STDOUT:
Results will be saved in /home/philip/projects/ltspice_examples_code_repo/Circuit-Completion-Using-GNNs/component_classification_with_link_prediction_head/evaluation/FEGIN/results/model_FEGIN_dataset_ltspice_examples
Command line input: python main.py --data ltspice_examples --representation component_pin_net --model FEGIN --layers 6 --hiddens 64 --batch_size 64 --lr 0.001 --emb_size 512 --epochs 100 --save_appendix component_pin_net_L6_H64_BS64_LR0.001_E512 --no_val
 is saved.
-----
ltspice_examples - FEGIN
Using 6 layers, 64 hidden units, h = 2
Loading component_pin_net representation dataset
ENTERED
Training FEGIN on component_pin_net representation
Train: 3558, Test: 846
##################ITERATION #0 ****************************************
 epoch: 0, train_loss: 1.2075, test_loss: 1.0794, test_f1: 0.3714
 epoch: 1, train_loss: 1.0244, test_loss: 0.9887, test_f1: 0.5167
 epoch: 2, train_loss: 0.9955, test_loss: 0.9743, test_f1: 0.5108
 epoch: 3, train_loss: 0.9655, test_loss: 0.9681, test_f1: 0.5031
 epoch: 4, train_loss: 0.9393, test_loss: 0.9574, test_f1: 0.4843
 epoch: 5, train_loss: 0.9246, test_loss: 0.9234, test_f1: 0.5189
 epoch: 6, train_loss: 0.9010, test_loss: 0.9298, test_f1: 0.5208
 epoch: 7, train_loss: 0.8822, test_loss: 0.9093, test_f1: 0.5186
 epoch: 8, train_loss: 0.8712, test_loss: 0.9084, test_f1: 0.5194
 epoch: 9, train_loss: 0.8502, test_loss: 0.8780, test_f1: 0.5527
 epoch: 10, train_loss: 0.8404, test_loss: 0.8793, test_f1: 0.5841
 epoch: 11, train_loss: 0.8298, test_loss: 0.8100, test_f1: 0.5629
 epoch: 12, train_loss: 0.8095, test_loss: 0.8518, test_f1: 0.5978
 epoch: 13, train_loss: 0.7927, test_loss: 0.9383, test_f1: 0.5851
 epoch: 14, train_loss: 0.7738, test_loss: 0.8784, test_f1: 0.5636
 epoch: 15, train_loss: 0.7724, test_loss: 0.9142, test_f1: 0.5856
 epoch: 16, train_loss: 0.7498, test_loss: 0.7860, test_f1: 0.5744
 epoch: 17, train_loss: 0.7371, test_loss: 0.8268, test_f1: 0.6292
 epoch: 18, train_loss: 0.7344, test_loss: 0.7693, test_f1: 0.5965
 epoch: 19, train_loss: 0.7111, test_loss: 0.9071, test_f1: 0.6088
 epoch: 20, train_loss: 0.7001, test_loss: 0.7223, test_f1: 0.6277
 epoch: 21, train_loss: 0.6842, test_loss: 0.7895, test_f1: 0.5940
 epoch: 22, train_loss: 0.6769, test_loss: 0.8207, test_f1: 0.5969
 epoch: 23, train_loss: 0.6711, test_loss: 1.1115, test_f1: 0.4974
 epoch: 24, train_loss: 0.6604, test_loss: 0.8558, test_f1: 0.6012
 epoch: 25, train_loss: 0.6390, test_loss: 0.7560, test_f1: 0.6244
 epoch: 26, train_loss: 0.6360, test_loss: 0.7541, test_f1: 0.6472
 epoch: 27, train_loss: 0.6361, test_loss: 0.7088, test_f1: 0.6701
 epoch: 28, train_loss: 0.6120, test_loss: 0.8475, test_f1: 0.6532
 epoch: 29, train_loss: 0.6256, test_loss: 0.7722, test_f1: 0.6433
 epoch: 30, train_loss: 0.5871, test_loss: 0.7232, test_f1: 0.6879
 epoch: 31, train_loss: 0.5803, test_loss: 0.7342, test_f1: 0.6731
 epoch: 32, train_loss: 0.5747, test_loss: 0.8721, test_f1: 0.6255
 epoch: 33, train_loss: 0.5707, test_loss: 0.7475, test_f1: 0.6588
 epoch: 34, train_loss: 0.5674, test_loss: 0.7443, test_f1: 0.6789
 epoch: 35, train_loss: 0.5641, test_loss: 0.7415, test_f1: 0.6662
 epoch: 36, train_loss: 0.5642, test_loss: 0.9281, test_f1: 0.6487
 epoch: 37, train_loss: 0.5522, test_loss: 0.8749, test_f1: 0.6403
 epoch: 38, train_loss: 0.5395, test_loss: 0.8820, test_f1: 0.6548
 epoch: 39, train_loss: 0.5146, test_loss: 0.8914, test_f1: 0.6594
 epoch: 40, train_loss: 0.5130, test_loss: 0.8808, test_f1: 0.6559
 epoch: 41, train_loss: 0.5385, test_loss: 0.9641, test_f1: 0.6367
 epoch: 42, train_loss: 0.5380, test_loss: 0.8701, test_f1: 0.6247
 epoch: 43, train_loss: 0.5007, test_loss: 0.9603, test_f1: 0.6490
 epoch: 44, train_loss: 0.5102, test_loss: 0.9615, test_f1: 0.6621
 epoch: 45, train_loss: 0.5170, test_loss: 0.7782, test_f1: 0.6609
 epoch: 46, train_loss: 0.5009, test_loss: 0.9567, test_f1: 0.6365
 epoch: 47, train_loss: 0.5145, test_loss: 0.7772, test_f1: 0.6551
 epoch: 48, train_loss: 0.4883, test_loss: 0.9199, test_f1: 0.6627
 epoch: 49, train_loss: 0.4929, test_loss: 0.9525, test_f1: 0.6463
 epoch: 50, train_loss: 0.4814, test_loss: 0.8404, test_f1: 0.6732
 epoch: 51, train_loss: 0.4423, test_loss: 0.9418, test_f1: 0.6751
 epoch: 52, train_loss: 0.4265, test_loss: 1.0074, test_f1: 0.6531
 epoch: 53, train_loss: 0.3978, test_loss: 1.0051, test_f1: 0.6802
 epoch: 54, train_loss: 0.4023, test_loss: 1.0325, test_f1: 0.6689
 epoch: 55, train_loss: 0.4049, test_loss: 0.9474, test_f1: 0.6467
 epoch: 56, train_loss: 0.3729, test_loss: 1.0764, test_f1: 0.6448
 epoch: 57, train_loss: 0.3851, test_loss: 1.0544, test_f1: 0.6564
 epoch: 58, train_loss: 0.3918, test_loss: 0.9007, test_f1: 0.6655
 epoch: 59, train_loss: 0.3753, test_loss: 1.0704, test_f1: 0.6725
 epoch: 60, train_loss: 0.3718, test_loss: 1.0798, test_f1: 0.6467
 epoch: 61, train_loss: 0.3713, test_loss: 0.9989, test_f1: 0.6587
 epoch: 62, train_loss: 0.3577, test_loss: 1.1621, test_f1: 0.6524
 epoch: 63, train_loss: 0.3650, test_loss: 1.1678, test_f1: 0.6619
 epoch: 64, train_loss: 0.3595, test_loss: 1.0501, test_f1: 0.6745
 epoch: 65, train_loss: 0.3448, test_loss: 1.0902, test_f1: 0.6806
 epoch: 66, train_loss: 0.3572, test_loss: 1.1849, test_f1: 0.6787
 epoch: 67, train_loss: 0.3356, test_loss: 1.1407, test_f1: 0.6495
 epoch: 68, train_loss: 0.3422, test_loss: 1.1397, test_f1: 0.6903
 epoch: 69, train_loss: 0.3469, test_loss: 1.0667, test_f1: 0.6590
 epoch: 70, train_loss: 0.3370, test_loss: 1.0826, test_f1: 0.6688
 epoch: 71, train_loss: 0.3346, test_loss: 1.1289, test_f1: 0.6633
 epoch: 72, train_loss: 0.3424, test_loss: 1.1281, test_f1: 0.6560
 epoch: 73, train_loss: 0.3322, test_loss: 1.1619, test_f1: 0.6756
 epoch: 74, train_loss: 0.3095, test_loss: 1.2526, test_f1: 0.6789
 epoch: 75, train_loss: 0.3187, test_loss: 1.3249, test_f1: 0.6509
 epoch: 76, train_loss: 0.3140, test_loss: 1.1576, test_f1: 0.6718
 epoch: 77, train_loss: 0.3225, test_loss: 1.2802, test_f1: 0.6686
 epoch: 78, train_loss: 0.3154, test_loss: 1.1369, test_f1: 0.6378
 epoch: 79, train_loss: 0.3065, test_loss: 1.3358, test_f1: 0.6400
 epoch: 80, train_loss: 0.3134, test_loss: 1.2895, test_f1: 0.6517
 epoch: 81, train_loss: 0.2921, test_loss: 1.3846, test_f1: 0.6713
 epoch: 82, train_loss: 0.2803, test_loss: 1.4438, test_f1: 0.6500
 epoch: 83, train_loss: 0.2841, test_loss: 1.3797, test_f1: 0.6569
 epoch: 84, train_loss: 0.3023, test_loss: 1.2637, test_f1: 0.6698
 epoch: 85, train_loss: 0.3030, test_loss: 1.2023, test_f1: 0.6805
 epoch: 86, train_loss: 0.2904, test_loss: 1.3643, test_f1: 0.6551
 epoch: 87, train_loss: 0.2709, test_loss: 1.3042, test_f1: 0.6728
 epoch: 88, train_loss: 0.2690, test_loss: 1.2765, test_f1: 0.6713
 epoch: 89, train_loss: 0.2666, test_loss: 1.4511, test_f1: 0.6709
 epoch: 90, train_loss: 0.2750, test_loss: 1.3698, test_f1: 0.6846
 epoch: 91, train_loss: 0.2748, test_loss: 1.4470, test_f1: 0.6666
 epoch: 92, train_loss: 0.2726, test_loss: 1.4170, test_f1: 0.6713
 epoch: 93, train_loss: 0.2930, test_loss: 1.5716, test_f1: 0.6707
 epoch: 94, train_loss: 0.2854, test_loss: 1.4171, test_f1: 0.6514
 epoch: 95, train_loss: 0.2513, test_loss: 1.4327, test_f1: 0.6624
 epoch: 96, train_loss: 0.2530, test_loss: 1.4635, test_f1: 0.6816
 epoch: 97, train_loss: 0.2494, test_loss: 1.5457, test_f1: 0.6697
 epoch: 98, train_loss: 0.2550, test_loss: 1.5004, test_f1: 0.6713
 epoch: 99, train_loss: 0.2594, test_loss: 1.5375, test_f1: 0.6924
##################ITERATION #1 ****************************************
 epoch: 0, train_loss: 1.0955, test_loss: 1.1431, test_f1: 0.3472
 epoch: 1, train_loss: 0.9868, test_loss: 0.9601, test_f1: 0.5036
 epoch: 2, train_loss: 0.9370, test_loss: 0.8824, test_f1: 0.5728
 epoch: 3, train_loss: 0.9179, test_loss: 0.8918, test_f1: 0.5132
 epoch: 4, train_loss: 0.9089, test_loss: 0.9171, test_f1: 0.5260
 epoch: 5, train_loss: 0.8885, test_loss: 0.8515, test_f1: 0.5823
 epoch: 6, train_loss: 0.8623, test_loss: 0.8849, test_f1: 0.5654
 epoch: 7, train_loss: 0.8530, test_loss: 0.7973, test_f1: 0.5725
 epoch: 8, train_loss: 0.8224, test_loss: 0.9272, test_f1: 0.5600
 epoch: 9, train_loss: 0.8185, test_loss: 0.8171, test_f1: 0.5994
 epoch: 10, train_loss: 0.8004, test_loss: 0.8392, test_f1: 0.6049
 epoch: 11, train_loss: 0.7782, test_loss: 0.7849, test_f1: 0.6034
 epoch: 12, train_loss: 0.7599, test_loss: 0.8101, test_f1: 0.6269
 epoch: 13, train_loss: 0.7522, test_loss: 0.9392, test_f1: 0.6066
 epoch: 14, train_loss: 0.7353, test_loss: 0.8427, test_f1: 0.6353
 epoch: 15, train_loss: 0.7167, test_loss: 0.7858, test_f1: 0.6130
 epoch: 16, train_loss: 0.7132, test_loss: 0.8080, test_f1: 0.6610
 epoch: 17, train_loss: 0.7010, test_loss: 0.7522, test_f1: 0.6320
 epoch: 18, train_loss: 0.6825, test_loss: 0.8019, test_f1: 0.6223
 epoch: 19, train_loss: 0.6633, test_loss: 0.8024, test_f1: 0.6337
 epoch: 20, train_loss: 0.6665, test_loss: 0.8267, test_f1: 0.6470
 epoch: 21, train_loss: 0.6625, test_loss: 0.8208, test_f1: 0.6260
 epoch: 22, train_loss: 0.6440, test_loss: 0.6891, test_f1: 0.6913
 epoch: 23, train_loss: 0.6413, test_loss: 0.7251, test_f1: 0.6480
 epoch: 24, train_loss: 0.6151, test_loss: 0.7883, test_f1: 0.6434
 epoch: 25, train_loss: 0.6126, test_loss: 0.8009, test_f1: 0.6279
 epoch: 26, train_loss: 0.6081, test_loss: 0.8194, test_f1: 0.6583
 epoch: 27, train_loss: 0.5857, test_loss: 0.9063, test_f1: 0.6317
 epoch: 28, train_loss: 0.5869, test_loss: 0.8154, test_f1: 0.6333
 epoch: 29, train_loss: 0.5618, test_loss: 0.9294, test_f1: 0.6427
 epoch: 30, train_loss: 0.5751, test_loss: 0.7351, test_f1: 0.6629
 epoch: 31, train_loss: 0.5618, test_loss: 0.9376, test_f1: 0.6583
 epoch: 32, train_loss: 0.5644, test_loss: 0.8348, test_f1: 0.6375
 epoch: 33, train_loss: 0.5430, test_loss: 0.9061, test_f1: 0.6482
 epoch: 34, train_loss: 0.5456, test_loss: 0.8421, test_f1: 0.6331
 epoch: 35, train_loss: 0.5359, test_loss: 0.8690, test_f1: 0.6433
 epoch: 36, train_loss: 0.5416, test_loss: 0.8983, test_f1: 0.6262
 epoch: 37, train_loss: 0.5263, test_loss: 0.9073, test_f1: 0.6401
 epoch: 38, train_loss: 0.5145, test_loss: 0.7498, test_f1: 0.6722
 epoch: 39, train_loss: 0.5004, test_loss: 0.9556, test_f1: 0.6561
 epoch: 40, train_loss: 0.5022, test_loss: 0.8601, test_f1: 0.6573
 epoch: 41, train_loss: 0.4821, test_loss: 1.0146, test_f1: 0.6618
 epoch: 42, train_loss: 0.4996, test_loss: 0.8919, test_f1: 0.6587
 epoch: 43, train_loss: 0.4963, test_loss: 0.9621, test_f1: 0.6416
 epoch: 44, train_loss: 0.4891, test_loss: 1.0042, test_f1: 0.6479
 epoch: 45, train_loss: 0.4859, test_loss: 1.0041, test_f1: 0.6375
 epoch: 46, train_loss: 0.4724, test_loss: 0.8633, test_f1: 0.6677
 epoch: 47, train_loss: 0.4612, test_loss: 1.0165, test_f1: 0.6487
 epoch: 48, train_loss: 0.4567, test_loss: 1.1602, test_f1: 0.6555
 epoch: 49, train_loss: 0.4653, test_loss: 1.0365, test_f1: 0.6735
 epoch: 50, train_loss: 0.4556, test_loss: 0.8970, test_f1: 0.6823
 epoch: 51, train_loss: 0.4028, test_loss: 1.0724, test_f1: 0.6406
 epoch: 52, train_loss: 0.3911, test_loss: 1.1496, test_f1: 0.6422
 epoch: 53, train_loss: 0.3923, test_loss: 1.1246, test_f1: 0.6347
 epoch: 54, train_loss: 0.3784, test_loss: 1.0657, test_f1: 0.6768
 epoch: 55, train_loss: 0.3660, test_loss: 1.1120, test_f1: 0.6846
 epoch: 56, train_loss: 0.3601, test_loss: 1.1651, test_f1: 0.6557
 epoch: 57, train_loss: 0.3592, test_loss: 1.2163, test_f1: 0.6402
 epoch: 58, train_loss: 0.3542, test_loss: 1.1288, test_f1: 0.6892
 epoch: 59, train_loss: 0.3435, test_loss: 1.2454, test_f1: 0.6827
 epoch: 60, train_loss: 0.3402, test_loss: 1.3224, test_f1: 0.6495
 epoch: 61, train_loss: 0.3611, test_loss: 1.2146, test_f1: 0.6679
 epoch: 62, train_loss: 0.3515, test_loss: 1.1709, test_f1: 0.6772
 epoch: 63, train_loss: 0.3416, test_loss: 1.3094, test_f1: 0.6506
 epoch: 64, train_loss: 0.3584, test_loss: 1.2234, test_f1: 0.6682
 epoch: 65, train_loss: 0.3342, test_loss: 1.1629, test_f1: 0.6674
 epoch: 66, train_loss: 0.3233, test_loss: 1.4042, test_f1: 0.6520
 epoch: 67, train_loss: 0.3389, test_loss: 1.3411, test_f1: 0.6564
 epoch: 68, train_loss: 0.3058, test_loss: 1.3800, test_f1: 0.6669
 epoch: 69, train_loss: 0.3178, test_loss: 1.4316, test_f1: 0.6729
 epoch: 70, train_loss: 0.3344, test_loss: 1.4753, test_f1: 0.6626
 epoch: 71, train_loss: 0.3080, test_loss: 1.3747, test_f1: 0.6737
 epoch: 72, train_loss: 0.3032, test_loss: 1.4430, test_f1: 0.6737
 epoch: 73, train_loss: 0.3077, test_loss: 1.4596, test_f1: 0.6580
 epoch: 74, train_loss: 0.3090, test_loss: 1.2954, test_f1: 0.6839
 epoch: 75, train_loss: 0.2831, test_loss: 1.4720, test_f1: 0.6627
 epoch: 76, train_loss: 0.2884, test_loss: 1.5878, test_f1: 0.6308
 epoch: 77, train_loss: 0.3032, test_loss: 1.6004, test_f1: 0.6501
 epoch: 78, train_loss: 0.2842, test_loss: 1.4419, test_f1: 0.6547
 epoch: 79, train_loss: 0.2864, test_loss: 1.5639, test_f1: 0.6635
 epoch: 80, train_loss: 0.3064, test_loss: 1.4870, test_f1: 0.6665
 epoch: 81, train_loss: 0.2962, test_loss: 1.3965, test_f1: 0.6807
 epoch: 82, train_loss: 0.2837, test_loss: 1.5719, test_f1: 0.6600
 epoch: 83, train_loss: 0.2804, test_loss: 1.5503, test_f1: 0.6718
 epoch: 84, train_loss: 0.2849, test_loss: 1.6485, test_f1: 0.6649
 epoch: 85, train_loss: 0.2790, test_loss: 1.6173, test_f1: 0.6701
 epoch: 86, train_loss: 0.2836, test_loss: 1.5328, test_f1: 0.6781
 epoch: 87, train_loss: 0.2661, test_loss: 1.6099, test_f1: 0.6639
 epoch: 88, train_loss: 0.2668, test_loss: 1.5412, test_f1: 0.6624
 epoch: 89, train_loss: 0.2613, test_loss: 1.5609, test_f1: 0.6604
 epoch: 90, train_loss: 0.2509, test_loss: 1.7022, test_f1: 0.6785
 epoch: 91, train_loss: 0.2494, test_loss: 1.7250, test_f1: 0.6699
 epoch: 92, train_loss: 0.2752, test_loss: 1.7384, test_f1: 0.6539
 epoch: 93, train_loss: 0.2525, test_loss: 1.6040, test_f1: 0.6534
 epoch: 94, train_loss: 0.2585, test_loss: 1.5495, test_f1: 0.6618
 epoch: 95, train_loss: 0.2482, test_loss: 1.6534, test_f1: 0.6698
 epoch: 96, train_loss: 0.2467, test_loss: 1.7577, test_f1: 0.6675
 epoch: 97, train_loss: 0.2301, test_loss: 1.6314, test_f1: 0.6714
 epoch: 98, train_loss: 0.2412, test_loss: 1.6954, test_f1: 0.6486
 epoch: 99, train_loss: 0.2442, test_loss: 1.7443, test_f1: 0.6573
##################ITERATION #2 ****************************************
 epoch: 0, train_loss: 1.0940, test_loss: 1.8644, test_f1: 0.2142
 epoch: 1, train_loss: 0.9770, test_loss: 0.9877, test_f1: 0.5316
 epoch: 2, train_loss: 0.9325, test_loss: 0.9399, test_f1: 0.5558
 epoch: 3, train_loss: 0.9222, test_loss: 0.9760, test_f1: 0.5619
 epoch: 4, train_loss: 0.8894, test_loss: 0.9080, test_f1: 0.5518
 epoch: 5, train_loss: 0.8667, test_loss: 0.9424, test_f1: 0.5337
 epoch: 6, train_loss: 0.8384, test_loss: 0.8713, test_f1: 0.5874
 epoch: 7, train_loss: 0.8305, test_loss: 0.9237, test_f1: 0.5507
 epoch: 8, train_loss: 0.8012, test_loss: 0.8708, test_f1: 0.5908
 epoch: 9, train_loss: 0.7804, test_loss: 0.9127, test_f1: 0.6139
 epoch: 10, train_loss: 0.7870, test_loss: 0.8754, test_f1: 0.6029
 epoch: 11, train_loss: 0.7640, test_loss: 0.8484, test_f1: 0.6266
 epoch: 12, train_loss: 0.7449, test_loss: 0.8577, test_f1: 0.6098
 epoch: 13, train_loss: 0.7220, test_loss: 0.8048, test_f1: 0.6069
 epoch: 14, train_loss: 0.7211, test_loss: 0.8592, test_f1: 0.6349
 epoch: 15, train_loss: 0.6907, test_loss: 0.9054, test_f1: 0.6137
 epoch: 16, train_loss: 0.6920, test_loss: 0.7761, test_f1: 0.6448
 epoch: 17, train_loss: 0.6832, test_loss: 0.7862, test_f1: 0.6402
 epoch: 18, train_loss: 0.6715, test_loss: 0.8577, test_f1: 0.6439
 epoch: 19, train_loss: 0.6638, test_loss: 0.7932, test_f1: 0.6686
 epoch: 20, train_loss: 0.6328, test_loss: 0.8172, test_f1: 0.6469
 epoch: 21, train_loss: 0.6365, test_loss: 0.8820, test_f1: 0.5872
 epoch: 22, train_loss: 0.6529, test_loss: 0.7481, test_f1: 0.6440
 epoch: 23, train_loss: 0.6423, test_loss: 0.7418, test_f1: 0.6508
 epoch: 24, train_loss: 0.6313, test_loss: 0.7615, test_f1: 0.6382
 epoch: 25, train_loss: 0.6048, test_loss: 0.8031, test_f1: 0.6426
 epoch: 26, train_loss: 0.6066, test_loss: 0.8629, test_f1: 0.6168
 epoch: 27, train_loss: 0.5944, test_loss: 0.9574, test_f1: 0.6464
 epoch: 28, train_loss: 0.5977, test_loss: 0.8396, test_f1: 0.6348
 epoch: 29, train_loss: 0.5818, test_loss: 0.8356, test_f1: 0.6404
 epoch: 30, train_loss: 0.5525, test_loss: 0.8018, test_f1: 0.6235
 epoch: 31, train_loss: 0.5775, test_loss: 0.8332, test_f1: 0.6629
 epoch: 32, train_loss: 0.5703, test_loss: 0.8617, test_f1: 0.6569
 epoch: 33, train_loss: 0.5461, test_loss: 0.9845, test_f1: 0.6542
 epoch: 34, train_loss: 0.5502, test_loss: 0.9719, test_f1: 0.6405
 epoch: 35, train_loss: 0.5449, test_loss: 0.9619, test_f1: 0.6470
 epoch: 36, train_loss: 0.5382, test_loss: 0.8289, test_f1: 0.6716
 epoch: 37, train_loss: 0.5267, test_loss: 0.9458, test_f1: 0.6461
 epoch: 38, train_loss: 0.5143, test_loss: 0.8313, test_f1: 0.6612
 epoch: 39, train_loss: 0.4885, test_loss: 0.8734, test_f1: 0.6644
 epoch: 40, train_loss: 0.5237, test_loss: 0.8896, test_f1: 0.6607
 epoch: 41, train_loss: 0.5056, test_loss: 0.8961, test_f1: 0.6448
 epoch: 42, train_loss: 0.4929, test_loss: 0.9552, test_f1: 0.6329
 epoch: 43, train_loss: 0.4878, test_loss: 0.9248, test_f1: 0.6570
 epoch: 44, train_loss: 0.4795, test_loss: 0.9487, test_f1: 0.6598
 epoch: 45, train_loss: 0.4706, test_loss: 0.8636, test_f1: 0.6785
 epoch: 46, train_loss: 0.4784, test_loss: 0.8870, test_f1: 0.6832
 epoch: 47, train_loss: 0.4594, test_loss: 0.9579, test_f1: 0.6683
 epoch: 48, train_loss: 0.4619, test_loss: 0.9587, test_f1: 0.6658
 epoch: 49, train_loss: 0.4495, test_loss: 1.0641, test_f1: 0.6742
 epoch: 50, train_loss: 0.4548, test_loss: 1.0876, test_f1: 0.6813
 epoch: 51, train_loss: 0.4213, test_loss: 1.1430, test_f1: 0.6735
 epoch: 52, train_loss: 0.3951, test_loss: 1.1076, test_f1: 0.7008
 epoch: 53, train_loss: 0.3814, test_loss: 1.1411, test_f1: 0.6911
 epoch: 54, train_loss: 0.3616, test_loss: 1.2770, test_f1: 0.6692
 epoch: 55, train_loss: 0.3716, test_loss: 1.0971, test_f1: 0.6900
 epoch: 56, train_loss: 0.3789, test_loss: 1.2527, test_f1: 0.6580
 epoch: 57, train_loss: 0.3724, test_loss: 1.2193, test_f1: 0.6734
 epoch: 58, train_loss: 0.3598, test_loss: 1.2053, test_f1: 0.6765
 epoch: 59, train_loss: 0.3627, test_loss: 1.2354, test_f1: 0.6631
 epoch: 60, train_loss: 0.3511, test_loss: 1.2304, test_f1: 0.6674
 epoch: 61, train_loss: 0.3445, test_loss: 1.3230, test_f1: 0.6518
 epoch: 62, train_loss: 0.3349, test_loss: 1.2964, test_f1: 0.6666
 epoch: 63, train_loss: 0.3533, test_loss: 1.2516, test_f1: 0.6635
 epoch: 64, train_loss: 0.3403, test_loss: 1.3284, test_f1: 0.6735
 epoch: 65, train_loss: 0.3427, test_loss: 1.2720, test_f1: 0.6748
 epoch: 66, train_loss: 0.3182, test_loss: 1.3551, test_f1: 0.6793
 epoch: 67, train_loss: 0.3359, test_loss: 1.3602, test_f1: 0.6763
 epoch: 68, train_loss: 0.3138, test_loss: 1.4502, test_f1: 0.6691
 epoch: 69, train_loss: 0.3358, test_loss: 1.3068, test_f1: 0.6518
 epoch: 70, train_loss: 0.3161, test_loss: 1.3889, test_f1: 0.6516
 epoch: 71, train_loss: 0.3068, test_loss: 1.3940, test_f1: 0.6979
 epoch: 72, train_loss: 0.3131, test_loss: 1.3095, test_f1: 0.6745
 epoch: 73, train_loss: 0.3279, test_loss: 1.3539, test_f1: 0.6660
 epoch: 74, train_loss: 0.3046, test_loss: 1.3056, test_f1: 0.6969
 epoch: 75, train_loss: 0.2921, test_loss: 1.4569, test_f1: 0.6683
 epoch: 76, train_loss: 0.3125, test_loss: 1.3084, test_f1: 0.6604
 epoch: 77, train_loss: 0.3052, test_loss: 1.5063, test_f1: 0.6489
 epoch: 78, train_loss: 0.2893, test_loss: 1.6138, test_f1: 0.6537
 epoch: 79, train_loss: 0.2928, test_loss: 1.4960, test_f1: 0.6528
 epoch: 80, train_loss: 0.2837, test_loss: 1.4717, test_f1: 0.6591
 epoch: 81, train_loss: 0.3037, test_loss: 1.5117, test_f1: 0.6590
 epoch: 82, train_loss: 0.2898, test_loss: 1.5994, test_f1: 0.6395
 epoch: 83, train_loss: 0.2665, test_loss: 1.4306, test_f1: 0.6691
 epoch: 84, train_loss: 0.2697, test_loss: 1.4755, test_f1: 0.6646
 epoch: 85, train_loss: 0.2765, test_loss: 1.7444, test_f1: 0.6459
 epoch: 86, train_loss: 0.2795, test_loss: 1.8108, test_f1: 0.6436
 epoch: 87, train_loss: 0.2781, test_loss: 1.6929, test_f1: 0.6669
 epoch: 88, train_loss: 0.2803, test_loss: 1.6707, test_f1: 0.6688
 epoch: 89, train_loss: 0.2725, test_loss: 1.6796, test_f1: 0.6568
 epoch: 90, train_loss: 0.2513, test_loss: 1.6418, test_f1: 0.6830
 epoch: 91, train_loss: 0.2450, test_loss: 1.6641, test_f1: 0.6682
 epoch: 92, train_loss: 0.2544, test_loss: 1.6104, test_f1: 0.6551
 epoch: 93, train_loss: 0.2737, test_loss: 1.6210, test_f1: 0.6793
 epoch: 94, train_loss: 0.2528, test_loss: 1.7424, test_f1: 0.6791
 epoch: 95, train_loss: 0.2584, test_loss: 1.7280, test_f1: 0.6683
 epoch: 96, train_loss: 0.2557, test_loss: 1.7554, test_f1: 0.6586
 epoch: 97, train_loss: 0.2325, test_loss: 1.6595, test_f1: 0.6735
 epoch: 98, train_loss: 0.2330, test_loss: 1.6647, test_f1: 0.6732
 epoch: 99, train_loss: 0.2568, test_loss: 1.8901, test_f1: 0.6458
##################ITERATION #3 ****************************************
 epoch: 0, train_loss: 1.1744, test_loss: 1.0423, test_f1: 0.4365
 epoch: 1, train_loss: 0.9968, test_loss: 0.9574, test_f1: 0.5438
 epoch: 2, train_loss: 0.9585, test_loss: 0.9768, test_f1: 0.5366
 epoch: 3, train_loss: 0.9260, test_loss: 0.9290, test_f1: 0.5261
 epoch: 4, train_loss: 0.9116, test_loss: 0.9159, test_f1: 0.5478
 epoch: 5, train_loss: 0.8828, test_loss: 0.8792, test_f1: 0.5774
 epoch: 6, train_loss: 0.8694, test_loss: 0.8675, test_f1: 0.5991
 epoch: 7, train_loss: 0.8427, test_loss: 0.8635, test_f1: 0.5944
 epoch: 8, train_loss: 0.8182, test_loss: 0.8711, test_f1: 0.5761
 epoch: 9, train_loss: 0.8070, test_loss: 0.8448, test_f1: 0.6170
 epoch: 10, train_loss: 0.7940, test_loss: 0.8233, test_f1: 0.6423
 epoch: 11, train_loss: 0.7829, test_loss: 0.8051, test_f1: 0.6123
 epoch: 12, train_loss: 0.7625, test_loss: 0.8812, test_f1: 0.5952
 epoch: 13, train_loss: 0.7518, test_loss: 0.7919, test_f1: 0.6103
 epoch: 14, train_loss: 0.7448, test_loss: 0.8081, test_f1: 0.6353
 epoch: 15, train_loss: 0.7092, test_loss: 0.7594, test_f1: 0.6542
 epoch: 16, train_loss: 0.7066, test_loss: 0.7296, test_f1: 0.6472
 epoch: 17, train_loss: 0.7081, test_loss: 0.7254, test_f1: 0.6734
 epoch: 18, train_loss: 0.6850, test_loss: 0.7354, test_f1: 0.6596
 epoch: 19, train_loss: 0.6805, test_loss: 0.7298, test_f1: 0.6457
 epoch: 20, train_loss: 0.6646, test_loss: 0.7876, test_f1: 0.6445
 epoch: 21, train_loss: 0.6567, test_loss: 0.8903, test_f1: 0.6118
 epoch: 22, train_loss: 0.6423, test_loss: 0.7787, test_f1: 0.6697
 epoch: 23, train_loss: 0.6438, test_loss: 0.8133, test_f1: 0.6073
 epoch: 24, train_loss: 0.6366, test_loss: 0.8077, test_f1: 0.6713
 epoch: 25, train_loss: 0.6073, test_loss: 0.7849, test_f1: 0.6562
 epoch: 26, train_loss: 0.5872, test_loss: 0.7579, test_f1: 0.6773
 epoch: 27, train_loss: 0.5925, test_loss: 0.7143, test_f1: 0.6793
 epoch: 28, train_loss: 0.6028, test_loss: 0.7627, test_f1: 0.6640
 epoch: 29, train_loss: 0.5742, test_loss: 0.8264, test_f1: 0.6501
 epoch: 30, train_loss: 0.5671, test_loss: 0.8018, test_f1: 0.6525
 epoch: 31, train_loss: 0.5653, test_loss: 0.7253, test_f1: 0.7265
 epoch: 32, train_loss: 0.5565, test_loss: 0.7289, test_f1: 0.6714
 epoch: 33, train_loss: 0.5377, test_loss: 0.7769, test_f1: 0.6950
 epoch: 34, train_loss: 0.5293, test_loss: 0.8272, test_f1: 0.6887
 epoch: 35, train_loss: 0.5245, test_loss: 0.8877, test_f1: 0.6439
 epoch: 36, train_loss: 0.5287, test_loss: 0.8104, test_f1: 0.6866
 epoch: 37, train_loss: 0.5310, test_loss: 0.8383, test_f1: 0.6921
 epoch: 38, train_loss: 0.4939, test_loss: 0.9660, test_f1: 0.6175
 epoch: 39, train_loss: 0.5007, test_loss: 0.8746, test_f1: 0.6713
 epoch: 40, train_loss: 0.4821, test_loss: 0.8162, test_f1: 0.6785
 epoch: 41, train_loss: 0.4902, test_loss: 0.9392, test_f1: 0.6412
 epoch: 42, train_loss: 0.4789, test_loss: 0.8572, test_f1: 0.6731
 epoch: 43, train_loss: 0.4713, test_loss: 0.9114, test_f1: 0.6476
 epoch: 44, train_loss: 0.4663, test_loss: 0.9950, test_f1: 0.6524
 epoch: 45, train_loss: 0.4478, test_loss: 0.9273, test_f1: 0.6667
 epoch: 46, train_loss: 0.4331, test_loss: 0.9152, test_f1: 0.6644
 epoch: 47, train_loss: 0.4542, test_loss: 0.9138, test_f1: 0.6944
 epoch: 48, train_loss: 0.4775, test_loss: 0.9766, test_f1: 0.6893
 epoch: 49, train_loss: 0.4252, test_loss: 0.8649, test_f1: 0.6742
 epoch: 50, train_loss: 0.4212, test_loss: 1.0198, test_f1: 0.6628
 epoch: 51, train_loss: 0.3896, test_loss: 1.0723, test_f1: 0.6667
 epoch: 52, train_loss: 0.3706, test_loss: 1.0224, test_f1: 0.6629
 epoch: 53, train_loss: 0.3657, test_loss: 1.1510, test_f1: 0.6633
 epoch: 54, train_loss: 0.3468, test_loss: 1.2124, test_f1: 0.6521
 epoch: 55, train_loss: 0.3425, test_loss: 1.1973, test_f1: 0.6570
 epoch: 56, train_loss: 0.3429, test_loss: 1.0982, test_f1: 0.6732
 epoch: 57, train_loss: 0.3211, test_loss: 1.1993, test_f1: 0.6721
 epoch: 58, train_loss: 0.3438, test_loss: 1.2073, test_f1: 0.6595
 epoch: 59, train_loss: 0.3217, test_loss: 1.1582, test_f1: 0.6487
 epoch: 60, train_loss: 0.3196, test_loss: 1.1163, test_f1: 0.6540
 epoch: 61, train_loss: 0.3323, test_loss: 1.2920, test_f1: 0.6558
 epoch: 62, train_loss: 0.3231, test_loss: 1.1699, test_f1: 0.6547
 epoch: 63, train_loss: 0.3053, test_loss: 1.3049, test_f1: 0.6638
 epoch: 64, train_loss: 0.3135, test_loss: 1.2206, test_f1: 0.6839
 epoch: 65, train_loss: 0.3110, test_loss: 1.2792, test_f1: 0.6500
 epoch: 66, train_loss: 0.3204, test_loss: 1.2390, test_f1: 0.6689
 epoch: 67, train_loss: 0.3069, test_loss: 1.3239, test_f1: 0.6662
 epoch: 68, train_loss: 0.2924, test_loss: 1.2544, test_f1: 0.6643
 epoch: 69, train_loss: 0.2863, test_loss: 1.3386, test_f1: 0.6556
 epoch: 70, train_loss: 0.2968, test_loss: 1.3408, test_f1: 0.6504
 epoch: 71, train_loss: 0.2964, test_loss: 1.3356, test_f1: 0.6407
 epoch: 72, train_loss: 0.3098, test_loss: 1.4613, test_f1: 0.6448
 epoch: 73, train_loss: 0.2946, test_loss: 1.4067, test_f1: 0.6468
 epoch: 74, train_loss: 0.2792, test_loss: 1.3830, test_f1: 0.6577
 epoch: 75, train_loss: 0.2622, test_loss: 1.4385, test_f1: 0.6485
 epoch: 76, train_loss: 0.2819, test_loss: 1.4444, test_f1: 0.6480
 epoch: 77, train_loss: 0.2710, test_loss: 1.4864, test_f1: 0.6470
 epoch: 78, train_loss: 0.2658, test_loss: 1.4824, test_f1: 0.6847
 epoch: 79, train_loss: 0.2782, test_loss: 1.4639, test_f1: 0.6524
 epoch: 80, train_loss: 0.2534, test_loss: 1.4774, test_f1: 0.6531
 epoch: 81, train_loss: 0.2491, test_loss: 1.3773, test_f1: 0.6578
 epoch: 82, train_loss: 0.2656, test_loss: 1.3700, test_f1: 0.6734
 epoch: 83, train_loss: 0.2460, test_loss: 1.5440, test_f1: 0.6556
 epoch: 84, train_loss: 0.2368, test_loss: 1.5847, test_f1: 0.6466
 epoch: 85, train_loss: 0.2315, test_loss: 1.6206, test_f1: 0.6468
 epoch: 86, train_loss: 0.2539, test_loss: 1.6841, test_f1: 0.6405
 epoch: 87, train_loss: 0.2419, test_loss: 1.5094, test_f1: 0.6550
 epoch: 88, train_loss: 0.2358, test_loss: 1.5619, test_f1: 0.6336
 epoch: 89, train_loss: 0.2432, test_loss: 1.6110, test_f1: 0.6444
 epoch: 90, train_loss: 0.2374, test_loss: 1.6964, test_f1: 0.6356
 epoch: 91, train_loss: 0.2445, test_loss: 1.6761, test_f1: 0.6354
 epoch: 92, train_loss: 0.2502, test_loss: 1.6720, test_f1: 0.6380
 epoch: 93, train_loss: 0.2349, test_loss: 1.6472, test_f1: 0.6528
 epoch: 94, train_loss: 0.2259, test_loss: 1.6719, test_f1: 0.6369
 epoch: 95, train_loss: 0.2306, test_loss: 1.7122, test_f1: 0.6569
 epoch: 96, train_loss: 0.2337, test_loss: 1.7101, test_f1: 0.6418
 epoch: 97, train_loss: 0.2170, test_loss: 1.6985, test_f1: 0.6482
 epoch: 98, train_loss: 0.2000, test_loss: 1.9064, test_f1: 0.6423
 epoch: 99, train_loss: 0.2260, test_loss: 1.7251, test_f1: 0.6630
##################ITERATION #4 ****************************************
 epoch: 0, train_loss: 1.2330, test_loss: 1.0941, test_f1: 0.4413
 epoch: 1, train_loss: 1.0143, test_loss: 0.9561, test_f1: 0.5099
 epoch: 2, train_loss: 0.9637, test_loss: 0.9172, test_f1: 0.5390
 epoch: 3, train_loss: 0.9337, test_loss: 0.9405, test_f1: 0.5487
 epoch: 4, train_loss: 0.9087, test_loss: 0.8294, test_f1: 0.5960
 epoch: 5, train_loss: 0.8818, test_loss: 0.8499, test_f1: 0.5756
 epoch: 6, train_loss: 0.8552, test_loss: 0.7875, test_f1: 0.6037
 epoch: 7, train_loss: 0.8309, test_loss: 0.7721, test_f1: 0.6061
 epoch: 8, train_loss: 0.8046, test_loss: 0.7940, test_f1: 0.6242
 epoch: 9, train_loss: 0.7881, test_loss: 0.7733, test_f1: 0.6119
 epoch: 10, train_loss: 0.7791, test_loss: 0.7297, test_f1: 0.6329
 epoch: 11, train_loss: 0.7632, test_loss: 0.7529, test_f1: 0.6448
 epoch: 12, train_loss: 0.7349, test_loss: 0.7245, test_f1: 0.6813
 epoch: 13, train_loss: 0.7330, test_loss: 0.7824, test_f1: 0.6266
 epoch: 14, train_loss: 0.7179, test_loss: 0.7526, test_f1: 0.6513
 epoch: 15, train_loss: 0.7035, test_loss: 0.7564, test_f1: 0.6506
 epoch: 16, train_loss: 0.6950, test_loss: 0.7867, test_f1: 0.6729
 epoch: 17, train_loss: 0.6800, test_loss: 0.8527, test_f1: 0.6168
 epoch: 18, train_loss: 0.6802, test_loss: 0.7739, test_f1: 0.6576
 epoch: 19, train_loss: 0.6644, test_loss: 0.7263, test_f1: 0.6469
 epoch: 20, train_loss: 0.6510, test_loss: 0.7234, test_f1: 0.6519
 epoch: 21, train_loss: 0.6449, test_loss: 0.7371, test_f1: 0.6808
 epoch: 22, train_loss: 0.6458, test_loss: 0.7487, test_f1: 0.6900
 epoch: 23, train_loss: 0.6162, test_loss: 0.7464, test_f1: 0.6633
 epoch: 24, train_loss: 0.6015, test_loss: 0.7345, test_f1: 0.6647
 epoch: 25, train_loss: 0.6063, test_loss: 0.7286, test_f1: 0.6776
 epoch: 26, train_loss: 0.6129, test_loss: 0.7713, test_f1: 0.6924
 epoch: 27, train_loss: 0.5925, test_loss: 0.8096, test_f1: 0.6520
 epoch: 28, train_loss: 0.6054, test_loss: 0.7672, test_f1: 0.6723
 epoch: 29, train_loss: 0.5854, test_loss: 0.7286, test_f1: 0.7058
 epoch: 30, train_loss: 0.5899, test_loss: 0.7329, test_f1: 0.6947
 epoch: 31, train_loss: 0.6012, test_loss: 0.7329, test_f1: 0.6879
 epoch: 32, train_loss: 0.5695, test_loss: 0.8321, test_f1: 0.6518
 epoch: 33, train_loss: 0.5618, test_loss: 0.7205, test_f1: 0.6999
 epoch: 34, train_loss: 0.5313, test_loss: 0.8687, test_f1: 0.6628
 epoch: 35, train_loss: 0.5409, test_loss: 0.8101, test_f1: 0.6607
 epoch: 36, train_loss: 0.5230, test_loss: 0.9460, test_f1: 0.6461
 epoch: 37, train_loss: 0.5106, test_loss: 0.9001, test_f1: 0.6604
 epoch: 38, train_loss: 0.5098, test_loss: 0.8215, test_f1: 0.7029
 epoch: 39, train_loss: 0.5170, test_loss: 0.8954, test_f1: 0.6677
 epoch: 40, train_loss: 0.5004, test_loss: 0.7320, test_f1: 0.6862
 epoch: 41, train_loss: 0.5121, test_loss: 0.7928, test_f1: 0.6724
 epoch: 42, train_loss: 0.5049, test_loss: 0.8510, test_f1: 0.6674
 epoch: 43, train_loss: 0.4939, test_loss: 0.8459, test_f1: 0.6706
 epoch: 44, train_loss: 0.4929, test_loss: 0.8937, test_f1: 0.6881
 epoch: 45, train_loss: 0.4805, test_loss: 0.8221, test_f1: 0.7009
 epoch: 46, train_loss: 0.4809, test_loss: 0.9100, test_f1: 0.6937
 epoch: 47, train_loss: 0.4801, test_loss: 0.8853, test_f1: 0.7038
 epoch: 48, train_loss: 0.4636, test_loss: 0.8099, test_f1: 0.6835
 epoch: 49, train_loss: 0.4555, test_loss: 0.8209, test_f1: 0.6961
 epoch: 50, train_loss: 0.4493, test_loss: 0.8697, test_f1: 0.6975
 epoch: 51, train_loss: 0.4258, test_loss: 0.9122, test_f1: 0.6804
 epoch: 52, train_loss: 0.4019, test_loss: 0.9082, test_f1: 0.6719
 epoch: 53, train_loss: 0.3754, test_loss: 0.9006, test_f1: 0.7035
 epoch: 54, train_loss: 0.3803, test_loss: 0.9234, test_f1: 0.6961
 epoch: 55, train_loss: 0.3592, test_loss: 0.9860, test_f1: 0.6848
 epoch: 56, train_loss: 0.3703, test_loss: 0.9799, test_f1: 0.6893
 epoch: 57, train_loss: 0.3555, test_loss: 0.9866, test_f1: 0.6845
 epoch: 58, train_loss: 0.3665, test_loss: 1.0240, test_f1: 0.6848
 epoch: 59, train_loss: 0.3307, test_loss: 0.9799, test_f1: 0.6968
 epoch: 60, train_loss: 0.3570, test_loss: 0.9867, test_f1: 0.6718
 epoch: 61, train_loss: 0.3475, test_loss: 1.0519, test_f1: 0.6742
 epoch: 62, train_loss: 0.3409, test_loss: 1.0703, test_f1: 0.6906
 epoch: 63, train_loss: 0.3376, test_loss: 1.0811, test_f1: 0.6750
 epoch: 64, train_loss: 0.3485, test_loss: 1.1055, test_f1: 0.6801
 epoch: 65, train_loss: 0.3262, test_loss: 1.0950, test_f1: 0.6895
 epoch: 66, train_loss: 0.3282, test_loss: 1.1272, test_f1: 0.6751
 epoch: 67, train_loss: 0.3222, test_loss: 1.1979, test_f1: 0.6764
 epoch: 68, train_loss: 0.3205, test_loss: 1.2349, test_f1: 0.6659
 epoch: 69, train_loss: 0.3155, test_loss: 1.1214, test_f1: 0.6805
 epoch: 70, train_loss: 0.3162, test_loss: 1.1953, test_f1: 0.6788
 epoch: 71, train_loss: 0.3183, test_loss: 1.1566, test_f1: 0.6839
 epoch: 72, train_loss: 0.3073, test_loss: 1.1029, test_f1: 0.6841
 epoch: 73, train_loss: 0.3093, test_loss: 1.1732, test_f1: 0.6831
 epoch: 74, train_loss: 0.3109, test_loss: 1.1355, test_f1: 0.6806
 epoch: 75, train_loss: 0.2961, test_loss: 1.2478, test_f1: 0.6832
 epoch: 76, train_loss: 0.2921, test_loss: 1.0166, test_f1: 0.7112
 epoch: 77, train_loss: 0.2981, test_loss: 1.1596, test_f1: 0.6956
 epoch: 78, train_loss: 0.2898, test_loss: 1.3348, test_f1: 0.6683
 epoch: 79, train_loss: 0.2967, test_loss: 1.2664, test_f1: 0.6639
 epoch: 80, train_loss: 0.2943, test_loss: 1.4227, test_f1: 0.6606
 epoch: 81, train_loss: 0.3125, test_loss: 1.2365, test_f1: 0.6669
 epoch: 82, train_loss: 0.2754, test_loss: 1.3410, test_f1: 0.6738
 epoch: 83, train_loss: 0.2789, test_loss: 1.2404, test_f1: 0.6830
 epoch: 84, train_loss: 0.2759, test_loss: 1.3759, test_f1: 0.6839
 epoch: 85, train_loss: 0.2714, test_loss: 1.2850, test_f1: 0.6748
 epoch: 86, train_loss: 0.2749, test_loss: 1.2719, test_f1: 0.6690
 epoch: 87, train_loss: 0.2723, test_loss: 1.2478, test_f1: 0.6781
 epoch: 88, train_loss: 0.2748, test_loss: 1.2825, test_f1: 0.6564
 epoch: 89, train_loss: 0.2611, test_loss: 1.3207, test_f1: 0.6674
 epoch: 90, train_loss: 0.2502, test_loss: 1.4255, test_f1: 0.6660
 epoch: 91, train_loss: 0.2515, test_loss: 1.4887, test_f1: 0.6685
 epoch: 92, train_loss: 0.2508, test_loss: 1.4965, test_f1: 0.6703
 epoch: 93, train_loss: 0.2675, test_loss: 1.4266, test_f1: 0.6611
 epoch: 94, train_loss: 0.2573, test_loss: 1.3138, test_f1: 0.6720
 epoch: 95, train_loss: 0.2505, test_loss: 1.3249, test_f1: 0.6871
 epoch: 96, train_loss: 0.2534, test_loss: 1.3840, test_f1: 0.6782
 epoch: 97, train_loss: 0.2455, test_loss: 1.5022, test_f1: 0.6597
 epoch: 98, train_loss: 0.2496, test_loss: 1.4951, test_f1: 0.6684
 epoch: 99, train_loss: 0.2589, test_loss: 1.4661, test_f1: 0.6662
##################ITERATION #5 ****************************************
 epoch: 0, train_loss: 1.2903, test_loss: 1.1732, test_f1: 0.4501
 epoch: 1, train_loss: 1.0080, test_loss: 0.9275, test_f1: 0.5224
 epoch: 2, train_loss: 0.9635, test_loss: 0.9093, test_f1: 0.5371
 epoch: 3, train_loss: 0.9443, test_loss: 0.8631, test_f1: 0.5432
 epoch: 4, train_loss: 0.8979, test_loss: 0.8109, test_f1: 0.5793
 epoch: 5, train_loss: 0.8669, test_loss: 0.8397, test_f1: 0.5637
 epoch: 6, train_loss: 0.8594, test_loss: 0.8245, test_f1: 0.6050
 epoch: 7, train_loss: 0.8422, test_loss: 0.8000, test_f1: 0.5896
 epoch: 8, train_loss: 0.8199, test_loss: 0.7979, test_f1: 0.6169
 epoch: 9, train_loss: 0.8132, test_loss: 0.7964, test_f1: 0.5831
 epoch: 10, train_loss: 0.7906, test_loss: 0.8013, test_f1: 0.5843
 epoch: 11, train_loss: 0.7811, test_loss: 0.7780, test_f1: 0.6245
 epoch: 12, train_loss: 0.7693, test_loss: 0.7623, test_f1: 0.6311
 epoch: 13, train_loss: 0.7419, test_loss: 0.7822, test_f1: 0.6620
 epoch: 14, train_loss: 0.7442, test_loss: 0.7072, test_f1: 0.6722
 epoch: 15, train_loss: 0.7328, test_loss: 0.7855, test_f1: 0.6602
 epoch: 16, train_loss: 0.7271, test_loss: 0.7347, test_f1: 0.6590
 epoch: 17, train_loss: 0.7180, test_loss: 0.7416, test_f1: 0.6666
 epoch: 18, train_loss: 0.7055, test_loss: 0.8506, test_f1: 0.5946
 epoch: 19, train_loss: 0.7063, test_loss: 0.7511, test_f1: 0.6406
 epoch: 20, train_loss: 0.6984, test_loss: 0.7775, test_f1: 0.6572
 epoch: 21, train_loss: 0.6792, test_loss: 0.7018, test_f1: 0.6789
 epoch: 22, train_loss: 0.6669, test_loss: 0.7429, test_f1: 0.6531
 epoch: 23, train_loss: 0.6521, test_loss: 0.7383, test_f1: 0.6638
 epoch: 24, train_loss: 0.6537, test_loss: 0.7915, test_f1: 0.6414
 epoch: 25, train_loss: 0.6418, test_loss: 0.7742, test_f1: 0.6807
 epoch: 26, train_loss: 0.6337, test_loss: 0.7982, test_f1: 0.6511
 epoch: 27, train_loss: 0.6115, test_loss: 0.8244, test_f1: 0.6240
 epoch: 28, train_loss: 0.6233, test_loss: 0.7327, test_f1: 0.6702
 epoch: 29, train_loss: 0.6029, test_loss: 0.8256, test_f1: 0.6333
 epoch: 30, train_loss: 0.5822, test_loss: 0.7339, test_f1: 0.6856
 epoch: 31, train_loss: 0.5909, test_loss: 0.7845, test_f1: 0.6622
 epoch: 32, train_loss: 0.5689, test_loss: 0.8217, test_f1: 0.6698
 epoch: 33, train_loss: 0.5760, test_loss: 0.7792, test_f1: 0.6576
 epoch: 34, train_loss: 0.5659, test_loss: 0.7046, test_f1: 0.7045
 epoch: 35, train_loss: 0.5681, test_loss: 0.8631, test_f1: 0.6433
 epoch: 36, train_loss: 0.5362, test_loss: 0.8571, test_f1: 0.6630
 epoch: 37, train_loss: 0.5352, test_loss: 0.7865, test_f1: 0.6605
 epoch: 38, train_loss: 0.5378, test_loss: 0.7723, test_f1: 0.6709
 epoch: 39, train_loss: 0.5327, test_loss: 0.7600, test_f1: 0.6806
 epoch: 40, train_loss: 0.5317, test_loss: 0.8432, test_f1: 0.6332
 epoch: 41, train_loss: 0.5198, test_loss: 0.8342, test_f1: 0.6579
 epoch: 42, train_loss: 0.5051, test_loss: 0.9131, test_f1: 0.6373
 epoch: 43, train_loss: 0.5166, test_loss: 0.9489, test_f1: 0.6338
 epoch: 44, train_loss: 0.5116, test_loss: 0.7885, test_f1: 0.6736
 epoch: 45, train_loss: 0.4854, test_loss: 0.9556, test_f1: 0.6496
 epoch: 46, train_loss: 0.4936, test_loss: 0.8838, test_f1: 0.6296
 epoch: 47, train_loss: 0.5088, test_loss: 0.8820, test_f1: 0.6524
 epoch: 48, train_loss: 0.4782, test_loss: 0.8572, test_f1: 0.6594
 epoch: 49, train_loss: 0.4764, test_loss: 0.9435, test_f1: 0.6504
 epoch: 50, train_loss: 0.4724, test_loss: 1.0484, test_f1: 0.6354
 epoch: 51, train_loss: 0.4506, test_loss: 0.9425, test_f1: 0.6695
 epoch: 52, train_loss: 0.4102, test_loss: 0.9847, test_f1: 0.6601
 epoch: 53, train_loss: 0.3978, test_loss: 1.0475, test_f1: 0.6704
 epoch: 54, train_loss: 0.3917, test_loss: 1.0834, test_f1: 0.6545
 epoch: 55, train_loss: 0.3940, test_loss: 1.0853, test_f1: 0.6754
 epoch: 56, train_loss: 0.3812, test_loss: 1.0683, test_f1: 0.6584
 epoch: 57, train_loss: 0.3763, test_loss: 1.1015, test_f1: 0.6466
 epoch: 58, train_loss: 0.3801, test_loss: 1.0586, test_f1: 0.6658
 epoch: 59, train_loss: 0.3721, test_loss: 1.1033, test_f1: 0.6645
 epoch: 60, train_loss: 0.3694, test_loss: 1.2117, test_f1: 0.6608
 epoch: 61, train_loss: 0.3644, test_loss: 1.2075, test_f1: 0.6524
 epoch: 62, train_loss: 0.3608, test_loss: 1.1496, test_f1: 0.6786
 epoch: 63, train_loss: 0.3501, test_loss: 1.0854, test_f1: 0.6640
 epoch: 64, train_loss: 0.3457, test_loss: 1.1924, test_f1: 0.6633
 epoch: 65, train_loss: 0.3569, test_loss: 1.1590, test_f1: 0.6703
 epoch: 66, train_loss: 0.3310, test_loss: 1.1318, test_f1: 0.6645
 epoch: 67, train_loss: 0.3431, test_loss: 1.2280, test_f1: 0.6429
 epoch: 68, train_loss: 0.3318, test_loss: 1.2388, test_f1: 0.6629
 epoch: 69, train_loss: 0.3527, test_loss: 1.2205, test_f1: 0.6679
 epoch: 70, train_loss: 0.3050, test_loss: 1.3021, test_f1: 0.6538
 epoch: 71, train_loss: 0.3424, test_loss: 1.2524, test_f1: 0.6420
 epoch: 72, train_loss: 0.3280, test_loss: 1.2141, test_f1: 0.6841
 epoch: 73, train_loss: 0.3246, test_loss: 1.2299, test_f1: 0.6784
 epoch: 74, train_loss: 0.3090, test_loss: 1.2076, test_f1: 0.6654
 epoch: 75, train_loss: 0.3213, test_loss: 1.2495, test_f1: 0.6720
 epoch: 76, train_loss: 0.3129, test_loss: 1.3274, test_f1: 0.6836
 epoch: 77, train_loss: 0.3135, test_loss: 1.3813, test_f1: 0.6616
 epoch: 78, train_loss: 0.3105, test_loss: 1.3020, test_f1: 0.6675
 epoch: 79, train_loss: 0.3095, test_loss: 1.2899, test_f1: 0.6727
 epoch: 80, train_loss: 0.2928, test_loss: 1.3915, test_f1: 0.6686
 epoch: 81, train_loss: 0.2872, test_loss: 1.3901, test_f1: 0.6542
 epoch: 82, train_loss: 0.2971, test_loss: 1.4093, test_f1: 0.6526
 epoch: 83, train_loss: 0.2980, test_loss: 1.3519, test_f1: 0.6699
 epoch: 84, train_loss: 0.2878, test_loss: 1.4797, test_f1: 0.6627
 epoch: 85, train_loss: 0.2728, test_loss: 1.3551, test_f1: 0.6682
 epoch: 86, train_loss: 0.2963, test_loss: 1.3328, test_f1: 0.6662
 epoch: 87, train_loss: 0.2924, test_loss: 1.4337, test_f1: 0.6723
 epoch: 88, train_loss: 0.3072, test_loss: 1.3581, test_f1: 0.6615
 epoch: 89, train_loss: 0.2819, test_loss: 1.3872, test_f1: 0.6601
 epoch: 90, train_loss: 0.2818, test_loss: 1.4215, test_f1: 0.6515
 epoch: 91, train_loss: 0.2534, test_loss: 1.4413, test_f1: 0.6626
 epoch: 92, train_loss: 0.2879, test_loss: 1.4652, test_f1: 0.6664
 epoch: 93, train_loss: 0.2608, test_loss: 1.4160, test_f1: 0.6735
 epoch: 94, train_loss: 0.2704, test_loss: 1.4584, test_f1: 0.6681
 epoch: 95, train_loss: 0.2568, test_loss: 1.4930, test_f1: 0.6544
 epoch: 96, train_loss: 0.2786, test_loss: 1.4238, test_f1: 0.6759
 epoch: 97, train_loss: 0.2451, test_loss: 1.5764, test_f1: 0.6731
 epoch: 98, train_loss: 0.2604, test_loss: 1.4977, test_f1: 0.6760
 epoch: 99, train_loss: 0.2711, test_loss: 1.6036, test_f1: 0.6660
##################ITERATION #6 ****************************************
 epoch: 0, train_loss: 1.3057, test_loss: 1.0960, test_f1: 0.4249
 epoch: 1, train_loss: 1.0077, test_loss: 0.9399, test_f1: 0.5290
 epoch: 2, train_loss: 0.9654, test_loss: 0.9787, test_f1: 0.5168
 epoch: 3, train_loss: 0.9341, test_loss: 0.9589, test_f1: 0.5158
 epoch: 4, train_loss: 0.8989, test_loss: 0.9242, test_f1: 0.5692
 epoch: 5, train_loss: 0.9063, test_loss: 0.9802, test_f1: 0.5578
 epoch: 6, train_loss: 0.8700, test_loss: 0.8889, test_f1: 0.5794
 epoch: 7, train_loss: 0.8554, test_loss: 0.8674, test_f1: 0.5676
 epoch: 8, train_loss: 0.8392, test_loss: 0.8786, test_f1: 0.5538
 epoch: 9, train_loss: 0.8143, test_loss: 0.8628, test_f1: 0.5951
 epoch: 10, train_loss: 0.8072, test_loss: 0.8599, test_f1: 0.6035
 epoch: 11, train_loss: 0.8121, test_loss: 0.7960, test_f1: 0.6108
 epoch: 12, train_loss: 0.7842, test_loss: 0.8105, test_f1: 0.6256
 epoch: 13, train_loss: 0.7718, test_loss: 0.8226, test_f1: 0.6204
 epoch: 14, train_loss: 0.7555, test_loss: 0.7577, test_f1: 0.6572
 epoch: 15, train_loss: 0.7571, test_loss: 0.7525, test_f1: 0.6455
 epoch: 16, train_loss: 0.7255, test_loss: 0.8265, test_f1: 0.6395
 epoch: 17, train_loss: 0.7019, test_loss: 0.8069, test_f1: 0.6206
 epoch: 18, train_loss: 0.7101, test_loss: 0.7179, test_f1: 0.6666
 epoch: 19, train_loss: 0.7183, test_loss: 0.7666, test_f1: 0.6404
 epoch: 20, train_loss: 0.6863, test_loss: 0.7682, test_f1: 0.6202
 epoch: 21, train_loss: 0.6861, test_loss: 0.7497, test_f1: 0.6615
 epoch: 22, train_loss: 0.6794, test_loss: 0.7831, test_f1: 0.6528
 epoch: 23, train_loss: 0.6539, test_loss: 0.7679, test_f1: 0.6611
 epoch: 24, train_loss: 0.6358, test_loss: 0.8250, test_f1: 0.6510
 epoch: 25, train_loss: 0.6489, test_loss: 0.7015, test_f1: 0.6684
 epoch: 26, train_loss: 0.6345, test_loss: 0.7575, test_f1: 0.6725
 epoch: 27, train_loss: 0.6475, test_loss: 0.7561, test_f1: 0.6764
 epoch: 28, train_loss: 0.6263, test_loss: 0.7438, test_f1: 0.6477
 epoch: 29, train_loss: 0.6027, test_loss: 0.7659, test_f1: 0.6698
 epoch: 30, train_loss: 0.6101, test_loss: 0.8036, test_f1: 0.6573
 epoch: 31, train_loss: 0.5811, test_loss: 0.8430, test_f1: 0.6405
 epoch: 32, train_loss: 0.5969, test_loss: 0.7584, test_f1: 0.6828
 epoch: 33, train_loss: 0.6069, test_loss: 0.8074, test_f1: 0.6355
 epoch: 34, train_loss: 0.5907, test_loss: 0.8455, test_f1: 0.6374
 epoch: 35, train_loss: 0.5724, test_loss: 0.7564, test_f1: 0.6740
 epoch: 36, train_loss: 0.5760, test_loss: 0.8561, test_f1: 0.6447
 epoch: 37, train_loss: 0.5670, test_loss: 0.7787, test_f1: 0.6594
 epoch: 38, train_loss: 0.5518, test_loss: 0.8384, test_f1: 0.6546
 epoch: 39, train_loss: 0.5649, test_loss: 0.7227, test_f1: 0.6730
 epoch: 40, train_loss: 0.5463, test_loss: 0.8250, test_f1: 0.6399
 epoch: 41, train_loss: 0.5444, test_loss: 0.7776, test_f1: 0.6508
 epoch: 42, train_loss: 0.5423, test_loss: 0.7818, test_f1: 0.6641
 epoch: 43, train_loss: 0.5296, test_loss: 0.8216, test_f1: 0.6543
 epoch: 44, train_loss: 0.5314, test_loss: 0.8281, test_f1: 0.6833
 epoch: 45, train_loss: 0.4989, test_loss: 0.7812, test_f1: 0.6813
 epoch: 46, train_loss: 0.5012, test_loss: 0.7647, test_f1: 0.6835
 epoch: 47, train_loss: 0.5116, test_loss: 0.7156, test_f1: 0.6946
 epoch: 48, train_loss: 0.5121, test_loss: 0.7947, test_f1: 0.6736
 epoch: 49, train_loss: 0.4816, test_loss: 0.8055, test_f1: 0.6622
 epoch: 50, train_loss: 0.5040, test_loss: 0.9516, test_f1: 0.6313
 epoch: 51, train_loss: 0.4590, test_loss: 0.7725, test_f1: 0.6828
 epoch: 52, train_loss: 0.4335, test_loss: 0.8066, test_f1: 0.6645
 epoch: 53, train_loss: 0.4200, test_loss: 0.8333, test_f1: 0.6619
 epoch: 54, train_loss: 0.4154, test_loss: 0.7999, test_f1: 0.6824
 epoch: 55, train_loss: 0.4150, test_loss: 0.8142, test_f1: 0.6630
 epoch: 56, train_loss: 0.4021, test_loss: 0.8745, test_f1: 0.6621
 epoch: 57, train_loss: 0.3946, test_loss: 0.8845, test_f1: 0.6735
 epoch: 58, train_loss: 0.4188, test_loss: 0.8607, test_f1: 0.6611
 epoch: 59, train_loss: 0.4079, test_loss: 0.9730, test_f1: 0.6586
 epoch: 60, train_loss: 0.3730, test_loss: 0.9064, test_f1: 0.6810
 epoch: 61, train_loss: 0.3915, test_loss: 1.0058, test_f1: 0.6503
 epoch: 62, train_loss: 0.3812, test_loss: 0.9806, test_f1: 0.6564
 epoch: 63, train_loss: 0.3812, test_loss: 0.9200, test_f1: 0.6624
 epoch: 64, train_loss: 0.3941, test_loss: 0.8914, test_f1: 0.6572
 epoch: 65, train_loss: 0.3707, test_loss: 0.9668, test_f1: 0.6436
 epoch: 66, train_loss: 0.3923, test_loss: 0.9598, test_f1: 0.6560
 epoch: 67, train_loss: 0.3798, test_loss: 0.9420, test_f1: 0.6512
 epoch: 68, train_loss: 0.3520, test_loss: 0.9858, test_f1: 0.6602
 epoch: 69, train_loss: 0.3729, test_loss: 1.0818, test_f1: 0.6679
 epoch: 70, train_loss: 0.3759, test_loss: 1.0301, test_f1: 0.6424
 epoch: 71, train_loss: 0.3674, test_loss: 0.9692, test_f1: 0.6706
 epoch: 72, train_loss: 0.3491, test_loss: 0.9118, test_f1: 0.6764
 epoch: 73, train_loss: 0.3589, test_loss: 0.9486, test_f1: 0.6517
 epoch: 74, train_loss: 0.3334, test_loss: 1.0114, test_f1: 0.6652
 epoch: 75, train_loss: 0.3367, test_loss: 1.0658, test_f1: 0.6479
 epoch: 76, train_loss: 0.3532, test_loss: 0.9460, test_f1: 0.6711
 epoch: 77, train_loss: 0.3559, test_loss: 1.0847, test_f1: 0.6745
 epoch: 78, train_loss: 0.3497, test_loss: 1.0406, test_f1: 0.6628
 epoch: 79, train_loss: 0.3301, test_loss: 1.0868, test_f1: 0.6677
 epoch: 80, train_loss: 0.3243, test_loss: 1.1150, test_f1: 0.6451
 epoch: 81, train_loss: 0.3440, test_loss: 1.0789, test_f1: 0.6506
 epoch: 82, train_loss: 0.3425, test_loss: 1.0115, test_f1: 0.6482
 epoch: 83, train_loss: 0.3458, test_loss: 1.0975, test_f1: 0.6317
 epoch: 84, train_loss: 0.3248, test_loss: 1.0588, test_f1: 0.6483
 epoch: 85, train_loss: 0.3154, test_loss: 1.0583, test_f1: 0.6546
 epoch: 86, train_loss: 0.3214, test_loss: 1.1500, test_f1: 0.6570
 epoch: 87, train_loss: 0.3176, test_loss: 1.0591, test_f1: 0.6553
 epoch: 88, train_loss: 0.3091, test_loss: 1.1257, test_f1: 0.6620
 epoch: 89, train_loss: 0.3243, test_loss: 1.0940, test_f1: 0.6590
 epoch: 90, train_loss: 0.3039, test_loss: 1.1633, test_f1: 0.6588
 epoch: 91, train_loss: 0.3156, test_loss: 1.1701, test_f1: 0.6521
 epoch: 92, train_loss: 0.3095, test_loss: 1.1648, test_f1: 0.6687
 epoch: 93, train_loss: 0.3218, test_loss: 1.1497, test_f1: 0.6619
 epoch: 94, train_loss: 0.3098, test_loss: 1.2402, test_f1: 0.6652
 epoch: 95, train_loss: 0.2836, test_loss: 1.1474, test_f1: 0.6685
 epoch: 96, train_loss: 0.2921, test_loss: 1.1257, test_f1: 0.6748
 epoch: 97, train_loss: 0.3037, test_loss: 1.1835, test_f1: 0.6621
 epoch: 98, train_loss: 0.2827, test_loss: 1.1573, test_f1: 0.6654
 epoch: 99, train_loss: 0.2856, test_loss: 1.1372, test_f1: 0.6709
##################ITERATION #7 ****************************************
 epoch: 0, train_loss: 1.3644, test_loss: 1.0840, test_f1: 0.4595
 epoch: 1, train_loss: 1.0436, test_loss: 0.9876, test_f1: 0.5347
 epoch: 2, train_loss: 0.9884, test_loss: 0.9207, test_f1: 0.5367
 epoch: 3, train_loss: 0.9493, test_loss: 0.9260, test_f1: 0.5359
 epoch: 4, train_loss: 0.9345, test_loss: 0.9264, test_f1: 0.5500
 epoch: 5, train_loss: 0.9143, test_loss: 0.9252, test_f1: 0.5577
 epoch: 6, train_loss: 0.8943, test_loss: 0.8849, test_f1: 0.5771
 epoch: 7, train_loss: 0.8772, test_loss: 0.8717, test_f1: 0.5576
 epoch: 8, train_loss: 0.8649, test_loss: 0.8444, test_f1: 0.5767
 epoch: 9, train_loss: 0.8510, test_loss: 0.8429, test_f1: 0.5891
 epoch: 10, train_loss: 0.8349, test_loss: 0.8362, test_f1: 0.5806
 epoch: 11, train_loss: 0.8114, test_loss: 0.8157, test_f1: 0.5913
 epoch: 12, train_loss: 0.8064, test_loss: 0.7791, test_f1: 0.6362
 epoch: 13, train_loss: 0.8031, test_loss: 0.8397, test_f1: 0.5987
 epoch: 14, train_loss: 0.7885, test_loss: 0.7574, test_f1: 0.6480
 epoch: 15, train_loss: 0.7669, test_loss: 0.8050, test_f1: 0.6154
 epoch: 16, train_loss: 0.7711, test_loss: 0.7821, test_f1: 0.6083
 epoch: 17, train_loss: 0.7550, test_loss: 0.7692, test_f1: 0.6308
 epoch: 18, train_loss: 0.7375, test_loss: 0.8297, test_f1: 0.6207
 epoch: 19, train_loss: 0.7344, test_loss: 0.7748, test_f1: 0.6351
 epoch: 20, train_loss: 0.7232, test_loss: 0.7483, test_f1: 0.6571
 epoch: 21, train_loss: 0.7130, test_loss: 0.8341, test_f1: 0.6364
 epoch: 22, train_loss: 0.7164, test_loss: 0.7493, test_f1: 0.6659
 epoch: 23, train_loss: 0.7001, test_loss: 0.7817, test_f1: 0.6264
 epoch: 24, train_loss: 0.6813, test_loss: 0.7867, test_f1: 0.6428
 epoch: 25, train_loss: 0.6794, test_loss: 0.8575, test_f1: 0.5901
 epoch: 26, train_loss: 0.6840, test_loss: 0.7570, test_f1: 0.6416
 epoch: 27, train_loss: 0.6726, test_loss: 0.8078, test_f1: 0.6127
 epoch: 28, train_loss: 0.6624, test_loss: 0.8103, test_f1: 0.6219
 epoch: 29, train_loss: 0.6447, test_loss: 0.7196, test_f1: 0.6649
 epoch: 30, train_loss: 0.6505, test_loss: 0.8537, test_f1: 0.6366
 epoch: 31, train_loss: 0.6329, test_loss: 0.8371, test_f1: 0.6353
 epoch: 32, train_loss: 0.6227, test_loss: 0.8361, test_f1: 0.6332
 epoch: 33, train_loss: 0.6383, test_loss: 0.7649, test_f1: 0.6499
 epoch: 34, train_loss: 0.6130, test_loss: 0.8260, test_f1: 0.6389
 epoch: 35, train_loss: 0.6053, test_loss: 0.7995, test_f1: 0.6298
 epoch: 36, train_loss: 0.5802, test_loss: 0.7612, test_f1: 0.6617
 epoch: 37, train_loss: 0.6003, test_loss: 0.7634, test_f1: 0.6464
 epoch: 38, train_loss: 0.5813, test_loss: 0.8269, test_f1: 0.6214
 epoch: 39, train_loss: 0.5923, test_loss: 0.7560, test_f1: 0.6616
 epoch: 40, train_loss: 0.5800, test_loss: 0.7643, test_f1: 0.6447
 epoch: 41, train_loss: 0.5616, test_loss: 0.7509, test_f1: 0.6826
 epoch: 42, train_loss: 0.5490, test_loss: 0.7897, test_f1: 0.6609
 epoch: 43, train_loss: 0.5565, test_loss: 0.8265, test_f1: 0.6524
 epoch: 44, train_loss: 0.5468, test_loss: 0.8154, test_f1: 0.6496
 epoch: 45, train_loss: 0.5447, test_loss: 0.8143, test_f1: 0.6642
 epoch: 46, train_loss: 0.5382, test_loss: 0.8135, test_f1: 0.6355
 epoch: 47, train_loss: 0.5327, test_loss: 0.8374, test_f1: 0.6531
 epoch: 48, train_loss: 0.5359, test_loss: 0.8162, test_f1: 0.6197
 epoch: 49, train_loss: 0.5350, test_loss: 0.9221, test_f1: 0.6545
 epoch: 50, train_loss: 0.5153, test_loss: 0.8774, test_f1: 0.6372
 epoch: 51, train_loss: 0.4864, test_loss: 0.9328, test_f1: 0.6551
 epoch: 52, train_loss: 0.4633, test_loss: 0.9030, test_f1: 0.6487
 epoch: 53, train_loss: 0.4656, test_loss: 0.9460, test_f1: 0.6324
 epoch: 54, train_loss: 0.4386, test_loss: 0.9832, test_f1: 0.6419
 epoch: 55, train_loss: 0.4413, test_loss: 1.0520, test_f1: 0.6434
 epoch: 56, train_loss: 0.4281, test_loss: 1.0531, test_f1: 0.6369
 epoch: 57, train_loss: 0.4498, test_loss: 0.9909, test_f1: 0.6407
 epoch: 58, train_loss: 0.4440, test_loss: 0.9701, test_f1: 0.6398
 epoch: 59, train_loss: 0.4167, test_loss: 1.0747, test_f1: 0.6355
 epoch: 60, train_loss: 0.4001, test_loss: 1.0806, test_f1: 0.6384
 epoch: 61, train_loss: 0.4130, test_loss: 0.9989, test_f1: 0.6486
 epoch: 62, train_loss: 0.4102, test_loss: 1.1138, test_f1: 0.6385
 epoch: 63, train_loss: 0.4065, test_loss: 1.0165, test_f1: 0.6398
 epoch: 64, train_loss: 0.4086, test_loss: 1.0287, test_f1: 0.6396
 epoch: 65, train_loss: 0.3993, test_loss: 1.1278, test_f1: 0.6435
 epoch: 66, train_loss: 0.3826, test_loss: 1.0795, test_f1: 0.6300
 epoch: 67, train_loss: 0.4047, test_loss: 1.0843, test_f1: 0.6524
 epoch: 68, train_loss: 0.4170, test_loss: 1.0398, test_f1: 0.6358
 epoch: 69, train_loss: 0.3859, test_loss: 1.1633, test_f1: 0.6362
 epoch: 70, train_loss: 0.3885, test_loss: 1.0603, test_f1: 0.6411
 epoch: 71, train_loss: 0.3971, test_loss: 1.1292, test_f1: 0.6580
 epoch: 72, train_loss: 0.3851, test_loss: 1.0682, test_f1: 0.6367
 epoch: 73, train_loss: 0.3638, test_loss: 1.1358, test_f1: 0.6247
 epoch: 74, train_loss: 0.3851, test_loss: 1.0966, test_f1: 0.6465
 epoch: 75, train_loss: 0.3550, test_loss: 1.0760, test_f1: 0.6487
 epoch: 76, train_loss: 0.3633, test_loss: 1.0401, test_f1: 0.6443
 epoch: 77, train_loss: 0.3568, test_loss: 1.0668, test_f1: 0.6344
 epoch: 78, train_loss: 0.3643, test_loss: 1.0118, test_f1: 0.6490
 epoch: 79, train_loss: 0.3558, test_loss: 1.0357, test_f1: 0.6424
 epoch: 80, train_loss: 0.3670, test_loss: 1.1391, test_f1: 0.6418
 epoch: 81, train_loss: 0.3430, test_loss: 1.1944, test_f1: 0.6494
 epoch: 82, train_loss: 0.3609, test_loss: 1.1083, test_f1: 0.6481
 epoch: 83, train_loss: 0.3412, test_loss: 1.1937, test_f1: 0.6473
 epoch: 84, train_loss: 0.3581, test_loss: 1.1385, test_f1: 0.6363
 epoch: 85, train_loss: 0.3463, test_loss: 1.0920, test_f1: 0.6543
 epoch: 86, train_loss: 0.3227, test_loss: 1.0892, test_f1: 0.6443
 epoch: 87, train_loss: 0.3177, test_loss: 1.1401, test_f1: 0.6393
 epoch: 88, train_loss: 0.3405, test_loss: 1.1111, test_f1: 0.6496
 epoch: 89, train_loss: 0.3390, test_loss: 1.2408, test_f1: 0.6354
 epoch: 90, train_loss: 0.3200, test_loss: 1.2428, test_f1: 0.6453
 epoch: 91, train_loss: 0.3293, test_loss: 1.2094, test_f1: 0.6416
 epoch: 92, train_loss: 0.3326, test_loss: 1.2055, test_f1: 0.6481
 epoch: 93, train_loss: 0.3207, test_loss: 1.2875, test_f1: 0.6304
 epoch: 94, train_loss: 0.3057, test_loss: 1.2377, test_f1: 0.6337
 epoch: 95, train_loss: 0.3093, test_loss: 1.2789, test_f1: 0.6300
 epoch: 96, train_loss: 0.3093, test_loss: 1.2378, test_f1: 0.6391
 epoch: 97, train_loss: 0.3118, test_loss: 1.2746, test_f1: 0.6336
 epoch: 98, train_loss: 0.3092, test_loss: 1.2538, test_f1: 0.6410
 epoch: 99, train_loss: 0.3043, test_loss: 1.2981, test_f1: 0.6346
##################ITERATION #8 ****************************************
 epoch: 0, train_loss: 1.2425, test_loss: 1.0769, test_f1: 0.4809
 epoch: 1, train_loss: 1.0067, test_loss: 0.9261, test_f1: 0.5526
 epoch: 2, train_loss: 0.9625, test_loss: 0.9103, test_f1: 0.5523
 epoch: 3, train_loss: 0.9367, test_loss: 0.9255, test_f1: 0.5928
 epoch: 4, train_loss: 0.9238, test_loss: 0.8806, test_f1: 0.5515
 epoch: 5, train_loss: 0.8967, test_loss: 0.8348, test_f1: 0.5910
 epoch: 6, train_loss: 0.8658, test_loss: 0.8462, test_f1: 0.5595
 epoch: 7, train_loss: 0.8464, test_loss: 0.8106, test_f1: 0.6140
 epoch: 8, train_loss: 0.8245, test_loss: 0.8108, test_f1: 0.6012
 epoch: 9, train_loss: 0.8223, test_loss: 0.7673, test_f1: 0.6298
 epoch: 10, train_loss: 0.7968, test_loss: 0.7924, test_f1: 0.6038
 epoch: 11, train_loss: 0.7682, test_loss: 0.7810, test_f1: 0.6151
 epoch: 12, train_loss: 0.7563, test_loss: 0.8693, test_f1: 0.5976
 epoch: 13, train_loss: 0.7563, test_loss: 0.7540, test_f1: 0.6877
 epoch: 14, train_loss: 0.7433, test_loss: 0.7307, test_f1: 0.6814
 epoch: 15, train_loss: 0.7219, test_loss: 0.7237, test_f1: 0.6860
 epoch: 16, train_loss: 0.7419, test_loss: 0.7316, test_f1: 0.6513
 epoch: 17, train_loss: 0.7004, test_loss: 0.7042, test_f1: 0.7248
 epoch: 18, train_loss: 0.6987, test_loss: 0.7331, test_f1: 0.6661
 epoch: 19, train_loss: 0.6798, test_loss: 0.7300, test_f1: 0.6493
 epoch: 20, train_loss: 0.6670, test_loss: 0.7184, test_f1: 0.6535
 epoch: 21, train_loss: 0.6668, test_loss: 0.7434, test_f1: 0.6425
 epoch: 22, train_loss: 0.6397, test_loss: 0.7512, test_f1: 0.6727
 epoch: 23, train_loss: 0.6297, test_loss: 0.6910, test_f1: 0.6802
 epoch: 24, train_loss: 0.6372, test_loss: 0.7709, test_f1: 0.6430
 epoch: 25, train_loss: 0.6350, test_loss: 0.7611, test_f1: 0.6799
 epoch: 26, train_loss: 0.6150, test_loss: 0.7104, test_f1: 0.6930
 epoch: 27, train_loss: 0.6263, test_loss: 0.7434, test_f1: 0.6793
 epoch: 28, train_loss: 0.5985, test_loss: 0.7400, test_f1: 0.6850
 epoch: 29, train_loss: 0.5918, test_loss: 0.7460, test_f1: 0.6805
 epoch: 30, train_loss: 0.5788, test_loss: 0.7148, test_f1: 0.7035
 epoch: 31, train_loss: 0.6028, test_loss: 0.7278, test_f1: 0.6985
 epoch: 32, train_loss: 0.5878, test_loss: 0.7954, test_f1: 0.6345
 epoch: 33, train_loss: 0.5652, test_loss: 0.9467, test_f1: 0.6292
 epoch: 34, train_loss: 0.5644, test_loss: 0.7766, test_f1: 0.6904
 epoch: 35, train_loss: 0.5610, test_loss: 0.7315, test_f1: 0.6847
 epoch: 36, train_loss: 0.5302, test_loss: 0.8571, test_f1: 0.6472
 epoch: 37, train_loss: 0.5338, test_loss: 0.8336, test_f1: 0.6406
 epoch: 38, train_loss: 0.5429, test_loss: 0.7822, test_f1: 0.6514
 epoch: 39, train_loss: 0.5195, test_loss: 0.8490, test_f1: 0.6687
 epoch: 40, train_loss: 0.5174, test_loss: 0.7694, test_f1: 0.6515
 epoch: 41, train_loss: 0.5097, test_loss: 0.8818, test_f1: 0.6609
 epoch: 42, train_loss: 0.5191, test_loss: 0.7746, test_f1: 0.6638
 epoch: 43, train_loss: 0.4994, test_loss: 0.8360, test_f1: 0.6680
 epoch: 44, train_loss: 0.4989, test_loss: 0.8712, test_f1: 0.6589
 epoch: 45, train_loss: 0.4858, test_loss: 0.8372, test_f1: 0.6687
 epoch: 46, train_loss: 0.4883, test_loss: 0.8983, test_f1: 0.6745
 epoch: 47, train_loss: 0.4779, test_loss: 0.7511, test_f1: 0.6828
 epoch: 48, train_loss: 0.4890, test_loss: 0.7761, test_f1: 0.6900
 epoch: 49, train_loss: 0.4698, test_loss: 0.9589, test_f1: 0.6495
 epoch: 50, train_loss: 0.4686, test_loss: 0.8180, test_f1: 0.6952
 epoch: 51, train_loss: 0.4246, test_loss: 0.8172, test_f1: 0.6876
 epoch: 52, train_loss: 0.4191, test_loss: 0.9248, test_f1: 0.6714
 epoch: 53, train_loss: 0.3841, test_loss: 0.8564, test_f1: 0.6934
 epoch: 54, train_loss: 0.3716, test_loss: 0.9196, test_f1: 0.6628
 epoch: 55, train_loss: 0.3718, test_loss: 0.9551, test_f1: 0.6711
 epoch: 56, train_loss: 0.3668, test_loss: 0.9358, test_f1: 0.6820
 epoch: 57, train_loss: 0.3710, test_loss: 0.9597, test_f1: 0.6869
 epoch: 58, train_loss: 0.3687, test_loss: 0.9660, test_f1: 0.6660
 epoch: 59, train_loss: 0.3705, test_loss: 1.0840, test_f1: 0.6530
 epoch: 60, train_loss: 0.3512, test_loss: 1.0843, test_f1: 0.6709
 epoch: 61, train_loss: 0.3458, test_loss: 1.1007, test_f1: 0.6697
 epoch: 62, train_loss: 0.3574, test_loss: 1.0642, test_f1: 0.6822
 epoch: 63, train_loss: 0.3513, test_loss: 0.9812, test_f1: 0.6672
 epoch: 64, train_loss: 0.3365, test_loss: 1.2005, test_f1: 0.6746
 epoch: 65, train_loss: 0.3462, test_loss: 1.1692, test_f1: 0.6603
 epoch: 66, train_loss: 0.3310, test_loss: 1.2140, test_f1: 0.6422
 epoch: 67, train_loss: 0.3418, test_loss: 1.1444, test_f1: 0.6728
 epoch: 68, train_loss: 0.3400, test_loss: 1.1169, test_f1: 0.6585
 epoch: 69, train_loss: 0.3456, test_loss: 1.1119, test_f1: 0.6772
 epoch: 70, train_loss: 0.3262, test_loss: 1.0571, test_f1: 0.6791
 epoch: 71, train_loss: 0.3080, test_loss: 1.2485, test_f1: 0.6673
 epoch: 72, train_loss: 0.3190, test_loss: 1.1843, test_f1: 0.6709
 epoch: 73, train_loss: 0.3236, test_loss: 1.2909, test_f1: 0.6628
 epoch: 74, train_loss: 0.3028, test_loss: 1.2319, test_f1: 0.6618
 epoch: 75, train_loss: 0.3263, test_loss: 1.1696, test_f1: 0.6711
 epoch: 76, train_loss: 0.3049, test_loss: 1.1047, test_f1: 0.6768
 epoch: 77, train_loss: 0.2944, test_loss: 1.2261, test_f1: 0.6673
 epoch: 78, train_loss: 0.2952, test_loss: 1.3203, test_f1: 0.6637
 epoch: 79, train_loss: 0.3168, test_loss: 1.2397, test_f1: 0.6892
 epoch: 80, train_loss: 0.2955, test_loss: 1.2826, test_f1: 0.6662
 epoch: 81, train_loss: 0.3076, test_loss: 1.2288, test_f1: 0.6583
 epoch: 82, train_loss: 0.2837, test_loss: 1.2937, test_f1: 0.6755
 epoch: 83, train_loss: 0.2790, test_loss: 1.3954, test_f1: 0.6718
 epoch: 84, train_loss: 0.2904, test_loss: 1.3614, test_f1: 0.6701
 epoch: 85, train_loss: 0.2948, test_loss: 1.2555, test_f1: 0.6794
 epoch: 86, train_loss: 0.2984, test_loss: 1.3283, test_f1: 0.6733
 epoch: 87, train_loss: 0.3012, test_loss: 1.3526, test_f1: 0.6498
 epoch: 88, train_loss: 0.2902, test_loss: 1.3606, test_f1: 0.6747
 epoch: 89, train_loss: 0.2817, test_loss: 1.3767, test_f1: 0.6739
 epoch: 90, train_loss: 0.2974, test_loss: 1.3070, test_f1: 0.6924
 epoch: 91, train_loss: 0.2536, test_loss: 1.3631, test_f1: 0.6677
 epoch: 92, train_loss: 0.2780, test_loss: 1.4343, test_f1: 0.6763
 epoch: 93, train_loss: 0.2536, test_loss: 1.4679, test_f1: 0.6731
 epoch: 94, train_loss: 0.2844, test_loss: 1.5038, test_f1: 0.6511
 epoch: 95, train_loss: 0.2697, test_loss: 1.4293, test_f1: 0.6819
 epoch: 96, train_loss: 0.2710, test_loss: 1.5378, test_f1: 0.6543
 epoch: 97, train_loss: 0.2718, test_loss: 1.6411, test_f1: 0.6740
 epoch: 98, train_loss: 0.2487, test_loss: 1.6581, test_f1: 0.6613
 epoch: 99, train_loss: 0.2447, test_loss: 1.6604, test_f1: 0.6638
##################ITERATION #9 ****************************************
 epoch: 0, train_loss: 1.4058, test_loss: 1.0991, test_f1: 0.4545
 epoch: 1, train_loss: 1.0222, test_loss: 1.0042, test_f1: 0.5103
 epoch: 2, train_loss: 0.9807, test_loss: 0.9373, test_f1: 0.5353
 epoch: 3, train_loss: 0.9584, test_loss: 0.9465, test_f1: 0.5432
 epoch: 4, train_loss: 0.9339, test_loss: 0.9473, test_f1: 0.5281
 epoch: 5, train_loss: 0.8991, test_loss: 0.8840, test_f1: 0.6033
 epoch: 6, train_loss: 0.9031, test_loss: 0.8424, test_f1: 0.5867
 epoch: 7, train_loss: 0.8761, test_loss: 0.8422, test_f1: 0.5854
 epoch: 8, train_loss: 0.8552, test_loss: 0.8650, test_f1: 0.5569
 epoch: 9, train_loss: 0.8435, test_loss: 0.8313, test_f1: 0.5994
 epoch: 10, train_loss: 0.8333, test_loss: 0.8081, test_f1: 0.5982
 epoch: 11, train_loss: 0.8266, test_loss: 0.8210, test_f1: 0.5767
 epoch: 12, train_loss: 0.7910, test_loss: 0.8408, test_f1: 0.5803
 epoch: 13, train_loss: 0.8011, test_loss: 0.8059, test_f1: 0.6055
 epoch: 14, train_loss: 0.7830, test_loss: 0.7891, test_f1: 0.6047
 epoch: 15, train_loss: 0.7715, test_loss: 0.7645, test_f1: 0.6252
 epoch: 16, train_loss: 0.7598, test_loss: 0.8046, test_f1: 0.6428
 epoch: 17, train_loss: 0.7571, test_loss: 0.8370, test_f1: 0.5840
 epoch: 18, train_loss: 0.7339, test_loss: 0.8667, test_f1: 0.6146
 epoch: 19, train_loss: 0.7366, test_loss: 0.7390, test_f1: 0.6449
 epoch: 20, train_loss: 0.7157, test_loss: 0.7807, test_f1: 0.6292
 epoch: 21, train_loss: 0.7016, test_loss: 0.7674, test_f1: 0.6318
 epoch: 22, train_loss: 0.6808, test_loss: 0.7545, test_f1: 0.6275
 epoch: 23, train_loss: 0.6906, test_loss: 0.7973, test_f1: 0.6519
 epoch: 24, train_loss: 0.6895, test_loss: 0.8321, test_f1: 0.6157
 epoch: 25, train_loss: 0.6677, test_loss: 0.8146, test_f1: 0.6114
 epoch: 26, train_loss: 0.6638, test_loss: 0.8099, test_f1: 0.6264
 epoch: 27, train_loss: 0.6402, test_loss: 0.7906, test_f1: 0.6359
 epoch: 28, train_loss: 0.6300, test_loss: 0.7724, test_f1: 0.6556
 epoch: 29, train_loss: 0.6354, test_loss: 0.8751, test_f1: 0.6241
 epoch: 30, train_loss: 0.6169, test_loss: 0.8329, test_f1: 0.6510
 epoch: 31, train_loss: 0.6139, test_loss: 0.8492, test_f1: 0.6466
 epoch: 32, train_loss: 0.6082, test_loss: 0.8344, test_f1: 0.6412
 epoch: 33, train_loss: 0.5918, test_loss: 0.7806, test_f1: 0.6392
 epoch: 34, train_loss: 0.6009, test_loss: 0.8714, test_f1: 0.6735
 epoch: 35, train_loss: 0.5858, test_loss: 0.8237, test_f1: 0.6540
 epoch: 36, train_loss: 0.5852, test_loss: 0.8260, test_f1: 0.6631
 epoch: 37, train_loss: 0.5669, test_loss: 0.8355, test_f1: 0.6745
 epoch: 38, train_loss: 0.5428, test_loss: 0.9136, test_f1: 0.6926
 epoch: 39, train_loss: 0.5412, test_loss: 0.8430, test_f1: 0.6364
 epoch: 40, train_loss: 0.5486, test_loss: 0.8799, test_f1: 0.6567
 epoch: 41, train_loss: 0.5234, test_loss: 0.9003, test_f1: 0.6659
 epoch: 42, train_loss: 0.5296, test_loss: 0.9074, test_f1: 0.6481
 epoch: 43, train_loss: 0.5130, test_loss: 0.8674, test_f1: 0.6690
 epoch: 44, train_loss: 0.5253, test_loss: 0.8779, test_f1: 0.6479
 epoch: 45, train_loss: 0.5256, test_loss: 0.8683, test_f1: 0.6805
 epoch: 46, train_loss: 0.4987, test_loss: 0.9170, test_f1: 0.6715
 epoch: 47, train_loss: 0.5053, test_loss: 0.9894, test_f1: 0.6511
 epoch: 48, train_loss: 0.4905, test_loss: 0.9658, test_f1: 0.6771
 epoch: 49, train_loss: 0.4961, test_loss: 0.8875, test_f1: 0.6566
 epoch: 50, train_loss: 0.4741, test_loss: 0.8873, test_f1: 0.6444
 epoch: 51, train_loss: 0.4589, test_loss: 0.9607, test_f1: 0.6727
 epoch: 52, train_loss: 0.4149, test_loss: 1.0463, test_f1: 0.6733
 epoch: 53, train_loss: 0.4093, test_loss: 1.0866, test_f1: 0.6827
 epoch: 54, train_loss: 0.3858, test_loss: 1.1086, test_f1: 0.6686
 epoch: 55, train_loss: 0.3776, test_loss: 1.1568, test_f1: 0.6823
 epoch: 56, train_loss: 0.3706, test_loss: 1.0541, test_f1: 0.6838
 epoch: 57, train_loss: 0.3793, test_loss: 1.1938, test_f1: 0.6549
 epoch: 58, train_loss: 0.3763, test_loss: 1.0934, test_f1: 0.6662
 epoch: 59, train_loss: 0.3647, test_loss: 1.0909, test_f1: 0.6680
 epoch: 60, train_loss: 0.3487, test_loss: 1.1352, test_f1: 0.6747
 epoch: 61, train_loss: 0.3671, test_loss: 1.0378, test_f1: 0.6867
 epoch: 62, train_loss: 0.3596, test_loss: 1.0647, test_f1: 0.6831
 epoch: 63, train_loss: 0.3535, test_loss: 1.1954, test_f1: 0.6553
 epoch: 64, train_loss: 0.3621, test_loss: 1.2165, test_f1: 0.6697
 epoch: 65, train_loss: 0.3456, test_loss: 1.1280, test_f1: 0.6700
 epoch: 66, train_loss: 0.3496, test_loss: 1.1752, test_f1: 0.6454
 epoch: 67, train_loss: 0.3420, test_loss: 1.1673, test_f1: 0.6555
 epoch: 68, train_loss: 0.3385, test_loss: 1.3156, test_f1: 0.6697
 epoch: 69, train_loss: 0.3447, test_loss: 1.2038, test_f1: 0.6495
 epoch: 70, train_loss: 0.3352, test_loss: 1.2363, test_f1: 0.6610
 epoch: 71, train_loss: 0.3230, test_loss: 1.2526, test_f1: 0.6440
 epoch: 72, train_loss: 0.3228, test_loss: 1.1641, test_f1: 0.6713
 epoch: 73, train_loss: 0.3154, test_loss: 1.2287, test_f1: 0.6644
 epoch: 74, train_loss: 0.3181, test_loss: 1.1234, test_f1: 0.6795
 epoch: 75, train_loss: 0.3073, test_loss: 1.3163, test_f1: 0.6693
 epoch: 76, train_loss: 0.3079, test_loss: 1.3400, test_f1: 0.6714
 epoch: 77, train_loss: 0.3142, test_loss: 1.3400, test_f1: 0.6589
 epoch: 78, train_loss: 0.3166, test_loss: 1.3197, test_f1: 0.6757
 epoch: 79, train_loss: 0.3208, test_loss: 1.3751, test_f1: 0.6302
 epoch: 80, train_loss: 0.3042, test_loss: 1.3078, test_f1: 0.6657
 epoch: 81, train_loss: 0.3076, test_loss: 1.3175, test_f1: 0.6461
 epoch: 82, train_loss: 0.2933, test_loss: 1.3130, test_f1: 0.6727
 epoch: 83, train_loss: 0.2946, test_loss: 1.2718, test_f1: 0.6763
 epoch: 84, train_loss: 0.2945, test_loss: 1.3036, test_f1: 0.6756
 epoch: 85, train_loss: 0.2856, test_loss: 1.4026, test_f1: 0.6395
 epoch: 86, train_loss: 0.2832, test_loss: 1.3440, test_f1: 0.6698
 epoch: 87, train_loss: 0.2807, test_loss: 1.3423, test_f1: 0.6692
 epoch: 88, train_loss: 0.2748, test_loss: 1.3899, test_f1: 0.6588
 epoch: 89, train_loss: 0.2899, test_loss: 1.3664, test_f1: 0.6532
 epoch: 90, train_loss: 0.2599, test_loss: 1.4143, test_f1: 0.6726
 epoch: 91, train_loss: 0.2602, test_loss: 1.4692, test_f1: 0.6611
 epoch: 92, train_loss: 0.2831, test_loss: 1.2988, test_f1: 0.6628
 epoch: 93, train_loss: 0.2814, test_loss: 1.3848, test_f1: 0.6635
 epoch: 94, train_loss: 0.2708, test_loss: 1.3253, test_f1: 0.6840
 epoch: 95, train_loss: 0.2639, test_loss: 1.2952, test_f1: 0.6868
 epoch: 96, train_loss: 0.2544, test_loss: 1.4646, test_f1: 0.6514
 epoch: 97, train_loss: 0.2547, test_loss: 1.4490, test_f1: 0.6535
 epoch: 98, train_loss: 0.2606, test_loss: 1.5418, test_f1: 0.6609
 epoch: 99, train_loss: 0.2521, test_loss: 1.4755, test_f1: 0.6659

Training completed in 893.33 seconds
Best F1: 0.7265 at epoch 31
Mean F1 across iterations: 0.7021  0.0139
========================FINAL RESULTS================================
FEGIN weighted F1: 0.7265  0.0139
python main.py --data ltspice_examples --representation component_pin_net --model FEGIN --layers 6 --hiddens 64 --batch_size 64 --lr 0.001 --emb_size 512 --epochs 100 --save_appendix component_pin_net_L6_H64_BS64_LR0.001_E512 --no_val
-----



STDERR:
  File "main.py", line 370, in <module>
    main()
  File "main.py", line 254, in main
    dataset = dataset_class(
  File "/home/philip/projects/ltspice_examples_code_repo/Circuit-Completion-Using-GNNs/component_classification_with_link_prediction_head/evaluation/FEGIN/kernel/circuit_datasets.py", line 15, in __init__
    self.data, self.slices = torch.load(self.processed_paths[0])
  File "/home/philip/.local/lib/python3.8/site-packages/torch/serialization.py", line 1040, in load
    warnings.warn(
  File "/usr/lib/python3.8/warnings.py", line 109, in _showwarnmsg
    sw(msg.message, msg.category, msg.filename, msg.lineno,
  File "main.py", line 47, in warn_with_traceback
    traceback.print_stack(file=log)
/home/philip/projects/ltspice_examples_code_repo/Circuit-Completion-Using-GNNs/component_classification_with_link_prediction_head/evaluation/FEGIN/kernel/circuit_datasets.py:15: FutureWarning: You are using `torch.load` with `weights_only=False` (the current default value), which uses the default pickle module implicitly. It is possible to construct malicious pickle data which will execute arbitrary code during unpickling (See https://github.com/pytorch/pytorch/blob/main/SECURITY.md#untrusted-models for more details). In a future release, the default value for `weights_only` will be flipped to `True`. This limits the functions that could be executed during unpickling. Arbitrary objects will no longer be allowed to be loaded via this mode unless they are explicitly allowlisted by the user via `torch.serialization.add_safe_globals`. We recommend you start setting `weights_only=True` for any use case where you don't have full control of the loaded file. Please open an issue on GitHub for any issues related to this experimental feature.
  self.data, self.slices = torch.load(self.processed_paths[0])
