STDOUT:
Results will be saved in /home/philip/projects/ltspice_examples_code_repo/Circuit-Completion-Using-GNNs/component_classification_with_link_prediction_head/evaluation/FEGIN/results/model_FEGIN_dataset_ltspice_examples
Command line input: python main.py --data ltspice_examples --representation component_net --model FEGIN --layers 3 --hiddens 16 --batch_size 256 --lr 0.01 --emb_size 250 --epochs 100 --save_appendix component_net_L3_H16_BS256_LR0.01_E250 --no_val
 is saved.
-----
ltspice_examples - FEGIN
Using 3 layers, 16 hidden units, h = 2
Loading component_net representation dataset
ENTERED
Training FEGIN on component_net representation
Train: 3558, Test: 846
##################ITERATION #0 ****************************************
 epoch: 0, train_loss: 1.3075, test_loss: 1.2984, test_f1: 0.2270
 epoch: 1, train_loss: 1.2221, test_loss: 1.2323, test_f1: 0.2270
 epoch: 2, train_loss: 1.1798, test_loss: 1.1840, test_f1: 0.2270
 epoch: 3, train_loss: 1.1435, test_loss: 1.1548, test_f1: 0.2270
 epoch: 4, train_loss: 1.1118, test_loss: 1.0776, test_f1: 0.4609
 epoch: 5, train_loss: 1.0743, test_loss: 1.0326, test_f1: 0.4879
 epoch: 6, train_loss: 1.0273, test_loss: 1.1156, test_f1: 0.4395
 epoch: 7, train_loss: 1.0001, test_loss: 0.9782, test_f1: 0.4665
 epoch: 8, train_loss: 0.9756, test_loss: 0.9518, test_f1: 0.4861
 epoch: 9, train_loss: 0.9567, test_loss: 1.0038, test_f1: 0.4646
 epoch: 10, train_loss: 0.9546, test_loss: 0.9434, test_f1: 0.4774
 epoch: 11, train_loss: 0.9478, test_loss: 1.0073, test_f1: 0.5220
 epoch: 12, train_loss: 0.9387, test_loss: 0.9550, test_f1: 0.5216
 epoch: 13, train_loss: 0.9220, test_loss: 0.9416, test_f1: 0.5004
 epoch: 14, train_loss: 0.9129, test_loss: 0.9739, test_f1: 0.4982
 epoch: 15, train_loss: 0.9235, test_loss: 0.9514, test_f1: 0.4916
 epoch: 16, train_loss: 0.9108, test_loss: 0.9302, test_f1: 0.5010
 epoch: 17, train_loss: 0.8964, test_loss: 0.9898, test_f1: 0.5176
 epoch: 18, train_loss: 0.9012, test_loss: 0.9286, test_f1: 0.5315
 epoch: 19, train_loss: 0.8967, test_loss: 0.9029, test_f1: 0.5153
 epoch: 20, train_loss: 0.8814, test_loss: 1.0149, test_f1: 0.5046
 epoch: 21, train_loss: 0.8897, test_loss: 0.9889, test_f1: 0.4943
 epoch: 22, train_loss: 0.8948, test_loss: 1.1032, test_f1: 0.4840
 epoch: 23, train_loss: 0.8830, test_loss: 1.0324, test_f1: 0.4908
 epoch: 24, train_loss: 0.8812, test_loss: 0.9845, test_f1: 0.5020
 epoch: 25, train_loss: 0.8846, test_loss: 0.9072, test_f1: 0.5104
 epoch: 26, train_loss: 0.8724, test_loss: 1.0022, test_f1: 0.5247
 epoch: 27, train_loss: 0.8676, test_loss: 1.0095, test_f1: 0.4980
 epoch: 28, train_loss: 0.8548, test_loss: 0.9058, test_f1: 0.5369
 epoch: 29, train_loss: 0.8491, test_loss: 1.0310, test_f1: 0.5116
 epoch: 30, train_loss: 0.8635, test_loss: 1.0373, test_f1: 0.5266
 epoch: 31, train_loss: 0.8594, test_loss: 1.0101, test_f1: 0.5071
 epoch: 32, train_loss: 0.8585, test_loss: 0.8985, test_f1: 0.5272
 epoch: 33, train_loss: 0.8562, test_loss: 1.0994, test_f1: 0.4846
 epoch: 34, train_loss: 0.8579, test_loss: 1.0629, test_f1: 0.5334
 epoch: 35, train_loss: 0.8469, test_loss: 0.8873, test_f1: 0.5699
 epoch: 36, train_loss: 0.8218, test_loss: 0.9185, test_f1: 0.5717
 epoch: 37, train_loss: 0.8438, test_loss: 1.0179, test_f1: 0.5698
 epoch: 38, train_loss: 0.8354, test_loss: 0.9502, test_f1: 0.5191
 epoch: 39, train_loss: 0.8214, test_loss: 0.9168, test_f1: 0.5434
 epoch: 40, train_loss: 0.8155, test_loss: 1.0132, test_f1: 0.5318
 epoch: 41, train_loss: 0.8286, test_loss: 0.9729, test_f1: 0.5480
 epoch: 42, train_loss: 0.8421, test_loss: 1.0048, test_f1: 0.5222
 epoch: 43, train_loss: 0.8150, test_loss: 0.9886, test_f1: 0.5112
 epoch: 44, train_loss: 0.8137, test_loss: 1.0256, test_f1: 0.5737
 epoch: 45, train_loss: 0.8121, test_loss: 0.9402, test_f1: 0.5090
 epoch: 46, train_loss: 0.8122, test_loss: 1.0662, test_f1: 0.4860
 epoch: 47, train_loss: 0.7959, test_loss: 1.1535, test_f1: 0.5270
 epoch: 48, train_loss: 0.8159, test_loss: 0.9521, test_f1: 0.5181
 epoch: 49, train_loss: 0.8141, test_loss: 1.0379, test_f1: 0.5202
 epoch: 50, train_loss: 0.7945, test_loss: 1.0045, test_f1: 0.5498
 epoch: 51, train_loss: 0.7821, test_loss: 0.9786, test_f1: 0.5583
 epoch: 52, train_loss: 0.7702, test_loss: 0.8852, test_f1: 0.5529
 epoch: 53, train_loss: 0.7857, test_loss: 1.0621, test_f1: 0.5489
 epoch: 54, train_loss: 0.7662, test_loss: 0.9984, test_f1: 0.5703
 epoch: 55, train_loss: 0.7715, test_loss: 0.9575, test_f1: 0.5699
 epoch: 56, train_loss: 0.7585, test_loss: 0.9177, test_f1: 0.5342
 epoch: 57, train_loss: 0.7648, test_loss: 0.8842, test_f1: 0.5518
 epoch: 58, train_loss: 0.7676, test_loss: 1.0063, test_f1: 0.5671
 epoch: 59, train_loss: 0.7686, test_loss: 0.8377, test_f1: 0.5715
 epoch: 60, train_loss: 0.7485, test_loss: 0.9926, test_f1: 0.5519
 epoch: 61, train_loss: 0.7658, test_loss: 0.9044, test_f1: 0.5248
 epoch: 62, train_loss: 0.7705, test_loss: 0.9766, test_f1: 0.5740
 epoch: 63, train_loss: 0.7626, test_loss: 0.9101, test_f1: 0.5587
 epoch: 64, train_loss: 0.7649, test_loss: 0.8610, test_f1: 0.5792
 epoch: 65, train_loss: 0.7495, test_loss: 0.9785, test_f1: 0.5731
 epoch: 66, train_loss: 0.7648, test_loss: 0.8634, test_f1: 0.5525
 epoch: 67, train_loss: 0.7447, test_loss: 1.0044, test_f1: 0.5800
 epoch: 68, train_loss: 0.7487, test_loss: 0.9498, test_f1: 0.5436
 epoch: 69, train_loss: 0.7502, test_loss: 0.9721, test_f1: 0.5697
 epoch: 70, train_loss: 0.7405, test_loss: 0.9624, test_f1: 0.5790
 epoch: 71, train_loss: 0.7454, test_loss: 0.8818, test_f1: 0.5715
 epoch: 72, train_loss: 0.7397, test_loss: 1.0414, test_f1: 0.5626
 epoch: 73, train_loss: 0.7369, test_loss: 1.0224, test_f1: 0.5324
 epoch: 74, train_loss: 0.7494, test_loss: 1.0402, test_f1: 0.6021
 epoch: 75, train_loss: 0.7455, test_loss: 0.9173, test_f1: 0.5334
 epoch: 76, train_loss: 0.7471, test_loss: 0.9985, test_f1: 0.5733
 epoch: 77, train_loss: 0.7377, test_loss: 1.0180, test_f1: 0.5438
 epoch: 78, train_loss: 0.7508, test_loss: 1.0526, test_f1: 0.5386
 epoch: 79, train_loss: 0.7336, test_loss: 1.0394, test_f1: 0.5715
 epoch: 80, train_loss: 0.7248, test_loss: 1.0648, test_f1: 0.5514
 epoch: 81, train_loss: 0.7211, test_loss: 0.8887, test_f1: 0.5580
 epoch: 82, train_loss: 0.7303, test_loss: 0.9360, test_f1: 0.5390
 epoch: 83, train_loss: 0.7311, test_loss: 1.0633, test_f1: 0.5720
 epoch: 84, train_loss: 0.7176, test_loss: 0.9092, test_f1: 0.5619
 epoch: 85, train_loss: 0.7349, test_loss: 1.1146, test_f1: 0.5310
 epoch: 86, train_loss: 0.7154, test_loss: 1.0202, test_f1: 0.5586
 epoch: 87, train_loss: 0.7291, test_loss: 0.9633, test_f1: 0.5552
 epoch: 88, train_loss: 0.7154, test_loss: 1.0393, test_f1: 0.5863
 epoch: 89, train_loss: 0.7311, test_loss: 1.1051, test_f1: 0.5262
 epoch: 90, train_loss: 0.7426, test_loss: 1.0605, test_f1: 0.5547
 epoch: 91, train_loss: 0.7303, test_loss: 0.9648, test_f1: 0.5803
 epoch: 92, train_loss: 0.7147, test_loss: 1.0321, test_f1: 0.5479
 epoch: 93, train_loss: 0.7343, test_loss: 1.0994, test_f1: 0.5794
 epoch: 94, train_loss: 0.7278, test_loss: 1.1097, test_f1: 0.5627
 epoch: 95, train_loss: 0.7001, test_loss: 1.1041, test_f1: 0.5562
 epoch: 96, train_loss: 0.7143, test_loss: 1.0231, test_f1: 0.6043
 epoch: 97, train_loss: 0.7100, test_loss: 0.9365, test_f1: 0.5524
 epoch: 98, train_loss: 0.7074, test_loss: 1.0680, test_f1: 0.5414
 epoch: 99, train_loss: 0.7248, test_loss: 1.1062, test_f1: 0.5507
##################ITERATION #1 ****************************************
 epoch: 0, train_loss: 1.3080, test_loss: 1.2940, test_f1: 0.2270
 epoch: 1, train_loss: 1.1919, test_loss: 1.2458, test_f1: 0.2270
 epoch: 2, train_loss: 1.1462, test_loss: 1.1778, test_f1: 0.3052
 epoch: 3, train_loss: 1.1195, test_loss: 1.0969, test_f1: 0.3569
 epoch: 4, train_loss: 1.0771, test_loss: 1.0840, test_f1: 0.3327
 epoch: 5, train_loss: 1.0451, test_loss: 1.0343, test_f1: 0.4228
 epoch: 6, train_loss: 1.0133, test_loss: 1.0219, test_f1: 0.4417
 epoch: 7, train_loss: 0.9971, test_loss: 1.0196, test_f1: 0.4535
 epoch: 8, train_loss: 0.9969, test_loss: 0.9656, test_f1: 0.5031
 epoch: 9, train_loss: 0.9747, test_loss: 0.9868, test_f1: 0.4782
 epoch: 10, train_loss: 0.9533, test_loss: 1.0041, test_f1: 0.4759
 epoch: 11, train_loss: 0.9407, test_loss: 1.0077, test_f1: 0.4920
 epoch: 12, train_loss: 0.9315, test_loss: 0.9633, test_f1: 0.5147
 epoch: 13, train_loss: 0.9161, test_loss: 0.9447, test_f1: 0.5174
 epoch: 14, train_loss: 0.9156, test_loss: 0.9843, test_f1: 0.5256
 epoch: 15, train_loss: 0.9131, test_loss: 0.9309, test_f1: 0.4917
 epoch: 16, train_loss: 0.9093, test_loss: 0.9915, test_f1: 0.5255
 epoch: 17, train_loss: 0.9108, test_loss: 1.0384, test_f1: 0.5307
 epoch: 18, train_loss: 0.8974, test_loss: 0.9618, test_f1: 0.5260
 epoch: 19, train_loss: 0.9013, test_loss: 1.0452, test_f1: 0.4852
 epoch: 20, train_loss: 0.8968, test_loss: 0.9010, test_f1: 0.5277
 epoch: 21, train_loss: 0.8941, test_loss: 0.9825, test_f1: 0.4970
 epoch: 22, train_loss: 0.8896, test_loss: 1.0861, test_f1: 0.5040
 epoch: 23, train_loss: 0.8745, test_loss: 0.9676, test_f1: 0.5160
 epoch: 24, train_loss: 0.8606, test_loss: 0.9634, test_f1: 0.5045
 epoch: 25, train_loss: 0.8777, test_loss: 0.8919, test_f1: 0.5192
 epoch: 26, train_loss: 0.8704, test_loss: 0.9927, test_f1: 0.4964
 epoch: 27, train_loss: 0.8580, test_loss: 0.9743, test_f1: 0.5239
 epoch: 28, train_loss: 0.8691, test_loss: 1.0560, test_f1: 0.4824
 epoch: 29, train_loss: 0.8664, test_loss: 0.9501, test_f1: 0.5401
 epoch: 30, train_loss: 0.8710, test_loss: 0.9256, test_f1: 0.4990
 epoch: 31, train_loss: 0.8618, test_loss: 0.9546, test_f1: 0.5331
 epoch: 32, train_loss: 0.8524, test_loss: 0.9052, test_f1: 0.5298
 epoch: 33, train_loss: 0.8595, test_loss: 1.0961, test_f1: 0.5062
 epoch: 34, train_loss: 0.8369, test_loss: 0.8931, test_f1: 0.5354
 epoch: 35, train_loss: 0.8519, test_loss: 0.9824, test_f1: 0.4985
 epoch: 36, train_loss: 0.8444, test_loss: 0.9813, test_f1: 0.5277
 epoch: 37, train_loss: 0.8382, test_loss: 0.9271, test_f1: 0.5548
 epoch: 38, train_loss: 0.8507, test_loss: 0.9775, test_f1: 0.5029
 epoch: 39, train_loss: 0.8385, test_loss: 0.9581, test_f1: 0.5414
 epoch: 40, train_loss: 0.8394, test_loss: 1.0363, test_f1: 0.4912
 epoch: 41, train_loss: 0.8551, test_loss: 0.9711, test_f1: 0.4635
 epoch: 42, train_loss: 0.8596, test_loss: 0.9258, test_f1: 0.5260
 epoch: 43, train_loss: 0.8396, test_loss: 0.8990, test_f1: 0.5176
 epoch: 44, train_loss: 0.8311, test_loss: 0.9742, test_f1: 0.5252
 epoch: 45, train_loss: 0.8226, test_loss: 0.9801, test_f1: 0.5550
 epoch: 46, train_loss: 0.8355, test_loss: 1.1454, test_f1: 0.4961
 epoch: 47, train_loss: 0.8497, test_loss: 1.2267, test_f1: 0.5307
 epoch: 48, train_loss: 0.8350, test_loss: 0.9514, test_f1: 0.5099
 epoch: 49, train_loss: 0.8197, test_loss: 0.9348, test_f1: 0.5744
 epoch: 50, train_loss: 0.8176, test_loss: 0.9257, test_f1: 0.5847
 epoch: 51, train_loss: 0.8175, test_loss: 1.0181, test_f1: 0.5460
 epoch: 52, train_loss: 0.8051, test_loss: 0.9316, test_f1: 0.5527
 epoch: 53, train_loss: 0.8063, test_loss: 0.8404, test_f1: 0.5566
 epoch: 54, train_loss: 0.8067, test_loss: 0.9492, test_f1: 0.5434
 epoch: 55, train_loss: 0.7876, test_loss: 0.9197, test_f1: 0.5737
 epoch: 56, train_loss: 0.7842, test_loss: 0.8966, test_f1: 0.5677
 epoch: 57, train_loss: 0.7938, test_loss: 0.9878, test_f1: 0.5637
 epoch: 58, train_loss: 0.7899, test_loss: 1.0410, test_f1: 0.5259
 epoch: 59, train_loss: 0.7999, test_loss: 0.9572, test_f1: 0.5743
 epoch: 60, train_loss: 0.7939, test_loss: 0.9278, test_f1: 0.5883
 epoch: 61, train_loss: 0.7867, test_loss: 0.9958, test_f1: 0.5259
 epoch: 62, train_loss: 0.7847, test_loss: 0.9840, test_f1: 0.5258
 epoch: 63, train_loss: 0.7770, test_loss: 0.8491, test_f1: 0.5582
 epoch: 64, train_loss: 0.7716, test_loss: 0.9844, test_f1: 0.5431
 epoch: 65, train_loss: 0.7863, test_loss: 0.9768, test_f1: 0.5416
 epoch: 66, train_loss: 0.7782, test_loss: 0.9972, test_f1: 0.5586
 epoch: 67, train_loss: 0.7690, test_loss: 0.9074, test_f1: 0.5447
 epoch: 68, train_loss: 0.7796, test_loss: 1.0769, test_f1: 0.5434
 epoch: 69, train_loss: 0.7726, test_loss: 0.9577, test_f1: 0.5886
 epoch: 70, train_loss: 0.7841, test_loss: 0.9584, test_f1: 0.5538
 epoch: 71, train_loss: 0.7705, test_loss: 1.0009, test_f1: 0.5812
 epoch: 72, train_loss: 0.7701, test_loss: 0.9702, test_f1: 0.5713
 epoch: 73, train_loss: 0.7619, test_loss: 1.0299, test_f1: 0.5741
 epoch: 74, train_loss: 0.7752, test_loss: 0.9411, test_f1: 0.5541
 epoch: 75, train_loss: 0.7776, test_loss: 0.9453, test_f1: 0.5502
 epoch: 76, train_loss: 0.7644, test_loss: 0.9940, test_f1: 0.5326
 epoch: 77, train_loss: 0.7621, test_loss: 0.9331, test_f1: 0.5467
 epoch: 78, train_loss: 0.7725, test_loss: 0.9894, test_f1: 0.5470
 epoch: 79, train_loss: 0.7560, test_loss: 1.0976, test_f1: 0.5797
 epoch: 80, train_loss: 0.7616, test_loss: 0.9483, test_f1: 0.5620
 epoch: 81, train_loss: 0.7639, test_loss: 0.9499, test_f1: 0.5994
 epoch: 82, train_loss: 0.7506, test_loss: 0.9286, test_f1: 0.5970
 epoch: 83, train_loss: 0.7550, test_loss: 0.9908, test_f1: 0.6007
 epoch: 84, train_loss: 0.7554, test_loss: 1.0038, test_f1: 0.5886
 epoch: 85, train_loss: 0.7481, test_loss: 1.0357, test_f1: 0.5866
 epoch: 86, train_loss: 0.7577, test_loss: 0.9891, test_f1: 0.5898
 epoch: 87, train_loss: 0.7543, test_loss: 1.0620, test_f1: 0.5726
 epoch: 88, train_loss: 0.7522, test_loss: 1.0196, test_f1: 0.5577
 epoch: 89, train_loss: 0.7586, test_loss: 1.1016, test_f1: 0.5866
 epoch: 90, train_loss: 0.7671, test_loss: 0.9598, test_f1: 0.5840
 epoch: 91, train_loss: 0.7742, test_loss: 0.9303, test_f1: 0.5952
 epoch: 92, train_loss: 0.7681, test_loss: 0.9705, test_f1: 0.5578
 epoch: 93, train_loss: 0.7520, test_loss: 1.0451, test_f1: 0.5727
 epoch: 94, train_loss: 0.7622, test_loss: 1.0283, test_f1: 0.5414
 epoch: 95, train_loss: 0.7372, test_loss: 1.0123, test_f1: 0.5758
 epoch: 96, train_loss: 0.7470, test_loss: 0.9194, test_f1: 0.5712
 epoch: 97, train_loss: 0.7433, test_loss: 1.0128, test_f1: 0.5779
 epoch: 98, train_loss: 0.7687, test_loss: 0.9677, test_f1: 0.5712
 epoch: 99, train_loss: 0.7667, test_loss: 1.0340, test_f1: 0.5430
##################ITERATION #2 ****************************************
 epoch: 0, train_loss: 1.3051, test_loss: 1.2655, test_f1: 0.2270
 epoch: 1, train_loss: 1.1455, test_loss: 1.2360, test_f1: 0.2270
 epoch: 2, train_loss: 1.0935, test_loss: 1.1188, test_f1: 0.3320
 epoch: 3, train_loss: 1.0608, test_loss: 1.0653, test_f1: 0.3814
 epoch: 4, train_loss: 1.0415, test_loss: 1.0599, test_f1: 0.4538
 epoch: 5, train_loss: 1.0243, test_loss: 1.0306, test_f1: 0.4636
 epoch: 6, train_loss: 1.0003, test_loss: 1.0754, test_f1: 0.3934
 epoch: 7, train_loss: 0.9822, test_loss: 1.0857, test_f1: 0.4667
 epoch: 8, train_loss: 0.9810, test_loss: 1.0251, test_f1: 0.4699
 epoch: 9, train_loss: 0.9823, test_loss: 1.1592, test_f1: 0.3972
 epoch: 10, train_loss: 0.9621, test_loss: 0.9919, test_f1: 0.4829
 epoch: 11, train_loss: 0.9547, test_loss: 1.0902, test_f1: 0.4555
 epoch: 12, train_loss: 0.9378, test_loss: 1.0298, test_f1: 0.5014
 epoch: 13, train_loss: 0.9205, test_loss: 0.9798, test_f1: 0.4624
 epoch: 14, train_loss: 0.9304, test_loss: 0.9556, test_f1: 0.5176
 epoch: 15, train_loss: 0.9187, test_loss: 0.9987, test_f1: 0.4883
 epoch: 16, train_loss: 0.9197, test_loss: 1.0369, test_f1: 0.4892
 epoch: 17, train_loss: 0.8975, test_loss: 0.9565, test_f1: 0.4977
 epoch: 18, train_loss: 0.8947, test_loss: 1.0981, test_f1: 0.5013
 epoch: 19, train_loss: 0.8911, test_loss: 0.9511, test_f1: 0.4972
 epoch: 20, train_loss: 0.8829, test_loss: 0.9706, test_f1: 0.5263
 epoch: 21, train_loss: 0.8727, test_loss: 1.0145, test_f1: 0.5059
 epoch: 22, train_loss: 0.8848, test_loss: 0.9959, test_f1: 0.4979
 epoch: 23, train_loss: 0.8873, test_loss: 0.9987, test_f1: 0.5394
 epoch: 24, train_loss: 0.8704, test_loss: 0.9496, test_f1: 0.5630
 epoch: 25, train_loss: 0.8698, test_loss: 1.0135, test_f1: 0.5178
 epoch: 26, train_loss: 0.8766, test_loss: 1.2090, test_f1: 0.4746
 epoch: 27, train_loss: 0.8682, test_loss: 0.9866, test_f1: 0.5018
 epoch: 28, train_loss: 0.8674, test_loss: 0.9780, test_f1: 0.5297
 epoch: 29, train_loss: 0.8620, test_loss: 0.9829, test_f1: 0.5328
 epoch: 30, train_loss: 0.8521, test_loss: 1.1331, test_f1: 0.4892
 epoch: 31, train_loss: 0.8706, test_loss: 0.9718, test_f1: 0.5516
 epoch: 32, train_loss: 0.8535, test_loss: 0.9858, test_f1: 0.5131
 epoch: 33, train_loss: 0.8532, test_loss: 0.9234, test_f1: 0.5335
 epoch: 34, train_loss: 0.8406, test_loss: 0.9826, test_f1: 0.5236
 epoch: 35, train_loss: 0.8365, test_loss: 0.9966, test_f1: 0.5019
 epoch: 36, train_loss: 0.8323, test_loss: 0.9381, test_f1: 0.5492
 epoch: 37, train_loss: 0.8363, test_loss: 0.9915, test_f1: 0.5056
 epoch: 38, train_loss: 0.8293, test_loss: 0.9567, test_f1: 0.5615
 epoch: 39, train_loss: 0.8391, test_loss: 1.0127, test_f1: 0.5470
 epoch: 40, train_loss: 0.8290, test_loss: 0.9794, test_f1: 0.5543
 epoch: 41, train_loss: 0.8366, test_loss: 1.0738, test_f1: 0.4982
 epoch: 42, train_loss: 0.8279, test_loss: 0.9993, test_f1: 0.5520
 epoch: 43, train_loss: 0.8294, test_loss: 1.0258, test_f1: 0.5458
 epoch: 44, train_loss: 0.8284, test_loss: 1.0475, test_f1: 0.5448
 epoch: 45, train_loss: 0.8299, test_loss: 0.9450, test_f1: 0.5620
 epoch: 46, train_loss: 0.8307, test_loss: 1.0111, test_f1: 0.5217
 epoch: 47, train_loss: 0.8180, test_loss: 1.0040, test_f1: 0.5260
 epoch: 48, train_loss: 0.8286, test_loss: 0.9682, test_f1: 0.5711
 epoch: 49, train_loss: 0.8015, test_loss: 0.9220, test_f1: 0.5480
 epoch: 50, train_loss: 0.8225, test_loss: 0.9687, test_f1: 0.5545
 epoch: 51, train_loss: 0.8072, test_loss: 0.9390, test_f1: 0.5878
 epoch: 52, train_loss: 0.7839, test_loss: 0.9429, test_f1: 0.5714
 epoch: 53, train_loss: 0.7832, test_loss: 1.0231, test_f1: 0.5498
 epoch: 54, train_loss: 0.8020, test_loss: 0.9258, test_f1: 0.5659
 epoch: 55, train_loss: 0.7786, test_loss: 0.9382, test_f1: 0.5965
 epoch: 56, train_loss: 0.7847, test_loss: 1.0824, test_f1: 0.5359
 epoch: 57, train_loss: 0.7818, test_loss: 0.9411, test_f1: 0.5608
 epoch: 58, train_loss: 0.7750, test_loss: 0.9444, test_f1: 0.5457
 epoch: 59, train_loss: 0.7813, test_loss: 0.9681, test_f1: 0.5776
 epoch: 60, train_loss: 0.7773, test_loss: 0.9622, test_f1: 0.5909
 epoch: 61, train_loss: 0.7724, test_loss: 0.9585, test_f1: 0.5721
 epoch: 62, train_loss: 0.7694, test_loss: 0.9798, test_f1: 0.5630
 epoch: 63, train_loss: 0.7651, test_loss: 0.9877, test_f1: 0.5391
 epoch: 64, train_loss: 0.7757, test_loss: 0.9513, test_f1: 0.5865
 epoch: 65, train_loss: 0.7749, test_loss: 0.9576, test_f1: 0.5801
 epoch: 66, train_loss: 0.7659, test_loss: 0.9388, test_f1: 0.5735
 epoch: 67, train_loss: 0.7577, test_loss: 0.9979, test_f1: 0.5144
 epoch: 68, train_loss: 0.7648, test_loss: 0.9574, test_f1: 0.5619
 epoch: 69, train_loss: 0.7679, test_loss: 1.0054, test_f1: 0.5568
 epoch: 70, train_loss: 0.7602, test_loss: 0.9586, test_f1: 0.5704
 epoch: 71, train_loss: 0.7589, test_loss: 0.9452, test_f1: 0.5925
 epoch: 72, train_loss: 0.7530, test_loss: 0.9387, test_f1: 0.5763
 epoch: 73, train_loss: 0.7629, test_loss: 0.9764, test_f1: 0.5761
 epoch: 74, train_loss: 0.7680, test_loss: 0.9134, test_f1: 0.5819
 epoch: 75, train_loss: 0.7606, test_loss: 0.9349, test_f1: 0.5684
 epoch: 76, train_loss: 0.7547, test_loss: 0.9472, test_f1: 0.5756
 epoch: 77, train_loss: 0.7516, test_loss: 0.9408, test_f1: 0.5722
 epoch: 78, train_loss: 0.7481, test_loss: 0.9364, test_f1: 0.5727
 epoch: 79, train_loss: 0.7462, test_loss: 0.9536, test_f1: 0.5440
 epoch: 80, train_loss: 0.7475, test_loss: 0.9283, test_f1: 0.5818
 epoch: 81, train_loss: 0.7519, test_loss: 1.0072, test_f1: 0.5722
 epoch: 82, train_loss: 0.7605, test_loss: 0.9747, test_f1: 0.5678
 epoch: 83, train_loss: 0.7641, test_loss: 0.9408, test_f1: 0.5802
 epoch: 84, train_loss: 0.7536, test_loss: 1.0028, test_f1: 0.5464
 epoch: 85, train_loss: 0.7369, test_loss: 0.9414, test_f1: 0.5748
 epoch: 86, train_loss: 0.7396, test_loss: 1.0052, test_f1: 0.5694
 epoch: 87, train_loss: 0.7577, test_loss: 0.9407, test_f1: 0.5701
 epoch: 88, train_loss: 0.7421, test_loss: 0.9902, test_f1: 0.5324
 epoch: 89, train_loss: 0.7419, test_loss: 0.9874, test_f1: 0.5637
 epoch: 90, train_loss: 0.7467, test_loss: 1.0004, test_f1: 0.5392
 epoch: 91, train_loss: 0.7433, test_loss: 1.0103, test_f1: 0.5672
 epoch: 92, train_loss: 0.7408, test_loss: 0.9478, test_f1: 0.5630
 epoch: 93, train_loss: 0.7267, test_loss: 1.0245, test_f1: 0.5688
 epoch: 94, train_loss: 0.7340, test_loss: 0.9574, test_f1: 0.5673
 epoch: 95, train_loss: 0.7344, test_loss: 0.9451, test_f1: 0.5842
 epoch: 96, train_loss: 0.7322, test_loss: 0.9433, test_f1: 0.5805
 epoch: 97, train_loss: 0.7358, test_loss: 1.0934, test_f1: 0.4927
 epoch: 98, train_loss: 0.7617, test_loss: 0.9871, test_f1: 0.5708
 epoch: 99, train_loss: 0.7391, test_loss: 0.9277, test_f1: 0.5743
##################ITERATION #3 ****************************************
 epoch: 0, train_loss: 1.4344, test_loss: 1.2632, test_f1: 0.2270
 epoch: 1, train_loss: 1.1647, test_loss: 1.2050, test_f1: 0.2270
 epoch: 2, train_loss: 1.0905, test_loss: 1.1352, test_f1: 0.4140
 epoch: 3, train_loss: 1.0617, test_loss: 1.1143, test_f1: 0.3977
 epoch: 4, train_loss: 1.0372, test_loss: 1.0866, test_f1: 0.4042
 epoch: 5, train_loss: 1.0366, test_loss: 1.0680, test_f1: 0.4459
 epoch: 6, train_loss: 1.0114, test_loss: 1.0764, test_f1: 0.4567
 epoch: 7, train_loss: 0.9962, test_loss: 1.0300, test_f1: 0.4701
 epoch: 8, train_loss: 0.9912, test_loss: 1.0419, test_f1: 0.4984
 epoch: 9, train_loss: 0.9835, test_loss: 1.0606, test_f1: 0.4370
 epoch: 10, train_loss: 0.9628, test_loss: 1.0166, test_f1: 0.4527
 epoch: 11, train_loss: 0.9642, test_loss: 1.0305, test_f1: 0.4467
 epoch: 12, train_loss: 0.9527, test_loss: 1.0334, test_f1: 0.4556
 epoch: 13, train_loss: 0.9329, test_loss: 1.0313, test_f1: 0.4620
 epoch: 14, train_loss: 0.9206, test_loss: 1.0630, test_f1: 0.4385
 epoch: 15, train_loss: 0.9168, test_loss: 1.0520, test_f1: 0.5430
 epoch: 16, train_loss: 0.9181, test_loss: 1.1147, test_f1: 0.4347
 epoch: 17, train_loss: 0.9066, test_loss: 1.0089, test_f1: 0.5349
 epoch: 18, train_loss: 0.8904, test_loss: 0.9674, test_f1: 0.4885
 epoch: 19, train_loss: 0.8955, test_loss: 1.0704, test_f1: 0.4549
 epoch: 20, train_loss: 0.8866, test_loss: 1.0179, test_f1: 0.5245
 epoch: 21, train_loss: 0.8990, test_loss: 1.0159, test_f1: 0.5578
 epoch: 22, train_loss: 0.8783, test_loss: 0.9952, test_f1: 0.5277
 epoch: 23, train_loss: 0.8681, test_loss: 1.0128, test_f1: 0.4691
 epoch: 24, train_loss: 0.8801, test_loss: 0.9747, test_f1: 0.5320
 epoch: 25, train_loss: 0.8539, test_loss: 1.0925, test_f1: 0.4667
 epoch: 26, train_loss: 0.8757, test_loss: 1.0179, test_f1: 0.4929
 epoch: 27, train_loss: 0.8613, test_loss: 1.0781, test_f1: 0.5099
 epoch: 28, train_loss: 0.8624, test_loss: 1.0275, test_f1: 0.4906
 epoch: 29, train_loss: 0.8484, test_loss: 1.0499, test_f1: 0.4967
 epoch: 30, train_loss: 0.8460, test_loss: 1.0308, test_f1: 0.5650
 epoch: 31, train_loss: 0.8528, test_loss: 1.0387, test_f1: 0.4984
 epoch: 32, train_loss: 0.8472, test_loss: 1.1186, test_f1: 0.5161
 epoch: 33, train_loss: 0.8499, test_loss: 0.9491, test_f1: 0.5264
 epoch: 34, train_loss: 0.8349, test_loss: 1.0309, test_f1: 0.5637
 epoch: 35, train_loss: 0.8494, test_loss: 1.0974, test_f1: 0.4773
 epoch: 36, train_loss: 0.8394, test_loss: 1.0648, test_f1: 0.5150
 epoch: 37, train_loss: 0.8316, test_loss: 1.0865, test_f1: 0.5034
 epoch: 38, train_loss: 0.8414, test_loss: 1.0302, test_f1: 0.5389
 epoch: 39, train_loss: 0.8292, test_loss: 1.1244, test_f1: 0.5208
 epoch: 40, train_loss: 0.8335, test_loss: 1.0569, test_f1: 0.5593
 epoch: 41, train_loss: 0.8211, test_loss: 1.0312, test_f1: 0.5038
 epoch: 42, train_loss: 0.8252, test_loss: 1.0139, test_f1: 0.5696
 epoch: 43, train_loss: 0.8129, test_loss: 1.0075, test_f1: 0.5202
 epoch: 44, train_loss: 0.8192, test_loss: 1.0069, test_f1: 0.5277
 epoch: 45, train_loss: 0.8186, test_loss: 1.1462, test_f1: 0.4887
 epoch: 46, train_loss: 0.8047, test_loss: 1.0750, test_f1: 0.5365
 epoch: 47, train_loss: 0.8175, test_loss: 1.0609, test_f1: 0.5435
 epoch: 48, train_loss: 0.8061, test_loss: 1.0105, test_f1: 0.5743
 epoch: 49, train_loss: 0.8067, test_loss: 1.0450, test_f1: 0.5114
 epoch: 50, train_loss: 0.8141, test_loss: 0.9835, test_f1: 0.5921
 epoch: 51, train_loss: 0.7901, test_loss: 1.0317, test_f1: 0.5256
 epoch: 52, train_loss: 0.7869, test_loss: 1.0361, test_f1: 0.5544
 epoch: 53, train_loss: 0.7623, test_loss: 1.0168, test_f1: 0.5637
 epoch: 54, train_loss: 0.7793, test_loss: 1.0232, test_f1: 0.5606
 epoch: 55, train_loss: 0.7613, test_loss: 1.0115, test_f1: 0.5639
 epoch: 56, train_loss: 0.7566, test_loss: 1.0303, test_f1: 0.5719
 epoch: 57, train_loss: 0.7651, test_loss: 1.0410, test_f1: 0.5680
 epoch: 58, train_loss: 0.7811, test_loss: 1.0298, test_f1: 0.5331
 epoch: 59, train_loss: 0.7765, test_loss: 0.9953, test_f1: 0.5428
 epoch: 60, train_loss: 0.7607, test_loss: 0.9570, test_f1: 0.5617
 epoch: 61, train_loss: 0.7492, test_loss: 1.0401, test_f1: 0.5635
 epoch: 62, train_loss: 0.7630, test_loss: 0.9940, test_f1: 0.5683
 epoch: 63, train_loss: 0.7522, test_loss: 1.0495, test_f1: 0.5728
 epoch: 64, train_loss: 0.7577, test_loss: 1.0140, test_f1: 0.5372
 epoch: 65, train_loss: 0.7502, test_loss: 1.0024, test_f1: 0.5805
 epoch: 66, train_loss: 0.7717, test_loss: 1.0280, test_f1: 0.5375
 epoch: 67, train_loss: 0.7633, test_loss: 1.0435, test_f1: 0.5366
 epoch: 68, train_loss: 0.7598, test_loss: 1.0470, test_f1: 0.5257
 epoch: 69, train_loss: 0.7429, test_loss: 1.0686, test_f1: 0.5307
 epoch: 70, train_loss: 0.7507, test_loss: 1.0145, test_f1: 0.5594
 epoch: 71, train_loss: 0.7401, test_loss: 1.0033, test_f1: 0.5801
 epoch: 72, train_loss: 0.7411, test_loss: 1.0128, test_f1: 0.5304
 epoch: 73, train_loss: 0.7485, test_loss: 1.0344, test_f1: 0.5624
 epoch: 74, train_loss: 0.7543, test_loss: 1.0550, test_f1: 0.5568
 epoch: 75, train_loss: 0.7675, test_loss: 0.9586, test_f1: 0.5881
 epoch: 76, train_loss: 0.7369, test_loss: 1.0041, test_f1: 0.5601
 epoch: 77, train_loss: 0.7427, test_loss: 1.1045, test_f1: 0.5329
 epoch: 78, train_loss: 0.7353, test_loss: 1.0867, test_f1: 0.5477
 epoch: 79, train_loss: 0.7654, test_loss: 1.0209, test_f1: 0.5678
 epoch: 80, train_loss: 0.7392, test_loss: 1.0038, test_f1: 0.5667
 epoch: 81, train_loss: 0.7465, test_loss: 1.0366, test_f1: 0.5512
 epoch: 82, train_loss: 0.7311, test_loss: 1.0286, test_f1: 0.5619
 epoch: 83, train_loss: 0.7402, test_loss: 1.0188, test_f1: 0.5873
 epoch: 84, train_loss: 0.7501, test_loss: 1.0896, test_f1: 0.5409
 epoch: 85, train_loss: 0.7331, test_loss: 1.0273, test_f1: 0.5437
 epoch: 86, train_loss: 0.7315, test_loss: 1.0245, test_f1: 0.5561
 epoch: 87, train_loss: 0.7320, test_loss: 1.0390, test_f1: 0.5513
 epoch: 88, train_loss: 0.7212, test_loss: 1.0424, test_f1: 0.5669
 epoch: 89, train_loss: 0.7200, test_loss: 1.0626, test_f1: 0.5814
 epoch: 90, train_loss: 0.7330, test_loss: 1.0248, test_f1: 0.5432
 epoch: 91, train_loss: 0.7407, test_loss: 0.9898, test_f1: 0.5673
 epoch: 92, train_loss: 0.7275, test_loss: 0.9826, test_f1: 0.5937
 epoch: 93, train_loss: 0.7346, test_loss: 0.9790, test_f1: 0.5644
 epoch: 94, train_loss: 0.7123, test_loss: 1.0113, test_f1: 0.5641
 epoch: 95, train_loss: 0.7179, test_loss: 1.0495, test_f1: 0.5674
 epoch: 96, train_loss: 0.7130, test_loss: 1.0108, test_f1: 0.5729
 epoch: 97, train_loss: 0.7136, test_loss: 0.9844, test_f1: 0.5694
 epoch: 98, train_loss: 0.7172, test_loss: 1.0030, test_f1: 0.5408
 epoch: 99, train_loss: 0.7188, test_loss: 1.0468, test_f1: 0.5668
##################ITERATION #4 ****************************************
 epoch: 0, train_loss: 1.4775, test_loss: 1.3284, test_f1: 0.2270
 epoch: 1, train_loss: 1.2374, test_loss: 1.2284, test_f1: 0.2400
 epoch: 2, train_loss: 1.1932, test_loss: 1.1702, test_f1: 0.3075
 epoch: 3, train_loss: 1.1607, test_loss: 1.1445, test_f1: 0.3274
 epoch: 4, train_loss: 1.1311, test_loss: 1.1054, test_f1: 0.3515
 epoch: 5, train_loss: 1.1003, test_loss: 1.1216, test_f1: 0.3716
 epoch: 6, train_loss: 1.0703, test_loss: 1.0997, test_f1: 0.3706
 epoch: 7, train_loss: 1.0451, test_loss: 1.1075, test_f1: 0.3878
 epoch: 8, train_loss: 1.0348, test_loss: 1.2141, test_f1: 0.3638
 epoch: 9, train_loss: 1.0204, test_loss: 1.0886, test_f1: 0.4014
 epoch: 10, train_loss: 1.0063, test_loss: 1.0296, test_f1: 0.4664
 epoch: 11, train_loss: 0.9762, test_loss: 1.0640, test_f1: 0.4860
 epoch: 12, train_loss: 0.9824, test_loss: 1.0380, test_f1: 0.5093
 epoch: 13, train_loss: 0.9653, test_loss: 1.2031, test_f1: 0.4445
 epoch: 14, train_loss: 0.9524, test_loss: 1.0175, test_f1: 0.5278
 epoch: 15, train_loss: 0.9635, test_loss: 1.1984, test_f1: 0.4474
 epoch: 16, train_loss: 0.9369, test_loss: 1.0233, test_f1: 0.5624
 epoch: 17, train_loss: 0.9353, test_loss: 1.0932, test_f1: 0.5183
 epoch: 18, train_loss: 0.9219, test_loss: 1.0179, test_f1: 0.5206
 epoch: 19, train_loss: 0.9237, test_loss: 1.1100, test_f1: 0.4365
 epoch: 20, train_loss: 0.9226, test_loss: 1.0141, test_f1: 0.5180
 epoch: 21, train_loss: 0.9076, test_loss: 1.1713, test_f1: 0.4921
 epoch: 22, train_loss: 0.8955, test_loss: 1.0217, test_f1: 0.5405
 epoch: 23, train_loss: 0.9044, test_loss: 1.0467, test_f1: 0.5371
 epoch: 24, train_loss: 0.8945, test_loss: 1.0330, test_f1: 0.5179
 epoch: 25, train_loss: 0.8961, test_loss: 1.0386, test_f1: 0.5497
 epoch: 26, train_loss: 0.8869, test_loss: 1.2261, test_f1: 0.4736
 epoch: 27, train_loss: 0.8902, test_loss: 1.1366, test_f1: 0.5118
 epoch: 28, train_loss: 0.8867, test_loss: 1.0262, test_f1: 0.5531
 epoch: 29, train_loss: 0.8772, test_loss: 1.0245, test_f1: 0.5360
 epoch: 30, train_loss: 0.8663, test_loss: 1.1330, test_f1: 0.5357
 epoch: 31, train_loss: 0.8659, test_loss: 1.0599, test_f1: 0.5207
 epoch: 32, train_loss: 0.8705, test_loss: 1.1901, test_f1: 0.4669
 epoch: 33, train_loss: 0.8678, test_loss: 1.0156, test_f1: 0.5143
 epoch: 34, train_loss: 0.8783, test_loss: 1.1611, test_f1: 0.4777
 epoch: 35, train_loss: 0.8674, test_loss: 1.2937, test_f1: 0.4458
 epoch: 36, train_loss: 0.8772, test_loss: 1.0119, test_f1: 0.5349
 epoch: 37, train_loss: 0.8742, test_loss: 0.9931, test_f1: 0.5581
 epoch: 38, train_loss: 0.8543, test_loss: 1.0175, test_f1: 0.5201
 epoch: 39, train_loss: 0.8504, test_loss: 1.0702, test_f1: 0.5065
 epoch: 40, train_loss: 0.8516, test_loss: 1.0555, test_f1: 0.5239
 epoch: 41, train_loss: 0.8524, test_loss: 0.9859, test_f1: 0.5540
 epoch: 42, train_loss: 0.8578, test_loss: 1.0510, test_f1: 0.5299
 epoch: 43, train_loss: 0.8396, test_loss: 1.0130, test_f1: 0.5457
 epoch: 44, train_loss: 0.8346, test_loss: 1.0982, test_f1: 0.5339
 epoch: 45, train_loss: 0.8399, test_loss: 1.0451, test_f1: 0.5151
 epoch: 46, train_loss: 0.8330, test_loss: 1.0597, test_f1: 0.5183
 epoch: 47, train_loss: 0.8211, test_loss: 0.9754, test_f1: 0.5498
 epoch: 48, train_loss: 0.8191, test_loss: 1.0700, test_f1: 0.5503
 epoch: 49, train_loss: 0.8124, test_loss: 1.0693, test_f1: 0.5185
 epoch: 50, train_loss: 0.8341, test_loss: 1.0150, test_f1: 0.5685
 epoch: 51, train_loss: 0.8201, test_loss: 1.0425, test_f1: 0.5248
 epoch: 52, train_loss: 0.8097, test_loss: 1.0044, test_f1: 0.5469
 epoch: 53, train_loss: 0.7947, test_loss: 1.0230, test_f1: 0.5614
 epoch: 54, train_loss: 0.7963, test_loss: 1.0283, test_f1: 0.5580
 epoch: 55, train_loss: 0.8032, test_loss: 0.9934, test_f1: 0.5573
 epoch: 56, train_loss: 0.7978, test_loss: 1.0210, test_f1: 0.5477
 epoch: 57, train_loss: 0.7966, test_loss: 1.0456, test_f1: 0.5636
 epoch: 58, train_loss: 0.7822, test_loss: 1.0004, test_f1: 0.5535
 epoch: 59, train_loss: 0.7792, test_loss: 1.0282, test_f1: 0.5663
 epoch: 60, train_loss: 0.7778, test_loss: 1.0264, test_f1: 0.5695
 epoch: 61, train_loss: 0.7870, test_loss: 1.0210, test_f1: 0.5419
 epoch: 62, train_loss: 0.7864, test_loss: 1.0566, test_f1: 0.5443
 epoch: 63, train_loss: 0.7851, test_loss: 1.0403, test_f1: 0.5477
 epoch: 64, train_loss: 0.7863, test_loss: 1.0234, test_f1: 0.5490
 epoch: 65, train_loss: 0.8017, test_loss: 0.9963, test_f1: 0.5582
 epoch: 66, train_loss: 0.7825, test_loss: 1.0152, test_f1: 0.5524
 epoch: 67, train_loss: 0.7892, test_loss: 1.0073, test_f1: 0.5502
 epoch: 68, train_loss: 0.7836, test_loss: 1.0096, test_f1: 0.5823
 epoch: 69, train_loss: 0.7696, test_loss: 1.0286, test_f1: 0.5515
 epoch: 70, train_loss: 0.7693, test_loss: 0.9987, test_f1: 0.5687
 epoch: 71, train_loss: 0.7783, test_loss: 1.0022, test_f1: 0.5635
 epoch: 72, train_loss: 0.7678, test_loss: 1.0850, test_f1: 0.5424
 epoch: 73, train_loss: 0.7741, test_loss: 0.9951, test_f1: 0.5741
 epoch: 74, train_loss: 0.7687, test_loss: 1.0208, test_f1: 0.5507
 epoch: 75, train_loss: 0.7640, test_loss: 1.1382, test_f1: 0.5703
 epoch: 76, train_loss: 0.7717, test_loss: 1.0064, test_f1: 0.5620
 epoch: 77, train_loss: 0.7590, test_loss: 0.9844, test_f1: 0.5589
 epoch: 78, train_loss: 0.7662, test_loss: 1.0207, test_f1: 0.5848
 epoch: 79, train_loss: 0.7654, test_loss: 1.0938, test_f1: 0.5000
 epoch: 80, train_loss: 0.7623, test_loss: 0.9934, test_f1: 0.5763
 epoch: 81, train_loss: 0.7648, test_loss: 0.9859, test_f1: 0.5583
 epoch: 82, train_loss: 0.7659, test_loss: 0.9904, test_f1: 0.5533
 epoch: 83, train_loss: 0.7627, test_loss: 0.9818, test_f1: 0.5545
 epoch: 84, train_loss: 0.7566, test_loss: 0.9986, test_f1: 0.5800
 epoch: 85, train_loss: 0.7644, test_loss: 1.0236, test_f1: 0.5617
 epoch: 86, train_loss: 0.7664, test_loss: 0.9847, test_f1: 0.5762
 epoch: 87, train_loss: 0.7450, test_loss: 0.9903, test_f1: 0.5572
 epoch: 88, train_loss: 0.7484, test_loss: 0.9835, test_f1: 0.5584
 epoch: 89, train_loss: 0.7470, test_loss: 0.9849, test_f1: 0.5827
 epoch: 90, train_loss: 0.7461, test_loss: 1.0002, test_f1: 0.5694
 epoch: 91, train_loss: 0.7440, test_loss: 1.0299, test_f1: 0.6001
 epoch: 92, train_loss: 0.7454, test_loss: 0.9838, test_f1: 0.5737
 epoch: 93, train_loss: 0.7466, test_loss: 1.0350, test_f1: 0.5873
 epoch: 94, train_loss: 0.7457, test_loss: 1.0089, test_f1: 0.5719
 epoch: 95, train_loss: 0.7334, test_loss: 1.0457, test_f1: 0.5918
 epoch: 96, train_loss: 0.7345, test_loss: 1.0280, test_f1: 0.5482
 epoch: 97, train_loss: 0.7363, test_loss: 0.9760, test_f1: 0.6032
 epoch: 98, train_loss: 0.7384, test_loss: 1.0304, test_f1: 0.5640
 epoch: 99, train_loss: 0.7488, test_loss: 0.9920, test_f1: 0.6181
##################ITERATION #5 ****************************************
 epoch: 0, train_loss: 1.2963, test_loss: 1.2999, test_f1: 0.2270
 epoch: 1, train_loss: 1.1661, test_loss: 1.2570, test_f1: 0.2520
 epoch: 2, train_loss: 1.1073, test_loss: 1.3181, test_f1: 0.2842
 epoch: 3, train_loss: 1.0741, test_loss: 1.0937, test_f1: 0.4358
 epoch: 4, train_loss: 1.0318, test_loss: 0.9767, test_f1: 0.4945
 epoch: 5, train_loss: 1.0215, test_loss: 1.0261, test_f1: 0.4741
 epoch: 6, train_loss: 1.0208, test_loss: 0.9882, test_f1: 0.4863
 epoch: 7, train_loss: 0.9935, test_loss: 1.3594, test_f1: 0.4143
 epoch: 8, train_loss: 0.9968, test_loss: 1.0166, test_f1: 0.4638
 epoch: 9, train_loss: 0.9797, test_loss: 1.0641, test_f1: 0.4749
 epoch: 10, train_loss: 0.9658, test_loss: 1.0179, test_f1: 0.4381
 epoch: 11, train_loss: 0.9610, test_loss: 1.0868, test_f1: 0.4388
 epoch: 12, train_loss: 0.9488, test_loss: 1.0822, test_f1: 0.4667
 epoch: 13, train_loss: 0.9489, test_loss: 1.0222, test_f1: 0.4787
 epoch: 14, train_loss: 0.9389, test_loss: 0.9898, test_f1: 0.4888
 epoch: 15, train_loss: 0.9160, test_loss: 0.9480, test_f1: 0.4940
 epoch: 16, train_loss: 0.9141, test_loss: 0.9925, test_f1: 0.5029
 epoch: 17, train_loss: 0.9161, test_loss: 1.0353, test_f1: 0.4874
 epoch: 18, train_loss: 0.9123, test_loss: 0.9510, test_f1: 0.5396
 epoch: 19, train_loss: 0.8992, test_loss: 1.0273, test_f1: 0.4634
 epoch: 20, train_loss: 0.8933, test_loss: 1.0954, test_f1: 0.4833
 epoch: 21, train_loss: 0.8756, test_loss: 0.9746, test_f1: 0.5611
 epoch: 22, train_loss: 0.8819, test_loss: 0.9663, test_f1: 0.5182
 epoch: 23, train_loss: 0.8776, test_loss: 1.2069, test_f1: 0.4846
 epoch: 24, train_loss: 0.8646, test_loss: 0.9906, test_f1: 0.4861
 epoch: 25, train_loss: 0.8677, test_loss: 0.9047, test_f1: 0.5386
 epoch: 26, train_loss: 0.8712, test_loss: 0.9911, test_f1: 0.5140
 epoch: 27, train_loss: 0.8706, test_loss: 0.9938, test_f1: 0.5168
 epoch: 28, train_loss: 0.8713, test_loss: 1.4484, test_f1: 0.4594
 epoch: 29, train_loss: 0.8662, test_loss: 0.9521, test_f1: 0.5425
 epoch: 30, train_loss: 0.8436, test_loss: 1.0664, test_f1: 0.5622
 epoch: 31, train_loss: 0.8519, test_loss: 1.0908, test_f1: 0.4549
 epoch: 32, train_loss: 0.8402, test_loss: 0.9968, test_f1: 0.5260
 epoch: 33, train_loss: 0.8384, test_loss: 1.1462, test_f1: 0.5013
 epoch: 34, train_loss: 0.8382, test_loss: 1.6707, test_f1: 0.4215
 epoch: 35, train_loss: 0.8424, test_loss: 0.9683, test_f1: 0.5377
 epoch: 36, train_loss: 0.8311, test_loss: 1.0066, test_f1: 0.4792
 epoch: 37, train_loss: 0.8352, test_loss: 0.9924, test_f1: 0.4580
 epoch: 38, train_loss: 0.8456, test_loss: 1.1684, test_f1: 0.5374
 epoch: 39, train_loss: 0.8305, test_loss: 1.2379, test_f1: 0.4697
 epoch: 40, train_loss: 0.8379, test_loss: 1.0295, test_f1: 0.5464
 epoch: 41, train_loss: 0.8461, test_loss: 1.0320, test_f1: 0.5434
 epoch: 42, train_loss: 0.8147, test_loss: 1.0304, test_f1: 0.5287
 epoch: 43, train_loss: 0.8147, test_loss: 0.9700, test_f1: 0.5775
 epoch: 44, train_loss: 0.8135, test_loss: 0.9678, test_f1: 0.5187
 epoch: 45, train_loss: 0.8036, test_loss: 1.0034, test_f1: 0.5622
 epoch: 46, train_loss: 0.8042, test_loss: 0.9677, test_f1: 0.6189
 epoch: 47, train_loss: 0.7990, test_loss: 0.9631, test_f1: 0.5670
 epoch: 48, train_loss: 0.8283, test_loss: 1.0406, test_f1: 0.5097
 epoch: 49, train_loss: 0.8043, test_loss: 1.1630, test_f1: 0.4894
 epoch: 50, train_loss: 0.8053, test_loss: 1.0305, test_f1: 0.5395
 epoch: 51, train_loss: 0.7963, test_loss: 0.9088, test_f1: 0.6055
 epoch: 52, train_loss: 0.7727, test_loss: 0.8864, test_f1: 0.5677
 epoch: 53, train_loss: 0.7738, test_loss: 0.9536, test_f1: 0.5999
 epoch: 54, train_loss: 0.7682, test_loss: 0.9331, test_f1: 0.6066
 epoch: 55, train_loss: 0.7636, test_loss: 0.9429, test_f1: 0.5710
 epoch: 56, train_loss: 0.7570, test_loss: 0.9149, test_f1: 0.5852
 epoch: 57, train_loss: 0.7499, test_loss: 1.0969, test_f1: 0.5420
 epoch: 58, train_loss: 0.7507, test_loss: 0.9340, test_f1: 0.5803
 epoch: 59, train_loss: 0.7581, test_loss: 0.9646, test_f1: 0.5822
 epoch: 60, train_loss: 0.7594, test_loss: 0.9431, test_f1: 0.5696
 epoch: 61, train_loss: 0.7453, test_loss: 1.0493, test_f1: 0.5333
 epoch: 62, train_loss: 0.7620, test_loss: 0.9646, test_f1: 0.5720
 epoch: 63, train_loss: 0.7535, test_loss: 0.9803, test_f1: 0.5585
 epoch: 64, train_loss: 0.7440, test_loss: 0.9963, test_f1: 0.6005
 epoch: 65, train_loss: 0.7496, test_loss: 1.0818, test_f1: 0.5772
 epoch: 66, train_loss: 0.7429, test_loss: 0.9413, test_f1: 0.5943
 epoch: 67, train_loss: 0.7442, test_loss: 0.9622, test_f1: 0.5899
 epoch: 68, train_loss: 0.7359, test_loss: 1.1651, test_f1: 0.5451
 epoch: 69, train_loss: 0.7283, test_loss: 0.9698, test_f1: 0.5919
 epoch: 70, train_loss: 0.7354, test_loss: 1.1108, test_f1: 0.5871
 epoch: 71, train_loss: 0.7336, test_loss: 0.9533, test_f1: 0.6134
 epoch: 72, train_loss: 0.7404, test_loss: 1.0441, test_f1: 0.5722
 epoch: 73, train_loss: 0.7209, test_loss: 1.0340, test_f1: 0.5442
 epoch: 74, train_loss: 0.7369, test_loss: 0.9626, test_f1: 0.6001
 epoch: 75, train_loss: 0.7218, test_loss: 1.0008, test_f1: 0.5775
 epoch: 76, train_loss: 0.7311, test_loss: 1.0452, test_f1: 0.5773
 epoch: 77, train_loss: 0.7251, test_loss: 0.9196, test_f1: 0.6055
 epoch: 78, train_loss: 0.7291, test_loss: 1.2517, test_f1: 0.5337
 epoch: 79, train_loss: 0.7190, test_loss: 1.0003, test_f1: 0.6004
 epoch: 80, train_loss: 0.7266, test_loss: 0.9589, test_f1: 0.5936
 epoch: 81, train_loss: 0.7183, test_loss: 1.0383, test_f1: 0.5612
 epoch: 82, train_loss: 0.7302, test_loss: 0.9903, test_f1: 0.5902
 epoch: 83, train_loss: 0.7235, test_loss: 0.9671, test_f1: 0.6201
 epoch: 84, train_loss: 0.7267, test_loss: 1.0810, test_f1: 0.5789
 epoch: 85, train_loss: 0.7225, test_loss: 0.9499, test_f1: 0.5600
 epoch: 86, train_loss: 0.7193, test_loss: 1.0683, test_f1: 0.5457
 epoch: 87, train_loss: 0.7213, test_loss: 1.0000, test_f1: 0.5896
 epoch: 88, train_loss: 0.7131, test_loss: 0.9682, test_f1: 0.6256
 epoch: 89, train_loss: 0.7084, test_loss: 0.9854, test_f1: 0.6233
 epoch: 90, train_loss: 0.6975, test_loss: 1.0471, test_f1: 0.5620
 epoch: 91, train_loss: 0.7056, test_loss: 1.0184, test_f1: 0.5754
 epoch: 92, train_loss: 0.7059, test_loss: 1.0853, test_f1: 0.5940
 epoch: 93, train_loss: 0.7076, test_loss: 1.3571, test_f1: 0.5270
 epoch: 94, train_loss: 0.6908, test_loss: 0.9861, test_f1: 0.6160
 epoch: 95, train_loss: 0.7071, test_loss: 1.1728, test_f1: 0.5716
 epoch: 96, train_loss: 0.6776, test_loss: 0.9946, test_f1: 0.6040
 epoch: 97, train_loss: 0.6850, test_loss: 0.9883, test_f1: 0.6011
 epoch: 98, train_loss: 0.6912, test_loss: 1.0139, test_f1: 0.6150
 epoch: 99, train_loss: 0.7037, test_loss: 1.1445, test_f1: 0.5949
##################ITERATION #6 ****************************************
 epoch: 0, train_loss: 1.5466, test_loss: 1.3886, test_f1: 0.2270
 epoch: 1, train_loss: 1.1869, test_loss: 1.2556, test_f1: 0.2270
 epoch: 2, train_loss: 1.1253, test_loss: 1.1604, test_f1: 0.3393
 epoch: 3, train_loss: 1.0773, test_loss: 1.0728, test_f1: 0.3950
 epoch: 4, train_loss: 1.0361, test_loss: 1.0205, test_f1: 0.4850
 epoch: 5, train_loss: 1.0316, test_loss: 1.0213, test_f1: 0.4358
 epoch: 6, train_loss: 1.0073, test_loss: 1.0010, test_f1: 0.4605
 epoch: 7, train_loss: 1.0044, test_loss: 0.9878, test_f1: 0.4315
 epoch: 8, train_loss: 0.9896, test_loss: 1.0063, test_f1: 0.5121
 epoch: 9, train_loss: 0.9791, test_loss: 0.9844, test_f1: 0.4882
 epoch: 10, train_loss: 0.9708, test_loss: 0.9299, test_f1: 0.4963
 epoch: 11, train_loss: 0.9523, test_loss: 0.9810, test_f1: 0.5128
 epoch: 12, train_loss: 0.9485, test_loss: 0.9390, test_f1: 0.5212
 epoch: 13, train_loss: 0.9507, test_loss: 0.9690, test_f1: 0.4796
 epoch: 14, train_loss: 0.9465, test_loss: 1.0212, test_f1: 0.4714
 epoch: 15, train_loss: 0.9410, test_loss: 1.0182, test_f1: 0.4715
 epoch: 16, train_loss: 0.9338, test_loss: 0.9261, test_f1: 0.5036
 epoch: 17, train_loss: 0.9134, test_loss: 0.9241, test_f1: 0.5445
 epoch: 18, train_loss: 0.9212, test_loss: 0.9277, test_f1: 0.4998
 epoch: 19, train_loss: 0.9002, test_loss: 0.9456, test_f1: 0.5102
 epoch: 20, train_loss: 0.8934, test_loss: 0.9754, test_f1: 0.5146
 epoch: 21, train_loss: 0.9029, test_loss: 0.9403, test_f1: 0.4986
 epoch: 22, train_loss: 0.9122, test_loss: 0.9169, test_f1: 0.5329
 epoch: 23, train_loss: 0.8961, test_loss: 0.8673, test_f1: 0.5467
 epoch: 24, train_loss: 0.8699, test_loss: 0.9236, test_f1: 0.5694
 epoch: 25, train_loss: 0.8845, test_loss: 0.9071, test_f1: 0.4927
 epoch: 26, train_loss: 0.8878, test_loss: 0.9147, test_f1: 0.4918
 epoch: 27, train_loss: 0.9058, test_loss: 0.9120, test_f1: 0.5093
 epoch: 28, train_loss: 0.8810, test_loss: 0.9189, test_f1: 0.5448
 epoch: 29, train_loss: 0.8782, test_loss: 1.0725, test_f1: 0.4431
 epoch: 30, train_loss: 0.8750, test_loss: 1.0023, test_f1: 0.5043
 epoch: 31, train_loss: 0.8710, test_loss: 0.9553, test_f1: 0.5170
 epoch: 32, train_loss: 0.8820, test_loss: 1.0343, test_f1: 0.4961
 epoch: 33, train_loss: 0.8858, test_loss: 0.8885, test_f1: 0.5295
 epoch: 34, train_loss: 0.8613, test_loss: 0.9339, test_f1: 0.5257
 epoch: 35, train_loss: 0.8655, test_loss: 0.9218, test_f1: 0.5076
 epoch: 36, train_loss: 0.8621, test_loss: 0.9572, test_f1: 0.5132
 epoch: 37, train_loss: 0.8562, test_loss: 0.9010, test_f1: 0.5432
 epoch: 38, train_loss: 0.8570, test_loss: 0.9761, test_f1: 0.4687
 epoch: 39, train_loss: 0.8583, test_loss: 0.9082, test_f1: 0.5437
 epoch: 40, train_loss: 0.8470, test_loss: 0.9165, test_f1: 0.5321
 epoch: 41, train_loss: 0.8420, test_loss: 0.8959, test_f1: 0.5119
 epoch: 42, train_loss: 0.8435, test_loss: 0.8572, test_f1: 0.5426
 epoch: 43, train_loss: 0.8384, test_loss: 0.9581, test_f1: 0.5389
 epoch: 44, train_loss: 0.8372, test_loss: 0.8892, test_f1: 0.5301
 epoch: 45, train_loss: 0.8387, test_loss: 0.8946, test_f1: 0.5194
 epoch: 46, train_loss: 0.8217, test_loss: 0.9439, test_f1: 0.5042
 epoch: 47, train_loss: 0.8188, test_loss: 0.8875, test_f1: 0.5104
 epoch: 48, train_loss: 0.8386, test_loss: 0.8995, test_f1: 0.5245
 epoch: 49, train_loss: 0.8384, test_loss: 0.9119, test_f1: 0.5048
 epoch: 50, train_loss: 0.8354, test_loss: 0.8943, test_f1: 0.5257
 epoch: 51, train_loss: 0.8221, test_loss: 0.9261, test_f1: 0.5098
 epoch: 52, train_loss: 0.8130, test_loss: 0.8726, test_f1: 0.5555
 epoch: 53, train_loss: 0.7993, test_loss: 0.8652, test_f1: 0.5257
 epoch: 54, train_loss: 0.8047, test_loss: 0.9301, test_f1: 0.5219
 epoch: 55, train_loss: 0.8134, test_loss: 0.9077, test_f1: 0.5534
 epoch: 56, train_loss: 0.7998, test_loss: 0.8551, test_f1: 0.5211
 epoch: 57, train_loss: 0.8052, test_loss: 0.9377, test_f1: 0.5366
 epoch: 58, train_loss: 0.8069, test_loss: 0.9380, test_f1: 0.4967
 epoch: 59, train_loss: 0.7934, test_loss: 0.8821, test_f1: 0.5169
 epoch: 60, train_loss: 0.7896, test_loss: 0.8530, test_f1: 0.5580
 epoch: 61, train_loss: 0.7937, test_loss: 0.9033, test_f1: 0.5260
 epoch: 62, train_loss: 0.8032, test_loss: 0.9050, test_f1: 0.5315
 epoch: 63, train_loss: 0.7985, test_loss: 0.9557, test_f1: 0.5156
 epoch: 64, train_loss: 0.8016, test_loss: 0.8707, test_f1: 0.5213
 epoch: 65, train_loss: 0.8017, test_loss: 0.9097, test_f1: 0.5650
 epoch: 66, train_loss: 0.7834, test_loss: 0.9457, test_f1: 0.5058
 epoch: 67, train_loss: 0.8107, test_loss: 0.9371, test_f1: 0.5030
 epoch: 68, train_loss: 0.8014, test_loss: 0.9132, test_f1: 0.5106
 epoch: 69, train_loss: 0.8004, test_loss: 0.9145, test_f1: 0.5377
 epoch: 70, train_loss: 0.7884, test_loss: 0.8334, test_f1: 0.5873
 epoch: 71, train_loss: 0.7775, test_loss: 0.8541, test_f1: 0.5340
 epoch: 72, train_loss: 0.7820, test_loss: 0.8901, test_f1: 0.5309
 epoch: 73, train_loss: 0.7926, test_loss: 0.8943, test_f1: 0.5305
 epoch: 74, train_loss: 0.7940, test_loss: 0.9023, test_f1: 0.5390
 epoch: 75, train_loss: 0.7802, test_loss: 0.8875, test_f1: 0.5255
 epoch: 76, train_loss: 0.7831, test_loss: 0.8914, test_f1: 0.5322
 epoch: 77, train_loss: 0.7678, test_loss: 0.9235, test_f1: 0.5363
 epoch: 78, train_loss: 0.7838, test_loss: 0.9577, test_f1: 0.5031
 epoch: 79, train_loss: 0.7645, test_loss: 0.8734, test_f1: 0.5512
 epoch: 80, train_loss: 0.7707, test_loss: 0.8756, test_f1: 0.5528
 epoch: 81, train_loss: 0.7650, test_loss: 0.8472, test_f1: 0.5513
 epoch: 82, train_loss: 0.7529, test_loss: 0.8715, test_f1: 0.5831
 epoch: 83, train_loss: 0.7751, test_loss: 0.8359, test_f1: 0.5680
 epoch: 84, train_loss: 0.7587, test_loss: 0.8889, test_f1: 0.5352
 epoch: 85, train_loss: 0.7645, test_loss: 0.8971, test_f1: 0.5373
 epoch: 86, train_loss: 0.7657, test_loss: 0.9832, test_f1: 0.5172
 epoch: 87, train_loss: 0.7605, test_loss: 0.8621, test_f1: 0.5848
 epoch: 88, train_loss: 0.7668, test_loss: 0.9229, test_f1: 0.5481
 epoch: 89, train_loss: 0.7563, test_loss: 0.8502, test_f1: 0.5457
 epoch: 90, train_loss: 0.7723, test_loss: 0.9874, test_f1: 0.5579
 epoch: 91, train_loss: 0.7644, test_loss: 0.8100, test_f1: 0.5783
 epoch: 92, train_loss: 0.7535, test_loss: 0.8502, test_f1: 0.5734
 epoch: 93, train_loss: 0.7659, test_loss: 0.8869, test_f1: 0.5483
 epoch: 94, train_loss: 0.7633, test_loss: 0.8869, test_f1: 0.5733
 epoch: 95, train_loss: 0.7623, test_loss: 0.8432, test_f1: 0.5694
 epoch: 96, train_loss: 0.7469, test_loss: 0.9042, test_f1: 0.5835
 epoch: 97, train_loss: 0.7543, test_loss: 0.8467, test_f1: 0.6109
 epoch: 98, train_loss: 0.7489, test_loss: 0.9316, test_f1: 0.5438
 epoch: 99, train_loss: 0.7535, test_loss: 0.8611, test_f1: 0.5828
##################ITERATION #7 ****************************************
 epoch: 0, train_loss: 1.2923, test_loss: 1.4576, test_f1: 0.2270
 epoch: 1, train_loss: 1.1272, test_loss: 1.1855, test_f1: 0.2709
 epoch: 2, train_loss: 1.0875, test_loss: 1.0638, test_f1: 0.3782
 epoch: 3, train_loss: 1.0605, test_loss: 1.0715, test_f1: 0.4056
 epoch: 4, train_loss: 1.0473, test_loss: 1.0706, test_f1: 0.3453
 epoch: 5, train_loss: 1.0229, test_loss: 1.0799, test_f1: 0.3867
 epoch: 6, train_loss: 1.0168, test_loss: 1.0077, test_f1: 0.4791
 epoch: 7, train_loss: 0.9795, test_loss: 1.0756, test_f1: 0.4605
 epoch: 8, train_loss: 0.9855, test_loss: 0.9900, test_f1: 0.4565
 epoch: 9, train_loss: 0.9537, test_loss: 0.9471, test_f1: 0.4974
 epoch: 10, train_loss: 0.9332, test_loss: 0.9567, test_f1: 0.4602
 epoch: 11, train_loss: 0.9330, test_loss: 0.9350, test_f1: 0.5116
 epoch: 12, train_loss: 0.9260, test_loss: 0.9437, test_f1: 0.4989
 epoch: 13, train_loss: 0.9193, test_loss: 0.9676, test_f1: 0.4997
 epoch: 14, train_loss: 0.9103, test_loss: 1.0146, test_f1: 0.4801
 epoch: 15, train_loss: 0.9168, test_loss: 1.0804, test_f1: 0.4813
 epoch: 16, train_loss: 0.9220, test_loss: 0.9390, test_f1: 0.5151
 epoch: 17, train_loss: 0.9014, test_loss: 0.9808, test_f1: 0.4370
 epoch: 18, train_loss: 0.9120, test_loss: 1.4643, test_f1: 0.3557
 epoch: 19, train_loss: 0.9174, test_loss: 0.9399, test_f1: 0.4848
 epoch: 20, train_loss: 0.9071, test_loss: 1.0466, test_f1: 0.4597
 epoch: 21, train_loss: 0.9019, test_loss: 0.9022, test_f1: 0.4881
 epoch: 22, train_loss: 0.9000, test_loss: 0.8930, test_f1: 0.4906
 epoch: 23, train_loss: 0.8970, test_loss: 0.9839, test_f1: 0.4628
 epoch: 24, train_loss: 0.8906, test_loss: 0.9126, test_f1: 0.5062
 epoch: 25, train_loss: 0.8870, test_loss: 0.9086, test_f1: 0.4781
 epoch: 26, train_loss: 0.8815, test_loss: 0.9248, test_f1: 0.4610
 epoch: 27, train_loss: 0.8789, test_loss: 0.9480, test_f1: 0.4948
 epoch: 28, train_loss: 0.8784, test_loss: 0.9537, test_f1: 0.5062
 epoch: 29, train_loss: 0.8648, test_loss: 0.8947, test_f1: 0.4944
 epoch: 30, train_loss: 0.8653, test_loss: 0.8833, test_f1: 0.4745
 epoch: 31, train_loss: 0.8520, test_loss: 0.9140, test_f1: 0.5218
 epoch: 32, train_loss: 0.8578, test_loss: 0.9636, test_f1: 0.4449
 epoch: 33, train_loss: 0.8574, test_loss: 0.8654, test_f1: 0.5393
 epoch: 34, train_loss: 0.8461, test_loss: 0.9519, test_f1: 0.5057
 epoch: 35, train_loss: 0.8350, test_loss: 0.8724, test_f1: 0.5410
 epoch: 36, train_loss: 0.8398, test_loss: 0.8939, test_f1: 0.5578
 epoch: 37, train_loss: 0.8336, test_loss: 0.9120, test_f1: 0.4744
 epoch: 38, train_loss: 0.8529, test_loss: 1.0273, test_f1: 0.4361
 epoch: 39, train_loss: 0.8403, test_loss: 0.9022, test_f1: 0.5268
 epoch: 40, train_loss: 0.8248, test_loss: 0.9163, test_f1: 0.5428
 epoch: 41, train_loss: 0.8361, test_loss: 0.9309, test_f1: 0.5255
 epoch: 42, train_loss: 0.8368, test_loss: 0.8577, test_f1: 0.5260
 epoch: 43, train_loss: 0.8240, test_loss: 1.0097, test_f1: 0.4924
 epoch: 44, train_loss: 0.8201, test_loss: 0.8490, test_f1: 0.5474
 epoch: 45, train_loss: 0.8214, test_loss: 0.9198, test_f1: 0.5085
 epoch: 46, train_loss: 0.8274, test_loss: 0.9566, test_f1: 0.5487
 epoch: 47, train_loss: 0.8188, test_loss: 0.9328, test_f1: 0.5268
 epoch: 48, train_loss: 0.8094, test_loss: 0.9255, test_f1: 0.5451
 epoch: 49, train_loss: 0.8270, test_loss: 0.8499, test_f1: 0.5434
 epoch: 50, train_loss: 0.7988, test_loss: 0.9100, test_f1: 0.5619
 epoch: 51, train_loss: 0.7978, test_loss: 0.9139, test_f1: 0.5438
 epoch: 52, train_loss: 0.7934, test_loss: 0.9901, test_f1: 0.4842
 epoch: 53, train_loss: 0.7903, test_loss: 0.9007, test_f1: 0.5596
 epoch: 54, train_loss: 0.7791, test_loss: 0.8579, test_f1: 0.5602
 epoch: 55, train_loss: 0.7771, test_loss: 0.8796, test_f1: 0.5553
 epoch: 56, train_loss: 0.7737, test_loss: 0.8731, test_f1: 0.5747
 epoch: 57, train_loss: 0.7756, test_loss: 0.8705, test_f1: 0.5678
 epoch: 58, train_loss: 0.7686, test_loss: 0.8430, test_f1: 0.5796
 epoch: 59, train_loss: 0.7767, test_loss: 0.8706, test_f1: 0.5804
 epoch: 60, train_loss: 0.7704, test_loss: 0.8894, test_f1: 0.5584
 epoch: 61, train_loss: 0.7594, test_loss: 0.8808, test_f1: 0.5719
 epoch: 62, train_loss: 0.7525, test_loss: 0.8625, test_f1: 0.5751
 epoch: 63, train_loss: 0.7622, test_loss: 0.9221, test_f1: 0.5747
 epoch: 64, train_loss: 0.7575, test_loss: 0.8640, test_f1: 0.5776
 epoch: 65, train_loss: 0.7604, test_loss: 0.9261, test_f1: 0.5566
 epoch: 66, train_loss: 0.7530, test_loss: 0.8885, test_f1: 0.5541
 epoch: 67, train_loss: 0.7566, test_loss: 0.8918, test_f1: 0.5582
 epoch: 68, train_loss: 0.7520, test_loss: 0.9066, test_f1: 0.5560
 epoch: 69, train_loss: 0.7408, test_loss: 0.8998, test_f1: 0.5601
 epoch: 70, train_loss: 0.7398, test_loss: 0.8814, test_f1: 0.5693
 epoch: 71, train_loss: 0.7369, test_loss: 0.8707, test_f1: 0.5667
 epoch: 72, train_loss: 0.7428, test_loss: 0.8933, test_f1: 0.5594
 epoch: 73, train_loss: 0.7308, test_loss: 0.9098, test_f1: 0.5556
 epoch: 74, train_loss: 0.7486, test_loss: 0.8966, test_f1: 0.5697
 epoch: 75, train_loss: 0.7370, test_loss: 0.9822, test_f1: 0.5714
 epoch: 76, train_loss: 0.7575, test_loss: 0.9298, test_f1: 0.5651
 epoch: 77, train_loss: 0.7661, test_loss: 0.9647, test_f1: 0.5324
 epoch: 78, train_loss: 0.7457, test_loss: 0.8830, test_f1: 0.5942
 epoch: 79, train_loss: 0.7395, test_loss: 0.9040, test_f1: 0.5584
 epoch: 80, train_loss: 0.7329, test_loss: 0.8822, test_f1: 0.5948
 epoch: 81, train_loss: 0.7446, test_loss: 0.9003, test_f1: 0.5704
 epoch: 82, train_loss: 0.7341, test_loss: 1.1481, test_f1: 0.4877
 epoch: 83, train_loss: 0.7449, test_loss: 0.9647, test_f1: 0.5729
 epoch: 84, train_loss: 0.7468, test_loss: 0.8699, test_f1: 0.6066
 epoch: 85, train_loss: 0.7532, test_loss: 0.9488, test_f1: 0.5798
 epoch: 86, train_loss: 0.7427, test_loss: 0.9461, test_f1: 0.6004
 epoch: 87, train_loss: 0.7294, test_loss: 0.9770, test_f1: 0.5578
 epoch: 88, train_loss: 0.7252, test_loss: 0.9886, test_f1: 0.5931
 epoch: 89, train_loss: 0.7224, test_loss: 0.9289, test_f1: 0.5842
 epoch: 90, train_loss: 0.7077, test_loss: 0.8710, test_f1: 0.5678
 epoch: 91, train_loss: 0.7066, test_loss: 0.9541, test_f1: 0.5814
 epoch: 92, train_loss: 0.7332, test_loss: 0.8816, test_f1: 0.6032
 epoch: 93, train_loss: 0.7159, test_loss: 0.9323, test_f1: 0.5727
 epoch: 94, train_loss: 0.7183, test_loss: 0.8954, test_f1: 0.5676
 epoch: 95, train_loss: 0.7217, test_loss: 0.9115, test_f1: 0.5903
 epoch: 96, train_loss: 0.7191, test_loss: 0.9505, test_f1: 0.5773
 epoch: 97, train_loss: 0.7248, test_loss: 1.0450, test_f1: 0.5477
 epoch: 98, train_loss: 0.7145, test_loss: 0.8730, test_f1: 0.5928
 epoch: 99, train_loss: 0.7331, test_loss: 0.9350, test_f1: 0.5800
##################ITERATION #8 ****************************************
 epoch: 0, train_loss: 1.2753, test_loss: 1.3663, test_f1: 0.2270
 epoch: 1, train_loss: 1.0994, test_loss: 1.1186, test_f1: 0.3748
 epoch: 2, train_loss: 1.0502, test_loss: 1.0664, test_f1: 0.3713
 epoch: 3, train_loss: 1.0287, test_loss: 1.0187, test_f1: 0.4095
 epoch: 4, train_loss: 1.0184, test_loss: 1.0434, test_f1: 0.4213
 epoch: 5, train_loss: 0.9977, test_loss: 1.0090, test_f1: 0.4386
 epoch: 6, train_loss: 0.9857, test_loss: 1.0971, test_f1: 0.4696
 epoch: 7, train_loss: 0.9811, test_loss: 1.0520, test_f1: 0.4433
 epoch: 8, train_loss: 0.9673, test_loss: 1.0025, test_f1: 0.4583
 epoch: 9, train_loss: 0.9550, test_loss: 1.0021, test_f1: 0.4596
 epoch: 10, train_loss: 0.9473, test_loss: 0.9673, test_f1: 0.4693
 epoch: 11, train_loss: 0.9499, test_loss: 1.0397, test_f1: 0.4716
 epoch: 12, train_loss: 0.9738, test_loss: 1.4667, test_f1: 0.3559
 epoch: 13, train_loss: 0.9459, test_loss: 0.9799, test_f1: 0.4933
 epoch: 14, train_loss: 0.9350, test_loss: 0.9923, test_f1: 0.4757
 epoch: 15, train_loss: 0.9157, test_loss: 0.9255, test_f1: 0.5039
 epoch: 16, train_loss: 0.9247, test_loss: 1.1030, test_f1: 0.4629
 epoch: 17, train_loss: 0.9089, test_loss: 1.0663, test_f1: 0.4624
 epoch: 18, train_loss: 0.9018, test_loss: 0.9925, test_f1: 0.5070
 epoch: 19, train_loss: 0.8930, test_loss: 1.1401, test_f1: 0.4469
 epoch: 20, train_loss: 0.8913, test_loss: 1.0730, test_f1: 0.4394
 epoch: 21, train_loss: 0.8870, test_loss: 1.0452, test_f1: 0.4524
 epoch: 22, train_loss: 0.8898, test_loss: 0.9389, test_f1: 0.5188
 epoch: 23, train_loss: 0.8802, test_loss: 1.0738, test_f1: 0.4664
 epoch: 24, train_loss: 0.8779, test_loss: 1.0424, test_f1: 0.4966
 epoch: 25, train_loss: 0.8934, test_loss: 0.9984, test_f1: 0.5268
 epoch: 26, train_loss: 0.8703, test_loss: 1.0480, test_f1: 0.4601
 epoch: 27, train_loss: 0.8677, test_loss: 1.0401, test_f1: 0.4971
 epoch: 28, train_loss: 0.8690, test_loss: 0.9711, test_f1: 0.5128
 epoch: 29, train_loss: 0.8767, test_loss: 0.9843, test_f1: 0.5009
 epoch: 30, train_loss: 0.8621, test_loss: 0.9674, test_f1: 0.5521
 epoch: 31, train_loss: 0.8507, test_loss: 1.0064, test_f1: 0.4759
 epoch: 32, train_loss: 0.8721, test_loss: 1.0031, test_f1: 0.5039
 epoch: 33, train_loss: 0.8613, test_loss: 1.0023, test_f1: 0.4964
 epoch: 34, train_loss: 0.8678, test_loss: 0.9773, test_f1: 0.5071
 epoch: 35, train_loss: 0.8687, test_loss: 1.0291, test_f1: 0.4906
 epoch: 36, train_loss: 0.8571, test_loss: 1.0067, test_f1: 0.5459
 epoch: 37, train_loss: 0.8517, test_loss: 1.0341, test_f1: 0.4931
 epoch: 38, train_loss: 0.8389, test_loss: 1.0270, test_f1: 0.5194
 epoch: 39, train_loss: 0.8511, test_loss: 1.0002, test_f1: 0.5221
 epoch: 40, train_loss: 0.8545, test_loss: 1.0283, test_f1: 0.4999
 epoch: 41, train_loss: 0.8276, test_loss: 0.9581, test_f1: 0.5277
 epoch: 42, train_loss: 0.8327, test_loss: 0.9040, test_f1: 0.5292
 epoch: 43, train_loss: 0.8322, test_loss: 1.0002, test_f1: 0.5094
 epoch: 44, train_loss: 0.8368, test_loss: 1.4219, test_f1: 0.3881
 epoch: 45, train_loss: 0.8704, test_loss: 0.9683, test_f1: 0.5239
 epoch: 46, train_loss: 0.8537, test_loss: 0.9586, test_f1: 0.5703
 epoch: 47, train_loss: 0.8302, test_loss: 0.9588, test_f1: 0.5280
 epoch: 48, train_loss: 0.8304, test_loss: 0.9477, test_f1: 0.5300
 epoch: 49, train_loss: 0.8147, test_loss: 0.9565, test_f1: 0.5415
 epoch: 50, train_loss: 0.8122, test_loss: 0.9802, test_f1: 0.5193
 epoch: 51, train_loss: 0.8004, test_loss: 0.9732, test_f1: 0.5371
 epoch: 52, train_loss: 0.7857, test_loss: 0.9640, test_f1: 0.5225
 epoch: 53, train_loss: 0.7950, test_loss: 0.9608, test_f1: 0.5286
 epoch: 54, train_loss: 0.7917, test_loss: 0.9517, test_f1: 0.5417
 epoch: 55, train_loss: 0.7866, test_loss: 0.9613, test_f1: 0.5340
 epoch: 56, train_loss: 0.7794, test_loss: 0.9673, test_f1: 0.5568
 epoch: 57, train_loss: 0.7887, test_loss: 0.9625, test_f1: 0.5607
 epoch: 58, train_loss: 0.7899, test_loss: 0.9644, test_f1: 0.5598
 epoch: 59, train_loss: 0.7877, test_loss: 0.9746, test_f1: 0.5607
 epoch: 60, train_loss: 0.7798, test_loss: 0.9294, test_f1: 0.5834
 epoch: 61, train_loss: 0.7762, test_loss: 0.9533, test_f1: 0.5587
 epoch: 62, train_loss: 0.7810, test_loss: 0.9559, test_f1: 0.5324
 epoch: 63, train_loss: 0.7622, test_loss: 0.9447, test_f1: 0.5557
 epoch: 64, train_loss: 0.7771, test_loss: 0.9545, test_f1: 0.5652
 epoch: 65, train_loss: 0.7848, test_loss: 0.9418, test_f1: 0.5625
 epoch: 66, train_loss: 0.7693, test_loss: 0.9372, test_f1: 0.5642
 epoch: 67, train_loss: 0.7741, test_loss: 0.9250, test_f1: 0.5723
 epoch: 68, train_loss: 0.7755, test_loss: 0.9680, test_f1: 0.5560
 epoch: 69, train_loss: 0.7669, test_loss: 0.9703, test_f1: 0.5653
 epoch: 70, train_loss: 0.7734, test_loss: 0.9398, test_f1: 0.5459
 epoch: 71, train_loss: 0.7606, test_loss: 0.9501, test_f1: 0.5525
 epoch: 72, train_loss: 0.7642, test_loss: 0.9557, test_f1: 0.5388
 epoch: 73, train_loss: 0.7560, test_loss: 0.9773, test_f1: 0.5524
 epoch: 74, train_loss: 0.7618, test_loss: 0.9388, test_f1: 0.5825
 epoch: 75, train_loss: 0.7764, test_loss: 0.9761, test_f1: 0.5471
 epoch: 76, train_loss: 0.7689, test_loss: 0.9524, test_f1: 0.5445
 epoch: 77, train_loss: 0.7621, test_loss: 0.9685, test_f1: 0.5575
 epoch: 78, train_loss: 0.7521, test_loss: 0.9553, test_f1: 0.5301
 epoch: 79, train_loss: 0.7564, test_loss: 0.9861, test_f1: 0.5359
 epoch: 80, train_loss: 0.7616, test_loss: 0.9667, test_f1: 0.5518
 epoch: 81, train_loss: 0.7574, test_loss: 0.9430, test_f1: 0.5643
 epoch: 82, train_loss: 0.7522, test_loss: 0.9828, test_f1: 0.5385
 epoch: 83, train_loss: 0.7558, test_loss: 0.9447, test_f1: 0.5681
 epoch: 84, train_loss: 0.7731, test_loss: 1.0047, test_f1: 0.5213
 epoch: 85, train_loss: 0.7616, test_loss: 0.9593, test_f1: 0.5536
 epoch: 86, train_loss: 0.7578, test_loss: 0.9731, test_f1: 0.5365
 epoch: 87, train_loss: 0.7465, test_loss: 0.9748, test_f1: 0.5416
 epoch: 88, train_loss: 0.7452, test_loss: 0.9643, test_f1: 0.5656
 epoch: 89, train_loss: 0.7459, test_loss: 0.9841, test_f1: 0.5671
 epoch: 90, train_loss: 0.7424, test_loss: 0.9353, test_f1: 0.5546
 epoch: 91, train_loss: 0.7465, test_loss: 1.0021, test_f1: 0.5498
 epoch: 92, train_loss: 0.7477, test_loss: 0.9615, test_f1: 0.5565
 epoch: 93, train_loss: 0.7309, test_loss: 0.9462, test_f1: 0.5675
 epoch: 94, train_loss: 0.7445, test_loss: 0.9757, test_f1: 0.5432
 epoch: 95, train_loss: 0.7525, test_loss: 0.9908, test_f1: 0.5643
 epoch: 96, train_loss: 0.7466, test_loss: 0.9644, test_f1: 0.5690
 epoch: 97, train_loss: 0.7416, test_loss: 1.0127, test_f1: 0.5586
 epoch: 98, train_loss: 0.7448, test_loss: 1.0229, test_f1: 0.5813
 epoch: 99, train_loss: 0.7445, test_loss: 1.0340, test_f1: 0.5472
##################ITERATION #9 ****************************************
 epoch: 0, train_loss: 1.2856, test_loss: 1.3155, test_f1: 0.2270
 epoch: 1, train_loss: 1.1163, test_loss: 1.2304, test_f1: 0.2391
 epoch: 2, train_loss: 1.0564, test_loss: 1.0729, test_f1: 0.3979
 epoch: 3, train_loss: 1.0293, test_loss: 1.0233, test_f1: 0.4132
 epoch: 4, train_loss: 1.0018, test_loss: 1.0310, test_f1: 0.4339
 epoch: 5, train_loss: 0.9881, test_loss: 1.0145, test_f1: 0.4254
 epoch: 6, train_loss: 0.9919, test_loss: 1.0116, test_f1: 0.4497
 epoch: 7, train_loss: 0.9552, test_loss: 0.9633, test_f1: 0.5005
 epoch: 8, train_loss: 0.9555, test_loss: 0.9605, test_f1: 0.4884
 epoch: 9, train_loss: 0.9516, test_loss: 0.9838, test_f1: 0.4619
 epoch: 10, train_loss: 0.9463, test_loss: 1.0603, test_f1: 0.4489
 epoch: 11, train_loss: 0.9334, test_loss: 1.0013, test_f1: 0.4868
 epoch: 12, train_loss: 0.9284, test_loss: 1.0044, test_f1: 0.4617
 epoch: 13, train_loss: 0.9226, test_loss: 0.9685, test_f1: 0.4475
 epoch: 14, train_loss: 0.9137, test_loss: 1.0230, test_f1: 0.4713
 epoch: 15, train_loss: 0.9062, test_loss: 1.0050, test_f1: 0.4710
 epoch: 16, train_loss: 0.9115, test_loss: 1.1207, test_f1: 0.4568
 epoch: 17, train_loss: 0.9058, test_loss: 0.9906, test_f1: 0.5040
 epoch: 18, train_loss: 0.8951, test_loss: 0.9699, test_f1: 0.4998
 epoch: 19, train_loss: 0.8995, test_loss: 0.9473, test_f1: 0.4943
 epoch: 20, train_loss: 0.8844, test_loss: 0.9427, test_f1: 0.5299
 epoch: 21, train_loss: 0.8786, test_loss: 1.0246, test_f1: 0.4755
 epoch: 22, train_loss: 0.8872, test_loss: 1.0265, test_f1: 0.4806
 epoch: 23, train_loss: 0.8767, test_loss: 0.9273, test_f1: 0.5003
 epoch: 24, train_loss: 0.8714, test_loss: 0.9121, test_f1: 0.5405
 epoch: 25, train_loss: 0.8873, test_loss: 0.9814, test_f1: 0.5063
 epoch: 26, train_loss: 0.8666, test_loss: 0.9948, test_f1: 0.4682
 epoch: 27, train_loss: 0.8472, test_loss: 0.9545, test_f1: 0.5152
 epoch: 28, train_loss: 0.8537, test_loss: 0.9471, test_f1: 0.5456
 epoch: 29, train_loss: 0.8601, test_loss: 0.9625, test_f1: 0.4895
 epoch: 30, train_loss: 0.8480, test_loss: 0.9086, test_f1: 0.5104
 epoch: 31, train_loss: 0.8509, test_loss: 0.9386, test_f1: 0.5213
 epoch: 32, train_loss: 0.8655, test_loss: 0.9434, test_f1: 0.5499
 epoch: 33, train_loss: 0.8570, test_loss: 0.9964, test_f1: 0.4769
 epoch: 34, train_loss: 0.8691, test_loss: 0.8777, test_f1: 0.5109
 epoch: 35, train_loss: 0.8522, test_loss: 0.9862, test_f1: 0.5180
 epoch: 36, train_loss: 0.8494, test_loss: 0.9327, test_f1: 0.4988
 epoch: 37, train_loss: 0.8475, test_loss: 0.9612, test_f1: 0.5093
 epoch: 38, train_loss: 0.8411, test_loss: 0.9759, test_f1: 0.5085
 epoch: 39, train_loss: 0.8477, test_loss: 0.9365, test_f1: 0.4748
 epoch: 40, train_loss: 0.8365, test_loss: 0.9791, test_f1: 0.5096
 epoch: 41, train_loss: 0.8315, test_loss: 0.9403, test_f1: 0.5129
 epoch: 42, train_loss: 0.8358, test_loss: 0.9527, test_f1: 0.5046
 epoch: 43, train_loss: 0.8437, test_loss: 0.9059, test_f1: 0.5338
 epoch: 44, train_loss: 0.8284, test_loss: 0.9124, test_f1: 0.5110
 epoch: 45, train_loss: 0.8217, test_loss: 0.9012, test_f1: 0.5149
 epoch: 46, train_loss: 0.8150, test_loss: 0.9351, test_f1: 0.5138
 epoch: 47, train_loss: 0.8275, test_loss: 0.8972, test_f1: 0.4946
 epoch: 48, train_loss: 0.8254, test_loss: 0.9248, test_f1: 0.5309
 epoch: 49, train_loss: 0.8103, test_loss: 0.9196, test_f1: 0.5257
 epoch: 50, train_loss: 0.8228, test_loss: 0.9397, test_f1: 0.4977
 epoch: 51, train_loss: 0.8048, test_loss: 0.9459, test_f1: 0.5172
 epoch: 52, train_loss: 0.7938, test_loss: 0.9154, test_f1: 0.5233
 epoch: 53, train_loss: 0.7859, test_loss: 0.8854, test_f1: 0.5406
 epoch: 54, train_loss: 0.7831, test_loss: 0.9428, test_f1: 0.5121
 epoch: 55, train_loss: 0.7769, test_loss: 0.9317, test_f1: 0.5188
 epoch: 56, train_loss: 0.7763, test_loss: 0.9585, test_f1: 0.4977
 epoch: 57, train_loss: 0.7883, test_loss: 0.9281, test_f1: 0.5233
 epoch: 58, train_loss: 0.7792, test_loss: 0.9293, test_f1: 0.5189
 epoch: 59, train_loss: 0.7700, test_loss: 0.9188, test_f1: 0.5338
 epoch: 60, train_loss: 0.7753, test_loss: 0.8879, test_f1: 0.5428
 epoch: 61, train_loss: 0.7717, test_loss: 0.9431, test_f1: 0.5295
 epoch: 62, train_loss: 0.7595, test_loss: 0.9133, test_f1: 0.5328
 epoch: 63, train_loss: 0.7633, test_loss: 0.8861, test_f1: 0.5379
 epoch: 64, train_loss: 0.7690, test_loss: 0.9247, test_f1: 0.5362
 epoch: 65, train_loss: 0.7587, test_loss: 0.9215, test_f1: 0.5066
 epoch: 66, train_loss: 0.7630, test_loss: 0.9907, test_f1: 0.4971
 epoch: 67, train_loss: 0.7665, test_loss: 0.9637, test_f1: 0.5185
 epoch: 68, train_loss: 0.7590, test_loss: 0.9278, test_f1: 0.5249
 epoch: 69, train_loss: 0.7527, test_loss: 0.9202, test_f1: 0.5466
 epoch: 70, train_loss: 0.7459, test_loss: 0.9624, test_f1: 0.5473
 epoch: 71, train_loss: 0.7486, test_loss: 0.9131, test_f1: 0.5407
 epoch: 72, train_loss: 0.7452, test_loss: 0.9007, test_f1: 0.5658
 epoch: 73, train_loss: 0.7506, test_loss: 0.9150, test_f1: 0.5478
 epoch: 74, train_loss: 0.7487, test_loss: 0.9693, test_f1: 0.5486
 epoch: 75, train_loss: 0.7396, test_loss: 0.9049, test_f1: 0.5494
 epoch: 76, train_loss: 0.7513, test_loss: 0.9476, test_f1: 0.5275
 epoch: 77, train_loss: 0.7476, test_loss: 1.0126, test_f1: 0.5407
 epoch: 78, train_loss: 0.7391, test_loss: 1.0408, test_f1: 0.5216
 epoch: 79, train_loss: 0.7420, test_loss: 0.8765, test_f1: 0.5648
 epoch: 80, train_loss: 0.7511, test_loss: 0.9105, test_f1: 0.5554
 epoch: 81, train_loss: 0.7183, test_loss: 0.9026, test_f1: 0.5573
 epoch: 82, train_loss: 0.7333, test_loss: 0.9096, test_f1: 0.5958
 epoch: 83, train_loss: 0.7305, test_loss: 1.0828, test_f1: 0.5034
 epoch: 84, train_loss: 0.7339, test_loss: 0.8597, test_f1: 0.5635
 epoch: 85, train_loss: 0.7196, test_loss: 0.8792, test_f1: 0.5790
 epoch: 86, train_loss: 0.7241, test_loss: 0.9245, test_f1: 0.5561
 epoch: 87, train_loss: 0.7264, test_loss: 1.0111, test_f1: 0.5396
 epoch: 88, train_loss: 0.7287, test_loss: 0.9926, test_f1: 0.5480
 epoch: 89, train_loss: 0.7320, test_loss: 0.9531, test_f1: 0.5784
 epoch: 90, train_loss: 0.7264, test_loss: 0.8879, test_f1: 0.5740
 epoch: 91, train_loss: 0.7411, test_loss: 0.9185, test_f1: 0.5420
 epoch: 92, train_loss: 0.7190, test_loss: 1.0636, test_f1: 0.5221
 epoch: 93, train_loss: 0.7186, test_loss: 0.9274, test_f1: 0.5401
 epoch: 94, train_loss: 0.7133, test_loss: 1.0438, test_f1: 0.5381
 epoch: 95, train_loss: 0.7318, test_loss: 0.9144, test_f1: 0.5852
 epoch: 96, train_loss: 0.7146, test_loss: 0.9631, test_f1: 0.6120
 epoch: 97, train_loss: 0.7173, test_loss: 0.9394, test_f1: 0.5515
 epoch: 98, train_loss: 0.7174, test_loss: 0.9857, test_f1: 0.5486
 epoch: 99, train_loss: 0.7185, test_loss: 0.8886, test_f1: 0.5617

Training completed in 388.21 seconds
Best F1: 0.6256 at epoch 88
Mean F1 across iterations: 0.6052  0.0117
========================FINAL RESULTS================================
FEGIN weighted F1: 0.6256  0.0117
python main.py --data ltspice_examples --representation component_net --model FEGIN --layers 3 --hiddens 16 --batch_size 256 --lr 0.01 --emb_size 250 --epochs 100 --save_appendix component_net_L3_H16_BS256_LR0.01_E250 --no_val
-----



STDERR:
  File "main.py", line 370, in <module>
    main()
  File "main.py", line 254, in main
    dataset = dataset_class(
  File "/home/philip/projects/ltspice_examples_code_repo/Circuit-Completion-Using-GNNs/component_classification_with_link_prediction_head/evaluation/FEGIN/kernel/circuit_datasets.py", line 15, in __init__
    self.data, self.slices = torch.load(self.processed_paths[0])
  File "/home/philip/.local/lib/python3.8/site-packages/torch/serialization.py", line 1040, in load
    warnings.warn(
  File "/usr/lib/python3.8/warnings.py", line 109, in _showwarnmsg
    sw(msg.message, msg.category, msg.filename, msg.lineno,
  File "main.py", line 47, in warn_with_traceback
    traceback.print_stack(file=log)
/home/philip/projects/ltspice_examples_code_repo/Circuit-Completion-Using-GNNs/component_classification_with_link_prediction_head/evaluation/FEGIN/kernel/circuit_datasets.py:15: FutureWarning: You are using `torch.load` with `weights_only=False` (the current default value), which uses the default pickle module implicitly. It is possible to construct malicious pickle data which will execute arbitrary code during unpickling (See https://github.com/pytorch/pytorch/blob/main/SECURITY.md#untrusted-models for more details). In a future release, the default value for `weights_only` will be flipped to `True`. This limits the functions that could be executed during unpickling. Arbitrary objects will no longer be allowed to be loaded via this mode unless they are explicitly allowlisted by the user via `torch.serialization.add_safe_globals`. We recommend you start setting `weights_only=True` for any use case where you don't have full control of the loaded file. Please open an issue on GitHub for any issues related to this experimental feature.
  self.data, self.slices = torch.load(self.processed_paths[0])
