STDOUT:
Results will be saved in /home/philip/projects/ltspice_examples_code_repo/Circuit-Completion-Using-GNNs/component_classification_with_link_prediction_head/evaluation/FEGIN/results/model_FEGIN_dataset_ltspice_examples
Command line input: python main.py --data ltspice_examples --representation component_component --model FEGIN --layers 4 --hiddens 16 --batch_size 256 --lr 0.001 --emb_size 512 --epochs 100 --save_appendix component_component_L4_H16_BS256_LR0.001_E512 --no_val
 is saved.
-----
ltspice_examples - FEGIN
Using 4 layers, 16 hidden units, h = 2
Loading component_component representation dataset
ENTERED
Training FEGIN on component_component representation
Train: 3556, Test: 845
##################ITERATION #0 ****************************************
 epoch: 0, train_loss: 1.3533, test_loss: 1.3557, test_f1: 0.2274
 epoch: 1, train_loss: 1.3410, test_loss: 1.3486, test_f1: 0.2274
 epoch: 2, train_loss: 1.3329, test_loss: 1.3404, test_f1: 0.2274
 epoch: 3, train_loss: 1.3235, test_loss: 1.3297, test_f1: 0.2274
 epoch: 4, train_loss: 1.3123, test_loss: 1.3183, test_f1: 0.2274
 epoch: 5, train_loss: 1.3007, test_loss: 1.3032, test_f1: 0.2274
 epoch: 6, train_loss: 1.2867, test_loss: 1.2884, test_f1: 0.2274
 epoch: 7, train_loss: 1.2761, test_loss: 1.2673, test_f1: 0.2274
 epoch: 8, train_loss: 1.2592, test_loss: 1.2506, test_f1: 0.2274
 epoch: 9, train_loss: 1.2454, test_loss: 1.2382, test_f1: 0.2274
 epoch: 10, train_loss: 1.2387, test_loss: 1.2297, test_f1: 0.2350
 epoch: 11, train_loss: 1.2343, test_loss: 1.2241, test_f1: 0.2375
 epoch: 12, train_loss: 1.2260, test_loss: 1.2199, test_f1: 0.2942
 epoch: 13, train_loss: 1.2219, test_loss: 1.2093, test_f1: 0.3229
 epoch: 14, train_loss: 1.2220, test_loss: 1.1997, test_f1: 0.3298
 epoch: 15, train_loss: 1.2100, test_loss: 1.1909, test_f1: 0.3469
 epoch: 16, train_loss: 1.2038, test_loss: 1.1850, test_f1: 0.3555
 epoch: 17, train_loss: 1.1993, test_loss: 1.1818, test_f1: 0.3499
 epoch: 18, train_loss: 1.1968, test_loss: 1.1976, test_f1: 0.3499
 epoch: 19, train_loss: 1.1910, test_loss: 1.2000, test_f1: 0.3439
 epoch: 20, train_loss: 1.1792, test_loss: 1.1864, test_f1: 0.3634
 epoch: 21, train_loss: 1.1812, test_loss: 1.1897, test_f1: 0.3564
 epoch: 22, train_loss: 1.1689, test_loss: 1.1798, test_f1: 0.3739
 epoch: 23, train_loss: 1.1613, test_loss: 1.1751, test_f1: 0.3920
 epoch: 24, train_loss: 1.1555, test_loss: 1.1947, test_f1: 0.3927
 epoch: 25, train_loss: 1.1476, test_loss: 1.1822, test_f1: 0.4133
 epoch: 26, train_loss: 1.1428, test_loss: 1.1895, test_f1: 0.4196
 epoch: 27, train_loss: 1.1394, test_loss: 1.1834, test_f1: 0.4157
 epoch: 28, train_loss: 1.1330, test_loss: 1.1744, test_f1: 0.4195
 epoch: 29, train_loss: 1.1220, test_loss: 1.2125, test_f1: 0.4270
 epoch: 30, train_loss: 1.1226, test_loss: 1.1683, test_f1: 0.4305
 epoch: 31, train_loss: 1.1111, test_loss: 1.1168, test_f1: 0.4401
 epoch: 32, train_loss: 1.1087, test_loss: 1.1113, test_f1: 0.4394
 epoch: 33, train_loss: 1.1030, test_loss: 1.1435, test_f1: 0.4165
 epoch: 34, train_loss: 1.0893, test_loss: 1.1432, test_f1: 0.4161
 epoch: 35, train_loss: 1.0877, test_loss: 1.1757, test_f1: 0.4266
 epoch: 36, train_loss: 1.0818, test_loss: 1.1445, test_f1: 0.4151
 epoch: 37, train_loss: 1.0701, test_loss: 1.1622, test_f1: 0.4294
 epoch: 38, train_loss: 1.0765, test_loss: 1.1767, test_f1: 0.4250
 epoch: 39, train_loss: 1.0676, test_loss: 1.1568, test_f1: 0.4095
 epoch: 40, train_loss: 1.0592, test_loss: 1.1370, test_f1: 0.4171
 epoch: 41, train_loss: 1.0549, test_loss: 1.1412, test_f1: 0.4154
 epoch: 42, train_loss: 1.0544, test_loss: 1.1150, test_f1: 0.4214
 epoch: 43, train_loss: 1.0473, test_loss: 1.1410, test_f1: 0.4181
 epoch: 44, train_loss: 1.0475, test_loss: 1.0879, test_f1: 0.4245
 epoch: 45, train_loss: 1.0370, test_loss: 1.0996, test_f1: 0.4241
 epoch: 46, train_loss: 1.0330, test_loss: 1.1191, test_f1: 0.4328
 epoch: 47, train_loss: 1.0308, test_loss: 1.1568, test_f1: 0.4330
 epoch: 48, train_loss: 1.0174, test_loss: 1.0670, test_f1: 0.4475
 epoch: 49, train_loss: 1.0337, test_loss: 1.0970, test_f1: 0.4348
 epoch: 50, train_loss: 1.0088, test_loss: 1.0434, test_f1: 0.4576
 epoch: 51, train_loss: 1.0101, test_loss: 1.0456, test_f1: 0.4669
 epoch: 52, train_loss: 1.0187, test_loss: 1.0342, test_f1: 0.4606
 epoch: 53, train_loss: 1.0088, test_loss: 1.0689, test_f1: 0.4459
 epoch: 54, train_loss: 1.0056, test_loss: 1.0907, test_f1: 0.4380
 epoch: 55, train_loss: 1.0074, test_loss: 1.0741, test_f1: 0.4453
 epoch: 56, train_loss: 0.9985, test_loss: 1.0750, test_f1: 0.4477
 epoch: 57, train_loss: 1.0021, test_loss: 1.0355, test_f1: 0.4608
 epoch: 58, train_loss: 0.9919, test_loss: 1.0527, test_f1: 0.4591
 epoch: 59, train_loss: 0.9931, test_loss: 1.0615, test_f1: 0.4465
 epoch: 60, train_loss: 0.9916, test_loss: 1.0766, test_f1: 0.4405
 epoch: 61, train_loss: 0.9894, test_loss: 1.0983, test_f1: 0.4395
 epoch: 62, train_loss: 0.9895, test_loss: 1.0951, test_f1: 0.4402
 epoch: 63, train_loss: 0.9827, test_loss: 1.0899, test_f1: 0.4501
 epoch: 64, train_loss: 0.9812, test_loss: 1.0440, test_f1: 0.4631
 epoch: 65, train_loss: 0.9800, test_loss: 1.0304, test_f1: 0.4721
 epoch: 66, train_loss: 0.9790, test_loss: 1.0548, test_f1: 0.4749
 epoch: 67, train_loss: 0.9791, test_loss: 1.0619, test_f1: 0.4543
 epoch: 68, train_loss: 0.9802, test_loss: 1.0768, test_f1: 0.4469
 epoch: 69, train_loss: 0.9689, test_loss: 1.1074, test_f1: 0.4575
 epoch: 70, train_loss: 0.9812, test_loss: 1.0853, test_f1: 0.4483
 epoch: 71, train_loss: 0.9820, test_loss: 1.1300, test_f1: 0.4296
 epoch: 72, train_loss: 0.9738, test_loss: 1.1617, test_f1: 0.4456
 epoch: 73, train_loss: 0.9569, test_loss: 1.0769, test_f1: 0.4429
 epoch: 74, train_loss: 0.9654, test_loss: 1.0691, test_f1: 0.4466
 epoch: 75, train_loss: 0.9738, test_loss: 1.0850, test_f1: 0.4464
 epoch: 76, train_loss: 0.9662, test_loss: 1.1070, test_f1: 0.4386
 epoch: 77, train_loss: 0.9586, test_loss: 1.0694, test_f1: 0.4603
 epoch: 78, train_loss: 0.9583, test_loss: 1.0889, test_f1: 0.4400
 epoch: 79, train_loss: 0.9431, test_loss: 1.0943, test_f1: 0.4459
 epoch: 80, train_loss: 0.9559, test_loss: 1.1495, test_f1: 0.4432
 epoch: 81, train_loss: 0.9543, test_loss: 1.1484, test_f1: 0.4426
 epoch: 82, train_loss: 0.9613, test_loss: 1.1453, test_f1: 0.4501
 epoch: 83, train_loss: 0.9619, test_loss: 1.1342, test_f1: 0.4484
 epoch: 84, train_loss: 0.9549, test_loss: 1.1427, test_f1: 0.4449
 epoch: 85, train_loss: 0.9528, test_loss: 1.1401, test_f1: 0.4421
 epoch: 86, train_loss: 0.9532, test_loss: 1.1436, test_f1: 0.4416
 epoch: 87, train_loss: 0.9338, test_loss: 1.1186, test_f1: 0.4501
 epoch: 88, train_loss: 0.9510, test_loss: 1.1387, test_f1: 0.4464
 epoch: 89, train_loss: 0.9439, test_loss: 1.1237, test_f1: 0.4436
 epoch: 90, train_loss: 0.9430, test_loss: 1.1330, test_f1: 0.4456
 epoch: 91, train_loss: 0.9351, test_loss: 1.1273, test_f1: 0.4565
 epoch: 92, train_loss: 0.9410, test_loss: 1.1722, test_f1: 0.4396
 epoch: 93, train_loss: 0.9339, test_loss: 1.1620, test_f1: 0.4468
 epoch: 94, train_loss: 0.9283, test_loss: 1.1400, test_f1: 0.4576
 epoch: 95, train_loss: 0.9247, test_loss: 1.0835, test_f1: 0.4615
 epoch: 96, train_loss: 0.9437, test_loss: 1.1810, test_f1: 0.4473
 epoch: 97, train_loss: 0.9245, test_loss: 1.0994, test_f1: 0.4463
 epoch: 98, train_loss: 0.9234, test_loss: 1.1221, test_f1: 0.4491
 epoch: 99, train_loss: 0.9283, test_loss: 1.1326, test_f1: 0.4564
##################ITERATION #1 ****************************************
 epoch: 0, train_loss: 1.3724, test_loss: 1.3734, test_f1: 0.2309
 epoch: 1, train_loss: 1.3016, test_loss: 1.3183, test_f1: 0.2274
 epoch: 2, train_loss: 1.2757, test_loss: 1.2810, test_f1: 0.2274
 epoch: 3, train_loss: 1.2645, test_loss: 1.2587, test_f1: 0.2274
 epoch: 4, train_loss: 1.2491, test_loss: 1.2390, test_f1: 0.2274
 epoch: 5, train_loss: 1.2358, test_loss: 1.2258, test_f1: 0.2868
 epoch: 6, train_loss: 1.2261, test_loss: 1.2117, test_f1: 0.2894
 epoch: 7, train_loss: 1.2206, test_loss: 1.1932, test_f1: 0.3090
 epoch: 8, train_loss: 1.2106, test_loss: 1.1847, test_f1: 0.3169
 epoch: 9, train_loss: 1.2063, test_loss: 1.1734, test_f1: 0.3260
 epoch: 10, train_loss: 1.1934, test_loss: 1.1611, test_f1: 0.3501
 epoch: 11, train_loss: 1.1861, test_loss: 1.1541, test_f1: 0.3672
 epoch: 12, train_loss: 1.1770, test_loss: 1.1409, test_f1: 0.3769
 epoch: 13, train_loss: 1.1674, test_loss: 1.1247, test_f1: 0.3881
 epoch: 14, train_loss: 1.1649, test_loss: 1.1154, test_f1: 0.3990
 epoch: 15, train_loss: 1.1534, test_loss: 1.1129, test_f1: 0.3850
 epoch: 16, train_loss: 1.1500, test_loss: 1.0998, test_f1: 0.4125
 epoch: 17, train_loss: 1.1412, test_loss: 1.0816, test_f1: 0.4569
 epoch: 18, train_loss: 1.1346, test_loss: 1.0938, test_f1: 0.4243
 epoch: 19, train_loss: 1.1281, test_loss: 1.0745, test_f1: 0.4391
 epoch: 20, train_loss: 1.1183, test_loss: 1.0823, test_f1: 0.4454
 epoch: 21, train_loss: 1.1134, test_loss: 1.0671, test_f1: 0.4354
 epoch: 22, train_loss: 1.1118, test_loss: 1.0666, test_f1: 0.4404
 epoch: 23, train_loss: 1.0964, test_loss: 1.0455, test_f1: 0.4632
 epoch: 24, train_loss: 1.0981, test_loss: 1.0542, test_f1: 0.4459
 epoch: 25, train_loss: 1.0905, test_loss: 1.0286, test_f1: 0.4534
 epoch: 26, train_loss: 1.0865, test_loss: 1.0179, test_f1: 0.4602
 epoch: 27, train_loss: 1.0711, test_loss: 1.0249, test_f1: 0.4563
 epoch: 28, train_loss: 1.0681, test_loss: 1.0231, test_f1: 0.4631
 epoch: 29, train_loss: 1.0596, test_loss: 1.0169, test_f1: 0.4771
 epoch: 30, train_loss: 1.0510, test_loss: 1.0057, test_f1: 0.4577
 epoch: 31, train_loss: 1.0509, test_loss: 0.9942, test_f1: 0.4744
 epoch: 32, train_loss: 1.0450, test_loss: 0.9963, test_f1: 0.4652
 epoch: 33, train_loss: 1.0508, test_loss: 1.0055, test_f1: 0.4672
 epoch: 34, train_loss: 1.0451, test_loss: 1.0005, test_f1: 0.4704
 epoch: 35, train_loss: 1.0362, test_loss: 0.9933, test_f1: 0.4676
 epoch: 36, train_loss: 1.0366, test_loss: 0.9941, test_f1: 0.4710
 epoch: 37, train_loss: 1.0220, test_loss: 0.9988, test_f1: 0.4626
 epoch: 38, train_loss: 1.0244, test_loss: 0.9895, test_f1: 0.4688
 epoch: 39, train_loss: 1.0116, test_loss: 1.0205, test_f1: 0.4369
 epoch: 40, train_loss: 1.0133, test_loss: 0.9732, test_f1: 0.4787
 epoch: 41, train_loss: 1.0031, test_loss: 0.9904, test_f1: 0.4593
 epoch: 42, train_loss: 1.0005, test_loss: 0.9885, test_f1: 0.4594
 epoch: 43, train_loss: 0.9936, test_loss: 0.9729, test_f1: 0.4907
 epoch: 44, train_loss: 0.9906, test_loss: 1.0020, test_f1: 0.4512
 epoch: 45, train_loss: 0.9860, test_loss: 1.0147, test_f1: 0.4588
 epoch: 46, train_loss: 0.9811, test_loss: 0.9772, test_f1: 0.4797
 epoch: 47, train_loss: 0.9821, test_loss: 0.9723, test_f1: 0.4587
 epoch: 48, train_loss: 0.9843, test_loss: 0.9764, test_f1: 0.4827
 epoch: 49, train_loss: 0.9765, test_loss: 0.9985, test_f1: 0.4748
 epoch: 50, train_loss: 0.9734, test_loss: 1.0226, test_f1: 0.4394
 epoch: 51, train_loss: 0.9624, test_loss: 1.0021, test_f1: 0.4564
 epoch: 52, train_loss: 0.9427, test_loss: 1.0076, test_f1: 0.4440
 epoch: 53, train_loss: 0.9613, test_loss: 0.9840, test_f1: 0.4675
 epoch: 54, train_loss: 0.9655, test_loss: 1.0124, test_f1: 0.4467
 epoch: 55, train_loss: 0.9554, test_loss: 1.0196, test_f1: 0.4450
 epoch: 56, train_loss: 0.9561, test_loss: 1.0142, test_f1: 0.4521
 epoch: 57, train_loss: 0.9479, test_loss: 1.0045, test_f1: 0.4495
 epoch: 58, train_loss: 0.9407, test_loss: 1.0396, test_f1: 0.4494
 epoch: 59, train_loss: 0.9529, test_loss: 1.0417, test_f1: 0.4398
 epoch: 60, train_loss: 0.9494, test_loss: 1.0230, test_f1: 0.4549
 epoch: 61, train_loss: 0.9398, test_loss: 1.0142, test_f1: 0.4570
 epoch: 62, train_loss: 0.9410, test_loss: 1.0849, test_f1: 0.4516
 epoch: 63, train_loss: 0.9423, test_loss: 1.0843, test_f1: 0.4442
 epoch: 64, train_loss: 0.9467, test_loss: 1.0758, test_f1: 0.4473
 epoch: 65, train_loss: 0.9449, test_loss: 1.0794, test_f1: 0.4534
 epoch: 66, train_loss: 0.9421, test_loss: 1.0926, test_f1: 0.4467
 epoch: 67, train_loss: 0.9395, test_loss: 1.0804, test_f1: 0.4594
 epoch: 68, train_loss: 0.9306, test_loss: 1.0922, test_f1: 0.4407
 epoch: 69, train_loss: 0.9321, test_loss: 1.0430, test_f1: 0.4576
 epoch: 70, train_loss: 0.9348, test_loss: 1.0081, test_f1: 0.4622
 epoch: 71, train_loss: 0.9282, test_loss: 1.0348, test_f1: 0.4554
 epoch: 72, train_loss: 0.9360, test_loss: 1.0634, test_f1: 0.4436
 epoch: 73, train_loss: 0.9341, test_loss: 1.0461, test_f1: 0.4430
 epoch: 74, train_loss: 0.9243, test_loss: 1.0252, test_f1: 0.4507
 epoch: 75, train_loss: 0.9244, test_loss: 1.0338, test_f1: 0.4514
 epoch: 76, train_loss: 0.9271, test_loss: 1.0434, test_f1: 0.4600
 epoch: 77, train_loss: 0.9230, test_loss: 1.0343, test_f1: 0.4543
 epoch: 78, train_loss: 0.9199, test_loss: 1.0457, test_f1: 0.4550
 epoch: 79, train_loss: 0.9126, test_loss: 1.0332, test_f1: 0.4594
 epoch: 80, train_loss: 0.9219, test_loss: 1.0181, test_f1: 0.4680
 epoch: 81, train_loss: 0.9051, test_loss: 1.0408, test_f1: 0.4387
 epoch: 82, train_loss: 0.9151, test_loss: 1.0500, test_f1: 0.4516
 epoch: 83, train_loss: 0.9139, test_loss: 1.0197, test_f1: 0.4576
 epoch: 84, train_loss: 0.9221, test_loss: 1.0240, test_f1: 0.4504
 epoch: 85, train_loss: 0.9185, test_loss: 1.0167, test_f1: 0.4566
 epoch: 86, train_loss: 0.9130, test_loss: 1.0202, test_f1: 0.4617
 epoch: 87, train_loss: 0.9111, test_loss: 1.0115, test_f1: 0.4614
 epoch: 88, train_loss: 0.9060, test_loss: 1.0093, test_f1: 0.4606
 epoch: 89, train_loss: 0.9016, test_loss: 1.0504, test_f1: 0.4444
 epoch: 90, train_loss: 0.9100, test_loss: 1.0753, test_f1: 0.4547
 epoch: 91, train_loss: 0.9137, test_loss: 1.0550, test_f1: 0.4530
 epoch: 92, train_loss: 0.9028, test_loss: 1.0735, test_f1: 0.4427
 epoch: 93, train_loss: 0.8960, test_loss: 1.0350, test_f1: 0.4640
 epoch: 94, train_loss: 0.8944, test_loss: 1.0233, test_f1: 0.4632
 epoch: 95, train_loss: 0.8844, test_loss: 1.0008, test_f1: 0.4704
 epoch: 96, train_loss: 0.8972, test_loss: 1.1569, test_f1: 0.4554
 epoch: 97, train_loss: 0.9073, test_loss: 1.1378, test_f1: 0.4528
 epoch: 98, train_loss: 0.8911, test_loss: 1.1419, test_f1: 0.4667
 epoch: 99, train_loss: 0.9021, test_loss: 1.1075, test_f1: 0.4445
##################ITERATION #2 ****************************************
 epoch: 0, train_loss: 1.3573, test_loss: 1.3533, test_f1: 0.2274
 epoch: 1, train_loss: 1.2951, test_loss: 1.3222, test_f1: 0.2274
 epoch: 2, train_loss: 1.2673, test_loss: 1.2874, test_f1: 0.2274
 epoch: 3, train_loss: 1.2554, test_loss: 1.2582, test_f1: 0.2274
 epoch: 4, train_loss: 1.2430, test_loss: 1.2339, test_f1: 0.2600
 epoch: 5, train_loss: 1.2303, test_loss: 1.2055, test_f1: 0.2776
 epoch: 6, train_loss: 1.2244, test_loss: 1.1990, test_f1: 0.2970
 epoch: 7, train_loss: 1.2196, test_loss: 1.1787, test_f1: 0.3097
 epoch: 8, train_loss: 1.2109, test_loss: 1.1761, test_f1: 0.3232
 epoch: 9, train_loss: 1.2068, test_loss: 1.1665, test_f1: 0.3538
 epoch: 10, train_loss: 1.1943, test_loss: 1.1556, test_f1: 0.3549
 epoch: 11, train_loss: 1.1884, test_loss: 1.1559, test_f1: 0.4046
 epoch: 12, train_loss: 1.1782, test_loss: 1.1382, test_f1: 0.3991
 epoch: 13, train_loss: 1.1654, test_loss: 1.1344, test_f1: 0.3891
 epoch: 14, train_loss: 1.1551, test_loss: 1.1321, test_f1: 0.3973
 epoch: 15, train_loss: 1.1523, test_loss: 1.1211, test_f1: 0.4159
 epoch: 16, train_loss: 1.1502, test_loss: 1.1136, test_f1: 0.4083
 epoch: 17, train_loss: 1.1402, test_loss: 1.1243, test_f1: 0.4093
 epoch: 18, train_loss: 1.1304, test_loss: 1.1210, test_f1: 0.4157
 epoch: 19, train_loss: 1.1247, test_loss: 1.1003, test_f1: 0.4389
 epoch: 20, train_loss: 1.1192, test_loss: 1.1054, test_f1: 0.4200
 epoch: 21, train_loss: 1.1201, test_loss: 1.1047, test_f1: 0.4548
 epoch: 22, train_loss: 1.1130, test_loss: 1.1008, test_f1: 0.4274
 epoch: 23, train_loss: 1.1049, test_loss: 1.1195, test_f1: 0.4321
 epoch: 24, train_loss: 1.0992, test_loss: 1.1037, test_f1: 0.4408
 epoch: 25, train_loss: 1.0990, test_loss: 1.1285, test_f1: 0.4132
 epoch: 26, train_loss: 1.0854, test_loss: 1.0998, test_f1: 0.4501
 epoch: 27, train_loss: 1.0838, test_loss: 1.1079, test_f1: 0.4302
 epoch: 28, train_loss: 1.0751, test_loss: 1.0943, test_f1: 0.4289
 epoch: 29, train_loss: 1.0820, test_loss: 1.0779, test_f1: 0.4572
 epoch: 30, train_loss: 1.0692, test_loss: 1.0878, test_f1: 0.4450
 epoch: 31, train_loss: 1.0737, test_loss: 1.1030, test_f1: 0.4330
 epoch: 32, train_loss: 1.0744, test_loss: 1.1101, test_f1: 0.4338
 epoch: 33, train_loss: 1.0621, test_loss: 1.1074, test_f1: 0.4241
 epoch: 34, train_loss: 1.0617, test_loss: 1.1210, test_f1: 0.4379
 epoch: 35, train_loss: 1.0515, test_loss: 1.1122, test_f1: 0.4187
 epoch: 36, train_loss: 1.0619, test_loss: 1.1205, test_f1: 0.4447
 epoch: 37, train_loss: 1.0553, test_loss: 1.0774, test_f1: 0.4354
 epoch: 38, train_loss: 1.0546, test_loss: 1.0820, test_f1: 0.4445
 epoch: 39, train_loss: 1.0399, test_loss: 1.1175, test_f1: 0.4327
 epoch: 40, train_loss: 1.0376, test_loss: 1.0999, test_f1: 0.4470
 epoch: 41, train_loss: 1.0330, test_loss: 1.0750, test_f1: 0.4618
 epoch: 42, train_loss: 1.0390, test_loss: 1.0929, test_f1: 0.4192
 epoch: 43, train_loss: 1.0340, test_loss: 1.1028, test_f1: 0.4222
 epoch: 44, train_loss: 1.0401, test_loss: 1.1015, test_f1: 0.4384
 epoch: 45, train_loss: 1.0355, test_loss: 1.0759, test_f1: 0.4591
 epoch: 46, train_loss: 1.0174, test_loss: 1.0791, test_f1: 0.4501
 epoch: 47, train_loss: 1.0343, test_loss: 1.0815, test_f1: 0.4610
 epoch: 48, train_loss: 1.0250, test_loss: 1.0917, test_f1: 0.4358
 epoch: 49, train_loss: 1.0140, test_loss: 1.1036, test_f1: 0.4551
 epoch: 50, train_loss: 1.0223, test_loss: 1.0505, test_f1: 0.4502
 epoch: 51, train_loss: 1.0138, test_loss: 1.0689, test_f1: 0.4411
 epoch: 52, train_loss: 1.0093, test_loss: 1.0732, test_f1: 0.4451
 epoch: 53, train_loss: 1.0109, test_loss: 1.0538, test_f1: 0.4564
 epoch: 54, train_loss: 1.0025, test_loss: 1.0884, test_f1: 0.4401
 epoch: 55, train_loss: 1.0106, test_loss: 1.1284, test_f1: 0.4314
 epoch: 56, train_loss: 0.9938, test_loss: 1.0838, test_f1: 0.4463
 epoch: 57, train_loss: 1.0048, test_loss: 1.0831, test_f1: 0.4440
 epoch: 58, train_loss: 0.9910, test_loss: 1.0953, test_f1: 0.4389
 epoch: 59, train_loss: 0.9888, test_loss: 1.0797, test_f1: 0.4405
 epoch: 60, train_loss: 0.9891, test_loss: 1.0896, test_f1: 0.4563
 epoch: 61, train_loss: 0.9937, test_loss: 1.0600, test_f1: 0.4497
 epoch: 62, train_loss: 0.9785, test_loss: 1.0797, test_f1: 0.4442
 epoch: 63, train_loss: 0.9831, test_loss: 1.0928, test_f1: 0.4450
 epoch: 64, train_loss: 0.9761, test_loss: 1.0656, test_f1: 0.4542
 epoch: 65, train_loss: 0.9761, test_loss: 1.0971, test_f1: 0.4486
 epoch: 66, train_loss: 0.9824, test_loss: 1.0887, test_f1: 0.4407
 epoch: 67, train_loss: 0.9807, test_loss: 1.0894, test_f1: 0.4489
 epoch: 68, train_loss: 0.9814, test_loss: 1.0836, test_f1: 0.4620
 epoch: 69, train_loss: 0.9697, test_loss: 1.0787, test_f1: 0.4500
 epoch: 70, train_loss: 0.9649, test_loss: 1.1057, test_f1: 0.4534
 epoch: 71, train_loss: 0.9707, test_loss: 1.0868, test_f1: 0.4494
 epoch: 72, train_loss: 0.9647, test_loss: 1.0796, test_f1: 0.4530
 epoch: 73, train_loss: 0.9603, test_loss: 1.0842, test_f1: 0.4664
 epoch: 74, train_loss: 0.9618, test_loss: 1.0779, test_f1: 0.4511
 epoch: 75, train_loss: 0.9571, test_loss: 1.0994, test_f1: 0.4431
 epoch: 76, train_loss: 0.9640, test_loss: 1.0971, test_f1: 0.4571
 epoch: 77, train_loss: 0.9669, test_loss: 1.0879, test_f1: 0.4634
 epoch: 78, train_loss: 0.9604, test_loss: 1.1067, test_f1: 0.4520
 epoch: 79, train_loss: 0.9611, test_loss: 1.1120, test_f1: 0.4503
 epoch: 80, train_loss: 0.9552, test_loss: 1.1081, test_f1: 0.4644
 epoch: 81, train_loss: 0.9665, test_loss: 1.0900, test_f1: 0.4609
 epoch: 82, train_loss: 0.9544, test_loss: 1.1019, test_f1: 0.4493
 epoch: 83, train_loss: 0.9441, test_loss: 1.1104, test_f1: 0.4541
 epoch: 84, train_loss: 0.9474, test_loss: 1.1145, test_f1: 0.4419
 epoch: 85, train_loss: 0.9460, test_loss: 1.0996, test_f1: 0.4660
 epoch: 86, train_loss: 0.9378, test_loss: 1.1076, test_f1: 0.4766
 epoch: 87, train_loss: 0.9556, test_loss: 1.1035, test_f1: 0.4617
 epoch: 88, train_loss: 0.9538, test_loss: 1.1165, test_f1: 0.4507
 epoch: 89, train_loss: 0.9444, test_loss: 1.1007, test_f1: 0.4520
 epoch: 90, train_loss: 0.9398, test_loss: 1.1044, test_f1: 0.4551
 epoch: 91, train_loss: 0.9425, test_loss: 1.1033, test_f1: 0.4472
 epoch: 92, train_loss: 0.9352, test_loss: 1.0878, test_f1: 0.4667
 epoch: 93, train_loss: 0.9388, test_loss: 1.1067, test_f1: 0.4449
 epoch: 94, train_loss: 0.9377, test_loss: 1.1274, test_f1: 0.4412
 epoch: 95, train_loss: 0.9405, test_loss: 1.1033, test_f1: 0.4544
 epoch: 96, train_loss: 0.9388, test_loss: 1.1293, test_f1: 0.4466
 epoch: 97, train_loss: 0.9319, test_loss: 1.1249, test_f1: 0.4470
 epoch: 98, train_loss: 0.9404, test_loss: 1.1077, test_f1: 0.4451
 epoch: 99, train_loss: 0.9241, test_loss: 1.1108, test_f1: 0.4427
##################ITERATION #3 ****************************************
 epoch: 0, train_loss: 1.3321, test_loss: 1.3090, test_f1: 0.2274
 epoch: 1, train_loss: 1.2765, test_loss: 1.2751, test_f1: 0.2274
 epoch: 2, train_loss: 1.2640, test_loss: 1.2462, test_f1: 0.2274
 epoch: 3, train_loss: 1.2477, test_loss: 1.2282, test_f1: 0.2622
 epoch: 4, train_loss: 1.2361, test_loss: 1.2188, test_f1: 0.2663
 epoch: 5, train_loss: 1.2352, test_loss: 1.2092, test_f1: 0.2985
 epoch: 6, train_loss: 1.2216, test_loss: 1.1985, test_f1: 0.3433
 epoch: 7, train_loss: 1.2182, test_loss: 1.1869, test_f1: 0.3433
 epoch: 8, train_loss: 1.2150, test_loss: 1.1844, test_f1: 0.3468
 epoch: 9, train_loss: 1.1980, test_loss: 1.1905, test_f1: 0.3527
 epoch: 10, train_loss: 1.1931, test_loss: 1.1646, test_f1: 0.3891
 epoch: 11, train_loss: 1.1894, test_loss: 1.1688, test_f1: 0.4053
 epoch: 12, train_loss: 1.1926, test_loss: 1.1561, test_f1: 0.3984
 epoch: 13, train_loss: 1.1825, test_loss: 1.1499, test_f1: 0.4280
 epoch: 14, train_loss: 1.1772, test_loss: 1.1436, test_f1: 0.4142
 epoch: 15, train_loss: 1.1754, test_loss: 1.1411, test_f1: 0.4293
 epoch: 16, train_loss: 1.1588, test_loss: 1.1208, test_f1: 0.4616
 epoch: 17, train_loss: 1.1562, test_loss: 1.1192, test_f1: 0.4590
 epoch: 18, train_loss: 1.1453, test_loss: 1.1194, test_f1: 0.4673
 epoch: 19, train_loss: 1.1469, test_loss: 1.1163, test_f1: 0.4505
 epoch: 20, train_loss: 1.1383, test_loss: 1.1142, test_f1: 0.4431
 epoch: 21, train_loss: 1.1442, test_loss: 1.0942, test_f1: 0.4795
 epoch: 22, train_loss: 1.1329, test_loss: 1.1096, test_f1: 0.4729
 epoch: 23, train_loss: 1.1272, test_loss: 1.1040, test_f1: 0.4569
 epoch: 24, train_loss: 1.1264, test_loss: 1.0812, test_f1: 0.4803
 epoch: 25, train_loss: 1.1177, test_loss: 1.0834, test_f1: 0.4676
 epoch: 26, train_loss: 1.1121, test_loss: 1.0784, test_f1: 0.4693
 epoch: 27, train_loss: 1.1076, test_loss: 1.0751, test_f1: 0.4734
 epoch: 28, train_loss: 1.1004, test_loss: 1.0803, test_f1: 0.4591
 epoch: 29, train_loss: 1.0931, test_loss: 1.0734, test_f1: 0.4575
 epoch: 30, train_loss: 1.1014, test_loss: 1.0698, test_f1: 0.4642
 epoch: 31, train_loss: 1.0812, test_loss: 1.0645, test_f1: 0.4775
 epoch: 32, train_loss: 1.0866, test_loss: 1.0629, test_f1: 0.4569
 epoch: 33, train_loss: 1.0808, test_loss: 1.0853, test_f1: 0.4718
 epoch: 34, train_loss: 1.0676, test_loss: 1.0488, test_f1: 0.4661
 epoch: 35, train_loss: 1.0779, test_loss: 1.0438, test_f1: 0.4918
 epoch: 36, train_loss: 1.0689, test_loss: 1.0446, test_f1: 0.4638
 epoch: 37, train_loss: 1.0623, test_loss: 1.0277, test_f1: 0.4959
 epoch: 38, train_loss: 1.0513, test_loss: 1.0382, test_f1: 0.4990
 epoch: 39, train_loss: 1.0627, test_loss: 1.0433, test_f1: 0.4846
 epoch: 40, train_loss: 1.0518, test_loss: 1.0236, test_f1: 0.4748
 epoch: 41, train_loss: 1.0533, test_loss: 1.0422, test_f1: 0.4828
 epoch: 42, train_loss: 1.0462, test_loss: 1.0268, test_f1: 0.4750
 epoch: 43, train_loss: 1.0313, test_loss: 1.0455, test_f1: 0.4723
 epoch: 44, train_loss: 1.0358, test_loss: 1.0385, test_f1: 0.4893
 epoch: 45, train_loss: 1.0459, test_loss: 1.0040, test_f1: 0.4807
 epoch: 46, train_loss: 1.0397, test_loss: 1.0260, test_f1: 0.4915
 epoch: 47, train_loss: 1.0295, test_loss: 1.0125, test_f1: 0.5063
 epoch: 48, train_loss: 1.0263, test_loss: 1.0127, test_f1: 0.4894
 epoch: 49, train_loss: 1.0236, test_loss: 1.0047, test_f1: 0.5185
 epoch: 50, train_loss: 1.0244, test_loss: 1.0183, test_f1: 0.4963
 epoch: 51, train_loss: 1.0165, test_loss: 1.0092, test_f1: 0.5024
 epoch: 52, train_loss: 1.0107, test_loss: 1.0015, test_f1: 0.5087
 epoch: 53, train_loss: 1.0122, test_loss: 1.0095, test_f1: 0.5042
 epoch: 54, train_loss: 1.0110, test_loss: 1.0097, test_f1: 0.5011
 epoch: 55, train_loss: 1.0076, test_loss: 0.9957, test_f1: 0.5175
 epoch: 56, train_loss: 1.0083, test_loss: 0.9976, test_f1: 0.5081
 epoch: 57, train_loss: 0.9965, test_loss: 0.9952, test_f1: 0.5045
 epoch: 58, train_loss: 0.9940, test_loss: 0.9985, test_f1: 0.5038
 epoch: 59, train_loss: 0.9881, test_loss: 1.0050, test_f1: 0.5065
 epoch: 60, train_loss: 0.9829, test_loss: 0.9903, test_f1: 0.5129
 epoch: 61, train_loss: 0.9905, test_loss: 0.9974, test_f1: 0.5123
 epoch: 62, train_loss: 0.9984, test_loss: 1.0035, test_f1: 0.4990
 epoch: 63, train_loss: 0.9916, test_loss: 0.9986, test_f1: 0.5111
 epoch: 64, train_loss: 0.9928, test_loss: 0.9913, test_f1: 0.5083
 epoch: 65, train_loss: 0.9925, test_loss: 1.0164, test_f1: 0.5004
 epoch: 66, train_loss: 0.9885, test_loss: 1.0027, test_f1: 0.5020
 epoch: 67, train_loss: 0.9752, test_loss: 0.9843, test_f1: 0.5166
 epoch: 68, train_loss: 0.9776, test_loss: 1.0201, test_f1: 0.5044
 epoch: 69, train_loss: 0.9843, test_loss: 0.9927, test_f1: 0.5148
 epoch: 70, train_loss: 0.9860, test_loss: 0.9817, test_f1: 0.5181
 epoch: 71, train_loss: 0.9646, test_loss: 0.9878, test_f1: 0.5100
 epoch: 72, train_loss: 0.9716, test_loss: 1.0014, test_f1: 0.5080
 epoch: 73, train_loss: 0.9620, test_loss: 1.0102, test_f1: 0.4974
 epoch: 74, train_loss: 0.9851, test_loss: 1.0055, test_f1: 0.5069
 epoch: 75, train_loss: 0.9586, test_loss: 1.0089, test_f1: 0.5162
 epoch: 76, train_loss: 0.9805, test_loss: 1.0070, test_f1: 0.5049
 epoch: 77, train_loss: 0.9755, test_loss: 0.9901, test_f1: 0.5145
 epoch: 78, train_loss: 0.9805, test_loss: 0.9977, test_f1: 0.5169
 epoch: 79, train_loss: 0.9656, test_loss: 0.9931, test_f1: 0.5169
 epoch: 80, train_loss: 0.9650, test_loss: 1.0092, test_f1: 0.5072
 epoch: 81, train_loss: 0.9722, test_loss: 0.9984, test_f1: 0.5140
 epoch: 82, train_loss: 0.9626, test_loss: 0.9984, test_f1: 0.5126
 epoch: 83, train_loss: 0.9602, test_loss: 0.9902, test_f1: 0.5170
 epoch: 84, train_loss: 0.9709, test_loss: 0.9943, test_f1: 0.5135
 epoch: 85, train_loss: 0.9791, test_loss: 0.9977, test_f1: 0.5082
 epoch: 86, train_loss: 0.9575, test_loss: 0.9997, test_f1: 0.5038
 epoch: 87, train_loss: 0.9657, test_loss: 0.9969, test_f1: 0.5133
 epoch: 88, train_loss: 0.9682, test_loss: 0.9875, test_f1: 0.5210
 epoch: 89, train_loss: 0.9530, test_loss: 1.0044, test_f1: 0.5114
 epoch: 90, train_loss: 0.9556, test_loss: 1.0109, test_f1: 0.5065
 epoch: 91, train_loss: 0.9509, test_loss: 1.0059, test_f1: 0.5081
 epoch: 92, train_loss: 0.9542, test_loss: 0.9933, test_f1: 0.5139
 epoch: 93, train_loss: 0.9510, test_loss: 1.0068, test_f1: 0.5125
 epoch: 94, train_loss: 0.9575, test_loss: 0.9977, test_f1: 0.5200
 epoch: 95, train_loss: 0.9474, test_loss: 0.9965, test_f1: 0.5151
 epoch: 96, train_loss: 0.9564, test_loss: 1.0022, test_f1: 0.5135
 epoch: 97, train_loss: 0.9456, test_loss: 1.0091, test_f1: 0.5165
 epoch: 98, train_loss: 0.9514, test_loss: 1.0401, test_f1: 0.5044
 epoch: 99, train_loss: 0.9454, test_loss: 1.0174, test_f1: 0.5124
##################ITERATION #4 ****************************************
 epoch: 0, train_loss: 1.4427, test_loss: 1.3209, test_f1: 0.2274
 epoch: 1, train_loss: 1.3105, test_loss: 1.2904, test_f1: 0.2274
 epoch: 2, train_loss: 1.2775, test_loss: 1.2716, test_f1: 0.2460
 epoch: 3, train_loss: 1.2551, test_loss: 1.2473, test_f1: 0.2732
 epoch: 4, train_loss: 1.2468, test_loss: 1.2222, test_f1: 0.3227
 epoch: 5, train_loss: 1.2272, test_loss: 1.2052, test_f1: 0.3493
 epoch: 6, train_loss: 1.2255, test_loss: 1.1881, test_f1: 0.3743
 epoch: 7, train_loss: 1.2127, test_loss: 1.1779, test_f1: 0.3782
 epoch: 8, train_loss: 1.2032, test_loss: 1.1702, test_f1: 0.4072
 epoch: 9, train_loss: 1.1977, test_loss: 1.1594, test_f1: 0.3873
 epoch: 10, train_loss: 1.1964, test_loss: 1.1566, test_f1: 0.3781
 epoch: 11, train_loss: 1.1923, test_loss: 1.1317, test_f1: 0.4187
 epoch: 12, train_loss: 1.1614, test_loss: 1.1123, test_f1: 0.4421
 epoch: 13, train_loss: 1.1618, test_loss: 1.1142, test_f1: 0.4262
 epoch: 14, train_loss: 1.1592, test_loss: 1.0949, test_f1: 0.4359
 epoch: 15, train_loss: 1.1591, test_loss: 1.0904, test_f1: 0.4190
 epoch: 16, train_loss: 1.1457, test_loss: 1.0726, test_f1: 0.4557
 epoch: 17, train_loss: 1.1382, test_loss: 1.0797, test_f1: 0.4309
 epoch: 18, train_loss: 1.1381, test_loss: 1.0678, test_f1: 0.4460
 epoch: 19, train_loss: 1.1356, test_loss: 1.0630, test_f1: 0.4407
 epoch: 20, train_loss: 1.1272, test_loss: 1.0503, test_f1: 0.4555
 epoch: 21, train_loss: 1.1192, test_loss: 1.0544, test_f1: 0.4357
 epoch: 22, train_loss: 1.1159, test_loss: 1.0410, test_f1: 0.4527
 epoch: 23, train_loss: 1.1030, test_loss: 1.0310, test_f1: 0.4572
 epoch: 24, train_loss: 1.1005, test_loss: 1.0366, test_f1: 0.4600
 epoch: 25, train_loss: 1.0964, test_loss: 1.0106, test_f1: 0.4768
 epoch: 26, train_loss: 1.0892, test_loss: 1.0177, test_f1: 0.4686
 epoch: 27, train_loss: 1.0865, test_loss: 1.0030, test_f1: 0.4783
 epoch: 28, train_loss: 1.0741, test_loss: 1.0051, test_f1: 0.4690
 epoch: 29, train_loss: 1.0762, test_loss: 1.0078, test_f1: 0.4623
 epoch: 30, train_loss: 1.0731, test_loss: 0.9856, test_f1: 0.4772
 epoch: 31, train_loss: 1.0677, test_loss: 0.9807, test_f1: 0.4743
 epoch: 32, train_loss: 1.0650, test_loss: 0.9954, test_f1: 0.4726
 epoch: 33, train_loss: 1.0577, test_loss: 0.9759, test_f1: 0.4866
 epoch: 34, train_loss: 1.0547, test_loss: 0.9767, test_f1: 0.4864
 epoch: 35, train_loss: 1.0463, test_loss: 0.9708, test_f1: 0.4905
 epoch: 36, train_loss: 1.0406, test_loss: 0.9632, test_f1: 0.4816
 epoch: 37, train_loss: 1.0373, test_loss: 0.9555, test_f1: 0.4745
 epoch: 38, train_loss: 1.0330, test_loss: 0.9710, test_f1: 0.4846
 epoch: 39, train_loss: 1.0255, test_loss: 0.9454, test_f1: 0.4925
 epoch: 40, train_loss: 1.0194, test_loss: 0.9385, test_f1: 0.4768
 epoch: 41, train_loss: 1.0299, test_loss: 0.9524, test_f1: 0.4765
 epoch: 42, train_loss: 1.0230, test_loss: 0.9835, test_f1: 0.4689
 epoch: 43, train_loss: 1.0094, test_loss: 0.9477, test_f1: 0.4733
 epoch: 44, train_loss: 1.0134, test_loss: 0.9506, test_f1: 0.4766
 epoch: 45, train_loss: 1.0168, test_loss: 0.9541, test_f1: 0.4804
 epoch: 46, train_loss: 1.0043, test_loss: 0.9338, test_f1: 0.4743
 epoch: 47, train_loss: 0.9955, test_loss: 0.9257, test_f1: 0.4831
 epoch: 48, train_loss: 1.0020, test_loss: 0.9447, test_f1: 0.4839
 epoch: 49, train_loss: 0.9952, test_loss: 0.9214, test_f1: 0.4877
 epoch: 50, train_loss: 0.9939, test_loss: 0.9338, test_f1: 0.4762
 epoch: 51, train_loss: 0.9921, test_loss: 0.9410, test_f1: 0.4740
 epoch: 52, train_loss: 0.9837, test_loss: 0.9268, test_f1: 0.4750
 epoch: 53, train_loss: 0.9813, test_loss: 0.9343, test_f1: 0.4741
 epoch: 54, train_loss: 0.9821, test_loss: 0.9133, test_f1: 0.4897
 epoch: 55, train_loss: 0.9792, test_loss: 0.9291, test_f1: 0.4769
 epoch: 56, train_loss: 0.9828, test_loss: 0.9390, test_f1: 0.4709
 epoch: 57, train_loss: 0.9746, test_loss: 0.9141, test_f1: 0.4827
 epoch: 58, train_loss: 0.9692, test_loss: 0.9265, test_f1: 0.4805
 epoch: 59, train_loss: 0.9722, test_loss: 0.9181, test_f1: 0.4829
 epoch: 60, train_loss: 0.9745, test_loss: 0.9353, test_f1: 0.4811
 epoch: 61, train_loss: 0.9691, test_loss: 0.9200, test_f1: 0.4806
 epoch: 62, train_loss: 0.9719, test_loss: 0.9119, test_f1: 0.4921
 epoch: 63, train_loss: 0.9780, test_loss: 0.9193, test_f1: 0.4883
 epoch: 64, train_loss: 0.9716, test_loss: 0.9350, test_f1: 0.4855
 epoch: 65, train_loss: 0.9619, test_loss: 0.9217, test_f1: 0.4922
 epoch: 66, train_loss: 0.9576, test_loss: 0.9164, test_f1: 0.4896
 epoch: 67, train_loss: 0.9745, test_loss: 0.9321, test_f1: 0.4821
 epoch: 68, train_loss: 0.9678, test_loss: 0.9265, test_f1: 0.4917
 epoch: 69, train_loss: 0.9623, test_loss: 0.9166, test_f1: 0.4722
 epoch: 70, train_loss: 0.9569, test_loss: 0.9289, test_f1: 0.4734
 epoch: 71, train_loss: 0.9645, test_loss: 0.9283, test_f1: 0.4786
 epoch: 72, train_loss: 0.9543, test_loss: 0.9177, test_f1: 0.4807
 epoch: 73, train_loss: 0.9485, test_loss: 0.9217, test_f1: 0.4658
 epoch: 74, train_loss: 0.9621, test_loss: 0.9268, test_f1: 0.4685
 epoch: 75, train_loss: 0.9598, test_loss: 0.9298, test_f1: 0.4736
 epoch: 76, train_loss: 0.9533, test_loss: 0.9210, test_f1: 0.4896
 epoch: 77, train_loss: 0.9494, test_loss: 0.9254, test_f1: 0.4734
 epoch: 78, train_loss: 0.9457, test_loss: 0.9546, test_f1: 0.4745
 epoch: 79, train_loss: 0.9505, test_loss: 0.9460, test_f1: 0.4743
 epoch: 80, train_loss: 0.9582, test_loss: 0.9383, test_f1: 0.4757
 epoch: 81, train_loss: 0.9476, test_loss: 0.9354, test_f1: 0.4802
 epoch: 82, train_loss: 0.9378, test_loss: 0.9316, test_f1: 0.4860
 epoch: 83, train_loss: 0.9464, test_loss: 0.9363, test_f1: 0.4660
 epoch: 84, train_loss: 0.9417, test_loss: 0.9402, test_f1: 0.4734
 epoch: 85, train_loss: 0.9497, test_loss: 0.9436, test_f1: 0.4760
 epoch: 86, train_loss: 0.9403, test_loss: 0.9581, test_f1: 0.4587
 epoch: 87, train_loss: 0.9359, test_loss: 0.9535, test_f1: 0.4655
 epoch: 88, train_loss: 0.9404, test_loss: 0.9437, test_f1: 0.4824
 epoch: 89, train_loss: 0.9369, test_loss: 0.9411, test_f1: 0.4797
 epoch: 90, train_loss: 0.9427, test_loss: 0.9550, test_f1: 0.4826
 epoch: 91, train_loss: 0.9326, test_loss: 0.9420, test_f1: 0.4912
 epoch: 92, train_loss: 0.9315, test_loss: 0.9565, test_f1: 0.4758
 epoch: 93, train_loss: 0.9457, test_loss: 0.9663, test_f1: 0.4762
 epoch: 94, train_loss: 0.9336, test_loss: 0.9469, test_f1: 0.4810
 epoch: 95, train_loss: 0.9458, test_loss: 0.9381, test_f1: 0.4860
 epoch: 96, train_loss: 0.9334, test_loss: 0.9604, test_f1: 0.4714
 epoch: 97, train_loss: 0.9323, test_loss: 0.9476, test_f1: 0.4830
 epoch: 98, train_loss: 0.9346, test_loss: 0.9566, test_f1: 0.4858
 epoch: 99, train_loss: 0.9377, test_loss: 0.9647, test_f1: 0.4787
##################ITERATION #5 ****************************************
 epoch: 0, train_loss: 1.5179, test_loss: 1.3820, test_f1: 0.3032
 epoch: 1, train_loss: 1.3371, test_loss: 1.3161, test_f1: 0.2556
 epoch: 2, train_loss: 1.3033, test_loss: 1.2709, test_f1: 0.2555
 epoch: 3, train_loss: 1.2758, test_loss: 1.2548, test_f1: 0.2914
 epoch: 4, train_loss: 1.2586, test_loss: 1.2413, test_f1: 0.3049
 epoch: 5, train_loss: 1.2364, test_loss: 1.2240, test_f1: 0.2903
 epoch: 6, train_loss: 1.2333, test_loss: 1.2032, test_f1: 0.3223
 epoch: 7, train_loss: 1.2228, test_loss: 1.1824, test_f1: 0.3661
 epoch: 8, train_loss: 1.2146, test_loss: 1.1750, test_f1: 0.3802
 epoch: 9, train_loss: 1.1978, test_loss: 1.1671, test_f1: 0.3812
 epoch: 10, train_loss: 1.1840, test_loss: 1.1604, test_f1: 0.3789
 epoch: 11, train_loss: 1.1745, test_loss: 1.1340, test_f1: 0.3999
 epoch: 12, train_loss: 1.1610, test_loss: 1.0971, test_f1: 0.4137
 epoch: 13, train_loss: 1.1445, test_loss: 1.0947, test_f1: 0.4226
 epoch: 14, train_loss: 1.1248, test_loss: 1.0764, test_f1: 0.4191
 epoch: 15, train_loss: 1.1308, test_loss: 1.0674, test_f1: 0.4339
 epoch: 16, train_loss: 1.1152, test_loss: 1.0536, test_f1: 0.4365
 epoch: 17, train_loss: 1.1025, test_loss: 1.0385, test_f1: 0.4414
 epoch: 18, train_loss: 1.0997, test_loss: 1.0354, test_f1: 0.4351
 epoch: 19, train_loss: 1.0818, test_loss: 1.0196, test_f1: 0.4513
 epoch: 20, train_loss: 1.0695, test_loss: 1.0338, test_f1: 0.4415
 epoch: 21, train_loss: 1.0777, test_loss: 1.0247, test_f1: 0.4591
 epoch: 22, train_loss: 1.0619, test_loss: 1.0260, test_f1: 0.4476
 epoch: 23, train_loss: 1.0476, test_loss: 0.9997, test_f1: 0.4566
 epoch: 24, train_loss: 1.0521, test_loss: 0.9859, test_f1: 0.4628
 epoch: 25, train_loss: 1.0405, test_loss: 1.0175, test_f1: 0.4513
 epoch: 26, train_loss: 1.0358, test_loss: 0.9813, test_f1: 0.4649
 epoch: 27, train_loss: 1.0189, test_loss: 0.9891, test_f1: 0.4489
 epoch: 28, train_loss: 1.0141, test_loss: 0.9767, test_f1: 0.4505
 epoch: 29, train_loss: 1.0105, test_loss: 0.9723, test_f1: 0.4543
 epoch: 30, train_loss: 1.0094, test_loss: 0.9743, test_f1: 0.4630
 epoch: 31, train_loss: 1.0087, test_loss: 0.9772, test_f1: 0.4594
 epoch: 32, train_loss: 0.9969, test_loss: 0.9706, test_f1: 0.4662
 epoch: 33, train_loss: 0.9892, test_loss: 0.9564, test_f1: 0.4846
 epoch: 34, train_loss: 0.9915, test_loss: 0.9823, test_f1: 0.4564
 epoch: 35, train_loss: 0.9871, test_loss: 0.9935, test_f1: 0.4421
 epoch: 36, train_loss: 0.9835, test_loss: 0.9526, test_f1: 0.4820
 epoch: 37, train_loss: 0.9858, test_loss: 0.9700, test_f1: 0.4536
 epoch: 38, train_loss: 0.9687, test_loss: 0.9561, test_f1: 0.4714
 epoch: 39, train_loss: 0.9721, test_loss: 0.9593, test_f1: 0.4681
 epoch: 40, train_loss: 0.9692, test_loss: 0.9717, test_f1: 0.4622
 epoch: 41, train_loss: 0.9675, test_loss: 0.9503, test_f1: 0.4909
 epoch: 42, train_loss: 0.9654, test_loss: 0.9569, test_f1: 0.4750
 epoch: 43, train_loss: 0.9578, test_loss: 0.9740, test_f1: 0.4508
 epoch: 44, train_loss: 0.9513, test_loss: 0.9443, test_f1: 0.4753
 epoch: 45, train_loss: 0.9518, test_loss: 0.9573, test_f1: 0.4870
 epoch: 46, train_loss: 0.9607, test_loss: 0.9432, test_f1: 0.4840
 epoch: 47, train_loss: 0.9484, test_loss: 0.9523, test_f1: 0.4660
 epoch: 48, train_loss: 0.9482, test_loss: 0.9585, test_f1: 0.4882
 epoch: 49, train_loss: 0.9457, test_loss: 0.9537, test_f1: 0.4756
 epoch: 50, train_loss: 0.9438, test_loss: 0.9601, test_f1: 0.4636
 epoch: 51, train_loss: 0.9312, test_loss: 0.9606, test_f1: 0.4827
 epoch: 52, train_loss: 0.9351, test_loss: 0.9553, test_f1: 0.4860
 epoch: 53, train_loss: 0.9292, test_loss: 0.9685, test_f1: 0.4809
 epoch: 54, train_loss: 0.9199, test_loss: 0.9533, test_f1: 0.4955
 epoch: 55, train_loss: 0.9203, test_loss: 0.9542, test_f1: 0.4928
 epoch: 56, train_loss: 0.9362, test_loss: 0.9601, test_f1: 0.4756
 epoch: 57, train_loss: 0.9151, test_loss: 0.9641, test_f1: 0.4841
 epoch: 58, train_loss: 0.9224, test_loss: 0.9547, test_f1: 0.4832
 epoch: 59, train_loss: 0.9180, test_loss: 0.9589, test_f1: 0.4823
 epoch: 60, train_loss: 0.9163, test_loss: 0.9754, test_f1: 0.4898
 epoch: 61, train_loss: 0.9205, test_loss: 0.9701, test_f1: 0.4801
 epoch: 62, train_loss: 0.9265, test_loss: 0.9625, test_f1: 0.4842
 epoch: 63, train_loss: 0.9168, test_loss: 0.9686, test_f1: 0.4797
 epoch: 64, train_loss: 0.9101, test_loss: 0.9705, test_f1: 0.4775
 epoch: 65, train_loss: 0.9053, test_loss: 0.9550, test_f1: 0.4892
 epoch: 66, train_loss: 0.9024, test_loss: 0.9648, test_f1: 0.4777
 epoch: 67, train_loss: 0.9021, test_loss: 0.9569, test_f1: 0.4906
 epoch: 68, train_loss: 0.9090, test_loss: 0.9639, test_f1: 0.4786
 epoch: 69, train_loss: 0.9084, test_loss: 0.9657, test_f1: 0.4799
 epoch: 70, train_loss: 0.9094, test_loss: 0.9703, test_f1: 0.4875
 epoch: 71, train_loss: 0.9040, test_loss: 0.9526, test_f1: 0.4952
 epoch: 72, train_loss: 0.9054, test_loss: 0.9611, test_f1: 0.4868
 epoch: 73, train_loss: 0.9050, test_loss: 0.9433, test_f1: 0.5004
 epoch: 74, train_loss: 0.9059, test_loss: 0.9559, test_f1: 0.4931
 epoch: 75, train_loss: 0.9048, test_loss: 0.9684, test_f1: 0.4902
 epoch: 76, train_loss: 0.9042, test_loss: 0.9612, test_f1: 0.4789
 epoch: 77, train_loss: 0.9037, test_loss: 0.9609, test_f1: 0.4828
 epoch: 78, train_loss: 0.9018, test_loss: 0.9630, test_f1: 0.4901
 epoch: 79, train_loss: 0.9019, test_loss: 0.9489, test_f1: 0.4936
 epoch: 80, train_loss: 0.8919, test_loss: 0.9580, test_f1: 0.4809
 epoch: 81, train_loss: 0.8938, test_loss: 0.9760, test_f1: 0.4808
 epoch: 82, train_loss: 0.8905, test_loss: 0.9776, test_f1: 0.4883
 epoch: 83, train_loss: 0.9006, test_loss: 0.9678, test_f1: 0.4879
 epoch: 84, train_loss: 0.8868, test_loss: 0.9534, test_f1: 0.4937
 epoch: 85, train_loss: 0.8885, test_loss: 0.9527, test_f1: 0.4981
 epoch: 86, train_loss: 0.8892, test_loss: 0.9566, test_f1: 0.4901
 epoch: 87, train_loss: 0.8888, test_loss: 0.9692, test_f1: 0.4853
 epoch: 88, train_loss: 0.8847, test_loss: 0.9561, test_f1: 0.4876
 epoch: 89, train_loss: 0.8814, test_loss: 0.9504, test_f1: 0.4963
 epoch: 90, train_loss: 0.8854, test_loss: 0.9666, test_f1: 0.4945
 epoch: 91, train_loss: 0.8873, test_loss: 0.9627, test_f1: 0.4910
 epoch: 92, train_loss: 0.8849, test_loss: 0.9727, test_f1: 0.4988
 epoch: 93, train_loss: 0.8770, test_loss: 0.9579, test_f1: 0.4877
 epoch: 94, train_loss: 0.8865, test_loss: 0.9598, test_f1: 0.4965
 epoch: 95, train_loss: 0.8761, test_loss: 0.9620, test_f1: 0.4994
 epoch: 96, train_loss: 0.8863, test_loss: 0.9545, test_f1: 0.5075
 epoch: 97, train_loss: 0.8772, test_loss: 0.9562, test_f1: 0.4964
 epoch: 98, train_loss: 0.8830, test_loss: 0.9562, test_f1: 0.4977
 epoch: 99, train_loss: 0.8770, test_loss: 0.9846, test_f1: 0.4847
##################ITERATION #6 ****************************************
 epoch: 0, train_loss: 1.6198, test_loss: 1.3362, test_f1: 0.2274
 epoch: 1, train_loss: 1.3846, test_loss: 1.3414, test_f1: 0.2300
 epoch: 2, train_loss: 1.3122, test_loss: 1.2935, test_f1: 0.2470
 epoch: 3, train_loss: 1.2936, test_loss: 1.2615, test_f1: 0.2981
 epoch: 4, train_loss: 1.2927, test_loss: 1.2492, test_f1: 0.3066
 epoch: 5, train_loss: 1.2632, test_loss: 1.2321, test_f1: 0.3205
 epoch: 6, train_loss: 1.2446, test_loss: 1.2165, test_f1: 0.3517
 epoch: 7, train_loss: 1.2422, test_loss: 1.2009, test_f1: 0.3574
 epoch: 8, train_loss: 1.2141, test_loss: 1.1826, test_f1: 0.3785
 epoch: 9, train_loss: 1.2225, test_loss: 1.1797, test_f1: 0.3901
 epoch: 10, train_loss: 1.2057, test_loss: 1.1693, test_f1: 0.4015
 epoch: 11, train_loss: 1.1882, test_loss: 1.1506, test_f1: 0.4086
 epoch: 12, train_loss: 1.1884, test_loss: 1.1372, test_f1: 0.4139
 epoch: 13, train_loss: 1.1641, test_loss: 1.1242, test_f1: 0.4229
 epoch: 14, train_loss: 1.1796, test_loss: 1.1210, test_f1: 0.4363
 epoch: 15, train_loss: 1.1655, test_loss: 1.1119, test_f1: 0.4394
 epoch: 16, train_loss: 1.1455, test_loss: 1.0987, test_f1: 0.4365
 epoch: 17, train_loss: 1.1582, test_loss: 1.0829, test_f1: 0.4606
 epoch: 18, train_loss: 1.1267, test_loss: 1.0816, test_f1: 0.4461
 epoch: 19, train_loss: 1.1320, test_loss: 1.0749, test_f1: 0.4474
 epoch: 20, train_loss: 1.1243, test_loss: 1.0624, test_f1: 0.4470
 epoch: 21, train_loss: 1.1154, test_loss: 1.0641, test_f1: 0.4466
 epoch: 22, train_loss: 1.1062, test_loss: 1.0629, test_f1: 0.4573
 epoch: 23, train_loss: 1.1011, test_loss: 1.0539, test_f1: 0.4497
 epoch: 24, train_loss: 1.0839, test_loss: 1.0586, test_f1: 0.4583
 epoch: 25, train_loss: 1.1047, test_loss: 1.0502, test_f1: 0.4563
 epoch: 26, train_loss: 1.0831, test_loss: 1.0448, test_f1: 0.4697
 epoch: 27, train_loss: 1.0788, test_loss: 1.0408, test_f1: 0.4730
 epoch: 28, train_loss: 1.0710, test_loss: 1.0528, test_f1: 0.4520
 epoch: 29, train_loss: 1.0696, test_loss: 1.0626, test_f1: 0.4484
 epoch: 30, train_loss: 1.0678, test_loss: 1.0307, test_f1: 0.4731
 epoch: 31, train_loss: 1.0548, test_loss: 1.0451, test_f1: 0.4636
 epoch: 32, train_loss: 1.0488, test_loss: 1.0809, test_f1: 0.4512
 epoch: 33, train_loss: 1.0512, test_loss: 1.0409, test_f1: 0.4595
 epoch: 34, train_loss: 1.0437, test_loss: 1.0345, test_f1: 0.4692
 epoch: 35, train_loss: 1.0352, test_loss: 1.0616, test_f1: 0.4608
 epoch: 36, train_loss: 1.0357, test_loss: 1.0494, test_f1: 0.4557
 epoch: 37, train_loss: 1.0311, test_loss: 1.0831, test_f1: 0.4440
 epoch: 38, train_loss: 1.0239, test_loss: 1.0430, test_f1: 0.4538
 epoch: 39, train_loss: 1.0250, test_loss: 1.1042, test_f1: 0.4367
 epoch: 40, train_loss: 1.0281, test_loss: 1.0723, test_f1: 0.4605
 epoch: 41, train_loss: 1.0260, test_loss: 1.0607, test_f1: 0.4531
 epoch: 42, train_loss: 0.9975, test_loss: 1.0828, test_f1: 0.4452
 epoch: 43, train_loss: 1.0059, test_loss: 1.0822, test_f1: 0.4556
 epoch: 44, train_loss: 1.0019, test_loss: 1.0663, test_f1: 0.4564
 epoch: 45, train_loss: 0.9901, test_loss: 1.0829, test_f1: 0.4462
 epoch: 46, train_loss: 0.9833, test_loss: 1.0816, test_f1: 0.4548
 epoch: 47, train_loss: 0.9871, test_loss: 1.0498, test_f1: 0.4544
 epoch: 48, train_loss: 0.9824, test_loss: 1.0904, test_f1: 0.4492
 epoch: 49, train_loss: 0.9850, test_loss: 1.0920, test_f1: 0.4471
 epoch: 50, train_loss: 0.9783, test_loss: 1.0524, test_f1: 0.4687
 epoch: 51, train_loss: 0.9687, test_loss: 1.0681, test_f1: 0.4654
 epoch: 52, train_loss: 0.9656, test_loss: 1.0730, test_f1: 0.4578
 epoch: 53, train_loss: 0.9673, test_loss: 1.0941, test_f1: 0.4445
 epoch: 54, train_loss: 0.9678, test_loss: 1.0949, test_f1: 0.4608
 epoch: 55, train_loss: 0.9665, test_loss: 1.0995, test_f1: 0.4510
 epoch: 56, train_loss: 0.9587, test_loss: 1.1249, test_f1: 0.4580
 epoch: 57, train_loss: 0.9605, test_loss: 1.0870, test_f1: 0.4588
 epoch: 58, train_loss: 0.9651, test_loss: 1.1163, test_f1: 0.4495
 epoch: 59, train_loss: 0.9529, test_loss: 1.1010, test_f1: 0.4547
 epoch: 60, train_loss: 0.9518, test_loss: 1.1200, test_f1: 0.4633
 epoch: 61, train_loss: 0.9479, test_loss: 1.1078, test_f1: 0.4592
 epoch: 62, train_loss: 0.9422, test_loss: 1.1039, test_f1: 0.4570
 epoch: 63, train_loss: 0.9385, test_loss: 1.1087, test_f1: 0.4566
 epoch: 64, train_loss: 0.9408, test_loss: 1.0890, test_f1: 0.4632
 epoch: 65, train_loss: 0.9431, test_loss: 1.0932, test_f1: 0.4516
 epoch: 66, train_loss: 0.9370, test_loss: 1.1242, test_f1: 0.4562
 epoch: 67, train_loss: 0.9504, test_loss: 1.1217, test_f1: 0.4649
 epoch: 68, train_loss: 0.9406, test_loss: 1.0854, test_f1: 0.4665
 epoch: 69, train_loss: 0.9333, test_loss: 1.1135, test_f1: 0.4650
 epoch: 70, train_loss: 0.9274, test_loss: 1.1162, test_f1: 0.4603
 epoch: 71, train_loss: 0.9325, test_loss: 1.1360, test_f1: 0.4559
 epoch: 72, train_loss: 0.9258, test_loss: 1.1293, test_f1: 0.4640
 epoch: 73, train_loss: 0.9308, test_loss: 1.1125, test_f1: 0.4643
 epoch: 74, train_loss: 0.9193, test_loss: 1.1198, test_f1: 0.4616
 epoch: 75, train_loss: 0.9338, test_loss: 1.1288, test_f1: 0.4674
 epoch: 76, train_loss: 0.9251, test_loss: 1.1426, test_f1: 0.4589
 epoch: 77, train_loss: 0.9231, test_loss: 1.1093, test_f1: 0.4724
 epoch: 78, train_loss: 0.9301, test_loss: 1.1348, test_f1: 0.4726
 epoch: 79, train_loss: 0.9333, test_loss: 1.1315, test_f1: 0.4694
 epoch: 80, train_loss: 0.9085, test_loss: 1.1595, test_f1: 0.4527
 epoch: 81, train_loss: 0.9253, test_loss: 1.1566, test_f1: 0.4764
 epoch: 82, train_loss: 0.9221, test_loss: 1.1526, test_f1: 0.4665
 epoch: 83, train_loss: 0.9167, test_loss: 1.1458, test_f1: 0.4687
 epoch: 84, train_loss: 0.9159, test_loss: 1.1480, test_f1: 0.4653
 epoch: 85, train_loss: 0.9122, test_loss: 1.1576, test_f1: 0.4703
 epoch: 86, train_loss: 0.9153, test_loss: 1.1654, test_f1: 0.4692
 epoch: 87, train_loss: 0.9058, test_loss: 1.1684, test_f1: 0.4599
 epoch: 88, train_loss: 0.9053, test_loss: 1.1650, test_f1: 0.4584
 epoch: 89, train_loss: 0.9127, test_loss: 1.1570, test_f1: 0.4648
 epoch: 90, train_loss: 0.9039, test_loss: 1.1447, test_f1: 0.4653
 epoch: 91, train_loss: 0.8937, test_loss: 1.1753, test_f1: 0.4525
 epoch: 92, train_loss: 0.9115, test_loss: 1.1745, test_f1: 0.4679
 epoch: 93, train_loss: 0.8967, test_loss: 1.1714, test_f1: 0.4612
 epoch: 94, train_loss: 0.9046, test_loss: 1.1767, test_f1: 0.4544
 epoch: 95, train_loss: 0.9092, test_loss: 1.1718, test_f1: 0.4640
 epoch: 96, train_loss: 0.8933, test_loss: 1.1855, test_f1: 0.4668
 epoch: 97, train_loss: 0.8943, test_loss: 1.1664, test_f1: 0.4618
 epoch: 98, train_loss: 0.8932, test_loss: 1.1783, test_f1: 0.4653
 epoch: 99, train_loss: 0.8866, test_loss: 1.1748, test_f1: 0.4670
##################ITERATION #7 ****************************************
 epoch: 0, train_loss: 1.5273, test_loss: 1.3744, test_f1: 0.2475
 epoch: 1, train_loss: 1.3213, test_loss: 1.3216, test_f1: 0.2910
 epoch: 2, train_loss: 1.2765, test_loss: 1.2614, test_f1: 0.3444
 epoch: 3, train_loss: 1.2402, test_loss: 1.2142, test_f1: 0.3810
 epoch: 4, train_loss: 1.2060, test_loss: 1.1877, test_f1: 0.3898
 epoch: 5, train_loss: 1.1935, test_loss: 1.1591, test_f1: 0.4125
 epoch: 6, train_loss: 1.1777, test_loss: 1.1421, test_f1: 0.4213
 epoch: 7, train_loss: 1.1737, test_loss: 1.1327, test_f1: 0.4318
 epoch: 8, train_loss: 1.1614, test_loss: 1.1171, test_f1: 0.4458
 epoch: 9, train_loss: 1.1491, test_loss: 1.1048, test_f1: 0.4382
 epoch: 10, train_loss: 1.1612, test_loss: 1.1066, test_f1: 0.4579
 epoch: 11, train_loss: 1.1306, test_loss: 1.1035, test_f1: 0.4500
 epoch: 12, train_loss: 1.1311, test_loss: 1.0978, test_f1: 0.4518
 epoch: 13, train_loss: 1.1305, test_loss: 1.0916, test_f1: 0.4565
 epoch: 14, train_loss: 1.1286, test_loss: 1.0944, test_f1: 0.4539
 epoch: 15, train_loss: 1.1217, test_loss: 1.0957, test_f1: 0.4469
 epoch: 16, train_loss: 1.1138, test_loss: 1.0841, test_f1: 0.4324
 epoch: 17, train_loss: 1.1180, test_loss: 1.0818, test_f1: 0.4346
 epoch: 18, train_loss: 1.1036, test_loss: 1.0807, test_f1: 0.4308
 epoch: 19, train_loss: 1.0982, test_loss: 1.0765, test_f1: 0.4269
 epoch: 20, train_loss: 1.1002, test_loss: 1.0709, test_f1: 0.4272
 epoch: 21, train_loss: 1.0977, test_loss: 1.0640, test_f1: 0.4298
 epoch: 22, train_loss: 1.0906, test_loss: 1.0569, test_f1: 0.4319
 epoch: 23, train_loss: 1.0833, test_loss: 1.0636, test_f1: 0.4172
 epoch: 24, train_loss: 1.0827, test_loss: 1.0605, test_f1: 0.4250
 epoch: 25, train_loss: 1.0790, test_loss: 1.0522, test_f1: 0.4193
 epoch: 26, train_loss: 1.0636, test_loss: 1.0547, test_f1: 0.4235
 epoch: 27, train_loss: 1.0593, test_loss: 1.0508, test_f1: 0.4205
 epoch: 28, train_loss: 1.0622, test_loss: 1.0327, test_f1: 0.4282
 epoch: 29, train_loss: 1.0574, test_loss: 1.0386, test_f1: 0.4222
 epoch: 30, train_loss: 1.0517, test_loss: 1.0402, test_f1: 0.4216
 epoch: 31, train_loss: 1.0466, test_loss: 1.0429, test_f1: 0.4220
 epoch: 32, train_loss: 1.0430, test_loss: 1.0418, test_f1: 0.4230
 epoch: 33, train_loss: 1.0421, test_loss: 1.0246, test_f1: 0.4310
 epoch: 34, train_loss: 1.0444, test_loss: 1.0299, test_f1: 0.4240
 epoch: 35, train_loss: 1.0367, test_loss: 1.0180, test_f1: 0.4317
 epoch: 36, train_loss: 1.0272, test_loss: 1.0194, test_f1: 0.4331
 epoch: 37, train_loss: 1.0258, test_loss: 1.0117, test_f1: 0.4465
 epoch: 38, train_loss: 1.0209, test_loss: 1.0082, test_f1: 0.4457
 epoch: 39, train_loss: 1.0261, test_loss: 1.0151, test_f1: 0.4412
 epoch: 40, train_loss: 1.0261, test_loss: 1.0021, test_f1: 0.4437
 epoch: 41, train_loss: 1.0194, test_loss: 1.0023, test_f1: 0.4495
 epoch: 42, train_loss: 1.0185, test_loss: 1.0065, test_f1: 0.4547
 epoch: 43, train_loss: 1.0089, test_loss: 0.9992, test_f1: 0.4515
 epoch: 44, train_loss: 1.0026, test_loss: 0.9970, test_f1: 0.4452
 epoch: 45, train_loss: 1.0008, test_loss: 1.0600, test_f1: 0.4305
 epoch: 46, train_loss: 1.0029, test_loss: 1.0292, test_f1: 0.4450
 epoch: 47, train_loss: 1.0055, test_loss: 1.0103, test_f1: 0.4417
 epoch: 48, train_loss: 0.9965, test_loss: 1.0009, test_f1: 0.4551
 epoch: 49, train_loss: 0.9887, test_loss: 0.9917, test_f1: 0.4552
 epoch: 50, train_loss: 0.9916, test_loss: 1.0013, test_f1: 0.4546
 epoch: 51, train_loss: 0.9813, test_loss: 0.9940, test_f1: 0.4729
 epoch: 52, train_loss: 0.9857, test_loss: 0.9865, test_f1: 0.4594
 epoch: 53, train_loss: 0.9805, test_loss: 1.0115, test_f1: 0.4405
 epoch: 54, train_loss: 0.9738, test_loss: 0.9955, test_f1: 0.4471
 epoch: 55, train_loss: 0.9722, test_loss: 1.0096, test_f1: 0.4536
 epoch: 56, train_loss: 0.9769, test_loss: 0.9969, test_f1: 0.4609
 epoch: 57, train_loss: 0.9764, test_loss: 0.9905, test_f1: 0.4536
 epoch: 58, train_loss: 0.9646, test_loss: 0.9940, test_f1: 0.4476
 epoch: 59, train_loss: 0.9745, test_loss: 1.0473, test_f1: 0.4395
 epoch: 60, train_loss: 0.9726, test_loss: 1.0398, test_f1: 0.4489
 epoch: 61, train_loss: 0.9553, test_loss: 1.1013, test_f1: 0.4409
 epoch: 62, train_loss: 0.9672, test_loss: 1.0139, test_f1: 0.4506
 epoch: 63, train_loss: 0.9590, test_loss: 1.0531, test_f1: 0.4433
 epoch: 64, train_loss: 0.9604, test_loss: 1.0435, test_f1: 0.4356
 epoch: 65, train_loss: 0.9630, test_loss: 1.0544, test_f1: 0.4447
 epoch: 66, train_loss: 0.9554, test_loss: 1.0955, test_f1: 0.4431
 epoch: 67, train_loss: 0.9631, test_loss: 1.0238, test_f1: 0.4443
 epoch: 68, train_loss: 0.9618, test_loss: 1.0166, test_f1: 0.4444
 epoch: 69, train_loss: 0.9606, test_loss: 1.0225, test_f1: 0.4446
 epoch: 70, train_loss: 0.9466, test_loss: 1.0507, test_f1: 0.4487
 epoch: 71, train_loss: 0.9460, test_loss: 1.0120, test_f1: 0.4558
 epoch: 72, train_loss: 0.9517, test_loss: 1.0121, test_f1: 0.4463
 epoch: 73, train_loss: 0.9474, test_loss: 1.0111, test_f1: 0.4354
 epoch: 74, train_loss: 0.9506, test_loss: 1.0390, test_f1: 0.4406
 epoch: 75, train_loss: 0.9485, test_loss: 1.0147, test_f1: 0.4531
 epoch: 76, train_loss: 0.9489, test_loss: 1.0921, test_f1: 0.4342
 epoch: 77, train_loss: 0.9384, test_loss: 1.1199, test_f1: 0.4371
 epoch: 78, train_loss: 0.9368, test_loss: 1.0807, test_f1: 0.4473
 epoch: 79, train_loss: 0.9389, test_loss: 1.0736, test_f1: 0.4525
 epoch: 80, train_loss: 0.9490, test_loss: 1.0325, test_f1: 0.4467
 epoch: 81, train_loss: 0.9424, test_loss: 1.0397, test_f1: 0.4473
 epoch: 82, train_loss: 0.9348, test_loss: 1.0612, test_f1: 0.4516
 epoch: 83, train_loss: 0.9450, test_loss: 1.0837, test_f1: 0.4344
 epoch: 84, train_loss: 0.9450, test_loss: 1.0727, test_f1: 0.4320
 epoch: 85, train_loss: 0.9319, test_loss: 1.1723, test_f1: 0.4304
 epoch: 86, train_loss: 0.9280, test_loss: 1.0827, test_f1: 0.4632
 epoch: 87, train_loss: 0.9398, test_loss: 1.0732, test_f1: 0.4549
 epoch: 88, train_loss: 0.9351, test_loss: 1.1208, test_f1: 0.4314
 epoch: 89, train_loss: 0.9222, test_loss: 1.2136, test_f1: 0.4380
 epoch: 90, train_loss: 0.9289, test_loss: 1.0782, test_f1: 0.4356
 epoch: 91, train_loss: 0.9216, test_loss: 1.1577, test_f1: 0.4370
 epoch: 92, train_loss: 0.9361, test_loss: 1.1165, test_f1: 0.4329
 epoch: 93, train_loss: 0.9286, test_loss: 1.1688, test_f1: 0.4275
 epoch: 94, train_loss: 0.9287, test_loss: 1.1623, test_f1: 0.4285
 epoch: 95, train_loss: 0.9316, test_loss: 1.1422, test_f1: 0.4370
 epoch: 96, train_loss: 0.9255, test_loss: 1.1448, test_f1: 0.4336
 epoch: 97, train_loss: 0.9261, test_loss: 1.0747, test_f1: 0.4567
 epoch: 98, train_loss: 0.9151, test_loss: 1.1270, test_f1: 0.4442
 epoch: 99, train_loss: 0.9075, test_loss: 1.0796, test_f1: 0.4610
##################ITERATION #8 ****************************************
 epoch: 0, train_loss: 1.4727, test_loss: 1.3098, test_f1: 0.2274
 epoch: 1, train_loss: 1.3221, test_loss: 1.2850, test_f1: 0.2274
 epoch: 2, train_loss: 1.2783, test_loss: 1.2410, test_f1: 0.2426
 epoch: 3, train_loss: 1.2522, test_loss: 1.2073, test_f1: 0.3565
 epoch: 4, train_loss: 1.2176, test_loss: 1.1961, test_f1: 0.3630
 epoch: 5, train_loss: 1.2050, test_loss: 1.1754, test_f1: 0.3647
 epoch: 6, train_loss: 1.1944, test_loss: 1.1619, test_f1: 0.3820
 epoch: 7, train_loss: 1.1841, test_loss: 1.1519, test_f1: 0.3918
 epoch: 8, train_loss: 1.1799, test_loss: 1.1431, test_f1: 0.3980
 epoch: 9, train_loss: 1.1796, test_loss: 1.1407, test_f1: 0.3914
 epoch: 10, train_loss: 1.1714, test_loss: 1.1254, test_f1: 0.3992
 epoch: 11, train_loss: 1.1541, test_loss: 1.1171, test_f1: 0.4039
 epoch: 12, train_loss: 1.1423, test_loss: 1.1121, test_f1: 0.4104
 epoch: 13, train_loss: 1.1423, test_loss: 1.1018, test_f1: 0.4127
 epoch: 14, train_loss: 1.1326, test_loss: 1.0945, test_f1: 0.4154
 epoch: 15, train_loss: 1.1235, test_loss: 1.0910, test_f1: 0.4224
 epoch: 16, train_loss: 1.1244, test_loss: 1.0810, test_f1: 0.4203
 epoch: 17, train_loss: 1.1009, test_loss: 1.0805, test_f1: 0.4206
 epoch: 18, train_loss: 1.0997, test_loss: 1.0759, test_f1: 0.4234
 epoch: 19, train_loss: 1.0848, test_loss: 1.0653, test_f1: 0.4264
 epoch: 20, train_loss: 1.0821, test_loss: 1.0489, test_f1: 0.4239
 epoch: 21, train_loss: 1.0678, test_loss: 1.0449, test_f1: 0.4320
 epoch: 22, train_loss: 1.0727, test_loss: 1.0342, test_f1: 0.4384
 epoch: 23, train_loss: 1.0592, test_loss: 1.0206, test_f1: 0.4436
 epoch: 24, train_loss: 1.0553, test_loss: 1.0208, test_f1: 0.4372
 epoch: 25, train_loss: 1.0492, test_loss: 1.0127, test_f1: 0.4408
 epoch: 26, train_loss: 1.0439, test_loss: 1.0061, test_f1: 0.4429
 epoch: 27, train_loss: 1.0326, test_loss: 0.9998, test_f1: 0.4427
 epoch: 28, train_loss: 1.0236, test_loss: 1.0055, test_f1: 0.4485
 epoch: 29, train_loss: 1.0227, test_loss: 0.9912, test_f1: 0.4460
 epoch: 30, train_loss: 1.0272, test_loss: 0.9932, test_f1: 0.4543
 epoch: 31, train_loss: 1.0134, test_loss: 0.9884, test_f1: 0.4544
 epoch: 32, train_loss: 1.0021, test_loss: 0.9807, test_f1: 0.4522
 epoch: 33, train_loss: 0.9979, test_loss: 0.9803, test_f1: 0.4524
 epoch: 34, train_loss: 1.0033, test_loss: 0.9813, test_f1: 0.4573
 epoch: 35, train_loss: 0.9966, test_loss: 0.9721, test_f1: 0.4610
 epoch: 36, train_loss: 0.9954, test_loss: 0.9696, test_f1: 0.4573
 epoch: 37, train_loss: 0.9788, test_loss: 0.9570, test_f1: 0.4646
 epoch: 38, train_loss: 0.9900, test_loss: 0.9713, test_f1: 0.4674
 epoch: 39, train_loss: 0.9769, test_loss: 0.9627, test_f1: 0.4698
 epoch: 40, train_loss: 0.9804, test_loss: 0.9600, test_f1: 0.4695
 epoch: 41, train_loss: 0.9712, test_loss: 0.9460, test_f1: 0.4734
 epoch: 42, train_loss: 0.9682, test_loss: 0.9512, test_f1: 0.4667
 epoch: 43, train_loss: 0.9648, test_loss: 0.9713, test_f1: 0.4616
 epoch: 44, train_loss: 0.9644, test_loss: 0.9677, test_f1: 0.4710
 epoch: 45, train_loss: 0.9630, test_loss: 0.9458, test_f1: 0.4750
 epoch: 46, train_loss: 0.9557, test_loss: 0.9479, test_f1: 0.4796
 epoch: 47, train_loss: 0.9449, test_loss: 0.9600, test_f1: 0.4664
 epoch: 48, train_loss: 0.9414, test_loss: 0.9538, test_f1: 0.4785
 epoch: 49, train_loss: 0.9382, test_loss: 0.9537, test_f1: 0.4719
 epoch: 50, train_loss: 0.9330, test_loss: 0.9716, test_f1: 0.4721
 epoch: 51, train_loss: 0.9332, test_loss: 0.9466, test_f1: 0.4786
 epoch: 52, train_loss: 0.9461, test_loss: 0.9525, test_f1: 0.4760
 epoch: 53, train_loss: 0.9316, test_loss: 0.9485, test_f1: 0.4776
 epoch: 54, train_loss: 0.9282, test_loss: 0.9412, test_f1: 0.4846
 epoch: 55, train_loss: 0.9299, test_loss: 0.9556, test_f1: 0.4827
 epoch: 56, train_loss: 0.9229, test_loss: 0.9602, test_f1: 0.4776
 epoch: 57, train_loss: 0.9244, test_loss: 0.9577, test_f1: 0.4790
 epoch: 58, train_loss: 0.9198, test_loss: 0.9521, test_f1: 0.4893
 epoch: 59, train_loss: 0.9226, test_loss: 0.9485, test_f1: 0.4910
 epoch: 60, train_loss: 0.9230, test_loss: 0.9554, test_f1: 0.4787
 epoch: 61, train_loss: 0.9250, test_loss: 0.9710, test_f1: 0.4781
 epoch: 62, train_loss: 0.9257, test_loss: 0.9617, test_f1: 0.4844
 epoch: 63, train_loss: 0.9144, test_loss: 0.9536, test_f1: 0.4887
 epoch: 64, train_loss: 0.9156, test_loss: 0.9607, test_f1: 0.4823
 epoch: 65, train_loss: 0.9120, test_loss: 0.9754, test_f1: 0.4800
 epoch: 66, train_loss: 0.9224, test_loss: 0.9725, test_f1: 0.4841
 epoch: 67, train_loss: 0.9133, test_loss: 0.9485, test_f1: 0.4871
 epoch: 68, train_loss: 0.9144, test_loss: 0.9645, test_f1: 0.4847
 epoch: 69, train_loss: 0.9032, test_loss: 0.9752, test_f1: 0.4803
 epoch: 70, train_loss: 0.8967, test_loss: 0.9660, test_f1: 0.4873
 epoch: 71, train_loss: 0.9095, test_loss: 0.9787, test_f1: 0.4932
 epoch: 72, train_loss: 0.8985, test_loss: 0.9716, test_f1: 0.4869
 epoch: 73, train_loss: 0.9021, test_loss: 1.0029, test_f1: 0.4780
 epoch: 74, train_loss: 0.9019, test_loss: 0.9648, test_f1: 0.4865
 epoch: 75, train_loss: 0.9023, test_loss: 0.9731, test_f1: 0.4927
 epoch: 76, train_loss: 0.8905, test_loss: 0.9639, test_f1: 0.4918
 epoch: 77, train_loss: 0.8932, test_loss: 0.9910, test_f1: 0.4715
 epoch: 78, train_loss: 0.9022, test_loss: 0.9952, test_f1: 0.4798
 epoch: 79, train_loss: 0.8871, test_loss: 0.9795, test_f1: 0.4872
 epoch: 80, train_loss: 0.8980, test_loss: 0.9809, test_f1: 0.4863
 epoch: 81, train_loss: 0.8992, test_loss: 0.9970, test_f1: 0.4826
 epoch: 82, train_loss: 0.8950, test_loss: 0.9724, test_f1: 0.4890
 epoch: 83, train_loss: 0.9016, test_loss: 0.9975, test_f1: 0.4704
 epoch: 84, train_loss: 0.8986, test_loss: 0.9692, test_f1: 0.4824
 epoch: 85, train_loss: 0.8964, test_loss: 0.9688, test_f1: 0.4836
 epoch: 86, train_loss: 0.8904, test_loss: 0.9781, test_f1: 0.4992
 epoch: 87, train_loss: 0.8924, test_loss: 0.9820, test_f1: 0.4920
 epoch: 88, train_loss: 0.8852, test_loss: 0.9889, test_f1: 0.4882
 epoch: 89, train_loss: 0.8876, test_loss: 1.0015, test_f1: 0.4815
 epoch: 90, train_loss: 0.8868, test_loss: 0.9738, test_f1: 0.4916
 epoch: 91, train_loss: 0.8834, test_loss: 0.9708, test_f1: 0.4916
 epoch: 92, train_loss: 0.8731, test_loss: 0.9947, test_f1: 0.4870
 epoch: 93, train_loss: 0.8892, test_loss: 1.0061, test_f1: 0.4845
 epoch: 94, train_loss: 0.8731, test_loss: 0.9781, test_f1: 0.4940
 epoch: 95, train_loss: 0.8828, test_loss: 0.9735, test_f1: 0.4876
 epoch: 96, train_loss: 0.8809, test_loss: 0.9785, test_f1: 0.4871
 epoch: 97, train_loss: 0.8738, test_loss: 0.9885, test_f1: 0.4996
 epoch: 98, train_loss: 0.8756, test_loss: 0.9786, test_f1: 0.4876
 epoch: 99, train_loss: 0.8707, test_loss: 0.9900, test_f1: 0.5140
##################ITERATION #9 ****************************************
 epoch: 0, train_loss: 1.3827, test_loss: 1.3407, test_f1: 0.2274
 epoch: 1, train_loss: 1.2772, test_loss: 1.2891, test_f1: 0.2374
 epoch: 2, train_loss: 1.2551, test_loss: 1.2440, test_f1: 0.3083
 epoch: 3, train_loss: 1.2355, test_loss: 1.2229, test_f1: 0.3308
 epoch: 4, train_loss: 1.2184, test_loss: 1.2030, test_f1: 0.3279
 epoch: 5, train_loss: 1.2215, test_loss: 1.1862, test_f1: 0.3316
 epoch: 6, train_loss: 1.2129, test_loss: 1.1777, test_f1: 0.3413
 epoch: 7, train_loss: 1.1906, test_loss: 1.1713, test_f1: 0.3817
 epoch: 8, train_loss: 1.1849, test_loss: 1.1576, test_f1: 0.3809
 epoch: 9, train_loss: 1.1861, test_loss: 1.1446, test_f1: 0.3712
 epoch: 10, train_loss: 1.1728, test_loss: 1.1340, test_f1: 0.3805
 epoch: 11, train_loss: 1.1721, test_loss: 1.1298, test_f1: 0.4117
 epoch: 12, train_loss: 1.1676, test_loss: 1.1250, test_f1: 0.3706
 epoch: 13, train_loss: 1.1508, test_loss: 1.1187, test_f1: 0.3850
 epoch: 14, train_loss: 1.1463, test_loss: 1.1111, test_f1: 0.4016
 epoch: 15, train_loss: 1.1477, test_loss: 1.1067, test_f1: 0.4020
 epoch: 16, train_loss: 1.1480, test_loss: 1.1010, test_f1: 0.3952
 epoch: 17, train_loss: 1.1345, test_loss: 1.0977, test_f1: 0.4087
 epoch: 18, train_loss: 1.1356, test_loss: 1.0895, test_f1: 0.4184
 epoch: 19, train_loss: 1.1290, test_loss: 1.0872, test_f1: 0.4109
 epoch: 20, train_loss: 1.1152, test_loss: 1.0792, test_f1: 0.4144
 epoch: 21, train_loss: 1.1046, test_loss: 1.0589, test_f1: 0.4180
 epoch: 22, train_loss: 1.0984, test_loss: 1.0601, test_f1: 0.4349
 epoch: 23, train_loss: 1.1043, test_loss: 1.0532, test_f1: 0.4265
 epoch: 24, train_loss: 1.0924, test_loss: 1.0578, test_f1: 0.4082
 epoch: 25, train_loss: 1.0877, test_loss: 1.0480, test_f1: 0.4399
 epoch: 26, train_loss: 1.0739, test_loss: 1.0344, test_f1: 0.4461
 epoch: 27, train_loss: 1.0701, test_loss: 1.0504, test_f1: 0.4446
 epoch: 28, train_loss: 1.0694, test_loss: 1.0286, test_f1: 0.4444
 epoch: 29, train_loss: 1.0675, test_loss: 1.0320, test_f1: 0.4439
 epoch: 30, train_loss: 1.0649, test_loss: 1.0223, test_f1: 0.4515
 epoch: 31, train_loss: 1.0403, test_loss: 1.0177, test_f1: 0.4533
 epoch: 32, train_loss: 1.0473, test_loss: 1.0314, test_f1: 0.4540
 epoch: 33, train_loss: 1.0409, test_loss: 1.0090, test_f1: 0.4570
 epoch: 34, train_loss: 1.0395, test_loss: 1.0159, test_f1: 0.4521
 epoch: 35, train_loss: 1.0383, test_loss: 1.0027, test_f1: 0.4516
 epoch: 36, train_loss: 1.0268, test_loss: 1.0002, test_f1: 0.4573
 epoch: 37, train_loss: 1.0276, test_loss: 1.0004, test_f1: 0.4605
 epoch: 38, train_loss: 1.0149, test_loss: 0.9895, test_f1: 0.4611
 epoch: 39, train_loss: 1.0150, test_loss: 0.9979, test_f1: 0.4439
 epoch: 40, train_loss: 1.0076, test_loss: 1.0035, test_f1: 0.4500
 epoch: 41, train_loss: 1.0075, test_loss: 0.9927, test_f1: 0.4736
 epoch: 42, train_loss: 1.0161, test_loss: 0.9842, test_f1: 0.4806
 epoch: 43, train_loss: 1.0057, test_loss: 0.9828, test_f1: 0.4867
 epoch: 44, train_loss: 0.9937, test_loss: 0.9895, test_f1: 0.4719
 epoch: 45, train_loss: 0.9976, test_loss: 0.9876, test_f1: 0.4688
 epoch: 46, train_loss: 0.9957, test_loss: 0.9784, test_f1: 0.4667
 epoch: 47, train_loss: 0.9875, test_loss: 0.9868, test_f1: 0.4745
 epoch: 48, train_loss: 0.9759, test_loss: 0.9880, test_f1: 0.4588
 epoch: 49, train_loss: 0.9835, test_loss: 0.9790, test_f1: 0.4745
 epoch: 50, train_loss: 0.9797, test_loss: 0.9846, test_f1: 0.4657
 epoch: 51, train_loss: 0.9727, test_loss: 0.9981, test_f1: 0.4611
 epoch: 52, train_loss: 0.9703, test_loss: 0.9827, test_f1: 0.4689
 epoch: 53, train_loss: 0.9624, test_loss: 0.9827, test_f1: 0.4688
 epoch: 54, train_loss: 0.9527, test_loss: 0.9728, test_f1: 0.4774
 epoch: 55, train_loss: 0.9697, test_loss: 0.9863, test_f1: 0.4670
 epoch: 56, train_loss: 0.9557, test_loss: 0.9843, test_f1: 0.4698
 epoch: 57, train_loss: 0.9497, test_loss: 1.0142, test_f1: 0.4649
 epoch: 58, train_loss: 0.9534, test_loss: 0.9848, test_f1: 0.4714
 epoch: 59, train_loss: 0.9522, test_loss: 1.0116, test_f1: 0.4594
 epoch: 60, train_loss: 0.9518, test_loss: 1.0106, test_f1: 0.4759
 epoch: 61, train_loss: 0.9466, test_loss: 1.0069, test_f1: 0.4673
 epoch: 62, train_loss: 0.9502, test_loss: 0.9697, test_f1: 0.4704
 epoch: 63, train_loss: 0.9488, test_loss: 0.9903, test_f1: 0.4705
 epoch: 64, train_loss: 0.9445, test_loss: 0.9949, test_f1: 0.4738
 epoch: 65, train_loss: 0.9349, test_loss: 1.0003, test_f1: 0.4786
 epoch: 66, train_loss: 0.9417, test_loss: 0.9939, test_f1: 0.4928
 epoch: 67, train_loss: 0.9463, test_loss: 1.0303, test_f1: 0.4819
 epoch: 68, train_loss: 0.9404, test_loss: 1.0120, test_f1: 0.4809
 epoch: 69, train_loss: 0.9310, test_loss: 1.0229, test_f1: 0.4649
 epoch: 70, train_loss: 0.9424, test_loss: 1.0042, test_f1: 0.4778
 epoch: 71, train_loss: 0.9423, test_loss: 1.0042, test_f1: 0.4737
 epoch: 72, train_loss: 0.9269, test_loss: 0.9966, test_f1: 0.4814
 epoch: 73, train_loss: 0.9296, test_loss: 1.0224, test_f1: 0.4786
 epoch: 74, train_loss: 0.9231, test_loss: 1.0068, test_f1: 0.4827
 epoch: 75, train_loss: 0.9310, test_loss: 1.0148, test_f1: 0.4693
 epoch: 76, train_loss: 0.9272, test_loss: 1.0210, test_f1: 0.4644
 epoch: 77, train_loss: 0.9384, test_loss: 0.9930, test_f1: 0.4750
 epoch: 78, train_loss: 0.9294, test_loss: 0.9914, test_f1: 0.4854
 epoch: 79, train_loss: 0.9222, test_loss: 0.9890, test_f1: 0.4748
 epoch: 80, train_loss: 0.9234, test_loss: 1.0400, test_f1: 0.4538
 epoch: 81, train_loss: 0.9108, test_loss: 1.0122, test_f1: 0.4818
 epoch: 82, train_loss: 0.9240, test_loss: 1.0038, test_f1: 0.4676
 epoch: 83, train_loss: 0.9112, test_loss: 1.0163, test_f1: 0.4657
 epoch: 84, train_loss: 0.8983, test_loss: 1.0380, test_f1: 0.4640
 epoch: 85, train_loss: 0.9205, test_loss: 1.0381, test_f1: 0.4514
 epoch: 86, train_loss: 0.9178, test_loss: 1.0162, test_f1: 0.4865
 epoch: 87, train_loss: 0.9170, test_loss: 0.9975, test_f1: 0.4822
 epoch: 88, train_loss: 0.9224, test_loss: 1.0147, test_f1: 0.4771
 epoch: 89, train_loss: 0.9100, test_loss: 1.0549, test_f1: 0.4383
 epoch: 90, train_loss: 0.9069, test_loss: 1.0159, test_f1: 0.4810
 epoch: 91, train_loss: 0.9103, test_loss: 1.0124, test_f1: 0.4562
 epoch: 92, train_loss: 0.9067, test_loss: 1.0197, test_f1: 0.4736
 epoch: 93, train_loss: 0.9058, test_loss: 1.0544, test_f1: 0.4550
 epoch: 94, train_loss: 0.8978, test_loss: 1.0131, test_f1: 0.4831
 epoch: 95, train_loss: 0.9057, test_loss: 1.0145, test_f1: 0.4881
 epoch: 96, train_loss: 0.9072, test_loss: 1.0299, test_f1: 0.4877
 epoch: 97, train_loss: 0.9043, test_loss: 1.0270, test_f1: 0.4896
 epoch: 98, train_loss: 0.9022, test_loss: 1.0183, test_f1: 0.4940
 epoch: 99, train_loss: 0.9088, test_loss: 1.0193, test_f1: 0.4851

Training completed in 387.70 seconds
Best F1: 0.5210 at epoch 88
Mean F1 across iterations: 0.4920  0.0165
========================FINAL RESULTS================================
FEGIN weighted F1: 0.5210  0.0165
python main.py --data ltspice_examples --representation component_component --model FEGIN --layers 4 --hiddens 16 --batch_size 256 --lr 0.001 --emb_size 512 --epochs 100 --save_appendix component_component_L4_H16_BS256_LR0.001_E512 --no_val
-----



STDERR:
  File "main.py", line 370, in <module>
    main()
  File "main.py", line 254, in main
    dataset = dataset_class(
  File "/home/philip/projects/ltspice_examples_code_repo/Circuit-Completion-Using-GNNs/component_classification_with_link_prediction_head/evaluation/FEGIN/kernel/circuit_datasets.py", line 15, in __init__
    self.data, self.slices = torch.load(self.processed_paths[0])
  File "/home/philip/.local/lib/python3.8/site-packages/torch/serialization.py", line 1040, in load
    warnings.warn(
  File "/usr/lib/python3.8/warnings.py", line 109, in _showwarnmsg
    sw(msg.message, msg.category, msg.filename, msg.lineno,
  File "main.py", line 47, in warn_with_traceback
    traceback.print_stack(file=log)
/home/philip/projects/ltspice_examples_code_repo/Circuit-Completion-Using-GNNs/component_classification_with_link_prediction_head/evaluation/FEGIN/kernel/circuit_datasets.py:15: FutureWarning: You are using `torch.load` with `weights_only=False` (the current default value), which uses the default pickle module implicitly. It is possible to construct malicious pickle data which will execute arbitrary code during unpickling (See https://github.com/pytorch/pytorch/blob/main/SECURITY.md#untrusted-models for more details). In a future release, the default value for `weights_only` will be flipped to `True`. This limits the functions that could be executed during unpickling. Arbitrary objects will no longer be allowed to be loaded via this mode unless they are explicitly allowlisted by the user via `torch.serialization.add_safe_globals`. We recommend you start setting `weights_only=True` for any use case where you don't have full control of the loaded file. Please open an issue on GitHub for any issues related to this experimental feature.
  self.data, self.slices = torch.load(self.processed_paths[0])
