STDOUT:
Results will be saved in /home/philip/projects/ltspice_examples_code_repo/Circuit-Completion-Using-GNNs/component_classification_with_link_prediction_head/evaluation/FEGIN/results/model_FEGIN_dataset_ltspice_demos
Command line input: python main.py --data ltspice_demos --representation component_pin_net --model FEGIN --layers 2 --hiddens 32 --batch_size 256 --lr 0.1 --emb_size 512 --epochs 100 --save_appendix component_pin_net_L2_H32_BS256_LR0.1_E512 --no_val
 is saved.
-----
ltspice_demos - FEGIN
Using 2 layers, 32 hidden units, h = 2
Loading component_pin_net representation dataset
ENTERED
Training FEGIN on component_pin_net representation
Train: 1565, Test: 383
##################ITERATION #0 ****************************************
 epoch: 0, train_loss: 1.3085, test_loss: 1.6411, test_f1: 0.2281
 epoch: 1, train_loss: 1.1708, test_loss: 1.2446, test_f1: 0.2984
 epoch: 2, train_loss: 1.1019, test_loss: 1.5836, test_f1: 0.2278
 epoch: 3, train_loss: 1.0700, test_loss: 1.2061, test_f1: 0.3327
 epoch: 4, train_loss: 1.0697, test_loss: 1.1243, test_f1: 0.3395
 epoch: 5, train_loss: 1.0438, test_loss: 1.3922, test_f1: 0.2829
 epoch: 6, train_loss: 1.0413, test_loss: 1.1440, test_f1: 0.3344
 epoch: 7, train_loss: 1.0468, test_loss: 1.3124, test_f1: 0.2822
 epoch: 8, train_loss: 1.0485, test_loss: 1.4133, test_f1: 0.3189
 epoch: 9, train_loss: 1.0583, test_loss: 1.1330, test_f1: 0.4234
 epoch: 10, train_loss: 1.0208, test_loss: 2.2954, test_f1: 0.2188
 epoch: 11, train_loss: 1.0739, test_loss: 2.3777, test_f1: 0.2312
 epoch: 12, train_loss: 1.0390, test_loss: 1.7265, test_f1: 0.2950
 epoch: 13, train_loss: 1.0224, test_loss: 1.6649, test_f1: 0.2895
 epoch: 14, train_loss: 1.0304, test_loss: 1.3231, test_f1: 0.2683
 epoch: 15, train_loss: 1.0490, test_loss: 1.4248, test_f1: 0.2600
 epoch: 16, train_loss: 1.0586, test_loss: 1.1958, test_f1: 0.3420
 epoch: 17, train_loss: 1.0442, test_loss: 1.1322, test_f1: 0.3344
 epoch: 18, train_loss: 1.0441, test_loss: 1.1643, test_f1: 0.3244
 epoch: 19, train_loss: 1.0535, test_loss: 1.2930, test_f1: 0.1921
 epoch: 20, train_loss: 1.0618, test_loss: 1.1514, test_f1: 0.3290
 epoch: 21, train_loss: 1.0406, test_loss: 1.3493, test_f1: 0.2390
 epoch: 22, train_loss: 1.1135, test_loss: 1.1598, test_f1: 0.3234
 epoch: 23, train_loss: 1.0571, test_loss: 1.1471, test_f1: 0.3290
 epoch: 24, train_loss: 1.0691, test_loss: 1.1240, test_f1: 0.3395
 epoch: 25, train_loss: 1.0618, test_loss: 1.1199, test_f1: 0.3388
 epoch: 26, train_loss: 1.0465, test_loss: 1.1552, test_f1: 0.3354
 epoch: 27, train_loss: 1.0396, test_loss: 1.1272, test_f1: 0.3344
 epoch: 28, train_loss: 1.0449, test_loss: 1.1359, test_f1: 0.3344
 epoch: 29, train_loss: 1.0427, test_loss: 1.1141, test_f1: 0.3395
 epoch: 30, train_loss: 1.0374, test_loss: 1.1414, test_f1: 0.3317
 epoch: 31, train_loss: 1.0649, test_loss: 1.1584, test_f1: 0.3290
 epoch: 32, train_loss: 1.0661, test_loss: 1.1496, test_f1: 0.3290
 epoch: 33, train_loss: 1.0546, test_loss: 1.1218, test_f1: 0.3344
 epoch: 34, train_loss: 1.0646, test_loss: 1.1581, test_f1: 0.3290
 epoch: 35, train_loss: 1.0493, test_loss: 1.1505, test_f1: 0.3317
 epoch: 36, train_loss: 1.0402, test_loss: 1.1200, test_f1: 0.3344
 epoch: 37, train_loss: 1.0481, test_loss: 1.1425, test_f1: 0.3344
 epoch: 38, train_loss: 1.0363, test_loss: 1.0983, test_f1: 0.3395
 epoch: 39, train_loss: 1.0323, test_loss: 1.1047, test_f1: 0.3395
 epoch: 40, train_loss: 1.0186, test_loss: 1.1111, test_f1: 0.3390
 epoch: 41, train_loss: 1.0304, test_loss: 1.1397, test_f1: 0.3344
 epoch: 42, train_loss: 1.0220, test_loss: 1.1605, test_f1: 0.3317
 epoch: 43, train_loss: 1.0111, test_loss: 1.1656, test_f1: 0.3317
 epoch: 44, train_loss: 1.0309, test_loss: 1.1372, test_f1: 0.3344
 epoch: 45, train_loss: 1.0310, test_loss: 1.1138, test_f1: 0.3344
 epoch: 46, train_loss: 1.0173, test_loss: 1.1057, test_f1: 0.3344
 epoch: 47, train_loss: 1.0239, test_loss: 1.1382, test_f1: 0.3344
 epoch: 48, train_loss: 1.0223, test_loss: 1.1700, test_f1: 0.3290
 epoch: 49, train_loss: 1.0157, test_loss: 1.1332, test_f1: 0.3317
 epoch: 50, train_loss: 1.0082, test_loss: 1.1298, test_f1: 0.3344
 epoch: 51, train_loss: 1.0216, test_loss: 1.1467, test_f1: 0.3322
 epoch: 52, train_loss: 1.0096, test_loss: 1.1386, test_f1: 0.3362
 epoch: 53, train_loss: 1.0142, test_loss: 1.2909, test_f1: 0.3229
 epoch: 54, train_loss: 1.0100, test_loss: 1.1208, test_f1: 0.3640
 epoch: 55, train_loss: 1.0144, test_loss: 1.1485, test_f1: 0.3460
 epoch: 56, train_loss: 1.0173, test_loss: 1.1075, test_f1: 0.3522
 epoch: 57, train_loss: 1.0089, test_loss: 1.1245, test_f1: 0.3353
 epoch: 58, train_loss: 1.0067, test_loss: 1.1456, test_f1: 0.3317
 epoch: 59, train_loss: 1.0068, test_loss: 1.1514, test_f1: 0.3317
 epoch: 60, train_loss: 1.0084, test_loss: 1.1238, test_f1: 0.3346
 epoch: 61, train_loss: 1.0033, test_loss: 1.1600, test_f1: 0.3290
 epoch: 62, train_loss: 1.0081, test_loss: 1.1189, test_f1: 0.3397
 epoch: 63, train_loss: 0.9961, test_loss: 1.1428, test_f1: 0.3358
 epoch: 64, train_loss: 1.0646, test_loss: 1.1830, test_f1: 0.3051
 epoch: 65, train_loss: 1.0545, test_loss: 1.1323, test_f1: 0.3344
 epoch: 66, train_loss: 1.0356, test_loss: 1.2160, test_f1: 0.2984
 epoch: 67, train_loss: 1.0171, test_loss: 1.1177, test_f1: 0.3321
 epoch: 68, train_loss: 1.0239, test_loss: 1.6885, test_f1: 0.3020
 epoch: 69, train_loss: 1.0251, test_loss: 4.4574, test_f1: 0.2439
 epoch: 70, train_loss: 1.0377, test_loss: 1.1004, test_f1: 0.3501
 epoch: 71, train_loss: 1.0226, test_loss: 1.0979, test_f1: 0.3526
 epoch: 72, train_loss: 1.0237, test_loss: 1.0954, test_f1: 0.3483
 epoch: 73, train_loss: 1.0208, test_loss: 1.1002, test_f1: 0.3495
 epoch: 74, train_loss: 1.0224, test_loss: 1.1267, test_f1: 0.3325
 epoch: 75, train_loss: 1.0150, test_loss: 1.1066, test_f1: 0.3396
 epoch: 76, train_loss: 1.0151, test_loss: 1.1343, test_f1: 0.3527
 epoch: 77, train_loss: 1.0108, test_loss: 1.1183, test_f1: 0.3381
 epoch: 78, train_loss: 1.0073, test_loss: 1.1066, test_f1: 0.3414
 epoch: 79, train_loss: 1.0102, test_loss: 1.1062, test_f1: 0.3438
 epoch: 80, train_loss: 1.0179, test_loss: 1.1360, test_f1: 0.3352
 epoch: 81, train_loss: 1.0081, test_loss: 1.8530, test_f1: 0.2998
 epoch: 82, train_loss: 1.1039, test_loss: 1.1549, test_f1: 0.3290
 epoch: 83, train_loss: 1.0780, test_loss: 1.1010, test_f1: 0.3481
 epoch: 84, train_loss: 1.0339, test_loss: 1.0946, test_f1: 0.3395
 epoch: 85, train_loss: 1.0149, test_loss: 1.0936, test_f1: 0.3605
 epoch: 86, train_loss: 1.0152, test_loss: 1.1025, test_f1: 0.3609
 epoch: 87, train_loss: 1.0081, test_loss: 1.1050, test_f1: 0.3377
 epoch: 88, train_loss: 1.0108, test_loss: 1.4855, test_f1: 0.3328
 epoch: 89, train_loss: 1.0300, test_loss: 1.1569, test_f1: 0.3300
 epoch: 90, train_loss: 1.0197, test_loss: 1.1455, test_f1: 0.3327
 epoch: 91, train_loss: 1.0053, test_loss: 1.1392, test_f1: 0.3322
 epoch: 92, train_loss: 1.0057, test_loss: 1.1149, test_f1: 0.3370
 epoch: 93, train_loss: 1.0087, test_loss: 1.0990, test_f1: 0.3468
 epoch: 94, train_loss: 1.0042, test_loss: 1.1504, test_f1: 0.3296
 epoch: 95, train_loss: 1.0087, test_loss: 1.1371, test_f1: 0.3338
 epoch: 96, train_loss: 1.0064, test_loss: 1.2409, test_f1: 0.3062
 epoch: 97, train_loss: 1.0075, test_loss: 1.1085, test_f1: 0.3360
 epoch: 98, train_loss: 1.0103, test_loss: 1.1164, test_f1: 0.3395
 epoch: 99, train_loss: 1.0110, test_loss: 1.1174, test_f1: 0.3444
##################ITERATION #1 ****************************************
 epoch: 0, train_loss: 1.4172, test_loss: 10.5752, test_f1: 0.2281
 epoch: 1, train_loss: 1.3373, test_loss: 3.3188, test_f1: 0.2138
 epoch: 2, train_loss: 1.3098, test_loss: 1.4130, test_f1: 0.2618
 epoch: 3, train_loss: 1.2847, test_loss: 1.3353, test_f1: 0.2570
 epoch: 4, train_loss: 1.2665, test_loss: 1.3099, test_f1: 0.2281
 epoch: 5, train_loss: 1.2563, test_loss: 1.3011, test_f1: 0.2281
 epoch: 6, train_loss: 1.2535, test_loss: 1.3032, test_f1: 0.2281
 epoch: 7, train_loss: 1.2539, test_loss: 1.3090, test_f1: 0.2281
 epoch: 8, train_loss: 1.2522, test_loss: 1.3057, test_f1: 0.2281
 epoch: 9, train_loss: 1.2522, test_loss: 1.3041, test_f1: 0.2281
 epoch: 10, train_loss: 1.2531, test_loss: 1.3031, test_f1: 0.2281
 epoch: 11, train_loss: 1.2526, test_loss: 1.3058, test_f1: 0.2281
 epoch: 12, train_loss: 1.2605, test_loss: 1.3048, test_f1: 0.2281
 epoch: 13, train_loss: 1.2524, test_loss: 1.3028, test_f1: 0.2281
 epoch: 14, train_loss: 1.2525, test_loss: 1.3004, test_f1: 0.2281
 epoch: 15, train_loss: 1.2537, test_loss: 1.2990, test_f1: 0.2281
 epoch: 16, train_loss: 1.2539, test_loss: 1.3024, test_f1: 0.2281
 epoch: 17, train_loss: 1.2524, test_loss: 1.3027, test_f1: 0.2281
 epoch: 18, train_loss: 1.2522, test_loss: 1.3058, test_f1: 0.2281
 epoch: 19, train_loss: 1.2528, test_loss: 1.3081, test_f1: 0.2281
 epoch: 20, train_loss: 1.2528, test_loss: 1.3099, test_f1: 0.2281
 epoch: 21, train_loss: 1.2527, test_loss: 1.3082, test_f1: 0.2281
 epoch: 22, train_loss: 1.2522, test_loss: 1.3041, test_f1: 0.2281
 epoch: 23, train_loss: 1.2526, test_loss: 1.3019, test_f1: 0.2281
 epoch: 24, train_loss: 1.2525, test_loss: 1.3058, test_f1: 0.2281
 epoch: 25, train_loss: 1.2522, test_loss: 1.3046, test_f1: 0.2281
 epoch: 26, train_loss: 1.2520, test_loss: 1.3029, test_f1: 0.2281
 epoch: 27, train_loss: 1.2529, test_loss: 1.3023, test_f1: 0.2281
 epoch: 28, train_loss: 1.2543, test_loss: 1.3051, test_f1: 0.2281
 epoch: 29, train_loss: 1.2529, test_loss: 1.3046, test_f1: 0.2281
 epoch: 30, train_loss: 1.2529, test_loss: 1.3084, test_f1: 0.2281
 epoch: 31, train_loss: 1.2540, test_loss: 1.3108, test_f1: 0.2281
 epoch: 32, train_loss: 1.2534, test_loss: 1.3067, test_f1: 0.2281
 epoch: 33, train_loss: 1.2526, test_loss: 1.3056, test_f1: 0.2281
 epoch: 34, train_loss: 1.2537, test_loss: 1.3053, test_f1: 0.2281
 epoch: 35, train_loss: 1.2529, test_loss: 1.3033, test_f1: 0.2281
 epoch: 36, train_loss: 1.2524, test_loss: 1.3050, test_f1: 0.2281
 epoch: 37, train_loss: 1.2555, test_loss: 1.3063, test_f1: 0.2281
 epoch: 38, train_loss: 1.2527, test_loss: 1.3050, test_f1: 0.2281
 epoch: 39, train_loss: 1.2530, test_loss: 1.3055, test_f1: 0.2281
 epoch: 40, train_loss: 1.2544, test_loss: 1.3020, test_f1: 0.2281
 epoch: 41, train_loss: 1.2529, test_loss: 1.3049, test_f1: 0.2281
 epoch: 42, train_loss: 1.2523, test_loss: 1.3085, test_f1: 0.2281
 epoch: 43, train_loss: 1.2534, test_loss: 1.3089, test_f1: 0.2281
 epoch: 44, train_loss: 1.2531, test_loss: 1.3053, test_f1: 0.2281
 epoch: 45, train_loss: 1.2526, test_loss: 1.3061, test_f1: 0.2281
 epoch: 46, train_loss: 1.2521, test_loss: 1.3055, test_f1: 0.2281
 epoch: 47, train_loss: 1.2527, test_loss: 1.3037, test_f1: 0.2281
 epoch: 48, train_loss: 1.2523, test_loss: 1.3044, test_f1: 0.2281
 epoch: 49, train_loss: 1.2523, test_loss: 1.3055, test_f1: 0.2281
 epoch: 50, train_loss: 1.2527, test_loss: 1.3055, test_f1: 0.2281
 epoch: 51, train_loss: 1.2520, test_loss: 1.3045, test_f1: 0.2281
 epoch: 52, train_loss: 1.2529, test_loss: 1.3016, test_f1: 0.2281
 epoch: 53, train_loss: 1.2532, test_loss: 1.3021, test_f1: 0.2281
 epoch: 54, train_loss: 1.2521, test_loss: 1.3045, test_f1: 0.2281
 epoch: 55, train_loss: 1.2527, test_loss: 1.3085, test_f1: 0.2281
 epoch: 56, train_loss: 1.2535, test_loss: 1.3091, test_f1: 0.2281
 epoch: 57, train_loss: 1.2526, test_loss: 1.3061, test_f1: 0.2281
 epoch: 58, train_loss: 1.2521, test_loss: 1.3049, test_f1: 0.2281
 epoch: 59, train_loss: 1.2520, test_loss: 1.3039, test_f1: 0.2281
 epoch: 60, train_loss: 1.2522, test_loss: 1.3047, test_f1: 0.2281
 epoch: 61, train_loss: 1.2521, test_loss: 1.3038, test_f1: 0.2281
 epoch: 62, train_loss: 1.2520, test_loss: 1.3018, test_f1: 0.2281
 epoch: 63, train_loss: 1.2523, test_loss: 1.3028, test_f1: 0.2281
 epoch: 64, train_loss: 1.2524, test_loss: 1.3051, test_f1: 0.2281
 epoch: 65, train_loss: 1.2525, test_loss: 1.3076, test_f1: 0.2281
 epoch: 66, train_loss: 1.2524, test_loss: 1.3083, test_f1: 0.2281
 epoch: 67, train_loss: 1.2524, test_loss: 1.3086, test_f1: 0.2281
 epoch: 68, train_loss: 1.2526, test_loss: 1.3108, test_f1: 0.2281
 epoch: 69, train_loss: 1.2531, test_loss: 1.3104, test_f1: 0.2281
 epoch: 70, train_loss: 1.2527, test_loss: 1.3076, test_f1: 0.2281
 epoch: 71, train_loss: 1.2527, test_loss: 1.3049, test_f1: 0.2281
 epoch: 72, train_loss: 1.2525, test_loss: 1.3046, test_f1: 0.2281
 epoch: 73, train_loss: 1.2522, test_loss: 1.3043, test_f1: 0.2281
 epoch: 74, train_loss: 1.2522, test_loss: 1.3045, test_f1: 0.2281
 epoch: 75, train_loss: 1.2525, test_loss: 1.3059, test_f1: 0.2281
 epoch: 76, train_loss: 1.2527, test_loss: 1.3061, test_f1: 0.2281
 epoch: 77, train_loss: 1.2518, test_loss: 1.3055, test_f1: 0.2281
 epoch: 78, train_loss: 1.2523, test_loss: 1.3057, test_f1: 0.2281
 epoch: 79, train_loss: 1.2523, test_loss: 1.3048, test_f1: 0.2281
 epoch: 80, train_loss: 1.2520, test_loss: 1.3035, test_f1: 0.2281
 epoch: 81, train_loss: 1.2523, test_loss: 1.3036, test_f1: 0.2281
 epoch: 82, train_loss: 1.2523, test_loss: 1.3043, test_f1: 0.2281
 epoch: 83, train_loss: 1.2527, test_loss: 1.3064, test_f1: 0.2281
 epoch: 84, train_loss: 1.2524, test_loss: 1.3082, test_f1: 0.2281
 epoch: 85, train_loss: 1.2527, test_loss: 1.3086, test_f1: 0.2281
 epoch: 86, train_loss: 1.2524, test_loss: 1.3051, test_f1: 0.2281
 epoch: 87, train_loss: 1.2520, test_loss: 1.3051, test_f1: 0.2281
 epoch: 88, train_loss: 1.2522, test_loss: 1.3043, test_f1: 0.2281
 epoch: 89, train_loss: 1.2525, test_loss: 1.3036, test_f1: 0.2281
 epoch: 90, train_loss: 1.2524, test_loss: 1.3036, test_f1: 0.2281
 epoch: 91, train_loss: 1.2521, test_loss: 1.3054, test_f1: 0.2281
 epoch: 92, train_loss: 1.2525, test_loss: 1.3068, test_f1: 0.2281
 epoch: 93, train_loss: 1.2523, test_loss: 1.3059, test_f1: 0.2281
 epoch: 94, train_loss: 1.2527, test_loss: 1.3046, test_f1: 0.2281
 epoch: 95, train_loss: 1.2521, test_loss: 1.3029, test_f1: 0.2281
 epoch: 96, train_loss: 1.2523, test_loss: 1.3035, test_f1: 0.2281
 epoch: 97, train_loss: 1.2521, test_loss: 1.3043, test_f1: 0.2281
 epoch: 98, train_loss: 1.2521, test_loss: 1.3028, test_f1: 0.2281
 epoch: 99, train_loss: 1.2524, test_loss: 1.3027, test_f1: 0.2281
##################ITERATION #2 ****************************************
 epoch: 0, train_loss: 1.3232, test_loss: 1.2980, test_f1: 0.2281
 epoch: 1, train_loss: 1.2543, test_loss: 1.3083, test_f1: 0.2281
 epoch: 2, train_loss: 1.2531, test_loss: 1.3097, test_f1: 0.2281
 epoch: 3, train_loss: 1.2535, test_loss: 1.3041, test_f1: 0.2281
 epoch: 4, train_loss: 1.2536, test_loss: 1.3029, test_f1: 0.2281
 epoch: 5, train_loss: 1.2532, test_loss: 1.3030, test_f1: 0.2281
 epoch: 6, train_loss: 1.2521, test_loss: 1.3048, test_f1: 0.2281
 epoch: 7, train_loss: 1.2544, test_loss: 1.3083, test_f1: 0.2281
 epoch: 8, train_loss: 1.2540, test_loss: 1.3061, test_f1: 0.2281
 epoch: 9, train_loss: 1.2530, test_loss: 1.3071, test_f1: 0.2281
 epoch: 10, train_loss: 1.2526, test_loss: 1.3054, test_f1: 0.2281
 epoch: 11, train_loss: 1.2531, test_loss: 1.3027, test_f1: 0.2281
 epoch: 12, train_loss: 1.2522, test_loss: 1.3051, test_f1: 0.2281
 epoch: 13, train_loss: 1.2523, test_loss: 1.3032, test_f1: 0.2281
 epoch: 14, train_loss: 1.2524, test_loss: 1.3023, test_f1: 0.2281
 epoch: 15, train_loss: 1.2520, test_loss: 1.3042, test_f1: 0.2281
 epoch: 16, train_loss: 1.2532, test_loss: 1.3099, test_f1: 0.2281
 epoch: 17, train_loss: 1.2538, test_loss: 1.3101, test_f1: 0.2281
 epoch: 18, train_loss: 1.2522, test_loss: 1.3049, test_f1: 0.2281
 epoch: 19, train_loss: 1.2548, test_loss: 1.3022, test_f1: 0.2281
 epoch: 20, train_loss: 1.2532, test_loss: 1.3046, test_f1: 0.2281
 epoch: 21, train_loss: 1.2523, test_loss: 1.3065, test_f1: 0.2281
 epoch: 22, train_loss: 1.2533, test_loss: 1.3054, test_f1: 0.2281
 epoch: 23, train_loss: 1.2527, test_loss: 1.3047, test_f1: 0.2281
 epoch: 24, train_loss: 1.2527, test_loss: 1.3038, test_f1: 0.2281
 epoch: 25, train_loss: 1.2527, test_loss: 1.3090, test_f1: 0.2281
 epoch: 26, train_loss: 1.2541, test_loss: 1.3070, test_f1: 0.2281
 epoch: 27, train_loss: 1.2526, test_loss: 1.3032, test_f1: 0.2281
 epoch: 28, train_loss: 1.2520, test_loss: 1.3037, test_f1: 0.2281
 epoch: 29, train_loss: 1.2528, test_loss: 1.3037, test_f1: 0.2281
 epoch: 30, train_loss: 1.2535, test_loss: 1.3041, test_f1: 0.2281
 epoch: 31, train_loss: 1.2528, test_loss: 1.3060, test_f1: 0.2281
 epoch: 32, train_loss: 1.2528, test_loss: 1.3061, test_f1: 0.2281
 epoch: 33, train_loss: 1.2531, test_loss: 1.3074, test_f1: 0.2281
 epoch: 34, train_loss: 1.2526, test_loss: 1.3062, test_f1: 0.2281
 epoch: 35, train_loss: 1.2526, test_loss: 1.3075, test_f1: 0.2281
 epoch: 36, train_loss: 1.2530, test_loss: 1.3030, test_f1: 0.2281
 epoch: 37, train_loss: 1.2521, test_loss: 1.3037, test_f1: 0.2281
 epoch: 38, train_loss: 1.2531, test_loss: 1.3076, test_f1: 0.2281
 epoch: 39, train_loss: 1.2529, test_loss: 1.3082, test_f1: 0.2281
 epoch: 40, train_loss: 1.2524, test_loss: 1.3033, test_f1: 0.2281
 epoch: 41, train_loss: 1.2526, test_loss: 1.3021, test_f1: 0.2281
 epoch: 42, train_loss: 1.2538, test_loss: 1.3075, test_f1: 0.2281
 epoch: 43, train_loss: 1.2524, test_loss: 1.3062, test_f1: 0.2281
 epoch: 44, train_loss: 1.2535, test_loss: 1.3050, test_f1: 0.2281
 epoch: 45, train_loss: 1.2526, test_loss: 1.3049, test_f1: 0.2281
 epoch: 46, train_loss: 1.2553, test_loss: 1.3083, test_f1: 0.2281
 epoch: 47, train_loss: 1.2524, test_loss: 1.3071, test_f1: 0.2281
 epoch: 48, train_loss: 1.2533, test_loss: 1.3108, test_f1: 0.2281
 epoch: 49, train_loss: 1.2531, test_loss: 1.3064, test_f1: 0.2281
 epoch: 50, train_loss: 1.2522, test_loss: 1.3009, test_f1: 0.2281
 epoch: 51, train_loss: 1.2533, test_loss: 1.3017, test_f1: 0.2281
 epoch: 52, train_loss: 1.2530, test_loss: 1.3018, test_f1: 0.2281
 epoch: 53, train_loss: 1.2528, test_loss: 1.3016, test_f1: 0.2281
 epoch: 54, train_loss: 1.2524, test_loss: 1.3034, test_f1: 0.2281
 epoch: 55, train_loss: 1.2523, test_loss: 1.3035, test_f1: 0.2281
 epoch: 56, train_loss: 1.2521, test_loss: 1.3048, test_f1: 0.2281
 epoch: 57, train_loss: 1.2520, test_loss: 1.3041, test_f1: 0.2281
 epoch: 58, train_loss: 1.2522, test_loss: 1.3034, test_f1: 0.2281
 epoch: 59, train_loss: 1.2530, test_loss: 1.3052, test_f1: 0.2281
 epoch: 60, train_loss: 1.2541, test_loss: 1.3069, test_f1: 0.2281
 epoch: 61, train_loss: 1.2526, test_loss: 1.3036, test_f1: 0.2281
 epoch: 62, train_loss: 1.2528, test_loss: 1.3014, test_f1: 0.2281
 epoch: 63, train_loss: 1.2539, test_loss: 1.2997, test_f1: 0.2281
 epoch: 64, train_loss: 1.2544, test_loss: 1.3001, test_f1: 0.2281
 epoch: 65, train_loss: 1.2521, test_loss: 1.3043, test_f1: 0.2281
 epoch: 66, train_loss: 1.2525, test_loss: 1.3078, test_f1: 0.2281
 epoch: 67, train_loss: 1.2526, test_loss: 1.3085, test_f1: 0.2281
 epoch: 68, train_loss: 1.2526, test_loss: 1.3093, test_f1: 0.2281
 epoch: 69, train_loss: 1.2525, test_loss: 1.3082, test_f1: 0.2281
 epoch: 70, train_loss: 1.2524, test_loss: 1.3063, test_f1: 0.2281
 epoch: 71, train_loss: 1.2526, test_loss: 1.3053, test_f1: 0.2281
 epoch: 72, train_loss: 1.2528, test_loss: 1.3051, test_f1: 0.2281
 epoch: 73, train_loss: 1.2520, test_loss: 1.3051, test_f1: 0.2281
 epoch: 74, train_loss: 1.2522, test_loss: 1.3049, test_f1: 0.2281
 epoch: 75, train_loss: 1.2525, test_loss: 1.3069, test_f1: 0.2281
 epoch: 76, train_loss: 1.2523, test_loss: 1.3068, test_f1: 0.2281
 epoch: 77, train_loss: 1.2521, test_loss: 1.3045, test_f1: 0.2281
 epoch: 78, train_loss: 1.2527, test_loss: 1.3005, test_f1: 0.2281
 epoch: 79, train_loss: 1.2530, test_loss: 1.3008, test_f1: 0.2281
 epoch: 80, train_loss: 1.2528, test_loss: 1.3045, test_f1: 0.2281
 epoch: 81, train_loss: 1.2540, test_loss: 1.3060, test_f1: 0.2281
 epoch: 82, train_loss: 1.2525, test_loss: 1.3063, test_f1: 0.2281
 epoch: 83, train_loss: 1.2525, test_loss: 1.3070, test_f1: 0.2281
 epoch: 84, train_loss: 1.2526, test_loss: 1.3070, test_f1: 0.2281
 epoch: 85, train_loss: 1.2525, test_loss: 1.3064, test_f1: 0.2281
 epoch: 86, train_loss: 1.2519, test_loss: 1.3080, test_f1: 0.2281
 epoch: 87, train_loss: 1.2531, test_loss: 1.3092, test_f1: 0.2281
 epoch: 88, train_loss: 1.2525, test_loss: 1.3057, test_f1: 0.2281
 epoch: 89, train_loss: 1.2523, test_loss: 1.3031, test_f1: 0.2281
 epoch: 90, train_loss: 1.2524, test_loss: 1.3010, test_f1: 0.2281
 epoch: 91, train_loss: 1.2523, test_loss: 1.3024, test_f1: 0.2281
 epoch: 92, train_loss: 1.2523, test_loss: 1.3042, test_f1: 0.2281
 epoch: 93, train_loss: 1.2523, test_loss: 1.3043, test_f1: 0.2281
 epoch: 94, train_loss: 1.2523, test_loss: 1.3059, test_f1: 0.2281
 epoch: 95, train_loss: 1.2520, test_loss: 1.3045, test_f1: 0.2281
 epoch: 96, train_loss: 1.2521, test_loss: 1.3030, test_f1: 0.2281
 epoch: 97, train_loss: 1.2528, test_loss: 1.3001, test_f1: 0.2281
 epoch: 98, train_loss: 1.2530, test_loss: 1.2997, test_f1: 0.2281
 epoch: 99, train_loss: 1.2537, test_loss: 1.2993, test_f1: 0.2281
##################ITERATION #3 ****************************************
 epoch: 0, train_loss: 1.2626, test_loss: 7.1702, test_f1: 0.1365
 epoch: 1, train_loss: 1.2315, test_loss: 6.8186, test_f1: 0.1365
 epoch: 2, train_loss: 1.2045, test_loss: 1.8181, test_f1: 0.2281
 epoch: 3, train_loss: 1.1907, test_loss: 1.3234, test_f1: 0.3192
 epoch: 4, train_loss: 1.1645, test_loss: 1.3400, test_f1: 0.1592
 epoch: 5, train_loss: 1.1758, test_loss: 1.3447, test_f1: 0.3235
 epoch: 6, train_loss: 1.1519, test_loss: 1.2150, test_f1: 0.2972
 epoch: 7, train_loss: 1.1652, test_loss: 1.2501, test_f1: 0.3940
 epoch: 8, train_loss: 1.1879, test_loss: 1.3274, test_f1: 0.2187
 epoch: 9, train_loss: 1.1982, test_loss: 1.3157, test_f1: 0.2611
 epoch: 10, train_loss: 1.1572, test_loss: 1.2421, test_f1: 0.2281
 epoch: 11, train_loss: 1.1593, test_loss: 1.2337, test_f1: 0.2281
 epoch: 12, train_loss: 1.1356, test_loss: 1.2482, test_f1: 0.3811
 epoch: 13, train_loss: 1.1436, test_loss: 1.2192, test_f1: 0.3143
 epoch: 14, train_loss: 1.1166, test_loss: 1.3329, test_f1: 0.3415
 epoch: 15, train_loss: 1.0916, test_loss: 1.4280, test_f1: 0.3399
 epoch: 16, train_loss: 1.0782, test_loss: 1.2940, test_f1: 0.2491
 epoch: 17, train_loss: 1.0994, test_loss: 1.1714, test_f1: 0.4232
 epoch: 18, train_loss: 1.0915, test_loss: 1.2356, test_f1: 0.3058
 epoch: 19, train_loss: 1.0755, test_loss: 1.2569, test_f1: 0.3779
 epoch: 20, train_loss: 1.0672, test_loss: 1.2984, test_f1: 0.3283
 epoch: 21, train_loss: 1.1255, test_loss: 1.2081, test_f1: 0.4107
 epoch: 22, train_loss: 1.0727, test_loss: 1.3082, test_f1: 0.3558
 epoch: 23, train_loss: 1.0938, test_loss: 1.1689, test_f1: 0.3270
 epoch: 24, train_loss: 1.0675, test_loss: 1.2550, test_f1: 0.2306
 epoch: 25, train_loss: 1.1062, test_loss: 1.2741, test_f1: 0.3083
 epoch: 26, train_loss: 1.0882, test_loss: 1.2093, test_f1: 0.3018
 epoch: 27, train_loss: 1.0706, test_loss: 101.1422, test_f1: 0.1599
 epoch: 28, train_loss: 1.0396, test_loss: 1.1398, test_f1: 0.3368
 epoch: 29, train_loss: 1.0537, test_loss: 1.1293, test_f1: 0.3654
 epoch: 30, train_loss: 1.0725, test_loss: 1.1455, test_f1: 0.3179
 epoch: 31, train_loss: 1.0730, test_loss: 1.3395, test_f1: 0.2478
 epoch: 32, train_loss: 1.0812, test_loss: 1.4687, test_f1: 0.2995
 epoch: 33, train_loss: 1.0716, test_loss: 1.3505, test_f1: 0.2931
 epoch: 34, train_loss: 1.0439, test_loss: 1.3077, test_f1: 0.4160
 epoch: 35, train_loss: 1.0528, test_loss: 1.1473, test_f1: 0.3283
 epoch: 36, train_loss: 1.0361, test_loss: 1.1769, test_f1: 0.2350
 epoch: 37, train_loss: 1.0456, test_loss: 1.1579, test_f1: 0.3290
 epoch: 38, train_loss: 1.1280, test_loss: 1.1497, test_f1: 0.3221
 epoch: 39, train_loss: 1.0711, test_loss: 1.1890, test_f1: 0.2835
 epoch: 40, train_loss: 1.0650, test_loss: 1.2153, test_f1: 0.2735
 epoch: 41, train_loss: 1.0431, test_loss: 1.1945, test_f1: 0.2859
 epoch: 42, train_loss: 1.1154, test_loss: 1.1855, test_f1: 0.3290
 epoch: 43, train_loss: 1.0444, test_loss: 1.1793, test_f1: 0.3290
 epoch: 44, train_loss: 1.0587, test_loss: 1.1534, test_f1: 0.3290
 epoch: 45, train_loss: 1.0542, test_loss: 1.1585, test_f1: 0.3681
 epoch: 46, train_loss: 1.4013, test_loss: 1.3601, test_f1: 0.2759
 epoch: 47, train_loss: 1.1249, test_loss: 1.2463, test_f1: 0.3185
 epoch: 48, train_loss: 1.0921, test_loss: 1.3239, test_f1: 0.2190
 epoch: 49, train_loss: 1.0821, test_loss: 1.1502, test_f1: 0.3316
 epoch: 50, train_loss: 1.0771, test_loss: 1.1598, test_f1: 0.3290
 epoch: 51, train_loss: 1.0509, test_loss: 1.1650, test_f1: 0.3290
 epoch: 52, train_loss: 1.0532, test_loss: 1.1521, test_f1: 0.3283
 epoch: 53, train_loss: 1.0486, test_loss: 1.1476, test_f1: 0.3317
 epoch: 54, train_loss: 1.0550, test_loss: 1.1501, test_f1: 0.3238
 epoch: 55, train_loss: 1.0950, test_loss: 1.1574, test_f1: 0.3290
 epoch: 56, train_loss: 1.0811, test_loss: 1.1459, test_f1: 0.3290
 epoch: 57, train_loss: 1.0805, test_loss: 1.1314, test_f1: 0.3303
 epoch: 58, train_loss: 1.0729, test_loss: 1.1207, test_f1: 0.3281
 epoch: 59, train_loss: 1.0671, test_loss: 1.1392, test_f1: 0.3606
 epoch: 60, train_loss: 1.0402, test_loss: 1.1271, test_f1: 0.3665
 epoch: 61, train_loss: 1.0521, test_loss: 1.1250, test_f1: 0.4232
 epoch: 62, train_loss: 1.0465, test_loss: 1.1170, test_f1: 0.3381
 epoch: 63, train_loss: 1.0407, test_loss: 1.1360, test_f1: 0.3388
 epoch: 64, train_loss: 1.0284, test_loss: 1.1307, test_f1: 0.3785
 epoch: 65, train_loss: 1.0297, test_loss: 1.1090, test_f1: 0.3381
 epoch: 66, train_loss: 1.0323, test_loss: 1.1616, test_f1: 0.3310
 epoch: 67, train_loss: 1.1035, test_loss: 1.3240, test_f1: 0.2984
 epoch: 68, train_loss: 1.1533, test_loss: 1.2335, test_f1: 0.2984
 epoch: 69, train_loss: 1.1451, test_loss: 1.2159, test_f1: 0.4070
 epoch: 70, train_loss: 1.1256, test_loss: 1.1894, test_f1: 0.3164
 epoch: 71, train_loss: 1.1135, test_loss: 1.2047, test_f1: 0.3134
 epoch: 72, train_loss: 1.0987, test_loss: 1.1901, test_f1: 0.4174
 epoch: 73, train_loss: 1.1089, test_loss: 1.1662, test_f1: 0.4125
 epoch: 74, train_loss: 1.0941, test_loss: 1.1513, test_f1: 0.3310
 epoch: 75, train_loss: 1.0908, test_loss: 1.1567, test_f1: 0.4365
 epoch: 76, train_loss: 1.0739, test_loss: 1.1511, test_f1: 0.3303
 epoch: 77, train_loss: 1.0727, test_loss: 1.1724, test_f1: 0.3260
 epoch: 78, train_loss: 1.0772, test_loss: 1.1634, test_f1: 0.3608
 epoch: 79, train_loss: 1.0527, test_loss: 1.1368, test_f1: 0.3303
 epoch: 80, train_loss: 1.0516, test_loss: 1.1388, test_f1: 0.3608
 epoch: 81, train_loss: 1.0366, test_loss: 1.1235, test_f1: 0.3652
 epoch: 82, train_loss: 1.0333, test_loss: 1.1352, test_f1: 0.3310
 epoch: 83, train_loss: 1.0393, test_loss: 1.1416, test_f1: 0.3622
 epoch: 84, train_loss: 1.0386, test_loss: 1.1273, test_f1: 0.3709
 epoch: 85, train_loss: 1.0274, test_loss: 1.1289, test_f1: 0.3622
 epoch: 86, train_loss: 1.0289, test_loss: 1.1118, test_f1: 0.3381
 epoch: 87, train_loss: 1.0314, test_loss: 1.1392, test_f1: 0.4499
 epoch: 88, train_loss: 1.0264, test_loss: 1.1407, test_f1: 0.3310
 epoch: 89, train_loss: 1.0286, test_loss: 1.1346, test_f1: 0.3310
 epoch: 90, train_loss: 1.0310, test_loss: 1.1232, test_f1: 0.3800
 epoch: 91, train_loss: 1.0189, test_loss: 1.1246, test_f1: 0.3310
 epoch: 92, train_loss: 1.0444, test_loss: 1.1229, test_f1: 0.3303
 epoch: 93, train_loss: 1.0241, test_loss: 1.1248, test_f1: 0.4465
 epoch: 94, train_loss: 1.0341, test_loss: 1.1429, test_f1: 0.3294
 epoch: 95, train_loss: 1.0182, test_loss: 1.1564, test_f1: 0.3193
 epoch: 96, train_loss: 1.0255, test_loss: 1.1555, test_f1: 0.4168
 epoch: 97, train_loss: 1.0233, test_loss: 1.1400, test_f1: 0.3310
 epoch: 98, train_loss: 1.0248, test_loss: 1.1274, test_f1: 0.3310
 epoch: 99, train_loss: 1.0104, test_loss: 1.1407, test_f1: 0.4167
##################ITERATION #4 ****************************************
 epoch: 0, train_loss: 1.4652, test_loss: 4.7706, test_f1: 0.1365
 epoch: 1, train_loss: 1.1317, test_loss: 2.9674, test_f1: 0.1365
 epoch: 2, train_loss: 1.0918, test_loss: 1.5247, test_f1: 0.2227
 epoch: 3, train_loss: 1.0721, test_loss: 1.5486, test_f1: 0.2245
 epoch: 4, train_loss: 1.1073, test_loss: 1.6028, test_f1: 0.3328
 epoch: 5, train_loss: 1.0759, test_loss: 1.4410, test_f1: 0.2982
 epoch: 6, train_loss: 1.0921, test_loss: 1.4695, test_f1: 0.2390
 epoch: 7, train_loss: 1.0911, test_loss: 1.4676, test_f1: 0.1607
 epoch: 8, train_loss: 1.0629, test_loss: 1.1725, test_f1: 0.3273
 epoch: 9, train_loss: 1.0590, test_loss: 1.2571, test_f1: 0.4176
 epoch: 10, train_loss: 1.0569, test_loss: 1.3733, test_f1: 0.3006
 epoch: 11, train_loss: 1.0369, test_loss: 1.5818, test_f1: 0.3489
 epoch: 12, train_loss: 1.0416, test_loss: 1.2652, test_f1: 0.3767
 epoch: 13, train_loss: 1.0475, test_loss: 1.1586, test_f1: 0.3320
 epoch: 14, train_loss: 1.0422, test_loss: 1.1856, test_f1: 0.4342
 epoch: 15, train_loss: 1.0415, test_loss: 1.1604, test_f1: 0.4287
 epoch: 16, train_loss: 1.0250, test_loss: 1.1436, test_f1: 0.4309
 epoch: 17, train_loss: 1.0109, test_loss: 1.1872, test_f1: 0.4286
 epoch: 18, train_loss: 1.0230, test_loss: 1.2492, test_f1: 0.3019
 epoch: 19, train_loss: 1.0078, test_loss: 1.2084, test_f1: 0.4132
 epoch: 20, train_loss: 1.0089, test_loss: 1.1461, test_f1: 0.4314
 epoch: 21, train_loss: 1.0038, test_loss: 1.1666, test_f1: 0.4337
 epoch: 22, train_loss: 1.0085, test_loss: 1.1429, test_f1: 0.3348
 epoch: 23, train_loss: 1.0046, test_loss: 1.1540, test_f1: 0.3292
 epoch: 24, train_loss: 1.0119, test_loss: 1.3039, test_f1: 0.3719
 epoch: 25, train_loss: 1.0290, test_loss: 1.2965, test_f1: 0.4212
 epoch: 26, train_loss: 0.9994, test_loss: 1.1308, test_f1: 0.3800
 epoch: 27, train_loss: 1.0056, test_loss: 1.1439, test_f1: 0.4385
 epoch: 28, train_loss: 0.9959, test_loss: 1.2575, test_f1: 0.4256
 epoch: 29, train_loss: 1.0158, test_loss: 1.1827, test_f1: 0.3923
 epoch: 30, train_loss: 1.1805, test_loss: 1.4758, test_f1: 0.1903
 epoch: 31, train_loss: 1.1673, test_loss: 1.2728, test_f1: 0.2894
 epoch: 32, train_loss: 1.1429, test_loss: 1.2230, test_f1: 0.2838
 epoch: 33, train_loss: 1.0801, test_loss: 2.6039, test_f1: 0.2775
 epoch: 34, train_loss: 1.0893, test_loss: 1.1550, test_f1: 0.3317
 epoch: 35, train_loss: 1.0546, test_loss: 1.1764, test_f1: 0.3746
 epoch: 36, train_loss: 1.0384, test_loss: 1.7649, test_f1: 0.2450
 epoch: 37, train_loss: 1.0384, test_loss: 1.1233, test_f1: 0.3420
 epoch: 38, train_loss: 1.0317, test_loss: 1.2583, test_f1: 0.4056
 epoch: 39, train_loss: 1.0225, test_loss: 1.1905, test_f1: 0.3506
 epoch: 40, train_loss: 1.0205, test_loss: 1.2999, test_f1: 0.3727
 epoch: 41, train_loss: 1.0411, test_loss: 1.1155, test_f1: 0.3395
 epoch: 42, train_loss: 1.0252, test_loss: 1.1439, test_f1: 0.3601
 epoch: 43, train_loss: 1.0217, test_loss: 1.1200, test_f1: 0.3414
 epoch: 44, train_loss: 1.0287, test_loss: 1.1337, test_f1: 0.3676
 epoch: 45, train_loss: 1.0181, test_loss: 1.1153, test_f1: 0.3395
 epoch: 46, train_loss: 1.0165, test_loss: 1.1939, test_f1: 0.4107
 epoch: 47, train_loss: 1.0398, test_loss: 1.1130, test_f1: 0.3420
 epoch: 48, train_loss: 1.0251, test_loss: 1.1046, test_f1: 0.2714
 epoch: 49, train_loss: 1.0194, test_loss: 1.2352, test_f1: 0.2948
 epoch: 50, train_loss: 1.0123, test_loss: 1.1108, test_f1: 0.3665
 epoch: 51, train_loss: 1.0239, test_loss: 1.1384, test_f1: 0.4374
 epoch: 52, train_loss: 1.0149, test_loss: 1.1254, test_f1: 0.3444
 epoch: 53, train_loss: 1.0164, test_loss: 1.2440, test_f1: 0.3911
 epoch: 54, train_loss: 1.0134, test_loss: 1.3636, test_f1: 0.3444
 epoch: 55, train_loss: 1.0015, test_loss: 1.1210, test_f1: 0.3438
 epoch: 56, train_loss: 1.0021, test_loss: 1.1377, test_f1: 0.3744
 epoch: 57, train_loss: 0.9983, test_loss: 1.1280, test_f1: 0.3593
 epoch: 58, train_loss: 1.0052, test_loss: 1.1065, test_f1: 0.3802
 epoch: 59, train_loss: 0.9989, test_loss: 1.1464, test_f1: 0.4302
 epoch: 60, train_loss: 0.9926, test_loss: 1.1554, test_f1: 0.3680
 epoch: 61, train_loss: 0.9962, test_loss: 1.2933, test_f1: 0.3393
 epoch: 62, train_loss: 0.9942, test_loss: 1.1530, test_f1: 0.3766
 epoch: 63, train_loss: 1.0088, test_loss: 1.1144, test_f1: 0.4342
 epoch: 64, train_loss: 1.0103, test_loss: 1.2659, test_f1: 0.3372
 epoch: 65, train_loss: 0.9983, test_loss: 1.1839, test_f1: 0.4208
 epoch: 66, train_loss: 0.9950, test_loss: 1.1496, test_f1: 0.3718
 epoch: 67, train_loss: 0.9865, test_loss: 1.2603, test_f1: 0.4274
 epoch: 68, train_loss: 0.9976, test_loss: 1.1395, test_f1: 0.4211
 epoch: 69, train_loss: 0.9963, test_loss: 1.1899, test_f1: 0.4271
 epoch: 70, train_loss: 0.9851, test_loss: 1.1885, test_f1: 0.4049
 epoch: 71, train_loss: 0.9885, test_loss: 1.3181, test_f1: 0.3333
 epoch: 72, train_loss: 0.9914, test_loss: 1.1230, test_f1: 0.4181
 epoch: 73, train_loss: 0.9924, test_loss: 1.1138, test_f1: 0.3894
 epoch: 74, train_loss: 0.9790, test_loss: 1.1102, test_f1: 0.4357
 epoch: 75, train_loss: 0.9771, test_loss: 1.2308, test_f1: 0.4349
 epoch: 76, train_loss: 0.9825, test_loss: 1.1641, test_f1: 0.4027
 epoch: 77, train_loss: 0.9799, test_loss: 1.7150, test_f1: 0.3710
 epoch: 78, train_loss: 0.9779, test_loss: 1.2340, test_f1: 0.3072
 epoch: 79, train_loss: 0.9661, test_loss: 1.2482, test_f1: 0.3080
 epoch: 80, train_loss: 0.9866, test_loss: 1.4558, test_f1: 0.3295
 epoch: 81, train_loss: 0.9772, test_loss: 1.2013, test_f1: 0.3907
 epoch: 82, train_loss: 0.9779, test_loss: 1.1181, test_f1: 0.3602
 epoch: 83, train_loss: 0.9766, test_loss: 1.1122, test_f1: 0.4660
 epoch: 84, train_loss: 0.9553, test_loss: 1.1915, test_f1: 0.4342
 epoch: 85, train_loss: 0.9650, test_loss: 1.1168, test_f1: 0.3454
 epoch: 86, train_loss: 0.9691, test_loss: 1.6022, test_f1: 0.3356
 epoch: 87, train_loss: 0.9565, test_loss: 1.8429, test_f1: 0.3720
 epoch: 88, train_loss: 0.9495, test_loss: 1.1686, test_f1: 0.4424
 epoch: 89, train_loss: 0.9593, test_loss: 1.1221, test_f1: 0.3370
 epoch: 90, train_loss: 0.9501, test_loss: 1.1750, test_f1: 0.3344
 epoch: 91, train_loss: 0.9736, test_loss: 2.4186, test_f1: 0.2371
 epoch: 92, train_loss: 0.9712, test_loss: 2.0825, test_f1: 0.3789
 epoch: 93, train_loss: 0.9687, test_loss: 1.0549, test_f1: 0.3795
 epoch: 94, train_loss: 0.9697, test_loss: 1.1190, test_f1: 0.3344
 epoch: 95, train_loss: 0.9602, test_loss: 1.1131, test_f1: 0.3340
 epoch: 96, train_loss: 0.9520, test_loss: 1.1188, test_f1: 0.3482
 epoch: 97, train_loss: 0.9400, test_loss: 1.1103, test_f1: 0.3468
 epoch: 98, train_loss: 0.9434, test_loss: 1.0828, test_f1: 0.3375
 epoch: 99, train_loss: 0.9372, test_loss: 1.0924, test_f1: 0.3716
##################ITERATION #5 ****************************************
 epoch: 0, train_loss: 1.3605, test_loss: 1.5590, test_f1: 0.1514
 epoch: 1, train_loss: 1.2585, test_loss: 1.7557, test_f1: 0.2302
 epoch: 2, train_loss: 1.1066, test_loss: 2.2760, test_f1: 0.1365
 epoch: 3, train_loss: 1.0577, test_loss: 1.7264, test_f1: 0.1379
 epoch: 4, train_loss: 1.0280, test_loss: 1.2944, test_f1: 0.3518
 epoch: 5, train_loss: 1.0250, test_loss: 1.1455, test_f1: 0.4504
 epoch: 6, train_loss: 1.0200, test_loss: 1.1562, test_f1: 0.3858
 epoch: 7, train_loss: 1.0051, test_loss: 1.2036, test_f1: 0.4506
 epoch: 8, train_loss: 1.0030, test_loss: 1.1646, test_f1: 0.4579
 epoch: 9, train_loss: 1.0069, test_loss: 1.1234, test_f1: 0.3344
 epoch: 10, train_loss: 1.0157, test_loss: 1.2185, test_f1: 0.3097
 epoch: 11, train_loss: 1.0556, test_loss: 1.1871, test_f1: 0.3566
 epoch: 12, train_loss: 1.0288, test_loss: 1.2017, test_f1: 0.3205
 epoch: 13, train_loss: 1.0350, test_loss: 1.1759, test_f1: 0.3290
 epoch: 14, train_loss: 1.0378, test_loss: 1.1510, test_f1: 0.3761
 epoch: 15, train_loss: 1.0330, test_loss: 1.2846, test_f1: 0.3746
 epoch: 16, train_loss: 1.0305, test_loss: 1.1076, test_f1: 0.3278
 epoch: 17, train_loss: 1.0012, test_loss: 1.1425, test_f1: 0.3849
 epoch: 18, train_loss: 0.9958, test_loss: 1.1655, test_f1: 0.3670
 epoch: 19, train_loss: 0.9818, test_loss: 1.0916, test_f1: 0.3358
 epoch: 20, train_loss: 0.9968, test_loss: 1.1111, test_f1: 0.4440
 epoch: 21, train_loss: 0.9831, test_loss: 1.1157, test_f1: 0.3346
 epoch: 22, train_loss: 1.0007, test_loss: 1.1417, test_f1: 0.3359
 epoch: 23, train_loss: 0.9902, test_loss: 1.3017, test_f1: 0.4182
 epoch: 24, train_loss: 0.9917, test_loss: 1.1912, test_f1: 0.3738
 epoch: 25, train_loss: 0.9886, test_loss: 1.0697, test_f1: 0.4577
 epoch: 26, train_loss: 0.9999, test_loss: 1.1509, test_f1: 0.3455
 epoch: 27, train_loss: 0.9983, test_loss: 1.0652, test_f1: 0.3694
 epoch: 28, train_loss: 0.9770, test_loss: 1.0847, test_f1: 0.3385
 epoch: 29, train_loss: 0.9757, test_loss: 1.2117, test_f1: 0.3919
 epoch: 30, train_loss: 1.0047, test_loss: 1.2461, test_f1: 0.4222
 epoch: 31, train_loss: 0.9616, test_loss: 1.1762, test_f1: 0.4335
 epoch: 32, train_loss: 0.9520, test_loss: 1.4653, test_f1: 0.2868
 epoch: 33, train_loss: 0.9809, test_loss: 1.2183, test_f1: 0.2940
 epoch: 34, train_loss: 0.9938, test_loss: 1.2980, test_f1: 0.3768
 epoch: 35, train_loss: 0.9736, test_loss: 1.1512, test_f1: 0.4750
 epoch: 36, train_loss: 0.9618, test_loss: 1.1137, test_f1: 0.4058
 epoch: 37, train_loss: 0.9606, test_loss: 1.7945, test_f1: 0.2954
 epoch: 38, train_loss: 0.9678, test_loss: 1.1335, test_f1: 0.4176
 epoch: 39, train_loss: 0.9681, test_loss: 1.0128, test_f1: 0.3933
 epoch: 40, train_loss: 0.9892, test_loss: 1.1295, test_f1: 0.3959
 epoch: 41, train_loss: 0.9802, test_loss: 1.3282, test_f1: 0.3996
 epoch: 42, train_loss: 1.0245, test_loss: 1.1005, test_f1: 0.4274
 epoch: 43, train_loss: 0.9544, test_loss: 1.0510, test_f1: 0.4509
 epoch: 44, train_loss: 0.9310, test_loss: 1.0508, test_f1: 0.4204
 epoch: 45, train_loss: 0.9186, test_loss: 1.0759, test_f1: 0.4937
 epoch: 46, train_loss: 0.9031, test_loss: 1.1444, test_f1: 0.4559
 epoch: 47, train_loss: 0.9370, test_loss: 1.1151, test_f1: 0.4851
 epoch: 48, train_loss: 0.9501, test_loss: 1.3087, test_f1: 0.3872
 epoch: 49, train_loss: 1.0145, test_loss: 1.1388, test_f1: 0.3852
 epoch: 50, train_loss: 0.9498, test_loss: 0.9783, test_f1: 0.4312
 epoch: 51, train_loss: 0.9080, test_loss: 0.9607, test_f1: 0.4340
 epoch: 52, train_loss: 0.8896, test_loss: 0.9777, test_f1: 0.4270
 epoch: 53, train_loss: 0.8696, test_loss: 0.9704, test_f1: 0.5384
 epoch: 54, train_loss: 0.8625, test_loss: 0.9864, test_f1: 0.4316
 epoch: 55, train_loss: 0.8653, test_loss: 0.9874, test_f1: 0.4288
 epoch: 56, train_loss: 0.8744, test_loss: 1.0809, test_f1: 0.5242
 epoch: 57, train_loss: 0.8866, test_loss: 1.0267, test_f1: 0.5219
 epoch: 58, train_loss: 0.8770, test_loss: 1.0015, test_f1: 0.4229
 epoch: 59, train_loss: 0.8731, test_loss: 0.9956, test_f1: 0.4531
 epoch: 60, train_loss: 0.8862, test_loss: 1.0177, test_f1: 0.5430
 epoch: 61, train_loss: 0.8732, test_loss: 1.0403, test_f1: 0.4645
 epoch: 62, train_loss: 0.8771, test_loss: 1.0338, test_f1: 0.4256
 epoch: 63, train_loss: 0.8529, test_loss: 1.0105, test_f1: 0.5252
 epoch: 64, train_loss: 0.8624, test_loss: 0.9913, test_f1: 0.4260
 epoch: 65, train_loss: 0.8418, test_loss: 0.9984, test_f1: 0.4360
 epoch: 66, train_loss: 0.8355, test_loss: 1.0357, test_f1: 0.4451
 epoch: 67, train_loss: 0.8486, test_loss: 1.3776, test_f1: 0.3611
 epoch: 68, train_loss: 0.8549, test_loss: 1.1703, test_f1: 0.4029
 epoch: 69, train_loss: 0.8395, test_loss: 1.1526, test_f1: 0.3944
 epoch: 70, train_loss: 0.8487, test_loss: 1.0106, test_f1: 0.4236
 epoch: 71, train_loss: 0.8450, test_loss: 0.9963, test_f1: 0.5530
 epoch: 72, train_loss: 0.8705, test_loss: 1.7513, test_f1: 0.3575
 epoch: 73, train_loss: 0.8605, test_loss: 1.0802, test_f1: 0.5208
 epoch: 74, train_loss: 0.8425, test_loss: 1.0607, test_f1: 0.5227
 epoch: 75, train_loss: 0.8366, test_loss: 1.0007, test_f1: 0.5334
 epoch: 76, train_loss: 0.8394, test_loss: 0.9900, test_f1: 0.5221
 epoch: 77, train_loss: 0.8453, test_loss: 0.9462, test_f1: 0.4440
 epoch: 78, train_loss: 0.8207, test_loss: 0.9383, test_f1: 0.5039
 epoch: 79, train_loss: 0.8238, test_loss: 0.9790, test_f1: 0.5136
 epoch: 80, train_loss: 0.8368, test_loss: 1.0133, test_f1: 0.5235
 epoch: 81, train_loss: 0.8469, test_loss: 0.9402, test_f1: 0.4417
 epoch: 82, train_loss: 0.8374, test_loss: 0.9665, test_f1: 0.5571
 epoch: 83, train_loss: 0.8283, test_loss: 0.9492, test_f1: 0.5509
 epoch: 84, train_loss: 0.8211, test_loss: 1.0355, test_f1: 0.4126
 epoch: 85, train_loss: 0.8303, test_loss: 1.0221, test_f1: 0.4687
 epoch: 86, train_loss: 0.8346, test_loss: 1.0182, test_f1: 0.5034
 epoch: 87, train_loss: 0.8322, test_loss: 1.1201, test_f1: 0.4705
 epoch: 88, train_loss: 0.8349, test_loss: 1.0126, test_f1: 0.5496
 epoch: 89, train_loss: 0.8297, test_loss: 0.9972, test_f1: 0.4353
 epoch: 90, train_loss: 0.8251, test_loss: 0.9794, test_f1: 0.5432
 epoch: 91, train_loss: 0.8477, test_loss: 1.0137, test_f1: 0.4617
 epoch: 92, train_loss: 0.8384, test_loss: 1.5302, test_f1: 0.4697
 epoch: 93, train_loss: 0.8376, test_loss: 1.1540, test_f1: 0.5062
 epoch: 94, train_loss: 0.8318, test_loss: 1.1955, test_f1: 0.4949
 epoch: 95, train_loss: 0.8321, test_loss: 0.9640, test_f1: 0.4954
 epoch: 96, train_loss: 0.8446, test_loss: 0.9615, test_f1: 0.4318
 epoch: 97, train_loss: 0.8497, test_loss: 0.9593, test_f1: 0.5574
 epoch: 98, train_loss: 0.8299, test_loss: 0.9810, test_f1: 0.5010
 epoch: 99, train_loss: 0.8399, test_loss: 1.0466, test_f1: 0.4976
##################ITERATION #6 ****************************************
 epoch: 0, train_loss: 1.5957, test_loss: 1.3759, test_f1: 0.2281
 epoch: 1, train_loss: 1.3468, test_loss: 1.3190, test_f1: 0.2281
 epoch: 2, train_loss: 1.2619, test_loss: 1.3294, test_f1: 0.1365
 epoch: 3, train_loss: 1.2240, test_loss: 1.4056, test_f1: 0.1365
 epoch: 4, train_loss: 1.2074, test_loss: 1.3452, test_f1: 0.2281
 epoch: 5, train_loss: 1.2237, test_loss: 1.3505, test_f1: 0.2281
 epoch: 6, train_loss: 1.1191, test_loss: 1.2048, test_f1: 0.3146
 epoch: 7, train_loss: 1.0837, test_loss: 1.1662, test_f1: 0.3234
 epoch: 8, train_loss: 1.0647, test_loss: 1.1355, test_f1: 0.3317
 epoch: 9, train_loss: 1.0580, test_loss: 1.2232, test_f1: 0.3083
 epoch: 10, train_loss: 1.0564, test_loss: 1.1663, test_f1: 0.3295
 epoch: 11, train_loss: 1.0504, test_loss: 1.1671, test_f1: 0.3290
 epoch: 12, train_loss: 1.0477, test_loss: 1.1713, test_f1: 0.3290
 epoch: 13, train_loss: 1.0531, test_loss: 1.1581, test_f1: 0.3295
 epoch: 14, train_loss: 1.0515, test_loss: 1.2016, test_f1: 0.3083
 epoch: 15, train_loss: 1.0706, test_loss: 1.1597, test_f1: 0.3290
 epoch: 16, train_loss: 1.0348, test_loss: 1.1147, test_f1: 0.3395
 epoch: 17, train_loss: 1.0559, test_loss: 1.1910, test_f1: 0.3176
 epoch: 18, train_loss: 1.0513, test_loss: 1.1408, test_f1: 0.3344
 epoch: 19, train_loss: 1.0335, test_loss: 1.1528, test_f1: 0.3322
 epoch: 20, train_loss: 1.0235, test_loss: 1.1591, test_f1: 0.3300
 epoch: 21, train_loss: 1.0220, test_loss: 1.1785, test_f1: 0.3272
 epoch: 22, train_loss: 1.0298, test_loss: 1.2481, test_f1: 0.3011
 epoch: 23, train_loss: 1.1099, test_loss: 1.1809, test_f1: 0.3210
 epoch: 24, train_loss: 1.0790, test_loss: 1.2723, test_f1: 0.3061
 epoch: 25, train_loss: 1.0573, test_loss: 1.3541, test_f1: 0.2832
 epoch: 26, train_loss: 1.0566, test_loss: 1.1550, test_f1: 0.3455
 epoch: 27, train_loss: 1.0404, test_loss: 1.1408, test_f1: 0.3496
 epoch: 28, train_loss: 1.0242, test_loss: 1.2900, test_f1: 0.2861
 epoch: 29, train_loss: 1.0341, test_loss: 1.3996, test_f1: 0.2345
 epoch: 30, train_loss: 1.0289, test_loss: 1.1715, test_f1: 0.3290
 epoch: 31, train_loss: 1.0722, test_loss: 1.3970, test_f1: 0.2586
 epoch: 32, train_loss: 1.0551, test_loss: 1.2213, test_f1: 0.3069
 epoch: 33, train_loss: 1.0470, test_loss: 1.2092, test_f1: 0.3097
 epoch: 34, train_loss: 1.0437, test_loss: 1.1269, test_f1: 0.3422
 epoch: 35, train_loss: 1.0186, test_loss: 1.1481, test_f1: 0.3322
 epoch: 36, train_loss: 1.0092, test_loss: 1.1650, test_f1: 0.3630
 epoch: 37, train_loss: 1.0412, test_loss: 1.1874, test_f1: 0.3290
 epoch: 38, train_loss: 1.0204, test_loss: 1.1767, test_f1: 0.3317
 epoch: 39, train_loss: 1.0158, test_loss: 1.1506, test_f1: 0.3395
 epoch: 40, train_loss: 1.0178, test_loss: 1.1373, test_f1: 0.3395
 epoch: 41, train_loss: 1.0280, test_loss: 1.2712, test_f1: 0.3607
 epoch: 42, train_loss: 1.0343, test_loss: 1.2215, test_f1: 0.3219
 epoch: 43, train_loss: 1.0328, test_loss: 1.1939, test_f1: 0.3295
 epoch: 44, train_loss: 1.0150, test_loss: 1.1549, test_f1: 0.3416
 epoch: 45, train_loss: 1.0042, test_loss: 1.1251, test_f1: 0.3649
 epoch: 46, train_loss: 0.9841, test_loss: 1.1244, test_f1: 0.3949
 epoch: 47, train_loss: 0.9984, test_loss: 1.1706, test_f1: 0.3684
 epoch: 48, train_loss: 1.0002, test_loss: 1.1481, test_f1: 0.3798
 epoch: 49, train_loss: 0.9937, test_loss: 1.1617, test_f1: 0.3358
 epoch: 50, train_loss: 0.9876, test_loss: 1.0881, test_f1: 0.3882
 epoch: 51, train_loss: 0.9703, test_loss: 1.0910, test_f1: 0.4120
 epoch: 52, train_loss: 0.9846, test_loss: 1.1119, test_f1: 0.3996
 epoch: 53, train_loss: 0.9728, test_loss: 1.0975, test_f1: 0.4172
 epoch: 54, train_loss: 0.9507, test_loss: 1.1406, test_f1: 0.3558
 epoch: 55, train_loss: 0.9582, test_loss: 1.1490, test_f1: 0.3539
 epoch: 56, train_loss: 0.9709, test_loss: 1.1645, test_f1: 0.3451
 epoch: 57, train_loss: 0.9478, test_loss: 1.1096, test_f1: 0.3872
 epoch: 58, train_loss: 0.9456, test_loss: 1.0850, test_f1: 0.4162
 epoch: 59, train_loss: 0.9483, test_loss: 1.1265, test_f1: 0.4106
 epoch: 60, train_loss: 0.9330, test_loss: 1.1363, test_f1: 0.4036
 epoch: 61, train_loss: 0.9357, test_loss: 1.0454, test_f1: 0.4292
 epoch: 62, train_loss: 0.9467, test_loss: 1.0559, test_f1: 0.4285
 epoch: 63, train_loss: 0.9308, test_loss: 1.0442, test_f1: 0.4266
 epoch: 64, train_loss: 0.9234, test_loss: 1.0796, test_f1: 0.4200
 epoch: 65, train_loss: 0.9212, test_loss: 1.0669, test_f1: 0.4177
 epoch: 66, train_loss: 0.9311, test_loss: 1.0106, test_f1: 0.4288
 epoch: 67, train_loss: 0.9318, test_loss: 1.1166, test_f1: 0.4143
 epoch: 68, train_loss: 0.9194, test_loss: 1.1134, test_f1: 0.4102
 epoch: 69, train_loss: 0.9251, test_loss: 1.3752, test_f1: 0.3743
 epoch: 70, train_loss: 0.9133, test_loss: 1.0990, test_f1: 0.4172
 epoch: 71, train_loss: 0.8967, test_loss: 1.1054, test_f1: 0.4155
 epoch: 72, train_loss: 0.8987, test_loss: 1.0419, test_f1: 0.4260
 epoch: 73, train_loss: 0.9004, test_loss: 1.0584, test_f1: 0.4207
 epoch: 74, train_loss: 0.8855, test_loss: 1.0468, test_f1: 0.4260
 epoch: 75, train_loss: 0.8906, test_loss: 1.0536, test_f1: 0.4244
 epoch: 76, train_loss: 0.8822, test_loss: 1.0067, test_f1: 0.4323
 epoch: 77, train_loss: 0.8967, test_loss: 1.1059, test_f1: 0.4217
 epoch: 78, train_loss: 0.8901, test_loss: 1.0870, test_f1: 0.4099
 epoch: 79, train_loss: 0.8727, test_loss: 1.1098, test_f1: 0.4125
 epoch: 80, train_loss: 0.8695, test_loss: 1.0445, test_f1: 0.5122
 epoch: 81, train_loss: 0.8800, test_loss: 1.0882, test_f1: 0.4050
 epoch: 82, train_loss: 0.8676, test_loss: 0.9850, test_f1: 0.4201
 epoch: 83, train_loss: 0.8864, test_loss: 1.0102, test_f1: 0.5263
 epoch: 84, train_loss: 0.8744, test_loss: 1.0880, test_f1: 0.5189
 epoch: 85, train_loss: 0.9085, test_loss: 1.1575, test_f1: 0.4300
 epoch: 86, train_loss: 0.8989, test_loss: 1.0132, test_f1: 0.4170
 epoch: 87, train_loss: 0.9060, test_loss: 1.0203, test_f1: 0.5201
 epoch: 88, train_loss: 0.9053, test_loss: 1.1838, test_f1: 0.4683
 epoch: 89, train_loss: 0.9342, test_loss: 1.2117, test_f1: 0.3275
 epoch: 90, train_loss: 0.9079, test_loss: 0.9905, test_f1: 0.4317
 epoch: 91, train_loss: 0.9141, test_loss: 1.0204, test_f1: 0.5297
 epoch: 92, train_loss: 0.8948, test_loss: 1.0330, test_f1: 0.4918
 epoch: 93, train_loss: 0.8989, test_loss: 1.0435, test_f1: 0.5225
 epoch: 94, train_loss: 0.8981, test_loss: 1.1274, test_f1: 0.3940
 epoch: 95, train_loss: 0.8968, test_loss: 1.1198, test_f1: 0.4888
 epoch: 96, train_loss: 0.8948, test_loss: 1.0519, test_f1: 0.5397
 epoch: 97, train_loss: 0.8942, test_loss: 1.0337, test_f1: 0.5167
 epoch: 98, train_loss: 0.8945, test_loss: 1.0372, test_f1: 0.4244
 epoch: 99, train_loss: 0.8908, test_loss: 0.9970, test_f1: 0.4346
##################ITERATION #7 ****************************************
 epoch: 0, train_loss: 2.4159, test_loss: 2.4071, test_f1: 0.1365
 epoch: 1, train_loss: 1.2896, test_loss: 1.8801, test_f1: 0.1368
 epoch: 2, train_loss: 1.2427, test_loss: 1.4091, test_f1: 0.1497
 epoch: 3, train_loss: 1.2122, test_loss: 1.5453, test_f1: 0.1426
 epoch: 4, train_loss: 1.1924, test_loss: 1.3183, test_f1: 0.3181
 epoch: 5, train_loss: 1.1846, test_loss: 1.2704, test_f1: 0.3573
 epoch: 6, train_loss: 1.1586, test_loss: 1.2101, test_f1: 0.4009
 epoch: 7, train_loss: 1.1256, test_loss: 1.1489, test_f1: 0.3724
 epoch: 8, train_loss: 1.0498, test_loss: 1.1105, test_f1: 0.3639
 epoch: 9, train_loss: 1.0551, test_loss: 1.1478, test_f1: 0.4477
 epoch: 10, train_loss: 1.0314, test_loss: 1.2068, test_f1: 0.3691
 epoch: 11, train_loss: 1.0174, test_loss: 1.1606, test_f1: 0.4023
 epoch: 12, train_loss: 0.9995, test_loss: 1.1454, test_f1: 0.3399
 epoch: 13, train_loss: 1.0011, test_loss: 1.0740, test_f1: 0.3685
 epoch: 14, train_loss: 0.9845, test_loss: 1.2356, test_f1: 0.3849
 epoch: 15, train_loss: 0.9775, test_loss: 1.1394, test_f1: 0.3378
 epoch: 16, train_loss: 0.9884, test_loss: 1.8304, test_f1: 0.2522
 epoch: 17, train_loss: 1.0288, test_loss: 1.1283, test_f1: 0.3295
 epoch: 18, train_loss: 1.0236, test_loss: 1.1676, test_f1: 0.3169
 epoch: 19, train_loss: 1.0135, test_loss: 1.1024, test_f1: 0.3769
 epoch: 20, train_loss: 1.0483, test_loss: 1.3184, test_f1: 0.2452
 epoch: 21, train_loss: 1.0141, test_loss: 3.1798, test_f1: 0.2084
 epoch: 22, train_loss: 1.0169, test_loss: 1.4254, test_f1: 0.3778
 epoch: 23, train_loss: 1.0083, test_loss: 1.5865, test_f1: 0.2557
 epoch: 24, train_loss: 1.0166, test_loss: 1.4263, test_f1: 0.3862
 epoch: 25, train_loss: 1.0103, test_loss: 1.3375, test_f1: 0.3313
 epoch: 26, train_loss: 0.9996, test_loss: 1.0838, test_f1: 0.3317
 epoch: 27, train_loss: 0.9994, test_loss: 1.3547, test_f1: 0.3868
 epoch: 28, train_loss: 0.9872, test_loss: 1.5221, test_f1: 0.3895
 epoch: 29, train_loss: 0.9919, test_loss: 1.2522, test_f1: 0.4597
 epoch: 30, train_loss: 0.9674, test_loss: 1.1024, test_f1: 0.5014
 epoch: 31, train_loss: 1.0026, test_loss: 1.1267, test_f1: 0.4620
 epoch: 32, train_loss: 1.0100, test_loss: 1.1140, test_f1: 0.3440
 epoch: 33, train_loss: 0.9926, test_loss: 1.1329, test_f1: 0.4382
 epoch: 34, train_loss: 0.9722, test_loss: 1.1338, test_f1: 0.4441
 epoch: 35, train_loss: 0.9831, test_loss: 1.1374, test_f1: 0.3265
 epoch: 36, train_loss: 0.9836, test_loss: 1.1107, test_f1: 0.3350
 epoch: 37, train_loss: 0.9865, test_loss: 1.0933, test_f1: 0.4052
 epoch: 38, train_loss: 0.9818, test_loss: 1.3348, test_f1: 0.3443
 epoch: 39, train_loss: 0.9746, test_loss: 1.8061, test_f1: 0.2638
 epoch: 40, train_loss: 0.9861, test_loss: 1.0967, test_f1: 0.3746
 epoch: 41, train_loss: 0.9897, test_loss: 1.1594, test_f1: 0.4162
 epoch: 42, train_loss: 1.0050, test_loss: 1.2921, test_f1: 0.4727
 epoch: 43, train_loss: 0.9827, test_loss: 1.3424, test_f1: 0.4572
 epoch: 44, train_loss: 1.0015, test_loss: 1.3916, test_f1: 0.2855
 epoch: 45, train_loss: 0.9910, test_loss: 1.4312, test_f1: 0.4212
 epoch: 46, train_loss: 0.9741, test_loss: 1.1323, test_f1: 0.4328
 epoch: 47, train_loss: 0.9859, test_loss: 1.3742, test_f1: 0.3954
 epoch: 48, train_loss: 1.0116, test_loss: 1.0893, test_f1: 0.4444
 epoch: 49, train_loss: 0.9865, test_loss: 1.0879, test_f1: 0.4660
 epoch: 50, train_loss: 0.9768, test_loss: 1.1051, test_f1: 0.4521
 epoch: 51, train_loss: 0.9721, test_loss: 1.1054, test_f1: 0.4389
 epoch: 52, train_loss: 0.9713, test_loss: 1.1641, test_f1: 0.3373
 epoch: 53, train_loss: 0.9909, test_loss: 1.1210, test_f1: 0.3471
 epoch: 54, train_loss: 0.9735, test_loss: 1.0928, test_f1: 0.3694
 epoch: 55, train_loss: 0.9616, test_loss: 1.1056, test_f1: 0.3816
 epoch: 56, train_loss: 0.9878, test_loss: 1.1163, test_f1: 0.3722
 epoch: 57, train_loss: 0.9889, test_loss: 1.0912, test_f1: 0.3435
 epoch: 58, train_loss: 0.9589, test_loss: 1.1105, test_f1: 0.3428
 epoch: 59, train_loss: 0.9632, test_loss: 1.0607, test_f1: 0.4818
 epoch: 60, train_loss: 0.9499, test_loss: 1.0709, test_f1: 0.4878
 epoch: 61, train_loss: 0.9366, test_loss: 1.1165, test_f1: 0.3509
 epoch: 62, train_loss: 0.9548, test_loss: 1.1394, test_f1: 0.4426
 epoch: 63, train_loss: 0.9501, test_loss: 1.1804, test_f1: 0.4583
 epoch: 64, train_loss: 0.9482, test_loss: 1.1373, test_f1: 0.4948
 epoch: 65, train_loss: 0.9627, test_loss: 1.3607, test_f1: 0.4792
 epoch: 66, train_loss: 0.9492, test_loss: 1.2865, test_f1: 0.3959
 epoch: 67, train_loss: 0.9327, test_loss: 1.0837, test_f1: 0.5089
 epoch: 68, train_loss: 0.9477, test_loss: 1.0733, test_f1: 0.5236
 epoch: 69, train_loss: 0.9542, test_loss: 1.1523, test_f1: 0.4385
 epoch: 70, train_loss: 0.9563, test_loss: 1.0961, test_f1: 0.3885
 epoch: 71, train_loss: 0.9589, test_loss: 1.0857, test_f1: 0.4647
 epoch: 72, train_loss: 0.9497, test_loss: 1.0768, test_f1: 0.4102
 epoch: 73, train_loss: 0.9550, test_loss: 1.2243, test_f1: 0.3111
 epoch: 74, train_loss: 0.9610, test_loss: 1.2398, test_f1: 0.4078
 epoch: 75, train_loss: 0.9558, test_loss: 1.1100, test_f1: 0.3821
 epoch: 76, train_loss: 0.9652, test_loss: 1.1152, test_f1: 0.3572
 epoch: 77, train_loss: 0.9509, test_loss: 1.1425, test_f1: 0.4771
 epoch: 78, train_loss: 0.9451, test_loss: 1.1353, test_f1: 0.4681
 epoch: 79, train_loss: 0.9534, test_loss: 1.0645, test_f1: 0.3683
 epoch: 80, train_loss: 0.9671, test_loss: 1.1148, test_f1: 0.3817
 epoch: 81, train_loss: 0.9800, test_loss: 1.1247, test_f1: 0.4448
 epoch: 82, train_loss: 0.9917, test_loss: 1.1823, test_f1: 0.3569
 epoch: 83, train_loss: 0.9778, test_loss: 1.2125, test_f1: 0.4457
 epoch: 84, train_loss: 0.9551, test_loss: 1.1590, test_f1: 0.4358
 epoch: 85, train_loss: 0.9768, test_loss: 1.0630, test_f1: 0.4191
 epoch: 86, train_loss: 0.9781, test_loss: 1.0480, test_f1: 0.4242
 epoch: 87, train_loss: 0.9801, test_loss: 1.0373, test_f1: 0.4244
 epoch: 88, train_loss: 0.9598, test_loss: 1.0414, test_f1: 0.5495
 epoch: 89, train_loss: 0.9465, test_loss: 1.0467, test_f1: 0.4848
 epoch: 90, train_loss: 0.9489, test_loss: 1.1910, test_f1: 0.4140
 epoch: 91, train_loss: 0.9729, test_loss: 1.0844, test_f1: 0.3764
 epoch: 92, train_loss: 0.9762, test_loss: 1.2419, test_f1: 0.4984
 epoch: 93, train_loss: 0.9519, test_loss: 1.1006, test_f1: 0.3973
 epoch: 94, train_loss: 0.9494, test_loss: 1.0674, test_f1: 0.5033
 epoch: 95, train_loss: 0.9531, test_loss: 1.0614, test_f1: 0.4102
 epoch: 96, train_loss: 0.9517, test_loss: 1.0642, test_f1: 0.3973
 epoch: 97, train_loss: 0.9433, test_loss: 1.0548, test_f1: 0.4744
 epoch: 98, train_loss: 0.9322, test_loss: 1.0508, test_f1: 0.4674
 epoch: 99, train_loss: 0.9159, test_loss: 1.0427, test_f1: 0.4624
##################ITERATION #8 ****************************************
 epoch: 0, train_loss: 1.4361, test_loss: 1.4163, test_f1: 0.0507
 epoch: 1, train_loss: 1.2831, test_loss: 1.3376, test_f1: 0.2281
 epoch: 2, train_loss: 1.2560, test_loss: 1.3119, test_f1: 0.2281
 epoch: 3, train_loss: 1.2599, test_loss: 1.3121, test_f1: 0.2281
 epoch: 4, train_loss: 1.2528, test_loss: 1.3067, test_f1: 0.2281
 epoch: 5, train_loss: 1.2430, test_loss: 1.2654, test_f1: 0.2281
 epoch: 6, train_loss: 1.2289, test_loss: 1.2895, test_f1: 0.3032
 epoch: 7, train_loss: 1.2179, test_loss: 1.3682, test_f1: 0.2175
 epoch: 8, train_loss: 1.2354, test_loss: 1.4337, test_f1: 0.2281
 epoch: 9, train_loss: 1.2011, test_loss: 1.3832, test_f1: 0.2256
 epoch: 10, train_loss: 1.1571, test_loss: 1.6893, test_f1: 0.1625
 epoch: 11, train_loss: 1.1364, test_loss: 1.3735, test_f1: 0.3335
 epoch: 12, train_loss: 1.1353, test_loss: 1.3314, test_f1: 0.3008
 epoch: 13, train_loss: 1.1501, test_loss: 1.4296, test_f1: 0.1977
 epoch: 14, train_loss: 1.1606, test_loss: 2.2596, test_f1: 0.1436
 epoch: 15, train_loss: 1.1064, test_loss: 1.7019, test_f1: 0.2325
 epoch: 16, train_loss: 1.0999, test_loss: 1.8400, test_f1: 0.1558
 epoch: 17, train_loss: 1.0949, test_loss: 1.2180, test_f1: 0.3215
 epoch: 18, train_loss: 1.1055, test_loss: 1.1882, test_f1: 0.3145
 epoch: 19, train_loss: 1.0844, test_loss: 1.2512, test_f1: 0.2885
 epoch: 20, train_loss: 1.0672, test_loss: 1.2088, test_f1: 0.3559
 epoch: 21, train_loss: 1.0621, test_loss: 1.2351, test_f1: 0.3535
 epoch: 22, train_loss: 1.1111, test_loss: 1.1482, test_f1: 0.3317
 epoch: 23, train_loss: 1.0882, test_loss: 1.1989, test_f1: 0.3286
 epoch: 24, train_loss: 1.0977, test_loss: 1.1422, test_f1: 0.3349
 epoch: 25, train_loss: 1.0689, test_loss: 1.1481, test_f1: 0.3831
 epoch: 26, train_loss: 1.0745, test_loss: 1.1638, test_f1: 0.3317
 epoch: 27, train_loss: 1.0580, test_loss: 1.1377, test_f1: 0.3395
 epoch: 28, train_loss: 1.0685, test_loss: 1.2254, test_f1: 0.3955
 epoch: 29, train_loss: 1.0558, test_loss: 1.1160, test_f1: 0.3412
 epoch: 30, train_loss: 1.0267, test_loss: 1.1161, test_f1: 0.3370
 epoch: 31, train_loss: 1.0523, test_loss: 1.2641, test_f1: 0.2638
 epoch: 32, train_loss: 1.0673, test_loss: 1.1710, test_f1: 0.3262
 epoch: 33, train_loss: 1.0469, test_loss: 1.1810, test_f1: 0.4374
 epoch: 34, train_loss: 1.0403, test_loss: 1.1532, test_f1: 0.3317
 epoch: 35, train_loss: 1.0238, test_loss: 1.1562, test_f1: 0.3317
 epoch: 36, train_loss: 1.0293, test_loss: 1.1532, test_f1: 0.4121
 epoch: 37, train_loss: 1.0381, test_loss: 1.1440, test_f1: 0.3617
 epoch: 38, train_loss: 1.0221, test_loss: 1.1324, test_f1: 0.3317
 epoch: 39, train_loss: 1.0136, test_loss: 1.1013, test_f1: 0.3395
 epoch: 40, train_loss: 1.0247, test_loss: 1.0945, test_f1: 0.3431
 epoch: 41, train_loss: 1.0486, test_loss: 1.1786, test_f1: 0.3083
 epoch: 42, train_loss: 1.0521, test_loss: 1.1729, test_f1: 0.3583
 epoch: 43, train_loss: 1.0694, test_loss: 1.1170, test_f1: 0.3344
 epoch: 44, train_loss: 1.0385, test_loss: 1.1296, test_f1: 0.4112
 epoch: 45, train_loss: 1.0403, test_loss: 1.0985, test_f1: 0.3463
 epoch: 46, train_loss: 1.0421, test_loss: 1.1811, test_f1: 0.3660
 epoch: 47, train_loss: 1.0520, test_loss: 1.1470, test_f1: 0.3290
 epoch: 48, train_loss: 1.0359, test_loss: 1.1174, test_f1: 0.3535
 epoch: 49, train_loss: 1.0232, test_loss: 1.1407, test_f1: 0.3201
 epoch: 50, train_loss: 1.0225, test_loss: 1.1292, test_f1: 0.3344
 epoch: 51, train_loss: 1.0169, test_loss: 1.1399, test_f1: 0.3603
 epoch: 52, train_loss: 1.0108, test_loss: 1.1068, test_f1: 0.3395
 epoch: 53, train_loss: 1.0037, test_loss: 1.1076, test_f1: 0.3395
 epoch: 54, train_loss: 1.0055, test_loss: 1.1223, test_f1: 0.3344
 epoch: 55, train_loss: 1.0114, test_loss: 1.0921, test_f1: 0.3395
 epoch: 56, train_loss: 1.0074, test_loss: 1.0732, test_f1: 0.3752
 epoch: 57, train_loss: 1.0004, test_loss: 1.0929, test_f1: 0.4373
 epoch: 58, train_loss: 1.0008, test_loss: 1.0916, test_f1: 0.3412
 epoch: 59, train_loss: 0.9976, test_loss: 1.1328, test_f1: 0.4622
 epoch: 60, train_loss: 1.0016, test_loss: 1.3735, test_f1: 0.3850
 epoch: 61, train_loss: 0.9969, test_loss: 1.1178, test_f1: 0.3651
 epoch: 62, train_loss: 1.0166, test_loss: 1.1098, test_f1: 0.4191
 epoch: 63, train_loss: 1.0017, test_loss: 1.1035, test_f1: 0.4553
 epoch: 64, train_loss: 0.9901, test_loss: 1.1049, test_f1: 0.3344
 epoch: 65, train_loss: 0.9979, test_loss: 1.1142, test_f1: 0.3344
 epoch: 66, train_loss: 0.9873, test_loss: 1.1217, test_f1: 0.3344
 epoch: 67, train_loss: 0.9876, test_loss: 1.0875, test_f1: 0.3414
 epoch: 68, train_loss: 1.0191, test_loss: 1.1588, test_f1: 0.4277
 epoch: 69, train_loss: 0.9959, test_loss: 1.1810, test_f1: 0.3921
 epoch: 70, train_loss: 0.9793, test_loss: 1.0946, test_f1: 0.4501
 epoch: 71, train_loss: 0.9849, test_loss: 1.0840, test_f1: 0.4596
 epoch: 72, train_loss: 0.9795, test_loss: 1.0551, test_f1: 0.3468
 epoch: 73, train_loss: 0.9829, test_loss: 1.0786, test_f1: 0.3395
 epoch: 74, train_loss: 0.9886, test_loss: 1.2052, test_f1: 0.4316
 epoch: 75, train_loss: 0.9808, test_loss: 1.1235, test_f1: 0.3333
 epoch: 76, train_loss: 0.9697, test_loss: 1.1919, test_f1: 0.4441
 epoch: 77, train_loss: 0.9785, test_loss: 1.1000, test_f1: 0.3927
 epoch: 78, train_loss: 0.9782, test_loss: 1.1056, test_f1: 0.4493
 epoch: 79, train_loss: 0.9679, test_loss: 1.1128, test_f1: 0.3344
 epoch: 80, train_loss: 0.9663, test_loss: 1.0440, test_f1: 0.4562
 epoch: 81, train_loss: 0.9774, test_loss: 1.0142, test_f1: 0.4624
 epoch: 82, train_loss: 0.9841, test_loss: 1.0770, test_f1: 0.3538
 epoch: 83, train_loss: 0.9584, test_loss: 1.0793, test_f1: 0.3803
 epoch: 84, train_loss: 0.9603, test_loss: 1.1830, test_f1: 0.4039
 epoch: 85, train_loss: 0.9836, test_loss: 1.0569, test_f1: 0.3984
 epoch: 86, train_loss: 0.9718, test_loss: 1.1165, test_f1: 0.4783
 epoch: 87, train_loss: 0.9677, test_loss: 1.4038, test_f1: 0.3234
 epoch: 88, train_loss: 0.9606, test_loss: 1.1935, test_f1: 0.4351
 epoch: 89, train_loss: 0.9768, test_loss: 1.2092, test_f1: 0.3742
 epoch: 90, train_loss: 0.9746, test_loss: 1.1432, test_f1: 0.3298
 epoch: 91, train_loss: 0.9820, test_loss: 1.1080, test_f1: 0.3451
 epoch: 92, train_loss: 1.0005, test_loss: 1.1641, test_f1: 0.4465
 epoch: 93, train_loss: 1.0113, test_loss: 1.1251, test_f1: 0.3317
 epoch: 94, train_loss: 0.9793, test_loss: 1.1056, test_f1: 0.3932
 epoch: 95, train_loss: 0.9600, test_loss: 1.1124, test_f1: 0.3712
 epoch: 96, train_loss: 0.9573, test_loss: 1.3226, test_f1: 0.3135
 epoch: 97, train_loss: 0.9445, test_loss: 1.4023, test_f1: 0.4450
 epoch: 98, train_loss: 0.9700, test_loss: 1.4954, test_f1: 0.3897
 epoch: 99, train_loss: 0.9332, test_loss: 1.4320, test_f1: 0.3113
##################ITERATION #9 ****************************************
 epoch: 0, train_loss: 1.4013, test_loss: 3.7809, test_f1: 0.2281
 epoch: 1, train_loss: 1.2190, test_loss: 4.8265, test_f1: 0.1365
 epoch: 2, train_loss: 1.1083, test_loss: 1.4255, test_f1: 0.1887
 epoch: 3, train_loss: 1.1202, test_loss: 1.2540, test_f1: 0.3193
 epoch: 4, train_loss: 1.0854, test_loss: 1.3446, test_f1: 0.2491
 epoch: 5, train_loss: 1.0597, test_loss: 1.2567, test_f1: 0.3464
 epoch: 6, train_loss: 1.0595, test_loss: 1.1932, test_f1: 0.3311
 epoch: 7, train_loss: 1.0515, test_loss: 1.2291, test_f1: 0.3594
 epoch: 8, train_loss: 1.0395, test_loss: 1.1415, test_f1: 0.3388
 epoch: 9, train_loss: 1.0468, test_loss: 1.1559, test_f1: 0.3692
 epoch: 10, train_loss: 1.0522, test_loss: 1.1700, test_f1: 0.3290
 epoch: 11, train_loss: 1.0615, test_loss: 1.1720, test_f1: 0.3205
 epoch: 12, train_loss: 1.0414, test_loss: 1.1240, test_f1: 0.3395
 epoch: 13, train_loss: 1.0395, test_loss: 1.1533, test_f1: 0.3317
 epoch: 14, train_loss: 1.0253, test_loss: 1.1212, test_f1: 0.3399
 epoch: 15, train_loss: 1.0278, test_loss: 1.2158, test_f1: 0.4119
 epoch: 16, train_loss: 1.0281, test_loss: 1.5814, test_f1: 0.2876
 epoch: 17, train_loss: 1.0302, test_loss: 1.5775, test_f1: 0.2333
 epoch: 18, train_loss: 1.0302, test_loss: 1.1300, test_f1: 0.3344
 epoch: 19, train_loss: 1.0151, test_loss: 1.1594, test_f1: 0.3903
 epoch: 20, train_loss: 1.0060, test_loss: 1.1605, test_f1: 0.3395
 epoch: 21, train_loss: 1.0141, test_loss: 1.2706, test_f1: 0.4401
 epoch: 22, train_loss: 1.0706, test_loss: 1.2849, test_f1: 0.2586
 epoch: 23, train_loss: 1.0329, test_loss: 1.2534, test_f1: 0.2759
 epoch: 24, train_loss: 1.0145, test_loss: 1.2943, test_f1: 0.3959
 epoch: 25, train_loss: 1.0092, test_loss: 1.1486, test_f1: 0.3290
 epoch: 26, train_loss: 0.9992, test_loss: 1.6319, test_f1: 0.2696
 epoch: 27, train_loss: 0.9947, test_loss: 1.1034, test_f1: 0.3399
 epoch: 28, train_loss: 1.0078, test_loss: 1.2841, test_f1: 0.3602
 epoch: 29, train_loss: 1.0214, test_loss: 1.2348, test_f1: 0.3980
 epoch: 30, train_loss: 0.9982, test_loss: 1.5537, test_f1: 0.3617
 epoch: 31, train_loss: 1.0090, test_loss: 1.5302, test_f1: 0.4030
 epoch: 32, train_loss: 0.9953, test_loss: 1.1595, test_f1: 0.3262
 epoch: 33, train_loss: 1.0194, test_loss: 1.1455, test_f1: 0.3290
 epoch: 34, train_loss: 0.9876, test_loss: 1.2101, test_f1: 0.3073
 epoch: 35, train_loss: 1.0013, test_loss: 1.1226, test_f1: 0.3395
 epoch: 36, train_loss: 0.9889, test_loss: 1.6909, test_f1: 0.2369
 epoch: 37, train_loss: 1.0674, test_loss: 1.7198, test_f1: 0.1845
 epoch: 38, train_loss: 1.0549, test_loss: 1.2394, test_f1: 0.2957
 epoch: 39, train_loss: 1.0038, test_loss: 1.0871, test_f1: 0.3444
 epoch: 40, train_loss: 1.0296, test_loss: 1.0818, test_f1: 0.3444
 epoch: 41, train_loss: 1.0018, test_loss: 1.0836, test_f1: 0.4447
 epoch: 42, train_loss: 1.0153, test_loss: 1.0868, test_f1: 0.3942
 epoch: 43, train_loss: 1.0014, test_loss: 1.1400, test_f1: 0.3395
 epoch: 44, train_loss: 0.9948, test_loss: 1.0899, test_f1: 0.4218
 epoch: 45, train_loss: 1.0104, test_loss: 1.1290, test_f1: 0.3395
 epoch: 46, train_loss: 0.9974, test_loss: 1.0677, test_f1: 0.4476
 epoch: 47, train_loss: 0.9934, test_loss: 1.0938, test_f1: 0.3344
 epoch: 48, train_loss: 0.9939, test_loss: 1.1091, test_f1: 0.3344
 epoch: 49, train_loss: 0.9896, test_loss: 1.1168, test_f1: 0.3344
 epoch: 50, train_loss: 0.9778, test_loss: 1.3059, test_f1: 0.3792
 epoch: 51, train_loss: 0.9887, test_loss: 1.4540, test_f1: 0.2673
 epoch: 52, train_loss: 0.9751, test_loss: 1.2431, test_f1: 0.3496
 epoch: 53, train_loss: 0.9925, test_loss: 1.0656, test_f1: 0.3364
 epoch: 54, train_loss: 0.9854, test_loss: 1.0942, test_f1: 0.3395
 epoch: 55, train_loss: 0.9798, test_loss: 1.1242, test_f1: 0.3946
 epoch: 56, train_loss: 0.9865, test_loss: 1.0934, test_f1: 0.3344
 epoch: 57, train_loss: 0.9886, test_loss: 1.0791, test_f1: 0.4267
 epoch: 58, train_loss: 0.9910, test_loss: 1.1280, test_f1: 0.3477
 epoch: 59, train_loss: 0.9826, test_loss: 1.1639, test_f1: 0.3317
 epoch: 60, train_loss: 0.9629, test_loss: 1.2189, test_f1: 0.4544
 epoch: 61, train_loss: 0.9667, test_loss: 1.1211, test_f1: 0.3344
 epoch: 62, train_loss: 0.9698, test_loss: 1.0521, test_f1: 0.3380
 epoch: 63, train_loss: 0.9680, test_loss: 1.0938, test_f1: 0.3370
 epoch: 64, train_loss: 0.9636, test_loss: 1.0529, test_f1: 0.3384
 epoch: 65, train_loss: 0.9554, test_loss: 1.1097, test_f1: 0.3400
 epoch: 66, train_loss: 0.9530, test_loss: 1.1986, test_f1: 0.4185
 epoch: 67, train_loss: 0.9603, test_loss: 1.0491, test_f1: 0.3468
 epoch: 68, train_loss: 0.9578, test_loss: 1.0491, test_f1: 0.3453
 epoch: 69, train_loss: 0.9454, test_loss: 1.1503, test_f1: 0.3371
 epoch: 70, train_loss: 0.9440, test_loss: 1.3528, test_f1: 0.2966
 epoch: 71, train_loss: 0.9629, test_loss: 2.5578, test_f1: 0.2313
 epoch: 72, train_loss: 0.9769, test_loss: 1.2796, test_f1: 0.4541
 epoch: 73, train_loss: 0.9600, test_loss: 1.2000, test_f1: 0.4428
 epoch: 74, train_loss: 0.9555, test_loss: 1.1534, test_f1: 0.3262
 epoch: 75, train_loss: 0.9645, test_loss: 1.1137, test_f1: 0.4710
 epoch: 76, train_loss: 0.9560, test_loss: 1.0775, test_f1: 0.3443
 epoch: 77, train_loss: 0.9495, test_loss: 1.0925, test_f1: 0.3533
 epoch: 78, train_loss: 0.9604, test_loss: 1.0979, test_f1: 0.3345
 epoch: 79, train_loss: 0.9489, test_loss: 1.0469, test_f1: 0.3507
 epoch: 80, train_loss: 0.9453, test_loss: 1.1339, test_f1: 0.3276
 epoch: 81, train_loss: 0.9422, test_loss: 1.2583, test_f1: 0.3251
 epoch: 82, train_loss: 0.9567, test_loss: 1.4150, test_f1: 0.3926
 epoch: 83, train_loss: 0.9523, test_loss: 1.3653, test_f1: 0.3103
 epoch: 84, train_loss: 0.9524, test_loss: 1.1215, test_f1: 0.3514
 epoch: 85, train_loss: 0.9297, test_loss: 1.0416, test_f1: 0.4114
 epoch: 86, train_loss: 0.9444, test_loss: 1.1386, test_f1: 0.3279
 epoch: 87, train_loss: 0.9514, test_loss: 1.1183, test_f1: 0.4167
 epoch: 88, train_loss: 0.9528, test_loss: 1.1369, test_f1: 0.3348
 epoch: 89, train_loss: 0.9498, test_loss: 1.1059, test_f1: 0.3462
 epoch: 90, train_loss: 0.9393, test_loss: 1.1437, test_f1: 0.3538
 epoch: 91, train_loss: 0.9519, test_loss: 1.1024, test_f1: 0.3449
 epoch: 92, train_loss: 0.9420, test_loss: 1.0423, test_f1: 0.3565
 epoch: 93, train_loss: 0.9384, test_loss: 1.0551, test_f1: 0.3398
 epoch: 94, train_loss: 0.9364, test_loss: 1.0770, test_f1: 0.3603
 epoch: 95, train_loss: 0.9539, test_loss: 1.1326, test_f1: 0.3348
 epoch: 96, train_loss: 0.9470, test_loss: 1.0840, test_f1: 0.3473
 epoch: 97, train_loss: 0.9461, test_loss: 1.0797, test_f1: 0.3456
 epoch: 98, train_loss: 0.9553, test_loss: 1.0297, test_f1: 0.3503
 epoch: 99, train_loss: 1.0071, test_loss: 1.1985, test_f1: 0.2962

Training completed in 364.77 seconds
Best F1: 0.5574 at epoch 97
Mean F1 across iterations: 0.4425  0.1076
========================FINAL RESULTS================================
FEGIN weighted F1: 0.5574  0.1076
python main.py --data ltspice_demos --representation component_pin_net --model FEGIN --layers 2 --hiddens 32 --batch_size 256 --lr 0.1 --emb_size 512 --epochs 100 --save_appendix component_pin_net_L2_H32_BS256_LR0.1_E512 --no_val
-----



STDERR:
  File "main.py", line 370, in <module>
    main()
  File "main.py", line 254, in main
    dataset = dataset_class(
  File "/home/philip/projects/ltspice_examples_code_repo/Circuit-Completion-Using-GNNs/component_classification_with_link_prediction_head/evaluation/FEGIN/kernel/circuit_datasets.py", line 15, in __init__
    self.data, self.slices = torch.load(self.processed_paths[0])
  File "/home/philip/.local/lib/python3.8/site-packages/torch/serialization.py", line 1040, in load
    warnings.warn(
  File "/usr/lib/python3.8/warnings.py", line 109, in _showwarnmsg
    sw(msg.message, msg.category, msg.filename, msg.lineno,
  File "main.py", line 47, in warn_with_traceback
    traceback.print_stack(file=log)
/home/philip/projects/ltspice_examples_code_repo/Circuit-Completion-Using-GNNs/component_classification_with_link_prediction_head/evaluation/FEGIN/kernel/circuit_datasets.py:15: FutureWarning: You are using `torch.load` with `weights_only=False` (the current default value), which uses the default pickle module implicitly. It is possible to construct malicious pickle data which will execute arbitrary code during unpickling (See https://github.com/pytorch/pytorch/blob/main/SECURITY.md#untrusted-models for more details). In a future release, the default value for `weights_only` will be flipped to `True`. This limits the functions that could be executed during unpickling. Arbitrary objects will no longer be allowed to be loaded via this mode unless they are explicitly allowlisted by the user via `torch.serialization.add_safe_globals`. We recommend you start setting `weights_only=True` for any use case where you don't have full control of the loaded file. Please open an issue on GitHub for any issues related to this experimental feature.
  self.data, self.slices = torch.load(self.processed_paths[0])
