STDOUT:
Results will be saved in /home/philip/projects/ltspice_examples_code_repo/Circuit-Completion-Using-GNNs/component_classification_with_link_prediction_head/evaluation/FEGIN/results/model_FEGIN_dataset_ltspice_examples
Command line input: python main.py --data ltspice_examples --representation component_component --model FEGIN --layers 4 --hiddens 16 --batch_size 256 --lr 0.001 --emb_size 512 --epochs 100 --save_appendix component_component_L4_H16_BS256_LR0.001_E512 --no_val
 is saved.
-----
ltspice_examples - FEGIN
Using 4 layers, 16 hidden units, h = 2
Loading component_component representation dataset
ENTERED
Training FEGIN on component_component representation
Train: 3556, Test: 845
##################ITERATION #0 ****************************************
 epoch: 0, train_loss: 1.3533, test_loss: 1.3557, test_f1: 0.2274
 epoch: 1, train_loss: 1.3410, test_loss: 1.3486, test_f1: 0.2274
 epoch: 2, train_loss: 1.3329, test_loss: 1.3404, test_f1: 0.2274
 epoch: 3, train_loss: 1.3236, test_loss: 1.3299, test_f1: 0.2274
 epoch: 4, train_loss: 1.3122, test_loss: 1.3184, test_f1: 0.2274
 epoch: 5, train_loss: 1.3007, test_loss: 1.3036, test_f1: 0.2274
 epoch: 6, train_loss: 1.2870, test_loss: 1.2894, test_f1: 0.2274
 epoch: 7, train_loss: 1.2766, test_loss: 1.2690, test_f1: 0.2274
 epoch: 8, train_loss: 1.2600, test_loss: 1.2535, test_f1: 0.2274
 epoch: 9, train_loss: 1.2480, test_loss: 1.2379, test_f1: 0.2274
 epoch: 10, train_loss: 1.2411, test_loss: 1.2309, test_f1: 0.2274
 epoch: 11, train_loss: 1.2360, test_loss: 1.2252, test_f1: 0.2325
 epoch: 12, train_loss: 1.2292, test_loss: 1.2244, test_f1: 0.2516
 epoch: 13, train_loss: 1.2233, test_loss: 1.2134, test_f1: 0.2875
 epoch: 14, train_loss: 1.2243, test_loss: 1.2143, test_f1: 0.3260
 epoch: 15, train_loss: 1.2139, test_loss: 1.2083, test_f1: 0.3276
 epoch: 16, train_loss: 1.2090, test_loss: 1.1971, test_f1: 0.3489
 epoch: 17, train_loss: 1.2035, test_loss: 1.1908, test_f1: 0.3660
 epoch: 18, train_loss: 1.2007, test_loss: 1.1825, test_f1: 0.3574
 epoch: 19, train_loss: 1.1954, test_loss: 1.1846, test_f1: 0.3555
 epoch: 20, train_loss: 1.1872, test_loss: 1.1817, test_f1: 0.3517
 epoch: 21, train_loss: 1.1852, test_loss: 1.1776, test_f1: 0.3560
 epoch: 22, train_loss: 1.1732, test_loss: 1.1713, test_f1: 0.3710
 epoch: 23, train_loss: 1.1701, test_loss: 1.1642, test_f1: 0.3796
 epoch: 24, train_loss: 1.1666, test_loss: 1.1563, test_f1: 0.4232
 epoch: 25, train_loss: 1.1560, test_loss: 1.1517, test_f1: 0.4335
 epoch: 26, train_loss: 1.1506, test_loss: 1.1469, test_f1: 0.4277
 epoch: 27, train_loss: 1.1422, test_loss: 1.1350, test_f1: 0.4344
 epoch: 28, train_loss: 1.1389, test_loss: 1.1437, test_f1: 0.4196
 epoch: 29, train_loss: 1.1280, test_loss: 1.1347, test_f1: 0.4251
 epoch: 30, train_loss: 1.1315, test_loss: 1.1222, test_f1: 0.4361
 epoch: 31, train_loss: 1.1193, test_loss: 1.1147, test_f1: 0.4445
 epoch: 32, train_loss: 1.1127, test_loss: 1.1185, test_f1: 0.4236
 epoch: 33, train_loss: 1.1103, test_loss: 1.1128, test_f1: 0.4237
 epoch: 34, train_loss: 1.0971, test_loss: 1.0901, test_f1: 0.4421
 epoch: 35, train_loss: 1.1010, test_loss: 1.1073, test_f1: 0.4213
 epoch: 36, train_loss: 1.0938, test_loss: 1.1013, test_f1: 0.4210
 epoch: 37, train_loss: 1.0802, test_loss: 1.0839, test_f1: 0.4338
 epoch: 38, train_loss: 1.0781, test_loss: 1.0814, test_f1: 0.4405
 epoch: 39, train_loss: 1.0768, test_loss: 1.0985, test_f1: 0.4229
 epoch: 40, train_loss: 1.0729, test_loss: 1.0850, test_f1: 0.4277
 epoch: 41, train_loss: 1.0712, test_loss: 1.0939, test_f1: 0.4321
 epoch: 42, train_loss: 1.0593, test_loss: 1.0879, test_f1: 0.4256
 epoch: 43, train_loss: 1.0670, test_loss: 1.0766, test_f1: 0.4357
 epoch: 44, train_loss: 1.0515, test_loss: 1.0649, test_f1: 0.4353
 epoch: 45, train_loss: 1.0517, test_loss: 1.0749, test_f1: 0.4306
 epoch: 46, train_loss: 1.0452, test_loss: 1.0967, test_f1: 0.4135
 epoch: 47, train_loss: 1.0337, test_loss: 1.0736, test_f1: 0.4275
 epoch: 48, train_loss: 1.0372, test_loss: 1.0931, test_f1: 0.4291
 epoch: 49, train_loss: 1.0411, test_loss: 1.0972, test_f1: 0.4288
 epoch: 50, train_loss: 1.0235, test_loss: 1.1298, test_f1: 0.4053
 epoch: 51, train_loss: 1.0157, test_loss: 1.1008, test_f1: 0.4225
 epoch: 52, train_loss: 1.0179, test_loss: 1.1110, test_f1: 0.4201
 epoch: 53, train_loss: 1.0109, test_loss: 1.0989, test_f1: 0.4196
 epoch: 54, train_loss: 1.0167, test_loss: 1.1034, test_f1: 0.4252
 epoch: 55, train_loss: 1.0116, test_loss: 1.0922, test_f1: 0.4185
 epoch: 56, train_loss: 1.0133, test_loss: 1.0743, test_f1: 0.4374
 epoch: 57, train_loss: 1.0061, test_loss: 1.0563, test_f1: 0.4332
 epoch: 58, train_loss: 1.0032, test_loss: 1.0610, test_f1: 0.4374
 epoch: 59, train_loss: 1.0026, test_loss: 1.0614, test_f1: 0.4301
 epoch: 60, train_loss: 0.9909, test_loss: 1.0567, test_f1: 0.4288
 epoch: 61, train_loss: 0.9964, test_loss: 1.0652, test_f1: 0.4273
 epoch: 62, train_loss: 0.9976, test_loss: 1.0664, test_f1: 0.4313
 epoch: 63, train_loss: 0.9915, test_loss: 1.1420, test_f1: 0.4247
 epoch: 64, train_loss: 0.9831, test_loss: 1.0732, test_f1: 0.4345
 epoch: 65, train_loss: 0.9928, test_loss: 1.0656, test_f1: 0.4308
 epoch: 66, train_loss: 0.9797, test_loss: 1.0977, test_f1: 0.4343
 epoch: 67, train_loss: 0.9881, test_loss: 1.0819, test_f1: 0.4394
 epoch: 68, train_loss: 0.9802, test_loss: 1.0980, test_f1: 0.4209
 epoch: 69, train_loss: 0.9763, test_loss: 1.1005, test_f1: 0.4135
 epoch: 70, train_loss: 0.9774, test_loss: 1.0735, test_f1: 0.4344
 epoch: 71, train_loss: 0.9860, test_loss: 1.0925, test_f1: 0.4259
 epoch: 72, train_loss: 0.9805, test_loss: 1.1987, test_f1: 0.4288
 epoch: 73, train_loss: 0.9692, test_loss: 1.1451, test_f1: 0.4349
 epoch: 74, train_loss: 0.9750, test_loss: 1.0823, test_f1: 0.4498
 epoch: 75, train_loss: 0.9873, test_loss: 1.0832, test_f1: 0.4367
 epoch: 76, train_loss: 0.9763, test_loss: 1.0888, test_f1: 0.4462
 epoch: 77, train_loss: 0.9672, test_loss: 1.0802, test_f1: 0.4343
 epoch: 78, train_loss: 0.9582, test_loss: 1.0807, test_f1: 0.4486
 epoch: 79, train_loss: 0.9670, test_loss: 1.0886, test_f1: 0.4199
 epoch: 80, train_loss: 0.9692, test_loss: 1.0784, test_f1: 0.4504
 epoch: 81, train_loss: 0.9619, test_loss: 1.1092, test_f1: 0.4235
 epoch: 82, train_loss: 0.9625, test_loss: 1.0743, test_f1: 0.4380
 epoch: 83, train_loss: 0.9749, test_loss: 1.0540, test_f1: 0.4393
 epoch: 84, train_loss: 0.9646, test_loss: 1.0903, test_f1: 0.4291
 epoch: 85, train_loss: 0.9551, test_loss: 1.1522, test_f1: 0.4246
 epoch: 86, train_loss: 0.9602, test_loss: 1.0893, test_f1: 0.4284
 epoch: 87, train_loss: 0.9549, test_loss: 1.0567, test_f1: 0.4587
 epoch: 88, train_loss: 0.9523, test_loss: 1.0753, test_f1: 0.4417
 epoch: 89, train_loss: 0.9505, test_loss: 1.0696, test_f1: 0.4531
 epoch: 90, train_loss: 0.9494, test_loss: 1.0791, test_f1: 0.4294
 epoch: 91, train_loss: 0.9519, test_loss: 1.1000, test_f1: 0.4279
 epoch: 92, train_loss: 0.9625, test_loss: 1.1353, test_f1: 0.4313
 epoch: 93, train_loss: 0.9469, test_loss: 1.0907, test_f1: 0.4293
 epoch: 94, train_loss: 0.9377, test_loss: 1.1076, test_f1: 0.4223
 epoch: 95, train_loss: 0.9383, test_loss: 1.0960, test_f1: 0.4257
 epoch: 96, train_loss: 0.9476, test_loss: 1.0799, test_f1: 0.4347
 epoch: 97, train_loss: 0.9269, test_loss: 1.1069, test_f1: 0.4326
 epoch: 98, train_loss: 0.9347, test_loss: 1.1083, test_f1: 0.4372
 epoch: 99, train_loss: 0.9326, test_loss: 1.1131, test_f1: 0.4143
##################ITERATION #1 ****************************************
 epoch: 0, train_loss: 1.3677, test_loss: 1.3700, test_f1: 0.2310
 epoch: 1, train_loss: 1.2952, test_loss: 1.3161, test_f1: 0.2274
 epoch: 2, train_loss: 1.2707, test_loss: 1.2750, test_f1: 0.2274
 epoch: 3, train_loss: 1.2594, test_loss: 1.2518, test_f1: 0.2274
 epoch: 4, train_loss: 1.2474, test_loss: 1.2381, test_f1: 0.2324
 epoch: 5, train_loss: 1.2344, test_loss: 1.2268, test_f1: 0.2768
 epoch: 6, train_loss: 1.2236, test_loss: 1.2114, test_f1: 0.2924
 epoch: 7, train_loss: 1.2191, test_loss: 1.1972, test_f1: 0.3210
 epoch: 8, train_loss: 1.2094, test_loss: 1.1903, test_f1: 0.3284
 epoch: 9, train_loss: 1.2035, test_loss: 1.1811, test_f1: 0.3389
 epoch: 10, train_loss: 1.1927, test_loss: 1.1678, test_f1: 0.3795
 epoch: 11, train_loss: 1.1900, test_loss: 1.1621, test_f1: 0.3884
 epoch: 12, train_loss: 1.1798, test_loss: 1.1481, test_f1: 0.4026
 epoch: 13, train_loss: 1.1712, test_loss: 1.1404, test_f1: 0.4202
 epoch: 14, train_loss: 1.1699, test_loss: 1.1268, test_f1: 0.4213
 epoch: 15, train_loss: 1.1570, test_loss: 1.1210, test_f1: 0.4166
 epoch: 16, train_loss: 1.1533, test_loss: 1.1100, test_f1: 0.4422
 epoch: 17, train_loss: 1.1423, test_loss: 1.1011, test_f1: 0.4468
 epoch: 18, train_loss: 1.1326, test_loss: 1.0950, test_f1: 0.4407
 epoch: 19, train_loss: 1.1307, test_loss: 1.0920, test_f1: 0.4364
 epoch: 20, train_loss: 1.1200, test_loss: 1.0830, test_f1: 0.4532
 epoch: 21, train_loss: 1.1119, test_loss: 1.0794, test_f1: 0.4381
 epoch: 22, train_loss: 1.1059, test_loss: 1.0626, test_f1: 0.4505
 epoch: 23, train_loss: 1.0939, test_loss: 1.0598, test_f1: 0.4496
 epoch: 24, train_loss: 1.0920, test_loss: 1.0675, test_f1: 0.4491
 epoch: 25, train_loss: 1.0885, test_loss: 1.0559, test_f1: 0.4406
 epoch: 26, train_loss: 1.0871, test_loss: 1.0402, test_f1: 0.4535
 epoch: 27, train_loss: 1.0766, test_loss: 1.0531, test_f1: 0.4421
 epoch: 28, train_loss: 1.0671, test_loss: 1.0416, test_f1: 0.4601
 epoch: 29, train_loss: 1.0599, test_loss: 1.0465, test_f1: 0.4472
 epoch: 30, train_loss: 1.0551, test_loss: 1.0440, test_f1: 0.4865
 epoch: 31, train_loss: 1.0595, test_loss: 1.0463, test_f1: 0.4277
 epoch: 32, train_loss: 1.0539, test_loss: 1.0336, test_f1: 0.4608
 epoch: 33, train_loss: 1.0535, test_loss: 1.0480, test_f1: 0.4477
 epoch: 34, train_loss: 1.0449, test_loss: 1.0392, test_f1: 0.4804
 epoch: 35, train_loss: 1.0328, test_loss: 1.0486, test_f1: 0.4499
 epoch: 36, train_loss: 1.0309, test_loss: 1.0324, test_f1: 0.4744
 epoch: 37, train_loss: 1.0267, test_loss: 1.0528, test_f1: 0.4551
 epoch: 38, train_loss: 1.0351, test_loss: 1.0417, test_f1: 0.4533
 epoch: 39, train_loss: 1.0141, test_loss: 1.0311, test_f1: 0.4761
 epoch: 40, train_loss: 1.0224, test_loss: 1.0173, test_f1: 0.4686
 epoch: 41, train_loss: 1.0048, test_loss: 1.0353, test_f1: 0.4732
 epoch: 42, train_loss: 0.9984, test_loss: 1.0402, test_f1: 0.4658
 epoch: 43, train_loss: 1.0055, test_loss: 1.0308, test_f1: 0.4733
 epoch: 44, train_loss: 0.9935, test_loss: 1.0366, test_f1: 0.4586
 epoch: 45, train_loss: 0.9820, test_loss: 1.0693, test_f1: 0.4539
 epoch: 46, train_loss: 0.9889, test_loss: 1.0076, test_f1: 0.4569
 epoch: 47, train_loss: 0.9894, test_loss: 1.0484, test_f1: 0.4569
 epoch: 48, train_loss: 0.9898, test_loss: 1.0563, test_f1: 0.4279
 epoch: 49, train_loss: 0.9857, test_loss: 1.0325, test_f1: 0.4615
 epoch: 50, train_loss: 0.9815, test_loss: 1.0252, test_f1: 0.4755
 epoch: 51, train_loss: 0.9728, test_loss: 1.0436, test_f1: 0.4571
 epoch: 52, train_loss: 0.9532, test_loss: 1.0546, test_f1: 0.4674
 epoch: 53, train_loss: 0.9613, test_loss: 1.0359, test_f1: 0.4673
 epoch: 54, train_loss: 0.9616, test_loss: 1.0347, test_f1: 0.4793
 epoch: 55, train_loss: 0.9591, test_loss: 1.0179, test_f1: 0.4747
 epoch: 56, train_loss: 0.9511, test_loss: 1.0386, test_f1: 0.4717
 epoch: 57, train_loss: 0.9506, test_loss: 1.0799, test_f1: 0.4668
 epoch: 58, train_loss: 0.9451, test_loss: 1.0473, test_f1: 0.4721
 epoch: 59, train_loss: 0.9514, test_loss: 1.0175, test_f1: 0.4742
 epoch: 60, train_loss: 0.9507, test_loss: 1.0513, test_f1: 0.4688
 epoch: 61, train_loss: 0.9355, test_loss: 1.0347, test_f1: 0.4646
 epoch: 62, train_loss: 0.9426, test_loss: 1.0241, test_f1: 0.4520
 epoch: 63, train_loss: 0.9372, test_loss: 1.0334, test_f1: 0.4745
 epoch: 64, train_loss: 0.9454, test_loss: 1.0637, test_f1: 0.4663
 epoch: 65, train_loss: 0.9447, test_loss: 1.0483, test_f1: 0.4633
 epoch: 66, train_loss: 0.9365, test_loss: 1.0239, test_f1: 0.4762
 epoch: 67, train_loss: 0.9418, test_loss: 1.0758, test_f1: 0.4616
 epoch: 68, train_loss: 0.9306, test_loss: 1.0288, test_f1: 0.4644
 epoch: 69, train_loss: 0.9356, test_loss: 1.0684, test_f1: 0.4648
 epoch: 70, train_loss: 0.9290, test_loss: 1.0480, test_f1: 0.4715
 epoch: 71, train_loss: 0.9217, test_loss: 1.0363, test_f1: 0.4678
 epoch: 72, train_loss: 0.9307, test_loss: 1.0474, test_f1: 0.4687
 epoch: 73, train_loss: 0.9243, test_loss: 1.0583, test_f1: 0.4686
 epoch: 74, train_loss: 0.9294, test_loss: 1.0223, test_f1: 0.4853
 epoch: 75, train_loss: 0.9217, test_loss: 1.0753, test_f1: 0.4601
 epoch: 76, train_loss: 0.9231, test_loss: 1.0005, test_f1: 0.4858
 epoch: 77, train_loss: 0.9164, test_loss: 1.0253, test_f1: 0.4639
 epoch: 78, train_loss: 0.9167, test_loss: 1.0269, test_f1: 0.4781
 epoch: 79, train_loss: 0.9132, test_loss: 1.0171, test_f1: 0.4719
 epoch: 80, train_loss: 0.9253, test_loss: 0.9932, test_f1: 0.4879
 epoch: 81, train_loss: 0.9041, test_loss: 1.0639, test_f1: 0.4687
 epoch: 82, train_loss: 0.9202, test_loss: 1.0547, test_f1: 0.4733
 epoch: 83, train_loss: 0.9148, test_loss: 1.0412, test_f1: 0.4779
 epoch: 84, train_loss: 0.9177, test_loss: 1.0510, test_f1: 0.4725
 epoch: 85, train_loss: 0.9120, test_loss: 1.0360, test_f1: 0.4740
 epoch: 86, train_loss: 0.9148, test_loss: 1.0585, test_f1: 0.4726
 epoch: 87, train_loss: 0.9044, test_loss: 0.9974, test_f1: 0.4784
 epoch: 88, train_loss: 0.9087, test_loss: 1.0252, test_f1: 0.4702
 epoch: 89, train_loss: 0.8979, test_loss: 0.9952, test_f1: 0.4871
 epoch: 90, train_loss: 0.9087, test_loss: 0.9977, test_f1: 0.4960
 epoch: 91, train_loss: 0.9046, test_loss: 1.0201, test_f1: 0.4829
 epoch: 92, train_loss: 0.9003, test_loss: 0.9967, test_f1: 0.4875
 epoch: 93, train_loss: 0.8936, test_loss: 1.0323, test_f1: 0.4815
 epoch: 94, train_loss: 0.8958, test_loss: 1.0323, test_f1: 0.4786
 epoch: 95, train_loss: 0.8894, test_loss: 1.0403, test_f1: 0.4784
 epoch: 96, train_loss: 0.8986, test_loss: 1.0329, test_f1: 0.4698
 epoch: 97, train_loss: 0.8919, test_loss: 1.0128, test_f1: 0.4844
 epoch: 98, train_loss: 0.8956, test_loss: 1.0326, test_f1: 0.4763
 epoch: 99, train_loss: 0.8853, test_loss: 1.0276, test_f1: 0.4822
##################ITERATION #2 ****************************************
 epoch: 0, train_loss: 1.3534, test_loss: 1.3477, test_f1: 0.2274
 epoch: 1, train_loss: 1.2966, test_loss: 1.3180, test_f1: 0.2274
 epoch: 2, train_loss: 1.2667, test_loss: 1.2802, test_f1: 0.2274
 epoch: 3, train_loss: 1.2510, test_loss: 1.2377, test_f1: 0.2274
 epoch: 4, train_loss: 1.2390, test_loss: 1.2094, test_f1: 0.2269
 epoch: 5, train_loss: 1.2244, test_loss: 1.1966, test_f1: 0.2424
 epoch: 6, train_loss: 1.2193, test_loss: 1.1832, test_f1: 0.2660
 epoch: 7, train_loss: 1.2062, test_loss: 1.1760, test_f1: 0.3331
 epoch: 8, train_loss: 1.2007, test_loss: 1.1616, test_f1: 0.3527
 epoch: 9, train_loss: 1.1942, test_loss: 1.1471, test_f1: 0.3872
 epoch: 10, train_loss: 1.1872, test_loss: 1.1520, test_f1: 0.3443
 epoch: 11, train_loss: 1.1804, test_loss: 1.1525, test_f1: 0.3773
 epoch: 12, train_loss: 1.1716, test_loss: 1.1370, test_f1: 0.3959
 epoch: 13, train_loss: 1.1636, test_loss: 1.1290, test_f1: 0.4088
 epoch: 14, train_loss: 1.1538, test_loss: 1.1214, test_f1: 0.4089
 epoch: 15, train_loss: 1.1548, test_loss: 1.1199, test_f1: 0.4036
 epoch: 16, train_loss: 1.1514, test_loss: 1.1088, test_f1: 0.4103
 epoch: 17, train_loss: 1.1499, test_loss: 1.0931, test_f1: 0.4075
 epoch: 18, train_loss: 1.1362, test_loss: 1.1029, test_f1: 0.4217
 epoch: 19, train_loss: 1.1308, test_loss: 1.0918, test_f1: 0.4273
 epoch: 20, train_loss: 1.1268, test_loss: 1.0905, test_f1: 0.4329
 epoch: 21, train_loss: 1.1250, test_loss: 1.0980, test_f1: 0.4122
 epoch: 22, train_loss: 1.1097, test_loss: 1.0872, test_f1: 0.4184
 epoch: 23, train_loss: 1.1105, test_loss: 1.0893, test_f1: 0.4092
 epoch: 24, train_loss: 1.1136, test_loss: 1.0906, test_f1: 0.4293
 epoch: 25, train_loss: 1.1115, test_loss: 1.0671, test_f1: 0.4272
 epoch: 26, train_loss: 1.0897, test_loss: 1.0832, test_f1: 0.4359
 epoch: 27, train_loss: 1.0933, test_loss: 1.0642, test_f1: 0.4246
 epoch: 28, train_loss: 1.0881, test_loss: 1.0650, test_f1: 0.4416
 epoch: 29, train_loss: 1.0865, test_loss: 1.0596, test_f1: 0.4434
 epoch: 30, train_loss: 1.0718, test_loss: 1.0533, test_f1: 0.4428
 epoch: 31, train_loss: 1.0725, test_loss: 1.0534, test_f1: 0.4346
 epoch: 32, train_loss: 1.0767, test_loss: 1.0641, test_f1: 0.4331
 epoch: 33, train_loss: 1.0746, test_loss: 1.0527, test_f1: 0.4380
 epoch: 34, train_loss: 1.0659, test_loss: 1.0564, test_f1: 0.4408
 epoch: 35, train_loss: 1.0650, test_loss: 1.0467, test_f1: 0.4519
 epoch: 36, train_loss: 1.0621, test_loss: 1.0450, test_f1: 0.4468
 epoch: 37, train_loss: 1.0479, test_loss: 1.0459, test_f1: 0.4463
 epoch: 38, train_loss: 1.0595, test_loss: 1.0291, test_f1: 0.4497
 epoch: 39, train_loss: 1.0509, test_loss: 1.0445, test_f1: 0.4604
 epoch: 40, train_loss: 1.0407, test_loss: 1.0440, test_f1: 0.4493
 epoch: 41, train_loss: 1.0391, test_loss: 1.0459, test_f1: 0.4610
 epoch: 42, train_loss: 1.0263, test_loss: 1.0145, test_f1: 0.4649
 epoch: 43, train_loss: 1.0384, test_loss: 1.0666, test_f1: 0.4337
 epoch: 44, train_loss: 1.0329, test_loss: 1.0238, test_f1: 0.4564
 epoch: 45, train_loss: 1.0177, test_loss: 1.0169, test_f1: 0.4688
 epoch: 46, train_loss: 1.0162, test_loss: 1.0341, test_f1: 0.4568
 epoch: 47, train_loss: 1.0225, test_loss: 1.0392, test_f1: 0.4673
 epoch: 48, train_loss: 1.0158, test_loss: 1.0368, test_f1: 0.4582
 epoch: 49, train_loss: 1.0056, test_loss: 1.0334, test_f1: 0.4632
 epoch: 50, train_loss: 1.0032, test_loss: 1.0275, test_f1: 0.4618
 epoch: 51, train_loss: 0.9981, test_loss: 1.0224, test_f1: 0.4683
 epoch: 52, train_loss: 1.0009, test_loss: 1.0208, test_f1: 0.4742
 epoch: 53, train_loss: 0.9899, test_loss: 1.0359, test_f1: 0.4510
 epoch: 54, train_loss: 0.9850, test_loss: 1.0354, test_f1: 0.4589
 epoch: 55, train_loss: 0.9896, test_loss: 1.0171, test_f1: 0.4593
 epoch: 56, train_loss: 0.9903, test_loss: 1.0266, test_f1: 0.4695
 epoch: 57, train_loss: 0.9790, test_loss: 1.0535, test_f1: 0.4622
 epoch: 58, train_loss: 0.9798, test_loss: 1.0689, test_f1: 0.4530
 epoch: 59, train_loss: 0.9794, test_loss: 1.0585, test_f1: 0.4654
 epoch: 60, train_loss: 0.9754, test_loss: 1.0513, test_f1: 0.4579
 epoch: 61, train_loss: 0.9710, test_loss: 1.0494, test_f1: 0.4632
 epoch: 62, train_loss: 0.9722, test_loss: 1.0655, test_f1: 0.4558
 epoch: 63, train_loss: 0.9703, test_loss: 1.0309, test_f1: 0.4553
 epoch: 64, train_loss: 0.9634, test_loss: 1.0036, test_f1: 0.4641
 epoch: 65, train_loss: 0.9629, test_loss: 1.0120, test_f1: 0.4707
 epoch: 66, train_loss: 0.9753, test_loss: 1.0180, test_f1: 0.4650
 epoch: 67, train_loss: 0.9629, test_loss: 1.0428, test_f1: 0.4700
 epoch: 68, train_loss: 0.9563, test_loss: 1.0317, test_f1: 0.4662
 epoch: 69, train_loss: 0.9489, test_loss: 1.0595, test_f1: 0.4564
 epoch: 70, train_loss: 0.9555, test_loss: 1.0363, test_f1: 0.4663
 epoch: 71, train_loss: 0.9506, test_loss: 1.0268, test_f1: 0.4705
 epoch: 72, train_loss: 0.9469, test_loss: 1.0533, test_f1: 0.4407
 epoch: 73, train_loss: 0.9486, test_loss: 1.0295, test_f1: 0.4676
 epoch: 74, train_loss: 0.9528, test_loss: 1.0388, test_f1: 0.4636
 epoch: 75, train_loss: 0.9412, test_loss: 1.0523, test_f1: 0.4629
 epoch: 76, train_loss: 0.9450, test_loss: 1.0272, test_f1: 0.4656
 epoch: 77, train_loss: 0.9427, test_loss: 1.0256, test_f1: 0.4775
 epoch: 78, train_loss: 0.9367, test_loss: 1.0239, test_f1: 0.4760
 epoch: 79, train_loss: 0.9404, test_loss: 1.0355, test_f1: 0.4717
 epoch: 80, train_loss: 0.9366, test_loss: 1.0392, test_f1: 0.4720
 epoch: 81, train_loss: 0.9347, test_loss: 1.0245, test_f1: 0.4680
 epoch: 82, train_loss: 0.9409, test_loss: 1.0267, test_f1: 0.4817
 epoch: 83, train_loss: 0.9289, test_loss: 1.0193, test_f1: 0.4727
 epoch: 84, train_loss: 0.9330, test_loss: 1.0500, test_f1: 0.4558
 epoch: 85, train_loss: 0.9439, test_loss: 1.0513, test_f1: 0.4702
 epoch: 86, train_loss: 0.9314, test_loss: 1.0416, test_f1: 0.4642
 epoch: 87, train_loss: 0.9264, test_loss: 1.0410, test_f1: 0.4540
 epoch: 88, train_loss: 0.9421, test_loss: 1.0414, test_f1: 0.4701
 epoch: 89, train_loss: 0.9315, test_loss: 1.0257, test_f1: 0.4702
 epoch: 90, train_loss: 0.9314, test_loss: 1.0235, test_f1: 0.4811
 epoch: 91, train_loss: 0.9251, test_loss: 1.0692, test_f1: 0.4648
 epoch: 92, train_loss: 0.9259, test_loss: 1.0652, test_f1: 0.4614
 epoch: 93, train_loss: 0.9200, test_loss: 1.0399, test_f1: 0.4736
 epoch: 94, train_loss: 0.9156, test_loss: 1.0447, test_f1: 0.4819
 epoch: 95, train_loss: 0.9047, test_loss: 1.0702, test_f1: 0.4596
 epoch: 96, train_loss: 0.9232, test_loss: 1.0543, test_f1: 0.4675
 epoch: 97, train_loss: 0.9064, test_loss: 1.0511, test_f1: 0.4815
 epoch: 98, train_loss: 0.9200, test_loss: 1.0597, test_f1: 0.4582
 epoch: 99, train_loss: 0.9078, test_loss: 1.0592, test_f1: 0.4748
##################ITERATION #3 ****************************************
 epoch: 0, train_loss: 1.3190, test_loss: 1.3012, test_f1: 0.2274
 epoch: 1, train_loss: 1.2691, test_loss: 1.2699, test_f1: 0.2274
 epoch: 2, train_loss: 1.2564, test_loss: 1.2460, test_f1: 0.2274
 epoch: 3, train_loss: 1.2431, test_loss: 1.2268, test_f1: 0.2369
 epoch: 4, train_loss: 1.2308, test_loss: 1.2140, test_f1: 0.2584
 epoch: 5, train_loss: 1.2283, test_loss: 1.2070, test_f1: 0.2756
 epoch: 6, train_loss: 1.2184, test_loss: 1.1986, test_f1: 0.3221
 epoch: 7, train_loss: 1.2192, test_loss: 1.1931, test_f1: 0.3233
 epoch: 8, train_loss: 1.2129, test_loss: 1.1816, test_f1: 0.3162
 epoch: 9, train_loss: 1.2033, test_loss: 1.1847, test_f1: 0.3300
 epoch: 10, train_loss: 1.1949, test_loss: 1.1759, test_f1: 0.3440
 epoch: 11, train_loss: 1.1924, test_loss: 1.1702, test_f1: 0.3800
 epoch: 12, train_loss: 1.1921, test_loss: 1.1576, test_f1: 0.3983
 epoch: 13, train_loss: 1.1876, test_loss: 1.1548, test_f1: 0.3952
 epoch: 14, train_loss: 1.1805, test_loss: 1.1521, test_f1: 0.4033
 epoch: 15, train_loss: 1.1766, test_loss: 1.1471, test_f1: 0.4263
 epoch: 16, train_loss: 1.1591, test_loss: 1.1328, test_f1: 0.4334
 epoch: 17, train_loss: 1.1588, test_loss: 1.1269, test_f1: 0.4299
 epoch: 18, train_loss: 1.1511, test_loss: 1.1237, test_f1: 0.4349
 epoch: 19, train_loss: 1.1536, test_loss: 1.1162, test_f1: 0.4385
 epoch: 20, train_loss: 1.1436, test_loss: 1.1030, test_f1: 0.4464
 epoch: 21, train_loss: 1.1392, test_loss: 1.1080, test_f1: 0.4596
 epoch: 22, train_loss: 1.1303, test_loss: 1.1076, test_f1: 0.4815
 epoch: 23, train_loss: 1.1248, test_loss: 1.0870, test_f1: 0.4697
 epoch: 24, train_loss: 1.1209, test_loss: 1.0727, test_f1: 0.4342
 epoch: 25, train_loss: 1.1091, test_loss: 1.0827, test_f1: 0.4634
 epoch: 26, train_loss: 1.1052, test_loss: 1.0642, test_f1: 0.4683
 epoch: 27, train_loss: 1.0996, test_loss: 1.0772, test_f1: 0.4576
 epoch: 28, train_loss: 1.0968, test_loss: 1.0545, test_f1: 0.4730
 epoch: 29, train_loss: 1.0864, test_loss: 1.0634, test_f1: 0.4741
 epoch: 30, train_loss: 1.0860, test_loss: 1.0559, test_f1: 0.4628
 epoch: 31, train_loss: 1.0831, test_loss: 1.0597, test_f1: 0.4655
 epoch: 32, train_loss: 1.0749, test_loss: 1.0697, test_f1: 0.4729
 epoch: 33, train_loss: 1.0728, test_loss: 1.0571, test_f1: 0.4749
 epoch: 34, train_loss: 1.0734, test_loss: 1.0379, test_f1: 0.4633
 epoch: 35, train_loss: 1.0748, test_loss: 1.0601, test_f1: 0.4773
 epoch: 36, train_loss: 1.0628, test_loss: 1.0356, test_f1: 0.4725
 epoch: 37, train_loss: 1.0561, test_loss: 1.0415, test_f1: 0.4684
 epoch: 38, train_loss: 1.0461, test_loss: 1.0346, test_f1: 0.4745
 epoch: 39, train_loss: 1.0456, test_loss: 1.0263, test_f1: 0.4670
 epoch: 40, train_loss: 1.0507, test_loss: 1.0452, test_f1: 0.4748
 epoch: 41, train_loss: 1.0421, test_loss: 1.0464, test_f1: 0.4697
 epoch: 42, train_loss: 1.0417, test_loss: 1.0335, test_f1: 0.4835
 epoch: 43, train_loss: 1.0263, test_loss: 1.0571, test_f1: 0.4616
 epoch: 44, train_loss: 1.0395, test_loss: 1.0339, test_f1: 0.4665
 epoch: 45, train_loss: 1.0367, test_loss: 1.0463, test_f1: 0.4678
 epoch: 46, train_loss: 1.0289, test_loss: 1.0176, test_f1: 0.4809
 epoch: 47, train_loss: 1.0250, test_loss: 1.0456, test_f1: 0.4674
 epoch: 48, train_loss: 1.0187, test_loss: 1.0238, test_f1: 0.4574
 epoch: 49, train_loss: 1.0222, test_loss: 1.0225, test_f1: 0.4719
 epoch: 50, train_loss: 1.0257, test_loss: 1.0223, test_f1: 0.4794
 epoch: 51, train_loss: 1.0133, test_loss: 1.0425, test_f1: 0.4597
 epoch: 52, train_loss: 0.9990, test_loss: 1.0479, test_f1: 0.4641
 epoch: 53, train_loss: 1.0102, test_loss: 1.0293, test_f1: 0.4583
 epoch: 54, train_loss: 1.0144, test_loss: 1.0336, test_f1: 0.4504
 epoch: 55, train_loss: 1.0069, test_loss: 1.0400, test_f1: 0.4587
 epoch: 56, train_loss: 1.0157, test_loss: 1.0416, test_f1: 0.4628
 epoch: 57, train_loss: 0.9885, test_loss: 1.0235, test_f1: 0.4709
 epoch: 58, train_loss: 1.0051, test_loss: 1.0431, test_f1: 0.4670
 epoch: 59, train_loss: 0.9966, test_loss: 1.0235, test_f1: 0.4729
 epoch: 60, train_loss: 0.9879, test_loss: 1.0371, test_f1: 0.4638
 epoch: 61, train_loss: 0.9902, test_loss: 1.0254, test_f1: 0.4738
 epoch: 62, train_loss: 0.9936, test_loss: 1.0431, test_f1: 0.4533
 epoch: 63, train_loss: 0.9977, test_loss: 1.0379, test_f1: 0.4580
 epoch: 64, train_loss: 0.9857, test_loss: 1.0199, test_f1: 0.4870
 epoch: 65, train_loss: 0.9918, test_loss: 1.0383, test_f1: 0.4726
 epoch: 66, train_loss: 0.9952, test_loss: 1.0257, test_f1: 0.4837
 epoch: 67, train_loss: 0.9823, test_loss: 1.0195, test_f1: 0.4815
 epoch: 68, train_loss: 0.9812, test_loss: 1.0271, test_f1: 0.4737
 epoch: 69, train_loss: 0.9757, test_loss: 1.0274, test_f1: 0.4745
 epoch: 70, train_loss: 0.9877, test_loss: 1.0320, test_f1: 0.4798
 epoch: 71, train_loss: 0.9738, test_loss: 1.0182, test_f1: 0.4924
 epoch: 72, train_loss: 0.9802, test_loss: 1.0193, test_f1: 0.4661
 epoch: 73, train_loss: 0.9690, test_loss: 1.0264, test_f1: 0.4893
 epoch: 74, train_loss: 0.9855, test_loss: 1.0143, test_f1: 0.4922
 epoch: 75, train_loss: 0.9582, test_loss: 1.0351, test_f1: 0.4649
 epoch: 76, train_loss: 0.9726, test_loss: 1.0218, test_f1: 0.4764
 epoch: 77, train_loss: 0.9785, test_loss: 1.0152, test_f1: 0.4670
 epoch: 78, train_loss: 0.9814, test_loss: 1.0219, test_f1: 0.4787
 epoch: 79, train_loss: 0.9790, test_loss: 1.0234, test_f1: 0.4821
 epoch: 80, train_loss: 0.9668, test_loss: 1.0234, test_f1: 0.4721
 epoch: 81, train_loss: 0.9743, test_loss: 1.0200, test_f1: 0.4691
 epoch: 82, train_loss: 0.9622, test_loss: 1.0266, test_f1: 0.4649
 epoch: 83, train_loss: 0.9628, test_loss: 1.0342, test_f1: 0.4683
 epoch: 84, train_loss: 0.9743, test_loss: 1.0357, test_f1: 0.4549
 epoch: 85, train_loss: 0.9810, test_loss: 1.0323, test_f1: 0.4583
 epoch: 86, train_loss: 0.9683, test_loss: 1.0332, test_f1: 0.4632
 epoch: 87, train_loss: 0.9744, test_loss: 1.0304, test_f1: 0.4662
 epoch: 88, train_loss: 0.9716, test_loss: 1.0344, test_f1: 0.4581
 epoch: 89, train_loss: 0.9627, test_loss: 1.0358, test_f1: 0.4589
 epoch: 90, train_loss: 0.9647, test_loss: 1.0198, test_f1: 0.4619
 epoch: 91, train_loss: 0.9571, test_loss: 1.0179, test_f1: 0.4750
 epoch: 92, train_loss: 0.9548, test_loss: 1.0379, test_f1: 0.4496
 epoch: 93, train_loss: 0.9552, test_loss: 1.0828, test_f1: 0.4473
 epoch: 94, train_loss: 0.9675, test_loss: 1.0282, test_f1: 0.4614
 epoch: 95, train_loss: 0.9534, test_loss: 1.0308, test_f1: 0.4604
 epoch: 96, train_loss: 0.9692, test_loss: 1.0316, test_f1: 0.4586
 epoch: 97, train_loss: 0.9449, test_loss: 1.0487, test_f1: 0.4629
 epoch: 98, train_loss: 0.9548, test_loss: 1.0405, test_f1: 0.4588
 epoch: 99, train_loss: 0.9456, test_loss: 1.0320, test_f1: 0.4618
##################ITERATION #4 ****************************************
 epoch: 0, train_loss: 1.4035, test_loss: 1.3089, test_f1: 0.2274
 epoch: 1, train_loss: 1.2975, test_loss: 1.2839, test_f1: 0.2274
 epoch: 2, train_loss: 1.2685, test_loss: 1.2620, test_f1: 0.2460
 epoch: 3, train_loss: 1.2476, test_loss: 1.2373, test_f1: 0.3081
 epoch: 4, train_loss: 1.2384, test_loss: 1.2182, test_f1: 0.3306
 epoch: 5, train_loss: 1.2197, test_loss: 1.2013, test_f1: 0.3627
 epoch: 6, train_loss: 1.2215, test_loss: 1.1866, test_f1: 0.3427
 epoch: 7, train_loss: 1.2099, test_loss: 1.1755, test_f1: 0.3706
 epoch: 8, train_loss: 1.1992, test_loss: 1.1725, test_f1: 0.3812
 epoch: 9, train_loss: 1.1932, test_loss: 1.1649, test_f1: 0.3637
 epoch: 10, train_loss: 1.1951, test_loss: 1.1513, test_f1: 0.3780
 epoch: 11, train_loss: 1.1894, test_loss: 1.1413, test_f1: 0.3959
 epoch: 12, train_loss: 1.1628, test_loss: 1.1223, test_f1: 0.4282
 epoch: 13, train_loss: 1.1519, test_loss: 1.1200, test_f1: 0.4175
 epoch: 14, train_loss: 1.1545, test_loss: 1.0905, test_f1: 0.4268
 epoch: 15, train_loss: 1.1507, test_loss: 1.0781, test_f1: 0.4298
 epoch: 16, train_loss: 1.1400, test_loss: 1.0764, test_f1: 0.4324
 epoch: 17, train_loss: 1.1301, test_loss: 1.0697, test_f1: 0.4387
 epoch: 18, train_loss: 1.1303, test_loss: 1.0664, test_f1: 0.4526
 epoch: 19, train_loss: 1.1270, test_loss: 1.0550, test_f1: 0.4343
 epoch: 20, train_loss: 1.1218, test_loss: 1.0496, test_f1: 0.4479
 epoch: 21, train_loss: 1.1155, test_loss: 1.0605, test_f1: 0.4453
 epoch: 22, train_loss: 1.1094, test_loss: 1.0438, test_f1: 0.4635
 epoch: 23, train_loss: 1.1041, test_loss: 1.0240, test_f1: 0.4502
 epoch: 24, train_loss: 1.0952, test_loss: 1.0220, test_f1: 0.4539
 epoch: 25, train_loss: 1.1005, test_loss: 1.0159, test_f1: 0.4514
 epoch: 26, train_loss: 1.0897, test_loss: 1.0235, test_f1: 0.4638
 epoch: 27, train_loss: 1.0806, test_loss: 1.0212, test_f1: 0.4750
 epoch: 28, train_loss: 1.0692, test_loss: 0.9975, test_f1: 0.4761
 epoch: 29, train_loss: 1.0751, test_loss: 1.0173, test_f1: 0.4610
 epoch: 30, train_loss: 1.0726, test_loss: 0.9889, test_f1: 0.4746
 epoch: 31, train_loss: 1.0602, test_loss: 1.0005, test_f1: 0.4721
 epoch: 32, train_loss: 1.0650, test_loss: 0.9934, test_f1: 0.4732
 epoch: 33, train_loss: 1.0651, test_loss: 0.9882, test_f1: 0.4755
 epoch: 34, train_loss: 1.0560, test_loss: 0.9793, test_f1: 0.4681
 epoch: 35, train_loss: 1.0501, test_loss: 0.9731, test_f1: 0.4757
 epoch: 36, train_loss: 1.0430, test_loss: 0.9830, test_f1: 0.4785
 epoch: 37, train_loss: 1.0378, test_loss: 0.9689, test_f1: 0.4883
 epoch: 38, train_loss: 1.0370, test_loss: 0.9717, test_f1: 0.4736
 epoch: 39, train_loss: 1.0346, test_loss: 0.9591, test_f1: 0.4781
 epoch: 40, train_loss: 1.0230, test_loss: 0.9551, test_f1: 0.4797
 epoch: 41, train_loss: 1.0326, test_loss: 0.9611, test_f1: 0.4709
 epoch: 42, train_loss: 1.0242, test_loss: 0.9567, test_f1: 0.4833
 epoch: 43, train_loss: 1.0138, test_loss: 0.9682, test_f1: 0.4658
 epoch: 44, train_loss: 1.0080, test_loss: 0.9496, test_f1: 0.4866
 epoch: 45, train_loss: 1.0196, test_loss: 0.9451, test_f1: 0.4803
 epoch: 46, train_loss: 1.0066, test_loss: 0.9560, test_f1: 0.4865
 epoch: 47, train_loss: 0.9978, test_loss: 0.9219, test_f1: 0.5007
 epoch: 48, train_loss: 1.0093, test_loss: 0.9217, test_f1: 0.4928
 epoch: 49, train_loss: 0.9913, test_loss: 0.9633, test_f1: 0.4916
 epoch: 50, train_loss: 0.9949, test_loss: 0.9405, test_f1: 0.4942
 epoch: 51, train_loss: 0.9931, test_loss: 0.9481, test_f1: 0.4880
 epoch: 52, train_loss: 0.9841, test_loss: 0.9290, test_f1: 0.5009
 epoch: 53, train_loss: 0.9861, test_loss: 0.9341, test_f1: 0.5071
 epoch: 54, train_loss: 0.9797, test_loss: 0.9287, test_f1: 0.4892
 epoch: 55, train_loss: 0.9806, test_loss: 0.9284, test_f1: 0.4873
 epoch: 56, train_loss: 0.9869, test_loss: 0.9293, test_f1: 0.4903
 epoch: 57, train_loss: 0.9756, test_loss: 0.9242, test_f1: 0.4903
 epoch: 58, train_loss: 0.9734, test_loss: 0.9314, test_f1: 0.4934
 epoch: 59, train_loss: 0.9752, test_loss: 0.9222, test_f1: 0.5067
 epoch: 60, train_loss: 0.9727, test_loss: 0.9273, test_f1: 0.4978
 epoch: 61, train_loss: 0.9722, test_loss: 0.9219, test_f1: 0.4885
 epoch: 62, train_loss: 0.9773, test_loss: 0.9182, test_f1: 0.4865
 epoch: 63, train_loss: 0.9693, test_loss: 0.9335, test_f1: 0.4891
 epoch: 64, train_loss: 0.9695, test_loss: 0.9243, test_f1: 0.4915
 epoch: 65, train_loss: 0.9609, test_loss: 0.9303, test_f1: 0.4813
 epoch: 66, train_loss: 0.9671, test_loss: 0.9245, test_f1: 0.4786
 epoch: 67, train_loss: 0.9709, test_loss: 0.9265, test_f1: 0.4842
 epoch: 68, train_loss: 0.9614, test_loss: 0.9254, test_f1: 0.4761
 epoch: 69, train_loss: 0.9564, test_loss: 0.9253, test_f1: 0.4912
 epoch: 70, train_loss: 0.9546, test_loss: 0.9319, test_f1: 0.4829
 epoch: 71, train_loss: 0.9656, test_loss: 0.9253, test_f1: 0.4786
 epoch: 72, train_loss: 0.9494, test_loss: 0.9279, test_f1: 0.4855
 epoch: 73, train_loss: 0.9473, test_loss: 0.9270, test_f1: 0.4854
 epoch: 74, train_loss: 0.9578, test_loss: 0.9183, test_f1: 0.4829
 epoch: 75, train_loss: 0.9547, test_loss: 0.9213, test_f1: 0.4830
 epoch: 76, train_loss: 0.9570, test_loss: 0.9265, test_f1: 0.4806
 epoch: 77, train_loss: 0.9518, test_loss: 0.9168, test_f1: 0.4834
 epoch: 78, train_loss: 0.9460, test_loss: 0.9233, test_f1: 0.4897
 epoch: 79, train_loss: 0.9508, test_loss: 0.9130, test_f1: 0.4802
 epoch: 80, train_loss: 0.9520, test_loss: 0.9240, test_f1: 0.4925
 epoch: 81, train_loss: 0.9415, test_loss: 0.9290, test_f1: 0.4924
 epoch: 82, train_loss: 0.9314, test_loss: 0.9256, test_f1: 0.4831
 epoch: 83, train_loss: 0.9364, test_loss: 0.9276, test_f1: 0.4777
 epoch: 84, train_loss: 0.9375, test_loss: 0.9302, test_f1: 0.4839
 epoch: 85, train_loss: 0.9450, test_loss: 0.9253, test_f1: 0.4829
 epoch: 86, train_loss: 0.9405, test_loss: 0.9421, test_f1: 0.4889
 epoch: 87, train_loss: 0.9313, test_loss: 0.9355, test_f1: 0.4778
 epoch: 88, train_loss: 0.9371, test_loss: 0.9379, test_f1: 0.4908
 epoch: 89, train_loss: 0.9326, test_loss: 0.9246, test_f1: 0.4990
 epoch: 90, train_loss: 0.9370, test_loss: 0.9314, test_f1: 0.4855
 epoch: 91, train_loss: 0.9397, test_loss: 0.9260, test_f1: 0.4895
 epoch: 92, train_loss: 0.9264, test_loss: 0.9334, test_f1: 0.4861
 epoch: 93, train_loss: 0.9292, test_loss: 0.9380, test_f1: 0.4975
 epoch: 94, train_loss: 0.9267, test_loss: 0.9283, test_f1: 0.4830
 epoch: 95, train_loss: 0.9421, test_loss: 0.9319, test_f1: 0.4981
 epoch: 96, train_loss: 0.9311, test_loss: 0.9405, test_f1: 0.4865
 epoch: 97, train_loss: 0.9136, test_loss: 0.9396, test_f1: 0.4844
 epoch: 98, train_loss: 0.9292, test_loss: 0.9307, test_f1: 0.4915
 epoch: 99, train_loss: 0.9334, test_loss: 0.9315, test_f1: 0.4859
##################ITERATION #5 ****************************************
 epoch: 0, train_loss: 1.5504, test_loss: 1.3665, test_f1: 0.2691
 epoch: 1, train_loss: 1.3504, test_loss: 1.2941, test_f1: 0.2545
 epoch: 2, train_loss: 1.3089, test_loss: 1.2634, test_f1: 0.2545
 epoch: 3, train_loss: 1.2748, test_loss: 1.2485, test_f1: 0.2991
 epoch: 4, train_loss: 1.2647, test_loss: 1.2345, test_f1: 0.3267
 epoch: 5, train_loss: 1.2432, test_loss: 1.2218, test_f1: 0.3146
 epoch: 6, train_loss: 1.2356, test_loss: 1.2086, test_f1: 0.3142
 epoch: 7, train_loss: 1.2246, test_loss: 1.1929, test_f1: 0.3550
 epoch: 8, train_loss: 1.2207, test_loss: 1.1856, test_f1: 0.3544
 epoch: 9, train_loss: 1.2087, test_loss: 1.1742, test_f1: 0.4096
 epoch: 10, train_loss: 1.1934, test_loss: 1.1587, test_f1: 0.3933
 epoch: 11, train_loss: 1.1902, test_loss: 1.1443, test_f1: 0.4022
 epoch: 12, train_loss: 1.1788, test_loss: 1.1360, test_f1: 0.4047
 epoch: 13, train_loss: 1.1685, test_loss: 1.1295, test_f1: 0.4121
 epoch: 14, train_loss: 1.1574, test_loss: 1.1246, test_f1: 0.4009
 epoch: 15, train_loss: 1.1587, test_loss: 1.1129, test_f1: 0.4188
 epoch: 16, train_loss: 1.1511, test_loss: 1.1089, test_f1: 0.4197
 epoch: 17, train_loss: 1.1362, test_loss: 1.1016, test_f1: 0.4188
 epoch: 18, train_loss: 1.1385, test_loss: 1.0923, test_f1: 0.4068
 epoch: 19, train_loss: 1.1208, test_loss: 1.0928, test_f1: 0.4277
 epoch: 20, train_loss: 1.1141, test_loss: 1.0924, test_f1: 0.4078
 epoch: 21, train_loss: 1.1120, test_loss: 1.0850, test_f1: 0.4224
 epoch: 22, train_loss: 1.1079, test_loss: 1.0740, test_f1: 0.4399
 epoch: 23, train_loss: 1.0990, test_loss: 1.0783, test_f1: 0.4313
 epoch: 24, train_loss: 1.0908, test_loss: 1.0714, test_f1: 0.4277
 epoch: 25, train_loss: 1.0868, test_loss: 1.0563, test_f1: 0.4446
 epoch: 26, train_loss: 1.0852, test_loss: 1.0734, test_f1: 0.4203
 epoch: 27, train_loss: 1.0652, test_loss: 1.0713, test_f1: 0.4280
 epoch: 28, train_loss: 1.0627, test_loss: 1.0533, test_f1: 0.4405
 epoch: 29, train_loss: 1.0542, test_loss: 1.0458, test_f1: 0.4403
 epoch: 30, train_loss: 1.0522, test_loss: 1.0487, test_f1: 0.4438
 epoch: 31, train_loss: 1.0508, test_loss: 1.0396, test_f1: 0.4596
 epoch: 32, train_loss: 1.0413, test_loss: 1.0420, test_f1: 0.4474
 epoch: 33, train_loss: 1.0346, test_loss: 1.0462, test_f1: 0.4310
 epoch: 34, train_loss: 1.0407, test_loss: 1.0382, test_f1: 0.4356
 epoch: 35, train_loss: 1.0406, test_loss: 1.0278, test_f1: 0.4356
 epoch: 36, train_loss: 1.0264, test_loss: 1.0368, test_f1: 0.4490
 epoch: 37, train_loss: 1.0179, test_loss: 1.0311, test_f1: 0.4611
 epoch: 38, train_loss: 1.0062, test_loss: 1.0314, test_f1: 0.4443
 epoch: 39, train_loss: 1.0085, test_loss: 1.0146, test_f1: 0.4786
 epoch: 40, train_loss: 1.0102, test_loss: 1.0368, test_f1: 0.4386
 epoch: 41, train_loss: 1.0083, test_loss: 1.0250, test_f1: 0.4546
 epoch: 42, train_loss: 1.0050, test_loss: 1.0261, test_f1: 0.4496
 epoch: 43, train_loss: 1.0006, test_loss: 1.0199, test_f1: 0.4512
 epoch: 44, train_loss: 0.9882, test_loss: 1.0174, test_f1: 0.4560
 epoch: 45, train_loss: 0.9917, test_loss: 1.0282, test_f1: 0.4488
 epoch: 46, train_loss: 0.9952, test_loss: 1.0191, test_f1: 0.4478
 epoch: 47, train_loss: 0.9854, test_loss: 1.0085, test_f1: 0.4523
 epoch: 48, train_loss: 0.9735, test_loss: 1.0453, test_f1: 0.4465
 epoch: 49, train_loss: 0.9730, test_loss: 1.0435, test_f1: 0.4429
 epoch: 50, train_loss: 0.9685, test_loss: 1.0179, test_f1: 0.4742
 epoch: 51, train_loss: 0.9664, test_loss: 1.0102, test_f1: 0.4766
 epoch: 52, train_loss: 0.9738, test_loss: 1.0283, test_f1: 0.4581
 epoch: 53, train_loss: 0.9612, test_loss: 1.0357, test_f1: 0.4538
 epoch: 54, train_loss: 0.9513, test_loss: 1.0243, test_f1: 0.4518
 epoch: 55, train_loss: 0.9554, test_loss: 1.0192, test_f1: 0.4515
 epoch: 56, train_loss: 0.9716, test_loss: 1.0382, test_f1: 0.4543
 epoch: 57, train_loss: 0.9588, test_loss: 1.0212, test_f1: 0.4556
 epoch: 58, train_loss: 0.9521, test_loss: 1.0300, test_f1: 0.4634
 epoch: 59, train_loss: 0.9423, test_loss: 1.0404, test_f1: 0.4614
 epoch: 60, train_loss: 0.9582, test_loss: 1.0203, test_f1: 0.4507
 epoch: 61, train_loss: 0.9525, test_loss: 1.0349, test_f1: 0.4495
 epoch: 62, train_loss: 0.9481, test_loss: 1.0318, test_f1: 0.4550
 epoch: 63, train_loss: 0.9409, test_loss: 1.0028, test_f1: 0.4648
 epoch: 64, train_loss: 0.9395, test_loss: 1.0279, test_f1: 0.4574
 epoch: 65, train_loss: 0.9427, test_loss: 1.0218, test_f1: 0.4582
 epoch: 66, train_loss: 0.9358, test_loss: 1.0227, test_f1: 0.4574
 epoch: 67, train_loss: 0.9426, test_loss: 1.0170, test_f1: 0.4692
 epoch: 68, train_loss: 0.9425, test_loss: 1.0336, test_f1: 0.4676
 epoch: 69, train_loss: 0.9336, test_loss: 1.0190, test_f1: 0.4669
 epoch: 70, train_loss: 0.9458, test_loss: 1.0256, test_f1: 0.4636
 epoch: 71, train_loss: 0.9370, test_loss: 1.0189, test_f1: 0.4645
 epoch: 72, train_loss: 0.9326, test_loss: 1.0245, test_f1: 0.4684
 epoch: 73, train_loss: 0.9309, test_loss: 1.0193, test_f1: 0.4538
 epoch: 74, train_loss: 0.9361, test_loss: 1.0384, test_f1: 0.4493
 epoch: 75, train_loss: 0.9307, test_loss: 1.0146, test_f1: 0.4679
 epoch: 76, train_loss: 0.9331, test_loss: 1.0289, test_f1: 0.4585
 epoch: 77, train_loss: 0.9246, test_loss: 1.0251, test_f1: 0.4711
 epoch: 78, train_loss: 0.9286, test_loss: 1.0191, test_f1: 0.4630
 epoch: 79, train_loss: 0.9250, test_loss: 1.0192, test_f1: 0.4632
 epoch: 80, train_loss: 0.9222, test_loss: 1.0279, test_f1: 0.4655
 epoch: 81, train_loss: 0.9327, test_loss: 1.0176, test_f1: 0.4651
 epoch: 82, train_loss: 0.9248, test_loss: 1.0352, test_f1: 0.4617
 epoch: 83, train_loss: 0.9272, test_loss: 1.0208, test_f1: 0.4686
 epoch: 84, train_loss: 0.9167, test_loss: 1.0096, test_f1: 0.4712
 epoch: 85, train_loss: 0.9196, test_loss: 1.0437, test_f1: 0.4607
 epoch: 86, train_loss: 0.9197, test_loss: 1.0049, test_f1: 0.4732
 epoch: 87, train_loss: 0.9178, test_loss: 1.0115, test_f1: 0.4663
 epoch: 88, train_loss: 0.9134, test_loss: 1.0029, test_f1: 0.4796
 epoch: 89, train_loss: 0.9133, test_loss: 1.0147, test_f1: 0.4672
 epoch: 90, train_loss: 0.9118, test_loss: 1.0096, test_f1: 0.4814
 epoch: 91, train_loss: 0.9162, test_loss: 1.0136, test_f1: 0.4706
 epoch: 92, train_loss: 0.9131, test_loss: 1.0315, test_f1: 0.4793
 epoch: 93, train_loss: 0.9097, test_loss: 1.0126, test_f1: 0.4719
 epoch: 94, train_loss: 0.9049, test_loss: 1.0364, test_f1: 0.4701
 epoch: 95, train_loss: 0.9097, test_loss: 1.0201, test_f1: 0.4693
 epoch: 96, train_loss: 0.9140, test_loss: 1.0187, test_f1: 0.4752
 epoch: 97, train_loss: 0.9066, test_loss: 1.0220, test_f1: 0.4784
 epoch: 98, train_loss: 0.9052, test_loss: 1.0310, test_f1: 0.4672
 epoch: 99, train_loss: 0.9093, test_loss: 1.0216, test_f1: 0.4681
##################ITERATION #6 ****************************************
 epoch: 0, train_loss: 1.5965, test_loss: 1.3169, test_f1: 0.2274
 epoch: 1, train_loss: 1.3723, test_loss: 1.3190, test_f1: 0.2300
 epoch: 2, train_loss: 1.3062, test_loss: 1.2973, test_f1: 0.2697
 epoch: 3, train_loss: 1.2902, test_loss: 1.2491, test_f1: 0.2842
 epoch: 4, train_loss: 1.2762, test_loss: 1.2253, test_f1: 0.3436
 epoch: 5, train_loss: 1.2561, test_loss: 1.2129, test_f1: 0.3628
 epoch: 6, train_loss: 1.2353, test_loss: 1.2048, test_f1: 0.3639
 epoch: 7, train_loss: 1.2250, test_loss: 1.2010, test_f1: 0.3791
 epoch: 8, train_loss: 1.2105, test_loss: 1.1839, test_f1: 0.3765
 epoch: 9, train_loss: 1.2143, test_loss: 1.1816, test_f1: 0.4000
 epoch: 10, train_loss: 1.1979, test_loss: 1.1764, test_f1: 0.4125
 epoch: 11, train_loss: 1.1891, test_loss: 1.1714, test_f1: 0.3989
 epoch: 12, train_loss: 1.1898, test_loss: 1.1673, test_f1: 0.4132
 epoch: 13, train_loss: 1.1709, test_loss: 1.1426, test_f1: 0.4280
 epoch: 14, train_loss: 1.1713, test_loss: 1.1430, test_f1: 0.4233
 epoch: 15, train_loss: 1.1575, test_loss: 1.1337, test_f1: 0.4187
 epoch: 16, train_loss: 1.1478, test_loss: 1.1259, test_f1: 0.4116
 epoch: 17, train_loss: 1.1503, test_loss: 1.1002, test_f1: 0.4361
 epoch: 18, train_loss: 1.1358, test_loss: 1.1136, test_f1: 0.4190
 epoch: 19, train_loss: 1.1300, test_loss: 1.0936, test_f1: 0.4210
 epoch: 20, train_loss: 1.1244, test_loss: 1.0964, test_f1: 0.4236
 epoch: 21, train_loss: 1.1142, test_loss: 1.0869, test_f1: 0.4287
 epoch: 22, train_loss: 1.1111, test_loss: 1.0948, test_f1: 0.4310
 epoch: 23, train_loss: 1.1098, test_loss: 1.0846, test_f1: 0.4335
 epoch: 24, train_loss: 1.0946, test_loss: 1.1155, test_f1: 0.4175
 epoch: 25, train_loss: 1.1022, test_loss: 1.1058, test_f1: 0.4149
 epoch: 26, train_loss: 1.0902, test_loss: 1.0689, test_f1: 0.4424
 epoch: 27, train_loss: 1.0827, test_loss: 1.0758, test_f1: 0.4246
 epoch: 28, train_loss: 1.0746, test_loss: 1.1141, test_f1: 0.4318
 epoch: 29, train_loss: 1.0671, test_loss: 1.0813, test_f1: 0.4360
 epoch: 30, train_loss: 1.0567, test_loss: 1.0600, test_f1: 0.4375
 epoch: 31, train_loss: 1.0481, test_loss: 1.0423, test_f1: 0.4581
 epoch: 32, train_loss: 1.0495, test_loss: 1.1244, test_f1: 0.4380
 epoch: 33, train_loss: 1.0520, test_loss: 1.0594, test_f1: 0.4507
 epoch: 34, train_loss: 1.0403, test_loss: 1.0836, test_f1: 0.4373
 epoch: 35, train_loss: 1.0355, test_loss: 1.0982, test_f1: 0.4621
 epoch: 36, train_loss: 1.0277, test_loss: 1.0883, test_f1: 0.4429
 epoch: 37, train_loss: 1.0287, test_loss: 1.1109, test_f1: 0.4269
 epoch: 38, train_loss: 1.0160, test_loss: 1.1190, test_f1: 0.4309
 epoch: 39, train_loss: 1.0202, test_loss: 1.0595, test_f1: 0.4442
 epoch: 40, train_loss: 1.0091, test_loss: 1.1199, test_f1: 0.4349
 epoch: 41, train_loss: 1.0253, test_loss: 1.1073, test_f1: 0.4507
 epoch: 42, train_loss: 0.9994, test_loss: 1.1332, test_f1: 0.4439
 epoch: 43, train_loss: 1.0032, test_loss: 1.1195, test_f1: 0.4443
 epoch: 44, train_loss: 0.9932, test_loss: 1.1197, test_f1: 0.4564
 epoch: 45, train_loss: 0.9924, test_loss: 1.1182, test_f1: 0.4370
 epoch: 46, train_loss: 0.9859, test_loss: 1.1320, test_f1: 0.4464
 epoch: 47, train_loss: 0.9882, test_loss: 1.0878, test_f1: 0.4491
 epoch: 48, train_loss: 0.9762, test_loss: 1.1143, test_f1: 0.4422
 epoch: 49, train_loss: 0.9786, test_loss: 1.1480, test_f1: 0.4379
 epoch: 50, train_loss: 0.9761, test_loss: 1.1468, test_f1: 0.4430
 epoch: 51, train_loss: 0.9732, test_loss: 1.1064, test_f1: 0.4592
 epoch: 52, train_loss: 0.9691, test_loss: 1.1377, test_f1: 0.4416
 epoch: 53, train_loss: 0.9692, test_loss: 1.1373, test_f1: 0.4583
 epoch: 54, train_loss: 0.9690, test_loss: 1.1127, test_f1: 0.4587
 epoch: 55, train_loss: 0.9653, test_loss: 1.1481, test_f1: 0.4347
 epoch: 56, train_loss: 0.9666, test_loss: 1.1142, test_f1: 0.4537
 epoch: 57, train_loss: 0.9597, test_loss: 1.1050, test_f1: 0.4618
 epoch: 58, train_loss: 0.9712, test_loss: 1.1103, test_f1: 0.4523
 epoch: 59, train_loss: 0.9576, test_loss: 1.1500, test_f1: 0.4440
 epoch: 60, train_loss: 0.9560, test_loss: 1.1222, test_f1: 0.4488
 epoch: 61, train_loss: 0.9524, test_loss: 1.1054, test_f1: 0.4588
 epoch: 62, train_loss: 0.9441, test_loss: 1.1272, test_f1: 0.4509
 epoch: 63, train_loss: 0.9464, test_loss: 1.1229, test_f1: 0.4526
 epoch: 64, train_loss: 0.9497, test_loss: 1.1292, test_f1: 0.4433
 epoch: 65, train_loss: 0.9468, test_loss: 1.1456, test_f1: 0.4392
 epoch: 66, train_loss: 0.9457, test_loss: 1.1304, test_f1: 0.4426
 epoch: 67, train_loss: 0.9562, test_loss: 1.1277, test_f1: 0.4664
 epoch: 68, train_loss: 0.9483, test_loss: 1.1210, test_f1: 0.4602
 epoch: 69, train_loss: 0.9386, test_loss: 1.1397, test_f1: 0.4438
 epoch: 70, train_loss: 0.9407, test_loss: 1.1046, test_f1: 0.4594
 epoch: 71, train_loss: 0.9396, test_loss: 1.1266, test_f1: 0.4545
 epoch: 72, train_loss: 0.9375, test_loss: 1.1325, test_f1: 0.4471
 epoch: 73, train_loss: 0.9394, test_loss: 1.1178, test_f1: 0.4609
 epoch: 74, train_loss: 0.9274, test_loss: 1.1423, test_f1: 0.4584
 epoch: 75, train_loss: 0.9406, test_loss: 1.1155, test_f1: 0.4595
 epoch: 76, train_loss: 0.9419, test_loss: 1.1141, test_f1: 0.4625
 epoch: 77, train_loss: 0.9257, test_loss: 1.1595, test_f1: 0.4563
 epoch: 78, train_loss: 0.9377, test_loss: 1.1630, test_f1: 0.4451
 epoch: 79, train_loss: 0.9470, test_loss: 1.1107, test_f1: 0.4581
 epoch: 80, train_loss: 0.9329, test_loss: 1.1326, test_f1: 0.4602
 epoch: 81, train_loss: 0.9328, test_loss: 1.1537, test_f1: 0.4677
 epoch: 82, train_loss: 0.9196, test_loss: 1.1306, test_f1: 0.4607
 epoch: 83, train_loss: 0.9279, test_loss: 1.1406, test_f1: 0.4597
 epoch: 84, train_loss: 0.9257, test_loss: 1.1529, test_f1: 0.4517
 epoch: 85, train_loss: 0.9282, test_loss: 1.1244, test_f1: 0.4737
 epoch: 86, train_loss: 0.9194, test_loss: 1.1570, test_f1: 0.4554
 epoch: 87, train_loss: 0.9294, test_loss: 1.1329, test_f1: 0.4718
 epoch: 88, train_loss: 0.9210, test_loss: 1.1625, test_f1: 0.4510
 epoch: 89, train_loss: 0.9170, test_loss: 1.1378, test_f1: 0.4729
 epoch: 90, train_loss: 0.9213, test_loss: 1.1470, test_f1: 0.4473
 epoch: 91, train_loss: 0.9089, test_loss: 1.1480, test_f1: 0.4689
 epoch: 92, train_loss: 0.9215, test_loss: 1.1380, test_f1: 0.4521
 epoch: 93, train_loss: 0.9206, test_loss: 1.1517, test_f1: 0.4631
 epoch: 94, train_loss: 0.9153, test_loss: 1.1765, test_f1: 0.4494
 epoch: 95, train_loss: 0.9244, test_loss: 1.1214, test_f1: 0.4668
 epoch: 96, train_loss: 0.9018, test_loss: 1.1683, test_f1: 0.4530
 epoch: 97, train_loss: 0.9052, test_loss: 1.1591, test_f1: 0.4753
 epoch: 98, train_loss: 0.9073, test_loss: 1.1989, test_f1: 0.4460
 epoch: 99, train_loss: 0.9248, test_loss: 1.1463, test_f1: 0.4737
##################ITERATION #7 ****************************************
 epoch: 0, train_loss: 1.4997, test_loss: 1.3615, test_f1: 0.2247
 epoch: 1, train_loss: 1.3077, test_loss: 1.3207, test_f1: 0.2549
 epoch: 2, train_loss: 1.2670, test_loss: 1.2754, test_f1: 0.3057
 epoch: 3, train_loss: 1.2368, test_loss: 1.2121, test_f1: 0.3625
 epoch: 4, train_loss: 1.2058, test_loss: 1.1860, test_f1: 0.4013
 epoch: 5, train_loss: 1.1898, test_loss: 1.1625, test_f1: 0.4274
 epoch: 6, train_loss: 1.1796, test_loss: 1.1393, test_f1: 0.4380
 epoch: 7, train_loss: 1.1710, test_loss: 1.1218, test_f1: 0.4324
 epoch: 8, train_loss: 1.1592, test_loss: 1.1157, test_f1: 0.4434
 epoch: 9, train_loss: 1.1356, test_loss: 1.1035, test_f1: 0.4557
 epoch: 10, train_loss: 1.1519, test_loss: 1.1047, test_f1: 0.4569
 epoch: 11, train_loss: 1.1383, test_loss: 1.0975, test_f1: 0.4595
 epoch: 12, train_loss: 1.1388, test_loss: 1.0966, test_f1: 0.4596
 epoch: 13, train_loss: 1.1189, test_loss: 1.0905, test_f1: 0.4576
 epoch: 14, train_loss: 1.1205, test_loss: 1.0766, test_f1: 0.4641
 epoch: 15, train_loss: 1.1144, test_loss: 1.0739, test_f1: 0.4546
 epoch: 16, train_loss: 1.1099, test_loss: 1.0761, test_f1: 0.4537
 epoch: 17, train_loss: 1.1123, test_loss: 1.0668, test_f1: 0.4446
 epoch: 18, train_loss: 1.0989, test_loss: 1.0643, test_f1: 0.4266
 epoch: 19, train_loss: 1.0940, test_loss: 1.0594, test_f1: 0.4444
 epoch: 20, train_loss: 1.0883, test_loss: 1.0502, test_f1: 0.4422
 epoch: 21, train_loss: 1.0845, test_loss: 1.0394, test_f1: 0.4406
 epoch: 22, train_loss: 1.0769, test_loss: 1.0390, test_f1: 0.4410
 epoch: 23, train_loss: 1.0720, test_loss: 1.0525, test_f1: 0.4241
 epoch: 24, train_loss: 1.0771, test_loss: 1.0406, test_f1: 0.4315
 epoch: 25, train_loss: 1.0654, test_loss: 1.0341, test_f1: 0.4380
 epoch: 26, train_loss: 1.0514, test_loss: 1.0392, test_f1: 0.4401
 epoch: 27, train_loss: 1.0473, test_loss: 1.0376, test_f1: 0.4419
 epoch: 28, train_loss: 1.0555, test_loss: 1.0242, test_f1: 0.4415
 epoch: 29, train_loss: 1.0475, test_loss: 1.0352, test_f1: 0.4385
 epoch: 30, train_loss: 1.0405, test_loss: 1.0331, test_f1: 0.4412
 epoch: 31, train_loss: 1.0337, test_loss: 1.0341, test_f1: 0.4321
 epoch: 32, train_loss: 1.0332, test_loss: 1.0327, test_f1: 0.4437
 epoch: 33, train_loss: 1.0346, test_loss: 1.0278, test_f1: 0.4397
 epoch: 34, train_loss: 1.0309, test_loss: 1.0160, test_f1: 0.4498
 epoch: 35, train_loss: 1.0330, test_loss: 1.0267, test_f1: 0.4421
 epoch: 36, train_loss: 1.0210, test_loss: 1.0463, test_f1: 0.4552
 epoch: 37, train_loss: 1.0217, test_loss: 1.0127, test_f1: 0.4543
 epoch: 38, train_loss: 1.0167, test_loss: 1.0532, test_f1: 0.4454
 epoch: 39, train_loss: 1.0132, test_loss: 1.0194, test_f1: 0.4575
 epoch: 40, train_loss: 1.0157, test_loss: 1.0388, test_f1: 0.4563
 epoch: 41, train_loss: 1.0080, test_loss: 1.0293, test_f1: 0.4529
 epoch: 42, train_loss: 1.0065, test_loss: 1.0226, test_f1: 0.4606
 epoch: 43, train_loss: 0.9996, test_loss: 1.0371, test_f1: 0.4512
 epoch: 44, train_loss: 0.9910, test_loss: 1.0373, test_f1: 0.4584
 epoch: 45, train_loss: 0.9959, test_loss: 1.0169, test_f1: 0.4589
 epoch: 46, train_loss: 0.9937, test_loss: 1.0325, test_f1: 0.4646
 epoch: 47, train_loss: 0.9950, test_loss: 1.0143, test_f1: 0.4728
 epoch: 48, train_loss: 0.9855, test_loss: 1.0056, test_f1: 0.4723
 epoch: 49, train_loss: 0.9855, test_loss: 1.0167, test_f1: 0.4753
 epoch: 50, train_loss: 0.9795, test_loss: 1.0039, test_f1: 0.4730
 epoch: 51, train_loss: 0.9796, test_loss: 1.0268, test_f1: 0.4600
 epoch: 52, train_loss: 0.9753, test_loss: 1.0088, test_f1: 0.4610
 epoch: 53, train_loss: 0.9714, test_loss: 1.0184, test_f1: 0.4586
 epoch: 54, train_loss: 0.9629, test_loss: 1.0149, test_f1: 0.4676
 epoch: 55, train_loss: 0.9713, test_loss: 1.0076, test_f1: 0.4646
 epoch: 56, train_loss: 0.9665, test_loss: 1.0152, test_f1: 0.4711
 epoch: 57, train_loss: 0.9735, test_loss: 1.0127, test_f1: 0.4622
 epoch: 58, train_loss: 0.9565, test_loss: 1.0011, test_f1: 0.4704
 epoch: 59, train_loss: 0.9721, test_loss: 1.0001, test_f1: 0.4641
 epoch: 60, train_loss: 0.9565, test_loss: 0.9979, test_f1: 0.4701
 epoch: 61, train_loss: 0.9500, test_loss: 0.9950, test_f1: 0.4671
 epoch: 62, train_loss: 0.9554, test_loss: 1.0074, test_f1: 0.4611
 epoch: 63, train_loss: 0.9557, test_loss: 1.0133, test_f1: 0.4712
 epoch: 64, train_loss: 0.9576, test_loss: 1.0177, test_f1: 0.4645
 epoch: 65, train_loss: 0.9517, test_loss: 0.9838, test_f1: 0.4758
 epoch: 66, train_loss: 0.9471, test_loss: 0.9891, test_f1: 0.4765
 epoch: 67, train_loss: 0.9489, test_loss: 1.0083, test_f1: 0.4764
 epoch: 68, train_loss: 0.9574, test_loss: 1.0056, test_f1: 0.4782
 epoch: 69, train_loss: 0.9500, test_loss: 1.0095, test_f1: 0.4745
 epoch: 70, train_loss: 0.9389, test_loss: 1.0144, test_f1: 0.4703
 epoch: 71, train_loss: 0.9414, test_loss: 1.0262, test_f1: 0.4610
 epoch: 72, train_loss: 0.9544, test_loss: 1.0092, test_f1: 0.4709
 epoch: 73, train_loss: 0.9493, test_loss: 1.0098, test_f1: 0.4744
 epoch: 74, train_loss: 0.9461, test_loss: 1.0188, test_f1: 0.4643
 epoch: 75, train_loss: 0.9375, test_loss: 1.0132, test_f1: 0.4757
 epoch: 76, train_loss: 0.9391, test_loss: 1.0090, test_f1: 0.4784
 epoch: 77, train_loss: 0.9364, test_loss: 1.0203, test_f1: 0.4809
 epoch: 78, train_loss: 0.9397, test_loss: 1.0181, test_f1: 0.4676
 epoch: 79, train_loss: 0.9357, test_loss: 1.0177, test_f1: 0.4667
 epoch: 80, train_loss: 0.9453, test_loss: 1.0097, test_f1: 0.4675
 epoch: 81, train_loss: 0.9359, test_loss: 1.0130, test_f1: 0.4720
 epoch: 82, train_loss: 0.9322, test_loss: 1.0074, test_f1: 0.4724
 epoch: 83, train_loss: 0.9312, test_loss: 1.0205, test_f1: 0.4696
 epoch: 84, train_loss: 0.9425, test_loss: 1.0070, test_f1: 0.4747
 epoch: 85, train_loss: 0.9300, test_loss: 1.0193, test_f1: 0.4746
 epoch: 86, train_loss: 0.9266, test_loss: 1.0197, test_f1: 0.4706
 epoch: 87, train_loss: 0.9316, test_loss: 1.0219, test_f1: 0.4745
 epoch: 88, train_loss: 0.9232, test_loss: 1.0190, test_f1: 0.4785
 epoch: 89, train_loss: 0.9231, test_loss: 0.9980, test_f1: 0.4776
 epoch: 90, train_loss: 0.9318, test_loss: 1.0154, test_f1: 0.4755
 epoch: 91, train_loss: 0.9238, test_loss: 1.0154, test_f1: 0.4819
 epoch: 92, train_loss: 0.9253, test_loss: 1.0234, test_f1: 0.4808
 epoch: 93, train_loss: 0.9228, test_loss: 1.0190, test_f1: 0.4739
 epoch: 94, train_loss: 0.9248, test_loss: 1.0196, test_f1: 0.4740
 epoch: 95, train_loss: 0.9217, test_loss: 1.0120, test_f1: 0.4756
 epoch: 96, train_loss: 0.9207, test_loss: 1.0240, test_f1: 0.4834
 epoch: 97, train_loss: 0.9263, test_loss: 1.0220, test_f1: 0.4822
 epoch: 98, train_loss: 0.9105, test_loss: 1.0180, test_f1: 0.4736
 epoch: 99, train_loss: 0.9075, test_loss: 0.9917, test_f1: 0.4851
##################ITERATION #8 ****************************************
 epoch: 0, train_loss: 1.4918, test_loss: 1.3020, test_f1: 0.2274
 epoch: 1, train_loss: 1.3262, test_loss: 1.2756, test_f1: 0.2274
 epoch: 2, train_loss: 1.2856, test_loss: 1.2292, test_f1: 0.2905
 epoch: 3, train_loss: 1.2472, test_loss: 1.2048, test_f1: 0.3800
 epoch: 4, train_loss: 1.2148, test_loss: 1.1946, test_f1: 0.3753
 epoch: 5, train_loss: 1.2029, test_loss: 1.1736, test_f1: 0.3813
 epoch: 6, train_loss: 1.1917, test_loss: 1.1607, test_f1: 0.3891
 epoch: 7, train_loss: 1.1868, test_loss: 1.1525, test_f1: 0.3949
 epoch: 8, train_loss: 1.1768, test_loss: 1.1436, test_f1: 0.3994
 epoch: 9, train_loss: 1.1730, test_loss: 1.1447, test_f1: 0.3941
 epoch: 10, train_loss: 1.1724, test_loss: 1.1290, test_f1: 0.4172
 epoch: 11, train_loss: 1.1594, test_loss: 1.1238, test_f1: 0.3972
 epoch: 12, train_loss: 1.1512, test_loss: 1.1221, test_f1: 0.4121
 epoch: 13, train_loss: 1.1490, test_loss: 1.1080, test_f1: 0.4234
 epoch: 14, train_loss: 1.1372, test_loss: 1.1065, test_f1: 0.4176
 epoch: 15, train_loss: 1.1288, test_loss: 1.0988, test_f1: 0.4389
 epoch: 16, train_loss: 1.1341, test_loss: 1.0883, test_f1: 0.4324
 epoch: 17, train_loss: 1.1106, test_loss: 1.0891, test_f1: 0.4381
 epoch: 18, train_loss: 1.1098, test_loss: 1.0881, test_f1: 0.4342
 epoch: 19, train_loss: 1.0957, test_loss: 1.0768, test_f1: 0.4420
 epoch: 20, train_loss: 1.0961, test_loss: 1.0731, test_f1: 0.4359
 epoch: 21, train_loss: 1.0890, test_loss: 1.0719, test_f1: 0.4317
 epoch: 22, train_loss: 1.0915, test_loss: 1.0598, test_f1: 0.4368
 epoch: 23, train_loss: 1.0775, test_loss: 1.0499, test_f1: 0.4521
 epoch: 24, train_loss: 1.0691, test_loss: 1.0441, test_f1: 0.4485
 epoch: 25, train_loss: 1.0610, test_loss: 1.0395, test_f1: 0.4532
 epoch: 26, train_loss: 1.0557, test_loss: 1.0310, test_f1: 0.4468
 epoch: 27, train_loss: 1.0539, test_loss: 1.0318, test_f1: 0.4573
 epoch: 28, train_loss: 1.0409, test_loss: 1.0256, test_f1: 0.4532
 epoch: 29, train_loss: 1.0347, test_loss: 1.0171, test_f1: 0.4551
 epoch: 30, train_loss: 1.0334, test_loss: 1.0058, test_f1: 0.4618
 epoch: 31, train_loss: 1.0286, test_loss: 0.9976, test_f1: 0.4624
 epoch: 32, train_loss: 1.0205, test_loss: 0.9911, test_f1: 0.4682
 epoch: 33, train_loss: 1.0078, test_loss: 0.9980, test_f1: 0.4687
 epoch: 34, train_loss: 1.0125, test_loss: 0.9977, test_f1: 0.4625
 epoch: 35, train_loss: 1.0091, test_loss: 0.9777, test_f1: 0.4869
 epoch: 36, train_loss: 1.0025, test_loss: 0.9848, test_f1: 0.4814
 epoch: 37, train_loss: 0.9871, test_loss: 0.9801, test_f1: 0.4869
 epoch: 38, train_loss: 0.9866, test_loss: 0.9828, test_f1: 0.4691
 epoch: 39, train_loss: 0.9797, test_loss: 0.9888, test_f1: 0.4733
 epoch: 40, train_loss: 0.9770, test_loss: 0.9680, test_f1: 0.4779
 epoch: 41, train_loss: 0.9816, test_loss: 0.9536, test_f1: 0.4908
 epoch: 42, train_loss: 0.9699, test_loss: 0.9610, test_f1: 0.5074
 epoch: 43, train_loss: 0.9648, test_loss: 0.9543, test_f1: 0.4945
 epoch: 44, train_loss: 0.9739, test_loss: 0.9643, test_f1: 0.4853
 epoch: 45, train_loss: 0.9601, test_loss: 0.9715, test_f1: 0.4878
 epoch: 46, train_loss: 0.9537, test_loss: 0.9514, test_f1: 0.4907
 epoch: 47, train_loss: 0.9460, test_loss: 0.9579, test_f1: 0.4805
 epoch: 48, train_loss: 0.9395, test_loss: 0.9604, test_f1: 0.4949
 epoch: 49, train_loss: 0.9408, test_loss: 0.9535, test_f1: 0.4915
 epoch: 50, train_loss: 0.9388, test_loss: 0.9956, test_f1: 0.4761
 epoch: 51, train_loss: 0.9307, test_loss: 0.9727, test_f1: 0.4846
 epoch: 52, train_loss: 0.9435, test_loss: 0.9501, test_f1: 0.4896
 epoch: 53, train_loss: 0.9260, test_loss: 0.9396, test_f1: 0.4826
 epoch: 54, train_loss: 0.9308, test_loss: 0.9491, test_f1: 0.4821
 epoch: 55, train_loss: 0.9251, test_loss: 0.9626, test_f1: 0.4811
 epoch: 56, train_loss: 0.9241, test_loss: 0.9487, test_f1: 0.4926
 epoch: 57, train_loss: 0.9261, test_loss: 0.9386, test_f1: 0.4869
 epoch: 58, train_loss: 0.9218, test_loss: 0.9544, test_f1: 0.4900
 epoch: 59, train_loss: 0.9193, test_loss: 0.9614, test_f1: 0.4900
 epoch: 60, train_loss: 0.9148, test_loss: 0.9464, test_f1: 0.5043
 epoch: 61, train_loss: 0.9184, test_loss: 0.9595, test_f1: 0.4889
 epoch: 62, train_loss: 0.9149, test_loss: 0.9498, test_f1: 0.4936
 epoch: 63, train_loss: 0.9107, test_loss: 0.9627, test_f1: 0.4841
 epoch: 64, train_loss: 0.9117, test_loss: 0.9560, test_f1: 0.4869
 epoch: 65, train_loss: 0.9091, test_loss: 0.9478, test_f1: 0.4905
 epoch: 66, train_loss: 0.9111, test_loss: 0.9583, test_f1: 0.4888
 epoch: 67, train_loss: 0.9064, test_loss: 0.9521, test_f1: 0.4922
 epoch: 68, train_loss: 0.9037, test_loss: 0.9568, test_f1: 0.4962
 epoch: 69, train_loss: 0.9041, test_loss: 0.9514, test_f1: 0.4892
 epoch: 70, train_loss: 0.8959, test_loss: 0.9685, test_f1: 0.4909
 epoch: 71, train_loss: 0.9011, test_loss: 0.9695, test_f1: 0.4964
 epoch: 72, train_loss: 0.8965, test_loss: 0.9483, test_f1: 0.5025
 epoch: 73, train_loss: 0.9029, test_loss: 0.9566, test_f1: 0.5046
 epoch: 74, train_loss: 0.8866, test_loss: 0.9483, test_f1: 0.4952
 epoch: 75, train_loss: 0.9046, test_loss: 0.9445, test_f1: 0.4986
 epoch: 76, train_loss: 0.9051, test_loss: 0.9508, test_f1: 0.4950
 epoch: 77, train_loss: 0.8918, test_loss: 0.9722, test_f1: 0.4918
 epoch: 78, train_loss: 0.8900, test_loss: 0.9596, test_f1: 0.5040
 epoch: 79, train_loss: 0.8858, test_loss: 0.9524, test_f1: 0.5144
 epoch: 80, train_loss: 0.8935, test_loss: 0.9627, test_f1: 0.4999
 epoch: 81, train_loss: 0.9006, test_loss: 0.9639, test_f1: 0.4917
 epoch: 82, train_loss: 0.8795, test_loss: 0.9602, test_f1: 0.4861
 epoch: 83, train_loss: 0.8892, test_loss: 0.9542, test_f1: 0.4912
 epoch: 84, train_loss: 0.8883, test_loss: 0.9536, test_f1: 0.4963
 epoch: 85, train_loss: 0.8899, test_loss: 0.9654, test_f1: 0.4934
 epoch: 86, train_loss: 0.8793, test_loss: 0.9645, test_f1: 0.4984
 epoch: 87, train_loss: 0.8916, test_loss: 0.9531, test_f1: 0.4983
 epoch: 88, train_loss: 0.8851, test_loss: 0.9717, test_f1: 0.4904
 epoch: 89, train_loss: 0.8896, test_loss: 0.9658, test_f1: 0.4900
 epoch: 90, train_loss: 0.8702, test_loss: 0.9459, test_f1: 0.4949
 epoch: 91, train_loss: 0.8810, test_loss: 0.9714, test_f1: 0.5047
 epoch: 92, train_loss: 0.8725, test_loss: 0.9758, test_f1: 0.4849
 epoch: 93, train_loss: 0.8842, test_loss: 0.9664, test_f1: 0.4949
 epoch: 94, train_loss: 0.8662, test_loss: 0.9503, test_f1: 0.4888
 epoch: 95, train_loss: 0.8796, test_loss: 0.9433, test_f1: 0.4904
 epoch: 96, train_loss: 0.8679, test_loss: 0.9541, test_f1: 0.5040
 epoch: 97, train_loss: 0.8658, test_loss: 0.9703, test_f1: 0.4877
 epoch: 98, train_loss: 0.8643, test_loss: 0.9536, test_f1: 0.5083
 epoch: 99, train_loss: 0.8621, test_loss: 0.9619, test_f1: 0.5129
##################ITERATION #9 ****************************************
 epoch: 0, train_loss: 1.4120, test_loss: 1.3540, test_f1: 0.2274
 epoch: 1, train_loss: 1.2869, test_loss: 1.2979, test_f1: 0.2483
 epoch: 2, train_loss: 1.2648, test_loss: 1.2484, test_f1: 0.2816
 epoch: 3, train_loss: 1.2366, test_loss: 1.2255, test_f1: 0.2918
 epoch: 4, train_loss: 1.2164, test_loss: 1.2011, test_f1: 0.3509
 epoch: 5, train_loss: 1.2218, test_loss: 1.1878, test_f1: 0.3761
 epoch: 6, train_loss: 1.2123, test_loss: 1.1772, test_f1: 0.3674
 epoch: 7, train_loss: 1.1909, test_loss: 1.1605, test_f1: 0.3793
 epoch: 8, train_loss: 1.1881, test_loss: 1.1499, test_f1: 0.3914
 epoch: 9, train_loss: 1.1849, test_loss: 1.1418, test_f1: 0.3861
 epoch: 10, train_loss: 1.1715, test_loss: 1.1355, test_f1: 0.4068
 epoch: 11, train_loss: 1.1697, test_loss: 1.1275, test_f1: 0.4169
 epoch: 12, train_loss: 1.1648, test_loss: 1.1168, test_f1: 0.4149
 epoch: 13, train_loss: 1.1469, test_loss: 1.1131, test_f1: 0.4144
 epoch: 14, train_loss: 1.1428, test_loss: 1.1210, test_f1: 0.4144
 epoch: 15, train_loss: 1.1421, test_loss: 1.1098, test_f1: 0.4238
 epoch: 16, train_loss: 1.1447, test_loss: 1.0927, test_f1: 0.4276
 epoch: 17, train_loss: 1.1315, test_loss: 1.0922, test_f1: 0.4120
 epoch: 18, train_loss: 1.1266, test_loss: 1.0962, test_f1: 0.4213
 epoch: 19, train_loss: 1.1226, test_loss: 1.0868, test_f1: 0.4296
 epoch: 20, train_loss: 1.1063, test_loss: 1.0922, test_f1: 0.4207
 epoch: 21, train_loss: 1.1019, test_loss: 1.0749, test_f1: 0.4234
 epoch: 22, train_loss: 1.0937, test_loss: 1.0735, test_f1: 0.4272
 epoch: 23, train_loss: 1.0972, test_loss: 1.0698, test_f1: 0.4268
 epoch: 24, train_loss: 1.0837, test_loss: 1.0543, test_f1: 0.4205
 epoch: 25, train_loss: 1.0897, test_loss: 1.0638, test_f1: 0.4152
 epoch: 26, train_loss: 1.0722, test_loss: 1.0584, test_f1: 0.4185
 epoch: 27, train_loss: 1.0621, test_loss: 1.0435, test_f1: 0.4510
 epoch: 28, train_loss: 1.0595, test_loss: 1.0275, test_f1: 0.4539
 epoch: 29, train_loss: 1.0609, test_loss: 1.0333, test_f1: 0.4392
 epoch: 30, train_loss: 1.0628, test_loss: 1.0333, test_f1: 0.4259
 epoch: 31, train_loss: 1.0395, test_loss: 1.0246, test_f1: 0.4461
 epoch: 32, train_loss: 1.0425, test_loss: 1.0271, test_f1: 0.4434
 epoch: 33, train_loss: 1.0344, test_loss: 1.0178, test_f1: 0.4388
 epoch: 34, train_loss: 1.0300, test_loss: 1.0593, test_f1: 0.4236
 epoch: 35, train_loss: 1.0347, test_loss: 1.0152, test_f1: 0.4670
 epoch: 36, train_loss: 1.0209, test_loss: 1.0257, test_f1: 0.4643
 epoch: 37, train_loss: 1.0098, test_loss: 1.0050, test_f1: 0.4536
 epoch: 38, train_loss: 1.0141, test_loss: 1.0255, test_f1: 0.4544
 epoch: 39, train_loss: 1.0077, test_loss: 1.0401, test_f1: 0.4456
 epoch: 40, train_loss: 1.0060, test_loss: 1.0071, test_f1: 0.4457
 epoch: 41, train_loss: 1.0005, test_loss: 1.0152, test_f1: 0.4426
 epoch: 42, train_loss: 1.0045, test_loss: 1.0212, test_f1: 0.4552
 epoch: 43, train_loss: 1.0018, test_loss: 1.0423, test_f1: 0.4498
 epoch: 44, train_loss: 0.9839, test_loss: 1.0226, test_f1: 0.4569
 epoch: 45, train_loss: 0.9901, test_loss: 1.0006, test_f1: 0.4496
 epoch: 46, train_loss: 0.9940, test_loss: 1.0458, test_f1: 0.4422
 epoch: 47, train_loss: 0.9839, test_loss: 1.0181, test_f1: 0.4489
 epoch: 48, train_loss: 0.9905, test_loss: 0.9920, test_f1: 0.4529
 epoch: 49, train_loss: 0.9847, test_loss: 1.0372, test_f1: 0.4517
 epoch: 50, train_loss: 0.9747, test_loss: 0.9896, test_f1: 0.4745
 epoch: 51, train_loss: 0.9614, test_loss: 1.0107, test_f1: 0.4667
 epoch: 52, train_loss: 0.9707, test_loss: 1.0244, test_f1: 0.4722
 epoch: 53, train_loss: 0.9626, test_loss: 1.0046, test_f1: 0.4674
 epoch: 54, train_loss: 0.9510, test_loss: 0.9992, test_f1: 0.4617
 epoch: 55, train_loss: 0.9691, test_loss: 1.0113, test_f1: 0.4481
 epoch: 56, train_loss: 0.9535, test_loss: 1.0156, test_f1: 0.4515
 epoch: 57, train_loss: 0.9576, test_loss: 1.0023, test_f1: 0.4618
 epoch: 58, train_loss: 0.9478, test_loss: 1.0090, test_f1: 0.4658
 epoch: 59, train_loss: 0.9541, test_loss: 1.0235, test_f1: 0.4456
 epoch: 60, train_loss: 0.9485, test_loss: 1.0187, test_f1: 0.4502
 epoch: 61, train_loss: 0.9489, test_loss: 1.0171, test_f1: 0.4610
 epoch: 62, train_loss: 0.9488, test_loss: 1.0004, test_f1: 0.4687
 epoch: 63, train_loss: 0.9367, test_loss: 1.0149, test_f1: 0.4617
 epoch: 64, train_loss: 0.9428, test_loss: 1.0451, test_f1: 0.4503
 epoch: 65, train_loss: 0.9385, test_loss: 1.0170, test_f1: 0.4504
 epoch: 66, train_loss: 0.9492, test_loss: 0.9997, test_f1: 0.4569
 epoch: 67, train_loss: 0.9468, test_loss: 1.0365, test_f1: 0.4621
 epoch: 68, train_loss: 0.9368, test_loss: 1.0057, test_f1: 0.4694
 epoch: 69, train_loss: 0.9448, test_loss: 1.0553, test_f1: 0.4636
 epoch: 70, train_loss: 0.9394, test_loss: 1.0111, test_f1: 0.4656
 epoch: 71, train_loss: 0.9415, test_loss: 1.0340, test_f1: 0.4603
 epoch: 72, train_loss: 0.9190, test_loss: 0.9760, test_f1: 0.4676
 epoch: 73, train_loss: 0.9378, test_loss: 1.0182, test_f1: 0.4633
 epoch: 74, train_loss: 0.9228, test_loss: 1.0223, test_f1: 0.4643
 epoch: 75, train_loss: 0.9220, test_loss: 1.0226, test_f1: 0.4585
 epoch: 76, train_loss: 0.9258, test_loss: 1.0257, test_f1: 0.4624
 epoch: 77, train_loss: 0.9361, test_loss: 1.0054, test_f1: 0.4616
 epoch: 78, train_loss: 0.9251, test_loss: 1.0222, test_f1: 0.4518
 epoch: 79, train_loss: 0.9225, test_loss: 1.0549, test_f1: 0.4490
 epoch: 80, train_loss: 0.9199, test_loss: 1.0286, test_f1: 0.4660
 epoch: 81, train_loss: 0.9184, test_loss: 1.0454, test_f1: 0.4597
 epoch: 82, train_loss: 0.9321, test_loss: 1.0054, test_f1: 0.4630
 epoch: 83, train_loss: 0.9097, test_loss: 1.0247, test_f1: 0.4773
 epoch: 84, train_loss: 0.9020, test_loss: 1.0168, test_f1: 0.4836
 epoch: 85, train_loss: 0.9156, test_loss: 1.0046, test_f1: 0.4736
 epoch: 86, train_loss: 0.9203, test_loss: 1.0307, test_f1: 0.4563
 epoch: 87, train_loss: 0.9216, test_loss: 1.0320, test_f1: 0.4605
 epoch: 88, train_loss: 0.9257, test_loss: 1.0284, test_f1: 0.4694
 epoch: 89, train_loss: 0.9086, test_loss: 1.0369, test_f1: 0.4678
 epoch: 90, train_loss: 0.9147, test_loss: 1.0176, test_f1: 0.4645
 epoch: 91, train_loss: 0.9151, test_loss: 1.0085, test_f1: 0.4550
 epoch: 92, train_loss: 0.9144, test_loss: 1.0485, test_f1: 0.4698
 epoch: 93, train_loss: 0.9136, test_loss: 1.0296, test_f1: 0.4675
 epoch: 94, train_loss: 0.9062, test_loss: 1.0601, test_f1: 0.4656
 epoch: 95, train_loss: 0.9094, test_loss: 1.0281, test_f1: 0.4614
 epoch: 96, train_loss: 0.8999, test_loss: 1.0379, test_f1: 0.4677
 epoch: 97, train_loss: 0.8996, test_loss: 1.0323, test_f1: 0.4621
 epoch: 98, train_loss: 0.9034, test_loss: 1.0460, test_f1: 0.4578
 epoch: 99, train_loss: 0.9099, test_loss: 1.0629, test_f1: 0.4572

Training completed in 385.05 seconds
Best F1: 0.5144 at epoch 79
Mean F1 across iterations: 0.4876  0.0151
========================FINAL RESULTS================================
FEGIN weighted F1: 0.5144  0.0151
python main.py --data ltspice_examples --representation component_component --model FEGIN --layers 4 --hiddens 16 --batch_size 256 --lr 0.001 --emb_size 512 --epochs 100 --save_appendix component_component_L4_H16_BS256_LR0.001_E512 --no_val
-----



STDERR:
  File "main.py", line 370, in <module>
    main()
  File "main.py", line 254, in main
    dataset = dataset_class(
  File "/home/philip/projects/ltspice_examples_code_repo/Circuit-Completion-Using-GNNs/component_classification_with_link_prediction_head/evaluation/FEGIN/kernel/circuit_datasets.py", line 15, in __init__
    self.data, self.slices = torch.load(self.processed_paths[0])
  File "/home/philip/.local/lib/python3.8/site-packages/torch/serialization.py", line 1040, in load
    warnings.warn(
  File "/usr/lib/python3.8/warnings.py", line 109, in _showwarnmsg
    sw(msg.message, msg.category, msg.filename, msg.lineno,
  File "main.py", line 47, in warn_with_traceback
    traceback.print_stack(file=log)
/home/philip/projects/ltspice_examples_code_repo/Circuit-Completion-Using-GNNs/component_classification_with_link_prediction_head/evaluation/FEGIN/kernel/circuit_datasets.py:15: FutureWarning: You are using `torch.load` with `weights_only=False` (the current default value), which uses the default pickle module implicitly. It is possible to construct malicious pickle data which will execute arbitrary code during unpickling (See https://github.com/pytorch/pytorch/blob/main/SECURITY.md#untrusted-models for more details). In a future release, the default value for `weights_only` will be flipped to `True`. This limits the functions that could be executed during unpickling. Arbitrary objects will no longer be allowed to be loaded via this mode unless they are explicitly allowlisted by the user via `torch.serialization.add_safe_globals`. We recommend you start setting `weights_only=True` for any use case where you don't have full control of the loaded file. Please open an issue on GitHub for any issues related to this experimental feature.
  self.data, self.slices = torch.load(self.processed_paths[0])
