STDOUT:
Results will be saved in /home/philip/projects/llm_inference_code_repo/Circuit-Completion-Using-GNNs/component_classification_with_link_prediction_head/evaluation/FEGIN/results/model_FEGIN_dataset_ltspice_examples
Command line input: python main.py --data ltspice_examples --representation component_component --model FEGIN --layers 2 --hiddens 64 --batch_size 128 --lr 0.001 --emb_size 250 --epochs 100 --save_appendix component_component_L2_H64_BS128_LR0.001_E250 --no_val
 is saved.
-----
ltspice_examples - FEGIN
Using 2 layers, 64 hidden units, h = 2
Loading component_component representation dataset
ENTERED
Training FEGIN on component_component representation
Train: 3556, Test: 845
##################ITERATION #0 ****************************************
 epoch: 0, train_loss: 1.3267, test_loss: 1.2634, test_f1: 0.2274
 epoch: 1, train_loss: 1.2220, test_loss: 1.1719, test_f1: 0.3040
 epoch: 2, train_loss: 1.1653, test_loss: 1.1250, test_f1: 0.3667
 epoch: 3, train_loss: 1.1137, test_loss: 1.0864, test_f1: 0.4616
 epoch: 4, train_loss: 1.0663, test_loss: 1.0073, test_f1: 0.4700
 epoch: 5, train_loss: 1.0424, test_loss: 1.0295, test_f1: 0.4653
 epoch: 6, train_loss: 1.0088, test_loss: 0.9700, test_f1: 0.5069
 epoch: 7, train_loss: 0.9791, test_loss: 0.9284, test_f1: 0.5005
 epoch: 8, train_loss: 0.9494, test_loss: 0.9637, test_f1: 0.4813
 epoch: 9, train_loss: 0.9394, test_loss: 0.9692, test_f1: 0.5038
 epoch: 10, train_loss: 0.9326, test_loss: 0.9550, test_f1: 0.5181
 epoch: 11, train_loss: 0.9190, test_loss: 0.9595, test_f1: 0.4942
 epoch: 12, train_loss: 0.8993, test_loss: 0.9246, test_f1: 0.5323
 epoch: 13, train_loss: 0.8850, test_loss: 1.0260, test_f1: 0.5007
 epoch: 14, train_loss: 0.8698, test_loss: 0.9912, test_f1: 0.4972
 epoch: 15, train_loss: 0.8568, test_loss: 1.0123, test_f1: 0.5114
 epoch: 16, train_loss: 0.8622, test_loss: 1.0013, test_f1: 0.5215
 epoch: 17, train_loss: 0.8473, test_loss: 1.1320, test_f1: 0.4952
 epoch: 18, train_loss: 0.8381, test_loss: 1.0401, test_f1: 0.5091
 epoch: 19, train_loss: 0.8221, test_loss: 1.0045, test_f1: 0.5174
 epoch: 20, train_loss: 0.8097, test_loss: 1.0442, test_f1: 0.5513
 epoch: 21, train_loss: 0.8023, test_loss: 1.0958, test_f1: 0.5178
 epoch: 22, train_loss: 0.8037, test_loss: 1.0095, test_f1: 0.5562
 epoch: 23, train_loss: 0.7952, test_loss: 1.1167, test_f1: 0.5216
 epoch: 24, train_loss: 0.7750, test_loss: 1.0936, test_f1: 0.5423
 epoch: 25, train_loss: 0.7784, test_loss: 1.0997, test_f1: 0.5421
 epoch: 26, train_loss: 0.7695, test_loss: 1.1549, test_f1: 0.5537
 epoch: 27, train_loss: 0.7679, test_loss: 1.2293, test_f1: 0.5486
 epoch: 28, train_loss: 0.7454, test_loss: 1.1141, test_f1: 0.5663
 epoch: 29, train_loss: 0.7405, test_loss: 1.1750, test_f1: 0.5297
 epoch: 30, train_loss: 0.7333, test_loss: 1.1848, test_f1: 0.5486
 epoch: 31, train_loss: 0.7350, test_loss: 1.2243, test_f1: 0.4821
 epoch: 32, train_loss: 0.7354, test_loss: 1.2345, test_f1: 0.5150
 epoch: 33, train_loss: 0.7223, test_loss: 1.2645, test_f1: 0.5279
 epoch: 34, train_loss: 0.7221, test_loss: 1.2049, test_f1: 0.5293
 epoch: 35, train_loss: 0.7064, test_loss: 1.2327, test_f1: 0.5228
 epoch: 36, train_loss: 0.7043, test_loss: 1.1433, test_f1: 0.5010
 epoch: 37, train_loss: 0.6857, test_loss: 1.2370, test_f1: 0.5257
 epoch: 38, train_loss: 0.6841, test_loss: 1.1335, test_f1: 0.5418
 epoch: 39, train_loss: 0.6650, test_loss: 1.1913, test_f1: 0.5347
 epoch: 40, train_loss: 0.6717, test_loss: 1.2003, test_f1: 0.5352
 epoch: 41, train_loss: 0.6588, test_loss: 1.4090, test_f1: 0.5454
 epoch: 42, train_loss: 0.6663, test_loss: 1.1620, test_f1: 0.5234
 epoch: 43, train_loss: 0.6764, test_loss: 1.1546, test_f1: 0.5489
 epoch: 44, train_loss: 0.6704, test_loss: 1.2388, test_f1: 0.5488
 epoch: 45, train_loss: 0.6473, test_loss: 1.3023, test_f1: 0.5283
 epoch: 46, train_loss: 0.6531, test_loss: 1.4006, test_f1: 0.5248
 epoch: 47, train_loss: 0.6474, test_loss: 1.1936, test_f1: 0.5145
 epoch: 48, train_loss: 0.6212, test_loss: 1.2028, test_f1: 0.5267
 epoch: 49, train_loss: 0.6348, test_loss: 1.2810, test_f1: 0.5627
 epoch: 50, train_loss: 0.6110, test_loss: 1.2870, test_f1: 0.5043
 epoch: 51, train_loss: 0.5757, test_loss: 1.3268, test_f1: 0.5507
 epoch: 52, train_loss: 0.5747, test_loss: 1.3275, test_f1: 0.5238
 epoch: 53, train_loss: 0.5728, test_loss: 1.2556, test_f1: 0.5422
 epoch: 54, train_loss: 0.5587, test_loss: 1.3403, test_f1: 0.5197
 epoch: 55, train_loss: 0.5352, test_loss: 1.2965, test_f1: 0.5613
 epoch: 56, train_loss: 0.5436, test_loss: 1.3689, test_f1: 0.5592
 epoch: 57, train_loss: 0.5493, test_loss: 1.4711, test_f1: 0.5300
 epoch: 58, train_loss: 0.5369, test_loss: 1.3835, test_f1: 0.5440
 epoch: 59, train_loss: 0.5452, test_loss: 1.4198, test_f1: 0.5608
 epoch: 60, train_loss: 0.5452, test_loss: 1.3570, test_f1: 0.5536
 epoch: 61, train_loss: 0.5178, test_loss: 1.4897, test_f1: 0.5367
 epoch: 62, train_loss: 0.5372, test_loss: 1.4086, test_f1: 0.5283
 epoch: 63, train_loss: 0.5180, test_loss: 1.4016, test_f1: 0.5280
 epoch: 64, train_loss: 0.5190, test_loss: 1.4997, test_f1: 0.5190
 epoch: 65, train_loss: 0.5148, test_loss: 1.3762, test_f1: 0.5491
 epoch: 66, train_loss: 0.5016, test_loss: 1.5193, test_f1: 0.5257
 epoch: 67, train_loss: 0.5125, test_loss: 1.4505, test_f1: 0.5429
 epoch: 68, train_loss: 0.5246, test_loss: 1.4959, test_f1: 0.5060
 epoch: 69, train_loss: 0.5097, test_loss: 1.6149, test_f1: 0.5123
 epoch: 70, train_loss: 0.4956, test_loss: 1.4347, test_f1: 0.5461
 epoch: 71, train_loss: 0.4905, test_loss: 1.5538, test_f1: 0.5062
 epoch: 72, train_loss: 0.4974, test_loss: 1.6323, test_f1: 0.5139
 epoch: 73, train_loss: 0.4807, test_loss: 1.4675, test_f1: 0.5678
 epoch: 74, train_loss: 0.4744, test_loss: 1.5788, test_f1: 0.5183
 epoch: 75, train_loss: 0.4792, test_loss: 1.6664, test_f1: 0.5051
 epoch: 76, train_loss: 0.4762, test_loss: 1.5799, test_f1: 0.5143
 epoch: 77, train_loss: 0.4766, test_loss: 1.5787, test_f1: 0.5151
 epoch: 78, train_loss: 0.4765, test_loss: 1.8039, test_f1: 0.5047
 epoch: 79, train_loss: 0.4747, test_loss: 1.6044, test_f1: 0.5291
 epoch: 80, train_loss: 0.4722, test_loss: 1.5545, test_f1: 0.5499
 epoch: 81, train_loss: 0.4624, test_loss: 1.7157, test_f1: 0.5063
 epoch: 82, train_loss: 0.4692, test_loss: 1.6741, test_f1: 0.5443
 epoch: 83, train_loss: 0.4501, test_loss: 1.6471, test_f1: 0.5310
 epoch: 84, train_loss: 0.4511, test_loss: 1.7324, test_f1: 0.5280
 epoch: 85, train_loss: 0.4602, test_loss: 1.6469, test_f1: 0.5456
 epoch: 86, train_loss: 0.4604, test_loss: 1.7095, test_f1: 0.5157
 epoch: 87, train_loss: 0.4633, test_loss: 1.6717, test_f1: 0.5060
 epoch: 88, train_loss: 0.4356, test_loss: 1.6906, test_f1: 0.5504
 epoch: 89, train_loss: 0.4428, test_loss: 1.7200, test_f1: 0.5284
 epoch: 90, train_loss: 0.4319, test_loss: 1.6762, test_f1: 0.5188
 epoch: 91, train_loss: 0.4478, test_loss: 1.6498, test_f1: 0.5324
 epoch: 92, train_loss: 0.4351, test_loss: 1.7763, test_f1: 0.5203
 epoch: 93, train_loss: 0.4425, test_loss: 1.7358, test_f1: 0.5415
 epoch: 94, train_loss: 0.4226, test_loss: 1.7184, test_f1: 0.5456
 epoch: 95, train_loss: 0.3978, test_loss: 1.6788, test_f1: 0.5359
 epoch: 96, train_loss: 0.4248, test_loss: 1.7936, test_f1: 0.5464
 epoch: 97, train_loss: 0.4357, test_loss: 1.8867, test_f1: 0.5167
 epoch: 98, train_loss: 0.4016, test_loss: 1.7071, test_f1: 0.5133
 epoch: 99, train_loss: 0.4040, test_loss: 1.6794, test_f1: 0.5344
##################ITERATION #1 ****************************************
 epoch: 0, train_loss: 1.2729, test_loss: 1.2096, test_f1: 0.2992
 epoch: 1, train_loss: 1.1579, test_loss: 1.1025, test_f1: 0.4594
 epoch: 2, train_loss: 1.1059, test_loss: 1.0616, test_f1: 0.4478
 epoch: 3, train_loss: 1.0648, test_loss: 1.0135, test_f1: 0.4476
 epoch: 4, train_loss: 1.0308, test_loss: 0.9923, test_f1: 0.4733
 epoch: 5, train_loss: 1.0070, test_loss: 0.9719, test_f1: 0.4731
 epoch: 6, train_loss: 0.9794, test_loss: 0.9575, test_f1: 0.5127
 epoch: 7, train_loss: 0.9539, test_loss: 0.9636, test_f1: 0.5139
 epoch: 8, train_loss: 0.9417, test_loss: 0.9263, test_f1: 0.5238
 epoch: 9, train_loss: 0.9173, test_loss: 0.9246, test_f1: 0.5382
 epoch: 10, train_loss: 0.9191, test_loss: 0.9839, test_f1: 0.5401
 epoch: 11, train_loss: 0.9001, test_loss: 0.9643, test_f1: 0.5615
 epoch: 12, train_loss: 0.8917, test_loss: 1.0235, test_f1: 0.5197
 epoch: 13, train_loss: 0.8741, test_loss: 1.0038, test_f1: 0.5262
 epoch: 14, train_loss: 0.8567, test_loss: 0.8931, test_f1: 0.5465
 epoch: 15, train_loss: 0.8533, test_loss: 0.9383, test_f1: 0.5357
 epoch: 16, train_loss: 0.8381, test_loss: 0.9559, test_f1: 0.5356
 epoch: 17, train_loss: 0.8215, test_loss: 0.9788, test_f1: 0.4925
 epoch: 18, train_loss: 0.8165, test_loss: 0.9572, test_f1: 0.5460
 epoch: 19, train_loss: 0.8000, test_loss: 0.9797, test_f1: 0.5141
 epoch: 20, train_loss: 0.7842, test_loss: 0.9632, test_f1: 0.5428
 epoch: 21, train_loss: 0.7861, test_loss: 0.9427, test_f1: 0.5555
 epoch: 22, train_loss: 0.7700, test_loss: 1.0332, test_f1: 0.5547
 epoch: 23, train_loss: 0.7596, test_loss: 1.0494, test_f1: 0.5213
 epoch: 24, train_loss: 0.7512, test_loss: 1.0289, test_f1: 0.5567
 epoch: 25, train_loss: 0.7540, test_loss: 1.0086, test_f1: 0.5490
 epoch: 26, train_loss: 0.7465, test_loss: 1.0053, test_f1: 0.5284
 epoch: 27, train_loss: 0.7479, test_loss: 0.9503, test_f1: 0.5517
 epoch: 28, train_loss: 0.7287, test_loss: 0.9988, test_f1: 0.5591
 epoch: 29, train_loss: 0.7098, test_loss: 0.9373, test_f1: 0.5743
 epoch: 30, train_loss: 0.7181, test_loss: 1.0792, test_f1: 0.5409
 epoch: 31, train_loss: 0.6888, test_loss: 1.0480, test_f1: 0.5456
 epoch: 32, train_loss: 0.6969, test_loss: 0.9843, test_f1: 0.5432
 epoch: 33, train_loss: 0.6829, test_loss: 1.1456, test_f1: 0.5320
 epoch: 34, train_loss: 0.6762, test_loss: 0.9202, test_f1: 0.5627
 epoch: 35, train_loss: 0.6708, test_loss: 1.1057, test_f1: 0.5305
 epoch: 36, train_loss: 0.6805, test_loss: 1.0232, test_f1: 0.5603
 epoch: 37, train_loss: 0.6730, test_loss: 1.0429, test_f1: 0.5459
 epoch: 38, train_loss: 0.6535, test_loss: 1.0329, test_f1: 0.5713
 epoch: 39, train_loss: 0.6207, test_loss: 1.0394, test_f1: 0.5708
 epoch: 40, train_loss: 0.6249, test_loss: 1.1172, test_f1: 0.5279
 epoch: 41, train_loss: 0.6223, test_loss: 1.0095, test_f1: 0.5707
 epoch: 42, train_loss: 0.6085, test_loss: 1.2289, test_f1: 0.5317
 epoch: 43, train_loss: 0.6252, test_loss: 1.1918, test_f1: 0.5469
 epoch: 44, train_loss: 0.6238, test_loss: 1.0765, test_f1: 0.5402
 epoch: 45, train_loss: 0.6221, test_loss: 1.1362, test_f1: 0.5776
 epoch: 46, train_loss: 0.5862, test_loss: 1.1468, test_f1: 0.5425
 epoch: 47, train_loss: 0.5957, test_loss: 1.0739, test_f1: 0.5686
 epoch: 48, train_loss: 0.6056, test_loss: 1.1522, test_f1: 0.5580
 epoch: 49, train_loss: 0.5996, test_loss: 1.1449, test_f1: 0.5627
 epoch: 50, train_loss: 0.5868, test_loss: 1.1797, test_f1: 0.5526
 epoch: 51, train_loss: 0.5541, test_loss: 1.1029, test_f1: 0.5886
 epoch: 52, train_loss: 0.5408, test_loss: 1.0776, test_f1: 0.5852
 epoch: 53, train_loss: 0.5108, test_loss: 1.1744, test_f1: 0.5551
 epoch: 54, train_loss: 0.5126, test_loss: 1.2663, test_f1: 0.5313
 epoch: 55, train_loss: 0.5189, test_loss: 1.1580, test_f1: 0.5815
 epoch: 56, train_loss: 0.5030, test_loss: 1.1917, test_f1: 0.5824
 epoch: 57, train_loss: 0.4977, test_loss: 1.2542, test_f1: 0.5497
 epoch: 58, train_loss: 0.5034, test_loss: 1.2482, test_f1: 0.5515
 epoch: 59, train_loss: 0.4896, test_loss: 1.2530, test_f1: 0.5524
 epoch: 60, train_loss: 0.4911, test_loss: 1.2984, test_f1: 0.5434
 epoch: 61, train_loss: 0.4812, test_loss: 1.3237, test_f1: 0.5711
 epoch: 62, train_loss: 0.4704, test_loss: 1.3523, test_f1: 0.5312
 epoch: 63, train_loss: 0.4909, test_loss: 1.2594, test_f1: 0.5625
 epoch: 64, train_loss: 0.4833, test_loss: 1.3262, test_f1: 0.5754
 epoch: 65, train_loss: 0.4704, test_loss: 1.3520, test_f1: 0.5470
 epoch: 66, train_loss: 0.4657, test_loss: 1.3083, test_f1: 0.5428
 epoch: 67, train_loss: 0.4623, test_loss: 1.3911, test_f1: 0.5314
 epoch: 68, train_loss: 0.4534, test_loss: 1.4236, test_f1: 0.5363
 epoch: 69, train_loss: 0.4555, test_loss: 1.3789, test_f1: 0.5552
 epoch: 70, train_loss: 0.4509, test_loss: 1.2478, test_f1: 0.5863
 epoch: 71, train_loss: 0.4535, test_loss: 1.3745, test_f1: 0.5418
 epoch: 72, train_loss: 0.4333, test_loss: 1.4439, test_f1: 0.5216
 epoch: 73, train_loss: 0.4405, test_loss: 1.3555, test_f1: 0.5867
 epoch: 74, train_loss: 0.4551, test_loss: 1.2719, test_f1: 0.5635
 epoch: 75, train_loss: 0.4663, test_loss: 1.5425, test_f1: 0.5244
 epoch: 76, train_loss: 0.4430, test_loss: 1.4090, test_f1: 0.5433
 epoch: 77, train_loss: 0.4333, test_loss: 1.3511, test_f1: 0.5691
 epoch: 78, train_loss: 0.4239, test_loss: 1.5318, test_f1: 0.5423
 epoch: 79, train_loss: 0.4234, test_loss: 1.5328, test_f1: 0.5385
 epoch: 80, train_loss: 0.4060, test_loss: 1.6162, test_f1: 0.5549
 epoch: 81, train_loss: 0.4154, test_loss: 1.4131, test_f1: 0.5657
 epoch: 82, train_loss: 0.4116, test_loss: 1.4498, test_f1: 0.5759
 epoch: 83, train_loss: 0.4107, test_loss: 1.4872, test_f1: 0.5933
 epoch: 84, train_loss: 0.4308, test_loss: 1.4493, test_f1: 0.5583
 epoch: 85, train_loss: 0.4131, test_loss: 1.6189, test_f1: 0.5292
 epoch: 86, train_loss: 0.3847, test_loss: 1.5688, test_f1: 0.5776
 epoch: 87, train_loss: 0.4095, test_loss: 1.4428, test_f1: 0.5650
 epoch: 88, train_loss: 0.4008, test_loss: 1.5751, test_f1: 0.5661
 epoch: 89, train_loss: 0.3870, test_loss: 1.7971, test_f1: 0.5195
 epoch: 90, train_loss: 0.3912, test_loss: 1.6625, test_f1: 0.5356
 epoch: 91, train_loss: 0.3810, test_loss: 1.6180, test_f1: 0.5510
 epoch: 92, train_loss: 0.3961, test_loss: 1.5780, test_f1: 0.5610
 epoch: 93, train_loss: 0.3838, test_loss: 1.4915, test_f1: 0.5473
 epoch: 94, train_loss: 0.4011, test_loss: 1.7658, test_f1: 0.5266
 epoch: 95, train_loss: 0.3805, test_loss: 1.6451, test_f1: 0.5366
 epoch: 96, train_loss: 0.3770, test_loss: 1.7869, test_f1: 0.5238
 epoch: 97, train_loss: 0.3867, test_loss: 1.7051, test_f1: 0.5499
 epoch: 98, train_loss: 0.3826, test_loss: 1.6792, test_f1: 0.5584
 epoch: 99, train_loss: 0.3943, test_loss: 1.4885, test_f1: 0.5730
##################ITERATION #2 ****************************************
 epoch: 0, train_loss: 1.3003, test_loss: 1.2225, test_f1: 0.3179
 epoch: 1, train_loss: 1.1670, test_loss: 1.1301, test_f1: 0.4943
 epoch: 2, train_loss: 1.1264, test_loss: 1.0658, test_f1: 0.4954
 epoch: 3, train_loss: 1.0914, test_loss: 1.0497, test_f1: 0.4486
 epoch: 4, train_loss: 1.0587, test_loss: 1.0209, test_f1: 0.4826
 epoch: 5, train_loss: 1.0384, test_loss: 0.9854, test_f1: 0.4853
 epoch: 6, train_loss: 0.9986, test_loss: 0.9985, test_f1: 0.4992
 epoch: 7, train_loss: 0.9942, test_loss: 0.9836, test_f1: 0.4615
 epoch: 8, train_loss: 0.9703, test_loss: 0.9812, test_f1: 0.4740
 epoch: 9, train_loss: 0.9661, test_loss: 0.9888, test_f1: 0.5009
 epoch: 10, train_loss: 0.9465, test_loss: 0.9729, test_f1: 0.4951
 epoch: 11, train_loss: 0.9220, test_loss: 0.9731, test_f1: 0.5177
 epoch: 12, train_loss: 0.9176, test_loss: 1.0034, test_f1: 0.4909
 epoch: 13, train_loss: 0.9022, test_loss: 0.9814, test_f1: 0.5097
 epoch: 14, train_loss: 0.8769, test_loss: 1.0783, test_f1: 0.4508
 epoch: 15, train_loss: 0.8856, test_loss: 0.9515, test_f1: 0.5138
 epoch: 16, train_loss: 0.8741, test_loss: 1.0335, test_f1: 0.4965
 epoch: 17, train_loss: 0.8609, test_loss: 1.0382, test_f1: 0.5154
 epoch: 18, train_loss: 0.8500, test_loss: 0.9698, test_f1: 0.5603
 epoch: 19, train_loss: 0.8298, test_loss: 0.9384, test_f1: 0.5548
 epoch: 20, train_loss: 0.8176, test_loss: 1.0316, test_f1: 0.5019
 epoch: 21, train_loss: 0.8256, test_loss: 1.0101, test_f1: 0.5017
 epoch: 22, train_loss: 0.8039, test_loss: 1.2090, test_f1: 0.4776
 epoch: 23, train_loss: 0.8148, test_loss: 1.0837, test_f1: 0.4965
 epoch: 24, train_loss: 0.8057, test_loss: 1.1570, test_f1: 0.4869
 epoch: 25, train_loss: 0.7938, test_loss: 1.0246, test_f1: 0.5200
 epoch: 26, train_loss: 0.7779, test_loss: 1.1039, test_f1: 0.5015
 epoch: 27, train_loss: 0.7752, test_loss: 1.0634, test_f1: 0.5111
 epoch: 28, train_loss: 0.7474, test_loss: 1.1329, test_f1: 0.5420
 epoch: 29, train_loss: 0.7544, test_loss: 1.0284, test_f1: 0.5209
 epoch: 30, train_loss: 0.7536, test_loss: 1.1058, test_f1: 0.5330
 epoch: 31, train_loss: 0.7415, test_loss: 1.1202, test_f1: 0.5677
 epoch: 32, train_loss: 0.7460, test_loss: 1.1178, test_f1: 0.5382
 epoch: 33, train_loss: 0.7288, test_loss: 1.0209, test_f1: 0.5472
 epoch: 34, train_loss: 0.7235, test_loss: 1.1679, test_f1: 0.5138
 epoch: 35, train_loss: 0.7445, test_loss: 1.0312, test_f1: 0.5585
 epoch: 36, train_loss: 0.7271, test_loss: 1.1921, test_f1: 0.5423
 epoch: 37, train_loss: 0.7296, test_loss: 1.1226, test_f1: 0.5310
 epoch: 38, train_loss: 0.7199, test_loss: 1.0961, test_f1: 0.5481
 epoch: 39, train_loss: 0.6943, test_loss: 1.1060, test_f1: 0.5449
 epoch: 40, train_loss: 0.6623, test_loss: 1.0615, test_f1: 0.5860
 epoch: 41, train_loss: 0.6798, test_loss: 1.1691, test_f1: 0.5185
 epoch: 42, train_loss: 0.6584, test_loss: 1.2518, test_f1: 0.5307
 epoch: 43, train_loss: 0.6560, test_loss: 1.2389, test_f1: 0.5441
 epoch: 44, train_loss: 0.6466, test_loss: 1.3424, test_f1: 0.5672
 epoch: 45, train_loss: 0.6492, test_loss: 1.1385, test_f1: 0.5380
 epoch: 46, train_loss: 0.6550, test_loss: 1.1180, test_f1: 0.5598
 epoch: 47, train_loss: 0.6223, test_loss: 1.1846, test_f1: 0.5530
 epoch: 48, train_loss: 0.6432, test_loss: 1.2485, test_f1: 0.5305
 epoch: 49, train_loss: 0.6420, test_loss: 1.2372, test_f1: 0.5140
 epoch: 50, train_loss: 0.6306, test_loss: 1.2904, test_f1: 0.5313
 epoch: 51, train_loss: 0.5805, test_loss: 1.1642, test_f1: 0.5655
 epoch: 52, train_loss: 0.5788, test_loss: 1.2283, test_f1: 0.5784
 epoch: 53, train_loss: 0.5789, test_loss: 1.2536, test_f1: 0.5406
 epoch: 54, train_loss: 0.5562, test_loss: 1.1831, test_f1: 0.5482
 epoch: 55, train_loss: 0.5531, test_loss: 1.2384, test_f1: 0.5785
 epoch: 56, train_loss: 0.5590, test_loss: 1.2258, test_f1: 0.5737
 epoch: 57, train_loss: 0.5615, test_loss: 1.2771, test_f1: 0.5349
 epoch: 58, train_loss: 0.5442, test_loss: 1.2864, test_f1: 0.5507
 epoch: 59, train_loss: 0.5392, test_loss: 1.2693, test_f1: 0.5497
 epoch: 60, train_loss: 0.5366, test_loss: 1.3728, test_f1: 0.5268
 epoch: 61, train_loss: 0.5524, test_loss: 1.3568, test_f1: 0.5383
 epoch: 62, train_loss: 0.5425, test_loss: 1.3561, test_f1: 0.5562
 epoch: 63, train_loss: 0.5392, test_loss: 1.2934, test_f1: 0.5498
 epoch: 64, train_loss: 0.5258, test_loss: 1.3798, test_f1: 0.5377
 epoch: 65, train_loss: 0.5144, test_loss: 1.3282, test_f1: 0.5610
 epoch: 66, train_loss: 0.4977, test_loss: 1.3858, test_f1: 0.5604
 epoch: 67, train_loss: 0.5186, test_loss: 1.3383, test_f1: 0.5407
 epoch: 68, train_loss: 0.5006, test_loss: 1.4174, test_f1: 0.5482
 epoch: 69, train_loss: 0.5026, test_loss: 1.3318, test_f1: 0.5588
 epoch: 70, train_loss: 0.5150, test_loss: 1.3416, test_f1: 0.5739
 epoch: 71, train_loss: 0.4986, test_loss: 1.4723, test_f1: 0.5550
 epoch: 72, train_loss: 0.5140, test_loss: 1.4730, test_f1: 0.5537
 epoch: 73, train_loss: 0.5108, test_loss: 1.4462, test_f1: 0.5625
 epoch: 74, train_loss: 0.4966, test_loss: 1.4870, test_f1: 0.5432
 epoch: 75, train_loss: 0.4780, test_loss: 1.3664, test_f1: 0.5752
 epoch: 76, train_loss: 0.4903, test_loss: 1.4872, test_f1: 0.5486
 epoch: 77, train_loss: 0.4740, test_loss: 1.5736, test_f1: 0.5263
 epoch: 78, train_loss: 0.4871, test_loss: 1.4089, test_f1: 0.5696
 epoch: 79, train_loss: 0.4958, test_loss: 1.4231, test_f1: 0.5553
 epoch: 80, train_loss: 0.4841, test_loss: 1.4257, test_f1: 0.5524
 epoch: 81, train_loss: 0.4760, test_loss: 1.4908, test_f1: 0.5295
 epoch: 82, train_loss: 0.4906, test_loss: 1.4620, test_f1: 0.5563
 epoch: 83, train_loss: 0.4561, test_loss: 1.5172, test_f1: 0.5564
 epoch: 84, train_loss: 0.4657, test_loss: 1.5676, test_f1: 0.5389
 epoch: 85, train_loss: 0.4783, test_loss: 1.3882, test_f1: 0.5665
 epoch: 86, train_loss: 0.4813, test_loss: 1.4954, test_f1: 0.5737
 epoch: 87, train_loss: 0.4859, test_loss: 1.5044, test_f1: 0.5775
 epoch: 88, train_loss: 0.4614, test_loss: 1.5286, test_f1: 0.5600
 epoch: 89, train_loss: 0.4505, test_loss: 1.5583, test_f1: 0.5387
 epoch: 90, train_loss: 0.4393, test_loss: 1.5160, test_f1: 0.5464
 epoch: 91, train_loss: 0.4529, test_loss: 1.5730, test_f1: 0.5758
 epoch: 92, train_loss: 0.4542, test_loss: 1.8626, test_f1: 0.5265
 epoch: 93, train_loss: 0.4701, test_loss: 1.7770, test_f1: 0.5476
 epoch: 94, train_loss: 0.4566, test_loss: 1.4499, test_f1: 0.5867
 epoch: 95, train_loss: 0.4402, test_loss: 1.6023, test_f1: 0.5520
 epoch: 96, train_loss: 0.4278, test_loss: 1.5142, test_f1: 0.5766
 epoch: 97, train_loss: 0.4267, test_loss: 1.6867, test_f1: 0.5391
 epoch: 98, train_loss: 0.4358, test_loss: 1.7142, test_f1: 0.5546
 epoch: 99, train_loss: 0.4331, test_loss: 1.6030, test_f1: 0.5480
##################ITERATION #3 ****************************************
 epoch: 0, train_loss: 1.3330, test_loss: 1.1863, test_f1: 0.3298
 epoch: 1, train_loss: 1.1688, test_loss: 1.0662, test_f1: 0.4866
 epoch: 2, train_loss: 1.1125, test_loss: 1.0358, test_f1: 0.4776
 epoch: 3, train_loss: 1.0763, test_loss: 1.0096, test_f1: 0.4345
 epoch: 4, train_loss: 1.0562, test_loss: 0.9953, test_f1: 0.4842
 epoch: 5, train_loss: 1.0301, test_loss: 0.9900, test_f1: 0.5048
 epoch: 6, train_loss: 1.0168, test_loss: 0.9719, test_f1: 0.5041
 epoch: 7, train_loss: 0.9961, test_loss: 0.9367, test_f1: 0.5247
 epoch: 8, train_loss: 0.9625, test_loss: 0.9290, test_f1: 0.5296
 epoch: 9, train_loss: 0.9615, test_loss: 0.9734, test_f1: 0.5257
 epoch: 10, train_loss: 0.9491, test_loss: 0.9983, test_f1: 0.5292
 epoch: 11, train_loss: 0.9372, test_loss: 0.9590, test_f1: 0.5291
 epoch: 12, train_loss: 0.9140, test_loss: 0.9637, test_f1: 0.5139
 epoch: 13, train_loss: 0.9070, test_loss: 0.9405, test_f1: 0.5292
 epoch: 14, train_loss: 0.8974, test_loss: 0.9745, test_f1: 0.5350
 epoch: 15, train_loss: 0.8830, test_loss: 0.9973, test_f1: 0.5168
 epoch: 16, train_loss: 0.8759, test_loss: 0.9099, test_f1: 0.5446
 epoch: 17, train_loss: 0.8746, test_loss: 0.9467, test_f1: 0.5090
 epoch: 18, train_loss: 0.8589, test_loss: 1.0573, test_f1: 0.4956
 epoch: 19, train_loss: 0.8553, test_loss: 0.9471, test_f1: 0.5664
 epoch: 20, train_loss: 0.8351, test_loss: 1.0222, test_f1: 0.5335
 epoch: 21, train_loss: 0.8462, test_loss: 0.9955, test_f1: 0.5197
 epoch: 22, train_loss: 0.8246, test_loss: 0.9529, test_f1: 0.5264
 epoch: 23, train_loss: 0.8096, test_loss: 1.1027, test_f1: 0.5339
 epoch: 24, train_loss: 0.8058, test_loss: 1.0256, test_f1: 0.5143
 epoch: 25, train_loss: 0.8148, test_loss: 1.0016, test_f1: 0.5425
 epoch: 26, train_loss: 0.7935, test_loss: 1.0560, test_f1: 0.5339
 epoch: 27, train_loss: 0.7786, test_loss: 1.0432, test_f1: 0.5383
 epoch: 28, train_loss: 0.7786, test_loss: 1.0182, test_f1: 0.5134
 epoch: 29, train_loss: 0.7826, test_loss: 1.0290, test_f1: 0.5238
 epoch: 30, train_loss: 0.7712, test_loss: 1.0100, test_f1: 0.5407
 epoch: 31, train_loss: 0.7585, test_loss: 1.0435, test_f1: 0.5286
 epoch: 32, train_loss: 0.7461, test_loss: 1.0713, test_f1: 0.5081
 epoch: 33, train_loss: 0.7565, test_loss: 1.0498, test_f1: 0.5335
 epoch: 34, train_loss: 0.7573, test_loss: 1.0667, test_f1: 0.4962
 epoch: 35, train_loss: 0.7476, test_loss: 1.0488, test_f1: 0.5294
 epoch: 36, train_loss: 0.7460, test_loss: 1.1381, test_f1: 0.5155
 epoch: 37, train_loss: 0.7124, test_loss: 1.0598, test_f1: 0.5392
 epoch: 38, train_loss: 0.7077, test_loss: 1.0942, test_f1: 0.5264
 epoch: 39, train_loss: 0.7104, test_loss: 1.0846, test_f1: 0.5358
 epoch: 40, train_loss: 0.7200, test_loss: 1.0720, test_f1: 0.5474
 epoch: 41, train_loss: 0.7173, test_loss: 1.1270, test_f1: 0.5404
 epoch: 42, train_loss: 0.6976, test_loss: 1.1272, test_f1: 0.5298
 epoch: 43, train_loss: 0.7066, test_loss: 1.0973, test_f1: 0.5522
 epoch: 44, train_loss: 0.6893, test_loss: 1.1466, test_f1: 0.5137
 epoch: 45, train_loss: 0.6823, test_loss: 1.1220, test_f1: 0.5414
 epoch: 46, train_loss: 0.6849, test_loss: 1.1288, test_f1: 0.5314
 epoch: 47, train_loss: 0.6854, test_loss: 1.1872, test_f1: 0.5228
 epoch: 48, train_loss: 0.6748, test_loss: 1.0698, test_f1: 0.5169
 epoch: 49, train_loss: 0.6608, test_loss: 1.0979, test_f1: 0.5118
 epoch: 50, train_loss: 0.6742, test_loss: 1.2149, test_f1: 0.5019
 epoch: 51, train_loss: 0.6501, test_loss: 1.1289, test_f1: 0.5298
 epoch: 52, train_loss: 0.6348, test_loss: 1.1607, test_f1: 0.5195
 epoch: 53, train_loss: 0.6007, test_loss: 1.1998, test_f1: 0.5171
 epoch: 54, train_loss: 0.5969, test_loss: 1.2151, test_f1: 0.5248
 epoch: 55, train_loss: 0.6091, test_loss: 1.2438, test_f1: 0.5136
 epoch: 56, train_loss: 0.6026, test_loss: 1.1827, test_f1: 0.5416
 epoch: 57, train_loss: 0.5987, test_loss: 1.2000, test_f1: 0.5125
 epoch: 58, train_loss: 0.5828, test_loss: 1.2089, test_f1: 0.5073
 epoch: 59, train_loss: 0.5771, test_loss: 1.2357, test_f1: 0.5076
 epoch: 60, train_loss: 0.5912, test_loss: 1.2550, test_f1: 0.5212
 epoch: 61, train_loss: 0.6031, test_loss: 1.2281, test_f1: 0.5135
 epoch: 62, train_loss: 0.5911, test_loss: 1.2409, test_f1: 0.5130
 epoch: 63, train_loss: 0.5801, test_loss: 1.2649, test_f1: 0.5052
 epoch: 64, train_loss: 0.5831, test_loss: 1.2287, test_f1: 0.5230
 epoch: 65, train_loss: 0.5679, test_loss: 1.2053, test_f1: 0.5335
 epoch: 66, train_loss: 0.5687, test_loss: 1.2924, test_f1: 0.5044
 epoch: 67, train_loss: 0.5659, test_loss: 1.2235, test_f1: 0.5125
 epoch: 68, train_loss: 0.5671, test_loss: 1.2279, test_f1: 0.5227
 epoch: 69, train_loss: 0.5585, test_loss: 1.3355, test_f1: 0.4907
 epoch: 70, train_loss: 0.5481, test_loss: 1.3053, test_f1: 0.5080
 epoch: 71, train_loss: 0.5531, test_loss: 1.4043, test_f1: 0.4989
 epoch: 72, train_loss: 0.5475, test_loss: 1.3676, test_f1: 0.5040
 epoch: 73, train_loss: 0.5484, test_loss: 1.5025, test_f1: 0.5041
 epoch: 74, train_loss: 0.5324, test_loss: 1.4412, test_f1: 0.4833
 epoch: 75, train_loss: 0.5323, test_loss: 1.4150, test_f1: 0.4993
 epoch: 76, train_loss: 0.5164, test_loss: 1.3980, test_f1: 0.5143
 epoch: 77, train_loss: 0.5219, test_loss: 1.2999, test_f1: 0.5157
 epoch: 78, train_loss: 0.5326, test_loss: 1.4511, test_f1: 0.5128
 epoch: 79, train_loss: 0.5453, test_loss: 1.4337, test_f1: 0.5178
 epoch: 80, train_loss: 0.5136, test_loss: 1.3482, test_f1: 0.5074
 epoch: 81, train_loss: 0.5384, test_loss: 1.4120, test_f1: 0.4896
 epoch: 82, train_loss: 0.5434, test_loss: 1.3604, test_f1: 0.5177
 epoch: 83, train_loss: 0.5338, test_loss: 1.3980, test_f1: 0.5081
 epoch: 84, train_loss: 0.5230, test_loss: 1.4404, test_f1: 0.5191
 epoch: 85, train_loss: 0.5147, test_loss: 1.4813, test_f1: 0.5054
 epoch: 86, train_loss: 0.5230, test_loss: 1.4592, test_f1: 0.5041
 epoch: 87, train_loss: 0.4951, test_loss: 1.4203, test_f1: 0.5104
 epoch: 88, train_loss: 0.5018, test_loss: 1.4700, test_f1: 0.5150
 epoch: 89, train_loss: 0.4961, test_loss: 1.3907, test_f1: 0.5106
 epoch: 90, train_loss: 0.4794, test_loss: 1.3928, test_f1: 0.5146
 epoch: 91, train_loss: 0.4924, test_loss: 1.4756, test_f1: 0.5176
 epoch: 92, train_loss: 0.5014, test_loss: 1.3273, test_f1: 0.5439
 epoch: 93, train_loss: 0.4926, test_loss: 1.3658, test_f1: 0.4988
 epoch: 94, train_loss: 0.5083, test_loss: 1.4517, test_f1: 0.5046
 epoch: 95, train_loss: 0.5051, test_loss: 1.3045, test_f1: 0.5244
 epoch: 96, train_loss: 0.4838, test_loss: 1.4685, test_f1: 0.5051
 epoch: 97, train_loss: 0.4748, test_loss: 1.3981, test_f1: 0.5075
 epoch: 98, train_loss: 0.4754, test_loss: 1.5108, test_f1: 0.5071
 epoch: 99, train_loss: 0.4750, test_loss: 1.5081, test_f1: 0.4969
##################ITERATION #4 ****************************************
 epoch: 0, train_loss: 1.4501, test_loss: 1.2013, test_f1: 0.3528
 epoch: 1, train_loss: 1.1664, test_loss: 1.1135, test_f1: 0.4374
 epoch: 2, train_loss: 1.1264, test_loss: 1.0576, test_f1: 0.4474
 epoch: 3, train_loss: 1.0892, test_loss: 1.0625, test_f1: 0.4299
 epoch: 4, train_loss: 1.0746, test_loss: 1.0219, test_f1: 0.4450
 epoch: 5, train_loss: 1.0455, test_loss: 1.0098, test_f1: 0.4953
 epoch: 6, train_loss: 1.0198, test_loss: 0.9711, test_f1: 0.4961
 epoch: 7, train_loss: 1.0046, test_loss: 0.9475, test_f1: 0.4953
 epoch: 8, train_loss: 0.9875, test_loss: 0.9823, test_f1: 0.4672
 epoch: 9, train_loss: 0.9715, test_loss: 0.9658, test_f1: 0.5024
 epoch: 10, train_loss: 0.9591, test_loss: 0.9485, test_f1: 0.4903
 epoch: 11, train_loss: 0.9432, test_loss: 0.9683, test_f1: 0.5190
 epoch: 12, train_loss: 0.9341, test_loss: 0.9773, test_f1: 0.5141
 epoch: 13, train_loss: 0.9187, test_loss: 0.9564, test_f1: 0.5470
 epoch: 14, train_loss: 0.9132, test_loss: 0.9526, test_f1: 0.5324
 epoch: 15, train_loss: 0.9119, test_loss: 0.9574, test_f1: 0.5309
 epoch: 16, train_loss: 0.8928, test_loss: 0.9189, test_f1: 0.5299
 epoch: 17, train_loss: 0.8824, test_loss: 0.9543, test_f1: 0.5302
 epoch: 18, train_loss: 0.8682, test_loss: 0.9805, test_f1: 0.5129
 epoch: 19, train_loss: 0.8718, test_loss: 0.9593, test_f1: 0.5281
 epoch: 20, train_loss: 0.8549, test_loss: 0.9770, test_f1: 0.5713
 epoch: 21, train_loss: 0.8434, test_loss: 0.9381, test_f1: 0.5285
 epoch: 22, train_loss: 0.8325, test_loss: 1.0383, test_f1: 0.5041
 epoch: 23, train_loss: 0.8167, test_loss: 0.9974, test_f1: 0.5359
 epoch: 24, train_loss: 0.8335, test_loss: 1.0064, test_f1: 0.4995
 epoch: 25, train_loss: 0.7993, test_loss: 0.9504, test_f1: 0.5548
 epoch: 26, train_loss: 0.8066, test_loss: 0.9809, test_f1: 0.5435
 epoch: 27, train_loss: 0.7943, test_loss: 1.0283, test_f1: 0.5389
 epoch: 28, train_loss: 0.7877, test_loss: 1.0251, test_f1: 0.5633
 epoch: 29, train_loss: 0.7775, test_loss: 1.0386, test_f1: 0.5384
 epoch: 30, train_loss: 0.7666, test_loss: 1.0323, test_f1: 0.5130
 epoch: 31, train_loss: 0.7721, test_loss: 0.9967, test_f1: 0.5691
 epoch: 32, train_loss: 0.7405, test_loss: 1.0622, test_f1: 0.5393
 epoch: 33, train_loss: 0.7507, test_loss: 1.0423, test_f1: 0.5348
 epoch: 34, train_loss: 0.7376, test_loss: 1.0660, test_f1: 0.5471
 epoch: 35, train_loss: 0.7527, test_loss: 1.1042, test_f1: 0.5159
 epoch: 36, train_loss: 0.7508, test_loss: 1.2230, test_f1: 0.4732
 epoch: 37, train_loss: 0.7273, test_loss: 1.1313, test_f1: 0.5135
 epoch: 38, train_loss: 0.7328, test_loss: 1.0321, test_f1: 0.5401
 epoch: 39, train_loss: 0.6996, test_loss: 1.0651, test_f1: 0.5736
 epoch: 40, train_loss: 0.6994, test_loss: 1.1405, test_f1: 0.5093
 epoch: 41, train_loss: 0.6820, test_loss: 1.1173, test_f1: 0.5324
 epoch: 42, train_loss: 0.6824, test_loss: 1.1332, test_f1: 0.5348
 epoch: 43, train_loss: 0.6835, test_loss: 1.0453, test_f1: 0.5229
 epoch: 44, train_loss: 0.6679, test_loss: 1.1294, test_f1: 0.5459
 epoch: 45, train_loss: 0.6678, test_loss: 1.2354, test_f1: 0.5272
 epoch: 46, train_loss: 0.6726, test_loss: 1.1353, test_f1: 0.5524
 epoch: 47, train_loss: 0.6637, test_loss: 1.1822, test_f1: 0.5229
 epoch: 48, train_loss: 0.6609, test_loss: 1.1072, test_f1: 0.5263
 epoch: 49, train_loss: 0.6706, test_loss: 1.1021, test_f1: 0.5421
 epoch: 50, train_loss: 0.6458, test_loss: 1.1482, test_f1: 0.5628
 epoch: 51, train_loss: 0.6286, test_loss: 1.1271, test_f1: 0.5513
 epoch: 52, train_loss: 0.6006, test_loss: 1.2071, test_f1: 0.5415
 epoch: 53, train_loss: 0.5998, test_loss: 1.1612, test_f1: 0.5618
 epoch: 54, train_loss: 0.6007, test_loss: 1.1690, test_f1: 0.5351
 epoch: 55, train_loss: 0.5893, test_loss: 1.1815, test_f1: 0.5654
 epoch: 56, train_loss: 0.5762, test_loss: 1.2141, test_f1: 0.5344
 epoch: 57, train_loss: 0.5777, test_loss: 1.2341, test_f1: 0.5372
 epoch: 58, train_loss: 0.5739, test_loss: 1.2692, test_f1: 0.5132
 epoch: 59, train_loss: 0.5696, test_loss: 1.2491, test_f1: 0.5354
 epoch: 60, train_loss: 0.5678, test_loss: 1.2229, test_f1: 0.5622
 epoch: 61, train_loss: 0.5547, test_loss: 1.2708, test_f1: 0.5071
 epoch: 62, train_loss: 0.5509, test_loss: 1.2565, test_f1: 0.5333
 epoch: 63, train_loss: 0.5450, test_loss: 1.2533, test_f1: 0.5683
 epoch: 64, train_loss: 0.5646, test_loss: 1.2769, test_f1: 0.5709
 epoch: 65, train_loss: 0.5482, test_loss: 1.3216, test_f1: 0.5362
 epoch: 66, train_loss: 0.5480, test_loss: 1.3360, test_f1: 0.5224
 epoch: 67, train_loss: 0.5271, test_loss: 1.2851, test_f1: 0.5190
 epoch: 68, train_loss: 0.5490, test_loss: 1.2774, test_f1: 0.5207
 epoch: 69, train_loss: 0.5392, test_loss: 1.2861, test_f1: 0.5382
 epoch: 70, train_loss: 0.5418, test_loss: 1.3261, test_f1: 0.5502
 epoch: 71, train_loss: 0.5294, test_loss: 1.3149, test_f1: 0.5219
 epoch: 72, train_loss: 0.5234, test_loss: 1.2458, test_f1: 0.5683
 epoch: 73, train_loss: 0.5244, test_loss: 1.3535, test_f1: 0.5273
 epoch: 74, train_loss: 0.5224, test_loss: 1.2748, test_f1: 0.5478
 epoch: 75, train_loss: 0.5340, test_loss: 1.3570, test_f1: 0.5401
 epoch: 76, train_loss: 0.5020, test_loss: 1.3172, test_f1: 0.5512
 epoch: 77, train_loss: 0.5155, test_loss: 1.4110, test_f1: 0.5378
 epoch: 78, train_loss: 0.4958, test_loss: 1.3024, test_f1: 0.5664
 epoch: 79, train_loss: 0.4948, test_loss: 1.3513, test_f1: 0.5683
 epoch: 80, train_loss: 0.5289, test_loss: 1.4151, test_f1: 0.5502
 epoch: 81, train_loss: 0.5108, test_loss: 1.3309, test_f1: 0.5304
 epoch: 82, train_loss: 0.5256, test_loss: 1.3814, test_f1: 0.5401
 epoch: 83, train_loss: 0.5172, test_loss: 1.3729, test_f1: 0.5504
 epoch: 84, train_loss: 0.4909, test_loss: 1.4363, test_f1: 0.5391
 epoch: 85, train_loss: 0.4867, test_loss: 1.3613, test_f1: 0.5607
 epoch: 86, train_loss: 0.4761, test_loss: 1.4374, test_f1: 0.5427
 epoch: 87, train_loss: 0.5008, test_loss: 1.3650, test_f1: 0.5706
 epoch: 88, train_loss: 0.4841, test_loss: 1.4047, test_f1: 0.5435
 epoch: 89, train_loss: 0.4845, test_loss: 1.4668, test_f1: 0.5173
 epoch: 90, train_loss: 0.4840, test_loss: 1.4177, test_f1: 0.5505
 epoch: 91, train_loss: 0.4784, test_loss: 1.3940, test_f1: 0.5768
 epoch: 92, train_loss: 0.4700, test_loss: 1.5214, test_f1: 0.5801
 epoch: 93, train_loss: 0.4702, test_loss: 1.3674, test_f1: 0.5580
 epoch: 94, train_loss: 0.4675, test_loss: 1.6598, test_f1: 0.5212
 epoch: 95, train_loss: 0.4539, test_loss: 1.3746, test_f1: 0.5474
 epoch: 96, train_loss: 0.4661, test_loss: 1.4767, test_f1: 0.5384
 epoch: 97, train_loss: 0.4599, test_loss: 1.4107, test_f1: 0.5608
 epoch: 98, train_loss: 0.4439, test_loss: 1.4683, test_f1: 0.5845
 epoch: 99, train_loss: 0.4538, test_loss: 1.5609, test_f1: 0.5366
##################ITERATION #5 ****************************************
 epoch: 0, train_loss: 1.5179, test_loss: 1.2382, test_f1: 0.3846
 epoch: 1, train_loss: 1.2372, test_loss: 1.1449, test_f1: 0.4249
 epoch: 2, train_loss: 1.1845, test_loss: 1.0997, test_f1: 0.4922
 epoch: 3, train_loss: 1.1358, test_loss: 1.0780, test_f1: 0.4378
 epoch: 4, train_loss: 1.1115, test_loss: 1.0672, test_f1: 0.4667
 epoch: 5, train_loss: 1.0882, test_loss: 1.0283, test_f1: 0.5078
 epoch: 6, train_loss: 1.0630, test_loss: 1.0625, test_f1: 0.4993
 epoch: 7, train_loss: 1.0349, test_loss: 1.0272, test_f1: 0.4579
 epoch: 8, train_loss: 1.0302, test_loss: 0.9746, test_f1: 0.4937
 epoch: 9, train_loss: 1.0047, test_loss: 0.9846, test_f1: 0.4729
 epoch: 10, train_loss: 0.9946, test_loss: 0.9696, test_f1: 0.4959
 epoch: 11, train_loss: 0.9782, test_loss: 0.9589, test_f1: 0.5269
 epoch: 12, train_loss: 0.9665, test_loss: 0.9431, test_f1: 0.4987
 epoch: 13, train_loss: 0.9540, test_loss: 0.9944, test_f1: 0.4982
 epoch: 14, train_loss: 0.9262, test_loss: 0.9967, test_f1: 0.4944
 epoch: 15, train_loss: 0.9042, test_loss: 1.0828, test_f1: 0.4920
 epoch: 16, train_loss: 0.9119, test_loss: 0.9835, test_f1: 0.5031
 epoch: 17, train_loss: 0.8877, test_loss: 1.0473, test_f1: 0.4873
 epoch: 18, train_loss: 0.8871, test_loss: 1.0016, test_f1: 0.4971
 epoch: 19, train_loss: 0.8826, test_loss: 1.0304, test_f1: 0.4908
 epoch: 20, train_loss: 0.8593, test_loss: 0.9701, test_f1: 0.5145
 epoch: 21, train_loss: 0.8398, test_loss: 1.0147, test_f1: 0.4961
 epoch: 22, train_loss: 0.8291, test_loss: 1.0092, test_f1: 0.5074
 epoch: 23, train_loss: 0.8343, test_loss: 1.0039, test_f1: 0.5269
 epoch: 24, train_loss: 0.8286, test_loss: 1.0317, test_f1: 0.5159
 epoch: 25, train_loss: 0.8275, test_loss: 1.2961, test_f1: 0.4623
 epoch: 26, train_loss: 0.8064, test_loss: 1.0607, test_f1: 0.5131
 epoch: 27, train_loss: 0.8234, test_loss: 1.0035, test_f1: 0.5136
 epoch: 28, train_loss: 0.8027, test_loss: 1.0463, test_f1: 0.5190
 epoch: 29, train_loss: 0.7917, test_loss: 0.9982, test_f1: 0.5144
 epoch: 30, train_loss: 0.7934, test_loss: 1.1558, test_f1: 0.4853
 epoch: 31, train_loss: 0.7700, test_loss: 1.1053, test_f1: 0.5062
 epoch: 32, train_loss: 0.7685, test_loss: 1.0690, test_f1: 0.5237
 epoch: 33, train_loss: 0.7686, test_loss: 1.0491, test_f1: 0.5267
 epoch: 34, train_loss: 0.7558, test_loss: 1.0786, test_f1: 0.5113
 epoch: 35, train_loss: 0.7615, test_loss: 1.0857, test_f1: 0.5036
 epoch: 36, train_loss: 0.7504, test_loss: 1.1263, test_f1: 0.4795
 epoch: 37, train_loss: 0.7670, test_loss: 1.1175, test_f1: 0.5209
 epoch: 38, train_loss: 0.7407, test_loss: 1.1024, test_f1: 0.5225
 epoch: 39, train_loss: 0.7367, test_loss: 1.1147, test_f1: 0.5022
 epoch: 40, train_loss: 0.7304, test_loss: 1.1084, test_f1: 0.5019
 epoch: 41, train_loss: 0.7227, test_loss: 1.1312, test_f1: 0.4890
 epoch: 42, train_loss: 0.7216, test_loss: 1.1309, test_f1: 0.5409
 epoch: 43, train_loss: 0.7040, test_loss: 1.1521, test_f1: 0.5295
 epoch: 44, train_loss: 0.7085, test_loss: 1.1880, test_f1: 0.5140
 epoch: 45, train_loss: 0.6972, test_loss: 1.1675, test_f1: 0.5516
 epoch: 46, train_loss: 0.6934, test_loss: 1.1491, test_f1: 0.5493
 epoch: 47, train_loss: 0.6831, test_loss: 1.1810, test_f1: 0.5098
 epoch: 48, train_loss: 0.6861, test_loss: 1.2713, test_f1: 0.5320
 epoch: 49, train_loss: 0.6929, test_loss: 1.1850, test_f1: 0.5261
 epoch: 50, train_loss: 0.6842, test_loss: 1.1823, test_f1: 0.5155
 epoch: 51, train_loss: 0.6493, test_loss: 1.1331, test_f1: 0.5237
 epoch: 52, train_loss: 0.6320, test_loss: 1.1835, test_f1: 0.5247
 epoch: 53, train_loss: 0.6293, test_loss: 1.1254, test_f1: 0.5611
 epoch: 54, train_loss: 0.6187, test_loss: 1.1896, test_f1: 0.5341
 epoch: 55, train_loss: 0.6097, test_loss: 1.1688, test_f1: 0.5180
 epoch: 56, train_loss: 0.6082, test_loss: 1.1648, test_f1: 0.5292
 epoch: 57, train_loss: 0.6132, test_loss: 1.1810, test_f1: 0.5196
 epoch: 58, train_loss: 0.6059, test_loss: 1.1977, test_f1: 0.5231
 epoch: 59, train_loss: 0.6041, test_loss: 1.1904, test_f1: 0.5427
 epoch: 60, train_loss: 0.6009, test_loss: 1.2814, test_f1: 0.5017
 epoch: 61, train_loss: 0.5877, test_loss: 1.2234, test_f1: 0.5225
 epoch: 62, train_loss: 0.5838, test_loss: 1.2316, test_f1: 0.5334
 epoch: 63, train_loss: 0.5781, test_loss: 1.1982, test_f1: 0.5407
 epoch: 64, train_loss: 0.5748, test_loss: 1.2751, test_f1: 0.5208
 epoch: 65, train_loss: 0.5720, test_loss: 1.2323, test_f1: 0.5197
 epoch: 66, train_loss: 0.5617, test_loss: 1.2356, test_f1: 0.5348
 epoch: 67, train_loss: 0.5735, test_loss: 1.2851, test_f1: 0.5134
 epoch: 68, train_loss: 0.5665, test_loss: 1.2571, test_f1: 0.5061
 epoch: 69, train_loss: 0.5707, test_loss: 1.2529, test_f1: 0.5162
 epoch: 70, train_loss: 0.5704, test_loss: 1.2462, test_f1: 0.5337
 epoch: 71, train_loss: 0.5609, test_loss: 1.3167, test_f1: 0.5401
 epoch: 72, train_loss: 0.5551, test_loss: 1.2832, test_f1: 0.5409
 epoch: 73, train_loss: 0.5435, test_loss: 1.2785, test_f1: 0.5371
 epoch: 74, train_loss: 0.5435, test_loss: 1.2950, test_f1: 0.5376
 epoch: 75, train_loss: 0.5558, test_loss: 1.3723, test_f1: 0.5292
 epoch: 76, train_loss: 0.5525, test_loss: 1.2807, test_f1: 0.4971
 epoch: 77, train_loss: 0.5539, test_loss: 1.3352, test_f1: 0.5367
 epoch: 78, train_loss: 0.5484, test_loss: 1.2891, test_f1: 0.5351
 epoch: 79, train_loss: 0.5298, test_loss: 1.3285, test_f1: 0.5394
 epoch: 80, train_loss: 0.5262, test_loss: 1.3046, test_f1: 0.5273
 epoch: 81, train_loss: 0.5263, test_loss: 1.3986, test_f1: 0.5408
 epoch: 82, train_loss: 0.5215, test_loss: 1.3946, test_f1: 0.5356
 epoch: 83, train_loss: 0.5116, test_loss: 1.3971, test_f1: 0.5215
 epoch: 84, train_loss: 0.5403, test_loss: 1.3229, test_f1: 0.5328
 epoch: 85, train_loss: 0.5185, test_loss: 1.3816, test_f1: 0.5262
 epoch: 86, train_loss: 0.5137, test_loss: 1.4964, test_f1: 0.5114
 epoch: 87, train_loss: 0.5155, test_loss: 1.4066, test_f1: 0.5577
 epoch: 88, train_loss: 0.5103, test_loss: 1.3462, test_f1: 0.5205
 epoch: 89, train_loss: 0.4950, test_loss: 1.4066, test_f1: 0.5367
 epoch: 90, train_loss: 0.5070, test_loss: 1.3229, test_f1: 0.5405
 epoch: 91, train_loss: 0.5083, test_loss: 1.3838, test_f1: 0.5330
 epoch: 92, train_loss: 0.4984, test_loss: 1.4503, test_f1: 0.5359
 epoch: 93, train_loss: 0.4777, test_loss: 1.4001, test_f1: 0.5414
 epoch: 94, train_loss: 0.5066, test_loss: 1.4395, test_f1: 0.4938
 epoch: 95, train_loss: 0.4884, test_loss: 1.4949, test_f1: 0.5288
 epoch: 96, train_loss: 0.4882, test_loss: 1.3805, test_f1: 0.5186
 epoch: 97, train_loss: 0.4910, test_loss: 1.4452, test_f1: 0.5479
 epoch: 98, train_loss: 0.4762, test_loss: 1.4510, test_f1: 0.5163
 epoch: 99, train_loss: 0.4850, test_loss: 1.4180, test_f1: 0.5411
##################ITERATION #6 ****************************************
 epoch: 0, train_loss: 1.4760, test_loss: 1.2356, test_f1: 0.2838
 epoch: 1, train_loss: 1.1988, test_loss: 1.0950, test_f1: 0.4716
 epoch: 2, train_loss: 1.1424, test_loss: 1.0486, test_f1: 0.4661
 epoch: 3, train_loss: 1.1106, test_loss: 1.0509, test_f1: 0.4487
 epoch: 4, train_loss: 1.0836, test_loss: 0.9987, test_f1: 0.4766
 epoch: 5, train_loss: 1.0488, test_loss: 1.0247, test_f1: 0.4445
 epoch: 6, train_loss: 1.0336, test_loss: 0.9780, test_f1: 0.4808
 epoch: 7, train_loss: 1.0050, test_loss: 0.9767, test_f1: 0.4952
 epoch: 8, train_loss: 0.9959, test_loss: 0.9626, test_f1: 0.4947
 epoch: 9, train_loss: 0.9884, test_loss: 0.9414, test_f1: 0.5204
 epoch: 10, train_loss: 0.9569, test_loss: 0.9406, test_f1: 0.4940
 epoch: 11, train_loss: 0.9408, test_loss: 1.0120, test_f1: 0.5154
 epoch: 12, train_loss: 0.9479, test_loss: 0.9600, test_f1: 0.4981
 epoch: 13, train_loss: 0.9315, test_loss: 0.9649, test_f1: 0.5180
 epoch: 14, train_loss: 0.9292, test_loss: 0.9461, test_f1: 0.5178
 epoch: 15, train_loss: 0.9037, test_loss: 0.9801, test_f1: 0.5098
 epoch: 16, train_loss: 0.8910, test_loss: 1.0019, test_f1: 0.5084
 epoch: 17, train_loss: 0.8873, test_loss: 0.9846, test_f1: 0.4950
 epoch: 18, train_loss: 0.8701, test_loss: 0.9505, test_f1: 0.5138
 epoch: 19, train_loss: 0.8661, test_loss: 1.0005, test_f1: 0.4886
 epoch: 20, train_loss: 0.8448, test_loss: 1.0347, test_f1: 0.4678
 epoch: 21, train_loss: 0.8395, test_loss: 0.9639, test_f1: 0.5204
 epoch: 22, train_loss: 0.8394, test_loss: 1.0033, test_f1: 0.4804
 epoch: 23, train_loss: 0.8307, test_loss: 1.0247, test_f1: 0.5261
 epoch: 24, train_loss: 0.8244, test_loss: 1.0771, test_f1: 0.5165
 epoch: 25, train_loss: 0.8136, test_loss: 1.0203, test_f1: 0.5406
 epoch: 26, train_loss: 0.8062, test_loss: 1.0162, test_f1: 0.5141
 epoch: 27, train_loss: 0.7939, test_loss: 1.0588, test_f1: 0.5606
 epoch: 28, train_loss: 0.7718, test_loss: 1.0308, test_f1: 0.5404
 epoch: 29, train_loss: 0.7727, test_loss: 1.0331, test_f1: 0.5206
 epoch: 30, train_loss: 0.7704, test_loss: 1.0556, test_f1: 0.5287
 epoch: 31, train_loss: 0.7665, test_loss: 1.0745, test_f1: 0.5262
 epoch: 32, train_loss: 0.7646, test_loss: 1.0551, test_f1: 0.5481
 epoch: 33, train_loss: 0.7664, test_loss: 1.1034, test_f1: 0.5409
 epoch: 34, train_loss: 0.7395, test_loss: 1.0586, test_f1: 0.5457
 epoch: 35, train_loss: 0.7439, test_loss: 1.0623, test_f1: 0.5535
 epoch: 36, train_loss: 0.7248, test_loss: 1.1328, test_f1: 0.5530
 epoch: 37, train_loss: 0.7096, test_loss: 1.1710, test_f1: 0.5333
 epoch: 38, train_loss: 0.7106, test_loss: 1.1174, test_f1: 0.5555
 epoch: 39, train_loss: 0.7028, test_loss: 1.1592, test_f1: 0.5601
 epoch: 40, train_loss: 0.6924, test_loss: 1.1260, test_f1: 0.5465
 epoch: 41, train_loss: 0.6890, test_loss: 1.1440, test_f1: 0.5466
 epoch: 42, train_loss: 0.6685, test_loss: 1.0797, test_f1: 0.5744
 epoch: 43, train_loss: 0.6939, test_loss: 1.1518, test_f1: 0.5441
 epoch: 44, train_loss: 0.6787, test_loss: 1.2184, test_f1: 0.5346
 epoch: 45, train_loss: 0.6749, test_loss: 1.1883, test_f1: 0.5834
 epoch: 46, train_loss: 0.6648, test_loss: 1.1048, test_f1: 0.5539
 epoch: 47, train_loss: 0.6594, test_loss: 1.1608, test_f1: 0.5397
 epoch: 48, train_loss: 0.6509, test_loss: 1.2167, test_f1: 0.5498
 epoch: 49, train_loss: 0.6426, test_loss: 1.2442, test_f1: 0.5570
 epoch: 50, train_loss: 0.6445, test_loss: 1.2167, test_f1: 0.5596
 epoch: 51, train_loss: 0.6117, test_loss: 1.2211, test_f1: 0.5314
 epoch: 52, train_loss: 0.6014, test_loss: 1.2391, test_f1: 0.5557
 epoch: 53, train_loss: 0.5829, test_loss: 1.2490, test_f1: 0.5641
 epoch: 54, train_loss: 0.5875, test_loss: 1.2303, test_f1: 0.5389
 epoch: 55, train_loss: 0.5780, test_loss: 1.2269, test_f1: 0.5811
 epoch: 56, train_loss: 0.5624, test_loss: 1.2648, test_f1: 0.5641
 epoch: 57, train_loss: 0.5770, test_loss: 1.3113, test_f1: 0.5831
 epoch: 58, train_loss: 0.5742, test_loss: 1.3303, test_f1: 0.5505
 epoch: 59, train_loss: 0.5583, test_loss: 1.2521, test_f1: 0.5600
 epoch: 60, train_loss: 0.5579, test_loss: 1.3020, test_f1: 0.5568
 epoch: 61, train_loss: 0.5426, test_loss: 1.3628, test_f1: 0.5660
 epoch: 62, train_loss: 0.5393, test_loss: 1.3192, test_f1: 0.5567
 epoch: 63, train_loss: 0.5289, test_loss: 1.3933, test_f1: 0.5499
 epoch: 64, train_loss: 0.5350, test_loss: 1.2828, test_f1: 0.5716
 epoch: 65, train_loss: 0.5118, test_loss: 1.3219, test_f1: 0.5882
 epoch: 66, train_loss: 0.5464, test_loss: 1.3389, test_f1: 0.5555
 epoch: 67, train_loss: 0.5202, test_loss: 1.3510, test_f1: 0.5567
 epoch: 68, train_loss: 0.5267, test_loss: 1.3814, test_f1: 0.5772
 epoch: 69, train_loss: 0.5214, test_loss: 1.3093, test_f1: 0.5888
 epoch: 70, train_loss: 0.5229, test_loss: 1.3897, test_f1: 0.5755
 epoch: 71, train_loss: 0.5156, test_loss: 1.3767, test_f1: 0.5820
 epoch: 72, train_loss: 0.5113, test_loss: 1.3865, test_f1: 0.5723
 epoch: 73, train_loss: 0.5084, test_loss: 1.3018, test_f1: 0.5709
 epoch: 74, train_loss: 0.5024, test_loss: 1.3058, test_f1: 0.5738
 epoch: 75, train_loss: 0.5166, test_loss: 1.4469, test_f1: 0.5800
 epoch: 76, train_loss: 0.5078, test_loss: 1.3224, test_f1: 0.5702
 epoch: 77, train_loss: 0.4965, test_loss: 1.3264, test_f1: 0.5798
 epoch: 78, train_loss: 0.5119, test_loss: 1.3389, test_f1: 0.5746
 epoch: 79, train_loss: 0.4934, test_loss: 1.3990, test_f1: 0.5767
 epoch: 80, train_loss: 0.4880, test_loss: 1.4632, test_f1: 0.5377
 epoch: 81, train_loss: 0.4766, test_loss: 1.4954, test_f1: 0.5841
 epoch: 82, train_loss: 0.4678, test_loss: 1.4805, test_f1: 0.5871
 epoch: 83, train_loss: 0.4730, test_loss: 1.4018, test_f1: 0.5716
 epoch: 84, train_loss: 0.4664, test_loss: 1.4157, test_f1: 0.5788
 epoch: 85, train_loss: 0.4698, test_loss: 1.4886, test_f1: 0.5885
 epoch: 86, train_loss: 0.4540, test_loss: 1.5104, test_f1: 0.5704
 epoch: 87, train_loss: 0.4637, test_loss: 1.3667, test_f1: 0.5684
 epoch: 88, train_loss: 0.4618, test_loss: 1.5411, test_f1: 0.5803
 epoch: 89, train_loss: 0.4688, test_loss: 1.4106, test_f1: 0.5882
 epoch: 90, train_loss: 0.4542, test_loss: 1.4506, test_f1: 0.5805
 epoch: 91, train_loss: 0.4449, test_loss: 1.4505, test_f1: 0.5762
 epoch: 92, train_loss: 0.4579, test_loss: 1.5325, test_f1: 0.5665
 epoch: 93, train_loss: 0.4523, test_loss: 1.6289, test_f1: 0.5655
 epoch: 94, train_loss: 0.4296, test_loss: 1.4662, test_f1: 0.5878
 epoch: 95, train_loss: 0.4458, test_loss: 1.6079, test_f1: 0.5762
 epoch: 96, train_loss: 0.4383, test_loss: 1.5166, test_f1: 0.5542
 epoch: 97, train_loss: 0.4510, test_loss: 1.4765, test_f1: 0.5663
 epoch: 98, train_loss: 0.4185, test_loss: 1.5301, test_f1: 0.5751
 epoch: 99, train_loss: 0.4378, test_loss: 1.6116, test_f1: 0.5682
##################ITERATION #7 ****************************************
 epoch: 0, train_loss: 1.4856, test_loss: 1.2132, test_f1: 0.3615
 epoch: 1, train_loss: 1.2315, test_loss: 1.1008, test_f1: 0.4927
 epoch: 2, train_loss: 1.1790, test_loss: 1.0634, test_f1: 0.4378
 epoch: 3, train_loss: 1.1049, test_loss: 1.0199, test_f1: 0.4649
 epoch: 4, train_loss: 1.0843, test_loss: 1.0311, test_f1: 0.5047
 epoch: 5, train_loss: 1.0661, test_loss: 1.0288, test_f1: 0.4869
 epoch: 6, train_loss: 1.0354, test_loss: 0.9581, test_f1: 0.5211
 epoch: 7, train_loss: 1.0091, test_loss: 0.9558, test_f1: 0.5296
 epoch: 8, train_loss: 0.9962, test_loss: 0.9526, test_f1: 0.5008
 epoch: 9, train_loss: 0.9911, test_loss: 0.9449, test_f1: 0.5044
 epoch: 10, train_loss: 0.9616, test_loss: 0.9267, test_f1: 0.5069
 epoch: 11, train_loss: 0.9422, test_loss: 0.9651, test_f1: 0.5061
 epoch: 12, train_loss: 0.9406, test_loss: 1.0516, test_f1: 0.5197
 epoch: 13, train_loss: 0.9218, test_loss: 0.9276, test_f1: 0.5323
 epoch: 14, train_loss: 0.9159, test_loss: 1.0313, test_f1: 0.4935
 epoch: 15, train_loss: 0.8991, test_loss: 0.9711, test_f1: 0.5296
 epoch: 16, train_loss: 0.8875, test_loss: 1.0143, test_f1: 0.5322
 epoch: 17, train_loss: 0.8864, test_loss: 0.9534, test_f1: 0.5344
 epoch: 18, train_loss: 0.8791, test_loss: 0.9247, test_f1: 0.5327
 epoch: 19, train_loss: 0.8693, test_loss: 1.0702, test_f1: 0.5127
 epoch: 20, train_loss: 0.8595, test_loss: 0.9769, test_f1: 0.5390
 epoch: 21, train_loss: 0.8568, test_loss: 1.0256, test_f1: 0.4960
 epoch: 22, train_loss: 0.8394, test_loss: 0.9923, test_f1: 0.5226
 epoch: 23, train_loss: 0.8288, test_loss: 1.0189, test_f1: 0.5275
 epoch: 24, train_loss: 0.8333, test_loss: 1.1550, test_f1: 0.4747
 epoch: 25, train_loss: 0.8195, test_loss: 0.9855, test_f1: 0.5380
 epoch: 26, train_loss: 0.8001, test_loss: 0.9966, test_f1: 0.5325
 epoch: 27, train_loss: 0.8159, test_loss: 0.9710, test_f1: 0.5484
 epoch: 28, train_loss: 0.7992, test_loss: 1.0024, test_f1: 0.5305
 epoch: 29, train_loss: 0.7855, test_loss: 0.9843, test_f1: 0.5446
 epoch: 30, train_loss: 0.7905, test_loss: 1.0452, test_f1: 0.4924
 epoch: 31, train_loss: 0.7751, test_loss: 1.0296, test_f1: 0.5389
 epoch: 32, train_loss: 0.7834, test_loss: 1.0630, test_f1: 0.5363
 epoch: 33, train_loss: 0.7538, test_loss: 1.0383, test_f1: 0.5356
 epoch: 34, train_loss: 0.7567, test_loss: 1.0994, test_f1: 0.5299
 epoch: 35, train_loss: 0.7422, test_loss: 1.1148, test_f1: 0.5318
 epoch: 36, train_loss: 0.7355, test_loss: 1.1970, test_f1: 0.5236
 epoch: 37, train_loss: 0.7525, test_loss: 1.1420, test_f1: 0.5443
 epoch: 38, train_loss: 0.7393, test_loss: 1.0441, test_f1: 0.5371
 epoch: 39, train_loss: 0.7167, test_loss: 1.0506, test_f1: 0.5511
 epoch: 40, train_loss: 0.7239, test_loss: 1.1373, test_f1: 0.5471
 epoch: 41, train_loss: 0.7392, test_loss: 1.1453, test_f1: 0.5473
 epoch: 42, train_loss: 0.7171, test_loss: 1.0563, test_f1: 0.5608
 epoch: 43, train_loss: 0.7257, test_loss: 1.1150, test_f1: 0.5412
 epoch: 44, train_loss: 0.7213, test_loss: 1.1730, test_f1: 0.5332
 epoch: 45, train_loss: 0.6923, test_loss: 1.1179, test_f1: 0.5389
 epoch: 46, train_loss: 0.6926, test_loss: 1.1372, test_f1: 0.5521
 epoch: 47, train_loss: 0.6768, test_loss: 1.2490, test_f1: 0.5296
 epoch: 48, train_loss: 0.6707, test_loss: 1.1510, test_f1: 0.5435
 epoch: 49, train_loss: 0.6870, test_loss: 1.1852, test_f1: 0.5382
 epoch: 50, train_loss: 0.6789, test_loss: 1.1084, test_f1: 0.5480
 epoch: 51, train_loss: 0.6511, test_loss: 1.1548, test_f1: 0.5436
 epoch: 52, train_loss: 0.6331, test_loss: 1.1468, test_f1: 0.5526
 epoch: 53, train_loss: 0.6290, test_loss: 1.1605, test_f1: 0.5536
 epoch: 54, train_loss: 0.6162, test_loss: 1.2178, test_f1: 0.5323
 epoch: 55, train_loss: 0.6059, test_loss: 1.1736, test_f1: 0.5472
 epoch: 56, train_loss: 0.6025, test_loss: 1.2003, test_f1: 0.5560
 epoch: 57, train_loss: 0.5991, test_loss: 1.1998, test_f1: 0.5532
 epoch: 58, train_loss: 0.6026, test_loss: 1.2270, test_f1: 0.5449
 epoch: 59, train_loss: 0.6094, test_loss: 1.2076, test_f1: 0.5644
 epoch: 60, train_loss: 0.5997, test_loss: 1.2509, test_f1: 0.5381
 epoch: 61, train_loss: 0.5816, test_loss: 1.2266, test_f1: 0.5528
 epoch: 62, train_loss: 0.5902, test_loss: 1.2839, test_f1: 0.5542
 epoch: 63, train_loss: 0.5890, test_loss: 1.2884, test_f1: 0.5516
 epoch: 64, train_loss: 0.5850, test_loss: 1.2060, test_f1: 0.5618
 epoch: 65, train_loss: 0.5823, test_loss: 1.2570, test_f1: 0.5546
 epoch: 66, train_loss: 0.5893, test_loss: 1.2832, test_f1: 0.5448
 epoch: 67, train_loss: 0.5786, test_loss: 1.2932, test_f1: 0.5473
 epoch: 68, train_loss: 0.5748, test_loss: 1.2537, test_f1: 0.5609
 epoch: 69, train_loss: 0.5773, test_loss: 1.2726, test_f1: 0.5587
 epoch: 70, train_loss: 0.5621, test_loss: 1.3474, test_f1: 0.5347
 epoch: 71, train_loss: 0.5544, test_loss: 1.2685, test_f1: 0.5571
 epoch: 72, train_loss: 0.5585, test_loss: 1.3608, test_f1: 0.5541
 epoch: 73, train_loss: 0.5708, test_loss: 1.2928, test_f1: 0.5637
 epoch: 74, train_loss: 0.5504, test_loss: 1.2395, test_f1: 0.5616
 epoch: 75, train_loss: 0.5449, test_loss: 1.3260, test_f1: 0.5407
 epoch: 76, train_loss: 0.5514, test_loss: 1.2409, test_f1: 0.5808
 epoch: 77, train_loss: 0.5517, test_loss: 1.2921, test_f1: 0.5807
 epoch: 78, train_loss: 0.5673, test_loss: 1.2906, test_f1: 0.5475
 epoch: 79, train_loss: 0.5420, test_loss: 1.3103, test_f1: 0.5577
 epoch: 80, train_loss: 0.5422, test_loss: 1.2994, test_f1: 0.5716
 epoch: 81, train_loss: 0.5350, test_loss: 1.3637, test_f1: 0.5488
 epoch: 82, train_loss: 0.5468, test_loss: 1.2937, test_f1: 0.5545
 epoch: 83, train_loss: 0.5319, test_loss: 1.3659, test_f1: 0.5589
 epoch: 84, train_loss: 0.5367, test_loss: 1.3276, test_f1: 0.5651
 epoch: 85, train_loss: 0.5454, test_loss: 1.3302, test_f1: 0.5601
 epoch: 86, train_loss: 0.5318, test_loss: 1.2913, test_f1: 0.5793
 epoch: 87, train_loss: 0.5317, test_loss: 1.3685, test_f1: 0.5427
 epoch: 88, train_loss: 0.5288, test_loss: 1.3681, test_f1: 0.5824
 epoch: 89, train_loss: 0.5285, test_loss: 1.4117, test_f1: 0.5600
 epoch: 90, train_loss: 0.5156, test_loss: 1.3507, test_f1: 0.5445
 epoch: 91, train_loss: 0.5072, test_loss: 1.3317, test_f1: 0.5571
 epoch: 92, train_loss: 0.5138, test_loss: 1.4256, test_f1: 0.5306
 epoch: 93, train_loss: 0.5185, test_loss: 1.4102, test_f1: 0.5316
 epoch: 94, train_loss: 0.5165, test_loss: 1.3172, test_f1: 0.5660
 epoch: 95, train_loss: 0.5227, test_loss: 1.3917, test_f1: 0.5475
 epoch: 96, train_loss: 0.5178, test_loss: 1.4122, test_f1: 0.5717
 epoch: 97, train_loss: 0.4994, test_loss: 1.4385, test_f1: 0.5509
 epoch: 98, train_loss: 0.5117, test_loss: 1.3824, test_f1: 0.5473
 epoch: 99, train_loss: 0.4944, test_loss: 1.4889, test_f1: 0.5182
##################ITERATION #8 ****************************************
 epoch: 0, train_loss: 1.5356, test_loss: 1.2088, test_f1: 0.3437
 epoch: 1, train_loss: 1.2311, test_loss: 1.1312, test_f1: 0.4090
 epoch: 2, train_loss: 1.1500, test_loss: 1.0883, test_f1: 0.4635
 epoch: 3, train_loss: 1.1234, test_loss: 1.0933, test_f1: 0.4668
 epoch: 4, train_loss: 1.1075, test_loss: 1.0553, test_f1: 0.4887
 epoch: 5, train_loss: 1.0648, test_loss: 1.0081, test_f1: 0.4715
 epoch: 6, train_loss: 1.0423, test_loss: 1.0096, test_f1: 0.5033
 epoch: 7, train_loss: 1.0312, test_loss: 1.0030, test_f1: 0.4891
 epoch: 8, train_loss: 1.0107, test_loss: 1.0264, test_f1: 0.4704
 epoch: 9, train_loss: 1.0166, test_loss: 0.9930, test_f1: 0.4723
 epoch: 10, train_loss: 0.9822, test_loss: 0.9626, test_f1: 0.5093
 epoch: 11, train_loss: 0.9640, test_loss: 1.0603, test_f1: 0.4731
 epoch: 12, train_loss: 0.9549, test_loss: 0.9959, test_f1: 0.4889
 epoch: 13, train_loss: 0.9475, test_loss: 1.0431, test_f1: 0.4928
 epoch: 14, train_loss: 0.9345, test_loss: 1.0045, test_f1: 0.5138
 epoch: 15, train_loss: 0.9375, test_loss: 0.9733, test_f1: 0.5032
 epoch: 16, train_loss: 0.9103, test_loss: 1.0463, test_f1: 0.4832
 epoch: 17, train_loss: 0.9090, test_loss: 1.0048, test_f1: 0.4886
 epoch: 18, train_loss: 0.8996, test_loss: 1.0351, test_f1: 0.5013
 epoch: 19, train_loss: 0.8830, test_loss: 1.0204, test_f1: 0.5236
 epoch: 20, train_loss: 0.8846, test_loss: 1.0467, test_f1: 0.5238
 epoch: 21, train_loss: 0.8606, test_loss: 0.9538, test_f1: 0.5061
 epoch: 22, train_loss: 0.8584, test_loss: 1.0998, test_f1: 0.5157
 epoch: 23, train_loss: 0.8690, test_loss: 1.0108, test_f1: 0.5138
 epoch: 24, train_loss: 0.8534, test_loss: 0.9902, test_f1: 0.5131
 epoch: 25, train_loss: 0.8380, test_loss: 0.9871, test_f1: 0.5189
 epoch: 26, train_loss: 0.8427, test_loss: 1.0751, test_f1: 0.5106
 epoch: 27, train_loss: 0.8368, test_loss: 1.1427, test_f1: 0.5264
 epoch: 28, train_loss: 0.8220, test_loss: 1.0431, test_f1: 0.5172
 epoch: 29, train_loss: 0.8155, test_loss: 1.0104, test_f1: 0.5348
 epoch: 30, train_loss: 0.8035, test_loss: 1.0390, test_f1: 0.5363
 epoch: 31, train_loss: 0.8123, test_loss: 1.0143, test_f1: 0.5593
 epoch: 32, train_loss: 0.7933, test_loss: 1.0212, test_f1: 0.5504
 epoch: 33, train_loss: 0.7877, test_loss: 1.0882, test_f1: 0.5204
 epoch: 34, train_loss: 0.7970, test_loss: 1.1157, test_f1: 0.4995
 epoch: 35, train_loss: 0.7829, test_loss: 1.0885, test_f1: 0.5268
 epoch: 36, train_loss: 0.7651, test_loss: 1.0937, test_f1: 0.5594
 epoch: 37, train_loss: 0.7651, test_loss: 1.1076, test_f1: 0.5131
 epoch: 38, train_loss: 0.7654, test_loss: 1.1163, test_f1: 0.5266
 epoch: 39, train_loss: 0.7626, test_loss: 1.1053, test_f1: 0.5226
 epoch: 40, train_loss: 0.7409, test_loss: 1.1382, test_f1: 0.5344
 epoch: 41, train_loss: 0.7422, test_loss: 1.0966, test_f1: 0.5574
 epoch: 42, train_loss: 0.7275, test_loss: 1.0785, test_f1: 0.5498
 epoch: 43, train_loss: 0.7286, test_loss: 1.1820, test_f1: 0.5335
 epoch: 44, train_loss: 0.7169, test_loss: 1.1217, test_f1: 0.5620
 epoch: 45, train_loss: 0.7137, test_loss: 1.1703, test_f1: 0.5161
 epoch: 46, train_loss: 0.7170, test_loss: 1.1415, test_f1: 0.5262
 epoch: 47, train_loss: 0.7136, test_loss: 1.0538, test_f1: 0.5384
 epoch: 48, train_loss: 0.7008, test_loss: 1.1563, test_f1: 0.5377
 epoch: 49, train_loss: 0.7224, test_loss: 1.3503, test_f1: 0.4810
 epoch: 50, train_loss: 0.6915, test_loss: 1.1709, test_f1: 0.5490
 epoch: 51, train_loss: 0.6676, test_loss: 1.0640, test_f1: 0.5511
 epoch: 52, train_loss: 0.6581, test_loss: 1.1590, test_f1: 0.5389
 epoch: 53, train_loss: 0.6395, test_loss: 1.1485, test_f1: 0.5598
 epoch: 54, train_loss: 0.6350, test_loss: 1.1944, test_f1: 0.5479
 epoch: 55, train_loss: 0.6229, test_loss: 1.1818, test_f1: 0.5612
 epoch: 56, train_loss: 0.6335, test_loss: 1.2231, test_f1: 0.5207
 epoch: 57, train_loss: 0.6206, test_loss: 1.1577, test_f1: 0.5826
 epoch: 58, train_loss: 0.6336, test_loss: 1.1685, test_f1: 0.5591
 epoch: 59, train_loss: 0.6203, test_loss: 1.1576, test_f1: 0.5668
 epoch: 60, train_loss: 0.6150, test_loss: 1.2043, test_f1: 0.5791
 epoch: 61, train_loss: 0.6089, test_loss: 1.1960, test_f1: 0.5541
 epoch: 62, train_loss: 0.6162, test_loss: 1.2067, test_f1: 0.5577
 epoch: 63, train_loss: 0.6028, test_loss: 1.2100, test_f1: 0.5549
 epoch: 64, train_loss: 0.6029, test_loss: 1.2155, test_f1: 0.5683
 epoch: 65, train_loss: 0.5999, test_loss: 1.2120, test_f1: 0.5473
 epoch: 66, train_loss: 0.6032, test_loss: 1.2210, test_f1: 0.5511
 epoch: 67, train_loss: 0.6077, test_loss: 1.2512, test_f1: 0.5582
 epoch: 68, train_loss: 0.5996, test_loss: 1.2159, test_f1: 0.5539
 epoch: 69, train_loss: 0.6011, test_loss: 1.2097, test_f1: 0.5743
 epoch: 70, train_loss: 0.5766, test_loss: 1.2265, test_f1: 0.5470
 epoch: 71, train_loss: 0.5805, test_loss: 1.3014, test_f1: 0.5735
 epoch: 72, train_loss: 0.5826, test_loss: 1.3283, test_f1: 0.5310
 epoch: 73, train_loss: 0.5864, test_loss: 1.2567, test_f1: 0.5411
 epoch: 74, train_loss: 0.5940, test_loss: 1.3264, test_f1: 0.5222
 epoch: 75, train_loss: 0.5762, test_loss: 1.2520, test_f1: 0.5559
 epoch: 76, train_loss: 0.5725, test_loss: 1.1857, test_f1: 0.5800
 epoch: 77, train_loss: 0.5589, test_loss: 1.2727, test_f1: 0.5643
 epoch: 78, train_loss: 0.5602, test_loss: 1.2506, test_f1: 0.5550
 epoch: 79, train_loss: 0.5504, test_loss: 1.3045, test_f1: 0.5530
 epoch: 80, train_loss: 0.5630, test_loss: 1.2998, test_f1: 0.5594
 epoch: 81, train_loss: 0.5519, test_loss: 1.3039, test_f1: 0.5633
 epoch: 82, train_loss: 0.5641, test_loss: 1.2723, test_f1: 0.5518
 epoch: 83, train_loss: 0.5520, test_loss: 1.3379, test_f1: 0.5649
 epoch: 84, train_loss: 0.5357, test_loss: 1.2995, test_f1: 0.5948
 epoch: 85, train_loss: 0.5301, test_loss: 1.3136, test_f1: 0.5572
 epoch: 86, train_loss: 0.5375, test_loss: 1.2885, test_f1: 0.5796
 epoch: 87, train_loss: 0.5497, test_loss: 1.2935, test_f1: 0.5672
 epoch: 88, train_loss: 0.5255, test_loss: 1.3002, test_f1: 0.5704
 epoch: 89, train_loss: 0.5327, test_loss: 1.3268, test_f1: 0.5764
 epoch: 90, train_loss: 0.5650, test_loss: 1.2710, test_f1: 0.5749
 epoch: 91, train_loss: 0.5303, test_loss: 1.2837, test_f1: 0.5921
 epoch: 92, train_loss: 0.5376, test_loss: 1.2962, test_f1: 0.5829
 epoch: 93, train_loss: 0.5226, test_loss: 1.3097, test_f1: 0.5936
 epoch: 94, train_loss: 0.5383, test_loss: 1.3155, test_f1: 0.5859
 epoch: 95, train_loss: 0.5087, test_loss: 1.3885, test_f1: 0.5402
 epoch: 96, train_loss: 0.5003, test_loss: 1.3142, test_f1: 0.5684
 epoch: 97, train_loss: 0.5311, test_loss: 1.3556, test_f1: 0.5464
 epoch: 98, train_loss: 0.4955, test_loss: 1.2986, test_f1: 0.5794
 epoch: 99, train_loss: 0.5149, test_loss: 1.3187, test_f1: 0.5847
##################ITERATION #9 ****************************************
 epoch: 0, train_loss: 1.5568, test_loss: 1.2184, test_f1: 0.2601
 epoch: 1, train_loss: 1.2368, test_loss: 1.1466, test_f1: 0.3991
 epoch: 2, train_loss: 1.1661, test_loss: 1.0918, test_f1: 0.4525
 epoch: 3, train_loss: 1.1289, test_loss: 1.0763, test_f1: 0.4565
 epoch: 4, train_loss: 1.0953, test_loss: 1.0195, test_f1: 0.4309
 epoch: 5, train_loss: 1.0823, test_loss: 1.0083, test_f1: 0.4420
 epoch: 6, train_loss: 1.0500, test_loss: 0.9910, test_f1: 0.4770
 epoch: 7, train_loss: 1.0295, test_loss: 0.9875, test_f1: 0.4573
 epoch: 8, train_loss: 0.9990, test_loss: 0.9798, test_f1: 0.4850
 epoch: 9, train_loss: 0.9794, test_loss: 1.0111, test_f1: 0.4254
 epoch: 10, train_loss: 0.9677, test_loss: 0.9876, test_f1: 0.4955
 epoch: 11, train_loss: 0.9558, test_loss: 0.9961, test_f1: 0.4764
 epoch: 12, train_loss: 0.9457, test_loss: 1.0567, test_f1: 0.4735
 epoch: 13, train_loss: 0.9379, test_loss: 1.0329, test_f1: 0.4395
 epoch: 14, train_loss: 0.9290, test_loss: 0.9901, test_f1: 0.4950
 epoch: 15, train_loss: 0.9144, test_loss: 1.0413, test_f1: 0.4894
 epoch: 16, train_loss: 0.8996, test_loss: 1.0255, test_f1: 0.4755
 epoch: 17, train_loss: 0.8949, test_loss: 1.0231, test_f1: 0.4624
 epoch: 18, train_loss: 0.8827, test_loss: 0.9685, test_f1: 0.4914
 epoch: 19, train_loss: 0.8726, test_loss: 1.0931, test_f1: 0.4584
 epoch: 20, train_loss: 0.8619, test_loss: 1.0222, test_f1: 0.4839
 epoch: 21, train_loss: 0.8594, test_loss: 1.0606, test_f1: 0.4641
 epoch: 22, train_loss: 0.8503, test_loss: 1.0428, test_f1: 0.4784
 epoch: 23, train_loss: 0.8305, test_loss: 1.1077, test_f1: 0.4546
 epoch: 24, train_loss: 0.8320, test_loss: 1.0889, test_f1: 0.4914
 epoch: 25, train_loss: 0.8238, test_loss: 1.0909, test_f1: 0.4826
 epoch: 26, train_loss: 0.8287, test_loss: 1.0819, test_f1: 0.4853
 epoch: 27, train_loss: 0.7961, test_loss: 1.0591, test_f1: 0.5205
 epoch: 28, train_loss: 0.8165, test_loss: 1.0857, test_f1: 0.4810
 epoch: 29, train_loss: 0.8053, test_loss: 1.0774, test_f1: 0.5021
 epoch: 30, train_loss: 0.8122, test_loss: 1.0516, test_f1: 0.4745
 epoch: 31, train_loss: 0.7901, test_loss: 1.0865, test_f1: 0.4822
 epoch: 32, train_loss: 0.7865, test_loss: 1.0910, test_f1: 0.4840
 epoch: 33, train_loss: 0.7894, test_loss: 1.2043, test_f1: 0.4741
 epoch: 34, train_loss: 0.7839, test_loss: 1.0970, test_f1: 0.5026
 epoch: 35, train_loss: 0.7563, test_loss: 1.1115, test_f1: 0.5297
 epoch: 36, train_loss: 0.7610, test_loss: 1.1239, test_f1: 0.4993
 epoch: 37, train_loss: 0.7582, test_loss: 1.1649, test_f1: 0.4877
 epoch: 38, train_loss: 0.7378, test_loss: 1.2062, test_f1: 0.5122
 epoch: 39, train_loss: 0.7401, test_loss: 1.2080, test_f1: 0.4935
 epoch: 40, train_loss: 0.7330, test_loss: 1.1730, test_f1: 0.5087
 epoch: 41, train_loss: 0.7291, test_loss: 1.1153, test_f1: 0.5277
 epoch: 42, train_loss: 0.7201, test_loss: 1.1756, test_f1: 0.5127
 epoch: 43, train_loss: 0.7165, test_loss: 1.2008, test_f1: 0.5133
 epoch: 44, train_loss: 0.7412, test_loss: 1.1234, test_f1: 0.5195
 epoch: 45, train_loss: 0.7084, test_loss: 1.1038, test_f1: 0.5385
 epoch: 46, train_loss: 0.7099, test_loss: 1.2564, test_f1: 0.5072
 epoch: 47, train_loss: 0.7066, test_loss: 1.1521, test_f1: 0.5146
 epoch: 48, train_loss: 0.6818, test_loss: 1.1977, test_f1: 0.5239
 epoch: 49, train_loss: 0.6876, test_loss: 1.2293, test_f1: 0.5490
 epoch: 50, train_loss: 0.6703, test_loss: 1.1802, test_f1: 0.5482
 epoch: 51, train_loss: 0.6531, test_loss: 1.2087, test_f1: 0.5202
 epoch: 52, train_loss: 0.6419, test_loss: 1.3064, test_f1: 0.5433
 epoch: 53, train_loss: 0.6312, test_loss: 1.2436, test_f1: 0.5414
 epoch: 54, train_loss: 0.6278, test_loss: 1.3239, test_f1: 0.5223
 epoch: 55, train_loss: 0.6227, test_loss: 1.2664, test_f1: 0.5723
 epoch: 56, train_loss: 0.6156, test_loss: 1.2681, test_f1: 0.5498
 epoch: 57, train_loss: 0.6042, test_loss: 1.3019, test_f1: 0.5144
 epoch: 58, train_loss: 0.6128, test_loss: 1.3477, test_f1: 0.5493
 epoch: 59, train_loss: 0.6088, test_loss: 1.3536, test_f1: 0.5228
 epoch: 60, train_loss: 0.6126, test_loss: 1.2939, test_f1: 0.5500
 epoch: 61, train_loss: 0.6096, test_loss: 1.2936, test_f1: 0.5268
 epoch: 62, train_loss: 0.5846, test_loss: 1.2366, test_f1: 0.5566
 epoch: 63, train_loss: 0.5885, test_loss: 1.2954, test_f1: 0.5351
 epoch: 64, train_loss: 0.5806, test_loss: 1.3006, test_f1: 0.5654
 epoch: 65, train_loss: 0.5834, test_loss: 1.2941, test_f1: 0.5486
 epoch: 66, train_loss: 0.5738, test_loss: 1.3226, test_f1: 0.5597
 epoch: 67, train_loss: 0.5782, test_loss: 1.3419, test_f1: 0.5480
 epoch: 68, train_loss: 0.5780, test_loss: 1.3926, test_f1: 0.5248
 epoch: 69, train_loss: 0.5903, test_loss: 1.3676, test_f1: 0.5623
 epoch: 70, train_loss: 0.5794, test_loss: 1.3492, test_f1: 0.5509
 epoch: 71, train_loss: 0.5726, test_loss: 1.3869, test_f1: 0.5465
 epoch: 72, train_loss: 0.5499, test_loss: 1.3749, test_f1: 0.5216
 epoch: 73, train_loss: 0.5469, test_loss: 1.4123, test_f1: 0.5510
 epoch: 74, train_loss: 0.5385, test_loss: 1.4402, test_f1: 0.5356
 epoch: 75, train_loss: 0.5583, test_loss: 1.3813, test_f1: 0.5519
 epoch: 76, train_loss: 0.5436, test_loss: 1.3535, test_f1: 0.5570
 epoch: 77, train_loss: 0.5481, test_loss: 1.3311, test_f1: 0.5510
 epoch: 78, train_loss: 0.5511, test_loss: 1.3630, test_f1: 0.5452
 epoch: 79, train_loss: 0.5330, test_loss: 1.4196, test_f1: 0.5376
 epoch: 80, train_loss: 0.5384, test_loss: 1.4223, test_f1: 0.5369
 epoch: 81, train_loss: 0.5181, test_loss: 1.3681, test_f1: 0.5447
 epoch: 82, train_loss: 0.5355, test_loss: 1.4389, test_f1: 0.5274
 epoch: 83, train_loss: 0.5281, test_loss: 1.4041, test_f1: 0.5280
 epoch: 84, train_loss: 0.5519, test_loss: 1.4041, test_f1: 0.5405
 epoch: 85, train_loss: 0.5116, test_loss: 1.4332, test_f1: 0.5352
 epoch: 86, train_loss: 0.5197, test_loss: 1.4303, test_f1: 0.5491
 epoch: 87, train_loss: 0.5075, test_loss: 1.4259, test_f1: 0.5152
 epoch: 88, train_loss: 0.5125, test_loss: 1.4343, test_f1: 0.5447
 epoch: 89, train_loss: 0.5109, test_loss: 1.4085, test_f1: 0.5623
 epoch: 90, train_loss: 0.5099, test_loss: 1.5116, test_f1: 0.5232
 epoch: 91, train_loss: 0.5145, test_loss: 1.6083, test_f1: 0.5353
 epoch: 92, train_loss: 0.4811, test_loss: 1.4422, test_f1: 0.5764
 epoch: 93, train_loss: 0.5036, test_loss: 1.5568, test_f1: 0.5292
 epoch: 94, train_loss: 0.4979, test_loss: 1.4857, test_f1: 0.5368
 epoch: 95, train_loss: 0.4838, test_loss: 1.6505, test_f1: 0.5432
 epoch: 96, train_loss: 0.5126, test_loss: 1.4813, test_f1: 0.5321
 epoch: 97, train_loss: 0.4790, test_loss: 1.5212, test_f1: 0.5350
 epoch: 98, train_loss: 0.4933, test_loss: 1.5767, test_f1: 0.5182
 epoch: 99, train_loss: 0.4843, test_loss: 1.6107, test_f1: 0.5579

Training completed in 546.35 seconds
Best F1: 0.5948 at epoch 84
Mean F1 across iterations: 0.5802  0.0112
========================FINAL RESULTS================================
FEGIN weighted F1: 0.5948  0.0112
python main.py --data ltspice_examples --representation component_component --model FEGIN --layers 2 --hiddens 64 --batch_size 128 --lr 0.001 --emb_size 250 --epochs 100 --save_appendix component_component_L2_H64_BS128_LR0.001_E250 --no_val
-----



STDERR:
  File "main.py", line 370, in <module>
    main()
  File "main.py", line 254, in main
    dataset = dataset_class(
  File "/home/philip/projects/llm_inference_code_repo/Circuit-Completion-Using-GNNs/component_classification_with_link_prediction_head/evaluation/FEGIN/kernel/circuit_datasets.py", line 15, in __init__
    self.data, self.slices = torch.load(self.processed_paths[0])
  File "/home/philip/.local/lib/python3.8/site-packages/torch/serialization.py", line 1040, in load
    warnings.warn(
  File "/usr/lib/python3.8/warnings.py", line 109, in _showwarnmsg
    sw(msg.message, msg.category, msg.filename, msg.lineno,
  File "main.py", line 47, in warn_with_traceback
    traceback.print_stack(file=log)
/home/philip/projects/llm_inference_code_repo/Circuit-Completion-Using-GNNs/component_classification_with_link_prediction_head/evaluation/FEGIN/kernel/circuit_datasets.py:15: FutureWarning: You are using `torch.load` with `weights_only=False` (the current default value), which uses the default pickle module implicitly. It is possible to construct malicious pickle data which will execute arbitrary code during unpickling (See https://github.com/pytorch/pytorch/blob/main/SECURITY.md#untrusted-models for more details). In a future release, the default value for `weights_only` will be flipped to `True`. This limits the functions that could be executed during unpickling. Arbitrary objects will no longer be allowed to be loaded via this mode unless they are explicitly allowlisted by the user via `torch.serialization.add_safe_globals`. We recommend you start setting `weights_only=True` for any use case where you don't have full control of the loaded file. Please open an issue on GitHub for any issues related to this experimental feature.
  self.data, self.slices = torch.load(self.processed_paths[0])
