STDOUT:
Results will be saved in /home/philip/projects/llm_inference_code_repo/Circuit-Completion-Using-GNNs/component_classification_with_link_prediction_head/evaluation/FEGIN/results/model_FEGIN_dataset_ltspice_examples
Command line input: python main.py --data ltspice_examples --representation component_pin_net --model FEGIN --layers 2 --hiddens 32 --batch_size 256 --lr 0.0001 --emb_size 128 --epochs 100 --save_appendix component_pin_net_L2_H32_BS256_LR0.0001_E128 --no_val
 is saved.
-----
ltspice_examples - FEGIN
Using 2 layers, 32 hidden units, h = 2
Loading component_pin_net representation dataset
ENTERED
Training FEGIN on component_pin_net representation
Train: 3558, Test: 846
##################ITERATION #0 ****************************************
 epoch: 0, train_loss: 1.3879, test_loss: 1.3824, test_f1: 0.0793
 epoch: 1, train_loss: 1.3845, test_loss: 1.3808, test_f1: 0.0793
 epoch: 2, train_loss: 1.3822, test_loss: 1.3788, test_f1: 0.0793
 epoch: 3, train_loss: 1.3805, test_loss: 1.3769, test_f1: 0.0793
 epoch: 4, train_loss: 1.3788, test_loss: 1.3748, test_f1: 0.0793
 epoch: 5, train_loss: 1.3770, test_loss: 1.3728, test_f1: 0.0793
 epoch: 6, train_loss: 1.3747, test_loss: 1.3707, test_f1: 0.0793
 epoch: 7, train_loss: 1.3733, test_loss: 1.3687, test_f1: 0.0793
 epoch: 8, train_loss: 1.3712, test_loss: 1.3667, test_f1: 0.0793
 epoch: 9, train_loss: 1.3693, test_loss: 1.3648, test_f1: 0.0793
 epoch: 10, train_loss: 1.3673, test_loss: 1.3628, test_f1: 0.0808
 epoch: 11, train_loss: 1.3654, test_loss: 1.3608, test_f1: 0.0939
 epoch: 12, train_loss: 1.3626, test_loss: 1.3585, test_f1: 0.2480
 epoch: 13, train_loss: 1.3602, test_loss: 1.3560, test_f1: 0.2573
 epoch: 14, train_loss: 1.3582, test_loss: 1.3534, test_f1: 0.2762
 epoch: 15, train_loss: 1.3549, test_loss: 1.3506, test_f1: 0.2894
 epoch: 16, train_loss: 1.3523, test_loss: 1.3476, test_f1: 0.2920
 epoch: 17, train_loss: 1.3484, test_loss: 1.3441, test_f1: 0.2919
 epoch: 18, train_loss: 1.3442, test_loss: 1.3402, test_f1: 0.2907
 epoch: 19, train_loss: 1.3404, test_loss: 1.3360, test_f1: 0.2924
 epoch: 20, train_loss: 1.3354, test_loss: 1.3316, test_f1: 0.2927
 epoch: 21, train_loss: 1.3304, test_loss: 1.3266, test_f1: 0.2767
 epoch: 22, train_loss: 1.3261, test_loss: 1.3211, test_f1: 0.2816
 epoch: 23, train_loss: 1.3204, test_loss: 1.3150, test_f1: 0.2724
 epoch: 24, train_loss: 1.3144, test_loss: 1.3084, test_f1: 0.2657
 epoch: 25, train_loss: 1.3080, test_loss: 1.3013, test_f1: 0.2270
 epoch: 26, train_loss: 1.3015, test_loss: 1.2934, test_f1: 0.2270
 epoch: 27, train_loss: 1.2937, test_loss: 1.2845, test_f1: 0.2270
 epoch: 28, train_loss: 1.2857, test_loss: 1.2748, test_f1: 0.2270
 epoch: 29, train_loss: 1.2770, test_loss: 1.2654, test_f1: 0.2270
 epoch: 30, train_loss: 1.2689, test_loss: 1.2557, test_f1: 0.2270
 epoch: 31, train_loss: 1.2622, test_loss: 1.2455, test_f1: 0.2270
 epoch: 32, train_loss: 1.2512, test_loss: 1.2353, test_f1: 0.2527
 epoch: 33, train_loss: 1.2440, test_loss: 1.2246, test_f1: 0.2853
 epoch: 34, train_loss: 1.2376, test_loss: 1.2148, test_f1: 0.2936
 epoch: 35, train_loss: 1.2244, test_loss: 1.2049, test_f1: 0.3185
 epoch: 36, train_loss: 1.2186, test_loss: 1.1945, test_f1: 0.3382
 epoch: 37, train_loss: 1.2095, test_loss: 1.1843, test_f1: 0.3509
 epoch: 38, train_loss: 1.2017, test_loss: 1.1738, test_f1: 0.3462
 epoch: 39, train_loss: 1.1915, test_loss: 1.1640, test_f1: 0.3422
 epoch: 40, train_loss: 1.1802, test_loss: 1.1534, test_f1: 0.3422
 epoch: 41, train_loss: 1.1683, test_loss: 1.1428, test_f1: 0.3422
 epoch: 42, train_loss: 1.1648, test_loss: 1.1328, test_f1: 0.3432
 epoch: 43, train_loss: 1.1507, test_loss: 1.1233, test_f1: 0.3460
 epoch: 44, train_loss: 1.1480, test_loss: 1.1136, test_f1: 0.3460
 epoch: 45, train_loss: 1.1374, test_loss: 1.1053, test_f1: 0.3460
 epoch: 46, train_loss: 1.1279, test_loss: 1.0975, test_f1: 0.3460
 epoch: 47, train_loss: 1.1236, test_loss: 1.0905, test_f1: 0.3460
 epoch: 48, train_loss: 1.1156, test_loss: 1.0835, test_f1: 0.3460
 epoch: 49, train_loss: 1.1118, test_loss: 1.0780, test_f1: 0.3469
 epoch: 50, train_loss: 1.1035, test_loss: 1.0729, test_f1: 0.3469
 epoch: 51, train_loss: 1.0975, test_loss: 1.0696, test_f1: 0.3469
 epoch: 52, train_loss: 1.0927, test_loss: 1.0669, test_f1: 0.3469
 epoch: 53, train_loss: 1.0916, test_loss: 1.0644, test_f1: 0.3469
 epoch: 54, train_loss: 1.0920, test_loss: 1.0628, test_f1: 0.3469
 epoch: 55, train_loss: 1.0900, test_loss: 1.0609, test_f1: 0.3469
 epoch: 56, train_loss: 1.0857, test_loss: 1.0589, test_f1: 0.3469
 epoch: 57, train_loss: 1.0834, test_loss: 1.0571, test_f1: 0.3469
 epoch: 58, train_loss: 1.0832, test_loss: 1.0556, test_f1: 0.3469
 epoch: 59, train_loss: 1.0746, test_loss: 1.0539, test_f1: 0.3469
 epoch: 60, train_loss: 1.0768, test_loss: 1.0524, test_f1: 0.3469
 epoch: 61, train_loss: 1.0760, test_loss: 1.0516, test_f1: 0.3469
 epoch: 62, train_loss: 1.0678, test_loss: 1.0496, test_f1: 0.3469
 epoch: 63, train_loss: 1.0701, test_loss: 1.0482, test_f1: 0.3521
 epoch: 64, train_loss: 1.0766, test_loss: 1.0473, test_f1: 0.3495
 epoch: 65, train_loss: 1.0705, test_loss: 1.0465, test_f1: 0.3511
 epoch: 66, train_loss: 1.0682, test_loss: 1.0458, test_f1: 0.3520
 epoch: 67, train_loss: 1.0646, test_loss: 1.0447, test_f1: 0.3521
 epoch: 68, train_loss: 1.0651, test_loss: 1.0440, test_f1: 0.3511
 epoch: 69, train_loss: 1.0587, test_loss: 1.0428, test_f1: 0.3521
 epoch: 70, train_loss: 1.0588, test_loss: 1.0415, test_f1: 0.3521
 epoch: 71, train_loss: 1.0552, test_loss: 1.0406, test_f1: 0.3511
 epoch: 72, train_loss: 1.0618, test_loss: 1.0404, test_f1: 0.3511
 epoch: 73, train_loss: 1.0565, test_loss: 1.0397, test_f1: 0.3546
 epoch: 74, train_loss: 1.0553, test_loss: 1.0381, test_f1: 0.3536
 epoch: 75, train_loss: 1.0514, test_loss: 1.0381, test_f1: 0.3531
 epoch: 76, train_loss: 1.0463, test_loss: 1.0375, test_f1: 0.3540
 epoch: 77, train_loss: 1.0521, test_loss: 1.0374, test_f1: 0.3541
 epoch: 78, train_loss: 1.0508, test_loss: 1.0363, test_f1: 0.3540
 epoch: 79, train_loss: 1.0496, test_loss: 1.0347, test_f1: 0.3530
 epoch: 80, train_loss: 1.0468, test_loss: 1.0359, test_f1: 0.3590
 epoch: 81, train_loss: 1.0444, test_loss: 1.0343, test_f1: 0.3605
 epoch: 82, train_loss: 1.0420, test_loss: 1.0335, test_f1: 0.3619
 epoch: 83, train_loss: 1.0404, test_loss: 1.0331, test_f1: 0.3687
 epoch: 84, train_loss: 1.0444, test_loss: 1.0315, test_f1: 0.3687
 epoch: 85, train_loss: 1.0399, test_loss: 1.0318, test_f1: 0.3713
 epoch: 86, train_loss: 1.0417, test_loss: 1.0315, test_f1: 0.3726
 epoch: 87, train_loss: 1.0412, test_loss: 1.0307, test_f1: 0.3757
 epoch: 88, train_loss: 1.0408, test_loss: 1.0300, test_f1: 0.3773
 epoch: 89, train_loss: 1.0376, test_loss: 1.0305, test_f1: 0.3776
 epoch: 90, train_loss: 1.0390, test_loss: 1.0294, test_f1: 0.3792
 epoch: 91, train_loss: 1.0396, test_loss: 1.0291, test_f1: 0.3792
 epoch: 92, train_loss: 1.0359, test_loss: 1.0285, test_f1: 0.3859
 epoch: 93, train_loss: 1.0349, test_loss: 1.0281, test_f1: 0.3881
 epoch: 94, train_loss: 1.0341, test_loss: 1.0282, test_f1: 0.3881
 epoch: 95, train_loss: 1.0355, test_loss: 1.0268, test_f1: 0.3905
 epoch: 96, train_loss: 1.0328, test_loss: 1.0262, test_f1: 0.3895
 epoch: 97, train_loss: 1.0359, test_loss: 1.0265, test_f1: 0.3896
 epoch: 98, train_loss: 1.0296, test_loss: 1.0261, test_f1: 0.3892
 epoch: 99, train_loss: 1.0292, test_loss: 1.0257, test_f1: 0.3924
##################ITERATION #1 ****************************************
 epoch: 0, train_loss: 1.3556, test_loss: 1.3522, test_f1: 0.2270
 epoch: 1, train_loss: 1.3507, test_loss: 1.3496, test_f1: 0.2270
 epoch: 2, train_loss: 1.3481, test_loss: 1.3475, test_f1: 0.2270
 epoch: 3, train_loss: 1.3445, test_loss: 1.3451, test_f1: 0.2270
 epoch: 4, train_loss: 1.3421, test_loss: 1.3424, test_f1: 0.2270
 epoch: 5, train_loss: 1.3393, test_loss: 1.3391, test_f1: 0.2270
 epoch: 6, train_loss: 1.3356, test_loss: 1.3356, test_f1: 0.2270
 epoch: 7, train_loss: 1.3330, test_loss: 1.3320, test_f1: 0.2270
 epoch: 8, train_loss: 1.3286, test_loss: 1.3280, test_f1: 0.2270
 epoch: 9, train_loss: 1.3252, test_loss: 1.3238, test_f1: 0.2270
 epoch: 10, train_loss: 1.3204, test_loss: 1.3192, test_f1: 0.2270
 epoch: 11, train_loss: 1.3156, test_loss: 1.3144, test_f1: 0.2270
 epoch: 12, train_loss: 1.3110, test_loss: 1.3090, test_f1: 0.2270
 epoch: 13, train_loss: 1.3061, test_loss: 1.3031, test_f1: 0.2270
 epoch: 14, train_loss: 1.3004, test_loss: 1.2966, test_f1: 0.2270
 epoch: 15, train_loss: 1.2927, test_loss: 1.2891, test_f1: 0.2270
 epoch: 16, train_loss: 1.2877, test_loss: 1.2811, test_f1: 0.2270
 epoch: 17, train_loss: 1.2783, test_loss: 1.2725, test_f1: 0.2506
 epoch: 18, train_loss: 1.2715, test_loss: 1.2634, test_f1: 0.2651
 epoch: 19, train_loss: 1.2637, test_loss: 1.2527, test_f1: 0.3029
 epoch: 20, train_loss: 1.2540, test_loss: 1.2423, test_f1: 0.3284
 epoch: 21, train_loss: 1.2447, test_loss: 1.2316, test_f1: 0.3303
 epoch: 22, train_loss: 1.2337, test_loss: 1.2202, test_f1: 0.3403
 epoch: 23, train_loss: 1.2221, test_loss: 1.2092, test_f1: 0.3413
 epoch: 24, train_loss: 1.2144, test_loss: 1.1969, test_f1: 0.3413
 epoch: 25, train_loss: 1.2036, test_loss: 1.1855, test_f1: 0.3422
 epoch: 26, train_loss: 1.1909, test_loss: 1.1732, test_f1: 0.3422
 epoch: 27, train_loss: 1.1788, test_loss: 1.1619, test_f1: 0.3441
 epoch: 28, train_loss: 1.1721, test_loss: 1.1511, test_f1: 0.3441
 epoch: 29, train_loss: 1.1621, test_loss: 1.1397, test_f1: 0.3432
 epoch: 30, train_loss: 1.1538, test_loss: 1.1297, test_f1: 0.3441
 epoch: 31, train_loss: 1.1436, test_loss: 1.1205, test_f1: 0.3441
 epoch: 32, train_loss: 1.1357, test_loss: 1.1126, test_f1: 0.3450
 epoch: 33, train_loss: 1.1298, test_loss: 1.1044, test_f1: 0.3450
 epoch: 34, train_loss: 1.1249, test_loss: 1.0988, test_f1: 0.3460
 epoch: 35, train_loss: 1.1185, test_loss: 1.0930, test_f1: 0.3450
 epoch: 36, train_loss: 1.1109, test_loss: 1.0872, test_f1: 0.3460
 epoch: 37, train_loss: 1.1099, test_loss: 1.0831, test_f1: 0.3460
 epoch: 38, train_loss: 1.0983, test_loss: 1.0786, test_f1: 0.3450
 epoch: 39, train_loss: 1.0947, test_loss: 1.0753, test_f1: 0.3450
 epoch: 40, train_loss: 1.0907, test_loss: 1.0716, test_f1: 0.3450
 epoch: 41, train_loss: 1.0870, test_loss: 1.0692, test_f1: 0.3450
 epoch: 42, train_loss: 1.0823, test_loss: 1.0665, test_f1: 0.3450
 epoch: 43, train_loss: 1.0828, test_loss: 1.0653, test_f1: 0.3450
 epoch: 44, train_loss: 1.0833, test_loss: 1.0622, test_f1: 0.3450
 epoch: 45, train_loss: 1.0749, test_loss: 1.0592, test_f1: 0.3450
 epoch: 46, train_loss: 1.0719, test_loss: 1.0574, test_f1: 0.3450
 epoch: 47, train_loss: 1.0683, test_loss: 1.0562, test_f1: 0.3450
 epoch: 48, train_loss: 1.0645, test_loss: 1.0531, test_f1: 0.3438
 epoch: 49, train_loss: 1.0632, test_loss: 1.0538, test_f1: 0.3450
 epoch: 50, train_loss: 1.0604, test_loss: 1.0539, test_f1: 0.3450
 epoch: 51, train_loss: 1.0674, test_loss: 1.0524, test_f1: 0.3450
 epoch: 52, train_loss: 1.0594, test_loss: 1.0523, test_f1: 0.3440
 epoch: 53, train_loss: 1.0613, test_loss: 1.0516, test_f1: 0.3440
 epoch: 54, train_loss: 1.0596, test_loss: 1.0516, test_f1: 0.3450
 epoch: 55, train_loss: 1.0576, test_loss: 1.0514, test_f1: 0.3450
 epoch: 56, train_loss: 1.0549, test_loss: 1.0508, test_f1: 0.3450
 epoch: 57, train_loss: 1.0581, test_loss: 1.0499, test_f1: 0.3450
 epoch: 58, train_loss: 1.0555, test_loss: 1.0477, test_f1: 0.3450
 epoch: 59, train_loss: 1.0555, test_loss: 1.0489, test_f1: 0.3437
 epoch: 60, train_loss: 1.0501, test_loss: 1.0497, test_f1: 0.3459
 epoch: 61, train_loss: 1.0513, test_loss: 1.0486, test_f1: 0.3457
 epoch: 62, train_loss: 1.0517, test_loss: 1.0477, test_f1: 0.3459
 epoch: 63, train_loss: 1.0473, test_loss: 1.0469, test_f1: 0.3459
 epoch: 64, train_loss: 1.0512, test_loss: 1.0470, test_f1: 0.3447
 epoch: 65, train_loss: 1.0502, test_loss: 1.0461, test_f1: 0.3437
 epoch: 66, train_loss: 1.0492, test_loss: 1.0454, test_f1: 0.3449
 epoch: 67, train_loss: 1.0446, test_loss: 1.0458, test_f1: 0.3440
 epoch: 68, train_loss: 1.0472, test_loss: 1.0442, test_f1: 0.3459
 epoch: 69, train_loss: 1.0471, test_loss: 1.0454, test_f1: 0.3447
 epoch: 70, train_loss: 1.0415, test_loss: 1.0458, test_f1: 0.3437
 epoch: 71, train_loss: 1.0486, test_loss: 1.0455, test_f1: 0.3440
 epoch: 72, train_loss: 1.0403, test_loss: 1.0429, test_f1: 0.3459
 epoch: 73, train_loss: 1.0416, test_loss: 1.0427, test_f1: 0.3437
 epoch: 74, train_loss: 1.0371, test_loss: 1.0406, test_f1: 0.3459
 epoch: 75, train_loss: 1.0416, test_loss: 1.0445, test_f1: 0.3435
 epoch: 76, train_loss: 1.0350, test_loss: 1.0416, test_f1: 0.3459
 epoch: 77, train_loss: 1.0413, test_loss: 1.0415, test_f1: 0.3456
 epoch: 78, train_loss: 1.0373, test_loss: 1.0410, test_f1: 0.3456
 epoch: 79, train_loss: 1.0346, test_loss: 1.0397, test_f1: 0.3504
 epoch: 80, train_loss: 1.0357, test_loss: 1.0401, test_f1: 0.3497
 epoch: 81, train_loss: 1.0319, test_loss: 1.0392, test_f1: 0.3504
 epoch: 82, train_loss: 1.0343, test_loss: 1.0399, test_f1: 0.3501
 epoch: 83, train_loss: 1.0367, test_loss: 1.0371, test_f1: 0.3494
 epoch: 84, train_loss: 1.0295, test_loss: 1.0349, test_f1: 0.3494
 epoch: 85, train_loss: 1.0255, test_loss: 1.0366, test_f1: 0.3517
 epoch: 86, train_loss: 1.0337, test_loss: 1.0369, test_f1: 0.3517
 epoch: 87, train_loss: 1.0317, test_loss: 1.0335, test_f1: 0.3517
 epoch: 88, train_loss: 1.0299, test_loss: 1.0382, test_f1: 0.3556
 epoch: 89, train_loss: 1.0296, test_loss: 1.0377, test_f1: 0.3645
 epoch: 90, train_loss: 1.0325, test_loss: 1.0341, test_f1: 0.3657
 epoch: 91, train_loss: 1.0234, test_loss: 1.0335, test_f1: 0.3655
 epoch: 92, train_loss: 1.0295, test_loss: 1.0320, test_f1: 0.3657
 epoch: 93, train_loss: 1.0281, test_loss: 1.0311, test_f1: 0.3678
 epoch: 94, train_loss: 1.0274, test_loss: 1.0335, test_f1: 0.3724
 epoch: 95, train_loss: 1.0240, test_loss: 1.0312, test_f1: 0.3748
 epoch: 96, train_loss: 1.0312, test_loss: 1.0308, test_f1: 0.3757
 epoch: 97, train_loss: 1.0260, test_loss: 1.0303, test_f1: 0.3801
 epoch: 98, train_loss: 1.0238, test_loss: 1.0321, test_f1: 0.3823
 epoch: 99, train_loss: 1.0285, test_loss: 1.0277, test_f1: 0.3823
##################ITERATION #2 ****************************************
 epoch: 0, train_loss: 1.3349, test_loss: 1.3329, test_f1: 0.2270
 epoch: 1, train_loss: 1.3259, test_loss: 1.3317, test_f1: 0.2270
 epoch: 2, train_loss: 1.3216, test_loss: 1.3273, test_f1: 0.2270
 epoch: 3, train_loss: 1.3159, test_loss: 1.3190, test_f1: 0.2270
 epoch: 4, train_loss: 1.3114, test_loss: 1.3096, test_f1: 0.2270
 epoch: 5, train_loss: 1.3057, test_loss: 1.3021, test_f1: 0.2270
 epoch: 6, train_loss: 1.2999, test_loss: 1.2951, test_f1: 0.2270
 epoch: 7, train_loss: 1.2939, test_loss: 1.2876, test_f1: 0.2270
 epoch: 8, train_loss: 1.2871, test_loss: 1.2801, test_f1: 0.2270
 epoch: 9, train_loss: 1.2807, test_loss: 1.2720, test_f1: 0.2270
 epoch: 10, train_loss: 1.2743, test_loss: 1.2633, test_f1: 0.2270
 epoch: 11, train_loss: 1.2681, test_loss: 1.2541, test_f1: 0.2270
 epoch: 12, train_loss: 1.2610, test_loss: 1.2442, test_f1: 0.2368
 epoch: 13, train_loss: 1.2492, test_loss: 1.2343, test_f1: 0.2747
 epoch: 14, train_loss: 1.2401, test_loss: 1.2236, test_f1: 0.3347
 epoch: 15, train_loss: 1.2332, test_loss: 1.2125, test_f1: 0.3533
 epoch: 16, train_loss: 1.2235, test_loss: 1.2012, test_f1: 0.3563
 epoch: 17, train_loss: 1.2123, test_loss: 1.1905, test_f1: 0.3573
 epoch: 18, train_loss: 1.2034, test_loss: 1.1787, test_f1: 0.3583
 epoch: 19, train_loss: 1.1916, test_loss: 1.1675, test_f1: 0.3566
 epoch: 20, train_loss: 1.1841, test_loss: 1.1565, test_f1: 0.3432
 epoch: 21, train_loss: 1.1696, test_loss: 1.1457, test_f1: 0.3441
 epoch: 22, train_loss: 1.1629, test_loss: 1.1352, test_f1: 0.3441
 epoch: 23, train_loss: 1.1512, test_loss: 1.1254, test_f1: 0.3441
 epoch: 24, train_loss: 1.1448, test_loss: 1.1161, test_f1: 0.3469
 epoch: 25, train_loss: 1.1343, test_loss: 1.1081, test_f1: 0.3469
 epoch: 26, train_loss: 1.1256, test_loss: 1.1002, test_f1: 0.3469
 epoch: 27, train_loss: 1.1161, test_loss: 1.0927, test_f1: 0.3469
 epoch: 28, train_loss: 1.1126, test_loss: 1.0869, test_f1: 0.3459
 epoch: 29, train_loss: 1.1017, test_loss: 1.0808, test_f1: 0.3469
 epoch: 30, train_loss: 1.0958, test_loss: 1.0748, test_f1: 0.3469
 epoch: 31, train_loss: 1.0922, test_loss: 1.0702, test_f1: 0.3459
 epoch: 32, train_loss: 1.0909, test_loss: 1.0667, test_f1: 0.3420
 epoch: 33, train_loss: 1.0814, test_loss: 1.0626, test_f1: 0.3430
 epoch: 34, train_loss: 1.0801, test_loss: 1.0600, test_f1: 0.3420
 epoch: 35, train_loss: 1.0728, test_loss: 1.0557, test_f1: 0.3430
 epoch: 36, train_loss: 1.0676, test_loss: 1.0519, test_f1: 0.3411
 epoch: 37, train_loss: 1.0659, test_loss: 1.0491, test_f1: 0.3411
 epoch: 38, train_loss: 1.0639, test_loss: 1.0462, test_f1: 0.3411
 epoch: 39, train_loss: 1.0580, test_loss: 1.0449, test_f1: 0.3411
 epoch: 40, train_loss: 1.0570, test_loss: 1.0419, test_f1: 0.3411
 epoch: 41, train_loss: 1.0580, test_loss: 1.0396, test_f1: 0.3430
 epoch: 42, train_loss: 1.0521, test_loss: 1.0376, test_f1: 0.3430
 epoch: 43, train_loss: 1.0489, test_loss: 1.0366, test_f1: 0.3411
 epoch: 44, train_loss: 1.0501, test_loss: 1.0351, test_f1: 0.3430
 epoch: 45, train_loss: 1.0474, test_loss: 1.0327, test_f1: 0.3440
 epoch: 46, train_loss: 1.0472, test_loss: 1.0322, test_f1: 0.3430
 epoch: 47, train_loss: 1.0392, test_loss: 1.0300, test_f1: 0.3440
 epoch: 48, train_loss: 1.0424, test_loss: 1.0289, test_f1: 0.3440
 epoch: 49, train_loss: 1.0434, test_loss: 1.0268, test_f1: 0.3430
 epoch: 50, train_loss: 1.0392, test_loss: 1.0251, test_f1: 0.3576
 epoch: 51, train_loss: 1.0404, test_loss: 1.0250, test_f1: 0.3547
 epoch: 52, train_loss: 1.0364, test_loss: 1.0241, test_f1: 0.3577
 epoch: 53, train_loss: 1.0369, test_loss: 1.0239, test_f1: 0.3593
 epoch: 54, train_loss: 1.0391, test_loss: 1.0225, test_f1: 0.3593
 epoch: 55, train_loss: 1.0360, test_loss: 1.0215, test_f1: 0.3618
 epoch: 56, train_loss: 1.0342, test_loss: 1.0211, test_f1: 0.3628
 epoch: 57, train_loss: 1.0361, test_loss: 1.0205, test_f1: 0.3702
 epoch: 58, train_loss: 1.0370, test_loss: 1.0196, test_f1: 0.3696
 epoch: 59, train_loss: 1.0319, test_loss: 1.0192, test_f1: 0.3714
 epoch: 60, train_loss: 1.0274, test_loss: 1.0189, test_f1: 0.3714
 epoch: 61, train_loss: 1.0341, test_loss: 1.0184, test_f1: 0.3714
 epoch: 62, train_loss: 1.0328, test_loss: 1.0188, test_f1: 0.3740
 epoch: 63, train_loss: 1.0276, test_loss: 1.0184, test_f1: 0.3810
 epoch: 64, train_loss: 1.0229, test_loss: 1.0170, test_f1: 0.3810
 epoch: 65, train_loss: 1.0217, test_loss: 1.0158, test_f1: 0.3804
 epoch: 66, train_loss: 1.0263, test_loss: 1.0146, test_f1: 0.3827
 epoch: 67, train_loss: 1.0270, test_loss: 1.0149, test_f1: 0.3827
 epoch: 68, train_loss: 1.0238, test_loss: 1.0141, test_f1: 0.3838
 epoch: 69, train_loss: 1.0281, test_loss: 1.0130, test_f1: 0.3851
 epoch: 70, train_loss: 1.0249, test_loss: 1.0129, test_f1: 0.3898
 epoch: 71, train_loss: 1.0230, test_loss: 1.0122, test_f1: 0.3920
 epoch: 72, train_loss: 1.0174, test_loss: 1.0117, test_f1: 0.3913
 epoch: 73, train_loss: 1.0208, test_loss: 1.0112, test_f1: 0.3913
 epoch: 74, train_loss: 1.0230, test_loss: 1.0095, test_f1: 0.3913
 epoch: 75, train_loss: 1.0212, test_loss: 1.0094, test_f1: 0.3935
 epoch: 76, train_loss: 1.0217, test_loss: 1.0089, test_f1: 0.3956
 epoch: 77, train_loss: 1.0220, test_loss: 1.0086, test_f1: 0.3935
 epoch: 78, train_loss: 1.0217, test_loss: 1.0077, test_f1: 0.3956
 epoch: 79, train_loss: 1.0206, test_loss: 1.0055, test_f1: 0.3956
 epoch: 80, train_loss: 1.0181, test_loss: 1.0067, test_f1: 0.3998
 epoch: 81, train_loss: 1.0189, test_loss: 1.0061, test_f1: 0.3990
 epoch: 82, train_loss: 1.0141, test_loss: 1.0036, test_f1: 0.3992
 epoch: 83, train_loss: 1.0162, test_loss: 1.0029, test_f1: 0.3990
 epoch: 84, train_loss: 1.0157, test_loss: 1.0022, test_f1: 0.3996
 epoch: 85, train_loss: 1.0097, test_loss: 1.0016, test_f1: 0.4009
 epoch: 86, train_loss: 1.0115, test_loss: 1.0014, test_f1: 0.4009
 epoch: 87, train_loss: 1.0158, test_loss: 1.0007, test_f1: 0.4014
 epoch: 88, train_loss: 1.0095, test_loss: 1.0000, test_f1: 0.4014
 epoch: 89, train_loss: 1.0068, test_loss: 0.9988, test_f1: 0.4016
 epoch: 90, train_loss: 1.0025, test_loss: 0.9972, test_f1: 0.4041
 epoch: 91, train_loss: 1.0081, test_loss: 0.9968, test_f1: 0.4052
 epoch: 92, train_loss: 1.0056, test_loss: 0.9968, test_f1: 0.4032
 epoch: 93, train_loss: 1.0084, test_loss: 0.9976, test_f1: 0.4090
 epoch: 94, train_loss: 1.0092, test_loss: 0.9968, test_f1: 0.4094
 epoch: 95, train_loss: 1.0057, test_loss: 0.9959, test_f1: 0.4105
 epoch: 96, train_loss: 1.0028, test_loss: 0.9955, test_f1: 0.4156
 epoch: 97, train_loss: 1.0048, test_loss: 0.9947, test_f1: 0.4132
 epoch: 98, train_loss: 0.9972, test_loss: 0.9937, test_f1: 0.4169
 epoch: 99, train_loss: 1.0035, test_loss: 0.9917, test_f1: 0.4188
##################ITERATION #3 ****************************************
 epoch: 0, train_loss: 1.3409, test_loss: 1.3300, test_f1: 0.2270
 epoch: 1, train_loss: 1.3239, test_loss: 1.3283, test_f1: 0.2270
 epoch: 2, train_loss: 1.3144, test_loss: 1.3280, test_f1: 0.2270
 epoch: 3, train_loss: 1.3028, test_loss: 1.3266, test_f1: 0.2270
 epoch: 4, train_loss: 1.2979, test_loss: 1.3137, test_f1: 0.2270
 epoch: 5, train_loss: 1.2888, test_loss: 1.2963, test_f1: 0.2270
 epoch: 6, train_loss: 1.2798, test_loss: 1.2805, test_f1: 0.2270
 epoch: 7, train_loss: 1.2700, test_loss: 1.2660, test_f1: 0.2320
 epoch: 8, train_loss: 1.2640, test_loss: 1.2525, test_f1: 0.2591
 epoch: 9, train_loss: 1.2536, test_loss: 1.2402, test_f1: 0.2836
 epoch: 10, train_loss: 1.2447, test_loss: 1.2282, test_f1: 0.2999
 epoch: 11, train_loss: 1.2315, test_loss: 1.2151, test_f1: 0.3130
 epoch: 12, train_loss: 1.2196, test_loss: 1.2028, test_f1: 0.3312
 epoch: 13, train_loss: 1.2099, test_loss: 1.1894, test_f1: 0.3394
 epoch: 14, train_loss: 1.1972, test_loss: 1.1768, test_f1: 0.3481
 epoch: 15, train_loss: 1.1881, test_loss: 1.1643, test_f1: 0.3412
 epoch: 16, train_loss: 1.1734, test_loss: 1.1521, test_f1: 0.3354
 epoch: 17, train_loss: 1.1651, test_loss: 1.1411, test_f1: 0.3403
 epoch: 18, train_loss: 1.1533, test_loss: 1.1308, test_f1: 0.3403
 epoch: 19, train_loss: 1.1463, test_loss: 1.1206, test_f1: 0.3384
 epoch: 20, train_loss: 1.1377, test_loss: 1.1123, test_f1: 0.3403
 epoch: 21, train_loss: 1.1282, test_loss: 1.1042, test_f1: 0.3431
 epoch: 22, train_loss: 1.1205, test_loss: 1.0970, test_f1: 0.3430
 epoch: 23, train_loss: 1.1136, test_loss: 1.0908, test_f1: 0.3450
 epoch: 24, train_loss: 1.1081, test_loss: 1.0851, test_f1: 0.3430
 epoch: 25, train_loss: 1.0987, test_loss: 1.0795, test_f1: 0.3430
 epoch: 26, train_loss: 1.0950, test_loss: 1.0743, test_f1: 0.3430
 epoch: 27, train_loss: 1.0906, test_loss: 1.0703, test_f1: 0.3430
 epoch: 28, train_loss: 1.0875, test_loss: 1.0674, test_f1: 0.3430
 epoch: 29, train_loss: 1.0804, test_loss: 1.0638, test_f1: 0.3430
 epoch: 30, train_loss: 1.0798, test_loss: 1.0584, test_f1: 0.3430
 epoch: 31, train_loss: 1.0737, test_loss: 1.0551, test_f1: 0.3430
 epoch: 32, train_loss: 1.0679, test_loss: 1.0530, test_f1: 0.3430
 epoch: 33, train_loss: 1.0682, test_loss: 1.0510, test_f1: 0.3430
 epoch: 34, train_loss: 1.0661, test_loss: 1.0485, test_f1: 0.3430
 epoch: 35, train_loss: 1.0633, test_loss: 1.0471, test_f1: 0.3430
 epoch: 36, train_loss: 1.0613, test_loss: 1.0451, test_f1: 0.3430
 epoch: 37, train_loss: 1.0578, test_loss: 1.0431, test_f1: 0.3430
 epoch: 38, train_loss: 1.0561, test_loss: 1.0411, test_f1: 0.3430
 epoch: 39, train_loss: 1.0488, test_loss: 1.0405, test_f1: 0.3428
 epoch: 40, train_loss: 1.0509, test_loss: 1.0383, test_f1: 0.3428
 epoch: 41, train_loss: 1.0476, test_loss: 1.0378, test_f1: 0.3426
 epoch: 42, train_loss: 1.0447, test_loss: 1.0358, test_f1: 0.3430
 epoch: 43, train_loss: 1.0424, test_loss: 1.0330, test_f1: 0.3428
 epoch: 44, train_loss: 1.0422, test_loss: 1.0331, test_f1: 0.3428
 epoch: 45, train_loss: 1.0385, test_loss: 1.0317, test_f1: 0.3428
 epoch: 46, train_loss: 1.0369, test_loss: 1.0290, test_f1: 0.3428
 epoch: 47, train_loss: 1.0374, test_loss: 1.0288, test_f1: 0.3428
 epoch: 48, train_loss: 1.0342, test_loss: 1.0277, test_f1: 0.3426
 epoch: 49, train_loss: 1.0323, test_loss: 1.0249, test_f1: 0.3426
 epoch: 50, train_loss: 1.0337, test_loss: 1.0244, test_f1: 0.3426
 epoch: 51, train_loss: 1.0312, test_loss: 1.0238, test_f1: 0.3426
 epoch: 52, train_loss: 1.0312, test_loss: 1.0243, test_f1: 0.3428
 epoch: 53, train_loss: 1.0297, test_loss: 1.0251, test_f1: 0.3426
 epoch: 54, train_loss: 1.0306, test_loss: 1.0248, test_f1: 0.3426
 epoch: 55, train_loss: 1.0318, test_loss: 1.0235, test_f1: 0.3440
 epoch: 56, train_loss: 1.0285, test_loss: 1.0229, test_f1: 0.3440
 epoch: 57, train_loss: 1.0275, test_loss: 1.0232, test_f1: 0.3426
 epoch: 58, train_loss: 1.0267, test_loss: 1.0210, test_f1: 0.3426
 epoch: 59, train_loss: 1.0275, test_loss: 1.0199, test_f1: 0.3454
 epoch: 60, train_loss: 1.0257, test_loss: 1.0192, test_f1: 0.3625
 epoch: 61, train_loss: 1.0253, test_loss: 1.0186, test_f1: 0.3627
 epoch: 62, train_loss: 1.0252, test_loss: 1.0168, test_f1: 0.3639
 epoch: 63, train_loss: 1.0245, test_loss: 1.0179, test_f1: 0.3621
 epoch: 64, train_loss: 1.0220, test_loss: 1.0166, test_f1: 0.3658
 epoch: 65, train_loss: 1.0172, test_loss: 1.0154, test_f1: 0.3656
 epoch: 66, train_loss: 1.0234, test_loss: 1.0143, test_f1: 0.3646
 epoch: 67, train_loss: 1.0211, test_loss: 1.0135, test_f1: 0.3705
 epoch: 68, train_loss: 1.0168, test_loss: 1.0128, test_f1: 0.3706
 epoch: 69, train_loss: 1.0205, test_loss: 1.0132, test_f1: 0.3742
 epoch: 70, train_loss: 1.0167, test_loss: 1.0138, test_f1: 0.3790
 epoch: 71, train_loss: 1.0238, test_loss: 1.0130, test_f1: 0.3807
 epoch: 72, train_loss: 1.0208, test_loss: 1.0112, test_f1: 0.3796
 epoch: 73, train_loss: 1.0181, test_loss: 1.0104, test_f1: 0.3828
 epoch: 74, train_loss: 1.0173, test_loss: 1.0092, test_f1: 0.3821
 epoch: 75, train_loss: 1.0202, test_loss: 1.0085, test_f1: 0.3828
 epoch: 76, train_loss: 1.0182, test_loss: 1.0084, test_f1: 0.3852
 epoch: 77, train_loss: 1.0183, test_loss: 1.0077, test_f1: 0.3879
 epoch: 78, train_loss: 1.0185, test_loss: 1.0066, test_f1: 0.3879
 epoch: 79, train_loss: 1.0122, test_loss: 1.0059, test_f1: 0.3877
 epoch: 80, train_loss: 1.0159, test_loss: 1.0040, test_f1: 0.3892
 epoch: 81, train_loss: 1.0138, test_loss: 1.0053, test_f1: 0.3882
 epoch: 82, train_loss: 1.0131, test_loss: 1.0051, test_f1: 0.3927
 epoch: 83, train_loss: 1.0119, test_loss: 1.0045, test_f1: 0.3939
 epoch: 84, train_loss: 1.0128, test_loss: 1.0030, test_f1: 0.3936
 epoch: 85, train_loss: 1.0095, test_loss: 1.0020, test_f1: 0.3929
 epoch: 86, train_loss: 1.0104, test_loss: 1.0008, test_f1: 0.3933
 epoch: 87, train_loss: 1.0095, test_loss: 1.0009, test_f1: 0.3935
 epoch: 88, train_loss: 1.0108, test_loss: 1.0013, test_f1: 0.3935
 epoch: 89, train_loss: 1.0023, test_loss: 0.9996, test_f1: 0.3964
 epoch: 90, train_loss: 1.0120, test_loss: 0.9983, test_f1: 0.3952
 epoch: 91, train_loss: 0.9994, test_loss: 0.9988, test_f1: 0.3978
 epoch: 92, train_loss: 1.0020, test_loss: 0.9982, test_f1: 0.4005
 epoch: 93, train_loss: 1.0030, test_loss: 0.9978, test_f1: 0.4012
 epoch: 94, train_loss: 1.0056, test_loss: 0.9966, test_f1: 0.4008
 epoch: 95, train_loss: 1.0052, test_loss: 0.9968, test_f1: 0.4001
 epoch: 96, train_loss: 1.0064, test_loss: 0.9953, test_f1: 0.4001
 epoch: 97, train_loss: 1.0038, test_loss: 0.9948, test_f1: 0.4008
 epoch: 98, train_loss: 1.0009, test_loss: 0.9934, test_f1: 0.4001
 epoch: 99, train_loss: 1.0012, test_loss: 0.9945, test_f1: 0.4019
##################ITERATION #4 ****************************************
 epoch: 0, train_loss: 1.3083, test_loss: 1.3152, test_f1: 0.2270
 epoch: 1, train_loss: 1.2982, test_loss: 1.3152, test_f1: 0.2270
 epoch: 2, train_loss: 1.2897, test_loss: 1.3141, test_f1: 0.2270
 epoch: 3, train_loss: 1.2825, test_loss: 1.3045, test_f1: 0.2270
 epoch: 4, train_loss: 1.2768, test_loss: 1.2893, test_f1: 0.2270
 epoch: 5, train_loss: 1.2698, test_loss: 1.2732, test_f1: 0.2270
 epoch: 6, train_loss: 1.2636, test_loss: 1.2611, test_f1: 0.2270
 epoch: 7, train_loss: 1.2546, test_loss: 1.2499, test_f1: 0.2270
 epoch: 8, train_loss: 1.2450, test_loss: 1.2392, test_f1: 0.2270
 epoch: 9, train_loss: 1.2384, test_loss: 1.2284, test_f1: 0.2320
 epoch: 10, train_loss: 1.2265, test_loss: 1.2167, test_f1: 0.2344
 epoch: 11, train_loss: 1.2153, test_loss: 1.2036, test_f1: 0.2690
 epoch: 12, train_loss: 1.2045, test_loss: 1.1895, test_f1: 0.2903
 epoch: 13, train_loss: 1.1941, test_loss: 1.1760, test_f1: 0.3084
 epoch: 14, train_loss: 1.1838, test_loss: 1.1627, test_f1: 0.3184
 epoch: 15, train_loss: 1.1715, test_loss: 1.1501, test_f1: 0.3293
 epoch: 16, train_loss: 1.1583, test_loss: 1.1386, test_f1: 0.3413
 epoch: 17, train_loss: 1.1515, test_loss: 1.1279, test_f1: 0.3422
 epoch: 18, train_loss: 1.1425, test_loss: 1.1188, test_f1: 0.3422
 epoch: 19, train_loss: 1.1341, test_loss: 1.1107, test_f1: 0.3422
 epoch: 20, train_loss: 1.1249, test_loss: 1.1028, test_f1: 0.3460
 epoch: 21, train_loss: 1.1163, test_loss: 1.0960, test_f1: 0.3460
 epoch: 22, train_loss: 1.1098, test_loss: 1.0901, test_f1: 0.3460
 epoch: 23, train_loss: 1.1031, test_loss: 1.0852, test_f1: 0.3441
 epoch: 24, train_loss: 1.0976, test_loss: 1.0803, test_f1: 0.3450
 epoch: 25, train_loss: 1.0940, test_loss: 1.0756, test_f1: 0.3441
 epoch: 26, train_loss: 1.0894, test_loss: 1.0722, test_f1: 0.3450
 epoch: 27, train_loss: 1.0858, test_loss: 1.0676, test_f1: 0.3573
 epoch: 28, train_loss: 1.0811, test_loss: 1.0653, test_f1: 0.3563
 epoch: 29, train_loss: 1.0792, test_loss: 1.0637, test_f1: 0.3563
 epoch: 30, train_loss: 1.0749, test_loss: 1.0625, test_f1: 0.3554
 epoch: 31, train_loss: 1.0674, test_loss: 1.0611, test_f1: 0.3554
 epoch: 32, train_loss: 1.0703, test_loss: 1.0601, test_f1: 0.3554
 epoch: 33, train_loss: 1.0671, test_loss: 1.0576, test_f1: 0.3554
 epoch: 34, train_loss: 1.0582, test_loss: 1.0555, test_f1: 0.3554
 epoch: 35, train_loss: 1.0621, test_loss: 1.0521, test_f1: 0.3554
 epoch: 36, train_loss: 1.0593, test_loss: 1.0509, test_f1: 0.3554
 epoch: 37, train_loss: 1.0550, test_loss: 1.0506, test_f1: 0.3554
 epoch: 38, train_loss: 1.0542, test_loss: 1.0495, test_f1: 0.3554
 epoch: 39, train_loss: 1.0498, test_loss: 1.0463, test_f1: 0.3554
 epoch: 40, train_loss: 1.0526, test_loss: 1.0450, test_f1: 0.3554
 epoch: 41, train_loss: 1.0474, test_loss: 1.0454, test_f1: 0.3554
 epoch: 42, train_loss: 1.0442, test_loss: 1.0420, test_f1: 0.3565
 epoch: 43, train_loss: 1.0457, test_loss: 1.0420, test_f1: 0.3567
 epoch: 44, train_loss: 1.0429, test_loss: 1.0389, test_f1: 0.3567
 epoch: 45, train_loss: 1.0437, test_loss: 1.0372, test_f1: 0.3602
 epoch: 46, train_loss: 1.0423, test_loss: 1.0368, test_f1: 0.3593
 epoch: 47, train_loss: 1.0392, test_loss: 1.0382, test_f1: 0.3616
 epoch: 48, train_loss: 1.0390, test_loss: 1.0345, test_f1: 0.3618
 epoch: 49, train_loss: 1.0346, test_loss: 1.0329, test_f1: 0.3625
 epoch: 50, train_loss: 1.0363, test_loss: 1.0306, test_f1: 0.3653
 epoch: 51, train_loss: 1.0341, test_loss: 1.0307, test_f1: 0.3650
 epoch: 52, train_loss: 1.0364, test_loss: 1.0316, test_f1: 0.3677
 epoch: 53, train_loss: 1.0276, test_loss: 1.0293, test_f1: 0.3671
 epoch: 54, train_loss: 1.0317, test_loss: 1.0270, test_f1: 0.3672
 epoch: 55, train_loss: 1.0304, test_loss: 1.0272, test_f1: 0.3690
 epoch: 56, train_loss: 1.0288, test_loss: 1.0262, test_f1: 0.3702
 epoch: 57, train_loss: 1.0242, test_loss: 1.0262, test_f1: 0.3680
 epoch: 58, train_loss: 1.0278, test_loss: 1.0247, test_f1: 0.3705
 epoch: 59, train_loss: 1.0315, test_loss: 1.0238, test_f1: 0.3750
 epoch: 60, train_loss: 1.0243, test_loss: 1.0225, test_f1: 0.3748
 epoch: 61, train_loss: 1.0258, test_loss: 1.0217, test_f1: 0.3729
 epoch: 62, train_loss: 1.0292, test_loss: 1.0206, test_f1: 0.3729
 epoch: 63, train_loss: 1.0242, test_loss: 1.0207, test_f1: 0.3753
 epoch: 64, train_loss: 1.0216, test_loss: 1.0195, test_f1: 0.3764
 epoch: 65, train_loss: 1.0245, test_loss: 1.0200, test_f1: 0.3788
 epoch: 66, train_loss: 1.0203, test_loss: 1.0199, test_f1: 0.3805
 epoch: 67, train_loss: 1.0197, test_loss: 1.0185, test_f1: 0.3805
 epoch: 68, train_loss: 1.0201, test_loss: 1.0168, test_f1: 0.3805
 epoch: 69, train_loss: 1.0209, test_loss: 1.0163, test_f1: 0.3860
 epoch: 70, train_loss: 1.0202, test_loss: 1.0132, test_f1: 0.3845
 epoch: 71, train_loss: 1.0201, test_loss: 1.0134, test_f1: 0.3854
 epoch: 72, train_loss: 1.0183, test_loss: 1.0127, test_f1: 0.3869
 epoch: 73, train_loss: 1.0174, test_loss: 1.0115, test_f1: 0.3914
 epoch: 74, train_loss: 1.0188, test_loss: 1.0105, test_f1: 0.3958
 epoch: 75, train_loss: 1.0196, test_loss: 1.0096, test_f1: 0.3959
 epoch: 76, train_loss: 1.0168, test_loss: 1.0095, test_f1: 0.3983
 epoch: 77, train_loss: 1.0127, test_loss: 1.0073, test_f1: 0.3987
 epoch: 78, train_loss: 1.0149, test_loss: 1.0060, test_f1: 0.4009
 epoch: 79, train_loss: 1.0158, test_loss: 1.0047, test_f1: 0.3997
 epoch: 80, train_loss: 1.0150, test_loss: 1.0043, test_f1: 0.4100
 epoch: 81, train_loss: 1.0118, test_loss: 1.0016, test_f1: 0.4103
 epoch: 82, train_loss: 1.0125, test_loss: 1.0008, test_f1: 0.4080
 epoch: 83, train_loss: 1.0102, test_loss: 1.0037, test_f1: 0.4095
 epoch: 84, train_loss: 1.0048, test_loss: 0.9995, test_f1: 0.4084
 epoch: 85, train_loss: 1.0116, test_loss: 0.9977, test_f1: 0.4067
 epoch: 86, train_loss: 1.0083, test_loss: 0.9973, test_f1: 0.4099
 epoch: 87, train_loss: 1.0098, test_loss: 0.9972, test_f1: 0.4117
 epoch: 88, train_loss: 1.0026, test_loss: 0.9969, test_f1: 0.4109
 epoch: 89, train_loss: 1.0060, test_loss: 0.9957, test_f1: 0.4128
 epoch: 90, train_loss: 1.0046, test_loss: 0.9924, test_f1: 0.4151
 epoch: 91, train_loss: 1.0026, test_loss: 0.9937, test_f1: 0.4147
 epoch: 92, train_loss: 1.0042, test_loss: 0.9919, test_f1: 0.4188
 epoch: 93, train_loss: 1.0008, test_loss: 0.9878, test_f1: 0.4216
 epoch: 94, train_loss: 1.0023, test_loss: 0.9882, test_f1: 0.4244
 epoch: 95, train_loss: 0.9987, test_loss: 0.9879, test_f1: 0.4236
 epoch: 96, train_loss: 1.0012, test_loss: 0.9875, test_f1: 0.4225
 epoch: 97, train_loss: 0.9991, test_loss: 0.9851, test_f1: 0.4264
 epoch: 98, train_loss: 1.0021, test_loss: 0.9830, test_f1: 0.4323
 epoch: 99, train_loss: 1.0046, test_loss: 0.9824, test_f1: 0.4327
##################ITERATION #5 ****************************************
 epoch: 0, train_loss: 1.3364, test_loss: 1.3153, test_f1: 0.2270
 epoch: 1, train_loss: 1.3085, test_loss: 1.3134, test_f1: 0.2270
 epoch: 2, train_loss: 1.2914, test_loss: 1.3064, test_f1: 0.2270
 epoch: 3, train_loss: 1.2792, test_loss: 1.2900, test_f1: 0.2270
 epoch: 4, train_loss: 1.2624, test_loss: 1.2663, test_f1: 0.2270
 epoch: 5, train_loss: 1.2528, test_loss: 1.2431, test_f1: 0.2270
 epoch: 6, train_loss: 1.2359, test_loss: 1.2219, test_f1: 0.2344
 epoch: 7, train_loss: 1.2203, test_loss: 1.2013, test_f1: 0.2836
 epoch: 8, train_loss: 1.2059, test_loss: 1.1825, test_f1: 0.3059
 epoch: 9, train_loss: 1.1999, test_loss: 1.1672, test_f1: 0.3287
 epoch: 10, train_loss: 1.1890, test_loss: 1.1521, test_f1: 0.3389
 epoch: 11, train_loss: 1.1734, test_loss: 1.1398, test_f1: 0.3364
 epoch: 12, train_loss: 1.1612, test_loss: 1.1282, test_f1: 0.3403
 epoch: 13, train_loss: 1.1518, test_loss: 1.1177, test_f1: 0.3422
 epoch: 14, train_loss: 1.1463, test_loss: 1.1076, test_f1: 0.3422
 epoch: 15, train_loss: 1.1357, test_loss: 1.0993, test_f1: 0.3422
 epoch: 16, train_loss: 1.1234, test_loss: 1.0926, test_f1: 0.3422
 epoch: 17, train_loss: 1.1236, test_loss: 1.0856, test_f1: 0.3422
 epoch: 18, train_loss: 1.1128, test_loss: 1.0804, test_f1: 0.3422
 epoch: 19, train_loss: 1.1067, test_loss: 1.0752, test_f1: 0.3422
 epoch: 20, train_loss: 1.1051, test_loss: 1.0715, test_f1: 0.3422
 epoch: 21, train_loss: 1.0922, test_loss: 1.0676, test_f1: 0.3422
 epoch: 22, train_loss: 1.0914, test_loss: 1.0648, test_f1: 0.3422
 epoch: 23, train_loss: 1.0906, test_loss: 1.0622, test_f1: 0.3432
 epoch: 24, train_loss: 1.0810, test_loss: 1.0598, test_f1: 0.3422
 epoch: 25, train_loss: 1.0783, test_loss: 1.0572, test_f1: 0.3450
 epoch: 26, train_loss: 1.0716, test_loss: 1.0548, test_f1: 0.3441
 epoch: 27, train_loss: 1.0678, test_loss: 1.0527, test_f1: 0.3431
 epoch: 28, train_loss: 1.0583, test_loss: 1.0504, test_f1: 0.3449
 epoch: 29, train_loss: 1.0632, test_loss: 1.0479, test_f1: 0.3449
 epoch: 30, train_loss: 1.0631, test_loss: 1.0461, test_f1: 0.3449
 epoch: 31, train_loss: 1.0594, test_loss: 1.0446, test_f1: 0.3449
 epoch: 32, train_loss: 1.0544, test_loss: 1.0431, test_f1: 0.3449
 epoch: 33, train_loss: 1.0502, test_loss: 1.0416, test_f1: 0.3440
 epoch: 34, train_loss: 1.0497, test_loss: 1.0399, test_f1: 0.3429
 epoch: 35, train_loss: 1.0496, test_loss: 1.0383, test_f1: 0.3439
 epoch: 36, train_loss: 1.0463, test_loss: 1.0373, test_f1: 0.3587
 epoch: 37, train_loss: 1.0436, test_loss: 1.0363, test_f1: 0.3587
 epoch: 38, train_loss: 1.0445, test_loss: 1.0342, test_f1: 0.3639
 epoch: 39, train_loss: 1.0443, test_loss: 1.0330, test_f1: 0.3689
 epoch: 40, train_loss: 1.0356, test_loss: 1.0309, test_f1: 0.3739
 epoch: 41, train_loss: 1.0343, test_loss: 1.0306, test_f1: 0.3733
 epoch: 42, train_loss: 1.0375, test_loss: 1.0294, test_f1: 0.3828
 epoch: 43, train_loss: 1.0286, test_loss: 1.0285, test_f1: 0.3852
 epoch: 44, train_loss: 1.0270, test_loss: 1.0269, test_f1: 0.3885
 epoch: 45, train_loss: 1.0274, test_loss: 1.0250, test_f1: 0.3930
 epoch: 46, train_loss: 1.0282, test_loss: 1.0239, test_f1: 0.3924
 epoch: 47, train_loss: 1.0261, test_loss: 1.0226, test_f1: 0.3918
 epoch: 48, train_loss: 1.0245, test_loss: 1.0213, test_f1: 0.3928
 epoch: 49, train_loss: 1.0246, test_loss: 1.0204, test_f1: 0.3929
 epoch: 50, train_loss: 1.0245, test_loss: 1.0196, test_f1: 0.3946
 epoch: 51, train_loss: 1.0169, test_loss: 1.0186, test_f1: 0.4026
 epoch: 52, train_loss: 1.0173, test_loss: 1.0178, test_f1: 0.4030
 epoch: 53, train_loss: 1.0171, test_loss: 1.0177, test_f1: 0.4030
 epoch: 54, train_loss: 1.0224, test_loss: 1.0171, test_f1: 0.4010
 epoch: 55, train_loss: 1.0137, test_loss: 1.0156, test_f1: 0.4010
 epoch: 56, train_loss: 1.0102, test_loss: 1.0152, test_f1: 0.4052
 epoch: 57, train_loss: 1.0151, test_loss: 1.0139, test_f1: 0.4120
 epoch: 58, train_loss: 1.0142, test_loss: 1.0122, test_f1: 0.4140
 epoch: 59, train_loss: 1.0147, test_loss: 1.0129, test_f1: 0.4100
 epoch: 60, train_loss: 1.0130, test_loss: 1.0128, test_f1: 0.4094
 epoch: 61, train_loss: 1.0151, test_loss: 1.0119, test_f1: 0.4160
 epoch: 62, train_loss: 1.0149, test_loss: 1.0108, test_f1: 0.4134
 epoch: 63, train_loss: 1.0148, test_loss: 1.0106, test_f1: 0.4174
 epoch: 64, train_loss: 1.0100, test_loss: 1.0095, test_f1: 0.4161
 epoch: 65, train_loss: 1.0102, test_loss: 1.0080, test_f1: 0.4201
 epoch: 66, train_loss: 1.0127, test_loss: 1.0082, test_f1: 0.4181
 epoch: 67, train_loss: 1.0097, test_loss: 1.0070, test_f1: 0.4186
 epoch: 68, train_loss: 1.0104, test_loss: 1.0072, test_f1: 0.4225
 epoch: 69, train_loss: 1.0031, test_loss: 1.0055, test_f1: 0.4227
 epoch: 70, train_loss: 1.0019, test_loss: 1.0050, test_f1: 0.4228
 epoch: 71, train_loss: 1.0004, test_loss: 1.0043, test_f1: 0.4248
 epoch: 72, train_loss: 1.0060, test_loss: 1.0042, test_f1: 0.4240
 epoch: 73, train_loss: 0.9986, test_loss: 1.0027, test_f1: 0.4240
 epoch: 74, train_loss: 0.9982, test_loss: 1.0016, test_f1: 0.4277
 epoch: 75, train_loss: 1.0008, test_loss: 1.0001, test_f1: 0.4279
 epoch: 76, train_loss: 0.9935, test_loss: 0.9996, test_f1: 0.4313
 epoch: 77, train_loss: 1.0001, test_loss: 0.9991, test_f1: 0.4342
 epoch: 78, train_loss: 0.9993, test_loss: 0.9995, test_f1: 0.4348
 epoch: 79, train_loss: 0.9955, test_loss: 0.9969, test_f1: 0.4377
 epoch: 80, train_loss: 0.9947, test_loss: 0.9938, test_f1: 0.4375
 epoch: 81, train_loss: 0.9912, test_loss: 0.9936, test_f1: 0.4352
 epoch: 82, train_loss: 0.9933, test_loss: 0.9934, test_f1: 0.4369
 epoch: 83, train_loss: 0.9918, test_loss: 0.9934, test_f1: 0.4379
 epoch: 84, train_loss: 0.9874, test_loss: 0.9929, test_f1: 0.4369
 epoch: 85, train_loss: 0.9904, test_loss: 0.9911, test_f1: 0.4369
 epoch: 86, train_loss: 0.9884, test_loss: 0.9903, test_f1: 0.4371
 epoch: 87, train_loss: 0.9935, test_loss: 0.9901, test_f1: 0.4384
 epoch: 88, train_loss: 0.9841, test_loss: 0.9889, test_f1: 0.4375
 epoch: 89, train_loss: 0.9909, test_loss: 0.9879, test_f1: 0.4369
 epoch: 90, train_loss: 0.9836, test_loss: 0.9876, test_f1: 0.4409
 epoch: 91, train_loss: 0.9856, test_loss: 0.9858, test_f1: 0.4409
 epoch: 92, train_loss: 0.9850, test_loss: 0.9849, test_f1: 0.4423
 epoch: 93, train_loss: 0.9859, test_loss: 0.9834, test_f1: 0.4442
 epoch: 94, train_loss: 0.9842, test_loss: 0.9826, test_f1: 0.4450
 epoch: 95, train_loss: 0.9856, test_loss: 0.9819, test_f1: 0.4448
 epoch: 96, train_loss: 0.9821, test_loss: 0.9814, test_f1: 0.4448
 epoch: 97, train_loss: 0.9816, test_loss: 0.9800, test_f1: 0.4512
 epoch: 98, train_loss: 0.9825, test_loss: 0.9798, test_f1: 0.4473
 epoch: 99, train_loss: 0.9785, test_loss: 0.9784, test_f1: 0.4536
##################ITERATION #6 ****************************************
 epoch: 0, train_loss: 1.2858, test_loss: 1.3117, test_f1: 0.2270
 epoch: 1, train_loss: 1.2577, test_loss: 1.3101, test_f1: 0.2270
 epoch: 2, train_loss: 1.2428, test_loss: 1.2971, test_f1: 0.2270
 epoch: 3, train_loss: 1.2241, test_loss: 1.2640, test_f1: 0.2270
 epoch: 4, train_loss: 1.2081, test_loss: 1.2177, test_f1: 0.2631
 epoch: 5, train_loss: 1.1963, test_loss: 1.1855, test_f1: 0.3416
 epoch: 6, train_loss: 1.1871, test_loss: 1.1660, test_f1: 0.3452
 epoch: 7, train_loss: 1.1747, test_loss: 1.1520, test_f1: 0.3413
 epoch: 8, train_loss: 1.1650, test_loss: 1.1409, test_f1: 0.3422
 epoch: 9, train_loss: 1.1523, test_loss: 1.1312, test_f1: 0.3422
 epoch: 10, train_loss: 1.1449, test_loss: 1.1221, test_f1: 0.3422
 epoch: 11, train_loss: 1.1395, test_loss: 1.1148, test_f1: 0.3422
 epoch: 12, train_loss: 1.1288, test_loss: 1.1090, test_f1: 0.3422
 epoch: 13, train_loss: 1.1212, test_loss: 1.1035, test_f1: 0.3460
 epoch: 14, train_loss: 1.1173, test_loss: 1.0978, test_f1: 0.3460
 epoch: 15, train_loss: 1.1131, test_loss: 1.0926, test_f1: 0.3460
 epoch: 16, train_loss: 1.1018, test_loss: 1.0890, test_f1: 0.3460
 epoch: 17, train_loss: 1.0983, test_loss: 1.0846, test_f1: 0.3460
 epoch: 18, train_loss: 1.0893, test_loss: 1.0813, test_f1: 0.3460
 epoch: 19, train_loss: 1.0886, test_loss: 1.0780, test_f1: 0.3460
 epoch: 20, train_loss: 1.0843, test_loss: 1.0742, test_f1: 0.3460
 epoch: 21, train_loss: 1.0782, test_loss: 1.0720, test_f1: 0.3460
 epoch: 22, train_loss: 1.0787, test_loss: 1.0684, test_f1: 0.3460
 epoch: 23, train_loss: 1.0690, test_loss: 1.0653, test_f1: 0.3460
 epoch: 24, train_loss: 1.0676, test_loss: 1.0629, test_f1: 0.3469
 epoch: 25, train_loss: 1.0696, test_loss: 1.0596, test_f1: 0.3460
 epoch: 26, train_loss: 1.0664, test_loss: 1.0576, test_f1: 0.3450
 epoch: 27, train_loss: 1.0637, test_loss: 1.0569, test_f1: 0.3440
 epoch: 28, train_loss: 1.0609, test_loss: 1.0542, test_f1: 0.3450
 epoch: 29, train_loss: 1.0610, test_loss: 1.0518, test_f1: 0.3440
 epoch: 30, train_loss: 1.0566, test_loss: 1.0504, test_f1: 0.3440
 epoch: 31, train_loss: 1.0533, test_loss: 1.0484, test_f1: 0.3465
 epoch: 32, train_loss: 1.0506, test_loss: 1.0492, test_f1: 0.3441
 epoch: 33, train_loss: 1.0533, test_loss: 1.0462, test_f1: 0.3572
 epoch: 34, train_loss: 1.0481, test_loss: 1.0433, test_f1: 0.3572
 epoch: 35, train_loss: 1.0493, test_loss: 1.0425, test_f1: 0.3572
 epoch: 36, train_loss: 1.0409, test_loss: 1.0430, test_f1: 0.3562
 epoch: 37, train_loss: 1.0411, test_loss: 1.0396, test_f1: 0.3572
 epoch: 38, train_loss: 1.0418, test_loss: 1.0375, test_f1: 0.3572
 epoch: 39, train_loss: 1.0386, test_loss: 1.0367, test_f1: 0.3600
 epoch: 40, train_loss: 1.0383, test_loss: 1.0365, test_f1: 0.3617
 epoch: 41, train_loss: 1.0333, test_loss: 1.0352, test_f1: 0.3627
 epoch: 42, train_loss: 1.0302, test_loss: 1.0342, test_f1: 0.3645
 epoch: 43, train_loss: 1.0297, test_loss: 1.0318, test_f1: 0.3653
 epoch: 44, train_loss: 1.0346, test_loss: 1.0318, test_f1: 0.3618
 epoch: 45, train_loss: 1.0338, test_loss: 1.0282, test_f1: 0.3664
 epoch: 46, train_loss: 1.0273, test_loss: 1.0273, test_f1: 0.3771
 epoch: 47, train_loss: 1.0245, test_loss: 1.0280, test_f1: 0.3755
 epoch: 48, train_loss: 1.0275, test_loss: 1.0248, test_f1: 0.3768
 epoch: 49, train_loss: 1.0224, test_loss: 1.0220, test_f1: 0.3783
 epoch: 50, train_loss: 1.0248, test_loss: 1.0192, test_f1: 0.3783
 epoch: 51, train_loss: 1.0184, test_loss: 1.0184, test_f1: 0.3807
 epoch: 52, train_loss: 1.0237, test_loss: 1.0191, test_f1: 0.3784
 epoch: 53, train_loss: 1.0218, test_loss: 1.0193, test_f1: 0.3778
 epoch: 54, train_loss: 1.0174, test_loss: 1.0185, test_f1: 0.3807
 epoch: 55, train_loss: 1.0199, test_loss: 1.0172, test_f1: 0.3784
 epoch: 56, train_loss: 1.0172, test_loss: 1.0172, test_f1: 0.3819
 epoch: 57, train_loss: 1.0151, test_loss: 1.0160, test_f1: 0.3843
 epoch: 58, train_loss: 1.0159, test_loss: 1.0154, test_f1: 0.3878
 epoch: 59, train_loss: 1.0201, test_loss: 1.0152, test_f1: 0.3881
 epoch: 60, train_loss: 1.0137, test_loss: 1.0149, test_f1: 0.3897
 epoch: 61, train_loss: 1.0124, test_loss: 1.0122, test_f1: 0.3904
 epoch: 62, train_loss: 1.0150, test_loss: 1.0139, test_f1: 0.3882
 epoch: 63, train_loss: 1.0062, test_loss: 1.0118, test_f1: 0.3898
 epoch: 64, train_loss: 1.0102, test_loss: 1.0094, test_f1: 0.3965
 epoch: 65, train_loss: 1.0065, test_loss: 1.0105, test_f1: 0.4085
 epoch: 66, train_loss: 1.0131, test_loss: 1.0082, test_f1: 0.4016
 epoch: 67, train_loss: 1.0073, test_loss: 1.0079, test_f1: 0.4105
 epoch: 68, train_loss: 1.0058, test_loss: 1.0048, test_f1: 0.4051
 epoch: 69, train_loss: 1.0068, test_loss: 1.0045, test_f1: 0.4132
 epoch: 70, train_loss: 1.0029, test_loss: 1.0017, test_f1: 0.4169
 epoch: 71, train_loss: 1.0049, test_loss: 1.0021, test_f1: 0.4084
 epoch: 72, train_loss: 1.0054, test_loss: 1.0011, test_f1: 0.4127
 epoch: 73, train_loss: 1.0043, test_loss: 0.9986, test_f1: 0.4106
 epoch: 74, train_loss: 1.0076, test_loss: 1.0006, test_f1: 0.4209
 epoch: 75, train_loss: 1.0052, test_loss: 0.9990, test_f1: 0.4189
 epoch: 76, train_loss: 1.0065, test_loss: 0.9992, test_f1: 0.4209
 epoch: 77, train_loss: 1.0025, test_loss: 1.0013, test_f1: 0.4223
 epoch: 78, train_loss: 1.0011, test_loss: 0.9965, test_f1: 0.4248
 epoch: 79, train_loss: 0.9994, test_loss: 0.9950, test_f1: 0.4397
 epoch: 80, train_loss: 0.9990, test_loss: 0.9946, test_f1: 0.4358
 epoch: 81, train_loss: 0.9962, test_loss: 0.9952, test_f1: 0.4401
 epoch: 82, train_loss: 0.9975, test_loss: 0.9947, test_f1: 0.4347
 epoch: 83, train_loss: 1.0005, test_loss: 0.9934, test_f1: 0.4386
 epoch: 84, train_loss: 0.9955, test_loss: 0.9918, test_f1: 0.4370
 epoch: 85, train_loss: 0.9885, test_loss: 0.9939, test_f1: 0.4400
 epoch: 86, train_loss: 0.9967, test_loss: 0.9924, test_f1: 0.4420
 epoch: 87, train_loss: 0.9964, test_loss: 0.9904, test_f1: 0.4400
 epoch: 88, train_loss: 0.9945, test_loss: 0.9875, test_f1: 0.4427
 epoch: 89, train_loss: 0.9873, test_loss: 0.9891, test_f1: 0.4477
 epoch: 90, train_loss: 0.9912, test_loss: 0.9880, test_f1: 0.4501
 epoch: 91, train_loss: 0.9914, test_loss: 0.9877, test_f1: 0.4517
 epoch: 92, train_loss: 0.9868, test_loss: 0.9853, test_f1: 0.4501
 epoch: 93, train_loss: 0.9921, test_loss: 0.9850, test_f1: 0.4511
 epoch: 94, train_loss: 0.9902, test_loss: 0.9886, test_f1: 0.4483
 epoch: 95, train_loss: 0.9902, test_loss: 0.9837, test_f1: 0.4535
 epoch: 96, train_loss: 0.9899, test_loss: 0.9842, test_f1: 0.4544
 epoch: 97, train_loss: 0.9836, test_loss: 0.9817, test_f1: 0.4537
 epoch: 98, train_loss: 0.9852, test_loss: 0.9804, test_f1: 0.4544
 epoch: 99, train_loss: 0.9843, test_loss: 0.9813, test_f1: 0.4553
##################ITERATION #7 ****************************************
 epoch: 0, train_loss: 1.3028, test_loss: 1.3189, test_f1: 0.2270
 epoch: 1, train_loss: 1.2800, test_loss: 1.3103, test_f1: 0.2270
 epoch: 2, train_loss: 1.2720, test_loss: 1.2907, test_f1: 0.2270
 epoch: 3, train_loss: 1.2550, test_loss: 1.2584, test_f1: 0.2270
 epoch: 4, train_loss: 1.2421, test_loss: 1.2277, test_f1: 0.2270
 epoch: 5, train_loss: 1.2328, test_loss: 1.2050, test_f1: 0.2270
 epoch: 6, train_loss: 1.2115, test_loss: 1.1888, test_f1: 0.2584
 epoch: 7, train_loss: 1.2047, test_loss: 1.1743, test_f1: 0.2851
 epoch: 8, train_loss: 1.2003, test_loss: 1.1609, test_f1: 0.3179
 epoch: 9, train_loss: 1.1817, test_loss: 1.1479, test_f1: 0.3273
 epoch: 10, train_loss: 1.1699, test_loss: 1.1365, test_f1: 0.3384
 epoch: 11, train_loss: 1.1526, test_loss: 1.1246, test_f1: 0.3477
 epoch: 12, train_loss: 1.1523, test_loss: 1.1149, test_f1: 0.3487
 epoch: 13, train_loss: 1.1401, test_loss: 1.1056, test_f1: 0.3516
 epoch: 14, train_loss: 1.1283, test_loss: 1.0967, test_f1: 0.3545
 epoch: 15, train_loss: 1.1200, test_loss: 1.0885, test_f1: 0.3545
 epoch: 16, train_loss: 1.1174, test_loss: 1.0803, test_f1: 0.3564
 epoch: 17, train_loss: 1.1095, test_loss: 1.0737, test_f1: 0.3641
 epoch: 18, train_loss: 1.0956, test_loss: 1.0677, test_f1: 0.3668
 epoch: 19, train_loss: 1.0915, test_loss: 1.0620, test_f1: 0.3693
 epoch: 20, train_loss: 1.0885, test_loss: 1.0577, test_f1: 0.3821
 epoch: 21, train_loss: 1.0844, test_loss: 1.0538, test_f1: 0.3859
 epoch: 22, train_loss: 1.0780, test_loss: 1.0490, test_f1: 0.3969
 epoch: 23, train_loss: 1.0715, test_loss: 1.0454, test_f1: 0.4073
 epoch: 24, train_loss: 1.0681, test_loss: 1.0418, test_f1: 0.4180
 epoch: 25, train_loss: 1.0607, test_loss: 1.0392, test_f1: 0.4210
 epoch: 26, train_loss: 1.0588, test_loss: 1.0362, test_f1: 0.4243
 epoch: 27, train_loss: 1.0522, test_loss: 1.0348, test_f1: 0.4278
 epoch: 28, train_loss: 1.0472, test_loss: 1.0325, test_f1: 0.4262
 epoch: 29, train_loss: 1.0441, test_loss: 1.0305, test_f1: 0.4256
 epoch: 30, train_loss: 1.0419, test_loss: 1.0274, test_f1: 0.4338
 epoch: 31, train_loss: 1.0355, test_loss: 1.0251, test_f1: 0.4404
 epoch: 32, train_loss: 1.0378, test_loss: 1.0227, test_f1: 0.4422
 epoch: 33, train_loss: 1.0334, test_loss: 1.0213, test_f1: 0.4411
 epoch: 34, train_loss: 1.0301, test_loss: 1.0190, test_f1: 0.4421
 epoch: 35, train_loss: 1.0305, test_loss: 1.0171, test_f1: 0.4439
 epoch: 36, train_loss: 1.0259, test_loss: 1.0156, test_f1: 0.4436
 epoch: 37, train_loss: 1.0204, test_loss: 1.0133, test_f1: 0.4442
 epoch: 38, train_loss: 1.0244, test_loss: 1.0109, test_f1: 0.4460
 epoch: 39, train_loss: 1.0215, test_loss: 1.0066, test_f1: 0.4442
 epoch: 40, train_loss: 1.0151, test_loss: 1.0047, test_f1: 0.4442
 epoch: 41, train_loss: 1.0097, test_loss: 1.0039, test_f1: 0.4449
 epoch: 42, train_loss: 1.0141, test_loss: 1.0026, test_f1: 0.4464
 epoch: 43, train_loss: 1.0061, test_loss: 1.0001, test_f1: 0.4498
 epoch: 44, train_loss: 1.0060, test_loss: 0.9990, test_f1: 0.4500
 epoch: 45, train_loss: 1.0046, test_loss: 0.9961, test_f1: 0.4537
 epoch: 46, train_loss: 0.9977, test_loss: 0.9946, test_f1: 0.4547
 epoch: 47, train_loss: 1.0007, test_loss: 0.9927, test_f1: 0.4581
 epoch: 48, train_loss: 0.9990, test_loss: 0.9926, test_f1: 0.4569
 epoch: 49, train_loss: 0.9987, test_loss: 0.9922, test_f1: 0.4585
 epoch: 50, train_loss: 1.0013, test_loss: 0.9854, test_f1: 0.4618
 epoch: 51, train_loss: 0.9952, test_loss: 0.9862, test_f1: 0.4605
 epoch: 52, train_loss: 0.9894, test_loss: 0.9864, test_f1: 0.4620
 epoch: 53, train_loss: 0.9858, test_loss: 0.9840, test_f1: 0.4612
 epoch: 54, train_loss: 0.9864, test_loss: 0.9843, test_f1: 0.4610
 epoch: 55, train_loss: 0.9946, test_loss: 0.9832, test_f1: 0.4637
 epoch: 56, train_loss: 0.9896, test_loss: 0.9814, test_f1: 0.4705
 epoch: 57, train_loss: 0.9872, test_loss: 0.9815, test_f1: 0.4644
 epoch: 58, train_loss: 0.9880, test_loss: 0.9802, test_f1: 0.4663
 epoch: 59, train_loss: 0.9823, test_loss: 0.9784, test_f1: 0.4629
 epoch: 60, train_loss: 0.9793, test_loss: 0.9773, test_f1: 0.4814
 epoch: 61, train_loss: 0.9824, test_loss: 0.9785, test_f1: 0.4798
 epoch: 62, train_loss: 0.9824, test_loss: 0.9790, test_f1: 0.4799
 epoch: 63, train_loss: 0.9898, test_loss: 0.9782, test_f1: 0.4818
 epoch: 64, train_loss: 0.9793, test_loss: 0.9776, test_f1: 0.4813
 epoch: 65, train_loss: 0.9849, test_loss: 0.9788, test_f1: 0.4832
 epoch: 66, train_loss: 0.9801, test_loss: 0.9764, test_f1: 0.4810
 epoch: 67, train_loss: 0.9762, test_loss: 0.9760, test_f1: 0.4822
 epoch: 68, train_loss: 0.9814, test_loss: 0.9746, test_f1: 0.4840
 epoch: 69, train_loss: 0.9762, test_loss: 0.9722, test_f1: 0.4831
 epoch: 70, train_loss: 0.9725, test_loss: 0.9732, test_f1: 0.4840
 epoch: 71, train_loss: 0.9773, test_loss: 0.9722, test_f1: 0.4858
 epoch: 72, train_loss: 0.9704, test_loss: 0.9727, test_f1: 0.4829
 epoch: 73, train_loss: 0.9752, test_loss: 0.9719, test_f1: 0.4853
 epoch: 74, train_loss: 0.9701, test_loss: 0.9705, test_f1: 0.4830
 epoch: 75, train_loss: 0.9764, test_loss: 0.9687, test_f1: 0.4904
 epoch: 76, train_loss: 0.9671, test_loss: 0.9679, test_f1: 0.4895
 epoch: 77, train_loss: 0.9630, test_loss: 0.9683, test_f1: 0.4922
 epoch: 78, train_loss: 0.9727, test_loss: 0.9688, test_f1: 0.4892
 epoch: 79, train_loss: 0.9678, test_loss: 0.9673, test_f1: 0.4905
 epoch: 80, train_loss: 0.9728, test_loss: 0.9679, test_f1: 0.4894
 epoch: 81, train_loss: 0.9644, test_loss: 0.9668, test_f1: 0.4922
 epoch: 82, train_loss: 0.9689, test_loss: 0.9673, test_f1: 0.4931
 epoch: 83, train_loss: 0.9652, test_loss: 0.9653, test_f1: 0.4933
 epoch: 84, train_loss: 0.9638, test_loss: 0.9641, test_f1: 0.4864
 epoch: 85, train_loss: 0.9692, test_loss: 0.9653, test_f1: 0.4913
 epoch: 86, train_loss: 0.9614, test_loss: 0.9658, test_f1: 0.4947
 epoch: 87, train_loss: 0.9562, test_loss: 0.9637, test_f1: 0.4902
 epoch: 88, train_loss: 0.9600, test_loss: 0.9616, test_f1: 0.4908
 epoch: 89, train_loss: 0.9622, test_loss: 0.9631, test_f1: 0.4979
 epoch: 90, train_loss: 0.9628, test_loss: 0.9646, test_f1: 0.4943
 epoch: 91, train_loss: 0.9619, test_loss: 0.9634, test_f1: 0.4942
 epoch: 92, train_loss: 0.9571, test_loss: 0.9632, test_f1: 0.4994
 epoch: 93, train_loss: 0.9594, test_loss: 0.9607, test_f1: 0.4985
 epoch: 94, train_loss: 0.9537, test_loss: 0.9597, test_f1: 0.4965
 epoch: 95, train_loss: 0.9568, test_loss: 0.9599, test_f1: 0.4971
 epoch: 96, train_loss: 0.9580, test_loss: 0.9602, test_f1: 0.4947
 epoch: 97, train_loss: 0.9574, test_loss: 0.9586, test_f1: 0.4921
 epoch: 98, train_loss: 0.9569, test_loss: 0.9576, test_f1: 0.4957
 epoch: 99, train_loss: 0.9511, test_loss: 0.9575, test_f1: 0.4984
##################ITERATION #8 ****************************************
 epoch: 0, train_loss: 1.3569, test_loss: 1.3528, test_f1: 0.2270
 epoch: 1, train_loss: 1.3246, test_loss: 1.3507, test_f1: 0.2270
 epoch: 2, train_loss: 1.3005, test_loss: 1.3374, test_f1: 0.2270
 epoch: 3, train_loss: 1.2812, test_loss: 1.3058, test_f1: 0.2270
 epoch: 4, train_loss: 1.2589, test_loss: 1.2648, test_f1: 0.2270
 epoch: 5, train_loss: 1.2371, test_loss: 1.2307, test_f1: 0.2344
 epoch: 6, train_loss: 1.2220, test_loss: 1.2057, test_f1: 0.2506
 epoch: 7, train_loss: 1.2070, test_loss: 1.1860, test_f1: 0.2651
 epoch: 8, train_loss: 1.1890, test_loss: 1.1682, test_f1: 0.2903
 epoch: 9, train_loss: 1.1759, test_loss: 1.1537, test_f1: 0.2954
 epoch: 10, train_loss: 1.1643, test_loss: 1.1403, test_f1: 0.3138
 epoch: 11, train_loss: 1.1548, test_loss: 1.1289, test_f1: 0.3282
 epoch: 12, train_loss: 1.1398, test_loss: 1.1202, test_f1: 0.3403
 epoch: 13, train_loss: 1.1315, test_loss: 1.1110, test_f1: 0.3441
 epoch: 14, train_loss: 1.1276, test_loss: 1.1026, test_f1: 0.3451
 epoch: 15, train_loss: 1.1180, test_loss: 1.0952, test_f1: 0.3477
 epoch: 16, train_loss: 1.1071, test_loss: 1.0889, test_f1: 0.3486
 epoch: 17, train_loss: 1.1031, test_loss: 1.0822, test_f1: 0.3562
 epoch: 18, train_loss: 1.0944, test_loss: 1.0770, test_f1: 0.3613
 epoch: 19, train_loss: 1.0905, test_loss: 1.0732, test_f1: 0.3758
 epoch: 20, train_loss: 1.0794, test_loss: 1.0693, test_f1: 0.3821
 epoch: 21, train_loss: 1.0784, test_loss: 1.0646, test_f1: 0.3883
 epoch: 22, train_loss: 1.0752, test_loss: 1.0607, test_f1: 0.3919
 epoch: 23, train_loss: 1.0690, test_loss: 1.0584, test_f1: 0.3931
 epoch: 24, train_loss: 1.0613, test_loss: 1.0561, test_f1: 0.4019
 epoch: 25, train_loss: 1.0608, test_loss: 1.0548, test_f1: 0.4144
 epoch: 26, train_loss: 1.0518, test_loss: 1.0505, test_f1: 0.4211
 epoch: 27, train_loss: 1.0551, test_loss: 1.0477, test_f1: 0.4239
 epoch: 28, train_loss: 1.0539, test_loss: 1.0452, test_f1: 0.4231
 epoch: 29, train_loss: 1.0437, test_loss: 1.0437, test_f1: 0.4311
 epoch: 30, train_loss: 1.0465, test_loss: 1.0412, test_f1: 0.4311
 epoch: 31, train_loss: 1.0421, test_loss: 1.0394, test_f1: 0.4354
 epoch: 32, train_loss: 1.0379, test_loss: 1.0382, test_f1: 0.4354
 epoch: 33, train_loss: 1.0336, test_loss: 1.0353, test_f1: 0.4343
 epoch: 34, train_loss: 1.0234, test_loss: 1.0326, test_f1: 0.4327
 epoch: 35, train_loss: 1.0273, test_loss: 1.0319, test_f1: 0.4318
 epoch: 36, train_loss: 1.0228, test_loss: 1.0296, test_f1: 0.4381
 epoch: 37, train_loss: 1.0244, test_loss: 1.0292, test_f1: 0.4456
 epoch: 38, train_loss: 1.0205, test_loss: 1.0251, test_f1: 0.4456
 epoch: 39, train_loss: 1.0235, test_loss: 1.0226, test_f1: 0.4466
 epoch: 40, train_loss: 1.0104, test_loss: 1.0233, test_f1: 0.4532
 epoch: 41, train_loss: 1.0150, test_loss: 1.0197, test_f1: 0.4497
 epoch: 42, train_loss: 1.0077, test_loss: 1.0187, test_f1: 0.4522
 epoch: 43, train_loss: 1.0114, test_loss: 1.0166, test_f1: 0.4529
 epoch: 44, train_loss: 1.0048, test_loss: 1.0150, test_f1: 0.4571
 epoch: 45, train_loss: 1.0052, test_loss: 1.0131, test_f1: 0.4553
 epoch: 46, train_loss: 1.0019, test_loss: 1.0121, test_f1: 0.4550
 epoch: 47, train_loss: 0.9954, test_loss: 1.0095, test_f1: 0.4592
 epoch: 48, train_loss: 0.9993, test_loss: 1.0090, test_f1: 0.4666
 epoch: 49, train_loss: 0.9987, test_loss: 1.0084, test_f1: 0.4631
 epoch: 50, train_loss: 0.9919, test_loss: 1.0075, test_f1: 0.4678
 epoch: 51, train_loss: 0.9916, test_loss: 1.0042, test_f1: 0.4697
 epoch: 52, train_loss: 0.9938, test_loss: 1.0033, test_f1: 0.4689
 epoch: 53, train_loss: 0.9906, test_loss: 1.0051, test_f1: 0.4684
 epoch: 54, train_loss: 0.9881, test_loss: 1.0041, test_f1: 0.4697
 epoch: 55, train_loss: 0.9879, test_loss: 1.0028, test_f1: 0.4697
 epoch: 56, train_loss: 0.9868, test_loss: 1.0008, test_f1: 0.4704
 epoch: 57, train_loss: 0.9851, test_loss: 1.0009, test_f1: 0.4703
 epoch: 58, train_loss: 0.9874, test_loss: 1.0031, test_f1: 0.4647
 epoch: 59, train_loss: 0.9806, test_loss: 0.9997, test_f1: 0.4732
 epoch: 60, train_loss: 0.9850, test_loss: 0.9988, test_f1: 0.4732
 epoch: 61, train_loss: 0.9879, test_loss: 0.9987, test_f1: 0.4746
 epoch: 62, train_loss: 0.9790, test_loss: 0.9988, test_f1: 0.4732
 epoch: 63, train_loss: 0.9858, test_loss: 0.9965, test_f1: 0.4767
 epoch: 64, train_loss: 0.9810, test_loss: 0.9967, test_f1: 0.4767
 epoch: 65, train_loss: 0.9814, test_loss: 0.9965, test_f1: 0.4756
 epoch: 66, train_loss: 0.9773, test_loss: 0.9942, test_f1: 0.4767
 epoch: 67, train_loss: 0.9806, test_loss: 0.9934, test_f1: 0.4766
 epoch: 68, train_loss: 0.9824, test_loss: 0.9951, test_f1: 0.4775
 epoch: 69, train_loss: 0.9786, test_loss: 0.9958, test_f1: 0.4722
 epoch: 70, train_loss: 0.9753, test_loss: 0.9928, test_f1: 0.4756
 epoch: 71, train_loss: 0.9707, test_loss: 0.9937, test_f1: 0.4755
 epoch: 72, train_loss: 0.9754, test_loss: 0.9936, test_f1: 0.4744
 epoch: 73, train_loss: 0.9700, test_loss: 0.9937, test_f1: 0.4745
 epoch: 74, train_loss: 0.9774, test_loss: 0.9912, test_f1: 0.4794
 epoch: 75, train_loss: 0.9780, test_loss: 0.9913, test_f1: 0.4794
 epoch: 76, train_loss: 0.9723, test_loss: 0.9912, test_f1: 0.4756
 epoch: 77, train_loss: 0.9731, test_loss: 0.9901, test_f1: 0.4756
 epoch: 78, train_loss: 0.9690, test_loss: 0.9892, test_f1: 0.4803
 epoch: 79, train_loss: 0.9695, test_loss: 0.9894, test_f1: 0.4791
 epoch: 80, train_loss: 0.9712, test_loss: 0.9881, test_f1: 0.4759
 epoch: 81, train_loss: 0.9747, test_loss: 0.9866, test_f1: 0.4795
 epoch: 82, train_loss: 0.9708, test_loss: 0.9866, test_f1: 0.4794
 epoch: 83, train_loss: 0.9694, test_loss: 0.9874, test_f1: 0.4795
 epoch: 84, train_loss: 0.9690, test_loss: 0.9874, test_f1: 0.4790
 epoch: 85, train_loss: 0.9653, test_loss: 0.9864, test_f1: 0.4784
 epoch: 86, train_loss: 0.9632, test_loss: 0.9854, test_f1: 0.4855
 epoch: 87, train_loss: 0.9630, test_loss: 0.9840, test_f1: 0.4831
 epoch: 88, train_loss: 0.9652, test_loss: 0.9853, test_f1: 0.4798
 epoch: 89, train_loss: 0.9650, test_loss: 0.9860, test_f1: 0.4784
 epoch: 90, train_loss: 0.9640, test_loss: 0.9853, test_f1: 0.4779
 epoch: 91, train_loss: 0.9666, test_loss: 0.9850, test_f1: 0.4784
 epoch: 92, train_loss: 0.9726, test_loss: 0.9836, test_f1: 0.4813
 epoch: 93, train_loss: 0.9667, test_loss: 0.9832, test_f1: 0.4818
 epoch: 94, train_loss: 0.9578, test_loss: 0.9830, test_f1: 0.4789
 epoch: 95, train_loss: 0.9588, test_loss: 0.9825, test_f1: 0.4817
 epoch: 96, train_loss: 0.9620, test_loss: 0.9821, test_f1: 0.4836
 epoch: 97, train_loss: 0.9636, test_loss: 0.9816, test_f1: 0.4834
 epoch: 98, train_loss: 0.9634, test_loss: 0.9830, test_f1: 0.4804
 epoch: 99, train_loss: 0.9556, test_loss: 0.9802, test_f1: 0.4840
##################ITERATION #9 ****************************************
 epoch: 0, train_loss: 1.3795, test_loss: 1.3660, test_f1: 0.2270
 epoch: 1, train_loss: 1.3054, test_loss: 1.3596, test_f1: 0.2270
 epoch: 2, train_loss: 1.2586, test_loss: 1.3236, test_f1: 0.2270
 epoch: 3, train_loss: 1.2256, test_loss: 1.2540, test_f1: 0.2270
 epoch: 4, train_loss: 1.1976, test_loss: 1.1882, test_f1: 0.2709
 epoch: 5, train_loss: 1.1836, test_loss: 1.1400, test_f1: 0.3287
 epoch: 6, train_loss: 1.1496, test_loss: 1.1091, test_f1: 0.3428
 epoch: 7, train_loss: 1.1393, test_loss: 1.0922, test_f1: 0.3384
 epoch: 8, train_loss: 1.1256, test_loss: 1.0818, test_f1: 0.3436
 epoch: 9, train_loss: 1.1210, test_loss: 1.0735, test_f1: 0.3436
 epoch: 10, train_loss: 1.1096, test_loss: 1.0668, test_f1: 0.3445
 epoch: 11, train_loss: 1.0982, test_loss: 1.0613, test_f1: 0.3435
 epoch: 12, train_loss: 1.0936, test_loss: 1.0564, test_f1: 0.3419
 epoch: 13, train_loss: 1.0901, test_loss: 1.0527, test_f1: 0.3472
 epoch: 14, train_loss: 1.0813, test_loss: 1.0497, test_f1: 0.3446
 epoch: 15, train_loss: 1.0769, test_loss: 1.0474, test_f1: 0.3547
 epoch: 16, train_loss: 1.0726, test_loss: 1.0455, test_f1: 0.3665
 epoch: 17, train_loss: 1.0650, test_loss: 1.0443, test_f1: 0.3736
 epoch: 18, train_loss: 1.0644, test_loss: 1.0430, test_f1: 0.3837
 epoch: 19, train_loss: 1.0627, test_loss: 1.0400, test_f1: 0.3886
 epoch: 20, train_loss: 1.0613, test_loss: 1.0383, test_f1: 0.3873
 epoch: 21, train_loss: 1.0537, test_loss: 1.0353, test_f1: 0.3900
 epoch: 22, train_loss: 1.0542, test_loss: 1.0325, test_f1: 0.3893
 epoch: 23, train_loss: 1.0507, test_loss: 1.0323, test_f1: 0.3932
 epoch: 24, train_loss: 1.0491, test_loss: 1.0354, test_f1: 0.3975
 epoch: 25, train_loss: 1.0464, test_loss: 1.0302, test_f1: 0.3937
 epoch: 26, train_loss: 1.0444, test_loss: 1.0292, test_f1: 0.3979
 epoch: 27, train_loss: 1.0357, test_loss: 1.0293, test_f1: 0.4004
 epoch: 28, train_loss: 1.0407, test_loss: 1.0276, test_f1: 0.4095
 epoch: 29, train_loss: 1.0355, test_loss: 1.0280, test_f1: 0.4094
 epoch: 30, train_loss: 1.0321, test_loss: 1.0260, test_f1: 0.4249
 epoch: 31, train_loss: 1.0274, test_loss: 1.0238, test_f1: 0.4247
 epoch: 32, train_loss: 1.0318, test_loss: 1.0236, test_f1: 0.4216
 epoch: 33, train_loss: 1.0280, test_loss: 1.0221, test_f1: 0.4244
 epoch: 34, train_loss: 1.0185, test_loss: 1.0210, test_f1: 0.4208
 epoch: 35, train_loss: 1.0299, test_loss: 1.0179, test_f1: 0.4216
 epoch: 36, train_loss: 1.0178, test_loss: 1.0142, test_f1: 0.4201
 epoch: 37, train_loss: 1.0232, test_loss: 1.0169, test_f1: 0.4260
 epoch: 38, train_loss: 1.0178, test_loss: 1.0137, test_f1: 0.4250
 epoch: 39, train_loss: 1.0081, test_loss: 1.0113, test_f1: 0.4268
 epoch: 40, train_loss: 1.0127, test_loss: 1.0095, test_f1: 0.4295
 epoch: 41, train_loss: 1.0087, test_loss: 1.0082, test_f1: 0.4339
 epoch: 42, train_loss: 1.0075, test_loss: 1.0063, test_f1: 0.4368
 epoch: 43, train_loss: 1.0087, test_loss: 1.0057, test_f1: 0.4406
 epoch: 44, train_loss: 1.0028, test_loss: 1.0048, test_f1: 0.4435
 epoch: 45, train_loss: 1.0048, test_loss: 1.0038, test_f1: 0.4435
 epoch: 46, train_loss: 1.0027, test_loss: 1.0025, test_f1: 0.4474
 epoch: 47, train_loss: 1.0010, test_loss: 1.0007, test_f1: 0.4469
 epoch: 48, train_loss: 0.9961, test_loss: 0.9998, test_f1: 0.4562
 epoch: 49, train_loss: 0.9916, test_loss: 0.9982, test_f1: 0.4552
 epoch: 50, train_loss: 0.9961, test_loss: 0.9970, test_f1: 0.4526
 epoch: 51, train_loss: 0.9921, test_loss: 0.9962, test_f1: 0.4554
 epoch: 52, train_loss: 0.9883, test_loss: 0.9971, test_f1: 0.4566
 epoch: 53, train_loss: 0.9859, test_loss: 0.9958, test_f1: 0.4580
 epoch: 54, train_loss: 0.9935, test_loss: 0.9951, test_f1: 0.4570
 epoch: 55, train_loss: 0.9840, test_loss: 0.9931, test_f1: 0.4581
 epoch: 56, train_loss: 0.9905, test_loss: 0.9933, test_f1: 0.4574
 epoch: 57, train_loss: 0.9859, test_loss: 0.9928, test_f1: 0.4580
 epoch: 58, train_loss: 0.9791, test_loss: 0.9909, test_f1: 0.4570
 epoch: 59, train_loss: 0.9817, test_loss: 0.9905, test_f1: 0.4565
 epoch: 60, train_loss: 0.9874, test_loss: 0.9892, test_f1: 0.4599
 epoch: 61, train_loss: 0.9788, test_loss: 0.9890, test_f1: 0.4653
 epoch: 62, train_loss: 0.9738, test_loss: 0.9889, test_f1: 0.4648
 epoch: 63, train_loss: 0.9810, test_loss: 0.9878, test_f1: 0.4675
 epoch: 64, train_loss: 0.9811, test_loss: 0.9878, test_f1: 0.4732
 epoch: 65, train_loss: 0.9750, test_loss: 0.9872, test_f1: 0.4621
 epoch: 66, train_loss: 0.9778, test_loss: 0.9867, test_f1: 0.4638
 epoch: 67, train_loss: 0.9747, test_loss: 0.9867, test_f1: 0.4706
 epoch: 68, train_loss: 0.9703, test_loss: 0.9861, test_f1: 0.4665
 epoch: 69, train_loss: 0.9701, test_loss: 0.9849, test_f1: 0.4688
 epoch: 70, train_loss: 0.9717, test_loss: 0.9835, test_f1: 0.4772
 epoch: 71, train_loss: 0.9674, test_loss: 0.9838, test_f1: 0.4753
 epoch: 72, train_loss: 0.9714, test_loss: 0.9839, test_f1: 0.4766
 epoch: 73, train_loss: 0.9652, test_loss: 0.9831, test_f1: 0.4779
 epoch: 74, train_loss: 0.9683, test_loss: 0.9822, test_f1: 0.4850
 epoch: 75, train_loss: 0.9584, test_loss: 0.9824, test_f1: 0.4831
 epoch: 76, train_loss: 0.9647, test_loss: 0.9827, test_f1: 0.4818
 epoch: 77, train_loss: 0.9644, test_loss: 0.9826, test_f1: 0.4792
 epoch: 78, train_loss: 0.9611, test_loss: 0.9806, test_f1: 0.4836
 epoch: 79, train_loss: 0.9646, test_loss: 0.9782, test_f1: 0.4824
 epoch: 80, train_loss: 0.9566, test_loss: 0.9778, test_f1: 0.4844
 epoch: 81, train_loss: 0.9663, test_loss: 0.9776, test_f1: 0.4844
 epoch: 82, train_loss: 0.9642, test_loss: 0.9768, test_f1: 0.4825
 epoch: 83, train_loss: 0.9557, test_loss: 0.9757, test_f1: 0.4845
 epoch: 84, train_loss: 0.9626, test_loss: 0.9772, test_f1: 0.4782
 epoch: 85, train_loss: 0.9624, test_loss: 0.9745, test_f1: 0.4849
 epoch: 86, train_loss: 0.9590, test_loss: 0.9744, test_f1: 0.4852
 epoch: 87, train_loss: 0.9588, test_loss: 0.9734, test_f1: 0.4849
 epoch: 88, train_loss: 0.9521, test_loss: 0.9735, test_f1: 0.4805
 epoch: 89, train_loss: 0.9593, test_loss: 0.9731, test_f1: 0.4824
 epoch: 90, train_loss: 0.9521, test_loss: 0.9742, test_f1: 0.4779
 epoch: 91, train_loss: 0.9501, test_loss: 0.9733, test_f1: 0.4863
 epoch: 92, train_loss: 0.9514, test_loss: 0.9746, test_f1: 0.4853
 epoch: 93, train_loss: 0.9501, test_loss: 0.9707, test_f1: 0.4810
 epoch: 94, train_loss: 0.9484, test_loss: 0.9717, test_f1: 0.4841
 epoch: 95, train_loss: 0.9502, test_loss: 0.9703, test_f1: 0.4867
 epoch: 96, train_loss: 0.9513, test_loss: 0.9705, test_f1: 0.4829
 epoch: 97, train_loss: 0.9557, test_loss: 0.9714, test_f1: 0.4846
 epoch: 98, train_loss: 0.9546, test_loss: 0.9692, test_f1: 0.4826
 epoch: 99, train_loss: 0.9481, test_loss: 0.9692, test_f1: 0.4915

Training completed in 557.00 seconds
Best F1: 0.4994 at epoch 92
Mean F1 across iterations: 0.4413  0.0402
========================FINAL RESULTS================================
FEGIN weighted F1: 0.4994  0.0402
python main.py --data ltspice_examples --representation component_pin_net --model FEGIN --layers 2 --hiddens 32 --batch_size 256 --lr 0.0001 --emb_size 128 --epochs 100 --save_appendix component_pin_net_L2_H32_BS256_LR0.0001_E128 --no_val
-----



STDERR:
  File "main.py", line 370, in <module>
    main()
  File "main.py", line 254, in main
    dataset = dataset_class(
  File "/home/philip/projects/llm_inference_code_repo/Circuit-Completion-Using-GNNs/component_classification_with_link_prediction_head/evaluation/FEGIN/kernel/circuit_datasets.py", line 15, in __init__
    self.data, self.slices = torch.load(self.processed_paths[0])
  File "/home/philip/.local/lib/python3.8/site-packages/torch/serialization.py", line 1040, in load
    warnings.warn(
  File "/usr/lib/python3.8/warnings.py", line 109, in _showwarnmsg
    sw(msg.message, msg.category, msg.filename, msg.lineno,
  File "main.py", line 47, in warn_with_traceback
    traceback.print_stack(file=log)
/home/philip/projects/llm_inference_code_repo/Circuit-Completion-Using-GNNs/component_classification_with_link_prediction_head/evaluation/FEGIN/kernel/circuit_datasets.py:15: FutureWarning: You are using `torch.load` with `weights_only=False` (the current default value), which uses the default pickle module implicitly. It is possible to construct malicious pickle data which will execute arbitrary code during unpickling (See https://github.com/pytorch/pytorch/blob/main/SECURITY.md#untrusted-models for more details). In a future release, the default value for `weights_only` will be flipped to `True`. This limits the functions that could be executed during unpickling. Arbitrary objects will no longer be allowed to be loaded via this mode unless they are explicitly allowlisted by the user via `torch.serialization.add_safe_globals`. We recommend you start setting `weights_only=True` for any use case where you don't have full control of the loaded file. Please open an issue on GitHub for any issues related to this experimental feature.
  self.data, self.slices = torch.load(self.processed_paths[0])
