STDOUT:
Results will be saved in /home/philip/projects/ltspice_examples_code_repo/Circuit-Completion-Using-GNNs/component_classification_with_link_prediction_head/evaluation/FEGIN/results/model_FEGIN_dataset_ltspice_examples
Command line input: python main.py --data ltspice_examples --representation component_pin --model FEGIN --layers 3 --hiddens 128 --batch_size 32 --lr 0.001 --emb_size 128 --epochs 100 --save_appendix component_pin_L3_H128_BS32_LR0.001_E128 --no_val
 is saved.
-----
ltspice_examples - FEGIN
Using 3 layers, 128 hidden units, h = 2
Loading component_pin representation dataset
ENTERED
Training FEGIN on component_pin representation
Train: 3560, Test: 848
##################ITERATION #0 ****************************************
 epoch: 0, train_loss: 1.1212, test_loss: 1.0591, test_f1: 0.3882
 epoch: 1, train_loss: 0.9831, test_loss: 0.9382, test_f1: 0.5088
 epoch: 2, train_loss: 0.9080, test_loss: 0.8852, test_f1: 0.5408
 epoch: 3, train_loss: 0.8774, test_loss: 0.9124, test_f1: 0.5055
 epoch: 4, train_loss: 0.8480, test_loss: 0.9520, test_f1: 0.4739
 epoch: 5, train_loss: 0.8189, test_loss: 0.8700, test_f1: 0.6115
 epoch: 6, train_loss: 0.8041, test_loss: 0.8028, test_f1: 0.5782
 epoch: 7, train_loss: 0.7820, test_loss: 0.8253, test_f1: 0.6056
 epoch: 8, train_loss: 0.7522, test_loss: 0.8787, test_f1: 0.5602
 epoch: 9, train_loss: 0.7508, test_loss: 0.7680, test_f1: 0.6308
 epoch: 10, train_loss: 0.7236, test_loss: 0.8940, test_f1: 0.5813
 epoch: 11, train_loss: 0.7413, test_loss: 0.8342, test_f1: 0.5948
 epoch: 12, train_loss: 0.7355, test_loss: 0.8238, test_f1: 0.5695
 epoch: 13, train_loss: 0.7132, test_loss: 0.8525, test_f1: 0.5877
 epoch: 14, train_loss: 0.6955, test_loss: 0.8169, test_f1: 0.5775
 epoch: 15, train_loss: 0.6824, test_loss: 0.8115, test_f1: 0.5964
 epoch: 16, train_loss: 0.6750, test_loss: 0.7959, test_f1: 0.6387
 epoch: 17, train_loss: 0.6496, test_loss: 0.8989, test_f1: 0.5761
 epoch: 18, train_loss: 0.6474, test_loss: 0.8011, test_f1: 0.6432
 epoch: 19, train_loss: 0.6513, test_loss: 0.8213, test_f1: 0.6680
 epoch: 20, train_loss: 0.6326, test_loss: 0.8462, test_f1: 0.6299
 epoch: 21, train_loss: 0.6163, test_loss: 0.7898, test_f1: 0.6651
 epoch: 22, train_loss: 0.6249, test_loss: 0.8606, test_f1: 0.6388
 epoch: 23, train_loss: 0.6092, test_loss: 0.8963, test_f1: 0.6465
 epoch: 24, train_loss: 0.6024, test_loss: 0.8433, test_f1: 0.6390
 epoch: 25, train_loss: 0.5887, test_loss: 0.8685, test_f1: 0.6260
 epoch: 26, train_loss: 0.5774, test_loss: 0.9026, test_f1: 0.6349
 epoch: 27, train_loss: 0.5692, test_loss: 0.8858, test_f1: 0.6556
 epoch: 28, train_loss: 0.5760, test_loss: 0.8740, test_f1: 0.6350
 epoch: 29, train_loss: 0.5379, test_loss: 0.8974, test_f1: 0.6190
 epoch: 30, train_loss: 0.5269, test_loss: 0.8372, test_f1: 0.6437
 epoch: 31, train_loss: 0.5236, test_loss: 0.9641, test_f1: 0.6222
 epoch: 32, train_loss: 0.5187, test_loss: 0.9514, test_f1: 0.6559
 epoch: 33, train_loss: 0.4929, test_loss: 0.9409, test_f1: 0.6033
 epoch: 34, train_loss: 0.4919, test_loss: 0.8828, test_f1: 0.6810
 epoch: 35, train_loss: 0.4935, test_loss: 0.9384, test_f1: 0.6339
 epoch: 36, train_loss: 0.4904, test_loss: 0.9307, test_f1: 0.6214
 epoch: 37, train_loss: 0.4857, test_loss: 1.0265, test_f1: 0.6126
 epoch: 38, train_loss: 0.4524, test_loss: 0.9444, test_f1: 0.6452
 epoch: 39, train_loss: 0.4744, test_loss: 0.9339, test_f1: 0.6516
 epoch: 40, train_loss: 0.4502, test_loss: 0.8989, test_f1: 0.6622
 epoch: 41, train_loss: 0.4366, test_loss: 0.9700, test_f1: 0.6256
 epoch: 42, train_loss: 0.4430, test_loss: 1.0795, test_f1: 0.6074
 epoch: 43, train_loss: 0.3952, test_loss: 1.0757, test_f1: 0.6374
 epoch: 44, train_loss: 0.4349, test_loss: 0.9827, test_f1: 0.6694
 epoch: 45, train_loss: 0.4251, test_loss: 1.0814, test_f1: 0.6650
 epoch: 46, train_loss: 0.3974, test_loss: 1.1022, test_f1: 0.6614
 epoch: 47, train_loss: 0.4093, test_loss: 1.0572, test_f1: 0.6587
 epoch: 48, train_loss: 0.4001, test_loss: 1.1479, test_f1: 0.6646
 epoch: 49, train_loss: 0.3865, test_loss: 1.1248, test_f1: 0.6433
 epoch: 50, train_loss: 0.3781, test_loss: 0.9638, test_f1: 0.6370
 epoch: 51, train_loss: 0.3581, test_loss: 1.0669, test_f1: 0.6528
 epoch: 52, train_loss: 0.3286, test_loss: 0.9998, test_f1: 0.6788
 epoch: 53, train_loss: 0.2944, test_loss: 1.0942, test_f1: 0.6476
 epoch: 54, train_loss: 0.2862, test_loss: 1.1139, test_f1: 0.6622
 epoch: 55, train_loss: 0.2999, test_loss: 1.1507, test_f1: 0.6399
 epoch: 56, train_loss: 0.2915, test_loss: 1.2175, test_f1: 0.6760
 epoch: 57, train_loss: 0.2932, test_loss: 1.2825, test_f1: 0.6761
 epoch: 58, train_loss: 0.2918, test_loss: 1.2356, test_f1: 0.6468
 epoch: 59, train_loss: 0.2839, test_loss: 1.2646, test_f1: 0.6518
 epoch: 60, train_loss: 0.2696, test_loss: 1.2466, test_f1: 0.6693
 epoch: 61, train_loss: 0.2717, test_loss: 1.1800, test_f1: 0.6331
 epoch: 62, train_loss: 0.2731, test_loss: 1.1578, test_f1: 0.6768
 epoch: 63, train_loss: 0.2547, test_loss: 1.2996, test_f1: 0.6731
 epoch: 64, train_loss: 0.2355, test_loss: 1.3977, test_f1: 0.6635
 epoch: 65, train_loss: 0.2356, test_loss: 1.4363, test_f1: 0.6604
 epoch: 66, train_loss: 0.2359, test_loss: 1.2847, test_f1: 0.6709
 epoch: 67, train_loss: 0.2567, test_loss: 1.3436, test_f1: 0.6483
 epoch: 68, train_loss: 0.2364, test_loss: 1.3951, test_f1: 0.6637
 epoch: 69, train_loss: 0.2432, test_loss: 1.3879, test_f1: 0.6378
 epoch: 70, train_loss: 0.2258, test_loss: 1.4147, test_f1: 0.6765
 epoch: 71, train_loss: 0.2394, test_loss: 1.3115, test_f1: 0.6671
 epoch: 72, train_loss: 0.2287, test_loss: 1.4467, test_f1: 0.6604
 epoch: 73, train_loss: 0.2241, test_loss: 1.4236, test_f1: 0.6404
 epoch: 74, train_loss: 0.2131, test_loss: 1.4673, test_f1: 0.6506
 epoch: 75, train_loss: 0.2076, test_loss: 1.5477, test_f1: 0.6571
 epoch: 76, train_loss: 0.2330, test_loss: 1.3888, test_f1: 0.6895
 epoch: 77, train_loss: 0.2146, test_loss: 1.4357, test_f1: 0.6516
 epoch: 78, train_loss: 0.2063, test_loss: 1.5969, test_f1: 0.6451
 epoch: 79, train_loss: 0.2118, test_loss: 1.4610, test_f1: 0.6772
 epoch: 80, train_loss: 0.2135, test_loss: 1.6019, test_f1: 0.6517
 epoch: 81, train_loss: 0.2126, test_loss: 1.7062, test_f1: 0.6686
 epoch: 82, train_loss: 0.1942, test_loss: 1.6596, test_f1: 0.6766
 epoch: 83, train_loss: 0.2041, test_loss: 1.6542, test_f1: 0.6628
 epoch: 84, train_loss: 0.1850, test_loss: 1.6429, test_f1: 0.6632
 epoch: 85, train_loss: 0.1984, test_loss: 1.7541, test_f1: 0.6503
 epoch: 86, train_loss: 0.1812, test_loss: 1.7824, test_f1: 0.6629
 epoch: 87, train_loss: 0.1648, test_loss: 1.7236, test_f1: 0.6673
 epoch: 88, train_loss: 0.1804, test_loss: 1.7250, test_f1: 0.6389
 epoch: 89, train_loss: 0.2122, test_loss: 1.5578, test_f1: 0.6591
 epoch: 90, train_loss: 0.1817, test_loss: 1.6048, test_f1: 0.6523
 epoch: 91, train_loss: 0.1968, test_loss: 1.7360, test_f1: 0.6389
 epoch: 92, train_loss: 0.1857, test_loss: 1.7015, test_f1: 0.6501
 epoch: 93, train_loss: 0.1933, test_loss: 1.7096, test_f1: 0.6691
 epoch: 94, train_loss: 0.1723, test_loss: 1.8294, test_f1: 0.6527
 epoch: 95, train_loss: 0.1660, test_loss: 1.7868, test_f1: 0.6402
 epoch: 96, train_loss: 0.1635, test_loss: 1.7535, test_f1: 0.6496
 epoch: 97, train_loss: 0.1742, test_loss: 1.7903, test_f1: 0.6529
 epoch: 98, train_loss: 0.1647, test_loss: 1.8140, test_f1: 0.6532
 epoch: 99, train_loss: 0.1575, test_loss: 1.8747, test_f1: 0.6622
##################ITERATION #1 ****************************************
 epoch: 0, train_loss: 1.0935, test_loss: 1.1757, test_f1: 0.4713
 epoch: 1, train_loss: 0.9408, test_loss: 0.8745, test_f1: 0.5438
 epoch: 2, train_loss: 0.9008, test_loss: 0.8889, test_f1: 0.5389
 epoch: 3, train_loss: 0.8615, test_loss: 0.8823, test_f1: 0.5213
 epoch: 4, train_loss: 0.8465, test_loss: 0.8647, test_f1: 0.5031
 epoch: 5, train_loss: 0.8201, test_loss: 0.8314, test_f1: 0.5981
 epoch: 6, train_loss: 0.7928, test_loss: 0.7920, test_f1: 0.5874
 epoch: 7, train_loss: 0.7628, test_loss: 0.8762, test_f1: 0.5724
 epoch: 8, train_loss: 0.7453, test_loss: 0.8245, test_f1: 0.6022
 epoch: 9, train_loss: 0.7447, test_loss: 0.7790, test_f1: 0.5812
 epoch: 10, train_loss: 0.7188, test_loss: 0.9269, test_f1: 0.5879
 epoch: 11, train_loss: 0.6972, test_loss: 0.8480, test_f1: 0.6010
 epoch: 12, train_loss: 0.6970, test_loss: 0.8427, test_f1: 0.6488
 epoch: 13, train_loss: 0.6840, test_loss: 0.7589, test_f1: 0.6564
 epoch: 14, train_loss: 0.6779, test_loss: 0.7723, test_f1: 0.6317
 epoch: 15, train_loss: 0.6615, test_loss: 0.7887, test_f1: 0.6820
 epoch: 16, train_loss: 0.6484, test_loss: 0.8168, test_f1: 0.6613
 epoch: 17, train_loss: 0.6290, test_loss: 0.8800, test_f1: 0.6281
 epoch: 18, train_loss: 0.6298, test_loss: 0.7641, test_f1: 0.6541
 epoch: 19, train_loss: 0.6159, test_loss: 0.8276, test_f1: 0.6032
 epoch: 20, train_loss: 0.5920, test_loss: 0.8393, test_f1: 0.6367
 epoch: 21, train_loss: 0.5964, test_loss: 0.8036, test_f1: 0.6479
 epoch: 22, train_loss: 0.5810, test_loss: 0.8344, test_f1: 0.6372
 epoch: 23, train_loss: 0.5661, test_loss: 0.9073, test_f1: 0.5943
 epoch: 24, train_loss: 0.5667, test_loss: 0.9083, test_f1: 0.5815
 epoch: 25, train_loss: 0.5470, test_loss: 0.8804, test_f1: 0.6373
 epoch: 26, train_loss: 0.5327, test_loss: 0.9717, test_f1: 0.6445
 epoch: 27, train_loss: 0.5272, test_loss: 0.9082, test_f1: 0.6681
 epoch: 28, train_loss: 0.5132, test_loss: 0.9678, test_f1: 0.6134
 epoch: 29, train_loss: 0.4900, test_loss: 0.8336, test_f1: 0.6546
 epoch: 30, train_loss: 0.4841, test_loss: 1.0434, test_f1: 0.6254
 epoch: 31, train_loss: 0.4954, test_loss: 0.8817, test_f1: 0.6594
 epoch: 32, train_loss: 0.4555, test_loss: 0.9470, test_f1: 0.6557
 epoch: 33, train_loss: 0.4556, test_loss: 0.9893, test_f1: 0.6354
 epoch: 34, train_loss: 0.4659, test_loss: 0.9570, test_f1: 0.6548
 epoch: 35, train_loss: 0.4591, test_loss: 0.8611, test_f1: 0.6824
 epoch: 36, train_loss: 0.4425, test_loss: 1.2612, test_f1: 0.6516
 epoch: 37, train_loss: 0.4461, test_loss: 1.0505, test_f1: 0.6785
 epoch: 38, train_loss: 0.4126, test_loss: 0.9843, test_f1: 0.6862
 epoch: 39, train_loss: 0.4222, test_loss: 0.8370, test_f1: 0.6675
 epoch: 40, train_loss: 0.4116, test_loss: 0.9324, test_f1: 0.6758
 epoch: 41, train_loss: 0.4120, test_loss: 0.9400, test_f1: 0.6369
 epoch: 42, train_loss: 0.3854, test_loss: 0.9891, test_f1: 0.6726
 epoch: 43, train_loss: 0.3675, test_loss: 0.9414, test_f1: 0.6617
 epoch: 44, train_loss: 0.4055, test_loss: 1.0586, test_f1: 0.6810
 epoch: 45, train_loss: 0.3818, test_loss: 0.9796, test_f1: 0.6533
 epoch: 46, train_loss: 0.3726, test_loss: 1.0832, test_f1: 0.6763
 epoch: 47, train_loss: 0.3872, test_loss: 1.0128, test_f1: 0.6630
 epoch: 48, train_loss: 0.3651, test_loss: 1.0842, test_f1: 0.6481
 epoch: 49, train_loss: 0.3713, test_loss: 1.0337, test_f1: 0.7177
 epoch: 50, train_loss: 0.3431, test_loss: 0.9360, test_f1: 0.6625
 epoch: 51, train_loss: 0.3216, test_loss: 1.0744, test_f1: 0.6926
 epoch: 52, train_loss: 0.2745, test_loss: 1.1091, test_f1: 0.6735
 epoch: 53, train_loss: 0.2876, test_loss: 1.2976, test_f1: 0.6417
 epoch: 54, train_loss: 0.2719, test_loss: 1.1042, test_f1: 0.6781
 epoch: 55, train_loss: 0.2550, test_loss: 1.2153, test_f1: 0.6839
 epoch: 56, train_loss: 0.2565, test_loss: 1.0960, test_f1: 0.6675
 epoch: 57, train_loss: 0.2397, test_loss: 1.1854, test_f1: 0.6815
 epoch: 58, train_loss: 0.2474, test_loss: 1.2260, test_f1: 0.7014
 epoch: 59, train_loss: 0.2439, test_loss: 1.1946, test_f1: 0.6730
 epoch: 60, train_loss: 0.2345, test_loss: 1.3638, test_f1: 0.6537
 epoch: 61, train_loss: 0.2344, test_loss: 1.3037, test_f1: 0.6745
 epoch: 62, train_loss: 0.2348, test_loss: 1.3566, test_f1: 0.6874
 epoch: 63, train_loss: 0.2401, test_loss: 1.3187, test_f1: 0.6875
 epoch: 64, train_loss: 0.2324, test_loss: 1.4313, test_f1: 0.6980
 epoch: 65, train_loss: 0.2244, test_loss: 1.3598, test_f1: 0.6619
 epoch: 66, train_loss: 0.2198, test_loss: 1.2600, test_f1: 0.7176
 epoch: 67, train_loss: 0.2320, test_loss: 1.2883, test_f1: 0.6693
 epoch: 68, train_loss: 0.2340, test_loss: 1.3390, test_f1: 0.6599
 epoch: 69, train_loss: 0.2116, test_loss: 1.3472, test_f1: 0.6774
 epoch: 70, train_loss: 0.2173, test_loss: 1.3551, test_f1: 0.6996
 epoch: 71, train_loss: 0.2184, test_loss: 1.3014, test_f1: 0.6663
 epoch: 72, train_loss: 0.2214, test_loss: 1.3853, test_f1: 0.6735
 epoch: 73, train_loss: 0.2062, test_loss: 1.5480, test_f1: 0.6829
 epoch: 74, train_loss: 0.1991, test_loss: 1.4652, test_f1: 0.6905
 epoch: 75, train_loss: 0.2282, test_loss: 1.3685, test_f1: 0.6618
 epoch: 76, train_loss: 0.2114, test_loss: 1.4285, test_f1: 0.6375
 epoch: 77, train_loss: 0.1959, test_loss: 1.3874, test_f1: 0.6862
 epoch: 78, train_loss: 0.1904, test_loss: 1.4741, test_f1: 0.7054
 epoch: 79, train_loss: 0.1779, test_loss: 1.3873, test_f1: 0.6597
 epoch: 80, train_loss: 0.1716, test_loss: 1.5618, test_f1: 0.6789
 epoch: 81, train_loss: 0.1974, test_loss: 1.4182, test_f1: 0.6464
 epoch: 82, train_loss: 0.1802, test_loss: 1.3659, test_f1: 0.7060
 epoch: 83, train_loss: 0.1787, test_loss: 1.4111, test_f1: 0.6882
 epoch: 84, train_loss: 0.1710, test_loss: 1.2697, test_f1: 0.6900
 epoch: 85, train_loss: 0.1674, test_loss: 1.5392, test_f1: 0.6661
 epoch: 86, train_loss: 0.1708, test_loss: 1.4313, test_f1: 0.6672
 epoch: 87, train_loss: 0.1662, test_loss: 1.5430, test_f1: 0.6526
 epoch: 88, train_loss: 0.1896, test_loss: 1.5544, test_f1: 0.6535
 epoch: 89, train_loss: 0.1586, test_loss: 1.6040, test_f1: 0.6540
 epoch: 90, train_loss: 0.1563, test_loss: 1.6362, test_f1: 0.6718
 epoch: 91, train_loss: 0.1489, test_loss: 1.5634, test_f1: 0.6755
 epoch: 92, train_loss: 0.1776, test_loss: 1.4284, test_f1: 0.6794
 epoch: 93, train_loss: 0.1574, test_loss: 1.5296, test_f1: 0.6670
 epoch: 94, train_loss: 0.1588, test_loss: 1.6529, test_f1: 0.6499
 epoch: 95, train_loss: 0.1608, test_loss: 1.5250, test_f1: 0.6692
 epoch: 96, train_loss: 0.1569, test_loss: 1.5508, test_f1: 0.6579
 epoch: 97, train_loss: 0.1634, test_loss: 1.6979, test_f1: 0.6297
 epoch: 98, train_loss: 0.1649, test_loss: 1.6143, test_f1: 0.6581
 epoch: 99, train_loss: 0.1615, test_loss: 1.5138, test_f1: 0.6687
##################ITERATION #2 ****************************************
 epoch: 0, train_loss: 1.1033, test_loss: 1.0128, test_f1: 0.4606
 epoch: 1, train_loss: 0.9499, test_loss: 0.9745, test_f1: 0.5263
 epoch: 2, train_loss: 0.9198, test_loss: 1.0573, test_f1: 0.4776
 epoch: 3, train_loss: 0.8740, test_loss: 0.9444, test_f1: 0.5437
 epoch: 4, train_loss: 0.8592, test_loss: 0.9275, test_f1: 0.5373
 epoch: 5, train_loss: 0.8484, test_loss: 0.8586, test_f1: 0.5872
 epoch: 6, train_loss: 0.8086, test_loss: 0.9679, test_f1: 0.5590
 epoch: 7, train_loss: 0.8025, test_loss: 0.8830, test_f1: 0.5493
 epoch: 8, train_loss: 0.7794, test_loss: 0.8758, test_f1: 0.5519
 epoch: 9, train_loss: 0.7569, test_loss: 0.7950, test_f1: 0.6671
 epoch: 10, train_loss: 0.7305, test_loss: 0.7828, test_f1: 0.6109
 epoch: 11, train_loss: 0.7018, test_loss: 0.8399, test_f1: 0.6429
 epoch: 12, train_loss: 0.6909, test_loss: 1.0543, test_f1: 0.5788
 epoch: 13, train_loss: 0.7125, test_loss: 0.8227, test_f1: 0.6137
 epoch: 14, train_loss: 0.6699, test_loss: 0.8409, test_f1: 0.6394
 epoch: 15, train_loss: 0.6641, test_loss: 0.8938, test_f1: 0.6220
 epoch: 16, train_loss: 0.6623, test_loss: 0.9011, test_f1: 0.6187
 epoch: 17, train_loss: 0.6335, test_loss: 0.8748, test_f1: 0.6249
 epoch: 18, train_loss: 0.6250, test_loss: 0.8872, test_f1: 0.6488
 epoch: 19, train_loss: 0.6139, test_loss: 0.8569, test_f1: 0.6718
 epoch: 20, train_loss: 0.6146, test_loss: 0.8485, test_f1: 0.6484
 epoch: 21, train_loss: 0.5858, test_loss: 0.9319, test_f1: 0.6348
 epoch: 22, train_loss: 0.5690, test_loss: 0.8314, test_f1: 0.6215
 epoch: 23, train_loss: 0.5904, test_loss: 0.9992, test_f1: 0.6394
 epoch: 24, train_loss: 0.5604, test_loss: 0.7412, test_f1: 0.6659
 epoch: 25, train_loss: 0.5508, test_loss: 0.9435, test_f1: 0.6254
 epoch: 26, train_loss: 0.5331, test_loss: 0.8408, test_f1: 0.6565
 epoch: 27, train_loss: 0.5205, test_loss: 0.9729, test_f1: 0.6400
 epoch: 28, train_loss: 0.5368, test_loss: 0.8687, test_f1: 0.6471
 epoch: 29, train_loss: 0.4951, test_loss: 0.9096, test_f1: 0.6509
 epoch: 30, train_loss: 0.4959, test_loss: 0.9223, test_f1: 0.6533
 epoch: 31, train_loss: 0.5145, test_loss: 0.9246, test_f1: 0.6557
 epoch: 32, train_loss: 0.4681, test_loss: 1.1790, test_f1: 0.5952
 epoch: 33, train_loss: 0.4767, test_loss: 0.9075, test_f1: 0.6858
 epoch: 34, train_loss: 0.4600, test_loss: 0.9889, test_f1: 0.6774
 epoch: 35, train_loss: 0.4538, test_loss: 0.9721, test_f1: 0.6792
 epoch: 36, train_loss: 0.4865, test_loss: 1.0090, test_f1: 0.6525
 epoch: 37, train_loss: 0.4549, test_loss: 0.9998, test_f1: 0.6595
 epoch: 38, train_loss: 0.4402, test_loss: 0.9562, test_f1: 0.6803
 epoch: 39, train_loss: 0.4340, test_loss: 1.0617, test_f1: 0.6429
 epoch: 40, train_loss: 0.4391, test_loss: 0.9872, test_f1: 0.6507
 epoch: 41, train_loss: 0.4150, test_loss: 0.9798, test_f1: 0.6730
 epoch: 42, train_loss: 0.4058, test_loss: 0.9678, test_f1: 0.7001
 epoch: 43, train_loss: 0.4001, test_loss: 1.0040, test_f1: 0.6862
 epoch: 44, train_loss: 0.3881, test_loss: 1.0913, test_f1: 0.6486
 epoch: 45, train_loss: 0.3637, test_loss: 1.0724, test_f1: 0.6761
 epoch: 46, train_loss: 0.3763, test_loss: 0.8854, test_f1: 0.6902
 epoch: 47, train_loss: 0.3796, test_loss: 1.1464, test_f1: 0.6539
 epoch: 48, train_loss: 0.3727, test_loss: 1.0342, test_f1: 0.6536
 epoch: 49, train_loss: 0.3449, test_loss: 1.0047, test_f1: 0.6571
 epoch: 50, train_loss: 0.3394, test_loss: 1.1078, test_f1: 0.6638
 epoch: 51, train_loss: 0.3252, test_loss: 1.1657, test_f1: 0.6537
 epoch: 52, train_loss: 0.2973, test_loss: 1.0994, test_f1: 0.6643
 epoch: 53, train_loss: 0.2987, test_loss: 1.2024, test_f1: 0.6730
 epoch: 54, train_loss: 0.2718, test_loss: 1.1574, test_f1: 0.6694
 epoch: 55, train_loss: 0.2671, test_loss: 1.1511, test_f1: 0.6871
 epoch: 56, train_loss: 0.2611, test_loss: 1.1784, test_f1: 0.6597
 epoch: 57, train_loss: 0.2534, test_loss: 1.1777, test_f1: 0.6770
 epoch: 58, train_loss: 0.2520, test_loss: 1.2671, test_f1: 0.6600
 epoch: 59, train_loss: 0.2311, test_loss: 1.3419, test_f1: 0.6347
 epoch: 60, train_loss: 0.2533, test_loss: 1.2799, test_f1: 0.6612
 epoch: 61, train_loss: 0.2307, test_loss: 1.3582, test_f1: 0.6919
 epoch: 62, train_loss: 0.2558, test_loss: 1.4457, test_f1: 0.6167
 epoch: 63, train_loss: 0.2487, test_loss: 1.1687, test_f1: 0.6945
 epoch: 64, train_loss: 0.2327, test_loss: 1.2636, test_f1: 0.6533
 epoch: 65, train_loss: 0.2218, test_loss: 1.3351, test_f1: 0.6642
 epoch: 66, train_loss: 0.2284, test_loss: 1.4720, test_f1: 0.6541
 epoch: 67, train_loss: 0.2082, test_loss: 1.4035, test_f1: 0.6936
 epoch: 68, train_loss: 0.2325, test_loss: 1.4494, test_f1: 0.6359
 epoch: 69, train_loss: 0.2150, test_loss: 1.3760, test_f1: 0.6637
 epoch: 70, train_loss: 0.2315, test_loss: 1.3830, test_f1: 0.6847
 epoch: 71, train_loss: 0.2085, test_loss: 1.4171, test_f1: 0.6851
 epoch: 72, train_loss: 0.2053, test_loss: 1.3233, test_f1: 0.6706
 epoch: 73, train_loss: 0.1966, test_loss: 1.4013, test_f1: 0.6939
 epoch: 74, train_loss: 0.2036, test_loss: 1.3024, test_f1: 0.6809
 epoch: 75, train_loss: 0.2016, test_loss: 1.4348, test_f1: 0.6616
 epoch: 76, train_loss: 0.1875, test_loss: 1.3887, test_f1: 0.6626
 epoch: 77, train_loss: 0.2035, test_loss: 1.4948, test_f1: 0.6761
 epoch: 78, train_loss: 0.2032, test_loss: 1.5561, test_f1: 0.6611
 epoch: 79, train_loss: 0.1964, test_loss: 1.3410, test_f1: 0.6777
 epoch: 80, train_loss: 0.2099, test_loss: 1.3538, test_f1: 0.6780
 epoch: 81, train_loss: 0.1851, test_loss: 1.3368, test_f1: 0.6879
 epoch: 82, train_loss: 0.1853, test_loss: 1.4806, test_f1: 0.6705
 epoch: 83, train_loss: 0.1819, test_loss: 1.4601, test_f1: 0.6812
 epoch: 84, train_loss: 0.1793, test_loss: 1.5076, test_f1: 0.6697
 epoch: 85, train_loss: 0.1918, test_loss: 1.6278, test_f1: 0.6555
 epoch: 86, train_loss: 0.1793, test_loss: 1.7321, test_f1: 0.6886
 epoch: 87, train_loss: 0.1790, test_loss: 1.6030, test_f1: 0.6770
 epoch: 88, train_loss: 0.1659, test_loss: 1.5322, test_f1: 0.6787
 epoch: 89, train_loss: 0.1686, test_loss: 1.5944, test_f1: 0.6713
 epoch: 90, train_loss: 0.1739, test_loss: 1.5482, test_f1: 0.6622
 epoch: 91, train_loss: 0.1529, test_loss: 1.6855, test_f1: 0.6660
 epoch: 92, train_loss: 0.1887, test_loss: 1.5683, test_f1: 0.6650
 epoch: 93, train_loss: 0.1802, test_loss: 1.5894, test_f1: 0.6612
 epoch: 94, train_loss: 0.1639, test_loss: 1.4639, test_f1: 0.6868
 epoch: 95, train_loss: 0.1540, test_loss: 1.3947, test_f1: 0.6851
 epoch: 96, train_loss: 0.1631, test_loss: 1.5224, test_f1: 0.6544
 epoch: 97, train_loss: 0.1564, test_loss: 1.6084, test_f1: 0.6518
 epoch: 98, train_loss: 0.1592, test_loss: 1.5831, test_f1: 0.6604
 epoch: 99, train_loss: 0.1649, test_loss: 1.6219, test_f1: 0.6598
##################ITERATION #3 ****************************************
 epoch: 0, train_loss: 1.1654, test_loss: 1.1526, test_f1: 0.4652
 epoch: 1, train_loss: 0.9540, test_loss: 0.9393, test_f1: 0.5618
 epoch: 2, train_loss: 0.9085, test_loss: 0.9006, test_f1: 0.5146
 epoch: 3, train_loss: 0.8818, test_loss: 0.8417, test_f1: 0.5373
 epoch: 4, train_loss: 0.8438, test_loss: 0.8695, test_f1: 0.5385
 epoch: 5, train_loss: 0.8365, test_loss: 0.9201, test_f1: 0.5583
 epoch: 6, train_loss: 0.8104, test_loss: 0.9059, test_f1: 0.5860
 epoch: 7, train_loss: 0.8073, test_loss: 0.9403, test_f1: 0.5590
 epoch: 8, train_loss: 0.7813, test_loss: 0.8539, test_f1: 0.5628
 epoch: 9, train_loss: 0.7627, test_loss: 0.8159, test_f1: 0.5928
 epoch: 10, train_loss: 0.7427, test_loss: 0.8510, test_f1: 0.5522
 epoch: 11, train_loss: 0.7507, test_loss: 0.7380, test_f1: 0.6540
 epoch: 12, train_loss: 0.7254, test_loss: 0.8168, test_f1: 0.5935
 epoch: 13, train_loss: 0.7054, test_loss: 0.8780, test_f1: 0.5777
 epoch: 14, train_loss: 0.6896, test_loss: 0.8211, test_f1: 0.6100
 epoch: 15, train_loss: 0.6829, test_loss: 0.8893, test_f1: 0.6214
 epoch: 16, train_loss: 0.6868, test_loss: 0.9170, test_f1: 0.5581
 epoch: 17, train_loss: 0.6612, test_loss: 0.8769, test_f1: 0.6094
 epoch: 18, train_loss: 0.6513, test_loss: 0.9409, test_f1: 0.6027
 epoch: 19, train_loss: 0.6401, test_loss: 0.8556, test_f1: 0.5855
 epoch: 20, train_loss: 0.6160, test_loss: 0.8902, test_f1: 0.6028
 epoch: 21, train_loss: 0.6112, test_loss: 0.8666, test_f1: 0.6148
 epoch: 22, train_loss: 0.6228, test_loss: 0.7326, test_f1: 0.6777
 epoch: 23, train_loss: 0.5777, test_loss: 0.7704, test_f1: 0.6322
 epoch: 24, train_loss: 0.5970, test_loss: 0.7639, test_f1: 0.6517
 epoch: 25, train_loss: 0.5754, test_loss: 0.7870, test_f1: 0.6115
 epoch: 26, train_loss: 0.5750, test_loss: 0.7992, test_f1: 0.6389
 epoch: 27, train_loss: 0.5652, test_loss: 0.7750, test_f1: 0.6600
 epoch: 28, train_loss: 0.5559, test_loss: 0.8756, test_f1: 0.6350
 epoch: 29, train_loss: 0.5301, test_loss: 0.9028, test_f1: 0.6673
 epoch: 30, train_loss: 0.5312, test_loss: 0.8992, test_f1: 0.6399
 epoch: 31, train_loss: 0.5126, test_loss: 0.7903, test_f1: 0.6529
 epoch: 32, train_loss: 0.5178, test_loss: 0.9194, test_f1: 0.6543
 epoch: 33, train_loss: 0.5146, test_loss: 0.8061, test_f1: 0.6504
 epoch: 34, train_loss: 0.4975, test_loss: 0.9030, test_f1: 0.6621
 epoch: 35, train_loss: 0.4928, test_loss: 0.8092, test_f1: 0.6645
 epoch: 36, train_loss: 0.4830, test_loss: 0.8503, test_f1: 0.6698
 epoch: 37, train_loss: 0.4574, test_loss: 0.8184, test_f1: 0.6851
 epoch: 38, train_loss: 0.4685, test_loss: 0.9343, test_f1: 0.6712
 epoch: 39, train_loss: 0.4506, test_loss: 0.9258, test_f1: 0.6569
 epoch: 40, train_loss: 0.4511, test_loss: 0.8551, test_f1: 0.6836
 epoch: 41, train_loss: 0.4353, test_loss: 0.9549, test_f1: 0.6739
 epoch: 42, train_loss: 0.4317, test_loss: 1.0162, test_f1: 0.6697
 epoch: 43, train_loss: 0.3919, test_loss: 0.9636, test_f1: 0.6795
 epoch: 44, train_loss: 0.4428, test_loss: 1.0482, test_f1: 0.6705
 epoch: 45, train_loss: 0.3996, test_loss: 0.9544, test_f1: 0.6995
 epoch: 46, train_loss: 0.3848, test_loss: 1.0887, test_f1: 0.6645
 epoch: 47, train_loss: 0.3882, test_loss: 0.9618, test_f1: 0.6760
 epoch: 48, train_loss: 0.3882, test_loss: 1.1171, test_f1: 0.6827
 epoch: 49, train_loss: 0.4118, test_loss: 1.0658, test_f1: 0.6508
 epoch: 50, train_loss: 0.3791, test_loss: 1.0383, test_f1: 0.6509
 epoch: 51, train_loss: 0.3303, test_loss: 0.9404, test_f1: 0.7257
 epoch: 52, train_loss: 0.3076, test_loss: 0.9963, test_f1: 0.6703
 epoch: 53, train_loss: 0.2798, test_loss: 1.1492, test_f1: 0.6540
 epoch: 54, train_loss: 0.2915, test_loss: 1.0557, test_f1: 0.6682
 epoch: 55, train_loss: 0.2710, test_loss: 1.0412, test_f1: 0.6647
 epoch: 56, train_loss: 0.2706, test_loss: 1.0949, test_f1: 0.6908
 epoch: 57, train_loss: 0.2855, test_loss: 1.1893, test_f1: 0.6648
 epoch: 58, train_loss: 0.2645, test_loss: 1.2308, test_f1: 0.6706
 epoch: 59, train_loss: 0.2798, test_loss: 1.1763, test_f1: 0.6920
 epoch: 60, train_loss: 0.2670, test_loss: 1.2430, test_f1: 0.6587
 epoch: 61, train_loss: 0.2674, test_loss: 1.2224, test_f1: 0.6604
 epoch: 62, train_loss: 0.2401, test_loss: 1.2023, test_f1: 0.6651
 epoch: 63, train_loss: 0.2569, test_loss: 1.1343, test_f1: 0.6886
 epoch: 64, train_loss: 0.2644, test_loss: 1.3414, test_f1: 0.6742
 epoch: 65, train_loss: 0.2428, test_loss: 1.2650, test_f1: 0.6743
 epoch: 66, train_loss: 0.2372, test_loss: 1.3288, test_f1: 0.6830
 epoch: 67, train_loss: 0.2378, test_loss: 1.2421, test_f1: 0.6807
 epoch: 68, train_loss: 0.2425, test_loss: 1.2561, test_f1: 0.7221
 epoch: 69, train_loss: 0.2395, test_loss: 1.3050, test_f1: 0.6748
 epoch: 70, train_loss: 0.2355, test_loss: 1.2973, test_f1: 0.6583
 epoch: 71, train_loss: 0.2141, test_loss: 1.2754, test_f1: 0.6992
 epoch: 72, train_loss: 0.2299, test_loss: 1.3270, test_f1: 0.6646
 epoch: 73, train_loss: 0.2181, test_loss: 1.3912, test_f1: 0.6482
 epoch: 74, train_loss: 0.2178, test_loss: 1.3785, test_f1: 0.6576
 epoch: 75, train_loss: 0.2107, test_loss: 1.3793, test_f1: 0.6771
 epoch: 76, train_loss: 0.1950, test_loss: 1.4989, test_f1: 0.6611
 epoch: 77, train_loss: 0.2048, test_loss: 1.3487, test_f1: 0.6704
 epoch: 78, train_loss: 0.2047, test_loss: 1.5277, test_f1: 0.6586
 epoch: 79, train_loss: 0.1957, test_loss: 1.4404, test_f1: 0.6660
 epoch: 80, train_loss: 0.2148, test_loss: 1.2671, test_f1: 0.6756
 epoch: 81, train_loss: 0.1990, test_loss: 1.3859, test_f1: 0.6686
 epoch: 82, train_loss: 0.1948, test_loss: 1.3463, test_f1: 0.6757
 epoch: 83, train_loss: 0.1894, test_loss: 1.6700, test_f1: 0.6538
 epoch: 84, train_loss: 0.1944, test_loss: 1.4109, test_f1: 0.6825
 epoch: 85, train_loss: 0.1816, test_loss: 1.3637, test_f1: 0.6867
 epoch: 86, train_loss: 0.1910, test_loss: 1.4212, test_f1: 0.6934
 epoch: 87, train_loss: 0.1745, test_loss: 1.4000, test_f1: 0.6907
 epoch: 88, train_loss: 0.1804, test_loss: 1.3931, test_f1: 0.6884
 epoch: 89, train_loss: 0.1802, test_loss: 1.4645, test_f1: 0.6678
 epoch: 90, train_loss: 0.1927, test_loss: 1.4227, test_f1: 0.7021
 epoch: 91, train_loss: 0.1865, test_loss: 1.5696, test_f1: 0.6668
 epoch: 92, train_loss: 0.1623, test_loss: 1.5285, test_f1: 0.6578
 epoch: 93, train_loss: 0.1503, test_loss: 1.5785, test_f1: 0.6684
 epoch: 94, train_loss: 0.1700, test_loss: 1.6639, test_f1: 0.6540
 epoch: 95, train_loss: 0.1579, test_loss: 1.5716, test_f1: 0.7043
 epoch: 96, train_loss: 0.1774, test_loss: 1.5254, test_f1: 0.6653
 epoch: 97, train_loss: 0.1790, test_loss: 1.5040, test_f1: 0.6828
 epoch: 98, train_loss: 0.1578, test_loss: 1.3758, test_f1: 0.7111
 epoch: 99, train_loss: 0.1510, test_loss: 1.4767, test_f1: 0.6809
##################ITERATION #4 ****************************************
 epoch: 0, train_loss: 1.1995, test_loss: 1.0259, test_f1: 0.5351
 epoch: 1, train_loss: 0.9652, test_loss: 0.9149, test_f1: 0.5020
 epoch: 2, train_loss: 0.9161, test_loss: 1.0080, test_f1: 0.5345
 epoch: 3, train_loss: 0.8893, test_loss: 0.9804, test_f1: 0.5165
 epoch: 4, train_loss: 0.8750, test_loss: 0.9267, test_f1: 0.4939
 epoch: 5, train_loss: 0.8518, test_loss: 0.8968, test_f1: 0.5296
 epoch: 6, train_loss: 0.8236, test_loss: 0.9435, test_f1: 0.5157
 epoch: 7, train_loss: 0.8341, test_loss: 0.8914, test_f1: 0.5781
 epoch: 8, train_loss: 0.7972, test_loss: 0.8754, test_f1: 0.5523
 epoch: 9, train_loss: 0.7705, test_loss: 0.7963, test_f1: 0.6244
 epoch: 10, train_loss: 0.7507, test_loss: 0.8409, test_f1: 0.6270
 epoch: 11, train_loss: 0.7410, test_loss: 0.8550, test_f1: 0.6206
 epoch: 12, train_loss: 0.7369, test_loss: 0.8882, test_f1: 0.6043
 epoch: 13, train_loss: 0.7019, test_loss: 0.8020, test_f1: 0.6325
 epoch: 14, train_loss: 0.7045, test_loss: 0.8504, test_f1: 0.6304
 epoch: 15, train_loss: 0.6922, test_loss: 0.8536, test_f1: 0.6438
 epoch: 16, train_loss: 0.6593, test_loss: 0.8544, test_f1: 0.6420
 epoch: 17, train_loss: 0.6679, test_loss: 0.9757, test_f1: 0.5744
 epoch: 18, train_loss: 0.6487, test_loss: 0.9755, test_f1: 0.6040
 epoch: 19, train_loss: 0.6540, test_loss: 0.8874, test_f1: 0.6410
 epoch: 20, train_loss: 0.6314, test_loss: 0.8400, test_f1: 0.6767
 epoch: 21, train_loss: 0.6238, test_loss: 0.9838, test_f1: 0.5869
 epoch: 22, train_loss: 0.6287, test_loss: 0.8821, test_f1: 0.6471
 epoch: 23, train_loss: 0.5973, test_loss: 0.8639, test_f1: 0.6407
 epoch: 24, train_loss: 0.5995, test_loss: 0.8720, test_f1: 0.6236
 epoch: 25, train_loss: 0.5975, test_loss: 0.8879, test_f1: 0.6600
 epoch: 26, train_loss: 0.5615, test_loss: 0.8452, test_f1: 0.6686
 epoch: 27, train_loss: 0.5895, test_loss: 0.9659, test_f1: 0.6332
 epoch: 28, train_loss: 0.5427, test_loss: 1.0035, test_f1: 0.6437
 epoch: 29, train_loss: 0.5761, test_loss: 0.9102, test_f1: 0.6406
 epoch: 30, train_loss: 0.5522, test_loss: 0.9660, test_f1: 0.6343
 epoch: 31, train_loss: 0.5259, test_loss: 0.8498, test_f1: 0.6765
 epoch: 32, train_loss: 0.5111, test_loss: 0.8965, test_f1: 0.6751
 epoch: 33, train_loss: 0.5115, test_loss: 0.9731, test_f1: 0.6567
 epoch: 34, train_loss: 0.5182, test_loss: 0.9470, test_f1: 0.6377
 epoch: 35, train_loss: 0.4995, test_loss: 0.9968, test_f1: 0.6847
 epoch: 36, train_loss: 0.4613, test_loss: 1.0060, test_f1: 0.6692
 epoch: 37, train_loss: 0.4852, test_loss: 0.9758, test_f1: 0.6504
 epoch: 38, train_loss: 0.4863, test_loss: 0.9095, test_f1: 0.6636
 epoch: 39, train_loss: 0.4640, test_loss: 0.9516, test_f1: 0.6676
 epoch: 40, train_loss: 0.4548, test_loss: 0.9692, test_f1: 0.6633
 epoch: 41, train_loss: 0.4559, test_loss: 0.9532, test_f1: 0.6406
 epoch: 42, train_loss: 0.4462, test_loss: 0.9731, test_f1: 0.6801
 epoch: 43, train_loss: 0.4522, test_loss: 0.9779, test_f1: 0.6596
 epoch: 44, train_loss: 0.4266, test_loss: 1.2066, test_f1: 0.6680
 epoch: 45, train_loss: 0.4083, test_loss: 1.1080, test_f1: 0.6347
 epoch: 46, train_loss: 0.4374, test_loss: 1.0700, test_f1: 0.6525
 epoch: 47, train_loss: 0.4119, test_loss: 1.0051, test_f1: 0.6581
 epoch: 48, train_loss: 0.4338, test_loss: 1.2054, test_f1: 0.6669
 epoch: 49, train_loss: 0.4130, test_loss: 1.0762, test_f1: 0.6457
 epoch: 50, train_loss: 0.4120, test_loss: 1.0687, test_f1: 0.6453
 epoch: 51, train_loss: 0.3478, test_loss: 1.0140, test_f1: 0.6675
 epoch: 52, train_loss: 0.3276, test_loss: 1.1067, test_f1: 0.6576
 epoch: 53, train_loss: 0.3236, test_loss: 1.1203, test_f1: 0.6464
 epoch: 54, train_loss: 0.3097, test_loss: 1.2002, test_f1: 0.6525
 epoch: 55, train_loss: 0.3007, test_loss: 1.1842, test_f1: 0.6649
 epoch: 56, train_loss: 0.2871, test_loss: 1.2458, test_f1: 0.6684
 epoch: 57, train_loss: 0.2912, test_loss: 1.2241, test_f1: 0.6545
 epoch: 58, train_loss: 0.2887, test_loss: 1.0973, test_f1: 0.6812
 epoch: 59, train_loss: 0.2834, test_loss: 1.2017, test_f1: 0.6712
 epoch: 60, train_loss: 0.2819, test_loss: 1.2283, test_f1: 0.6528
 epoch: 61, train_loss: 0.2974, test_loss: 1.2802, test_f1: 0.6383
 epoch: 62, train_loss: 0.2705, test_loss: 1.3065, test_f1: 0.6611
 epoch: 63, train_loss: 0.2604, test_loss: 1.2526, test_f1: 0.6528
 epoch: 64, train_loss: 0.2836, test_loss: 1.1064, test_f1: 0.6365
 epoch: 65, train_loss: 0.2785, test_loss: 1.2357, test_f1: 0.6659
 epoch: 66, train_loss: 0.2678, test_loss: 1.3191, test_f1: 0.6596
 epoch: 67, train_loss: 0.2645, test_loss: 1.3931, test_f1: 0.6679
 epoch: 68, train_loss: 0.2702, test_loss: 1.2938, test_f1: 0.6639
 epoch: 69, train_loss: 0.2577, test_loss: 1.3295, test_f1: 0.6735
 epoch: 70, train_loss: 0.2401, test_loss: 1.3912, test_f1: 0.6558
 epoch: 71, train_loss: 0.2455, test_loss: 1.4634, test_f1: 0.6566
 epoch: 72, train_loss: 0.2340, test_loss: 1.5478, test_f1: 0.6199
 epoch: 73, train_loss: 0.2316, test_loss: 1.5096, test_f1: 0.6437
 epoch: 74, train_loss: 0.2143, test_loss: 1.3393, test_f1: 0.6633
 epoch: 75, train_loss: 0.2369, test_loss: 1.3594, test_f1: 0.6566
 epoch: 76, train_loss: 0.2361, test_loss: 1.3456, test_f1: 0.6477
 epoch: 77, train_loss: 0.2381, test_loss: 1.3918, test_f1: 0.6514
 epoch: 78, train_loss: 0.1991, test_loss: 1.5188, test_f1: 0.6533
 epoch: 79, train_loss: 0.2042, test_loss: 1.3733, test_f1: 0.6728
 epoch: 80, train_loss: 0.2138, test_loss: 1.4508, test_f1: 0.6541
 epoch: 81, train_loss: 0.2141, test_loss: 1.4038, test_f1: 0.6626
 epoch: 82, train_loss: 0.2223, test_loss: 1.4960, test_f1: 0.6643
 epoch: 83, train_loss: 0.2091, test_loss: 1.6712, test_f1: 0.6610
 epoch: 84, train_loss: 0.1963, test_loss: 1.4412, test_f1: 0.6667
 epoch: 85, train_loss: 0.2111, test_loss: 1.5360, test_f1: 0.6488
 epoch: 86, train_loss: 0.2050, test_loss: 1.5836, test_f1: 0.6550
 epoch: 87, train_loss: 0.2016, test_loss: 1.6874, test_f1: 0.6291
 epoch: 88, train_loss: 0.2079, test_loss: 1.6762, test_f1: 0.6525
 epoch: 89, train_loss: 0.2018, test_loss: 1.7399, test_f1: 0.6426
 epoch: 90, train_loss: 0.1814, test_loss: 1.9167, test_f1: 0.6535
 epoch: 91, train_loss: 0.1980, test_loss: 1.6109, test_f1: 0.6642
 epoch: 92, train_loss: 0.1799, test_loss: 1.6743, test_f1: 0.6419
 epoch: 93, train_loss: 0.1938, test_loss: 1.7067, test_f1: 0.6559
 epoch: 94, train_loss: 0.1740, test_loss: 2.0492, test_f1: 0.6481
 epoch: 95, train_loss: 0.2000, test_loss: 1.7850, test_f1: 0.6533
 epoch: 96, train_loss: 0.1820, test_loss: 1.8347, test_f1: 0.6442
 epoch: 97, train_loss: 0.1583, test_loss: 1.7725, test_f1: 0.6507
 epoch: 98, train_loss: 0.1947, test_loss: 1.8279, test_f1: 0.6362
 epoch: 99, train_loss: 0.1740, test_loss: 1.6702, test_f1: 0.6469
##################ITERATION #5 ****************************************
 epoch: 0, train_loss: 1.1660, test_loss: 0.9906, test_f1: 0.4794
 epoch: 1, train_loss: 0.9489, test_loss: 0.9029, test_f1: 0.4978
 epoch: 2, train_loss: 0.9076, test_loss: 0.8695, test_f1: 0.5124
 epoch: 3, train_loss: 0.8854, test_loss: 0.8552, test_f1: 0.5428
 epoch: 4, train_loss: 0.8579, test_loss: 0.8649, test_f1: 0.5372
 epoch: 5, train_loss: 0.8458, test_loss: 0.8263, test_f1: 0.5539
 epoch: 6, train_loss: 0.8195, test_loss: 0.8557, test_f1: 0.5545
 epoch: 7, train_loss: 0.8147, test_loss: 0.8294, test_f1: 0.5397
 epoch: 8, train_loss: 0.7778, test_loss: 0.7435, test_f1: 0.6419
 epoch: 9, train_loss: 0.7687, test_loss: 0.8674, test_f1: 0.5380
 epoch: 10, train_loss: 0.7694, test_loss: 0.8433, test_f1: 0.5802
 epoch: 11, train_loss: 0.7488, test_loss: 0.8767, test_f1: 0.6055
 epoch: 12, train_loss: 0.7405, test_loss: 0.8536, test_f1: 0.5789
 epoch: 13, train_loss: 0.7227, test_loss: 0.6980, test_f1: 0.6434
 epoch: 14, train_loss: 0.7051, test_loss: 0.7958, test_f1: 0.6384
 epoch: 15, train_loss: 0.7142, test_loss: 0.7880, test_f1: 0.6727
 epoch: 16, train_loss: 0.6975, test_loss: 0.7447, test_f1: 0.6380
 epoch: 17, train_loss: 0.6704, test_loss: 0.7681, test_f1: 0.6608
 epoch: 18, train_loss: 0.6771, test_loss: 0.7133, test_f1: 0.6546
 epoch: 19, train_loss: 0.6535, test_loss: 0.7306, test_f1: 0.6443
 epoch: 20, train_loss: 0.6625, test_loss: 0.7729, test_f1: 0.6271
 epoch: 21, train_loss: 0.6313, test_loss: 0.7810, test_f1: 0.6448
 epoch: 22, train_loss: 0.6332, test_loss: 0.7568, test_f1: 0.6473
 epoch: 23, train_loss: 0.6289, test_loss: 0.7882, test_f1: 0.6516
 epoch: 24, train_loss: 0.6064, test_loss: 0.8340, test_f1: 0.6351
 epoch: 25, train_loss: 0.6102, test_loss: 0.8419, test_f1: 0.6534
 epoch: 26, train_loss: 0.5824, test_loss: 1.0792, test_f1: 0.6206
 epoch: 27, train_loss: 0.5702, test_loss: 0.7369, test_f1: 0.6947
 epoch: 28, train_loss: 0.5786, test_loss: 0.7321, test_f1: 0.6850
 epoch: 29, train_loss: 0.5624, test_loss: 0.8157, test_f1: 0.6778
 epoch: 30, train_loss: 0.5290, test_loss: 0.7345, test_f1: 0.6565
 epoch: 31, train_loss: 0.5387, test_loss: 0.6885, test_f1: 0.6965
 epoch: 32, train_loss: 0.5345, test_loss: 0.7955, test_f1: 0.6526
 epoch: 33, train_loss: 0.5209, test_loss: 0.7559, test_f1: 0.6891
 epoch: 34, train_loss: 0.5174, test_loss: 0.6830, test_f1: 0.7079
 epoch: 35, train_loss: 0.4905, test_loss: 0.7759, test_f1: 0.6873
 epoch: 36, train_loss: 0.4966, test_loss: 0.7584, test_f1: 0.6796
 epoch: 37, train_loss: 0.5033, test_loss: 0.7921, test_f1: 0.6860
 epoch: 38, train_loss: 0.4975, test_loss: 0.7637, test_f1: 0.6909
 epoch: 39, train_loss: 0.4584, test_loss: 0.7871, test_f1: 0.6483
 epoch: 40, train_loss: 0.4640, test_loss: 0.7717, test_f1: 0.6897
 epoch: 41, train_loss: 0.4537, test_loss: 0.8117, test_f1: 0.6905
 epoch: 42, train_loss: 0.4688, test_loss: 0.8961, test_f1: 0.6679
 epoch: 43, train_loss: 0.4375, test_loss: 0.7632, test_f1: 0.7120
 epoch: 44, train_loss: 0.4358, test_loss: 0.8254, test_f1: 0.7037
 epoch: 45, train_loss: 0.4491, test_loss: 0.8363, test_f1: 0.6726
 epoch: 46, train_loss: 0.4161, test_loss: 0.8607, test_f1: 0.6818
 epoch: 47, train_loss: 0.4096, test_loss: 0.7686, test_f1: 0.6959
 epoch: 48, train_loss: 0.3985, test_loss: 0.9135, test_f1: 0.6663
 epoch: 49, train_loss: 0.4127, test_loss: 0.8645, test_f1: 0.6687
 epoch: 50, train_loss: 0.3802, test_loss: 0.9722, test_f1: 0.6809
 epoch: 51, train_loss: 0.3474, test_loss: 0.9075, test_f1: 0.6735
 epoch: 52, train_loss: 0.3207, test_loss: 1.0394, test_f1: 0.6662
 epoch: 53, train_loss: 0.3127, test_loss: 0.9037, test_f1: 0.6569
 epoch: 54, train_loss: 0.3170, test_loss: 1.0320, test_f1: 0.6826
 epoch: 55, train_loss: 0.3153, test_loss: 0.9615, test_f1: 0.6740
 epoch: 56, train_loss: 0.3126, test_loss: 0.9228, test_f1: 0.7011
 epoch: 57, train_loss: 0.2894, test_loss: 1.0629, test_f1: 0.6699
 epoch: 58, train_loss: 0.2783, test_loss: 1.0781, test_f1: 0.6999
 epoch: 59, train_loss: 0.2994, test_loss: 0.9627, test_f1: 0.6909
 epoch: 60, train_loss: 0.2799, test_loss: 0.9728, test_f1: 0.6878
 epoch: 61, train_loss: 0.2926, test_loss: 1.0216, test_f1: 0.6761
 epoch: 62, train_loss: 0.2824, test_loss: 0.9974, test_f1: 0.6773
 epoch: 63, train_loss: 0.2642, test_loss: 1.1451, test_f1: 0.6656
 epoch: 64, train_loss: 0.2735, test_loss: 1.0416, test_f1: 0.6689
 epoch: 65, train_loss: 0.2736, test_loss: 1.0313, test_f1: 0.6863
 epoch: 66, train_loss: 0.2665, test_loss: 1.0907, test_f1: 0.6522
 epoch: 67, train_loss: 0.2725, test_loss: 1.1541, test_f1: 0.6655
 epoch: 68, train_loss: 0.2576, test_loss: 1.0335, test_f1: 0.6827
 epoch: 69, train_loss: 0.2569, test_loss: 1.1034, test_f1: 0.6769
 epoch: 70, train_loss: 0.2420, test_loss: 1.1458, test_f1: 0.6570
 epoch: 71, train_loss: 0.2656, test_loss: 1.1265, test_f1: 0.6651
 epoch: 72, train_loss: 0.2428, test_loss: 1.0361, test_f1: 0.6719
 epoch: 73, train_loss: 0.2305, test_loss: 1.1475, test_f1: 0.6876
 epoch: 74, train_loss: 0.2354, test_loss: 1.1250, test_f1: 0.6804
 epoch: 75, train_loss: 0.2381, test_loss: 1.3108, test_f1: 0.6840
 epoch: 76, train_loss: 0.2377, test_loss: 1.2289, test_f1: 0.6914
 epoch: 77, train_loss: 0.2226, test_loss: 1.2388, test_f1: 0.6749
 epoch: 78, train_loss: 0.2399, test_loss: 1.1655, test_f1: 0.6938
 epoch: 79, train_loss: 0.2221, test_loss: 1.1604, test_f1: 0.6852
 epoch: 80, train_loss: 0.2345, test_loss: 1.1341, test_f1: 0.6766
 epoch: 81, train_loss: 0.2348, test_loss: 1.1614, test_f1: 0.6807
 epoch: 82, train_loss: 0.2165, test_loss: 1.1376, test_f1: 0.7075
 epoch: 83, train_loss: 0.2134, test_loss: 1.1850, test_f1: 0.6797
 epoch: 84, train_loss: 0.2175, test_loss: 1.2252, test_f1: 0.6735
 epoch: 85, train_loss: 0.1986, test_loss: 1.3413, test_f1: 0.6642
 epoch: 86, train_loss: 0.2398, test_loss: 1.3569, test_f1: 0.6412
 epoch: 87, train_loss: 0.2159, test_loss: 1.2482, test_f1: 0.6826
 epoch: 88, train_loss: 0.2090, test_loss: 1.2279, test_f1: 0.6801
 epoch: 89, train_loss: 0.2188, test_loss: 1.2661, test_f1: 0.7037
 epoch: 90, train_loss: 0.2094, test_loss: 1.2185, test_f1: 0.6842
 epoch: 91, train_loss: 0.2091, test_loss: 1.1225, test_f1: 0.6589
 epoch: 92, train_loss: 0.2077, test_loss: 1.0929, test_f1: 0.6815
 epoch: 93, train_loss: 0.1878, test_loss: 1.1438, test_f1: 0.6921
 epoch: 94, train_loss: 0.2111, test_loss: 1.1312, test_f1: 0.6842
 epoch: 95, train_loss: 0.2039, test_loss: 1.1949, test_f1: 0.6906
 epoch: 96, train_loss: 0.1890, test_loss: 1.2149, test_f1: 0.6770
 epoch: 97, train_loss: 0.1622, test_loss: 1.3601, test_f1: 0.6781
 epoch: 98, train_loss: 0.1751, test_loss: 1.3197, test_f1: 0.6770
 epoch: 99, train_loss: 0.1840, test_loss: 1.1494, test_f1: 0.6848
##################ITERATION #6 ****************************************
 epoch: 0, train_loss: 1.1910, test_loss: 1.0263, test_f1: 0.4937
 epoch: 1, train_loss: 0.9608, test_loss: 0.9477, test_f1: 0.5126
 epoch: 2, train_loss: 0.9133, test_loss: 0.9713, test_f1: 0.5147
 epoch: 3, train_loss: 0.8990, test_loss: 0.9588, test_f1: 0.5032
 epoch: 4, train_loss: 0.8762, test_loss: 0.9094, test_f1: 0.5541
 epoch: 5, train_loss: 0.8622, test_loss: 0.9459, test_f1: 0.5003
 epoch: 6, train_loss: 0.8403, test_loss: 0.8928, test_f1: 0.5474
 epoch: 7, train_loss: 0.8344, test_loss: 0.8758, test_f1: 0.5344
 epoch: 8, train_loss: 0.7910, test_loss: 0.9700, test_f1: 0.5284
 epoch: 9, train_loss: 0.7853, test_loss: 0.8710, test_f1: 0.6273
 epoch: 10, train_loss: 0.7581, test_loss: 0.7895, test_f1: 0.6103
 epoch: 11, train_loss: 0.7471, test_loss: 0.8743, test_f1: 0.5663
 epoch: 12, train_loss: 0.7360, test_loss: 0.8462, test_f1: 0.6139
 epoch: 13, train_loss: 0.7354, test_loss: 0.9389, test_f1: 0.5433
 epoch: 14, train_loss: 0.7013, test_loss: 0.7620, test_f1: 0.6415
 epoch: 15, train_loss: 0.7078, test_loss: 0.9247, test_f1: 0.5814
 epoch: 16, train_loss: 0.6874, test_loss: 0.7893, test_f1: 0.6543
 epoch: 17, train_loss: 0.6727, test_loss: 0.8521, test_f1: 0.6424
 epoch: 18, train_loss: 0.6796, test_loss: 0.9032, test_f1: 0.5976
 epoch: 19, train_loss: 0.6572, test_loss: 0.8366, test_f1: 0.6275
 epoch: 20, train_loss: 0.6316, test_loss: 0.8947, test_f1: 0.6667
 epoch: 21, train_loss: 0.6281, test_loss: 0.8038, test_f1: 0.6770
 epoch: 22, train_loss: 0.6131, test_loss: 0.8902, test_f1: 0.6525
 epoch: 23, train_loss: 0.6178, test_loss: 0.8183, test_f1: 0.6343
 epoch: 24, train_loss: 0.6056, test_loss: 0.9670, test_f1: 0.6380
 epoch: 25, train_loss: 0.6039, test_loss: 0.8884, test_f1: 0.6219
 epoch: 26, train_loss: 0.5830, test_loss: 0.8831, test_f1: 0.6634
 epoch: 27, train_loss: 0.5670, test_loss: 0.8351, test_f1: 0.6788
 epoch: 28, train_loss: 0.5482, test_loss: 0.9425, test_f1: 0.6412
 epoch: 29, train_loss: 0.5535, test_loss: 0.9410, test_f1: 0.6662
 epoch: 30, train_loss: 0.5555, test_loss: 1.0265, test_f1: 0.6135
 epoch: 31, train_loss: 0.5385, test_loss: 0.8395, test_f1: 0.6712
 epoch: 32, train_loss: 0.5397, test_loss: 0.8712, test_f1: 0.6735
 epoch: 33, train_loss: 0.5212, test_loss: 0.9321, test_f1: 0.6576
 epoch: 34, train_loss: 0.5004, test_loss: 1.0282, test_f1: 0.6410
 epoch: 35, train_loss: 0.5003, test_loss: 0.9389, test_f1: 0.6886
 epoch: 36, train_loss: 0.4890, test_loss: 1.0333, test_f1: 0.6542
 epoch: 37, train_loss: 0.4754, test_loss: 0.8858, test_f1: 0.7001
 epoch: 38, train_loss: 0.4989, test_loss: 0.9986, test_f1: 0.6732
 epoch: 39, train_loss: 0.4693, test_loss: 0.9490, test_f1: 0.6637
 epoch: 40, train_loss: 0.4632, test_loss: 0.9992, test_f1: 0.6641
 epoch: 41, train_loss: 0.4808, test_loss: 0.9042, test_f1: 0.7006
 epoch: 42, train_loss: 0.4583, test_loss: 0.9873, test_f1: 0.6668
 epoch: 43, train_loss: 0.4389, test_loss: 0.8977, test_f1: 0.6968
 epoch: 44, train_loss: 0.4354, test_loss: 1.0042, test_f1: 0.6570
 epoch: 45, train_loss: 0.4437, test_loss: 0.8955, test_f1: 0.6914
 epoch: 46, train_loss: 0.4355, test_loss: 1.0592, test_f1: 0.6324
 epoch: 47, train_loss: 0.4079, test_loss: 0.9895, test_f1: 0.6607
 epoch: 48, train_loss: 0.4125, test_loss: 1.0382, test_f1: 0.6624
 epoch: 49, train_loss: 0.4048, test_loss: 1.1072, test_f1: 0.6380
 epoch: 50, train_loss: 0.4455, test_loss: 1.1092, test_f1: 0.6668
 epoch: 51, train_loss: 0.3462, test_loss: 1.0280, test_f1: 0.6887
 epoch: 52, train_loss: 0.3280, test_loss: 1.0001, test_f1: 0.6826
 epoch: 53, train_loss: 0.3239, test_loss: 1.1277, test_f1: 0.6863
 epoch: 54, train_loss: 0.3032, test_loss: 1.0713, test_f1: 0.7014
 epoch: 55, train_loss: 0.3144, test_loss: 1.0572, test_f1: 0.6866
 epoch: 56, train_loss: 0.3090, test_loss: 1.1818, test_f1: 0.6685
 epoch: 57, train_loss: 0.3067, test_loss: 1.1220, test_f1: 0.6855
 epoch: 58, train_loss: 0.2874, test_loss: 1.1493, test_f1: 0.6911
 epoch: 59, train_loss: 0.2955, test_loss: 1.1023, test_f1: 0.6841
 epoch: 60, train_loss: 0.2928, test_loss: 1.1682, test_f1: 0.6784
 epoch: 61, train_loss: 0.3102, test_loss: 1.1281, test_f1: 0.6966
 epoch: 62, train_loss: 0.2933, test_loss: 1.1438, test_f1: 0.6841
 epoch: 63, train_loss: 0.2770, test_loss: 1.1693, test_f1: 0.6878
 epoch: 64, train_loss: 0.2719, test_loss: 1.1256, test_f1: 0.6910
 epoch: 65, train_loss: 0.2612, test_loss: 1.1420, test_f1: 0.6835
 epoch: 66, train_loss: 0.2483, test_loss: 1.1882, test_f1: 0.6728
 epoch: 67, train_loss: 0.2633, test_loss: 1.1304, test_f1: 0.6929
 epoch: 68, train_loss: 0.2774, test_loss: 1.2358, test_f1: 0.6925
 epoch: 69, train_loss: 0.2719, test_loss: 1.2517, test_f1: 0.6648
 epoch: 70, train_loss: 0.2814, test_loss: 1.2742, test_f1: 0.6585
 epoch: 71, train_loss: 0.2530, test_loss: 1.3347, test_f1: 0.6819
 epoch: 72, train_loss: 0.2636, test_loss: 1.2317, test_f1: 0.6829
 epoch: 73, train_loss: 0.2442, test_loss: 1.3220, test_f1: 0.6898
 epoch: 74, train_loss: 0.2566, test_loss: 1.3205, test_f1: 0.6590
 epoch: 75, train_loss: 0.2368, test_loss: 1.2046, test_f1: 0.6833
 epoch: 76, train_loss: 0.2381, test_loss: 1.2686, test_f1: 0.6737
 epoch: 77, train_loss: 0.2076, test_loss: 1.2838, test_f1: 0.6839
 epoch: 78, train_loss: 0.2142, test_loss: 1.4720, test_f1: 0.6671
 epoch: 79, train_loss: 0.2328, test_loss: 1.3290, test_f1: 0.6884
 epoch: 80, train_loss: 0.2363, test_loss: 1.3605, test_f1: 0.6806
 epoch: 81, train_loss: 0.2316, test_loss: 1.4206, test_f1: 0.6876
 epoch: 82, train_loss: 0.2260, test_loss: 1.3684, test_f1: 0.6862
 epoch: 83, train_loss: 0.2235, test_loss: 1.3627, test_f1: 0.7004
 epoch: 84, train_loss: 0.2060, test_loss: 1.2923, test_f1: 0.6870
 epoch: 85, train_loss: 0.2149, test_loss: 1.2988, test_f1: 0.7005
 epoch: 86, train_loss: 0.2003, test_loss: 1.3838, test_f1: 0.6840
 epoch: 87, train_loss: 0.2084, test_loss: 1.4773, test_f1: 0.6734
 epoch: 88, train_loss: 0.1996, test_loss: 1.4327, test_f1: 0.6894
 epoch: 89, train_loss: 0.2001, test_loss: 1.5169, test_f1: 0.6841
 epoch: 90, train_loss: 0.1854, test_loss: 1.4640, test_f1: 0.6949
 epoch: 91, train_loss: 0.2007, test_loss: 1.5346, test_f1: 0.6866
 epoch: 92, train_loss: 0.2049, test_loss: 1.5411, test_f1: 0.6869
 epoch: 93, train_loss: 0.1834, test_loss: 1.5470, test_f1: 0.6863
 epoch: 94, train_loss: 0.1896, test_loss: 1.4553, test_f1: 0.6798
 epoch: 95, train_loss: 0.1886, test_loss: 1.5391, test_f1: 0.6840
 epoch: 96, train_loss: 0.2066, test_loss: 1.4016, test_f1: 0.6835
 epoch: 97, train_loss: 0.2070, test_loss: 1.5198, test_f1: 0.7048
 epoch: 98, train_loss: 0.1815, test_loss: 1.6589, test_f1: 0.6493
 epoch: 99, train_loss: 0.1847, test_loss: 1.6614, test_f1: 0.6802
##################ITERATION #7 ****************************************
 epoch: 0, train_loss: 1.2170, test_loss: 0.9952, test_f1: 0.4707
 epoch: 1, train_loss: 0.9581, test_loss: 0.9557, test_f1: 0.5592
 epoch: 2, train_loss: 0.9213, test_loss: 1.0249, test_f1: 0.4957
 epoch: 3, train_loss: 0.8941, test_loss: 0.8932, test_f1: 0.5089
 epoch: 4, train_loss: 0.8707, test_loss: 0.8992, test_f1: 0.5403
 epoch: 5, train_loss: 0.8269, test_loss: 0.9347, test_f1: 0.4990
 epoch: 6, train_loss: 0.8237, test_loss: 0.8001, test_f1: 0.5670
 epoch: 7, train_loss: 0.7909, test_loss: 0.8408, test_f1: 0.5971
 epoch: 8, train_loss: 0.7947, test_loss: 0.8914, test_f1: 0.5878
 epoch: 9, train_loss: 0.7761, test_loss: 0.8901, test_f1: 0.5491
 epoch: 10, train_loss: 0.7581, test_loss: 0.9880, test_f1: 0.5250
 epoch: 11, train_loss: 0.7429, test_loss: 0.8342, test_f1: 0.5975
 epoch: 12, train_loss: 0.7295, test_loss: 0.7836, test_f1: 0.6166
 epoch: 13, train_loss: 0.7225, test_loss: 0.9396, test_f1: 0.5708
 epoch: 14, train_loss: 0.7124, test_loss: 0.7790, test_f1: 0.6257
 epoch: 15, train_loss: 0.6846, test_loss: 0.7837, test_f1: 0.6242
 epoch: 16, train_loss: 0.6708, test_loss: 0.8270, test_f1: 0.6415
 epoch: 17, train_loss: 0.6688, test_loss: 0.8289, test_f1: 0.6109
 epoch: 18, train_loss: 0.6652, test_loss: 0.8594, test_f1: 0.5889
 epoch: 19, train_loss: 0.6379, test_loss: 0.8356, test_f1: 0.5826
 epoch: 20, train_loss: 0.6409, test_loss: 0.8308, test_f1: 0.6339
 epoch: 21, train_loss: 0.6321, test_loss: 0.8415, test_f1: 0.6338
 epoch: 22, train_loss: 0.5942, test_loss: 0.8528, test_f1: 0.6130
 epoch: 23, train_loss: 0.5910, test_loss: 0.7691, test_f1: 0.6532
 epoch: 24, train_loss: 0.5954, test_loss: 0.7435, test_f1: 0.6663
 epoch: 25, train_loss: 0.5722, test_loss: 0.8263, test_f1: 0.6568
 epoch: 26, train_loss: 0.5762, test_loss: 0.8191, test_f1: 0.6342
 epoch: 27, train_loss: 0.5505, test_loss: 0.8181, test_f1: 0.6719
 epoch: 28, train_loss: 0.5501, test_loss: 0.9133, test_f1: 0.6415
 epoch: 29, train_loss: 0.5423, test_loss: 0.7853, test_f1: 0.6759
 epoch: 30, train_loss: 0.5494, test_loss: 0.8451, test_f1: 0.6551
 epoch: 31, train_loss: 0.5286, test_loss: 0.9326, test_f1: 0.6708
 epoch: 32, train_loss: 0.5313, test_loss: 0.9188, test_f1: 0.6621
 epoch: 33, train_loss: 0.5146, test_loss: 0.9164, test_f1: 0.6495
 epoch: 34, train_loss: 0.4900, test_loss: 0.9513, test_f1: 0.6434
 epoch: 35, train_loss: 0.5049, test_loss: 0.8354, test_f1: 0.6911
 epoch: 36, train_loss: 0.4876, test_loss: 0.9318, test_f1: 0.6678
 epoch: 37, train_loss: 0.4800, test_loss: 0.9268, test_f1: 0.6777
 epoch: 38, train_loss: 0.4730, test_loss: 0.9399, test_f1: 0.6752
 epoch: 39, train_loss: 0.4517, test_loss: 0.9158, test_f1: 0.6699
 epoch: 40, train_loss: 0.4431, test_loss: 0.9522, test_f1: 0.6934
 epoch: 41, train_loss: 0.4449, test_loss: 0.9735, test_f1: 0.6661
 epoch: 42, train_loss: 0.4040, test_loss: 0.9748, test_f1: 0.6785
 epoch: 43, train_loss: 0.4302, test_loss: 0.9906, test_f1: 0.6647
 epoch: 44, train_loss: 0.4150, test_loss: 1.0812, test_f1: 0.6531
 epoch: 45, train_loss: 0.4213, test_loss: 0.9779, test_f1: 0.6728
 epoch: 46, train_loss: 0.3924, test_loss: 0.9848, test_f1: 0.6800
 epoch: 47, train_loss: 0.4196, test_loss: 0.9650, test_f1: 0.6765
 epoch: 48, train_loss: 0.3914, test_loss: 0.9660, test_f1: 0.6938
 epoch: 49, train_loss: 0.3882, test_loss: 1.1292, test_f1: 0.6898
 epoch: 50, train_loss: 0.4033, test_loss: 1.1002, test_f1: 0.6797
 epoch: 51, train_loss: 0.3618, test_loss: 1.0850, test_f1: 0.6642
 epoch: 52, train_loss: 0.3047, test_loss: 1.0692, test_f1: 0.6802
 epoch: 53, train_loss: 0.3034, test_loss: 1.1617, test_f1: 0.6787
 epoch: 54, train_loss: 0.3153, test_loss: 1.1622, test_f1: 0.6698
 epoch: 55, train_loss: 0.2851, test_loss: 1.3210, test_f1: 0.6647
 epoch: 56, train_loss: 0.2895, test_loss: 1.1027, test_f1: 0.6758
 epoch: 57, train_loss: 0.2771, test_loss: 1.1702, test_f1: 0.6862
 epoch: 58, train_loss: 0.2657, test_loss: 1.1646, test_f1: 0.6762
 epoch: 59, train_loss: 0.2756, test_loss: 1.2325, test_f1: 0.6553
 epoch: 60, train_loss: 0.2820, test_loss: 1.1305, test_f1: 0.6769
 epoch: 61, train_loss: 0.2573, test_loss: 1.2566, test_f1: 0.6628
 epoch: 62, train_loss: 0.2757, test_loss: 1.2052, test_f1: 0.6734
 epoch: 63, train_loss: 0.2563, test_loss: 1.2025, test_f1: 0.6712
 epoch: 64, train_loss: 0.2345, test_loss: 1.3330, test_f1: 0.6523
 epoch: 65, train_loss: 0.2342, test_loss: 1.3367, test_f1: 0.6645
 epoch: 66, train_loss: 0.2567, test_loss: 1.2173, test_f1: 0.6614
 epoch: 67, train_loss: 0.2499, test_loss: 1.2223, test_f1: 0.6597
 epoch: 68, train_loss: 0.2346, test_loss: 1.3683, test_f1: 0.6500
 epoch: 69, train_loss: 0.2228, test_loss: 1.3486, test_f1: 0.6786
 epoch: 70, train_loss: 0.2296, test_loss: 1.4662, test_f1: 0.6585
 epoch: 71, train_loss: 0.2489, test_loss: 1.3962, test_f1: 0.6383
 epoch: 72, train_loss: 0.2311, test_loss: 1.3153, test_f1: 0.6643
 epoch: 73, train_loss: 0.2268, test_loss: 1.2465, test_f1: 0.6796
 epoch: 74, train_loss: 0.2320, test_loss: 1.3056, test_f1: 0.6682
 epoch: 75, train_loss: 0.2356, test_loss: 1.4902, test_f1: 0.6675
 epoch: 76, train_loss: 0.2125, test_loss: 1.3928, test_f1: 0.6963
 epoch: 77, train_loss: 0.2122, test_loss: 1.4950, test_f1: 0.6673
 epoch: 78, train_loss: 0.2233, test_loss: 1.4452, test_f1: 0.6724
 epoch: 79, train_loss: 0.2523, test_loss: 1.5952, test_f1: 0.6420
 epoch: 80, train_loss: 0.1993, test_loss: 1.5127, test_f1: 0.6323
 epoch: 81, train_loss: 0.2166, test_loss: 1.4674, test_f1: 0.6423
 epoch: 82, train_loss: 0.2129, test_loss: 1.6264, test_f1: 0.6318
 epoch: 83, train_loss: 0.2000, test_loss: 1.5571, test_f1: 0.6717
 epoch: 84, train_loss: 0.2043, test_loss: 1.4283, test_f1: 0.6751
 epoch: 85, train_loss: 0.2007, test_loss: 1.5102, test_f1: 0.6791
 epoch: 86, train_loss: 0.1798, test_loss: 1.6845, test_f1: 0.6531
 epoch: 87, train_loss: 0.1900, test_loss: 1.5547, test_f1: 0.6858
 epoch: 88, train_loss: 0.1895, test_loss: 1.5770, test_f1: 0.6918
 epoch: 89, train_loss: 0.1674, test_loss: 1.6371, test_f1: 0.6834
 epoch: 90, train_loss: 0.2143, test_loss: 1.5376, test_f1: 0.6742
 epoch: 91, train_loss: 0.1780, test_loss: 1.5490, test_f1: 0.6592
 epoch: 92, train_loss: 0.1855, test_loss: 1.6125, test_f1: 0.6536
 epoch: 93, train_loss: 0.2032, test_loss: 1.6031, test_f1: 0.6643
 epoch: 94, train_loss: 0.1968, test_loss: 1.3778, test_f1: 0.6667
 epoch: 95, train_loss: 0.2065, test_loss: 1.6915, test_f1: 0.6661
 epoch: 96, train_loss: 0.1713, test_loss: 1.5731, test_f1: 0.6693
 epoch: 97, train_loss: 0.1641, test_loss: 1.5967, test_f1: 0.6806
 epoch: 98, train_loss: 0.1631, test_loss: 1.5982, test_f1: 0.6830
 epoch: 99, train_loss: 0.1726, test_loss: 1.5224, test_f1: 0.6745
##################ITERATION #8 ****************************************
 epoch: 0, train_loss: 1.1579, test_loss: 0.9720, test_f1: 0.4718
 epoch: 1, train_loss: 0.9438, test_loss: 0.9201, test_f1: 0.5599
 epoch: 2, train_loss: 0.9130, test_loss: 0.8900, test_f1: 0.5478
 epoch: 3, train_loss: 0.8886, test_loss: 0.8732, test_f1: 0.5421
 epoch: 4, train_loss: 0.8477, test_loss: 0.8223, test_f1: 0.6111
 epoch: 5, train_loss: 0.8192, test_loss: 0.9445, test_f1: 0.5207
 epoch: 6, train_loss: 0.7996, test_loss: 0.8668, test_f1: 0.5602
 epoch: 7, train_loss: 0.7919, test_loss: 0.8388, test_f1: 0.6099
 epoch: 8, train_loss: 0.7845, test_loss: 0.8436, test_f1: 0.5839
 epoch: 9, train_loss: 0.7661, test_loss: 0.8905, test_f1: 0.5778
 epoch: 10, train_loss: 0.7579, test_loss: 0.8422, test_f1: 0.5930
 epoch: 11, train_loss: 0.7184, test_loss: 0.8037, test_f1: 0.6320
 epoch: 12, train_loss: 0.7261, test_loss: 0.8119, test_f1: 0.6240
 epoch: 13, train_loss: 0.6949, test_loss: 0.8229, test_f1: 0.6410
 epoch: 14, train_loss: 0.6739, test_loss: 0.8091, test_f1: 0.6772
 epoch: 15, train_loss: 0.6759, test_loss: 0.8699, test_f1: 0.6138
 epoch: 16, train_loss: 0.6698, test_loss: 0.8222, test_f1: 0.6329
 epoch: 17, train_loss: 0.6622, test_loss: 0.9067, test_f1: 0.6361
 epoch: 18, train_loss: 0.6358, test_loss: 0.7682, test_f1: 0.6647
 epoch: 19, train_loss: 0.6410, test_loss: 0.8436, test_f1: 0.6688
 epoch: 20, train_loss: 0.6225, test_loss: 0.8756, test_f1: 0.6386
 epoch: 21, train_loss: 0.6111, test_loss: 0.8450, test_f1: 0.6486
 epoch: 22, train_loss: 0.6029, test_loss: 0.7914, test_f1: 0.6543
 epoch: 23, train_loss: 0.6005, test_loss: 0.8059, test_f1: 0.6644
 epoch: 24, train_loss: 0.5963, test_loss: 0.9189, test_f1: 0.6258
 epoch: 25, train_loss: 0.5797, test_loss: 0.8256, test_f1: 0.6710
 epoch: 26, train_loss: 0.5584, test_loss: 0.8348, test_f1: 0.6891
 epoch: 27, train_loss: 0.5617, test_loss: 0.9031, test_f1: 0.6648
 epoch: 28, train_loss: 0.5377, test_loss: 0.9100, test_f1: 0.6630
 epoch: 29, train_loss: 0.5368, test_loss: 0.8008, test_f1: 0.6683
 epoch: 30, train_loss: 0.5109, test_loss: 0.8971, test_f1: 0.6554
 epoch: 31, train_loss: 0.5068, test_loss: 0.8648, test_f1: 0.6808
 epoch: 32, train_loss: 0.4769, test_loss: 0.9093, test_f1: 0.6632
 epoch: 33, train_loss: 0.4892, test_loss: 0.9535, test_f1: 0.6604
 epoch: 34, train_loss: 0.4842, test_loss: 0.8524, test_f1: 0.6839
 epoch: 35, train_loss: 0.4687, test_loss: 0.9271, test_f1: 0.6695
 epoch: 36, train_loss: 0.4842, test_loss: 0.9109, test_f1: 0.6493
 epoch: 37, train_loss: 0.5076, test_loss: 0.8779, test_f1: 0.6628
 epoch: 38, train_loss: 0.4650, test_loss: 0.8937, test_f1: 0.6515
 epoch: 39, train_loss: 0.4474, test_loss: 0.7805, test_f1: 0.6979
 epoch: 40, train_loss: 0.4403, test_loss: 0.8318, test_f1: 0.6497
 epoch: 41, train_loss: 0.4462, test_loss: 0.8481, test_f1: 0.6864
 epoch: 42, train_loss: 0.4305, test_loss: 0.8748, test_f1: 0.6592
 epoch: 43, train_loss: 0.4358, test_loss: 0.8608, test_f1: 0.6981
 epoch: 44, train_loss: 0.4276, test_loss: 0.9291, test_f1: 0.6553
 epoch: 45, train_loss: 0.4000, test_loss: 1.0685, test_f1: 0.6790
 epoch: 46, train_loss: 0.4205, test_loss: 0.9810, test_f1: 0.6515
 epoch: 47, train_loss: 0.3964, test_loss: 0.9028, test_f1: 0.6812
 epoch: 48, train_loss: 0.3757, test_loss: 0.9508, test_f1: 0.6716
 epoch: 49, train_loss: 0.3976, test_loss: 1.0792, test_f1: 0.6745
 epoch: 50, train_loss: 0.3844, test_loss: 1.1049, test_f1: 0.6783
 epoch: 51, train_loss: 0.3315, test_loss: 1.0506, test_f1: 0.6856
 epoch: 52, train_loss: 0.3354, test_loss: 1.0410, test_f1: 0.6894
 epoch: 53, train_loss: 0.2941, test_loss: 1.0889, test_f1: 0.6958
 epoch: 54, train_loss: 0.3117, test_loss: 1.1193, test_f1: 0.7148
 epoch: 55, train_loss: 0.2872, test_loss: 1.1037, test_f1: 0.6941
 epoch: 56, train_loss: 0.2861, test_loss: 1.1581, test_f1: 0.7192
 epoch: 57, train_loss: 0.2958, test_loss: 1.1885, test_f1: 0.6888
 epoch: 58, train_loss: 0.2845, test_loss: 1.2122, test_f1: 0.7001
 epoch: 59, train_loss: 0.2721, test_loss: 1.1949, test_f1: 0.7084
 epoch: 60, train_loss: 0.2771, test_loss: 1.1298, test_f1: 0.6958
 epoch: 61, train_loss: 0.2741, test_loss: 1.0988, test_f1: 0.6854
 epoch: 62, train_loss: 0.2575, test_loss: 1.1916, test_f1: 0.7039
 epoch: 63, train_loss: 0.2508, test_loss: 1.0689, test_f1: 0.6962
 epoch: 64, train_loss: 0.2416, test_loss: 1.2334, test_f1: 0.7061
 epoch: 65, train_loss: 0.2437, test_loss: 1.2682, test_f1: 0.6898
 epoch: 66, train_loss: 0.2398, test_loss: 1.2491, test_f1: 0.6629
 epoch: 67, train_loss: 0.2519, test_loss: 1.2072, test_f1: 0.7020
 epoch: 68, train_loss: 0.2423, test_loss: 1.1713, test_f1: 0.7028
 epoch: 69, train_loss: 0.2293, test_loss: 1.1770, test_f1: 0.6888
 epoch: 70, train_loss: 0.2287, test_loss: 1.2703, test_f1: 0.6707
 epoch: 71, train_loss: 0.2353, test_loss: 1.2735, test_f1: 0.6914
 epoch: 72, train_loss: 0.2264, test_loss: 1.2703, test_f1: 0.6973
 epoch: 73, train_loss: 0.2196, test_loss: 1.2258, test_f1: 0.6914
 epoch: 74, train_loss: 0.2269, test_loss: 1.2058, test_f1: 0.6993
 epoch: 75, train_loss: 0.2177, test_loss: 1.2629, test_f1: 0.6804
 epoch: 76, train_loss: 0.2095, test_loss: 1.2967, test_f1: 0.6871
 epoch: 77, train_loss: 0.2283, test_loss: 1.1833, test_f1: 0.6803
 epoch: 78, train_loss: 0.2049, test_loss: 1.2323, test_f1: 0.6768
 epoch: 79, train_loss: 0.2104, test_loss: 1.2267, test_f1: 0.7008
 epoch: 80, train_loss: 0.1844, test_loss: 1.1793, test_f1: 0.6927
 epoch: 81, train_loss: 0.2283, test_loss: 1.2305, test_f1: 0.7013
 epoch: 82, train_loss: 0.2106, test_loss: 1.2178, test_f1: 0.6894
 epoch: 83, train_loss: 0.2006, test_loss: 1.2768, test_f1: 0.7062
 epoch: 84, train_loss: 0.1933, test_loss: 1.2853, test_f1: 0.6995
 epoch: 85, train_loss: 0.2053, test_loss: 1.4102, test_f1: 0.6871
 epoch: 86, train_loss: 0.1954, test_loss: 1.5242, test_f1: 0.6713
 epoch: 87, train_loss: 0.2016, test_loss: 1.3889, test_f1: 0.6837
 epoch: 88, train_loss: 0.1874, test_loss: 1.3630, test_f1: 0.6695
 epoch: 89, train_loss: 0.1845, test_loss: 1.4244, test_f1: 0.6866
 epoch: 90, train_loss: 0.1897, test_loss: 1.5464, test_f1: 0.6522
 epoch: 91, train_loss: 0.1744, test_loss: 1.5111, test_f1: 0.7057
 epoch: 92, train_loss: 0.1700, test_loss: 1.4044, test_f1: 0.6951
 epoch: 93, train_loss: 0.1904, test_loss: 1.3002, test_f1: 0.7152
 epoch: 94, train_loss: 0.1913, test_loss: 1.2670, test_f1: 0.6850
 epoch: 95, train_loss: 0.1635, test_loss: 1.4189, test_f1: 0.6738
 epoch: 96, train_loss: 0.1788, test_loss: 1.2701, test_f1: 0.7072
 epoch: 97, train_loss: 0.1950, test_loss: 1.3571, test_f1: 0.7060
 epoch: 98, train_loss: 0.1999, test_loss: 1.3656, test_f1: 0.7023
 epoch: 99, train_loss: 0.1628, test_loss: 1.4475, test_f1: 0.6704
##################ITERATION #9 ****************************************
 epoch: 0, train_loss: 1.1980, test_loss: 1.0676, test_f1: 0.4138
 epoch: 1, train_loss: 0.9658, test_loss: 0.9275, test_f1: 0.5058
 epoch: 2, train_loss: 0.9064, test_loss: 0.9056, test_f1: 0.5265
 epoch: 3, train_loss: 0.8814, test_loss: 0.9438, test_f1: 0.5068
 epoch: 4, train_loss: 0.8568, test_loss: 0.9161, test_f1: 0.4865
 epoch: 5, train_loss: 0.8315, test_loss: 0.9107, test_f1: 0.5469
 epoch: 6, train_loss: 0.8104, test_loss: 0.9144, test_f1: 0.5505
 epoch: 7, train_loss: 0.7912, test_loss: 0.8611, test_f1: 0.5610
 epoch: 8, train_loss: 0.7728, test_loss: 0.9017, test_f1: 0.5836
 epoch: 9, train_loss: 0.7630, test_loss: 0.8325, test_f1: 0.6345
 epoch: 10, train_loss: 0.7421, test_loss: 0.9154, test_f1: 0.5431
 epoch: 11, train_loss: 0.7280, test_loss: 0.9288, test_f1: 0.5806
 epoch: 12, train_loss: 0.7250, test_loss: 0.8825, test_f1: 0.6098
 epoch: 13, train_loss: 0.7016, test_loss: 0.7990, test_f1: 0.6361
 epoch: 14, train_loss: 0.6952, test_loss: 0.8487, test_f1: 0.6064
 epoch: 15, train_loss: 0.6717, test_loss: 0.8412, test_f1: 0.6054
 epoch: 16, train_loss: 0.6621, test_loss: 0.8278, test_f1: 0.6406
 epoch: 17, train_loss: 0.6476, test_loss: 0.8944, test_f1: 0.6164
 epoch: 18, train_loss: 0.6444, test_loss: 0.7941, test_f1: 0.6341
 epoch: 19, train_loss: 0.6248, test_loss: 0.9205, test_f1: 0.6259
 epoch: 20, train_loss: 0.6212, test_loss: 0.8849, test_f1: 0.6395
 epoch: 21, train_loss: 0.6064, test_loss: 0.8930, test_f1: 0.6692
 epoch: 22, train_loss: 0.6027, test_loss: 0.8772, test_f1: 0.6618
 epoch: 23, train_loss: 0.5821, test_loss: 0.8800, test_f1: 0.6445
 epoch: 24, train_loss: 0.5623, test_loss: 0.8754, test_f1: 0.6370
 epoch: 25, train_loss: 0.5698, test_loss: 0.9127, test_f1: 0.6612
 epoch: 26, train_loss: 0.5495, test_loss: 0.8603, test_f1: 0.6641
 epoch: 27, train_loss: 0.5393, test_loss: 0.8917, test_f1: 0.6527
 epoch: 28, train_loss: 0.5384, test_loss: 0.9420, test_f1: 0.6354
 epoch: 29, train_loss: 0.5106, test_loss: 0.9926, test_f1: 0.6619
 epoch: 30, train_loss: 0.4965, test_loss: 1.0140, test_f1: 0.6627
 epoch: 31, train_loss: 0.4888, test_loss: 1.0165, test_f1: 0.6768
 epoch: 32, train_loss: 0.5006, test_loss: 0.9616, test_f1: 0.6553
 epoch: 33, train_loss: 0.4925, test_loss: 0.9533, test_f1: 0.6672
 epoch: 34, train_loss: 0.4722, test_loss: 0.9403, test_f1: 0.6799
 epoch: 35, train_loss: 0.4889, test_loss: 0.9830, test_f1: 0.6754
 epoch: 36, train_loss: 0.4719, test_loss: 0.8714, test_f1: 0.6708
 epoch: 37, train_loss: 0.4637, test_loss: 0.9602, test_f1: 0.6645
 epoch: 38, train_loss: 0.4395, test_loss: 1.0538, test_f1: 0.6689
 epoch: 39, train_loss: 0.4119, test_loss: 1.0886, test_f1: 0.6679
 epoch: 40, train_loss: 0.4185, test_loss: 1.0327, test_f1: 0.6821
 epoch: 41, train_loss: 0.4029, test_loss: 0.9786, test_f1: 0.6496
 epoch: 42, train_loss: 0.4274, test_loss: 0.9706, test_f1: 0.6582
 epoch: 43, train_loss: 0.4241, test_loss: 0.9444, test_f1: 0.6852
 epoch: 44, train_loss: 0.4228, test_loss: 1.0023, test_f1: 0.6953
 epoch: 45, train_loss: 0.4138, test_loss: 1.0401, test_f1: 0.6655
 epoch: 46, train_loss: 0.4019, test_loss: 0.9639, test_f1: 0.6869
 epoch: 47, train_loss: 0.3934, test_loss: 1.1004, test_f1: 0.6618
 epoch: 48, train_loss: 0.3894, test_loss: 0.9989, test_f1: 0.6780
 epoch: 49, train_loss: 0.3626, test_loss: 1.0697, test_f1: 0.6671
 epoch: 50, train_loss: 0.3912, test_loss: 0.9721, test_f1: 0.6581
 epoch: 51, train_loss: 0.3246, test_loss: 1.0272, test_f1: 0.6998
 epoch: 52, train_loss: 0.2978, test_loss: 1.1371, test_f1: 0.6939
 epoch: 53, train_loss: 0.3002, test_loss: 1.1188, test_f1: 0.6689
 epoch: 54, train_loss: 0.2925, test_loss: 1.0509, test_f1: 0.6884
 epoch: 55, train_loss: 0.2781, test_loss: 1.0900, test_f1: 0.6986
 epoch: 56, train_loss: 0.2757, test_loss: 1.1771, test_f1: 0.6681
 epoch: 57, train_loss: 0.2743, test_loss: 1.1345, test_f1: 0.7119
 epoch: 58, train_loss: 0.2761, test_loss: 1.0889, test_f1: 0.6781
 epoch: 59, train_loss: 0.2480, test_loss: 1.0892, test_f1: 0.6768
 epoch: 60, train_loss: 0.2614, test_loss: 1.1163, test_f1: 0.6894
 epoch: 61, train_loss: 0.2482, test_loss: 1.2576, test_f1: 0.7053
 epoch: 62, train_loss: 0.2478, test_loss: 1.2293, test_f1: 0.6713
 epoch: 63, train_loss: 0.2429, test_loss: 1.2700, test_f1: 0.6759
 epoch: 64, train_loss: 0.2553, test_loss: 1.2964, test_f1: 0.6768
 epoch: 65, train_loss: 0.2304, test_loss: 1.3011, test_f1: 0.7014
 epoch: 66, train_loss: 0.2186, test_loss: 1.2434, test_f1: 0.7056
 epoch: 67, train_loss: 0.2453, test_loss: 1.2920, test_f1: 0.6988
 epoch: 68, train_loss: 0.2343, test_loss: 1.2443, test_f1: 0.6919
 epoch: 69, train_loss: 0.2294, test_loss: 1.4215, test_f1: 0.6699
 epoch: 70, train_loss: 0.2337, test_loss: 1.3715, test_f1: 0.6752
 epoch: 71, train_loss: 0.2267, test_loss: 1.3365, test_f1: 0.7123
 epoch: 72, train_loss: 0.2222, test_loss: 1.4097, test_f1: 0.6969
 epoch: 73, train_loss: 0.2311, test_loss: 1.4181, test_f1: 0.6947
 epoch: 74, train_loss: 0.2237, test_loss: 1.4300, test_f1: 0.6696
 epoch: 75, train_loss: 0.2132, test_loss: 1.3294, test_f1: 0.6960
 epoch: 76, train_loss: 0.2177, test_loss: 1.4458, test_f1: 0.6849
 epoch: 77, train_loss: 0.2239, test_loss: 1.4393, test_f1: 0.6524
 epoch: 78, train_loss: 0.2000, test_loss: 1.5538, test_f1: 0.6651
 epoch: 79, train_loss: 0.1974, test_loss: 1.3870, test_f1: 0.6946
 epoch: 80, train_loss: 0.1996, test_loss: 1.4840, test_f1: 0.6868
 epoch: 81, train_loss: 0.2043, test_loss: 1.4612, test_f1: 0.6781
 epoch: 82, train_loss: 0.2081, test_loss: 1.4258, test_f1: 0.6903
 epoch: 83, train_loss: 0.2181, test_loss: 1.4215, test_f1: 0.6820
 epoch: 84, train_loss: 0.1850, test_loss: 1.4387, test_f1: 0.6893
 epoch: 85, train_loss: 0.1754, test_loss: 1.5374, test_f1: 0.6899
 epoch: 86, train_loss: 0.1771, test_loss: 1.7167, test_f1: 0.6436
 epoch: 87, train_loss: 0.1960, test_loss: 1.5447, test_f1: 0.6697
 epoch: 88, train_loss: 0.1796, test_loss: 1.5658, test_f1: 0.6812
 epoch: 89, train_loss: 0.1850, test_loss: 1.4502, test_f1: 0.6763
 epoch: 90, train_loss: 0.1814, test_loss: 1.5425, test_f1: 0.6766
 epoch: 91, train_loss: 0.1772, test_loss: 1.5527, test_f1: 0.6499
 epoch: 92, train_loss: 0.1670, test_loss: 1.6175, test_f1: 0.6411
 epoch: 93, train_loss: 0.1690, test_loss: 1.5066, test_f1: 0.7010
 epoch: 94, train_loss: 0.1761, test_loss: 1.5615, test_f1: 0.6985
 epoch: 95, train_loss: 0.1787, test_loss: 1.4741, test_f1: 0.6622
 epoch: 96, train_loss: 0.1636, test_loss: 1.4986, test_f1: 0.6808
 epoch: 97, train_loss: 0.1723, test_loss: 1.6861, test_f1: 0.6733
 epoch: 98, train_loss: 0.1698, test_loss: 1.7997, test_f1: 0.6762
 epoch: 99, train_loss: 0.1852, test_loss: 1.6067, test_f1: 0.6786

Training completed in 973.56 seconds
Best F1: 0.7257 at epoch 51
Mean F1 across iterations: 0.7062  0.0128
========================FINAL RESULTS================================
FEGIN weighted F1: 0.7257  0.0128
python main.py --data ltspice_examples --representation component_pin --model FEGIN --layers 3 --hiddens 128 --batch_size 32 --lr 0.001 --emb_size 128 --epochs 100 --save_appendix component_pin_L3_H128_BS32_LR0.001_E128 --no_val
-----



STDERR:
  File "main.py", line 370, in <module>
    main()
  File "main.py", line 254, in main
    dataset = dataset_class(
  File "/home/philip/projects/ltspice_examples_code_repo/Circuit-Completion-Using-GNNs/component_classification_with_link_prediction_head/evaluation/FEGIN/kernel/circuit_datasets.py", line 15, in __init__
    self.data, self.slices = torch.load(self.processed_paths[0])
  File "/home/philip/.local/lib/python3.8/site-packages/torch/serialization.py", line 1040, in load
    warnings.warn(
  File "/usr/lib/python3.8/warnings.py", line 109, in _showwarnmsg
    sw(msg.message, msg.category, msg.filename, msg.lineno,
  File "main.py", line 47, in warn_with_traceback
    traceback.print_stack(file=log)
/home/philip/projects/ltspice_examples_code_repo/Circuit-Completion-Using-GNNs/component_classification_with_link_prediction_head/evaluation/FEGIN/kernel/circuit_datasets.py:15: FutureWarning: You are using `torch.load` with `weights_only=False` (the current default value), which uses the default pickle module implicitly. It is possible to construct malicious pickle data which will execute arbitrary code during unpickling (See https://github.com/pytorch/pytorch/blob/main/SECURITY.md#untrusted-models for more details). In a future release, the default value for `weights_only` will be flipped to `True`. This limits the functions that could be executed during unpickling. Arbitrary objects will no longer be allowed to be loaded via this mode unless they are explicitly allowlisted by the user via `torch.serialization.add_safe_globals`. We recommend you start setting `weights_only=True` for any use case where you don't have full control of the loaded file. Please open an issue on GitHub for any issues related to this experimental feature.
  self.data, self.slices = torch.load(self.processed_paths[0])
