STDOUT:
Results will be saved in /home/philip/projects/ltspice_examples_code_repo/Circuit-Completion-Using-GNNs/component_classification_with_link_prediction_head/evaluation/FEGIN/results/model_FEGIN_dataset_ltspice_examples
Command line input: python main.py --data ltspice_examples --representation component_pin_net --model FEGIN --layers 3 --hiddens 128 --batch_size 32 --lr 0.0001 --emb_size 128 --epochs 100 --save_appendix component_pin_net_L3_H128_BS32_LR0.0001_E128 --no_val
 is saved.
-----
ltspice_examples - FEGIN
Using 3 layers, 128 hidden units, h = 2
Loading component_pin_net representation dataset
ENTERED
Training FEGIN on component_pin_net representation
Train: 3558, Test: 846
##################ITERATION #0 ****************************************
 epoch: 0, train_loss: 1.3109, test_loss: 1.1882, test_f1: 0.3056
 epoch: 1, train_loss: 1.1820, test_loss: 1.1291, test_f1: 0.3821
 epoch: 2, train_loss: 1.1184, test_loss: 1.0548, test_f1: 0.4469
 epoch: 3, train_loss: 1.0490, test_loss: 1.0237, test_f1: 0.4637
 epoch: 4, train_loss: 1.0037, test_loss: 0.9999, test_f1: 0.5071
 epoch: 5, train_loss: 0.9797, test_loss: 0.9534, test_f1: 0.5014
 epoch: 6, train_loss: 0.9530, test_loss: 0.9649, test_f1: 0.5157
 epoch: 7, train_loss: 0.9291, test_loss: 0.9366, test_f1: 0.5324
 epoch: 8, train_loss: 0.9272, test_loss: 0.9233, test_f1: 0.4959
 epoch: 9, train_loss: 0.9146, test_loss: 0.9133, test_f1: 0.5092
 epoch: 10, train_loss: 0.9037, test_loss: 0.9352, test_f1: 0.4917
 epoch: 11, train_loss: 0.8851, test_loss: 0.9116, test_f1: 0.5400
 epoch: 12, train_loss: 0.8822, test_loss: 0.8630, test_f1: 0.5365
 epoch: 13, train_loss: 0.8681, test_loss: 0.8639, test_f1: 0.5495
 epoch: 14, train_loss: 0.8495, test_loss: 0.8683, test_f1: 0.5583
 epoch: 15, train_loss: 0.8510, test_loss: 0.8852, test_f1: 0.5277
 epoch: 16, train_loss: 0.8403, test_loss: 0.8535, test_f1: 0.5557
 epoch: 17, train_loss: 0.8360, test_loss: 0.8442, test_f1: 0.5621
 epoch: 18, train_loss: 0.8219, test_loss: 0.8619, test_f1: 0.5418
 epoch: 19, train_loss: 0.8114, test_loss: 0.8369, test_f1: 0.5518
 epoch: 20, train_loss: 0.8082, test_loss: 0.8295, test_f1: 0.5688
 epoch: 21, train_loss: 0.7974, test_loss: 0.8260, test_f1: 0.5818
 epoch: 22, train_loss: 0.7959, test_loss: 0.8534, test_f1: 0.5611
 epoch: 23, train_loss: 0.7765, test_loss: 0.8690, test_f1: 0.5322
 epoch: 24, train_loss: 0.7727, test_loss: 0.8347, test_f1: 0.5677
 epoch: 25, train_loss: 0.7700, test_loss: 0.8081, test_f1: 0.5715
 epoch: 26, train_loss: 0.7665, test_loss: 0.8151, test_f1: 0.5787
 epoch: 27, train_loss: 0.7509, test_loss: 0.7931, test_f1: 0.5784
 epoch: 28, train_loss: 0.7520, test_loss: 0.8857, test_f1: 0.5798
 epoch: 29, train_loss: 0.7534, test_loss: 0.8242, test_f1: 0.6055
 epoch: 30, train_loss: 0.7358, test_loss: 0.7880, test_f1: 0.6055
 epoch: 31, train_loss: 0.7363, test_loss: 0.8329, test_f1: 0.5714
 epoch: 32, train_loss: 0.7244, test_loss: 0.8415, test_f1: 0.6007
 epoch: 33, train_loss: 0.7180, test_loss: 0.8376, test_f1: 0.5957
 epoch: 34, train_loss: 0.7162, test_loss: 0.8338, test_f1: 0.6095
 epoch: 35, train_loss: 0.7191, test_loss: 0.8087, test_f1: 0.6134
 epoch: 36, train_loss: 0.7043, test_loss: 0.8321, test_f1: 0.6126
 epoch: 37, train_loss: 0.6943, test_loss: 0.8180, test_f1: 0.6058
 epoch: 38, train_loss: 0.6990, test_loss: 0.8494, test_f1: 0.6040
 epoch: 39, train_loss: 0.6738, test_loss: 0.8340, test_f1: 0.5953
 epoch: 40, train_loss: 0.6862, test_loss: 0.7801, test_f1: 0.6125
 epoch: 41, train_loss: 0.6718, test_loss: 0.7876, test_f1: 0.6274
 epoch: 42, train_loss: 0.6749, test_loss: 0.8046, test_f1: 0.5928
 epoch: 43, train_loss: 0.6753, test_loss: 0.8157, test_f1: 0.6334
 epoch: 44, train_loss: 0.6653, test_loss: 0.8482, test_f1: 0.5939
 epoch: 45, train_loss: 0.6602, test_loss: 0.8780, test_f1: 0.6179
 epoch: 46, train_loss: 0.6476, test_loss: 0.8202, test_f1: 0.6317
 epoch: 47, train_loss: 0.6591, test_loss: 0.8664, test_f1: 0.6003
 epoch: 48, train_loss: 0.6428, test_loss: 0.8583, test_f1: 0.5981
 epoch: 49, train_loss: 0.6492, test_loss: 0.8511, test_f1: 0.6377
 epoch: 50, train_loss: 0.6279, test_loss: 0.8554, test_f1: 0.6375
 epoch: 51, train_loss: 0.6140, test_loss: 0.8254, test_f1: 0.6222
 epoch: 52, train_loss: 0.6184, test_loss: 0.8182, test_f1: 0.6344
 epoch: 53, train_loss: 0.6074, test_loss: 0.8371, test_f1: 0.6320
 epoch: 54, train_loss: 0.5941, test_loss: 0.8555, test_f1: 0.6298
 epoch: 55, train_loss: 0.6053, test_loss: 0.8467, test_f1: 0.6289
 epoch: 56, train_loss: 0.6024, test_loss: 0.8404, test_f1: 0.6334
 epoch: 57, train_loss: 0.5973, test_loss: 0.8565, test_f1: 0.6323
 epoch: 58, train_loss: 0.5929, test_loss: 0.8620, test_f1: 0.6360
 epoch: 59, train_loss: 0.5872, test_loss: 0.8752, test_f1: 0.6339
 epoch: 60, train_loss: 0.5766, test_loss: 0.8777, test_f1: 0.6360
 epoch: 61, train_loss: 0.5843, test_loss: 0.9067, test_f1: 0.6281
 epoch: 62, train_loss: 0.5796, test_loss: 0.8836, test_f1: 0.6287
 epoch: 63, train_loss: 0.5778, test_loss: 0.8948, test_f1: 0.6387
 epoch: 64, train_loss: 0.5768, test_loss: 0.8895, test_f1: 0.6429
 epoch: 65, train_loss: 0.5802, test_loss: 0.8791, test_f1: 0.6413
 epoch: 66, train_loss: 0.5755, test_loss: 0.8720, test_f1: 0.6468
 epoch: 67, train_loss: 0.5778, test_loss: 0.8588, test_f1: 0.6230
 epoch: 68, train_loss: 0.5707, test_loss: 0.8707, test_f1: 0.6452
 epoch: 69, train_loss: 0.5593, test_loss: 0.8990, test_f1: 0.6334
 epoch: 70, train_loss: 0.5775, test_loss: 0.8731, test_f1: 0.6573
 epoch: 71, train_loss: 0.5505, test_loss: 0.9121, test_f1: 0.6389
 epoch: 72, train_loss: 0.5608, test_loss: 0.8722, test_f1: 0.6461
 epoch: 73, train_loss: 0.5582, test_loss: 0.8629, test_f1: 0.6507
 epoch: 74, train_loss: 0.5519, test_loss: 0.9004, test_f1: 0.6567
 epoch: 75, train_loss: 0.5485, test_loss: 0.8984, test_f1: 0.6411
 epoch: 76, train_loss: 0.5483, test_loss: 0.8912, test_f1: 0.6579
 epoch: 77, train_loss: 0.5518, test_loss: 0.9036, test_f1: 0.6482
 epoch: 78, train_loss: 0.5393, test_loss: 0.9143, test_f1: 0.6454
 epoch: 79, train_loss: 0.5394, test_loss: 0.8579, test_f1: 0.6542
 epoch: 80, train_loss: 0.5444, test_loss: 0.8722, test_f1: 0.6309
 epoch: 81, train_loss: 0.5405, test_loss: 0.8331, test_f1: 0.6635
 epoch: 82, train_loss: 0.5296, test_loss: 0.9240, test_f1: 0.6512
 epoch: 83, train_loss: 0.5219, test_loss: 0.9281, test_f1: 0.6443
 epoch: 84, train_loss: 0.5186, test_loss: 0.9411, test_f1: 0.6315
 epoch: 85, train_loss: 0.5325, test_loss: 0.9018, test_f1: 0.6402
 epoch: 86, train_loss: 0.5344, test_loss: 0.9162, test_f1: 0.6329
 epoch: 87, train_loss: 0.5317, test_loss: 0.9329, test_f1: 0.6168
 epoch: 88, train_loss: 0.5216, test_loss: 0.9570, test_f1: 0.6304
 epoch: 89, train_loss: 0.5135, test_loss: 0.9068, test_f1: 0.6548
 epoch: 90, train_loss: 0.5239, test_loss: 0.9638, test_f1: 0.6491
 epoch: 91, train_loss: 0.5051, test_loss: 0.9313, test_f1: 0.6379
 epoch: 92, train_loss: 0.5009, test_loss: 0.9287, test_f1: 0.6353
 epoch: 93, train_loss: 0.5042, test_loss: 0.9176, test_f1: 0.6258
 epoch: 94, train_loss: 0.5089, test_loss: 0.9764, test_f1: 0.6305
 epoch: 95, train_loss: 0.5069, test_loss: 0.9529, test_f1: 0.6448
 epoch: 96, train_loss: 0.5121, test_loss: 0.9485, test_f1: 0.6601
 epoch: 97, train_loss: 0.5016, test_loss: 0.9571, test_f1: 0.6371
 epoch: 98, train_loss: 0.5048, test_loss: 0.9507, test_f1: 0.6276
 epoch: 99, train_loss: 0.4987, test_loss: 0.9400, test_f1: 0.6197
##################ITERATION #1 ****************************************
 epoch: 0, train_loss: 1.2081, test_loss: 1.0523, test_f1: 0.4086
 epoch: 1, train_loss: 1.0414, test_loss: 0.9885, test_f1: 0.4794
 epoch: 2, train_loss: 0.9871, test_loss: 0.9477, test_f1: 0.5022
 epoch: 3, train_loss: 0.9607, test_loss: 0.9346, test_f1: 0.5445
 epoch: 4, train_loss: 0.9389, test_loss: 0.9271, test_f1: 0.5143
 epoch: 5, train_loss: 0.9228, test_loss: 0.9053, test_f1: 0.5400
 epoch: 6, train_loss: 0.9049, test_loss: 0.9169, test_f1: 0.5338
 epoch: 7, train_loss: 0.8959, test_loss: 0.8946, test_f1: 0.5561
 epoch: 8, train_loss: 0.8677, test_loss: 0.8365, test_f1: 0.5751
 epoch: 9, train_loss: 0.8661, test_loss: 0.8451, test_f1: 0.5671
 epoch: 10, train_loss: 0.8384, test_loss: 0.8558, test_f1: 0.5603
 epoch: 11, train_loss: 0.8339, test_loss: 0.8297, test_f1: 0.5567
 epoch: 12, train_loss: 0.8285, test_loss: 0.8114, test_f1: 0.5727
 epoch: 13, train_loss: 0.8203, test_loss: 0.8110, test_f1: 0.5733
 epoch: 14, train_loss: 0.8044, test_loss: 0.8126, test_f1: 0.5650
 epoch: 15, train_loss: 0.8003, test_loss: 0.7972, test_f1: 0.5872
 epoch: 16, train_loss: 0.7905, test_loss: 0.7867, test_f1: 0.5935
 epoch: 17, train_loss: 0.7769, test_loss: 0.7588, test_f1: 0.6106
 epoch: 18, train_loss: 0.7708, test_loss: 0.8102, test_f1: 0.6168
 epoch: 19, train_loss: 0.7577, test_loss: 0.8151, test_f1: 0.6201
 epoch: 20, train_loss: 0.7548, test_loss: 0.7704, test_f1: 0.6197
 epoch: 21, train_loss: 0.7415, test_loss: 0.7564, test_f1: 0.6084
 epoch: 22, train_loss: 0.7342, test_loss: 0.7827, test_f1: 0.5972
 epoch: 23, train_loss: 0.7348, test_loss: 0.7381, test_f1: 0.6178
 epoch: 24, train_loss: 0.7200, test_loss: 0.7497, test_f1: 0.6475
 epoch: 25, train_loss: 0.7014, test_loss: 0.8042, test_f1: 0.6165
 epoch: 26, train_loss: 0.7050, test_loss: 0.7909, test_f1: 0.6031
 epoch: 27, train_loss: 0.6939, test_loss: 0.7880, test_f1: 0.6267
 epoch: 28, train_loss: 0.6947, test_loss: 0.8098, test_f1: 0.6111
 epoch: 29, train_loss: 0.6798, test_loss: 0.7228, test_f1: 0.6415
 epoch: 30, train_loss: 0.6737, test_loss: 0.7556, test_f1: 0.6411
 epoch: 31, train_loss: 0.6661, test_loss: 0.7635, test_f1: 0.6479
 epoch: 32, train_loss: 0.6684, test_loss: 0.7295, test_f1: 0.6326
 epoch: 33, train_loss: 0.6561, test_loss: 0.7525, test_f1: 0.6497
 epoch: 34, train_loss: 0.6584, test_loss: 0.7430, test_f1: 0.6286
 epoch: 35, train_loss: 0.6341, test_loss: 0.7851, test_f1: 0.6287
 epoch: 36, train_loss: 0.6335, test_loss: 0.7648, test_f1: 0.6357
 epoch: 37, train_loss: 0.6191, test_loss: 0.7768, test_f1: 0.6212
 epoch: 38, train_loss: 0.6295, test_loss: 0.7696, test_f1: 0.6439
 epoch: 39, train_loss: 0.6173, test_loss: 0.7867, test_f1: 0.6276
 epoch: 40, train_loss: 0.6068, test_loss: 0.7853, test_f1: 0.6445
 epoch: 41, train_loss: 0.6033, test_loss: 0.7775, test_f1: 0.6206
 epoch: 42, train_loss: 0.6009, test_loss: 0.8024, test_f1: 0.6517
 epoch: 43, train_loss: 0.6006, test_loss: 0.8078, test_f1: 0.6454
 epoch: 44, train_loss: 0.5796, test_loss: 0.7845, test_f1: 0.6694
 epoch: 45, train_loss: 0.5796, test_loss: 0.8296, test_f1: 0.6421
 epoch: 46, train_loss: 0.5868, test_loss: 0.7741, test_f1: 0.6517
 epoch: 47, train_loss: 0.5774, test_loss: 0.8072, test_f1: 0.6292
 epoch: 48, train_loss: 0.5728, test_loss: 0.7650, test_f1: 0.6259
 epoch: 49, train_loss: 0.5609, test_loss: 0.8027, test_f1: 0.6469
 epoch: 50, train_loss: 0.5523, test_loss: 0.8612, test_f1: 0.6541
 epoch: 51, train_loss: 0.5444, test_loss: 0.8281, test_f1: 0.6518
 epoch: 52, train_loss: 0.5371, test_loss: 0.8208, test_f1: 0.6600
 epoch: 53, train_loss: 0.5264, test_loss: 0.8425, test_f1: 0.6428
 epoch: 54, train_loss: 0.5297, test_loss: 0.8769, test_f1: 0.6507
 epoch: 55, train_loss: 0.5137, test_loss: 0.8537, test_f1: 0.6418
 epoch: 56, train_loss: 0.5061, test_loss: 0.8618, test_f1: 0.6568
 epoch: 57, train_loss: 0.5165, test_loss: 0.8121, test_f1: 0.6616
 epoch: 58, train_loss: 0.5130, test_loss: 0.8483, test_f1: 0.6481
 epoch: 59, train_loss: 0.5037, test_loss: 0.8436, test_f1: 0.6524
 epoch: 60, train_loss: 0.5022, test_loss: 0.8508, test_f1: 0.6628
 epoch: 61, train_loss: 0.5032, test_loss: 0.8433, test_f1: 0.6410
 epoch: 62, train_loss: 0.4978, test_loss: 0.8699, test_f1: 0.6573
 epoch: 63, train_loss: 0.4969, test_loss: 0.9124, test_f1: 0.6386
 epoch: 64, train_loss: 0.4970, test_loss: 0.8658, test_f1: 0.6686
 epoch: 65, train_loss: 0.4873, test_loss: 0.8580, test_f1: 0.6375
 epoch: 66, train_loss: 0.4925, test_loss: 0.8710, test_f1: 0.6571
 epoch: 67, train_loss: 0.4879, test_loss: 0.8989, test_f1: 0.6417
 epoch: 68, train_loss: 0.4737, test_loss: 0.8894, test_f1: 0.6722
 epoch: 69, train_loss: 0.4670, test_loss: 0.8841, test_f1: 0.6605
 epoch: 70, train_loss: 0.4816, test_loss: 0.9366, test_f1: 0.6423
 epoch: 71, train_loss: 0.4732, test_loss: 0.9113, test_f1: 0.6614
 epoch: 72, train_loss: 0.4763, test_loss: 0.9318, test_f1: 0.6486
 epoch: 73, train_loss: 0.4622, test_loss: 0.9160, test_f1: 0.6546
 epoch: 74, train_loss: 0.4626, test_loss: 0.9591, test_f1: 0.6546
 epoch: 75, train_loss: 0.4554, test_loss: 0.9432, test_f1: 0.6669
 epoch: 76, train_loss: 0.4636, test_loss: 0.9382, test_f1: 0.6631
 epoch: 77, train_loss: 0.4560, test_loss: 0.9684, test_f1: 0.6531
 epoch: 78, train_loss: 0.4470, test_loss: 0.9254, test_f1: 0.6548
 epoch: 79, train_loss: 0.4448, test_loss: 0.9538, test_f1: 0.6453
 epoch: 80, train_loss: 0.4487, test_loss: 0.9532, test_f1: 0.6652
 epoch: 81, train_loss: 0.4399, test_loss: 1.0068, test_f1: 0.6549
 epoch: 82, train_loss: 0.4406, test_loss: 0.9824, test_f1: 0.6592
 epoch: 83, train_loss: 0.4394, test_loss: 0.9690, test_f1: 0.6531
 epoch: 84, train_loss: 0.4412, test_loss: 0.9899, test_f1: 0.6421
 epoch: 85, train_loss: 0.4288, test_loss: 1.0045, test_f1: 0.6471
 epoch: 86, train_loss: 0.4363, test_loss: 0.9913, test_f1: 0.6507
 epoch: 87, train_loss: 0.4305, test_loss: 0.9950, test_f1: 0.6651
 epoch: 88, train_loss: 0.4428, test_loss: 1.0235, test_f1: 0.6682
 epoch: 89, train_loss: 0.4141, test_loss: 1.0208, test_f1: 0.6499
 epoch: 90, train_loss: 0.4233, test_loss: 1.0042, test_f1: 0.6527
 epoch: 91, train_loss: 0.4332, test_loss: 0.9646, test_f1: 0.6594
 epoch: 92, train_loss: 0.4145, test_loss: 1.0050, test_f1: 0.6452
 epoch: 93, train_loss: 0.4175, test_loss: 1.0685, test_f1: 0.6422
 epoch: 94, train_loss: 0.4253, test_loss: 1.0627, test_f1: 0.6590
 epoch: 95, train_loss: 0.4070, test_loss: 1.0365, test_f1: 0.6314
 epoch: 96, train_loss: 0.4247, test_loss: 1.0249, test_f1: 0.6579
 epoch: 97, train_loss: 0.4104, test_loss: 1.0686, test_f1: 0.6553
 epoch: 98, train_loss: 0.4106, test_loss: 1.0448, test_f1: 0.6589
 epoch: 99, train_loss: 0.4134, test_loss: 1.0671, test_f1: 0.6469
##################ITERATION #2 ****************************************
 epoch: 0, train_loss: 1.1477, test_loss: 1.0217, test_f1: 0.4872
 epoch: 1, train_loss: 1.0162, test_loss: 0.9812, test_f1: 0.4805
 epoch: 2, train_loss: 0.9666, test_loss: 0.9628, test_f1: 0.5233
 epoch: 3, train_loss: 0.9528, test_loss: 0.9331, test_f1: 0.5467
 epoch: 4, train_loss: 0.9384, test_loss: 0.9100, test_f1: 0.5562
 epoch: 5, train_loss: 0.9266, test_loss: 0.8772, test_f1: 0.5450
 epoch: 6, train_loss: 0.9088, test_loss: 0.8839, test_f1: 0.5319
 epoch: 7, train_loss: 0.8950, test_loss: 0.8561, test_f1: 0.5538
 epoch: 8, train_loss: 0.8769, test_loss: 0.8619, test_f1: 0.5467
 epoch: 9, train_loss: 0.8625, test_loss: 0.8585, test_f1: 0.5714
 epoch: 10, train_loss: 0.8506, test_loss: 0.8376, test_f1: 0.5590
 epoch: 11, train_loss: 0.8436, test_loss: 0.8204, test_f1: 0.5704
 epoch: 12, train_loss: 0.8211, test_loss: 0.8072, test_f1: 0.5593
 epoch: 13, train_loss: 0.8146, test_loss: 0.8036, test_f1: 0.5811
 epoch: 14, train_loss: 0.8162, test_loss: 0.7842, test_f1: 0.5976
 epoch: 15, train_loss: 0.7946, test_loss: 0.7928, test_f1: 0.6114
 epoch: 16, train_loss: 0.7846, test_loss: 0.7642, test_f1: 0.6150
 epoch: 17, train_loss: 0.7779, test_loss: 0.7808, test_f1: 0.6156
 epoch: 18, train_loss: 0.7695, test_loss: 0.7726, test_f1: 0.6002
 epoch: 19, train_loss: 0.7579, test_loss: 0.7813, test_f1: 0.6385
 epoch: 20, train_loss: 0.7602, test_loss: 0.8063, test_f1: 0.5947
 epoch: 21, train_loss: 0.7417, test_loss: 0.7628, test_f1: 0.6043
 epoch: 22, train_loss: 0.7241, test_loss: 0.7905, test_f1: 0.6145
 epoch: 23, train_loss: 0.7163, test_loss: 0.7248, test_f1: 0.6512
 epoch: 24, train_loss: 0.7157, test_loss: 0.7526, test_f1: 0.6231
 epoch: 25, train_loss: 0.6991, test_loss: 0.7519, test_f1: 0.6467
 epoch: 26, train_loss: 0.6983, test_loss: 0.7913, test_f1: 0.6267
 epoch: 27, train_loss: 0.7035, test_loss: 0.7654, test_f1: 0.6361
 epoch: 28, train_loss: 0.6825, test_loss: 0.7312, test_f1: 0.6509
 epoch: 29, train_loss: 0.6722, test_loss: 0.8364, test_f1: 0.6316
 epoch: 30, train_loss: 0.6549, test_loss: 0.7509, test_f1: 0.6289
 epoch: 31, train_loss: 0.6635, test_loss: 0.7355, test_f1: 0.6476
 epoch: 32, train_loss: 0.6583, test_loss: 0.7715, test_f1: 0.6144
 epoch: 33, train_loss: 0.6470, test_loss: 0.7702, test_f1: 0.6148
 epoch: 34, train_loss: 0.6390, test_loss: 0.7647, test_f1: 0.6319
 epoch: 35, train_loss: 0.6276, test_loss: 0.7490, test_f1: 0.6371
 epoch: 36, train_loss: 0.6307, test_loss: 0.7510, test_f1: 0.6467
 epoch: 37, train_loss: 0.6213, test_loss: 0.8114, test_f1: 0.6082
 epoch: 38, train_loss: 0.6187, test_loss: 0.7637, test_f1: 0.6345
 epoch: 39, train_loss: 0.6103, test_loss: 0.8226, test_f1: 0.6204
 epoch: 40, train_loss: 0.6037, test_loss: 0.7948, test_f1: 0.6282
 epoch: 41, train_loss: 0.5809, test_loss: 0.8922, test_f1: 0.6218
 epoch: 42, train_loss: 0.5966, test_loss: 0.8488, test_f1: 0.6186
 epoch: 43, train_loss: 0.6003, test_loss: 0.8682, test_f1: 0.6247
 epoch: 44, train_loss: 0.5798, test_loss: 0.8104, test_f1: 0.6198
 epoch: 45, train_loss: 0.5786, test_loss: 0.7884, test_f1: 0.6317
 epoch: 46, train_loss: 0.5690, test_loss: 0.7912, test_f1: 0.6297
 epoch: 47, train_loss: 0.5589, test_loss: 0.7830, test_f1: 0.6473
 epoch: 48, train_loss: 0.5617, test_loss: 0.8169, test_f1: 0.6348
 epoch: 49, train_loss: 0.5609, test_loss: 0.8407, test_f1: 0.6294
 epoch: 50, train_loss: 0.5476, test_loss: 0.8374, test_f1: 0.6406
 epoch: 51, train_loss: 0.5336, test_loss: 0.8429, test_f1: 0.6404
 epoch: 52, train_loss: 0.5277, test_loss: 0.8136, test_f1: 0.6399
 epoch: 53, train_loss: 0.5125, test_loss: 0.8253, test_f1: 0.6385
 epoch: 54, train_loss: 0.5148, test_loss: 0.8252, test_f1: 0.6365
 epoch: 55, train_loss: 0.4991, test_loss: 0.7993, test_f1: 0.6456
 epoch: 56, train_loss: 0.5146, test_loss: 0.8908, test_f1: 0.6321
 epoch: 57, train_loss: 0.5125, test_loss: 0.8821, test_f1: 0.6261
 epoch: 58, train_loss: 0.4978, test_loss: 0.8778, test_f1: 0.6362
 epoch: 59, train_loss: 0.5031, test_loss: 0.8693, test_f1: 0.6315
 epoch: 60, train_loss: 0.5043, test_loss: 0.8846, test_f1: 0.6280
 epoch: 61, train_loss: 0.4925, test_loss: 0.8583, test_f1: 0.6467
 epoch: 62, train_loss: 0.4939, test_loss: 0.8591, test_f1: 0.6427
 epoch: 63, train_loss: 0.4897, test_loss: 0.9353, test_f1: 0.6388
 epoch: 64, train_loss: 0.4847, test_loss: 0.9433, test_f1: 0.6343
 epoch: 65, train_loss: 0.4972, test_loss: 0.8757, test_f1: 0.6445
 epoch: 66, train_loss: 0.4860, test_loss: 0.8882, test_f1: 0.6434
 epoch: 67, train_loss: 0.4769, test_loss: 0.8674, test_f1: 0.6470
 epoch: 68, train_loss: 0.4704, test_loss: 0.8974, test_f1: 0.6284
 epoch: 69, train_loss: 0.4739, test_loss: 0.9136, test_f1: 0.6232
 epoch: 70, train_loss: 0.4738, test_loss: 0.8571, test_f1: 0.6499
 epoch: 71, train_loss: 0.4735, test_loss: 0.9071, test_f1: 0.6421
 epoch: 72, train_loss: 0.4534, test_loss: 0.8853, test_f1: 0.6531
 epoch: 73, train_loss: 0.4620, test_loss: 0.9556, test_f1: 0.6095
 epoch: 74, train_loss: 0.4519, test_loss: 0.9826, test_f1: 0.6311
 epoch: 75, train_loss: 0.4543, test_loss: 0.9693, test_f1: 0.6421
 epoch: 76, train_loss: 0.4585, test_loss: 0.9561, test_f1: 0.6398
 epoch: 77, train_loss: 0.4476, test_loss: 0.9935, test_f1: 0.6181
 epoch: 78, train_loss: 0.4618, test_loss: 0.9523, test_f1: 0.6334
 epoch: 79, train_loss: 0.4507, test_loss: 1.0725, test_f1: 0.6384
 epoch: 80, train_loss: 0.4443, test_loss: 0.9870, test_f1: 0.6374
 epoch: 81, train_loss: 0.4486, test_loss: 0.9631, test_f1: 0.6482
 epoch: 82, train_loss: 0.4291, test_loss: 0.9774, test_f1: 0.6426
 epoch: 83, train_loss: 0.4419, test_loss: 0.9776, test_f1: 0.6451
 epoch: 84, train_loss: 0.4449, test_loss: 1.0161, test_f1: 0.6266
 epoch: 85, train_loss: 0.4244, test_loss: 1.0455, test_f1: 0.6308
 epoch: 86, train_loss: 0.4402, test_loss: 0.9884, test_f1: 0.6473
 epoch: 87, train_loss: 0.4327, test_loss: 1.0092, test_f1: 0.6440
 epoch: 88, train_loss: 0.4319, test_loss: 1.0495, test_f1: 0.6404
 epoch: 89, train_loss: 0.4203, test_loss: 0.9757, test_f1: 0.6520
 epoch: 90, train_loss: 0.4435, test_loss: 0.9641, test_f1: 0.6572
 epoch: 91, train_loss: 0.4111, test_loss: 1.0521, test_f1: 0.6328
 epoch: 92, train_loss: 0.4444, test_loss: 1.0560, test_f1: 0.6308
 epoch: 93, train_loss: 0.4313, test_loss: 1.0504, test_f1: 0.6417
 epoch: 94, train_loss: 0.4118, test_loss: 1.0662, test_f1: 0.6201
 epoch: 95, train_loss: 0.4188, test_loss: 1.1474, test_f1: 0.6317
 epoch: 96, train_loss: 0.4177, test_loss: 1.1060, test_f1: 0.6606
 epoch: 97, train_loss: 0.4168, test_loss: 1.1453, test_f1: 0.6432
 epoch: 98, train_loss: 0.4134, test_loss: 1.0505, test_f1: 0.6362
 epoch: 99, train_loss: 0.4002, test_loss: 1.0979, test_f1: 0.6374
##################ITERATION #3 ****************************************
 epoch: 0, train_loss: 1.1149, test_loss: 1.0133, test_f1: 0.4635
 epoch: 1, train_loss: 1.0108, test_loss: 0.9695, test_f1: 0.4902
 epoch: 2, train_loss: 0.9809, test_loss: 0.9713, test_f1: 0.5268
 epoch: 3, train_loss: 0.9512, test_loss: 0.9457, test_f1: 0.5082
 epoch: 4, train_loss: 0.9417, test_loss: 0.9354, test_f1: 0.5045
 epoch: 5, train_loss: 0.9278, test_loss: 0.9352, test_f1: 0.5071
 epoch: 6, train_loss: 0.9090, test_loss: 0.9157, test_f1: 0.5400
 epoch: 7, train_loss: 0.8953, test_loss: 0.9039, test_f1: 0.5288
 epoch: 8, train_loss: 0.8772, test_loss: 0.8814, test_f1: 0.5490
 epoch: 9, train_loss: 0.8649, test_loss: 0.8760, test_f1: 0.5189
 epoch: 10, train_loss: 0.8514, test_loss: 0.8572, test_f1: 0.5884
 epoch: 11, train_loss: 0.8513, test_loss: 0.8429, test_f1: 0.5446
 epoch: 12, train_loss: 0.8376, test_loss: 0.8376, test_f1: 0.5432
 epoch: 13, train_loss: 0.8207, test_loss: 0.8140, test_f1: 0.5748
 epoch: 14, train_loss: 0.8190, test_loss: 0.8425, test_f1: 0.5830
 epoch: 15, train_loss: 0.8060, test_loss: 0.7956, test_f1: 0.5916
 epoch: 16, train_loss: 0.7929, test_loss: 0.7974, test_f1: 0.5835
 epoch: 17, train_loss: 0.8004, test_loss: 0.7842, test_f1: 0.5832
 epoch: 18, train_loss: 0.7812, test_loss: 0.8117, test_f1: 0.5830
 epoch: 19, train_loss: 0.7703, test_loss: 0.8116, test_f1: 0.5991
 epoch: 20, train_loss: 0.7644, test_loss: 0.7706, test_f1: 0.6053
 epoch: 21, train_loss: 0.7627, test_loss: 0.7677, test_f1: 0.6068
 epoch: 22, train_loss: 0.7510, test_loss: 0.7599, test_f1: 0.6017
 epoch: 23, train_loss: 0.7304, test_loss: 0.7939, test_f1: 0.6011
 epoch: 24, train_loss: 0.7280, test_loss: 0.7432, test_f1: 0.6271
 epoch: 25, train_loss: 0.7297, test_loss: 0.7545, test_f1: 0.6125
 epoch: 26, train_loss: 0.7063, test_loss: 0.7452, test_f1: 0.6349
 epoch: 27, train_loss: 0.7143, test_loss: 0.7191, test_f1: 0.6658
 epoch: 28, train_loss: 0.7103, test_loss: 0.7406, test_f1: 0.6632
 epoch: 29, train_loss: 0.6934, test_loss: 0.7288, test_f1: 0.6495
 epoch: 30, train_loss: 0.6878, test_loss: 0.7306, test_f1: 0.6711
 epoch: 31, train_loss: 0.6876, test_loss: 0.7236, test_f1: 0.6780
 epoch: 32, train_loss: 0.6751, test_loss: 0.7280, test_f1: 0.6676
 epoch: 33, train_loss: 0.6676, test_loss: 0.7442, test_f1: 0.6307
 epoch: 34, train_loss: 0.6572, test_loss: 0.7575, test_f1: 0.6344
 epoch: 35, train_loss: 0.6668, test_loss: 0.7692, test_f1: 0.6267
 epoch: 36, train_loss: 0.6508, test_loss: 0.7413, test_f1: 0.6764
 epoch: 37, train_loss: 0.6461, test_loss: 0.7399, test_f1: 0.6689
 epoch: 38, train_loss: 0.6341, test_loss: 0.7707, test_f1: 0.6307
 epoch: 39, train_loss: 0.6327, test_loss: 0.7654, test_f1: 0.6569
 epoch: 40, train_loss: 0.6181, test_loss: 0.7420, test_f1: 0.6711
 epoch: 41, train_loss: 0.6142, test_loss: 0.7256, test_f1: 0.6458
 epoch: 42, train_loss: 0.6200, test_loss: 0.7357, test_f1: 0.6875
 epoch: 43, train_loss: 0.6132, test_loss: 0.7578, test_f1: 0.6319
 epoch: 44, train_loss: 0.6165, test_loss: 0.7202, test_f1: 0.6839
 epoch: 45, train_loss: 0.5921, test_loss: 0.7323, test_f1: 0.6639
 epoch: 46, train_loss: 0.5941, test_loss: 0.7294, test_f1: 0.6804
 epoch: 47, train_loss: 0.5977, test_loss: 0.7115, test_f1: 0.6646
 epoch: 48, train_loss: 0.5838, test_loss: 0.7590, test_f1: 0.6602
 epoch: 49, train_loss: 0.5810, test_loss: 0.7680, test_f1: 0.6615
 epoch: 50, train_loss: 0.5648, test_loss: 0.7913, test_f1: 0.6698
 epoch: 51, train_loss: 0.5433, test_loss: 0.7728, test_f1: 0.6624
 epoch: 52, train_loss: 0.5363, test_loss: 0.7856, test_f1: 0.6550
 epoch: 53, train_loss: 0.5401, test_loss: 0.7781, test_f1: 0.6558
 epoch: 54, train_loss: 0.5322, test_loss: 0.7731, test_f1: 0.6562
 epoch: 55, train_loss: 0.5472, test_loss: 0.7420, test_f1: 0.6910
 epoch: 56, train_loss: 0.5338, test_loss: 0.8108, test_f1: 0.6679
 epoch: 57, train_loss: 0.5223, test_loss: 0.7712, test_f1: 0.6630
 epoch: 58, train_loss: 0.5320, test_loss: 0.7769, test_f1: 0.6781
 epoch: 59, train_loss: 0.5237, test_loss: 0.7807, test_f1: 0.6815
 epoch: 60, train_loss: 0.5131, test_loss: 0.7529, test_f1: 0.6798
 epoch: 61, train_loss: 0.5213, test_loss: 0.7970, test_f1: 0.6745
 epoch: 62, train_loss: 0.5171, test_loss: 0.8024, test_f1: 0.6468
 epoch: 63, train_loss: 0.5169, test_loss: 0.8657, test_f1: 0.6484
 epoch: 64, train_loss: 0.5085, test_loss: 0.8352, test_f1: 0.6775
 epoch: 65, train_loss: 0.5012, test_loss: 0.8159, test_f1: 0.6684
 epoch: 66, train_loss: 0.5131, test_loss: 0.8140, test_f1: 0.6846
 epoch: 67, train_loss: 0.4986, test_loss: 0.7929, test_f1: 0.6762
 epoch: 68, train_loss: 0.5071, test_loss: 0.8108, test_f1: 0.6781
 epoch: 69, train_loss: 0.5003, test_loss: 0.8239, test_f1: 0.6720
 epoch: 70, train_loss: 0.4977, test_loss: 0.8225, test_f1: 0.6832
 epoch: 71, train_loss: 0.4919, test_loss: 0.8063, test_f1: 0.6774
 epoch: 72, train_loss: 0.4854, test_loss: 0.8420, test_f1: 0.6771
 epoch: 73, train_loss: 0.4830, test_loss: 0.8270, test_f1: 0.6853
 epoch: 74, train_loss: 0.4718, test_loss: 0.8433, test_f1: 0.6826
 epoch: 75, train_loss: 0.4798, test_loss: 0.8245, test_f1: 0.6791
 epoch: 76, train_loss: 0.4692, test_loss: 0.8575, test_f1: 0.6594
 epoch: 77, train_loss: 0.4809, test_loss: 0.8544, test_f1: 0.6649
 epoch: 78, train_loss: 0.4749, test_loss: 0.8628, test_f1: 0.6926
 epoch: 79, train_loss: 0.4772, test_loss: 0.8573, test_f1: 0.6718
 epoch: 80, train_loss: 0.4604, test_loss: 0.8566, test_f1: 0.6851
 epoch: 81, train_loss: 0.4725, test_loss: 0.8805, test_f1: 0.6492
 epoch: 82, train_loss: 0.4564, test_loss: 0.8991, test_f1: 0.6715
 epoch: 83, train_loss: 0.4550, test_loss: 0.8698, test_f1: 0.6631
 epoch: 84, train_loss: 0.4491, test_loss: 0.8834, test_f1: 0.6782
 epoch: 85, train_loss: 0.4500, test_loss: 0.9102, test_f1: 0.6700
 epoch: 86, train_loss: 0.4503, test_loss: 0.8710, test_f1: 0.6776
 epoch: 87, train_loss: 0.4474, test_loss: 0.8610, test_f1: 0.6824
 epoch: 88, train_loss: 0.4440, test_loss: 0.8766, test_f1: 0.6702
 epoch: 89, train_loss: 0.4587, test_loss: 0.8414, test_f1: 0.6911
 epoch: 90, train_loss: 0.4377, test_loss: 0.8717, test_f1: 0.6754
 epoch: 91, train_loss: 0.4463, test_loss: 0.9003, test_f1: 0.6731
 epoch: 92, train_loss: 0.4371, test_loss: 0.9023, test_f1: 0.6762
 epoch: 93, train_loss: 0.4518, test_loss: 0.8827, test_f1: 0.6871
 epoch: 94, train_loss: 0.4397, test_loss: 0.8454, test_f1: 0.6690
 epoch: 95, train_loss: 0.4272, test_loss: 0.8574, test_f1: 0.7013
 epoch: 96, train_loss: 0.4306, test_loss: 0.8935, test_f1: 0.6709
 epoch: 97, train_loss: 0.4231, test_loss: 0.9044, test_f1: 0.6889
 epoch: 98, train_loss: 0.4171, test_loss: 0.9276, test_f1: 0.6648
 epoch: 99, train_loss: 0.4220, test_loss: 0.9140, test_f1: 0.6901
##################ITERATION #4 ****************************************
 epoch: 0, train_loss: 1.1340, test_loss: 0.9772, test_f1: 0.4756
 epoch: 1, train_loss: 0.9868, test_loss: 0.9719, test_f1: 0.4818
 epoch: 2, train_loss: 0.9675, test_loss: 0.9420, test_f1: 0.5067
 epoch: 3, train_loss: 0.9357, test_loss: 0.9028, test_f1: 0.4950
 epoch: 4, train_loss: 0.9278, test_loss: 0.9044, test_f1: 0.5587
 epoch: 5, train_loss: 0.9139, test_loss: 0.8817, test_f1: 0.5514
 epoch: 6, train_loss: 0.8938, test_loss: 0.8630, test_f1: 0.5484
 epoch: 7, train_loss: 0.8792, test_loss: 0.8544, test_f1: 0.5559
 epoch: 8, train_loss: 0.8614, test_loss: 0.8440, test_f1: 0.5772
 epoch: 9, train_loss: 0.8511, test_loss: 0.8230, test_f1: 0.5600
 epoch: 10, train_loss: 0.8365, test_loss: 0.8232, test_f1: 0.6069
 epoch: 11, train_loss: 0.8171, test_loss: 0.8059, test_f1: 0.5749
 epoch: 12, train_loss: 0.8177, test_loss: 0.8075, test_f1: 0.5725
 epoch: 13, train_loss: 0.7943, test_loss: 0.7902, test_f1: 0.6039
 epoch: 14, train_loss: 0.7845, test_loss: 0.8220, test_f1: 0.6149
 epoch: 15, train_loss: 0.7732, test_loss: 0.7795, test_f1: 0.6025
 epoch: 16, train_loss: 0.7741, test_loss: 0.7947, test_f1: 0.6361
 epoch: 17, train_loss: 0.7695, test_loss: 0.7978, test_f1: 0.6272
 epoch: 18, train_loss: 0.7495, test_loss: 0.8013, test_f1: 0.6316
 epoch: 19, train_loss: 0.7453, test_loss: 0.7709, test_f1: 0.6263
 epoch: 20, train_loss: 0.7416, test_loss: 0.7712, test_f1: 0.6368
 epoch: 21, train_loss: 0.7288, test_loss: 0.7860, test_f1: 0.6547
 epoch: 22, train_loss: 0.7207, test_loss: 0.7705, test_f1: 0.6537
 epoch: 23, train_loss: 0.7055, test_loss: 0.7595, test_f1: 0.6394
 epoch: 24, train_loss: 0.6944, test_loss: 0.7845, test_f1: 0.6231
 epoch: 25, train_loss: 0.6952, test_loss: 0.7412, test_f1: 0.6564
 epoch: 26, train_loss: 0.6900, test_loss: 0.7260, test_f1: 0.6612
 epoch: 27, train_loss: 0.6766, test_loss: 0.7486, test_f1: 0.6474
 epoch: 28, train_loss: 0.6634, test_loss: 0.7317, test_f1: 0.6421
 epoch: 29, train_loss: 0.6610, test_loss: 0.7238, test_f1: 0.6649
 epoch: 30, train_loss: 0.6584, test_loss: 0.8031, test_f1: 0.6324
 epoch: 31, train_loss: 0.6456, test_loss: 0.7646, test_f1: 0.6409
 epoch: 32, train_loss: 0.6652, test_loss: 0.7131, test_f1: 0.6733
 epoch: 33, train_loss: 0.6326, test_loss: 0.7498, test_f1: 0.6600
 epoch: 34, train_loss: 0.6289, test_loss: 0.7607, test_f1: 0.6556
 epoch: 35, train_loss: 0.6337, test_loss: 0.7187, test_f1: 0.6681
 epoch: 36, train_loss: 0.6169, test_loss: 0.7197, test_f1: 0.6627
 epoch: 37, train_loss: 0.6179, test_loss: 0.7494, test_f1: 0.6371
 epoch: 38, train_loss: 0.6202, test_loss: 0.7919, test_f1: 0.6448
 epoch: 39, train_loss: 0.6024, test_loss: 0.7306, test_f1: 0.6521
 epoch: 40, train_loss: 0.5967, test_loss: 0.7478, test_f1: 0.6450
 epoch: 41, train_loss: 0.5923, test_loss: 0.7507, test_f1: 0.6457
 epoch: 42, train_loss: 0.5994, test_loss: 0.7291, test_f1: 0.6834
 epoch: 43, train_loss: 0.5858, test_loss: 0.7216, test_f1: 0.6705
 epoch: 44, train_loss: 0.5621, test_loss: 0.7191, test_f1: 0.6692
 epoch: 45, train_loss: 0.5731, test_loss: 0.7863, test_f1: 0.6675
 epoch: 46, train_loss: 0.5525, test_loss: 0.7664, test_f1: 0.6789
 epoch: 47, train_loss: 0.5617, test_loss: 0.7950, test_f1: 0.6526
 epoch: 48, train_loss: 0.5672, test_loss: 0.7334, test_f1: 0.6749
 epoch: 49, train_loss: 0.5523, test_loss: 0.8546, test_f1: 0.6563
 epoch: 50, train_loss: 0.5462, test_loss: 0.7844, test_f1: 0.6560
 epoch: 51, train_loss: 0.5251, test_loss: 0.8340, test_f1: 0.6596
 epoch: 52, train_loss: 0.5138, test_loss: 0.7278, test_f1: 0.6861
 epoch: 53, train_loss: 0.5160, test_loss: 0.8273, test_f1: 0.6622
 epoch: 54, train_loss: 0.5086, test_loss: 0.8180, test_f1: 0.6720
 epoch: 55, train_loss: 0.5032, test_loss: 0.8339, test_f1: 0.6712
 epoch: 56, train_loss: 0.4992, test_loss: 0.8843, test_f1: 0.6423
 epoch: 57, train_loss: 0.5015, test_loss: 0.8065, test_f1: 0.6695
 epoch: 58, train_loss: 0.4957, test_loss: 0.8193, test_f1: 0.6609
 epoch: 59, train_loss: 0.4849, test_loss: 0.8340, test_f1: 0.6570
 epoch: 60, train_loss: 0.4986, test_loss: 0.8347, test_f1: 0.6507
 epoch: 61, train_loss: 0.4769, test_loss: 0.8479, test_f1: 0.6493
 epoch: 62, train_loss: 0.4865, test_loss: 0.8187, test_f1: 0.6554
 epoch: 63, train_loss: 0.4854, test_loss: 0.8224, test_f1: 0.6567
 epoch: 64, train_loss: 0.4844, test_loss: 0.8799, test_f1: 0.6609
 epoch: 65, train_loss: 0.4755, test_loss: 0.8743, test_f1: 0.6512
 epoch: 66, train_loss: 0.4693, test_loss: 0.8438, test_f1: 0.6518
 epoch: 67, train_loss: 0.4550, test_loss: 0.8685, test_f1: 0.6600
 epoch: 68, train_loss: 0.4565, test_loss: 0.8486, test_f1: 0.6488
 epoch: 69, train_loss: 0.4637, test_loss: 0.8941, test_f1: 0.6450
 epoch: 70, train_loss: 0.4672, test_loss: 0.8627, test_f1: 0.6582
 epoch: 71, train_loss: 0.4619, test_loss: 0.8610, test_f1: 0.6435
 epoch: 72, train_loss: 0.4616, test_loss: 0.8845, test_f1: 0.6470
 epoch: 73, train_loss: 0.4615, test_loss: 0.8544, test_f1: 0.6462
 epoch: 74, train_loss: 0.4498, test_loss: 0.8929, test_f1: 0.6553
 epoch: 75, train_loss: 0.4482, test_loss: 0.9186, test_f1: 0.6669
 epoch: 76, train_loss: 0.4427, test_loss: 0.8767, test_f1: 0.6551
 epoch: 77, train_loss: 0.4395, test_loss: 0.9216, test_f1: 0.6568
 epoch: 78, train_loss: 0.4391, test_loss: 0.9220, test_f1: 0.6616
 epoch: 79, train_loss: 0.4398, test_loss: 0.9341, test_f1: 0.6707
 epoch: 80, train_loss: 0.4415, test_loss: 0.8963, test_f1: 0.6502
 epoch: 81, train_loss: 0.4380, test_loss: 0.9213, test_f1: 0.6455
 epoch: 82, train_loss: 0.4334, test_loss: 0.9523, test_f1: 0.6376
 epoch: 83, train_loss: 0.4337, test_loss: 0.8858, test_f1: 0.6568
 epoch: 84, train_loss: 0.4395, test_loss: 0.9529, test_f1: 0.6491
 epoch: 85, train_loss: 0.4197, test_loss: 0.9176, test_f1: 0.6576
 epoch: 86, train_loss: 0.4195, test_loss: 0.9364, test_f1: 0.6527
 epoch: 87, train_loss: 0.4129, test_loss: 0.9689, test_f1: 0.6493
 epoch: 88, train_loss: 0.4138, test_loss: 0.9914, test_f1: 0.6585
 epoch: 89, train_loss: 0.4064, test_loss: 0.9524, test_f1: 0.6471
 epoch: 90, train_loss: 0.4252, test_loss: 1.0167, test_f1: 0.6535
 epoch: 91, train_loss: 0.4133, test_loss: 0.9665, test_f1: 0.6510
 epoch: 92, train_loss: 0.4053, test_loss: 1.0324, test_f1: 0.6472
 epoch: 93, train_loss: 0.4152, test_loss: 0.9776, test_f1: 0.6433
 epoch: 94, train_loss: 0.3984, test_loss: 0.9521, test_f1: 0.6507
 epoch: 95, train_loss: 0.4168, test_loss: 1.0370, test_f1: 0.6590
 epoch: 96, train_loss: 0.3911, test_loss: 1.0221, test_f1: 0.6467
 epoch: 97, train_loss: 0.3938, test_loss: 1.0550, test_f1: 0.6542
 epoch: 98, train_loss: 0.3934, test_loss: 1.0333, test_f1: 0.6519
 epoch: 99, train_loss: 0.4002, test_loss: 1.0706, test_f1: 0.6621
##################ITERATION #5 ****************************************
 epoch: 0, train_loss: 1.1418, test_loss: 0.9699, test_f1: 0.5039
 epoch: 1, train_loss: 1.0038, test_loss: 0.9315, test_f1: 0.5022
 epoch: 2, train_loss: 0.9726, test_loss: 0.8914, test_f1: 0.5268
 epoch: 3, train_loss: 0.9424, test_loss: 0.8769, test_f1: 0.5189
 epoch: 4, train_loss: 0.9218, test_loss: 0.8664, test_f1: 0.5138
 epoch: 5, train_loss: 0.9005, test_loss: 0.8626, test_f1: 0.5305
 epoch: 6, train_loss: 0.8809, test_loss: 0.8251, test_f1: 0.5447
 epoch: 7, train_loss: 0.8695, test_loss: 0.8220, test_f1: 0.5606
 epoch: 8, train_loss: 0.8618, test_loss: 0.8255, test_f1: 0.5443
 epoch: 9, train_loss: 0.8444, test_loss: 0.7969, test_f1: 0.5985
 epoch: 10, train_loss: 0.8235, test_loss: 0.8145, test_f1: 0.5849
 epoch: 11, train_loss: 0.8113, test_loss: 0.7898, test_f1: 0.5919
 epoch: 12, train_loss: 0.8003, test_loss: 0.7765, test_f1: 0.6075
 epoch: 13, train_loss: 0.7930, test_loss: 0.7682, test_f1: 0.5959
 epoch: 14, train_loss: 0.7848, test_loss: 0.7565, test_f1: 0.6152
 epoch: 15, train_loss: 0.7665, test_loss: 0.7588, test_f1: 0.6188
 epoch: 16, train_loss: 0.7590, test_loss: 0.7582, test_f1: 0.5916
 epoch: 17, train_loss: 0.7563, test_loss: 0.7797, test_f1: 0.6203
 epoch: 18, train_loss: 0.7492, test_loss: 0.7486, test_f1: 0.6065
 epoch: 19, train_loss: 0.7245, test_loss: 0.7469, test_f1: 0.6231
 epoch: 20, train_loss: 0.7265, test_loss: 0.7445, test_f1: 0.6368
 epoch: 21, train_loss: 0.7257, test_loss: 0.7513, test_f1: 0.6222
 epoch: 22, train_loss: 0.7213, test_loss: 0.7379, test_f1: 0.6177
 epoch: 23, train_loss: 0.7158, test_loss: 0.7339, test_f1: 0.6430
 epoch: 24, train_loss: 0.6917, test_loss: 0.7397, test_f1: 0.6371
 epoch: 25, train_loss: 0.6809, test_loss: 0.7355, test_f1: 0.6195
 epoch: 26, train_loss: 0.6792, test_loss: 0.7649, test_f1: 0.6336
 epoch: 27, train_loss: 0.6746, test_loss: 0.7527, test_f1: 0.6137
 epoch: 28, train_loss: 0.6583, test_loss: 0.7570, test_f1: 0.6628
 epoch: 29, train_loss: 0.6546, test_loss: 0.7317, test_f1: 0.6552
 epoch: 30, train_loss: 0.6467, test_loss: 0.7283, test_f1: 0.6862
 epoch: 31, train_loss: 0.6622, test_loss: 0.7995, test_f1: 0.6189
 epoch: 32, train_loss: 0.6447, test_loss: 0.7482, test_f1: 0.6419
 epoch: 33, train_loss: 0.6377, test_loss: 0.7273, test_f1: 0.6589
 epoch: 34, train_loss: 0.6272, test_loss: 0.7297, test_f1: 0.6677
 epoch: 35, train_loss: 0.6112, test_loss: 0.7734, test_f1: 0.6565
 epoch: 36, train_loss: 0.6092, test_loss: 0.7778, test_f1: 0.6284
 epoch: 37, train_loss: 0.6131, test_loss: 0.7536, test_f1: 0.6496
 epoch: 38, train_loss: 0.6138, test_loss: 0.7594, test_f1: 0.6607
 epoch: 39, train_loss: 0.5968, test_loss: 0.7316, test_f1: 0.6567
 epoch: 40, train_loss: 0.6092, test_loss: 0.7509, test_f1: 0.6422
 epoch: 41, train_loss: 0.5908, test_loss: 0.7307, test_f1: 0.6586
 epoch: 42, train_loss: 0.5829, test_loss: 0.7968, test_f1: 0.6580
 epoch: 43, train_loss: 0.5853, test_loss: 0.7283, test_f1: 0.6525
 epoch: 44, train_loss: 0.5669, test_loss: 0.8123, test_f1: 0.6493
 epoch: 45, train_loss: 0.5665, test_loss: 0.7467, test_f1: 0.6780
 epoch: 46, train_loss: 0.5670, test_loss: 0.7655, test_f1: 0.6557
 epoch: 47, train_loss: 0.5685, test_loss: 0.7439, test_f1: 0.6560
 epoch: 48, train_loss: 0.5609, test_loss: 0.7637, test_f1: 0.6673
 epoch: 49, train_loss: 0.5451, test_loss: 0.7620, test_f1: 0.6691
 epoch: 50, train_loss: 0.5428, test_loss: 0.8106, test_f1: 0.6530
 epoch: 51, train_loss: 0.5194, test_loss: 0.7703, test_f1: 0.6653
 epoch: 52, train_loss: 0.5339, test_loss: 0.7933, test_f1: 0.6639
 epoch: 53, train_loss: 0.5166, test_loss: 0.7894, test_f1: 0.6575
 epoch: 54, train_loss: 0.5041, test_loss: 0.8138, test_f1: 0.6415
 epoch: 55, train_loss: 0.5074, test_loss: 0.7975, test_f1: 0.6533
 epoch: 56, train_loss: 0.5039, test_loss: 0.8486, test_f1: 0.6451
 epoch: 57, train_loss: 0.5051, test_loss: 0.8152, test_f1: 0.6509
 epoch: 58, train_loss: 0.4963, test_loss: 0.8385, test_f1: 0.6386
 epoch: 59, train_loss: 0.5025, test_loss: 0.7894, test_f1: 0.6540
 epoch: 60, train_loss: 0.4987, test_loss: 0.7830, test_f1: 0.6548
 epoch: 61, train_loss: 0.4910, test_loss: 0.8290, test_f1: 0.6528
 epoch: 62, train_loss: 0.4908, test_loss: 0.8087, test_f1: 0.6448
 epoch: 63, train_loss: 0.4777, test_loss: 0.7999, test_f1: 0.6637
 epoch: 64, train_loss: 0.4833, test_loss: 0.8908, test_f1: 0.6410
 epoch: 65, train_loss: 0.4850, test_loss: 0.8519, test_f1: 0.6597
 epoch: 66, train_loss: 0.4753, test_loss: 0.8478, test_f1: 0.6505
 epoch: 67, train_loss: 0.4761, test_loss: 0.8808, test_f1: 0.6427
 epoch: 68, train_loss: 0.4925, test_loss: 0.8178, test_f1: 0.6554
 epoch: 69, train_loss: 0.4578, test_loss: 0.8580, test_f1: 0.6464
 epoch: 70, train_loss: 0.4614, test_loss: 0.8453, test_f1: 0.6460
 epoch: 71, train_loss: 0.4795, test_loss: 0.8542, test_f1: 0.6641
 epoch: 72, train_loss: 0.4642, test_loss: 0.8795, test_f1: 0.6545
 epoch: 73, train_loss: 0.4587, test_loss: 0.8723, test_f1: 0.6595
 epoch: 74, train_loss: 0.4480, test_loss: 0.9093, test_f1: 0.6449
 epoch: 75, train_loss: 0.4565, test_loss: 0.9074, test_f1: 0.6561
 epoch: 76, train_loss: 0.4563, test_loss: 0.8942, test_f1: 0.6522
 epoch: 77, train_loss: 0.4626, test_loss: 0.8973, test_f1: 0.6595
 epoch: 78, train_loss: 0.4503, test_loss: 0.9119, test_f1: 0.6693
 epoch: 79, train_loss: 0.4452, test_loss: 0.9266, test_f1: 0.6549
 epoch: 80, train_loss: 0.4419, test_loss: 0.8886, test_f1: 0.6626
 epoch: 81, train_loss: 0.4358, test_loss: 0.9186, test_f1: 0.6448
 epoch: 82, train_loss: 0.4437, test_loss: 0.9794, test_f1: 0.6683
 epoch: 83, train_loss: 0.4403, test_loss: 0.9264, test_f1: 0.6523
 epoch: 84, train_loss: 0.4347, test_loss: 0.9449, test_f1: 0.6619
 epoch: 85, train_loss: 0.4358, test_loss: 0.9159, test_f1: 0.6538
 epoch: 86, train_loss: 0.4222, test_loss: 0.9507, test_f1: 0.6560
 epoch: 87, train_loss: 0.4315, test_loss: 0.9058, test_f1: 0.6726
 epoch: 88, train_loss: 0.4196, test_loss: 0.9560, test_f1: 0.6519
 epoch: 89, train_loss: 0.4120, test_loss: 0.9289, test_f1: 0.6556
 epoch: 90, train_loss: 0.4209, test_loss: 1.0037, test_f1: 0.6442
 epoch: 91, train_loss: 0.4136, test_loss: 1.0121, test_f1: 0.6607
 epoch: 92, train_loss: 0.4198, test_loss: 0.9413, test_f1: 0.6649
 epoch: 93, train_loss: 0.4135, test_loss: 0.9992, test_f1: 0.6579
 epoch: 94, train_loss: 0.4076, test_loss: 0.9873, test_f1: 0.6486
 epoch: 95, train_loss: 0.4004, test_loss: 0.9950, test_f1: 0.6418
 epoch: 96, train_loss: 0.3968, test_loss: 1.0403, test_f1: 0.6558
 epoch: 97, train_loss: 0.4042, test_loss: 1.0413, test_f1: 0.6598
 epoch: 98, train_loss: 0.4062, test_loss: 0.9457, test_f1: 0.6606
 epoch: 99, train_loss: 0.4066, test_loss: 0.9971, test_f1: 0.6543
##################ITERATION #6 ****************************************
 epoch: 0, train_loss: 1.1922, test_loss: 0.9776, test_f1: 0.4957
 epoch: 1, train_loss: 1.0186, test_loss: 0.9294, test_f1: 0.5270
 epoch: 2, train_loss: 0.9887, test_loss: 0.9222, test_f1: 0.5067
 epoch: 3, train_loss: 0.9425, test_loss: 0.8931, test_f1: 0.5399
 epoch: 4, train_loss: 0.9261, test_loss: 0.8896, test_f1: 0.5455
 epoch: 5, train_loss: 0.9142, test_loss: 0.8579, test_f1: 0.5599
 epoch: 6, train_loss: 0.8966, test_loss: 0.8569, test_f1: 0.5681
 epoch: 7, train_loss: 0.8880, test_loss: 0.8351, test_f1: 0.5630
 epoch: 8, train_loss: 0.8814, test_loss: 0.8494, test_f1: 0.5718
 epoch: 9, train_loss: 0.8463, test_loss: 0.8379, test_f1: 0.5947
 epoch: 10, train_loss: 0.8468, test_loss: 0.8081, test_f1: 0.5907
 epoch: 11, train_loss: 0.8222, test_loss: 0.7846, test_f1: 0.5935
 epoch: 12, train_loss: 0.8067, test_loss: 0.7986, test_f1: 0.6244
 epoch: 13, train_loss: 0.8089, test_loss: 0.8023, test_f1: 0.5948
 epoch: 14, train_loss: 0.7906, test_loss: 0.8010, test_f1: 0.6195
 epoch: 15, train_loss: 0.7957, test_loss: 0.7774, test_f1: 0.6297
 epoch: 16, train_loss: 0.7792, test_loss: 0.7512, test_f1: 0.6423
 epoch: 17, train_loss: 0.7685, test_loss: 0.7498, test_f1: 0.6514
 epoch: 18, train_loss: 0.7535, test_loss: 0.7464, test_f1: 0.6399
 epoch: 19, train_loss: 0.7417, test_loss: 0.7326, test_f1: 0.6313
 epoch: 20, train_loss: 0.7319, test_loss: 0.7491, test_f1: 0.6584
 epoch: 21, train_loss: 0.7369, test_loss: 0.7492, test_f1: 0.6429
 epoch: 22, train_loss: 0.7178, test_loss: 0.7273, test_f1: 0.6552
 epoch: 23, train_loss: 0.7302, test_loss: 0.7269, test_f1: 0.6569
 epoch: 24, train_loss: 0.7057, test_loss: 0.7154, test_f1: 0.6581
 epoch: 25, train_loss: 0.7025, test_loss: 0.7122, test_f1: 0.6599
 epoch: 26, train_loss: 0.6845, test_loss: 0.7241, test_f1: 0.6631
 epoch: 27, train_loss: 0.6884, test_loss: 0.7218, test_f1: 0.6535
 epoch: 28, train_loss: 0.6686, test_loss: 0.7097, test_f1: 0.6604
 epoch: 29, train_loss: 0.6733, test_loss: 0.7286, test_f1: 0.6489
 epoch: 30, train_loss: 0.6617, test_loss: 0.7486, test_f1: 0.6510
 epoch: 31, train_loss: 0.6735, test_loss: 0.7214, test_f1: 0.6671
 epoch: 32, train_loss: 0.6642, test_loss: 0.7028, test_f1: 0.6590
 epoch: 33, train_loss: 0.6504, test_loss: 0.7264, test_f1: 0.6767
 epoch: 34, train_loss: 0.6471, test_loss: 0.7300, test_f1: 0.6546
 epoch: 35, train_loss: 0.6470, test_loss: 0.7391, test_f1: 0.6543
 epoch: 36, train_loss: 0.6206, test_loss: 0.7094, test_f1: 0.7071
 epoch: 37, train_loss: 0.6148, test_loss: 0.7222, test_f1: 0.6454
 epoch: 38, train_loss: 0.6104, test_loss: 0.7113, test_f1: 0.6645
 epoch: 39, train_loss: 0.6153, test_loss: 0.7314, test_f1: 0.6568
 epoch: 40, train_loss: 0.5973, test_loss: 0.7511, test_f1: 0.6390
 epoch: 41, train_loss: 0.6044, test_loss: 0.7401, test_f1: 0.6672
 epoch: 42, train_loss: 0.6001, test_loss: 0.7252, test_f1: 0.6628
 epoch: 43, train_loss: 0.5805, test_loss: 0.7504, test_f1: 0.6626
 epoch: 44, train_loss: 0.5823, test_loss: 0.7258, test_f1: 0.6817
 epoch: 45, train_loss: 0.5855, test_loss: 0.7215, test_f1: 0.6741
 epoch: 46, train_loss: 0.5743, test_loss: 0.7434, test_f1: 0.6601
 epoch: 47, train_loss: 0.5544, test_loss: 0.7719, test_f1: 0.6538
 epoch: 48, train_loss: 0.5586, test_loss: 0.7868, test_f1: 0.6728
 epoch: 49, train_loss: 0.5482, test_loss: 0.7861, test_f1: 0.6551
 epoch: 50, train_loss: 0.5548, test_loss: 0.8000, test_f1: 0.6407
 epoch: 51, train_loss: 0.5335, test_loss: 0.7825, test_f1: 0.6650
 epoch: 52, train_loss: 0.5154, test_loss: 0.7723, test_f1: 0.6689
 epoch: 53, train_loss: 0.5153, test_loss: 0.8143, test_f1: 0.6660
 epoch: 54, train_loss: 0.5183, test_loss: 0.7584, test_f1: 0.6793
 epoch: 55, train_loss: 0.5097, test_loss: 0.7783, test_f1: 0.6709
 epoch: 56, train_loss: 0.5106, test_loss: 0.7759, test_f1: 0.6688
 epoch: 57, train_loss: 0.5137, test_loss: 0.7962, test_f1: 0.6620
 epoch: 58, train_loss: 0.4964, test_loss: 0.7951, test_f1: 0.6665
 epoch: 59, train_loss: 0.4871, test_loss: 0.8114, test_f1: 0.6630
 epoch: 60, train_loss: 0.5007, test_loss: 0.8083, test_f1: 0.6638
 epoch: 61, train_loss: 0.4839, test_loss: 0.8186, test_f1: 0.6643
 epoch: 62, train_loss: 0.4958, test_loss: 0.8363, test_f1: 0.6710
 epoch: 63, train_loss: 0.5006, test_loss: 0.8165, test_f1: 0.6635
 epoch: 64, train_loss: 0.4939, test_loss: 0.8283, test_f1: 0.6734
 epoch: 65, train_loss: 0.4807, test_loss: 0.8492, test_f1: 0.6800
 epoch: 66, train_loss: 0.4815, test_loss: 0.8368, test_f1: 0.6880
 epoch: 67, train_loss: 0.4787, test_loss: 0.8331, test_f1: 0.6933
 epoch: 68, train_loss: 0.4638, test_loss: 0.8385, test_f1: 0.6642
 epoch: 69, train_loss: 0.4678, test_loss: 0.8400, test_f1: 0.6735
 epoch: 70, train_loss: 0.4834, test_loss: 0.8814, test_f1: 0.6707
 epoch: 71, train_loss: 0.4705, test_loss: 0.8812, test_f1: 0.6675
 epoch: 72, train_loss: 0.4694, test_loss: 0.9342, test_f1: 0.6640
 epoch: 73, train_loss: 0.4608, test_loss: 0.8391, test_f1: 0.6751
 epoch: 74, train_loss: 0.4574, test_loss: 0.8622, test_f1: 0.6634
 epoch: 75, train_loss: 0.4696, test_loss: 0.8784, test_f1: 0.6657
 epoch: 76, train_loss: 0.4547, test_loss: 0.9084, test_f1: 0.6757
 epoch: 77, train_loss: 0.4432, test_loss: 0.8716, test_f1: 0.6656
 epoch: 78, train_loss: 0.4472, test_loss: 0.9159, test_f1: 0.6631
 epoch: 79, train_loss: 0.4456, test_loss: 0.9265, test_f1: 0.6539
 epoch: 80, train_loss: 0.4333, test_loss: 0.9117, test_f1: 0.6736
 epoch: 81, train_loss: 0.4431, test_loss: 0.9246, test_f1: 0.6517
 epoch: 82, train_loss: 0.4481, test_loss: 0.9499, test_f1: 0.6557
 epoch: 83, train_loss: 0.4423, test_loss: 0.9196, test_f1: 0.6559
 epoch: 84, train_loss: 0.4375, test_loss: 1.0230, test_f1: 0.6538
 epoch: 85, train_loss: 0.4472, test_loss: 0.9782, test_f1: 0.6704
 epoch: 86, train_loss: 0.4268, test_loss: 0.9622, test_f1: 0.6488
 epoch: 87, train_loss: 0.4225, test_loss: 0.9983, test_f1: 0.6475
 epoch: 88, train_loss: 0.4267, test_loss: 1.0201, test_f1: 0.6487
 epoch: 89, train_loss: 0.4166, test_loss: 0.9910, test_f1: 0.6537
 epoch: 90, train_loss: 0.4163, test_loss: 0.9661, test_f1: 0.6576
 epoch: 91, train_loss: 0.4093, test_loss: 1.0917, test_f1: 0.6475
 epoch: 92, train_loss: 0.4189, test_loss: 1.0213, test_f1: 0.6465
 epoch: 93, train_loss: 0.4065, test_loss: 1.0362, test_f1: 0.6426
 epoch: 94, train_loss: 0.4111, test_loss: 1.0670, test_f1: 0.6557
 epoch: 95, train_loss: 0.4044, test_loss: 1.0729, test_f1: 0.6496
 epoch: 96, train_loss: 0.4192, test_loss: 1.0683, test_f1: 0.6592
 epoch: 97, train_loss: 0.3975, test_loss: 1.1255, test_f1: 0.6395
 epoch: 98, train_loss: 0.3999, test_loss: 1.0514, test_f1: 0.6651
 epoch: 99, train_loss: 0.4189, test_loss: 1.1172, test_f1: 0.6509
##################ITERATION #7 ****************************************
 epoch: 0, train_loss: 1.2090, test_loss: 0.9482, test_f1: 0.5151
 epoch: 1, train_loss: 1.0244, test_loss: 0.9374, test_f1: 0.5052
 epoch: 2, train_loss: 0.9871, test_loss: 0.9471, test_f1: 0.5189
 epoch: 3, train_loss: 0.9578, test_loss: 0.9193, test_f1: 0.5364
 epoch: 4, train_loss: 0.9319, test_loss: 0.8967, test_f1: 0.5493
 epoch: 5, train_loss: 0.9197, test_loss: 0.8693, test_f1: 0.5579
 epoch: 6, train_loss: 0.9048, test_loss: 0.8606, test_f1: 0.5583
 epoch: 7, train_loss: 0.8905, test_loss: 0.8541, test_f1: 0.5765
 epoch: 8, train_loss: 0.8702, test_loss: 0.8843, test_f1: 0.5958
 epoch: 9, train_loss: 0.8697, test_loss: 0.8737, test_f1: 0.5653
 epoch: 10, train_loss: 0.8447, test_loss: 0.8651, test_f1: 0.6176
 epoch: 11, train_loss: 0.8374, test_loss: 0.8602, test_f1: 0.5946
 epoch: 12, train_loss: 0.8209, test_loss: 0.8327, test_f1: 0.6156
 epoch: 13, train_loss: 0.8023, test_loss: 0.8124, test_f1: 0.5959
 epoch: 14, train_loss: 0.7998, test_loss: 0.8272, test_f1: 0.6090
 epoch: 15, train_loss: 0.7945, test_loss: 0.8664, test_f1: 0.5742
 epoch: 16, train_loss: 0.7813, test_loss: 0.8347, test_f1: 0.5927
 epoch: 17, train_loss: 0.7694, test_loss: 0.8177, test_f1: 0.6147
 epoch: 18, train_loss: 0.7685, test_loss: 0.7959, test_f1: 0.6377
 epoch: 19, train_loss: 0.7459, test_loss: 0.8108, test_f1: 0.6202
 epoch: 20, train_loss: 0.7379, test_loss: 0.8347, test_f1: 0.6389
 epoch: 21, train_loss: 0.7263, test_loss: 0.7903, test_f1: 0.6364
 epoch: 22, train_loss: 0.7412, test_loss: 0.7858, test_f1: 0.6428
 epoch: 23, train_loss: 0.7257, test_loss: 0.8007, test_f1: 0.6408
 epoch: 24, train_loss: 0.6973, test_loss: 0.7923, test_f1: 0.6503
 epoch: 25, train_loss: 0.7000, test_loss: 0.7587, test_f1: 0.6423
 epoch: 26, train_loss: 0.6967, test_loss: 0.7902, test_f1: 0.6475
 epoch: 27, train_loss: 0.6926, test_loss: 0.7466, test_f1: 0.6544
 epoch: 28, train_loss: 0.6833, test_loss: 0.7682, test_f1: 0.6388
 epoch: 29, train_loss: 0.6684, test_loss: 0.8071, test_f1: 0.6450
 epoch: 30, train_loss: 0.6769, test_loss: 0.7661, test_f1: 0.6332
 epoch: 31, train_loss: 0.6590, test_loss: 0.7444, test_f1: 0.6552
 epoch: 32, train_loss: 0.6425, test_loss: 0.7658, test_f1: 0.6508
 epoch: 33, train_loss: 0.6536, test_loss: 0.7766, test_f1: 0.6298
 epoch: 34, train_loss: 0.6389, test_loss: 0.7799, test_f1: 0.6423
 epoch: 35, train_loss: 0.6307, test_loss: 0.7525, test_f1: 0.6523
 epoch: 36, train_loss: 0.6353, test_loss: 0.8181, test_f1: 0.6257
 epoch: 37, train_loss: 0.6116, test_loss: 0.8027, test_f1: 0.6426
 epoch: 38, train_loss: 0.6193, test_loss: 0.8095, test_f1: 0.6438
 epoch: 39, train_loss: 0.6163, test_loss: 0.7978, test_f1: 0.6504
 epoch: 40, train_loss: 0.6068, test_loss: 0.8144, test_f1: 0.6470
 epoch: 41, train_loss: 0.6147, test_loss: 0.7982, test_f1: 0.6196
 epoch: 42, train_loss: 0.6063, test_loss: 0.8638, test_f1: 0.6174
 epoch: 43, train_loss: 0.5974, test_loss: 0.7518, test_f1: 0.6355
 epoch: 44, train_loss: 0.6071, test_loss: 0.8008, test_f1: 0.6529
 epoch: 45, train_loss: 0.6129, test_loss: 0.8413, test_f1: 0.6386
 epoch: 46, train_loss: 0.5847, test_loss: 0.8019, test_f1: 0.6401
 epoch: 47, train_loss: 0.5807, test_loss: 0.8415, test_f1: 0.6475
 epoch: 48, train_loss: 0.5826, test_loss: 0.8197, test_f1: 0.6484
 epoch: 49, train_loss: 0.5647, test_loss: 0.8557, test_f1: 0.6583
 epoch: 50, train_loss: 0.5631, test_loss: 0.8527, test_f1: 0.6179
 epoch: 51, train_loss: 0.5487, test_loss: 0.8090, test_f1: 0.6633
 epoch: 52, train_loss: 0.5387, test_loss: 0.8069, test_f1: 0.6716
 epoch: 53, train_loss: 0.5272, test_loss: 0.7815, test_f1: 0.6502
 epoch: 54, train_loss: 0.5174, test_loss: 0.8161, test_f1: 0.6572
 epoch: 55, train_loss: 0.5298, test_loss: 0.8235, test_f1: 0.6637
 epoch: 56, train_loss: 0.5181, test_loss: 0.8530, test_f1: 0.6462
 epoch: 57, train_loss: 0.5172, test_loss: 0.8447, test_f1: 0.6532
 epoch: 58, train_loss: 0.5032, test_loss: 0.8318, test_f1: 0.6421
 epoch: 59, train_loss: 0.5075, test_loss: 0.8178, test_f1: 0.6320
 epoch: 60, train_loss: 0.5000, test_loss: 0.8071, test_f1: 0.6354
 epoch: 61, train_loss: 0.5183, test_loss: 0.8542, test_f1: 0.6786
 epoch: 62, train_loss: 0.5005, test_loss: 0.8494, test_f1: 0.6518
 epoch: 63, train_loss: 0.5043, test_loss: 0.8379, test_f1: 0.6754
 epoch: 64, train_loss: 0.4879, test_loss: 0.8811, test_f1: 0.6519
 epoch: 65, train_loss: 0.4979, test_loss: 0.8648, test_f1: 0.6626
 epoch: 66, train_loss: 0.4922, test_loss: 0.8916, test_f1: 0.6550
 epoch: 67, train_loss: 0.4980, test_loss: 0.8794, test_f1: 0.6585
 epoch: 68, train_loss: 0.4947, test_loss: 0.8911, test_f1: 0.6355
 epoch: 69, train_loss: 0.4887, test_loss: 0.8879, test_f1: 0.6554
 epoch: 70, train_loss: 0.4838, test_loss: 0.8806, test_f1: 0.6565
 epoch: 71, train_loss: 0.4858, test_loss: 0.8886, test_f1: 0.6456
 epoch: 72, train_loss: 0.4810, test_loss: 0.8939, test_f1: 0.6445
 epoch: 73, train_loss: 0.4836, test_loss: 0.8534, test_f1: 0.6498
 epoch: 74, train_loss: 0.4657, test_loss: 0.9011, test_f1: 0.6482
 epoch: 75, train_loss: 0.4830, test_loss: 0.8779, test_f1: 0.6562
 epoch: 76, train_loss: 0.4578, test_loss: 0.9274, test_f1: 0.6510
 epoch: 77, train_loss: 0.4653, test_loss: 0.8966, test_f1: 0.6522
 epoch: 78, train_loss: 0.4611, test_loss: 0.8917, test_f1: 0.6482
 epoch: 79, train_loss: 0.4569, test_loss: 0.9220, test_f1: 0.6504
 epoch: 80, train_loss: 0.4525, test_loss: 0.8901, test_f1: 0.6638
 epoch: 81, train_loss: 0.4645, test_loss: 0.8670, test_f1: 0.6462
 epoch: 82, train_loss: 0.4573, test_loss: 0.9242, test_f1: 0.6623
 epoch: 83, train_loss: 0.4642, test_loss: 0.9434, test_f1: 0.6516
 epoch: 84, train_loss: 0.4575, test_loss: 0.9196, test_f1: 0.6406
 epoch: 85, train_loss: 0.4540, test_loss: 0.9357, test_f1: 0.6507
 epoch: 86, train_loss: 0.4573, test_loss: 0.9776, test_f1: 0.6579
 epoch: 87, train_loss: 0.4537, test_loss: 0.9169, test_f1: 0.6474
 epoch: 88, train_loss: 0.4449, test_loss: 0.9137, test_f1: 0.6434
 epoch: 89, train_loss: 0.4386, test_loss: 0.9240, test_f1: 0.6529
 epoch: 90, train_loss: 0.4277, test_loss: 0.9885, test_f1: 0.6582
 epoch: 91, train_loss: 0.4339, test_loss: 0.9035, test_f1: 0.6625
 epoch: 92, train_loss: 0.4168, test_loss: 1.0076, test_f1: 0.6598
 epoch: 93, train_loss: 0.4203, test_loss: 0.9517, test_f1: 0.6537
 epoch: 94, train_loss: 0.4245, test_loss: 1.0291, test_f1: 0.6472
 epoch: 95, train_loss: 0.4231, test_loss: 1.0044, test_f1: 0.6487
 epoch: 96, train_loss: 0.4183, test_loss: 0.9658, test_f1: 0.6590
 epoch: 97, train_loss: 0.4264, test_loss: 1.0053, test_f1: 0.6506
 epoch: 98, train_loss: 0.4096, test_loss: 0.9377, test_f1: 0.6508
 epoch: 99, train_loss: 0.4079, test_loss: 1.0149, test_f1: 0.6521
##################ITERATION #8 ****************************************
 epoch: 0, train_loss: 1.2086, test_loss: 1.0032, test_f1: 0.5331
 epoch: 1, train_loss: 1.0478, test_loss: 0.9386, test_f1: 0.5262
 epoch: 2, train_loss: 0.9977, test_loss: 0.9266, test_f1: 0.5301
 epoch: 3, train_loss: 0.9779, test_loss: 0.9506, test_f1: 0.5487
 epoch: 4, train_loss: 0.9453, test_loss: 0.8832, test_f1: 0.5436
 epoch: 5, train_loss: 0.9044, test_loss: 0.8608, test_f1: 0.5400
 epoch: 6, train_loss: 0.8854, test_loss: 0.8361, test_f1: 0.5639
 epoch: 7, train_loss: 0.8915, test_loss: 0.8191, test_f1: 0.5648
 epoch: 8, train_loss: 0.8676, test_loss: 0.8280, test_f1: 0.5902
 epoch: 9, train_loss: 0.8507, test_loss: 0.8113, test_f1: 0.5722
 epoch: 10, train_loss: 0.8423, test_loss: 0.8219, test_f1: 0.5806
 epoch: 11, train_loss: 0.8365, test_loss: 0.7935, test_f1: 0.5957
 epoch: 12, train_loss: 0.8143, test_loss: 0.7824, test_f1: 0.5928
 epoch: 13, train_loss: 0.8058, test_loss: 0.7854, test_f1: 0.5909
 epoch: 14, train_loss: 0.7922, test_loss: 0.7750, test_f1: 0.5744
 epoch: 15, train_loss: 0.7665, test_loss: 0.7774, test_f1: 0.5989
 epoch: 16, train_loss: 0.7933, test_loss: 0.7553, test_f1: 0.6117
 epoch: 17, train_loss: 0.7529, test_loss: 0.7664, test_f1: 0.6237
 epoch: 18, train_loss: 0.7513, test_loss: 0.7534, test_f1: 0.6125
 epoch: 19, train_loss: 0.7398, test_loss: 0.7403, test_f1: 0.6453
 epoch: 20, train_loss: 0.7374, test_loss: 0.7777, test_f1: 0.5922
 epoch: 21, train_loss: 0.7194, test_loss: 0.7750, test_f1: 0.6064
 epoch: 22, train_loss: 0.7248, test_loss: 0.7718, test_f1: 0.6283
 epoch: 23, train_loss: 0.7106, test_loss: 0.7356, test_f1: 0.6285
 epoch: 24, train_loss: 0.7148, test_loss: 0.7290, test_f1: 0.6356
 epoch: 25, train_loss: 0.6898, test_loss: 0.7186, test_f1: 0.6760
 epoch: 26, train_loss: 0.6959, test_loss: 0.7472, test_f1: 0.6556
 epoch: 27, train_loss: 0.6847, test_loss: 0.7454, test_f1: 0.6561
 epoch: 28, train_loss: 0.6657, test_loss: 0.7126, test_f1: 0.6922
 epoch: 29, train_loss: 0.6593, test_loss: 0.7242, test_f1: 0.6679
 epoch: 30, train_loss: 0.6652, test_loss: 0.7133, test_f1: 0.6966
 epoch: 31, train_loss: 0.6638, test_loss: 0.7213, test_f1: 0.6554
 epoch: 32, train_loss: 0.6490, test_loss: 0.7252, test_f1: 0.6633
 epoch: 33, train_loss: 0.6486, test_loss: 0.7285, test_f1: 0.6908
 epoch: 34, train_loss: 0.6408, test_loss: 0.7394, test_f1: 0.6573
 epoch: 35, train_loss: 0.6414, test_loss: 0.7093, test_f1: 0.6943
 epoch: 36, train_loss: 0.6269, test_loss: 0.6904, test_f1: 0.6890
 epoch: 37, train_loss: 0.6280, test_loss: 0.7275, test_f1: 0.6645
 epoch: 38, train_loss: 0.6225, test_loss: 0.7301, test_f1: 0.6616
 epoch: 39, train_loss: 0.6109, test_loss: 0.7470, test_f1: 0.6558
 epoch: 40, train_loss: 0.6070, test_loss: 0.7466, test_f1: 0.6397
 epoch: 41, train_loss: 0.5885, test_loss: 0.7375, test_f1: 0.6562
 epoch: 42, train_loss: 0.5934, test_loss: 0.7297, test_f1: 0.6557
 epoch: 43, train_loss: 0.5964, test_loss: 0.7615, test_f1: 0.6541
 epoch: 44, train_loss: 0.5779, test_loss: 0.7458, test_f1: 0.6585
 epoch: 45, train_loss: 0.5802, test_loss: 0.7468, test_f1: 0.6421
 epoch: 46, train_loss: 0.5842, test_loss: 0.7849, test_f1: 0.6585
 epoch: 47, train_loss: 0.5733, test_loss: 0.7476, test_f1: 0.6551
 epoch: 48, train_loss: 0.5639, test_loss: 0.7752, test_f1: 0.6449
 epoch: 49, train_loss: 0.5590, test_loss: 0.7569, test_f1: 0.6694
 epoch: 50, train_loss: 0.5669, test_loss: 0.7852, test_f1: 0.6412
 epoch: 51, train_loss: 0.5397, test_loss: 0.7996, test_f1: 0.6504
 epoch: 52, train_loss: 0.5325, test_loss: 0.7852, test_f1: 0.6675
 epoch: 53, train_loss: 0.5216, test_loss: 0.7691, test_f1: 0.6464
 epoch: 54, train_loss: 0.5133, test_loss: 0.7733, test_f1: 0.6577
 epoch: 55, train_loss: 0.5262, test_loss: 0.7834, test_f1: 0.6585
 epoch: 56, train_loss: 0.5178, test_loss: 0.7525, test_f1: 0.6494
 epoch: 57, train_loss: 0.5127, test_loss: 0.7880, test_f1: 0.6421
 epoch: 58, train_loss: 0.5166, test_loss: 0.7733, test_f1: 0.6660
 epoch: 59, train_loss: 0.5117, test_loss: 0.7641, test_f1: 0.6792
 epoch: 60, train_loss: 0.4920, test_loss: 0.7733, test_f1: 0.6648
 epoch: 61, train_loss: 0.4957, test_loss: 0.7810, test_f1: 0.6639
 epoch: 62, train_loss: 0.5096, test_loss: 0.7851, test_f1: 0.6515
 epoch: 63, train_loss: 0.4847, test_loss: 0.7952, test_f1: 0.6680
 epoch: 64, train_loss: 0.4959, test_loss: 0.8422, test_f1: 0.6488
 epoch: 65, train_loss: 0.4835, test_loss: 0.7659, test_f1: 0.6516
 epoch: 66, train_loss: 0.4837, test_loss: 0.8473, test_f1: 0.6720
 epoch: 67, train_loss: 0.4699, test_loss: 0.8204, test_f1: 0.6500
 epoch: 68, train_loss: 0.4627, test_loss: 0.8423, test_f1: 0.6584
 epoch: 69, train_loss: 0.4758, test_loss: 0.8546, test_f1: 0.6612
 epoch: 70, train_loss: 0.4772, test_loss: 0.9031, test_f1: 0.6396
 epoch: 71, train_loss: 0.4739, test_loss: 0.9034, test_f1: 0.6502
 epoch: 72, train_loss: 0.4589, test_loss: 0.9130, test_f1: 0.6464
 epoch: 73, train_loss: 0.4572, test_loss: 0.9136, test_f1: 0.6489
 epoch: 74, train_loss: 0.4761, test_loss: 0.8927, test_f1: 0.6536
 epoch: 75, train_loss: 0.4655, test_loss: 0.8629, test_f1: 0.6609
 epoch: 76, train_loss: 0.4696, test_loss: 0.9177, test_f1: 0.6602
 epoch: 77, train_loss: 0.4398, test_loss: 0.8847, test_f1: 0.6490
 epoch: 78, train_loss: 0.4580, test_loss: 0.9047, test_f1: 0.6515
 epoch: 79, train_loss: 0.4435, test_loss: 0.9214, test_f1: 0.6528
 epoch: 80, train_loss: 0.4488, test_loss: 0.9160, test_f1: 0.6481
 epoch: 81, train_loss: 0.4523, test_loss: 0.8589, test_f1: 0.6553
 epoch: 82, train_loss: 0.4355, test_loss: 0.9802, test_f1: 0.6619
 epoch: 83, train_loss: 0.4400, test_loss: 0.9073, test_f1: 0.6602
 epoch: 84, train_loss: 0.4376, test_loss: 0.9067, test_f1: 0.6744
 epoch: 85, train_loss: 0.4311, test_loss: 0.9738, test_f1: 0.6603
 epoch: 86, train_loss: 0.4230, test_loss: 0.9522, test_f1: 0.6663
 epoch: 87, train_loss: 0.4338, test_loss: 0.9425, test_f1: 0.6506
 epoch: 88, train_loss: 0.4238, test_loss: 0.9948, test_f1: 0.6461
 epoch: 89, train_loss: 0.4241, test_loss: 0.9719, test_f1: 0.6419
 epoch: 90, train_loss: 0.4264, test_loss: 0.9612, test_f1: 0.6652
 epoch: 91, train_loss: 0.4314, test_loss: 0.9930, test_f1: 0.6551
 epoch: 92, train_loss: 0.4222, test_loss: 1.0295, test_f1: 0.6553
 epoch: 93, train_loss: 0.4060, test_loss: 1.0401, test_f1: 0.6349
 epoch: 94, train_loss: 0.4129, test_loss: 0.9801, test_f1: 0.6615
 epoch: 95, train_loss: 0.4205, test_loss: 1.0020, test_f1: 0.6533
 epoch: 96, train_loss: 0.4002, test_loss: 0.9667, test_f1: 0.6477
 epoch: 97, train_loss: 0.4119, test_loss: 1.0028, test_f1: 0.6452
 epoch: 98, train_loss: 0.4070, test_loss: 1.0531, test_f1: 0.6575
 epoch: 99, train_loss: 0.4023, test_loss: 1.0230, test_f1: 0.6596
##################ITERATION #9 ****************************************
 epoch: 0, train_loss: 1.1975, test_loss: 1.0207, test_f1: 0.5023
 epoch: 1, train_loss: 1.0373, test_loss: 1.0147, test_f1: 0.5215
 epoch: 2, train_loss: 0.9959, test_loss: 0.9502, test_f1: 0.5297
 epoch: 3, train_loss: 0.9581, test_loss: 0.9301, test_f1: 0.5526
 epoch: 4, train_loss: 0.9407, test_loss: 0.9151, test_f1: 0.5695
 epoch: 5, train_loss: 0.9229, test_loss: 0.9358, test_f1: 0.5716
 epoch: 6, train_loss: 0.9077, test_loss: 0.9314, test_f1: 0.5385
 epoch: 7, train_loss: 0.8900, test_loss: 0.8964, test_f1: 0.5603
 epoch: 8, train_loss: 0.8631, test_loss: 0.8846, test_f1: 0.5687
 epoch: 9, train_loss: 0.8685, test_loss: 0.9007, test_f1: 0.5818
 epoch: 10, train_loss: 0.8342, test_loss: 0.8696, test_f1: 0.5748
 epoch: 11, train_loss: 0.8410, test_loss: 0.8904, test_f1: 0.6071
 epoch: 12, train_loss: 0.8175, test_loss: 0.8689, test_f1: 0.6409
 epoch: 13, train_loss: 0.8135, test_loss: 0.8621, test_f1: 0.5632
 epoch: 14, train_loss: 0.8030, test_loss: 0.8381, test_f1: 0.6138
 epoch: 15, train_loss: 0.7866, test_loss: 0.8601, test_f1: 0.5809
 epoch: 16, train_loss: 0.7830, test_loss: 0.8616, test_f1: 0.6100
 epoch: 17, train_loss: 0.7658, test_loss: 0.7722, test_f1: 0.6313
 epoch: 18, train_loss: 0.7702, test_loss: 0.8017, test_f1: 0.6314
 epoch: 19, train_loss: 0.7529, test_loss: 0.8356, test_f1: 0.6140
 epoch: 20, train_loss: 0.7432, test_loss: 0.7699, test_f1: 0.6316
 epoch: 21, train_loss: 0.7291, test_loss: 0.7517, test_f1: 0.6049
 epoch: 22, train_loss: 0.7438, test_loss: 0.7574, test_f1: 0.6085
 epoch: 23, train_loss: 0.7306, test_loss: 0.7644, test_f1: 0.6424
 epoch: 24, train_loss: 0.7109, test_loss: 0.7641, test_f1: 0.6466
 epoch: 25, train_loss: 0.7113, test_loss: 0.7342, test_f1: 0.6414
 epoch: 26, train_loss: 0.6998, test_loss: 0.7946, test_f1: 0.6308
 epoch: 27, train_loss: 0.7016, test_loss: 0.7482, test_f1: 0.6465
 epoch: 28, train_loss: 0.6951, test_loss: 0.7483, test_f1: 0.6400
 epoch: 29, train_loss: 0.6828, test_loss: 0.7502, test_f1: 0.6675
 epoch: 30, train_loss: 0.6866, test_loss: 0.7584, test_f1: 0.6458
 epoch: 31, train_loss: 0.6730, test_loss: 0.8013, test_f1: 0.6800
 epoch: 32, train_loss: 0.6741, test_loss: 0.7303, test_f1: 0.6388
 epoch: 33, train_loss: 0.6861, test_loss: 0.7320, test_f1: 0.6648
 epoch: 34, train_loss: 0.6410, test_loss: 0.7726, test_f1: 0.6548
 epoch: 35, train_loss: 0.6422, test_loss: 0.7612, test_f1: 0.6649
 epoch: 36, train_loss: 0.6458, test_loss: 0.8075, test_f1: 0.6580
 epoch: 37, train_loss: 0.6440, test_loss: 0.7911, test_f1: 0.6492
 epoch: 38, train_loss: 0.6362, test_loss: 0.7667, test_f1: 0.6439
 epoch: 39, train_loss: 0.6340, test_loss: 0.8358, test_f1: 0.6339
 epoch: 40, train_loss: 0.6235, test_loss: 0.7812, test_f1: 0.6430
 epoch: 41, train_loss: 0.6067, test_loss: 0.7539, test_f1: 0.6667
 epoch: 42, train_loss: 0.6154, test_loss: 0.8430, test_f1: 0.6409
 epoch: 43, train_loss: 0.6050, test_loss: 0.7939, test_f1: 0.6518
 epoch: 44, train_loss: 0.6254, test_loss: 0.8008, test_f1: 0.6418
 epoch: 45, train_loss: 0.6093, test_loss: 0.7783, test_f1: 0.6649
 epoch: 46, train_loss: 0.5800, test_loss: 0.8363, test_f1: 0.6396
 epoch: 47, train_loss: 0.5854, test_loss: 0.8042, test_f1: 0.6525
 epoch: 48, train_loss: 0.5904, test_loss: 0.8238, test_f1: 0.6471
 epoch: 49, train_loss: 0.5807, test_loss: 0.8061, test_f1: 0.6438
 epoch: 50, train_loss: 0.5582, test_loss: 0.8831, test_f1: 0.6503
 epoch: 51, train_loss: 0.5443, test_loss: 0.8633, test_f1: 0.6459
 epoch: 52, train_loss: 0.5442, test_loss: 0.8515, test_f1: 0.6564
 epoch: 53, train_loss: 0.5456, test_loss: 0.8185, test_f1: 0.6662
 epoch: 54, train_loss: 0.5265, test_loss: 0.8139, test_f1: 0.6416
 epoch: 55, train_loss: 0.5273, test_loss: 0.8415, test_f1: 0.6435
 epoch: 56, train_loss: 0.5338, test_loss: 0.8428, test_f1: 0.6535
 epoch: 57, train_loss: 0.5310, test_loss: 0.8870, test_f1: 0.6490
 epoch: 58, train_loss: 0.5275, test_loss: 0.8674, test_f1: 0.6482
 epoch: 59, train_loss: 0.5168, test_loss: 0.9110, test_f1: 0.6577
 epoch: 60, train_loss: 0.5145, test_loss: 0.8491, test_f1: 0.6442
 epoch: 61, train_loss: 0.5130, test_loss: 0.9047, test_f1: 0.6393
 epoch: 62, train_loss: 0.5138, test_loss: 0.8818, test_f1: 0.6353
 epoch: 63, train_loss: 0.4908, test_loss: 0.9046, test_f1: 0.6343
 epoch: 64, train_loss: 0.5123, test_loss: 0.9053, test_f1: 0.6368
 epoch: 65, train_loss: 0.4991, test_loss: 0.8912, test_f1: 0.6568
 epoch: 66, train_loss: 0.4973, test_loss: 0.8940, test_f1: 0.6605
 epoch: 67, train_loss: 0.4982, test_loss: 0.8751, test_f1: 0.6579
 epoch: 68, train_loss: 0.4868, test_loss: 0.9131, test_f1: 0.6697
 epoch: 69, train_loss: 0.5012, test_loss: 0.9078, test_f1: 0.6471
 epoch: 70, train_loss: 0.4808, test_loss: 0.9410, test_f1: 0.6482
 epoch: 71, train_loss: 0.4779, test_loss: 0.9033, test_f1: 0.6422
 epoch: 72, train_loss: 0.4925, test_loss: 0.9340, test_f1: 0.6482
 epoch: 73, train_loss: 0.4847, test_loss: 0.9190, test_f1: 0.6616
 epoch: 74, train_loss: 0.4729, test_loss: 0.9165, test_f1: 0.6591
 epoch: 75, train_loss: 0.4760, test_loss: 0.9442, test_f1: 0.6647
 epoch: 76, train_loss: 0.4636, test_loss: 0.9267, test_f1: 0.6564
 epoch: 77, train_loss: 0.4711, test_loss: 0.9114, test_f1: 0.6603
 epoch: 78, train_loss: 0.4588, test_loss: 0.9476, test_f1: 0.6388
 epoch: 79, train_loss: 0.4685, test_loss: 0.9281, test_f1: 0.6646
 epoch: 80, train_loss: 0.4707, test_loss: 0.9532, test_f1: 0.6455
 epoch: 81, train_loss: 0.4617, test_loss: 0.9292, test_f1: 0.6484
 epoch: 82, train_loss: 0.4485, test_loss: 0.9448, test_f1: 0.6568
 epoch: 83, train_loss: 0.4649, test_loss: 1.0002, test_f1: 0.6676
 epoch: 84, train_loss: 0.4543, test_loss: 1.0066, test_f1: 0.6575
 epoch: 85, train_loss: 0.4510, test_loss: 1.0275, test_f1: 0.6420
 epoch: 86, train_loss: 0.4488, test_loss: 1.0415, test_f1: 0.6578
 epoch: 87, train_loss: 0.4494, test_loss: 1.0531, test_f1: 0.6513
 epoch: 88, train_loss: 0.4541, test_loss: 1.0203, test_f1: 0.6517
 epoch: 89, train_loss: 0.4364, test_loss: 1.0087, test_f1: 0.6532
 epoch: 90, train_loss: 0.4359, test_loss: 1.0499, test_f1: 0.6483
 epoch: 91, train_loss: 0.4365, test_loss: 1.0195, test_f1: 0.6552
 epoch: 92, train_loss: 0.4335, test_loss: 1.0403, test_f1: 0.6622
 epoch: 93, train_loss: 0.4310, test_loss: 1.1199, test_f1: 0.6513
 epoch: 94, train_loss: 0.4339, test_loss: 1.0550, test_f1: 0.6543
 epoch: 95, train_loss: 0.4256, test_loss: 0.9809, test_f1: 0.6581
 epoch: 96, train_loss: 0.4230, test_loss: 1.0654, test_f1: 0.6490
 epoch: 97, train_loss: 0.4317, test_loss: 1.0412, test_f1: 0.6515
 epoch: 98, train_loss: 0.4198, test_loss: 1.1122, test_f1: 0.6482
 epoch: 99, train_loss: 0.4225, test_loss: 1.0688, test_f1: 0.6470

Training completed in 969.08 seconds
Best F1: 0.7071 at epoch 36
Mean F1 across iterations: 0.6832  0.0147
========================FINAL RESULTS================================
FEGIN weighted F1: 0.7071  0.0147
python main.py --data ltspice_examples --representation component_pin_net --model FEGIN --layers 3 --hiddens 128 --batch_size 32 --lr 0.0001 --emb_size 128 --epochs 100 --save_appendix component_pin_net_L3_H128_BS32_LR0.0001_E128 --no_val
-----



STDERR:
  File "main.py", line 370, in <module>
    main()
  File "main.py", line 254, in main
    dataset = dataset_class(
  File "/home/philip/projects/ltspice_examples_code_repo/Circuit-Completion-Using-GNNs/component_classification_with_link_prediction_head/evaluation/FEGIN/kernel/circuit_datasets.py", line 15, in __init__
    self.data, self.slices = torch.load(self.processed_paths[0])
  File "/home/philip/.local/lib/python3.8/site-packages/torch/serialization.py", line 1040, in load
    warnings.warn(
  File "/usr/lib/python3.8/warnings.py", line 109, in _showwarnmsg
    sw(msg.message, msg.category, msg.filename, msg.lineno,
  File "main.py", line 47, in warn_with_traceback
    traceback.print_stack(file=log)
/home/philip/projects/ltspice_examples_code_repo/Circuit-Completion-Using-GNNs/component_classification_with_link_prediction_head/evaluation/FEGIN/kernel/circuit_datasets.py:15: FutureWarning: You are using `torch.load` with `weights_only=False` (the current default value), which uses the default pickle module implicitly. It is possible to construct malicious pickle data which will execute arbitrary code during unpickling (See https://github.com/pytorch/pytorch/blob/main/SECURITY.md#untrusted-models for more details). In a future release, the default value for `weights_only` will be flipped to `True`. This limits the functions that could be executed during unpickling. Arbitrary objects will no longer be allowed to be loaded via this mode unless they are explicitly allowlisted by the user via `torch.serialization.add_safe_globals`. We recommend you start setting `weights_only=True` for any use case where you don't have full control of the loaded file. Please open an issue on GitHub for any issues related to this experimental feature.
  self.data, self.slices = torch.load(self.processed_paths[0])
