STDOUT:
Results will be saved in /home/philip/projects/llm_inference_code_repo/Circuit-Completion-Using-GNNs/component_classification_with_link_prediction_head/evaluation/FEGIN/results/model_FEGIN_dataset_ltspice_examples
Command line input: python main.py --data ltspice_examples --representation component_pin_net --model FEGIN --layers 4 --hiddens 16 --batch_size 32 --lr 0.01 --emb_size 250 --epochs 100 --save_appendix component_pin_net_L4_H16_BS32_LR0.01_E250 --no_val
 is saved.
-----
ltspice_examples - FEGIN
Using 4 layers, 16 hidden units, h = 2
Loading component_pin_net representation dataset
ENTERED
Training FEGIN on component_pin_net representation
Train: 3558, Test: 846
##################ITERATION #0 ****************************************
 epoch: 0, train_loss: 1.1560, test_loss: 1.0400, test_f1: 0.4104
 epoch: 1, train_loss: 1.0445, test_loss: 1.0688, test_f1: 0.4547
 epoch: 2, train_loss: 1.0314, test_loss: 1.0857, test_f1: 0.4759
 epoch: 3, train_loss: 1.0130, test_loss: 1.0218, test_f1: 0.4650
 epoch: 4, train_loss: 0.9984, test_loss: 0.9702, test_f1: 0.4641
 epoch: 5, train_loss: 0.9854, test_loss: 1.0448, test_f1: 0.4673
 epoch: 6, train_loss: 0.9690, test_loss: 1.0493, test_f1: 0.4798
 epoch: 7, train_loss: 0.9673, test_loss: 0.9908, test_f1: 0.4951
 epoch: 8, train_loss: 0.9756, test_loss: 1.0141, test_f1: 0.5018
 epoch: 9, train_loss: 0.9624, test_loss: 0.9774, test_f1: 0.4948
 epoch: 10, train_loss: 0.9538, test_loss: 0.9930, test_f1: 0.4445
 epoch: 11, train_loss: 0.9469, test_loss: 1.0115, test_f1: 0.4839
 epoch: 12, train_loss: 0.9594, test_loss: 0.9582, test_f1: 0.5349
 epoch: 13, train_loss: 0.9345, test_loss: 0.9329, test_f1: 0.5085
 epoch: 14, train_loss: 0.9348, test_loss: 0.9509, test_f1: 0.5005
 epoch: 15, train_loss: 0.9455, test_loss: 0.9462, test_f1: 0.5035
 epoch: 16, train_loss: 0.9237, test_loss: 1.0323, test_f1: 0.4980
 epoch: 17, train_loss: 0.9325, test_loss: 0.9621, test_f1: 0.5602
 epoch: 18, train_loss: 0.9282, test_loss: 0.9867, test_f1: 0.5096
 epoch: 19, train_loss: 0.9257, test_loss: 0.9794, test_f1: 0.5081
 epoch: 20, train_loss: 0.9141, test_loss: 0.9486, test_f1: 0.5415
 epoch: 21, train_loss: 0.9201, test_loss: 0.9637, test_f1: 0.4974
 epoch: 22, train_loss: 0.9191, test_loss: 1.0185, test_f1: 0.4861
 epoch: 23, train_loss: 0.9082, test_loss: 0.9290, test_f1: 0.5210
 epoch: 24, train_loss: 0.9117, test_loss: 0.9466, test_f1: 0.5050
 epoch: 25, train_loss: 0.8900, test_loss: 0.9590, test_f1: 0.5066
 epoch: 26, train_loss: 0.9066, test_loss: 0.9896, test_f1: 0.5602
 epoch: 27, train_loss: 0.9128, test_loss: 1.0211, test_f1: 0.4769
 epoch: 28, train_loss: 0.8899, test_loss: 0.9713, test_f1: 0.5217
 epoch: 29, train_loss: 0.8797, test_loss: 0.9658, test_f1: 0.5624
 epoch: 30, train_loss: 0.8852, test_loss: 1.0169, test_f1: 0.4897
 epoch: 31, train_loss: 0.8893, test_loss: 0.9543, test_f1: 0.5172
 epoch: 32, train_loss: 0.8680, test_loss: 0.9860, test_f1: 0.5304
 epoch: 33, train_loss: 0.8679, test_loss: 0.9248, test_f1: 0.5443
 epoch: 34, train_loss: 0.8674, test_loss: 1.0457, test_f1: 0.5092
 epoch: 35, train_loss: 0.8795, test_loss: 0.9923, test_f1: 0.5123
 epoch: 36, train_loss: 0.8913, test_loss: 0.9132, test_f1: 0.5469
 epoch: 37, train_loss: 0.8680, test_loss: 0.9394, test_f1: 0.5452
 epoch: 38, train_loss: 0.8817, test_loss: 0.9033, test_f1: 0.5512
 epoch: 39, train_loss: 0.8579, test_loss: 1.0209, test_f1: 0.5431
 epoch: 40, train_loss: 0.8662, test_loss: 0.9547, test_f1: 0.5399
 epoch: 41, train_loss: 0.8560, test_loss: 0.9407, test_f1: 0.5229
 epoch: 42, train_loss: 0.8656, test_loss: 0.9667, test_f1: 0.5325
 epoch: 43, train_loss: 0.8520, test_loss: 0.9218, test_f1: 0.5563
 epoch: 44, train_loss: 0.8407, test_loss: 0.9585, test_f1: 0.5527
 epoch: 45, train_loss: 0.8400, test_loss: 0.9441, test_f1: 0.5301
 epoch: 46, train_loss: 0.8473, test_loss: 0.9274, test_f1: 0.5408
 epoch: 47, train_loss: 0.8420, test_loss: 0.9095, test_f1: 0.5767
 epoch: 48, train_loss: 0.8380, test_loss: 0.8840, test_f1: 0.5465
 epoch: 49, train_loss: 0.8489, test_loss: 0.9049, test_f1: 0.5394
 epoch: 50, train_loss: 0.8348, test_loss: 0.9001, test_f1: 0.5457
 epoch: 51, train_loss: 0.8252, test_loss: 0.9140, test_f1: 0.5497
 epoch: 52, train_loss: 0.8214, test_loss: 0.9289, test_f1: 0.5780
 epoch: 53, train_loss: 0.8092, test_loss: 0.9557, test_f1: 0.5742
 epoch: 54, train_loss: 0.8159, test_loss: 0.8736, test_f1: 0.5902
 epoch: 55, train_loss: 0.8100, test_loss: 0.9213, test_f1: 0.5859
 epoch: 56, train_loss: 0.8036, test_loss: 0.9442, test_f1: 0.6069
 epoch: 57, train_loss: 0.8188, test_loss: 0.9226, test_f1: 0.6089
 epoch: 58, train_loss: 0.8096, test_loss: 0.9123, test_f1: 0.5764
 epoch: 59, train_loss: 0.8147, test_loss: 0.9027, test_f1: 0.6123
 epoch: 60, train_loss: 0.8146, test_loss: 0.9249, test_f1: 0.6100
 epoch: 61, train_loss: 0.8059, test_loss: 0.9223, test_f1: 0.6016
 epoch: 62, train_loss: 0.8034, test_loss: 0.9343, test_f1: 0.6115
 epoch: 63, train_loss: 0.7968, test_loss: 0.9165, test_f1: 0.6088
 epoch: 64, train_loss: 0.7815, test_loss: 0.9533, test_f1: 0.5816
 epoch: 65, train_loss: 0.7892, test_loss: 0.8953, test_f1: 0.5809
 epoch: 66, train_loss: 0.8005, test_loss: 0.9301, test_f1: 0.6243
 epoch: 67, train_loss: 0.7928, test_loss: 0.8657, test_f1: 0.6056
 epoch: 68, train_loss: 0.7972, test_loss: 0.9206, test_f1: 0.5742
 epoch: 69, train_loss: 0.7909, test_loss: 0.9109, test_f1: 0.5951
 epoch: 70, train_loss: 0.7771, test_loss: 0.8871, test_f1: 0.5932
 epoch: 71, train_loss: 0.7757, test_loss: 0.9194, test_f1: 0.6241
 epoch: 72, train_loss: 0.7850, test_loss: 0.9910, test_f1: 0.5786
 epoch: 73, train_loss: 0.7851, test_loss: 0.9456, test_f1: 0.6199
 epoch: 74, train_loss: 0.7884, test_loss: 1.0008, test_f1: 0.5931
 epoch: 75, train_loss: 0.7802, test_loss: 1.0162, test_f1: 0.6121
 epoch: 76, train_loss: 0.7898, test_loss: 1.0375, test_f1: 0.5949
 epoch: 77, train_loss: 0.7851, test_loss: 0.9339, test_f1: 0.5993
 epoch: 78, train_loss: 0.7873, test_loss: 0.9303, test_f1: 0.6059
 epoch: 79, train_loss: 0.7672, test_loss: 0.9385, test_f1: 0.6154
 epoch: 80, train_loss: 0.7723, test_loss: 0.9608, test_f1: 0.6168
 epoch: 81, train_loss: 0.7714, test_loss: 1.0129, test_f1: 0.6147
 epoch: 82, train_loss: 0.7742, test_loss: 0.9478, test_f1: 0.5885
 epoch: 83, train_loss: 0.7736, test_loss: 0.8648, test_f1: 0.6344
 epoch: 84, train_loss: 0.7809, test_loss: 0.9151, test_f1: 0.6135
 epoch: 85, train_loss: 0.7676, test_loss: 0.9295, test_f1: 0.6190
 epoch: 86, train_loss: 0.7939, test_loss: 0.8920, test_f1: 0.6052
 epoch: 87, train_loss: 0.7730, test_loss: 0.8860, test_f1: 0.6218
 epoch: 88, train_loss: 0.7900, test_loss: 0.8846, test_f1: 0.6192
 epoch: 89, train_loss: 0.7618, test_loss: 0.9765, test_f1: 0.5672
 epoch: 90, train_loss: 0.7810, test_loss: 0.8870, test_f1: 0.6398
 epoch: 91, train_loss: 0.7706, test_loss: 0.8973, test_f1: 0.6101
 epoch: 92, train_loss: 0.7708, test_loss: 0.9399, test_f1: 0.6160
 epoch: 93, train_loss: 0.7647, test_loss: 0.9008, test_f1: 0.6396
 epoch: 94, train_loss: 0.7579, test_loss: 0.8951, test_f1: 0.5997
 epoch: 95, train_loss: 0.7577, test_loss: 0.8880, test_f1: 0.6409
 epoch: 96, train_loss: 0.7574, test_loss: 0.9118, test_f1: 0.6147
 epoch: 97, train_loss: 0.7668, test_loss: 0.8919, test_f1: 0.6110
 epoch: 98, train_loss: 0.7802, test_loss: 0.8536, test_f1: 0.6301
 epoch: 99, train_loss: 0.7562, test_loss: 0.8763, test_f1: 0.6270
##################ITERATION #1 ****************************************
 epoch: 0, train_loss: 1.1068, test_loss: 1.2541, test_f1: 0.2977
 epoch: 1, train_loss: 1.0413, test_loss: 1.0464, test_f1: 0.4532
 epoch: 2, train_loss: 0.9957, test_loss: 1.3259, test_f1: 0.4094
 epoch: 3, train_loss: 0.9926, test_loss: 1.0133, test_f1: 0.4691
 epoch: 4, train_loss: 0.9894, test_loss: 1.1874, test_f1: 0.4085
 epoch: 5, train_loss: 0.9803, test_loss: 1.0810, test_f1: 0.4415
 epoch: 6, train_loss: 0.9743, test_loss: 0.9950, test_f1: 0.4715
 epoch: 7, train_loss: 0.9533, test_loss: 0.9626, test_f1: 0.4823
 epoch: 8, train_loss: 0.9472, test_loss: 0.9902, test_f1: 0.4814
 epoch: 9, train_loss: 0.9507, test_loss: 1.0311, test_f1: 0.4854
 epoch: 10, train_loss: 0.9373, test_loss: 0.9535, test_f1: 0.5040
 epoch: 11, train_loss: 0.9262, test_loss: 0.9286, test_f1: 0.5055
 epoch: 12, train_loss: 0.9305, test_loss: 0.9024, test_f1: 0.5598
 epoch: 13, train_loss: 0.9315, test_loss: 0.9713, test_f1: 0.5133
 epoch: 14, train_loss: 0.9196, test_loss: 0.9528, test_f1: 0.5147
 epoch: 15, train_loss: 0.9165, test_loss: 0.9661, test_f1: 0.5170
 epoch: 16, train_loss: 0.9068, test_loss: 0.9159, test_f1: 0.5219
 epoch: 17, train_loss: 0.9009, test_loss: 0.9435, test_f1: 0.4999
 epoch: 18, train_loss: 0.9223, test_loss: 0.9934, test_f1: 0.4932
 epoch: 19, train_loss: 0.9086, test_loss: 0.8838, test_f1: 0.5188
 epoch: 20, train_loss: 0.9057, test_loss: 0.9237, test_f1: 0.5163
 epoch: 21, train_loss: 0.8964, test_loss: 0.9585, test_f1: 0.4760
 epoch: 22, train_loss: 0.9238, test_loss: 0.9701, test_f1: 0.5127
 epoch: 23, train_loss: 0.8928, test_loss: 0.9645, test_f1: 0.5260
 epoch: 24, train_loss: 0.8914, test_loss: 0.8937, test_f1: 0.5806
 epoch: 25, train_loss: 0.8846, test_loss: 0.9052, test_f1: 0.5226
 epoch: 26, train_loss: 0.8708, test_loss: 0.9140, test_f1: 0.5364
 epoch: 27, train_loss: 0.8753, test_loss: 0.8867, test_f1: 0.5562
 epoch: 28, train_loss: 0.8836, test_loss: 0.8875, test_f1: 0.5540
 epoch: 29, train_loss: 0.8780, test_loss: 0.8912, test_f1: 0.5606
 epoch: 30, train_loss: 0.8735, test_loss: 0.9704, test_f1: 0.5178
 epoch: 31, train_loss: 0.8659, test_loss: 0.8643, test_f1: 0.5319
 epoch: 32, train_loss: 0.8693, test_loss: 0.8875, test_f1: 0.5605
 epoch: 33, train_loss: 0.8652, test_loss: 0.8549, test_f1: 0.5356
 epoch: 34, train_loss: 0.8574, test_loss: 0.9217, test_f1: 0.5492
 epoch: 35, train_loss: 0.8492, test_loss: 0.9023, test_f1: 0.5624
 epoch: 36, train_loss: 0.8724, test_loss: 0.8828, test_f1: 0.5489
 epoch: 37, train_loss: 0.8596, test_loss: 0.8799, test_f1: 0.6045
 epoch: 38, train_loss: 0.8567, test_loss: 0.9065, test_f1: 0.5461
 epoch: 39, train_loss: 0.8655, test_loss: 0.9169, test_f1: 0.5302
 epoch: 40, train_loss: 0.8729, test_loss: 0.8962, test_f1: 0.5440
 epoch: 41, train_loss: 0.8749, test_loss: 0.8498, test_f1: 0.5556
 epoch: 42, train_loss: 0.8592, test_loss: 0.8950, test_f1: 0.5864
 epoch: 43, train_loss: 0.8511, test_loss: 0.8357, test_f1: 0.5436
 epoch: 44, train_loss: 0.8520, test_loss: 0.8849, test_f1: 0.5441
 epoch: 45, train_loss: 0.8419, test_loss: 0.8457, test_f1: 0.5498
 epoch: 46, train_loss: 0.8367, test_loss: 0.8869, test_f1: 0.5621
 epoch: 47, train_loss: 0.8461, test_loss: 0.8625, test_f1: 0.6083
 epoch: 48, train_loss: 0.8492, test_loss: 0.9120, test_f1: 0.5415
 epoch: 49, train_loss: 0.8524, test_loss: 0.8604, test_f1: 0.5243
 epoch: 50, train_loss: 0.8425, test_loss: 0.7928, test_f1: 0.6121
 epoch: 51, train_loss: 0.8116, test_loss: 0.8749, test_f1: 0.6080
 epoch: 52, train_loss: 0.8202, test_loss: 0.8415, test_f1: 0.5750
 epoch: 53, train_loss: 0.8217, test_loss: 0.8538, test_f1: 0.5804
 epoch: 54, train_loss: 0.8203, test_loss: 0.8218, test_f1: 0.5875
 epoch: 55, train_loss: 0.8124, test_loss: 0.8299, test_f1: 0.5888
 epoch: 56, train_loss: 0.8168, test_loss: 0.8713, test_f1: 0.5724
 epoch: 57, train_loss: 0.7999, test_loss: 0.8527, test_f1: 0.5859
 epoch: 58, train_loss: 0.8042, test_loss: 0.8539, test_f1: 0.5795
 epoch: 59, train_loss: 0.8039, test_loss: 0.8421, test_f1: 0.5759
 epoch: 60, train_loss: 0.8010, test_loss: 0.8718, test_f1: 0.5939
 epoch: 61, train_loss: 0.8026, test_loss: 0.8002, test_f1: 0.5772
 epoch: 62, train_loss: 0.7989, test_loss: 0.8554, test_f1: 0.5881
 epoch: 63, train_loss: 0.7941, test_loss: 0.7843, test_f1: 0.5922
 epoch: 64, train_loss: 0.7999, test_loss: 0.8241, test_f1: 0.6197
 epoch: 65, train_loss: 0.7970, test_loss: 0.8591, test_f1: 0.6132
 epoch: 66, train_loss: 0.7844, test_loss: 0.8640, test_f1: 0.6013
 epoch: 67, train_loss: 0.7888, test_loss: 0.8931, test_f1: 0.6266
 epoch: 68, train_loss: 0.7919, test_loss: 0.9076, test_f1: 0.5606
 epoch: 69, train_loss: 0.7756, test_loss: 0.8440, test_f1: 0.6044
 epoch: 70, train_loss: 0.7899, test_loss: 0.8168, test_f1: 0.5825
 epoch: 71, train_loss: 0.7768, test_loss: 0.8244, test_f1: 0.6099
 epoch: 72, train_loss: 0.7839, test_loss: 0.8222, test_f1: 0.5968
 epoch: 73, train_loss: 0.7847, test_loss: 0.8167, test_f1: 0.6099
 epoch: 74, train_loss: 0.7801, test_loss: 0.8150, test_f1: 0.6158
 epoch: 75, train_loss: 0.7816, test_loss: 0.8322, test_f1: 0.5906
 epoch: 76, train_loss: 0.7673, test_loss: 0.8828, test_f1: 0.6071
 epoch: 77, train_loss: 0.7937, test_loss: 0.8012, test_f1: 0.5969
 epoch: 78, train_loss: 0.7877, test_loss: 0.8510, test_f1: 0.5823
 epoch: 79, train_loss: 0.7840, test_loss: 0.8182, test_f1: 0.5943
 epoch: 80, train_loss: 0.7931, test_loss: 0.8035, test_f1: 0.6038
 epoch: 81, train_loss: 0.7929, test_loss: 0.7856, test_f1: 0.6091
 epoch: 82, train_loss: 0.7779, test_loss: 0.8238, test_f1: 0.5938
 epoch: 83, train_loss: 0.7767, test_loss: 0.8260, test_f1: 0.6130
 epoch: 84, train_loss: 0.7644, test_loss: 0.8633, test_f1: 0.6172
 epoch: 85, train_loss: 0.7692, test_loss: 0.8455, test_f1: 0.6014
 epoch: 86, train_loss: 0.7835, test_loss: 0.8133, test_f1: 0.5945
 epoch: 87, train_loss: 0.7762, test_loss: 0.8624, test_f1: 0.5712
 epoch: 88, train_loss: 0.7634, test_loss: 0.8283, test_f1: 0.6181
 epoch: 89, train_loss: 0.7651, test_loss: 0.8400, test_f1: 0.6061
 epoch: 90, train_loss: 0.7672, test_loss: 0.7810, test_f1: 0.6267
 epoch: 91, train_loss: 0.7734, test_loss: 0.7923, test_f1: 0.6152
 epoch: 92, train_loss: 0.7813, test_loss: 0.7882, test_f1: 0.6305
 epoch: 93, train_loss: 0.7686, test_loss: 0.8286, test_f1: 0.6035
 epoch: 94, train_loss: 0.7567, test_loss: 0.8584, test_f1: 0.6089
 epoch: 95, train_loss: 0.7680, test_loss: 0.8953, test_f1: 0.5753
 epoch: 96, train_loss: 0.7675, test_loss: 0.8494, test_f1: 0.5897
 epoch: 97, train_loss: 0.7651, test_loss: 0.7994, test_f1: 0.6677
 epoch: 98, train_loss: 0.7564, test_loss: 0.8088, test_f1: 0.6271
 epoch: 99, train_loss: 0.7800, test_loss: 0.7980, test_f1: 0.6265
##################ITERATION #2 ****************************************
 epoch: 0, train_loss: 1.1076, test_loss: 1.0837, test_f1: 0.4481
 epoch: 1, train_loss: 1.0258, test_loss: 1.1203, test_f1: 0.4375
 epoch: 2, train_loss: 0.9975, test_loss: 1.0729, test_f1: 0.4654
 epoch: 3, train_loss: 0.9871, test_loss: 1.1120, test_f1: 0.4495
 epoch: 4, train_loss: 0.9716, test_loss: 0.9796, test_f1: 0.5104
 epoch: 5, train_loss: 0.9588, test_loss: 0.9900, test_f1: 0.4399
 epoch: 6, train_loss: 0.9578, test_loss: 1.0356, test_f1: 0.4689
 epoch: 7, train_loss: 0.9916, test_loss: 1.0879, test_f1: 0.4135
 epoch: 8, train_loss: 0.9753, test_loss: 1.0288, test_f1: 0.4938
 epoch: 9, train_loss: 0.9521, test_loss: 0.9367, test_f1: 0.4802
 epoch: 10, train_loss: 0.9604, test_loss: 0.9663, test_f1: 0.4828
 epoch: 11, train_loss: 0.9457, test_loss: 1.0078, test_f1: 0.4487
 epoch: 12, train_loss: 0.9460, test_loss: 1.0000, test_f1: 0.4322
 epoch: 13, train_loss: 0.9498, test_loss: 0.9756, test_f1: 0.4955
 epoch: 14, train_loss: 0.9363, test_loss: 0.9552, test_f1: 0.5023
 epoch: 15, train_loss: 0.9157, test_loss: 0.9066, test_f1: 0.5346
 epoch: 16, train_loss: 0.8967, test_loss: 0.9332, test_f1: 0.5242
 epoch: 17, train_loss: 0.9004, test_loss: 0.8947, test_f1: 0.5055
 epoch: 18, train_loss: 0.8836, test_loss: 0.9411, test_f1: 0.5078
 epoch: 19, train_loss: 0.8880, test_loss: 0.9730, test_f1: 0.5209
 epoch: 20, train_loss: 0.8914, test_loss: 0.9157, test_f1: 0.5157
 epoch: 21, train_loss: 0.9193, test_loss: 1.1176, test_f1: 0.4601
 epoch: 22, train_loss: 0.8985, test_loss: 0.8959, test_f1: 0.5321
 epoch: 23, train_loss: 0.8800, test_loss: 0.9079, test_f1: 0.4936
 epoch: 24, train_loss: 0.8700, test_loss: 0.9440, test_f1: 0.5395
 epoch: 25, train_loss: 0.8761, test_loss: 0.8770, test_f1: 0.5203
 epoch: 26, train_loss: 0.8794, test_loss: 0.9488, test_f1: 0.5358
 epoch: 27, train_loss: 0.8557, test_loss: 0.9015, test_f1: 0.5707
 epoch: 28, train_loss: 0.8598, test_loss: 0.9338, test_f1: 0.5207
 epoch: 29, train_loss: 0.8581, test_loss: 0.9111, test_f1: 0.5243
 epoch: 30, train_loss: 0.8572, test_loss: 0.8736, test_f1: 0.5404
 epoch: 31, train_loss: 0.8534, test_loss: 0.9199, test_f1: 0.5517
 epoch: 32, train_loss: 0.8448, test_loss: 0.9118, test_f1: 0.5353
 epoch: 33, train_loss: 0.8616, test_loss: 0.9049, test_f1: 0.5658
 epoch: 34, train_loss: 0.8449, test_loss: 0.8981, test_f1: 0.5136
 epoch: 35, train_loss: 0.8583, test_loss: 0.8893, test_f1: 0.5394
 epoch: 36, train_loss: 0.8387, test_loss: 0.9079, test_f1: 0.5909
 epoch: 37, train_loss: 0.8411, test_loss: 0.8948, test_f1: 0.5293
 epoch: 38, train_loss: 0.8479, test_loss: 0.8784, test_f1: 0.5380
 epoch: 39, train_loss: 0.8338, test_loss: 0.9060, test_f1: 0.5657
 epoch: 40, train_loss: 0.8593, test_loss: 0.9209, test_f1: 0.5662
 epoch: 41, train_loss: 0.8472, test_loss: 0.8788, test_f1: 0.5433
 epoch: 42, train_loss: 0.8277, test_loss: 0.8984, test_f1: 0.5605
 epoch: 43, train_loss: 0.8400, test_loss: 0.9104, test_f1: 0.5312
 epoch: 44, train_loss: 0.8346, test_loss: 0.8830, test_f1: 0.5448
 epoch: 45, train_loss: 0.8574, test_loss: 0.9365, test_f1: 0.5301
 epoch: 46, train_loss: 0.8649, test_loss: 0.9288, test_f1: 0.5320
 epoch: 47, train_loss: 0.8530, test_loss: 0.9191, test_f1: 0.5781
 epoch: 48, train_loss: 0.8522, test_loss: 1.0112, test_f1: 0.5187
 epoch: 49, train_loss: 0.8318, test_loss: 0.8858, test_f1: 0.5665
 epoch: 50, train_loss: 0.8298, test_loss: 0.9252, test_f1: 0.5592
 epoch: 51, train_loss: 0.8146, test_loss: 0.8938, test_f1: 0.5690
 epoch: 52, train_loss: 0.8071, test_loss: 0.8361, test_f1: 0.5685
 epoch: 53, train_loss: 0.8010, test_loss: 0.9089, test_f1: 0.6105
 epoch: 54, train_loss: 0.7999, test_loss: 0.8670, test_f1: 0.5933
 epoch: 55, train_loss: 0.7911, test_loss: 0.8432, test_f1: 0.5940
 epoch: 56, train_loss: 0.7965, test_loss: 0.8410, test_f1: 0.5764
 epoch: 57, train_loss: 0.7962, test_loss: 0.8756, test_f1: 0.5844
 epoch: 58, train_loss: 0.7798, test_loss: 0.8857, test_f1: 0.5809
 epoch: 59, train_loss: 0.8018, test_loss: 0.8465, test_f1: 0.5723
 epoch: 60, train_loss: 0.7876, test_loss: 0.8609, test_f1: 0.5811
 epoch: 61, train_loss: 0.7821, test_loss: 0.8556, test_f1: 0.5705
 epoch: 62, train_loss: 0.7783, test_loss: 0.8585, test_f1: 0.5815
 epoch: 63, train_loss: 0.7843, test_loss: 0.8549, test_f1: 0.5833
 epoch: 64, train_loss: 0.7895, test_loss: 0.9018, test_f1: 0.5485
 epoch: 65, train_loss: 0.7953, test_loss: 0.8575, test_f1: 0.5783
 epoch: 66, train_loss: 0.7747, test_loss: 0.8888, test_f1: 0.5935
 epoch: 67, train_loss: 0.7994, test_loss: 0.8722, test_f1: 0.5623
 epoch: 68, train_loss: 0.7818, test_loss: 0.8461, test_f1: 0.5865
 epoch: 69, train_loss: 0.7775, test_loss: 0.7940, test_f1: 0.5888
 epoch: 70, train_loss: 0.7625, test_loss: 0.8357, test_f1: 0.5819
 epoch: 71, train_loss: 0.7773, test_loss: 0.8444, test_f1: 0.5809
 epoch: 72, train_loss: 0.7640, test_loss: 0.8765, test_f1: 0.5747
 epoch: 73, train_loss: 0.7648, test_loss: 0.8173, test_f1: 0.5928
 epoch: 74, train_loss: 0.7721, test_loss: 0.7812, test_f1: 0.5972
 epoch: 75, train_loss: 0.7545, test_loss: 0.8255, test_f1: 0.6086
 epoch: 76, train_loss: 0.7546, test_loss: 0.8764, test_f1: 0.6173
 epoch: 77, train_loss: 0.7555, test_loss: 0.8489, test_f1: 0.5812
 epoch: 78, train_loss: 0.7556, test_loss: 0.8591, test_f1: 0.5941
 epoch: 79, train_loss: 0.7540, test_loss: 0.8317, test_f1: 0.6117
 epoch: 80, train_loss: 0.7699, test_loss: 0.8233, test_f1: 0.6538
 epoch: 81, train_loss: 0.7596, test_loss: 0.8674, test_f1: 0.6112
 epoch: 82, train_loss: 0.7558, test_loss: 0.8099, test_f1: 0.6000
 epoch: 83, train_loss: 0.7414, test_loss: 0.8220, test_f1: 0.5845
 epoch: 84, train_loss: 0.7644, test_loss: 0.8599, test_f1: 0.5793
 epoch: 85, train_loss: 0.7533, test_loss: 0.8508, test_f1: 0.6231
 epoch: 86, train_loss: 0.7522, test_loss: 0.8329, test_f1: 0.6050
 epoch: 87, train_loss: 0.7460, test_loss: 0.8720, test_f1: 0.5869
 epoch: 88, train_loss: 0.7678, test_loss: 0.8914, test_f1: 0.6330
 epoch: 89, train_loss: 0.7496, test_loss: 0.8697, test_f1: 0.5732
 epoch: 90, train_loss: 0.7574, test_loss: 0.8849, test_f1: 0.6141
 epoch: 91, train_loss: 0.7537, test_loss: 0.9174, test_f1: 0.5870
 epoch: 92, train_loss: 0.7484, test_loss: 0.8439, test_f1: 0.6341
 epoch: 93, train_loss: 0.7379, test_loss: 0.8414, test_f1: 0.6131
 epoch: 94, train_loss: 0.7318, test_loss: 0.8754, test_f1: 0.6448
 epoch: 95, train_loss: 0.7276, test_loss: 0.8445, test_f1: 0.6163
 epoch: 96, train_loss: 0.7406, test_loss: 0.9090, test_f1: 0.5858
 epoch: 97, train_loss: 0.7425, test_loss: 0.8305, test_f1: 0.6077
 epoch: 98, train_loss: 0.7386, test_loss: 0.8598, test_f1: 0.6286
 epoch: 99, train_loss: 0.7374, test_loss: 0.8177, test_f1: 0.6417
##################ITERATION #3 ****************************************
 epoch: 0, train_loss: 1.1278, test_loss: 1.1015, test_f1: 0.4321
 epoch: 1, train_loss: 1.0476, test_loss: 1.0721, test_f1: 0.4606
 epoch: 2, train_loss: 1.0235, test_loss: 1.0276, test_f1: 0.4762
 epoch: 3, train_loss: 1.0027, test_loss: 1.0106, test_f1: 0.4564
 epoch: 4, train_loss: 0.9790, test_loss: 1.0429, test_f1: 0.4488
 epoch: 5, train_loss: 0.9572, test_loss: 0.9540, test_f1: 0.4958
 epoch: 6, train_loss: 0.9632, test_loss: 1.0625, test_f1: 0.4782
 epoch: 7, train_loss: 0.9541, test_loss: 0.9858, test_f1: 0.5285
 epoch: 8, train_loss: 0.9486, test_loss: 0.9351, test_f1: 0.5308
 epoch: 9, train_loss: 0.9452, test_loss: 0.9777, test_f1: 0.4933
 epoch: 10, train_loss: 0.9364, test_loss: 0.9270, test_f1: 0.5211
 epoch: 11, train_loss: 0.9348, test_loss: 0.9778, test_f1: 0.4904
 epoch: 12, train_loss: 0.9316, test_loss: 1.0673, test_f1: 0.4720
 epoch: 13, train_loss: 0.9367, test_loss: 0.9551, test_f1: 0.5064
 epoch: 14, train_loss: 0.9172, test_loss: 0.9881, test_f1: 0.5174
 epoch: 15, train_loss: 0.9169, test_loss: 0.9311, test_f1: 0.5091
 epoch: 16, train_loss: 0.9209, test_loss: 0.9162, test_f1: 0.5446
 epoch: 17, train_loss: 0.9170, test_loss: 0.9017, test_f1: 0.5212
 epoch: 18, train_loss: 0.9055, test_loss: 0.9656, test_f1: 0.5488
 epoch: 19, train_loss: 0.9080, test_loss: 0.8940, test_f1: 0.5359
 epoch: 20, train_loss: 0.9053, test_loss: 0.8985, test_f1: 0.5182
 epoch: 21, train_loss: 0.8985, test_loss: 0.8881, test_f1: 0.5667
 epoch: 22, train_loss: 0.8879, test_loss: 0.9124, test_f1: 0.5342
 epoch: 23, train_loss: 0.8862, test_loss: 0.9371, test_f1: 0.5119
 epoch: 24, train_loss: 0.8771, test_loss: 1.0680, test_f1: 0.4846
 epoch: 25, train_loss: 0.8871, test_loss: 0.8915, test_f1: 0.5375
 epoch: 26, train_loss: 0.8768, test_loss: 0.9067, test_f1: 0.5209
 epoch: 27, train_loss: 0.8820, test_loss: 0.8942, test_f1: 0.5716
 epoch: 28, train_loss: 0.8750, test_loss: 0.8703, test_f1: 0.5432
 epoch: 29, train_loss: 0.8740, test_loss: 0.9307, test_f1: 0.5365
 epoch: 30, train_loss: 0.8757, test_loss: 0.9999, test_f1: 0.5267
 epoch: 31, train_loss: 0.8754, test_loss: 0.9047, test_f1: 0.5586
 epoch: 32, train_loss: 0.8763, test_loss: 0.9104, test_f1: 0.5756
 epoch: 33, train_loss: 0.8522, test_loss: 0.9118, test_f1: 0.5287
 epoch: 34, train_loss: 0.8569, test_loss: 0.8900, test_f1: 0.5406
 epoch: 35, train_loss: 0.8492, test_loss: 0.9345, test_f1: 0.5666
 epoch: 36, train_loss: 0.8632, test_loss: 0.8771, test_f1: 0.5407
 epoch: 37, train_loss: 0.8546, test_loss: 0.9311, test_f1: 0.5364
 epoch: 38, train_loss: 0.8657, test_loss: 1.0752, test_f1: 0.5038
 epoch: 39, train_loss: 0.8604, test_loss: 0.8843, test_f1: 0.5187
 epoch: 40, train_loss: 0.8584, test_loss: 0.9132, test_f1: 0.5413
 epoch: 41, train_loss: 0.8462, test_loss: 0.9099, test_f1: 0.5306
 epoch: 42, train_loss: 0.8624, test_loss: 0.8897, test_f1: 0.5455
 epoch: 43, train_loss: 0.8568, test_loss: 0.9375, test_f1: 0.5404
 epoch: 44, train_loss: 0.8718, test_loss: 0.9034, test_f1: 0.5741
 epoch: 45, train_loss: 0.8597, test_loss: 0.8795, test_f1: 0.5577
 epoch: 46, train_loss: 0.8588, test_loss: 0.8847, test_f1: 0.5416
 epoch: 47, train_loss: 0.8619, test_loss: 0.8241, test_f1: 0.5536
 epoch: 48, train_loss: 0.8379, test_loss: 0.9122, test_f1: 0.5891
 epoch: 49, train_loss: 0.8498, test_loss: 0.9091, test_f1: 0.6044
 epoch: 50, train_loss: 0.8573, test_loss: 0.9035, test_f1: 0.5549
 epoch: 51, train_loss: 0.8204, test_loss: 0.8440, test_f1: 0.5805
 epoch: 52, train_loss: 0.8193, test_loss: 0.8383, test_f1: 0.5866
 epoch: 53, train_loss: 0.8163, test_loss: 0.8505, test_f1: 0.5736
 epoch: 54, train_loss: 0.8175, test_loss: 0.8465, test_f1: 0.5749
 epoch: 55, train_loss: 0.8197, test_loss: 0.8571, test_f1: 0.5614
 epoch: 56, train_loss: 0.8086, test_loss: 0.8228, test_f1: 0.6020
 epoch: 57, train_loss: 0.8095, test_loss: 0.8314, test_f1: 0.5989
 epoch: 58, train_loss: 0.8099, test_loss: 0.8711, test_f1: 0.5656
 epoch: 59, train_loss: 0.8077, test_loss: 0.8603, test_f1: 0.5916
 epoch: 60, train_loss: 0.8082, test_loss: 0.8962, test_f1: 0.5682
 epoch: 61, train_loss: 0.8006, test_loss: 0.8582, test_f1: 0.5809
 epoch: 62, train_loss: 0.7984, test_loss: 0.8540, test_f1: 0.5709
 epoch: 63, train_loss: 0.8050, test_loss: 0.8762, test_f1: 0.5751
 epoch: 64, train_loss: 0.8253, test_loss: 0.8810, test_f1: 0.5720
 epoch: 65, train_loss: 0.8021, test_loss: 0.8738, test_f1: 0.5932
 epoch: 66, train_loss: 0.8016, test_loss: 0.8758, test_f1: 0.5951
 epoch: 67, train_loss: 0.8011, test_loss: 0.8480, test_f1: 0.5790
 epoch: 68, train_loss: 0.7909, test_loss: 0.8428, test_f1: 0.5825
 epoch: 69, train_loss: 0.7874, test_loss: 0.8395, test_f1: 0.5784
 epoch: 70, train_loss: 0.8044, test_loss: 0.8372, test_f1: 0.6230
 epoch: 71, train_loss: 0.7975, test_loss: 0.8449, test_f1: 0.5878
 epoch: 72, train_loss: 0.7986, test_loss: 0.8514, test_f1: 0.5840
 epoch: 73, train_loss: 0.7942, test_loss: 0.8401, test_f1: 0.6433
 epoch: 74, train_loss: 0.8017, test_loss: 0.8774, test_f1: 0.5884
 epoch: 75, train_loss: 0.8110, test_loss: 0.8734, test_f1: 0.6063
 epoch: 76, train_loss: 0.7880, test_loss: 0.8845, test_f1: 0.5799
 epoch: 77, train_loss: 0.7937, test_loss: 0.9156, test_f1: 0.5489
 epoch: 78, train_loss: 0.8013, test_loss: 0.8509, test_f1: 0.5960
 epoch: 79, train_loss: 0.7922, test_loss: 0.8323, test_f1: 0.6059
 epoch: 80, train_loss: 0.8042, test_loss: 0.8640, test_f1: 0.5877
 epoch: 81, train_loss: 0.7877, test_loss: 0.8377, test_f1: 0.5941
 epoch: 82, train_loss: 0.7996, test_loss: 0.8768, test_f1: 0.5849
 epoch: 83, train_loss: 0.8025, test_loss: 0.8477, test_f1: 0.6036
 epoch: 84, train_loss: 0.8149, test_loss: 0.8734, test_f1: 0.5761
 epoch: 85, train_loss: 0.8104, test_loss: 0.8739, test_f1: 0.5668
 epoch: 86, train_loss: 0.7800, test_loss: 0.8263, test_f1: 0.6103
 epoch: 87, train_loss: 0.7787, test_loss: 0.8595, test_f1: 0.5890
 epoch: 88, train_loss: 0.8000, test_loss: 0.9075, test_f1: 0.5476
 epoch: 89, train_loss: 0.8299, test_loss: 0.8541, test_f1: 0.6113
 epoch: 90, train_loss: 0.7991, test_loss: 0.8613, test_f1: 0.5894
 epoch: 91, train_loss: 0.7931, test_loss: 0.8773, test_f1: 0.5931
 epoch: 92, train_loss: 0.7842, test_loss: 0.8566, test_f1: 0.5893
 epoch: 93, train_loss: 0.7925, test_loss: 0.8784, test_f1: 0.6153
 epoch: 94, train_loss: 0.7814, test_loss: 0.8424, test_f1: 0.5995
 epoch: 95, train_loss: 0.7688, test_loss: 0.8506, test_f1: 0.5800
 epoch: 96, train_loss: 0.7742, test_loss: 0.8409, test_f1: 0.6236
 epoch: 97, train_loss: 0.7914, test_loss: 0.8592, test_f1: 0.6043
 epoch: 98, train_loss: 0.7784, test_loss: 0.8453, test_f1: 0.5899
 epoch: 99, train_loss: 0.7808, test_loss: 0.8802, test_f1: 0.5889
##################ITERATION #4 ****************************************
 epoch: 0, train_loss: 1.1189, test_loss: 1.0336, test_f1: 0.5106
 epoch: 1, train_loss: 1.0161, test_loss: 1.0420, test_f1: 0.4622
 epoch: 2, train_loss: 1.0084, test_loss: 1.0286, test_f1: 0.4791
 epoch: 3, train_loss: 0.9897, test_loss: 1.0187, test_f1: 0.4871
 epoch: 4, train_loss: 0.9759, test_loss: 0.9943, test_f1: 0.4821
 epoch: 5, train_loss: 0.9660, test_loss: 1.0021, test_f1: 0.4694
 epoch: 6, train_loss: 0.9710, test_loss: 0.9864, test_f1: 0.5288
 epoch: 7, train_loss: 0.9607, test_loss: 1.0313, test_f1: 0.4691
 epoch: 8, train_loss: 0.9560, test_loss: 0.9679, test_f1: 0.4569
 epoch: 9, train_loss: 0.9466, test_loss: 0.9919, test_f1: 0.4837
 epoch: 10, train_loss: 0.9290, test_loss: 1.0709, test_f1: 0.4819
 epoch: 11, train_loss: 0.9275, test_loss: 0.9197, test_f1: 0.5260
 epoch: 12, train_loss: 0.9249, test_loss: 0.9891, test_f1: 0.5083
 epoch: 13, train_loss: 0.9257, test_loss: 0.8974, test_f1: 0.5455
 epoch: 14, train_loss: 0.9183, test_loss: 0.9519, test_f1: 0.5324
 epoch: 15, train_loss: 0.9126, test_loss: 0.9909, test_f1: 0.4667
 epoch: 16, train_loss: 0.9048, test_loss: 1.3003, test_f1: 0.4549
 epoch: 17, train_loss: 0.9335, test_loss: 0.9199, test_f1: 0.4710
 epoch: 18, train_loss: 0.9036, test_loss: 0.9382, test_f1: 0.5134
 epoch: 19, train_loss: 0.9111, test_loss: 0.9195, test_f1: 0.5013
 epoch: 20, train_loss: 0.9192, test_loss: 0.9481, test_f1: 0.5515
 epoch: 21, train_loss: 0.8886, test_loss: 0.9181, test_f1: 0.5032
 epoch: 22, train_loss: 0.9131, test_loss: 0.9660, test_f1: 0.5874
 epoch: 23, train_loss: 0.8740, test_loss: 0.9857, test_f1: 0.5467
 epoch: 24, train_loss: 0.9016, test_loss: 0.9478, test_f1: 0.5186
 epoch: 25, train_loss: 0.8755, test_loss: 0.9019, test_f1: 0.5144
 epoch: 26, train_loss: 0.8741, test_loss: 0.8980, test_f1: 0.5560
 epoch: 27, train_loss: 0.8614, test_loss: 1.0050, test_f1: 0.5076
 epoch: 28, train_loss: 0.8748, test_loss: 0.9246, test_f1: 0.5777
 epoch: 29, train_loss: 0.8645, test_loss: 0.8951, test_f1: 0.6265
 epoch: 30, train_loss: 0.8672, test_loss: 1.1188, test_f1: 0.5090
 epoch: 31, train_loss: 0.8670, test_loss: 0.8818, test_f1: 0.5523
 epoch: 32, train_loss: 0.8563, test_loss: 0.8779, test_f1: 0.5255
 epoch: 33, train_loss: 0.8624, test_loss: 0.8964, test_f1: 0.5204
 epoch: 34, train_loss: 0.8573, test_loss: 0.9075, test_f1: 0.5249
 epoch: 35, train_loss: 0.8539, test_loss: 0.9249, test_f1: 0.5313
 epoch: 36, train_loss: 0.8515, test_loss: 0.8848, test_f1: 0.5295
 epoch: 37, train_loss: 0.8512, test_loss: 0.8898, test_f1: 0.5490
 epoch: 38, train_loss: 0.8422, test_loss: 0.9388, test_f1: 0.5146
 epoch: 39, train_loss: 0.8438, test_loss: 0.8747, test_f1: 0.6177
 epoch: 40, train_loss: 0.8497, test_loss: 0.8722, test_f1: 0.6246
 epoch: 41, train_loss: 0.8351, test_loss: 0.8881, test_f1: 0.6326
 epoch: 42, train_loss: 0.8512, test_loss: 0.9185, test_f1: 0.5246
 epoch: 43, train_loss: 0.8294, test_loss: 0.9397, test_f1: 0.5217
 epoch: 44, train_loss: 0.8231, test_loss: 0.8951, test_f1: 0.5980
 epoch: 45, train_loss: 0.8262, test_loss: 0.9001, test_f1: 0.5486
 epoch: 46, train_loss: 0.8269, test_loss: 0.9082, test_f1: 0.5360
 epoch: 47, train_loss: 0.8063, test_loss: 0.9961, test_f1: 0.5568
 epoch: 48, train_loss: 0.8060, test_loss: 0.8795, test_f1: 0.6089
 epoch: 49, train_loss: 0.8263, test_loss: 0.8526, test_f1: 0.5333
 epoch: 50, train_loss: 0.8227, test_loss: 0.9245, test_f1: 0.5682
 epoch: 51, train_loss: 0.8036, test_loss: 0.8517, test_f1: 0.5563
 epoch: 52, train_loss: 0.7988, test_loss: 0.8509, test_f1: 0.5478
 epoch: 53, train_loss: 0.7755, test_loss: 0.8769, test_f1: 0.5379
 epoch: 54, train_loss: 0.7909, test_loss: 0.8799, test_f1: 0.5306
 epoch: 55, train_loss: 0.7706, test_loss: 0.8730, test_f1: 0.5535
 epoch: 56, train_loss: 0.7770, test_loss: 0.8516, test_f1: 0.5913
 epoch: 57, train_loss: 0.7677, test_loss: 0.8820, test_f1: 0.6470
 epoch: 58, train_loss: 0.7792, test_loss: 0.9097, test_f1: 0.5436
 epoch: 59, train_loss: 0.7651, test_loss: 0.8799, test_f1: 0.5872
 epoch: 60, train_loss: 0.7693, test_loss: 0.8511, test_f1: 0.5775
 epoch: 61, train_loss: 0.7646, test_loss: 0.8550, test_f1: 0.6456
 epoch: 62, train_loss: 0.7777, test_loss: 0.8898, test_f1: 0.5507
 epoch: 63, train_loss: 0.7716, test_loss: 0.8539, test_f1: 0.6284
 epoch: 64, train_loss: 0.7710, test_loss: 0.8594, test_f1: 0.6374
 epoch: 65, train_loss: 0.7747, test_loss: 0.8565, test_f1: 0.5608
 epoch: 66, train_loss: 0.7626, test_loss: 0.8419, test_f1: 0.5511
 epoch: 67, train_loss: 0.7517, test_loss: 0.8362, test_f1: 0.5621
 epoch: 68, train_loss: 0.7540, test_loss: 0.8160, test_f1: 0.5535
 epoch: 69, train_loss: 0.7677, test_loss: 0.8328, test_f1: 0.5736
 epoch: 70, train_loss: 0.7697, test_loss: 0.8453, test_f1: 0.5978
 epoch: 71, train_loss: 0.7676, test_loss: 0.8192, test_f1: 0.5828
 epoch: 72, train_loss: 0.7548, test_loss: 0.8202, test_f1: 0.6566
 epoch: 73, train_loss: 0.7630, test_loss: 0.8802, test_f1: 0.5569
 epoch: 74, train_loss: 0.7498, test_loss: 0.8121, test_f1: 0.6107
 epoch: 75, train_loss: 0.7470, test_loss: 0.8637, test_f1: 0.5883
 epoch: 76, train_loss: 0.7690, test_loss: 0.8559, test_f1: 0.6190
 epoch: 77, train_loss: 0.7576, test_loss: 0.7920, test_f1: 0.5807
 epoch: 78, train_loss: 0.7569, test_loss: 0.8080, test_f1: 0.6034
 epoch: 79, train_loss: 0.7655, test_loss: 0.8223, test_f1: 0.6011
 epoch: 80, train_loss: 0.7436, test_loss: 0.8627, test_f1: 0.5598
 epoch: 81, train_loss: 0.7472, test_loss: 0.8531, test_f1: 0.6520
 epoch: 82, train_loss: 0.7387, test_loss: 0.8664, test_f1: 0.5703
 epoch: 83, train_loss: 0.7502, test_loss: 0.8367, test_f1: 0.5631
 epoch: 84, train_loss: 0.7433, test_loss: 0.8120, test_f1: 0.6215
 epoch: 85, train_loss: 0.7478, test_loss: 0.8519, test_f1: 0.6263
 epoch: 86, train_loss: 0.7629, test_loss: 0.8476, test_f1: 0.5610
 epoch: 87, train_loss: 0.7320, test_loss: 0.8501, test_f1: 0.6041
 epoch: 88, train_loss: 0.7468, test_loss: 0.8479, test_f1: 0.6511
 epoch: 89, train_loss: 0.7496, test_loss: 0.8220, test_f1: 0.6391
 epoch: 90, train_loss: 0.7362, test_loss: 0.8502, test_f1: 0.6429
 epoch: 91, train_loss: 0.7289, test_loss: 0.8568, test_f1: 0.5916
 epoch: 92, train_loss: 0.7479, test_loss: 0.8761, test_f1: 0.5796
 epoch: 93, train_loss: 0.7500, test_loss: 0.8492, test_f1: 0.6194
 epoch: 94, train_loss: 0.7386, test_loss: 0.8536, test_f1: 0.6077
 epoch: 95, train_loss: 0.7550, test_loss: 0.8413, test_f1: 0.6355
 epoch: 96, train_loss: 0.7474, test_loss: 0.9710, test_f1: 0.5847
 epoch: 97, train_loss: 0.7288, test_loss: 0.8628, test_f1: 0.6008
 epoch: 98, train_loss: 0.7307, test_loss: 0.8503, test_f1: 0.6226
 epoch: 99, train_loss: 0.7336, test_loss: 0.8652, test_f1: 0.6367
##################ITERATION #5 ****************************************
 epoch: 0, train_loss: 1.1727, test_loss: 1.1217, test_f1: 0.3876
 epoch: 1, train_loss: 1.0421, test_loss: 1.0836, test_f1: 0.4349
 epoch: 2, train_loss: 1.0013, test_loss: 0.9947, test_f1: 0.4787
 epoch: 3, train_loss: 0.9921, test_loss: 1.0804, test_f1: 0.4500
 epoch: 4, train_loss: 0.9931, test_loss: 1.0409, test_f1: 0.4738
 epoch: 5, train_loss: 0.9709, test_loss: 1.4688, test_f1: 0.3487
 epoch: 6, train_loss: 0.9937, test_loss: 1.0362, test_f1: 0.4929
 epoch: 7, train_loss: 0.9633, test_loss: 1.0000, test_f1: 0.4812
 epoch: 8, train_loss: 0.9556, test_loss: 1.0164, test_f1: 0.4901
 epoch: 9, train_loss: 0.9421, test_loss: 0.9824, test_f1: 0.5091
 epoch: 10, train_loss: 0.9294, test_loss: 0.9797, test_f1: 0.4978
 epoch: 11, train_loss: 0.9333, test_loss: 1.0228, test_f1: 0.5139
 epoch: 12, train_loss: 0.9336, test_loss: 0.9550, test_f1: 0.4944
 epoch: 13, train_loss: 0.9549, test_loss: 0.9447, test_f1: 0.5291
 epoch: 14, train_loss: 0.9352, test_loss: 1.1083, test_f1: 0.4560
 epoch: 15, train_loss: 0.9313, test_loss: 0.9398, test_f1: 0.5710
 epoch: 16, train_loss: 0.9069, test_loss: 0.9459, test_f1: 0.5306
 epoch: 17, train_loss: 0.9154, test_loss: 0.9610, test_f1: 0.5121
 epoch: 18, train_loss: 0.9023, test_loss: 0.8576, test_f1: 0.5266
 epoch: 19, train_loss: 0.9077, test_loss: 0.9101, test_f1: 0.5429
 epoch: 20, train_loss: 0.8886, test_loss: 0.8982, test_f1: 0.5172
 epoch: 21, train_loss: 0.9098, test_loss: 0.9167, test_f1: 0.4922
 epoch: 22, train_loss: 0.9027, test_loss: 0.8585, test_f1: 0.5351
 epoch: 23, train_loss: 0.9029, test_loss: 0.8438, test_f1: 0.5296
 epoch: 24, train_loss: 0.9057, test_loss: 0.8903, test_f1: 0.5432
 epoch: 25, train_loss: 0.8973, test_loss: 0.8683, test_f1: 0.5551
 epoch: 26, train_loss: 0.8982, test_loss: 1.0930, test_f1: 0.4750
 epoch: 27, train_loss: 0.8953, test_loss: 0.9012, test_f1: 0.5764
 epoch: 28, train_loss: 0.8893, test_loss: 0.9513, test_f1: 0.4802
 epoch: 29, train_loss: 0.8778, test_loss: 0.9064, test_f1: 0.5279
 epoch: 30, train_loss: 0.8656, test_loss: 0.8834, test_f1: 0.5340
 epoch: 31, train_loss: 0.8679, test_loss: 0.8829, test_f1: 0.5813
 epoch: 32, train_loss: 0.8767, test_loss: 0.9531, test_f1: 0.5275
 epoch: 33, train_loss: 0.8794, test_loss: 0.8777, test_f1: 0.5568
 epoch: 34, train_loss: 0.8762, test_loss: 0.9115, test_f1: 0.5179
 epoch: 35, train_loss: 0.8714, test_loss: 0.9255, test_f1: 0.5284
 epoch: 36, train_loss: 0.9139, test_loss: 0.9551, test_f1: 0.5159
 epoch: 37, train_loss: 0.8682, test_loss: 0.8574, test_f1: 0.5274
 epoch: 38, train_loss: 0.8606, test_loss: 0.8653, test_f1: 0.5496
 epoch: 39, train_loss: 0.8605, test_loss: 0.9134, test_f1: 0.5193
 epoch: 40, train_loss: 0.8585, test_loss: 0.8858, test_f1: 0.5557
 epoch: 41, train_loss: 0.8617, test_loss: 0.8444, test_f1: 0.5560
 epoch: 42, train_loss: 0.8560, test_loss: 0.8369, test_f1: 0.5506
 epoch: 43, train_loss: 0.8530, test_loss: 0.8633, test_f1: 0.5972
 epoch: 44, train_loss: 0.8658, test_loss: 0.8932, test_f1: 0.5362
 epoch: 45, train_loss: 0.8798, test_loss: 0.8530, test_f1: 0.5463
 epoch: 46, train_loss: 0.8526, test_loss: 0.8400, test_f1: 0.5615
 epoch: 47, train_loss: 0.8408, test_loss: 0.8328, test_f1: 0.5586
 epoch: 48, train_loss: 0.8442, test_loss: 0.9721, test_f1: 0.5121
 epoch: 49, train_loss: 0.8650, test_loss: 0.8833, test_f1: 0.5697
 epoch: 50, train_loss: 0.8513, test_loss: 0.8520, test_f1: 0.5898
 epoch: 51, train_loss: 0.8298, test_loss: 0.8256, test_f1: 0.5817
 epoch: 52, train_loss: 0.8228, test_loss: 0.8544, test_f1: 0.5709
 epoch: 53, train_loss: 0.8263, test_loss: 0.8719, test_f1: 0.5595
 epoch: 54, train_loss: 0.8219, test_loss: 0.8304, test_f1: 0.5743
 epoch: 55, train_loss: 0.8295, test_loss: 0.8254, test_f1: 0.5715
 epoch: 56, train_loss: 0.8053, test_loss: 0.8341, test_f1: 0.5576
 epoch: 57, train_loss: 0.8060, test_loss: 0.8410, test_f1: 0.5630
 epoch: 58, train_loss: 0.8105, test_loss: 0.8467, test_f1: 0.5583
 epoch: 59, train_loss: 0.8155, test_loss: 0.8110, test_f1: 0.5560
 epoch: 60, train_loss: 0.8056, test_loss: 0.8584, test_f1: 0.5584
 epoch: 61, train_loss: 0.8060, test_loss: 0.8849, test_f1: 0.5655
 epoch: 62, train_loss: 0.8782, test_loss: 0.8583, test_f1: 0.5424
 epoch: 63, train_loss: 0.8196, test_loss: 0.8403, test_f1: 0.5747
 epoch: 64, train_loss: 0.8058, test_loss: 0.8340, test_f1: 0.5633
 epoch: 65, train_loss: 0.8059, test_loss: 0.8439, test_f1: 0.5724
 epoch: 66, train_loss: 0.8065, test_loss: 0.7735, test_f1: 0.5872
 epoch: 67, train_loss: 0.8075, test_loss: 0.8358, test_f1: 0.6049
 epoch: 68, train_loss: 0.7976, test_loss: 0.8630, test_f1: 0.5683
 epoch: 69, train_loss: 0.7986, test_loss: 0.8735, test_f1: 0.5704
 epoch: 70, train_loss: 0.8208, test_loss: 0.8018, test_f1: 0.5844
 epoch: 71, train_loss: 0.7983, test_loss: 0.7955, test_f1: 0.6310
 epoch: 72, train_loss: 0.7905, test_loss: 0.7998, test_f1: 0.5849
 epoch: 73, train_loss: 0.7905, test_loss: 0.8169, test_f1: 0.5751
 epoch: 74, train_loss: 0.7956, test_loss: 0.7975, test_f1: 0.5829
 epoch: 75, train_loss: 0.7866, test_loss: 0.8086, test_f1: 0.6083
 epoch: 76, train_loss: 0.7987, test_loss: 0.8205, test_f1: 0.6067
 epoch: 77, train_loss: 0.8002, test_loss: 0.8563, test_f1: 0.5795
 epoch: 78, train_loss: 0.8063, test_loss: 0.8516, test_f1: 0.5814
 epoch: 79, train_loss: 0.7899, test_loss: 0.8552, test_f1: 0.6194
 epoch: 80, train_loss: 0.7955, test_loss: 0.8389, test_f1: 0.6104
 epoch: 81, train_loss: 0.8033, test_loss: 0.8345, test_f1: 0.6012
 epoch: 82, train_loss: 0.7855, test_loss: 0.8300, test_f1: 0.5867
 epoch: 83, train_loss: 0.7953, test_loss: 0.9473, test_f1: 0.5774
 epoch: 84, train_loss: 0.7904, test_loss: 0.8121, test_f1: 0.5793
 epoch: 85, train_loss: 0.7952, test_loss: 0.8123, test_f1: 0.5955
 epoch: 86, train_loss: 0.7883, test_loss: 0.7868, test_f1: 0.5989
 epoch: 87, train_loss: 0.7822, test_loss: 0.7903, test_f1: 0.5851
 epoch: 88, train_loss: 0.7706, test_loss: 0.8321, test_f1: 0.5953
 epoch: 89, train_loss: 0.7779, test_loss: 0.8011, test_f1: 0.6032
 epoch: 90, train_loss: 0.7635, test_loss: 0.7866, test_f1: 0.6234
 epoch: 91, train_loss: 0.7838, test_loss: 0.8375, test_f1: 0.5884
 epoch: 92, train_loss: 0.7881, test_loss: 0.8649, test_f1: 0.5678
 epoch: 93, train_loss: 0.7753, test_loss: 0.8362, test_f1: 0.5736
 epoch: 94, train_loss: 0.7834, test_loss: 0.8404, test_f1: 0.5982
 epoch: 95, train_loss: 0.7869, test_loss: 0.8567, test_f1: 0.5944
 epoch: 96, train_loss: 0.7850, test_loss: 0.8328, test_f1: 0.5950
 epoch: 97, train_loss: 0.7872, test_loss: 0.8987, test_f1: 0.6005
 epoch: 98, train_loss: 0.7749, test_loss: 0.8486, test_f1: 0.5847
 epoch: 99, train_loss: 0.7734, test_loss: 0.8912, test_f1: 0.6108
##################ITERATION #6 ****************************************
 epoch: 0, train_loss: 1.1110, test_loss: 1.0207, test_f1: 0.4639
 epoch: 1, train_loss: 1.0231, test_loss: 0.9772, test_f1: 0.4614
 epoch: 2, train_loss: 1.0138, test_loss: 1.0251, test_f1: 0.4465
 epoch: 3, train_loss: 0.9874, test_loss: 1.0298, test_f1: 0.4698
 epoch: 4, train_loss: 0.9776, test_loss: 0.9963, test_f1: 0.4971
 epoch: 5, train_loss: 0.9708, test_loss: 1.0151, test_f1: 0.4385
 epoch: 6, train_loss: 0.9686, test_loss: 0.9402, test_f1: 0.4866
 epoch: 7, train_loss: 0.9724, test_loss: 0.9740, test_f1: 0.4974
 epoch: 8, train_loss: 0.9532, test_loss: 0.9263, test_f1: 0.5048
 epoch: 9, train_loss: 0.9457, test_loss: 0.9320, test_f1: 0.4926
 epoch: 10, train_loss: 0.9467, test_loss: 0.9319, test_f1: 0.5766
 epoch: 11, train_loss: 0.9257, test_loss: 0.9943, test_f1: 0.4987
 epoch: 12, train_loss: 0.9417, test_loss: 0.9388, test_f1: 0.5065
 epoch: 13, train_loss: 0.9313, test_loss: 0.9506, test_f1: 0.4958
 epoch: 14, train_loss: 0.9387, test_loss: 0.9213, test_f1: 0.5415
 epoch: 15, train_loss: 0.9264, test_loss: 0.9429, test_f1: 0.4927
 epoch: 16, train_loss: 0.9199, test_loss: 0.8793, test_f1: 0.5345
 epoch: 17, train_loss: 0.9172, test_loss: 1.0472, test_f1: 0.3923
 epoch: 18, train_loss: 0.9246, test_loss: 0.9686, test_f1: 0.5056
 epoch: 19, train_loss: 0.9198, test_loss: 0.9492, test_f1: 0.4845
 epoch: 20, train_loss: 0.9183, test_loss: 0.9465, test_f1: 0.5109
 epoch: 21, train_loss: 0.9046, test_loss: 0.9373, test_f1: 0.5457
 epoch: 22, train_loss: 0.9109, test_loss: 0.9048, test_f1: 0.5956
 epoch: 23, train_loss: 0.8980, test_loss: 0.8703, test_f1: 0.5651
 epoch: 24, train_loss: 0.8989, test_loss: 1.3223, test_f1: 0.5107
 epoch: 25, train_loss: 0.8967, test_loss: 0.9361, test_f1: 0.5175
 epoch: 26, train_loss: 0.8897, test_loss: 0.9461, test_f1: 0.4978
 epoch: 27, train_loss: 0.8913, test_loss: 0.9206, test_f1: 0.5790
 epoch: 28, train_loss: 0.8719, test_loss: 0.9199, test_f1: 0.5282
 epoch: 29, train_loss: 0.8754, test_loss: 0.9553, test_f1: 0.5354
 epoch: 30, train_loss: 0.8614, test_loss: 0.9920, test_f1: 0.5413
 epoch: 31, train_loss: 0.8605, test_loss: 0.9012, test_f1: 0.5158
 epoch: 32, train_loss: 0.8745, test_loss: 0.8983, test_f1: 0.5333
 epoch: 33, train_loss: 0.8690, test_loss: 0.9103, test_f1: 0.5243
 epoch: 34, train_loss: 0.8703, test_loss: 0.9165, test_f1: 0.5500
 epoch: 35, train_loss: 0.8609, test_loss: 0.9390, test_f1: 0.5268
 epoch: 36, train_loss: 0.8674, test_loss: 0.8799, test_f1: 0.5462
 epoch: 37, train_loss: 0.8654, test_loss: 1.0016, test_f1: 0.5008
 epoch: 38, train_loss: 0.8883, test_loss: 0.9284, test_f1: 0.5179
 epoch: 39, train_loss: 0.8721, test_loss: 0.9228, test_f1: 0.5293
 epoch: 40, train_loss: 0.8572, test_loss: 0.8703, test_f1: 0.5459
 epoch: 41, train_loss: 0.8537, test_loss: 0.8673, test_f1: 0.5720
 epoch: 42, train_loss: 0.8514, test_loss: 0.8870, test_f1: 0.5462
 epoch: 43, train_loss: 0.8368, test_loss: 0.8834, test_f1: 0.5782
 epoch: 44, train_loss: 0.8555, test_loss: 0.9281, test_f1: 0.5293
 epoch: 45, train_loss: 0.8443, test_loss: 0.8725, test_f1: 0.5487
 epoch: 46, train_loss: 0.8389, test_loss: 0.9038, test_f1: 0.5200
 epoch: 47, train_loss: 0.8424, test_loss: 0.8380, test_f1: 0.5784
 epoch: 48, train_loss: 0.8401, test_loss: 0.8699, test_f1: 0.5816
 epoch: 49, train_loss: 0.8296, test_loss: 0.8518, test_f1: 0.6088
 epoch: 50, train_loss: 0.8254, test_loss: 0.9276, test_f1: 0.5777
 epoch: 51, train_loss: 0.8120, test_loss: 0.8783, test_f1: 0.5404
 epoch: 52, train_loss: 0.8040, test_loss: 0.8541, test_f1: 0.5963
 epoch: 53, train_loss: 0.8024, test_loss: 0.8504, test_f1: 0.5948
 epoch: 54, train_loss: 0.7933, test_loss: 0.9071, test_f1: 0.5872
 epoch: 55, train_loss: 0.7925, test_loss: 0.8342, test_f1: 0.5982
 epoch: 56, train_loss: 0.7980, test_loss: 0.8370, test_f1: 0.6320
 epoch: 57, train_loss: 0.7853, test_loss: 0.8600, test_f1: 0.6146
 epoch: 58, train_loss: 0.7833, test_loss: 0.8382, test_f1: 0.5935
 epoch: 59, train_loss: 0.7923, test_loss: 0.8573, test_f1: 0.5987
 epoch: 60, train_loss: 0.7772, test_loss: 0.8302, test_f1: 0.5989
 epoch: 61, train_loss: 0.7809, test_loss: 0.8577, test_f1: 0.6009
 epoch: 62, train_loss: 0.7758, test_loss: 0.8311, test_f1: 0.6043
 epoch: 63, train_loss: 0.7784, test_loss: 0.8231, test_f1: 0.6196
 epoch: 64, train_loss: 0.7805, test_loss: 0.8198, test_f1: 0.6075
 epoch: 65, train_loss: 0.7755, test_loss: 0.8019, test_f1: 0.6154
 epoch: 66, train_loss: 0.7666, test_loss: 0.8151, test_f1: 0.5873
 epoch: 67, train_loss: 0.7855, test_loss: 0.8314, test_f1: 0.5803
 epoch: 68, train_loss: 0.7680, test_loss: 0.8208, test_f1: 0.5903
 epoch: 69, train_loss: 0.7782, test_loss: 0.8302, test_f1: 0.5751
 epoch: 70, train_loss: 0.7665, test_loss: 0.8291, test_f1: 0.6377
 epoch: 71, train_loss: 0.7648, test_loss: 0.8222, test_f1: 0.5916
 epoch: 72, train_loss: 0.7787, test_loss: 0.8020, test_f1: 0.5829
 epoch: 73, train_loss: 0.7581, test_loss: 0.8276, test_f1: 0.6011
 epoch: 74, train_loss: 0.7633, test_loss: 0.8369, test_f1: 0.5942
 epoch: 75, train_loss: 0.7540, test_loss: 0.8500, test_f1: 0.5761
 epoch: 76, train_loss: 0.7655, test_loss: 0.8337, test_f1: 0.6048
 epoch: 77, train_loss: 0.7635, test_loss: 0.8634, test_f1: 0.5837
 epoch: 78, train_loss: 0.7673, test_loss: 0.8367, test_f1: 0.6204
 epoch: 79, train_loss: 0.7557, test_loss: 0.8378, test_f1: 0.6223
 epoch: 80, train_loss: 0.7552, test_loss: 0.8760, test_f1: 0.5734
 epoch: 81, train_loss: 0.7451, test_loss: 0.8236, test_f1: 0.6004
 epoch: 82, train_loss: 0.7462, test_loss: 0.8287, test_f1: 0.6232
 epoch: 83, train_loss: 0.7616, test_loss: 0.8120, test_f1: 0.6121
 epoch: 84, train_loss: 0.7538, test_loss: 0.8148, test_f1: 0.5825
 epoch: 85, train_loss: 0.7452, test_loss: 0.8555, test_f1: 0.6046
 epoch: 86, train_loss: 0.7483, test_loss: 0.8575, test_f1: 0.6057
 epoch: 87, train_loss: 0.7391, test_loss: 0.8530, test_f1: 0.6126
 epoch: 88, train_loss: 0.7634, test_loss: 0.9001, test_f1: 0.5746
 epoch: 89, train_loss: 0.7519, test_loss: 0.8405, test_f1: 0.6159
 epoch: 90, train_loss: 0.7371, test_loss: 0.8466, test_f1: 0.6007
 epoch: 91, train_loss: 0.7554, test_loss: 0.8228, test_f1: 0.6355
 epoch: 92, train_loss: 0.7473, test_loss: 0.8436, test_f1: 0.6179
 epoch: 93, train_loss: 0.7399, test_loss: 0.8446, test_f1: 0.5752
 epoch: 94, train_loss: 0.7464, test_loss: 0.8132, test_f1: 0.6031
 epoch: 95, train_loss: 0.7302, test_loss: 0.8132, test_f1: 0.6208
 epoch: 96, train_loss: 0.7533, test_loss: 0.8373, test_f1: 0.6053
 epoch: 97, train_loss: 0.7366, test_loss: 0.8401, test_f1: 0.6298
 epoch: 98, train_loss: 0.7303, test_loss: 0.8580, test_f1: 0.6199
 epoch: 99, train_loss: 0.7209, test_loss: 0.8418, test_f1: 0.6154
##################ITERATION #7 ****************************************
 epoch: 0, train_loss: 1.1359, test_loss: 1.0508, test_f1: 0.4349
 epoch: 1, train_loss: 1.0235, test_loss: 1.0385, test_f1: 0.4497
 epoch: 2, train_loss: 1.0011, test_loss: 1.0444, test_f1: 0.4903
 epoch: 3, train_loss: 0.9929, test_loss: 1.0313, test_f1: 0.4377
 epoch: 4, train_loss: 0.9892, test_loss: 1.0264, test_f1: 0.4772
 epoch: 5, train_loss: 0.9792, test_loss: 1.0604, test_f1: 0.4567
 epoch: 6, train_loss: 0.9692, test_loss: 0.9910, test_f1: 0.4929
 epoch: 7, train_loss: 0.9632, test_loss: 1.0166, test_f1: 0.4839
 epoch: 8, train_loss: 0.9535, test_loss: 0.9949, test_f1: 0.4608
 epoch: 9, train_loss: 0.9518, test_loss: 1.0233, test_f1: 0.4878
 epoch: 10, train_loss: 0.9528, test_loss: 0.9623, test_f1: 0.5091
 epoch: 11, train_loss: 0.9441, test_loss: 1.0115, test_f1: 0.4908
 epoch: 12, train_loss: 0.9224, test_loss: 0.9157, test_f1: 0.5165
 epoch: 13, train_loss: 0.9290, test_loss: 0.9281, test_f1: 0.5202
 epoch: 14, train_loss: 0.9385, test_loss: 0.9591, test_f1: 0.4957
 epoch: 15, train_loss: 0.9112, test_loss: 0.9413, test_f1: 0.5508
 epoch: 16, train_loss: 0.9155, test_loss: 1.0215, test_f1: 0.4297
 epoch: 17, train_loss: 0.9074, test_loss: 0.9509, test_f1: 0.5252
 epoch: 18, train_loss: 0.8944, test_loss: 0.9201, test_f1: 0.5091
 epoch: 19, train_loss: 0.8867, test_loss: 0.8700, test_f1: 0.5185
 epoch: 20, train_loss: 0.8997, test_loss: 0.9214, test_f1: 0.5125
 epoch: 21, train_loss: 0.9164, test_loss: 0.9146, test_f1: 0.5263
 epoch: 22, train_loss: 0.9194, test_loss: 0.9325, test_f1: 0.5255
 epoch: 23, train_loss: 0.9169, test_loss: 0.8880, test_f1: 0.5221
 epoch: 24, train_loss: 0.8992, test_loss: 0.8733, test_f1: 0.5108
 epoch: 25, train_loss: 0.8962, test_loss: 0.9608, test_f1: 0.4836
 epoch: 26, train_loss: 0.9069, test_loss: 0.9070, test_f1: 0.4680
 epoch: 27, train_loss: 0.8899, test_loss: 0.8734, test_f1: 0.5491
 epoch: 28, train_loss: 0.8839, test_loss: 0.8661, test_f1: 0.5401
 epoch: 29, train_loss: 0.8815, test_loss: 0.8621, test_f1: 0.5259
 epoch: 30, train_loss: 0.8975, test_loss: 0.8336, test_f1: 0.5873
 epoch: 31, train_loss: 0.8665, test_loss: 0.9048, test_f1: 0.5230
 epoch: 32, train_loss: 0.8744, test_loss: 0.8979, test_f1: 0.5200
 epoch: 33, train_loss: 0.8698, test_loss: 0.8210, test_f1: 0.5162
 epoch: 34, train_loss: 0.8587, test_loss: 0.8387, test_f1: 0.5334
 epoch: 35, train_loss: 0.8813, test_loss: 0.8821, test_f1: 0.5404
 epoch: 36, train_loss: 0.8689, test_loss: 0.8360, test_f1: 0.5520
 epoch: 37, train_loss: 0.8603, test_loss: 0.8558, test_f1: 0.5367
 epoch: 38, train_loss: 0.8686, test_loss: 0.8780, test_f1: 0.5245
 epoch: 39, train_loss: 0.8485, test_loss: 0.8062, test_f1: 0.5659
 epoch: 40, train_loss: 0.8627, test_loss: 0.8924, test_f1: 0.5248
 epoch: 41, train_loss: 0.8522, test_loss: 0.8957, test_f1: 0.5231
 epoch: 42, train_loss: 0.8576, test_loss: 0.8123, test_f1: 0.5723
 epoch: 43, train_loss: 0.8542, test_loss: 0.7782, test_f1: 0.5857
 epoch: 44, train_loss: 0.8433, test_loss: 0.8783, test_f1: 0.5433
 epoch: 45, train_loss: 0.8542, test_loss: 0.8275, test_f1: 0.5299
 epoch: 46, train_loss: 0.8381, test_loss: 0.8049, test_f1: 0.5767
 epoch: 47, train_loss: 0.8409, test_loss: 0.8507, test_f1: 0.5488
 epoch: 48, train_loss: 0.8437, test_loss: 0.8764, test_f1: 0.5353
 epoch: 49, train_loss: 0.8374, test_loss: 0.8627, test_f1: 0.5585
 epoch: 50, train_loss: 0.8381, test_loss: 0.8826, test_f1: 0.5174
 epoch: 51, train_loss: 0.8353, test_loss: 0.7847, test_f1: 0.5524
 epoch: 52, train_loss: 0.8158, test_loss: 0.8139, test_f1: 0.5398
 epoch: 53, train_loss: 0.8165, test_loss: 0.8122, test_f1: 0.5547
 epoch: 54, train_loss: 0.8102, test_loss: 0.7836, test_f1: 0.5548
 epoch: 55, train_loss: 0.8101, test_loss: 0.7952, test_f1: 0.5697
 epoch: 56, train_loss: 0.8093, test_loss: 0.7428, test_f1: 0.5855
 epoch: 57, train_loss: 0.8011, test_loss: 0.7844, test_f1: 0.6031
 epoch: 58, train_loss: 0.7929, test_loss: 0.8455, test_f1: 0.6203
 epoch: 59, train_loss: 0.7957, test_loss: 0.8096, test_f1: 0.5717
 epoch: 60, train_loss: 0.7856, test_loss: 0.7941, test_f1: 0.5910
 epoch: 61, train_loss: 0.7814, test_loss: 0.8586, test_f1: 0.5864
 epoch: 62, train_loss: 0.7798, test_loss: 0.8243, test_f1: 0.5576
 epoch: 63, train_loss: 0.7737, test_loss: 0.8265, test_f1: 0.6083
 epoch: 64, train_loss: 0.7850, test_loss: 0.8623, test_f1: 0.5803
 epoch: 65, train_loss: 0.8096, test_loss: 0.7985, test_f1: 0.5959
 epoch: 66, train_loss: 0.7734, test_loss: 0.7786, test_f1: 0.6031
 epoch: 67, train_loss: 0.7785, test_loss: 0.8074, test_f1: 0.6037
 epoch: 68, train_loss: 0.7777, test_loss: 0.8009, test_f1: 0.5954
 epoch: 69, train_loss: 0.7921, test_loss: 0.8240, test_f1: 0.6373
 epoch: 70, train_loss: 0.7720, test_loss: 0.7918, test_f1: 0.6091
 epoch: 71, train_loss: 0.7723, test_loss: 0.7693, test_f1: 0.5941
 epoch: 72, train_loss: 0.7727, test_loss: 0.8062, test_f1: 0.6168
 epoch: 73, train_loss: 0.7771, test_loss: 0.7678, test_f1: 0.6313
 epoch: 74, train_loss: 0.7759, test_loss: 0.7632, test_f1: 0.6236
 epoch: 75, train_loss: 0.7639, test_loss: 0.7971, test_f1: 0.5789
 epoch: 76, train_loss: 0.7609, test_loss: 0.8120, test_f1: 0.6080
 epoch: 77, train_loss: 0.7625, test_loss: 0.7903, test_f1: 0.6210
 epoch: 78, train_loss: 0.7646, test_loss: 0.8326, test_f1: 0.5752
 epoch: 79, train_loss: 0.7697, test_loss: 0.8076, test_f1: 0.6138
 epoch: 80, train_loss: 0.7603, test_loss: 0.7469, test_f1: 0.6328
 epoch: 81, train_loss: 0.7632, test_loss: 0.7397, test_f1: 0.6464
 epoch: 82, train_loss: 0.7542, test_loss: 0.7959, test_f1: 0.6298
 epoch: 83, train_loss: 0.7697, test_loss: 0.8200, test_f1: 0.6068
 epoch: 84, train_loss: 0.7553, test_loss: 0.8112, test_f1: 0.6417
 epoch: 85, train_loss: 0.7612, test_loss: 0.7913, test_f1: 0.6165
 epoch: 86, train_loss: 0.7385, test_loss: 0.7437, test_f1: 0.6103
 epoch: 87, train_loss: 0.7605, test_loss: 0.8281, test_f1: 0.6275
 epoch: 88, train_loss: 0.7551, test_loss: 0.8039, test_f1: 0.6205
 epoch: 89, train_loss: 0.7477, test_loss: 0.8353, test_f1: 0.6076
 epoch: 90, train_loss: 0.7640, test_loss: 0.7582, test_f1: 0.6463
 epoch: 91, train_loss: 0.7581, test_loss: 0.7749, test_f1: 0.6187
 epoch: 92, train_loss: 0.7465, test_loss: 0.8353, test_f1: 0.5948
 epoch: 93, train_loss: 0.7528, test_loss: 0.7242, test_f1: 0.6438
 epoch: 94, train_loss: 0.7709, test_loss: 0.7994, test_f1: 0.6096
 epoch: 95, train_loss: 0.7538, test_loss: 0.7403, test_f1: 0.6308
 epoch: 96, train_loss: 0.7654, test_loss: 0.7187, test_f1: 0.6423
 epoch: 97, train_loss: 0.7621, test_loss: 0.7984, test_f1: 0.5918
 epoch: 98, train_loss: 0.7497, test_loss: 0.7537, test_f1: 0.6313
 epoch: 99, train_loss: 0.7641, test_loss: 0.7537, test_f1: 0.6355
##################ITERATION #8 ****************************************
 epoch: 0, train_loss: 1.1039, test_loss: 1.2160, test_f1: 0.4088
 epoch: 1, train_loss: 1.0405, test_loss: 1.0367, test_f1: 0.4914
 epoch: 2, train_loss: 0.9993, test_loss: 1.0333, test_f1: 0.4697
 epoch: 3, train_loss: 0.9945, test_loss: 0.9901, test_f1: 0.4897
 epoch: 4, train_loss: 0.9868, test_loss: 0.9538, test_f1: 0.5047
 epoch: 5, train_loss: 0.9682, test_loss: 1.0136, test_f1: 0.5377
 epoch: 6, train_loss: 0.9578, test_loss: 0.9990, test_f1: 0.4760
 epoch: 7, train_loss: 0.9613, test_loss: 1.0344, test_f1: 0.4855
 epoch: 8, train_loss: 0.9461, test_loss: 1.0637, test_f1: 0.4243
 epoch: 9, train_loss: 0.9473, test_loss: 1.0357, test_f1: 0.5299
 epoch: 10, train_loss: 0.9408, test_loss: 1.0012, test_f1: 0.4884
 epoch: 11, train_loss: 0.9296, test_loss: 1.0475, test_f1: 0.5132
 epoch: 12, train_loss: 0.9266, test_loss: 1.0204, test_f1: 0.5020
 epoch: 13, train_loss: 0.9197, test_loss: 1.0450, test_f1: 0.4786
 epoch: 14, train_loss: 0.9123, test_loss: 0.9743, test_f1: 0.5019
 epoch: 15, train_loss: 0.9219, test_loss: 1.0310, test_f1: 0.5414
 epoch: 16, train_loss: 0.9146, test_loss: 1.0123, test_f1: 0.5074
 epoch: 17, train_loss: 0.8951, test_loss: 0.9880, test_f1: 0.5762
 epoch: 18, train_loss: 0.9141, test_loss: 1.0860, test_f1: 0.4887
 epoch: 19, train_loss: 0.9241, test_loss: 1.0661, test_f1: 0.5327
 epoch: 20, train_loss: 0.9129, test_loss: 1.0143, test_f1: 0.5478
 epoch: 21, train_loss: 0.8918, test_loss: 1.0525, test_f1: 0.5204
 epoch: 22, train_loss: 0.8821, test_loss: 0.9867, test_f1: 0.5252
 epoch: 23, train_loss: 0.8894, test_loss: 0.9635, test_f1: 0.5567
 epoch: 24, train_loss: 0.8951, test_loss: 1.0189, test_f1: 0.5304
 epoch: 25, train_loss: 0.8807, test_loss: 0.8789, test_f1: 0.5267
 epoch: 26, train_loss: 0.8840, test_loss: 0.9404, test_f1: 0.5887
 epoch: 27, train_loss: 0.8819, test_loss: 0.9384, test_f1: 0.5367
 epoch: 28, train_loss: 0.8745, test_loss: 0.9793, test_f1: 0.5240
 epoch: 29, train_loss: 0.8718, test_loss: 0.9977, test_f1: 0.5161
 epoch: 30, train_loss: 0.8653, test_loss: 0.9729, test_f1: 0.5339
 epoch: 31, train_loss: 0.8631, test_loss: 0.9847, test_f1: 0.5320
 epoch: 32, train_loss: 0.8783, test_loss: 1.0518, test_f1: 0.4730
 epoch: 33, train_loss: 0.8884, test_loss: 0.8913, test_f1: 0.5536
 epoch: 34, train_loss: 0.8716, test_loss: 0.9489, test_f1: 0.5558
 epoch: 35, train_loss: 0.8804, test_loss: 0.9226, test_f1: 0.5626
 epoch: 36, train_loss: 0.8726, test_loss: 0.8712, test_f1: 0.5533
 epoch: 37, train_loss: 0.8578, test_loss: 0.8934, test_f1: 0.5956
 epoch: 38, train_loss: 0.8486, test_loss: 0.9494, test_f1: 0.5535
 epoch: 39, train_loss: 0.8773, test_loss: 0.9259, test_f1: 0.5260
 epoch: 40, train_loss: 0.8627, test_loss: 0.9278, test_f1: 0.5373
 epoch: 41, train_loss: 0.8464, test_loss: 0.8513, test_f1: 0.5725
 epoch: 42, train_loss: 0.8280, test_loss: 0.9025, test_f1: 0.5931
 epoch: 43, train_loss: 0.8736, test_loss: 0.8919, test_f1: 0.5516
 epoch: 44, train_loss: 0.8494, test_loss: 0.8752, test_f1: 0.5476
 epoch: 45, train_loss: 0.8425, test_loss: 0.8421, test_f1: 0.5560
 epoch: 46, train_loss: 0.8320, test_loss: 0.8896, test_f1: 0.5395
 epoch: 47, train_loss: 0.8335, test_loss: 0.9193, test_f1: 0.5521
 epoch: 48, train_loss: 0.8394, test_loss: 0.8884, test_f1: 0.5989
 epoch: 49, train_loss: 0.8339, test_loss: 0.8977, test_f1: 0.5566
 epoch: 50, train_loss: 0.8401, test_loss: 0.8576, test_f1: 0.6241
 epoch: 51, train_loss: 0.8059, test_loss: 0.8415, test_f1: 0.5898
 epoch: 52, train_loss: 0.8135, test_loss: 0.8904, test_f1: 0.5940
 epoch: 53, train_loss: 0.8018, test_loss: 0.8486, test_f1: 0.5610
 epoch: 54, train_loss: 0.8007, test_loss: 0.8704, test_f1: 0.5900
 epoch: 55, train_loss: 0.7956, test_loss: 0.8661, test_f1: 0.5930
 epoch: 56, train_loss: 0.8112, test_loss: 0.8805, test_f1: 0.5929
 epoch: 57, train_loss: 0.8011, test_loss: 0.8646, test_f1: 0.6039
 epoch: 58, train_loss: 0.7905, test_loss: 0.8372, test_f1: 0.6363
 epoch: 59, train_loss: 0.8042, test_loss: 0.8380, test_f1: 0.5793
 epoch: 60, train_loss: 0.7914, test_loss: 0.8475, test_f1: 0.5826
 epoch: 61, train_loss: 0.8024, test_loss: 0.8366, test_f1: 0.6035
 epoch: 62, train_loss: 0.7856, test_loss: 0.8589, test_f1: 0.6072
 epoch: 63, train_loss: 0.7957, test_loss: 0.8251, test_f1: 0.5818
 epoch: 64, train_loss: 0.7880, test_loss: 0.8458, test_f1: 0.5932
 epoch: 65, train_loss: 0.7990, test_loss: 0.7949, test_f1: 0.6310
 epoch: 66, train_loss: 0.7859, test_loss: 0.8198, test_f1: 0.5715
 epoch: 67, train_loss: 0.7660, test_loss: 0.8315, test_f1: 0.5957
 epoch: 68, train_loss: 0.7669, test_loss: 0.8498, test_f1: 0.6313
 epoch: 69, train_loss: 0.7809, test_loss: 0.8579, test_f1: 0.5732
 epoch: 70, train_loss: 0.7835, test_loss: 0.8485, test_f1: 0.5950
 epoch: 71, train_loss: 0.7766, test_loss: 0.8139, test_f1: 0.6275
 epoch: 72, train_loss: 0.7621, test_loss: 0.8564, test_f1: 0.6020
 epoch: 73, train_loss: 0.7793, test_loss: 0.8325, test_f1: 0.6284
 epoch: 74, train_loss: 0.7751, test_loss: 0.8429, test_f1: 0.5860
 epoch: 75, train_loss: 0.7699, test_loss: 0.8501, test_f1: 0.5973
 epoch: 76, train_loss: 0.7809, test_loss: 0.8796, test_f1: 0.6072
 epoch: 77, train_loss: 0.7557, test_loss: 0.8431, test_f1: 0.6403
 epoch: 78, train_loss: 0.7664, test_loss: 0.8899, test_f1: 0.6419
 epoch: 79, train_loss: 0.7667, test_loss: 0.8892, test_f1: 0.5823
 epoch: 80, train_loss: 0.7676, test_loss: 0.8106, test_f1: 0.6055
 epoch: 81, train_loss: 0.7881, test_loss: 0.8899, test_f1: 0.5870
 epoch: 82, train_loss: 0.7676, test_loss: 0.8369, test_f1: 0.6071
 epoch: 83, train_loss: 0.7724, test_loss: 0.8019, test_f1: 0.5984
 epoch: 84, train_loss: 0.7570, test_loss: 0.8094, test_f1: 0.6071
 epoch: 85, train_loss: 0.7724, test_loss: 0.8138, test_f1: 0.6166
 epoch: 86, train_loss: 0.7613, test_loss: 0.8358, test_f1: 0.6276
 epoch: 87, train_loss: 0.7692, test_loss: 0.8737, test_f1: 0.6260
 epoch: 88, train_loss: 0.7808, test_loss: 0.8204, test_f1: 0.6262
 epoch: 89, train_loss: 0.7607, test_loss: 0.8132, test_f1: 0.6341
 epoch: 90, train_loss: 0.7653, test_loss: 0.8280, test_f1: 0.6088
 epoch: 91, train_loss: 0.7563, test_loss: 0.8214, test_f1: 0.6340
 epoch: 92, train_loss: 0.7590, test_loss: 0.8497, test_f1: 0.6192
 epoch: 93, train_loss: 0.7550, test_loss: 0.8133, test_f1: 0.6344
 epoch: 94, train_loss: 0.7593, test_loss: 0.8262, test_f1: 0.6143
 epoch: 95, train_loss: 0.7653, test_loss: 0.8123, test_f1: 0.6466
 epoch: 96, train_loss: 0.7398, test_loss: 0.7919, test_f1: 0.6208
 epoch: 97, train_loss: 0.7457, test_loss: 0.8112, test_f1: 0.6586
 epoch: 98, train_loss: 0.7469, test_loss: 0.7878, test_f1: 0.6519
 epoch: 99, train_loss: 0.7491, test_loss: 0.8120, test_f1: 0.6248
##################ITERATION #9 ****************************************
 epoch: 0, train_loss: 1.1421, test_loss: 1.5574, test_f1: 0.2409
 epoch: 1, train_loss: 1.0366, test_loss: 1.0574, test_f1: 0.4745
 epoch: 2, train_loss: 1.0121, test_loss: 0.9806, test_f1: 0.4602
 epoch: 3, train_loss: 1.0084, test_loss: 1.0265, test_f1: 0.5163
 epoch: 4, train_loss: 0.9860, test_loss: 0.9752, test_f1: 0.5147
 epoch: 5, train_loss: 0.9816, test_loss: 0.9598, test_f1: 0.5362
 epoch: 6, train_loss: 0.9734, test_loss: 0.9463, test_f1: 0.4980
 epoch: 7, train_loss: 0.9698, test_loss: 0.9536, test_f1: 0.5041
 epoch: 8, train_loss: 0.9698, test_loss: 1.0305, test_f1: 0.4243
 epoch: 9, train_loss: 0.9931, test_loss: 1.0371, test_f1: 0.4844
 epoch: 10, train_loss: 0.9988, test_loss: 1.0447, test_f1: 0.4754
 epoch: 11, train_loss: 0.9807, test_loss: 0.9990, test_f1: 0.5201
 epoch: 12, train_loss: 0.9722, test_loss: 1.0413, test_f1: 0.4892
 epoch: 13, train_loss: 0.9685, test_loss: 0.9929, test_f1: 0.4792
 epoch: 14, train_loss: 0.9577, test_loss: 1.0356, test_f1: 0.4900
 epoch: 15, train_loss: 0.9504, test_loss: 1.0192, test_f1: 0.5381
 epoch: 16, train_loss: 0.9486, test_loss: 0.9951, test_f1: 0.4865
 epoch: 17, train_loss: 0.9429, test_loss: 0.9802, test_f1: 0.4915
 epoch: 18, train_loss: 0.9356, test_loss: 1.0239, test_f1: 0.4478
 epoch: 19, train_loss: 0.9326, test_loss: 0.9547, test_f1: 0.5106
 epoch: 20, train_loss: 0.9260, test_loss: 0.9453, test_f1: 0.5445
 epoch: 21, train_loss: 0.9916, test_loss: 1.0634, test_f1: 0.4516
 epoch: 22, train_loss: 0.9659, test_loss: 0.9616, test_f1: 0.4806
 epoch: 23, train_loss: 0.9580, test_loss: 0.9710, test_f1: 0.5052
 epoch: 24, train_loss: 0.9456, test_loss: 0.9291, test_f1: 0.5584
 epoch: 25, train_loss: 0.9314, test_loss: 0.9973, test_f1: 0.4828
 epoch: 26, train_loss: 0.9443, test_loss: 0.9480, test_f1: 0.5011
 epoch: 27, train_loss: 0.9180, test_loss: 0.9439, test_f1: 0.4950
 epoch: 28, train_loss: 0.9237, test_loss: 0.9475, test_f1: 0.5013
 epoch: 29, train_loss: 0.9454, test_loss: 1.0176, test_f1: 0.4380
 epoch: 30, train_loss: 0.9742, test_loss: 0.9694, test_f1: 0.4953
 epoch: 31, train_loss: 0.9423, test_loss: 0.9493, test_f1: 0.5071
 epoch: 32, train_loss: 0.9324, test_loss: 0.9409, test_f1: 0.4953
 epoch: 33, train_loss: 0.9186, test_loss: 0.8865, test_f1: 0.5104
 epoch: 34, train_loss: 0.9128, test_loss: 0.8980, test_f1: 0.5115
 epoch: 35, train_loss: 0.9394, test_loss: 0.9352, test_f1: 0.5205
 epoch: 36, train_loss: 0.9172, test_loss: 0.9001, test_f1: 0.5304
 epoch: 37, train_loss: 0.9059, test_loss: 0.9481, test_f1: 0.4853
 epoch: 38, train_loss: 0.9031, test_loss: 0.8735, test_f1: 0.5368
 epoch: 39, train_loss: 0.8984, test_loss: 0.8519, test_f1: 0.5366
 epoch: 40, train_loss: 0.8855, test_loss: 0.8766, test_f1: 0.5131
 epoch: 41, train_loss: 0.8884, test_loss: 0.8585, test_f1: 0.5325
 epoch: 42, train_loss: 0.8741, test_loss: 0.8608, test_f1: 0.5218
 epoch: 43, train_loss: 0.8762, test_loss: 0.8752, test_f1: 0.5239
 epoch: 44, train_loss: 0.8715, test_loss: 0.8578, test_f1: 0.5623
 epoch: 45, train_loss: 0.8813, test_loss: 0.8633, test_f1: 0.5288
 epoch: 46, train_loss: 0.8677, test_loss: 0.8762, test_f1: 0.5534
 epoch: 47, train_loss: 0.8738, test_loss: 0.8921, test_f1: 0.5383
 epoch: 48, train_loss: 0.8682, test_loss: 0.8585, test_f1: 0.5452
 epoch: 49, train_loss: 0.8672, test_loss: 0.8570, test_f1: 0.5622
 epoch: 50, train_loss: 0.8839, test_loss: 0.8980, test_f1: 0.5305
 epoch: 51, train_loss: 0.8720, test_loss: 0.8446, test_f1: 0.5548
 epoch: 52, train_loss: 0.8534, test_loss: 0.8588, test_f1: 0.5398
 epoch: 53, train_loss: 0.8468, test_loss: 0.8933, test_f1: 0.5434
 epoch: 54, train_loss: 0.8449, test_loss: 0.8421, test_f1: 0.5528
 epoch: 55, train_loss: 0.8394, test_loss: 0.8471, test_f1: 0.5452
 epoch: 56, train_loss: 0.8317, test_loss: 0.8145, test_f1: 0.5677
 epoch: 57, train_loss: 0.8252, test_loss: 0.8244, test_f1: 0.5488
 epoch: 58, train_loss: 0.8286, test_loss: 0.8731, test_f1: 0.5218
 epoch: 59, train_loss: 0.8451, test_loss: 0.8211, test_f1: 0.5343
 epoch: 60, train_loss: 0.8117, test_loss: 0.8209, test_f1: 0.5540
 epoch: 61, train_loss: 0.8174, test_loss: 0.8015, test_f1: 0.5540
 epoch: 62, train_loss: 0.8252, test_loss: 0.8408, test_f1: 0.5566
 epoch: 63, train_loss: 0.8264, test_loss: 0.8465, test_f1: 0.5394
 epoch: 64, train_loss: 0.8281, test_loss: 0.8081, test_f1: 0.5939
 epoch: 65, train_loss: 0.8192, test_loss: 0.8213, test_f1: 0.5665
 epoch: 66, train_loss: 0.8094, test_loss: 0.8395, test_f1: 0.5712
 epoch: 67, train_loss: 0.8070, test_loss: 0.8232, test_f1: 0.5683
 epoch: 68, train_loss: 0.8138, test_loss: 0.8275, test_f1: 0.5686
 epoch: 69, train_loss: 0.8142, test_loss: 0.8606, test_f1: 0.5372
 epoch: 70, train_loss: 0.8091, test_loss: 0.8088, test_f1: 0.5697
 epoch: 71, train_loss: 0.8181, test_loss: 0.8829, test_f1: 0.5750
 epoch: 72, train_loss: 0.8251, test_loss: 0.8251, test_f1: 0.5457
 epoch: 73, train_loss: 0.8079, test_loss: 0.8167, test_f1: 0.5555
 epoch: 74, train_loss: 0.8119, test_loss: 0.8311, test_f1: 0.5809
 epoch: 75, train_loss: 0.8092, test_loss: 0.8110, test_f1: 0.5916
 epoch: 76, train_loss: 0.8062, test_loss: 0.8239, test_f1: 0.5609
 epoch: 77, train_loss: 0.8008, test_loss: 0.8452, test_f1: 0.5498
 epoch: 78, train_loss: 0.7956, test_loss: 0.8300, test_f1: 0.5629
 epoch: 79, train_loss: 0.8079, test_loss: 0.8332, test_f1: 0.6006
 epoch: 80, train_loss: 0.8133, test_loss: 0.8487, test_f1: 0.5554
 epoch: 81, train_loss: 0.7971, test_loss: 0.8332, test_f1: 0.5820
 epoch: 82, train_loss: 0.8064, test_loss: 0.8700, test_f1: 0.5658
 epoch: 83, train_loss: 0.8142, test_loss: 0.8591, test_f1: 0.5796
 epoch: 84, train_loss: 0.8103, test_loss: 0.8332, test_f1: 0.5640
 epoch: 85, train_loss: 0.8020, test_loss: 0.8160, test_f1: 0.5696
 epoch: 86, train_loss: 0.8092, test_loss: 0.8227, test_f1: 0.5672
 epoch: 87, train_loss: 0.8088, test_loss: 0.8067, test_f1: 0.5906
 epoch: 88, train_loss: 0.8037, test_loss: 0.8361, test_f1: 0.5539
 epoch: 89, train_loss: 0.7917, test_loss: 0.8217, test_f1: 0.5869
 epoch: 90, train_loss: 0.7909, test_loss: 0.8086, test_f1: 0.5774
 epoch: 91, train_loss: 0.8077, test_loss: 0.8150, test_f1: 0.5818
 epoch: 92, train_loss: 0.8017, test_loss: 0.8326, test_f1: 0.5895
 epoch: 93, train_loss: 0.7879, test_loss: 0.8262, test_f1: 0.6006
 epoch: 94, train_loss: 0.7932, test_loss: 0.8033, test_f1: 0.6079
 epoch: 95, train_loss: 0.7979, test_loss: 0.8224, test_f1: 0.5747
 epoch: 96, train_loss: 0.7824, test_loss: 0.8103, test_f1: 0.5962
 epoch: 97, train_loss: 0.8071, test_loss: 0.8282, test_f1: 0.5623
 epoch: 98, train_loss: 0.7923, test_loss: 0.8048, test_f1: 0.5756
 epoch: 99, train_loss: 0.7842, test_loss: 0.8321, test_f1: 0.5756

Training completed in 1193.92 seconds
Best F1: 0.6677 at epoch 97
Mean F1 across iterations: 0.6444  0.0160
========================FINAL RESULTS================================
FEGIN weighted F1: 0.6677  0.0160
python main.py --data ltspice_examples --representation component_pin_net --model FEGIN --layers 4 --hiddens 16 --batch_size 32 --lr 0.01 --emb_size 250 --epochs 100 --save_appendix component_pin_net_L4_H16_BS32_LR0.01_E250 --no_val
-----



STDERR:
  File "main.py", line 370, in <module>
    main()
  File "main.py", line 254, in main
    dataset = dataset_class(
  File "/home/philip/projects/llm_inference_code_repo/Circuit-Completion-Using-GNNs/component_classification_with_link_prediction_head/evaluation/FEGIN/kernel/circuit_datasets.py", line 15, in __init__
    self.data, self.slices = torch.load(self.processed_paths[0])
  File "/home/philip/.local/lib/python3.8/site-packages/torch/serialization.py", line 1040, in load
    warnings.warn(
  File "/usr/lib/python3.8/warnings.py", line 109, in _showwarnmsg
    sw(msg.message, msg.category, msg.filename, msg.lineno,
  File "main.py", line 47, in warn_with_traceback
    traceback.print_stack(file=log)
/home/philip/projects/llm_inference_code_repo/Circuit-Completion-Using-GNNs/component_classification_with_link_prediction_head/evaluation/FEGIN/kernel/circuit_datasets.py:15: FutureWarning: You are using `torch.load` with `weights_only=False` (the current default value), which uses the default pickle module implicitly. It is possible to construct malicious pickle data which will execute arbitrary code during unpickling (See https://github.com/pytorch/pytorch/blob/main/SECURITY.md#untrusted-models for more details). In a future release, the default value for `weights_only` will be flipped to `True`. This limits the functions that could be executed during unpickling. Arbitrary objects will no longer be allowed to be loaded via this mode unless they are explicitly allowlisted by the user via `torch.serialization.add_safe_globals`. We recommend you start setting `weights_only=True` for any use case where you don't have full control of the loaded file. Please open an issue on GitHub for any issues related to this experimental feature.
  self.data, self.slices = torch.load(self.processed_paths[0])
