STDOUT:
Results will be saved in /home/philip/projects/ltspice_examples_code_repo/Circuit-Completion-Using-GNNs/component_classification_with_link_prediction_head/evaluation/FEGIN/results/model_FEGIN_dataset_ltspice_demos
Command line input: python main.py --data ltspice_demos --representation component_pin --model FEGIN --layers 3 --hiddens 128 --batch_size 64 --lr 0.01 --emb_size 512 --epochs 100 --save_appendix component_pin_L3_H128_BS64_LR0.01_E512 --no_val
 is saved.
-----
ltspice_demos - FEGIN
Using 3 layers, 128 hidden units, h = 2
Loading component_pin representation dataset
ENTERED
Training FEGIN on component_pin representation
Train: 1565, Test: 383
##################ITERATION #0 ****************************************
 epoch: 0, train_loss: 1.1850, test_loss: 4.5509, test_f1: 0.1412
 epoch: 1, train_loss: 1.0694, test_loss: 1.1609, test_f1: 0.4479
 epoch: 2, train_loss: 0.9894, test_loss: 1.3725, test_f1: 0.2590
 epoch: 3, train_loss: 0.9579, test_loss: 1.0518, test_f1: 0.5062
 epoch: 4, train_loss: 0.8988, test_loss: 0.9902, test_f1: 0.4547
 epoch: 5, train_loss: 0.8619, test_loss: 1.0347, test_f1: 0.5263
 epoch: 6, train_loss: 0.8570, test_loss: 1.0385, test_f1: 0.5703
 epoch: 7, train_loss: 0.8766, test_loss: 1.1110, test_f1: 0.3975
 epoch: 8, train_loss: 0.8103, test_loss: 1.0914, test_f1: 0.4837
 epoch: 9, train_loss: 0.7773, test_loss: 1.2552, test_f1: 0.4995
 epoch: 10, train_loss: 0.8148, test_loss: 1.1845, test_f1: 0.4918
 epoch: 11, train_loss: 0.7728, test_loss: 1.0793, test_f1: 0.4405
 epoch: 12, train_loss: 0.7949, test_loss: 1.2618, test_f1: 0.5433
 epoch: 13, train_loss: 0.7456, test_loss: 1.3275, test_f1: 0.5750
 epoch: 14, train_loss: 0.7452, test_loss: 1.0137, test_f1: 0.5094
 epoch: 15, train_loss: 0.7327, test_loss: 1.3991, test_f1: 0.4556
 epoch: 16, train_loss: 0.7365, test_loss: 1.0847, test_f1: 0.5536
 epoch: 17, train_loss: 0.6966, test_loss: 1.1155, test_f1: 0.4864
 epoch: 18, train_loss: 0.6941, test_loss: 1.3818, test_f1: 0.4705
 epoch: 19, train_loss: 0.7169, test_loss: 1.3976, test_f1: 0.5115
 epoch: 20, train_loss: 0.6737, test_loss: 1.2232, test_f1: 0.5715
 epoch: 21, train_loss: 0.7190, test_loss: 1.0718, test_f1: 0.5504
 epoch: 22, train_loss: 0.7058, test_loss: 2.2521, test_f1: 0.5043
 epoch: 23, train_loss: 0.6821, test_loss: 0.9902, test_f1: 0.6184
 epoch: 24, train_loss: 0.6647, test_loss: 1.0774, test_f1: 0.5451
 epoch: 25, train_loss: 0.6722, test_loss: 1.1499, test_f1: 0.6525
 epoch: 26, train_loss: 0.6533, test_loss: 1.0541, test_f1: 0.6609
 epoch: 27, train_loss: 0.6379, test_loss: 1.0875, test_f1: 0.6068
 epoch: 28, train_loss: 0.6303, test_loss: 1.1706, test_f1: 0.5689
 epoch: 29, train_loss: 0.6367, test_loss: 1.6537, test_f1: 0.5842
 epoch: 30, train_loss: 0.6337, test_loss: 1.0654, test_f1: 0.5815
 epoch: 31, train_loss: 0.6148, test_loss: 1.1556, test_f1: 0.6203
 epoch: 32, train_loss: 0.6058, test_loss: 1.1312, test_f1: 0.6067
 epoch: 33, train_loss: 0.5940, test_loss: 1.4080, test_f1: 0.4918
 epoch: 34, train_loss: 0.6260, test_loss: 1.7665, test_f1: 0.5379
 epoch: 35, train_loss: 0.6200, test_loss: 1.1734, test_f1: 0.6040
 epoch: 36, train_loss: 0.5660, test_loss: 1.0760, test_f1: 0.6352
 epoch: 37, train_loss: 0.5556, test_loss: 1.6231, test_f1: 0.6212
 epoch: 38, train_loss: 0.5518, test_loss: 1.0497, test_f1: 0.6344
 epoch: 39, train_loss: 0.5553, test_loss: 1.6615, test_f1: 0.5247
 epoch: 40, train_loss: 0.5600, test_loss: 1.1513, test_f1: 0.6352
 epoch: 41, train_loss: 0.5975, test_loss: 0.9778, test_f1: 0.6380
 epoch: 42, train_loss: 0.5364, test_loss: 1.2153, test_f1: 0.6485
 epoch: 43, train_loss: 0.5547, test_loss: 1.5410, test_f1: 0.6050
 epoch: 44, train_loss: 0.4996, test_loss: 1.1615, test_f1: 0.5805
 epoch: 45, train_loss: 0.5554, test_loss: 1.2603, test_f1: 0.6172
 epoch: 46, train_loss: 0.5609, test_loss: 1.1061, test_f1: 0.6346
 epoch: 47, train_loss: 0.5009, test_loss: 1.1605, test_f1: 0.6570
 epoch: 48, train_loss: 0.4599, test_loss: 1.2716, test_f1: 0.6323
 epoch: 49, train_loss: 0.4829, test_loss: 1.3201, test_f1: 0.6511
 epoch: 50, train_loss: 0.5030, test_loss: 1.2023, test_f1: 0.6865
 epoch: 51, train_loss: 0.4384, test_loss: 1.2506, test_f1: 0.6958
 epoch: 52, train_loss: 0.3921, test_loss: 1.4432, test_f1: 0.6788
 epoch: 53, train_loss: 0.3669, test_loss: 1.2883, test_f1: 0.6658
 epoch: 54, train_loss: 0.3878, test_loss: 1.3999, test_f1: 0.6927
 epoch: 55, train_loss: 0.3552, test_loss: 1.3145, test_f1: 0.6927
 epoch: 56, train_loss: 0.3455, test_loss: 1.5046, test_f1: 0.7099
 epoch: 57, train_loss: 0.3416, test_loss: 1.7929, test_f1: 0.6774
 epoch: 58, train_loss: 0.3213, test_loss: 2.1563, test_f1: 0.6416
 epoch: 59, train_loss: 0.3427, test_loss: 1.7384, test_f1: 0.6521
 epoch: 60, train_loss: 0.3212, test_loss: 1.5807, test_f1: 0.7017
 epoch: 61, train_loss: 0.3177, test_loss: 1.5968, test_f1: 0.6690
 epoch: 62, train_loss: 0.3089, test_loss: 1.7889, test_f1: 0.6666
 epoch: 63, train_loss: 0.3123, test_loss: 1.5824, test_f1: 0.6860
 epoch: 64, train_loss: 0.3265, test_loss: 2.1346, test_f1: 0.6239
 epoch: 65, train_loss: 0.3259, test_loss: 1.5662, test_f1: 0.6734
 epoch: 66, train_loss: 0.2577, test_loss: 2.0257, test_f1: 0.6658
 epoch: 67, train_loss: 0.2871, test_loss: 1.6390, test_f1: 0.6610
 epoch: 68, train_loss: 0.3393, test_loss: 1.7901, test_f1: 0.6765
 epoch: 69, train_loss: 0.3192, test_loss: 1.3611, test_f1: 0.6778
 epoch: 70, train_loss: 0.2898, test_loss: 1.5337, test_f1: 0.6659
 epoch: 71, train_loss: 0.2684, test_loss: 1.6089, test_f1: 0.6369
 epoch: 72, train_loss: 0.2995, test_loss: 1.5739, test_f1: 0.6623
 epoch: 73, train_loss: 0.2598, test_loss: 1.9620, test_f1: 0.6522
 epoch: 74, train_loss: 0.2429, test_loss: 1.7821, test_f1: 0.6467
 epoch: 75, train_loss: 0.2687, test_loss: 2.1385, test_f1: 0.6507
 epoch: 76, train_loss: 0.2450, test_loss: 1.7154, test_f1: 0.6601
 epoch: 77, train_loss: 0.2727, test_loss: 1.8839, test_f1: 0.6705
 epoch: 78, train_loss: 0.2523, test_loss: 1.8500, test_f1: 0.7051
 epoch: 79, train_loss: 0.2274, test_loss: 2.4145, test_f1: 0.6566
 epoch: 80, train_loss: 0.2418, test_loss: 1.6064, test_f1: 0.7012
 epoch: 81, train_loss: 0.2279, test_loss: 1.9452, test_f1: 0.6250
 epoch: 82, train_loss: 0.2123, test_loss: 2.0204, test_f1: 0.6637
 epoch: 83, train_loss: 0.2361, test_loss: 2.1446, test_f1: 0.6574
 epoch: 84, train_loss: 0.2467, test_loss: 2.1913, test_f1: 0.6721
 epoch: 85, train_loss: 0.2112, test_loss: 1.7908, test_f1: 0.6604
 epoch: 86, train_loss: 0.2177, test_loss: 1.9451, test_f1: 0.6890
 epoch: 87, train_loss: 0.2545, test_loss: 2.0429, test_f1: 0.6064
 epoch: 88, train_loss: 0.2269, test_loss: 2.3815, test_f1: 0.6662
 epoch: 89, train_loss: 0.2165, test_loss: 1.8512, test_f1: 0.6490
 epoch: 90, train_loss: 0.2248, test_loss: 2.5111, test_f1: 0.6585
 epoch: 91, train_loss: 0.1920, test_loss: 2.6176, test_f1: 0.6420
 epoch: 92, train_loss: 0.2026, test_loss: 2.8625, test_f1: 0.6705
 epoch: 93, train_loss: 0.2042, test_loss: 2.8160, test_f1: 0.5999
 epoch: 94, train_loss: 0.1718, test_loss: 2.6507, test_f1: 0.6482
 epoch: 95, train_loss: 0.1917, test_loss: 2.3220, test_f1: 0.6791
 epoch: 96, train_loss: 0.2259, test_loss: 1.9508, test_f1: 0.6624
 epoch: 97, train_loss: 0.2149, test_loss: 1.9147, test_f1: 0.6531
 epoch: 98, train_loss: 0.1725, test_loss: 2.2493, test_f1: 0.6535
 epoch: 99, train_loss: 0.1526, test_loss: 2.2582, test_f1: 0.6862
##################ITERATION #1 ****************************************
 epoch: 0, train_loss: 1.1568, test_loss: 1.4217, test_f1: 0.4262
 epoch: 1, train_loss: 0.9619, test_loss: 1.0147, test_f1: 0.6016
 epoch: 2, train_loss: 0.8625, test_loss: 1.1369, test_f1: 0.4735
 epoch: 3, train_loss: 0.8358, test_loss: 1.0226, test_f1: 0.5791
 epoch: 4, train_loss: 0.7969, test_loss: 1.1754, test_f1: 0.4572
 epoch: 5, train_loss: 0.8318, test_loss: 1.0672, test_f1: 0.6236
 epoch: 6, train_loss: 0.7855, test_loss: 1.0883, test_f1: 0.5571
 epoch: 7, train_loss: 0.7925, test_loss: 1.1069, test_f1: 0.6006
 epoch: 8, train_loss: 0.7838, test_loss: 1.0325, test_f1: 0.5615
 epoch: 9, train_loss: 0.7393, test_loss: 1.0511, test_f1: 0.5825
 epoch: 10, train_loss: 0.7177, test_loss: 1.0889, test_f1: 0.6528
 epoch: 11, train_loss: 0.7084, test_loss: 1.1625, test_f1: 0.6015
 epoch: 12, train_loss: 0.7035, test_loss: 1.0980, test_f1: 0.5543
 epoch: 13, train_loss: 0.7000, test_loss: 0.9340, test_f1: 0.5850
 epoch: 14, train_loss: 0.6872, test_loss: 1.1514, test_f1: 0.6130
 epoch: 15, train_loss: 0.7032, test_loss: 1.1088, test_f1: 0.5936
 epoch: 16, train_loss: 0.6951, test_loss: 1.0961, test_f1: 0.6075
 epoch: 17, train_loss: 0.6810, test_loss: 1.5734, test_f1: 0.4836
 epoch: 18, train_loss: 0.6585, test_loss: 1.1876, test_f1: 0.4730
 epoch: 19, train_loss: 0.6409, test_loss: 1.1673, test_f1: 0.5484
 epoch: 20, train_loss: 0.6695, test_loss: 1.2513, test_f1: 0.6100
 epoch: 21, train_loss: 0.6493, test_loss: 1.4822, test_f1: 0.6152
 epoch: 22, train_loss: 0.6558, test_loss: 1.3935, test_f1: 0.5467
 epoch: 23, train_loss: 0.6126, test_loss: 1.4776, test_f1: 0.5001
 epoch: 24, train_loss: 0.6530, test_loss: 1.1635, test_f1: 0.5992
 epoch: 25, train_loss: 0.6341, test_loss: 1.3411, test_f1: 0.6104
 epoch: 26, train_loss: 0.6164, test_loss: 1.4065, test_f1: 0.4843
 epoch: 27, train_loss: 0.5636, test_loss: 1.5139, test_f1: 0.5162
 epoch: 28, train_loss: 0.5766, test_loss: 1.3812, test_f1: 0.5695
 epoch: 29, train_loss: 0.5710, test_loss: 1.4313, test_f1: 0.6463
 epoch: 30, train_loss: 0.5497, test_loss: 1.3613, test_f1: 0.5990
 epoch: 31, train_loss: 0.5631, test_loss: 1.4715, test_f1: 0.5683
 epoch: 32, train_loss: 0.5256, test_loss: 1.7824, test_f1: 0.5444
 epoch: 33, train_loss: 0.5620, test_loss: 1.5676, test_f1: 0.6034
 epoch: 34, train_loss: 0.5623, test_loss: 1.3920, test_f1: 0.6116
 epoch: 35, train_loss: 0.5701, test_loss: 1.3712, test_f1: 0.6576
 epoch: 36, train_loss: 0.5276, test_loss: 1.3582, test_f1: 0.5851
 epoch: 37, train_loss: 0.5867, test_loss: 1.8235, test_f1: 0.6058
 epoch: 38, train_loss: 0.5149, test_loss: 1.6112, test_f1: 0.6137
 epoch: 39, train_loss: 0.5420, test_loss: 1.4323, test_f1: 0.5819
 epoch: 40, train_loss: 0.5033, test_loss: 1.6968, test_f1: 0.5658
 epoch: 41, train_loss: 0.5153, test_loss: 1.4472, test_f1: 0.6074
 epoch: 42, train_loss: 0.5037, test_loss: 1.5782, test_f1: 0.6135
 epoch: 43, train_loss: 0.4766, test_loss: 1.4887, test_f1: 0.6581
 epoch: 44, train_loss: 0.5009, test_loss: 1.7712, test_f1: 0.5469
 epoch: 45, train_loss: 0.4845, test_loss: 1.7201, test_f1: 0.6100
 epoch: 46, train_loss: 0.4729, test_loss: 1.4291, test_f1: 0.6448
 epoch: 47, train_loss: 0.4427, test_loss: 1.7109, test_f1: 0.6053
 epoch: 48, train_loss: 0.4639, test_loss: 2.0903, test_f1: 0.4865
 epoch: 49, train_loss: 0.4821, test_loss: 1.6574, test_f1: 0.6130
 epoch: 50, train_loss: 0.4374, test_loss: 1.9259, test_f1: 0.5964
 epoch: 51, train_loss: 0.3554, test_loss: 1.7871, test_f1: 0.5815
 epoch: 52, train_loss: 0.3648, test_loss: 1.7088, test_f1: 0.6042
 epoch: 53, train_loss: 0.3324, test_loss: 2.0707, test_f1: 0.5742
 epoch: 54, train_loss: 0.3488, test_loss: 1.9688, test_f1: 0.5830
 epoch: 55, train_loss: 0.3222, test_loss: 2.1574, test_f1: 0.5805
 epoch: 56, train_loss: 0.2978, test_loss: 2.1579, test_f1: 0.6550
 epoch: 57, train_loss: 0.2885, test_loss: 2.2771, test_f1: 0.5955
 epoch: 58, train_loss: 0.3254, test_loss: 2.6394, test_f1: 0.6404
 epoch: 59, train_loss: 0.3093, test_loss: 2.6879, test_f1: 0.6640
 epoch: 60, train_loss: 0.2816, test_loss: 2.0158, test_f1: 0.6157
 epoch: 61, train_loss: 0.2818, test_loss: 1.8009, test_f1: 0.6101
 epoch: 62, train_loss: 0.2646, test_loss: 2.3665, test_f1: 0.6182
 epoch: 63, train_loss: 0.2788, test_loss: 2.8162, test_f1: 0.5874
 epoch: 64, train_loss: 0.2490, test_loss: 2.4603, test_f1: 0.6382
 epoch: 65, train_loss: 0.2919, test_loss: 2.0737, test_f1: 0.6395
 epoch: 66, train_loss: 0.2686, test_loss: 2.7312, test_f1: 0.6337
 epoch: 67, train_loss: 0.2414, test_loss: 2.5057, test_f1: 0.6235
 epoch: 68, train_loss: 0.2500, test_loss: 2.2171, test_f1: 0.5867
 epoch: 69, train_loss: 0.2660, test_loss: 2.6705, test_f1: 0.6208
 epoch: 70, train_loss: 0.2301, test_loss: 2.4565, test_f1: 0.6018
 epoch: 71, train_loss: 0.2250, test_loss: 2.5859, test_f1: 0.6345
 epoch: 72, train_loss: 0.2121, test_loss: 2.8893, test_f1: 0.5909
 epoch: 73, train_loss: 0.2554, test_loss: 2.5226, test_f1: 0.6760
 epoch: 74, train_loss: 0.2598, test_loss: 2.2173, test_f1: 0.6514
 epoch: 75, train_loss: 0.2403, test_loss: 2.5857, test_f1: 0.6314
 epoch: 76, train_loss: 0.2268, test_loss: 3.0079, test_f1: 0.6022
 epoch: 77, train_loss: 0.2127, test_loss: 2.7273, test_f1: 0.6298
 epoch: 78, train_loss: 0.1898, test_loss: 2.6744, test_f1: 0.6164
 epoch: 79, train_loss: 0.2112, test_loss: 2.5091, test_f1: 0.6184
 epoch: 80, train_loss: 0.2412, test_loss: 2.6427, test_f1: 0.6404
 epoch: 81, train_loss: 0.1983, test_loss: 2.5314, test_f1: 0.6419
 epoch: 82, train_loss: 0.1883, test_loss: 2.8338, test_f1: 0.6740
 epoch: 83, train_loss: 0.2011, test_loss: 3.2239, test_f1: 0.6370
 epoch: 84, train_loss: 0.1758, test_loss: 2.6414, test_f1: 0.6419
 epoch: 85, train_loss: 0.1771, test_loss: 2.7101, test_f1: 0.6743
 epoch: 86, train_loss: 0.1617, test_loss: 3.1875, test_f1: 0.6624
 epoch: 87, train_loss: 0.1963, test_loss: 2.8057, test_f1: 0.6281
 epoch: 88, train_loss: 0.1800, test_loss: 3.2365, test_f1: 0.6212
 epoch: 89, train_loss: 0.1740, test_loss: 3.0460, test_f1: 0.6173
 epoch: 90, train_loss: 0.1967, test_loss: 3.0187, test_f1: 0.6225
 epoch: 91, train_loss: 0.1717, test_loss: 2.7872, test_f1: 0.6473
 epoch: 92, train_loss: 0.1926, test_loss: 2.6775, test_f1: 0.6361
 epoch: 93, train_loss: 0.1556, test_loss: 2.6727, test_f1: 0.6897
 epoch: 94, train_loss: 0.1755, test_loss: 2.9448, test_f1: 0.6496
 epoch: 95, train_loss: 0.1873, test_loss: 2.9772, test_f1: 0.6179
 epoch: 96, train_loss: 0.1896, test_loss: 3.3175, test_f1: 0.6531
 epoch: 97, train_loss: 0.1689, test_loss: 3.3119, test_f1: 0.6591
 epoch: 98, train_loss: 0.1614, test_loss: 2.5765, test_f1: 0.6616
 epoch: 99, train_loss: 0.1575, test_loss: 2.5533, test_f1: 0.6300
##################ITERATION #2 ****************************************
 epoch: 0, train_loss: 1.1841, test_loss: 1.9617, test_f1: 0.2159
 epoch: 1, train_loss: 0.9701, test_loss: 1.3908, test_f1: 0.4974
 epoch: 2, train_loss: 0.9235, test_loss: 1.0666, test_f1: 0.4921
 epoch: 3, train_loss: 0.8542, test_loss: 1.2195, test_f1: 0.5080
 epoch: 4, train_loss: 0.8374, test_loss: 1.0775, test_f1: 0.5780
 epoch: 5, train_loss: 0.8191, test_loss: 1.0895, test_f1: 0.4430
 epoch: 6, train_loss: 0.8071, test_loss: 1.2753, test_f1: 0.5091
 epoch: 7, train_loss: 0.7954, test_loss: 1.3491, test_f1: 0.3708
 epoch: 8, train_loss: 0.7618, test_loss: 1.3348, test_f1: 0.5388
 epoch: 9, train_loss: 0.8113, test_loss: 1.0628, test_f1: 0.5143
 epoch: 10, train_loss: 0.8103, test_loss: 1.0792, test_f1: 0.4523
 epoch: 11, train_loss: 0.7470, test_loss: 0.9869, test_f1: 0.5758
 epoch: 12, train_loss: 0.7692, test_loss: 1.4336, test_f1: 0.4038
 epoch: 13, train_loss: 0.7890, test_loss: 0.9613, test_f1: 0.5947
 epoch: 14, train_loss: 0.7684, test_loss: 1.1386, test_f1: 0.5862
 epoch: 15, train_loss: 0.7596, test_loss: 1.0282, test_f1: 0.6140
 epoch: 16, train_loss: 0.7677, test_loss: 1.2302, test_f1: 0.5505
 epoch: 17, train_loss: 0.7651, test_loss: 0.9786, test_f1: 0.6285
 epoch: 18, train_loss: 0.7261, test_loss: 1.2812, test_f1: 0.5101
 epoch: 19, train_loss: 0.7497, test_loss: 1.1092, test_f1: 0.5263
 epoch: 20, train_loss: 0.7230, test_loss: 1.0329, test_f1: 0.6368
 epoch: 21, train_loss: 0.6824, test_loss: 1.0776, test_f1: 0.6493
 epoch: 22, train_loss: 0.7182, test_loss: 1.1357, test_f1: 0.5644
 epoch: 23, train_loss: 0.7470, test_loss: 1.1032, test_f1: 0.6101
 epoch: 24, train_loss: 0.7180, test_loss: 1.0175, test_f1: 0.6514
 epoch: 25, train_loss: 0.7079, test_loss: 1.1557, test_f1: 0.5617
 epoch: 26, train_loss: 0.6670, test_loss: 1.0127, test_f1: 0.6776
 epoch: 27, train_loss: 0.6550, test_loss: 1.2157, test_f1: 0.6506
 epoch: 28, train_loss: 0.6907, test_loss: 1.1239, test_f1: 0.5730
 epoch: 29, train_loss: 0.6568, test_loss: 1.4196, test_f1: 0.5507
 epoch: 30, train_loss: 0.6477, test_loss: 1.2543, test_f1: 0.6077
 epoch: 31, train_loss: 0.6481, test_loss: 1.2713, test_f1: 0.6250
 epoch: 32, train_loss: 0.6005, test_loss: 0.9183, test_f1: 0.7096
 epoch: 33, train_loss: 0.6095, test_loss: 1.0960, test_f1: 0.6977
 epoch: 34, train_loss: 0.6495, test_loss: 1.4672, test_f1: 0.5449
 epoch: 35, train_loss: 0.5964, test_loss: 1.0845, test_f1: 0.6293
 epoch: 36, train_loss: 0.5859, test_loss: 1.2895, test_f1: 0.6714
 epoch: 37, train_loss: 0.5670, test_loss: 1.2810, test_f1: 0.5482
 epoch: 38, train_loss: 0.5863, test_loss: 1.5722, test_f1: 0.4654
 epoch: 39, train_loss: 0.5686, test_loss: 1.6789, test_f1: 0.5742
 epoch: 40, train_loss: 0.5319, test_loss: 1.7355, test_f1: 0.6021
 epoch: 41, train_loss: 0.6290, test_loss: 1.3826, test_f1: 0.5639
 epoch: 42, train_loss: 0.5628, test_loss: 1.1576, test_f1: 0.6812
 epoch: 43, train_loss: 0.5725, test_loss: 1.3616, test_f1: 0.5694
 epoch: 44, train_loss: 0.5486, test_loss: 1.4808, test_f1: 0.6478
 epoch: 45, train_loss: 0.5197, test_loss: 1.1868, test_f1: 0.6624
 epoch: 46, train_loss: 0.4936, test_loss: 1.8994, test_f1: 0.5973
 epoch: 47, train_loss: 0.5320, test_loss: 1.4308, test_f1: 0.6212
 epoch: 48, train_loss: 0.5011, test_loss: 1.7796, test_f1: 0.5176
 epoch: 49, train_loss: 0.5102, test_loss: 1.6044, test_f1: 0.6262
 epoch: 50, train_loss: 0.5377, test_loss: 1.2574, test_f1: 0.6488
 epoch: 51, train_loss: 0.4453, test_loss: 1.5786, test_f1: 0.6139
 epoch: 52, train_loss: 0.4484, test_loss: 1.6035, test_f1: 0.6104
 epoch: 53, train_loss: 0.4198, test_loss: 1.8486, test_f1: 0.6570
 epoch: 54, train_loss: 0.3872, test_loss: 1.6074, test_f1: 0.6342
 epoch: 55, train_loss: 0.3647, test_loss: 1.6224, test_f1: 0.6144
 epoch: 56, train_loss: 0.3884, test_loss: 1.6230, test_f1: 0.6374
 epoch: 57, train_loss: 0.3577, test_loss: 1.7020, test_f1: 0.6386
 epoch: 58, train_loss: 0.3625, test_loss: 2.0246, test_f1: 0.6346
 epoch: 59, train_loss: 0.3493, test_loss: 2.2026, test_f1: 0.6591
 epoch: 60, train_loss: 0.3739, test_loss: 1.9180, test_f1: 0.6394
 epoch: 61, train_loss: 0.3912, test_loss: 2.2656, test_f1: 0.6313
 epoch: 62, train_loss: 0.3662, test_loss: 1.6623, test_f1: 0.6447
 epoch: 63, train_loss: 0.3346, test_loss: 2.0374, test_f1: 0.6312
 epoch: 64, train_loss: 0.3416, test_loss: 1.9760, test_f1: 0.5889
 epoch: 65, train_loss: 0.3366, test_loss: 1.7366, test_f1: 0.6613
 epoch: 66, train_loss: 0.3480, test_loss: 1.8280, test_f1: 0.6682
 epoch: 67, train_loss: 0.2866, test_loss: 2.6580, test_f1: 0.6446
 epoch: 68, train_loss: 0.2985, test_loss: 2.4675, test_f1: 0.6430
 epoch: 69, train_loss: 0.2939, test_loss: 2.2145, test_f1: 0.6496
 epoch: 70, train_loss: 0.3121, test_loss: 1.9132, test_f1: 0.6986
 epoch: 71, train_loss: 0.3903, test_loss: 1.7839, test_f1: 0.6178
 epoch: 72, train_loss: 0.2999, test_loss: 2.1727, test_f1: 0.6444
 epoch: 73, train_loss: 0.2841, test_loss: 2.1448, test_f1: 0.6167
 epoch: 74, train_loss: 0.2670, test_loss: 1.8507, test_f1: 0.6726
 epoch: 75, train_loss: 0.3161, test_loss: 2.3952, test_f1: 0.6086
 epoch: 76, train_loss: 0.2975, test_loss: 2.0419, test_f1: 0.6502
 epoch: 77, train_loss: 0.2786, test_loss: 1.9913, test_f1: 0.6666
 epoch: 78, train_loss: 0.2971, test_loss: 2.2888, test_f1: 0.6676
 epoch: 79, train_loss: 0.2896, test_loss: 2.1767, test_f1: 0.6566
 epoch: 80, train_loss: 0.2337, test_loss: 2.3374, test_f1: 0.6234
 epoch: 81, train_loss: 0.2409, test_loss: 2.3699, test_f1: 0.6510
 epoch: 82, train_loss: 0.2276, test_loss: 2.3424, test_f1: 0.6397
 epoch: 83, train_loss: 0.2565, test_loss: 2.7587, test_f1: 0.6731
 epoch: 84, train_loss: 0.2464, test_loss: 2.4332, test_f1: 0.6405
 epoch: 85, train_loss: 0.2407, test_loss: 2.1830, test_f1: 0.6532
 epoch: 86, train_loss: 0.2227, test_loss: 2.3468, test_f1: 0.6186
 epoch: 87, train_loss: 0.2522, test_loss: 2.4071, test_f1: 0.6709
 epoch: 88, train_loss: 0.2292, test_loss: 2.4267, test_f1: 0.6160
 epoch: 89, train_loss: 0.2042, test_loss: 2.3813, test_f1: 0.6828
 epoch: 90, train_loss: 0.2654, test_loss: 1.8484, test_f1: 0.6351
 epoch: 91, train_loss: 0.2213, test_loss: 2.4584, test_f1: 0.6556
 epoch: 92, train_loss: 0.2219, test_loss: 2.6181, test_f1: 0.6379
 epoch: 93, train_loss: 0.1956, test_loss: 2.6311, test_f1: 0.6127
 epoch: 94, train_loss: 0.2000, test_loss: 2.6636, test_f1: 0.6676
 epoch: 95, train_loss: 0.2278, test_loss: 2.6270, test_f1: 0.6431
 epoch: 96, train_loss: 0.1977, test_loss: 2.7100, test_f1: 0.6619
 epoch: 97, train_loss: 0.2076, test_loss: 2.6356, test_f1: 0.6711
 epoch: 98, train_loss: 0.1938, test_loss: 2.4409, test_f1: 0.6245
 epoch: 99, train_loss: 0.1701, test_loss: 3.1528, test_f1: 0.6272
##################ITERATION #3 ****************************************
 epoch: 0, train_loss: 1.2376, test_loss: 1.8297, test_f1: 0.2464
 epoch: 1, train_loss: 0.9524, test_loss: 1.2841, test_f1: 0.5030
 epoch: 2, train_loss: 0.8969, test_loss: 1.2062, test_f1: 0.3976
 epoch: 3, train_loss: 0.8634, test_loss: 1.2107, test_f1: 0.5275
 epoch: 4, train_loss: 0.8839, test_loss: 1.0660, test_f1: 0.5472
 epoch: 5, train_loss: 0.8209, test_loss: 1.0985, test_f1: 0.4955
 epoch: 6, train_loss: 0.8034, test_loss: 1.1966, test_f1: 0.6089
 epoch: 7, train_loss: 0.7880, test_loss: 1.0817, test_f1: 0.4634
 epoch: 8, train_loss: 0.7900, test_loss: 1.1164, test_f1: 0.4655
 epoch: 9, train_loss: 0.7940, test_loss: 1.1015, test_f1: 0.5770
 epoch: 10, train_loss: 0.8366, test_loss: 1.1650, test_f1: 0.4528
 epoch: 11, train_loss: 0.7914, test_loss: 1.3593, test_f1: 0.5247
 epoch: 12, train_loss: 0.7981, test_loss: 1.3804, test_f1: 0.4608
 epoch: 13, train_loss: 0.7670, test_loss: 1.0595, test_f1: 0.5729
 epoch: 14, train_loss: 0.7572, test_loss: 1.1166, test_f1: 0.4810
 epoch: 15, train_loss: 0.7556, test_loss: 1.2465, test_f1: 0.5724
 epoch: 16, train_loss: 0.7597, test_loss: 1.4686, test_f1: 0.5365
 epoch: 17, train_loss: 0.7364, test_loss: 1.1951, test_f1: 0.6162
 epoch: 18, train_loss: 0.7412, test_loss: 1.0296, test_f1: 0.6206
 epoch: 19, train_loss: 0.7134, test_loss: 1.3418, test_f1: 0.5738
 epoch: 20, train_loss: 0.7394, test_loss: 1.2806, test_f1: 0.5904
 epoch: 21, train_loss: 0.7472, test_loss: 1.0603, test_f1: 0.6499
 epoch: 22, train_loss: 0.7149, test_loss: 1.0713, test_f1: 0.4735
 epoch: 23, train_loss: 0.7014, test_loss: 1.3256, test_f1: 0.6248
 epoch: 24, train_loss: 0.7073, test_loss: 1.1499, test_f1: 0.6111
 epoch: 25, train_loss: 0.7109, test_loss: 1.4262, test_f1: 0.6146
 epoch: 26, train_loss: 0.6945, test_loss: 1.0764, test_f1: 0.6285
 epoch: 27, train_loss: 0.7067, test_loss: 1.6159, test_f1: 0.6051
 epoch: 28, train_loss: 0.6727, test_loss: 1.2125, test_f1: 0.5565
 epoch: 29, train_loss: 0.6878, test_loss: 1.0185, test_f1: 0.5448
 epoch: 30, train_loss: 0.6535, test_loss: 1.4746, test_f1: 0.5803
 epoch: 31, train_loss: 0.6423, test_loss: 1.3864, test_f1: 0.5801
 epoch: 32, train_loss: 0.6487, test_loss: 1.1750, test_f1: 0.6003
 epoch: 33, train_loss: 0.6495, test_loss: 1.6342, test_f1: 0.5634
 epoch: 34, train_loss: 0.6277, test_loss: 1.0299, test_f1: 0.6425
 epoch: 35, train_loss: 0.6041, test_loss: 1.2139, test_f1: 0.5801
 epoch: 36, train_loss: 0.5913, test_loss: 1.2979, test_f1: 0.5327
 epoch: 37, train_loss: 0.6296, test_loss: 1.7850, test_f1: 0.5561
 epoch: 38, train_loss: 0.6495, test_loss: 1.2119, test_f1: 0.6052
 epoch: 39, train_loss: 0.5840, test_loss: 1.0278, test_f1: 0.6128
 epoch: 40, train_loss: 0.5773, test_loss: 1.2764, test_f1: 0.5778
 epoch: 41, train_loss: 0.5633, test_loss: 1.3840, test_f1: 0.5597
 epoch: 42, train_loss: 0.5666, test_loss: 1.6794, test_f1: 0.5501
 epoch: 43, train_loss: 0.5595, test_loss: 1.1678, test_f1: 0.6465
 epoch: 44, train_loss: 0.5952, test_loss: 1.1795, test_f1: 0.6253
 epoch: 45, train_loss: 0.5626, test_loss: 1.4323, test_f1: 0.6094
 epoch: 46, train_loss: 0.5254, test_loss: 1.6376, test_f1: 0.5719
 epoch: 47, train_loss: 0.5728, test_loss: 1.1500, test_f1: 0.5850
 epoch: 48, train_loss: 0.6293, test_loss: 1.7624, test_f1: 0.5531
 epoch: 49, train_loss: 0.5638, test_loss: 1.1368, test_f1: 0.6252
 epoch: 50, train_loss: 0.5232, test_loss: 1.3321, test_f1: 0.6103
 epoch: 51, train_loss: 0.4742, test_loss: 1.4719, test_f1: 0.5980
 epoch: 52, train_loss: 0.4507, test_loss: 1.4364, test_f1: 0.6036
 epoch: 53, train_loss: 0.4371, test_loss: 1.3392, test_f1: 0.6034
 epoch: 54, train_loss: 0.4171, test_loss: 1.6602, test_f1: 0.6229
 epoch: 55, train_loss: 0.4010, test_loss: 1.4021, test_f1: 0.6422
 epoch: 56, train_loss: 0.3684, test_loss: 1.6148, test_f1: 0.5864
 epoch: 57, train_loss: 0.4501, test_loss: 1.2112, test_f1: 0.6564
 epoch: 58, train_loss: 0.3811, test_loss: 1.4846, test_f1: 0.6183
 epoch: 59, train_loss: 0.3894, test_loss: 1.8036, test_f1: 0.6141
 epoch: 60, train_loss: 0.3542, test_loss: 2.0131, test_f1: 0.6413
 epoch: 61, train_loss: 0.3940, test_loss: 1.7692, test_f1: 0.6063
 epoch: 62, train_loss: 0.3652, test_loss: 1.7327, test_f1: 0.6265
 epoch: 63, train_loss: 0.3558, test_loss: 1.8494, test_f1: 0.6137
 epoch: 64, train_loss: 0.3583, test_loss: 1.6319, test_f1: 0.6223
 epoch: 65, train_loss: 0.3253, test_loss: 1.8306, test_f1: 0.6001
 epoch: 66, train_loss: 0.3209, test_loss: 2.0509, test_f1: 0.6562
 epoch: 67, train_loss: 0.3538, test_loss: 2.2205, test_f1: 0.6145
 epoch: 68, train_loss: 0.3507, test_loss: 1.6371, test_f1: 0.6289
 epoch: 69, train_loss: 0.3165, test_loss: 2.0447, test_f1: 0.6146
 epoch: 70, train_loss: 0.3061, test_loss: 2.0021, test_f1: 0.6429
 epoch: 71, train_loss: 0.3302, test_loss: 1.8355, test_f1: 0.6107
 epoch: 72, train_loss: 0.3285, test_loss: 2.0462, test_f1: 0.6318
 epoch: 73, train_loss: 0.3059, test_loss: 1.7551, test_f1: 0.6397
 epoch: 74, train_loss: 0.2883, test_loss: 1.7222, test_f1: 0.6697
 epoch: 75, train_loss: 0.2669, test_loss: 2.3504, test_f1: 0.5972
 epoch: 76, train_loss: 0.2837, test_loss: 2.0538, test_f1: 0.6355
 epoch: 77, train_loss: 0.2886, test_loss: 2.1691, test_f1: 0.6518
 epoch: 78, train_loss: 0.3072, test_loss: 2.2127, test_f1: 0.5756
 epoch: 79, train_loss: 0.2860, test_loss: 2.1607, test_f1: 0.6275
 epoch: 80, train_loss: 0.2412, test_loss: 1.9211, test_f1: 0.6201
 epoch: 81, train_loss: 0.2640, test_loss: 2.4034, test_f1: 0.6092
 epoch: 82, train_loss: 0.2290, test_loss: 2.4810, test_f1: 0.6330
 epoch: 83, train_loss: 0.2666, test_loss: 2.4060, test_f1: 0.6399
 epoch: 84, train_loss: 0.2469, test_loss: 2.4675, test_f1: 0.6006
 epoch: 85, train_loss: 0.2284, test_loss: 1.8716, test_f1: 0.6478
 epoch: 86, train_loss: 0.2020, test_loss: 2.3028, test_f1: 0.6245
 epoch: 87, train_loss: 0.2201, test_loss: 2.5698, test_f1: 0.6270
 epoch: 88, train_loss: 0.2233, test_loss: 2.5698, test_f1: 0.6150
 epoch: 89, train_loss: 0.2520, test_loss: 2.4020, test_f1: 0.6199
 epoch: 90, train_loss: 0.2710, test_loss: 2.2018, test_f1: 0.6186
 epoch: 91, train_loss: 0.2977, test_loss: 2.5038, test_f1: 0.6166
 epoch: 92, train_loss: 0.2508, test_loss: 2.1162, test_f1: 0.6600
 epoch: 93, train_loss: 0.2592, test_loss: 2.1399, test_f1: 0.6477
 epoch: 94, train_loss: 0.2102, test_loss: 2.3797, test_f1: 0.6378
 epoch: 95, train_loss: 0.2116, test_loss: 2.1590, test_f1: 0.6077
 epoch: 96, train_loss: 0.2264, test_loss: 2.5120, test_f1: 0.6225
 epoch: 97, train_loss: 0.2105, test_loss: 2.5127, test_f1: 0.6148
 epoch: 98, train_loss: 0.2435, test_loss: 2.5269, test_f1: 0.5915
 epoch: 99, train_loss: 0.1803, test_loss: 2.3748, test_f1: 0.6013
##################ITERATION #4 ****************************************
 epoch: 0, train_loss: 1.1972, test_loss: 1.6528, test_f1: 0.1402
 epoch: 1, train_loss: 1.0378, test_loss: 1.0623, test_f1: 0.4202
 epoch: 2, train_loss: 0.9611, test_loss: 1.2243, test_f1: 0.3630
 epoch: 3, train_loss: 0.8953, test_loss: 1.1172, test_f1: 0.5007
 epoch: 4, train_loss: 0.8874, test_loss: 1.0262, test_f1: 0.5680
 epoch: 5, train_loss: 0.8384, test_loss: 1.0081, test_f1: 0.4794
 epoch: 6, train_loss: 0.8131, test_loss: 2.1225, test_f1: 0.4354
 epoch: 7, train_loss: 0.8049, test_loss: 0.9562, test_f1: 0.5221
 epoch: 8, train_loss: 0.7906, test_loss: 0.9697, test_f1: 0.5947
 epoch: 9, train_loss: 0.8224, test_loss: 1.0461, test_f1: 0.5864
 epoch: 10, train_loss: 0.7662, test_loss: 1.2675, test_f1: 0.5647
 epoch: 11, train_loss: 0.7702, test_loss: 1.0708, test_f1: 0.5613
 epoch: 12, train_loss: 0.7962, test_loss: 1.0560, test_f1: 0.4891
 epoch: 13, train_loss: 0.7996, test_loss: 1.1320, test_f1: 0.4691
 epoch: 14, train_loss: 0.7507, test_loss: 1.0209, test_f1: 0.6002
 epoch: 15, train_loss: 0.7834, test_loss: 1.0410, test_f1: 0.6123
 epoch: 16, train_loss: 0.7562, test_loss: 1.2631, test_f1: 0.5592
 epoch: 17, train_loss: 0.7510, test_loss: 1.2134, test_f1: 0.6222
 epoch: 18, train_loss: 0.7046, test_loss: 1.2815, test_f1: 0.4402
 epoch: 19, train_loss: 0.7048, test_loss: 1.3973, test_f1: 0.5865
 epoch: 20, train_loss: 0.7432, test_loss: 0.9980, test_f1: 0.6333
 epoch: 21, train_loss: 0.7183, test_loss: 1.3546, test_f1: 0.4287
 epoch: 22, train_loss: 0.7285, test_loss: 1.1116, test_f1: 0.6652
 epoch: 23, train_loss: 0.7166, test_loss: 1.7572, test_f1: 0.5018
 epoch: 24, train_loss: 0.7002, test_loss: 1.0182, test_f1: 0.5395
 epoch: 25, train_loss: 0.7025, test_loss: 1.1717, test_f1: 0.6287
 epoch: 26, train_loss: 0.6991, test_loss: 1.1858, test_f1: 0.6403
 epoch: 27, train_loss: 0.6847, test_loss: 1.1299, test_f1: 0.6068
 epoch: 28, train_loss: 0.6791, test_loss: 1.5233, test_f1: 0.5822
 epoch: 29, train_loss: 0.6536, test_loss: 1.1151, test_f1: 0.6001
 epoch: 30, train_loss: 0.6722, test_loss: 1.1247, test_f1: 0.6030
 epoch: 31, train_loss: 0.6207, test_loss: 1.3076, test_f1: 0.5849
 epoch: 32, train_loss: 0.6492, test_loss: 1.2876, test_f1: 0.5839
 epoch: 33, train_loss: 0.6294, test_loss: 1.5791, test_f1: 0.6127
 epoch: 34, train_loss: 0.6060, test_loss: 1.4461, test_f1: 0.6312
 epoch: 35, train_loss: 0.6110, test_loss: 1.3328, test_f1: 0.6634
 epoch: 36, train_loss: 0.5860, test_loss: 2.0219, test_f1: 0.5976
 epoch: 37, train_loss: 0.5973, test_loss: 1.2043, test_f1: 0.6093
 epoch: 38, train_loss: 0.5945, test_loss: 1.8126, test_f1: 0.5380
 epoch: 39, train_loss: 0.6085, test_loss: 1.7346, test_f1: 0.5605
 epoch: 40, train_loss: 0.5994, test_loss: 1.2966, test_f1: 0.5650
 epoch: 41, train_loss: 0.5745, test_loss: 1.3394, test_f1: 0.6127
 epoch: 42, train_loss: 0.5599, test_loss: 1.2933, test_f1: 0.5335
 epoch: 43, train_loss: 0.5637, test_loss: 1.2550, test_f1: 0.5997
 epoch: 44, train_loss: 0.5390, test_loss: 1.4295, test_f1: 0.5771
 epoch: 45, train_loss: 0.5339, test_loss: 1.2417, test_f1: 0.6112
 epoch: 46, train_loss: 0.5240, test_loss: 1.4472, test_f1: 0.5687
 epoch: 47, train_loss: 0.5670, test_loss: 1.7780, test_f1: 0.5663
 epoch: 48, train_loss: 0.5487, test_loss: 1.3328, test_f1: 0.5394
 epoch: 49, train_loss: 0.5134, test_loss: 1.3808, test_f1: 0.5742
 epoch: 50, train_loss: 0.5009, test_loss: 1.7303, test_f1: 0.5942
 epoch: 51, train_loss: 0.4853, test_loss: 1.4434, test_f1: 0.5963
 epoch: 52, train_loss: 0.4444, test_loss: 2.2564, test_f1: 0.5753
 epoch: 53, train_loss: 0.4418, test_loss: 1.9096, test_f1: 0.6036
 epoch: 54, train_loss: 0.4025, test_loss: 1.7512, test_f1: 0.6202
 epoch: 55, train_loss: 0.4108, test_loss: 2.2291, test_f1: 0.6178
 epoch: 56, train_loss: 0.4050, test_loss: 1.9413, test_f1: 0.5725
 epoch: 57, train_loss: 0.4216, test_loss: 1.8616, test_f1: 0.5970
 epoch: 58, train_loss: 0.3834, test_loss: 2.2505, test_f1: 0.6014
 epoch: 59, train_loss: 0.3719, test_loss: 2.1134, test_f1: 0.6085
 epoch: 60, train_loss: 0.3838, test_loss: 2.3760, test_f1: 0.5767
 epoch: 61, train_loss: 0.3719, test_loss: 2.0182, test_f1: 0.5980
 epoch: 62, train_loss: 0.4015, test_loss: 1.9774, test_f1: 0.5821
 epoch: 63, train_loss: 0.3444, test_loss: 2.1461, test_f1: 0.5972
 epoch: 64, train_loss: 0.3509, test_loss: 2.1670, test_f1: 0.5911
 epoch: 65, train_loss: 0.3506, test_loss: 2.2775, test_f1: 0.6280
 epoch: 66, train_loss: 0.3554, test_loss: 2.2165, test_f1: 0.5676
 epoch: 67, train_loss: 0.3807, test_loss: 2.0763, test_f1: 0.6334
 epoch: 68, train_loss: 0.3717, test_loss: 2.3800, test_f1: 0.5350
 epoch: 69, train_loss: 0.3338, test_loss: 2.2015, test_f1: 0.5585
 epoch: 70, train_loss: 0.2998, test_loss: 2.4499, test_f1: 0.5977
 epoch: 71, train_loss: 0.3300, test_loss: 2.7986, test_f1: 0.5303
 epoch: 72, train_loss: 0.3252, test_loss: 2.4030, test_f1: 0.6239
 epoch: 73, train_loss: 0.3303, test_loss: 2.4085, test_f1: 0.5882
 epoch: 74, train_loss: 0.3135, test_loss: 2.5409, test_f1: 0.5895
 epoch: 75, train_loss: 0.3260, test_loss: 2.1679, test_f1: 0.6135
 epoch: 76, train_loss: 0.2870, test_loss: 2.8206, test_f1: 0.6314
 epoch: 77, train_loss: 0.3401, test_loss: 2.4348, test_f1: 0.5661
 epoch: 78, train_loss: 0.2885, test_loss: 2.9562, test_f1: 0.5974
 epoch: 79, train_loss: 0.2679, test_loss: 2.5004, test_f1: 0.5728
 epoch: 80, train_loss: 0.2837, test_loss: 2.9259, test_f1: 0.6112
 epoch: 81, train_loss: 0.2728, test_loss: 3.1623, test_f1: 0.5903
 epoch: 82, train_loss: 0.2584, test_loss: 2.9322, test_f1: 0.6076
 epoch: 83, train_loss: 0.2770, test_loss: 2.8569, test_f1: 0.6015
 epoch: 84, train_loss: 0.2373, test_loss: 2.9007, test_f1: 0.5871
 epoch: 85, train_loss: 0.2399, test_loss: 2.9922, test_f1: 0.6061
 epoch: 86, train_loss: 0.2835, test_loss: 3.3674, test_f1: 0.6016
 epoch: 87, train_loss: 0.2688, test_loss: 2.7997, test_f1: 0.6287
 epoch: 88, train_loss: 0.2729, test_loss: 2.9578, test_f1: 0.6102
 epoch: 89, train_loss: 0.2390, test_loss: 2.5942, test_f1: 0.5982
 epoch: 90, train_loss: 0.2687, test_loss: 3.4813, test_f1: 0.6034
 epoch: 91, train_loss: 0.2244, test_loss: 2.8790, test_f1: 0.5976
 epoch: 92, train_loss: 0.2832, test_loss: 2.2654, test_f1: 0.6182
 epoch: 93, train_loss: 0.2322, test_loss: 2.9080, test_f1: 0.6133
 epoch: 94, train_loss: 0.2311, test_loss: 3.1595, test_f1: 0.6067
 epoch: 95, train_loss: 0.2413, test_loss: 2.9590, test_f1: 0.6049
 epoch: 96, train_loss: 0.2999, test_loss: 2.7465, test_f1: 0.6271
 epoch: 97, train_loss: 0.2529, test_loss: 3.0196, test_f1: 0.6004
 epoch: 98, train_loss: 0.2284, test_loss: 2.6647, test_f1: 0.5923
 epoch: 99, train_loss: 0.2121, test_loss: 2.7623, test_f1: 0.6053
##################ITERATION #5 ****************************************
 epoch: 0, train_loss: 1.2707, test_loss: 1.3127, test_f1: 0.2942
 epoch: 1, train_loss: 0.9897, test_loss: 1.0803, test_f1: 0.4954
 epoch: 2, train_loss: 0.9016, test_loss: 1.0813, test_f1: 0.5420
 epoch: 3, train_loss: 0.8547, test_loss: 1.1321, test_f1: 0.4670
 epoch: 4, train_loss: 0.8228, test_loss: 1.0898, test_f1: 0.5021
 epoch: 5, train_loss: 0.8261, test_loss: 1.0862, test_f1: 0.5100
 epoch: 6, train_loss: 0.7804, test_loss: 1.0770, test_f1: 0.5492
 epoch: 7, train_loss: 0.7689, test_loss: 1.5467, test_f1: 0.3951
 epoch: 8, train_loss: 0.7829, test_loss: 0.9919, test_f1: 0.5802
 epoch: 9, train_loss: 0.7767, test_loss: 1.1105, test_f1: 0.4613
 epoch: 10, train_loss: 0.7395, test_loss: 0.9171, test_f1: 0.6548
 epoch: 11, train_loss: 0.7372, test_loss: 0.9286, test_f1: 0.6561
 epoch: 12, train_loss: 0.7329, test_loss: 1.0457, test_f1: 0.5698
 epoch: 13, train_loss: 0.7247, test_loss: 1.1287, test_f1: 0.5922
 epoch: 14, train_loss: 0.7220, test_loss: 1.0388, test_f1: 0.5941
 epoch: 15, train_loss: 0.6917, test_loss: 1.1466, test_f1: 0.6145
 epoch: 16, train_loss: 0.6902, test_loss: 1.1343, test_f1: 0.6362
 epoch: 17, train_loss: 0.6888, test_loss: 1.2287, test_f1: 0.5735
 epoch: 18, train_loss: 0.6705, test_loss: 1.1322, test_f1: 0.6658
 epoch: 19, train_loss: 0.6544, test_loss: 1.0289, test_f1: 0.5901
 epoch: 20, train_loss: 0.6694, test_loss: 1.3070, test_f1: 0.5889
 epoch: 21, train_loss: 0.6597, test_loss: 1.1503, test_f1: 0.6386
 epoch: 22, train_loss: 0.6552, test_loss: 1.0530, test_f1: 0.5782
 epoch: 23, train_loss: 0.6860, test_loss: 1.0575, test_f1: 0.6101
 epoch: 24, train_loss: 0.6263, test_loss: 1.4230, test_f1: 0.5300
 epoch: 25, train_loss: 0.6169, test_loss: 1.0775, test_f1: 0.5757
 epoch: 26, train_loss: 0.6150, test_loss: 1.0178, test_f1: 0.6123
 epoch: 27, train_loss: 0.6174, test_loss: 1.0439, test_f1: 0.6224
 epoch: 28, train_loss: 0.6084, test_loss: 1.7782, test_f1: 0.5180
 epoch: 29, train_loss: 0.6148, test_loss: 1.1723, test_f1: 0.6285
 epoch: 30, train_loss: 0.6278, test_loss: 1.1508, test_f1: 0.6186
 epoch: 31, train_loss: 0.5779, test_loss: 1.1719, test_f1: 0.5626
 epoch: 32, train_loss: 0.5941, test_loss: 1.2188, test_f1: 0.6313
 epoch: 33, train_loss: 0.5240, test_loss: 1.2131, test_f1: 0.6194
 epoch: 34, train_loss: 0.5478, test_loss: 1.1323, test_f1: 0.6687
 epoch: 35, train_loss: 0.5596, test_loss: 1.4046, test_f1: 0.5525
 epoch: 36, train_loss: 0.5145, test_loss: 1.0905, test_f1: 0.6681
 epoch: 37, train_loss: 0.5408, test_loss: 1.1968, test_f1: 0.6082
 epoch: 38, train_loss: 0.5066, test_loss: 1.2990, test_f1: 0.5844
 epoch: 39, train_loss: 0.5536, test_loss: 1.3248, test_f1: 0.5719
 epoch: 40, train_loss: 0.5187, test_loss: 1.2550, test_f1: 0.5499
 epoch: 41, train_loss: 0.4939, test_loss: 1.4686, test_f1: 0.5960
 epoch: 42, train_loss: 0.5022, test_loss: 1.3102, test_f1: 0.6076
 epoch: 43, train_loss: 0.5065, test_loss: 1.4487, test_f1: 0.5923
 epoch: 44, train_loss: 0.4784, test_loss: 1.6167, test_f1: 0.5409
 epoch: 45, train_loss: 0.5219, test_loss: 1.4063, test_f1: 0.5992
 epoch: 46, train_loss: 0.4661, test_loss: 1.1834, test_f1: 0.6010
 epoch: 47, train_loss: 0.4434, test_loss: 1.3697, test_f1: 0.6155
 epoch: 48, train_loss: 0.4192, test_loss: 1.5466, test_f1: 0.5776
 epoch: 49, train_loss: 0.4393, test_loss: 1.3410, test_f1: 0.5666
 epoch: 50, train_loss: 0.4614, test_loss: 1.6993, test_f1: 0.5358
 epoch: 51, train_loss: 0.3972, test_loss: 1.5474, test_f1: 0.6038
 epoch: 52, train_loss: 0.3834, test_loss: 1.4227, test_f1: 0.6327
 epoch: 53, train_loss: 0.3905, test_loss: 1.4680, test_f1: 0.6049
 epoch: 54, train_loss: 0.3659, test_loss: 1.6529, test_f1: 0.5784
 epoch: 55, train_loss: 0.3667, test_loss: 1.4438, test_f1: 0.6443
 epoch: 56, train_loss: 0.3440, test_loss: 1.6594, test_f1: 0.6372
 epoch: 57, train_loss: 0.2986, test_loss: 1.7900, test_f1: 0.6344
 epoch: 58, train_loss: 0.3101, test_loss: 1.7562, test_f1: 0.6056
 epoch: 59, train_loss: 0.2877, test_loss: 1.7670, test_f1: 0.6532
 epoch: 60, train_loss: 0.3168, test_loss: 1.5968, test_f1: 0.6234
 epoch: 61, train_loss: 0.2805, test_loss: 1.7988, test_f1: 0.6245
 epoch: 62, train_loss: 0.3308, test_loss: 1.7365, test_f1: 0.6165
 epoch: 63, train_loss: 0.2874, test_loss: 1.8033, test_f1: 0.6499
 epoch: 64, train_loss: 0.2696, test_loss: 1.8512, test_f1: 0.6248
 epoch: 65, train_loss: 0.2958, test_loss: 1.7349, test_f1: 0.6282
 epoch: 66, train_loss: 0.2716, test_loss: 1.9542, test_f1: 0.6262
 epoch: 67, train_loss: 0.2914, test_loss: 1.7889, test_f1: 0.6311
 epoch: 68, train_loss: 0.2720, test_loss: 1.7161, test_f1: 0.6379
 epoch: 69, train_loss: 0.3262, test_loss: 1.7689, test_f1: 0.6435
 epoch: 70, train_loss: 0.2775, test_loss: 1.7445, test_f1: 0.6551
 epoch: 71, train_loss: 0.2587, test_loss: 1.9292, test_f1: 0.6502
 epoch: 72, train_loss: 0.2703, test_loss: 1.8791, test_f1: 0.6391
 epoch: 73, train_loss: 0.2492, test_loss: 1.8947, test_f1: 0.6521
 epoch: 74, train_loss: 0.2490, test_loss: 1.9050, test_f1: 0.6550
 epoch: 75, train_loss: 0.2681, test_loss: 1.8464, test_f1: 0.6578
 epoch: 76, train_loss: 0.2378, test_loss: 1.8642, test_f1: 0.6548
 epoch: 77, train_loss: 0.2170, test_loss: 1.9799, test_f1: 0.6565
 epoch: 78, train_loss: 0.2363, test_loss: 1.7558, test_f1: 0.6746
 epoch: 79, train_loss: 0.2218, test_loss: 1.9594, test_f1: 0.6328
 epoch: 80, train_loss: 0.2174, test_loss: 1.9035, test_f1: 0.6813
 epoch: 81, train_loss: 0.2346, test_loss: 1.9086, test_f1: 0.6924
 epoch: 82, train_loss: 0.1716, test_loss: 2.0344, test_f1: 0.6607
 epoch: 83, train_loss: 0.2007, test_loss: 2.3439, test_f1: 0.6368
 epoch: 84, train_loss: 0.2626, test_loss: 2.2277, test_f1: 0.6529
 epoch: 85, train_loss: 0.2044, test_loss: 2.1064, test_f1: 0.6582
 epoch: 86, train_loss: 0.2000, test_loss: 2.1177, test_f1: 0.6853
 epoch: 87, train_loss: 0.2320, test_loss: 1.9627, test_f1: 0.6469
 epoch: 88, train_loss: 0.2124, test_loss: 2.0680, test_f1: 0.6662
 epoch: 89, train_loss: 0.2008, test_loss: 2.1086, test_f1: 0.6516
 epoch: 90, train_loss: 0.2139, test_loss: 1.9400, test_f1: 0.6512
 epoch: 91, train_loss: 0.2209, test_loss: 2.0883, test_f1: 0.6338
 epoch: 92, train_loss: 0.1788, test_loss: 2.0869, test_f1: 0.6692
 epoch: 93, train_loss: 0.1964, test_loss: 2.3126, test_f1: 0.6663
 epoch: 94, train_loss: 0.2046, test_loss: 2.2787, test_f1: 0.6747
 epoch: 95, train_loss: 0.1873, test_loss: 2.2635, test_f1: 0.6772
 epoch: 96, train_loss: 0.1957, test_loss: 2.1586, test_f1: 0.6494
 epoch: 97, train_loss: 0.1658, test_loss: 2.3167, test_f1: 0.6667
 epoch: 98, train_loss: 0.1845, test_loss: 2.0617, test_f1: 0.6828
 epoch: 99, train_loss: 0.1649, test_loss: 2.0802, test_f1: 0.6751
##################ITERATION #6 ****************************************
 epoch: 0, train_loss: 1.2656, test_loss: 1.2536, test_f1: 0.4589
 epoch: 1, train_loss: 0.9556, test_loss: 0.9888, test_f1: 0.5283
 epoch: 2, train_loss: 0.9036, test_loss: 1.0097, test_f1: 0.5660
 epoch: 3, train_loss: 0.8677, test_loss: 1.1682, test_f1: 0.4788
 epoch: 4, train_loss: 0.8533, test_loss: 1.0647, test_f1: 0.4688
 epoch: 5, train_loss: 0.8324, test_loss: 1.1802, test_f1: 0.5790
 epoch: 6, train_loss: 0.8321, test_loss: 1.0158, test_f1: 0.5662
 epoch: 7, train_loss: 0.7928, test_loss: 0.9988, test_f1: 0.5718
 epoch: 8, train_loss: 0.7580, test_loss: 1.1703, test_f1: 0.5193
 epoch: 9, train_loss: 0.7692, test_loss: 0.9721, test_f1: 0.6186
 epoch: 10, train_loss: 0.7768, test_loss: 1.0409, test_f1: 0.5365
 epoch: 11, train_loss: 0.7510, test_loss: 1.0612, test_f1: 0.5962
 epoch: 12, train_loss: 0.7314, test_loss: 1.1188, test_f1: 0.5625
 epoch: 13, train_loss: 0.7131, test_loss: 0.9871, test_f1: 0.5786
 epoch: 14, train_loss: 0.7053, test_loss: 1.2013, test_f1: 0.6358
 epoch: 15, train_loss: 0.7237, test_loss: 1.0813, test_f1: 0.5418
 epoch: 16, train_loss: 0.7123, test_loss: 1.0469, test_f1: 0.5747
 epoch: 17, train_loss: 0.6797, test_loss: 1.0766, test_f1: 0.5866
 epoch: 18, train_loss: 0.6741, test_loss: 1.1469, test_f1: 0.5905
 epoch: 19, train_loss: 0.6707, test_loss: 1.3368, test_f1: 0.6426
 epoch: 20, train_loss: 0.6251, test_loss: 1.0819, test_f1: 0.6094
 epoch: 21, train_loss: 0.6301, test_loss: 1.0639, test_f1: 0.6336
 epoch: 22, train_loss: 0.6274, test_loss: 1.0861, test_f1: 0.6145
 epoch: 23, train_loss: 0.6179, test_loss: 1.0461, test_f1: 0.6548
 epoch: 24, train_loss: 0.6215, test_loss: 1.0752, test_f1: 0.6274
 epoch: 25, train_loss: 0.6190, test_loss: 1.1266, test_f1: 0.6057
 epoch: 26, train_loss: 0.5993, test_loss: 1.2685, test_f1: 0.6198
 epoch: 27, train_loss: 0.6435, test_loss: 1.0945, test_f1: 0.6208
 epoch: 28, train_loss: 0.5948, test_loss: 1.2288, test_f1: 0.6596
 epoch: 29, train_loss: 0.5700, test_loss: 1.2239, test_f1: 0.6029
 epoch: 30, train_loss: 0.5594, test_loss: 1.1972, test_f1: 0.6283
 epoch: 31, train_loss: 0.5168, test_loss: 1.9063, test_f1: 0.5520
 epoch: 32, train_loss: 0.5988, test_loss: 1.2014, test_f1: 0.6441
 epoch: 33, train_loss: 0.5577, test_loss: 1.3275, test_f1: 0.6443
 epoch: 34, train_loss: 0.5331, test_loss: 1.4075, test_f1: 0.6312
 epoch: 35, train_loss: 0.5186, test_loss: 1.7258, test_f1: 0.5874
 epoch: 36, train_loss: 0.5059, test_loss: 1.2744, test_f1: 0.6296
 epoch: 37, train_loss: 0.5082, test_loss: 1.1143, test_f1: 0.6507
 epoch: 38, train_loss: 0.5199, test_loss: 1.3678, test_f1: 0.6449
 epoch: 39, train_loss: 0.5447, test_loss: 1.5716, test_f1: 0.5551
 epoch: 40, train_loss: 0.5342, test_loss: 1.5506, test_f1: 0.6079
 epoch: 41, train_loss: 0.4846, test_loss: 1.3283, test_f1: 0.6758
 epoch: 42, train_loss: 0.4659, test_loss: 1.1679, test_f1: 0.6399
 epoch: 43, train_loss: 0.4540, test_loss: 1.2838, test_f1: 0.6546
 epoch: 44, train_loss: 0.4948, test_loss: 1.4266, test_f1: 0.6653
 epoch: 45, train_loss: 0.4756, test_loss: 1.3220, test_f1: 0.6021
 epoch: 46, train_loss: 0.5284, test_loss: 1.4246, test_f1: 0.6408
 epoch: 47, train_loss: 0.4589, test_loss: 1.3282, test_f1: 0.6084
 epoch: 48, train_loss: 0.4410, test_loss: 1.4224, test_f1: 0.6762
 epoch: 49, train_loss: 0.4260, test_loss: 1.5936, test_f1: 0.6342
 epoch: 50, train_loss: 0.4441, test_loss: 1.3595, test_f1: 0.5926
 epoch: 51, train_loss: 0.4034, test_loss: 1.4699, test_f1: 0.6568
 epoch: 52, train_loss: 0.3770, test_loss: 1.3731, test_f1: 0.6651
 epoch: 53, train_loss: 0.3609, test_loss: 1.4363, test_f1: 0.6480
 epoch: 54, train_loss: 0.3266, test_loss: 1.5402, test_f1: 0.6220
 epoch: 55, train_loss: 0.3486, test_loss: 1.7635, test_f1: 0.6350
 epoch: 56, train_loss: 0.3148, test_loss: 1.8520, test_f1: 0.6015
 epoch: 57, train_loss: 0.3274, test_loss: 1.8499, test_f1: 0.6009
 epoch: 58, train_loss: 0.3412, test_loss: 1.9177, test_f1: 0.6390
 epoch: 59, train_loss: 0.3469, test_loss: 1.9500, test_f1: 0.6116
 epoch: 60, train_loss: 0.3040, test_loss: 2.0291, test_f1: 0.5964
 epoch: 61, train_loss: 0.2709, test_loss: 2.0950, test_f1: 0.6268
 epoch: 62, train_loss: 0.3044, test_loss: 2.0318, test_f1: 0.6102
 epoch: 63, train_loss: 0.2825, test_loss: 2.1679, test_f1: 0.5790
 epoch: 64, train_loss: 0.3261, test_loss: 2.0030, test_f1: 0.6008
 epoch: 65, train_loss: 0.3528, test_loss: 1.6605, test_f1: 0.6010
 epoch: 66, train_loss: 0.2912, test_loss: 1.7572, test_f1: 0.5925
 epoch: 67, train_loss: 0.3158, test_loss: 1.9618, test_f1: 0.6269
 epoch: 68, train_loss: 0.2916, test_loss: 2.0333, test_f1: 0.5961
 epoch: 69, train_loss: 0.2608, test_loss: 2.0239, test_f1: 0.6091
 epoch: 70, train_loss: 0.2623, test_loss: 2.0068, test_f1: 0.6203
 epoch: 71, train_loss: 0.2644, test_loss: 2.2985, test_f1: 0.6026
 epoch: 72, train_loss: 0.2569, test_loss: 2.4124, test_f1: 0.6047
 epoch: 73, train_loss: 0.2184, test_loss: 2.4633, test_f1: 0.6471
 epoch: 74, train_loss: 0.2590, test_loss: 2.0954, test_f1: 0.6046
 epoch: 75, train_loss: 0.2379, test_loss: 2.2785, test_f1: 0.6485
 epoch: 76, train_loss: 0.2241, test_loss: 2.2398, test_f1: 0.6399
 epoch: 77, train_loss: 0.2067, test_loss: 3.0130, test_f1: 0.5838
 epoch: 78, train_loss: 0.2448, test_loss: 2.8892, test_f1: 0.5940
 epoch: 79, train_loss: 0.2550, test_loss: 2.5674, test_f1: 0.6463
 epoch: 80, train_loss: 0.2369, test_loss: 2.2566, test_f1: 0.6172
 epoch: 81, train_loss: 0.2414, test_loss: 2.4065, test_f1: 0.5985
 epoch: 82, train_loss: 0.1959, test_loss: 2.4227, test_f1: 0.6006
 epoch: 83, train_loss: 0.2048, test_loss: 2.4805, test_f1: 0.6214
 epoch: 84, train_loss: 0.2477, test_loss: 2.6360, test_f1: 0.6271
 epoch: 85, train_loss: 0.2119, test_loss: 2.4058, test_f1: 0.6450
 epoch: 86, train_loss: 0.2071, test_loss: 2.4867, test_f1: 0.5999
 epoch: 87, train_loss: 0.1992, test_loss: 2.3457, test_f1: 0.5785
 epoch: 88, train_loss: 0.2164, test_loss: 2.3302, test_f1: 0.5982
 epoch: 89, train_loss: 0.1785, test_loss: 2.5934, test_f1: 0.6022
 epoch: 90, train_loss: 0.2048, test_loss: 2.8172, test_f1: 0.5987
 epoch: 91, train_loss: 0.1914, test_loss: 2.6141, test_f1: 0.6530
 epoch: 92, train_loss: 0.2079, test_loss: 2.5205, test_f1: 0.5757
 epoch: 93, train_loss: 0.2363, test_loss: 2.3695, test_f1: 0.5977
 epoch: 94, train_loss: 0.2071, test_loss: 2.3549, test_f1: 0.6339
 epoch: 95, train_loss: 0.1534, test_loss: 2.2123, test_f1: 0.6590
 epoch: 96, train_loss: 0.1906, test_loss: 2.3709, test_f1: 0.5936
 epoch: 97, train_loss: 0.2132, test_loss: 1.8892, test_f1: 0.6481
 epoch: 98, train_loss: 0.2125, test_loss: 2.2514, test_f1: 0.6645
 epoch: 99, train_loss: 0.1869, test_loss: 2.1439, test_f1: 0.6585
##################ITERATION #7 ****************************************
 epoch: 0, train_loss: 1.2221, test_loss: 1.3460, test_f1: 0.2347
 epoch: 1, train_loss: 1.0051, test_loss: 1.0551, test_f1: 0.5086
 epoch: 2, train_loss: 0.9418, test_loss: 1.0729, test_f1: 0.5250
 epoch: 3, train_loss: 0.9009, test_loss: 1.0408, test_f1: 0.5311
 epoch: 4, train_loss: 0.8780, test_loss: 1.1174, test_f1: 0.4179
 epoch: 5, train_loss: 0.8572, test_loss: 1.3106, test_f1: 0.4284
 epoch: 6, train_loss: 0.8630, test_loss: 0.9823, test_f1: 0.4969
 epoch: 7, train_loss: 0.8506, test_loss: 0.9545, test_f1: 0.5743
 epoch: 8, train_loss: 0.8069, test_loss: 1.2401, test_f1: 0.4924
 epoch: 9, train_loss: 0.7886, test_loss: 0.9734, test_f1: 0.6039
 epoch: 10, train_loss: 0.7602, test_loss: 1.1072, test_f1: 0.5746
 epoch: 11, train_loss: 0.7841, test_loss: 1.0101, test_f1: 0.5869
 epoch: 12, train_loss: 0.7733, test_loss: 1.0051, test_f1: 0.6316
 epoch: 13, train_loss: 0.7671, test_loss: 1.0175, test_f1: 0.5705
 epoch: 14, train_loss: 0.7230, test_loss: 0.9592, test_f1: 0.6186
 epoch: 15, train_loss: 0.7287, test_loss: 2.0211, test_f1: 0.3867
 epoch: 16, train_loss: 0.7251, test_loss: 1.2188, test_f1: 0.5141
 epoch: 17, train_loss: 0.7649, test_loss: 0.9471, test_f1: 0.6267
 epoch: 18, train_loss: 0.6955, test_loss: 1.6040, test_f1: 0.4410
 epoch: 19, train_loss: 0.6793, test_loss: 1.1136, test_f1: 0.6296
 epoch: 20, train_loss: 0.7035, test_loss: 1.0370, test_f1: 0.5915
 epoch: 21, train_loss: 0.6718, test_loss: 1.2623, test_f1: 0.4558
 epoch: 22, train_loss: 0.6885, test_loss: 1.0478, test_f1: 0.6430
 epoch: 23, train_loss: 0.6743, test_loss: 1.0696, test_f1: 0.6118
 epoch: 24, train_loss: 0.7011, test_loss: 1.0905, test_f1: 0.4925
 epoch: 25, train_loss: 0.6548, test_loss: 1.0223, test_f1: 0.6585
 epoch: 26, train_loss: 0.6653, test_loss: 0.9919, test_f1: 0.6035
 epoch: 27, train_loss: 0.6276, test_loss: 1.1626, test_f1: 0.6075
 epoch: 28, train_loss: 0.6260, test_loss: 1.2570, test_f1: 0.5834
 epoch: 29, train_loss: 0.6334, test_loss: 0.9896, test_f1: 0.6316
 epoch: 30, train_loss: 0.6170, test_loss: 1.2548, test_f1: 0.6364
 epoch: 31, train_loss: 0.6057, test_loss: 1.3831, test_f1: 0.5607
 epoch: 32, train_loss: 0.6033, test_loss: 2.0255, test_f1: 0.6092
 epoch: 33, train_loss: 0.5764, test_loss: 1.2116, test_f1: 0.6185
 epoch: 34, train_loss: 0.6125, test_loss: 1.1347, test_f1: 0.5616
 epoch: 35, train_loss: 0.5918, test_loss: 1.6256, test_f1: 0.4531
 epoch: 36, train_loss: 0.5559, test_loss: 1.2111, test_f1: 0.5776
 epoch: 37, train_loss: 0.5334, test_loss: 1.3403, test_f1: 0.5907
 epoch: 38, train_loss: 0.5740, test_loss: 1.6907, test_f1: 0.5007
 epoch: 39, train_loss: 0.5504, test_loss: 14.0019, test_f1: 0.1502
 epoch: 40, train_loss: 0.5733, test_loss: 1.2960, test_f1: 0.6052
 epoch: 41, train_loss: 0.5606, test_loss: 1.2693, test_f1: 0.5825
 epoch: 42, train_loss: 0.5437, test_loss: 1.1234, test_f1: 0.6374
 epoch: 43, train_loss: 0.5643, test_loss: 1.8667, test_f1: 0.4867
 epoch: 44, train_loss: 0.6067, test_loss: 0.9563, test_f1: 0.6309
 epoch: 45, train_loss: 0.5070, test_loss: 1.1724, test_f1: 0.5920
 epoch: 46, train_loss: 0.5322, test_loss: 1.1991, test_f1: 0.5749
 epoch: 47, train_loss: 0.5162, test_loss: 1.0787, test_f1: 0.6194
 epoch: 48, train_loss: 0.5058, test_loss: 1.1855, test_f1: 0.6208
 epoch: 49, train_loss: 0.5484, test_loss: 1.5227, test_f1: 0.5813
 epoch: 50, train_loss: 0.4755, test_loss: 1.5206, test_f1: 0.5993
 epoch: 51, train_loss: 0.4295, test_loss: 1.1678, test_f1: 0.6485
 epoch: 52, train_loss: 0.3957, test_loss: 1.3976, test_f1: 0.6061
 epoch: 53, train_loss: 0.4032, test_loss: 1.2269, test_f1: 0.6156
 epoch: 54, train_loss: 0.3930, test_loss: 1.4703, test_f1: 0.6106
 epoch: 55, train_loss: 0.3753, test_loss: 1.3203, test_f1: 0.6288
 epoch: 56, train_loss: 0.3692, test_loss: 1.2243, test_f1: 0.6451
 epoch: 57, train_loss: 0.3691, test_loss: 1.3468, test_f1: 0.5993
 epoch: 58, train_loss: 0.3606, test_loss: 1.2985, test_f1: 0.6299
 epoch: 59, train_loss: 0.3363, test_loss: 1.4364, test_f1: 0.6300
 epoch: 60, train_loss: 0.3728, test_loss: 1.6109, test_f1: 0.5888
 epoch: 61, train_loss: 0.3777, test_loss: 1.7479, test_f1: 0.5997
 epoch: 62, train_loss: 0.3506, test_loss: 1.8126, test_f1: 0.6483
 epoch: 63, train_loss: 0.3972, test_loss: 1.1671, test_f1: 0.6428
 epoch: 64, train_loss: 0.3637, test_loss: 1.4316, test_f1: 0.5976
 epoch: 65, train_loss: 0.3499, test_loss: 1.4579, test_f1: 0.6087
 epoch: 66, train_loss: 0.3315, test_loss: 1.5791, test_f1: 0.6135
 epoch: 67, train_loss: 0.3156, test_loss: 1.6063, test_f1: 0.6362
 epoch: 68, train_loss: 0.3045, test_loss: 1.7402, test_f1: 0.6244
 epoch: 69, train_loss: 0.3016, test_loss: 1.3805, test_f1: 0.6049
 epoch: 70, train_loss: 0.3075, test_loss: 1.4289, test_f1: 0.6267
 epoch: 71, train_loss: 0.2820, test_loss: 1.8619, test_f1: 0.5952
 epoch: 72, train_loss: 0.2857, test_loss: 1.5670, test_f1: 0.6355
 epoch: 73, train_loss: 0.3014, test_loss: 1.5124, test_f1: 0.6212
 epoch: 74, train_loss: 0.2912, test_loss: 1.6844, test_f1: 0.6308
 epoch: 75, train_loss: 0.3137, test_loss: 1.6637, test_f1: 0.6218
 epoch: 76, train_loss: 0.2890, test_loss: 1.3416, test_f1: 0.6409
 epoch: 77, train_loss: 0.2856, test_loss: 2.1296, test_f1: 0.6382
 epoch: 78, train_loss: 0.2597, test_loss: 2.0004, test_f1: 0.6176
 epoch: 79, train_loss: 0.2871, test_loss: 1.6579, test_f1: 0.6096
 epoch: 80, train_loss: 0.2810, test_loss: 1.5371, test_f1: 0.6228
 epoch: 81, train_loss: 0.2922, test_loss: 1.8011, test_f1: 0.6317
 epoch: 82, train_loss: 0.2546, test_loss: 2.1656, test_f1: 0.5950
 epoch: 83, train_loss: 0.2855, test_loss: 1.7575, test_f1: 0.6037
 epoch: 84, train_loss: 0.2565, test_loss: 1.7497, test_f1: 0.6420
 epoch: 85, train_loss: 0.2884, test_loss: 1.7092, test_f1: 0.6026
 epoch: 86, train_loss: 0.2424, test_loss: 1.8370, test_f1: 0.6274
 epoch: 87, train_loss: 0.2351, test_loss: 1.9220, test_f1: 0.5938
 epoch: 88, train_loss: 0.2422, test_loss: 1.8726, test_f1: 0.6388
 epoch: 89, train_loss: 0.2349, test_loss: 1.7961, test_f1: 0.6043
 epoch: 90, train_loss: 0.2559, test_loss: 2.1211, test_f1: 0.6223
 epoch: 91, train_loss: 0.2900, test_loss: 1.4617, test_f1: 0.6313
 epoch: 92, train_loss: 0.2499, test_loss: 1.6697, test_f1: 0.5799
 epoch: 93, train_loss: 0.1999, test_loss: 2.1871, test_f1: 0.6197
 epoch: 94, train_loss: 0.2137, test_loss: 1.8537, test_f1: 0.6044
 epoch: 95, train_loss: 0.2094, test_loss: 1.8675, test_f1: 0.6006
 epoch: 96, train_loss: 0.2411, test_loss: 1.9311, test_f1: 0.6144
 epoch: 97, train_loss: 0.2719, test_loss: 2.0962, test_f1: 0.5201
 epoch: 98, train_loss: 0.2511, test_loss: 1.7527, test_f1: 0.6264
 epoch: 99, train_loss: 0.2450, test_loss: 1.6110, test_f1: 0.6556
##################ITERATION #8 ****************************************
 epoch: 0, train_loss: 1.2047, test_loss: 1.1298, test_f1: 0.4559
 epoch: 1, train_loss: 0.9346, test_loss: 1.0852, test_f1: 0.4942
 epoch: 2, train_loss: 0.8868, test_loss: 1.0311, test_f1: 0.5158
 epoch: 3, train_loss: 0.8342, test_loss: 1.2293, test_f1: 0.4994
 epoch: 4, train_loss: 0.8326, test_loss: 1.7244, test_f1: 0.4166
 epoch: 5, train_loss: 0.7888, test_loss: 0.9961, test_f1: 0.5485
 epoch: 6, train_loss: 0.7720, test_loss: 1.0161, test_f1: 0.5495
 epoch: 7, train_loss: 0.7690, test_loss: 1.0625, test_f1: 0.5142
 epoch: 8, train_loss: 0.7587, test_loss: 1.1071, test_f1: 0.5173
 epoch: 9, train_loss: 0.7336, test_loss: 1.0332, test_f1: 0.5525
 epoch: 10, train_loss: 0.7983, test_loss: 1.1279, test_f1: 0.5206
 epoch: 11, train_loss: 0.7421, test_loss: 1.0762, test_f1: 0.5001
 epoch: 12, train_loss: 0.7204, test_loss: 0.9691, test_f1: 0.6095
 epoch: 13, train_loss: 0.6803, test_loss: 1.0821, test_f1: 0.5406
 epoch: 14, train_loss: 0.7014, test_loss: 1.0336, test_f1: 0.5084
 epoch: 15, train_loss: 0.7102, test_loss: 1.0642, test_f1: 0.6304
 epoch: 16, train_loss: 0.6533, test_loss: 1.1226, test_f1: 0.5797
 epoch: 17, train_loss: 0.6721, test_loss: 1.0782, test_f1: 0.5895
 epoch: 18, train_loss: 0.6343, test_loss: 1.1221, test_f1: 0.5635
 epoch: 19, train_loss: 0.6712, test_loss: 0.9249, test_f1: 0.5889
 epoch: 20, train_loss: 0.6479, test_loss: 1.1661, test_f1: 0.5866
 epoch: 21, train_loss: 0.6423, test_loss: 1.1169, test_f1: 0.5499
 epoch: 22, train_loss: 0.6270, test_loss: 0.9195, test_f1: 0.6026
 epoch: 23, train_loss: 0.6505, test_loss: 1.0556, test_f1: 0.5682
 epoch: 24, train_loss: 0.6026, test_loss: 1.2468, test_f1: 0.5597
 epoch: 25, train_loss: 0.6595, test_loss: 1.0415, test_f1: 0.5912
 epoch: 26, train_loss: 0.6370, test_loss: 0.9945, test_f1: 0.6490
 epoch: 27, train_loss: 0.6197, test_loss: 1.1222, test_f1: 0.5382
 epoch: 28, train_loss: 0.6066, test_loss: 0.9612, test_f1: 0.6413
 epoch: 29, train_loss: 0.5873, test_loss: 1.2188, test_f1: 0.5764
 epoch: 30, train_loss: 0.5884, test_loss: 1.1085, test_f1: 0.5490
 epoch: 31, train_loss: 0.5661, test_loss: 1.0411, test_f1: 0.5902
 epoch: 32, train_loss: 0.5846, test_loss: 1.5942, test_f1: 0.5081
 epoch: 33, train_loss: 0.5742, test_loss: 1.0394, test_f1: 0.5994
 epoch: 34, train_loss: 0.5637, test_loss: 1.3026, test_f1: 0.5979
 epoch: 35, train_loss: 0.5367, test_loss: 1.0491, test_f1: 0.6174
 epoch: 36, train_loss: 0.5336, test_loss: 1.1902, test_f1: 0.6051
 epoch: 37, train_loss: 0.5230, test_loss: 1.1892, test_f1: 0.5373
 epoch: 38, train_loss: 0.5237, test_loss: 1.1897, test_f1: 0.6646
 epoch: 39, train_loss: 0.5345, test_loss: 1.1134, test_f1: 0.6188
 epoch: 40, train_loss: 0.5404, test_loss: 1.2038, test_f1: 0.6631
 epoch: 41, train_loss: 0.5189, test_loss: 0.9962, test_f1: 0.6178
 epoch: 42, train_loss: 0.5072, test_loss: 1.1618, test_f1: 0.6320
 epoch: 43, train_loss: 0.5519, test_loss: 1.4061, test_f1: 0.5649
 epoch: 44, train_loss: 0.4916, test_loss: 1.3660, test_f1: 0.6169
 epoch: 45, train_loss: 0.4764, test_loss: 1.3798, test_f1: 0.5627
 epoch: 46, train_loss: 0.5194, test_loss: 1.0707, test_f1: 0.6093
 epoch: 47, train_loss: 0.5003, test_loss: 2.0607, test_f1: 0.5777
 epoch: 48, train_loss: 0.5183, test_loss: 1.2259, test_f1: 0.6339
 epoch: 49, train_loss: 0.4671, test_loss: 1.2772, test_f1: 0.6230
 epoch: 50, train_loss: 0.4692, test_loss: 1.2683, test_f1: 0.6231
 epoch: 51, train_loss: 0.4042, test_loss: 1.2632, test_f1: 0.6451
 epoch: 52, train_loss: 0.3774, test_loss: 1.3372, test_f1: 0.5825
 epoch: 53, train_loss: 0.3927, test_loss: 1.1350, test_f1: 0.6100
 epoch: 54, train_loss: 0.3929, test_loss: 1.3164, test_f1: 0.6248
 epoch: 55, train_loss: 0.3687, test_loss: 1.2882, test_f1: 0.6583
 epoch: 56, train_loss: 0.3685, test_loss: 1.4360, test_f1: 0.6124
 epoch: 57, train_loss: 0.3654, test_loss: 1.3310, test_f1: 0.5939
 epoch: 58, train_loss: 0.3448, test_loss: 1.4581, test_f1: 0.6077
 epoch: 59, train_loss: 0.3179, test_loss: 1.4808, test_f1: 0.6182
 epoch: 60, train_loss: 0.3403, test_loss: 1.6356, test_f1: 0.6262
 epoch: 61, train_loss: 0.3843, test_loss: 1.2912, test_f1: 0.6771
 epoch: 62, train_loss: 0.3053, test_loss: 1.4026, test_f1: 0.6047
 epoch: 63, train_loss: 0.3037, test_loss: 1.4352, test_f1: 0.6519
 epoch: 64, train_loss: 0.3181, test_loss: 1.4838, test_f1: 0.6297
 epoch: 65, train_loss: 0.2965, test_loss: 1.4943, test_f1: 0.6669
 epoch: 66, train_loss: 0.3074, test_loss: 1.6980, test_f1: 0.6267
 epoch: 67, train_loss: 0.2983, test_loss: 1.6139, test_f1: 0.6573
 epoch: 68, train_loss: 0.3309, test_loss: 1.4538, test_f1: 0.6723
 epoch: 69, train_loss: 0.3152, test_loss: 1.5970, test_f1: 0.6596
 epoch: 70, train_loss: 0.2794, test_loss: 1.5440, test_f1: 0.6544
 epoch: 71, train_loss: 0.3134, test_loss: 1.6096, test_f1: 0.6681
 epoch: 72, train_loss: 0.2687, test_loss: 1.5228, test_f1: 0.6422
 epoch: 73, train_loss: 0.2602, test_loss: 1.5042, test_f1: 0.6542
 epoch: 74, train_loss: 0.2629, test_loss: 1.5679, test_f1: 0.6577
 epoch: 75, train_loss: 0.3017, test_loss: 1.3937, test_f1: 0.6437
 epoch: 76, train_loss: 0.2872, test_loss: 1.7930, test_f1: 0.6344
 epoch: 77, train_loss: 0.3304, test_loss: 1.4838, test_f1: 0.6680
 epoch: 78, train_loss: 0.2641, test_loss: 1.5316, test_f1: 0.6495
 epoch: 79, train_loss: 0.2841, test_loss: 1.5480, test_f1: 0.6643
 epoch: 80, train_loss: 0.2697, test_loss: 1.5835, test_f1: 0.6992
 epoch: 81, train_loss: 0.2657, test_loss: 1.5102, test_f1: 0.6345
 epoch: 82, train_loss: 0.2467, test_loss: 1.9796, test_f1: 0.6388
 epoch: 83, train_loss: 0.2294, test_loss: 1.6418, test_f1: 0.6629
 epoch: 84, train_loss: 0.2426, test_loss: 1.7171, test_f1: 0.6605
 epoch: 85, train_loss: 0.2040, test_loss: 1.9000, test_f1: 0.6820
 epoch: 86, train_loss: 0.2525, test_loss: 1.8286, test_f1: 0.6686
 epoch: 87, train_loss: 0.2288, test_loss: 2.0210, test_f1: 0.6363
 epoch: 88, train_loss: 0.3186, test_loss: 1.5376, test_f1: 0.6603
 epoch: 89, train_loss: 0.2703, test_loss: 1.6889, test_f1: 0.6582
 epoch: 90, train_loss: 0.2533, test_loss: 1.8835, test_f1: 0.6263
 epoch: 91, train_loss: 0.2089, test_loss: 1.9645, test_f1: 0.6607
 epoch: 92, train_loss: 0.2294, test_loss: 1.8345, test_f1: 0.6461
 epoch: 93, train_loss: 0.2138, test_loss: 1.8225, test_f1: 0.6676
 epoch: 94, train_loss: 0.2128, test_loss: 1.7962, test_f1: 0.6402
 epoch: 95, train_loss: 0.2012, test_loss: 1.9955, test_f1: 0.6651
 epoch: 96, train_loss: 0.1898, test_loss: 1.8883, test_f1: 0.6610
 epoch: 97, train_loss: 0.1779, test_loss: 1.8489, test_f1: 0.6462
 epoch: 98, train_loss: 0.2572, test_loss: 1.5979, test_f1: 0.6566
 epoch: 99, train_loss: 0.1827, test_loss: 1.7586, test_f1: 0.6383
##################ITERATION #9 ****************************************
 epoch: 0, train_loss: 1.2550, test_loss: 1.3376, test_f1: 0.4116
 epoch: 1, train_loss: 1.0045, test_loss: 1.1489, test_f1: 0.4611
 epoch: 2, train_loss: 0.9392, test_loss: 0.9784, test_f1: 0.5726
 epoch: 3, train_loss: 0.8991, test_loss: 1.1080, test_f1: 0.4539
 epoch: 4, train_loss: 0.8719, test_loss: 1.0106, test_f1: 0.5414
 epoch: 5, train_loss: 0.8561, test_loss: 1.1686, test_f1: 0.5068
 epoch: 6, train_loss: 0.7934, test_loss: 1.0876, test_f1: 0.5302
 epoch: 7, train_loss: 0.7981, test_loss: 1.6125, test_f1: 0.4701
 epoch: 8, train_loss: 0.7828, test_loss: 0.9840, test_f1: 0.6017
 epoch: 9, train_loss: 0.7456, test_loss: 1.9087, test_f1: 0.4151
 epoch: 10, train_loss: 0.7394, test_loss: 1.2295, test_f1: 0.5653
 epoch: 11, train_loss: 0.7326, test_loss: 1.0543, test_f1: 0.6324
 epoch: 12, train_loss: 0.7241, test_loss: 1.4143, test_f1: 0.6321
 epoch: 13, train_loss: 0.7435, test_loss: 1.2652, test_f1: 0.5948
 epoch: 14, train_loss: 0.7125, test_loss: 0.9291, test_f1: 0.6307
 epoch: 15, train_loss: 0.6814, test_loss: 0.9703, test_f1: 0.6290
 epoch: 16, train_loss: 0.6938, test_loss: 1.7665, test_f1: 0.5096
 epoch: 17, train_loss: 0.6934, test_loss: 1.0174, test_f1: 0.5287
 epoch: 18, train_loss: 0.6901, test_loss: 1.2201, test_f1: 0.5922
 epoch: 19, train_loss: 0.7317, test_loss: 1.1331, test_f1: 0.5673
 epoch: 20, train_loss: 0.6844, test_loss: 1.1813, test_f1: 0.6015
 epoch: 21, train_loss: 0.6578, test_loss: 1.2736, test_f1: 0.5993
 epoch: 22, train_loss: 0.6445, test_loss: 1.0001, test_f1: 0.6070
 epoch: 23, train_loss: 0.6157, test_loss: 1.0038, test_f1: 0.6335
 epoch: 24, train_loss: 0.6331, test_loss: 1.0553, test_f1: 0.6461
 epoch: 25, train_loss: 0.6368, test_loss: 0.9893, test_f1: 0.5875
 epoch: 26, train_loss: 0.6552, test_loss: 1.1721, test_f1: 0.5814
 epoch: 27, train_loss: 0.6078, test_loss: 1.4738, test_f1: 0.5494
 epoch: 28, train_loss: 0.5963, test_loss: 1.0605, test_f1: 0.5623
 epoch: 29, train_loss: 0.7151, test_loss: 1.6864, test_f1: 0.4644
 epoch: 30, train_loss: 0.6009, test_loss: 1.0568, test_f1: 0.6024
 epoch: 31, train_loss: 0.5640, test_loss: 1.1643, test_f1: 0.5946
 epoch: 32, train_loss: 0.5837, test_loss: 1.2478, test_f1: 0.5873
 epoch: 33, train_loss: 0.5432, test_loss: 1.1618, test_f1: 0.5617
 epoch: 34, train_loss: 0.5488, test_loss: 1.4097, test_f1: 0.6229
 epoch: 35, train_loss: 0.5369, test_loss: 1.3497, test_f1: 0.6014
 epoch: 36, train_loss: 0.5576, test_loss: 1.2041, test_f1: 0.6430
 epoch: 37, train_loss: 0.5681, test_loss: 1.1211, test_f1: 0.5834
 epoch: 38, train_loss: 0.5427, test_loss: 1.1875, test_f1: 0.5546
 epoch: 39, train_loss: 0.5008, test_loss: 1.2180, test_f1: 0.6398
 epoch: 40, train_loss: 0.5437, test_loss: 1.0981, test_f1: 0.6441
 epoch: 41, train_loss: 0.5995, test_loss: 1.1285, test_f1: 0.5767
 epoch: 42, train_loss: 0.5203, test_loss: 1.2371, test_f1: 0.6473
 epoch: 43, train_loss: 0.5267, test_loss: 1.1489, test_f1: 0.6603
 epoch: 44, train_loss: 0.4970, test_loss: 1.2191, test_f1: 0.6138
 epoch: 45, train_loss: 0.5659, test_loss: 1.1147, test_f1: 0.6288
 epoch: 46, train_loss: 0.5624, test_loss: 1.0758, test_f1: 0.6319
 epoch: 47, train_loss: 0.5527, test_loss: 1.4135, test_f1: 0.5997
 epoch: 48, train_loss: 0.5444, test_loss: 1.1720, test_f1: 0.5498
 epoch: 49, train_loss: 0.5558, test_loss: 1.2999, test_f1: 0.6410
 epoch: 50, train_loss: 0.4919, test_loss: 1.0531, test_f1: 0.6737
 epoch: 51, train_loss: 0.4415, test_loss: 1.1843, test_f1: 0.6466
 epoch: 52, train_loss: 0.4039, test_loss: 1.1979, test_f1: 0.6451
 epoch: 53, train_loss: 0.4019, test_loss: 1.1969, test_f1: 0.6606
 epoch: 54, train_loss: 0.4009, test_loss: 1.5111, test_f1: 0.6434
 epoch: 55, train_loss: 0.4019, test_loss: 1.4331, test_f1: 0.6236
 epoch: 56, train_loss: 0.3721, test_loss: 1.9204, test_f1: 0.6452
 epoch: 57, train_loss: 0.3793, test_loss: 1.4461, test_f1: 0.6068
 epoch: 58, train_loss: 0.3542, test_loss: 1.4391, test_f1: 0.6613
 epoch: 59, train_loss: 0.3279, test_loss: 1.7723, test_f1: 0.6388
 epoch: 60, train_loss: 0.3451, test_loss: 1.4182, test_f1: 0.6407
 epoch: 61, train_loss: 0.3623, test_loss: 1.3974, test_f1: 0.6370
 epoch: 62, train_loss: 0.3459, test_loss: 1.8657, test_f1: 0.5974
 epoch: 63, train_loss: 0.3342, test_loss: 1.4740, test_f1: 0.6412
 epoch: 64, train_loss: 0.3609, test_loss: 1.3441, test_f1: 0.6429
 epoch: 65, train_loss: 0.3267, test_loss: 1.5284, test_f1: 0.6386
 epoch: 66, train_loss: 0.3230, test_loss: 1.4154, test_f1: 0.6242
 epoch: 67, train_loss: 0.3332, test_loss: 1.7407, test_f1: 0.6358
 epoch: 68, train_loss: 0.3067, test_loss: 1.6547, test_f1: 0.6094
 epoch: 69, train_loss: 0.2941, test_loss: 2.7113, test_f1: 0.5940
 epoch: 70, train_loss: 0.2720, test_loss: 1.8099, test_f1: 0.6335
 epoch: 71, train_loss: 0.2797, test_loss: 2.0828, test_f1: 0.6353
 epoch: 72, train_loss: 0.3052, test_loss: 2.6410, test_f1: 0.6334
 epoch: 73, train_loss: 0.3121, test_loss: 1.6687, test_f1: 0.6626
 epoch: 74, train_loss: 0.2661, test_loss: 2.1999, test_f1: 0.6119
 epoch: 75, train_loss: 0.2701, test_loss: 1.9517, test_f1: 0.6413
 epoch: 76, train_loss: 0.2878, test_loss: 1.6132, test_f1: 0.6731
 epoch: 77, train_loss: 0.2535, test_loss: 2.1863, test_f1: 0.6433
 epoch: 78, train_loss: 0.2776, test_loss: 1.6281, test_f1: 0.6459
 epoch: 79, train_loss: 0.2579, test_loss: 1.6344, test_f1: 0.6663
 epoch: 80, train_loss: 0.2653, test_loss: 1.9558, test_f1: 0.6600
 epoch: 81, train_loss: 0.2566, test_loss: 2.0179, test_f1: 0.6310
 epoch: 82, train_loss: 0.2643, test_loss: 1.5973, test_f1: 0.7205
 epoch: 83, train_loss: 0.2470, test_loss: 1.9127, test_f1: 0.6278
 epoch: 84, train_loss: 0.2388, test_loss: 2.0106, test_f1: 0.6076
 epoch: 85, train_loss: 0.2034, test_loss: 2.4639, test_f1: 0.6465
 epoch: 86, train_loss: 0.2610, test_loss: 2.0965, test_f1: 0.7061
 epoch: 87, train_loss: 0.2255, test_loss: 2.3101, test_f1: 0.6312
 epoch: 88, train_loss: 0.2179, test_loss: 1.9926, test_f1: 0.6475
 epoch: 89, train_loss: 0.2003, test_loss: 2.2672, test_f1: 0.6890
 epoch: 90, train_loss: 0.2020, test_loss: 2.2924, test_f1: 0.6594
 epoch: 91, train_loss: 0.2541, test_loss: 1.8715, test_f1: 0.6234
 epoch: 92, train_loss: 0.2527, test_loss: 1.7787, test_f1: 0.6306
 epoch: 93, train_loss: 0.2135, test_loss: 2.4284, test_f1: 0.6132
 epoch: 94, train_loss: 0.2449, test_loss: 2.0875, test_f1: 0.6869
 epoch: 95, train_loss: 0.2049, test_loss: 2.1375, test_f1: 0.6697
 epoch: 96, train_loss: 0.2392, test_loss: 2.0639, test_f1: 0.6839
 epoch: 97, train_loss: 0.1728, test_loss: 2.1083, test_f1: 0.6392
 epoch: 98, train_loss: 0.1925, test_loss: 2.3692, test_f1: 0.6163
 epoch: 99, train_loss: 0.1635, test_loss: 2.5877, test_f1: 0.6611

Training completed in 597.97 seconds
Best F1: 0.7205 at epoch 82
Mean F1 across iterations: 0.6891  0.0200
========================FINAL RESULTS================================
FEGIN weighted F1: 0.7205  0.0200
python main.py --data ltspice_demos --representation component_pin --model FEGIN --layers 3 --hiddens 128 --batch_size 64 --lr 0.01 --emb_size 512 --epochs 100 --save_appendix component_pin_L3_H128_BS64_LR0.01_E512 --no_val
-----



STDERR:
  File "main.py", line 370, in <module>
    main()
  File "main.py", line 254, in main
    dataset = dataset_class(
  File "/home/philip/projects/ltspice_examples_code_repo/Circuit-Completion-Using-GNNs/component_classification_with_link_prediction_head/evaluation/FEGIN/kernel/circuit_datasets.py", line 15, in __init__
    self.data, self.slices = torch.load(self.processed_paths[0])
  File "/home/philip/.local/lib/python3.8/site-packages/torch/serialization.py", line 1040, in load
    warnings.warn(
  File "/usr/lib/python3.8/warnings.py", line 109, in _showwarnmsg
    sw(msg.message, msg.category, msg.filename, msg.lineno,
  File "main.py", line 47, in warn_with_traceback
    traceback.print_stack(file=log)
/home/philip/projects/ltspice_examples_code_repo/Circuit-Completion-Using-GNNs/component_classification_with_link_prediction_head/evaluation/FEGIN/kernel/circuit_datasets.py:15: FutureWarning: You are using `torch.load` with `weights_only=False` (the current default value), which uses the default pickle module implicitly. It is possible to construct malicious pickle data which will execute arbitrary code during unpickling (See https://github.com/pytorch/pytorch/blob/main/SECURITY.md#untrusted-models for more details). In a future release, the default value for `weights_only` will be flipped to `True`. This limits the functions that could be executed during unpickling. Arbitrary objects will no longer be allowed to be loaded via this mode unless they are explicitly allowlisted by the user via `torch.serialization.add_safe_globals`. We recommend you start setting `weights_only=True` for any use case where you don't have full control of the loaded file. Please open an issue on GitHub for any issues related to this experimental feature.
  self.data, self.slices = torch.load(self.processed_paths[0])
