STDOUT:
Results will be saved in /home/philip/projects/ltspice_examples_code_repo/Circuit-Completion-Using-GNNs/component_classification_with_link_prediction_head/evaluation/FEGIN/results/model_FEGIN_dataset_ltspice_demos
Command line input: python main.py --data ltspice_demos --representation component_component --model FEGIN --layers 3 --hiddens 128 --batch_size 32 --lr 0.001 --emb_size 512 --epochs 100 --save_appendix component_component_L3_H128_BS32_LR0.001_E512 --no_val
 is saved.
-----
ltspice_demos - FEGIN
Using 3 layers, 128 hidden units, h = 2
Loading component_component representation dataset
ENTERED
Training FEGIN on component_component representation
Train: 1565, Test: 383
##################ITERATION #0 ****************************************
 epoch: 0, train_loss: 1.2234, test_loss: 1.2758, test_f1: 0.2588
 epoch: 1, train_loss: 1.1076, test_loss: 1.2535, test_f1: 0.3673
 epoch: 2, train_loss: 1.0541, test_loss: 1.3175, test_f1: 0.4451
 epoch: 3, train_loss: 1.0270, test_loss: 1.2175, test_f1: 0.4448
 epoch: 4, train_loss: 0.9879, test_loss: 1.1410, test_f1: 0.5477
 epoch: 5, train_loss: 0.9343, test_loss: 1.1407, test_f1: 0.5395
 epoch: 6, train_loss: 0.9257, test_loss: 1.2931, test_f1: 0.5501
 epoch: 7, train_loss: 0.8834, test_loss: 1.2750, test_f1: 0.4950
 epoch: 8, train_loss: 0.8614, test_loss: 1.0968, test_f1: 0.5676
 epoch: 9, train_loss: 0.8480, test_loss: 1.1574, test_f1: 0.5155
 epoch: 10, train_loss: 0.8252, test_loss: 1.1799, test_f1: 0.6090
 epoch: 11, train_loss: 0.8147, test_loss: 1.0398, test_f1: 0.6248
 epoch: 12, train_loss: 0.7920, test_loss: 1.3912, test_f1: 0.4685
 epoch: 13, train_loss: 0.7896, test_loss: 1.2217, test_f1: 0.5413
 epoch: 14, train_loss: 0.7705, test_loss: 1.2695, test_f1: 0.5239
 epoch: 15, train_loss: 0.7260, test_loss: 1.2935, test_f1: 0.5498
 epoch: 16, train_loss: 0.7492, test_loss: 1.5783, test_f1: 0.5395
 epoch: 17, train_loss: 0.7402, test_loss: 1.4917, test_f1: 0.5775
 epoch: 18, train_loss: 0.7063, test_loss: 1.2787, test_f1: 0.5786
 epoch: 19, train_loss: 0.7119, test_loss: 1.3872, test_f1: 0.5683
 epoch: 20, train_loss: 0.7097, test_loss: 1.3834, test_f1: 0.5792
 epoch: 21, train_loss: 0.6506, test_loss: 1.3023, test_f1: 0.5616
 epoch: 22, train_loss: 0.6514, test_loss: 1.4456, test_f1: 0.5471
 epoch: 23, train_loss: 0.6482, test_loss: 1.3670, test_f1: 0.5460
 epoch: 24, train_loss: 0.6464, test_loss: 1.3213, test_f1: 0.5345
 epoch: 25, train_loss: 0.5943, test_loss: 1.3699, test_f1: 0.5720
 epoch: 26, train_loss: 0.6104, test_loss: 1.5740, test_f1: 0.5163
 epoch: 27, train_loss: 0.5841, test_loss: 1.5554, test_f1: 0.5779
 epoch: 28, train_loss: 0.6021, test_loss: 1.7127, test_f1: 0.5481
 epoch: 29, train_loss: 0.5719, test_loss: 1.4583, test_f1: 0.5547
 epoch: 30, train_loss: 0.5785, test_loss: 1.5501, test_f1: 0.5572
 epoch: 31, train_loss: 0.5553, test_loss: 1.7298, test_f1: 0.5112
 epoch: 32, train_loss: 0.5455, test_loss: 1.6285, test_f1: 0.5690
 epoch: 33, train_loss: 0.5214, test_loss: 1.8832, test_f1: 0.5202
 epoch: 34, train_loss: 0.5217, test_loss: 1.7575, test_f1: 0.5451
 epoch: 35, train_loss: 0.4785, test_loss: 1.7770, test_f1: 0.5594
 epoch: 36, train_loss: 0.5357, test_loss: 1.9945, test_f1: 0.5032
 epoch: 37, train_loss: 0.4884, test_loss: 2.5968, test_f1: 0.5318
 epoch: 38, train_loss: 0.4915, test_loss: 1.7420, test_f1: 0.5584
 epoch: 39, train_loss: 0.5287, test_loss: 1.6864, test_f1: 0.5428
 epoch: 40, train_loss: 0.4787, test_loss: 1.9370, test_f1: 0.5327
 epoch: 41, train_loss: 0.5102, test_loss: 1.9809, test_f1: 0.5436
 epoch: 42, train_loss: 0.4669, test_loss: 1.5951, test_f1: 0.6154
 epoch: 43, train_loss: 0.4645, test_loss: 1.9206, test_f1: 0.5427
 epoch: 44, train_loss: 0.4644, test_loss: 2.1026, test_f1: 0.5818
 epoch: 45, train_loss: 0.4342, test_loss: 2.2152, test_f1: 0.4893
 epoch: 46, train_loss: 0.4060, test_loss: 2.2556, test_f1: 0.5350
 epoch: 47, train_loss: 0.4164, test_loss: 2.2564, test_f1: 0.5623
 epoch: 48, train_loss: 0.4295, test_loss: 2.9037, test_f1: 0.5221
 epoch: 49, train_loss: 0.4116, test_loss: 2.2349, test_f1: 0.5513
 epoch: 50, train_loss: 0.4260, test_loss: 2.0649, test_f1: 0.5596
 epoch: 51, train_loss: 0.3672, test_loss: 2.5312, test_f1: 0.5526
 epoch: 52, train_loss: 0.3387, test_loss: 2.1498, test_f1: 0.5708
 epoch: 53, train_loss: 0.3258, test_loss: 2.3249, test_f1: 0.5975
 epoch: 54, train_loss: 0.3266, test_loss: 2.3422, test_f1: 0.5510
 epoch: 55, train_loss: 0.3047, test_loss: 2.3562, test_f1: 0.5927
 epoch: 56, train_loss: 0.3121, test_loss: 2.6887, test_f1: 0.5166
 epoch: 57, train_loss: 0.3423, test_loss: 2.9027, test_f1: 0.5645
 epoch: 58, train_loss: 0.3018, test_loss: 2.6464, test_f1: 0.5633
 epoch: 59, train_loss: 0.2813, test_loss: 2.7504, test_f1: 0.5595
 epoch: 60, train_loss: 0.2700, test_loss: 2.5758, test_f1: 0.5720
 epoch: 61, train_loss: 0.2804, test_loss: 3.0753, test_f1: 0.5526
 epoch: 62, train_loss: 0.3034, test_loss: 2.9157, test_f1: 0.5581
 epoch: 63, train_loss: 0.2906, test_loss: 2.8041, test_f1: 0.5536
 epoch: 64, train_loss: 0.2790, test_loss: 3.3244, test_f1: 0.5359
 epoch: 65, train_loss: 0.2968, test_loss: 2.7220, test_f1: 0.5611
 epoch: 66, train_loss: 0.3086, test_loss: 2.7601, test_f1: 0.5578
 epoch: 67, train_loss: 0.2745, test_loss: 2.7060, test_f1: 0.5783
 epoch: 68, train_loss: 0.2600, test_loss: 2.7181, test_f1: 0.5638
 epoch: 69, train_loss: 0.2462, test_loss: 2.8053, test_f1: 0.5845
 epoch: 70, train_loss: 0.2682, test_loss: 2.6607, test_f1: 0.5581
 epoch: 71, train_loss: 0.2458, test_loss: 3.1394, test_f1: 0.5596
 epoch: 72, train_loss: 0.2367, test_loss: 2.6858, test_f1: 0.5598
 epoch: 73, train_loss: 0.2562, test_loss: 2.9605, test_f1: 0.5726
 epoch: 74, train_loss: 0.2862, test_loss: 2.9296, test_f1: 0.5704
 epoch: 75, train_loss: 0.2513, test_loss: 3.0594, test_f1: 0.5688
 epoch: 76, train_loss: 0.2665, test_loss: 2.5618, test_f1: 0.5799
 epoch: 77, train_loss: 0.2238, test_loss: 2.8396, test_f1: 0.6096
 epoch: 78, train_loss: 0.2445, test_loss: 2.9430, test_f1: 0.5712
 epoch: 79, train_loss: 0.2352, test_loss: 3.0806, test_f1: 0.5853
 epoch: 80, train_loss: 0.2239, test_loss: 3.2248, test_f1: 0.5937
 epoch: 81, train_loss: 0.2030, test_loss: 3.1281, test_f1: 0.5778
 epoch: 82, train_loss: 0.2265, test_loss: 3.2828, test_f1: 0.5496
 epoch: 83, train_loss: 0.2193, test_loss: 3.4811, test_f1: 0.5545
 epoch: 84, train_loss: 0.2113, test_loss: 3.5486, test_f1: 0.5827
 epoch: 85, train_loss: 0.2193, test_loss: 3.8336, test_f1: 0.5800
 epoch: 86, train_loss: 0.2123, test_loss: 3.4592, test_f1: 0.5930
 epoch: 87, train_loss: 0.2378, test_loss: 3.4858, test_f1: 0.5873
 epoch: 88, train_loss: 0.1872, test_loss: 3.4501, test_f1: 0.5894
 epoch: 89, train_loss: 0.2304, test_loss: 3.4480, test_f1: 0.5833
 epoch: 90, train_loss: 0.2234, test_loss: 3.3684, test_f1: 0.5714
 epoch: 91, train_loss: 0.2032, test_loss: 3.1548, test_f1: 0.5766
 epoch: 92, train_loss: 0.1870, test_loss: 3.2662, test_f1: 0.5747
 epoch: 93, train_loss: 0.1949, test_loss: 3.2505, test_f1: 0.5868
 epoch: 94, train_loss: 0.2300, test_loss: 3.6269, test_f1: 0.5916
 epoch: 95, train_loss: 0.2046, test_loss: 3.5436, test_f1: 0.5927
 epoch: 96, train_loss: 0.2188, test_loss: 3.3287, test_f1: 0.5872
 epoch: 97, train_loss: 0.1935, test_loss: 3.7809, test_f1: 0.5704
 epoch: 98, train_loss: 0.1769, test_loss: 3.8992, test_f1: 0.5575
 epoch: 99, train_loss: 0.1937, test_loss: 3.5204, test_f1: 0.5847
##################ITERATION #1 ****************************************
 epoch: 0, train_loss: 1.1675, test_loss: 1.2373, test_f1: 0.3666
 epoch: 1, train_loss: 1.0879, test_loss: 1.1867, test_f1: 0.4996
 epoch: 2, train_loss: 1.0112, test_loss: 1.2012, test_f1: 0.5185
 epoch: 3, train_loss: 0.9567, test_loss: 1.1970, test_f1: 0.5438
 epoch: 4, train_loss: 0.9349, test_loss: 1.1251, test_f1: 0.5201
 epoch: 5, train_loss: 0.9266, test_loss: 1.0844, test_f1: 0.5275
 epoch: 6, train_loss: 0.8938, test_loss: 1.2107, test_f1: 0.5686
 epoch: 7, train_loss: 0.8622, test_loss: 1.1266, test_f1: 0.5792
 epoch: 8, train_loss: 0.8255, test_loss: 1.3228, test_f1: 0.4933
 epoch: 9, train_loss: 0.8467, test_loss: 1.1093, test_f1: 0.6239
 epoch: 10, train_loss: 0.8252, test_loss: 1.2739, test_f1: 0.5641
 epoch: 11, train_loss: 0.7950, test_loss: 1.2646, test_f1: 0.5399
 epoch: 12, train_loss: 0.8003, test_loss: 1.5124, test_f1: 0.5880
 epoch: 13, train_loss: 0.7704, test_loss: 1.2439, test_f1: 0.5912
 epoch: 14, train_loss: 0.7295, test_loss: 1.3472, test_f1: 0.5512
 epoch: 15, train_loss: 0.7167, test_loss: 1.3637, test_f1: 0.5267
 epoch: 16, train_loss: 0.7338, test_loss: 1.2491, test_f1: 0.5628
 epoch: 17, train_loss: 0.7292, test_loss: 1.3728, test_f1: 0.4964
 epoch: 18, train_loss: 0.6947, test_loss: 1.5356, test_f1: 0.5325
 epoch: 19, train_loss: 0.7083, test_loss: 1.2260, test_f1: 0.5853
 epoch: 20, train_loss: 0.6669, test_loss: 1.2762, test_f1: 0.6097
 epoch: 21, train_loss: 0.6778, test_loss: 1.5472, test_f1: 0.5138
 epoch: 22, train_loss: 0.6521, test_loss: 1.5008, test_f1: 0.5575
 epoch: 23, train_loss: 0.6403, test_loss: 1.3934, test_f1: 0.5542
 epoch: 24, train_loss: 0.5941, test_loss: 1.4586, test_f1: 0.5856
 epoch: 25, train_loss: 0.6493, test_loss: 1.3881, test_f1: 0.5813
 epoch: 26, train_loss: 0.6174, test_loss: 1.6116, test_f1: 0.5639
 epoch: 27, train_loss: 0.6116, test_loss: 1.4252, test_f1: 0.6466
 epoch: 28, train_loss: 0.6016, test_loss: 1.5318, test_f1: 0.5628
 epoch: 29, train_loss: 0.5743, test_loss: 1.4355, test_f1: 0.5975
 epoch: 30, train_loss: 0.5751, test_loss: 1.4179, test_f1: 0.6183
 epoch: 31, train_loss: 0.5570, test_loss: 1.5927, test_f1: 0.5730
 epoch: 32, train_loss: 0.5447, test_loss: 1.5845, test_f1: 0.5371
 epoch: 33, train_loss: 0.5549, test_loss: 1.7818, test_f1: 0.5671
 epoch: 34, train_loss: 0.5402, test_loss: 1.6408, test_f1: 0.5943
 epoch: 35, train_loss: 0.5145, test_loss: 1.9131, test_f1: 0.5709
 epoch: 36, train_loss: 0.5180, test_loss: 1.7176, test_f1: 0.5790
 epoch: 37, train_loss: 0.5254, test_loss: 1.5070, test_f1: 0.5773
 epoch: 38, train_loss: 0.5128, test_loss: 1.7318, test_f1: 0.5255
 epoch: 39, train_loss: 0.5038, test_loss: 1.5341, test_f1: 0.5873
 epoch: 40, train_loss: 0.5055, test_loss: 1.6923, test_f1: 0.6055
 epoch: 41, train_loss: 0.4863, test_loss: 1.9452, test_f1: 0.5870
 epoch: 42, train_loss: 0.4698, test_loss: 2.1238, test_f1: 0.5510
 epoch: 43, train_loss: 0.4768, test_loss: 1.9761, test_f1: 0.5755
 epoch: 44, train_loss: 0.4791, test_loss: 1.6423, test_f1: 0.6138
 epoch: 45, train_loss: 0.4985, test_loss: 1.5219, test_f1: 0.6172
 epoch: 46, train_loss: 0.4664, test_loss: 1.8344, test_f1: 0.5684
 epoch: 47, train_loss: 0.4723, test_loss: 1.6142, test_f1: 0.6017
 epoch: 48, train_loss: 0.4292, test_loss: 1.9761, test_f1: 0.5902
 epoch: 49, train_loss: 0.4457, test_loss: 1.6810, test_f1: 0.6043
 epoch: 50, train_loss: 0.4349, test_loss: 2.2188, test_f1: 0.5842
 epoch: 51, train_loss: 0.3993, test_loss: 1.8123, test_f1: 0.6195
 epoch: 52, train_loss: 0.3552, test_loss: 1.9754, test_f1: 0.5492
 epoch: 53, train_loss: 0.3551, test_loss: 1.9754, test_f1: 0.6077
 epoch: 54, train_loss: 0.3506, test_loss: 1.9213, test_f1: 0.6043
 epoch: 55, train_loss: 0.3196, test_loss: 1.9707, test_f1: 0.6041
 epoch: 56, train_loss: 0.3298, test_loss: 2.2423, test_f1: 0.6166
 epoch: 57, train_loss: 0.3204, test_loss: 2.4941, test_f1: 0.5622
 epoch: 58, train_loss: 0.3307, test_loss: 2.2917, test_f1: 0.6203
 epoch: 59, train_loss: 0.3304, test_loss: 2.1111, test_f1: 0.6147
 epoch: 60, train_loss: 0.3215, test_loss: 2.2840, test_f1: 0.6108
 epoch: 61, train_loss: 0.3262, test_loss: 2.3948, test_f1: 0.6114
 epoch: 62, train_loss: 0.2937, test_loss: 2.4354, test_f1: 0.5948
 epoch: 63, train_loss: 0.3166, test_loss: 2.6145, test_f1: 0.6145
 epoch: 64, train_loss: 0.2849, test_loss: 2.3712, test_f1: 0.5776
 epoch: 65, train_loss: 0.2840, test_loss: 2.3075, test_f1: 0.5903
 epoch: 66, train_loss: 0.2831, test_loss: 2.5826, test_f1: 0.5864
 epoch: 67, train_loss: 0.2953, test_loss: 2.2617, test_f1: 0.5826
 epoch: 68, train_loss: 0.2655, test_loss: 2.4878, test_f1: 0.5791
 epoch: 69, train_loss: 0.2666, test_loss: 2.3750, test_f1: 0.5786
 epoch: 70, train_loss: 0.2863, test_loss: 2.2702, test_f1: 0.5915
 epoch: 71, train_loss: 0.2665, test_loss: 2.6741, test_f1: 0.6037
 epoch: 72, train_loss: 0.3198, test_loss: 2.2217, test_f1: 0.5829
 epoch: 73, train_loss: 0.2920, test_loss: 2.5622, test_f1: 0.5747
 epoch: 74, train_loss: 0.2536, test_loss: 2.5130, test_f1: 0.6091
 epoch: 75, train_loss: 0.2465, test_loss: 2.4766, test_f1: 0.6312
 epoch: 76, train_loss: 0.2539, test_loss: 2.5345, test_f1: 0.6234
 epoch: 77, train_loss: 0.2525, test_loss: 2.7917, test_f1: 0.5770
 epoch: 78, train_loss: 0.2632, test_loss: 2.3901, test_f1: 0.5884
 epoch: 79, train_loss: 0.2536, test_loss: 2.6551, test_f1: 0.6024
 epoch: 80, train_loss: 0.2670, test_loss: 2.4225, test_f1: 0.5901
 epoch: 81, train_loss: 0.2513, test_loss: 2.5173, test_f1: 0.5814
 epoch: 82, train_loss: 0.2366, test_loss: 2.6835, test_f1: 0.5866
 epoch: 83, train_loss: 0.2431, test_loss: 2.6194, test_f1: 0.5775
 epoch: 84, train_loss: 0.2407, test_loss: 2.5026, test_f1: 0.6088
 epoch: 85, train_loss: 0.2710, test_loss: 2.7880, test_f1: 0.5910
 epoch: 86, train_loss: 0.2464, test_loss: 2.8257, test_f1: 0.6260
 epoch: 87, train_loss: 0.2666, test_loss: 2.4776, test_f1: 0.6030
 epoch: 88, train_loss: 0.2439, test_loss: 2.6708, test_f1: 0.6005
 epoch: 89, train_loss: 0.2328, test_loss: 2.4059, test_f1: 0.6065
 epoch: 90, train_loss: 0.2268, test_loss: 2.5415, test_f1: 0.6163
 epoch: 91, train_loss: 0.2117, test_loss: 2.6661, test_f1: 0.5880
 epoch: 92, train_loss: 0.2413, test_loss: 2.3870, test_f1: 0.5994
 epoch: 93, train_loss: 0.2034, test_loss: 2.7573, test_f1: 0.5939
 epoch: 94, train_loss: 0.2457, test_loss: 2.6394, test_f1: 0.5935
 epoch: 95, train_loss: 0.2194, test_loss: 2.4984, test_f1: 0.6028
 epoch: 96, train_loss: 0.2079, test_loss: 2.5130, test_f1: 0.6133
 epoch: 97, train_loss: 0.2263, test_loss: 2.5700, test_f1: 0.6261
 epoch: 98, train_loss: 0.1806, test_loss: 2.8224, test_f1: 0.5955
 epoch: 99, train_loss: 0.2151, test_loss: 2.6028, test_f1: 0.6117
##################ITERATION #2 ****************************************
 epoch: 0, train_loss: 1.2076, test_loss: 1.1991, test_f1: 0.4434
 epoch: 1, train_loss: 1.0654, test_loss: 1.2378, test_f1: 0.4680
 epoch: 2, train_loss: 0.9942, test_loss: 1.1358, test_f1: 0.4750
 epoch: 3, train_loss: 0.9537, test_loss: 1.2991, test_f1: 0.4169
 epoch: 4, train_loss: 0.8937, test_loss: 1.1485, test_f1: 0.4879
 epoch: 5, train_loss: 0.8962, test_loss: 1.1633, test_f1: 0.5130
 epoch: 6, train_loss: 0.8734, test_loss: 1.0923, test_f1: 0.5440
 epoch: 7, train_loss: 0.8622, test_loss: 1.1591, test_f1: 0.5512
 epoch: 8, train_loss: 0.8175, test_loss: 1.0973, test_f1: 0.5576
 epoch: 9, train_loss: 0.8053, test_loss: 1.1632, test_f1: 0.5642
 epoch: 10, train_loss: 0.7817, test_loss: 1.0771, test_f1: 0.5596
 epoch: 11, train_loss: 0.7869, test_loss: 1.1006, test_f1: 0.5881
 epoch: 12, train_loss: 0.7744, test_loss: 1.1231, test_f1: 0.6133
 epoch: 13, train_loss: 0.7290, test_loss: 1.2977, test_f1: 0.5660
 epoch: 14, train_loss: 0.7267, test_loss: 1.1863, test_f1: 0.5549
 epoch: 15, train_loss: 0.7309, test_loss: 1.1253, test_f1: 0.5885
 epoch: 16, train_loss: 0.7181, test_loss: 1.2654, test_f1: 0.5402
 epoch: 17, train_loss: 0.6824, test_loss: 1.1331, test_f1: 0.6004
 epoch: 18, train_loss: 0.6496, test_loss: 1.3791, test_f1: 0.5192
 epoch: 19, train_loss: 0.7064, test_loss: 1.2685, test_f1: 0.6098
 epoch: 20, train_loss: 0.6370, test_loss: 1.2603, test_f1: 0.6159
 epoch: 21, train_loss: 0.6483, test_loss: 1.2763, test_f1: 0.5949
 epoch: 22, train_loss: 0.6214, test_loss: 1.2950, test_f1: 0.5677
 epoch: 23, train_loss: 0.6274, test_loss: 1.2948, test_f1: 0.6073
 epoch: 24, train_loss: 0.6182, test_loss: 1.5914, test_f1: 0.5655
 epoch: 25, train_loss: 0.5909, test_loss: 1.5952, test_f1: 0.5547
 epoch: 26, train_loss: 0.5674, test_loss: 1.6953, test_f1: 0.5811
 epoch: 27, train_loss: 0.6294, test_loss: 1.6476, test_f1: 0.5875
 epoch: 28, train_loss: 0.5605, test_loss: 1.6583, test_f1: 0.5828
 epoch: 29, train_loss: 0.5353, test_loss: 1.8008, test_f1: 0.6068
 epoch: 30, train_loss: 0.5851, test_loss: 1.4427, test_f1: 0.5511
 epoch: 31, train_loss: 0.6028, test_loss: 1.3136, test_f1: 0.6347
 epoch: 32, train_loss: 0.5384, test_loss: 1.3020, test_f1: 0.6055
 epoch: 33, train_loss: 0.5100, test_loss: 1.6201, test_f1: 0.5912
 epoch: 34, train_loss: 0.5204, test_loss: 1.5845, test_f1: 0.5773
 epoch: 35, train_loss: 0.4994, test_loss: 1.7305, test_f1: 0.6339
 epoch: 36, train_loss: 0.5257, test_loss: 1.8748, test_f1: 0.5870
 epoch: 37, train_loss: 0.5168, test_loss: 1.9392, test_f1: 0.6189
 epoch: 38, train_loss: 0.4774, test_loss: 1.9582, test_f1: 0.6255
 epoch: 39, train_loss: 0.5055, test_loss: 1.8101, test_f1: 0.5645
 epoch: 40, train_loss: 0.5226, test_loss: 1.5341, test_f1: 0.6220
 epoch: 41, train_loss: 0.5135, test_loss: 1.7977, test_f1: 0.5643
 epoch: 42, train_loss: 0.4901, test_loss: 1.6387, test_f1: 0.6182
 epoch: 43, train_loss: 0.4868, test_loss: 1.8765, test_f1: 0.5653
 epoch: 44, train_loss: 0.4877, test_loss: 1.6720, test_f1: 0.6122
 epoch: 45, train_loss: 0.4418, test_loss: 2.1010, test_f1: 0.5547
 epoch: 46, train_loss: 0.4447, test_loss: 1.9348, test_f1: 0.5757
 epoch: 47, train_loss: 0.4546, test_loss: 2.1454, test_f1: 0.5860
 epoch: 48, train_loss: 0.4355, test_loss: 2.0038, test_f1: 0.5798
 epoch: 49, train_loss: 0.4226, test_loss: 2.3515, test_f1: 0.5568
 epoch: 50, train_loss: 0.3954, test_loss: 2.0526, test_f1: 0.6074
 epoch: 51, train_loss: 0.3476, test_loss: 2.0873, test_f1: 0.5991
 epoch: 52, train_loss: 0.3532, test_loss: 2.1669, test_f1: 0.5658
 epoch: 53, train_loss: 0.3417, test_loss: 2.2146, test_f1: 0.5953
 epoch: 54, train_loss: 0.3421, test_loss: 2.3714, test_f1: 0.5544
 epoch: 55, train_loss: 0.3451, test_loss: 2.2174, test_f1: 0.5964
 epoch: 56, train_loss: 0.3127, test_loss: 2.3390, test_f1: 0.6361
 epoch: 57, train_loss: 0.2838, test_loss: 2.1718, test_f1: 0.6060
 epoch: 58, train_loss: 0.3038, test_loss: 2.3543, test_f1: 0.6141
 epoch: 59, train_loss: 0.3456, test_loss: 2.2891, test_f1: 0.5842
 epoch: 60, train_loss: 0.3157, test_loss: 2.4586, test_f1: 0.5819
 epoch: 61, train_loss: 0.3120, test_loss: 2.3419, test_f1: 0.5951
 epoch: 62, train_loss: 0.2864, test_loss: 2.5479, test_f1: 0.6066
 epoch: 63, train_loss: 0.3374, test_loss: 2.7311, test_f1: 0.5811
 epoch: 64, train_loss: 0.3119, test_loss: 2.3200, test_f1: 0.5897
 epoch: 65, train_loss: 0.2830, test_loss: 2.3897, test_f1: 0.5554
 epoch: 66, train_loss: 0.2972, test_loss: 2.6944, test_f1: 0.6004
 epoch: 67, train_loss: 0.2668, test_loss: 2.9553, test_f1: 0.5699
 epoch: 68, train_loss: 0.2728, test_loss: 2.7496, test_f1: 0.6075
 epoch: 69, train_loss: 0.2766, test_loss: 2.7994, test_f1: 0.5691
 epoch: 70, train_loss: 0.2480, test_loss: 2.5773, test_f1: 0.6129
 epoch: 71, train_loss: 0.2853, test_loss: 2.5280, test_f1: 0.6006
 epoch: 72, train_loss: 0.2608, test_loss: 2.5545, test_f1: 0.5887
 epoch: 73, train_loss: 0.2502, test_loss: 2.7676, test_f1: 0.6099
 epoch: 74, train_loss: 0.2887, test_loss: 2.5599, test_f1: 0.5970
 epoch: 75, train_loss: 0.2585, test_loss: 2.3343, test_f1: 0.5892
 epoch: 76, train_loss: 0.2691, test_loss: 2.6570, test_f1: 0.6009
 epoch: 77, train_loss: 0.2730, test_loss: 2.2037, test_f1: 0.5686
 epoch: 78, train_loss: 0.2475, test_loss: 2.7335, test_f1: 0.5727
 epoch: 79, train_loss: 0.2292, test_loss: 2.3836, test_f1: 0.5579
 epoch: 80, train_loss: 0.2363, test_loss: 2.6222, test_f1: 0.5903
 epoch: 81, train_loss: 0.2276, test_loss: 2.7659, test_f1: 0.6245
 epoch: 82, train_loss: 0.2635, test_loss: 2.6918, test_f1: 0.6232
 epoch: 83, train_loss: 0.2498, test_loss: 2.5449, test_f1: 0.5992
 epoch: 84, train_loss: 0.2521, test_loss: 2.8986, test_f1: 0.5670
 epoch: 85, train_loss: 0.2253, test_loss: 3.0017, test_f1: 0.6133
 epoch: 86, train_loss: 0.2513, test_loss: 3.3284, test_f1: 0.5888
 epoch: 87, train_loss: 0.2319, test_loss: 2.7316, test_f1: 0.5704
 epoch: 88, train_loss: 0.2185, test_loss: 3.0076, test_f1: 0.5897
 epoch: 89, train_loss: 0.2042, test_loss: 3.2023, test_f1: 0.5956
 epoch: 90, train_loss: 0.2354, test_loss: 3.2327, test_f1: 0.6025
 epoch: 91, train_loss: 0.2228, test_loss: 3.0529, test_f1: 0.6172
 epoch: 92, train_loss: 0.1995, test_loss: 3.2628, test_f1: 0.6202
 epoch: 93, train_loss: 0.2246, test_loss: 3.5427, test_f1: 0.5884
 epoch: 94, train_loss: 0.2396, test_loss: 3.2821, test_f1: 0.6071
 epoch: 95, train_loss: 0.2347, test_loss: 3.3207, test_f1: 0.5537
 epoch: 96, train_loss: 0.2171, test_loss: 2.8610, test_f1: 0.6154
 epoch: 97, train_loss: 0.2350, test_loss: 3.0236, test_f1: 0.5948
 epoch: 98, train_loss: 0.2028, test_loss: 3.0006, test_f1: 0.5801
 epoch: 99, train_loss: 0.1868, test_loss: 3.0446, test_f1: 0.5980
##################ITERATION #3 ****************************************
 epoch: 0, train_loss: 1.2094, test_loss: 1.3197, test_f1: 0.5305
 epoch: 1, train_loss: 1.0586, test_loss: 1.1731, test_f1: 0.5452
 epoch: 2, train_loss: 0.9960, test_loss: 1.1650, test_f1: 0.5253
 epoch: 3, train_loss: 0.9593, test_loss: 1.2035, test_f1: 0.4969
 epoch: 4, train_loss: 0.9059, test_loss: 1.1201, test_f1: 0.5540
 epoch: 5, train_loss: 0.8919, test_loss: 1.3269, test_f1: 0.5329
 epoch: 6, train_loss: 0.8860, test_loss: 1.1862, test_f1: 0.5399
 epoch: 7, train_loss: 0.8559, test_loss: 1.1914, test_f1: 0.5668
 epoch: 8, train_loss: 0.8440, test_loss: 1.2269, test_f1: 0.5629
 epoch: 9, train_loss: 0.8225, test_loss: 1.0981, test_f1: 0.5680
 epoch: 10, train_loss: 0.8189, test_loss: 1.1156, test_f1: 0.5842
 epoch: 11, train_loss: 0.7845, test_loss: 1.1963, test_f1: 0.5639
 epoch: 12, train_loss: 0.7769, test_loss: 1.1743, test_f1: 0.5772
 epoch: 13, train_loss: 0.7507, test_loss: 1.4462, test_f1: 0.4859
 epoch: 14, train_loss: 0.7634, test_loss: 1.2330, test_f1: 0.5662
 epoch: 15, train_loss: 0.7411, test_loss: 1.1902, test_f1: 0.5401
 epoch: 16, train_loss: 0.7023, test_loss: 1.2387, test_f1: 0.5815
 epoch: 17, train_loss: 0.7310, test_loss: 1.1922, test_f1: 0.5906
 epoch: 18, train_loss: 0.7195, test_loss: 1.1720, test_f1: 0.5861
 epoch: 19, train_loss: 0.6844, test_loss: 1.2427, test_f1: 0.5861
 epoch: 20, train_loss: 0.6476, test_loss: 1.3689, test_f1: 0.5861
 epoch: 21, train_loss: 0.6552, test_loss: 1.2673, test_f1: 0.5680
 epoch: 22, train_loss: 0.6392, test_loss: 1.3122, test_f1: 0.5788
 epoch: 23, train_loss: 0.6381, test_loss: 1.4444, test_f1: 0.5567
 epoch: 24, train_loss: 0.6215, test_loss: 1.4364, test_f1: 0.5448
 epoch: 25, train_loss: 0.6238, test_loss: 1.3834, test_f1: 0.5907
 epoch: 26, train_loss: 0.6051, test_loss: 1.3288, test_f1: 0.5695
 epoch: 27, train_loss: 0.6201, test_loss: 1.2367, test_f1: 0.6041
 epoch: 28, train_loss: 0.5942, test_loss: 1.5116, test_f1: 0.5811
 epoch: 29, train_loss: 0.6143, test_loss: 1.4344, test_f1: 0.6178
 epoch: 30, train_loss: 0.5586, test_loss: 1.4305, test_f1: 0.6061
 epoch: 31, train_loss: 0.5668, test_loss: 1.7432, test_f1: 0.5429
 epoch: 32, train_loss: 0.5718, test_loss: 1.5436, test_f1: 0.6128
 epoch: 33, train_loss: 0.5590, test_loss: 1.6172, test_f1: 0.5207
 epoch: 34, train_loss: 0.5373, test_loss: 1.8255, test_f1: 0.4708
 epoch: 35, train_loss: 0.5147, test_loss: 1.5866, test_f1: 0.5522
 epoch: 36, train_loss: 0.5690, test_loss: 1.5942, test_f1: 0.5790
 epoch: 37, train_loss: 0.5122, test_loss: 1.6038, test_f1: 0.5899
 epoch: 38, train_loss: 0.5261, test_loss: 1.5658, test_f1: 0.5523
 epoch: 39, train_loss: 0.5008, test_loss: 1.6096, test_f1: 0.6187
 epoch: 40, train_loss: 0.4930, test_loss: 1.6278, test_f1: 0.5945
 epoch: 41, train_loss: 0.5002, test_loss: 1.6379, test_f1: 0.6006
 epoch: 42, train_loss: 0.4953, test_loss: 1.6662, test_f1: 0.5669
 epoch: 43, train_loss: 0.4645, test_loss: 1.6454, test_f1: 0.6227
 epoch: 44, train_loss: 0.4533, test_loss: 1.7314, test_f1: 0.5489
 epoch: 45, train_loss: 0.4572, test_loss: 1.7828, test_f1: 0.5509
 epoch: 46, train_loss: 0.4603, test_loss: 2.0396, test_f1: 0.5330
 epoch: 47, train_loss: 0.5006, test_loss: 1.7569, test_f1: 0.5661
 epoch: 48, train_loss: 0.4543, test_loss: 1.6876, test_f1: 0.5580
 epoch: 49, train_loss: 0.4530, test_loss: 1.9878, test_f1: 0.5372
 epoch: 50, train_loss: 0.4587, test_loss: 1.9359, test_f1: 0.5733
 epoch: 51, train_loss: 0.3904, test_loss: 2.2201, test_f1: 0.5347
 epoch: 52, train_loss: 0.3723, test_loss: 2.1077, test_f1: 0.5827
 epoch: 53, train_loss: 0.3539, test_loss: 2.0039, test_f1: 0.5899
 epoch: 54, train_loss: 0.3474, test_loss: 2.3198, test_f1: 0.5599
 epoch: 55, train_loss: 0.3551, test_loss: 2.0852, test_f1: 0.5883
 epoch: 56, train_loss: 0.3218, test_loss: 2.3120, test_f1: 0.6015
 epoch: 57, train_loss: 0.3199, test_loss: 2.2762, test_f1: 0.5791
 epoch: 58, train_loss: 0.3062, test_loss: 2.4120, test_f1: 0.5398
 epoch: 59, train_loss: 0.3065, test_loss: 2.3422, test_f1: 0.5656
 epoch: 60, train_loss: 0.2939, test_loss: 2.4927, test_f1: 0.5703
 epoch: 61, train_loss: 0.3362, test_loss: 2.2278, test_f1: 0.5871
 epoch: 62, train_loss: 0.3007, test_loss: 2.5168, test_f1: 0.5696
 epoch: 63, train_loss: 0.2902, test_loss: 2.4422, test_f1: 0.5482
 epoch: 64, train_loss: 0.2888, test_loss: 2.6583, test_f1: 0.5571
 epoch: 65, train_loss: 0.2817, test_loss: 2.3988, test_f1: 0.5913
 epoch: 66, train_loss: 0.2501, test_loss: 2.6310, test_f1: 0.5531
 epoch: 67, train_loss: 0.2602, test_loss: 2.5521, test_f1: 0.5718
 epoch: 68, train_loss: 0.2718, test_loss: 2.3239, test_f1: 0.6055
 epoch: 69, train_loss: 0.2858, test_loss: 2.5811, test_f1: 0.5828
 epoch: 70, train_loss: 0.2758, test_loss: 2.7671, test_f1: 0.5822
 epoch: 71, train_loss: 0.2991, test_loss: 2.4174, test_f1: 0.5989
 epoch: 72, train_loss: 0.2763, test_loss: 2.4886, test_f1: 0.5616
 epoch: 73, train_loss: 0.2713, test_loss: 2.8005, test_f1: 0.5747
 epoch: 74, train_loss: 0.2787, test_loss: 2.7984, test_f1: 0.5738
 epoch: 75, train_loss: 0.2358, test_loss: 3.0215, test_f1: 0.5746
 epoch: 76, train_loss: 0.2450, test_loss: 2.6870, test_f1: 0.5616
 epoch: 77, train_loss: 0.2519, test_loss: 2.7910, test_f1: 0.5996
 epoch: 78, train_loss: 0.2560, test_loss: 2.6656, test_f1: 0.5887
 epoch: 79, train_loss: 0.2409, test_loss: 2.9836, test_f1: 0.5910
 epoch: 80, train_loss: 0.2518, test_loss: 2.5105, test_f1: 0.5871
 epoch: 81, train_loss: 0.2040, test_loss: 2.7335, test_f1: 0.6218
 epoch: 82, train_loss: 0.2198, test_loss: 2.8865, test_f1: 0.6091
 epoch: 83, train_loss: 0.2283, test_loss: 3.0704, test_f1: 0.6120
 epoch: 84, train_loss: 0.2301, test_loss: 2.7038, test_f1: 0.6112
 epoch: 85, train_loss: 0.2406, test_loss: 2.7503, test_f1: 0.6184
 epoch: 86, train_loss: 0.2132, test_loss: 2.7426, test_f1: 0.6100
 epoch: 87, train_loss: 0.2514, test_loss: 2.8777, test_f1: 0.5649
 epoch: 88, train_loss: 0.2619, test_loss: 3.0453, test_f1: 0.5597
 epoch: 89, train_loss: 0.2590, test_loss: 2.8553, test_f1: 0.5792
 epoch: 90, train_loss: 0.2267, test_loss: 3.1392, test_f1: 0.5744
 epoch: 91, train_loss: 0.2265, test_loss: 3.0281, test_f1: 0.5928
 epoch: 92, train_loss: 0.1994, test_loss: 3.1743, test_f1: 0.5822
 epoch: 93, train_loss: 0.2077, test_loss: 3.2613, test_f1: 0.5884
 epoch: 94, train_loss: 0.2441, test_loss: 3.0480, test_f1: 0.5826
 epoch: 95, train_loss: 0.2375, test_loss: 2.8627, test_f1: 0.5936
 epoch: 96, train_loss: 0.2238, test_loss: 2.9993, test_f1: 0.6359
 epoch: 97, train_loss: 0.1850, test_loss: 2.7644, test_f1: 0.6054
 epoch: 98, train_loss: 0.1991, test_loss: 3.7602, test_f1: 0.5793
 epoch: 99, train_loss: 0.2279, test_loss: 2.6656, test_f1: 0.6269
##################ITERATION #4 ****************************************
 epoch: 0, train_loss: 1.2549, test_loss: 1.3373, test_f1: 0.2336
 epoch: 1, train_loss: 1.0808, test_loss: 1.2355, test_f1: 0.5091
 epoch: 2, train_loss: 1.0468, test_loss: 1.1959, test_f1: 0.4733
 epoch: 3, train_loss: 0.9938, test_loss: 1.1347, test_f1: 0.5555
 epoch: 4, train_loss: 0.9673, test_loss: 1.1584, test_f1: 0.5147
 epoch: 5, train_loss: 0.9347, test_loss: 1.1952, test_f1: 0.5047
 epoch: 6, train_loss: 0.8921, test_loss: 1.3307, test_f1: 0.5165
 epoch: 7, train_loss: 0.8827, test_loss: 1.2281, test_f1: 0.5692
 epoch: 8, train_loss: 0.8708, test_loss: 1.1242, test_f1: 0.5721
 epoch: 9, train_loss: 0.8440, test_loss: 1.1900, test_f1: 0.6007
 epoch: 10, train_loss: 0.8169, test_loss: 1.4022, test_f1: 0.6013
 epoch: 11, train_loss: 0.8258, test_loss: 1.2533, test_f1: 0.5905
 epoch: 12, train_loss: 0.8133, test_loss: 1.2057, test_f1: 0.5561
 epoch: 13, train_loss: 0.7891, test_loss: 1.2092, test_f1: 0.6013
 epoch: 14, train_loss: 0.7862, test_loss: 1.1774, test_f1: 0.6085
 epoch: 15, train_loss: 0.7660, test_loss: 1.1370, test_f1: 0.6030
 epoch: 16, train_loss: 0.7218, test_loss: 1.1729, test_f1: 0.6265
 epoch: 17, train_loss: 0.7319, test_loss: 1.3017, test_f1: 0.5488
 epoch: 18, train_loss: 0.7112, test_loss: 1.3785, test_f1: 0.5430
 epoch: 19, train_loss: 0.7325, test_loss: 1.2725, test_f1: 0.5623
 epoch: 20, train_loss: 0.7164, test_loss: 1.2315, test_f1: 0.5938
 epoch: 21, train_loss: 0.6685, test_loss: 1.3178, test_f1: 0.5953
 epoch: 22, train_loss: 0.6547, test_loss: 1.3296, test_f1: 0.6422
 epoch: 23, train_loss: 0.6664, test_loss: 1.5231, test_f1: 0.5666
 epoch: 24, train_loss: 0.6519, test_loss: 1.3935, test_f1: 0.5704
 epoch: 25, train_loss: 0.6213, test_loss: 1.3886, test_f1: 0.5919
 epoch: 26, train_loss: 0.6105, test_loss: 1.2344, test_f1: 0.5753
 epoch: 27, train_loss: 0.6274, test_loss: 1.5129, test_f1: 0.5688
 epoch: 28, train_loss: 0.5867, test_loss: 1.6596, test_f1: 0.5413
 epoch: 29, train_loss: 0.6130, test_loss: 1.2959, test_f1: 0.6163
 epoch: 30, train_loss: 0.6173, test_loss: 1.4813, test_f1: 0.6074
 epoch: 31, train_loss: 0.6008, test_loss: 1.4944, test_f1: 0.6210
 epoch: 32, train_loss: 0.5519, test_loss: 1.5301, test_f1: 0.5946
 epoch: 33, train_loss: 0.5490, test_loss: 1.4182, test_f1: 0.6390
 epoch: 34, train_loss: 0.5458, test_loss: 1.5385, test_f1: 0.6455
 epoch: 35, train_loss: 0.5354, test_loss: 1.6167, test_f1: 0.5572
 epoch: 36, train_loss: 0.5702, test_loss: 1.4067, test_f1: 0.5788
 epoch: 37, train_loss: 0.4942, test_loss: 1.6419, test_f1: 0.6072
 epoch: 38, train_loss: 0.5208, test_loss: 1.4084, test_f1: 0.6253
 epoch: 39, train_loss: 0.5009, test_loss: 1.6113, test_f1: 0.5787
 epoch: 40, train_loss: 0.5442, test_loss: 1.6221, test_f1: 0.6021
 epoch: 41, train_loss: 0.4908, test_loss: 1.6581, test_f1: 0.5894
 epoch: 42, train_loss: 0.4850, test_loss: 1.7323, test_f1: 0.5927
 epoch: 43, train_loss: 0.4640, test_loss: 2.0785, test_f1: 0.5322
 epoch: 44, train_loss: 0.5255, test_loss: 2.1336, test_f1: 0.5461
 epoch: 45, train_loss: 0.4712, test_loss: 1.6046, test_f1: 0.5945
 epoch: 46, train_loss: 0.4688, test_loss: 1.9057, test_f1: 0.5522
 epoch: 47, train_loss: 0.4652, test_loss: 1.7513, test_f1: 0.5544
 epoch: 48, train_loss: 0.4590, test_loss: 2.0873, test_f1: 0.5990
 epoch: 49, train_loss: 0.4309, test_loss: 2.0128, test_f1: 0.5945
 epoch: 50, train_loss: 0.4291, test_loss: 1.7834, test_f1: 0.6425
 epoch: 51, train_loss: 0.3688, test_loss: 2.0184, test_f1: 0.5917
 epoch: 52, train_loss: 0.3535, test_loss: 2.1822, test_f1: 0.5854
 epoch: 53, train_loss: 0.3559, test_loss: 1.9490, test_f1: 0.5939
 epoch: 54, train_loss: 0.3628, test_loss: 2.1028, test_f1: 0.6534
 epoch: 55, train_loss: 0.3310, test_loss: 2.1927, test_f1: 0.5777
 epoch: 56, train_loss: 0.3361, test_loss: 2.3597, test_f1: 0.5689
 epoch: 57, train_loss: 0.3501, test_loss: 2.5170, test_f1: 0.5537
 epoch: 58, train_loss: 0.3296, test_loss: 2.3433, test_f1: 0.5960
 epoch: 59, train_loss: 0.3388, test_loss: 2.4424, test_f1: 0.6358
 epoch: 60, train_loss: 0.3127, test_loss: 2.4757, test_f1: 0.5908
 epoch: 61, train_loss: 0.3065, test_loss: 2.9831, test_f1: 0.5667
 epoch: 62, train_loss: 0.2995, test_loss: 2.7142, test_f1: 0.5547
 epoch: 63, train_loss: 0.3096, test_loss: 2.6504, test_f1: 0.5890
 epoch: 64, train_loss: 0.2861, test_loss: 2.5382, test_f1: 0.6119
 epoch: 65, train_loss: 0.3120, test_loss: 2.4577, test_f1: 0.5683
 epoch: 66, train_loss: 0.2969, test_loss: 2.5720, test_f1: 0.5961
 epoch: 67, train_loss: 0.3096, test_loss: 2.7044, test_f1: 0.6085
 epoch: 68, train_loss: 0.2787, test_loss: 2.8107, test_f1: 0.5852
 epoch: 69, train_loss: 0.2576, test_loss: 2.4628, test_f1: 0.5994
 epoch: 70, train_loss: 0.2752, test_loss: 2.6722, test_f1: 0.5969
 epoch: 71, train_loss: 0.2667, test_loss: 2.7679, test_f1: 0.5793
 epoch: 72, train_loss: 0.2744, test_loss: 2.9510, test_f1: 0.5793
 epoch: 73, train_loss: 0.2762, test_loss: 2.8967, test_f1: 0.6111
 epoch: 74, train_loss: 0.2527, test_loss: 2.7902, test_f1: 0.5827
 epoch: 75, train_loss: 0.2835, test_loss: 3.3404, test_f1: 0.5691
 epoch: 76, train_loss: 0.3091, test_loss: 2.9705, test_f1: 0.6042
 epoch: 77, train_loss: 0.2519, test_loss: 2.8052, test_f1: 0.5971
 epoch: 78, train_loss: 0.2869, test_loss: 2.9398, test_f1: 0.6042
 epoch: 79, train_loss: 0.2645, test_loss: 2.5612, test_f1: 0.6173
 epoch: 80, train_loss: 0.2495, test_loss: 2.8084, test_f1: 0.6145
 epoch: 81, train_loss: 0.2561, test_loss: 2.6934, test_f1: 0.6244
 epoch: 82, train_loss: 0.2451, test_loss: 2.7127, test_f1: 0.6298
 epoch: 83, train_loss: 0.2337, test_loss: 2.8465, test_f1: 0.6056
 epoch: 84, train_loss: 0.2364, test_loss: 2.9892, test_f1: 0.5956
 epoch: 85, train_loss: 0.2581, test_loss: 2.8717, test_f1: 0.6190
 epoch: 86, train_loss: 0.2520, test_loss: 2.8414, test_f1: 0.5951
 epoch: 87, train_loss: 0.2434, test_loss: 2.6181, test_f1: 0.6142
 epoch: 88, train_loss: 0.2030, test_loss: 2.9631, test_f1: 0.6195
 epoch: 89, train_loss: 0.2096, test_loss: 2.7998, test_f1: 0.6118
 epoch: 90, train_loss: 0.2478, test_loss: 3.1750, test_f1: 0.5605
 epoch: 91, train_loss: 0.2538, test_loss: 2.9201, test_f1: 0.6120
 epoch: 92, train_loss: 0.2352, test_loss: 2.8084, test_f1: 0.6212
 epoch: 93, train_loss: 0.2134, test_loss: 2.9610, test_f1: 0.6118
 epoch: 94, train_loss: 0.2193, test_loss: 3.1359, test_f1: 0.5658
 epoch: 95, train_loss: 0.2268, test_loss: 3.4029, test_f1: 0.5576
 epoch: 96, train_loss: 0.2280, test_loss: 3.7599, test_f1: 0.5641
 epoch: 97, train_loss: 0.2397, test_loss: 3.3868, test_f1: 0.5652
 epoch: 98, train_loss: 0.2131, test_loss: 3.2013, test_f1: 0.6137
 epoch: 99, train_loss: 0.1924, test_loss: 3.2250, test_f1: 0.6120
##################ITERATION #5 ****************************************
 epoch: 0, train_loss: 1.2476, test_loss: 1.3125, test_f1: 0.3987
 epoch: 1, train_loss: 1.0430, test_loss: 1.2019, test_f1: 0.5359
 epoch: 2, train_loss: 0.9893, test_loss: 1.1620, test_f1: 0.4317
 epoch: 3, train_loss: 0.9430, test_loss: 1.1856, test_f1: 0.5311
 epoch: 4, train_loss: 0.9444, test_loss: 1.0823, test_f1: 0.5649
 epoch: 5, train_loss: 0.9109, test_loss: 1.1857, test_f1: 0.5724
 epoch: 6, train_loss: 0.8533, test_loss: 1.2182, test_f1: 0.5164
 epoch: 7, train_loss: 0.8494, test_loss: 1.1615, test_f1: 0.5595
 epoch: 8, train_loss: 0.8134, test_loss: 1.2830, test_f1: 0.6065
 epoch: 9, train_loss: 0.7882, test_loss: 1.3798, test_f1: 0.5250
 epoch: 10, train_loss: 0.8041, test_loss: 1.2909, test_f1: 0.4880
 epoch: 11, train_loss: 0.7807, test_loss: 1.3722, test_f1: 0.5203
 epoch: 12, train_loss: 0.7654, test_loss: 1.1532, test_f1: 0.5464
 epoch: 13, train_loss: 0.7338, test_loss: 1.1989, test_f1: 0.5644
 epoch: 14, train_loss: 0.7398, test_loss: 1.3334, test_f1: 0.5860
 epoch: 15, train_loss: 0.7445, test_loss: 1.4836, test_f1: 0.5358
 epoch: 16, train_loss: 0.7224, test_loss: 1.2006, test_f1: 0.5650
 epoch: 17, train_loss: 0.6682, test_loss: 1.3401, test_f1: 0.5602
 epoch: 18, train_loss: 0.6707, test_loss: 1.3121, test_f1: 0.6054
 epoch: 19, train_loss: 0.6579, test_loss: 1.3134, test_f1: 0.5692
 epoch: 20, train_loss: 0.6525, test_loss: 1.1812, test_f1: 0.6153
 epoch: 21, train_loss: 0.6250, test_loss: 1.2811, test_f1: 0.5968
 epoch: 22, train_loss: 0.6297, test_loss: 1.2483, test_f1: 0.5867
 epoch: 23, train_loss: 0.6316, test_loss: 1.5246, test_f1: 0.5925
 epoch: 24, train_loss: 0.6447, test_loss: 1.5199, test_f1: 0.5809
 epoch: 25, train_loss: 0.5946, test_loss: 1.6496, test_f1: 0.5359
 epoch: 26, train_loss: 0.5950, test_loss: 1.4574, test_f1: 0.5874
 epoch: 27, train_loss: 0.5928, test_loss: 1.3495, test_f1: 0.5809
 epoch: 28, train_loss: 0.5786, test_loss: 1.5051, test_f1: 0.5812
 epoch: 29, train_loss: 0.5622, test_loss: 1.3918, test_f1: 0.5984
 epoch: 30, train_loss: 0.5620, test_loss: 1.4718, test_f1: 0.5740
 epoch: 31, train_loss: 0.5581, test_loss: 1.5413, test_f1: 0.5947
 epoch: 32, train_loss: 0.5359, test_loss: 1.6605, test_f1: 0.5545
 epoch: 33, train_loss: 0.5473, test_loss: 1.3165, test_f1: 0.5819
 epoch: 34, train_loss: 0.5305, test_loss: 1.5202, test_f1: 0.5912
 epoch: 35, train_loss: 0.5448, test_loss: 1.5197, test_f1: 0.5802
 epoch: 36, train_loss: 0.5098, test_loss: 1.6415, test_f1: 0.5555
 epoch: 37, train_loss: 0.5301, test_loss: 1.6045, test_f1: 0.5788
 epoch: 38, train_loss: 0.4820, test_loss: 1.4434, test_f1: 0.6174
 epoch: 39, train_loss: 0.5043, test_loss: 1.4546, test_f1: 0.5761
 epoch: 40, train_loss: 0.5186, test_loss: 1.5800, test_f1: 0.6368
 epoch: 41, train_loss: 0.4857, test_loss: 1.8775, test_f1: 0.5365
 epoch: 42, train_loss: 0.4815, test_loss: 1.5919, test_f1: 0.6027
 epoch: 43, train_loss: 0.4710, test_loss: 1.6748, test_f1: 0.5897
 epoch: 44, train_loss: 0.4535, test_loss: 1.8906, test_f1: 0.5952
 epoch: 45, train_loss: 0.5126, test_loss: 1.7166, test_f1: 0.5499
 epoch: 46, train_loss: 0.4773, test_loss: 2.1855, test_f1: 0.5590
 epoch: 47, train_loss: 0.4794, test_loss: 1.7243, test_f1: 0.6118
 epoch: 48, train_loss: 0.4377, test_loss: 1.6294, test_f1: 0.6013
 epoch: 49, train_loss: 0.4531, test_loss: 1.7123, test_f1: 0.5838
 epoch: 50, train_loss: 0.4566, test_loss: 1.6518, test_f1: 0.6032
 epoch: 51, train_loss: 0.4012, test_loss: 1.8177, test_f1: 0.5662
 epoch: 52, train_loss: 0.3628, test_loss: 1.8179, test_f1: 0.6154
 epoch: 53, train_loss: 0.3777, test_loss: 2.2700, test_f1: 0.6042
 epoch: 54, train_loss: 0.3757, test_loss: 1.7095, test_f1: 0.5676
 epoch: 55, train_loss: 0.3458, test_loss: 1.9014, test_f1: 0.6037
 epoch: 56, train_loss: 0.3311, test_loss: 1.9471, test_f1: 0.5954
 epoch: 57, train_loss: 0.3096, test_loss: 2.2435, test_f1: 0.5889
 epoch: 58, train_loss: 0.3002, test_loss: 2.1669, test_f1: 0.5581
 epoch: 59, train_loss: 0.3130, test_loss: 2.1235, test_f1: 0.5644
 epoch: 60, train_loss: 0.3149, test_loss: 1.9916, test_f1: 0.6100
 epoch: 61, train_loss: 0.3378, test_loss: 2.1969, test_f1: 0.5997
 epoch: 62, train_loss: 0.2876, test_loss: 2.3700, test_f1: 0.6041
 epoch: 63, train_loss: 0.3233, test_loss: 2.2467, test_f1: 0.5653
 epoch: 64, train_loss: 0.2928, test_loss: 2.2774, test_f1: 0.6251
 epoch: 65, train_loss: 0.2802, test_loss: 2.1681, test_f1: 0.5877
 epoch: 66, train_loss: 0.2883, test_loss: 2.5031, test_f1: 0.6083
 epoch: 67, train_loss: 0.3000, test_loss: 2.5131, test_f1: 0.5524
 epoch: 68, train_loss: 0.3119, test_loss: 2.1684, test_f1: 0.6106
 epoch: 69, train_loss: 0.2644, test_loss: 2.2987, test_f1: 0.5569
 epoch: 70, train_loss: 0.2683, test_loss: 2.5061, test_f1: 0.5823
 epoch: 71, train_loss: 0.2732, test_loss: 2.4695, test_f1: 0.6078
 epoch: 72, train_loss: 0.2637, test_loss: 3.0437, test_f1: 0.5330
 epoch: 73, train_loss: 0.2502, test_loss: 3.0071, test_f1: 0.5694
 epoch: 74, train_loss: 0.2879, test_loss: 2.4248, test_f1: 0.5973
 epoch: 75, train_loss: 0.2617, test_loss: 2.6716, test_f1: 0.5942
 epoch: 76, train_loss: 0.2495, test_loss: 2.4293, test_f1: 0.5677
 epoch: 77, train_loss: 0.2448, test_loss: 2.6104, test_f1: 0.5631
 epoch: 78, train_loss: 0.2554, test_loss: 2.9878, test_f1: 0.5855
 epoch: 79, train_loss: 0.2598, test_loss: 2.7445, test_f1: 0.5697
 epoch: 80, train_loss: 0.2470, test_loss: 2.6224, test_f1: 0.5991
 epoch: 81, train_loss: 0.2547, test_loss: 2.6014, test_f1: 0.5841
 epoch: 82, train_loss: 0.2408, test_loss: 2.5820, test_f1: 0.5944
 epoch: 83, train_loss: 0.2353, test_loss: 2.9963, test_f1: 0.5666
 epoch: 84, train_loss: 0.2241, test_loss: 2.9407, test_f1: 0.5449
 epoch: 85, train_loss: 0.2420, test_loss: 2.8435, test_f1: 0.5805
 epoch: 86, train_loss: 0.2510, test_loss: 3.0641, test_f1: 0.5722
 epoch: 87, train_loss: 0.2473, test_loss: 3.0617, test_f1: 0.5691
 epoch: 88, train_loss: 0.2237, test_loss: 3.0413, test_f1: 0.5204
 epoch: 89, train_loss: 0.2435, test_loss: 2.6178, test_f1: 0.6116
 epoch: 90, train_loss: 0.2518, test_loss: 2.8964, test_f1: 0.5615
 epoch: 91, train_loss: 0.2259, test_loss: 2.9863, test_f1: 0.5800
 epoch: 92, train_loss: 0.2038, test_loss: 2.7339, test_f1: 0.5753
 epoch: 93, train_loss: 0.2529, test_loss: 2.7973, test_f1: 0.5563
 epoch: 94, train_loss: 0.2075, test_loss: 2.8039, test_f1: 0.6032
 epoch: 95, train_loss: 0.2092, test_loss: 2.9118, test_f1: 0.5951
 epoch: 96, train_loss: 0.2184, test_loss: 3.0942, test_f1: 0.5738
 epoch: 97, train_loss: 0.2275, test_loss: 3.0607, test_f1: 0.5922
 epoch: 98, train_loss: 0.2304, test_loss: 2.8054, test_f1: 0.5893
 epoch: 99, train_loss: 0.2101, test_loss: 2.6577, test_f1: 0.5978
##################ITERATION #6 ****************************************
 epoch: 0, train_loss: 1.3084, test_loss: 1.3850, test_f1: 0.3710
 epoch: 1, train_loss: 1.0941, test_loss: 1.1857, test_f1: 0.5043
 epoch: 2, train_loss: 1.0215, test_loss: 1.2185, test_f1: 0.5168
 epoch: 3, train_loss: 0.9859, test_loss: 1.1572, test_f1: 0.5907
 epoch: 4, train_loss: 0.9513, test_loss: 1.1057, test_f1: 0.5542
 epoch: 5, train_loss: 0.9013, test_loss: 1.1072, test_f1: 0.5693
 epoch: 6, train_loss: 0.8900, test_loss: 1.1493, test_f1: 0.5231
 epoch: 7, train_loss: 0.8838, test_loss: 1.1325, test_f1: 0.5341
 epoch: 8, train_loss: 0.8494, test_loss: 1.2230, test_f1: 0.5633
 epoch: 9, train_loss: 0.8479, test_loss: 1.0659, test_f1: 0.5570
 epoch: 10, train_loss: 0.8150, test_loss: 1.0933, test_f1: 0.5670
 epoch: 11, train_loss: 0.8183, test_loss: 1.2169, test_f1: 0.5516
 epoch: 12, train_loss: 0.8023, test_loss: 1.0820, test_f1: 0.5786
 epoch: 13, train_loss: 0.7695, test_loss: 1.2634, test_f1: 0.5474
 epoch: 14, train_loss: 0.7740, test_loss: 1.1463, test_f1: 0.5272
 epoch: 15, train_loss: 0.7648, test_loss: 1.1413, test_f1: 0.5500
 epoch: 16, train_loss: 0.7193, test_loss: 1.1740, test_f1: 0.5890
 epoch: 17, train_loss: 0.7262, test_loss: 1.2363, test_f1: 0.5547
 epoch: 18, train_loss: 0.7104, test_loss: 1.0839, test_f1: 0.5700
 epoch: 19, train_loss: 0.7146, test_loss: 1.2287, test_f1: 0.5371
 epoch: 20, train_loss: 0.6817, test_loss: 1.1750, test_f1: 0.6264
 epoch: 21, train_loss: 0.6797, test_loss: 1.1853, test_f1: 0.5647
 epoch: 22, train_loss: 0.6819, test_loss: 1.5144, test_f1: 0.5052
 epoch: 23, train_loss: 0.6504, test_loss: 1.2911, test_f1: 0.5303
 epoch: 24, train_loss: 0.6534, test_loss: 1.5565, test_f1: 0.5153
 epoch: 25, train_loss: 0.6398, test_loss: 1.4571, test_f1: 0.5744
 epoch: 26, train_loss: 0.6284, test_loss: 1.3982, test_f1: 0.5747
 epoch: 27, train_loss: 0.6312, test_loss: 1.3638, test_f1: 0.5880
 epoch: 28, train_loss: 0.6590, test_loss: 1.2836, test_f1: 0.6016
 epoch: 29, train_loss: 0.5971, test_loss: 3.6850, test_f1: 0.5565
 epoch: 30, train_loss: 0.5837, test_loss: 1.4340, test_f1: 0.5880
 epoch: 31, train_loss: 0.5973, test_loss: 1.2675, test_f1: 0.5968
 epoch: 32, train_loss: 0.5700, test_loss: 1.6402, test_f1: 0.5442
 epoch: 33, train_loss: 0.5762, test_loss: 1.3911, test_f1: 0.5767
 epoch: 34, train_loss: 0.5720, test_loss: 1.3541, test_f1: 0.5923
 epoch: 35, train_loss: 0.5361, test_loss: 1.4147, test_f1: 0.5847
 epoch: 36, train_loss: 0.5743, test_loss: 1.5454, test_f1: 0.5767
 epoch: 37, train_loss: 0.5439, test_loss: 1.8604, test_f1: 0.5525
 epoch: 38, train_loss: 0.5341, test_loss: 1.4366, test_f1: 0.6237
 epoch: 39, train_loss: 0.5220, test_loss: 1.9500, test_f1: 0.5364
 epoch: 40, train_loss: 0.5295, test_loss: 1.5580, test_f1: 0.5670
 epoch: 41, train_loss: 0.5237, test_loss: 1.8240, test_f1: 0.5353
 epoch: 42, train_loss: 0.4893, test_loss: 1.7501, test_f1: 0.5819
 epoch: 43, train_loss: 0.4988, test_loss: 1.9670, test_f1: 0.5618
 epoch: 44, train_loss: 0.4766, test_loss: 1.6238, test_f1: 0.5846
 epoch: 45, train_loss: 0.4936, test_loss: 1.7204, test_f1: 0.5747
 epoch: 46, train_loss: 0.4626, test_loss: 1.6820, test_f1: 0.5815
 epoch: 47, train_loss: 0.4858, test_loss: 1.7204, test_f1: 0.5211
 epoch: 48, train_loss: 0.5012, test_loss: 1.8356, test_f1: 0.5721
 epoch: 49, train_loss: 0.4504, test_loss: 2.0698, test_f1: 0.5230
 epoch: 50, train_loss: 0.4511, test_loss: 1.8107, test_f1: 0.5740
 epoch: 51, train_loss: 0.4047, test_loss: 1.9799, test_f1: 0.6112
 epoch: 52, train_loss: 0.3846, test_loss: 2.0503, test_f1: 0.5589
 epoch: 53, train_loss: 0.3672, test_loss: 2.1383, test_f1: 0.5864
 epoch: 54, train_loss: 0.3570, test_loss: 2.4490, test_f1: 0.5495
 epoch: 55, train_loss: 0.3224, test_loss: 2.4660, test_f1: 0.5441
 epoch: 56, train_loss: 0.3505, test_loss: 2.7279, test_f1: 0.6017
 epoch: 57, train_loss: 0.3438, test_loss: 2.8237, test_f1: 0.5901
 epoch: 58, train_loss: 0.3428, test_loss: 2.3411, test_f1: 0.5989
 epoch: 59, train_loss: 0.3834, test_loss: 2.5018, test_f1: 0.6050
 epoch: 60, train_loss: 0.3439, test_loss: 2.3328, test_f1: 0.5609
 epoch: 61, train_loss: 0.3431, test_loss: 2.5007, test_f1: 0.5874
 epoch: 62, train_loss: 0.3143, test_loss: 2.9554, test_f1: 0.5858
 epoch: 63, train_loss: 0.3271, test_loss: 2.5982, test_f1: 0.5734
 epoch: 64, train_loss: 0.3304, test_loss: 3.8765, test_f1: 0.5584
 epoch: 65, train_loss: 0.3082, test_loss: 4.1406, test_f1: 0.5801
 epoch: 66, train_loss: 0.3128, test_loss: 2.4298, test_f1: 0.6063
 epoch: 67, train_loss: 0.3147, test_loss: 2.6958, test_f1: 0.5884
 epoch: 68, train_loss: 0.2991, test_loss: 2.9850, test_f1: 0.5509
 epoch: 69, train_loss: 0.2995, test_loss: 2.6896, test_f1: 0.5652
 epoch: 70, train_loss: 0.2828, test_loss: 2.7721, test_f1: 0.5899
 epoch: 71, train_loss: 0.2863, test_loss: 2.4736, test_f1: 0.5824
 epoch: 72, train_loss: 0.2774, test_loss: 2.3950, test_f1: 0.6106
 epoch: 73, train_loss: 0.2937, test_loss: 2.9949, test_f1: 0.5803
 epoch: 74, train_loss: 0.2506, test_loss: 2.5902, test_f1: 0.5806
 epoch: 75, train_loss: 0.2587, test_loss: 2.3350, test_f1: 0.5720
 epoch: 76, train_loss: 0.2845, test_loss: 2.7370, test_f1: 0.6353
 epoch: 77, train_loss: 0.2679, test_loss: 2.8354, test_f1: 0.5825
 epoch: 78, train_loss: 0.2785, test_loss: 2.4299, test_f1: 0.6146
 epoch: 79, train_loss: 0.2583, test_loss: 2.7953, test_f1: 0.5990
 epoch: 80, train_loss: 0.2943, test_loss: 2.6554, test_f1: 0.5822
 epoch: 81, train_loss: 0.2561, test_loss: 2.4676, test_f1: 0.6109
 epoch: 82, train_loss: 0.2597, test_loss: 2.3217, test_f1: 0.5797
 epoch: 83, train_loss: 0.2708, test_loss: 2.3923, test_f1: 0.6013
 epoch: 84, train_loss: 0.2489, test_loss: 2.5602, test_f1: 0.6228
 epoch: 85, train_loss: 0.2436, test_loss: 2.6783, test_f1: 0.5867
 epoch: 86, train_loss: 0.2405, test_loss: 2.7416, test_f1: 0.6069
 epoch: 87, train_loss: 0.2369, test_loss: 3.3515, test_f1: 0.5539
 epoch: 88, train_loss: 0.2199, test_loss: 2.6943, test_f1: 0.5790
 epoch: 89, train_loss: 0.2265, test_loss: 2.8523, test_f1: 0.5992
 epoch: 90, train_loss: 0.2252, test_loss: 2.8036, test_f1: 0.5532
 epoch: 91, train_loss: 0.2375, test_loss: 2.4891, test_f1: 0.5992
 epoch: 92, train_loss: 0.2106, test_loss: 3.3084, test_f1: 0.5989
 epoch: 93, train_loss: 0.2356, test_loss: 3.1127, test_f1: 0.5976
 epoch: 94, train_loss: 0.2183, test_loss: 2.7460, test_f1: 0.6241
 epoch: 95, train_loss: 0.2172, test_loss: 3.3361, test_f1: 0.5664
 epoch: 96, train_loss: 0.2085, test_loss: 3.4092, test_f1: 0.5924
 epoch: 97, train_loss: 0.2198, test_loss: 3.0035, test_f1: 0.5886
 epoch: 98, train_loss: 0.2347, test_loss: 3.3486, test_f1: 0.5948
 epoch: 99, train_loss: 0.2079, test_loss: 2.8238, test_f1: 0.6125
##################ITERATION #7 ****************************************
 epoch: 0, train_loss: 1.3147, test_loss: 1.2819, test_f1: 0.4365
 epoch: 1, train_loss: 1.0925, test_loss: 1.1322, test_f1: 0.5421
 epoch: 2, train_loss: 1.0371, test_loss: 1.2059, test_f1: 0.5497
 epoch: 3, train_loss: 0.9876, test_loss: 1.1529, test_f1: 0.5320
 epoch: 4, train_loss: 0.9564, test_loss: 1.0934, test_f1: 0.5103
 epoch: 5, train_loss: 0.9229, test_loss: 1.0980, test_f1: 0.5662
 epoch: 6, train_loss: 0.8679, test_loss: 1.0930, test_f1: 0.5310
 epoch: 7, train_loss: 0.8539, test_loss: 1.0898, test_f1: 0.5871
 epoch: 8, train_loss: 0.8389, test_loss: 1.0482, test_f1: 0.6060
 epoch: 9, train_loss: 0.8114, test_loss: 1.1259, test_f1: 0.5671
 epoch: 10, train_loss: 0.7969, test_loss: 1.1785, test_f1: 0.5525
 epoch: 11, train_loss: 0.7932, test_loss: 1.1587, test_f1: 0.5759
 epoch: 12, train_loss: 0.7650, test_loss: 1.1685, test_f1: 0.5759
 epoch: 13, train_loss: 0.7721, test_loss: 1.1295, test_f1: 0.6060
 epoch: 14, train_loss: 0.7399, test_loss: 1.2116, test_f1: 0.5654
 epoch: 15, train_loss: 0.7471, test_loss: 1.2212, test_f1: 0.5766
 epoch: 16, train_loss: 0.7347, test_loss: 1.3176, test_f1: 0.5271
 epoch: 17, train_loss: 0.7462, test_loss: 1.2016, test_f1: 0.5978
 epoch: 18, train_loss: 0.7252, test_loss: 1.0995, test_f1: 0.6247
 epoch: 19, train_loss: 0.7236, test_loss: 1.0533, test_f1: 0.6162
 epoch: 20, train_loss: 0.6792, test_loss: 1.2570, test_f1: 0.5563
 epoch: 21, train_loss: 0.6633, test_loss: 1.2782, test_f1: 0.5880
 epoch: 22, train_loss: 0.6347, test_loss: 1.3475, test_f1: 0.6043
 epoch: 23, train_loss: 0.6346, test_loss: 1.5032, test_f1: 0.5546
 epoch: 24, train_loss: 0.6484, test_loss: 1.2978, test_f1: 0.5382
 epoch: 25, train_loss: 0.6334, test_loss: 1.2521, test_f1: 0.5943
 epoch: 26, train_loss: 0.6105, test_loss: 1.4110, test_f1: 0.5581
 epoch: 27, train_loss: 0.5988, test_loss: 1.4245, test_f1: 0.6043
 epoch: 28, train_loss: 0.5558, test_loss: 2.0379, test_f1: 0.4565
 epoch: 29, train_loss: 0.6400, test_loss: 1.3041, test_f1: 0.6047
 epoch: 30, train_loss: 0.5826, test_loss: 1.3129, test_f1: 0.5345
 epoch: 31, train_loss: 0.6289, test_loss: 1.4228, test_f1: 0.5794
 epoch: 32, train_loss: 0.5816, test_loss: 1.4592, test_f1: 0.5960
 epoch: 33, train_loss: 0.5709, test_loss: 1.4231, test_f1: 0.6082
 epoch: 34, train_loss: 0.5265, test_loss: 1.5471, test_f1: 0.6102
 epoch: 35, train_loss: 0.5405, test_loss: 1.4793, test_f1: 0.5711
 epoch: 36, train_loss: 0.5563, test_loss: 1.7339, test_f1: 0.5644
 epoch: 37, train_loss: 0.5282, test_loss: 1.7260, test_f1: 0.5465
 epoch: 38, train_loss: 0.5497, test_loss: 1.4501, test_f1: 0.5802
 epoch: 39, train_loss: 0.5189, test_loss: 1.8336, test_f1: 0.5593
 epoch: 40, train_loss: 0.5261, test_loss: 1.5083, test_f1: 0.5232
 epoch: 41, train_loss: 0.4910, test_loss: 1.6049, test_f1: 0.5973
 epoch: 42, train_loss: 0.5215, test_loss: 1.7439, test_f1: 0.5886
 epoch: 43, train_loss: 0.5063, test_loss: 1.3648, test_f1: 0.5895
 epoch: 44, train_loss: 0.4587, test_loss: 1.7447, test_f1: 0.5799
 epoch: 45, train_loss: 0.4801, test_loss: 1.6430, test_f1: 0.6055
 epoch: 46, train_loss: 0.4912, test_loss: 1.8235, test_f1: 0.5558
 epoch: 47, train_loss: 0.4528, test_loss: 1.7286, test_f1: 0.5831
 epoch: 48, train_loss: 0.4684, test_loss: 1.9690, test_f1: 0.5701
 epoch: 49, train_loss: 0.4513, test_loss: 1.7374, test_f1: 0.5802
 epoch: 50, train_loss: 0.4614, test_loss: 1.9972, test_f1: 0.5979
 epoch: 51, train_loss: 0.4227, test_loss: 1.7399, test_f1: 0.6154
 epoch: 52, train_loss: 0.3660, test_loss: 2.1605, test_f1: 0.6025
 epoch: 53, train_loss: 0.3568, test_loss: 2.0973, test_f1: 0.5932
 epoch: 54, train_loss: 0.3413, test_loss: 2.2910, test_f1: 0.5815
 epoch: 55, train_loss: 0.3611, test_loss: 1.9004, test_f1: 0.6042
 epoch: 56, train_loss: 0.3297, test_loss: 2.1208, test_f1: 0.6055
 epoch: 57, train_loss: 0.3345, test_loss: 2.0934, test_f1: 0.6484
 epoch: 58, train_loss: 0.3341, test_loss: 2.1845, test_f1: 0.5958
 epoch: 59, train_loss: 0.3408, test_loss: 2.1213, test_f1: 0.6110
 epoch: 60, train_loss: 0.3371, test_loss: 1.9546, test_f1: 0.6160
 epoch: 61, train_loss: 0.3170, test_loss: 2.4597, test_f1: 0.5920
 epoch: 62, train_loss: 0.3152, test_loss: 2.0836, test_f1: 0.6190
 epoch: 63, train_loss: 0.2790, test_loss: 2.4368, test_f1: 0.6002
 epoch: 64, train_loss: 0.3034, test_loss: 2.2719, test_f1: 0.6299
 epoch: 65, train_loss: 0.3108, test_loss: 2.2580, test_f1: 0.5973
 epoch: 66, train_loss: 0.2748, test_loss: 2.3379, test_f1: 0.6359
 epoch: 67, train_loss: 0.2861, test_loss: 2.3683, test_f1: 0.6431
 epoch: 68, train_loss: 0.3114, test_loss: 2.4320, test_f1: 0.6064
 epoch: 69, train_loss: 0.2929, test_loss: 2.3637, test_f1: 0.5850
 epoch: 70, train_loss: 0.3039, test_loss: 2.6015, test_f1: 0.5974
 epoch: 71, train_loss: 0.3117, test_loss: 2.7370, test_f1: 0.5823
 epoch: 72, train_loss: 0.2579, test_loss: 2.6614, test_f1: 0.5991
 epoch: 73, train_loss: 0.2608, test_loss: 2.7512, test_f1: 0.6435
 epoch: 74, train_loss: 0.2828, test_loss: 2.1708, test_f1: 0.6336
 epoch: 75, train_loss: 0.2715, test_loss: 2.0896, test_f1: 0.6550
 epoch: 76, train_loss: 0.2956, test_loss: 2.7358, test_f1: 0.5918
 epoch: 77, train_loss: 0.2635, test_loss: 2.6153, test_f1: 0.6029
 epoch: 78, train_loss: 0.2863, test_loss: 2.3336, test_f1: 0.5861
 epoch: 79, train_loss: 0.2378, test_loss: 2.4237, test_f1: 0.6225
 epoch: 80, train_loss: 0.2512, test_loss: 2.3680, test_f1: 0.6191
 epoch: 81, train_loss: 0.2538, test_loss: 2.6491, test_f1: 0.6294
 epoch: 82, train_loss: 0.2837, test_loss: 2.3825, test_f1: 0.5991
 epoch: 83, train_loss: 0.2510, test_loss: 2.4930, test_f1: 0.6210
 epoch: 84, train_loss: 0.2567, test_loss: 2.7707, test_f1: 0.5752
 epoch: 85, train_loss: 0.2746, test_loss: 2.9166, test_f1: 0.6057
 epoch: 86, train_loss: 0.2620, test_loss: 2.9406, test_f1: 0.5889
 epoch: 87, train_loss: 0.2590, test_loss: 2.4586, test_f1: 0.6144
 epoch: 88, train_loss: 0.2762, test_loss: 2.3802, test_f1: 0.6001
 epoch: 89, train_loss: 0.2525, test_loss: 2.5344, test_f1: 0.5908
 epoch: 90, train_loss: 0.2549, test_loss: 3.2120, test_f1: 0.5439
 epoch: 91, train_loss: 0.2250, test_loss: 2.8927, test_f1: 0.6242
 epoch: 92, train_loss: 0.2194, test_loss: 3.2464, test_f1: 0.6215
 epoch: 93, train_loss: 0.2419, test_loss: 2.6634, test_f1: 0.6084
 epoch: 94, train_loss: 0.2407, test_loss: 3.0472, test_f1: 0.6259
 epoch: 95, train_loss: 0.2356, test_loss: 2.8638, test_f1: 0.5946
 epoch: 96, train_loss: 0.2254, test_loss: 3.1534, test_f1: 0.5784
 epoch: 97, train_loss: 0.2317, test_loss: 2.9027, test_f1: 0.5747
 epoch: 98, train_loss: 0.2452, test_loss: 2.8792, test_f1: 0.5613
 epoch: 99, train_loss: 0.2183, test_loss: 2.6483, test_f1: 0.5946
##################ITERATION #8 ****************************************
 epoch: 0, train_loss: 1.2937, test_loss: 1.2731, test_f1: 0.4335
 epoch: 1, train_loss: 1.1003, test_loss: 1.1809, test_f1: 0.5030
 epoch: 2, train_loss: 1.0245, test_loss: 1.2045, test_f1: 0.5173
 epoch: 3, train_loss: 0.9947, test_loss: 1.1155, test_f1: 0.5441
 epoch: 4, train_loss: 0.9644, test_loss: 1.0976, test_f1: 0.5933
 epoch: 5, train_loss: 0.9374, test_loss: 1.0940, test_f1: 0.5303
 epoch: 6, train_loss: 0.8958, test_loss: 1.0949, test_f1: 0.5045
 epoch: 7, train_loss: 0.8894, test_loss: 1.0911, test_f1: 0.5567
 epoch: 8, train_loss: 0.8275, test_loss: 1.0517, test_f1: 0.5865
 epoch: 9, train_loss: 0.8247, test_loss: 1.2336, test_f1: 0.4921
 epoch: 10, train_loss: 0.8610, test_loss: 1.0725, test_f1: 0.5986
 epoch: 11, train_loss: 0.7898, test_loss: 1.1633, test_f1: 0.5056
 epoch: 12, train_loss: 0.8100, test_loss: 1.0299, test_f1: 0.5900
 epoch: 13, train_loss: 0.7507, test_loss: 1.1886, test_f1: 0.5762
 epoch: 14, train_loss: 0.7382, test_loss: 1.2932, test_f1: 0.5608
 epoch: 15, train_loss: 0.7203, test_loss: 1.1610, test_f1: 0.5639
 epoch: 16, train_loss: 0.7342, test_loss: 1.1739, test_f1: 0.5779
 epoch: 17, train_loss: 0.7263, test_loss: 1.3046, test_f1: 0.5462
 epoch: 18, train_loss: 0.7316, test_loss: 1.1813, test_f1: 0.5606
 epoch: 19, train_loss: 0.6933, test_loss: 1.3726, test_f1: 0.5592
 epoch: 20, train_loss: 0.6841, test_loss: 1.1612, test_f1: 0.5653
 epoch: 21, train_loss: 0.6758, test_loss: 1.1473, test_f1: 0.5829
 epoch: 22, train_loss: 0.6592, test_loss: 1.3035, test_f1: 0.5955
 epoch: 23, train_loss: 0.6502, test_loss: 1.3967, test_f1: 0.5056
 epoch: 24, train_loss: 0.6542, test_loss: 1.2455, test_f1: 0.5784
 epoch: 25, train_loss: 0.6141, test_loss: 1.2560, test_f1: 0.6169
 epoch: 26, train_loss: 0.5834, test_loss: 1.3352, test_f1: 0.6498
 epoch: 27, train_loss: 0.6018, test_loss: 1.2527, test_f1: 0.6146
 epoch: 28, train_loss: 0.6173, test_loss: 1.1758, test_f1: 0.6318
 epoch: 29, train_loss: 0.5879, test_loss: 1.4723, test_f1: 0.5346
 epoch: 30, train_loss: 0.5729, test_loss: 1.4358, test_f1: 0.5910
 epoch: 31, train_loss: 0.5640, test_loss: 1.2673, test_f1: 0.5997
 epoch: 32, train_loss: 0.5668, test_loss: 1.4044, test_f1: 0.5481
 epoch: 33, train_loss: 0.5466, test_loss: 1.1980, test_f1: 0.5976
 epoch: 34, train_loss: 0.5370, test_loss: 1.4867, test_f1: 0.5672
 epoch: 35, train_loss: 0.5118, test_loss: 1.4618, test_f1: 0.5820
 epoch: 36, train_loss: 0.4931, test_loss: 1.5649, test_f1: 0.6055
 epoch: 37, train_loss: 0.5255, test_loss: 1.4774, test_f1: 0.5581
 epoch: 38, train_loss: 0.5087, test_loss: 1.5066, test_f1: 0.6161
 epoch: 39, train_loss: 0.5056, test_loss: 2.0475, test_f1: 0.5342
 epoch: 40, train_loss: 0.4843, test_loss: 1.6195, test_f1: 0.5823
 epoch: 41, train_loss: 0.5173, test_loss: 1.8144, test_f1: 0.5393
 epoch: 42, train_loss: 0.4908, test_loss: 1.7617, test_f1: 0.6265
 epoch: 43, train_loss: 0.4805, test_loss: 1.5943, test_f1: 0.5490
 epoch: 44, train_loss: 0.4636, test_loss: 1.7194, test_f1: 0.5968
 epoch: 45, train_loss: 0.4257, test_loss: 1.4709, test_f1: 0.6137
 epoch: 46, train_loss: 0.4763, test_loss: 1.7877, test_f1: 0.5641
 epoch: 47, train_loss: 0.4380, test_loss: 1.7569, test_f1: 0.5832
 epoch: 48, train_loss: 0.4418, test_loss: 1.7954, test_f1: 0.5109
 epoch: 49, train_loss: 0.4366, test_loss: 2.1785, test_f1: 0.5483
 epoch: 50, train_loss: 0.4136, test_loss: 2.0398, test_f1: 0.5372
 epoch: 51, train_loss: 0.3938, test_loss: 1.7479, test_f1: 0.6246
 epoch: 52, train_loss: 0.3894, test_loss: 1.7170, test_f1: 0.6140
 epoch: 53, train_loss: 0.3391, test_loss: 1.9345, test_f1: 0.5874
 epoch: 54, train_loss: 0.3667, test_loss: 2.0516, test_f1: 0.5783
 epoch: 55, train_loss: 0.3474, test_loss: 1.8030, test_f1: 0.5623
 epoch: 56, train_loss: 0.3406, test_loss: 2.2062, test_f1: 0.5447
 epoch: 57, train_loss: 0.3583, test_loss: 2.0869, test_f1: 0.6084
 epoch: 58, train_loss: 0.3090, test_loss: 2.1123, test_f1: 0.5745
 epoch: 59, train_loss: 0.3216, test_loss: 2.6239, test_f1: 0.5758
 epoch: 60, train_loss: 0.3360, test_loss: 2.4630, test_f1: 0.5532
 epoch: 61, train_loss: 0.3188, test_loss: 2.6699, test_f1: 0.5389
 epoch: 62, train_loss: 0.3062, test_loss: 2.5176, test_f1: 0.5486
 epoch: 63, train_loss: 0.2810, test_loss: 2.7116, test_f1: 0.5489
 epoch: 64, train_loss: 0.3071, test_loss: 2.7921, test_f1: 0.5413
 epoch: 65, train_loss: 0.3140, test_loss: 2.4875, test_f1: 0.5502
 epoch: 66, train_loss: 0.2909, test_loss: 3.3597, test_f1: 0.5387
 epoch: 67, train_loss: 0.2670, test_loss: 2.6096, test_f1: 0.5457
 epoch: 68, train_loss: 0.2821, test_loss: 3.0215, test_f1: 0.5678
 epoch: 69, train_loss: 0.3005, test_loss: 2.5133, test_f1: 0.5450
 epoch: 70, train_loss: 0.2756, test_loss: 2.7399, test_f1: 0.5522
 epoch: 71, train_loss: 0.2938, test_loss: 2.6543, test_f1: 0.5593
 epoch: 72, train_loss: 0.2723, test_loss: 2.5666, test_f1: 0.5497
 epoch: 73, train_loss: 0.2910, test_loss: 2.3284, test_f1: 0.5523
 epoch: 74, train_loss: 0.2718, test_loss: 2.5549, test_f1: 0.5497
 epoch: 75, train_loss: 0.2819, test_loss: 2.2872, test_f1: 0.5646
 epoch: 76, train_loss: 0.2739, test_loss: 2.3625, test_f1: 0.5534
 epoch: 77, train_loss: 0.2658, test_loss: 2.6092, test_f1: 0.5712
 epoch: 78, train_loss: 0.2704, test_loss: 2.8765, test_f1: 0.5597
 epoch: 79, train_loss: 0.2595, test_loss: 2.6747, test_f1: 0.5847
 epoch: 80, train_loss: 0.2607, test_loss: 2.9807, test_f1: 0.5706
 epoch: 81, train_loss: 0.2574, test_loss: 2.6764, test_f1: 0.5857
 epoch: 82, train_loss: 0.2556, test_loss: 2.8048, test_f1: 0.5601
 epoch: 83, train_loss: 0.2418, test_loss: 2.9290, test_f1: 0.5775
 epoch: 84, train_loss: 0.2521, test_loss: 3.1173, test_f1: 0.5498
 epoch: 85, train_loss: 0.2539, test_loss: 2.8102, test_f1: 0.5883
 epoch: 86, train_loss: 0.2374, test_loss: 3.0603, test_f1: 0.5870
 epoch: 87, train_loss: 0.2460, test_loss: 3.0613, test_f1: 0.5454
 epoch: 88, train_loss: 0.2622, test_loss: 3.4869, test_f1: 0.5552
 epoch: 89, train_loss: 0.2315, test_loss: 2.6728, test_f1: 0.5833
 epoch: 90, train_loss: 0.2324, test_loss: 2.6823, test_f1: 0.5647
 epoch: 91, train_loss: 0.2439, test_loss: 3.0845, test_f1: 0.5741
 epoch: 92, train_loss: 0.2367, test_loss: 3.2450, test_f1: 0.5665
 epoch: 93, train_loss: 0.2341, test_loss: 4.0314, test_f1: 0.5854
 epoch: 94, train_loss: 0.2281, test_loss: 3.2902, test_f1: 0.5171
 epoch: 95, train_loss: 0.2327, test_loss: 2.9958, test_f1: 0.5875
 epoch: 96, train_loss: 0.2454, test_loss: 3.2304, test_f1: 0.5688
 epoch: 97, train_loss: 0.2324, test_loss: 4.1317, test_f1: 0.5533
 epoch: 98, train_loss: 0.2540, test_loss: 3.6142, test_f1: 0.5594
 epoch: 99, train_loss: 0.1996, test_loss: 3.4808, test_f1: 0.5573
##################ITERATION #9 ****************************************
 epoch: 0, train_loss: 1.3381, test_loss: 1.2274, test_f1: 0.4282
 epoch: 1, train_loss: 1.0888, test_loss: 1.1580, test_f1: 0.4701
 epoch: 2, train_loss: 1.0088, test_loss: 1.1396, test_f1: 0.5291
 epoch: 3, train_loss: 0.9833, test_loss: 1.0984, test_f1: 0.5655
 epoch: 4, train_loss: 0.9634, test_loss: 1.0983, test_f1: 0.5191
 epoch: 5, train_loss: 0.9115, test_loss: 1.0552, test_f1: 0.6029
 epoch: 6, train_loss: 0.8701, test_loss: 1.1025, test_f1: 0.5494
 epoch: 7, train_loss: 0.8558, test_loss: 1.1048, test_f1: 0.5438
 epoch: 8, train_loss: 0.8200, test_loss: 1.1028, test_f1: 0.5957
 epoch: 9, train_loss: 0.8167, test_loss: 1.1033, test_f1: 0.6248
 epoch: 10, train_loss: 0.8071, test_loss: 1.0452, test_f1: 0.5460
 epoch: 11, train_loss: 0.7934, test_loss: 1.1381, test_f1: 0.5731
 epoch: 12, train_loss: 0.7650, test_loss: 1.1932, test_f1: 0.5552
 epoch: 13, train_loss: 0.7650, test_loss: 1.1703, test_f1: 0.5854
 epoch: 14, train_loss: 0.7163, test_loss: 1.1550, test_f1: 0.5740
 epoch: 15, train_loss: 0.7405, test_loss: 1.2571, test_f1: 0.6052
 epoch: 16, train_loss: 0.7150, test_loss: 1.0712, test_f1: 0.6359
 epoch: 17, train_loss: 0.6921, test_loss: 1.0954, test_f1: 0.6466
 epoch: 18, train_loss: 0.6768, test_loss: 1.5688, test_f1: 0.5281
 epoch: 19, train_loss: 0.6706, test_loss: 1.2007, test_f1: 0.4885
 epoch: 20, train_loss: 0.6640, test_loss: 1.2136, test_f1: 0.6270
 epoch: 21, train_loss: 0.6237, test_loss: 1.3667, test_f1: 0.5900
 epoch: 22, train_loss: 0.6532, test_loss: 1.3181, test_f1: 0.6019
 epoch: 23, train_loss: 0.6586, test_loss: 1.2342, test_f1: 0.5672
 epoch: 24, train_loss: 0.6232, test_loss: 1.3490, test_f1: 0.5691
 epoch: 25, train_loss: 0.6083, test_loss: 1.5232, test_f1: 0.5617
 epoch: 26, train_loss: 0.6104, test_loss: 1.2400, test_f1: 0.6001
 epoch: 27, train_loss: 0.5874, test_loss: 1.1713, test_f1: 0.5986
 epoch: 28, train_loss: 0.5672, test_loss: 1.4954, test_f1: 0.5832
 epoch: 29, train_loss: 0.5602, test_loss: 1.5194, test_f1: 0.5971
 epoch: 30, train_loss: 0.5432, test_loss: 1.2428, test_f1: 0.5881
 epoch: 31, train_loss: 0.5936, test_loss: 1.2581, test_f1: 0.5675
 epoch: 32, train_loss: 0.5585, test_loss: 1.3073, test_f1: 0.5901
 epoch: 33, train_loss: 0.5640, test_loss: 1.8525, test_f1: 0.5140
 epoch: 34, train_loss: 0.5482, test_loss: 1.3713, test_f1: 0.5843
 epoch: 35, train_loss: 0.5385, test_loss: 1.5473, test_f1: 0.5595
 epoch: 36, train_loss: 0.5135, test_loss: 1.7106, test_f1: 0.5324
 epoch: 37, train_loss: 0.5163, test_loss: 1.6308, test_f1: 0.5489
 epoch: 38, train_loss: 0.5209, test_loss: 1.7640, test_f1: 0.5519
 epoch: 39, train_loss: 0.5127, test_loss: 1.5793, test_f1: 0.5654
 epoch: 40, train_loss: 0.4890, test_loss: 1.7145, test_f1: 0.5831
 epoch: 41, train_loss: 0.5057, test_loss: 1.8680, test_f1: 0.5450
 epoch: 42, train_loss: 0.4502, test_loss: 1.7939, test_f1: 0.5673
 epoch: 43, train_loss: 0.4601, test_loss: 1.7667, test_f1: 0.5649
 epoch: 44, train_loss: 0.4835, test_loss: 1.7859, test_f1: 0.5822
 epoch: 45, train_loss: 0.4317, test_loss: 1.7936, test_f1: 0.5772
 epoch: 46, train_loss: 0.4576, test_loss: 1.9348, test_f1: 0.5512
 epoch: 47, train_loss: 0.4264, test_loss: 2.0062, test_f1: 0.5627
 epoch: 48, train_loss: 0.4326, test_loss: 1.7687, test_f1: 0.5550
 epoch: 49, train_loss: 0.4599, test_loss: 2.0109, test_f1: 0.5439
 epoch: 50, train_loss: 0.4333, test_loss: 2.0068, test_f1: 0.5373
 epoch: 51, train_loss: 0.3693, test_loss: 1.7230, test_f1: 0.5673
 epoch: 52, train_loss: 0.3266, test_loss: 2.0203, test_f1: 0.5735
 epoch: 53, train_loss: 0.3257, test_loss: 2.0444, test_f1: 0.5790
 epoch: 54, train_loss: 0.3180, test_loss: 2.0829, test_f1: 0.5704
 epoch: 55, train_loss: 0.3231, test_loss: 2.1189, test_f1: 0.5843
 epoch: 56, train_loss: 0.3069, test_loss: 2.1076, test_f1: 0.5628
 epoch: 57, train_loss: 0.3168, test_loss: 2.0363, test_f1: 0.5682
 epoch: 58, train_loss: 0.3267, test_loss: 2.3024, test_f1: 0.5803
 epoch: 59, train_loss: 0.3209, test_loss: 1.9981, test_f1: 0.6035
 epoch: 60, train_loss: 0.2723, test_loss: 2.0643, test_f1: 0.5864
 epoch: 61, train_loss: 0.2996, test_loss: 2.1153, test_f1: 0.5728
 epoch: 62, train_loss: 0.3121, test_loss: 2.0704, test_f1: 0.5645
 epoch: 63, train_loss: 0.3099, test_loss: 2.0570, test_f1: 0.5502
 epoch: 64, train_loss: 0.2761, test_loss: 2.2064, test_f1: 0.5816
 epoch: 65, train_loss: 0.2530, test_loss: 2.1513, test_f1: 0.5825
 epoch: 66, train_loss: 0.2859, test_loss: 2.7710, test_f1: 0.5135
 epoch: 67, train_loss: 0.2901, test_loss: 2.4423, test_f1: 0.5761
 epoch: 68, train_loss: 0.2629, test_loss: 2.4549, test_f1: 0.5708
 epoch: 69, train_loss: 0.2812, test_loss: 2.6361, test_f1: 0.5673
 epoch: 70, train_loss: 0.2646, test_loss: 2.6377, test_f1: 0.5697
 epoch: 71, train_loss: 0.2684, test_loss: 2.4941, test_f1: 0.5883
 epoch: 72, train_loss: 0.2417, test_loss: 2.6606, test_f1: 0.5675
 epoch: 73, train_loss: 0.2606, test_loss: 2.5568, test_f1: 0.5768
 epoch: 74, train_loss: 0.2577, test_loss: 2.5690, test_f1: 0.5555
 epoch: 75, train_loss: 0.2381, test_loss: 2.3725, test_f1: 0.5646
 epoch: 76, train_loss: 0.2360, test_loss: 2.7333, test_f1: 0.5395
 epoch: 77, train_loss: 0.2511, test_loss: 2.5449, test_f1: 0.5882
 epoch: 78, train_loss: 0.2181, test_loss: 2.7124, test_f1: 0.5659
 epoch: 79, train_loss: 0.2372, test_loss: 2.6237, test_f1: 0.5805
 epoch: 80, train_loss: 0.2472, test_loss: 2.6852, test_f1: 0.5772
 epoch: 81, train_loss: 0.2466, test_loss: 2.5344, test_f1: 0.5790
 epoch: 82, train_loss: 0.2230, test_loss: 2.3934, test_f1: 0.5763
 epoch: 83, train_loss: 0.2166, test_loss: 2.9953, test_f1: 0.5718
 epoch: 84, train_loss: 0.2117, test_loss: 2.7258, test_f1: 0.5786
 epoch: 85, train_loss: 0.2380, test_loss: 2.4554, test_f1: 0.5772
 epoch: 86, train_loss: 0.2074, test_loss: 2.5896, test_f1: 0.5952
 epoch: 87, train_loss: 0.2094, test_loss: 2.5850, test_f1: 0.5898
 epoch: 88, train_loss: 0.2285, test_loss: 2.6234, test_f1: 0.5965
 epoch: 89, train_loss: 0.2213, test_loss: 2.6496, test_f1: 0.5747
 epoch: 90, train_loss: 0.2328, test_loss: 2.5638, test_f1: 0.5955
 epoch: 91, train_loss: 0.1780, test_loss: 2.8634, test_f1: 0.5708
 epoch: 92, train_loss: 0.1879, test_loss: 3.0439, test_f1: 0.5680
 epoch: 93, train_loss: 0.2041, test_loss: 2.7363, test_f1: 0.5901
 epoch: 94, train_loss: 0.2205, test_loss: 3.1267, test_f1: 0.5891
 epoch: 95, train_loss: 0.2181, test_loss: 3.2780, test_f1: 0.5727
 epoch: 96, train_loss: 0.2400, test_loss: 3.2191, test_f1: 0.5412
 epoch: 97, train_loss: 0.2369, test_loss: 2.7053, test_f1: 0.5784
 epoch: 98, train_loss: 0.2229, test_loss: 2.6814, test_f1: 0.5668
 epoch: 99, train_loss: 0.2263, test_loss: 2.6957, test_f1: 0.5743

Training completed in 591.84 seconds
Best F1: 0.6550 at epoch 75
Mean F1 across iterations: 0.6420  0.0092
========================FINAL RESULTS================================
FEGIN weighted F1: 0.6550  0.0092
python main.py --data ltspice_demos --representation component_component --model FEGIN --layers 3 --hiddens 128 --batch_size 32 --lr 0.001 --emb_size 512 --epochs 100 --save_appendix component_component_L3_H128_BS32_LR0.001_E512 --no_val
-----



STDERR:
  File "main.py", line 370, in <module>
    main()
  File "main.py", line 254, in main
    dataset = dataset_class(
  File "/home/philip/projects/ltspice_examples_code_repo/Circuit-Completion-Using-GNNs/component_classification_with_link_prediction_head/evaluation/FEGIN/kernel/circuit_datasets.py", line 15, in __init__
    self.data, self.slices = torch.load(self.processed_paths[0])
  File "/home/philip/.local/lib/python3.8/site-packages/torch/serialization.py", line 1040, in load
    warnings.warn(
  File "/usr/lib/python3.8/warnings.py", line 109, in _showwarnmsg
    sw(msg.message, msg.category, msg.filename, msg.lineno,
  File "main.py", line 47, in warn_with_traceback
    traceback.print_stack(file=log)
/home/philip/projects/ltspice_examples_code_repo/Circuit-Completion-Using-GNNs/component_classification_with_link_prediction_head/evaluation/FEGIN/kernel/circuit_datasets.py:15: FutureWarning: You are using `torch.load` with `weights_only=False` (the current default value), which uses the default pickle module implicitly. It is possible to construct malicious pickle data which will execute arbitrary code during unpickling (See https://github.com/pytorch/pytorch/blob/main/SECURITY.md#untrusted-models for more details). In a future release, the default value for `weights_only` will be flipped to `True`. This limits the functions that could be executed during unpickling. Arbitrary objects will no longer be allowed to be loaded via this mode unless they are explicitly allowlisted by the user via `torch.serialization.add_safe_globals`. We recommend you start setting `weights_only=True` for any use case where you don't have full control of the loaded file. Please open an issue on GitHub for any issues related to this experimental feature.
  self.data, self.slices = torch.load(self.processed_paths[0])
