STDOUT:
Results will be saved in /home/philip/projects/ltspice_examples_code_repo/Circuit-Completion-Using-GNNs/component_classification_with_link_prediction_head/evaluation/FEGIN/results/model_FEGIN_dataset_ltspice_examples
Command line input: python main.py --data ltspice_examples --representation component_net --model FEGIN --layers 2 --hiddens 16 --batch_size 32 --lr 0.001 --emb_size 250 --epochs 100 --save_appendix component_net_L2_H16_BS32_LR0.001_E250 --no_val
 is saved.
-----
ltspice_examples - FEGIN
Using 2 layers, 16 hidden units, h = 2
Loading component_net representation dataset
ENTERED
Training FEGIN on component_net representation
Train: 3558, Test: 846
##################ITERATION #0 ****************************************
 epoch: 0, train_loss: 1.3459, test_loss: 1.2616, test_f1: 0.2270
 epoch: 1, train_loss: 1.2490, test_loss: 1.2110, test_f1: 0.2315
 epoch: 2, train_loss: 1.2055, test_loss: 1.1467, test_f1: 0.3867
 epoch: 3, train_loss: 1.1501, test_loss: 1.0799, test_f1: 0.3565
 epoch: 4, train_loss: 1.0890, test_loss: 1.0358, test_f1: 0.3453
 epoch: 5, train_loss: 1.0605, test_loss: 1.0236, test_f1: 0.3506
 epoch: 6, train_loss: 1.0407, test_loss: 1.0269, test_f1: 0.3518
 epoch: 7, train_loss: 1.0325, test_loss: 1.0042, test_f1: 0.3582
 epoch: 8, train_loss: 1.0258, test_loss: 1.0072, test_f1: 0.4364
 epoch: 9, train_loss: 1.0105, test_loss: 0.9899, test_f1: 0.4415
 epoch: 10, train_loss: 0.9978, test_loss: 1.0050, test_f1: 0.4623
 epoch: 11, train_loss: 0.9907, test_loss: 1.0253, test_f1: 0.4860
 epoch: 12, train_loss: 0.9916, test_loss: 0.9729, test_f1: 0.4620
 epoch: 13, train_loss: 0.9897, test_loss: 0.9970, test_f1: 0.4605
 epoch: 14, train_loss: 0.9819, test_loss: 0.9653, test_f1: 0.4696
 epoch: 15, train_loss: 0.9683, test_loss: 0.9366, test_f1: 0.4827
 epoch: 16, train_loss: 0.9731, test_loss: 0.9708, test_f1: 0.4492
 epoch: 17, train_loss: 0.9628, test_loss: 0.9402, test_f1: 0.4981
 epoch: 18, train_loss: 0.9559, test_loss: 0.9521, test_f1: 0.4734
 epoch: 19, train_loss: 0.9645, test_loss: 0.9187, test_f1: 0.5232
 epoch: 20, train_loss: 0.9581, test_loss: 1.0104, test_f1: 0.4827
 epoch: 21, train_loss: 0.9595, test_loss: 1.0017, test_f1: 0.4549
 epoch: 22, train_loss: 0.9464, test_loss: 0.9677, test_f1: 0.5018
 epoch: 23, train_loss: 0.9410, test_loss: 0.9701, test_f1: 0.4876
 epoch: 24, train_loss: 0.9489, test_loss: 0.9642, test_f1: 0.5022
 epoch: 25, train_loss: 0.9486, test_loss: 0.9493, test_f1: 0.4964
 epoch: 26, train_loss: 0.9478, test_loss: 0.9561, test_f1: 0.5184
 epoch: 27, train_loss: 0.9315, test_loss: 0.9927, test_f1: 0.4874
 epoch: 28, train_loss: 0.9323, test_loss: 0.9751, test_f1: 0.4933
 epoch: 29, train_loss: 0.9326, test_loss: 0.9218, test_f1: 0.5002
 epoch: 30, train_loss: 0.9283, test_loss: 0.9623, test_f1: 0.4876
 epoch: 31, train_loss: 0.9326, test_loss: 0.9535, test_f1: 0.4968
 epoch: 32, train_loss: 0.9268, test_loss: 0.9692, test_f1: 0.5488
 epoch: 33, train_loss: 0.9281, test_loss: 0.9206, test_f1: 0.5173
 epoch: 34, train_loss: 0.9125, test_loss: 0.9400, test_f1: 0.5135
 epoch: 35, train_loss: 0.9345, test_loss: 0.9314, test_f1: 0.4932
 epoch: 36, train_loss: 0.9132, test_loss: 0.9573, test_f1: 0.5147
 epoch: 37, train_loss: 0.9165, test_loss: 0.9439, test_f1: 0.5127
 epoch: 38, train_loss: 0.9136, test_loss: 0.9056, test_f1: 0.5240
 epoch: 39, train_loss: 0.9113, test_loss: 0.9489, test_f1: 0.4947
 epoch: 40, train_loss: 0.9034, test_loss: 0.9330, test_f1: 0.5293
 epoch: 41, train_loss: 0.9091, test_loss: 0.9589, test_f1: 0.5112
 epoch: 42, train_loss: 0.9058, test_loss: 0.9392, test_f1: 0.5341
 epoch: 43, train_loss: 0.9005, test_loss: 0.9079, test_f1: 0.5133
 epoch: 44, train_loss: 0.9015, test_loss: 0.9545, test_f1: 0.5274
 epoch: 45, train_loss: 0.8952, test_loss: 0.9127, test_f1: 0.5154
 epoch: 46, train_loss: 0.9100, test_loss: 0.9380, test_f1: 0.5185
 epoch: 47, train_loss: 0.8801, test_loss: 0.9257, test_f1: 0.5335
 epoch: 48, train_loss: 0.8977, test_loss: 0.9279, test_f1: 0.5233
 epoch: 49, train_loss: 0.9044, test_loss: 0.9138, test_f1: 0.5239
 epoch: 50, train_loss: 0.8893, test_loss: 0.9322, test_f1: 0.5298
 epoch: 51, train_loss: 0.8783, test_loss: 0.8739, test_f1: 0.5270
 epoch: 52, train_loss: 0.8781, test_loss: 0.9283, test_f1: 0.5346
 epoch: 53, train_loss: 0.8872, test_loss: 0.9450, test_f1: 0.5147
 epoch: 54, train_loss: 0.8783, test_loss: 0.9215, test_f1: 0.5055
 epoch: 55, train_loss: 0.8673, test_loss: 0.9013, test_f1: 0.5290
 epoch: 56, train_loss: 0.8780, test_loss: 0.9134, test_f1: 0.5177
 epoch: 57, train_loss: 0.8727, test_loss: 0.9063, test_f1: 0.5106
 epoch: 58, train_loss: 0.8677, test_loss: 0.8994, test_f1: 0.5405
 epoch: 59, train_loss: 0.8699, test_loss: 0.9074, test_f1: 0.5350
 epoch: 60, train_loss: 0.8701, test_loss: 0.9149, test_f1: 0.5369
 epoch: 61, train_loss: 0.8681, test_loss: 0.9148, test_f1: 0.5528
 epoch: 62, train_loss: 0.8629, test_loss: 0.8956, test_f1: 0.5472
 epoch: 63, train_loss: 0.8556, test_loss: 0.9135, test_f1: 0.5328
 epoch: 64, train_loss: 0.8710, test_loss: 0.9273, test_f1: 0.5373
 epoch: 65, train_loss: 0.8593, test_loss: 0.9413, test_f1: 0.5219
 epoch: 66, train_loss: 0.8610, test_loss: 0.9345, test_f1: 0.5399
 epoch: 67, train_loss: 0.8529, test_loss: 0.9262, test_f1: 0.5417
 epoch: 68, train_loss: 0.8557, test_loss: 0.9166, test_f1: 0.5321
 epoch: 69, train_loss: 0.8518, test_loss: 0.9220, test_f1: 0.5387
 epoch: 70, train_loss: 0.8541, test_loss: 0.9226, test_f1: 0.5423
 epoch: 71, train_loss: 0.8427, test_loss: 0.9365, test_f1: 0.5298
 epoch: 72, train_loss: 0.8610, test_loss: 0.8750, test_f1: 0.5482
 epoch: 73, train_loss: 0.8494, test_loss: 0.9169, test_f1: 0.5469
 epoch: 74, train_loss: 0.8522, test_loss: 0.9167, test_f1: 0.5403
 epoch: 75, train_loss: 0.8438, test_loss: 0.9125, test_f1: 0.5286
 epoch: 76, train_loss: 0.8511, test_loss: 0.8868, test_f1: 0.5386
 epoch: 77, train_loss: 0.8440, test_loss: 0.8924, test_f1: 0.5450
 epoch: 78, train_loss: 0.8557, test_loss: 0.9414, test_f1: 0.5196
 epoch: 79, train_loss: 0.8559, test_loss: 0.9108, test_f1: 0.5506
 epoch: 80, train_loss: 0.8512, test_loss: 0.9031, test_f1: 0.5389
 epoch: 81, train_loss: 0.8532, test_loss: 0.9232, test_f1: 0.5452
 epoch: 82, train_loss: 0.8443, test_loss: 0.8848, test_f1: 0.5489
 epoch: 83, train_loss: 0.8448, test_loss: 0.9335, test_f1: 0.5351
 epoch: 84, train_loss: 0.8352, test_loss: 0.9031, test_f1: 0.5364
 epoch: 85, train_loss: 0.8367, test_loss: 0.9226, test_f1: 0.5315
 epoch: 86, train_loss: 0.8380, test_loss: 0.9122, test_f1: 0.5506
 epoch: 87, train_loss: 0.8459, test_loss: 0.9099, test_f1: 0.5398
 epoch: 88, train_loss: 0.8460, test_loss: 0.9129, test_f1: 0.5418
 epoch: 89, train_loss: 0.8475, test_loss: 0.8828, test_f1: 0.5400
 epoch: 90, train_loss: 0.8368, test_loss: 0.9048, test_f1: 0.5377
 epoch: 91, train_loss: 0.8342, test_loss: 0.8830, test_f1: 0.5420
 epoch: 92, train_loss: 0.8299, test_loss: 0.8943, test_f1: 0.5319
 epoch: 93, train_loss: 0.8439, test_loss: 0.8856, test_f1: 0.5480
 epoch: 94, train_loss: 0.8444, test_loss: 0.8863, test_f1: 0.5459
 epoch: 95, train_loss: 0.8369, test_loss: 0.9078, test_f1: 0.5391
 epoch: 96, train_loss: 0.8284, test_loss: 0.9038, test_f1: 0.5551
 epoch: 97, train_loss: 0.8414, test_loss: 0.8861, test_f1: 0.5412
 epoch: 98, train_loss: 0.8320, test_loss: 0.9035, test_f1: 0.5302
 epoch: 99, train_loss: 0.8370, test_loss: 0.8688, test_f1: 0.5523
##################ITERATION #1 ****************************************
 epoch: 0, train_loss: 1.2444, test_loss: 1.1593, test_f1: 0.2537
 epoch: 1, train_loss: 1.1574, test_loss: 1.0787, test_f1: 0.3585
 epoch: 2, train_loss: 1.0962, test_loss: 1.0598, test_f1: 0.4067
 epoch: 3, train_loss: 1.0739, test_loss: 1.0473, test_f1: 0.4314
 epoch: 4, train_loss: 1.0482, test_loss: 1.0555, test_f1: 0.4443
 epoch: 5, train_loss: 1.0307, test_loss: 1.0276, test_f1: 0.4154
 epoch: 6, train_loss: 1.0218, test_loss: 1.0438, test_f1: 0.4745
 epoch: 7, train_loss: 1.0195, test_loss: 1.0180, test_f1: 0.4677
 epoch: 8, train_loss: 1.0013, test_loss: 1.0072, test_f1: 0.4788
 epoch: 9, train_loss: 0.9954, test_loss: 0.9991, test_f1: 0.4902
 epoch: 10, train_loss: 0.9928, test_loss: 1.0037, test_f1: 0.4858
 epoch: 11, train_loss: 0.9860, test_loss: 1.0103, test_f1: 0.4840
 epoch: 12, train_loss: 0.9763, test_loss: 0.9922, test_f1: 0.4864
 epoch: 13, train_loss: 0.9652, test_loss: 0.9799, test_f1: 0.5047
 epoch: 14, train_loss: 0.9604, test_loss: 0.9660, test_f1: 0.4882
 epoch: 15, train_loss: 0.9643, test_loss: 0.9694, test_f1: 0.5131
 epoch: 16, train_loss: 0.9656, test_loss: 1.0052, test_f1: 0.4943
 epoch: 17, train_loss: 0.9530, test_loss: 0.9851, test_f1: 0.4979
 epoch: 18, train_loss: 0.9547, test_loss: 0.9867, test_f1: 0.4763
 epoch: 19, train_loss: 0.9506, test_loss: 1.0132, test_f1: 0.4807
 epoch: 20, train_loss: 0.9432, test_loss: 1.0358, test_f1: 0.4917
 epoch: 21, train_loss: 0.9315, test_loss: 1.0101, test_f1: 0.4775
 epoch: 22, train_loss: 0.9399, test_loss: 1.0313, test_f1: 0.4955
 epoch: 23, train_loss: 0.9400, test_loss: 0.9709, test_f1: 0.4967
 epoch: 24, train_loss: 0.9416, test_loss: 0.9618, test_f1: 0.4946
 epoch: 25, train_loss: 0.9247, test_loss: 0.9880, test_f1: 0.5216
 epoch: 26, train_loss: 0.9337, test_loss: 0.9889, test_f1: 0.4805
 epoch: 27, train_loss: 0.9316, test_loss: 1.0193, test_f1: 0.5252
 epoch: 28, train_loss: 0.9240, test_loss: 1.0049, test_f1: 0.5089
 epoch: 29, train_loss: 0.9128, test_loss: 1.0028, test_f1: 0.5145
 epoch: 30, train_loss: 0.9249, test_loss: 1.0086, test_f1: 0.4901
 epoch: 31, train_loss: 0.9209, test_loss: 0.9823, test_f1: 0.5078
 epoch: 32, train_loss: 0.9115, test_loss: 0.9851, test_f1: 0.5000
 epoch: 33, train_loss: 0.9171, test_loss: 0.9900, test_f1: 0.5110
 epoch: 34, train_loss: 0.9104, test_loss: 0.9990, test_f1: 0.5036
 epoch: 35, train_loss: 0.9138, test_loss: 1.0184, test_f1: 0.5262
 epoch: 36, train_loss: 0.9157, test_loss: 1.0063, test_f1: 0.5340
 epoch: 37, train_loss: 0.9116, test_loss: 1.0076, test_f1: 0.5123
 epoch: 38, train_loss: 0.9062, test_loss: 0.9806, test_f1: 0.5097
 epoch: 39, train_loss: 0.9034, test_loss: 0.9469, test_f1: 0.5051
 epoch: 40, train_loss: 0.9110, test_loss: 1.0042, test_f1: 0.5359
 epoch: 41, train_loss: 0.9107, test_loss: 1.0055, test_f1: 0.5171
 epoch: 42, train_loss: 0.9087, test_loss: 0.9697, test_f1: 0.5231
 epoch: 43, train_loss: 0.8886, test_loss: 0.9664, test_f1: 0.5115
 epoch: 44, train_loss: 0.8912, test_loss: 0.9779, test_f1: 0.5146
 epoch: 45, train_loss: 0.8806, test_loss: 0.9814, test_f1: 0.5296
 epoch: 46, train_loss: 0.8917, test_loss: 1.0099, test_f1: 0.5090
 epoch: 47, train_loss: 0.8915, test_loss: 1.0171, test_f1: 0.5362
 epoch: 48, train_loss: 0.8912, test_loss: 1.0191, test_f1: 0.4969
 epoch: 49, train_loss: 0.8877, test_loss: 0.9707, test_f1: 0.5120
 epoch: 50, train_loss: 0.8702, test_loss: 1.0038, test_f1: 0.5257
 epoch: 51, train_loss: 0.8761, test_loss: 0.9741, test_f1: 0.5283
 epoch: 52, train_loss: 0.8793, test_loss: 0.9836, test_f1: 0.5176
 epoch: 53, train_loss: 0.8706, test_loss: 0.9765, test_f1: 0.5226
 epoch: 54, train_loss: 0.8758, test_loss: 0.9610, test_f1: 0.5217
 epoch: 55, train_loss: 0.8724, test_loss: 0.9645, test_f1: 0.5223
 epoch: 56, train_loss: 0.8746, test_loss: 0.9899, test_f1: 0.5166
 epoch: 57, train_loss: 0.8635, test_loss: 0.9849, test_f1: 0.5274
 epoch: 58, train_loss: 0.8676, test_loss: 0.9953, test_f1: 0.5297
 epoch: 59, train_loss: 0.8655, test_loss: 0.9992, test_f1: 0.5257
 epoch: 60, train_loss: 0.8541, test_loss: 0.9572, test_f1: 0.5370
 epoch: 61, train_loss: 0.8669, test_loss: 0.9793, test_f1: 0.5334
 epoch: 62, train_loss: 0.8673, test_loss: 0.9922, test_f1: 0.5127
 epoch: 63, train_loss: 0.8678, test_loss: 0.9613, test_f1: 0.5270
 epoch: 64, train_loss: 0.8566, test_loss: 0.9689, test_f1: 0.5267
 epoch: 65, train_loss: 0.8657, test_loss: 0.9766, test_f1: 0.5196
 epoch: 66, train_loss: 0.8663, test_loss: 0.9909, test_f1: 0.5197
 epoch: 67, train_loss: 0.8625, test_loss: 0.9679, test_f1: 0.5297
 epoch: 68, train_loss: 0.8551, test_loss: 0.9718, test_f1: 0.5235
 epoch: 69, train_loss: 0.8592, test_loss: 0.9687, test_f1: 0.5256
 epoch: 70, train_loss: 0.8606, test_loss: 0.9692, test_f1: 0.5248
 epoch: 71, train_loss: 0.8595, test_loss: 0.9509, test_f1: 0.5177
 epoch: 72, train_loss: 0.8541, test_loss: 0.9603, test_f1: 0.5219
 epoch: 73, train_loss: 0.8592, test_loss: 0.9973, test_f1: 0.5166
 epoch: 74, train_loss: 0.8684, test_loss: 0.9595, test_f1: 0.5233
 epoch: 75, train_loss: 0.8481, test_loss: 0.9597, test_f1: 0.5293
 epoch: 76, train_loss: 0.8586, test_loss: 0.9909, test_f1: 0.5095
 epoch: 77, train_loss: 0.8585, test_loss: 0.9733, test_f1: 0.5302
 epoch: 78, train_loss: 0.8517, test_loss: 0.9568, test_f1: 0.5193
 epoch: 79, train_loss: 0.8581, test_loss: 0.9786, test_f1: 0.5302
 epoch: 80, train_loss: 0.8454, test_loss: 0.9849, test_f1: 0.5278
 epoch: 81, train_loss: 0.8618, test_loss: 1.0021, test_f1: 0.5157
 epoch: 82, train_loss: 0.8504, test_loss: 0.9867, test_f1: 0.5066
 epoch: 83, train_loss: 0.8504, test_loss: 0.9687, test_f1: 0.5174
 epoch: 84, train_loss: 0.8560, test_loss: 0.9588, test_f1: 0.5172
 epoch: 85, train_loss: 0.8324, test_loss: 0.9629, test_f1: 0.5142
 epoch: 86, train_loss: 0.8561, test_loss: 0.9684, test_f1: 0.5399
 epoch: 87, train_loss: 0.8490, test_loss: 0.9785, test_f1: 0.5368
 epoch: 88, train_loss: 0.8454, test_loss: 0.9764, test_f1: 0.5089
 epoch: 89, train_loss: 0.8480, test_loss: 0.9634, test_f1: 0.5435
 epoch: 90, train_loss: 0.8461, test_loss: 0.9779, test_f1: 0.5340
 epoch: 91, train_loss: 0.8519, test_loss: 0.9582, test_f1: 0.5300
 epoch: 92, train_loss: 0.8537, test_loss: 0.9852, test_f1: 0.5269
 epoch: 93, train_loss: 0.8541, test_loss: 0.9730, test_f1: 0.5385
 epoch: 94, train_loss: 0.8473, test_loss: 0.9808, test_f1: 0.5252
 epoch: 95, train_loss: 0.8492, test_loss: 0.9722, test_f1: 0.5339
 epoch: 96, train_loss: 0.8351, test_loss: 0.9642, test_f1: 0.5315
 epoch: 97, train_loss: 0.8456, test_loss: 0.9730, test_f1: 0.5220
 epoch: 98, train_loss: 0.8597, test_loss: 0.9650, test_f1: 0.5281
 epoch: 99, train_loss: 0.8368, test_loss: 0.9677, test_f1: 0.5209
##################ITERATION #2 ****************************************
 epoch: 0, train_loss: 1.2200, test_loss: 1.1029, test_f1: 0.4191
 epoch: 1, train_loss: 1.1283, test_loss: 1.0655, test_f1: 0.3878
 epoch: 2, train_loss: 1.0905, test_loss: 1.0392, test_f1: 0.4107
 epoch: 3, train_loss: 1.0662, test_loss: 1.0277, test_f1: 0.4390
 epoch: 4, train_loss: 1.0380, test_loss: 1.0128, test_f1: 0.4587
 epoch: 5, train_loss: 1.0217, test_loss: 0.9921, test_f1: 0.4505
 epoch: 6, train_loss: 1.0080, test_loss: 0.9767, test_f1: 0.4920
 epoch: 7, train_loss: 0.9865, test_loss: 0.9760, test_f1: 0.4723
 epoch: 8, train_loss: 0.9898, test_loss: 0.9640, test_f1: 0.4898
 epoch: 9, train_loss: 0.9801, test_loss: 0.9519, test_f1: 0.5055
 epoch: 10, train_loss: 0.9767, test_loss: 0.9400, test_f1: 0.4957
 epoch: 11, train_loss: 0.9603, test_loss: 0.9383, test_f1: 0.5044
 epoch: 12, train_loss: 0.9498, test_loss: 0.9185, test_f1: 0.5122
 epoch: 13, train_loss: 0.9542, test_loss: 0.9258, test_f1: 0.5192
 epoch: 14, train_loss: 0.9481, test_loss: 0.9097, test_f1: 0.5254
 epoch: 15, train_loss: 0.9329, test_loss: 0.9348, test_f1: 0.5341
 epoch: 16, train_loss: 0.9509, test_loss: 0.9342, test_f1: 0.5422
 epoch: 17, train_loss: 0.9413, test_loss: 0.9553, test_f1: 0.5091
 epoch: 18, train_loss: 0.9429, test_loss: 0.9089, test_f1: 0.5145
 epoch: 19, train_loss: 0.9212, test_loss: 0.9334, test_f1: 0.5273
 epoch: 20, train_loss: 0.9202, test_loss: 0.9125, test_f1: 0.5353
 epoch: 21, train_loss: 0.9236, test_loss: 0.9363, test_f1: 0.5347
 epoch: 22, train_loss: 0.9118, test_loss: 0.9036, test_f1: 0.5361
 epoch: 23, train_loss: 0.9106, test_loss: 0.9023, test_f1: 0.5179
 epoch: 24, train_loss: 0.9205, test_loss: 0.9115, test_f1: 0.5333
 epoch: 25, train_loss: 0.9153, test_loss: 0.9250, test_f1: 0.5427
 epoch: 26, train_loss: 0.9056, test_loss: 0.9479, test_f1: 0.4786
 epoch: 27, train_loss: 0.9267, test_loss: 0.8898, test_f1: 0.5378
 epoch: 28, train_loss: 0.9024, test_loss: 0.9245, test_f1: 0.5105
 epoch: 29, train_loss: 0.9094, test_loss: 0.9097, test_f1: 0.5144
 epoch: 30, train_loss: 0.8961, test_loss: 0.9335, test_f1: 0.5305
 epoch: 31, train_loss: 0.9003, test_loss: 0.9007, test_f1: 0.5369
 epoch: 32, train_loss: 0.8967, test_loss: 0.8786, test_f1: 0.5354
 epoch: 33, train_loss: 0.8909, test_loss: 0.9981, test_f1: 0.4833
 epoch: 34, train_loss: 0.8996, test_loss: 0.8752, test_f1: 0.5358
 epoch: 35, train_loss: 0.8828, test_loss: 0.9401, test_f1: 0.5216
 epoch: 36, train_loss: 0.8861, test_loss: 0.8952, test_f1: 0.5398
 epoch: 37, train_loss: 0.8807, test_loss: 0.8853, test_f1: 0.5242
 epoch: 38, train_loss: 0.8902, test_loss: 0.8521, test_f1: 0.5521
 epoch: 39, train_loss: 0.8770, test_loss: 0.9101, test_f1: 0.5329
 epoch: 40, train_loss: 0.8708, test_loss: 0.9348, test_f1: 0.5223
 epoch: 41, train_loss: 0.8773, test_loss: 0.8823, test_f1: 0.5431
 epoch: 42, train_loss: 0.8799, test_loss: 0.8868, test_f1: 0.5336
 epoch: 43, train_loss: 0.8891, test_loss: 0.9159, test_f1: 0.5487
 epoch: 44, train_loss: 0.8707, test_loss: 0.8785, test_f1: 0.5506
 epoch: 45, train_loss: 0.8777, test_loss: 0.8677, test_f1: 0.5484
 epoch: 46, train_loss: 0.8672, test_loss: 0.9253, test_f1: 0.5256
 epoch: 47, train_loss: 0.8749, test_loss: 0.8714, test_f1: 0.5557
 epoch: 48, train_loss: 0.8741, test_loss: 0.9017, test_f1: 0.5402
 epoch: 49, train_loss: 0.8605, test_loss: 0.8697, test_f1: 0.5580
 epoch: 50, train_loss: 0.8578, test_loss: 0.8993, test_f1: 0.5418
 epoch: 51, train_loss: 0.8567, test_loss: 0.8851, test_f1: 0.5499
 epoch: 52, train_loss: 0.8467, test_loss: 0.8723, test_f1: 0.5474
 epoch: 53, train_loss: 0.8495, test_loss: 0.8897, test_f1: 0.5568
 epoch: 54, train_loss: 0.8488, test_loss: 0.9213, test_f1: 0.5534
 epoch: 55, train_loss: 0.8422, test_loss: 0.9075, test_f1: 0.5523
 epoch: 56, train_loss: 0.8465, test_loss: 0.8946, test_f1: 0.5520
 epoch: 57, train_loss: 0.8386, test_loss: 0.8907, test_f1: 0.5570
 epoch: 58, train_loss: 0.8435, test_loss: 0.9071, test_f1: 0.5501
 epoch: 59, train_loss: 0.8410, test_loss: 0.9072, test_f1: 0.5611
 epoch: 60, train_loss: 0.8490, test_loss: 0.8970, test_f1: 0.5513
 epoch: 61, train_loss: 0.8397, test_loss: 0.8993, test_f1: 0.5440
 epoch: 62, train_loss: 0.8460, test_loss: 0.8988, test_f1: 0.5533
 epoch: 63, train_loss: 0.8355, test_loss: 0.8915, test_f1: 0.5566
 epoch: 64, train_loss: 0.8302, test_loss: 0.9181, test_f1: 0.5477
 epoch: 65, train_loss: 0.8394, test_loss: 0.9238, test_f1: 0.5536
 epoch: 66, train_loss: 0.8408, test_loss: 0.8940, test_f1: 0.5405
 epoch: 67, train_loss: 0.8315, test_loss: 0.9027, test_f1: 0.5444
 epoch: 68, train_loss: 0.8314, test_loss: 0.9040, test_f1: 0.5537
 epoch: 69, train_loss: 0.8198, test_loss: 0.9301, test_f1: 0.5571
 epoch: 70, train_loss: 0.8415, test_loss: 0.8762, test_f1: 0.5524
 epoch: 71, train_loss: 0.8339, test_loss: 0.8995, test_f1: 0.5484
 epoch: 72, train_loss: 0.8316, test_loss: 0.9216, test_f1: 0.5427
 epoch: 73, train_loss: 0.8355, test_loss: 0.9157, test_f1: 0.5558
 epoch: 74, train_loss: 0.8189, test_loss: 0.9167, test_f1: 0.5446
 epoch: 75, train_loss: 0.8475, test_loss: 0.9018, test_f1: 0.5593
 epoch: 76, train_loss: 0.8308, test_loss: 0.8872, test_f1: 0.5583
 epoch: 77, train_loss: 0.8293, test_loss: 0.8958, test_f1: 0.5533
 epoch: 78, train_loss: 0.8306, test_loss: 0.8822, test_f1: 0.5594
 epoch: 79, train_loss: 0.8253, test_loss: 0.8868, test_f1: 0.5502
 epoch: 80, train_loss: 0.8212, test_loss: 0.9120, test_f1: 0.5493
 epoch: 81, train_loss: 0.8176, test_loss: 0.9117, test_f1: 0.5480
 epoch: 82, train_loss: 0.8288, test_loss: 0.9210, test_f1: 0.5526
 epoch: 83, train_loss: 0.8212, test_loss: 0.9177, test_f1: 0.5514
 epoch: 84, train_loss: 0.8266, test_loss: 0.9375, test_f1: 0.5449
 epoch: 85, train_loss: 0.8181, test_loss: 0.9138, test_f1: 0.5537
 epoch: 86, train_loss: 0.8129, test_loss: 0.8781, test_f1: 0.5632
 epoch: 87, train_loss: 0.8276, test_loss: 0.9029, test_f1: 0.5549
 epoch: 88, train_loss: 0.8274, test_loss: 0.9199, test_f1: 0.5548
 epoch: 89, train_loss: 0.8173, test_loss: 0.9339, test_f1: 0.5566
 epoch: 90, train_loss: 0.8184, test_loss: 0.9382, test_f1: 0.5551
 epoch: 91, train_loss: 0.8123, test_loss: 0.9474, test_f1: 0.5501
 epoch: 92, train_loss: 0.8089, test_loss: 0.9081, test_f1: 0.5521
 epoch: 93, train_loss: 0.8159, test_loss: 0.9167, test_f1: 0.5534
 epoch: 94, train_loss: 0.8187, test_loss: 0.9077, test_f1: 0.5513
 epoch: 95, train_loss: 0.8214, test_loss: 0.9068, test_f1: 0.5602
 epoch: 96, train_loss: 0.8249, test_loss: 0.9164, test_f1: 0.5571
 epoch: 97, train_loss: 0.8112, test_loss: 0.9380, test_f1: 0.5469
 epoch: 98, train_loss: 0.8090, test_loss: 0.9112, test_f1: 0.5544
 epoch: 99, train_loss: 0.8153, test_loss: 0.9342, test_f1: 0.5531
##################ITERATION #3 ****************************************
 epoch: 0, train_loss: 1.2439, test_loss: 1.1131, test_f1: 0.3379
 epoch: 1, train_loss: 1.1402, test_loss: 1.0490, test_f1: 0.4394
 epoch: 2, train_loss: 1.0991, test_loss: 0.9987, test_f1: 0.4835
 epoch: 3, train_loss: 1.0664, test_loss: 0.9881, test_f1: 0.4833
 epoch: 4, train_loss: 1.0473, test_loss: 0.9997, test_f1: 0.4535
 epoch: 5, train_loss: 1.0265, test_loss: 0.9679, test_f1: 0.4647
 epoch: 6, train_loss: 1.0195, test_loss: 0.9624, test_f1: 0.4679
 epoch: 7, train_loss: 1.0037, test_loss: 0.9636, test_f1: 0.4868
 epoch: 8, train_loss: 0.9993, test_loss: 0.9605, test_f1: 0.4863
 epoch: 9, train_loss: 0.9795, test_loss: 0.9548, test_f1: 0.4905
 epoch: 10, train_loss: 0.9748, test_loss: 0.9436, test_f1: 0.4911
 epoch: 11, train_loss: 0.9768, test_loss: 0.9377, test_f1: 0.4892
 epoch: 12, train_loss: 0.9824, test_loss: 0.9546, test_f1: 0.4776
 epoch: 13, train_loss: 0.9590, test_loss: 0.9586, test_f1: 0.4919
 epoch: 14, train_loss: 0.9583, test_loss: 0.9514, test_f1: 0.4944
 epoch: 15, train_loss: 0.9513, test_loss: 1.0005, test_f1: 0.4655
 epoch: 16, train_loss: 0.9414, test_loss: 0.9776, test_f1: 0.4927
 epoch: 17, train_loss: 0.9540, test_loss: 1.0488, test_f1: 0.4793
 epoch: 18, train_loss: 0.9435, test_loss: 0.9704, test_f1: 0.5120
 epoch: 19, train_loss: 0.9500, test_loss: 0.9726, test_f1: 0.4870
 epoch: 20, train_loss: 0.9348, test_loss: 1.0343, test_f1: 0.4820
 epoch: 21, train_loss: 0.9390, test_loss: 0.9618, test_f1: 0.5096
 epoch: 22, train_loss: 0.9326, test_loss: 0.9586, test_f1: 0.5023
 epoch: 23, train_loss: 0.9346, test_loss: 0.9471, test_f1: 0.4824
 epoch: 24, train_loss: 0.9381, test_loss: 0.9528, test_f1: 0.4781
 epoch: 25, train_loss: 0.9237, test_loss: 1.0240, test_f1: 0.4655
 epoch: 26, train_loss: 0.9255, test_loss: 0.9736, test_f1: 0.5105
 epoch: 27, train_loss: 0.9267, test_loss: 0.9414, test_f1: 0.5096
 epoch: 28, train_loss: 0.9327, test_loss: 0.9607, test_f1: 0.5034
 epoch: 29, train_loss: 0.9273, test_loss: 0.9562, test_f1: 0.5124
 epoch: 30, train_loss: 0.9228, test_loss: 0.9382, test_f1: 0.5070
 epoch: 31, train_loss: 0.9244, test_loss: 0.9631, test_f1: 0.5111
 epoch: 32, train_loss: 0.9141, test_loss: 0.9748, test_f1: 0.4937
 epoch: 33, train_loss: 0.9171, test_loss: 0.9235, test_f1: 0.5089
 epoch: 34, train_loss: 0.9156, test_loss: 0.9964, test_f1: 0.4966
 epoch: 35, train_loss: 0.9133, test_loss: 0.9340, test_f1: 0.5199
 epoch: 36, train_loss: 0.9156, test_loss: 0.9512, test_f1: 0.5202
 epoch: 37, train_loss: 0.9123, test_loss: 0.9552, test_f1: 0.5131
 epoch: 38, train_loss: 0.9120, test_loss: 0.9489, test_f1: 0.5077
 epoch: 39, train_loss: 0.8997, test_loss: 0.9631, test_f1: 0.5120
 epoch: 40, train_loss: 0.9203, test_loss: 0.9624, test_f1: 0.4982
 epoch: 41, train_loss: 0.9106, test_loss: 1.0011, test_f1: 0.4961
 epoch: 42, train_loss: 0.9049, test_loss: 0.9670, test_f1: 0.5023
 epoch: 43, train_loss: 0.9066, test_loss: 1.0091, test_f1: 0.4870
 epoch: 44, train_loss: 0.9026, test_loss: 0.9668, test_f1: 0.4970
 epoch: 45, train_loss: 0.9036, test_loss: 0.9708, test_f1: 0.5174
 epoch: 46, train_loss: 0.9030, test_loss: 0.9849, test_f1: 0.4873
 epoch: 47, train_loss: 0.8998, test_loss: 0.9768, test_f1: 0.4960
 epoch: 48, train_loss: 0.8932, test_loss: 0.9494, test_f1: 0.5050
 epoch: 49, train_loss: 0.9040, test_loss: 0.9712, test_f1: 0.4956
 epoch: 50, train_loss: 0.8970, test_loss: 0.9920, test_f1: 0.4997
 epoch: 51, train_loss: 0.8892, test_loss: 0.9702, test_f1: 0.5110
 epoch: 52, train_loss: 0.8910, test_loss: 1.0035, test_f1: 0.4961
 epoch: 53, train_loss: 0.8896, test_loss: 0.9679, test_f1: 0.5077
 epoch: 54, train_loss: 0.8850, test_loss: 0.9769, test_f1: 0.4980
 epoch: 55, train_loss: 0.8820, test_loss: 0.9635, test_f1: 0.5072
 epoch: 56, train_loss: 0.8737, test_loss: 0.9725, test_f1: 0.5155
 epoch: 57, train_loss: 0.8849, test_loss: 0.9786, test_f1: 0.5301
 epoch: 58, train_loss: 0.8752, test_loss: 0.9985, test_f1: 0.4938
 epoch: 59, train_loss: 0.8806, test_loss: 0.9697, test_f1: 0.5103
 epoch: 60, train_loss: 0.8811, test_loss: 0.9671, test_f1: 0.5072
 epoch: 61, train_loss: 0.8849, test_loss: 0.9755, test_f1: 0.4964
 epoch: 62, train_loss: 0.8773, test_loss: 0.9804, test_f1: 0.5050
 epoch: 63, train_loss: 0.8733, test_loss: 0.9670, test_f1: 0.5109
 epoch: 64, train_loss: 0.8870, test_loss: 0.9587, test_f1: 0.5187
 epoch: 65, train_loss: 0.8754, test_loss: 0.9748, test_f1: 0.5047
 epoch: 66, train_loss: 0.8725, test_loss: 0.9736, test_f1: 0.5152
 epoch: 67, train_loss: 0.8711, test_loss: 0.9627, test_f1: 0.5030
 epoch: 68, train_loss: 0.8758, test_loss: 1.0026, test_f1: 0.4934
 epoch: 69, train_loss: 0.8806, test_loss: 1.0080, test_f1: 0.5011
 epoch: 70, train_loss: 0.8718, test_loss: 0.9702, test_f1: 0.5124
 epoch: 71, train_loss: 0.8711, test_loss: 0.9632, test_f1: 0.5082
 epoch: 72, train_loss: 0.8699, test_loss: 0.9580, test_f1: 0.5163
 epoch: 73, train_loss: 0.8676, test_loss: 0.9783, test_f1: 0.5113
 epoch: 74, train_loss: 0.8757, test_loss: 0.9610, test_f1: 0.5250
 epoch: 75, train_loss: 0.8729, test_loss: 0.9531, test_f1: 0.5274
 epoch: 76, train_loss: 0.8720, test_loss: 0.9804, test_f1: 0.5060
 epoch: 77, train_loss: 0.8701, test_loss: 0.9717, test_f1: 0.4964
 epoch: 78, train_loss: 0.8772, test_loss: 0.9935, test_f1: 0.4908
 epoch: 79, train_loss: 0.8712, test_loss: 0.9817, test_f1: 0.5041
 epoch: 80, train_loss: 0.8674, test_loss: 0.9842, test_f1: 0.5036
 epoch: 81, train_loss: 0.8745, test_loss: 0.9558, test_f1: 0.5144
 epoch: 82, train_loss: 0.8771, test_loss: 0.9525, test_f1: 0.5141
 epoch: 83, train_loss: 0.8702, test_loss: 0.9822, test_f1: 0.4942
 epoch: 84, train_loss: 0.8736, test_loss: 0.9929, test_f1: 0.4975
 epoch: 85, train_loss: 0.8641, test_loss: 1.0013, test_f1: 0.5060
 epoch: 86, train_loss: 0.8643, test_loss: 0.9855, test_f1: 0.5194
 epoch: 87, train_loss: 0.8568, test_loss: 0.9745, test_f1: 0.4982
 epoch: 88, train_loss: 0.8699, test_loss: 0.9984, test_f1: 0.5116
 epoch: 89, train_loss: 0.8596, test_loss: 0.9906, test_f1: 0.5090
 epoch: 90, train_loss: 0.8693, test_loss: 1.0134, test_f1: 0.5013
 epoch: 91, train_loss: 0.8607, test_loss: 0.9152, test_f1: 0.5181
 epoch: 92, train_loss: 0.8606, test_loss: 0.9735, test_f1: 0.5066
 epoch: 93, train_loss: 0.8692, test_loss: 0.9529, test_f1: 0.5179
 epoch: 94, train_loss: 0.8626, test_loss: 0.9746, test_f1: 0.5098
 epoch: 95, train_loss: 0.8639, test_loss: 0.9732, test_f1: 0.5057
 epoch: 96, train_loss: 0.8662, test_loss: 0.9793, test_f1: 0.5174
 epoch: 97, train_loss: 0.8655, test_loss: 1.0315, test_f1: 0.5000
 epoch: 98, train_loss: 0.8551, test_loss: 0.9714, test_f1: 0.5165
 epoch: 99, train_loss: 0.8573, test_loss: 0.9964, test_f1: 0.5092
##################ITERATION #4 ****************************************
 epoch: 0, train_loss: 1.2603, test_loss: 1.1014, test_f1: 0.3650
 epoch: 1, train_loss: 1.1458, test_loss: 1.0590, test_f1: 0.4019
 epoch: 2, train_loss: 1.1074, test_loss: 1.0488, test_f1: 0.4126
 epoch: 3, train_loss: 1.0845, test_loss: 1.0273, test_f1: 0.4521
 epoch: 4, train_loss: 1.0557, test_loss: 1.0150, test_f1: 0.4550
 epoch: 5, train_loss: 1.0428, test_loss: 1.0123, test_f1: 0.4513
 epoch: 6, train_loss: 1.0336, test_loss: 1.0250, test_f1: 0.4528
 epoch: 7, train_loss: 1.0167, test_loss: 0.9944, test_f1: 0.4695
 epoch: 8, train_loss: 1.0089, test_loss: 0.9858, test_f1: 0.4665
 epoch: 9, train_loss: 1.0077, test_loss: 0.9936, test_f1: 0.4449
 epoch: 10, train_loss: 0.9908, test_loss: 1.0061, test_f1: 0.4810
 epoch: 11, train_loss: 0.9886, test_loss: 0.9872, test_f1: 0.4631
 epoch: 12, train_loss: 0.9861, test_loss: 0.9871, test_f1: 0.4865
 epoch: 13, train_loss: 0.9883, test_loss: 0.9741, test_f1: 0.4602
 epoch: 14, train_loss: 0.9712, test_loss: 1.0047, test_f1: 0.4774
 epoch: 15, train_loss: 0.9707, test_loss: 1.0193, test_f1: 0.4487
 epoch: 16, train_loss: 0.9614, test_loss: 0.9704, test_f1: 0.4684
 epoch: 17, train_loss: 0.9585, test_loss: 0.9952, test_f1: 0.4709
 epoch: 18, train_loss: 0.9600, test_loss: 0.9978, test_f1: 0.4880
 epoch: 19, train_loss: 0.9532, test_loss: 0.9887, test_f1: 0.4804
 epoch: 20, train_loss: 0.9546, test_loss: 1.0166, test_f1: 0.4762
 epoch: 21, train_loss: 0.9385, test_loss: 0.9908, test_f1: 0.4990
 epoch: 22, train_loss: 0.9423, test_loss: 1.0159, test_f1: 0.4831
 epoch: 23, train_loss: 0.9380, test_loss: 1.0074, test_f1: 0.4975
 epoch: 24, train_loss: 0.9302, test_loss: 0.9787, test_f1: 0.4982
 epoch: 25, train_loss: 0.9338, test_loss: 0.9870, test_f1: 0.4974
 epoch: 26, train_loss: 0.9241, test_loss: 0.9938, test_f1: 0.4953
 epoch: 27, train_loss: 0.9292, test_loss: 0.9887, test_f1: 0.4951
 epoch: 28, train_loss: 0.9276, test_loss: 0.9898, test_f1: 0.4999
 epoch: 29, train_loss: 0.9177, test_loss: 0.9811, test_f1: 0.5108
 epoch: 30, train_loss: 0.9142, test_loss: 0.9495, test_f1: 0.5321
 epoch: 31, train_loss: 0.9181, test_loss: 0.9702, test_f1: 0.5116
 epoch: 32, train_loss: 0.9288, test_loss: 0.9821, test_f1: 0.5219
 epoch: 33, train_loss: 0.9214, test_loss: 0.9949, test_f1: 0.4970
 epoch: 34, train_loss: 0.9127, test_loss: 0.9954, test_f1: 0.4886
 epoch: 35, train_loss: 0.9099, test_loss: 0.9832, test_f1: 0.4920
 epoch: 36, train_loss: 0.9151, test_loss: 0.9752, test_f1: 0.4964
 epoch: 37, train_loss: 0.9024, test_loss: 0.9567, test_f1: 0.5168
 epoch: 38, train_loss: 0.9049, test_loss: 0.9509, test_f1: 0.5335
 epoch: 39, train_loss: 0.9025, test_loss: 0.9506, test_f1: 0.5036
 epoch: 40, train_loss: 0.9015, test_loss: 0.9825, test_f1: 0.5015
 epoch: 41, train_loss: 0.9038, test_loss: 0.9505, test_f1: 0.5191
 epoch: 42, train_loss: 0.8939, test_loss: 0.9555, test_f1: 0.4974
 epoch: 43, train_loss: 0.8931, test_loss: 0.9600, test_f1: 0.4983
 epoch: 44, train_loss: 0.8938, test_loss: 0.9554, test_f1: 0.5205
 epoch: 45, train_loss: 0.8787, test_loss: 0.9505, test_f1: 0.5223
 epoch: 46, train_loss: 0.8796, test_loss: 0.9502, test_f1: 0.5171
 epoch: 47, train_loss: 0.8805, test_loss: 0.9470, test_f1: 0.5120
 epoch: 48, train_loss: 0.8783, test_loss: 0.9571, test_f1: 0.5303
 epoch: 49, train_loss: 0.8807, test_loss: 0.9749, test_f1: 0.4982
 epoch: 50, train_loss: 0.8815, test_loss: 0.9346, test_f1: 0.5172
 epoch: 51, train_loss: 0.8610, test_loss: 0.9486, test_f1: 0.5086
 epoch: 52, train_loss: 0.8701, test_loss: 0.9470, test_f1: 0.5196
 epoch: 53, train_loss: 0.8635, test_loss: 0.9230, test_f1: 0.5148
 epoch: 54, train_loss: 0.8699, test_loss: 0.9558, test_f1: 0.5183
 epoch: 55, train_loss: 0.8795, test_loss: 0.9401, test_f1: 0.5098
 epoch: 56, train_loss: 0.8582, test_loss: 0.9734, test_f1: 0.5116
 epoch: 57, train_loss: 0.8655, test_loss: 0.9307, test_f1: 0.5384
 epoch: 58, train_loss: 0.8511, test_loss: 0.9315, test_f1: 0.5307
 epoch: 59, train_loss: 0.8577, test_loss: 0.9618, test_f1: 0.5221
 epoch: 60, train_loss: 0.8537, test_loss: 0.9465, test_f1: 0.5249
 epoch: 61, train_loss: 0.8605, test_loss: 0.9491, test_f1: 0.5227
 epoch: 62, train_loss: 0.8478, test_loss: 0.9451, test_f1: 0.5239
 epoch: 63, train_loss: 0.8597, test_loss: 0.9408, test_f1: 0.5191
 epoch: 64, train_loss: 0.8590, test_loss: 0.9588, test_f1: 0.5094
 epoch: 65, train_loss: 0.8485, test_loss: 0.9433, test_f1: 0.5180
 epoch: 66, train_loss: 0.8576, test_loss: 0.9274, test_f1: 0.5348
 epoch: 67, train_loss: 0.8578, test_loss: 0.9561, test_f1: 0.5190
 epoch: 68, train_loss: 0.8534, test_loss: 0.9552, test_f1: 0.5264
 epoch: 69, train_loss: 0.8468, test_loss: 0.9357, test_f1: 0.5283
 epoch: 70, train_loss: 0.8482, test_loss: 0.9212, test_f1: 0.5420
 epoch: 71, train_loss: 0.8526, test_loss: 0.9344, test_f1: 0.5219
 epoch: 72, train_loss: 0.8510, test_loss: 0.9196, test_f1: 0.5320
 epoch: 73, train_loss: 0.8466, test_loss: 0.9463, test_f1: 0.5272
 epoch: 74, train_loss: 0.8454, test_loss: 0.9291, test_f1: 0.5336
 epoch: 75, train_loss: 0.8485, test_loss: 0.9294, test_f1: 0.5313
 epoch: 76, train_loss: 0.8311, test_loss: 0.9457, test_f1: 0.5220
 epoch: 77, train_loss: 0.8397, test_loss: 0.9446, test_f1: 0.5207
 epoch: 78, train_loss: 0.8364, test_loss: 0.9414, test_f1: 0.5264
 epoch: 79, train_loss: 0.8447, test_loss: 0.9425, test_f1: 0.5250
 epoch: 80, train_loss: 0.8357, test_loss: 0.9271, test_f1: 0.5331
 epoch: 81, train_loss: 0.8310, test_loss: 0.9327, test_f1: 0.5315
 epoch: 82, train_loss: 0.8274, test_loss: 0.9324, test_f1: 0.5353
 epoch: 83, train_loss: 0.8275, test_loss: 0.9232, test_f1: 0.5320
 epoch: 84, train_loss: 0.8376, test_loss: 0.9516, test_f1: 0.5250
 epoch: 85, train_loss: 0.8328, test_loss: 0.9395, test_f1: 0.5391
 epoch: 86, train_loss: 0.8286, test_loss: 0.9386, test_f1: 0.5316
 epoch: 87, train_loss: 0.8366, test_loss: 0.9335, test_f1: 0.5249
 epoch: 88, train_loss: 0.8254, test_loss: 0.9394, test_f1: 0.5177
 epoch: 89, train_loss: 0.8317, test_loss: 0.9557, test_f1: 0.5271
 epoch: 90, train_loss: 0.8305, test_loss: 0.9337, test_f1: 0.5363
 epoch: 91, train_loss: 0.8249, test_loss: 0.9350, test_f1: 0.5352
 epoch: 92, train_loss: 0.8184, test_loss: 0.9531, test_f1: 0.5269
 epoch: 93, train_loss: 0.8419, test_loss: 0.9309, test_f1: 0.5358
 epoch: 94, train_loss: 0.8254, test_loss: 0.9277, test_f1: 0.5206
 epoch: 95, train_loss: 0.8298, test_loss: 0.9399, test_f1: 0.5491
 epoch: 96, train_loss: 0.8164, test_loss: 0.9226, test_f1: 0.5279
 epoch: 97, train_loss: 0.8271, test_loss: 0.9380, test_f1: 0.5144
 epoch: 98, train_loss: 0.8185, test_loss: 0.9287, test_f1: 0.5506
 epoch: 99, train_loss: 0.8217, test_loss: 0.9329, test_f1: 0.5373
##################ITERATION #5 ****************************************
 epoch: 0, train_loss: 1.3271, test_loss: 1.0917, test_f1: 0.3839
 epoch: 1, train_loss: 1.1302, test_loss: 1.0637, test_f1: 0.3918
 epoch: 2, train_loss: 1.0905, test_loss: 1.0430, test_f1: 0.4108
 epoch: 3, train_loss: 1.0628, test_loss: 1.0277, test_f1: 0.4471
 epoch: 4, train_loss: 1.0455, test_loss: 1.0412, test_f1: 0.4449
 epoch: 5, train_loss: 1.0357, test_loss: 1.0257, test_f1: 0.4594
 epoch: 6, train_loss: 1.0304, test_loss: 1.0172, test_f1: 0.4706
 epoch: 7, train_loss: 1.0095, test_loss: 1.0163, test_f1: 0.4853
 epoch: 8, train_loss: 1.0007, test_loss: 1.0159, test_f1: 0.4848
 epoch: 9, train_loss: 1.0014, test_loss: 1.0165, test_f1: 0.4844
 epoch: 10, train_loss: 0.9975, test_loss: 1.0121, test_f1: 0.4761
 epoch: 11, train_loss: 0.9896, test_loss: 1.0368, test_f1: 0.4825
 epoch: 12, train_loss: 0.9873, test_loss: 1.0205, test_f1: 0.4717
 epoch: 13, train_loss: 0.9929, test_loss: 1.0023, test_f1: 0.4862
 epoch: 14, train_loss: 0.9796, test_loss: 0.9977, test_f1: 0.5341
 epoch: 15, train_loss: 0.9816, test_loss: 0.9982, test_f1: 0.4780
 epoch: 16, train_loss: 0.9701, test_loss: 1.0079, test_f1: 0.4980
 epoch: 17, train_loss: 0.9705, test_loss: 1.0054, test_f1: 0.4845
 epoch: 18, train_loss: 0.9608, test_loss: 1.0090, test_f1: 0.5126
 epoch: 19, train_loss: 0.9595, test_loss: 0.9945, test_f1: 0.4991
 epoch: 20, train_loss: 0.9612, test_loss: 1.0073, test_f1: 0.5049
 epoch: 21, train_loss: 0.9590, test_loss: 1.0066, test_f1: 0.4922
 epoch: 22, train_loss: 0.9484, test_loss: 1.0006, test_f1: 0.4689
 epoch: 23, train_loss: 0.9606, test_loss: 1.0155, test_f1: 0.5064
 epoch: 24, train_loss: 0.9509, test_loss: 1.0219, test_f1: 0.4658
 epoch: 25, train_loss: 0.9528, test_loss: 1.0108, test_f1: 0.4943
 epoch: 26, train_loss: 0.9490, test_loss: 0.9886, test_f1: 0.5076
 epoch: 27, train_loss: 0.9428, test_loss: 1.0012, test_f1: 0.5179
 epoch: 28, train_loss: 0.9478, test_loss: 0.9865, test_f1: 0.5073
 epoch: 29, train_loss: 0.9448, test_loss: 0.9935, test_f1: 0.4809
 epoch: 30, train_loss: 0.9415, test_loss: 0.9830, test_f1: 0.4752
 epoch: 31, train_loss: 0.9380, test_loss: 0.9947, test_f1: 0.4733
 epoch: 32, train_loss: 0.9304, test_loss: 0.9887, test_f1: 0.5001
 epoch: 33, train_loss: 0.9314, test_loss: 0.9917, test_f1: 0.4854
 epoch: 34, train_loss: 0.9331, test_loss: 0.9849, test_f1: 0.5008
 epoch: 35, train_loss: 0.9277, test_loss: 0.9846, test_f1: 0.5040
 epoch: 36, train_loss: 0.9274, test_loss: 1.0130, test_f1: 0.5229
 epoch: 37, train_loss: 0.9207, test_loss: 1.0067, test_f1: 0.5034
 epoch: 38, train_loss: 0.9173, test_loss: 1.0076, test_f1: 0.5057
 epoch: 39, train_loss: 0.9197, test_loss: 1.0031, test_f1: 0.5172
 epoch: 40, train_loss: 0.9230, test_loss: 0.9733, test_f1: 0.5187
 epoch: 41, train_loss: 0.9212, test_loss: 0.9866, test_f1: 0.5141
 epoch: 42, train_loss: 0.9153, test_loss: 1.0029, test_f1: 0.5026
 epoch: 43, train_loss: 0.9107, test_loss: 0.9842, test_f1: 0.4916
 epoch: 44, train_loss: 0.9148, test_loss: 1.0042, test_f1: 0.4941
 epoch: 45, train_loss: 0.9101, test_loss: 0.9980, test_f1: 0.5041
 epoch: 46, train_loss: 0.9023, test_loss: 1.0022, test_f1: 0.5088
 epoch: 47, train_loss: 0.9033, test_loss: 1.0004, test_f1: 0.5360
 epoch: 48, train_loss: 0.9150, test_loss: 1.0089, test_f1: 0.4885
 epoch: 49, train_loss: 0.9144, test_loss: 0.9922, test_f1: 0.4974
 epoch: 50, train_loss: 0.9047, test_loss: 0.9758, test_f1: 0.4883
 epoch: 51, train_loss: 0.8958, test_loss: 0.9900, test_f1: 0.5063
 epoch: 52, train_loss: 0.8875, test_loss: 1.0045, test_f1: 0.5138
 epoch: 53, train_loss: 0.8934, test_loss: 0.9977, test_f1: 0.5095
 epoch: 54, train_loss: 0.8807, test_loss: 0.9939, test_f1: 0.5338
 epoch: 55, train_loss: 0.8921, test_loss: 0.9999, test_f1: 0.5191
 epoch: 56, train_loss: 0.8972, test_loss: 0.9894, test_f1: 0.5177
 epoch: 57, train_loss: 0.8849, test_loss: 1.0060, test_f1: 0.5200
 epoch: 58, train_loss: 0.8862, test_loss: 0.9821, test_f1: 0.5143
 epoch: 59, train_loss: 0.8870, test_loss: 0.9845, test_f1: 0.5136
 epoch: 60, train_loss: 0.8793, test_loss: 0.9807, test_f1: 0.5181
 epoch: 61, train_loss: 0.8870, test_loss: 0.9849, test_f1: 0.5157
 epoch: 62, train_loss: 0.8743, test_loss: 0.9982, test_f1: 0.5076
 epoch: 63, train_loss: 0.8965, test_loss: 0.9815, test_f1: 0.5218
 epoch: 64, train_loss: 0.8750, test_loss: 0.9897, test_f1: 0.5272
 epoch: 65, train_loss: 0.8893, test_loss: 0.9916, test_f1: 0.5038
 epoch: 66, train_loss: 0.8830, test_loss: 0.9978, test_f1: 0.5365
 epoch: 67, train_loss: 0.8839, test_loss: 0.9930, test_f1: 0.5320
 epoch: 68, train_loss: 0.8822, test_loss: 0.9940, test_f1: 0.5116
 epoch: 69, train_loss: 0.8761, test_loss: 0.9742, test_f1: 0.5235
 epoch: 70, train_loss: 0.8804, test_loss: 0.9723, test_f1: 0.5205
 epoch: 71, train_loss: 0.8714, test_loss: 0.9804, test_f1: 0.5392
 epoch: 72, train_loss: 0.8671, test_loss: 0.9877, test_f1: 0.5291
 epoch: 73, train_loss: 0.8791, test_loss: 0.9940, test_f1: 0.5321
 epoch: 74, train_loss: 0.8741, test_loss: 0.9822, test_f1: 0.5213
 epoch: 75, train_loss: 0.8745, test_loss: 0.9842, test_f1: 0.5349
 epoch: 76, train_loss: 0.9004, test_loss: 0.9833, test_f1: 0.5118
 epoch: 77, train_loss: 0.8750, test_loss: 0.9712, test_f1: 0.5245
 epoch: 78, train_loss: 0.8745, test_loss: 0.9662, test_f1: 0.5437
 epoch: 79, train_loss: 0.8723, test_loss: 0.9736, test_f1: 0.5256
 epoch: 80, train_loss: 0.8718, test_loss: 0.9891, test_f1: 0.5266
 epoch: 81, train_loss: 0.8750, test_loss: 0.9819, test_f1: 0.4968
 epoch: 82, train_loss: 0.8725, test_loss: 0.9939, test_f1: 0.5636
 epoch: 83, train_loss: 0.8663, test_loss: 0.9963, test_f1: 0.5411
 epoch: 84, train_loss: 0.8831, test_loss: 0.9850, test_f1: 0.5198
 epoch: 85, train_loss: 0.8725, test_loss: 0.9857, test_f1: 0.4944
 epoch: 86, train_loss: 0.8654, test_loss: 0.9703, test_f1: 0.5323
 epoch: 87, train_loss: 0.8739, test_loss: 0.9736, test_f1: 0.5371
 epoch: 88, train_loss: 0.8654, test_loss: 0.9835, test_f1: 0.5383
 epoch: 89, train_loss: 0.8606, test_loss: 0.9911, test_f1: 0.5052
 epoch: 90, train_loss: 0.8644, test_loss: 0.9788, test_f1: 0.5111
 epoch: 91, train_loss: 0.8610, test_loss: 0.9828, test_f1: 0.5413
 epoch: 92, train_loss: 0.8641, test_loss: 0.9822, test_f1: 0.5251
 epoch: 93, train_loss: 0.8657, test_loss: 0.9932, test_f1: 0.5204
 epoch: 94, train_loss: 0.8597, test_loss: 0.9891, test_f1: 0.5083
 epoch: 95, train_loss: 0.8586, test_loss: 0.9758, test_f1: 0.5183
 epoch: 96, train_loss: 0.8678, test_loss: 0.9847, test_f1: 0.5238
 epoch: 97, train_loss: 0.8725, test_loss: 0.9895, test_f1: 0.5270
 epoch: 98, train_loss: 0.8540, test_loss: 0.9749, test_f1: 0.5361
 epoch: 99, train_loss: 0.8625, test_loss: 0.9870, test_f1: 0.5261
##################ITERATION #6 ****************************************
 epoch: 0, train_loss: 1.2662, test_loss: 1.1128, test_f1: 0.3640
 epoch: 1, train_loss: 1.1300, test_loss: 1.0468, test_f1: 0.3738
 epoch: 2, train_loss: 1.0890, test_loss: 1.0220, test_f1: 0.3751
 epoch: 3, train_loss: 1.0738, test_loss: 1.0530, test_f1: 0.4047
 epoch: 4, train_loss: 1.0515, test_loss: 1.0091, test_f1: 0.3830
 epoch: 5, train_loss: 1.0375, test_loss: 1.0305, test_f1: 0.4448
 epoch: 6, train_loss: 1.0178, test_loss: 1.0309, test_f1: 0.4198
 epoch: 7, train_loss: 1.0077, test_loss: 0.9957, test_f1: 0.4464
 epoch: 8, train_loss: 1.0022, test_loss: 1.0073, test_f1: 0.4401
 epoch: 9, train_loss: 1.0019, test_loss: 1.0366, test_f1: 0.4810
 epoch: 10, train_loss: 0.9853, test_loss: 1.0186, test_f1: 0.4818
 epoch: 11, train_loss: 0.9818, test_loss: 1.0257, test_f1: 0.4354
 epoch: 12, train_loss: 0.9853, test_loss: 1.0108, test_f1: 0.4900
 epoch: 13, train_loss: 0.9774, test_loss: 0.9529, test_f1: 0.4907
 epoch: 14, train_loss: 0.9710, test_loss: 1.0201, test_f1: 0.4678
 epoch: 15, train_loss: 0.9528, test_loss: 1.0174, test_f1: 0.4999
 epoch: 16, train_loss: 0.9578, test_loss: 1.0084, test_f1: 0.5176
 epoch: 17, train_loss: 0.9653, test_loss: 1.0219, test_f1: 0.4956
 epoch: 18, train_loss: 0.9488, test_loss: 0.9942, test_f1: 0.5043
 epoch: 19, train_loss: 0.9542, test_loss: 0.9928, test_f1: 0.5145
 epoch: 20, train_loss: 0.9463, test_loss: 0.9540, test_f1: 0.5022
 epoch: 21, train_loss: 0.9588, test_loss: 0.9980, test_f1: 0.5176
 epoch: 22, train_loss: 0.9443, test_loss: 0.9522, test_f1: 0.4819
 epoch: 23, train_loss: 0.9369, test_loss: 0.9203, test_f1: 0.5061
 epoch: 24, train_loss: 0.9463, test_loss: 0.9724, test_f1: 0.5176
 epoch: 25, train_loss: 0.9340, test_loss: 0.9615, test_f1: 0.5163
 epoch: 26, train_loss: 0.9338, test_loss: 0.9869, test_f1: 0.5216
 epoch: 27, train_loss: 0.9277, test_loss: 0.9686, test_f1: 0.5040
 epoch: 28, train_loss: 0.9259, test_loss: 0.9730, test_f1: 0.5098
 epoch: 29, train_loss: 0.9227, test_loss: 0.9954, test_f1: 0.4970
 epoch: 30, train_loss: 0.9208, test_loss: 1.0071, test_f1: 0.5093
 epoch: 31, train_loss: 0.9128, test_loss: 0.9756, test_f1: 0.5200
 epoch: 32, train_loss: 0.9108, test_loss: 0.9442, test_f1: 0.5045
 epoch: 33, train_loss: 0.9125, test_loss: 1.0101, test_f1: 0.4886
 epoch: 34, train_loss: 0.9065, test_loss: 0.9847, test_f1: 0.4885
 epoch: 35, train_loss: 0.9103, test_loss: 0.9298, test_f1: 0.5221
 epoch: 36, train_loss: 0.9006, test_loss: 0.9122, test_f1: 0.4854
 epoch: 37, train_loss: 0.9011, test_loss: 0.9731, test_f1: 0.5185
 epoch: 38, train_loss: 0.9134, test_loss: 0.9795, test_f1: 0.4879
 epoch: 39, train_loss: 0.8974, test_loss: 0.9466, test_f1: 0.5049
 epoch: 40, train_loss: 0.8997, test_loss: 0.9814, test_f1: 0.5066
 epoch: 41, train_loss: 0.8841, test_loss: 0.9565, test_f1: 0.5093
 epoch: 42, train_loss: 0.8858, test_loss: 0.9360, test_f1: 0.5013
 epoch: 43, train_loss: 0.8783, test_loss: 0.9385, test_f1: 0.4976
 epoch: 44, train_loss: 0.8900, test_loss: 0.9634, test_f1: 0.4942
 epoch: 45, train_loss: 0.8832, test_loss: 0.9242, test_f1: 0.5267
 epoch: 46, train_loss: 0.8798, test_loss: 0.9160, test_f1: 0.5266
 epoch: 47, train_loss: 0.8717, test_loss: 0.8925, test_f1: 0.5037
 epoch: 48, train_loss: 0.8752, test_loss: 0.9246, test_f1: 0.5253
 epoch: 49, train_loss: 0.8815, test_loss: 0.9247, test_f1: 0.5150
 epoch: 50, train_loss: 0.8728, test_loss: 0.9647, test_f1: 0.5067
 epoch: 51, train_loss: 0.8682, test_loss: 0.9571, test_f1: 0.5160
 epoch: 52, train_loss: 0.8593, test_loss: 0.9480, test_f1: 0.5192
 epoch: 53, train_loss: 0.8563, test_loss: 0.9120, test_f1: 0.5295
 epoch: 54, train_loss: 0.8633, test_loss: 0.9002, test_f1: 0.5223
 epoch: 55, train_loss: 0.8584, test_loss: 0.8984, test_f1: 0.5063
 epoch: 56, train_loss: 0.8520, test_loss: 0.9438, test_f1: 0.5199
 epoch: 57, train_loss: 0.8598, test_loss: 0.9041, test_f1: 0.5163
 epoch: 58, train_loss: 0.8539, test_loss: 0.9501, test_f1: 0.5249
 epoch: 59, train_loss: 0.8419, test_loss: 0.9388, test_f1: 0.5311
 epoch: 60, train_loss: 0.8516, test_loss: 0.9277, test_f1: 0.5258
 epoch: 61, train_loss: 0.8493, test_loss: 0.9310, test_f1: 0.5255
 epoch: 62, train_loss: 0.8447, test_loss: 0.8841, test_f1: 0.5311
 epoch: 63, train_loss: 0.8471, test_loss: 0.9150, test_f1: 0.5146
 epoch: 64, train_loss: 0.8469, test_loss: 0.8994, test_f1: 0.5273
 epoch: 65, train_loss: 0.8467, test_loss: 0.8757, test_f1: 0.5293
 epoch: 66, train_loss: 0.8421, test_loss: 0.9111, test_f1: 0.5226
 epoch: 67, train_loss: 0.8442, test_loss: 0.9233, test_f1: 0.5355
 epoch: 68, train_loss: 0.8559, test_loss: 0.9495, test_f1: 0.5184
 epoch: 69, train_loss: 0.8473, test_loss: 0.9284, test_f1: 0.5309
 epoch: 70, train_loss: 0.8356, test_loss: 0.8914, test_f1: 0.5290
 epoch: 71, train_loss: 0.8487, test_loss: 0.9281, test_f1: 0.5329
 epoch: 72, train_loss: 0.8372, test_loss: 0.9187, test_f1: 0.5360
 epoch: 73, train_loss: 0.8317, test_loss: 0.9264, test_f1: 0.5290
 epoch: 74, train_loss: 0.8325, test_loss: 0.9222, test_f1: 0.5281
 epoch: 75, train_loss: 0.8282, test_loss: 0.9104, test_f1: 0.5371
 epoch: 76, train_loss: 0.8357, test_loss: 0.9176, test_f1: 0.5379
 epoch: 77, train_loss: 0.8372, test_loss: 0.9395, test_f1: 0.5223
 epoch: 78, train_loss: 0.8332, test_loss: 0.9492, test_f1: 0.5305
 epoch: 79, train_loss: 0.8272, test_loss: 0.9254, test_f1: 0.5393
 epoch: 80, train_loss: 0.8358, test_loss: 0.9046, test_f1: 0.5388
 epoch: 81, train_loss: 0.8319, test_loss: 0.9154, test_f1: 0.5336
 epoch: 82, train_loss: 0.8256, test_loss: 0.8929, test_f1: 0.5404
 epoch: 83, train_loss: 0.8291, test_loss: 0.9205, test_f1: 0.5454
 epoch: 84, train_loss: 0.8279, test_loss: 0.9161, test_f1: 0.5306
 epoch: 85, train_loss: 0.8318, test_loss: 0.9063, test_f1: 0.5202
 epoch: 86, train_loss: 0.8352, test_loss: 0.9156, test_f1: 0.5368
 epoch: 87, train_loss: 0.8127, test_loss: 0.9185, test_f1: 0.5351
 epoch: 88, train_loss: 0.8215, test_loss: 0.9429, test_f1: 0.5500
 epoch: 89, train_loss: 0.8230, test_loss: 0.9468, test_f1: 0.5360
 epoch: 90, train_loss: 0.8226, test_loss: 0.9153, test_f1: 0.5423
 epoch: 91, train_loss: 0.8257, test_loss: 0.9104, test_f1: 0.5340
 epoch: 92, train_loss: 0.8272, test_loss: 0.9254, test_f1: 0.5313
 epoch: 93, train_loss: 0.8091, test_loss: 0.9100, test_f1: 0.5390
 epoch: 94, train_loss: 0.8215, test_loss: 0.9021, test_f1: 0.5367
 epoch: 95, train_loss: 0.8175, test_loss: 0.9390, test_f1: 0.5483
 epoch: 96, train_loss: 0.8178, test_loss: 0.9333, test_f1: 0.5397
 epoch: 97, train_loss: 0.8183, test_loss: 0.9060, test_f1: 0.5405
 epoch: 98, train_loss: 0.8180, test_loss: 0.8587, test_f1: 0.5565
 epoch: 99, train_loss: 0.8252, test_loss: 0.9078, test_f1: 0.5393
##################ITERATION #7 ****************************************
 epoch: 0, train_loss: 1.2443, test_loss: 1.1005, test_f1: 0.3981
 epoch: 1, train_loss: 1.1299, test_loss: 1.0458, test_f1: 0.4183
 epoch: 2, train_loss: 1.0971, test_loss: 1.0181, test_f1: 0.4209
 epoch: 3, train_loss: 1.0676, test_loss: 1.0049, test_f1: 0.4485
 epoch: 4, train_loss: 1.0672, test_loss: 0.9975, test_f1: 0.4422
 epoch: 5, train_loss: 1.0360, test_loss: 1.0134, test_f1: 0.4724
 epoch: 6, train_loss: 1.0278, test_loss: 0.9715, test_f1: 0.4710
 epoch: 7, train_loss: 1.0101, test_loss: 0.9931, test_f1: 0.4732
 epoch: 8, train_loss: 1.0118, test_loss: 0.9868, test_f1: 0.4685
 epoch: 9, train_loss: 0.9976, test_loss: 0.9763, test_f1: 0.4874
 epoch: 10, train_loss: 0.9960, test_loss: 0.9894, test_f1: 0.4627
 epoch: 11, train_loss: 0.9794, test_loss: 0.9716, test_f1: 0.4807
 epoch: 12, train_loss: 0.9734, test_loss: 0.9669, test_f1: 0.4750
 epoch: 13, train_loss: 0.9659, test_loss: 0.9845, test_f1: 0.4851
 epoch: 14, train_loss: 0.9692, test_loss: 1.0060, test_f1: 0.4652
 epoch: 15, train_loss: 0.9626, test_loss: 0.9757, test_f1: 0.4545
 epoch: 16, train_loss: 0.9513, test_loss: 0.9946, test_f1: 0.4715
 epoch: 17, train_loss: 0.9514, test_loss: 0.9593, test_f1: 0.4583
 epoch: 18, train_loss: 0.9454, test_loss: 0.9879, test_f1: 0.4740
 epoch: 19, train_loss: 0.9341, test_loss: 0.9764, test_f1: 0.4687
 epoch: 20, train_loss: 0.9333, test_loss: 0.9725, test_f1: 0.4633
 epoch: 21, train_loss: 0.9377, test_loss: 0.9789, test_f1: 0.4705
 epoch: 22, train_loss: 0.9248, test_loss: 0.9834, test_f1: 0.4580
 epoch: 23, train_loss: 0.9368, test_loss: 0.9523, test_f1: 0.4783
 epoch: 24, train_loss: 0.9336, test_loss: 0.9800, test_f1: 0.4886
 epoch: 25, train_loss: 0.9240, test_loss: 0.9575, test_f1: 0.4854
 epoch: 26, train_loss: 0.9203, test_loss: 0.9467, test_f1: 0.4914
 epoch: 27, train_loss: 0.9142, test_loss: 0.9483, test_f1: 0.5068
 epoch: 28, train_loss: 0.9205, test_loss: 0.9511, test_f1: 0.4815
 epoch: 29, train_loss: 0.9133, test_loss: 0.9287, test_f1: 0.5042
 epoch: 30, train_loss: 0.9117, test_loss: 0.9404, test_f1: 0.5216
 epoch: 31, train_loss: 0.9183, test_loss: 0.9440, test_f1: 0.4952
 epoch: 32, train_loss: 0.9044, test_loss: 0.9307, test_f1: 0.4980
 epoch: 33, train_loss: 0.9059, test_loss: 0.9676, test_f1: 0.4803
 epoch: 34, train_loss: 0.8996, test_loss: 0.9488, test_f1: 0.4917
 epoch: 35, train_loss: 0.9085, test_loss: 0.9088, test_f1: 0.5182
 epoch: 36, train_loss: 0.8940, test_loss: 0.9544, test_f1: 0.4821
 epoch: 37, train_loss: 0.8934, test_loss: 0.9345, test_f1: 0.5124
 epoch: 38, train_loss: 0.8944, test_loss: 0.9332, test_f1: 0.5066
 epoch: 39, train_loss: 0.8934, test_loss: 0.9445, test_f1: 0.5192
 epoch: 40, train_loss: 0.8810, test_loss: 0.9220, test_f1: 0.5148
 epoch: 41, train_loss: 0.8914, test_loss: 0.9183, test_f1: 0.5117
 epoch: 42, train_loss: 0.8963, test_loss: 0.9459, test_f1: 0.5043
 epoch: 43, train_loss: 0.8797, test_loss: 0.9970, test_f1: 0.4765
 epoch: 44, train_loss: 0.8847, test_loss: 0.9330, test_f1: 0.5268
 epoch: 45, train_loss: 0.8718, test_loss: 0.9211, test_f1: 0.5200
 epoch: 46, train_loss: 0.8795, test_loss: 0.9470, test_f1: 0.5205
 epoch: 47, train_loss: 0.8763, test_loss: 0.9298, test_f1: 0.4927
 epoch: 48, train_loss: 0.8685, test_loss: 0.8938, test_f1: 0.5206
 epoch: 49, train_loss: 0.8675, test_loss: 0.9222, test_f1: 0.5133
 epoch: 50, train_loss: 0.8637, test_loss: 0.9199, test_f1: 0.5208
 epoch: 51, train_loss: 0.8582, test_loss: 0.9205, test_f1: 0.5159
 epoch: 52, train_loss: 0.8576, test_loss: 0.9153, test_f1: 0.5259
 epoch: 53, train_loss: 0.8473, test_loss: 0.9236, test_f1: 0.5235
 epoch: 54, train_loss: 0.8350, test_loss: 0.9264, test_f1: 0.5208
 epoch: 55, train_loss: 0.8571, test_loss: 0.9333, test_f1: 0.5240
 epoch: 56, train_loss: 0.8505, test_loss: 0.9237, test_f1: 0.5216
 epoch: 57, train_loss: 0.8550, test_loss: 0.9419, test_f1: 0.5124
 epoch: 58, train_loss: 0.8442, test_loss: 0.9141, test_f1: 0.5246
 epoch: 59, train_loss: 0.8504, test_loss: 0.9208, test_f1: 0.5373
 epoch: 60, train_loss: 0.8488, test_loss: 0.9285, test_f1: 0.5214
 epoch: 61, train_loss: 0.8505, test_loss: 0.9441, test_f1: 0.5266
 epoch: 62, train_loss: 0.8578, test_loss: 0.9219, test_f1: 0.5325
 epoch: 63, train_loss: 0.8510, test_loss: 0.9407, test_f1: 0.5184
 epoch: 64, train_loss: 0.8418, test_loss: 0.9340, test_f1: 0.5224
 epoch: 65, train_loss: 0.8412, test_loss: 0.9223, test_f1: 0.5321
 epoch: 66, train_loss: 0.8550, test_loss: 0.9254, test_f1: 0.5259
 epoch: 67, train_loss: 0.8544, test_loss: 0.9471, test_f1: 0.5305
 epoch: 68, train_loss: 0.8478, test_loss: 0.9454, test_f1: 0.5213
 epoch: 69, train_loss: 0.8362, test_loss: 0.9690, test_f1: 0.5025
 epoch: 70, train_loss: 0.8339, test_loss: 0.9551, test_f1: 0.5310
 epoch: 71, train_loss: 0.8277, test_loss: 0.9592, test_f1: 0.5327
 epoch: 72, train_loss: 0.8328, test_loss: 0.9182, test_f1: 0.5249
 epoch: 73, train_loss: 0.8429, test_loss: 0.9520, test_f1: 0.5347
 epoch: 74, train_loss: 0.8412, test_loss: 0.9441, test_f1: 0.5268
 epoch: 75, train_loss: 0.8420, test_loss: 0.9382, test_f1: 0.5583
 epoch: 76, train_loss: 0.8287, test_loss: 0.9380, test_f1: 0.5382
 epoch: 77, train_loss: 0.8417, test_loss: 0.9590, test_f1: 0.5335
 epoch: 78, train_loss: 0.8339, test_loss: 0.9058, test_f1: 0.5277
 epoch: 79, train_loss: 0.8407, test_loss: 0.9598, test_f1: 0.5210
 epoch: 80, train_loss: 0.8254, test_loss: 0.9262, test_f1: 0.5443
 epoch: 81, train_loss: 0.8372, test_loss: 0.9207, test_f1: 0.5285
 epoch: 82, train_loss: 0.8384, test_loss: 0.9588, test_f1: 0.5160
 epoch: 83, train_loss: 0.8403, test_loss: 0.9488, test_f1: 0.5343
 epoch: 84, train_loss: 0.8307, test_loss: 0.9268, test_f1: 0.5337
 epoch: 85, train_loss: 0.8199, test_loss: 0.9844, test_f1: 0.5038
 epoch: 86, train_loss: 0.8253, test_loss: 0.9402, test_f1: 0.5244
 epoch: 87, train_loss: 0.8268, test_loss: 0.9325, test_f1: 0.5308
 epoch: 88, train_loss: 0.8251, test_loss: 0.9552, test_f1: 0.5282
 epoch: 89, train_loss: 0.8351, test_loss: 0.9612, test_f1: 0.5389
 epoch: 90, train_loss: 0.8389, test_loss: 0.9356, test_f1: 0.5425
 epoch: 91, train_loss: 0.8298, test_loss: 0.9385, test_f1: 0.5455
 epoch: 92, train_loss: 0.8224, test_loss: 0.9670, test_f1: 0.5302
 epoch: 93, train_loss: 0.8149, test_loss: 0.9387, test_f1: 0.5407
 epoch: 94, train_loss: 0.8273, test_loss: 0.9650, test_f1: 0.5208
 epoch: 95, train_loss: 0.8236, test_loss: 0.9364, test_f1: 0.5293
 epoch: 96, train_loss: 0.8188, test_loss: 0.9519, test_f1: 0.5222
 epoch: 97, train_loss: 0.8370, test_loss: 0.9707, test_f1: 0.5143
 epoch: 98, train_loss: 0.8177, test_loss: 0.9622, test_f1: 0.5233
 epoch: 99, train_loss: 0.8226, test_loss: 0.9695, test_f1: 0.5319
##################ITERATION #8 ****************************************
 epoch: 0, train_loss: 1.2639, test_loss: 1.0643, test_f1: 0.4177
 epoch: 1, train_loss: 1.1208, test_loss: 1.0337, test_f1: 0.4331
 epoch: 2, train_loss: 1.0800, test_loss: 1.0080, test_f1: 0.4337
 epoch: 3, train_loss: 1.0571, test_loss: 0.9998, test_f1: 0.4590
 epoch: 4, train_loss: 1.0297, test_loss: 1.0108, test_f1: 0.4555
 epoch: 5, train_loss: 1.0050, test_loss: 0.9905, test_f1: 0.4709
 epoch: 6, train_loss: 1.0056, test_loss: 0.9859, test_f1: 0.4866
 epoch: 7, train_loss: 1.0088, test_loss: 1.0088, test_f1: 0.4581
 epoch: 8, train_loss: 0.9882, test_loss: 0.9738, test_f1: 0.4921
 epoch: 9, train_loss: 0.9845, test_loss: 0.9671, test_f1: 0.4712
 epoch: 10, train_loss: 0.9759, test_loss: 0.9718, test_f1: 0.4993
 epoch: 11, train_loss: 0.9667, test_loss: 0.9614, test_f1: 0.5148
 epoch: 12, train_loss: 0.9633, test_loss: 0.9668, test_f1: 0.4939
 epoch: 13, train_loss: 0.9599, test_loss: 0.9554, test_f1: 0.4912
 epoch: 14, train_loss: 0.9640, test_loss: 0.9665, test_f1: 0.4948
 epoch: 15, train_loss: 0.9453, test_loss: 0.9479, test_f1: 0.4934
 epoch: 16, train_loss: 0.9351, test_loss: 0.9517, test_f1: 0.5220
 epoch: 17, train_loss: 0.9453, test_loss: 0.9509, test_f1: 0.5250
 epoch: 18, train_loss: 0.9525, test_loss: 0.9485, test_f1: 0.5213
 epoch: 19, train_loss: 0.9437, test_loss: 0.9490, test_f1: 0.5027
 epoch: 20, train_loss: 0.9378, test_loss: 0.9474, test_f1: 0.5213
 epoch: 21, train_loss: 0.9284, test_loss: 0.9470, test_f1: 0.5291
 epoch: 22, train_loss: 0.9363, test_loss: 0.9247, test_f1: 0.5185
 epoch: 23, train_loss: 0.9323, test_loss: 0.9260, test_f1: 0.5298
 epoch: 24, train_loss: 0.9168, test_loss: 0.9376, test_f1: 0.5249
 epoch: 25, train_loss: 0.9303, test_loss: 0.9165, test_f1: 0.5272
 epoch: 26, train_loss: 0.9149, test_loss: 0.9310, test_f1: 0.5212
 epoch: 27, train_loss: 0.9216, test_loss: 0.9392, test_f1: 0.5313
 epoch: 28, train_loss: 0.9185, test_loss: 0.9107, test_f1: 0.5222
 epoch: 29, train_loss: 0.9162, test_loss: 0.9479, test_f1: 0.5027
 epoch: 30, train_loss: 0.9187, test_loss: 0.9214, test_f1: 0.5315
 epoch: 31, train_loss: 0.9016, test_loss: 0.9264, test_f1: 0.5378
 epoch: 32, train_loss: 0.9059, test_loss: 0.9187, test_f1: 0.5376
 epoch: 33, train_loss: 0.9080, test_loss: 0.9357, test_f1: 0.5204
 epoch: 34, train_loss: 0.9068, test_loss: 0.9204, test_f1: 0.5125
 epoch: 35, train_loss: 0.9052, test_loss: 0.9284, test_f1: 0.5328
 epoch: 36, train_loss: 0.9027, test_loss: 0.9154, test_f1: 0.5329
 epoch: 37, train_loss: 0.9068, test_loss: 0.9187, test_f1: 0.5427
 epoch: 38, train_loss: 0.8920, test_loss: 0.9398, test_f1: 0.5522
 epoch: 39, train_loss: 0.8889, test_loss: 0.9251, test_f1: 0.5330
 epoch: 40, train_loss: 0.8787, test_loss: 0.9176, test_f1: 0.5336
 epoch: 41, train_loss: 0.8946, test_loss: 0.9195, test_f1: 0.5369
 epoch: 42, train_loss: 0.8903, test_loss: 0.9042, test_f1: 0.5342
 epoch: 43, train_loss: 0.8871, test_loss: 0.9118, test_f1: 0.5506
 epoch: 44, train_loss: 0.8814, test_loss: 0.9239, test_f1: 0.5345
 epoch: 45, train_loss: 0.8838, test_loss: 0.9139, test_f1: 0.5500
 epoch: 46, train_loss: 0.8950, test_loss: 0.9158, test_f1: 0.5376
 epoch: 47, train_loss: 0.8837, test_loss: 0.8958, test_f1: 0.5287
 epoch: 48, train_loss: 0.8929, test_loss: 0.9175, test_f1: 0.5285
 epoch: 49, train_loss: 0.8873, test_loss: 0.9259, test_f1: 0.5203
 epoch: 50, train_loss: 0.8824, test_loss: 0.8975, test_f1: 0.5399
 epoch: 51, train_loss: 0.8807, test_loss: 0.9060, test_f1: 0.5412
 epoch: 52, train_loss: 0.8739, test_loss: 0.8979, test_f1: 0.5452
 epoch: 53, train_loss: 0.8638, test_loss: 0.9125, test_f1: 0.5432
 epoch: 54, train_loss: 0.8765, test_loss: 0.9078, test_f1: 0.5365
 epoch: 55, train_loss: 0.8707, test_loss: 0.9075, test_f1: 0.5325
 epoch: 56, train_loss: 0.8710, test_loss: 0.9128, test_f1: 0.5243
 epoch: 57, train_loss: 0.8802, test_loss: 0.8886, test_f1: 0.5428
 epoch: 58, train_loss: 0.8725, test_loss: 0.9099, test_f1: 0.5187
 epoch: 59, train_loss: 0.8740, test_loss: 0.8831, test_f1: 0.5424
 epoch: 60, train_loss: 0.8635, test_loss: 0.9050, test_f1: 0.5264
 epoch: 61, train_loss: 0.8597, test_loss: 0.9074, test_f1: 0.5391
 epoch: 62, train_loss: 0.8579, test_loss: 0.9074, test_f1: 0.5291
 epoch: 63, train_loss: 0.8635, test_loss: 0.9040, test_f1: 0.5439
 epoch: 64, train_loss: 0.8666, test_loss: 0.8956, test_f1: 0.5435
 epoch: 65, train_loss: 0.8520, test_loss: 0.9139, test_f1: 0.5444
 epoch: 66, train_loss: 0.8540, test_loss: 0.9070, test_f1: 0.5351
 epoch: 67, train_loss: 0.8535, test_loss: 0.8989, test_f1: 0.5471
 epoch: 68, train_loss: 0.8533, test_loss: 0.9040, test_f1: 0.5352
 epoch: 69, train_loss: 0.8513, test_loss: 0.8975, test_f1: 0.5342
 epoch: 70, train_loss: 0.8613, test_loss: 0.9080, test_f1: 0.5409
 epoch: 71, train_loss: 0.8614, test_loss: 0.8992, test_f1: 0.5299
 epoch: 72, train_loss: 0.8503, test_loss: 0.9013, test_f1: 0.5467
 epoch: 73, train_loss: 0.8544, test_loss: 0.8972, test_f1: 0.5266
 epoch: 74, train_loss: 0.8597, test_loss: 0.9046, test_f1: 0.5519
 epoch: 75, train_loss: 0.8587, test_loss: 0.8947, test_f1: 0.5398
 epoch: 76, train_loss: 0.8546, test_loss: 0.8984, test_f1: 0.5356
 epoch: 77, train_loss: 0.8524, test_loss: 0.8917, test_f1: 0.5369
 epoch: 78, train_loss: 0.8495, test_loss: 0.8903, test_f1: 0.5462
 epoch: 79, train_loss: 0.8510, test_loss: 0.8816, test_f1: 0.5322
 epoch: 80, train_loss: 0.8500, test_loss: 0.8944, test_f1: 0.5377
 epoch: 81, train_loss: 0.8492, test_loss: 0.9052, test_f1: 0.5435
 epoch: 82, train_loss: 0.8460, test_loss: 0.8853, test_f1: 0.5429
 epoch: 83, train_loss: 0.8502, test_loss: 0.8941, test_f1: 0.5397
 epoch: 84, train_loss: 0.8597, test_loss: 0.8908, test_f1: 0.5342
 epoch: 85, train_loss: 0.8440, test_loss: 0.9081, test_f1: 0.5323
 epoch: 86, train_loss: 0.8385, test_loss: 0.8969, test_f1: 0.5403
 epoch: 87, train_loss: 0.8350, test_loss: 0.8868, test_f1: 0.5313
 epoch: 88, train_loss: 0.8470, test_loss: 0.9111, test_f1: 0.5417
 epoch: 89, train_loss: 0.8435, test_loss: 0.8804, test_f1: 0.5525
 epoch: 90, train_loss: 0.8450, test_loss: 0.8831, test_f1: 0.5594
 epoch: 91, train_loss: 0.8480, test_loss: 0.8896, test_f1: 0.5353
 epoch: 92, train_loss: 0.8475, test_loss: 0.8989, test_f1: 0.5405
 epoch: 93, train_loss: 0.8492, test_loss: 0.8797, test_f1: 0.5291
 epoch: 94, train_loss: 0.8549, test_loss: 0.8814, test_f1: 0.5339
 epoch: 95, train_loss: 0.8452, test_loss: 0.8929, test_f1: 0.5265
 epoch: 96, train_loss: 0.8373, test_loss: 0.8752, test_f1: 0.5485
 epoch: 97, train_loss: 0.8304, test_loss: 0.8808, test_f1: 0.5445
 epoch: 98, train_loss: 0.8438, test_loss: 0.8858, test_f1: 0.5497
 epoch: 99, train_loss: 0.8580, test_loss: 0.8836, test_f1: 0.5468
##################ITERATION #9 ****************************************
 epoch: 0, train_loss: 1.4063, test_loss: 1.1335, test_f1: 0.3877
 epoch: 1, train_loss: 1.1687, test_loss: 1.0672, test_f1: 0.4112
 epoch: 2, train_loss: 1.1157, test_loss: 1.0208, test_f1: 0.4499
 epoch: 3, train_loss: 1.0760, test_loss: 1.0184, test_f1: 0.4243
 epoch: 4, train_loss: 1.0655, test_loss: 1.0215, test_f1: 0.4770
 epoch: 5, train_loss: 1.0499, test_loss: 1.0250, test_f1: 0.4704
 epoch: 6, train_loss: 1.0418, test_loss: 0.9947, test_f1: 0.4743
 epoch: 7, train_loss: 1.0138, test_loss: 1.0059, test_f1: 0.4644
 epoch: 8, train_loss: 1.0062, test_loss: 1.0088, test_f1: 0.4877
 epoch: 9, train_loss: 0.9983, test_loss: 1.0056, test_f1: 0.4959
 epoch: 10, train_loss: 0.9895, test_loss: 1.0016, test_f1: 0.4843
 epoch: 11, train_loss: 0.9953, test_loss: 0.9985, test_f1: 0.4886
 epoch: 12, train_loss: 0.9743, test_loss: 0.9515, test_f1: 0.5004
 epoch: 13, train_loss: 0.9733, test_loss: 0.9895, test_f1: 0.5078
 epoch: 14, train_loss: 0.9762, test_loss: 1.0008, test_f1: 0.5003
 epoch: 15, train_loss: 0.9687, test_loss: 0.9978, test_f1: 0.5037
 epoch: 16, train_loss: 0.9700, test_loss: 0.9939, test_f1: 0.5132
 epoch: 17, train_loss: 0.9498, test_loss: 0.9821, test_f1: 0.5125
 epoch: 18, train_loss: 0.9579, test_loss: 0.9866, test_f1: 0.5122
 epoch: 19, train_loss: 0.9458, test_loss: 0.9882, test_f1: 0.5113
 epoch: 20, train_loss: 0.9555, test_loss: 0.9688, test_f1: 0.5116
 epoch: 21, train_loss: 0.9391, test_loss: 0.9739, test_f1: 0.4821
 epoch: 22, train_loss: 0.9353, test_loss: 0.9660, test_f1: 0.5074
 epoch: 23, train_loss: 0.9512, test_loss: 0.9843, test_f1: 0.4681
 epoch: 24, train_loss: 0.9414, test_loss: 0.9652, test_f1: 0.4864
 epoch: 25, train_loss: 0.9328, test_loss: 0.9751, test_f1: 0.4879
 epoch: 26, train_loss: 0.9194, test_loss: 0.9761, test_f1: 0.4772
 epoch: 27, train_loss: 0.9115, test_loss: 0.9645, test_f1: 0.4885
 epoch: 28, train_loss: 0.9230, test_loss: 0.9664, test_f1: 0.4985
 epoch: 29, train_loss: 0.9116, test_loss: 0.9624, test_f1: 0.4772
 epoch: 30, train_loss: 0.9137, test_loss: 0.9656, test_f1: 0.4998
 epoch: 31, train_loss: 0.9181, test_loss: 0.9791, test_f1: 0.4880
 epoch: 32, train_loss: 0.9096, test_loss: 0.9545, test_f1: 0.4937
 epoch: 33, train_loss: 0.9154, test_loss: 0.9419, test_f1: 0.5063
 epoch: 34, train_loss: 0.9151, test_loss: 0.9718, test_f1: 0.4913
 epoch: 35, train_loss: 0.9171, test_loss: 0.9508, test_f1: 0.4922
 epoch: 36, train_loss: 0.9093, test_loss: 0.9525, test_f1: 0.4931
 epoch: 37, train_loss: 0.9008, test_loss: 0.9569, test_f1: 0.4944
 epoch: 38, train_loss: 0.9045, test_loss: 0.9380, test_f1: 0.4987
 epoch: 39, train_loss: 0.9033, test_loss: 0.9428, test_f1: 0.5069
 epoch: 40, train_loss: 0.8977, test_loss: 0.9731, test_f1: 0.4997
 epoch: 41, train_loss: 0.9054, test_loss: 0.9420, test_f1: 0.5034
 epoch: 42, train_loss: 0.8953, test_loss: 0.9355, test_f1: 0.5041
 epoch: 43, train_loss: 0.8916, test_loss: 0.9412, test_f1: 0.5040
 epoch: 44, train_loss: 0.8994, test_loss: 0.9522, test_f1: 0.5141
 epoch: 45, train_loss: 0.8922, test_loss: 0.9496, test_f1: 0.5100
 epoch: 46, train_loss: 0.8870, test_loss: 0.9439, test_f1: 0.4962
 epoch: 47, train_loss: 0.8913, test_loss: 0.9333, test_f1: 0.5235
 epoch: 48, train_loss: 0.8895, test_loss: 1.0471, test_f1: 0.4641
 epoch: 49, train_loss: 0.8933, test_loss: 0.9300, test_f1: 0.5259
 epoch: 50, train_loss: 0.8942, test_loss: 0.9495, test_f1: 0.5290
 epoch: 51, train_loss: 0.8772, test_loss: 0.9294, test_f1: 0.5340
 epoch: 52, train_loss: 0.8645, test_loss: 0.9308, test_f1: 0.5405
 epoch: 53, train_loss: 0.8723, test_loss: 0.9368, test_f1: 0.5405
 epoch: 54, train_loss: 0.8768, test_loss: 0.9173, test_f1: 0.5448
 epoch: 55, train_loss: 0.8660, test_loss: 0.9132, test_f1: 0.5653
 epoch: 56, train_loss: 0.8715, test_loss: 0.9141, test_f1: 0.5502
 epoch: 57, train_loss: 0.8738, test_loss: 0.9104, test_f1: 0.5702
 epoch: 58, train_loss: 0.8746, test_loss: 0.9101, test_f1: 0.5503
 epoch: 59, train_loss: 0.8704, test_loss: 0.9194, test_f1: 0.5354
 epoch: 60, train_loss: 0.8707, test_loss: 0.9161, test_f1: 0.5498
 epoch: 61, train_loss: 0.8631, test_loss: 0.9057, test_f1: 0.5528
 epoch: 62, train_loss: 0.8724, test_loss: 0.9186, test_f1: 0.5584
 epoch: 63, train_loss: 0.8556, test_loss: 0.9047, test_f1: 0.5568
 epoch: 64, train_loss: 0.8687, test_loss: 0.8989, test_f1: 0.5716
 epoch: 65, train_loss: 0.8574, test_loss: 0.9163, test_f1: 0.5684
 epoch: 66, train_loss: 0.8664, test_loss: 0.9114, test_f1: 0.5660
 epoch: 67, train_loss: 0.8617, test_loss: 0.9070, test_f1: 0.5774
 epoch: 68, train_loss: 0.8655, test_loss: 0.9227, test_f1: 0.5545
 epoch: 69, train_loss: 0.8621, test_loss: 0.9019, test_f1: 0.5639
 epoch: 70, train_loss: 0.8578, test_loss: 0.9082, test_f1: 0.5681
 epoch: 71, train_loss: 0.8620, test_loss: 0.8996, test_f1: 0.5657
 epoch: 72, train_loss: 0.8557, test_loss: 0.9092, test_f1: 0.5512
 epoch: 73, train_loss: 0.8567, test_loss: 0.9081, test_f1: 0.5561
 epoch: 74, train_loss: 0.8548, test_loss: 0.8964, test_f1: 0.5646
 epoch: 75, train_loss: 0.8562, test_loss: 0.9090, test_f1: 0.5671
 epoch: 76, train_loss: 0.8616, test_loss: 0.9159, test_f1: 0.5579
 epoch: 77, train_loss: 0.8497, test_loss: 0.8999, test_f1: 0.5636
 epoch: 78, train_loss: 0.8523, test_loss: 0.8840, test_f1: 0.5655
 epoch: 79, train_loss: 0.8667, test_loss: 0.8916, test_f1: 0.5551
 epoch: 80, train_loss: 0.8467, test_loss: 0.9059, test_f1: 0.5434
 epoch: 81, train_loss: 0.8506, test_loss: 0.8990, test_f1: 0.5636
 epoch: 82, train_loss: 0.8463, test_loss: 0.8963, test_f1: 0.5826
 epoch: 83, train_loss: 0.8462, test_loss: 0.8937, test_f1: 0.5708
 epoch: 84, train_loss: 0.8547, test_loss: 0.8908, test_f1: 0.5768
 epoch: 85, train_loss: 0.8511, test_loss: 0.9071, test_f1: 0.5478
 epoch: 86, train_loss: 0.8554, test_loss: 0.8969, test_f1: 0.5473
 epoch: 87, train_loss: 0.8456, test_loss: 0.8955, test_f1: 0.5675
 epoch: 88, train_loss: 0.8483, test_loss: 0.8796, test_f1: 0.5798
 epoch: 89, train_loss: 0.8581, test_loss: 0.8840, test_f1: 0.5439
 epoch: 90, train_loss: 0.8492, test_loss: 0.8849, test_f1: 0.5717
 epoch: 91, train_loss: 0.8522, test_loss: 0.8927, test_f1: 0.5786
 epoch: 92, train_loss: 0.8473, test_loss: 0.8724, test_f1: 0.5804
 epoch: 93, train_loss: 0.8526, test_loss: 0.8765, test_f1: 0.5836
 epoch: 94, train_loss: 0.8547, test_loss: 0.8766, test_f1: 0.5661
 epoch: 95, train_loss: 0.8464, test_loss: 0.8732, test_f1: 0.5612
 epoch: 96, train_loss: 0.8538, test_loss: 0.9037, test_f1: 0.5533
 epoch: 97, train_loss: 0.8370, test_loss: 0.8669, test_f1: 0.5736
 epoch: 98, train_loss: 0.8579, test_loss: 0.8786, test_f1: 0.5941
 epoch: 99, train_loss: 0.8478, test_loss: 0.8685, test_f1: 0.5832

Training completed in 789.77 seconds
Best F1: 0.5941 at epoch 98
Mean F1 across iterations: 0.5574  0.0155
========================FINAL RESULTS================================
FEGIN weighted F1: 0.5941  0.0155
python main.py --data ltspice_examples --representation component_net --model FEGIN --layers 2 --hiddens 16 --batch_size 32 --lr 0.001 --emb_size 250 --epochs 100 --save_appendix component_net_L2_H16_BS32_LR0.001_E250 --no_val
-----



STDERR:
  File "main.py", line 370, in <module>
    main()
  File "main.py", line 254, in main
    dataset = dataset_class(
  File "/home/philip/projects/ltspice_examples_code_repo/Circuit-Completion-Using-GNNs/component_classification_with_link_prediction_head/evaluation/FEGIN/kernel/circuit_datasets.py", line 15, in __init__
    self.data, self.slices = torch.load(self.processed_paths[0])
  File "/home/philip/.local/lib/python3.8/site-packages/torch/serialization.py", line 1040, in load
    warnings.warn(
  File "/usr/lib/python3.8/warnings.py", line 109, in _showwarnmsg
    sw(msg.message, msg.category, msg.filename, msg.lineno,
  File "main.py", line 47, in warn_with_traceback
    traceback.print_stack(file=log)
/home/philip/projects/ltspice_examples_code_repo/Circuit-Completion-Using-GNNs/component_classification_with_link_prediction_head/evaluation/FEGIN/kernel/circuit_datasets.py:15: FutureWarning: You are using `torch.load` with `weights_only=False` (the current default value), which uses the default pickle module implicitly. It is possible to construct malicious pickle data which will execute arbitrary code during unpickling (See https://github.com/pytorch/pytorch/blob/main/SECURITY.md#untrusted-models for more details). In a future release, the default value for `weights_only` will be flipped to `True`. This limits the functions that could be executed during unpickling. Arbitrary objects will no longer be allowed to be loaded via this mode unless they are explicitly allowlisted by the user via `torch.serialization.add_safe_globals`. We recommend you start setting `weights_only=True` for any use case where you don't have full control of the loaded file. Please open an issue on GitHub for any issues related to this experimental feature.
  self.data, self.slices = torch.load(self.processed_paths[0])
