STDOUT:
Results will be saved in /home/philip/projects/ltspice_examples_code_repo/Circuit-Completion-Using-GNNs/component_classification_with_link_prediction_head/evaluation/FEGIN/results/model_FEGIN_dataset_ltspice_demos
Command line input: python main.py --data ltspice_demos --representation component_net --model FEGIN --layers 2 --hiddens 128 --batch_size 32 --lr 0.0001 --emb_size 128 --epochs 100 --save_appendix component_net_L2_H128_BS32_LR0.0001_E128 --no_val
 is saved.
-----
ltspice_demos - FEGIN
Using 2 layers, 128 hidden units, h = 2
Loading component_net representation dataset
ENTERED
Training FEGIN on component_net representation
Train: 1565, Test: 383
##################ITERATION #0 ****************************************
 epoch: 0, train_loss: 1.3545, test_loss: 1.3499, test_f1: 0.2281
 epoch: 1, train_loss: 1.2907, test_loss: 1.2977, test_f1: 0.2281
 epoch: 2, train_loss: 1.2282, test_loss: 1.2569, test_f1: 0.2281
 epoch: 3, train_loss: 1.1858, test_loss: 1.2342, test_f1: 0.2833
 epoch: 4, train_loss: 1.1559, test_loss: 1.2176, test_f1: 0.2886
 epoch: 5, train_loss: 1.1287, test_loss: 1.2011, test_f1: 0.3333
 epoch: 6, train_loss: 1.1035, test_loss: 1.1910, test_f1: 0.3968
 epoch: 7, train_loss: 1.0808, test_loss: 1.1698, test_f1: 0.4045
 epoch: 8, train_loss: 1.0612, test_loss: 1.1583, test_f1: 0.4066
 epoch: 9, train_loss: 1.0371, test_loss: 1.1398, test_f1: 0.4166
 epoch: 10, train_loss: 1.0117, test_loss: 1.1228, test_f1: 0.4333
 epoch: 11, train_loss: 0.9984, test_loss: 1.0954, test_f1: 0.4418
 epoch: 12, train_loss: 0.9786, test_loss: 1.0841, test_f1: 0.4568
 epoch: 13, train_loss: 0.9656, test_loss: 1.0751, test_f1: 0.4619
 epoch: 14, train_loss: 0.9432, test_loss: 1.0694, test_f1: 0.4785
 epoch: 15, train_loss: 0.9312, test_loss: 1.0572, test_f1: 0.4738
 epoch: 16, train_loss: 0.9269, test_loss: 1.0650, test_f1: 0.5016
 epoch: 17, train_loss: 0.9153, test_loss: 1.0555, test_f1: 0.4933
 epoch: 18, train_loss: 0.9041, test_loss: 1.0489, test_f1: 0.5105
 epoch: 19, train_loss: 0.8984, test_loss: 1.0355, test_f1: 0.5430
 epoch: 20, train_loss: 0.8872, test_loss: 1.0617, test_f1: 0.5486
 epoch: 21, train_loss: 0.8782, test_loss: 1.0416, test_f1: 0.5196
 epoch: 22, train_loss: 0.8790, test_loss: 1.0298, test_f1: 0.5339
 epoch: 23, train_loss: 0.8676, test_loss: 1.0292, test_f1: 0.5544
 epoch: 24, train_loss: 0.8526, test_loss: 1.0823, test_f1: 0.5415
 epoch: 25, train_loss: 0.8473, test_loss: 1.0775, test_f1: 0.5619
 epoch: 26, train_loss: 0.8460, test_loss: 1.0530, test_f1: 0.5574
 epoch: 27, train_loss: 0.8291, test_loss: 1.0530, test_f1: 0.5443
 epoch: 28, train_loss: 0.8386, test_loss: 1.0444, test_f1: 0.5632
 epoch: 29, train_loss: 0.8215, test_loss: 1.0578, test_f1: 0.5716
 epoch: 30, train_loss: 0.8185, test_loss: 1.0474, test_f1: 0.5824
 epoch: 31, train_loss: 0.8148, test_loss: 1.0451, test_f1: 0.5913
 epoch: 32, train_loss: 0.8110, test_loss: 1.0310, test_f1: 0.5875
 epoch: 33, train_loss: 0.7943, test_loss: 1.0547, test_f1: 0.5665
 epoch: 34, train_loss: 0.8031, test_loss: 1.0130, test_f1: 0.5874
 epoch: 35, train_loss: 0.7851, test_loss: 1.0613, test_f1: 0.5876
 epoch: 36, train_loss: 0.7848, test_loss: 1.0575, test_f1: 0.5760
 epoch: 37, train_loss: 0.7812, test_loss: 1.0561, test_f1: 0.5692
 epoch: 38, train_loss: 0.7805, test_loss: 1.1071, test_f1: 0.5556
 epoch: 39, train_loss: 0.7478, test_loss: 1.0409, test_f1: 0.5703
 epoch: 40, train_loss: 0.7561, test_loss: 1.0485, test_f1: 0.5831
 epoch: 41, train_loss: 0.7439, test_loss: 1.0385, test_f1: 0.5716
 epoch: 42, train_loss: 0.7402, test_loss: 1.0668, test_f1: 0.5550
 epoch: 43, train_loss: 0.7299, test_loss: 1.0889, test_f1: 0.5638
 epoch: 44, train_loss: 0.7189, test_loss: 1.0811, test_f1: 0.5632
 epoch: 45, train_loss: 0.7198, test_loss: 1.0374, test_f1: 0.5632
 epoch: 46, train_loss: 0.7165, test_loss: 1.0898, test_f1: 0.5635
 epoch: 47, train_loss: 0.7029, test_loss: 1.0551, test_f1: 0.5581
 epoch: 48, train_loss: 0.7089, test_loss: 1.0905, test_f1: 0.5860
 epoch: 49, train_loss: 0.6905, test_loss: 1.0569, test_f1: 0.6088
 epoch: 50, train_loss: 0.6796, test_loss: 1.0428, test_f1: 0.5788
 epoch: 51, train_loss: 0.6845, test_loss: 1.0684, test_f1: 0.5784
 epoch: 52, train_loss: 0.6666, test_loss: 1.0407, test_f1: 0.5933
 epoch: 53, train_loss: 0.6585, test_loss: 1.0494, test_f1: 0.6115
 epoch: 54, train_loss: 0.6577, test_loss: 1.0257, test_f1: 0.6144
 epoch: 55, train_loss: 0.6367, test_loss: 1.0557, test_f1: 0.5976
 epoch: 56, train_loss: 0.6444, test_loss: 1.0647, test_f1: 0.5793
 epoch: 57, train_loss: 0.6557, test_loss: 1.0614, test_f1: 0.6024
 epoch: 58, train_loss: 0.6369, test_loss: 1.0717, test_f1: 0.6047
 epoch: 59, train_loss: 0.6505, test_loss: 1.0728, test_f1: 0.5913
 epoch: 60, train_loss: 0.6415, test_loss: 1.0809, test_f1: 0.5896
 epoch: 61, train_loss: 0.6392, test_loss: 1.0768, test_f1: 0.6169
 epoch: 62, train_loss: 0.6241, test_loss: 1.1198, test_f1: 0.6054
 epoch: 63, train_loss: 0.6380, test_loss: 1.0529, test_f1: 0.6146
 epoch: 64, train_loss: 0.6213, test_loss: 1.0756, test_f1: 0.6062
 epoch: 65, train_loss: 0.6134, test_loss: 1.1309, test_f1: 0.5725
 epoch: 66, train_loss: 0.6015, test_loss: 1.0905, test_f1: 0.6013
 epoch: 67, train_loss: 0.6142, test_loss: 1.0855, test_f1: 0.6234
 epoch: 68, train_loss: 0.6025, test_loss: 1.1219, test_f1: 0.5990
 epoch: 69, train_loss: 0.5983, test_loss: 1.1127, test_f1: 0.5982
 epoch: 70, train_loss: 0.6032, test_loss: 1.1408, test_f1: 0.5943
 epoch: 71, train_loss: 0.6014, test_loss: 1.1332, test_f1: 0.5822
 epoch: 72, train_loss: 0.5958, test_loss: 1.1328, test_f1: 0.5890
 epoch: 73, train_loss: 0.5961, test_loss: 1.1403, test_f1: 0.5805
 epoch: 74, train_loss: 0.5961, test_loss: 1.1577, test_f1: 0.5943
 epoch: 75, train_loss: 0.5723, test_loss: 1.1493, test_f1: 0.5934
 epoch: 76, train_loss: 0.5946, test_loss: 1.1523, test_f1: 0.5997
 epoch: 77, train_loss: 0.5684, test_loss: 1.2337, test_f1: 0.5479
 epoch: 78, train_loss: 0.5720, test_loss: 1.1465, test_f1: 0.6051
 epoch: 79, train_loss: 0.5837, test_loss: 1.1795, test_f1: 0.6049
 epoch: 80, train_loss: 0.5506, test_loss: 1.1763, test_f1: 0.5917
 epoch: 81, train_loss: 0.5659, test_loss: 1.1592, test_f1: 0.6053
 epoch: 82, train_loss: 0.5723, test_loss: 1.2001, test_f1: 0.5535
 epoch: 83, train_loss: 0.5651, test_loss: 1.2022, test_f1: 0.5679
 epoch: 84, train_loss: 0.5681, test_loss: 1.1930, test_f1: 0.6049
 epoch: 85, train_loss: 0.5426, test_loss: 1.2475, test_f1: 0.5783
 epoch: 86, train_loss: 0.5611, test_loss: 1.2286, test_f1: 0.5903
 epoch: 87, train_loss: 0.5402, test_loss: 1.3037, test_f1: 0.5503
 epoch: 88, train_loss: 0.5472, test_loss: 1.2698, test_f1: 0.5660
 epoch: 89, train_loss: 0.5476, test_loss: 1.2707, test_f1: 0.5498
 epoch: 90, train_loss: 0.5305, test_loss: 1.2848, test_f1: 0.5891
 epoch: 91, train_loss: 0.5343, test_loss: 1.3000, test_f1: 0.5732
 epoch: 92, train_loss: 0.5344, test_loss: 1.3002, test_f1: 0.5687
 epoch: 93, train_loss: 0.5375, test_loss: 1.2682, test_f1: 0.5810
 epoch: 94, train_loss: 0.5332, test_loss: 1.2666, test_f1: 0.5953
 epoch: 95, train_loss: 0.5284, test_loss: 1.2511, test_f1: 0.6107
 epoch: 96, train_loss: 0.5137, test_loss: 1.3700, test_f1: 0.5623
 epoch: 97, train_loss: 0.5161, test_loss: 1.3890, test_f1: 0.5755
 epoch: 98, train_loss: 0.5101, test_loss: 1.3248, test_f1: 0.6049
 epoch: 99, train_loss: 0.5008, test_loss: 1.3342, test_f1: 0.5783
##################ITERATION #1 ****************************************
 epoch: 0, train_loss: 1.2618, test_loss: 1.2773, test_f1: 0.2805
 epoch: 1, train_loss: 1.1562, test_loss: 1.2162, test_f1: 0.3722
 epoch: 2, train_loss: 1.1138, test_loss: 1.1810, test_f1: 0.3621
 epoch: 3, train_loss: 1.0896, test_loss: 1.1520, test_f1: 0.4246
 epoch: 4, train_loss: 1.0519, test_loss: 1.1271, test_f1: 0.4683
 epoch: 5, train_loss: 1.0288, test_loss: 1.1000, test_f1: 0.4738
 epoch: 6, train_loss: 1.0102, test_loss: 1.0826, test_f1: 0.4947
 epoch: 7, train_loss: 0.9802, test_loss: 1.0765, test_f1: 0.5043
 epoch: 8, train_loss: 0.9591, test_loss: 1.0571, test_f1: 0.5050
 epoch: 9, train_loss: 0.9360, test_loss: 1.0470, test_f1: 0.5215
 epoch: 10, train_loss: 0.9223, test_loss: 1.0330, test_f1: 0.5091
 epoch: 11, train_loss: 0.9186, test_loss: 1.0537, test_f1: 0.5310
 epoch: 12, train_loss: 0.9045, test_loss: 1.0400, test_f1: 0.5393
 epoch: 13, train_loss: 0.8895, test_loss: 1.0226, test_f1: 0.5478
 epoch: 14, train_loss: 0.8750, test_loss: 1.0289, test_f1: 0.5277
 epoch: 15, train_loss: 0.8652, test_loss: 1.0299, test_f1: 0.5300
 epoch: 16, train_loss: 0.8637, test_loss: 1.0390, test_f1: 0.5336
 epoch: 17, train_loss: 0.8360, test_loss: 1.0351, test_f1: 0.5207
 epoch: 18, train_loss: 0.8485, test_loss: 1.0295, test_f1: 0.5389
 epoch: 19, train_loss: 0.8324, test_loss: 1.0188, test_f1: 0.5566
 epoch: 20, train_loss: 0.8134, test_loss: 1.0318, test_f1: 0.5598
 epoch: 21, train_loss: 0.8148, test_loss: 1.0302, test_f1: 0.5291
 epoch: 22, train_loss: 0.8159, test_loss: 1.0202, test_f1: 0.5736
 epoch: 23, train_loss: 0.8112, test_loss: 1.0239, test_f1: 0.5647
 epoch: 24, train_loss: 0.7845, test_loss: 1.0495, test_f1: 0.5861
 epoch: 25, train_loss: 0.7705, test_loss: 1.0321, test_f1: 0.5780
 epoch: 26, train_loss: 0.7741, test_loss: 1.0832, test_f1: 0.5845
 epoch: 27, train_loss: 0.7576, test_loss: 1.0247, test_f1: 0.6059
 epoch: 28, train_loss: 0.7551, test_loss: 1.0182, test_f1: 0.6087
 epoch: 29, train_loss: 0.7474, test_loss: 1.0005, test_f1: 0.6361
 epoch: 30, train_loss: 0.7423, test_loss: 1.0267, test_f1: 0.6059
 epoch: 31, train_loss: 0.7444, test_loss: 1.0451, test_f1: 0.6092
 epoch: 32, train_loss: 0.7344, test_loss: 1.0263, test_f1: 0.6085
 epoch: 33, train_loss: 0.7155, test_loss: 0.9999, test_f1: 0.6017
 epoch: 34, train_loss: 0.7084, test_loss: 1.0033, test_f1: 0.5925
 epoch: 35, train_loss: 0.6952, test_loss: 0.9933, test_f1: 0.6417
 epoch: 36, train_loss: 0.7037, test_loss: 1.0550, test_f1: 0.6220
 epoch: 37, train_loss: 0.7034, test_loss: 1.0388, test_f1: 0.5995
 epoch: 38, train_loss: 0.6861, test_loss: 1.0316, test_f1: 0.6138
 epoch: 39, train_loss: 0.6779, test_loss: 0.9995, test_f1: 0.6209
 epoch: 40, train_loss: 0.6644, test_loss: 1.0365, test_f1: 0.5978
 epoch: 41, train_loss: 0.6604, test_loss: 1.0411, test_f1: 0.6211
 epoch: 42, train_loss: 0.6624, test_loss: 0.9885, test_f1: 0.6367
 epoch: 43, train_loss: 0.6441, test_loss: 1.0463, test_f1: 0.6236
 epoch: 44, train_loss: 0.6418, test_loss: 0.9961, test_f1: 0.6508
 epoch: 45, train_loss: 0.6468, test_loss: 1.1271, test_f1: 0.6150
 epoch: 46, train_loss: 0.6486, test_loss: 1.0503, test_f1: 0.6275
 epoch: 47, train_loss: 0.6209, test_loss: 1.0688, test_f1: 0.6297
 epoch: 48, train_loss: 0.6385, test_loss: 1.0167, test_f1: 0.6381
 epoch: 49, train_loss: 0.6180, test_loss: 1.0532, test_f1: 0.6186
 epoch: 50, train_loss: 0.6223, test_loss: 1.0305, test_f1: 0.6459
 epoch: 51, train_loss: 0.5965, test_loss: 1.0061, test_f1: 0.6560
 epoch: 52, train_loss: 0.5983, test_loss: 1.0433, test_f1: 0.6764
 epoch: 53, train_loss: 0.5878, test_loss: 1.0429, test_f1: 0.6691
 epoch: 54, train_loss: 0.5796, test_loss: 1.0544, test_f1: 0.6421
 epoch: 55, train_loss: 0.5760, test_loss: 1.0484, test_f1: 0.6605
 epoch: 56, train_loss: 0.5850, test_loss: 1.0571, test_f1: 0.6585
 epoch: 57, train_loss: 0.5691, test_loss: 1.0463, test_f1: 0.6566
 epoch: 58, train_loss: 0.5724, test_loss: 1.0592, test_f1: 0.6423
 epoch: 59, train_loss: 0.5675, test_loss: 1.0582, test_f1: 0.6647
 epoch: 60, train_loss: 0.5630, test_loss: 1.0405, test_f1: 0.6658
 epoch: 61, train_loss: 0.5545, test_loss: 1.0762, test_f1: 0.6455
 epoch: 62, train_loss: 0.5534, test_loss: 1.0560, test_f1: 0.6588
 epoch: 63, train_loss: 0.5487, test_loss: 1.0803, test_f1: 0.6474
 epoch: 64, train_loss: 0.5450, test_loss: 1.0704, test_f1: 0.6580
 epoch: 65, train_loss: 0.5449, test_loss: 1.0433, test_f1: 0.6469
 epoch: 66, train_loss: 0.5378, test_loss: 1.0831, test_f1: 0.6257
 epoch: 67, train_loss: 0.5420, test_loss: 1.0902, test_f1: 0.6568
 epoch: 68, train_loss: 0.5379, test_loss: 1.0969, test_f1: 0.6447
 epoch: 69, train_loss: 0.5390, test_loss: 1.0910, test_f1: 0.6585
 epoch: 70, train_loss: 0.5376, test_loss: 1.1189, test_f1: 0.6397
 epoch: 71, train_loss: 0.5196, test_loss: 1.1670, test_f1: 0.6454
 epoch: 72, train_loss: 0.5280, test_loss: 1.1336, test_f1: 0.6307
 epoch: 73, train_loss: 0.5128, test_loss: 1.1389, test_f1: 0.6395
 epoch: 74, train_loss: 0.5002, test_loss: 1.1122, test_f1: 0.6465
 epoch: 75, train_loss: 0.5153, test_loss: 1.1455, test_f1: 0.6318
 epoch: 76, train_loss: 0.5181, test_loss: 1.1533, test_f1: 0.6552
 epoch: 77, train_loss: 0.5305, test_loss: 1.1395, test_f1: 0.6473
 epoch: 78, train_loss: 0.5097, test_loss: 1.1962, test_f1: 0.6251
 epoch: 79, train_loss: 0.5029, test_loss: 1.1438, test_f1: 0.6606
 epoch: 80, train_loss: 0.5138, test_loss: 1.1566, test_f1: 0.6634
 epoch: 81, train_loss: 0.5045, test_loss: 1.1792, test_f1: 0.6585
 epoch: 82, train_loss: 0.5030, test_loss: 1.1678, test_f1: 0.6532
 epoch: 83, train_loss: 0.4923, test_loss: 1.1702, test_f1: 0.6450
 epoch: 84, train_loss: 0.5042, test_loss: 1.1416, test_f1: 0.6343
 epoch: 85, train_loss: 0.4983, test_loss: 1.2116, test_f1: 0.6472
 epoch: 86, train_loss: 0.4988, test_loss: 1.1961, test_f1: 0.6423
 epoch: 87, train_loss: 0.4810, test_loss: 1.2009, test_f1: 0.6373
 epoch: 88, train_loss: 0.4638, test_loss: 1.2728, test_f1: 0.6236
 epoch: 89, train_loss: 0.4900, test_loss: 1.1700, test_f1: 0.6521
 epoch: 90, train_loss: 0.4720, test_loss: 1.2321, test_f1: 0.6162
 epoch: 91, train_loss: 0.4652, test_loss: 1.2386, test_f1: 0.6352
 epoch: 92, train_loss: 0.4549, test_loss: 1.2539, test_f1: 0.6345
 epoch: 93, train_loss: 0.4668, test_loss: 1.2316, test_f1: 0.6412
 epoch: 94, train_loss: 0.4520, test_loss: 1.2871, test_f1: 0.6492
 epoch: 95, train_loss: 0.4603, test_loss: 1.2587, test_f1: 0.6372
 epoch: 96, train_loss: 0.4699, test_loss: 1.2293, test_f1: 0.6809
 epoch: 97, train_loss: 0.4541, test_loss: 1.2185, test_f1: 0.6226
 epoch: 98, train_loss: 0.4704, test_loss: 1.2986, test_f1: 0.6220
 epoch: 99, train_loss: 0.4514, test_loss: 1.2592, test_f1: 0.6438
##################ITERATION #2 ****************************************
 epoch: 0, train_loss: 1.2125, test_loss: 1.2343, test_f1: 0.3619
 epoch: 1, train_loss: 1.1037, test_loss: 1.1675, test_f1: 0.4496
 epoch: 2, train_loss: 1.0652, test_loss: 1.1380, test_f1: 0.4662
 epoch: 3, train_loss: 1.0322, test_loss: 1.1193, test_f1: 0.4666
 epoch: 4, train_loss: 1.0177, test_loss: 1.1002, test_f1: 0.4840
 epoch: 5, train_loss: 0.9945, test_loss: 1.0867, test_f1: 0.4966
 epoch: 6, train_loss: 0.9700, test_loss: 1.0805, test_f1: 0.5060
 epoch: 7, train_loss: 0.9565, test_loss: 1.0690, test_f1: 0.5234
 epoch: 8, train_loss: 0.9479, test_loss: 1.0623, test_f1: 0.5162
 epoch: 9, train_loss: 0.9342, test_loss: 1.0538, test_f1: 0.5290
 epoch: 10, train_loss: 0.9193, test_loss: 1.0466, test_f1: 0.5213
 epoch: 11, train_loss: 0.9058, test_loss: 1.0359, test_f1: 0.5438
 epoch: 12, train_loss: 0.8862, test_loss: 1.0319, test_f1: 0.5661
 epoch: 13, train_loss: 0.8770, test_loss: 1.0540, test_f1: 0.5435
 epoch: 14, train_loss: 0.8672, test_loss: 1.0545, test_f1: 0.5518
 epoch: 15, train_loss: 0.8661, test_loss: 1.0542, test_f1: 0.5385
 epoch: 16, train_loss: 0.8386, test_loss: 1.0575, test_f1: 0.5571
 epoch: 17, train_loss: 0.8419, test_loss: 1.0519, test_f1: 0.5224
 epoch: 18, train_loss: 0.8307, test_loss: 1.0538, test_f1: 0.5509
 epoch: 19, train_loss: 0.8180, test_loss: 1.0632, test_f1: 0.5685
 epoch: 20, train_loss: 0.8188, test_loss: 1.0551, test_f1: 0.5599
 epoch: 21, train_loss: 0.7954, test_loss: 1.0444, test_f1: 0.5653
 epoch: 22, train_loss: 0.7856, test_loss: 1.0536, test_f1: 0.5715
 epoch: 23, train_loss: 0.7708, test_loss: 1.0661, test_f1: 0.5813
 epoch: 24, train_loss: 0.7611, test_loss: 1.0493, test_f1: 0.5926
 epoch: 25, train_loss: 0.7563, test_loss: 1.0357, test_f1: 0.6060
 epoch: 26, train_loss: 0.7454, test_loss: 1.0720, test_f1: 0.6096
 epoch: 27, train_loss: 0.7436, test_loss: 1.0738, test_f1: 0.5784
 epoch: 28, train_loss: 0.7317, test_loss: 1.0639, test_f1: 0.5963
 epoch: 29, train_loss: 0.7339, test_loss: 1.0312, test_f1: 0.6158
 epoch: 30, train_loss: 0.7146, test_loss: 1.0621, test_f1: 0.5828
 epoch: 31, train_loss: 0.7284, test_loss: 1.0635, test_f1: 0.5587
 epoch: 32, train_loss: 0.7229, test_loss: 1.0870, test_f1: 0.5666
 epoch: 33, train_loss: 0.7079, test_loss: 1.0306, test_f1: 0.6110
 epoch: 34, train_loss: 0.6840, test_loss: 1.0386, test_f1: 0.6335
 epoch: 35, train_loss: 0.6714, test_loss: 1.0477, test_f1: 0.6279
 epoch: 36, train_loss: 0.6603, test_loss: 1.0602, test_f1: 0.5984
 epoch: 37, train_loss: 0.6691, test_loss: 1.0732, test_f1: 0.6137
 epoch: 38, train_loss: 0.6541, test_loss: 1.0518, test_f1: 0.6203
 epoch: 39, train_loss: 0.6573, test_loss: 1.0904, test_f1: 0.6163
 epoch: 40, train_loss: 0.6405, test_loss: 1.0657, test_f1: 0.5572
 epoch: 41, train_loss: 0.6245, test_loss: 1.0456, test_f1: 0.6182
 epoch: 42, train_loss: 0.6451, test_loss: 1.1518, test_f1: 0.5715
 epoch: 43, train_loss: 0.6155, test_loss: 1.1041, test_f1: 0.5874
 epoch: 44, train_loss: 0.6102, test_loss: 1.0498, test_f1: 0.6326
 epoch: 45, train_loss: 0.6119, test_loss: 1.0661, test_f1: 0.6319
 epoch: 46, train_loss: 0.6173, test_loss: 1.1516, test_f1: 0.5893
 epoch: 47, train_loss: 0.5921, test_loss: 1.1203, test_f1: 0.6221
 epoch: 48, train_loss: 0.5963, test_loss: 1.1518, test_f1: 0.6365
 epoch: 49, train_loss: 0.5919, test_loss: 1.1061, test_f1: 0.5857
 epoch: 50, train_loss: 0.5844, test_loss: 1.1833, test_f1: 0.5881
 epoch: 51, train_loss: 0.5556, test_loss: 1.1463, test_f1: 0.6249
 epoch: 52, train_loss: 0.5484, test_loss: 1.1326, test_f1: 0.6181
 epoch: 53, train_loss: 0.5549, test_loss: 1.1706, test_f1: 0.5939
 epoch: 54, train_loss: 0.5458, test_loss: 1.1599, test_f1: 0.6137
 epoch: 55, train_loss: 0.5499, test_loss: 1.2039, test_f1: 0.6010
 epoch: 56, train_loss: 0.5553, test_loss: 1.1428, test_f1: 0.6454
 epoch: 57, train_loss: 0.5352, test_loss: 1.1471, test_f1: 0.6086
 epoch: 58, train_loss: 0.5067, test_loss: 1.1794, test_f1: 0.6013
 epoch: 59, train_loss: 0.5338, test_loss: 1.1443, test_f1: 0.6242
 epoch: 60, train_loss: 0.5164, test_loss: 1.1770, test_f1: 0.6196
 epoch: 61, train_loss: 0.5045, test_loss: 1.1739, test_f1: 0.6079
 epoch: 62, train_loss: 0.5029, test_loss: 1.1813, test_f1: 0.6204
 epoch: 63, train_loss: 0.5064, test_loss: 1.1636, test_f1: 0.6301
 epoch: 64, train_loss: 0.5200, test_loss: 1.2054, test_f1: 0.5941
 epoch: 65, train_loss: 0.4920, test_loss: 1.1838, test_f1: 0.6197
 epoch: 66, train_loss: 0.5076, test_loss: 1.2252, test_f1: 0.5881
 epoch: 67, train_loss: 0.4728, test_loss: 1.2211, test_f1: 0.6142
 epoch: 68, train_loss: 0.5014, test_loss: 1.2786, test_f1: 0.5895
 epoch: 69, train_loss: 0.5162, test_loss: 1.2273, test_f1: 0.6260
 epoch: 70, train_loss: 0.5055, test_loss: 1.2952, test_f1: 0.6030
 epoch: 71, train_loss: 0.4919, test_loss: 1.1838, test_f1: 0.6274
 epoch: 72, train_loss: 0.5043, test_loss: 1.2453, test_f1: 0.6277
 epoch: 73, train_loss: 0.4877, test_loss: 1.2433, test_f1: 0.6084
 epoch: 74, train_loss: 0.4757, test_loss: 1.2039, test_f1: 0.6205
 epoch: 75, train_loss: 0.4913, test_loss: 1.2506, test_f1: 0.6388
 epoch: 76, train_loss: 0.4628, test_loss: 1.2674, test_f1: 0.6333
 epoch: 77, train_loss: 0.4643, test_loss: 1.2575, test_f1: 0.6228
 epoch: 78, train_loss: 0.4697, test_loss: 1.2914, test_f1: 0.6238
 epoch: 79, train_loss: 0.4677, test_loss: 1.2964, test_f1: 0.6182
 epoch: 80, train_loss: 0.4779, test_loss: 1.3374, test_f1: 0.5956
 epoch: 81, train_loss: 0.4619, test_loss: 1.3187, test_f1: 0.6240
 epoch: 82, train_loss: 0.4453, test_loss: 1.3185, test_f1: 0.6460
 epoch: 83, train_loss: 0.4689, test_loss: 1.3335, test_f1: 0.6227
 epoch: 84, train_loss: 0.4450, test_loss: 1.3023, test_f1: 0.6435
 epoch: 85, train_loss: 0.4509, test_loss: 1.2975, test_f1: 0.6334
 epoch: 86, train_loss: 0.4630, test_loss: 1.3066, test_f1: 0.6336
 epoch: 87, train_loss: 0.4595, test_loss: 1.3274, test_f1: 0.6383
 epoch: 88, train_loss: 0.4444, test_loss: 1.3810, test_f1: 0.6066
 epoch: 89, train_loss: 0.4305, test_loss: 1.3904, test_f1: 0.6167
 epoch: 90, train_loss: 0.4495, test_loss: 1.3508, test_f1: 0.6107
 epoch: 91, train_loss: 0.4350, test_loss: 1.4205, test_f1: 0.5958
 epoch: 92, train_loss: 0.4384, test_loss: 1.4233, test_f1: 0.6202
 epoch: 93, train_loss: 0.4241, test_loss: 1.4370, test_f1: 0.6176
 epoch: 94, train_loss: 0.3984, test_loss: 1.4308, test_f1: 0.6189
 epoch: 95, train_loss: 0.3954, test_loss: 1.4376, test_f1: 0.6115
 epoch: 96, train_loss: 0.4298, test_loss: 1.4260, test_f1: 0.6332
 epoch: 97, train_loss: 0.4229, test_loss: 1.4806, test_f1: 0.6005
 epoch: 98, train_loss: 0.4258, test_loss: 1.5115, test_f1: 0.5987
 epoch: 99, train_loss: 0.4315, test_loss: 1.4634, test_f1: 0.6417
##################ITERATION #3 ****************************************
 epoch: 0, train_loss: 1.1725, test_loss: 1.2185, test_f1: 0.3752
 epoch: 1, train_loss: 1.0854, test_loss: 1.1278, test_f1: 0.4609
 epoch: 2, train_loss: 1.0409, test_loss: 1.1086, test_f1: 0.4641
 epoch: 3, train_loss: 1.0238, test_loss: 1.0893, test_f1: 0.4762
 epoch: 4, train_loss: 1.0001, test_loss: 1.0669, test_f1: 0.4950
 epoch: 5, train_loss: 0.9887, test_loss: 1.0529, test_f1: 0.4956
 epoch: 6, train_loss: 0.9738, test_loss: 1.0403, test_f1: 0.5087
 epoch: 7, train_loss: 0.9487, test_loss: 1.0477, test_f1: 0.5314
 epoch: 8, train_loss: 0.9200, test_loss: 1.0284, test_f1: 0.5247
 epoch: 9, train_loss: 0.9218, test_loss: 1.0375, test_f1: 0.5278
 epoch: 10, train_loss: 0.9061, test_loss: 1.0341, test_f1: 0.5288
 epoch: 11, train_loss: 0.8940, test_loss: 1.0396, test_f1: 0.5166
 epoch: 12, train_loss: 0.8907, test_loss: 1.0289, test_f1: 0.5263
 epoch: 13, train_loss: 0.8837, test_loss: 1.0247, test_f1: 0.5413
 epoch: 14, train_loss: 0.8735, test_loss: 1.0366, test_f1: 0.5414
 epoch: 15, train_loss: 0.8540, test_loss: 1.0253, test_f1: 0.5399
 epoch: 16, train_loss: 0.8448, test_loss: 1.0340, test_f1: 0.5489
 epoch: 17, train_loss: 0.8499, test_loss: 1.0296, test_f1: 0.5706
 epoch: 18, train_loss: 0.8328, test_loss: 1.0327, test_f1: 0.5701
 epoch: 19, train_loss: 0.8184, test_loss: 1.0221, test_f1: 0.5787
 epoch: 20, train_loss: 0.8257, test_loss: 1.0441, test_f1: 0.5668
 epoch: 21, train_loss: 0.8202, test_loss: 1.0466, test_f1: 0.5766
 epoch: 22, train_loss: 0.8085, test_loss: 1.0395, test_f1: 0.5823
 epoch: 23, train_loss: 0.7728, test_loss: 1.0579, test_f1: 0.5895
 epoch: 24, train_loss: 0.7827, test_loss: 1.0545, test_f1: 0.5796
 epoch: 25, train_loss: 0.7812, test_loss: 1.0404, test_f1: 0.5995
 epoch: 26, train_loss: 0.7810, test_loss: 1.0654, test_f1: 0.5912
 epoch: 27, train_loss: 0.7590, test_loss: 1.0867, test_f1: 0.5913
 epoch: 28, train_loss: 0.7629, test_loss: 1.0438, test_f1: 0.6042
 epoch: 29, train_loss: 0.7636, test_loss: 1.0423, test_f1: 0.6086
 epoch: 30, train_loss: 0.7481, test_loss: 1.0556, test_f1: 0.6094
 epoch: 31, train_loss: 0.7442, test_loss: 1.0639, test_f1: 0.6035
 epoch: 32, train_loss: 0.7257, test_loss: 1.0688, test_f1: 0.6082
 epoch: 33, train_loss: 0.7319, test_loss: 1.0870, test_f1: 0.6154
 epoch: 34, train_loss: 0.7429, test_loss: 1.1102, test_f1: 0.6037
 epoch: 35, train_loss: 0.7160, test_loss: 1.0854, test_f1: 0.6141
 epoch: 36, train_loss: 0.7231, test_loss: 1.1262, test_f1: 0.5876
 epoch: 37, train_loss: 0.7092, test_loss: 1.1234, test_f1: 0.6091
 epoch: 38, train_loss: 0.7020, test_loss: 1.1249, test_f1: 0.5969
 epoch: 39, train_loss: 0.7047, test_loss: 1.1194, test_f1: 0.6014
 epoch: 40, train_loss: 0.6781, test_loss: 1.1117, test_f1: 0.5931
 epoch: 41, train_loss: 0.6925, test_loss: 1.1321, test_f1: 0.6272
 epoch: 42, train_loss: 0.6751, test_loss: 1.1879, test_f1: 0.5776
 epoch: 43, train_loss: 0.6643, test_loss: 1.1768, test_f1: 0.6013
 epoch: 44, train_loss: 0.6744, test_loss: 1.1489, test_f1: 0.6018
 epoch: 45, train_loss: 0.6730, test_loss: 1.1741, test_f1: 0.6036
 epoch: 46, train_loss: 0.6610, test_loss: 1.1707, test_f1: 0.6009
 epoch: 47, train_loss: 0.6452, test_loss: 1.2111, test_f1: 0.5940
 epoch: 48, train_loss: 0.6332, test_loss: 1.1712, test_f1: 0.6359
 epoch: 49, train_loss: 0.6429, test_loss: 1.1915, test_f1: 0.6213
 epoch: 50, train_loss: 0.6350, test_loss: 1.2115, test_f1: 0.6017
 epoch: 51, train_loss: 0.6156, test_loss: 1.2048, test_f1: 0.6204
 epoch: 52, train_loss: 0.5985, test_loss: 1.2237, test_f1: 0.5929
 epoch: 53, train_loss: 0.5976, test_loss: 1.2352, test_f1: 0.6041
 epoch: 54, train_loss: 0.6236, test_loss: 1.2097, test_f1: 0.6219
 epoch: 55, train_loss: 0.5884, test_loss: 1.2253, test_f1: 0.6115
 epoch: 56, train_loss: 0.6038, test_loss: 1.2532, test_f1: 0.5958
 epoch: 57, train_loss: 0.5934, test_loss: 1.2481, test_f1: 0.6030
 epoch: 58, train_loss: 0.6036, test_loss: 1.2233, test_f1: 0.6189
 epoch: 59, train_loss: 0.5866, test_loss: 1.2726, test_f1: 0.6052
 epoch: 60, train_loss: 0.5940, test_loss: 1.2339, test_f1: 0.6239
 epoch: 61, train_loss: 0.5802, test_loss: 1.2751, test_f1: 0.6034
 epoch: 62, train_loss: 0.5862, test_loss: 1.2521, test_f1: 0.6106
 epoch: 63, train_loss: 0.5829, test_loss: 1.2683, test_f1: 0.6167
 epoch: 64, train_loss: 0.5813, test_loss: 1.2616, test_f1: 0.6204
 epoch: 65, train_loss: 0.5585, test_loss: 1.3269, test_f1: 0.5970
 epoch: 66, train_loss: 0.5551, test_loss: 1.2910, test_f1: 0.6196
 epoch: 67, train_loss: 0.5541, test_loss: 1.3295, test_f1: 0.5917
 epoch: 68, train_loss: 0.5464, test_loss: 1.3431, test_f1: 0.5816
 epoch: 69, train_loss: 0.5394, test_loss: 1.3639, test_f1: 0.5846
 epoch: 70, train_loss: 0.5572, test_loss: 1.3220, test_f1: 0.6198
 epoch: 71, train_loss: 0.5378, test_loss: 1.3185, test_f1: 0.6181
 epoch: 72, train_loss: 0.5510, test_loss: 1.3669, test_f1: 0.6033
 epoch: 73, train_loss: 0.5402, test_loss: 1.3386, test_f1: 0.6156
 epoch: 74, train_loss: 0.5396, test_loss: 1.3197, test_f1: 0.6383
 epoch: 75, train_loss: 0.5395, test_loss: 1.3570, test_f1: 0.6260
 epoch: 76, train_loss: 0.5425, test_loss: 1.3901, test_f1: 0.5784
 epoch: 77, train_loss: 0.5285, test_loss: 1.3959, test_f1: 0.5872
 epoch: 78, train_loss: 0.5394, test_loss: 1.4059, test_f1: 0.6067
 epoch: 79, train_loss: 0.5317, test_loss: 1.3979, test_f1: 0.5834
 epoch: 80, train_loss: 0.5223, test_loss: 1.3977, test_f1: 0.5906
 epoch: 81, train_loss: 0.5222, test_loss: 1.4086, test_f1: 0.5928
 epoch: 82, train_loss: 0.5095, test_loss: 1.4069, test_f1: 0.6148
 epoch: 83, train_loss: 0.5274, test_loss: 1.3927, test_f1: 0.6085
 epoch: 84, train_loss: 0.5111, test_loss: 1.4099, test_f1: 0.6212
 epoch: 85, train_loss: 0.4861, test_loss: 1.4288, test_f1: 0.6084
 epoch: 86, train_loss: 0.5187, test_loss: 1.4743, test_f1: 0.5777
 epoch: 87, train_loss: 0.4947, test_loss: 1.4552, test_f1: 0.5901
 epoch: 88, train_loss: 0.4836, test_loss: 1.4813, test_f1: 0.6010
 epoch: 89, train_loss: 0.4919, test_loss: 1.4936, test_f1: 0.5986
 epoch: 90, train_loss: 0.4918, test_loss: 1.4631, test_f1: 0.5954
 epoch: 91, train_loss: 0.5101, test_loss: 1.5100, test_f1: 0.6231
 epoch: 92, train_loss: 0.4975, test_loss: 1.5450, test_f1: 0.5819
 epoch: 93, train_loss: 0.5076, test_loss: 1.4248, test_f1: 0.6042
 epoch: 94, train_loss: 0.5021, test_loss: 1.5063, test_f1: 0.6133
 epoch: 95, train_loss: 0.4551, test_loss: 1.5035, test_f1: 0.6037
 epoch: 96, train_loss: 0.4901, test_loss: 1.5337, test_f1: 0.5846
 epoch: 97, train_loss: 0.4737, test_loss: 1.4920, test_f1: 0.6027
 epoch: 98, train_loss: 0.4824, test_loss: 1.5006, test_f1: 0.5893
 epoch: 99, train_loss: 0.5104, test_loss: 1.5236, test_f1: 0.6043
##################ITERATION #4 ****************************************
 epoch: 0, train_loss: 1.1906, test_loss: 1.1951, test_f1: 0.3699
 epoch: 1, train_loss: 1.0864, test_loss: 1.1019, test_f1: 0.4674
 epoch: 2, train_loss: 1.0300, test_loss: 1.0772, test_f1: 0.4758
 epoch: 3, train_loss: 1.0192, test_loss: 1.0649, test_f1: 0.4984
 epoch: 4, train_loss: 0.9940, test_loss: 1.0660, test_f1: 0.4966
 epoch: 5, train_loss: 0.9553, test_loss: 1.0523, test_f1: 0.5197
 epoch: 6, train_loss: 0.9691, test_loss: 1.0163, test_f1: 0.5566
 epoch: 7, train_loss: 0.9475, test_loss: 1.0280, test_f1: 0.5388
 epoch: 8, train_loss: 0.9266, test_loss: 1.0059, test_f1: 0.5545
 epoch: 9, train_loss: 0.9089, test_loss: 1.0168, test_f1: 0.5626
 epoch: 10, train_loss: 0.8888, test_loss: 1.0345, test_f1: 0.5519
 epoch: 11, train_loss: 0.8725, test_loss: 1.0422, test_f1: 0.5439
 epoch: 12, train_loss: 0.8788, test_loss: 1.0265, test_f1: 0.5687
 epoch: 13, train_loss: 0.8494, test_loss: 1.0490, test_f1: 0.5446
 epoch: 14, train_loss: 0.8593, test_loss: 0.9992, test_f1: 0.6008
 epoch: 15, train_loss: 0.8339, test_loss: 0.9908, test_f1: 0.5860
 epoch: 16, train_loss: 0.8342, test_loss: 1.0070, test_f1: 0.5646
 epoch: 17, train_loss: 0.8126, test_loss: 0.9864, test_f1: 0.6138
 epoch: 18, train_loss: 0.8173, test_loss: 0.9801, test_f1: 0.6029
 epoch: 19, train_loss: 0.8036, test_loss: 0.9844, test_f1: 0.6138
 epoch: 20, train_loss: 0.8122, test_loss: 1.0099, test_f1: 0.6263
 epoch: 21, train_loss: 0.7937, test_loss: 1.0253, test_f1: 0.6191
 epoch: 22, train_loss: 0.7771, test_loss: 0.9830, test_f1: 0.6165
 epoch: 23, train_loss: 0.7769, test_loss: 0.9910, test_f1: 0.6354
 epoch: 24, train_loss: 0.7739, test_loss: 0.9875, test_f1: 0.6405
 epoch: 25, train_loss: 0.7683, test_loss: 1.0235, test_f1: 0.6398
 epoch: 26, train_loss: 0.7450, test_loss: 1.0095, test_f1: 0.6326
 epoch: 27, train_loss: 0.7443, test_loss: 1.0218, test_f1: 0.6123
 epoch: 28, train_loss: 0.7290, test_loss: 0.9790, test_f1: 0.6155
 epoch: 29, train_loss: 0.7395, test_loss: 1.0244, test_f1: 0.6289
 epoch: 30, train_loss: 0.7274, test_loss: 1.0251, test_f1: 0.6327
 epoch: 31, train_loss: 0.6969, test_loss: 1.0501, test_f1: 0.6237
 epoch: 32, train_loss: 0.6991, test_loss: 1.0395, test_f1: 0.6179
 epoch: 33, train_loss: 0.6910, test_loss: 1.0115, test_f1: 0.6083
 epoch: 34, train_loss: 0.6882, test_loss: 1.1154, test_f1: 0.6245
 epoch: 35, train_loss: 0.6881, test_loss: 1.0699, test_f1: 0.6075
 epoch: 36, train_loss: 0.6634, test_loss: 1.0936, test_f1: 0.6217
 epoch: 37, train_loss: 0.6702, test_loss: 1.0729, test_f1: 0.6030
 epoch: 38, train_loss: 0.6446, test_loss: 1.0661, test_f1: 0.6366
 epoch: 39, train_loss: 0.6566, test_loss: 1.0503, test_f1: 0.6074
 epoch: 40, train_loss: 0.6313, test_loss: 1.0698, test_f1: 0.6152
 epoch: 41, train_loss: 0.6267, test_loss: 1.0988, test_f1: 0.6107
 epoch: 42, train_loss: 0.6361, test_loss: 1.0991, test_f1: 0.6385
 epoch: 43, train_loss: 0.6278, test_loss: 1.0932, test_f1: 0.6073
 epoch: 44, train_loss: 0.6342, test_loss: 1.1527, test_f1: 0.6167
 epoch: 45, train_loss: 0.6192, test_loss: 1.1754, test_f1: 0.6011
 epoch: 46, train_loss: 0.6267, test_loss: 1.1241, test_f1: 0.6081
 epoch: 47, train_loss: 0.5953, test_loss: 1.1974, test_f1: 0.6236
 epoch: 48, train_loss: 0.5884, test_loss: 1.1533, test_f1: 0.6389
 epoch: 49, train_loss: 0.6073, test_loss: 1.1849, test_f1: 0.6211
 epoch: 50, train_loss: 0.6033, test_loss: 1.1716, test_f1: 0.6236
 epoch: 51, train_loss: 0.5786, test_loss: 1.1741, test_f1: 0.6332
 epoch: 52, train_loss: 0.5604, test_loss: 1.1771, test_f1: 0.6440
 epoch: 53, train_loss: 0.5716, test_loss: 1.1774, test_f1: 0.6424
 epoch: 54, train_loss: 0.5696, test_loss: 1.1878, test_f1: 0.6522
 epoch: 55, train_loss: 0.5647, test_loss: 1.1597, test_f1: 0.6624
 epoch: 56, train_loss: 0.5614, test_loss: 1.1657, test_f1: 0.6243
 epoch: 57, train_loss: 0.5408, test_loss: 1.2056, test_f1: 0.6423
 epoch: 58, train_loss: 0.5678, test_loss: 1.2337, test_f1: 0.6134
 epoch: 59, train_loss: 0.5545, test_loss: 1.2124, test_f1: 0.6398
 epoch: 60, train_loss: 0.5372, test_loss: 1.1989, test_f1: 0.6305
 epoch: 61, train_loss: 0.5452, test_loss: 1.1899, test_f1: 0.6545
 epoch: 62, train_loss: 0.5236, test_loss: 1.2116, test_f1: 0.6404
 epoch: 63, train_loss: 0.5422, test_loss: 1.2050, test_f1: 0.6470
 epoch: 64, train_loss: 0.5366, test_loss: 1.1964, test_f1: 0.6492
 epoch: 65, train_loss: 0.5461, test_loss: 1.2462, test_f1: 0.6739
 epoch: 66, train_loss: 0.5378, test_loss: 1.2283, test_f1: 0.6282
 epoch: 67, train_loss: 0.5187, test_loss: 1.2602, test_f1: 0.6298
 epoch: 68, train_loss: 0.5392, test_loss: 1.2406, test_f1: 0.6358
 epoch: 69, train_loss: 0.5123, test_loss: 1.2882, test_f1: 0.6178
 epoch: 70, train_loss: 0.4987, test_loss: 1.3021, test_f1: 0.6382
 epoch: 71, train_loss: 0.4927, test_loss: 1.2324, test_f1: 0.6373
 epoch: 72, train_loss: 0.4926, test_loss: 1.2737, test_f1: 0.6568
 epoch: 73, train_loss: 0.5019, test_loss: 1.2571, test_f1: 0.6193
 epoch: 74, train_loss: 0.5186, test_loss: 1.2897, test_f1: 0.6528
 epoch: 75, train_loss: 0.4851, test_loss: 1.3406, test_f1: 0.6492
 epoch: 76, train_loss: 0.5096, test_loss: 1.2978, test_f1: 0.6586
 epoch: 77, train_loss: 0.5147, test_loss: 1.2503, test_f1: 0.6576
 epoch: 78, train_loss: 0.4824, test_loss: 1.2923, test_f1: 0.6383
 epoch: 79, train_loss: 0.4763, test_loss: 1.3502, test_f1: 0.6479
 epoch: 80, train_loss: 0.4668, test_loss: 1.3158, test_f1: 0.6685
 epoch: 81, train_loss: 0.4874, test_loss: 1.3262, test_f1: 0.6437
 epoch: 82, train_loss: 0.4713, test_loss: 1.3664, test_f1: 0.6469
 epoch: 83, train_loss: 0.4964, test_loss: 1.3563, test_f1: 0.6481
 epoch: 84, train_loss: 0.4745, test_loss: 1.2989, test_f1: 0.6328
 epoch: 85, train_loss: 0.4759, test_loss: 1.3276, test_f1: 0.6435
 epoch: 86, train_loss: 0.4690, test_loss: 1.3698, test_f1: 0.6060
 epoch: 87, train_loss: 0.4990, test_loss: 1.3638, test_f1: 0.6451
 epoch: 88, train_loss: 0.4704, test_loss: 1.3583, test_f1: 0.6321
 epoch: 89, train_loss: 0.4686, test_loss: 1.3533, test_f1: 0.6594
 epoch: 90, train_loss: 0.4344, test_loss: 1.3476, test_f1: 0.6727
 epoch: 91, train_loss: 0.4669, test_loss: 1.3772, test_f1: 0.6418
 epoch: 92, train_loss: 0.4629, test_loss: 1.3613, test_f1: 0.6549
 epoch: 93, train_loss: 0.4766, test_loss: 1.3547, test_f1: 0.6356
 epoch: 94, train_loss: 0.4541, test_loss: 1.3516, test_f1: 0.6619
 epoch: 95, train_loss: 0.4341, test_loss: 1.3718, test_f1: 0.6751
 epoch: 96, train_loss: 0.4599, test_loss: 1.3702, test_f1: 0.6461
 epoch: 97, train_loss: 0.4504, test_loss: 1.4653, test_f1: 0.6430
 epoch: 98, train_loss: 0.4437, test_loss: 1.3648, test_f1: 0.6600
 epoch: 99, train_loss: 0.4438, test_loss: 1.4283, test_f1: 0.6603
##################ITERATION #5 ****************************************
 epoch: 0, train_loss: 1.2045, test_loss: 1.2002, test_f1: 0.4463
 epoch: 1, train_loss: 1.1063, test_loss: 1.1313, test_f1: 0.4593
 epoch: 2, train_loss: 1.0589, test_loss: 1.1171, test_f1: 0.4946
 epoch: 3, train_loss: 1.0329, test_loss: 1.0949, test_f1: 0.4935
 epoch: 4, train_loss: 0.9929, test_loss: 1.1027, test_f1: 0.4834
 epoch: 5, train_loss: 0.9933, test_loss: 1.0969, test_f1: 0.4768
 epoch: 6, train_loss: 0.9766, test_loss: 1.0678, test_f1: 0.5041
 epoch: 7, train_loss: 0.9431, test_loss: 1.0593, test_f1: 0.5115
 epoch: 8, train_loss: 0.9438, test_loss: 1.0554, test_f1: 0.4990
 epoch: 9, train_loss: 0.9164, test_loss: 1.0376, test_f1: 0.5444
 epoch: 10, train_loss: 0.9138, test_loss: 1.0366, test_f1: 0.5077
 epoch: 11, train_loss: 0.9118, test_loss: 1.0295, test_f1: 0.5272
 epoch: 12, train_loss: 0.8950, test_loss: 1.0479, test_f1: 0.5122
 epoch: 13, train_loss: 0.8679, test_loss: 1.0159, test_f1: 0.5513
 epoch: 14, train_loss: 0.8659, test_loss: 1.0244, test_f1: 0.5591
 epoch: 15, train_loss: 0.8626, test_loss: 1.0214, test_f1: 0.5623
 epoch: 16, train_loss: 0.8438, test_loss: 1.0248, test_f1: 0.5482
 epoch: 17, train_loss: 0.8369, test_loss: 1.0187, test_f1: 0.5688
 epoch: 18, train_loss: 0.8425, test_loss: 1.0369, test_f1: 0.5912
 epoch: 19, train_loss: 0.8290, test_loss: 1.0181, test_f1: 0.5849
 epoch: 20, train_loss: 0.8159, test_loss: 1.0368, test_f1: 0.5687
 epoch: 21, train_loss: 0.8132, test_loss: 1.0305, test_f1: 0.5683
 epoch: 22, train_loss: 0.8112, test_loss: 1.0244, test_f1: 0.5950
 epoch: 23, train_loss: 0.7820, test_loss: 1.0721, test_f1: 0.5847
 epoch: 24, train_loss: 0.7958, test_loss: 1.0304, test_f1: 0.5736
 epoch: 25, train_loss: 0.7874, test_loss: 1.0200, test_f1: 0.5968
 epoch: 26, train_loss: 0.7901, test_loss: 1.0229, test_f1: 0.6234
 epoch: 27, train_loss: 0.7750, test_loss: 1.0529, test_f1: 0.5947
 epoch: 28, train_loss: 0.7805, test_loss: 1.0022, test_f1: 0.6498
 epoch: 29, train_loss: 0.7651, test_loss: 1.0351, test_f1: 0.6077
 epoch: 30, train_loss: 0.7478, test_loss: 1.0302, test_f1: 0.6132
 epoch: 31, train_loss: 0.7342, test_loss: 1.0442, test_f1: 0.6086
 epoch: 32, train_loss: 0.7379, test_loss: 1.0148, test_f1: 0.6320
 epoch: 33, train_loss: 0.7309, test_loss: 1.0133, test_f1: 0.6150
 epoch: 34, train_loss: 0.7171, test_loss: 1.0080, test_f1: 0.6067
 epoch: 35, train_loss: 0.7110, test_loss: 1.0273, test_f1: 0.6352
 epoch: 36, train_loss: 0.7056, test_loss: 1.0539, test_f1: 0.6145
 epoch: 37, train_loss: 0.7070, test_loss: 1.0094, test_f1: 0.6286
 epoch: 38, train_loss: 0.6887, test_loss: 1.0145, test_f1: 0.6335
 epoch: 39, train_loss: 0.7001, test_loss: 1.0553, test_f1: 0.6219
 epoch: 40, train_loss: 0.6696, test_loss: 1.0520, test_f1: 0.6223
 epoch: 41, train_loss: 0.6801, test_loss: 1.0715, test_f1: 0.5950
 epoch: 42, train_loss: 0.6835, test_loss: 1.0555, test_f1: 0.6121
 epoch: 43, train_loss: 0.6669, test_loss: 1.0660, test_f1: 0.6378
 epoch: 44, train_loss: 0.6652, test_loss: 1.1344, test_f1: 0.6294
 epoch: 45, train_loss: 0.6868, test_loss: 1.1034, test_f1: 0.6178
 epoch: 46, train_loss: 0.6632, test_loss: 1.1107, test_f1: 0.6405
 epoch: 47, train_loss: 0.6402, test_loss: 1.1038, test_f1: 0.6478
 epoch: 48, train_loss: 0.6448, test_loss: 1.1079, test_f1: 0.6326
 epoch: 49, train_loss: 0.6501, test_loss: 1.0816, test_f1: 0.6424
 epoch: 50, train_loss: 0.6320, test_loss: 1.1153, test_f1: 0.5970
 epoch: 51, train_loss: 0.6242, test_loss: 1.0926, test_f1: 0.6375
 epoch: 52, train_loss: 0.6053, test_loss: 1.1235, test_f1: 0.6258
 epoch: 53, train_loss: 0.6090, test_loss: 1.1289, test_f1: 0.6123
 epoch: 54, train_loss: 0.6066, test_loss: 1.1179, test_f1: 0.6436
 epoch: 55, train_loss: 0.5951, test_loss: 1.1214, test_f1: 0.6451
 epoch: 56, train_loss: 0.5957, test_loss: 1.1331, test_f1: 0.6335
 epoch: 57, train_loss: 0.5956, test_loss: 1.0924, test_f1: 0.6424
 epoch: 58, train_loss: 0.6009, test_loss: 1.1325, test_f1: 0.6432
 epoch: 59, train_loss: 0.5835, test_loss: 1.1246, test_f1: 0.6365
 epoch: 60, train_loss: 0.5847, test_loss: 1.1630, test_f1: 0.6181
 epoch: 61, train_loss: 0.5808, test_loss: 1.1210, test_f1: 0.6326
 epoch: 62, train_loss: 0.5828, test_loss: 1.1896, test_f1: 0.6087
 epoch: 63, train_loss: 0.5790, test_loss: 1.1254, test_f1: 0.6347
 epoch: 64, train_loss: 0.5569, test_loss: 1.2114, test_f1: 0.6149
 epoch: 65, train_loss: 0.5720, test_loss: 1.1925, test_f1: 0.6117
 epoch: 66, train_loss: 0.5682, test_loss: 1.1534, test_f1: 0.6186
 epoch: 67, train_loss: 0.5535, test_loss: 1.1777, test_f1: 0.6398
 epoch: 68, train_loss: 0.5678, test_loss: 1.1769, test_f1: 0.6487
 epoch: 69, train_loss: 0.5538, test_loss: 1.1953, test_f1: 0.6232
 epoch: 70, train_loss: 0.5457, test_loss: 1.1885, test_f1: 0.6231
 epoch: 71, train_loss: 0.5486, test_loss: 1.2149, test_f1: 0.6199
 epoch: 72, train_loss: 0.5667, test_loss: 1.1894, test_f1: 0.6171
 epoch: 73, train_loss: 0.5530, test_loss: 1.2315, test_f1: 0.6202
 epoch: 74, train_loss: 0.5511, test_loss: 1.2561, test_f1: 0.6051
 epoch: 75, train_loss: 0.5316, test_loss: 1.2510, test_f1: 0.6105
 epoch: 76, train_loss: 0.5373, test_loss: 1.2168, test_f1: 0.6556
 epoch: 77, train_loss: 0.5359, test_loss: 1.2357, test_f1: 0.6099
 epoch: 78, train_loss: 0.5435, test_loss: 1.2254, test_f1: 0.6315
 epoch: 79, train_loss: 0.5285, test_loss: 1.2235, test_f1: 0.6246
 epoch: 80, train_loss: 0.5259, test_loss: 1.2583, test_f1: 0.6206
 epoch: 81, train_loss: 0.5391, test_loss: 1.2316, test_f1: 0.6407
 epoch: 82, train_loss: 0.5440, test_loss: 1.2675, test_f1: 0.6166
 epoch: 83, train_loss: 0.5286, test_loss: 1.2476, test_f1: 0.6348
 epoch: 84, train_loss: 0.5162, test_loss: 1.2595, test_f1: 0.6222
 epoch: 85, train_loss: 0.5088, test_loss: 1.3085, test_f1: 0.6099
 epoch: 86, train_loss: 0.5220, test_loss: 1.3053, test_f1: 0.6229
 epoch: 87, train_loss: 0.5137, test_loss: 1.2838, test_f1: 0.6024
 epoch: 88, train_loss: 0.5049, test_loss: 1.3113, test_f1: 0.6225
 epoch: 89, train_loss: 0.5151, test_loss: 1.3315, test_f1: 0.6362
 epoch: 90, train_loss: 0.5130, test_loss: 1.2763, test_f1: 0.6435
 epoch: 91, train_loss: 0.4966, test_loss: 1.3447, test_f1: 0.6379
 epoch: 92, train_loss: 0.4971, test_loss: 1.3318, test_f1: 0.6223
 epoch: 93, train_loss: 0.4954, test_loss: 1.2952, test_f1: 0.6281
 epoch: 94, train_loss: 0.5005, test_loss: 1.4023, test_f1: 0.6094
 epoch: 95, train_loss: 0.4914, test_loss: 1.3938, test_f1: 0.6111
 epoch: 96, train_loss: 0.5049, test_loss: 1.4003, test_f1: 0.6007
 epoch: 97, train_loss: 0.4890, test_loss: 1.3685, test_f1: 0.6224
 epoch: 98, train_loss: 0.4770, test_loss: 1.3583, test_f1: 0.6074
 epoch: 99, train_loss: 0.4833, test_loss: 1.3761, test_f1: 0.6109
##################ITERATION #6 ****************************************
 epoch: 0, train_loss: 1.2426, test_loss: 1.2126, test_f1: 0.3587
 epoch: 1, train_loss: 1.0911, test_loss: 1.1459, test_f1: 0.4898
 epoch: 2, train_loss: 1.0494, test_loss: 1.1233, test_f1: 0.4975
 epoch: 3, train_loss: 1.0273, test_loss: 1.1244, test_f1: 0.4911
 epoch: 4, train_loss: 1.0082, test_loss: 1.1105, test_f1: 0.5025
 epoch: 5, train_loss: 0.9971, test_loss: 1.1133, test_f1: 0.5142
 epoch: 6, train_loss: 0.9699, test_loss: 1.0798, test_f1: 0.4956
 epoch: 7, train_loss: 0.9377, test_loss: 1.0831, test_f1: 0.5230
 epoch: 8, train_loss: 0.9207, test_loss: 1.0623, test_f1: 0.5341
 epoch: 9, train_loss: 0.9256, test_loss: 1.0688, test_f1: 0.5200
 epoch: 10, train_loss: 0.9053, test_loss: 1.0669, test_f1: 0.5413
 epoch: 11, train_loss: 0.8896, test_loss: 1.0425, test_f1: 0.5499
 epoch: 12, train_loss: 0.8821, test_loss: 1.0395, test_f1: 0.5498
 epoch: 13, train_loss: 0.8820, test_loss: 1.0484, test_f1: 0.5515
 epoch: 14, train_loss: 0.8722, test_loss: 1.0474, test_f1: 0.5667
 epoch: 15, train_loss: 0.8521, test_loss: 1.0407, test_f1: 0.6026
 epoch: 16, train_loss: 0.8622, test_loss: 1.0414, test_f1: 0.5872
 epoch: 17, train_loss: 0.8262, test_loss: 1.0462, test_f1: 0.5680
 epoch: 18, train_loss: 0.8304, test_loss: 1.0177, test_f1: 0.5898
 epoch: 19, train_loss: 0.8260, test_loss: 1.0034, test_f1: 0.6161
 epoch: 20, train_loss: 0.8237, test_loss: 1.0294, test_f1: 0.6191
 epoch: 21, train_loss: 0.7962, test_loss: 1.0272, test_f1: 0.6064
 epoch: 22, train_loss: 0.8013, test_loss: 1.0209, test_f1: 0.5879
 epoch: 23, train_loss: 0.8068, test_loss: 1.0116, test_f1: 0.6279
 epoch: 24, train_loss: 0.7765, test_loss: 1.0231, test_f1: 0.6262
 epoch: 25, train_loss: 0.7713, test_loss: 1.0342, test_f1: 0.5850
 epoch: 26, train_loss: 0.7682, test_loss: 1.0062, test_f1: 0.6457
 epoch: 27, train_loss: 0.7632, test_loss: 1.0108, test_f1: 0.6330
 epoch: 28, train_loss: 0.7513, test_loss: 0.9926, test_f1: 0.6297
 epoch: 29, train_loss: 0.7544, test_loss: 1.0256, test_f1: 0.6093
 epoch: 30, train_loss: 0.7340, test_loss: 1.0117, test_f1: 0.6317
 epoch: 31, train_loss: 0.7377, test_loss: 1.0308, test_f1: 0.6151
 epoch: 32, train_loss: 0.7240, test_loss: 1.0076, test_f1: 0.6265
 epoch: 33, train_loss: 0.7197, test_loss: 0.9850, test_f1: 0.6244
 epoch: 34, train_loss: 0.7187, test_loss: 1.0095, test_f1: 0.6532
 epoch: 35, train_loss: 0.7189, test_loss: 1.0628, test_f1: 0.6117
 epoch: 36, train_loss: 0.6995, test_loss: 1.0334, test_f1: 0.6276
 epoch: 37, train_loss: 0.7198, test_loss: 1.0222, test_f1: 0.6561
 epoch: 38, train_loss: 0.6869, test_loss: 1.0158, test_f1: 0.6366
 epoch: 39, train_loss: 0.7024, test_loss: 1.0168, test_f1: 0.6230
 epoch: 40, train_loss: 0.6773, test_loss: 1.0152, test_f1: 0.6614
 epoch: 41, train_loss: 0.6717, test_loss: 1.0023, test_f1: 0.6156
 epoch: 42, train_loss: 0.6873, test_loss: 1.0469, test_f1: 0.6344
 epoch: 43, train_loss: 0.6608, test_loss: 1.0421, test_f1: 0.6433
 epoch: 44, train_loss: 0.6420, test_loss: 1.0316, test_f1: 0.6404
 epoch: 45, train_loss: 0.6594, test_loss: 1.0562, test_f1: 0.6735
 epoch: 46, train_loss: 0.6295, test_loss: 1.0630, test_f1: 0.6746
 epoch: 47, train_loss: 0.6245, test_loss: 1.0532, test_f1: 0.6437
 epoch: 48, train_loss: 0.6578, test_loss: 1.0845, test_f1: 0.6421
 epoch: 49, train_loss: 0.6387, test_loss: 1.1136, test_f1: 0.6234
 epoch: 50, train_loss: 0.6244, test_loss: 1.0797, test_f1: 0.6174
 epoch: 51, train_loss: 0.5983, test_loss: 1.0735, test_f1: 0.6320
 epoch: 52, train_loss: 0.5905, test_loss: 1.0964, test_f1: 0.6360
 epoch: 53, train_loss: 0.5950, test_loss: 1.1171, test_f1: 0.6254
 epoch: 54, train_loss: 0.6017, test_loss: 1.1151, test_f1: 0.6267
 epoch: 55, train_loss: 0.5856, test_loss: 1.0868, test_f1: 0.6255
 epoch: 56, train_loss: 0.5979, test_loss: 1.1161, test_f1: 0.6319
 epoch: 57, train_loss: 0.5922, test_loss: 1.0912, test_f1: 0.6282
 epoch: 58, train_loss: 0.5806, test_loss: 1.1075, test_f1: 0.6462
 epoch: 59, train_loss: 0.5645, test_loss: 1.1401, test_f1: 0.6287
 epoch: 60, train_loss: 0.5804, test_loss: 1.1498, test_f1: 0.6543
 epoch: 61, train_loss: 0.5916, test_loss: 1.1379, test_f1: 0.6522
 epoch: 62, train_loss: 0.5742, test_loss: 1.1318, test_f1: 0.6341
 epoch: 63, train_loss: 0.5860, test_loss: 1.1319, test_f1: 0.6201
 epoch: 64, train_loss: 0.5520, test_loss: 1.1479, test_f1: 0.6312
 epoch: 65, train_loss: 0.5648, test_loss: 1.1553, test_f1: 0.6118
 epoch: 66, train_loss: 0.5533, test_loss: 1.1728, test_f1: 0.6260
 epoch: 67, train_loss: 0.5605, test_loss: 1.1369, test_f1: 0.6199
 epoch: 68, train_loss: 0.5590, test_loss: 1.1529, test_f1: 0.6383
 epoch: 69, train_loss: 0.5481, test_loss: 1.1300, test_f1: 0.6438
 epoch: 70, train_loss: 0.5589, test_loss: 1.1698, test_f1: 0.6412
 epoch: 71, train_loss: 0.5316, test_loss: 1.1767, test_f1: 0.6338
 epoch: 72, train_loss: 0.5426, test_loss: 1.1816, test_f1: 0.6187
 epoch: 73, train_loss: 0.5520, test_loss: 1.1945, test_f1: 0.6442
 epoch: 74, train_loss: 0.5079, test_loss: 1.1857, test_f1: 0.6309
 epoch: 75, train_loss: 0.5418, test_loss: 1.1845, test_f1: 0.6332
 epoch: 76, train_loss: 0.5336, test_loss: 1.1954, test_f1: 0.6248
 epoch: 77, train_loss: 0.5353, test_loss: 1.1884, test_f1: 0.6305
 epoch: 78, train_loss: 0.5168, test_loss: 1.1911, test_f1: 0.6493
 epoch: 79, train_loss: 0.5078, test_loss: 1.2159, test_f1: 0.6365
 epoch: 80, train_loss: 0.5059, test_loss: 1.1999, test_f1: 0.6439
 epoch: 81, train_loss: 0.5240, test_loss: 1.2265, test_f1: 0.6290
 epoch: 82, train_loss: 0.5073, test_loss: 1.2357, test_f1: 0.6261
 epoch: 83, train_loss: 0.5176, test_loss: 1.2074, test_f1: 0.6424
 epoch: 84, train_loss: 0.5022, test_loss: 1.2404, test_f1: 0.6202
 epoch: 85, train_loss: 0.4918, test_loss: 1.2238, test_f1: 0.6413
 epoch: 86, train_loss: 0.5116, test_loss: 1.2273, test_f1: 0.6303
 epoch: 87, train_loss: 0.5094, test_loss: 1.2718, test_f1: 0.6306
 epoch: 88, train_loss: 0.5123, test_loss: 1.2668, test_f1: 0.6285
 epoch: 89, train_loss: 0.4916, test_loss: 1.2265, test_f1: 0.6336
 epoch: 90, train_loss: 0.4859, test_loss: 1.2449, test_f1: 0.6278
 epoch: 91, train_loss: 0.4836, test_loss: 1.2638, test_f1: 0.6489
 epoch: 92, train_loss: 0.4884, test_loss: 1.2496, test_f1: 0.6278
 epoch: 93, train_loss: 0.4804, test_loss: 1.3014, test_f1: 0.6287
 epoch: 94, train_loss: 0.4957, test_loss: 1.3165, test_f1: 0.6453
 epoch: 95, train_loss: 0.4826, test_loss: 1.3220, test_f1: 0.6438
 epoch: 96, train_loss: 0.4774, test_loss: 1.3481, test_f1: 0.6359
 epoch: 97, train_loss: 0.4684, test_loss: 1.3250, test_f1: 0.6360
 epoch: 98, train_loss: 0.4870, test_loss: 1.3219, test_f1: 0.6292
 epoch: 99, train_loss: 0.4812, test_loss: 1.3807, test_f1: 0.6068
##################ITERATION #7 ****************************************
 epoch: 0, train_loss: 1.2887, test_loss: 1.2232, test_f1: 0.3771
 epoch: 1, train_loss: 1.1028, test_loss: 1.1584, test_f1: 0.4698
 epoch: 2, train_loss: 1.0522, test_loss: 1.1299, test_f1: 0.5010
 epoch: 3, train_loss: 1.0313, test_loss: 1.1265, test_f1: 0.4854
 epoch: 4, train_loss: 1.0342, test_loss: 1.1158, test_f1: 0.5034
 epoch: 5, train_loss: 0.9764, test_loss: 1.1064, test_f1: 0.4983
 epoch: 6, train_loss: 0.9831, test_loss: 1.0855, test_f1: 0.5263
 epoch: 7, train_loss: 0.9534, test_loss: 1.0631, test_f1: 0.5310
 epoch: 8, train_loss: 0.9560, test_loss: 1.0636, test_f1: 0.5090
 epoch: 9, train_loss: 0.9461, test_loss: 1.0702, test_f1: 0.5235
 epoch: 10, train_loss: 0.9212, test_loss: 1.0371, test_f1: 0.5324
 epoch: 11, train_loss: 0.9116, test_loss: 1.0183, test_f1: 0.5251
 epoch: 12, train_loss: 0.8995, test_loss: 1.0325, test_f1: 0.5538
 epoch: 13, train_loss: 0.8809, test_loss: 1.0464, test_f1: 0.5488
 epoch: 14, train_loss: 0.8704, test_loss: 1.0350, test_f1: 0.5608
 epoch: 15, train_loss: 0.8599, test_loss: 1.0382, test_f1: 0.5712
 epoch: 16, train_loss: 0.8662, test_loss: 1.0190, test_f1: 0.5702
 epoch: 17, train_loss: 0.8394, test_loss: 1.0087, test_f1: 0.5768
 epoch: 18, train_loss: 0.8495, test_loss: 1.0118, test_f1: 0.5932
 epoch: 19, train_loss: 0.8297, test_loss: 1.0306, test_f1: 0.5901
 epoch: 20, train_loss: 0.8413, test_loss: 1.0038, test_f1: 0.5812
 epoch: 21, train_loss: 0.8182, test_loss: 1.0267, test_f1: 0.5908
 epoch: 22, train_loss: 0.8333, test_loss: 1.0068, test_f1: 0.5801
 epoch: 23, train_loss: 0.8028, test_loss: 1.0135, test_f1: 0.5954
 epoch: 24, train_loss: 0.7986, test_loss: 1.0067, test_f1: 0.5778
 epoch: 25, train_loss: 0.7968, test_loss: 1.0006, test_f1: 0.6131
 epoch: 26, train_loss: 0.8044, test_loss: 1.0006, test_f1: 0.6121
 epoch: 27, train_loss: 0.7726, test_loss: 1.0108, test_f1: 0.6090
 epoch: 28, train_loss: 0.7790, test_loss: 1.0342, test_f1: 0.5754
 epoch: 29, train_loss: 0.7681, test_loss: 1.0254, test_f1: 0.6009
 epoch: 30, train_loss: 0.7813, test_loss: 1.0333, test_f1: 0.6070
 epoch: 31, train_loss: 0.7547, test_loss: 1.0419, test_f1: 0.5991
 epoch: 32, train_loss: 0.7521, test_loss: 1.0521, test_f1: 0.5980
 epoch: 33, train_loss: 0.7446, test_loss: 1.0457, test_f1: 0.6227
 epoch: 34, train_loss: 0.7301, test_loss: 1.0740, test_f1: 0.6035
 epoch: 35, train_loss: 0.7130, test_loss: 1.0444, test_f1: 0.6132
 epoch: 36, train_loss: 0.7342, test_loss: 1.0412, test_f1: 0.6034
 epoch: 37, train_loss: 0.7148, test_loss: 1.0656, test_f1: 0.6114
 epoch: 38, train_loss: 0.7241, test_loss: 1.0488, test_f1: 0.6143
 epoch: 39, train_loss: 0.7296, test_loss: 1.0767, test_f1: 0.6277
 epoch: 40, train_loss: 0.7021, test_loss: 1.0919, test_f1: 0.6038
 epoch: 41, train_loss: 0.6906, test_loss: 1.0895, test_f1: 0.6136
 epoch: 42, train_loss: 0.6899, test_loss: 1.1011, test_f1: 0.6113
 epoch: 43, train_loss: 0.6754, test_loss: 1.0606, test_f1: 0.6297
 epoch: 44, train_loss: 0.6697, test_loss: 1.0653, test_f1: 0.6233
 epoch: 45, train_loss: 0.6685, test_loss: 1.1087, test_f1: 0.6225
 epoch: 46, train_loss: 0.6520, test_loss: 1.1071, test_f1: 0.6227
 epoch: 47, train_loss: 0.6592, test_loss: 1.1160, test_f1: 0.6015
 epoch: 48, train_loss: 0.6385, test_loss: 1.1475, test_f1: 0.6030
 epoch: 49, train_loss: 0.6368, test_loss: 1.1229, test_f1: 0.6100
 epoch: 50, train_loss: 0.6256, test_loss: 1.0928, test_f1: 0.6198
 epoch: 51, train_loss: 0.6214, test_loss: 1.0947, test_f1: 0.6244
 epoch: 52, train_loss: 0.6373, test_loss: 1.0950, test_f1: 0.6298
 epoch: 53, train_loss: 0.6034, test_loss: 1.1174, test_f1: 0.6220
 epoch: 54, train_loss: 0.6049, test_loss: 1.1316, test_f1: 0.6316
 epoch: 55, train_loss: 0.6093, test_loss: 1.1629, test_f1: 0.6144
 epoch: 56, train_loss: 0.6076, test_loss: 1.1454, test_f1: 0.6243
 epoch: 57, train_loss: 0.5896, test_loss: 1.1543, test_f1: 0.6205
 epoch: 58, train_loss: 0.5960, test_loss: 1.1731, test_f1: 0.6274
 epoch: 59, train_loss: 0.5798, test_loss: 1.2099, test_f1: 0.6094
 epoch: 60, train_loss: 0.6036, test_loss: 1.1795, test_f1: 0.6283
 epoch: 61, train_loss: 0.5905, test_loss: 1.1596, test_f1: 0.6261
 epoch: 62, train_loss: 0.5712, test_loss: 1.1552, test_f1: 0.6220
 epoch: 63, train_loss: 0.5999, test_loss: 1.1883, test_f1: 0.6221
 epoch: 64, train_loss: 0.6127, test_loss: 1.1770, test_f1: 0.6198
 epoch: 65, train_loss: 0.5771, test_loss: 1.1809, test_f1: 0.6321
 epoch: 66, train_loss: 0.5625, test_loss: 1.1825, test_f1: 0.6226
 epoch: 67, train_loss: 0.5719, test_loss: 1.1742, test_f1: 0.6324
 epoch: 68, train_loss: 0.5752, test_loss: 1.2038, test_f1: 0.6211
 epoch: 69, train_loss: 0.5736, test_loss: 1.2228, test_f1: 0.6068
 epoch: 70, train_loss: 0.5833, test_loss: 1.1964, test_f1: 0.6219
 epoch: 71, train_loss: 0.5665, test_loss: 1.1958, test_f1: 0.6275
 epoch: 72, train_loss: 0.5501, test_loss: 1.2235, test_f1: 0.6396
 epoch: 73, train_loss: 0.5658, test_loss: 1.2186, test_f1: 0.6371
 epoch: 74, train_loss: 0.5462, test_loss: 1.2157, test_f1: 0.6402
 epoch: 75, train_loss: 0.5754, test_loss: 1.2485, test_f1: 0.6320
 epoch: 76, train_loss: 0.5454, test_loss: 1.2531, test_f1: 0.6319
 epoch: 77, train_loss: 0.5413, test_loss: 1.2498, test_f1: 0.6266
 epoch: 78, train_loss: 0.5574, test_loss: 1.2564, test_f1: 0.6404
 epoch: 79, train_loss: 0.5539, test_loss: 1.2178, test_f1: 0.6382
 epoch: 80, train_loss: 0.5453, test_loss: 1.2759, test_f1: 0.6206
 epoch: 81, train_loss: 0.5396, test_loss: 1.2720, test_f1: 0.6304
 epoch: 82, train_loss: 0.5352, test_loss: 1.2805, test_f1: 0.6253
 epoch: 83, train_loss: 0.5312, test_loss: 1.3096, test_f1: 0.6287
 epoch: 84, train_loss: 0.5188, test_loss: 1.2809, test_f1: 0.6499
 epoch: 85, train_loss: 0.5208, test_loss: 1.2671, test_f1: 0.6282
 epoch: 86, train_loss: 0.5227, test_loss: 1.2840, test_f1: 0.6322
 epoch: 87, train_loss: 0.5126, test_loss: 1.3201, test_f1: 0.6250
 epoch: 88, train_loss: 0.5268, test_loss: 1.2838, test_f1: 0.6480
 epoch: 89, train_loss: 0.5054, test_loss: 1.3183, test_f1: 0.6353
 epoch: 90, train_loss: 0.5081, test_loss: 1.2868, test_f1: 0.6477
 epoch: 91, train_loss: 0.5011, test_loss: 1.3695, test_f1: 0.6429
 epoch: 92, train_loss: 0.5107, test_loss: 1.3629, test_f1: 0.6199
 epoch: 93, train_loss: 0.5100, test_loss: 1.4319, test_f1: 0.6201
 epoch: 94, train_loss: 0.4956, test_loss: 1.3780, test_f1: 0.6238
 epoch: 95, train_loss: 0.5020, test_loss: 1.3814, test_f1: 0.6149
 epoch: 96, train_loss: 0.5073, test_loss: 1.4047, test_f1: 0.6158
 epoch: 97, train_loss: 0.4865, test_loss: 1.3864, test_f1: 0.6250
 epoch: 98, train_loss: 0.4948, test_loss: 1.4052, test_f1: 0.6325
 epoch: 99, train_loss: 0.4724, test_loss: 1.4215, test_f1: 0.6162
##################ITERATION #8 ****************************************
 epoch: 0, train_loss: 1.2759, test_loss: 1.2070, test_f1: 0.4131
 epoch: 1, train_loss: 1.1009, test_loss: 1.1068, test_f1: 0.5134
 epoch: 2, train_loss: 1.0765, test_loss: 1.1206, test_f1: 0.5280
 epoch: 3, train_loss: 1.0457, test_loss: 1.0880, test_f1: 0.5200
 epoch: 4, train_loss: 1.0124, test_loss: 1.0548, test_f1: 0.5467
 epoch: 5, train_loss: 0.9936, test_loss: 1.0482, test_f1: 0.5653
 epoch: 6, train_loss: 0.9716, test_loss: 1.0424, test_f1: 0.5554
 epoch: 7, train_loss: 0.9378, test_loss: 1.0524, test_f1: 0.5599
 epoch: 8, train_loss: 0.9336, test_loss: 1.0376, test_f1: 0.5584
 epoch: 9, train_loss: 0.9360, test_loss: 1.0257, test_f1: 0.5850
 epoch: 10, train_loss: 0.9098, test_loss: 1.0350, test_f1: 0.5900
 epoch: 11, train_loss: 0.8961, test_loss: 1.0292, test_f1: 0.5918
 epoch: 12, train_loss: 0.8936, test_loss: 1.0367, test_f1: 0.6141
 epoch: 13, train_loss: 0.8822, test_loss: 1.0129, test_f1: 0.6047
 epoch: 14, train_loss: 0.8762, test_loss: 1.0305, test_f1: 0.5869
 epoch: 15, train_loss: 0.8417, test_loss: 1.0161, test_f1: 0.6146
 epoch: 16, train_loss: 0.8501, test_loss: 1.0083, test_f1: 0.5973
 epoch: 17, train_loss: 0.8289, test_loss: 1.0387, test_f1: 0.5898
 epoch: 18, train_loss: 0.8314, test_loss: 1.0296, test_f1: 0.6159
 epoch: 19, train_loss: 0.8161, test_loss: 1.0203, test_f1: 0.5838
 epoch: 20, train_loss: 0.7976, test_loss: 1.0100, test_f1: 0.6084
 epoch: 21, train_loss: 0.7866, test_loss: 1.0206, test_f1: 0.6160
 epoch: 22, train_loss: 0.7785, test_loss: 1.0248, test_f1: 0.6314
 epoch: 23, train_loss: 0.7844, test_loss: 1.0257, test_f1: 0.6340
 epoch: 24, train_loss: 0.7774, test_loss: 1.0434, test_f1: 0.6273
 epoch: 25, train_loss: 0.7749, test_loss: 1.0687, test_f1: 0.6331
 epoch: 26, train_loss: 0.7627, test_loss: 1.0301, test_f1: 0.6483
 epoch: 27, train_loss: 0.7551, test_loss: 1.0199, test_f1: 0.6531
 epoch: 28, train_loss: 0.7476, test_loss: 1.0645, test_f1: 0.6350
 epoch: 29, train_loss: 0.7394, test_loss: 1.0065, test_f1: 0.6194
 epoch: 30, train_loss: 0.7401, test_loss: 1.0601, test_f1: 0.6034
 epoch: 31, train_loss: 0.7272, test_loss: 1.0313, test_f1: 0.6310
 epoch: 32, train_loss: 0.7243, test_loss: 1.0578, test_f1: 0.6050
 epoch: 33, train_loss: 0.7204, test_loss: 1.0572, test_f1: 0.6342
 epoch: 34, train_loss: 0.6983, test_loss: 1.0938, test_f1: 0.6188
 epoch: 35, train_loss: 0.6940, test_loss: 1.0911, test_f1: 0.6360
 epoch: 36, train_loss: 0.6854, test_loss: 1.0788, test_f1: 0.6519
 epoch: 37, train_loss: 0.6886, test_loss: 1.1397, test_f1: 0.6077
 epoch: 38, train_loss: 0.6863, test_loss: 1.1007, test_f1: 0.6621
 epoch: 39, train_loss: 0.6634, test_loss: 1.0802, test_f1: 0.6318
 epoch: 40, train_loss: 0.6680, test_loss: 1.0586, test_f1: 0.6434
 epoch: 41, train_loss: 0.6972, test_loss: 1.0519, test_f1: 0.6727
 epoch: 42, train_loss: 0.6657, test_loss: 1.1013, test_f1: 0.6336
 epoch: 43, train_loss: 0.6600, test_loss: 1.0765, test_f1: 0.6320
 epoch: 44, train_loss: 0.6628, test_loss: 1.0454, test_f1: 0.6539
 epoch: 45, train_loss: 0.6457, test_loss: 1.0849, test_f1: 0.6499
 epoch: 46, train_loss: 0.6400, test_loss: 1.0817, test_f1: 0.6315
 epoch: 47, train_loss: 0.6325, test_loss: 1.1592, test_f1: 0.5993
 epoch: 48, train_loss: 0.6429, test_loss: 1.1105, test_f1: 0.6301
 epoch: 49, train_loss: 0.6236, test_loss: 1.0519, test_f1: 0.6478
 epoch: 50, train_loss: 0.6107, test_loss: 1.1561, test_f1: 0.6438
 epoch: 51, train_loss: 0.6025, test_loss: 1.1659, test_f1: 0.6271
 epoch: 52, train_loss: 0.5805, test_loss: 1.1206, test_f1: 0.6471
 epoch: 53, train_loss: 0.5878, test_loss: 1.1298, test_f1: 0.6479
 epoch: 54, train_loss: 0.5843, test_loss: 1.1603, test_f1: 0.6185
 epoch: 55, train_loss: 0.5781, test_loss: 1.1592, test_f1: 0.6112
 epoch: 56, train_loss: 0.5634, test_loss: 1.1755, test_f1: 0.6298
 epoch: 57, train_loss: 0.5771, test_loss: 1.1835, test_f1: 0.6177
 epoch: 58, train_loss: 0.5636, test_loss: 1.2143, test_f1: 0.6020
 epoch: 59, train_loss: 0.5751, test_loss: 1.1959, test_f1: 0.6270
 epoch: 60, train_loss: 0.5551, test_loss: 1.2131, test_f1: 0.6198
 epoch: 61, train_loss: 0.5821, test_loss: 1.2036, test_f1: 0.6164
 epoch: 62, train_loss: 0.5408, test_loss: 1.2236, test_f1: 0.6167
 epoch: 63, train_loss: 0.5757, test_loss: 1.1840, test_f1: 0.6430
 epoch: 64, train_loss: 0.5639, test_loss: 1.2109, test_f1: 0.6479
 epoch: 65, train_loss: 0.5571, test_loss: 1.2095, test_f1: 0.6125
 epoch: 66, train_loss: 0.5460, test_loss: 1.2071, test_f1: 0.6128
 epoch: 67, train_loss: 0.5654, test_loss: 1.2355, test_f1: 0.6445
 epoch: 68, train_loss: 0.5368, test_loss: 1.2058, test_f1: 0.6218
 epoch: 69, train_loss: 0.5451, test_loss: 1.2931, test_f1: 0.5991
 epoch: 70, train_loss: 0.5402, test_loss: 1.2618, test_f1: 0.6189
 epoch: 71, train_loss: 0.5452, test_loss: 1.2632, test_f1: 0.6039
 epoch: 72, train_loss: 0.5322, test_loss: 1.2381, test_f1: 0.6229
 epoch: 73, train_loss: 0.5264, test_loss: 1.2762, test_f1: 0.6010
 epoch: 74, train_loss: 0.5124, test_loss: 1.2660, test_f1: 0.6124
 epoch: 75, train_loss: 0.5284, test_loss: 1.2912, test_f1: 0.6164
 epoch: 76, train_loss: 0.5219, test_loss: 1.2893, test_f1: 0.6017
 epoch: 77, train_loss: 0.5205, test_loss: 1.3225, test_f1: 0.5930
 epoch: 78, train_loss: 0.5086, test_loss: 1.3409, test_f1: 0.5996
 epoch: 79, train_loss: 0.5013, test_loss: 1.2845, test_f1: 0.6046
 epoch: 80, train_loss: 0.5053, test_loss: 1.3009, test_f1: 0.6075
 epoch: 81, train_loss: 0.5097, test_loss: 1.2866, test_f1: 0.6396
 epoch: 82, train_loss: 0.5057, test_loss: 1.3108, test_f1: 0.6186
 epoch: 83, train_loss: 0.4921, test_loss: 1.3330, test_f1: 0.5829
 epoch: 84, train_loss: 0.4986, test_loss: 1.3074, test_f1: 0.6190
 epoch: 85, train_loss: 0.5015, test_loss: 1.3353, test_f1: 0.6241
 epoch: 86, train_loss: 0.4855, test_loss: 1.3085, test_f1: 0.6286
 epoch: 87, train_loss: 0.5050, test_loss: 1.3473, test_f1: 0.6073
 epoch: 88, train_loss: 0.5120, test_loss: 1.3209, test_f1: 0.6417
 epoch: 89, train_loss: 0.4927, test_loss: 1.3739, test_f1: 0.6114
 epoch: 90, train_loss: 0.4915, test_loss: 1.4037, test_f1: 0.5873
 epoch: 91, train_loss: 0.5003, test_loss: 1.3513, test_f1: 0.6318
 epoch: 92, train_loss: 0.5037, test_loss: 1.3455, test_f1: 0.6170
 epoch: 93, train_loss: 0.4778, test_loss: 1.4108, test_f1: 0.5809
 epoch: 94, train_loss: 0.4710, test_loss: 1.4109, test_f1: 0.5930
 epoch: 95, train_loss: 0.4765, test_loss: 1.4043, test_f1: 0.6085
 epoch: 96, train_loss: 0.4782, test_loss: 1.4379, test_f1: 0.6087
 epoch: 97, train_loss: 0.4680, test_loss: 1.4145, test_f1: 0.6288
 epoch: 98, train_loss: 0.4596, test_loss: 1.3920, test_f1: 0.6202
 epoch: 99, train_loss: 0.4755, test_loss: 1.4152, test_f1: 0.6170
##################ITERATION #9 ****************************************
 epoch: 0, train_loss: 1.2836, test_loss: 1.2067, test_f1: 0.3991
 epoch: 1, train_loss: 1.0906, test_loss: 1.1312, test_f1: 0.4680
 epoch: 2, train_loss: 1.0685, test_loss: 1.0928, test_f1: 0.5238
 epoch: 3, train_loss: 1.0024, test_loss: 1.0982, test_f1: 0.5575
 epoch: 4, train_loss: 1.0182, test_loss: 1.0673, test_f1: 0.5449
 epoch: 5, train_loss: 0.9903, test_loss: 1.0537, test_f1: 0.5526
 epoch: 6, train_loss: 0.9564, test_loss: 1.0600, test_f1: 0.5549
 epoch: 7, train_loss: 0.9613, test_loss: 1.0402, test_f1: 0.5669
 epoch: 8, train_loss: 0.9210, test_loss: 1.0576, test_f1: 0.5630
 epoch: 9, train_loss: 0.9256, test_loss: 1.0579, test_f1: 0.5527
 epoch: 10, train_loss: 0.8909, test_loss: 1.0492, test_f1: 0.5763
 epoch: 11, train_loss: 0.9070, test_loss: 1.0513, test_f1: 0.5620
 epoch: 12, train_loss: 0.8892, test_loss: 1.0287, test_f1: 0.5844
 epoch: 13, train_loss: 0.8809, test_loss: 1.0179, test_f1: 0.5876
 epoch: 14, train_loss: 0.8668, test_loss: 1.0189, test_f1: 0.5854
 epoch: 15, train_loss: 0.8664, test_loss: 1.0150, test_f1: 0.6013
 epoch: 16, train_loss: 0.8323, test_loss: 0.9933, test_f1: 0.5973
 epoch: 17, train_loss: 0.8520, test_loss: 1.0013, test_f1: 0.6108
 epoch: 18, train_loss: 0.8360, test_loss: 1.0225, test_f1: 0.5804
 epoch: 19, train_loss: 0.8284, test_loss: 1.0153, test_f1: 0.5778
 epoch: 20, train_loss: 0.7967, test_loss: 1.0099, test_f1: 0.6063
 epoch: 21, train_loss: 0.8272, test_loss: 1.0184, test_f1: 0.6158
 epoch: 22, train_loss: 0.7851, test_loss: 1.0124, test_f1: 0.6123
 epoch: 23, train_loss: 0.8083, test_loss: 1.0117, test_f1: 0.6302
 epoch: 24, train_loss: 0.7878, test_loss: 0.9888, test_f1: 0.6340
 epoch: 25, train_loss: 0.8007, test_loss: 0.9891, test_f1: 0.6347
 epoch: 26, train_loss: 0.7605, test_loss: 0.9827, test_f1: 0.6113
 epoch: 27, train_loss: 0.7710, test_loss: 0.9962, test_f1: 0.6079
 epoch: 28, train_loss: 0.7737, test_loss: 0.9882, test_f1: 0.5969
 epoch: 29, train_loss: 0.7549, test_loss: 0.9914, test_f1: 0.6126
 epoch: 30, train_loss: 0.7490, test_loss: 0.9593, test_f1: 0.6253
 epoch: 31, train_loss: 0.7435, test_loss: 0.9974, test_f1: 0.6161
 epoch: 32, train_loss: 0.7244, test_loss: 0.9898, test_f1: 0.6472
 epoch: 33, train_loss: 0.7363, test_loss: 0.9845, test_f1: 0.6166
 epoch: 34, train_loss: 0.7149, test_loss: 0.9769, test_f1: 0.6426
 epoch: 35, train_loss: 0.7135, test_loss: 1.0136, test_f1: 0.6097
 epoch: 36, train_loss: 0.7068, test_loss: 1.0017, test_f1: 0.6370
 epoch: 37, train_loss: 0.6886, test_loss: 0.9938, test_f1: 0.6227
 epoch: 38, train_loss: 0.7061, test_loss: 0.9790, test_f1: 0.6357
 epoch: 39, train_loss: 0.6833, test_loss: 1.0272, test_f1: 0.6191
 epoch: 40, train_loss: 0.6701, test_loss: 1.0037, test_f1: 0.6508
 epoch: 41, train_loss: 0.6720, test_loss: 1.0028, test_f1: 0.6369
 epoch: 42, train_loss: 0.6648, test_loss: 1.0090, test_f1: 0.6479
 epoch: 43, train_loss: 0.6777, test_loss: 0.9810, test_f1: 0.6511
 epoch: 44, train_loss: 0.6395, test_loss: 1.0091, test_f1: 0.6415
 epoch: 45, train_loss: 0.6400, test_loss: 1.0167, test_f1: 0.6359
 epoch: 46, train_loss: 0.6517, test_loss: 1.0259, test_f1: 0.6216
 epoch: 47, train_loss: 0.6361, test_loss: 1.0173, test_f1: 0.6819
 epoch: 48, train_loss: 0.6393, test_loss: 1.0120, test_f1: 0.6216
 epoch: 49, train_loss: 0.6478, test_loss: 1.0127, test_f1: 0.6361
 epoch: 50, train_loss: 0.6179, test_loss: 1.0097, test_f1: 0.6457
 epoch: 51, train_loss: 0.6026, test_loss: 1.0191, test_f1: 0.6315
 epoch: 52, train_loss: 0.6289, test_loss: 1.0195, test_f1: 0.6477
 epoch: 53, train_loss: 0.6085, test_loss: 1.0353, test_f1: 0.6346
 epoch: 54, train_loss: 0.5920, test_loss: 1.0517, test_f1: 0.6544
 epoch: 55, train_loss: 0.5886, test_loss: 1.0446, test_f1: 0.6435
 epoch: 56, train_loss: 0.5885, test_loss: 1.0514, test_f1: 0.6592
 epoch: 57, train_loss: 0.5871, test_loss: 1.0422, test_f1: 0.6454
 epoch: 58, train_loss: 0.5814, test_loss: 1.0603, test_f1: 0.6525
 epoch: 59, train_loss: 0.5943, test_loss: 1.0324, test_f1: 0.6399
 epoch: 60, train_loss: 0.5835, test_loss: 1.0379, test_f1: 0.6451
 epoch: 61, train_loss: 0.5823, test_loss: 1.0474, test_f1: 0.6423
 epoch: 62, train_loss: 0.5647, test_loss: 1.0588, test_f1: 0.6293
 epoch: 63, train_loss: 0.5800, test_loss: 1.0422, test_f1: 0.6405
 epoch: 64, train_loss: 0.5598, test_loss: 1.0657, test_f1: 0.6556
 epoch: 65, train_loss: 0.5537, test_loss: 1.0396, test_f1: 0.6580
 epoch: 66, train_loss: 0.5487, test_loss: 1.0769, test_f1: 0.6652
 epoch: 67, train_loss: 0.5524, test_loss: 1.0902, test_f1: 0.6439
 epoch: 68, train_loss: 0.5450, test_loss: 1.1139, test_f1: 0.6451
 epoch: 69, train_loss: 0.5429, test_loss: 1.0887, test_f1: 0.6422
 epoch: 70, train_loss: 0.5551, test_loss: 1.1082, test_f1: 0.6520
 epoch: 71, train_loss: 0.5368, test_loss: 1.0806, test_f1: 0.6312
 epoch: 72, train_loss: 0.5426, test_loss: 1.1141, test_f1: 0.6400
 epoch: 73, train_loss: 0.5522, test_loss: 1.1362, test_f1: 0.6345
 epoch: 74, train_loss: 0.5436, test_loss: 1.1384, test_f1: 0.6491
 epoch: 75, train_loss: 0.5378, test_loss: 1.1263, test_f1: 0.6339
 epoch: 76, train_loss: 0.5277, test_loss: 1.1051, test_f1: 0.6411
 epoch: 77, train_loss: 0.5481, test_loss: 1.1351, test_f1: 0.6474
 epoch: 78, train_loss: 0.5057, test_loss: 1.1741, test_f1: 0.6340
 epoch: 79, train_loss: 0.5300, test_loss: 1.1497, test_f1: 0.6456
 epoch: 80, train_loss: 0.5319, test_loss: 1.1341, test_f1: 0.6236
 epoch: 81, train_loss: 0.5277, test_loss: 1.1421, test_f1: 0.6392
 epoch: 82, train_loss: 0.5184, test_loss: 1.1410, test_f1: 0.6504
 epoch: 83, train_loss: 0.5154, test_loss: 1.1869, test_f1: 0.6442
 epoch: 84, train_loss: 0.5078, test_loss: 1.1563, test_f1: 0.6381
 epoch: 85, train_loss: 0.5125, test_loss: 1.1650, test_f1: 0.6161
 epoch: 86, train_loss: 0.5046, test_loss: 1.1686, test_f1: 0.6302
 epoch: 87, train_loss: 0.4876, test_loss: 1.1437, test_f1: 0.6537
 epoch: 88, train_loss: 0.5085, test_loss: 1.1832, test_f1: 0.6214
 epoch: 89, train_loss: 0.5078, test_loss: 1.1957, test_f1: 0.6401
 epoch: 90, train_loss: 0.5047, test_loss: 1.2276, test_f1: 0.6434
 epoch: 91, train_loss: 0.5019, test_loss: 1.1789, test_f1: 0.6525
 epoch: 92, train_loss: 0.4769, test_loss: 1.1397, test_f1: 0.6472
 epoch: 93, train_loss: 0.4852, test_loss: 1.2093, test_f1: 0.6503
 epoch: 94, train_loss: 0.4863, test_loss: 1.1517, test_f1: 0.6443
 epoch: 95, train_loss: 0.4821, test_loss: 1.2086, test_f1: 0.6552
 epoch: 96, train_loss: 0.4793, test_loss: 1.2174, test_f1: 0.6601
 epoch: 97, train_loss: 0.4676, test_loss: 1.1996, test_f1: 0.6408
 epoch: 98, train_loss: 0.4782, test_loss: 1.2085, test_f1: 0.6434
 epoch: 99, train_loss: 0.4650, test_loss: 1.2131, test_f1: 0.6332

Training completed in 499.24 seconds
Best F1: 0.6819 at epoch 47
Mean F1 across iterations: 0.6598  0.0191
========================FINAL RESULTS================================
FEGIN weighted F1: 0.6819  0.0191
python main.py --data ltspice_demos --representation component_net --model FEGIN --layers 2 --hiddens 128 --batch_size 32 --lr 0.0001 --emb_size 128 --epochs 100 --save_appendix component_net_L2_H128_BS32_LR0.0001_E128 --no_val
-----



STDERR:
  File "main.py", line 370, in <module>
    main()
  File "main.py", line 254, in main
    dataset = dataset_class(
  File "/home/philip/projects/ltspice_examples_code_repo/Circuit-Completion-Using-GNNs/component_classification_with_link_prediction_head/evaluation/FEGIN/kernel/circuit_datasets.py", line 15, in __init__
    self.data, self.slices = torch.load(self.processed_paths[0])
  File "/home/philip/.local/lib/python3.8/site-packages/torch/serialization.py", line 1040, in load
    warnings.warn(
  File "/usr/lib/python3.8/warnings.py", line 109, in _showwarnmsg
    sw(msg.message, msg.category, msg.filename, msg.lineno,
  File "main.py", line 47, in warn_with_traceback
    traceback.print_stack(file=log)
/home/philip/projects/ltspice_examples_code_repo/Circuit-Completion-Using-GNNs/component_classification_with_link_prediction_head/evaluation/FEGIN/kernel/circuit_datasets.py:15: FutureWarning: You are using `torch.load` with `weights_only=False` (the current default value), which uses the default pickle module implicitly. It is possible to construct malicious pickle data which will execute arbitrary code during unpickling (See https://github.com/pytorch/pytorch/blob/main/SECURITY.md#untrusted-models for more details). In a future release, the default value for `weights_only` will be flipped to `True`. This limits the functions that could be executed during unpickling. Arbitrary objects will no longer be allowed to be loaded via this mode unless they are explicitly allowlisted by the user via `torch.serialization.add_safe_globals`. We recommend you start setting `weights_only=True` for any use case where you don't have full control of the loaded file. Please open an issue on GitHub for any issues related to this experimental feature.
  self.data, self.slices = torch.load(self.processed_paths[0])
