STDOUT:
Results will be saved in /home/philip/projects/ltspice_examples_code_repo/Circuit-Completion-Using-GNNs/component_classification_with_link_prediction_head/evaluation/FEGIN/results/model_FEGIN_dataset_ltspice_demos
Command line input: python main.py --data ltspice_demos --representation component_component --model FEGIN --layers 4 --hiddens 64 --batch_size 64 --lr 0.0001 --emb_size 250 --epochs 100 --save_appendix component_component_L4_H64_BS64_LR0.0001_E250 --no_val
 is saved.
-----
ltspice_demos - FEGIN
Using 4 layers, 64 hidden units, h = 2
Loading component_component representation dataset
ENTERED
Training FEGIN on component_component representation
Train: 1565, Test: 383
##################ITERATION #0 ****************************************
 epoch: 0, train_loss: 1.3821, test_loss: 1.3773, test_f1: 0.2281
 epoch: 1, train_loss: 1.3677, test_loss: 1.3668, test_f1: 0.2281
 epoch: 2, train_loss: 1.3563, test_loss: 1.3557, test_f1: 0.2281
 epoch: 3, train_loss: 1.3434, test_loss: 1.3446, test_f1: 0.2281
 epoch: 4, train_loss: 1.3239, test_loss: 1.3303, test_f1: 0.2281
 epoch: 5, train_loss: 1.3032, test_loss: 1.3145, test_f1: 0.2281
 epoch: 6, train_loss: 1.2740, test_loss: 1.2963, test_f1: 0.2281
 epoch: 7, train_loss: 1.2468, test_loss: 1.2826, test_f1: 0.2281
 epoch: 8, train_loss: 1.2268, test_loss: 1.2691, test_f1: 0.2278
 epoch: 9, train_loss: 1.2041, test_loss: 1.2618, test_f1: 0.2330
 epoch: 10, train_loss: 1.1892, test_loss: 1.2503, test_f1: 0.2430
 epoch: 11, train_loss: 1.1799, test_loss: 1.2481, test_f1: 0.2635
 epoch: 12, train_loss: 1.1643, test_loss: 1.2451, test_f1: 0.2625
 epoch: 13, train_loss: 1.1604, test_loss: 1.2381, test_f1: 0.2611
 epoch: 14, train_loss: 1.1507, test_loss: 1.2393, test_f1: 0.2611
 epoch: 15, train_loss: 1.1406, test_loss: 1.2396, test_f1: 0.2690
 epoch: 16, train_loss: 1.1363, test_loss: 1.2327, test_f1: 0.2721
 epoch: 17, train_loss: 1.1272, test_loss: 1.2321, test_f1: 0.2935
 epoch: 18, train_loss: 1.1177, test_loss: 1.2323, test_f1: 0.2935
 epoch: 19, train_loss: 1.1137, test_loss: 1.2304, test_f1: 0.3024
 epoch: 20, train_loss: 1.1076, test_loss: 1.2261, test_f1: 0.3057
 epoch: 21, train_loss: 1.0984, test_loss: 1.2244, test_f1: 0.2997
 epoch: 22, train_loss: 1.0914, test_loss: 1.2226, test_f1: 0.3506
 epoch: 23, train_loss: 1.0816, test_loss: 1.2157, test_f1: 0.4234
 epoch: 24, train_loss: 1.0772, test_loss: 1.2157, test_f1: 0.4119
 epoch: 25, train_loss: 1.0674, test_loss: 1.2082, test_f1: 0.4151
 epoch: 26, train_loss: 1.0546, test_loss: 1.2091, test_f1: 0.4160
 epoch: 27, train_loss: 1.0541, test_loss: 1.2073, test_f1: 0.4132
 epoch: 28, train_loss: 1.0371, test_loss: 1.2116, test_f1: 0.4082
 epoch: 29, train_loss: 1.0313, test_loss: 1.2002, test_f1: 0.4163
 epoch: 30, train_loss: 1.0263, test_loss: 1.1992, test_f1: 0.4036
 epoch: 31, train_loss: 1.0078, test_loss: 1.1966, test_f1: 0.4182
 epoch: 32, train_loss: 1.0002, test_loss: 1.2012, test_f1: 0.4205
 epoch: 33, train_loss: 1.0003, test_loss: 1.2014, test_f1: 0.4252
 epoch: 34, train_loss: 0.9819, test_loss: 1.2014, test_f1: 0.4158
 epoch: 35, train_loss: 0.9773, test_loss: 1.2011, test_f1: 0.4332
 epoch: 36, train_loss: 0.9790, test_loss: 1.2050, test_f1: 0.4386
 epoch: 37, train_loss: 0.9663, test_loss: 1.2103, test_f1: 0.4275
 epoch: 38, train_loss: 0.9555, test_loss: 1.2051, test_f1: 0.4135
 epoch: 39, train_loss: 0.9535, test_loss: 1.2275, test_f1: 0.4425
 epoch: 40, train_loss: 0.9275, test_loss: 1.2072, test_f1: 0.4380
 epoch: 41, train_loss: 0.9381, test_loss: 1.2308, test_f1: 0.4443
 epoch: 42, train_loss: 0.9315, test_loss: 1.2284, test_f1: 0.4347
 epoch: 43, train_loss: 0.9138, test_loss: 1.2245, test_f1: 0.4522
 epoch: 44, train_loss: 0.8944, test_loss: 1.2335, test_f1: 0.4612
 epoch: 45, train_loss: 0.8984, test_loss: 1.2408, test_f1: 0.4678
 epoch: 46, train_loss: 0.8985, test_loss: 1.2531, test_f1: 0.4720
 epoch: 47, train_loss: 0.8940, test_loss: 1.2162, test_f1: 0.5014
 epoch: 48, train_loss: 0.8956, test_loss: 1.2956, test_f1: 0.4708
 epoch: 49, train_loss: 0.8817, test_loss: 1.3109, test_f1: 0.5148
 epoch: 50, train_loss: 0.8831, test_loss: 1.3006, test_f1: 0.5000
 epoch: 51, train_loss: 0.8698, test_loss: 1.2825, test_f1: 0.5013
 epoch: 52, train_loss: 0.8735, test_loss: 1.2613, test_f1: 0.5019
 epoch: 53, train_loss: 0.8563, test_loss: 1.2784, test_f1: 0.5093
 epoch: 54, train_loss: 0.8614, test_loss: 1.2592, test_f1: 0.5020
 epoch: 55, train_loss: 0.8507, test_loss: 1.2728, test_f1: 0.5149
 epoch: 56, train_loss: 0.8517, test_loss: 1.2944, test_f1: 0.5156
 epoch: 57, train_loss: 0.8433, test_loss: 1.2907, test_f1: 0.5035
 epoch: 58, train_loss: 0.8386, test_loss: 1.3012, test_f1: 0.4964
 epoch: 59, train_loss: 0.8329, test_loss: 1.3088, test_f1: 0.5181
 epoch: 60, train_loss: 0.8220, test_loss: 1.3204, test_f1: 0.5225
 epoch: 61, train_loss: 0.8479, test_loss: 1.3088, test_f1: 0.5079
 epoch: 62, train_loss: 0.8405, test_loss: 1.2886, test_f1: 0.5206
 epoch: 63, train_loss: 0.8221, test_loss: 1.3512, test_f1: 0.5223
 epoch: 64, train_loss: 0.8292, test_loss: 1.3245, test_f1: 0.4981
 epoch: 65, train_loss: 0.8073, test_loss: 1.3094, test_f1: 0.5293
 epoch: 66, train_loss: 0.8256, test_loss: 1.3667, test_f1: 0.5145
 epoch: 67, train_loss: 0.8190, test_loss: 1.3327, test_f1: 0.5274
 epoch: 68, train_loss: 0.8136, test_loss: 1.3232, test_f1: 0.5394
 epoch: 69, train_loss: 0.8061, test_loss: 1.3399, test_f1: 0.5326
 epoch: 70, train_loss: 0.8096, test_loss: 1.3709, test_f1: 0.5517
 epoch: 71, train_loss: 0.8193, test_loss: 1.3668, test_f1: 0.5466
 epoch: 72, train_loss: 0.8088, test_loss: 1.3330, test_f1: 0.5265
 epoch: 73, train_loss: 0.7987, test_loss: 1.3702, test_f1: 0.5330
 epoch: 74, train_loss: 0.8033, test_loss: 1.3713, test_f1: 0.5393
 epoch: 75, train_loss: 0.8002, test_loss: 1.3401, test_f1: 0.5450
 epoch: 76, train_loss: 0.7990, test_loss: 1.3858, test_f1: 0.5347
 epoch: 77, train_loss: 0.7916, test_loss: 1.3933, test_f1: 0.5496
 epoch: 78, train_loss: 0.7777, test_loss: 1.3961, test_f1: 0.5453
 epoch: 79, train_loss: 0.8034, test_loss: 1.4467, test_f1: 0.5459
 epoch: 80, train_loss: 0.7991, test_loss: 1.3905, test_f1: 0.5544
 epoch: 81, train_loss: 0.7994, test_loss: 1.3680, test_f1: 0.5573
 epoch: 82, train_loss: 0.7895, test_loss: 1.3791, test_f1: 0.5400
 epoch: 83, train_loss: 0.7761, test_loss: 1.3995, test_f1: 0.5475
 epoch: 84, train_loss: 0.7842, test_loss: 1.3932, test_f1: 0.5327
 epoch: 85, train_loss: 0.7719, test_loss: 1.4106, test_f1: 0.5437
 epoch: 86, train_loss: 0.7630, test_loss: 1.4019, test_f1: 0.5366
 epoch: 87, train_loss: 0.7579, test_loss: 1.3807, test_f1: 0.5499
 epoch: 88, train_loss: 0.7592, test_loss: 1.3722, test_f1: 0.5432
 epoch: 89, train_loss: 0.7520, test_loss: 1.3970, test_f1: 0.5476
 epoch: 90, train_loss: 0.7553, test_loss: 1.3243, test_f1: 0.5583
 epoch: 91, train_loss: 0.7658, test_loss: 1.3997, test_f1: 0.5308
 epoch: 92, train_loss: 0.7585, test_loss: 1.4376, test_f1: 0.5295
 epoch: 93, train_loss: 0.7645, test_loss: 1.4004, test_f1: 0.5367
 epoch: 94, train_loss: 0.7497, test_loss: 1.3601, test_f1: 0.5421
 epoch: 95, train_loss: 0.7585, test_loss: 1.3863, test_f1: 0.5439
 epoch: 96, train_loss: 0.7468, test_loss: 1.3924, test_f1: 0.5717
 epoch: 97, train_loss: 0.7505, test_loss: 1.4117, test_f1: 0.5503
 epoch: 98, train_loss: 0.7657, test_loss: 1.3946, test_f1: 0.5420
 epoch: 99, train_loss: 0.7504, test_loss: 1.4105, test_f1: 0.5458
##################ITERATION #1 ****************************************
 epoch: 0, train_loss: 1.3467, test_loss: 1.3689, test_f1: 0.2281
 epoch: 1, train_loss: 1.2998, test_loss: 1.3471, test_f1: 0.2580
 epoch: 2, train_loss: 1.2729, test_loss: 1.3222, test_f1: 0.3490
 epoch: 3, train_loss: 1.2445, test_loss: 1.2909, test_f1: 0.3178
 epoch: 4, train_loss: 1.2287, test_loss: 1.2908, test_f1: 0.3212
 epoch: 5, train_loss: 1.2098, test_loss: 1.2872, test_f1: 0.3234
 epoch: 6, train_loss: 1.2016, test_loss: 1.2804, test_f1: 0.3224
 epoch: 7, train_loss: 1.1886, test_loss: 1.2723, test_f1: 0.3260
 epoch: 8, train_loss: 1.1826, test_loss: 1.2677, test_f1: 0.3362
 epoch: 9, train_loss: 1.1707, test_loss: 1.2659, test_f1: 0.3419
 epoch: 10, train_loss: 1.1660, test_loss: 1.2566, test_f1: 0.3754
 epoch: 11, train_loss: 1.1544, test_loss: 1.2480, test_f1: 0.3606
 epoch: 12, train_loss: 1.1455, test_loss: 1.2520, test_f1: 0.3840
 epoch: 13, train_loss: 1.1406, test_loss: 1.2429, test_f1: 0.3793
 epoch: 14, train_loss: 1.1307, test_loss: 1.2348, test_f1: 0.4003
 epoch: 15, train_loss: 1.1228, test_loss: 1.2268, test_f1: 0.3994
 epoch: 16, train_loss: 1.1067, test_loss: 1.2254, test_f1: 0.4141
 epoch: 17, train_loss: 1.1034, test_loss: 1.2270, test_f1: 0.4019
 epoch: 18, train_loss: 1.0917, test_loss: 1.2222, test_f1: 0.4090
 epoch: 19, train_loss: 1.0860, test_loss: 1.2153, test_f1: 0.4178
 epoch: 20, train_loss: 1.0772, test_loss: 1.2118, test_f1: 0.4243
 epoch: 21, train_loss: 1.0674, test_loss: 1.2128, test_f1: 0.4325
 epoch: 22, train_loss: 1.0574, test_loss: 1.2166, test_f1: 0.4177
 epoch: 23, train_loss: 1.0517, test_loss: 1.2089, test_f1: 0.4370
 epoch: 24, train_loss: 1.0476, test_loss: 1.2054, test_f1: 0.4310
 epoch: 25, train_loss: 1.0436, test_loss: 1.2009, test_f1: 0.4591
 epoch: 26, train_loss: 1.0267, test_loss: 1.1936, test_f1: 0.4499
 epoch: 27, train_loss: 1.0274, test_loss: 1.1976, test_f1: 0.4549
 epoch: 28, train_loss: 1.0063, test_loss: 1.1978, test_f1: 0.4510
 epoch: 29, train_loss: 1.0067, test_loss: 1.2022, test_f1: 0.4489
 epoch: 30, train_loss: 1.0000, test_loss: 1.2001, test_f1: 0.4534
 epoch: 31, train_loss: 0.9953, test_loss: 1.2070, test_f1: 0.4725
 epoch: 32, train_loss: 0.9744, test_loss: 1.2028, test_f1: 0.4626
 epoch: 33, train_loss: 0.9789, test_loss: 1.1946, test_f1: 0.4782
 epoch: 34, train_loss: 0.9514, test_loss: 1.2318, test_f1: 0.4763
 epoch: 35, train_loss: 0.9504, test_loss: 1.2357, test_f1: 0.5044
 epoch: 36, train_loss: 0.9549, test_loss: 1.2071, test_f1: 0.5035
 epoch: 37, train_loss: 0.9381, test_loss: 1.2457, test_f1: 0.4863
 epoch: 38, train_loss: 0.9302, test_loss: 1.2308, test_f1: 0.5233
 epoch: 39, train_loss: 0.9239, test_loss: 1.2480, test_f1: 0.5061
 epoch: 40, train_loss: 0.9141, test_loss: 1.2257, test_f1: 0.5215
 epoch: 41, train_loss: 0.9026, test_loss: 1.2712, test_f1: 0.5116
 epoch: 42, train_loss: 0.9017, test_loss: 1.2813, test_f1: 0.5206
 epoch: 43, train_loss: 0.8955, test_loss: 1.2806, test_f1: 0.5173
 epoch: 44, train_loss: 0.8899, test_loss: 1.2596, test_f1: 0.5213
 epoch: 45, train_loss: 0.8828, test_loss: 1.2487, test_f1: 0.5079
 epoch: 46, train_loss: 0.8714, test_loss: 1.2973, test_f1: 0.5367
 epoch: 47, train_loss: 0.8686, test_loss: 1.3004, test_f1: 0.5205
 epoch: 48, train_loss: 0.8573, test_loss: 1.2945, test_f1: 0.4968
 epoch: 49, train_loss: 0.8437, test_loss: 1.3090, test_f1: 0.5227
 epoch: 50, train_loss: 0.8406, test_loss: 1.3165, test_f1: 0.5148
 epoch: 51, train_loss: 0.8301, test_loss: 1.3472, test_f1: 0.5102
 epoch: 52, train_loss: 0.8317, test_loss: 1.3526, test_f1: 0.5318
 epoch: 53, train_loss: 0.8286, test_loss: 1.3488, test_f1: 0.5007
 epoch: 54, train_loss: 0.8288, test_loss: 1.3665, test_f1: 0.5132
 epoch: 55, train_loss: 0.8175, test_loss: 1.3471, test_f1: 0.5178
 epoch: 56, train_loss: 0.8042, test_loss: 1.3787, test_f1: 0.5085
 epoch: 57, train_loss: 0.8212, test_loss: 1.3554, test_f1: 0.5050
 epoch: 58, train_loss: 0.8063, test_loss: 1.3544, test_f1: 0.5205
 epoch: 59, train_loss: 0.8165, test_loss: 1.3220, test_f1: 0.5139
 epoch: 60, train_loss: 0.7925, test_loss: 1.3286, test_f1: 0.5009
 epoch: 61, train_loss: 0.8098, test_loss: 1.3116, test_f1: 0.5202
 epoch: 62, train_loss: 0.7816, test_loss: 1.3178, test_f1: 0.5207
 epoch: 63, train_loss: 0.7863, test_loss: 1.3372, test_f1: 0.5149
 epoch: 64, train_loss: 0.7853, test_loss: 1.3578, test_f1: 0.5301
 epoch: 65, train_loss: 0.7916, test_loss: 1.3603, test_f1: 0.5385
 epoch: 66, train_loss: 0.7818, test_loss: 1.4129, test_f1: 0.5072
 epoch: 67, train_loss: 0.7952, test_loss: 1.3414, test_f1: 0.5241
 epoch: 68, train_loss: 0.7797, test_loss: 1.3398, test_f1: 0.5240
 epoch: 69, train_loss: 0.7699, test_loss: 1.3597, test_f1: 0.5237
 epoch: 70, train_loss: 0.7755, test_loss: 1.3708, test_f1: 0.5156
 epoch: 71, train_loss: 0.7851, test_loss: 1.3444, test_f1: 0.5293
 epoch: 72, train_loss: 0.7588, test_loss: 1.3883, test_f1: 0.5286
 epoch: 73, train_loss: 0.7653, test_loss: 1.3974, test_f1: 0.5158
 epoch: 74, train_loss: 0.7686, test_loss: 1.4040, test_f1: 0.5150
 epoch: 75, train_loss: 0.7601, test_loss: 1.3614, test_f1: 0.5283
 epoch: 76, train_loss: 0.7443, test_loss: 1.3974, test_f1: 0.5254
 epoch: 77, train_loss: 0.7509, test_loss: 1.4308, test_f1: 0.5048
 epoch: 78, train_loss: 0.7535, test_loss: 1.4272, test_f1: 0.5179
 epoch: 79, train_loss: 0.7459, test_loss: 1.4113, test_f1: 0.5254
 epoch: 80, train_loss: 0.7496, test_loss: 1.4586, test_f1: 0.5090
 epoch: 81, train_loss: 0.7450, test_loss: 1.4225, test_f1: 0.5224
 epoch: 82, train_loss: 0.7255, test_loss: 1.4240, test_f1: 0.5231
 epoch: 83, train_loss: 0.7411, test_loss: 1.4069, test_f1: 0.5307
 epoch: 84, train_loss: 0.7215, test_loss: 1.3796, test_f1: 0.5391
 epoch: 85, train_loss: 0.7263, test_loss: 1.4090, test_f1: 0.5273
 epoch: 86, train_loss: 0.7203, test_loss: 1.4607, test_f1: 0.5245
 epoch: 87, train_loss: 0.7100, test_loss: 1.4818, test_f1: 0.5196
 epoch: 88, train_loss: 0.7198, test_loss: 1.4983, test_f1: 0.5184
 epoch: 89, train_loss: 0.7138, test_loss: 1.5155, test_f1: 0.5194
 epoch: 90, train_loss: 0.7313, test_loss: 1.4833, test_f1: 0.5258
 epoch: 91, train_loss: 0.7035, test_loss: 1.4769, test_f1: 0.5250
 epoch: 92, train_loss: 0.7020, test_loss: 1.5510, test_f1: 0.5228
 epoch: 93, train_loss: 0.7185, test_loss: 1.5289, test_f1: 0.5380
 epoch: 94, train_loss: 0.6996, test_loss: 1.5700, test_f1: 0.5134
 epoch: 95, train_loss: 0.7028, test_loss: 1.5033, test_f1: 0.5179
 epoch: 96, train_loss: 0.6950, test_loss: 1.5425, test_f1: 0.5137
 epoch: 97, train_loss: 0.7115, test_loss: 1.5086, test_f1: 0.5290
 epoch: 98, train_loss: 0.7010, test_loss: 1.5206, test_f1: 0.5215
 epoch: 99, train_loss: 0.6813, test_loss: 1.5029, test_f1: 0.5253
##################ITERATION #2 ****************************************
 epoch: 0, train_loss: 1.3328, test_loss: 1.3932, test_f1: 0.1501
 epoch: 1, train_loss: 1.2862, test_loss: 1.3459, test_f1: 0.3517
 epoch: 2, train_loss: 1.2526, test_loss: 1.3478, test_f1: 0.3605
 epoch: 3, train_loss: 1.2335, test_loss: 1.3479, test_f1: 0.3386
 epoch: 4, train_loss: 1.2196, test_loss: 1.3410, test_f1: 0.3363
 epoch: 5, train_loss: 1.2009, test_loss: 1.3132, test_f1: 0.3339
 epoch: 6, train_loss: 1.1916, test_loss: 1.3065, test_f1: 0.3293
 epoch: 7, train_loss: 1.1862, test_loss: 1.2903, test_f1: 0.3249
 epoch: 8, train_loss: 1.1762, test_loss: 1.2921, test_f1: 0.3467
 epoch: 9, train_loss: 1.1758, test_loss: 1.2835, test_f1: 0.3449
 epoch: 10, train_loss: 1.1597, test_loss: 1.2814, test_f1: 0.3351
 epoch: 11, train_loss: 1.1617, test_loss: 1.2786, test_f1: 0.3615
 epoch: 12, train_loss: 1.1461, test_loss: 1.2767, test_f1: 0.3675
 epoch: 13, train_loss: 1.1261, test_loss: 1.2805, test_f1: 0.3885
 epoch: 14, train_loss: 1.1274, test_loss: 1.2612, test_f1: 0.3999
 epoch: 15, train_loss: 1.1274, test_loss: 1.2529, test_f1: 0.4084
 epoch: 16, train_loss: 1.1160, test_loss: 1.2683, test_f1: 0.4056
 epoch: 17, train_loss: 1.1005, test_loss: 1.2504, test_f1: 0.4180
 epoch: 18, train_loss: 1.0976, test_loss: 1.2726, test_f1: 0.4232
 epoch: 19, train_loss: 1.0902, test_loss: 1.2474, test_f1: 0.4331
 epoch: 20, train_loss: 1.0815, test_loss: 1.2477, test_f1: 0.4352
 epoch: 21, train_loss: 1.0692, test_loss: 1.2625, test_f1: 0.4546
 epoch: 22, train_loss: 1.0626, test_loss: 1.2621, test_f1: 0.4463
 epoch: 23, train_loss: 1.0543, test_loss: 1.2448, test_f1: 0.4560
 epoch: 24, train_loss: 1.0477, test_loss: 1.2498, test_f1: 0.4893
 epoch: 25, train_loss: 1.0400, test_loss: 1.2707, test_f1: 0.5024
 epoch: 26, train_loss: 1.0307, test_loss: 1.2824, test_f1: 0.4998
 epoch: 27, train_loss: 1.0129, test_loss: 1.2606, test_f1: 0.5122
 epoch: 28, train_loss: 1.0210, test_loss: 1.2632, test_f1: 0.5110
 epoch: 29, train_loss: 1.0089, test_loss: 1.2555, test_f1: 0.5271
 epoch: 30, train_loss: 1.0040, test_loss: 1.2440, test_f1: 0.5271
 epoch: 31, train_loss: 0.9833, test_loss: 1.2686, test_f1: 0.5318
 epoch: 32, train_loss: 0.9851, test_loss: 1.2395, test_f1: 0.5148
 epoch: 33, train_loss: 0.9745, test_loss: 1.2368, test_f1: 0.5046
 epoch: 34, train_loss: 0.9517, test_loss: 1.2491, test_f1: 0.5000
 epoch: 35, train_loss: 0.9532, test_loss: 1.2681, test_f1: 0.4972
 epoch: 36, train_loss: 0.9358, test_loss: 1.2616, test_f1: 0.5124
 epoch: 37, train_loss: 0.9262, test_loss: 1.2816, test_f1: 0.5216
 epoch: 38, train_loss: 0.9289, test_loss: 1.2955, test_f1: 0.5221
 epoch: 39, train_loss: 0.9299, test_loss: 1.3170, test_f1: 0.5066
 epoch: 40, train_loss: 0.9077, test_loss: 1.3228, test_f1: 0.5208
 epoch: 41, train_loss: 0.9081, test_loss: 1.3097, test_f1: 0.5085
 epoch: 42, train_loss: 0.9080, test_loss: 1.3282, test_f1: 0.4967
 epoch: 43, train_loss: 0.8907, test_loss: 1.3015, test_f1: 0.5180
 epoch: 44, train_loss: 0.8853, test_loss: 1.3502, test_f1: 0.5034
 epoch: 45, train_loss: 0.8721, test_loss: 1.2874, test_f1: 0.5165
 epoch: 46, train_loss: 0.8763, test_loss: 1.3069, test_f1: 0.4894
 epoch: 47, train_loss: 0.8675, test_loss: 1.3207, test_f1: 0.4942
 epoch: 48, train_loss: 0.8581, test_loss: 1.3390, test_f1: 0.5229
 epoch: 49, train_loss: 0.8462, test_loss: 1.3122, test_f1: 0.5073
 epoch: 50, train_loss: 0.8467, test_loss: 1.3156, test_f1: 0.5153
 epoch: 51, train_loss: 0.8437, test_loss: 1.3526, test_f1: 0.5283
 epoch: 52, train_loss: 0.8295, test_loss: 1.3462, test_f1: 0.5085
 epoch: 53, train_loss: 0.8110, test_loss: 1.3700, test_f1: 0.5129
 epoch: 54, train_loss: 0.8321, test_loss: 1.3752, test_f1: 0.4885
 epoch: 55, train_loss: 0.8205, test_loss: 1.3595, test_f1: 0.5122
 epoch: 56, train_loss: 0.8122, test_loss: 1.3948, test_f1: 0.4965
 epoch: 57, train_loss: 0.8169, test_loss: 1.3880, test_f1: 0.5180
 epoch: 58, train_loss: 0.8001, test_loss: 1.3822, test_f1: 0.5010
 epoch: 59, train_loss: 0.8115, test_loss: 1.4321, test_f1: 0.5212
 epoch: 60, train_loss: 0.8040, test_loss: 1.3670, test_f1: 0.5045
 epoch: 61, train_loss: 0.7989, test_loss: 1.3436, test_f1: 0.5128
 epoch: 62, train_loss: 0.8107, test_loss: 1.3984, test_f1: 0.5083
 epoch: 63, train_loss: 0.8103, test_loss: 1.3954, test_f1: 0.5150
 epoch: 64, train_loss: 0.7954, test_loss: 1.3852, test_f1: 0.5121
 epoch: 65, train_loss: 0.7915, test_loss: 1.3947, test_f1: 0.5073
 epoch: 66, train_loss: 0.7851, test_loss: 1.4373, test_f1: 0.5194
 epoch: 67, train_loss: 0.7785, test_loss: 1.4107, test_f1: 0.5033
 epoch: 68, train_loss: 0.7883, test_loss: 1.4634, test_f1: 0.4976
 epoch: 69, train_loss: 0.7830, test_loss: 1.4250, test_f1: 0.5093
 epoch: 70, train_loss: 0.7928, test_loss: 1.4711, test_f1: 0.4924
 epoch: 71, train_loss: 0.7888, test_loss: 1.4370, test_f1: 0.4825
 epoch: 72, train_loss: 0.7835, test_loss: 1.3897, test_f1: 0.5126
 epoch: 73, train_loss: 0.7773, test_loss: 1.4444, test_f1: 0.5113
 epoch: 74, train_loss: 0.7704, test_loss: 1.4930, test_f1: 0.4988
 epoch: 75, train_loss: 0.7657, test_loss: 1.4509, test_f1: 0.5114
 epoch: 76, train_loss: 0.7718, test_loss: 1.4608, test_f1: 0.5224
 epoch: 77, train_loss: 0.7661, test_loss: 1.4755, test_f1: 0.5107
 epoch: 78, train_loss: 0.7450, test_loss: 1.4854, test_f1: 0.5054
 epoch: 79, train_loss: 0.7631, test_loss: 1.5354, test_f1: 0.4826
 epoch: 80, train_loss: 0.7547, test_loss: 1.5330, test_f1: 0.4820
 epoch: 81, train_loss: 0.7473, test_loss: 1.4853, test_f1: 0.5007
 epoch: 82, train_loss: 0.7382, test_loss: 1.5301, test_f1: 0.4922
 epoch: 83, train_loss: 0.7567, test_loss: 1.5101, test_f1: 0.4870
 epoch: 84, train_loss: 0.7829, test_loss: 1.4847, test_f1: 0.4983
 epoch: 85, train_loss: 0.7486, test_loss: 1.5640, test_f1: 0.4908
 epoch: 86, train_loss: 0.7352, test_loss: 1.5328, test_f1: 0.4894
 epoch: 87, train_loss: 0.7346, test_loss: 1.5705, test_f1: 0.5027
 epoch: 88, train_loss: 0.7384, test_loss: 1.6071, test_f1: 0.4921
 epoch: 89, train_loss: 0.7254, test_loss: 1.5679, test_f1: 0.4925
 epoch: 90, train_loss: 0.7318, test_loss: 1.5000, test_f1: 0.4965
 epoch: 91, train_loss: 0.7238, test_loss: 1.6181, test_f1: 0.4746
 epoch: 92, train_loss: 0.7161, test_loss: 1.5687, test_f1: 0.4905
 epoch: 93, train_loss: 0.7388, test_loss: 1.6006, test_f1: 0.4877
 epoch: 94, train_loss: 0.7230, test_loss: 1.5388, test_f1: 0.4973
 epoch: 95, train_loss: 0.7135, test_loss: 1.5730, test_f1: 0.5032
 epoch: 96, train_loss: 0.7113, test_loss: 1.5944, test_f1: 0.4991
 epoch: 97, train_loss: 0.7142, test_loss: 1.6198, test_f1: 0.5025
 epoch: 98, train_loss: 0.7104, test_loss: 1.5606, test_f1: 0.5012
 epoch: 99, train_loss: 0.7086, test_loss: 1.5252, test_f1: 0.4939
##################ITERATION #3 ****************************************
 epoch: 0, train_loss: 1.2827, test_loss: 1.3261, test_f1: 0.2281
 epoch: 1, train_loss: 1.2388, test_loss: 1.2854, test_f1: 0.3362
 epoch: 2, train_loss: 1.2089, test_loss: 1.2802, test_f1: 0.3412
 epoch: 3, train_loss: 1.1995, test_loss: 1.2735, test_f1: 0.3690
 epoch: 4, train_loss: 1.1753, test_loss: 1.2606, test_f1: 0.3639
 epoch: 5, train_loss: 1.1688, test_loss: 1.2510, test_f1: 0.3836
 epoch: 6, train_loss: 1.1592, test_loss: 1.2452, test_f1: 0.3954
 epoch: 7, train_loss: 1.1458, test_loss: 1.2377, test_f1: 0.3970
 epoch: 8, train_loss: 1.1288, test_loss: 1.2251, test_f1: 0.4037
 epoch: 9, train_loss: 1.1247, test_loss: 1.2245, test_f1: 0.3879
 epoch: 10, train_loss: 1.1111, test_loss: 1.2253, test_f1: 0.4055
 epoch: 11, train_loss: 1.1019, test_loss: 1.2278, test_f1: 0.4019
 epoch: 12, train_loss: 1.0971, test_loss: 1.2245, test_f1: 0.4263
 epoch: 13, train_loss: 1.0846, test_loss: 1.2232, test_f1: 0.4183
 epoch: 14, train_loss: 1.0765, test_loss: 1.2254, test_f1: 0.4157
 epoch: 15, train_loss: 1.0757, test_loss: 1.2245, test_f1: 0.4345
 epoch: 16, train_loss: 1.0645, test_loss: 1.2316, test_f1: 0.4228
 epoch: 17, train_loss: 1.0628, test_loss: 1.2024, test_f1: 0.4416
 epoch: 18, train_loss: 1.0459, test_loss: 1.2000, test_f1: 0.4612
 epoch: 19, train_loss: 1.0395, test_loss: 1.2042, test_f1: 0.4454
 epoch: 20, train_loss: 1.0290, test_loss: 1.2004, test_f1: 0.4614
 epoch: 21, train_loss: 1.0239, test_loss: 1.2001, test_f1: 0.4580
 epoch: 22, train_loss: 1.0174, test_loss: 1.1922, test_f1: 0.4817
 epoch: 23, train_loss: 0.9993, test_loss: 1.2089, test_f1: 0.4735
 epoch: 24, train_loss: 1.0000, test_loss: 1.2432, test_f1: 0.4771
 epoch: 25, train_loss: 0.9973, test_loss: 1.2158, test_f1: 0.4702
 epoch: 26, train_loss: 0.9890, test_loss: 1.2672, test_f1: 0.4745
 epoch: 27, train_loss: 0.9766, test_loss: 1.2634, test_f1: 0.4712
 epoch: 28, train_loss: 0.9691, test_loss: 1.2544, test_f1: 0.4907
 epoch: 29, train_loss: 0.9648, test_loss: 1.2687, test_f1: 0.4931
 epoch: 30, train_loss: 0.9500, test_loss: 1.2729, test_f1: 0.4864
 epoch: 31, train_loss: 0.9392, test_loss: 1.2304, test_f1: 0.4810
 epoch: 32, train_loss: 0.9361, test_loss: 1.2936, test_f1: 0.4934
 epoch: 33, train_loss: 0.9303, test_loss: 1.2935, test_f1: 0.4837
 epoch: 34, train_loss: 0.9194, test_loss: 1.3024, test_f1: 0.5006
 epoch: 35, train_loss: 0.9179, test_loss: 1.3012, test_f1: 0.5001
 epoch: 36, train_loss: 0.9115, test_loss: 1.3128, test_f1: 0.5215
 epoch: 37, train_loss: 0.9004, test_loss: 1.2991, test_f1: 0.4853
 epoch: 38, train_loss: 0.9074, test_loss: 1.2391, test_f1: 0.5340
 epoch: 39, train_loss: 0.8882, test_loss: 1.2301, test_f1: 0.5406
 epoch: 40, train_loss: 0.8846, test_loss: 1.2989, test_f1: 0.5112
 epoch: 41, train_loss: 0.8746, test_loss: 1.3652, test_f1: 0.5270
 epoch: 42, train_loss: 0.8775, test_loss: 1.2948, test_f1: 0.5507
 epoch: 43, train_loss: 0.8727, test_loss: 1.2619, test_f1: 0.5534
 epoch: 44, train_loss: 0.8651, test_loss: 1.3188, test_f1: 0.5510
 epoch: 45, train_loss: 0.8471, test_loss: 1.2956, test_f1: 0.5426
 epoch: 46, train_loss: 0.8371, test_loss: 1.2981, test_f1: 0.5446
 epoch: 47, train_loss: 0.8299, test_loss: 1.3383, test_f1: 0.5403
 epoch: 48, train_loss: 0.8465, test_loss: 1.3047, test_f1: 0.5573
 epoch: 49, train_loss: 0.8345, test_loss: 1.3264, test_f1: 0.5563
 epoch: 50, train_loss: 0.8223, test_loss: 1.2848, test_f1: 0.5533
 epoch: 51, train_loss: 0.8333, test_loss: 1.3544, test_f1: 0.5463
 epoch: 52, train_loss: 0.8096, test_loss: 1.3469, test_f1: 0.5533
 epoch: 53, train_loss: 0.8200, test_loss: 1.3172, test_f1: 0.5466
 epoch: 54, train_loss: 0.8006, test_loss: 1.3719, test_f1: 0.5534
 epoch: 55, train_loss: 0.7919, test_loss: 1.3589, test_f1: 0.5560
 epoch: 56, train_loss: 0.7984, test_loss: 1.3802, test_f1: 0.5484
 epoch: 57, train_loss: 0.7914, test_loss: 1.3590, test_f1: 0.5550
 epoch: 58, train_loss: 0.8016, test_loss: 1.3605, test_f1: 0.5590
 epoch: 59, train_loss: 0.7885, test_loss: 1.3971, test_f1: 0.5558
 epoch: 60, train_loss: 0.7820, test_loss: 1.4009, test_f1: 0.5508
 epoch: 61, train_loss: 0.7803, test_loss: 1.3866, test_f1: 0.5408
 epoch: 62, train_loss: 0.7833, test_loss: 1.4317, test_f1: 0.5492
 epoch: 63, train_loss: 0.7801, test_loss: 1.3965, test_f1: 0.5489
 epoch: 64, train_loss: 0.7753, test_loss: 1.3755, test_f1: 0.5443
 epoch: 65, train_loss: 0.7628, test_loss: 1.4363, test_f1: 0.5659
 epoch: 66, train_loss: 0.7614, test_loss: 1.4517, test_f1: 0.5657
 epoch: 67, train_loss: 0.7739, test_loss: 1.4220, test_f1: 0.5516
 epoch: 68, train_loss: 0.7633, test_loss: 1.4403, test_f1: 0.5519
 epoch: 69, train_loss: 0.7602, test_loss: 1.4689, test_f1: 0.5474
 epoch: 70, train_loss: 0.7585, test_loss: 1.4839, test_f1: 0.5396
 epoch: 71, train_loss: 0.7752, test_loss: 1.4846, test_f1: 0.5545
 epoch: 72, train_loss: 0.7391, test_loss: 1.5263, test_f1: 0.5510
 epoch: 73, train_loss: 0.7541, test_loss: 1.4490, test_f1: 0.5595
 epoch: 74, train_loss: 0.7387, test_loss: 1.5194, test_f1: 0.5660
 epoch: 75, train_loss: 0.7343, test_loss: 1.4542, test_f1: 0.5714
 epoch: 76, train_loss: 0.7520, test_loss: 1.4634, test_f1: 0.5641
 epoch: 77, train_loss: 0.7324, test_loss: 1.5277, test_f1: 0.5540
 epoch: 78, train_loss: 0.7456, test_loss: 1.5218, test_f1: 0.5614
 epoch: 79, train_loss: 0.7166, test_loss: 1.4959, test_f1: 0.5514
 epoch: 80, train_loss: 0.7294, test_loss: 1.5013, test_f1: 0.5702
 epoch: 81, train_loss: 0.7150, test_loss: 1.5712, test_f1: 0.5479
 epoch: 82, train_loss: 0.7321, test_loss: 1.6010, test_f1: 0.5642
 epoch: 83, train_loss: 0.7360, test_loss: 1.6018, test_f1: 0.5630
 epoch: 84, train_loss: 0.7346, test_loss: 1.5728, test_f1: 0.5702
 epoch: 85, train_loss: 0.7030, test_loss: 1.5812, test_f1: 0.5711
 epoch: 86, train_loss: 0.7220, test_loss: 1.5551, test_f1: 0.5632
 epoch: 87, train_loss: 0.7131, test_loss: 1.5195, test_f1: 0.5720
 epoch: 88, train_loss: 0.7153, test_loss: 1.6182, test_f1: 0.5595
 epoch: 89, train_loss: 0.7052, test_loss: 1.7346, test_f1: 0.5712
 epoch: 90, train_loss: 0.7077, test_loss: 1.6278, test_f1: 0.5682
 epoch: 91, train_loss: 0.7016, test_loss: 1.6143, test_f1: 0.5710
 epoch: 92, train_loss: 0.6977, test_loss: 1.5502, test_f1: 0.5585
 epoch: 93, train_loss: 0.7033, test_loss: 1.6427, test_f1: 0.5682
 epoch: 94, train_loss: 0.6960, test_loss: 1.6777, test_f1: 0.5657
 epoch: 95, train_loss: 0.6814, test_loss: 1.5661, test_f1: 0.5538
 epoch: 96, train_loss: 0.6846, test_loss: 1.6201, test_f1: 0.5558
 epoch: 97, train_loss: 0.6902, test_loss: 1.6106, test_f1: 0.5638
 epoch: 98, train_loss: 0.7005, test_loss: 1.5763, test_f1: 0.5744
 epoch: 99, train_loss: 0.6786, test_loss: 1.6191, test_f1: 0.5698
##################ITERATION #4 ****************************************
 epoch: 0, train_loss: 1.2671, test_loss: 1.3211, test_f1: 0.2281
 epoch: 1, train_loss: 1.2348, test_loss: 1.3220, test_f1: 0.3191
 epoch: 2, train_loss: 1.2101, test_loss: 1.3516, test_f1: 0.3354
 epoch: 3, train_loss: 1.2110, test_loss: 1.3304, test_f1: 0.3671
 epoch: 4, train_loss: 1.1788, test_loss: 1.3118, test_f1: 0.3671
 epoch: 5, train_loss: 1.1747, test_loss: 1.2997, test_f1: 0.3770
 epoch: 6, train_loss: 1.1566, test_loss: 1.2969, test_f1: 0.3879
 epoch: 7, train_loss: 1.1442, test_loss: 1.2726, test_f1: 0.4037
 epoch: 8, train_loss: 1.1370, test_loss: 1.2426, test_f1: 0.4109
 epoch: 9, train_loss: 1.1307, test_loss: 1.2489, test_f1: 0.4140
 epoch: 10, train_loss: 1.1175, test_loss: 1.2450, test_f1: 0.4267
 epoch: 11, train_loss: 1.1025, test_loss: 1.2256, test_f1: 0.4411
 epoch: 12, train_loss: 1.1042, test_loss: 1.2410, test_f1: 0.4541
 epoch: 13, train_loss: 1.0821, test_loss: 1.2226, test_f1: 0.4691
 epoch: 14, train_loss: 1.0735, test_loss: 1.2181, test_f1: 0.4764
 epoch: 15, train_loss: 1.0664, test_loss: 1.2315, test_f1: 0.4993
 epoch: 16, train_loss: 1.0583, test_loss: 1.2525, test_f1: 0.5208
 epoch: 17, train_loss: 1.0470, test_loss: 1.2384, test_f1: 0.5228
 epoch: 18, train_loss: 1.0326, test_loss: 1.2438, test_f1: 0.5172
 epoch: 19, train_loss: 1.0345, test_loss: 1.2494, test_f1: 0.5145
 epoch: 20, train_loss: 1.0197, test_loss: 1.2498, test_f1: 0.5073
 epoch: 21, train_loss: 1.0145, test_loss: 1.2251, test_f1: 0.5142
 epoch: 22, train_loss: 1.0073, test_loss: 1.2341, test_f1: 0.5136
 epoch: 23, train_loss: 0.9986, test_loss: 1.2620, test_f1: 0.5121
 epoch: 24, train_loss: 0.9875, test_loss: 1.2859, test_f1: 0.5182
 epoch: 25, train_loss: 0.9868, test_loss: 1.2703, test_f1: 0.4804
 epoch: 26, train_loss: 0.9788, test_loss: 1.2767, test_f1: 0.5347
 epoch: 27, train_loss: 0.9745, test_loss: 1.2866, test_f1: 0.5264
 epoch: 28, train_loss: 0.9599, test_loss: 1.2807, test_f1: 0.5098
 epoch: 29, train_loss: 0.9576, test_loss: 1.2425, test_f1: 0.5101
 epoch: 30, train_loss: 0.9480, test_loss: 1.2571, test_f1: 0.5075
 epoch: 31, train_loss: 0.9370, test_loss: 1.2671, test_f1: 0.5188
 epoch: 32, train_loss: 0.9460, test_loss: 1.2559, test_f1: 0.5084
 epoch: 33, train_loss: 0.9314, test_loss: 1.2784, test_f1: 0.5035
 epoch: 34, train_loss: 0.9218, test_loss: 1.2441, test_f1: 0.5157
 epoch: 35, train_loss: 0.9087, test_loss: 1.3054, test_f1: 0.5214
 epoch: 36, train_loss: 0.9081, test_loss: 1.2664, test_f1: 0.5249
 epoch: 37, train_loss: 0.8880, test_loss: 1.3468, test_f1: 0.5155
 epoch: 38, train_loss: 0.8887, test_loss: 1.2866, test_f1: 0.5446
 epoch: 39, train_loss: 0.8900, test_loss: 1.3248, test_f1: 0.5068
 epoch: 40, train_loss: 0.8818, test_loss: 1.2814, test_f1: 0.5534
 epoch: 41, train_loss: 0.8923, test_loss: 1.3021, test_f1: 0.5591
 epoch: 42, train_loss: 0.8716, test_loss: 1.3300, test_f1: 0.5170
 epoch: 43, train_loss: 0.8704, test_loss: 1.3405, test_f1: 0.5597
 epoch: 44, train_loss: 0.8727, test_loss: 1.3290, test_f1: 0.5280
 epoch: 45, train_loss: 0.8453, test_loss: 1.3364, test_f1: 0.5672
 epoch: 46, train_loss: 0.8457, test_loss: 1.3281, test_f1: 0.5593
 epoch: 47, train_loss: 0.8416, test_loss: 1.3581, test_f1: 0.5314
 epoch: 48, train_loss: 0.8532, test_loss: 1.3421, test_f1: 0.5804
 epoch: 49, train_loss: 0.8397, test_loss: 1.3378, test_f1: 0.5350
 epoch: 50, train_loss: 0.8220, test_loss: 1.3753, test_f1: 0.5845
 epoch: 51, train_loss: 0.8353, test_loss: 1.3671, test_f1: 0.5389
 epoch: 52, train_loss: 0.8182, test_loss: 1.3251, test_f1: 0.5469
 epoch: 53, train_loss: 0.8201, test_loss: 1.3661, test_f1: 0.5163
 epoch: 54, train_loss: 0.8268, test_loss: 1.3617, test_f1: 0.5598
 epoch: 55, train_loss: 0.8079, test_loss: 1.4278, test_f1: 0.5628
 epoch: 56, train_loss: 0.8093, test_loss: 1.3655, test_f1: 0.5614
 epoch: 57, train_loss: 0.8207, test_loss: 1.3649, test_f1: 0.5521
 epoch: 58, train_loss: 0.8090, test_loss: 1.4142, test_f1: 0.5598
 epoch: 59, train_loss: 0.8012, test_loss: 1.3996, test_f1: 0.5544
 epoch: 60, train_loss: 0.8118, test_loss: 1.4403, test_f1: 0.5650
 epoch: 61, train_loss: 0.8046, test_loss: 1.3354, test_f1: 0.5191
 epoch: 62, train_loss: 0.8157, test_loss: 1.3212, test_f1: 0.5490
 epoch: 63, train_loss: 0.7943, test_loss: 1.3489, test_f1: 0.5604
 epoch: 64, train_loss: 0.7779, test_loss: 1.4875, test_f1: 0.5633
 epoch: 65, train_loss: 0.8013, test_loss: 1.4163, test_f1: 0.5677
 epoch: 66, train_loss: 0.7970, test_loss: 1.3907, test_f1: 0.5730
 epoch: 67, train_loss: 0.7811, test_loss: 1.3776, test_f1: 0.5793
 epoch: 68, train_loss: 0.7745, test_loss: 1.3844, test_f1: 0.5603
 epoch: 69, train_loss: 0.7679, test_loss: 1.4326, test_f1: 0.5538
 epoch: 70, train_loss: 0.7665, test_loss: 1.4193, test_f1: 0.5571
 epoch: 71, train_loss: 0.7720, test_loss: 1.3862, test_f1: 0.5617
 epoch: 72, train_loss: 0.7880, test_loss: 1.4085, test_f1: 0.5555
 epoch: 73, train_loss: 0.7828, test_loss: 1.4493, test_f1: 0.5365
 epoch: 74, train_loss: 0.7703, test_loss: 1.4648, test_f1: 0.5553
 epoch: 75, train_loss: 0.7667, test_loss: 1.4030, test_f1: 0.5791
 epoch: 76, train_loss: 0.7618, test_loss: 1.4442, test_f1: 0.5386
 epoch: 77, train_loss: 0.7661, test_loss: 1.4444, test_f1: 0.5280
 epoch: 78, train_loss: 0.7539, test_loss: 1.4055, test_f1: 0.5413
 epoch: 79, train_loss: 0.7750, test_loss: 1.4342, test_f1: 0.5676
 epoch: 80, train_loss: 0.7706, test_loss: 1.4785, test_f1: 0.5526
 epoch: 81, train_loss: 0.7617, test_loss: 1.4991, test_f1: 0.5468
 epoch: 82, train_loss: 0.7509, test_loss: 1.4744, test_f1: 0.5516
 epoch: 83, train_loss: 0.7595, test_loss: 1.4414, test_f1: 0.5544
 epoch: 84, train_loss: 0.7605, test_loss: 1.4967, test_f1: 0.5576
 epoch: 85, train_loss: 0.7501, test_loss: 1.5391, test_f1: 0.5656
 epoch: 86, train_loss: 0.7402, test_loss: 1.5510, test_f1: 0.5603
 epoch: 87, train_loss: 0.7363, test_loss: 1.5835, test_f1: 0.5599
 epoch: 88, train_loss: 0.7417, test_loss: 1.5322, test_f1: 0.5707
 epoch: 89, train_loss: 0.7336, test_loss: 1.6269, test_f1: 0.5649
 epoch: 90, train_loss: 0.7301, test_loss: 1.5242, test_f1: 0.5414
 epoch: 91, train_loss: 0.7419, test_loss: 1.5497, test_f1: 0.5334
 epoch: 92, train_loss: 0.7286, test_loss: 1.7188, test_f1: 0.5629
 epoch: 93, train_loss: 0.7285, test_loss: 1.7398, test_f1: 0.5522
 epoch: 94, train_loss: 0.7272, test_loss: 1.6516, test_f1: 0.5658
 epoch: 95, train_loss: 0.7344, test_loss: 1.5322, test_f1: 0.5681
 epoch: 96, train_loss: 0.7022, test_loss: 1.6924, test_f1: 0.5305
 epoch: 97, train_loss: 0.7252, test_loss: 1.5712, test_f1: 0.5312
 epoch: 98, train_loss: 0.7108, test_loss: 1.6397, test_f1: 0.5412
 epoch: 99, train_loss: 0.7371, test_loss: 1.7495, test_f1: 0.5387
##################ITERATION #5 ****************************************
 epoch: 0, train_loss: 1.2831, test_loss: 1.3689, test_f1: 0.2293
 epoch: 1, train_loss: 1.2203, test_loss: 1.3190, test_f1: 0.4002
 epoch: 2, train_loss: 1.1883, test_loss: 1.3043, test_f1: 0.4119
 epoch: 3, train_loss: 1.1845, test_loss: 1.2771, test_f1: 0.4261
 epoch: 4, train_loss: 1.1733, test_loss: 1.2605, test_f1: 0.4334
 epoch: 5, train_loss: 1.1517, test_loss: 1.2690, test_f1: 0.4291
 epoch: 6, train_loss: 1.1423, test_loss: 1.2411, test_f1: 0.4414
 epoch: 7, train_loss: 1.1238, test_loss: 1.2321, test_f1: 0.4396
 epoch: 8, train_loss: 1.1186, test_loss: 1.2402, test_f1: 0.4372
 epoch: 9, train_loss: 1.1036, test_loss: 1.2509, test_f1: 0.4324
 epoch: 10, train_loss: 1.1124, test_loss: 1.2375, test_f1: 0.4345
 epoch: 11, train_loss: 1.0933, test_loss: 1.2322, test_f1: 0.4420
 epoch: 12, train_loss: 1.0801, test_loss: 1.2294, test_f1: 0.4470
 epoch: 13, train_loss: 1.0759, test_loss: 1.2322, test_f1: 0.4349
 epoch: 14, train_loss: 1.0621, test_loss: 1.2437, test_f1: 0.4874
 epoch: 15, train_loss: 1.0480, test_loss: 1.2412, test_f1: 0.4528
 epoch: 16, train_loss: 1.0457, test_loss: 1.2392, test_f1: 0.4837
 epoch: 17, train_loss: 1.0421, test_loss: 1.2303, test_f1: 0.4871
 epoch: 18, train_loss: 1.0347, test_loss: 1.2269, test_f1: 0.4900
 epoch: 19, train_loss: 1.0202, test_loss: 1.2146, test_f1: 0.5022
 epoch: 20, train_loss: 1.0096, test_loss: 1.2280, test_f1: 0.5197
 epoch: 21, train_loss: 1.0106, test_loss: 1.2451, test_f1: 0.5259
 epoch: 22, train_loss: 1.0026, test_loss: 1.2281, test_f1: 0.5178
 epoch: 23, train_loss: 0.9860, test_loss: 1.2431, test_f1: 0.5281
 epoch: 24, train_loss: 0.9962, test_loss: 1.2143, test_f1: 0.5278
 epoch: 25, train_loss: 0.9945, test_loss: 1.2233, test_f1: 0.5277
 epoch: 26, train_loss: 0.9690, test_loss: 1.2217, test_f1: 0.5361
 epoch: 27, train_loss: 0.9671, test_loss: 1.2368, test_f1: 0.5125
 epoch: 28, train_loss: 0.9647, test_loss: 1.2327, test_f1: 0.5138
 epoch: 29, train_loss: 0.9488, test_loss: 1.2405, test_f1: 0.5181
 epoch: 30, train_loss: 0.9582, test_loss: 1.2496, test_f1: 0.5038
 epoch: 31, train_loss: 0.9423, test_loss: 1.2292, test_f1: 0.4993
 epoch: 32, train_loss: 0.9457, test_loss: 1.2346, test_f1: 0.5245
 epoch: 33, train_loss: 0.9376, test_loss: 1.2281, test_f1: 0.4980
 epoch: 34, train_loss: 0.9502, test_loss: 1.2292, test_f1: 0.5377
 epoch: 35, train_loss: 0.9334, test_loss: 1.2346, test_f1: 0.5355
 epoch: 36, train_loss: 0.9215, test_loss: 1.2170, test_f1: 0.5381
 epoch: 37, train_loss: 0.9102, test_loss: 1.2440, test_f1: 0.5330
 epoch: 38, train_loss: 0.8939, test_loss: 1.2340, test_f1: 0.5305
 epoch: 39, train_loss: 0.8968, test_loss: 1.2384, test_f1: 0.5388
 epoch: 40, train_loss: 0.8926, test_loss: 1.2036, test_f1: 0.5547
 epoch: 41, train_loss: 0.8979, test_loss: 1.2272, test_f1: 0.5434
 epoch: 42, train_loss: 0.8938, test_loss: 1.2306, test_f1: 0.5314
 epoch: 43, train_loss: 0.8948, test_loss: 1.2360, test_f1: 0.5365
 epoch: 44, train_loss: 0.8705, test_loss: 1.2252, test_f1: 0.5359
 epoch: 45, train_loss: 0.8835, test_loss: 1.2607, test_f1: 0.5357
 epoch: 46, train_loss: 0.8764, test_loss: 1.2441, test_f1: 0.5350
 epoch: 47, train_loss: 0.8626, test_loss: 1.2544, test_f1: 0.5655
 epoch: 48, train_loss: 0.8573, test_loss: 1.2610, test_f1: 0.5236
 epoch: 49, train_loss: 0.8569, test_loss: 1.2613, test_f1: 0.5660
 epoch: 50, train_loss: 0.8507, test_loss: 1.2835, test_f1: 0.5311
 epoch: 51, train_loss: 0.8528, test_loss: 1.2762, test_f1: 0.5400
 epoch: 52, train_loss: 0.8369, test_loss: 1.2712, test_f1: 0.5373
 epoch: 53, train_loss: 0.8241, test_loss: 1.2695, test_f1: 0.5504
 epoch: 54, train_loss: 0.8310, test_loss: 1.2720, test_f1: 0.5331
 epoch: 55, train_loss: 0.8521, test_loss: 1.2787, test_f1: 0.5385
 epoch: 56, train_loss: 0.8272, test_loss: 1.2659, test_f1: 0.5569
 epoch: 57, train_loss: 0.8259, test_loss: 1.2810, test_f1: 0.5492
 epoch: 58, train_loss: 0.8060, test_loss: 1.2979, test_f1: 0.5560
 epoch: 59, train_loss: 0.8146, test_loss: 1.3036, test_f1: 0.5557
 epoch: 60, train_loss: 0.8273, test_loss: 1.2946, test_f1: 0.5556
 epoch: 61, train_loss: 0.8168, test_loss: 1.2892, test_f1: 0.5511
 epoch: 62, train_loss: 0.8097, test_loss: 1.3051, test_f1: 0.5527
 epoch: 63, train_loss: 0.8141, test_loss: 1.3170, test_f1: 0.5457
 epoch: 64, train_loss: 0.7899, test_loss: 1.3234, test_f1: 0.5458
 epoch: 65, train_loss: 0.8062, test_loss: 1.2936, test_f1: 0.5611
 epoch: 66, train_loss: 0.8189, test_loss: 1.2873, test_f1: 0.5490
 epoch: 67, train_loss: 0.8047, test_loss: 1.2849, test_f1: 0.5419
 epoch: 68, train_loss: 0.7881, test_loss: 1.2775, test_f1: 0.5567
 epoch: 69, train_loss: 0.7848, test_loss: 1.3017, test_f1: 0.5520
 epoch: 70, train_loss: 0.8190, test_loss: 1.3007, test_f1: 0.5522
 epoch: 71, train_loss: 0.7745, test_loss: 1.3050, test_f1: 0.5614
 epoch: 72, train_loss: 0.7960, test_loss: 1.2927, test_f1: 0.5737
 epoch: 73, train_loss: 0.7806, test_loss: 1.3135, test_f1: 0.5389
 epoch: 74, train_loss: 0.7919, test_loss: 1.3398, test_f1: 0.5617
 epoch: 75, train_loss: 0.7748, test_loss: 1.3399, test_f1: 0.5583
 epoch: 76, train_loss: 0.7701, test_loss: 1.3557, test_f1: 0.5521
 epoch: 77, train_loss: 0.7925, test_loss: 1.3318, test_f1: 0.5516
 epoch: 78, train_loss: 0.7843, test_loss: 1.3625, test_f1: 0.5566
 epoch: 79, train_loss: 0.7799, test_loss: 1.3737, test_f1: 0.5462
 epoch: 80, train_loss: 0.7703, test_loss: 1.3549, test_f1: 0.5589
 epoch: 81, train_loss: 0.7807, test_loss: 1.3892, test_f1: 0.5485
 epoch: 82, train_loss: 0.7709, test_loss: 1.3654, test_f1: 0.5751
 epoch: 83, train_loss: 0.7593, test_loss: 1.3598, test_f1: 0.5438
 epoch: 84, train_loss: 0.7552, test_loss: 1.3767, test_f1: 0.5374
 epoch: 85, train_loss: 0.7557, test_loss: 1.3869, test_f1: 0.5581
 epoch: 86, train_loss: 0.7496, test_loss: 1.3924, test_f1: 0.5625
 epoch: 87, train_loss: 0.7620, test_loss: 1.3942, test_f1: 0.5578
 epoch: 88, train_loss: 0.7469, test_loss: 1.3756, test_f1: 0.5619
 epoch: 89, train_loss: 0.7473, test_loss: 1.3918, test_f1: 0.5681
 epoch: 90, train_loss: 0.7593, test_loss: 1.3864, test_f1: 0.5568
 epoch: 91, train_loss: 0.7620, test_loss: 1.3933, test_f1: 0.5557
 epoch: 92, train_loss: 0.7331, test_loss: 1.3945, test_f1: 0.5393
 epoch: 93, train_loss: 0.7576, test_loss: 1.4000, test_f1: 0.5566
 epoch: 94, train_loss: 0.7422, test_loss: 1.3765, test_f1: 0.5487
 epoch: 95, train_loss: 0.7407, test_loss: 1.4366, test_f1: 0.5643
 epoch: 96, train_loss: 0.7331, test_loss: 1.4282, test_f1: 0.5611
 epoch: 97, train_loss: 0.7523, test_loss: 1.4432, test_f1: 0.5432
 epoch: 98, train_loss: 0.7342, test_loss: 1.4234, test_f1: 0.5511
 epoch: 99, train_loss: 0.7595, test_loss: 1.4115, test_f1: 0.5610
##################ITERATION #6 ****************************************
 epoch: 0, train_loss: 1.2750, test_loss: 1.3174, test_f1: 0.2991
 epoch: 1, train_loss: 1.2146, test_loss: 1.2526, test_f1: 0.3898
 epoch: 2, train_loss: 1.2027, test_loss: 1.2897, test_f1: 0.4188
 epoch: 3, train_loss: 1.1869, test_loss: 1.5806, test_f1: 0.4516
 epoch: 4, train_loss: 1.1611, test_loss: 1.9662, test_f1: 0.4384
 epoch: 5, train_loss: 1.1597, test_loss: 1.8872, test_f1: 0.4455
 epoch: 6, train_loss: 1.1381, test_loss: 2.0513, test_f1: 0.4565
 epoch: 7, train_loss: 1.1310, test_loss: 2.3804, test_f1: 0.4558
 epoch: 8, train_loss: 1.1149, test_loss: 2.1720, test_f1: 0.4645
 epoch: 9, train_loss: 1.1019, test_loss: 2.2436, test_f1: 0.4667
 epoch: 10, train_loss: 1.1069, test_loss: 2.3263, test_f1: 0.4890
 epoch: 11, train_loss: 1.0922, test_loss: 2.3175, test_f1: 0.4964
 epoch: 12, train_loss: 1.0924, test_loss: 2.3416, test_f1: 0.5222
 epoch: 13, train_loss: 1.0743, test_loss: 2.4955, test_f1: 0.5225
 epoch: 14, train_loss: 1.0637, test_loss: 2.4908, test_f1: 0.5185
 epoch: 15, train_loss: 1.0517, test_loss: 2.4201, test_f1: 0.5406
 epoch: 16, train_loss: 1.0462, test_loss: 2.5341, test_f1: 0.5347
 epoch: 17, train_loss: 1.0477, test_loss: 2.4224, test_f1: 0.5256
 epoch: 18, train_loss: 1.0442, test_loss: 2.2675, test_f1: 0.5457
 epoch: 19, train_loss: 1.0302, test_loss: 2.4388, test_f1: 0.5661
 epoch: 20, train_loss: 1.0160, test_loss: 2.6250, test_f1: 0.5351
 epoch: 21, train_loss: 1.0174, test_loss: 2.6262, test_f1: 0.5488
 epoch: 22, train_loss: 1.0205, test_loss: 2.9703, test_f1: 0.5407
 epoch: 23, train_loss: 1.0041, test_loss: 2.7916, test_f1: 0.5364
 epoch: 24, train_loss: 0.9996, test_loss: 3.1160, test_f1: 0.5452
 epoch: 25, train_loss: 0.9761, test_loss: 3.1001, test_f1: 0.5327
 epoch: 26, train_loss: 0.9806, test_loss: 2.9846, test_f1: 0.5402
 epoch: 27, train_loss: 0.9694, test_loss: 3.3024, test_f1: 0.5293
 epoch: 28, train_loss: 0.9530, test_loss: 3.2654, test_f1: 0.5181
 epoch: 29, train_loss: 0.9634, test_loss: 3.1007, test_f1: 0.5233
 epoch: 30, train_loss: 0.9486, test_loss: 3.2735, test_f1: 0.5134
 epoch: 31, train_loss: 0.9444, test_loss: 3.3128, test_f1: 0.5316
 epoch: 32, train_loss: 0.9238, test_loss: 3.6460, test_f1: 0.5225
 epoch: 33, train_loss: 0.9405, test_loss: 3.5541, test_f1: 0.5325
 epoch: 34, train_loss: 0.9138, test_loss: 3.8892, test_f1: 0.5277
 epoch: 35, train_loss: 0.9287, test_loss: 4.0412, test_f1: 0.5035
 epoch: 36, train_loss: 0.9026, test_loss: 4.1254, test_f1: 0.5344
 epoch: 37, train_loss: 0.8989, test_loss: 3.8145, test_f1: 0.5341
 epoch: 38, train_loss: 0.8905, test_loss: 4.2011, test_f1: 0.5303
 epoch: 39, train_loss: 0.8927, test_loss: 4.1123, test_f1: 0.5482
 epoch: 40, train_loss: 0.8902, test_loss: 4.4285, test_f1: 0.5477
 epoch: 41, train_loss: 0.9053, test_loss: 3.8620, test_f1: 0.5344
 epoch: 42, train_loss: 0.8620, test_loss: 3.6905, test_f1: 0.5222
 epoch: 43, train_loss: 0.8800, test_loss: 4.2378, test_f1: 0.5202
 epoch: 44, train_loss: 0.8539, test_loss: 4.0562, test_f1: 0.5357
 epoch: 45, train_loss: 0.8576, test_loss: 3.8938, test_f1: 0.5152
 epoch: 46, train_loss: 0.8559, test_loss: 3.6946, test_f1: 0.5253
 epoch: 47, train_loss: 0.8522, test_loss: 4.4616, test_f1: 0.5227
 epoch: 48, train_loss: 0.8349, test_loss: 4.2655, test_f1: 0.5270
 epoch: 49, train_loss: 0.8544, test_loss: 3.9922, test_f1: 0.5287
 epoch: 50, train_loss: 0.8303, test_loss: 3.9234, test_f1: 0.5087
 epoch: 51, train_loss: 0.8254, test_loss: 3.9151, test_f1: 0.5189
 epoch: 52, train_loss: 0.8243, test_loss: 3.9120, test_f1: 0.5166
 epoch: 53, train_loss: 0.8262, test_loss: 3.9268, test_f1: 0.5051
 epoch: 54, train_loss: 0.8235, test_loss: 3.8161, test_f1: 0.5349
 epoch: 55, train_loss: 0.8221, test_loss: 4.0312, test_f1: 0.5143
 epoch: 56, train_loss: 0.7974, test_loss: 3.8503, test_f1: 0.5233
 epoch: 57, train_loss: 0.8046, test_loss: 4.0750, test_f1: 0.5459
 epoch: 58, train_loss: 0.8028, test_loss: 3.9749, test_f1: 0.5197
 epoch: 59, train_loss: 0.8049, test_loss: 3.8144, test_f1: 0.5284
 epoch: 60, train_loss: 0.8064, test_loss: 3.8639, test_f1: 0.5100
 epoch: 61, train_loss: 0.8180, test_loss: 4.0564, test_f1: 0.5263
 epoch: 62, train_loss: 0.7934, test_loss: 4.1688, test_f1: 0.5077
 epoch: 63, train_loss: 0.8145, test_loss: 3.8041, test_f1: 0.5293
 epoch: 64, train_loss: 0.7939, test_loss: 3.8010, test_f1: 0.5088
 epoch: 65, train_loss: 0.7805, test_loss: 3.9664, test_f1: 0.5180
 epoch: 66, train_loss: 0.7976, test_loss: 3.7678, test_f1: 0.5193
 epoch: 67, train_loss: 0.7712, test_loss: 3.9963, test_f1: 0.5280
 epoch: 68, train_loss: 0.7793, test_loss: 3.8959, test_f1: 0.5169
 epoch: 69, train_loss: 0.7931, test_loss: 3.9043, test_f1: 0.5243
 epoch: 70, train_loss: 0.7814, test_loss: 3.9881, test_f1: 0.5312
 epoch: 71, train_loss: 0.7658, test_loss: 3.9783, test_f1: 0.5206
 epoch: 72, train_loss: 0.7614, test_loss: 3.8560, test_f1: 0.5066
 epoch: 73, train_loss: 0.7602, test_loss: 3.9167, test_f1: 0.5286
 epoch: 74, train_loss: 0.7578, test_loss: 3.8723, test_f1: 0.5177
 epoch: 75, train_loss: 0.7524, test_loss: 4.0919, test_f1: 0.4984
 epoch: 76, train_loss: 0.7498, test_loss: 4.0755, test_f1: 0.5146
 epoch: 77, train_loss: 0.7377, test_loss: 3.8406, test_f1: 0.4993
 epoch: 78, train_loss: 0.7609, test_loss: 4.1095, test_f1: 0.5140
 epoch: 79, train_loss: 0.7544, test_loss: 4.1083, test_f1: 0.5197
 epoch: 80, train_loss: 0.7652, test_loss: 3.9584, test_f1: 0.4993
 epoch: 81, train_loss: 0.7466, test_loss: 3.7919, test_f1: 0.5101
 epoch: 82, train_loss: 0.7444, test_loss: 3.9153, test_f1: 0.5073
 epoch: 83, train_loss: 0.7392, test_loss: 4.1577, test_f1: 0.5129
 epoch: 84, train_loss: 0.7364, test_loss: 4.0934, test_f1: 0.5094
 epoch: 85, train_loss: 0.7601, test_loss: 4.0769, test_f1: 0.5072
 epoch: 86, train_loss: 0.7506, test_loss: 4.1291, test_f1: 0.5108
 epoch: 87, train_loss: 0.7286, test_loss: 3.9810, test_f1: 0.5028
 epoch: 88, train_loss: 0.7569, test_loss: 3.9183, test_f1: 0.5051
 epoch: 89, train_loss: 0.7288, test_loss: 3.9479, test_f1: 0.5178
 epoch: 90, train_loss: 0.7324, test_loss: 3.9583, test_f1: 0.5142
 epoch: 91, train_loss: 0.7471, test_loss: 4.0661, test_f1: 0.5022
 epoch: 92, train_loss: 0.7047, test_loss: 4.0653, test_f1: 0.5181
 epoch: 93, train_loss: 0.7190, test_loss: 4.1581, test_f1: 0.5235
 epoch: 94, train_loss: 0.7322, test_loss: 4.5190, test_f1: 0.5137
 epoch: 95, train_loss: 0.7291, test_loss: 4.4789, test_f1: 0.5337
 epoch: 96, train_loss: 0.7059, test_loss: 4.2003, test_f1: 0.5390
 epoch: 97, train_loss: 0.7116, test_loss: 4.0361, test_f1: 0.5157
 epoch: 98, train_loss: 0.7127, test_loss: 4.2915, test_f1: 0.5440
 epoch: 99, train_loss: 0.7123, test_loss: 4.5691, test_f1: 0.5336
##################ITERATION #7 ****************************************
 epoch: 0, train_loss: 1.3439, test_loss: 1.3548, test_f1: 0.2887
 epoch: 1, train_loss: 1.2588, test_loss: 1.3493, test_f1: 0.3604
 epoch: 2, train_loss: 1.2295, test_loss: 1.3345, test_f1: 0.4543
 epoch: 3, train_loss: 1.1887, test_loss: 1.3310, test_f1: 0.4701
 epoch: 4, train_loss: 1.1701, test_loss: 1.2969, test_f1: 0.4945
 epoch: 5, train_loss: 1.1524, test_loss: 1.2915, test_f1: 0.4952
 epoch: 6, train_loss: 1.1370, test_loss: 1.3172, test_f1: 0.5234
 epoch: 7, train_loss: 1.1199, test_loss: 1.2924, test_f1: 0.5203
 epoch: 8, train_loss: 1.1139, test_loss: 1.2710, test_f1: 0.5334
 epoch: 9, train_loss: 1.0867, test_loss: 1.2659, test_f1: 0.5517
 epoch: 10, train_loss: 1.0699, test_loss: 1.2661, test_f1: 0.5336
 epoch: 11, train_loss: 1.0606, test_loss: 1.2369, test_f1: 0.5248
 epoch: 12, train_loss: 1.0585, test_loss: 1.2315, test_f1: 0.5171
 epoch: 13, train_loss: 1.0294, test_loss: 1.2807, test_f1: 0.5104
 epoch: 14, train_loss: 1.0426, test_loss: 1.2328, test_f1: 0.5245
 epoch: 15, train_loss: 1.0222, test_loss: 1.2693, test_f1: 0.5365
 epoch: 16, train_loss: 1.0242, test_loss: 1.2334, test_f1: 0.5275
 epoch: 17, train_loss: 1.0000, test_loss: 1.2348, test_f1: 0.5264
 epoch: 18, train_loss: 0.9900, test_loss: 1.2478, test_f1: 0.5291
 epoch: 19, train_loss: 0.9900, test_loss: 1.2392, test_f1: 0.5131
 epoch: 20, train_loss: 0.9877, test_loss: 1.2291, test_f1: 0.5277
 epoch: 21, train_loss: 0.9738, test_loss: 1.2008, test_f1: 0.5273
 epoch: 22, train_loss: 0.9568, test_loss: 1.2110, test_f1: 0.5236
 epoch: 23, train_loss: 0.9652, test_loss: 1.1930, test_f1: 0.5338
 epoch: 24, train_loss: 0.9613, test_loss: 1.2022, test_f1: 0.5239
 epoch: 25, train_loss: 0.9562, test_loss: 1.1747, test_f1: 0.5338
 epoch: 26, train_loss: 0.9345, test_loss: 1.2059, test_f1: 0.5449
 epoch: 27, train_loss: 0.9353, test_loss: 1.1964, test_f1: 0.5262
 epoch: 28, train_loss: 0.9229, test_loss: 1.2146, test_f1: 0.5045
 epoch: 29, train_loss: 0.9124, test_loss: 1.1879, test_f1: 0.5069
 epoch: 30, train_loss: 0.9226, test_loss: 1.2102, test_f1: 0.5104
 epoch: 31, train_loss: 0.9050, test_loss: 1.2037, test_f1: 0.5312
 epoch: 32, train_loss: 0.8994, test_loss: 1.2114, test_f1: 0.5253
 epoch: 33, train_loss: 0.8911, test_loss: 1.2090, test_f1: 0.5425
 epoch: 34, train_loss: 0.9009, test_loss: 1.2481, test_f1: 0.5163
 epoch: 35, train_loss: 0.8794, test_loss: 1.2674, test_f1: 0.5151
 epoch: 36, train_loss: 0.8790, test_loss: 1.2394, test_f1: 0.5276
 epoch: 37, train_loss: 0.8734, test_loss: 1.2324, test_f1: 0.5257
 epoch: 38, train_loss: 0.8583, test_loss: 1.2084, test_f1: 0.5211
 epoch: 39, train_loss: 0.8943, test_loss: 1.2097, test_f1: 0.5180
 epoch: 40, train_loss: 0.8686, test_loss: 1.2165, test_f1: 0.5409
 epoch: 41, train_loss: 0.8540, test_loss: 1.2083, test_f1: 0.5427
 epoch: 42, train_loss: 0.8428, test_loss: 1.2504, test_f1: 0.5299
 epoch: 43, train_loss: 0.8509, test_loss: 1.2569, test_f1: 0.5376
 epoch: 44, train_loss: 0.8564, test_loss: 1.2196, test_f1: 0.5567
 epoch: 45, train_loss: 0.8286, test_loss: 1.2398, test_f1: 0.5321
 epoch: 46, train_loss: 0.8444, test_loss: 1.2253, test_f1: 0.5403
 epoch: 47, train_loss: 0.8167, test_loss: 1.2464, test_f1: 0.5297
 epoch: 48, train_loss: 0.8169, test_loss: 1.2418, test_f1: 0.5386
 epoch: 49, train_loss: 0.8180, test_loss: 1.2344, test_f1: 0.5469
 epoch: 50, train_loss: 0.8258, test_loss: 1.2458, test_f1: 0.5295
 epoch: 51, train_loss: 0.8138, test_loss: 1.2458, test_f1: 0.5414
 epoch: 52, train_loss: 0.7903, test_loss: 1.2644, test_f1: 0.5569
 epoch: 53, train_loss: 0.8016, test_loss: 1.2393, test_f1: 0.5463
 epoch: 54, train_loss: 0.8149, test_loss: 1.2739, test_f1: 0.5513
 epoch: 55, train_loss: 0.7957, test_loss: 1.2510, test_f1: 0.5715
 epoch: 56, train_loss: 0.7859, test_loss: 1.2638, test_f1: 0.5594
 epoch: 57, train_loss: 0.7898, test_loss: 1.2534, test_f1: 0.5636
 epoch: 58, train_loss: 0.7882, test_loss: 1.2918, test_f1: 0.5469
 epoch: 59, train_loss: 0.7798, test_loss: 1.2736, test_f1: 0.5607
 epoch: 60, train_loss: 0.7722, test_loss: 1.3240, test_f1: 0.5656
 epoch: 61, train_loss: 0.7929, test_loss: 1.3009, test_f1: 0.5460
 epoch: 62, train_loss: 0.7889, test_loss: 1.2890, test_f1: 0.5615
 epoch: 63, train_loss: 0.7796, test_loss: 1.3507, test_f1: 0.5553
 epoch: 64, train_loss: 0.7793, test_loss: 1.2820, test_f1: 0.5667
 epoch: 65, train_loss: 0.7699, test_loss: 1.2928, test_f1: 0.5534
 epoch: 66, train_loss: 0.7628, test_loss: 1.2879, test_f1: 0.5637
 epoch: 67, train_loss: 0.7747, test_loss: 1.2701, test_f1: 0.5558
 epoch: 68, train_loss: 0.7564, test_loss: 1.3376, test_f1: 0.5561
 epoch: 69, train_loss: 0.7767, test_loss: 1.3446, test_f1: 0.5487
 epoch: 70, train_loss: 0.7593, test_loss: 1.3532, test_f1: 0.5693
 epoch: 71, train_loss: 0.7668, test_loss: 1.3457, test_f1: 0.5559
 epoch: 72, train_loss: 0.7389, test_loss: 1.3625, test_f1: 0.5685
 epoch: 73, train_loss: 0.7591, test_loss: 1.3647, test_f1: 0.5591
 epoch: 74, train_loss: 0.7683, test_loss: 1.3373, test_f1: 0.5728
 epoch: 75, train_loss: 0.7509, test_loss: 1.3545, test_f1: 0.5718
 epoch: 76, train_loss: 0.7764, test_loss: 1.3225, test_f1: 0.5717
 epoch: 77, train_loss: 0.7600, test_loss: 1.3471, test_f1: 0.5540
 epoch: 78, train_loss: 0.7486, test_loss: 1.3252, test_f1: 0.5692
 epoch: 79, train_loss: 0.7364, test_loss: 1.3271, test_f1: 0.5646
 epoch: 80, train_loss: 0.7447, test_loss: 1.3377, test_f1: 0.5713
 epoch: 81, train_loss: 0.7298, test_loss: 1.3616, test_f1: 0.5716
 epoch: 82, train_loss: 0.7326, test_loss: 1.3450, test_f1: 0.5579
 epoch: 83, train_loss: 0.7372, test_loss: 1.3533, test_f1: 0.5718
 epoch: 84, train_loss: 0.7435, test_loss: 1.3558, test_f1: 0.5622
 epoch: 85, train_loss: 0.7290, test_loss: 1.3714, test_f1: 0.5614
 epoch: 86, train_loss: 0.7435, test_loss: 1.3835, test_f1: 0.5487
 epoch: 87, train_loss: 0.7240, test_loss: 1.3721, test_f1: 0.5436
 epoch: 88, train_loss: 0.7398, test_loss: 1.3656, test_f1: 0.5661
 epoch: 89, train_loss: 0.7282, test_loss: 1.3701, test_f1: 0.5560
 epoch: 90, train_loss: 0.7343, test_loss: 1.3514, test_f1: 0.5815
 epoch: 91, train_loss: 0.7439, test_loss: 1.3518, test_f1: 0.5706
 epoch: 92, train_loss: 0.7335, test_loss: 1.3736, test_f1: 0.5824
 epoch: 93, train_loss: 0.7267, test_loss: 1.3931, test_f1: 0.5867
 epoch: 94, train_loss: 0.7233, test_loss: 1.3349, test_f1: 0.5686
 epoch: 95, train_loss: 0.7211, test_loss: 1.3839, test_f1: 0.5585
 epoch: 96, train_loss: 0.7100, test_loss: 1.4118, test_f1: 0.5755
 epoch: 97, train_loss: 0.7128, test_loss: 1.3689, test_f1: 0.5588
 epoch: 98, train_loss: 0.7318, test_loss: 1.4091, test_f1: 0.5742
 epoch: 99, train_loss: 0.7022, test_loss: 1.3985, test_f1: 0.5767
##################ITERATION #8 ****************************************
 epoch: 0, train_loss: 1.3215, test_loss: 1.3648, test_f1: 0.2572
 epoch: 1, train_loss: 1.2370, test_loss: 1.3396, test_f1: 0.3208
 epoch: 2, train_loss: 1.2283, test_loss: 1.3104, test_f1: 0.3766
 epoch: 3, train_loss: 1.2102, test_loss: 1.2938, test_f1: 0.3971
 epoch: 4, train_loss: 1.1874, test_loss: 1.2783, test_f1: 0.4140
 epoch: 5, train_loss: 1.1653, test_loss: 1.2488, test_f1: 0.4328
 epoch: 6, train_loss: 1.1605, test_loss: 1.2511, test_f1: 0.4627
 epoch: 7, train_loss: 1.1343, test_loss: 1.2417, test_f1: 0.4576
 epoch: 8, train_loss: 1.1289, test_loss: 1.2337, test_f1: 0.4731
 epoch: 9, train_loss: 1.1199, test_loss: 1.2210, test_f1: 0.4923
 epoch: 10, train_loss: 1.1225, test_loss: 1.2184, test_f1: 0.4934
 epoch: 11, train_loss: 1.0876, test_loss: 1.2113, test_f1: 0.4860
 epoch: 12, train_loss: 1.0991, test_loss: 1.2299, test_f1: 0.5008
 epoch: 13, train_loss: 1.0790, test_loss: 1.2232, test_f1: 0.4951
 epoch: 14, train_loss: 1.0706, test_loss: 1.2405, test_f1: 0.5022
 epoch: 15, train_loss: 1.0742, test_loss: 1.2126, test_f1: 0.5246
 epoch: 16, train_loss: 1.0378, test_loss: 1.2276, test_f1: 0.5196
 epoch: 17, train_loss: 1.0488, test_loss: 1.2367, test_f1: 0.5046
 epoch: 18, train_loss: 1.0357, test_loss: 1.2291, test_f1: 0.4945
 epoch: 19, train_loss: 1.0325, test_loss: 1.2302, test_f1: 0.4706
 epoch: 20, train_loss: 1.0123, test_loss: 1.2017, test_f1: 0.5221
 epoch: 21, train_loss: 1.0074, test_loss: 1.2032, test_f1: 0.5339
 epoch: 22, train_loss: 1.0127, test_loss: 1.2067, test_f1: 0.5491
 epoch: 23, train_loss: 0.9956, test_loss: 1.2024, test_f1: 0.5322
 epoch: 24, train_loss: 0.9763, test_loss: 1.2012, test_f1: 0.5174
 epoch: 25, train_loss: 0.9930, test_loss: 1.1813, test_f1: 0.5160
 epoch: 26, train_loss: 0.9650, test_loss: 1.1997, test_f1: 0.5447
 epoch: 27, train_loss: 0.9768, test_loss: 1.2482, test_f1: 0.5086
 epoch: 28, train_loss: 0.9579, test_loss: 1.2291, test_f1: 0.5244
 epoch: 29, train_loss: 0.9456, test_loss: 1.2494, test_f1: 0.5339
 epoch: 30, train_loss: 0.9494, test_loss: 1.2447, test_f1: 0.5040
 epoch: 31, train_loss: 0.9444, test_loss: 1.2292, test_f1: 0.5227
 epoch: 32, train_loss: 0.9390, test_loss: 1.2367, test_f1: 0.5498
 epoch: 33, train_loss: 0.9241, test_loss: 1.2059, test_f1: 0.5697
 epoch: 34, train_loss: 0.9296, test_loss: 1.2159, test_f1: 0.5514
 epoch: 35, train_loss: 0.9011, test_loss: 1.2219, test_f1: 0.5351
 epoch: 36, train_loss: 0.8991, test_loss: 1.2159, test_f1: 0.5421
 epoch: 37, train_loss: 0.9090, test_loss: 1.2423, test_f1: 0.5224
 epoch: 38, train_loss: 0.9071, test_loss: 1.2249, test_f1: 0.5351
 epoch: 39, train_loss: 0.8775, test_loss: 1.2558, test_f1: 0.5433
 epoch: 40, train_loss: 0.8809, test_loss: 1.2668, test_f1: 0.5433
 epoch: 41, train_loss: 0.8769, test_loss: 1.2459, test_f1: 0.5596
 epoch: 42, train_loss: 0.8707, test_loss: 1.2570, test_f1: 0.5618
 epoch: 43, train_loss: 0.8461, test_loss: 1.2640, test_f1: 0.5585
 epoch: 44, train_loss: 0.8685, test_loss: 1.3001, test_f1: 0.5585
 epoch: 45, train_loss: 0.8595, test_loss: 1.2851, test_f1: 0.5624
 epoch: 46, train_loss: 0.8507, test_loss: 1.3101, test_f1: 0.5535
 epoch: 47, train_loss: 0.8445, test_loss: 1.3077, test_f1: 0.5642
 epoch: 48, train_loss: 0.8451, test_loss: 1.2648, test_f1: 0.5725
 epoch: 49, train_loss: 0.8360, test_loss: 1.2950, test_f1: 0.5731
 epoch: 50, train_loss: 0.8390, test_loss: 1.2803, test_f1: 0.5729
 epoch: 51, train_loss: 0.8311, test_loss: 1.2628, test_f1: 0.5907
 epoch: 52, train_loss: 0.8248, test_loss: 1.2634, test_f1: 0.5843
 epoch: 53, train_loss: 0.8211, test_loss: 1.2758, test_f1: 0.5723
 epoch: 54, train_loss: 0.8155, test_loss: 1.2956, test_f1: 0.5806
 epoch: 55, train_loss: 0.8053, test_loss: 1.2635, test_f1: 0.5642
 epoch: 56, train_loss: 0.8143, test_loss: 1.2859, test_f1: 0.5620
 epoch: 57, train_loss: 0.8072, test_loss: 1.2756, test_f1: 0.5838
 epoch: 58, train_loss: 0.7906, test_loss: 1.3051, test_f1: 0.5807
 epoch: 59, train_loss: 0.8113, test_loss: 1.2920, test_f1: 0.5756
 epoch: 60, train_loss: 0.8277, test_loss: 1.2975, test_f1: 0.5810
 epoch: 61, train_loss: 0.8124, test_loss: 1.2820, test_f1: 0.6143
 epoch: 62, train_loss: 0.8050, test_loss: 1.2926, test_f1: 0.5886
 epoch: 63, train_loss: 0.8007, test_loss: 1.3234, test_f1: 0.5835
 epoch: 64, train_loss: 0.7963, test_loss: 1.2897, test_f1: 0.5814
 epoch: 65, train_loss: 0.7978, test_loss: 1.3250, test_f1: 0.5869
 epoch: 66, train_loss: 0.7821, test_loss: 1.2993, test_f1: 0.5895
 epoch: 67, train_loss: 0.7915, test_loss: 1.3215, test_f1: 0.5757
 epoch: 68, train_loss: 0.7791, test_loss: 1.3332, test_f1: 0.5621
 epoch: 69, train_loss: 0.7936, test_loss: 1.3337, test_f1: 0.5812
 epoch: 70, train_loss: 0.7854, test_loss: 1.3466, test_f1: 0.5727
 epoch: 71, train_loss: 0.7835, test_loss: 1.3707, test_f1: 0.5664
 epoch: 72, train_loss: 0.7693, test_loss: 1.3522, test_f1: 0.5657
 epoch: 73, train_loss: 0.7565, test_loss: 1.3293, test_f1: 0.5694
 epoch: 74, train_loss: 0.7670, test_loss: 1.3422, test_f1: 0.5741
 epoch: 75, train_loss: 0.7572, test_loss: 1.3679, test_f1: 0.5756
 epoch: 76, train_loss: 0.7903, test_loss: 1.4026, test_f1: 0.5575
 epoch: 77, train_loss: 0.7647, test_loss: 1.3513, test_f1: 0.5632
 epoch: 78, train_loss: 0.7694, test_loss: 1.3474, test_f1: 0.5861
 epoch: 79, train_loss: 0.7718, test_loss: 1.3612, test_f1: 0.5591
 epoch: 80, train_loss: 0.7502, test_loss: 1.3483, test_f1: 0.5787
 epoch: 81, train_loss: 0.7575, test_loss: 1.3585, test_f1: 0.5763
 epoch: 82, train_loss: 0.7542, test_loss: 1.3662, test_f1: 0.5736
 epoch: 83, train_loss: 0.7390, test_loss: 1.3676, test_f1: 0.5627
 epoch: 84, train_loss: 0.7524, test_loss: 1.3751, test_f1: 0.5629
 epoch: 85, train_loss: 0.7582, test_loss: 1.3354, test_f1: 0.5626
 epoch: 86, train_loss: 0.7640, test_loss: 1.3826, test_f1: 0.5540
 epoch: 87, train_loss: 0.7393, test_loss: 1.4004, test_f1: 0.5497
 epoch: 88, train_loss: 0.7568, test_loss: 1.3733, test_f1: 0.5734
 epoch: 89, train_loss: 0.7469, test_loss: 1.3855, test_f1: 0.5708
 epoch: 90, train_loss: 0.7421, test_loss: 1.3751, test_f1: 0.5468
 epoch: 91, train_loss: 0.7256, test_loss: 1.4011, test_f1: 0.5652
 epoch: 92, train_loss: 0.7370, test_loss: 1.4273, test_f1: 0.5631
 epoch: 93, train_loss: 0.7363, test_loss: 1.3950, test_f1: 0.5731
 epoch: 94, train_loss: 0.7349, test_loss: 1.3981, test_f1: 0.5657
 epoch: 95, train_loss: 0.7213, test_loss: 1.3988, test_f1: 0.5678
 epoch: 96, train_loss: 0.7369, test_loss: 1.4187, test_f1: 0.5490
 epoch: 97, train_loss: 0.7243, test_loss: 1.3945, test_f1: 0.5734
 epoch: 98, train_loss: 0.7254, test_loss: 1.3654, test_f1: 0.5670
 epoch: 99, train_loss: 0.7258, test_loss: 1.3722, test_f1: 0.5757
##################ITERATION #9 ****************************************
 epoch: 0, train_loss: 1.3537, test_loss: 1.2996, test_f1: 0.3015
 epoch: 1, train_loss: 1.2523, test_loss: 1.3131, test_f1: 0.3102
 epoch: 2, train_loss: 1.2224, test_loss: 1.2909, test_f1: 0.3254
 epoch: 3, train_loss: 1.2068, test_loss: 1.3067, test_f1: 0.3431
 epoch: 4, train_loss: 1.1758, test_loss: 1.2887, test_f1: 0.3390
 epoch: 5, train_loss: 1.1761, test_loss: 1.2722, test_f1: 0.3617
 epoch: 6, train_loss: 1.1660, test_loss: 1.2814, test_f1: 0.3579
 epoch: 7, train_loss: 1.1644, test_loss: 1.2571, test_f1: 0.3859
 epoch: 8, train_loss: 1.1554, test_loss: 1.2638, test_f1: 0.4014
 epoch: 9, train_loss: 1.1188, test_loss: 1.2789, test_f1: 0.3935
 epoch: 10, train_loss: 1.1097, test_loss: 1.2720, test_f1: 0.4106
 epoch: 11, train_loss: 1.1178, test_loss: 1.2547, test_f1: 0.4378
 epoch: 12, train_loss: 1.1083, test_loss: 1.2755, test_f1: 0.4352
 epoch: 13, train_loss: 1.0929, test_loss: 1.2554, test_f1: 0.4544
 epoch: 14, train_loss: 1.0947, test_loss: 1.2239, test_f1: 0.4454
 epoch: 15, train_loss: 1.0795, test_loss: 1.2366, test_f1: 0.4520
 epoch: 16, train_loss: 1.0797, test_loss: 1.2128, test_f1: 0.4525
 epoch: 17, train_loss: 1.0771, test_loss: 1.2008, test_f1: 0.4639
 epoch: 18, train_loss: 1.0542, test_loss: 1.2098, test_f1: 0.4617
 epoch: 19, train_loss: 1.0372, test_loss: 1.2081, test_f1: 0.4865
 epoch: 20, train_loss: 1.0457, test_loss: 1.1990, test_f1: 0.5149
 epoch: 21, train_loss: 1.0295, test_loss: 1.2203, test_f1: 0.5146
 epoch: 22, train_loss: 1.0332, test_loss: 1.2010, test_f1: 0.5191
 epoch: 23, train_loss: 1.0234, test_loss: 1.2073, test_f1: 0.5064
 epoch: 24, train_loss: 1.0279, test_loss: 1.2403, test_f1: 0.5151
 epoch: 25, train_loss: 0.9978, test_loss: 1.1899, test_f1: 0.5227
 epoch: 26, train_loss: 1.0135, test_loss: 1.1950, test_f1: 0.5279
 epoch: 27, train_loss: 0.9865, test_loss: 1.2216, test_f1: 0.5311
 epoch: 28, train_loss: 0.9826, test_loss: 1.2122, test_f1: 0.5315
 epoch: 29, train_loss: 0.9840, test_loss: 1.2051, test_f1: 0.5466
 epoch: 30, train_loss: 0.9943, test_loss: 1.2162, test_f1: 0.5437
 epoch: 31, train_loss: 0.9656, test_loss: 1.2349, test_f1: 0.5388
 epoch: 32, train_loss: 0.9678, test_loss: 1.2133, test_f1: 0.5375
 epoch: 33, train_loss: 0.9542, test_loss: 1.2151, test_f1: 0.5400
 epoch: 34, train_loss: 0.9435, test_loss: 1.2104, test_f1: 0.5372
 epoch: 35, train_loss: 0.9348, test_loss: 1.2214, test_f1: 0.5285
 epoch: 36, train_loss: 0.9300, test_loss: 1.2029, test_f1: 0.5247
 epoch: 37, train_loss: 0.9172, test_loss: 1.2012, test_f1: 0.5366
 epoch: 38, train_loss: 0.9084, test_loss: 1.2180, test_f1: 0.5391
 epoch: 39, train_loss: 0.9183, test_loss: 1.2038, test_f1: 0.5555
 epoch: 40, train_loss: 0.9283, test_loss: 1.2187, test_f1: 0.5252
 epoch: 41, train_loss: 0.8954, test_loss: 1.2221, test_f1: 0.5543
 epoch: 42, train_loss: 0.9043, test_loss: 1.2394, test_f1: 0.5270
 epoch: 43, train_loss: 0.8887, test_loss: 1.2141, test_f1: 0.5668
 epoch: 44, train_loss: 0.8953, test_loss: 1.2169, test_f1: 0.5517
 epoch: 45, train_loss: 0.8791, test_loss: 1.2257, test_f1: 0.5518
 epoch: 46, train_loss: 0.8613, test_loss: 1.2403, test_f1: 0.5285
 epoch: 47, train_loss: 0.8588, test_loss: 1.2304, test_f1: 0.5342
 epoch: 48, train_loss: 0.8627, test_loss: 1.2377, test_f1: 0.5297
 epoch: 49, train_loss: 0.8685, test_loss: 1.2109, test_f1: 0.5736
 epoch: 50, train_loss: 0.8695, test_loss: 1.2221, test_f1: 0.5348
 epoch: 51, train_loss: 0.8614, test_loss: 1.2365, test_f1: 0.5578
 epoch: 52, train_loss: 0.8330, test_loss: 1.2413, test_f1: 0.5392
 epoch: 53, train_loss: 0.8624, test_loss: 1.2734, test_f1: 0.5444
 epoch: 54, train_loss: 0.8369, test_loss: 1.2182, test_f1: 0.5504
 epoch: 55, train_loss: 0.8543, test_loss: 1.2571, test_f1: 0.5508
 epoch: 56, train_loss: 0.8443, test_loss: 1.2405, test_f1: 0.5531
 epoch: 57, train_loss: 0.8430, test_loss: 1.2662, test_f1: 0.5571
 epoch: 58, train_loss: 0.8327, test_loss: 1.2907, test_f1: 0.5622
 epoch: 59, train_loss: 0.8208, test_loss: 1.2623, test_f1: 0.5539
 epoch: 60, train_loss: 0.8351, test_loss: 1.2610, test_f1: 0.5415
 epoch: 61, train_loss: 0.8105, test_loss: 1.2574, test_f1: 0.5491
 epoch: 62, train_loss: 0.8130, test_loss: 1.2565, test_f1: 0.5489
 epoch: 63, train_loss: 0.8344, test_loss: 1.2425, test_f1: 0.5534
 epoch: 64, train_loss: 0.8163, test_loss: 1.2758, test_f1: 0.5161
 epoch: 65, train_loss: 0.8193, test_loss: 1.2626, test_f1: 0.5436
 epoch: 66, train_loss: 0.8129, test_loss: 1.2558, test_f1: 0.5432
 epoch: 67, train_loss: 0.8077, test_loss: 1.2741, test_f1: 0.5446
 epoch: 68, train_loss: 0.7996, test_loss: 1.2381, test_f1: 0.5659
 epoch: 69, train_loss: 0.7970, test_loss: 1.2412, test_f1: 0.5653
 epoch: 70, train_loss: 0.8059, test_loss: 1.2592, test_f1: 0.5580
 epoch: 71, train_loss: 0.8033, test_loss: 1.2705, test_f1: 0.5655
 epoch: 72, train_loss: 0.7964, test_loss: 1.2419, test_f1: 0.5558
 epoch: 73, train_loss: 0.7796, test_loss: 1.2450, test_f1: 0.5690
 epoch: 74, train_loss: 0.7794, test_loss: 1.2893, test_f1: 0.5626
 epoch: 75, train_loss: 0.8037, test_loss: 1.2688, test_f1: 0.5590
 epoch: 76, train_loss: 0.7944, test_loss: 1.2558, test_f1: 0.5550
 epoch: 77, train_loss: 0.7808, test_loss: 1.2662, test_f1: 0.5628
 epoch: 78, train_loss: 0.7799, test_loss: 1.2708, test_f1: 0.5544
 epoch: 79, train_loss: 0.7711, test_loss: 1.2839, test_f1: 0.5576
 epoch: 80, train_loss: 0.7648, test_loss: 1.2712, test_f1: 0.5468
 epoch: 81, train_loss: 0.7829, test_loss: 1.2637, test_f1: 0.5511
 epoch: 82, train_loss: 0.7547, test_loss: 1.2666, test_f1: 0.5566
 epoch: 83, train_loss: 0.7645, test_loss: 1.2826, test_f1: 0.5615
 epoch: 84, train_loss: 0.7613, test_loss: 1.2916, test_f1: 0.5395
 epoch: 85, train_loss: 0.7620, test_loss: 1.3031, test_f1: 0.5543
 epoch: 86, train_loss: 0.7624, test_loss: 1.3167, test_f1: 0.5623
 epoch: 87, train_loss: 0.7650, test_loss: 1.2824, test_f1: 0.5585
 epoch: 88, train_loss: 0.7508, test_loss: 1.2612, test_f1: 0.5608
 epoch: 89, train_loss: 0.7593, test_loss: 1.2866, test_f1: 0.5569
 epoch: 90, train_loss: 0.7517, test_loss: 1.2927, test_f1: 0.5614
 epoch: 91, train_loss: 0.7481, test_loss: 1.2812, test_f1: 0.5645
 epoch: 92, train_loss: 0.7465, test_loss: 1.2587, test_f1: 0.5805
 epoch: 93, train_loss: 0.7355, test_loss: 1.3002, test_f1: 0.5734
 epoch: 94, train_loss: 0.7423, test_loss: 1.3011, test_f1: 0.5502
 epoch: 95, train_loss: 0.7342, test_loss: 1.2979, test_f1: 0.5745
 epoch: 96, train_loss: 0.7488, test_loss: 1.3445, test_f1: 0.5572
 epoch: 97, train_loss: 0.7498, test_loss: 1.2939, test_f1: 0.5646
 epoch: 98, train_loss: 0.7262, test_loss: 1.3623, test_f1: 0.5445
 epoch: 99, train_loss: 0.7314, test_loss: 1.3164, test_f1: 0.5410

Training completed in 619.53 seconds
Best F1: 0.6143 at epoch 61
Mean F1 across iterations: 0.5724  0.0223
========================FINAL RESULTS================================
FEGIN weighted F1: 0.6143  0.0223
python main.py --data ltspice_demos --representation component_component --model FEGIN --layers 4 --hiddens 64 --batch_size 64 --lr 0.0001 --emb_size 250 --epochs 100 --save_appendix component_component_L4_H64_BS64_LR0.0001_E250 --no_val
-----



STDERR:
  File "main.py", line 370, in <module>
    main()
  File "main.py", line 254, in main
    dataset = dataset_class(
  File "/home/philip/projects/ltspice_examples_code_repo/Circuit-Completion-Using-GNNs/component_classification_with_link_prediction_head/evaluation/FEGIN/kernel/circuit_datasets.py", line 15, in __init__
    self.data, self.slices = torch.load(self.processed_paths[0])
  File "/home/philip/.local/lib/python3.8/site-packages/torch/serialization.py", line 1040, in load
    warnings.warn(
  File "/usr/lib/python3.8/warnings.py", line 109, in _showwarnmsg
    sw(msg.message, msg.category, msg.filename, msg.lineno,
  File "main.py", line 47, in warn_with_traceback
    traceback.print_stack(file=log)
/home/philip/projects/ltspice_examples_code_repo/Circuit-Completion-Using-GNNs/component_classification_with_link_prediction_head/evaluation/FEGIN/kernel/circuit_datasets.py:15: FutureWarning: You are using `torch.load` with `weights_only=False` (the current default value), which uses the default pickle module implicitly. It is possible to construct malicious pickle data which will execute arbitrary code during unpickling (See https://github.com/pytorch/pytorch/blob/main/SECURITY.md#untrusted-models for more details). In a future release, the default value for `weights_only` will be flipped to `True`. This limits the functions that could be executed during unpickling. Arbitrary objects will no longer be allowed to be loaded via this mode unless they are explicitly allowlisted by the user via `torch.serialization.add_safe_globals`. We recommend you start setting `weights_only=True` for any use case where you don't have full control of the loaded file. Please open an issue on GitHub for any issues related to this experimental feature.
  self.data, self.slices = torch.load(self.processed_paths[0])
