STDOUT:
Results will be saved in /home/philip/projects/ltspice_examples_code_repo/Circuit-Completion-Using-GNNs/component_classification_with_link_prediction_head/evaluation/FEGIN/results/model_FEGIN_dataset_ltspice_demos
Command line input: python main.py --data ltspice_demos --representation component_pin_net --model FEGIN --layers 4 --hiddens 16 --batch_size 32 --lr 0.01 --emb_size 250 --epochs 100 --save_appendix component_pin_net_L4_H16_BS32_LR0.01_E250 --no_val
 is saved.
-----
ltspice_demos - FEGIN
Using 4 layers, 16 hidden units, h = 2
Loading component_pin_net representation dataset
ENTERED
Training FEGIN on component_pin_net representation
Train: 1565, Test: 383
##################ITERATION #0 ****************************************
 epoch: 0, train_loss: 1.2273, test_loss: 1.2997, test_f1: 0.3091
 epoch: 1, train_loss: 1.0903, test_loss: 1.2157, test_f1: 0.3732
 epoch: 2, train_loss: 1.0457, test_loss: 1.3161, test_f1: 0.3234
 epoch: 3, train_loss: 1.0304, test_loss: 1.1581, test_f1: 0.4257
 epoch: 4, train_loss: 1.0173, test_loss: 1.1925, test_f1: 0.3527
 epoch: 5, train_loss: 1.0272, test_loss: 1.0672, test_f1: 0.3705
 epoch: 6, train_loss: 0.9927, test_loss: 1.0866, test_f1: 0.4778
 epoch: 7, train_loss: 0.9994, test_loss: 1.1335, test_f1: 0.4568
 epoch: 8, train_loss: 0.9983, test_loss: 1.1391, test_f1: 0.3959
 epoch: 9, train_loss: 0.9721, test_loss: 1.0445, test_f1: 0.5177
 epoch: 10, train_loss: 0.9512, test_loss: 1.0727, test_f1: 0.4577
 epoch: 11, train_loss: 0.9611, test_loss: 1.0523, test_f1: 0.4811
 epoch: 12, train_loss: 0.9445, test_loss: 1.0629, test_f1: 0.4278
 epoch: 13, train_loss: 0.9678, test_loss: 1.1167, test_f1: 0.5219
 epoch: 14, train_loss: 0.9257, test_loss: 1.7524, test_f1: 0.3067
 epoch: 15, train_loss: 0.9114, test_loss: 1.0669, test_f1: 0.4488
 epoch: 16, train_loss: 0.8883, test_loss: 0.9875, test_f1: 0.5506
 epoch: 17, train_loss: 0.8878, test_loss: 0.9835, test_f1: 0.5572
 epoch: 18, train_loss: 0.8721, test_loss: 0.9613, test_f1: 0.4630
 epoch: 19, train_loss: 0.8858, test_loss: 0.9772, test_f1: 0.4687
 epoch: 20, train_loss: 0.8941, test_loss: 1.3190, test_f1: 0.4528
 epoch: 21, train_loss: 0.8823, test_loss: 0.9539, test_f1: 0.5970
 epoch: 22, train_loss: 0.8517, test_loss: 0.9288, test_f1: 0.5698
 epoch: 23, train_loss: 0.8601, test_loss: 1.0719, test_f1: 0.5079
 epoch: 24, train_loss: 0.8737, test_loss: 0.9833, test_f1: 0.5536
 epoch: 25, train_loss: 0.8283, test_loss: 1.1427, test_f1: 0.5219
 epoch: 26, train_loss: 0.8357, test_loss: 1.0555, test_f1: 0.3923
 epoch: 27, train_loss: 0.8290, test_loss: 1.0692, test_f1: 0.5784
 epoch: 28, train_loss: 0.8379, test_loss: 0.9951, test_f1: 0.4977
 epoch: 29, train_loss: 0.8495, test_loss: 1.1017, test_f1: 0.4081
 epoch: 30, train_loss: 0.8224, test_loss: 0.9684, test_f1: 0.5814
 epoch: 31, train_loss: 0.8332, test_loss: 1.0212, test_f1: 0.5628
 epoch: 32, train_loss: 0.8367, test_loss: 1.1393, test_f1: 0.5387
 epoch: 33, train_loss: 0.8222, test_loss: 1.0132, test_f1: 0.5301
 epoch: 34, train_loss: 0.8219, test_loss: 2.0670, test_f1: 0.4148
 epoch: 35, train_loss: 0.8219, test_loss: 1.0737, test_f1: 0.5468
 epoch: 36, train_loss: 0.7985, test_loss: 1.0308, test_f1: 0.5604
 epoch: 37, train_loss: 0.7957, test_loss: 0.9862, test_f1: 0.5509
 epoch: 38, train_loss: 0.8300, test_loss: 0.9760, test_f1: 0.5837
 epoch: 39, train_loss: 0.8210, test_loss: 1.0016, test_f1: 0.5692
 epoch: 40, train_loss: 0.8122, test_loss: 0.9709, test_f1: 0.6067
 epoch: 41, train_loss: 0.8032, test_loss: 1.0854, test_f1: 0.4492
 epoch: 42, train_loss: 0.8096, test_loss: 0.9797, test_f1: 0.6067
 epoch: 43, train_loss: 0.8085, test_loss: 1.1640, test_f1: 0.5426
 epoch: 44, train_loss: 0.7844, test_loss: 0.9937, test_f1: 0.6368
 epoch: 45, train_loss: 0.7985, test_loss: 1.2392, test_f1: 0.4021
 epoch: 46, train_loss: 0.8037, test_loss: 0.9794, test_f1: 0.5885
 epoch: 47, train_loss: 0.7862, test_loss: 0.9391, test_f1: 0.6098
 epoch: 48, train_loss: 0.7887, test_loss: 0.9477, test_f1: 0.6157
 epoch: 49, train_loss: 0.7867, test_loss: 1.1385, test_f1: 0.5456
 epoch: 50, train_loss: 0.7841, test_loss: 0.9440, test_f1: 0.6226
 epoch: 51, train_loss: 0.7806, test_loss: 0.9427, test_f1: 0.6212
 epoch: 52, train_loss: 0.7728, test_loss: 0.9545, test_f1: 0.5884
 epoch: 53, train_loss: 0.7574, test_loss: 0.9461, test_f1: 0.5914
 epoch: 54, train_loss: 0.7579, test_loss: 1.0447, test_f1: 0.5565
 epoch: 55, train_loss: 0.7567, test_loss: 0.9634, test_f1: 0.5968
 epoch: 56, train_loss: 0.7400, test_loss: 0.9628, test_f1: 0.5883
 epoch: 57, train_loss: 0.7524, test_loss: 0.9522, test_f1: 0.6097
 epoch: 58, train_loss: 0.7443, test_loss: 0.9664, test_f1: 0.6056
 epoch: 59, train_loss: 0.7501, test_loss: 0.9526, test_f1: 0.6253
 epoch: 60, train_loss: 0.7342, test_loss: 1.0725, test_f1: 0.5670
 epoch: 61, train_loss: 0.7368, test_loss: 1.0616, test_f1: 0.5661
 epoch: 62, train_loss: 0.7278, test_loss: 1.2178, test_f1: 0.5329
 epoch: 63, train_loss: 0.7506, test_loss: 0.9871, test_f1: 0.5784
 epoch: 64, train_loss: 0.7504, test_loss: 0.9746, test_f1: 0.5913
 epoch: 65, train_loss: 0.7338, test_loss: 0.9669, test_f1: 0.6268
 epoch: 66, train_loss: 0.7278, test_loss: 1.2497, test_f1: 0.5716
 epoch: 67, train_loss: 0.7302, test_loss: 1.0007, test_f1: 0.5862
 epoch: 68, train_loss: 0.7272, test_loss: 1.1156, test_f1: 0.5577
 epoch: 69, train_loss: 0.7488, test_loss: 0.9626, test_f1: 0.6278
 epoch: 70, train_loss: 0.7298, test_loss: 0.9998, test_f1: 0.5874
 epoch: 71, train_loss: 0.7443, test_loss: 0.9897, test_f1: 0.5837
 epoch: 72, train_loss: 0.7235, test_loss: 0.9099, test_f1: 0.6407
 epoch: 73, train_loss: 0.7380, test_loss: 0.9830, test_f1: 0.6097
 epoch: 74, train_loss: 0.7261, test_loss: 1.0196, test_f1: 0.5997
 epoch: 75, train_loss: 0.7432, test_loss: 0.9508, test_f1: 0.6620
 epoch: 76, train_loss: 0.7112, test_loss: 1.0345, test_f1: 0.6189
 epoch: 77, train_loss: 0.7157, test_loss: 0.9750, test_f1: 0.6142
 epoch: 78, train_loss: 0.7097, test_loss: 1.0706, test_f1: 0.6022
 epoch: 79, train_loss: 0.7215, test_loss: 0.9899, test_f1: 0.6062
 epoch: 80, train_loss: 0.7137, test_loss: 0.9980, test_f1: 0.5647
 epoch: 81, train_loss: 0.7174, test_loss: 0.9860, test_f1: 0.6312
 epoch: 82, train_loss: 0.7204, test_loss: 0.9894, test_f1: 0.6241
 epoch: 83, train_loss: 0.7175, test_loss: 0.9875, test_f1: 0.6323
 epoch: 84, train_loss: 0.7091, test_loss: 0.9955, test_f1: 0.5783
 epoch: 85, train_loss: 0.7033, test_loss: 1.0474, test_f1: 0.6400
 epoch: 86, train_loss: 0.7219, test_loss: 0.9772, test_f1: 0.5708
 epoch: 87, train_loss: 0.7178, test_loss: 0.9528, test_f1: 0.6079
 epoch: 88, train_loss: 0.7260, test_loss: 0.9283, test_f1: 0.6395
 epoch: 89, train_loss: 0.7168, test_loss: 0.9771, test_f1: 0.6108
 epoch: 90, train_loss: 0.7163, test_loss: 1.0129, test_f1: 0.6203
 epoch: 91, train_loss: 0.7261, test_loss: 0.9304, test_f1: 0.5561
 epoch: 92, train_loss: 0.7059, test_loss: 0.9810, test_f1: 0.6064
 epoch: 93, train_loss: 0.6919, test_loss: 0.9899, test_f1: 0.6298
 epoch: 94, train_loss: 0.6955, test_loss: 0.9574, test_f1: 0.6719
 epoch: 95, train_loss: 0.7061, test_loss: 0.9346, test_f1: 0.6331
 epoch: 96, train_loss: 0.6915, test_loss: 1.0363, test_f1: 0.6229
 epoch: 97, train_loss: 0.6933, test_loss: 1.0053, test_f1: 0.5736
 epoch: 98, train_loss: 0.6988, test_loss: 0.9515, test_f1: 0.6529
 epoch: 99, train_loss: 0.6976, test_loss: 0.9606, test_f1: 0.5525
##################ITERATION #1 ****************************************
 epoch: 0, train_loss: 1.0949, test_loss: 1.2622, test_f1: 0.2692
 epoch: 1, train_loss: 1.0222, test_loss: 1.0888, test_f1: 0.4545
 epoch: 2, train_loss: 0.9815, test_loss: 1.1518, test_f1: 0.4495
 epoch: 3, train_loss: 0.9834, test_loss: 1.0241, test_f1: 0.5279
 epoch: 4, train_loss: 0.9609, test_loss: 1.1608, test_f1: 0.4861
 epoch: 5, train_loss: 0.9298, test_loss: 1.0308, test_f1: 0.5169
 epoch: 6, train_loss: 0.9089, test_loss: 0.9604, test_f1: 0.5810
 epoch: 7, train_loss: 0.9366, test_loss: 1.0273, test_f1: 0.4808
 epoch: 8, train_loss: 0.9186, test_loss: 1.2526, test_f1: 0.4405
 epoch: 9, train_loss: 0.9075, test_loss: 1.0334, test_f1: 0.5286
 epoch: 10, train_loss: 0.8845, test_loss: 1.0079, test_f1: 0.5091
 epoch: 11, train_loss: 0.9091, test_loss: 0.9942, test_f1: 0.5419
 epoch: 12, train_loss: 0.9014, test_loss: 1.0342, test_f1: 0.5199
 epoch: 13, train_loss: 0.8959, test_loss: 0.9601, test_f1: 0.5592
 epoch: 14, train_loss: 0.8687, test_loss: 0.9839, test_f1: 0.5397
 epoch: 15, train_loss: 0.8577, test_loss: 0.9724, test_f1: 0.5248
 epoch: 16, train_loss: 0.8482, test_loss: 1.2617, test_f1: 0.4707
 epoch: 17, train_loss: 0.8566, test_loss: 0.9937, test_f1: 0.5468
 epoch: 18, train_loss: 0.8476, test_loss: 1.4188, test_f1: 0.4491
 epoch: 19, train_loss: 0.8552, test_loss: 0.9627, test_f1: 0.5625
 epoch: 20, train_loss: 0.8627, test_loss: 1.0244, test_f1: 0.5682
 epoch: 21, train_loss: 0.8327, test_loss: 1.0157, test_f1: 0.5803
 epoch: 22, train_loss: 0.8244, test_loss: 0.9879, test_f1: 0.5504
 epoch: 23, train_loss: 0.8393, test_loss: 0.9812, test_f1: 0.5897
 epoch: 24, train_loss: 0.8223, test_loss: 0.9591, test_f1: 0.6009
 epoch: 25, train_loss: 0.8392, test_loss: 1.0174, test_f1: 0.5451
 epoch: 26, train_loss: 0.8384, test_loss: 0.9924, test_f1: 0.4884
 epoch: 27, train_loss: 0.8350, test_loss: 0.9865, test_f1: 0.5813
 epoch: 28, train_loss: 0.8220, test_loss: 0.9937, test_f1: 0.5606
 epoch: 29, train_loss: 0.8150, test_loss: 1.8395, test_f1: 0.4255
 epoch: 30, train_loss: 0.8226, test_loss: 1.0085, test_f1: 0.4569
 epoch: 31, train_loss: 0.8201, test_loss: 1.0464, test_f1: 0.5368
 epoch: 32, train_loss: 0.8306, test_loss: 1.1934, test_f1: 0.5151
 epoch: 33, train_loss: 0.8005, test_loss: 0.9535, test_f1: 0.5311
 epoch: 34, train_loss: 0.7887, test_loss: 0.9572, test_f1: 0.5466
 epoch: 35, train_loss: 0.8110, test_loss: 1.0432, test_f1: 0.5500
 epoch: 36, train_loss: 0.8022, test_loss: 1.0138, test_f1: 0.5996
 epoch: 37, train_loss: 0.7917, test_loss: 1.1825, test_f1: 0.4359
 epoch: 38, train_loss: 0.7656, test_loss: 0.9748, test_f1: 0.6087
 epoch: 39, train_loss: 0.7932, test_loss: 0.9827, test_f1: 0.5743
 epoch: 40, train_loss: 0.7644, test_loss: 0.9815, test_f1: 0.5164
 epoch: 41, train_loss: 0.7709, test_loss: 1.0161, test_f1: 0.5483
 epoch: 42, train_loss: 0.8013, test_loss: 1.2338, test_f1: 0.4205
 epoch: 43, train_loss: 0.7813, test_loss: 1.4837, test_f1: 0.4266
 epoch: 44, train_loss: 0.8048, test_loss: 0.9475, test_f1: 0.5906
 epoch: 45, train_loss: 0.7881, test_loss: 1.0126, test_f1: 0.5062
 epoch: 46, train_loss: 0.7514, test_loss: 1.1298, test_f1: 0.5747
 epoch: 47, train_loss: 0.7748, test_loss: 1.1043, test_f1: 0.5494
 epoch: 48, train_loss: 0.7584, test_loss: 0.9058, test_f1: 0.5872
 epoch: 49, train_loss: 0.7605, test_loss: 1.3694, test_f1: 0.3972
 epoch: 50, train_loss: 0.7661, test_loss: 1.0296, test_f1: 0.4897
 epoch: 51, train_loss: 0.7260, test_loss: 0.9860, test_f1: 0.6015
 epoch: 52, train_loss: 0.7055, test_loss: 0.9861, test_f1: 0.5962
 epoch: 53, train_loss: 0.7059, test_loss: 1.0673, test_f1: 0.6008
 epoch: 54, train_loss: 0.6796, test_loss: 0.9451, test_f1: 0.6035
 epoch: 55, train_loss: 0.6968, test_loss: 1.0916, test_f1: 0.5474
 epoch: 56, train_loss: 0.7032, test_loss: 0.9427, test_f1: 0.6494
 epoch: 57, train_loss: 0.7116, test_loss: 0.9403, test_f1: 0.5867
 epoch: 58, train_loss: 0.6942, test_loss: 0.9419, test_f1: 0.6271
 epoch: 59, train_loss: 0.6752, test_loss: 0.9805, test_f1: 0.5943
 epoch: 60, train_loss: 0.7018, test_loss: 0.9524, test_f1: 0.6419
 epoch: 61, train_loss: 0.6893, test_loss: 1.0025, test_f1: 0.5204
 epoch: 62, train_loss: 0.6757, test_loss: 0.9696, test_f1: 0.6180
 epoch: 63, train_loss: 0.6806, test_loss: 0.9533, test_f1: 0.6051
 epoch: 64, train_loss: 0.6838, test_loss: 1.1484, test_f1: 0.5808
 epoch: 65, train_loss: 0.7080, test_loss: 1.0064, test_f1: 0.6330
 epoch: 66, train_loss: 0.6785, test_loss: 1.1215, test_f1: 0.5811
 epoch: 67, train_loss: 0.6752, test_loss: 1.0271, test_f1: 0.5496
 epoch: 68, train_loss: 0.6851, test_loss: 0.9998, test_f1: 0.6466
 epoch: 69, train_loss: 0.6704, test_loss: 0.9963, test_f1: 0.5936
 epoch: 70, train_loss: 0.6725, test_loss: 1.1111, test_f1: 0.5605
 epoch: 71, train_loss: 0.6729, test_loss: 0.9998, test_f1: 0.6157
 epoch: 72, train_loss: 0.6799, test_loss: 0.9827, test_f1: 0.6092
 epoch: 73, train_loss: 0.6823, test_loss: 1.1426, test_f1: 0.5545
 epoch: 74, train_loss: 0.6594, test_loss: 1.0694, test_f1: 0.5865
 epoch: 75, train_loss: 0.6617, test_loss: 0.9378, test_f1: 0.6250
 epoch: 76, train_loss: 0.6705, test_loss: 1.0255, test_f1: 0.5710
 epoch: 77, train_loss: 0.6700, test_loss: 0.9996, test_f1: 0.6080
 epoch: 78, train_loss: 0.6587, test_loss: 0.9414, test_f1: 0.6025
 epoch: 79, train_loss: 0.6554, test_loss: 0.9978, test_f1: 0.6202
 epoch: 80, train_loss: 0.6509, test_loss: 1.0923, test_f1: 0.5874
 epoch: 81, train_loss: 0.6297, test_loss: 1.0403, test_f1: 0.6049
 epoch: 82, train_loss: 0.6467, test_loss: 1.0327, test_f1: 0.6126
 epoch: 83, train_loss: 0.6389, test_loss: 1.0659, test_f1: 0.5597
 epoch: 84, train_loss: 0.6364, test_loss: 1.1446, test_f1: 0.5844
 epoch: 85, train_loss: 0.6342, test_loss: 1.0906, test_f1: 0.5796
 epoch: 86, train_loss: 0.6322, test_loss: 1.0108, test_f1: 0.6344
 epoch: 87, train_loss: 0.6220, test_loss: 1.1260, test_f1: 0.5761
 epoch: 88, train_loss: 0.6415, test_loss: 1.1309, test_f1: 0.5634
 epoch: 89, train_loss: 0.6454, test_loss: 0.9359, test_f1: 0.6039
 epoch: 90, train_loss: 0.6675, test_loss: 1.0058, test_f1: 0.6095
 epoch: 91, train_loss: 0.6344, test_loss: 1.0772, test_f1: 0.5458
 epoch: 92, train_loss: 0.6367, test_loss: 1.0893, test_f1: 0.5992
 epoch: 93, train_loss: 0.6389, test_loss: 1.1856, test_f1: 0.5586
 epoch: 94, train_loss: 0.6314, test_loss: 1.0483, test_f1: 0.6030
 epoch: 95, train_loss: 0.6353, test_loss: 1.0421, test_f1: 0.5931
 epoch: 96, train_loss: 0.6345, test_loss: 1.0534, test_f1: 0.5812
 epoch: 97, train_loss: 0.6249, test_loss: 1.0597, test_f1: 0.6342
 epoch: 98, train_loss: 0.6223, test_loss: 1.3475, test_f1: 0.5182
 epoch: 99, train_loss: 0.6527, test_loss: 1.1413, test_f1: 0.5912
##################ITERATION #2 ****************************************
 epoch: 0, train_loss: 1.2069, test_loss: 1.1386, test_f1: 0.4256
 epoch: 1, train_loss: 1.0631, test_loss: 1.0628, test_f1: 0.4475
 epoch: 2, train_loss: 1.0211, test_loss: 1.1442, test_f1: 0.4868
 epoch: 3, train_loss: 1.0127, test_loss: 2.0861, test_f1: 0.3105
 epoch: 4, train_loss: 0.9847, test_loss: 1.0474, test_f1: 0.4950
 epoch: 5, train_loss: 0.9834, test_loss: 1.0122, test_f1: 0.5354
 epoch: 6, train_loss: 0.9464, test_loss: 1.0247, test_f1: 0.5327
 epoch: 7, train_loss: 0.9393, test_loss: 1.1108, test_f1: 0.4574
 epoch: 8, train_loss: 0.9381, test_loss: 1.0070, test_f1: 0.5188
 epoch: 9, train_loss: 0.9200, test_loss: 1.0104, test_f1: 0.5180
 epoch: 10, train_loss: 0.9276, test_loss: 1.0113, test_f1: 0.4520
 epoch: 11, train_loss: 0.8972, test_loss: 1.0406, test_f1: 0.5389
 epoch: 12, train_loss: 0.9015, test_loss: 1.0405, test_f1: 0.4541
 epoch: 13, train_loss: 0.9083, test_loss: 0.9803, test_f1: 0.5501
 epoch: 14, train_loss: 0.8994, test_loss: 0.9954, test_f1: 0.5433
 epoch: 15, train_loss: 0.8874, test_loss: 1.0161, test_f1: 0.4048
 epoch: 16, train_loss: 0.8885, test_loss: 0.9505, test_f1: 0.5448
 epoch: 17, train_loss: 0.8646, test_loss: 1.1798, test_f1: 0.4731
 epoch: 18, train_loss: 0.8870, test_loss: 0.9861, test_f1: 0.4603
 epoch: 19, train_loss: 0.8656, test_loss: 0.9673, test_f1: 0.5373
 epoch: 20, train_loss: 0.8536, test_loss: 0.9341, test_f1: 0.5630
 epoch: 21, train_loss: 0.8756, test_loss: 0.9577, test_f1: 0.5769
 epoch: 22, train_loss: 0.8467, test_loss: 0.9836, test_f1: 0.5583
 epoch: 23, train_loss: 0.8417, test_loss: 1.0574, test_f1: 0.5613
 epoch: 24, train_loss: 0.8639, test_loss: 0.9945, test_f1: 0.5707
 epoch: 25, train_loss: 0.8679, test_loss: 0.9607, test_f1: 0.5822
 epoch: 26, train_loss: 0.8553, test_loss: 0.9973, test_f1: 0.5621
 epoch: 27, train_loss: 0.8355, test_loss: 0.9912, test_f1: 0.4217
 epoch: 28, train_loss: 0.8446, test_loss: 0.9456, test_f1: 0.5513
 epoch: 29, train_loss: 0.8634, test_loss: 1.1002, test_f1: 0.4009
 epoch: 30, train_loss: 0.8500, test_loss: 1.0381, test_f1: 0.5470
 epoch: 31, train_loss: 0.8403, test_loss: 0.9682, test_f1: 0.4620
 epoch: 32, train_loss: 0.8423, test_loss: 0.9777, test_f1: 0.5625
 epoch: 33, train_loss: 0.8340, test_loss: 0.9815, test_f1: 0.5522
 epoch: 34, train_loss: 0.8373, test_loss: 0.9867, test_f1: 0.5273
 epoch: 35, train_loss: 0.8365, test_loss: 1.0079, test_f1: 0.5804
 epoch: 36, train_loss: 0.8362, test_loss: 1.0003, test_f1: 0.5569
 epoch: 37, train_loss: 0.8345, test_loss: 1.0046, test_f1: 0.5572
 epoch: 38, train_loss: 0.8293, test_loss: 0.9475, test_f1: 0.6016
 epoch: 39, train_loss: 0.8164, test_loss: 1.0148, test_f1: 0.5278
 epoch: 40, train_loss: 0.8369, test_loss: 1.1176, test_f1: 0.5283
 epoch: 41, train_loss: 0.8541, test_loss: 1.0294, test_f1: 0.5295
 epoch: 42, train_loss: 0.8314, test_loss: 1.0228, test_f1: 0.5707
 epoch: 43, train_loss: 0.8234, test_loss: 1.0112, test_f1: 0.5793
 epoch: 44, train_loss: 0.8183, test_loss: 0.9791, test_f1: 0.5646
 epoch: 45, train_loss: 0.8112, test_loss: 2.1903, test_f1: 0.3695
 epoch: 46, train_loss: 0.8483, test_loss: 0.9540, test_f1: 0.5441
 epoch: 47, train_loss: 0.8347, test_loss: 1.0380, test_f1: 0.5468
 epoch: 48, train_loss: 0.8085, test_loss: 0.9309, test_f1: 0.5885
 epoch: 49, train_loss: 0.8078, test_loss: 0.9471, test_f1: 0.5335
 epoch: 50, train_loss: 0.8131, test_loss: 1.0604, test_f1: 0.5366
 epoch: 51, train_loss: 0.8162, test_loss: 0.9279, test_f1: 0.5991
 epoch: 52, train_loss: 0.7865, test_loss: 0.9456, test_f1: 0.5846
 epoch: 53, train_loss: 0.7863, test_loss: 0.9467, test_f1: 0.5766
 epoch: 54, train_loss: 0.7802, test_loss: 0.9815, test_f1: 0.5916
 epoch: 55, train_loss: 0.7867, test_loss: 0.9406, test_f1: 0.5977
 epoch: 56, train_loss: 0.7687, test_loss: 1.0346, test_f1: 0.5707
 epoch: 57, train_loss: 0.7701, test_loss: 0.9595, test_f1: 0.5901
 epoch: 58, train_loss: 0.7665, test_loss: 0.9640, test_f1: 0.6111
 epoch: 59, train_loss: 0.7731, test_loss: 0.9344, test_f1: 0.5738
 epoch: 60, train_loss: 0.7695, test_loss: 0.9950, test_f1: 0.5633
 epoch: 61, train_loss: 0.7866, test_loss: 1.0425, test_f1: 0.5733
 epoch: 62, train_loss: 0.7869, test_loss: 0.9558, test_f1: 0.5886
 epoch: 63, train_loss: 0.7715, test_loss: 0.9668, test_f1: 0.6022
 epoch: 64, train_loss: 0.7812, test_loss: 0.9545, test_f1: 0.5603
 epoch: 65, train_loss: 0.7866, test_loss: 0.9424, test_f1: 0.5790
 epoch: 66, train_loss: 0.7768, test_loss: 0.9669, test_f1: 0.5761
 epoch: 67, train_loss: 0.7685, test_loss: 1.0123, test_f1: 0.5663
 epoch: 68, train_loss: 0.7716, test_loss: 0.9640, test_f1: 0.5937
 epoch: 69, train_loss: 0.7589, test_loss: 0.9726, test_f1: 0.6095
 epoch: 70, train_loss: 0.7605, test_loss: 0.9508, test_f1: 0.5868
 epoch: 71, train_loss: 0.7664, test_loss: 0.9712, test_f1: 0.6170
 epoch: 72, train_loss: 0.7539, test_loss: 0.9563, test_f1: 0.5727
 epoch: 73, train_loss: 0.7550, test_loss: 0.9658, test_f1: 0.5952
 epoch: 74, train_loss: 0.7684, test_loss: 0.9725, test_f1: 0.5814
 epoch: 75, train_loss: 0.7538, test_loss: 0.9725, test_f1: 0.5667
 epoch: 76, train_loss: 0.7716, test_loss: 1.1659, test_f1: 0.5293
 epoch: 77, train_loss: 0.7478, test_loss: 0.9453, test_f1: 0.5989
 epoch: 78, train_loss: 0.7440, test_loss: 0.9861, test_f1: 0.5754
 epoch: 79, train_loss: 0.7441, test_loss: 0.9953, test_f1: 0.5562
 epoch: 80, train_loss: 0.7346, test_loss: 0.9436, test_f1: 0.5845
 epoch: 81, train_loss: 0.7431, test_loss: 0.9939, test_f1: 0.5158
 epoch: 82, train_loss: 0.7648, test_loss: 0.9050, test_f1: 0.6030
 epoch: 83, train_loss: 0.7389, test_loss: 1.0122, test_f1: 0.5868
 epoch: 84, train_loss: 0.7486, test_loss: 0.9390, test_f1: 0.5946
 epoch: 85, train_loss: 0.7418, test_loss: 0.9720, test_f1: 0.5960
 epoch: 86, train_loss: 0.7242, test_loss: 0.9864, test_f1: 0.5622
 epoch: 87, train_loss: 0.7098, test_loss: 1.0094, test_f1: 0.5926
 epoch: 88, train_loss: 0.7100, test_loss: 1.0435, test_f1: 0.5732
 epoch: 89, train_loss: 0.7207, test_loss: 1.0592, test_f1: 0.5895
 epoch: 90, train_loss: 0.7253, test_loss: 0.9478, test_f1: 0.5950
 epoch: 91, train_loss: 0.7348, test_loss: 0.9592, test_f1: 0.6052
 epoch: 92, train_loss: 0.7196, test_loss: 1.0436, test_f1: 0.6423
 epoch: 93, train_loss: 0.7284, test_loss: 1.0169, test_f1: 0.5827
 epoch: 94, train_loss: 0.7214, test_loss: 0.9482, test_f1: 0.6173
 epoch: 95, train_loss: 0.7197, test_loss: 0.9273, test_f1: 0.6064
 epoch: 96, train_loss: 0.7060, test_loss: 0.9554, test_f1: 0.5970
 epoch: 97, train_loss: 0.7073, test_loss: 0.9390, test_f1: 0.5961
 epoch: 98, train_loss: 0.7152, test_loss: 0.9398, test_f1: 0.6377
 epoch: 99, train_loss: 0.6957, test_loss: 0.9254, test_f1: 0.6102
##################ITERATION #3 ****************************************
 epoch: 0, train_loss: 1.1335, test_loss: 1.1793, test_f1: 0.4145
 epoch: 1, train_loss: 1.0078, test_loss: 1.0500, test_f1: 0.5281
 epoch: 2, train_loss: 0.9559, test_loss: 0.9841, test_f1: 0.5530
 epoch: 3, train_loss: 0.9426, test_loss: 1.1025, test_f1: 0.5141
 epoch: 4, train_loss: 0.9310, test_loss: 1.0345, test_f1: 0.5336
 epoch: 5, train_loss: 0.9171, test_loss: 0.9864, test_f1: 0.5686
 epoch: 6, train_loss: 0.9041, test_loss: 0.9978, test_f1: 0.5494
 epoch: 7, train_loss: 0.8757, test_loss: 0.9817, test_f1: 0.5683
 epoch: 8, train_loss: 0.8935, test_loss: 1.0527, test_f1: 0.5236
 epoch: 9, train_loss: 0.9035, test_loss: 1.0074, test_f1: 0.5665
 epoch: 10, train_loss: 0.8806, test_loss: 0.9984, test_f1: 0.5491
 epoch: 11, train_loss: 0.8594, test_loss: 0.9849, test_f1: 0.5831
 epoch: 12, train_loss: 0.8344, test_loss: 1.0377, test_f1: 0.5055
 epoch: 13, train_loss: 0.8651, test_loss: 1.2333, test_f1: 0.4566
 epoch: 14, train_loss: 0.8387, test_loss: 1.1726, test_f1: 0.5202
 epoch: 15, train_loss: 0.8568, test_loss: 1.0729, test_f1: 0.5226
 epoch: 16, train_loss: 0.8411, test_loss: 0.9941, test_f1: 0.5683
 epoch: 17, train_loss: 0.8565, test_loss: 1.0150, test_f1: 0.5516
 epoch: 18, train_loss: 0.8354, test_loss: 1.0148, test_f1: 0.5833
 epoch: 19, train_loss: 0.8389, test_loss: 0.9587, test_f1: 0.5532
 epoch: 20, train_loss: 0.8114, test_loss: 0.9751, test_f1: 0.5883
 epoch: 21, train_loss: 0.8447, test_loss: 1.0072, test_f1: 0.5836
 epoch: 22, train_loss: 0.8270, test_loss: 0.9898, test_f1: 0.5850
 epoch: 23, train_loss: 0.8608, test_loss: 0.9773, test_f1: 0.5647
 epoch: 24, train_loss: 0.8092, test_loss: 1.0229, test_f1: 0.5656
 epoch: 25, train_loss: 0.8329, test_loss: 0.9890, test_f1: 0.5376
 epoch: 26, train_loss: 0.8118, test_loss: 0.9936, test_f1: 0.5901
 epoch: 27, train_loss: 0.8010, test_loss: 1.0205, test_f1: 0.5576
 epoch: 28, train_loss: 0.8084, test_loss: 1.1911, test_f1: 0.5219
 epoch: 29, train_loss: 0.8040, test_loss: 1.0281, test_f1: 0.6112
 epoch: 30, train_loss: 0.8320, test_loss: 1.1817, test_f1: 0.5480
 epoch: 31, train_loss: 0.8080, test_loss: 1.0573, test_f1: 0.5422
 epoch: 32, train_loss: 0.7706, test_loss: 0.9733, test_f1: 0.5952
 epoch: 33, train_loss: 0.7936, test_loss: 1.1373, test_f1: 0.5354
 epoch: 34, train_loss: 0.7778, test_loss: 1.1702, test_f1: 0.5384
 epoch: 35, train_loss: 0.7693, test_loss: 1.0013, test_f1: 0.5857
 epoch: 36, train_loss: 0.7820, test_loss: 1.0690, test_f1: 0.5671
 epoch: 37, train_loss: 0.8292, test_loss: 1.0217, test_f1: 0.5412
 epoch: 38, train_loss: 0.7806, test_loss: 1.0035, test_f1: 0.5777
 epoch: 39, train_loss: 0.7719, test_loss: 1.1011, test_f1: 0.5488
 epoch: 40, train_loss: 0.7646, test_loss: 1.0124, test_f1: 0.5468
 epoch: 41, train_loss: 0.7937, test_loss: 1.0211, test_f1: 0.5629
 epoch: 42, train_loss: 0.8046, test_loss: 0.9555, test_f1: 0.6419
 epoch: 43, train_loss: 0.7839, test_loss: 0.9466, test_f1: 0.5983
 epoch: 44, train_loss: 0.7789, test_loss: 0.9406, test_f1: 0.5739
 epoch: 45, train_loss: 0.7779, test_loss: 0.9680, test_f1: 0.5918
 epoch: 46, train_loss: 0.7790, test_loss: 0.9576, test_f1: 0.6041
 epoch: 47, train_loss: 0.7954, test_loss: 1.3408, test_f1: 0.4496
 epoch: 48, train_loss: 0.7873, test_loss: 0.9844, test_f1: 0.5484
 epoch: 49, train_loss: 0.7570, test_loss: 1.0024, test_f1: 0.5699
 epoch: 50, train_loss: 0.7559, test_loss: 0.9928, test_f1: 0.5892
 epoch: 51, train_loss: 0.7577, test_loss: 1.0053, test_f1: 0.5984
 epoch: 52, train_loss: 0.7468, test_loss: 0.9734, test_f1: 0.6050
 epoch: 53, train_loss: 0.7272, test_loss: 0.9641, test_f1: 0.5892
 epoch: 54, train_loss: 0.7252, test_loss: 0.9929, test_f1: 0.6129
 epoch: 55, train_loss: 0.7279, test_loss: 1.0880, test_f1: 0.6016
 epoch: 56, train_loss: 0.7067, test_loss: 0.9605, test_f1: 0.5850
 epoch: 57, train_loss: 0.6947, test_loss: 0.9716, test_f1: 0.6374
 epoch: 58, train_loss: 0.7188, test_loss: 0.9710, test_f1: 0.6211
 epoch: 59, train_loss: 0.6941, test_loss: 1.0895, test_f1: 0.5744
 epoch: 60, train_loss: 0.6908, test_loss: 0.9414, test_f1: 0.6719
 epoch: 61, train_loss: 0.6935, test_loss: 0.9945, test_f1: 0.6447
 epoch: 62, train_loss: 0.7039, test_loss: 0.9451, test_f1: 0.6079
 epoch: 63, train_loss: 0.7162, test_loss: 1.0227, test_f1: 0.6042
 epoch: 64, train_loss: 0.7040, test_loss: 1.0217, test_f1: 0.6005
 epoch: 65, train_loss: 0.6957, test_loss: 0.9961, test_f1: 0.6563
 epoch: 66, train_loss: 0.6949, test_loss: 1.2367, test_f1: 0.5245
 epoch: 67, train_loss: 0.7023, test_loss: 0.9392, test_f1: 0.6425
 epoch: 68, train_loss: 0.6798, test_loss: 1.0346, test_f1: 0.6249
 epoch: 69, train_loss: 0.7108, test_loss: 1.2765, test_f1: 0.5654
 epoch: 70, train_loss: 0.7126, test_loss: 1.0408, test_f1: 0.6065
 epoch: 71, train_loss: 0.6983, test_loss: 0.9883, test_f1: 0.6183
 epoch: 72, train_loss: 0.6836, test_loss: 0.9889, test_f1: 0.6140
 epoch: 73, train_loss: 0.6642, test_loss: 0.9558, test_f1: 0.6796
 epoch: 74, train_loss: 0.6738, test_loss: 1.0102, test_f1: 0.6565
 epoch: 75, train_loss: 0.6727, test_loss: 1.0377, test_f1: 0.6119
 epoch: 76, train_loss: 0.6740, test_loss: 0.9976, test_f1: 0.6250
 epoch: 77, train_loss: 0.6478, test_loss: 1.0195, test_f1: 0.6163
 epoch: 78, train_loss: 0.6521, test_loss: 1.1105, test_f1: 0.6092
 epoch: 79, train_loss: 0.6592, test_loss: 0.9750, test_f1: 0.6537
 epoch: 80, train_loss: 0.6679, test_loss: 1.0048, test_f1: 0.6521
 epoch: 81, train_loss: 0.6854, test_loss: 0.9353, test_f1: 0.6555
 epoch: 82, train_loss: 0.6728, test_loss: 1.0987, test_f1: 0.6037
 epoch: 83, train_loss: 0.6766, test_loss: 0.9189, test_f1: 0.6854
 epoch: 84, train_loss: 0.6530, test_loss: 1.0048, test_f1: 0.6221
 epoch: 85, train_loss: 0.6687, test_loss: 0.9720, test_f1: 0.6517
 epoch: 86, train_loss: 0.6829, test_loss: 1.0456, test_f1: 0.5748
 epoch: 87, train_loss: 0.6531, test_loss: 1.0686, test_f1: 0.6207
 epoch: 88, train_loss: 0.6382, test_loss: 1.0679, test_f1: 0.6285
 epoch: 89, train_loss: 0.6441, test_loss: 0.9911, test_f1: 0.6209
 epoch: 90, train_loss: 0.6394, test_loss: 1.0226, test_f1: 0.6137
 epoch: 91, train_loss: 0.6281, test_loss: 1.0454, test_f1: 0.5911
 epoch: 92, train_loss: 0.6551, test_loss: 1.0016, test_f1: 0.6145
 epoch: 93, train_loss: 0.6262, test_loss: 1.0782, test_f1: 0.6427
 epoch: 94, train_loss: 0.6478, test_loss: 1.0214, test_f1: 0.6533
 epoch: 95, train_loss: 0.6417, test_loss: 0.9823, test_f1: 0.6516
 epoch: 96, train_loss: 0.6461, test_loss: 0.9648, test_f1: 0.6344
 epoch: 97, train_loss: 0.6760, test_loss: 1.0635, test_f1: 0.5947
 epoch: 98, train_loss: 0.6549, test_loss: 1.0751, test_f1: 0.6391
 epoch: 99, train_loss: 0.6597, test_loss: 1.1586, test_f1: 0.6076
##################ITERATION #4 ****************************************
 epoch: 0, train_loss: 1.1465, test_loss: 1.1438, test_f1: 0.3734
 epoch: 1, train_loss: 1.0219, test_loss: 1.1320, test_f1: 0.3928
 epoch: 2, train_loss: 0.9991, test_loss: 1.0111, test_f1: 0.5187
 epoch: 3, train_loss: 0.9729, test_loss: 0.9927, test_f1: 0.5396
 epoch: 4, train_loss: 0.9637, test_loss: 0.9904, test_f1: 0.5412
 epoch: 5, train_loss: 0.9409, test_loss: 1.0782, test_f1: 0.4859
 epoch: 6, train_loss: 0.9420, test_loss: 1.0319, test_f1: 0.4726
 epoch: 7, train_loss: 0.9185, test_loss: 1.0321, test_f1: 0.4865
 epoch: 8, train_loss: 0.9319, test_loss: 0.9863, test_f1: 0.4564
 epoch: 9, train_loss: 0.8828, test_loss: 1.0211, test_f1: 0.5240
 epoch: 10, train_loss: 0.8839, test_loss: 1.0042, test_f1: 0.5567
 epoch: 11, train_loss: 0.8878, test_loss: 1.0154, test_f1: 0.5359
 epoch: 12, train_loss: 0.8596, test_loss: 1.0705, test_f1: 0.4950
 epoch: 13, train_loss: 0.8756, test_loss: 0.9793, test_f1: 0.5184
 epoch: 14, train_loss: 0.8619, test_loss: 1.1460, test_f1: 0.5078
 epoch: 15, train_loss: 0.8497, test_loss: 0.9577, test_f1: 0.5726
 epoch: 16, train_loss: 0.8904, test_loss: 1.0197, test_f1: 0.5155
 epoch: 17, train_loss: 0.8567, test_loss: 0.9778, test_f1: 0.5616
 epoch: 18, train_loss: 0.8529, test_loss: 0.9706, test_f1: 0.5709
 epoch: 19, train_loss: 0.8465, test_loss: 0.9460, test_f1: 0.5848
 epoch: 20, train_loss: 0.8422, test_loss: 1.0510, test_f1: 0.5592
 epoch: 21, train_loss: 0.8549, test_loss: 1.2280, test_f1: 0.4789
 epoch: 22, train_loss: 0.8295, test_loss: 1.1467, test_f1: 0.4862
 epoch: 23, train_loss: 0.8341, test_loss: 1.0228, test_f1: 0.5425
 epoch: 24, train_loss: 0.8455, test_loss: 1.0530, test_f1: 0.5688
 epoch: 25, train_loss: 0.8197, test_loss: 1.0806, test_f1: 0.4995
 epoch: 26, train_loss: 0.8203, test_loss: 1.1941, test_f1: 0.5003
 epoch: 27, train_loss: 0.8398, test_loss: 1.0860, test_f1: 0.5064
 epoch: 28, train_loss: 0.8197, test_loss: 1.3670, test_f1: 0.5036
 epoch: 29, train_loss: 0.8247, test_loss: 1.1122, test_f1: 0.4674
 epoch: 30, train_loss: 0.8271, test_loss: 0.9768, test_f1: 0.5717
 epoch: 31, train_loss: 0.7994, test_loss: 1.0438, test_f1: 0.5382
 epoch: 32, train_loss: 0.8140, test_loss: 0.9717, test_f1: 0.5740
 epoch: 33, train_loss: 0.8019, test_loss: 1.0114, test_f1: 0.4361
 epoch: 34, train_loss: 0.7803, test_loss: 0.9938, test_f1: 0.5697
 epoch: 35, train_loss: 0.7837, test_loss: 0.9929, test_f1: 0.5389
 epoch: 36, train_loss: 0.7818, test_loss: 1.0502, test_f1: 0.4451
 epoch: 37, train_loss: 0.7729, test_loss: 1.0286, test_f1: 0.5996
 epoch: 38, train_loss: 0.7905, test_loss: 0.9721, test_f1: 0.6228
 epoch: 39, train_loss: 0.8110, test_loss: 0.9459, test_f1: 0.5695
 epoch: 40, train_loss: 0.7919, test_loss: 0.9687, test_f1: 0.5549
 epoch: 41, train_loss: 0.7993, test_loss: 1.0110, test_f1: 0.5201
 epoch: 42, train_loss: 0.7881, test_loss: 1.0354, test_f1: 0.5509
 epoch: 43, train_loss: 0.7786, test_loss: 1.3492, test_f1: 0.4464
 epoch: 44, train_loss: 0.7572, test_loss: 0.9677, test_f1: 0.6115
 epoch: 45, train_loss: 0.7862, test_loss: 1.0120, test_f1: 0.5280
 epoch: 46, train_loss: 0.7677, test_loss: 1.1194, test_f1: 0.5332
 epoch: 47, train_loss: 0.7675, test_loss: 0.9972, test_f1: 0.5387
 epoch: 48, train_loss: 0.7643, test_loss: 1.1021, test_f1: 0.5610
 epoch: 49, train_loss: 0.7890, test_loss: 0.9878, test_f1: 0.5943
 epoch: 50, train_loss: 0.7569, test_loss: 1.0865, test_f1: 0.5703
 epoch: 51, train_loss: 0.7758, test_loss: 0.9673, test_f1: 0.5899
 epoch: 52, train_loss: 0.7467, test_loss: 0.9615, test_f1: 0.5609
 epoch: 53, train_loss: 0.7112, test_loss: 0.9705, test_f1: 0.6048
 epoch: 54, train_loss: 0.7179, test_loss: 0.9743, test_f1: 0.6296
 epoch: 55, train_loss: 0.7355, test_loss: 1.0622, test_f1: 0.5259
 epoch: 56, train_loss: 0.7044, test_loss: 1.0200, test_f1: 0.5773
 epoch: 57, train_loss: 0.7178, test_loss: 1.0520, test_f1: 0.6124
 epoch: 58, train_loss: 0.7276, test_loss: 0.9680, test_f1: 0.6234
 epoch: 59, train_loss: 0.6992, test_loss: 1.0263, test_f1: 0.5554
 epoch: 60, train_loss: 0.7112, test_loss: 1.0360, test_f1: 0.5843
 epoch: 61, train_loss: 0.7222, test_loss: 1.0192, test_f1: 0.5572
 epoch: 62, train_loss: 0.7173, test_loss: 0.9852, test_f1: 0.5768
 epoch: 63, train_loss: 0.7112, test_loss: 1.1200, test_f1: 0.5674
 epoch: 64, train_loss: 0.7044, test_loss: 1.0830, test_f1: 0.5612
 epoch: 65, train_loss: 0.7023, test_loss: 0.9531, test_f1: 0.5822
 epoch: 66, train_loss: 0.7223, test_loss: 1.0635, test_f1: 0.5427
 epoch: 67, train_loss: 0.6979, test_loss: 0.9542, test_f1: 0.6207
 epoch: 68, train_loss: 0.6755, test_loss: 1.0763, test_f1: 0.5485
 epoch: 69, train_loss: 0.6936, test_loss: 0.9829, test_f1: 0.6093
 epoch: 70, train_loss: 0.6958, test_loss: 1.0459, test_f1: 0.5417
 epoch: 71, train_loss: 0.7083, test_loss: 1.0766, test_f1: 0.5627
 epoch: 72, train_loss: 0.6779, test_loss: 0.9804, test_f1: 0.5632
 epoch: 73, train_loss: 0.6680, test_loss: 0.9641, test_f1: 0.6413
 epoch: 74, train_loss: 0.6797, test_loss: 1.1226, test_f1: 0.5497
 epoch: 75, train_loss: 0.6924, test_loss: 1.0210, test_f1: 0.5751
 epoch: 76, train_loss: 0.6936, test_loss: 0.9619, test_f1: 0.5916
 epoch: 77, train_loss: 0.6604, test_loss: 1.0186, test_f1: 0.5942
 epoch: 78, train_loss: 0.6618, test_loss: 0.9788, test_f1: 0.5748
 epoch: 79, train_loss: 0.6783, test_loss: 0.9974, test_f1: 0.5755
 epoch: 80, train_loss: 0.6793, test_loss: 0.9786, test_f1: 0.6057
 epoch: 81, train_loss: 0.6483, test_loss: 1.0342, test_f1: 0.5733
 epoch: 82, train_loss: 0.6564, test_loss: 1.0160, test_f1: 0.5889
 epoch: 83, train_loss: 0.6794, test_loss: 1.2151, test_f1: 0.5268
 epoch: 84, train_loss: 0.6489, test_loss: 0.9694, test_f1: 0.6191
 epoch: 85, train_loss: 0.6675, test_loss: 1.0309, test_f1: 0.6016
 epoch: 86, train_loss: 0.6919, test_loss: 1.0257, test_f1: 0.5868
 epoch: 87, train_loss: 0.6747, test_loss: 0.9792, test_f1: 0.6127
 epoch: 88, train_loss: 0.6676, test_loss: 1.0143, test_f1: 0.5760
 epoch: 89, train_loss: 0.6501, test_loss: 0.9749, test_f1: 0.5731
 epoch: 90, train_loss: 0.6823, test_loss: 1.1169, test_f1: 0.5242
 epoch: 91, train_loss: 0.6584, test_loss: 1.0610, test_f1: 0.6117
 epoch: 92, train_loss: 0.6593, test_loss: 1.0965, test_f1: 0.5712
 epoch: 93, train_loss: 0.6385, test_loss: 1.0566, test_f1: 0.6065
 epoch: 94, train_loss: 0.6429, test_loss: 0.9891, test_f1: 0.5948
 epoch: 95, train_loss: 0.6554, test_loss: 1.1312, test_f1: 0.5676
 epoch: 96, train_loss: 0.6667, test_loss: 0.9712, test_f1: 0.5884
 epoch: 97, train_loss: 0.6412, test_loss: 1.0051, test_f1: 0.6205
 epoch: 98, train_loss: 0.6455, test_loss: 0.9928, test_f1: 0.5944
 epoch: 99, train_loss: 0.6357, test_loss: 1.0330, test_f1: 0.5577
##################ITERATION #5 ****************************************
 epoch: 0, train_loss: 1.1496, test_loss: 1.1406, test_f1: 0.3092
 epoch: 1, train_loss: 1.0239, test_loss: 1.0804, test_f1: 0.5094
 epoch: 2, train_loss: 0.9987, test_loss: 1.0880, test_f1: 0.5153
 epoch: 3, train_loss: 0.9777, test_loss: 1.0296, test_f1: 0.4359
 epoch: 4, train_loss: 0.9701, test_loss: 0.9615, test_f1: 0.4260
 epoch: 5, train_loss: 0.9379, test_loss: 1.0266, test_f1: 0.4527
 epoch: 6, train_loss: 0.9262, test_loss: 0.9829, test_f1: 0.5355
 epoch: 7, train_loss: 0.9038, test_loss: 1.0029, test_f1: 0.5103
 epoch: 8, train_loss: 0.8960, test_loss: 1.0240, test_f1: 0.5565
 epoch: 9, train_loss: 0.8916, test_loss: 0.9516, test_f1: 0.5453
 epoch: 10, train_loss: 0.8813, test_loss: 0.9926, test_f1: 0.5382
 epoch: 11, train_loss: 0.8781, test_loss: 0.9404, test_f1: 0.4427
 epoch: 12, train_loss: 0.8724, test_loss: 1.0080, test_f1: 0.5054
 epoch: 13, train_loss: 0.9044, test_loss: 0.9893, test_f1: 0.5325
 epoch: 14, train_loss: 0.8671, test_loss: 0.9548, test_f1: 0.4713
 epoch: 15, train_loss: 0.8805, test_loss: 0.9763, test_f1: 0.5435
 epoch: 16, train_loss: 0.8911, test_loss: 0.9561, test_f1: 0.5276
 epoch: 17, train_loss: 0.8456, test_loss: 0.9979, test_f1: 0.5588
 epoch: 18, train_loss: 0.8516, test_loss: 0.9367, test_f1: 0.5928
 epoch: 19, train_loss: 0.8611, test_loss: 0.9919, test_f1: 0.4757
 epoch: 20, train_loss: 0.8709, test_loss: 0.9847, test_f1: 0.5593
 epoch: 21, train_loss: 0.8623, test_loss: 0.9452, test_f1: 0.4817
 epoch: 22, train_loss: 0.8469, test_loss: 0.9660, test_f1: 0.5411
 epoch: 23, train_loss: 0.8347, test_loss: 1.0953, test_f1: 0.4817
 epoch: 24, train_loss: 0.8534, test_loss: 0.9588, test_f1: 0.5632
 epoch: 25, train_loss: 0.8486, test_loss: 0.9696, test_f1: 0.5667
 epoch: 26, train_loss: 0.8427, test_loss: 0.9540, test_f1: 0.5689
 epoch: 27, train_loss: 0.8280, test_loss: 0.9843, test_f1: 0.5603
 epoch: 28, train_loss: 0.8340, test_loss: 1.1521, test_f1: 0.4897
 epoch: 29, train_loss: 0.8545, test_loss: 0.9309, test_f1: 0.6038
 epoch: 30, train_loss: 0.8155, test_loss: 1.0170, test_f1: 0.5331
 epoch: 31, train_loss: 0.8411, test_loss: 0.9397, test_f1: 0.5733
 epoch: 32, train_loss: 0.8446, test_loss: 1.2061, test_f1: 0.5036
 epoch: 33, train_loss: 0.8239, test_loss: 0.9997, test_f1: 0.5383
 epoch: 34, train_loss: 0.8309, test_loss: 0.9399, test_f1: 0.5612
 epoch: 35, train_loss: 0.8182, test_loss: 1.0577, test_f1: 0.5435
 epoch: 36, train_loss: 0.8242, test_loss: 0.9285, test_f1: 0.5426
 epoch: 37, train_loss: 0.8323, test_loss: 0.9750, test_f1: 0.5622
 epoch: 38, train_loss: 0.8055, test_loss: 1.0650, test_f1: 0.5309
 epoch: 39, train_loss: 0.8110, test_loss: 0.9583, test_f1: 0.5946
 epoch: 40, train_loss: 0.8054, test_loss: 0.9634, test_f1: 0.5480
 epoch: 41, train_loss: 0.8032, test_loss: 1.1296, test_f1: 0.5403
 epoch: 42, train_loss: 0.8245, test_loss: 0.9757, test_f1: 0.5949
 epoch: 43, train_loss: 0.8029, test_loss: 1.0588, test_f1: 0.3865
 epoch: 44, train_loss: 0.8047, test_loss: 0.9529, test_f1: 0.5379
 epoch: 45, train_loss: 0.7973, test_loss: 0.9435, test_f1: 0.5596
 epoch: 46, train_loss: 0.8028, test_loss: 1.0456, test_f1: 0.4949
 epoch: 47, train_loss: 0.8075, test_loss: 0.9951, test_f1: 0.6092
 epoch: 48, train_loss: 0.8057, test_loss: 0.9797, test_f1: 0.5120
 epoch: 49, train_loss: 0.7901, test_loss: 0.9950, test_f1: 0.5990
 epoch: 50, train_loss: 0.8033, test_loss: 1.0683, test_f1: 0.3880
 epoch: 51, train_loss: 0.7728, test_loss: 1.2257, test_f1: 0.4978
 epoch: 52, train_loss: 0.7657, test_loss: 0.9672, test_f1: 0.5877
 epoch: 53, train_loss: 0.7621, test_loss: 0.9357, test_f1: 0.6330
 epoch: 54, train_loss: 0.7676, test_loss: 0.9289, test_f1: 0.6043
 epoch: 55, train_loss: 0.7361, test_loss: 0.9364, test_f1: 0.6094
 epoch: 56, train_loss: 0.7416, test_loss: 0.9828, test_f1: 0.5740
 epoch: 57, train_loss: 0.7356, test_loss: 1.0291, test_f1: 0.6113
 epoch: 58, train_loss: 0.7532, test_loss: 1.1336, test_f1: 0.5308
 epoch: 59, train_loss: 0.7646, test_loss: 0.9880, test_f1: 0.5798
 epoch: 60, train_loss: 0.7436, test_loss: 0.9932, test_f1: 0.5493
 epoch: 61, train_loss: 0.7472, test_loss: 1.0041, test_f1: 0.5690
 epoch: 62, train_loss: 0.7423, test_loss: 0.9841, test_f1: 0.5727
 epoch: 63, train_loss: 0.7414, test_loss: 0.9533, test_f1: 0.6249
 epoch: 64, train_loss: 0.7201, test_loss: 0.9883, test_f1: 0.5982
 epoch: 65, train_loss: 0.7365, test_loss: 1.2517, test_f1: 0.4974
 epoch: 66, train_loss: 0.7392, test_loss: 1.0187, test_f1: 0.5714
 epoch: 67, train_loss: 0.7117, test_loss: 0.9645, test_f1: 0.6256
 epoch: 68, train_loss: 0.7251, test_loss: 1.0414, test_f1: 0.5850
 epoch: 69, train_loss: 0.7074, test_loss: 0.9974, test_f1: 0.5825
 epoch: 70, train_loss: 0.7096, test_loss: 1.0430, test_f1: 0.5126
 epoch: 71, train_loss: 0.7110, test_loss: 1.0187, test_f1: 0.5860
 epoch: 72, train_loss: 0.7120, test_loss: 1.0565, test_f1: 0.5490
 epoch: 73, train_loss: 0.6992, test_loss: 1.1004, test_f1: 0.5563
 epoch: 74, train_loss: 0.7140, test_loss: 1.1582, test_f1: 0.5608
 epoch: 75, train_loss: 0.6977, test_loss: 1.0716, test_f1: 0.5890
 epoch: 76, train_loss: 0.6997, test_loss: 1.0465, test_f1: 0.5718
 epoch: 77, train_loss: 0.7127, test_loss: 1.1014, test_f1: 0.5004
 epoch: 78, train_loss: 0.7179, test_loss: 1.1314, test_f1: 0.5104
 epoch: 79, train_loss: 0.7061, test_loss: 1.0486, test_f1: 0.6010
 epoch: 80, train_loss: 0.7112, test_loss: 1.0773, test_f1: 0.5267
 epoch: 81, train_loss: 0.7001, test_loss: 1.0919, test_f1: 0.5723
 epoch: 82, train_loss: 0.6860, test_loss: 1.1111, test_f1: 0.5453
 epoch: 83, train_loss: 0.6785, test_loss: 1.0060, test_f1: 0.6165
 epoch: 84, train_loss: 0.6481, test_loss: 1.2971, test_f1: 0.4785
 epoch: 85, train_loss: 0.6898, test_loss: 1.0617, test_f1: 0.6241
 epoch: 86, train_loss: 0.6694, test_loss: 1.0720, test_f1: 0.5839
 epoch: 87, train_loss: 0.7013, test_loss: 1.1459, test_f1: 0.5536
 epoch: 88, train_loss: 0.6816, test_loss: 1.0203, test_f1: 0.5849
 epoch: 89, train_loss: 0.6529, test_loss: 1.0348, test_f1: 0.6114
 epoch: 90, train_loss: 0.6747, test_loss: 0.9662, test_f1: 0.6348
 epoch: 91, train_loss: 0.6577, test_loss: 1.0671, test_f1: 0.6005
 epoch: 92, train_loss: 0.6603, test_loss: 1.1126, test_f1: 0.5674
 epoch: 93, train_loss: 0.6665, test_loss: 1.0287, test_f1: 0.6034
 epoch: 94, train_loss: 0.6618, test_loss: 1.1183, test_f1: 0.5594
 epoch: 95, train_loss: 0.6476, test_loss: 1.0258, test_f1: 0.6360
 epoch: 96, train_loss: 0.6457, test_loss: 1.0586, test_f1: 0.6077
 epoch: 97, train_loss: 0.6566, test_loss: 1.1840, test_f1: 0.4691
 epoch: 98, train_loss: 0.6808, test_loss: 1.1248, test_f1: 0.5824
 epoch: 99, train_loss: 0.6704, test_loss: 1.0674, test_f1: 0.6384
##################ITERATION #6 ****************************************
 epoch: 0, train_loss: 1.1267, test_loss: 1.1375, test_f1: 0.3565
 epoch: 1, train_loss: 1.0172, test_loss: 1.0883, test_f1: 0.4219
 epoch: 2, train_loss: 0.9902, test_loss: 1.0613, test_f1: 0.4974
 epoch: 3, train_loss: 0.9919, test_loss: 1.0281, test_f1: 0.4772
 epoch: 4, train_loss: 0.9547, test_loss: 1.0676, test_f1: 0.5452
 epoch: 5, train_loss: 0.9504, test_loss: 1.1184, test_f1: 0.4481
 epoch: 6, train_loss: 0.9348, test_loss: 1.0739, test_f1: 0.5274
 epoch: 7, train_loss: 0.8885, test_loss: 1.0092, test_f1: 0.5842
 epoch: 8, train_loss: 0.9052, test_loss: 1.0079, test_f1: 0.5200
 epoch: 9, train_loss: 0.8960, test_loss: 1.1935, test_f1: 0.4178
 epoch: 10, train_loss: 0.8906, test_loss: 1.0499, test_f1: 0.4329
 epoch: 11, train_loss: 0.8580, test_loss: 1.0092, test_f1: 0.4735
 epoch: 12, train_loss: 0.8739, test_loss: 0.9825, test_f1: 0.5767
 epoch: 13, train_loss: 0.8614, test_loss: 1.2474, test_f1: 0.4954
 epoch: 14, train_loss: 0.8553, test_loss: 1.0677, test_f1: 0.5249
 epoch: 15, train_loss: 0.8610, test_loss: 0.9863, test_f1: 0.5172
 epoch: 16, train_loss: 0.8409, test_loss: 1.0119, test_f1: 0.5391
 epoch: 17, train_loss: 0.8567, test_loss: 1.2613, test_f1: 0.4071
 epoch: 18, train_loss: 0.8583, test_loss: 1.0008, test_f1: 0.5576
 epoch: 19, train_loss: 0.8504, test_loss: 1.0612, test_f1: 0.4887
 epoch: 20, train_loss: 0.8135, test_loss: 0.9496, test_f1: 0.5616
 epoch: 21, train_loss: 0.8492, test_loss: 1.0039, test_f1: 0.5321
 epoch: 22, train_loss: 0.8277, test_loss: 0.9997, test_f1: 0.5764
 epoch: 23, train_loss: 0.8158, test_loss: 1.0261, test_f1: 0.5776
 epoch: 24, train_loss: 0.8857, test_loss: 1.0036, test_f1: 0.5605
 epoch: 25, train_loss: 0.8343, test_loss: 0.9966, test_f1: 0.5493
 epoch: 26, train_loss: 0.8490, test_loss: 0.9962, test_f1: 0.5740
 epoch: 27, train_loss: 0.8167, test_loss: 1.0094, test_f1: 0.5276
 epoch: 28, train_loss: 0.8115, test_loss: 1.1868, test_f1: 0.5132
 epoch: 29, train_loss: 0.8171, test_loss: 0.9847, test_f1: 0.5714
 epoch: 30, train_loss: 0.8081, test_loss: 1.2636, test_f1: 0.5460
 epoch: 31, train_loss: 0.7866, test_loss: 0.9701, test_f1: 0.5517
 epoch: 32, train_loss: 0.8106, test_loss: 1.0429, test_f1: 0.4937
 epoch: 33, train_loss: 0.7944, test_loss: 1.0338, test_f1: 0.5682
 epoch: 34, train_loss: 0.7948, test_loss: 1.0353, test_f1: 0.5206
 epoch: 35, train_loss: 0.7833, test_loss: 1.0489, test_f1: 0.5311
 epoch: 36, train_loss: 0.7908, test_loss: 1.0175, test_f1: 0.5469
 epoch: 37, train_loss: 0.7784, test_loss: 0.9846, test_f1: 0.5612
 epoch: 38, train_loss: 0.8028, test_loss: 1.0405, test_f1: 0.5496
 epoch: 39, train_loss: 0.7959, test_loss: 0.9555, test_f1: 0.6192
 epoch: 40, train_loss: 0.8140, test_loss: 1.0314, test_f1: 0.5558
 epoch: 41, train_loss: 0.8067, test_loss: 1.0537, test_f1: 0.5386
 epoch: 42, train_loss: 0.7879, test_loss: 1.0133, test_f1: 0.5228
 epoch: 43, train_loss: 0.7691, test_loss: 0.9959, test_f1: 0.5965
 epoch: 44, train_loss: 0.7887, test_loss: 1.0248, test_f1: 0.5374
 epoch: 45, train_loss: 0.7816, test_loss: 1.0598, test_f1: 0.5307
 epoch: 46, train_loss: 0.7931, test_loss: 1.0635, test_f1: 0.5292
 epoch: 47, train_loss: 0.7832, test_loss: 1.2611, test_f1: 0.4654
 epoch: 48, train_loss: 0.7846, test_loss: 1.3222, test_f1: 0.4638
 epoch: 49, train_loss: 0.7828, test_loss: 1.1258, test_f1: 0.5126
 epoch: 50, train_loss: 0.7936, test_loss: 1.0149, test_f1: 0.5970
 epoch: 51, train_loss: 0.7682, test_loss: 1.0879, test_f1: 0.5827
 epoch: 52, train_loss: 0.7486, test_loss: 1.0055, test_f1: 0.5982
 epoch: 53, train_loss: 0.7385, test_loss: 1.0851, test_f1: 0.5419
 epoch: 54, train_loss: 0.7306, test_loss: 1.0713, test_f1: 0.5435
 epoch: 55, train_loss: 0.7208, test_loss: 1.0379, test_f1: 0.6013
 epoch: 56, train_loss: 0.7191, test_loss: 1.0480, test_f1: 0.6008
 epoch: 57, train_loss: 0.7443, test_loss: 1.0759, test_f1: 0.5154
 epoch: 58, train_loss: 0.7244, test_loss: 1.0439, test_f1: 0.5798
 epoch: 59, train_loss: 0.7276, test_loss: 1.0552, test_f1: 0.5708
 epoch: 60, train_loss: 0.7306, test_loss: 1.0257, test_f1: 0.5460
 epoch: 61, train_loss: 0.7427, test_loss: 1.2193, test_f1: 0.5427
 epoch: 62, train_loss: 0.7258, test_loss: 1.1630, test_f1: 0.5609
 epoch: 63, train_loss: 0.7195, test_loss: 1.0854, test_f1: 0.5398
 epoch: 64, train_loss: 0.7191, test_loss: 1.0501, test_f1: 0.5965
 epoch: 65, train_loss: 0.7399, test_loss: 1.0589, test_f1: 0.5960
 epoch: 66, train_loss: 0.7181, test_loss: 1.1578, test_f1: 0.5617
 epoch: 67, train_loss: 0.7400, test_loss: 1.0633, test_f1: 0.5991
 epoch: 68, train_loss: 0.7076, test_loss: 1.0472, test_f1: 0.5584
 epoch: 69, train_loss: 0.6983, test_loss: 1.1288, test_f1: 0.5654
 epoch: 70, train_loss: 0.6995, test_loss: 1.0163, test_f1: 0.5756
 epoch: 71, train_loss: 0.7106, test_loss: 1.0532, test_f1: 0.5815
 epoch: 72, train_loss: 0.7039, test_loss: 1.0904, test_f1: 0.5630
 epoch: 73, train_loss: 0.7266, test_loss: 1.1426, test_f1: 0.5660
 epoch: 74, train_loss: 0.6952, test_loss: 1.1145, test_f1: 0.5663
 epoch: 75, train_loss: 0.6991, test_loss: 1.0446, test_f1: 0.5906
 epoch: 76, train_loss: 0.6860, test_loss: 1.0041, test_f1: 0.5720
 epoch: 77, train_loss: 0.6960, test_loss: 1.0025, test_f1: 0.5756
 epoch: 78, train_loss: 0.6896, test_loss: 1.1112, test_f1: 0.5461
 epoch: 79, train_loss: 0.6762, test_loss: 1.0979, test_f1: 0.5890
 epoch: 80, train_loss: 0.6833, test_loss: 1.2194, test_f1: 0.5616
 epoch: 81, train_loss: 0.6819, test_loss: 1.0917, test_f1: 0.5797
 epoch: 82, train_loss: 0.7135, test_loss: 1.1928, test_f1: 0.5419
 epoch: 83, train_loss: 0.6845, test_loss: 1.1827, test_f1: 0.5300
 epoch: 84, train_loss: 0.7077, test_loss: 1.1017, test_f1: 0.5709
 epoch: 85, train_loss: 0.6991, test_loss: 1.0270, test_f1: 0.6170
 epoch: 86, train_loss: 0.6754, test_loss: 1.2877, test_f1: 0.5005
 epoch: 87, train_loss: 0.6846, test_loss: 1.0914, test_f1: 0.5528
 epoch: 88, train_loss: 0.6899, test_loss: 1.0740, test_f1: 0.5456
 epoch: 89, train_loss: 0.6688, test_loss: 1.0388, test_f1: 0.5783
 epoch: 90, train_loss: 0.6576, test_loss: 1.1694, test_f1: 0.5533
 epoch: 91, train_loss: 0.6590, test_loss: 1.1063, test_f1: 0.5663
 epoch: 92, train_loss: 0.6782, test_loss: 1.0822, test_f1: 0.5960
 epoch: 93, train_loss: 0.6977, test_loss: 1.0781, test_f1: 0.6276
 epoch: 94, train_loss: 0.6575, test_loss: 1.1572, test_f1: 0.5664
 epoch: 95, train_loss: 0.6611, test_loss: 1.0818, test_f1: 0.6211
 epoch: 96, train_loss: 0.6742, test_loss: 1.4076, test_f1: 0.5659
 epoch: 97, train_loss: 0.6833, test_loss: 1.1629, test_f1: 0.5999
 epoch: 98, train_loss: 0.6860, test_loss: 1.1717, test_f1: 0.6325
 epoch: 99, train_loss: 0.6456, test_loss: 1.1377, test_f1: 0.5909
##################ITERATION #7 ****************************************
 epoch: 0, train_loss: 1.1401, test_loss: 1.1856, test_f1: 0.3516
 epoch: 1, train_loss: 1.0339, test_loss: 1.0493, test_f1: 0.5068
 epoch: 2, train_loss: 0.9930, test_loss: 1.0424, test_f1: 0.4578
 epoch: 3, train_loss: 0.9745, test_loss: 1.0850, test_f1: 0.4584
 epoch: 4, train_loss: 0.9501, test_loss: 1.0935, test_f1: 0.4255
 epoch: 5, train_loss: 0.9267, test_loss: 1.0141, test_f1: 0.5377
 epoch: 6, train_loss: 0.8984, test_loss: 0.9876, test_f1: 0.4507
 epoch: 7, train_loss: 0.8915, test_loss: 1.1659, test_f1: 0.4996
 epoch: 8, train_loss: 0.8825, test_loss: 1.0216, test_f1: 0.4646
 epoch: 9, train_loss: 0.8829, test_loss: 1.0618, test_f1: 0.4936
 epoch: 10, train_loss: 0.8885, test_loss: 0.9949, test_f1: 0.4904
 epoch: 11, train_loss: 0.8913, test_loss: 0.9800, test_f1: 0.5312
 epoch: 12, train_loss: 0.8966, test_loss: 1.0476, test_f1: 0.4630
 epoch: 13, train_loss: 0.8977, test_loss: 1.6127, test_f1: 0.3642
 epoch: 14, train_loss: 0.8767, test_loss: 1.0300, test_f1: 0.5588
 epoch: 15, train_loss: 0.8612, test_loss: 0.9812, test_f1: 0.5232
 epoch: 16, train_loss: 0.8554, test_loss: 1.2733, test_f1: 0.4731
 epoch: 17, train_loss: 0.8471, test_loss: 1.0564, test_f1: 0.4863
 epoch: 18, train_loss: 0.8617, test_loss: 1.0418, test_f1: 0.5230
 epoch: 19, train_loss: 0.8622, test_loss: 1.0661, test_f1: 0.5346
 epoch: 20, train_loss: 0.8324, test_loss: 1.0677, test_f1: 0.4717
 epoch: 21, train_loss: 0.8510, test_loss: 0.9969, test_f1: 0.5278
 epoch: 22, train_loss: 0.8570, test_loss: 0.9889, test_f1: 0.5445
 epoch: 23, train_loss: 0.8347, test_loss: 1.1664, test_f1: 0.4263
 epoch: 24, train_loss: 0.8270, test_loss: 1.6627, test_f1: 0.4015
 epoch: 25, train_loss: 0.8526, test_loss: 1.1424, test_f1: 0.4480
 epoch: 26, train_loss: 0.8261, test_loss: 1.0300, test_f1: 0.4416
 epoch: 27, train_loss: 0.8155, test_loss: 1.1831, test_f1: 0.5078
 epoch: 28, train_loss: 0.8366, test_loss: 1.0249, test_f1: 0.5626
 epoch: 29, train_loss: 0.8081, test_loss: 1.1034, test_f1: 0.5358
 epoch: 30, train_loss: 0.8138, test_loss: 1.6856, test_f1: 0.3947
 epoch: 31, train_loss: 0.7912, test_loss: 1.0858, test_f1: 0.4094
 epoch: 32, train_loss: 0.8011, test_loss: 1.0844, test_f1: 0.5216
 epoch: 33, train_loss: 0.8226, test_loss: 1.1559, test_f1: 0.4700
 epoch: 34, train_loss: 0.7960, test_loss: 1.0017, test_f1: 0.5752
 epoch: 35, train_loss: 0.7917, test_loss: 1.0731, test_f1: 0.5505
 epoch: 36, train_loss: 0.7643, test_loss: 1.1484, test_f1: 0.5153
 epoch: 37, train_loss: 0.7868, test_loss: 1.5466, test_f1: 0.3903
 epoch: 38, train_loss: 0.8248, test_loss: 1.0396, test_f1: 0.5042
 epoch: 39, train_loss: 0.7762, test_loss: 1.1132, test_f1: 0.5276
 epoch: 40, train_loss: 0.7768, test_loss: 1.8856, test_f1: 0.4573
 epoch: 41, train_loss: 0.7901, test_loss: 1.0201, test_f1: 0.5282
 epoch: 42, train_loss: 0.7318, test_loss: 1.1227, test_f1: 0.5505
 epoch: 43, train_loss: 0.7924, test_loss: 1.1517, test_f1: 0.4382
 epoch: 44, train_loss: 0.7770, test_loss: 1.7089, test_f1: 0.4169
 epoch: 45, train_loss: 0.8106, test_loss: 0.9942, test_f1: 0.5538
 epoch: 46, train_loss: 0.7825, test_loss: 1.0272, test_f1: 0.5464
 epoch: 47, train_loss: 0.7595, test_loss: 1.0341, test_f1: 0.5534
 epoch: 48, train_loss: 0.7668, test_loss: 1.2539, test_f1: 0.5404
 epoch: 49, train_loss: 0.7801, test_loss: 1.0189, test_f1: 0.5879
 epoch: 50, train_loss: 0.7506, test_loss: 1.1641, test_f1: 0.5093
 epoch: 51, train_loss: 0.7362, test_loss: 1.2822, test_f1: 0.5219
 epoch: 52, train_loss: 0.7337, test_loss: 1.0699, test_f1: 0.5550
 epoch: 53, train_loss: 0.7307, test_loss: 1.0205, test_f1: 0.5481
 epoch: 54, train_loss: 0.7176, test_loss: 1.0958, test_f1: 0.6173
 epoch: 55, train_loss: 0.7123, test_loss: 1.1271, test_f1: 0.5882
 epoch: 56, train_loss: 0.6844, test_loss: 1.1146, test_f1: 0.6067
 epoch: 57, train_loss: 0.6891, test_loss: 1.0937, test_f1: 0.5963
 epoch: 58, train_loss: 0.7220, test_loss: 1.3542, test_f1: 0.5628
 epoch: 59, train_loss: 0.7371, test_loss: 1.2191, test_f1: 0.5708
 epoch: 60, train_loss: 0.7033, test_loss: 1.1294, test_f1: 0.5824
 epoch: 61, train_loss: 0.7063, test_loss: 1.0979, test_f1: 0.6027
 epoch: 62, train_loss: 0.6981, test_loss: 1.1941, test_f1: 0.5881
 epoch: 63, train_loss: 0.6897, test_loss: 1.0976, test_f1: 0.5713
 epoch: 64, train_loss: 0.6761, test_loss: 1.1687, test_f1: 0.5440
 epoch: 65, train_loss: 0.6743, test_loss: 1.1054, test_f1: 0.6057
 epoch: 66, train_loss: 0.6735, test_loss: 1.1040, test_f1: 0.5740
 epoch: 67, train_loss: 0.6807, test_loss: 1.2909, test_f1: 0.5716
 epoch: 68, train_loss: 0.6704, test_loss: 1.0600, test_f1: 0.6140
 epoch: 69, train_loss: 0.6942, test_loss: 1.2214, test_f1: 0.5713
 epoch: 70, train_loss: 0.6890, test_loss: 1.4662, test_f1: 0.5033
 epoch: 71, train_loss: 0.6843, test_loss: 1.1414, test_f1: 0.5354
 epoch: 72, train_loss: 0.6851, test_loss: 1.0911, test_f1: 0.5334
 epoch: 73, train_loss: 0.6766, test_loss: 1.1849, test_f1: 0.5747
 epoch: 74, train_loss: 0.6750, test_loss: 1.1292, test_f1: 0.5803
 epoch: 75, train_loss: 0.6745, test_loss: 1.1939, test_f1: 0.6120
 epoch: 76, train_loss: 0.6475, test_loss: 1.1634, test_f1: 0.5879
 epoch: 77, train_loss: 0.6658, test_loss: 1.0467, test_f1: 0.6163
 epoch: 78, train_loss: 0.6578, test_loss: 1.2130, test_f1: 0.6257
 epoch: 79, train_loss: 0.6398, test_loss: 1.1171, test_f1: 0.6060
 epoch: 80, train_loss: 0.6272, test_loss: 1.2967, test_f1: 0.5503
 epoch: 81, train_loss: 0.6434, test_loss: 1.0948, test_f1: 0.6269
 epoch: 82, train_loss: 0.6541, test_loss: 1.1574, test_f1: 0.6158
 epoch: 83, train_loss: 0.6741, test_loss: 1.3506, test_f1: 0.5529
 epoch: 84, train_loss: 0.6743, test_loss: 1.2294, test_f1: 0.6084
 epoch: 85, train_loss: 0.6483, test_loss: 1.1605, test_f1: 0.6079
 epoch: 86, train_loss: 0.6313, test_loss: 1.1710, test_f1: 0.5886
 epoch: 87, train_loss: 0.6353, test_loss: 1.1412, test_f1: 0.6093
 epoch: 88, train_loss: 0.6554, test_loss: 1.2919, test_f1: 0.5980
 epoch: 89, train_loss: 0.6493, test_loss: 1.1940, test_f1: 0.5914
 epoch: 90, train_loss: 0.6259, test_loss: 1.5028, test_f1: 0.5561
 epoch: 91, train_loss: 0.6268, test_loss: 1.1546, test_f1: 0.6291
 epoch: 92, train_loss: 0.6313, test_loss: 1.2458, test_f1: 0.5796
 epoch: 93, train_loss: 0.6076, test_loss: 1.3349, test_f1: 0.5719
 epoch: 94, train_loss: 0.5872, test_loss: 1.4286, test_f1: 0.5888
 epoch: 95, train_loss: 0.6344, test_loss: 1.2597, test_f1: 0.5874
 epoch: 96, train_loss: 0.5975, test_loss: 1.3051, test_f1: 0.5935
 epoch: 97, train_loss: 0.6377, test_loss: 1.2575, test_f1: 0.5628
 epoch: 98, train_loss: 0.6387, test_loss: 1.2711, test_f1: 0.6043
 epoch: 99, train_loss: 0.6290, test_loss: 1.2119, test_f1: 0.6111
##################ITERATION #8 ****************************************
 epoch: 0, train_loss: 1.1956, test_loss: 1.1420, test_f1: 0.4855
 epoch: 1, train_loss: 1.0465, test_loss: 1.1050, test_f1: 0.3830
 epoch: 2, train_loss: 0.9965, test_loss: 1.0561, test_f1: 0.5247
 epoch: 3, train_loss: 1.0061, test_loss: 1.0724, test_f1: 0.5137
 epoch: 4, train_loss: 0.9841, test_loss: 1.0465, test_f1: 0.5037
 epoch: 5, train_loss: 0.9795, test_loss: 1.1318, test_f1: 0.4282
 epoch: 6, train_loss: 0.9575, test_loss: 1.0288, test_f1: 0.4999
 epoch: 7, train_loss: 0.9330, test_loss: 1.0456, test_f1: 0.5177
 epoch: 8, train_loss: 0.9696, test_loss: 1.0499, test_f1: 0.4986
 epoch: 9, train_loss: 0.9429, test_loss: 1.0252, test_f1: 0.5504
 epoch: 10, train_loss: 0.9275, test_loss: 1.0528, test_f1: 0.4758
 epoch: 11, train_loss: 0.9413, test_loss: 1.1095, test_f1: 0.4209
 epoch: 12, train_loss: 0.9178, test_loss: 1.0286, test_f1: 0.5191
 epoch: 13, train_loss: 0.9069, test_loss: 1.0895, test_f1: 0.4960
 epoch: 14, train_loss: 0.9081, test_loss: 1.1509, test_f1: 0.4131
 epoch: 15, train_loss: 0.9186, test_loss: 1.0455, test_f1: 0.5289
 epoch: 16, train_loss: 0.8906, test_loss: 0.9896, test_f1: 0.5690
 epoch: 17, train_loss: 0.8989, test_loss: 1.0728, test_f1: 0.5493
 epoch: 18, train_loss: 0.9015, test_loss: 1.0496, test_f1: 0.4748
 epoch: 19, train_loss: 0.9023, test_loss: 1.0420, test_f1: 0.5222
 epoch: 20, train_loss: 0.8648, test_loss: 1.0399, test_f1: 0.5335
 epoch: 21, train_loss: 0.8820, test_loss: 1.0876, test_f1: 0.5329
 epoch: 22, train_loss: 0.8677, test_loss: 0.9974, test_f1: 0.5637
 epoch: 23, train_loss: 0.8701, test_loss: 0.9924, test_f1: 0.5578
 epoch: 24, train_loss: 0.8511, test_loss: 0.9854, test_f1: 0.5499
 epoch: 25, train_loss: 0.8691, test_loss: 0.9893, test_f1: 0.5761
 epoch: 26, train_loss: 0.8339, test_loss: 1.0267, test_f1: 0.5472
 epoch: 27, train_loss: 0.8302, test_loss: 0.9519, test_f1: 0.6029
 epoch: 28, train_loss: 0.8179, test_loss: 1.0639, test_f1: 0.5380
 epoch: 29, train_loss: 0.8279, test_loss: 1.0918, test_f1: 0.5489
 epoch: 30, train_loss: 0.8377, test_loss: 1.1065, test_f1: 0.4687
 epoch: 31, train_loss: 0.8418, test_loss: 1.1662, test_f1: 0.4554
 epoch: 32, train_loss: 0.8096, test_loss: 0.9970, test_f1: 0.5741
 epoch: 33, train_loss: 0.7931, test_loss: 1.0206, test_f1: 0.5467
 epoch: 34, train_loss: 0.7906, test_loss: 0.9334, test_f1: 0.6108
 epoch: 35, train_loss: 0.7815, test_loss: 0.9739, test_f1: 0.6046
 epoch: 36, train_loss: 0.7852, test_loss: 0.9721, test_f1: 0.5745
 epoch: 37, train_loss: 0.7697, test_loss: 1.0093, test_f1: 0.5521
 epoch: 38, train_loss: 0.7637, test_loss: 1.0535, test_f1: 0.5820
 epoch: 39, train_loss: 0.7734, test_loss: 1.0801, test_f1: 0.5183
 epoch: 40, train_loss: 0.7847, test_loss: 0.9953, test_f1: 0.5248
 epoch: 41, train_loss: 0.7747, test_loss: 1.2406, test_f1: 0.5092
 epoch: 42, train_loss: 0.7857, test_loss: 0.9388, test_f1: 0.6030
 epoch: 43, train_loss: 0.7616, test_loss: 0.9307, test_f1: 0.5566
 epoch: 44, train_loss: 0.7603, test_loss: 0.9984, test_f1: 0.5836
 epoch: 45, train_loss: 0.7479, test_loss: 1.0600, test_f1: 0.5713
 epoch: 46, train_loss: 0.7603, test_loss: 1.0327, test_f1: 0.5872
 epoch: 47, train_loss: 0.7622, test_loss: 1.4084, test_f1: 0.4913
 epoch: 48, train_loss: 0.7562, test_loss: 0.9890, test_f1: 0.5842
 epoch: 49, train_loss: 0.7562, test_loss: 0.9984, test_f1: 0.5709
 epoch: 50, train_loss: 0.7396, test_loss: 0.9120, test_f1: 0.6276
 epoch: 51, train_loss: 0.7168, test_loss: 0.9740, test_f1: 0.5992
 epoch: 52, train_loss: 0.7033, test_loss: 0.9469, test_f1: 0.5750
 epoch: 53, train_loss: 0.7054, test_loss: 0.9799, test_f1: 0.5840
 epoch: 54, train_loss: 0.7052, test_loss: 0.9226, test_f1: 0.6074
 epoch: 55, train_loss: 0.7057, test_loss: 0.9941, test_f1: 0.5525
 epoch: 56, train_loss: 0.7058, test_loss: 1.1161, test_f1: 0.5718
 epoch: 57, train_loss: 0.6869, test_loss: 1.0585, test_f1: 0.5566
 epoch: 58, train_loss: 0.6842, test_loss: 1.0437, test_f1: 0.6219
 epoch: 59, train_loss: 0.6711, test_loss: 1.1080, test_f1: 0.5656
 epoch: 60, train_loss: 0.7102, test_loss: 0.9712, test_f1: 0.5745
 epoch: 61, train_loss: 0.6808, test_loss: 1.3346, test_f1: 0.5387
 epoch: 62, train_loss: 0.6763, test_loss: 0.9678, test_f1: 0.6069
 epoch: 63, train_loss: 0.6492, test_loss: 1.0665, test_f1: 0.6021
 epoch: 64, train_loss: 0.6599, test_loss: 1.0314, test_f1: 0.5893
 epoch: 65, train_loss: 0.6656, test_loss: 1.0323, test_f1: 0.6041
 epoch: 66, train_loss: 0.7031, test_loss: 0.9984, test_f1: 0.6164
 epoch: 67, train_loss: 0.6949, test_loss: 0.9751, test_f1: 0.6138
 epoch: 68, train_loss: 0.6672, test_loss: 1.1143, test_f1: 0.6068
 epoch: 69, train_loss: 0.6619, test_loss: 1.1083, test_f1: 0.6331
 epoch: 70, train_loss: 0.6502, test_loss: 1.1230, test_f1: 0.5829
 epoch: 71, train_loss: 0.6519, test_loss: 1.0827, test_f1: 0.5595
 epoch: 72, train_loss: 0.6306, test_loss: 1.2782, test_f1: 0.5629
 epoch: 73, train_loss: 0.6546, test_loss: 1.0769, test_f1: 0.5760
 epoch: 74, train_loss: 0.6577, test_loss: 1.0081, test_f1: 0.6085
 epoch: 75, train_loss: 0.6435, test_loss: 1.0712, test_f1: 0.6202
 epoch: 76, train_loss: 0.6407, test_loss: 1.0590, test_f1: 0.5982
 epoch: 77, train_loss: 0.6391, test_loss: 1.0076, test_f1: 0.6087
 epoch: 78, train_loss: 0.6359, test_loss: 1.0334, test_f1: 0.6288
 epoch: 79, train_loss: 0.6423, test_loss: 1.1732, test_f1: 0.5814
 epoch: 80, train_loss: 0.6444, test_loss: 1.0293, test_f1: 0.6250
 epoch: 81, train_loss: 0.6167, test_loss: 1.0455, test_f1: 0.6288
 epoch: 82, train_loss: 0.6121, test_loss: 1.2270, test_f1: 0.5779
 epoch: 83, train_loss: 0.5966, test_loss: 1.1500, test_f1: 0.5832
 epoch: 84, train_loss: 0.6267, test_loss: 1.0857, test_f1: 0.6353
 epoch: 85, train_loss: 0.6367, test_loss: 1.3934, test_f1: 0.5557
 epoch: 86, train_loss: 0.6308, test_loss: 1.1537, test_f1: 0.5739
 epoch: 87, train_loss: 0.6234, test_loss: 1.0444, test_f1: 0.6135
 epoch: 88, train_loss: 0.6316, test_loss: 1.1250, test_f1: 0.5920
 epoch: 89, train_loss: 0.6402, test_loss: 1.0697, test_f1: 0.5835
 epoch: 90, train_loss: 0.6346, test_loss: 1.0539, test_f1: 0.6150
 epoch: 91, train_loss: 0.6094, test_loss: 1.0306, test_f1: 0.6287
 epoch: 92, train_loss: 0.6225, test_loss: 1.0869, test_f1: 0.5882
 epoch: 93, train_loss: 0.6527, test_loss: 1.6466, test_f1: 0.5312
 epoch: 94, train_loss: 0.6290, test_loss: 1.1919, test_f1: 0.6035
 epoch: 95, train_loss: 0.6238, test_loss: 1.0374, test_f1: 0.6193
 epoch: 96, train_loss: 0.6032, test_loss: 1.1750, test_f1: 0.5951
 epoch: 97, train_loss: 0.5949, test_loss: 1.0531, test_f1: 0.6114
 epoch: 98, train_loss: 0.6155, test_loss: 1.2412, test_f1: 0.6358
 epoch: 99, train_loss: 0.5999, test_loss: 1.0631, test_f1: 0.6407
##################ITERATION #9 ****************************************
 epoch: 0, train_loss: 1.1363, test_loss: 1.1845, test_f1: 0.3861
 epoch: 1, train_loss: 1.0215, test_loss: 1.0869, test_f1: 0.3863
 epoch: 2, train_loss: 0.9629, test_loss: 0.9638, test_f1: 0.5665
 epoch: 3, train_loss: 0.9487, test_loss: 0.9968, test_f1: 0.5469
 epoch: 4, train_loss: 0.9538, test_loss: 1.0399, test_f1: 0.4360
 epoch: 5, train_loss: 0.9284, test_loss: 1.2531, test_f1: 0.4419
 epoch: 6, train_loss: 0.9201, test_loss: 1.0221, test_f1: 0.4616
 epoch: 7, train_loss: 0.9164, test_loss: 1.0140, test_f1: 0.5258
 epoch: 8, train_loss: 0.8896, test_loss: 1.0648, test_f1: 0.5262
 epoch: 9, train_loss: 0.8705, test_loss: 0.9463, test_f1: 0.5324
 epoch: 10, train_loss: 0.8593, test_loss: 1.0743, test_f1: 0.5455
 epoch: 11, train_loss: 0.8584, test_loss: 1.0495, test_f1: 0.5329
 epoch: 12, train_loss: 0.8726, test_loss: 1.0937, test_f1: 0.4412
 epoch: 13, train_loss: 0.8884, test_loss: 1.0459, test_f1: 0.5586
 epoch: 14, train_loss: 0.8807, test_loss: 0.9678, test_f1: 0.5389
 epoch: 15, train_loss: 0.8580, test_loss: 0.9383, test_f1: 0.5837
 epoch: 16, train_loss: 0.8621, test_loss: 1.0489, test_f1: 0.4854
 epoch: 17, train_loss: 0.8522, test_loss: 0.9423, test_f1: 0.5582
 epoch: 18, train_loss: 0.8531, test_loss: 1.0159, test_f1: 0.5135
 epoch: 19, train_loss: 0.8720, test_loss: 0.9559, test_f1: 0.5966
 epoch: 20, train_loss: 0.8532, test_loss: 0.9859, test_f1: 0.5596
 epoch: 21, train_loss: 0.8316, test_loss: 1.0032, test_f1: 0.5264
 epoch: 22, train_loss: 0.8534, test_loss: 0.9716, test_f1: 0.5453
 epoch: 23, train_loss: 0.8605, test_loss: 0.9466, test_f1: 0.5764
 epoch: 24, train_loss: 0.8307, test_loss: 1.0465, test_f1: 0.5130
 epoch: 25, train_loss: 0.8337, test_loss: 0.9450, test_f1: 0.6187
 epoch: 26, train_loss: 0.8125, test_loss: 0.9370, test_f1: 0.6325
 epoch: 27, train_loss: 0.8329, test_loss: 0.9483, test_f1: 0.5840
 epoch: 28, train_loss: 0.8381, test_loss: 1.0106, test_f1: 0.5159
 epoch: 29, train_loss: 0.8295, test_loss: 1.0220, test_f1: 0.5247
 epoch: 30, train_loss: 0.8121, test_loss: 0.9386, test_f1: 0.5949
 epoch: 31, train_loss: 0.8154, test_loss: 1.0335, test_f1: 0.5382
 epoch: 32, train_loss: 0.8017, test_loss: 0.9923, test_f1: 0.5806
 epoch: 33, train_loss: 0.8207, test_loss: 0.9564, test_f1: 0.5822
 epoch: 34, train_loss: 0.8157, test_loss: 0.9287, test_f1: 0.5974
 epoch: 35, train_loss: 0.7974, test_loss: 0.9990, test_f1: 0.5733
 epoch: 36, train_loss: 0.8215, test_loss: 0.9931, test_f1: 0.6156
 epoch: 37, train_loss: 0.8269, test_loss: 0.9528, test_f1: 0.6186
 epoch: 38, train_loss: 0.8258, test_loss: 1.0684, test_f1: 0.5403
 epoch: 39, train_loss: 0.7962, test_loss: 0.9499, test_f1: 0.5670
 epoch: 40, train_loss: 0.8138, test_loss: 1.0865, test_f1: 0.5682
 epoch: 41, train_loss: 0.8043, test_loss: 0.9704, test_f1: 0.5635
 epoch: 42, train_loss: 0.7941, test_loss: 1.0312, test_f1: 0.5779
 epoch: 43, train_loss: 0.8179, test_loss: 0.9503, test_f1: 0.6001
 epoch: 44, train_loss: 0.7941, test_loss: 0.9316, test_f1: 0.6046
 epoch: 45, train_loss: 0.7978, test_loss: 0.9357, test_f1: 0.5879
 epoch: 46, train_loss: 0.8104, test_loss: 0.9219, test_f1: 0.6277
 epoch: 47, train_loss: 0.7758, test_loss: 0.9128, test_f1: 0.6352
 epoch: 48, train_loss: 0.7714, test_loss: 0.9266, test_f1: 0.6222
 epoch: 49, train_loss: 0.7627, test_loss: 0.9088, test_f1: 0.6316
 epoch: 50, train_loss: 0.7741, test_loss: 0.9706, test_f1: 0.6184
 epoch: 51, train_loss: 0.7641, test_loss: 0.9504, test_f1: 0.6245
 epoch: 52, train_loss: 0.7523, test_loss: 0.9221, test_f1: 0.6223
 epoch: 53, train_loss: 0.7427, test_loss: 0.9418, test_f1: 0.6357
 epoch: 54, train_loss: 0.7372, test_loss: 0.9115, test_f1: 0.6670
 epoch: 55, train_loss: 0.7371, test_loss: 1.0025, test_f1: 0.5889
 epoch: 56, train_loss: 0.7416, test_loss: 0.9089, test_f1: 0.6237
 epoch: 57, train_loss: 0.7444, test_loss: 0.9732, test_f1: 0.5744
 epoch: 58, train_loss: 0.7369, test_loss: 0.9642, test_f1: 0.6131
 epoch: 59, train_loss: 0.7062, test_loss: 0.9276, test_f1: 0.6478
 epoch: 60, train_loss: 0.7172, test_loss: 0.9001, test_f1: 0.6393
 epoch: 61, train_loss: 0.6959, test_loss: 0.9687, test_f1: 0.6461
 epoch: 62, train_loss: 0.7241, test_loss: 0.9156, test_f1: 0.6326
 epoch: 63, train_loss: 0.7127, test_loss: 0.9202, test_f1: 0.6371
 epoch: 64, train_loss: 0.7222, test_loss: 0.9326, test_f1: 0.5767
 epoch: 65, train_loss: 0.6974, test_loss: 0.9884, test_f1: 0.5945
 epoch: 66, train_loss: 0.7235, test_loss: 0.9387, test_f1: 0.6110
 epoch: 67, train_loss: 0.7101, test_loss: 0.9747, test_f1: 0.5965
 epoch: 68, train_loss: 0.7225, test_loss: 1.0854, test_f1: 0.5175
 epoch: 69, train_loss: 0.7042, test_loss: 0.9085, test_f1: 0.6541
 epoch: 70, train_loss: 0.6861, test_loss: 0.9429, test_f1: 0.6243
 epoch: 71, train_loss: 0.6962, test_loss: 0.9818, test_f1: 0.6034
 epoch: 72, train_loss: 0.7197, test_loss: 0.9201, test_f1: 0.6650
 epoch: 73, train_loss: 0.6817, test_loss: 1.0232, test_f1: 0.6005
 epoch: 74, train_loss: 0.6661, test_loss: 0.9867, test_f1: 0.6156
 epoch: 75, train_loss: 0.6871, test_loss: 0.9613, test_f1: 0.6096
 epoch: 76, train_loss: 0.6907, test_loss: 0.9228, test_f1: 0.6614
 epoch: 77, train_loss: 0.6834, test_loss: 0.9427, test_f1: 0.5877
 epoch: 78, train_loss: 0.6896, test_loss: 1.0956, test_f1: 0.5184
 epoch: 79, train_loss: 0.6550, test_loss: 0.9527, test_f1: 0.5620
 epoch: 80, train_loss: 0.6637, test_loss: 1.0343, test_f1: 0.5517
 epoch: 81, train_loss: 0.6738, test_loss: 0.9335, test_f1: 0.6594
 epoch: 82, train_loss: 0.6628, test_loss: 0.9772, test_f1: 0.6398
 epoch: 83, train_loss: 0.6938, test_loss: 1.0468, test_f1: 0.6058
 epoch: 84, train_loss: 0.6647, test_loss: 0.9991, test_f1: 0.6187
 epoch: 85, train_loss: 0.6691, test_loss: 1.0515, test_f1: 0.5791
 epoch: 86, train_loss: 0.6730, test_loss: 0.9557, test_f1: 0.6380
 epoch: 87, train_loss: 0.6796, test_loss: 1.0624, test_f1: 0.5412
 epoch: 88, train_loss: 0.6653, test_loss: 2.4427, test_f1: 0.3839
 epoch: 89, train_loss: 0.9247, test_loss: 1.0255, test_f1: 0.5208
 epoch: 90, train_loss: 0.8137, test_loss: 1.0184, test_f1: 0.5602
 epoch: 91, train_loss: 0.7579, test_loss: 0.9618, test_f1: 0.6451
 epoch: 92, train_loss: 0.7108, test_loss: 0.9675, test_f1: 0.6186
 epoch: 93, train_loss: 0.6898, test_loss: 0.9956, test_f1: 0.6117
 epoch: 94, train_loss: 0.6920, test_loss: 0.9930, test_f1: 0.5805
 epoch: 95, train_loss: 0.6827, test_loss: 1.0059, test_f1: 0.6059
 epoch: 96, train_loss: 0.6574, test_loss: 0.9664, test_f1: 0.6299
 epoch: 97, train_loss: 0.6450, test_loss: 1.1077, test_f1: 0.5478
 epoch: 98, train_loss: 0.6436, test_loss: 1.0341, test_f1: 0.6261
 epoch: 99, train_loss: 0.6779, test_loss: 1.2721, test_f1: 0.5660

Training completed in 981.91 seconds
Best F1: 0.6854 at epoch 83
Mean F1 across iterations: 0.6498  0.0177
========================FINAL RESULTS================================
FEGIN weighted F1: 0.6854  0.0177
python main.py --data ltspice_demos --representation component_pin_net --model FEGIN --layers 4 --hiddens 16 --batch_size 32 --lr 0.01 --emb_size 250 --epochs 100 --save_appendix component_pin_net_L4_H16_BS32_LR0.01_E250 --no_val
-----



STDERR:
  File "main.py", line 370, in <module>
    main()
  File "main.py", line 254, in main
    dataset = dataset_class(
  File "/home/philip/projects/ltspice_examples_code_repo/Circuit-Completion-Using-GNNs/component_classification_with_link_prediction_head/evaluation/FEGIN/kernel/circuit_datasets.py", line 15, in __init__
    self.data, self.slices = torch.load(self.processed_paths[0])
  File "/home/philip/.local/lib/python3.8/site-packages/torch/serialization.py", line 1040, in load
    warnings.warn(
  File "/usr/lib/python3.8/warnings.py", line 109, in _showwarnmsg
    sw(msg.message, msg.category, msg.filename, msg.lineno,
  File "main.py", line 47, in warn_with_traceback
    traceback.print_stack(file=log)
/home/philip/projects/ltspice_examples_code_repo/Circuit-Completion-Using-GNNs/component_classification_with_link_prediction_head/evaluation/FEGIN/kernel/circuit_datasets.py:15: FutureWarning: You are using `torch.load` with `weights_only=False` (the current default value), which uses the default pickle module implicitly. It is possible to construct malicious pickle data which will execute arbitrary code during unpickling (See https://github.com/pytorch/pytorch/blob/main/SECURITY.md#untrusted-models for more details). In a future release, the default value for `weights_only` will be flipped to `True`. This limits the functions that could be executed during unpickling. Arbitrary objects will no longer be allowed to be loaded via this mode unless they are explicitly allowlisted by the user via `torch.serialization.add_safe_globals`. We recommend you start setting `weights_only=True` for any use case where you don't have full control of the loaded file. Please open an issue on GitHub for any issues related to this experimental feature.
  self.data, self.slices = torch.load(self.processed_paths[0])
