STDOUT:
Results will be saved in /home/philip/projects/ltspice_examples_code_repo/Circuit-Completion-Using-GNNs/component_classification_with_link_prediction_head/evaluation/FEGIN/results/model_FEGIN_dataset_ltspice_examples
Command line input: python main.py --data ltspice_examples --representation component_component --model FEGIN --layers 5 --hiddens 128 --batch_size 256 --lr 0.001 --emb_size 250 --epochs 100 --save_appendix component_component_L5_H128_BS256_LR0.001_E250 --no_val
 is saved.
-----
ltspice_examples - FEGIN
Using 5 layers, 128 hidden units, h = 2
Loading component_component representation dataset
ENTERED
Training FEGIN on component_component representation
Train: 3556, Test: 845
##################ITERATION #0 ****************************************
 epoch: 0, train_loss: 1.3141, test_loss: 1.2847, test_f1: 0.2589
 epoch: 1, train_loss: 1.2007, test_loss: 1.2032, test_f1: 0.3624
 epoch: 2, train_loss: 1.1471, test_loss: 1.1484, test_f1: 0.3591
 epoch: 3, train_loss: 1.0941, test_loss: 1.0992, test_f1: 0.4803
 epoch: 4, train_loss: 1.0494, test_loss: 1.0495, test_f1: 0.4563
 epoch: 5, train_loss: 1.0053, test_loss: 1.0222, test_f1: 0.4876
 epoch: 6, train_loss: 0.9721, test_loss: 0.9977, test_f1: 0.4868
 epoch: 7, train_loss: 0.9310, test_loss: 1.0221, test_f1: 0.5187
 epoch: 8, train_loss: 0.9083, test_loss: 1.0926, test_f1: 0.4400
 epoch: 9, train_loss: 0.8824, test_loss: 1.0176, test_f1: 0.4967
 epoch: 10, train_loss: 0.8419, test_loss: 1.1245, test_f1: 0.4769
 epoch: 11, train_loss: 0.8414, test_loss: 1.0530, test_f1: 0.4913
 epoch: 12, train_loss: 0.8344, test_loss: 1.1984, test_f1: 0.4359
 epoch: 13, train_loss: 0.8139, test_loss: 1.3095, test_f1: 0.4679
 epoch: 14, train_loss: 0.7787, test_loss: 1.1268, test_f1: 0.4812
 epoch: 15, train_loss: 0.7664, test_loss: 1.0900, test_f1: 0.5312
 epoch: 16, train_loss: 0.7429, test_loss: 1.1932, test_f1: 0.5304
 epoch: 17, train_loss: 0.7138, test_loss: 1.3101, test_f1: 0.5161
 epoch: 18, train_loss: 0.7143, test_loss: 1.3821, test_f1: 0.5142
 epoch: 19, train_loss: 0.6968, test_loss: 1.2838, test_f1: 0.5288
 epoch: 20, train_loss: 0.7063, test_loss: 1.4506, test_f1: 0.4649
 epoch: 21, train_loss: 0.6912, test_loss: 1.2327, test_f1: 0.5518
 epoch: 22, train_loss: 0.6724, test_loss: 1.3814, test_f1: 0.5503
 epoch: 23, train_loss: 0.6396, test_loss: 1.6836, test_f1: 0.4849
 epoch: 24, train_loss: 0.6379, test_loss: 1.3654, test_f1: 0.5381
 epoch: 25, train_loss: 0.6663, test_loss: 1.5739, test_f1: 0.5390
 epoch: 26, train_loss: 0.6478, test_loss: 1.4381, test_f1: 0.5358
 epoch: 27, train_loss: 0.6337, test_loss: 1.6257, test_f1: 0.4807
 epoch: 28, train_loss: 0.5982, test_loss: 1.5222, test_f1: 0.5420
 epoch: 29, train_loss: 0.5831, test_loss: 1.4592, test_f1: 0.5443
 epoch: 30, train_loss: 0.5542, test_loss: 1.5551, test_f1: 0.5116
 epoch: 31, train_loss: 0.5697, test_loss: 1.8278, test_f1: 0.5059
 epoch: 32, train_loss: 0.5681, test_loss: 1.6853, test_f1: 0.5174
 epoch: 33, train_loss: 0.5723, test_loss: 1.6477, test_f1: 0.5175
 epoch: 34, train_loss: 0.5430, test_loss: 1.7257, test_f1: 0.5169
 epoch: 35, train_loss: 0.4967, test_loss: 1.5989, test_f1: 0.5424
 epoch: 36, train_loss: 0.5108, test_loss: 1.6336, test_f1: 0.5134
 epoch: 37, train_loss: 0.4845, test_loss: 1.8357, test_f1: 0.5158
 epoch: 38, train_loss: 0.4974, test_loss: 2.0454, test_f1: 0.5113
 epoch: 39, train_loss: 0.4823, test_loss: 1.9498, test_f1: 0.5114
 epoch: 40, train_loss: 0.4913, test_loss: 1.9344, test_f1: 0.5581
 epoch: 41, train_loss: 0.4687, test_loss: 1.8317, test_f1: 0.4891
 epoch: 42, train_loss: 0.4605, test_loss: 2.0261, test_f1: 0.5362
 epoch: 43, train_loss: 0.4506, test_loss: 1.7655, test_f1: 0.5310
 epoch: 44, train_loss: 0.4622, test_loss: 2.3142, test_f1: 0.5351
 epoch: 45, train_loss: 0.4697, test_loss: 1.7447, test_f1: 0.5344
 epoch: 46, train_loss: 0.4586, test_loss: 1.9343, test_f1: 0.5278
 epoch: 47, train_loss: 0.4254, test_loss: 2.0523, test_f1: 0.5128
 epoch: 48, train_loss: 0.4080, test_loss: 1.8993, test_f1: 0.5199
 epoch: 49, train_loss: 0.3964, test_loss: 2.2036, test_f1: 0.5287
 epoch: 50, train_loss: 0.3865, test_loss: 2.4421, test_f1: 0.5117
 epoch: 51, train_loss: 0.3750, test_loss: 2.2140, test_f1: 0.5276
 epoch: 52, train_loss: 0.3200, test_loss: 2.2357, test_f1: 0.5409
 epoch: 53, train_loss: 0.3089, test_loss: 2.3010, test_f1: 0.5487
 epoch: 54, train_loss: 0.2997, test_loss: 2.6224, test_f1: 0.5213
 epoch: 55, train_loss: 0.2836, test_loss: 2.4602, test_f1: 0.5180
 epoch: 56, train_loss: 0.2795, test_loss: 2.6663, test_f1: 0.5269
 epoch: 57, train_loss: 0.2875, test_loss: 2.5463, test_f1: 0.5370
 epoch: 58, train_loss: 0.2731, test_loss: 2.7046, test_f1: 0.5100
 epoch: 59, train_loss: 0.2628, test_loss: 2.7187, test_f1: 0.5526
 epoch: 60, train_loss: 0.2699, test_loss: 2.6565, test_f1: 0.5262
 epoch: 61, train_loss: 0.2705, test_loss: 2.6773, test_f1: 0.5296
 epoch: 62, train_loss: 0.2650, test_loss: 2.9138, test_f1: 0.5385
 epoch: 63, train_loss: 0.2534, test_loss: 2.8488, test_f1: 0.5338
 epoch: 64, train_loss: 0.2477, test_loss: 3.0272, test_f1: 0.5437
 epoch: 65, train_loss: 0.2459, test_loss: 2.7624, test_f1: 0.5175
 epoch: 66, train_loss: 0.2357, test_loss: 2.9064, test_f1: 0.5301
 epoch: 67, train_loss: 0.2526, test_loss: 2.8683, test_f1: 0.5271
 epoch: 68, train_loss: 0.2551, test_loss: 2.9365, test_f1: 0.5016
 epoch: 69, train_loss: 0.2527, test_loss: 2.9594, test_f1: 0.5488
 epoch: 70, train_loss: 0.2516, test_loss: 2.8813, test_f1: 0.5228
 epoch: 71, train_loss: 0.2372, test_loss: 3.3385, test_f1: 0.5266
 epoch: 72, train_loss: 0.2487, test_loss: 2.7895, test_f1: 0.5263
 epoch: 73, train_loss: 0.2576, test_loss: 3.2703, test_f1: 0.5218
 epoch: 74, train_loss: 0.2380, test_loss: 2.9641, test_f1: 0.5181
 epoch: 75, train_loss: 0.2170, test_loss: 3.3068, test_f1: 0.4969
 epoch: 76, train_loss: 0.2224, test_loss: 2.8016, test_f1: 0.5457
 epoch: 77, train_loss: 0.2528, test_loss: 2.9561, test_f1: 0.5237
 epoch: 78, train_loss: 0.2350, test_loss: 3.2888, test_f1: 0.5080
 epoch: 79, train_loss: 0.2179, test_loss: 3.2961, test_f1: 0.5128
 epoch: 80, train_loss: 0.2224, test_loss: 3.1326, test_f1: 0.5118
 epoch: 81, train_loss: 0.2325, test_loss: 3.1474, test_f1: 0.5346
 epoch: 82, train_loss: 0.1981, test_loss: 3.3375, test_f1: 0.5242
 epoch: 83, train_loss: 0.1874, test_loss: 3.5686, test_f1: 0.5343
 epoch: 84, train_loss: 0.1857, test_loss: 3.2572, test_f1: 0.5217
 epoch: 85, train_loss: 0.1974, test_loss: 3.4487, test_f1: 0.5077
 epoch: 86, train_loss: 0.1928, test_loss: 3.2532, test_f1: 0.5110
 epoch: 87, train_loss: 0.1914, test_loss: 3.3469, test_f1: 0.5382
 epoch: 88, train_loss: 0.2040, test_loss: 3.2192, test_f1: 0.5265
 epoch: 89, train_loss: 0.2164, test_loss: 3.3232, test_f1: 0.5138
 epoch: 90, train_loss: 0.2041, test_loss: 3.1803, test_f1: 0.5140
 epoch: 91, train_loss: 0.1866, test_loss: 3.5575, test_f1: 0.5122
 epoch: 92, train_loss: 0.1865, test_loss: 3.3235, test_f1: 0.5099
 epoch: 93, train_loss: 0.1854, test_loss: 3.5813, test_f1: 0.5088
 epoch: 94, train_loss: 0.1727, test_loss: 3.4463, test_f1: 0.5099
 epoch: 95, train_loss: 0.1881, test_loss: 3.5350, test_f1: 0.5175
 epoch: 96, train_loss: 0.1686, test_loss: 3.4934, test_f1: 0.5252
 epoch: 97, train_loss: 0.1786, test_loss: 3.5095, test_f1: 0.5141
 epoch: 98, train_loss: 0.1786, test_loss: 3.7870, test_f1: 0.5268
 epoch: 99, train_loss: 0.1466, test_loss: 3.8062, test_f1: 0.5107
##################ITERATION #1 ****************************************
 epoch: 0, train_loss: 1.2474, test_loss: 1.2583, test_f1: 0.2390
 epoch: 1, train_loss: 1.1307, test_loss: 1.1685, test_f1: 0.4255
 epoch: 2, train_loss: 1.0679, test_loss: 1.0641, test_f1: 0.4952
 epoch: 3, train_loss: 1.0168, test_loss: 1.0222, test_f1: 0.4925
 epoch: 4, train_loss: 0.9753, test_loss: 1.0181, test_f1: 0.4679
 epoch: 5, train_loss: 0.9540, test_loss: 1.0003, test_f1: 0.5101
 epoch: 6, train_loss: 0.9033, test_loss: 1.0577, test_f1: 0.4805
 epoch: 7, train_loss: 0.8703, test_loss: 0.9675, test_f1: 0.5274
 epoch: 8, train_loss: 0.8504, test_loss: 1.0120, test_f1: 0.5568
 epoch: 9, train_loss: 0.8300, test_loss: 0.9836, test_f1: 0.4981
 epoch: 10, train_loss: 0.8072, test_loss: 1.0882, test_f1: 0.5097
 epoch: 11, train_loss: 0.7655, test_loss: 1.2625, test_f1: 0.5359
 epoch: 12, train_loss: 0.7601, test_loss: 1.0817, test_f1: 0.5194
 epoch: 13, train_loss: 0.7715, test_loss: 1.2122, test_f1: 0.4981
 epoch: 14, train_loss: 0.7456, test_loss: 1.1314, test_f1: 0.5215
 epoch: 15, train_loss: 0.7012, test_loss: 1.1616, test_f1: 0.5645
 epoch: 16, train_loss: 0.7048, test_loss: 1.4097, test_f1: 0.5108
 epoch: 17, train_loss: 0.6824, test_loss: 1.6366, test_f1: 0.5082
 epoch: 18, train_loss: 0.6647, test_loss: 1.2773, test_f1: 0.5420
 epoch: 19, train_loss: 0.6643, test_loss: 1.7551, test_f1: 0.4843
 epoch: 20, train_loss: 0.6538, test_loss: 1.2764, test_f1: 0.5384
 epoch: 21, train_loss: 0.6284, test_loss: 1.3740, test_f1: 0.5297
 epoch: 22, train_loss: 0.5889, test_loss: 1.3755, test_f1: 0.5290
 epoch: 23, train_loss: 0.6144, test_loss: 1.5163, test_f1: 0.5398
 epoch: 24, train_loss: 0.5882, test_loss: 1.6789, test_f1: 0.5390
 epoch: 25, train_loss: 0.5557, test_loss: 1.4532, test_f1: 0.5344
 epoch: 26, train_loss: 0.5437, test_loss: 1.3984, test_f1: 0.5269
 epoch: 27, train_loss: 0.5365, test_loss: 1.4125, test_f1: 0.5221
 epoch: 28, train_loss: 0.5294, test_loss: 1.6052, test_f1: 0.5463
 epoch: 29, train_loss: 0.5248, test_loss: 1.7292, test_f1: 0.5185
 epoch: 30, train_loss: 0.5028, test_loss: 1.5616, test_f1: 0.5407
 epoch: 31, train_loss: 0.4971, test_loss: 1.9423, test_f1: 0.5244
 epoch: 32, train_loss: 0.4869, test_loss: 1.7746, test_f1: 0.5287
 epoch: 33, train_loss: 0.4624, test_loss: 1.9057, test_f1: 0.5258
 epoch: 34, train_loss: 0.4640, test_loss: 1.8884, test_f1: 0.5093
 epoch: 35, train_loss: 0.4615, test_loss: 1.9309, test_f1: 0.5119
 epoch: 36, train_loss: 0.4494, test_loss: 1.7346, test_f1: 0.5468
 epoch: 37, train_loss: 0.4233, test_loss: 1.9496, test_f1: 0.5310
 epoch: 38, train_loss: 0.4312, test_loss: 1.9147, test_f1: 0.5249
 epoch: 39, train_loss: 0.4298, test_loss: 2.0376, test_f1: 0.5072
 epoch: 40, train_loss: 0.4159, test_loss: 1.8723, test_f1: 0.5089
 epoch: 41, train_loss: 0.4058, test_loss: 2.2457, test_f1: 0.4903
 epoch: 42, train_loss: 0.4051, test_loss: 1.9900, test_f1: 0.5215
 epoch: 43, train_loss: 0.3938, test_loss: 2.0588, test_f1: 0.5224
 epoch: 44, train_loss: 0.3890, test_loss: 1.9113, test_f1: 0.5068
 epoch: 45, train_loss: 0.3927, test_loss: 2.0022, test_f1: 0.5266
 epoch: 46, train_loss: 0.3877, test_loss: 2.0533, test_f1: 0.5259
 epoch: 47, train_loss: 0.4128, test_loss: 2.0433, test_f1: 0.5237
 epoch: 48, train_loss: 0.3797, test_loss: 2.0933, test_f1: 0.5458
 epoch: 49, train_loss: 0.3472, test_loss: 2.0986, test_f1: 0.5054
 epoch: 50, train_loss: 0.3213, test_loss: 2.4263, test_f1: 0.5044
 epoch: 51, train_loss: 0.3176, test_loss: 2.2987, test_f1: 0.5225
 epoch: 52, train_loss: 0.2853, test_loss: 2.5267, test_f1: 0.5363
 epoch: 53, train_loss: 0.2695, test_loss: 2.3389, test_f1: 0.5209
 epoch: 54, train_loss: 0.2664, test_loss: 2.3939, test_f1: 0.5342
 epoch: 55, train_loss: 0.2485, test_loss: 2.5150, test_f1: 0.5338
 epoch: 56, train_loss: 0.2559, test_loss: 2.4487, test_f1: 0.5151
 epoch: 57, train_loss: 0.2535, test_loss: 2.6066, test_f1: 0.5014
 epoch: 58, train_loss: 0.2340, test_loss: 2.6193, test_f1: 0.5164
 epoch: 59, train_loss: 0.2346, test_loss: 2.5947, test_f1: 0.5158
 epoch: 60, train_loss: 0.2390, test_loss: 2.8201, test_f1: 0.5289
 epoch: 61, train_loss: 0.2224, test_loss: 2.8056, test_f1: 0.5091
 epoch: 62, train_loss: 0.2262, test_loss: 2.7416, test_f1: 0.5275
 epoch: 63, train_loss: 0.2299, test_loss: 2.9213, test_f1: 0.4893
 epoch: 64, train_loss: 0.2302, test_loss: 2.7084, test_f1: 0.5306
 epoch: 65, train_loss: 0.2133, test_loss: 2.7176, test_f1: 0.5489
 epoch: 66, train_loss: 0.2149, test_loss: 2.8014, test_f1: 0.5154
 epoch: 67, train_loss: 0.2097, test_loss: 2.7012, test_f1: 0.5121
 epoch: 68, train_loss: 0.2039, test_loss: 2.9374, test_f1: 0.5301
 epoch: 69, train_loss: 0.2026, test_loss: 3.0923, test_f1: 0.5031
 epoch: 70, train_loss: 0.2158, test_loss: 2.6274, test_f1: 0.5394
 epoch: 71, train_loss: 0.2183, test_loss: 3.2171, test_f1: 0.5262
 epoch: 72, train_loss: 0.2221, test_loss: 2.7531, test_f1: 0.5465
 epoch: 73, train_loss: 0.2143, test_loss: 2.9658, test_f1: 0.5459
 epoch: 74, train_loss: 0.1964, test_loss: 2.9064, test_f1: 0.5281
 epoch: 75, train_loss: 0.2104, test_loss: 2.7419, test_f1: 0.5344
 epoch: 76, train_loss: 0.1994, test_loss: 2.7693, test_f1: 0.5240
 epoch: 77, train_loss: 0.1921, test_loss: 2.7245, test_f1: 0.5402
 epoch: 78, train_loss: 0.1847, test_loss: 3.1286, test_f1: 0.5033
 epoch: 79, train_loss: 0.1784, test_loss: 3.0837, test_f1: 0.5330
 epoch: 80, train_loss: 0.1813, test_loss: 3.0344, test_f1: 0.5293
 epoch: 81, train_loss: 0.1797, test_loss: 3.2441, test_f1: 0.5356
 epoch: 82, train_loss: 0.1699, test_loss: 3.1644, test_f1: 0.5337
 epoch: 83, train_loss: 0.1665, test_loss: 3.0227, test_f1: 0.5585
 epoch: 84, train_loss: 0.1716, test_loss: 3.4571, test_f1: 0.5250
 epoch: 85, train_loss: 0.1802, test_loss: 3.2093, test_f1: 0.5278
 epoch: 86, train_loss: 0.1672, test_loss: 3.0586, test_f1: 0.5229
 epoch: 87, train_loss: 0.1674, test_loss: 3.2213, test_f1: 0.5224
 epoch: 88, train_loss: 0.1811, test_loss: 3.3424, test_f1: 0.5253
 epoch: 89, train_loss: 0.1540, test_loss: 3.1857, test_f1: 0.5377
 epoch: 90, train_loss: 0.1526, test_loss: 3.1074, test_f1: 0.5505
 epoch: 91, train_loss: 0.1642, test_loss: 3.1131, test_f1: 0.5351
 epoch: 92, train_loss: 0.1725, test_loss: 3.3336, test_f1: 0.5071
 epoch: 93, train_loss: 0.1876, test_loss: 3.6313, test_f1: 0.5286
 epoch: 94, train_loss: 0.1744, test_loss: 2.9657, test_f1: 0.5501
 epoch: 95, train_loss: 0.1593, test_loss: 3.5481, test_f1: 0.5063
 epoch: 96, train_loss: 0.1575, test_loss: 3.4865, test_f1: 0.5196
 epoch: 97, train_loss: 0.1690, test_loss: 3.1959, test_f1: 0.5521
 epoch: 98, train_loss: 0.1582, test_loss: 3.3223, test_f1: 0.5397
 epoch: 99, train_loss: 0.1405, test_loss: 3.3406, test_f1: 0.5435
##################ITERATION #2 ****************************************
 epoch: 0, train_loss: 1.2870, test_loss: 1.2698, test_f1: 0.3271
 epoch: 1, train_loss: 1.1423, test_loss: 1.1832, test_f1: 0.4091
 epoch: 2, train_loss: 1.0924, test_loss: 1.1059, test_f1: 0.4333
 epoch: 3, train_loss: 1.0312, test_loss: 1.0548, test_f1: 0.4638
 epoch: 4, train_loss: 0.9925, test_loss: 0.9929, test_f1: 0.5013
 epoch: 5, train_loss: 0.9534, test_loss: 0.9862, test_f1: 0.5012
 epoch: 6, train_loss: 0.9275, test_loss: 1.0155, test_f1: 0.4971
 epoch: 7, train_loss: 0.8952, test_loss: 1.0645, test_f1: 0.4831
 epoch: 8, train_loss: 0.8801, test_loss: 0.9918, test_f1: 0.5117
 epoch: 9, train_loss: 0.8769, test_loss: 0.9961, test_f1: 0.5089
 epoch: 10, train_loss: 0.8381, test_loss: 1.0861, test_f1: 0.4831
 epoch: 11, train_loss: 0.8327, test_loss: 1.0722, test_f1: 0.5007
 epoch: 12, train_loss: 0.8078, test_loss: 1.0357, test_f1: 0.5064
 epoch: 13, train_loss: 0.8048, test_loss: 1.0558, test_f1: 0.5337
 epoch: 14, train_loss: 0.7845, test_loss: 1.1075, test_f1: 0.5109
 epoch: 15, train_loss: 0.7593, test_loss: 1.0819, test_f1: 0.5293
 epoch: 16, train_loss: 0.7753, test_loss: 1.1077, test_f1: 0.5292
 epoch: 17, train_loss: 0.7677, test_loss: 1.1883, test_f1: 0.5210
 epoch: 18, train_loss: 0.7521, test_loss: 1.1561, test_f1: 0.5360
 epoch: 19, train_loss: 0.7115, test_loss: 1.2642, test_f1: 0.4902
 epoch: 20, train_loss: 0.7107, test_loss: 1.2457, test_f1: 0.5123
 epoch: 21, train_loss: 0.7149, test_loss: 1.2807, test_f1: 0.5458
 epoch: 22, train_loss: 0.7012, test_loss: 1.5752, test_f1: 0.4855
 epoch: 23, train_loss: 0.6831, test_loss: 1.3652, test_f1: 0.5290
 epoch: 24, train_loss: 0.6658, test_loss: 1.3949, test_f1: 0.5143
 epoch: 25, train_loss: 0.6554, test_loss: 1.2178, test_f1: 0.5642
 epoch: 26, train_loss: 0.6472, test_loss: 1.3239, test_f1: 0.5080
 epoch: 27, train_loss: 0.6246, test_loss: 1.4057, test_f1: 0.5388
 epoch: 28, train_loss: 0.6100, test_loss: 1.3639, test_f1: 0.5586
 epoch: 29, train_loss: 0.6059, test_loss: 1.6946, test_f1: 0.4922
 epoch: 30, train_loss: 0.6072, test_loss: 1.5392, test_f1: 0.5468
 epoch: 31, train_loss: 0.5927, test_loss: 1.4908, test_f1: 0.5386
 epoch: 32, train_loss: 0.5776, test_loss: 1.9406, test_f1: 0.4773
 epoch: 33, train_loss: 0.5684, test_loss: 1.5571, test_f1: 0.5382
 epoch: 34, train_loss: 0.5685, test_loss: 1.7034, test_f1: 0.5202
 epoch: 35, train_loss: 0.5814, test_loss: 1.4758, test_f1: 0.5406
 epoch: 36, train_loss: 0.5554, test_loss: 1.4875, test_f1: 0.5454
 epoch: 37, train_loss: 0.5460, test_loss: 1.5310, test_f1: 0.5379
 epoch: 38, train_loss: 0.5245, test_loss: 1.5875, test_f1: 0.5204
 epoch: 39, train_loss: 0.5180, test_loss: 1.7912, test_f1: 0.5376
 epoch: 40, train_loss: 0.5355, test_loss: 1.5071, test_f1: 0.5452
 epoch: 41, train_loss: 0.4983, test_loss: 1.8241, test_f1: 0.5251
 epoch: 42, train_loss: 0.4968, test_loss: 1.8552, test_f1: 0.5117
 epoch: 43, train_loss: 0.5000, test_loss: 1.7004, test_f1: 0.5380
 epoch: 44, train_loss: 0.5164, test_loss: 1.7256, test_f1: 0.5280
 epoch: 45, train_loss: 0.4983, test_loss: 1.7467, test_f1: 0.5584
 epoch: 46, train_loss: 0.4766, test_loss: 1.9298, test_f1: 0.5187
 epoch: 47, train_loss: 0.4656, test_loss: 1.7142, test_f1: 0.5328
 epoch: 48, train_loss: 0.4617, test_loss: 2.0480, test_f1: 0.5150
 epoch: 49, train_loss: 0.4454, test_loss: 1.7156, test_f1: 0.5440
 epoch: 50, train_loss: 0.4462, test_loss: 1.8621, test_f1: 0.5039
 epoch: 51, train_loss: 0.4038, test_loss: 1.9250, test_f1: 0.5493
 epoch: 52, train_loss: 0.3795, test_loss: 2.0111, test_f1: 0.5215
 epoch: 53, train_loss: 0.3586, test_loss: 2.0985, test_f1: 0.5470
 epoch: 54, train_loss: 0.3585, test_loss: 2.0496, test_f1: 0.5479
 epoch: 55, train_loss: 0.3342, test_loss: 2.2036, test_f1: 0.5304
 epoch: 56, train_loss: 0.3285, test_loss: 2.2940, test_f1: 0.5074
 epoch: 57, train_loss: 0.3467, test_loss: 2.1704, test_f1: 0.5279
 epoch: 58, train_loss: 0.3237, test_loss: 2.2731, test_f1: 0.5272
 epoch: 59, train_loss: 0.3226, test_loss: 2.2644, test_f1: 0.5238
 epoch: 60, train_loss: 0.3180, test_loss: 2.5477, test_f1: 0.5339
 epoch: 61, train_loss: 0.3064, test_loss: 2.4822, test_f1: 0.5210
 epoch: 62, train_loss: 0.2913, test_loss: 2.4216, test_f1: 0.5413
 epoch: 63, train_loss: 0.3023, test_loss: 2.7902, test_f1: 0.5365
 epoch: 64, train_loss: 0.2886, test_loss: 2.4335, test_f1: 0.5515
 epoch: 65, train_loss: 0.3014, test_loss: 2.4681, test_f1: 0.5287
 epoch: 66, train_loss: 0.2848, test_loss: 2.7417, test_f1: 0.5445
 epoch: 67, train_loss: 0.2900, test_loss: 2.8163, test_f1: 0.5306
 epoch: 68, train_loss: 0.2918, test_loss: 2.4463, test_f1: 0.5251
 epoch: 69, train_loss: 0.2900, test_loss: 2.9009, test_f1: 0.5105
 epoch: 70, train_loss: 0.2719, test_loss: 2.5395, test_f1: 0.5403
 epoch: 71, train_loss: 0.2788, test_loss: 2.5920, test_f1: 0.5280
 epoch: 72, train_loss: 0.2693, test_loss: 2.7310, test_f1: 0.5145
 epoch: 73, train_loss: 0.2719, test_loss: 2.7548, test_f1: 0.5431
 epoch: 74, train_loss: 0.2589, test_loss: 2.6124, test_f1: 0.5197
 epoch: 75, train_loss: 0.2773, test_loss: 2.8857, test_f1: 0.5143
 epoch: 76, train_loss: 0.2725, test_loss: 2.7503, test_f1: 0.5310
 epoch: 77, train_loss: 0.2620, test_loss: 2.7479, test_f1: 0.5364
 epoch: 78, train_loss: 0.2713, test_loss: 2.8360, test_f1: 0.5200
 epoch: 79, train_loss: 0.2668, test_loss: 2.7481, test_f1: 0.5260
 epoch: 80, train_loss: 0.2689, test_loss: 2.9831, test_f1: 0.5307
 epoch: 81, train_loss: 0.2660, test_loss: 2.7611, test_f1: 0.5226
 epoch: 82, train_loss: 0.2713, test_loss: 2.6413, test_f1: 0.5346
 epoch: 83, train_loss: 0.2500, test_loss: 2.6812, test_f1: 0.5394
 epoch: 84, train_loss: 0.2432, test_loss: 2.8675, test_f1: 0.5217
 epoch: 85, train_loss: 0.2532, test_loss: 2.8846, test_f1: 0.5392
 epoch: 86, train_loss: 0.2558, test_loss: 2.8528, test_f1: 0.5409
 epoch: 87, train_loss: 0.2360, test_loss: 2.8338, test_f1: 0.5152
 epoch: 88, train_loss: 0.2334, test_loss: 2.5928, test_f1: 0.5434
 epoch: 89, train_loss: 0.2193, test_loss: 2.9856, test_f1: 0.5290
 epoch: 90, train_loss: 0.2288, test_loss: 3.1621, test_f1: 0.5202
 epoch: 91, train_loss: 0.2177, test_loss: 2.9980, test_f1: 0.5451
 epoch: 92, train_loss: 0.2101, test_loss: 3.0218, test_f1: 0.5151
 epoch: 93, train_loss: 0.2145, test_loss: 2.8184, test_f1: 0.5282
 epoch: 94, train_loss: 0.2134, test_loss: 3.3352, test_f1: 0.5366
 epoch: 95, train_loss: 0.2211, test_loss: 3.1149, test_f1: 0.5325
 epoch: 96, train_loss: 0.2301, test_loss: 3.0487, test_f1: 0.5218
 epoch: 97, train_loss: 0.2283, test_loss: 3.2347, test_f1: 0.5216
 epoch: 98, train_loss: 0.2377, test_loss: 3.2207, test_f1: 0.5443
 epoch: 99, train_loss: 0.2208, test_loss: 3.3326, test_f1: 0.5179
##################ITERATION #3 ****************************************
 epoch: 0, train_loss: 1.3270, test_loss: 1.2578, test_f1: 0.3483
 epoch: 1, train_loss: 1.1586, test_loss: 1.2147, test_f1: 0.4146
 epoch: 2, train_loss: 1.1219, test_loss: 1.1640, test_f1: 0.3928
 epoch: 3, train_loss: 1.0687, test_loss: 1.0996, test_f1: 0.4313
 epoch: 4, train_loss: 1.0339, test_loss: 1.0612, test_f1: 0.4490
 epoch: 5, train_loss: 0.9923, test_loss: 1.0154, test_f1: 0.4720
 epoch: 6, train_loss: 0.9626, test_loss: 0.9970, test_f1: 0.4725
 epoch: 7, train_loss: 0.9404, test_loss: 1.0300, test_f1: 0.4841
 epoch: 8, train_loss: 0.9258, test_loss: 1.0592, test_f1: 0.4880
 epoch: 9, train_loss: 0.9098, test_loss: 1.0881, test_f1: 0.5083
 epoch: 10, train_loss: 0.8705, test_loss: 1.0686, test_f1: 0.4912
 epoch: 11, train_loss: 0.8276, test_loss: 1.0587, test_f1: 0.5111
 epoch: 12, train_loss: 0.8159, test_loss: 1.0627, test_f1: 0.4918
 epoch: 13, train_loss: 0.7963, test_loss: 1.1288, test_f1: 0.5006
 epoch: 14, train_loss: 0.7881, test_loss: 1.2022, test_f1: 0.4846
 epoch: 15, train_loss: 0.7462, test_loss: 1.2571, test_f1: 0.4940
 epoch: 16, train_loss: 0.7223, test_loss: 1.1277, test_f1: 0.5184
 epoch: 17, train_loss: 0.7133, test_loss: 1.2697, test_f1: 0.5259
 epoch: 18, train_loss: 0.7108, test_loss: 1.3114, test_f1: 0.5008
 epoch: 19, train_loss: 0.7033, test_loss: 1.3629, test_f1: 0.5203
 epoch: 20, train_loss: 0.7064, test_loss: 1.2452, test_f1: 0.5194
 epoch: 21, train_loss: 0.6732, test_loss: 1.2860, test_f1: 0.5592
 epoch: 22, train_loss: 0.6489, test_loss: 1.3578, test_f1: 0.4970
 epoch: 23, train_loss: 0.6522, test_loss: 1.3782, test_f1: 0.5293
 epoch: 24, train_loss: 0.6392, test_loss: 1.4343, test_f1: 0.5153
 epoch: 25, train_loss: 0.6245, test_loss: 1.4448, test_f1: 0.5135
 epoch: 26, train_loss: 0.6044, test_loss: 1.4136, test_f1: 0.5479
 epoch: 27, train_loss: 0.5974, test_loss: 1.3867, test_f1: 0.5535
 epoch: 28, train_loss: 0.5770, test_loss: 1.5881, test_f1: 0.5516
 epoch: 29, train_loss: 0.5750, test_loss: 1.4377, test_f1: 0.5338
 epoch: 30, train_loss: 0.5900, test_loss: 1.6912, test_f1: 0.5474
 epoch: 31, train_loss: 0.5540, test_loss: 1.4997, test_f1: 0.5669
 epoch: 32, train_loss: 0.5252, test_loss: 1.6750, test_f1: 0.5250
 epoch: 33, train_loss: 0.5317, test_loss: 1.4829, test_f1: 0.5621
 epoch: 34, train_loss: 0.5165, test_loss: 1.7766, test_f1: 0.5113
 epoch: 35, train_loss: 0.5054, test_loss: 1.6930, test_f1: 0.5471
 epoch: 36, train_loss: 0.5037, test_loss: 1.6837, test_f1: 0.5420
 epoch: 37, train_loss: 0.5152, test_loss: 1.6301, test_f1: 0.5113
 epoch: 38, train_loss: 0.5028, test_loss: 1.7328, test_f1: 0.5106
 epoch: 39, train_loss: 0.5125, test_loss: 1.6455, test_f1: 0.5595
 epoch: 40, train_loss: 0.5231, test_loss: 1.7049, test_f1: 0.5305
 epoch: 41, train_loss: 0.4651, test_loss: 1.6042, test_f1: 0.5309
 epoch: 42, train_loss: 0.4596, test_loss: 1.8661, test_f1: 0.5145
 epoch: 43, train_loss: 0.4386, test_loss: 2.0509, test_f1: 0.5227
 epoch: 44, train_loss: 0.4520, test_loss: 1.7789, test_f1: 0.5322
 epoch: 45, train_loss: 0.4316, test_loss: 1.5588, test_f1: 0.5387
 epoch: 46, train_loss: 0.4370, test_loss: 2.1609, test_f1: 0.5130
 epoch: 47, train_loss: 0.4305, test_loss: 1.8901, test_f1: 0.5369
 epoch: 48, train_loss: 0.4331, test_loss: 2.0279, test_f1: 0.5231
 epoch: 49, train_loss: 0.4134, test_loss: 2.0539, test_f1: 0.5423
 epoch: 50, train_loss: 0.4300, test_loss: 2.0347, test_f1: 0.5155
 epoch: 51, train_loss: 0.3841, test_loss: 2.2010, test_f1: 0.5207
 epoch: 52, train_loss: 0.3308, test_loss: 2.1521, test_f1: 0.5451
 epoch: 53, train_loss: 0.3106, test_loss: 2.1148, test_f1: 0.5344
 epoch: 54, train_loss: 0.3098, test_loss: 2.1419, test_f1: 0.5463
 epoch: 55, train_loss: 0.2953, test_loss: 2.3082, test_f1: 0.5127
 epoch: 56, train_loss: 0.2967, test_loss: 2.2903, test_f1: 0.5373
 epoch: 57, train_loss: 0.2915, test_loss: 2.3080, test_f1: 0.5447
 epoch: 58, train_loss: 0.3017, test_loss: 2.3735, test_f1: 0.5195
 epoch: 59, train_loss: 0.3022, test_loss: 2.3244, test_f1: 0.5360
 epoch: 60, train_loss: 0.2955, test_loss: 2.2759, test_f1: 0.5411
 epoch: 61, train_loss: 0.2853, test_loss: 2.4638, test_f1: 0.5241
 epoch: 62, train_loss: 0.2672, test_loss: 2.6051, test_f1: 0.5137
 epoch: 63, train_loss: 0.2651, test_loss: 2.5486, test_f1: 0.5372
 epoch: 64, train_loss: 0.2711, test_loss: 2.3959, test_f1: 0.5457
 epoch: 65, train_loss: 0.2637, test_loss: 2.5259, test_f1: 0.5317
 epoch: 66, train_loss: 0.2601, test_loss: 2.5785, test_f1: 0.5391
 epoch: 67, train_loss: 0.2509, test_loss: 2.5410, test_f1: 0.5399
 epoch: 68, train_loss: 0.2704, test_loss: 2.3951, test_f1: 0.5345
 epoch: 69, train_loss: 0.2459, test_loss: 2.6525, test_f1: 0.5382
 epoch: 70, train_loss: 0.2386, test_loss: 2.7099, test_f1: 0.5356
 epoch: 71, train_loss: 0.2404, test_loss: 2.4088, test_f1: 0.5316
 epoch: 72, train_loss: 0.2380, test_loss: 2.7301, test_f1: 0.5076
 epoch: 73, train_loss: 0.2464, test_loss: 2.8696, test_f1: 0.5373
 epoch: 74, train_loss: 0.2349, test_loss: 2.7987, test_f1: 0.5457
 epoch: 75, train_loss: 0.2484, test_loss: 2.6920, test_f1: 0.5412
 epoch: 76, train_loss: 0.2349, test_loss: 2.6941, test_f1: 0.5324
 epoch: 77, train_loss: 0.2290, test_loss: 2.8334, test_f1: 0.5122
 epoch: 78, train_loss: 0.2110, test_loss: 3.0084, test_f1: 0.5530
 epoch: 79, train_loss: 0.2243, test_loss: 2.8025, test_f1: 0.5148
 epoch: 80, train_loss: 0.2135, test_loss: 2.7762, test_f1: 0.5377
 epoch: 81, train_loss: 0.2415, test_loss: 2.9156, test_f1: 0.5237
 epoch: 82, train_loss: 0.2153, test_loss: 2.9608, test_f1: 0.5207
 epoch: 83, train_loss: 0.2143, test_loss: 2.7529, test_f1: 0.5246
 epoch: 84, train_loss: 0.2126, test_loss: 2.8918, test_f1: 0.5237
 epoch: 85, train_loss: 0.1986, test_loss: 2.9382, test_f1: 0.5341
 epoch: 86, train_loss: 0.2009, test_loss: 3.0208, test_f1: 0.5197
 epoch: 87, train_loss: 0.2110, test_loss: 2.8477, test_f1: 0.5344
 epoch: 88, train_loss: 0.2126, test_loss: 3.1376, test_f1: 0.5283
 epoch: 89, train_loss: 0.1980, test_loss: 2.9527, test_f1: 0.5348
 epoch: 90, train_loss: 0.1982, test_loss: 2.8853, test_f1: 0.5331
 epoch: 91, train_loss: 0.2076, test_loss: 3.1096, test_f1: 0.5226
 epoch: 92, train_loss: 0.1920, test_loss: 2.8610, test_f1: 0.5330
 epoch: 93, train_loss: 0.1706, test_loss: 2.9335, test_f1: 0.5173
 epoch: 94, train_loss: 0.1850, test_loss: 3.0871, test_f1: 0.5261
 epoch: 95, train_loss: 0.1874, test_loss: 3.1626, test_f1: 0.5397
 epoch: 96, train_loss: 0.1871, test_loss: 3.1965, test_f1: 0.5279
 epoch: 97, train_loss: 0.1847, test_loss: 3.1545, test_f1: 0.5305
 epoch: 98, train_loss: 0.2015, test_loss: 3.2533, test_f1: 0.5067
 epoch: 99, train_loss: 0.1749, test_loss: 3.1939, test_f1: 0.5241
##################ITERATION #4 ****************************************
 epoch: 0, train_loss: 1.3287, test_loss: 1.3745, test_f1: 0.3625
 epoch: 1, train_loss: 1.1932, test_loss: 1.2085, test_f1: 0.4872
 epoch: 2, train_loss: 1.1233, test_loss: 1.0863, test_f1: 0.4534
 epoch: 3, train_loss: 1.0683, test_loss: 1.0381, test_f1: 0.5021
 epoch: 4, train_loss: 1.0289, test_loss: 0.9949, test_f1: 0.5251
 epoch: 5, train_loss: 0.9951, test_loss: 1.0304, test_f1: 0.4700
 epoch: 6, train_loss: 0.9713, test_loss: 1.0006, test_f1: 0.5134
 epoch: 7, train_loss: 0.9390, test_loss: 1.0478, test_f1: 0.4803
 epoch: 8, train_loss: 0.9106, test_loss: 0.9930, test_f1: 0.5281
 epoch: 9, train_loss: 0.8853, test_loss: 1.0879, test_f1: 0.4648
 epoch: 10, train_loss: 0.8627, test_loss: 0.9909, test_f1: 0.5255
 epoch: 11, train_loss: 0.8442, test_loss: 1.0257, test_f1: 0.5225
 epoch: 12, train_loss: 0.8462, test_loss: 1.1100, test_f1: 0.4878
 epoch: 13, train_loss: 0.8094, test_loss: 1.0612, test_f1: 0.5463
 epoch: 14, train_loss: 0.8009, test_loss: 1.1047, test_f1: 0.4974
 epoch: 15, train_loss: 0.7691, test_loss: 1.0545, test_f1: 0.5251
 epoch: 16, train_loss: 0.7635, test_loss: 1.2439, test_f1: 0.5293
 epoch: 17, train_loss: 0.7354, test_loss: 1.1790, test_f1: 0.5134
 epoch: 18, train_loss: 0.7410, test_loss: 1.0854, test_f1: 0.5490
 epoch: 19, train_loss: 0.7174, test_loss: 1.2390, test_f1: 0.5323
 epoch: 20, train_loss: 0.6821, test_loss: 1.2196, test_f1: 0.5185
 epoch: 21, train_loss: 0.6981, test_loss: 1.3125, test_f1: 0.5003
 epoch: 22, train_loss: 0.6715, test_loss: 1.3158, test_f1: 0.5097
 epoch: 23, train_loss: 0.6760, test_loss: 1.2360, test_f1: 0.5461
 epoch: 24, train_loss: 0.6642, test_loss: 1.2168, test_f1: 0.5599
 epoch: 25, train_loss: 0.6263, test_loss: 1.2310, test_f1: 0.5747
 epoch: 26, train_loss: 0.6498, test_loss: 1.3952, test_f1: 0.5269
 epoch: 27, train_loss: 0.6492, test_loss: 1.2383, test_f1: 0.5480
 epoch: 28, train_loss: 0.6110, test_loss: 1.2846, test_f1: 0.5747
 epoch: 29, train_loss: 0.5948, test_loss: 1.3543, test_f1: 0.5579
 epoch: 30, train_loss: 0.5838, test_loss: 1.3807, test_f1: 0.5449
 epoch: 31, train_loss: 0.5875, test_loss: 1.3696, test_f1: 0.5250
 epoch: 32, train_loss: 0.5966, test_loss: 1.2843, test_f1: 0.5524
 epoch: 33, train_loss: 0.5620, test_loss: 1.4202, test_f1: 0.5213
 epoch: 34, train_loss: 0.5630, test_loss: 1.4195, test_f1: 0.5147
 epoch: 35, train_loss: 0.5609, test_loss: 1.4525, test_f1: 0.5580
 epoch: 36, train_loss: 0.5447, test_loss: 1.4120, test_f1: 0.5613
 epoch: 37, train_loss: 0.5143, test_loss: 1.5463, test_f1: 0.5552
 epoch: 38, train_loss: 0.5258, test_loss: 1.6140, test_f1: 0.5248
 epoch: 39, train_loss: 0.5276, test_loss: 1.5852, test_f1: 0.5451
 epoch: 40, train_loss: 0.5082, test_loss: 1.4525, test_f1: 0.5445
 epoch: 41, train_loss: 0.4860, test_loss: 1.5025, test_f1: 0.5642
 epoch: 42, train_loss: 0.5026, test_loss: 1.6349, test_f1: 0.5089
 epoch: 43, train_loss: 0.4921, test_loss: 1.5772, test_f1: 0.5332
 epoch: 44, train_loss: 0.5175, test_loss: 1.5509, test_f1: 0.5554
 epoch: 45, train_loss: 0.4852, test_loss: 1.5802, test_f1: 0.5013
 epoch: 46, train_loss: 0.4714, test_loss: 1.4848, test_f1: 0.5630
 epoch: 47, train_loss: 0.4608, test_loss: 1.8702, test_f1: 0.5464
 epoch: 48, train_loss: 0.4440, test_loss: 1.5385, test_f1: 0.5544
 epoch: 49, train_loss: 0.4501, test_loss: 1.5706, test_f1: 0.5603
 epoch: 50, train_loss: 0.4416, test_loss: 1.6700, test_f1: 0.5039
 epoch: 51, train_loss: 0.4126, test_loss: 1.8009, test_f1: 0.5198
 epoch: 52, train_loss: 0.3706, test_loss: 1.6172, test_f1: 0.5528
 epoch: 53, train_loss: 0.3460, test_loss: 1.9051, test_f1: 0.5390
 epoch: 54, train_loss: 0.3501, test_loss: 1.7502, test_f1: 0.5567
 epoch: 55, train_loss: 0.3270, test_loss: 1.8283, test_f1: 0.5572
 epoch: 56, train_loss: 0.3440, test_loss: 1.9090, test_f1: 0.5315
 epoch: 57, train_loss: 0.3295, test_loss: 1.7907, test_f1: 0.5559
 epoch: 58, train_loss: 0.3294, test_loss: 2.0382, test_f1: 0.5485
 epoch: 59, train_loss: 0.3286, test_loss: 1.7987, test_f1: 0.5585
 epoch: 60, train_loss: 0.3193, test_loss: 2.1067, test_f1: 0.5472
 epoch: 61, train_loss: 0.3153, test_loss: 2.0196, test_f1: 0.5479
 epoch: 62, train_loss: 0.3134, test_loss: 2.0174, test_f1: 0.5422
 epoch: 63, train_loss: 0.3211, test_loss: 2.0235, test_f1: 0.5235
 epoch: 64, train_loss: 0.3079, test_loss: 2.0080, test_f1: 0.5619
 epoch: 65, train_loss: 0.2982, test_loss: 2.1291, test_f1: 0.5534
 epoch: 66, train_loss: 0.2996, test_loss: 1.9596, test_f1: 0.5374
 epoch: 67, train_loss: 0.2848, test_loss: 2.0495, test_f1: 0.5447
 epoch: 68, train_loss: 0.2918, test_loss: 2.2866, test_f1: 0.5374
 epoch: 69, train_loss: 0.2938, test_loss: 2.1536, test_f1: 0.5359
 epoch: 70, train_loss: 0.2674, test_loss: 2.2029, test_f1: 0.5228
 epoch: 71, train_loss: 0.2821, test_loss: 2.1065, test_f1: 0.5398
 epoch: 72, train_loss: 0.2860, test_loss: 2.2342, test_f1: 0.5570
 epoch: 73, train_loss: 0.2744, test_loss: 2.1129, test_f1: 0.5515
 epoch: 74, train_loss: 0.2673, test_loss: 2.2301, test_f1: 0.5438
 epoch: 75, train_loss: 0.2671, test_loss: 2.1571, test_f1: 0.5370
 epoch: 76, train_loss: 0.2620, test_loss: 2.2294, test_f1: 0.5492
 epoch: 77, train_loss: 0.3140, test_loss: 2.3777, test_f1: 0.5265
 epoch: 78, train_loss: 0.2728, test_loss: 2.3199, test_f1: 0.5366
 epoch: 79, train_loss: 0.2611, test_loss: 2.2122, test_f1: 0.5403
 epoch: 80, train_loss: 0.2719, test_loss: 2.3803, test_f1: 0.5360
 epoch: 81, train_loss: 0.2578, test_loss: 2.1785, test_f1: 0.5424
 epoch: 82, train_loss: 0.2486, test_loss: 2.3768, test_f1: 0.5495
 epoch: 83, train_loss: 0.2347, test_loss: 2.4648, test_f1: 0.5222
 epoch: 84, train_loss: 0.2188, test_loss: 2.4963, test_f1: 0.5493
 epoch: 85, train_loss: 0.2169, test_loss: 2.6499, test_f1: 0.5328
 epoch: 86, train_loss: 0.2229, test_loss: 2.5649, test_f1: 0.5281
 epoch: 87, train_loss: 0.2557, test_loss: 2.5854, test_f1: 0.5393
 epoch: 88, train_loss: 0.2417, test_loss: 2.7325, test_f1: 0.5194
 epoch: 89, train_loss: 0.2233, test_loss: 2.5965, test_f1: 0.5275
 epoch: 90, train_loss: 0.2198, test_loss: 2.7153, test_f1: 0.5092
 epoch: 91, train_loss: 0.2268, test_loss: 2.6258, test_f1: 0.5478
 epoch: 92, train_loss: 0.2182, test_loss: 2.4567, test_f1: 0.5527
 epoch: 93, train_loss: 0.2045, test_loss: 2.7702, test_f1: 0.5477
 epoch: 94, train_loss: 0.2220, test_loss: 2.7227, test_f1: 0.5234
 epoch: 95, train_loss: 0.2185, test_loss: 2.7167, test_f1: 0.5419
 epoch: 96, train_loss: 0.2134, test_loss: 2.4978, test_f1: 0.5389
 epoch: 97, train_loss: 0.2099, test_loss: 2.6182, test_f1: 0.5268
 epoch: 98, train_loss: 0.2109, test_loss: 2.8289, test_f1: 0.5145
 epoch: 99, train_loss: 0.2202, test_loss: 2.9434, test_f1: 0.5198
##################ITERATION #5 ****************************************
 epoch: 0, train_loss: 1.3995, test_loss: 1.3763, test_f1: 0.3490
 epoch: 1, train_loss: 1.2018, test_loss: 1.2097, test_f1: 0.4279
 epoch: 2, train_loss: 1.1419, test_loss: 1.1318, test_f1: 0.4216
 epoch: 3, train_loss: 1.0856, test_loss: 1.0711, test_f1: 0.4542
 epoch: 4, train_loss: 1.0361, test_loss: 0.9904, test_f1: 0.5157
 epoch: 5, train_loss: 0.9985, test_loss: 0.9747, test_f1: 0.5185
 epoch: 6, train_loss: 0.9747, test_loss: 1.0022, test_f1: 0.4968
 epoch: 7, train_loss: 0.9523, test_loss: 1.0056, test_f1: 0.5001
 epoch: 8, train_loss: 0.9073, test_loss: 0.9544, test_f1: 0.5398
 epoch: 9, train_loss: 0.8837, test_loss: 1.1236, test_f1: 0.4589
 epoch: 10, train_loss: 0.8834, test_loss: 1.0402, test_f1: 0.5056
 epoch: 11, train_loss: 0.8682, test_loss: 1.0077, test_f1: 0.5031
 epoch: 12, train_loss: 0.8212, test_loss: 0.9650, test_f1: 0.5261
 epoch: 13, train_loss: 0.8131, test_loss: 1.1021, test_f1: 0.4743
 epoch: 14, train_loss: 0.7954, test_loss: 1.0184, test_f1: 0.5309
 epoch: 15, train_loss: 0.7646, test_loss: 1.0144, test_f1: 0.5277
 epoch: 16, train_loss: 0.7494, test_loss: 0.9995, test_f1: 0.5324
 epoch: 17, train_loss: 0.7469, test_loss: 1.0795, test_f1: 0.5308
 epoch: 18, train_loss: 0.7360, test_loss: 1.1399, test_f1: 0.5350
 epoch: 19, train_loss: 0.7129, test_loss: 1.2173, test_f1: 0.4842
 epoch: 20, train_loss: 0.7152, test_loss: 1.2907, test_f1: 0.5020
 epoch: 21, train_loss: 0.7203, test_loss: 1.2107, test_f1: 0.5254
 epoch: 22, train_loss: 0.7079, test_loss: 1.1564, test_f1: 0.4909
 epoch: 23, train_loss: 0.6663, test_loss: 1.2165, test_f1: 0.5185
 epoch: 24, train_loss: 0.6536, test_loss: 1.1918, test_f1: 0.5222
 epoch: 25, train_loss: 0.6506, test_loss: 1.2638, test_f1: 0.5295
 epoch: 26, train_loss: 0.6497, test_loss: 1.2869, test_f1: 0.5533
 epoch: 27, train_loss: 0.6338, test_loss: 1.3640, test_f1: 0.4985
 epoch: 28, train_loss: 0.6157, test_loss: 1.3603, test_f1: 0.4939
 epoch: 29, train_loss: 0.6517, test_loss: 1.4152, test_f1: 0.4948
 epoch: 30, train_loss: 0.6172, test_loss: 1.4704, test_f1: 0.5077
 epoch: 31, train_loss: 0.5997, test_loss: 1.2828, test_f1: 0.5210
 epoch: 32, train_loss: 0.5811, test_loss: 1.4797, test_f1: 0.5245
 epoch: 33, train_loss: 0.5808, test_loss: 1.2613, test_f1: 0.5296
 epoch: 34, train_loss: 0.5526, test_loss: 1.3939, test_f1: 0.5451
 epoch: 35, train_loss: 0.5448, test_loss: 1.3778, test_f1: 0.5319
 epoch: 36, train_loss: 0.5661, test_loss: 1.5721, test_f1: 0.5171
 epoch: 37, train_loss: 0.5768, test_loss: 1.3763, test_f1: 0.5315
 epoch: 38, train_loss: 0.5530, test_loss: 1.5938, test_f1: 0.5081
 epoch: 39, train_loss: 0.5315, test_loss: 1.4595, test_f1: 0.5246
 epoch: 40, train_loss: 0.4984, test_loss: 1.6016, test_f1: 0.5118
 epoch: 41, train_loss: 0.5222, test_loss: 1.6570, test_f1: 0.5069
 epoch: 42, train_loss: 0.5169, test_loss: 1.5378, test_f1: 0.5485
 epoch: 43, train_loss: 0.5046, test_loss: 1.5329, test_f1: 0.5233
 epoch: 44, train_loss: 0.5038, test_loss: 1.5928, test_f1: 0.5259
 epoch: 45, train_loss: 0.4810, test_loss: 1.5846, test_f1: 0.5262
 epoch: 46, train_loss: 0.4897, test_loss: 1.5168, test_f1: 0.5080
 epoch: 47, train_loss: 0.4797, test_loss: 1.6351, test_f1: 0.5471
 epoch: 48, train_loss: 0.4609, test_loss: 1.6385, test_f1: 0.5301
 epoch: 49, train_loss: 0.4575, test_loss: 1.5898, test_f1: 0.5276
 epoch: 50, train_loss: 0.4362, test_loss: 1.7250, test_f1: 0.5079
 epoch: 51, train_loss: 0.3797, test_loss: 1.7342, test_f1: 0.5368
 epoch: 52, train_loss: 0.3615, test_loss: 1.8574, test_f1: 0.5070
 epoch: 53, train_loss: 0.3596, test_loss: 1.8358, test_f1: 0.5403
 epoch: 54, train_loss: 0.3436, test_loss: 1.8992, test_f1: 0.5351
 epoch: 55, train_loss: 0.3469, test_loss: 1.9879, test_f1: 0.5285
 epoch: 56, train_loss: 0.3292, test_loss: 2.0289, test_f1: 0.5228
 epoch: 57, train_loss: 0.3442, test_loss: 1.9739, test_f1: 0.5097
 epoch: 58, train_loss: 0.3236, test_loss: 1.9767, test_f1: 0.5134
 epoch: 59, train_loss: 0.3383, test_loss: 2.0249, test_f1: 0.5223
 epoch: 60, train_loss: 0.3202, test_loss: 2.2014, test_f1: 0.5226
 epoch: 61, train_loss: 0.3290, test_loss: 2.0710, test_f1: 0.5160
 epoch: 62, train_loss: 0.3151, test_loss: 2.1919, test_f1: 0.5048
 epoch: 63, train_loss: 0.3335, test_loss: 2.1173, test_f1: 0.5303
 epoch: 64, train_loss: 0.3170, test_loss: 2.1423, test_f1: 0.5193
 epoch: 65, train_loss: 0.2902, test_loss: 2.1225, test_f1: 0.5162
 epoch: 66, train_loss: 0.2850, test_loss: 2.1134, test_f1: 0.5344
 epoch: 67, train_loss: 0.2740, test_loss: 2.2453, test_f1: 0.5355
 epoch: 68, train_loss: 0.2928, test_loss: 2.3371, test_f1: 0.5331
 epoch: 69, train_loss: 0.2797, test_loss: 2.1759, test_f1: 0.5174
 epoch: 70, train_loss: 0.2824, test_loss: 2.4912, test_f1: 0.5035
 epoch: 71, train_loss: 0.2810, test_loss: 2.4499, test_f1: 0.5151
 epoch: 72, train_loss: 0.2751, test_loss: 2.2799, test_f1: 0.5208
 epoch: 73, train_loss: 0.2734, test_loss: 2.5086, test_f1: 0.5190
 epoch: 74, train_loss: 0.2706, test_loss: 2.3392, test_f1: 0.5323
 epoch: 75, train_loss: 0.2648, test_loss: 2.2919, test_f1: 0.5393
 epoch: 76, train_loss: 0.2576, test_loss: 2.5086, test_f1: 0.5002
 epoch: 77, train_loss: 0.2447, test_loss: 2.3860, test_f1: 0.5065
 epoch: 78, train_loss: 0.2541, test_loss: 2.5258, test_f1: 0.5284
 epoch: 79, train_loss: 0.2730, test_loss: 2.6526, test_f1: 0.4881
 epoch: 80, train_loss: 0.2738, test_loss: 2.3698, test_f1: 0.5473
 epoch: 81, train_loss: 0.2663, test_loss: 2.4766, test_f1: 0.4968
 epoch: 82, train_loss: 0.2418, test_loss: 2.5826, test_f1: 0.5189
 epoch: 83, train_loss: 0.2442, test_loss: 2.4940, test_f1: 0.5042
 epoch: 84, train_loss: 0.2442, test_loss: 2.5735, test_f1: 0.5288
 epoch: 85, train_loss: 0.2381, test_loss: 2.7051, test_f1: 0.5056
 epoch: 86, train_loss: 0.2528, test_loss: 2.7152, test_f1: 0.4896
 epoch: 87, train_loss: 0.2464, test_loss: 2.7620, test_f1: 0.5097
 epoch: 88, train_loss: 0.2373, test_loss: 2.7495, test_f1: 0.5211
 epoch: 89, train_loss: 0.2408, test_loss: 2.7574, test_f1: 0.5233
 epoch: 90, train_loss: 0.2246, test_loss: 2.6338, test_f1: 0.5308
 epoch: 91, train_loss: 0.2243, test_loss: 2.7211, test_f1: 0.5311
 epoch: 92, train_loss: 0.2105, test_loss: 2.6265, test_f1: 0.5076
 epoch: 93, train_loss: 0.2273, test_loss: 2.6314, test_f1: 0.5415
 epoch: 94, train_loss: 0.2368, test_loss: 2.6673, test_f1: 0.5405
 epoch: 95, train_loss: 0.2212, test_loss: 2.7358, test_f1: 0.5129
 epoch: 96, train_loss: 0.2375, test_loss: 2.9901, test_f1: 0.5041
 epoch: 97, train_loss: 0.2182, test_loss: 2.9702, test_f1: 0.5029
 epoch: 98, train_loss: 0.2155, test_loss: 2.8921, test_f1: 0.5210
 epoch: 99, train_loss: 0.2100, test_loss: 2.7045, test_f1: 0.5308
##################ITERATION #6 ****************************************
 epoch: 0, train_loss: 1.5476, test_loss: 1.2492, test_f1: 0.3625
 epoch: 1, train_loss: 1.2488, test_loss: 1.1733, test_f1: 0.4285
 epoch: 2, train_loss: 1.1343, test_loss: 1.0950, test_f1: 0.4586
 epoch: 3, train_loss: 1.0676, test_loss: 1.0231, test_f1: 0.4806
 epoch: 4, train_loss: 1.0314, test_loss: 1.0334, test_f1: 0.4610
 epoch: 5, train_loss: 0.9835, test_loss: 1.0275, test_f1: 0.4859
 epoch: 6, train_loss: 0.9639, test_loss: 0.9921, test_f1: 0.5147
 epoch: 7, train_loss: 0.9182, test_loss: 0.9931, test_f1: 0.5087
 epoch: 8, train_loss: 0.9050, test_loss: 1.0393, test_f1: 0.5020
 epoch: 9, train_loss: 0.8829, test_loss: 1.0220, test_f1: 0.4969
 epoch: 10, train_loss: 0.8641, test_loss: 1.0032, test_f1: 0.4857
 epoch: 11, train_loss: 0.8505, test_loss: 1.0476, test_f1: 0.4787
 epoch: 12, train_loss: 0.8282, test_loss: 0.9921, test_f1: 0.5192
 epoch: 13, train_loss: 0.8095, test_loss: 1.0394, test_f1: 0.5054
 epoch: 14, train_loss: 0.7773, test_loss: 1.0497, test_f1: 0.4949
 epoch: 15, train_loss: 0.7604, test_loss: 1.0743, test_f1: 0.5199
 epoch: 16, train_loss: 0.7460, test_loss: 1.1047, test_f1: 0.5046
 epoch: 17, train_loss: 0.7365, test_loss: 1.1114, test_f1: 0.5336
 epoch: 18, train_loss: 0.7289, test_loss: 1.0465, test_f1: 0.5585
 epoch: 19, train_loss: 0.7092, test_loss: 1.1297, test_f1: 0.5148
 epoch: 20, train_loss: 0.6957, test_loss: 1.0729, test_f1: 0.5228
 epoch: 21, train_loss: 0.6630, test_loss: 1.1167, test_f1: 0.5260
 epoch: 22, train_loss: 0.6688, test_loss: 1.2887, test_f1: 0.5517
 epoch: 23, train_loss: 0.6769, test_loss: 1.1144, test_f1: 0.5400
 epoch: 24, train_loss: 0.6517, test_loss: 1.1225, test_f1: 0.5414
 epoch: 25, train_loss: 0.6524, test_loss: 1.1381, test_f1: 0.5337
 epoch: 26, train_loss: 0.6269, test_loss: 1.1998, test_f1: 0.5391
 epoch: 27, train_loss: 0.6288, test_loss: 1.3404, test_f1: 0.5001
 epoch: 28, train_loss: 0.6101, test_loss: 1.2676, test_f1: 0.5504
 epoch: 29, train_loss: 0.6056, test_loss: 1.2955, test_f1: 0.5516
 epoch: 30, train_loss: 0.6018, test_loss: 1.3482, test_f1: 0.5346
 epoch: 31, train_loss: 0.5759, test_loss: 1.1578, test_f1: 0.5463
 epoch: 32, train_loss: 0.5591, test_loss: 1.3048, test_f1: 0.5321
 epoch: 33, train_loss: 0.5627, test_loss: 1.3558, test_f1: 0.5231
 epoch: 34, train_loss: 0.5457, test_loss: 1.3840, test_f1: 0.5307
 epoch: 35, train_loss: 0.5383, test_loss: 1.5542, test_f1: 0.5140
 epoch: 36, train_loss: 0.5518, test_loss: 1.4250, test_f1: 0.5299
 epoch: 37, train_loss: 0.5669, test_loss: 1.2881, test_f1: 0.5425
 epoch: 38, train_loss: 0.5203, test_loss: 1.4849, test_f1: 0.5237
 epoch: 39, train_loss: 0.4905, test_loss: 1.5074, test_f1: 0.5367
 epoch: 40, train_loss: 0.4960, test_loss: 1.6113, test_f1: 0.5573
 epoch: 41, train_loss: 0.4935, test_loss: 1.5093, test_f1: 0.5093
 epoch: 42, train_loss: 0.4928, test_loss: 1.5044, test_f1: 0.5348
 epoch: 43, train_loss: 0.4838, test_loss: 1.6509, test_f1: 0.5025
 epoch: 44, train_loss: 0.5052, test_loss: 1.5566, test_f1: 0.5274
 epoch: 45, train_loss: 0.4737, test_loss: 1.7127, test_f1: 0.5281
 epoch: 46, train_loss: 0.4639, test_loss: 1.5609, test_f1: 0.5241
 epoch: 47, train_loss: 0.4586, test_loss: 1.5964, test_f1: 0.5641
 epoch: 48, train_loss: 0.4663, test_loss: 1.8221, test_f1: 0.5160
 epoch: 49, train_loss: 0.4330, test_loss: 1.5662, test_f1: 0.5526
 epoch: 50, train_loss: 0.4415, test_loss: 1.8008, test_f1: 0.5257
 epoch: 51, train_loss: 0.3887, test_loss: 1.6035, test_f1: 0.5803
 epoch: 52, train_loss: 0.3504, test_loss: 1.8479, test_f1: 0.5601
 epoch: 53, train_loss: 0.3303, test_loss: 1.8110, test_f1: 0.5353
 epoch: 54, train_loss: 0.3508, test_loss: 1.8064, test_f1: 0.5367
 epoch: 55, train_loss: 0.3451, test_loss: 1.6690, test_f1: 0.5615
 epoch: 56, train_loss: 0.3293, test_loss: 1.8756, test_f1: 0.5439
 epoch: 57, train_loss: 0.3111, test_loss: 2.1503, test_f1: 0.5455
 epoch: 58, train_loss: 0.3055, test_loss: 1.8749, test_f1: 0.5430
 epoch: 59, train_loss: 0.2949, test_loss: 2.0281, test_f1: 0.5397
 epoch: 60, train_loss: 0.2861, test_loss: 2.0816, test_f1: 0.5448
 epoch: 61, train_loss: 0.2872, test_loss: 2.0749, test_f1: 0.5381
 epoch: 62, train_loss: 0.2935, test_loss: 1.9095, test_f1: 0.5541
 epoch: 63, train_loss: 0.2957, test_loss: 2.1895, test_f1: 0.5331
 epoch: 64, train_loss: 0.2809, test_loss: 2.2585, test_f1: 0.5200
 epoch: 65, train_loss: 0.2844, test_loss: 2.2819, test_f1: 0.5302
 epoch: 66, train_loss: 0.2948, test_loss: 2.1227, test_f1: 0.5164
 epoch: 67, train_loss: 0.3093, test_loss: 1.9068, test_f1: 0.5583
 epoch: 68, train_loss: 0.2766, test_loss: 2.2357, test_f1: 0.5274
 epoch: 69, train_loss: 0.2869, test_loss: 1.9478, test_f1: 0.5536
 epoch: 70, train_loss: 0.2590, test_loss: 2.3203, test_f1: 0.5268
 epoch: 71, train_loss: 0.2655, test_loss: 2.2122, test_f1: 0.5351
 epoch: 72, train_loss: 0.2673, test_loss: 2.1427, test_f1: 0.5566
 epoch: 73, train_loss: 0.2736, test_loss: 2.4769, test_f1: 0.5242
 epoch: 74, train_loss: 0.2893, test_loss: 2.1270, test_f1: 0.5456
 epoch: 75, train_loss: 0.2479, test_loss: 2.1293, test_f1: 0.5420
 epoch: 76, train_loss: 0.2497, test_loss: 2.3490, test_f1: 0.5272
 epoch: 77, train_loss: 0.2342, test_loss: 2.4468, test_f1: 0.5327
 epoch: 78, train_loss: 0.2490, test_loss: 2.5563, test_f1: 0.5433
 epoch: 79, train_loss: 0.2617, test_loss: 2.3234, test_f1: 0.5238
 epoch: 80, train_loss: 0.2385, test_loss: 2.3966, test_f1: 0.5296
 epoch: 81, train_loss: 0.2603, test_loss: 2.5513, test_f1: 0.5469
 epoch: 82, train_loss: 0.2294, test_loss: 2.3414, test_f1: 0.5356
 epoch: 83, train_loss: 0.2270, test_loss: 2.2151, test_f1: 0.5461
 epoch: 84, train_loss: 0.2289, test_loss: 2.3506, test_f1: 0.5500
 epoch: 85, train_loss: 0.2325, test_loss: 2.5491, test_f1: 0.5359
 epoch: 86, train_loss: 0.2152, test_loss: 2.4224, test_f1: 0.5312
 epoch: 87, train_loss: 0.2210, test_loss: 2.2528, test_f1: 0.5464
 epoch: 88, train_loss: 0.2085, test_loss: 2.7386, test_f1: 0.5393
 epoch: 89, train_loss: 0.1910, test_loss: 2.5736, test_f1: 0.5339
 epoch: 90, train_loss: 0.1955, test_loss: 2.4282, test_f1: 0.5443
 epoch: 91, train_loss: 0.2031, test_loss: 2.6566, test_f1: 0.5371
 epoch: 92, train_loss: 0.2229, test_loss: 2.3542, test_f1: 0.5443
 epoch: 93, train_loss: 0.2255, test_loss: 2.4788, test_f1: 0.5167
 epoch: 94, train_loss: 0.2252, test_loss: 2.4378, test_f1: 0.5613
 epoch: 95, train_loss: 0.2347, test_loss: 2.3773, test_f1: 0.5495
 epoch: 96, train_loss: 0.2196, test_loss: 2.6347, test_f1: 0.5258
 epoch: 97, train_loss: 0.2048, test_loss: 2.4806, test_f1: 0.5701
 epoch: 98, train_loss: 0.2094, test_loss: 2.5466, test_f1: 0.5376
 epoch: 99, train_loss: 0.2012, test_loss: 2.2869, test_f1: 0.5598
##################ITERATION #7 ****************************************
 epoch: 0, train_loss: 1.4543, test_loss: 1.2467, test_f1: 0.3189
 epoch: 1, train_loss: 1.1746, test_loss: 1.2361, test_f1: 0.3312
 epoch: 2, train_loss: 1.0941, test_loss: 1.1285, test_f1: 0.4152
 epoch: 3, train_loss: 1.0373, test_loss: 1.0726, test_f1: 0.4355
 epoch: 4, train_loss: 0.9816, test_loss: 0.9922, test_f1: 0.4726
 epoch: 5, train_loss: 0.9618, test_loss: 0.9561, test_f1: 0.4921
 epoch: 6, train_loss: 0.9283, test_loss: 0.9516, test_f1: 0.5321
 epoch: 7, train_loss: 0.8976, test_loss: 0.9626, test_f1: 0.4998
 epoch: 8, train_loss: 0.8902, test_loss: 0.9446, test_f1: 0.5082
 epoch: 9, train_loss: 0.8723, test_loss: 0.9726, test_f1: 0.5414
 epoch: 10, train_loss: 0.8401, test_loss: 1.0462, test_f1: 0.5010
 epoch: 11, train_loss: 0.8233, test_loss: 1.0621, test_f1: 0.4892
 epoch: 12, train_loss: 0.8074, test_loss: 1.1152, test_f1: 0.5054
 epoch: 13, train_loss: 0.7778, test_loss: 1.0226, test_f1: 0.5381
 epoch: 14, train_loss: 0.7627, test_loss: 1.0663, test_f1: 0.5045
 epoch: 15, train_loss: 0.7437, test_loss: 1.1799, test_f1: 0.5007
 epoch: 16, train_loss: 0.7409, test_loss: 1.1701, test_f1: 0.5015
 epoch: 17, train_loss: 0.7392, test_loss: 1.4257, test_f1: 0.4640
 epoch: 18, train_loss: 0.7021, test_loss: 1.1325, test_f1: 0.5128
 epoch: 19, train_loss: 0.6983, test_loss: 1.2076, test_f1: 0.4982
 epoch: 20, train_loss: 0.6704, test_loss: 1.2644, test_f1: 0.5137
 epoch: 21, train_loss: 0.6668, test_loss: 1.1655, test_f1: 0.4959
 epoch: 22, train_loss: 0.6683, test_loss: 1.2990, test_f1: 0.5335
 epoch: 23, train_loss: 0.6296, test_loss: 1.4657, test_f1: 0.5187
 epoch: 24, train_loss: 0.6206, test_loss: 1.4522, test_f1: 0.5189
 epoch: 25, train_loss: 0.5933, test_loss: 1.3552, test_f1: 0.5187
 epoch: 26, train_loss: 0.5985, test_loss: 1.3155, test_f1: 0.5605
 epoch: 27, train_loss: 0.6025, test_loss: 1.5528, test_f1: 0.4917
 epoch: 28, train_loss: 0.6033, test_loss: 1.3912, test_f1: 0.5258
 epoch: 29, train_loss: 0.5785, test_loss: 1.4215, test_f1: 0.5191
 epoch: 30, train_loss: 0.5558, test_loss: 1.4935, test_f1: 0.5208
 epoch: 31, train_loss: 0.5629, test_loss: 1.4064, test_f1: 0.5235
 epoch: 32, train_loss: 0.5340, test_loss: 1.6488, test_f1: 0.5380
 epoch: 33, train_loss: 0.5095, test_loss: 1.8071, test_f1: 0.4827
 epoch: 34, train_loss: 0.5331, test_loss: 1.3798, test_f1: 0.5561
 epoch: 35, train_loss: 0.5089, test_loss: 1.6512, test_f1: 0.5280
 epoch: 36, train_loss: 0.4976, test_loss: 1.5387, test_f1: 0.5375
 epoch: 37, train_loss: 0.4885, test_loss: 1.8504, test_f1: 0.5144
 epoch: 38, train_loss: 0.5034, test_loss: 1.5411, test_f1: 0.5416
 epoch: 39, train_loss: 0.4793, test_loss: 1.7247, test_f1: 0.5583
 epoch: 40, train_loss: 0.4677, test_loss: 1.7841, test_f1: 0.5266
 epoch: 41, train_loss: 0.4511, test_loss: 1.9718, test_f1: 0.5235
 epoch: 42, train_loss: 0.4672, test_loss: 1.8469, test_f1: 0.5074
 epoch: 43, train_loss: 0.4671, test_loss: 1.8426, test_f1: 0.5328
 epoch: 44, train_loss: 0.4685, test_loss: 1.5898, test_f1: 0.5590
 epoch: 45, train_loss: 0.4299, test_loss: 1.8168, test_f1: 0.5250
 epoch: 46, train_loss: 0.4320, test_loss: 1.9518, test_f1: 0.5170
 epoch: 47, train_loss: 0.4127, test_loss: 1.8763, test_f1: 0.5429
 epoch: 48, train_loss: 0.4270, test_loss: 1.9311, test_f1: 0.5488
 epoch: 49, train_loss: 0.4202, test_loss: 1.7740, test_f1: 0.5201
 epoch: 50, train_loss: 0.3873, test_loss: 2.0006, test_f1: 0.5064
 epoch: 51, train_loss: 0.3674, test_loss: 2.0799, test_f1: 0.5233
 epoch: 52, train_loss: 0.3345, test_loss: 2.0474, test_f1: 0.5500
 epoch: 53, train_loss: 0.3062, test_loss: 2.0322, test_f1: 0.5417
 epoch: 54, train_loss: 0.2875, test_loss: 2.2453, test_f1: 0.5038
 epoch: 55, train_loss: 0.2927, test_loss: 2.2266, test_f1: 0.5348
 epoch: 56, train_loss: 0.2899, test_loss: 2.2563, test_f1: 0.5351
 epoch: 57, train_loss: 0.2887, test_loss: 2.4046, test_f1: 0.5154
 epoch: 58, train_loss: 0.2953, test_loss: 2.2952, test_f1: 0.5407
 epoch: 59, train_loss: 0.2629, test_loss: 2.2867, test_f1: 0.5325
 epoch: 60, train_loss: 0.2805, test_loss: 2.3042, test_f1: 0.5435
 epoch: 61, train_loss: 0.2676, test_loss: 2.3847, test_f1: 0.5298
 epoch: 62, train_loss: 0.2678, test_loss: 2.3267, test_f1: 0.5237
 epoch: 63, train_loss: 0.2630, test_loss: 2.3638, test_f1: 0.5213
 epoch: 64, train_loss: 0.2630, test_loss: 2.5644, test_f1: 0.5135
 epoch: 65, train_loss: 0.2603, test_loss: 2.4894, test_f1: 0.5358
 epoch: 66, train_loss: 0.2526, test_loss: 2.5417, test_f1: 0.5260
 epoch: 67, train_loss: 0.2369, test_loss: 2.5630, test_f1: 0.5204
 epoch: 68, train_loss: 0.2368, test_loss: 2.6966, test_f1: 0.5084
 epoch: 69, train_loss: 0.2472, test_loss: 2.4258, test_f1: 0.5662
 epoch: 70, train_loss: 0.2570, test_loss: 2.6432, test_f1: 0.5121
 epoch: 71, train_loss: 0.2450, test_loss: 2.5953, test_f1: 0.5478
 epoch: 72, train_loss: 0.2613, test_loss: 2.4171, test_f1: 0.5290
 epoch: 73, train_loss: 0.2466, test_loss: 2.5989, test_f1: 0.5344
 epoch: 74, train_loss: 0.2293, test_loss: 2.3917, test_f1: 0.5347
 epoch: 75, train_loss: 0.2224, test_loss: 2.6698, test_f1: 0.5286
 epoch: 76, train_loss: 0.2070, test_loss: 2.6734, test_f1: 0.5484
 epoch: 77, train_loss: 0.2203, test_loss: 2.6334, test_f1: 0.5376
 epoch: 78, train_loss: 0.2234, test_loss: 2.9411, test_f1: 0.5116
 epoch: 79, train_loss: 0.2283, test_loss: 3.0254, test_f1: 0.5202
 epoch: 80, train_loss: 0.2051, test_loss: 2.6703, test_f1: 0.5270
 epoch: 81, train_loss: 0.2159, test_loss: 2.8730, test_f1: 0.5216
 epoch: 82, train_loss: 0.2032, test_loss: 2.5232, test_f1: 0.5423
 epoch: 83, train_loss: 0.2087, test_loss: 2.9122, test_f1: 0.5173
 epoch: 84, train_loss: 0.2053, test_loss: 2.9806, test_f1: 0.5236
 epoch: 85, train_loss: 0.2130, test_loss: 2.9637, test_f1: 0.5092
 epoch: 86, train_loss: 0.2348, test_loss: 3.0051, test_f1: 0.5307
 epoch: 87, train_loss: 0.2137, test_loss: 2.9323, test_f1: 0.5459
 epoch: 88, train_loss: 0.2124, test_loss: 3.1455, test_f1: 0.5417
 epoch: 89, train_loss: 0.1978, test_loss: 2.7431, test_f1: 0.5428
 epoch: 90, train_loss: 0.1974, test_loss: 2.7514, test_f1: 0.5415
 epoch: 91, train_loss: 0.1959, test_loss: 2.9991, test_f1: 0.5278
 epoch: 92, train_loss: 0.1898, test_loss: 2.9226, test_f1: 0.5253
 epoch: 93, train_loss: 0.2016, test_loss: 2.7965, test_f1: 0.5470
 epoch: 94, train_loss: 0.2142, test_loss: 3.1099, test_f1: 0.5259
 epoch: 95, train_loss: 0.2050, test_loss: 3.0633, test_f1: 0.5255
 epoch: 96, train_loss: 0.1961, test_loss: 2.8783, test_f1: 0.5636
 epoch: 97, train_loss: 0.2151, test_loss: 3.0027, test_f1: 0.5319
 epoch: 98, train_loss: 0.2070, test_loss: 2.9220, test_f1: 0.5517
 epoch: 99, train_loss: 0.1886, test_loss: 2.9386, test_f1: 0.5305
##################ITERATION #8 ****************************************
 epoch: 0, train_loss: 1.6068, test_loss: 1.3456, test_f1: 0.3805
 epoch: 1, train_loss: 1.2523, test_loss: 1.2279, test_f1: 0.3686
 epoch: 2, train_loss: 1.1424, test_loss: 1.1083, test_f1: 0.4400
 epoch: 3, train_loss: 1.0884, test_loss: 1.0763, test_f1: 0.4577
 epoch: 4, train_loss: 1.0475, test_loss: 1.0328, test_f1: 0.4830
 epoch: 5, train_loss: 1.0317, test_loss: 0.9807, test_f1: 0.5258
 epoch: 6, train_loss: 0.9817, test_loss: 0.9667, test_f1: 0.4823
 epoch: 7, train_loss: 0.9552, test_loss: 1.0317, test_f1: 0.5040
 epoch: 8, train_loss: 0.9251, test_loss: 0.9789, test_f1: 0.5246
 epoch: 9, train_loss: 0.9134, test_loss: 0.9804, test_f1: 0.5333
 epoch: 10, train_loss: 0.9021, test_loss: 1.0728, test_f1: 0.4916
 epoch: 11, train_loss: 0.9043, test_loss: 1.0502, test_f1: 0.4789
 epoch: 12, train_loss: 0.8635, test_loss: 1.0675, test_f1: 0.4843
 epoch: 13, train_loss: 0.8571, test_loss: 1.1098, test_f1: 0.5036
 epoch: 14, train_loss: 0.8366, test_loss: 1.0536, test_f1: 0.5284
 epoch: 15, train_loss: 0.8065, test_loss: 1.1659, test_f1: 0.5231
 epoch: 16, train_loss: 0.7992, test_loss: 1.0584, test_f1: 0.5243
 epoch: 17, train_loss: 0.7852, test_loss: 1.1254, test_f1: 0.5033
 epoch: 18, train_loss: 0.7609, test_loss: 1.2564, test_f1: 0.5083
 epoch: 19, train_loss: 0.7598, test_loss: 1.1132, test_f1: 0.5117
 epoch: 20, train_loss: 0.7440, test_loss: 1.0106, test_f1: 0.5321
 epoch: 21, train_loss: 0.7221, test_loss: 1.1773, test_f1: 0.5138
 epoch: 22, train_loss: 0.7157, test_loss: 1.0500, test_f1: 0.5420
 epoch: 23, train_loss: 0.6896, test_loss: 1.1642, test_f1: 0.5364
 epoch: 24, train_loss: 0.7096, test_loss: 1.2138, test_f1: 0.5104
 epoch: 25, train_loss: 0.6695, test_loss: 1.2551, test_f1: 0.5211
 epoch: 26, train_loss: 0.6832, test_loss: 1.3254, test_f1: 0.5094
 epoch: 27, train_loss: 0.6589, test_loss: 1.1642, test_f1: 0.5489
 epoch: 28, train_loss: 0.6435, test_loss: 1.1496, test_f1: 0.5356
 epoch: 29, train_loss: 0.6494, test_loss: 1.2040, test_f1: 0.5311
 epoch: 30, train_loss: 0.6434, test_loss: 1.3119, test_f1: 0.5246
 epoch: 31, train_loss: 0.6042, test_loss: 1.3312, test_f1: 0.5420
 epoch: 32, train_loss: 0.5880, test_loss: 1.2329, test_f1: 0.5430
 epoch: 33, train_loss: 0.6067, test_loss: 1.2947, test_f1: 0.5533
 epoch: 34, train_loss: 0.5754, test_loss: 1.3538, test_f1: 0.5441
 epoch: 35, train_loss: 0.5681, test_loss: 1.4158, test_f1: 0.5441
 epoch: 36, train_loss: 0.5560, test_loss: 1.4702, test_f1: 0.5344
 epoch: 37, train_loss: 0.5782, test_loss: 1.3525, test_f1: 0.5265
 epoch: 38, train_loss: 0.5528, test_loss: 1.6808, test_f1: 0.5048
 epoch: 39, train_loss: 0.5399, test_loss: 1.3345, test_f1: 0.5569
 epoch: 40, train_loss: 0.5167, test_loss: 1.7146, test_f1: 0.5151
 epoch: 41, train_loss: 0.5210, test_loss: 1.5111, test_f1: 0.5213
 epoch: 42, train_loss: 0.5610, test_loss: 1.3203, test_f1: 0.5358
 epoch: 43, train_loss: 0.5240, test_loss: 1.5776, test_f1: 0.5405
 epoch: 44, train_loss: 0.5278, test_loss: 1.3676, test_f1: 0.5579
 epoch: 45, train_loss: 0.5326, test_loss: 1.6509, test_f1: 0.4931
 epoch: 46, train_loss: 0.4965, test_loss: 1.4334, test_f1: 0.5364
 epoch: 47, train_loss: 0.4715, test_loss: 1.4927, test_f1: 0.5727
 epoch: 48, train_loss: 0.4686, test_loss: 1.6070, test_f1: 0.5545
 epoch: 49, train_loss: 0.4662, test_loss: 1.5084, test_f1: 0.5331
 epoch: 50, train_loss: 0.4762, test_loss: 1.5109, test_f1: 0.5500
 epoch: 51, train_loss: 0.4196, test_loss: 1.5783, test_f1: 0.5372
 epoch: 52, train_loss: 0.3929, test_loss: 1.6071, test_f1: 0.5447
 epoch: 53, train_loss: 0.3707, test_loss: 1.7739, test_f1: 0.5566
 epoch: 54, train_loss: 0.3518, test_loss: 1.7143, test_f1: 0.5425
 epoch: 55, train_loss: 0.3375, test_loss: 1.8336, test_f1: 0.5408
 epoch: 56, train_loss: 0.3377, test_loss: 1.8201, test_f1: 0.5529
 epoch: 57, train_loss: 0.3359, test_loss: 1.9248, test_f1: 0.5264
 epoch: 58, train_loss: 0.3409, test_loss: 1.7595, test_f1: 0.5370
 epoch: 59, train_loss: 0.3237, test_loss: 1.8117, test_f1: 0.5614
 epoch: 60, train_loss: 0.3131, test_loss: 1.8769, test_f1: 0.5486
 epoch: 61, train_loss: 0.3236, test_loss: 1.9752, test_f1: 0.5376
 epoch: 62, train_loss: 0.3261, test_loss: 1.8668, test_f1: 0.5557
 epoch: 63, train_loss: 0.3114, test_loss: 1.9301, test_f1: 0.5494
 epoch: 64, train_loss: 0.2906, test_loss: 2.0506, test_f1: 0.5277
 epoch: 65, train_loss: 0.3020, test_loss: 2.0578, test_f1: 0.5336
 epoch: 66, train_loss: 0.2930, test_loss: 1.7905, test_f1: 0.5485
 epoch: 67, train_loss: 0.2825, test_loss: 2.0883, test_f1: 0.5571
 epoch: 68, train_loss: 0.3123, test_loss: 1.9533, test_f1: 0.5587
 epoch: 69, train_loss: 0.2951, test_loss: 2.0302, test_f1: 0.5269
 epoch: 70, train_loss: 0.2930, test_loss: 2.1987, test_f1: 0.5455
 epoch: 71, train_loss: 0.2916, test_loss: 1.9110, test_f1: 0.5388
 epoch: 72, train_loss: 0.2852, test_loss: 2.0442, test_f1: 0.5478
 epoch: 73, train_loss: 0.2547, test_loss: 2.1036, test_f1: 0.5443
 epoch: 74, train_loss: 0.2695, test_loss: 2.1993, test_f1: 0.5381
 epoch: 75, train_loss: 0.2563, test_loss: 2.2091, test_f1: 0.5394
 epoch: 76, train_loss: 0.2676, test_loss: 2.1808, test_f1: 0.5454
 epoch: 77, train_loss: 0.2621, test_loss: 2.1957, test_f1: 0.5356
 epoch: 78, train_loss: 0.2813, test_loss: 2.5062, test_f1: 0.5155
 epoch: 79, train_loss: 0.2838, test_loss: 2.0483, test_f1: 0.5309
 epoch: 80, train_loss: 0.2649, test_loss: 2.2026, test_f1: 0.5299
 epoch: 81, train_loss: 0.2566, test_loss: 2.1003, test_f1: 0.5435
 epoch: 82, train_loss: 0.2580, test_loss: 2.2261, test_f1: 0.5236
 epoch: 83, train_loss: 0.2457, test_loss: 2.1457, test_f1: 0.5405
 epoch: 84, train_loss: 0.2489, test_loss: 2.2372, test_f1: 0.5125
 epoch: 85, train_loss: 0.2355, test_loss: 2.2710, test_f1: 0.5263
 epoch: 86, train_loss: 0.2412, test_loss: 2.4328, test_f1: 0.5262
 epoch: 87, train_loss: 0.2324, test_loss: 2.1914, test_f1: 0.5274
 epoch: 88, train_loss: 0.2297, test_loss: 2.5002, test_f1: 0.5300
 epoch: 89, train_loss: 0.2266, test_loss: 2.4852, test_f1: 0.5405
 epoch: 90, train_loss: 0.2223, test_loss: 2.4914, test_f1: 0.5300
 epoch: 91, train_loss: 0.2151, test_loss: 2.5237, test_f1: 0.5382
 epoch: 92, train_loss: 0.2293, test_loss: 2.3823, test_f1: 0.5521
 epoch: 93, train_loss: 0.2295, test_loss: 2.4604, test_f1: 0.5482
 epoch: 94, train_loss: 0.2146, test_loss: 2.5447, test_f1: 0.5340
 epoch: 95, train_loss: 0.2081, test_loss: 2.6999, test_f1: 0.5473
 epoch: 96, train_loss: 0.2110, test_loss: 2.6992, test_f1: 0.5181
 epoch: 97, train_loss: 0.2282, test_loss: 2.4926, test_f1: 0.5446
 epoch: 98, train_loss: 0.2169, test_loss: 2.3392, test_f1: 0.5379
 epoch: 99, train_loss: 0.2050, test_loss: 2.5231, test_f1: 0.5396
##################ITERATION #9 ****************************************
 epoch: 0, train_loss: 1.6145, test_loss: 1.2857, test_f1: 0.2375
 epoch: 1, train_loss: 1.2267, test_loss: 1.2061, test_f1: 0.3521
 epoch: 2, train_loss: 1.1479, test_loss: 1.1315, test_f1: 0.4297
 epoch: 3, train_loss: 1.0955, test_loss: 1.0727, test_f1: 0.4502
 epoch: 4, train_loss: 1.0660, test_loss: 1.1289, test_f1: 0.4305
 epoch: 5, train_loss: 1.0445, test_loss: 1.0228, test_f1: 0.5006
 epoch: 6, train_loss: 0.9998, test_loss: 0.9994, test_f1: 0.4934
 epoch: 7, train_loss: 0.9694, test_loss: 1.0652, test_f1: 0.4543
 epoch: 8, train_loss: 0.9460, test_loss: 1.0694, test_f1: 0.4593
 epoch: 9, train_loss: 0.9251, test_loss: 1.0208, test_f1: 0.4969
 epoch: 10, train_loss: 0.9015, test_loss: 0.9967, test_f1: 0.4925
 epoch: 11, train_loss: 0.8814, test_loss: 1.0311, test_f1: 0.4825
 epoch: 12, train_loss: 0.8555, test_loss: 1.0845, test_f1: 0.5096
 epoch: 13, train_loss: 0.8432, test_loss: 1.0804, test_f1: 0.4907
 epoch: 14, train_loss: 0.8374, test_loss: 1.0394, test_f1: 0.5124
 epoch: 15, train_loss: 0.8183, test_loss: 0.9822, test_f1: 0.5273
 epoch: 16, train_loss: 0.7820, test_loss: 1.1105, test_f1: 0.5110
 epoch: 17, train_loss: 0.7745, test_loss: 1.0643, test_f1: 0.5037
 epoch: 18, train_loss: 0.7452, test_loss: 1.0469, test_f1: 0.5403
 epoch: 19, train_loss: 0.7493, test_loss: 1.0883, test_f1: 0.5040
 epoch: 20, train_loss: 0.7262, test_loss: 1.1795, test_f1: 0.5213
 epoch: 21, train_loss: 0.7379, test_loss: 1.0869, test_f1: 0.5300
 epoch: 22, train_loss: 0.7161, test_loss: 1.2004, test_f1: 0.5020
 epoch: 23, train_loss: 0.7277, test_loss: 1.2013, test_f1: 0.4976
 epoch: 24, train_loss: 0.7261, test_loss: 1.2617, test_f1: 0.5074
 epoch: 25, train_loss: 0.6941, test_loss: 1.1018, test_f1: 0.5270
 epoch: 26, train_loss: 0.6708, test_loss: 1.0751, test_f1: 0.5129
 epoch: 27, train_loss: 0.6532, test_loss: 1.1822, test_f1: 0.5189
 epoch: 28, train_loss: 0.6435, test_loss: 1.3587, test_f1: 0.4881
 epoch: 29, train_loss: 0.6527, test_loss: 1.2572, test_f1: 0.4984
 epoch: 30, train_loss: 0.6255, test_loss: 1.1771, test_f1: 0.5459
 epoch: 31, train_loss: 0.6315, test_loss: 1.2586, test_f1: 0.5175
 epoch: 32, train_loss: 0.6009, test_loss: 1.2259, test_f1: 0.5365
 epoch: 33, train_loss: 0.6004, test_loss: 1.1957, test_f1: 0.5219
 epoch: 34, train_loss: 0.5879, test_loss: 1.2635, test_f1: 0.5191
 epoch: 35, train_loss: 0.5993, test_loss: 1.2436, test_f1: 0.5532
 epoch: 36, train_loss: 0.5593, test_loss: 1.2134, test_f1: 0.5560
 epoch: 37, train_loss: 0.5642, test_loss: 1.4510, test_f1: 0.5304
 epoch: 38, train_loss: 0.5359, test_loss: 1.3343, test_f1: 0.5393
 epoch: 39, train_loss: 0.5244, test_loss: 1.2851, test_f1: 0.5564
 epoch: 40, train_loss: 0.5307, test_loss: 1.5114, test_f1: 0.5245
 epoch: 41, train_loss: 0.5348, test_loss: 1.4520, test_f1: 0.5072
 epoch: 42, train_loss: 0.5553, test_loss: 1.4542, test_f1: 0.5299
 epoch: 43, train_loss: 0.5365, test_loss: 1.3654, test_f1: 0.5308
 epoch: 44, train_loss: 0.5362, test_loss: 1.3323, test_f1: 0.5326
 epoch: 45, train_loss: 0.5115, test_loss: 1.5672, test_f1: 0.5458
 epoch: 46, train_loss: 0.5065, test_loss: 1.3502, test_f1: 0.5544
 epoch: 47, train_loss: 0.4976, test_loss: 1.3586, test_f1: 0.5552
 epoch: 48, train_loss: 0.4938, test_loss: 1.3801, test_f1: 0.5368
 epoch: 49, train_loss: 0.4725, test_loss: 1.3362, test_f1: 0.5641
 epoch: 50, train_loss: 0.4574, test_loss: 1.5480, test_f1: 0.5319
 epoch: 51, train_loss: 0.4176, test_loss: 1.4622, test_f1: 0.5568
 epoch: 52, train_loss: 0.3826, test_loss: 1.6398, test_f1: 0.5542
 epoch: 53, train_loss: 0.3589, test_loss: 1.5655, test_f1: 0.5501
 epoch: 54, train_loss: 0.3715, test_loss: 1.7528, test_f1: 0.5199
 epoch: 55, train_loss: 0.3593, test_loss: 1.7646, test_f1: 0.5371
 epoch: 56, train_loss: 0.3551, test_loss: 1.6846, test_f1: 0.5446
 epoch: 57, train_loss: 0.3659, test_loss: 1.7050, test_f1: 0.5527
 epoch: 58, train_loss: 0.3300, test_loss: 1.6799, test_f1: 0.5533
 epoch: 59, train_loss: 0.3387, test_loss: 1.8388, test_f1: 0.5440
 epoch: 60, train_loss: 0.3281, test_loss: 1.8924, test_f1: 0.5340
 epoch: 61, train_loss: 0.3079, test_loss: 1.9031, test_f1: 0.5612
 epoch: 62, train_loss: 0.3057, test_loss: 1.8654, test_f1: 0.5410
 epoch: 63, train_loss: 0.3197, test_loss: 1.8573, test_f1: 0.5450
 epoch: 64, train_loss: 0.3108, test_loss: 1.9602, test_f1: 0.5355
 epoch: 65, train_loss: 0.3086, test_loss: 2.0568, test_f1: 0.5209
 epoch: 66, train_loss: 0.3004, test_loss: 1.9949, test_f1: 0.5315
 epoch: 67, train_loss: 0.2957, test_loss: 1.7652, test_f1: 0.5652
 epoch: 68, train_loss: 0.3007, test_loss: 2.1816, test_f1: 0.5297
 epoch: 69, train_loss: 0.3054, test_loss: 2.2300, test_f1: 0.5242
 epoch: 70, train_loss: 0.2767, test_loss: 1.9685, test_f1: 0.5339
 epoch: 71, train_loss: 0.2808, test_loss: 1.9554, test_f1: 0.5567
 epoch: 72, train_loss: 0.3004, test_loss: 1.9317, test_f1: 0.5656
 epoch: 73, train_loss: 0.3048, test_loss: 2.0007, test_f1: 0.5472
 epoch: 74, train_loss: 0.2771, test_loss: 2.0741, test_f1: 0.5367
 epoch: 75, train_loss: 0.2874, test_loss: 1.8904, test_f1: 0.5250
 epoch: 76, train_loss: 0.2808, test_loss: 2.0016, test_f1: 0.5464
 epoch: 77, train_loss: 0.2746, test_loss: 2.0038, test_f1: 0.5368
 epoch: 78, train_loss: 0.2531, test_loss: 2.2978, test_f1: 0.5336
 epoch: 79, train_loss: 0.2588, test_loss: 2.1120, test_f1: 0.5261
 epoch: 80, train_loss: 0.2555, test_loss: 2.0921, test_f1: 0.5592
 epoch: 81, train_loss: 0.2609, test_loss: 2.1575, test_f1: 0.5366
 epoch: 82, train_loss: 0.2502, test_loss: 2.2663, test_f1: 0.5380
 epoch: 83, train_loss: 0.2584, test_loss: 2.1755, test_f1: 0.5520
 epoch: 84, train_loss: 0.2489, test_loss: 2.2373, test_f1: 0.5282
 epoch: 85, train_loss: 0.2526, test_loss: 2.0824, test_f1: 0.5637
 epoch: 86, train_loss: 0.2539, test_loss: 2.4011, test_f1: 0.5254
 epoch: 87, train_loss: 0.2545, test_loss: 2.1244, test_f1: 0.5421
 epoch: 88, train_loss: 0.2533, test_loss: 2.2521, test_f1: 0.5332
 epoch: 89, train_loss: 0.2473, test_loss: 2.2155, test_f1: 0.5389
 epoch: 90, train_loss: 0.2361, test_loss: 2.3032, test_f1: 0.5306
 epoch: 91, train_loss: 0.2238, test_loss: 2.4307, test_f1: 0.5058
 epoch: 92, train_loss: 0.2440, test_loss: 2.3452, test_f1: 0.5581
 epoch: 93, train_loss: 0.2246, test_loss: 2.5166, test_f1: 0.5444
 epoch: 94, train_loss: 0.2269, test_loss: 2.3089, test_f1: 0.5410
 epoch: 95, train_loss: 0.2254, test_loss: 2.3113, test_f1: 0.5392
 epoch: 96, train_loss: 0.2237, test_loss: 2.2340, test_f1: 0.5424
 epoch: 97, train_loss: 0.2075, test_loss: 2.4653, test_f1: 0.5334
 epoch: 98, train_loss: 0.2246, test_loss: 2.4787, test_f1: 0.5451
 epoch: 99, train_loss: 0.2175, test_loss: 2.6086, test_f1: 0.5213

Training completed in 418.34 seconds
Best F1: 0.5803 at epoch 51
Mean F1 across iterations: 0.5666  0.0074
========================FINAL RESULTS================================
FEGIN weighted F1: 0.5803  0.0074
python main.py --data ltspice_examples --representation component_component --model FEGIN --layers 5 --hiddens 128 --batch_size 256 --lr 0.001 --emb_size 250 --epochs 100 --save_appendix component_component_L5_H128_BS256_LR0.001_E250 --no_val
-----



STDERR:
  File "main.py", line 370, in <module>
    main()
  File "main.py", line 254, in main
    dataset = dataset_class(
  File "/home/philip/projects/ltspice_examples_code_repo/Circuit-Completion-Using-GNNs/component_classification_with_link_prediction_head/evaluation/FEGIN/kernel/circuit_datasets.py", line 15, in __init__
    self.data, self.slices = torch.load(self.processed_paths[0])
  File "/home/philip/.local/lib/python3.8/site-packages/torch/serialization.py", line 1040, in load
    warnings.warn(
  File "/usr/lib/python3.8/warnings.py", line 109, in _showwarnmsg
    sw(msg.message, msg.category, msg.filename, msg.lineno,
  File "main.py", line 47, in warn_with_traceback
    traceback.print_stack(file=log)
/home/philip/projects/ltspice_examples_code_repo/Circuit-Completion-Using-GNNs/component_classification_with_link_prediction_head/evaluation/FEGIN/kernel/circuit_datasets.py:15: FutureWarning: You are using `torch.load` with `weights_only=False` (the current default value), which uses the default pickle module implicitly. It is possible to construct malicious pickle data which will execute arbitrary code during unpickling (See https://github.com/pytorch/pytorch/blob/main/SECURITY.md#untrusted-models for more details). In a future release, the default value for `weights_only` will be flipped to `True`. This limits the functions that could be executed during unpickling. Arbitrary objects will no longer be allowed to be loaded via this mode unless they are explicitly allowlisted by the user via `torch.serialization.add_safe_globals`. We recommend you start setting `weights_only=True` for any use case where you don't have full control of the loaded file. Please open an issue on GitHub for any issues related to this experimental feature.
  self.data, self.slices = torch.load(self.processed_paths[0])
