STDOUT:
Results will be saved in /home/philip/projects/ltspice_examples_code_repo/Circuit-Completion-Using-GNNs/component_classification_with_link_prediction_head/evaluation/FEGIN/results/model_FEGIN_dataset_ltspice_examples
Command line input: python main.py --data ltspice_examples --representation component_component --model FEGIN --layers 3 --hiddens 128 --batch_size 32 --lr 0.001 --emb_size 512 --epochs 100 --save_appendix component_component_L3_H128_BS32_LR0.001_E512 --no_val
 is saved.
-----
ltspice_examples - FEGIN
Using 3 layers, 128 hidden units, h = 2
Loading component_component representation dataset
ENTERED
Training FEGIN on component_component representation
Train: 3556, Test: 845
##################ITERATION #0 ****************************************
 epoch: 0, train_loss: 1.2308, test_loss: 1.1209, test_f1: 0.4212
 epoch: 1, train_loss: 1.1135, test_loss: 1.0527, test_f1: 0.4947
 epoch: 2, train_loss: 1.0686, test_loss: 0.9652, test_f1: 0.4788
 epoch: 3, train_loss: 1.0160, test_loss: 0.9823, test_f1: 0.5005
 epoch: 4, train_loss: 0.9973, test_loss: 0.9592, test_f1: 0.4890
 epoch: 5, train_loss: 0.9755, test_loss: 1.0060, test_f1: 0.4691
 epoch: 6, train_loss: 0.9541, test_loss: 0.9842, test_f1: 0.5312
 epoch: 7, train_loss: 0.9346, test_loss: 1.0578, test_f1: 0.4764
 epoch: 8, train_loss: 0.9212, test_loss: 0.9604, test_f1: 0.5281
 epoch: 9, train_loss: 0.9027, test_loss: 0.9716, test_f1: 0.5460
 epoch: 10, train_loss: 0.8974, test_loss: 0.9804, test_f1: 0.5174
 epoch: 11, train_loss: 0.8820, test_loss: 0.9972, test_f1: 0.4959
 epoch: 12, train_loss: 0.8723, test_loss: 1.0045, test_f1: 0.5240
 epoch: 13, train_loss: 0.9040, test_loss: 1.0214, test_f1: 0.5450
 epoch: 14, train_loss: 0.8654, test_loss: 0.9442, test_f1: 0.5559
 epoch: 15, train_loss: 0.8564, test_loss: 1.0409, test_f1: 0.4903
 epoch: 16, train_loss: 0.8458, test_loss: 0.9487, test_f1: 0.5318
 epoch: 17, train_loss: 0.8465, test_loss: 1.1325, test_f1: 0.4956
 epoch: 18, train_loss: 0.8242, test_loss: 0.9899, test_f1: 0.5549
 epoch: 19, train_loss: 0.8121, test_loss: 1.0240, test_f1: 0.5329
 epoch: 20, train_loss: 0.7992, test_loss: 1.0487, test_f1: 0.5490
 epoch: 21, train_loss: 0.8100, test_loss: 1.0789, test_f1: 0.5155
 epoch: 22, train_loss: 0.7922, test_loss: 1.0211, test_f1: 0.5654
 epoch: 23, train_loss: 0.8021, test_loss: 1.0383, test_f1: 0.5373
 epoch: 24, train_loss: 0.7585, test_loss: 0.9768, test_f1: 0.5400
 epoch: 25, train_loss: 0.7548, test_loss: 1.1024, test_f1: 0.5364
 epoch: 26, train_loss: 0.7589, test_loss: 0.9889, test_f1: 0.5663
 epoch: 27, train_loss: 0.7412, test_loss: 1.0756, test_f1: 0.5634
 epoch: 28, train_loss: 0.7382, test_loss: 1.0788, test_f1: 0.5472
 epoch: 29, train_loss: 0.7287, test_loss: 1.0300, test_f1: 0.5582
 epoch: 30, train_loss: 0.7231, test_loss: 1.1396, test_f1: 0.5041
 epoch: 31, train_loss: 0.7154, test_loss: 1.1601, test_f1: 0.5450
 epoch: 32, train_loss: 0.7052, test_loss: 1.0872, test_f1: 0.5680
 epoch: 33, train_loss: 0.6982, test_loss: 1.0702, test_f1: 0.5562
 epoch: 34, train_loss: 0.6861, test_loss: 1.1483, test_f1: 0.5175
 epoch: 35, train_loss: 0.6953, test_loss: 1.1736, test_f1: 0.5478
 epoch: 36, train_loss: 0.6789, test_loss: 1.0557, test_f1: 0.5664
 epoch: 37, train_loss: 0.6795, test_loss: 1.1044, test_f1: 0.5515
 epoch: 38, train_loss: 0.6768, test_loss: 1.2353, test_f1: 0.5461
 epoch: 39, train_loss: 0.6564, test_loss: 1.1776, test_f1: 0.5383
 epoch: 40, train_loss: 0.7107, test_loss: 1.1582, test_f1: 0.5637
 epoch: 41, train_loss: 0.6911, test_loss: 1.0890, test_f1: 0.5417
 epoch: 42, train_loss: 0.6771, test_loss: 1.0639, test_f1: 0.5463
 epoch: 43, train_loss: 0.6522, test_loss: 1.1685, test_f1: 0.5509
 epoch: 44, train_loss: 0.6340, test_loss: 1.2028, test_f1: 0.5379
 epoch: 45, train_loss: 0.6467, test_loss: 1.1027, test_f1: 0.5530
 epoch: 46, train_loss: 0.6303, test_loss: 1.2209, test_f1: 0.5636
 epoch: 47, train_loss: 0.6427, test_loss: 1.2898, test_f1: 0.5536
 epoch: 48, train_loss: 0.6555, test_loss: 1.1308, test_f1: 0.5732
 epoch: 49, train_loss: 0.6264, test_loss: 1.1143, test_f1: 0.5674
 epoch: 50, train_loss: 0.5935, test_loss: 1.1743, test_f1: 0.5565
 epoch: 51, train_loss: 0.5627, test_loss: 1.2498, test_f1: 0.5353
 epoch: 52, train_loss: 0.5485, test_loss: 1.1509, test_f1: 0.5826
 epoch: 53, train_loss: 0.5376, test_loss: 1.1871, test_f1: 0.6037
 epoch: 54, train_loss: 0.5323, test_loss: 1.1962, test_f1: 0.5804
 epoch: 55, train_loss: 0.5155, test_loss: 1.2513, test_f1: 0.5490
 epoch: 56, train_loss: 0.5299, test_loss: 1.2380, test_f1: 0.5748
 epoch: 57, train_loss: 0.5045, test_loss: 1.3289, test_f1: 0.5458
 epoch: 58, train_loss: 0.4887, test_loss: 1.3517, test_f1: 0.5786
 epoch: 59, train_loss: 0.4983, test_loss: 1.3957, test_f1: 0.5661
 epoch: 60, train_loss: 0.5026, test_loss: 1.3895, test_f1: 0.5516
 epoch: 61, train_loss: 0.4775, test_loss: 1.4385, test_f1: 0.5408
 epoch: 62, train_loss: 0.4741, test_loss: 1.4107, test_f1: 0.5776
 epoch: 63, train_loss: 0.4740, test_loss: 1.4108, test_f1: 0.5890
 epoch: 64, train_loss: 0.4615, test_loss: 1.5093, test_f1: 0.5705
 epoch: 65, train_loss: 0.4618, test_loss: 1.3563, test_f1: 0.5900
 epoch: 66, train_loss: 0.4620, test_loss: 1.4297, test_f1: 0.5388
 epoch: 67, train_loss: 0.4795, test_loss: 1.5343, test_f1: 0.5284
 epoch: 68, train_loss: 0.4394, test_loss: 1.4112, test_f1: 0.5678
 epoch: 69, train_loss: 0.4670, test_loss: 1.4184, test_f1: 0.5695
 epoch: 70, train_loss: 0.4484, test_loss: 1.4041, test_f1: 0.5605
 epoch: 71, train_loss: 0.4544, test_loss: 1.4832, test_f1: 0.5708
 epoch: 72, train_loss: 0.4415, test_loss: 1.4019, test_f1: 0.5858
 epoch: 73, train_loss: 0.4195, test_loss: 1.5463, test_f1: 0.5565
 epoch: 74, train_loss: 0.4381, test_loss: 1.4895, test_f1: 0.5648
 epoch: 75, train_loss: 0.4233, test_loss: 1.4965, test_f1: 0.5717
 epoch: 76, train_loss: 0.4189, test_loss: 1.4582, test_f1: 0.5831
 epoch: 77, train_loss: 0.4884, test_loss: 1.5036, test_f1: 0.5996
 epoch: 78, train_loss: 0.4345, test_loss: 1.5181, test_f1: 0.5561
 epoch: 79, train_loss: 0.4376, test_loss: 1.5360, test_f1: 0.5436
 epoch: 80, train_loss: 0.4088, test_loss: 1.5322, test_f1: 0.5585
 epoch: 81, train_loss: 0.4145, test_loss: 1.4831, test_f1: 0.6011
 epoch: 82, train_loss: 0.4166, test_loss: 1.6895, test_f1: 0.5504
 epoch: 83, train_loss: 0.3824, test_loss: 1.5570, test_f1: 0.5877
 epoch: 84, train_loss: 0.3944, test_loss: 1.6814, test_f1: 0.5580
 epoch: 85, train_loss: 0.4077, test_loss: 1.5787, test_f1: 0.5543
 epoch: 86, train_loss: 0.3956, test_loss: 1.6518, test_f1: 0.5562
 epoch: 87, train_loss: 0.4030, test_loss: 1.5629, test_f1: 0.5711
 epoch: 88, train_loss: 0.3765, test_loss: 1.6056, test_f1: 0.5666
 epoch: 89, train_loss: 0.3873, test_loss: 1.7282, test_f1: 0.5604
 epoch: 90, train_loss: 0.3692, test_loss: 1.7017, test_f1: 0.5634
 epoch: 91, train_loss: 0.3729, test_loss: 1.6870, test_f1: 0.5751
 epoch: 92, train_loss: 0.3715, test_loss: 1.5780, test_f1: 0.5781
 epoch: 93, train_loss: 0.3836, test_loss: 1.7694, test_f1: 0.5581
 epoch: 94, train_loss: 0.4041, test_loss: 1.7008, test_f1: 0.5689
 epoch: 95, train_loss: 0.3661, test_loss: 1.7639, test_f1: 0.5678
 epoch: 96, train_loss: 0.3955, test_loss: 1.7740, test_f1: 0.5475
 epoch: 97, train_loss: 0.3936, test_loss: 1.7758, test_f1: 0.5616
 epoch: 98, train_loss: 0.3724, test_loss: 1.7463, test_f1: 0.5679
 epoch: 99, train_loss: 0.3925, test_loss: 1.6447, test_f1: 0.5861
##################ITERATION #1 ****************************************
 epoch: 0, train_loss: 1.1968, test_loss: 1.0944, test_f1: 0.4191
 epoch: 1, train_loss: 1.0782, test_loss: 1.0442, test_f1: 0.4572
 epoch: 2, train_loss: 1.0406, test_loss: 0.9828, test_f1: 0.4593
 epoch: 3, train_loss: 1.0321, test_loss: 0.9669, test_f1: 0.4739
 epoch: 4, train_loss: 0.9998, test_loss: 0.9843, test_f1: 0.4713
 epoch: 5, train_loss: 0.9676, test_loss: 1.0364, test_f1: 0.4407
 epoch: 6, train_loss: 0.9509, test_loss: 0.9480, test_f1: 0.4834
 epoch: 7, train_loss: 0.9338, test_loss: 0.9734, test_f1: 0.5316
 epoch: 8, train_loss: 0.9225, test_loss: 0.9299, test_f1: 0.4947
 epoch: 9, train_loss: 0.9064, test_loss: 0.9600, test_f1: 0.5229
 epoch: 10, train_loss: 0.8868, test_loss: 1.0399, test_f1: 0.4578
 epoch: 11, train_loss: 0.8735, test_loss: 0.9769, test_f1: 0.5461
 epoch: 12, train_loss: 0.8666, test_loss: 0.9437, test_f1: 0.5592
 epoch: 13, train_loss: 0.8550, test_loss: 0.9693, test_f1: 0.4997
 epoch: 14, train_loss: 0.8535, test_loss: 1.0175, test_f1: 0.5372
 epoch: 15, train_loss: 0.8422, test_loss: 1.0353, test_f1: 0.5257
 epoch: 16, train_loss: 0.8348, test_loss: 0.9947, test_f1: 0.5098
 epoch: 17, train_loss: 0.8232, test_loss: 1.0172, test_f1: 0.5303
 epoch: 18, train_loss: 0.8171, test_loss: 0.9416, test_f1: 0.5565
 epoch: 19, train_loss: 0.7959, test_loss: 1.0309, test_f1: 0.5499
 epoch: 20, train_loss: 0.8035, test_loss: 1.0422, test_f1: 0.5591
 epoch: 21, train_loss: 0.7812, test_loss: 0.9562, test_f1: 0.5602
 epoch: 22, train_loss: 0.7777, test_loss: 0.9799, test_f1: 0.5812
 epoch: 23, train_loss: 0.7599, test_loss: 1.1135, test_f1: 0.5084
 epoch: 24, train_loss: 0.7554, test_loss: 1.1092, test_f1: 0.5565
 epoch: 25, train_loss: 0.7621, test_loss: 1.0217, test_f1: 0.5516
 epoch: 26, train_loss: 0.7569, test_loss: 0.9490, test_f1: 0.5549
 epoch: 27, train_loss: 0.7215, test_loss: 1.0111, test_f1: 0.5656
 epoch: 28, train_loss: 0.7393, test_loss: 1.0640, test_f1: 0.5609
 epoch: 29, train_loss: 0.7702, test_loss: 1.0467, test_f1: 0.5549
 epoch: 30, train_loss: 0.7316, test_loss: 1.0182, test_f1: 0.5706
 epoch: 31, train_loss: 0.7314, test_loss: 1.1395, test_f1: 0.5339
 epoch: 32, train_loss: 0.6956, test_loss: 1.1584, test_f1: 0.5536
 epoch: 33, train_loss: 0.6963, test_loss: 1.0937, test_f1: 0.5338
 epoch: 34, train_loss: 0.6945, test_loss: 1.0588, test_f1: 0.5663
 epoch: 35, train_loss: 0.6846, test_loss: 1.1725, test_f1: 0.5603
 epoch: 36, train_loss: 0.6670, test_loss: 1.1638, test_f1: 0.5569
 epoch: 37, train_loss: 0.7016, test_loss: 1.0466, test_f1: 0.5721
 epoch: 38, train_loss: 0.6597, test_loss: 1.1206, test_f1: 0.5420
 epoch: 39, train_loss: 0.6355, test_loss: 1.2673, test_f1: 0.5167
 epoch: 40, train_loss: 0.6801, test_loss: 1.1230, test_f1: 0.5326
 epoch: 41, train_loss: 0.6556, test_loss: 1.0540, test_f1: 0.5662
 epoch: 42, train_loss: 0.6505, test_loss: 1.0167, test_f1: 0.5833
 epoch: 43, train_loss: 0.6165, test_loss: 1.2066, test_f1: 0.5431
 epoch: 44, train_loss: 0.6901, test_loss: 1.0578, test_f1: 0.5384
 epoch: 45, train_loss: 0.6727, test_loss: 1.1330, test_f1: 0.5583
 epoch: 46, train_loss: 0.6608, test_loss: 1.1544, test_f1: 0.5489
 epoch: 47, train_loss: 0.6396, test_loss: 1.2113, test_f1: 0.5360
 epoch: 48, train_loss: 0.6369, test_loss: 1.1813, test_f1: 0.5429
 epoch: 49, train_loss: 0.5941, test_loss: 1.1813, test_f1: 0.5619
 epoch: 50, train_loss: 0.6030, test_loss: 1.1680, test_f1: 0.5502
 epoch: 51, train_loss: 0.5647, test_loss: 1.1945, test_f1: 0.5485
 epoch: 52, train_loss: 0.5493, test_loss: 1.2274, test_f1: 0.5559
 epoch: 53, train_loss: 0.5416, test_loss: 1.2597, test_f1: 0.5509
 epoch: 54, train_loss: 0.5523, test_loss: 1.1031, test_f1: 0.5642
 epoch: 55, train_loss: 0.5477, test_loss: 1.2268, test_f1: 0.5648
 epoch: 56, train_loss: 0.5213, test_loss: 1.2873, test_f1: 0.5360
 epoch: 57, train_loss: 0.5177, test_loss: 1.2892, test_f1: 0.5338
 epoch: 58, train_loss: 0.5117, test_loss: 1.3098, test_f1: 0.5599
 epoch: 59, train_loss: 0.5043, test_loss: 1.2716, test_f1: 0.5400
 epoch: 60, train_loss: 0.5348, test_loss: 1.2810, test_f1: 0.5359
 epoch: 61, train_loss: 0.5145, test_loss: 1.2471, test_f1: 0.5667
 epoch: 62, train_loss: 0.5026, test_loss: 1.2252, test_f1: 0.5939
 epoch: 63, train_loss: 0.5106, test_loss: 1.5818, test_f1: 0.5292
 epoch: 64, train_loss: 0.5099, test_loss: 1.2477, test_f1: 0.5504
 epoch: 65, train_loss: 0.4972, test_loss: 1.3781, test_f1: 0.5667
 epoch: 66, train_loss: 0.4766, test_loss: 1.4364, test_f1: 0.5548
 epoch: 67, train_loss: 0.5030, test_loss: 1.2271, test_f1: 0.5627
 epoch: 68, train_loss: 0.4687, test_loss: 1.4011, test_f1: 0.5523
 epoch: 69, train_loss: 0.4869, test_loss: 1.2654, test_f1: 0.5822
 epoch: 70, train_loss: 0.4563, test_loss: 1.4813, test_f1: 0.5484
 epoch: 71, train_loss: 0.5025, test_loss: 1.2849, test_f1: 0.5713
 epoch: 72, train_loss: 0.4603, test_loss: 1.3482, test_f1: 0.5590
 epoch: 73, train_loss: 0.4475, test_loss: 1.3918, test_f1: 0.5544
 epoch: 74, train_loss: 0.4563, test_loss: 1.4062, test_f1: 0.5537
 epoch: 75, train_loss: 0.4644, test_loss: 1.3093, test_f1: 0.5667
 epoch: 76, train_loss: 0.4348, test_loss: 1.4997, test_f1: 0.5490
 epoch: 77, train_loss: 0.4732, test_loss: 1.6319, test_f1: 0.5148
 epoch: 78, train_loss: 0.4530, test_loss: 1.4270, test_f1: 0.5622
 epoch: 79, train_loss: 0.4361, test_loss: 1.4981, test_f1: 0.5366
 epoch: 80, train_loss: 0.4447, test_loss: 1.3985, test_f1: 0.5510
 epoch: 81, train_loss: 0.4465, test_loss: 1.3085, test_f1: 0.5769
 epoch: 82, train_loss: 0.4275, test_loss: 1.4731, test_f1: 0.5373
 epoch: 83, train_loss: 0.4241, test_loss: 1.3829, test_f1: 0.5485
 epoch: 84, train_loss: 0.4265, test_loss: 1.4165, test_f1: 0.5561
 epoch: 85, train_loss: 0.4244, test_loss: 1.5021, test_f1: 0.5610
 epoch: 86, train_loss: 0.4206, test_loss: 1.4730, test_f1: 0.5306
 epoch: 87, train_loss: 0.4360, test_loss: 1.5203, test_f1: 0.5283
 epoch: 88, train_loss: 0.4421, test_loss: 1.4253, test_f1: 0.5608
 epoch: 89, train_loss: 0.4210, test_loss: 1.4594, test_f1: 0.5553
 epoch: 90, train_loss: 0.4327, test_loss: 1.3504, test_f1: 0.5605
 epoch: 91, train_loss: 0.4360, test_loss: 1.3906, test_f1: 0.5581
 epoch: 92, train_loss: 0.3975, test_loss: 1.5598, test_f1: 0.5250
 epoch: 93, train_loss: 0.4135, test_loss: 1.5081, test_f1: 0.5498
 epoch: 94, train_loss: 0.4056, test_loss: 1.4079, test_f1: 0.5567
 epoch: 95, train_loss: 0.4089, test_loss: 1.3732, test_f1: 0.5694
 epoch: 96, train_loss: 0.4429, test_loss: 1.3497, test_f1: 0.5579
 epoch: 97, train_loss: 0.3998, test_loss: 1.4113, test_f1: 0.5417
 epoch: 98, train_loss: 0.4030, test_loss: 1.4178, test_f1: 0.5619
 epoch: 99, train_loss: 0.3943, test_loss: 1.3779, test_f1: 0.5333
##################ITERATION #2 ****************************************
 epoch: 0, train_loss: 1.2405, test_loss: 1.1404, test_f1: 0.4365
 epoch: 1, train_loss: 1.1158, test_loss: 0.9979, test_f1: 0.4425
 epoch: 2, train_loss: 1.0520, test_loss: 0.9640, test_f1: 0.4790
 epoch: 3, train_loss: 1.0258, test_loss: 0.9635, test_f1: 0.4891
 epoch: 4, train_loss: 0.9957, test_loss: 0.9520, test_f1: 0.5062
 epoch: 5, train_loss: 0.9753, test_loss: 1.0162, test_f1: 0.4640
 epoch: 6, train_loss: 0.9636, test_loss: 0.9268, test_f1: 0.5016
 epoch: 7, train_loss: 0.9442, test_loss: 0.8911, test_f1: 0.5030
 epoch: 8, train_loss: 0.9317, test_loss: 0.9382, test_f1: 0.5237
 epoch: 9, train_loss: 0.9238, test_loss: 0.9862, test_f1: 0.4974
 epoch: 10, train_loss: 0.9061, test_loss: 0.9361, test_f1: 0.5391
 epoch: 11, train_loss: 0.9172, test_loss: 1.0040, test_f1: 0.5002
 epoch: 12, train_loss: 0.8965, test_loss: 0.9818, test_f1: 0.5195
 epoch: 13, train_loss: 0.8726, test_loss: 0.9884, test_f1: 0.5251
 epoch: 14, train_loss: 0.8862, test_loss: 1.0543, test_f1: 0.5198
 epoch: 15, train_loss: 0.8713, test_loss: 1.1321, test_f1: 0.4944
 epoch: 16, train_loss: 0.8454, test_loss: 1.1059, test_f1: 0.5025
 epoch: 17, train_loss: 0.8426, test_loss: 1.0218, test_f1: 0.5391
 epoch: 18, train_loss: 0.8219, test_loss: 0.9587, test_f1: 0.5359
 epoch: 19, train_loss: 0.8350, test_loss: 0.9890, test_f1: 0.5001
 epoch: 20, train_loss: 0.8052, test_loss: 1.0581, test_f1: 0.4960
 epoch: 21, train_loss: 0.8042, test_loss: 0.9889, test_f1: 0.5603
 epoch: 22, train_loss: 0.7933, test_loss: 1.0888, test_f1: 0.5414
 epoch: 23, train_loss: 0.8119, test_loss: 1.0352, test_f1: 0.5516
 epoch: 24, train_loss: 0.7750, test_loss: 1.0253, test_f1: 0.5342
 epoch: 25, train_loss: 0.7722, test_loss: 1.0181, test_f1: 0.5405
 epoch: 26, train_loss: 0.7762, test_loss: 1.0725, test_f1: 0.5331
 epoch: 27, train_loss: 0.7584, test_loss: 1.1886, test_f1: 0.5338
 epoch: 28, train_loss: 0.7419, test_loss: 1.0221, test_f1: 0.5340
 epoch: 29, train_loss: 0.7314, test_loss: 1.0681, test_f1: 0.5701
 epoch: 30, train_loss: 0.7184, test_loss: 1.0323, test_f1: 0.5668
 epoch: 31, train_loss: 0.7702, test_loss: 1.1569, test_f1: 0.5175
 epoch: 32, train_loss: 0.7293, test_loss: 1.0621, test_f1: 0.5343
 epoch: 33, train_loss: 0.7204, test_loss: 1.0198, test_f1: 0.5589
 epoch: 34, train_loss: 0.7069, test_loss: 1.1196, test_f1: 0.5320
 epoch: 35, train_loss: 0.6948, test_loss: 1.0348, test_f1: 0.5575
 epoch: 36, train_loss: 0.6995, test_loss: 1.0806, test_f1: 0.5661
 epoch: 37, train_loss: 0.7109, test_loss: 1.0304, test_f1: 0.5507
 epoch: 38, train_loss: 0.7511, test_loss: 1.0752, test_f1: 0.5354
 epoch: 39, train_loss: 0.6807, test_loss: 1.0581, test_f1: 0.5524
 epoch: 40, train_loss: 0.6739, test_loss: 1.0841, test_f1: 0.5495
 epoch: 41, train_loss: 0.6512, test_loss: 1.0997, test_f1: 0.5369
 epoch: 42, train_loss: 0.6525, test_loss: 1.1551, test_f1: 0.5378
 epoch: 43, train_loss: 0.6506, test_loss: 1.1043, test_f1: 0.5492
 epoch: 44, train_loss: 0.6495, test_loss: 1.0459, test_f1: 0.5890
 epoch: 45, train_loss: 0.6295, test_loss: 1.1500, test_f1: 0.5653
 epoch: 46, train_loss: 0.6696, test_loss: 1.0527, test_f1: 0.5386
 epoch: 47, train_loss: 0.6285, test_loss: 1.1499, test_f1: 0.5666
 epoch: 48, train_loss: 0.6208, test_loss: 1.0853, test_f1: 0.5372
 epoch: 49, train_loss: 0.6153, test_loss: 1.0502, test_f1: 0.5771
 epoch: 50, train_loss: 0.6011, test_loss: 1.1434, test_f1: 0.5587
 epoch: 51, train_loss: 0.5706, test_loss: 1.1388, test_f1: 0.5529
 epoch: 52, train_loss: 0.5489, test_loss: 1.1386, test_f1: 0.5704
 epoch: 53, train_loss: 0.5533, test_loss: 1.1443, test_f1: 0.5712
 epoch: 54, train_loss: 0.5363, test_loss: 1.1418, test_f1: 0.5729
 epoch: 55, train_loss: 0.5389, test_loss: 1.0989, test_f1: 0.5926
 epoch: 56, train_loss: 0.5170, test_loss: 1.1879, test_f1: 0.5839
 epoch: 57, train_loss: 0.5212, test_loss: 1.1659, test_f1: 0.5994
 epoch: 58, train_loss: 0.5143, test_loss: 1.2177, test_f1: 0.5647
 epoch: 59, train_loss: 0.4979, test_loss: 1.2949, test_f1: 0.5567
 epoch: 60, train_loss: 0.4986, test_loss: 1.1936, test_f1: 0.5880
 epoch: 61, train_loss: 0.4941, test_loss: 1.2467, test_f1: 0.5833
 epoch: 62, train_loss: 0.5380, test_loss: 1.2496, test_f1: 0.5791
 epoch: 63, train_loss: 0.5021, test_loss: 1.3134, test_f1: 0.5562
 epoch: 64, train_loss: 0.5012, test_loss: 1.2742, test_f1: 0.5660
 epoch: 65, train_loss: 0.4864, test_loss: 1.2695, test_f1: 0.5748
 epoch: 66, train_loss: 0.4797, test_loss: 1.2705, test_f1: 0.5530
 epoch: 67, train_loss: 0.4704, test_loss: 1.2955, test_f1: 0.5798
 epoch: 68, train_loss: 0.4895, test_loss: 1.3097, test_f1: 0.5560
 epoch: 69, train_loss: 0.4655, test_loss: 1.3799, test_f1: 0.5708
 epoch: 70, train_loss: 0.5906, test_loss: 1.2605, test_f1: 0.5665
 epoch: 71, train_loss: 0.5184, test_loss: 1.3152, test_f1: 0.5545
 epoch: 72, train_loss: 0.5048, test_loss: 1.2927, test_f1: 0.5755
 epoch: 73, train_loss: 0.4924, test_loss: 1.2438, test_f1: 0.5916
 epoch: 74, train_loss: 0.4546, test_loss: 1.3290, test_f1: 0.5731
 epoch: 75, train_loss: 0.4589, test_loss: 1.4044, test_f1: 0.5745
 epoch: 76, train_loss: 0.4587, test_loss: 1.3769, test_f1: 0.5597
 epoch: 77, train_loss: 0.4346, test_loss: 1.3468, test_f1: 0.5721
 epoch: 78, train_loss: 0.4506, test_loss: 1.2577, test_f1: 0.5722
 epoch: 79, train_loss: 0.4451, test_loss: 1.3255, test_f1: 0.5485
 epoch: 80, train_loss: 0.4366, test_loss: 1.3752, test_f1: 0.5667
 epoch: 81, train_loss: 0.4139, test_loss: 1.2881, test_f1: 0.5722
 epoch: 82, train_loss: 0.4080, test_loss: 1.3688, test_f1: 0.5851
 epoch: 83, train_loss: 0.4183, test_loss: 1.4311, test_f1: 0.5437
 epoch: 84, train_loss: 0.4048, test_loss: 1.5012, test_f1: 0.5515
 epoch: 85, train_loss: 0.4438, test_loss: 1.3964, test_f1: 0.5639
 epoch: 86, train_loss: 0.4364, test_loss: 1.4759, test_f1: 0.5569
 epoch: 87, train_loss: 0.4014, test_loss: 1.3917, test_f1: 0.5772
 epoch: 88, train_loss: 0.4068, test_loss: 1.3838, test_f1: 0.5684
 epoch: 89, train_loss: 0.3963, test_loss: 1.3680, test_f1: 0.5819
 epoch: 90, train_loss: 0.4071, test_loss: 1.4527, test_f1: 0.5710
 epoch: 91, train_loss: 0.3942, test_loss: 1.5318, test_f1: 0.5402
 epoch: 92, train_loss: 0.3893, test_loss: 1.3723, test_f1: 0.5736
 epoch: 93, train_loss: 0.3943, test_loss: 1.4940, test_f1: 0.5361
 epoch: 94, train_loss: 0.3814, test_loss: 1.4829, test_f1: 0.5108
 epoch: 95, train_loss: 0.3811, test_loss: 1.5055, test_f1: 0.5549
 epoch: 96, train_loss: 0.3790, test_loss: 1.5550, test_f1: 0.5348
 epoch: 97, train_loss: 0.3959, test_loss: 1.4853, test_f1: 0.5313
 epoch: 98, train_loss: 0.3744, test_loss: 1.3932, test_f1: 0.5753
 epoch: 99, train_loss: 0.3930, test_loss: 1.3580, test_f1: 0.5754
##################ITERATION #3 ****************************************
 epoch: 0, train_loss: 1.2824, test_loss: 1.1120, test_f1: 0.4779
 epoch: 1, train_loss: 1.1192, test_loss: 1.0724, test_f1: 0.4410
 epoch: 2, train_loss: 1.0692, test_loss: 0.9950, test_f1: 0.4767
 epoch: 3, train_loss: 1.0500, test_loss: 0.9654, test_f1: 0.4875
 epoch: 4, train_loss: 1.0155, test_loss: 0.9920, test_f1: 0.4415
 epoch: 5, train_loss: 0.9963, test_loss: 0.9291, test_f1: 0.5078
 epoch: 6, train_loss: 0.9678, test_loss: 0.9246, test_f1: 0.5139
 epoch: 7, train_loss: 0.9515, test_loss: 1.0118, test_f1: 0.4634
 epoch: 8, train_loss: 0.9406, test_loss: 0.9836, test_f1: 0.4906
 epoch: 9, train_loss: 0.9233, test_loss: 1.0474, test_f1: 0.4703
 epoch: 10, train_loss: 0.9159, test_loss: 0.9643, test_f1: 0.5376
 epoch: 11, train_loss: 0.9002, test_loss: 1.0060, test_f1: 0.5212
 epoch: 12, train_loss: 0.8752, test_loss: 1.0151, test_f1: 0.5368
 epoch: 13, train_loss: 0.8742, test_loss: 0.9922, test_f1: 0.5184
 epoch: 14, train_loss: 0.8671, test_loss: 1.0092, test_f1: 0.5503
 epoch: 15, train_loss: 0.8671, test_loss: 1.1759, test_f1: 0.5268
 epoch: 16, train_loss: 0.8561, test_loss: 1.0867, test_f1: 0.5383
 epoch: 17, train_loss: 0.8432, test_loss: 1.0618, test_f1: 0.5467
 epoch: 18, train_loss: 0.8241, test_loss: 1.0957, test_f1: 0.5300
 epoch: 19, train_loss: 0.8004, test_loss: 1.0405, test_f1: 0.5588
 epoch: 20, train_loss: 0.8081, test_loss: 1.1205, test_f1: 0.5284
 epoch: 21, train_loss: 0.8067, test_loss: 1.1183, test_f1: 0.5299
 epoch: 22, train_loss: 0.7818, test_loss: 1.1413, test_f1: 0.5276
 epoch: 23, train_loss: 0.7792, test_loss: 1.1388, test_f1: 0.5370
 epoch: 24, train_loss: 0.7570, test_loss: 1.0493, test_f1: 0.5846
 epoch: 25, train_loss: 0.7857, test_loss: 1.0872, test_f1: 0.5733
 epoch: 26, train_loss: 0.8021, test_loss: 1.1291, test_f1: 0.5292
 epoch: 27, train_loss: 0.7847, test_loss: 1.1325, test_f1: 0.5519
 epoch: 28, train_loss: 0.7591, test_loss: 1.0283, test_f1: 0.5658
 epoch: 29, train_loss: 0.7643, test_loss: 1.0551, test_f1: 0.5617
 epoch: 30, train_loss: 0.7386, test_loss: 1.1042, test_f1: 0.5648
 epoch: 31, train_loss: 0.7244, test_loss: 1.1589, test_f1: 0.5346
 epoch: 32, train_loss: 0.7247, test_loss: 1.0355, test_f1: 0.5808
 epoch: 33, train_loss: 0.7578, test_loss: 0.9580, test_f1: 0.5722
 epoch: 34, train_loss: 0.7290, test_loss: 1.0261, test_f1: 0.5573
 epoch: 35, train_loss: 0.7133, test_loss: 1.0296, test_f1: 0.5738
 epoch: 36, train_loss: 0.6856, test_loss: 1.0788, test_f1: 0.5635
 epoch: 37, train_loss: 0.6890, test_loss: 1.1773, test_f1: 0.4845
 epoch: 38, train_loss: 0.6690, test_loss: 1.0443, test_f1: 0.5548
 epoch: 39, train_loss: 0.6669, test_loss: 0.9916, test_f1: 0.5711
 epoch: 40, train_loss: 0.7111, test_loss: 1.0385, test_f1: 0.5487
 epoch: 41, train_loss: 0.6793, test_loss: 1.0553, test_f1: 0.5613
 epoch: 42, train_loss: 0.6734, test_loss: 1.0729, test_f1: 0.5372
 epoch: 43, train_loss: 0.6384, test_loss: 1.1176, test_f1: 0.5593
 epoch: 44, train_loss: 0.6583, test_loss: 1.1004, test_f1: 0.5573
 epoch: 45, train_loss: 0.6421, test_loss: 1.0938, test_f1: 0.5526
 epoch: 46, train_loss: 0.6238, test_loss: 1.0763, test_f1: 0.5762
 epoch: 47, train_loss: 0.6635, test_loss: 1.0529, test_f1: 0.5374
 epoch: 48, train_loss: 0.6465, test_loss: 1.1358, test_f1: 0.5447
 epoch: 49, train_loss: 0.6191, test_loss: 1.0363, test_f1: 0.5879
 epoch: 50, train_loss: 0.6119, test_loss: 1.1924, test_f1: 0.5658
 epoch: 51, train_loss: 0.5661, test_loss: 1.0962, test_f1: 0.5694
 epoch: 52, train_loss: 0.5493, test_loss: 1.1668, test_f1: 0.5787
 epoch: 53, train_loss: 0.5467, test_loss: 1.2033, test_f1: 0.5808
 epoch: 54, train_loss: 0.5313, test_loss: 1.2225, test_f1: 0.5580
 epoch: 55, train_loss: 0.5470, test_loss: 1.1664, test_f1: 0.5773
 epoch: 56, train_loss: 0.5452, test_loss: 1.1694, test_f1: 0.5756
 epoch: 57, train_loss: 0.5375, test_loss: 1.2598, test_f1: 0.5673
 epoch: 58, train_loss: 0.5874, test_loss: 1.2956, test_f1: 0.5551
 epoch: 59, train_loss: 0.5347, test_loss: 1.2986, test_f1: 0.5617
 epoch: 60, train_loss: 0.5257, test_loss: 1.3689, test_f1: 0.5565
 epoch: 61, train_loss: 0.5172, test_loss: 1.3152, test_f1: 0.5685
 epoch: 62, train_loss: 0.5120, test_loss: 1.2685, test_f1: 0.5935
 epoch: 63, train_loss: 0.4917, test_loss: 1.3978, test_f1: 0.5654
 epoch: 64, train_loss: 0.5125, test_loss: 1.3046, test_f1: 0.5822
 epoch: 65, train_loss: 0.5006, test_loss: 1.2801, test_f1: 0.5801
 epoch: 66, train_loss: 0.5024, test_loss: 1.3432, test_f1: 0.5811
 epoch: 67, train_loss: 0.4797, test_loss: 1.4066, test_f1: 0.5579
 epoch: 68, train_loss: 0.4845, test_loss: 1.3126, test_f1: 0.5607
 epoch: 69, train_loss: 0.4837, test_loss: 1.3410, test_f1: 0.5583
 epoch: 70, train_loss: 0.4621, test_loss: 1.4168, test_f1: 0.5726
 epoch: 71, train_loss: 0.4417, test_loss: 1.4557, test_f1: 0.5594
 epoch: 72, train_loss: 0.4372, test_loss: 1.5071, test_f1: 0.5750
 epoch: 73, train_loss: 0.4902, test_loss: 1.3744, test_f1: 0.5637
 epoch: 74, train_loss: 0.4848, test_loss: 1.3715, test_f1: 0.5632
 epoch: 75, train_loss: 0.4624, test_loss: 1.4713, test_f1: 0.5574
 epoch: 76, train_loss: 0.4628, test_loss: 1.5335, test_f1: 0.5501
 epoch: 77, train_loss: 0.4708, test_loss: 1.3970, test_f1: 0.5592
 epoch: 78, train_loss: 0.4638, test_loss: 1.3492, test_f1: 0.5856
 epoch: 79, train_loss: 0.4529, test_loss: 1.4552, test_f1: 0.5619
 epoch: 80, train_loss: 0.4360, test_loss: 1.3689, test_f1: 0.5563
 epoch: 81, train_loss: 0.4285, test_loss: 1.3624, test_f1: 0.5909
 epoch: 82, train_loss: 0.4306, test_loss: 1.4021, test_f1: 0.5709
 epoch: 83, train_loss: 0.4434, test_loss: 1.5059, test_f1: 0.5540
 epoch: 84, train_loss: 0.4250, test_loss: 1.4512, test_f1: 0.5527
 epoch: 85, train_loss: 0.4285, test_loss: 1.4642, test_f1: 0.5702
 epoch: 86, train_loss: 0.4304, test_loss: 1.4125, test_f1: 0.5496
 epoch: 87, train_loss: 0.4279, test_loss: 1.4959, test_f1: 0.5492
 epoch: 88, train_loss: 0.4388, test_loss: 1.4480, test_f1: 0.5639
 epoch: 89, train_loss: 0.4232, test_loss: 1.4802, test_f1: 0.5498
 epoch: 90, train_loss: 0.4052, test_loss: 1.4799, test_f1: 0.5247
 epoch: 91, train_loss: 0.4116, test_loss: 1.4645, test_f1: 0.5449
 epoch: 92, train_loss: 0.4208, test_loss: 1.4986, test_f1: 0.5615
 epoch: 93, train_loss: 0.3988, test_loss: 1.4919, test_f1: 0.5572
 epoch: 94, train_loss: 0.3990, test_loss: 1.5326, test_f1: 0.5563
 epoch: 95, train_loss: 0.4144, test_loss: 1.6740, test_f1: 0.5379
 epoch: 96, train_loss: 0.4034, test_loss: 1.7439, test_f1: 0.5495
 epoch: 97, train_loss: 0.3848, test_loss: 1.6298, test_f1: 0.5559
 epoch: 98, train_loss: 0.3658, test_loss: 1.5787, test_f1: 0.5626
 epoch: 99, train_loss: 0.4029, test_loss: 1.7071, test_f1: 0.5697
##################ITERATION #4 ****************************************
 epoch: 0, train_loss: 1.3125, test_loss: 1.0902, test_f1: 0.4324
 epoch: 1, train_loss: 1.1161, test_loss: 1.0370, test_f1: 0.4413
 epoch: 2, train_loss: 1.0798, test_loss: 1.0024, test_f1: 0.4591
 epoch: 3, train_loss: 1.0531, test_loss: 0.9843, test_f1: 0.4698
 epoch: 4, train_loss: 1.0322, test_loss: 1.0225, test_f1: 0.4390
 epoch: 5, train_loss: 1.0098, test_loss: 0.9917, test_f1: 0.4422
 epoch: 6, train_loss: 0.9847, test_loss: 0.9815, test_f1: 0.4559
 epoch: 7, train_loss: 0.9641, test_loss: 0.9851, test_f1: 0.5027
 epoch: 8, train_loss: 0.9725, test_loss: 0.9598, test_f1: 0.4927
 epoch: 9, train_loss: 0.9416, test_loss: 0.9680, test_f1: 0.5003
 epoch: 10, train_loss: 0.9373, test_loss: 0.9690, test_f1: 0.4957
 epoch: 11, train_loss: 0.9065, test_loss: 0.9915, test_f1: 0.4747
 epoch: 12, train_loss: 0.9123, test_loss: 0.9694, test_f1: 0.5324
 epoch: 13, train_loss: 0.8818, test_loss: 0.9436, test_f1: 0.5219
 epoch: 14, train_loss: 0.8642, test_loss: 0.9899, test_f1: 0.5140
 epoch: 15, train_loss: 0.8580, test_loss: 1.0366, test_f1: 0.5045
 epoch: 16, train_loss: 0.8798, test_loss: 0.9597, test_f1: 0.5014
 epoch: 17, train_loss: 0.8537, test_loss: 1.0678, test_f1: 0.4819
 epoch: 18, train_loss: 0.8236, test_loss: 0.9795, test_f1: 0.5326
 epoch: 19, train_loss: 0.8427, test_loss: 0.9993, test_f1: 0.5552
 epoch: 20, train_loss: 0.8120, test_loss: 1.0176, test_f1: 0.5445
 epoch: 21, train_loss: 0.7956, test_loss: 1.0845, test_f1: 0.5510
 epoch: 22, train_loss: 0.7891, test_loss: 1.0557, test_f1: 0.5284
 epoch: 23, train_loss: 0.7834, test_loss: 1.0949, test_f1: 0.5355
 epoch: 24, train_loss: 0.8138, test_loss: 1.1454, test_f1: 0.5203
 epoch: 25, train_loss: 0.7743, test_loss: 1.0922, test_f1: 0.5238
 epoch: 26, train_loss: 0.7451, test_loss: 1.0894, test_f1: 0.5324
 epoch: 27, train_loss: 0.7927, test_loss: 1.0836, test_f1: 0.5450
 epoch: 28, train_loss: 0.7643, test_loss: 1.1004, test_f1: 0.5388
 epoch: 29, train_loss: 0.7582, test_loss: 1.1463, test_f1: 0.5291
 epoch: 30, train_loss: 0.7328, test_loss: 1.1342, test_f1: 0.5267
 epoch: 31, train_loss: 0.7252, test_loss: 1.2162, test_f1: 0.5207
 epoch: 32, train_loss: 0.7765, test_loss: 1.0980, test_f1: 0.5735
 epoch: 33, train_loss: 0.7109, test_loss: 1.1785, test_f1: 0.5277
 epoch: 34, train_loss: 0.7309, test_loss: 1.1966, test_f1: 0.5185
 epoch: 35, train_loss: 0.7323, test_loss: 1.0968, test_f1: 0.5233
 epoch: 36, train_loss: 0.6976, test_loss: 1.1419, test_f1: 0.5339
 epoch: 37, train_loss: 0.6889, test_loss: 1.1544, test_f1: 0.5408
 epoch: 38, train_loss: 0.6998, test_loss: 1.1903, test_f1: 0.5510
 epoch: 39, train_loss: 0.6747, test_loss: 1.1531, test_f1: 0.5499
 epoch: 40, train_loss: 0.6911, test_loss: 1.2036, test_f1: 0.5310
 epoch: 41, train_loss: 0.6731, test_loss: 1.2365, test_f1: 0.5384
 epoch: 42, train_loss: 0.6517, test_loss: 1.2209, test_f1: 0.5149
 epoch: 43, train_loss: 0.6452, test_loss: 1.2449, test_f1: 0.5183
 epoch: 44, train_loss: 0.6642, test_loss: 1.1919, test_f1: 0.5241
 epoch: 45, train_loss: 0.6295, test_loss: 1.2182, test_f1: 0.5355
 epoch: 46, train_loss: 0.6109, test_loss: 1.2231, test_f1: 0.5415
 epoch: 47, train_loss: 0.6124, test_loss: 1.2650, test_f1: 0.5213
 epoch: 48, train_loss: 0.6246, test_loss: 1.2583, test_f1: 0.5328
 epoch: 49, train_loss: 0.5968, test_loss: 1.2205, test_f1: 0.5538
 epoch: 50, train_loss: 0.6156, test_loss: 1.3560, test_f1: 0.5079
 epoch: 51, train_loss: 0.5661, test_loss: 1.3389, test_f1: 0.5392
 epoch: 52, train_loss: 0.5450, test_loss: 1.2846, test_f1: 0.5518
 epoch: 53, train_loss: 0.5229, test_loss: 1.3866, test_f1: 0.5315
 epoch: 54, train_loss: 0.5545, test_loss: 1.4020, test_f1: 0.5360
 epoch: 55, train_loss: 0.5343, test_loss: 1.3103, test_f1: 0.5680
 epoch: 56, train_loss: 0.5058, test_loss: 1.4319, test_f1: 0.5301
 epoch: 57, train_loss: 0.5132, test_loss: 1.4101, test_f1: 0.5364
 epoch: 58, train_loss: 0.5040, test_loss: 1.4692, test_f1: 0.5330
 epoch: 59, train_loss: 0.4929, test_loss: 1.4526, test_f1: 0.5479
 epoch: 60, train_loss: 0.4913, test_loss: 1.4660, test_f1: 0.5466
 epoch: 61, train_loss: 0.4761, test_loss: 1.4948, test_f1: 0.5160
 epoch: 62, train_loss: 0.4829, test_loss: 1.3746, test_f1: 0.5516
 epoch: 63, train_loss: 0.4723, test_loss: 1.3959, test_f1: 0.5498
 epoch: 64, train_loss: 0.4696, test_loss: 1.4838, test_f1: 0.4941
 epoch: 65, train_loss: 0.4646, test_loss: 1.4701, test_f1: 0.5336
 epoch: 66, train_loss: 0.4773, test_loss: 1.4472, test_f1: 0.5586
 epoch: 67, train_loss: 0.4478, test_loss: 1.5276, test_f1: 0.5468
 epoch: 68, train_loss: 0.4582, test_loss: 1.5923, test_f1: 0.5457
 epoch: 69, train_loss: 0.4441, test_loss: 1.4940, test_f1: 0.5366
 epoch: 70, train_loss: 0.4461, test_loss: 1.5250, test_f1: 0.5597
 epoch: 71, train_loss: 0.4403, test_loss: 1.4403, test_f1: 0.5502
 epoch: 72, train_loss: 0.4430, test_loss: 1.4895, test_f1: 0.5483
 epoch: 73, train_loss: 0.4528, test_loss: 1.5806, test_f1: 0.5619
 epoch: 74, train_loss: 0.4186, test_loss: 1.5837, test_f1: 0.5519
 epoch: 75, train_loss: 0.4525, test_loss: 1.6272, test_f1: 0.5254
 epoch: 76, train_loss: 0.4266, test_loss: 1.5753, test_f1: 0.5514
 epoch: 77, train_loss: 0.4166, test_loss: 1.7362, test_f1: 0.5468
 epoch: 78, train_loss: 0.4687, test_loss: 1.4777, test_f1: 0.5224
 epoch: 79, train_loss: 0.4367, test_loss: 1.5663, test_f1: 0.5211
 epoch: 80, train_loss: 0.4009, test_loss: 1.5198, test_f1: 0.5693
 epoch: 81, train_loss: 0.4021, test_loss: 1.6048, test_f1: 0.5457
 epoch: 82, train_loss: 0.3893, test_loss: 1.6271, test_f1: 0.5516
 epoch: 83, train_loss: 0.3988, test_loss: 1.4907, test_f1: 0.5789
 epoch: 84, train_loss: 0.4192, test_loss: 1.5976, test_f1: 0.5387
 epoch: 85, train_loss: 0.4123, test_loss: 1.5843, test_f1: 0.5651
 epoch: 86, train_loss: 0.4238, test_loss: 1.5557, test_f1: 0.5744
 epoch: 87, train_loss: 0.3780, test_loss: 1.6254, test_f1: 0.5538
 epoch: 88, train_loss: 0.3816, test_loss: 1.5546, test_f1: 0.5627
 epoch: 89, train_loss: 0.3931, test_loss: 1.5893, test_f1: 0.5577
 epoch: 90, train_loss: 0.3893, test_loss: 1.7020, test_f1: 0.5301
 epoch: 91, train_loss: 0.3777, test_loss: 1.7280, test_f1: 0.5386
 epoch: 92, train_loss: 0.3850, test_loss: 1.6965, test_f1: 0.5538
 epoch: 93, train_loss: 0.3701, test_loss: 1.6915, test_f1: 0.5368
 epoch: 94, train_loss: 0.3929, test_loss: 1.5978, test_f1: 0.5659
 epoch: 95, train_loss: 0.3810, test_loss: 1.6104, test_f1: 0.5515
 epoch: 96, train_loss: 0.3731, test_loss: 1.4846, test_f1: 0.5833
 epoch: 97, train_loss: 0.4463, test_loss: 1.5614, test_f1: 0.5471
 epoch: 98, train_loss: 0.3770, test_loss: 1.6106, test_f1: 0.5602
 epoch: 99, train_loss: 0.3831, test_loss: 1.5443, test_f1: 0.5435
##################ITERATION #5 ****************************************
 epoch: 0, train_loss: 1.2970, test_loss: 1.1460, test_f1: 0.4186
 epoch: 1, train_loss: 1.1236, test_loss: 1.0412, test_f1: 0.4603
 epoch: 2, train_loss: 1.0848, test_loss: 1.0474, test_f1: 0.4222
 epoch: 3, train_loss: 1.0603, test_loss: 0.9877, test_f1: 0.5041
 epoch: 4, train_loss: 1.0144, test_loss: 1.0136, test_f1: 0.4647
 epoch: 5, train_loss: 1.0075, test_loss: 0.9743, test_f1: 0.4529
 epoch: 6, train_loss: 0.9857, test_loss: 0.9818, test_f1: 0.4858
 epoch: 7, train_loss: 0.9715, test_loss: 0.9621, test_f1: 0.4682
 epoch: 8, train_loss: 0.9683, test_loss: 1.0273, test_f1: 0.4958
 epoch: 9, train_loss: 0.9353, test_loss: 0.9413, test_f1: 0.5123
 epoch: 10, train_loss: 0.9150, test_loss: 0.9373, test_f1: 0.5290
 epoch: 11, train_loss: 0.9099, test_loss: 1.0213, test_f1: 0.4835
 epoch: 12, train_loss: 0.8881, test_loss: 0.9002, test_f1: 0.5247
 epoch: 13, train_loss: 0.8698, test_loss: 0.9158, test_f1: 0.5069
 epoch: 14, train_loss: 0.8792, test_loss: 0.9699, test_f1: 0.5189
 epoch: 15, train_loss: 0.8619, test_loss: 1.0349, test_f1: 0.5104
 epoch: 16, train_loss: 0.9019, test_loss: 0.9648, test_f1: 0.5229
 epoch: 17, train_loss: 0.8506, test_loss: 1.0438, test_f1: 0.5368
 epoch: 18, train_loss: 0.8428, test_loss: 1.0350, test_f1: 0.5087
 epoch: 19, train_loss: 0.8363, test_loss: 0.9901, test_f1: 0.5259
 epoch: 20, train_loss: 0.8142, test_loss: 1.0249, test_f1: 0.5321
 epoch: 21, train_loss: 0.7900, test_loss: 1.0740, test_f1: 0.5461
 epoch: 22, train_loss: 0.7789, test_loss: 1.0202, test_f1: 0.5356
 epoch: 23, train_loss: 0.7951, test_loss: 1.0596, test_f1: 0.5450
 epoch: 24, train_loss: 0.7998, test_loss: 1.0420, test_f1: 0.5299
 epoch: 25, train_loss: 0.7822, test_loss: 1.1157, test_f1: 0.5478
 epoch: 26, train_loss: 0.7734, test_loss: 1.1125, test_f1: 0.5239
 epoch: 27, train_loss: 0.7800, test_loss: 1.0592, test_f1: 0.5204
 epoch: 28, train_loss: 0.7566, test_loss: 1.0446, test_f1: 0.5494
 epoch: 29, train_loss: 0.7498, test_loss: 1.1375, test_f1: 0.5204
 epoch: 30, train_loss: 0.7314, test_loss: 1.0060, test_f1: 0.5464
 epoch: 31, train_loss: 0.7271, test_loss: 1.0585, test_f1: 0.5261
 epoch: 32, train_loss: 0.7341, test_loss: 1.0519, test_f1: 0.5368
 epoch: 33, train_loss: 0.7097, test_loss: 1.0859, test_f1: 0.5578
 epoch: 34, train_loss: 0.7269, test_loss: 1.0867, test_f1: 0.5459
 epoch: 35, train_loss: 0.6999, test_loss: 1.1245, test_f1: 0.5647
 epoch: 36, train_loss: 0.7144, test_loss: 1.1745, test_f1: 0.5629
 epoch: 37, train_loss: 0.6996, test_loss: 1.1257, test_f1: 0.5774
 epoch: 38, train_loss: 0.6994, test_loss: 1.1010, test_f1: 0.5666
 epoch: 39, train_loss: 0.6828, test_loss: 1.1412, test_f1: 0.5518
 epoch: 40, train_loss: 0.7065, test_loss: 1.1135, test_f1: 0.5568
 epoch: 41, train_loss: 0.6667, test_loss: 1.2079, test_f1: 0.5457
 epoch: 42, train_loss: 0.6800, test_loss: 1.1577, test_f1: 0.5509
 epoch: 43, train_loss: 0.6659, test_loss: 1.0934, test_f1: 0.5688
 epoch: 44, train_loss: 0.6578, test_loss: 1.1481, test_f1: 0.5402
 epoch: 45, train_loss: 0.7244, test_loss: 1.1221, test_f1: 0.5654
 epoch: 46, train_loss: 0.6831, test_loss: 1.0189, test_f1: 0.5566
 epoch: 47, train_loss: 0.6567, test_loss: 1.0994, test_f1: 0.5747
 epoch: 48, train_loss: 0.6349, test_loss: 1.1513, test_f1: 0.5647
 epoch: 49, train_loss: 0.6259, test_loss: 1.0951, test_f1: 0.5437
 epoch: 50, train_loss: 0.6480, test_loss: 1.0133, test_f1: 0.5696
 epoch: 51, train_loss: 0.5818, test_loss: 1.0746, test_f1: 0.5721
 epoch: 52, train_loss: 0.5552, test_loss: 1.1291, test_f1: 0.5661
 epoch: 53, train_loss: 0.5482, test_loss: 1.2573, test_f1: 0.5346
 epoch: 54, train_loss: 0.5471, test_loss: 1.1728, test_f1: 0.5462
 epoch: 55, train_loss: 0.5457, test_loss: 1.1468, test_f1: 0.5880
 epoch: 56, train_loss: 0.5346, test_loss: 1.2233, test_f1: 0.5353
 epoch: 57, train_loss: 0.5314, test_loss: 1.1541, test_f1: 0.5698
 epoch: 58, train_loss: 0.5194, test_loss: 1.3397, test_f1: 0.5397
 epoch: 59, train_loss: 0.5155, test_loss: 1.2980, test_f1: 0.5382
 epoch: 60, train_loss: 0.5128, test_loss: 1.2199, test_f1: 0.5520
 epoch: 61, train_loss: 0.5034, test_loss: 1.2583, test_f1: 0.5694
 epoch: 62, train_loss: 0.5002, test_loss: 1.3388, test_f1: 0.5460
 epoch: 63, train_loss: 0.5026, test_loss: 1.2932, test_f1: 0.5668
 epoch: 64, train_loss: 0.4879, test_loss: 1.2848, test_f1: 0.5643
 epoch: 65, train_loss: 0.4843, test_loss: 1.3762, test_f1: 0.5403
 epoch: 66, train_loss: 0.4780, test_loss: 1.2981, test_f1: 0.5650
 epoch: 67, train_loss: 0.4811, test_loss: 1.4573, test_f1: 0.5384
 epoch: 68, train_loss: 0.4825, test_loss: 1.4574, test_f1: 0.5264
 epoch: 69, train_loss: 0.4697, test_loss: 1.3479, test_f1: 0.5533
 epoch: 70, train_loss: 0.4624, test_loss: 1.4154, test_f1: 0.5409
 epoch: 71, train_loss: 0.4613, test_loss: 1.4003, test_f1: 0.5462
 epoch: 72, train_loss: 0.4606, test_loss: 1.3161, test_f1: 0.5685
 epoch: 73, train_loss: 0.4613, test_loss: 1.3571, test_f1: 0.5537
 epoch: 74, train_loss: 0.4528, test_loss: 1.3065, test_f1: 0.5526
 epoch: 75, train_loss: 0.4409, test_loss: 1.3874, test_f1: 0.5547
 epoch: 76, train_loss: 0.4347, test_loss: 1.3827, test_f1: 0.5536
 epoch: 77, train_loss: 0.4310, test_loss: 1.3601, test_f1: 0.5629
 epoch: 78, train_loss: 0.4219, test_loss: 1.3941, test_f1: 0.5647
 epoch: 79, train_loss: 0.4493, test_loss: 1.3263, test_f1: 0.5747
 epoch: 80, train_loss: 0.4174, test_loss: 1.3670, test_f1: 0.5625
 epoch: 81, train_loss: 0.4260, test_loss: 1.3758, test_f1: 0.5664
 epoch: 82, train_loss: 0.4322, test_loss: 1.4974, test_f1: 0.5659
 epoch: 83, train_loss: 0.4211, test_loss: 1.3559, test_f1: 0.5723
 epoch: 84, train_loss: 0.4126, test_loss: 1.4897, test_f1: 0.5461
 epoch: 85, train_loss: 0.4014, test_loss: 1.5269, test_f1: 0.5404
 epoch: 86, train_loss: 0.4143, test_loss: 1.5762, test_f1: 0.5258
 epoch: 87, train_loss: 0.4147, test_loss: 1.5891, test_f1: 0.5499
 epoch: 88, train_loss: 0.3745, test_loss: 1.5805, test_f1: 0.5463
 epoch: 89, train_loss: 0.4004, test_loss: 1.5800, test_f1: 0.5443
 epoch: 90, train_loss: 0.4256, test_loss: 1.4909, test_f1: 0.5512
 epoch: 91, train_loss: 0.4128, test_loss: 1.4448, test_f1: 0.5737
 epoch: 92, train_loss: 0.3695, test_loss: 1.5253, test_f1: 0.5652
 epoch: 93, train_loss: 0.4065, test_loss: 1.4925, test_f1: 0.5769
 epoch: 94, train_loss: 0.3861, test_loss: 1.4816, test_f1: 0.5856
 epoch: 95, train_loss: 0.3853, test_loss: 1.5027, test_f1: 0.5650
 epoch: 96, train_loss: 0.3719, test_loss: 1.5405, test_f1: 0.5620
 epoch: 97, train_loss: 0.3760, test_loss: 1.4675, test_f1: 0.5707
 epoch: 98, train_loss: 0.3583, test_loss: 1.5281, test_f1: 0.5592
 epoch: 99, train_loss: 0.3709, test_loss: 1.7748, test_f1: 0.5269
##################ITERATION #6 ****************************************
 epoch: 0, train_loss: 1.2891, test_loss: 1.0963, test_f1: 0.4211
 epoch: 1, train_loss: 1.1109, test_loss: 1.0126, test_f1: 0.4595
 epoch: 2, train_loss: 1.0555, test_loss: 0.9825, test_f1: 0.5118
 epoch: 3, train_loss: 1.0307, test_loss: 0.9666, test_f1: 0.4864
 epoch: 4, train_loss: 1.0020, test_loss: 0.9911, test_f1: 0.4482
 epoch: 5, train_loss: 0.9964, test_loss: 0.9831, test_f1: 0.4751
 epoch: 6, train_loss: 0.9682, test_loss: 1.0159, test_f1: 0.4850
 epoch: 7, train_loss: 0.9435, test_loss: 0.9885, test_f1: 0.5271
 epoch: 8, train_loss: 0.9294, test_loss: 0.9287, test_f1: 0.5073
 epoch: 9, train_loss: 0.9065, test_loss: 1.0031, test_f1: 0.5228
 epoch: 10, train_loss: 0.9272, test_loss: 1.0448, test_f1: 0.4885
 epoch: 11, train_loss: 0.9194, test_loss: 1.0105, test_f1: 0.5121
 epoch: 12, train_loss: 0.8812, test_loss: 0.9160, test_f1: 0.5271
 epoch: 13, train_loss: 0.8775, test_loss: 1.0193, test_f1: 0.5235
 epoch: 14, train_loss: 0.8666, test_loss: 0.9682, test_f1: 0.5270
 epoch: 15, train_loss: 0.8550, test_loss: 0.9399, test_f1: 0.5398
 epoch: 16, train_loss: 0.8305, test_loss: 1.0064, test_f1: 0.5666
 epoch: 17, train_loss: 0.8362, test_loss: 1.2061, test_f1: 0.4804
 epoch: 18, train_loss: 0.8215, test_loss: 1.0016, test_f1: 0.5488
 epoch: 19, train_loss: 0.8213, test_loss: 0.9997, test_f1: 0.5496
 epoch: 20, train_loss: 0.8068, test_loss: 0.9865, test_f1: 0.5526
 epoch: 21, train_loss: 0.7804, test_loss: 1.0823, test_f1: 0.5605
 epoch: 22, train_loss: 0.7767, test_loss: 1.0897, test_f1: 0.5326
 epoch: 23, train_loss: 0.7899, test_loss: 1.0375, test_f1: 0.5256
 epoch: 24, train_loss: 0.7885, test_loss: 1.0016, test_f1: 0.5597
 epoch: 25, train_loss: 0.7612, test_loss: 1.0720, test_f1: 0.5305
 epoch: 26, train_loss: 0.7816, test_loss: 1.0912, test_f1: 0.5365
 epoch: 27, train_loss: 0.7520, test_loss: 1.0492, test_f1: 0.5578
 epoch: 28, train_loss: 0.7382, test_loss: 1.0891, test_f1: 0.5240
 epoch: 29, train_loss: 0.7355, test_loss: 1.0249, test_f1: 0.5435
 epoch: 30, train_loss: 0.7308, test_loss: 1.1242, test_f1: 0.5515
 epoch: 31, train_loss: 0.7369, test_loss: 1.0913, test_f1: 0.5425
 epoch: 32, train_loss: 0.7049, test_loss: 1.1437, test_f1: 0.5404
 epoch: 33, train_loss: 0.6993, test_loss: 1.1279, test_f1: 0.5427
 epoch: 34, train_loss: 0.7082, test_loss: 1.1141, test_f1: 0.5594
 epoch: 35, train_loss: 0.6969, test_loss: 1.0822, test_f1: 0.5767
 epoch: 36, train_loss: 0.6803, test_loss: 1.0890, test_f1: 0.5663
 epoch: 37, train_loss: 0.6839, test_loss: 1.0942, test_f1: 0.5730
 epoch: 38, train_loss: 0.6871, test_loss: 1.1144, test_f1: 0.5557
 epoch: 39, train_loss: 0.6709, test_loss: 1.1600, test_f1: 0.5241
 epoch: 40, train_loss: 0.6825, test_loss: 1.0545, test_f1: 0.5215
 epoch: 41, train_loss: 0.6715, test_loss: 1.1080, test_f1: 0.5343
 epoch: 42, train_loss: 0.6530, test_loss: 1.1445, test_f1: 0.5213
 epoch: 43, train_loss: 0.6377, test_loss: 1.1059, test_f1: 0.5375
 epoch: 44, train_loss: 0.6417, test_loss: 1.1847, test_f1: 0.5386
 epoch: 45, train_loss: 0.6478, test_loss: 1.1837, test_f1: 0.5298
 epoch: 46, train_loss: 0.6313, test_loss: 1.1956, test_f1: 0.5383
 epoch: 47, train_loss: 0.6191, test_loss: 1.1530, test_f1: 0.5342
 epoch: 48, train_loss: 0.6457, test_loss: 1.2536, test_f1: 0.5085
 epoch: 49, train_loss: 0.6241, test_loss: 1.1986, test_f1: 0.5077
 epoch: 50, train_loss: 0.6374, test_loss: 1.2146, test_f1: 0.5235
 epoch: 51, train_loss: 0.5853, test_loss: 1.2411, test_f1: 0.5340
 epoch: 52, train_loss: 0.5667, test_loss: 1.1924, test_f1: 0.5238
 epoch: 53, train_loss: 0.5559, test_loss: 1.2645, test_f1: 0.5403
 epoch: 54, train_loss: 0.5530, test_loss: 1.1740, test_f1: 0.5580
 epoch: 55, train_loss: 0.5341, test_loss: 1.2529, test_f1: 0.5493
 epoch: 56, train_loss: 0.5490, test_loss: 1.3119, test_f1: 0.5460
 epoch: 57, train_loss: 0.5522, test_loss: 1.3074, test_f1: 0.5458
 epoch: 58, train_loss: 0.5135, test_loss: 1.3020, test_f1: 0.5368
 epoch: 59, train_loss: 0.4967, test_loss: 1.3122, test_f1: 0.5463
 epoch: 60, train_loss: 0.5116, test_loss: 1.2991, test_f1: 0.5499
 epoch: 61, train_loss: 0.4891, test_loss: 1.2505, test_f1: 0.5568
 epoch: 62, train_loss: 0.4964, test_loss: 1.3418, test_f1: 0.5520
 epoch: 63, train_loss: 0.5006, test_loss: 1.3719, test_f1: 0.5528
 epoch: 64, train_loss: 0.5003, test_loss: 1.4108, test_f1: 0.5594
 epoch: 65, train_loss: 0.4956, test_loss: 1.2903, test_f1: 0.5696
 epoch: 66, train_loss: 0.4959, test_loss: 1.3809, test_f1: 0.5673
 epoch: 67, train_loss: 0.4844, test_loss: 1.3419, test_f1: 0.5707
 epoch: 68, train_loss: 0.4920, test_loss: 1.3162, test_f1: 0.5386
 epoch: 69, train_loss: 0.4789, test_loss: 1.3487, test_f1: 0.5494
 epoch: 70, train_loss: 0.4745, test_loss: 1.3727, test_f1: 0.5564
 epoch: 71, train_loss: 0.4662, test_loss: 1.4797, test_f1: 0.5555
 epoch: 72, train_loss: 0.4781, test_loss: 1.3677, test_f1: 0.5615
 epoch: 73, train_loss: 0.4343, test_loss: 1.3822, test_f1: 0.5862
 epoch: 74, train_loss: 0.4426, test_loss: 1.3312, test_f1: 0.5655
 epoch: 75, train_loss: 0.4513, test_loss: 1.3091, test_f1: 0.5627
 epoch: 76, train_loss: 0.4442, test_loss: 1.3071, test_f1: 0.5523
 epoch: 77, train_loss: 0.4380, test_loss: 1.4827, test_f1: 0.5374
 epoch: 78, train_loss: 0.4412, test_loss: 1.4759, test_f1: 0.5556
 epoch: 79, train_loss: 0.4426, test_loss: 1.4392, test_f1: 0.5390
 epoch: 80, train_loss: 0.4369, test_loss: 1.4352, test_f1: 0.5447
 epoch: 81, train_loss: 0.4255, test_loss: 1.4099, test_f1: 0.5584
 epoch: 82, train_loss: 0.4449, test_loss: 1.2806, test_f1: 0.5581
 epoch: 83, train_loss: 0.4371, test_loss: 1.3729, test_f1: 0.5458
 epoch: 84, train_loss: 0.4253, test_loss: 1.7263, test_f1: 0.5227
 epoch: 85, train_loss: 0.4134, test_loss: 1.6354, test_f1: 0.5094
 epoch: 86, train_loss: 0.4171, test_loss: 1.4683, test_f1: 0.5600
 epoch: 87, train_loss: 0.4210, test_loss: 1.4194, test_f1: 0.5508
 epoch: 88, train_loss: 0.4440, test_loss: 1.3987, test_f1: 0.5415
 epoch: 89, train_loss: 0.4180, test_loss: 1.3460, test_f1: 0.5716
 epoch: 90, train_loss: 0.4016, test_loss: 1.3633, test_f1: 0.5463
 epoch: 91, train_loss: 0.3993, test_loss: 1.4301, test_f1: 0.5418
 epoch: 92, train_loss: 0.3886, test_loss: 1.4314, test_f1: 0.5439
 epoch: 93, train_loss: 0.3930, test_loss: 1.5284, test_f1: 0.5521
 epoch: 94, train_loss: 0.5503, test_loss: 1.3777, test_f1: 0.5623
 epoch: 95, train_loss: 0.4664, test_loss: 1.4528, test_f1: 0.5477
 epoch: 96, train_loss: 0.4236, test_loss: 1.4226, test_f1: 0.5664
 epoch: 97, train_loss: 0.4155, test_loss: 1.4211, test_f1: 0.5636
 epoch: 98, train_loss: 0.4053, test_loss: 1.3875, test_f1: 0.5602
 epoch: 99, train_loss: 0.3830, test_loss: 1.4663, test_f1: 0.5426
##################ITERATION #7 ****************************************
 epoch: 0, train_loss: 1.3005, test_loss: 1.1448, test_f1: 0.3701
 epoch: 1, train_loss: 1.1414, test_loss: 1.0992, test_f1: 0.4278
 epoch: 2, train_loss: 1.1009, test_loss: 1.0383, test_f1: 0.4611
 epoch: 3, train_loss: 1.0679, test_loss: 0.9983, test_f1: 0.4408
 epoch: 4, train_loss: 1.0463, test_loss: 1.0202, test_f1: 0.4476
 epoch: 5, train_loss: 1.0185, test_loss: 1.0267, test_f1: 0.4337
 epoch: 6, train_loss: 0.9953, test_loss: 1.0068, test_f1: 0.4714
 epoch: 7, train_loss: 0.9811, test_loss: 0.9583, test_f1: 0.5138
 epoch: 8, train_loss: 0.9695, test_loss: 0.9606, test_f1: 0.4825
 epoch: 9, train_loss: 0.9466, test_loss: 1.0052, test_f1: 0.4939
 epoch: 10, train_loss: 0.9488, test_loss: 0.9595, test_f1: 0.5075
 epoch: 11, train_loss: 0.9204, test_loss: 0.9688, test_f1: 0.4885
 epoch: 12, train_loss: 0.8873, test_loss: 0.9700, test_f1: 0.4873
 epoch: 13, train_loss: 0.8911, test_loss: 1.0455, test_f1: 0.5055
 epoch: 14, train_loss: 0.8854, test_loss: 1.0463, test_f1: 0.5322
 epoch: 15, train_loss: 0.8687, test_loss: 0.9667, test_f1: 0.5499
 epoch: 16, train_loss: 0.8463, test_loss: 1.0132, test_f1: 0.5265
 epoch: 17, train_loss: 0.8441, test_loss: 0.9781, test_f1: 0.5378
 epoch: 18, train_loss: 0.8857, test_loss: 1.0470, test_f1: 0.5349
 epoch: 19, train_loss: 0.8485, test_loss: 0.9863, test_f1: 0.5504
 epoch: 20, train_loss: 0.8183, test_loss: 1.0311, test_f1: 0.5322
 epoch: 21, train_loss: 0.8480, test_loss: 0.9777, test_f1: 0.5557
 epoch: 22, train_loss: 0.8167, test_loss: 1.0106, test_f1: 0.5472
 epoch: 23, train_loss: 0.8180, test_loss: 1.0284, test_f1: 0.5490
 epoch: 24, train_loss: 0.8194, test_loss: 0.9894, test_f1: 0.5325
 epoch: 25, train_loss: 0.7895, test_loss: 1.0056, test_f1: 0.5508
 epoch: 26, train_loss: 0.7866, test_loss: 1.0525, test_f1: 0.5337
 epoch: 27, train_loss: 0.7989, test_loss: 1.0036, test_f1: 0.5278
 epoch: 28, train_loss: 0.8115, test_loss: 1.0432, test_f1: 0.5294
 epoch: 29, train_loss: 0.7713, test_loss: 0.9956, test_f1: 0.5441
 epoch: 30, train_loss: 0.7565, test_loss: 1.0338, test_f1: 0.5508
 epoch: 31, train_loss: 0.7513, test_loss: 1.0324, test_f1: 0.5411
 epoch: 32, train_loss: 0.7393, test_loss: 1.1323, test_f1: 0.5041
 epoch: 33, train_loss: 0.7338, test_loss: 1.0133, test_f1: 0.5604
 epoch: 34, train_loss: 0.7441, test_loss: 1.0083, test_f1: 0.5475
 epoch: 35, train_loss: 0.7358, test_loss: 1.0107, test_f1: 0.5604
 epoch: 36, train_loss: 0.7015, test_loss: 1.0522, test_f1: 0.5476
 epoch: 37, train_loss: 0.7192, test_loss: 1.0566, test_f1: 0.5624
 epoch: 38, train_loss: 0.7316, test_loss: 1.1192, test_f1: 0.5154
 epoch: 39, train_loss: 0.7171, test_loss: 1.0924, test_f1: 0.5313
 epoch: 40, train_loss: 0.7845, test_loss: 1.0920, test_f1: 0.5499
 epoch: 41, train_loss: 0.7296, test_loss: 0.9956, test_f1: 0.5399
 epoch: 42, train_loss: 0.6708, test_loss: 1.1053, test_f1: 0.5401
 epoch: 43, train_loss: 0.6848, test_loss: 1.0520, test_f1: 0.5585
 epoch: 44, train_loss: 0.6765, test_loss: 1.0368, test_f1: 0.5659
 epoch: 45, train_loss: 0.6836, test_loss: 1.1076, test_f1: 0.5031
 epoch: 46, train_loss: 0.6743, test_loss: 1.0831, test_f1: 0.5586
 epoch: 47, train_loss: 0.6738, test_loss: 1.1571, test_f1: 0.5607
 epoch: 48, train_loss: 0.6698, test_loss: 0.9915, test_f1: 0.5438
 epoch: 49, train_loss: 0.7254, test_loss: 1.0269, test_f1: 0.5419
 epoch: 50, train_loss: 0.6640, test_loss: 1.0390, test_f1: 0.5493
 epoch: 51, train_loss: 0.6117, test_loss: 1.0683, test_f1: 0.5619
 epoch: 52, train_loss: 0.5969, test_loss: 1.1361, test_f1: 0.5559
 epoch: 53, train_loss: 0.5915, test_loss: 1.1198, test_f1: 0.5447
 epoch: 54, train_loss: 0.5793, test_loss: 1.1066, test_f1: 0.5635
 epoch: 55, train_loss: 0.5813, test_loss: 1.1118, test_f1: 0.5649
 epoch: 56, train_loss: 0.5576, test_loss: 1.1497, test_f1: 0.5513
 epoch: 57, train_loss: 0.5660, test_loss: 1.1203, test_f1: 0.5414
 epoch: 58, train_loss: 0.5595, test_loss: 1.1173, test_f1: 0.5370
 epoch: 59, train_loss: 0.5316, test_loss: 1.2038, test_f1: 0.5384
 epoch: 60, train_loss: 0.5661, test_loss: 1.1264, test_f1: 0.5593
 epoch: 61, train_loss: 0.5554, test_loss: 1.1301, test_f1: 0.5830
 epoch: 62, train_loss: 0.5294, test_loss: 1.1390, test_f1: 0.5580
 epoch: 63, train_loss: 0.5194, test_loss: 1.1454, test_f1: 0.5635
 epoch: 64, train_loss: 0.5344, test_loss: 1.2493, test_f1: 0.5307
 epoch: 65, train_loss: 0.5213, test_loss: 1.2236, test_f1: 0.5615
 epoch: 66, train_loss: 0.5090, test_loss: 1.2007, test_f1: 0.5644
 epoch: 67, train_loss: 0.4990, test_loss: 1.1872, test_f1: 0.5723
 epoch: 68, train_loss: 0.4934, test_loss: 1.2827, test_f1: 0.5594
 epoch: 69, train_loss: 0.5063, test_loss: 1.1884, test_f1: 0.5826
 epoch: 70, train_loss: 0.4866, test_loss: 1.1583, test_f1: 0.5898
 epoch: 71, train_loss: 0.4958, test_loss: 1.2355, test_f1: 0.5656
 epoch: 72, train_loss: 0.5105, test_loss: 1.2338, test_f1: 0.5511
 epoch: 73, train_loss: 0.4837, test_loss: 1.3163, test_f1: 0.5396
 epoch: 74, train_loss: 0.4607, test_loss: 1.2574, test_f1: 0.5973
 epoch: 75, train_loss: 0.4607, test_loss: 1.2943, test_f1: 0.5632
 epoch: 76, train_loss: 0.4905, test_loss: 1.2566, test_f1: 0.5794
 epoch: 77, train_loss: 0.4553, test_loss: 1.2404, test_f1: 0.5680
 epoch: 78, train_loss: 0.4633, test_loss: 1.2337, test_f1: 0.5824
 epoch: 79, train_loss: 0.4362, test_loss: 1.2739, test_f1: 0.5840
 epoch: 80, train_loss: 0.4413, test_loss: 1.2776, test_f1: 0.5572
 epoch: 81, train_loss: 0.4497, test_loss: 1.3400, test_f1: 0.5294
 epoch: 82, train_loss: 0.4595, test_loss: 1.2862, test_f1: 0.5970
 epoch: 83, train_loss: 0.4230, test_loss: 1.3617, test_f1: 0.5791
 epoch: 84, train_loss: 0.4383, test_loss: 1.2450, test_f1: 0.5729
 epoch: 85, train_loss: 0.4473, test_loss: 1.2145, test_f1: 0.5913
 epoch: 86, train_loss: 0.4464, test_loss: 1.2715, test_f1: 0.6257
 epoch: 87, train_loss: 0.4412, test_loss: 1.2964, test_f1: 0.5653
 epoch: 88, train_loss: 0.4199, test_loss: 1.3015, test_f1: 0.5618
 epoch: 89, train_loss: 0.4222, test_loss: 1.2329, test_f1: 0.5907
 epoch: 90, train_loss: 0.4316, test_loss: 1.4331, test_f1: 0.5143
 epoch: 91, train_loss: 0.4268, test_loss: 1.4034, test_f1: 0.5241
 epoch: 92, train_loss: 0.4147, test_loss: 1.3658, test_f1: 0.5619
 epoch: 93, train_loss: 0.3990, test_loss: 1.3433, test_f1: 0.5653
 epoch: 94, train_loss: 0.3944, test_loss: 1.3240, test_f1: 0.5851
 epoch: 95, train_loss: 0.4023, test_loss: 1.2870, test_f1: 0.5986
 epoch: 96, train_loss: 0.3870, test_loss: 1.4362, test_f1: 0.5759
 epoch: 97, train_loss: 0.4185, test_loss: 1.4515, test_f1: 0.5484
 epoch: 98, train_loss: 0.3950, test_loss: 1.5695, test_f1: 0.5422
 epoch: 99, train_loss: 0.3903, test_loss: 1.3151, test_f1: 0.5973
##################ITERATION #8 ****************************************
 epoch: 0, train_loss: 1.3053, test_loss: 1.0872, test_f1: 0.4147
 epoch: 1, train_loss: 1.1164, test_loss: 1.0366, test_f1: 0.4294
 epoch: 2, train_loss: 1.0698, test_loss: 1.0068, test_f1: 0.4584
 epoch: 3, train_loss: 1.0328, test_loss: 0.9681, test_f1: 0.4707
 epoch: 4, train_loss: 1.0216, test_loss: 0.9379, test_f1: 0.4922
 epoch: 5, train_loss: 0.9995, test_loss: 0.9651, test_f1: 0.4608
 epoch: 6, train_loss: 0.9737, test_loss: 1.0229, test_f1: 0.4655
 epoch: 7, train_loss: 0.9794, test_loss: 0.9370, test_f1: 0.4839
 epoch: 8, train_loss: 0.9313, test_loss: 0.9991, test_f1: 0.4750
 epoch: 9, train_loss: 0.9364, test_loss: 0.9742, test_f1: 0.4788
 epoch: 10, train_loss: 0.9319, test_loss: 0.9721, test_f1: 0.4933
 epoch: 11, train_loss: 0.9159, test_loss: 1.0040, test_f1: 0.4748
 epoch: 12, train_loss: 0.9158, test_loss: 0.8905, test_f1: 0.5466
 epoch: 13, train_loss: 0.9018, test_loss: 0.9799, test_f1: 0.4988
 epoch: 14, train_loss: 0.8770, test_loss: 0.9569, test_f1: 0.4933
 epoch: 15, train_loss: 0.8636, test_loss: 0.9424, test_f1: 0.5380
 epoch: 16, train_loss: 0.8628, test_loss: 1.0326, test_f1: 0.5203
 epoch: 17, train_loss: 0.8518, test_loss: 1.0229, test_f1: 0.5066
 epoch: 18, train_loss: 0.8367, test_loss: 1.1001, test_f1: 0.5235
 epoch: 19, train_loss: 0.8359, test_loss: 0.9364, test_f1: 0.5588
 epoch: 20, train_loss: 0.8186, test_loss: 0.9243, test_f1: 0.5618
 epoch: 21, train_loss: 0.8211, test_loss: 0.8899, test_f1: 0.5496
 epoch: 22, train_loss: 0.8114, test_loss: 1.0286, test_f1: 0.5630
 epoch: 23, train_loss: 0.8035, test_loss: 1.0741, test_f1: 0.4938
 epoch: 24, train_loss: 0.7829, test_loss: 1.0757, test_f1: 0.5287
 epoch: 25, train_loss: 0.7922, test_loss: 1.0362, test_f1: 0.5408
 epoch: 26, train_loss: 0.7862, test_loss: 1.0555, test_f1: 0.5403
 epoch: 27, train_loss: 0.7912, test_loss: 1.0549, test_f1: 0.5376
 epoch: 28, train_loss: 0.7906, test_loss: 1.0306, test_f1: 0.5471
 epoch: 29, train_loss: 0.7549, test_loss: 1.0502, test_f1: 0.5377
 epoch: 30, train_loss: 0.7409, test_loss: 0.9722, test_f1: 0.5549
 epoch: 31, train_loss: 0.7171, test_loss: 1.0812, test_f1: 0.5630
 epoch: 32, train_loss: 0.7213, test_loss: 1.1282, test_f1: 0.5408
 epoch: 33, train_loss: 0.7422, test_loss: 1.0683, test_f1: 0.5414
 epoch: 34, train_loss: 0.7124, test_loss: 1.0231, test_f1: 0.5523
 epoch: 35, train_loss: 0.7241, test_loss: 1.0469, test_f1: 0.5640
 epoch: 36, train_loss: 0.6989, test_loss: 1.0605, test_f1: 0.5556
 epoch: 37, train_loss: 0.6698, test_loss: 1.1635, test_f1: 0.5511
 epoch: 38, train_loss: 0.7169, test_loss: 1.0924, test_f1: 0.5459
 epoch: 39, train_loss: 0.6936, test_loss: 1.0454, test_f1: 0.5658
 epoch: 40, train_loss: 0.6998, test_loss: 1.0791, test_f1: 0.5610
 epoch: 41, train_loss: 0.7093, test_loss: 1.0933, test_f1: 0.5267
 epoch: 42, train_loss: 0.6694, test_loss: 1.0550, test_f1: 0.5345
 epoch: 43, train_loss: 0.6569, test_loss: 1.1051, test_f1: 0.5610
 epoch: 44, train_loss: 0.6364, test_loss: 1.0759, test_f1: 0.5419
 epoch: 45, train_loss: 0.6567, test_loss: 1.1232, test_f1: 0.5671
 epoch: 46, train_loss: 0.6417, test_loss: 1.1419, test_f1: 0.5635
 epoch: 47, train_loss: 0.6515, test_loss: 1.0451, test_f1: 0.5535
 epoch: 48, train_loss: 0.6301, test_loss: 1.1252, test_f1: 0.5691
 epoch: 49, train_loss: 0.6218, test_loss: 1.0942, test_f1: 0.5402
 epoch: 50, train_loss: 0.6119, test_loss: 1.2504, test_f1: 0.5517
 epoch: 51, train_loss: 0.5954, test_loss: 1.1457, test_f1: 0.5600
 epoch: 52, train_loss: 0.5547, test_loss: 1.2000, test_f1: 0.5483
 epoch: 53, train_loss: 0.5613, test_loss: 1.1807, test_f1: 0.5643
 epoch: 54, train_loss: 0.5381, test_loss: 1.1953, test_f1: 0.5500
 epoch: 55, train_loss: 0.5348, test_loss: 1.1939, test_f1: 0.5452
 epoch: 56, train_loss: 0.5976, test_loss: 1.1232, test_f1: 0.5671
 epoch: 57, train_loss: 0.5402, test_loss: 1.2914, test_f1: 0.5161
 epoch: 58, train_loss: 0.5268, test_loss: 1.2506, test_f1: 0.5599
 epoch: 59, train_loss: 0.5160, test_loss: 1.1829, test_f1: 0.5706
 epoch: 60, train_loss: 0.5231, test_loss: 1.2204, test_f1: 0.5568
 epoch: 61, train_loss: 0.5089, test_loss: 1.1839, test_f1: 0.5741
 epoch: 62, train_loss: 0.5091, test_loss: 1.2749, test_f1: 0.5493
 epoch: 63, train_loss: 0.5004, test_loss: 1.2627, test_f1: 0.5718
 epoch: 64, train_loss: 0.4807, test_loss: 1.2176, test_f1: 0.5664
 epoch: 65, train_loss: 0.4870, test_loss: 1.2786, test_f1: 0.5829
 epoch: 66, train_loss: 0.4944, test_loss: 1.2027, test_f1: 0.5588
 epoch: 67, train_loss: 0.4609, test_loss: 1.2487, test_f1: 0.5610
 epoch: 68, train_loss: 0.4628, test_loss: 1.2723, test_f1: 0.5703
 epoch: 69, train_loss: 0.4810, test_loss: 1.3242, test_f1: 0.5635
 epoch: 70, train_loss: 0.4909, test_loss: 1.3514, test_f1: 0.5571
 epoch: 71, train_loss: 0.4895, test_loss: 1.2632, test_f1: 0.5726
 epoch: 72, train_loss: 0.4680, test_loss: 1.3459, test_f1: 0.5855
 epoch: 73, train_loss: 0.4692, test_loss: 1.2768, test_f1: 0.5718
 epoch: 74, train_loss: 0.4557, test_loss: 1.2855, test_f1: 0.5735
 epoch: 75, train_loss: 0.4552, test_loss: 1.2608, test_f1: 0.5636
 epoch: 76, train_loss: 0.4494, test_loss: 1.3179, test_f1: 0.5621
 epoch: 77, train_loss: 0.4344, test_loss: 1.2781, test_f1: 0.5805
 epoch: 78, train_loss: 0.4449, test_loss: 1.3193, test_f1: 0.5851
 epoch: 79, train_loss: 0.4413, test_loss: 1.3124, test_f1: 0.5804
 epoch: 80, train_loss: 0.4307, test_loss: 1.3890, test_f1: 0.5714
 epoch: 81, train_loss: 0.4212, test_loss: 1.4463, test_f1: 0.5575
 epoch: 82, train_loss: 0.4202, test_loss: 1.3767, test_f1: 0.5705
 epoch: 83, train_loss: 0.4166, test_loss: 1.4977, test_f1: 0.5532
 epoch: 84, train_loss: 0.4110, test_loss: 1.5439, test_f1: 0.5284
 epoch: 85, train_loss: 0.4418, test_loss: 1.4060, test_f1: 0.5609
 epoch: 86, train_loss: 0.4290, test_loss: 1.3848, test_f1: 0.5328
 epoch: 87, train_loss: 0.4107, test_loss: 1.3847, test_f1: 0.5629
 epoch: 88, train_loss: 0.4094, test_loss: 1.4628, test_f1: 0.5517
 epoch: 89, train_loss: 0.4154, test_loss: 1.3563, test_f1: 0.5738
 epoch: 90, train_loss: 0.4022, test_loss: 1.3638, test_f1: 0.5858
 epoch: 91, train_loss: 0.3889, test_loss: 1.4539, test_f1: 0.5501
 epoch: 92, train_loss: 0.4021, test_loss: 1.4694, test_f1: 0.5549
 epoch: 93, train_loss: 0.4236, test_loss: 1.3162, test_f1: 0.5636
 epoch: 94, train_loss: 0.3728, test_loss: 1.3539, test_f1: 0.5518
 epoch: 95, train_loss: 0.4162, test_loss: 1.2632, test_f1: 0.5733
 epoch: 96, train_loss: 0.3679, test_loss: 1.3999, test_f1: 0.5772
 epoch: 97, train_loss: 0.3664, test_loss: 1.4074, test_f1: 0.5543
 epoch: 98, train_loss: 0.3824, test_loss: 1.3675, test_f1: 0.5563
 epoch: 99, train_loss: 0.3781, test_loss: 1.3721, test_f1: 0.5848
##################ITERATION #9 ****************************************
 epoch: 0, train_loss: 1.2820, test_loss: 1.1608, test_f1: 0.3779
 epoch: 1, train_loss: 1.1426, test_loss: 1.0775, test_f1: 0.4315
 epoch: 2, train_loss: 1.0793, test_loss: 1.0073, test_f1: 0.4536
 epoch: 3, train_loss: 1.0418, test_loss: 0.9505, test_f1: 0.4653
 epoch: 4, train_loss: 1.0053, test_loss: 0.9952, test_f1: 0.4773
 epoch: 5, train_loss: 0.9850, test_loss: 0.9877, test_f1: 0.4815
 epoch: 6, train_loss: 0.9733, test_loss: 1.0188, test_f1: 0.5119
 epoch: 7, train_loss: 0.9606, test_loss: 0.9820, test_f1: 0.5150
 epoch: 8, train_loss: 0.9285, test_loss: 0.9866, test_f1: 0.4921
 epoch: 9, train_loss: 0.9340, test_loss: 0.9567, test_f1: 0.5231
 epoch: 10, train_loss: 0.9060, test_loss: 1.0065, test_f1: 0.5038
 epoch: 11, train_loss: 0.9067, test_loss: 1.0771, test_f1: 0.4872
 epoch: 12, train_loss: 0.8991, test_loss: 0.9751, test_f1: 0.5265
 epoch: 13, train_loss: 0.8671, test_loss: 1.0712, test_f1: 0.4725
 epoch: 14, train_loss: 0.8545, test_loss: 1.0213, test_f1: 0.5300
 epoch: 15, train_loss: 0.8407, test_loss: 0.9409, test_f1: 0.5175
 epoch: 16, train_loss: 0.8394, test_loss: 1.0165, test_f1: 0.5387
 epoch: 17, train_loss: 0.8278, test_loss: 1.0068, test_f1: 0.5424
 epoch: 18, train_loss: 0.8251, test_loss: 1.0253, test_f1: 0.5519
 epoch: 19, train_loss: 0.8207, test_loss: 1.0221, test_f1: 0.5333
 epoch: 20, train_loss: 0.8124, test_loss: 1.0370, test_f1: 0.5332
 epoch: 21, train_loss: 0.8153, test_loss: 1.0903, test_f1: 0.5619
 epoch: 22, train_loss: 0.8078, test_loss: 0.9831, test_f1: 0.5633
 epoch: 23, train_loss: 0.7797, test_loss: 1.0151, test_f1: 0.5549
 epoch: 24, train_loss: 0.7766, test_loss: 1.0175, test_f1: 0.5583
 epoch: 25, train_loss: 0.7879, test_loss: 0.9846, test_f1: 0.5797
 epoch: 26, train_loss: 0.7611, test_loss: 1.0394, test_f1: 0.5655
 epoch: 27, train_loss: 0.7702, test_loss: 1.0868, test_f1: 0.5598
 epoch: 28, train_loss: 0.7541, test_loss: 1.0510, test_f1: 0.5525
 epoch: 29, train_loss: 0.7397, test_loss: 0.9513, test_f1: 0.5713
 epoch: 30, train_loss: 0.7274, test_loss: 1.0404, test_f1: 0.5620
 epoch: 31, train_loss: 0.7208, test_loss: 1.0676, test_f1: 0.5537
 epoch: 32, train_loss: 0.7201, test_loss: 1.1775, test_f1: 0.5569
 epoch: 33, train_loss: 0.6947, test_loss: 1.0969, test_f1: 0.5629
 epoch: 34, train_loss: 0.7137, test_loss: 1.0181, test_f1: 0.5761
 epoch: 35, train_loss: 0.6933, test_loss: 1.1015, test_f1: 0.5468
 epoch: 36, train_loss: 0.6883, test_loss: 1.0212, test_f1: 0.5715
 epoch: 37, train_loss: 0.6791, test_loss: 0.9872, test_f1: 0.6030
 epoch: 38, train_loss: 0.6852, test_loss: 1.1175, test_f1: 0.5176
 epoch: 39, train_loss: 0.7121, test_loss: 1.0177, test_f1: 0.5471
 epoch: 40, train_loss: 0.6734, test_loss: 1.1095, test_f1: 0.5662
 epoch: 41, train_loss: 0.6789, test_loss: 0.9843, test_f1: 0.5618
 epoch: 42, train_loss: 0.6615, test_loss: 1.0670, test_f1: 0.5488
 epoch: 43, train_loss: 0.6572, test_loss: 1.0445, test_f1: 0.5767
 epoch: 44, train_loss: 0.6380, test_loss: 1.1472, test_f1: 0.5366
 epoch: 45, train_loss: 0.6455, test_loss: 1.0240, test_f1: 0.5367
 epoch: 46, train_loss: 0.6182, test_loss: 1.0745, test_f1: 0.5489
 epoch: 47, train_loss: 0.7295, test_loss: 1.0121, test_f1: 0.5726
 epoch: 48, train_loss: 0.6607, test_loss: 1.0160, test_f1: 0.5580
 epoch: 49, train_loss: 0.6340, test_loss: 1.0404, test_f1: 0.5793
 epoch: 50, train_loss: 0.6114, test_loss: 1.1477, test_f1: 0.5424
 epoch: 51, train_loss: 0.5894, test_loss: 1.0711, test_f1: 0.5656
 epoch: 52, train_loss: 0.5748, test_loss: 1.0959, test_f1: 0.5784
 epoch: 53, train_loss: 0.5502, test_loss: 1.1546, test_f1: 0.5788
 epoch: 54, train_loss: 0.5630, test_loss: 1.1484, test_f1: 0.5671
 epoch: 55, train_loss: 0.5427, test_loss: 1.1812, test_f1: 0.5852
 epoch: 56, train_loss: 0.5367, test_loss: 1.2017, test_f1: 0.5603
 epoch: 57, train_loss: 0.5250, test_loss: 1.2604, test_f1: 0.5498
 epoch: 58, train_loss: 0.5546, test_loss: 1.1723, test_f1: 0.5799
 epoch: 59, train_loss: 0.5482, test_loss: 1.2115, test_f1: 0.5731
 epoch: 60, train_loss: 0.5136, test_loss: 1.2594, test_f1: 0.5725
 epoch: 61, train_loss: 0.4940, test_loss: 1.2858, test_f1: 0.5689
 epoch: 62, train_loss: 0.5075, test_loss: 1.2457, test_f1: 0.5685
 epoch: 63, train_loss: 0.4875, test_loss: 1.2247, test_f1: 0.5698
 epoch: 64, train_loss: 0.4892, test_loss: 1.2528, test_f1: 0.5519
 epoch: 65, train_loss: 0.4926, test_loss: 1.2667, test_f1: 0.5748
 epoch: 66, train_loss: 0.4759, test_loss: 1.3474, test_f1: 0.5675
 epoch: 67, train_loss: 0.4749, test_loss: 1.3059, test_f1: 0.5626
 epoch: 68, train_loss: 0.4870, test_loss: 1.3778, test_f1: 0.5481
 epoch: 69, train_loss: 0.4802, test_loss: 1.2382, test_f1: 0.5680
 epoch: 70, train_loss: 0.4694, test_loss: 1.2844, test_f1: 0.5635
 epoch: 71, train_loss: 0.4612, test_loss: 1.2858, test_f1: 0.5529
 epoch: 72, train_loss: 0.4668, test_loss: 1.3012, test_f1: 0.5575
 epoch: 73, train_loss: 0.4555, test_loss: 1.3309, test_f1: 0.5441
 epoch: 74, train_loss: 0.4518, test_loss: 1.3347, test_f1: 0.5569
 epoch: 75, train_loss: 0.4623, test_loss: 1.2844, test_f1: 0.5782
 epoch: 76, train_loss: 0.4498, test_loss: 1.3426, test_f1: 0.5638
 epoch: 77, train_loss: 0.4530, test_loss: 1.3291, test_f1: 0.5533
 epoch: 78, train_loss: 0.4254, test_loss: 1.3254, test_f1: 0.5802
 epoch: 79, train_loss: 0.4253, test_loss: 1.3926, test_f1: 0.5979
 epoch: 80, train_loss: 0.4377, test_loss: 1.3752, test_f1: 0.5783
 epoch: 81, train_loss: 0.4234, test_loss: 1.4491, test_f1: 0.5632
 epoch: 82, train_loss: 0.5143, test_loss: 1.4597, test_f1: 0.5715
 epoch: 83, train_loss: 0.4498, test_loss: 1.3789, test_f1: 0.5749
 epoch: 84, train_loss: 0.4410, test_loss: 1.3450, test_f1: 0.5797
 epoch: 85, train_loss: 0.4007, test_loss: 1.5789, test_f1: 0.5428
 epoch: 86, train_loss: 0.4177, test_loss: 1.4628, test_f1: 0.5513
 epoch: 87, train_loss: 0.4096, test_loss: 1.5376, test_f1: 0.5589
 epoch: 88, train_loss: 0.4149, test_loss: 1.3604, test_f1: 0.5647
 epoch: 89, train_loss: 0.4033, test_loss: 1.4812, test_f1: 0.5482
 epoch: 90, train_loss: 0.3900, test_loss: 1.4261, test_f1: 0.5900
 epoch: 91, train_loss: 0.3865, test_loss: 1.4802, test_f1: 0.5629
 epoch: 92, train_loss: 0.3962, test_loss: 1.8583, test_f1: 0.5415
 epoch: 93, train_loss: 0.3860, test_loss: 1.4826, test_f1: 0.5632
 epoch: 94, train_loss: 0.3613, test_loss: 1.7859, test_f1: 0.5368
 epoch: 95, train_loss: 0.4005, test_loss: 1.5457, test_f1: 0.5659
 epoch: 96, train_loss: 0.3831, test_loss: 1.5239, test_f1: 0.5389
 epoch: 97, train_loss: 0.4300, test_loss: 1.5387, test_f1: 0.5634
 epoch: 98, train_loss: 0.3925, test_loss: 1.5097, test_f1: 0.5614
 epoch: 99, train_loss: 0.3661, test_loss: 1.4971, test_f1: 0.5824

Training completed in 943.96 seconds
Best F1: 0.6257 at epoch 86
Mean F1 across iterations: 0.5962  0.0120
========================FINAL RESULTS================================
FEGIN weighted F1: 0.6257  0.0120
python main.py --data ltspice_examples --representation component_component --model FEGIN --layers 3 --hiddens 128 --batch_size 32 --lr 0.001 --emb_size 512 --epochs 100 --save_appendix component_component_L3_H128_BS32_LR0.001_E512 --no_val
-----



STDERR:
  File "main.py", line 370, in <module>
    main()
  File "main.py", line 254, in main
    dataset = dataset_class(
  File "/home/philip/projects/ltspice_examples_code_repo/Circuit-Completion-Using-GNNs/component_classification_with_link_prediction_head/evaluation/FEGIN/kernel/circuit_datasets.py", line 15, in __init__
    self.data, self.slices = torch.load(self.processed_paths[0])
  File "/home/philip/.local/lib/python3.8/site-packages/torch/serialization.py", line 1040, in load
    warnings.warn(
  File "/usr/lib/python3.8/warnings.py", line 109, in _showwarnmsg
    sw(msg.message, msg.category, msg.filename, msg.lineno,
  File "main.py", line 47, in warn_with_traceback
    traceback.print_stack(file=log)
/home/philip/projects/ltspice_examples_code_repo/Circuit-Completion-Using-GNNs/component_classification_with_link_prediction_head/evaluation/FEGIN/kernel/circuit_datasets.py:15: FutureWarning: You are using `torch.load` with `weights_only=False` (the current default value), which uses the default pickle module implicitly. It is possible to construct malicious pickle data which will execute arbitrary code during unpickling (See https://github.com/pytorch/pytorch/blob/main/SECURITY.md#untrusted-models for more details). In a future release, the default value for `weights_only` will be flipped to `True`. This limits the functions that could be executed during unpickling. Arbitrary objects will no longer be allowed to be loaded via this mode unless they are explicitly allowlisted by the user via `torch.serialization.add_safe_globals`. We recommend you start setting `weights_only=True` for any use case where you don't have full control of the loaded file. Please open an issue on GitHub for any issues related to this experimental feature.
  self.data, self.slices = torch.load(self.processed_paths[0])
