STDOUT:
Results will be saved in /home/philip/projects/ltspice_examples_code_repo/Circuit-Completion-Using-GNNs/component_classification_with_link_prediction_head/evaluation/FEGIN/results/model_FEGIN_dataset_ltspice_examples
Command line input: python main.py --data ltspice_examples --representation component_component --model FEGIN --layers 4 --hiddens 16 --batch_size 256 --lr 0.001 --emb_size 512 --epochs 100 --save_appendix component_component_L4_H16_BS256_LR0.001_E512 --no_val
 is saved.
-----
ltspice_examples - FEGIN
Using 4 layers, 16 hidden units, h = 2
Loading component_component representation dataset
ENTERED
Training FEGIN on component_component representation
Train: 3556, Test: 845
##################ITERATION #0 ****************************************
 epoch: 0, train_loss: 1.3533, test_loss: 1.3557, test_f1: 0.2274
 epoch: 1, train_loss: 1.3410, test_loss: 1.3486, test_f1: 0.2274
 epoch: 2, train_loss: 1.3329, test_loss: 1.3404, test_f1: 0.2274
 epoch: 3, train_loss: 1.3236, test_loss: 1.3299, test_f1: 0.2274
 epoch: 4, train_loss: 1.3122, test_loss: 1.3185, test_f1: 0.2274
 epoch: 5, train_loss: 1.3007, test_loss: 1.3037, test_f1: 0.2274
 epoch: 6, train_loss: 1.2871, test_loss: 1.2905, test_f1: 0.2274
 epoch: 7, train_loss: 1.2772, test_loss: 1.2706, test_f1: 0.2274
 epoch: 8, train_loss: 1.2604, test_loss: 1.2526, test_f1: 0.2274
 epoch: 9, train_loss: 1.2478, test_loss: 1.2414, test_f1: 0.2274
 epoch: 10, train_loss: 1.2410, test_loss: 1.2326, test_f1: 0.2274
 epoch: 11, train_loss: 1.2363, test_loss: 1.2278, test_f1: 0.2300
 epoch: 12, train_loss: 1.2300, test_loss: 1.2229, test_f1: 0.2607
 epoch: 13, train_loss: 1.2246, test_loss: 1.2169, test_f1: 0.3006
 epoch: 14, train_loss: 1.2256, test_loss: 1.2154, test_f1: 0.3151
 epoch: 15, train_loss: 1.2148, test_loss: 1.2068, test_f1: 0.3298
 epoch: 16, train_loss: 1.2091, test_loss: 1.1986, test_f1: 0.3529
 epoch: 17, train_loss: 1.2050, test_loss: 1.1972, test_f1: 0.3503
 epoch: 18, train_loss: 1.2045, test_loss: 1.1892, test_f1: 0.3475
 epoch: 19, train_loss: 1.1956, test_loss: 1.1862, test_f1: 0.3546
 epoch: 20, train_loss: 1.1869, test_loss: 1.1844, test_f1: 0.3558
 epoch: 21, train_loss: 1.1908, test_loss: 1.1876, test_f1: 0.3516
 epoch: 22, train_loss: 1.1787, test_loss: 1.1853, test_f1: 0.3519
 epoch: 23, train_loss: 1.1760, test_loss: 1.1942, test_f1: 0.3569
 epoch: 24, train_loss: 1.1724, test_loss: 1.2058, test_f1: 0.3789
 epoch: 25, train_loss: 1.1682, test_loss: 1.1782, test_f1: 0.3985
 epoch: 26, train_loss: 1.1578, test_loss: 1.1941, test_f1: 0.4079
 epoch: 27, train_loss: 1.1531, test_loss: 1.1769, test_f1: 0.4198
 epoch: 28, train_loss: 1.1485, test_loss: 1.2085, test_f1: 0.4193
 epoch: 29, train_loss: 1.1403, test_loss: 1.1913, test_f1: 0.4045
 epoch: 30, train_loss: 1.1389, test_loss: 1.1481, test_f1: 0.4243
 epoch: 31, train_loss: 1.1353, test_loss: 1.1736, test_f1: 0.4169
 epoch: 32, train_loss: 1.1233, test_loss: 1.2157, test_f1: 0.3939
 epoch: 33, train_loss: 1.1184, test_loss: 1.1464, test_f1: 0.4105
 epoch: 34, train_loss: 1.1059, test_loss: 1.1640, test_f1: 0.4038
 epoch: 35, train_loss: 1.1076, test_loss: 1.1528, test_f1: 0.4195
 epoch: 36, train_loss: 1.0976, test_loss: 1.2080, test_f1: 0.4060
 epoch: 37, train_loss: 1.0857, test_loss: 1.1370, test_f1: 0.4230
 epoch: 38, train_loss: 1.0845, test_loss: 1.1293, test_f1: 0.4142
 epoch: 39, train_loss: 1.0789, test_loss: 1.1354, test_f1: 0.4122
 epoch: 40, train_loss: 1.0775, test_loss: 1.1393, test_f1: 0.4166
 epoch: 41, train_loss: 1.0746, test_loss: 1.1516, test_f1: 0.4026
 epoch: 42, train_loss: 1.0691, test_loss: 1.1180, test_f1: 0.4053
 epoch: 43, train_loss: 1.0601, test_loss: 1.1022, test_f1: 0.4330
 epoch: 44, train_loss: 1.0581, test_loss: 1.1936, test_f1: 0.4009
 epoch: 45, train_loss: 1.0493, test_loss: 1.0898, test_f1: 0.4146
 epoch: 46, train_loss: 1.0368, test_loss: 1.1257, test_f1: 0.4097
 epoch: 47, train_loss: 1.0371, test_loss: 1.1529, test_f1: 0.4129
 epoch: 48, train_loss: 1.0326, test_loss: 1.2475, test_f1: 0.4059
 epoch: 49, train_loss: 1.0419, test_loss: 1.0693, test_f1: 0.4431
 epoch: 50, train_loss: 1.0255, test_loss: 1.2475, test_f1: 0.4125
 epoch: 51, train_loss: 1.0244, test_loss: 1.1172, test_f1: 0.4207
 epoch: 52, train_loss: 1.0219, test_loss: 1.1173, test_f1: 0.4228
 epoch: 53, train_loss: 1.0114, test_loss: 1.1192, test_f1: 0.4170
 epoch: 54, train_loss: 1.0093, test_loss: 1.1634, test_f1: 0.4113
 epoch: 55, train_loss: 1.0020, test_loss: 1.1343, test_f1: 0.4172
 epoch: 56, train_loss: 1.0103, test_loss: 1.1564, test_f1: 0.4098
 epoch: 57, train_loss: 1.0083, test_loss: 1.0994, test_f1: 0.4462
 epoch: 58, train_loss: 0.9973, test_loss: 1.1315, test_f1: 0.4134
 epoch: 59, train_loss: 1.0021, test_loss: 1.1057, test_f1: 0.4249
 epoch: 60, train_loss: 0.9891, test_loss: 1.1806, test_f1: 0.4051
 epoch: 61, train_loss: 0.9977, test_loss: 1.1163, test_f1: 0.4127
 epoch: 62, train_loss: 0.9903, test_loss: 1.1096, test_f1: 0.4268
 epoch: 63, train_loss: 0.9910, test_loss: 1.1010, test_f1: 0.4439
 epoch: 64, train_loss: 0.9826, test_loss: 1.1046, test_f1: 0.4260
 epoch: 65, train_loss: 0.9744, test_loss: 1.1143, test_f1: 0.4188
 epoch: 66, train_loss: 0.9773, test_loss: 1.1126, test_f1: 0.4392
 epoch: 67, train_loss: 0.9784, test_loss: 1.1123, test_f1: 0.4244
 epoch: 68, train_loss: 0.9823, test_loss: 1.1154, test_f1: 0.4163
 epoch: 69, train_loss: 0.9784, test_loss: 1.0966, test_f1: 0.4324
 epoch: 70, train_loss: 0.9791, test_loss: 1.2146, test_f1: 0.4094
 epoch: 71, train_loss: 0.9874, test_loss: 1.0967, test_f1: 0.4354
 epoch: 72, train_loss: 0.9860, test_loss: 1.1524, test_f1: 0.4059
 epoch: 73, train_loss: 0.9664, test_loss: 1.0944, test_f1: 0.4120
 epoch: 74, train_loss: 0.9618, test_loss: 1.1112, test_f1: 0.4192
 epoch: 75, train_loss: 0.9757, test_loss: 1.1415, test_f1: 0.4117
 epoch: 76, train_loss: 0.9707, test_loss: 1.0840, test_f1: 0.4243
 epoch: 77, train_loss: 0.9627, test_loss: 1.1179, test_f1: 0.4175
 epoch: 78, train_loss: 0.9577, test_loss: 1.0865, test_f1: 0.4364
 epoch: 79, train_loss: 0.9601, test_loss: 1.1630, test_f1: 0.4199
 epoch: 80, train_loss: 0.9603, test_loss: 1.1427, test_f1: 0.4142
 epoch: 81, train_loss: 0.9620, test_loss: 1.1844, test_f1: 0.4092
 epoch: 82, train_loss: 0.9589, test_loss: 1.0852, test_f1: 0.4414
 epoch: 83, train_loss: 0.9666, test_loss: 1.0926, test_f1: 0.4423
 epoch: 84, train_loss: 0.9591, test_loss: 1.0812, test_f1: 0.4230
 epoch: 85, train_loss: 0.9496, test_loss: 1.1095, test_f1: 0.4192
 epoch: 86, train_loss: 0.9627, test_loss: 1.1046, test_f1: 0.4109
 epoch: 87, train_loss: 0.9455, test_loss: 1.0866, test_f1: 0.4399
 epoch: 88, train_loss: 0.9536, test_loss: 1.0652, test_f1: 0.4603
 epoch: 89, train_loss: 0.9471, test_loss: 1.1282, test_f1: 0.4186
 epoch: 90, train_loss: 0.9478, test_loss: 1.1229, test_f1: 0.4278
 epoch: 91, train_loss: 0.9409, test_loss: 1.1012, test_f1: 0.4097
 epoch: 92, train_loss: 0.9511, test_loss: 1.0753, test_f1: 0.4395
 epoch: 93, train_loss: 0.9431, test_loss: 1.0631, test_f1: 0.4451
 epoch: 94, train_loss: 0.9353, test_loss: 1.0918, test_f1: 0.4308
 epoch: 95, train_loss: 0.9303, test_loss: 1.0871, test_f1: 0.4282
 epoch: 96, train_loss: 0.9415, test_loss: 1.1031, test_f1: 0.4062
 epoch: 97, train_loss: 0.9373, test_loss: 1.0897, test_f1: 0.4271
 epoch: 98, train_loss: 0.9320, test_loss: 1.1543, test_f1: 0.4051
 epoch: 99, train_loss: 0.9362, test_loss: 1.1001, test_f1: 0.4220
##################ITERATION #1 ****************************************
 epoch: 0, train_loss: 1.3731, test_loss: 1.3728, test_f1: 0.2315
 epoch: 1, train_loss: 1.2978, test_loss: 1.3139, test_f1: 0.2274
 epoch: 2, train_loss: 1.2724, test_loss: 1.2758, test_f1: 0.2274
 epoch: 3, train_loss: 1.2615, test_loss: 1.2523, test_f1: 0.2274
 epoch: 4, train_loss: 1.2491, test_loss: 1.2344, test_f1: 0.2532
 epoch: 5, train_loss: 1.2332, test_loss: 1.2201, test_f1: 0.3031
 epoch: 6, train_loss: 1.2224, test_loss: 1.2106, test_f1: 0.3060
 epoch: 7, train_loss: 1.2186, test_loss: 1.1991, test_f1: 0.3244
 epoch: 8, train_loss: 1.2066, test_loss: 1.1818, test_f1: 0.3429
 epoch: 9, train_loss: 1.2016, test_loss: 1.1776, test_f1: 0.3344
 epoch: 10, train_loss: 1.1902, test_loss: 1.1715, test_f1: 0.3474
 epoch: 11, train_loss: 1.1882, test_loss: 1.1589, test_f1: 0.3589
 epoch: 12, train_loss: 1.1765, test_loss: 1.1518, test_f1: 0.3710
 epoch: 13, train_loss: 1.1720, test_loss: 1.1425, test_f1: 0.3780
 epoch: 14, train_loss: 1.1684, test_loss: 1.1340, test_f1: 0.3911
 epoch: 15, train_loss: 1.1574, test_loss: 1.1330, test_f1: 0.3876
 epoch: 16, train_loss: 1.1527, test_loss: 1.1272, test_f1: 0.4060
 epoch: 17, train_loss: 1.1435, test_loss: 1.1178, test_f1: 0.4057
 epoch: 18, train_loss: 1.1360, test_loss: 1.1138, test_f1: 0.4084
 epoch: 19, train_loss: 1.1310, test_loss: 1.1122, test_f1: 0.4061
 epoch: 20, train_loss: 1.1251, test_loss: 1.1002, test_f1: 0.4147
 epoch: 21, train_loss: 1.1204, test_loss: 1.1006, test_f1: 0.4203
 epoch: 22, train_loss: 1.1127, test_loss: 1.1072, test_f1: 0.4318
 epoch: 23, train_loss: 1.1008, test_loss: 1.1030, test_f1: 0.4237
 epoch: 24, train_loss: 1.1020, test_loss: 1.1002, test_f1: 0.4314
 epoch: 25, train_loss: 1.0938, test_loss: 1.0982, test_f1: 0.4456
 epoch: 26, train_loss: 1.0949, test_loss: 1.0923, test_f1: 0.4296
 epoch: 27, train_loss: 1.0855, test_loss: 1.0937, test_f1: 0.4395
 epoch: 28, train_loss: 1.0739, test_loss: 1.0981, test_f1: 0.4339
 epoch: 29, train_loss: 1.0650, test_loss: 1.0877, test_f1: 0.4343
 epoch: 30, train_loss: 1.0635, test_loss: 1.0966, test_f1: 0.4362
 epoch: 31, train_loss: 1.0650, test_loss: 1.0793, test_f1: 0.4469
 epoch: 32, train_loss: 1.0626, test_loss: 1.0927, test_f1: 0.4296
 epoch: 33, train_loss: 1.0589, test_loss: 1.0711, test_f1: 0.4516
 epoch: 34, train_loss: 1.0546, test_loss: 1.0702, test_f1: 0.4384
 epoch: 35, train_loss: 1.0418, test_loss: 1.0777, test_f1: 0.4263
 epoch: 36, train_loss: 1.0488, test_loss: 1.0665, test_f1: 0.4407
 epoch: 37, train_loss: 1.0359, test_loss: 1.0863, test_f1: 0.4242
 epoch: 38, train_loss: 1.0420, test_loss: 1.0685, test_f1: 0.4457
 epoch: 39, train_loss: 1.0255, test_loss: 1.0711, test_f1: 0.4402
 epoch: 40, train_loss: 1.0218, test_loss: 1.0628, test_f1: 0.4327
 epoch: 41, train_loss: 1.0078, test_loss: 1.0643, test_f1: 0.4329
 epoch: 42, train_loss: 1.0179, test_loss: 1.0588, test_f1: 0.4477
 epoch: 43, train_loss: 1.0186, test_loss: 1.0581, test_f1: 0.4418
 epoch: 44, train_loss: 1.0062, test_loss: 1.0706, test_f1: 0.4306
 epoch: 45, train_loss: 1.0003, test_loss: 1.0775, test_f1: 0.4343
 epoch: 46, train_loss: 0.9897, test_loss: 1.0471, test_f1: 0.4346
 epoch: 47, train_loss: 0.9903, test_loss: 1.0575, test_f1: 0.4298
 epoch: 48, train_loss: 0.9911, test_loss: 1.0440, test_f1: 0.4469
 epoch: 49, train_loss: 0.9805, test_loss: 1.0671, test_f1: 0.4371
 epoch: 50, train_loss: 0.9795, test_loss: 1.0567, test_f1: 0.4476
 epoch: 51, train_loss: 0.9721, test_loss: 1.0462, test_f1: 0.4445
 epoch: 52, train_loss: 0.9577, test_loss: 1.0593, test_f1: 0.4475
 epoch: 53, train_loss: 0.9690, test_loss: 1.0624, test_f1: 0.4488
 epoch: 54, train_loss: 0.9718, test_loss: 1.0588, test_f1: 0.4565
 epoch: 55, train_loss: 0.9583, test_loss: 1.0561, test_f1: 0.4476
 epoch: 56, train_loss: 0.9573, test_loss: 1.0686, test_f1: 0.4493
 epoch: 57, train_loss: 0.9551, test_loss: 1.0628, test_f1: 0.4474
 epoch: 58, train_loss: 0.9500, test_loss: 1.0594, test_f1: 0.4420
 epoch: 59, train_loss: 0.9578, test_loss: 1.0618, test_f1: 0.4448
 epoch: 60, train_loss: 0.9564, test_loss: 1.0629, test_f1: 0.4578
 epoch: 61, train_loss: 0.9453, test_loss: 1.0765, test_f1: 0.4505
 epoch: 62, train_loss: 0.9454, test_loss: 1.0721, test_f1: 0.4443
 epoch: 63, train_loss: 0.9449, test_loss: 1.0725, test_f1: 0.4490
 epoch: 64, train_loss: 0.9506, test_loss: 1.0824, test_f1: 0.4430
 epoch: 65, train_loss: 0.9472, test_loss: 1.0670, test_f1: 0.4547
 epoch: 66, train_loss: 0.9433, test_loss: 1.0680, test_f1: 0.4563
 epoch: 67, train_loss: 0.9466, test_loss: 1.1032, test_f1: 0.4356
 epoch: 68, train_loss: 0.9348, test_loss: 1.0863, test_f1: 0.4452
 epoch: 69, train_loss: 0.9343, test_loss: 1.0783, test_f1: 0.4492
 epoch: 70, train_loss: 0.9384, test_loss: 1.0779, test_f1: 0.4517
 epoch: 71, train_loss: 0.9257, test_loss: 1.0833, test_f1: 0.4538
 epoch: 72, train_loss: 0.9302, test_loss: 1.0801, test_f1: 0.4461
 epoch: 73, train_loss: 0.9403, test_loss: 1.0917, test_f1: 0.4491
 epoch: 74, train_loss: 0.9267, test_loss: 1.0732, test_f1: 0.4468
 epoch: 75, train_loss: 0.9209, test_loss: 1.0865, test_f1: 0.4467
 epoch: 76, train_loss: 0.9322, test_loss: 1.0712, test_f1: 0.4607
 epoch: 77, train_loss: 0.9200, test_loss: 1.0730, test_f1: 0.4595
 epoch: 78, train_loss: 0.9235, test_loss: 1.0742, test_f1: 0.4497
 epoch: 79, train_loss: 0.9270, test_loss: 1.0672, test_f1: 0.4567
 epoch: 80, train_loss: 0.9284, test_loss: 1.0950, test_f1: 0.4458
 epoch: 81, train_loss: 0.9082, test_loss: 1.0836, test_f1: 0.4539
 epoch: 82, train_loss: 0.9129, test_loss: 1.1068, test_f1: 0.4554
 epoch: 83, train_loss: 0.9179, test_loss: 1.0770, test_f1: 0.4487
 epoch: 84, train_loss: 0.9116, test_loss: 1.0826, test_f1: 0.4554
 epoch: 85, train_loss: 0.9126, test_loss: 1.0904, test_f1: 0.4506
 epoch: 86, train_loss: 0.9146, test_loss: 1.0957, test_f1: 0.4472
 epoch: 87, train_loss: 0.9158, test_loss: 1.0692, test_f1: 0.4581
 epoch: 88, train_loss: 0.9167, test_loss: 1.0703, test_f1: 0.4452
 epoch: 89, train_loss: 0.8988, test_loss: 1.0768, test_f1: 0.4625
 epoch: 90, train_loss: 0.9088, test_loss: 1.0981, test_f1: 0.4592
 epoch: 91, train_loss: 0.9076, test_loss: 1.0889, test_f1: 0.4596
 epoch: 92, train_loss: 0.8959, test_loss: 1.0993, test_f1: 0.4840
 epoch: 93, train_loss: 0.8976, test_loss: 1.0815, test_f1: 0.4732
 epoch: 94, train_loss: 0.9014, test_loss: 1.1128, test_f1: 0.4691
 epoch: 95, train_loss: 0.8911, test_loss: 1.0891, test_f1: 0.4612
 epoch: 96, train_loss: 0.8976, test_loss: 1.0948, test_f1: 0.4563
 epoch: 97, train_loss: 0.9002, test_loss: 1.1194, test_f1: 0.4527
 epoch: 98, train_loss: 0.8994, test_loss: 1.1057, test_f1: 0.4517
 epoch: 99, train_loss: 0.8970, test_loss: 1.0977, test_f1: 0.4659
##################ITERATION #2 ****************************************
 epoch: 0, train_loss: 1.3571, test_loss: 1.3539, test_f1: 0.2274
 epoch: 1, train_loss: 1.2982, test_loss: 1.3184, test_f1: 0.2274
 epoch: 2, train_loss: 1.2669, test_loss: 1.2788, test_f1: 0.2274
 epoch: 3, train_loss: 1.2527, test_loss: 1.2427, test_f1: 0.2274
 epoch: 4, train_loss: 1.2375, test_loss: 1.2195, test_f1: 0.2264
 epoch: 5, train_loss: 1.2245, test_loss: 1.2030, test_f1: 0.2558
 epoch: 6, train_loss: 1.2184, test_loss: 1.1815, test_f1: 0.2987
 epoch: 7, train_loss: 1.2062, test_loss: 1.1770, test_f1: 0.3387
 epoch: 8, train_loss: 1.1952, test_loss: 1.1636, test_f1: 0.3491
 epoch: 9, train_loss: 1.1902, test_loss: 1.1489, test_f1: 0.3965
 epoch: 10, train_loss: 1.1829, test_loss: 1.1467, test_f1: 0.3890
 epoch: 11, train_loss: 1.1754, test_loss: 1.1519, test_f1: 0.3820
 epoch: 12, train_loss: 1.1700, test_loss: 1.1432, test_f1: 0.4111
 epoch: 13, train_loss: 1.1551, test_loss: 1.1356, test_f1: 0.4028
 epoch: 14, train_loss: 1.1506, test_loss: 1.1361, test_f1: 0.4045
 epoch: 15, train_loss: 1.1463, test_loss: 1.1220, test_f1: 0.4164
 epoch: 16, train_loss: 1.1471, test_loss: 1.1095, test_f1: 0.4183
 epoch: 17, train_loss: 1.1430, test_loss: 1.1190, test_f1: 0.4163
 epoch: 18, train_loss: 1.1275, test_loss: 1.1289, test_f1: 0.4069
 epoch: 19, train_loss: 1.1240, test_loss: 1.1203, test_f1: 0.4203
 epoch: 20, train_loss: 1.1211, test_loss: 1.1116, test_f1: 0.4236
 epoch: 21, train_loss: 1.1130, test_loss: 1.1035, test_f1: 0.4222
 epoch: 22, train_loss: 1.1069, test_loss: 1.1094, test_f1: 0.4243
 epoch: 23, train_loss: 1.1000, test_loss: 1.1097, test_f1: 0.4283
 epoch: 24, train_loss: 1.1012, test_loss: 1.1146, test_f1: 0.4206
 epoch: 25, train_loss: 1.0937, test_loss: 1.1033, test_f1: 0.4270
 epoch: 26, train_loss: 1.0838, test_loss: 1.0895, test_f1: 0.4295
 epoch: 27, train_loss: 1.0832, test_loss: 1.1084, test_f1: 0.4182
 epoch: 28, train_loss: 1.0808, test_loss: 1.0806, test_f1: 0.4426
 epoch: 29, train_loss: 1.0741, test_loss: 1.0791, test_f1: 0.4253
 epoch: 30, train_loss: 1.0690, test_loss: 1.0871, test_f1: 0.4397
 epoch: 31, train_loss: 1.0701, test_loss: 1.0971, test_f1: 0.4174
 epoch: 32, train_loss: 1.0594, test_loss: 1.0660, test_f1: 0.4393
 epoch: 33, train_loss: 1.0614, test_loss: 1.1327, test_f1: 0.4096
 epoch: 34, train_loss: 1.0609, test_loss: 1.0662, test_f1: 0.4475
 epoch: 35, train_loss: 1.0410, test_loss: 1.0856, test_f1: 0.4095
 epoch: 36, train_loss: 1.0454, test_loss: 1.0927, test_f1: 0.4211
 epoch: 37, train_loss: 1.0317, test_loss: 1.0831, test_f1: 0.4312
 epoch: 38, train_loss: 1.0424, test_loss: 1.0721, test_f1: 0.4195
 epoch: 39, train_loss: 1.0268, test_loss: 1.0769, test_f1: 0.4073
 epoch: 40, train_loss: 1.0254, test_loss: 1.1251, test_f1: 0.4210
 epoch: 41, train_loss: 1.0291, test_loss: 1.0867, test_f1: 0.4391
 epoch: 42, train_loss: 1.0189, test_loss: 1.0742, test_f1: 0.4222
 epoch: 43, train_loss: 1.0235, test_loss: 1.0892, test_f1: 0.4209
 epoch: 44, train_loss: 1.0157, test_loss: 1.1096, test_f1: 0.4166
 epoch: 45, train_loss: 1.0193, test_loss: 1.0897, test_f1: 0.4305
 epoch: 46, train_loss: 1.0079, test_loss: 1.0880, test_f1: 0.4027
 epoch: 47, train_loss: 0.9987, test_loss: 1.1160, test_f1: 0.3968
 epoch: 48, train_loss: 1.0069, test_loss: 1.1211, test_f1: 0.4243
 epoch: 49, train_loss: 0.9901, test_loss: 1.1493, test_f1: 0.4017
 epoch: 50, train_loss: 0.9883, test_loss: 1.0849, test_f1: 0.4118
 epoch: 51, train_loss: 0.9868, test_loss: 1.1176, test_f1: 0.4053
 epoch: 52, train_loss: 0.9936, test_loss: 1.1238, test_f1: 0.4147
 epoch: 53, train_loss: 0.9811, test_loss: 1.0876, test_f1: 0.4272
 epoch: 54, train_loss: 0.9743, test_loss: 1.1081, test_f1: 0.4129
 epoch: 55, train_loss: 0.9692, test_loss: 1.1264, test_f1: 0.4265
 epoch: 56, train_loss: 0.9699, test_loss: 1.1148, test_f1: 0.4134
 epoch: 57, train_loss: 0.9732, test_loss: 1.1293, test_f1: 0.4073
 epoch: 58, train_loss: 0.9619, test_loss: 1.1155, test_f1: 0.3991
 epoch: 59, train_loss: 0.9650, test_loss: 1.1194, test_f1: 0.4163
 epoch: 60, train_loss: 0.9628, test_loss: 1.1017, test_f1: 0.4179
 epoch: 61, train_loss: 0.9538, test_loss: 1.1063, test_f1: 0.4221
 epoch: 62, train_loss: 0.9579, test_loss: 1.1133, test_f1: 0.4264
 epoch: 63, train_loss: 0.9520, test_loss: 1.1118, test_f1: 0.4103
 epoch: 64, train_loss: 0.9465, test_loss: 1.1169, test_f1: 0.4149
 epoch: 65, train_loss: 0.9472, test_loss: 1.1190, test_f1: 0.4249
 epoch: 66, train_loss: 0.9559, test_loss: 1.0996, test_f1: 0.4251
 epoch: 67, train_loss: 0.9524, test_loss: 1.1204, test_f1: 0.4225
 epoch: 68, train_loss: 0.9380, test_loss: 1.1075, test_f1: 0.4294
 epoch: 69, train_loss: 0.9350, test_loss: 1.1206, test_f1: 0.4262
 epoch: 70, train_loss: 0.9408, test_loss: 1.1373, test_f1: 0.4242
 epoch: 71, train_loss: 0.9321, test_loss: 1.1209, test_f1: 0.4234
 epoch: 72, train_loss: 0.9385, test_loss: 1.1329, test_f1: 0.4238
 epoch: 73, train_loss: 0.9429, test_loss: 1.1157, test_f1: 0.4186
 epoch: 74, train_loss: 0.9392, test_loss: 1.1359, test_f1: 0.4156
 epoch: 75, train_loss: 0.9239, test_loss: 1.1373, test_f1: 0.4033
 epoch: 76, train_loss: 0.9368, test_loss: 1.1465, test_f1: 0.4093
 epoch: 77, train_loss: 0.9340, test_loss: 1.1264, test_f1: 0.4195
 epoch: 78, train_loss: 0.9354, test_loss: 1.1474, test_f1: 0.4236
 epoch: 79, train_loss: 0.9250, test_loss: 1.1311, test_f1: 0.4308
 epoch: 80, train_loss: 0.9331, test_loss: 1.1336, test_f1: 0.4302
 epoch: 81, train_loss: 0.9284, test_loss: 1.1227, test_f1: 0.4320
 epoch: 82, train_loss: 0.9273, test_loss: 1.1350, test_f1: 0.4186
 epoch: 83, train_loss: 0.9186, test_loss: 1.1563, test_f1: 0.4240
 epoch: 84, train_loss: 0.9136, test_loss: 1.1433, test_f1: 0.4311
 epoch: 85, train_loss: 0.9198, test_loss: 1.1177, test_f1: 0.4404
 epoch: 86, train_loss: 0.9137, test_loss: 1.1551, test_f1: 0.4226
 epoch: 87, train_loss: 0.9124, test_loss: 1.1424, test_f1: 0.4310
 epoch: 88, train_loss: 0.9175, test_loss: 1.1510, test_f1: 0.4426
 epoch: 89, train_loss: 0.9132, test_loss: 1.1556, test_f1: 0.4340
 epoch: 90, train_loss: 0.9192, test_loss: 1.1488, test_f1: 0.4166
 epoch: 91, train_loss: 0.9101, test_loss: 1.1694, test_f1: 0.4256
 epoch: 92, train_loss: 0.9087, test_loss: 1.1934, test_f1: 0.4115
 epoch: 93, train_loss: 0.9089, test_loss: 1.1281, test_f1: 0.4351
 epoch: 94, train_loss: 0.9084, test_loss: 1.1847, test_f1: 0.4359
 epoch: 95, train_loss: 0.9052, test_loss: 1.1478, test_f1: 0.4396
 epoch: 96, train_loss: 0.9145, test_loss: 1.1964, test_f1: 0.4249
 epoch: 97, train_loss: 0.8991, test_loss: 1.1498, test_f1: 0.4199
 epoch: 98, train_loss: 0.9078, test_loss: 1.1633, test_f1: 0.4356
 epoch: 99, train_loss: 0.9003, test_loss: 1.1726, test_f1: 0.4303
##################ITERATION #3 ****************************************
 epoch: 0, train_loss: 1.3203, test_loss: 1.2970, test_f1: 0.2274
 epoch: 1, train_loss: 1.2680, test_loss: 1.2652, test_f1: 0.2274
 epoch: 2, train_loss: 1.2607, test_loss: 1.2428, test_f1: 0.2274
 epoch: 3, train_loss: 1.2426, test_loss: 1.2239, test_f1: 0.2592
 epoch: 4, train_loss: 1.2311, test_loss: 1.2123, test_f1: 0.2685
 epoch: 5, train_loss: 1.2309, test_loss: 1.2058, test_f1: 0.2803
 epoch: 6, train_loss: 1.2190, test_loss: 1.1992, test_f1: 0.2935
 epoch: 7, train_loss: 1.2190, test_loss: 1.1882, test_f1: 0.3253
 epoch: 8, train_loss: 1.2150, test_loss: 1.1816, test_f1: 0.3178
 epoch: 9, train_loss: 1.2022, test_loss: 1.1779, test_f1: 0.3090
 epoch: 10, train_loss: 1.1962, test_loss: 1.1711, test_f1: 0.3333
 epoch: 11, train_loss: 1.1944, test_loss: 1.1734, test_f1: 0.3405
 epoch: 12, train_loss: 1.1933, test_loss: 1.1615, test_f1: 0.3596
 epoch: 13, train_loss: 1.1913, test_loss: 1.1505, test_f1: 0.3473
 epoch: 14, train_loss: 1.1814, test_loss: 1.1435, test_f1: 0.3749
 epoch: 15, train_loss: 1.1878, test_loss: 1.1477, test_f1: 0.3962
 epoch: 16, train_loss: 1.1727, test_loss: 1.1431, test_f1: 0.3830
 epoch: 17, train_loss: 1.1724, test_loss: 1.1338, test_f1: 0.4285
 epoch: 18, train_loss: 1.1641, test_loss: 1.1241, test_f1: 0.4157
 epoch: 19, train_loss: 1.1668, test_loss: 1.1176, test_f1: 0.4262
 epoch: 20, train_loss: 1.1546, test_loss: 1.1043, test_f1: 0.4342
 epoch: 21, train_loss: 1.1482, test_loss: 1.1088, test_f1: 0.4347
 epoch: 22, train_loss: 1.1492, test_loss: 1.1041, test_f1: 0.4287
 epoch: 23, train_loss: 1.1398, test_loss: 1.0979, test_f1: 0.4404
 epoch: 24, train_loss: 1.1357, test_loss: 1.0933, test_f1: 0.4394
 epoch: 25, train_loss: 1.1265, test_loss: 1.0959, test_f1: 0.4449
 epoch: 26, train_loss: 1.1237, test_loss: 1.0771, test_f1: 0.4605
 epoch: 27, train_loss: 1.1201, test_loss: 1.0823, test_f1: 0.4573
 epoch: 28, train_loss: 1.1155, test_loss: 1.0655, test_f1: 0.4723
 epoch: 29, train_loss: 1.0982, test_loss: 1.0661, test_f1: 0.4619
 epoch: 30, train_loss: 1.1002, test_loss: 1.0675, test_f1: 0.4713
 epoch: 31, train_loss: 1.0907, test_loss: 1.0527, test_f1: 0.4763
 epoch: 32, train_loss: 1.0893, test_loss: 1.0628, test_f1: 0.4638
 epoch: 33, train_loss: 1.0879, test_loss: 1.0687, test_f1: 0.4701
 epoch: 34, train_loss: 1.0833, test_loss: 1.0261, test_f1: 0.4779
 epoch: 35, train_loss: 1.0847, test_loss: 1.0405, test_f1: 0.4695
 epoch: 36, train_loss: 1.0749, test_loss: 1.0271, test_f1: 0.4676
 epoch: 37, train_loss: 1.0729, test_loss: 1.0363, test_f1: 0.4798
 epoch: 38, train_loss: 1.0558, test_loss: 1.0157, test_f1: 0.4760
 epoch: 39, train_loss: 1.0553, test_loss: 1.0256, test_f1: 0.4836
 epoch: 40, train_loss: 1.0561, test_loss: 1.0220, test_f1: 0.4870
 epoch: 41, train_loss: 1.0527, test_loss: 1.0160, test_f1: 0.4904
 epoch: 42, train_loss: 1.0447, test_loss: 0.9999, test_f1: 0.5029
 epoch: 43, train_loss: 1.0252, test_loss: 1.0260, test_f1: 0.4857
 epoch: 44, train_loss: 1.0456, test_loss: 1.0086, test_f1: 0.4875
 epoch: 45, train_loss: 1.0384, test_loss: 1.0332, test_f1: 0.4837
 epoch: 46, train_loss: 1.0268, test_loss: 0.9927, test_f1: 0.5054
 epoch: 47, train_loss: 1.0252, test_loss: 0.9998, test_f1: 0.4825
 epoch: 48, train_loss: 1.0208, test_loss: 1.0187, test_f1: 0.4847
 epoch: 49, train_loss: 1.0177, test_loss: 0.9896, test_f1: 0.5047
 epoch: 50, train_loss: 1.0241, test_loss: 0.9976, test_f1: 0.4967
 epoch: 51, train_loss: 1.0138, test_loss: 0.9979, test_f1: 0.4826
 epoch: 52, train_loss: 1.0066, test_loss: 0.9883, test_f1: 0.4901
 epoch: 53, train_loss: 1.0016, test_loss: 1.0040, test_f1: 0.4980
 epoch: 54, train_loss: 1.0115, test_loss: 0.9839, test_f1: 0.4968
 epoch: 55, train_loss: 0.9985, test_loss: 0.9825, test_f1: 0.4950
 epoch: 56, train_loss: 1.0064, test_loss: 0.9981, test_f1: 0.4849
 epoch: 57, train_loss: 0.9879, test_loss: 0.9825, test_f1: 0.5004
 epoch: 58, train_loss: 0.9994, test_loss: 0.9924, test_f1: 0.4650
 epoch: 59, train_loss: 0.9943, test_loss: 0.9904, test_f1: 0.4912
 epoch: 60, train_loss: 0.9954, test_loss: 0.9824, test_f1: 0.4763
 epoch: 61, train_loss: 0.9881, test_loss: 0.9868, test_f1: 0.4845
 epoch: 62, train_loss: 0.9937, test_loss: 1.0033, test_f1: 0.4699
 epoch: 63, train_loss: 0.9809, test_loss: 1.0060, test_f1: 0.4633
 epoch: 64, train_loss: 0.9849, test_loss: 0.9876, test_f1: 0.4918
 epoch: 65, train_loss: 0.9827, test_loss: 0.9997, test_f1: 0.4889
 epoch: 66, train_loss: 0.9896, test_loss: 0.9919, test_f1: 0.4721
 epoch: 67, train_loss: 0.9827, test_loss: 0.9788, test_f1: 0.4898
 epoch: 68, train_loss: 0.9726, test_loss: 0.9879, test_f1: 0.4980
 epoch: 69, train_loss: 0.9681, test_loss: 0.9766, test_f1: 0.4891
 epoch: 70, train_loss: 0.9816, test_loss: 0.9806, test_f1: 0.4856
 epoch: 71, train_loss: 0.9639, test_loss: 0.9799, test_f1: 0.4969
 epoch: 72, train_loss: 0.9761, test_loss: 0.9861, test_f1: 0.4945
 epoch: 73, train_loss: 0.9620, test_loss: 0.9747, test_f1: 0.5029
 epoch: 74, train_loss: 0.9766, test_loss: 0.9818, test_f1: 0.4964
 epoch: 75, train_loss: 0.9539, test_loss: 0.9850, test_f1: 0.4882
 epoch: 76, train_loss: 0.9753, test_loss: 0.9828, test_f1: 0.4995
 epoch: 77, train_loss: 0.9653, test_loss: 0.9669, test_f1: 0.4952
 epoch: 78, train_loss: 0.9737, test_loss: 0.9896, test_f1: 0.4940
 epoch: 79, train_loss: 0.9625, test_loss: 0.9839, test_f1: 0.4846
 epoch: 80, train_loss: 0.9591, test_loss: 0.9799, test_f1: 0.5016
 epoch: 81, train_loss: 0.9697, test_loss: 0.9927, test_f1: 0.4908
 epoch: 82, train_loss: 0.9610, test_loss: 0.9920, test_f1: 0.4993
 epoch: 83, train_loss: 0.9576, test_loss: 0.9736, test_f1: 0.4922
 epoch: 84, train_loss: 0.9725, test_loss: 0.9856, test_f1: 0.4885
 epoch: 85, train_loss: 0.9671, test_loss: 1.0091, test_f1: 0.4734
 epoch: 86, train_loss: 0.9618, test_loss: 0.9793, test_f1: 0.4939
 epoch: 87, train_loss: 0.9621, test_loss: 0.9769, test_f1: 0.4948
 epoch: 88, train_loss: 0.9649, test_loss: 0.9962, test_f1: 0.4797
 epoch: 89, train_loss: 0.9580, test_loss: 1.0109, test_f1: 0.4780
 epoch: 90, train_loss: 0.9543, test_loss: 0.9918, test_f1: 0.4905
 epoch: 91, train_loss: 0.9481, test_loss: 1.0043, test_f1: 0.4747
 epoch: 92, train_loss: 0.9517, test_loss: 0.9756, test_f1: 0.5029
 epoch: 93, train_loss: 0.9528, test_loss: 0.9787, test_f1: 0.5002
 epoch: 94, train_loss: 0.9596, test_loss: 0.9977, test_f1: 0.4867
 epoch: 95, train_loss: 0.9469, test_loss: 0.9881, test_f1: 0.4804
 epoch: 96, train_loss: 0.9572, test_loss: 0.9650, test_f1: 0.5101
 epoch: 97, train_loss: 0.9450, test_loss: 0.9934, test_f1: 0.4891
 epoch: 98, train_loss: 0.9405, test_loss: 0.9941, test_f1: 0.4867
 epoch: 99, train_loss: 0.9352, test_loss: 0.9867, test_f1: 0.4900
##################ITERATION #4 ****************************************
 epoch: 0, train_loss: 1.4381, test_loss: 1.3217, test_f1: 0.2274
 epoch: 1, train_loss: 1.3098, test_loss: 1.2942, test_f1: 0.2274
 epoch: 2, train_loss: 1.2793, test_loss: 1.2721, test_f1: 0.2482
 epoch: 3, train_loss: 1.2501, test_loss: 1.2435, test_f1: 0.3090
 epoch: 4, train_loss: 1.2399, test_loss: 1.2164, test_f1: 0.3240
 epoch: 5, train_loss: 1.2228, test_loss: 1.1968, test_f1: 0.3537
 epoch: 6, train_loss: 1.2225, test_loss: 1.1824, test_f1: 0.3739
 epoch: 7, train_loss: 1.2101, test_loss: 1.1794, test_f1: 0.3580
 epoch: 8, train_loss: 1.1996, test_loss: 1.1638, test_f1: 0.4104
 epoch: 9, train_loss: 1.1936, test_loss: 1.1488, test_f1: 0.4027
 epoch: 10, train_loss: 1.1933, test_loss: 1.1461, test_f1: 0.3846
 epoch: 11, train_loss: 1.1859, test_loss: 1.1243, test_f1: 0.4268
 epoch: 12, train_loss: 1.1620, test_loss: 1.1108, test_f1: 0.4403
 epoch: 13, train_loss: 1.1529, test_loss: 1.1063, test_f1: 0.4383
 epoch: 14, train_loss: 1.1572, test_loss: 1.0982, test_f1: 0.4234
 epoch: 15, train_loss: 1.1583, test_loss: 1.0919, test_f1: 0.4227
 epoch: 16, train_loss: 1.1472, test_loss: 1.0748, test_f1: 0.4537
 epoch: 17, train_loss: 1.1342, test_loss: 1.0721, test_f1: 0.4434
 epoch: 18, train_loss: 1.1336, test_loss: 1.0647, test_f1: 0.4562
 epoch: 19, train_loss: 1.1280, test_loss: 1.0555, test_f1: 0.4378
 epoch: 20, train_loss: 1.1214, test_loss: 1.0457, test_f1: 0.4487
 epoch: 21, train_loss: 1.1136, test_loss: 1.0575, test_f1: 0.4506
 epoch: 22, train_loss: 1.1058, test_loss: 1.0215, test_f1: 0.4515
 epoch: 23, train_loss: 1.0953, test_loss: 1.0289, test_f1: 0.4566
 epoch: 24, train_loss: 1.0880, test_loss: 1.0128, test_f1: 0.4547
 epoch: 25, train_loss: 1.0784, test_loss: 1.0059, test_f1: 0.4576
 epoch: 26, train_loss: 1.0780, test_loss: 0.9861, test_f1: 0.4771
 epoch: 27, train_loss: 1.0651, test_loss: 0.9836, test_f1: 0.4837
 epoch: 28, train_loss: 1.0494, test_loss: 0.9784, test_f1: 0.4770
 epoch: 29, train_loss: 1.0658, test_loss: 0.9785, test_f1: 0.4738
 epoch: 30, train_loss: 1.0599, test_loss: 0.9683, test_f1: 0.4729
 epoch: 31, train_loss: 1.0469, test_loss: 0.9551, test_f1: 0.4916
 epoch: 32, train_loss: 1.0531, test_loss: 0.9850, test_f1: 0.4729
 epoch: 33, train_loss: 1.0411, test_loss: 0.9457, test_f1: 0.4864
 epoch: 34, train_loss: 1.0391, test_loss: 0.9411, test_f1: 0.4940
 epoch: 35, train_loss: 1.0324, test_loss: 0.9461, test_f1: 0.4861
 epoch: 36, train_loss: 1.0269, test_loss: 0.9420, test_f1: 0.4901
 epoch: 37, train_loss: 1.0236, test_loss: 0.9361, test_f1: 0.4857
 epoch: 38, train_loss: 1.0242, test_loss: 0.9431, test_f1: 0.4883
 epoch: 39, train_loss: 1.0212, test_loss: 0.9306, test_f1: 0.4885
 epoch: 40, train_loss: 1.0065, test_loss: 0.9317, test_f1: 0.4908
 epoch: 41, train_loss: 1.0101, test_loss: 0.9403, test_f1: 0.5055
 epoch: 42, train_loss: 1.0085, test_loss: 0.9331, test_f1: 0.4919
 epoch: 43, train_loss: 0.9946, test_loss: 0.9215, test_f1: 0.4916
 epoch: 44, train_loss: 0.9988, test_loss: 0.9235, test_f1: 0.4925
 epoch: 45, train_loss: 1.0044, test_loss: 0.9282, test_f1: 0.4816
 epoch: 46, train_loss: 0.9866, test_loss: 0.9170, test_f1: 0.4923
 epoch: 47, train_loss: 0.9917, test_loss: 0.9267, test_f1: 0.4931
 epoch: 48, train_loss: 0.9920, test_loss: 0.9118, test_f1: 0.5011
 epoch: 49, train_loss: 0.9876, test_loss: 0.9526, test_f1: 0.4847
 epoch: 50, train_loss: 0.9829, test_loss: 0.9283, test_f1: 0.4918
 epoch: 51, train_loss: 0.9807, test_loss: 0.9169, test_f1: 0.4952
 epoch: 52, train_loss: 0.9756, test_loss: 0.9092, test_f1: 0.4975
 epoch: 53, train_loss: 0.9731, test_loss: 0.9054, test_f1: 0.5017
 epoch: 54, train_loss: 0.9693, test_loss: 0.9399, test_f1: 0.4933
 epoch: 55, train_loss: 0.9723, test_loss: 0.9043, test_f1: 0.4927
 epoch: 56, train_loss: 0.9764, test_loss: 0.9034, test_f1: 0.4963
 epoch: 57, train_loss: 0.9633, test_loss: 0.9082, test_f1: 0.4982
 epoch: 58, train_loss: 0.9644, test_loss: 0.9116, test_f1: 0.4943
 epoch: 59, train_loss: 0.9620, test_loss: 0.9149, test_f1: 0.4915
 epoch: 60, train_loss: 0.9628, test_loss: 0.9138, test_f1: 0.4998
 epoch: 61, train_loss: 0.9583, test_loss: 0.9046, test_f1: 0.4893
 epoch: 62, train_loss: 0.9671, test_loss: 0.9554, test_f1: 0.4906
 epoch: 63, train_loss: 0.9668, test_loss: 0.9053, test_f1: 0.4935
 epoch: 64, train_loss: 0.9615, test_loss: 0.9045, test_f1: 0.4882
 epoch: 65, train_loss: 0.9531, test_loss: 0.9045, test_f1: 0.4949
 epoch: 66, train_loss: 0.9587, test_loss: 0.9108, test_f1: 0.4912
 epoch: 67, train_loss: 0.9664, test_loss: 0.9025, test_f1: 0.4973
 epoch: 68, train_loss: 0.9525, test_loss: 0.9223, test_f1: 0.5026
 epoch: 69, train_loss: 0.9494, test_loss: 0.9171, test_f1: 0.4908
 epoch: 70, train_loss: 0.9526, test_loss: 0.9023, test_f1: 0.4979
 epoch: 71, train_loss: 0.9632, test_loss: 0.9172, test_f1: 0.4932
 epoch: 72, train_loss: 0.9508, test_loss: 0.9085, test_f1: 0.4914
 epoch: 73, train_loss: 0.9399, test_loss: 0.9081, test_f1: 0.4835
 epoch: 74, train_loss: 0.9612, test_loss: 0.9139, test_f1: 0.4947
 epoch: 75, train_loss: 0.9492, test_loss: 0.9065, test_f1: 0.4909
 epoch: 76, train_loss: 0.9509, test_loss: 0.9133, test_f1: 0.4982
 epoch: 77, train_loss: 0.9479, test_loss: 0.9088, test_f1: 0.4842
 epoch: 78, train_loss: 0.9472, test_loss: 0.8965, test_f1: 0.5033
 epoch: 79, train_loss: 0.9488, test_loss: 0.9518, test_f1: 0.4703
 epoch: 80, train_loss: 0.9506, test_loss: 0.9023, test_f1: 0.4947
 epoch: 81, train_loss: 0.9451, test_loss: 0.9069, test_f1: 0.4981
 epoch: 82, train_loss: 0.9410, test_loss: 0.9172, test_f1: 0.4976
 epoch: 83, train_loss: 0.9402, test_loss: 0.9221, test_f1: 0.4906
 epoch: 84, train_loss: 0.9349, test_loss: 0.9103, test_f1: 0.4858
 epoch: 85, train_loss: 0.9474, test_loss: 0.9078, test_f1: 0.4908
 epoch: 86, train_loss: 0.9391, test_loss: 0.9108, test_f1: 0.4987
 epoch: 87, train_loss: 0.9341, test_loss: 0.9025, test_f1: 0.4868
 epoch: 88, train_loss: 0.9413, test_loss: 0.9130, test_f1: 0.4998
 epoch: 89, train_loss: 0.9335, test_loss: 0.9101, test_f1: 0.5022
 epoch: 90, train_loss: 0.9346, test_loss: 0.9230, test_f1: 0.4853
 epoch: 91, train_loss: 0.9342, test_loss: 0.9081, test_f1: 0.4853
 epoch: 92, train_loss: 0.9254, test_loss: 0.9205, test_f1: 0.5047
 epoch: 93, train_loss: 0.9366, test_loss: 0.9046, test_f1: 0.4962
 epoch: 94, train_loss: 0.9280, test_loss: 0.9043, test_f1: 0.5089
 epoch: 95, train_loss: 0.9360, test_loss: 0.9073, test_f1: 0.4904
 epoch: 96, train_loss: 0.9398, test_loss: 0.9016, test_f1: 0.4901
 epoch: 97, train_loss: 0.9306, test_loss: 0.8992, test_f1: 0.4872
 epoch: 98, train_loss: 0.9305, test_loss: 0.9003, test_f1: 0.4876
 epoch: 99, train_loss: 0.9452, test_loss: 0.9115, test_f1: 0.4950
##################ITERATION #5 ****************************************
 epoch: 0, train_loss: 1.5488, test_loss: 1.3555, test_f1: 0.2819
 epoch: 1, train_loss: 1.3422, test_loss: 1.2903, test_f1: 0.2532
 epoch: 2, train_loss: 1.3040, test_loss: 1.2570, test_f1: 0.2654
 epoch: 3, train_loss: 1.2710, test_loss: 1.2438, test_f1: 0.2970
 epoch: 4, train_loss: 1.2533, test_loss: 1.2250, test_f1: 0.3304
 epoch: 5, train_loss: 1.2332, test_loss: 1.2003, test_f1: 0.3331
 epoch: 6, train_loss: 1.2223, test_loss: 1.1804, test_f1: 0.3593
 epoch: 7, train_loss: 1.2032, test_loss: 1.1627, test_f1: 0.3767
 epoch: 8, train_loss: 1.1990, test_loss: 1.1500, test_f1: 0.3674
 epoch: 9, train_loss: 1.1849, test_loss: 1.1399, test_f1: 0.3749
 epoch: 10, train_loss: 1.1688, test_loss: 1.1258, test_f1: 0.3807
 epoch: 11, train_loss: 1.1610, test_loss: 1.1215, test_f1: 0.3902
 epoch: 12, train_loss: 1.1463, test_loss: 1.1037, test_f1: 0.4052
 epoch: 13, train_loss: 1.1429, test_loss: 1.0916, test_f1: 0.4080
 epoch: 14, train_loss: 1.1155, test_loss: 1.0924, test_f1: 0.4276
 epoch: 15, train_loss: 1.1226, test_loss: 1.0810, test_f1: 0.4301
 epoch: 16, train_loss: 1.1125, test_loss: 1.0847, test_f1: 0.4406
 epoch: 17, train_loss: 1.1005, test_loss: 1.0784, test_f1: 0.4374
 epoch: 18, train_loss: 1.0958, test_loss: 1.0535, test_f1: 0.4429
 epoch: 19, train_loss: 1.0784, test_loss: 1.0558, test_f1: 0.4323
 epoch: 20, train_loss: 1.0732, test_loss: 1.0464, test_f1: 0.4344
 epoch: 21, train_loss: 1.0737, test_loss: 1.0597, test_f1: 0.4227
 epoch: 22, train_loss: 1.0605, test_loss: 1.0507, test_f1: 0.4303
 epoch: 23, train_loss: 1.0568, test_loss: 1.0497, test_f1: 0.4304
 epoch: 24, train_loss: 1.0553, test_loss: 1.0314, test_f1: 0.4403
 epoch: 25, train_loss: 1.0519, test_loss: 1.0386, test_f1: 0.4304
 epoch: 26, train_loss: 1.0489, test_loss: 1.0259, test_f1: 0.4431
 epoch: 27, train_loss: 1.0351, test_loss: 1.0318, test_f1: 0.4350
 epoch: 28, train_loss: 1.0215, test_loss: 1.0282, test_f1: 0.4336
 epoch: 29, train_loss: 1.0129, test_loss: 1.0132, test_f1: 0.4458
 epoch: 30, train_loss: 1.0122, test_loss: 1.0586, test_f1: 0.4211
 epoch: 31, train_loss: 1.0178, test_loss: 1.0331, test_f1: 0.4364
 epoch: 32, train_loss: 1.0015, test_loss: 1.0245, test_f1: 0.4466
 epoch: 33, train_loss: 1.0006, test_loss: 1.0335, test_f1: 0.4454
 epoch: 34, train_loss: 0.9969, test_loss: 1.0165, test_f1: 0.4493
 epoch: 35, train_loss: 1.0015, test_loss: 1.0149, test_f1: 0.4560
 epoch: 36, train_loss: 0.9925, test_loss: 0.9884, test_f1: 0.4620
 epoch: 37, train_loss: 0.9867, test_loss: 1.0024, test_f1: 0.4464
 epoch: 38, train_loss: 0.9799, test_loss: 1.0068, test_f1: 0.4470
 epoch: 39, train_loss: 0.9774, test_loss: 0.9906, test_f1: 0.4718
 epoch: 40, train_loss: 0.9838, test_loss: 1.0012, test_f1: 0.4606
 epoch: 41, train_loss: 0.9737, test_loss: 0.9895, test_f1: 0.4619
 epoch: 42, train_loss: 0.9715, test_loss: 1.0077, test_f1: 0.4552
 epoch: 43, train_loss: 0.9692, test_loss: 0.9886, test_f1: 0.4611
 epoch: 44, train_loss: 0.9572, test_loss: 0.9685, test_f1: 0.4552
 epoch: 45, train_loss: 0.9582, test_loss: 0.9970, test_f1: 0.4625
 epoch: 46, train_loss: 0.9533, test_loss: 0.9930, test_f1: 0.4569
 epoch: 47, train_loss: 0.9511, test_loss: 0.9701, test_f1: 0.4745
 epoch: 48, train_loss: 0.9450, test_loss: 0.9794, test_f1: 0.4817
 epoch: 49, train_loss: 0.9410, test_loss: 0.9784, test_f1: 0.4612
 epoch: 50, train_loss: 0.9389, test_loss: 1.0001, test_f1: 0.4590
 epoch: 51, train_loss: 0.9300, test_loss: 0.9853, test_f1: 0.4577
 epoch: 52, train_loss: 0.9416, test_loss: 0.9776, test_f1: 0.4707
 epoch: 53, train_loss: 0.9281, test_loss: 0.9831, test_f1: 0.4762
 epoch: 54, train_loss: 0.9202, test_loss: 0.9869, test_f1: 0.4665
 epoch: 55, train_loss: 0.9154, test_loss: 0.9723, test_f1: 0.4659
 epoch: 56, train_loss: 0.9364, test_loss: 0.9968, test_f1: 0.4593
 epoch: 57, train_loss: 0.9284, test_loss: 0.9782, test_f1: 0.4670
 epoch: 58, train_loss: 0.9206, test_loss: 0.9793, test_f1: 0.4665
 epoch: 59, train_loss: 0.9165, test_loss: 0.9850, test_f1: 0.4725
 epoch: 60, train_loss: 0.9180, test_loss: 0.9870, test_f1: 0.4641
 epoch: 61, train_loss: 0.9274, test_loss: 0.9773, test_f1: 0.4622
 epoch: 62, train_loss: 0.9256, test_loss: 0.9745, test_f1: 0.4642
 epoch: 63, train_loss: 0.9138, test_loss: 0.9750, test_f1: 0.4674
 epoch: 64, train_loss: 0.9131, test_loss: 0.9870, test_f1: 0.4772
 epoch: 65, train_loss: 0.9183, test_loss: 0.9833, test_f1: 0.4622
 epoch: 66, train_loss: 0.9034, test_loss: 0.9883, test_f1: 0.4849
 epoch: 67, train_loss: 0.9035, test_loss: 1.0193, test_f1: 0.4481
 epoch: 68, train_loss: 0.9243, test_loss: 0.9832, test_f1: 0.4535
 epoch: 69, train_loss: 0.9149, test_loss: 0.9855, test_f1: 0.4559
 epoch: 70, train_loss: 0.9043, test_loss: 0.9878, test_f1: 0.4711
 epoch: 71, train_loss: 0.9054, test_loss: 0.9890, test_f1: 0.4637
 epoch: 72, train_loss: 0.9113, test_loss: 0.9856, test_f1: 0.4560
 epoch: 73, train_loss: 0.8994, test_loss: 0.9799, test_f1: 0.4819
 epoch: 74, train_loss: 0.9034, test_loss: 0.9827, test_f1: 0.4697
 epoch: 75, train_loss: 0.8973, test_loss: 0.9852, test_f1: 0.4725
 epoch: 76, train_loss: 0.9025, test_loss: 0.9934, test_f1: 0.4812
 epoch: 77, train_loss: 0.9077, test_loss: 0.9818, test_f1: 0.4519
 epoch: 78, train_loss: 0.9017, test_loss: 0.9840, test_f1: 0.4910
 epoch: 79, train_loss: 0.9096, test_loss: 0.9872, test_f1: 0.4776
 epoch: 80, train_loss: 0.8918, test_loss: 0.9753, test_f1: 0.4825
 epoch: 81, train_loss: 0.9011, test_loss: 1.0244, test_f1: 0.4473
 epoch: 82, train_loss: 0.8975, test_loss: 0.9849, test_f1: 0.4755
 epoch: 83, train_loss: 0.8974, test_loss: 0.9822, test_f1: 0.4693
 epoch: 84, train_loss: 0.8924, test_loss: 0.9856, test_f1: 0.4556
 epoch: 85, train_loss: 0.8929, test_loss: 0.9863, test_f1: 0.4713
 epoch: 86, train_loss: 0.8856, test_loss: 0.9718, test_f1: 0.4649
 epoch: 87, train_loss: 0.8764, test_loss: 1.0004, test_f1: 0.4613
 epoch: 88, train_loss: 0.8808, test_loss: 0.9904, test_f1: 0.4584
 epoch: 89, train_loss: 0.8787, test_loss: 0.9819, test_f1: 0.4658
 epoch: 90, train_loss: 0.8883, test_loss: 0.9983, test_f1: 0.4648
 epoch: 91, train_loss: 0.8838, test_loss: 0.9778, test_f1: 0.4843
 epoch: 92, train_loss: 0.8768, test_loss: 1.0053, test_f1: 0.4576
 epoch: 93, train_loss: 0.8731, test_loss: 0.9886, test_f1: 0.4622
 epoch: 94, train_loss: 0.8829, test_loss: 0.9966, test_f1: 0.4583
 epoch: 95, train_loss: 0.8842, test_loss: 0.9776, test_f1: 0.4557
 epoch: 96, train_loss: 0.8811, test_loss: 0.9874, test_f1: 0.4623
 epoch: 97, train_loss: 0.8735, test_loss: 0.9861, test_f1: 0.4620
 epoch: 98, train_loss: 0.8776, test_loss: 0.9862, test_f1: 0.4608
 epoch: 99, train_loss: 0.8707, test_loss: 0.9897, test_f1: 0.4597
##################ITERATION #6 ****************************************
 epoch: 0, train_loss: 1.6106, test_loss: 1.3333, test_f1: 0.2274
 epoch: 1, train_loss: 1.3801, test_loss: 1.3403, test_f1: 0.2300
 epoch: 2, train_loss: 1.3150, test_loss: 1.2930, test_f1: 0.2811
 epoch: 3, train_loss: 1.2982, test_loss: 1.2493, test_f1: 0.2991
 epoch: 4, train_loss: 1.2903, test_loss: 1.2292, test_f1: 0.3309
 epoch: 5, train_loss: 1.2527, test_loss: 1.2095, test_f1: 0.3531
 epoch: 6, train_loss: 1.2345, test_loss: 1.2002, test_f1: 0.3601
 epoch: 7, train_loss: 1.2288, test_loss: 1.1940, test_f1: 0.3870
 epoch: 8, train_loss: 1.2102, test_loss: 1.1704, test_f1: 0.3932
 epoch: 9, train_loss: 1.2112, test_loss: 1.1600, test_f1: 0.4044
 epoch: 10, train_loss: 1.1940, test_loss: 1.1536, test_f1: 0.4140
 epoch: 11, train_loss: 1.1838, test_loss: 1.1443, test_f1: 0.4221
 epoch: 12, train_loss: 1.1759, test_loss: 1.1365, test_f1: 0.4183
 epoch: 13, train_loss: 1.1660, test_loss: 1.1236, test_f1: 0.4333
 epoch: 14, train_loss: 1.1683, test_loss: 1.1256, test_f1: 0.4275
 epoch: 15, train_loss: 1.1574, test_loss: 1.1138, test_f1: 0.4424
 epoch: 16, train_loss: 1.1396, test_loss: 1.0981, test_f1: 0.4411
 epoch: 17, train_loss: 1.1406, test_loss: 1.0918, test_f1: 0.4489
 epoch: 18, train_loss: 1.1273, test_loss: 1.0842, test_f1: 0.4468
 epoch: 19, train_loss: 1.1243, test_loss: 1.0772, test_f1: 0.4518
 epoch: 20, train_loss: 1.1225, test_loss: 1.0676, test_f1: 0.4463
 epoch: 21, train_loss: 1.1081, test_loss: 1.0721, test_f1: 0.4588
 epoch: 22, train_loss: 1.1022, test_loss: 1.0609, test_f1: 0.4417
 epoch: 23, train_loss: 1.0990, test_loss: 1.0499, test_f1: 0.4586
 epoch: 24, train_loss: 1.0848, test_loss: 1.0544, test_f1: 0.4508
 epoch: 25, train_loss: 1.0955, test_loss: 1.0657, test_f1: 0.4367
 epoch: 26, train_loss: 1.0821, test_loss: 1.0544, test_f1: 0.4694
 epoch: 27, train_loss: 1.0803, test_loss: 1.0675, test_f1: 0.4450
 epoch: 28, train_loss: 1.0772, test_loss: 1.0286, test_f1: 0.4619
 epoch: 29, train_loss: 1.0644, test_loss: 1.0308, test_f1: 0.4573
 epoch: 30, train_loss: 1.0590, test_loss: 1.0314, test_f1: 0.4618
 epoch: 31, train_loss: 1.0487, test_loss: 1.0373, test_f1: 0.4465
 epoch: 32, train_loss: 1.0514, test_loss: 1.0806, test_f1: 0.4619
 epoch: 33, train_loss: 1.0553, test_loss: 1.0127, test_f1: 0.4667
 epoch: 34, train_loss: 1.0365, test_loss: 1.0108, test_f1: 0.4667
 epoch: 35, train_loss: 1.0379, test_loss: 1.0828, test_f1: 0.4411
 epoch: 36, train_loss: 1.0291, test_loss: 1.0327, test_f1: 0.4578
 epoch: 37, train_loss: 1.0267, test_loss: 1.0438, test_f1: 0.4424
 epoch: 38, train_loss: 1.0229, test_loss: 1.0311, test_f1: 0.4595
 epoch: 39, train_loss: 1.0189, test_loss: 1.0238, test_f1: 0.4611
 epoch: 40, train_loss: 1.0245, test_loss: 1.1039, test_f1: 0.4599
 epoch: 41, train_loss: 1.0220, test_loss: 1.0446, test_f1: 0.4738
 epoch: 42, train_loss: 1.0064, test_loss: 1.0582, test_f1: 0.4530
 epoch: 43, train_loss: 1.0114, test_loss: 1.0311, test_f1: 0.4660
 epoch: 44, train_loss: 1.0033, test_loss: 1.0260, test_f1: 0.4653
 epoch: 45, train_loss: 0.9941, test_loss: 1.0386, test_f1: 0.4518
 epoch: 46, train_loss: 0.9927, test_loss: 1.0284, test_f1: 0.4567
 epoch: 47, train_loss: 0.9957, test_loss: 1.0644, test_f1: 0.4551
 epoch: 48, train_loss: 0.9844, test_loss: 1.0479, test_f1: 0.4668
 epoch: 49, train_loss: 0.9802, test_loss: 1.1102, test_f1: 0.4553
 epoch: 50, train_loss: 0.9786, test_loss: 1.0755, test_f1: 0.4540
 epoch: 51, train_loss: 0.9691, test_loss: 1.1153, test_f1: 0.4578
 epoch: 52, train_loss: 0.9687, test_loss: 1.1044, test_f1: 0.4656
 epoch: 53, train_loss: 0.9653, test_loss: 1.0977, test_f1: 0.4530
 epoch: 54, train_loss: 0.9702, test_loss: 1.0908, test_f1: 0.4513
 epoch: 55, train_loss: 0.9584, test_loss: 1.1085, test_f1: 0.4418
 epoch: 56, train_loss: 0.9623, test_loss: 1.1111, test_f1: 0.4623
 epoch: 57, train_loss: 0.9680, test_loss: 1.1042, test_f1: 0.4612
 epoch: 58, train_loss: 0.9623, test_loss: 1.1669, test_f1: 0.4463
 epoch: 59, train_loss: 0.9587, test_loss: 1.1314, test_f1: 0.4438
 epoch: 60, train_loss: 0.9588, test_loss: 1.1346, test_f1: 0.4620
 epoch: 61, train_loss: 0.9469, test_loss: 1.1116, test_f1: 0.4454
 epoch: 62, train_loss: 0.9472, test_loss: 1.1158, test_f1: 0.4624
 epoch: 63, train_loss: 0.9467, test_loss: 1.1500, test_f1: 0.4596
 epoch: 64, train_loss: 0.9364, test_loss: 1.1380, test_f1: 0.4453
 epoch: 65, train_loss: 0.9428, test_loss: 1.1250, test_f1: 0.4548
 epoch: 66, train_loss: 0.9486, test_loss: 1.1218, test_f1: 0.4445
 epoch: 67, train_loss: 0.9563, test_loss: 1.1033, test_f1: 0.4741
 epoch: 68, train_loss: 0.9442, test_loss: 1.0966, test_f1: 0.4620
 epoch: 69, train_loss: 0.9355, test_loss: 1.1030, test_f1: 0.4469
 epoch: 70, train_loss: 0.9338, test_loss: 1.1305, test_f1: 0.4517
 epoch: 71, train_loss: 0.9342, test_loss: 1.1520, test_f1: 0.4674
 epoch: 72, train_loss: 0.9372, test_loss: 1.1745, test_f1: 0.4410
 epoch: 73, train_loss: 0.9381, test_loss: 1.1189, test_f1: 0.4557
 epoch: 74, train_loss: 0.9213, test_loss: 1.1529, test_f1: 0.4575
 epoch: 75, train_loss: 0.9321, test_loss: 1.1112, test_f1: 0.4487
 epoch: 76, train_loss: 0.9310, test_loss: 1.1478, test_f1: 0.4627
 epoch: 77, train_loss: 0.9207, test_loss: 1.1576, test_f1: 0.4703
 epoch: 78, train_loss: 0.9318, test_loss: 1.1503, test_f1: 0.4588
 epoch: 79, train_loss: 0.9330, test_loss: 1.1649, test_f1: 0.4542
 epoch: 80, train_loss: 0.9149, test_loss: 1.1632, test_f1: 0.4776
 epoch: 81, train_loss: 0.9344, test_loss: 1.1552, test_f1: 0.4830
 epoch: 82, train_loss: 0.9205, test_loss: 1.1235, test_f1: 0.4548
 epoch: 83, train_loss: 0.9232, test_loss: 1.1058, test_f1: 0.4733
 epoch: 84, train_loss: 0.9204, test_loss: 1.1815, test_f1: 0.4731
 epoch: 85, train_loss: 0.9212, test_loss: 1.1300, test_f1: 0.4719
 epoch: 86, train_loss: 0.9144, test_loss: 1.1569, test_f1: 0.4701
 epoch: 87, train_loss: 0.9169, test_loss: 1.1027, test_f1: 0.4689
 epoch: 88, train_loss: 0.9070, test_loss: 1.1573, test_f1: 0.4619
 epoch: 89, train_loss: 0.9068, test_loss: 1.1832, test_f1: 0.4732
 epoch: 90, train_loss: 0.9048, test_loss: 1.1583, test_f1: 0.4456
 epoch: 91, train_loss: 0.8989, test_loss: 1.1369, test_f1: 0.4791
 epoch: 92, train_loss: 0.9149, test_loss: 1.1393, test_f1: 0.4647
 epoch: 93, train_loss: 0.9033, test_loss: 1.1198, test_f1: 0.4805
 epoch: 94, train_loss: 0.8966, test_loss: 1.1688, test_f1: 0.4622
 epoch: 95, train_loss: 0.9200, test_loss: 1.1202, test_f1: 0.4731
 epoch: 96, train_loss: 0.9017, test_loss: 1.0891, test_f1: 0.4967
 epoch: 97, train_loss: 0.9010, test_loss: 1.1102, test_f1: 0.4899
 epoch: 98, train_loss: 0.9153, test_loss: 1.1682, test_f1: 0.4568
 epoch: 99, train_loss: 0.9047, test_loss: 1.1522, test_f1: 0.4807
##################ITERATION #7 ****************************************
 epoch: 0, train_loss: 1.5185, test_loss: 1.3509, test_f1: 0.2274
 epoch: 1, train_loss: 1.3052, test_loss: 1.2998, test_f1: 0.2673
 epoch: 2, train_loss: 1.2755, test_loss: 1.2543, test_f1: 0.3143
 epoch: 3, train_loss: 1.2425, test_loss: 1.2173, test_f1: 0.3395
 epoch: 4, train_loss: 1.2059, test_loss: 1.1867, test_f1: 0.3992
 epoch: 5, train_loss: 1.1951, test_loss: 1.1566, test_f1: 0.4179
 epoch: 6, train_loss: 1.1812, test_loss: 1.1355, test_f1: 0.4247
 epoch: 7, train_loss: 1.1751, test_loss: 1.1229, test_f1: 0.4262
 epoch: 8, train_loss: 1.1618, test_loss: 1.1163, test_f1: 0.4358
 epoch: 9, train_loss: 1.1453, test_loss: 1.1064, test_f1: 0.4450
 epoch: 10, train_loss: 1.1586, test_loss: 1.0986, test_f1: 0.4411
 epoch: 11, train_loss: 1.1324, test_loss: 1.0905, test_f1: 0.4380
 epoch: 12, train_loss: 1.1383, test_loss: 1.0865, test_f1: 0.4534
 epoch: 13, train_loss: 1.1228, test_loss: 1.0849, test_f1: 0.4501
 epoch: 14, train_loss: 1.1251, test_loss: 1.0839, test_f1: 0.4518
 epoch: 15, train_loss: 1.1181, test_loss: 1.0760, test_f1: 0.4356
 epoch: 16, train_loss: 1.1095, test_loss: 1.0692, test_f1: 0.4299
 epoch: 17, train_loss: 1.1142, test_loss: 1.0726, test_f1: 0.4288
 epoch: 18, train_loss: 1.0996, test_loss: 1.0688, test_f1: 0.4250
 epoch: 19, train_loss: 1.0938, test_loss: 1.0652, test_f1: 0.4194
 epoch: 20, train_loss: 1.0892, test_loss: 1.0587, test_f1: 0.4302
 epoch: 21, train_loss: 1.0824, test_loss: 1.0478, test_f1: 0.4269
 epoch: 22, train_loss: 1.0795, test_loss: 1.0508, test_f1: 0.4158
 epoch: 23, train_loss: 1.0683, test_loss: 1.0602, test_f1: 0.4197
 epoch: 24, train_loss: 1.0797, test_loss: 1.0450, test_f1: 0.4261
 epoch: 25, train_loss: 1.0679, test_loss: 1.0463, test_f1: 0.4358
 epoch: 26, train_loss: 1.0518, test_loss: 1.0554, test_f1: 0.4337
 epoch: 27, train_loss: 1.0491, test_loss: 1.0389, test_f1: 0.4373
 epoch: 28, train_loss: 1.0461, test_loss: 1.0374, test_f1: 0.4389
 epoch: 29, train_loss: 1.0477, test_loss: 1.0325, test_f1: 0.4387
 epoch: 30, train_loss: 1.0382, test_loss: 1.0394, test_f1: 0.4345
 epoch: 31, train_loss: 1.0330, test_loss: 1.0465, test_f1: 0.4302
 epoch: 32, train_loss: 1.0342, test_loss: 1.0236, test_f1: 0.4334
 epoch: 33, train_loss: 1.0287, test_loss: 1.0428, test_f1: 0.4324
 epoch: 34, train_loss: 1.0275, test_loss: 1.0395, test_f1: 0.4315
 epoch: 35, train_loss: 1.0182, test_loss: 1.0192, test_f1: 0.4390
 epoch: 36, train_loss: 1.0163, test_loss: 1.0247, test_f1: 0.4382
 epoch: 37, train_loss: 1.0116, test_loss: 1.0368, test_f1: 0.4485
 epoch: 38, train_loss: 1.0081, test_loss: 1.0831, test_f1: 0.4326
 epoch: 39, train_loss: 1.0079, test_loss: 1.0075, test_f1: 0.4612
 epoch: 40, train_loss: 1.0072, test_loss: 1.0241, test_f1: 0.4425
 epoch: 41, train_loss: 1.0002, test_loss: 1.0369, test_f1: 0.4397
 epoch: 42, train_loss: 0.9980, test_loss: 1.0384, test_f1: 0.4536
 epoch: 43, train_loss: 0.9816, test_loss: 1.0514, test_f1: 0.4586
 epoch: 44, train_loss: 0.9807, test_loss: 1.0202, test_f1: 0.4647
 epoch: 45, train_loss: 0.9844, test_loss: 1.0354, test_f1: 0.4623
 epoch: 46, train_loss: 0.9816, test_loss: 1.0388, test_f1: 0.4632
 epoch: 47, train_loss: 0.9773, test_loss: 1.0555, test_f1: 0.4616
 epoch: 48, train_loss: 0.9800, test_loss: 1.0579, test_f1: 0.4539
 epoch: 49, train_loss: 0.9710, test_loss: 1.0408, test_f1: 0.4567
 epoch: 50, train_loss: 0.9686, test_loss: 1.0524, test_f1: 0.4634
 epoch: 51, train_loss: 0.9626, test_loss: 1.0509, test_f1: 0.4497
 epoch: 52, train_loss: 0.9604, test_loss: 1.0367, test_f1: 0.4547
 epoch: 53, train_loss: 0.9588, test_loss: 1.0421, test_f1: 0.4734
 epoch: 54, train_loss: 0.9571, test_loss: 1.0386, test_f1: 0.4643
 epoch: 55, train_loss: 0.9529, test_loss: 1.0281, test_f1: 0.4623
 epoch: 56, train_loss: 0.9582, test_loss: 1.0131, test_f1: 0.4715
 epoch: 57, train_loss: 0.9595, test_loss: 1.0179, test_f1: 0.4705
 epoch: 58, train_loss: 0.9427, test_loss: 1.0342, test_f1: 0.4668
 epoch: 59, train_loss: 0.9510, test_loss: 1.0502, test_f1: 0.4505
 epoch: 60, train_loss: 0.9502, test_loss: 1.0278, test_f1: 0.4702
 epoch: 61, train_loss: 0.9380, test_loss: 1.0365, test_f1: 0.4694
 epoch: 62, train_loss: 0.9390, test_loss: 1.0540, test_f1: 0.4840
 epoch: 63, train_loss: 0.9410, test_loss: 1.0391, test_f1: 0.4732
 epoch: 64, train_loss: 0.9427, test_loss: 1.0368, test_f1: 0.4721
 epoch: 65, train_loss: 0.9428, test_loss: 1.0380, test_f1: 0.4764
 epoch: 66, train_loss: 0.9346, test_loss: 1.0422, test_f1: 0.4775
 epoch: 67, train_loss: 0.9347, test_loss: 1.0357, test_f1: 0.4844
 epoch: 68, train_loss: 0.9424, test_loss: 1.0417, test_f1: 0.4796
 epoch: 69, train_loss: 0.9337, test_loss: 1.0333, test_f1: 0.4706
 epoch: 70, train_loss: 0.9219, test_loss: 1.0276, test_f1: 0.4725
 epoch: 71, train_loss: 0.9312, test_loss: 1.0382, test_f1: 0.4968
 epoch: 72, train_loss: 0.9332, test_loss: 1.0221, test_f1: 0.4858
 epoch: 73, train_loss: 0.9372, test_loss: 1.0369, test_f1: 0.4644
 epoch: 74, train_loss: 0.9309, test_loss: 1.0321, test_f1: 0.4743
 epoch: 75, train_loss: 0.9195, test_loss: 1.0423, test_f1: 0.4832
 epoch: 76, train_loss: 0.9199, test_loss: 1.0345, test_f1: 0.4734
 epoch: 77, train_loss: 0.9212, test_loss: 1.0488, test_f1: 0.4597
 epoch: 78, train_loss: 0.9227, test_loss: 1.0484, test_f1: 0.4649
 epoch: 79, train_loss: 0.9128, test_loss: 1.0283, test_f1: 0.4804
 epoch: 80, train_loss: 0.9265, test_loss: 1.0400, test_f1: 0.4758
 epoch: 81, train_loss: 0.9231, test_loss: 1.0594, test_f1: 0.4864
 epoch: 82, train_loss: 0.9160, test_loss: 1.0540, test_f1: 0.4909
 epoch: 83, train_loss: 0.9186, test_loss: 1.0289, test_f1: 0.4727
 epoch: 84, train_loss: 0.9215, test_loss: 1.0609, test_f1: 0.4754
 epoch: 85, train_loss: 0.9214, test_loss: 1.0346, test_f1: 0.4887
 epoch: 86, train_loss: 0.9135, test_loss: 1.0497, test_f1: 0.4790
 epoch: 87, train_loss: 0.9183, test_loss: 1.0520, test_f1: 0.4700
 epoch: 88, train_loss: 0.9108, test_loss: 1.0749, test_f1: 0.4772
 epoch: 89, train_loss: 0.9156, test_loss: 1.0534, test_f1: 0.4711
 epoch: 90, train_loss: 0.9084, test_loss: 1.0614, test_f1: 0.4709
 epoch: 91, train_loss: 0.8979, test_loss: 1.0624, test_f1: 0.5068
 epoch: 92, train_loss: 0.9078, test_loss: 1.0538, test_f1: 0.4784
 epoch: 93, train_loss: 0.9020, test_loss: 1.0557, test_f1: 0.4881
 epoch: 94, train_loss: 0.9083, test_loss: 1.0584, test_f1: 0.4792
 epoch: 95, train_loss: 0.8986, test_loss: 1.0634, test_f1: 0.4781
 epoch: 96, train_loss: 0.9045, test_loss: 1.0357, test_f1: 0.4870
 epoch: 97, train_loss: 0.9097, test_loss: 1.0334, test_f1: 0.4815
 epoch: 98, train_loss: 0.9013, test_loss: 1.0568, test_f1: 0.4827
 epoch: 99, train_loss: 0.8907, test_loss: 1.0463, test_f1: 0.5121
##################ITERATION #8 ****************************************
 epoch: 0, train_loss: 1.4981, test_loss: 1.2953, test_f1: 0.2274
 epoch: 1, train_loss: 1.3271, test_loss: 1.2637, test_f1: 0.2274
 epoch: 2, train_loss: 1.2803, test_loss: 1.2246, test_f1: 0.3234
 epoch: 3, train_loss: 1.2468, test_loss: 1.2010, test_f1: 0.3823
 epoch: 4, train_loss: 1.2164, test_loss: 1.1975, test_f1: 0.3828
 epoch: 5, train_loss: 1.2039, test_loss: 1.1730, test_f1: 0.3763
 epoch: 6, train_loss: 1.1924, test_loss: 1.1627, test_f1: 0.3815
 epoch: 7, train_loss: 1.1870, test_loss: 1.1530, test_f1: 0.3909
 epoch: 8, train_loss: 1.1780, test_loss: 1.1419, test_f1: 0.4002
 epoch: 9, train_loss: 1.1712, test_loss: 1.1378, test_f1: 0.4065
 epoch: 10, train_loss: 1.1737, test_loss: 1.1269, test_f1: 0.4101
 epoch: 11, train_loss: 1.1595, test_loss: 1.1254, test_f1: 0.4042
 epoch: 12, train_loss: 1.1538, test_loss: 1.1184, test_f1: 0.4260
 epoch: 13, train_loss: 1.1510, test_loss: 1.1126, test_f1: 0.4217
 epoch: 14, train_loss: 1.1416, test_loss: 1.1088, test_f1: 0.4277
 epoch: 15, train_loss: 1.1334, test_loss: 1.0981, test_f1: 0.4384
 epoch: 16, train_loss: 1.1334, test_loss: 1.0925, test_f1: 0.4289
 epoch: 17, train_loss: 1.1108, test_loss: 1.0885, test_f1: 0.4224
 epoch: 18, train_loss: 1.1084, test_loss: 1.0760, test_f1: 0.4294
 epoch: 19, train_loss: 1.1013, test_loss: 1.0744, test_f1: 0.4279
 epoch: 20, train_loss: 1.0954, test_loss: 1.0687, test_f1: 0.4163
 epoch: 21, train_loss: 1.0893, test_loss: 1.0595, test_f1: 0.4266
 epoch: 22, train_loss: 1.0858, test_loss: 1.0508, test_f1: 0.4331
 epoch: 23, train_loss: 1.0802, test_loss: 1.0487, test_f1: 0.4285
 epoch: 24, train_loss: 1.0706, test_loss: 1.0371, test_f1: 0.4403
 epoch: 25, train_loss: 1.0616, test_loss: 1.0309, test_f1: 0.4287
 epoch: 26, train_loss: 1.0587, test_loss: 1.0199, test_f1: 0.4367
 epoch: 27, train_loss: 1.0547, test_loss: 1.0283, test_f1: 0.4188
 epoch: 28, train_loss: 1.0466, test_loss: 1.0125, test_f1: 0.4311
 epoch: 29, train_loss: 1.0350, test_loss: 1.0118, test_f1: 0.4347
 epoch: 30, train_loss: 1.0372, test_loss: 1.0178, test_f1: 0.4355
 epoch: 31, train_loss: 1.0289, test_loss: 1.0009, test_f1: 0.4362
 epoch: 32, train_loss: 1.0193, test_loss: 0.9943, test_f1: 0.4239
 epoch: 33, train_loss: 1.0139, test_loss: 1.0008, test_f1: 0.4445
 epoch: 34, train_loss: 1.0117, test_loss: 0.9864, test_f1: 0.4359
 epoch: 35, train_loss: 1.0111, test_loss: 0.9833, test_f1: 0.4533
 epoch: 36, train_loss: 0.9954, test_loss: 0.9877, test_f1: 0.4498
 epoch: 37, train_loss: 0.9890, test_loss: 0.9944, test_f1: 0.4627
 epoch: 38, train_loss: 0.9888, test_loss: 0.9777, test_f1: 0.4442
 epoch: 39, train_loss: 0.9805, test_loss: 0.9756, test_f1: 0.4647
 epoch: 40, train_loss: 0.9808, test_loss: 1.0056, test_f1: 0.4330
 epoch: 41, train_loss: 0.9803, test_loss: 0.9622, test_f1: 0.4723
 epoch: 42, train_loss: 0.9787, test_loss: 0.9707, test_f1: 0.4526
 epoch: 43, train_loss: 0.9638, test_loss: 0.9920, test_f1: 0.4691
 epoch: 44, train_loss: 0.9676, test_loss: 0.9888, test_f1: 0.4697
 epoch: 45, train_loss: 0.9680, test_loss: 0.9840, test_f1: 0.4595
 epoch: 46, train_loss: 0.9548, test_loss: 0.9542, test_f1: 0.4813
 epoch: 47, train_loss: 0.9490, test_loss: 0.9650, test_f1: 0.4780
 epoch: 48, train_loss: 0.9354, test_loss: 0.9694, test_f1: 0.4655
 epoch: 49, train_loss: 0.9303, test_loss: 0.9603, test_f1: 0.4691
 epoch: 50, train_loss: 0.9340, test_loss: 0.9802, test_f1: 0.4638
 epoch: 51, train_loss: 0.9284, test_loss: 0.9708, test_f1: 0.4588
 epoch: 52, train_loss: 0.9346, test_loss: 0.9639, test_f1: 0.4696
 epoch: 53, train_loss: 0.9269, test_loss: 0.9605, test_f1: 0.4731
 epoch: 54, train_loss: 0.9217, test_loss: 0.9592, test_f1: 0.4729
 epoch: 55, train_loss: 0.9190, test_loss: 0.9648, test_f1: 0.4681
 epoch: 56, train_loss: 0.9180, test_loss: 0.9589, test_f1: 0.4749
 epoch: 57, train_loss: 0.9206, test_loss: 0.9611, test_f1: 0.4788
 epoch: 58, train_loss: 0.9140, test_loss: 0.9664, test_f1: 0.4690
 epoch: 59, train_loss: 0.9173, test_loss: 0.9576, test_f1: 0.4775
 epoch: 60, train_loss: 0.9116, test_loss: 0.9573, test_f1: 0.4737
 epoch: 61, train_loss: 0.9122, test_loss: 0.9763, test_f1: 0.4798
 epoch: 62, train_loss: 0.9200, test_loss: 0.9655, test_f1: 0.4849
 epoch: 63, train_loss: 0.9103, test_loss: 0.9598, test_f1: 0.4824
 epoch: 64, train_loss: 0.9070, test_loss: 0.9536, test_f1: 0.4767
 epoch: 65, train_loss: 0.9101, test_loss: 0.9744, test_f1: 0.4728
 epoch: 66, train_loss: 0.9121, test_loss: 0.9726, test_f1: 0.4807
 epoch: 67, train_loss: 0.9105, test_loss: 0.9611, test_f1: 0.4817
 epoch: 68, train_loss: 0.9012, test_loss: 0.9672, test_f1: 0.4709
 epoch: 69, train_loss: 0.9013, test_loss: 0.9770, test_f1: 0.4726
 epoch: 70, train_loss: 0.8887, test_loss: 0.9592, test_f1: 0.4821
 epoch: 71, train_loss: 0.8955, test_loss: 0.9873, test_f1: 0.4747
 epoch: 72, train_loss: 0.8916, test_loss: 0.9761, test_f1: 0.4664
 epoch: 73, train_loss: 0.8985, test_loss: 0.9689, test_f1: 0.4817
 epoch: 74, train_loss: 0.8895, test_loss: 0.9625, test_f1: 0.4820
 epoch: 75, train_loss: 0.8907, test_loss: 0.9723, test_f1: 0.4795
 epoch: 76, train_loss: 0.8865, test_loss: 0.9700, test_f1: 0.4784
 epoch: 77, train_loss: 0.8917, test_loss: 0.9817, test_f1: 0.4747
 epoch: 78, train_loss: 0.8877, test_loss: 0.9850, test_f1: 0.4712
 epoch: 79, train_loss: 0.8792, test_loss: 0.9592, test_f1: 0.4725
 epoch: 80, train_loss: 0.8867, test_loss: 0.9676, test_f1: 0.4750
 epoch: 81, train_loss: 0.8878, test_loss: 0.9882, test_f1: 0.4655
 epoch: 82, train_loss: 0.8806, test_loss: 0.9840, test_f1: 0.4993
 epoch: 83, train_loss: 0.8868, test_loss: 0.9710, test_f1: 0.4787
 epoch: 84, train_loss: 0.8829, test_loss: 0.9836, test_f1: 0.4775
 epoch: 85, train_loss: 0.8771, test_loss: 0.9746, test_f1: 0.4758
 epoch: 86, train_loss: 0.8819, test_loss: 0.9851, test_f1: 0.4703
 epoch: 87, train_loss: 0.8864, test_loss: 0.9946, test_f1: 0.4794
 epoch: 88, train_loss: 0.8735, test_loss: 0.9814, test_f1: 0.4989
 epoch: 89, train_loss: 0.8740, test_loss: 0.9624, test_f1: 0.4833
 epoch: 90, train_loss: 0.8694, test_loss: 0.9709, test_f1: 0.4916
 epoch: 91, train_loss: 0.8780, test_loss: 0.9831, test_f1: 0.4880
 epoch: 92, train_loss: 0.8692, test_loss: 0.9763, test_f1: 0.4846
 epoch: 93, train_loss: 0.8820, test_loss: 0.9773, test_f1: 0.5029
 epoch: 94, train_loss: 0.8583, test_loss: 0.9838, test_f1: 0.4909
 epoch: 95, train_loss: 0.8682, test_loss: 0.9747, test_f1: 0.4932
 epoch: 96, train_loss: 0.8715, test_loss: 0.9840, test_f1: 0.4926
 epoch: 97, train_loss: 0.8583, test_loss: 0.9685, test_f1: 0.4977
 epoch: 98, train_loss: 0.8637, test_loss: 0.9528, test_f1: 0.4681
 epoch: 99, train_loss: 0.8619, test_loss: 0.9864, test_f1: 0.4895
##################ITERATION #9 ****************************************
 epoch: 0, train_loss: 1.4237, test_loss: 1.3411, test_f1: 0.2274
 epoch: 1, train_loss: 1.2946, test_loss: 1.2954, test_f1: 0.2856
 epoch: 2, train_loss: 1.2594, test_loss: 1.2426, test_f1: 0.2888
 epoch: 3, train_loss: 1.2353, test_loss: 1.2248, test_f1: 0.3094
 epoch: 4, train_loss: 1.2138, test_loss: 1.2001, test_f1: 0.3356
 epoch: 5, train_loss: 1.2241, test_loss: 1.1891, test_f1: 0.3619
 epoch: 6, train_loss: 1.2161, test_loss: 1.1783, test_f1: 0.3547
 epoch: 7, train_loss: 1.1932, test_loss: 1.1626, test_f1: 0.3758
 epoch: 8, train_loss: 1.1921, test_loss: 1.1551, test_f1: 0.3832
 epoch: 9, train_loss: 1.1865, test_loss: 1.1470, test_f1: 0.3836
 epoch: 10, train_loss: 1.1755, test_loss: 1.1338, test_f1: 0.3840
 epoch: 11, train_loss: 1.1768, test_loss: 1.1256, test_f1: 0.4237
 epoch: 12, train_loss: 1.1668, test_loss: 1.1180, test_f1: 0.4177
 epoch: 13, train_loss: 1.1487, test_loss: 1.1149, test_f1: 0.3888
 epoch: 14, train_loss: 1.1463, test_loss: 1.1132, test_f1: 0.4204
 epoch: 15, train_loss: 1.1442, test_loss: 1.1029, test_f1: 0.4212
 epoch: 16, train_loss: 1.1469, test_loss: 1.0972, test_f1: 0.3847
 epoch: 17, train_loss: 1.1286, test_loss: 1.0942, test_f1: 0.4202
 epoch: 18, train_loss: 1.1259, test_loss: 1.0884, test_f1: 0.4403
 epoch: 19, train_loss: 1.1272, test_loss: 1.0790, test_f1: 0.4179
 epoch: 20, train_loss: 1.1015, test_loss: 1.0765, test_f1: 0.4205
 epoch: 21, train_loss: 1.0985, test_loss: 1.0701, test_f1: 0.4342
 epoch: 22, train_loss: 1.0895, test_loss: 1.0567, test_f1: 0.4292
 epoch: 23, train_loss: 1.0961, test_loss: 1.0569, test_f1: 0.4370
 epoch: 24, train_loss: 1.0864, test_loss: 1.0466, test_f1: 0.4415
 epoch: 25, train_loss: 1.0878, test_loss: 1.0374, test_f1: 0.4398
 epoch: 26, train_loss: 1.0734, test_loss: 1.0447, test_f1: 0.4215
 epoch: 27, train_loss: 1.0586, test_loss: 1.0462, test_f1: 0.4397
 epoch: 28, train_loss: 1.0608, test_loss: 1.0396, test_f1: 0.4230
 epoch: 29, train_loss: 1.0666, test_loss: 1.0409, test_f1: 0.4354
 epoch: 30, train_loss: 1.0610, test_loss: 1.0268, test_f1: 0.4477
 epoch: 31, train_loss: 1.0419, test_loss: 1.0131, test_f1: 0.4649
 epoch: 32, train_loss: 1.0447, test_loss: 1.0226, test_f1: 0.4615
 epoch: 33, train_loss: 1.0370, test_loss: 1.0354, test_f1: 0.4290
 epoch: 34, train_loss: 1.0379, test_loss: 1.0325, test_f1: 0.4223
 epoch: 35, train_loss: 1.0349, test_loss: 1.0019, test_f1: 0.4449
 epoch: 36, train_loss: 1.0201, test_loss: 0.9982, test_f1: 0.4699
 epoch: 37, train_loss: 1.0127, test_loss: 1.0496, test_f1: 0.4459
 epoch: 38, train_loss: 1.0121, test_loss: 1.0278, test_f1: 0.4682
 epoch: 39, train_loss: 1.0148, test_loss: 1.0226, test_f1: 0.4620
 epoch: 40, train_loss: 1.0057, test_loss: 0.9879, test_f1: 0.4686
 epoch: 41, train_loss: 1.0003, test_loss: 0.9797, test_f1: 0.4770
 epoch: 42, train_loss: 1.0123, test_loss: 1.0043, test_f1: 0.4777
 epoch: 43, train_loss: 1.0108, test_loss: 0.9830, test_f1: 0.4804
 epoch: 44, train_loss: 0.9980, test_loss: 0.9931, test_f1: 0.4672
 epoch: 45, train_loss: 0.9991, test_loss: 1.0027, test_f1: 0.4713
 epoch: 46, train_loss: 1.0021, test_loss: 0.9821, test_f1: 0.4735
 epoch: 47, train_loss: 0.9881, test_loss: 0.9945, test_f1: 0.4530
 epoch: 48, train_loss: 0.9805, test_loss: 0.9868, test_f1: 0.4678
 epoch: 49, train_loss: 0.9849, test_loss: 0.9744, test_f1: 0.4846
 epoch: 50, train_loss: 0.9808, test_loss: 0.9675, test_f1: 0.4697
 epoch: 51, train_loss: 0.9784, test_loss: 0.9673, test_f1: 0.5003
 epoch: 52, train_loss: 0.9746, test_loss: 0.9813, test_f1: 0.4825
 epoch: 53, train_loss: 0.9655, test_loss: 0.9720, test_f1: 0.4820
 epoch: 54, train_loss: 0.9533, test_loss: 0.9682, test_f1: 0.4833
 epoch: 55, train_loss: 0.9781, test_loss: 0.9834, test_f1: 0.4792
 epoch: 56, train_loss: 0.9647, test_loss: 0.9838, test_f1: 0.4720
 epoch: 57, train_loss: 0.9634, test_loss: 0.9808, test_f1: 0.4690
 epoch: 58, train_loss: 0.9614, test_loss: 0.9747, test_f1: 0.4895
 epoch: 59, train_loss: 0.9580, test_loss: 0.9683, test_f1: 0.4851
 epoch: 60, train_loss: 0.9576, test_loss: 0.9731, test_f1: 0.4826
 epoch: 61, train_loss: 0.9509, test_loss: 0.9715, test_f1: 0.4864
 epoch: 62, train_loss: 0.9601, test_loss: 0.9644, test_f1: 0.4930
 epoch: 63, train_loss: 0.9451, test_loss: 0.9824, test_f1: 0.4763
 epoch: 64, train_loss: 0.9522, test_loss: 0.9904, test_f1: 0.4728
 epoch: 65, train_loss: 0.9476, test_loss: 0.9777, test_f1: 0.4888
 epoch: 66, train_loss: 0.9512, test_loss: 0.9709, test_f1: 0.4949
 epoch: 67, train_loss: 0.9502, test_loss: 0.9699, test_f1: 0.4774
 epoch: 68, train_loss: 0.9512, test_loss: 0.9741, test_f1: 0.4896
 epoch: 69, train_loss: 0.9402, test_loss: 0.9780, test_f1: 0.4758
 epoch: 70, train_loss: 0.9518, test_loss: 0.9720, test_f1: 0.4900
 epoch: 71, train_loss: 0.9502, test_loss: 0.9763, test_f1: 0.4896
 epoch: 72, train_loss: 0.9307, test_loss: 0.9843, test_f1: 0.4811
 epoch: 73, train_loss: 0.9426, test_loss: 0.9753, test_f1: 0.4953
 epoch: 74, train_loss: 0.9257, test_loss: 0.9824, test_f1: 0.4832
 epoch: 75, train_loss: 0.9347, test_loss: 0.9550, test_f1: 0.5012
 epoch: 76, train_loss: 0.9264, test_loss: 0.9776, test_f1: 0.4935
 epoch: 77, train_loss: 0.9476, test_loss: 0.9685, test_f1: 0.4721
 epoch: 78, train_loss: 0.9355, test_loss: 0.9715, test_f1: 0.4969
 epoch: 79, train_loss: 0.9288, test_loss: 0.9721, test_f1: 0.4813
 epoch: 80, train_loss: 0.9328, test_loss: 0.9895, test_f1: 0.4888
 epoch: 81, train_loss: 0.9340, test_loss: 0.9744, test_f1: 0.4970
 epoch: 82, train_loss: 0.9336, test_loss: 0.9712, test_f1: 0.4924
 epoch: 83, train_loss: 0.9155, test_loss: 0.9923, test_f1: 0.4840
 epoch: 84, train_loss: 0.9094, test_loss: 0.9873, test_f1: 0.4772
 epoch: 85, train_loss: 0.9254, test_loss: 0.9875, test_f1: 0.4983
 epoch: 86, train_loss: 0.9345, test_loss: 0.9891, test_f1: 0.4816
 epoch: 87, train_loss: 0.9320, test_loss: 0.9656, test_f1: 0.4938
 epoch: 88, train_loss: 0.9228, test_loss: 0.9718, test_f1: 0.4941
 epoch: 89, train_loss: 0.9168, test_loss: 0.9937, test_f1: 0.4847
 epoch: 90, train_loss: 0.9182, test_loss: 1.0038, test_f1: 0.4896
 epoch: 91, train_loss: 0.9215, test_loss: 0.9639, test_f1: 0.4959
 epoch: 92, train_loss: 0.9204, test_loss: 0.9898, test_f1: 0.5011
 epoch: 93, train_loss: 0.9182, test_loss: 1.0002, test_f1: 0.4916
 epoch: 94, train_loss: 0.9127, test_loss: 0.9780, test_f1: 0.4933
 epoch: 95, train_loss: 0.9124, test_loss: 0.9978, test_f1: 0.4919
 epoch: 96, train_loss: 0.9187, test_loss: 0.9983, test_f1: 0.4910
 epoch: 97, train_loss: 0.9136, test_loss: 0.9933, test_f1: 0.4971
 epoch: 98, train_loss: 0.9032, test_loss: 0.9914, test_f1: 0.4929
 epoch: 99, train_loss: 0.9151, test_loss: 0.9933, test_f1: 0.4931

Training completed in 388.47 seconds
Best F1: 0.5121 at epoch 99
Mean F1 across iterations: 0.4915  0.0207
========================FINAL RESULTS================================
FEGIN weighted F1: 0.5121  0.0207
python main.py --data ltspice_examples --representation component_component --model FEGIN --layers 4 --hiddens 16 --batch_size 256 --lr 0.001 --emb_size 512 --epochs 100 --save_appendix component_component_L4_H16_BS256_LR0.001_E512 --no_val
-----



STDERR:
  File "main.py", line 370, in <module>
    main()
  File "main.py", line 254, in main
    dataset = dataset_class(
  File "/home/philip/projects/ltspice_examples_code_repo/Circuit-Completion-Using-GNNs/component_classification_with_link_prediction_head/evaluation/FEGIN/kernel/circuit_datasets.py", line 15, in __init__
    self.data, self.slices = torch.load(self.processed_paths[0])
  File "/home/philip/.local/lib/python3.8/site-packages/torch/serialization.py", line 1040, in load
    warnings.warn(
  File "/usr/lib/python3.8/warnings.py", line 109, in _showwarnmsg
    sw(msg.message, msg.category, msg.filename, msg.lineno,
  File "main.py", line 47, in warn_with_traceback
    traceback.print_stack(file=log)
/home/philip/projects/ltspice_examples_code_repo/Circuit-Completion-Using-GNNs/component_classification_with_link_prediction_head/evaluation/FEGIN/kernel/circuit_datasets.py:15: FutureWarning: You are using `torch.load` with `weights_only=False` (the current default value), which uses the default pickle module implicitly. It is possible to construct malicious pickle data which will execute arbitrary code during unpickling (See https://github.com/pytorch/pytorch/blob/main/SECURITY.md#untrusted-models for more details). In a future release, the default value for `weights_only` will be flipped to `True`. This limits the functions that could be executed during unpickling. Arbitrary objects will no longer be allowed to be loaded via this mode unless they are explicitly allowlisted by the user via `torch.serialization.add_safe_globals`. We recommend you start setting `weights_only=True` for any use case where you don't have full control of the loaded file. Please open an issue on GitHub for any issues related to this experimental feature.
  self.data, self.slices = torch.load(self.processed_paths[0])
