STDOUT:
Results will be saved in /home/philip/projects/ltspice_examples_code_repo/Circuit-Completion-Using-GNNs/component_classification_with_link_prediction_head/evaluation/FEGIN/results/model_FEGIN_dataset_ltspice_demos
Command line input: python main.py --data ltspice_demos --representation component_net --model FEGIN --layers 3 --hiddens 64 --batch_size 128 --lr 0.01 --emb_size 250 --epochs 100 --save_appendix component_net_L3_H64_BS128_LR0.01_E250 --no_val
 is saved.
-----
ltspice_demos - FEGIN
Using 3 layers, 64 hidden units, h = 2
Loading component_net representation dataset
ENTERED
Training FEGIN on component_net representation
Train: 1565, Test: 383
##################ITERATION #0 ****************************************
 epoch: 0, train_loss: 1.2190, test_loss: 1.4842, test_f1: 0.2281
 epoch: 1, train_loss: 1.1374, test_loss: 1.2916, test_f1: 0.2281
 epoch: 2, train_loss: 1.1177, test_loss: 1.3111, test_f1: 0.3069
 epoch: 3, train_loss: 1.0467, test_loss: 1.0866, test_f1: 0.3995
 epoch: 4, train_loss: 0.9923, test_loss: 1.1129, test_f1: 0.5255
 epoch: 5, train_loss: 0.9568, test_loss: 1.2123, test_f1: 0.5467
 epoch: 6, train_loss: 0.9319, test_loss: 1.1655, test_f1: 0.5133
 epoch: 7, train_loss: 0.9034, test_loss: 1.1150, test_f1: 0.5492
 epoch: 8, train_loss: 0.9029, test_loss: 1.0782, test_f1: 0.5510
 epoch: 9, train_loss: 0.9168, test_loss: 1.0470, test_f1: 0.5159
 epoch: 10, train_loss: 0.8748, test_loss: 1.2561, test_f1: 0.3889
 epoch: 11, train_loss: 0.8456, test_loss: 1.0985, test_f1: 0.5382
 epoch: 12, train_loss: 0.8503, test_loss: 1.3920, test_f1: 0.4895
 epoch: 13, train_loss: 0.8205, test_loss: 1.1593, test_f1: 0.5212
 epoch: 14, train_loss: 0.7751, test_loss: 1.5977, test_f1: 0.4557
 epoch: 15, train_loss: 0.8511, test_loss: 1.2859, test_f1: 0.5071
 epoch: 16, train_loss: 0.8022, test_loss: 1.5077, test_f1: 0.5028
 epoch: 17, train_loss: 0.7776, test_loss: 1.1556, test_f1: 0.5608
 epoch: 18, train_loss: 0.7578, test_loss: 1.2313, test_f1: 0.5045
 epoch: 19, train_loss: 0.7402, test_loss: 1.2905, test_f1: 0.5878
 epoch: 20, train_loss: 0.7626, test_loss: 1.1068, test_f1: 0.6258
 epoch: 21, train_loss: 0.7208, test_loss: 1.1456, test_f1: 0.5874
 epoch: 22, train_loss: 0.6917, test_loss: 1.2909, test_f1: 0.5462
 epoch: 23, train_loss: 0.7018, test_loss: 2.3296, test_f1: 0.2579
 epoch: 24, train_loss: 0.7012, test_loss: 1.5338, test_f1: 0.5293
 epoch: 25, train_loss: 0.7540, test_loss: 1.9904, test_f1: 0.4445
 epoch: 26, train_loss: 0.7082, test_loss: 1.5871, test_f1: 0.5762
 epoch: 27, train_loss: 0.6884, test_loss: 1.3303, test_f1: 0.5596
 epoch: 28, train_loss: 0.6838, test_loss: 1.3876, test_f1: 0.5168
 epoch: 29, train_loss: 0.6515, test_loss: 1.6368, test_f1: 0.6071
 epoch: 30, train_loss: 0.6205, test_loss: 1.3583, test_f1: 0.5999
 epoch: 31, train_loss: 0.6317, test_loss: 1.8523, test_f1: 0.5457
 epoch: 32, train_loss: 0.6233, test_loss: 1.4597, test_f1: 0.5922
 epoch: 33, train_loss: 0.6204, test_loss: 1.4667, test_f1: 0.5803
 epoch: 34, train_loss: 0.6080, test_loss: 1.4426, test_f1: 0.5467
 epoch: 35, train_loss: 0.5655, test_loss: 1.8118, test_f1: 0.6125
 epoch: 36, train_loss: 0.6192, test_loss: 1.7324, test_f1: 0.6021
 epoch: 37, train_loss: 0.5937, test_loss: 1.5430, test_f1: 0.5946
 epoch: 38, train_loss: 0.5734, test_loss: 2.3089, test_f1: 0.5402
 epoch: 39, train_loss: 0.5719, test_loss: 1.6040, test_f1: 0.5490
 epoch: 40, train_loss: 0.6014, test_loss: 1.4324, test_f1: 0.6008
 epoch: 41, train_loss: 0.5848, test_loss: 1.7331, test_f1: 0.6164
 epoch: 42, train_loss: 0.5600, test_loss: 1.6237, test_f1: 0.6100
 epoch: 43, train_loss: 0.5599, test_loss: 1.7449, test_f1: 0.5128
 epoch: 44, train_loss: 0.5636, test_loss: 1.4274, test_f1: 0.6058
 epoch: 45, train_loss: 0.5836, test_loss: 1.8501, test_f1: 0.6118
 epoch: 46, train_loss: 0.5294, test_loss: 1.8269, test_f1: 0.5476
 epoch: 47, train_loss: 0.5027, test_loss: 2.3428, test_f1: 0.5679
 epoch: 48, train_loss: 0.5135, test_loss: 1.5399, test_f1: 0.5645
 epoch: 49, train_loss: 0.5586, test_loss: 2.6134, test_f1: 0.4991
 epoch: 50, train_loss: 0.5333, test_loss: 1.5292, test_f1: 0.6002
 epoch: 51, train_loss: 0.4844, test_loss: 2.0637, test_f1: 0.6102
 epoch: 52, train_loss: 0.4690, test_loss: 1.9431, test_f1: 0.6035
 epoch: 53, train_loss: 0.4398, test_loss: 1.8455, test_f1: 0.6319
 epoch: 54, train_loss: 0.4214, test_loss: 2.1860, test_f1: 0.6238
 epoch: 55, train_loss: 0.4011, test_loss: 2.3337, test_f1: 0.5969
 epoch: 56, train_loss: 0.4277, test_loss: 2.4100, test_f1: 0.6084
 epoch: 57, train_loss: 0.3979, test_loss: 2.9724, test_f1: 0.5960
 epoch: 58, train_loss: 0.4372, test_loss: 2.1537, test_f1: 0.6155
 epoch: 59, train_loss: 0.4071, test_loss: 2.2425, test_f1: 0.5590
 epoch: 60, train_loss: 0.3758, test_loss: 2.3790, test_f1: 0.6234
 epoch: 61, train_loss: 0.4072, test_loss: 2.7052, test_f1: 0.5953
 epoch: 62, train_loss: 0.3735, test_loss: 2.1261, test_f1: 0.6320
 epoch: 63, train_loss: 0.3923, test_loss: 2.6647, test_f1: 0.5796
 epoch: 64, train_loss: 0.3927, test_loss: 2.2139, test_f1: 0.5740
 epoch: 65, train_loss: 0.3883, test_loss: 2.2702, test_f1: 0.6198
 epoch: 66, train_loss: 0.3833, test_loss: 2.9106, test_f1: 0.6138
 epoch: 67, train_loss: 0.3723, test_loss: 2.6569, test_f1: 0.6395
 epoch: 68, train_loss: 0.4135, test_loss: 3.1729, test_f1: 0.5884
 epoch: 69, train_loss: 0.3839, test_loss: 2.6923, test_f1: 0.6051
 epoch: 70, train_loss: 0.4274, test_loss: 2.1783, test_f1: 0.6228
 epoch: 71, train_loss: 0.3726, test_loss: 2.1402, test_f1: 0.6099
 epoch: 72, train_loss: 0.3692, test_loss: 2.4732, test_f1: 0.5750
 epoch: 73, train_loss: 0.3883, test_loss: 3.6753, test_f1: 0.5799
 epoch: 74, train_loss: 0.4017, test_loss: 2.6552, test_f1: 0.5869
 epoch: 75, train_loss: 0.3747, test_loss: 2.5419, test_f1: 0.5770
 epoch: 76, train_loss: 0.3667, test_loss: 2.0278, test_f1: 0.6280
 epoch: 77, train_loss: 0.3164, test_loss: 2.7842, test_f1: 0.6084
 epoch: 78, train_loss: 0.3410, test_loss: 3.1128, test_f1: 0.6227
 epoch: 79, train_loss: 0.3329, test_loss: 2.8293, test_f1: 0.6357
 epoch: 80, train_loss: 0.3353, test_loss: 2.3209, test_f1: 0.5969
 epoch: 81, train_loss: 0.3113, test_loss: 3.7156, test_f1: 0.5899
 epoch: 82, train_loss: 0.2975, test_loss: 2.9091, test_f1: 0.5475
 epoch: 83, train_loss: 0.3310, test_loss: 3.1930, test_f1: 0.6091
 epoch: 84, train_loss: 0.3069, test_loss: 3.5473, test_f1: 0.6031
 epoch: 85, train_loss: 0.3206, test_loss: 3.3093, test_f1: 0.5664
 epoch: 86, train_loss: 0.3292, test_loss: 2.4935, test_f1: 0.5788
 epoch: 87, train_loss: 0.2960, test_loss: 3.3022, test_f1: 0.6066
 epoch: 88, train_loss: 0.2643, test_loss: 3.7559, test_f1: 0.6112
 epoch: 89, train_loss: 0.2814, test_loss: 3.6442, test_f1: 0.5851
 epoch: 90, train_loss: 0.3076, test_loss: 3.6402, test_f1: 0.5735
 epoch: 91, train_loss: 0.3158, test_loss: 3.1187, test_f1: 0.5652
 epoch: 92, train_loss: 0.2770, test_loss: 3.0102, test_f1: 0.6144
 epoch: 93, train_loss: 0.2972, test_loss: 4.2364, test_f1: 0.5725
 epoch: 94, train_loss: 0.3036, test_loss: 2.8720, test_f1: 0.5737
 epoch: 95, train_loss: 0.3221, test_loss: 4.9151, test_f1: 0.5948
 epoch: 96, train_loss: 0.3528, test_loss: 3.8575, test_f1: 0.6115
 epoch: 97, train_loss: 0.3193, test_loss: 2.7138, test_f1: 0.6055
 epoch: 98, train_loss: 0.3734, test_loss: 3.4845, test_f1: 0.5967
 epoch: 99, train_loss: 0.3269, test_loss: 3.4387, test_f1: 0.5916
##################ITERATION #1 ****************************************
 epoch: 0, train_loss: 1.2003, test_loss: 2.0907, test_f1: 0.2951
 epoch: 1, train_loss: 1.0472, test_loss: 1.3136, test_f1: 0.3724
 epoch: 2, train_loss: 0.9874, test_loss: 1.1148, test_f1: 0.4757
 epoch: 3, train_loss: 0.9358, test_loss: 1.0777, test_f1: 0.5064
 epoch: 4, train_loss: 0.9205, test_loss: 1.2091, test_f1: 0.4857
 epoch: 5, train_loss: 0.8928, test_loss: 1.1031, test_f1: 0.5206
 epoch: 6, train_loss: 0.8720, test_loss: 1.1281, test_f1: 0.5368
 epoch: 7, train_loss: 0.8651, test_loss: 1.1418, test_f1: 0.5260
 epoch: 8, train_loss: 0.8509, test_loss: 1.4350, test_f1: 0.4893
 epoch: 9, train_loss: 0.8570, test_loss: 1.1456, test_f1: 0.5357
 epoch: 10, train_loss: 0.8406, test_loss: 1.6116, test_f1: 0.4432
 epoch: 11, train_loss: 0.8424, test_loss: 1.1258, test_f1: 0.4942
 epoch: 12, train_loss: 0.8125, test_loss: 1.1341, test_f1: 0.4817
 epoch: 13, train_loss: 0.7794, test_loss: 1.1826, test_f1: 0.5405
 epoch: 14, train_loss: 0.7716, test_loss: 1.3110, test_f1: 0.4511
 epoch: 15, train_loss: 0.7803, test_loss: 1.8034, test_f1: 0.3585
 epoch: 16, train_loss: 0.7459, test_loss: 1.1423, test_f1: 0.5799
 epoch: 17, train_loss: 0.7357, test_loss: 1.0892, test_f1: 0.5550
 epoch: 18, train_loss: 0.7149, test_loss: 1.0582, test_f1: 0.5330
 epoch: 19, train_loss: 0.7403, test_loss: 1.0931, test_f1: 0.5587
 epoch: 20, train_loss: 0.7381, test_loss: 1.1189, test_f1: 0.4994
 epoch: 21, train_loss: 0.7308, test_loss: 1.4749, test_f1: 0.4669
 epoch: 22, train_loss: 0.7064, test_loss: 1.3394, test_f1: 0.5704
 epoch: 23, train_loss: 0.6891, test_loss: 1.1606, test_f1: 0.4862
 epoch: 24, train_loss: 0.6540, test_loss: 1.4785, test_f1: 0.5732
 epoch: 25, train_loss: 0.6415, test_loss: 1.3511, test_f1: 0.5463
 epoch: 26, train_loss: 0.6418, test_loss: 1.1374, test_f1: 0.5928
 epoch: 27, train_loss: 0.6552, test_loss: 1.3288, test_f1: 0.5443
 epoch: 28, train_loss: 0.6145, test_loss: 1.3895, test_f1: 0.5300
 epoch: 29, train_loss: 0.5849, test_loss: 1.4666, test_f1: 0.5453
 epoch: 30, train_loss: 0.5741, test_loss: 1.7635, test_f1: 0.4804
 epoch: 31, train_loss: 0.6123, test_loss: 1.8456, test_f1: 0.5126
 epoch: 32, train_loss: 0.6205, test_loss: 1.3878, test_f1: 0.5575
 epoch: 33, train_loss: 0.5851, test_loss: 1.7016, test_f1: 0.5463
 epoch: 34, train_loss: 0.5768, test_loss: 1.5304, test_f1: 0.5592
 epoch: 35, train_loss: 0.5611, test_loss: 1.5312, test_f1: 0.5372
 epoch: 36, train_loss: 0.5543, test_loss: 1.4675, test_f1: 0.6053
 epoch: 37, train_loss: 0.5757, test_loss: 1.3664, test_f1: 0.5303
 epoch: 38, train_loss: 0.5857, test_loss: 1.4431, test_f1: 0.5957
 epoch: 39, train_loss: 0.5496, test_loss: 1.9559, test_f1: 0.5556
 epoch: 40, train_loss: 0.5291, test_loss: 1.3736, test_f1: 0.5664
 epoch: 41, train_loss: 0.5063, test_loss: 1.6926, test_f1: 0.5880
 epoch: 42, train_loss: 0.5209, test_loss: 1.6410, test_f1: 0.5885
 epoch: 43, train_loss: 0.5029, test_loss: 2.0213, test_f1: 0.5054
 epoch: 44, train_loss: 0.5737, test_loss: 1.7845, test_f1: 0.5553
 epoch: 45, train_loss: 0.5381, test_loss: 1.6798, test_f1: 0.5820
 epoch: 46, train_loss: 0.4934, test_loss: 1.9016, test_f1: 0.5880
 epoch: 47, train_loss: 0.5284, test_loss: 1.6649, test_f1: 0.5723
 epoch: 48, train_loss: 0.4946, test_loss: 2.2231, test_f1: 0.5175
 epoch: 49, train_loss: 0.6073, test_loss: 1.9465, test_f1: 0.4940
 epoch: 50, train_loss: 0.5615, test_loss: 1.7294, test_f1: 0.5923
 epoch: 51, train_loss: 0.5054, test_loss: 1.4736, test_f1: 0.5712
 epoch: 52, train_loss: 0.4760, test_loss: 2.2486, test_f1: 0.5730
 epoch: 53, train_loss: 0.4490, test_loss: 2.1800, test_f1: 0.5951
 epoch: 54, train_loss: 0.4161, test_loss: 2.1925, test_f1: 0.5886
 epoch: 55, train_loss: 0.4204, test_loss: 1.7652, test_f1: 0.6099
 epoch: 56, train_loss: 0.3963, test_loss: 2.3676, test_f1: 0.5874
 epoch: 57, train_loss: 0.3904, test_loss: 2.0870, test_f1: 0.6170
 epoch: 58, train_loss: 0.3791, test_loss: 2.3973, test_f1: 0.5971
 epoch: 59, train_loss: 0.3572, test_loss: 2.2268, test_f1: 0.6090
 epoch: 60, train_loss: 0.3621, test_loss: 2.4145, test_f1: 0.6133
 epoch: 61, train_loss: 0.3556, test_loss: 2.5575, test_f1: 0.5847
 epoch: 62, train_loss: 0.3604, test_loss: 2.6355, test_f1: 0.5847
 epoch: 63, train_loss: 0.3535, test_loss: 2.3253, test_f1: 0.6235
 epoch: 64, train_loss: 0.3499, test_loss: 2.4964, test_f1: 0.6283
 epoch: 65, train_loss: 0.3430, test_loss: 2.8589, test_f1: 0.5610
 epoch: 66, train_loss: 0.3622, test_loss: 2.4995, test_f1: 0.5613
 epoch: 67, train_loss: 0.3646, test_loss: 2.3645, test_f1: 0.6167
 epoch: 68, train_loss: 0.3384, test_loss: 2.2178, test_f1: 0.6346
 epoch: 69, train_loss: 0.3385, test_loss: 2.5081, test_f1: 0.6267
 epoch: 70, train_loss: 0.3575, test_loss: 2.6332, test_f1: 0.5975
 epoch: 71, train_loss: 0.3097, test_loss: 2.8155, test_f1: 0.6300
 epoch: 72, train_loss: 0.3355, test_loss: 2.4573, test_f1: 0.5685
 epoch: 73, train_loss: 0.2868, test_loss: 2.8315, test_f1: 0.5684
 epoch: 74, train_loss: 0.2870, test_loss: 2.6001, test_f1: 0.6502
 epoch: 75, train_loss: 0.2819, test_loss: 2.5286, test_f1: 0.6153
 epoch: 76, train_loss: 0.3257, test_loss: 2.5827, test_f1: 0.6213
 epoch: 77, train_loss: 0.2966, test_loss: 2.7504, test_f1: 0.5783
 epoch: 78, train_loss: 0.2928, test_loss: 2.6219, test_f1: 0.6528
 epoch: 79, train_loss: 0.2949, test_loss: 2.7081, test_f1: 0.6114
 epoch: 80, train_loss: 0.2810, test_loss: 2.7063, test_f1: 0.5950
 epoch: 81, train_loss: 0.3060, test_loss: 3.2936, test_f1: 0.5781
 epoch: 82, train_loss: 0.3224, test_loss: 2.7111, test_f1: 0.5968
 epoch: 83, train_loss: 0.3199, test_loss: 3.3235, test_f1: 0.5951
 epoch: 84, train_loss: 0.3012, test_loss: 3.1415, test_f1: 0.5960
 epoch: 85, train_loss: 0.2995, test_loss: 3.4077, test_f1: 0.5520
 epoch: 86, train_loss: 0.3092, test_loss: 2.5880, test_f1: 0.6135
 epoch: 87, train_loss: 0.3067, test_loss: 2.8449, test_f1: 0.6107
 epoch: 88, train_loss: 0.2811, test_loss: 3.1254, test_f1: 0.6178
 epoch: 89, train_loss: 0.2510, test_loss: 2.8731, test_f1: 0.6177
 epoch: 90, train_loss: 0.2464, test_loss: 3.1600, test_f1: 0.6092
 epoch: 91, train_loss: 0.2584, test_loss: 3.1509, test_f1: 0.5692
 epoch: 92, train_loss: 0.2851, test_loss: 3.0264, test_f1: 0.6156
 epoch: 93, train_loss: 0.2629, test_loss: 3.0563, test_f1: 0.6177
 epoch: 94, train_loss: 0.2568, test_loss: 3.0322, test_f1: 0.5877
 epoch: 95, train_loss: 0.2503, test_loss: 4.0507, test_f1: 0.6049
 epoch: 96, train_loss: 0.3139, test_loss: 2.6941, test_f1: 0.6137
 epoch: 97, train_loss: 0.2507, test_loss: 2.9741, test_f1: 0.5912
 epoch: 98, train_loss: 0.2291, test_loss: 3.2015, test_f1: 0.5750
 epoch: 99, train_loss: 0.2577, test_loss: 2.9555, test_f1: 0.6349
##################ITERATION #2 ****************************************
 epoch: 0, train_loss: 1.2717, test_loss: 1.4427, test_f1: 0.1918
 epoch: 1, train_loss: 1.0785, test_loss: 1.2556, test_f1: 0.3488
 epoch: 2, train_loss: 1.0080, test_loss: 1.1135, test_f1: 0.4587
 epoch: 3, train_loss: 0.9728, test_loss: 1.0767, test_f1: 0.4756
 epoch: 4, train_loss: 0.9466, test_loss: 1.0937, test_f1: 0.4911
 epoch: 5, train_loss: 0.9243, test_loss: 1.0624, test_f1: 0.5403
 epoch: 6, train_loss: 0.8943, test_loss: 1.0317, test_f1: 0.5081
 epoch: 7, train_loss: 0.9011, test_loss: 1.2056, test_f1: 0.5004
 epoch: 8, train_loss: 0.8894, test_loss: 1.1357, test_f1: 0.5681
 epoch: 9, train_loss: 0.8442, test_loss: 1.1193, test_f1: 0.5686
 epoch: 10, train_loss: 0.8620, test_loss: 1.1521, test_f1: 0.5249
 epoch: 11, train_loss: 0.8211, test_loss: 1.0988, test_f1: 0.5477
 epoch: 12, train_loss: 0.8363, test_loss: 1.1134, test_f1: 0.5529
 epoch: 13, train_loss: 0.8308, test_loss: 1.0899, test_f1: 0.4914
 epoch: 14, train_loss: 0.8650, test_loss: 1.0754, test_f1: 0.5222
 epoch: 15, train_loss: 0.8106, test_loss: 1.1287, test_f1: 0.4964
 epoch: 16, train_loss: 0.7896, test_loss: 1.1236, test_f1: 0.5964
 epoch: 17, train_loss: 0.7702, test_loss: 1.4963, test_f1: 0.4521
 epoch: 18, train_loss: 0.7911, test_loss: 1.2100, test_f1: 0.4652
 epoch: 19, train_loss: 0.7521, test_loss: 1.0457, test_f1: 0.5680
 epoch: 20, train_loss: 0.7083, test_loss: 1.2881, test_f1: 0.5658
 epoch: 21, train_loss: 0.7178, test_loss: 1.2100, test_f1: 0.5760
 epoch: 22, train_loss: 0.6941, test_loss: 1.0753, test_f1: 0.6339
 epoch: 23, train_loss: 0.6869, test_loss: 1.0920, test_f1: 0.6092
 epoch: 24, train_loss: 0.6510, test_loss: 1.2027, test_f1: 0.4755
 epoch: 25, train_loss: 0.6798, test_loss: 1.1171, test_f1: 0.5655
 epoch: 26, train_loss: 0.6938, test_loss: 1.2033, test_f1: 0.5954
 epoch: 27, train_loss: 0.6603, test_loss: 1.1923, test_f1: 0.5928
 epoch: 28, train_loss: 0.6653, test_loss: 1.1493, test_f1: 0.5249
 epoch: 29, train_loss: 0.6465, test_loss: 1.2403, test_f1: 0.5873
 epoch: 30, train_loss: 0.6406, test_loss: 1.2581, test_f1: 0.5090
 epoch: 31, train_loss: 0.6351, test_loss: 1.2571, test_f1: 0.6053
 epoch: 32, train_loss: 0.6028, test_loss: 1.3103, test_f1: 0.5798
 epoch: 33, train_loss: 0.5964, test_loss: 1.3945, test_f1: 0.6012
 epoch: 34, train_loss: 0.5943, test_loss: 1.6485, test_f1: 0.5229
 epoch: 35, train_loss: 0.6135, test_loss: 1.2760, test_f1: 0.5013
 epoch: 36, train_loss: 0.5973, test_loss: 1.2228, test_f1: 0.6001
 epoch: 37, train_loss: 0.5550, test_loss: 1.2771, test_f1: 0.5868
 epoch: 38, train_loss: 0.5641, test_loss: 1.4752, test_f1: 0.6034
 epoch: 39, train_loss: 0.5591, test_loss: 1.2876, test_f1: 0.6066
 epoch: 40, train_loss: 0.5372, test_loss: 1.4488, test_f1: 0.5582
 epoch: 41, train_loss: 0.6046, test_loss: 1.2972, test_f1: 0.5199
 epoch: 42, train_loss: 0.5813, test_loss: 1.4162, test_f1: 0.5099
 epoch: 43, train_loss: 0.5841, test_loss: 1.4173, test_f1: 0.5020
 epoch: 44, train_loss: 0.5522, test_loss: 1.3989, test_f1: 0.5834
 epoch: 45, train_loss: 0.5549, test_loss: 1.4641, test_f1: 0.5819
 epoch: 46, train_loss: 0.5575, test_loss: 1.4766, test_f1: 0.6184
 epoch: 47, train_loss: 0.5254, test_loss: 1.3284, test_f1: 0.6246
 epoch: 48, train_loss: 0.5123, test_loss: 1.3176, test_f1: 0.6180
 epoch: 49, train_loss: 0.5662, test_loss: 1.2213, test_f1: 0.5800
 epoch: 50, train_loss: 0.5334, test_loss: 1.7638, test_f1: 0.4962
 epoch: 51, train_loss: 0.4856, test_loss: 1.4131, test_f1: 0.6062
 epoch: 52, train_loss: 0.5155, test_loss: 1.3552, test_f1: 0.6254
 epoch: 53, train_loss: 0.4833, test_loss: 1.2436, test_f1: 0.6167
 epoch: 54, train_loss: 0.4457, test_loss: 1.5899, test_f1: 0.6168
 epoch: 55, train_loss: 0.4398, test_loss: 1.5056, test_f1: 0.6243
 epoch: 56, train_loss: 0.4342, test_loss: 1.5799, test_f1: 0.6042
 epoch: 57, train_loss: 0.4299, test_loss: 1.4714, test_f1: 0.6041
 epoch: 58, train_loss: 0.4089, test_loss: 1.5000, test_f1: 0.6109
 epoch: 59, train_loss: 0.4423, test_loss: 1.6831, test_f1: 0.6006
 epoch: 60, train_loss: 0.4360, test_loss: 1.3322, test_f1: 0.6038
 epoch: 61, train_loss: 0.4302, test_loss: 1.8312, test_f1: 0.5988
 epoch: 62, train_loss: 0.4040, test_loss: 1.4663, test_f1: 0.6294
 epoch: 63, train_loss: 0.4069, test_loss: 1.6009, test_f1: 0.6276
 epoch: 64, train_loss: 0.3994, test_loss: 1.6876, test_f1: 0.5954
 epoch: 65, train_loss: 0.3622, test_loss: 1.6158, test_f1: 0.6255
 epoch: 66, train_loss: 0.3497, test_loss: 2.0425, test_f1: 0.6042
 epoch: 67, train_loss: 0.4064, test_loss: 1.4831, test_f1: 0.6289
 epoch: 68, train_loss: 0.3831, test_loss: 1.5087, test_f1: 0.6055
 epoch: 69, train_loss: 0.3721, test_loss: 2.2060, test_f1: 0.6072
 epoch: 70, train_loss: 0.3926, test_loss: 1.6638, test_f1: 0.6239
 epoch: 71, train_loss: 0.4004, test_loss: 1.5575, test_f1: 0.6469
 epoch: 72, train_loss: 0.3637, test_loss: 2.0677, test_f1: 0.6325
 epoch: 73, train_loss: 0.3767, test_loss: 1.7815, test_f1: 0.5832
 epoch: 74, train_loss: 0.3997, test_loss: 2.0459, test_f1: 0.5610
 epoch: 75, train_loss: 0.3759, test_loss: 1.9014, test_f1: 0.6124
 epoch: 76, train_loss: 0.3563, test_loss: 2.1002, test_f1: 0.5870
 epoch: 77, train_loss: 0.3859, test_loss: 2.0568, test_f1: 0.6145
 epoch: 78, train_loss: 0.3419, test_loss: 2.0217, test_f1: 0.6081
 epoch: 79, train_loss: 0.3792, test_loss: 2.0071, test_f1: 0.5878
 epoch: 80, train_loss: 0.3797, test_loss: 1.6433, test_f1: 0.5753
 epoch: 81, train_loss: 0.3589, test_loss: 1.8566, test_f1: 0.6265
 epoch: 82, train_loss: 0.3322, test_loss: 1.8535, test_f1: 0.6316
 epoch: 83, train_loss: 0.3300, test_loss: 1.6578, test_f1: 0.6260
 epoch: 84, train_loss: 0.3746, test_loss: 1.7510, test_f1: 0.6039
 epoch: 85, train_loss: 0.3231, test_loss: 1.9341, test_f1: 0.5907
 epoch: 86, train_loss: 0.3185, test_loss: 2.1353, test_f1: 0.6226
 epoch: 87, train_loss: 0.3333, test_loss: 2.3159, test_f1: 0.6069
 epoch: 88, train_loss: 0.3271, test_loss: 1.7664, test_f1: 0.6344
 epoch: 89, train_loss: 0.3249, test_loss: 1.8820, test_f1: 0.6021
 epoch: 90, train_loss: 0.4100, test_loss: 1.9507, test_f1: 0.5841
 epoch: 91, train_loss: 0.3617, test_loss: 1.7699, test_f1: 0.5682
 epoch: 92, train_loss: 0.3498, test_loss: 1.9025, test_f1: 0.6228
 epoch: 93, train_loss: 0.3630, test_loss: 2.0049, test_f1: 0.5951
 epoch: 94, train_loss: 0.3238, test_loss: 1.9523, test_f1: 0.6258
 epoch: 95, train_loss: 0.3152, test_loss: 1.9207, test_f1: 0.6028
 epoch: 96, train_loss: 0.3082, test_loss: 2.1305, test_f1: 0.6092
 epoch: 97, train_loss: 0.3287, test_loss: 2.1335, test_f1: 0.5981
 epoch: 98, train_loss: 0.2723, test_loss: 2.2036, test_f1: 0.6285
 epoch: 99, train_loss: 0.2677, test_loss: 2.4470, test_f1: 0.6043
##################ITERATION #3 ****************************************
 epoch: 0, train_loss: 1.3092, test_loss: 1.5507, test_f1: 0.1649
 epoch: 1, train_loss: 1.0728, test_loss: 1.3011, test_f1: 0.2300
 epoch: 2, train_loss: 1.0298, test_loss: 1.1703, test_f1: 0.3802
 epoch: 3, train_loss: 0.9761, test_loss: 1.1291, test_f1: 0.4508
 epoch: 4, train_loss: 0.9425, test_loss: 1.1207, test_f1: 0.5029
 epoch: 5, train_loss: 0.9276, test_loss: 1.0510, test_f1: 0.5207
 epoch: 6, train_loss: 0.8993, test_loss: 1.2099, test_f1: 0.4682
 epoch: 7, train_loss: 0.8905, test_loss: 1.0735, test_f1: 0.5498
 epoch: 8, train_loss: 0.8800, test_loss: 1.1358, test_f1: 0.4848
 epoch: 9, train_loss: 0.8605, test_loss: 1.1542, test_f1: 0.5073
 epoch: 10, train_loss: 0.8507, test_loss: 1.0665, test_f1: 0.4844
 epoch: 11, train_loss: 0.8685, test_loss: 1.2138, test_f1: 0.5307
 epoch: 12, train_loss: 0.8682, test_loss: 1.0407, test_f1: 0.5553
 epoch: 13, train_loss: 0.8457, test_loss: 1.0654, test_f1: 0.5751
 epoch: 14, train_loss: 0.8179, test_loss: 1.1409, test_f1: 0.4888
 epoch: 15, train_loss: 0.7973, test_loss: 1.3004, test_f1: 0.4794
 epoch: 16, train_loss: 0.7731, test_loss: 1.2819, test_f1: 0.5334
 epoch: 17, train_loss: 0.7607, test_loss: 1.1851, test_f1: 0.5378
 epoch: 18, train_loss: 0.7582, test_loss: 1.1416, test_f1: 0.5562
 epoch: 19, train_loss: 0.7209, test_loss: 1.3502, test_f1: 0.5039
 epoch: 20, train_loss: 0.7338, test_loss: 1.4987, test_f1: 0.4767
 epoch: 21, train_loss: 0.7014, test_loss: 1.1324, test_f1: 0.5766
 epoch: 22, train_loss: 0.7069, test_loss: 1.2765, test_f1: 0.5561
 epoch: 23, train_loss: 0.7288, test_loss: 1.3709, test_f1: 0.5048
 epoch: 24, train_loss: 0.7240, test_loss: 1.1605, test_f1: 0.5448
 epoch: 25, train_loss: 0.6714, test_loss: 1.1359, test_f1: 0.5474
 epoch: 26, train_loss: 0.6906, test_loss: 1.1749, test_f1: 0.6167
 epoch: 27, train_loss: 0.6942, test_loss: 1.4848, test_f1: 0.5465
 epoch: 28, train_loss: 0.6471, test_loss: 1.2322, test_f1: 0.5384
 epoch: 29, train_loss: 0.6363, test_loss: 1.2854, test_f1: 0.5826
 epoch: 30, train_loss: 0.6596, test_loss: 1.3090, test_f1: 0.5572
 epoch: 31, train_loss: 0.6238, test_loss: 1.3445, test_f1: 0.5704
 epoch: 32, train_loss: 0.6491, test_loss: 1.3418, test_f1: 0.5853
 epoch: 33, train_loss: 0.5979, test_loss: 1.5503, test_f1: 0.5668
 epoch: 34, train_loss: 0.5904, test_loss: 1.4198, test_f1: 0.5764
 epoch: 35, train_loss: 0.5966, test_loss: 1.3643, test_f1: 0.5305
 epoch: 36, train_loss: 0.6060, test_loss: 1.6003, test_f1: 0.4958
 epoch: 37, train_loss: 0.5895, test_loss: 1.6284, test_f1: 0.5736
 epoch: 38, train_loss: 0.6109, test_loss: 1.4697, test_f1: 0.5440
 epoch: 39, train_loss: 0.6177, test_loss: 1.6249, test_f1: 0.4895
 epoch: 40, train_loss: 0.6509, test_loss: 1.4201, test_f1: 0.4667
 epoch: 41, train_loss: 0.5859, test_loss: 1.1502, test_f1: 0.5828
 epoch: 42, train_loss: 0.5695, test_loss: 1.5047, test_f1: 0.5982
 epoch: 43, train_loss: 0.5816, test_loss: 1.3662, test_f1: 0.6253
 epoch: 44, train_loss: 0.5835, test_loss: 1.2494, test_f1: 0.5983
 epoch: 45, train_loss: 0.5530, test_loss: 1.3531, test_f1: 0.6192
 epoch: 46, train_loss: 0.4880, test_loss: 1.3868, test_f1: 0.6111
 epoch: 47, train_loss: 0.4949, test_loss: 1.4440, test_f1: 0.5848
 epoch: 48, train_loss: 0.5676, test_loss: 1.5762, test_f1: 0.5621
 epoch: 49, train_loss: 0.5515, test_loss: 1.4560, test_f1: 0.6054
 epoch: 50, train_loss: 0.5937, test_loss: 1.1891, test_f1: 0.6477
 epoch: 51, train_loss: 0.5560, test_loss: 1.3797, test_f1: 0.5843
 epoch: 52, train_loss: 0.4885, test_loss: 1.4925, test_f1: 0.5985
 epoch: 53, train_loss: 0.4737, test_loss: 1.5012, test_f1: 0.5738
 epoch: 54, train_loss: 0.4475, test_loss: 1.7406, test_f1: 0.5292
 epoch: 55, train_loss: 0.4096, test_loss: 1.5741, test_f1: 0.5975
 epoch: 56, train_loss: 0.3873, test_loss: 1.6094, test_f1: 0.6290
 epoch: 57, train_loss: 0.4212, test_loss: 1.5403, test_f1: 0.6151
 epoch: 58, train_loss: 0.4022, test_loss: 1.6668, test_f1: 0.6092
 epoch: 59, train_loss: 0.3866, test_loss: 1.6526, test_f1: 0.5948
 epoch: 60, train_loss: 0.3959, test_loss: 1.8300, test_f1: 0.5868
 epoch: 61, train_loss: 0.4053, test_loss: 1.5918, test_f1: 0.6158
 epoch: 62, train_loss: 0.4276, test_loss: 1.8635, test_f1: 0.6012
 epoch: 63, train_loss: 0.3942, test_loss: 1.5599, test_f1: 0.6139
 epoch: 64, train_loss: 0.3898, test_loss: 1.6594, test_f1: 0.5918
 epoch: 65, train_loss: 0.3541, test_loss: 1.9196, test_f1: 0.5969
 epoch: 66, train_loss: 0.3593, test_loss: 1.9093, test_f1: 0.6052
 epoch: 67, train_loss: 0.3322, test_loss: 1.9037, test_f1: 0.6107
 epoch: 68, train_loss: 0.3363, test_loss: 1.8299, test_f1: 0.6332
 epoch: 69, train_loss: 0.3258, test_loss: 1.7876, test_f1: 0.6515
 epoch: 70, train_loss: 0.3249, test_loss: 1.9858, test_f1: 0.6165
 epoch: 71, train_loss: 0.3460, test_loss: 1.6833, test_f1: 0.6212
 epoch: 72, train_loss: 0.3276, test_loss: 2.1798, test_f1: 0.5931
 epoch: 73, train_loss: 0.3284, test_loss: 1.9252, test_f1: 0.6040
 epoch: 74, train_loss: 0.3057, test_loss: 2.0576, test_f1: 0.6070
 epoch: 75, train_loss: 0.3509, test_loss: 1.8634, test_f1: 0.5778
 epoch: 76, train_loss: 0.3292, test_loss: 2.3105, test_f1: 0.5354
 epoch: 77, train_loss: 0.2946, test_loss: 1.9627, test_f1: 0.6052
 epoch: 78, train_loss: 0.2794, test_loss: 2.1341, test_f1: 0.6049
 epoch: 79, train_loss: 0.2854, test_loss: 2.1834, test_f1: 0.5999
 epoch: 80, train_loss: 0.3062, test_loss: 2.0986, test_f1: 0.5958
 epoch: 81, train_loss: 0.3131, test_loss: 2.2718, test_f1: 0.5805
 epoch: 82, train_loss: 0.3140, test_loss: 2.1735, test_f1: 0.5865
 epoch: 83, train_loss: 0.3202, test_loss: 2.0955, test_f1: 0.5951
 epoch: 84, train_loss: 0.2742, test_loss: 1.9988, test_f1: 0.6030
 epoch: 85, train_loss: 0.2726, test_loss: 2.2392, test_f1: 0.5929
 epoch: 86, train_loss: 0.2624, test_loss: 2.2294, test_f1: 0.5765
 epoch: 87, train_loss: 0.2485, test_loss: 2.2734, test_f1: 0.5823
 epoch: 88, train_loss: 0.2503, test_loss: 2.2102, test_f1: 0.5986
 epoch: 89, train_loss: 0.2521, test_loss: 2.2227, test_f1: 0.6134
 epoch: 90, train_loss: 0.2538, test_loss: 2.4893, test_f1: 0.6191
 epoch: 91, train_loss: 0.2632, test_loss: 2.3098, test_f1: 0.6393
 epoch: 92, train_loss: 0.2787, test_loss: 2.0829, test_f1: 0.6153
 epoch: 93, train_loss: 0.2780, test_loss: 2.1737, test_f1: 0.5867
 epoch: 94, train_loss: 0.2900, test_loss: 2.5497, test_f1: 0.5924
 epoch: 95, train_loss: 0.2812, test_loss: 2.3415, test_f1: 0.5728
 epoch: 96, train_loss: 0.2948, test_loss: 2.4317, test_f1: 0.5753
 epoch: 97, train_loss: 0.2718, test_loss: 2.0721, test_f1: 0.6089
 epoch: 98, train_loss: 0.2647, test_loss: 2.2960, test_f1: 0.5940
 epoch: 99, train_loss: 0.2242, test_loss: 2.3630, test_f1: 0.5925
##################ITERATION #4 ****************************************
 epoch: 0, train_loss: 1.3718, test_loss: 1.3328, test_f1: 0.1908
 epoch: 1, train_loss: 1.0333, test_loss: 1.1737, test_f1: 0.4312
 epoch: 2, train_loss: 0.9801, test_loss: 1.1095, test_f1: 0.4679
 epoch: 3, train_loss: 0.9487, test_loss: 1.0339, test_f1: 0.5129
 epoch: 4, train_loss: 0.9288, test_loss: 0.9983, test_f1: 0.5361
 epoch: 5, train_loss: 0.9202, test_loss: 1.1213, test_f1: 0.5147
 epoch: 6, train_loss: 0.9162, test_loss: 1.0327, test_f1: 0.5354
 epoch: 7, train_loss: 0.8732, test_loss: 1.0427, test_f1: 0.5404
 epoch: 8, train_loss: 0.8674, test_loss: 1.0510, test_f1: 0.4968
 epoch: 9, train_loss: 0.8700, test_loss: 1.0043, test_f1: 0.5768
 epoch: 10, train_loss: 0.8584, test_loss: 1.0059, test_f1: 0.5853
 epoch: 11, train_loss: 0.8353, test_loss: 1.1427, test_f1: 0.5123
 epoch: 12, train_loss: 0.8166, test_loss: 1.1638, test_f1: 0.4961
 epoch: 13, train_loss: 0.8056, test_loss: 1.2185, test_f1: 0.4872
 epoch: 14, train_loss: 0.8136, test_loss: 1.2058, test_f1: 0.4709
 epoch: 15, train_loss: 0.7990, test_loss: 1.1373, test_f1: 0.5395
 epoch: 16, train_loss: 0.7735, test_loss: 1.1563, test_f1: 0.5152
 epoch: 17, train_loss: 0.7248, test_loss: 1.1503, test_f1: 0.5683
 epoch: 18, train_loss: 0.7577, test_loss: 1.2241, test_f1: 0.5627
 epoch: 19, train_loss: 0.7554, test_loss: 1.1160, test_f1: 0.5551
 epoch: 20, train_loss: 0.7123, test_loss: 1.0987, test_f1: 0.5159
 epoch: 21, train_loss: 0.7125, test_loss: 1.0851, test_f1: 0.5924
 epoch: 22, train_loss: 0.7158, test_loss: 1.1968, test_f1: 0.5449
 epoch: 23, train_loss: 0.6859, test_loss: 1.3071, test_f1: 0.5327
 epoch: 24, train_loss: 0.6907, test_loss: 1.3933, test_f1: 0.4987
 epoch: 25, train_loss: 0.6668, test_loss: 1.2267, test_f1: 0.5603
 epoch: 26, train_loss: 0.6588, test_loss: 1.7287, test_f1: 0.4965
 epoch: 27, train_loss: 0.6982, test_loss: 1.5087, test_f1: 0.4837
 epoch: 28, train_loss: 0.6594, test_loss: 1.1876, test_f1: 0.5612
 epoch: 29, train_loss: 0.6438, test_loss: 1.2343, test_f1: 0.5847
 epoch: 30, train_loss: 0.6889, test_loss: 1.5809, test_f1: 0.5615
 epoch: 31, train_loss: 0.6804, test_loss: 1.1956, test_f1: 0.5681
 epoch: 32, train_loss: 0.6408, test_loss: 1.1012, test_f1: 0.5177
 epoch: 33, train_loss: 0.6512, test_loss: 1.1961, test_f1: 0.5494
 epoch: 34, train_loss: 0.6529, test_loss: 1.3044, test_f1: 0.5354
 epoch: 35, train_loss: 0.6351, test_loss: 1.3373, test_f1: 0.5609
 epoch: 36, train_loss: 0.6515, test_loss: 1.1896, test_f1: 0.5580
 epoch: 37, train_loss: 0.6258, test_loss: 1.2264, test_f1: 0.5718
 epoch: 38, train_loss: 0.5840, test_loss: 1.2957, test_f1: 0.6198
 epoch: 39, train_loss: 0.6251, test_loss: 1.4536, test_f1: 0.5477
 epoch: 40, train_loss: 0.5742, test_loss: 1.2792, test_f1: 0.5569
 epoch: 41, train_loss: 0.5805, test_loss: 1.2736, test_f1: 0.5700
 epoch: 42, train_loss: 0.5524, test_loss: 1.3400, test_f1: 0.5458
 epoch: 43, train_loss: 0.5690, test_loss: 2.0104, test_f1: 0.5194
 epoch: 44, train_loss: 0.5837, test_loss: 1.3815, test_f1: 0.5986
 epoch: 45, train_loss: 0.5480, test_loss: 1.3484, test_f1: 0.5676
 epoch: 46, train_loss: 0.6016, test_loss: 1.6164, test_f1: 0.5502
 epoch: 47, train_loss: 0.5673, test_loss: 1.3081, test_f1: 0.5204
 epoch: 48, train_loss: 0.5355, test_loss: 1.3840, test_f1: 0.6240
 epoch: 49, train_loss: 0.5427, test_loss: 1.9103, test_f1: 0.4790
 epoch: 50, train_loss: 0.6117, test_loss: 1.3138, test_f1: 0.6006
 epoch: 51, train_loss: 0.5401, test_loss: 1.4350, test_f1: 0.5862
 epoch: 52, train_loss: 0.4837, test_loss: 1.3833, test_f1: 0.5985
 epoch: 53, train_loss: 0.4764, test_loss: 1.2972, test_f1: 0.5972
 epoch: 54, train_loss: 0.4623, test_loss: 1.2790, test_f1: 0.5882
 epoch: 55, train_loss: 0.4510, test_loss: 1.3392, test_f1: 0.6179
 epoch: 56, train_loss: 0.4720, test_loss: 1.4129, test_f1: 0.5700
 epoch: 57, train_loss: 0.4689, test_loss: 1.4998, test_f1: 0.5917
 epoch: 58, train_loss: 0.4446, test_loss: 1.7464, test_f1: 0.5424
 epoch: 59, train_loss: 0.4930, test_loss: 1.4991, test_f1: 0.6080
 epoch: 60, train_loss: 0.4884, test_loss: 1.4255, test_f1: 0.5975
 epoch: 61, train_loss: 0.4688, test_loss: 1.4561, test_f1: 0.5798
 epoch: 62, train_loss: 0.4318, test_loss: 1.8034, test_f1: 0.5759
 epoch: 63, train_loss: 0.4232, test_loss: 1.5751, test_f1: 0.5733
 epoch: 64, train_loss: 0.4250, test_loss: 1.6183, test_f1: 0.5421
 epoch: 65, train_loss: 0.4111, test_loss: 1.7333, test_f1: 0.5739
 epoch: 66, train_loss: 0.3903, test_loss: 2.0371, test_f1: 0.5221
 epoch: 67, train_loss: 0.3934, test_loss: 1.7221, test_f1: 0.5900
 epoch: 68, train_loss: 0.3909, test_loss: 1.8257, test_f1: 0.5768
 epoch: 69, train_loss: 0.4116, test_loss: 1.8565, test_f1: 0.5519
 epoch: 70, train_loss: 0.4234, test_loss: 2.1114, test_f1: 0.5314
 epoch: 71, train_loss: 0.4216, test_loss: 1.7458, test_f1: 0.5852
 epoch: 72, train_loss: 0.3989, test_loss: 1.7596, test_f1: 0.5644
 epoch: 73, train_loss: 0.3848, test_loss: 1.8777, test_f1: 0.5702
 epoch: 74, train_loss: 0.3611, test_loss: 1.7876, test_f1: 0.6150
 epoch: 75, train_loss: 0.3674, test_loss: 1.7717, test_f1: 0.6147
 epoch: 76, train_loss: 0.3933, test_loss: 1.9215, test_f1: 0.5294
 epoch: 77, train_loss: 0.4043, test_loss: 1.7406, test_f1: 0.5774
 epoch: 78, train_loss: 0.4027, test_loss: 1.9503, test_f1: 0.5176
 epoch: 79, train_loss: 0.3959, test_loss: 1.8050, test_f1: 0.5694
 epoch: 80, train_loss: 0.3472, test_loss: 1.8115, test_f1: 0.6315
 epoch: 81, train_loss: 0.3540, test_loss: 1.7563, test_f1: 0.6232
 epoch: 82, train_loss: 0.3537, test_loss: 1.9728, test_f1: 0.5455
 epoch: 83, train_loss: 0.3594, test_loss: 1.9514, test_f1: 0.5502
 epoch: 84, train_loss: 0.3635, test_loss: 1.6795, test_f1: 0.6073
 epoch: 85, train_loss: 0.3493, test_loss: 1.9810, test_f1: 0.5750
 epoch: 86, train_loss: 0.3650, test_loss: 1.7988, test_f1: 0.5674
 epoch: 87, train_loss: 0.3373, test_loss: 1.7689, test_f1: 0.6099
 epoch: 88, train_loss: 0.3598, test_loss: 1.8904, test_f1: 0.5721
 epoch: 89, train_loss: 0.3362, test_loss: 2.0506, test_f1: 0.6125
 epoch: 90, train_loss: 0.3155, test_loss: 2.1023, test_f1: 0.5123
 epoch: 91, train_loss: 0.3371, test_loss: 1.9057, test_f1: 0.5800
 epoch: 92, train_loss: 0.3031, test_loss: 1.9875, test_f1: 0.5975
 epoch: 93, train_loss: 0.3203, test_loss: 1.5730, test_f1: 0.6357
 epoch: 94, train_loss: 0.3438, test_loss: 1.9470, test_f1: 0.5546
 epoch: 95, train_loss: 0.3492, test_loss: 1.7518, test_f1: 0.6031
 epoch: 96, train_loss: 0.3744, test_loss: 2.0514, test_f1: 0.5663
 epoch: 97, train_loss: 0.3516, test_loss: 1.7800, test_f1: 0.6357
 epoch: 98, train_loss: 0.3393, test_loss: 2.0829, test_f1: 0.6354
 epoch: 99, train_loss: 0.3158, test_loss: 2.2294, test_f1: 0.5759
##################ITERATION #5 ****************************************
 epoch: 0, train_loss: 1.3807, test_loss: 1.3509, test_f1: 0.2525
 epoch: 1, train_loss: 1.0813, test_loss: 1.1734, test_f1: 0.3735
 epoch: 2, train_loss: 0.9910, test_loss: 1.1083, test_f1: 0.4477
 epoch: 3, train_loss: 0.9635, test_loss: 1.0844, test_f1: 0.4707
 epoch: 4, train_loss: 0.9344, test_loss: 1.1525, test_f1: 0.4618
 epoch: 5, train_loss: 0.9494, test_loss: 1.1283, test_f1: 0.4941
 epoch: 6, train_loss: 0.9134, test_loss: 1.1206, test_f1: 0.5025
 epoch: 7, train_loss: 0.8654, test_loss: 1.0532, test_f1: 0.5414
 epoch: 8, train_loss: 0.8833, test_loss: 1.1732, test_f1: 0.5049
 epoch: 9, train_loss: 0.8765, test_loss: 1.1933, test_f1: 0.5065
 epoch: 10, train_loss: 0.8700, test_loss: 1.2378, test_f1: 0.4471
 epoch: 11, train_loss: 0.8528, test_loss: 1.1765, test_f1: 0.4429
 epoch: 12, train_loss: 0.8437, test_loss: 1.1866, test_f1: 0.5257
 epoch: 13, train_loss: 0.8492, test_loss: 1.0761, test_f1: 0.5834
 epoch: 14, train_loss: 0.8177, test_loss: 1.2295, test_f1: 0.4799
 epoch: 15, train_loss: 0.7837, test_loss: 1.3701, test_f1: 0.5420
 epoch: 16, train_loss: 0.7467, test_loss: 1.3666, test_f1: 0.5724
 epoch: 17, train_loss: 0.8015, test_loss: 1.3290, test_f1: 0.5155
 epoch: 18, train_loss: 0.8095, test_loss: 1.2661, test_f1: 0.5022
 epoch: 19, train_loss: 0.7777, test_loss: 1.4150, test_f1: 0.5765
 epoch: 20, train_loss: 0.7725, test_loss: 1.2762, test_f1: 0.5123
 epoch: 21, train_loss: 0.7247, test_loss: 1.3078, test_f1: 0.4769
 epoch: 22, train_loss: 0.7375, test_loss: 1.2082, test_f1: 0.5963
 epoch: 23, train_loss: 0.7068, test_loss: 1.2068, test_f1: 0.5798
 epoch: 24, train_loss: 0.6989, test_loss: 1.1405, test_f1: 0.5722
 epoch: 25, train_loss: 0.6931, test_loss: 1.1853, test_f1: 0.6066
 epoch: 26, train_loss: 0.6746, test_loss: 1.1606, test_f1: 0.5607
 epoch: 27, train_loss: 0.6696, test_loss: 1.3901, test_f1: 0.5716
 epoch: 28, train_loss: 0.6276, test_loss: 1.3421, test_f1: 0.5252
 epoch: 29, train_loss: 0.6648, test_loss: 1.6312, test_f1: 0.5338
 epoch: 30, train_loss: 0.6508, test_loss: 1.4191, test_f1: 0.4966
 epoch: 31, train_loss: 0.6149, test_loss: 1.5676, test_f1: 0.4866
 epoch: 32, train_loss: 0.6590, test_loss: 1.4303, test_f1: 0.5507
 epoch: 33, train_loss: 0.6173, test_loss: 1.5222, test_f1: 0.5036
 epoch: 34, train_loss: 0.6097, test_loss: 1.1681, test_f1: 0.5980
 epoch: 35, train_loss: 0.6476, test_loss: 1.4650, test_f1: 0.5809
 epoch: 36, train_loss: 0.6415, test_loss: 1.6034, test_f1: 0.5947
 epoch: 37, train_loss: 0.6095, test_loss: 1.3556, test_f1: 0.5690
 epoch: 38, train_loss: 0.5695, test_loss: 1.2623, test_f1: 0.5662
 epoch: 39, train_loss: 0.5656, test_loss: 1.3840, test_f1: 0.5976
 epoch: 40, train_loss: 0.6095, test_loss: 1.5180, test_f1: 0.6207
 epoch: 41, train_loss: 0.5686, test_loss: 1.3655, test_f1: 0.6175
 epoch: 42, train_loss: 0.5712, test_loss: 1.4420, test_f1: 0.5702
 epoch: 43, train_loss: 0.5725, test_loss: 1.5498, test_f1: 0.5962
 epoch: 44, train_loss: 0.5546, test_loss: 1.8959, test_f1: 0.5881
 epoch: 45, train_loss: 0.5879, test_loss: 1.5827, test_f1: 0.5869
 epoch: 46, train_loss: 0.5694, test_loss: 1.2051, test_f1: 0.5533
 epoch: 47, train_loss: 0.5261, test_loss: 1.3359, test_f1: 0.5786
 epoch: 48, train_loss: 0.5112, test_loss: 1.4000, test_f1: 0.6019
 epoch: 49, train_loss: 0.5600, test_loss: 1.5919, test_f1: 0.5308
 epoch: 50, train_loss: 0.5337, test_loss: 1.2982, test_f1: 0.6102
 epoch: 51, train_loss: 0.5058, test_loss: 1.5403, test_f1: 0.5423
 epoch: 52, train_loss: 0.4813, test_loss: 1.3216, test_f1: 0.6210
 epoch: 53, train_loss: 0.4422, test_loss: 1.5929, test_f1: 0.6114
 epoch: 54, train_loss: 0.4079, test_loss: 1.5445, test_f1: 0.6047
 epoch: 55, train_loss: 0.4171, test_loss: 1.6800, test_f1: 0.5898
 epoch: 56, train_loss: 0.4053, test_loss: 1.6218, test_f1: 0.6246
 epoch: 57, train_loss: 0.3993, test_loss: 1.6481, test_f1: 0.6225
 epoch: 58, train_loss: 0.3802, test_loss: 1.9628, test_f1: 0.5764
 epoch: 59, train_loss: 0.4312, test_loss: 2.0592, test_f1: 0.5561
 epoch: 60, train_loss: 0.4344, test_loss: 1.6132, test_f1: 0.6297
 epoch: 61, train_loss: 0.4155, test_loss: 1.5912, test_f1: 0.6283
 epoch: 62, train_loss: 0.3609, test_loss: 1.8780, test_f1: 0.5979
 epoch: 63, train_loss: 0.3589, test_loss: 2.2399, test_f1: 0.5661
 epoch: 64, train_loss: 0.3764, test_loss: 1.7820, test_f1: 0.6142
 epoch: 65, train_loss: 0.4169, test_loss: 1.6338, test_f1: 0.6536
 epoch: 66, train_loss: 0.3954, test_loss: 1.6759, test_f1: 0.6409
 epoch: 67, train_loss: 0.3615, test_loss: 1.6980, test_f1: 0.6265
 epoch: 68, train_loss: 0.3753, test_loss: 1.7809, test_f1: 0.6491
 epoch: 69, train_loss: 0.3081, test_loss: 1.8921, test_f1: 0.6428
 epoch: 70, train_loss: 0.3345, test_loss: 1.8106, test_f1: 0.6319
 epoch: 71, train_loss: 0.3378, test_loss: 1.8859, test_f1: 0.6147
 epoch: 72, train_loss: 0.3075, test_loss: 1.9404, test_f1: 0.6041
 epoch: 73, train_loss: 0.3163, test_loss: 2.0744, test_f1: 0.6193
 epoch: 74, train_loss: 0.2920, test_loss: 1.7993, test_f1: 0.6536
 epoch: 75, train_loss: 0.3016, test_loss: 2.0824, test_f1: 0.6164
 epoch: 76, train_loss: 0.2938, test_loss: 1.9994, test_f1: 0.6471
 epoch: 77, train_loss: 0.3416, test_loss: 1.8937, test_f1: 0.5951
 epoch: 78, train_loss: 0.3468, test_loss: 1.9679, test_f1: 0.6143
 epoch: 79, train_loss: 0.2698, test_loss: 2.0900, test_f1: 0.6266
 epoch: 80, train_loss: 0.2845, test_loss: 2.1809, test_f1: 0.5759
 epoch: 81, train_loss: 0.3159, test_loss: 2.2690, test_f1: 0.6292
 epoch: 82, train_loss: 0.2876, test_loss: 2.3164, test_f1: 0.5949
 epoch: 83, train_loss: 0.2935, test_loss: 2.1827, test_f1: 0.6445
 epoch: 84, train_loss: 0.2891, test_loss: 2.3928, test_f1: 0.6225
 epoch: 85, train_loss: 0.2675, test_loss: 2.1336, test_f1: 0.6152
 epoch: 86, train_loss: 0.2751, test_loss: 2.1847, test_f1: 0.6303
 epoch: 87, train_loss: 0.2935, test_loss: 2.1806, test_f1: 0.5561
 epoch: 88, train_loss: 0.2596, test_loss: 2.1618, test_f1: 0.6160
 epoch: 89, train_loss: 0.2900, test_loss: 2.1383, test_f1: 0.6098
 epoch: 90, train_loss: 0.2675, test_loss: 2.0878, test_f1: 0.6241
 epoch: 91, train_loss: 0.2394, test_loss: 2.0804, test_f1: 0.6210
 epoch: 92, train_loss: 0.2657, test_loss: 2.3291, test_f1: 0.6244
 epoch: 93, train_loss: 0.3205, test_loss: 2.4307, test_f1: 0.6369
 epoch: 94, train_loss: 0.2962, test_loss: 2.2447, test_f1: 0.5847
 epoch: 95, train_loss: 0.2680, test_loss: 2.1158, test_f1: 0.6304
 epoch: 96, train_loss: 0.3153, test_loss: 2.4762, test_f1: 0.6217
 epoch: 97, train_loss: 0.2863, test_loss: 2.2346, test_f1: 0.5870
 epoch: 98, train_loss: 0.2611, test_loss: 2.3523, test_f1: 0.5569
 epoch: 99, train_loss: 0.2309, test_loss: 2.2416, test_f1: 0.6472
##################ITERATION #6 ****************************************
 epoch: 0, train_loss: 1.3817, test_loss: 1.3872, test_f1: 0.2875
 epoch: 1, train_loss: 1.1524, test_loss: 1.3669, test_f1: 0.3293
 epoch: 2, train_loss: 1.0234, test_loss: 1.1416, test_f1: 0.4433
 epoch: 3, train_loss: 0.9823, test_loss: 1.1399, test_f1: 0.3899
 epoch: 4, train_loss: 0.9653, test_loss: 1.1599, test_f1: 0.5204
 epoch: 5, train_loss: 0.9181, test_loss: 1.0772, test_f1: 0.5111
 epoch: 6, train_loss: 0.9235, test_loss: 1.1207, test_f1: 0.4405
 epoch: 7, train_loss: 0.9105, test_loss: 1.1011, test_f1: 0.4185
 epoch: 8, train_loss: 0.8777, test_loss: 1.1371, test_f1: 0.5199
 epoch: 9, train_loss: 0.8807, test_loss: 1.0467, test_f1: 0.5270
 epoch: 10, train_loss: 0.8642, test_loss: 1.0647, test_f1: 0.4193
 epoch: 11, train_loss: 0.8424, test_loss: 1.2468, test_f1: 0.4885
 epoch: 12, train_loss: 0.8648, test_loss: 1.1662, test_f1: 0.4865
 epoch: 13, train_loss: 0.8356, test_loss: 1.0502, test_f1: 0.5439
 epoch: 14, train_loss: 0.8307, test_loss: 1.0163, test_f1: 0.5860
 epoch: 15, train_loss: 0.8246, test_loss: 1.0573, test_f1: 0.5831
 epoch: 16, train_loss: 0.7860, test_loss: 1.0848, test_f1: 0.5592
 epoch: 17, train_loss: 0.7568, test_loss: 1.1064, test_f1: 0.5784
 epoch: 18, train_loss: 0.7348, test_loss: 1.1361, test_f1: 0.5094
 epoch: 19, train_loss: 0.7333, test_loss: 1.0272, test_f1: 0.6034
 epoch: 20, train_loss: 0.7103, test_loss: 1.8228, test_f1: 0.3209
 epoch: 21, train_loss: 0.7663, test_loss: 0.9767, test_f1: 0.5959
 epoch: 22, train_loss: 0.7060, test_loss: 1.2258, test_f1: 0.4996
 epoch: 23, train_loss: 0.7125, test_loss: 1.7686, test_f1: 0.4877
 epoch: 24, train_loss: 0.7376, test_loss: 2.2990, test_f1: 0.4183
 epoch: 25, train_loss: 0.7554, test_loss: 1.0685, test_f1: 0.4772
 epoch: 26, train_loss: 0.7371, test_loss: 1.1059, test_f1: 0.5797
 epoch: 27, train_loss: 0.6901, test_loss: 1.2442, test_f1: 0.5536
 epoch: 28, train_loss: 0.6791, test_loss: 1.3224, test_f1: 0.4509
 epoch: 29, train_loss: 0.6833, test_loss: 1.0752, test_f1: 0.6020
 epoch: 30, train_loss: 0.6673, test_loss: 1.1762, test_f1: 0.5740
 epoch: 31, train_loss: 0.6376, test_loss: 1.2595, test_f1: 0.5540
 epoch: 32, train_loss: 0.6315, test_loss: 1.3404, test_f1: 0.6151
 epoch: 33, train_loss: 0.6326, test_loss: 1.2041, test_f1: 0.5737
 epoch: 34, train_loss: 0.6321, test_loss: 1.3693, test_f1: 0.5939
 epoch: 35, train_loss: 0.5911, test_loss: 1.3794, test_f1: 0.5702
 epoch: 36, train_loss: 0.6056, test_loss: 1.2006, test_f1: 0.6023
 epoch: 37, train_loss: 0.6211, test_loss: 1.2436, test_f1: 0.5795
 epoch: 38, train_loss: 0.6211, test_loss: 1.6029, test_f1: 0.5295
 epoch: 39, train_loss: 0.6630, test_loss: 1.5322, test_f1: 0.4744
 epoch: 40, train_loss: 0.6438, test_loss: 1.2496, test_f1: 0.5593
 epoch: 41, train_loss: 0.6107, test_loss: 1.2107, test_f1: 0.5984
 epoch: 42, train_loss: 0.6123, test_loss: 1.2321, test_f1: 0.6139
 epoch: 43, train_loss: 0.6136, test_loss: 1.2571, test_f1: 0.5708
 epoch: 44, train_loss: 0.5716, test_loss: 1.2817, test_f1: 0.6049
 epoch: 45, train_loss: 0.5815, test_loss: 1.5117, test_f1: 0.5727
 epoch: 46, train_loss: 0.6261, test_loss: 1.3548, test_f1: 0.5668
 epoch: 47, train_loss: 0.5916, test_loss: 1.2905, test_f1: 0.5012
 epoch: 48, train_loss: 0.5990, test_loss: 1.5693, test_f1: 0.5188
 epoch: 49, train_loss: 0.6264, test_loss: 1.2181, test_f1: 0.5672
 epoch: 50, train_loss: 0.5907, test_loss: 1.3015, test_f1: 0.5605
 epoch: 51, train_loss: 0.5468, test_loss: 1.3819, test_f1: 0.5886
 epoch: 52, train_loss: 0.5151, test_loss: 1.4355, test_f1: 0.5897
 epoch: 53, train_loss: 0.5130, test_loss: 1.3509, test_f1: 0.5987
 epoch: 54, train_loss: 0.4837, test_loss: 1.4575, test_f1: 0.5953
 epoch: 55, train_loss: 0.4639, test_loss: 1.5262, test_f1: 0.5940
 epoch: 56, train_loss: 0.4643, test_loss: 1.5479, test_f1: 0.6191
 epoch: 57, train_loss: 0.4545, test_loss: 1.4647, test_f1: 0.5683
 epoch: 58, train_loss: 0.4210, test_loss: 1.6727, test_f1: 0.5890
 epoch: 59, train_loss: 0.4350, test_loss: 1.5492, test_f1: 0.6112
 epoch: 60, train_loss: 0.4287, test_loss: 1.5337, test_f1: 0.5690
 epoch: 61, train_loss: 0.4975, test_loss: 1.2787, test_f1: 0.6190
 epoch: 62, train_loss: 0.4554, test_loss: 1.5393, test_f1: 0.5870
 epoch: 63, train_loss: 0.4440, test_loss: 1.6702, test_f1: 0.5716
 epoch: 64, train_loss: 0.4557, test_loss: 1.5377, test_f1: 0.5788
 epoch: 65, train_loss: 0.4424, test_loss: 1.6942, test_f1: 0.5907
 epoch: 66, train_loss: 0.4247, test_loss: 1.8238, test_f1: 0.5802
 epoch: 67, train_loss: 0.3916, test_loss: 1.5917, test_f1: 0.5520
 epoch: 68, train_loss: 0.4071, test_loss: 1.7971, test_f1: 0.6014
 epoch: 69, train_loss: 0.4186, test_loss: 1.8199, test_f1: 0.6018
 epoch: 70, train_loss: 0.3992, test_loss: 1.6959, test_f1: 0.5904
 epoch: 71, train_loss: 0.4120, test_loss: 1.6400, test_f1: 0.6058
 epoch: 72, train_loss: 0.3992, test_loss: 1.7506, test_f1: 0.5879
 epoch: 73, train_loss: 0.3966, test_loss: 1.6149, test_f1: 0.5923
 epoch: 74, train_loss: 0.3920, test_loss: 1.8521, test_f1: 0.5961
 epoch: 75, train_loss: 0.3908, test_loss: 1.9754, test_f1: 0.6046
 epoch: 76, train_loss: 0.4051, test_loss: 1.8230, test_f1: 0.5930
 epoch: 77, train_loss: 0.4293, test_loss: 1.6263, test_f1: 0.5979
 epoch: 78, train_loss: 0.3553, test_loss: 1.9287, test_f1: 0.5794
 epoch: 79, train_loss: 0.3684, test_loss: 2.1793, test_f1: 0.5749
 epoch: 80, train_loss: 0.3952, test_loss: 1.5528, test_f1: 0.6229
 epoch: 81, train_loss: 0.3802, test_loss: 1.9674, test_f1: 0.6118
 epoch: 82, train_loss: 0.3893, test_loss: 1.7046, test_f1: 0.5768
 epoch: 83, train_loss: 0.4021, test_loss: 2.2018, test_f1: 0.5850
 epoch: 84, train_loss: 0.3864, test_loss: 2.2417, test_f1: 0.5802
 epoch: 85, train_loss: 0.3959, test_loss: 1.7837, test_f1: 0.5817
 epoch: 86, train_loss: 0.3702, test_loss: 1.7674, test_f1: 0.5869
 epoch: 87, train_loss: 0.3399, test_loss: 2.0342, test_f1: 0.5913
 epoch: 88, train_loss: 0.3347, test_loss: 2.0116, test_f1: 0.5924
 epoch: 89, train_loss: 0.3266, test_loss: 2.0798, test_f1: 0.5822
 epoch: 90, train_loss: 0.3312, test_loss: 1.9898, test_f1: 0.5781
 epoch: 91, train_loss: 0.3411, test_loss: 2.0621, test_f1: 0.5653
 epoch: 92, train_loss: 0.3349, test_loss: 2.2309, test_f1: 0.5895
 epoch: 93, train_loss: 0.3286, test_loss: 2.3902, test_f1: 0.5667
 epoch: 94, train_loss: 0.3323, test_loss: 2.0521, test_f1: 0.6005
 epoch: 95, train_loss: 0.2979, test_loss: 2.3782, test_f1: 0.5982
 epoch: 96, train_loss: 0.3425, test_loss: 1.9864, test_f1: 0.5997
 epoch: 97, train_loss: 0.3508, test_loss: 2.2172, test_f1: 0.5440
 epoch: 98, train_loss: 0.3444, test_loss: 1.8832, test_f1: 0.6000
 epoch: 99, train_loss: 0.2899, test_loss: 2.1052, test_f1: 0.6005
##################ITERATION #7 ****************************************
 epoch: 0, train_loss: 1.5075, test_loss: 1.4685, test_f1: 0.3216
 epoch: 1, train_loss: 1.0995, test_loss: 1.2347, test_f1: 0.3197
 epoch: 2, train_loss: 1.0448, test_loss: 1.1722, test_f1: 0.3814
 epoch: 3, train_loss: 0.9823, test_loss: 1.1017, test_f1: 0.4796
 epoch: 4, train_loss: 0.9720, test_loss: 1.0745, test_f1: 0.5039
 epoch: 5, train_loss: 0.9420, test_loss: 1.0661, test_f1: 0.4999
 epoch: 6, train_loss: 0.9303, test_loss: 1.0307, test_f1: 0.5636
 epoch: 7, train_loss: 0.9142, test_loss: 1.0920, test_f1: 0.5017
 epoch: 8, train_loss: 0.9001, test_loss: 1.0119, test_f1: 0.5192
 epoch: 9, train_loss: 0.8940, test_loss: 1.0321, test_f1: 0.5584
 epoch: 10, train_loss: 0.8807, test_loss: 0.9965, test_f1: 0.5581
 epoch: 11, train_loss: 0.8649, test_loss: 1.0698, test_f1: 0.5042
 epoch: 12, train_loss: 0.8821, test_loss: 1.0788, test_f1: 0.5141
 epoch: 13, train_loss: 0.8452, test_loss: 1.0954, test_f1: 0.5147
 epoch: 14, train_loss: 0.8220, test_loss: 1.0818, test_f1: 0.5623
 epoch: 15, train_loss: 0.8375, test_loss: 1.0702, test_f1: 0.5498
 epoch: 16, train_loss: 0.8195, test_loss: 1.3572, test_f1: 0.4735
 epoch: 17, train_loss: 0.8082, test_loss: 1.3102, test_f1: 0.5402
 epoch: 18, train_loss: 0.8077, test_loss: 1.1467, test_f1: 0.5522
 epoch: 19, train_loss: 0.8082, test_loss: 1.1839, test_f1: 0.5488
 epoch: 20, train_loss: 0.7822, test_loss: 1.1010, test_f1: 0.5729
 epoch: 21, train_loss: 0.7864, test_loss: 1.2029, test_f1: 0.5589
 epoch: 22, train_loss: 0.7636, test_loss: 1.0864, test_f1: 0.5765
 epoch: 23, train_loss: 0.7489, test_loss: 1.3511, test_f1: 0.5334
 epoch: 24, train_loss: 0.7365, test_loss: 1.3674, test_f1: 0.5234
 epoch: 25, train_loss: 0.7221, test_loss: 1.2431, test_f1: 0.5290
 epoch: 26, train_loss: 0.6963, test_loss: 1.3561, test_f1: 0.5681
 epoch: 27, train_loss: 0.6807, test_loss: 1.2465, test_f1: 0.5535
 epoch: 28, train_loss: 0.7007, test_loss: 1.2677, test_f1: 0.5270
 epoch: 29, train_loss: 0.7433, test_loss: 1.1950, test_f1: 0.5695
 epoch: 30, train_loss: 0.7077, test_loss: 1.3195, test_f1: 0.5462
 epoch: 31, train_loss: 0.6819, test_loss: 1.2422, test_f1: 0.5450
 epoch: 32, train_loss: 0.6347, test_loss: 1.3325, test_f1: 0.5643
 epoch: 33, train_loss: 0.6266, test_loss: 1.6402, test_f1: 0.5074
 epoch: 34, train_loss: 0.7037, test_loss: 1.6344, test_f1: 0.5468
 epoch: 35, train_loss: 0.6842, test_loss: 1.3608, test_f1: 0.5884
 epoch: 36, train_loss: 0.6605, test_loss: 1.3430, test_f1: 0.6080
 epoch: 37, train_loss: 0.5921, test_loss: 1.5981, test_f1: 0.5607
 epoch: 38, train_loss: 0.6388, test_loss: 1.4641, test_f1: 0.5250
 epoch: 39, train_loss: 0.6476, test_loss: 1.4056, test_f1: 0.5804
 epoch: 40, train_loss: 0.6059, test_loss: 1.5461, test_f1: 0.5810
 epoch: 41, train_loss: 0.6081, test_loss: 1.5477, test_f1: 0.5708
 epoch: 42, train_loss: 0.5930, test_loss: 1.5591, test_f1: 0.5601
 epoch: 43, train_loss: 0.5735, test_loss: 1.4665, test_f1: 0.5545
 epoch: 44, train_loss: 0.5593, test_loss: 1.5225, test_f1: 0.5937
 epoch: 45, train_loss: 0.5853, test_loss: 1.5804, test_f1: 0.5712
 epoch: 46, train_loss: 0.6009, test_loss: 1.9729, test_f1: 0.5597
 epoch: 47, train_loss: 0.5909, test_loss: 1.5068, test_f1: 0.5428
 epoch: 48, train_loss: 0.5682, test_loss: 1.5856, test_f1: 0.5231
 epoch: 49, train_loss: 0.6078, test_loss: 1.6721, test_f1: 0.5736
 epoch: 50, train_loss: 0.5876, test_loss: 1.5247, test_f1: 0.5818
 epoch: 51, train_loss: 0.5258, test_loss: 1.6234, test_f1: 0.5709
 epoch: 52, train_loss: 0.5104, test_loss: 1.6146, test_f1: 0.5947
 epoch: 53, train_loss: 0.4957, test_loss: 1.6626, test_f1: 0.5944
 epoch: 54, train_loss: 0.5151, test_loss: 1.7548, test_f1: 0.5775
 epoch: 55, train_loss: 0.5119, test_loss: 1.8606, test_f1: 0.5977
 epoch: 56, train_loss: 0.5064, test_loss: 1.8593, test_f1: 0.5910
 epoch: 57, train_loss: 0.4849, test_loss: 1.9488, test_f1: 0.6043
 epoch: 58, train_loss: 0.4611, test_loss: 1.6992, test_f1: 0.5848
 epoch: 59, train_loss: 0.4500, test_loss: 1.6101, test_f1: 0.5662
 epoch: 60, train_loss: 0.4463, test_loss: 2.1236, test_f1: 0.5985
 epoch: 61, train_loss: 0.4269, test_loss: 2.0219, test_f1: 0.6063
 epoch: 62, train_loss: 0.4342, test_loss: 1.9260, test_f1: 0.5879
 epoch: 63, train_loss: 0.3887, test_loss: 2.4872, test_f1: 0.5786
 epoch: 64, train_loss: 0.4032, test_loss: 1.9425, test_f1: 0.5947
 epoch: 65, train_loss: 0.3801, test_loss: 1.8029, test_f1: 0.5949
 epoch: 66, train_loss: 0.3743, test_loss: 2.0946, test_f1: 0.6114
 epoch: 67, train_loss: 0.3878, test_loss: 2.4469, test_f1: 0.5954
 epoch: 68, train_loss: 0.4656, test_loss: 1.9898, test_f1: 0.5680
 epoch: 69, train_loss: 0.4361, test_loss: 1.7500, test_f1: 0.6035
 epoch: 70, train_loss: 0.4240, test_loss: 2.3357, test_f1: 0.6029
 epoch: 71, train_loss: 0.3954, test_loss: 1.7651, test_f1: 0.5936
 epoch: 72, train_loss: 0.3959, test_loss: 2.0639, test_f1: 0.5808
 epoch: 73, train_loss: 0.3711, test_loss: 2.3516, test_f1: 0.5863
 epoch: 74, train_loss: 0.3835, test_loss: 1.9702, test_f1: 0.6124
 epoch: 75, train_loss: 0.3869, test_loss: 1.8155, test_f1: 0.6192
 epoch: 76, train_loss: 0.3734, test_loss: 2.1343, test_f1: 0.6078
 epoch: 77, train_loss: 0.3682, test_loss: 2.3071, test_f1: 0.5892
 epoch: 78, train_loss: 0.3676, test_loss: 2.2242, test_f1: 0.5988
 epoch: 79, train_loss: 0.4057, test_loss: 2.0535, test_f1: 0.5595
 epoch: 80, train_loss: 0.4182, test_loss: 2.7194, test_f1: 0.5549
 epoch: 81, train_loss: 0.3879, test_loss: 1.9601, test_f1: 0.6029
 epoch: 82, train_loss: 0.3964, test_loss: 1.8925, test_f1: 0.6128
 epoch: 83, train_loss: 0.3575, test_loss: 2.3974, test_f1: 0.6079
 epoch: 84, train_loss: 0.3694, test_loss: 1.9398, test_f1: 0.6185
 epoch: 85, train_loss: 0.3557, test_loss: 2.3028, test_f1: 0.6071
 epoch: 86, train_loss: 0.3692, test_loss: 2.0665, test_f1: 0.6291
 epoch: 87, train_loss: 0.3969, test_loss: 2.2952, test_f1: 0.6136
 epoch: 88, train_loss: 0.3922, test_loss: 2.3518, test_f1: 0.6015
 epoch: 89, train_loss: 0.3585, test_loss: 2.3607, test_f1: 0.5735
 epoch: 90, train_loss: 0.3830, test_loss: 1.9172, test_f1: 0.5702
 epoch: 91, train_loss: 0.3620, test_loss: 2.2181, test_f1: 0.5406
 epoch: 92, train_loss: 0.3359, test_loss: 2.1548, test_f1: 0.5934
 epoch: 93, train_loss: 0.3432, test_loss: 2.2629, test_f1: 0.5790
 epoch: 94, train_loss: 0.3493, test_loss: 2.6265, test_f1: 0.5815
 epoch: 95, train_loss: 0.3013, test_loss: 2.5838, test_f1: 0.5865
 epoch: 96, train_loss: 0.3284, test_loss: 2.6134, test_f1: 0.5956
 epoch: 97, train_loss: 0.2960, test_loss: 2.2693, test_f1: 0.6220
 epoch: 98, train_loss: 0.3452, test_loss: 2.5660, test_f1: 0.5950
 epoch: 99, train_loss: 0.3007, test_loss: 2.6006, test_f1: 0.6187
##################ITERATION #8 ****************************************
 epoch: 0, train_loss: 1.4800, test_loss: 1.8494, test_f1: 0.1365
 epoch: 1, train_loss: 1.0673, test_loss: 1.4001, test_f1: 0.2945
 epoch: 2, train_loss: 0.9911, test_loss: 1.0919, test_f1: 0.5223
 epoch: 3, train_loss: 0.9559, test_loss: 1.1138, test_f1: 0.5062
 epoch: 4, train_loss: 0.9390, test_loss: 1.0868, test_f1: 0.5509
 epoch: 5, train_loss: 0.9065, test_loss: 1.0596, test_f1: 0.5417
 epoch: 6, train_loss: 0.8936, test_loss: 1.0785, test_f1: 0.5118
 epoch: 7, train_loss: 0.8472, test_loss: 1.0988, test_f1: 0.5514
 epoch: 8, train_loss: 0.8271, test_loss: 1.1802, test_f1: 0.5413
 epoch: 9, train_loss: 0.8725, test_loss: 1.2981, test_f1: 0.4546
 epoch: 10, train_loss: 0.8355, test_loss: 1.2565, test_f1: 0.5043
 epoch: 11, train_loss: 0.8105, test_loss: 1.1912, test_f1: 0.5391
 epoch: 12, train_loss: 0.8131, test_loss: 1.2254, test_f1: 0.5190
 epoch: 13, train_loss: 0.8056, test_loss: 1.1488, test_f1: 0.5223
 epoch: 14, train_loss: 0.7940, test_loss: 1.2591, test_f1: 0.5387
 epoch: 15, train_loss: 0.7634, test_loss: 1.1956, test_f1: 0.5650
 epoch: 16, train_loss: 0.7708, test_loss: 1.2873, test_f1: 0.5166
 epoch: 17, train_loss: 0.7417, test_loss: 1.1663, test_f1: 0.5416
 epoch: 18, train_loss: 0.7289, test_loss: 1.3063, test_f1: 0.5427
 epoch: 19, train_loss: 0.7356, test_loss: 1.3290, test_f1: 0.5522
 epoch: 20, train_loss: 0.7224, test_loss: 1.1949, test_f1: 0.6063
 epoch: 21, train_loss: 0.7001, test_loss: 1.1540, test_f1: 0.5932
 epoch: 22, train_loss: 0.6803, test_loss: 1.4270, test_f1: 0.5679
 epoch: 23, train_loss: 0.6801, test_loss: 1.1125, test_f1: 0.5760
 epoch: 24, train_loss: 0.6576, test_loss: 1.4422, test_f1: 0.5474
 epoch: 25, train_loss: 0.6808, test_loss: 1.2350, test_f1: 0.5343
 epoch: 26, train_loss: 0.6461, test_loss: 1.2826, test_f1: 0.5854
 epoch: 27, train_loss: 0.6488, test_loss: 1.2198, test_f1: 0.5893
 epoch: 28, train_loss: 0.6486, test_loss: 1.2302, test_f1: 0.5825
 epoch: 29, train_loss: 0.6098, test_loss: 1.4097, test_f1: 0.5376
 epoch: 30, train_loss: 0.6022, test_loss: 1.3103, test_f1: 0.5773
 epoch: 31, train_loss: 0.6142, test_loss: 1.4616, test_f1: 0.5678
 epoch: 32, train_loss: 0.6214, test_loss: 1.4229, test_f1: 0.5968
 epoch: 33, train_loss: 0.6377, test_loss: 1.3823, test_f1: 0.5155
 epoch: 34, train_loss: 0.6475, test_loss: 1.3496, test_f1: 0.5755
 epoch: 35, train_loss: 0.6986, test_loss: 1.7178, test_f1: 0.5439
 epoch: 36, train_loss: 0.6913, test_loss: 1.2335, test_f1: 0.5148
 epoch: 37, train_loss: 0.6503, test_loss: 1.3908, test_f1: 0.5911
 epoch: 38, train_loss: 0.6006, test_loss: 1.4561, test_f1: 0.5442
 epoch: 39, train_loss: 0.5812, test_loss: 1.3883, test_f1: 0.5866
 epoch: 40, train_loss: 0.6028, test_loss: 1.4838, test_f1: 0.5295
 epoch: 41, train_loss: 0.6130, test_loss: 1.1863, test_f1: 0.5470
 epoch: 42, train_loss: 0.5970, test_loss: 1.1768, test_f1: 0.6093
 epoch: 43, train_loss: 0.5601, test_loss: 1.5446, test_f1: 0.5478
 epoch: 44, train_loss: 0.5538, test_loss: 1.4376, test_f1: 0.6323
 epoch: 45, train_loss: 0.5426, test_loss: 1.3669, test_f1: 0.6210
 epoch: 46, train_loss: 0.5595, test_loss: 1.2480, test_f1: 0.5866
 epoch: 47, train_loss: 0.5299, test_loss: 1.3476, test_f1: 0.5441
 epoch: 48, train_loss: 0.5439, test_loss: 1.1930, test_f1: 0.5930
 epoch: 49, train_loss: 0.5426, test_loss: 1.7545, test_f1: 0.5431
 epoch: 50, train_loss: 0.5046, test_loss: 1.4774, test_f1: 0.6024
 epoch: 51, train_loss: 0.4768, test_loss: 1.6560, test_f1: 0.6284
 epoch: 52, train_loss: 0.4177, test_loss: 1.5867, test_f1: 0.6177
 epoch: 53, train_loss: 0.4308, test_loss: 1.8072, test_f1: 0.6082
 epoch: 54, train_loss: 0.4215, test_loss: 1.6293, test_f1: 0.6117
 epoch: 55, train_loss: 0.4061, test_loss: 2.0228, test_f1: 0.6027
 epoch: 56, train_loss: 0.4099, test_loss: 1.8121, test_f1: 0.5953
 epoch: 57, train_loss: 0.4095, test_loss: 1.6897, test_f1: 0.6109
 epoch: 58, train_loss: 0.3685, test_loss: 2.2481, test_f1: 0.6009
 epoch: 59, train_loss: 0.4077, test_loss: 1.8184, test_f1: 0.6200
 epoch: 60, train_loss: 0.3796, test_loss: 1.9655, test_f1: 0.5818
 epoch: 61, train_loss: 0.3625, test_loss: 1.7980, test_f1: 0.5966
 epoch: 62, train_loss: 0.3711, test_loss: 2.5169, test_f1: 0.5889
 epoch: 63, train_loss: 0.3561, test_loss: 2.1045, test_f1: 0.5984
 epoch: 64, train_loss: 0.3861, test_loss: 1.8391, test_f1: 0.5818
 epoch: 65, train_loss: 0.3676, test_loss: 1.9700, test_f1: 0.5415
 epoch: 66, train_loss: 0.3730, test_loss: 2.1966, test_f1: 0.5917
 epoch: 67, train_loss: 0.3863, test_loss: 1.9211, test_f1: 0.5725
 epoch: 68, train_loss: 0.3433, test_loss: 2.0509, test_f1: 0.6326
 epoch: 69, train_loss: 0.3973, test_loss: 1.6904, test_f1: 0.6080
 epoch: 70, train_loss: 0.3478, test_loss: 2.5295, test_f1: 0.5628
 epoch: 71, train_loss: 0.3328, test_loss: 1.8084, test_f1: 0.6004
 epoch: 72, train_loss: 0.3394, test_loss: 2.0068, test_f1: 0.5923
 epoch: 73, train_loss: 0.2943, test_loss: 2.0593, test_f1: 0.5902
 epoch: 74, train_loss: 0.3286, test_loss: 1.9959, test_f1: 0.5875
 epoch: 75, train_loss: 0.3369, test_loss: 2.2172, test_f1: 0.6195
 epoch: 76, train_loss: 0.3271, test_loss: 1.8918, test_f1: 0.6102
 epoch: 77, train_loss: 0.3551, test_loss: 2.2761, test_f1: 0.5880
 epoch: 78, train_loss: 0.3347, test_loss: 1.8478, test_f1: 0.5973
 epoch: 79, train_loss: 0.3200, test_loss: 2.2799, test_f1: 0.5981
 epoch: 80, train_loss: 0.2804, test_loss: 2.2061, test_f1: 0.5895
 epoch: 81, train_loss: 0.2956, test_loss: 2.1834, test_f1: 0.6147
 epoch: 82, train_loss: 0.2716, test_loss: 2.2950, test_f1: 0.5918
 epoch: 83, train_loss: 0.2798, test_loss: 2.3545, test_f1: 0.6011
 epoch: 84, train_loss: 0.2919, test_loss: 2.7297, test_f1: 0.5811
 epoch: 85, train_loss: 0.3003, test_loss: 2.5843, test_f1: 0.5707
 epoch: 86, train_loss: 0.2742, test_loss: 2.7750, test_f1: 0.6036
 epoch: 87, train_loss: 0.2926, test_loss: 2.5895, test_f1: 0.6127
 epoch: 88, train_loss: 0.2707, test_loss: 2.4631, test_f1: 0.5485
 epoch: 89, train_loss: 0.2806, test_loss: 2.3260, test_f1: 0.6117
 epoch: 90, train_loss: 0.2677, test_loss: 2.5869, test_f1: 0.5962
 epoch: 91, train_loss: 0.2508, test_loss: 2.4506, test_f1: 0.6219
 epoch: 92, train_loss: 0.2663, test_loss: 2.4973, test_f1: 0.5864
 epoch: 93, train_loss: 0.2685, test_loss: 2.9788, test_f1: 0.5826
 epoch: 94, train_loss: 0.2734, test_loss: 3.0614, test_f1: 0.5834
 epoch: 95, train_loss: 0.2364, test_loss: 2.8506, test_f1: 0.6024
 epoch: 96, train_loss: 0.2431, test_loss: 2.5572, test_f1: 0.6088
 epoch: 97, train_loss: 0.2416, test_loss: 2.8742, test_f1: 0.5829
 epoch: 98, train_loss: 0.2698, test_loss: 2.6169, test_f1: 0.6123
 epoch: 99, train_loss: 0.2787, test_loss: 2.7995, test_f1: 0.6254
##################ITERATION #9 ****************************************
 epoch: 0, train_loss: 1.4552, test_loss: 1.5116, test_f1: 0.2106
 epoch: 1, train_loss: 1.1207, test_loss: 1.2965, test_f1: 0.2415
 epoch: 2, train_loss: 1.0163, test_loss: 1.2844, test_f1: 0.3733
 epoch: 3, train_loss: 0.9692, test_loss: 1.1084, test_f1: 0.5228
 epoch: 4, train_loss: 0.9424, test_loss: 1.0547, test_f1: 0.5587
 epoch: 5, train_loss: 0.9299, test_loss: 1.0965, test_f1: 0.4764
 epoch: 6, train_loss: 0.9053, test_loss: 1.1162, test_f1: 0.4919
 epoch: 7, train_loss: 0.8995, test_loss: 1.2119, test_f1: 0.4536
 epoch: 8, train_loss: 0.8802, test_loss: 1.0836, test_f1: 0.5002
 epoch: 9, train_loss: 0.8556, test_loss: 1.0482, test_f1: 0.5603
 epoch: 10, train_loss: 0.8412, test_loss: 1.0701, test_f1: 0.5114
 epoch: 11, train_loss: 0.8462, test_loss: 1.0418, test_f1: 0.5598
 epoch: 12, train_loss: 0.8366, test_loss: 1.0535, test_f1: 0.5367
 epoch: 13, train_loss: 0.7991, test_loss: 1.1924, test_f1: 0.5231
 epoch: 14, train_loss: 0.8147, test_loss: 1.1372, test_f1: 0.5347
 epoch: 15, train_loss: 0.8058, test_loss: 1.2914, test_f1: 0.4087
 epoch: 16, train_loss: 0.8111, test_loss: 1.1762, test_f1: 0.5049
 epoch: 17, train_loss: 0.7708, test_loss: 1.2972, test_f1: 0.4911
 epoch: 18, train_loss: 0.7594, test_loss: 1.2971, test_f1: 0.5158
 epoch: 19, train_loss: 0.7382, test_loss: 1.1006, test_f1: 0.5525
 epoch: 20, train_loss: 0.7114, test_loss: 1.0656, test_f1: 0.5999
 epoch: 21, train_loss: 0.7432, test_loss: 1.0999, test_f1: 0.5987
 epoch: 22, train_loss: 0.7313, test_loss: 1.1403, test_f1: 0.5717
 epoch: 23, train_loss: 0.7153, test_loss: 1.1219, test_f1: 0.5952
 epoch: 24, train_loss: 0.6925, test_loss: 1.4407, test_f1: 0.5379
 epoch: 25, train_loss: 0.6695, test_loss: 1.3396, test_f1: 0.5736
 epoch: 26, train_loss: 0.6818, test_loss: 1.5616, test_f1: 0.5285
 epoch: 27, train_loss: 0.6736, test_loss: 1.4701, test_f1: 0.4906
 epoch: 28, train_loss: 0.7217, test_loss: 1.1893, test_f1: 0.5762
 epoch: 29, train_loss: 0.6997, test_loss: 1.2589, test_f1: 0.5702
 epoch: 30, train_loss: 0.7226, test_loss: 1.3192, test_f1: 0.5481
 epoch: 31, train_loss: 0.6790, test_loss: 1.0640, test_f1: 0.5870
 epoch: 32, train_loss: 0.6334, test_loss: 1.0771, test_f1: 0.6002
 epoch: 33, train_loss: 0.6251, test_loss: 1.2215, test_f1: 0.5793
 epoch: 34, train_loss: 0.5979, test_loss: 1.5258, test_f1: 0.5138
 epoch: 35, train_loss: 0.6556, test_loss: 1.4584, test_f1: 0.5494
 epoch: 36, train_loss: 0.6424, test_loss: 1.2400, test_f1: 0.5152
 epoch: 37, train_loss: 0.6115, test_loss: 1.3549, test_f1: 0.5625
 epoch: 38, train_loss: 0.6104, test_loss: 1.4015, test_f1: 0.5750
 epoch: 39, train_loss: 0.6145, test_loss: 1.3060, test_f1: 0.5404
 epoch: 40, train_loss: 0.5964, test_loss: 1.3045, test_f1: 0.5743
 epoch: 41, train_loss: 0.5741, test_loss: 1.3081, test_f1: 0.5703
 epoch: 42, train_loss: 0.5770, test_loss: 1.4301, test_f1: 0.5804
 epoch: 43, train_loss: 0.5903, test_loss: 1.2210, test_f1: 0.5315
 epoch: 44, train_loss: 0.5633, test_loss: 1.6416, test_f1: 0.5627
 epoch: 45, train_loss: 0.5639, test_loss: 1.6401, test_f1: 0.5707
 epoch: 46, train_loss: 0.5544, test_loss: 1.9133, test_f1: 0.5395
 epoch: 47, train_loss: 0.5619, test_loss: 1.4309, test_f1: 0.5689
 epoch: 48, train_loss: 0.5774, test_loss: 1.2624, test_f1: 0.6065
 epoch: 49, train_loss: 0.5681, test_loss: 1.4808, test_f1: 0.5268
 epoch: 50, train_loss: 0.5464, test_loss: 1.5343, test_f1: 0.5452
 epoch: 51, train_loss: 0.4922, test_loss: 1.5227, test_f1: 0.5913
 epoch: 52, train_loss: 0.4926, test_loss: 1.4390, test_f1: 0.5953
 epoch: 53, train_loss: 0.4539, test_loss: 1.5148, test_f1: 0.6038
 epoch: 54, train_loss: 0.4299, test_loss: 1.5760, test_f1: 0.5607
 epoch: 55, train_loss: 0.4289, test_loss: 1.7013, test_f1: 0.5908
 epoch: 56, train_loss: 0.4581, test_loss: 1.6967, test_f1: 0.5638
 epoch: 57, train_loss: 0.4359, test_loss: 1.4952, test_f1: 0.5503
 epoch: 58, train_loss: 0.4495, test_loss: 1.4583, test_f1: 0.5891
 epoch: 59, train_loss: 0.4577, test_loss: 1.7062, test_f1: 0.6012
 epoch: 60, train_loss: 0.4621, test_loss: 1.6782, test_f1: 0.5684
 epoch: 61, train_loss: 0.4818, test_loss: 1.4691, test_f1: 0.6162
 epoch: 62, train_loss: 0.4354, test_loss: 1.4232, test_f1: 0.6098
 epoch: 63, train_loss: 0.3985, test_loss: 1.5138, test_f1: 0.5899
 epoch: 64, train_loss: 0.4334, test_loss: 1.6853, test_f1: 0.5990
 epoch: 65, train_loss: 0.4228, test_loss: 1.6499, test_f1: 0.5433
 epoch: 66, train_loss: 0.3885, test_loss: 1.7594, test_f1: 0.6051
 epoch: 67, train_loss: 0.3874, test_loss: 1.9095, test_f1: 0.5891
 epoch: 68, train_loss: 0.3682, test_loss: 1.6084, test_f1: 0.6122
 epoch: 69, train_loss: 0.3775, test_loss: 1.7766, test_f1: 0.5700
 epoch: 70, train_loss: 0.3586, test_loss: 1.7035, test_f1: 0.5821
 epoch: 71, train_loss: 0.3854, test_loss: 2.0512, test_f1: 0.5988
 epoch: 72, train_loss: 0.3846, test_loss: 1.6848, test_f1: 0.5727
 epoch: 73, train_loss: 0.3648, test_loss: 1.7484, test_f1: 0.5707
 epoch: 74, train_loss: 0.4146, test_loss: 2.2958, test_f1: 0.5331
 epoch: 75, train_loss: 0.3960, test_loss: 2.0598, test_f1: 0.5878
 epoch: 76, train_loss: 0.3523, test_loss: 1.7407, test_f1: 0.5804
 epoch: 77, train_loss: 0.3655, test_loss: 2.0115, test_f1: 0.5590
 epoch: 78, train_loss: 0.3642, test_loss: 2.1121, test_f1: 0.5712
 epoch: 79, train_loss: 0.3453, test_loss: 2.1974, test_f1: 0.5904
 epoch: 80, train_loss: 0.3315, test_loss: 2.1898, test_f1: 0.6207
 epoch: 81, train_loss: 0.3211, test_loss: 2.3363, test_f1: 0.5818
 epoch: 82, train_loss: 0.3504, test_loss: 1.7932, test_f1: 0.5910
 epoch: 83, train_loss: 0.3377, test_loss: 2.3133, test_f1: 0.5811
 epoch: 84, train_loss: 0.3209, test_loss: 2.1750, test_f1: 0.5304
 epoch: 85, train_loss: 0.3318, test_loss: 1.9773, test_f1: 0.6027
 epoch: 86, train_loss: 0.3276, test_loss: 2.5276, test_f1: 0.5887
 epoch: 87, train_loss: 0.3126, test_loss: 2.1126, test_f1: 0.5625
 epoch: 88, train_loss: 0.3125, test_loss: 2.1304, test_f1: 0.6037
 epoch: 89, train_loss: 0.3365, test_loss: 1.9288, test_f1: 0.5895
 epoch: 90, train_loss: 0.3260, test_loss: 2.0905, test_f1: 0.5727
 epoch: 91, train_loss: 0.3157, test_loss: 2.0835, test_f1: 0.5838
 epoch: 92, train_loss: 0.3257, test_loss: 2.3129, test_f1: 0.6162
 epoch: 93, train_loss: 0.3111, test_loss: 1.9866, test_f1: 0.5777
 epoch: 94, train_loss: 0.2790, test_loss: 2.5947, test_f1: 0.5777
 epoch: 95, train_loss: 0.2734, test_loss: 2.5104, test_f1: 0.6044
 epoch: 96, train_loss: 0.2858, test_loss: 2.4487, test_f1: 0.5939
 epoch: 97, train_loss: 0.3247, test_loss: 2.6837, test_f1: 0.5856
 epoch: 98, train_loss: 0.3281, test_loss: 2.4377, test_f1: 0.5635
 epoch: 99, train_loss: 0.3506, test_loss: 1.9939, test_f1: 0.5933

Training completed in 329.61 seconds
Best F1: 0.6536 at epoch 74
Mean F1 across iterations: 0.6385  0.0117
========================FINAL RESULTS================================
FEGIN weighted F1: 0.6536  0.0117
python main.py --data ltspice_demos --representation component_net --model FEGIN --layers 3 --hiddens 64 --batch_size 128 --lr 0.01 --emb_size 250 --epochs 100 --save_appendix component_net_L3_H64_BS128_LR0.01_E250 --no_val
-----



STDERR:
  File "main.py", line 370, in <module>
    main()
  File "main.py", line 254, in main
    dataset = dataset_class(
  File "/home/philip/projects/ltspice_examples_code_repo/Circuit-Completion-Using-GNNs/component_classification_with_link_prediction_head/evaluation/FEGIN/kernel/circuit_datasets.py", line 15, in __init__
    self.data, self.slices = torch.load(self.processed_paths[0])
  File "/home/philip/.local/lib/python3.8/site-packages/torch/serialization.py", line 1040, in load
    warnings.warn(
  File "/usr/lib/python3.8/warnings.py", line 109, in _showwarnmsg
    sw(msg.message, msg.category, msg.filename, msg.lineno,
  File "main.py", line 47, in warn_with_traceback
    traceback.print_stack(file=log)
/home/philip/projects/ltspice_examples_code_repo/Circuit-Completion-Using-GNNs/component_classification_with_link_prediction_head/evaluation/FEGIN/kernel/circuit_datasets.py:15: FutureWarning: You are using `torch.load` with `weights_only=False` (the current default value), which uses the default pickle module implicitly. It is possible to construct malicious pickle data which will execute arbitrary code during unpickling (See https://github.com/pytorch/pytorch/blob/main/SECURITY.md#untrusted-models for more details). In a future release, the default value for `weights_only` will be flipped to `True`. This limits the functions that could be executed during unpickling. Arbitrary objects will no longer be allowed to be loaded via this mode unless they are explicitly allowlisted by the user via `torch.serialization.add_safe_globals`. We recommend you start setting `weights_only=True` for any use case where you don't have full control of the loaded file. Please open an issue on GitHub for any issues related to this experimental feature.
  self.data, self.slices = torch.load(self.processed_paths[0])
