STDOUT:
Results will be saved in /home/philip/projects/ltspice_examples_code_repo/Circuit-Completion-Using-GNNs/component_classification_with_link_prediction_head/evaluation/FEGIN/results/model_FEGIN_dataset_ltspice_examples
Command line input: python main.py --data ltspice_examples --representation component_net --model FEGIN --layers 4 --hiddens 16 --batch_size 256 --lr 0.1 --emb_size 512 --epochs 100 --save_appendix component_net_L4_H16_BS256_LR0.1_E512 --no_val
 is saved.
-----
ltspice_examples - FEGIN
Using 4 layers, 16 hidden units, h = 2
Loading component_net representation dataset
ENTERED
Training FEGIN on component_net representation
Train: 3558, Test: 846
##################ITERATION #0 ****************************************
 epoch: 0, train_loss: 1.4370, test_loss: 2.7880, test_f1: 0.0813
 epoch: 1, train_loss: 1.2594, test_loss: 1.3004, test_f1: 0.2742
 epoch: 2, train_loss: 1.2169, test_loss: 1.2095, test_f1: 0.2937
 epoch: 3, train_loss: 1.1812, test_loss: 1.1954, test_f1: 0.2708
 epoch: 4, train_loss: 1.1368, test_loss: 1.1776, test_f1: 0.3269
 epoch: 5, train_loss: 1.1422, test_loss: 1.1706, test_f1: 0.2912
 epoch: 6, train_loss: 1.1179, test_loss: 1.0672, test_f1: 0.3657
 epoch: 7, train_loss: 1.1112, test_loss: 1.1019, test_f1: 0.3662
 epoch: 8, train_loss: 1.0897, test_loss: 1.0976, test_f1: 0.4217
 epoch: 9, train_loss: 1.0810, test_loss: 1.1393, test_f1: 0.4554
 epoch: 10, train_loss: 1.0815, test_loss: 1.1411, test_f1: 0.3536
 epoch: 11, train_loss: 1.0966, test_loss: 1.1003, test_f1: 0.3996
 epoch: 12, train_loss: 1.0730, test_loss: 1.3335, test_f1: 0.3640
 epoch: 13, train_loss: 1.1059, test_loss: 1.1382, test_f1: 0.3335
 epoch: 14, train_loss: 1.0894, test_loss: 1.7460, test_f1: 0.3123
 epoch: 15, train_loss: 1.0652, test_loss: 1.0266, test_f1: 0.4038
 epoch: 16, train_loss: 1.0628, test_loss: 1.0903, test_f1: 0.4162
 epoch: 17, train_loss: 1.0584, test_loss: 1.0133, test_f1: 0.4228
 epoch: 18, train_loss: 1.0317, test_loss: 1.0119, test_f1: 0.4418
 epoch: 19, train_loss: 1.0395, test_loss: 1.1760, test_f1: 0.3296
 epoch: 20, train_loss: 1.0548, test_loss: 1.0853, test_f1: 0.4471
 epoch: 21, train_loss: 1.0434, test_loss: 1.0218, test_f1: 0.4042
 epoch: 22, train_loss: 1.0481, test_loss: 1.0464, test_f1: 0.3912
 epoch: 23, train_loss: 1.0606, test_loss: 1.1472, test_f1: 0.4645
 epoch: 24, train_loss: 1.0393, test_loss: 1.1557, test_f1: 0.4087
 epoch: 25, train_loss: 1.0621, test_loss: 1.1073, test_f1: 0.4439
 epoch: 26, train_loss: 1.0600, test_loss: 1.3528, test_f1: 0.3126
 epoch: 27, train_loss: 1.0885, test_loss: 1.1878, test_f1: 0.3409
 epoch: 28, train_loss: 1.0711, test_loss: 1.2765, test_f1: 0.4540
 epoch: 29, train_loss: 1.0381, test_loss: 1.0444, test_f1: 0.4170
 epoch: 30, train_loss: 1.0330, test_loss: 1.0355, test_f1: 0.4338
 epoch: 31, train_loss: 1.0511, test_loss: 1.1311, test_f1: 0.3315
 epoch: 32, train_loss: 1.0749, test_loss: 1.0660, test_f1: 0.4628
 epoch: 33, train_loss: 1.0433, test_loss: 1.0013, test_f1: 0.4477
 epoch: 34, train_loss: 1.0486, test_loss: 1.0899, test_f1: 0.4479
 epoch: 35, train_loss: 1.0306, test_loss: 1.0950, test_f1: 0.4608
 epoch: 36, train_loss: 1.0246, test_loss: 1.1782, test_f1: 0.4744
 epoch: 37, train_loss: 1.0271, test_loss: 1.1915, test_f1: 0.4139
 epoch: 38, train_loss: 1.0213, test_loss: 1.0970, test_f1: 0.4656
 epoch: 39, train_loss: 1.0320, test_loss: 1.1380, test_f1: 0.4212
 epoch: 40, train_loss: 1.0314, test_loss: 1.1059, test_f1: 0.4634
 epoch: 41, train_loss: 1.0298, test_loss: 1.0642, test_f1: 0.4315
 epoch: 42, train_loss: 1.0488, test_loss: 0.9952, test_f1: 0.4646
 epoch: 43, train_loss: 1.0655, test_loss: 1.0527, test_f1: 0.4414
 epoch: 44, train_loss: 1.0527, test_loss: 1.2342, test_f1: 0.4324
 epoch: 45, train_loss: 1.0461, test_loss: 1.1342, test_f1: 0.4377
 epoch: 46, train_loss: 1.0484, test_loss: 1.2446, test_f1: 0.4547
 epoch: 47, train_loss: 1.0668, test_loss: 1.0718, test_f1: 0.4353
 epoch: 48, train_loss: 1.0727, test_loss: 1.0533, test_f1: 0.4127
 epoch: 49, train_loss: 1.0743, test_loss: 1.1590, test_f1: 0.4569
 epoch: 50, train_loss: 1.0621, test_loss: 1.0716, test_f1: 0.4345
 epoch: 51, train_loss: 1.0348, test_loss: 1.0307, test_f1: 0.4709
 epoch: 52, train_loss: 1.0244, test_loss: 1.0447, test_f1: 0.4548
 epoch: 53, train_loss: 1.0149, test_loss: 1.0182, test_f1: 0.4688
 epoch: 54, train_loss: 1.0218, test_loss: 1.1112, test_f1: 0.4591
 epoch: 55, train_loss: 1.0250, test_loss: 1.1014, test_f1: 0.4552
 epoch: 56, train_loss: 1.0178, test_loss: 1.0502, test_f1: 0.4642
 epoch: 57, train_loss: 1.0177, test_loss: 1.0219, test_f1: 0.4656
 epoch: 58, train_loss: 1.0158, test_loss: 1.0011, test_f1: 0.4855
 epoch: 59, train_loss: 1.0137, test_loss: 1.0496, test_f1: 0.4611
 epoch: 60, train_loss: 1.0289, test_loss: 1.0123, test_f1: 0.4781
 epoch: 61, train_loss: 1.0127, test_loss: 1.0020, test_f1: 0.4745
 epoch: 62, train_loss: 1.0122, test_loss: 1.2127, test_f1: 0.4434
 epoch: 63, train_loss: 1.0539, test_loss: 1.1176, test_f1: 0.3657
 epoch: 64, train_loss: 1.0341, test_loss: 1.0014, test_f1: 0.4671
 epoch: 65, train_loss: 1.0178, test_loss: 1.0489, test_f1: 0.4353
 epoch: 66, train_loss: 1.0125, test_loss: 1.0516, test_f1: 0.4324
 epoch: 67, train_loss: 1.0205, test_loss: 1.0247, test_f1: 0.4398
 epoch: 68, train_loss: 1.0051, test_loss: 1.0039, test_f1: 0.4498
 epoch: 69, train_loss: 1.0169, test_loss: 1.0281, test_f1: 0.4519
 epoch: 70, train_loss: 1.0503, test_loss: 1.0161, test_f1: 0.4670
 epoch: 71, train_loss: 1.0482, test_loss: 1.0094, test_f1: 0.4656
 epoch: 72, train_loss: 1.0166, test_loss: 1.3359, test_f1: 0.4361
 epoch: 73, train_loss: 1.0444, test_loss: 1.1431, test_f1: 0.4345
 epoch: 74, train_loss: 1.0400, test_loss: 1.1236, test_f1: 0.3951
 epoch: 75, train_loss: 1.0383, test_loss: 1.1067, test_f1: 0.4691
 epoch: 76, train_loss: 1.0231, test_loss: 1.1569, test_f1: 0.4406
 epoch: 77, train_loss: 1.0191, test_loss: 1.0441, test_f1: 0.4487
 epoch: 78, train_loss: 1.0061, test_loss: 1.1293, test_f1: 0.4718
 epoch: 79, train_loss: 1.0027, test_loss: 1.1396, test_f1: 0.4638
 epoch: 80, train_loss: 1.0077, test_loss: 1.1466, test_f1: 0.4528
 epoch: 81, train_loss: 1.0088, test_loss: 1.1220, test_f1: 0.4653
 epoch: 82, train_loss: 1.0098, test_loss: 1.0021, test_f1: 0.4730
 epoch: 83, train_loss: 1.0001, test_loss: 1.1918, test_f1: 0.4754
 epoch: 84, train_loss: 1.0069, test_loss: 1.1650, test_f1: 0.4662
 epoch: 85, train_loss: 1.0092, test_loss: 1.1693, test_f1: 0.4743
 epoch: 86, train_loss: 1.0026, test_loss: 1.1407, test_f1: 0.4721
 epoch: 87, train_loss: 1.0062, test_loss: 1.2845, test_f1: 0.4570
 epoch: 88, train_loss: 1.0053, test_loss: 1.3215, test_f1: 0.4585
 epoch: 89, train_loss: 0.9954, test_loss: 1.1839, test_f1: 0.4676
 epoch: 90, train_loss: 0.9930, test_loss: 1.1913, test_f1: 0.4741
 epoch: 91, train_loss: 1.0025, test_loss: 1.0214, test_f1: 0.4748
 epoch: 92, train_loss: 1.0024, test_loss: 0.9878, test_f1: 0.4706
 epoch: 93, train_loss: 1.0041, test_loss: 0.9945, test_f1: 0.5041
 epoch: 94, train_loss: 1.0098, test_loss: 1.0140, test_f1: 0.4911
 epoch: 95, train_loss: 1.0318, test_loss: 1.0281, test_f1: 0.4289
 epoch: 96, train_loss: 1.0349, test_loss: 1.1017, test_f1: 0.4443
 epoch: 97, train_loss: 0.9964, test_loss: 1.1772, test_f1: 0.4590
 epoch: 98, train_loss: 0.9960, test_loss: 1.3428, test_f1: 0.4683
 epoch: 99, train_loss: 1.0090, test_loss: 1.1131, test_f1: 0.4326
##################ITERATION #1 ****************************************
 epoch: 0, train_loss: 1.3217, test_loss: 1.3285, test_f1: 0.2270
 epoch: 1, train_loss: 1.2112, test_loss: 1.3123, test_f1: 0.2348
 epoch: 2, train_loss: 1.1897, test_loss: 1.3054, test_f1: 0.2439
 epoch: 3, train_loss: 1.1383, test_loss: 1.3532, test_f1: 0.3415
 epoch: 4, train_loss: 1.0936, test_loss: 1.2064, test_f1: 0.3479
 epoch: 5, train_loss: 1.1003, test_loss: 1.1604, test_f1: 0.3441
 epoch: 6, train_loss: 1.0824, test_loss: 1.0883, test_f1: 0.3544
 epoch: 7, train_loss: 1.0774, test_loss: 1.0855, test_f1: 0.3469
 epoch: 8, train_loss: 1.0792, test_loss: 1.2182, test_f1: 0.2936
 epoch: 9, train_loss: 1.1006, test_loss: 1.1810, test_f1: 0.3171
 epoch: 10, train_loss: 1.0898, test_loss: 1.0894, test_f1: 0.3422
 epoch: 11, train_loss: 1.0686, test_loss: 1.0935, test_f1: 0.3441
 epoch: 12, train_loss: 1.0616, test_loss: 1.1506, test_f1: 0.3388
 epoch: 13, train_loss: 1.0604, test_loss: 1.1666, test_f1: 0.3736
 epoch: 14, train_loss: 1.0532, test_loss: 1.0796, test_f1: 0.4015
 epoch: 15, train_loss: 1.0696, test_loss: 1.0476, test_f1: 0.3845
 epoch: 16, train_loss: 1.0551, test_loss: 1.1408, test_f1: 0.3441
 epoch: 17, train_loss: 1.0488, test_loss: 1.1782, test_f1: 0.4331
 epoch: 18, train_loss: 1.0496, test_loss: 1.3317, test_f1: 0.3767
 epoch: 19, train_loss: 1.0716, test_loss: 1.0764, test_f1: 0.4040
 epoch: 20, train_loss: 1.0713, test_loss: 1.1405, test_f1: 0.3397
 epoch: 21, train_loss: 1.0608, test_loss: 1.0809, test_f1: 0.3591
 epoch: 22, train_loss: 1.0503, test_loss: 1.0968, test_f1: 0.3575
 epoch: 23, train_loss: 1.0541, test_loss: 1.0793, test_f1: 0.3709
 epoch: 24, train_loss: 1.0710, test_loss: 1.1296, test_f1: 0.3503
 epoch: 25, train_loss: 1.0518, test_loss: 1.0716, test_f1: 0.3980
 epoch: 26, train_loss: 1.0434, test_loss: 1.5020, test_f1: 0.4034
 epoch: 27, train_loss: 1.0532, test_loss: 1.0750, test_f1: 0.3573
 epoch: 28, train_loss: 1.0363, test_loss: 1.2389, test_f1: 0.3675
 epoch: 29, train_loss: 1.0330, test_loss: 1.0573, test_f1: 0.4210
 epoch: 30, train_loss: 1.0291, test_loss: 1.2958, test_f1: 0.4256
 epoch: 31, train_loss: 1.0458, test_loss: 1.0884, test_f1: 0.3912
 epoch: 32, train_loss: 1.0417, test_loss: 1.1562, test_f1: 0.4078
 epoch: 33, train_loss: 1.0392, test_loss: 1.0311, test_f1: 0.3600
 epoch: 34, train_loss: 1.0460, test_loss: 1.0312, test_f1: 0.4449
 epoch: 35, train_loss: 1.0246, test_loss: 1.1818, test_f1: 0.4261
 epoch: 36, train_loss: 1.0280, test_loss: 1.1533, test_f1: 0.3849
 epoch: 37, train_loss: 1.0316, test_loss: 1.0441, test_f1: 0.4207
 epoch: 38, train_loss: 1.0531, test_loss: 1.2249, test_f1: 0.3678
 epoch: 39, train_loss: 1.0312, test_loss: 1.0663, test_f1: 0.4365
 epoch: 40, train_loss: 1.0570, test_loss: 1.0802, test_f1: 0.3913
 epoch: 41, train_loss: 1.0555, test_loss: 1.1286, test_f1: 0.3449
 epoch: 42, train_loss: 1.0683, test_loss: 1.0351, test_f1: 0.4101
 epoch: 43, train_loss: 1.0504, test_loss: 1.0428, test_f1: 0.3599
 epoch: 44, train_loss: 1.0348, test_loss: 1.0131, test_f1: 0.4309
 epoch: 45, train_loss: 1.0232, test_loss: 1.0052, test_f1: 0.4558
 epoch: 46, train_loss: 1.0240, test_loss: 1.2910, test_f1: 0.3334
 epoch: 47, train_loss: 1.0303, test_loss: 1.1439, test_f1: 0.4242
 epoch: 48, train_loss: 1.0314, test_loss: 1.2844, test_f1: 0.4506
 epoch: 49, train_loss: 1.0420, test_loss: 1.0754, test_f1: 0.3877
 epoch: 50, train_loss: 1.0488, test_loss: 1.0412, test_f1: 0.4297
 epoch: 51, train_loss: 1.0300, test_loss: 1.0307, test_f1: 0.4161
 epoch: 52, train_loss: 1.0270, test_loss: 1.0435, test_f1: 0.4642
 epoch: 53, train_loss: 1.0314, test_loss: 1.1473, test_f1: 0.3836
 epoch: 54, train_loss: 1.0270, test_loss: 1.1015, test_f1: 0.4520
 epoch: 55, train_loss: 1.0260, test_loss: 1.0132, test_f1: 0.4277
 epoch: 56, train_loss: 1.0169, test_loss: 1.0605, test_f1: 0.4628
 epoch: 57, train_loss: 1.0345, test_loss: 1.0320, test_f1: 0.4581
 epoch: 58, train_loss: 1.0411, test_loss: 1.0685, test_f1: 0.4475
 epoch: 59, train_loss: 1.0303, test_loss: 1.0994, test_f1: 0.4521
 epoch: 60, train_loss: 1.0127, test_loss: 1.0478, test_f1: 0.4603
 epoch: 61, train_loss: 1.0070, test_loss: 1.1993, test_f1: 0.4590
 epoch: 62, train_loss: 1.0082, test_loss: 1.0006, test_f1: 0.4723
 epoch: 63, train_loss: 0.9991, test_loss: 0.9800, test_f1: 0.4572
 epoch: 64, train_loss: 1.0214, test_loss: 1.1510, test_f1: 0.4447
 epoch: 65, train_loss: 1.0165, test_loss: 1.0124, test_f1: 0.4579
 epoch: 66, train_loss: 1.0179, test_loss: 1.0884, test_f1: 0.4132
 epoch: 67, train_loss: 1.0247, test_loss: 1.0137, test_f1: 0.4589
 epoch: 68, train_loss: 0.9997, test_loss: 1.1064, test_f1: 0.4538
 epoch: 69, train_loss: 1.0087, test_loss: 1.1465, test_f1: 0.4595
 epoch: 70, train_loss: 1.0101, test_loss: 1.0823, test_f1: 0.4031
 epoch: 71, train_loss: 1.0115, test_loss: 1.0947, test_f1: 0.4413
 epoch: 72, train_loss: 0.9994, test_loss: 0.9908, test_f1: 0.4750
 epoch: 73, train_loss: 1.0078, test_loss: 1.0930, test_f1: 0.4573
 epoch: 74, train_loss: 1.0175, test_loss: 1.1243, test_f1: 0.3440
 epoch: 75, train_loss: 1.0116, test_loss: 1.0372, test_f1: 0.4550
 epoch: 76, train_loss: 1.0002, test_loss: 1.0052, test_f1: 0.4233
 epoch: 77, train_loss: 0.9973, test_loss: 0.9809, test_f1: 0.4614
 epoch: 78, train_loss: 0.9896, test_loss: 1.0742, test_f1: 0.4636
 epoch: 79, train_loss: 0.9857, test_loss: 1.1502, test_f1: 0.4749
 epoch: 80, train_loss: 0.9909, test_loss: 1.0360, test_f1: 0.4621
 epoch: 81, train_loss: 0.9875, test_loss: 1.1088, test_f1: 0.4596
 epoch: 82, train_loss: 1.0065, test_loss: 1.0235, test_f1: 0.4661
 epoch: 83, train_loss: 0.9968, test_loss: 1.3324, test_f1: 0.4409
 epoch: 84, train_loss: 1.0296, test_loss: 1.0163, test_f1: 0.4272
 epoch: 85, train_loss: 1.0122, test_loss: 0.9725, test_f1: 0.4420
 epoch: 86, train_loss: 1.0032, test_loss: 0.9874, test_f1: 0.4780
 epoch: 87, train_loss: 0.9931, test_loss: 0.9931, test_f1: 0.4688
 epoch: 88, train_loss: 0.9937, test_loss: 1.0265, test_f1: 0.4443
 epoch: 89, train_loss: 1.0032, test_loss: 0.9812, test_f1: 0.4620
 epoch: 90, train_loss: 0.9927, test_loss: 0.9943, test_f1: 0.4616
 epoch: 91, train_loss: 0.9974, test_loss: 0.9644, test_f1: 0.4890
 epoch: 92, train_loss: 0.9745, test_loss: 0.9488, test_f1: 0.4836
 epoch: 93, train_loss: 0.9858, test_loss: 0.9621, test_f1: 0.4837
 epoch: 94, train_loss: 0.9829, test_loss: 0.9937, test_f1: 0.3617
 epoch: 95, train_loss: 1.0051, test_loss: 1.0261, test_f1: 0.4335
 epoch: 96, train_loss: 1.0194, test_loss: 1.0259, test_f1: 0.4399
 epoch: 97, train_loss: 1.0248, test_loss: 1.0223, test_f1: 0.4362
 epoch: 98, train_loss: 0.9938, test_loss: 1.0333, test_f1: 0.4503
 epoch: 99, train_loss: 1.0012, test_loss: 1.2630, test_f1: 0.4303
##################ITERATION #2 ****************************************
 epoch: 0, train_loss: 1.4959, test_loss: 1.4186, test_f1: 0.2281
 epoch: 1, train_loss: 1.2656, test_loss: 1.2332, test_f1: 0.2270
 epoch: 2, train_loss: 1.2273, test_loss: 1.1583, test_f1: 0.3237
 epoch: 3, train_loss: 1.2044, test_loss: 1.1473, test_f1: 0.3498
 epoch: 4, train_loss: 1.1963, test_loss: 1.1271, test_f1: 0.3324
 epoch: 5, train_loss: 1.1775, test_loss: 1.2079, test_f1: 0.2999
 epoch: 6, train_loss: 1.1428, test_loss: 1.1251, test_f1: 0.3533
 epoch: 7, train_loss: 1.1257, test_loss: 1.0664, test_f1: 0.3441
 epoch: 8, train_loss: 1.1207, test_loss: 1.0694, test_f1: 0.3642
 epoch: 9, train_loss: 1.1251, test_loss: 1.0791, test_f1: 0.3659
 epoch: 10, train_loss: 1.0998, test_loss: 1.1355, test_f1: 0.3456
 epoch: 11, train_loss: 1.0942, test_loss: 1.0746, test_f1: 0.3422
 epoch: 12, train_loss: 1.0849, test_loss: 1.1348, test_f1: 0.3440
 epoch: 13, train_loss: 1.0815, test_loss: 1.1239, test_f1: 0.3432
 epoch: 14, train_loss: 1.0820, test_loss: 1.1269, test_f1: 0.3432
 epoch: 15, train_loss: 1.0931, test_loss: 1.0798, test_f1: 0.3400
 epoch: 16, train_loss: 1.0818, test_loss: 1.1341, test_f1: 0.3422
 epoch: 17, train_loss: 1.0845, test_loss: 1.1509, test_f1: 0.3470
 epoch: 18, train_loss: 1.0775, test_loss: 1.1185, test_f1: 0.3432
 epoch: 19, train_loss: 1.0698, test_loss: 1.0559, test_f1: 0.3593
 epoch: 20, train_loss: 1.0745, test_loss: 1.1969, test_f1: 0.3379
 epoch: 21, train_loss: 1.0782, test_loss: 1.0928, test_f1: 0.3432
 epoch: 22, train_loss: 1.0674, test_loss: 1.0842, test_f1: 0.3422
 epoch: 23, train_loss: 1.0745, test_loss: 1.1535, test_f1: 0.3421
 epoch: 24, train_loss: 1.0748, test_loss: 1.0631, test_f1: 0.3569
 epoch: 25, train_loss: 1.0654, test_loss: 1.0652, test_f1: 0.3467
 epoch: 26, train_loss: 1.0674, test_loss: 1.1381, test_f1: 0.3429
 epoch: 27, train_loss: 1.0838, test_loss: 1.0825, test_f1: 0.3422
 epoch: 28, train_loss: 1.0661, test_loss: 1.0892, test_f1: 0.3413
 epoch: 29, train_loss: 1.0773, test_loss: 1.1790, test_f1: 0.3422
 epoch: 30, train_loss: 1.0692, test_loss: 1.0892, test_f1: 0.3425
 epoch: 31, train_loss: 1.0737, test_loss: 1.0898, test_f1: 0.3474
 epoch: 32, train_loss: 1.0596, test_loss: 1.1427, test_f1: 0.3565
 epoch: 33, train_loss: 1.0594, test_loss: 1.1203, test_f1: 0.3422
 epoch: 34, train_loss: 1.0727, test_loss: 1.0838, test_f1: 0.3432
 epoch: 35, train_loss: 1.0585, test_loss: 1.1509, test_f1: 0.3452
 epoch: 36, train_loss: 1.0535, test_loss: 1.1408, test_f1: 0.3568
 epoch: 37, train_loss: 1.0623, test_loss: 1.0767, test_f1: 0.3576
 epoch: 38, train_loss: 1.0741, test_loss: 1.0922, test_f1: 0.3532
 epoch: 39, train_loss: 1.0603, test_loss: 1.0586, test_f1: 0.3572
 epoch: 40, train_loss: 1.0639, test_loss: 1.1330, test_f1: 0.3848
 epoch: 41, train_loss: 1.0565, test_loss: 1.1484, test_f1: 0.4296
 epoch: 42, train_loss: 1.0589, test_loss: 1.1762, test_f1: 0.4231
 epoch: 43, train_loss: 1.0705, test_loss: 1.2072, test_f1: 0.3555
 epoch: 44, train_loss: 1.0774, test_loss: 1.2077, test_f1: 0.3422
 epoch: 45, train_loss: 1.0677, test_loss: 1.0789, test_f1: 0.3553
 epoch: 46, train_loss: 1.0580, test_loss: 1.1636, test_f1: 0.3679
 epoch: 47, train_loss: 1.0644, test_loss: 1.1640, test_f1: 0.3630
 epoch: 48, train_loss: 1.0565, test_loss: 1.0844, test_f1: 0.3569
 epoch: 49, train_loss: 1.0570, test_loss: 1.1408, test_f1: 0.3829
 epoch: 50, train_loss: 1.0482, test_loss: 1.1450, test_f1: 0.3935
 epoch: 51, train_loss: 1.0420, test_loss: 1.1349, test_f1: 0.4134
 epoch: 52, train_loss: 1.0375, test_loss: 1.1398, test_f1: 0.4385
 epoch: 53, train_loss: 1.0557, test_loss: 1.1335, test_f1: 0.4599
 epoch: 54, train_loss: 1.0402, test_loss: 1.1493, test_f1: 0.4317
 epoch: 55, train_loss: 1.0373, test_loss: 1.1558, test_f1: 0.4117
 epoch: 56, train_loss: 1.0387, test_loss: 1.1460, test_f1: 0.4169
 epoch: 57, train_loss: 1.0420, test_loss: 1.1540, test_f1: 0.4436
 epoch: 58, train_loss: 1.0447, test_loss: 1.1367, test_f1: 0.3979
 epoch: 59, train_loss: 1.0359, test_loss: 1.1319, test_f1: 0.4396
 epoch: 60, train_loss: 1.0308, test_loss: 1.1330, test_f1: 0.4353
 epoch: 61, train_loss: 1.0305, test_loss: 1.1150, test_f1: 0.4384
 epoch: 62, train_loss: 1.0285, test_loss: 1.0900, test_f1: 0.4571
 epoch: 63, train_loss: 1.0338, test_loss: 1.1208, test_f1: 0.4490
 epoch: 64, train_loss: 1.0214, test_loss: 1.1491, test_f1: 0.4567
 epoch: 65, train_loss: 1.0277, test_loss: 1.1318, test_f1: 0.4514
 epoch: 66, train_loss: 1.0253, test_loss: 1.1190, test_f1: 0.4544
 epoch: 67, train_loss: 1.0289, test_loss: 1.1337, test_f1: 0.4163
 epoch: 68, train_loss: 1.0265, test_loss: 1.1516, test_f1: 0.4606
 epoch: 69, train_loss: 1.0337, test_loss: 1.2291, test_f1: 0.4204
 epoch: 70, train_loss: 1.0373, test_loss: 1.1310, test_f1: 0.4474
 epoch: 71, train_loss: 1.0366, test_loss: 1.0667, test_f1: 0.4496
 epoch: 72, train_loss: 1.0331, test_loss: 1.1107, test_f1: 0.4634
 epoch: 73, train_loss: 1.0632, test_loss: 1.1076, test_f1: 0.3524
 epoch: 74, train_loss: 1.0724, test_loss: 1.1293, test_f1: 0.4355
 epoch: 75, train_loss: 1.0388, test_loss: 1.1243, test_f1: 0.4496
 epoch: 76, train_loss: 1.0315, test_loss: 1.1485, test_f1: 0.4343
 epoch: 77, train_loss: 1.0316, test_loss: 1.0647, test_f1: 0.4489
 epoch: 78, train_loss: 1.0307, test_loss: 1.1241, test_f1: 0.4586
 epoch: 79, train_loss: 1.0401, test_loss: 1.1377, test_f1: 0.4232
 epoch: 80, train_loss: 1.0496, test_loss: 1.1241, test_f1: 0.4492
 epoch: 81, train_loss: 1.0421, test_loss: 1.1067, test_f1: 0.4458
 epoch: 82, train_loss: 1.0411, test_loss: 1.1517, test_f1: 0.3548
 epoch: 83, train_loss: 1.0419, test_loss: 1.1638, test_f1: 0.4255
 epoch: 84, train_loss: 1.0268, test_loss: 1.1669, test_f1: 0.4534
 epoch: 85, train_loss: 1.0338, test_loss: 1.1545, test_f1: 0.4388
 epoch: 86, train_loss: 1.0277, test_loss: 1.1975, test_f1: 0.4371
 epoch: 87, train_loss: 1.0358, test_loss: 1.0354, test_f1: 0.4547
 epoch: 88, train_loss: 1.0248, test_loss: 1.0888, test_f1: 0.4522
 epoch: 89, train_loss: 1.0201, test_loss: 1.1009, test_f1: 0.4798
 epoch: 90, train_loss: 1.0201, test_loss: 1.0822, test_f1: 0.3831
 epoch: 91, train_loss: 1.0307, test_loss: 1.0378, test_f1: 0.4272
 epoch: 92, train_loss: 1.0271, test_loss: 1.1503, test_f1: 0.4658
 epoch: 93, train_loss: 1.0212, test_loss: 1.1192, test_f1: 0.4812
 epoch: 94, train_loss: 1.0117, test_loss: 1.1455, test_f1: 0.4402
 epoch: 95, train_loss: 1.0155, test_loss: 1.1275, test_f1: 0.4606
 epoch: 96, train_loss: 1.0189, test_loss: 1.1166, test_f1: 0.4496
 epoch: 97, train_loss: 1.0348, test_loss: 1.1133, test_f1: 0.4277
 epoch: 98, train_loss: 1.0301, test_loss: 1.0846, test_f1: 0.4787
 epoch: 99, train_loss: 1.0224, test_loss: 1.1133, test_f1: 0.4954
##################ITERATION #3 ****************************************
 epoch: 0, train_loss: 1.4043, test_loss: 1.4476, test_f1: 0.2270
 epoch: 1, train_loss: 1.2310, test_loss: 1.3903, test_f1: 0.2270
 epoch: 2, train_loss: 1.1831, test_loss: 1.3196, test_f1: 0.2692
 epoch: 3, train_loss: 1.1711, test_loss: 1.1732, test_f1: 0.3299
 epoch: 4, train_loss: 1.1755, test_loss: 1.3558, test_f1: 0.2295
 epoch: 5, train_loss: 1.1635, test_loss: 1.1311, test_f1: 0.3446
 epoch: 6, train_loss: 1.1638, test_loss: 1.1369, test_f1: 0.3359
 epoch: 7, train_loss: 1.1565, test_loss: 1.1147, test_f1: 0.3576
 epoch: 8, train_loss: 1.1397, test_loss: 1.1033, test_f1: 0.3531
 epoch: 9, train_loss: 1.1382, test_loss: 1.0972, test_f1: 0.3560
 epoch: 10, train_loss: 1.1278, test_loss: 1.1289, test_f1: 0.3446
 epoch: 11, train_loss: 1.1235, test_loss: 1.1294, test_f1: 0.3413
 epoch: 12, train_loss: 1.1139, test_loss: 1.1205, test_f1: 0.3442
 epoch: 13, train_loss: 1.1067, test_loss: 1.1652, test_f1: 0.3297
 epoch: 14, train_loss: 1.1065, test_loss: 1.1339, test_f1: 0.3441
 epoch: 15, train_loss: 1.1254, test_loss: 1.3108, test_f1: 0.3101
 epoch: 16, train_loss: 1.1126, test_loss: 1.1443, test_f1: 0.3422
 epoch: 17, train_loss: 1.1067, test_loss: 1.1489, test_f1: 0.3448
 epoch: 18, train_loss: 1.0896, test_loss: 1.2237, test_f1: 0.3295
 epoch: 19, train_loss: 1.0885, test_loss: 1.1340, test_f1: 0.3472
 epoch: 20, train_loss: 1.0944, test_loss: 1.3261, test_f1: 0.2611
 epoch: 21, train_loss: 1.1181, test_loss: 1.2488, test_f1: 0.2967
 epoch: 22, train_loss: 1.1050, test_loss: 1.0966, test_f1: 0.3465
 epoch: 23, train_loss: 1.0901, test_loss: 1.1974, test_f1: 0.3348
 epoch: 24, train_loss: 1.0803, test_loss: 1.1344, test_f1: 0.3462
 epoch: 25, train_loss: 1.0876, test_loss: 1.2806, test_f1: 0.2801
 epoch: 26, train_loss: 1.1051, test_loss: 1.1332, test_f1: 0.3432
 epoch: 27, train_loss: 1.0829, test_loss: 1.1680, test_f1: 0.3474
 epoch: 28, train_loss: 1.0796, test_loss: 1.1434, test_f1: 0.3453
 epoch: 29, train_loss: 1.0865, test_loss: 1.0795, test_f1: 0.3533
 epoch: 30, train_loss: 1.0936, test_loss: 1.1695, test_f1: 0.3432
 epoch: 31, train_loss: 1.0902, test_loss: 1.1302, test_f1: 0.3476
 epoch: 32, train_loss: 1.0882, test_loss: 1.1551, test_f1: 0.3441
 epoch: 33, train_loss: 1.1004, test_loss: 1.1263, test_f1: 0.3455
 epoch: 34, train_loss: 1.0895, test_loss: 1.1339, test_f1: 0.3487
 epoch: 35, train_loss: 1.0890, test_loss: 1.1776, test_f1: 0.3460
 epoch: 36, train_loss: 1.1009, test_loss: 1.1776, test_f1: 0.3403
 epoch: 37, train_loss: 1.1090, test_loss: 1.2155, test_f1: 0.3422
 epoch: 38, train_loss: 1.1091, test_loss: 1.2153, test_f1: 0.3403
 epoch: 39, train_loss: 1.1113, test_loss: 1.2449, test_f1: 0.3422
 epoch: 40, train_loss: 1.1062, test_loss: 1.2165, test_f1: 0.3422
 epoch: 41, train_loss: 1.0983, test_loss: 1.1715, test_f1: 0.3469
 epoch: 42, train_loss: 1.0998, test_loss: 1.1660, test_f1: 0.3432
 epoch: 43, train_loss: 1.0921, test_loss: 1.1046, test_f1: 0.3513
 epoch: 44, train_loss: 1.0842, test_loss: 1.0710, test_f1: 0.3556
 epoch: 45, train_loss: 1.1105, test_loss: 1.2934, test_f1: 0.2765
 epoch: 46, train_loss: 1.1090, test_loss: 1.1555, test_f1: 0.3413
 epoch: 47, train_loss: 1.0987, test_loss: 1.2596, test_f1: 0.3460
 epoch: 48, train_loss: 1.1073, test_loss: 1.2756, test_f1: 0.3467
 epoch: 49, train_loss: 1.1055, test_loss: 1.1524, test_f1: 0.3422
 epoch: 50, train_loss: 1.1138, test_loss: 1.1281, test_f1: 0.3382
 epoch: 51, train_loss: 1.1184, test_loss: 1.1657, test_f1: 0.3422
 epoch: 52, train_loss: 1.1020, test_loss: 1.1940, test_f1: 0.3469
 epoch: 53, train_loss: 1.0879, test_loss: 1.1255, test_f1: 0.3432
 epoch: 54, train_loss: 1.0865, test_loss: 1.1289, test_f1: 0.3478
 epoch: 55, train_loss: 1.0995, test_loss: 1.1042, test_f1: 0.3432
 epoch: 56, train_loss: 1.0871, test_loss: 1.1438, test_f1: 0.3488
 epoch: 57, train_loss: 1.0751, test_loss: 1.1533, test_f1: 0.3488
 epoch: 58, train_loss: 1.0782, test_loss: 1.1051, test_f1: 0.3475
 epoch: 59, train_loss: 1.0746, test_loss: 1.1544, test_f1: 0.3479
 epoch: 60, train_loss: 1.0675, test_loss: 1.1750, test_f1: 0.3451
 epoch: 61, train_loss: 1.0609, test_loss: 1.1952, test_f1: 0.3506
 epoch: 62, train_loss: 1.0617, test_loss: 1.1570, test_f1: 0.3497
 epoch: 63, train_loss: 1.0659, test_loss: 1.1783, test_f1: 0.3482
 epoch: 64, train_loss: 1.0744, test_loss: 1.1493, test_f1: 0.3469
 epoch: 65, train_loss: 1.0627, test_loss: 1.1705, test_f1: 0.3497
 epoch: 66, train_loss: 1.0663, test_loss: 1.1842, test_f1: 0.3494
 epoch: 67, train_loss: 1.0696, test_loss: 1.1330, test_f1: 0.3479
 epoch: 68, train_loss: 1.0596, test_loss: 1.1638, test_f1: 0.3506
 epoch: 69, train_loss: 1.0602, test_loss: 1.1716, test_f1: 0.3472
 epoch: 70, train_loss: 1.0645, test_loss: 1.1763, test_f1: 0.3497
 epoch: 71, train_loss: 1.0641, test_loss: 1.2054, test_f1: 0.3497
 epoch: 72, train_loss: 1.0605, test_loss: 1.1743, test_f1: 0.3497
 epoch: 73, train_loss: 1.0570, test_loss: 1.1369, test_f1: 0.3506
 epoch: 74, train_loss: 1.0655, test_loss: 1.2115, test_f1: 0.3496
 epoch: 75, train_loss: 1.0648, test_loss: 1.2169, test_f1: 0.3488
 epoch: 76, train_loss: 1.0614, test_loss: 1.1810, test_f1: 0.3504
 epoch: 77, train_loss: 1.0618, test_loss: 1.1851, test_f1: 0.3486
 epoch: 78, train_loss: 1.0638, test_loss: 1.1349, test_f1: 0.3497
 epoch: 79, train_loss: 1.0579, test_loss: 1.1946, test_f1: 0.3496
 epoch: 80, train_loss: 1.0590, test_loss: 1.0504, test_f1: 0.3620
 epoch: 81, train_loss: 1.0706, test_loss: 1.1474, test_f1: 0.3497
 epoch: 82, train_loss: 1.0569, test_loss: 1.2354, test_f1: 0.3506
 epoch: 83, train_loss: 1.0537, test_loss: 1.2750, test_f1: 0.3495
 epoch: 84, train_loss: 1.0646, test_loss: 1.1838, test_f1: 0.3497
 epoch: 85, train_loss: 1.0583, test_loss: 1.1529, test_f1: 0.3506
 epoch: 86, train_loss: 1.0525, test_loss: 1.1948, test_f1: 0.3506
 epoch: 87, train_loss: 1.0516, test_loss: 1.2101, test_f1: 0.3506
 epoch: 88, train_loss: 1.0586, test_loss: 1.2325, test_f1: 0.3506
 epoch: 89, train_loss: 1.0507, test_loss: 1.2442, test_f1: 0.3506
 epoch: 90, train_loss: 1.0512, test_loss: 1.1255, test_f1: 0.3496
 epoch: 91, train_loss: 1.0492, test_loss: 1.1997, test_f1: 0.3496
 epoch: 92, train_loss: 1.0522, test_loss: 1.2356, test_f1: 0.3506
 epoch: 93, train_loss: 1.0569, test_loss: 1.3279, test_f1: 0.3477
 epoch: 94, train_loss: 1.0629, test_loss: 1.4066, test_f1: 0.3479
 epoch: 95, train_loss: 1.0527, test_loss: 1.2913, test_f1: 0.3441
 epoch: 96, train_loss: 1.0595, test_loss: 1.3144, test_f1: 0.3485
 epoch: 97, train_loss: 1.0594, test_loss: 1.2831, test_f1: 0.3460
 epoch: 98, train_loss: 1.0549, test_loss: 1.2710, test_f1: 0.3479
 epoch: 99, train_loss: 1.0527, test_loss: 1.2937, test_f1: 0.3536
##################ITERATION #4 ****************************************
 epoch: 0, train_loss: 1.3932, test_loss: 1.4412, test_f1: 0.2270
 epoch: 1, train_loss: 1.2386, test_loss: 1.4260, test_f1: 0.2270
 epoch: 2, train_loss: 1.1931, test_loss: 1.3793, test_f1: 0.2270
 epoch: 3, train_loss: 1.1751, test_loss: 1.2451, test_f1: 0.2836
 epoch: 4, train_loss: 1.1455, test_loss: 1.2027, test_f1: 0.2970
 epoch: 5, train_loss: 1.1485, test_loss: 1.1561, test_f1: 0.3198
 epoch: 6, train_loss: 1.1349, test_loss: 1.0815, test_f1: 0.3668
 epoch: 7, train_loss: 1.1073, test_loss: 1.1102, test_f1: 0.3467
 epoch: 8, train_loss: 1.1247, test_loss: 1.1792, test_f1: 0.3317
 epoch: 9, train_loss: 1.1144, test_loss: 1.1305, test_f1: 0.3411
 epoch: 10, train_loss: 1.1210, test_loss: 1.1334, test_f1: 0.3394
 epoch: 11, train_loss: 1.0996, test_loss: 1.0728, test_f1: 0.3420
 epoch: 12, train_loss: 1.1205, test_loss: 1.2084, test_f1: 0.2709
 epoch: 13, train_loss: 1.0976, test_loss: 1.1485, test_f1: 0.3362
 epoch: 14, train_loss: 1.0939, test_loss: 1.1391, test_f1: 0.3777
 epoch: 15, train_loss: 1.0877, test_loss: 1.2037, test_f1: 0.3853
 epoch: 16, train_loss: 1.0967, test_loss: 1.3148, test_f1: 0.2320
 epoch: 17, train_loss: 1.1055, test_loss: 1.2707, test_f1: 0.2595
 epoch: 18, train_loss: 1.0988, test_loss: 1.0913, test_f1: 0.3580
 epoch: 19, train_loss: 1.0968, test_loss: 1.1130, test_f1: 0.3462
 epoch: 20, train_loss: 1.1088, test_loss: 1.1107, test_f1: 0.3701
 epoch: 21, train_loss: 1.0977, test_loss: 1.1727, test_f1: 0.3184
 epoch: 22, train_loss: 1.0914, test_loss: 1.1479, test_f1: 0.3229
 epoch: 23, train_loss: 1.0973, test_loss: 1.1200, test_f1: 0.3553
 epoch: 24, train_loss: 1.0866, test_loss: 1.0674, test_f1: 0.3893
 epoch: 25, train_loss: 1.0834, test_loss: 1.3264, test_f1: 0.3159
 epoch: 26, train_loss: 1.0882, test_loss: 1.1521, test_f1: 0.3044
 epoch: 27, train_loss: 1.0811, test_loss: 1.1044, test_f1: 0.3568
 epoch: 28, train_loss: 1.0824, test_loss: 1.0728, test_f1: 0.3432
 epoch: 29, train_loss: 1.0749, test_loss: 1.0888, test_f1: 0.3432
 epoch: 30, train_loss: 1.0649, test_loss: 1.1609, test_f1: 0.3360
 epoch: 31, train_loss: 1.0847, test_loss: 1.1143, test_f1: 0.3451
 epoch: 32, train_loss: 1.0694, test_loss: 1.0764, test_f1: 0.3511
 epoch: 33, train_loss: 1.0772, test_loss: 1.0775, test_f1: 0.3524
 epoch: 34, train_loss: 1.0677, test_loss: 1.0793, test_f1: 0.3451
 epoch: 35, train_loss: 1.0773, test_loss: 1.0900, test_f1: 0.3494
 epoch: 36, train_loss: 1.0752, test_loss: 1.1380, test_f1: 0.3497
 epoch: 37, train_loss: 1.0816, test_loss: 1.0636, test_f1: 0.3451
 epoch: 38, train_loss: 1.0752, test_loss: 1.2183, test_f1: 0.3143
 epoch: 39, train_loss: 1.0853, test_loss: 1.1296, test_f1: 0.3469
 epoch: 40, train_loss: 1.0836, test_loss: 1.0803, test_f1: 0.3425
 epoch: 41, train_loss: 1.0783, test_loss: 1.0788, test_f1: 0.3569
 epoch: 42, train_loss: 1.0729, test_loss: 1.1807, test_f1: 0.3432
 epoch: 43, train_loss: 1.0784, test_loss: 1.1861, test_f1: 0.3337
 epoch: 44, train_loss: 1.0693, test_loss: 1.1927, test_f1: 0.3483
 epoch: 45, train_loss: 1.0771, test_loss: 1.9882, test_f1: 0.2726
 epoch: 46, train_loss: 1.1055, test_loss: 1.1914, test_f1: 0.3382
 epoch: 47, train_loss: 1.0925, test_loss: 1.0980, test_f1: 0.3544
 epoch: 48, train_loss: 1.0962, test_loss: 1.0690, test_f1: 0.3573
 epoch: 49, train_loss: 1.0865, test_loss: 1.0796, test_f1: 0.3432
 epoch: 50, train_loss: 1.0953, test_loss: 1.0824, test_f1: 0.3422
 epoch: 51, train_loss: 1.0730, test_loss: 1.0795, test_f1: 0.3512
 epoch: 52, train_loss: 1.0838, test_loss: 1.1140, test_f1: 0.3462
 epoch: 53, train_loss: 1.0763, test_loss: 1.1485, test_f1: 0.3457
 epoch: 54, train_loss: 1.0720, test_loss: 1.1875, test_f1: 0.3394
 epoch: 55, train_loss: 1.0756, test_loss: 1.1438, test_f1: 0.3608
 epoch: 56, train_loss: 1.0677, test_loss: 1.1780, test_f1: 0.3371
 epoch: 57, train_loss: 1.0610, test_loss: 1.1757, test_f1: 0.3528
 epoch: 58, train_loss: 1.0668, test_loss: 1.1673, test_f1: 0.3645
 epoch: 59, train_loss: 1.0664, test_loss: 1.0981, test_f1: 0.3429
 epoch: 60, train_loss: 1.0762, test_loss: 1.0876, test_f1: 0.3516
 epoch: 61, train_loss: 1.0775, test_loss: 1.1622, test_f1: 0.3427
 epoch: 62, train_loss: 1.0729, test_loss: 1.1880, test_f1: 0.3448
 epoch: 63, train_loss: 1.0995, test_loss: 1.0985, test_f1: 0.3411
 epoch: 64, train_loss: 1.0900, test_loss: 1.1285, test_f1: 0.3428
 epoch: 65, train_loss: 1.0689, test_loss: 1.1848, test_f1: 0.3513
 epoch: 66, train_loss: 1.0571, test_loss: 1.1879, test_f1: 0.3485
 epoch: 67, train_loss: 1.0551, test_loss: 1.0878, test_f1: 0.3673
 epoch: 68, train_loss: 1.0563, test_loss: 1.0955, test_f1: 0.3839
 epoch: 69, train_loss: 1.0590, test_loss: 1.2014, test_f1: 0.3412
 epoch: 70, train_loss: 1.0495, test_loss: 1.1764, test_f1: 0.3757
 epoch: 71, train_loss: 1.0525, test_loss: 1.1948, test_f1: 0.3989
 epoch: 72, train_loss: 1.0511, test_loss: 1.0932, test_f1: 0.4024
 epoch: 73, train_loss: 1.0585, test_loss: 1.1970, test_f1: 0.3695
 epoch: 74, train_loss: 1.0544, test_loss: 1.2027, test_f1: 0.3931
 epoch: 75, train_loss: 1.0471, test_loss: 1.2125, test_f1: 0.4131
 epoch: 76, train_loss: 1.0458, test_loss: 1.1971, test_f1: 0.4207
 epoch: 77, train_loss: 1.0459, test_loss: 1.2103, test_f1: 0.4328
 epoch: 78, train_loss: 1.0411, test_loss: 1.1925, test_f1: 0.4293
 epoch: 79, train_loss: 1.0435, test_loss: 1.1649, test_f1: 0.4213
 epoch: 80, train_loss: 1.0451, test_loss: 1.1234, test_f1: 0.4301
 epoch: 81, train_loss: 1.0493, test_loss: 1.0859, test_f1: 0.4304
 epoch: 82, train_loss: 1.0400, test_loss: 1.1065, test_f1: 0.4149
 epoch: 83, train_loss: 1.0514, test_loss: 1.0519, test_f1: 0.4150
 epoch: 84, train_loss: 1.0465, test_loss: 1.1493, test_f1: 0.4015
 epoch: 85, train_loss: 1.0441, test_loss: 1.2096, test_f1: 0.4077
 epoch: 86, train_loss: 1.0452, test_loss: 1.2044, test_f1: 0.4403
 epoch: 87, train_loss: 1.0411, test_loss: 1.0612, test_f1: 0.4028
 epoch: 88, train_loss: 1.0406, test_loss: 1.0994, test_f1: 0.4127
 epoch: 89, train_loss: 1.0458, test_loss: 1.0605, test_f1: 0.3703
 epoch: 90, train_loss: 1.0488, test_loss: 1.0626, test_f1: 0.4124
 epoch: 91, train_loss: 1.0433, test_loss: 1.2141, test_f1: 0.4428
 epoch: 92, train_loss: 1.0353, test_loss: 1.3447, test_f1: 0.4235
 epoch: 93, train_loss: 1.0469, test_loss: 1.1499, test_f1: 0.4385
 epoch: 94, train_loss: 1.0431, test_loss: 1.1705, test_f1: 0.4031
 epoch: 95, train_loss: 1.0303, test_loss: 1.1799, test_f1: 0.4274
 epoch: 96, train_loss: 1.0362, test_loss: 1.0468, test_f1: 0.4300
 epoch: 97, train_loss: 1.0345, test_loss: 1.3272, test_f1: 0.4497
 epoch: 98, train_loss: 1.0314, test_loss: 1.2144, test_f1: 0.4401
 epoch: 99, train_loss: 1.0457, test_loss: 1.0979, test_f1: 0.4008
##################ITERATION #5 ****************************************
 epoch: 0, train_loss: 1.3271, test_loss: 1.4362, test_f1: 0.2270
 epoch: 1, train_loss: 1.1860, test_loss: 1.4211, test_f1: 0.2270
 epoch: 2, train_loss: 1.1435, test_loss: 1.3953, test_f1: 0.2295
 epoch: 3, train_loss: 1.1240, test_loss: 1.1461, test_f1: 0.3420
 epoch: 4, train_loss: 1.1298, test_loss: 1.1202, test_f1: 0.3415
 epoch: 5, train_loss: 1.1083, test_loss: 1.1250, test_f1: 0.3432
 epoch: 6, train_loss: 1.0921, test_loss: 1.1365, test_f1: 0.3358
 epoch: 7, train_loss: 1.0735, test_loss: 1.2307, test_f1: 0.3169
 epoch: 8, train_loss: 1.0840, test_loss: 1.1106, test_f1: 0.3451
 epoch: 9, train_loss: 1.0849, test_loss: 1.0806, test_f1: 0.3422
 epoch: 10, train_loss: 1.0788, test_loss: 1.1284, test_f1: 0.3432
 epoch: 11, train_loss: 1.0897, test_loss: 1.1341, test_f1: 0.3432
 epoch: 12, train_loss: 1.0712, test_loss: 1.1527, test_f1: 0.3428
 epoch: 13, train_loss: 1.0687, test_loss: 1.2063, test_f1: 0.3526
 epoch: 14, train_loss: 1.0790, test_loss: 1.1408, test_f1: 0.3520
 epoch: 15, train_loss: 1.0653, test_loss: 1.1401, test_f1: 0.3539
 epoch: 16, train_loss: 1.0691, test_loss: 1.0810, test_f1: 0.3573
 epoch: 17, train_loss: 1.0698, test_loss: 1.1867, test_f1: 0.3503
 epoch: 18, train_loss: 1.0750, test_loss: 1.1164, test_f1: 0.3439
 epoch: 19, train_loss: 1.0712, test_loss: 1.1761, test_f1: 0.3897
 epoch: 20, train_loss: 1.0793, test_loss: 1.2822, test_f1: 0.2979
 epoch: 21, train_loss: 1.0659, test_loss: 1.1558, test_f1: 0.3571
 epoch: 22, train_loss: 1.0776, test_loss: 1.2733, test_f1: 0.2999
 epoch: 23, train_loss: 1.0872, test_loss: 1.2233, test_f1: 0.3555
 epoch: 24, train_loss: 1.0600, test_loss: 1.1865, test_f1: 0.4045
 epoch: 25, train_loss: 1.0621, test_loss: 1.2763, test_f1: 0.4218
 epoch: 26, train_loss: 1.0656, test_loss: 1.4538, test_f1: 0.4231
 epoch: 27, train_loss: 1.0495, test_loss: 1.1703, test_f1: 0.4222
 epoch: 28, train_loss: 1.0537, test_loss: 1.1150, test_f1: 0.4238
 epoch: 29, train_loss: 1.0525, test_loss: 1.1521, test_f1: 0.3907
 epoch: 30, train_loss: 1.0695, test_loss: 1.2450, test_f1: 0.3496
 epoch: 31, train_loss: 1.0702, test_loss: 1.0913, test_f1: 0.3720
 epoch: 32, train_loss: 1.0750, test_loss: 1.1306, test_f1: 0.4337
 epoch: 33, train_loss: 1.0635, test_loss: 1.2065, test_f1: 0.3730
 epoch: 34, train_loss: 1.0722, test_loss: 1.3017, test_f1: 0.4266
 epoch: 35, train_loss: 1.0663, test_loss: 1.2047, test_f1: 0.3453
 epoch: 36, train_loss: 1.0614, test_loss: 1.1167, test_f1: 0.3910
 epoch: 37, train_loss: 1.0503, test_loss: 1.2650, test_f1: 0.3972
 epoch: 38, train_loss: 1.0444, test_loss: 1.1691, test_f1: 0.4012
 epoch: 39, train_loss: 1.0570, test_loss: 1.2219, test_f1: 0.4361
 epoch: 40, train_loss: 1.0663, test_loss: 1.1428, test_f1: 0.3893
 epoch: 41, train_loss: 1.0624, test_loss: 1.2608, test_f1: 0.4579
 epoch: 42, train_loss: 1.0709, test_loss: 1.0871, test_f1: 0.3629
 epoch: 43, train_loss: 1.0564, test_loss: 1.0702, test_f1: 0.3772
 epoch: 44, train_loss: 1.0620, test_loss: 1.3302, test_f1: 0.4538
 epoch: 45, train_loss: 1.0536, test_loss: 1.5195, test_f1: 0.2959
 epoch: 46, train_loss: 1.0483, test_loss: 1.2876, test_f1: 0.4449
 epoch: 47, train_loss: 1.0450, test_loss: 1.2612, test_f1: 0.4705
 epoch: 48, train_loss: 1.0532, test_loss: 1.2251, test_f1: 0.4256
 epoch: 49, train_loss: 1.0398, test_loss: 1.0900, test_f1: 0.3948
 epoch: 50, train_loss: 1.0404, test_loss: 1.0810, test_f1: 0.3694
 epoch: 51, train_loss: 1.0414, test_loss: 1.2085, test_f1: 0.4565
 epoch: 52, train_loss: 1.0315, test_loss: 1.2009, test_f1: 0.4528
 epoch: 53, train_loss: 1.0353, test_loss: 1.4712, test_f1: 0.4223
 epoch: 54, train_loss: 1.0391, test_loss: 1.3067, test_f1: 0.4476
 epoch: 55, train_loss: 1.0394, test_loss: 1.1064, test_f1: 0.3609
 epoch: 56, train_loss: 1.0431, test_loss: 1.1791, test_f1: 0.4215
 epoch: 57, train_loss: 1.0297, test_loss: 1.1438, test_f1: 0.4209
 epoch: 58, train_loss: 1.0367, test_loss: 1.1310, test_f1: 0.4073
 epoch: 59, train_loss: 1.0353, test_loss: 1.2434, test_f1: 0.4526
 epoch: 60, train_loss: 1.0355, test_loss: 1.3510, test_f1: 0.4449
 epoch: 61, train_loss: 1.0329, test_loss: 1.1618, test_f1: 0.3763
 epoch: 62, train_loss: 1.0285, test_loss: 1.2514, test_f1: 0.4479
 epoch: 63, train_loss: 1.0324, test_loss: 1.2111, test_f1: 0.4423
 epoch: 64, train_loss: 1.0356, test_loss: 1.2640, test_f1: 0.4577
 epoch: 65, train_loss: 1.0325, test_loss: 1.1492, test_f1: 0.4487
 epoch: 66, train_loss: 1.0338, test_loss: 1.1496, test_f1: 0.4519
 epoch: 67, train_loss: 1.0398, test_loss: 1.2095, test_f1: 0.3968
 epoch: 68, train_loss: 1.0374, test_loss: 1.2650, test_f1: 0.4164
 epoch: 69, train_loss: 1.0290, test_loss: 1.1496, test_f1: 0.4084
 epoch: 70, train_loss: 1.0327, test_loss: 1.0989, test_f1: 0.4088
 epoch: 71, train_loss: 1.0457, test_loss: 1.1259, test_f1: 0.3989
 epoch: 72, train_loss: 1.0381, test_loss: 1.2185, test_f1: 0.4652
 epoch: 73, train_loss: 1.0351, test_loss: 1.2503, test_f1: 0.4532
 epoch: 74, train_loss: 1.0300, test_loss: 1.1560, test_f1: 0.4562
 epoch: 75, train_loss: 1.0280, test_loss: 1.1908, test_f1: 0.4498
 epoch: 76, train_loss: 1.0273, test_loss: 1.1706, test_f1: 0.4236
 epoch: 77, train_loss: 1.0305, test_loss: 1.2772, test_f1: 0.4144
 epoch: 78, train_loss: 1.0334, test_loss: 1.1930, test_f1: 0.3984
 epoch: 79, train_loss: 1.0377, test_loss: 1.2209, test_f1: 0.4144
 epoch: 80, train_loss: 1.0321, test_loss: 1.1878, test_f1: 0.4461
 epoch: 81, train_loss: 1.0316, test_loss: 1.1737, test_f1: 0.4026
 epoch: 82, train_loss: 1.0351, test_loss: 1.2082, test_f1: 0.4489
 epoch: 83, train_loss: 1.0271, test_loss: 1.1106, test_f1: 0.3695
 epoch: 84, train_loss: 1.0316, test_loss: 1.1999, test_f1: 0.4548
 epoch: 85, train_loss: 1.0215, test_loss: 1.2276, test_f1: 0.4161
 epoch: 86, train_loss: 1.0278, test_loss: 1.2238, test_f1: 0.4131
 epoch: 87, train_loss: 1.0270, test_loss: 1.3384, test_f1: 0.4326
 epoch: 88, train_loss: 1.0284, test_loss: 1.2076, test_f1: 0.4059
 epoch: 89, train_loss: 1.0334, test_loss: 1.2394, test_f1: 0.4057
 epoch: 90, train_loss: 1.0300, test_loss: 1.3703, test_f1: 0.4331
 epoch: 91, train_loss: 1.0312, test_loss: 1.1653, test_f1: 0.4498
 epoch: 92, train_loss: 1.0237, test_loss: 1.2121, test_f1: 0.4198
 epoch: 93, train_loss: 1.0206, test_loss: 1.4082, test_f1: 0.4341
 epoch: 94, train_loss: 1.0219, test_loss: 1.2415, test_f1: 0.4478
 epoch: 95, train_loss: 1.0456, test_loss: 1.3504, test_f1: 0.2791
 epoch: 96, train_loss: 1.0561, test_loss: 1.1578, test_f1: 0.3454
 epoch: 97, train_loss: 1.0438, test_loss: 1.3787, test_f1: 0.4430
 epoch: 98, train_loss: 1.0399, test_loss: 1.3873, test_f1: 0.4448
 epoch: 99, train_loss: 1.0373, test_loss: 1.2119, test_f1: 0.4561
##################ITERATION #6 ****************************************
 epoch: 0, train_loss: 1.2912, test_loss: 1.4019, test_f1: 0.2270
 epoch: 1, train_loss: 1.1548, test_loss: 1.3605, test_f1: 0.2270
 epoch: 2, train_loss: 1.1206, test_loss: 1.0826, test_f1: 0.3563
 epoch: 3, train_loss: 1.1104, test_loss: 1.1619, test_f1: 0.3403
 epoch: 4, train_loss: 1.1075, test_loss: 1.1569, test_f1: 0.3432
 epoch: 5, train_loss: 1.1086, test_loss: 1.3590, test_f1: 0.3189
 epoch: 6, train_loss: 1.0910, test_loss: 1.1213, test_f1: 0.3422
 epoch: 7, train_loss: 1.0909, test_loss: 1.1129, test_f1: 0.3432
 epoch: 8, train_loss: 1.0831, test_loss: 1.1249, test_f1: 0.3479
 epoch: 9, train_loss: 1.0730, test_loss: 1.1434, test_f1: 0.3394
 epoch: 10, train_loss: 1.0669, test_loss: 1.2104, test_f1: 0.3282
 epoch: 11, train_loss: 1.0655, test_loss: 1.2035, test_f1: 0.3393
 epoch: 12, train_loss: 1.0711, test_loss: 1.1195, test_f1: 0.3513
 epoch: 13, train_loss: 1.0692, test_loss: 1.1500, test_f1: 0.3432
 epoch: 14, train_loss: 1.0742, test_loss: 1.1038, test_f1: 0.3481
 epoch: 15, train_loss: 1.0901, test_loss: 1.1449, test_f1: 0.3515
 epoch: 16, train_loss: 1.0737, test_loss: 1.1802, test_f1: 0.3396
 epoch: 17, train_loss: 1.0780, test_loss: 1.1646, test_f1: 0.3450
 epoch: 18, train_loss: 1.0727, test_loss: 1.1880, test_f1: 0.3450
 epoch: 19, train_loss: 1.0741, test_loss: 1.1666, test_f1: 0.3486
 epoch: 20, train_loss: 1.0716, test_loss: 1.1465, test_f1: 0.3396
 epoch: 21, train_loss: 1.0678, test_loss: 1.2261, test_f1: 0.3337
 epoch: 22, train_loss: 1.0676, test_loss: 1.0683, test_f1: 0.3570
 epoch: 23, train_loss: 1.0678, test_loss: 1.1671, test_f1: 0.3450
 epoch: 24, train_loss: 1.0719, test_loss: 1.1564, test_f1: 0.3441
 epoch: 25, train_loss: 1.0585, test_loss: 1.2970, test_f1: 0.3308
 epoch: 26, train_loss: 1.0777, test_loss: 1.0855, test_f1: 0.3425
 epoch: 27, train_loss: 1.0656, test_loss: 1.1868, test_f1: 0.3402
 epoch: 28, train_loss: 1.0664, test_loss: 1.2044, test_f1: 0.3430
 epoch: 29, train_loss: 1.0682, test_loss: 1.2085, test_f1: 0.3345
 epoch: 30, train_loss: 1.0707, test_loss: 1.1194, test_f1: 0.3464
 epoch: 31, train_loss: 1.0631, test_loss: 1.0759, test_f1: 0.3563
 epoch: 32, train_loss: 1.0685, test_loss: 1.0725, test_f1: 0.3536
 epoch: 33, train_loss: 1.0636, test_loss: 1.2578, test_f1: 0.3441
 epoch: 34, train_loss: 1.0953, test_loss: 1.0760, test_f1: 0.3458
 epoch: 35, train_loss: 1.0762, test_loss: 1.0952, test_f1: 0.3307
 epoch: 36, train_loss: 1.0604, test_loss: 1.2693, test_f1: 0.3433
 epoch: 37, train_loss: 1.0694, test_loss: 1.1962, test_f1: 0.3506
 epoch: 38, train_loss: 1.0642, test_loss: 1.2203, test_f1: 0.3441
 epoch: 39, train_loss: 1.0651, test_loss: 1.0862, test_f1: 0.3554
 epoch: 40, train_loss: 1.0596, test_loss: 1.2757, test_f1: 0.3432
 epoch: 41, train_loss: 1.0689, test_loss: 1.2151, test_f1: 0.3432
 epoch: 42, train_loss: 1.0666, test_loss: 1.2516, test_f1: 0.3469
 epoch: 43, train_loss: 1.0658, test_loss: 1.1014, test_f1: 0.3505
 epoch: 44, train_loss: 1.0641, test_loss: 1.1130, test_f1: 0.3426
 epoch: 45, train_loss: 1.0594, test_loss: 1.0883, test_f1: 0.3521
 epoch: 46, train_loss: 1.0587, test_loss: 1.2820, test_f1: 0.3405
 epoch: 47, train_loss: 1.0774, test_loss: 1.1128, test_f1: 0.3471
 epoch: 48, train_loss: 1.0764, test_loss: 1.0826, test_f1: 0.3422
 epoch: 49, train_loss: 1.0679, test_loss: 1.2164, test_f1: 0.3452
 epoch: 50, train_loss: 1.0668, test_loss: 1.2603, test_f1: 0.3448
 epoch: 51, train_loss: 1.0659, test_loss: 1.1854, test_f1: 0.3495
 epoch: 52, train_loss: 1.0591, test_loss: 1.1963, test_f1: 0.3444
 epoch: 53, train_loss: 1.0587, test_loss: 1.3289, test_f1: 0.3352
 epoch: 54, train_loss: 1.0604, test_loss: 1.1914, test_f1: 0.3465
 epoch: 55, train_loss: 1.0573, test_loss: 1.4706, test_f1: 0.3438
 epoch: 56, train_loss: 1.0551, test_loss: 1.5065, test_f1: 0.3387
 epoch: 57, train_loss: 1.0567, test_loss: 1.4581, test_f1: 0.3375
 epoch: 58, train_loss: 1.0608, test_loss: 1.0598, test_f1: 0.3474
 epoch: 59, train_loss: 1.0597, test_loss: 1.0550, test_f1: 0.3571
 epoch: 60, train_loss: 1.0524, test_loss: 1.0522, test_f1: 0.3582
 epoch: 61, train_loss: 1.0578, test_loss: 1.0436, test_f1: 0.3631
 epoch: 62, train_loss: 1.0453, test_loss: 1.2340, test_f1: 0.3441
 epoch: 63, train_loss: 1.0544, test_loss: 1.0986, test_f1: 0.3553
 epoch: 64, train_loss: 1.0488, test_loss: 1.4666, test_f1: 0.3448
 epoch: 65, train_loss: 1.0451, test_loss: 1.1544, test_f1: 0.3441
 epoch: 66, train_loss: 1.0465, test_loss: 1.3221, test_f1: 0.3591
 epoch: 67, train_loss: 1.0376, test_loss: 1.0810, test_f1: 0.3443
 epoch: 68, train_loss: 1.0405, test_loss: 1.4927, test_f1: 0.3490
 epoch: 69, train_loss: 1.0438, test_loss: 1.4704, test_f1: 0.3501
 epoch: 70, train_loss: 1.0437, test_loss: 1.1457, test_f1: 0.3460
 epoch: 71, train_loss: 1.0418, test_loss: 1.0422, test_f1: 0.3598
 epoch: 72, train_loss: 1.0440, test_loss: 1.5038, test_f1: 0.3472
 epoch: 73, train_loss: 1.0376, test_loss: 1.4778, test_f1: 0.3297
 epoch: 74, train_loss: 1.0415, test_loss: 1.0478, test_f1: 0.3603
 epoch: 75, train_loss: 1.0409, test_loss: 1.0319, test_f1: 0.3576
 epoch: 76, train_loss: 1.0397, test_loss: 1.6594, test_f1: 0.3267
 epoch: 77, train_loss: 1.0351, test_loss: 1.0972, test_f1: 0.3441
 epoch: 78, train_loss: 1.0434, test_loss: 1.0516, test_f1: 0.3453
 epoch: 79, train_loss: 1.0364, test_loss: 1.0802, test_f1: 0.3432
 epoch: 80, train_loss: 1.0383, test_loss: 1.3249, test_f1: 0.3485
 epoch: 81, train_loss: 1.0399, test_loss: 1.4255, test_f1: 0.3244
 epoch: 82, train_loss: 1.0372, test_loss: 1.3212, test_f1: 0.3410
 epoch: 83, train_loss: 1.0334, test_loss: 1.3513, test_f1: 0.3462
 epoch: 84, train_loss: 1.0271, test_loss: 1.2995, test_f1: 0.3467
 epoch: 85, train_loss: 1.0329, test_loss: 1.0296, test_f1: 0.3610
 epoch: 86, train_loss: 1.0295, test_loss: 1.0610, test_f1: 0.3410
 epoch: 87, train_loss: 1.0296, test_loss: 1.1489, test_f1: 0.3467
 epoch: 88, train_loss: 1.0349, test_loss: 1.1001, test_f1: 0.3413
 epoch: 89, train_loss: 1.0275, test_loss: 1.0430, test_f1: 0.3534
 epoch: 90, train_loss: 1.0296, test_loss: 1.0737, test_f1: 0.3457
 epoch: 91, train_loss: 1.0332, test_loss: 1.2880, test_f1: 0.3375
 epoch: 92, train_loss: 1.0243, test_loss: 1.5883, test_f1: 0.3426
 epoch: 93, train_loss: 1.0256, test_loss: 1.0572, test_f1: 0.3599
 epoch: 94, train_loss: 1.0207, test_loss: 1.1596, test_f1: 0.3424
 epoch: 95, train_loss: 1.0240, test_loss: 1.0637, test_f1: 0.3579
 epoch: 96, train_loss: 1.0368, test_loss: 1.0819, test_f1: 0.3432
 epoch: 97, train_loss: 1.0382, test_loss: 1.2621, test_f1: 0.3400
 epoch: 98, train_loss: 1.0347, test_loss: 1.1878, test_f1: 0.3404
 epoch: 99, train_loss: 1.0313, test_loss: 1.1508, test_f1: 0.3495
##################ITERATION #7 ****************************************
 epoch: 0, train_loss: 1.3607, test_loss: 1.4850, test_f1: 0.2270
 epoch: 1, train_loss: 1.2314, test_loss: 1.4174, test_f1: 0.2271
 epoch: 2, train_loss: 1.1805, test_loss: 1.3263, test_f1: 0.2611
 epoch: 3, train_loss: 1.1391, test_loss: 1.1238, test_f1: 0.3502
 epoch: 4, train_loss: 1.1170, test_loss: 1.1737, test_f1: 0.3262
 epoch: 5, train_loss: 1.1092, test_loss: 1.1572, test_f1: 0.3422
 epoch: 6, train_loss: 1.1098, test_loss: 1.0805, test_f1: 0.3560
 epoch: 7, train_loss: 1.1074, test_loss: 1.1338, test_f1: 0.3413
 epoch: 8, train_loss: 1.1051, test_loss: 1.1470, test_f1: 0.3413
 epoch: 9, train_loss: 1.1091, test_loss: 1.1161, test_f1: 0.3403
 epoch: 10, train_loss: 1.0997, test_loss: 1.1260, test_f1: 0.3422
 epoch: 11, train_loss: 1.0917, test_loss: 1.1468, test_f1: 0.3432
 epoch: 12, train_loss: 1.0815, test_loss: 1.1452, test_f1: 0.3427
 epoch: 13, train_loss: 1.0907, test_loss: 1.1383, test_f1: 0.3515
 epoch: 14, train_loss: 1.0957, test_loss: 1.2700, test_f1: 0.3261
 epoch: 15, train_loss: 1.1067, test_loss: 1.2185, test_f1: 0.3059
 epoch: 16, train_loss: 1.0992, test_loss: 1.0714, test_f1: 0.3563
 epoch: 17, train_loss: 1.1025, test_loss: 1.1047, test_f1: 0.3422
 epoch: 18, train_loss: 1.0814, test_loss: 1.1755, test_f1: 0.3284
 epoch: 19, train_loss: 1.0810, test_loss: 1.1552, test_f1: 0.3484
 epoch: 20, train_loss: 1.0770, test_loss: 1.1507, test_f1: 0.3440
 epoch: 21, train_loss: 1.0823, test_loss: 1.1714, test_f1: 0.3413
 epoch: 22, train_loss: 1.0783, test_loss: 1.1559, test_f1: 0.3469
 epoch: 23, train_loss: 1.0738, test_loss: 1.1515, test_f1: 0.3432
 epoch: 24, train_loss: 1.0681, test_loss: 1.1856, test_f1: 0.3296
 epoch: 25, train_loss: 1.0657, test_loss: 1.1679, test_f1: 0.3455
 epoch: 26, train_loss: 1.0734, test_loss: 1.1465, test_f1: 0.3515
 epoch: 27, train_loss: 1.0747, test_loss: 1.2123, test_f1: 0.3302
 epoch: 28, train_loss: 1.0686, test_loss: 1.1564, test_f1: 0.3479
 epoch: 29, train_loss: 1.0730, test_loss: 1.1733, test_f1: 0.3403
 epoch: 30, train_loss: 1.1122, test_loss: 1.1449, test_f1: 0.3384
 epoch: 31, train_loss: 1.0907, test_loss: 1.1897, test_f1: 0.3432
 epoch: 32, train_loss: 1.0689, test_loss: 1.1863, test_f1: 0.3422
 epoch: 33, train_loss: 1.0740, test_loss: 1.1834, test_f1: 0.3411
 epoch: 34, train_loss: 1.0784, test_loss: 1.1775, test_f1: 0.3425
 epoch: 35, train_loss: 1.0677, test_loss: 1.1931, test_f1: 0.3253
 epoch: 36, train_loss: 1.0606, test_loss: 1.1731, test_f1: 0.3510
 epoch: 37, train_loss: 1.0677, test_loss: 1.2098, test_f1: 0.3430
 epoch: 38, train_loss: 1.0721, test_loss: 1.2076, test_f1: 0.3170
 epoch: 39, train_loss: 1.0608, test_loss: 1.2353, test_f1: 0.3178
 epoch: 40, train_loss: 1.0652, test_loss: 1.1731, test_f1: 0.3515
 epoch: 41, train_loss: 1.0643, test_loss: 1.1979, test_f1: 0.3306
 epoch: 42, train_loss: 1.0666, test_loss: 1.1546, test_f1: 0.3422
 epoch: 43, train_loss: 1.0747, test_loss: 1.0788, test_f1: 0.3560
 epoch: 44, train_loss: 1.0603, test_loss: 1.1795, test_f1: 0.3441
 epoch: 45, train_loss: 1.0581, test_loss: 1.2399, test_f1: 0.3212
 epoch: 46, train_loss: 1.0590, test_loss: 1.1470, test_f1: 0.3484
 epoch: 47, train_loss: 1.0579, test_loss: 1.1779, test_f1: 0.3439
 epoch: 48, train_loss: 1.0769, test_loss: 1.1667, test_f1: 0.3460
 epoch: 49, train_loss: 1.0661, test_loss: 1.1045, test_f1: 0.3432
 epoch: 50, train_loss: 1.0628, test_loss: 1.2469, test_f1: 0.3188
 epoch: 51, train_loss: 1.0652, test_loss: 1.2541, test_f1: 0.3154
 epoch: 52, train_loss: 1.0600, test_loss: 1.1636, test_f1: 0.3490
 epoch: 53, train_loss: 1.0564, test_loss: 1.1754, test_f1: 0.3471
 epoch: 54, train_loss: 1.0591, test_loss: 1.1512, test_f1: 0.3497
 epoch: 55, train_loss: 1.0607, test_loss: 1.1718, test_f1: 0.3394
 epoch: 56, train_loss: 1.0588, test_loss: 1.1648, test_f1: 0.3481
 epoch: 57, train_loss: 1.0576, test_loss: 1.0847, test_f1: 0.3441
 epoch: 58, train_loss: 1.0565, test_loss: 1.1025, test_f1: 0.3427
 epoch: 59, train_loss: 1.0556, test_loss: 1.1403, test_f1: 0.3471
 epoch: 60, train_loss: 1.0670, test_loss: 1.0997, test_f1: 0.3432
 epoch: 61, train_loss: 1.0561, test_loss: 1.1602, test_f1: 0.3504
 epoch: 62, train_loss: 1.0512, test_loss: 1.1703, test_f1: 0.3514
 epoch: 63, train_loss: 1.0573, test_loss: 1.1648, test_f1: 0.3504
 epoch: 64, train_loss: 1.0679, test_loss: 1.1308, test_f1: 0.3458
 epoch: 65, train_loss: 1.0761, test_loss: 1.1448, test_f1: 0.3441
 epoch: 66, train_loss: 1.0579, test_loss: 1.1867, test_f1: 0.3464
 epoch: 67, train_loss: 1.0511, test_loss: 1.2040, test_f1: 0.3426
 epoch: 68, train_loss: 1.0466, test_loss: 1.1934, test_f1: 0.3418
 epoch: 69, train_loss: 1.0472, test_loss: 1.1628, test_f1: 0.3451
 epoch: 70, train_loss: 1.0453, test_loss: 1.1846, test_f1: 0.3462
 epoch: 71, train_loss: 1.0548, test_loss: 1.1591, test_f1: 0.3504
 epoch: 72, train_loss: 1.0479, test_loss: 1.1505, test_f1: 0.3488
 epoch: 73, train_loss: 1.0514, test_loss: 1.1763, test_f1: 0.3489
 epoch: 74, train_loss: 1.0452, test_loss: 1.1305, test_f1: 0.3429
 epoch: 75, train_loss: 1.0454, test_loss: 1.1950, test_f1: 0.3400
 epoch: 76, train_loss: 1.0442, test_loss: 1.1616, test_f1: 0.3501
 epoch: 77, train_loss: 1.0479, test_loss: 1.1093, test_f1: 0.3432
 epoch: 78, train_loss: 1.0479, test_loss: 1.1909, test_f1: 0.3400
 epoch: 79, train_loss: 1.0493, test_loss: 1.1650, test_f1: 0.3484
 epoch: 80, train_loss: 1.0448, test_loss: 1.2910, test_f1: 0.3186
 epoch: 81, train_loss: 1.0483, test_loss: 1.2085, test_f1: 0.3338
 epoch: 82, train_loss: 1.0503, test_loss: 1.1426, test_f1: 0.3435
 epoch: 83, train_loss: 1.0563, test_loss: 1.1810, test_f1: 0.3420
 epoch: 84, train_loss: 1.0576, test_loss: 1.1726, test_f1: 0.3390
 epoch: 85, train_loss: 1.0529, test_loss: 1.1712, test_f1: 0.3422
 epoch: 86, train_loss: 1.0523, test_loss: 1.1845, test_f1: 0.3293
 epoch: 87, train_loss: 1.0493, test_loss: 1.1646, test_f1: 0.3504
 epoch: 88, train_loss: 1.0531, test_loss: 1.2147, test_f1: 0.3257
 epoch: 89, train_loss: 1.0519, test_loss: 1.1930, test_f1: 0.3252
 epoch: 90, train_loss: 1.0467, test_loss: 1.1841, test_f1: 0.3446
 epoch: 91, train_loss: 1.0517, test_loss: 1.1500, test_f1: 0.3467
 epoch: 92, train_loss: 1.0505, test_loss: 1.2087, test_f1: 0.3244
 epoch: 93, train_loss: 1.0619, test_loss: 1.0876, test_f1: 0.3573
 epoch: 94, train_loss: 1.0610, test_loss: 1.0831, test_f1: 0.3422
 epoch: 95, train_loss: 1.0556, test_loss: 1.1716, test_f1: 0.3504
 epoch: 96, train_loss: 1.0596, test_loss: 1.1391, test_f1: 0.3393
 epoch: 97, train_loss: 1.0562, test_loss: 1.1381, test_f1: 0.3492
 epoch: 98, train_loss: 1.0516, test_loss: 1.1339, test_f1: 0.3504
 epoch: 99, train_loss: 1.0565, test_loss: 1.1663, test_f1: 0.3498
##################ITERATION #8 ****************************************
 epoch: 0, train_loss: 1.3433, test_loss: 1.4327, test_f1: 0.2270
 epoch: 1, train_loss: 1.2013, test_loss: 1.3416, test_f1: 0.2270
 epoch: 2, train_loss: 1.1557, test_loss: 1.3658, test_f1: 0.2270
 epoch: 3, train_loss: 1.1300, test_loss: 1.2563, test_f1: 0.2819
 epoch: 4, train_loss: 1.1026, test_loss: 1.1175, test_f1: 0.3471
 epoch: 5, train_loss: 1.0972, test_loss: 1.2417, test_f1: 0.3261
 epoch: 6, train_loss: 1.0983, test_loss: 1.1082, test_f1: 0.3432
 epoch: 7, train_loss: 1.1063, test_loss: 1.1246, test_f1: 0.3451
 epoch: 8, train_loss: 1.0929, test_loss: 1.1408, test_f1: 0.3422
 epoch: 9, train_loss: 1.1009, test_loss: 1.1562, test_f1: 0.3432
 epoch: 10, train_loss: 1.0888, test_loss: 1.1544, test_f1: 0.3427
 epoch: 11, train_loss: 1.0859, test_loss: 1.1497, test_f1: 0.3413
 epoch: 12, train_loss: 1.0785, test_loss: 1.0966, test_f1: 0.3481
 epoch: 13, train_loss: 1.0843, test_loss: 1.1306, test_f1: 0.3469
 epoch: 14, train_loss: 1.0939, test_loss: 1.1030, test_f1: 0.3432
 epoch: 15, train_loss: 1.0977, test_loss: 1.1164, test_f1: 0.3469
 epoch: 16, train_loss: 1.0971, test_loss: 1.0991, test_f1: 0.3403
 epoch: 17, train_loss: 1.0867, test_loss: 1.1715, test_f1: 0.3422
 epoch: 18, train_loss: 1.0847, test_loss: 1.3485, test_f1: 0.3135
 epoch: 19, train_loss: 1.0956, test_loss: 1.1064, test_f1: 0.3432
 epoch: 20, train_loss: 1.0798, test_loss: 1.1367, test_f1: 0.3488
 epoch: 21, train_loss: 1.0778, test_loss: 1.3476, test_f1: 0.3128
 epoch: 22, train_loss: 1.0723, test_loss: 1.1870, test_f1: 0.3381
 epoch: 23, train_loss: 1.0763, test_loss: 1.0551, test_f1: 0.3612
 epoch: 24, train_loss: 1.0765, test_loss: 1.1133, test_f1: 0.3471
 epoch: 25, train_loss: 1.0781, test_loss: 1.1485, test_f1: 0.3472
 epoch: 26, train_loss: 1.0620, test_loss: 1.1334, test_f1: 0.3493
 epoch: 27, train_loss: 1.0598, test_loss: 1.1378, test_f1: 0.3501
 epoch: 28, train_loss: 1.0641, test_loss: 1.1368, test_f1: 0.3515
 epoch: 29, train_loss: 1.0672, test_loss: 1.1404, test_f1: 0.3497
 epoch: 30, train_loss: 1.0806, test_loss: 1.4172, test_f1: 0.2972
 epoch: 31, train_loss: 1.0798, test_loss: 1.1432, test_f1: 0.3466
 epoch: 32, train_loss: 1.0667, test_loss: 1.1679, test_f1: 0.3432
 epoch: 33, train_loss: 1.0611, test_loss: 1.1414, test_f1: 0.3494
 epoch: 34, train_loss: 1.0810, test_loss: 1.0758, test_f1: 0.3533
 epoch: 35, train_loss: 1.1038, test_loss: 1.1671, test_f1: 0.3441
 epoch: 36, train_loss: 1.0903, test_loss: 1.1391, test_f1: 0.3359
 epoch: 37, train_loss: 1.1057, test_loss: 1.1858, test_f1: 0.3422
 epoch: 38, train_loss: 1.1005, test_loss: 1.0964, test_f1: 0.3492
 epoch: 39, train_loss: 1.1065, test_loss: 1.1922, test_f1: 0.3422
 epoch: 40, train_loss: 1.1017, test_loss: 1.1581, test_f1: 0.3479
 epoch: 41, train_loss: 1.0821, test_loss: 1.1444, test_f1: 0.3510
 epoch: 42, train_loss: 1.0728, test_loss: 1.1632, test_f1: 0.3432
 epoch: 43, train_loss: 1.0769, test_loss: 1.1809, test_f1: 0.3433
 epoch: 44, train_loss: 1.0801, test_loss: 1.1893, test_f1: 0.3393
 epoch: 45, train_loss: 1.0726, test_loss: 1.2887, test_f1: 0.3201
 epoch: 46, train_loss: 1.0802, test_loss: 1.1823, test_f1: 0.3432
 epoch: 47, train_loss: 1.0860, test_loss: 1.0747, test_f1: 0.3553
 epoch: 48, train_loss: 1.1002, test_loss: 1.1944, test_f1: 0.3422
 epoch: 49, train_loss: 1.0907, test_loss: 1.1921, test_f1: 0.3422
 epoch: 50, train_loss: 1.0957, test_loss: 1.0787, test_f1: 0.3553
 epoch: 51, train_loss: 1.1039, test_loss: 1.1061, test_f1: 0.3422
 epoch: 52, train_loss: 1.0925, test_loss: 1.1578, test_f1: 0.3488
 epoch: 53, train_loss: 1.0764, test_loss: 1.1525, test_f1: 0.3460
 epoch: 54, train_loss: 1.0682, test_loss: 1.3590, test_f1: 0.3181
 epoch: 55, train_loss: 1.0738, test_loss: 1.1363, test_f1: 0.3492
 epoch: 56, train_loss: 1.0625, test_loss: 1.1652, test_f1: 0.3383
 epoch: 57, train_loss: 1.0692, test_loss: 1.1572, test_f1: 0.3402
 epoch: 58, train_loss: 1.0578, test_loss: 1.1294, test_f1: 0.3504
 epoch: 59, train_loss: 1.0634, test_loss: 1.1365, test_f1: 0.3510
 epoch: 60, train_loss: 1.0611, test_loss: 1.1490, test_f1: 0.3460
 epoch: 61, train_loss: 1.0566, test_loss: 1.1668, test_f1: 0.3420
 epoch: 62, train_loss: 1.0571, test_loss: 1.1602, test_f1: 0.3413
 epoch: 63, train_loss: 1.0518, test_loss: 1.1403, test_f1: 0.3504
 epoch: 64, train_loss: 1.0555, test_loss: 1.1526, test_f1: 0.3479
 epoch: 65, train_loss: 1.0536, test_loss: 1.1479, test_f1: 0.3485
 epoch: 66, train_loss: 1.0608, test_loss: 1.1676, test_f1: 0.3441
 epoch: 67, train_loss: 1.0602, test_loss: 1.1408, test_f1: 0.3497
 epoch: 68, train_loss: 1.0536, test_loss: 1.1744, test_f1: 0.3401
 epoch: 69, train_loss: 1.0562, test_loss: 1.1581, test_f1: 0.3460
 epoch: 70, train_loss: 1.0675, test_loss: 1.2130, test_f1: 0.3350
 epoch: 71, train_loss: 1.0560, test_loss: 1.0621, test_f1: 0.3589
 epoch: 72, train_loss: 1.0582, test_loss: 1.1425, test_f1: 0.3503
 epoch: 73, train_loss: 1.0591, test_loss: 1.1482, test_f1: 0.3456
 epoch: 74, train_loss: 1.0545, test_loss: 1.1663, test_f1: 0.3415
 epoch: 75, train_loss: 1.0498, test_loss: 1.1652, test_f1: 0.3443
 epoch: 76, train_loss: 1.0517, test_loss: 1.1455, test_f1: 0.3494
 epoch: 77, train_loss: 1.0564, test_loss: 1.1545, test_f1: 0.3488
 epoch: 78, train_loss: 1.0606, test_loss: 1.1931, test_f1: 0.3412
 epoch: 79, train_loss: 1.0496, test_loss: 1.1513, test_f1: 0.3467
 epoch: 80, train_loss: 1.0498, test_loss: 1.1488, test_f1: 0.3488
 epoch: 81, train_loss: 1.0538, test_loss: 1.1442, test_f1: 0.3495
 epoch: 82, train_loss: 1.0516, test_loss: 1.1443, test_f1: 0.3512
 epoch: 83, train_loss: 1.0535, test_loss: 1.1647, test_f1: 0.3460
 epoch: 84, train_loss: 1.0500, test_loss: 1.1935, test_f1: 0.3403
 epoch: 85, train_loss: 1.0498, test_loss: 1.1541, test_f1: 0.3488
 epoch: 86, train_loss: 1.0482, test_loss: 1.1577, test_f1: 0.3479
 epoch: 87, train_loss: 1.0513, test_loss: 1.1536, test_f1: 0.3509
 epoch: 88, train_loss: 1.0456, test_loss: 1.1671, test_f1: 0.3464
 epoch: 89, train_loss: 1.0618, test_loss: 1.1936, test_f1: 0.3417
 epoch: 90, train_loss: 1.0503, test_loss: 1.1634, test_f1: 0.3452
 epoch: 91, train_loss: 1.0491, test_loss: 1.1461, test_f1: 0.3503
 epoch: 92, train_loss: 1.0467, test_loss: 1.1574, test_f1: 0.3488
 epoch: 93, train_loss: 1.0564, test_loss: 1.1748, test_f1: 0.3441
 epoch: 94, train_loss: 1.0581, test_loss: 1.2322, test_f1: 0.3379
 epoch: 95, train_loss: 1.0601, test_loss: 1.1440, test_f1: 0.3432
 epoch: 96, train_loss: 1.0583, test_loss: 1.1476, test_f1: 0.3476
 epoch: 97, train_loss: 1.0657, test_loss: 1.3035, test_f1: 0.2780
 epoch: 98, train_loss: 1.0821, test_loss: 1.1545, test_f1: 0.3441
 epoch: 99, train_loss: 1.0864, test_loss: 1.1738, test_f1: 0.3346
##################ITERATION #9 ****************************************
 epoch: 0, train_loss: 1.5616, test_loss: 1.3995, test_f1: 0.2270
 epoch: 1, train_loss: 1.3701, test_loss: 1.3486, test_f1: 0.2270
 epoch: 2, train_loss: 1.3217, test_loss: 1.3184, test_f1: 0.2270
 epoch: 3, train_loss: 1.3043, test_loss: 1.3161, test_f1: 0.2270
 epoch: 4, train_loss: 1.3022, test_loss: 1.3159, test_f1: 0.2270
 epoch: 5, train_loss: 1.3018, test_loss: 1.3160, test_f1: 0.2270
 epoch: 6, train_loss: 1.3018, test_loss: 1.3149, test_f1: 0.2270
 epoch: 7, train_loss: 1.3021, test_loss: 1.3154, test_f1: 0.2270
 epoch: 8, train_loss: 1.3020, test_loss: 1.3146, test_f1: 0.2270
 epoch: 9, train_loss: 1.3017, test_loss: 1.3166, test_f1: 0.2270
 epoch: 10, train_loss: 1.3016, test_loss: 1.3146, test_f1: 0.2270
 epoch: 11, train_loss: 1.3018, test_loss: 1.3144, test_f1: 0.2270
 epoch: 12, train_loss: 1.3016, test_loss: 1.3146, test_f1: 0.2270
 epoch: 13, train_loss: 1.3017, test_loss: 1.3149, test_f1: 0.2270
 epoch: 14, train_loss: 1.3018, test_loss: 1.3159, test_f1: 0.2270
 epoch: 15, train_loss: 1.3024, test_loss: 1.3152, test_f1: 0.2270
 epoch: 16, train_loss: 1.3025, test_loss: 1.3148, test_f1: 0.2270
 epoch: 17, train_loss: 1.3027, test_loss: 1.3163, test_f1: 0.2270
 epoch: 18, train_loss: 1.3028, test_loss: 1.3141, test_f1: 0.2270
 epoch: 19, train_loss: 1.3018, test_loss: 1.3170, test_f1: 0.2270
 epoch: 20, train_loss: 1.3015, test_loss: 1.3142, test_f1: 0.2270
 epoch: 21, train_loss: 1.3029, test_loss: 1.3152, test_f1: 0.2270
 epoch: 22, train_loss: 1.3015, test_loss: 1.3153, test_f1: 0.2270
 epoch: 23, train_loss: 1.3016, test_loss: 1.3147, test_f1: 0.2270
 epoch: 24, train_loss: 1.3022, test_loss: 1.3157, test_f1: 0.2270
 epoch: 25, train_loss: 1.3017, test_loss: 1.3151, test_f1: 0.2270
 epoch: 26, train_loss: 1.3020, test_loss: 1.3151, test_f1: 0.2270
 epoch: 27, train_loss: 1.3019, test_loss: 1.3153, test_f1: 0.2270
 epoch: 28, train_loss: 1.3034, test_loss: 1.3148, test_f1: 0.2270
 epoch: 29, train_loss: 1.3028, test_loss: 1.3148, test_f1: 0.2270
 epoch: 30, train_loss: 1.3015, test_loss: 1.3154, test_f1: 0.2270
 epoch: 31, train_loss: 1.3023, test_loss: 1.3166, test_f1: 0.2270
 epoch: 32, train_loss: 1.3021, test_loss: 1.3149, test_f1: 0.2270
 epoch: 33, train_loss: 1.3016, test_loss: 1.3148, test_f1: 0.2270
 epoch: 34, train_loss: 1.3017, test_loss: 1.3155, test_f1: 0.2270
 epoch: 35, train_loss: 1.3023, test_loss: 1.3150, test_f1: 0.2270
 epoch: 36, train_loss: 1.3018, test_loss: 1.3140, test_f1: 0.2270
 epoch: 37, train_loss: 1.3016, test_loss: 1.3161, test_f1: 0.2270
 epoch: 38, train_loss: 1.3019, test_loss: 1.3148, test_f1: 0.2270
 epoch: 39, train_loss: 1.3018, test_loss: 1.3142, test_f1: 0.2270
 epoch: 40, train_loss: 1.3017, test_loss: 1.3161, test_f1: 0.2270
 epoch: 41, train_loss: 1.3017, test_loss: 1.3161, test_f1: 0.2270
 epoch: 42, train_loss: 1.3020, test_loss: 1.3153, test_f1: 0.2270
 epoch: 43, train_loss: 1.3016, test_loss: 1.3150, test_f1: 0.2270
 epoch: 44, train_loss: 1.3022, test_loss: 1.3155, test_f1: 0.2270
 epoch: 45, train_loss: 1.3019, test_loss: 1.3150, test_f1: 0.2270
 epoch: 46, train_loss: 1.3017, test_loss: 1.3168, test_f1: 0.2270
 epoch: 47, train_loss: 1.3018, test_loss: 1.3136, test_f1: 0.2270
 epoch: 48, train_loss: 1.3019, test_loss: 1.3163, test_f1: 0.2270
 epoch: 49, train_loss: 1.3038, test_loss: 1.3141, test_f1: 0.2270
 epoch: 50, train_loss: 1.3026, test_loss: 1.3159, test_f1: 0.2270
 epoch: 51, train_loss: 1.3014, test_loss: 1.3154, test_f1: 0.2270
 epoch: 52, train_loss: 1.3017, test_loss: 1.3145, test_f1: 0.2270
 epoch: 53, train_loss: 1.3014, test_loss: 1.3156, test_f1: 0.2270
 epoch: 54, train_loss: 1.3023, test_loss: 1.3150, test_f1: 0.2270
 epoch: 55, train_loss: 1.3023, test_loss: 1.3152, test_f1: 0.2270
 epoch: 56, train_loss: 1.3022, test_loss: 1.3158, test_f1: 0.2270
 epoch: 57, train_loss: 1.3017, test_loss: 1.3148, test_f1: 0.2270
 epoch: 58, train_loss: 1.3016, test_loss: 1.3153, test_f1: 0.2270
 epoch: 59, train_loss: 1.3014, test_loss: 1.3149, test_f1: 0.2270
 epoch: 60, train_loss: 1.3023, test_loss: 1.3146, test_f1: 0.2270
 epoch: 61, train_loss: 1.3014, test_loss: 1.3152, test_f1: 0.2270
 epoch: 62, train_loss: 1.3016, test_loss: 1.3156, test_f1: 0.2270
 epoch: 63, train_loss: 1.3015, test_loss: 1.3144, test_f1: 0.2270
 epoch: 64, train_loss: 1.3018, test_loss: 1.3150, test_f1: 0.2270
 epoch: 65, train_loss: 1.3016, test_loss: 1.3149, test_f1: 0.2270
 epoch: 66, train_loss: 1.3016, test_loss: 1.3147, test_f1: 0.2270
 epoch: 67, train_loss: 1.3018, test_loss: 1.3155, test_f1: 0.2270
 epoch: 68, train_loss: 1.3021, test_loss: 1.3141, test_f1: 0.2270
 epoch: 69, train_loss: 1.3018, test_loss: 1.3161, test_f1: 0.2270
 epoch: 70, train_loss: 1.3014, test_loss: 1.3153, test_f1: 0.2270
 epoch: 71, train_loss: 1.3019, test_loss: 1.3144, test_f1: 0.2270
 epoch: 72, train_loss: 1.3014, test_loss: 1.3151, test_f1: 0.2270
 epoch: 73, train_loss: 1.3018, test_loss: 1.3152, test_f1: 0.2270
 epoch: 74, train_loss: 1.3017, test_loss: 1.3155, test_f1: 0.2270
 epoch: 75, train_loss: 1.3015, test_loss: 1.3149, test_f1: 0.2270
 epoch: 76, train_loss: 1.3016, test_loss: 1.3151, test_f1: 0.2270
 epoch: 77, train_loss: 1.3016, test_loss: 1.3157, test_f1: 0.2270
 epoch: 78, train_loss: 1.3018, test_loss: 1.3142, test_f1: 0.2270
 epoch: 79, train_loss: 1.3014, test_loss: 1.3159, test_f1: 0.2270
 epoch: 80, train_loss: 1.3014, test_loss: 1.3149, test_f1: 0.2270
 epoch: 81, train_loss: 1.3015, test_loss: 1.3154, test_f1: 0.2270
 epoch: 82, train_loss: 1.3022, test_loss: 1.3160, test_f1: 0.2270
 epoch: 83, train_loss: 1.3016, test_loss: 1.3143, test_f1: 0.2270
 epoch: 84, train_loss: 1.3016, test_loss: 1.3153, test_f1: 0.2270
 epoch: 85, train_loss: 1.3014, test_loss: 1.3151, test_f1: 0.2270
 epoch: 86, train_loss: 1.3014, test_loss: 1.3151, test_f1: 0.2270
 epoch: 87, train_loss: 1.3020, test_loss: 1.3157, test_f1: 0.2270
 epoch: 88, train_loss: 1.3019, test_loss: 1.3148, test_f1: 0.2270
 epoch: 89, train_loss: 1.3018, test_loss: 1.3158, test_f1: 0.2270
 epoch: 90, train_loss: 1.3016, test_loss: 1.3145, test_f1: 0.2270
 epoch: 91, train_loss: 1.3017, test_loss: 1.3146, test_f1: 0.2270
 epoch: 92, train_loss: 1.3015, test_loss: 1.3164, test_f1: 0.2270
 epoch: 93, train_loss: 1.3013, test_loss: 1.3146, test_f1: 0.2270
 epoch: 94, train_loss: 1.3015, test_loss: 1.3141, test_f1: 0.2270
 epoch: 95, train_loss: 1.3018, test_loss: 1.3157, test_f1: 0.2270
 epoch: 96, train_loss: 1.3017, test_loss: 1.3147, test_f1: 0.2270
 epoch: 97, train_loss: 1.3012, test_loss: 1.3151, test_f1: 0.2270
 epoch: 98, train_loss: 1.3017, test_loss: 1.3147, test_f1: 0.2270
 epoch: 99, train_loss: 1.3016, test_loss: 1.3150, test_f1: 0.2270

Training completed in 405.05 seconds
Best F1: 0.5041 at epoch 93
Mean F1 across iterations: 0.4079  0.0841
========================FINAL RESULTS================================
FEGIN weighted F1: 0.5041  0.0841
python main.py --data ltspice_examples --representation component_net --model FEGIN --layers 4 --hiddens 16 --batch_size 256 --lr 0.1 --emb_size 512 --epochs 100 --save_appendix component_net_L4_H16_BS256_LR0.1_E512 --no_val
-----



STDERR:
  File "main.py", line 370, in <module>
    main()
  File "main.py", line 254, in main
    dataset = dataset_class(
  File "/home/philip/projects/ltspice_examples_code_repo/Circuit-Completion-Using-GNNs/component_classification_with_link_prediction_head/evaluation/FEGIN/kernel/circuit_datasets.py", line 15, in __init__
    self.data, self.slices = torch.load(self.processed_paths[0])
  File "/home/philip/.local/lib/python3.8/site-packages/torch/serialization.py", line 1040, in load
    warnings.warn(
  File "/usr/lib/python3.8/warnings.py", line 109, in _showwarnmsg
    sw(msg.message, msg.category, msg.filename, msg.lineno,
  File "main.py", line 47, in warn_with_traceback
    traceback.print_stack(file=log)
/home/philip/projects/ltspice_examples_code_repo/Circuit-Completion-Using-GNNs/component_classification_with_link_prediction_head/evaluation/FEGIN/kernel/circuit_datasets.py:15: FutureWarning: You are using `torch.load` with `weights_only=False` (the current default value), which uses the default pickle module implicitly. It is possible to construct malicious pickle data which will execute arbitrary code during unpickling (See https://github.com/pytorch/pytorch/blob/main/SECURITY.md#untrusted-models for more details). In a future release, the default value for `weights_only` will be flipped to `True`. This limits the functions that could be executed during unpickling. Arbitrary objects will no longer be allowed to be loaded via this mode unless they are explicitly allowlisted by the user via `torch.serialization.add_safe_globals`. We recommend you start setting `weights_only=True` for any use case where you don't have full control of the loaded file. Please open an issue on GitHub for any issues related to this experimental feature.
  self.data, self.slices = torch.load(self.processed_paths[0])
