STDOUT:
Results will be saved in /home/philip/projects/ltspice_examples_code_repo/Circuit-Completion-Using-GNNs/component_classification_with_link_prediction_head/evaluation/FEGIN/results/model_FEGIN_dataset_ltspice_examples
Command line input: python main.py --data ltspice_examples --representation component_pin_net --model FEGIN --layers 2 --hiddens 64 --batch_size 256 --lr 0.0001 --emb_size 512 --epochs 100 --save_appendix component_pin_net_L2_H64_BS256_LR0.0001_E512 --no_val
 is saved.
-----
ltspice_examples - FEGIN
Using 2 layers, 64 hidden units, h = 2
Loading component_pin_net representation dataset
ENTERED
Training FEGIN on component_pin_net representation
Train: 3558, Test: 846
##################ITERATION #0 ****************************************
 epoch: 0, train_loss: 1.3938, test_loss: 1.3924, test_f1: 0.1004
 epoch: 1, train_loss: 1.3854, test_loss: 1.3878, test_f1: 0.1004
 epoch: 2, train_loss: 1.3799, test_loss: 1.3824, test_f1: 0.1004
 epoch: 3, train_loss: 1.3731, test_loss: 1.3739, test_f1: 0.1162
 epoch: 4, train_loss: 1.3657, test_loss: 1.3633, test_f1: 0.1264
 epoch: 5, train_loss: 1.3557, test_loss: 1.3520, test_f1: 0.1436
 epoch: 6, train_loss: 1.3466, test_loss: 1.3395, test_f1: 0.2655
 epoch: 7, train_loss: 1.3338, test_loss: 1.3259, test_f1: 0.2825
 epoch: 8, train_loss: 1.3191, test_loss: 1.3113, test_f1: 0.2586
 epoch: 9, train_loss: 1.3049, test_loss: 1.2959, test_f1: 0.2555
 epoch: 10, train_loss: 1.2914, test_loss: 1.2800, test_f1: 0.2304
 epoch: 11, train_loss: 1.2741, test_loss: 1.2644, test_f1: 0.2302
 epoch: 12, train_loss: 1.2608, test_loss: 1.2502, test_f1: 0.2295
 epoch: 13, train_loss: 1.2504, test_loss: 1.2367, test_f1: 0.2270
 epoch: 14, train_loss: 1.2345, test_loss: 1.2237, test_f1: 0.2270
 epoch: 15, train_loss: 1.2271, test_loss: 1.2116, test_f1: 0.2270
 epoch: 16, train_loss: 1.2158, test_loss: 1.1998, test_f1: 0.2270
 epoch: 17, train_loss: 1.2086, test_loss: 1.1893, test_f1: 0.2679
 epoch: 18, train_loss: 1.1966, test_loss: 1.1791, test_f1: 0.2979
 epoch: 19, train_loss: 1.1889, test_loss: 1.1689, test_f1: 0.3155
 epoch: 20, train_loss: 1.1786, test_loss: 1.1590, test_f1: 0.3462
 epoch: 21, train_loss: 1.1732, test_loss: 1.1488, test_f1: 0.3708
 epoch: 22, train_loss: 1.1622, test_loss: 1.1387, test_f1: 0.3881
 epoch: 23, train_loss: 1.1538, test_loss: 1.1294, test_f1: 0.3900
 epoch: 24, train_loss: 1.1431, test_loss: 1.1190, test_f1: 0.4155
 epoch: 25, train_loss: 1.1345, test_loss: 1.1078, test_f1: 0.4231
 epoch: 26, train_loss: 1.1258, test_loss: 1.0974, test_f1: 0.4663
 epoch: 27, train_loss: 1.1122, test_loss: 1.0851, test_f1: 0.4577
 epoch: 28, train_loss: 1.1036, test_loss: 1.0734, test_f1: 0.4592
 epoch: 29, train_loss: 1.0920, test_loss: 1.0630, test_f1: 0.4759
 epoch: 30, train_loss: 1.0802, test_loss: 1.0527, test_f1: 0.4816
 epoch: 31, train_loss: 1.0725, test_loss: 1.0440, test_f1: 0.4775
 epoch: 32, train_loss: 1.0592, test_loss: 1.0338, test_f1: 0.4816
 epoch: 33, train_loss: 1.0567, test_loss: 1.0260, test_f1: 0.4816
 epoch: 34, train_loss: 1.0397, test_loss: 1.0196, test_f1: 0.4869
 epoch: 35, train_loss: 1.0377, test_loss: 1.0143, test_f1: 0.4853
 epoch: 36, train_loss: 1.0269, test_loss: 1.0068, test_f1: 0.4935
 epoch: 37, train_loss: 1.0180, test_loss: 1.0005, test_f1: 0.4989
 epoch: 38, train_loss: 1.0170, test_loss: 0.9978, test_f1: 0.4975
 epoch: 39, train_loss: 1.0048, test_loss: 0.9922, test_f1: 0.4942
 epoch: 40, train_loss: 1.0048, test_loss: 0.9914, test_f1: 0.4988
 epoch: 41, train_loss: 0.9964, test_loss: 0.9853, test_f1: 0.5036
 epoch: 42, train_loss: 0.9932, test_loss: 0.9821, test_f1: 0.5020
 epoch: 43, train_loss: 0.9903, test_loss: 0.9793, test_f1: 0.4981
 epoch: 44, train_loss: 0.9889, test_loss: 0.9780, test_f1: 0.4977
 epoch: 45, train_loss: 0.9859, test_loss: 0.9763, test_f1: 0.4990
 epoch: 46, train_loss: 0.9765, test_loss: 0.9709, test_f1: 0.5088
 epoch: 47, train_loss: 0.9775, test_loss: 0.9681, test_f1: 0.4991
 epoch: 48, train_loss: 0.9732, test_loss: 0.9654, test_f1: 0.5040
 epoch: 49, train_loss: 0.9760, test_loss: 0.9641, test_f1: 0.4977
 epoch: 50, train_loss: 0.9661, test_loss: 0.9690, test_f1: 0.5036
 epoch: 51, train_loss: 0.9622, test_loss: 0.9611, test_f1: 0.5095
 epoch: 52, train_loss: 0.9671, test_loss: 0.9602, test_f1: 0.5103
 epoch: 53, train_loss: 0.9641, test_loss: 0.9590, test_f1: 0.5088
 epoch: 54, train_loss: 0.9586, test_loss: 0.9580, test_f1: 0.5139
 epoch: 55, train_loss: 0.9582, test_loss: 0.9565, test_f1: 0.5130
 epoch: 56, train_loss: 0.9609, test_loss: 0.9563, test_f1: 0.5169
 epoch: 57, train_loss: 0.9563, test_loss: 0.9553, test_f1: 0.5101
 epoch: 58, train_loss: 0.9540, test_loss: 0.9532, test_f1: 0.5172
 epoch: 59, train_loss: 0.9550, test_loss: 0.9554, test_f1: 0.5087
 epoch: 60, train_loss: 0.9569, test_loss: 0.9526, test_f1: 0.5068
 epoch: 61, train_loss: 0.9530, test_loss: 0.9508, test_f1: 0.5100
 epoch: 62, train_loss: 0.9570, test_loss: 0.9525, test_f1: 0.5143
 epoch: 63, train_loss: 0.9507, test_loss: 0.9485, test_f1: 0.5109
 epoch: 64, train_loss: 0.9495, test_loss: 0.9476, test_f1: 0.5113
 epoch: 65, train_loss: 0.9485, test_loss: 0.9479, test_f1: 0.5151
 epoch: 66, train_loss: 0.9483, test_loss: 0.9505, test_f1: 0.5133
 epoch: 67, train_loss: 0.9490, test_loss: 0.9451, test_f1: 0.5228
 epoch: 68, train_loss: 0.9428, test_loss: 0.9454, test_f1: 0.5095
 epoch: 69, train_loss: 0.9458, test_loss: 0.9440, test_f1: 0.5035
 epoch: 70, train_loss: 0.9473, test_loss: 0.9444, test_f1: 0.5143
 epoch: 71, train_loss: 0.9382, test_loss: 0.9457, test_f1: 0.5148
 epoch: 72, train_loss: 0.9402, test_loss: 0.9430, test_f1: 0.5214
 epoch: 73, train_loss: 0.9391, test_loss: 0.9399, test_f1: 0.5159
 epoch: 74, train_loss: 0.9457, test_loss: 0.9389, test_f1: 0.5148
 epoch: 75, train_loss: 0.9331, test_loss: 0.9391, test_f1: 0.5026
 epoch: 76, train_loss: 0.9382, test_loss: 0.9363, test_f1: 0.5128
 epoch: 77, train_loss: 0.9344, test_loss: 0.9367, test_f1: 0.5118
 epoch: 78, train_loss: 0.9390, test_loss: 0.9354, test_f1: 0.5157
 epoch: 79, train_loss: 0.9325, test_loss: 0.9384, test_f1: 0.5093
 epoch: 80, train_loss: 0.9336, test_loss: 0.9378, test_f1: 0.5143
 epoch: 81, train_loss: 0.9274, test_loss: 0.9358, test_f1: 0.5091
 epoch: 82, train_loss: 0.9267, test_loss: 0.9353, test_f1: 0.5100
 epoch: 83, train_loss: 0.9278, test_loss: 0.9305, test_f1: 0.5062
 epoch: 84, train_loss: 0.9329, test_loss: 0.9331, test_f1: 0.5121
 epoch: 85, train_loss: 0.9310, test_loss: 0.9381, test_f1: 0.5235
 epoch: 86, train_loss: 0.9283, test_loss: 0.9339, test_f1: 0.5100
 epoch: 87, train_loss: 0.9294, test_loss: 0.9333, test_f1: 0.5137
 epoch: 88, train_loss: 0.9266, test_loss: 0.9350, test_f1: 0.5106
 epoch: 89, train_loss: 0.9224, test_loss: 0.9309, test_f1: 0.5279
 epoch: 90, train_loss: 0.9213, test_loss: 0.9321, test_f1: 0.5186
 epoch: 91, train_loss: 0.9264, test_loss: 0.9287, test_f1: 0.5164
 epoch: 92, train_loss: 0.9207, test_loss: 0.9317, test_f1: 0.5098
 epoch: 93, train_loss: 0.9147, test_loss: 0.9288, test_f1: 0.5154
 epoch: 94, train_loss: 0.9180, test_loss: 0.9271, test_f1: 0.5171
 epoch: 95, train_loss: 0.9192, test_loss: 0.9272, test_f1: 0.5120
 epoch: 96, train_loss: 0.9226, test_loss: 0.9245, test_f1: 0.5223
 epoch: 97, train_loss: 0.9137, test_loss: 0.9266, test_f1: 0.5267
 epoch: 98, train_loss: 0.9077, test_loss: 0.9217, test_f1: 0.5249
 epoch: 99, train_loss: 0.9145, test_loss: 0.9230, test_f1: 0.5208
##################ITERATION #1 ****************************************
 epoch: 0, train_loss: 1.3556, test_loss: 1.3668, test_f1: 0.1004
 epoch: 1, train_loss: 1.3351, test_loss: 1.3582, test_f1: 0.1004
 epoch: 2, train_loss: 1.3220, test_loss: 1.3466, test_f1: 0.2124
 epoch: 3, train_loss: 1.3073, test_loss: 1.3255, test_f1: 0.2578
 epoch: 4, train_loss: 1.2901, test_loss: 1.2911, test_f1: 0.2402
 epoch: 5, train_loss: 1.2745, test_loss: 1.2615, test_f1: 0.3144
 epoch: 6, train_loss: 1.2558, test_loss: 1.2370, test_f1: 0.3478
 epoch: 7, train_loss: 1.2353, test_loss: 1.2149, test_f1: 0.3403
 epoch: 8, train_loss: 1.2177, test_loss: 1.1939, test_f1: 0.3432
 epoch: 9, train_loss: 1.2000, test_loss: 1.1737, test_f1: 0.3460
 epoch: 10, train_loss: 1.1819, test_loss: 1.1543, test_f1: 0.3460
 epoch: 11, train_loss: 1.1641, test_loss: 1.1364, test_f1: 0.3460
 epoch: 12, train_loss: 1.1473, test_loss: 1.1206, test_f1: 0.3448
 epoch: 13, train_loss: 1.1316, test_loss: 1.1048, test_f1: 0.3438
 epoch: 14, train_loss: 1.1155, test_loss: 1.0905, test_f1: 0.3429
 epoch: 15, train_loss: 1.1057, test_loss: 1.0791, test_f1: 0.3428
 epoch: 16, train_loss: 1.0894, test_loss: 1.0695, test_f1: 0.3451
 epoch: 17, train_loss: 1.0831, test_loss: 1.0605, test_f1: 0.3502
 epoch: 18, train_loss: 1.0765, test_loss: 1.0521, test_f1: 0.3596
 epoch: 19, train_loss: 1.0661, test_loss: 1.0457, test_f1: 0.3644
 epoch: 20, train_loss: 1.0601, test_loss: 1.0397, test_f1: 0.3786
 epoch: 21, train_loss: 1.0533, test_loss: 1.0341, test_f1: 0.3863
 epoch: 22, train_loss: 1.0481, test_loss: 1.0289, test_f1: 0.3899
 epoch: 23, train_loss: 1.0391, test_loss: 1.0249, test_f1: 0.3979
 epoch: 24, train_loss: 1.0327, test_loss: 1.0191, test_f1: 0.4065
 epoch: 25, train_loss: 1.0296, test_loss: 1.0138, test_f1: 0.4129
 epoch: 26, train_loss: 1.0227, test_loss: 1.0097, test_f1: 0.4108
 epoch: 27, train_loss: 1.0235, test_loss: 1.0048, test_f1: 0.4121
 epoch: 28, train_loss: 1.0131, test_loss: 1.0011, test_f1: 0.4254
 epoch: 29, train_loss: 1.0074, test_loss: 0.9944, test_f1: 0.4320
 epoch: 30, train_loss: 1.0050, test_loss: 0.9911, test_f1: 0.4497
 epoch: 31, train_loss: 1.0052, test_loss: 0.9884, test_f1: 0.4456
 epoch: 32, train_loss: 1.0032, test_loss: 0.9876, test_f1: 0.4628
 epoch: 33, train_loss: 0.9932, test_loss: 0.9819, test_f1: 0.4710
 epoch: 34, train_loss: 0.9935, test_loss: 0.9802, test_f1: 0.4725
 epoch: 35, train_loss: 0.9825, test_loss: 0.9732, test_f1: 0.4787
 epoch: 36, train_loss: 0.9840, test_loss: 0.9683, test_f1: 0.4842
 epoch: 37, train_loss: 0.9821, test_loss: 0.9644, test_f1: 0.4747
 epoch: 38, train_loss: 0.9722, test_loss: 0.9608, test_f1: 0.4838
 epoch: 39, train_loss: 0.9747, test_loss: 0.9596, test_f1: 0.4869
 epoch: 40, train_loss: 0.9686, test_loss: 0.9551, test_f1: 0.4836
 epoch: 41, train_loss: 0.9650, test_loss: 0.9534, test_f1: 0.4908
 epoch: 42, train_loss: 0.9644, test_loss: 0.9513, test_f1: 0.4903
 epoch: 43, train_loss: 0.9590, test_loss: 0.9485, test_f1: 0.4911
 epoch: 44, train_loss: 0.9626, test_loss: 0.9453, test_f1: 0.4996
 epoch: 45, train_loss: 0.9563, test_loss: 0.9411, test_f1: 0.5039
 epoch: 46, train_loss: 0.9526, test_loss: 0.9368, test_f1: 0.4965
 epoch: 47, train_loss: 0.9499, test_loss: 0.9339, test_f1: 0.4982
 epoch: 48, train_loss: 0.9513, test_loss: 0.9373, test_f1: 0.5040
 epoch: 49, train_loss: 0.9468, test_loss: 0.9305, test_f1: 0.5057
 epoch: 50, train_loss: 0.9434, test_loss: 0.9292, test_f1: 0.5076
 epoch: 51, train_loss: 0.9339, test_loss: 0.9276, test_f1: 0.5094
 epoch: 52, train_loss: 0.9388, test_loss: 0.9236, test_f1: 0.5172
 epoch: 53, train_loss: 0.9342, test_loss: 0.9236, test_f1: 0.5070
 epoch: 54, train_loss: 0.9322, test_loss: 0.9242, test_f1: 0.5100
 epoch: 55, train_loss: 0.9350, test_loss: 0.9223, test_f1: 0.5112
 epoch: 56, train_loss: 0.9343, test_loss: 0.9199, test_f1: 0.5160
 epoch: 57, train_loss: 0.9279, test_loss: 0.9212, test_f1: 0.5124
 epoch: 58, train_loss: 0.9257, test_loss: 0.9210, test_f1: 0.5092
 epoch: 59, train_loss: 0.9234, test_loss: 0.9186, test_f1: 0.5107
 epoch: 60, train_loss: 0.9322, test_loss: 0.9165, test_f1: 0.5193
 epoch: 61, train_loss: 0.9286, test_loss: 0.9153, test_f1: 0.5202
 epoch: 62, train_loss: 0.9288, test_loss: 0.9123, test_f1: 0.5224
 epoch: 63, train_loss: 0.9254, test_loss: 0.9130, test_f1: 0.5198
 epoch: 64, train_loss: 0.9261, test_loss: 0.9115, test_f1: 0.5211
 epoch: 65, train_loss: 0.9222, test_loss: 0.9106, test_f1: 0.5210
 epoch: 66, train_loss: 0.9212, test_loss: 0.9107, test_f1: 0.5211
 epoch: 67, train_loss: 0.9202, test_loss: 0.9106, test_f1: 0.5161
 epoch: 68, train_loss: 0.9186, test_loss: 0.9095, test_f1: 0.5118
 epoch: 69, train_loss: 0.9150, test_loss: 0.9046, test_f1: 0.5244
 epoch: 70, train_loss: 0.9141, test_loss: 0.9049, test_f1: 0.5268
 epoch: 71, train_loss: 0.9171, test_loss: 0.9047, test_f1: 0.5214
 epoch: 72, train_loss: 0.9154, test_loss: 0.9053, test_f1: 0.5316
 epoch: 73, train_loss: 0.9081, test_loss: 0.8996, test_f1: 0.5245
 epoch: 74, train_loss: 0.9063, test_loss: 0.9028, test_f1: 0.5287
 epoch: 75, train_loss: 0.9112, test_loss: 0.9021, test_f1: 0.5286
 epoch: 76, train_loss: 0.9039, test_loss: 0.8986, test_f1: 0.5280
 epoch: 77, train_loss: 0.9086, test_loss: 0.8984, test_f1: 0.5316
 epoch: 78, train_loss: 0.8982, test_loss: 0.8977, test_f1: 0.5302
 epoch: 79, train_loss: 0.9064, test_loss: 0.8977, test_f1: 0.5264
 epoch: 80, train_loss: 0.9029, test_loss: 0.8956, test_f1: 0.5305
 epoch: 81, train_loss: 0.9007, test_loss: 0.8942, test_f1: 0.5353
 epoch: 82, train_loss: 0.8971, test_loss: 0.8932, test_f1: 0.5341
 epoch: 83, train_loss: 0.8955, test_loss: 0.8918, test_f1: 0.5351
 epoch: 84, train_loss: 0.8903, test_loss: 0.8933, test_f1: 0.5358
 epoch: 85, train_loss: 0.8942, test_loss: 0.8928, test_f1: 0.5316
 epoch: 86, train_loss: 0.8916, test_loss: 0.8911, test_f1: 0.5380
 epoch: 87, train_loss: 0.8990, test_loss: 0.8904, test_f1: 0.5348
 epoch: 88, train_loss: 0.8941, test_loss: 0.8891, test_f1: 0.5346
 epoch: 89, train_loss: 0.8851, test_loss: 0.8878, test_f1: 0.5376
 epoch: 90, train_loss: 0.8889, test_loss: 0.8864, test_f1: 0.5397
 epoch: 91, train_loss: 0.8853, test_loss: 0.8873, test_f1: 0.5372
 epoch: 92, train_loss: 0.8879, test_loss: 0.8871, test_f1: 0.5423
 epoch: 93, train_loss: 0.8829, test_loss: 0.8879, test_f1: 0.5386
 epoch: 94, train_loss: 0.8796, test_loss: 0.8839, test_f1: 0.5380
 epoch: 95, train_loss: 0.8783, test_loss: 0.8787, test_f1: 0.5441
 epoch: 96, train_loss: 0.8809, test_loss: 0.8817, test_f1: 0.5413
 epoch: 97, train_loss: 0.8769, test_loss: 0.8817, test_f1: 0.5386
 epoch: 98, train_loss: 0.8833, test_loss: 0.8809, test_f1: 0.5421
 epoch: 99, train_loss: 0.8751, test_loss: 0.8794, test_f1: 0.5422
##################ITERATION #2 ****************************************
 epoch: 0, train_loss: 1.3505, test_loss: 1.3592, test_f1: 0.2270
 epoch: 1, train_loss: 1.3227, test_loss: 1.3509, test_f1: 0.2270
 epoch: 2, train_loss: 1.3024, test_loss: 1.3340, test_f1: 0.2270
 epoch: 3, train_loss: 1.2857, test_loss: 1.3047, test_f1: 0.2484
 epoch: 4, train_loss: 1.2667, test_loss: 1.2669, test_f1: 0.3299
 epoch: 5, train_loss: 1.2449, test_loss: 1.2308, test_f1: 0.3467
 epoch: 6, train_loss: 1.2256, test_loss: 1.1994, test_f1: 0.3536
 epoch: 7, train_loss: 1.2057, test_loss: 1.1726, test_f1: 0.3441
 epoch: 8, train_loss: 1.1828, test_loss: 1.1472, test_f1: 0.3441
 epoch: 9, train_loss: 1.1656, test_loss: 1.1266, test_f1: 0.3451
 epoch: 10, train_loss: 1.1445, test_loss: 1.1084, test_f1: 0.3460
 epoch: 11, train_loss: 1.1308, test_loss: 1.0917, test_f1: 0.3460
 epoch: 12, train_loss: 1.1152, test_loss: 1.0781, test_f1: 0.3429
 epoch: 13, train_loss: 1.0988, test_loss: 1.0669, test_f1: 0.3448
 epoch: 14, train_loss: 1.0879, test_loss: 1.0584, test_f1: 0.3438
 epoch: 15, train_loss: 1.0782, test_loss: 1.0483, test_f1: 0.3462
 epoch: 16, train_loss: 1.0704, test_loss: 1.0422, test_f1: 0.3581
 epoch: 17, train_loss: 1.0595, test_loss: 1.0346, test_f1: 0.3732
 epoch: 18, train_loss: 1.0504, test_loss: 1.0307, test_f1: 0.3982
 epoch: 19, train_loss: 1.0440, test_loss: 1.0242, test_f1: 0.4046
 epoch: 20, train_loss: 1.0378, test_loss: 1.0177, test_f1: 0.4067
 epoch: 21, train_loss: 1.0331, test_loss: 1.0135, test_f1: 0.4152
 epoch: 22, train_loss: 1.0253, test_loss: 1.0105, test_f1: 0.4227
 epoch: 23, train_loss: 1.0209, test_loss: 1.0056, test_f1: 0.4263
 epoch: 24, train_loss: 1.0167, test_loss: 1.0018, test_f1: 0.4262
 epoch: 25, train_loss: 1.0104, test_loss: 0.9948, test_f1: 0.4351
 epoch: 26, train_loss: 1.0101, test_loss: 0.9912, test_f1: 0.4415
 epoch: 27, train_loss: 1.0036, test_loss: 0.9871, test_f1: 0.4443
 epoch: 28, train_loss: 0.9930, test_loss: 0.9832, test_f1: 0.4753
 epoch: 29, train_loss: 0.9906, test_loss: 0.9747, test_f1: 0.4655
 epoch: 30, train_loss: 0.9889, test_loss: 0.9712, test_f1: 0.4752
 epoch: 31, train_loss: 0.9864, test_loss: 0.9712, test_f1: 0.4792
 epoch: 32, train_loss: 0.9841, test_loss: 0.9654, test_f1: 0.4825
 epoch: 33, train_loss: 0.9722, test_loss: 0.9627, test_f1: 0.4809
 epoch: 34, train_loss: 0.9753, test_loss: 0.9558, test_f1: 0.4885
 epoch: 35, train_loss: 0.9724, test_loss: 0.9560, test_f1: 0.4873
 epoch: 36, train_loss: 0.9701, test_loss: 0.9533, test_f1: 0.4928
 epoch: 37, train_loss: 0.9670, test_loss: 0.9516, test_f1: 0.4892
 epoch: 38, train_loss: 0.9635, test_loss: 0.9524, test_f1: 0.4952
 epoch: 39, train_loss: 0.9578, test_loss: 0.9423, test_f1: 0.4948
 epoch: 40, train_loss: 0.9532, test_loss: 0.9421, test_f1: 0.5029
 epoch: 41, train_loss: 0.9492, test_loss: 0.9345, test_f1: 0.4946
 epoch: 42, train_loss: 0.9521, test_loss: 0.9369, test_f1: 0.4944
 epoch: 43, train_loss: 0.9413, test_loss: 0.9263, test_f1: 0.4989
 epoch: 44, train_loss: 0.9441, test_loss: 0.9285, test_f1: 0.4998
 epoch: 45, train_loss: 0.9379, test_loss: 0.9316, test_f1: 0.4918
 epoch: 46, train_loss: 0.9346, test_loss: 0.9222, test_f1: 0.4971
 epoch: 47, train_loss: 0.9322, test_loss: 0.9192, test_f1: 0.5059
 epoch: 48, train_loss: 0.9292, test_loss: 0.9221, test_f1: 0.5067
 epoch: 49, train_loss: 0.9281, test_loss: 0.9118, test_f1: 0.5092
 epoch: 50, train_loss: 0.9235, test_loss: 0.9124, test_f1: 0.5083
 epoch: 51, train_loss: 0.9185, test_loss: 0.9118, test_f1: 0.5068
 epoch: 52, train_loss: 0.9181, test_loss: 0.9104, test_f1: 0.5091
 epoch: 53, train_loss: 0.9165, test_loss: 0.9090, test_f1: 0.5109
 epoch: 54, train_loss: 0.9200, test_loss: 0.9070, test_f1: 0.5140
 epoch: 55, train_loss: 0.9134, test_loss: 0.9095, test_f1: 0.5131
 epoch: 56, train_loss: 0.9143, test_loss: 0.9083, test_f1: 0.5164
 epoch: 57, train_loss: 0.9104, test_loss: 0.9057, test_f1: 0.5169
 epoch: 58, train_loss: 0.9107, test_loss: 0.9029, test_f1: 0.5211
 epoch: 59, train_loss: 0.9090, test_loss: 0.9033, test_f1: 0.5254
 epoch: 60, train_loss: 0.9119, test_loss: 0.9009, test_f1: 0.5228
 epoch: 61, train_loss: 0.9101, test_loss: 0.9009, test_f1: 0.5278
 epoch: 62, train_loss: 0.8983, test_loss: 0.8995, test_f1: 0.5202
 epoch: 63, train_loss: 0.9050, test_loss: 0.8985, test_f1: 0.5198
 epoch: 64, train_loss: 0.9005, test_loss: 0.9001, test_f1: 0.5244
 epoch: 65, train_loss: 0.9031, test_loss: 0.8985, test_f1: 0.5219
 epoch: 66, train_loss: 0.8961, test_loss: 0.8962, test_f1: 0.5224
 epoch: 67, train_loss: 0.8970, test_loss: 0.8970, test_f1: 0.5273
 epoch: 68, train_loss: 0.8908, test_loss: 0.8946, test_f1: 0.5250
 epoch: 69, train_loss: 0.9002, test_loss: 0.8941, test_f1: 0.5297
 epoch: 70, train_loss: 0.8934, test_loss: 0.8907, test_f1: 0.5208
 epoch: 71, train_loss: 0.8911, test_loss: 0.8894, test_f1: 0.5305
 epoch: 72, train_loss: 0.8884, test_loss: 0.8880, test_f1: 0.5261
 epoch: 73, train_loss: 0.8873, test_loss: 0.8944, test_f1: 0.5296
 epoch: 74, train_loss: 0.8920, test_loss: 0.8875, test_f1: 0.5312
 epoch: 75, train_loss: 0.8891, test_loss: 0.8927, test_f1: 0.5256
 epoch: 76, train_loss: 0.8882, test_loss: 0.8867, test_f1: 0.5214
 epoch: 77, train_loss: 0.8849, test_loss: 0.8874, test_f1: 0.5334
 epoch: 78, train_loss: 0.8780, test_loss: 0.8908, test_f1: 0.5290
 epoch: 79, train_loss: 0.8791, test_loss: 0.8880, test_f1: 0.5299
 epoch: 80, train_loss: 0.8774, test_loss: 0.8845, test_f1: 0.5337
 epoch: 81, train_loss: 0.8764, test_loss: 0.8868, test_f1: 0.5266
 epoch: 82, train_loss: 0.8776, test_loss: 0.8877, test_f1: 0.5278
 epoch: 83, train_loss: 0.8799, test_loss: 0.8768, test_f1: 0.5295
 epoch: 84, train_loss: 0.8792, test_loss: 0.8821, test_f1: 0.5288
 epoch: 85, train_loss: 0.8734, test_loss: 0.8819, test_f1: 0.5283
 epoch: 86, train_loss: 0.8729, test_loss: 0.8801, test_f1: 0.5274
 epoch: 87, train_loss: 0.8648, test_loss: 0.8773, test_f1: 0.5279
 epoch: 88, train_loss: 0.8758, test_loss: 0.8824, test_f1: 0.5349
 epoch: 89, train_loss: 0.8687, test_loss: 0.8845, test_f1: 0.5249
 epoch: 90, train_loss: 0.8674, test_loss: 0.8783, test_f1: 0.5367
 epoch: 91, train_loss: 0.8656, test_loss: 0.8757, test_f1: 0.5329
 epoch: 92, train_loss: 0.8681, test_loss: 0.8785, test_f1: 0.5286
 epoch: 93, train_loss: 0.8639, test_loss: 0.8865, test_f1: 0.5324
 epoch: 94, train_loss: 0.8594, test_loss: 0.8819, test_f1: 0.5356
 epoch: 95, train_loss: 0.8630, test_loss: 0.8791, test_f1: 0.5316
 epoch: 96, train_loss: 0.8603, test_loss: 0.8810, test_f1: 0.5303
 epoch: 97, train_loss: 0.8600, test_loss: 0.8720, test_f1: 0.5378
 epoch: 98, train_loss: 0.8532, test_loss: 0.8756, test_f1: 0.5318
 epoch: 99, train_loss: 0.8607, test_loss: 0.8730, test_f1: 0.5415
##################ITERATION #3 ****************************************
 epoch: 0, train_loss: 1.3077, test_loss: 1.3171, test_f1: 0.2270
 epoch: 1, train_loss: 1.2740, test_loss: 1.2996, test_f1: 0.2270
 epoch: 2, train_loss: 1.2540, test_loss: 1.2725, test_f1: 0.2270
 epoch: 3, train_loss: 1.2377, test_loss: 1.2345, test_f1: 0.2270
 epoch: 4, train_loss: 1.2187, test_loss: 1.1996, test_f1: 0.3275
 epoch: 5, train_loss: 1.1971, test_loss: 1.1680, test_f1: 0.3548
 epoch: 6, train_loss: 1.1777, test_loss: 1.1411, test_f1: 0.3474
 epoch: 7, train_loss: 1.1578, test_loss: 1.1172, test_f1: 0.3484
 epoch: 8, train_loss: 1.1376, test_loss: 1.0963, test_f1: 0.3609
 epoch: 9, train_loss: 1.1151, test_loss: 1.0795, test_f1: 0.3880
 epoch: 10, train_loss: 1.0999, test_loss: 1.0640, test_f1: 0.4030
 epoch: 11, train_loss: 1.0856, test_loss: 1.0502, test_f1: 0.4130
 epoch: 12, train_loss: 1.0728, test_loss: 1.0391, test_f1: 0.4201
 epoch: 13, train_loss: 1.0582, test_loss: 1.0302, test_f1: 0.4277
 epoch: 14, train_loss: 1.0511, test_loss: 1.0212, test_f1: 0.4360
 epoch: 15, train_loss: 1.0455, test_loss: 1.0146, test_f1: 0.4360
 epoch: 16, train_loss: 1.0400, test_loss: 1.0071, test_f1: 0.4403
 epoch: 17, train_loss: 1.0279, test_loss: 1.0009, test_f1: 0.4391
 epoch: 18, train_loss: 1.0223, test_loss: 0.9955, test_f1: 0.4573
 epoch: 19, train_loss: 1.0145, test_loss: 0.9893, test_f1: 0.4640
 epoch: 20, train_loss: 1.0076, test_loss: 0.9837, test_f1: 0.4666
 epoch: 21, train_loss: 1.0048, test_loss: 0.9817, test_f1: 0.4703
 epoch: 22, train_loss: 0.9994, test_loss: 0.9766, test_f1: 0.4770
 epoch: 23, train_loss: 0.9933, test_loss: 0.9741, test_f1: 0.4871
 epoch: 24, train_loss: 0.9858, test_loss: 0.9708, test_f1: 0.4921
 epoch: 25, train_loss: 0.9854, test_loss: 0.9634, test_f1: 0.4901
 epoch: 26, train_loss: 0.9792, test_loss: 0.9600, test_f1: 0.4944
 epoch: 27, train_loss: 0.9749, test_loss: 0.9569, test_f1: 0.4922
 epoch: 28, train_loss: 0.9684, test_loss: 0.9531, test_f1: 0.4900
 epoch: 29, train_loss: 0.9674, test_loss: 0.9503, test_f1: 0.4945
 epoch: 30, train_loss: 0.9629, test_loss: 0.9457, test_f1: 0.4963
 epoch: 31, train_loss: 0.9616, test_loss: 0.9425, test_f1: 0.4921
 epoch: 32, train_loss: 0.9616, test_loss: 0.9413, test_f1: 0.4963
 epoch: 33, train_loss: 0.9485, test_loss: 0.9405, test_f1: 0.4960
 epoch: 34, train_loss: 0.9467, test_loss: 0.9331, test_f1: 0.5131
 epoch: 35, train_loss: 0.9427, test_loss: 0.9329, test_f1: 0.5140
 epoch: 36, train_loss: 0.9414, test_loss: 0.9305, test_f1: 0.5176
 epoch: 37, train_loss: 0.9400, test_loss: 0.9263, test_f1: 0.5171
 epoch: 38, train_loss: 0.9356, test_loss: 0.9239, test_f1: 0.5148
 epoch: 39, train_loss: 0.9336, test_loss: 0.9245, test_f1: 0.5175
 epoch: 40, train_loss: 0.9213, test_loss: 0.9167, test_f1: 0.5158
 epoch: 41, train_loss: 0.9238, test_loss: 0.9156, test_f1: 0.5211
 epoch: 42, train_loss: 0.9181, test_loss: 0.9090, test_f1: 0.5230
 epoch: 43, train_loss: 0.9152, test_loss: 0.9090, test_f1: 0.5172
 epoch: 44, train_loss: 0.9135, test_loss: 0.9049, test_f1: 0.5171
 epoch: 45, train_loss: 0.9193, test_loss: 0.9034, test_f1: 0.5271
 epoch: 46, train_loss: 0.9073, test_loss: 0.8967, test_f1: 0.5266
 epoch: 47, train_loss: 0.9071, test_loss: 0.9012, test_f1: 0.5134
 epoch: 48, train_loss: 0.9014, test_loss: 0.8927, test_f1: 0.5306
 epoch: 49, train_loss: 0.9030, test_loss: 0.8859, test_f1: 0.5244
 epoch: 50, train_loss: 0.9022, test_loss: 0.8797, test_f1: 0.5339
 epoch: 51, train_loss: 0.8890, test_loss: 0.8816, test_f1: 0.5217
 epoch: 52, train_loss: 0.8940, test_loss: 0.8818, test_f1: 0.5203
 epoch: 53, train_loss: 0.8873, test_loss: 0.8774, test_f1: 0.5302
 epoch: 54, train_loss: 0.8867, test_loss: 0.8756, test_f1: 0.5251
 epoch: 55, train_loss: 0.8880, test_loss: 0.8744, test_f1: 0.5340
 epoch: 56, train_loss: 0.8848, test_loss: 0.8743, test_f1: 0.5270
 epoch: 57, train_loss: 0.8863, test_loss: 0.8754, test_f1: 0.5292
 epoch: 58, train_loss: 0.8791, test_loss: 0.8745, test_f1: 0.5288
 epoch: 59, train_loss: 0.8827, test_loss: 0.8741, test_f1: 0.5315
 epoch: 60, train_loss: 0.8805, test_loss: 0.8727, test_f1: 0.5226
 epoch: 61, train_loss: 0.8786, test_loss: 0.8711, test_f1: 0.5335
 epoch: 62, train_loss: 0.8739, test_loss: 0.8705, test_f1: 0.5314
 epoch: 63, train_loss: 0.8749, test_loss: 0.8677, test_f1: 0.5371
 epoch: 64, train_loss: 0.8729, test_loss: 0.8662, test_f1: 0.5353
 epoch: 65, train_loss: 0.8682, test_loss: 0.8645, test_f1: 0.5351
 epoch: 66, train_loss: 0.8697, test_loss: 0.8642, test_f1: 0.5325
 epoch: 67, train_loss: 0.8672, test_loss: 0.8622, test_f1: 0.5288
 epoch: 68, train_loss: 0.8668, test_loss: 0.8599, test_f1: 0.5279
 epoch: 69, train_loss: 0.8701, test_loss: 0.8618, test_f1: 0.5275
 epoch: 70, train_loss: 0.8637, test_loss: 0.8599, test_f1: 0.5385
 epoch: 71, train_loss: 0.8627, test_loss: 0.8576, test_f1: 0.5301
 epoch: 72, train_loss: 0.8645, test_loss: 0.8566, test_f1: 0.5329
 epoch: 73, train_loss: 0.8611, test_loss: 0.8560, test_f1: 0.5414
 epoch: 74, train_loss: 0.8610, test_loss: 0.8560, test_f1: 0.5425
 epoch: 75, train_loss: 0.8560, test_loss: 0.8550, test_f1: 0.5366
 epoch: 76, train_loss: 0.8589, test_loss: 0.8546, test_f1: 0.5342
 epoch: 77, train_loss: 0.8596, test_loss: 0.8539, test_f1: 0.5395
 epoch: 78, train_loss: 0.8599, test_loss: 0.8539, test_f1: 0.5340
 epoch: 79, train_loss: 0.8540, test_loss: 0.8489, test_f1: 0.5472
 epoch: 80, train_loss: 0.8526, test_loss: 0.8540, test_f1: 0.5319
 epoch: 81, train_loss: 0.8515, test_loss: 0.8502, test_f1: 0.5409
 epoch: 82, train_loss: 0.8416, test_loss: 0.8485, test_f1: 0.5425
 epoch: 83, train_loss: 0.8442, test_loss: 0.8492, test_f1: 0.5464
 epoch: 84, train_loss: 0.8514, test_loss: 0.8473, test_f1: 0.5420
 epoch: 85, train_loss: 0.8455, test_loss: 0.8465, test_f1: 0.5407
 epoch: 86, train_loss: 0.8491, test_loss: 0.8475, test_f1: 0.5414
 epoch: 87, train_loss: 0.8495, test_loss: 0.8472, test_f1: 0.5486
 epoch: 88, train_loss: 0.8441, test_loss: 0.8470, test_f1: 0.5337
 epoch: 89, train_loss: 0.8482, test_loss: 0.8443, test_f1: 0.5439
 epoch: 90, train_loss: 0.8441, test_loss: 0.8433, test_f1: 0.5499
 epoch: 91, train_loss: 0.8461, test_loss: 0.8449, test_f1: 0.5457
 epoch: 92, train_loss: 0.8394, test_loss: 0.8426, test_f1: 0.5424
 epoch: 93, train_loss: 0.8348, test_loss: 0.8422, test_f1: 0.5341
 epoch: 94, train_loss: 0.8342, test_loss: 0.8396, test_f1: 0.5422
 epoch: 95, train_loss: 0.8325, test_loss: 0.8396, test_f1: 0.5457
 epoch: 96, train_loss: 0.8371, test_loss: 0.8356, test_f1: 0.5478
 epoch: 97, train_loss: 0.8357, test_loss: 0.8370, test_f1: 0.5501
 epoch: 98, train_loss: 0.8322, test_loss: 0.8345, test_f1: 0.5490
 epoch: 99, train_loss: 0.8293, test_loss: 0.8331, test_f1: 0.5548
##################ITERATION #4 ****************************************
 epoch: 0, train_loss: 1.3165, test_loss: 1.3351, test_f1: 0.2270
 epoch: 1, train_loss: 1.2812, test_loss: 1.3237, test_f1: 0.2270
 epoch: 2, train_loss: 1.2557, test_loss: 1.3014, test_f1: 0.2270
 epoch: 3, train_loss: 1.2363, test_loss: 1.2631, test_f1: 0.2320
 epoch: 4, train_loss: 1.2153, test_loss: 1.2200, test_f1: 0.3242
 epoch: 5, train_loss: 1.1988, test_loss: 1.1790, test_f1: 0.4259
 epoch: 6, train_loss: 1.1700, test_loss: 1.1443, test_f1: 0.4256
 epoch: 7, train_loss: 1.1523, test_loss: 1.1188, test_f1: 0.4281
 epoch: 8, train_loss: 1.1376, test_loss: 1.0978, test_f1: 0.4360
 epoch: 9, train_loss: 1.1179, test_loss: 1.0808, test_f1: 0.4309
 epoch: 10, train_loss: 1.1007, test_loss: 1.0660, test_f1: 0.4307
 epoch: 11, train_loss: 1.0898, test_loss: 1.0531, test_f1: 0.4350
 epoch: 12, train_loss: 1.0748, test_loss: 1.0429, test_f1: 0.4335
 epoch: 13, train_loss: 1.0682, test_loss: 1.0341, test_f1: 0.4372
 epoch: 14, train_loss: 1.0616, test_loss: 1.0264, test_f1: 0.4458
 epoch: 15, train_loss: 1.0450, test_loss: 1.0203, test_f1: 0.4414
 epoch: 16, train_loss: 1.0419, test_loss: 1.0139, test_f1: 0.4343
 epoch: 17, train_loss: 1.0284, test_loss: 1.0072, test_f1: 0.4398
 epoch: 18, train_loss: 1.0259, test_loss: 1.0033, test_f1: 0.4450
 epoch: 19, train_loss: 1.0195, test_loss: 0.9975, test_f1: 0.4536
 epoch: 20, train_loss: 1.0154, test_loss: 0.9928, test_f1: 0.4655
 epoch: 21, train_loss: 1.0108, test_loss: 0.9876, test_f1: 0.4657
 epoch: 22, train_loss: 1.0021, test_loss: 0.9837, test_f1: 0.4736
 epoch: 23, train_loss: 1.0002, test_loss: 0.9810, test_f1: 0.4712
 epoch: 24, train_loss: 0.9994, test_loss: 0.9763, test_f1: 0.4651
 epoch: 25, train_loss: 0.9877, test_loss: 0.9739, test_f1: 0.4669
 epoch: 26, train_loss: 0.9828, test_loss: 0.9678, test_f1: 0.4701
 epoch: 27, train_loss: 0.9830, test_loss: 0.9644, test_f1: 0.4781
 epoch: 28, train_loss: 0.9814, test_loss: 0.9622, test_f1: 0.4825
 epoch: 29, train_loss: 0.9759, test_loss: 0.9585, test_f1: 0.4810
 epoch: 30, train_loss: 0.9687, test_loss: 0.9579, test_f1: 0.4806
 epoch: 31, train_loss: 0.9635, test_loss: 0.9550, test_f1: 0.4879
 epoch: 32, train_loss: 0.9563, test_loss: 0.9485, test_f1: 0.4896
 epoch: 33, train_loss: 0.9602, test_loss: 0.9484, test_f1: 0.4896
 epoch: 34, train_loss: 0.9553, test_loss: 0.9459, test_f1: 0.4906
 epoch: 35, train_loss: 0.9523, test_loss: 0.9416, test_f1: 0.4821
 epoch: 36, train_loss: 0.9488, test_loss: 0.9385, test_f1: 0.4878
 epoch: 37, train_loss: 0.9470, test_loss: 0.9348, test_f1: 0.5045
 epoch: 38, train_loss: 0.9401, test_loss: 0.9316, test_f1: 0.5064
 epoch: 39, train_loss: 0.9408, test_loss: 0.9304, test_f1: 0.5006
 epoch: 40, train_loss: 0.9337, test_loss: 0.9228, test_f1: 0.5031
 epoch: 41, train_loss: 0.9300, test_loss: 0.9234, test_f1: 0.4992
 epoch: 42, train_loss: 0.9336, test_loss: 0.9180, test_f1: 0.5118
 epoch: 43, train_loss: 0.9216, test_loss: 0.9134, test_f1: 0.5112
 epoch: 44, train_loss: 0.9259, test_loss: 0.9183, test_f1: 0.5042
 epoch: 45, train_loss: 0.9207, test_loss: 0.9123, test_f1: 0.5070
 epoch: 46, train_loss: 0.9203, test_loss: 0.9100, test_f1: 0.5119
 epoch: 47, train_loss: 0.9161, test_loss: 0.9052, test_f1: 0.5080
 epoch: 48, train_loss: 0.9080, test_loss: 0.9017, test_f1: 0.5113
 epoch: 49, train_loss: 0.9107, test_loss: 0.8984, test_f1: 0.5126
 epoch: 50, train_loss: 0.9079, test_loss: 0.9019, test_f1: 0.5177
 epoch: 51, train_loss: 0.9062, test_loss: 0.8943, test_f1: 0.5154
 epoch: 52, train_loss: 0.8983, test_loss: 0.8918, test_f1: 0.5115
 epoch: 53, train_loss: 0.8947, test_loss: 0.8911, test_f1: 0.5181
 epoch: 54, train_loss: 0.9012, test_loss: 0.8895, test_f1: 0.5205
 epoch: 55, train_loss: 0.8989, test_loss: 0.8912, test_f1: 0.5164
 epoch: 56, train_loss: 0.8952, test_loss: 0.8900, test_f1: 0.5233
 epoch: 57, train_loss: 0.8915, test_loss: 0.8896, test_f1: 0.5252
 epoch: 58, train_loss: 0.8903, test_loss: 0.8868, test_f1: 0.5266
 epoch: 59, train_loss: 0.8830, test_loss: 0.8837, test_f1: 0.5190
 epoch: 60, train_loss: 0.8898, test_loss: 0.8842, test_f1: 0.5185
 epoch: 61, train_loss: 0.8850, test_loss: 0.8809, test_f1: 0.5310
 epoch: 62, train_loss: 0.8828, test_loss: 0.8782, test_f1: 0.5309
 epoch: 63, train_loss: 0.8843, test_loss: 0.8784, test_f1: 0.5288
 epoch: 64, train_loss: 0.8809, test_loss: 0.8821, test_f1: 0.5369
 epoch: 65, train_loss: 0.8854, test_loss: 0.8804, test_f1: 0.5366
 epoch: 66, train_loss: 0.8765, test_loss: 0.8764, test_f1: 0.5362
 epoch: 67, train_loss: 0.8785, test_loss: 0.8775, test_f1: 0.5370
 epoch: 68, train_loss: 0.8728, test_loss: 0.8720, test_f1: 0.5401
 epoch: 69, train_loss: 0.8745, test_loss: 0.8734, test_f1: 0.5359
 epoch: 70, train_loss: 0.8735, test_loss: 0.8712, test_f1: 0.5341
 epoch: 71, train_loss: 0.8723, test_loss: 0.8714, test_f1: 0.5328
 epoch: 72, train_loss: 0.8708, test_loss: 0.8706, test_f1: 0.5330
 epoch: 73, train_loss: 0.8675, test_loss: 0.8700, test_f1: 0.5346
 epoch: 74, train_loss: 0.8648, test_loss: 0.8697, test_f1: 0.5383
 epoch: 75, train_loss: 0.8722, test_loss: 0.8662, test_f1: 0.5436
 epoch: 76, train_loss: 0.8648, test_loss: 0.8695, test_f1: 0.5420
 epoch: 77, train_loss: 0.8620, test_loss: 0.8701, test_f1: 0.5391
 epoch: 78, train_loss: 0.8584, test_loss: 0.8646, test_f1: 0.5389
 epoch: 79, train_loss: 0.8526, test_loss: 0.8635, test_f1: 0.5421
 epoch: 80, train_loss: 0.8550, test_loss: 0.8658, test_f1: 0.5397
 epoch: 81, train_loss: 0.8511, test_loss: 0.8654, test_f1: 0.5352
 epoch: 82, train_loss: 0.8574, test_loss: 0.8645, test_f1: 0.5373
 epoch: 83, train_loss: 0.8593, test_loss: 0.8665, test_f1: 0.5485
 epoch: 84, train_loss: 0.8536, test_loss: 0.8631, test_f1: 0.5493
 epoch: 85, train_loss: 0.8510, test_loss: 0.8618, test_f1: 0.5437
 epoch: 86, train_loss: 0.8485, test_loss: 0.8642, test_f1: 0.5445
 epoch: 87, train_loss: 0.8486, test_loss: 0.8655, test_f1: 0.5464
 epoch: 88, train_loss: 0.8491, test_loss: 0.8593, test_f1: 0.5474
 epoch: 89, train_loss: 0.8557, test_loss: 0.8719, test_f1: 0.5507
 epoch: 90, train_loss: 0.8416, test_loss: 0.8583, test_f1: 0.5503
 epoch: 91, train_loss: 0.8438, test_loss: 0.8597, test_f1: 0.5446
 epoch: 92, train_loss: 0.8472, test_loss: 0.8615, test_f1: 0.5556
 epoch: 93, train_loss: 0.8437, test_loss: 0.8579, test_f1: 0.5504
 epoch: 94, train_loss: 0.8440, test_loss: 0.8569, test_f1: 0.5536
 epoch: 95, train_loss: 0.8428, test_loss: 0.8599, test_f1: 0.5505
 epoch: 96, train_loss: 0.8346, test_loss: 0.8545, test_f1: 0.5567
 epoch: 97, train_loss: 0.8400, test_loss: 0.8548, test_f1: 0.5485
 epoch: 98, train_loss: 0.8435, test_loss: 0.8597, test_f1: 0.5491
 epoch: 99, train_loss: 0.8423, test_loss: 0.8527, test_f1: 0.5562
##################ITERATION #5 ****************************************
 epoch: 0, train_loss: 1.3114, test_loss: 1.3172, test_f1: 0.2270
 epoch: 1, train_loss: 1.2514, test_loss: 1.2993, test_f1: 0.2270
 epoch: 2, train_loss: 1.2193, test_loss: 1.2637, test_f1: 0.2270
 epoch: 3, train_loss: 1.1949, test_loss: 1.2078, test_f1: 0.3080
 epoch: 4, train_loss: 1.1671, test_loss: 1.1464, test_f1: 0.3497
 epoch: 5, train_loss: 1.1376, test_loss: 1.1048, test_f1: 0.3833
 epoch: 6, train_loss: 1.1182, test_loss: 1.0810, test_f1: 0.4125
 epoch: 7, train_loss: 1.1050, test_loss: 1.0624, test_f1: 0.4265
 epoch: 8, train_loss: 1.0873, test_loss: 1.0498, test_f1: 0.4346
 epoch: 9, train_loss: 1.0762, test_loss: 1.0396, test_f1: 0.4477
 epoch: 10, train_loss: 1.0578, test_loss: 1.0298, test_f1: 0.4502
 epoch: 11, train_loss: 1.0550, test_loss: 1.0214, test_f1: 0.4454
 epoch: 12, train_loss: 1.0430, test_loss: 1.0162, test_f1: 0.4408
 epoch: 13, train_loss: 1.0289, test_loss: 1.0074, test_f1: 0.4534
 epoch: 14, train_loss: 1.0280, test_loss: 1.0007, test_f1: 0.4621
 epoch: 15, train_loss: 1.0177, test_loss: 0.9926, test_f1: 0.4679
 epoch: 16, train_loss: 1.0117, test_loss: 0.9871, test_f1: 0.4742
 epoch: 17, train_loss: 0.9989, test_loss: 0.9835, test_f1: 0.4800
 epoch: 18, train_loss: 1.0040, test_loss: 0.9788, test_f1: 0.4814
 epoch: 19, train_loss: 0.9953, test_loss: 0.9790, test_f1: 0.4840
 epoch: 20, train_loss: 0.9936, test_loss: 0.9751, test_f1: 0.4865
 epoch: 21, train_loss: 0.9847, test_loss: 0.9685, test_f1: 0.4865
 epoch: 22, train_loss: 0.9792, test_loss: 0.9668, test_f1: 0.4848
 epoch: 23, train_loss: 0.9712, test_loss: 0.9617, test_f1: 0.4883
 epoch: 24, train_loss: 0.9673, test_loss: 0.9596, test_f1: 0.4902
 epoch: 25, train_loss: 0.9657, test_loss: 0.9545, test_f1: 0.4841
 epoch: 26, train_loss: 0.9707, test_loss: 0.9506, test_f1: 0.4914
 epoch: 27, train_loss: 0.9617, test_loss: 0.9476, test_f1: 0.4862
 epoch: 28, train_loss: 0.9566, test_loss: 0.9472, test_f1: 0.4788
 epoch: 29, train_loss: 0.9485, test_loss: 0.9481, test_f1: 0.4998
 epoch: 30, train_loss: 0.9524, test_loss: 0.9435, test_f1: 0.4920
 epoch: 31, train_loss: 0.9500, test_loss: 0.9415, test_f1: 0.5015
 epoch: 32, train_loss: 0.9446, test_loss: 0.9347, test_f1: 0.5139
 epoch: 33, train_loss: 0.9410, test_loss: 0.9367, test_f1: 0.5022
 epoch: 34, train_loss: 0.9307, test_loss: 0.9341, test_f1: 0.5127
 epoch: 35, train_loss: 0.9264, test_loss: 0.9304, test_f1: 0.5185
 epoch: 36, train_loss: 0.9317, test_loss: 0.9273, test_f1: 0.5122
 epoch: 37, train_loss: 0.9281, test_loss: 0.9201, test_f1: 0.5194
 epoch: 38, train_loss: 0.9229, test_loss: 0.9188, test_f1: 0.5204
 epoch: 39, train_loss: 0.9216, test_loss: 0.9166, test_f1: 0.5221
 epoch: 40, train_loss: 0.9226, test_loss: 0.9159, test_f1: 0.5314
 epoch: 41, train_loss: 0.9098, test_loss: 0.9111, test_f1: 0.5301
 epoch: 42, train_loss: 0.9117, test_loss: 0.9053, test_f1: 0.5391
 epoch: 43, train_loss: 0.9094, test_loss: 0.9067, test_f1: 0.5269
 epoch: 44, train_loss: 0.9106, test_loss: 0.9078, test_f1: 0.5280
 epoch: 45, train_loss: 0.9034, test_loss: 0.9057, test_f1: 0.5366
 epoch: 46, train_loss: 0.8975, test_loss: 0.9046, test_f1: 0.5321
 epoch: 47, train_loss: 0.8955, test_loss: 0.8976, test_f1: 0.5372
 epoch: 48, train_loss: 0.8944, test_loss: 0.8979, test_f1: 0.5404
 epoch: 49, train_loss: 0.8991, test_loss: 0.8984, test_f1: 0.5341
 epoch: 50, train_loss: 0.8954, test_loss: 0.8907, test_f1: 0.5376
 epoch: 51, train_loss: 0.8889, test_loss: 0.8959, test_f1: 0.5330
 epoch: 52, train_loss: 0.8825, test_loss: 0.8903, test_f1: 0.5290
 epoch: 53, train_loss: 0.8799, test_loss: 0.8893, test_f1: 0.5344
 epoch: 54, train_loss: 0.8825, test_loss: 0.8912, test_f1: 0.5345
 epoch: 55, train_loss: 0.8859, test_loss: 0.8902, test_f1: 0.5312
 epoch: 56, train_loss: 0.8843, test_loss: 0.8890, test_f1: 0.5293
 epoch: 57, train_loss: 0.8843, test_loss: 0.8908, test_f1: 0.5317
 epoch: 58, train_loss: 0.8726, test_loss: 0.8895, test_f1: 0.5353
 epoch: 59, train_loss: 0.8834, test_loss: 0.8888, test_f1: 0.5378
 epoch: 60, train_loss: 0.8834, test_loss: 0.8852, test_f1: 0.5348
 epoch: 61, train_loss: 0.8760, test_loss: 0.8847, test_f1: 0.5340
 epoch: 62, train_loss: 0.8764, test_loss: 0.8830, test_f1: 0.5332
 epoch: 63, train_loss: 0.8645, test_loss: 0.8828, test_f1: 0.5353
 epoch: 64, train_loss: 0.8703, test_loss: 0.8803, test_f1: 0.5421
 epoch: 65, train_loss: 0.8744, test_loss: 0.8803, test_f1: 0.5407
 epoch: 66, train_loss: 0.8734, test_loss: 0.8795, test_f1: 0.5434
 epoch: 67, train_loss: 0.8739, test_loss: 0.8791, test_f1: 0.5467
 epoch: 68, train_loss: 0.8679, test_loss: 0.8763, test_f1: 0.5362
 epoch: 69, train_loss: 0.8695, test_loss: 0.8742, test_f1: 0.5422
 epoch: 70, train_loss: 0.8695, test_loss: 0.8723, test_f1: 0.5432
 epoch: 71, train_loss: 0.8636, test_loss: 0.8785, test_f1: 0.5374
 epoch: 72, train_loss: 0.8648, test_loss: 0.8745, test_f1: 0.5410
 epoch: 73, train_loss: 0.8605, test_loss: 0.8713, test_f1: 0.5420
 epoch: 74, train_loss: 0.8580, test_loss: 0.8704, test_f1: 0.5430
 epoch: 75, train_loss: 0.8535, test_loss: 0.8709, test_f1: 0.5429
 epoch: 76, train_loss: 0.8546, test_loss: 0.8738, test_f1: 0.5359
 epoch: 77, train_loss: 0.8593, test_loss: 0.8662, test_f1: 0.5417
 epoch: 78, train_loss: 0.8533, test_loss: 0.8679, test_f1: 0.5443
 epoch: 79, train_loss: 0.8554, test_loss: 0.8683, test_f1: 0.5400
 epoch: 80, train_loss: 0.8552, test_loss: 0.8665, test_f1: 0.5414
 epoch: 81, train_loss: 0.8586, test_loss: 0.8639, test_f1: 0.5404
 epoch: 82, train_loss: 0.8518, test_loss: 0.8655, test_f1: 0.5387
 epoch: 83, train_loss: 0.8532, test_loss: 0.8659, test_f1: 0.5422
 epoch: 84, train_loss: 0.8486, test_loss: 0.8654, test_f1: 0.5434
 epoch: 85, train_loss: 0.8490, test_loss: 0.8633, test_f1: 0.5452
 epoch: 86, train_loss: 0.8492, test_loss: 0.8637, test_f1: 0.5407
 epoch: 87, train_loss: 0.8503, test_loss: 0.8585, test_f1: 0.5454
 epoch: 88, train_loss: 0.8519, test_loss: 0.8598, test_f1: 0.5422
 epoch: 89, train_loss: 0.8413, test_loss: 0.8608, test_f1: 0.5477
 epoch: 90, train_loss: 0.8555, test_loss: 0.8611, test_f1: 0.5407
 epoch: 91, train_loss: 0.8436, test_loss: 0.8582, test_f1: 0.5473
 epoch: 92, train_loss: 0.8396, test_loss: 0.8603, test_f1: 0.5443
 epoch: 93, train_loss: 0.8347, test_loss: 0.8577, test_f1: 0.5442
 epoch: 94, train_loss: 0.8334, test_loss: 0.8529, test_f1: 0.5422
 epoch: 95, train_loss: 0.8438, test_loss: 0.8515, test_f1: 0.5460
 epoch: 96, train_loss: 0.8386, test_loss: 0.8572, test_f1: 0.5479
 epoch: 97, train_loss: 0.8321, test_loss: 0.8585, test_f1: 0.5439
 epoch: 98, train_loss: 0.8281, test_loss: 0.8577, test_f1: 0.5430
 epoch: 99, train_loss: 0.8357, test_loss: 0.8533, test_f1: 0.5479
##################ITERATION #6 ****************************************
 epoch: 0, train_loss: 1.3046, test_loss: 1.3148, test_f1: 0.2270
 epoch: 1, train_loss: 1.2322, test_loss: 1.2937, test_f1: 0.2270
 epoch: 2, train_loss: 1.2058, test_loss: 1.2298, test_f1: 0.2251
 epoch: 3, train_loss: 1.1762, test_loss: 1.1588, test_f1: 0.3351
 epoch: 4, train_loss: 1.1536, test_loss: 1.1140, test_f1: 0.4050
 epoch: 5, train_loss: 1.1276, test_loss: 1.0858, test_f1: 0.4219
 epoch: 6, train_loss: 1.1118, test_loss: 1.0629, test_f1: 0.4287
 epoch: 7, train_loss: 1.0902, test_loss: 1.0451, test_f1: 0.4294
 epoch: 8, train_loss: 1.0810, test_loss: 1.0331, test_f1: 0.4560
 epoch: 9, train_loss: 1.0665, test_loss: 1.0244, test_f1: 0.4568
 epoch: 10, train_loss: 1.0544, test_loss: 1.0176, test_f1: 0.4530
 epoch: 11, train_loss: 1.0489, test_loss: 1.0113, test_f1: 0.4628
 epoch: 12, train_loss: 1.0382, test_loss: 1.0051, test_f1: 0.4616
 epoch: 13, train_loss: 1.0327, test_loss: 0.9996, test_f1: 0.4566
 epoch: 14, train_loss: 1.0234, test_loss: 0.9975, test_f1: 0.4612
 epoch: 15, train_loss: 1.0169, test_loss: 0.9945, test_f1: 0.4714
 epoch: 16, train_loss: 1.0109, test_loss: 0.9894, test_f1: 0.4691
 epoch: 17, train_loss: 1.0108, test_loss: 0.9838, test_f1: 0.4714
 epoch: 18, train_loss: 1.0035, test_loss: 0.9823, test_f1: 0.4713
 epoch: 19, train_loss: 0.9965, test_loss: 0.9785, test_f1: 0.4797
 epoch: 20, train_loss: 0.9989, test_loss: 0.9747, test_f1: 0.4766
 epoch: 21, train_loss: 0.9986, test_loss: 0.9721, test_f1: 0.4794
 epoch: 22, train_loss: 0.9855, test_loss: 0.9681, test_f1: 0.4839
 epoch: 23, train_loss: 0.9828, test_loss: 0.9666, test_f1: 0.4821
 epoch: 24, train_loss: 0.9789, test_loss: 0.9691, test_f1: 0.4882
 epoch: 25, train_loss: 0.9743, test_loss: 0.9666, test_f1: 0.4900
 epoch: 26, train_loss: 0.9689, test_loss: 0.9596, test_f1: 0.4858
 epoch: 27, train_loss: 0.9704, test_loss: 0.9593, test_f1: 0.4883
 epoch: 28, train_loss: 0.9692, test_loss: 0.9578, test_f1: 0.4934
 epoch: 29, train_loss: 0.9676, test_loss: 0.9590, test_f1: 0.4917
 epoch: 30, train_loss: 0.9643, test_loss: 0.9569, test_f1: 0.4861
 epoch: 31, train_loss: 0.9623, test_loss: 0.9564, test_f1: 0.4844
 epoch: 32, train_loss: 0.9494, test_loss: 0.9520, test_f1: 0.4831
 epoch: 33, train_loss: 0.9480, test_loss: 0.9528, test_f1: 0.4831
 epoch: 34, train_loss: 0.9475, test_loss: 0.9468, test_f1: 0.4993
 epoch: 35, train_loss: 0.9412, test_loss: 0.9461, test_f1: 0.4961
 epoch: 36, train_loss: 0.9440, test_loss: 0.9407, test_f1: 0.4971
 epoch: 37, train_loss: 0.9371, test_loss: 0.9431, test_f1: 0.5025
 epoch: 38, train_loss: 0.9376, test_loss: 0.9351, test_f1: 0.5017
 epoch: 39, train_loss: 0.9384, test_loss: 0.9424, test_f1: 0.4994
 epoch: 40, train_loss: 0.9326, test_loss: 0.9303, test_f1: 0.5095
 epoch: 41, train_loss: 0.9249, test_loss: 0.9326, test_f1: 0.5125
 epoch: 42, train_loss: 0.9285, test_loss: 0.9289, test_f1: 0.5084
 epoch: 43, train_loss: 0.9207, test_loss: 0.9248, test_f1: 0.5108
 epoch: 44, train_loss: 0.9170, test_loss: 0.9207, test_f1: 0.5073
 epoch: 45, train_loss: 0.9195, test_loss: 0.9225, test_f1: 0.5022
 epoch: 46, train_loss: 0.9147, test_loss: 0.9172, test_f1: 0.5148
 epoch: 47, train_loss: 0.9109, test_loss: 0.9213, test_f1: 0.5396
 epoch: 48, train_loss: 0.9076, test_loss: 0.9141, test_f1: 0.4999
 epoch: 49, train_loss: 0.9135, test_loss: 0.9128, test_f1: 0.5109
 epoch: 50, train_loss: 0.9061, test_loss: 0.9209, test_f1: 0.5253
 epoch: 51, train_loss: 0.9000, test_loss: 0.9152, test_f1: 0.5325
 epoch: 52, train_loss: 0.8958, test_loss: 0.9121, test_f1: 0.5201
 epoch: 53, train_loss: 0.8983, test_loss: 0.9026, test_f1: 0.5307
 epoch: 54, train_loss: 0.8943, test_loss: 0.9010, test_f1: 0.5367
 epoch: 55, train_loss: 0.8919, test_loss: 0.9053, test_f1: 0.5314
 epoch: 56, train_loss: 0.8939, test_loss: 0.9026, test_f1: 0.5365
 epoch: 57, train_loss: 0.8979, test_loss: 0.8963, test_f1: 0.5344
 epoch: 58, train_loss: 0.8902, test_loss: 0.8994, test_f1: 0.5352
 epoch: 59, train_loss: 0.8947, test_loss: 0.9034, test_f1: 0.5242
 epoch: 60, train_loss: 0.8890, test_loss: 0.9051, test_f1: 0.5263
 epoch: 61, train_loss: 0.8896, test_loss: 0.9013, test_f1: 0.5260
 epoch: 62, train_loss: 0.8907, test_loss: 0.8978, test_f1: 0.5285
 epoch: 63, train_loss: 0.8774, test_loss: 0.8953, test_f1: 0.5324
 epoch: 64, train_loss: 0.8819, test_loss: 0.8917, test_f1: 0.5312
 epoch: 65, train_loss: 0.8782, test_loss: 0.8934, test_f1: 0.5329
 epoch: 66, train_loss: 0.8802, test_loss: 0.8939, test_f1: 0.5307
 epoch: 67, train_loss: 0.8769, test_loss: 0.8946, test_f1: 0.5330
 epoch: 68, train_loss: 0.8797, test_loss: 0.8924, test_f1: 0.5335
 epoch: 69, train_loss: 0.8809, test_loss: 0.9019, test_f1: 0.5285
 epoch: 70, train_loss: 0.8722, test_loss: 0.8921, test_f1: 0.5320
 epoch: 71, train_loss: 0.8734, test_loss: 0.8982, test_f1: 0.5325
 epoch: 72, train_loss: 0.8791, test_loss: 0.8872, test_f1: 0.5341
 epoch: 73, train_loss: 0.8740, test_loss: 0.8887, test_f1: 0.5311
 epoch: 74, train_loss: 0.8771, test_loss: 0.8943, test_f1: 0.5349
 epoch: 75, train_loss: 0.8728, test_loss: 0.8829, test_f1: 0.5295
 epoch: 76, train_loss: 0.8678, test_loss: 0.8911, test_f1: 0.5343
 epoch: 77, train_loss: 0.8684, test_loss: 0.8807, test_f1: 0.5307
 epoch: 78, train_loss: 0.8656, test_loss: 0.8938, test_f1: 0.5312
 epoch: 79, train_loss: 0.8599, test_loss: 0.8852, test_f1: 0.5413
 epoch: 80, train_loss: 0.8559, test_loss: 0.8820, test_f1: 0.5377
 epoch: 81, train_loss: 0.8601, test_loss: 0.8759, test_f1: 0.5394
 epoch: 82, train_loss: 0.8608, test_loss: 0.8800, test_f1: 0.5425
 epoch: 83, train_loss: 0.8541, test_loss: 0.8825, test_f1: 0.5373
 epoch: 84, train_loss: 0.8446, test_loss: 0.8812, test_f1: 0.5416
 epoch: 85, train_loss: 0.8553, test_loss: 0.8779, test_f1: 0.5400
 epoch: 86, train_loss: 0.8553, test_loss: 0.8801, test_f1: 0.5398
 epoch: 87, train_loss: 0.8553, test_loss: 0.8845, test_f1: 0.5390
 epoch: 88, train_loss: 0.8522, test_loss: 0.8720, test_f1: 0.5360
 epoch: 89, train_loss: 0.8498, test_loss: 0.8731, test_f1: 0.5393
 epoch: 90, train_loss: 0.8502, test_loss: 0.8723, test_f1: 0.5362
 epoch: 91, train_loss: 0.8454, test_loss: 0.8772, test_f1: 0.5407
 epoch: 92, train_loss: 0.8493, test_loss: 0.8714, test_f1: 0.5408
 epoch: 93, train_loss: 0.8436, test_loss: 0.8639, test_f1: 0.5467
 epoch: 94, train_loss: 0.8463, test_loss: 0.8763, test_f1: 0.5519
 epoch: 95, train_loss: 0.8435, test_loss: 0.8775, test_f1: 0.5475
 epoch: 96, train_loss: 0.8405, test_loss: 0.8676, test_f1: 0.5508
 epoch: 97, train_loss: 0.8401, test_loss: 0.8737, test_f1: 0.5460
 epoch: 98, train_loss: 0.8446, test_loss: 0.8775, test_f1: 0.5456
 epoch: 99, train_loss: 0.8414, test_loss: 0.8729, test_f1: 0.5509
##################ITERATION #7 ****************************************
 epoch: 0, train_loss: 1.2885, test_loss: 1.3066, test_f1: 0.2270
 epoch: 1, train_loss: 1.2227, test_loss: 1.2804, test_f1: 0.2270
 epoch: 2, train_loss: 1.1844, test_loss: 1.2381, test_f1: 0.2270
 epoch: 3, train_loss: 1.1591, test_loss: 1.1739, test_f1: 0.2384
 epoch: 4, train_loss: 1.1234, test_loss: 1.1134, test_f1: 0.4218
 epoch: 5, train_loss: 1.1041, test_loss: 1.0768, test_f1: 0.4410
 epoch: 6, train_loss: 1.0883, test_loss: 1.0549, test_f1: 0.4654
 epoch: 7, train_loss: 1.0805, test_loss: 1.0407, test_f1: 0.4706
 epoch: 8, train_loss: 1.0653, test_loss: 1.0340, test_f1: 0.4707
 epoch: 9, train_loss: 1.0488, test_loss: 1.0218, test_f1: 0.4680
 epoch: 10, train_loss: 1.0364, test_loss: 1.0166, test_f1: 0.4685
 epoch: 11, train_loss: 1.0294, test_loss: 1.0089, test_f1: 0.4760
 epoch: 12, train_loss: 1.0224, test_loss: 1.0012, test_f1: 0.4763
 epoch: 13, train_loss: 1.0141, test_loss: 0.9970, test_f1: 0.4769
 epoch: 14, train_loss: 1.0140, test_loss: 0.9920, test_f1: 0.4812
 epoch: 15, train_loss: 1.0020, test_loss: 0.9807, test_f1: 0.4834
 epoch: 16, train_loss: 0.9954, test_loss: 0.9765, test_f1: 0.4847
 epoch: 17, train_loss: 0.9900, test_loss: 0.9724, test_f1: 0.4977
 epoch: 18, train_loss: 0.9807, test_loss: 0.9669, test_f1: 0.5016
 epoch: 19, train_loss: 0.9769, test_loss: 0.9613, test_f1: 0.4901
 epoch: 20, train_loss: 0.9676, test_loss: 0.9560, test_f1: 0.5220
 epoch: 21, train_loss: 0.9665, test_loss: 0.9508, test_f1: 0.5123
 epoch: 22, train_loss: 0.9618, test_loss: 0.9486, test_f1: 0.5110
 epoch: 23, train_loss: 0.9511, test_loss: 0.9444, test_f1: 0.5230
 epoch: 24, train_loss: 0.9455, test_loss: 0.9356, test_f1: 0.5248
 epoch: 25, train_loss: 0.9437, test_loss: 0.9365, test_f1: 0.5266
 epoch: 26, train_loss: 0.9342, test_loss: 0.9321, test_f1: 0.5153
 epoch: 27, train_loss: 0.9313, test_loss: 0.9244, test_f1: 0.5274
 epoch: 28, train_loss: 0.9304, test_loss: 0.9303, test_f1: 0.5366
 epoch: 29, train_loss: 0.9259, test_loss: 0.9286, test_f1: 0.5200
 epoch: 30, train_loss: 0.9238, test_loss: 0.9277, test_f1: 0.5076
 epoch: 31, train_loss: 0.9177, test_loss: 0.9225, test_f1: 0.5285
 epoch: 32, train_loss: 0.9137, test_loss: 0.9253, test_f1: 0.5243
 epoch: 33, train_loss: 0.9058, test_loss: 0.9206, test_f1: 0.5254
 epoch: 34, train_loss: 0.9023, test_loss: 0.9158, test_f1: 0.5197
 epoch: 35, train_loss: 0.9037, test_loss: 0.9158, test_f1: 0.5331
 epoch: 36, train_loss: 0.9002, test_loss: 0.9165, test_f1: 0.5174
 epoch: 37, train_loss: 0.8945, test_loss: 0.9183, test_f1: 0.5313
 epoch: 38, train_loss: 0.8933, test_loss: 0.9098, test_f1: 0.5196
 epoch: 39, train_loss: 0.8932, test_loss: 0.9048, test_f1: 0.5277
 epoch: 40, train_loss: 0.8801, test_loss: 0.9033, test_f1: 0.5367
 epoch: 41, train_loss: 0.8821, test_loss: 0.9068, test_f1: 0.5437
 epoch: 42, train_loss: 0.8792, test_loss: 0.9043, test_f1: 0.5338
 epoch: 43, train_loss: 0.8723, test_loss: 0.8982, test_f1: 0.5356
 epoch: 44, train_loss: 0.8716, test_loss: 0.9010, test_f1: 0.5418
 epoch: 45, train_loss: 0.8628, test_loss: 0.8995, test_f1: 0.5449
 epoch: 46, train_loss: 0.8661, test_loss: 0.8980, test_f1: 0.5457
 epoch: 47, train_loss: 0.8682, test_loss: 0.8940, test_f1: 0.5517
 epoch: 48, train_loss: 0.8526, test_loss: 0.9002, test_f1: 0.5400
 epoch: 49, train_loss: 0.8596, test_loss: 0.8915, test_f1: 0.5541
 epoch: 50, train_loss: 0.8498, test_loss: 0.8917, test_f1: 0.5509
 epoch: 51, train_loss: 0.8546, test_loss: 0.8885, test_f1: 0.5506
 epoch: 52, train_loss: 0.8486, test_loss: 0.8861, test_f1: 0.5540
 epoch: 53, train_loss: 0.8513, test_loss: 0.8866, test_f1: 0.5542
 epoch: 54, train_loss: 0.8432, test_loss: 0.8918, test_f1: 0.5504
 epoch: 55, train_loss: 0.8401, test_loss: 0.8846, test_f1: 0.5472
 epoch: 56, train_loss: 0.8417, test_loss: 0.8847, test_f1: 0.5486
 epoch: 57, train_loss: 0.8372, test_loss: 0.8831, test_f1: 0.5533
 epoch: 58, train_loss: 0.8374, test_loss: 0.8786, test_f1: 0.5499
 epoch: 59, train_loss: 0.8357, test_loss: 0.8824, test_f1: 0.5496
 epoch: 60, train_loss: 0.8398, test_loss: 0.8825, test_f1: 0.5524
 epoch: 61, train_loss: 0.8362, test_loss: 0.8777, test_f1: 0.5558
 epoch: 62, train_loss: 0.8320, test_loss: 0.8759, test_f1: 0.5591
 epoch: 63, train_loss: 0.8395, test_loss: 0.8779, test_f1: 0.5609
 epoch: 64, train_loss: 0.8333, test_loss: 0.8781, test_f1: 0.5545
 epoch: 65, train_loss: 0.8294, test_loss: 0.8736, test_f1: 0.5575
 epoch: 66, train_loss: 0.8303, test_loss: 0.8713, test_f1: 0.5548
 epoch: 67, train_loss: 0.8326, test_loss: 0.8751, test_f1: 0.5564
 epoch: 68, train_loss: 0.8307, test_loss: 0.8756, test_f1: 0.5584
 epoch: 69, train_loss: 0.8247, test_loss: 0.8743, test_f1: 0.5542
 epoch: 70, train_loss: 0.8148, test_loss: 0.8712, test_f1: 0.5545
 epoch: 71, train_loss: 0.8172, test_loss: 0.8739, test_f1: 0.5579
 epoch: 72, train_loss: 0.8237, test_loss: 0.8703, test_f1: 0.5567
 epoch: 73, train_loss: 0.8176, test_loss: 0.8712, test_f1: 0.5567
 epoch: 74, train_loss: 0.8174, test_loss: 0.8767, test_f1: 0.5560
 epoch: 75, train_loss: 0.8186, test_loss: 0.8705, test_f1: 0.5624
 epoch: 76, train_loss: 0.8148, test_loss: 0.8647, test_f1: 0.5613
 epoch: 77, train_loss: 0.8128, test_loss: 0.8710, test_f1: 0.5563
 epoch: 78, train_loss: 0.8086, test_loss: 0.8716, test_f1: 0.5690
 epoch: 79, train_loss: 0.8072, test_loss: 0.8705, test_f1: 0.5606
 epoch: 80, train_loss: 0.8074, test_loss: 0.8661, test_f1: 0.5564
 epoch: 81, train_loss: 0.8068, test_loss: 0.8680, test_f1: 0.5564
 epoch: 82, train_loss: 0.8083, test_loss: 0.8628, test_f1: 0.5602
 epoch: 83, train_loss: 0.8047, test_loss: 0.8625, test_f1: 0.5577
 epoch: 84, train_loss: 0.7996, test_loss: 0.8654, test_f1: 0.5600
 epoch: 85, train_loss: 0.8006, test_loss: 0.8603, test_f1: 0.5634
 epoch: 86, train_loss: 0.8083, test_loss: 0.8634, test_f1: 0.5663
 epoch: 87, train_loss: 0.8032, test_loss: 0.8639, test_f1: 0.5636
 epoch: 88, train_loss: 0.7926, test_loss: 0.8611, test_f1: 0.5645
 epoch: 89, train_loss: 0.7940, test_loss: 0.8574, test_f1: 0.5650
 epoch: 90, train_loss: 0.8003, test_loss: 0.8588, test_f1: 0.5619
 epoch: 91, train_loss: 0.7927, test_loss: 0.8584, test_f1: 0.5641
 epoch: 92, train_loss: 0.8014, test_loss: 0.8617, test_f1: 0.5617
 epoch: 93, train_loss: 0.7925, test_loss: 0.8606, test_f1: 0.5662
 epoch: 94, train_loss: 0.7920, test_loss: 0.8589, test_f1: 0.5661
 epoch: 95, train_loss: 0.7922, test_loss: 0.8632, test_f1: 0.5632
 epoch: 96, train_loss: 0.7924, test_loss: 0.8595, test_f1: 0.5644
 epoch: 97, train_loss: 0.7931, test_loss: 0.8604, test_f1: 0.5641
 epoch: 98, train_loss: 0.7829, test_loss: 0.8597, test_f1: 0.5677
 epoch: 99, train_loss: 0.7785, test_loss: 0.8595, test_f1: 0.5656
##################ITERATION #8 ****************************************
 epoch: 0, train_loss: 1.3149, test_loss: 1.3447, test_f1: 0.2270
 epoch: 1, train_loss: 1.1949, test_loss: 1.3162, test_f1: 0.2270
 epoch: 2, train_loss: 1.1522, test_loss: 1.2430, test_f1: 0.2270
 epoch: 3, train_loss: 1.1209, test_loss: 1.1430, test_f1: 0.3102
 epoch: 4, train_loss: 1.0959, test_loss: 1.0697, test_f1: 0.3843
 epoch: 5, train_loss: 1.0819, test_loss: 1.0409, test_f1: 0.4250
 epoch: 6, train_loss: 1.0613, test_loss: 1.0293, test_f1: 0.4368
 epoch: 7, train_loss: 1.0482, test_loss: 1.0237, test_f1: 0.4510
 epoch: 8, train_loss: 1.0427, test_loss: 1.0171, test_f1: 0.4601
 epoch: 9, train_loss: 1.0376, test_loss: 1.0140, test_f1: 0.4544
 epoch: 10, train_loss: 1.0338, test_loss: 1.0079, test_f1: 0.4645
 epoch: 11, train_loss: 1.0233, test_loss: 1.0045, test_f1: 0.4690
 epoch: 12, train_loss: 1.0112, test_loss: 0.9997, test_f1: 0.4809
 epoch: 13, train_loss: 1.0106, test_loss: 0.9911, test_f1: 0.4926
 epoch: 14, train_loss: 1.0020, test_loss: 0.9861, test_f1: 0.4971
 epoch: 15, train_loss: 0.9978, test_loss: 0.9846, test_f1: 0.4953
 epoch: 16, train_loss: 0.9923, test_loss: 0.9811, test_f1: 0.5109
 epoch: 17, train_loss: 0.9883, test_loss: 0.9729, test_f1: 0.5205
 epoch: 18, train_loss: 0.9847, test_loss: 0.9694, test_f1: 0.5142
 epoch: 19, train_loss: 0.9750, test_loss: 0.9754, test_f1: 0.5196
 epoch: 20, train_loss: 0.9749, test_loss: 0.9631, test_f1: 0.5153
 epoch: 21, train_loss: 0.9760, test_loss: 0.9582, test_f1: 0.5086
 epoch: 22, train_loss: 0.9700, test_loss: 0.9566, test_f1: 0.5118
 epoch: 23, train_loss: 0.9662, test_loss: 0.9533, test_f1: 0.5210
 epoch: 24, train_loss: 0.9607, test_loss: 0.9515, test_f1: 0.5125
 epoch: 25, train_loss: 0.9504, test_loss: 0.9471, test_f1: 0.5158
 epoch: 26, train_loss: 0.9554, test_loss: 0.9524, test_f1: 0.5227
 epoch: 27, train_loss: 0.9427, test_loss: 0.9477, test_f1: 0.5210
 epoch: 28, train_loss: 0.9494, test_loss: 0.9432, test_f1: 0.5246
 epoch: 29, train_loss: 0.9445, test_loss: 0.9410, test_f1: 0.5257
 epoch: 30, train_loss: 0.9436, test_loss: 0.9392, test_f1: 0.5271
 epoch: 31, train_loss: 0.9337, test_loss: 0.9355, test_f1: 0.5462
 epoch: 32, train_loss: 0.9356, test_loss: 0.9372, test_f1: 0.5285
 epoch: 33, train_loss: 0.9313, test_loss: 0.9314, test_f1: 0.5242
 epoch: 34, train_loss: 0.9299, test_loss: 0.9289, test_f1: 0.5274
 epoch: 35, train_loss: 0.9275, test_loss: 0.9319, test_f1: 0.5226
 epoch: 36, train_loss: 0.9241, test_loss: 0.9288, test_f1: 0.5247
 epoch: 37, train_loss: 0.9148, test_loss: 0.9170, test_f1: 0.5276
 epoch: 38, train_loss: 0.9181, test_loss: 0.9186, test_f1: 0.5317
 epoch: 39, train_loss: 0.9167, test_loss: 0.9139, test_f1: 0.5390
 epoch: 40, train_loss: 0.9134, test_loss: 0.9197, test_f1: 0.5345
 epoch: 41, train_loss: 0.9054, test_loss: 0.9084, test_f1: 0.5382
 epoch: 42, train_loss: 0.9020, test_loss: 0.9130, test_f1: 0.5455
 epoch: 43, train_loss: 0.8991, test_loss: 0.9124, test_f1: 0.5417
 epoch: 44, train_loss: 0.9012, test_loss: 0.9124, test_f1: 0.5415
 epoch: 45, train_loss: 0.8953, test_loss: 0.9040, test_f1: 0.5396
 epoch: 46, train_loss: 0.8930, test_loss: 0.9023, test_f1: 0.5534
 epoch: 47, train_loss: 0.8954, test_loss: 0.8957, test_f1: 0.5356
 epoch: 48, train_loss: 0.8850, test_loss: 0.9040, test_f1: 0.5354
 epoch: 49, train_loss: 0.8815, test_loss: 0.8996, test_f1: 0.5508
 epoch: 50, train_loss: 0.8871, test_loss: 0.9002, test_f1: 0.5556
 epoch: 51, train_loss: 0.8735, test_loss: 0.8981, test_f1: 0.5505
 epoch: 52, train_loss: 0.8706, test_loss: 0.9005, test_f1: 0.5591
 epoch: 53, train_loss: 0.8733, test_loss: 0.8922, test_f1: 0.5612
 epoch: 54, train_loss: 0.8752, test_loss: 0.8910, test_f1: 0.5591
 epoch: 55, train_loss: 0.8712, test_loss: 0.8931, test_f1: 0.5524
 epoch: 56, train_loss: 0.8725, test_loss: 0.8920, test_f1: 0.5554
 epoch: 57, train_loss: 0.8733, test_loss: 0.8853, test_f1: 0.5467
 epoch: 58, train_loss: 0.8700, test_loss: 0.8913, test_f1: 0.5552
 epoch: 59, train_loss: 0.8704, test_loss: 0.8926, test_f1: 0.5576
 epoch: 60, train_loss: 0.8731, test_loss: 0.8905, test_f1: 0.5594
 epoch: 61, train_loss: 0.8655, test_loss: 0.8867, test_f1: 0.5637
 epoch: 62, train_loss: 0.8601, test_loss: 0.8881, test_f1: 0.5625
 epoch: 63, train_loss: 0.8637, test_loss: 0.8856, test_f1: 0.5627
 epoch: 64, train_loss: 0.8566, test_loss: 0.8853, test_f1: 0.5600
 epoch: 65, train_loss: 0.8662, test_loss: 0.8867, test_f1: 0.5615
 epoch: 66, train_loss: 0.8638, test_loss: 0.8845, test_f1: 0.5669
 epoch: 67, train_loss: 0.8603, test_loss: 0.8773, test_f1: 0.5625
 epoch: 68, train_loss: 0.8572, test_loss: 0.8850, test_f1: 0.5585
 epoch: 69, train_loss: 0.8553, test_loss: 0.8761, test_f1: 0.5693
 epoch: 70, train_loss: 0.8598, test_loss: 0.8790, test_f1: 0.5723
 epoch: 71, train_loss: 0.8581, test_loss: 0.8763, test_f1: 0.5726
 epoch: 72, train_loss: 0.8505, test_loss: 0.8791, test_f1: 0.5676
 epoch: 73, train_loss: 0.8475, test_loss: 0.8701, test_f1: 0.5723
 epoch: 74, train_loss: 0.8538, test_loss: 0.8756, test_f1: 0.5704
 epoch: 75, train_loss: 0.8532, test_loss: 0.8800, test_f1: 0.5585
 epoch: 76, train_loss: 0.8486, test_loss: 0.8724, test_f1: 0.5706
 epoch: 77, train_loss: 0.8461, test_loss: 0.8733, test_f1: 0.5745
 epoch: 78, train_loss: 0.8469, test_loss: 0.8760, test_f1: 0.5731
 epoch: 79, train_loss: 0.8458, test_loss: 0.8716, test_f1: 0.5710
 epoch: 80, train_loss: 0.8412, test_loss: 0.8737, test_f1: 0.5749
 epoch: 81, train_loss: 0.8413, test_loss: 0.8723, test_f1: 0.5689
 epoch: 82, train_loss: 0.8430, test_loss: 0.8709, test_f1: 0.5665
 epoch: 83, train_loss: 0.8387, test_loss: 0.8774, test_f1: 0.5721
 epoch: 84, train_loss: 0.8358, test_loss: 0.8756, test_f1: 0.5698
 epoch: 85, train_loss: 0.8359, test_loss: 0.8768, test_f1: 0.5730
 epoch: 86, train_loss: 0.8382, test_loss: 0.8713, test_f1: 0.5642
 epoch: 87, train_loss: 0.8299, test_loss: 0.8746, test_f1: 0.5689
 epoch: 88, train_loss: 0.8342, test_loss: 0.8765, test_f1: 0.5708
 epoch: 89, train_loss: 0.8295, test_loss: 0.8771, test_f1: 0.5607
 epoch: 90, train_loss: 0.8339, test_loss: 0.8689, test_f1: 0.5698
 epoch: 91, train_loss: 0.8349, test_loss: 0.8757, test_f1: 0.5762
 epoch: 92, train_loss: 0.8382, test_loss: 0.8727, test_f1: 0.5753
 epoch: 93, train_loss: 0.8351, test_loss: 0.8700, test_f1: 0.5696
 epoch: 94, train_loss: 0.8341, test_loss: 0.8711, test_f1: 0.5740
 epoch: 95, train_loss: 0.8283, test_loss: 0.8662, test_f1: 0.5729
 epoch: 96, train_loss: 0.8236, test_loss: 0.8720, test_f1: 0.5718
 epoch: 97, train_loss: 0.8226, test_loss: 0.8678, test_f1: 0.5744
 epoch: 98, train_loss: 0.8240, test_loss: 0.8659, test_f1: 0.5738
 epoch: 99, train_loss: 0.8224, test_loss: 0.8656, test_f1: 0.5756
##################ITERATION #9 ****************************************
 epoch: 0, train_loss: 1.3336, test_loss: 1.3183, test_f1: 0.2270
 epoch: 1, train_loss: 1.2243, test_loss: 1.2845, test_f1: 0.2270
 epoch: 2, train_loss: 1.1845, test_loss: 1.2402, test_f1: 0.2273
 epoch: 3, train_loss: 1.1490, test_loss: 1.1713, test_f1: 0.2859
 epoch: 4, train_loss: 1.1232, test_loss: 1.0976, test_f1: 0.3861
 epoch: 5, train_loss: 1.1064, test_loss: 1.0569, test_f1: 0.4352
 epoch: 6, train_loss: 1.0830, test_loss: 1.0356, test_f1: 0.4321
 epoch: 7, train_loss: 1.0747, test_loss: 1.0212, test_f1: 0.4315
 epoch: 8, train_loss: 1.0599, test_loss: 1.0105, test_f1: 0.4358
 epoch: 9, train_loss: 1.0557, test_loss: 1.0025, test_f1: 0.4395
 epoch: 10, train_loss: 1.0452, test_loss: 0.9950, test_f1: 0.4517
 epoch: 11, train_loss: 1.0333, test_loss: 0.9881, test_f1: 0.4584
 epoch: 12, train_loss: 1.0274, test_loss: 0.9825, test_f1: 0.4591
 epoch: 13, train_loss: 1.0186, test_loss: 0.9772, test_f1: 0.4647
 epoch: 14, train_loss: 1.0138, test_loss: 0.9744, test_f1: 0.4584
 epoch: 15, train_loss: 0.9974, test_loss: 0.9668, test_f1: 0.4780
 epoch: 16, train_loss: 1.0019, test_loss: 0.9618, test_f1: 0.4814
 epoch: 17, train_loss: 0.9932, test_loss: 0.9597, test_f1: 0.4774
 epoch: 18, train_loss: 0.9849, test_loss: 0.9552, test_f1: 0.4759
 epoch: 19, train_loss: 0.9792, test_loss: 0.9509, test_f1: 0.4766
 epoch: 20, train_loss: 0.9746, test_loss: 0.9495, test_f1: 0.4808
 epoch: 21, train_loss: 0.9668, test_loss: 0.9441, test_f1: 0.4778
 epoch: 22, train_loss: 0.9637, test_loss: 0.9427, test_f1: 0.4838
 epoch: 23, train_loss: 0.9668, test_loss: 0.9386, test_f1: 0.4834
 epoch: 24, train_loss: 0.9602, test_loss: 0.9349, test_f1: 0.4941
 epoch: 25, train_loss: 0.9529, test_loss: 0.9356, test_f1: 0.4962
 epoch: 26, train_loss: 0.9492, test_loss: 0.9292, test_f1: 0.5013
 epoch: 27, train_loss: 0.9497, test_loss: 0.9274, test_f1: 0.5082
 epoch: 28, train_loss: 0.9437, test_loss: 0.9256, test_f1: 0.5012
 epoch: 29, train_loss: 0.9425, test_loss: 0.9227, test_f1: 0.5135
 epoch: 30, train_loss: 0.9362, test_loss: 0.9187, test_f1: 0.5135
 epoch: 31, train_loss: 0.9337, test_loss: 0.9175, test_f1: 0.5112
 epoch: 32, train_loss: 0.9376, test_loss: 0.9164, test_f1: 0.5172
 epoch: 33, train_loss: 0.9269, test_loss: 0.9142, test_f1: 0.5203
 epoch: 34, train_loss: 0.9208, test_loss: 0.9102, test_f1: 0.5199
 epoch: 35, train_loss: 0.9278, test_loss: 0.9058, test_f1: 0.5228
 epoch: 36, train_loss: 0.9217, test_loss: 0.9066, test_f1: 0.5266
 epoch: 37, train_loss: 0.9194, test_loss: 0.9021, test_f1: 0.5236
 epoch: 38, train_loss: 0.9134, test_loss: 0.9054, test_f1: 0.5301
 epoch: 39, train_loss: 0.9059, test_loss: 0.9030, test_f1: 0.5315
 epoch: 40, train_loss: 0.9085, test_loss: 0.9013, test_f1: 0.5324
 epoch: 41, train_loss: 0.9069, test_loss: 0.8973, test_f1: 0.5310
 epoch: 42, train_loss: 0.9073, test_loss: 0.8948, test_f1: 0.5359
 epoch: 43, train_loss: 0.8960, test_loss: 0.8935, test_f1: 0.5445
 epoch: 44, train_loss: 0.8985, test_loss: 0.8916, test_f1: 0.5454
 epoch: 45, train_loss: 0.8938, test_loss: 0.8916, test_f1: 0.5408
 epoch: 46, train_loss: 0.8878, test_loss: 0.8885, test_f1: 0.5384
 epoch: 47, train_loss: 0.8880, test_loss: 0.8874, test_f1: 0.5409
 epoch: 48, train_loss: 0.8904, test_loss: 0.8846, test_f1: 0.5427
 epoch: 49, train_loss: 0.8795, test_loss: 0.8853, test_f1: 0.5441
 epoch: 50, train_loss: 0.8797, test_loss: 0.8824, test_f1: 0.5451
 epoch: 51, train_loss: 0.8715, test_loss: 0.8808, test_f1: 0.5523
 epoch: 52, train_loss: 0.8762, test_loss: 0.8825, test_f1: 0.5440
 epoch: 53, train_loss: 0.8742, test_loss: 0.8814, test_f1: 0.5463
 epoch: 54, train_loss: 0.8668, test_loss: 0.8785, test_f1: 0.5451
 epoch: 55, train_loss: 0.8706, test_loss: 0.8789, test_f1: 0.5497
 epoch: 56, train_loss: 0.8688, test_loss: 0.8780, test_f1: 0.5500
 epoch: 57, train_loss: 0.8743, test_loss: 0.8766, test_f1: 0.5441
 epoch: 58, train_loss: 0.8664, test_loss: 0.8779, test_f1: 0.5488
 epoch: 59, train_loss: 0.8670, test_loss: 0.8756, test_f1: 0.5498
 epoch: 60, train_loss: 0.8650, test_loss: 0.8744, test_f1: 0.5508
 epoch: 61, train_loss: 0.8619, test_loss: 0.8743, test_f1: 0.5533
 epoch: 62, train_loss: 0.8541, test_loss: 0.8747, test_f1: 0.5498
 epoch: 63, train_loss: 0.8537, test_loss: 0.8737, test_f1: 0.5618
 epoch: 64, train_loss: 0.8673, test_loss: 0.8751, test_f1: 0.5581
 epoch: 65, train_loss: 0.8507, test_loss: 0.8727, test_f1: 0.5545
 epoch: 66, train_loss: 0.8566, test_loss: 0.8714, test_f1: 0.5522
 epoch: 67, train_loss: 0.8545, test_loss: 0.8687, test_f1: 0.5597
 epoch: 68, train_loss: 0.8607, test_loss: 0.8701, test_f1: 0.5612
 epoch: 69, train_loss: 0.8553, test_loss: 0.8673, test_f1: 0.5543
 epoch: 70, train_loss: 0.8499, test_loss: 0.8709, test_f1: 0.5552
 epoch: 71, train_loss: 0.8533, test_loss: 0.8725, test_f1: 0.5643
 epoch: 72, train_loss: 0.8467, test_loss: 0.8704, test_f1: 0.5621
 epoch: 73, train_loss: 0.8415, test_loss: 0.8683, test_f1: 0.5624
 epoch: 74, train_loss: 0.8443, test_loss: 0.8669, test_f1: 0.5638
 epoch: 75, train_loss: 0.8564, test_loss: 0.8631, test_f1: 0.5657
 epoch: 76, train_loss: 0.8482, test_loss: 0.8640, test_f1: 0.5662
 epoch: 77, train_loss: 0.8443, test_loss: 0.8645, test_f1: 0.5636
 epoch: 78, train_loss: 0.8429, test_loss: 0.8650, test_f1: 0.5637
 epoch: 79, train_loss: 0.8412, test_loss: 0.8648, test_f1: 0.5590
 epoch: 80, train_loss: 0.8444, test_loss: 0.8637, test_f1: 0.5638
 epoch: 81, train_loss: 0.8415, test_loss: 0.8631, test_f1: 0.5671
 epoch: 82, train_loss: 0.8373, test_loss: 0.8639, test_f1: 0.5636
 epoch: 83, train_loss: 0.8331, test_loss: 0.8633, test_f1: 0.5652
 epoch: 84, train_loss: 0.8370, test_loss: 0.8645, test_f1: 0.5648
 epoch: 85, train_loss: 0.8363, test_loss: 0.8640, test_f1: 0.5635
 epoch: 86, train_loss: 0.8348, test_loss: 0.8632, test_f1: 0.5642
 epoch: 87, train_loss: 0.8277, test_loss: 0.8641, test_f1: 0.5666
 epoch: 88, train_loss: 0.8325, test_loss: 0.8625, test_f1: 0.5686
 epoch: 89, train_loss: 0.8313, test_loss: 0.8572, test_f1: 0.5657
 epoch: 90, train_loss: 0.8294, test_loss: 0.8578, test_f1: 0.5647
 epoch: 91, train_loss: 0.8325, test_loss: 0.8616, test_f1: 0.5673
 epoch: 92, train_loss: 0.8316, test_loss: 0.8601, test_f1: 0.5684
 epoch: 93, train_loss: 0.8278, test_loss: 0.8605, test_f1: 0.5611
 epoch: 94, train_loss: 0.8221, test_loss: 0.8580, test_f1: 0.5688
 epoch: 95, train_loss: 0.8222, test_loss: 0.8595, test_f1: 0.5663
 epoch: 96, train_loss: 0.8259, test_loss: 0.8566, test_f1: 0.5636
 epoch: 97, train_loss: 0.8303, test_loss: 0.8574, test_f1: 0.5638
 epoch: 98, train_loss: 0.8224, test_loss: 0.8625, test_f1: 0.5678
 epoch: 99, train_loss: 0.8210, test_loss: 0.8605, test_f1: 0.5667

Training completed in 404.59 seconds
Best F1: 0.5762 at epoch 91
Mean F1 across iterations: 0.5539  0.0139
========================FINAL RESULTS================================
FEGIN weighted F1: 0.5762  0.0139
python main.py --data ltspice_examples --representation component_pin_net --model FEGIN --layers 2 --hiddens 64 --batch_size 256 --lr 0.0001 --emb_size 512 --epochs 100 --save_appendix component_pin_net_L2_H64_BS256_LR0.0001_E512 --no_val
-----



STDERR:
  File "main.py", line 370, in <module>
    main()
  File "main.py", line 254, in main
    dataset = dataset_class(
  File "/home/philip/projects/ltspice_examples_code_repo/Circuit-Completion-Using-GNNs/component_classification_with_link_prediction_head/evaluation/FEGIN/kernel/circuit_datasets.py", line 15, in __init__
    self.data, self.slices = torch.load(self.processed_paths[0])
  File "/home/philip/.local/lib/python3.8/site-packages/torch/serialization.py", line 1040, in load
    warnings.warn(
  File "/usr/lib/python3.8/warnings.py", line 109, in _showwarnmsg
    sw(msg.message, msg.category, msg.filename, msg.lineno,
  File "main.py", line 47, in warn_with_traceback
    traceback.print_stack(file=log)
/home/philip/projects/ltspice_examples_code_repo/Circuit-Completion-Using-GNNs/component_classification_with_link_prediction_head/evaluation/FEGIN/kernel/circuit_datasets.py:15: FutureWarning: You are using `torch.load` with `weights_only=False` (the current default value), which uses the default pickle module implicitly. It is possible to construct malicious pickle data which will execute arbitrary code during unpickling (See https://github.com/pytorch/pytorch/blob/main/SECURITY.md#untrusted-models for more details). In a future release, the default value for `weights_only` will be flipped to `True`. This limits the functions that could be executed during unpickling. Arbitrary objects will no longer be allowed to be loaded via this mode unless they are explicitly allowlisted by the user via `torch.serialization.add_safe_globals`. We recommend you start setting `weights_only=True` for any use case where you don't have full control of the loaded file. Please open an issue on GitHub for any issues related to this experimental feature.
  self.data, self.slices = torch.load(self.processed_paths[0])
