STDOUT:
Results will be saved in /home/philip/projects/ltspice_examples_code_repo/Circuit-Completion-Using-GNNs/component_classification_with_link_prediction_head/evaluation/FEGIN/results/model_FEGIN_dataset_ltspice_examples
Command line input: python main.py --data ltspice_examples --representation component_component --model FEGIN --layers 4 --hiddens 64 --batch_size 64 --lr 0.0001 --emb_size 250 --epochs 100 --save_appendix component_component_L4_H64_BS64_LR0.0001_E250 --no_val
 is saved.
-----
ltspice_examples - FEGIN
Using 4 layers, 64 hidden units, h = 2
Loading component_component representation dataset
ENTERED
Training FEGIN on component_component representation
Train: 3556, Test: 845
##################ITERATION #0 ****************************************
 epoch: 0, train_loss: 1.3625, test_loss: 1.3549, test_f1: 0.2274
 epoch: 1, train_loss: 1.3369, test_loss: 1.3303, test_f1: 0.2274
 epoch: 2, train_loss: 1.3115, test_loss: 1.2981, test_f1: 0.2274
 epoch: 3, train_loss: 1.2819, test_loss: 1.2718, test_f1: 0.2274
 epoch: 4, train_loss: 1.2659, test_loss: 1.2493, test_f1: 0.2274
 epoch: 5, train_loss: 1.2525, test_loss: 1.2293, test_f1: 0.2274
 epoch: 6, train_loss: 1.2357, test_loss: 1.2155, test_f1: 0.2423
 epoch: 7, train_loss: 1.2255, test_loss: 1.1992, test_f1: 0.2674
 epoch: 8, train_loss: 1.2135, test_loss: 1.1862, test_f1: 0.3268
 epoch: 9, train_loss: 1.2004, test_loss: 1.1690, test_f1: 0.3851
 epoch: 10, train_loss: 1.1891, test_loss: 1.1494, test_f1: 0.3796
 epoch: 11, train_loss: 1.1739, test_loss: 1.1368, test_f1: 0.3822
 epoch: 12, train_loss: 1.1585, test_loss: 1.1202, test_f1: 0.3824
 epoch: 13, train_loss: 1.1460, test_loss: 1.1060, test_f1: 0.3859
 epoch: 14, train_loss: 1.1362, test_loss: 1.0946, test_f1: 0.3889
 epoch: 15, train_loss: 1.1239, test_loss: 1.0765, test_f1: 0.3978
 epoch: 16, train_loss: 1.1120, test_loss: 1.0685, test_f1: 0.4539
 epoch: 17, train_loss: 1.1037, test_loss: 1.0681, test_f1: 0.4630
 epoch: 18, train_loss: 1.0919, test_loss: 1.0576, test_f1: 0.4539
 epoch: 19, train_loss: 1.0789, test_loss: 1.0487, test_f1: 0.4605
 epoch: 20, train_loss: 1.0709, test_loss: 1.0431, test_f1: 0.4733
 epoch: 21, train_loss: 1.0647, test_loss: 1.0420, test_f1: 0.4692
 epoch: 22, train_loss: 1.0586, test_loss: 1.0256, test_f1: 0.4822
 epoch: 23, train_loss: 1.0475, test_loss: 1.0152, test_f1: 0.4784
 epoch: 24, train_loss: 1.0386, test_loss: 1.0301, test_f1: 0.4710
 epoch: 25, train_loss: 1.0338, test_loss: 1.0205, test_f1: 0.4806
 epoch: 26, train_loss: 1.0203, test_loss: 1.0255, test_f1: 0.4809
 epoch: 27, train_loss: 1.0164, test_loss: 1.0242, test_f1: 0.4752
 epoch: 28, train_loss: 1.0160, test_loss: 1.0060, test_f1: 0.4937
 epoch: 29, train_loss: 1.0065, test_loss: 0.9903, test_f1: 0.5010
 epoch: 30, train_loss: 0.9967, test_loss: 1.0085, test_f1: 0.4949
 epoch: 31, train_loss: 0.9929, test_loss: 0.9969, test_f1: 0.4881
 epoch: 32, train_loss: 0.9925, test_loss: 0.9977, test_f1: 0.4929
 epoch: 33, train_loss: 0.9874, test_loss: 1.0067, test_f1: 0.4878
 epoch: 34, train_loss: 0.9848, test_loss: 1.0007, test_f1: 0.4976
 epoch: 35, train_loss: 0.9764, test_loss: 0.9947, test_f1: 0.4781
 epoch: 36, train_loss: 0.9699, test_loss: 0.9898, test_f1: 0.4846
 epoch: 37, train_loss: 0.9703, test_loss: 0.9872, test_f1: 0.4740
 epoch: 38, train_loss: 0.9666, test_loss: 0.9782, test_f1: 0.4863
 epoch: 39, train_loss: 0.9547, test_loss: 0.9889, test_f1: 0.4927
 epoch: 40, train_loss: 0.9614, test_loss: 0.9835, test_f1: 0.5035
 epoch: 41, train_loss: 0.9618, test_loss: 0.9989, test_f1: 0.4756
 epoch: 42, train_loss: 0.9576, test_loss: 0.9845, test_f1: 0.4983
 epoch: 43, train_loss: 0.9438, test_loss: 0.9797, test_f1: 0.5097
 epoch: 44, train_loss: 0.9461, test_loss: 0.9769, test_f1: 0.4915
 epoch: 45, train_loss: 0.9301, test_loss: 0.9853, test_f1: 0.5016
 epoch: 46, train_loss: 0.9439, test_loss: 0.9792, test_f1: 0.4786
 epoch: 47, train_loss: 0.9362, test_loss: 0.9802, test_f1: 0.4794
 epoch: 48, train_loss: 0.9354, test_loss: 0.9801, test_f1: 0.5016
 epoch: 49, train_loss: 0.9149, test_loss: 0.9720, test_f1: 0.4814
 epoch: 50, train_loss: 0.9261, test_loss: 0.9744, test_f1: 0.4602
 epoch: 51, train_loss: 0.9277, test_loss: 0.9759, test_f1: 0.4808
 epoch: 52, train_loss: 0.9110, test_loss: 0.9752, test_f1: 0.4747
 epoch: 53, train_loss: 0.9212, test_loss: 0.9865, test_f1: 0.4809
 epoch: 54, train_loss: 0.9145, test_loss: 0.9817, test_f1: 0.4922
 epoch: 55, train_loss: 0.9013, test_loss: 0.9833, test_f1: 0.4710
 epoch: 56, train_loss: 0.9029, test_loss: 0.9794, test_f1: 0.4796
 epoch: 57, train_loss: 0.8997, test_loss: 0.9861, test_f1: 0.4831
 epoch: 58, train_loss: 0.9049, test_loss: 0.9814, test_f1: 0.4871
 epoch: 59, train_loss: 0.8987, test_loss: 0.9855, test_f1: 0.4888
 epoch: 60, train_loss: 0.9126, test_loss: 0.9757, test_f1: 0.4892
 epoch: 61, train_loss: 0.8911, test_loss: 0.9926, test_f1: 0.4811
 epoch: 62, train_loss: 0.8953, test_loss: 0.9936, test_f1: 0.4893
 epoch: 63, train_loss: 0.8940, test_loss: 0.9853, test_f1: 0.4852
 epoch: 64, train_loss: 0.9089, test_loss: 0.9781, test_f1: 0.4925
 epoch: 65, train_loss: 0.8880, test_loss: 0.9923, test_f1: 0.4871
 epoch: 66, train_loss: 0.8943, test_loss: 0.9802, test_f1: 0.4907
 epoch: 67, train_loss: 0.8968, test_loss: 0.9889, test_f1: 0.4904
 epoch: 68, train_loss: 0.8831, test_loss: 0.9824, test_f1: 0.5015
 epoch: 69, train_loss: 0.8910, test_loss: 0.9819, test_f1: 0.4958
 epoch: 70, train_loss: 0.8772, test_loss: 0.9915, test_f1: 0.5015
 epoch: 71, train_loss: 0.8877, test_loss: 0.9890, test_f1: 0.4953
 epoch: 72, train_loss: 0.8772, test_loss: 0.9853, test_f1: 0.5060
 epoch: 73, train_loss: 0.8924, test_loss: 0.9758, test_f1: 0.5039
 epoch: 74, train_loss: 0.8743, test_loss: 0.9857, test_f1: 0.4962
 epoch: 75, train_loss: 0.8791, test_loss: 0.9905, test_f1: 0.4861
 epoch: 76, train_loss: 0.8716, test_loss: 0.9913, test_f1: 0.4985
 epoch: 77, train_loss: 0.8766, test_loss: 1.0005, test_f1: 0.4727
 epoch: 78, train_loss: 0.8745, test_loss: 0.9889, test_f1: 0.5004
 epoch: 79, train_loss: 0.8744, test_loss: 0.9924, test_f1: 0.4925
 epoch: 80, train_loss: 0.8712, test_loss: 0.9910, test_f1: 0.4910
 epoch: 81, train_loss: 0.8744, test_loss: 1.0062, test_f1: 0.4963
 epoch: 82, train_loss: 0.8750, test_loss: 0.9714, test_f1: 0.5076
 epoch: 83, train_loss: 0.8662, test_loss: 0.9872, test_f1: 0.5118
 epoch: 84, train_loss: 0.8604, test_loss: 1.0049, test_f1: 0.4954
 epoch: 85, train_loss: 0.8561, test_loss: 1.0271, test_f1: 0.4838
 epoch: 86, train_loss: 0.8526, test_loss: 1.0211, test_f1: 0.4876
 epoch: 87, train_loss: 0.8703, test_loss: 0.9996, test_f1: 0.5008
 epoch: 88, train_loss: 0.8619, test_loss: 0.9845, test_f1: 0.5044
 epoch: 89, train_loss: 0.8538, test_loss: 1.0093, test_f1: 0.4949
 epoch: 90, train_loss: 0.8631, test_loss: 0.9810, test_f1: 0.5006
 epoch: 91, train_loss: 0.8655, test_loss: 1.0037, test_f1: 0.5003
 epoch: 92, train_loss: 0.8483, test_loss: 1.0163, test_f1: 0.4954
 epoch: 93, train_loss: 0.8492, test_loss: 0.9716, test_f1: 0.5206
 epoch: 94, train_loss: 0.8515, test_loss: 1.0039, test_f1: 0.5128
 epoch: 95, train_loss: 0.8550, test_loss: 1.0163, test_f1: 0.4878
 epoch: 96, train_loss: 0.8655, test_loss: 1.0098, test_f1: 0.4913
 epoch: 97, train_loss: 0.8586, test_loss: 0.9897, test_f1: 0.5138
 epoch: 98, train_loss: 0.8519, test_loss: 0.9958, test_f1: 0.4957
 epoch: 99, train_loss: 0.8352, test_loss: 1.0183, test_f1: 0.5018
##################ITERATION #1 ****************************************
 epoch: 0, train_loss: 1.3508, test_loss: 1.3016, test_f1: 0.2367
 epoch: 1, train_loss: 1.2841, test_loss: 1.2544, test_f1: 0.2796
 epoch: 2, train_loss: 1.2549, test_loss: 1.2254, test_f1: 0.3041
 epoch: 3, train_loss: 1.2334, test_loss: 1.2020, test_f1: 0.3541
 epoch: 4, train_loss: 1.2161, test_loss: 1.1858, test_f1: 0.3839
 epoch: 5, train_loss: 1.1994, test_loss: 1.1678, test_f1: 0.4090
 epoch: 6, train_loss: 1.1927, test_loss: 1.1522, test_f1: 0.4126
 epoch: 7, train_loss: 1.1736, test_loss: 1.1349, test_f1: 0.4194
 epoch: 8, train_loss: 1.1671, test_loss: 1.1283, test_f1: 0.4213
 epoch: 9, train_loss: 1.1535, test_loss: 1.1164, test_f1: 0.4376
 epoch: 10, train_loss: 1.1439, test_loss: 1.1073, test_f1: 0.4522
 epoch: 11, train_loss: 1.1270, test_loss: 1.0923, test_f1: 0.4464
 epoch: 12, train_loss: 1.1206, test_loss: 1.0899, test_f1: 0.4612
 epoch: 13, train_loss: 1.1116, test_loss: 1.0834, test_f1: 0.4639
 epoch: 14, train_loss: 1.1046, test_loss: 1.0795, test_f1: 0.4602
 epoch: 15, train_loss: 1.0987, test_loss: 1.0823, test_f1: 0.4487
 epoch: 16, train_loss: 1.0944, test_loss: 1.0748, test_f1: 0.4587
 epoch: 17, train_loss: 1.0830, test_loss: 1.0694, test_f1: 0.4650
 epoch: 18, train_loss: 1.0815, test_loss: 1.0701, test_f1: 0.4609
 epoch: 19, train_loss: 1.0771, test_loss: 1.0624, test_f1: 0.4801
 epoch: 20, train_loss: 1.0654, test_loss: 1.0468, test_f1: 0.4814
 epoch: 21, train_loss: 1.0645, test_loss: 1.0484, test_f1: 0.4780
 epoch: 22, train_loss: 1.0524, test_loss: 1.0411, test_f1: 0.4825
 epoch: 23, train_loss: 1.0499, test_loss: 1.0440, test_f1: 0.4809
 epoch: 24, train_loss: 1.0400, test_loss: 1.0426, test_f1: 0.4687
 epoch: 25, train_loss: 1.0412, test_loss: 1.0270, test_f1: 0.4829
 epoch: 26, train_loss: 1.0405, test_loss: 1.0281, test_f1: 0.4700
 epoch: 27, train_loss: 1.0189, test_loss: 1.0380, test_f1: 0.4744
 epoch: 28, train_loss: 1.0206, test_loss: 1.0252, test_f1: 0.4721
 epoch: 29, train_loss: 1.0198, test_loss: 1.0262, test_f1: 0.4595
 epoch: 30, train_loss: 1.0085, test_loss: 1.0273, test_f1: 0.4662
 epoch: 31, train_loss: 1.0138, test_loss: 1.0160, test_f1: 0.4932
 epoch: 32, train_loss: 1.0047, test_loss: 1.0152, test_f1: 0.4826
 epoch: 33, train_loss: 0.9892, test_loss: 1.0268, test_f1: 0.4824
 epoch: 34, train_loss: 0.9935, test_loss: 1.0182, test_f1: 0.4731
 epoch: 35, train_loss: 0.9864, test_loss: 1.0080, test_f1: 0.4944
 epoch: 36, train_loss: 0.9734, test_loss: 1.0211, test_f1: 0.4659
 epoch: 37, train_loss: 0.9651, test_loss: 0.9939, test_f1: 0.4968
 epoch: 38, train_loss: 0.9667, test_loss: 1.0050, test_f1: 0.5002
 epoch: 39, train_loss: 0.9604, test_loss: 1.0171, test_f1: 0.4673
 epoch: 40, train_loss: 0.9486, test_loss: 0.9989, test_f1: 0.4780
 epoch: 41, train_loss: 0.9417, test_loss: 1.0184, test_f1: 0.4777
 epoch: 42, train_loss: 0.9440, test_loss: 0.9992, test_f1: 0.5085
 epoch: 43, train_loss: 0.9432, test_loss: 1.0117, test_f1: 0.4880
 epoch: 44, train_loss: 0.9365, test_loss: 1.0046, test_f1: 0.4936
 epoch: 45, train_loss: 0.9422, test_loss: 1.0018, test_f1: 0.4876
 epoch: 46, train_loss: 0.9247, test_loss: 1.0012, test_f1: 0.4890
 epoch: 47, train_loss: 0.9224, test_loss: 1.0144, test_f1: 0.4829
 epoch: 48, train_loss: 0.9246, test_loss: 1.0094, test_f1: 0.4920
 epoch: 49, train_loss: 0.9050, test_loss: 1.0086, test_f1: 0.4837
 epoch: 50, train_loss: 0.8992, test_loss: 1.0137, test_f1: 0.4878
 epoch: 51, train_loss: 0.8982, test_loss: 1.0250, test_f1: 0.4859
 epoch: 52, train_loss: 0.8921, test_loss: 1.0173, test_f1: 0.4881
 epoch: 53, train_loss: 0.8868, test_loss: 1.0243, test_f1: 0.4822
 epoch: 54, train_loss: 0.8815, test_loss: 1.0363, test_f1: 0.4893
 epoch: 55, train_loss: 0.8896, test_loss: 1.0324, test_f1: 0.4853
 epoch: 56, train_loss: 0.8818, test_loss: 1.0431, test_f1: 0.4954
 epoch: 57, train_loss: 0.8763, test_loss: 1.0215, test_f1: 0.4944
 epoch: 58, train_loss: 0.8761, test_loss: 1.0230, test_f1: 0.5048
 epoch: 59, train_loss: 0.8799, test_loss: 1.0152, test_f1: 0.5049
 epoch: 60, train_loss: 0.8772, test_loss: 1.0213, test_f1: 0.4924
 epoch: 61, train_loss: 0.8651, test_loss: 1.0206, test_f1: 0.5003
 epoch: 62, train_loss: 0.8694, test_loss: 1.0201, test_f1: 0.5038
 epoch: 63, train_loss: 0.8598, test_loss: 1.0347, test_f1: 0.4965
 epoch: 64, train_loss: 0.8696, test_loss: 1.0491, test_f1: 0.4992
 epoch: 65, train_loss: 0.8630, test_loss: 1.0269, test_f1: 0.4997
 epoch: 66, train_loss: 0.8594, test_loss: 1.0357, test_f1: 0.4991
 epoch: 67, train_loss: 0.8593, test_loss: 1.0315, test_f1: 0.4932
 epoch: 68, train_loss: 0.8568, test_loss: 1.0411, test_f1: 0.4973
 epoch: 69, train_loss: 0.8564, test_loss: 1.0345, test_f1: 0.4939
 epoch: 70, train_loss: 0.8418, test_loss: 1.0498, test_f1: 0.4882
 epoch: 71, train_loss: 0.8535, test_loss: 1.0432, test_f1: 0.4907
 epoch: 72, train_loss: 0.8407, test_loss: 1.0471, test_f1: 0.4872
 epoch: 73, train_loss: 0.8385, test_loss: 1.0478, test_f1: 0.4907
 epoch: 74, train_loss: 0.8433, test_loss: 1.0591, test_f1: 0.4931
 epoch: 75, train_loss: 0.8322, test_loss: 1.0777, test_f1: 0.4854
 epoch: 76, train_loss: 0.8267, test_loss: 1.0558, test_f1: 0.4941
 epoch: 77, train_loss: 0.8377, test_loss: 1.0563, test_f1: 0.4814
 epoch: 78, train_loss: 0.8333, test_loss: 1.0628, test_f1: 0.4891
 epoch: 79, train_loss: 0.8282, test_loss: 1.0654, test_f1: 0.5021
 epoch: 80, train_loss: 0.8355, test_loss: 1.0532, test_f1: 0.4932
 epoch: 81, train_loss: 0.8263, test_loss: 1.0772, test_f1: 0.4960
 epoch: 82, train_loss: 0.8226, test_loss: 1.0755, test_f1: 0.4884
 epoch: 83, train_loss: 0.8272, test_loss: 1.0674, test_f1: 0.4871
 epoch: 84, train_loss: 0.8206, test_loss: 1.0654, test_f1: 0.4917
 epoch: 85, train_loss: 0.8203, test_loss: 1.0728, test_f1: 0.4994
 epoch: 86, train_loss: 0.8070, test_loss: 1.0514, test_f1: 0.4901
 epoch: 87, train_loss: 0.8149, test_loss: 1.0895, test_f1: 0.4796
 epoch: 88, train_loss: 0.8306, test_loss: 1.0664, test_f1: 0.4850
 epoch: 89, train_loss: 0.8179, test_loss: 1.0791, test_f1: 0.4937
 epoch: 90, train_loss: 0.8140, test_loss: 1.1059, test_f1: 0.4857
 epoch: 91, train_loss: 0.8035, test_loss: 1.0756, test_f1: 0.4975
 epoch: 92, train_loss: 0.7960, test_loss: 1.0856, test_f1: 0.4908
 epoch: 93, train_loss: 0.8154, test_loss: 1.0827, test_f1: 0.4904
 epoch: 94, train_loss: 0.8111, test_loss: 1.0999, test_f1: 0.4861
 epoch: 95, train_loss: 0.8044, test_loss: 1.0927, test_f1: 0.4911
 epoch: 96, train_loss: 0.7999, test_loss: 1.0989, test_f1: 0.4982
 epoch: 97, train_loss: 0.8049, test_loss: 1.0973, test_f1: 0.4909
 epoch: 98, train_loss: 0.7962, test_loss: 1.0976, test_f1: 0.4831
 epoch: 99, train_loss: 0.8078, test_loss: 1.0751, test_f1: 0.4947
##################ITERATION #2 ****************************************
 epoch: 0, train_loss: 1.3166, test_loss: 1.2944, test_f1: 0.3000
 epoch: 1, train_loss: 1.2579, test_loss: 1.2355, test_f1: 0.3340
 epoch: 2, train_loss: 1.2355, test_loss: 1.2148, test_f1: 0.3661
 epoch: 3, train_loss: 1.2210, test_loss: 1.1900, test_f1: 0.3708
 epoch: 4, train_loss: 1.2098, test_loss: 1.1753, test_f1: 0.3816
 epoch: 5, train_loss: 1.1992, test_loss: 1.1624, test_f1: 0.3868
 epoch: 6, train_loss: 1.1849, test_loss: 1.1524, test_f1: 0.4142
 epoch: 7, train_loss: 1.1731, test_loss: 1.1410, test_f1: 0.4186
 epoch: 8, train_loss: 1.1580, test_loss: 1.1286, test_f1: 0.4132
 epoch: 9, train_loss: 1.1526, test_loss: 1.1151, test_f1: 0.4199
 epoch: 10, train_loss: 1.1370, test_loss: 1.1082, test_f1: 0.4252
 epoch: 11, train_loss: 1.1248, test_loss: 1.0947, test_f1: 0.4335
 epoch: 12, train_loss: 1.1190, test_loss: 1.0860, test_f1: 0.4479
 epoch: 13, train_loss: 1.1056, test_loss: 1.0782, test_f1: 0.4444
 epoch: 14, train_loss: 1.1007, test_loss: 1.0731, test_f1: 0.4374
 epoch: 15, train_loss: 1.0879, test_loss: 1.0643, test_f1: 0.4274
 epoch: 16, train_loss: 1.0846, test_loss: 1.0466, test_f1: 0.4436
 epoch: 17, train_loss: 1.0692, test_loss: 1.0430, test_f1: 0.4436
 epoch: 18, train_loss: 1.0605, test_loss: 1.0296, test_f1: 0.4474
 epoch: 19, train_loss: 1.0454, test_loss: 1.0250, test_f1: 0.4679
 epoch: 20, train_loss: 1.0443, test_loss: 1.0214, test_f1: 0.4563
 epoch: 21, train_loss: 1.0366, test_loss: 1.0117, test_f1: 0.4440
 epoch: 22, train_loss: 1.0268, test_loss: 1.0030, test_f1: 0.4581
 epoch: 23, train_loss: 1.0139, test_loss: 1.0020, test_f1: 0.4660
 epoch: 24, train_loss: 1.0085, test_loss: 0.9917, test_f1: 0.4587
 epoch: 25, train_loss: 1.0058, test_loss: 0.9939, test_f1: 0.4549
 epoch: 26, train_loss: 0.9939, test_loss: 0.9834, test_f1: 0.4557
 epoch: 27, train_loss: 0.9820, test_loss: 0.9794, test_f1: 0.4552
 epoch: 28, train_loss: 0.9818, test_loss: 0.9771, test_f1: 0.4529
 epoch: 29, train_loss: 0.9753, test_loss: 0.9727, test_f1: 0.4566
 epoch: 30, train_loss: 0.9742, test_loss: 0.9829, test_f1: 0.4524
 epoch: 31, train_loss: 0.9693, test_loss: 0.9830, test_f1: 0.4399
 epoch: 32, train_loss: 0.9596, test_loss: 0.9848, test_f1: 0.4577
 epoch: 33, train_loss: 0.9561, test_loss: 0.9743, test_f1: 0.4520
 epoch: 34, train_loss: 0.9499, test_loss: 0.9662, test_f1: 0.4499
 epoch: 35, train_loss: 0.9413, test_loss: 0.9642, test_f1: 0.4705
 epoch: 36, train_loss: 0.9391, test_loss: 0.9691, test_f1: 0.4577
 epoch: 37, train_loss: 0.9338, test_loss: 0.9836, test_f1: 0.4606
 epoch: 38, train_loss: 0.9283, test_loss: 0.9578, test_f1: 0.4754
 epoch: 39, train_loss: 0.9349, test_loss: 0.9472, test_f1: 0.4840
 epoch: 40, train_loss: 0.9242, test_loss: 0.9543, test_f1: 0.4792
 epoch: 41, train_loss: 0.9132, test_loss: 0.9493, test_f1: 0.4821
 epoch: 42, train_loss: 0.9131, test_loss: 0.9412, test_f1: 0.4885
 epoch: 43, train_loss: 0.9055, test_loss: 0.9678, test_f1: 0.4758
 epoch: 44, train_loss: 0.8989, test_loss: 0.9483, test_f1: 0.5044
 epoch: 45, train_loss: 0.8993, test_loss: 0.9507, test_f1: 0.4915
 epoch: 46, train_loss: 0.8957, test_loss: 0.9665, test_f1: 0.4876
 epoch: 47, train_loss: 0.8997, test_loss: 0.9725, test_f1: 0.4886
 epoch: 48, train_loss: 0.8936, test_loss: 0.9552, test_f1: 0.4930
 epoch: 49, train_loss: 0.8836, test_loss: 0.9622, test_f1: 0.4904
 epoch: 50, train_loss: 0.8781, test_loss: 0.9577, test_f1: 0.4997
 epoch: 51, train_loss: 0.8742, test_loss: 0.9569, test_f1: 0.5026
 epoch: 52, train_loss: 0.8701, test_loss: 0.9577, test_f1: 0.5049
 epoch: 53, train_loss: 0.8604, test_loss: 0.9586, test_f1: 0.4898
 epoch: 54, train_loss: 0.8635, test_loss: 0.9591, test_f1: 0.4887
 epoch: 55, train_loss: 0.8519, test_loss: 0.9763, test_f1: 0.4754
 epoch: 56, train_loss: 0.8582, test_loss: 0.9628, test_f1: 0.4973
 epoch: 57, train_loss: 0.8485, test_loss: 0.9790, test_f1: 0.4925
 epoch: 58, train_loss: 0.8682, test_loss: 0.9758, test_f1: 0.4902
 epoch: 59, train_loss: 0.8476, test_loss: 0.9694, test_f1: 0.4948
 epoch: 60, train_loss: 0.8533, test_loss: 0.9803, test_f1: 0.4855
 epoch: 61, train_loss: 0.8487, test_loss: 0.9692, test_f1: 0.4989
 epoch: 62, train_loss: 0.8504, test_loss: 0.9919, test_f1: 0.4806
 epoch: 63, train_loss: 0.8463, test_loss: 0.9693, test_f1: 0.4937
 epoch: 64, train_loss: 0.8452, test_loss: 0.9730, test_f1: 0.4921
 epoch: 65, train_loss: 0.8397, test_loss: 0.9758, test_f1: 0.4937
 epoch: 66, train_loss: 0.8231, test_loss: 0.9791, test_f1: 0.4948
 epoch: 67, train_loss: 0.8345, test_loss: 0.9797, test_f1: 0.4835
 epoch: 68, train_loss: 0.8404, test_loss: 0.9847, test_f1: 0.4947
 epoch: 69, train_loss: 0.8363, test_loss: 0.9804, test_f1: 0.4893
 epoch: 70, train_loss: 0.8253, test_loss: 1.0051, test_f1: 0.4735
 epoch: 71, train_loss: 0.8368, test_loss: 0.9860, test_f1: 0.5032
 epoch: 72, train_loss: 0.8207, test_loss: 0.9865, test_f1: 0.5058
 epoch: 73, train_loss: 0.8170, test_loss: 1.0078, test_f1: 0.4792
 epoch: 74, train_loss: 0.8258, test_loss: 0.9924, test_f1: 0.4819
 epoch: 75, train_loss: 0.8274, test_loss: 0.9987, test_f1: 0.4720
 epoch: 76, train_loss: 0.8277, test_loss: 1.0041, test_f1: 0.4964
 epoch: 77, train_loss: 0.8260, test_loss: 1.0061, test_f1: 0.4816
 epoch: 78, train_loss: 0.8134, test_loss: 1.0033, test_f1: 0.4876
 epoch: 79, train_loss: 0.8156, test_loss: 1.0004, test_f1: 0.4809
 epoch: 80, train_loss: 0.8161, test_loss: 1.0286, test_f1: 0.4735
 epoch: 81, train_loss: 0.8149, test_loss: 1.0057, test_f1: 0.4898
 epoch: 82, train_loss: 0.8147, test_loss: 1.0094, test_f1: 0.4840
 epoch: 83, train_loss: 0.8226, test_loss: 1.0100, test_f1: 0.4974
 epoch: 84, train_loss: 0.8172, test_loss: 1.0187, test_f1: 0.4983
 epoch: 85, train_loss: 0.8091, test_loss: 0.9968, test_f1: 0.5199
 epoch: 86, train_loss: 0.8133, test_loss: 1.0130, test_f1: 0.4883
 epoch: 87, train_loss: 0.8077, test_loss: 1.0047, test_f1: 0.4932
 epoch: 88, train_loss: 0.8087, test_loss: 1.0107, test_f1: 0.4908
 epoch: 89, train_loss: 0.8060, test_loss: 1.0213, test_f1: 0.4823
 epoch: 90, train_loss: 0.8043, test_loss: 1.0338, test_f1: 0.4766
 epoch: 91, train_loss: 0.8085, test_loss: 1.0180, test_f1: 0.4875
 epoch: 92, train_loss: 0.8019, test_loss: 1.0419, test_f1: 0.4805
 epoch: 93, train_loss: 0.7996, test_loss: 1.0335, test_f1: 0.4807
 epoch: 94, train_loss: 0.8006, test_loss: 1.0281, test_f1: 0.4680
 epoch: 95, train_loss: 0.7850, test_loss: 1.0605, test_f1: 0.4799
 epoch: 96, train_loss: 0.8056, test_loss: 1.0457, test_f1: 0.4896
 epoch: 97, train_loss: 0.7893, test_loss: 1.0398, test_f1: 0.4847
 epoch: 98, train_loss: 0.7929, test_loss: 1.0687, test_f1: 0.4796
 epoch: 99, train_loss: 0.7905, test_loss: 1.0567, test_f1: 0.4833
##################ITERATION #3 ****************************************
 epoch: 0, train_loss: 1.3097, test_loss: 1.2603, test_f1: 0.2764
 epoch: 1, train_loss: 1.2524, test_loss: 1.2195, test_f1: 0.3145
 epoch: 2, train_loss: 1.2346, test_loss: 1.1989, test_f1: 0.3489
 epoch: 3, train_loss: 1.2136, test_loss: 1.1823, test_f1: 0.3949
 epoch: 4, train_loss: 1.2048, test_loss: 1.1723, test_f1: 0.4104
 epoch: 5, train_loss: 1.1919, test_loss: 1.1569, test_f1: 0.4047
 epoch: 6, train_loss: 1.1772, test_loss: 1.1441, test_f1: 0.4212
 epoch: 7, train_loss: 1.1658, test_loss: 1.1388, test_f1: 0.4144
 epoch: 8, train_loss: 1.1580, test_loss: 1.1251, test_f1: 0.4132
 epoch: 9, train_loss: 1.1478, test_loss: 1.1211, test_f1: 0.4104
 epoch: 10, train_loss: 1.1448, test_loss: 1.1105, test_f1: 0.4218
 epoch: 11, train_loss: 1.1287, test_loss: 1.1026, test_f1: 0.4353
 epoch: 12, train_loss: 1.1213, test_loss: 1.0921, test_f1: 0.4294
 epoch: 13, train_loss: 1.1123, test_loss: 1.0873, test_f1: 0.4420
 epoch: 14, train_loss: 1.1014, test_loss: 1.0865, test_f1: 0.4382
 epoch: 15, train_loss: 1.0927, test_loss: 1.0717, test_f1: 0.4350
 epoch: 16, train_loss: 1.0849, test_loss: 1.0726, test_f1: 0.4540
 epoch: 17, train_loss: 1.0878, test_loss: 1.0669, test_f1: 0.4318
 epoch: 18, train_loss: 1.0621, test_loss: 1.0623, test_f1: 0.4431
 epoch: 19, train_loss: 1.0614, test_loss: 1.0608, test_f1: 0.4466
 epoch: 20, train_loss: 1.0620, test_loss: 1.0580, test_f1: 0.4603
 epoch: 21, train_loss: 1.0572, test_loss: 1.0568, test_f1: 0.4541
 epoch: 22, train_loss: 1.0468, test_loss: 1.0552, test_f1: 0.4713
 epoch: 23, train_loss: 1.0400, test_loss: 1.0553, test_f1: 0.4463
 epoch: 24, train_loss: 1.0381, test_loss: 1.0450, test_f1: 0.4900
 epoch: 25, train_loss: 1.0220, test_loss: 1.0483, test_f1: 0.4709
 epoch: 26, train_loss: 1.0242, test_loss: 1.0446, test_f1: 0.4795
 epoch: 27, train_loss: 1.0217, test_loss: 1.0333, test_f1: 0.4927
 epoch: 28, train_loss: 1.0154, test_loss: 1.0282, test_f1: 0.4946
 epoch: 29, train_loss: 1.0106, test_loss: 1.0449, test_f1: 0.4826
 epoch: 30, train_loss: 0.9996, test_loss: 1.0233, test_f1: 0.5000
 epoch: 31, train_loss: 0.9933, test_loss: 1.0318, test_f1: 0.4673
 epoch: 32, train_loss: 0.9846, test_loss: 1.0261, test_f1: 0.4996
 epoch: 33, train_loss: 0.9829, test_loss: 1.0275, test_f1: 0.4946
 epoch: 34, train_loss: 0.9668, test_loss: 1.0272, test_f1: 0.4746
 epoch: 35, train_loss: 0.9692, test_loss: 1.0336, test_f1: 0.4854
 epoch: 36, train_loss: 0.9693, test_loss: 1.0391, test_f1: 0.5041
 epoch: 37, train_loss: 0.9593, test_loss: 1.0387, test_f1: 0.4972
 epoch: 38, train_loss: 0.9584, test_loss: 1.0355, test_f1: 0.5037
 epoch: 39, train_loss: 0.9493, test_loss: 1.0455, test_f1: 0.4802
 epoch: 40, train_loss: 0.9398, test_loss: 1.0377, test_f1: 0.5105
 epoch: 41, train_loss: 0.9367, test_loss: 1.0455, test_f1: 0.4792
 epoch: 42, train_loss: 0.9436, test_loss: 1.0384, test_f1: 0.4933
 epoch: 43, train_loss: 0.9335, test_loss: 1.0746, test_f1: 0.4827
 epoch: 44, train_loss: 0.9335, test_loss: 1.0502, test_f1: 0.4919
 epoch: 45, train_loss: 0.9230, test_loss: 1.0565, test_f1: 0.4913
 epoch: 46, train_loss: 0.9199, test_loss: 1.0430, test_f1: 0.5085
 epoch: 47, train_loss: 0.9090, test_loss: 1.0447, test_f1: 0.5088
 epoch: 48, train_loss: 0.9141, test_loss: 1.0582, test_f1: 0.4944
 epoch: 49, train_loss: 0.9100, test_loss: 1.0551, test_f1: 0.4840
 epoch: 50, train_loss: 0.9029, test_loss: 1.0395, test_f1: 0.4853
 epoch: 51, train_loss: 0.9008, test_loss: 1.0582, test_f1: 0.4907
 epoch: 52, train_loss: 0.8910, test_loss: 1.0659, test_f1: 0.4836
 epoch: 53, train_loss: 0.8861, test_loss: 1.0423, test_f1: 0.4903
 epoch: 54, train_loss: 0.9006, test_loss: 1.0354, test_f1: 0.5151
 epoch: 55, train_loss: 0.8723, test_loss: 1.0428, test_f1: 0.4968
 epoch: 56, train_loss: 0.8815, test_loss: 1.0459, test_f1: 0.5020
 epoch: 57, train_loss: 0.8768, test_loss: 1.0546, test_f1: 0.5011
 epoch: 58, train_loss: 0.8752, test_loss: 1.0516, test_f1: 0.5109
 epoch: 59, train_loss: 0.8730, test_loss: 1.0577, test_f1: 0.5001
 epoch: 60, train_loss: 0.8750, test_loss: 1.0499, test_f1: 0.4928
 epoch: 61, train_loss: 0.8811, test_loss: 1.0507, test_f1: 0.5091
 epoch: 62, train_loss: 0.8579, test_loss: 1.0537, test_f1: 0.4934
 epoch: 63, train_loss: 0.8574, test_loss: 1.0392, test_f1: 0.5061
 epoch: 64, train_loss: 0.8657, test_loss: 1.0606, test_f1: 0.4991
 epoch: 65, train_loss: 0.8762, test_loss: 1.0549, test_f1: 0.5002
 epoch: 66, train_loss: 0.8543, test_loss: 1.0522, test_f1: 0.4908
 epoch: 67, train_loss: 0.8570, test_loss: 1.0525, test_f1: 0.4910
 epoch: 68, train_loss: 0.8656, test_loss: 1.0489, test_f1: 0.5011
 epoch: 69, train_loss: 0.8556, test_loss: 1.0552, test_f1: 0.4933
 epoch: 70, train_loss: 0.8499, test_loss: 1.0476, test_f1: 0.5025
 epoch: 71, train_loss: 0.8605, test_loss: 1.0500, test_f1: 0.5030
 epoch: 72, train_loss: 0.8459, test_loss: 1.0531, test_f1: 0.5121
 epoch: 73, train_loss: 0.8566, test_loss: 1.0669, test_f1: 0.5064
 epoch: 74, train_loss: 0.8435, test_loss: 1.0629, test_f1: 0.5074
 epoch: 75, train_loss: 0.8405, test_loss: 1.0631, test_f1: 0.5092
 epoch: 76, train_loss: 0.8470, test_loss: 1.0750, test_f1: 0.5129
 epoch: 77, train_loss: 0.8432, test_loss: 1.0529, test_f1: 0.5235
 epoch: 78, train_loss: 0.8329, test_loss: 1.0459, test_f1: 0.5061
 epoch: 79, train_loss: 0.8431, test_loss: 1.0797, test_f1: 0.5091
 epoch: 80, train_loss: 0.8399, test_loss: 1.0528, test_f1: 0.5054
 epoch: 81, train_loss: 0.8331, test_loss: 1.0545, test_f1: 0.5127
 epoch: 82, train_loss: 0.8364, test_loss: 1.0704, test_f1: 0.5149
 epoch: 83, train_loss: 0.8270, test_loss: 1.0851, test_f1: 0.5002
 epoch: 84, train_loss: 0.8365, test_loss: 1.0870, test_f1: 0.5126
 epoch: 85, train_loss: 0.8259, test_loss: 1.0597, test_f1: 0.5035
 epoch: 86, train_loss: 0.8298, test_loss: 1.0765, test_f1: 0.5085
 epoch: 87, train_loss: 0.8293, test_loss: 1.0451, test_f1: 0.5302
 epoch: 88, train_loss: 0.8112, test_loss: 1.0641, test_f1: 0.4944
 epoch: 89, train_loss: 0.8297, test_loss: 1.0514, test_f1: 0.5100
 epoch: 90, train_loss: 0.8183, test_loss: 1.0799, test_f1: 0.5165
 epoch: 91, train_loss: 0.8157, test_loss: 1.0839, test_f1: 0.5086
 epoch: 92, train_loss: 0.8163, test_loss: 1.0963, test_f1: 0.5104
 epoch: 93, train_loss: 0.8145, test_loss: 1.0727, test_f1: 0.5027
 epoch: 94, train_loss: 0.8176, test_loss: 1.0607, test_f1: 0.5046
 epoch: 95, train_loss: 0.8045, test_loss: 1.1024, test_f1: 0.4992
 epoch: 96, train_loss: 0.8236, test_loss: 1.0743, test_f1: 0.5054
 epoch: 97, train_loss: 0.8057, test_loss: 1.0762, test_f1: 0.5055
 epoch: 98, train_loss: 0.8077, test_loss: 1.0672, test_f1: 0.5165
 epoch: 99, train_loss: 0.7962, test_loss: 1.0853, test_f1: 0.5165
##################ITERATION #4 ****************************************
 epoch: 0, train_loss: 1.3062, test_loss: 1.2660, test_f1: 0.3232
 epoch: 1, train_loss: 1.2454, test_loss: 1.2194, test_f1: 0.3679
 epoch: 2, train_loss: 1.2279, test_loss: 1.2067, test_f1: 0.3827
 epoch: 3, train_loss: 1.2079, test_loss: 1.1922, test_f1: 0.4333
 epoch: 4, train_loss: 1.2065, test_loss: 1.1746, test_f1: 0.4206
 epoch: 5, train_loss: 1.1940, test_loss: 1.1645, test_f1: 0.4347
 epoch: 6, train_loss: 1.1931, test_loss: 1.1654, test_f1: 0.4208
 epoch: 7, train_loss: 1.1758, test_loss: 1.1479, test_f1: 0.4224
 epoch: 8, train_loss: 1.1669, test_loss: 1.1396, test_f1: 0.4310
 epoch: 9, train_loss: 1.1478, test_loss: 1.1337, test_f1: 0.4054
 epoch: 10, train_loss: 1.1606, test_loss: 1.1258, test_f1: 0.4324
 epoch: 11, train_loss: 1.1440, test_loss: 1.1268, test_f1: 0.4080
 epoch: 12, train_loss: 1.1334, test_loss: 1.1187, test_f1: 0.4117
 epoch: 13, train_loss: 1.1274, test_loss: 1.1061, test_f1: 0.4173
 epoch: 14, train_loss: 1.1154, test_loss: 1.1009, test_f1: 0.4251
 epoch: 15, train_loss: 1.1048, test_loss: 1.0978, test_f1: 0.4136
 epoch: 16, train_loss: 1.1143, test_loss: 1.0903, test_f1: 0.4218
 epoch: 17, train_loss: 1.1110, test_loss: 1.0851, test_f1: 0.4575
 epoch: 18, train_loss: 1.1012, test_loss: 1.0678, test_f1: 0.4586
 epoch: 19, train_loss: 1.0905, test_loss: 1.0725, test_f1: 0.4553
 epoch: 20, train_loss: 1.0845, test_loss: 1.0601, test_f1: 0.4635
 epoch: 21, train_loss: 1.0778, test_loss: 1.0603, test_f1: 0.4393
 epoch: 22, train_loss: 1.0667, test_loss: 1.0522, test_f1: 0.4719
 epoch: 23, train_loss: 1.0615, test_loss: 1.0463, test_f1: 0.4493
 epoch: 24, train_loss: 1.0571, test_loss: 1.0241, test_f1: 0.4850
 epoch: 25, train_loss: 1.0479, test_loss: 1.0331, test_f1: 0.4667
 epoch: 26, train_loss: 1.0412, test_loss: 1.0256, test_f1: 0.4796
 epoch: 27, train_loss: 1.0248, test_loss: 1.0154, test_f1: 0.4875
 epoch: 28, train_loss: 1.0298, test_loss: 1.0297, test_f1: 0.4768
 epoch: 29, train_loss: 1.0234, test_loss: 1.0184, test_f1: 0.4762
 epoch: 30, train_loss: 1.0230, test_loss: 1.0164, test_f1: 0.4695
 epoch: 31, train_loss: 1.0078, test_loss: 0.9989, test_f1: 0.4846
 epoch: 32, train_loss: 1.0103, test_loss: 1.0123, test_f1: 0.4821
 epoch: 33, train_loss: 1.0066, test_loss: 0.9978, test_f1: 0.4943
 epoch: 34, train_loss: 1.0070, test_loss: 1.0016, test_f1: 0.4940
 epoch: 35, train_loss: 0.9951, test_loss: 1.0002, test_f1: 0.4750
 epoch: 36, train_loss: 0.9804, test_loss: 0.9910, test_f1: 0.4975
 epoch: 37, train_loss: 0.9825, test_loss: 1.0037, test_f1: 0.4958
 epoch: 38, train_loss: 0.9798, test_loss: 0.9958, test_f1: 0.4989
 epoch: 39, train_loss: 0.9649, test_loss: 0.9972, test_f1: 0.4853
 epoch: 40, train_loss: 0.9670, test_loss: 0.9971, test_f1: 0.5007
 epoch: 41, train_loss: 0.9603, test_loss: 1.0074, test_f1: 0.4922
 epoch: 42, train_loss: 0.9578, test_loss: 0.9986, test_f1: 0.4910
 epoch: 43, train_loss: 0.9630, test_loss: 0.9910, test_f1: 0.4848
 epoch: 44, train_loss: 0.9518, test_loss: 0.9981, test_f1: 0.5066
 epoch: 45, train_loss: 0.9533, test_loss: 1.0007, test_f1: 0.5012
 epoch: 46, train_loss: 0.9465, test_loss: 0.9945, test_f1: 0.5075
 epoch: 47, train_loss: 0.9419, test_loss: 0.9984, test_f1: 0.5004
 epoch: 48, train_loss: 0.9500, test_loss: 0.9827, test_f1: 0.5150
 epoch: 49, train_loss: 0.9343, test_loss: 0.9883, test_f1: 0.4824
 epoch: 50, train_loss: 0.9354, test_loss: 0.9798, test_f1: 0.5041
 epoch: 51, train_loss: 0.9231, test_loss: 0.9994, test_f1: 0.4798
 epoch: 52, train_loss: 0.9100, test_loss: 0.9972, test_f1: 0.5011
 epoch: 53, train_loss: 0.9061, test_loss: 0.9901, test_f1: 0.4980
 epoch: 54, train_loss: 0.9125, test_loss: 1.0138, test_f1: 0.4876
 epoch: 55, train_loss: 0.9049, test_loss: 0.9876, test_f1: 0.5042
 epoch: 56, train_loss: 0.9000, test_loss: 0.9996, test_f1: 0.4965
 epoch: 57, train_loss: 0.9139, test_loss: 1.0078, test_f1: 0.4972
 epoch: 58, train_loss: 0.8975, test_loss: 1.0166, test_f1: 0.4891
 epoch: 59, train_loss: 0.8984, test_loss: 1.0033, test_f1: 0.5009
 epoch: 60, train_loss: 0.8923, test_loss: 1.0110, test_f1: 0.5043
 epoch: 61, train_loss: 0.8932, test_loss: 1.0131, test_f1: 0.4970
 epoch: 62, train_loss: 0.8972, test_loss: 1.0102, test_f1: 0.5056
 epoch: 63, train_loss: 0.8885, test_loss: 1.0114, test_f1: 0.5068
 epoch: 64, train_loss: 0.8974, test_loss: 0.9999, test_f1: 0.4868
 epoch: 65, train_loss: 0.8869, test_loss: 1.0184, test_f1: 0.4947
 epoch: 66, train_loss: 0.8745, test_loss: 1.0072, test_f1: 0.4994
 epoch: 67, train_loss: 0.8822, test_loss: 1.0115, test_f1: 0.4929
 epoch: 68, train_loss: 0.8844, test_loss: 1.0238, test_f1: 0.4947
 epoch: 69, train_loss: 0.8685, test_loss: 1.0219, test_f1: 0.4934
 epoch: 70, train_loss: 0.8750, test_loss: 1.0291, test_f1: 0.4911
 epoch: 71, train_loss: 0.8682, test_loss: 1.0026, test_f1: 0.5100
 epoch: 72, train_loss: 0.8722, test_loss: 1.0244, test_f1: 0.5037
 epoch: 73, train_loss: 0.8760, test_loss: 1.0232, test_f1: 0.4983
 epoch: 74, train_loss: 0.8756, test_loss: 1.0231, test_f1: 0.5035
 epoch: 75, train_loss: 0.8733, test_loss: 1.0268, test_f1: 0.4994
 epoch: 76, train_loss: 0.8788, test_loss: 1.0207, test_f1: 0.4969
 epoch: 77, train_loss: 0.8568, test_loss: 1.0154, test_f1: 0.5057
 epoch: 78, train_loss: 0.8674, test_loss: 1.0383, test_f1: 0.4904
 epoch: 79, train_loss: 0.8699, test_loss: 1.0373, test_f1: 0.4956
 epoch: 80, train_loss: 0.8667, test_loss: 1.0273, test_f1: 0.5091
 epoch: 81, train_loss: 0.8641, test_loss: 1.0310, test_f1: 0.4971
 epoch: 82, train_loss: 0.8477, test_loss: 1.0438, test_f1: 0.4900
 epoch: 83, train_loss: 0.8558, test_loss: 1.0430, test_f1: 0.5057
 epoch: 84, train_loss: 0.8573, test_loss: 1.0242, test_f1: 0.5010
 epoch: 85, train_loss: 0.8514, test_loss: 1.0398, test_f1: 0.4883
 epoch: 86, train_loss: 0.8487, test_loss: 1.0425, test_f1: 0.4972
 epoch: 87, train_loss: 0.8357, test_loss: 1.0395, test_f1: 0.4883
 epoch: 88, train_loss: 0.8503, test_loss: 1.0407, test_f1: 0.4954
 epoch: 89, train_loss: 0.8419, test_loss: 1.0333, test_f1: 0.5051
 epoch: 90, train_loss: 0.8476, test_loss: 1.0406, test_f1: 0.4993
 epoch: 91, train_loss: 0.8572, test_loss: 1.0571, test_f1: 0.4957
 epoch: 92, train_loss: 0.8477, test_loss: 1.0510, test_f1: 0.5049
 epoch: 93, train_loss: 0.8400, test_loss: 1.0564, test_f1: 0.5006
 epoch: 94, train_loss: 0.8276, test_loss: 1.0191, test_f1: 0.5118
 epoch: 95, train_loss: 0.8418, test_loss: 1.0419, test_f1: 0.4993
 epoch: 96, train_loss: 0.8450, test_loss: 1.0430, test_f1: 0.5075
 epoch: 97, train_loss: 0.8254, test_loss: 1.0525, test_f1: 0.5132
 epoch: 98, train_loss: 0.8410, test_loss: 1.0400, test_f1: 0.5125
 epoch: 99, train_loss: 0.8373, test_loss: 1.0474, test_f1: 0.5078
##################ITERATION #5 ****************************************
 epoch: 0, train_loss: 1.3057, test_loss: 1.2507, test_f1: 0.2992
 epoch: 1, train_loss: 1.2402, test_loss: 1.1828, test_f1: 0.3834
 epoch: 2, train_loss: 1.2170, test_loss: 1.1601, test_f1: 0.4057
 epoch: 3, train_loss: 1.2020, test_loss: 1.1459, test_f1: 0.4188
 epoch: 4, train_loss: 1.1854, test_loss: 1.1429, test_f1: 0.4062
 epoch: 5, train_loss: 1.1814, test_loss: 1.1324, test_f1: 0.4068
 epoch: 6, train_loss: 1.1640, test_loss: 1.1257, test_f1: 0.4092
 epoch: 7, train_loss: 1.1657, test_loss: 1.1258, test_f1: 0.4246
 epoch: 8, train_loss: 1.1456, test_loss: 1.1108, test_f1: 0.4434
 epoch: 9, train_loss: 1.1396, test_loss: 1.1178, test_f1: 0.4140
 epoch: 10, train_loss: 1.1371, test_loss: 1.1042, test_f1: 0.4331
 epoch: 11, train_loss: 1.1201, test_loss: 1.1007, test_f1: 0.4302
 epoch: 12, train_loss: 1.1231, test_loss: 1.0953, test_f1: 0.4291
 epoch: 13, train_loss: 1.1141, test_loss: 1.0865, test_f1: 0.4298
 epoch: 14, train_loss: 1.1011, test_loss: 1.0841, test_f1: 0.4240
 epoch: 15, train_loss: 1.0983, test_loss: 1.0813, test_f1: 0.4236
 epoch: 16, train_loss: 1.0896, test_loss: 1.0693, test_f1: 0.4173
 epoch: 17, train_loss: 1.0785, test_loss: 1.0701, test_f1: 0.4301
 epoch: 18, train_loss: 1.0841, test_loss: 1.0663, test_f1: 0.4179
 epoch: 19, train_loss: 1.0770, test_loss: 1.0657, test_f1: 0.4338
 epoch: 20, train_loss: 1.0717, test_loss: 1.0641, test_f1: 0.4328
 epoch: 21, train_loss: 1.0587, test_loss: 1.0475, test_f1: 0.4353
 epoch: 22, train_loss: 1.0509, test_loss: 1.0357, test_f1: 0.4292
 epoch: 23, train_loss: 1.0523, test_loss: 1.0509, test_f1: 0.4384
 epoch: 24, train_loss: 1.0503, test_loss: 1.0351, test_f1: 0.4354
 epoch: 25, train_loss: 1.0399, test_loss: 1.0366, test_f1: 0.4268
 epoch: 26, train_loss: 1.0377, test_loss: 1.0299, test_f1: 0.4306
 epoch: 27, train_loss: 1.0291, test_loss: 1.0501, test_f1: 0.3958
 epoch: 28, train_loss: 1.0168, test_loss: 1.0325, test_f1: 0.4246
 epoch: 29, train_loss: 1.0193, test_loss: 1.0088, test_f1: 0.4271
 epoch: 30, train_loss: 1.0158, test_loss: 1.0057, test_f1: 0.4291
 epoch: 31, train_loss: 0.9975, test_loss: 1.0084, test_f1: 0.4246
 epoch: 32, train_loss: 0.9916, test_loss: 1.0229, test_f1: 0.4125
 epoch: 33, train_loss: 0.9779, test_loss: 1.0163, test_f1: 0.4356
 epoch: 34, train_loss: 0.9761, test_loss: 1.0098, test_f1: 0.4270
 epoch: 35, train_loss: 0.9791, test_loss: 1.0033, test_f1: 0.4379
 epoch: 36, train_loss: 0.9699, test_loss: 1.0211, test_f1: 0.4360
 epoch: 37, train_loss: 0.9557, test_loss: 1.0137, test_f1: 0.4288
 epoch: 38, train_loss: 0.9526, test_loss: 1.0174, test_f1: 0.4198
 epoch: 39, train_loss: 0.9613, test_loss: 1.0304, test_f1: 0.4249
 epoch: 40, train_loss: 0.9590, test_loss: 1.0088, test_f1: 0.4344
 epoch: 41, train_loss: 0.9474, test_loss: 1.0122, test_f1: 0.4338
 epoch: 42, train_loss: 0.9556, test_loss: 1.0490, test_f1: 0.4241
 epoch: 43, train_loss: 0.9410, test_loss: 1.0148, test_f1: 0.4362
 epoch: 44, train_loss: 0.9384, test_loss: 1.0429, test_f1: 0.4268
 epoch: 45, train_loss: 0.9358, test_loss: 1.0237, test_f1: 0.4300
 epoch: 46, train_loss: 0.9270, test_loss: 1.0398, test_f1: 0.4304
 epoch: 47, train_loss: 0.9341, test_loss: 1.0521, test_f1: 0.4229
 epoch: 48, train_loss: 0.9218, test_loss: 1.0482, test_f1: 0.4345
 epoch: 49, train_loss: 0.9304, test_loss: 1.0271, test_f1: 0.4431
 epoch: 50, train_loss: 0.9094, test_loss: 1.0208, test_f1: 0.4502
 epoch: 51, train_loss: 0.9156, test_loss: 1.0418, test_f1: 0.4384
 epoch: 52, train_loss: 0.9073, test_loss: 1.0325, test_f1: 0.4436
 epoch: 53, train_loss: 0.9038, test_loss: 1.0381, test_f1: 0.4366
 epoch: 54, train_loss: 0.8948, test_loss: 1.0247, test_f1: 0.4423
 epoch: 55, train_loss: 0.8927, test_loss: 1.0282, test_f1: 0.4363
 epoch: 56, train_loss: 0.8949, test_loss: 1.0281, test_f1: 0.4428
 epoch: 57, train_loss: 0.8921, test_loss: 1.0141, test_f1: 0.4555
 epoch: 58, train_loss: 0.8892, test_loss: 1.0180, test_f1: 0.4464
 epoch: 59, train_loss: 0.9069, test_loss: 1.0272, test_f1: 0.4431
 epoch: 60, train_loss: 0.8922, test_loss: 1.0006, test_f1: 0.4630
 epoch: 61, train_loss: 0.8932, test_loss: 1.0428, test_f1: 0.4426
 epoch: 62, train_loss: 0.8815, test_loss: 1.0291, test_f1: 0.4452
 epoch: 63, train_loss: 0.8906, test_loss: 1.0157, test_f1: 0.4544
 epoch: 64, train_loss: 0.8745, test_loss: 1.0414, test_f1: 0.4349
 epoch: 65, train_loss: 0.8798, test_loss: 1.0278, test_f1: 0.4498
 epoch: 66, train_loss: 0.8781, test_loss: 1.0525, test_f1: 0.4348
 epoch: 67, train_loss: 0.8695, test_loss: 1.0692, test_f1: 0.4471
 epoch: 68, train_loss: 0.8757, test_loss: 1.0291, test_f1: 0.4543
 epoch: 69, train_loss: 0.8632, test_loss: 1.0271, test_f1: 0.4592
 epoch: 70, train_loss: 0.8678, test_loss: 1.0235, test_f1: 0.4464
 epoch: 71, train_loss: 0.8929, test_loss: 1.0494, test_f1: 0.4599
 epoch: 72, train_loss: 0.8666, test_loss: 1.0580, test_f1: 0.4387
 epoch: 73, train_loss: 0.8713, test_loss: 1.0264, test_f1: 0.4514
 epoch: 74, train_loss: 0.8673, test_loss: 1.0414, test_f1: 0.4443
 epoch: 75, train_loss: 0.8603, test_loss: 1.0522, test_f1: 0.4424
 epoch: 76, train_loss: 0.8716, test_loss: 1.0371, test_f1: 0.4473
 epoch: 77, train_loss: 0.8601, test_loss: 1.0374, test_f1: 0.4518
 epoch: 78, train_loss: 0.8560, test_loss: 1.0193, test_f1: 0.4778
 epoch: 79, train_loss: 0.8616, test_loss: 1.0450, test_f1: 0.4505
 epoch: 80, train_loss: 0.8548, test_loss: 1.0414, test_f1: 0.4663
 epoch: 81, train_loss: 0.8558, test_loss: 1.0634, test_f1: 0.4519
 epoch: 82, train_loss: 0.8551, test_loss: 1.0442, test_f1: 0.4580
 epoch: 83, train_loss: 0.8475, test_loss: 1.0510, test_f1: 0.4647
 epoch: 84, train_loss: 0.8437, test_loss: 1.0606, test_f1: 0.4595
 epoch: 85, train_loss: 0.8591, test_loss: 1.0535, test_f1: 0.4614
 epoch: 86, train_loss: 0.8566, test_loss: 1.0441, test_f1: 0.4665
 epoch: 87, train_loss: 0.8345, test_loss: 1.0735, test_f1: 0.4461
 epoch: 88, train_loss: 0.8332, test_loss: 1.0531, test_f1: 0.4612
 epoch: 89, train_loss: 0.8516, test_loss: 1.0420, test_f1: 0.4568
 epoch: 90, train_loss: 0.8360, test_loss: 1.0548, test_f1: 0.4473
 epoch: 91, train_loss: 0.8435, test_loss: 1.0707, test_f1: 0.4662
 epoch: 92, train_loss: 0.8381, test_loss: 1.0842, test_f1: 0.4500
 epoch: 93, train_loss: 0.8351, test_loss: 1.0830, test_f1: 0.4603
 epoch: 94, train_loss: 0.8381, test_loss: 1.0658, test_f1: 0.4657
 epoch: 95, train_loss: 0.8316, test_loss: 1.0690, test_f1: 0.4591
 epoch: 96, train_loss: 0.8445, test_loss: 1.0538, test_f1: 0.4615
 epoch: 97, train_loss: 0.8157, test_loss: 1.0609, test_f1: 0.4536
 epoch: 98, train_loss: 0.8256, test_loss: 1.0760, test_f1: 0.4509
 epoch: 99, train_loss: 0.8240, test_loss: 1.0344, test_f1: 0.4718
##################ITERATION #6 ****************************************
 epoch: 0, train_loss: 1.3185, test_loss: 1.2448, test_f1: 0.3381
 epoch: 1, train_loss: 1.2385, test_loss: 1.2011, test_f1: 0.4005
 epoch: 2, train_loss: 1.2067, test_loss: 1.1768, test_f1: 0.4255
 epoch: 3, train_loss: 1.1883, test_loss: 1.1625, test_f1: 0.4221
 epoch: 4, train_loss: 1.1768, test_loss: 1.1443, test_f1: 0.4377
 epoch: 5, train_loss: 1.1609, test_loss: 1.1279, test_f1: 0.4418
 epoch: 6, train_loss: 1.1484, test_loss: 1.1238, test_f1: 0.4429
 epoch: 7, train_loss: 1.1315, test_loss: 1.1086, test_f1: 0.4513
 epoch: 8, train_loss: 1.1277, test_loss: 1.0923, test_f1: 0.4522
 epoch: 9, train_loss: 1.1138, test_loss: 1.0849, test_f1: 0.4526
 epoch: 10, train_loss: 1.1188, test_loss: 1.0778, test_f1: 0.4555
 epoch: 11, train_loss: 1.0998, test_loss: 1.0721, test_f1: 0.4764
 epoch: 12, train_loss: 1.0846, test_loss: 1.0606, test_f1: 0.4664
 epoch: 13, train_loss: 1.0850, test_loss: 1.0550, test_f1: 0.4704
 epoch: 14, train_loss: 1.0658, test_loss: 1.0459, test_f1: 0.4752
 epoch: 15, train_loss: 1.0616, test_loss: 1.0385, test_f1: 0.4846
 epoch: 16, train_loss: 1.0634, test_loss: 1.0352, test_f1: 0.4771
 epoch: 17, train_loss: 1.0477, test_loss: 1.0241, test_f1: 0.4852
 epoch: 18, train_loss: 1.0459, test_loss: 1.0200, test_f1: 0.4925
 epoch: 19, train_loss: 1.0361, test_loss: 1.0289, test_f1: 0.4636
 epoch: 20, train_loss: 1.0328, test_loss: 1.0198, test_f1: 0.4744
 epoch: 21, train_loss: 1.0192, test_loss: 0.9887, test_f1: 0.4942
 epoch: 22, train_loss: 1.0196, test_loss: 1.0145, test_f1: 0.4729
 epoch: 23, train_loss: 1.0106, test_loss: 1.0074, test_f1: 0.4730
 epoch: 24, train_loss: 1.0114, test_loss: 1.0026, test_f1: 0.4848
 epoch: 25, train_loss: 0.9949, test_loss: 1.0064, test_f1: 0.4755
 epoch: 26, train_loss: 1.0002, test_loss: 1.0176, test_f1: 0.4806
 epoch: 27, train_loss: 0.9820, test_loss: 0.9846, test_f1: 0.4870
 epoch: 28, train_loss: 0.9808, test_loss: 0.9940, test_f1: 0.4748
 epoch: 29, train_loss: 0.9822, test_loss: 1.0026, test_f1: 0.4813
 epoch: 30, train_loss: 0.9864, test_loss: 1.0005, test_f1: 0.4770
 epoch: 31, train_loss: 0.9767, test_loss: 0.9833, test_f1: 0.4785
 epoch: 32, train_loss: 0.9683, test_loss: 0.9732, test_f1: 0.4816
 epoch: 33, train_loss: 0.9563, test_loss: 0.9813, test_f1: 0.4790
 epoch: 34, train_loss: 0.9601, test_loss: 0.9707, test_f1: 0.4819
 epoch: 35, train_loss: 0.9568, test_loss: 0.9757, test_f1: 0.4823
 epoch: 36, train_loss: 0.9517, test_loss: 0.9750, test_f1: 0.4828
 epoch: 37, train_loss: 0.9686, test_loss: 0.9696, test_f1: 0.4865
 epoch: 38, train_loss: 0.9429, test_loss: 0.9705, test_f1: 0.4858
 epoch: 39, train_loss: 0.9296, test_loss: 0.9651, test_f1: 0.4906
 epoch: 40, train_loss: 0.9295, test_loss: 0.9847, test_f1: 0.4854
 epoch: 41, train_loss: 0.9341, test_loss: 0.9753, test_f1: 0.4916
 epoch: 42, train_loss: 0.9300, test_loss: 0.9868, test_f1: 0.4727
 epoch: 43, train_loss: 0.9297, test_loss: 0.9754, test_f1: 0.4727
 epoch: 44, train_loss: 0.9227, test_loss: 0.9887, test_f1: 0.4809
 epoch: 45, train_loss: 0.9184, test_loss: 1.0002, test_f1: 0.4699
 epoch: 46, train_loss: 0.9140, test_loss: 1.0009, test_f1: 0.4654
 epoch: 47, train_loss: 0.9126, test_loss: 0.9745, test_f1: 0.4954
 epoch: 48, train_loss: 0.9098, test_loss: 0.9869, test_f1: 0.4828
 epoch: 49, train_loss: 0.8910, test_loss: 0.9806, test_f1: 0.4768
 epoch: 50, train_loss: 0.9022, test_loss: 0.9693, test_f1: 0.4832
 epoch: 51, train_loss: 0.8910, test_loss: 0.9651, test_f1: 0.4762
 epoch: 52, train_loss: 0.8891, test_loss: 0.9771, test_f1: 0.4879
 epoch: 53, train_loss: 0.8876, test_loss: 1.0046, test_f1: 0.4860
 epoch: 54, train_loss: 0.8822, test_loss: 0.9840, test_f1: 0.4869
 epoch: 55, train_loss: 0.8773, test_loss: 0.9992, test_f1: 0.4872
 epoch: 56, train_loss: 0.8863, test_loss: 0.9960, test_f1: 0.4861
 epoch: 57, train_loss: 0.8739, test_loss: 0.9845, test_f1: 0.4864
 epoch: 58, train_loss: 0.8787, test_loss: 0.9865, test_f1: 0.4961
 epoch: 59, train_loss: 0.8754, test_loss: 1.0114, test_f1: 0.5120
 epoch: 60, train_loss: 0.8783, test_loss: 1.0014, test_f1: 0.4875
 epoch: 61, train_loss: 0.8705, test_loss: 1.0140, test_f1: 0.4886
 epoch: 62, train_loss: 0.8758, test_loss: 0.9985, test_f1: 0.4949
 epoch: 63, train_loss: 0.8663, test_loss: 0.9985, test_f1: 0.5018
 epoch: 64, train_loss: 0.8598, test_loss: 0.9966, test_f1: 0.4871
 epoch: 65, train_loss: 0.8611, test_loss: 1.0127, test_f1: 0.4876
 epoch: 66, train_loss: 0.8714, test_loss: 1.0039, test_f1: 0.5017
 epoch: 67, train_loss: 0.8663, test_loss: 0.9827, test_f1: 0.5127
 epoch: 68, train_loss: 0.8568, test_loss: 0.9761, test_f1: 0.5074
 epoch: 69, train_loss: 0.8592, test_loss: 0.9731, test_f1: 0.5052
 epoch: 70, train_loss: 0.8595, test_loss: 1.0143, test_f1: 0.4878
 epoch: 71, train_loss: 0.8570, test_loss: 1.0087, test_f1: 0.5122
 epoch: 72, train_loss: 0.8506, test_loss: 0.9785, test_f1: 0.5010
 epoch: 73, train_loss: 0.8552, test_loss: 0.9980, test_f1: 0.4855
 epoch: 74, train_loss: 0.8536, test_loss: 0.9982, test_f1: 0.4970
 epoch: 75, train_loss: 0.8448, test_loss: 0.9964, test_f1: 0.4984
 epoch: 76, train_loss: 0.8502, test_loss: 1.0296, test_f1: 0.4998
 epoch: 77, train_loss: 0.8456, test_loss: 1.0154, test_f1: 0.4976
 epoch: 78, train_loss: 0.8562, test_loss: 1.0289, test_f1: 0.4868
 epoch: 79, train_loss: 0.8416, test_loss: 1.0178, test_f1: 0.4935
 epoch: 80, train_loss: 0.8465, test_loss: 1.0158, test_f1: 0.5132
 epoch: 81, train_loss: 0.8341, test_loss: 1.0281, test_f1: 0.4836
 epoch: 82, train_loss: 0.8424, test_loss: 1.0144, test_f1: 0.5218
 epoch: 83, train_loss: 0.8309, test_loss: 1.0164, test_f1: 0.5048
 epoch: 84, train_loss: 0.8288, test_loss: 1.0297, test_f1: 0.5030
 epoch: 85, train_loss: 0.8381, test_loss: 1.0271, test_f1: 0.4956
 epoch: 86, train_loss: 0.8415, test_loss: 1.0203, test_f1: 0.5243
 epoch: 87, train_loss: 0.8331, test_loss: 1.0414, test_f1: 0.4976
 epoch: 88, train_loss: 0.8237, test_loss: 1.0120, test_f1: 0.5188
 epoch: 89, train_loss: 0.8229, test_loss: 1.0337, test_f1: 0.5082
 epoch: 90, train_loss: 0.8193, test_loss: 1.0362, test_f1: 0.5055
 epoch: 91, train_loss: 0.8262, test_loss: 1.0306, test_f1: 0.5042
 epoch: 92, train_loss: 0.8131, test_loss: 1.0409, test_f1: 0.5040
 epoch: 93, train_loss: 0.8186, test_loss: 1.0286, test_f1: 0.5117
 epoch: 94, train_loss: 0.8171, test_loss: 1.0303, test_f1: 0.5061
 epoch: 95, train_loss: 0.8036, test_loss: 1.0398, test_f1: 0.5018
 epoch: 96, train_loss: 0.8098, test_loss: 1.0494, test_f1: 0.5064
 epoch: 97, train_loss: 0.8350, test_loss: 1.0266, test_f1: 0.5180
 epoch: 98, train_loss: 0.8108, test_loss: 1.0344, test_f1: 0.5119
 epoch: 99, train_loss: 0.8294, test_loss: 1.0490, test_f1: 0.5179
##################ITERATION #7 ****************************************
 epoch: 0, train_loss: 1.3030, test_loss: 1.2465, test_f1: 0.3746
 epoch: 1, train_loss: 1.2412, test_loss: 1.2028, test_f1: 0.3985
 epoch: 2, train_loss: 1.2234, test_loss: 1.1712, test_f1: 0.4235
 epoch: 3, train_loss: 1.1972, test_loss: 1.1466, test_f1: 0.4206
 epoch: 4, train_loss: 1.1887, test_loss: 1.1327, test_f1: 0.4115
 epoch: 5, train_loss: 1.1618, test_loss: 1.1208, test_f1: 0.4207
 epoch: 6, train_loss: 1.1656, test_loss: 1.1053, test_f1: 0.4367
 epoch: 7, train_loss: 1.1487, test_loss: 1.0981, test_f1: 0.4290
 epoch: 8, train_loss: 1.1453, test_loss: 1.0918, test_f1: 0.4306
 epoch: 9, train_loss: 1.1289, test_loss: 1.0794, test_f1: 0.4369
 epoch: 10, train_loss: 1.1301, test_loss: 1.0758, test_f1: 0.4461
 epoch: 11, train_loss: 1.1102, test_loss: 1.0678, test_f1: 0.4478
 epoch: 12, train_loss: 1.1042, test_loss: 1.0567, test_f1: 0.4496
 epoch: 13, train_loss: 1.0925, test_loss: 1.0591, test_f1: 0.4394
 epoch: 14, train_loss: 1.0848, test_loss: 1.0464, test_f1: 0.4540
 epoch: 15, train_loss: 1.0809, test_loss: 1.0503, test_f1: 0.4607
 epoch: 16, train_loss: 1.0798, test_loss: 1.0405, test_f1: 0.4489
 epoch: 17, train_loss: 1.0787, test_loss: 1.0408, test_f1: 0.4500
 epoch: 18, train_loss: 1.0722, test_loss: 1.0423, test_f1: 0.4381
 epoch: 19, train_loss: 1.0600, test_loss: 1.0253, test_f1: 0.4708
 epoch: 20, train_loss: 1.0480, test_loss: 1.0457, test_f1: 0.4654
 epoch: 21, train_loss: 1.0365, test_loss: 1.0291, test_f1: 0.4723
 epoch: 22, train_loss: 1.0538, test_loss: 1.0351, test_f1: 0.4538
 epoch: 23, train_loss: 1.0260, test_loss: 1.0188, test_f1: 0.4447
 epoch: 24, train_loss: 1.0279, test_loss: 1.0177, test_f1: 0.4498
 epoch: 25, train_loss: 1.0202, test_loss: 1.0284, test_f1: 0.4506
 epoch: 26, train_loss: 1.0170, test_loss: 1.0301, test_f1: 0.4429
 epoch: 27, train_loss: 1.0098, test_loss: 1.0251, test_f1: 0.4439
 epoch: 28, train_loss: 1.0087, test_loss: 1.0167, test_f1: 0.4471
 epoch: 29, train_loss: 1.0014, test_loss: 1.0106, test_f1: 0.4493
 epoch: 30, train_loss: 0.9971, test_loss: 1.0100, test_f1: 0.4634
 epoch: 31, train_loss: 0.9981, test_loss: 1.0169, test_f1: 0.4660
 epoch: 32, train_loss: 1.0054, test_loss: 1.0173, test_f1: 0.4742
 epoch: 33, train_loss: 0.9869, test_loss: 1.0081, test_f1: 0.4744
 epoch: 34, train_loss: 0.9692, test_loss: 1.0083, test_f1: 0.4586
 epoch: 35, train_loss: 0.9752, test_loss: 1.0318, test_f1: 0.4514
 epoch: 36, train_loss: 0.9784, test_loss: 1.0120, test_f1: 0.4554
 epoch: 37, train_loss: 0.9776, test_loss: 1.0151, test_f1: 0.4598
 epoch: 38, train_loss: 0.9739, test_loss: 1.0042, test_f1: 0.4658
 epoch: 39, train_loss: 0.9595, test_loss: 1.0073, test_f1: 0.4722
 epoch: 40, train_loss: 0.9409, test_loss: 1.0143, test_f1: 0.4606
 epoch: 41, train_loss: 0.9440, test_loss: 0.9998, test_f1: 0.4880
 epoch: 42, train_loss: 0.9516, test_loss: 0.9820, test_f1: 0.4575
 epoch: 43, train_loss: 0.9466, test_loss: 0.9962, test_f1: 0.4593
 epoch: 44, train_loss: 0.9468, test_loss: 1.0031, test_f1: 0.4626
 epoch: 45, train_loss: 0.9414, test_loss: 1.0094, test_f1: 0.4671
 epoch: 46, train_loss: 0.9385, test_loss: 0.9914, test_f1: 0.4727
 epoch: 47, train_loss: 0.9231, test_loss: 1.0076, test_f1: 0.4718
 epoch: 48, train_loss: 0.9253, test_loss: 1.0024, test_f1: 0.4848
 epoch: 49, train_loss: 0.9220, test_loss: 1.0048, test_f1: 0.4752
 epoch: 50, train_loss: 0.9141, test_loss: 1.0197, test_f1: 0.4584
 epoch: 51, train_loss: 0.9078, test_loss: 0.9835, test_f1: 0.4816
 epoch: 52, train_loss: 0.9120, test_loss: 1.0237, test_f1: 0.4665
 epoch: 53, train_loss: 0.9047, test_loss: 0.9829, test_f1: 0.4791
 epoch: 54, train_loss: 0.9095, test_loss: 0.9964, test_f1: 0.4731
 epoch: 55, train_loss: 0.8945, test_loss: 0.9911, test_f1: 0.4688
 epoch: 56, train_loss: 0.8979, test_loss: 1.0062, test_f1: 0.4829
 epoch: 57, train_loss: 0.8963, test_loss: 1.0040, test_f1: 0.4919
 epoch: 58, train_loss: 0.8857, test_loss: 1.0040, test_f1: 0.4781
 epoch: 59, train_loss: 0.8785, test_loss: 1.0043, test_f1: 0.4610
 epoch: 60, train_loss: 0.9001, test_loss: 1.0061, test_f1: 0.4849
 epoch: 61, train_loss: 0.8823, test_loss: 1.0071, test_f1: 0.4724
 epoch: 62, train_loss: 0.8897, test_loss: 1.0093, test_f1: 0.4622
 epoch: 63, train_loss: 0.8885, test_loss: 0.9959, test_f1: 0.4653
 epoch: 64, train_loss: 0.8859, test_loss: 1.0203, test_f1: 0.4745
 epoch: 65, train_loss: 0.8788, test_loss: 1.0181, test_f1: 0.4701
 epoch: 66, train_loss: 0.8715, test_loss: 1.0146, test_f1: 0.4655
 epoch: 67, train_loss: 0.8856, test_loss: 1.0103, test_f1: 0.4701
 epoch: 68, train_loss: 0.8717, test_loss: 1.0021, test_f1: 0.4706
 epoch: 69, train_loss: 0.8706, test_loss: 1.0021, test_f1: 0.4761
 epoch: 70, train_loss: 0.8718, test_loss: 1.0271, test_f1: 0.4747
 epoch: 71, train_loss: 0.8637, test_loss: 1.0031, test_f1: 0.4847
 epoch: 72, train_loss: 0.8776, test_loss: 0.9964, test_f1: 0.4795
 epoch: 73, train_loss: 0.8674, test_loss: 1.0131, test_f1: 0.4733
 epoch: 74, train_loss: 0.8721, test_loss: 1.0174, test_f1: 0.4787
 epoch: 75, train_loss: 0.8642, test_loss: 1.0028, test_f1: 0.4795
 epoch: 76, train_loss: 0.8551, test_loss: 1.0260, test_f1: 0.4774
 epoch: 77, train_loss: 0.8646, test_loss: 1.0146, test_f1: 0.4692
 epoch: 78, train_loss: 0.8545, test_loss: 1.0193, test_f1: 0.4819
 epoch: 79, train_loss: 0.8547, test_loss: 1.0133, test_f1: 0.4842
 epoch: 80, train_loss: 0.8454, test_loss: 1.0098, test_f1: 0.4783
 epoch: 81, train_loss: 0.8529, test_loss: 1.0072, test_f1: 0.4812
 epoch: 82, train_loss: 0.8657, test_loss: 1.0162, test_f1: 0.4755
 epoch: 83, train_loss: 0.8439, test_loss: 1.0130, test_f1: 0.4894
 epoch: 84, train_loss: 0.8464, test_loss: 1.0202, test_f1: 0.4724
 epoch: 85, train_loss: 0.8423, test_loss: 1.0222, test_f1: 0.4731
 epoch: 86, train_loss: 0.8394, test_loss: 1.0247, test_f1: 0.4736
 epoch: 87, train_loss: 0.8406, test_loss: 1.0074, test_f1: 0.4763
 epoch: 88, train_loss: 0.8411, test_loss: 1.0180, test_f1: 0.4848
 epoch: 89, train_loss: 0.8389, test_loss: 1.0051, test_f1: 0.4911
 epoch: 90, train_loss: 0.8321, test_loss: 1.0075, test_f1: 0.4867
 epoch: 91, train_loss: 0.8254, test_loss: 1.0075, test_f1: 0.4901
 epoch: 92, train_loss: 0.8221, test_loss: 1.0184, test_f1: 0.4865
 epoch: 93, train_loss: 0.8279, test_loss: 1.0122, test_f1: 0.4811
 epoch: 94, train_loss: 0.8225, test_loss: 1.0223, test_f1: 0.4906
 epoch: 95, train_loss: 0.8252, test_loss: 1.0299, test_f1: 0.5002
 epoch: 96, train_loss: 0.8275, test_loss: 1.0259, test_f1: 0.4877
 epoch: 97, train_loss: 0.8107, test_loss: 1.0225, test_f1: 0.4932
 epoch: 98, train_loss: 0.8209, test_loss: 1.0246, test_f1: 0.4952
 epoch: 99, train_loss: 0.8328, test_loss: 1.0383, test_f1: 0.4802
##################ITERATION #8 ****************************************
 epoch: 0, train_loss: 1.3181, test_loss: 1.1967, test_f1: 0.4059
 epoch: 1, train_loss: 1.2402, test_loss: 1.1573, test_f1: 0.4521
 epoch: 2, train_loss: 1.2215, test_loss: 1.1368, test_f1: 0.4576
 epoch: 3, train_loss: 1.2022, test_loss: 1.1152, test_f1: 0.4372
 epoch: 4, train_loss: 1.1883, test_loss: 1.1063, test_f1: 0.4569
 epoch: 5, train_loss: 1.1704, test_loss: 1.0906, test_f1: 0.4494
 epoch: 6, train_loss: 1.1664, test_loss: 1.0769, test_f1: 0.4519
 epoch: 7, train_loss: 1.1441, test_loss: 1.0654, test_f1: 0.4444
 epoch: 8, train_loss: 1.1360, test_loss: 1.0471, test_f1: 0.4619
 epoch: 9, train_loss: 1.1175, test_loss: 1.0438, test_f1: 0.4612
 epoch: 10, train_loss: 1.1204, test_loss: 1.0455, test_f1: 0.4460
 epoch: 11, train_loss: 1.1090, test_loss: 1.0300, test_f1: 0.4709
 epoch: 12, train_loss: 1.0935, test_loss: 1.0213, test_f1: 0.4681
 epoch: 13, train_loss: 1.0965, test_loss: 1.0145, test_f1: 0.4576
 epoch: 14, train_loss: 1.0794, test_loss: 1.0108, test_f1: 0.4699
 epoch: 15, train_loss: 1.0706, test_loss: 1.0040, test_f1: 0.4605
 epoch: 16, train_loss: 1.0649, test_loss: 0.9929, test_f1: 0.4767
 epoch: 17, train_loss: 1.0621, test_loss: 0.9882, test_f1: 0.4697
 epoch: 18, train_loss: 1.0546, test_loss: 0.9942, test_f1: 0.4665
 epoch: 19, train_loss: 1.0492, test_loss: 0.9901, test_f1: 0.4634
 epoch: 20, train_loss: 1.0451, test_loss: 0.9717, test_f1: 0.4573
 epoch: 21, train_loss: 1.0341, test_loss: 0.9738, test_f1: 0.4704
 epoch: 22, train_loss: 1.0223, test_loss: 0.9830, test_f1: 0.4565
 epoch: 23, train_loss: 1.0294, test_loss: 0.9753, test_f1: 0.4547
 epoch: 24, train_loss: 1.0129, test_loss: 0.9934, test_f1: 0.4676
 epoch: 25, train_loss: 1.0182, test_loss: 0.9857, test_f1: 0.4631
 epoch: 26, train_loss: 1.0083, test_loss: 0.9856, test_f1: 0.4608
 epoch: 27, train_loss: 1.0108, test_loss: 0.9857, test_f1: 0.4580
 epoch: 28, train_loss: 0.9957, test_loss: 0.9710, test_f1: 0.4861
 epoch: 29, train_loss: 1.0061, test_loss: 0.9842, test_f1: 0.4628
 epoch: 30, train_loss: 0.9879, test_loss: 0.9666, test_f1: 0.4781
 epoch: 31, train_loss: 0.9826, test_loss: 0.9576, test_f1: 0.4662
 epoch: 32, train_loss: 0.9865, test_loss: 0.9842, test_f1: 0.4786
 epoch: 33, train_loss: 0.9865, test_loss: 0.9626, test_f1: 0.4788
 epoch: 34, train_loss: 0.9848, test_loss: 0.9517, test_f1: 0.4949
 epoch: 35, train_loss: 0.9776, test_loss: 0.9676, test_f1: 0.4885
 epoch: 36, train_loss: 0.9590, test_loss: 0.9568, test_f1: 0.4881
 epoch: 37, train_loss: 0.9530, test_loss: 0.9723, test_f1: 0.4897
 epoch: 38, train_loss: 0.9695, test_loss: 0.9974, test_f1: 0.4838
 epoch: 39, train_loss: 0.9532, test_loss: 0.9540, test_f1: 0.5050
 epoch: 40, train_loss: 0.9451, test_loss: 0.9584, test_f1: 0.5042
 epoch: 41, train_loss: 0.9490, test_loss: 0.9553, test_f1: 0.4996
 epoch: 42, train_loss: 0.9554, test_loss: 0.9759, test_f1: 0.4960
 epoch: 43, train_loss: 0.9430, test_loss: 0.9537, test_f1: 0.5016
 epoch: 44, train_loss: 0.9456, test_loss: 0.9547, test_f1: 0.4951
 epoch: 45, train_loss: 0.9432, test_loss: 0.9537, test_f1: 0.4918
 epoch: 46, train_loss: 0.9221, test_loss: 0.9675, test_f1: 0.5002
 epoch: 47, train_loss: 0.9294, test_loss: 0.9998, test_f1: 0.4774
 epoch: 48, train_loss: 0.9328, test_loss: 0.9489, test_f1: 0.5058
 epoch: 49, train_loss: 0.9313, test_loss: 0.9706, test_f1: 0.5034
 epoch: 50, train_loss: 0.9183, test_loss: 0.9802, test_f1: 0.5022
 epoch: 51, train_loss: 0.9160, test_loss: 0.9664, test_f1: 0.5180
 epoch: 52, train_loss: 0.9122, test_loss: 0.9750, test_f1: 0.5125
 epoch: 53, train_loss: 0.9063, test_loss: 0.9674, test_f1: 0.5109
 epoch: 54, train_loss: 0.9082, test_loss: 0.9616, test_f1: 0.5180
 epoch: 55, train_loss: 0.9101, test_loss: 0.9670, test_f1: 0.5021
 epoch: 56, train_loss: 0.9051, test_loss: 0.9997, test_f1: 0.5032
 epoch: 57, train_loss: 0.8890, test_loss: 0.9602, test_f1: 0.5278
 epoch: 58, train_loss: 0.8908, test_loss: 0.9837, test_f1: 0.5124
 epoch: 59, train_loss: 0.8892, test_loss: 0.9837, test_f1: 0.5075
 epoch: 60, train_loss: 0.8867, test_loss: 1.0024, test_f1: 0.4899
 epoch: 61, train_loss: 0.8939, test_loss: 0.9759, test_f1: 0.5027
 epoch: 62, train_loss: 0.8955, test_loss: 0.9746, test_f1: 0.4955
 epoch: 63, train_loss: 0.8933, test_loss: 0.9686, test_f1: 0.5075
 epoch: 64, train_loss: 0.8918, test_loss: 0.9745, test_f1: 0.5061
 epoch: 65, train_loss: 0.8847, test_loss: 1.0248, test_f1: 0.4921
 epoch: 66, train_loss: 0.8841, test_loss: 1.0201, test_f1: 0.5108
 epoch: 67, train_loss: 0.8739, test_loss: 1.0168, test_f1: 0.4808
 epoch: 68, train_loss: 0.8729, test_loss: 1.0116, test_f1: 0.4822
 epoch: 69, train_loss: 0.8901, test_loss: 1.0267, test_f1: 0.5142
 epoch: 70, train_loss: 0.8782, test_loss: 1.0174, test_f1: 0.4922
 epoch: 71, train_loss: 0.8725, test_loss: 1.1054, test_f1: 0.4736
 epoch: 72, train_loss: 0.8739, test_loss: 0.9855, test_f1: 0.4827
 epoch: 73, train_loss: 0.8586, test_loss: 1.0295, test_f1: 0.4896
 epoch: 74, train_loss: 0.8726, test_loss: 1.0200, test_f1: 0.5013
 epoch: 75, train_loss: 0.8729, test_loss: 1.0492, test_f1: 0.5002
 epoch: 76, train_loss: 0.8765, test_loss: 1.0455, test_f1: 0.4876
 epoch: 77, train_loss: 0.8711, test_loss: 1.0377, test_f1: 0.4932
 epoch: 78, train_loss: 0.8720, test_loss: 0.9932, test_f1: 0.4917
 epoch: 79, train_loss: 0.8572, test_loss: 1.0454, test_f1: 0.5020
 epoch: 80, train_loss: 0.8546, test_loss: 0.9820, test_f1: 0.4931
 epoch: 81, train_loss: 0.8639, test_loss: 1.0321, test_f1: 0.4956
 epoch: 82, train_loss: 0.8580, test_loss: 1.0570, test_f1: 0.4829
 epoch: 83, train_loss: 0.8562, test_loss: 1.0508, test_f1: 0.4892
 epoch: 84, train_loss: 0.8598, test_loss: 1.0334, test_f1: 0.4891
 epoch: 85, train_loss: 0.8539, test_loss: 1.0133, test_f1: 0.5018
 epoch: 86, train_loss: 0.8663, test_loss: 0.9770, test_f1: 0.4911
 epoch: 87, train_loss: 0.8378, test_loss: 1.0508, test_f1: 0.4832
 epoch: 88, train_loss: 0.8528, test_loss: 1.0001, test_f1: 0.4944
 epoch: 89, train_loss: 0.8503, test_loss: 0.9789, test_f1: 0.5025
 epoch: 90, train_loss: 0.8528, test_loss: 0.9902, test_f1: 0.4912
 epoch: 91, train_loss: 0.8303, test_loss: 1.0843, test_f1: 0.4850
 epoch: 92, train_loss: 0.8457, test_loss: 1.0343, test_f1: 0.4879
 epoch: 93, train_loss: 0.8403, test_loss: 1.0250, test_f1: 0.4802
 epoch: 94, train_loss: 0.8370, test_loss: 1.0484, test_f1: 0.4913
 epoch: 95, train_loss: 0.8416, test_loss: 1.0558, test_f1: 0.4881
 epoch: 96, train_loss: 0.8244, test_loss: 1.0448, test_f1: 0.4826
 epoch: 97, train_loss: 0.8389, test_loss: 1.0292, test_f1: 0.5004
 epoch: 98, train_loss: 0.8395, test_loss: 1.0547, test_f1: 0.4817
 epoch: 99, train_loss: 0.8367, test_loss: 1.0283, test_f1: 0.5015
##################ITERATION #9 ****************************************
 epoch: 0, train_loss: 1.3279, test_loss: 1.2247, test_f1: 0.3306
 epoch: 1, train_loss: 1.2536, test_loss: 1.1827, test_f1: 0.4239
 epoch: 2, train_loss: 1.2289, test_loss: 1.1673, test_f1: 0.4443
 epoch: 3, train_loss: 1.2100, test_loss: 1.1454, test_f1: 0.4613
 epoch: 4, train_loss: 1.1835, test_loss: 1.1301, test_f1: 0.4761
 epoch: 5, train_loss: 1.1718, test_loss: 1.1183, test_f1: 0.4567
 epoch: 6, train_loss: 1.1609, test_loss: 1.1045, test_f1: 0.4691
 epoch: 7, train_loss: 1.1704, test_loss: 1.0980, test_f1: 0.4771
 epoch: 8, train_loss: 1.1344, test_loss: 1.0820, test_f1: 0.4789
 epoch: 9, train_loss: 1.1389, test_loss: 1.0785, test_f1: 0.4871
 epoch: 10, train_loss: 1.1260, test_loss: 1.0902, test_f1: 0.4739
 epoch: 11, train_loss: 1.1131, test_loss: 1.0893, test_f1: 0.4693
 epoch: 12, train_loss: 1.1000, test_loss: 1.0549, test_f1: 0.4814
 epoch: 13, train_loss: 1.0858, test_loss: 1.0499, test_f1: 0.4765
 epoch: 14, train_loss: 1.0796, test_loss: 1.0299, test_f1: 0.4732
 epoch: 15, train_loss: 1.0729, test_loss: 1.0313, test_f1: 0.4778
 epoch: 16, train_loss: 1.0766, test_loss: 1.0341, test_f1: 0.4741
 epoch: 17, train_loss: 1.0698, test_loss: 1.0311, test_f1: 0.4653
 epoch: 18, train_loss: 1.0600, test_loss: 1.0252, test_f1: 0.4620
 epoch: 19, train_loss: 1.0482, test_loss: 1.0137, test_f1: 0.4823
 epoch: 20, train_loss: 1.0506, test_loss: 1.0180, test_f1: 0.4703
 epoch: 21, train_loss: 1.0446, test_loss: 1.0079, test_f1: 0.4775
 epoch: 22, train_loss: 1.0374, test_loss: 1.0090, test_f1: 0.4872
 epoch: 23, train_loss: 1.0239, test_loss: 0.9995, test_f1: 0.4823
 epoch: 24, train_loss: 1.0308, test_loss: 0.9970, test_f1: 0.4741
 epoch: 25, train_loss: 1.0231, test_loss: 1.0181, test_f1: 0.4752
 epoch: 26, train_loss: 1.0203, test_loss: 0.9870, test_f1: 0.4868
 epoch: 27, train_loss: 1.0090, test_loss: 1.0099, test_f1: 0.4714
 epoch: 28, train_loss: 0.9946, test_loss: 0.9921, test_f1: 0.4624
 epoch: 29, train_loss: 0.9944, test_loss: 0.9778, test_f1: 0.4671
 epoch: 30, train_loss: 0.9931, test_loss: 1.0300, test_f1: 0.4660
 epoch: 31, train_loss: 0.9833, test_loss: 1.0354, test_f1: 0.4612
 epoch: 32, train_loss: 0.9832, test_loss: 0.9986, test_f1: 0.4629
 epoch: 33, train_loss: 0.9713, test_loss: 1.0406, test_f1: 0.4603
 epoch: 34, train_loss: 0.9763, test_loss: 1.0050, test_f1: 0.4705
 epoch: 35, train_loss: 0.9642, test_loss: 1.0038, test_f1: 0.4651
 epoch: 36, train_loss: 0.9737, test_loss: 1.0328, test_f1: 0.4756
 epoch: 37, train_loss: 0.9527, test_loss: 1.0519, test_f1: 0.4865
 epoch: 38, train_loss: 0.9535, test_loss: 1.0359, test_f1: 0.4931
 epoch: 39, train_loss: 0.9485, test_loss: 1.0035, test_f1: 0.4546
 epoch: 40, train_loss: 0.9533, test_loss: 0.9809, test_f1: 0.4920
 epoch: 41, train_loss: 0.9489, test_loss: 1.0270, test_f1: 0.4769
 epoch: 42, train_loss: 0.9338, test_loss: 1.0513, test_f1: 0.4754
 epoch: 43, train_loss: 0.9371, test_loss: 1.0478, test_f1: 0.4833
 epoch: 44, train_loss: 0.9296, test_loss: 1.0969, test_f1: 0.4681
 epoch: 45, train_loss: 0.9344, test_loss: 1.0581, test_f1: 0.4919
 epoch: 46, train_loss: 0.9203, test_loss: 1.0555, test_f1: 0.4890
 epoch: 47, train_loss: 0.9293, test_loss: 1.0292, test_f1: 0.4888
 epoch: 48, train_loss: 0.9111, test_loss: 1.0538, test_f1: 0.4933
 epoch: 49, train_loss: 0.9131, test_loss: 1.1050, test_f1: 0.4779
 epoch: 50, train_loss: 0.9063, test_loss: 1.0996, test_f1: 0.4866
 epoch: 51, train_loss: 0.9084, test_loss: 1.0249, test_f1: 0.4857
 epoch: 52, train_loss: 0.9021, test_loss: 1.0484, test_f1: 0.4817
 epoch: 53, train_loss: 0.8973, test_loss: 1.0807, test_f1: 0.4826
 epoch: 54, train_loss: 0.8931, test_loss: 1.0724, test_f1: 0.4984
 epoch: 55, train_loss: 0.8914, test_loss: 1.0565, test_f1: 0.4705
 epoch: 56, train_loss: 0.8993, test_loss: 1.0578, test_f1: 0.4938
 epoch: 57, train_loss: 0.8915, test_loss: 0.9939, test_f1: 0.4785
 epoch: 58, train_loss: 0.8917, test_loss: 1.0980, test_f1: 0.5016
 epoch: 59, train_loss: 0.8820, test_loss: 1.0781, test_f1: 0.4693
 epoch: 60, train_loss: 0.8735, test_loss: 1.0089, test_f1: 0.4818
 epoch: 61, train_loss: 0.8901, test_loss: 1.0562, test_f1: 0.4937
 epoch: 62, train_loss: 0.8851, test_loss: 1.0645, test_f1: 0.4995
 epoch: 63, train_loss: 0.8720, test_loss: 1.1163, test_f1: 0.4961
 epoch: 64, train_loss: 0.8758, test_loss: 1.1539, test_f1: 0.5051
 epoch: 65, train_loss: 0.8759, test_loss: 1.1307, test_f1: 0.5024
 epoch: 66, train_loss: 0.8684, test_loss: 1.0856, test_f1: 0.4795
 epoch: 67, train_loss: 0.8639, test_loss: 1.1116, test_f1: 0.5095
 epoch: 68, train_loss: 0.8648, test_loss: 1.0816, test_f1: 0.5049
 epoch: 69, train_loss: 0.8565, test_loss: 1.1171, test_f1: 0.4966
 epoch: 70, train_loss: 0.8631, test_loss: 1.1143, test_f1: 0.4989
 epoch: 71, train_loss: 0.8599, test_loss: 1.0408, test_f1: 0.5349
 epoch: 72, train_loss: 0.8672, test_loss: 1.1097, test_f1: 0.4772
 epoch: 73, train_loss: 0.8619, test_loss: 1.0466, test_f1: 0.5120
 epoch: 74, train_loss: 0.8460, test_loss: 1.1034, test_f1: 0.4988
 epoch: 75, train_loss: 0.8592, test_loss: 1.0950, test_f1: 0.5204
 epoch: 76, train_loss: 0.8634, test_loss: 1.1147, test_f1: 0.5041
 epoch: 77, train_loss: 0.8544, test_loss: 1.1021, test_f1: 0.5120
 epoch: 78, train_loss: 0.8485, test_loss: 1.1071, test_f1: 0.5014
 epoch: 79, train_loss: 0.8419, test_loss: 1.1580, test_f1: 0.4993
 epoch: 80, train_loss: 0.8523, test_loss: 1.1531, test_f1: 0.4989
 epoch: 81, train_loss: 0.8561, test_loss: 1.1176, test_f1: 0.4936
 epoch: 82, train_loss: 0.8457, test_loss: 1.1066, test_f1: 0.4954
 epoch: 83, train_loss: 0.8593, test_loss: 1.1478, test_f1: 0.5093
 epoch: 84, train_loss: 0.8420, test_loss: 1.1162, test_f1: 0.5043
 epoch: 85, train_loss: 0.8270, test_loss: 1.1946, test_f1: 0.4872
 epoch: 86, train_loss: 0.8482, test_loss: 1.1307, test_f1: 0.5088
 epoch: 87, train_loss: 0.8374, test_loss: 1.1938, test_f1: 0.5024
 epoch: 88, train_loss: 0.8316, test_loss: 1.1598, test_f1: 0.4950
 epoch: 89, train_loss: 0.8292, test_loss: 1.1138, test_f1: 0.5185
 epoch: 90, train_loss: 0.8315, test_loss: 1.1137, test_f1: 0.4988
 epoch: 91, train_loss: 0.8238, test_loss: 1.1120, test_f1: 0.5007
 epoch: 92, train_loss: 0.8239, test_loss: 1.1542, test_f1: 0.5114
 epoch: 93, train_loss: 0.8265, test_loss: 1.1244, test_f1: 0.5237
 epoch: 94, train_loss: 0.8211, test_loss: 1.1856, test_f1: 0.4885
 epoch: 95, train_loss: 0.8273, test_loss: 1.2214, test_f1: 0.5088
 epoch: 96, train_loss: 0.8228, test_loss: 1.1754, test_f1: 0.4865
 epoch: 97, train_loss: 0.8155, test_loss: 1.1940, test_f1: 0.5122
 epoch: 98, train_loss: 0.8235, test_loss: 1.1700, test_f1: 0.5073
 epoch: 99, train_loss: 0.8081, test_loss: 1.1511, test_f1: 0.5203

Training completed in 673.01 seconds
Best F1: 0.5349 at epoch 71
Mean F1 across iterations: 0.5159  0.0160
========================FINAL RESULTS================================
FEGIN weighted F1: 0.5349  0.0160
python main.py --data ltspice_examples --representation component_component --model FEGIN --layers 4 --hiddens 64 --batch_size 64 --lr 0.0001 --emb_size 250 --epochs 100 --save_appendix component_component_L4_H64_BS64_LR0.0001_E250 --no_val
-----



STDERR:
  File "main.py", line 370, in <module>
    main()
  File "main.py", line 254, in main
    dataset = dataset_class(
  File "/home/philip/projects/ltspice_examples_code_repo/Circuit-Completion-Using-GNNs/component_classification_with_link_prediction_head/evaluation/FEGIN/kernel/circuit_datasets.py", line 15, in __init__
    self.data, self.slices = torch.load(self.processed_paths[0])
  File "/home/philip/.local/lib/python3.8/site-packages/torch/serialization.py", line 1040, in load
    warnings.warn(
  File "/usr/lib/python3.8/warnings.py", line 109, in _showwarnmsg
    sw(msg.message, msg.category, msg.filename, msg.lineno,
  File "main.py", line 47, in warn_with_traceback
    traceback.print_stack(file=log)
/home/philip/projects/ltspice_examples_code_repo/Circuit-Completion-Using-GNNs/component_classification_with_link_prediction_head/evaluation/FEGIN/kernel/circuit_datasets.py:15: FutureWarning: You are using `torch.load` with `weights_only=False` (the current default value), which uses the default pickle module implicitly. It is possible to construct malicious pickle data which will execute arbitrary code during unpickling (See https://github.com/pytorch/pytorch/blob/main/SECURITY.md#untrusted-models for more details). In a future release, the default value for `weights_only` will be flipped to `True`. This limits the functions that could be executed during unpickling. Arbitrary objects will no longer be allowed to be loaded via this mode unless they are explicitly allowlisted by the user via `torch.serialization.add_safe_globals`. We recommend you start setting `weights_only=True` for any use case where you don't have full control of the loaded file. Please open an issue on GitHub for any issues related to this experimental feature.
  self.data, self.slices = torch.load(self.processed_paths[0])
