STDOUT:
Results will be saved in /home/philip/projects/ltspice_examples_code_repo/Circuit-Completion-Using-GNNs/component_classification_with_link_prediction_head/evaluation/FEGIN/results/model_FEGIN_dataset_ltspice_demos
Command line input: python main.py --data ltspice_demos --representation component_pin --model FEGIN --layers 6 --hiddens 32 --batch_size 32 --lr 0.01 --emb_size 512 --epochs 100 --save_appendix component_pin_L6_H32_BS32_LR0.01_E512 --no_val
 is saved.
-----
ltspice_demos - FEGIN
Using 6 layers, 32 hidden units, h = 2
Loading component_pin representation dataset
ENTERED
Training FEGIN on component_pin representation
Train: 1565, Test: 383
##################ITERATION #0 ****************************************
 epoch: 0, train_loss: 1.2397, test_loss: 1.2666, test_f1: 0.2281
 epoch: 1, train_loss: 1.1458, test_loss: 1.2273, test_f1: 0.3146
 epoch: 2, train_loss: 1.0358, test_loss: 1.2651, test_f1: 0.3617
 epoch: 3, train_loss: 1.0239, test_loss: 1.0681, test_f1: 0.4515
 epoch: 4, train_loss: 0.9959, test_loss: 1.0908, test_f1: 0.3510
 epoch: 5, train_loss: 0.9613, test_loss: 1.0517, test_f1: 0.4947
 epoch: 6, train_loss: 0.9663, test_loss: 1.0189, test_f1: 0.4524
 epoch: 7, train_loss: 0.9376, test_loss: 0.9951, test_f1: 0.4833
 epoch: 8, train_loss: 0.8857, test_loss: 0.9947, test_f1: 0.5707
 epoch: 9, train_loss: 0.9252, test_loss: 1.0340, test_f1: 0.5383
 epoch: 10, train_loss: 0.8831, test_loss: 0.9985, test_f1: 0.4713
 epoch: 11, train_loss: 0.8565, test_loss: 1.1464, test_f1: 0.4916
 epoch: 12, train_loss: 0.8758, test_loss: 0.9642, test_f1: 0.5448
 epoch: 13, train_loss: 0.8284, test_loss: 0.9953, test_f1: 0.5278
 epoch: 14, train_loss: 0.7929, test_loss: 1.2390, test_f1: 0.5147
 epoch: 15, train_loss: 0.8085, test_loss: 1.1063, test_f1: 0.5092
 epoch: 16, train_loss: 0.8073, test_loss: 0.9801, test_f1: 0.5326
 epoch: 17, train_loss: 0.8091, test_loss: 1.0441, test_f1: 0.5736
 epoch: 18, train_loss: 0.8007, test_loss: 0.9625, test_f1: 0.5165
 epoch: 19, train_loss: 0.7803, test_loss: 0.9517, test_f1: 0.5846
 epoch: 20, train_loss: 0.7902, test_loss: 0.9515, test_f1: 0.5717
 epoch: 21, train_loss: 0.7591, test_loss: 0.9457, test_f1: 0.5542
 epoch: 22, train_loss: 0.7683, test_loss: 0.9024, test_f1: 0.5939
 epoch: 23, train_loss: 0.7621, test_loss: 0.9780, test_f1: 0.5591
 epoch: 24, train_loss: 0.7635, test_loss: 0.9766, test_f1: 0.5693
 epoch: 25, train_loss: 0.7547, test_loss: 0.9200, test_f1: 0.5348
 epoch: 26, train_loss: 0.7429, test_loss: 1.0778, test_f1: 0.5834
 epoch: 27, train_loss: 0.7429, test_loss: 0.9966, test_f1: 0.6044
 epoch: 28, train_loss: 0.7594, test_loss: 0.9365, test_f1: 0.5944
 epoch: 29, train_loss: 0.7166, test_loss: 0.9874, test_f1: 0.5599
 epoch: 30, train_loss: 0.7211, test_loss: 1.0691, test_f1: 0.5828
 epoch: 31, train_loss: 0.6952, test_loss: 1.0538, test_f1: 0.6109
 epoch: 32, train_loss: 0.7499, test_loss: 1.1366, test_f1: 0.4890
 epoch: 33, train_loss: 0.7121, test_loss: 0.9556, test_f1: 0.5719
 epoch: 34, train_loss: 0.7255, test_loss: 0.9609, test_f1: 0.5606
 epoch: 35, train_loss: 0.7255, test_loss: 0.9727, test_f1: 0.6040
 epoch: 36, train_loss: 0.7225, test_loss: 0.9633, test_f1: 0.5636
 epoch: 37, train_loss: 0.7056, test_loss: 1.1049, test_f1: 0.5273
 epoch: 38, train_loss: 0.6939, test_loss: 0.9414, test_f1: 0.6452
 epoch: 39, train_loss: 0.7090, test_loss: 0.9918, test_f1: 0.5436
 epoch: 40, train_loss: 0.6918, test_loss: 1.2074, test_f1: 0.5354
 epoch: 41, train_loss: 0.7002, test_loss: 0.9991, test_f1: 0.5757
 epoch: 42, train_loss: 0.7053, test_loss: 0.9650, test_f1: 0.5698
 epoch: 43, train_loss: 0.7178, test_loss: 0.9099, test_f1: 0.5974
 epoch: 44, train_loss: 0.6814, test_loss: 1.0152, test_f1: 0.5882
 epoch: 45, train_loss: 0.6742, test_loss: 1.0340, test_f1: 0.5672
 epoch: 46, train_loss: 0.6847, test_loss: 1.0195, test_f1: 0.5643
 epoch: 47, train_loss: 0.6880, test_loss: 1.1144, test_f1: 0.5618
 epoch: 48, train_loss: 0.6647, test_loss: 0.9704, test_f1: 0.5991
 epoch: 49, train_loss: 0.6860, test_loss: 1.1611, test_f1: 0.6053
 epoch: 50, train_loss: 0.6751, test_loss: 0.9760, test_f1: 0.6200
 epoch: 51, train_loss: 0.6435, test_loss: 0.9903, test_f1: 0.6234
 epoch: 52, train_loss: 0.6267, test_loss: 0.9581, test_f1: 0.6126
 epoch: 53, train_loss: 0.6309, test_loss: 1.0824, test_f1: 0.5857
 epoch: 54, train_loss: 0.6123, test_loss: 1.0394, test_f1: 0.6328
 epoch: 55, train_loss: 0.5964, test_loss: 1.1091, test_f1: 0.6546
 epoch: 56, train_loss: 0.6112, test_loss: 1.1828, test_f1: 0.5756
 epoch: 57, train_loss: 0.6120, test_loss: 1.0991, test_f1: 0.6146
 epoch: 58, train_loss: 0.6023, test_loss: 1.1820, test_f1: 0.6199
 epoch: 59, train_loss: 0.5857, test_loss: 1.1209, test_f1: 0.6116
 epoch: 60, train_loss: 0.5979, test_loss: 1.0386, test_f1: 0.6146
 epoch: 61, train_loss: 0.6198, test_loss: 1.0009, test_f1: 0.6633
 epoch: 62, train_loss: 0.6004, test_loss: 1.0481, test_f1: 0.6519
 epoch: 63, train_loss: 0.6032, test_loss: 1.2180, test_f1: 0.6404
 epoch: 64, train_loss: 0.5917, test_loss: 1.0563, test_f1: 0.6200
 epoch: 65, train_loss: 0.5850, test_loss: 1.0932, test_f1: 0.6170
 epoch: 66, train_loss: 0.5773, test_loss: 1.0853, test_f1: 0.6408
 epoch: 67, train_loss: 0.5774, test_loss: 1.0739, test_f1: 0.6507
 epoch: 68, train_loss: 0.5767, test_loss: 1.2317, test_f1: 0.5779
 epoch: 69, train_loss: 0.5926, test_loss: 1.2083, test_f1: 0.6146
 epoch: 70, train_loss: 0.5700, test_loss: 1.1236, test_f1: 0.6294
 epoch: 71, train_loss: 0.5732, test_loss: 1.0907, test_f1: 0.6618
 epoch: 72, train_loss: 0.5541, test_loss: 1.1742, test_f1: 0.6163
 epoch: 73, train_loss: 0.5450, test_loss: 1.0670, test_f1: 0.6327
 epoch: 74, train_loss: 0.5593, test_loss: 1.0788, test_f1: 0.6451
 epoch: 75, train_loss: 0.5634, test_loss: 1.1694, test_f1: 0.5948
 epoch: 76, train_loss: 0.5410, test_loss: 1.1358, test_f1: 0.6597
 epoch: 77, train_loss: 0.5757, test_loss: 1.0152, test_f1: 0.6448
 epoch: 78, train_loss: 0.5597, test_loss: 1.0682, test_f1: 0.6446
 epoch: 79, train_loss: 0.5412, test_loss: 1.1859, test_f1: 0.6214
 epoch: 80, train_loss: 0.5511, test_loss: 0.9914, test_f1: 0.6298
 epoch: 81, train_loss: 0.5591, test_loss: 1.0244, test_f1: 0.6013
 epoch: 82, train_loss: 0.5308, test_loss: 1.0169, test_f1: 0.6378
 epoch: 83, train_loss: 0.5246, test_loss: 1.0279, test_f1: 0.6223
 epoch: 84, train_loss: 0.5494, test_loss: 1.0596, test_f1: 0.6497
 epoch: 85, train_loss: 0.5174, test_loss: 1.0053, test_f1: 0.6386
 epoch: 86, train_loss: 0.5384, test_loss: 1.2006, test_f1: 0.6246
 epoch: 87, train_loss: 0.5253, test_loss: 1.1256, test_f1: 0.6277
 epoch: 88, train_loss: 0.5428, test_loss: 1.0965, test_f1: 0.6342
 epoch: 89, train_loss: 0.5323, test_loss: 1.1817, test_f1: 0.5723
 epoch: 90, train_loss: 0.5389, test_loss: 1.0287, test_f1: 0.6227
 epoch: 91, train_loss: 0.5133, test_loss: 1.2880, test_f1: 0.6392
 epoch: 92, train_loss: 0.5300, test_loss: 1.1750, test_f1: 0.6511
 epoch: 93, train_loss: 0.5501, test_loss: 1.2080, test_f1: 0.6235
 epoch: 94, train_loss: 0.5568, test_loss: 1.2900, test_f1: 0.6349
 epoch: 95, train_loss: 0.5062, test_loss: 1.0713, test_f1: 0.6130
 epoch: 96, train_loss: 0.5058, test_loss: 1.1178, test_f1: 0.6314
 epoch: 97, train_loss: 0.5007, test_loss: 1.1514, test_f1: 0.6385
 epoch: 98, train_loss: 0.4936, test_loss: 1.3152, test_f1: 0.6287
 epoch: 99, train_loss: 0.5178, test_loss: 1.3342, test_f1: 0.5892
##################ITERATION #1 ****************************************
 epoch: 0, train_loss: 1.1443, test_loss: 1.3787, test_f1: 0.2261
 epoch: 1, train_loss: 1.0336, test_loss: 1.2064, test_f1: 0.4058
 epoch: 2, train_loss: 1.0390, test_loss: 1.0850, test_f1: 0.3439
 epoch: 3, train_loss: 0.9801, test_loss: 1.1645, test_f1: 0.4026
 epoch: 4, train_loss: 0.9517, test_loss: 1.1208, test_f1: 0.4534
 epoch: 5, train_loss: 0.9715, test_loss: 1.1905, test_f1: 0.3243
 epoch: 6, train_loss: 0.9307, test_loss: 1.1581, test_f1: 0.3982
 epoch: 7, train_loss: 0.8894, test_loss: 1.0021, test_f1: 0.4574
 epoch: 8, train_loss: 0.8541, test_loss: 1.0741, test_f1: 0.5196
 epoch: 9, train_loss: 0.8845, test_loss: 0.9994, test_f1: 0.5061
 epoch: 10, train_loss: 0.8746, test_loss: 1.1295, test_f1: 0.4953
 epoch: 11, train_loss: 0.8460, test_loss: 1.0723, test_f1: 0.5402
 epoch: 12, train_loss: 0.8585, test_loss: 1.0195, test_f1: 0.5721
 epoch: 13, train_loss: 0.8319, test_loss: 1.0913, test_f1: 0.4894
 epoch: 14, train_loss: 0.8309, test_loss: 0.9617, test_f1: 0.5723
 epoch: 15, train_loss: 0.8269, test_loss: 1.0454, test_f1: 0.5365
 epoch: 16, train_loss: 0.7981, test_loss: 0.9931, test_f1: 0.5363
 epoch: 17, train_loss: 0.8005, test_loss: 1.1442, test_f1: 0.5196
 epoch: 18, train_loss: 0.7970, test_loss: 1.2095, test_f1: 0.5016
 epoch: 19, train_loss: 0.7994, test_loss: 1.1970, test_f1: 0.4180
 epoch: 20, train_loss: 0.7914, test_loss: 0.9715, test_f1: 0.5829
 epoch: 21, train_loss: 0.7931, test_loss: 0.9795, test_f1: 0.5924
 epoch: 22, train_loss: 0.7912, test_loss: 0.9478, test_f1: 0.5171
 epoch: 23, train_loss: 0.7947, test_loss: 0.9955, test_f1: 0.5770
 epoch: 24, train_loss: 0.7779, test_loss: 0.9863, test_f1: 0.5728
 epoch: 25, train_loss: 0.7779, test_loss: 0.9976, test_f1: 0.5302
 epoch: 26, train_loss: 0.7726, test_loss: 1.1157, test_f1: 0.5729
 epoch: 27, train_loss: 0.7596, test_loss: 1.1507, test_f1: 0.5604
 epoch: 28, train_loss: 0.7817, test_loss: 1.2778, test_f1: 0.4892
 epoch: 29, train_loss: 0.7621, test_loss: 1.1404, test_f1: 0.4980
 epoch: 30, train_loss: 0.7476, test_loss: 1.0782, test_f1: 0.5834
 epoch: 31, train_loss: 0.7464, test_loss: 0.9671, test_f1: 0.5401
 epoch: 32, train_loss: 0.7537, test_loss: 1.1949, test_f1: 0.5913
 epoch: 33, train_loss: 0.7384, test_loss: 1.0911, test_f1: 0.5902
 epoch: 34, train_loss: 0.7347, test_loss: 1.1577, test_f1: 0.4929
 epoch: 35, train_loss: 0.7182, test_loss: 1.0912, test_f1: 0.6248
 epoch: 36, train_loss: 0.7191, test_loss: 0.9723, test_f1: 0.6016
 epoch: 37, train_loss: 0.7127, test_loss: 2.4209, test_f1: 0.3321
 epoch: 38, train_loss: 0.7234, test_loss: 1.1498, test_f1: 0.4787
 epoch: 39, train_loss: 0.7207, test_loss: 1.0167, test_f1: 0.5927
 epoch: 40, train_loss: 0.7183, test_loss: 0.9812, test_f1: 0.5965
 epoch: 41, train_loss: 0.7398, test_loss: 1.2242, test_f1: 0.5039
 epoch: 42, train_loss: 0.7023, test_loss: 1.0650, test_f1: 0.5799
 epoch: 43, train_loss: 0.7885, test_loss: 0.9359, test_f1: 0.5927
 epoch: 44, train_loss: 0.7341, test_loss: 1.0357, test_f1: 0.5861
 epoch: 45, train_loss: 0.7385, test_loss: 1.1520, test_f1: 0.5549
 epoch: 46, train_loss: 0.7192, test_loss: 1.2198, test_f1: 0.5515
 epoch: 47, train_loss: 0.7022, test_loss: 1.2403, test_f1: 0.5906
 epoch: 48, train_loss: 0.6975, test_loss: 1.0426, test_f1: 0.6032
 epoch: 49, train_loss: 0.7061, test_loss: 1.1751, test_f1: 0.5906
 epoch: 50, train_loss: 0.7435, test_loss: 1.1072, test_f1: 0.5407
 epoch: 51, train_loss: 0.6893, test_loss: 1.0669, test_f1: 0.6116
 epoch: 52, train_loss: 0.6573, test_loss: 1.1221, test_f1: 0.6178
 epoch: 53, train_loss: 0.6656, test_loss: 1.3152, test_f1: 0.5956
 epoch: 54, train_loss: 0.6452, test_loss: 1.4011, test_f1: 0.5793
 epoch: 55, train_loss: 0.6646, test_loss: 1.1089, test_f1: 0.5739
 epoch: 56, train_loss: 0.6420, test_loss: 1.3342, test_f1: 0.6178
 epoch: 57, train_loss: 0.6309, test_loss: 1.5453, test_f1: 0.6048
 epoch: 58, train_loss: 0.6225, test_loss: 1.2313, test_f1: 0.6038
 epoch: 59, train_loss: 0.6605, test_loss: 1.2021, test_f1: 0.6143
 epoch: 60, train_loss: 0.6458, test_loss: 1.0241, test_f1: 0.6290
 epoch: 61, train_loss: 0.6397, test_loss: 1.1528, test_f1: 0.6386
 epoch: 62, train_loss: 0.6115, test_loss: 1.1324, test_f1: 0.6037
 epoch: 63, train_loss: 0.6165, test_loss: 1.2672, test_f1: 0.5832
 epoch: 64, train_loss: 0.6384, test_loss: 1.2099, test_f1: 0.6242
 epoch: 65, train_loss: 0.6251, test_loss: 1.3450, test_f1: 0.6015
 epoch: 66, train_loss: 0.6099, test_loss: 1.1355, test_f1: 0.6447
 epoch: 67, train_loss: 0.6025, test_loss: 1.3745, test_f1: 0.6083
 epoch: 68, train_loss: 0.6224, test_loss: 1.3130, test_f1: 0.6125
 epoch: 69, train_loss: 0.6130, test_loss: 1.2376, test_f1: 0.5941
 epoch: 70, train_loss: 0.5946, test_loss: 1.2558, test_f1: 0.6407
 epoch: 71, train_loss: 0.5993, test_loss: 1.4108, test_f1: 0.6446
 epoch: 72, train_loss: 0.6004, test_loss: 1.6128, test_f1: 0.5577
 epoch: 73, train_loss: 0.6304, test_loss: 1.2283, test_f1: 0.6258
 epoch: 74, train_loss: 0.5848, test_loss: 1.3755, test_f1: 0.5955
 epoch: 75, train_loss: 0.6305, test_loss: 1.1860, test_f1: 0.6215
 epoch: 76, train_loss: 0.5996, test_loss: 1.1946, test_f1: 0.6187
 epoch: 77, train_loss: 0.5841, test_loss: 1.2634, test_f1: 0.6080
 epoch: 78, train_loss: 0.5812, test_loss: 1.2250, test_f1: 0.6310
 epoch: 79, train_loss: 0.5828, test_loss: 1.4226, test_f1: 0.6396
 epoch: 80, train_loss: 0.5906, test_loss: 1.2330, test_f1: 0.6417
 epoch: 81, train_loss: 0.5968, test_loss: 1.3667, test_f1: 0.6440
 epoch: 82, train_loss: 0.6022, test_loss: 1.2260, test_f1: 0.6115
 epoch: 83, train_loss: 0.5899, test_loss: 1.2682, test_f1: 0.6236
 epoch: 84, train_loss: 0.5836, test_loss: 1.4041, test_f1: 0.5976
 epoch: 85, train_loss: 0.5681, test_loss: 1.2442, test_f1: 0.6520
 epoch: 86, train_loss: 0.5574, test_loss: 1.3833, test_f1: 0.6130
 epoch: 87, train_loss: 0.5913, test_loss: 1.3460, test_f1: 0.6255
 epoch: 88, train_loss: 0.5586, test_loss: 1.4033, test_f1: 0.6104
 epoch: 89, train_loss: 0.5516, test_loss: 1.4648, test_f1: 0.6136
 epoch: 90, train_loss: 0.5747, test_loss: 1.3224, test_f1: 0.6530
 epoch: 91, train_loss: 0.5544, test_loss: 1.4095, test_f1: 0.6417
 epoch: 92, train_loss: 0.5617, test_loss: 1.2428, test_f1: 0.6711
 epoch: 93, train_loss: 0.5654, test_loss: 1.2554, test_f1: 0.6383
 epoch: 94, train_loss: 0.5513, test_loss: 1.5630, test_f1: 0.6222
 epoch: 95, train_loss: 0.5541, test_loss: 1.2715, test_f1: 0.6022
 epoch: 96, train_loss: 0.5435, test_loss: 1.5674, test_f1: 0.6205
 epoch: 97, train_loss: 0.5388, test_loss: 1.3005, test_f1: 0.5810
 epoch: 98, train_loss: 0.5550, test_loss: 1.2842, test_f1: 0.6119
 epoch: 99, train_loss: 0.5464, test_loss: 1.3842, test_f1: 0.6321
##################ITERATION #2 ****************************************
 epoch: 0, train_loss: 1.1305, test_loss: 1.1679, test_f1: 0.4029
 epoch: 1, train_loss: 0.9975, test_loss: 1.1133, test_f1: 0.5025
 epoch: 2, train_loss: 0.9577, test_loss: 1.2595, test_f1: 0.4288
 epoch: 3, train_loss: 0.9424, test_loss: 1.0183, test_f1: 0.5128
 epoch: 4, train_loss: 0.9094, test_loss: 0.9981, test_f1: 0.4882
 epoch: 5, train_loss: 0.9011, test_loss: 1.1376, test_f1: 0.4672
 epoch: 6, train_loss: 0.8782, test_loss: 0.9590, test_f1: 0.5906
 epoch: 7, train_loss: 0.8531, test_loss: 1.0740, test_f1: 0.4894
 epoch: 8, train_loss: 0.8312, test_loss: 1.2156, test_f1: 0.5657
 epoch: 9, train_loss: 0.8389, test_loss: 1.0897, test_f1: 0.5481
 epoch: 10, train_loss: 0.8142, test_loss: 1.0621, test_f1: 0.5180
 epoch: 11, train_loss: 0.8215, test_loss: 1.1909, test_f1: 0.5685
 epoch: 12, train_loss: 0.8217, test_loss: 1.3301, test_f1: 0.5856
 epoch: 13, train_loss: 0.7955, test_loss: 1.1306, test_f1: 0.4901
 epoch: 14, train_loss: 0.8138, test_loss: 1.0617, test_f1: 0.4593
 epoch: 15, train_loss: 0.8102, test_loss: 1.1263, test_f1: 0.5213
 epoch: 16, train_loss: 0.7914, test_loss: 1.1625, test_f1: 0.5008
 epoch: 17, train_loss: 0.8083, test_loss: 1.0463, test_f1: 0.5633
 epoch: 18, train_loss: 0.7719, test_loss: 1.1002, test_f1: 0.5760
 epoch: 19, train_loss: 0.7514, test_loss: 0.9927, test_f1: 0.5748
 epoch: 20, train_loss: 0.7426, test_loss: 1.0937, test_f1: 0.5910
 epoch: 21, train_loss: 0.8107, test_loss: 0.9971, test_f1: 0.6177
 epoch: 22, train_loss: 0.7693, test_loss: 1.0686, test_f1: 0.5742
 epoch: 23, train_loss: 0.7547, test_loss: 0.9873, test_f1: 0.5998
 epoch: 24, train_loss: 0.7432, test_loss: 1.1356, test_f1: 0.6035
 epoch: 25, train_loss: 0.7355, test_loss: 1.1211, test_f1: 0.5724
 epoch: 26, train_loss: 0.7452, test_loss: 1.0566, test_f1: 0.6136
 epoch: 27, train_loss: 0.7513, test_loss: 1.1774, test_f1: 0.5251
 epoch: 28, train_loss: 0.7229, test_loss: 1.2654, test_f1: 0.4908
 epoch: 29, train_loss: 0.7201, test_loss: 1.2913, test_f1: 0.5904
 epoch: 30, train_loss: 0.7223, test_loss: 1.0826, test_f1: 0.5480
 epoch: 31, train_loss: 0.7352, test_loss: 1.1577, test_f1: 0.4936
 epoch: 32, train_loss: 0.7235, test_loss: 1.1527, test_f1: 0.6077
 epoch: 33, train_loss: 0.7091, test_loss: 1.1351, test_f1: 0.5904
 epoch: 34, train_loss: 0.7450, test_loss: 1.0043, test_f1: 0.6046
 epoch: 35, train_loss: 0.7331, test_loss: 1.4416, test_f1: 0.5883
 epoch: 36, train_loss: 0.7282, test_loss: 1.0478, test_f1: 0.6196
 epoch: 37, train_loss: 0.7163, test_loss: 1.0945, test_f1: 0.5882
 epoch: 38, train_loss: 0.7107, test_loss: 1.1151, test_f1: 0.5975
 epoch: 39, train_loss: 0.6924, test_loss: 1.1441, test_f1: 0.6103
 epoch: 40, train_loss: 0.6809, test_loss: 1.4083, test_f1: 0.5879
 epoch: 41, train_loss: 0.6848, test_loss: 1.2797, test_f1: 0.6149
 epoch: 42, train_loss: 0.6997, test_loss: 1.1067, test_f1: 0.6350
 epoch: 43, train_loss: 0.6868, test_loss: 1.1061, test_f1: 0.5781
 epoch: 44, train_loss: 0.6745, test_loss: 1.1018, test_f1: 0.5950
 epoch: 45, train_loss: 0.6738, test_loss: 1.1651, test_f1: 0.6061
 epoch: 46, train_loss: 0.6865, test_loss: 1.1045, test_f1: 0.5758
 epoch: 47, train_loss: 0.6386, test_loss: 1.5299, test_f1: 0.5245
 epoch: 48, train_loss: 0.6762, test_loss: 1.1315, test_f1: 0.5989
 epoch: 49, train_loss: 0.6657, test_loss: 1.0453, test_f1: 0.6281
 epoch: 50, train_loss: 0.6588, test_loss: 1.0999, test_f1: 0.5999
 epoch: 51, train_loss: 0.6349, test_loss: 1.1876, test_f1: 0.6416
 epoch: 52, train_loss: 0.6321, test_loss: 1.1871, test_f1: 0.6684
 epoch: 53, train_loss: 0.6106, test_loss: 1.0949, test_f1: 0.6783
 epoch: 54, train_loss: 0.6067, test_loss: 1.1943, test_f1: 0.6786
 epoch: 55, train_loss: 0.5815, test_loss: 1.1317, test_f1: 0.6496
 epoch: 56, train_loss: 0.5907, test_loss: 1.2370, test_f1: 0.6516
 epoch: 57, train_loss: 0.5676, test_loss: 1.2338, test_f1: 0.6377
 epoch: 58, train_loss: 0.5764, test_loss: 1.2768, test_f1: 0.6425
 epoch: 59, train_loss: 0.5528, test_loss: 1.3363, test_f1: 0.6468
 epoch: 60, train_loss: 0.5624, test_loss: 1.3255, test_f1: 0.6357
 epoch: 61, train_loss: 0.5788, test_loss: 1.2316, test_f1: 0.6880
 epoch: 62, train_loss: 0.5727, test_loss: 1.3492, test_f1: 0.6210
 epoch: 63, train_loss: 0.5555, test_loss: 1.2365, test_f1: 0.6182
 epoch: 64, train_loss: 0.5465, test_loss: 1.3897, test_f1: 0.6492
 epoch: 65, train_loss: 0.5682, test_loss: 1.5016, test_f1: 0.6235
 epoch: 66, train_loss: 0.5575, test_loss: 1.2791, test_f1: 0.6019
 epoch: 67, train_loss: 0.5487, test_loss: 1.5541, test_f1: 0.5536
 epoch: 68, train_loss: 0.5438, test_loss: 1.3147, test_f1: 0.5872
 epoch: 69, train_loss: 0.5461, test_loss: 1.3011, test_f1: 0.6357
 epoch: 70, train_loss: 0.5059, test_loss: 1.6693, test_f1: 0.6000
 epoch: 71, train_loss: 0.5398, test_loss: 1.3265, test_f1: 0.6692
 epoch: 72, train_loss: 0.5335, test_loss: 1.3767, test_f1: 0.6574
 epoch: 73, train_loss: 0.5248, test_loss: 1.4519, test_f1: 0.6161
 epoch: 74, train_loss: 0.5463, test_loss: 1.5895, test_f1: 0.6147
 epoch: 75, train_loss: 0.5225, test_loss: 1.6217, test_f1: 0.5721
 epoch: 76, train_loss: 0.4950, test_loss: 1.5053, test_f1: 0.6567
 epoch: 77, train_loss: 0.5225, test_loss: 1.7424, test_f1: 0.6046
 epoch: 78, train_loss: 0.5162, test_loss: 1.5408, test_f1: 0.6246
 epoch: 79, train_loss: 0.5210, test_loss: 1.4742, test_f1: 0.6007
 epoch: 80, train_loss: 0.4916, test_loss: 1.7621, test_f1: 0.5780
 epoch: 81, train_loss: 0.5138, test_loss: 1.5979, test_f1: 0.6078
 epoch: 82, train_loss: 0.5059, test_loss: 1.5962, test_f1: 0.6081
 epoch: 83, train_loss: 0.4808, test_loss: 1.5063, test_f1: 0.6265
 epoch: 84, train_loss: 0.4779, test_loss: 1.5510, test_f1: 0.6239
 epoch: 85, train_loss: 0.5080, test_loss: 1.6269, test_f1: 0.6136
 epoch: 86, train_loss: 0.4893, test_loss: 1.7175, test_f1: 0.6484
 epoch: 87, train_loss: 0.4591, test_loss: 1.5465, test_f1: 0.6690
 epoch: 88, train_loss: 0.4863, test_loss: 1.7639, test_f1: 0.5714
 epoch: 89, train_loss: 0.4712, test_loss: 1.8751, test_f1: 0.6435
 epoch: 90, train_loss: 0.4966, test_loss: 1.5420, test_f1: 0.5971
 epoch: 91, train_loss: 0.5023, test_loss: 1.4152, test_f1: 0.6553
 epoch: 92, train_loss: 0.4998, test_loss: 1.6619, test_f1: 0.6687
 epoch: 93, train_loss: 0.4708, test_loss: 1.6173, test_f1: 0.6779
 epoch: 94, train_loss: 0.4698, test_loss: 1.6176, test_f1: 0.6528
 epoch: 95, train_loss: 0.4830, test_loss: 1.6065, test_f1: 0.5944
 epoch: 96, train_loss: 0.4789, test_loss: 1.6095, test_f1: 0.6255
 epoch: 97, train_loss: 0.4864, test_loss: 1.5217, test_f1: 0.6502
 epoch: 98, train_loss: 0.4399, test_loss: 1.6843, test_f1: 0.6690
 epoch: 99, train_loss: 0.4406, test_loss: 1.9971, test_f1: 0.6296
##################ITERATION #3 ****************************************
 epoch: 0, train_loss: 1.2059, test_loss: 1.2046, test_f1: 0.4065
 epoch: 1, train_loss: 1.0438, test_loss: 1.1687, test_f1: 0.3801
 epoch: 2, train_loss: 0.9811, test_loss: 1.3176, test_f1: 0.4224
 epoch: 3, train_loss: 0.9420, test_loss: 4.6765, test_f1: 0.2213
 epoch: 4, train_loss: 0.8873, test_loss: 1.0253, test_f1: 0.5549
 epoch: 5, train_loss: 0.8548, test_loss: 1.0377, test_f1: 0.5162
 epoch: 6, train_loss: 0.8801, test_loss: 0.9901, test_f1: 0.5514
 epoch: 7, train_loss: 0.8461, test_loss: 1.0052, test_f1: 0.5667
 epoch: 8, train_loss: 0.8418, test_loss: 0.9644, test_f1: 0.5491
 epoch: 9, train_loss: 0.8371, test_loss: 0.9409, test_f1: 0.5343
 epoch: 10, train_loss: 0.8453, test_loss: 1.0373, test_f1: 0.5472
 epoch: 11, train_loss: 0.8397, test_loss: 0.9394, test_f1: 0.5295
 epoch: 12, train_loss: 0.8142, test_loss: 0.9921, test_f1: 0.5936
 epoch: 13, train_loss: 0.8317, test_loss: 2.1167, test_f1: 0.3062
 epoch: 14, train_loss: 0.8436, test_loss: 0.9595, test_f1: 0.6048
 epoch: 15, train_loss: 0.8150, test_loss: 1.0314, test_f1: 0.5438
 epoch: 16, train_loss: 0.7993, test_loss: 1.0746, test_f1: 0.5388
 epoch: 17, train_loss: 0.8227, test_loss: 1.0748, test_f1: 0.5076
 epoch: 18, train_loss: 0.8024, test_loss: 1.1115, test_f1: 0.5096
 epoch: 19, train_loss: 0.7927, test_loss: 1.6565, test_f1: 0.3886
 epoch: 20, train_loss: 0.8052, test_loss: 0.9869, test_f1: 0.5804
 epoch: 21, train_loss: 0.8107, test_loss: 1.0483, test_f1: 0.5423
 epoch: 22, train_loss: 0.8265, test_loss: 1.0234, test_f1: 0.5563
 epoch: 23, train_loss: 0.7944, test_loss: 1.1743, test_f1: 0.4652
 epoch: 24, train_loss: 0.7847, test_loss: 1.0747, test_f1: 0.5272
 epoch: 25, train_loss: 0.8245, test_loss: 1.1848, test_f1: 0.4958
 epoch: 26, train_loss: 0.7897, test_loss: 1.1409, test_f1: 0.5525
 epoch: 27, train_loss: 0.7848, test_loss: 1.4489, test_f1: 0.3939
 epoch: 28, train_loss: 0.8452, test_loss: 1.2210, test_f1: 0.5065
 epoch: 29, train_loss: 0.8102, test_loss: 1.0746, test_f1: 0.5413
 epoch: 30, train_loss: 0.7933, test_loss: 0.9786, test_f1: 0.5712
 epoch: 31, train_loss: 0.7848, test_loss: 0.9581, test_f1: 0.5996
 epoch: 32, train_loss: 0.7792, test_loss: 1.2196, test_f1: 0.5222
 epoch: 33, train_loss: 0.7712, test_loss: 0.9983, test_f1: 0.5548
 epoch: 34, train_loss: 0.7883, test_loss: 0.9767, test_f1: 0.5911
 epoch: 35, train_loss: 0.7612, test_loss: 0.9489, test_f1: 0.5991
 epoch: 36, train_loss: 0.7613, test_loss: 1.0849, test_f1: 0.5628
 epoch: 37, train_loss: 0.7830, test_loss: 1.0349, test_f1: 0.5518
 epoch: 38, train_loss: 0.7506, test_loss: 0.9950, test_f1: 0.5762
 epoch: 39, train_loss: 0.7503, test_loss: 2.2071, test_f1: 0.3561
 epoch: 40, train_loss: 0.7542, test_loss: 0.9616, test_f1: 0.5995
 epoch: 41, train_loss: 0.7589, test_loss: 0.9832, test_f1: 0.5645
 epoch: 42, train_loss: 0.7581, test_loss: 0.9860, test_f1: 0.5957
 epoch: 43, train_loss: 0.7308, test_loss: 1.0579, test_f1: 0.5870
 epoch: 44, train_loss: 0.7464, test_loss: 0.9614, test_f1: 0.4866
 epoch: 45, train_loss: 0.7629, test_loss: 1.2223, test_f1: 0.5005
 epoch: 46, train_loss: 0.7468, test_loss: 0.9882, test_f1: 0.5093
 epoch: 47, train_loss: 0.7414, test_loss: 1.1699, test_f1: 0.4878
 epoch: 48, train_loss: 0.7104, test_loss: 1.1303, test_f1: 0.5351
 epoch: 49, train_loss: 0.7178, test_loss: 1.0557, test_f1: 0.5129
 epoch: 50, train_loss: 0.7416, test_loss: 1.3150, test_f1: 0.4802
 epoch: 51, train_loss: 0.7324, test_loss: 1.1826, test_f1: 0.5214
 epoch: 52, train_loss: 0.7010, test_loss: 0.9834, test_f1: 0.6106
 epoch: 53, train_loss: 0.6979, test_loss: 1.0420, test_f1: 0.5879
 epoch: 54, train_loss: 0.6945, test_loss: 1.1065, test_f1: 0.5581
 epoch: 55, train_loss: 0.7043, test_loss: 1.1261, test_f1: 0.5820
 epoch: 56, train_loss: 0.6805, test_loss: 1.0715, test_f1: 0.6295
 epoch: 57, train_loss: 0.6978, test_loss: 1.0482, test_f1: 0.5803
 epoch: 58, train_loss: 0.7018, test_loss: 1.0876, test_f1: 0.5428
 epoch: 59, train_loss: 0.6682, test_loss: 1.3715, test_f1: 0.5315
 epoch: 60, train_loss: 0.6784, test_loss: 1.0605, test_f1: 0.5736
 epoch: 61, train_loss: 0.6651, test_loss: 1.1309, test_f1: 0.5915
 epoch: 62, train_loss: 0.6984, test_loss: 1.6809, test_f1: 0.5426
 epoch: 63, train_loss: 0.6691, test_loss: 1.0658, test_f1: 0.5750
 epoch: 64, train_loss: 0.6649, test_loss: 0.9936, test_f1: 0.6284
 epoch: 65, train_loss: 0.6584, test_loss: 1.1746, test_f1: 0.5812
 epoch: 66, train_loss: 0.6540, test_loss: 1.2591, test_f1: 0.5851
 epoch: 67, train_loss: 0.6410, test_loss: 2.8437, test_f1: 0.5426
 epoch: 68, train_loss: 0.6741, test_loss: 1.2581, test_f1: 0.5491
 epoch: 69, train_loss: 0.6426, test_loss: 1.1536, test_f1: 0.5556
 epoch: 70, train_loss: 0.6530, test_loss: 1.1119, test_f1: 0.5781
 epoch: 71, train_loss: 0.6653, test_loss: 1.1470, test_f1: 0.5515
 epoch: 72, train_loss: 0.6369, test_loss: 1.1626, test_f1: 0.5276
 epoch: 73, train_loss: 0.6505, test_loss: 1.2938, test_f1: 0.5558
 epoch: 74, train_loss: 0.6401, test_loss: 1.1795, test_f1: 0.5616
 epoch: 75, train_loss: 0.6476, test_loss: 1.2188, test_f1: 0.5243
 epoch: 76, train_loss: 0.6456, test_loss: 1.2195, test_f1: 0.5515
 epoch: 77, train_loss: 0.6494, test_loss: 1.1405, test_f1: 0.5980
 epoch: 78, train_loss: 0.6374, test_loss: 1.1395, test_f1: 0.5485
 epoch: 79, train_loss: 0.6535, test_loss: 1.4164, test_f1: 0.5377
 epoch: 80, train_loss: 0.6347, test_loss: 1.2823, test_f1: 0.5029
 epoch: 81, train_loss: 0.6504, test_loss: 1.2500, test_f1: 0.6498
 epoch: 82, train_loss: 0.6431, test_loss: 1.2564, test_f1: 0.5744
 epoch: 83, train_loss: 0.6253, test_loss: 1.1878, test_f1: 0.5803
 epoch: 84, train_loss: 0.6232, test_loss: 1.2493, test_f1: 0.5726
 epoch: 85, train_loss: 0.6465, test_loss: 1.1888, test_f1: 0.5271
 epoch: 86, train_loss: 0.6420, test_loss: 1.3858, test_f1: 0.5415
 epoch: 87, train_loss: 0.6410, test_loss: 1.5683, test_f1: 0.5342
 epoch: 88, train_loss: 0.6288, test_loss: 1.8336, test_f1: 0.5406
 epoch: 89, train_loss: 0.6172, test_loss: 1.2571, test_f1: 0.5118
 epoch: 90, train_loss: 0.6069, test_loss: 1.5215, test_f1: 0.5256
 epoch: 91, train_loss: 0.6380, test_loss: 1.2854, test_f1: 0.5392
 epoch: 92, train_loss: 0.6035, test_loss: 1.4712, test_f1: 0.5257
 epoch: 93, train_loss: 0.6269, test_loss: 1.4854, test_f1: 0.5221
 epoch: 94, train_loss: 0.6256, test_loss: 1.1905, test_f1: 0.5838
 epoch: 95, train_loss: 0.6230, test_loss: 1.5332, test_f1: 0.6036
 epoch: 96, train_loss: 0.6347, test_loss: 1.1594, test_f1: 0.5704
 epoch: 97, train_loss: 0.6222, test_loss: 1.2048, test_f1: 0.5185
 epoch: 98, train_loss: 0.6391, test_loss: 1.3617, test_f1: 0.5425
 epoch: 99, train_loss: 0.6162, test_loss: 1.0388, test_f1: 0.5878
##################ITERATION #4 ****************************************
 epoch: 0, train_loss: 1.1553, test_loss: 1.1981, test_f1: 0.3365
 epoch: 1, train_loss: 0.9573, test_loss: 0.9642, test_f1: 0.5547
 epoch: 2, train_loss: 0.9261, test_loss: 1.2358, test_f1: 0.4722
 epoch: 3, train_loss: 0.8525, test_loss: 1.0368, test_f1: 0.5391
 epoch: 4, train_loss: 0.8805, test_loss: 2.9524, test_f1: 0.3144
 epoch: 5, train_loss: 0.8362, test_loss: 1.0273, test_f1: 0.4705
 epoch: 6, train_loss: 0.8443, test_loss: 1.0053, test_f1: 0.5595
 epoch: 7, train_loss: 0.8202, test_loss: 1.0804, test_f1: 0.4568
 epoch: 8, train_loss: 0.8153, test_loss: 0.9880, test_f1: 0.5744
 epoch: 9, train_loss: 0.8118, test_loss: 1.1130, test_f1: 0.5211
 epoch: 10, train_loss: 0.8182, test_loss: 1.0435, test_f1: 0.5545
 epoch: 11, train_loss: 0.7922, test_loss: 1.0139, test_f1: 0.5504
 epoch: 12, train_loss: 0.7764, test_loss: 0.9411, test_f1: 0.5896
 epoch: 13, train_loss: 0.7765, test_loss: 0.9462, test_f1: 0.5966
 epoch: 14, train_loss: 0.8087, test_loss: 1.0534, test_f1: 0.5554
 epoch: 15, train_loss: 0.7721, test_loss: 0.9716, test_f1: 0.6115
 epoch: 16, train_loss: 0.7760, test_loss: 0.9897, test_f1: 0.5882
 epoch: 17, train_loss: 0.7731, test_loss: 2.2793, test_f1: 0.3601
 epoch: 18, train_loss: 0.7787, test_loss: 0.9646, test_f1: 0.5257
 epoch: 19, train_loss: 0.7745, test_loss: 1.1657, test_f1: 0.5004
 epoch: 20, train_loss: 0.7668, test_loss: 0.9227, test_f1: 0.5867
 epoch: 21, train_loss: 0.7578, test_loss: 1.1436, test_f1: 0.5376
 epoch: 22, train_loss: 0.7807, test_loss: 0.9592, test_f1: 0.5911
 epoch: 23, train_loss: 0.7701, test_loss: 1.2121, test_f1: 0.5746
 epoch: 24, train_loss: 0.7575, test_loss: 1.0308, test_f1: 0.5713
 epoch: 25, train_loss: 0.7377, test_loss: 1.1865, test_f1: 0.5978
 epoch: 26, train_loss: 0.7573, test_loss: 1.1955, test_f1: 0.4212
 epoch: 27, train_loss: 0.7433, test_loss: 0.9920, test_f1: 0.5930
 epoch: 28, train_loss: 0.7154, test_loss: 1.0521, test_f1: 0.6122
 epoch: 29, train_loss: 0.7358, test_loss: 0.9705, test_f1: 0.5160
 epoch: 30, train_loss: 0.7278, test_loss: 0.9863, test_f1: 0.6349
 epoch: 31, train_loss: 0.7253, test_loss: 1.0712, test_f1: 0.5479
 epoch: 32, train_loss: 0.7190, test_loss: 1.0674, test_f1: 0.5745
 epoch: 33, train_loss: 0.7190, test_loss: 1.0417, test_f1: 0.5924
 epoch: 34, train_loss: 0.7178, test_loss: 1.1149, test_f1: 0.5476
 epoch: 35, train_loss: 0.6985, test_loss: 1.0422, test_f1: 0.5629
 epoch: 36, train_loss: 0.7161, test_loss: 1.0268, test_f1: 0.5800
 epoch: 37, train_loss: 0.6955, test_loss: 1.1649, test_f1: 0.5725
 epoch: 38, train_loss: 0.7211, test_loss: 1.3154, test_f1: 0.6228
 epoch: 39, train_loss: 0.7426, test_loss: 1.1343, test_f1: 0.5129
 epoch: 40, train_loss: 0.6884, test_loss: 1.0762, test_f1: 0.5638
 epoch: 41, train_loss: 0.7279, test_loss: 1.2430, test_f1: 0.5253
 epoch: 42, train_loss: 0.6842, test_loss: 1.1369, test_f1: 0.5882
 epoch: 43, train_loss: 0.6775, test_loss: 0.9963, test_f1: 0.6171
 epoch: 44, train_loss: 0.6786, test_loss: 1.0615, test_f1: 0.6018
 epoch: 45, train_loss: 0.6774, test_loss: 1.0603, test_f1: 0.6169
 epoch: 46, train_loss: 0.6910, test_loss: 1.0502, test_f1: 0.5779
 epoch: 47, train_loss: 0.6826, test_loss: 1.1407, test_f1: 0.5872
 epoch: 48, train_loss: 0.6942, test_loss: 1.0639, test_f1: 0.6027
 epoch: 49, train_loss: 0.6895, test_loss: 1.0881, test_f1: 0.6182
 epoch: 50, train_loss: 0.6603, test_loss: 1.0060, test_f1: 0.6222
 epoch: 51, train_loss: 0.6533, test_loss: 1.0516, test_f1: 0.5774
 epoch: 52, train_loss: 0.6213, test_loss: 1.0796, test_f1: 0.6292
 epoch: 53, train_loss: 0.6118, test_loss: 1.2198, test_f1: 0.5981
 epoch: 54, train_loss: 0.6338, test_loss: 1.0664, test_f1: 0.6092
 epoch: 55, train_loss: 0.6299, test_loss: 1.0880, test_f1: 0.5973
 epoch: 56, train_loss: 0.6401, test_loss: 1.4109, test_f1: 0.5719
 epoch: 57, train_loss: 0.6075, test_loss: 1.2111, test_f1: 0.6609
 epoch: 58, train_loss: 0.6126, test_loss: 1.1181, test_f1: 0.6285
 epoch: 59, train_loss: 0.6114, test_loss: 1.1658, test_f1: 0.5883
 epoch: 60, train_loss: 0.6219, test_loss: 1.0648, test_f1: 0.6198
 epoch: 61, train_loss: 0.6056, test_loss: 1.1728, test_f1: 0.6332
 epoch: 62, train_loss: 0.6090, test_loss: 1.2117, test_f1: 0.6130
 epoch: 63, train_loss: 0.6023, test_loss: 1.1315, test_f1: 0.6150
 epoch: 64, train_loss: 0.5968, test_loss: 1.1517, test_f1: 0.6337
 epoch: 65, train_loss: 0.5873, test_loss: 1.3319, test_f1: 0.6085
 epoch: 66, train_loss: 0.6140, test_loss: 1.1207, test_f1: 0.6060
 epoch: 67, train_loss: 0.6229, test_loss: 1.1379, test_f1: 0.6449
 epoch: 68, train_loss: 0.5853, test_loss: 1.2242, test_f1: 0.6177
 epoch: 69, train_loss: 0.5938, test_loss: 1.2378, test_f1: 0.5940
 epoch: 70, train_loss: 0.5771, test_loss: 1.1448, test_f1: 0.5818
 epoch: 71, train_loss: 0.5909, test_loss: 1.1924, test_f1: 0.6300
 epoch: 72, train_loss: 0.5618, test_loss: 1.4344, test_f1: 0.6098
 epoch: 73, train_loss: 0.6018, test_loss: 1.2712, test_f1: 0.6101
 epoch: 74, train_loss: 0.5830, test_loss: 1.3034, test_f1: 0.6373
 epoch: 75, train_loss: 0.5740, test_loss: 1.3972, test_f1: 0.5989
 epoch: 76, train_loss: 0.5685, test_loss: 1.3139, test_f1: 0.6139
 epoch: 77, train_loss: 0.5714, test_loss: 1.1228, test_f1: 0.6235
 epoch: 78, train_loss: 0.5666, test_loss: 1.3939, test_f1: 0.6405
 epoch: 79, train_loss: 0.5665, test_loss: 1.3016, test_f1: 0.5745
 epoch: 80, train_loss: 0.5705, test_loss: 1.1768, test_f1: 0.5788
 epoch: 81, train_loss: 0.5783, test_loss: 1.4033, test_f1: 0.6127
 epoch: 82, train_loss: 0.5872, test_loss: 1.4279, test_f1: 0.5536
 epoch: 83, train_loss: 0.5527, test_loss: 1.1141, test_f1: 0.6269
 epoch: 84, train_loss: 0.5575, test_loss: 1.2571, test_f1: 0.6180
 epoch: 85, train_loss: 0.5814, test_loss: 1.1033, test_f1: 0.6094
 epoch: 86, train_loss: 0.5531, test_loss: 1.2531, test_f1: 0.5867
 epoch: 87, train_loss: 0.5552, test_loss: 1.3489, test_f1: 0.5742
 epoch: 88, train_loss: 0.5458, test_loss: 1.2612, test_f1: 0.5962
 epoch: 89, train_loss: 0.5623, test_loss: 1.3504, test_f1: 0.6238
 epoch: 90, train_loss: 0.5644, test_loss: 1.2497, test_f1: 0.6230
 epoch: 91, train_loss: 0.5299, test_loss: 1.5559, test_f1: 0.5902
 epoch: 92, train_loss: 0.5393, test_loss: 1.3156, test_f1: 0.6232
 epoch: 93, train_loss: 0.5599, test_loss: 1.3971, test_f1: 0.6053
 epoch: 94, train_loss: 0.5391, test_loss: 1.3895, test_f1: 0.5754
 epoch: 95, train_loss: 0.5547, test_loss: 1.4671, test_f1: 0.5943
 epoch: 96, train_loss: 0.5684, test_loss: 1.5644, test_f1: 0.5411
 epoch: 97, train_loss: 0.5444, test_loss: 1.3322, test_f1: 0.6102
 epoch: 98, train_loss: 0.5613, test_loss: 1.6130, test_f1: 0.5395
 epoch: 99, train_loss: 0.5739, test_loss: 1.2455, test_f1: 0.5738
##################ITERATION #5 ****************************************
 epoch: 0, train_loss: 1.1741, test_loss: 1.1365, test_f1: 0.3491
 epoch: 1, train_loss: 0.9936, test_loss: 1.0302, test_f1: 0.5007
 epoch: 2, train_loss: 0.9307, test_loss: 1.1090, test_f1: 0.4101
 epoch: 3, train_loss: 0.9447, test_loss: 0.9889, test_f1: 0.5641
 epoch: 4, train_loss: 0.8830, test_loss: 1.0607, test_f1: 0.5052
 epoch: 5, train_loss: 0.8568, test_loss: 1.1099, test_f1: 0.4848
 epoch: 6, train_loss: 0.8522, test_loss: 1.1212, test_f1: 0.5989
 epoch: 7, train_loss: 0.8436, test_loss: 1.0549, test_f1: 0.4751
 epoch: 8, train_loss: 0.8436, test_loss: 1.0282, test_f1: 0.5736
 epoch: 9, train_loss: 0.8346, test_loss: 1.0612, test_f1: 0.5735
 epoch: 10, train_loss: 0.8345, test_loss: 1.0361, test_f1: 0.5515
 epoch: 11, train_loss: 0.8336, test_loss: 0.9717, test_f1: 0.5794
 epoch: 12, train_loss: 0.8320, test_loss: 1.1423, test_f1: 0.5077
 epoch: 13, train_loss: 0.8199, test_loss: 1.0041, test_f1: 0.5781
 epoch: 14, train_loss: 0.7952, test_loss: 1.0171, test_f1: 0.5703
 epoch: 15, train_loss: 0.7784, test_loss: 1.0549, test_f1: 0.5448
 epoch: 16, train_loss: 0.7926, test_loss: 1.0254, test_f1: 0.5811
 epoch: 17, train_loss: 0.7954, test_loss: 0.9694, test_f1: 0.5966
 epoch: 18, train_loss: 0.7922, test_loss: 1.1677, test_f1: 0.5440
 epoch: 19, train_loss: 0.7664, test_loss: 1.0009, test_f1: 0.6085
 epoch: 20, train_loss: 0.7639, test_loss: 0.9471, test_f1: 0.6263
 epoch: 21, train_loss: 0.7618, test_loss: 1.0250, test_f1: 0.5861
 epoch: 22, train_loss: 0.7509, test_loss: 1.0259, test_f1: 0.5723
 epoch: 23, train_loss: 0.7688, test_loss: 1.0431, test_f1: 0.5987
 epoch: 24, train_loss: 0.7679, test_loss: 0.9596, test_f1: 0.6022
 epoch: 25, train_loss: 0.7722, test_loss: 1.2382, test_f1: 0.5377
 epoch: 26, train_loss: 0.7559, test_loss: 1.0041, test_f1: 0.6086
 epoch: 27, train_loss: 0.7565, test_loss: 0.9538, test_f1: 0.5878
 epoch: 28, train_loss: 0.8005, test_loss: 1.0361, test_f1: 0.4368
 epoch: 29, train_loss: 0.7837, test_loss: 1.0227, test_f1: 0.5805
 epoch: 30, train_loss: 0.7664, test_loss: 1.0909, test_f1: 0.5502
 epoch: 31, train_loss: 0.7556, test_loss: 1.0058, test_f1: 0.5608
 epoch: 32, train_loss: 0.7407, test_loss: 1.0060, test_f1: 0.5630
 epoch: 33, train_loss: 0.7417, test_loss: 1.0570, test_f1: 0.5895
 epoch: 34, train_loss: 0.7686, test_loss: 0.9865, test_f1: 0.5613
 epoch: 35, train_loss: 0.7440, test_loss: 1.7621, test_f1: 0.4402
 epoch: 36, train_loss: 0.7428, test_loss: 1.1060, test_f1: 0.5155
 epoch: 37, train_loss: 0.7473, test_loss: 1.6018, test_f1: 0.3572
 epoch: 38, train_loss: 0.7589, test_loss: 1.0507, test_f1: 0.5732
 epoch: 39, train_loss: 0.7366, test_loss: 1.1074, test_f1: 0.5278
 epoch: 40, train_loss: 0.7485, test_loss: 1.0032, test_f1: 0.5853
 epoch: 41, train_loss: 0.7132, test_loss: 1.0476, test_f1: 0.5594
 epoch: 42, train_loss: 0.7230, test_loss: 1.0685, test_f1: 0.5667
 epoch: 43, train_loss: 0.7347, test_loss: 1.0321, test_f1: 0.5824
 epoch: 44, train_loss: 0.7259, test_loss: 1.0854, test_f1: 0.5592
 epoch: 45, train_loss: 0.7470, test_loss: 1.2229, test_f1: 0.5320
 epoch: 46, train_loss: 0.7358, test_loss: 1.0880, test_f1: 0.5934
 epoch: 47, train_loss: 0.7085, test_loss: 1.2714, test_f1: 0.5228
 epoch: 48, train_loss: 0.7381, test_loss: 0.9265, test_f1: 0.5919
 epoch: 49, train_loss: 0.7288, test_loss: 0.9911, test_f1: 0.5623
 epoch: 50, train_loss: 0.7174, test_loss: 1.2855, test_f1: 0.5185
 epoch: 51, train_loss: 0.6909, test_loss: 1.0186, test_f1: 0.5860
 epoch: 52, train_loss: 0.6863, test_loss: 1.3264, test_f1: 0.5466
 epoch: 53, train_loss: 0.6871, test_loss: 1.0875, test_f1: 0.5877
 epoch: 54, train_loss: 0.6732, test_loss: 1.1941, test_f1: 0.5919
 epoch: 55, train_loss: 0.6808, test_loss: 1.1682, test_f1: 0.5739
 epoch: 56, train_loss: 0.6685, test_loss: 1.2694, test_f1: 0.5524
 epoch: 57, train_loss: 0.6624, test_loss: 1.2476, test_f1: 0.5597
 epoch: 58, train_loss: 0.6623, test_loss: 1.1391, test_f1: 0.5915
 epoch: 59, train_loss: 0.6663, test_loss: 1.1359, test_f1: 0.6195
 epoch: 60, train_loss: 0.6499, test_loss: 1.2053, test_f1: 0.5935
 epoch: 61, train_loss: 0.6746, test_loss: 1.1265, test_f1: 0.6088
 epoch: 62, train_loss: 0.6605, test_loss: 1.2073, test_f1: 0.5960
 epoch: 63, train_loss: 0.6451, test_loss: 1.1200, test_f1: 0.6004
 epoch: 64, train_loss: 0.6362, test_loss: 1.2273, test_f1: 0.5866
 epoch: 65, train_loss: 0.6406, test_loss: 1.3162, test_f1: 0.5792
 epoch: 66, train_loss: 0.6278, test_loss: 1.1026, test_f1: 0.6089
 epoch: 67, train_loss: 0.6511, test_loss: 1.1865, test_f1: 0.6065
 epoch: 68, train_loss: 0.6437, test_loss: 1.2449, test_f1: 0.6018
 epoch: 69, train_loss: 0.6468, test_loss: 1.2373, test_f1: 0.5987
 epoch: 70, train_loss: 0.6164, test_loss: 1.4756, test_f1: 0.5762
 epoch: 71, train_loss: 0.6406, test_loss: 1.3518, test_f1: 0.5924
 epoch: 72, train_loss: 0.6238, test_loss: 1.6485, test_f1: 0.5552
 epoch: 73, train_loss: 0.6433, test_loss: 1.2355, test_f1: 0.5981
 epoch: 74, train_loss: 0.6220, test_loss: 1.4384, test_f1: 0.6135
 epoch: 75, train_loss: 0.6158, test_loss: 1.1873, test_f1: 0.6139
 epoch: 76, train_loss: 0.6071, test_loss: 1.4928, test_f1: 0.5845
 epoch: 77, train_loss: 0.6231, test_loss: 1.1221, test_f1: 0.6379
 epoch: 78, train_loss: 0.6132, test_loss: 1.1015, test_f1: 0.6447
 epoch: 79, train_loss: 0.6169, test_loss: 1.6387, test_f1: 0.5363
 epoch: 80, train_loss: 0.6054, test_loss: 1.2662, test_f1: 0.6109
 epoch: 81, train_loss: 0.6254, test_loss: 1.1994, test_f1: 0.5899
 epoch: 82, train_loss: 0.5974, test_loss: 1.3905, test_f1: 0.6000
 epoch: 83, train_loss: 0.6015, test_loss: 1.1720, test_f1: 0.6370
 epoch: 84, train_loss: 0.6044, test_loss: 1.2961, test_f1: 0.5759
 epoch: 85, train_loss: 0.5982, test_loss: 1.3853, test_f1: 0.6289
 epoch: 86, train_loss: 0.6312, test_loss: 1.2936, test_f1: 0.6087
 epoch: 87, train_loss: 0.5945, test_loss: 1.1930, test_f1: 0.6264
 epoch: 88, train_loss: 0.5980, test_loss: 1.4658, test_f1: 0.6299
 epoch: 89, train_loss: 0.5836, test_loss: 1.2171, test_f1: 0.5915
 epoch: 90, train_loss: 0.5844, test_loss: 1.5260, test_f1: 0.5651
 epoch: 91, train_loss: 0.5718, test_loss: 1.6885, test_f1: 0.5948
 epoch: 92, train_loss: 0.5854, test_loss: 1.2962, test_f1: 0.6122
 epoch: 93, train_loss: 0.5867, test_loss: 1.3200, test_f1: 0.5978
 epoch: 94, train_loss: 0.5850, test_loss: 1.3853, test_f1: 0.5899
 epoch: 95, train_loss: 0.5871, test_loss: 1.3385, test_f1: 0.5942
 epoch: 96, train_loss: 0.5842, test_loss: 1.7722, test_f1: 0.5320
 epoch: 97, train_loss: 0.5706, test_loss: 1.4978, test_f1: 0.6005
 epoch: 98, train_loss: 0.5738, test_loss: 1.5423, test_f1: 0.5741
 epoch: 99, train_loss: 0.5586, test_loss: 1.3176, test_f1: 0.5776
##################ITERATION #6 ****************************************
 epoch: 0, train_loss: 1.1820, test_loss: 1.2033, test_f1: 0.4771
 epoch: 1, train_loss: 0.9885, test_loss: 1.0033, test_f1: 0.5876
 epoch: 2, train_loss: 0.9230, test_loss: 0.9858, test_f1: 0.5698
 epoch: 3, train_loss: 0.9036, test_loss: 0.9770, test_f1: 0.5425
 epoch: 4, train_loss: 0.9125, test_loss: 1.0007, test_f1: 0.5112
 epoch: 5, train_loss: 0.8919, test_loss: 1.0233, test_f1: 0.4554
 epoch: 6, train_loss: 0.8522, test_loss: 0.9467, test_f1: 0.5916
 epoch: 7, train_loss: 0.8470, test_loss: 0.9748, test_f1: 0.5721
 epoch: 8, train_loss: 0.8751, test_loss: 0.9386, test_f1: 0.5960
 epoch: 9, train_loss: 0.8427, test_loss: 1.0482, test_f1: 0.5355
 epoch: 10, train_loss: 0.8430, test_loss: 0.9539, test_f1: 0.5710
 epoch: 11, train_loss: 0.8391, test_loss: 1.6283, test_f1: 0.3822
 epoch: 12, train_loss: 0.8197, test_loss: 0.9895, test_f1: 0.5051
 epoch: 13, train_loss: 0.8088, test_loss: 1.0279, test_f1: 0.5497
 epoch: 14, train_loss: 0.7848, test_loss: 1.4928, test_f1: 0.5408
 epoch: 15, train_loss: 0.7920, test_loss: 1.0904, test_f1: 0.5658
 epoch: 16, train_loss: 0.7876, test_loss: 1.1539, test_f1: 0.5518
 epoch: 17, train_loss: 0.8024, test_loss: 1.3166, test_f1: 0.5075
 epoch: 18, train_loss: 0.7921, test_loss: 1.0172, test_f1: 0.5596
 epoch: 19, train_loss: 0.8070, test_loss: 1.1654, test_f1: 0.5878
 epoch: 20, train_loss: 0.7662, test_loss: 0.9754, test_f1: 0.5770
 epoch: 21, train_loss: 0.7758, test_loss: 1.2339, test_f1: 0.5672
 epoch: 22, train_loss: 0.7853, test_loss: 1.1170, test_f1: 0.5591
 epoch: 23, train_loss: 0.7707, test_loss: 1.0360, test_f1: 0.5977
 epoch: 24, train_loss: 0.7763, test_loss: 1.0216, test_f1: 0.6040
 epoch: 25, train_loss: 0.7576, test_loss: 0.9700, test_f1: 0.6335
 epoch: 26, train_loss: 0.7634, test_loss: 1.1443, test_f1: 0.5367
 epoch: 27, train_loss: 0.7907, test_loss: 1.2271, test_f1: 0.5072
 epoch: 28, train_loss: 0.7648, test_loss: 1.0067, test_f1: 0.5980
 epoch: 29, train_loss: 0.7530, test_loss: 1.0614, test_f1: 0.6088
 epoch: 30, train_loss: 0.7441, test_loss: 1.0911, test_f1: 0.5419
 epoch: 31, train_loss: 0.7395, test_loss: 1.0155, test_f1: 0.6217
 epoch: 32, train_loss: 0.7709, test_loss: 1.0562, test_f1: 0.6160
 epoch: 33, train_loss: 0.7505, test_loss: 1.3914, test_f1: 0.5586
 epoch: 34, train_loss: 0.7494, test_loss: 2.4833, test_f1: 0.4437
 epoch: 35, train_loss: 0.7358, test_loss: 1.0611, test_f1: 0.5076
 epoch: 36, train_loss: 0.7162, test_loss: 1.0770, test_f1: 0.5862
 epoch: 37, train_loss: 0.7172, test_loss: 1.0719, test_f1: 0.5951
 epoch: 38, train_loss: 0.7249, test_loss: 0.9791, test_f1: 0.5712
 epoch: 39, train_loss: 0.7371, test_loss: 1.0726, test_f1: 0.6253
 epoch: 40, train_loss: 0.7035, test_loss: 1.1861, test_f1: 0.5674
 epoch: 41, train_loss: 0.7451, test_loss: 1.0779, test_f1: 0.5558
 epoch: 42, train_loss: 0.7187, test_loss: 1.4104, test_f1: 0.5121
 epoch: 43, train_loss: 0.7342, test_loss: 2.2258, test_f1: 0.5640
 epoch: 44, train_loss: 0.7229, test_loss: 2.1534, test_f1: 0.5749
 epoch: 45, train_loss: 0.7005, test_loss: 1.0273, test_f1: 0.6199
 epoch: 46, train_loss: 0.6972, test_loss: 1.1431, test_f1: 0.6119
 epoch: 47, train_loss: 0.6886, test_loss: 1.0447, test_f1: 0.5841
 epoch: 48, train_loss: 0.6796, test_loss: 0.9918, test_f1: 0.6286
 epoch: 49, train_loss: 0.6936, test_loss: 1.0409, test_f1: 0.6192
 epoch: 50, train_loss: 0.7036, test_loss: 1.0199, test_f1: 0.5994
 epoch: 51, train_loss: 0.6743, test_loss: 1.0340, test_f1: 0.6006
 epoch: 52, train_loss: 0.6367, test_loss: 1.0195, test_f1: 0.6240
 epoch: 53, train_loss: 0.6516, test_loss: 1.1101, test_f1: 0.6495
 epoch: 54, train_loss: 0.6376, test_loss: 1.1389, test_f1: 0.6588
 epoch: 55, train_loss: 0.6432, test_loss: 2.1102, test_f1: 0.6243
 epoch: 56, train_loss: 0.6357, test_loss: 1.6903, test_f1: 0.6142
 epoch: 57, train_loss: 0.6203, test_loss: 1.1520, test_f1: 0.6257
 epoch: 58, train_loss: 0.6308, test_loss: 1.3705, test_f1: 0.6136
 epoch: 59, train_loss: 0.6340, test_loss: 1.1581, test_f1: 0.6507
 epoch: 60, train_loss: 0.6297, test_loss: 1.0625, test_f1: 0.6495
 epoch: 61, train_loss: 0.6335, test_loss: 1.0920, test_f1: 0.6496
 epoch: 62, train_loss: 0.6148, test_loss: 1.2817, test_f1: 0.6544
 epoch: 63, train_loss: 0.5951, test_loss: 1.2347, test_f1: 0.6348
 epoch: 64, train_loss: 0.6133, test_loss: 1.1692, test_f1: 0.6497
 epoch: 65, train_loss: 0.6185, test_loss: 1.1452, test_f1: 0.6501
 epoch: 66, train_loss: 0.5968, test_loss: 1.2462, test_f1: 0.6199
 epoch: 67, train_loss: 0.5900, test_loss: 1.3302, test_f1: 0.6279
 epoch: 68, train_loss: 0.6007, test_loss: 1.0406, test_f1: 0.6871
 epoch: 69, train_loss: 0.5909, test_loss: 1.3302, test_f1: 0.6017
 epoch: 70, train_loss: 0.5907, test_loss: 1.3375, test_f1: 0.6455
 epoch: 71, train_loss: 0.5979, test_loss: 1.2231, test_f1: 0.6354
 epoch: 72, train_loss: 0.5881, test_loss: 1.2339, test_f1: 0.6185
 epoch: 73, train_loss: 0.6161, test_loss: 1.1624, test_f1: 0.5921
 epoch: 74, train_loss: 0.5987, test_loss: 1.2571, test_f1: 0.6526
 epoch: 75, train_loss: 0.5768, test_loss: 1.2604, test_f1: 0.6470
 epoch: 76, train_loss: 0.5876, test_loss: 1.1491, test_f1: 0.6285
 epoch: 77, train_loss: 0.5933, test_loss: 1.2376, test_f1: 0.5812
 epoch: 78, train_loss: 0.5847, test_loss: 1.5955, test_f1: 0.6741
 epoch: 79, train_loss: 0.5711, test_loss: 1.1908, test_f1: 0.6203
 epoch: 80, train_loss: 0.5607, test_loss: 1.3784, test_f1: 0.5874
 epoch: 81, train_loss: 0.5741, test_loss: 1.5872, test_f1: 0.6653
 epoch: 82, train_loss: 0.5525, test_loss: 1.2606, test_f1: 0.6637
 epoch: 83, train_loss: 0.5486, test_loss: 1.8119, test_f1: 0.6214
 epoch: 84, train_loss: 0.5642, test_loss: 1.3020, test_f1: 0.6940
 epoch: 85, train_loss: 0.5482, test_loss: 1.4166, test_f1: 0.6326
 epoch: 86, train_loss: 0.5702, test_loss: 1.4157, test_f1: 0.6118
 epoch: 87, train_loss: 0.5524, test_loss: 1.2913, test_f1: 0.6473
 epoch: 88, train_loss: 0.5409, test_loss: 1.1054, test_f1: 0.6473
 epoch: 89, train_loss: 0.5466, test_loss: 1.3766, test_f1: 0.6541
 epoch: 90, train_loss: 0.5198, test_loss: 1.3037, test_f1: 0.5916
 epoch: 91, train_loss: 0.5307, test_loss: 1.5347, test_f1: 0.6594
 epoch: 92, train_loss: 0.5412, test_loss: 1.3387, test_f1: 0.6400
 epoch: 93, train_loss: 0.5422, test_loss: 1.0986, test_f1: 0.6921
 epoch: 94, train_loss: 0.5489, test_loss: 1.4660, test_f1: 0.6350
 epoch: 95, train_loss: 0.5224, test_loss: 1.7381, test_f1: 0.6615
 epoch: 96, train_loss: 0.5220, test_loss: 1.5038, test_f1: 0.6462
 epoch: 97, train_loss: 0.5224, test_loss: 1.3440, test_f1: 0.6415
 epoch: 98, train_loss: 0.5201, test_loss: 1.3692, test_f1: 0.6549
 epoch: 99, train_loss: 0.5009, test_loss: 1.4767, test_f1: 0.6373
##################ITERATION #7 ****************************************
 epoch: 0, train_loss: 1.2079, test_loss: 1.0977, test_f1: 0.4084
 epoch: 1, train_loss: 1.0249, test_loss: 1.1278, test_f1: 0.3651
 epoch: 2, train_loss: 1.0052, test_loss: 1.0764, test_f1: 0.4980
 epoch: 3, train_loss: 0.9756, test_loss: 1.1072, test_f1: 0.4523
 epoch: 4, train_loss: 0.9441, test_loss: 1.0540, test_f1: 0.5496
 epoch: 5, train_loss: 0.8851, test_loss: 1.2564, test_f1: 0.4421
 epoch: 6, train_loss: 0.9227, test_loss: 0.9770, test_f1: 0.5871
 epoch: 7, train_loss: 0.8707, test_loss: 0.9782, test_f1: 0.5563
 epoch: 8, train_loss: 0.8407, test_loss: 1.1976, test_f1: 0.5439
 epoch: 9, train_loss: 0.8803, test_loss: 0.9248, test_f1: 0.5931
 epoch: 10, train_loss: 0.8335, test_loss: 0.9706, test_f1: 0.5996
 epoch: 11, train_loss: 0.8331, test_loss: 1.0444, test_f1: 0.5458
 epoch: 12, train_loss: 0.8283, test_loss: 0.9898, test_f1: 0.4970
 epoch: 13, train_loss: 0.8061, test_loss: 0.9894, test_f1: 0.5899
 epoch: 14, train_loss: 0.8261, test_loss: 0.9194, test_f1: 0.5848
 epoch: 15, train_loss: 0.7853, test_loss: 0.9050, test_f1: 0.5793
 epoch: 16, train_loss: 0.8153, test_loss: 0.9290, test_f1: 0.5106
 epoch: 17, train_loss: 0.7980, test_loss: 1.0371, test_f1: 0.5037
 epoch: 18, train_loss: 0.8245, test_loss: 0.9903, test_f1: 0.5883
 epoch: 19, train_loss: 0.8246, test_loss: 0.9706, test_f1: 0.5948
 epoch: 20, train_loss: 0.7838, test_loss: 0.8824, test_f1: 0.6244
 epoch: 21, train_loss: 0.7749, test_loss: 0.9359, test_f1: 0.6020
 epoch: 22, train_loss: 0.7756, test_loss: 1.0031, test_f1: 0.4728
 epoch: 23, train_loss: 0.7845, test_loss: 0.9750, test_f1: 0.5655
 epoch: 24, train_loss: 0.7795, test_loss: 0.9431, test_f1: 0.6044
 epoch: 25, train_loss: 0.7573, test_loss: 0.9558, test_f1: 0.5057
 epoch: 26, train_loss: 0.7772, test_loss: 1.2534, test_f1: 0.5305
 epoch: 27, train_loss: 0.7426, test_loss: 0.8797, test_f1: 0.5919
 epoch: 28, train_loss: 0.7527, test_loss: 0.9758, test_f1: 0.6341
 epoch: 29, train_loss: 0.7632, test_loss: 0.8853, test_f1: 0.5788
 epoch: 30, train_loss: 0.7398, test_loss: 0.9526, test_f1: 0.5978
 epoch: 31, train_loss: 0.7506, test_loss: 1.0249, test_f1: 0.5330
 epoch: 32, train_loss: 0.7613, test_loss: 0.9814, test_f1: 0.5758
 epoch: 33, train_loss: 0.7587, test_loss: 1.0522, test_f1: 0.5690
 epoch: 34, train_loss: 0.7670, test_loss: 0.9236, test_f1: 0.6045
 epoch: 35, train_loss: 0.7095, test_loss: 0.9418, test_f1: 0.6141
 epoch: 36, train_loss: 0.7148, test_loss: 0.9652, test_f1: 0.4905
 epoch: 37, train_loss: 0.7624, test_loss: 0.9811, test_f1: 0.5359
 epoch: 38, train_loss: 0.7623, test_loss: 0.9102, test_f1: 0.6306
 epoch: 39, train_loss: 0.7077, test_loss: 0.9690, test_f1: 0.6249
 epoch: 40, train_loss: 0.7011, test_loss: 1.0566, test_f1: 0.6128
 epoch: 41, train_loss: 0.7357, test_loss: 0.9190, test_f1: 0.6283
 epoch: 42, train_loss: 0.7106, test_loss: 0.9573, test_f1: 0.6384
 epoch: 43, train_loss: 0.6980, test_loss: 0.9008, test_f1: 0.6401
 epoch: 44, train_loss: 0.7575, test_loss: 1.0279, test_f1: 0.5617
 epoch: 45, train_loss: 0.7518, test_loss: 0.9497, test_f1: 0.5889
 epoch: 46, train_loss: 0.7571, test_loss: 1.0026, test_f1: 0.5852
 epoch: 47, train_loss: 0.7348, test_loss: 0.9755, test_f1: 0.6095
 epoch: 48, train_loss: 0.7372, test_loss: 0.9296, test_f1: 0.6117
 epoch: 49, train_loss: 0.7167, test_loss: 1.0782, test_f1: 0.6219
 epoch: 50, train_loss: 0.7048, test_loss: 1.0176, test_f1: 0.5620
 epoch: 51, train_loss: 0.7100, test_loss: 0.9348, test_f1: 0.6536
 epoch: 52, train_loss: 0.6580, test_loss: 1.0306, test_f1: 0.5959
 epoch: 53, train_loss: 0.6488, test_loss: 1.0387, test_f1: 0.6163
 epoch: 54, train_loss: 0.6382, test_loss: 1.0777, test_f1: 0.6272
 epoch: 55, train_loss: 0.6256, test_loss: 0.9615, test_f1: 0.6539
 epoch: 56, train_loss: 0.6397, test_loss: 1.1589, test_f1: 0.6204
 epoch: 57, train_loss: 0.6795, test_loss: 1.0637, test_f1: 0.5832
 epoch: 58, train_loss: 0.6450, test_loss: 1.1196, test_f1: 0.6286
 epoch: 59, train_loss: 0.6412, test_loss: 1.0417, test_f1: 0.6309
 epoch: 60, train_loss: 0.6173, test_loss: 1.0050, test_f1: 0.6645
 epoch: 61, train_loss: 0.6094, test_loss: 1.1130, test_f1: 0.6419
 epoch: 62, train_loss: 0.5794, test_loss: 1.0511, test_f1: 0.6039
 epoch: 63, train_loss: 0.6297, test_loss: 1.2666, test_f1: 0.6385
 epoch: 64, train_loss: 0.6066, test_loss: 1.1103, test_f1: 0.6548
 epoch: 65, train_loss: 0.6143, test_loss: 1.1969, test_f1: 0.5863
 epoch: 66, train_loss: 0.6007, test_loss: 1.0536, test_f1: 0.6560
 epoch: 67, train_loss: 0.5939, test_loss: 1.0777, test_f1: 0.5775
 epoch: 68, train_loss: 0.6017, test_loss: 1.1599, test_f1: 0.6385
 epoch: 69, train_loss: 0.6013, test_loss: 1.0974, test_f1: 0.6200
 epoch: 70, train_loss: 0.5752, test_loss: 1.0650, test_f1: 0.6406
 epoch: 71, train_loss: 0.6192, test_loss: 0.9786, test_f1: 0.6460
 epoch: 72, train_loss: 0.5731, test_loss: 1.1674, test_f1: 0.6226
 epoch: 73, train_loss: 0.5674, test_loss: 0.9877, test_f1: 0.6597
 epoch: 74, train_loss: 0.5806, test_loss: 1.0181, test_f1: 0.6453
 epoch: 75, train_loss: 0.5855, test_loss: 1.0918, test_f1: 0.6247
 epoch: 76, train_loss: 0.5976, test_loss: 1.1324, test_f1: 0.6110
 epoch: 77, train_loss: 0.5828, test_loss: 1.1503, test_f1: 0.6714
 epoch: 78, train_loss: 0.5613, test_loss: 1.2112, test_f1: 0.6246
 epoch: 79, train_loss: 0.5573, test_loss: 1.3734, test_f1: 0.6328
 epoch: 80, train_loss: 0.5650, test_loss: 1.0814, test_f1: 0.6233
 epoch: 81, train_loss: 0.5588, test_loss: 1.4367, test_f1: 0.5537
 epoch: 82, train_loss: 0.5627, test_loss: 1.3919, test_f1: 0.6015
 epoch: 83, train_loss: 0.5596, test_loss: 1.2128, test_f1: 0.6292
 epoch: 84, train_loss: 0.5525, test_loss: 1.2831, test_f1: 0.6057
 epoch: 85, train_loss: 0.5704, test_loss: 1.0915, test_f1: 0.6166
 epoch: 86, train_loss: 0.5459, test_loss: 1.1805, test_f1: 0.6140
 epoch: 87, train_loss: 0.5753, test_loss: 1.2330, test_f1: 0.6270
 epoch: 88, train_loss: 0.5427, test_loss: 1.1215, test_f1: 0.6410
 epoch: 89, train_loss: 0.5343, test_loss: 1.2136, test_f1: 0.6317
 epoch: 90, train_loss: 0.5064, test_loss: 1.0709, test_f1: 0.6071
 epoch: 91, train_loss: 0.5698, test_loss: 1.2444, test_f1: 0.6289
 epoch: 92, train_loss: 0.5467, test_loss: 1.3209, test_f1: 0.6075
 epoch: 93, train_loss: 0.5355, test_loss: 1.2719, test_f1: 0.6479
 epoch: 94, train_loss: 0.5519, test_loss: 1.1546, test_f1: 0.6228
 epoch: 95, train_loss: 0.5333, test_loss: 1.3508, test_f1: 0.6115
 epoch: 96, train_loss: 0.5754, test_loss: 1.0997, test_f1: 0.6149
 epoch: 97, train_loss: 0.5449, test_loss: 1.1366, test_f1: 0.6391
 epoch: 98, train_loss: 0.5046, test_loss: 1.4484, test_f1: 0.6348
 epoch: 99, train_loss: 0.5036, test_loss: 1.3346, test_f1: 0.6209
##################ITERATION #8 ****************************************
 epoch: 0, train_loss: 1.1915, test_loss: 1.2781, test_f1: 0.2684
 epoch: 1, train_loss: 1.0648, test_loss: 2.0066, test_f1: 0.2388
 epoch: 2, train_loss: 0.9880, test_loss: 1.1489, test_f1: 0.4617
 epoch: 3, train_loss: 0.9488, test_loss: 1.0176, test_f1: 0.5467
 epoch: 4, train_loss: 0.9680, test_loss: 1.0978, test_f1: 0.4997
 epoch: 5, train_loss: 0.8982, test_loss: 1.0469, test_f1: 0.4857
 epoch: 6, train_loss: 0.8975, test_loss: 0.9926, test_f1: 0.5313
 epoch: 7, train_loss: 0.8781, test_loss: 0.9796, test_f1: 0.5790
 epoch: 8, train_loss: 0.8950, test_loss: 1.2882, test_f1: 0.5157
 epoch: 9, train_loss: 0.8541, test_loss: 0.9540, test_f1: 0.5789
 epoch: 10, train_loss: 0.8443, test_loss: 0.9400, test_f1: 0.5889
 epoch: 11, train_loss: 0.8155, test_loss: 0.9657, test_f1: 0.5463
 epoch: 12, train_loss: 0.8210, test_loss: 0.9500, test_f1: 0.5936
 epoch: 13, train_loss: 0.8496, test_loss: 0.9849, test_f1: 0.5220
 epoch: 14, train_loss: 0.8175, test_loss: 0.9726, test_f1: 0.6220
 epoch: 15, train_loss: 0.8283, test_loss: 1.0985, test_f1: 0.5560
 epoch: 16, train_loss: 0.8156, test_loss: 0.9724, test_f1: 0.5491
 epoch: 17, train_loss: 0.8480, test_loss: 0.9339, test_f1: 0.5753
 epoch: 18, train_loss: 0.8238, test_loss: 0.9831, test_f1: 0.5441
 epoch: 19, train_loss: 0.7993, test_loss: 0.9477, test_f1: 0.6082
 epoch: 20, train_loss: 0.8083, test_loss: 1.2158, test_f1: 0.5199
 epoch: 21, train_loss: 0.8013, test_loss: 0.9651, test_f1: 0.6120
 epoch: 22, train_loss: 0.7788, test_loss: 0.9727, test_f1: 0.5736
 epoch: 23, train_loss: 0.7758, test_loss: 1.0527, test_f1: 0.5910
 epoch: 24, train_loss: 0.7861, test_loss: 1.0294, test_f1: 0.5641
 epoch: 25, train_loss: 0.7881, test_loss: 1.0281, test_f1: 0.5394
 epoch: 26, train_loss: 0.7740, test_loss: 1.0495, test_f1: 0.5590
 epoch: 27, train_loss: 0.7605, test_loss: 0.9811, test_f1: 0.5904
 epoch: 28, train_loss: 0.7660, test_loss: 1.1327, test_f1: 0.4865
 epoch: 29, train_loss: 0.7699, test_loss: 0.9543, test_f1: 0.5892
 epoch: 30, train_loss: 0.7440, test_loss: 0.9882, test_f1: 0.5901
 epoch: 31, train_loss: 0.7439, test_loss: 1.0532, test_f1: 0.5317
 epoch: 32, train_loss: 0.7545, test_loss: 1.0157, test_f1: 0.5147
 epoch: 33, train_loss: 0.7598, test_loss: 1.2763, test_f1: 0.5091
 epoch: 34, train_loss: 0.7838, test_loss: 1.1621, test_f1: 0.4888
 epoch: 35, train_loss: 0.7508, test_loss: 1.0000, test_f1: 0.5583
 epoch: 36, train_loss: 0.7433, test_loss: 1.1068, test_f1: 0.5962
 epoch: 37, train_loss: 0.7425, test_loss: 1.2484, test_f1: 0.5095
 epoch: 38, train_loss: 0.7551, test_loss: 1.0248, test_f1: 0.5466
 epoch: 39, train_loss: 0.7626, test_loss: 0.9709, test_f1: 0.6161
 epoch: 40, train_loss: 0.7634, test_loss: 1.4997, test_f1: 0.5896
 epoch: 41, train_loss: 0.7528, test_loss: 0.9654, test_f1: 0.6088
 epoch: 42, train_loss: 0.7470, test_loss: 1.0365, test_f1: 0.5926
 epoch: 43, train_loss: 0.7033, test_loss: 1.0904, test_f1: 0.5757
 epoch: 44, train_loss: 0.7027, test_loss: 1.0412, test_f1: 0.5945
 epoch: 45, train_loss: 0.7496, test_loss: 1.1530, test_f1: 0.5541
 epoch: 46, train_loss: 0.6999, test_loss: 1.0622, test_f1: 0.6263
 epoch: 47, train_loss: 0.6958, test_loss: 1.1444, test_f1: 0.6622
 epoch: 48, train_loss: 0.7188, test_loss: 0.9998, test_f1: 0.5911
 epoch: 49, train_loss: 0.7279, test_loss: 1.4360, test_f1: 0.5094
 epoch: 50, train_loss: 0.7253, test_loss: 1.5822, test_f1: 0.5274
 epoch: 51, train_loss: 0.6931, test_loss: 1.0221, test_f1: 0.6604
 epoch: 52, train_loss: 0.6597, test_loss: 1.0134, test_f1: 0.6679
 epoch: 53, train_loss: 0.6550, test_loss: 1.0709, test_f1: 0.5992
 epoch: 54, train_loss: 0.6541, test_loss: 1.0558, test_f1: 0.6028
 epoch: 55, train_loss: 0.6227, test_loss: 1.0992, test_f1: 0.6361
 epoch: 56, train_loss: 0.6218, test_loss: 1.3222, test_f1: 0.5649
 epoch: 57, train_loss: 0.6393, test_loss: 1.0196, test_f1: 0.5890
 epoch: 58, train_loss: 0.6284, test_loss: 1.2383, test_f1: 0.5950
 epoch: 59, train_loss: 0.6169, test_loss: 1.2109, test_f1: 0.5967
 epoch: 60, train_loss: 0.6169, test_loss: 1.2217, test_f1: 0.5821
 epoch: 61, train_loss: 0.6294, test_loss: 1.0716, test_f1: 0.5764
 epoch: 62, train_loss: 0.6435, test_loss: 1.1288, test_f1: 0.5591
 epoch: 63, train_loss: 0.6320, test_loss: 0.9742, test_f1: 0.6239
 epoch: 64, train_loss: 0.6169, test_loss: 1.1940, test_f1: 0.5766
 epoch: 65, train_loss: 0.6262, test_loss: 1.2608, test_f1: 0.5868
 epoch: 66, train_loss: 0.6216, test_loss: 1.1670, test_f1: 0.5856
 epoch: 67, train_loss: 0.6341, test_loss: 1.0852, test_f1: 0.5989
 epoch: 68, train_loss: 0.6149, test_loss: 1.0921, test_f1: 0.5735
 epoch: 69, train_loss: 0.6131, test_loss: 1.1507, test_f1: 0.6075
 epoch: 70, train_loss: 0.6112, test_loss: 1.2819, test_f1: 0.6303
 epoch: 71, train_loss: 0.6010, test_loss: 1.1523, test_f1: 0.5949
 epoch: 72, train_loss: 0.6000, test_loss: 1.3883, test_f1: 0.6019
 epoch: 73, train_loss: 0.5985, test_loss: 1.0679, test_f1: 0.6140
 epoch: 74, train_loss: 0.6055, test_loss: 1.6100, test_f1: 0.5446
 epoch: 75, train_loss: 0.5912, test_loss: 1.2198, test_f1: 0.6283
 epoch: 76, train_loss: 0.5705, test_loss: 1.5563, test_f1: 0.5956
 epoch: 77, train_loss: 0.5770, test_loss: 1.4149, test_f1: 0.6160
 epoch: 78, train_loss: 0.5873, test_loss: 1.3778, test_f1: 0.5779
 epoch: 79, train_loss: 0.5993, test_loss: 1.3542, test_f1: 0.6282
 epoch: 80, train_loss: 0.5657, test_loss: 1.5649, test_f1: 0.6264
 epoch: 81, train_loss: 0.5587, test_loss: 1.3258, test_f1: 0.6118
 epoch: 82, train_loss: 0.5995, test_loss: 1.1092, test_f1: 0.6554
 epoch: 83, train_loss: 0.5907, test_loss: 1.2814, test_f1: 0.5833
 epoch: 84, train_loss: 0.5643, test_loss: 1.2460, test_f1: 0.6397
 epoch: 85, train_loss: 0.5863, test_loss: 1.1478, test_f1: 0.6115
 epoch: 86, train_loss: 0.5891, test_loss: 1.5365, test_f1: 0.5684
 epoch: 87, train_loss: 0.5784, test_loss: 1.2192, test_f1: 0.6326
 epoch: 88, train_loss: 0.5618, test_loss: 1.4903, test_f1: 0.6424
 epoch: 89, train_loss: 0.5627, test_loss: 1.2812, test_f1: 0.6332
 epoch: 90, train_loss: 0.5544, test_loss: 1.8513, test_f1: 0.6006
 epoch: 91, train_loss: 0.5501, test_loss: 1.4253, test_f1: 0.6154
 epoch: 92, train_loss: 0.5428, test_loss: 1.2694, test_f1: 0.5982
 epoch: 93, train_loss: 0.5657, test_loss: 1.6410, test_f1: 0.6166
 epoch: 94, train_loss: 0.5459, test_loss: 1.3894, test_f1: 0.6403
 epoch: 95, train_loss: 0.5666, test_loss: 1.6655, test_f1: 0.6215
 epoch: 96, train_loss: 0.5339, test_loss: 1.3909, test_f1: 0.6363
 epoch: 97, train_loss: 0.5245, test_loss: 1.5730, test_f1: 0.5862
 epoch: 98, train_loss: 0.5273, test_loss: 1.5255, test_f1: 0.6357
 epoch: 99, train_loss: 0.5541, test_loss: 1.4993, test_f1: 0.6278
##################ITERATION #9 ****************************************
 epoch: 0, train_loss: 1.1435, test_loss: 1.1569, test_f1: 0.4246
 epoch: 1, train_loss: 0.9763, test_loss: 0.9883, test_f1: 0.4483
 epoch: 2, train_loss: 0.9200, test_loss: 1.0171, test_f1: 0.5726
 epoch: 3, train_loss: 0.8940, test_loss: 0.9515, test_f1: 0.5783
 epoch: 4, train_loss: 0.8612, test_loss: 0.9326, test_f1: 0.5070
 epoch: 5, train_loss: 0.8680, test_loss: 1.2655, test_f1: 0.4130
 epoch: 6, train_loss: 0.8498, test_loss: 1.1656, test_f1: 0.5335
 epoch: 7, train_loss: 0.8709, test_loss: 0.9876, test_f1: 0.5356
 epoch: 8, train_loss: 0.8279, test_loss: 1.1373, test_f1: 0.5780
 epoch: 9, train_loss: 0.8455, test_loss: 1.0969, test_f1: 0.5117
 epoch: 10, train_loss: 0.8211, test_loss: 1.5530, test_f1: 0.4951
 epoch: 11, train_loss: 0.8141, test_loss: 1.2631, test_f1: 0.5551
 epoch: 12, train_loss: 0.7971, test_loss: 1.5447, test_f1: 0.5465
 epoch: 13, train_loss: 0.7976, test_loss: 1.1775, test_f1: 0.5254
 epoch: 14, train_loss: 0.7992, test_loss: 0.9791, test_f1: 0.5469
 epoch: 15, train_loss: 0.7922, test_loss: 0.9929, test_f1: 0.5941
 epoch: 16, train_loss: 0.7844, test_loss: 0.9670, test_f1: 0.6000
 epoch: 17, train_loss: 0.7790, test_loss: 1.1160, test_f1: 0.5489
 epoch: 18, train_loss: 0.7950, test_loss: 1.0731, test_f1: 0.6216
 epoch: 19, train_loss: 0.7948, test_loss: 1.1400, test_f1: 0.5746
 epoch: 20, train_loss: 0.7727, test_loss: 1.0800, test_f1: 0.5948
 epoch: 21, train_loss: 0.7594, test_loss: 1.1085, test_f1: 0.6062
 epoch: 22, train_loss: 0.7484, test_loss: 1.0029, test_f1: 0.6196
 epoch: 23, train_loss: 0.7706, test_loss: 1.4150, test_f1: 0.5718
 epoch: 24, train_loss: 0.7627, test_loss: 1.2659, test_f1: 0.5297
 epoch: 25, train_loss: 0.7765, test_loss: 1.2496, test_f1: 0.5855
 epoch: 26, train_loss: 0.7772, test_loss: 0.9894, test_f1: 0.6041
 epoch: 27, train_loss: 0.7687, test_loss: 1.0287, test_f1: 0.6237
 epoch: 28, train_loss: 0.7505, test_loss: 1.0594, test_f1: 0.6392
 epoch: 29, train_loss: 0.7478, test_loss: 1.0842, test_f1: 0.6225
 epoch: 30, train_loss: 0.7527, test_loss: 1.0667, test_f1: 0.5611
 epoch: 31, train_loss: 0.7169, test_loss: 1.1339, test_f1: 0.6326
 epoch: 32, train_loss: 0.7283, test_loss: 1.3434, test_f1: 0.5766
 epoch: 33, train_loss: 0.8539, test_loss: 1.0447, test_f1: 0.5248
 epoch: 34, train_loss: 0.7954, test_loss: 1.0355, test_f1: 0.5767
 epoch: 35, train_loss: 0.7733, test_loss: 0.9770, test_f1: 0.6110
 epoch: 36, train_loss: 0.7382, test_loss: 0.9926, test_f1: 0.6412
 epoch: 37, train_loss: 0.7512, test_loss: 1.1363, test_f1: 0.5648
 epoch: 38, train_loss: 0.7449, test_loss: 0.9970, test_f1: 0.6213
 epoch: 39, train_loss: 0.7604, test_loss: 0.9687, test_f1: 0.5877
 epoch: 40, train_loss: 0.8082, test_loss: 0.9589, test_f1: 0.5954
 epoch: 41, train_loss: 0.7482, test_loss: 1.2795, test_f1: 0.5718
 epoch: 42, train_loss: 0.7133, test_loss: 1.0683, test_f1: 0.5762
 epoch: 43, train_loss: 0.7260, test_loss: 0.9829, test_f1: 0.6063
 epoch: 44, train_loss: 0.7510, test_loss: 1.2361, test_f1: 0.5931
 epoch: 45, train_loss: 0.7285, test_loss: 1.0206, test_f1: 0.5920
 epoch: 46, train_loss: 0.7544, test_loss: 0.9470, test_f1: 0.6235
 epoch: 47, train_loss: 0.7387, test_loss: 0.9623, test_f1: 0.5984
 epoch: 48, train_loss: 0.7017, test_loss: 1.0032, test_f1: 0.6031
 epoch: 49, train_loss: 0.6748, test_loss: 1.0770, test_f1: 0.5187
 epoch: 50, train_loss: 0.6947, test_loss: 1.2843, test_f1: 0.6124
 epoch: 51, train_loss: 0.6768, test_loss: 1.1155, test_f1: 0.5955
 epoch: 52, train_loss: 0.6634, test_loss: 0.9171, test_f1: 0.6034
 epoch: 53, train_loss: 0.6514, test_loss: 1.1117, test_f1: 0.6330
 epoch: 54, train_loss: 0.6663, test_loss: 1.0215, test_f1: 0.6380
 epoch: 55, train_loss: 0.6450, test_loss: 1.1759, test_f1: 0.6747
 epoch: 56, train_loss: 0.6238, test_loss: 1.1003, test_f1: 0.6220
 epoch: 57, train_loss: 0.6583, test_loss: 1.2162, test_f1: 0.6243
 epoch: 58, train_loss: 0.6446, test_loss: 1.0070, test_f1: 0.6564
 epoch: 59, train_loss: 0.6322, test_loss: 1.1924, test_f1: 0.6203
 epoch: 60, train_loss: 0.6374, test_loss: 1.1254, test_f1: 0.6420
 epoch: 61, train_loss: 0.6285, test_loss: 1.2241, test_f1: 0.6218
 epoch: 62, train_loss: 0.6561, test_loss: 1.0478, test_f1: 0.6515
 epoch: 63, train_loss: 0.6359, test_loss: 1.2329, test_f1: 0.6358
 epoch: 64, train_loss: 0.6404, test_loss: 1.1976, test_f1: 0.6694
 epoch: 65, train_loss: 0.6153, test_loss: 1.3930, test_f1: 0.5969
 epoch: 66, train_loss: 0.6296, test_loss: 1.1986, test_f1: 0.6513
 epoch: 67, train_loss: 0.6441, test_loss: 1.1193, test_f1: 0.6536
 epoch: 68, train_loss: 0.6108, test_loss: 1.3406, test_f1: 0.6542
 epoch: 69, train_loss: 0.6232, test_loss: 1.2258, test_f1: 0.6546
 epoch: 70, train_loss: 0.6293, test_loss: 1.4142, test_f1: 0.6306
 epoch: 71, train_loss: 0.6268, test_loss: 1.0557, test_f1: 0.6301
 epoch: 72, train_loss: 0.6225, test_loss: 1.0780, test_f1: 0.6819
 epoch: 73, train_loss: 0.6180, test_loss: 1.1590, test_f1: 0.6438
 epoch: 74, train_loss: 0.5992, test_loss: 1.2853, test_f1: 0.6730
 epoch: 75, train_loss: 0.5897, test_loss: 1.3350, test_f1: 0.6114
 epoch: 76, train_loss: 0.6169, test_loss: 1.3420, test_f1: 0.6627
 epoch: 77, train_loss: 0.5934, test_loss: 1.2885, test_f1: 0.6448
 epoch: 78, train_loss: 0.6000, test_loss: 1.2457, test_f1: 0.6566
 epoch: 79, train_loss: 0.6170, test_loss: 1.8966, test_f1: 0.5553
 epoch: 80, train_loss: 0.6275, test_loss: 1.0589, test_f1: 0.6314
 epoch: 81, train_loss: 0.6203, test_loss: 1.2325, test_f1: 0.6484
 epoch: 82, train_loss: 0.6130, test_loss: 1.4010, test_f1: 0.6393
 epoch: 83, train_loss: 0.6155, test_loss: 1.1625, test_f1: 0.6190
 epoch: 84, train_loss: 0.5905, test_loss: 1.2210, test_f1: 0.6600
 epoch: 85, train_loss: 0.5737, test_loss: 1.2084, test_f1: 0.6743
 epoch: 86, train_loss: 0.5877, test_loss: 1.4246, test_f1: 0.6054
 epoch: 87, train_loss: 0.5757, test_loss: 1.1475, test_f1: 0.6370
 epoch: 88, train_loss: 0.5573, test_loss: 1.2321, test_f1: 0.6412
 epoch: 89, train_loss: 0.5932, test_loss: 1.1968, test_f1: 0.6424
 epoch: 90, train_loss: 0.5798, test_loss: 1.1697, test_f1: 0.6348
 epoch: 91, train_loss: 0.5690, test_loss: 1.2159, test_f1: 0.6458
 epoch: 92, train_loss: 0.5583, test_loss: 1.5163, test_f1: 0.6108
 epoch: 93, train_loss: 0.5839, test_loss: 1.1785, test_f1: 0.6468
 epoch: 94, train_loss: 0.5751, test_loss: 1.1618, test_f1: 0.6242
 epoch: 95, train_loss: 0.5699, test_loss: 1.4288, test_f1: 0.6508
 epoch: 96, train_loss: 0.5454, test_loss: 1.4708, test_f1: 0.6377
 epoch: 97, train_loss: 0.5758, test_loss: 1.6124, test_f1: 0.6565
 epoch: 98, train_loss: 0.5746, test_loss: 1.4259, test_f1: 0.6215
 epoch: 99, train_loss: 0.6018, test_loss: 1.2623, test_f1: 0.6436

Training completed in 780.79 seconds
Best F1: 0.6940 at epoch 84
Mean F1 across iterations: 0.6693  0.0149
========================FINAL RESULTS================================
FEGIN weighted F1: 0.6940  0.0149
python main.py --data ltspice_demos --representation component_pin --model FEGIN --layers 6 --hiddens 32 --batch_size 32 --lr 0.01 --emb_size 512 --epochs 100 --save_appendix component_pin_L6_H32_BS32_LR0.01_E512 --no_val
-----



STDERR:
  File "main.py", line 370, in <module>
    main()
  File "main.py", line 254, in main
    dataset = dataset_class(
  File "/home/philip/projects/ltspice_examples_code_repo/Circuit-Completion-Using-GNNs/component_classification_with_link_prediction_head/evaluation/FEGIN/kernel/circuit_datasets.py", line 15, in __init__
    self.data, self.slices = torch.load(self.processed_paths[0])
  File "/home/philip/.local/lib/python3.8/site-packages/torch/serialization.py", line 1040, in load
    warnings.warn(
  File "/usr/lib/python3.8/warnings.py", line 109, in _showwarnmsg
    sw(msg.message, msg.category, msg.filename, msg.lineno,
  File "main.py", line 47, in warn_with_traceback
    traceback.print_stack(file=log)
/home/philip/projects/ltspice_examples_code_repo/Circuit-Completion-Using-GNNs/component_classification_with_link_prediction_head/evaluation/FEGIN/kernel/circuit_datasets.py:15: FutureWarning: You are using `torch.load` with `weights_only=False` (the current default value), which uses the default pickle module implicitly. It is possible to construct malicious pickle data which will execute arbitrary code during unpickling (See https://github.com/pytorch/pytorch/blob/main/SECURITY.md#untrusted-models for more details). In a future release, the default value for `weights_only` will be flipped to `True`. This limits the functions that could be executed during unpickling. Arbitrary objects will no longer be allowed to be loaded via this mode unless they are explicitly allowlisted by the user via `torch.serialization.add_safe_globals`. We recommend you start setting `weights_only=True` for any use case where you don't have full control of the loaded file. Please open an issue on GitHub for any issues related to this experimental feature.
  self.data, self.slices = torch.load(self.processed_paths[0])
