STDOUT:
Results will be saved in /home/philip/projects/ltspice_examples_code_repo/Circuit-Completion-Using-GNNs/component_classification_with_link_prediction_head/evaluation/FEGIN/results/model_FEGIN_dataset_ltspice_demos
Command line input: python main.py --data ltspice_demos --representation component_pin --model FEGIN --layers 6 --hiddens 32 --batch_size 32 --lr 0.01 --emb_size 512 --epochs 100 --save_appendix component_pin_L6_H32_BS32_LR0.01_E512 --no_val
 is saved.
-----
ltspice_demos - FEGIN
Using 6 layers, 32 hidden units, h = 2
Loading component_pin representation dataset
ENTERED
Training FEGIN on component_pin representation
Train: 1565, Test: 383
##################ITERATION #0 ****************************************
 epoch: 0, train_loss: 1.2467, test_loss: 1.2227, test_f1: 0.2380
 epoch: 1, train_loss: 1.1442, test_loss: 1.3361, test_f1: 0.3142
 epoch: 2, train_loss: 1.0601, test_loss: 1.1828, test_f1: 0.4977
 epoch: 3, train_loss: 0.9874, test_loss: 1.4753, test_f1: 0.4289
 epoch: 4, train_loss: 0.9631, test_loss: 1.0802, test_f1: 0.4619
 epoch: 5, train_loss: 0.9293, test_loss: 1.3972, test_f1: 0.3327
 epoch: 6, train_loss: 0.8954, test_loss: 1.3735, test_f1: 0.3653
 epoch: 7, train_loss: 0.9158, test_loss: 1.0325, test_f1: 0.4411
 epoch: 8, train_loss: 0.8406, test_loss: 0.9997, test_f1: 0.5968
 epoch: 9, train_loss: 0.8266, test_loss: 0.9452, test_f1: 0.5936
 epoch: 10, train_loss: 0.8309, test_loss: 1.0297, test_f1: 0.4456
 epoch: 11, train_loss: 0.8036, test_loss: 0.9064, test_f1: 0.6060
 epoch: 12, train_loss: 0.8038, test_loss: 0.9823, test_f1: 0.5299
 epoch: 13, train_loss: 0.7719, test_loss: 0.9195, test_f1: 0.5651
 epoch: 14, train_loss: 0.7543, test_loss: 1.0084, test_f1: 0.5889
 epoch: 15, train_loss: 0.7700, test_loss: 0.9507, test_f1: 0.5905
 epoch: 16, train_loss: 0.7737, test_loss: 1.0123, test_f1: 0.4806
 epoch: 17, train_loss: 0.7677, test_loss: 0.9533, test_f1: 0.6296
 epoch: 18, train_loss: 0.7699, test_loss: 0.9366, test_f1: 0.5093
 epoch: 19, train_loss: 0.7337, test_loss: 1.0882, test_f1: 0.5157
 epoch: 20, train_loss: 0.7488, test_loss: 0.9458, test_f1: 0.5741
 epoch: 21, train_loss: 0.7541, test_loss: 0.9998, test_f1: 0.5528
 epoch: 22, train_loss: 0.7351, test_loss: 1.0840, test_f1: 0.5958
 epoch: 23, train_loss: 0.7322, test_loss: 1.0003, test_f1: 0.4809
 epoch: 24, train_loss: 0.7480, test_loss: 1.1185, test_f1: 0.5170
 epoch: 25, train_loss: 0.7480, test_loss: 1.0406, test_f1: 0.5987
 epoch: 26, train_loss: 0.7190, test_loss: 0.9752, test_f1: 0.5123
 epoch: 27, train_loss: 0.7153, test_loss: 1.0377, test_f1: 0.5750
 epoch: 28, train_loss: 0.7040, test_loss: 0.8549, test_f1: 0.6448
 epoch: 29, train_loss: 0.7284, test_loss: 0.9168, test_f1: 0.5739
 epoch: 30, train_loss: 0.7184, test_loss: 1.1958, test_f1: 0.6096
 epoch: 31, train_loss: 0.7192, test_loss: 1.0330, test_f1: 0.6314
 epoch: 32, train_loss: 0.7120, test_loss: 0.9868, test_f1: 0.6392
 epoch: 33, train_loss: 0.6906, test_loss: 1.2931, test_f1: 0.6245
 epoch: 34, train_loss: 0.7183, test_loss: 1.1246, test_f1: 0.5635
 epoch: 35, train_loss: 0.7143, test_loss: 0.8723, test_f1: 0.6457
 epoch: 36, train_loss: 0.6925, test_loss: 1.0429, test_f1: 0.5574
 epoch: 37, train_loss: 0.6965, test_loss: 1.0661, test_f1: 0.5426
 epoch: 38, train_loss: 0.7336, test_loss: 1.1043, test_f1: 0.5878
 epoch: 39, train_loss: 0.7030, test_loss: 1.1597, test_f1: 0.4972
 epoch: 40, train_loss: 0.6931, test_loss: 1.0881, test_f1: 0.5041
 epoch: 41, train_loss: 0.6720, test_loss: 1.3422, test_f1: 0.4823
 epoch: 42, train_loss: 0.6815, test_loss: 1.1208, test_f1: 0.5846
 epoch: 43, train_loss: 0.6909, test_loss: 1.5575, test_f1: 0.4531
 epoch: 44, train_loss: 0.6853, test_loss: 1.0223, test_f1: 0.6087
 epoch: 45, train_loss: 0.6708, test_loss: 1.0285, test_f1: 0.4858
 epoch: 46, train_loss: 0.6696, test_loss: 1.0749, test_f1: 0.5699
 epoch: 47, train_loss: 0.6827, test_loss: 1.1629, test_f1: 0.5342
 epoch: 48, train_loss: 0.6822, test_loss: 0.9697, test_f1: 0.6217
 epoch: 49, train_loss: 0.6678, test_loss: 1.1437, test_f1: 0.5836
 epoch: 50, train_loss: 0.7067, test_loss: 1.1905, test_f1: 0.5630
 epoch: 51, train_loss: 0.6548, test_loss: 1.1627, test_f1: 0.5880
 epoch: 52, train_loss: 0.6229, test_loss: 1.1223, test_f1: 0.6038
 epoch: 53, train_loss: 0.6191, test_loss: 1.2296, test_f1: 0.5624
 epoch: 54, train_loss: 0.6162, test_loss: 1.3291, test_f1: 0.5885
 epoch: 55, train_loss: 0.5999, test_loss: 1.1342, test_f1: 0.5880
 epoch: 56, train_loss: 0.6326, test_loss: 1.2680, test_f1: 0.5769
 epoch: 57, train_loss: 0.6146, test_loss: 0.9648, test_f1: 0.5932
 epoch: 58, train_loss: 0.6119, test_loss: 1.4196, test_f1: 0.5353
 epoch: 59, train_loss: 0.6299, test_loss: 1.1217, test_f1: 0.6015
 epoch: 60, train_loss: 0.6211, test_loss: 1.0262, test_f1: 0.5808
 epoch: 61, train_loss: 0.6383, test_loss: 1.2035, test_f1: 0.5567
 epoch: 62, train_loss: 0.6178, test_loss: 1.1242, test_f1: 0.6055
 epoch: 63, train_loss: 0.6170, test_loss: 1.1500, test_f1: 0.5900
 epoch: 64, train_loss: 0.6061, test_loss: 1.1870, test_f1: 0.6104
 epoch: 65, train_loss: 0.6088, test_loss: 1.6495, test_f1: 0.4769
 epoch: 66, train_loss: 0.6211, test_loss: 1.1144, test_f1: 0.6064
 epoch: 67, train_loss: 0.5997, test_loss: 1.2624, test_f1: 0.5827
 epoch: 68, train_loss: 0.5838, test_loss: 1.1469, test_f1: 0.5959
 epoch: 69, train_loss: 0.5885, test_loss: 1.3013, test_f1: 0.5956
 epoch: 70, train_loss: 0.5914, test_loss: 1.0949, test_f1: 0.6088
 epoch: 71, train_loss: 0.5994, test_loss: 1.2338, test_f1: 0.5372
 epoch: 72, train_loss: 0.5920, test_loss: 1.4646, test_f1: 0.5297
 epoch: 73, train_loss: 0.5833, test_loss: 1.2995, test_f1: 0.5812
 epoch: 74, train_loss: 0.5963, test_loss: 1.7812, test_f1: 0.5429
 epoch: 75, train_loss: 0.6037, test_loss: 1.0800, test_f1: 0.6068
 epoch: 76, train_loss: 0.6068, test_loss: 1.1553, test_f1: 0.5877
 epoch: 77, train_loss: 0.6222, test_loss: 1.5053, test_f1: 0.5590
 epoch: 78, train_loss: 0.5967, test_loss: 1.4386, test_f1: 0.5795
 epoch: 79, train_loss: 0.5907, test_loss: 1.0863, test_f1: 0.5624
 epoch: 80, train_loss: 0.5950, test_loss: 1.0380, test_f1: 0.6015
 epoch: 81, train_loss: 0.5758, test_loss: 1.0686, test_f1: 0.6132
 epoch: 82, train_loss: 0.5595, test_loss: 1.0322, test_f1: 0.6072
 epoch: 83, train_loss: 0.5659, test_loss: 1.2150, test_f1: 0.5665
 epoch: 84, train_loss: 0.5820, test_loss: 1.1538, test_f1: 0.5936
 epoch: 85, train_loss: 0.5609, test_loss: 1.0564, test_f1: 0.6178
 epoch: 86, train_loss: 0.5958, test_loss: 1.5096, test_f1: 0.5587
 epoch: 87, train_loss: 0.5645, test_loss: 1.2047, test_f1: 0.6002
 epoch: 88, train_loss: 0.5767, test_loss: 1.3054, test_f1: 0.6001
 epoch: 89, train_loss: 0.5394, test_loss: 1.0652, test_f1: 0.6449
 epoch: 90, train_loss: 0.5768, test_loss: 1.2211, test_f1: 0.6026
 epoch: 91, train_loss: 0.5545, test_loss: 1.1316, test_f1: 0.6175
 epoch: 92, train_loss: 0.5537, test_loss: 1.4823, test_f1: 0.5983
 epoch: 93, train_loss: 0.5710, test_loss: 1.3529, test_f1: 0.5977
 epoch: 94, train_loss: 0.5613, test_loss: 1.5654, test_f1: 0.5420
 epoch: 95, train_loss: 0.5554, test_loss: 1.4707, test_f1: 0.5811
 epoch: 96, train_loss: 0.5547, test_loss: 1.2023, test_f1: 0.6056
 epoch: 97, train_loss: 0.5556, test_loss: 1.3818, test_f1: 0.5867
 epoch: 98, train_loss: 0.5395, test_loss: 1.2899, test_f1: 0.5506
 epoch: 99, train_loss: 0.5512, test_loss: 1.1889, test_f1: 0.5924
##################ITERATION #1 ****************************************
 epoch: 0, train_loss: 1.1732, test_loss: 1.1777, test_f1: 0.4320
 epoch: 1, train_loss: 1.0563, test_loss: 1.1469, test_f1: 0.3859
 epoch: 2, train_loss: 1.0098, test_loss: 1.0954, test_f1: 0.3747
 epoch: 3, train_loss: 0.9575, test_loss: 1.1940, test_f1: 0.4294
 epoch: 4, train_loss: 0.9263, test_loss: 0.9530, test_f1: 0.5145
 epoch: 5, train_loss: 0.9207, test_loss: 1.0681, test_f1: 0.4672
 epoch: 6, train_loss: 0.9582, test_loss: 1.0218, test_f1: 0.5206
 epoch: 7, train_loss: 0.9062, test_loss: 1.0102, test_f1: 0.5752
 epoch: 8, train_loss: 0.8563, test_loss: 1.2084, test_f1: 0.4094
 epoch: 9, train_loss: 0.8645, test_loss: 1.0954, test_f1: 0.5386
 epoch: 10, train_loss: 0.8703, test_loss: 1.0845, test_f1: 0.5402
 epoch: 11, train_loss: 0.8488, test_loss: 1.2193, test_f1: 0.4937
 epoch: 12, train_loss: 0.8358, test_loss: 0.9737, test_f1: 0.5452
 epoch: 13, train_loss: 0.8163, test_loss: 0.9804, test_f1: 0.5710
 epoch: 14, train_loss: 0.8085, test_loss: 1.4755, test_f1: 0.4884
 epoch: 15, train_loss: 0.8206, test_loss: 1.1454, test_f1: 0.5083
 epoch: 16, train_loss: 0.8195, test_loss: 1.0369, test_f1: 0.5249
 epoch: 17, train_loss: 0.7945, test_loss: 1.1001, test_f1: 0.5118
 epoch: 18, train_loss: 0.7871, test_loss: 1.6547, test_f1: 0.5018
 epoch: 19, train_loss: 0.8149, test_loss: 1.0857, test_f1: 0.5181
 epoch: 20, train_loss: 0.7977, test_loss: 1.1649, test_f1: 0.6219
 epoch: 21, train_loss: 0.7759, test_loss: 1.3191, test_f1: 0.4701
 epoch: 22, train_loss: 0.8112, test_loss: 1.1367, test_f1: 0.5542
 epoch: 23, train_loss: 0.7756, test_loss: 0.9461, test_f1: 0.6097
 epoch: 24, train_loss: 0.7762, test_loss: 1.0245, test_f1: 0.5467
 epoch: 25, train_loss: 0.7695, test_loss: 1.3193, test_f1: 0.5231
 epoch: 26, train_loss: 0.7430, test_loss: 1.1172, test_f1: 0.4384
 epoch: 27, train_loss: 0.7745, test_loss: 0.9337, test_f1: 0.6116
 epoch: 28, train_loss: 0.7466, test_loss: 1.0572, test_f1: 0.5655
 epoch: 29, train_loss: 0.7726, test_loss: 1.3254, test_f1: 0.4081
 epoch: 30, train_loss: 0.7478, test_loss: 0.9312, test_f1: 0.6253
 epoch: 31, train_loss: 0.7328, test_loss: 1.1311, test_f1: 0.4185
 epoch: 32, train_loss: 0.7935, test_loss: 1.0812, test_f1: 0.5718
 epoch: 33, train_loss: 0.7499, test_loss: 1.2343, test_f1: 0.5990
 epoch: 34, train_loss: 0.7267, test_loss: 1.2990, test_f1: 0.4829
 epoch: 35, train_loss: 0.7256, test_loss: 1.3358, test_f1: 0.5816
 epoch: 36, train_loss: 0.7467, test_loss: 1.1226, test_f1: 0.6060
 epoch: 37, train_loss: 0.7475, test_loss: 1.0108, test_f1: 0.6179
 epoch: 38, train_loss: 0.7382, test_loss: 1.1776, test_f1: 0.5195
 epoch: 39, train_loss: 0.7088, test_loss: 1.1786, test_f1: 0.5905
 epoch: 40, train_loss: 0.7207, test_loss: 0.9950, test_f1: 0.6216
 epoch: 41, train_loss: 0.7172, test_loss: 1.1387, test_f1: 0.6232
 epoch: 42, train_loss: 0.6899, test_loss: 0.9486, test_f1: 0.6427
 epoch: 43, train_loss: 0.7091, test_loss: 1.1756, test_f1: 0.6040
 epoch: 44, train_loss: 0.7146, test_loss: 1.0404, test_f1: 0.6147
 epoch: 45, train_loss: 0.7006, test_loss: 1.1852, test_f1: 0.6129
 epoch: 46, train_loss: 0.7231, test_loss: 0.9702, test_f1: 0.5996
 epoch: 47, train_loss: 0.7149, test_loss: 1.5375, test_f1: 0.5838
 epoch: 48, train_loss: 0.6974, test_loss: 1.1387, test_f1: 0.5572
 epoch: 49, train_loss: 0.6971, test_loss: 0.9332, test_f1: 0.6011
 epoch: 50, train_loss: 0.6766, test_loss: 1.4660, test_f1: 0.5169
 epoch: 51, train_loss: 0.6560, test_loss: 1.3506, test_f1: 0.5672
 epoch: 52, train_loss: 0.6443, test_loss: 1.2559, test_f1: 0.6096
 epoch: 53, train_loss: 0.6389, test_loss: 1.3235, test_f1: 0.6184
 epoch: 54, train_loss: 0.6363, test_loss: 1.1882, test_f1: 0.6119
 epoch: 55, train_loss: 0.6361, test_loss: 1.3697, test_f1: 0.5649
 epoch: 56, train_loss: 0.6072, test_loss: 1.2762, test_f1: 0.6283
 epoch: 57, train_loss: 0.6183, test_loss: 1.1674, test_f1: 0.5870
 epoch: 58, train_loss: 0.6046, test_loss: 1.3172, test_f1: 0.5921
 epoch: 59, train_loss: 0.6317, test_loss: 1.2607, test_f1: 0.5699
 epoch: 60, train_loss: 0.6146, test_loss: 1.3214, test_f1: 0.6003
 epoch: 61, train_loss: 0.6156, test_loss: 1.1839, test_f1: 0.6009
 epoch: 62, train_loss: 0.5981, test_loss: 1.3958, test_f1: 0.5142
 epoch: 63, train_loss: 0.5978, test_loss: 1.3759, test_f1: 0.6124
 epoch: 64, train_loss: 0.6046, test_loss: 1.7929, test_f1: 0.6068
 epoch: 65, train_loss: 0.6051, test_loss: 1.1782, test_f1: 0.6621
 epoch: 66, train_loss: 0.5866, test_loss: 1.2019, test_f1: 0.6236
 epoch: 67, train_loss: 0.5873, test_loss: 1.7249, test_f1: 0.6049
 epoch: 68, train_loss: 0.5960, test_loss: 1.3481, test_f1: 0.5924
 epoch: 69, train_loss: 0.5759, test_loss: 1.2101, test_f1: 0.5704
 epoch: 70, train_loss: 0.5726, test_loss: 1.6540, test_f1: 0.6271
 epoch: 71, train_loss: 0.5433, test_loss: 1.4289, test_f1: 0.6371
 epoch: 72, train_loss: 0.5776, test_loss: 1.7816, test_f1: 0.6007
 epoch: 73, train_loss: 0.5819, test_loss: 1.2745, test_f1: 0.6083
 epoch: 74, train_loss: 0.5865, test_loss: 1.6129, test_f1: 0.6424
 epoch: 75, train_loss: 0.5896, test_loss: 1.1122, test_f1: 0.6564
 epoch: 76, train_loss: 0.5737, test_loss: 1.5039, test_f1: 0.6345
 epoch: 77, train_loss: 0.5920, test_loss: 1.1950, test_f1: 0.6273
 epoch: 78, train_loss: 0.5554, test_loss: 1.6197, test_f1: 0.6036
 epoch: 79, train_loss: 0.5678, test_loss: 1.4248, test_f1: 0.6647
 epoch: 80, train_loss: 0.5599, test_loss: 1.4673, test_f1: 0.5824
 epoch: 81, train_loss: 0.5571, test_loss: 1.7175, test_f1: 0.5979
 epoch: 82, train_loss: 0.5737, test_loss: 1.4677, test_f1: 0.6328
 epoch: 83, train_loss: 0.5882, test_loss: 1.6631, test_f1: 0.6377
 epoch: 84, train_loss: 0.5558, test_loss: 1.2991, test_f1: 0.6259
 epoch: 85, train_loss: 0.5883, test_loss: 1.3040, test_f1: 0.6168
 epoch: 86, train_loss: 0.5494, test_loss: 1.3293, test_f1: 0.6450
 epoch: 87, train_loss: 0.5259, test_loss: 1.6585, test_f1: 0.6083
 epoch: 88, train_loss: 0.5692, test_loss: 1.3770, test_f1: 0.6283
 epoch: 89, train_loss: 0.5534, test_loss: 1.3793, test_f1: 0.6272
 epoch: 90, train_loss: 0.5512, test_loss: 1.5241, test_f1: 0.6212
 epoch: 91, train_loss: 0.5393, test_loss: 1.5612, test_f1: 0.6399
 epoch: 92, train_loss: 0.5061, test_loss: 1.2995, test_f1: 0.6503
 epoch: 93, train_loss: 0.5429, test_loss: 1.6671, test_f1: 0.6059
 epoch: 94, train_loss: 0.5247, test_loss: 1.6217, test_f1: 0.6025
 epoch: 95, train_loss: 0.5583, test_loss: 1.7063, test_f1: 0.6256
 epoch: 96, train_loss: 0.5117, test_loss: 1.6991, test_f1: 0.5896
 epoch: 97, train_loss: 0.5164, test_loss: 1.4016, test_f1: 0.6456
 epoch: 98, train_loss: 0.5113, test_loss: 1.7293, test_f1: 0.6671
 epoch: 99, train_loss: 0.5285, test_loss: 1.7335, test_f1: 0.6285
##################ITERATION #2 ****************************************
 epoch: 0, train_loss: 1.1803, test_loss: 1.3040, test_f1: 0.3947
 epoch: 1, train_loss: 1.0218, test_loss: 1.1428, test_f1: 0.4172
 epoch: 2, train_loss: 0.9702, test_loss: 1.2885, test_f1: 0.4519
 epoch: 3, train_loss: 0.9359, test_loss: 1.0271, test_f1: 0.5460
 epoch: 4, train_loss: 0.9359, test_loss: 1.0176, test_f1: 0.5482
 epoch: 5, train_loss: 0.8871, test_loss: 1.3307, test_f1: 0.4262
 epoch: 6, train_loss: 0.8823, test_loss: 1.0994, test_f1: 0.4712
 epoch: 7, train_loss: 0.8638, test_loss: 1.1196, test_f1: 0.4220
 epoch: 8, train_loss: 0.8642, test_loss: 1.2033, test_f1: 0.5476
 epoch: 9, train_loss: 0.8531, test_loss: 1.5747, test_f1: 0.5548
 epoch: 10, train_loss: 0.8384, test_loss: 1.0577, test_f1: 0.5665
 epoch: 11, train_loss: 0.8531, test_loss: 1.0694, test_f1: 0.4873
 epoch: 12, train_loss: 0.8290, test_loss: 1.0756, test_f1: 0.4847
 epoch: 13, train_loss: 0.8293, test_loss: 1.1126, test_f1: 0.5917
 epoch: 14, train_loss: 0.8480, test_loss: 1.0181, test_f1: 0.4317
 epoch: 15, train_loss: 0.8203, test_loss: 1.1200, test_f1: 0.5283
 epoch: 16, train_loss: 0.8278, test_loss: 1.0628, test_f1: 0.5915
 epoch: 17, train_loss: 0.8066, test_loss: 1.3741, test_f1: 0.5229
 epoch: 18, train_loss: 0.8121, test_loss: 1.4173, test_f1: 0.5102
 epoch: 19, train_loss: 0.7734, test_loss: 1.0134, test_f1: 0.4915
 epoch: 20, train_loss: 0.8089, test_loss: 0.9971, test_f1: 0.5241
 epoch: 21, train_loss: 0.8245, test_loss: 0.9351, test_f1: 0.4763
 epoch: 22, train_loss: 0.7878, test_loss: 1.0804, test_f1: 0.6143
 epoch: 23, train_loss: 0.7900, test_loss: 0.9949, test_f1: 0.5568
 epoch: 24, train_loss: 0.7870, test_loss: 1.1090, test_f1: 0.5108
 epoch: 25, train_loss: 0.7901, test_loss: 0.9681, test_f1: 0.5850
 epoch: 26, train_loss: 0.7632, test_loss: 1.1598, test_f1: 0.5168
 epoch: 27, train_loss: 0.7764, test_loss: 1.0499, test_f1: 0.5437
 epoch: 28, train_loss: 0.7748, test_loss: 1.0960, test_f1: 0.5015
 epoch: 29, train_loss: 0.7516, test_loss: 1.0427, test_f1: 0.5516
 epoch: 30, train_loss: 0.7431, test_loss: 1.0836, test_f1: 0.5410
 epoch: 31, train_loss: 0.7589, test_loss: 1.0378, test_f1: 0.5649
 epoch: 32, train_loss: 0.7596, test_loss: 1.0130, test_f1: 0.5807
 epoch: 33, train_loss: 0.7801, test_loss: 0.9657, test_f1: 0.5617
 epoch: 34, train_loss: 0.7835, test_loss: 1.2259, test_f1: 0.4896
 epoch: 35, train_loss: 0.7641, test_loss: 1.2243, test_f1: 0.5880
 epoch: 36, train_loss: 0.7303, test_loss: 1.0257, test_f1: 0.5686
 epoch: 37, train_loss: 0.7189, test_loss: 1.1131, test_f1: 0.5807
 epoch: 38, train_loss: 0.7537, test_loss: 0.9162, test_f1: 0.5922
 epoch: 39, train_loss: 0.7303, test_loss: 1.0133, test_f1: 0.4745
 epoch: 40, train_loss: 0.7271, test_loss: 1.1121, test_f1: 0.5716
 epoch: 41, train_loss: 0.7123, test_loss: 0.8732, test_f1: 0.6105
 epoch: 42, train_loss: 0.7367, test_loss: 1.3266, test_f1: 0.5615
 epoch: 43, train_loss: 0.7508, test_loss: 1.3969, test_f1: 0.4765
 epoch: 44, train_loss: 0.7311, test_loss: 1.0308, test_f1: 0.5573
 epoch: 45, train_loss: 0.7230, test_loss: 1.2443, test_f1: 0.5738
 epoch: 46, train_loss: 0.7095, test_loss: 1.3618, test_f1: 0.5647
 epoch: 47, train_loss: 0.7397, test_loss: 1.0919, test_f1: 0.4303
 epoch: 48, train_loss: 0.7184, test_loss: 1.3284, test_f1: 0.5837
 epoch: 49, train_loss: 0.7164, test_loss: 1.0537, test_f1: 0.6026
 epoch: 50, train_loss: 0.7255, test_loss: 1.2522, test_f1: 0.4438
 epoch: 51, train_loss: 0.7013, test_loss: 1.1273, test_f1: 0.5382
 epoch: 52, train_loss: 0.6824, test_loss: 0.9871, test_f1: 0.5997
 epoch: 53, train_loss: 0.6794, test_loss: 1.3038, test_f1: 0.6245
 epoch: 54, train_loss: 0.6859, test_loss: 1.3102, test_f1: 0.6002
 epoch: 55, train_loss: 0.6774, test_loss: 1.1474, test_f1: 0.5903
 epoch: 56, train_loss: 0.6654, test_loss: 1.2842, test_f1: 0.5623
 epoch: 57, train_loss: 0.6562, test_loss: 1.6582, test_f1: 0.5555
 epoch: 58, train_loss: 0.6597, test_loss: 1.5803, test_f1: 0.6021
 epoch: 59, train_loss: 0.6610, test_loss: 1.5135, test_f1: 0.6286
 epoch: 60, train_loss: 0.6405, test_loss: 1.4747, test_f1: 0.5555
 epoch: 61, train_loss: 0.6558, test_loss: 1.3518, test_f1: 0.5682
 epoch: 62, train_loss: 0.6357, test_loss: 1.4384, test_f1: 0.6082
 epoch: 63, train_loss: 0.6419, test_loss: 1.7189, test_f1: 0.5659
 epoch: 64, train_loss: 0.6387, test_loss: 1.5259, test_f1: 0.5827
 epoch: 65, train_loss: 0.6407, test_loss: 1.5040, test_f1: 0.5351
 epoch: 66, train_loss: 0.6384, test_loss: 1.1620, test_f1: 0.5904
 epoch: 67, train_loss: 0.6213, test_loss: 1.4484, test_f1: 0.5761
 epoch: 68, train_loss: 0.6320, test_loss: 1.9588, test_f1: 0.5702
 epoch: 69, train_loss: 0.6388, test_loss: 1.1841, test_f1: 0.5571
 epoch: 70, train_loss: 0.6415, test_loss: 1.1184, test_f1: 0.5933
 epoch: 71, train_loss: 0.6398, test_loss: 1.1309, test_f1: 0.6329
 epoch: 72, train_loss: 0.6262, test_loss: 1.8144, test_f1: 0.6079
 epoch: 73, train_loss: 0.6248, test_loss: 1.5802, test_f1: 0.6143
 epoch: 74, train_loss: 0.6456, test_loss: 1.3698, test_f1: 0.6021
 epoch: 75, train_loss: 0.6183, test_loss: 1.4825, test_f1: 0.5711
 epoch: 76, train_loss: 0.5966, test_loss: 1.5338, test_f1: 0.5786
 epoch: 77, train_loss: 0.6348, test_loss: 1.3687, test_f1: 0.5883
 epoch: 78, train_loss: 0.6272, test_loss: 1.5579, test_f1: 0.6284
 epoch: 79, train_loss: 0.6084, test_loss: 1.4567, test_f1: 0.5917
 epoch: 80, train_loss: 0.5957, test_loss: 1.4695, test_f1: 0.5956
 epoch: 81, train_loss: 0.6094, test_loss: 1.4540, test_f1: 0.5791
 epoch: 82, train_loss: 0.6046, test_loss: 1.1076, test_f1: 0.5984
 epoch: 83, train_loss: 0.6105, test_loss: 1.3283, test_f1: 0.6129
 epoch: 84, train_loss: 0.5967, test_loss: 1.4915, test_f1: 0.6175
 epoch: 85, train_loss: 0.5905, test_loss: 1.1228, test_f1: 0.6199
 epoch: 86, train_loss: 0.6086, test_loss: 1.2275, test_f1: 0.6207
 epoch: 87, train_loss: 0.6093, test_loss: 1.1868, test_f1: 0.6240
 epoch: 88, train_loss: 0.5956, test_loss: 1.3676, test_f1: 0.5849
 epoch: 89, train_loss: 0.5780, test_loss: 1.4761, test_f1: 0.5872
 epoch: 90, train_loss: 0.5776, test_loss: 1.5364, test_f1: 0.5837
 epoch: 91, train_loss: 0.5662, test_loss: 1.4800, test_f1: 0.5905
 epoch: 92, train_loss: 0.5623, test_loss: 1.5343, test_f1: 0.6099
 epoch: 93, train_loss: 0.5581, test_loss: 1.5097, test_f1: 0.6218
 epoch: 94, train_loss: 0.5858, test_loss: 1.4386, test_f1: 0.5682
 epoch: 95, train_loss: 0.6024, test_loss: 1.2164, test_f1: 0.6294
 epoch: 96, train_loss: 0.5898, test_loss: 1.6051, test_f1: 0.6123
 epoch: 97, train_loss: 0.5870, test_loss: 1.1732, test_f1: 0.6080
 epoch: 98, train_loss: 0.5556, test_loss: 1.3535, test_f1: 0.5937
 epoch: 99, train_loss: 0.5329, test_loss: 1.2577, test_f1: 0.6539
##################ITERATION #3 ****************************************
 epoch: 0, train_loss: 1.1799, test_loss: 1.1317, test_f1: 0.4710
 epoch: 1, train_loss: 1.0084, test_loss: 1.2198, test_f1: 0.4001
 epoch: 2, train_loss: 0.9597, test_loss: 1.0570, test_f1: 0.4668
 epoch: 3, train_loss: 0.9394, test_loss: 1.0174, test_f1: 0.4811
 epoch: 4, train_loss: 0.9374, test_loss: 1.0808, test_f1: 0.5195
 epoch: 5, train_loss: 0.9224, test_loss: 1.0619, test_f1: 0.4832
 epoch: 6, train_loss: 0.9307, test_loss: 1.1330, test_f1: 0.4410
 epoch: 7, train_loss: 0.8973, test_loss: 1.0807, test_f1: 0.5131
 epoch: 8, train_loss: 0.8978, test_loss: 1.0140, test_f1: 0.5548
 epoch: 9, train_loss: 0.8642, test_loss: 1.0423, test_f1: 0.4663
 epoch: 10, train_loss: 0.8730, test_loss: 1.0524, test_f1: 0.5471
 epoch: 11, train_loss: 0.8904, test_loss: 1.0051, test_f1: 0.5212
 epoch: 12, train_loss: 0.8372, test_loss: 1.0335, test_f1: 0.4833
 epoch: 13, train_loss: 0.8345, test_loss: 1.0467, test_f1: 0.4917
 epoch: 14, train_loss: 0.8382, test_loss: 1.2474, test_f1: 0.4986
 epoch: 15, train_loss: 0.8274, test_loss: 1.1714, test_f1: 0.5716
 epoch: 16, train_loss: 0.8096, test_loss: 1.0379, test_f1: 0.5491
 epoch: 17, train_loss: 0.8134, test_loss: 1.0172, test_f1: 0.5704
 epoch: 18, train_loss: 0.7971, test_loss: 1.0461, test_f1: 0.5880
 epoch: 19, train_loss: 0.8100, test_loss: 1.1644, test_f1: 0.4874
 epoch: 20, train_loss: 0.7841, test_loss: 0.9943, test_f1: 0.5407
 epoch: 21, train_loss: 0.7741, test_loss: 1.1862, test_f1: 0.4489
 epoch: 22, train_loss: 0.7809, test_loss: 1.5058, test_f1: 0.5047
 epoch: 23, train_loss: 0.8026, test_loss: 0.9780, test_f1: 0.5491
 epoch: 24, train_loss: 0.7633, test_loss: 0.9905, test_f1: 0.6074
 epoch: 25, train_loss: 0.7707, test_loss: 1.0363, test_f1: 0.5523
 epoch: 26, train_loss: 0.7446, test_loss: 1.1240, test_f1: 0.5989
 epoch: 27, train_loss: 0.7346, test_loss: 1.3887, test_f1: 0.6114
 epoch: 28, train_loss: 0.8132, test_loss: 0.9156, test_f1: 0.6351
 epoch: 29, train_loss: 0.7530, test_loss: 1.1312, test_f1: 0.6239
 epoch: 30, train_loss: 0.7599, test_loss: 1.0048, test_f1: 0.5853
 epoch: 31, train_loss: 0.7568, test_loss: 1.0998, test_f1: 0.6074
 epoch: 32, train_loss: 0.7319, test_loss: 1.0588, test_f1: 0.6035
 epoch: 33, train_loss: 0.7318, test_loss: 1.0620, test_f1: 0.5322
 epoch: 34, train_loss: 0.8202, test_loss: 0.9155, test_f1: 0.5803
 epoch: 35, train_loss: 0.7947, test_loss: 1.0633, test_f1: 0.4526
 epoch: 36, train_loss: 0.7659, test_loss: 0.9518, test_f1: 0.6055
 epoch: 37, train_loss: 0.7465, test_loss: 1.0308, test_f1: 0.5971
 epoch: 38, train_loss: 0.7270, test_loss: 1.1626, test_f1: 0.5596
 epoch: 39, train_loss: 0.7323, test_loss: 0.9723, test_f1: 0.6231
 epoch: 40, train_loss: 0.7098, test_loss: 0.9924, test_f1: 0.5793
 epoch: 41, train_loss: 0.7206, test_loss: 0.9313, test_f1: 0.5991
 epoch: 42, train_loss: 0.7435, test_loss: 1.0171, test_f1: 0.5660
 epoch: 43, train_loss: 0.7210, test_loss: 1.1030, test_f1: 0.6082
 epoch: 44, train_loss: 0.7115, test_loss: 1.0474, test_f1: 0.5387
 epoch: 45, train_loss: 0.7174, test_loss: 1.0848, test_f1: 0.5973
 epoch: 46, train_loss: 0.6865, test_loss: 0.9214, test_f1: 0.6127
 epoch: 47, train_loss: 0.7190, test_loss: 0.9634, test_f1: 0.5792
 epoch: 48, train_loss: 0.7125, test_loss: 1.0546, test_f1: 0.5387
 epoch: 49, train_loss: 0.7504, test_loss: 1.1439, test_f1: 0.4867
 epoch: 50, train_loss: 0.7136, test_loss: 1.2513, test_f1: 0.6003
 epoch: 51, train_loss: 0.7050, test_loss: 1.0112, test_f1: 0.5957
 epoch: 52, train_loss: 0.6643, test_loss: 1.0149, test_f1: 0.5740
 epoch: 53, train_loss: 0.6706, test_loss: 1.0493, test_f1: 0.6099
 epoch: 54, train_loss: 0.6668, test_loss: 1.0752, test_f1: 0.6057
 epoch: 55, train_loss: 0.6351, test_loss: 0.9967, test_f1: 0.6112
 epoch: 56, train_loss: 0.6444, test_loss: 1.0945, test_f1: 0.6163
 epoch: 57, train_loss: 0.6547, test_loss: 0.9862, test_f1: 0.5889
 epoch: 58, train_loss: 0.6317, test_loss: 1.3065, test_f1: 0.5827
 epoch: 59, train_loss: 0.6092, test_loss: 1.2950, test_f1: 0.5959
 epoch: 60, train_loss: 0.6384, test_loss: 1.1761, test_f1: 0.5749
 epoch: 61, train_loss: 0.6217, test_loss: 1.0190, test_f1: 0.6162
 epoch: 62, train_loss: 0.6329, test_loss: 1.2985, test_f1: 0.5689
 epoch: 63, train_loss: 0.6145, test_loss: 0.9551, test_f1: 0.6121
 epoch: 64, train_loss: 0.6137, test_loss: 1.1297, test_f1: 0.5740
 epoch: 65, train_loss: 0.6114, test_loss: 1.3059, test_f1: 0.5862
 epoch: 66, train_loss: 0.6119, test_loss: 2.1562, test_f1: 0.5918
 epoch: 67, train_loss: 0.6113, test_loss: 1.2264, test_f1: 0.6125
 epoch: 68, train_loss: 0.6148, test_loss: 1.2346, test_f1: 0.6098
 epoch: 69, train_loss: 0.6067, test_loss: 1.0611, test_f1: 0.6351
 epoch: 70, train_loss: 0.5996, test_loss: 1.3467, test_f1: 0.6567
 epoch: 71, train_loss: 0.5905, test_loss: 1.1425, test_f1: 0.6345
 epoch: 72, train_loss: 0.5880, test_loss: 1.3524, test_f1: 0.6242
 epoch: 73, train_loss: 0.6048, test_loss: 1.4911, test_f1: 0.5915
 epoch: 74, train_loss: 0.6141, test_loss: 1.0598, test_f1: 0.6311
 epoch: 75, train_loss: 0.5834, test_loss: 1.5678, test_f1: 0.5742
 epoch: 76, train_loss: 0.5562, test_loss: 1.1396, test_f1: 0.6201
 epoch: 77, train_loss: 0.5818, test_loss: 1.5236, test_f1: 0.6060
 epoch: 78, train_loss: 0.6041, test_loss: 1.4011, test_f1: 0.5504
 epoch: 79, train_loss: 0.5747, test_loss: 1.2725, test_f1: 0.5871
 epoch: 80, train_loss: 0.5653, test_loss: 1.3557, test_f1: 0.6291
 epoch: 81, train_loss: 0.5824, test_loss: 1.4193, test_f1: 0.5934
 epoch: 82, train_loss: 0.5558, test_loss: 1.4037, test_f1: 0.5902
 epoch: 83, train_loss: 0.5648, test_loss: 1.5901, test_f1: 0.6041
 epoch: 84, train_loss: 0.5540, test_loss: 1.4169, test_f1: 0.5985
 epoch: 85, train_loss: 0.5742, test_loss: 1.2945, test_f1: 0.6084
 epoch: 86, train_loss: 0.5871, test_loss: 1.3435, test_f1: 0.6191
 epoch: 87, train_loss: 0.5554, test_loss: 1.7044, test_f1: 0.5881
 epoch: 88, train_loss: 0.5551, test_loss: 1.5536, test_f1: 0.6176
 epoch: 89, train_loss: 0.5514, test_loss: 1.6418, test_f1: 0.5936
 epoch: 90, train_loss: 0.5490, test_loss: 1.2185, test_f1: 0.6190
 epoch: 91, train_loss: 0.5595, test_loss: 1.2341, test_f1: 0.5999
 epoch: 92, train_loss: 0.5405, test_loss: 1.5386, test_f1: 0.5839
 epoch: 93, train_loss: 0.5533, test_loss: 1.5864, test_f1: 0.5782
 epoch: 94, train_loss: 0.5257, test_loss: 1.4970, test_f1: 0.5974
 epoch: 95, train_loss: 0.5397, test_loss: 1.5068, test_f1: 0.5796
 epoch: 96, train_loss: 0.5571, test_loss: 1.6067, test_f1: 0.5738
 epoch: 97, train_loss: 0.5262, test_loss: 1.7513, test_f1: 0.5685
 epoch: 98, train_loss: 0.5585, test_loss: 1.4281, test_f1: 0.5942
 epoch: 99, train_loss: 0.5441, test_loss: 1.2449, test_f1: 0.6207
##################ITERATION #4 ****************************************
 epoch: 0, train_loss: 1.1282, test_loss: 1.2111, test_f1: 0.3610
 epoch: 1, train_loss: 0.9685, test_loss: 1.0778, test_f1: 0.4399
 epoch: 2, train_loss: 0.9172, test_loss: 1.0030, test_f1: 0.5469
 epoch: 3, train_loss: 0.8656, test_loss: 1.0478, test_f1: 0.5112
 epoch: 4, train_loss: 0.8753, test_loss: 1.0090, test_f1: 0.5851
 epoch: 5, train_loss: 0.8415, test_loss: 0.9501, test_f1: 0.5756
 epoch: 6, train_loss: 0.8560, test_loss: 1.0158, test_f1: 0.5434
 epoch: 7, train_loss: 0.8208, test_loss: 1.1479, test_f1: 0.4710
 epoch: 8, train_loss: 0.8227, test_loss: 2.9673, test_f1: 0.3723
 epoch: 9, train_loss: 0.8581, test_loss: 1.0494, test_f1: 0.4968
 epoch: 10, train_loss: 0.8460, test_loss: 2.0654, test_f1: 0.4837
 epoch: 11, train_loss: 0.8382, test_loss: 1.0330, test_f1: 0.5286
 epoch: 12, train_loss: 0.8096, test_loss: 1.0542, test_f1: 0.5558
 epoch: 13, train_loss: 0.8092, test_loss: 0.9950, test_f1: 0.5132
 epoch: 14, train_loss: 0.8379, test_loss: 1.2013, test_f1: 0.5096
 epoch: 15, train_loss: 0.8350, test_loss: 1.1104, test_f1: 0.4704
 epoch: 16, train_loss: 0.8037, test_loss: 1.0760, test_f1: 0.5240
 epoch: 17, train_loss: 0.7856, test_loss: 0.9661, test_f1: 0.6014
 epoch: 18, train_loss: 0.7842, test_loss: 0.9759, test_f1: 0.5477
 epoch: 19, train_loss: 0.7789, test_loss: 0.9883, test_f1: 0.5697
 epoch: 20, train_loss: 0.7821, test_loss: 0.9294, test_f1: 0.5703
 epoch: 21, train_loss: 0.7580, test_loss: 1.1522, test_f1: 0.5513
 epoch: 22, train_loss: 0.8074, test_loss: 0.9290, test_f1: 0.5961
 epoch: 23, train_loss: 0.7808, test_loss: 1.1580, test_f1: 0.5206
 epoch: 24, train_loss: 0.7893, test_loss: 1.1395, test_f1: 0.4327
 epoch: 25, train_loss: 0.7776, test_loss: 1.0640, test_f1: 0.5745
 epoch: 26, train_loss: 0.7423, test_loss: 1.0817, test_f1: 0.5734
 epoch: 27, train_loss: 0.7478, test_loss: 1.0387, test_f1: 0.5167
 epoch: 28, train_loss: 0.7598, test_loss: 1.0438, test_f1: 0.5300
 epoch: 29, train_loss: 0.7449, test_loss: 1.1214, test_f1: 0.4773
 epoch: 30, train_loss: 0.7809, test_loss: 0.9248, test_f1: 0.5876
 epoch: 31, train_loss: 0.7564, test_loss: 0.9899, test_f1: 0.5945
 epoch: 32, train_loss: 0.7530, test_loss: 0.9610, test_f1: 0.5548
 epoch: 33, train_loss: 0.7695, test_loss: 1.1942, test_f1: 0.5502
 epoch: 34, train_loss: 0.7692, test_loss: 1.0338, test_f1: 0.5852
 epoch: 35, train_loss: 0.8176, test_loss: 1.1831, test_f1: 0.5101
 epoch: 36, train_loss: 0.7728, test_loss: 0.9823, test_f1: 0.5479
 epoch: 37, train_loss: 0.7685, test_loss: 0.9631, test_f1: 0.5673
 epoch: 38, train_loss: 0.7533, test_loss: 6.8456, test_f1: 0.1273
 epoch: 39, train_loss: 1.1088, test_loss: 1.1153, test_f1: 0.3994
 epoch: 40, train_loss: 1.0234, test_loss: 1.0549, test_f1: 0.5265
 epoch: 41, train_loss: 0.9979, test_loss: 1.1480, test_f1: 0.4642
 epoch: 42, train_loss: 0.9872, test_loss: 1.0397, test_f1: 0.4489
 epoch: 43, train_loss: 0.9025, test_loss: 1.0469, test_f1: 0.5255
 epoch: 44, train_loss: 0.8652, test_loss: 1.0511, test_f1: 0.5474
 epoch: 45, train_loss: 0.8600, test_loss: 1.0407, test_f1: 0.5331
 epoch: 46, train_loss: 0.8438, test_loss: 1.0489, test_f1: 0.5310
 epoch: 47, train_loss: 0.8448, test_loss: 0.9222, test_f1: 0.5714
 epoch: 48, train_loss: 0.8222, test_loss: 0.9456, test_f1: 0.5883
 epoch: 49, train_loss: 0.8149, test_loss: 0.9806, test_f1: 0.5678
 epoch: 50, train_loss: 0.8306, test_loss: 0.9238, test_f1: 0.6026
 epoch: 51, train_loss: 0.7813, test_loss: 0.9336, test_f1: 0.6071
 epoch: 52, train_loss: 0.7611, test_loss: 0.9059, test_f1: 0.6152
 epoch: 53, train_loss: 0.7674, test_loss: 0.9438, test_f1: 0.5536
 epoch: 54, train_loss: 0.7617, test_loss: 0.9114, test_f1: 0.6122
 epoch: 55, train_loss: 0.7741, test_loss: 0.9594, test_f1: 0.5926
 epoch: 56, train_loss: 0.7562, test_loss: 0.9507, test_f1: 0.5926
 epoch: 57, train_loss: 0.7506, test_loss: 0.9254, test_f1: 0.6034
 epoch: 58, train_loss: 0.7378, test_loss: 0.9062, test_f1: 0.6121
 epoch: 59, train_loss: 0.7466, test_loss: 0.9469, test_f1: 0.5901
 epoch: 60, train_loss: 0.7360, test_loss: 1.0097, test_f1: 0.5630
 epoch: 61, train_loss: 0.7273, test_loss: 0.9265, test_f1: 0.6109
 epoch: 62, train_loss: 0.7228, test_loss: 0.9885, test_f1: 0.5732
 epoch: 63, train_loss: 0.7542, test_loss: 1.0244, test_f1: 0.5689
 epoch: 64, train_loss: 0.7360, test_loss: 0.9730, test_f1: 0.5879
 epoch: 65, train_loss: 0.7156, test_loss: 0.9657, test_f1: 0.5665
 epoch: 66, train_loss: 0.7413, test_loss: 0.9235, test_f1: 0.6309
 epoch: 67, train_loss: 0.7442, test_loss: 0.9757, test_f1: 0.5811
 epoch: 68, train_loss: 0.7496, test_loss: 0.9584, test_f1: 0.6061
 epoch: 69, train_loss: 0.7417, test_loss: 0.9392, test_f1: 0.5977
 epoch: 70, train_loss: 0.7213, test_loss: 1.0082, test_f1: 0.6044
 epoch: 71, train_loss: 0.7087, test_loss: 0.9935, test_f1: 0.5798
 epoch: 72, train_loss: 0.7138, test_loss: 0.9713, test_f1: 0.6292
 epoch: 73, train_loss: 0.7296, test_loss: 1.0056, test_f1: 0.6183
 epoch: 74, train_loss: 0.7185, test_loss: 1.0078, test_f1: 0.5884
 epoch: 75, train_loss: 0.6871, test_loss: 1.0071, test_f1: 0.6101
 epoch: 76, train_loss: 0.7027, test_loss: 0.9629, test_f1: 0.6012
 epoch: 77, train_loss: 0.7179, test_loss: 1.0195, test_f1: 0.5886
 epoch: 78, train_loss: 0.7025, test_loss: 0.9411, test_f1: 0.6104
 epoch: 79, train_loss: 0.7217, test_loss: 0.9076, test_f1: 0.6152
 epoch: 80, train_loss: 0.7205, test_loss: 0.9915, test_f1: 0.5990
 epoch: 81, train_loss: 0.7180, test_loss: 0.9646, test_f1: 0.6001
 epoch: 82, train_loss: 0.6908, test_loss: 1.0241, test_f1: 0.6220
 epoch: 83, train_loss: 0.6790, test_loss: 1.0036, test_f1: 0.6166
 epoch: 84, train_loss: 0.6861, test_loss: 0.9790, test_f1: 0.6187
 epoch: 85, train_loss: 0.6974, test_loss: 1.2477, test_f1: 0.5911
 epoch: 86, train_loss: 0.6856, test_loss: 1.0709, test_f1: 0.5921
 epoch: 87, train_loss: 0.6799, test_loss: 1.1348, test_f1: 0.5185
 epoch: 88, train_loss: 0.6665, test_loss: 0.9614, test_f1: 0.5986
 epoch: 89, train_loss: 0.6818, test_loss: 0.9850, test_f1: 0.6161
 epoch: 90, train_loss: 0.6866, test_loss: 1.2428, test_f1: 0.5358
 epoch: 91, train_loss: 0.6842, test_loss: 1.0279, test_f1: 0.5931
 epoch: 92, train_loss: 0.6745, test_loss: 1.0410, test_f1: 0.5418
 epoch: 93, train_loss: 0.7073, test_loss: 0.9792, test_f1: 0.5875
 epoch: 94, train_loss: 0.6779, test_loss: 0.9737, test_f1: 0.5694
 epoch: 95, train_loss: 0.6726, test_loss: 0.9498, test_f1: 0.6115
 epoch: 96, train_loss: 0.6917, test_loss: 0.9253, test_f1: 0.6220
 epoch: 97, train_loss: 0.6814, test_loss: 0.9676, test_f1: 0.5741
 epoch: 98, train_loss: 0.6795, test_loss: 0.9398, test_f1: 0.6167
 epoch: 99, train_loss: 0.6731, test_loss: 0.9808, test_f1: 0.6178
##################ITERATION #5 ****************************************
 epoch: 0, train_loss: 1.1518, test_loss: 1.1935, test_f1: 0.2912
 epoch: 1, train_loss: 0.9862, test_loss: 1.0094, test_f1: 0.5379
 epoch: 2, train_loss: 0.9410, test_loss: 1.0628, test_f1: 0.4961
 epoch: 3, train_loss: 0.9137, test_loss: 1.0707, test_f1: 0.5610
 epoch: 4, train_loss: 0.8712, test_loss: 0.9963, test_f1: 0.5024
 epoch: 5, train_loss: 0.8666, test_loss: 1.0396, test_f1: 0.5211
 epoch: 6, train_loss: 0.8550, test_loss: 0.9758, test_f1: 0.5489
 epoch: 7, train_loss: 0.8157, test_loss: 1.1815, test_f1: 0.4557
 epoch: 8, train_loss: 0.8285, test_loss: 1.0216, test_f1: 0.5419
 epoch: 9, train_loss: 0.8374, test_loss: 1.1562, test_f1: 0.5003
 epoch: 10, train_loss: 0.8199, test_loss: 1.2261, test_f1: 0.5280
 epoch: 11, train_loss: 0.8249, test_loss: 1.0313, test_f1: 0.5291
 epoch: 12, train_loss: 0.8019, test_loss: 0.9270, test_f1: 0.6065
 epoch: 13, train_loss: 0.7916, test_loss: 0.9839, test_f1: 0.5006
 epoch: 14, train_loss: 0.7758, test_loss: 1.2038, test_f1: 0.5425
 epoch: 15, train_loss: 0.7715, test_loss: 1.1596, test_f1: 0.5472
 epoch: 16, train_loss: 0.7593, test_loss: 1.1618, test_f1: 0.5308
 epoch: 17, train_loss: 0.7781, test_loss: 0.9949, test_f1: 0.5986
 epoch: 18, train_loss: 0.7672, test_loss: 1.1107, test_f1: 0.5678
 epoch: 19, train_loss: 0.8094, test_loss: 1.1047, test_f1: 0.5045
 epoch: 20, train_loss: 0.7454, test_loss: 0.9547, test_f1: 0.6167
 epoch: 21, train_loss: 0.7522, test_loss: 1.2360, test_f1: 0.5914
 epoch: 22, train_loss: 0.7531, test_loss: 1.0188, test_f1: 0.5882
 epoch: 23, train_loss: 0.7602, test_loss: 1.0214, test_f1: 0.5344
 epoch: 24, train_loss: 0.7201, test_loss: 1.0239, test_f1: 0.5686
 epoch: 25, train_loss: 0.7669, test_loss: 1.5257, test_f1: 0.4776
 epoch: 26, train_loss: 0.7848, test_loss: 1.0744, test_f1: 0.5805
 epoch: 27, train_loss: 0.7303, test_loss: 1.0779, test_f1: 0.5648
 epoch: 28, train_loss: 0.7453, test_loss: 1.0740, test_f1: 0.5364
 epoch: 29, train_loss: 0.7658, test_loss: 1.0645, test_f1: 0.5954
 epoch: 30, train_loss: 0.7204, test_loss: 1.1303, test_f1: 0.5973
 epoch: 31, train_loss: 0.7467, test_loss: 1.2249, test_f1: 0.5291
 epoch: 32, train_loss: 0.7121, test_loss: 1.1345, test_f1: 0.5890
 epoch: 33, train_loss: 0.7168, test_loss: 1.2076, test_f1: 0.5795
 epoch: 34, train_loss: 0.7265, test_loss: 1.1182, test_f1: 0.5935
 epoch: 35, train_loss: 0.7233, test_loss: 1.1467, test_f1: 0.5898
 epoch: 36, train_loss: 0.7293, test_loss: 1.0859, test_f1: 0.5720
 epoch: 37, train_loss: 0.7268, test_loss: 0.9609, test_f1: 0.6098
 epoch: 38, train_loss: 0.6993, test_loss: 1.4032, test_f1: 0.5123
 epoch: 39, train_loss: 0.7010, test_loss: 1.0479, test_f1: 0.5996
 epoch: 40, train_loss: 0.6797, test_loss: 1.0789, test_f1: 0.6350
 epoch: 41, train_loss: 0.6843, test_loss: 1.0860, test_f1: 0.6044
 epoch: 42, train_loss: 0.6801, test_loss: 1.1217, test_f1: 0.5429
 epoch: 43, train_loss: 0.6796, test_loss: 0.9604, test_f1: 0.6099
 epoch: 44, train_loss: 0.6765, test_loss: 1.2243, test_f1: 0.5644
 epoch: 45, train_loss: 0.6931, test_loss: 1.0326, test_f1: 0.5952
 epoch: 46, train_loss: 0.6944, test_loss: 1.0537, test_f1: 0.5957
 epoch: 47, train_loss: 0.6814, test_loss: 1.2805, test_f1: 0.5705
 epoch: 48, train_loss: 0.6649, test_loss: 1.0907, test_f1: 0.5824
 epoch: 49, train_loss: 0.6619, test_loss: 1.1941, test_f1: 0.6071
 epoch: 50, train_loss: 0.6343, test_loss: 1.3716, test_f1: 0.5552
 epoch: 51, train_loss: 0.6307, test_loss: 1.2259, test_f1: 0.6346
 epoch: 52, train_loss: 0.6153, test_loss: 1.2558, test_f1: 0.6453
 epoch: 53, train_loss: 0.6281, test_loss: 1.1320, test_f1: 0.6257
 epoch: 54, train_loss: 0.6042, test_loss: 1.1709, test_f1: 0.6559
 epoch: 55, train_loss: 0.5994, test_loss: 1.1864, test_f1: 0.6390
 epoch: 56, train_loss: 0.5747, test_loss: 1.3056, test_f1: 0.6427
 epoch: 57, train_loss: 0.5941, test_loss: 1.2134, test_f1: 0.6244
 epoch: 58, train_loss: 0.5918, test_loss: 1.4277, test_f1: 0.6207
 epoch: 59, train_loss: 0.5719, test_loss: 1.3241, test_f1: 0.6246
 epoch: 60, train_loss: 0.5537, test_loss: 1.1407, test_f1: 0.6108
 epoch: 61, train_loss: 0.5450, test_loss: 1.7998, test_f1: 0.6055
 epoch: 62, train_loss: 0.5613, test_loss: 1.4631, test_f1: 0.5810
 epoch: 63, train_loss: 0.5620, test_loss: 1.3086, test_f1: 0.6317
 epoch: 64, train_loss: 0.5518, test_loss: 1.2331, test_f1: 0.5844
 epoch: 65, train_loss: 0.5552, test_loss: 1.6277, test_f1: 0.6009
 epoch: 66, train_loss: 0.5548, test_loss: 1.4482, test_f1: 0.6121
 epoch: 67, train_loss: 0.6064, test_loss: 1.4934, test_f1: 0.6075
 epoch: 68, train_loss: 0.5882, test_loss: 1.4184, test_f1: 0.6330
 epoch: 69, train_loss: 0.5324, test_loss: 1.2687, test_f1: 0.5967
 epoch: 70, train_loss: 0.5427, test_loss: 1.1758, test_f1: 0.6202
 epoch: 71, train_loss: 0.5500, test_loss: 1.2912, test_f1: 0.5797
 epoch: 72, train_loss: 0.5362, test_loss: 1.4957, test_f1: 0.6143
 epoch: 73, train_loss: 0.5380, test_loss: 1.8272, test_f1: 0.5821
 epoch: 74, train_loss: 0.5324, test_loss: 1.1632, test_f1: 0.6600
 epoch: 75, train_loss: 0.4941, test_loss: 1.6695, test_f1: 0.5947
 epoch: 76, train_loss: 0.4878, test_loss: 1.2580, test_f1: 0.6694
 epoch: 77, train_loss: 0.4971, test_loss: 1.3223, test_f1: 0.6337
 epoch: 78, train_loss: 0.5264, test_loss: 1.5269, test_f1: 0.5830
 epoch: 79, train_loss: 0.5009, test_loss: 1.3341, test_f1: 0.6015
 epoch: 80, train_loss: 0.5179, test_loss: 2.3710, test_f1: 0.5248
 epoch: 81, train_loss: 0.4981, test_loss: 1.4218, test_f1: 0.6207
 epoch: 82, train_loss: 0.5094, test_loss: 1.8825, test_f1: 0.6136
 epoch: 83, train_loss: 0.5281, test_loss: 1.6440, test_f1: 0.5911
 epoch: 84, train_loss: 0.4700, test_loss: 1.5926, test_f1: 0.6349
 epoch: 85, train_loss: 0.4735, test_loss: 1.3395, test_f1: 0.5931
 epoch: 86, train_loss: 0.4845, test_loss: 1.7344, test_f1: 0.6115
 epoch: 87, train_loss: 0.5077, test_loss: 1.5294, test_f1: 0.6087
 epoch: 88, train_loss: 0.5508, test_loss: 1.6635, test_f1: 0.6163
 epoch: 89, train_loss: 0.5531, test_loss: 1.5384, test_f1: 0.5868
 epoch: 90, train_loss: 0.4692, test_loss: 1.7727, test_f1: 0.5990
 epoch: 91, train_loss: 0.5076, test_loss: 1.8644, test_f1: 0.6195
 epoch: 92, train_loss: 0.4747, test_loss: 1.4518, test_f1: 0.6207
 epoch: 93, train_loss: 0.4454, test_loss: 2.0269, test_f1: 0.5400
 epoch: 94, train_loss: 0.4596, test_loss: 1.8107, test_f1: 0.5564
 epoch: 95, train_loss: 0.4703, test_loss: 1.9492, test_f1: 0.5806
 epoch: 96, train_loss: 0.4566, test_loss: 1.9129, test_f1: 0.5845
 epoch: 97, train_loss: 0.4618, test_loss: 1.6202, test_f1: 0.5863
 epoch: 98, train_loss: 0.4761, test_loss: 2.2288, test_f1: 0.5462
 epoch: 99, train_loss: 0.4427, test_loss: 1.9257, test_f1: 0.5978
##################ITERATION #6 ****************************************
 epoch: 0, train_loss: 1.1890, test_loss: 1.1550, test_f1: 0.4295
 epoch: 1, train_loss: 0.9778, test_loss: 1.0082, test_f1: 0.5445
 epoch: 2, train_loss: 0.9342, test_loss: 0.9549, test_f1: 0.5381
 epoch: 3, train_loss: 0.9078, test_loss: 1.0200, test_f1: 0.5533
 epoch: 4, train_loss: 0.8699, test_loss: 1.0252, test_f1: 0.5225
 epoch: 5, train_loss: 0.8863, test_loss: 1.0002, test_f1: 0.5542
 epoch: 6, train_loss: 0.8518, test_loss: 1.0157, test_f1: 0.5790
 epoch: 7, train_loss: 0.8416, test_loss: 1.1208, test_f1: 0.4977
 epoch: 8, train_loss: 0.8561, test_loss: 0.9327, test_f1: 0.5151
 epoch: 9, train_loss: 0.8171, test_loss: 1.0277, test_f1: 0.5043
 epoch: 10, train_loss: 0.8148, test_loss: 1.0364, test_f1: 0.5318
 epoch: 11, train_loss: 0.8154, test_loss: 1.0908, test_f1: 0.5228
 epoch: 12, train_loss: 0.8023, test_loss: 1.0789, test_f1: 0.5116
 epoch: 13, train_loss: 0.8045, test_loss: 1.0092, test_f1: 0.5388
 epoch: 14, train_loss: 0.7999, test_loss: 0.9890, test_f1: 0.5784
 epoch: 15, train_loss: 0.7861, test_loss: 0.9270, test_f1: 0.6061
 epoch: 16, train_loss: 0.7716, test_loss: 0.9111, test_f1: 0.6250
 epoch: 17, train_loss: 0.8003, test_loss: 1.2625, test_f1: 0.4825
 epoch: 18, train_loss: 0.7970, test_loss: 1.0001, test_f1: 0.5404
 epoch: 19, train_loss: 0.7652, test_loss: 0.9771, test_f1: 0.6315
 epoch: 20, train_loss: 0.8064, test_loss: 0.9478, test_f1: 0.6124
 epoch: 21, train_loss: 0.7774, test_loss: 1.0573, test_f1: 0.5499
 epoch: 22, train_loss: 0.7687, test_loss: 0.9542, test_f1: 0.5981
 epoch: 23, train_loss: 0.8045, test_loss: 0.9781, test_f1: 0.5958
 epoch: 24, train_loss: 0.7666, test_loss: 1.3115, test_f1: 0.4392
 epoch: 25, train_loss: 0.7682, test_loss: 1.0620, test_f1: 0.5803
 epoch: 26, train_loss: 0.7541, test_loss: 1.0330, test_f1: 0.6033
 epoch: 27, train_loss: 0.7676, test_loss: 0.8852, test_f1: 0.6171
 epoch: 28, train_loss: 0.7620, test_loss: 1.1127, test_f1: 0.5692
 epoch: 29, train_loss: 0.7447, test_loss: 1.0943, test_f1: 0.5981
 epoch: 30, train_loss: 0.7321, test_loss: 1.2885, test_f1: 0.5570
 epoch: 31, train_loss: 0.7430, test_loss: 1.2954, test_f1: 0.5563
 epoch: 32, train_loss: 0.7242, test_loss: 0.9930, test_f1: 0.6107
 epoch: 33, train_loss: 0.7467, test_loss: 1.0101, test_f1: 0.6053
 epoch: 34, train_loss: 0.7295, test_loss: 1.1066, test_f1: 0.6138
 epoch: 35, train_loss: 0.7113, test_loss: 1.0069, test_f1: 0.6287
 epoch: 36, train_loss: 0.7039, test_loss: 1.0850, test_f1: 0.6178
 epoch: 37, train_loss: 0.7188, test_loss: 1.2624, test_f1: 0.5147
 epoch: 38, train_loss: 0.7145, test_loss: 1.2883, test_f1: 0.6392
 epoch: 39, train_loss: 0.6886, test_loss: 0.9045, test_f1: 0.6927
 epoch: 40, train_loss: 0.7153, test_loss: 1.5183, test_f1: 0.5643
 epoch: 41, train_loss: 0.7985, test_loss: 0.9768, test_f1: 0.6733
 epoch: 42, train_loss: 0.7269, test_loss: 0.9986, test_f1: 0.6209
 epoch: 43, train_loss: 0.7323, test_loss: 1.0461, test_f1: 0.6632
 epoch: 44, train_loss: 0.7176, test_loss: 0.9284, test_f1: 0.6823
 epoch: 45, train_loss: 0.6991, test_loss: 1.0639, test_f1: 0.6304
 epoch: 46, train_loss: 0.7080, test_loss: 1.0515, test_f1: 0.6330
 epoch: 47, train_loss: 0.7154, test_loss: 1.0847, test_f1: 0.5396
 epoch: 48, train_loss: 0.6926, test_loss: 1.0020, test_f1: 0.6474
 epoch: 49, train_loss: 0.6904, test_loss: 1.0988, test_f1: 0.6104
 epoch: 50, train_loss: 0.7077, test_loss: 1.2240, test_f1: 0.5989
 epoch: 51, train_loss: 0.6729, test_loss: 1.0492, test_f1: 0.5946
 epoch: 52, train_loss: 0.6491, test_loss: 1.0896, test_f1: 0.6225
 epoch: 53, train_loss: 0.6463, test_loss: 1.1978, test_f1: 0.5990
 epoch: 54, train_loss: 0.6401, test_loss: 1.4740, test_f1: 0.5513
 epoch: 55, train_loss: 0.6650, test_loss: 1.2241, test_f1: 0.6248
 epoch: 56, train_loss: 0.6369, test_loss: 1.2101, test_f1: 0.6141
 epoch: 57, train_loss: 0.6106, test_loss: 1.1293, test_f1: 0.5804
 epoch: 58, train_loss: 0.5909, test_loss: 1.4225, test_f1: 0.6127
 epoch: 59, train_loss: 0.5880, test_loss: 1.5462, test_f1: 0.6066
 epoch: 60, train_loss: 0.6254, test_loss: 1.3230, test_f1: 0.6269
 epoch: 61, train_loss: 0.6087, test_loss: 1.3620, test_f1: 0.5721
 epoch: 62, train_loss: 0.5853, test_loss: 1.5601, test_f1: 0.5877
 epoch: 63, train_loss: 0.5896, test_loss: 1.4167, test_f1: 0.6035
 epoch: 64, train_loss: 0.6041, test_loss: 1.4845, test_f1: 0.6277
 epoch: 65, train_loss: 0.5894, test_loss: 1.4521, test_f1: 0.6277
 epoch: 66, train_loss: 0.5986, test_loss: 1.5598, test_f1: 0.6036
 epoch: 67, train_loss: 0.5747, test_loss: 1.6381, test_f1: 0.5966
 epoch: 68, train_loss: 0.6072, test_loss: 1.5741, test_f1: 0.6310
 epoch: 69, train_loss: 0.5882, test_loss: 1.4698, test_f1: 0.6043
 epoch: 70, train_loss: 0.5597, test_loss: 1.6047, test_f1: 0.5891
 epoch: 71, train_loss: 0.5706, test_loss: 1.5031, test_f1: 0.6088
 epoch: 72, train_loss: 0.6055, test_loss: 1.3050, test_f1: 0.6231
 epoch: 73, train_loss: 0.5703, test_loss: 1.2426, test_f1: 0.6719
 epoch: 74, train_loss: 0.5699, test_loss: 1.4211, test_f1: 0.6050
 epoch: 75, train_loss: 0.5799, test_loss: 1.1409, test_f1: 0.6249
 epoch: 76, train_loss: 0.5459, test_loss: 1.3830, test_f1: 0.6052
 epoch: 77, train_loss: 0.5430, test_loss: 1.5945, test_f1: 0.5951
 epoch: 78, train_loss: 0.5503, test_loss: 1.9676, test_f1: 0.6099
 epoch: 79, train_loss: 0.5655, test_loss: 1.5503, test_f1: 0.5838
 epoch: 80, train_loss: 0.5658, test_loss: 1.4078, test_f1: 0.6330
 epoch: 81, train_loss: 0.5504, test_loss: 1.3651, test_f1: 0.6187
 epoch: 82, train_loss: 0.5456, test_loss: 1.4382, test_f1: 0.5943
 epoch: 83, train_loss: 0.5198, test_loss: 1.4560, test_f1: 0.6244
 epoch: 84, train_loss: 0.5276, test_loss: 1.8263, test_f1: 0.6192
 epoch: 85, train_loss: 0.5358, test_loss: 1.1228, test_f1: 0.6816
 epoch: 86, train_loss: 0.5379, test_loss: 1.6780, test_f1: 0.5788
 epoch: 87, train_loss: 0.5186, test_loss: 1.2635, test_f1: 0.6383
 epoch: 88, train_loss: 0.4980, test_loss: 1.6107, test_f1: 0.5716
 epoch: 89, train_loss: 0.5293, test_loss: 1.6741, test_f1: 0.6359
 epoch: 90, train_loss: 0.5137, test_loss: 1.2638, test_f1: 0.6359
 epoch: 91, train_loss: 0.5082, test_loss: 1.5075, test_f1: 0.5845
 epoch: 92, train_loss: 0.5216, test_loss: 1.3712, test_f1: 0.6130
 epoch: 93, train_loss: 0.5261, test_loss: 1.5163, test_f1: 0.6383
 epoch: 94, train_loss: 0.4938, test_loss: 1.6734, test_f1: 0.6096
 epoch: 95, train_loss: 0.5135, test_loss: 1.4988, test_f1: 0.6366
 epoch: 96, train_loss: 0.5182, test_loss: 1.3249, test_f1: 0.6245
 epoch: 97, train_loss: 0.5233, test_loss: 2.1779, test_f1: 0.5926
 epoch: 98, train_loss: 0.5388, test_loss: 1.2950, test_f1: 0.6133
 epoch: 99, train_loss: 0.5068, test_loss: 1.3709, test_f1: 0.5798
##################ITERATION #7 ****************************************
 epoch: 0, train_loss: 1.1480, test_loss: 1.1446, test_f1: 0.4657
 epoch: 1, train_loss: 0.9353, test_loss: 1.0593, test_f1: 0.4624
 epoch: 2, train_loss: 0.8821, test_loss: 1.0164, test_f1: 0.5057
 epoch: 3, train_loss: 0.8677, test_loss: 1.0174, test_f1: 0.5568
 epoch: 4, train_loss: 0.8678, test_loss: 1.1514, test_f1: 0.4616
 epoch: 5, train_loss: 0.8405, test_loss: 0.9629, test_f1: 0.5811
 epoch: 6, train_loss: 0.8621, test_loss: 1.0284, test_f1: 0.5656
 epoch: 7, train_loss: 0.8602, test_loss: 0.9944, test_f1: 0.5570
 epoch: 8, train_loss: 0.8273, test_loss: 1.1122, test_f1: 0.5251
 epoch: 9, train_loss: 0.8232, test_loss: 0.9991, test_f1: 0.5643
 epoch: 10, train_loss: 0.8387, test_loss: 1.0198, test_f1: 0.5394
 epoch: 11, train_loss: 0.8116, test_loss: 0.9467, test_f1: 0.6061
 epoch: 12, train_loss: 0.8132, test_loss: 1.0721, test_f1: 0.5643
 epoch: 13, train_loss: 0.8090, test_loss: 0.9866, test_f1: 0.5471
 epoch: 14, train_loss: 0.8096, test_loss: 1.0166, test_f1: 0.5666
 epoch: 15, train_loss: 0.7786, test_loss: 0.9301, test_f1: 0.6243
 epoch: 16, train_loss: 0.7906, test_loss: 1.0637, test_f1: 0.5578
 epoch: 17, train_loss: 0.7549, test_loss: 1.0176, test_f1: 0.5618
 epoch: 18, train_loss: 0.7670, test_loss: 1.0208, test_f1: 0.5722
 epoch: 19, train_loss: 0.7752, test_loss: 1.0416, test_f1: 0.5550
 epoch: 20, train_loss: 0.7615, test_loss: 1.0556, test_f1: 0.5249
 epoch: 21, train_loss: 0.7859, test_loss: 1.0034, test_f1: 0.5687
 epoch: 22, train_loss: 0.7901, test_loss: 0.9405, test_f1: 0.5983
 epoch: 23, train_loss: 0.7897, test_loss: 1.0462, test_f1: 0.5366
 epoch: 24, train_loss: 0.7630, test_loss: 1.1728, test_f1: 0.5536
 epoch: 25, train_loss: 0.7408, test_loss: 1.6281, test_f1: 0.5079
 epoch: 26, train_loss: 0.7616, test_loss: 0.9898, test_f1: 0.6070
 epoch: 27, train_loss: 0.7579, test_loss: 1.1594, test_f1: 0.5831
 epoch: 28, train_loss: 0.8069, test_loss: 1.0458, test_f1: 0.5659
 epoch: 29, train_loss: 0.7562, test_loss: 0.9481, test_f1: 0.6253
 epoch: 30, train_loss: 0.7517, test_loss: 1.1090, test_f1: 0.5563
 epoch: 31, train_loss: 0.7702, test_loss: 1.0113, test_f1: 0.5957
 epoch: 32, train_loss: 0.7703, test_loss: 1.0267, test_f1: 0.5922
 epoch: 33, train_loss: 0.7503, test_loss: 1.1458, test_f1: 0.5952
 epoch: 34, train_loss: 0.7459, test_loss: 1.1130, test_f1: 0.5509
 epoch: 35, train_loss: 0.7118, test_loss: 1.1763, test_f1: 0.5868
 epoch: 36, train_loss: 0.7099, test_loss: 1.3157, test_f1: 0.4865
 epoch: 37, train_loss: 0.7645, test_loss: 1.1284, test_f1: 0.5771
 epoch: 38, train_loss: 0.7582, test_loss: 1.0529, test_f1: 0.5908
 epoch: 39, train_loss: 0.7287, test_loss: 1.1449, test_f1: 0.5727
 epoch: 40, train_loss: 0.7179, test_loss: 1.1685, test_f1: 0.6134
 epoch: 41, train_loss: 0.7099, test_loss: 1.0144, test_f1: 0.6045
 epoch: 42, train_loss: 0.7371, test_loss: 1.0282, test_f1: 0.6044
 epoch: 43, train_loss: 0.7016, test_loss: 1.5361, test_f1: 0.5685
 epoch: 44, train_loss: 0.7250, test_loss: 1.1399, test_f1: 0.5747
 epoch: 45, train_loss: 0.7422, test_loss: 1.0521, test_f1: 0.5573
 epoch: 46, train_loss: 0.6989, test_loss: 1.1541, test_f1: 0.5908
 epoch: 47, train_loss: 0.7049, test_loss: 1.1232, test_f1: 0.5992
 epoch: 48, train_loss: 0.7101, test_loss: 1.3886, test_f1: 0.5460
 epoch: 49, train_loss: 0.6830, test_loss: 1.5048, test_f1: 0.5661
 epoch: 50, train_loss: 0.6807, test_loss: 1.0269, test_f1: 0.6064
 epoch: 51, train_loss: 0.6799, test_loss: 1.1861, test_f1: 0.6162
 epoch: 52, train_loss: 0.6508, test_loss: 1.2435, test_f1: 0.6149
 epoch: 53, train_loss: 0.6726, test_loss: 1.2295, test_f1: 0.5453
 epoch: 54, train_loss: 0.6423, test_loss: 1.2298, test_f1: 0.5985
 epoch: 55, train_loss: 0.6409, test_loss: 1.4309, test_f1: 0.6109
 epoch: 56, train_loss: 0.6447, test_loss: 1.3630, test_f1: 0.5814
 epoch: 57, train_loss: 0.6574, test_loss: 1.2356, test_f1: 0.6078
 epoch: 58, train_loss: 0.6364, test_loss: 1.3601, test_f1: 0.6056
 epoch: 59, train_loss: 0.6540, test_loss: 1.3092, test_f1: 0.5903
 epoch: 60, train_loss: 0.6373, test_loss: 1.3487, test_f1: 0.6083
 epoch: 61, train_loss: 0.6272, test_loss: 1.4135, test_f1: 0.6320
 epoch: 62, train_loss: 0.6349, test_loss: 1.3165, test_f1: 0.6001
 epoch: 63, train_loss: 0.6455, test_loss: 1.0830, test_f1: 0.5967
 epoch: 64, train_loss: 0.6700, test_loss: 1.0403, test_f1: 0.6248
 epoch: 65, train_loss: 0.6561, test_loss: 1.1641, test_f1: 0.6134
 epoch: 66, train_loss: 0.6285, test_loss: 1.5082, test_f1: 0.5938
 epoch: 67, train_loss: 0.6587, test_loss: 1.3021, test_f1: 0.6132
 epoch: 68, train_loss: 0.6322, test_loss: 1.4490, test_f1: 0.5495
 epoch: 69, train_loss: 0.6154, test_loss: 1.4705, test_f1: 0.6021
 epoch: 70, train_loss: 0.6318, test_loss: 1.1869, test_f1: 0.5894
 epoch: 71, train_loss: 0.6281, test_loss: 1.3878, test_f1: 0.5659
 epoch: 72, train_loss: 0.6143, test_loss: 1.2218, test_f1: 0.6302
 epoch: 73, train_loss: 0.6175, test_loss: 1.1983, test_f1: 0.6235
 epoch: 74, train_loss: 0.6211, test_loss: 1.2952, test_f1: 0.5917
 epoch: 75, train_loss: 0.6240, test_loss: 1.6798, test_f1: 0.5687
 epoch: 76, train_loss: 0.6176, test_loss: 1.3014, test_f1: 0.6385
 epoch: 77, train_loss: 0.6249, test_loss: 1.3523, test_f1: 0.6091
 epoch: 78, train_loss: 0.6182, test_loss: 1.2911, test_f1: 0.6079
 epoch: 79, train_loss: 0.6098, test_loss: 1.2200, test_f1: 0.6218
 epoch: 80, train_loss: 0.6067, test_loss: 1.3686, test_f1: 0.6188
 epoch: 81, train_loss: 0.6054, test_loss: 1.3781, test_f1: 0.6070
 epoch: 82, train_loss: 0.6128, test_loss: 1.5411, test_f1: 0.5761
 epoch: 83, train_loss: 0.6017, test_loss: 1.2952, test_f1: 0.6174
 epoch: 84, train_loss: 0.6069, test_loss: 1.3252, test_f1: 0.5995
 epoch: 85, train_loss: 0.5982, test_loss: 1.2957, test_f1: 0.5896
 epoch: 86, train_loss: 0.6053, test_loss: 1.5336, test_f1: 0.5658
 epoch: 87, train_loss: 0.6348, test_loss: 1.2656, test_f1: 0.6209
 epoch: 88, train_loss: 0.6013, test_loss: 1.2834, test_f1: 0.6045
 epoch: 89, train_loss: 0.5964, test_loss: 1.2626, test_f1: 0.5974
 epoch: 90, train_loss: 0.5816, test_loss: 1.2604, test_f1: 0.6307
 epoch: 91, train_loss: 0.6119, test_loss: 1.2385, test_f1: 0.6248
 epoch: 92, train_loss: 0.5902, test_loss: 1.3898, test_f1: 0.6404
 epoch: 93, train_loss: 0.5877, test_loss: 1.4242, test_f1: 0.6115
 epoch: 94, train_loss: 0.5725, test_loss: 1.8477, test_f1: 0.6101
 epoch: 95, train_loss: 0.5950, test_loss: 1.4418, test_f1: 0.5864
 epoch: 96, train_loss: 0.5817, test_loss: 1.4718, test_f1: 0.5889
 epoch: 97, train_loss: 0.5853, test_loss: 1.2937, test_f1: 0.6277
 epoch: 98, train_loss: 0.5756, test_loss: 1.4404, test_f1: 0.6312
 epoch: 99, train_loss: 0.5785, test_loss: 1.3622, test_f1: 0.6230
##################ITERATION #8 ****************************************
 epoch: 0, train_loss: 1.2238, test_loss: 1.1336, test_f1: 0.4408
 epoch: 1, train_loss: 1.0564, test_loss: 1.0359, test_f1: 0.4609
 epoch: 2, train_loss: 0.9757, test_loss: 0.9979, test_f1: 0.5613
 epoch: 3, train_loss: 0.9215, test_loss: 1.0289, test_f1: 0.5525
 epoch: 4, train_loss: 0.9137, test_loss: 0.9988, test_f1: 0.5055
 epoch: 5, train_loss: 0.8952, test_loss: 1.0793, test_f1: 0.5043
 epoch: 6, train_loss: 0.8861, test_loss: 1.6505, test_f1: 0.3477
 epoch: 7, train_loss: 0.8446, test_loss: 1.0686, test_f1: 0.5259
 epoch: 8, train_loss: 0.8417, test_loss: 0.9841, test_f1: 0.5748
 epoch: 9, train_loss: 0.8655, test_loss: 1.1977, test_f1: 0.5427
 epoch: 10, train_loss: 0.8317, test_loss: 1.1136, test_f1: 0.5433
 epoch: 11, train_loss: 0.8863, test_loss: 0.9785, test_f1: 0.5845
 epoch: 12, train_loss: 0.8278, test_loss: 1.0734, test_f1: 0.5774
 epoch: 13, train_loss: 0.8517, test_loss: 0.9196, test_f1: 0.5900
 epoch: 14, train_loss: 0.8019, test_loss: 1.3303, test_f1: 0.5294
 epoch: 15, train_loss: 0.7932, test_loss: 1.0883, test_f1: 0.5641
 epoch: 16, train_loss: 0.7999, test_loss: 1.1899, test_f1: 0.5335
 epoch: 17, train_loss: 0.8340, test_loss: 1.1965, test_f1: 0.5264
 epoch: 18, train_loss: 0.8214, test_loss: 1.0455, test_f1: 0.5732
 epoch: 19, train_loss: 0.8075, test_loss: 1.0856, test_f1: 0.5916
 epoch: 20, train_loss: 0.7939, test_loss: 0.9791, test_f1: 0.5950
 epoch: 21, train_loss: 0.7916, test_loss: 1.0688, test_f1: 0.5612
 epoch: 22, train_loss: 0.8030, test_loss: 0.9896, test_f1: 0.5888
 epoch: 23, train_loss: 0.7825, test_loss: 1.1001, test_f1: 0.5708
 epoch: 24, train_loss: 0.7789, test_loss: 1.0450, test_f1: 0.5494
 epoch: 25, train_loss: 0.7704, test_loss: 1.0690, test_f1: 0.5858
 epoch: 26, train_loss: 0.7655, test_loss: 1.1114, test_f1: 0.5231
 epoch: 27, train_loss: 0.7595, test_loss: 1.0752, test_f1: 0.5555
 epoch: 28, train_loss: 0.7532, test_loss: 1.0317, test_f1: 0.5971
 epoch: 29, train_loss: 0.7505, test_loss: 1.2208, test_f1: 0.5294
 epoch: 30, train_loss: 0.7691, test_loss: 1.1305, test_f1: 0.5448
 epoch: 31, train_loss: 0.7306, test_loss: 1.0361, test_f1: 0.5652
 epoch: 32, train_loss: 0.7370, test_loss: 0.9204, test_f1: 0.6245
 epoch: 33, train_loss: 0.7376, test_loss: 1.1490, test_f1: 0.5308
 epoch: 34, train_loss: 0.7371, test_loss: 1.2587, test_f1: 0.5420
 epoch: 35, train_loss: 0.7509, test_loss: 1.1042, test_f1: 0.5472
 epoch: 36, train_loss: 0.7640, test_loss: 1.0419, test_f1: 0.5566
 epoch: 37, train_loss: 0.7420, test_loss: 0.9824, test_f1: 0.6056
 epoch: 38, train_loss: 0.7444, test_loss: 1.0025, test_f1: 0.5767
 epoch: 39, train_loss: 0.7053, test_loss: 1.0900, test_f1: 0.5541
 epoch: 40, train_loss: 0.7411, test_loss: 1.3763, test_f1: 0.5177
 epoch: 41, train_loss: 0.7488, test_loss: 1.0276, test_f1: 0.5854
 epoch: 42, train_loss: 0.7128, test_loss: 1.0412, test_f1: 0.5947
 epoch: 43, train_loss: 0.6960, test_loss: 1.0105, test_f1: 0.6127
 epoch: 44, train_loss: 0.7017, test_loss: 0.9112, test_f1: 0.6147
 epoch: 45, train_loss: 0.7144, test_loss: 1.0376, test_f1: 0.6011
 epoch: 46, train_loss: 0.6898, test_loss: 0.9381, test_f1: 0.5983
 epoch: 47, train_loss: 0.7046, test_loss: 0.9991, test_f1: 0.5804
 epoch: 48, train_loss: 0.7245, test_loss: 0.9160, test_f1: 0.6176
 epoch: 49, train_loss: 0.7036, test_loss: 0.9645, test_f1: 0.5462
 epoch: 50, train_loss: 0.6978, test_loss: 1.0235, test_f1: 0.5441
 epoch: 51, train_loss: 0.6656, test_loss: 1.0034, test_f1: 0.6097
 epoch: 52, train_loss: 0.6324, test_loss: 1.0611, test_f1: 0.5992
 epoch: 53, train_loss: 0.6715, test_loss: 1.1529, test_f1: 0.6022
 epoch: 54, train_loss: 0.6490, test_loss: 1.2506, test_f1: 0.5958
 epoch: 55, train_loss: 0.6325, test_loss: 1.1004, test_f1: 0.6087
 epoch: 56, train_loss: 0.6380, test_loss: 1.0305, test_f1: 0.6341
 epoch: 57, train_loss: 0.6298, test_loss: 1.1306, test_f1: 0.5908
 epoch: 58, train_loss: 0.6278, test_loss: 1.2512, test_f1: 0.6059
 epoch: 59, train_loss: 0.6137, test_loss: 1.2579, test_f1: 0.6104
 epoch: 60, train_loss: 0.6320, test_loss: 1.1582, test_f1: 0.5695
 epoch: 61, train_loss: 0.6434, test_loss: 1.1406, test_f1: 0.6299
 epoch: 62, train_loss: 0.6070, test_loss: 1.1116, test_f1: 0.5789
 epoch: 63, train_loss: 0.6375, test_loss: 1.0771, test_f1: 0.5855
 epoch: 64, train_loss: 0.6147, test_loss: 1.1128, test_f1: 0.6378
 epoch: 65, train_loss: 0.6056, test_loss: 1.1741, test_f1: 0.6250
 epoch: 66, train_loss: 0.6075, test_loss: 1.2205, test_f1: 0.6455
 epoch: 67, train_loss: 0.6206, test_loss: 1.1584, test_f1: 0.5967
 epoch: 68, train_loss: 0.6084, test_loss: 1.1950, test_f1: 0.6167
 epoch: 69, train_loss: 0.6167, test_loss: 1.1694, test_f1: 0.5911
 epoch: 70, train_loss: 0.5857, test_loss: 1.2817, test_f1: 0.6593
 epoch: 71, train_loss: 0.5882, test_loss: 1.5842, test_f1: 0.5444
 epoch: 72, train_loss: 0.5984, test_loss: 1.3912, test_f1: 0.5966
 epoch: 73, train_loss: 0.5905, test_loss: 1.3058, test_f1: 0.6478
 epoch: 74, train_loss: 0.5927, test_loss: 1.2813, test_f1: 0.6494
 epoch: 75, train_loss: 0.5913, test_loss: 1.0865, test_f1: 0.6426
 epoch: 76, train_loss: 0.5867, test_loss: 1.3880, test_f1: 0.6307
 epoch: 77, train_loss: 0.5888, test_loss: 1.4293, test_f1: 0.5983
 epoch: 78, train_loss: 0.5921, test_loss: 1.3146, test_f1: 0.5594
 epoch: 79, train_loss: 0.5820, test_loss: 1.1637, test_f1: 0.6002
 epoch: 80, train_loss: 0.5812, test_loss: 1.3219, test_f1: 0.6457
 epoch: 81, train_loss: 0.5824, test_loss: 1.3591, test_f1: 0.5537
 epoch: 82, train_loss: 0.5938, test_loss: 1.4465, test_f1: 0.5353
 epoch: 83, train_loss: 0.5728, test_loss: 1.3135, test_f1: 0.5952
 epoch: 84, train_loss: 0.5393, test_loss: 1.3689, test_f1: 0.6150
 epoch: 85, train_loss: 0.5674, test_loss: 1.0568, test_f1: 0.6405
 epoch: 86, train_loss: 0.5769, test_loss: 1.2210, test_f1: 0.5891
 epoch: 87, train_loss: 0.5710, test_loss: 1.2678, test_f1: 0.5685
 epoch: 88, train_loss: 0.5552, test_loss: 1.2140, test_f1: 0.6576
 epoch: 89, train_loss: 0.5770, test_loss: 1.3781, test_f1: 0.6459
 epoch: 90, train_loss: 0.5861, test_loss: 1.2394, test_f1: 0.6307
 epoch: 91, train_loss: 0.5704, test_loss: 1.4037, test_f1: 0.6136
 epoch: 92, train_loss: 0.5519, test_loss: 1.2887, test_f1: 0.6114
 epoch: 93, train_loss: 0.5527, test_loss: 1.2207, test_f1: 0.6443
 epoch: 94, train_loss: 0.5783, test_loss: 1.4137, test_f1: 0.5986
 epoch: 95, train_loss: 0.5769, test_loss: 1.0500, test_f1: 0.6220
 epoch: 96, train_loss: 0.5706, test_loss: 1.3189, test_f1: 0.6058
 epoch: 97, train_loss: 0.5343, test_loss: 1.3302, test_f1: 0.6189
 epoch: 98, train_loss: 0.5401, test_loss: 1.4087, test_f1: 0.5873
 epoch: 99, train_loss: 0.5444, test_loss: 1.3715, test_f1: 0.6071
##################ITERATION #9 ****************************************
 epoch: 0, train_loss: 1.1880, test_loss: 1.3200, test_f1: 0.3370
 epoch: 1, train_loss: 0.9868, test_loss: 0.9911, test_f1: 0.5248
 epoch: 2, train_loss: 0.9216, test_loss: 1.0123, test_f1: 0.5265
 epoch: 3, train_loss: 0.8910, test_loss: 0.9958, test_f1: 0.5706
 epoch: 4, train_loss: 0.8896, test_loss: 1.0790, test_f1: 0.4601
 epoch: 5, train_loss: 0.8640, test_loss: 1.0004, test_f1: 0.4826
 epoch: 6, train_loss: 0.8692, test_loss: 1.0204, test_f1: 0.4442
 epoch: 7, train_loss: 0.8447, test_loss: 1.0192, test_f1: 0.5499
 epoch: 8, train_loss: 0.8269, test_loss: 1.1103, test_f1: 0.5195
 epoch: 9, train_loss: 0.8322, test_loss: 0.9886, test_f1: 0.5543
 epoch: 10, train_loss: 0.8339, test_loss: 1.0138, test_f1: 0.5609
 epoch: 11, train_loss: 0.8121, test_loss: 0.9976, test_f1: 0.5526
 epoch: 12, train_loss: 0.8375, test_loss: 1.0602, test_f1: 0.5652
 epoch: 13, train_loss: 0.8118, test_loss: 1.0694, test_f1: 0.4975
 epoch: 14, train_loss: 0.8066, test_loss: 1.0086, test_f1: 0.5896
 epoch: 15, train_loss: 0.8042, test_loss: 1.1486, test_f1: 0.4998
 epoch: 16, train_loss: 0.8157, test_loss: 1.0384, test_f1: 0.5392
 epoch: 17, train_loss: 0.7918, test_loss: 1.0617, test_f1: 0.5601
 epoch: 18, train_loss: 0.7833, test_loss: 1.4227, test_f1: 0.5101
 epoch: 19, train_loss: 0.7675, test_loss: 1.2577, test_f1: 0.5847
 epoch: 20, train_loss: 0.7835, test_loss: 1.1832, test_f1: 0.5705
 epoch: 21, train_loss: 0.8102, test_loss: 1.0746, test_f1: 0.5450
 epoch: 22, train_loss: 0.8236, test_loss: 1.0129, test_f1: 0.5484
 epoch: 23, train_loss: 0.7649, test_loss: 1.1222, test_f1: 0.5397
 epoch: 24, train_loss: 0.7883, test_loss: 1.3199, test_f1: 0.4404
 epoch: 25, train_loss: 0.7663, test_loss: 1.0590, test_f1: 0.6087
 epoch: 26, train_loss: 0.7578, test_loss: 1.0357, test_f1: 0.5839
 epoch: 27, train_loss: 0.7527, test_loss: 1.0387, test_f1: 0.6218
 epoch: 28, train_loss: 0.7458, test_loss: 1.0472, test_f1: 0.5827
 epoch: 29, train_loss: 0.7438, test_loss: 1.1408, test_f1: 0.5807
 epoch: 30, train_loss: 0.7171, test_loss: 1.1414, test_f1: 0.5876
 epoch: 31, train_loss: 0.7465, test_loss: 1.1831, test_f1: 0.5560
 epoch: 32, train_loss: 0.7326, test_loss: 1.0851, test_f1: 0.6182
 epoch: 33, train_loss: 0.7238, test_loss: 1.1730, test_f1: 0.5790
 epoch: 34, train_loss: 0.7293, test_loss: 1.2509, test_f1: 0.4913
 epoch: 35, train_loss: 0.7203, test_loss: 1.0117, test_f1: 0.6305
 epoch: 36, train_loss: 0.7038, test_loss: 1.0054, test_f1: 0.6049
 epoch: 37, train_loss: 0.6837, test_loss: 1.0303, test_f1: 0.6367
 epoch: 38, train_loss: 0.6999, test_loss: 1.1332, test_f1: 0.5424
 epoch: 39, train_loss: 0.7105, test_loss: 1.1039, test_f1: 0.6012
 epoch: 40, train_loss: 0.7122, test_loss: 1.0809, test_f1: 0.5953
 epoch: 41, train_loss: 0.6741, test_loss: 1.1400, test_f1: 0.6192
 epoch: 42, train_loss: 0.6785, test_loss: 1.3309, test_f1: 0.5779
 epoch: 43, train_loss: 0.6714, test_loss: 1.0892, test_f1: 0.6230
 epoch: 44, train_loss: 0.7062, test_loss: 1.2260, test_f1: 0.5638
 epoch: 45, train_loss: 0.7057, test_loss: 1.0851, test_f1: 0.5354
 epoch: 46, train_loss: 0.6678, test_loss: 1.2024, test_f1: 0.5943
 epoch: 47, train_loss: 0.6720, test_loss: 1.0830, test_f1: 0.5927
 epoch: 48, train_loss: 0.6585, test_loss: 1.1020, test_f1: 0.6026
 epoch: 49, train_loss: 0.6481, test_loss: 1.3749, test_f1: 0.5338
 epoch: 50, train_loss: 0.6632, test_loss: 1.2364, test_f1: 0.5801
 epoch: 51, train_loss: 0.6392, test_loss: 1.2261, test_f1: 0.5804
 epoch: 52, train_loss: 0.5895, test_loss: 1.2322, test_f1: 0.5735
 epoch: 53, train_loss: 0.6097, test_loss: 1.7000, test_f1: 0.5168
 epoch: 54, train_loss: 0.5978, test_loss: 1.2798, test_f1: 0.6126
 epoch: 55, train_loss: 0.5802, test_loss: 1.2363, test_f1: 0.6025
 epoch: 56, train_loss: 0.5894, test_loss: 1.5559, test_f1: 0.5796
 epoch: 57, train_loss: 0.5815, test_loss: 1.4696, test_f1: 0.5864
 epoch: 58, train_loss: 0.5550, test_loss: 1.4472, test_f1: 0.5946
 epoch: 59, train_loss: 0.5710, test_loss: 1.4405, test_f1: 0.5737
 epoch: 60, train_loss: 0.5736, test_loss: 1.3558, test_f1: 0.6001
 epoch: 61, train_loss: 0.5520, test_loss: 1.4305, test_f1: 0.5517
 epoch: 62, train_loss: 0.6052, test_loss: 1.4461, test_f1: 0.5626
 epoch: 63, train_loss: 0.5725, test_loss: 1.4595, test_f1: 0.5715
 epoch: 64, train_loss: 0.5630, test_loss: 1.4797, test_f1: 0.6047
 epoch: 65, train_loss: 0.5556, test_loss: 1.7948, test_f1: 0.4840
 epoch: 66, train_loss: 0.5452, test_loss: 1.5138, test_f1: 0.5840
 epoch: 67, train_loss: 0.5569, test_loss: 1.3393, test_f1: 0.5913
 epoch: 68, train_loss: 0.5402, test_loss: 1.4779, test_f1: 0.5734
 epoch: 69, train_loss: 0.5707, test_loss: 1.4897, test_f1: 0.5836
 epoch: 70, train_loss: 0.5541, test_loss: 1.3620, test_f1: 0.5607
 epoch: 71, train_loss: 0.5491, test_loss: 1.4424, test_f1: 0.5858
 epoch: 72, train_loss: 0.5332, test_loss: 1.2627, test_f1: 0.6137
 epoch: 73, train_loss: 0.5260, test_loss: 1.4397, test_f1: 0.5939
 epoch: 74, train_loss: 0.5287, test_loss: 1.3594, test_f1: 0.5887
 epoch: 75, train_loss: 0.5257, test_loss: 1.5229, test_f1: 0.5921
 epoch: 76, train_loss: 0.5374, test_loss: 1.3396, test_f1: 0.6130
 epoch: 77, train_loss: 0.5438, test_loss: 1.4953, test_f1: 0.6000
 epoch: 78, train_loss: 0.5329, test_loss: 1.3490, test_f1: 0.6239
 epoch: 79, train_loss: 0.5205, test_loss: 1.2938, test_f1: 0.6135
 epoch: 80, train_loss: 0.5119, test_loss: 1.3147, test_f1: 0.6079
 epoch: 81, train_loss: 0.5114, test_loss: 1.3851, test_f1: 0.5603
 epoch: 82, train_loss: 0.5467, test_loss: 1.4906, test_f1: 0.5744
 epoch: 83, train_loss: 0.5140, test_loss: 1.8617, test_f1: 0.5284
 epoch: 84, train_loss: 0.5137, test_loss: 1.6166, test_f1: 0.5739
 epoch: 85, train_loss: 0.5002, test_loss: 1.5306, test_f1: 0.5969
 epoch: 86, train_loss: 0.4948, test_loss: 1.4006, test_f1: 0.6132
 epoch: 87, train_loss: 0.5002, test_loss: 1.4309, test_f1: 0.5967
 epoch: 88, train_loss: 0.4711, test_loss: 1.6004, test_f1: 0.5909
 epoch: 89, train_loss: 0.5236, test_loss: 1.7744, test_f1: 0.5125
 epoch: 90, train_loss: 0.5209, test_loss: 1.5067, test_f1: 0.6398
 epoch: 91, train_loss: 0.4853, test_loss: 1.3884, test_f1: 0.6309
 epoch: 92, train_loss: 0.4879, test_loss: 1.4396, test_f1: 0.5686
 epoch: 93, train_loss: 0.4955, test_loss: 1.6106, test_f1: 0.5982
 epoch: 94, train_loss: 0.4843, test_loss: 2.0270, test_f1: 0.5645
 epoch: 95, train_loss: 0.4686, test_loss: 1.5577, test_f1: 0.5935
 epoch: 96, train_loss: 0.4733, test_loss: 1.6199, test_f1: 0.5941
 epoch: 97, train_loss: 0.4796, test_loss: 1.4393, test_f1: 0.6024
 epoch: 98, train_loss: 0.5073, test_loss: 1.4627, test_f1: 0.5967
 epoch: 99, train_loss: 0.4527, test_loss: 1.7788, test_f1: 0.5814

Training completed in 783.51 seconds
Best F1: 0.6927 at epoch 39
Mean F1 across iterations: 0.6556  0.0171
========================FINAL RESULTS================================
FEGIN weighted F1: 0.6927  0.0171
python main.py --data ltspice_demos --representation component_pin --model FEGIN --layers 6 --hiddens 32 --batch_size 32 --lr 0.01 --emb_size 512 --epochs 100 --save_appendix component_pin_L6_H32_BS32_LR0.01_E512 --no_val
-----



STDERR:
  File "main.py", line 370, in <module>
    main()
  File "main.py", line 254, in main
    dataset = dataset_class(
  File "/home/philip/projects/ltspice_examples_code_repo/Circuit-Completion-Using-GNNs/component_classification_with_link_prediction_head/evaluation/FEGIN/kernel/circuit_datasets.py", line 15, in __init__
    self.data, self.slices = torch.load(self.processed_paths[0])
  File "/home/philip/.local/lib/python3.8/site-packages/torch/serialization.py", line 1040, in load
    warnings.warn(
  File "/usr/lib/python3.8/warnings.py", line 109, in _showwarnmsg
    sw(msg.message, msg.category, msg.filename, msg.lineno,
  File "main.py", line 47, in warn_with_traceback
    traceback.print_stack(file=log)
/home/philip/projects/ltspice_examples_code_repo/Circuit-Completion-Using-GNNs/component_classification_with_link_prediction_head/evaluation/FEGIN/kernel/circuit_datasets.py:15: FutureWarning: You are using `torch.load` with `weights_only=False` (the current default value), which uses the default pickle module implicitly. It is possible to construct malicious pickle data which will execute arbitrary code during unpickling (See https://github.com/pytorch/pytorch/blob/main/SECURITY.md#untrusted-models for more details). In a future release, the default value for `weights_only` will be flipped to `True`. This limits the functions that could be executed during unpickling. Arbitrary objects will no longer be allowed to be loaded via this mode unless they are explicitly allowlisted by the user via `torch.serialization.add_safe_globals`. We recommend you start setting `weights_only=True` for any use case where you don't have full control of the loaded file. Please open an issue on GitHub for any issues related to this experimental feature.
  self.data, self.slices = torch.load(self.processed_paths[0])
