STDOUT:
Results will be saved in /home/philip/projects/ltspice_examples_code_repo/Circuit-Completion-Using-GNNs/component_classification_with_link_prediction_head/evaluation/FEGIN/results/model_FEGIN_dataset_ltspice_examples
Command line input: python main.py --data ltspice_examples --representation component_pin_net --model FEGIN --layers 2 --hiddens 64 --batch_size 256 --lr 0.01 --emb_size 128 --epochs 100 --save_appendix component_pin_net_L2_H64_BS256_LR0.01_E128 --no_val
 is saved.
-----
ltspice_examples - FEGIN
Using 2 layers, 64 hidden units, h = 2
Loading component_pin_net representation dataset
ENTERED
Training FEGIN on component_pin_net representation
Train: 3558, Test: 846
##################ITERATION #0 ****************************************
 epoch: 0, train_loss: 1.2066, test_loss: 1.4535, test_f1: 0.2270
 epoch: 1, train_loss: 1.0093, test_loss: 1.4466, test_f1: 0.2624
 epoch: 2, train_loss: 0.9748, test_loss: 1.2180, test_f1: 0.3894
 epoch: 3, train_loss: 0.9550, test_loss: 0.9742, test_f1: 0.5014
 epoch: 4, train_loss: 0.9332, test_loss: 0.9200, test_f1: 0.5360
 epoch: 5, train_loss: 0.9214, test_loss: 0.9434, test_f1: 0.5106
 epoch: 6, train_loss: 0.9116, test_loss: 0.9613, test_f1: 0.4837
 epoch: 7, train_loss: 0.8888, test_loss: 0.9204, test_f1: 0.5556
 epoch: 8, train_loss: 0.8652, test_loss: 0.8904, test_f1: 0.5153
 epoch: 9, train_loss: 0.8488, test_loss: 0.8609, test_f1: 0.5159
 epoch: 10, train_loss: 0.8359, test_loss: 0.9090, test_f1: 0.5716
 epoch: 11, train_loss: 0.8325, test_loss: 0.9790, test_f1: 0.5425
 epoch: 12, train_loss: 0.8137, test_loss: 0.9458, test_f1: 0.5141
 epoch: 13, train_loss: 0.8054, test_loss: 0.9054, test_f1: 0.5716
 epoch: 14, train_loss: 0.7818, test_loss: 1.0242, test_f1: 0.5487
 epoch: 15, train_loss: 0.7680, test_loss: 0.8634, test_f1: 0.5828
 epoch: 16, train_loss: 0.7491, test_loss: 0.8677, test_f1: 0.6064
 epoch: 17, train_loss: 0.7305, test_loss: 0.9496, test_f1: 0.5641
 epoch: 18, train_loss: 0.7260, test_loss: 0.8815, test_f1: 0.5920
 epoch: 19, train_loss: 0.7108, test_loss: 1.1794, test_f1: 0.5530
 epoch: 20, train_loss: 0.7204, test_loss: 0.8112, test_f1: 0.6352
 epoch: 21, train_loss: 0.6984, test_loss: 1.1936, test_f1: 0.4958
 epoch: 22, train_loss: 0.6849, test_loss: 0.9953, test_f1: 0.5745
 epoch: 23, train_loss: 0.6686, test_loss: 0.8287, test_f1: 0.6334
 epoch: 24, train_loss: 0.6904, test_loss: 0.8351, test_f1: 0.6184
 epoch: 25, train_loss: 0.6563, test_loss: 0.8999, test_f1: 0.5930
 epoch: 26, train_loss: 0.6573, test_loss: 0.8497, test_f1: 0.6572
 epoch: 27, train_loss: 0.6491, test_loss: 0.9494, test_f1: 0.6378
 epoch: 28, train_loss: 0.6315, test_loss: 0.9992, test_f1: 0.6044
 epoch: 29, train_loss: 0.6470, test_loss: 0.9042, test_f1: 0.5706
 epoch: 30, train_loss: 0.6424, test_loss: 0.8641, test_f1: 0.6527
 epoch: 31, train_loss: 0.6098, test_loss: 0.9147, test_f1: 0.6204
 epoch: 32, train_loss: 0.6039, test_loss: 1.1602, test_f1: 0.5410
 epoch: 33, train_loss: 0.6119, test_loss: 0.8369, test_f1: 0.6625
 epoch: 34, train_loss: 0.5930, test_loss: 0.9043, test_f1: 0.6292
 epoch: 35, train_loss: 0.5755, test_loss: 0.8451, test_f1: 0.6459
 epoch: 36, train_loss: 0.5912, test_loss: 0.9164, test_f1: 0.6443
 epoch: 37, train_loss: 0.5679, test_loss: 0.9120, test_f1: 0.6672
 epoch: 38, train_loss: 0.5529, test_loss: 0.8948, test_f1: 0.6556
 epoch: 39, train_loss: 0.5556, test_loss: 1.0379, test_f1: 0.6371
 epoch: 40, train_loss: 0.5726, test_loss: 0.8116, test_f1: 0.6505
 epoch: 41, train_loss: 0.5527, test_loss: 0.9429, test_f1: 0.6367
 epoch: 42, train_loss: 0.5351, test_loss: 1.3002, test_f1: 0.5199
 epoch: 43, train_loss: 0.5397, test_loss: 1.1211, test_f1: 0.6218
 epoch: 44, train_loss: 0.5216, test_loss: 0.8507, test_f1: 0.6697
 epoch: 45, train_loss: 0.5121, test_loss: 1.0584, test_f1: 0.6242
 epoch: 46, train_loss: 0.5061, test_loss: 1.1875, test_f1: 0.5889
 epoch: 47, train_loss: 0.5283, test_loss: 1.4916, test_f1: 0.5817
 epoch: 48, train_loss: 0.5209, test_loss: 1.0123, test_f1: 0.6546
 epoch: 49, train_loss: 0.4844, test_loss: 0.8798, test_f1: 0.6689
 epoch: 50, train_loss: 0.4689, test_loss: 0.9260, test_f1: 0.6688
 epoch: 51, train_loss: 0.4787, test_loss: 1.0191, test_f1: 0.6782
 epoch: 52, train_loss: 0.4286, test_loss: 1.0496, test_f1: 0.6501
 epoch: 53, train_loss: 0.4328, test_loss: 0.9519, test_f1: 0.6823
 epoch: 54, train_loss: 0.4118, test_loss: 1.0920, test_f1: 0.6662
 epoch: 55, train_loss: 0.3998, test_loss: 1.0684, test_f1: 0.6431
 epoch: 56, train_loss: 0.3978, test_loss: 1.0157, test_f1: 0.6571
 epoch: 57, train_loss: 0.3973, test_loss: 1.2608, test_f1: 0.6153
 epoch: 58, train_loss: 0.3920, test_loss: 1.0595, test_f1: 0.6594
 epoch: 59, train_loss: 0.3830, test_loss: 1.0329, test_f1: 0.6598
 epoch: 60, train_loss: 0.3706, test_loss: 1.0844, test_f1: 0.6784
 epoch: 61, train_loss: 0.3770, test_loss: 1.0467, test_f1: 0.6868
 epoch: 62, train_loss: 0.3593, test_loss: 1.0842, test_f1: 0.6684
 epoch: 63, train_loss: 0.3679, test_loss: 1.2936, test_f1: 0.6478
 epoch: 64, train_loss: 0.3601, test_loss: 1.2643, test_f1: 0.6620
 epoch: 65, train_loss: 0.3591, test_loss: 1.1441, test_f1: 0.6671
 epoch: 66, train_loss: 0.3544, test_loss: 1.1636, test_f1: 0.6602
 epoch: 67, train_loss: 0.3593, test_loss: 1.2765, test_f1: 0.6548
 epoch: 68, train_loss: 0.3406, test_loss: 1.2609, test_f1: 0.6638
 epoch: 69, train_loss: 0.3367, test_loss: 1.1713, test_f1: 0.6605
 epoch: 70, train_loss: 0.3593, test_loss: 1.3624, test_f1: 0.6677
 epoch: 71, train_loss: 0.3427, test_loss: 1.2825, test_f1: 0.6526
 epoch: 72, train_loss: 0.3686, test_loss: 1.2256, test_f1: 0.6465
 epoch: 73, train_loss: 0.3439, test_loss: 1.2639, test_f1: 0.6499
 epoch: 74, train_loss: 0.3345, test_loss: 1.3012, test_f1: 0.6308
 epoch: 75, train_loss: 0.3247, test_loss: 1.2164, test_f1: 0.6630
 epoch: 76, train_loss: 0.3412, test_loss: 1.2124, test_f1: 0.6710
 epoch: 77, train_loss: 0.3158, test_loss: 1.1341, test_f1: 0.6638
 epoch: 78, train_loss: 0.3229, test_loss: 1.2429, test_f1: 0.6828
 epoch: 79, train_loss: 0.3253, test_loss: 1.3990, test_f1: 0.6400
 epoch: 80, train_loss: 0.3358, test_loss: 1.1906, test_f1: 0.6908
 epoch: 81, train_loss: 0.3506, test_loss: 1.2220, test_f1: 0.6606
 epoch: 82, train_loss: 0.3168, test_loss: 1.5035, test_f1: 0.6691
 epoch: 83, train_loss: 0.3123, test_loss: 1.2504, test_f1: 0.6670
 epoch: 84, train_loss: 0.3039, test_loss: 1.2941, test_f1: 0.6791
 epoch: 85, train_loss: 0.3157, test_loss: 1.2432, test_f1: 0.6674
 epoch: 86, train_loss: 0.2984, test_loss: 1.3922, test_f1: 0.6532
 epoch: 87, train_loss: 0.3127, test_loss: 1.2718, test_f1: 0.6686
 epoch: 88, train_loss: 0.3257, test_loss: 1.5635, test_f1: 0.6373
 epoch: 89, train_loss: 0.3146, test_loss: 1.3439, test_f1: 0.6651
 epoch: 90, train_loss: 0.3234, test_loss: 1.2330, test_f1: 0.6477
 epoch: 91, train_loss: 0.2932, test_loss: 1.2916, test_f1: 0.6342
 epoch: 92, train_loss: 0.2883, test_loss: 1.3506, test_f1: 0.6502
 epoch: 93, train_loss: 0.2946, test_loss: 1.2961, test_f1: 0.6825
 epoch: 94, train_loss: 0.2978, test_loss: 1.3061, test_f1: 0.6632
 epoch: 95, train_loss: 0.2863, test_loss: 1.3290, test_f1: 0.6557
 epoch: 96, train_loss: 0.2738, test_loss: 1.2743, test_f1: 0.6675
 epoch: 97, train_loss: 0.2940, test_loss: 1.4310, test_f1: 0.6687
 epoch: 98, train_loss: 0.2829, test_loss: 1.7005, test_f1: 0.6566
 epoch: 99, train_loss: 0.2765, test_loss: 1.4255, test_f1: 0.6598
##################ITERATION #1 ****************************************
 epoch: 0, train_loss: 1.2074, test_loss: 1.4097, test_f1: 0.2270
 epoch: 1, train_loss: 0.9972, test_loss: 1.1861, test_f1: 0.3905
 epoch: 2, train_loss: 0.9384, test_loss: 0.9889, test_f1: 0.4694
 epoch: 3, train_loss: 0.9020, test_loss: 0.9565, test_f1: 0.4666
 epoch: 4, train_loss: 0.8878, test_loss: 0.9952, test_f1: 0.4906
 epoch: 5, train_loss: 0.8768, test_loss: 1.0467, test_f1: 0.5221
 epoch: 6, train_loss: 0.8439, test_loss: 0.9266, test_f1: 0.5269
 epoch: 7, train_loss: 0.8277, test_loss: 0.9881, test_f1: 0.5033
 epoch: 8, train_loss: 0.8178, test_loss: 0.9090, test_f1: 0.5388
 epoch: 9, train_loss: 0.8075, test_loss: 1.0905, test_f1: 0.4676
 epoch: 10, train_loss: 0.7825, test_loss: 0.9558, test_f1: 0.5324
 epoch: 11, train_loss: 0.7707, test_loss: 0.9971, test_f1: 0.4955
 epoch: 12, train_loss: 0.7571, test_loss: 0.9526, test_f1: 0.6081
 epoch: 13, train_loss: 0.7640, test_loss: 0.8936, test_f1: 0.5491
 epoch: 14, train_loss: 0.7323, test_loss: 0.8816, test_f1: 0.6268
 epoch: 15, train_loss: 0.7342, test_loss: 0.7980, test_f1: 0.6109
 epoch: 16, train_loss: 0.7274, test_loss: 0.9018, test_f1: 0.5351
 epoch: 17, train_loss: 0.6887, test_loss: 0.8177, test_f1: 0.6783
 epoch: 18, train_loss: 0.6750, test_loss: 0.9002, test_f1: 0.6336
 epoch: 19, train_loss: 0.6889, test_loss: 0.8300, test_f1: 0.6452
 epoch: 20, train_loss: 0.6555, test_loss: 0.9979, test_f1: 0.5640
 epoch: 21, train_loss: 0.6515, test_loss: 0.9513, test_f1: 0.5827
 epoch: 22, train_loss: 0.6411, test_loss: 1.0491, test_f1: 0.5122
 epoch: 23, train_loss: 0.6261, test_loss: 0.9420, test_f1: 0.5944
 epoch: 24, train_loss: 0.6268, test_loss: 0.9734, test_f1: 0.6582
 epoch: 25, train_loss: 0.6495, test_loss: 0.9538, test_f1: 0.5982
 epoch: 26, train_loss: 0.6383, test_loss: 1.0466, test_f1: 0.6116
 epoch: 27, train_loss: 0.6147, test_loss: 0.9860, test_f1: 0.6360
 epoch: 28, train_loss: 0.6076, test_loss: 1.1975, test_f1: 0.5480
 epoch: 29, train_loss: 0.6017, test_loss: 1.0674, test_f1: 0.5657
 epoch: 30, train_loss: 0.5998, test_loss: 1.0999, test_f1: 0.5879
 epoch: 31, train_loss: 0.6035, test_loss: 1.0113, test_f1: 0.6451
 epoch: 32, train_loss: 0.5811, test_loss: 1.1546, test_f1: 0.6464
 epoch: 33, train_loss: 0.5787, test_loss: 1.0020, test_f1: 0.6047
 epoch: 34, train_loss: 0.5865, test_loss: 0.9298, test_f1: 0.6592
 epoch: 35, train_loss: 0.5450, test_loss: 1.5008, test_f1: 0.5527
 epoch: 36, train_loss: 0.5638, test_loss: 1.0714, test_f1: 0.6194
 epoch: 37, train_loss: 0.5744, test_loss: 1.2763, test_f1: 0.5619
 epoch: 38, train_loss: 0.5472, test_loss: 1.0638, test_f1: 0.6349
 epoch: 39, train_loss: 0.5181, test_loss: 0.9737, test_f1: 0.6405
 epoch: 40, train_loss: 0.5157, test_loss: 1.3095, test_f1: 0.6560
 epoch: 41, train_loss: 0.5284, test_loss: 1.1691, test_f1: 0.6248
 epoch: 42, train_loss: 0.5228, test_loss: 1.1364, test_f1: 0.6214
 epoch: 43, train_loss: 0.5508, test_loss: 1.5153, test_f1: 0.6219
 epoch: 44, train_loss: 0.5247, test_loss: 2.4395, test_f1: 0.4440
 epoch: 45, train_loss: 0.5046, test_loss: 1.7357, test_f1: 0.5805
 epoch: 46, train_loss: 0.4869, test_loss: 1.0994, test_f1: 0.6280
 epoch: 47, train_loss: 0.5114, test_loss: 1.1639, test_f1: 0.6511
 epoch: 48, train_loss: 0.5015, test_loss: 1.2791, test_f1: 0.5853
 epoch: 49, train_loss: 0.4954, test_loss: 1.3608, test_f1: 0.5871
 epoch: 50, train_loss: 0.4933, test_loss: 1.1610, test_f1: 0.6664
 epoch: 51, train_loss: 0.4470, test_loss: 1.2117, test_f1: 0.6151
 epoch: 52, train_loss: 0.4314, test_loss: 1.1825, test_f1: 0.6866
 epoch: 53, train_loss: 0.4323, test_loss: 1.2609, test_f1: 0.6587
 epoch: 54, train_loss: 0.4080, test_loss: 1.3200, test_f1: 0.6578
 epoch: 55, train_loss: 0.4074, test_loss: 1.3274, test_f1: 0.6383
 epoch: 56, train_loss: 0.4028, test_loss: 1.2772, test_f1: 0.6222
 epoch: 57, train_loss: 0.3985, test_loss: 1.2189, test_f1: 0.6618
 epoch: 58, train_loss: 0.3832, test_loss: 1.3731, test_f1: 0.6449
 epoch: 59, train_loss: 0.3618, test_loss: 1.3935, test_f1: 0.6752
 epoch: 60, train_loss: 0.3470, test_loss: 1.4287, test_f1: 0.6620
 epoch: 61, train_loss: 0.3718, test_loss: 1.5474, test_f1: 0.6399
 epoch: 62, train_loss: 0.3680, test_loss: 1.5104, test_f1: 0.6419
 epoch: 63, train_loss: 0.3599, test_loss: 1.3248, test_f1: 0.6673
 epoch: 64, train_loss: 0.3701, test_loss: 1.5838, test_f1: 0.6426
 epoch: 65, train_loss: 0.3644, test_loss: 1.5488, test_f1: 0.6454
 epoch: 66, train_loss: 0.3671, test_loss: 1.4632, test_f1: 0.6637
 epoch: 67, train_loss: 0.3525, test_loss: 1.4627, test_f1: 0.6605
 epoch: 68, train_loss: 0.3326, test_loss: 1.3044, test_f1: 0.6451
 epoch: 69, train_loss: 0.3515, test_loss: 1.4166, test_f1: 0.6298
 epoch: 70, train_loss: 0.3645, test_loss: 1.3690, test_f1: 0.6392
 epoch: 71, train_loss: 0.3504, test_loss: 1.5306, test_f1: 0.6599
 epoch: 72, train_loss: 0.3390, test_loss: 1.3730, test_f1: 0.6420
 epoch: 73, train_loss: 0.3475, test_loss: 1.3760, test_f1: 0.6673
 epoch: 74, train_loss: 0.3324, test_loss: 1.4432, test_f1: 0.6051
 epoch: 75, train_loss: 0.3571, test_loss: 1.6230, test_f1: 0.5972
 epoch: 76, train_loss: 0.3512, test_loss: 1.4086, test_f1: 0.6786
 epoch: 77, train_loss: 0.3144, test_loss: 1.3412, test_f1: 0.6212
 epoch: 78, train_loss: 0.3311, test_loss: 1.5174, test_f1: 0.6832
 epoch: 79, train_loss: 0.3237, test_loss: 1.5580, test_f1: 0.6706
 epoch: 80, train_loss: 0.3249, test_loss: 1.3187, test_f1: 0.6598
 epoch: 81, train_loss: 0.3268, test_loss: 1.5153, test_f1: 0.6769
 epoch: 82, train_loss: 0.3112, test_loss: 1.4279, test_f1: 0.6496
 epoch: 83, train_loss: 0.3246, test_loss: 1.4698, test_f1: 0.6446
 epoch: 84, train_loss: 0.3125, test_loss: 1.6201, test_f1: 0.6584
 epoch: 85, train_loss: 0.3304, test_loss: 1.4068, test_f1: 0.6639
 epoch: 86, train_loss: 0.3220, test_loss: 1.4218, test_f1: 0.6700
 epoch: 87, train_loss: 0.3245, test_loss: 1.5064, test_f1: 0.6914
 epoch: 88, train_loss: 0.3166, test_loss: 1.4574, test_f1: 0.6446
 epoch: 89, train_loss: 0.3434, test_loss: 1.7513, test_f1: 0.6592
 epoch: 90, train_loss: 0.3410, test_loss: 1.5853, test_f1: 0.6501
 epoch: 91, train_loss: 0.3323, test_loss: 1.4840, test_f1: 0.6909
 epoch: 92, train_loss: 0.3012, test_loss: 1.5097, test_f1: 0.6308
 epoch: 93, train_loss: 0.3116, test_loss: 1.7109, test_f1: 0.6571
 epoch: 94, train_loss: 0.2801, test_loss: 1.6636, test_f1: 0.6472
 epoch: 95, train_loss: 0.2787, test_loss: 1.5415, test_f1: 0.6621
 epoch: 96, train_loss: 0.2970, test_loss: 1.6368, test_f1: 0.6480
 epoch: 97, train_loss: 0.2930, test_loss: 1.6834, test_f1: 0.6308
 epoch: 98, train_loss: 0.2989, test_loss: 1.6150, test_f1: 0.6673
 epoch: 99, train_loss: 0.3085, test_loss: 1.5504, test_f1: 0.6282
##################ITERATION #2 ****************************************
 epoch: 0, train_loss: 1.4789, test_loss: 1.7483, test_f1: 0.1041
 epoch: 1, train_loss: 1.0077, test_loss: 1.3448, test_f1: 0.3088
 epoch: 2, train_loss: 0.9681, test_loss: 1.2483, test_f1: 0.3846
 epoch: 3, train_loss: 0.9501, test_loss: 1.0671, test_f1: 0.4176
 epoch: 4, train_loss: 0.9317, test_loss: 0.9895, test_f1: 0.4875
 epoch: 5, train_loss: 0.9165, test_loss: 0.9192, test_f1: 0.5158
 epoch: 6, train_loss: 0.8950, test_loss: 0.8518, test_f1: 0.5572
 epoch: 7, train_loss: 0.8725, test_loss: 0.9571, test_f1: 0.5007
 epoch: 8, train_loss: 0.8574, test_loss: 0.8950, test_f1: 0.5359
 epoch: 9, train_loss: 0.8430, test_loss: 0.9011, test_f1: 0.5517
 epoch: 10, train_loss: 0.8252, test_loss: 0.8746, test_f1: 0.5514
 epoch: 11, train_loss: 0.8613, test_loss: 0.9512, test_f1: 0.5532
 epoch: 12, train_loss: 0.8220, test_loss: 0.9818, test_f1: 0.5176
 epoch: 13, train_loss: 0.7907, test_loss: 0.8503, test_f1: 0.5981
 epoch: 14, train_loss: 0.7897, test_loss: 0.9230, test_f1: 0.5586
 epoch: 15, train_loss: 0.7792, test_loss: 0.8471, test_f1: 0.5727
 epoch: 16, train_loss: 0.7606, test_loss: 1.0291, test_f1: 0.5314
 epoch: 17, train_loss: 0.7635, test_loss: 0.8339, test_f1: 0.6057
 epoch: 18, train_loss: 0.7443, test_loss: 0.9196, test_f1: 0.5897
 epoch: 19, train_loss: 0.7329, test_loss: 1.0023, test_f1: 0.5463
 epoch: 20, train_loss: 0.7295, test_loss: 0.9182, test_f1: 0.5832
 epoch: 21, train_loss: 0.7027, test_loss: 0.9190, test_f1: 0.6261
 epoch: 22, train_loss: 0.6927, test_loss: 0.8859, test_f1: 0.5405
 epoch: 23, train_loss: 0.7052, test_loss: 0.9179, test_f1: 0.6396
 epoch: 24, train_loss: 0.6984, test_loss: 1.0000, test_f1: 0.5555
 epoch: 25, train_loss: 0.6766, test_loss: 0.8227, test_f1: 0.6270
 epoch: 26, train_loss: 0.6940, test_loss: 1.0904, test_f1: 0.5546
 epoch: 27, train_loss: 0.6794, test_loss: 0.9493, test_f1: 0.6027
 epoch: 28, train_loss: 0.6582, test_loss: 1.3154, test_f1: 0.4994
 epoch: 29, train_loss: 0.6729, test_loss: 0.9118, test_f1: 0.6283
 epoch: 30, train_loss: 0.6492, test_loss: 0.9562, test_f1: 0.6504
 epoch: 31, train_loss: 0.6402, test_loss: 0.9351, test_f1: 0.6437
 epoch: 32, train_loss: 0.6299, test_loss: 1.1077, test_f1: 0.5786
 epoch: 33, train_loss: 0.6599, test_loss: 1.0038, test_f1: 0.6644
 epoch: 34, train_loss: 0.6672, test_loss: 1.0759, test_f1: 0.5849
 epoch: 35, train_loss: 0.6737, test_loss: 1.1311, test_f1: 0.5745
 epoch: 36, train_loss: 0.6300, test_loss: 1.0241, test_f1: 0.6703
 epoch: 37, train_loss: 0.6151, test_loss: 1.4675, test_f1: 0.4728
 epoch: 38, train_loss: 0.5927, test_loss: 1.1044, test_f1: 0.5480
 epoch: 39, train_loss: 0.5959, test_loss: 1.0915, test_f1: 0.6726
 epoch: 40, train_loss: 0.5874, test_loss: 1.1677, test_f1: 0.5971
 epoch: 41, train_loss: 0.6015, test_loss: 1.2340, test_f1: 0.5318
 epoch: 42, train_loss: 0.5833, test_loss: 0.9354, test_f1: 0.6147
 epoch: 43, train_loss: 0.6273, test_loss: 1.1060, test_f1: 0.6020
 epoch: 44, train_loss: 0.5750, test_loss: 1.1375, test_f1: 0.5976
 epoch: 45, train_loss: 0.6188, test_loss: 0.9961, test_f1: 0.5935
 epoch: 46, train_loss: 0.6058, test_loss: 0.9697, test_f1: 0.6115
 epoch: 47, train_loss: 0.5666, test_loss: 1.1393, test_f1: 0.6121
 epoch: 48, train_loss: 0.5345, test_loss: 1.0872, test_f1: 0.6147
 epoch: 49, train_loss: 0.5442, test_loss: 1.2963, test_f1: 0.5964
 epoch: 50, train_loss: 0.5601, test_loss: 1.1214, test_f1: 0.6160
 epoch: 51, train_loss: 0.5203, test_loss: 1.1704, test_f1: 0.6556
 epoch: 52, train_loss: 0.5011, test_loss: 1.0756, test_f1: 0.6596
 epoch: 53, train_loss: 0.4714, test_loss: 1.1995, test_f1: 0.6480
 epoch: 54, train_loss: 0.4572, test_loss: 1.2031, test_f1: 0.6399
 epoch: 55, train_loss: 0.4636, test_loss: 1.3756, test_f1: 0.6650
 epoch: 56, train_loss: 0.4478, test_loss: 1.2007, test_f1: 0.6444
 epoch: 57, train_loss: 0.4466, test_loss: 1.3315, test_f1: 0.6319
 epoch: 58, train_loss: 0.4346, test_loss: 1.3253, test_f1: 0.6475
 epoch: 59, train_loss: 0.4314, test_loss: 1.3939, test_f1: 0.6694
 epoch: 60, train_loss: 0.4629, test_loss: 1.2251, test_f1: 0.6666
 epoch: 61, train_loss: 0.4573, test_loss: 1.4568, test_f1: 0.6347
 epoch: 62, train_loss: 0.4297, test_loss: 1.3722, test_f1: 0.6431
 epoch: 63, train_loss: 0.4399, test_loss: 1.1806, test_f1: 0.6717
 epoch: 64, train_loss: 0.4202, test_loss: 1.5866, test_f1: 0.6223
 epoch: 65, train_loss: 0.4341, test_loss: 1.4373, test_f1: 0.6202
 epoch: 66, train_loss: 0.4124, test_loss: 1.4847, test_f1: 0.6603
 epoch: 67, train_loss: 0.4157, test_loss: 1.5225, test_f1: 0.6650
 epoch: 68, train_loss: 0.4134, test_loss: 1.5225, test_f1: 0.6480
 epoch: 69, train_loss: 0.4117, test_loss: 1.5235, test_f1: 0.6467
 epoch: 70, train_loss: 0.4002, test_loss: 1.3611, test_f1: 0.6487
 epoch: 71, train_loss: 0.4017, test_loss: 1.3950, test_f1: 0.6742
 epoch: 72, train_loss: 0.4176, test_loss: 1.6160, test_f1: 0.6476
 epoch: 73, train_loss: 0.3999, test_loss: 1.6810, test_f1: 0.6396
 epoch: 74, train_loss: 0.3901, test_loss: 1.6356, test_f1: 0.6421
 epoch: 75, train_loss: 0.3920, test_loss: 1.8388, test_f1: 0.6114
 epoch: 76, train_loss: 0.3731, test_loss: 1.4434, test_f1: 0.6833
 epoch: 77, train_loss: 0.4077, test_loss: 1.8154, test_f1: 0.6363
 epoch: 78, train_loss: 0.4146, test_loss: 1.5567, test_f1: 0.6660
 epoch: 79, train_loss: 0.3879, test_loss: 1.4701, test_f1: 0.6672
 epoch: 80, train_loss: 0.3812, test_loss: 1.4700, test_f1: 0.6732
 epoch: 81, train_loss: 0.3875, test_loss: 1.7557, test_f1: 0.6384
 epoch: 82, train_loss: 0.4014, test_loss: 1.4526, test_f1: 0.6829
 epoch: 83, train_loss: 0.3705, test_loss: 1.6185, test_f1: 0.6808
 epoch: 84, train_loss: 0.3532, test_loss: 1.6601, test_f1: 0.6765
 epoch: 85, train_loss: 0.3914, test_loss: 1.5353, test_f1: 0.6655
 epoch: 86, train_loss: 0.3918, test_loss: 1.4535, test_f1: 0.6835
 epoch: 87, train_loss: 0.3848, test_loss: 1.5528, test_f1: 0.6690
 epoch: 88, train_loss: 0.3786, test_loss: 1.6026, test_f1: 0.6798
 epoch: 89, train_loss: 0.3499, test_loss: 1.7031, test_f1: 0.6684
 epoch: 90, train_loss: 0.3624, test_loss: 1.6814, test_f1: 0.6642
 epoch: 91, train_loss: 0.3470, test_loss: 1.7240, test_f1: 0.6528
 epoch: 92, train_loss: 0.3394, test_loss: 1.8728, test_f1: 0.6427
 epoch: 93, train_loss: 0.3736, test_loss: 1.6533, test_f1: 0.6248
 epoch: 94, train_loss: 0.3554, test_loss: 1.7474, test_f1: 0.6634
 epoch: 95, train_loss: 0.3400, test_loss: 1.5848, test_f1: 0.6729
 epoch: 96, train_loss: 0.3328, test_loss: 1.6672, test_f1: 0.6751
 epoch: 97, train_loss: 0.3418, test_loss: 1.9060, test_f1: 0.6786
 epoch: 98, train_loss: 0.3471, test_loss: 1.5126, test_f1: 0.6650
 epoch: 99, train_loss: 0.3359, test_loss: 1.5900, test_f1: 0.6814
##################ITERATION #3 ****************************************
 epoch: 0, train_loss: 1.4170, test_loss: 1.5731, test_f1: 0.2270
 epoch: 1, train_loss: 1.0051, test_loss: 1.1486, test_f1: 0.4035
 epoch: 2, train_loss: 0.9649, test_loss: 1.0129, test_f1: 0.3545
 epoch: 3, train_loss: 0.9386, test_loss: 0.9787, test_f1: 0.4581
 epoch: 4, train_loss: 0.9114, test_loss: 0.9377, test_f1: 0.5076
 epoch: 5, train_loss: 0.8830, test_loss: 0.9586, test_f1: 0.5151
 epoch: 6, train_loss: 0.8667, test_loss: 0.9408, test_f1: 0.5192
 epoch: 7, train_loss: 0.8605, test_loss: 0.9565, test_f1: 0.5304
 epoch: 8, train_loss: 0.8321, test_loss: 0.9155, test_f1: 0.5613
 epoch: 9, train_loss: 0.8063, test_loss: 0.8875, test_f1: 0.5455
 epoch: 10, train_loss: 0.7923, test_loss: 0.9585, test_f1: 0.5406
 epoch: 11, train_loss: 0.7828, test_loss: 0.8617, test_f1: 0.5995
 epoch: 12, train_loss: 0.7750, test_loss: 0.8445, test_f1: 0.6098
 epoch: 13, train_loss: 0.7644, test_loss: 0.8120, test_f1: 0.5780
 epoch: 14, train_loss: 0.7482, test_loss: 0.9530, test_f1: 0.5814
 epoch: 15, train_loss: 0.7435, test_loss: 1.1025, test_f1: 0.5248
 epoch: 16, train_loss: 0.7417, test_loss: 0.8811, test_f1: 0.5878
 epoch: 17, train_loss: 0.7357, test_loss: 1.2217, test_f1: 0.4880
 epoch: 18, train_loss: 0.7490, test_loss: 1.9279, test_f1: 0.3355
 epoch: 19, train_loss: 0.7437, test_loss: 0.8606, test_f1: 0.6138
 epoch: 20, train_loss: 0.7194, test_loss: 0.8560, test_f1: 0.6309
 epoch: 21, train_loss: 0.7088, test_loss: 0.8053, test_f1: 0.5919
 epoch: 22, train_loss: 0.6908, test_loss: 1.0127, test_f1: 0.5577
 epoch: 23, train_loss: 0.6804, test_loss: 0.8878, test_f1: 0.6155
 epoch: 24, train_loss: 0.6628, test_loss: 0.9089, test_f1: 0.6593
 epoch: 25, train_loss: 0.6572, test_loss: 0.9751, test_f1: 0.6150
 epoch: 26, train_loss: 0.6634, test_loss: 1.2914, test_f1: 0.5047
 epoch: 27, train_loss: 0.6527, test_loss: 1.0993, test_f1: 0.6041
 epoch: 28, train_loss: 0.6374, test_loss: 0.9097, test_f1: 0.6636
 epoch: 29, train_loss: 0.6356, test_loss: 1.1258, test_f1: 0.6052
 epoch: 30, train_loss: 0.6230, test_loss: 0.9610, test_f1: 0.6400
 epoch: 31, train_loss: 0.6103, test_loss: 1.0899, test_f1: 0.5849
 epoch: 32, train_loss: 0.6155, test_loss: 0.8728, test_f1: 0.6440
 epoch: 33, train_loss: 0.6289, test_loss: 1.1479, test_f1: 0.6470
 epoch: 34, train_loss: 0.6289, test_loss: 1.1377, test_f1: 0.6255
 epoch: 35, train_loss: 0.5961, test_loss: 0.8879, test_f1: 0.6513
 epoch: 36, train_loss: 0.5965, test_loss: 0.9593, test_f1: 0.6785
 epoch: 37, train_loss: 0.5743, test_loss: 1.0740, test_f1: 0.5979
 epoch: 38, train_loss: 0.5739, test_loss: 1.0037, test_f1: 0.6495
 epoch: 39, train_loss: 0.5722, test_loss: 1.1223, test_f1: 0.5994
 epoch: 40, train_loss: 0.5646, test_loss: 0.9660, test_f1: 0.6318
 epoch: 41, train_loss: 0.5734, test_loss: 1.1173, test_f1: 0.6608
 epoch: 42, train_loss: 0.5388, test_loss: 1.0483, test_f1: 0.6587
 epoch: 43, train_loss: 0.5741, test_loss: 1.2239, test_f1: 0.6563
 epoch: 44, train_loss: 0.5535, test_loss: 1.0689, test_f1: 0.6657
 epoch: 45, train_loss: 0.5383, test_loss: 1.0208, test_f1: 0.6517
 epoch: 46, train_loss: 0.5323, test_loss: 1.3413, test_f1: 0.6155
 epoch: 47, train_loss: 0.5370, test_loss: 1.2129, test_f1: 0.6516
 epoch: 48, train_loss: 0.5228, test_loss: 1.4700, test_f1: 0.5575
 epoch: 49, train_loss: 0.4952, test_loss: 1.2322, test_f1: 0.6479
 epoch: 50, train_loss: 0.5067, test_loss: 1.1792, test_f1: 0.6634
 epoch: 51, train_loss: 0.5006, test_loss: 1.3052, test_f1: 0.6439
 epoch: 52, train_loss: 0.4624, test_loss: 1.3053, test_f1: 0.6077
 epoch: 53, train_loss: 0.4472, test_loss: 1.2373, test_f1: 0.6746
 epoch: 54, train_loss: 0.4344, test_loss: 1.1110, test_f1: 0.6722
 epoch: 55, train_loss: 0.4268, test_loss: 1.3923, test_f1: 0.6756
 epoch: 56, train_loss: 0.4008, test_loss: 1.3054, test_f1: 0.6494
 epoch: 57, train_loss: 0.4063, test_loss: 1.4047, test_f1: 0.6374
 epoch: 58, train_loss: 0.4002, test_loss: 1.3630, test_f1: 0.6724
 epoch: 59, train_loss: 0.4231, test_loss: 1.1785, test_f1: 0.6624
 epoch: 60, train_loss: 0.4137, test_loss: 1.5247, test_f1: 0.6661
 epoch: 61, train_loss: 0.3910, test_loss: 1.3416, test_f1: 0.6682
 epoch: 62, train_loss: 0.4037, test_loss: 1.2856, test_f1: 0.6542
 epoch: 63, train_loss: 0.4124, test_loss: 1.3434, test_f1: 0.6799
 epoch: 64, train_loss: 0.3956, test_loss: 1.3770, test_f1: 0.6667
 epoch: 65, train_loss: 0.3817, test_loss: 1.3614, test_f1: 0.6679
 epoch: 66, train_loss: 0.3946, test_loss: 1.3647, test_f1: 0.6396
 epoch: 67, train_loss: 0.4188, test_loss: 1.3281, test_f1: 0.6669
 epoch: 68, train_loss: 0.3820, test_loss: 1.3777, test_f1: 0.6794
 epoch: 69, train_loss: 0.3912, test_loss: 1.3046, test_f1: 0.6798
 epoch: 70, train_loss: 0.3846, test_loss: 1.3491, test_f1: 0.6252
 epoch: 71, train_loss: 0.3676, test_loss: 1.3049, test_f1: 0.6421
 epoch: 72, train_loss: 0.3747, test_loss: 1.6429, test_f1: 0.6635
 epoch: 73, train_loss: 0.3694, test_loss: 1.4239, test_f1: 0.6811
 epoch: 74, train_loss: 0.3625, test_loss: 1.3024, test_f1: 0.6827
 epoch: 75, train_loss: 0.3781, test_loss: 1.2992, test_f1: 0.6645
 epoch: 76, train_loss: 0.3795, test_loss: 1.5921, test_f1: 0.6140
 epoch: 77, train_loss: 0.3766, test_loss: 1.3335, test_f1: 0.6641
 epoch: 78, train_loss: 0.3532, test_loss: 1.3504, test_f1: 0.6836
 epoch: 79, train_loss: 0.3352, test_loss: 1.4354, test_f1: 0.6697
 epoch: 80, train_loss: 0.3325, test_loss: 1.4778, test_f1: 0.6336
 epoch: 81, train_loss: 0.3640, test_loss: 1.4611, test_f1: 0.6659
 epoch: 82, train_loss: 0.3420, test_loss: 1.2260, test_f1: 0.6549
 epoch: 83, train_loss: 0.3620, test_loss: 1.5153, test_f1: 0.6707
 epoch: 84, train_loss: 0.3477, test_loss: 1.4106, test_f1: 0.6570
 epoch: 85, train_loss: 0.3250, test_loss: 1.4160, test_f1: 0.6547
 epoch: 86, train_loss: 0.3500, test_loss: 1.4901, test_f1: 0.6400
 epoch: 87, train_loss: 0.3730, test_loss: 1.6033, test_f1: 0.6698
 epoch: 88, train_loss: 0.3537, test_loss: 1.5914, test_f1: 0.6509
 epoch: 89, train_loss: 0.3504, test_loss: 1.3167, test_f1: 0.6632
 epoch: 90, train_loss: 0.3678, test_loss: 1.3669, test_f1: 0.6700
 epoch: 91, train_loss: 0.3299, test_loss: 1.5837, test_f1: 0.6234
 epoch: 92, train_loss: 0.3246, test_loss: 1.4972, test_f1: 0.6721
 epoch: 93, train_loss: 0.3263, test_loss: 1.4061, test_f1: 0.6664
 epoch: 94, train_loss: 0.3137, test_loss: 1.5232, test_f1: 0.6345
 epoch: 95, train_loss: 0.3544, test_loss: 1.5035, test_f1: 0.6694
 epoch: 96, train_loss: 0.3330, test_loss: 1.4065, test_f1: 0.6709
 epoch: 97, train_loss: 0.3218, test_loss: 1.5596, test_f1: 0.6457
 epoch: 98, train_loss: 0.3135, test_loss: 1.3473, test_f1: 0.6718
 epoch: 99, train_loss: 0.3138, test_loss: 1.4478, test_f1: 0.6578
##################ITERATION #4 ****************************************
 epoch: 0, train_loss: 1.3557, test_loss: 1.5676, test_f1: 0.2490
 epoch: 1, train_loss: 0.9894, test_loss: 1.3368, test_f1: 0.2270
 epoch: 2, train_loss: 0.9568, test_loss: 1.0124, test_f1: 0.4211
 epoch: 3, train_loss: 0.9361, test_loss: 0.9872, test_f1: 0.4678
 epoch: 4, train_loss: 0.9135, test_loss: 0.9381, test_f1: 0.4950
 epoch: 5, train_loss: 0.8828, test_loss: 0.8809, test_f1: 0.5209
 epoch: 6, train_loss: 0.8466, test_loss: 0.9792, test_f1: 0.5050
 epoch: 7, train_loss: 0.8441, test_loss: 0.8651, test_f1: 0.5698
 epoch: 8, train_loss: 0.8403, test_loss: 0.8565, test_f1: 0.5988
 epoch: 9, train_loss: 0.8101, test_loss: 1.1408, test_f1: 0.4679
 epoch: 10, train_loss: 0.7936, test_loss: 1.1503, test_f1: 0.5331
 epoch: 11, train_loss: 0.7866, test_loss: 0.9201, test_f1: 0.5671
 epoch: 12, train_loss: 0.7608, test_loss: 0.8852, test_f1: 0.6014
 epoch: 13, train_loss: 0.7454, test_loss: 0.9350, test_f1: 0.5465
 epoch: 14, train_loss: 0.7478, test_loss: 0.9571, test_f1: 0.5547
 epoch: 15, train_loss: 0.7381, test_loss: 0.8855, test_f1: 0.6091
 epoch: 16, train_loss: 0.7231, test_loss: 0.8229, test_f1: 0.6324
 epoch: 17, train_loss: 0.6935, test_loss: 0.8437, test_f1: 0.6282
 epoch: 18, train_loss: 0.6855, test_loss: 0.8801, test_f1: 0.6015
 epoch: 19, train_loss: 0.6855, test_loss: 1.2807, test_f1: 0.5270
 epoch: 20, train_loss: 0.7115, test_loss: 1.3697, test_f1: 0.5342
 epoch: 21, train_loss: 0.6714, test_loss: 0.8975, test_f1: 0.6465
 epoch: 22, train_loss: 0.6682, test_loss: 0.7818, test_f1: 0.6661
 epoch: 23, train_loss: 0.6420, test_loss: 0.7636, test_f1: 0.6594
 epoch: 24, train_loss: 0.6539, test_loss: 0.7991, test_f1: 0.6109
 epoch: 25, train_loss: 0.6280, test_loss: 0.8362, test_f1: 0.6336
 epoch: 26, train_loss: 0.6280, test_loss: 0.9667, test_f1: 0.6184
 epoch: 27, train_loss: 0.6181, test_loss: 0.8930, test_f1: 0.6152
 epoch: 28, train_loss: 0.5995, test_loss: 1.1133, test_f1: 0.6003
 epoch: 29, train_loss: 0.6106, test_loss: 1.0702, test_f1: 0.5743
 epoch: 30, train_loss: 0.6031, test_loss: 0.8028, test_f1: 0.6457
 epoch: 31, train_loss: 0.5821, test_loss: 0.8734, test_f1: 0.5798
 epoch: 32, train_loss: 0.5677, test_loss: 0.8733, test_f1: 0.6450
 epoch: 33, train_loss: 0.5683, test_loss: 0.9065, test_f1: 0.6069
 epoch: 34, train_loss: 0.5962, test_loss: 0.7492, test_f1: 0.6764
 epoch: 35, train_loss: 0.5615, test_loss: 0.9587, test_f1: 0.6464
 epoch: 36, train_loss: 0.5584, test_loss: 0.9530, test_f1: 0.6402
 epoch: 37, train_loss: 0.5624, test_loss: 0.9960, test_f1: 0.6211
 epoch: 38, train_loss: 0.5594, test_loss: 0.8187, test_f1: 0.6840
 epoch: 39, train_loss: 0.5664, test_loss: 0.8192, test_f1: 0.6632
 epoch: 40, train_loss: 0.5453, test_loss: 0.9996, test_f1: 0.6487
 epoch: 41, train_loss: 0.5171, test_loss: 1.0809, test_f1: 0.6345
 epoch: 42, train_loss: 0.5214, test_loss: 0.9033, test_f1: 0.6646
 epoch: 43, train_loss: 0.5371, test_loss: 0.8781, test_f1: 0.6814
 epoch: 44, train_loss: 0.5146, test_loss: 1.1232, test_f1: 0.6471
 epoch: 45, train_loss: 0.5066, test_loss: 0.9929, test_f1: 0.6480
 epoch: 46, train_loss: 0.5056, test_loss: 0.8719, test_f1: 0.6807
 epoch: 47, train_loss: 0.5255, test_loss: 1.1402, test_f1: 0.6333
 epoch: 48, train_loss: 0.5107, test_loss: 1.0557, test_f1: 0.6472
 epoch: 49, train_loss: 0.5221, test_loss: 0.9715, test_f1: 0.6064
 epoch: 50, train_loss: 0.5209, test_loss: 1.1355, test_f1: 0.6243
 epoch: 51, train_loss: 0.4894, test_loss: 0.9476, test_f1: 0.6755
 epoch: 52, train_loss: 0.4532, test_loss: 1.0304, test_f1: 0.6758
 epoch: 53, train_loss: 0.4199, test_loss: 0.9562, test_f1: 0.6698
 epoch: 54, train_loss: 0.4363, test_loss: 0.9542, test_f1: 0.6684
 epoch: 55, train_loss: 0.4251, test_loss: 0.8990, test_f1: 0.6930
 epoch: 56, train_loss: 0.4125, test_loss: 1.0155, test_f1: 0.6796
 epoch: 57, train_loss: 0.3956, test_loss: 1.0424, test_f1: 0.6722
 epoch: 58, train_loss: 0.3968, test_loss: 1.1273, test_f1: 0.6654
 epoch: 59, train_loss: 0.3831, test_loss: 1.0658, test_f1: 0.6830
 epoch: 60, train_loss: 0.3730, test_loss: 1.0255, test_f1: 0.6941
 epoch: 61, train_loss: 0.4003, test_loss: 1.0496, test_f1: 0.6667
 epoch: 62, train_loss: 0.3899, test_loss: 1.2117, test_f1: 0.6682
 epoch: 63, train_loss: 0.3849, test_loss: 1.0568, test_f1: 0.6949
 epoch: 64, train_loss: 0.3883, test_loss: 1.0804, test_f1: 0.6841
 epoch: 65, train_loss: 0.3846, test_loss: 0.9762, test_f1: 0.6804
 epoch: 66, train_loss: 0.3893, test_loss: 1.0668, test_f1: 0.6682
 epoch: 67, train_loss: 0.3768, test_loss: 1.1118, test_f1: 0.6664
 epoch: 68, train_loss: 0.3765, test_loss: 1.0292, test_f1: 0.7016
 epoch: 69, train_loss: 0.3560, test_loss: 1.0896, test_f1: 0.6810
 epoch: 70, train_loss: 0.3595, test_loss: 1.1972, test_f1: 0.6738
 epoch: 71, train_loss: 0.3870, test_loss: 0.9798, test_f1: 0.7048
 epoch: 72, train_loss: 0.3824, test_loss: 1.1517, test_f1: 0.6694
 epoch: 73, train_loss: 0.3906, test_loss: 1.3183, test_f1: 0.6389
 epoch: 74, train_loss: 0.3761, test_loss: 1.3269, test_f1: 0.6654
 epoch: 75, train_loss: 0.3861, test_loss: 1.1225, test_f1: 0.6847
 epoch: 76, train_loss: 0.3613, test_loss: 1.1126, test_f1: 0.7022
 epoch: 77, train_loss: 0.3623, test_loss: 1.1576, test_f1: 0.6658
 epoch: 78, train_loss: 0.3587, test_loss: 1.0744, test_f1: 0.6608
 epoch: 79, train_loss: 0.3417, test_loss: 1.1522, test_f1: 0.6678
 epoch: 80, train_loss: 0.3419, test_loss: 1.1245, test_f1: 0.6843
 epoch: 81, train_loss: 0.3366, test_loss: 1.2546, test_f1: 0.6442
 epoch: 82, train_loss: 0.3224, test_loss: 1.3513, test_f1: 0.6738
 epoch: 83, train_loss: 0.3344, test_loss: 1.1578, test_f1: 0.6761
 epoch: 84, train_loss: 0.3152, test_loss: 1.1934, test_f1: 0.6613
 epoch: 85, train_loss: 0.3105, test_loss: 1.2365, test_f1: 0.6327
 epoch: 86, train_loss: 0.3266, test_loss: 1.2843, test_f1: 0.6624
 epoch: 87, train_loss: 0.3335, test_loss: 1.4308, test_f1: 0.6366
 epoch: 88, train_loss: 0.3063, test_loss: 1.1504, test_f1: 0.6996
 epoch: 89, train_loss: 0.3282, test_loss: 1.0611, test_f1: 0.6968
 epoch: 90, train_loss: 0.3299, test_loss: 1.1440, test_f1: 0.6799
 epoch: 91, train_loss: 0.3482, test_loss: 1.1360, test_f1: 0.6957
 epoch: 92, train_loss: 0.3125, test_loss: 1.1247, test_f1: 0.6769
 epoch: 93, train_loss: 0.3154, test_loss: 1.3090, test_f1: 0.6703
 epoch: 94, train_loss: 0.3364, test_loss: 1.2070, test_f1: 0.6907
 epoch: 95, train_loss: 0.3187, test_loss: 1.2932, test_f1: 0.6517
 epoch: 96, train_loss: 0.3120, test_loss: 1.2650, test_f1: 0.6882
 epoch: 97, train_loss: 0.2871, test_loss: 1.2515, test_f1: 0.7077
 epoch: 98, train_loss: 0.2965, test_loss: 1.1463, test_f1: 0.6900
 epoch: 99, train_loss: 0.2883, test_loss: 1.2132, test_f1: 0.6901
##################ITERATION #5 ****************************************
 epoch: 0, train_loss: 1.3368, test_loss: 1.4764, test_f1: 0.2270
 epoch: 1, train_loss: 1.0068, test_loss: 1.1907, test_f1: 0.3710
 epoch: 2, train_loss: 0.9759, test_loss: 1.0774, test_f1: 0.3926
 epoch: 3, train_loss: 0.9483, test_loss: 1.0084, test_f1: 0.5037
 epoch: 4, train_loss: 0.9082, test_loss: 1.0544, test_f1: 0.5241
 epoch: 5, train_loss: 0.8921, test_loss: 0.9804, test_f1: 0.5256
 epoch: 6, train_loss: 0.8612, test_loss: 0.9541, test_f1: 0.5313
 epoch: 7, train_loss: 0.8419, test_loss: 0.8715, test_f1: 0.5612
 epoch: 8, train_loss: 0.8510, test_loss: 1.3286, test_f1: 0.4761
 epoch: 9, train_loss: 0.8208, test_loss: 1.0949, test_f1: 0.5360
 epoch: 10, train_loss: 0.8024, test_loss: 1.4420, test_f1: 0.4527
 epoch: 11, train_loss: 0.7903, test_loss: 0.8983, test_f1: 0.5499
 epoch: 12, train_loss: 0.7877, test_loss: 0.9337, test_f1: 0.5281
 epoch: 13, train_loss: 0.7737, test_loss: 1.0071, test_f1: 0.5702
 epoch: 14, train_loss: 0.7565, test_loss: 1.0647, test_f1: 0.5458
 epoch: 15, train_loss: 0.7564, test_loss: 1.1378, test_f1: 0.5308
 epoch: 16, train_loss: 0.7433, test_loss: 1.1034, test_f1: 0.5631
 epoch: 17, train_loss: 0.7175, test_loss: 0.9746, test_f1: 0.5883
 epoch: 18, train_loss: 0.7229, test_loss: 1.0939, test_f1: 0.4560
 epoch: 19, train_loss: 0.7195, test_loss: 0.9516, test_f1: 0.5749
 epoch: 20, train_loss: 0.7219, test_loss: 1.1296, test_f1: 0.5867
 epoch: 21, train_loss: 0.7239, test_loss: 0.8652, test_f1: 0.5507
 epoch: 22, train_loss: 0.6992, test_loss: 1.0325, test_f1: 0.6083
 epoch: 23, train_loss: 0.6894, test_loss: 1.3165, test_f1: 0.5334
 epoch: 24, train_loss: 0.6700, test_loss: 1.0225, test_f1: 0.6262
 epoch: 25, train_loss: 0.6665, test_loss: 0.9616, test_f1: 0.6296
 epoch: 26, train_loss: 0.6688, test_loss: 1.0747, test_f1: 0.5769
 epoch: 27, train_loss: 0.6518, test_loss: 1.0133, test_f1: 0.6543
 epoch: 28, train_loss: 0.6752, test_loss: 0.9526, test_f1: 0.6028
 epoch: 29, train_loss: 0.6470, test_loss: 1.1302, test_f1: 0.5991
 epoch: 30, train_loss: 0.6315, test_loss: 1.0060, test_f1: 0.6350
 epoch: 31, train_loss: 0.6224, test_loss: 1.4766, test_f1: 0.5327
 epoch: 32, train_loss: 0.6372, test_loss: 1.1172, test_f1: 0.6513
 epoch: 33, train_loss: 0.6111, test_loss: 1.0038, test_f1: 0.6452
 epoch: 34, train_loss: 0.6022, test_loss: 1.3116, test_f1: 0.6087
 epoch: 35, train_loss: 0.5800, test_loss: 1.3432, test_f1: 0.6093
 epoch: 36, train_loss: 0.6064, test_loss: 2.1433, test_f1: 0.4986
 epoch: 37, train_loss: 0.6142, test_loss: 1.2015, test_f1: 0.6247
 epoch: 38, train_loss: 0.6036, test_loss: 1.1120, test_f1: 0.6468
 epoch: 39, train_loss: 0.5744, test_loss: 1.1605, test_f1: 0.6257
 epoch: 40, train_loss: 0.5536, test_loss: 1.3572, test_f1: 0.5807
 epoch: 41, train_loss: 0.5714, test_loss: 1.6497, test_f1: 0.5364
 epoch: 42, train_loss: 0.5371, test_loss: 1.0610, test_f1: 0.6379
 epoch: 43, train_loss: 0.5364, test_loss: 1.2317, test_f1: 0.6372
 epoch: 44, train_loss: 0.5313, test_loss: 1.2299, test_f1: 0.6555
 epoch: 45, train_loss: 0.5354, test_loss: 0.9816, test_f1: 0.6416
 epoch: 46, train_loss: 0.5452, test_loss: 1.2849, test_f1: 0.5951
 epoch: 47, train_loss: 0.5540, test_loss: 1.2259, test_f1: 0.6211
 epoch: 48, train_loss: 0.5384, test_loss: 1.3471, test_f1: 0.5931
 epoch: 49, train_loss: 0.5279, test_loss: 1.3889, test_f1: 0.5698
 epoch: 50, train_loss: 0.5681, test_loss: 1.4334, test_f1: 0.5548
 epoch: 51, train_loss: 0.5420, test_loss: 1.2620, test_f1: 0.6867
 epoch: 52, train_loss: 0.4835, test_loss: 1.2766, test_f1: 0.6741
 epoch: 53, train_loss: 0.4812, test_loss: 1.1524, test_f1: 0.6920
 epoch: 54, train_loss: 0.4635, test_loss: 1.3216, test_f1: 0.6546
 epoch: 55, train_loss: 0.4410, test_loss: 1.2391, test_f1: 0.6431
 epoch: 56, train_loss: 0.4225, test_loss: 1.2472, test_f1: 0.6550
 epoch: 57, train_loss: 0.4495, test_loss: 1.3774, test_f1: 0.6602
 epoch: 58, train_loss: 0.4291, test_loss: 1.3008, test_f1: 0.6777
 epoch: 59, train_loss: 0.4444, test_loss: 1.3286, test_f1: 0.6653
 epoch: 60, train_loss: 0.4227, test_loss: 1.2906, test_f1: 0.6854
 epoch: 61, train_loss: 0.4238, test_loss: 1.3257, test_f1: 0.6518
 epoch: 62, train_loss: 0.4060, test_loss: 1.3296, test_f1: 0.6861
 epoch: 63, train_loss: 0.4283, test_loss: 1.5978, test_f1: 0.6299
 epoch: 64, train_loss: 0.4305, test_loss: 1.5322, test_f1: 0.6408
 epoch: 65, train_loss: 0.4418, test_loss: 1.5732, test_f1: 0.6679
 epoch: 66, train_loss: 0.4023, test_loss: 1.5421, test_f1: 0.6392
 epoch: 67, train_loss: 0.4063, test_loss: 1.4682, test_f1: 0.6964
 epoch: 68, train_loss: 0.4124, test_loss: 1.3913, test_f1: 0.6667
 epoch: 69, train_loss: 0.4108, test_loss: 1.4080, test_f1: 0.6615
 epoch: 70, train_loss: 0.3975, test_loss: 1.4414, test_f1: 0.6453
 epoch: 71, train_loss: 0.4062, test_loss: 1.4414, test_f1: 0.6596
 epoch: 72, train_loss: 0.3983, test_loss: 1.4890, test_f1: 0.6597
 epoch: 73, train_loss: 0.3814, test_loss: 1.5913, test_f1: 0.6529
 epoch: 74, train_loss: 0.3934, test_loss: 1.4440, test_f1: 0.6710
 epoch: 75, train_loss: 0.3892, test_loss: 1.5319, test_f1: 0.6501
 epoch: 76, train_loss: 0.3638, test_loss: 1.5964, test_f1: 0.6424
 epoch: 77, train_loss: 0.3932, test_loss: 1.5482, test_f1: 0.6720
 epoch: 78, train_loss: 0.3673, test_loss: 1.7570, test_f1: 0.6108
 epoch: 79, train_loss: 0.3784, test_loss: 1.5967, test_f1: 0.6441
 epoch: 80, train_loss: 0.3776, test_loss: 1.6023, test_f1: 0.6278
 epoch: 81, train_loss: 0.3965, test_loss: 1.6704, test_f1: 0.6406
 epoch: 82, train_loss: 0.3743, test_loss: 1.6492, test_f1: 0.6544
 epoch: 83, train_loss: 0.3648, test_loss: 1.6576, test_f1: 0.6494
 epoch: 84, train_loss: 0.3506, test_loss: 1.4978, test_f1: 0.6706
 epoch: 85, train_loss: 0.3587, test_loss: 1.6988, test_f1: 0.6740
 epoch: 86, train_loss: 0.3559, test_loss: 1.7805, test_f1: 0.6358
 epoch: 87, train_loss: 0.3520, test_loss: 1.6208, test_f1: 0.6565
 epoch: 88, train_loss: 0.3671, test_loss: 1.5814, test_f1: 0.6537
 epoch: 89, train_loss: 0.3424, test_loss: 1.5207, test_f1: 0.6701
 epoch: 90, train_loss: 0.3518, test_loss: 1.6507, test_f1: 0.6638
 epoch: 91, train_loss: 0.3480, test_loss: 1.7314, test_f1: 0.6638
 epoch: 92, train_loss: 0.3559, test_loss: 1.6813, test_f1: 0.6692
 epoch: 93, train_loss: 0.3297, test_loss: 1.9167, test_f1: 0.6539
 epoch: 94, train_loss: 0.3517, test_loss: 1.8463, test_f1: 0.6725
 epoch: 95, train_loss: 0.3552, test_loss: 2.0688, test_f1: 0.6210
 epoch: 96, train_loss: 0.3734, test_loss: 1.8152, test_f1: 0.6739
 epoch: 97, train_loss: 0.3454, test_loss: 1.8291, test_f1: 0.6790
 epoch: 98, train_loss: 0.3197, test_loss: 1.8190, test_f1: 0.6542
 epoch: 99, train_loss: 0.3215, test_loss: 1.7427, test_f1: 0.6337
##################ITERATION #6 ****************************************
 epoch: 0, train_loss: 1.6186, test_loss: 1.4826, test_f1: 0.2270
 epoch: 1, train_loss: 1.0431, test_loss: 1.2540, test_f1: 0.2345
 epoch: 2, train_loss: 0.9914, test_loss: 1.0070, test_f1: 0.4105
 epoch: 3, train_loss: 0.9642, test_loss: 0.9893, test_f1: 0.4207
 epoch: 4, train_loss: 0.9421, test_loss: 0.9974, test_f1: 0.4568
 epoch: 5, train_loss: 0.9266, test_loss: 0.9154, test_f1: 0.5183
 epoch: 6, train_loss: 0.9067, test_loss: 0.9362, test_f1: 0.5196
 epoch: 7, train_loss: 0.8748, test_loss: 0.9564, test_f1: 0.5253
 epoch: 8, train_loss: 0.8570, test_loss: 1.0526, test_f1: 0.5308
 epoch: 9, train_loss: 0.8530, test_loss: 0.9737, test_f1: 0.5042
 epoch: 10, train_loss: 0.8299, test_loss: 0.8931, test_f1: 0.5237
 epoch: 11, train_loss: 0.8306, test_loss: 0.9603, test_f1: 0.5352
 epoch: 12, train_loss: 0.8015, test_loss: 0.8854, test_f1: 0.5351
 epoch: 13, train_loss: 0.7861, test_loss: 0.9442, test_f1: 0.5468
 epoch: 14, train_loss: 0.7659, test_loss: 0.9969, test_f1: 0.5501
 epoch: 15, train_loss: 0.7736, test_loss: 1.0146, test_f1: 0.5259
 epoch: 16, train_loss: 0.7636, test_loss: 0.9198, test_f1: 0.5875
 epoch: 17, train_loss: 0.7608, test_loss: 0.8579, test_f1: 0.6048
 epoch: 18, train_loss: 0.7475, test_loss: 1.1495, test_f1: 0.5662
 epoch: 19, train_loss: 0.7221, test_loss: 1.0196, test_f1: 0.5973
 epoch: 20, train_loss: 0.7201, test_loss: 0.9070, test_f1: 0.5963
 epoch: 21, train_loss: 0.7060, test_loss: 0.8723, test_f1: 0.5644
 epoch: 22, train_loss: 0.6912, test_loss: 1.0435, test_f1: 0.6070
 epoch: 23, train_loss: 0.6999, test_loss: 1.3732, test_f1: 0.4704
 epoch: 24, train_loss: 0.7082, test_loss: 1.2664, test_f1: 0.5132
 epoch: 25, train_loss: 0.6887, test_loss: 1.1439, test_f1: 0.5971
 epoch: 26, train_loss: 0.6771, test_loss: 0.9607, test_f1: 0.5595
 epoch: 27, train_loss: 0.6785, test_loss: 1.0449, test_f1: 0.5981
 epoch: 28, train_loss: 0.6546, test_loss: 0.9836, test_f1: 0.6175
 epoch: 29, train_loss: 0.6530, test_loss: 1.0035, test_f1: 0.6015
 epoch: 30, train_loss: 0.6519, test_loss: 1.2871, test_f1: 0.4734
 epoch: 31, train_loss: 0.6462, test_loss: 0.9502, test_f1: 0.6263
 epoch: 32, train_loss: 0.6269, test_loss: 1.0078, test_f1: 0.6307
 epoch: 33, train_loss: 0.6075, test_loss: 1.0784, test_f1: 0.6118
 epoch: 34, train_loss: 0.6180, test_loss: 0.9331, test_f1: 0.6620
 epoch: 35, train_loss: 0.6330, test_loss: 1.0735, test_f1: 0.5872
 epoch: 36, train_loss: 0.6227, test_loss: 1.1464, test_f1: 0.5606
 epoch: 37, train_loss: 0.6095, test_loss: 0.9694, test_f1: 0.6408
 epoch: 38, train_loss: 0.5931, test_loss: 1.0886, test_f1: 0.6359
 epoch: 39, train_loss: 0.5950, test_loss: 1.2773, test_f1: 0.5633
 epoch: 40, train_loss: 0.5895, test_loss: 1.0231, test_f1: 0.6721
 epoch: 41, train_loss: 0.5662, test_loss: 1.2381, test_f1: 0.5447
 epoch: 42, train_loss: 0.5687, test_loss: 1.0825, test_f1: 0.5972
 epoch: 43, train_loss: 0.5648, test_loss: 1.0744, test_f1: 0.6126
 epoch: 44, train_loss: 0.5312, test_loss: 1.6942, test_f1: 0.5579
 epoch: 45, train_loss: 0.5601, test_loss: 1.1023, test_f1: 0.6049
 epoch: 46, train_loss: 0.5482, test_loss: 1.0682, test_f1: 0.6316
 epoch: 47, train_loss: 0.5438, test_loss: 0.9968, test_f1: 0.5992
 epoch: 48, train_loss: 0.5476, test_loss: 1.3375, test_f1: 0.5969
 epoch: 49, train_loss: 0.5535, test_loss: 0.9897, test_f1: 0.5977
 epoch: 50, train_loss: 0.5327, test_loss: 1.2048, test_f1: 0.6564
 epoch: 51, train_loss: 0.5093, test_loss: 1.1424, test_f1: 0.6888
 epoch: 52, train_loss: 0.4733, test_loss: 1.0193, test_f1: 0.6934
 epoch: 53, train_loss: 0.4648, test_loss: 1.0217, test_f1: 0.6710
 epoch: 54, train_loss: 0.4776, test_loss: 1.1342, test_f1: 0.6276
 epoch: 55, train_loss: 0.4393, test_loss: 1.1258, test_f1: 0.6415
 epoch: 56, train_loss: 0.4330, test_loss: 1.0194, test_f1: 0.6845
 epoch: 57, train_loss: 0.4401, test_loss: 1.0243, test_f1: 0.6727
 epoch: 58, train_loss: 0.4325, test_loss: 1.2165, test_f1: 0.6371
 epoch: 59, train_loss: 0.4630, test_loss: 1.2246, test_f1: 0.6479
 epoch: 60, train_loss: 0.4298, test_loss: 1.1197, test_f1: 0.6502
 epoch: 61, train_loss: 0.4154, test_loss: 1.2322, test_f1: 0.6345
 epoch: 62, train_loss: 0.4105, test_loss: 1.1152, test_f1: 0.6415
 epoch: 63, train_loss: 0.3978, test_loss: 1.1816, test_f1: 0.6324
 epoch: 64, train_loss: 0.4180, test_loss: 1.3323, test_f1: 0.6288
 epoch: 65, train_loss: 0.4166, test_loss: 1.2831, test_f1: 0.6150
 epoch: 66, train_loss: 0.4383, test_loss: 1.1349, test_f1: 0.6751
 epoch: 67, train_loss: 0.4254, test_loss: 1.0181, test_f1: 0.6672
 epoch: 68, train_loss: 0.3927, test_loss: 1.2614, test_f1: 0.6585
 epoch: 69, train_loss: 0.4173, test_loss: 1.2009, test_f1: 0.6581
 epoch: 70, train_loss: 0.4122, test_loss: 1.1654, test_f1: 0.6495
 epoch: 71, train_loss: 0.3885, test_loss: 1.2220, test_f1: 0.6592
 epoch: 72, train_loss: 0.3942, test_loss: 1.1809, test_f1: 0.6449
 epoch: 73, train_loss: 0.4023, test_loss: 1.4152, test_f1: 0.6173
 epoch: 74, train_loss: 0.3630, test_loss: 1.4044, test_f1: 0.6352
 epoch: 75, train_loss: 0.3692, test_loss: 1.2150, test_f1: 0.6745
 epoch: 76, train_loss: 0.3666, test_loss: 1.3323, test_f1: 0.6286
 epoch: 77, train_loss: 0.3813, test_loss: 1.2551, test_f1: 0.6447
 epoch: 78, train_loss: 0.3675, test_loss: 1.2157, test_f1: 0.6944
 epoch: 79, train_loss: 0.3826, test_loss: 1.3592, test_f1: 0.6344
 epoch: 80, train_loss: 0.3710, test_loss: 1.1360, test_f1: 0.6418
 epoch: 81, train_loss: 0.3797, test_loss: 1.4235, test_f1: 0.6428
 epoch: 82, train_loss: 0.3806, test_loss: 1.4097, test_f1: 0.6627
 epoch: 83, train_loss: 0.3648, test_loss: 1.3696, test_f1: 0.6275
 epoch: 84, train_loss: 0.3513, test_loss: 1.4620, test_f1: 0.6242
 epoch: 85, train_loss: 0.3567, test_loss: 1.3934, test_f1: 0.6491
 epoch: 86, train_loss: 0.3375, test_loss: 1.3817, test_f1: 0.6269
 epoch: 87, train_loss: 0.3523, test_loss: 1.3054, test_f1: 0.6547
 epoch: 88, train_loss: 0.3568, test_loss: 1.4778, test_f1: 0.6786
 epoch: 89, train_loss: 0.3727, test_loss: 1.2978, test_f1: 0.6349
 epoch: 90, train_loss: 0.3577, test_loss: 1.4182, test_f1: 0.6417
 epoch: 91, train_loss: 0.3621, test_loss: 1.3190, test_f1: 0.6787
 epoch: 92, train_loss: 0.3459, test_loss: 1.3154, test_f1: 0.6512
 epoch: 93, train_loss: 0.3416, test_loss: 1.5564, test_f1: 0.6215
 epoch: 94, train_loss: 0.3247, test_loss: 1.4110, test_f1: 0.6460
 epoch: 95, train_loss: 0.3438, test_loss: 1.3411, test_f1: 0.6556
 epoch: 96, train_loss: 0.3310, test_loss: 1.4783, test_f1: 0.6419
 epoch: 97, train_loss: 0.3419, test_loss: 1.5023, test_f1: 0.6449
 epoch: 98, train_loss: 0.3553, test_loss: 1.2939, test_f1: 0.6265
 epoch: 99, train_loss: 0.3497, test_loss: 1.4407, test_f1: 0.6420
##################ITERATION #7 ****************************************
 epoch: 0, train_loss: 1.5060, test_loss: 1.2558, test_f1: 0.2534
 epoch: 1, train_loss: 1.0303, test_loss: 1.1435, test_f1: 0.3195
 epoch: 2, train_loss: 0.9964, test_loss: 0.9942, test_f1: 0.4814
 epoch: 3, train_loss: 0.9590, test_loss: 1.0318, test_f1: 0.5061
 epoch: 4, train_loss: 0.9415, test_loss: 0.9176, test_f1: 0.4751
 epoch: 5, train_loss: 0.9016, test_loss: 0.8694, test_f1: 0.5575
 epoch: 6, train_loss: 0.8923, test_loss: 0.9452, test_f1: 0.5210
 epoch: 7, train_loss: 0.8943, test_loss: 0.9407, test_f1: 0.4936
 epoch: 8, train_loss: 0.8623, test_loss: 0.9112, test_f1: 0.5006
 epoch: 9, train_loss: 0.8470, test_loss: 0.9708, test_f1: 0.4980
 epoch: 10, train_loss: 0.8270, test_loss: 0.8391, test_f1: 0.5637
 epoch: 11, train_loss: 0.8176, test_loss: 0.9209, test_f1: 0.5018
 epoch: 12, train_loss: 0.8039, test_loss: 0.8353, test_f1: 0.5501
 epoch: 13, train_loss: 0.7788, test_loss: 0.8520, test_f1: 0.5491
 epoch: 14, train_loss: 0.7726, test_loss: 1.0089, test_f1: 0.4998
 epoch: 15, train_loss: 0.7542, test_loss: 0.8265, test_f1: 0.5685
 epoch: 16, train_loss: 0.7574, test_loss: 1.1736, test_f1: 0.5166
 epoch: 17, train_loss: 0.7420, test_loss: 0.8843, test_f1: 0.5627
 epoch: 18, train_loss: 0.7327, test_loss: 0.8768, test_f1: 0.5798
 epoch: 19, train_loss: 0.7340, test_loss: 0.7986, test_f1: 0.6115
 epoch: 20, train_loss: 0.7224, test_loss: 0.9205, test_f1: 0.5886
 epoch: 21, train_loss: 0.7103, test_loss: 1.1247, test_f1: 0.5009
 epoch: 22, train_loss: 0.7378, test_loss: 1.0611, test_f1: 0.5391
 epoch: 23, train_loss: 0.6995, test_loss: 0.9228, test_f1: 0.5634
 epoch: 24, train_loss: 0.6891, test_loss: 1.0072, test_f1: 0.6066
 epoch: 25, train_loss: 0.6747, test_loss: 0.8519, test_f1: 0.6087
 epoch: 26, train_loss: 0.6689, test_loss: 0.7635, test_f1: 0.6150
 epoch: 27, train_loss: 0.6599, test_loss: 0.8284, test_f1: 0.6318
 epoch: 28, train_loss: 0.6335, test_loss: 0.9249, test_f1: 0.6325
 epoch: 29, train_loss: 0.6472, test_loss: 0.8676, test_f1: 0.6060
 epoch: 30, train_loss: 0.6324, test_loss: 0.7459, test_f1: 0.6367
 epoch: 31, train_loss: 0.6538, test_loss: 0.8545, test_f1: 0.5935
 epoch: 32, train_loss: 0.6301, test_loss: 0.7794, test_f1: 0.6158
 epoch: 33, train_loss: 0.6243, test_loss: 0.8477, test_f1: 0.6233
 epoch: 34, train_loss: 0.6394, test_loss: 0.9920, test_f1: 0.6217
 epoch: 35, train_loss: 0.6238, test_loss: 1.0041, test_f1: 0.6117
 epoch: 36, train_loss: 0.6307, test_loss: 1.2232, test_f1: 0.4663
 epoch: 37, train_loss: 0.6288, test_loss: 0.9131, test_f1: 0.5815
 epoch: 38, train_loss: 0.6217, test_loss: 1.1074, test_f1: 0.5629
 epoch: 39, train_loss: 0.6035, test_loss: 0.9495, test_f1: 0.6182
 epoch: 40, train_loss: 0.5945, test_loss: 0.8752, test_f1: 0.6330
 epoch: 41, train_loss: 0.5891, test_loss: 0.7524, test_f1: 0.6623
 epoch: 42, train_loss: 0.5583, test_loss: 0.7742, test_f1: 0.6672
 epoch: 43, train_loss: 0.5643, test_loss: 0.8605, test_f1: 0.6609
 epoch: 44, train_loss: 0.5636, test_loss: 0.8459, test_f1: 0.6243
 epoch: 45, train_loss: 0.5615, test_loss: 1.0578, test_f1: 0.6205
 epoch: 46, train_loss: 0.5649, test_loss: 0.9158, test_f1: 0.6425
 epoch: 47, train_loss: 0.5441, test_loss: 1.3661, test_f1: 0.4846
 epoch: 48, train_loss: 0.5348, test_loss: 1.0892, test_f1: 0.6232
 epoch: 49, train_loss: 0.5474, test_loss: 0.9002, test_f1: 0.6191
 epoch: 50, train_loss: 0.5415, test_loss: 1.0956, test_f1: 0.5838
 epoch: 51, train_loss: 0.5095, test_loss: 0.9621, test_f1: 0.6588
 epoch: 52, train_loss: 0.4881, test_loss: 0.9568, test_f1: 0.6529
 epoch: 53, train_loss: 0.4838, test_loss: 0.8559, test_f1: 0.6431
 epoch: 54, train_loss: 0.4593, test_loss: 0.8737, test_f1: 0.6775
 epoch: 55, train_loss: 0.4355, test_loss: 0.9714, test_f1: 0.6432
 epoch: 56, train_loss: 0.4369, test_loss: 0.8859, test_f1: 0.6649
 epoch: 57, train_loss: 0.4330, test_loss: 0.8451, test_f1: 0.6601
 epoch: 58, train_loss: 0.4262, test_loss: 1.0118, test_f1: 0.6770
 epoch: 59, train_loss: 0.4292, test_loss: 0.9891, test_f1: 0.6581
 epoch: 60, train_loss: 0.4359, test_loss: 0.9346, test_f1: 0.6589
 epoch: 61, train_loss: 0.4298, test_loss: 0.9641, test_f1: 0.6718
 epoch: 62, train_loss: 0.4076, test_loss: 0.9372, test_f1: 0.6786
 epoch: 63, train_loss: 0.4084, test_loss: 1.0107, test_f1: 0.6539
 epoch: 64, train_loss: 0.4102, test_loss: 0.9882, test_f1: 0.6791
 epoch: 65, train_loss: 0.4066, test_loss: 0.9616, test_f1: 0.6681
 epoch: 66, train_loss: 0.4164, test_loss: 1.0872, test_f1: 0.6402
 epoch: 67, train_loss: 0.4241, test_loss: 1.0510, test_f1: 0.6681
 epoch: 68, train_loss: 0.4200, test_loss: 1.0662, test_f1: 0.6456
 epoch: 69, train_loss: 0.3935, test_loss: 1.0896, test_f1: 0.6605
 epoch: 70, train_loss: 0.3958, test_loss: 1.2473, test_f1: 0.6400
 epoch: 71, train_loss: 0.3893, test_loss: 1.0616, test_f1: 0.6373
 epoch: 72, train_loss: 0.3792, test_loss: 1.1332, test_f1: 0.6465
 epoch: 73, train_loss: 0.3698, test_loss: 1.0753, test_f1: 0.6434
 epoch: 74, train_loss: 0.3820, test_loss: 1.0795, test_f1: 0.6321
 epoch: 75, train_loss: 0.3831, test_loss: 1.1400, test_f1: 0.6442
 epoch: 76, train_loss: 0.3971, test_loss: 1.1383, test_f1: 0.6341
 epoch: 77, train_loss: 0.3672, test_loss: 1.0210, test_f1: 0.6492
 epoch: 78, train_loss: 0.3750, test_loss: 1.3405, test_f1: 0.6434
 epoch: 79, train_loss: 0.3647, test_loss: 1.1616, test_f1: 0.6212
 epoch: 80, train_loss: 0.3728, test_loss: 1.3174, test_f1: 0.6542
 epoch: 81, train_loss: 0.3793, test_loss: 1.2331, test_f1: 0.6167
 epoch: 82, train_loss: 0.3616, test_loss: 1.2273, test_f1: 0.6594
 epoch: 83, train_loss: 0.3407, test_loss: 1.3147, test_f1: 0.6550
 epoch: 84, train_loss: 0.3416, test_loss: 1.1131, test_f1: 0.6704
 epoch: 85, train_loss: 0.3406, test_loss: 1.2679, test_f1: 0.6483
 epoch: 86, train_loss: 0.3346, test_loss: 1.2455, test_f1: 0.6553
 epoch: 87, train_loss: 0.3295, test_loss: 1.3384, test_f1: 0.6236
 epoch: 88, train_loss: 0.3388, test_loss: 1.1345, test_f1: 0.6493
 epoch: 89, train_loss: 0.3468, test_loss: 1.2218, test_f1: 0.6630
 epoch: 90, train_loss: 0.3544, test_loss: 1.2325, test_f1: 0.6531
 epoch: 91, train_loss: 0.3508, test_loss: 1.1987, test_f1: 0.6380
 epoch: 92, train_loss: 0.3523, test_loss: 1.2909, test_f1: 0.5977
 epoch: 93, train_loss: 0.3414, test_loss: 1.1776, test_f1: 0.6443
 epoch: 94, train_loss: 0.3259, test_loss: 1.3025, test_f1: 0.6327
 epoch: 95, train_loss: 0.3009, test_loss: 1.4321, test_f1: 0.6407
 epoch: 96, train_loss: 0.3188, test_loss: 1.7091, test_f1: 0.6126
 epoch: 97, train_loss: 0.3231, test_loss: 1.3777, test_f1: 0.6265
 epoch: 98, train_loss: 0.3230, test_loss: 1.3437, test_f1: 0.6322
 epoch: 99, train_loss: 0.3194, test_loss: 1.3059, test_f1: 0.6282
##################ITERATION #8 ****************************************
 epoch: 0, train_loss: 1.5859, test_loss: 1.5062, test_f1: 0.3027
 epoch: 1, train_loss: 1.0340, test_loss: 1.1750, test_f1: 0.4101
 epoch: 2, train_loss: 0.9818, test_loss: 1.0406, test_f1: 0.4226
 epoch: 3, train_loss: 0.9435, test_loss: 0.9946, test_f1: 0.4275
 epoch: 4, train_loss: 0.9305, test_loss: 0.9913, test_f1: 0.5240
 epoch: 5, train_loss: 0.9095, test_loss: 1.0241, test_f1: 0.5220
 epoch: 6, train_loss: 0.8753, test_loss: 0.9162, test_f1: 0.5370
 epoch: 7, train_loss: 0.8598, test_loss: 0.9521, test_f1: 0.5453
 epoch: 8, train_loss: 0.8541, test_loss: 0.9655, test_f1: 0.4946
 epoch: 9, train_loss: 0.8353, test_loss: 0.9055, test_f1: 0.5647
 epoch: 10, train_loss: 0.8135, test_loss: 0.8399, test_f1: 0.5957
 epoch: 11, train_loss: 0.8050, test_loss: 0.9347, test_f1: 0.5630
 epoch: 12, train_loss: 0.7696, test_loss: 0.8405, test_f1: 0.6023
 epoch: 13, train_loss: 0.7817, test_loss: 0.9319, test_f1: 0.5741
 epoch: 14, train_loss: 0.7882, test_loss: 0.8078, test_f1: 0.6111
 epoch: 15, train_loss: 0.7597, test_loss: 0.8549, test_f1: 0.6071
 epoch: 16, train_loss: 0.7416, test_loss: 0.9352, test_f1: 0.5474
 epoch: 17, train_loss: 0.7372, test_loss: 0.9649, test_f1: 0.6014
 epoch: 18, train_loss: 0.7303, test_loss: 0.8447, test_f1: 0.6594
 epoch: 19, train_loss: 0.7004, test_loss: 0.8938, test_f1: 0.6054
 epoch: 20, train_loss: 0.7258, test_loss: 0.9791, test_f1: 0.5745
 epoch: 21, train_loss: 0.6988, test_loss: 1.1784, test_f1: 0.5410
 epoch: 22, train_loss: 0.6972, test_loss: 0.9298, test_f1: 0.5951
 epoch: 23, train_loss: 0.6759, test_loss: 0.9563, test_f1: 0.5932
 epoch: 24, train_loss: 0.6584, test_loss: 0.9375, test_f1: 0.6135
 epoch: 25, train_loss: 0.6630, test_loss: 0.9335, test_f1: 0.6179
 epoch: 26, train_loss: 0.6680, test_loss: 1.1806, test_f1: 0.5377
 epoch: 27, train_loss: 0.6471, test_loss: 1.0128, test_f1: 0.6224
 epoch: 28, train_loss: 0.6243, test_loss: 0.9483, test_f1: 0.6329
 epoch: 29, train_loss: 0.6095, test_loss: 0.8940, test_f1: 0.6369
 epoch: 30, train_loss: 0.6023, test_loss: 0.9795, test_f1: 0.5779
 epoch: 31, train_loss: 0.6309, test_loss: 1.1462, test_f1: 0.5987
 epoch: 32, train_loss: 0.6176, test_loss: 1.1250, test_f1: 0.6433
 epoch: 33, train_loss: 0.6493, test_loss: 1.2367, test_f1: 0.5592
 epoch: 34, train_loss: 0.6244, test_loss: 1.0221, test_f1: 0.5659
 epoch: 35, train_loss: 0.6155, test_loss: 0.9619, test_f1: 0.6377
 epoch: 36, train_loss: 0.6110, test_loss: 0.9872, test_f1: 0.6413
 epoch: 37, train_loss: 0.5998, test_loss: 1.1742, test_f1: 0.6322
 epoch: 38, train_loss: 0.5912, test_loss: 1.0870, test_f1: 0.6349
 epoch: 39, train_loss: 0.5615, test_loss: 1.0365, test_f1: 0.6559
 epoch: 40, train_loss: 0.5649, test_loss: 1.1785, test_f1: 0.6281
 epoch: 41, train_loss: 0.5632, test_loss: 1.2123, test_f1: 0.5784
 epoch: 42, train_loss: 0.5620, test_loss: 1.1683, test_f1: 0.6264
 epoch: 43, train_loss: 0.5383, test_loss: 1.2140, test_f1: 0.6197
 epoch: 44, train_loss: 0.5236, test_loss: 1.2848, test_f1: 0.5853
 epoch: 45, train_loss: 0.5522, test_loss: 1.1521, test_f1: 0.6312
 epoch: 46, train_loss: 0.5454, test_loss: 1.1589, test_f1: 0.6586
 epoch: 47, train_loss: 0.5249, test_loss: 1.2653, test_f1: 0.5866
 epoch: 48, train_loss: 0.5326, test_loss: 1.2174, test_f1: 0.6178
 epoch: 49, train_loss: 0.5076, test_loss: 1.3149, test_f1: 0.6149
 epoch: 50, train_loss: 0.4917, test_loss: 1.3263, test_f1: 0.6210
 epoch: 51, train_loss: 0.4800, test_loss: 1.3722, test_f1: 0.6008
 epoch: 52, train_loss: 0.4640, test_loss: 1.2213, test_f1: 0.6616
 epoch: 53, train_loss: 0.4483, test_loss: 1.3034, test_f1: 0.6623
 epoch: 54, train_loss: 0.4309, test_loss: 1.2492, test_f1: 0.6752
 epoch: 55, train_loss: 0.4586, test_loss: 1.3126, test_f1: 0.6372
 epoch: 56, train_loss: 0.4253, test_loss: 1.3461, test_f1: 0.6878
 epoch: 57, train_loss: 0.4357, test_loss: 1.3986, test_f1: 0.6414
 epoch: 58, train_loss: 0.4080, test_loss: 1.4935, test_f1: 0.6126
 epoch: 59, train_loss: 0.4222, test_loss: 1.4364, test_f1: 0.6647
 epoch: 60, train_loss: 0.4366, test_loss: 1.4254, test_f1: 0.6749
 epoch: 61, train_loss: 0.4322, test_loss: 1.5043, test_f1: 0.6500
 epoch: 62, train_loss: 0.4076, test_loss: 1.3408, test_f1: 0.6624
 epoch: 63, train_loss: 0.3925, test_loss: 1.4410, test_f1: 0.6544
 epoch: 64, train_loss: 0.4078, test_loss: 1.4952, test_f1: 0.6738
 epoch: 65, train_loss: 0.4020, test_loss: 1.3554, test_f1: 0.7105
 epoch: 66, train_loss: 0.4029, test_loss: 1.5436, test_f1: 0.6455
 epoch: 67, train_loss: 0.3914, test_loss: 1.4977, test_f1: 0.6425
 epoch: 68, train_loss: 0.4053, test_loss: 1.5301, test_f1: 0.6423
 epoch: 69, train_loss: 0.3901, test_loss: 1.4313, test_f1: 0.6415
 epoch: 70, train_loss: 0.3846, test_loss: 1.6933, test_f1: 0.6161
 epoch: 71, train_loss: 0.3684, test_loss: 1.6147, test_f1: 0.6527
 epoch: 72, train_loss: 0.3625, test_loss: 1.5748, test_f1: 0.6643
 epoch: 73, train_loss: 0.3735, test_loss: 1.6463, test_f1: 0.6445
 epoch: 74, train_loss: 0.3951, test_loss: 1.3173, test_f1: 0.6574
 epoch: 75, train_loss: 0.3797, test_loss: 1.5224, test_f1: 0.6412
 epoch: 76, train_loss: 0.3708, test_loss: 1.5613, test_f1: 0.6621
 epoch: 77, train_loss: 0.3858, test_loss: 1.5462, test_f1: 0.6612
 epoch: 78, train_loss: 0.3672, test_loss: 1.7916, test_f1: 0.6256
 epoch: 79, train_loss: 0.3764, test_loss: 1.4286, test_f1: 0.6667
 epoch: 80, train_loss: 0.3591, test_loss: 1.5732, test_f1: 0.6419
 epoch: 81, train_loss: 0.3677, test_loss: 1.5339, test_f1: 0.6512
 epoch: 82, train_loss: 0.3483, test_loss: 1.6963, test_f1: 0.6614
 epoch: 83, train_loss: 0.3716, test_loss: 1.7487, test_f1: 0.6203
 epoch: 84, train_loss: 0.3464, test_loss: 1.7503, test_f1: 0.6578
 epoch: 85, train_loss: 0.3707, test_loss: 1.8582, test_f1: 0.6486
 epoch: 86, train_loss: 0.3661, test_loss: 1.6301, test_f1: 0.6451
 epoch: 87, train_loss: 0.3531, test_loss: 1.8709, test_f1: 0.6279
 epoch: 88, train_loss: 0.3464, test_loss: 1.5472, test_f1: 0.6394
 epoch: 89, train_loss: 0.3401, test_loss: 1.7176, test_f1: 0.6482
 epoch: 90, train_loss: 0.3356, test_loss: 1.6199, test_f1: 0.6754
 epoch: 91, train_loss: 0.3341, test_loss: 1.6117, test_f1: 0.6920
 epoch: 92, train_loss: 0.3086, test_loss: 1.7489, test_f1: 0.6561
 epoch: 93, train_loss: 0.3182, test_loss: 1.6601, test_f1: 0.6560
 epoch: 94, train_loss: 0.2878, test_loss: 1.7849, test_f1: 0.6833
 epoch: 95, train_loss: 0.3275, test_loss: 1.7238, test_f1: 0.6444
 epoch: 96, train_loss: 0.3328, test_loss: 1.6687, test_f1: 0.6400
 epoch: 97, train_loss: 0.3088, test_loss: 1.7175, test_f1: 0.6472
 epoch: 98, train_loss: 0.2960, test_loss: 1.7053, test_f1: 0.6606
 epoch: 99, train_loss: 0.3357, test_loss: 1.6579, test_f1: 0.6554
##################ITERATION #9 ****************************************
 epoch: 0, train_loss: 1.3778, test_loss: 1.2785, test_f1: 0.2650
 epoch: 1, train_loss: 1.0049, test_loss: 1.0879, test_f1: 0.3460
 epoch: 2, train_loss: 0.9577, test_loss: 0.9797, test_f1: 0.4302
 epoch: 3, train_loss: 0.9218, test_loss: 0.9563, test_f1: 0.4248
 epoch: 4, train_loss: 0.8878, test_loss: 0.9056, test_f1: 0.4922
 epoch: 5, train_loss: 0.8828, test_loss: 0.8982, test_f1: 0.5243
 epoch: 6, train_loss: 0.8825, test_loss: 1.0635, test_f1: 0.4928
 epoch: 7, train_loss: 0.8552, test_loss: 0.9828, test_f1: 0.5205
 epoch: 8, train_loss: 0.8251, test_loss: 0.9842, test_f1: 0.5376
 epoch: 9, train_loss: 0.8146, test_loss: 0.9603, test_f1: 0.5688
 epoch: 10, train_loss: 0.7909, test_loss: 1.0989, test_f1: 0.5345
 epoch: 11, train_loss: 0.7922, test_loss: 0.8044, test_f1: 0.5988
 epoch: 12, train_loss: 0.7866, test_loss: 0.8227, test_f1: 0.6089
 epoch: 13, train_loss: 0.7619, test_loss: 0.8535, test_f1: 0.5984
 epoch: 14, train_loss: 0.7670, test_loss: 1.1417, test_f1: 0.4862
 epoch: 15, train_loss: 0.7588, test_loss: 0.9013, test_f1: 0.5577
 epoch: 16, train_loss: 0.7357, test_loss: 1.0316, test_f1: 0.5900
 epoch: 17, train_loss: 0.7107, test_loss: 0.9848, test_f1: 0.5898
 epoch: 18, train_loss: 0.7137, test_loss: 1.0472, test_f1: 0.5545
 epoch: 19, train_loss: 0.7083, test_loss: 0.9045, test_f1: 0.5763
 epoch: 20, train_loss: 0.7147, test_loss: 1.0895, test_f1: 0.5599
 epoch: 21, train_loss: 0.6809, test_loss: 1.1249, test_f1: 0.5793
 epoch: 22, train_loss: 0.7041, test_loss: 0.8896, test_f1: 0.6231
 epoch: 23, train_loss: 0.6748, test_loss: 0.8455, test_f1: 0.6028
 epoch: 24, train_loss: 0.6779, test_loss: 1.0823, test_f1: 0.5542
 epoch: 25, train_loss: 0.6610, test_loss: 0.9608, test_f1: 0.6206
 epoch: 26, train_loss: 0.6594, test_loss: 0.9850, test_f1: 0.6314
 epoch: 27, train_loss: 0.6730, test_loss: 1.1045, test_f1: 0.6253
 epoch: 28, train_loss: 0.6590, test_loss: 1.0080, test_f1: 0.6173
 epoch: 29, train_loss: 0.6207, test_loss: 1.1007, test_f1: 0.6142
 epoch: 30, train_loss: 0.6244, test_loss: 1.0728, test_f1: 0.6091
 epoch: 31, train_loss: 0.6460, test_loss: 1.1382, test_f1: 0.5900
 epoch: 32, train_loss: 0.6037, test_loss: 1.9397, test_f1: 0.4240
 epoch: 33, train_loss: 0.6171, test_loss: 1.1464, test_f1: 0.5893
 epoch: 34, train_loss: 0.5958, test_loss: 0.9241, test_f1: 0.6136
 epoch: 35, train_loss: 0.5927, test_loss: 0.8896, test_f1: 0.5998
 epoch: 36, train_loss: 0.5838, test_loss: 0.9331, test_f1: 0.6632
 epoch: 37, train_loss: 0.6172, test_loss: 1.1580, test_f1: 0.5890
 epoch: 38, train_loss: 0.6069, test_loss: 1.1235, test_f1: 0.6193
 epoch: 39, train_loss: 0.6044, test_loss: 1.1561, test_f1: 0.5304
 epoch: 40, train_loss: 0.5945, test_loss: 0.8912, test_f1: 0.6308
 epoch: 41, train_loss: 0.5987, test_loss: 1.0514, test_f1: 0.6239
 epoch: 42, train_loss: 0.5840, test_loss: 1.0988, test_f1: 0.5866
 epoch: 43, train_loss: 0.5514, test_loss: 1.1519, test_f1: 0.5706
 epoch: 44, train_loss: 0.5449, test_loss: 1.1335, test_f1: 0.6149
 epoch: 45, train_loss: 0.5464, test_loss: 1.1036, test_f1: 0.6394
 epoch: 46, train_loss: 0.5522, test_loss: 1.1444, test_f1: 0.6316
 epoch: 47, train_loss: 0.5295, test_loss: 1.0577, test_f1: 0.6596
 epoch: 48, train_loss: 0.5203, test_loss: 1.1642, test_f1: 0.6445
 epoch: 49, train_loss: 0.5210, test_loss: 1.2593, test_f1: 0.6208
 epoch: 50, train_loss: 0.5344, test_loss: 1.2841, test_f1: 0.6032
 epoch: 51, train_loss: 0.5180, test_loss: 1.1755, test_f1: 0.6376
 epoch: 52, train_loss: 0.4955, test_loss: 1.1595, test_f1: 0.6303
 epoch: 53, train_loss: 0.4616, test_loss: 1.1339, test_f1: 0.6527
 epoch: 54, train_loss: 0.4437, test_loss: 1.0952, test_f1: 0.6449
 epoch: 55, train_loss: 0.4504, test_loss: 1.1750, test_f1: 0.6402
 epoch: 56, train_loss: 0.4273, test_loss: 1.1726, test_f1: 0.6431
 epoch: 57, train_loss: 0.4154, test_loss: 1.2504, test_f1: 0.6363
 epoch: 58, train_loss: 0.4430, test_loss: 1.2203, test_f1: 0.6418
 epoch: 59, train_loss: 0.4319, test_loss: 1.1927, test_f1: 0.6504
 epoch: 60, train_loss: 0.4285, test_loss: 1.2361, test_f1: 0.6424
 epoch: 61, train_loss: 0.4276, test_loss: 1.2415, test_f1: 0.6418
 epoch: 62, train_loss: 0.4104, test_loss: 1.2194, test_f1: 0.6366
 epoch: 63, train_loss: 0.4006, test_loss: 1.2812, test_f1: 0.6372
 epoch: 64, train_loss: 0.3988, test_loss: 1.2308, test_f1: 0.6570
 epoch: 65, train_loss: 0.4105, test_loss: 1.2990, test_f1: 0.6428
 epoch: 66, train_loss: 0.4133, test_loss: 1.1401, test_f1: 0.6195
 epoch: 67, train_loss: 0.3972, test_loss: 1.3158, test_f1: 0.6306
 epoch: 68, train_loss: 0.4158, test_loss: 1.2302, test_f1: 0.6656
 epoch: 69, train_loss: 0.3863, test_loss: 1.2448, test_f1: 0.6502
 epoch: 70, train_loss: 0.3843, test_loss: 1.2905, test_f1: 0.6553
 epoch: 71, train_loss: 0.4011, test_loss: 1.2815, test_f1: 0.6602
 epoch: 72, train_loss: 0.3846, test_loss: 1.1849, test_f1: 0.6496
 epoch: 73, train_loss: 0.3952, test_loss: 1.1833, test_f1: 0.6657
 epoch: 74, train_loss: 0.4112, test_loss: 1.1705, test_f1: 0.6587
 epoch: 75, train_loss: 0.3721, test_loss: 1.2401, test_f1: 0.6699
 epoch: 76, train_loss: 0.3816, test_loss: 1.2055, test_f1: 0.6533
 epoch: 77, train_loss: 0.3752, test_loss: 1.2784, test_f1: 0.6787
 epoch: 78, train_loss: 0.3609, test_loss: 1.2478, test_f1: 0.6599
 epoch: 79, train_loss: 0.3477, test_loss: 1.3811, test_f1: 0.6196
 epoch: 80, train_loss: 0.3494, test_loss: 1.3963, test_f1: 0.6343
 epoch: 81, train_loss: 0.3462, test_loss: 1.2560, test_f1: 0.6480
 epoch: 82, train_loss: 0.3467, test_loss: 1.3853, test_f1: 0.6423
 epoch: 83, train_loss: 0.3727, test_loss: 1.3946, test_f1: 0.6095
 epoch: 84, train_loss: 0.3694, test_loss: 1.2807, test_f1: 0.6582
 epoch: 85, train_loss: 0.3427, test_loss: 1.3101, test_f1: 0.6481
 epoch: 86, train_loss: 0.3538, test_loss: 1.3562, test_f1: 0.6582
 epoch: 87, train_loss: 0.3529, test_loss: 1.4325, test_f1: 0.6474
 epoch: 88, train_loss: 0.3453, test_loss: 1.3088, test_f1: 0.6575
 epoch: 89, train_loss: 0.3594, test_loss: 1.4958, test_f1: 0.6559
 epoch: 90, train_loss: 0.3227, test_loss: 1.3902, test_f1: 0.6588
 epoch: 91, train_loss: 0.3284, test_loss: 1.4320, test_f1: 0.6651
 epoch: 92, train_loss: 0.3324, test_loss: 1.4611, test_f1: 0.6582
 epoch: 93, train_loss: 0.3198, test_loss: 1.2992, test_f1: 0.6384
 epoch: 94, train_loss: 0.3015, test_loss: 1.3659, test_f1: 0.6720
 epoch: 95, train_loss: 0.3217, test_loss: 1.4437, test_f1: 0.6818
 epoch: 96, train_loss: 0.3072, test_loss: 1.3543, test_f1: 0.6509
 epoch: 97, train_loss: 0.3273, test_loss: 1.5105, test_f1: 0.6565
 epoch: 98, train_loss: 0.3143, test_loss: 1.4923, test_f1: 0.6597
 epoch: 99, train_loss: 0.3153, test_loss: 1.3858, test_f1: 0.6546

Training completed in 407.99 seconds
Best F1: 0.7105 at epoch 65
Mean F1 across iterations: 0.6919  0.0101
========================FINAL RESULTS================================
FEGIN weighted F1: 0.7105  0.0101
python main.py --data ltspice_examples --representation component_pin_net --model FEGIN --layers 2 --hiddens 64 --batch_size 256 --lr 0.01 --emb_size 128 --epochs 100 --save_appendix component_pin_net_L2_H64_BS256_LR0.01_E128 --no_val
-----



STDERR:
  File "main.py", line 370, in <module>
    main()
  File "main.py", line 254, in main
    dataset = dataset_class(
  File "/home/philip/projects/ltspice_examples_code_repo/Circuit-Completion-Using-GNNs/component_classification_with_link_prediction_head/evaluation/FEGIN/kernel/circuit_datasets.py", line 15, in __init__
    self.data, self.slices = torch.load(self.processed_paths[0])
  File "/home/philip/.local/lib/python3.8/site-packages/torch/serialization.py", line 1040, in load
    warnings.warn(
  File "/usr/lib/python3.8/warnings.py", line 109, in _showwarnmsg
    sw(msg.message, msg.category, msg.filename, msg.lineno,
  File "main.py", line 47, in warn_with_traceback
    traceback.print_stack(file=log)
/home/philip/projects/ltspice_examples_code_repo/Circuit-Completion-Using-GNNs/component_classification_with_link_prediction_head/evaluation/FEGIN/kernel/circuit_datasets.py:15: FutureWarning: You are using `torch.load` with `weights_only=False` (the current default value), which uses the default pickle module implicitly. It is possible to construct malicious pickle data which will execute arbitrary code during unpickling (See https://github.com/pytorch/pytorch/blob/main/SECURITY.md#untrusted-models for more details). In a future release, the default value for `weights_only` will be flipped to `True`. This limits the functions that could be executed during unpickling. Arbitrary objects will no longer be allowed to be loaded via this mode unless they are explicitly allowlisted by the user via `torch.serialization.add_safe_globals`. We recommend you start setting `weights_only=True` for any use case where you don't have full control of the loaded file. Please open an issue on GitHub for any issues related to this experimental feature.
  self.data, self.slices = torch.load(self.processed_paths[0])
