STDOUT:
Results will be saved in /home/philip/projects/ltspice_examples_code_repo/Circuit-Completion-Using-GNNs/component_classification_with_link_prediction_head/evaluation/FEGIN/results/model_FEGIN_dataset_ltspice_examples
Command line input: python main.py --data ltspice_examples --representation component_net --model FEGIN --layers 2 --hiddens 64 --batch_size 128 --lr 0.0001 --emb_size 512 --epochs 100 --save_appendix component_net_L2_H64_BS128_LR0.0001_E512 --no_val
 is saved.
-----
ltspice_examples - FEGIN
Using 2 layers, 64 hidden units, h = 2
Loading component_net representation dataset
ENTERED
Training FEGIN on component_net representation
Train: 3558, Test: 846
##################ITERATION #0 ****************************************
 epoch: 0, train_loss: 1.3645, test_loss: 1.3617, test_f1: 0.2270
 epoch: 1, train_loss: 1.3549, test_loss: 1.3554, test_f1: 0.2270
 epoch: 2, train_loss: 1.3486, test_loss: 1.3487, test_f1: 0.2270
 epoch: 3, train_loss: 1.3414, test_loss: 1.3414, test_f1: 0.2270
 epoch: 4, train_loss: 1.3329, test_loss: 1.3315, test_f1: 0.2270
 epoch: 5, train_loss: 1.3214, test_loss: 1.3189, test_f1: 0.2271
 epoch: 6, train_loss: 1.3075, test_loss: 1.3036, test_f1: 0.2271
 epoch: 7, train_loss: 1.2909, test_loss: 1.2847, test_f1: 0.2270
 epoch: 8, train_loss: 1.2739, test_loss: 1.2663, test_f1: 0.2275
 epoch: 9, train_loss: 1.2572, test_loss: 1.2490, test_f1: 0.2611
 epoch: 10, train_loss: 1.2394, test_loss: 1.2319, test_f1: 0.2709
 epoch: 11, train_loss: 1.2270, test_loss: 1.2149, test_f1: 0.2928
 epoch: 12, train_loss: 1.2155, test_loss: 1.1974, test_f1: 0.3182
 epoch: 13, train_loss: 1.1981, test_loss: 1.1795, test_f1: 0.3505
 epoch: 14, train_loss: 1.1843, test_loss: 1.1608, test_f1: 0.3683
 epoch: 15, train_loss: 1.1693, test_loss: 1.1436, test_f1: 0.3707
 epoch: 16, train_loss: 1.1506, test_loss: 1.1248, test_f1: 0.3899
 epoch: 17, train_loss: 1.1385, test_loss: 1.1062, test_f1: 0.4083
 epoch: 18, train_loss: 1.1244, test_loss: 1.0876, test_f1: 0.4293
 epoch: 19, train_loss: 1.1037, test_loss: 1.0712, test_f1: 0.4378
 epoch: 20, train_loss: 1.0887, test_loss: 1.0558, test_f1: 0.4464
 epoch: 21, train_loss: 1.0713, test_loss: 1.0374, test_f1: 0.4544
 epoch: 22, train_loss: 1.0550, test_loss: 1.0180, test_f1: 0.4686
 epoch: 23, train_loss: 1.0389, test_loss: 1.0069, test_f1: 0.4490
 epoch: 24, train_loss: 1.0306, test_loss: 0.9933, test_f1: 0.4662
 epoch: 25, train_loss: 1.0246, test_loss: 0.9857, test_f1: 0.4593
 epoch: 26, train_loss: 1.0090, test_loss: 0.9772, test_f1: 0.4680
 epoch: 27, train_loss: 1.0001, test_loss: 0.9707, test_f1: 0.4672
 epoch: 28, train_loss: 0.9877, test_loss: 0.9656, test_f1: 0.4621
 epoch: 29, train_loss: 0.9837, test_loss: 0.9627, test_f1: 0.4636
 epoch: 30, train_loss: 0.9721, test_loss: 0.9520, test_f1: 0.4758
 epoch: 31, train_loss: 0.9621, test_loss: 0.9506, test_f1: 0.4727
 epoch: 32, train_loss: 0.9560, test_loss: 0.9491, test_f1: 0.4795
 epoch: 33, train_loss: 0.9557, test_loss: 0.9403, test_f1: 0.4792
 epoch: 34, train_loss: 0.9500, test_loss: 0.9355, test_f1: 0.4782
 epoch: 35, train_loss: 0.9507, test_loss: 0.9375, test_f1: 0.4845
 epoch: 36, train_loss: 0.9487, test_loss: 0.9314, test_f1: 0.4986
 epoch: 37, train_loss: 0.9408, test_loss: 0.9301, test_f1: 0.4838
 epoch: 38, train_loss: 0.9364, test_loss: 0.9307, test_f1: 0.4946
 epoch: 39, train_loss: 0.9279, test_loss: 0.9234, test_f1: 0.4917
 epoch: 40, train_loss: 0.9268, test_loss: 0.9264, test_f1: 0.4875
 epoch: 41, train_loss: 0.9157, test_loss: 0.9322, test_f1: 0.4968
 epoch: 42, train_loss: 0.9201, test_loss: 0.9174, test_f1: 0.5031
 epoch: 43, train_loss: 0.9153, test_loss: 0.9173, test_f1: 0.4978
 epoch: 44, train_loss: 0.9143, test_loss: 0.9170, test_f1: 0.5063
 epoch: 45, train_loss: 0.9140, test_loss: 0.9142, test_f1: 0.5097
 epoch: 46, train_loss: 0.9101, test_loss: 0.9140, test_f1: 0.5039
 epoch: 47, train_loss: 0.8992, test_loss: 0.9166, test_f1: 0.5091
 epoch: 48, train_loss: 0.9014, test_loss: 0.9149, test_f1: 0.4979
 epoch: 49, train_loss: 0.9004, test_loss: 0.9125, test_f1: 0.5043
 epoch: 50, train_loss: 0.8985, test_loss: 0.9083, test_f1: 0.5152
 epoch: 51, train_loss: 0.8980, test_loss: 0.9114, test_f1: 0.5109
 epoch: 52, train_loss: 0.8913, test_loss: 0.9098, test_f1: 0.5087
 epoch: 53, train_loss: 0.8944, test_loss: 0.9116, test_f1: 0.5126
 epoch: 54, train_loss: 0.8919, test_loss: 0.9059, test_f1: 0.5172
 epoch: 55, train_loss: 0.8915, test_loss: 0.9037, test_f1: 0.5126
 epoch: 56, train_loss: 0.8942, test_loss: 0.9030, test_f1: 0.5162
 epoch: 57, train_loss: 0.8809, test_loss: 0.9015, test_f1: 0.5270
 epoch: 58, train_loss: 0.8877, test_loss: 0.9089, test_f1: 0.5145
 epoch: 59, train_loss: 0.8819, test_loss: 0.9072, test_f1: 0.5103
 epoch: 60, train_loss: 0.8757, test_loss: 0.9040, test_f1: 0.5119
 epoch: 61, train_loss: 0.8811, test_loss: 0.9067, test_f1: 0.5151
 epoch: 62, train_loss: 0.8835, test_loss: 0.9021, test_f1: 0.5150
 epoch: 63, train_loss: 0.8781, test_loss: 0.8981, test_f1: 0.5226
 epoch: 64, train_loss: 0.8757, test_loss: 0.9022, test_f1: 0.5182
 epoch: 65, train_loss: 0.8835, test_loss: 0.9067, test_f1: 0.5091
 epoch: 66, train_loss: 0.8688, test_loss: 0.8968, test_f1: 0.5151
 epoch: 67, train_loss: 0.8798, test_loss: 0.9082, test_f1: 0.5146
 epoch: 68, train_loss: 0.8717, test_loss: 0.9027, test_f1: 0.5158
 epoch: 69, train_loss: 0.8721, test_loss: 0.9054, test_f1: 0.5100
 epoch: 70, train_loss: 0.8718, test_loss: 0.9004, test_f1: 0.5191
 epoch: 71, train_loss: 0.8680, test_loss: 0.9019, test_f1: 0.5172
 epoch: 72, train_loss: 0.8702, test_loss: 0.9044, test_f1: 0.5138
 epoch: 73, train_loss: 0.8666, test_loss: 0.8962, test_f1: 0.5161
 epoch: 74, train_loss: 0.8714, test_loss: 0.9000, test_f1: 0.5190
 epoch: 75, train_loss: 0.8602, test_loss: 0.9031, test_f1: 0.5111
 epoch: 76, train_loss: 0.8658, test_loss: 0.9040, test_f1: 0.5093
 epoch: 77, train_loss: 0.8616, test_loss: 0.8963, test_f1: 0.5282
 epoch: 78, train_loss: 0.8638, test_loss: 0.8989, test_f1: 0.5218
 epoch: 79, train_loss: 0.8583, test_loss: 0.9024, test_f1: 0.5083
 epoch: 80, train_loss: 0.8556, test_loss: 0.8965, test_f1: 0.5239
 epoch: 81, train_loss: 0.8571, test_loss: 0.8964, test_f1: 0.5288
 epoch: 82, train_loss: 0.8654, test_loss: 0.9000, test_f1: 0.5186
 epoch: 83, train_loss: 0.8600, test_loss: 0.9071, test_f1: 0.5121
 epoch: 84, train_loss: 0.8573, test_loss: 0.9046, test_f1: 0.5246
 epoch: 85, train_loss: 0.8526, test_loss: 0.8960, test_f1: 0.5177
 epoch: 86, train_loss: 0.8524, test_loss: 0.9064, test_f1: 0.5168
 epoch: 87, train_loss: 0.8518, test_loss: 0.8942, test_f1: 0.5257
 epoch: 88, train_loss: 0.8483, test_loss: 0.9062, test_f1: 0.5108
 epoch: 89, train_loss: 0.8574, test_loss: 0.9015, test_f1: 0.5262
 epoch: 90, train_loss: 0.8527, test_loss: 0.9040, test_f1: 0.5191
 epoch: 91, train_loss: 0.8534, test_loss: 0.9024, test_f1: 0.5295
 epoch: 92, train_loss: 0.8518, test_loss: 0.9116, test_f1: 0.5104
 epoch: 93, train_loss: 0.8453, test_loss: 0.9027, test_f1: 0.5318
 epoch: 94, train_loss: 0.8445, test_loss: 0.9048, test_f1: 0.5200
 epoch: 95, train_loss: 0.8474, test_loss: 0.9008, test_f1: 0.5253
 epoch: 96, train_loss: 0.8472, test_loss: 0.8974, test_f1: 0.5222
 epoch: 97, train_loss: 0.8505, test_loss: 0.9060, test_f1: 0.5223
 epoch: 98, train_loss: 0.8417, test_loss: 0.9000, test_f1: 0.5266
 epoch: 99, train_loss: 0.8455, test_loss: 0.9024, test_f1: 0.5168
##################ITERATION #1 ****************************************
 epoch: 0, train_loss: 1.3192, test_loss: 1.3294, test_f1: 0.2270
 epoch: 1, train_loss: 1.2897, test_loss: 1.2958, test_f1: 0.2270
 epoch: 2, train_loss: 1.2695, test_loss: 1.2610, test_f1: 0.2819
 epoch: 3, train_loss: 1.2520, test_loss: 1.2382, test_f1: 0.2851
 epoch: 4, train_loss: 1.2375, test_loss: 1.2201, test_f1: 0.2936
 epoch: 5, train_loss: 1.2197, test_loss: 1.2020, test_f1: 0.2970
 epoch: 6, train_loss: 1.2029, test_loss: 1.1847, test_f1: 0.3049
 epoch: 7, train_loss: 1.1901, test_loss: 1.1669, test_f1: 0.3145
 epoch: 8, train_loss: 1.1776, test_loss: 1.1490, test_f1: 0.3411
 epoch: 9, train_loss: 1.1585, test_loss: 1.1305, test_f1: 0.3632
 epoch: 10, train_loss: 1.1411, test_loss: 1.1117, test_f1: 0.3850
 epoch: 11, train_loss: 1.1299, test_loss: 1.0931, test_f1: 0.3913
 epoch: 12, train_loss: 1.1120, test_loss: 1.0768, test_f1: 0.3931
 epoch: 13, train_loss: 1.0983, test_loss: 1.0620, test_f1: 0.4012
 epoch: 14, train_loss: 1.0797, test_loss: 1.0439, test_f1: 0.4200
 epoch: 15, train_loss: 1.0615, test_loss: 1.0329, test_f1: 0.4274
 epoch: 16, train_loss: 1.0505, test_loss: 1.0210, test_f1: 0.4308
 epoch: 17, train_loss: 1.0353, test_loss: 1.0115, test_f1: 0.4385
 epoch: 18, train_loss: 1.0253, test_loss: 0.9997, test_f1: 0.4427
 epoch: 19, train_loss: 1.0216, test_loss: 0.9937, test_f1: 0.4513
 epoch: 20, train_loss: 1.0091, test_loss: 0.9814, test_f1: 0.4614
 epoch: 21, train_loss: 1.0052, test_loss: 0.9810, test_f1: 0.4607
 epoch: 22, train_loss: 0.9886, test_loss: 0.9719, test_f1: 0.4709
 epoch: 23, train_loss: 0.9837, test_loss: 0.9781, test_f1: 0.4694
 epoch: 24, train_loss: 0.9782, test_loss: 0.9682, test_f1: 0.4754
 epoch: 25, train_loss: 0.9753, test_loss: 0.9658, test_f1: 0.4770
 epoch: 26, train_loss: 0.9708, test_loss: 0.9522, test_f1: 0.4816
 epoch: 27, train_loss: 0.9617, test_loss: 0.9576, test_f1: 0.4783
 epoch: 28, train_loss: 0.9553, test_loss: 0.9599, test_f1: 0.4820
 epoch: 29, train_loss: 0.9532, test_loss: 0.9519, test_f1: 0.4810
 epoch: 30, train_loss: 0.9461, test_loss: 0.9509, test_f1: 0.4833
 epoch: 31, train_loss: 0.9412, test_loss: 0.9480, test_f1: 0.4869
 epoch: 32, train_loss: 0.9400, test_loss: 0.9556, test_f1: 0.4773
 epoch: 33, train_loss: 0.9313, test_loss: 0.9410, test_f1: 0.4744
 epoch: 34, train_loss: 0.9358, test_loss: 0.9473, test_f1: 0.4821
 epoch: 35, train_loss: 0.9314, test_loss: 0.9454, test_f1: 0.4863
 epoch: 36, train_loss: 0.9212, test_loss: 0.9427, test_f1: 0.4782
 epoch: 37, train_loss: 0.9187, test_loss: 0.9422, test_f1: 0.5040
 epoch: 38, train_loss: 0.9159, test_loss: 0.9397, test_f1: 0.4825
 epoch: 39, train_loss: 0.9142, test_loss: 0.9508, test_f1: 0.4830
 epoch: 40, train_loss: 0.9094, test_loss: 0.9473, test_f1: 0.4851
 epoch: 41, train_loss: 0.9017, test_loss: 0.9424, test_f1: 0.5107
 epoch: 42, train_loss: 0.9114, test_loss: 0.9438, test_f1: 0.4895
 epoch: 43, train_loss: 0.8969, test_loss: 0.9426, test_f1: 0.4782
 epoch: 44, train_loss: 0.8947, test_loss: 0.9492, test_f1: 0.4930
 epoch: 45, train_loss: 0.8909, test_loss: 0.9322, test_f1: 0.5019
 epoch: 46, train_loss: 0.8958, test_loss: 0.9433, test_f1: 0.4897
 epoch: 47, train_loss: 0.8868, test_loss: 0.9581, test_f1: 0.4894
 epoch: 48, train_loss: 0.8885, test_loss: 0.9421, test_f1: 0.4923
 epoch: 49, train_loss: 0.8787, test_loss: 0.9430, test_f1: 0.5022
 epoch: 50, train_loss: 0.8799, test_loss: 0.9600, test_f1: 0.4983
 epoch: 51, train_loss: 0.8776, test_loss: 0.9549, test_f1: 0.5017
 epoch: 52, train_loss: 0.8775, test_loss: 0.9581, test_f1: 0.4956
 epoch: 53, train_loss: 0.8734, test_loss: 0.9499, test_f1: 0.4977
 epoch: 54, train_loss: 0.8722, test_loss: 0.9540, test_f1: 0.4865
 epoch: 55, train_loss: 0.8757, test_loss: 0.9539, test_f1: 0.4947
 epoch: 56, train_loss: 0.8714, test_loss: 0.9478, test_f1: 0.5015
 epoch: 57, train_loss: 0.8715, test_loss: 0.9478, test_f1: 0.4900
 epoch: 58, train_loss: 0.8710, test_loss: 0.9454, test_f1: 0.5021
 epoch: 59, train_loss: 0.8693, test_loss: 0.9493, test_f1: 0.5004
 epoch: 60, train_loss: 0.8663, test_loss: 0.9522, test_f1: 0.4865
 epoch: 61, train_loss: 0.8658, test_loss: 0.9442, test_f1: 0.5105
 epoch: 62, train_loss: 0.8630, test_loss: 0.9459, test_f1: 0.5080
 epoch: 63, train_loss: 0.8642, test_loss: 0.9542, test_f1: 0.4983
 epoch: 64, train_loss: 0.8600, test_loss: 0.9473, test_f1: 0.5114
 epoch: 65, train_loss: 0.8561, test_loss: 0.9507, test_f1: 0.5056
 epoch: 66, train_loss: 0.8539, test_loss: 0.9533, test_f1: 0.5020
 epoch: 67, train_loss: 0.8572, test_loss: 0.9531, test_f1: 0.5100
 epoch: 68, train_loss: 0.8576, test_loss: 0.9485, test_f1: 0.5078
 epoch: 69, train_loss: 0.8512, test_loss: 0.9582, test_f1: 0.5096
 epoch: 70, train_loss: 0.8522, test_loss: 0.9464, test_f1: 0.5065
 epoch: 71, train_loss: 0.8522, test_loss: 0.9525, test_f1: 0.5108
 epoch: 72, train_loss: 0.8506, test_loss: 0.9471, test_f1: 0.4969
 epoch: 73, train_loss: 0.8570, test_loss: 0.9524, test_f1: 0.5057
 epoch: 74, train_loss: 0.8460, test_loss: 0.9590, test_f1: 0.4997
 epoch: 75, train_loss: 0.8460, test_loss: 0.9546, test_f1: 0.5116
 epoch: 76, train_loss: 0.8551, test_loss: 0.9507, test_f1: 0.5026
 epoch: 77, train_loss: 0.8567, test_loss: 0.9444, test_f1: 0.5122
 epoch: 78, train_loss: 0.8454, test_loss: 0.9533, test_f1: 0.5084
 epoch: 79, train_loss: 0.8440, test_loss: 0.9422, test_f1: 0.5044
 epoch: 80, train_loss: 0.8463, test_loss: 0.9519, test_f1: 0.4975
 epoch: 81, train_loss: 0.8408, test_loss: 0.9611, test_f1: 0.5049
 epoch: 82, train_loss: 0.8468, test_loss: 0.9499, test_f1: 0.5068
 epoch: 83, train_loss: 0.8417, test_loss: 0.9582, test_f1: 0.5080
 epoch: 84, train_loss: 0.8388, test_loss: 0.9548, test_f1: 0.5117
 epoch: 85, train_loss: 0.8441, test_loss: 0.9551, test_f1: 0.5059
 epoch: 86, train_loss: 0.8343, test_loss: 0.9507, test_f1: 0.5060
 epoch: 87, train_loss: 0.8412, test_loss: 0.9461, test_f1: 0.5094
 epoch: 88, train_loss: 0.8410, test_loss: 0.9574, test_f1: 0.5082
 epoch: 89, train_loss: 0.8306, test_loss: 0.9515, test_f1: 0.5118
 epoch: 90, train_loss: 0.8443, test_loss: 0.9457, test_f1: 0.5105
 epoch: 91, train_loss: 0.8319, test_loss: 0.9514, test_f1: 0.5080
 epoch: 92, train_loss: 0.8317, test_loss: 0.9569, test_f1: 0.5144
 epoch: 93, train_loss: 0.8365, test_loss: 0.9564, test_f1: 0.5102
 epoch: 94, train_loss: 0.8360, test_loss: 0.9581, test_f1: 0.5150
 epoch: 95, train_loss: 0.8340, test_loss: 0.9586, test_f1: 0.5081
 epoch: 96, train_loss: 0.8392, test_loss: 0.9485, test_f1: 0.5115
 epoch: 97, train_loss: 0.8381, test_loss: 0.9580, test_f1: 0.5100
 epoch: 98, train_loss: 0.8326, test_loss: 0.9648, test_f1: 0.5128
 epoch: 99, train_loss: 0.8268, test_loss: 0.9649, test_f1: 0.5065
##################ITERATION #2 ****************************************
 epoch: 0, train_loss: 1.2811, test_loss: 1.3069, test_f1: 0.2270
 epoch: 1, train_loss: 1.2327, test_loss: 1.2531, test_f1: 0.2270
 epoch: 2, train_loss: 1.2109, test_loss: 1.1941, test_f1: 0.3142
 epoch: 3, train_loss: 1.1908, test_loss: 1.1643, test_f1: 0.3326
 epoch: 4, train_loss: 1.1747, test_loss: 1.1455, test_f1: 0.3397
 epoch: 5, train_loss: 1.1563, test_loss: 1.1236, test_f1: 0.3497
 epoch: 6, train_loss: 1.1361, test_loss: 1.1047, test_f1: 0.3557
 epoch: 7, train_loss: 1.1209, test_loss: 1.0833, test_f1: 0.3714
 epoch: 8, train_loss: 1.0988, test_loss: 1.0662, test_f1: 0.3834
 epoch: 9, train_loss: 1.0809, test_loss: 1.0493, test_f1: 0.3961
 epoch: 10, train_loss: 1.0645, test_loss: 1.0367, test_f1: 0.4098
 epoch: 11, train_loss: 1.0456, test_loss: 1.0223, test_f1: 0.4152
 epoch: 12, train_loss: 1.0333, test_loss: 1.0110, test_f1: 0.4331
 epoch: 13, train_loss: 1.0202, test_loss: 1.0003, test_f1: 0.4356
 epoch: 14, train_loss: 1.0077, test_loss: 0.9884, test_f1: 0.4346
 epoch: 15, train_loss: 1.0025, test_loss: 0.9899, test_f1: 0.4582
 epoch: 16, train_loss: 0.9900, test_loss: 0.9770, test_f1: 0.4670
 epoch: 17, train_loss: 0.9897, test_loss: 0.9703, test_f1: 0.4707
 epoch: 18, train_loss: 0.9749, test_loss: 0.9767, test_f1: 0.4673
 epoch: 19, train_loss: 0.9660, test_loss: 0.9803, test_f1: 0.4656
 epoch: 20, train_loss: 0.9669, test_loss: 0.9630, test_f1: 0.4718
 epoch: 21, train_loss: 0.9604, test_loss: 0.9610, test_f1: 0.4776
 epoch: 22, train_loss: 0.9509, test_loss: 0.9627, test_f1: 0.4821
 epoch: 23, train_loss: 0.9459, test_loss: 0.9569, test_f1: 0.4803
 epoch: 24, train_loss: 0.9445, test_loss: 0.9574, test_f1: 0.4821
 epoch: 25, train_loss: 0.9312, test_loss: 0.9630, test_f1: 0.4746
 epoch: 26, train_loss: 0.9255, test_loss: 0.9517, test_f1: 0.4820
 epoch: 27, train_loss: 0.9203, test_loss: 0.9559, test_f1: 0.4801
 epoch: 28, train_loss: 0.9267, test_loss: 0.9541, test_f1: 0.4929
 epoch: 29, train_loss: 0.9113, test_loss: 0.9677, test_f1: 0.4794
 epoch: 30, train_loss: 0.9118, test_loss: 0.9343, test_f1: 0.5102
 epoch: 31, train_loss: 0.9050, test_loss: 0.9470, test_f1: 0.5003
 epoch: 32, train_loss: 0.9027, test_loss: 0.9444, test_f1: 0.4915
 epoch: 33, train_loss: 0.8962, test_loss: 0.9541, test_f1: 0.5028
 epoch: 34, train_loss: 0.8949, test_loss: 0.9560, test_f1: 0.5163
 epoch: 35, train_loss: 0.8891, test_loss: 0.9332, test_f1: 0.5124
 epoch: 36, train_loss: 0.8906, test_loss: 0.9706, test_f1: 0.5000
 epoch: 37, train_loss: 0.8824, test_loss: 0.9301, test_f1: 0.5205
 epoch: 38, train_loss: 0.8749, test_loss: 0.9471, test_f1: 0.5195
 epoch: 39, train_loss: 0.8762, test_loss: 0.9625, test_f1: 0.5215
 epoch: 40, train_loss: 0.8721, test_loss: 0.9532, test_f1: 0.5227
 epoch: 41, train_loss: 0.8702, test_loss: 0.9551, test_f1: 0.5195
 epoch: 42, train_loss: 0.8672, test_loss: 0.9554, test_f1: 0.5206
 epoch: 43, train_loss: 0.8603, test_loss: 0.9446, test_f1: 0.5222
 epoch: 44, train_loss: 0.8554, test_loss: 0.9542, test_f1: 0.5157
 epoch: 45, train_loss: 0.8592, test_loss: 0.9517, test_f1: 0.5161
 epoch: 46, train_loss: 0.8576, test_loss: 0.9617, test_f1: 0.5239
 epoch: 47, train_loss: 0.8520, test_loss: 0.9474, test_f1: 0.5194
 epoch: 48, train_loss: 0.8440, test_loss: 0.9395, test_f1: 0.5232
 epoch: 49, train_loss: 0.8435, test_loss: 0.9554, test_f1: 0.5169
 epoch: 50, train_loss: 0.8382, test_loss: 0.9713, test_f1: 0.5203
 epoch: 51, train_loss: 0.8455, test_loss: 0.9529, test_f1: 0.5218
 epoch: 52, train_loss: 0.8381, test_loss: 0.9546, test_f1: 0.5179
 epoch: 53, train_loss: 0.8298, test_loss: 0.9746, test_f1: 0.5166
 epoch: 54, train_loss: 0.8409, test_loss: 0.9413, test_f1: 0.5316
 epoch: 55, train_loss: 0.8364, test_loss: 0.9425, test_f1: 0.5275
 epoch: 56, train_loss: 0.8271, test_loss: 0.9599, test_f1: 0.5328
 epoch: 57, train_loss: 0.8255, test_loss: 0.9431, test_f1: 0.5286
 epoch: 58, train_loss: 0.8310, test_loss: 0.9652, test_f1: 0.5193
 epoch: 59, train_loss: 0.8230, test_loss: 0.9753, test_f1: 0.5221
 epoch: 60, train_loss: 0.8222, test_loss: 0.9525, test_f1: 0.5315
 epoch: 61, train_loss: 0.8267, test_loss: 0.9574, test_f1: 0.5299
 epoch: 62, train_loss: 0.8283, test_loss: 0.9763, test_f1: 0.5327
 epoch: 63, train_loss: 0.8236, test_loss: 0.9762, test_f1: 0.5308
 epoch: 64, train_loss: 0.8159, test_loss: 0.9668, test_f1: 0.5300
 epoch: 65, train_loss: 0.8258, test_loss: 0.9587, test_f1: 0.5334
 epoch: 66, train_loss: 0.8184, test_loss: 0.9529, test_f1: 0.5337
 epoch: 67, train_loss: 0.8085, test_loss: 0.9633, test_f1: 0.5253
 epoch: 68, train_loss: 0.8185, test_loss: 0.9675, test_f1: 0.5261
 epoch: 69, train_loss: 0.8106, test_loss: 0.9628, test_f1: 0.5319
 epoch: 70, train_loss: 0.8135, test_loss: 0.9669, test_f1: 0.5362
 epoch: 71, train_loss: 0.8138, test_loss: 0.9743, test_f1: 0.5239
 epoch: 72, train_loss: 0.8098, test_loss: 0.9537, test_f1: 0.5268
 epoch: 73, train_loss: 0.8095, test_loss: 0.9610, test_f1: 0.5336
 epoch: 74, train_loss: 0.8173, test_loss: 0.9627, test_f1: 0.5244
 epoch: 75, train_loss: 0.8142, test_loss: 0.9460, test_f1: 0.5331
 epoch: 76, train_loss: 0.8050, test_loss: 0.9685, test_f1: 0.5366
 epoch: 77, train_loss: 0.8093, test_loss: 0.9866, test_f1: 0.5317
 epoch: 78, train_loss: 0.8007, test_loss: 0.9508, test_f1: 0.5269
 epoch: 79, train_loss: 0.8042, test_loss: 0.9770, test_f1: 0.5268
 epoch: 80, train_loss: 0.8040, test_loss: 0.9639, test_f1: 0.5338
 epoch: 81, train_loss: 0.8004, test_loss: 0.9742, test_f1: 0.5385
 epoch: 82, train_loss: 0.7914, test_loss: 0.9781, test_f1: 0.5197
 epoch: 83, train_loss: 0.7921, test_loss: 0.9656, test_f1: 0.5293
 epoch: 84, train_loss: 0.7955, test_loss: 0.9732, test_f1: 0.5328
 epoch: 85, train_loss: 0.7940, test_loss: 0.9925, test_f1: 0.5292
 epoch: 86, train_loss: 0.7997, test_loss: 0.9643, test_f1: 0.5334
 epoch: 87, train_loss: 0.7935, test_loss: 0.9791, test_f1: 0.5297
 epoch: 88, train_loss: 0.7893, test_loss: 0.9743, test_f1: 0.5261
 epoch: 89, train_loss: 0.7887, test_loss: 0.9903, test_f1: 0.5273
 epoch: 90, train_loss: 0.7980, test_loss: 0.9856, test_f1: 0.5329
 epoch: 91, train_loss: 0.7865, test_loss: 0.9692, test_f1: 0.5357
 epoch: 92, train_loss: 0.7874, test_loss: 0.9668, test_f1: 0.5330
 epoch: 93, train_loss: 0.7906, test_loss: 0.9637, test_f1: 0.5321
 epoch: 94, train_loss: 0.7993, test_loss: 0.9967, test_f1: 0.5278
 epoch: 95, train_loss: 0.7852, test_loss: 0.9781, test_f1: 0.5326
 epoch: 96, train_loss: 0.7894, test_loss: 0.9773, test_f1: 0.5280
 epoch: 97, train_loss: 0.7748, test_loss: 0.9696, test_f1: 0.5348
 epoch: 98, train_loss: 0.7752, test_loss: 0.9788, test_f1: 0.5280
 epoch: 99, train_loss: 0.7846, test_loss: 0.9622, test_f1: 0.5279
##################ITERATION #3 ****************************************
 epoch: 0, train_loss: 1.2868, test_loss: 1.2934, test_f1: 0.2270
 epoch: 1, train_loss: 1.2247, test_loss: 1.2381, test_f1: 0.2270
 epoch: 2, train_loss: 1.2047, test_loss: 1.1814, test_f1: 0.3102
 epoch: 3, train_loss: 1.1813, test_loss: 1.1504, test_f1: 0.3322
 epoch: 4, train_loss: 1.1597, test_loss: 1.1280, test_f1: 0.3379
 epoch: 5, train_loss: 1.1447, test_loss: 1.1061, test_f1: 0.3463
 epoch: 6, train_loss: 1.1232, test_loss: 1.0851, test_f1: 0.3487
 epoch: 7, train_loss: 1.1041, test_loss: 1.0666, test_f1: 0.3676
 epoch: 8, train_loss: 1.0948, test_loss: 1.0482, test_f1: 0.3769
 epoch: 9, train_loss: 1.0756, test_loss: 1.0368, test_f1: 0.4054
 epoch: 10, train_loss: 1.0578, test_loss: 1.0223, test_f1: 0.4128
 epoch: 11, train_loss: 1.0452, test_loss: 1.0127, test_f1: 0.4182
 epoch: 12, train_loss: 1.0349, test_loss: 1.0050, test_f1: 0.4361
 epoch: 13, train_loss: 1.0264, test_loss: 0.9974, test_f1: 0.4341
 epoch: 14, train_loss: 1.0104, test_loss: 0.9824, test_f1: 0.4445
 epoch: 15, train_loss: 1.0026, test_loss: 0.9737, test_f1: 0.4576
 epoch: 16, train_loss: 0.9923, test_loss: 0.9669, test_f1: 0.4561
 epoch: 17, train_loss: 0.9850, test_loss: 0.9590, test_f1: 0.4715
 epoch: 18, train_loss: 0.9883, test_loss: 0.9584, test_f1: 0.4676
 epoch: 19, train_loss: 0.9698, test_loss: 0.9517, test_f1: 0.4663
 epoch: 20, train_loss: 0.9701, test_loss: 0.9405, test_f1: 0.4794
 epoch: 21, train_loss: 0.9559, test_loss: 0.9337, test_f1: 0.4864
 epoch: 22, train_loss: 0.9536, test_loss: 0.9408, test_f1: 0.4877
 epoch: 23, train_loss: 0.9492, test_loss: 0.9291, test_f1: 0.4937
 epoch: 24, train_loss: 0.9389, test_loss: 0.9224, test_f1: 0.4923
 epoch: 25, train_loss: 0.9382, test_loss: 0.9191, test_f1: 0.4939
 epoch: 26, train_loss: 0.9322, test_loss: 0.9163, test_f1: 0.5059
 epoch: 27, train_loss: 0.9267, test_loss: 0.9197, test_f1: 0.5007
 epoch: 28, train_loss: 0.9238, test_loss: 0.9197, test_f1: 0.5092
 epoch: 29, train_loss: 0.9235, test_loss: 0.9103, test_f1: 0.5183
 epoch: 30, train_loss: 0.9144, test_loss: 0.9110, test_f1: 0.5203
 epoch: 31, train_loss: 0.9134, test_loss: 0.9158, test_f1: 0.5109
 epoch: 32, train_loss: 0.9126, test_loss: 0.9063, test_f1: 0.5138
 epoch: 33, train_loss: 0.9008, test_loss: 0.9096, test_f1: 0.5160
 epoch: 34, train_loss: 0.9004, test_loss: 0.9054, test_f1: 0.5235
 epoch: 35, train_loss: 0.8982, test_loss: 0.9009, test_f1: 0.5288
 epoch: 36, train_loss: 0.8916, test_loss: 0.9084, test_f1: 0.5098
 epoch: 37, train_loss: 0.8839, test_loss: 0.8952, test_f1: 0.5359
 epoch: 38, train_loss: 0.8915, test_loss: 0.8989, test_f1: 0.5309
 epoch: 39, train_loss: 0.8862, test_loss: 0.8976, test_f1: 0.5348
 epoch: 40, train_loss: 0.8789, test_loss: 0.9007, test_f1: 0.5153
 epoch: 41, train_loss: 0.8835, test_loss: 0.8975, test_f1: 0.5303
 epoch: 42, train_loss: 0.8773, test_loss: 0.8930, test_f1: 0.5264
 epoch: 43, train_loss: 0.8729, test_loss: 0.8969, test_f1: 0.5363
 epoch: 44, train_loss: 0.8675, test_loss: 0.9056, test_f1: 0.5244
 epoch: 45, train_loss: 0.8572, test_loss: 0.9009, test_f1: 0.5190
 epoch: 46, train_loss: 0.8670, test_loss: 0.8970, test_f1: 0.5225
 epoch: 47, train_loss: 0.8638, test_loss: 0.9051, test_f1: 0.5249
 epoch: 48, train_loss: 0.8626, test_loss: 0.8875, test_f1: 0.5364
 epoch: 49, train_loss: 0.8565, test_loss: 0.8962, test_f1: 0.5291
 epoch: 50, train_loss: 0.8612, test_loss: 0.9045, test_f1: 0.5332
 epoch: 51, train_loss: 0.8571, test_loss: 0.9025, test_f1: 0.5366
 epoch: 52, train_loss: 0.8538, test_loss: 0.8999, test_f1: 0.5333
 epoch: 53, train_loss: 0.8465, test_loss: 0.8980, test_f1: 0.5332
 epoch: 54, train_loss: 0.8355, test_loss: 0.8909, test_f1: 0.5276
 epoch: 55, train_loss: 0.8448, test_loss: 0.8976, test_f1: 0.5372
 epoch: 56, train_loss: 0.8432, test_loss: 0.8856, test_f1: 0.5433
 epoch: 57, train_loss: 0.8377, test_loss: 0.8883, test_f1: 0.5453
 epoch: 58, train_loss: 0.8381, test_loss: 0.8965, test_f1: 0.5323
 epoch: 59, train_loss: 0.8367, test_loss: 0.9019, test_f1: 0.5325
 epoch: 60, train_loss: 0.8386, test_loss: 0.8958, test_f1: 0.5307
 epoch: 61, train_loss: 0.8425, test_loss: 0.8917, test_f1: 0.5334
 epoch: 62, train_loss: 0.8341, test_loss: 0.8937, test_f1: 0.5327
 epoch: 63, train_loss: 0.8288, test_loss: 0.8915, test_f1: 0.5450
 epoch: 64, train_loss: 0.8386, test_loss: 0.9026, test_f1: 0.5424
 epoch: 65, train_loss: 0.8204, test_loss: 0.8948, test_f1: 0.5466
 epoch: 66, train_loss: 0.8407, test_loss: 0.8894, test_f1: 0.5471
 epoch: 67, train_loss: 0.8285, test_loss: 0.8873, test_f1: 0.5485
 epoch: 68, train_loss: 0.8305, test_loss: 0.8890, test_f1: 0.5494
 epoch: 69, train_loss: 0.8338, test_loss: 0.8824, test_f1: 0.5356
 epoch: 70, train_loss: 0.8258, test_loss: 0.8901, test_f1: 0.5469
 epoch: 71, train_loss: 0.8250, test_loss: 0.9020, test_f1: 0.5507
 epoch: 72, train_loss: 0.8313, test_loss: 0.8864, test_f1: 0.5414
 epoch: 73, train_loss: 0.8192, test_loss: 0.8867, test_f1: 0.5433
 epoch: 74, train_loss: 0.8135, test_loss: 0.8863, test_f1: 0.5472
 epoch: 75, train_loss: 0.8289, test_loss: 0.8872, test_f1: 0.5442
 epoch: 76, train_loss: 0.8130, test_loss: 0.9015, test_f1: 0.5480
 epoch: 77, train_loss: 0.8213, test_loss: 0.8917, test_f1: 0.5442
 epoch: 78, train_loss: 0.8146, test_loss: 0.8864, test_f1: 0.5440
 epoch: 79, train_loss: 0.8201, test_loss: 0.8908, test_f1: 0.5481
 epoch: 80, train_loss: 0.8141, test_loss: 0.8987, test_f1: 0.5451
 epoch: 81, train_loss: 0.8217, test_loss: 0.8996, test_f1: 0.5396
 epoch: 82, train_loss: 0.8121, test_loss: 0.8918, test_f1: 0.5426
 epoch: 83, train_loss: 0.8096, test_loss: 0.9083, test_f1: 0.5479
 epoch: 84, train_loss: 0.8091, test_loss: 0.8888, test_f1: 0.5445
 epoch: 85, train_loss: 0.8105, test_loss: 0.8888, test_f1: 0.5452
 epoch: 86, train_loss: 0.8055, test_loss: 0.8862, test_f1: 0.5458
 epoch: 87, train_loss: 0.8138, test_loss: 0.9055, test_f1: 0.5458
 epoch: 88, train_loss: 0.8113, test_loss: 0.8848, test_f1: 0.5440
 epoch: 89, train_loss: 0.8150, test_loss: 0.8937, test_f1: 0.5475
 epoch: 90, train_loss: 0.8019, test_loss: 0.8812, test_f1: 0.5464
 epoch: 91, train_loss: 0.8054, test_loss: 0.8876, test_f1: 0.5568
 epoch: 92, train_loss: 0.8022, test_loss: 0.9128, test_f1: 0.5530
 epoch: 93, train_loss: 0.8101, test_loss: 0.8974, test_f1: 0.5478
 epoch: 94, train_loss: 0.8043, test_loss: 0.8996, test_f1: 0.5447
 epoch: 95, train_loss: 0.8099, test_loss: 0.8864, test_f1: 0.5549
 epoch: 96, train_loss: 0.8069, test_loss: 0.8847, test_f1: 0.5556
 epoch: 97, train_loss: 0.8030, test_loss: 0.8937, test_f1: 0.5545
 epoch: 98, train_loss: 0.8001, test_loss: 0.8911, test_f1: 0.5536
 epoch: 99, train_loss: 0.7934, test_loss: 0.8971, test_f1: 0.5563
##################ITERATION #4 ****************************************
 epoch: 0, train_loss: 1.2801, test_loss: 1.2910, test_f1: 0.2270
 epoch: 1, train_loss: 1.2062, test_loss: 1.2066, test_f1: 0.3297
 epoch: 2, train_loss: 1.1852, test_loss: 1.1503, test_f1: 0.3685
 epoch: 3, train_loss: 1.1616, test_loss: 1.1197, test_f1: 0.3943
 epoch: 4, train_loss: 1.1419, test_loss: 1.0996, test_f1: 0.4005
 epoch: 5, train_loss: 1.1321, test_loss: 1.0798, test_f1: 0.4069
 epoch: 6, train_loss: 1.1045, test_loss: 1.0670, test_f1: 0.4199
 epoch: 7, train_loss: 1.0911, test_loss: 1.0484, test_f1: 0.4388
 epoch: 8, train_loss: 1.0771, test_loss: 1.0367, test_f1: 0.4372
 epoch: 9, train_loss: 1.0707, test_loss: 1.0244, test_f1: 0.4501
 epoch: 10, train_loss: 1.0519, test_loss: 1.0134, test_f1: 0.4492
 epoch: 11, train_loss: 1.0446, test_loss: 1.0015, test_f1: 0.4569
 epoch: 12, train_loss: 1.0272, test_loss: 0.9874, test_f1: 0.4740
 epoch: 13, train_loss: 1.0222, test_loss: 0.9840, test_f1: 0.4680
 epoch: 14, train_loss: 1.0109, test_loss: 0.9817, test_f1: 0.4647
 epoch: 15, train_loss: 0.9977, test_loss: 0.9684, test_f1: 0.4813
 epoch: 16, train_loss: 0.9912, test_loss: 0.9539, test_f1: 0.4882
 epoch: 17, train_loss: 0.9836, test_loss: 0.9536, test_f1: 0.4923
 epoch: 18, train_loss: 0.9724, test_loss: 0.9511, test_f1: 0.4866
 epoch: 19, train_loss: 0.9679, test_loss: 0.9428, test_f1: 0.5001
 epoch: 20, train_loss: 0.9564, test_loss: 0.9379, test_f1: 0.4971
 epoch: 21, train_loss: 0.9541, test_loss: 0.9350, test_f1: 0.4918
 epoch: 22, train_loss: 0.9483, test_loss: 0.9322, test_f1: 0.4951
 epoch: 23, train_loss: 0.9471, test_loss: 0.9264, test_f1: 0.5023
 epoch: 24, train_loss: 0.9343, test_loss: 0.9243, test_f1: 0.5008
 epoch: 25, train_loss: 0.9386, test_loss: 0.9163, test_f1: 0.4967
 epoch: 26, train_loss: 0.9271, test_loss: 0.9168, test_f1: 0.5105
 epoch: 27, train_loss: 0.9253, test_loss: 0.9123, test_f1: 0.5071
 epoch: 28, train_loss: 0.9273, test_loss: 0.9145, test_f1: 0.5070
 epoch: 29, train_loss: 0.9212, test_loss: 0.9070, test_f1: 0.5159
 epoch: 30, train_loss: 0.9098, test_loss: 0.9026, test_f1: 0.5141
 epoch: 31, train_loss: 0.9053, test_loss: 0.8940, test_f1: 0.5176
 epoch: 32, train_loss: 0.9050, test_loss: 0.8946, test_f1: 0.5268
 epoch: 33, train_loss: 0.8952, test_loss: 0.8939, test_f1: 0.5285
 epoch: 34, train_loss: 0.8960, test_loss: 0.8859, test_f1: 0.5261
 epoch: 35, train_loss: 0.8896, test_loss: 0.8817, test_f1: 0.5298
 epoch: 36, train_loss: 0.8878, test_loss: 0.8839, test_f1: 0.5272
 epoch: 37, train_loss: 0.8915, test_loss: 0.8789, test_f1: 0.5257
 epoch: 38, train_loss: 0.8940, test_loss: 0.8793, test_f1: 0.5260
 epoch: 39, train_loss: 0.8813, test_loss: 0.8776, test_f1: 0.5293
 epoch: 40, train_loss: 0.8746, test_loss: 0.8711, test_f1: 0.5233
 epoch: 41, train_loss: 0.8702, test_loss: 0.8808, test_f1: 0.5326
 epoch: 42, train_loss: 0.8657, test_loss: 0.8778, test_f1: 0.5294
 epoch: 43, train_loss: 0.8649, test_loss: 0.8747, test_f1: 0.5251
 epoch: 44, train_loss: 0.8616, test_loss: 0.8860, test_f1: 0.5311
 epoch: 45, train_loss: 0.8660, test_loss: 0.8728, test_f1: 0.5385
 epoch: 46, train_loss: 0.8670, test_loss: 0.8616, test_f1: 0.5352
 epoch: 47, train_loss: 0.8545, test_loss: 0.8616, test_f1: 0.5436
 epoch: 48, train_loss: 0.8531, test_loss: 0.8656, test_f1: 0.5365
 epoch: 49, train_loss: 0.8600, test_loss: 0.8613, test_f1: 0.5347
 epoch: 50, train_loss: 0.8442, test_loss: 0.8588, test_f1: 0.5384
 epoch: 51, train_loss: 0.8451, test_loss: 0.8616, test_f1: 0.5392
 epoch: 52, train_loss: 0.8405, test_loss: 0.8647, test_f1: 0.5405
 epoch: 53, train_loss: 0.8493, test_loss: 0.8583, test_f1: 0.5422
 epoch: 54, train_loss: 0.8402, test_loss: 0.8593, test_f1: 0.5390
 epoch: 55, train_loss: 0.8372, test_loss: 0.8579, test_f1: 0.5417
 epoch: 56, train_loss: 0.8483, test_loss: 0.8609, test_f1: 0.5380
 epoch: 57, train_loss: 0.8281, test_loss: 0.8598, test_f1: 0.5384
 epoch: 58, train_loss: 0.8433, test_loss: 0.8635, test_f1: 0.5386
 epoch: 59, train_loss: 0.8346, test_loss: 0.8686, test_f1: 0.5352
 epoch: 60, train_loss: 0.8390, test_loss: 0.8554, test_f1: 0.5407
 epoch: 61, train_loss: 0.8323, test_loss: 0.8606, test_f1: 0.5409
 epoch: 62, train_loss: 0.8392, test_loss: 0.8543, test_f1: 0.5420
 epoch: 63, train_loss: 0.8279, test_loss: 0.8539, test_f1: 0.5418
 epoch: 64, train_loss: 0.8314, test_loss: 0.8588, test_f1: 0.5477
 epoch: 65, train_loss: 0.8305, test_loss: 0.8560, test_f1: 0.5394
 epoch: 66, train_loss: 0.8240, test_loss: 0.8578, test_f1: 0.5434
 epoch: 67, train_loss: 0.8211, test_loss: 0.8578, test_f1: 0.5379
 epoch: 68, train_loss: 0.8219, test_loss: 0.8534, test_f1: 0.5389
 epoch: 69, train_loss: 0.8260, test_loss: 0.8588, test_f1: 0.5468
 epoch: 70, train_loss: 0.8308, test_loss: 0.8573, test_f1: 0.5393
 epoch: 71, train_loss: 0.8263, test_loss: 0.8541, test_f1: 0.5448
 epoch: 72, train_loss: 0.8173, test_loss: 0.8551, test_f1: 0.5512
 epoch: 73, train_loss: 0.8224, test_loss: 0.8519, test_f1: 0.5417
 epoch: 74, train_loss: 0.8173, test_loss: 0.8563, test_f1: 0.5466
 epoch: 75, train_loss: 0.8190, test_loss: 0.8545, test_f1: 0.5553
 epoch: 76, train_loss: 0.8138, test_loss: 0.8534, test_f1: 0.5554
 epoch: 77, train_loss: 0.8270, test_loss: 0.8571, test_f1: 0.5488
 epoch: 78, train_loss: 0.8138, test_loss: 0.8512, test_f1: 0.5415
 epoch: 79, train_loss: 0.8187, test_loss: 0.8596, test_f1: 0.5429
 epoch: 80, train_loss: 0.8129, test_loss: 0.8569, test_f1: 0.5435
 epoch: 81, train_loss: 0.8194, test_loss: 0.8590, test_f1: 0.5422
 epoch: 82, train_loss: 0.8182, test_loss: 0.8512, test_f1: 0.5503
 epoch: 83, train_loss: 0.8120, test_loss: 0.8476, test_f1: 0.5534
 epoch: 84, train_loss: 0.8075, test_loss: 0.8601, test_f1: 0.5491
 epoch: 85, train_loss: 0.8064, test_loss: 0.8520, test_f1: 0.5482
 epoch: 86, train_loss: 0.8038, test_loss: 0.8516, test_f1: 0.5468
 epoch: 87, train_loss: 0.8064, test_loss: 0.8493, test_f1: 0.5483
 epoch: 88, train_loss: 0.8069, test_loss: 0.8534, test_f1: 0.5524
 epoch: 89, train_loss: 0.8067, test_loss: 0.8503, test_f1: 0.5468
 epoch: 90, train_loss: 0.8103, test_loss: 0.8458, test_f1: 0.5459
 epoch: 91, train_loss: 0.8023, test_loss: 0.8524, test_f1: 0.5504
 epoch: 92, train_loss: 0.8062, test_loss: 0.8530, test_f1: 0.5525
 epoch: 93, train_loss: 0.7989, test_loss: 0.8538, test_f1: 0.5497
 epoch: 94, train_loss: 0.8037, test_loss: 0.8535, test_f1: 0.5620
 epoch: 95, train_loss: 0.7990, test_loss: 0.8531, test_f1: 0.5520
 epoch: 96, train_loss: 0.8042, test_loss: 0.8578, test_f1: 0.5570
 epoch: 97, train_loss: 0.7954, test_loss: 0.8597, test_f1: 0.5558
 epoch: 98, train_loss: 0.8014, test_loss: 0.8551, test_f1: 0.5561
 epoch: 99, train_loss: 0.7974, test_loss: 0.8560, test_f1: 0.5487
##################ITERATION #5 ****************************************
 epoch: 0, train_loss: 1.2753, test_loss: 1.2458, test_f1: 0.2270
 epoch: 1, train_loss: 1.2021, test_loss: 1.1658, test_f1: 0.3373
 epoch: 2, train_loss: 1.1677, test_loss: 1.1166, test_f1: 0.3709
 epoch: 3, train_loss: 1.1471, test_loss: 1.0932, test_f1: 0.3847
 epoch: 4, train_loss: 1.1340, test_loss: 1.0751, test_f1: 0.4112
 epoch: 5, train_loss: 1.1085, test_loss: 1.0600, test_f1: 0.4261
 epoch: 6, train_loss: 1.0958, test_loss: 1.0444, test_f1: 0.4483
 epoch: 7, train_loss: 1.0778, test_loss: 1.0353, test_f1: 0.4470
 epoch: 8, train_loss: 1.0645, test_loss: 1.0223, test_f1: 0.4601
 epoch: 9, train_loss: 1.0526, test_loss: 1.0130, test_f1: 0.4620
 epoch: 10, train_loss: 1.0400, test_loss: 0.9972, test_f1: 0.4646
 epoch: 11, train_loss: 1.0297, test_loss: 0.9883, test_f1: 0.4686
 epoch: 12, train_loss: 1.0193, test_loss: 0.9844, test_f1: 0.4687
 epoch: 13, train_loss: 1.0027, test_loss: 0.9734, test_f1: 0.4701
 epoch: 14, train_loss: 0.9885, test_loss: 0.9651, test_f1: 0.4884
 epoch: 15, train_loss: 0.9906, test_loss: 0.9672, test_f1: 0.4803
 epoch: 16, train_loss: 0.9859, test_loss: 0.9587, test_f1: 0.4929
 epoch: 17, train_loss: 0.9803, test_loss: 0.9539, test_f1: 0.4888
 epoch: 18, train_loss: 0.9733, test_loss: 0.9475, test_f1: 0.4877
 epoch: 19, train_loss: 0.9647, test_loss: 0.9481, test_f1: 0.4842
 epoch: 20, train_loss: 0.9582, test_loss: 0.9438, test_f1: 0.4937
 epoch: 21, train_loss: 0.9605, test_loss: 0.9437, test_f1: 0.4870
 epoch: 22, train_loss: 0.9505, test_loss: 0.9380, test_f1: 0.4890
 epoch: 23, train_loss: 0.9465, test_loss: 0.9339, test_f1: 0.4846
 epoch: 24, train_loss: 0.9452, test_loss: 0.9397, test_f1: 0.5005
 epoch: 25, train_loss: 0.9339, test_loss: 0.9399, test_f1: 0.4893
 epoch: 26, train_loss: 0.9380, test_loss: 0.9391, test_f1: 0.5038
 epoch: 27, train_loss: 0.9352, test_loss: 0.9364, test_f1: 0.5020
 epoch: 28, train_loss: 0.9317, test_loss: 0.9245, test_f1: 0.5045
 epoch: 29, train_loss: 0.9194, test_loss: 0.9285, test_f1: 0.5005
 epoch: 30, train_loss: 0.9175, test_loss: 0.9297, test_f1: 0.5128
 epoch: 31, train_loss: 0.9150, test_loss: 0.9285, test_f1: 0.5073
 epoch: 32, train_loss: 0.9194, test_loss: 0.9246, test_f1: 0.4915
 epoch: 33, train_loss: 0.9230, test_loss: 0.9307, test_f1: 0.5102
 epoch: 34, train_loss: 0.9159, test_loss: 0.9198, test_f1: 0.5157
 epoch: 35, train_loss: 0.9033, test_loss: 0.9273, test_f1: 0.5027
 epoch: 36, train_loss: 0.9030, test_loss: 0.9207, test_f1: 0.5193
 epoch: 37, train_loss: 0.9069, test_loss: 0.9293, test_f1: 0.5132
 epoch: 38, train_loss: 0.8985, test_loss: 0.9198, test_f1: 0.5183
 epoch: 39, train_loss: 0.8958, test_loss: 0.9107, test_f1: 0.5249
 epoch: 40, train_loss: 0.8993, test_loss: 0.9227, test_f1: 0.5095
 epoch: 41, train_loss: 0.8905, test_loss: 0.9246, test_f1: 0.5093
 epoch: 42, train_loss: 0.8937, test_loss: 0.9121, test_f1: 0.5173
 epoch: 43, train_loss: 0.8921, test_loss: 0.9275, test_f1: 0.5075
 epoch: 44, train_loss: 0.8842, test_loss: 0.9225, test_f1: 0.5067
 epoch: 45, train_loss: 0.8759, test_loss: 0.9231, test_f1: 0.5121
 epoch: 46, train_loss: 0.8788, test_loss: 0.9162, test_f1: 0.5091
 epoch: 47, train_loss: 0.8705, test_loss: 0.9146, test_f1: 0.5113
 epoch: 48, train_loss: 0.8783, test_loss: 0.9043, test_f1: 0.5241
 epoch: 49, train_loss: 0.8781, test_loss: 0.9163, test_f1: 0.5195
 epoch: 50, train_loss: 0.8703, test_loss: 0.9160, test_f1: 0.5290
 epoch: 51, train_loss: 0.8721, test_loss: 0.9047, test_f1: 0.5308
 epoch: 52, train_loss: 0.8669, test_loss: 0.9158, test_f1: 0.5112
 epoch: 53, train_loss: 0.8642, test_loss: 0.9164, test_f1: 0.5197
 epoch: 54, train_loss: 0.8586, test_loss: 0.9223, test_f1: 0.5120
 epoch: 55, train_loss: 0.8559, test_loss: 0.9218, test_f1: 0.5177
 epoch: 56, train_loss: 0.8541, test_loss: 0.9134, test_f1: 0.5229
 epoch: 57, train_loss: 0.8546, test_loss: 0.9174, test_f1: 0.5189
 epoch: 58, train_loss: 0.8591, test_loss: 0.9248, test_f1: 0.5242
 epoch: 59, train_loss: 0.8467, test_loss: 0.9165, test_f1: 0.5193
 epoch: 60, train_loss: 0.8525, test_loss: 0.9162, test_f1: 0.5232
 epoch: 61, train_loss: 0.8532, test_loss: 0.9145, test_f1: 0.5259
 epoch: 62, train_loss: 0.8580, test_loss: 0.9225, test_f1: 0.5287
 epoch: 63, train_loss: 0.8584, test_loss: 0.9111, test_f1: 0.5163
 epoch: 64, train_loss: 0.8563, test_loss: 0.9236, test_f1: 0.5274
 epoch: 65, train_loss: 0.8461, test_loss: 0.9200, test_f1: 0.5316
 epoch: 66, train_loss: 0.8459, test_loss: 0.9228, test_f1: 0.5238
 epoch: 67, train_loss: 0.8471, test_loss: 0.9153, test_f1: 0.5289
 epoch: 68, train_loss: 0.8470, test_loss: 0.9240, test_f1: 0.5187
 epoch: 69, train_loss: 0.8407, test_loss: 0.9222, test_f1: 0.5156
 epoch: 70, train_loss: 0.8407, test_loss: 0.9154, test_f1: 0.5185
 epoch: 71, train_loss: 0.8431, test_loss: 0.9175, test_f1: 0.5206
 epoch: 72, train_loss: 0.8465, test_loss: 0.9249, test_f1: 0.5179
 epoch: 73, train_loss: 0.8409, test_loss: 0.9247, test_f1: 0.5260
 epoch: 74, train_loss: 0.8376, test_loss: 0.9206, test_f1: 0.5196
 epoch: 75, train_loss: 0.8369, test_loss: 0.9222, test_f1: 0.5258
 epoch: 76, train_loss: 0.8344, test_loss: 0.9201, test_f1: 0.5304
 epoch: 77, train_loss: 0.8377, test_loss: 0.9276, test_f1: 0.5441
 epoch: 78, train_loss: 0.8340, test_loss: 0.9190, test_f1: 0.5271
 epoch: 79, train_loss: 0.8343, test_loss: 0.9188, test_f1: 0.5235
 epoch: 80, train_loss: 0.8333, test_loss: 0.9249, test_f1: 0.5233
 epoch: 81, train_loss: 0.8315, test_loss: 0.9229, test_f1: 0.5310
 epoch: 82, train_loss: 0.8414, test_loss: 0.9209, test_f1: 0.5250
 epoch: 83, train_loss: 0.8351, test_loss: 0.9160, test_f1: 0.5375
 epoch: 84, train_loss: 0.8228, test_loss: 0.9291, test_f1: 0.5381
 epoch: 85, train_loss: 0.8196, test_loss: 0.9234, test_f1: 0.5375
 epoch: 86, train_loss: 0.8276, test_loss: 0.9260, test_f1: 0.5384
 epoch: 87, train_loss: 0.8351, test_loss: 0.9311, test_f1: 0.5214
 epoch: 88, train_loss: 0.8323, test_loss: 0.9263, test_f1: 0.5363
 epoch: 89, train_loss: 0.8323, test_loss: 0.9160, test_f1: 0.5374
 epoch: 90, train_loss: 0.8222, test_loss: 0.9231, test_f1: 0.5327
 epoch: 91, train_loss: 0.8272, test_loss: 0.9297, test_f1: 0.5377
 epoch: 92, train_loss: 0.8240, test_loss: 0.9170, test_f1: 0.5362
 epoch: 93, train_loss: 0.8169, test_loss: 0.9278, test_f1: 0.5304
 epoch: 94, train_loss: 0.8194, test_loss: 0.9253, test_f1: 0.5463
 epoch: 95, train_loss: 0.8109, test_loss: 0.9251, test_f1: 0.5320
 epoch: 96, train_loss: 0.8175, test_loss: 0.9246, test_f1: 0.5347
 epoch: 97, train_loss: 0.8212, test_loss: 0.9133, test_f1: 0.5326
 epoch: 98, train_loss: 0.8168, test_loss: 0.9192, test_f1: 0.5305
 epoch: 99, train_loss: 0.8143, test_loss: 0.9340, test_f1: 0.5274
##################ITERATION #6 ****************************************
 epoch: 0, train_loss: 1.3176, test_loss: 1.3141, test_f1: 0.2270
 epoch: 1, train_loss: 1.2106, test_loss: 1.2134, test_f1: 0.2569
 epoch: 2, train_loss: 1.1812, test_loss: 1.1383, test_f1: 0.3391
 epoch: 3, train_loss: 1.1533, test_loss: 1.1020, test_f1: 0.3594
 epoch: 4, train_loss: 1.1374, test_loss: 1.0818, test_f1: 0.3828
 epoch: 5, train_loss: 1.1081, test_loss: 1.0661, test_f1: 0.4065
 epoch: 6, train_loss: 1.0918, test_loss: 1.0519, test_f1: 0.4237
 epoch: 7, train_loss: 1.0751, test_loss: 1.0385, test_f1: 0.4410
 epoch: 8, train_loss: 1.0575, test_loss: 1.0263, test_f1: 0.4600
 epoch: 9, train_loss: 1.0442, test_loss: 1.0221, test_f1: 0.4678
 epoch: 10, train_loss: 1.0307, test_loss: 1.0172, test_f1: 0.4522
 epoch: 11, train_loss: 1.0249, test_loss: 1.0041, test_f1: 0.4740
 epoch: 12, train_loss: 1.0138, test_loss: 1.0069, test_f1: 0.4663
 epoch: 13, train_loss: 1.0045, test_loss: 0.9982, test_f1: 0.4718
 epoch: 14, train_loss: 0.9953, test_loss: 0.9931, test_f1: 0.4806
 epoch: 15, train_loss: 0.9884, test_loss: 0.9917, test_f1: 0.4854
 epoch: 16, train_loss: 0.9843, test_loss: 0.9890, test_f1: 0.4851
 epoch: 17, train_loss: 0.9801, test_loss: 0.9818, test_f1: 0.4898
 epoch: 18, train_loss: 0.9729, test_loss: 0.9828, test_f1: 0.4834
 epoch: 19, train_loss: 0.9672, test_loss: 0.9800, test_f1: 0.4874
 epoch: 20, train_loss: 0.9567, test_loss: 0.9744, test_f1: 0.4867
 epoch: 21, train_loss: 0.9566, test_loss: 0.9853, test_f1: 0.5007
 epoch: 22, train_loss: 0.9407, test_loss: 0.9775, test_f1: 0.5091
 epoch: 23, train_loss: 0.9435, test_loss: 0.9666, test_f1: 0.5077
 epoch: 24, train_loss: 0.9351, test_loss: 0.9765, test_f1: 0.4998
 epoch: 25, train_loss: 0.9339, test_loss: 0.9704, test_f1: 0.5210
 epoch: 26, train_loss: 0.9314, test_loss: 0.9713, test_f1: 0.5109
 epoch: 27, train_loss: 0.9288, test_loss: 0.9688, test_f1: 0.5232
 epoch: 28, train_loss: 0.9193, test_loss: 0.9747, test_f1: 0.5158
 epoch: 29, train_loss: 0.9225, test_loss: 0.9785, test_f1: 0.5199
 epoch: 30, train_loss: 0.9226, test_loss: 0.9756, test_f1: 0.5377
 epoch: 31, train_loss: 0.9086, test_loss: 0.9751, test_f1: 0.5338
 epoch: 32, train_loss: 0.9077, test_loss: 0.9778, test_f1: 0.5277
 epoch: 33, train_loss: 0.9031, test_loss: 0.9663, test_f1: 0.5296
 epoch: 34, train_loss: 0.8983, test_loss: 0.9758, test_f1: 0.5335
 epoch: 35, train_loss: 0.9060, test_loss: 0.9788, test_f1: 0.5458
 epoch: 36, train_loss: 0.8976, test_loss: 0.9689, test_f1: 0.5429
 epoch: 37, train_loss: 0.8855, test_loss: 0.9740, test_f1: 0.5313
 epoch: 38, train_loss: 0.8831, test_loss: 0.9792, test_f1: 0.5394
 epoch: 39, train_loss: 0.8892, test_loss: 0.9836, test_f1: 0.5351
 epoch: 40, train_loss: 0.8811, test_loss: 0.9779, test_f1: 0.5414
 epoch: 41, train_loss: 0.8740, test_loss: 0.9749, test_f1: 0.5468
 epoch: 42, train_loss: 0.8726, test_loss: 0.9731, test_f1: 0.5356
 epoch: 43, train_loss: 0.8753, test_loss: 0.9886, test_f1: 0.5427
 epoch: 44, train_loss: 0.8704, test_loss: 0.9860, test_f1: 0.5438
 epoch: 45, train_loss: 0.8675, test_loss: 0.9865, test_f1: 0.5415
 epoch: 46, train_loss: 0.8624, test_loss: 0.9782, test_f1: 0.5392
 epoch: 47, train_loss: 0.8622, test_loss: 0.9740, test_f1: 0.5406
 epoch: 48, train_loss: 0.8547, test_loss: 0.9803, test_f1: 0.5367
 epoch: 49, train_loss: 0.8553, test_loss: 0.9789, test_f1: 0.5486
 epoch: 50, train_loss: 0.8525, test_loss: 0.9803, test_f1: 0.5374
 epoch: 51, train_loss: 0.8556, test_loss: 0.9840, test_f1: 0.5384
 epoch: 52, train_loss: 0.8438, test_loss: 0.9844, test_f1: 0.5446
 epoch: 53, train_loss: 0.8414, test_loss: 0.9787, test_f1: 0.5414
 epoch: 54, train_loss: 0.8454, test_loss: 0.9782, test_f1: 0.5367
 epoch: 55, train_loss: 0.8461, test_loss: 0.9822, test_f1: 0.5501
 epoch: 56, train_loss: 0.8419, test_loss: 0.9740, test_f1: 0.5494
 epoch: 57, train_loss: 0.8451, test_loss: 0.9833, test_f1: 0.5411
 epoch: 58, train_loss: 0.8348, test_loss: 0.9832, test_f1: 0.5520
 epoch: 59, train_loss: 0.8429, test_loss: 0.9836, test_f1: 0.5472
 epoch: 60, train_loss: 0.8370, test_loss: 0.9817, test_f1: 0.5379
 epoch: 61, train_loss: 0.8399, test_loss: 0.9845, test_f1: 0.5346
 epoch: 62, train_loss: 0.8313, test_loss: 0.9879, test_f1: 0.5400
 epoch: 63, train_loss: 0.8298, test_loss: 0.9898, test_f1: 0.5445
 epoch: 64, train_loss: 0.8302, test_loss: 0.9910, test_f1: 0.5399
 epoch: 65, train_loss: 0.8392, test_loss: 0.9906, test_f1: 0.5484
 epoch: 66, train_loss: 0.8319, test_loss: 0.9846, test_f1: 0.5534
 epoch: 67, train_loss: 0.8250, test_loss: 0.9936, test_f1: 0.5460
 epoch: 68, train_loss: 0.8295, test_loss: 0.9940, test_f1: 0.5544
 epoch: 69, train_loss: 0.8172, test_loss: 0.9842, test_f1: 0.5462
 epoch: 70, train_loss: 0.8277, test_loss: 0.9800, test_f1: 0.5428
 epoch: 71, train_loss: 0.8263, test_loss: 1.0015, test_f1: 0.5450
 epoch: 72, train_loss: 0.8238, test_loss: 0.9865, test_f1: 0.5458
 epoch: 73, train_loss: 0.8264, test_loss: 0.9940, test_f1: 0.5508
 epoch: 74, train_loss: 0.8282, test_loss: 0.9839, test_f1: 0.5490
 epoch: 75, train_loss: 0.8241, test_loss: 0.9998, test_f1: 0.5527
 epoch: 76, train_loss: 0.8242, test_loss: 0.9900, test_f1: 0.5508
 epoch: 77, train_loss: 0.8267, test_loss: 0.9967, test_f1: 0.5552
 epoch: 78, train_loss: 0.8164, test_loss: 0.9996, test_f1: 0.5465
 epoch: 79, train_loss: 0.8221, test_loss: 0.9958, test_f1: 0.5442
 epoch: 80, train_loss: 0.8193, test_loss: 0.9900, test_f1: 0.5491
 epoch: 81, train_loss: 0.8121, test_loss: 0.9994, test_f1: 0.5551
 epoch: 82, train_loss: 0.8020, test_loss: 0.9935, test_f1: 0.5529
 epoch: 83, train_loss: 0.8195, test_loss: 0.9951, test_f1: 0.5542
 epoch: 84, train_loss: 0.8148, test_loss: 1.0009, test_f1: 0.5571
 epoch: 85, train_loss: 0.8116, test_loss: 1.0027, test_f1: 0.5547
 epoch: 86, train_loss: 0.8136, test_loss: 0.9993, test_f1: 0.5537
 epoch: 87, train_loss: 0.8109, test_loss: 0.9883, test_f1: 0.5615
 epoch: 88, train_loss: 0.8075, test_loss: 1.0054, test_f1: 0.5504
 epoch: 89, train_loss: 0.8038, test_loss: 1.0035, test_f1: 0.5605
 epoch: 90, train_loss: 0.8042, test_loss: 1.0058, test_f1: 0.5516
 epoch: 91, train_loss: 0.8162, test_loss: 0.9963, test_f1: 0.5595
 epoch: 92, train_loss: 0.8014, test_loss: 1.0037, test_f1: 0.5579
 epoch: 93, train_loss: 0.8022, test_loss: 0.9953, test_f1: 0.5448
 epoch: 94, train_loss: 0.8052, test_loss: 0.9990, test_f1: 0.5563
 epoch: 95, train_loss: 0.8013, test_loss: 0.9979, test_f1: 0.5535
 epoch: 96, train_loss: 0.7995, test_loss: 0.9937, test_f1: 0.5629
 epoch: 97, train_loss: 0.8051, test_loss: 0.9954, test_f1: 0.5659
 epoch: 98, train_loss: 0.7961, test_loss: 1.0071, test_f1: 0.5541
 epoch: 99, train_loss: 0.7958, test_loss: 0.9969, test_f1: 0.5629
##################ITERATION #7 ****************************************
 epoch: 0, train_loss: 1.3434, test_loss: 1.3205, test_f1: 0.2270
 epoch: 1, train_loss: 1.2147, test_loss: 1.2150, test_f1: 0.2295
 epoch: 2, train_loss: 1.1845, test_loss: 1.1205, test_f1: 0.3447
 epoch: 3, train_loss: 1.1587, test_loss: 1.0881, test_f1: 0.3951
 epoch: 4, train_loss: 1.1355, test_loss: 1.0681, test_f1: 0.4140
 epoch: 5, train_loss: 1.1164, test_loss: 1.0550, test_f1: 0.4382
 epoch: 6, train_loss: 1.0989, test_loss: 1.0417, test_f1: 0.4453
 epoch: 7, train_loss: 1.0820, test_loss: 1.0299, test_f1: 0.4388
 epoch: 8, train_loss: 1.0707, test_loss: 1.0228, test_f1: 0.4342
 epoch: 9, train_loss: 1.0549, test_loss: 1.0099, test_f1: 0.4535
 epoch: 10, train_loss: 1.0592, test_loss: 1.0050, test_f1: 0.4375
 epoch: 11, train_loss: 1.0365, test_loss: 1.0040, test_f1: 0.4442
 epoch: 12, train_loss: 1.0224, test_loss: 0.9958, test_f1: 0.4464
 epoch: 13, train_loss: 1.0241, test_loss: 0.9920, test_f1: 0.4471
 epoch: 14, train_loss: 1.0085, test_loss: 0.9897, test_f1: 0.4454
 epoch: 15, train_loss: 1.0051, test_loss: 0.9791, test_f1: 0.4669
 epoch: 16, train_loss: 0.9882, test_loss: 0.9795, test_f1: 0.4638
 epoch: 17, train_loss: 0.9941, test_loss: 0.9728, test_f1: 0.4677
 epoch: 18, train_loss: 0.9841, test_loss: 0.9687, test_f1: 0.4701
 epoch: 19, train_loss: 0.9789, test_loss: 0.9734, test_f1: 0.4852
 epoch: 20, train_loss: 0.9750, test_loss: 0.9646, test_f1: 0.4708
 epoch: 21, train_loss: 0.9673, test_loss: 0.9667, test_f1: 0.4863
 epoch: 22, train_loss: 0.9634, test_loss: 0.9649, test_f1: 0.4852
 epoch: 23, train_loss: 0.9678, test_loss: 0.9554, test_f1: 0.4900
 epoch: 24, train_loss: 0.9473, test_loss: 0.9541, test_f1: 0.4948
 epoch: 25, train_loss: 0.9452, test_loss: 0.9571, test_f1: 0.4971
 epoch: 26, train_loss: 0.9447, test_loss: 0.9489, test_f1: 0.4975
 epoch: 27, train_loss: 0.9423, test_loss: 0.9476, test_f1: 0.4927
 epoch: 28, train_loss: 0.9343, test_loss: 0.9441, test_f1: 0.5052
 epoch: 29, train_loss: 0.9321, test_loss: 0.9450, test_f1: 0.5159
 epoch: 30, train_loss: 0.9294, test_loss: 0.9405, test_f1: 0.5122
 epoch: 31, train_loss: 0.9386, test_loss: 0.9443, test_f1: 0.5221
 epoch: 32, train_loss: 0.9207, test_loss: 0.9394, test_f1: 0.5356
 epoch: 33, train_loss: 0.9172, test_loss: 0.9332, test_f1: 0.5235
 epoch: 34, train_loss: 0.9137, test_loss: 0.9361, test_f1: 0.5224
 epoch: 35, train_loss: 0.9137, test_loss: 0.9262, test_f1: 0.5253
 epoch: 36, train_loss: 0.9068, test_loss: 0.9274, test_f1: 0.5240
 epoch: 37, train_loss: 0.9161, test_loss: 0.9270, test_f1: 0.5409
 epoch: 38, train_loss: 0.9028, test_loss: 0.9232, test_f1: 0.5385
 epoch: 39, train_loss: 0.9020, test_loss: 0.9263, test_f1: 0.5372
 epoch: 40, train_loss: 0.8989, test_loss: 0.9179, test_f1: 0.5318
 epoch: 41, train_loss: 0.8989, test_loss: 0.9125, test_f1: 0.5360
 epoch: 42, train_loss: 0.8887, test_loss: 0.9190, test_f1: 0.5375
 epoch: 43, train_loss: 0.8861, test_loss: 0.9174, test_f1: 0.5363
 epoch: 44, train_loss: 0.8843, test_loss: 0.9190, test_f1: 0.5282
 epoch: 45, train_loss: 0.8830, test_loss: 0.9208, test_f1: 0.5189
 epoch: 46, train_loss: 0.8865, test_loss: 0.9189, test_f1: 0.5351
 epoch: 47, train_loss: 0.8871, test_loss: 0.9129, test_f1: 0.5316
 epoch: 48, train_loss: 0.8729, test_loss: 0.9065, test_f1: 0.5299
 epoch: 49, train_loss: 0.8790, test_loss: 0.9197, test_f1: 0.5293
 epoch: 50, train_loss: 0.8735, test_loss: 0.9135, test_f1: 0.5282
 epoch: 51, train_loss: 0.8709, test_loss: 0.9096, test_f1: 0.5314
 epoch: 52, train_loss: 0.8612, test_loss: 0.9084, test_f1: 0.5304
 epoch: 53, train_loss: 0.8704, test_loss: 0.9043, test_f1: 0.5320
 epoch: 54, train_loss: 0.8662, test_loss: 0.9141, test_f1: 0.5443
 epoch: 55, train_loss: 0.8687, test_loss: 0.9171, test_f1: 0.5357
 epoch: 56, train_loss: 0.8580, test_loss: 0.9091, test_f1: 0.5440
 epoch: 57, train_loss: 0.8653, test_loss: 0.9051, test_f1: 0.5385
 epoch: 58, train_loss: 0.8633, test_loss: 0.9162, test_f1: 0.5449
 epoch: 59, train_loss: 0.8547, test_loss: 0.9041, test_f1: 0.5497
 epoch: 60, train_loss: 0.8573, test_loss: 0.9127, test_f1: 0.5477
 epoch: 61, train_loss: 0.8635, test_loss: 0.9091, test_f1: 0.5430
 epoch: 62, train_loss: 0.8555, test_loss: 0.9084, test_f1: 0.5457
 epoch: 63, train_loss: 0.8637, test_loss: 0.9018, test_f1: 0.5447
 epoch: 64, train_loss: 0.8473, test_loss: 0.9080, test_f1: 0.5457
 epoch: 65, train_loss: 0.8604, test_loss: 0.9064, test_f1: 0.5493
 epoch: 66, train_loss: 0.8452, test_loss: 0.9023, test_f1: 0.5486
 epoch: 67, train_loss: 0.8602, test_loss: 0.9014, test_f1: 0.5473
 epoch: 68, train_loss: 0.8527, test_loss: 0.9077, test_f1: 0.5433
 epoch: 69, train_loss: 0.8490, test_loss: 0.9001, test_f1: 0.5501
 epoch: 70, train_loss: 0.8486, test_loss: 0.9123, test_f1: 0.5469
 epoch: 71, train_loss: 0.8561, test_loss: 0.9027, test_f1: 0.5436
 epoch: 72, train_loss: 0.8489, test_loss: 0.9104, test_f1: 0.5461
 epoch: 73, train_loss: 0.8457, test_loss: 0.9108, test_f1: 0.5341
 epoch: 74, train_loss: 0.8456, test_loss: 0.9107, test_f1: 0.5361
 epoch: 75, train_loss: 0.8445, test_loss: 0.9044, test_f1: 0.5383
 epoch: 76, train_loss: 0.8469, test_loss: 0.9076, test_f1: 0.5486
 epoch: 77, train_loss: 0.8455, test_loss: 0.9022, test_f1: 0.5358
 epoch: 78, train_loss: 0.8440, test_loss: 0.9018, test_f1: 0.5341
 epoch: 79, train_loss: 0.8406, test_loss: 0.9000, test_f1: 0.5509
 epoch: 80, train_loss: 0.8434, test_loss: 0.9052, test_f1: 0.5504
 epoch: 81, train_loss: 0.8388, test_loss: 0.8973, test_f1: 0.5524
 epoch: 82, train_loss: 0.8328, test_loss: 0.9010, test_f1: 0.5497
 epoch: 83, train_loss: 0.8356, test_loss: 0.8989, test_f1: 0.5390
 epoch: 84, train_loss: 0.8351, test_loss: 0.8949, test_f1: 0.5405
 epoch: 85, train_loss: 0.8299, test_loss: 0.9014, test_f1: 0.5408
 epoch: 86, train_loss: 0.8385, test_loss: 0.8994, test_f1: 0.5507
 epoch: 87, train_loss: 0.8320, test_loss: 0.8976, test_f1: 0.5485
 epoch: 88, train_loss: 0.8285, test_loss: 0.8990, test_f1: 0.5493
 epoch: 89, train_loss: 0.8302, test_loss: 0.8978, test_f1: 0.5443
 epoch: 90, train_loss: 0.8285, test_loss: 0.8927, test_f1: 0.5501
 epoch: 91, train_loss: 0.8366, test_loss: 0.8930, test_f1: 0.5498
 epoch: 92, train_loss: 0.8387, test_loss: 0.9051, test_f1: 0.5454
 epoch: 93, train_loss: 0.8258, test_loss: 0.9002, test_f1: 0.5491
 epoch: 94, train_loss: 0.8255, test_loss: 0.8957, test_f1: 0.5520
 epoch: 95, train_loss: 0.8234, test_loss: 0.9114, test_f1: 0.5400
 epoch: 96, train_loss: 0.8224, test_loss: 0.8971, test_f1: 0.5456
 epoch: 97, train_loss: 0.8258, test_loss: 0.8908, test_f1: 0.5462
 epoch: 98, train_loss: 0.8105, test_loss: 0.9008, test_f1: 0.5523
 epoch: 99, train_loss: 0.8174, test_loss: 0.9113, test_f1: 0.5509
##################ITERATION #8 ****************************************
 epoch: 0, train_loss: 1.2843, test_loss: 1.2392, test_f1: 0.2295
 epoch: 1, train_loss: 1.1922, test_loss: 1.1644, test_f1: 0.3096
 epoch: 2, train_loss: 1.1691, test_loss: 1.0974, test_f1: 0.3706
 epoch: 3, train_loss: 1.1450, test_loss: 1.0768, test_f1: 0.3888
 epoch: 4, train_loss: 1.1080, test_loss: 1.0536, test_f1: 0.4079
 epoch: 5, train_loss: 1.1062, test_loss: 1.0358, test_f1: 0.4196
 epoch: 6, train_loss: 1.0754, test_loss: 1.0203, test_f1: 0.4252
 epoch: 7, train_loss: 1.0653, test_loss: 1.0105, test_f1: 0.4315
 epoch: 8, train_loss: 1.0444, test_loss: 0.9983, test_f1: 0.4457
 epoch: 9, train_loss: 1.0330, test_loss: 0.9924, test_f1: 0.4512
 epoch: 10, train_loss: 1.0284, test_loss: 0.9867, test_f1: 0.4503
 epoch: 11, train_loss: 1.0170, test_loss: 0.9760, test_f1: 0.4666
 epoch: 12, train_loss: 1.0007, test_loss: 0.9708, test_f1: 0.4688
 epoch: 13, train_loss: 0.9941, test_loss: 0.9649, test_f1: 0.4909
 epoch: 14, train_loss: 0.9884, test_loss: 0.9696, test_f1: 0.4722
 epoch: 15, train_loss: 0.9821, test_loss: 0.9664, test_f1: 0.5065
 epoch: 16, train_loss: 0.9751, test_loss: 0.9617, test_f1: 0.5080
 epoch: 17, train_loss: 0.9739, test_loss: 0.9609, test_f1: 0.4993
 epoch: 18, train_loss: 0.9682, test_loss: 0.9543, test_f1: 0.5038
 epoch: 19, train_loss: 0.9679, test_loss: 0.9551, test_f1: 0.5044
 epoch: 20, train_loss: 0.9529, test_loss: 0.9550, test_f1: 0.5214
 epoch: 21, train_loss: 0.9491, test_loss: 0.9502, test_f1: 0.5154
 epoch: 22, train_loss: 0.9478, test_loss: 0.9525, test_f1: 0.5131
 epoch: 23, train_loss: 0.9458, test_loss: 0.9576, test_f1: 0.5114
 epoch: 24, train_loss: 0.9367, test_loss: 0.9469, test_f1: 0.5099
 epoch: 25, train_loss: 0.9294, test_loss: 0.9473, test_f1: 0.5267
 epoch: 26, train_loss: 0.9328, test_loss: 0.9470, test_f1: 0.5213
 epoch: 27, train_loss: 0.9224, test_loss: 0.9621, test_f1: 0.5071
 epoch: 28, train_loss: 0.9198, test_loss: 0.9503, test_f1: 0.5036
 epoch: 29, train_loss: 0.9298, test_loss: 0.9468, test_f1: 0.5317
 epoch: 30, train_loss: 0.9170, test_loss: 0.9454, test_f1: 0.5270
 epoch: 31, train_loss: 0.9242, test_loss: 0.9490, test_f1: 0.5145
 epoch: 32, train_loss: 0.9111, test_loss: 0.9460, test_f1: 0.5273
 epoch: 33, train_loss: 0.9147, test_loss: 0.9418, test_f1: 0.5055
 epoch: 34, train_loss: 0.9048, test_loss: 0.9519, test_f1: 0.5089
 epoch: 35, train_loss: 0.9011, test_loss: 0.9456, test_f1: 0.5234
 epoch: 36, train_loss: 0.9090, test_loss: 0.9441, test_f1: 0.5203
 epoch: 37, train_loss: 0.9044, test_loss: 0.9537, test_f1: 0.5126
 epoch: 38, train_loss: 0.8924, test_loss: 0.9478, test_f1: 0.5312
 epoch: 39, train_loss: 0.8963, test_loss: 0.9495, test_f1: 0.5182
 epoch: 40, train_loss: 0.8879, test_loss: 0.9514, test_f1: 0.5190
 epoch: 41, train_loss: 0.8941, test_loss: 0.9483, test_f1: 0.5234
 epoch: 42, train_loss: 0.8866, test_loss: 0.9396, test_f1: 0.5245
 epoch: 43, train_loss: 0.8924, test_loss: 0.9563, test_f1: 0.5174
 epoch: 44, train_loss: 0.8854, test_loss: 0.9422, test_f1: 0.5210
 epoch: 45, train_loss: 0.8838, test_loss: 0.9421, test_f1: 0.5302
 epoch: 46, train_loss: 0.8808, test_loss: 0.9479, test_f1: 0.5283
 epoch: 47, train_loss: 0.8748, test_loss: 0.9466, test_f1: 0.5223
 epoch: 48, train_loss: 0.8752, test_loss: 0.9401, test_f1: 0.5225
 epoch: 49, train_loss: 0.8764, test_loss: 0.9547, test_f1: 0.5200
 epoch: 50, train_loss: 0.8702, test_loss: 0.9471, test_f1: 0.5315
 epoch: 51, train_loss: 0.8603, test_loss: 0.9426, test_f1: 0.5231
 epoch: 52, train_loss: 0.8755, test_loss: 0.9389, test_f1: 0.5392
 epoch: 53, train_loss: 0.8574, test_loss: 0.9487, test_f1: 0.5330
 epoch: 54, train_loss: 0.8614, test_loss: 0.9412, test_f1: 0.5347
 epoch: 55, train_loss: 0.8607, test_loss: 0.9416, test_f1: 0.5238
 epoch: 56, train_loss: 0.8634, test_loss: 0.9469, test_f1: 0.5323
 epoch: 57, train_loss: 0.8572, test_loss: 0.9505, test_f1: 0.5267
 epoch: 58, train_loss: 0.8545, test_loss: 0.9474, test_f1: 0.5254
 epoch: 59, train_loss: 0.8573, test_loss: 0.9465, test_f1: 0.5344
 epoch: 60, train_loss: 0.8544, test_loss: 0.9454, test_f1: 0.5234
 epoch: 61, train_loss: 0.8541, test_loss: 0.9512, test_f1: 0.5332
 epoch: 62, train_loss: 0.8558, test_loss: 0.9517, test_f1: 0.5261
 epoch: 63, train_loss: 0.8560, test_loss: 0.9539, test_f1: 0.5270
 epoch: 64, train_loss: 0.8530, test_loss: 0.9455, test_f1: 0.5278
 epoch: 65, train_loss: 0.8499, test_loss: 0.9492, test_f1: 0.5222
 epoch: 66, train_loss: 0.8551, test_loss: 0.9348, test_f1: 0.5308
 epoch: 67, train_loss: 0.8478, test_loss: 0.9464, test_f1: 0.5230
 epoch: 68, train_loss: 0.8491, test_loss: 0.9450, test_f1: 0.5293
 epoch: 69, train_loss: 0.8463, test_loss: 0.9400, test_f1: 0.5263
 epoch: 70, train_loss: 0.8410, test_loss: 0.9464, test_f1: 0.5255
 epoch: 71, train_loss: 0.8454, test_loss: 0.9482, test_f1: 0.5368
 epoch: 72, train_loss: 0.8425, test_loss: 0.9466, test_f1: 0.5254
 epoch: 73, train_loss: 0.8399, test_loss: 0.9429, test_f1: 0.5243
 epoch: 74, train_loss: 0.8510, test_loss: 0.9533, test_f1: 0.5297
 epoch: 75, train_loss: 0.8433, test_loss: 0.9495, test_f1: 0.5238
 epoch: 76, train_loss: 0.8389, test_loss: 0.9469, test_f1: 0.5213
 epoch: 77, train_loss: 0.8359, test_loss: 0.9489, test_f1: 0.5188
 epoch: 78, train_loss: 0.8456, test_loss: 0.9491, test_f1: 0.5201
 epoch: 79, train_loss: 0.8407, test_loss: 0.9533, test_f1: 0.5202
 epoch: 80, train_loss: 0.8350, test_loss: 0.9479, test_f1: 0.5261
 epoch: 81, train_loss: 0.8380, test_loss: 0.9470, test_f1: 0.5255
 epoch: 82, train_loss: 0.8351, test_loss: 0.9519, test_f1: 0.5242
 epoch: 83, train_loss: 0.8319, test_loss: 0.9562, test_f1: 0.5174
 epoch: 84, train_loss: 0.8429, test_loss: 0.9559, test_f1: 0.5177
 epoch: 85, train_loss: 0.8336, test_loss: 0.9499, test_f1: 0.5188
 epoch: 86, train_loss: 0.8331, test_loss: 0.9469, test_f1: 0.5264
 epoch: 87, train_loss: 0.8296, test_loss: 0.9540, test_f1: 0.5219
 epoch: 88, train_loss: 0.8310, test_loss: 0.9553, test_f1: 0.5173
 epoch: 89, train_loss: 0.8208, test_loss: 0.9492, test_f1: 0.5241
 epoch: 90, train_loss: 0.8326, test_loss: 0.9503, test_f1: 0.5259
 epoch: 91, train_loss: 0.8244, test_loss: 0.9615, test_f1: 0.5284
 epoch: 92, train_loss: 0.8205, test_loss: 0.9482, test_f1: 0.5214
 epoch: 93, train_loss: 0.8161, test_loss: 0.9490, test_f1: 0.5261
 epoch: 94, train_loss: 0.8356, test_loss: 0.9495, test_f1: 0.5265
 epoch: 95, train_loss: 0.8225, test_loss: 0.9565, test_f1: 0.5218
 epoch: 96, train_loss: 0.8218, test_loss: 0.9535, test_f1: 0.5212
 epoch: 97, train_loss: 0.8172, test_loss: 0.9582, test_f1: 0.5206
 epoch: 98, train_loss: 0.8198, test_loss: 0.9593, test_f1: 0.5188
 epoch: 99, train_loss: 0.8160, test_loss: 0.9473, test_f1: 0.5257
##################ITERATION #9 ****************************************
 epoch: 0, train_loss: 1.3749, test_loss: 1.2929, test_f1: 0.2270
 epoch: 1, train_loss: 1.2399, test_loss: 1.1591, test_f1: 0.3221
 epoch: 2, train_loss: 1.2008, test_loss: 1.1029, test_f1: 0.3761
 epoch: 3, train_loss: 1.1714, test_loss: 1.0695, test_f1: 0.3829
 epoch: 4, train_loss: 1.1439, test_loss: 1.0517, test_f1: 0.4006
 epoch: 5, train_loss: 1.1257, test_loss: 1.0382, test_f1: 0.4053
 epoch: 6, train_loss: 1.0965, test_loss: 1.0276, test_f1: 0.4095
 epoch: 7, train_loss: 1.0850, test_loss: 1.0139, test_f1: 0.4280
 epoch: 8, train_loss: 1.0771, test_loss: 1.0092, test_f1: 0.4373
 epoch: 9, train_loss: 1.0681, test_loss: 1.0023, test_f1: 0.4453
 epoch: 10, train_loss: 1.0534, test_loss: 0.9912, test_f1: 0.4570
 epoch: 11, train_loss: 1.0375, test_loss: 0.9909, test_f1: 0.4638
 epoch: 12, train_loss: 1.0373, test_loss: 0.9820, test_f1: 0.4607
 epoch: 13, train_loss: 1.0181, test_loss: 0.9780, test_f1: 0.4579
 epoch: 14, train_loss: 1.0115, test_loss: 0.9726, test_f1: 0.4633
 epoch: 15, train_loss: 1.0153, test_loss: 0.9661, test_f1: 0.4627
 epoch: 16, train_loss: 0.9937, test_loss: 0.9589, test_f1: 0.4630
 epoch: 17, train_loss: 1.0019, test_loss: 0.9616, test_f1: 0.4623
 epoch: 18, train_loss: 0.9848, test_loss: 0.9596, test_f1: 0.4725
 epoch: 19, train_loss: 0.9922, test_loss: 0.9581, test_f1: 0.4760
 epoch: 20, train_loss: 0.9786, test_loss: 0.9486, test_f1: 0.4754
 epoch: 21, train_loss: 0.9790, test_loss: 0.9512, test_f1: 0.4737
 epoch: 22, train_loss: 0.9673, test_loss: 0.9447, test_f1: 0.4784
 epoch: 23, train_loss: 0.9575, test_loss: 0.9432, test_f1: 0.4825
 epoch: 24, train_loss: 0.9637, test_loss: 0.9496, test_f1: 0.4903
 epoch: 25, train_loss: 0.9541, test_loss: 0.9422, test_f1: 0.4925
 epoch: 26, train_loss: 0.9529, test_loss: 0.9404, test_f1: 0.4843
 epoch: 27, train_loss: 0.9447, test_loss: 0.9383, test_f1: 0.4918
 epoch: 28, train_loss: 0.9436, test_loss: 0.9339, test_f1: 0.4923
 epoch: 29, train_loss: 0.9421, test_loss: 0.9266, test_f1: 0.4918
 epoch: 30, train_loss: 0.9351, test_loss: 0.9299, test_f1: 0.4981
 epoch: 31, train_loss: 0.9260, test_loss: 0.9358, test_f1: 0.5035
 epoch: 32, train_loss: 0.9218, test_loss: 0.9297, test_f1: 0.5050
 epoch: 33, train_loss: 0.9189, test_loss: 0.9313, test_f1: 0.5056
 epoch: 34, train_loss: 0.9291, test_loss: 0.9254, test_f1: 0.5091
 epoch: 35, train_loss: 0.9167, test_loss: 0.9249, test_f1: 0.5121
 epoch: 36, train_loss: 0.9259, test_loss: 0.9397, test_f1: 0.5100
 epoch: 37, train_loss: 0.9156, test_loss: 0.9248, test_f1: 0.5204
 epoch: 38, train_loss: 0.9118, test_loss: 0.9288, test_f1: 0.5082
 epoch: 39, train_loss: 0.9122, test_loss: 0.9226, test_f1: 0.5136
 epoch: 40, train_loss: 0.9043, test_loss: 0.9291, test_f1: 0.5086
 epoch: 41, train_loss: 0.9015, test_loss: 0.9237, test_f1: 0.5127
 epoch: 42, train_loss: 0.9059, test_loss: 0.9223, test_f1: 0.5243
 epoch: 43, train_loss: 0.8983, test_loss: 0.9232, test_f1: 0.5182
 epoch: 44, train_loss: 0.8953, test_loss: 0.9299, test_f1: 0.5193
 epoch: 45, train_loss: 0.8998, test_loss: 0.9197, test_f1: 0.5225
 epoch: 46, train_loss: 0.8907, test_loss: 0.9297, test_f1: 0.5235
 epoch: 47, train_loss: 0.8859, test_loss: 0.9214, test_f1: 0.5288
 epoch: 48, train_loss: 0.8816, test_loss: 0.9095, test_f1: 0.5245
 epoch: 49, train_loss: 0.8849, test_loss: 0.9114, test_f1: 0.5222
 epoch: 50, train_loss: 0.8772, test_loss: 0.9158, test_f1: 0.5216
 epoch: 51, train_loss: 0.8694, test_loss: 0.9136, test_f1: 0.5258
 epoch: 52, train_loss: 0.8745, test_loss: 0.9154, test_f1: 0.5216
 epoch: 53, train_loss: 0.8741, test_loss: 0.9151, test_f1: 0.5374
 epoch: 54, train_loss: 0.8732, test_loss: 0.9117, test_f1: 0.5283
 epoch: 55, train_loss: 0.8755, test_loss: 0.9198, test_f1: 0.5224
 epoch: 56, train_loss: 0.8675, test_loss: 0.9125, test_f1: 0.5288
 epoch: 57, train_loss: 0.8790, test_loss: 0.9114, test_f1: 0.5272
 epoch: 58, train_loss: 0.8662, test_loss: 0.9108, test_f1: 0.5258
 epoch: 59, train_loss: 0.8671, test_loss: 0.9261, test_f1: 0.5236
 epoch: 60, train_loss: 0.8617, test_loss: 0.9084, test_f1: 0.5398
 epoch: 61, train_loss: 0.8669, test_loss: 0.9036, test_f1: 0.5273
 epoch: 62, train_loss: 0.8547, test_loss: 0.9246, test_f1: 0.5326
 epoch: 63, train_loss: 0.8664, test_loss: 0.9174, test_f1: 0.5373
 epoch: 64, train_loss: 0.8707, test_loss: 0.9131, test_f1: 0.5253
 epoch: 65, train_loss: 0.8643, test_loss: 0.9185, test_f1: 0.5389
 epoch: 66, train_loss: 0.8560, test_loss: 0.9248, test_f1: 0.5372
 epoch: 67, train_loss: 0.8521, test_loss: 0.9188, test_f1: 0.5289
 epoch: 68, train_loss: 0.8533, test_loss: 0.9109, test_f1: 0.5257
 epoch: 69, train_loss: 0.8477, test_loss: 0.9167, test_f1: 0.5255
 epoch: 70, train_loss: 0.8452, test_loss: 0.9196, test_f1: 0.5311
 epoch: 71, train_loss: 0.8520, test_loss: 0.9288, test_f1: 0.5275
 epoch: 72, train_loss: 0.8546, test_loss: 0.9236, test_f1: 0.5267
 epoch: 73, train_loss: 0.8596, test_loss: 0.9274, test_f1: 0.5336
 epoch: 74, train_loss: 0.8533, test_loss: 0.9199, test_f1: 0.5267
 epoch: 75, train_loss: 0.8511, test_loss: 0.9173, test_f1: 0.5282
 epoch: 76, train_loss: 0.8494, test_loss: 0.9174, test_f1: 0.5275
 epoch: 77, train_loss: 0.8578, test_loss: 0.9174, test_f1: 0.5404
 epoch: 78, train_loss: 0.8501, test_loss: 0.9235, test_f1: 0.5286
 epoch: 79, train_loss: 0.8490, test_loss: 0.9290, test_f1: 0.5280
 epoch: 80, train_loss: 0.8441, test_loss: 0.9129, test_f1: 0.5272
 epoch: 81, train_loss: 0.8325, test_loss: 0.9174, test_f1: 0.5277
 epoch: 82, train_loss: 0.8509, test_loss: 0.9321, test_f1: 0.5289
 epoch: 83, train_loss: 0.8374, test_loss: 0.9254, test_f1: 0.5427
 epoch: 84, train_loss: 0.8483, test_loss: 0.9285, test_f1: 0.5285
 epoch: 85, train_loss: 0.8418, test_loss: 0.9238, test_f1: 0.5361
 epoch: 86, train_loss: 0.8445, test_loss: 0.9319, test_f1: 0.5449
 epoch: 87, train_loss: 0.8442, test_loss: 0.9320, test_f1: 0.5329
 epoch: 88, train_loss: 0.8372, test_loss: 0.9207, test_f1: 0.5319
 epoch: 89, train_loss: 0.8411, test_loss: 0.9224, test_f1: 0.5323
 epoch: 90, train_loss: 0.8271, test_loss: 0.9198, test_f1: 0.5261
 epoch: 91, train_loss: 0.8422, test_loss: 0.9300, test_f1: 0.5250
 epoch: 92, train_loss: 0.8393, test_loss: 0.9261, test_f1: 0.5338
 epoch: 93, train_loss: 0.8277, test_loss: 0.9228, test_f1: 0.5410
 epoch: 94, train_loss: 0.8355, test_loss: 0.9271, test_f1: 0.5267
 epoch: 95, train_loss: 0.8279, test_loss: 0.9169, test_f1: 0.5342
 epoch: 96, train_loss: 0.8325, test_loss: 0.9143, test_f1: 0.5278
 epoch: 97, train_loss: 0.8384, test_loss: 0.9303, test_f1: 0.5352
 epoch: 98, train_loss: 0.8406, test_loss: 0.9184, test_f1: 0.5394
 epoch: 99, train_loss: 0.8329, test_loss: 0.9297, test_f1: 0.5287

Training completed in 425.07 seconds
Best F1: 0.5659 at epoch 97
Mean F1 across iterations: 0.5453  0.0144
========================FINAL RESULTS================================
FEGIN weighted F1: 0.5659  0.0144
python main.py --data ltspice_examples --representation component_net --model FEGIN --layers 2 --hiddens 64 --batch_size 128 --lr 0.0001 --emb_size 512 --epochs 100 --save_appendix component_net_L2_H64_BS128_LR0.0001_E512 --no_val
-----



STDERR:
  File "main.py", line 370, in <module>
    main()
  File "main.py", line 254, in main
    dataset = dataset_class(
  File "/home/philip/projects/ltspice_examples_code_repo/Circuit-Completion-Using-GNNs/component_classification_with_link_prediction_head/evaluation/FEGIN/kernel/circuit_datasets.py", line 15, in __init__
    self.data, self.slices = torch.load(self.processed_paths[0])
  File "/home/philip/.local/lib/python3.8/site-packages/torch/serialization.py", line 1040, in load
    warnings.warn(
  File "/usr/lib/python3.8/warnings.py", line 109, in _showwarnmsg
    sw(msg.message, msg.category, msg.filename, msg.lineno,
  File "main.py", line 47, in warn_with_traceback
    traceback.print_stack(file=log)
/home/philip/projects/ltspice_examples_code_repo/Circuit-Completion-Using-GNNs/component_classification_with_link_prediction_head/evaluation/FEGIN/kernel/circuit_datasets.py:15: FutureWarning: You are using `torch.load` with `weights_only=False` (the current default value), which uses the default pickle module implicitly. It is possible to construct malicious pickle data which will execute arbitrary code during unpickling (See https://github.com/pytorch/pytorch/blob/main/SECURITY.md#untrusted-models for more details). In a future release, the default value for `weights_only` will be flipped to `True`. This limits the functions that could be executed during unpickling. Arbitrary objects will no longer be allowed to be loaded via this mode unless they are explicitly allowlisted by the user via `torch.serialization.add_safe_globals`. We recommend you start setting `weights_only=True` for any use case where you don't have full control of the loaded file. Please open an issue on GitHub for any issues related to this experimental feature.
  self.data, self.slices = torch.load(self.processed_paths[0])
