STDOUT:
Results will be saved in /home/philip/projects/ltspice_examples_code_repo/Circuit-Completion-Using-GNNs/component_classification_with_link_prediction_head/evaluation/FEGIN/results/model_FEGIN_dataset_ltspice_examples
Command line input: python main.py --data ltspice_examples --representation component_component --model FEGIN --layers 2 --hiddens 128 --batch_size 32 --lr 0.0001 --emb_size 250 --epochs 100 --save_appendix component_component_L2_H128_BS32_LR0.0001_E250 --no_val
 is saved.
-----
ltspice_examples - FEGIN
Using 2 layers, 128 hidden units, h = 2
Loading component_component representation dataset
ENTERED
Training FEGIN on component_component representation
Train: 3556, Test: 845
##################ITERATION #0 ****************************************
 epoch: 0, train_loss: 1.3326, test_loss: 1.2693, test_f1: 0.2274
 epoch: 1, train_loss: 1.2561, test_loss: 1.2237, test_f1: 0.2274
 epoch: 2, train_loss: 1.2237, test_loss: 1.1882, test_f1: 0.3275
 epoch: 3, train_loss: 1.1905, test_loss: 1.1623, test_f1: 0.3577
 epoch: 4, train_loss: 1.1613, test_loss: 1.1270, test_f1: 0.4663
 epoch: 5, train_loss: 1.1308, test_loss: 1.0998, test_f1: 0.4594
 epoch: 6, train_loss: 1.1054, test_loss: 1.0629, test_f1: 0.4845
 epoch: 7, train_loss: 1.0872, test_loss: 1.0485, test_f1: 0.4750
 epoch: 8, train_loss: 1.0605, test_loss: 1.0346, test_f1: 0.4674
 epoch: 9, train_loss: 1.0479, test_loss: 1.0029, test_f1: 0.4712
 epoch: 10, train_loss: 1.0236, test_loss: 0.9933, test_f1: 0.4617
 epoch: 11, train_loss: 1.0031, test_loss: 1.0035, test_f1: 0.4628
 epoch: 12, train_loss: 0.9907, test_loss: 0.9756, test_f1: 0.4846
 epoch: 13, train_loss: 0.9910, test_loss: 0.9694, test_f1: 0.4909
 epoch: 14, train_loss: 0.9697, test_loss: 0.9720, test_f1: 0.5027
 epoch: 15, train_loss: 0.9691, test_loss: 0.9693, test_f1: 0.5081
 epoch: 16, train_loss: 0.9578, test_loss: 0.9858, test_f1: 0.5180
 epoch: 17, train_loss: 0.9418, test_loss: 0.9534, test_f1: 0.5143
 epoch: 18, train_loss: 0.9384, test_loss: 0.9647, test_f1: 0.5041
 epoch: 19, train_loss: 0.9364, test_loss: 0.9557, test_f1: 0.5183
 epoch: 20, train_loss: 0.9279, test_loss: 0.9743, test_f1: 0.5123
 epoch: 21, train_loss: 0.9066, test_loss: 0.9668, test_f1: 0.5109
 epoch: 22, train_loss: 0.9075, test_loss: 0.9812, test_f1: 0.5199
 epoch: 23, train_loss: 0.9020, test_loss: 0.9828, test_f1: 0.5022
 epoch: 24, train_loss: 0.8916, test_loss: 0.9862, test_f1: 0.5262
 epoch: 25, train_loss: 0.8834, test_loss: 0.9880, test_f1: 0.5157
 epoch: 26, train_loss: 0.8777, test_loss: 1.0137, test_f1: 0.5262
 epoch: 27, train_loss: 0.8827, test_loss: 0.9907, test_f1: 0.5217
 epoch: 28, train_loss: 0.8767, test_loss: 0.9726, test_f1: 0.5277
 epoch: 29, train_loss: 0.8499, test_loss: 0.9947, test_f1: 0.5156
 epoch: 30, train_loss: 0.8506, test_loss: 1.0034, test_f1: 0.5157
 epoch: 31, train_loss: 0.8432, test_loss: 1.0287, test_f1: 0.5135
 epoch: 32, train_loss: 0.8393, test_loss: 0.9814, test_f1: 0.4895
 epoch: 33, train_loss: 0.8386, test_loss: 1.0029, test_f1: 0.5205
 epoch: 34, train_loss: 0.8253, test_loss: 1.0439, test_f1: 0.5277
 epoch: 35, train_loss: 0.8168, test_loss: 1.0694, test_f1: 0.4887
 epoch: 36, train_loss: 0.8244, test_loss: 1.0333, test_f1: 0.5305
 epoch: 37, train_loss: 0.8190, test_loss: 1.0178, test_f1: 0.5065
 epoch: 38, train_loss: 0.8072, test_loss: 1.0314, test_f1: 0.5161
 epoch: 39, train_loss: 0.8077, test_loss: 1.0515, test_f1: 0.5134
 epoch: 40, train_loss: 0.7926, test_loss: 1.1133, test_f1: 0.4861
 epoch: 41, train_loss: 0.8033, test_loss: 1.0792, test_f1: 0.5181
 epoch: 42, train_loss: 0.7902, test_loss: 1.0473, test_f1: 0.5344
 epoch: 43, train_loss: 0.7822, test_loss: 1.0732, test_f1: 0.4944
 epoch: 44, train_loss: 0.7810, test_loss: 1.0669, test_f1: 0.5013
 epoch: 45, train_loss: 0.7794, test_loss: 1.0927, test_f1: 0.4910
 epoch: 46, train_loss: 0.7793, test_loss: 1.0891, test_f1: 0.5157
 epoch: 47, train_loss: 0.7536, test_loss: 1.0920, test_f1: 0.5213
 epoch: 48, train_loss: 0.7566, test_loss: 1.0734, test_f1: 0.5250
 epoch: 49, train_loss: 0.7649, test_loss: 1.0667, test_f1: 0.5225
 epoch: 50, train_loss: 0.7463, test_loss: 1.1175, test_f1: 0.5041
 epoch: 51, train_loss: 0.7385, test_loss: 1.0972, test_f1: 0.5082
 epoch: 52, train_loss: 0.7322, test_loss: 1.0870, test_f1: 0.5254
 epoch: 53, train_loss: 0.7301, test_loss: 1.1558, test_f1: 0.5106
 epoch: 54, train_loss: 0.7108, test_loss: 1.1339, test_f1: 0.5125
 epoch: 55, train_loss: 0.7256, test_loss: 1.1046, test_f1: 0.5265
 epoch: 56, train_loss: 0.7218, test_loss: 1.1694, test_f1: 0.5175
 epoch: 57, train_loss: 0.7277, test_loss: 1.1590, test_f1: 0.5125
 epoch: 58, train_loss: 0.7218, test_loss: 1.1394, test_f1: 0.5206
 epoch: 59, train_loss: 0.7199, test_loss: 1.1800, test_f1: 0.5035
 epoch: 60, train_loss: 0.7084, test_loss: 1.1348, test_f1: 0.5384
 epoch: 61, train_loss: 0.7093, test_loss: 1.1927, test_f1: 0.5063
 epoch: 62, train_loss: 0.7098, test_loss: 1.1526, test_f1: 0.5389
 epoch: 63, train_loss: 0.7041, test_loss: 1.2092, test_f1: 0.5038
 epoch: 64, train_loss: 0.6930, test_loss: 1.1646, test_f1: 0.5137
 epoch: 65, train_loss: 0.6847, test_loss: 1.1700, test_f1: 0.5271
 epoch: 66, train_loss: 0.7003, test_loss: 1.1729, test_f1: 0.5276
 epoch: 67, train_loss: 0.6919, test_loss: 1.1699, test_f1: 0.5286
 epoch: 68, train_loss: 0.6845, test_loss: 1.1905, test_f1: 0.5232
 epoch: 69, train_loss: 0.6919, test_loss: 1.1925, test_f1: 0.5215
 epoch: 70, train_loss: 0.6901, test_loss: 1.1843, test_f1: 0.5282
 epoch: 71, train_loss: 0.6809, test_loss: 1.2305, test_f1: 0.5141
 epoch: 72, train_loss: 0.6911, test_loss: 1.2018, test_f1: 0.5149
 epoch: 73, train_loss: 0.6869, test_loss: 1.2594, test_f1: 0.5080
 epoch: 74, train_loss: 0.6923, test_loss: 1.1558, test_f1: 0.5314
 epoch: 75, train_loss: 0.6741, test_loss: 1.2280, test_f1: 0.5157
 epoch: 76, train_loss: 0.6729, test_loss: 1.3364, test_f1: 0.5218
 epoch: 77, train_loss: 0.6728, test_loss: 1.2631, test_f1: 0.5260
 epoch: 78, train_loss: 0.6716, test_loss: 1.2174, test_f1: 0.5485
 epoch: 79, train_loss: 0.6785, test_loss: 1.2643, test_f1: 0.5364
 epoch: 80, train_loss: 0.6796, test_loss: 1.2306, test_f1: 0.5307
 epoch: 81, train_loss: 0.6613, test_loss: 1.1894, test_f1: 0.5249
 epoch: 82, train_loss: 0.6758, test_loss: 1.2687, test_f1: 0.5395
 epoch: 83, train_loss: 0.6614, test_loss: 1.2348, test_f1: 0.5345
 epoch: 84, train_loss: 0.6711, test_loss: 1.2575, test_f1: 0.5278
 epoch: 85, train_loss: 0.6581, test_loss: 1.1969, test_f1: 0.5341
 epoch: 86, train_loss: 0.6403, test_loss: 1.2097, test_f1: 0.5350
 epoch: 87, train_loss: 0.6555, test_loss: 1.2414, test_f1: 0.5241
 epoch: 88, train_loss: 0.6631, test_loss: 1.1804, test_f1: 0.5423
 epoch: 89, train_loss: 0.6528, test_loss: 1.2272, test_f1: 0.5354
 epoch: 90, train_loss: 0.6472, test_loss: 1.2585, test_f1: 0.5482
 epoch: 91, train_loss: 0.6494, test_loss: 1.2974, test_f1: 0.5295
 epoch: 92, train_loss: 0.6578, test_loss: 1.2717, test_f1: 0.5251
 epoch: 93, train_loss: 0.6579, test_loss: 1.2646, test_f1: 0.5404
 epoch: 94, train_loss: 0.6429, test_loss: 1.2541, test_f1: 0.5385
 epoch: 95, train_loss: 0.6449, test_loss: 1.2444, test_f1: 0.5367
 epoch: 96, train_loss: 0.6610, test_loss: 1.2133, test_f1: 0.5525
 epoch: 97, train_loss: 0.6265, test_loss: 1.3921, test_f1: 0.5126
 epoch: 98, train_loss: 0.6363, test_loss: 1.2983, test_f1: 0.5441
 epoch: 99, train_loss: 0.6399, test_loss: 1.2735, test_f1: 0.5352
##################ITERATION #1 ****************************************
 epoch: 0, train_loss: 1.2653, test_loss: 1.1839, test_f1: 0.4503
 epoch: 1, train_loss: 1.1949, test_loss: 1.1428, test_f1: 0.4454
 epoch: 2, train_loss: 1.1572, test_loss: 1.1118, test_f1: 0.4817
 epoch: 3, train_loss: 1.1344, test_loss: 1.0920, test_f1: 0.4714
 epoch: 4, train_loss: 1.1031, test_loss: 1.0681, test_f1: 0.4617
 epoch: 5, train_loss: 1.0878, test_loss: 1.0471, test_f1: 0.4668
 epoch: 6, train_loss: 1.0673, test_loss: 1.0231, test_f1: 0.4692
 epoch: 7, train_loss: 1.0510, test_loss: 1.0222, test_f1: 0.4737
 epoch: 8, train_loss: 1.0380, test_loss: 1.0105, test_f1: 0.4873
 epoch: 9, train_loss: 1.0198, test_loss: 0.9967, test_f1: 0.4877
 epoch: 10, train_loss: 0.9994, test_loss: 0.9772, test_f1: 0.4839
 epoch: 11, train_loss: 0.9892, test_loss: 0.9550, test_f1: 0.5166
 epoch: 12, train_loss: 0.9723, test_loss: 0.9524, test_f1: 0.5046
 epoch: 13, train_loss: 0.9571, test_loss: 0.9600, test_f1: 0.5054
 epoch: 14, train_loss: 0.9601, test_loss: 0.9567, test_f1: 0.4875
 epoch: 15, train_loss: 0.9442, test_loss: 0.9405, test_f1: 0.5102
 epoch: 16, train_loss: 0.9332, test_loss: 0.9369, test_f1: 0.5035
 epoch: 17, train_loss: 0.9232, test_loss: 0.9155, test_f1: 0.5215
 epoch: 18, train_loss: 0.9221, test_loss: 0.9184, test_f1: 0.5186
 epoch: 19, train_loss: 0.9045, test_loss: 0.9245, test_f1: 0.5478
 epoch: 20, train_loss: 0.9111, test_loss: 0.9368, test_f1: 0.5226
 epoch: 21, train_loss: 0.8880, test_loss: 0.9900, test_f1: 0.4975
 epoch: 22, train_loss: 0.8827, test_loss: 0.9585, test_f1: 0.5109
 epoch: 23, train_loss: 0.8893, test_loss: 0.9519, test_f1: 0.5114
 epoch: 24, train_loss: 0.8650, test_loss: 0.9255, test_f1: 0.5242
 epoch: 25, train_loss: 0.8610, test_loss: 0.9139, test_f1: 0.5054
 epoch: 26, train_loss: 0.8596, test_loss: 0.9356, test_f1: 0.5121
 epoch: 27, train_loss: 0.8527, test_loss: 0.9498, test_f1: 0.5266
 epoch: 28, train_loss: 0.8488, test_loss: 0.9452, test_f1: 0.5047
 epoch: 29, train_loss: 0.8486, test_loss: 0.9556, test_f1: 0.5123
 epoch: 30, train_loss: 0.8477, test_loss: 0.9373, test_f1: 0.5307
 epoch: 31, train_loss: 0.8398, test_loss: 0.9224, test_f1: 0.4880
 epoch: 32, train_loss: 0.8298, test_loss: 0.9105, test_f1: 0.5201
 epoch: 33, train_loss: 0.8213, test_loss: 0.9413, test_f1: 0.5063
 epoch: 34, train_loss: 0.8027, test_loss: 0.9435, test_f1: 0.5299
 epoch: 35, train_loss: 0.8043, test_loss: 1.0102, test_f1: 0.5176
 epoch: 36, train_loss: 0.8152, test_loss: 0.9503, test_f1: 0.5188
 epoch: 37, train_loss: 0.8079, test_loss: 0.9348, test_f1: 0.5369
 epoch: 38, train_loss: 0.7955, test_loss: 0.9616, test_f1: 0.5329
 epoch: 39, train_loss: 0.7923, test_loss: 0.9973, test_f1: 0.5011
 epoch: 40, train_loss: 0.7955, test_loss: 0.9399, test_f1: 0.5126
 epoch: 41, train_loss: 0.7720, test_loss: 0.9503, test_f1: 0.5218
 epoch: 42, train_loss: 0.7718, test_loss: 0.9547, test_f1: 0.5151
 epoch: 43, train_loss: 0.7687, test_loss: 0.9240, test_f1: 0.5665
 epoch: 44, train_loss: 0.7678, test_loss: 0.9400, test_f1: 0.5388
 epoch: 45, train_loss: 0.7708, test_loss: 1.0217, test_f1: 0.4969
 epoch: 46, train_loss: 0.7531, test_loss: 0.9583, test_f1: 0.5300
 epoch: 47, train_loss: 0.7574, test_loss: 0.9543, test_f1: 0.5682
 epoch: 48, train_loss: 0.7452, test_loss: 0.9619, test_f1: 0.5608
 epoch: 49, train_loss: 0.7431, test_loss: 1.0092, test_f1: 0.5086
 epoch: 50, train_loss: 0.7376, test_loss: 0.9972, test_f1: 0.5099
 epoch: 51, train_loss: 0.7310, test_loss: 0.9939, test_f1: 0.5181
 epoch: 52, train_loss: 0.7258, test_loss: 0.9735, test_f1: 0.5146
 epoch: 53, train_loss: 0.7172, test_loss: 0.9592, test_f1: 0.5342
 epoch: 54, train_loss: 0.7173, test_loss: 0.9526, test_f1: 0.5541
 epoch: 55, train_loss: 0.7123, test_loss: 1.0311, test_f1: 0.5264
 epoch: 56, train_loss: 0.6980, test_loss: 1.0018, test_f1: 0.5227
 epoch: 57, train_loss: 0.7057, test_loss: 0.9932, test_f1: 0.5566
 epoch: 58, train_loss: 0.7025, test_loss: 1.0006, test_f1: 0.5276
 epoch: 59, train_loss: 0.6932, test_loss: 0.9836, test_f1: 0.5509
 epoch: 60, train_loss: 0.6959, test_loss: 0.9616, test_f1: 0.5365
 epoch: 61, train_loss: 0.6983, test_loss: 0.9958, test_f1: 0.5247
 epoch: 62, train_loss: 0.6898, test_loss: 1.0182, test_f1: 0.5480
 epoch: 63, train_loss: 0.6851, test_loss: 1.0378, test_f1: 0.5238
 epoch: 64, train_loss: 0.6853, test_loss: 1.2157, test_f1: 0.4909
 epoch: 65, train_loss: 0.6787, test_loss: 1.0338, test_f1: 0.5286
 epoch: 66, train_loss: 0.6810, test_loss: 1.1089, test_f1: 0.5236
 epoch: 67, train_loss: 0.6748, test_loss: 1.1041, test_f1: 0.5136
 epoch: 68, train_loss: 0.6791, test_loss: 1.1382, test_f1: 0.5051
 epoch: 69, train_loss: 0.6722, test_loss: 1.0471, test_f1: 0.5188
 epoch: 70, train_loss: 0.6743, test_loss: 1.0599, test_f1: 0.5226
 epoch: 71, train_loss: 0.6746, test_loss: 1.0790, test_f1: 0.5321
 epoch: 72, train_loss: 0.6609, test_loss: 1.0874, test_f1: 0.5164
 epoch: 73, train_loss: 0.6627, test_loss: 1.1799, test_f1: 0.5037
 epoch: 74, train_loss: 0.6490, test_loss: 1.0716, test_f1: 0.5156
 epoch: 75, train_loss: 0.6646, test_loss: 1.1068, test_f1: 0.5101
 epoch: 76, train_loss: 0.6753, test_loss: 1.1125, test_f1: 0.5109
 epoch: 77, train_loss: 0.6679, test_loss: 1.1291, test_f1: 0.5011
 epoch: 78, train_loss: 0.6544, test_loss: 1.2261, test_f1: 0.5017
 epoch: 79, train_loss: 0.6506, test_loss: 1.1670, test_f1: 0.5125
 epoch: 80, train_loss: 0.6537, test_loss: 1.1370, test_f1: 0.5204
 epoch: 81, train_loss: 0.6540, test_loss: 1.0817, test_f1: 0.4779
 epoch: 82, train_loss: 0.6564, test_loss: 1.1635, test_f1: 0.5118
 epoch: 83, train_loss: 0.6552, test_loss: 1.1301, test_f1: 0.5068
 epoch: 84, train_loss: 0.6380, test_loss: 1.1611, test_f1: 0.5174
 epoch: 85, train_loss: 0.6265, test_loss: 1.1949, test_f1: 0.5029
 epoch: 86, train_loss: 0.6497, test_loss: 1.2444, test_f1: 0.5032
 epoch: 87, train_loss: 0.6439, test_loss: 1.1599, test_f1: 0.5092
 epoch: 88, train_loss: 0.6236, test_loss: 1.1393, test_f1: 0.5151
 epoch: 89, train_loss: 0.6362, test_loss: 1.1683, test_f1: 0.5272
 epoch: 90, train_loss: 0.6327, test_loss: 1.1580, test_f1: 0.5088
 epoch: 91, train_loss: 0.6442, test_loss: 1.1407, test_f1: 0.5128
 epoch: 92, train_loss: 0.6124, test_loss: 1.1916, test_f1: 0.5231
 epoch: 93, train_loss: 0.6250, test_loss: 1.1934, test_f1: 0.5005
 epoch: 94, train_loss: 0.6329, test_loss: 1.2852, test_f1: 0.5072
 epoch: 95, train_loss: 0.6252, test_loss: 1.1843, test_f1: 0.5003
 epoch: 96, train_loss: 0.6161, test_loss: 1.2419, test_f1: 0.5174
 epoch: 97, train_loss: 0.6017, test_loss: 1.1327, test_f1: 0.5175
 epoch: 98, train_loss: 0.6171, test_loss: 1.2457, test_f1: 0.5210
 epoch: 99, train_loss: 0.6138, test_loss: 1.1837, test_f1: 0.5305
##################ITERATION #2 ****************************************
 epoch: 0, train_loss: 1.2502, test_loss: 1.1486, test_f1: 0.4312
 epoch: 1, train_loss: 1.1723, test_loss: 1.1135, test_f1: 0.4558
 epoch: 2, train_loss: 1.1385, test_loss: 1.0846, test_f1: 0.4713
 epoch: 3, train_loss: 1.1150, test_loss: 1.0699, test_f1: 0.4678
 epoch: 4, train_loss: 1.0942, test_loss: 1.0409, test_f1: 0.4666
 epoch: 5, train_loss: 1.0743, test_loss: 1.0163, test_f1: 0.4710
 epoch: 6, train_loss: 1.0587, test_loss: 1.0034, test_f1: 0.4391
 epoch: 7, train_loss: 1.0440, test_loss: 0.9824, test_f1: 0.4904
 epoch: 8, train_loss: 1.0192, test_loss: 0.9871, test_f1: 0.4782
 epoch: 9, train_loss: 1.0188, test_loss: 0.9703, test_f1: 0.4865
 epoch: 10, train_loss: 1.0026, test_loss: 0.9566, test_f1: 0.4491
 epoch: 11, train_loss: 0.9950, test_loss: 0.9581, test_f1: 0.4837
 epoch: 12, train_loss: 0.9826, test_loss: 0.9470, test_f1: 0.4887
 epoch: 13, train_loss: 0.9624, test_loss: 0.9579, test_f1: 0.4816
 epoch: 14, train_loss: 0.9608, test_loss: 0.9583, test_f1: 0.4937
 epoch: 15, train_loss: 0.9536, test_loss: 0.9343, test_f1: 0.4874
 epoch: 16, train_loss: 0.9401, test_loss: 0.9286, test_f1: 0.4792
 epoch: 17, train_loss: 0.9454, test_loss: 0.9303, test_f1: 0.4596
 epoch: 18, train_loss: 0.9196, test_loss: 0.9129, test_f1: 0.5182
 epoch: 19, train_loss: 0.9129, test_loss: 0.9496, test_f1: 0.4839
 epoch: 20, train_loss: 0.9187, test_loss: 0.9298, test_f1: 0.4976
 epoch: 21, train_loss: 0.9155, test_loss: 0.9424, test_f1: 0.4970
 epoch: 22, train_loss: 0.8919, test_loss: 0.9224, test_f1: 0.4938
 epoch: 23, train_loss: 0.8845, test_loss: 0.9338, test_f1: 0.5092
 epoch: 24, train_loss: 0.8895, test_loss: 0.9142, test_f1: 0.5024
 epoch: 25, train_loss: 0.8702, test_loss: 0.9364, test_f1: 0.5050
 epoch: 26, train_loss: 0.8677, test_loss: 0.9450, test_f1: 0.5026
 epoch: 27, train_loss: 0.8571, test_loss: 0.9471, test_f1: 0.4958
 epoch: 28, train_loss: 0.8611, test_loss: 0.9332, test_f1: 0.4876
 epoch: 29, train_loss: 0.8656, test_loss: 0.9278, test_f1: 0.4990
 epoch: 30, train_loss: 0.8486, test_loss: 0.9586, test_f1: 0.5253
 epoch: 31, train_loss: 0.8544, test_loss: 0.9482, test_f1: 0.5181
 epoch: 32, train_loss: 0.8477, test_loss: 0.9491, test_f1: 0.5118
 epoch: 33, train_loss: 0.8418, test_loss: 0.9830, test_f1: 0.4890
 epoch: 34, train_loss: 0.8254, test_loss: 0.9379, test_f1: 0.5375
 epoch: 35, train_loss: 0.8374, test_loss: 0.9759, test_f1: 0.5153
 epoch: 36, train_loss: 0.8173, test_loss: 0.9721, test_f1: 0.5262
 epoch: 37, train_loss: 0.8123, test_loss: 0.9625, test_f1: 0.5394
 epoch: 38, train_loss: 0.8200, test_loss: 0.9692, test_f1: 0.5129
 epoch: 39, train_loss: 0.8046, test_loss: 0.9780, test_f1: 0.5136
 epoch: 40, train_loss: 0.7988, test_loss: 0.9787, test_f1: 0.5325
 epoch: 41, train_loss: 0.7986, test_loss: 0.9902, test_f1: 0.5364
 epoch: 42, train_loss: 0.8129, test_loss: 0.9697, test_f1: 0.5423
 epoch: 43, train_loss: 0.7956, test_loss: 0.9664, test_f1: 0.5503
 epoch: 44, train_loss: 0.7840, test_loss: 0.9784, test_f1: 0.5391
 epoch: 45, train_loss: 0.7835, test_loss: 0.9881, test_f1: 0.5467
 epoch: 46, train_loss: 0.7839, test_loss: 0.9622, test_f1: 0.5441
 epoch: 47, train_loss: 0.7736, test_loss: 0.9921, test_f1: 0.5065
 epoch: 48, train_loss: 0.7886, test_loss: 0.9788, test_f1: 0.5108
 epoch: 49, train_loss: 0.7853, test_loss: 0.9969, test_f1: 0.5467
 epoch: 50, train_loss: 0.7770, test_loss: 0.9923, test_f1: 0.5237
 epoch: 51, train_loss: 0.7555, test_loss: 0.9936, test_f1: 0.5402
 epoch: 52, train_loss: 0.7541, test_loss: 0.9941, test_f1: 0.5442
 epoch: 53, train_loss: 0.7478, test_loss: 0.9974, test_f1: 0.5479
 epoch: 54, train_loss: 0.7327, test_loss: 1.0118, test_f1: 0.5386
 epoch: 55, train_loss: 0.7301, test_loss: 1.0208, test_f1: 0.5372
 epoch: 56, train_loss: 0.7385, test_loss: 1.0095, test_f1: 0.5252
 epoch: 57, train_loss: 0.7279, test_loss: 1.0206, test_f1: 0.5401
 epoch: 58, train_loss: 0.7100, test_loss: 1.0309, test_f1: 0.5416
 epoch: 59, train_loss: 0.7284, test_loss: 1.0260, test_f1: 0.5177
 epoch: 60, train_loss: 0.7253, test_loss: 1.0219, test_f1: 0.5435
 epoch: 61, train_loss: 0.7243, test_loss: 1.0163, test_f1: 0.5501
 epoch: 62, train_loss: 0.7246, test_loss: 1.0156, test_f1: 0.5508
 epoch: 63, train_loss: 0.7156, test_loss: 1.0265, test_f1: 0.5439
 epoch: 64, train_loss: 0.7215, test_loss: 1.0398, test_f1: 0.5422
 epoch: 65, train_loss: 0.7298, test_loss: 1.0356, test_f1: 0.5419
 epoch: 66, train_loss: 0.7165, test_loss: 1.0553, test_f1: 0.5368
 epoch: 67, train_loss: 0.7128, test_loss: 1.0422, test_f1: 0.5450
 epoch: 68, train_loss: 0.7184, test_loss: 1.0570, test_f1: 0.5352
 epoch: 69, train_loss: 0.7126, test_loss: 1.0797, test_f1: 0.5226
 epoch: 70, train_loss: 0.6985, test_loss: 1.0626, test_f1: 0.5452
 epoch: 71, train_loss: 0.7063, test_loss: 1.0642, test_f1: 0.5500
 epoch: 72, train_loss: 0.6939, test_loss: 1.0248, test_f1: 0.5493
 epoch: 73, train_loss: 0.6989, test_loss: 1.0450, test_f1: 0.5444
 epoch: 74, train_loss: 0.7101, test_loss: 1.0343, test_f1: 0.5447
 epoch: 75, train_loss: 0.6796, test_loss: 1.0592, test_f1: 0.5453
 epoch: 76, train_loss: 0.6951, test_loss: 1.0425, test_f1: 0.5526
 epoch: 77, train_loss: 0.7084, test_loss: 1.0786, test_f1: 0.5362
 epoch: 78, train_loss: 0.6827, test_loss: 1.0665, test_f1: 0.5428
 epoch: 79, train_loss: 0.6863, test_loss: 1.0769, test_f1: 0.5239
 epoch: 80, train_loss: 0.6776, test_loss: 1.0682, test_f1: 0.5454
 epoch: 81, train_loss: 0.6866, test_loss: 1.0367, test_f1: 0.5340
 epoch: 82, train_loss: 0.6745, test_loss: 1.0717, test_f1: 0.5586
 epoch: 83, train_loss: 0.6922, test_loss: 1.0702, test_f1: 0.5376
 epoch: 84, train_loss: 0.6811, test_loss: 1.0838, test_f1: 0.5455
 epoch: 85, train_loss: 0.6808, test_loss: 1.0767, test_f1: 0.5555
 epoch: 86, train_loss: 0.6757, test_loss: 1.0516, test_f1: 0.5490
 epoch: 87, train_loss: 0.6756, test_loss: 1.0854, test_f1: 0.5375
 epoch: 88, train_loss: 0.6749, test_loss: 1.0736, test_f1: 0.5357
 epoch: 89, train_loss: 0.6577, test_loss: 1.1091, test_f1: 0.5543
 epoch: 90, train_loss: 0.6672, test_loss: 1.0945, test_f1: 0.5447
 epoch: 91, train_loss: 0.6596, test_loss: 1.0799, test_f1: 0.5419
 epoch: 92, train_loss: 0.6718, test_loss: 1.1522, test_f1: 0.5360
 epoch: 93, train_loss: 0.6640, test_loss: 1.1063, test_f1: 0.5221
 epoch: 94, train_loss: 0.6606, test_loss: 1.1101, test_f1: 0.5231
 epoch: 95, train_loss: 0.6619, test_loss: 1.1292, test_f1: 0.5370
 epoch: 96, train_loss: 0.6431, test_loss: 1.0972, test_f1: 0.5278
 epoch: 97, train_loss: 0.6507, test_loss: 1.1331, test_f1: 0.5347
 epoch: 98, train_loss: 0.6500, test_loss: 1.1146, test_f1: 0.5462
 epoch: 99, train_loss: 0.6579, test_loss: 1.1485, test_f1: 0.5395
##################ITERATION #3 ****************************************
 epoch: 0, train_loss: 1.2606, test_loss: 1.1661, test_f1: 0.4306
 epoch: 1, train_loss: 1.1870, test_loss: 1.1208, test_f1: 0.4563
 epoch: 2, train_loss: 1.1472, test_loss: 1.0911, test_f1: 0.4660
 epoch: 3, train_loss: 1.1334, test_loss: 1.0813, test_f1: 0.4564
 epoch: 4, train_loss: 1.1188, test_loss: 1.0518, test_f1: 0.4445
 epoch: 5, train_loss: 1.0913, test_loss: 1.0359, test_f1: 0.4579
 epoch: 6, train_loss: 1.0841, test_loss: 1.0145, test_f1: 0.4889
 epoch: 7, train_loss: 1.0623, test_loss: 1.0170, test_f1: 0.4818
 epoch: 8, train_loss: 1.0471, test_loss: 0.9787, test_f1: 0.4730
 epoch: 9, train_loss: 1.0348, test_loss: 0.9815, test_f1: 0.4709
 epoch: 10, train_loss: 1.0231, test_loss: 0.9860, test_f1: 0.4800
 epoch: 11, train_loss: 1.0152, test_loss: 0.9671, test_f1: 0.4561
 epoch: 12, train_loss: 0.9877, test_loss: 0.9437, test_f1: 0.4904
 epoch: 13, train_loss: 0.9913, test_loss: 0.9218, test_f1: 0.5147
 epoch: 14, train_loss: 0.9843, test_loss: 0.9247, test_f1: 0.5037
 epoch: 15, train_loss: 0.9703, test_loss: 0.9212, test_f1: 0.5150
 epoch: 16, train_loss: 0.9681, test_loss: 0.9573, test_f1: 0.4926
 epoch: 17, train_loss: 0.9561, test_loss: 0.9239, test_f1: 0.5023
 epoch: 18, train_loss: 0.9609, test_loss: 0.9494, test_f1: 0.4839
 epoch: 19, train_loss: 0.9344, test_loss: 0.9049, test_f1: 0.5080
 epoch: 20, train_loss: 0.9189, test_loss: 0.9346, test_f1: 0.5034
 epoch: 21, train_loss: 0.9130, test_loss: 0.9401, test_f1: 0.5028
 epoch: 22, train_loss: 0.9011, test_loss: 0.9303, test_f1: 0.4967
 epoch: 23, train_loss: 0.8991, test_loss: 0.9424, test_f1: 0.4976
 epoch: 24, train_loss: 0.8992, test_loss: 0.9346, test_f1: 0.4975
 epoch: 25, train_loss: 0.8889, test_loss: 0.9499, test_f1: 0.4921
 epoch: 26, train_loss: 0.8946, test_loss: 0.9202, test_f1: 0.5080
 epoch: 27, train_loss: 0.8726, test_loss: 0.9173, test_f1: 0.5004
 epoch: 28, train_loss: 0.8748, test_loss: 0.9624, test_f1: 0.5098
 epoch: 29, train_loss: 0.8533, test_loss: 0.9370, test_f1: 0.5091
 epoch: 30, train_loss: 0.8593, test_loss: 0.9183, test_f1: 0.5143
 epoch: 31, train_loss: 0.8564, test_loss: 0.9548, test_f1: 0.5113
 epoch: 32, train_loss: 0.8578, test_loss: 0.9246, test_f1: 0.4957
 epoch: 33, train_loss: 0.8427, test_loss: 0.9501, test_f1: 0.4959
 epoch: 34, train_loss: 0.8465, test_loss: 0.9653, test_f1: 0.5187
 epoch: 35, train_loss: 0.8444, test_loss: 0.9474, test_f1: 0.5003
 epoch: 36, train_loss: 0.8337, test_loss: 0.9405, test_f1: 0.5173
 epoch: 37, train_loss: 0.8342, test_loss: 0.9504, test_f1: 0.5105
 epoch: 38, train_loss: 0.8245, test_loss: 0.9402, test_f1: 0.5170
 epoch: 39, train_loss: 0.8244, test_loss: 0.9597, test_f1: 0.5000
 epoch: 40, train_loss: 0.8138, test_loss: 0.9973, test_f1: 0.4931
 epoch: 41, train_loss: 0.7987, test_loss: 1.0209, test_f1: 0.5040
 epoch: 42, train_loss: 0.8041, test_loss: 0.9534, test_f1: 0.5117
 epoch: 43, train_loss: 0.7895, test_loss: 1.0339, test_f1: 0.4974
 epoch: 44, train_loss: 0.7915, test_loss: 0.9900, test_f1: 0.5041
 epoch: 45, train_loss: 0.7895, test_loss: 0.9975, test_f1: 0.5152
 epoch: 46, train_loss: 0.8027, test_loss: 1.0219, test_f1: 0.5054
 epoch: 47, train_loss: 0.7863, test_loss: 0.9764, test_f1: 0.5198
 epoch: 48, train_loss: 0.7840, test_loss: 0.9734, test_f1: 0.5201
 epoch: 49, train_loss: 0.7723, test_loss: 0.9864, test_f1: 0.5224
 epoch: 50, train_loss: 0.7574, test_loss: 1.0147, test_f1: 0.5116
 epoch: 51, train_loss: 0.7545, test_loss: 0.9980, test_f1: 0.5051
 epoch: 52, train_loss: 0.7437, test_loss: 0.9990, test_f1: 0.5124
 epoch: 53, train_loss: 0.7476, test_loss: 1.0055, test_f1: 0.5189
 epoch: 54, train_loss: 0.7368, test_loss: 0.9926, test_f1: 0.5047
 epoch: 55, train_loss: 0.7423, test_loss: 0.9898, test_f1: 0.5163
 epoch: 56, train_loss: 0.7307, test_loss: 1.0499, test_f1: 0.5220
 epoch: 57, train_loss: 0.7401, test_loss: 1.0173, test_f1: 0.5128
 epoch: 58, train_loss: 0.7407, test_loss: 1.0026, test_f1: 0.5204
 epoch: 59, train_loss: 0.7320, test_loss: 1.0769, test_f1: 0.5048
 epoch: 60, train_loss: 0.7329, test_loss: 1.0131, test_f1: 0.5270
 epoch: 61, train_loss: 0.7245, test_loss: 1.0434, test_f1: 0.5172
 epoch: 62, train_loss: 0.7235, test_loss: 1.0331, test_f1: 0.5089
 epoch: 63, train_loss: 0.7249, test_loss: 1.0111, test_f1: 0.5340
 epoch: 64, train_loss: 0.7202, test_loss: 0.9969, test_f1: 0.5366
 epoch: 65, train_loss: 0.7199, test_loss: 1.0591, test_f1: 0.5171
 epoch: 66, train_loss: 0.7235, test_loss: 1.0230, test_f1: 0.5330
 epoch: 67, train_loss: 0.7254, test_loss: 1.0655, test_f1: 0.5238
 epoch: 68, train_loss: 0.7095, test_loss: 1.0191, test_f1: 0.5302
 epoch: 69, train_loss: 0.7097, test_loss: 1.0379, test_f1: 0.5202
 epoch: 70, train_loss: 0.7152, test_loss: 1.0497, test_f1: 0.5079
 epoch: 71, train_loss: 0.6990, test_loss: 1.0822, test_f1: 0.5118
 epoch: 72, train_loss: 0.7001, test_loss: 1.0504, test_f1: 0.5178
 epoch: 73, train_loss: 0.6959, test_loss: 1.0360, test_f1: 0.5282
 epoch: 74, train_loss: 0.6951, test_loss: 1.0668, test_f1: 0.5180
 epoch: 75, train_loss: 0.6954, test_loss: 1.1005, test_f1: 0.5160
 epoch: 76, train_loss: 0.6814, test_loss: 1.0864, test_f1: 0.5115
 epoch: 77, train_loss: 0.6998, test_loss: 1.1038, test_f1: 0.5092
 epoch: 78, train_loss: 0.7026, test_loss: 1.1377, test_f1: 0.5120
 epoch: 79, train_loss: 0.7003, test_loss: 1.0670, test_f1: 0.5237
 epoch: 80, train_loss: 0.6888, test_loss: 1.0423, test_f1: 0.5283
 epoch: 81, train_loss: 0.6823, test_loss: 1.1347, test_f1: 0.4942
 epoch: 82, train_loss: 0.6841, test_loss: 1.0658, test_f1: 0.5247
 epoch: 83, train_loss: 0.6807, test_loss: 1.1063, test_f1: 0.5372
 epoch: 84, train_loss: 0.6767, test_loss: 1.1034, test_f1: 0.5135
 epoch: 85, train_loss: 0.6733, test_loss: 1.1550, test_f1: 0.4914
 epoch: 86, train_loss: 0.6828, test_loss: 1.1139, test_f1: 0.5128
 epoch: 87, train_loss: 0.6825, test_loss: 1.1105, test_f1: 0.5285
 epoch: 88, train_loss: 0.6744, test_loss: 1.1170, test_f1: 0.4831
 epoch: 89, train_loss: 0.6731, test_loss: 1.1150, test_f1: 0.5025
 epoch: 90, train_loss: 0.6731, test_loss: 1.1415, test_f1: 0.5150
 epoch: 91, train_loss: 0.6667, test_loss: 1.1026, test_f1: 0.5224
 epoch: 92, train_loss: 0.6618, test_loss: 1.1241, test_f1: 0.5146
 epoch: 93, train_loss: 0.6631, test_loss: 1.1082, test_f1: 0.5273
 epoch: 94, train_loss: 0.6622, test_loss: 1.1513, test_f1: 0.5196
 epoch: 95, train_loss: 0.6852, test_loss: 1.1466, test_f1: 0.5087
 epoch: 96, train_loss: 0.6758, test_loss: 1.1347, test_f1: 0.5258
 epoch: 97, train_loss: 0.6632, test_loss: 1.1779, test_f1: 0.5276
 epoch: 98, train_loss: 0.6602, test_loss: 1.1058, test_f1: 0.5181
 epoch: 99, train_loss: 0.6610, test_loss: 1.1164, test_f1: 0.5304
##################ITERATION #4 ****************************************
 epoch: 0, train_loss: 1.2519, test_loss: 1.1098, test_f1: 0.4741
 epoch: 1, train_loss: 1.1589, test_loss: 1.0842, test_f1: 0.4631
 epoch: 2, train_loss: 1.1327, test_loss: 1.0683, test_f1: 0.4692
 epoch: 3, train_loss: 1.1064, test_loss: 1.0408, test_f1: 0.4721
 epoch: 4, train_loss: 1.0897, test_loss: 1.0307, test_f1: 0.4595
 epoch: 5, train_loss: 1.0673, test_loss: 1.0082, test_f1: 0.4947
 epoch: 6, train_loss: 1.0520, test_loss: 1.0002, test_f1: 0.4618
 epoch: 7, train_loss: 1.0381, test_loss: 0.9886, test_f1: 0.4791
 epoch: 8, train_loss: 1.0217, test_loss: 1.0108, test_f1: 0.4660
 epoch: 9, train_loss: 1.0158, test_loss: 0.9909, test_f1: 0.4823
 epoch: 10, train_loss: 0.9985, test_loss: 0.9785, test_f1: 0.4781
 epoch: 11, train_loss: 0.9876, test_loss: 0.9983, test_f1: 0.4782
 epoch: 12, train_loss: 0.9769, test_loss: 0.9956, test_f1: 0.4974
 epoch: 13, train_loss: 0.9655, test_loss: 0.9614, test_f1: 0.4920
 epoch: 14, train_loss: 0.9591, test_loss: 1.0020, test_f1: 0.4803
 epoch: 15, train_loss: 0.9498, test_loss: 0.9871, test_f1: 0.5064
 epoch: 16, train_loss: 0.9550, test_loss: 0.9905, test_f1: 0.5112
 epoch: 17, train_loss: 0.9397, test_loss: 0.9669, test_f1: 0.5096
 epoch: 18, train_loss: 0.9445, test_loss: 0.9638, test_f1: 0.4878
 epoch: 19, train_loss: 0.9316, test_loss: 0.9681, test_f1: 0.4973
 epoch: 20, train_loss: 0.9180, test_loss: 0.9498, test_f1: 0.5249
 epoch: 21, train_loss: 0.9085, test_loss: 0.9876, test_f1: 0.4993
 epoch: 22, train_loss: 0.9135, test_loss: 0.9771, test_f1: 0.5163
 epoch: 23, train_loss: 0.9058, test_loss: 0.9891, test_f1: 0.5160
 epoch: 24, train_loss: 0.8924, test_loss: 0.9871, test_f1: 0.5358
 epoch: 25, train_loss: 0.8886, test_loss: 0.9703, test_f1: 0.5182
 epoch: 26, train_loss: 0.8839, test_loss: 1.0097, test_f1: 0.5180
 epoch: 27, train_loss: 0.8869, test_loss: 0.9989, test_f1: 0.5009
 epoch: 28, train_loss: 0.8770, test_loss: 1.0157, test_f1: 0.5242
 epoch: 29, train_loss: 0.8606, test_loss: 1.0199, test_f1: 0.5051
 epoch: 30, train_loss: 0.8675, test_loss: 1.0033, test_f1: 0.5148
 epoch: 31, train_loss: 0.8612, test_loss: 1.0126, test_f1: 0.5313
 epoch: 32, train_loss: 0.8481, test_loss: 0.9866, test_f1: 0.5218
 epoch: 33, train_loss: 0.8452, test_loss: 1.0211, test_f1: 0.5067
 epoch: 34, train_loss: 0.8332, test_loss: 0.9971, test_f1: 0.5513
 epoch: 35, train_loss: 0.8412, test_loss: 0.9980, test_f1: 0.5379
 epoch: 36, train_loss: 0.8355, test_loss: 1.0303, test_f1: 0.5130
 epoch: 37, train_loss: 0.8210, test_loss: 1.0334, test_f1: 0.5280
 epoch: 38, train_loss: 0.8222, test_loss: 1.0187, test_f1: 0.5381
 epoch: 39, train_loss: 0.8175, test_loss: 1.0350, test_f1: 0.5406
 epoch: 40, train_loss: 0.8125, test_loss: 1.0208, test_f1: 0.5351
 epoch: 41, train_loss: 0.8121, test_loss: 1.0884, test_f1: 0.5318
 epoch: 42, train_loss: 0.8127, test_loss: 1.0722, test_f1: 0.5420
 epoch: 43, train_loss: 0.8131, test_loss: 1.0457, test_f1: 0.5261
 epoch: 44, train_loss: 0.7875, test_loss: 1.0674, test_f1: 0.5280
 epoch: 45, train_loss: 0.7925, test_loss: 1.0649, test_f1: 0.5057
 epoch: 46, train_loss: 0.7797, test_loss: 1.0751, test_f1: 0.5239
 epoch: 47, train_loss: 0.7860, test_loss: 1.0787, test_f1: 0.5028
 epoch: 48, train_loss: 0.7757, test_loss: 1.0534, test_f1: 0.5398
 epoch: 49, train_loss: 0.7793, test_loss: 1.0589, test_f1: 0.5176
 epoch: 50, train_loss: 0.7560, test_loss: 1.0869, test_f1: 0.5361
 epoch: 51, train_loss: 0.7546, test_loss: 1.0425, test_f1: 0.5365
 epoch: 52, train_loss: 0.7477, test_loss: 1.0460, test_f1: 0.5406
 epoch: 53, train_loss: 0.7464, test_loss: 1.0762, test_f1: 0.5331
 epoch: 54, train_loss: 0.7468, test_loss: 1.0741, test_f1: 0.5449
 epoch: 55, train_loss: 0.7604, test_loss: 1.0638, test_f1: 0.5494
 epoch: 56, train_loss: 0.7308, test_loss: 1.0655, test_f1: 0.5290
 epoch: 57, train_loss: 0.7427, test_loss: 1.0487, test_f1: 0.5675
 epoch: 58, train_loss: 0.7344, test_loss: 1.0434, test_f1: 0.5271
 epoch: 59, train_loss: 0.7340, test_loss: 1.1023, test_f1: 0.5355
 epoch: 60, train_loss: 0.7185, test_loss: 1.1361, test_f1: 0.4864
 epoch: 61, train_loss: 0.7258, test_loss: 1.0916, test_f1: 0.5226
 epoch: 62, train_loss: 0.7333, test_loss: 1.1015, test_f1: 0.5233
 epoch: 63, train_loss: 0.7160, test_loss: 1.0670, test_f1: 0.5163
 epoch: 64, train_loss: 0.7182, test_loss: 1.0760, test_f1: 0.5251
 epoch: 65, train_loss: 0.7217, test_loss: 1.1145, test_f1: 0.5345
 epoch: 66, train_loss: 0.7132, test_loss: 1.0997, test_f1: 0.5416
 epoch: 67, train_loss: 0.7211, test_loss: 1.1332, test_f1: 0.5081
 epoch: 68, train_loss: 0.7081, test_loss: 1.0849, test_f1: 0.5184
 epoch: 69, train_loss: 0.7052, test_loss: 1.1087, test_f1: 0.5366
 epoch: 70, train_loss: 0.7034, test_loss: 1.1768, test_f1: 0.5256
 epoch: 71, train_loss: 0.7013, test_loss: 1.1303, test_f1: 0.5228
 epoch: 72, train_loss: 0.6972, test_loss: 1.1541, test_f1: 0.5229
 epoch: 73, train_loss: 0.6951, test_loss: 1.1275, test_f1: 0.5373
 epoch: 74, train_loss: 0.6984, test_loss: 1.1110, test_f1: 0.5340
 epoch: 75, train_loss: 0.6853, test_loss: 1.1462, test_f1: 0.5209
 epoch: 76, train_loss: 0.7043, test_loss: 1.1619, test_f1: 0.5208
 epoch: 77, train_loss: 0.6892, test_loss: 1.1428, test_f1: 0.5422
 epoch: 78, train_loss: 0.6804, test_loss: 1.1366, test_f1: 0.5305
 epoch: 79, train_loss: 0.6882, test_loss: 1.1579, test_f1: 0.5333
 epoch: 80, train_loss: 0.6730, test_loss: 1.1881, test_f1: 0.5098
 epoch: 81, train_loss: 0.6671, test_loss: 1.1346, test_f1: 0.5234
 epoch: 82, train_loss: 0.6844, test_loss: 1.1191, test_f1: 0.5319
 epoch: 83, train_loss: 0.6757, test_loss: 1.1473, test_f1: 0.5353
 epoch: 84, train_loss: 0.6760, test_loss: 1.1419, test_f1: 0.5349
 epoch: 85, train_loss: 0.6803, test_loss: 1.1506, test_f1: 0.5396
 epoch: 86, train_loss: 0.6621, test_loss: 1.1587, test_f1: 0.5387
 epoch: 87, train_loss: 0.6765, test_loss: 1.1224, test_f1: 0.5531
 epoch: 88, train_loss: 0.6593, test_loss: 1.1764, test_f1: 0.5533
 epoch: 89, train_loss: 0.6593, test_loss: 1.1817, test_f1: 0.5390
 epoch: 90, train_loss: 0.6667, test_loss: 1.1885, test_f1: 0.5388
 epoch: 91, train_loss: 0.6551, test_loss: 1.1522, test_f1: 0.5399
 epoch: 92, train_loss: 0.6700, test_loss: 1.2087, test_f1: 0.5336
 epoch: 93, train_loss: 0.6546, test_loss: 1.1872, test_f1: 0.5291
 epoch: 94, train_loss: 0.6442, test_loss: 1.1571, test_f1: 0.5422
 epoch: 95, train_loss: 0.6622, test_loss: 1.2567, test_f1: 0.5318
 epoch: 96, train_loss: 0.6463, test_loss: 1.1663, test_f1: 0.5634
 epoch: 97, train_loss: 0.6507, test_loss: 1.1895, test_f1: 0.5443
 epoch: 98, train_loss: 0.6563, test_loss: 1.2292, test_f1: 0.5364
 epoch: 99, train_loss: 0.6525, test_loss: 1.1796, test_f1: 0.5541
##################ITERATION #5 ****************************************
 epoch: 0, train_loss: 1.3044, test_loss: 1.1707, test_f1: 0.4320
 epoch: 1, train_loss: 1.1934, test_loss: 1.1301, test_f1: 0.4121
 epoch: 2, train_loss: 1.1619, test_loss: 1.1017, test_f1: 0.4389
 epoch: 3, train_loss: 1.1397, test_loss: 1.0852, test_f1: 0.4579
 epoch: 4, train_loss: 1.1290, test_loss: 1.0807, test_f1: 0.4313
 epoch: 5, train_loss: 1.1013, test_loss: 1.0551, test_f1: 0.4612
 epoch: 6, train_loss: 1.0927, test_loss: 1.0477, test_f1: 0.4573
 epoch: 7, train_loss: 1.0794, test_loss: 1.0351, test_f1: 0.4396
 epoch: 8, train_loss: 1.0670, test_loss: 1.0327, test_f1: 0.4525
 epoch: 9, train_loss: 1.0475, test_loss: 1.0122, test_f1: 0.4732
 epoch: 10, train_loss: 1.0358, test_loss: 1.0047, test_f1: 0.4834
 epoch: 11, train_loss: 1.0311, test_loss: 0.9929, test_f1: 0.4788
 epoch: 12, train_loss: 1.0169, test_loss: 1.0043, test_f1: 0.4896
 epoch: 13, train_loss: 1.0094, test_loss: 1.0051, test_f1: 0.4501
 epoch: 14, train_loss: 0.9986, test_loss: 0.9921, test_f1: 0.4732
 epoch: 15, train_loss: 0.9904, test_loss: 0.9758, test_f1: 0.4793
 epoch: 16, train_loss: 0.9884, test_loss: 0.9861, test_f1: 0.4437
 epoch: 17, train_loss: 0.9742, test_loss: 0.9783, test_f1: 0.4612
 epoch: 18, train_loss: 0.9595, test_loss: 0.9740, test_f1: 0.4671
 epoch: 19, train_loss: 0.9587, test_loss: 0.9740, test_f1: 0.4701
 epoch: 20, train_loss: 0.9384, test_loss: 0.9717, test_f1: 0.4885
 epoch: 21, train_loss: 0.9464, test_loss: 0.9377, test_f1: 0.5359
 epoch: 22, train_loss: 0.9400, test_loss: 0.9689, test_f1: 0.4752
 epoch: 23, train_loss: 0.9322, test_loss: 0.9696, test_f1: 0.4845
 epoch: 24, train_loss: 0.9235, test_loss: 0.9841, test_f1: 0.4819
 epoch: 25, train_loss: 0.9167, test_loss: 0.9758, test_f1: 0.4810
 epoch: 26, train_loss: 0.9152, test_loss: 0.9473, test_f1: 0.5025
 epoch: 27, train_loss: 0.8953, test_loss: 0.9563, test_f1: 0.5079
 epoch: 28, train_loss: 0.8995, test_loss: 0.9949, test_f1: 0.4887
 epoch: 29, train_loss: 0.8970, test_loss: 0.9692, test_f1: 0.5030
 epoch: 30, train_loss: 0.8986, test_loss: 0.9585, test_f1: 0.5241
 epoch: 31, train_loss: 0.8726, test_loss: 0.9534, test_f1: 0.5163
 epoch: 32, train_loss: 0.8776, test_loss: 0.9666, test_f1: 0.5053
 epoch: 33, train_loss: 0.8733, test_loss: 0.9838, test_f1: 0.4969
 epoch: 34, train_loss: 0.8617, test_loss: 1.0412, test_f1: 0.4906
 epoch: 35, train_loss: 0.8619, test_loss: 0.9715, test_f1: 0.5342
 epoch: 36, train_loss: 0.8642, test_loss: 0.9875, test_f1: 0.5203
 epoch: 37, train_loss: 0.8515, test_loss: 0.9993, test_f1: 0.4946
 epoch: 38, train_loss: 0.8392, test_loss: 0.9783, test_f1: 0.5190
 epoch: 39, train_loss: 0.8386, test_loss: 1.0198, test_f1: 0.5022
 epoch: 40, train_loss: 0.8368, test_loss: 0.9843, test_f1: 0.5179
 epoch: 41, train_loss: 0.8360, test_loss: 1.0712, test_f1: 0.5077
 epoch: 42, train_loss: 0.8243, test_loss: 0.9973, test_f1: 0.5139
 epoch: 43, train_loss: 0.8288, test_loss: 1.0337, test_f1: 0.5324
 epoch: 44, train_loss: 0.8232, test_loss: 1.0298, test_f1: 0.5302
 epoch: 45, train_loss: 0.8208, test_loss: 1.0144, test_f1: 0.5038
 epoch: 46, train_loss: 0.8110, test_loss: 1.0807, test_f1: 0.4824
 epoch: 47, train_loss: 0.8179, test_loss: 1.0912, test_f1: 0.5321
 epoch: 48, train_loss: 0.8027, test_loss: 1.1938, test_f1: 0.5080
 epoch: 49, train_loss: 0.8015, test_loss: 1.1124, test_f1: 0.5259
 epoch: 50, train_loss: 0.8055, test_loss: 1.1409, test_f1: 0.5384
 epoch: 51, train_loss: 0.7938, test_loss: 1.0492, test_f1: 0.5322
 epoch: 52, train_loss: 0.7850, test_loss: 1.1530, test_f1: 0.5361
 epoch: 53, train_loss: 0.7925, test_loss: 1.1310, test_f1: 0.5169
 epoch: 54, train_loss: 0.7692, test_loss: 1.0529, test_f1: 0.5360
 epoch: 55, train_loss: 0.7723, test_loss: 1.0979, test_f1: 0.5042
 epoch: 56, train_loss: 0.7709, test_loss: 1.0816, test_f1: 0.5391
 epoch: 57, train_loss: 0.7621, test_loss: 1.0701, test_f1: 0.5301
 epoch: 58, train_loss: 0.7647, test_loss: 1.1116, test_f1: 0.5303
 epoch: 59, train_loss: 0.7562, test_loss: 1.0993, test_f1: 0.5380
 epoch: 60, train_loss: 0.7762, test_loss: 1.0778, test_f1: 0.5291
 epoch: 61, train_loss: 0.7570, test_loss: 1.1294, test_f1: 0.5209
 epoch: 62, train_loss: 0.7545, test_loss: 1.1003, test_f1: 0.5400
 epoch: 63, train_loss: 0.7577, test_loss: 1.1482, test_f1: 0.5420
 epoch: 64, train_loss: 0.7609, test_loss: 1.0939, test_f1: 0.5384
 epoch: 65, train_loss: 0.7511, test_loss: 1.1593, test_f1: 0.5181
 epoch: 66, train_loss: 0.7519, test_loss: 1.1844, test_f1: 0.5501
 epoch: 67, train_loss: 0.7458, test_loss: 1.1998, test_f1: 0.5309
 epoch: 68, train_loss: 0.7472, test_loss: 1.1018, test_f1: 0.5319
 epoch: 69, train_loss: 0.7360, test_loss: 1.1313, test_f1: 0.5431
 epoch: 70, train_loss: 0.7429, test_loss: 1.1657, test_f1: 0.5444
 epoch: 71, train_loss: 0.7434, test_loss: 1.1844, test_f1: 0.5424
 epoch: 72, train_loss: 0.7254, test_loss: 1.2047, test_f1: 0.5145
 epoch: 73, train_loss: 0.7323, test_loss: 1.2026, test_f1: 0.5232
 epoch: 74, train_loss: 0.7307, test_loss: 1.1568, test_f1: 0.5343
 epoch: 75, train_loss: 0.7318, test_loss: 1.2143, test_f1: 0.5131
 epoch: 76, train_loss: 0.7321, test_loss: 1.1619, test_f1: 0.5125
 epoch: 77, train_loss: 0.7228, test_loss: 1.1778, test_f1: 0.5283
 epoch: 78, train_loss: 0.7285, test_loss: 1.2257, test_f1: 0.5334
 epoch: 79, train_loss: 0.7187, test_loss: 1.1739, test_f1: 0.5383
 epoch: 80, train_loss: 0.7343, test_loss: 1.2223, test_f1: 0.5510
 epoch: 81, train_loss: 0.7317, test_loss: 1.2770, test_f1: 0.5484
 epoch: 82, train_loss: 0.7157, test_loss: 1.2385, test_f1: 0.5248
 epoch: 83, train_loss: 0.7152, test_loss: 1.2826, test_f1: 0.5218
 epoch: 84, train_loss: 0.7069, test_loss: 1.3006, test_f1: 0.5488
 epoch: 85, train_loss: 0.7149, test_loss: 1.2704, test_f1: 0.5318
 epoch: 86, train_loss: 0.7073, test_loss: 1.2824, test_f1: 0.5187
 epoch: 87, train_loss: 0.7245, test_loss: 1.2154, test_f1: 0.5429
 epoch: 88, train_loss: 0.7033, test_loss: 1.2872, test_f1: 0.5168
 epoch: 89, train_loss: 0.7015, test_loss: 1.2554, test_f1: 0.5474
 epoch: 90, train_loss: 0.6803, test_loss: 1.3258, test_f1: 0.5251
 epoch: 91, train_loss: 0.7030, test_loss: 1.4656, test_f1: 0.5256
 epoch: 92, train_loss: 0.7024, test_loss: 1.2454, test_f1: 0.5280
 epoch: 93, train_loss: 0.7093, test_loss: 1.2886, test_f1: 0.5315
 epoch: 94, train_loss: 0.7109, test_loss: 1.2907, test_f1: 0.5207
 epoch: 95, train_loss: 0.7047, test_loss: 1.3490, test_f1: 0.5079
 epoch: 96, train_loss: 0.6969, test_loss: 1.2202, test_f1: 0.5379
 epoch: 97, train_loss: 0.6895, test_loss: 1.2369, test_f1: 0.5389
 epoch: 98, train_loss: 0.6945, test_loss: 1.2384, test_f1: 0.5218
 epoch: 99, train_loss: 0.6928, test_loss: 1.2573, test_f1: 0.5357
##################ITERATION #6 ****************************************
 epoch: 0, train_loss: 1.3295, test_loss: 1.1378, test_f1: 0.4473
 epoch: 1, train_loss: 1.1818, test_loss: 1.1023, test_f1: 0.4467
 epoch: 2, train_loss: 1.1543, test_loss: 1.0856, test_f1: 0.4639
 epoch: 3, train_loss: 1.1226, test_loss: 1.0586, test_f1: 0.4696
 epoch: 4, train_loss: 1.1177, test_loss: 1.0493, test_f1: 0.4556
 epoch: 5, train_loss: 1.0808, test_loss: 1.0503, test_f1: 0.4596
 epoch: 6, train_loss: 1.0676, test_loss: 1.0465, test_f1: 0.4596
 epoch: 7, train_loss: 1.0517, test_loss: 1.0139, test_f1: 0.4745
 epoch: 8, train_loss: 1.0432, test_loss: 1.0116, test_f1: 0.4705
 epoch: 9, train_loss: 1.0367, test_loss: 0.9944, test_f1: 0.4593
 epoch: 10, train_loss: 1.0243, test_loss: 1.0033, test_f1: 0.4605
 epoch: 11, train_loss: 1.0123, test_loss: 0.9694, test_f1: 0.4717
 epoch: 12, train_loss: 0.9846, test_loss: 0.9807, test_f1: 0.4876
 epoch: 13, train_loss: 0.9832, test_loss: 0.9575, test_f1: 0.4894
 epoch: 14, train_loss: 0.9805, test_loss: 0.9880, test_f1: 0.4455
 epoch: 15, train_loss: 0.9803, test_loss: 0.9607, test_f1: 0.4811
 epoch: 16, train_loss: 0.9565, test_loss: 0.9545, test_f1: 0.5083
 epoch: 17, train_loss: 0.9567, test_loss: 0.9984, test_f1: 0.4755
 epoch: 18, train_loss: 0.9441, test_loss: 0.9916, test_f1: 0.4788
 epoch: 19, train_loss: 0.9473, test_loss: 0.9642, test_f1: 0.4978
 epoch: 20, train_loss: 0.9379, test_loss: 0.9715, test_f1: 0.4867
 epoch: 21, train_loss: 0.9267, test_loss: 0.9832, test_f1: 0.5006
 epoch: 22, train_loss: 0.9243, test_loss: 0.9594, test_f1: 0.5102
 epoch: 23, train_loss: 0.9233, test_loss: 0.9677, test_f1: 0.5176
 epoch: 24, train_loss: 0.9041, test_loss: 0.9848, test_f1: 0.4951
 epoch: 25, train_loss: 0.8932, test_loss: 0.9866, test_f1: 0.5101
 epoch: 26, train_loss: 0.8943, test_loss: 0.9725, test_f1: 0.4911
 epoch: 27, train_loss: 0.8879, test_loss: 0.9861, test_f1: 0.5102
 epoch: 28, train_loss: 0.8725, test_loss: 0.9809, test_f1: 0.4815
 epoch: 29, train_loss: 0.8722, test_loss: 0.9797, test_f1: 0.5115
 epoch: 30, train_loss: 0.8717, test_loss: 0.9742, test_f1: 0.5253
 epoch: 31, train_loss: 0.8724, test_loss: 0.9917, test_f1: 0.5174
 epoch: 32, train_loss: 0.8537, test_loss: 0.9927, test_f1: 0.5133
 epoch: 33, train_loss: 0.8569, test_loss: 1.0187, test_f1: 0.5198
 epoch: 34, train_loss: 0.8524, test_loss: 0.9779, test_f1: 0.5273
 epoch: 35, train_loss: 0.8494, test_loss: 1.0398, test_f1: 0.5090
 epoch: 36, train_loss: 0.8485, test_loss: 1.0214, test_f1: 0.5077
 epoch: 37, train_loss: 0.8367, test_loss: 1.0045, test_f1: 0.5195
 epoch: 38, train_loss: 0.8322, test_loss: 1.0129, test_f1: 0.5177
 epoch: 39, train_loss: 0.8288, test_loss: 1.0102, test_f1: 0.5134
 epoch: 40, train_loss: 0.8389, test_loss: 0.9912, test_f1: 0.5177
 epoch: 41, train_loss: 0.8274, test_loss: 1.0108, test_f1: 0.5486
 epoch: 42, train_loss: 0.8113, test_loss: 1.0155, test_f1: 0.5383
 epoch: 43, train_loss: 0.8230, test_loss: 1.0272, test_f1: 0.5151
 epoch: 44, train_loss: 0.8063, test_loss: 0.9990, test_f1: 0.5236
 epoch: 45, train_loss: 0.7988, test_loss: 1.0457, test_f1: 0.5194
 epoch: 46, train_loss: 0.7894, test_loss: 1.0369, test_f1: 0.5264
 epoch: 47, train_loss: 0.7888, test_loss: 1.0153, test_f1: 0.5343
 epoch: 48, train_loss: 0.7884, test_loss: 1.0100, test_f1: 0.5347
 epoch: 49, train_loss: 0.7784, test_loss: 1.0440, test_f1: 0.5271
 epoch: 50, train_loss: 0.7833, test_loss: 1.0216, test_f1: 0.5354
 epoch: 51, train_loss: 0.7691, test_loss: 1.0406, test_f1: 0.5187
 epoch: 52, train_loss: 0.7685, test_loss: 1.0449, test_f1: 0.5123
 epoch: 53, train_loss: 0.7654, test_loss: 1.0496, test_f1: 0.5198
 epoch: 54, train_loss: 0.7631, test_loss: 1.0685, test_f1: 0.5315
 epoch: 55, train_loss: 0.7602, test_loss: 1.0598, test_f1: 0.5360
 epoch: 56, train_loss: 0.7579, test_loss: 1.0463, test_f1: 0.5332
 epoch: 57, train_loss: 0.7443, test_loss: 1.0732, test_f1: 0.5354
 epoch: 58, train_loss: 0.7401, test_loss: 1.0929, test_f1: 0.5239
 epoch: 59, train_loss: 0.7377, test_loss: 1.0615, test_f1: 0.5263
 epoch: 60, train_loss: 0.7428, test_loss: 1.0977, test_f1: 0.5182
 epoch: 61, train_loss: 0.7462, test_loss: 1.0901, test_f1: 0.5255
 epoch: 62, train_loss: 0.7349, test_loss: 1.0931, test_f1: 0.5420
 epoch: 63, train_loss: 0.7274, test_loss: 1.0865, test_f1: 0.5342
 epoch: 64, train_loss: 0.7336, test_loss: 1.0944, test_f1: 0.5355
 epoch: 65, train_loss: 0.7269, test_loss: 1.1441, test_f1: 0.5153
 epoch: 66, train_loss: 0.7307, test_loss: 1.0763, test_f1: 0.5386
 epoch: 67, train_loss: 0.7329, test_loss: 1.0808, test_f1: 0.5430
 epoch: 68, train_loss: 0.7209, test_loss: 1.0858, test_f1: 0.5347
 epoch: 69, train_loss: 0.7177, test_loss: 1.1325, test_f1: 0.5199
 epoch: 70, train_loss: 0.7180, test_loss: 1.1266, test_f1: 0.5079
 epoch: 71, train_loss: 0.7202, test_loss: 1.1190, test_f1: 0.5392
 epoch: 72, train_loss: 0.7113, test_loss: 1.0907, test_f1: 0.5422
 epoch: 73, train_loss: 0.7208, test_loss: 1.1263, test_f1: 0.5356
 epoch: 74, train_loss: 0.7025, test_loss: 1.1302, test_f1: 0.5277
 epoch: 75, train_loss: 0.7121, test_loss: 1.0852, test_f1: 0.5224
 epoch: 76, train_loss: 0.6952, test_loss: 1.0914, test_f1: 0.5343
 epoch: 77, train_loss: 0.7114, test_loss: 1.1451, test_f1: 0.5188
 epoch: 78, train_loss: 0.7092, test_loss: 1.1047, test_f1: 0.5350
 epoch: 79, train_loss: 0.6973, test_loss: 1.0932, test_f1: 0.5289
 epoch: 80, train_loss: 0.7080, test_loss: 1.0924, test_f1: 0.5378
 epoch: 81, train_loss: 0.6956, test_loss: 1.1138, test_f1: 0.5303
 epoch: 82, train_loss: 0.6978, test_loss: 1.1255, test_f1: 0.5346
 epoch: 83, train_loss: 0.6828, test_loss: 1.1750, test_f1: 0.5260
 epoch: 84, train_loss: 0.6938, test_loss: 1.1723, test_f1: 0.5351
 epoch: 85, train_loss: 0.7003, test_loss: 1.1740, test_f1: 0.5244
 epoch: 86, train_loss: 0.6973, test_loss: 1.1740, test_f1: 0.5449
 epoch: 87, train_loss: 0.6815, test_loss: 1.1579, test_f1: 0.5282
 epoch: 88, train_loss: 0.6969, test_loss: 1.1320, test_f1: 0.5399
 epoch: 89, train_loss: 0.6767, test_loss: 1.1404, test_f1: 0.5282
 epoch: 90, train_loss: 0.6925, test_loss: 1.1763, test_f1: 0.5274
 epoch: 91, train_loss: 0.6986, test_loss: 1.2110, test_f1: 0.4995
 epoch: 92, train_loss: 0.6769, test_loss: 1.1779, test_f1: 0.5233
 epoch: 93, train_loss: 0.6708, test_loss: 1.1271, test_f1: 0.5400
 epoch: 94, train_loss: 0.6688, test_loss: 1.2210, test_f1: 0.5331
 epoch: 95, train_loss: 0.6771, test_loss: 1.1618, test_f1: 0.5361
 epoch: 96, train_loss: 0.6774, test_loss: 1.1498, test_f1: 0.5314
 epoch: 97, train_loss: 0.6649, test_loss: 1.1708, test_f1: 0.5275
 epoch: 98, train_loss: 0.6866, test_loss: 1.1827, test_f1: 0.5228
 epoch: 99, train_loss: 0.6775, test_loss: 1.2078, test_f1: 0.5224
##################ITERATION #7 ****************************************
 epoch: 0, train_loss: 1.3128, test_loss: 1.1371, test_f1: 0.4512
 epoch: 1, train_loss: 1.1933, test_loss: 1.0952, test_f1: 0.4475
 epoch: 2, train_loss: 1.1553, test_loss: 1.0787, test_f1: 0.4711
 epoch: 3, train_loss: 1.1384, test_loss: 1.0552, test_f1: 0.4743
 epoch: 4, train_loss: 1.1194, test_loss: 1.0529, test_f1: 0.4695
 epoch: 5, train_loss: 1.1012, test_loss: 1.0245, test_f1: 0.4592
 epoch: 6, train_loss: 1.0878, test_loss: 1.0148, test_f1: 0.4852
 epoch: 7, train_loss: 1.0726, test_loss: 1.0071, test_f1: 0.4806
 epoch: 8, train_loss: 1.0558, test_loss: 0.9862, test_f1: 0.4880
 epoch: 9, train_loss: 1.0530, test_loss: 0.9920, test_f1: 0.4874
 epoch: 10, train_loss: 1.0420, test_loss: 0.9803, test_f1: 0.5230
 epoch: 11, train_loss: 1.0336, test_loss: 1.0051, test_f1: 0.4896
 epoch: 12, train_loss: 1.0194, test_loss: 0.9746, test_f1: 0.5093
 epoch: 13, train_loss: 1.0049, test_loss: 0.9705, test_f1: 0.4780
 epoch: 14, train_loss: 1.0008, test_loss: 0.9761, test_f1: 0.5017
 epoch: 15, train_loss: 0.9744, test_loss: 0.9646, test_f1: 0.4792
 epoch: 16, train_loss: 0.9708, test_loss: 0.9596, test_f1: 0.4916
 epoch: 17, train_loss: 0.9737, test_loss: 0.9721, test_f1: 0.4971
 epoch: 18, train_loss: 0.9707, test_loss: 0.9668, test_f1: 0.4920
 epoch: 19, train_loss: 0.9591, test_loss: 0.9674, test_f1: 0.5109
 epoch: 20, train_loss: 0.9572, test_loss: 0.9564, test_f1: 0.5271
 epoch: 21, train_loss: 0.9501, test_loss: 0.9487, test_f1: 0.5053
 epoch: 22, train_loss: 0.9404, test_loss: 0.9586, test_f1: 0.5176
 epoch: 23, train_loss: 0.9379, test_loss: 0.9705, test_f1: 0.4721
 epoch: 24, train_loss: 0.9241, test_loss: 0.9662, test_f1: 0.5183
 epoch: 25, train_loss: 0.9063, test_loss: 0.9457, test_f1: 0.5184
 epoch: 26, train_loss: 0.9067, test_loss: 0.9765, test_f1: 0.5239
 epoch: 27, train_loss: 0.9143, test_loss: 0.9492, test_f1: 0.4836
 epoch: 28, train_loss: 0.8979, test_loss: 0.9449, test_f1: 0.4881
 epoch: 29, train_loss: 0.8979, test_loss: 0.9838, test_f1: 0.4977
 epoch: 30, train_loss: 0.8949, test_loss: 0.9894, test_f1: 0.5182
 epoch: 31, train_loss: 0.8888, test_loss: 0.9605, test_f1: 0.5139
 epoch: 32, train_loss: 0.8876, test_loss: 0.9649, test_f1: 0.5079
 epoch: 33, train_loss: 0.8770, test_loss: 0.9700, test_f1: 0.5082
 epoch: 34, train_loss: 0.8712, test_loss: 0.9757, test_f1: 0.5243
 epoch: 35, train_loss: 0.8611, test_loss: 0.9679, test_f1: 0.5392
 epoch: 36, train_loss: 0.8485, test_loss: 0.9903, test_f1: 0.5291
 epoch: 37, train_loss: 0.8652, test_loss: 0.9730, test_f1: 0.5300
 epoch: 38, train_loss: 0.8480, test_loss: 0.9763, test_f1: 0.5341
 epoch: 39, train_loss: 0.8506, test_loss: 1.0198, test_f1: 0.5194
 epoch: 40, train_loss: 0.8395, test_loss: 0.9674, test_f1: 0.5292
 epoch: 41, train_loss: 0.8476, test_loss: 0.9614, test_f1: 0.5322
 epoch: 42, train_loss: 0.8333, test_loss: 1.0832, test_f1: 0.5395
 epoch: 43, train_loss: 0.8211, test_loss: 0.9745, test_f1: 0.5326
 epoch: 44, train_loss: 0.8129, test_loss: 0.9672, test_f1: 0.5451
 epoch: 45, train_loss: 0.8193, test_loss: 1.0000, test_f1: 0.5330
 epoch: 46, train_loss: 0.8089, test_loss: 0.9815, test_f1: 0.5514
 epoch: 47, train_loss: 0.8130, test_loss: 1.0923, test_f1: 0.4999
 epoch: 48, train_loss: 0.8070, test_loss: 0.9739, test_f1: 0.5318
 epoch: 49, train_loss: 0.8225, test_loss: 1.0308, test_f1: 0.5429
 epoch: 50, train_loss: 0.8025, test_loss: 0.9958, test_f1: 0.5407
 epoch: 51, train_loss: 0.7805, test_loss: 1.0010, test_f1: 0.5396
 epoch: 52, train_loss: 0.7863, test_loss: 1.0189, test_f1: 0.5399
 epoch: 53, train_loss: 0.7789, test_loss: 1.0050, test_f1: 0.5423
 epoch: 54, train_loss: 0.7707, test_loss: 0.9997, test_f1: 0.5381
 epoch: 55, train_loss: 0.7732, test_loss: 0.9778, test_f1: 0.5521
 epoch: 56, train_loss: 0.7679, test_loss: 1.0175, test_f1: 0.5269
 epoch: 57, train_loss: 0.7567, test_loss: 1.0589, test_f1: 0.5356
 epoch: 58, train_loss: 0.7642, test_loss: 1.0351, test_f1: 0.5439
 epoch: 59, train_loss: 0.7530, test_loss: 1.0064, test_f1: 0.5401
 epoch: 60, train_loss: 0.7605, test_loss: 0.9854, test_f1: 0.5598
 epoch: 61, train_loss: 0.7585, test_loss: 1.0212, test_f1: 0.5423
 epoch: 62, train_loss: 0.7525, test_loss: 1.0368, test_f1: 0.5417
 epoch: 63, train_loss: 0.7490, test_loss: 1.0196, test_f1: 0.5495
 epoch: 64, train_loss: 0.7512, test_loss: 1.0448, test_f1: 0.5453
 epoch: 65, train_loss: 0.7472, test_loss: 1.0557, test_f1: 0.5424
 epoch: 66, train_loss: 0.7504, test_loss: 1.0230, test_f1: 0.5473
 epoch: 67, train_loss: 0.7427, test_loss: 1.0262, test_f1: 0.5486
 epoch: 68, train_loss: 0.7392, test_loss: 1.0607, test_f1: 0.5642
 epoch: 69, train_loss: 0.7419, test_loss: 1.0465, test_f1: 0.5478
 epoch: 70, train_loss: 0.7362, test_loss: 1.0285, test_f1: 0.5496
 epoch: 71, train_loss: 0.7415, test_loss: 1.0267, test_f1: 0.5437
 epoch: 72, train_loss: 0.7225, test_loss: 1.0310, test_f1: 0.5577
 epoch: 73, train_loss: 0.7249, test_loss: 1.0634, test_f1: 0.5526
 epoch: 74, train_loss: 0.7390, test_loss: 1.0341, test_f1: 0.5468
 epoch: 75, train_loss: 0.7134, test_loss: 1.0675, test_f1: 0.5423
 epoch: 76, train_loss: 0.7263, test_loss: 1.0288, test_f1: 0.5415
 epoch: 77, train_loss: 0.7166, test_loss: 1.0339, test_f1: 0.5442
 epoch: 78, train_loss: 0.7089, test_loss: 1.0496, test_f1: 0.5768
 epoch: 79, train_loss: 0.7130, test_loss: 1.0671, test_f1: 0.5484
 epoch: 80, train_loss: 0.7137, test_loss: 1.1081, test_f1: 0.5461
 epoch: 81, train_loss: 0.7196, test_loss: 1.0554, test_f1: 0.5585
 epoch: 82, train_loss: 0.7097, test_loss: 1.1098, test_f1: 0.5180
 epoch: 83, train_loss: 0.7105, test_loss: 1.0958, test_f1: 0.5268
 epoch: 84, train_loss: 0.7099, test_loss: 1.0589, test_f1: 0.5410
 epoch: 85, train_loss: 0.6940, test_loss: 1.0905, test_f1: 0.5467
 epoch: 86, train_loss: 0.6970, test_loss: 1.0488, test_f1: 0.5666
 epoch: 87, train_loss: 0.6911, test_loss: 1.1233, test_f1: 0.5259
 epoch: 88, train_loss: 0.7102, test_loss: 1.0812, test_f1: 0.5383
 epoch: 89, train_loss: 0.7103, test_loss: 1.0739, test_f1: 0.5327
 epoch: 90, train_loss: 0.7020, test_loss: 1.1098, test_f1: 0.5447
 epoch: 91, train_loss: 0.6958, test_loss: 1.0645, test_f1: 0.5384
 epoch: 92, train_loss: 0.6809, test_loss: 1.0923, test_f1: 0.5288
 epoch: 93, train_loss: 0.6903, test_loss: 1.1071, test_f1: 0.5326
 epoch: 94, train_loss: 0.6849, test_loss: 1.0647, test_f1: 0.5438
 epoch: 95, train_loss: 0.6827, test_loss: 1.0712, test_f1: 0.5614
 epoch: 96, train_loss: 0.6715, test_loss: 1.1156, test_f1: 0.5488
 epoch: 97, train_loss: 0.6689, test_loss: 1.0870, test_f1: 0.5536
 epoch: 98, train_loss: 0.6676, test_loss: 1.1169, test_f1: 0.5459
 epoch: 99, train_loss: 0.6670, test_loss: 1.1011, test_f1: 0.5400
##################ITERATION #8 ****************************************
 epoch: 0, train_loss: 1.3876, test_loss: 1.1842, test_f1: 0.4224
 epoch: 1, train_loss: 1.2118, test_loss: 1.1192, test_f1: 0.4417
 epoch: 2, train_loss: 1.1839, test_loss: 1.0913, test_f1: 0.4374
 epoch: 3, train_loss: 1.1600, test_loss: 1.0746, test_f1: 0.4428
 epoch: 4, train_loss: 1.1130, test_loss: 1.0627, test_f1: 0.4583
 epoch: 5, train_loss: 1.1090, test_loss: 1.0309, test_f1: 0.4774
 epoch: 6, train_loss: 1.0964, test_loss: 1.0118, test_f1: 0.4821
 epoch: 7, train_loss: 1.0783, test_loss: 1.0965, test_f1: 0.4614
 epoch: 8, train_loss: 1.0618, test_loss: 1.0531, test_f1: 0.4676
 epoch: 9, train_loss: 1.0377, test_loss: 1.0073, test_f1: 0.4503
 epoch: 10, train_loss: 1.0305, test_loss: 0.9993, test_f1: 0.4515
 epoch: 11, train_loss: 1.0225, test_loss: 0.9905, test_f1: 0.4465
 epoch: 12, train_loss: 1.0060, test_loss: 0.9792, test_f1: 0.4443
 epoch: 13, train_loss: 1.0096, test_loss: 1.1483, test_f1: 0.4360
 epoch: 14, train_loss: 0.9833, test_loss: 1.1093, test_f1: 0.4455
 epoch: 15, train_loss: 0.9822, test_loss: 1.0748, test_f1: 0.4488
 epoch: 16, train_loss: 0.9733, test_loss: 1.0243, test_f1: 0.4323
 epoch: 17, train_loss: 0.9688, test_loss: 1.0095, test_f1: 0.4612
 epoch: 18, train_loss: 0.9449, test_loss: 0.9784, test_f1: 0.4704
 epoch: 19, train_loss: 0.9432, test_loss: 0.9595, test_f1: 0.4829
 epoch: 20, train_loss: 0.9283, test_loss: 0.9709, test_f1: 0.5164
 epoch: 21, train_loss: 0.9352, test_loss: 0.9652, test_f1: 0.4988
 epoch: 22, train_loss: 0.9218, test_loss: 0.9969, test_f1: 0.4543
 epoch: 23, train_loss: 0.9371, test_loss: 0.9774, test_f1: 0.4678
 epoch: 24, train_loss: 0.9124, test_loss: 0.9872, test_f1: 0.4747
 epoch: 25, train_loss: 0.8957, test_loss: 1.0023, test_f1: 0.5012
 epoch: 26, train_loss: 0.8989, test_loss: 0.9876, test_f1: 0.4836
 epoch: 27, train_loss: 0.8891, test_loss: 1.0022, test_f1: 0.4772
 epoch: 28, train_loss: 0.8932, test_loss: 1.0385, test_f1: 0.4884
 epoch: 29, train_loss: 0.8694, test_loss: 1.0096, test_f1: 0.4987
 epoch: 30, train_loss: 0.8703, test_loss: 1.0687, test_f1: 0.4660
 epoch: 31, train_loss: 0.8593, test_loss: 1.0193, test_f1: 0.4796
 epoch: 32, train_loss: 0.8741, test_loss: 1.0911, test_f1: 0.4749
 epoch: 33, train_loss: 0.8661, test_loss: 0.9823, test_f1: 0.4980
 epoch: 34, train_loss: 0.8493, test_loss: 1.0701, test_f1: 0.4553
 epoch: 35, train_loss: 0.8459, test_loss: 1.0011, test_f1: 0.4887
 epoch: 36, train_loss: 0.8306, test_loss: 1.0084, test_f1: 0.5010
 epoch: 37, train_loss: 0.8443, test_loss: 0.9910, test_f1: 0.4980
 epoch: 38, train_loss: 0.8472, test_loss: 1.0569, test_f1: 0.4584
 epoch: 39, train_loss: 0.8333, test_loss: 1.0908, test_f1: 0.4918
 epoch: 40, train_loss: 0.8263, test_loss: 1.1993, test_f1: 0.4823
 epoch: 41, train_loss: 0.8249, test_loss: 1.0095, test_f1: 0.5068
 epoch: 42, train_loss: 0.8121, test_loss: 1.0344, test_f1: 0.4929
 epoch: 43, train_loss: 0.8246, test_loss: 1.1097, test_f1: 0.4851
 epoch: 44, train_loss: 0.7961, test_loss: 1.1285, test_f1: 0.4811
 epoch: 45, train_loss: 0.8042, test_loss: 1.1302, test_f1: 0.4862
 epoch: 46, train_loss: 0.8020, test_loss: 1.1260, test_f1: 0.4968
 epoch: 47, train_loss: 0.8000, test_loss: 1.1574, test_f1: 0.4867
 epoch: 48, train_loss: 0.7836, test_loss: 1.0635, test_f1: 0.5058
 epoch: 49, train_loss: 0.7814, test_loss: 1.0847, test_f1: 0.4971
 epoch: 50, train_loss: 0.7892, test_loss: 1.0844, test_f1: 0.4889
 epoch: 51, train_loss: 0.7606, test_loss: 1.0962, test_f1: 0.4976
 epoch: 52, train_loss: 0.7504, test_loss: 1.0869, test_f1: 0.4853
 epoch: 53, train_loss: 0.7453, test_loss: 1.0821, test_f1: 0.4853
 epoch: 54, train_loss: 0.7436, test_loss: 1.0998, test_f1: 0.5000
 epoch: 55, train_loss: 0.7503, test_loss: 1.2031, test_f1: 0.4827
 epoch: 56, train_loss: 0.7338, test_loss: 1.1284, test_f1: 0.5083
 epoch: 57, train_loss: 0.7426, test_loss: 1.1699, test_f1: 0.4993
 epoch: 58, train_loss: 0.7463, test_loss: 1.1260, test_f1: 0.5045
 epoch: 59, train_loss: 0.7436, test_loss: 1.1376, test_f1: 0.5016
 epoch: 60, train_loss: 0.7311, test_loss: 1.1325, test_f1: 0.4942
 epoch: 61, train_loss: 0.7258, test_loss: 1.1325, test_f1: 0.4909
 epoch: 62, train_loss: 0.7340, test_loss: 1.2207, test_f1: 0.4864
 epoch: 63, train_loss: 0.7063, test_loss: 1.2330, test_f1: 0.4823
 epoch: 64, train_loss: 0.7273, test_loss: 1.2259, test_f1: 0.4816
 epoch: 65, train_loss: 0.7181, test_loss: 1.2913, test_f1: 0.4887
 epoch: 66, train_loss: 0.7050, test_loss: 1.3242, test_f1: 0.5047
 epoch: 67, train_loss: 0.7079, test_loss: 1.3111, test_f1: 0.4821
 epoch: 68, train_loss: 0.7135, test_loss: 1.3207, test_f1: 0.4782
 epoch: 69, train_loss: 0.7048, test_loss: 1.2402, test_f1: 0.5092
 epoch: 70, train_loss: 0.7021, test_loss: 1.2379, test_f1: 0.4904
 epoch: 71, train_loss: 0.7015, test_loss: 1.2341, test_f1: 0.4993
 epoch: 72, train_loss: 0.7098, test_loss: 1.2960, test_f1: 0.4690
 epoch: 73, train_loss: 0.6993, test_loss: 1.3567, test_f1: 0.4963
 epoch: 74, train_loss: 0.7025, test_loss: 1.2687, test_f1: 0.5001
 epoch: 75, train_loss: 0.6997, test_loss: 1.2466, test_f1: 0.4937
 epoch: 76, train_loss: 0.6956, test_loss: 1.2889, test_f1: 0.4958
 epoch: 77, train_loss: 0.6869, test_loss: 1.3977, test_f1: 0.4923
 epoch: 78, train_loss: 0.6822, test_loss: 1.3586, test_f1: 0.4962
 epoch: 79, train_loss: 0.6920, test_loss: 1.3211, test_f1: 0.4915
 epoch: 80, train_loss: 0.6800, test_loss: 1.3139, test_f1: 0.4843
 epoch: 81, train_loss: 0.6932, test_loss: 1.3278, test_f1: 0.4947
 epoch: 82, train_loss: 0.6943, test_loss: 1.3399, test_f1: 0.4883
 epoch: 83, train_loss: 0.6804, test_loss: 1.2607, test_f1: 0.5129
 epoch: 84, train_loss: 0.6807, test_loss: 1.2645, test_f1: 0.4939
 epoch: 85, train_loss: 0.6856, test_loss: 1.3102, test_f1: 0.5009
 epoch: 86, train_loss: 0.6800, test_loss: 1.3235, test_f1: 0.5149
 epoch: 87, train_loss: 0.6791, test_loss: 1.3240, test_f1: 0.5033
 epoch: 88, train_loss: 0.6745, test_loss: 1.2621, test_f1: 0.4903
 epoch: 89, train_loss: 0.6594, test_loss: 1.3401, test_f1: 0.4913
 epoch: 90, train_loss: 0.6771, test_loss: 1.3663, test_f1: 0.5011
 epoch: 91, train_loss: 0.6608, test_loss: 1.3345, test_f1: 0.5084
 epoch: 92, train_loss: 0.6592, test_loss: 1.2826, test_f1: 0.4932
 epoch: 93, train_loss: 0.6643, test_loss: 1.2844, test_f1: 0.5011
 epoch: 94, train_loss: 0.6551, test_loss: 1.4309, test_f1: 0.4985
 epoch: 95, train_loss: 0.6694, test_loss: 1.4682, test_f1: 0.5215
 epoch: 96, train_loss: 0.6469, test_loss: 1.4320, test_f1: 0.4929
 epoch: 97, train_loss: 0.6604, test_loss: 1.3385, test_f1: 0.5045
 epoch: 98, train_loss: 0.6561, test_loss: 1.3170, test_f1: 0.4943
 epoch: 99, train_loss: 0.6624, test_loss: 1.3541, test_f1: 0.5055
##################ITERATION #9 ****************************************
 epoch: 0, train_loss: 1.3384, test_loss: 1.1298, test_f1: 0.4549
 epoch: 1, train_loss: 1.2177, test_loss: 1.0939, test_f1: 0.4503
 epoch: 2, train_loss: 1.1798, test_loss: 1.0787, test_f1: 0.4736
 epoch: 3, train_loss: 1.1427, test_loss: 1.0516, test_f1: 0.4820
 epoch: 4, train_loss: 1.1297, test_loss: 1.0504, test_f1: 0.4766
 epoch: 5, train_loss: 1.0982, test_loss: 1.0430, test_f1: 0.4894
 epoch: 6, train_loss: 1.0925, test_loss: 1.0248, test_f1: 0.4833
 epoch: 7, train_loss: 1.0611, test_loss: 1.0132, test_f1: 0.4795
 epoch: 8, train_loss: 1.0566, test_loss: 0.9950, test_f1: 0.4563
 epoch: 9, train_loss: 1.0380, test_loss: 0.9976, test_f1: 0.4719
 epoch: 10, train_loss: 1.0263, test_loss: 0.9658, test_f1: 0.4865
 epoch: 11, train_loss: 1.0171, test_loss: 0.9705, test_f1: 0.4949
 epoch: 12, train_loss: 1.0065, test_loss: 0.9438, test_f1: 0.4991
 epoch: 13, train_loss: 0.9927, test_loss: 0.9659, test_f1: 0.4691
 epoch: 14, train_loss: 0.9869, test_loss: 0.9455, test_f1: 0.5055
 epoch: 15, train_loss: 0.9827, test_loss: 0.9470, test_f1: 0.5024
 epoch: 16, train_loss: 0.9707, test_loss: 0.9696, test_f1: 0.4666
 epoch: 17, train_loss: 0.9657, test_loss: 0.9621, test_f1: 0.4835
 epoch: 18, train_loss: 0.9513, test_loss: 0.9607, test_f1: 0.5146
 epoch: 19, train_loss: 0.9492, test_loss: 0.9536, test_f1: 0.4828
 epoch: 20, train_loss: 0.9428, test_loss: 0.9893, test_f1: 0.4865
 epoch: 21, train_loss: 0.9282, test_loss: 0.9392, test_f1: 0.4940
 epoch: 22, train_loss: 0.9242, test_loss: 0.9291, test_f1: 0.5169
 epoch: 23, train_loss: 0.9301, test_loss: 0.9144, test_f1: 0.5193
 epoch: 24, train_loss: 0.9193, test_loss: 0.9255, test_f1: 0.5286
 epoch: 25, train_loss: 0.9102, test_loss: 0.9614, test_f1: 0.5177
 epoch: 26, train_loss: 0.8876, test_loss: 0.9434, test_f1: 0.5296
 epoch: 27, train_loss: 0.8909, test_loss: 0.9871, test_f1: 0.4850
 epoch: 28, train_loss: 0.8811, test_loss: 0.9671, test_f1: 0.5151
 epoch: 29, train_loss: 0.8712, test_loss: 0.9942, test_f1: 0.4948
 epoch: 30, train_loss: 0.8663, test_loss: 0.9723, test_f1: 0.5154
 epoch: 31, train_loss: 0.8776, test_loss: 0.9782, test_f1: 0.4972
 epoch: 32, train_loss: 0.8690, test_loss: 0.9758, test_f1: 0.5150
 epoch: 33, train_loss: 0.8614, test_loss: 0.9835, test_f1: 0.4925
 epoch: 34, train_loss: 0.8584, test_loss: 0.9862, test_f1: 0.5054
 epoch: 35, train_loss: 0.8440, test_loss: 0.9496, test_f1: 0.5261
 epoch: 36, train_loss: 0.8459, test_loss: 0.9726, test_f1: 0.5188
 epoch: 37, train_loss: 0.8438, test_loss: 0.9825, test_f1: 0.5336
 epoch: 38, train_loss: 0.8296, test_loss: 1.0052, test_f1: 0.5176
 epoch: 39, train_loss: 0.8283, test_loss: 0.9790, test_f1: 0.5092
 epoch: 40, train_loss: 0.8248, test_loss: 1.0451, test_f1: 0.5075
 epoch: 41, train_loss: 0.8172, test_loss: 0.9660, test_f1: 0.5208
 epoch: 42, train_loss: 0.8188, test_loss: 0.9883, test_f1: 0.5168
 epoch: 43, train_loss: 0.8241, test_loss: 0.9692, test_f1: 0.5322
 epoch: 44, train_loss: 0.8135, test_loss: 1.0004, test_f1: 0.5198
 epoch: 45, train_loss: 0.7971, test_loss: 0.9427, test_f1: 0.5255
 epoch: 46, train_loss: 0.8032, test_loss: 0.9816, test_f1: 0.5330
 epoch: 47, train_loss: 0.7967, test_loss: 0.9879, test_f1: 0.5323
 epoch: 48, train_loss: 0.7958, test_loss: 1.0138, test_f1: 0.5355
 epoch: 49, train_loss: 0.7999, test_loss: 0.9865, test_f1: 0.5384
 epoch: 50, train_loss: 0.7818, test_loss: 1.0844, test_f1: 0.5221
 epoch: 51, train_loss: 0.7741, test_loss: 1.0391, test_f1: 0.5494
 epoch: 52, train_loss: 0.7618, test_loss: 1.0430, test_f1: 0.5358
 epoch: 53, train_loss: 0.7668, test_loss: 1.0329, test_f1: 0.5430
 epoch: 54, train_loss: 0.7573, test_loss: 1.0171, test_f1: 0.5452
 epoch: 55, train_loss: 0.7565, test_loss: 1.0317, test_f1: 0.5377
 epoch: 56, train_loss: 0.7360, test_loss: 1.0206, test_f1: 0.5351
 epoch: 57, train_loss: 0.7587, test_loss: 1.0562, test_f1: 0.5472
 epoch: 58, train_loss: 0.7463, test_loss: 1.0425, test_f1: 0.5286
 epoch: 59, train_loss: 0.7545, test_loss: 1.0631, test_f1: 0.5521
 epoch: 60, train_loss: 0.7350, test_loss: 1.0572, test_f1: 0.5380
 epoch: 61, train_loss: 0.7438, test_loss: 1.0333, test_f1: 0.5505
 epoch: 62, train_loss: 0.7350, test_loss: 1.0753, test_f1: 0.5142
 epoch: 63, train_loss: 0.7222, test_loss: 1.1000, test_f1: 0.5227
 epoch: 64, train_loss: 0.7270, test_loss: 1.0897, test_f1: 0.5264
 epoch: 65, train_loss: 0.7380, test_loss: 1.1025, test_f1: 0.5142
 epoch: 66, train_loss: 0.7170, test_loss: 1.0812, test_f1: 0.5401
 epoch: 67, train_loss: 0.7266, test_loss: 1.0703, test_f1: 0.5307
 epoch: 68, train_loss: 0.7195, test_loss: 1.0558, test_f1: 0.5538
 epoch: 69, train_loss: 0.7189, test_loss: 1.0805, test_f1: 0.5186
 epoch: 70, train_loss: 0.7241, test_loss: 1.0943, test_f1: 0.5416
 epoch: 71, train_loss: 0.7161, test_loss: 1.0811, test_f1: 0.5350
 epoch: 72, train_loss: 0.7005, test_loss: 1.1040, test_f1: 0.5329
 epoch: 73, train_loss: 0.7131, test_loss: 1.0773, test_f1: 0.5675
 epoch: 74, train_loss: 0.7086, test_loss: 1.0242, test_f1: 0.5404
 epoch: 75, train_loss: 0.7107, test_loss: 1.1052, test_f1: 0.5410
 epoch: 76, train_loss: 0.7053, test_loss: 1.0895, test_f1: 0.5502
 epoch: 77, train_loss: 0.7024, test_loss: 1.0836, test_f1: 0.5423
 epoch: 78, train_loss: 0.6976, test_loss: 1.0999, test_f1: 0.5235
 epoch: 79, train_loss: 0.6943, test_loss: 1.0983, test_f1: 0.5306
 epoch: 80, train_loss: 0.6975, test_loss: 1.0768, test_f1: 0.5342
 epoch: 81, train_loss: 0.6799, test_loss: 1.1347, test_f1: 0.5341
 epoch: 82, train_loss: 0.7024, test_loss: 1.0977, test_f1: 0.5407
 epoch: 83, train_loss: 0.6835, test_loss: 1.1305, test_f1: 0.5378
 epoch: 84, train_loss: 0.6815, test_loss: 1.1659, test_f1: 0.5428
 epoch: 85, train_loss: 0.6853, test_loss: 1.0851, test_f1: 0.5177
 epoch: 86, train_loss: 0.6686, test_loss: 1.1160, test_f1: 0.5432
 epoch: 87, train_loss: 0.6802, test_loss: 1.1403, test_f1: 0.5397
 epoch: 88, train_loss: 0.6789, test_loss: 1.1157, test_f1: 0.5549
 epoch: 89, train_loss: 0.6685, test_loss: 1.1273, test_f1: 0.5612
 epoch: 90, train_loss: 0.6672, test_loss: 1.1094, test_f1: 0.5747
 epoch: 91, train_loss: 0.6780, test_loss: 1.1594, test_f1: 0.5263
 epoch: 92, train_loss: 0.6707, test_loss: 1.1208, test_f1: 0.5404
 epoch: 93, train_loss: 0.6599, test_loss: 1.1556, test_f1: 0.5175
 epoch: 94, train_loss: 0.6575, test_loss: 1.1358, test_f1: 0.5385
 epoch: 95, train_loss: 0.6639, test_loss: 1.1795, test_f1: 0.5184
 epoch: 96, train_loss: 0.6641, test_loss: 1.1604, test_f1: 0.5301
 epoch: 97, train_loss: 0.6649, test_loss: 1.2198, test_f1: 0.5251
 epoch: 98, train_loss: 0.6635, test_loss: 1.1225, test_f1: 0.5440
 epoch: 99, train_loss: 0.6592, test_loss: 1.1957, test_f1: 0.5573

Training completed in 792.49 seconds
Best F1: 0.5768 at epoch 78
Mean F1 across iterations: 0.5557  0.0164
========================FINAL RESULTS================================
FEGIN weighted F1: 0.5768  0.0164
python main.py --data ltspice_examples --representation component_component --model FEGIN --layers 2 --hiddens 128 --batch_size 32 --lr 0.0001 --emb_size 250 --epochs 100 --save_appendix component_component_L2_H128_BS32_LR0.0001_E250 --no_val
-----



STDERR:
  File "main.py", line 370, in <module>
    main()
  File "main.py", line 254, in main
    dataset = dataset_class(
  File "/home/philip/projects/ltspice_examples_code_repo/Circuit-Completion-Using-GNNs/component_classification_with_link_prediction_head/evaluation/FEGIN/kernel/circuit_datasets.py", line 15, in __init__
    self.data, self.slices = torch.load(self.processed_paths[0])
  File "/home/philip/.local/lib/python3.8/site-packages/torch/serialization.py", line 1040, in load
    warnings.warn(
  File "/usr/lib/python3.8/warnings.py", line 109, in _showwarnmsg
    sw(msg.message, msg.category, msg.filename, msg.lineno,
  File "main.py", line 47, in warn_with_traceback
    traceback.print_stack(file=log)
/home/philip/projects/ltspice_examples_code_repo/Circuit-Completion-Using-GNNs/component_classification_with_link_prediction_head/evaluation/FEGIN/kernel/circuit_datasets.py:15: FutureWarning: You are using `torch.load` with `weights_only=False` (the current default value), which uses the default pickle module implicitly. It is possible to construct malicious pickle data which will execute arbitrary code during unpickling (See https://github.com/pytorch/pytorch/blob/main/SECURITY.md#untrusted-models for more details). In a future release, the default value for `weights_only` will be flipped to `True`. This limits the functions that could be executed during unpickling. Arbitrary objects will no longer be allowed to be loaded via this mode unless they are explicitly allowlisted by the user via `torch.serialization.add_safe_globals`. We recommend you start setting `weights_only=True` for any use case where you don't have full control of the loaded file. Please open an issue on GitHub for any issues related to this experimental feature.
  self.data, self.slices = torch.load(self.processed_paths[0])
