STDOUT:
Results will be saved in /home/philip/projects/ltspice_examples_code_repo/Circuit-Completion-Using-GNNs/component_classification_with_link_prediction_head/evaluation/FEGIN/results/model_FEGIN_dataset_ltspice_examples
Command line input: python main.py --data ltspice_examples --representation component_pin --model FEGIN --layers 3 --hiddens 128 --batch_size 32 --lr 0.001 --emb_size 128 --epochs 100 --save_appendix component_pin_L3_H128_BS32_LR0.001_E128 --no_val
 is saved.
-----
ltspice_examples - FEGIN
Using 3 layers, 128 hidden units, h = 2
Loading component_pin representation dataset
ENTERED
Training FEGIN on component_pin representation
Train: 3560, Test: 848
##################ITERATION #0 ****************************************
 epoch: 0, train_loss: 1.1220, test_loss: 1.0947, test_f1: 0.4017
 epoch: 1, train_loss: 0.9715, test_loss: 0.9001, test_f1: 0.5276
 epoch: 2, train_loss: 0.8990, test_loss: 0.8290, test_f1: 0.5782
 epoch: 3, train_loss: 0.8703, test_loss: 0.8405, test_f1: 0.5259
 epoch: 4, train_loss: 0.8522, test_loss: 0.9182, test_f1: 0.5161
 epoch: 5, train_loss: 0.8182, test_loss: 0.8323, test_f1: 0.6331
 epoch: 6, train_loss: 0.7913, test_loss: 0.8143, test_f1: 0.5850
 epoch: 7, train_loss: 0.7893, test_loss: 0.8281, test_f1: 0.5723
 epoch: 8, train_loss: 0.7671, test_loss: 0.8031, test_f1: 0.5782
 epoch: 9, train_loss: 0.7586, test_loss: 0.7479, test_f1: 0.6446
 epoch: 10, train_loss: 0.7307, test_loss: 0.9074, test_f1: 0.5842
 epoch: 11, train_loss: 0.7317, test_loss: 0.7416, test_f1: 0.6479
 epoch: 12, train_loss: 0.7248, test_loss: 0.8229, test_f1: 0.5453
 epoch: 13, train_loss: 0.7166, test_loss: 0.8419, test_f1: 0.6312
 epoch: 14, train_loss: 0.7010, test_loss: 0.8017, test_f1: 0.5841
 epoch: 15, train_loss: 0.6841, test_loss: 0.7924, test_f1: 0.6299
 epoch: 16, train_loss: 0.6639, test_loss: 0.7689, test_f1: 0.6441
 epoch: 17, train_loss: 0.6515, test_loss: 0.7968, test_f1: 0.5978
 epoch: 18, train_loss: 0.6507, test_loss: 1.0588, test_f1: 0.5850
 epoch: 19, train_loss: 0.6400, test_loss: 0.7712, test_f1: 0.6268
 epoch: 20, train_loss: 0.6290, test_loss: 0.8194, test_f1: 0.6565
 epoch: 21, train_loss: 0.6196, test_loss: 0.8207, test_f1: 0.5850
 epoch: 22, train_loss: 0.6171, test_loss: 0.8284, test_f1: 0.6376
 epoch: 23, train_loss: 0.6136, test_loss: 0.8266, test_f1: 0.6158
 epoch: 24, train_loss: 0.5873, test_loss: 0.8837, test_f1: 0.6298
 epoch: 25, train_loss: 0.5922, test_loss: 0.8436, test_f1: 0.6708
 epoch: 26, train_loss: 0.5745, test_loss: 0.9221, test_f1: 0.6219
 epoch: 27, train_loss: 0.5719, test_loss: 0.8877, test_f1: 0.6202
 epoch: 28, train_loss: 0.5536, test_loss: 0.8900, test_f1: 0.6406
 epoch: 29, train_loss: 0.5235, test_loss: 0.8419, test_f1: 0.6497
 epoch: 30, train_loss: 0.5211, test_loss: 0.9485, test_f1: 0.6640
 epoch: 31, train_loss: 0.5099, test_loss: 1.0063, test_f1: 0.6511
 epoch: 32, train_loss: 0.5153, test_loss: 0.9709, test_f1: 0.6341
 epoch: 33, train_loss: 0.4853, test_loss: 0.9016, test_f1: 0.6518
 epoch: 34, train_loss: 0.5039, test_loss: 0.8841, test_f1: 0.6547
 epoch: 35, train_loss: 0.4964, test_loss: 0.8954, test_f1: 0.6654
 epoch: 36, train_loss: 0.4634, test_loss: 1.0123, test_f1: 0.6793
 epoch: 37, train_loss: 0.4704, test_loss: 1.0931, test_f1: 0.6343
 epoch: 38, train_loss: 0.4420, test_loss: 1.0684, test_f1: 0.6624
 epoch: 39, train_loss: 0.4610, test_loss: 1.1216, test_f1: 0.6678
 epoch: 40, train_loss: 0.4530, test_loss: 1.0309, test_f1: 0.6586
 epoch: 41, train_loss: 0.4388, test_loss: 1.0485, test_f1: 0.6524
 epoch: 42, train_loss: 0.4267, test_loss: 1.0442, test_f1: 0.6472
 epoch: 43, train_loss: 0.3997, test_loss: 0.9964, test_f1: 0.6770
 epoch: 44, train_loss: 0.4176, test_loss: 1.1945, test_f1: 0.6393
 epoch: 45, train_loss: 0.4100, test_loss: 1.1266, test_f1: 0.6591
 epoch: 46, train_loss: 0.4025, test_loss: 1.1786, test_f1: 0.6691
 epoch: 47, train_loss: 0.4082, test_loss: 1.1737, test_f1: 0.6708
 epoch: 48, train_loss: 0.3871, test_loss: 1.2630, test_f1: 0.6652
 epoch: 49, train_loss: 0.3970, test_loss: 1.3571, test_f1: 0.6717
 epoch: 50, train_loss: 0.3538, test_loss: 1.0519, test_f1: 0.6601
 epoch: 51, train_loss: 0.3382, test_loss: 1.1593, test_f1: 0.6629
 epoch: 52, train_loss: 0.2929, test_loss: 1.1759, test_f1: 0.6571
 epoch: 53, train_loss: 0.2903, test_loss: 1.2509, test_f1: 0.6687
 epoch: 54, train_loss: 0.2852, test_loss: 1.2513, test_f1: 0.6753
 epoch: 55, train_loss: 0.2866, test_loss: 1.3027, test_f1: 0.6701
 epoch: 56, train_loss: 0.2899, test_loss: 1.3460, test_f1: 0.6827
 epoch: 57, train_loss: 0.2704, test_loss: 1.3260, test_f1: 0.7010
 epoch: 58, train_loss: 0.2679, test_loss: 1.3618, test_f1: 0.6799
 epoch: 59, train_loss: 0.2773, test_loss: 1.3985, test_f1: 0.6749
 epoch: 60, train_loss: 0.2593, test_loss: 1.5703, test_f1: 0.6720
 epoch: 61, train_loss: 0.2799, test_loss: 1.4435, test_f1: 0.6519
 epoch: 62, train_loss: 0.2673, test_loss: 1.4352, test_f1: 0.6699
 epoch: 63, train_loss: 0.2528, test_loss: 1.5081, test_f1: 0.6668
 epoch: 64, train_loss: 0.2528, test_loss: 1.5295, test_f1: 0.6801
 epoch: 65, train_loss: 0.2292, test_loss: 1.5253, test_f1: 0.6568
 epoch: 66, train_loss: 0.2404, test_loss: 1.3074, test_f1: 0.6862
 epoch: 67, train_loss: 0.2377, test_loss: 1.5431, test_f1: 0.6758
 epoch: 68, train_loss: 0.2326, test_loss: 1.5076, test_f1: 0.6477
 epoch: 69, train_loss: 0.2471, test_loss: 1.5011, test_f1: 0.6643
 epoch: 70, train_loss: 0.2444, test_loss: 1.5026, test_f1: 0.6569
 epoch: 71, train_loss: 0.2229, test_loss: 1.4687, test_f1: 0.6584
 epoch: 72, train_loss: 0.2313, test_loss: 1.5581, test_f1: 0.6638
 epoch: 73, train_loss: 0.2254, test_loss: 1.5793, test_f1: 0.6785
 epoch: 74, train_loss: 0.2070, test_loss: 1.4488, test_f1: 0.6735
 epoch: 75, train_loss: 0.2033, test_loss: 1.6860, test_f1: 0.6635
 epoch: 76, train_loss: 0.2177, test_loss: 1.3852, test_f1: 0.6917
 epoch: 77, train_loss: 0.2144, test_loss: 1.6469, test_f1: 0.6547
 epoch: 78, train_loss: 0.2420, test_loss: 1.3995, test_f1: 0.6624
 epoch: 79, train_loss: 0.2187, test_loss: 1.6148, test_f1: 0.6656
 epoch: 80, train_loss: 0.2205, test_loss: 1.4974, test_f1: 0.6720
 epoch: 81, train_loss: 0.1973, test_loss: 1.5838, test_f1: 0.6936
 epoch: 82, train_loss: 0.1968, test_loss: 1.4816, test_f1: 0.6736
 epoch: 83, train_loss: 0.1863, test_loss: 1.5846, test_f1: 0.6773
 epoch: 84, train_loss: 0.2099, test_loss: 1.6383, test_f1: 0.6781
 epoch: 85, train_loss: 0.1931, test_loss: 1.7166, test_f1: 0.6634
 epoch: 86, train_loss: 0.1714, test_loss: 1.6321, test_f1: 0.6711
 epoch: 87, train_loss: 0.1915, test_loss: 1.5365, test_f1: 0.6889
 epoch: 88, train_loss: 0.1810, test_loss: 1.5686, test_f1: 0.6652
 epoch: 89, train_loss: 0.1951, test_loss: 1.7274, test_f1: 0.6582
 epoch: 90, train_loss: 0.1882, test_loss: 1.6338, test_f1: 0.6686
 epoch: 91, train_loss: 0.1787, test_loss: 1.6951, test_f1: 0.6711
 epoch: 92, train_loss: 0.1882, test_loss: 1.6624, test_f1: 0.6579
 epoch: 93, train_loss: 0.1722, test_loss: 1.7488, test_f1: 0.6818
 epoch: 94, train_loss: 0.1751, test_loss: 1.7372, test_f1: 0.6746
 epoch: 95, train_loss: 0.1685, test_loss: 1.5335, test_f1: 0.6866
 epoch: 96, train_loss: 0.1604, test_loss: 1.6622, test_f1: 0.6741
 epoch: 97, train_loss: 0.1680, test_loss: 1.5826, test_f1: 0.6968
 epoch: 98, train_loss: 0.1621, test_loss: 1.6711, test_f1: 0.6658
 epoch: 99, train_loss: 0.1706, test_loss: 1.9664, test_f1: 0.6904
##################ITERATION #1 ****************************************
 epoch: 0, train_loss: 1.0978, test_loss: 1.1664, test_f1: 0.4584
 epoch: 1, train_loss: 0.9387, test_loss: 0.8740, test_f1: 0.5293
 epoch: 2, train_loss: 0.9040, test_loss: 1.0463, test_f1: 0.5261
 epoch: 3, train_loss: 0.8598, test_loss: 0.9182, test_f1: 0.5502
 epoch: 4, train_loss: 0.8493, test_loss: 0.8189, test_f1: 0.5598
 epoch: 5, train_loss: 0.8220, test_loss: 0.8450, test_f1: 0.6356
 epoch: 6, train_loss: 0.8077, test_loss: 0.8213, test_f1: 0.6037
 epoch: 7, train_loss: 0.7660, test_loss: 0.8420, test_f1: 0.5763
 epoch: 8, train_loss: 0.7611, test_loss: 0.8287, test_f1: 0.5809
 epoch: 9, train_loss: 0.7489, test_loss: 0.7981, test_f1: 0.6091
 epoch: 10, train_loss: 0.7185, test_loss: 0.7835, test_f1: 0.6424
 epoch: 11, train_loss: 0.7020, test_loss: 0.8616, test_f1: 0.6035
 epoch: 12, train_loss: 0.7021, test_loss: 0.8336, test_f1: 0.6555
 epoch: 13, train_loss: 0.6760, test_loss: 0.7487, test_f1: 0.6759
 epoch: 14, train_loss: 0.6633, test_loss: 0.7363, test_f1: 0.6163
 epoch: 15, train_loss: 0.6621, test_loss: 0.7937, test_f1: 0.6373
 epoch: 16, train_loss: 0.6393, test_loss: 0.7885, test_f1: 0.6391
 epoch: 17, train_loss: 0.6037, test_loss: 0.7906, test_f1: 0.6460
 epoch: 18, train_loss: 0.6168, test_loss: 0.9156, test_f1: 0.6086
 epoch: 19, train_loss: 0.5888, test_loss: 0.7672, test_f1: 0.6557
 epoch: 20, train_loss: 0.6065, test_loss: 0.8312, test_f1: 0.6454
 epoch: 21, train_loss: 0.5678, test_loss: 0.8271, test_f1: 0.6622
 epoch: 22, train_loss: 0.5607, test_loss: 0.8800, test_f1: 0.6284
 epoch: 23, train_loss: 0.5584, test_loss: 0.8806, test_f1: 0.6487
 epoch: 24, train_loss: 0.5227, test_loss: 0.8881, test_f1: 0.6179
 epoch: 25, train_loss: 0.5376, test_loss: 0.8646, test_f1: 0.6333
 epoch: 26, train_loss: 0.5340, test_loss: 0.8687, test_f1: 0.6515
 epoch: 27, train_loss: 0.5160, test_loss: 0.8644, test_f1: 0.6458
 epoch: 28, train_loss: 0.5037, test_loss: 0.8366, test_f1: 0.6427
 epoch: 29, train_loss: 0.4745, test_loss: 0.9069, test_f1: 0.6378
 epoch: 30, train_loss: 0.5062, test_loss: 0.8566, test_f1: 0.6468
 epoch: 31, train_loss: 0.5005, test_loss: 1.0332, test_f1: 0.6101
 epoch: 32, train_loss: 0.4647, test_loss: 0.9188, test_f1: 0.6737
 epoch: 33, train_loss: 0.4436, test_loss: 0.9052, test_f1: 0.6587
 epoch: 34, train_loss: 0.4733, test_loss: 0.9789, test_f1: 0.6308
 epoch: 35, train_loss: 0.4645, test_loss: 0.9891, test_f1: 0.6815
 epoch: 36, train_loss: 0.4359, test_loss: 1.0555, test_f1: 0.6831
 epoch: 37, train_loss: 0.4367, test_loss: 1.1094, test_f1: 0.6628
 epoch: 38, train_loss: 0.4193, test_loss: 0.9183, test_f1: 0.6871
 epoch: 39, train_loss: 0.4044, test_loss: 1.0112, test_f1: 0.6527
 epoch: 40, train_loss: 0.3935, test_loss: 0.9509, test_f1: 0.6571
 epoch: 41, train_loss: 0.4059, test_loss: 0.9540, test_f1: 0.6425
 epoch: 42, train_loss: 0.3775, test_loss: 0.9449, test_f1: 0.6874
 epoch: 43, train_loss: 0.3650, test_loss: 0.9958, test_f1: 0.6789
 epoch: 44, train_loss: 0.3792, test_loss: 1.0615, test_f1: 0.6743
 epoch: 45, train_loss: 0.3994, test_loss: 1.0217, test_f1: 0.6854
 epoch: 46, train_loss: 0.3895, test_loss: 1.0025, test_f1: 0.6763
 epoch: 47, train_loss: 0.3827, test_loss: 1.0902, test_f1: 0.6559
 epoch: 48, train_loss: 0.3562, test_loss: 0.9433, test_f1: 0.6676
 epoch: 49, train_loss: 0.3484, test_loss: 1.0501, test_f1: 0.6755
 epoch: 50, train_loss: 0.3294, test_loss: 1.0426, test_f1: 0.6632
 epoch: 51, train_loss: 0.2986, test_loss: 1.0996, test_f1: 0.6705
 epoch: 52, train_loss: 0.2776, test_loss: 1.1488, test_f1: 0.6713
 epoch: 53, train_loss: 0.2735, test_loss: 1.3071, test_f1: 0.6441
 epoch: 54, train_loss: 0.2565, test_loss: 1.2027, test_f1: 0.6530
 epoch: 55, train_loss: 0.2330, test_loss: 1.1869, test_f1: 0.6679
 epoch: 56, train_loss: 0.2549, test_loss: 1.2275, test_f1: 0.6831
 epoch: 57, train_loss: 0.2333, test_loss: 1.2352, test_f1: 0.6664
 epoch: 58, train_loss: 0.2462, test_loss: 1.2546, test_f1: 0.6683
 epoch: 59, train_loss: 0.2548, test_loss: 1.2498, test_f1: 0.6661
 epoch: 60, train_loss: 0.2469, test_loss: 1.2877, test_f1: 0.6557
 epoch: 61, train_loss: 0.2318, test_loss: 1.2842, test_f1: 0.7092
 epoch: 62, train_loss: 0.2272, test_loss: 1.4417, test_f1: 0.6763
 epoch: 63, train_loss: 0.2271, test_loss: 1.3169, test_f1: 0.6738
 epoch: 64, train_loss: 0.2289, test_loss: 1.3254, test_f1: 0.6851
 epoch: 65, train_loss: 0.2161, test_loss: 1.3997, test_f1: 0.6781
 epoch: 66, train_loss: 0.2252, test_loss: 1.3148, test_f1: 0.6761
 epoch: 67, train_loss: 0.2206, test_loss: 1.3305, test_f1: 0.6914
 epoch: 68, train_loss: 0.2379, test_loss: 1.3614, test_f1: 0.6682
 epoch: 69, train_loss: 0.2170, test_loss: 1.3384, test_f1: 0.6501
 epoch: 70, train_loss: 0.2008, test_loss: 1.3853, test_f1: 0.6862
 epoch: 71, train_loss: 0.2076, test_loss: 1.4386, test_f1: 0.6716
 epoch: 72, train_loss: 0.2021, test_loss: 1.4457, test_f1: 0.6448
 epoch: 73, train_loss: 0.1997, test_loss: 1.6066, test_f1: 0.6549
 epoch: 74, train_loss: 0.2147, test_loss: 1.5880, test_f1: 0.6861
 epoch: 75, train_loss: 0.2158, test_loss: 1.4251, test_f1: 0.6639
 epoch: 76, train_loss: 0.1909, test_loss: 1.4687, test_f1: 0.6642
 epoch: 77, train_loss: 0.1803, test_loss: 1.5130, test_f1: 0.6899
 epoch: 78, train_loss: 0.2013, test_loss: 1.4424, test_f1: 0.6747
 epoch: 79, train_loss: 0.1735, test_loss: 1.4884, test_f1: 0.6543
 epoch: 80, train_loss: 0.1821, test_loss: 1.5707, test_f1: 0.6427
 epoch: 81, train_loss: 0.1625, test_loss: 1.5764, test_f1: 0.6573
 epoch: 82, train_loss: 0.1967, test_loss: 1.5131, test_f1: 0.6718
 epoch: 83, train_loss: 0.1684, test_loss: 1.6580, test_f1: 0.6633
 epoch: 84, train_loss: 0.1661, test_loss: 1.6537, test_f1: 0.6559
 epoch: 85, train_loss: 0.1683, test_loss: 1.6769, test_f1: 0.6335
 epoch: 86, train_loss: 0.1930, test_loss: 1.6085, test_f1: 0.6619
 epoch: 87, train_loss: 0.1612, test_loss: 1.6957, test_f1: 0.6597
 epoch: 88, train_loss: 0.1818, test_loss: 1.6680, test_f1: 0.6573
 epoch: 89, train_loss: 0.1694, test_loss: 1.6994, test_f1: 0.6690
 epoch: 90, train_loss: 0.1634, test_loss: 1.7381, test_f1: 0.6456
 epoch: 91, train_loss: 0.1494, test_loss: 1.6733, test_f1: 0.6470
 epoch: 92, train_loss: 0.1699, test_loss: 1.5506, test_f1: 0.6647
 epoch: 93, train_loss: 0.1528, test_loss: 1.6477, test_f1: 0.6464
 epoch: 94, train_loss: 0.1610, test_loss: 1.6728, test_f1: 0.6722
 epoch: 95, train_loss: 0.1714, test_loss: 1.5970, test_f1: 0.6492
 epoch: 96, train_loss: 0.1575, test_loss: 1.6246, test_f1: 0.6680
 epoch: 97, train_loss: 0.1638, test_loss: 1.8020, test_f1: 0.6492
 epoch: 98, train_loss: 0.1428, test_loss: 1.6989, test_f1: 0.6743
 epoch: 99, train_loss: 0.1522, test_loss: 1.7004, test_f1: 0.6666
##################ITERATION #2 ****************************************
 epoch: 0, train_loss: 1.1244, test_loss: 1.0194, test_f1: 0.4563
 epoch: 1, train_loss: 0.9677, test_loss: 0.9605, test_f1: 0.5326
 epoch: 2, train_loss: 0.9080, test_loss: 0.9106, test_f1: 0.5482
 epoch: 3, train_loss: 0.8839, test_loss: 0.9514, test_f1: 0.5392
 epoch: 4, train_loss: 0.8625, test_loss: 0.9811, test_f1: 0.5578
 epoch: 5, train_loss: 0.8406, test_loss: 0.9238, test_f1: 0.5767
 epoch: 6, train_loss: 0.8074, test_loss: 1.0044, test_f1: 0.5620
 epoch: 7, train_loss: 0.7950, test_loss: 0.8803, test_f1: 0.5353
 epoch: 8, train_loss: 0.7740, test_loss: 0.9432, test_f1: 0.5696
 epoch: 9, train_loss: 0.7670, test_loss: 0.8797, test_f1: 0.6250
 epoch: 10, train_loss: 0.7333, test_loss: 0.7919, test_f1: 0.5984
 epoch: 11, train_loss: 0.7286, test_loss: 0.8039, test_f1: 0.6732
 epoch: 12, train_loss: 0.7129, test_loss: 0.8964, test_f1: 0.6243
 epoch: 13, train_loss: 0.7107, test_loss: 0.9261, test_f1: 0.6107
 epoch: 14, train_loss: 0.6798, test_loss: 0.8563, test_f1: 0.6443
 epoch: 15, train_loss: 0.6747, test_loss: 0.7760, test_f1: 0.6671
 epoch: 16, train_loss: 0.6808, test_loss: 0.9854, test_f1: 0.5910
 epoch: 17, train_loss: 0.6421, test_loss: 0.8497, test_f1: 0.6385
 epoch: 18, train_loss: 0.6308, test_loss: 0.8341, test_f1: 0.6550
 epoch: 19, train_loss: 0.6175, test_loss: 0.8304, test_f1: 0.6544
 epoch: 20, train_loss: 0.6287, test_loss: 0.7295, test_f1: 0.6795
 epoch: 21, train_loss: 0.6052, test_loss: 0.8059, test_f1: 0.6579
 epoch: 22, train_loss: 0.5913, test_loss: 0.8112, test_f1: 0.6453
 epoch: 23, train_loss: 0.5922, test_loss: 0.8215, test_f1: 0.6456
 epoch: 24, train_loss: 0.6110, test_loss: 0.7547, test_f1: 0.6871
 epoch: 25, train_loss: 0.5911, test_loss: 0.8363, test_f1: 0.6314
 epoch: 26, train_loss: 0.5551, test_loss: 0.8493, test_f1: 0.6705
 epoch: 27, train_loss: 0.5577, test_loss: 0.8102, test_f1: 0.6616
 epoch: 28, train_loss: 0.5443, test_loss: 0.8786, test_f1: 0.6356
 epoch: 29, train_loss: 0.5351, test_loss: 0.8541, test_f1: 0.6611
 epoch: 30, train_loss: 0.5382, test_loss: 1.1097, test_f1: 0.5974
 epoch: 31, train_loss: 0.5181, test_loss: 0.8628, test_f1: 0.6673
 epoch: 32, train_loss: 0.4854, test_loss: 0.8373, test_f1: 0.6594
 epoch: 33, train_loss: 0.4979, test_loss: 0.8211, test_f1: 0.6737
 epoch: 34, train_loss: 0.4776, test_loss: 0.8583, test_f1: 0.6568
 epoch: 35, train_loss: 0.4859, test_loss: 0.9912, test_f1: 0.6714
 epoch: 36, train_loss: 0.4699, test_loss: 0.8957, test_f1: 0.6691
 epoch: 37, train_loss: 0.4595, test_loss: 0.9690, test_f1: 0.6657
 epoch: 38, train_loss: 0.4478, test_loss: 0.8837, test_f1: 0.6865
 epoch: 39, train_loss: 0.4317, test_loss: 1.0309, test_f1: 0.6488
 epoch: 40, train_loss: 0.4402, test_loss: 0.9709, test_f1: 0.6483
 epoch: 41, train_loss: 0.4153, test_loss: 0.8989, test_f1: 0.6477
 epoch: 42, train_loss: 0.4035, test_loss: 0.9925, test_f1: 0.6685
 epoch: 43, train_loss: 0.4210, test_loss: 0.9425, test_f1: 0.6565
 epoch: 44, train_loss: 0.3947, test_loss: 1.0070, test_f1: 0.6556
 epoch: 45, train_loss: 0.4056, test_loss: 0.9746, test_f1: 0.6603
 epoch: 46, train_loss: 0.4014, test_loss: 0.9664, test_f1: 0.6930
 epoch: 47, train_loss: 0.3962, test_loss: 0.9828, test_f1: 0.6803
 epoch: 48, train_loss: 0.3910, test_loss: 1.0220, test_f1: 0.6816
 epoch: 49, train_loss: 0.3640, test_loss: 1.0284, test_f1: 0.6536
 epoch: 50, train_loss: 0.3683, test_loss: 0.9944, test_f1: 0.6417
 epoch: 51, train_loss: 0.3251, test_loss: 0.9965, test_f1: 0.6669
 epoch: 52, train_loss: 0.2976, test_loss: 1.0520, test_f1: 0.6467
 epoch: 53, train_loss: 0.2987, test_loss: 1.0885, test_f1: 0.6733
 epoch: 54, train_loss: 0.2799, test_loss: 1.1470, test_f1: 0.6538
 epoch: 55, train_loss: 0.2893, test_loss: 0.9880, test_f1: 0.6641
 epoch: 56, train_loss: 0.2591, test_loss: 1.2394, test_f1: 0.6479
 epoch: 57, train_loss: 0.2801, test_loss: 1.2062, test_f1: 0.6439
 epoch: 58, train_loss: 0.2710, test_loss: 1.1995, test_f1: 0.6739
 epoch: 59, train_loss: 0.2592, test_loss: 1.2257, test_f1: 0.6648
 epoch: 60, train_loss: 0.2607, test_loss: 1.2375, test_f1: 0.6534
 epoch: 61, train_loss: 0.2454, test_loss: 1.2677, test_f1: 0.6735
 epoch: 62, train_loss: 0.2475, test_loss: 1.4550, test_f1: 0.6260
 epoch: 63, train_loss: 0.2602, test_loss: 1.2563, test_f1: 0.6603
 epoch: 64, train_loss: 0.2385, test_loss: 1.2629, test_f1: 0.6874
 epoch: 65, train_loss: 0.2467, test_loss: 1.2559, test_f1: 0.6712
 epoch: 66, train_loss: 0.2405, test_loss: 1.3495, test_f1: 0.6832
 epoch: 67, train_loss: 0.2025, test_loss: 1.3793, test_f1: 0.6407
 epoch: 68, train_loss: 0.2326, test_loss: 1.2864, test_f1: 0.6434
 epoch: 69, train_loss: 0.2142, test_loss: 1.4449, test_f1: 0.6544
 epoch: 70, train_loss: 0.2444, test_loss: 1.4877, test_f1: 0.6205
 epoch: 71, train_loss: 0.2141, test_loss: 1.3539, test_f1: 0.6632
 epoch: 72, train_loss: 0.2104, test_loss: 1.2905, test_f1: 0.6584
 epoch: 73, train_loss: 0.1997, test_loss: 1.4963, test_f1: 0.6733
 epoch: 74, train_loss: 0.2127, test_loss: 1.2741, test_f1: 0.6871
 epoch: 75, train_loss: 0.2086, test_loss: 1.4075, test_f1: 0.6689
 epoch: 76, train_loss: 0.2053, test_loss: 1.3799, test_f1: 0.6730
 epoch: 77, train_loss: 0.2015, test_loss: 1.4801, test_f1: 0.6291
 epoch: 78, train_loss: 0.2089, test_loss: 1.4352, test_f1: 0.6672
 epoch: 79, train_loss: 0.1932, test_loss: 1.4950, test_f1: 0.6550
 epoch: 80, train_loss: 0.2085, test_loss: 1.4925, test_f1: 0.6532
 epoch: 81, train_loss: 0.1956, test_loss: 1.5659, test_f1: 0.6621
 epoch: 82, train_loss: 0.1879, test_loss: 1.4296, test_f1: 0.6699
 epoch: 83, train_loss: 0.1898, test_loss: 1.5119, test_f1: 0.6757
 epoch: 84, train_loss: 0.1827, test_loss: 1.5085, test_f1: 0.6543
 epoch: 85, train_loss: 0.1989, test_loss: 1.4511, test_f1: 0.6710
 epoch: 86, train_loss: 0.1770, test_loss: 1.5980, test_f1: 0.6592
 epoch: 87, train_loss: 0.1814, test_loss: 1.5383, test_f1: 0.6654
 epoch: 88, train_loss: 0.1752, test_loss: 1.5084, test_f1: 0.6565
 epoch: 89, train_loss: 0.1747, test_loss: 1.6653, test_f1: 0.6493
 epoch: 90, train_loss: 0.1883, test_loss: 1.5197, test_f1: 0.6782
 epoch: 91, train_loss: 0.1604, test_loss: 1.6230, test_f1: 0.6588
 epoch: 92, train_loss: 0.1739, test_loss: 1.4217, test_f1: 0.6688
 epoch: 93, train_loss: 0.1847, test_loss: 1.4581, test_f1: 0.6743
 epoch: 94, train_loss: 0.1595, test_loss: 1.4357, test_f1: 0.6615
 epoch: 95, train_loss: 0.1705, test_loss: 1.4173, test_f1: 0.6702
 epoch: 96, train_loss: 0.1740, test_loss: 1.6405, test_f1: 0.6659
 epoch: 97, train_loss: 0.1753, test_loss: 1.4664, test_f1: 0.6791
 epoch: 98, train_loss: 0.1730, test_loss: 1.5855, test_f1: 0.6621
 epoch: 99, train_loss: 0.1587, test_loss: 1.5547, test_f1: 0.6859
##################ITERATION #3 ****************************************
 epoch: 0, train_loss: 1.1876, test_loss: 1.0903, test_f1: 0.4628
 epoch: 1, train_loss: 0.9542, test_loss: 0.9286, test_f1: 0.5253
 epoch: 2, train_loss: 0.9165, test_loss: 0.9153, test_f1: 0.5287
 epoch: 3, train_loss: 0.8631, test_loss: 0.8565, test_f1: 0.5324
 epoch: 4, train_loss: 0.8488, test_loss: 0.7928, test_f1: 0.5941
 epoch: 5, train_loss: 0.8331, test_loss: 0.9456, test_f1: 0.5225
 epoch: 6, train_loss: 0.7991, test_loss: 0.8737, test_f1: 0.5918
 epoch: 7, train_loss: 0.7948, test_loss: 0.9538, test_f1: 0.5654
 epoch: 8, train_loss: 0.7618, test_loss: 0.7948, test_f1: 0.5869
 epoch: 9, train_loss: 0.7638, test_loss: 0.7838, test_f1: 0.6096
 epoch: 10, train_loss: 0.7272, test_loss: 0.8427, test_f1: 0.5882
 epoch: 11, train_loss: 0.7441, test_loss: 0.8670, test_f1: 0.6023
 epoch: 12, train_loss: 0.7256, test_loss: 0.7575, test_f1: 0.6534
 epoch: 13, train_loss: 0.7036, test_loss: 0.8559, test_f1: 0.6187
 epoch: 14, train_loss: 0.7021, test_loss: 0.8720, test_f1: 0.5862
 epoch: 15, train_loss: 0.6944, test_loss: 0.8949, test_f1: 0.5985
 epoch: 16, train_loss: 0.6822, test_loss: 0.7979, test_f1: 0.5663
 epoch: 17, train_loss: 0.6783, test_loss: 0.8425, test_f1: 0.6124
 epoch: 18, train_loss: 0.6603, test_loss: 0.8527, test_f1: 0.6318
 epoch: 19, train_loss: 0.6327, test_loss: 0.9407, test_f1: 0.5758
 epoch: 20, train_loss: 0.6362, test_loss: 0.8810, test_f1: 0.6569
 epoch: 21, train_loss: 0.6263, test_loss: 0.8527, test_f1: 0.6028
 epoch: 22, train_loss: 0.6088, test_loss: 0.7793, test_f1: 0.6809
 epoch: 23, train_loss: 0.6061, test_loss: 0.8299, test_f1: 0.6222
 epoch: 24, train_loss: 0.5971, test_loss: 0.8578, test_f1: 0.6242
 epoch: 25, train_loss: 0.5783, test_loss: 0.8247, test_f1: 0.6460
 epoch: 26, train_loss: 0.5546, test_loss: 0.8154, test_f1: 0.6637
 epoch: 27, train_loss: 0.5593, test_loss: 0.9503, test_f1: 0.6125
 epoch: 28, train_loss: 0.5501, test_loss: 0.8296, test_f1: 0.6470
 epoch: 29, train_loss: 0.5441, test_loss: 0.9813, test_f1: 0.6463
 epoch: 30, train_loss: 0.5297, test_loss: 1.0084, test_f1: 0.6435
 epoch: 31, train_loss: 0.5288, test_loss: 0.8817, test_f1: 0.6360
 epoch: 32, train_loss: 0.5293, test_loss: 0.8789, test_f1: 0.6557
 epoch: 33, train_loss: 0.4919, test_loss: 0.8737, test_f1: 0.6215
 epoch: 34, train_loss: 0.5009, test_loss: 0.9362, test_f1: 0.6462
 epoch: 35, train_loss: 0.4839, test_loss: 0.9156, test_f1: 0.6621
 epoch: 36, train_loss: 0.4795, test_loss: 0.9126, test_f1: 0.6828
 epoch: 37, train_loss: 0.4754, test_loss: 0.8434, test_f1: 0.6733
 epoch: 38, train_loss: 0.4519, test_loss: 0.9403, test_f1: 0.6586
 epoch: 39, train_loss: 0.4489, test_loss: 0.8410, test_f1: 0.6830
 epoch: 40, train_loss: 0.4475, test_loss: 0.9252, test_f1: 0.6679
 epoch: 41, train_loss: 0.4327, test_loss: 0.9238, test_f1: 0.6763
 epoch: 42, train_loss: 0.4369, test_loss: 0.9777, test_f1: 0.6509
 epoch: 43, train_loss: 0.4210, test_loss: 0.9952, test_f1: 0.6381
 epoch: 44, train_loss: 0.4262, test_loss: 0.9737, test_f1: 0.6660
 epoch: 45, train_loss: 0.3962, test_loss: 0.9952, test_f1: 0.6926
 epoch: 46, train_loss: 0.4139, test_loss: 0.9348, test_f1: 0.6923
 epoch: 47, train_loss: 0.3957, test_loss: 1.0058, test_f1: 0.6594
 epoch: 48, train_loss: 0.3976, test_loss: 1.1709, test_f1: 0.6477
 epoch: 49, train_loss: 0.4030, test_loss: 1.2168, test_f1: 0.6511
 epoch: 50, train_loss: 0.3750, test_loss: 1.0273, test_f1: 0.6457
 epoch: 51, train_loss: 0.3396, test_loss: 1.0951, test_f1: 0.6534
 epoch: 52, train_loss: 0.3127, test_loss: 1.0263, test_f1: 0.6811
 epoch: 53, train_loss: 0.3000, test_loss: 1.0503, test_f1: 0.6847
 epoch: 54, train_loss: 0.2964, test_loss: 1.1020, test_f1: 0.6888
 epoch: 55, train_loss: 0.2903, test_loss: 1.1329, test_f1: 0.6822
 epoch: 56, train_loss: 0.2722, test_loss: 1.1272, test_f1: 0.6514
 epoch: 57, train_loss: 0.2924, test_loss: 1.2441, test_f1: 0.6275
 epoch: 58, train_loss: 0.2837, test_loss: 1.2230, test_f1: 0.6758
 epoch: 59, train_loss: 0.2949, test_loss: 1.1827, test_f1: 0.6574
 epoch: 60, train_loss: 0.2822, test_loss: 1.1251, test_f1: 0.6567
 epoch: 61, train_loss: 0.2697, test_loss: 1.2034, test_f1: 0.6419
 epoch: 62, train_loss: 0.2671, test_loss: 1.1905, test_f1: 0.6485
 epoch: 63, train_loss: 0.2649, test_loss: 1.1571, test_f1: 0.6698
 epoch: 64, train_loss: 0.2594, test_loss: 1.2115, test_f1: 0.6691
 epoch: 65, train_loss: 0.2485, test_loss: 1.2153, test_f1: 0.6743
 epoch: 66, train_loss: 0.2482, test_loss: 1.2034, test_f1: 0.6854
 epoch: 67, train_loss: 0.2562, test_loss: 1.2023, test_f1: 0.6679
 epoch: 68, train_loss: 0.2358, test_loss: 1.2498, test_f1: 0.6824
 epoch: 69, train_loss: 0.2486, test_loss: 1.2196, test_f1: 0.6683
 epoch: 70, train_loss: 0.2383, test_loss: 1.1972, test_f1: 0.6499
 epoch: 71, train_loss: 0.2324, test_loss: 1.2714, test_f1: 0.6424
 epoch: 72, train_loss: 0.2253, test_loss: 1.3152, test_f1: 0.6467
 epoch: 73, train_loss: 0.2237, test_loss: 1.3308, test_f1: 0.6606
 epoch: 74, train_loss: 0.2350, test_loss: 1.2737, test_f1: 0.6594
 epoch: 75, train_loss: 0.2400, test_loss: 1.2978, test_f1: 0.6826
 epoch: 76, train_loss: 0.2249, test_loss: 1.3359, test_f1: 0.6596
 epoch: 77, train_loss: 0.2242, test_loss: 1.3484, test_f1: 0.6527
 epoch: 78, train_loss: 0.2098, test_loss: 1.3329, test_f1: 0.6609
 epoch: 79, train_loss: 0.2218, test_loss: 1.3786, test_f1: 0.6668
 epoch: 80, train_loss: 0.2289, test_loss: 1.1786, test_f1: 0.6845
 epoch: 81, train_loss: 0.2123, test_loss: 1.2432, test_f1: 0.6823
 epoch: 82, train_loss: 0.2202, test_loss: 1.2297, test_f1: 0.6879
 epoch: 83, train_loss: 0.1842, test_loss: 1.3100, test_f1: 0.6737
 epoch: 84, train_loss: 0.2208, test_loss: 1.3311, test_f1: 0.6576
 epoch: 85, train_loss: 0.1899, test_loss: 1.3473, test_f1: 0.6599
 epoch: 86, train_loss: 0.2140, test_loss: 1.3104, test_f1: 0.6767
 epoch: 87, train_loss: 0.2092, test_loss: 1.3423, test_f1: 0.6696
 epoch: 88, train_loss: 0.1902, test_loss: 1.3844, test_f1: 0.6837
 epoch: 89, train_loss: 0.1832, test_loss: 1.4249, test_f1: 0.6645
 epoch: 90, train_loss: 0.1942, test_loss: 1.3465, test_f1: 0.6853
 epoch: 91, train_loss: 0.1812, test_loss: 1.5135, test_f1: 0.6532
 epoch: 92, train_loss: 0.1866, test_loss: 1.5984, test_f1: 0.6463
 epoch: 93, train_loss: 0.1711, test_loss: 1.5243, test_f1: 0.6901
 epoch: 94, train_loss: 0.1766, test_loss: 1.4855, test_f1: 0.6531
 epoch: 95, train_loss: 0.1767, test_loss: 1.5883, test_f1: 0.6413
 epoch: 96, train_loss: 0.1937, test_loss: 1.5616, test_f1: 0.6653
 epoch: 97, train_loss: 0.1978, test_loss: 1.5830, test_f1: 0.6487
 epoch: 98, train_loss: 0.1613, test_loss: 1.4797, test_f1: 0.6822
 epoch: 99, train_loss: 0.1653, test_loss: 1.5486, test_f1: 0.6573
##################ITERATION #4 ****************************************
 epoch: 0, train_loss: 1.2352, test_loss: 1.0603, test_f1: 0.5089
 epoch: 1, train_loss: 0.9695, test_loss: 0.9220, test_f1: 0.5595
 epoch: 2, train_loss: 0.9249, test_loss: 0.9779, test_f1: 0.5678
 epoch: 3, train_loss: 0.8922, test_loss: 0.9292, test_f1: 0.5612
 epoch: 4, train_loss: 0.8616, test_loss: 0.8829, test_f1: 0.5276
 epoch: 5, train_loss: 0.8424, test_loss: 0.8414, test_f1: 0.5624
 epoch: 6, train_loss: 0.8262, test_loss: 0.8177, test_f1: 0.5293
 epoch: 7, train_loss: 0.8207, test_loss: 0.8455, test_f1: 0.5531
 epoch: 8, train_loss: 0.7929, test_loss: 0.7434, test_f1: 0.6321
 epoch: 9, train_loss: 0.7672, test_loss: 0.7609, test_f1: 0.5836
 epoch: 10, train_loss: 0.7710, test_loss: 0.7972, test_f1: 0.5904
 epoch: 11, train_loss: 0.7543, test_loss: 0.8168, test_f1: 0.6121
 epoch: 12, train_loss: 0.7395, test_loss: 0.8341, test_f1: 0.5907
 epoch: 13, train_loss: 0.7169, test_loss: 0.7911, test_f1: 0.6316
 epoch: 14, train_loss: 0.7002, test_loss: 0.8582, test_f1: 0.6342
 epoch: 15, train_loss: 0.7050, test_loss: 0.9008, test_f1: 0.5996
 epoch: 16, train_loss: 0.6918, test_loss: 0.7215, test_f1: 0.6487
 epoch: 17, train_loss: 0.6939, test_loss: 0.8348, test_f1: 0.6256
 epoch: 18, train_loss: 0.6740, test_loss: 0.8442, test_f1: 0.6373
 epoch: 19, train_loss: 0.6813, test_loss: 0.9070, test_f1: 0.6210
 epoch: 20, train_loss: 0.6514, test_loss: 0.7323, test_f1: 0.6586
 epoch: 21, train_loss: 0.6368, test_loss: 0.8156, test_f1: 0.6220
 epoch: 22, train_loss: 0.6353, test_loss: 0.9466, test_f1: 0.6250
 epoch: 23, train_loss: 0.6161, test_loss: 0.8427, test_f1: 0.6403
 epoch: 24, train_loss: 0.6160, test_loss: 0.8585, test_f1: 0.6315
 epoch: 25, train_loss: 0.6078, test_loss: 0.7589, test_f1: 0.6697
 epoch: 26, train_loss: 0.5894, test_loss: 0.8383, test_f1: 0.6558
 epoch: 27, train_loss: 0.6072, test_loss: 0.7860, test_f1: 0.6582
 epoch: 28, train_loss: 0.5621, test_loss: 0.9105, test_f1: 0.6341
 epoch: 29, train_loss: 0.5667, test_loss: 0.8917, test_f1: 0.6197
 epoch: 30, train_loss: 0.5566, test_loss: 0.8507, test_f1: 0.6363
 epoch: 31, train_loss: 0.5244, test_loss: 0.8959, test_f1: 0.6711
 epoch: 32, train_loss: 0.5394, test_loss: 0.8165, test_f1: 0.6879
 epoch: 33, train_loss: 0.5364, test_loss: 1.0078, test_f1: 0.6348
 epoch: 34, train_loss: 0.5213, test_loss: 0.9342, test_f1: 0.6632
 epoch: 35, train_loss: 0.5151, test_loss: 0.9801, test_f1: 0.6595
 epoch: 36, train_loss: 0.5039, test_loss: 0.9956, test_f1: 0.6712
 epoch: 37, train_loss: 0.5103, test_loss: 0.8510, test_f1: 0.6598
 epoch: 38, train_loss: 0.4852, test_loss: 0.8932, test_f1: 0.6657
 epoch: 39, train_loss: 0.4858, test_loss: 0.9736, test_f1: 0.6494
 epoch: 40, train_loss: 0.4812, test_loss: 0.8949, test_f1: 0.6584
 epoch: 41, train_loss: 0.4798, test_loss: 1.0000, test_f1: 0.6413
 epoch: 42, train_loss: 0.4628, test_loss: 0.9547, test_f1: 0.6629
 epoch: 43, train_loss: 0.4655, test_loss: 0.9262, test_f1: 0.6721
 epoch: 44, train_loss: 0.4507, test_loss: 0.9767, test_f1: 0.6902
 epoch: 45, train_loss: 0.4477, test_loss: 0.8998, test_f1: 0.6595
 epoch: 46, train_loss: 0.4351, test_loss: 0.8848, test_f1: 0.6985
 epoch: 47, train_loss: 0.4155, test_loss: 1.2471, test_f1: 0.6237
 epoch: 48, train_loss: 0.4321, test_loss: 1.0131, test_f1: 0.6777
 epoch: 49, train_loss: 0.4189, test_loss: 0.9419, test_f1: 0.6850
 epoch: 50, train_loss: 0.4100, test_loss: 0.9623, test_f1: 0.6838
 epoch: 51, train_loss: 0.3714, test_loss: 0.9412, test_f1: 0.6786
 epoch: 52, train_loss: 0.3571, test_loss: 1.0207, test_f1: 0.6820
 epoch: 53, train_loss: 0.3523, test_loss: 0.9664, test_f1: 0.6917
 epoch: 54, train_loss: 0.3264, test_loss: 0.9699, test_f1: 0.6886
 epoch: 55, train_loss: 0.3093, test_loss: 1.0566, test_f1: 0.6798
 epoch: 56, train_loss: 0.2895, test_loss: 1.0154, test_f1: 0.7058
 epoch: 57, train_loss: 0.2999, test_loss: 1.0181, test_f1: 0.6824
 epoch: 58, train_loss: 0.2951, test_loss: 1.0762, test_f1: 0.7016
 epoch: 59, train_loss: 0.2837, test_loss: 1.0851, test_f1: 0.6814
 epoch: 60, train_loss: 0.2827, test_loss: 1.0941, test_f1: 0.6959
 epoch: 61, train_loss: 0.2849, test_loss: 1.1020, test_f1: 0.6894
 epoch: 62, train_loss: 0.2748, test_loss: 1.1682, test_f1: 0.6904
 epoch: 63, train_loss: 0.2884, test_loss: 1.2533, test_f1: 0.6965
 epoch: 64, train_loss: 0.2862, test_loss: 1.1145, test_f1: 0.6687
 epoch: 65, train_loss: 0.2897, test_loss: 1.1431, test_f1: 0.7029
 epoch: 66, train_loss: 0.2755, test_loss: 1.1364, test_f1: 0.7034
 epoch: 67, train_loss: 0.2571, test_loss: 1.2104, test_f1: 0.6845
 epoch: 68, train_loss: 0.2824, test_loss: 1.0774, test_f1: 0.7047
 epoch: 69, train_loss: 0.2616, test_loss: 1.2886, test_f1: 0.7054
 epoch: 70, train_loss: 0.2510, test_loss: 1.0933, test_f1: 0.7006
 epoch: 71, train_loss: 0.2428, test_loss: 1.1762, test_f1: 0.6928
 epoch: 72, train_loss: 0.2620, test_loss: 1.1438, test_f1: 0.7044
 epoch: 73, train_loss: 0.2371, test_loss: 1.3279, test_f1: 0.6969
 epoch: 74, train_loss: 0.2239, test_loss: 1.3080, test_f1: 0.6819
 epoch: 75, train_loss: 0.2325, test_loss: 1.4008, test_f1: 0.6704
 epoch: 76, train_loss: 0.2248, test_loss: 1.3104, test_f1: 0.6937
 epoch: 77, train_loss: 0.2345, test_loss: 1.2038, test_f1: 0.6796
 epoch: 78, train_loss: 0.2278, test_loss: 1.3236, test_f1: 0.6903
 epoch: 79, train_loss: 0.2271, test_loss: 1.3528, test_f1: 0.6885
 epoch: 80, train_loss: 0.2246, test_loss: 1.3198, test_f1: 0.6940
 epoch: 81, train_loss: 0.2351, test_loss: 1.2063, test_f1: 0.7126
 epoch: 82, train_loss: 0.2354, test_loss: 1.3348, test_f1: 0.7134
 epoch: 83, train_loss: 0.2392, test_loss: 1.3915, test_f1: 0.7007
 epoch: 84, train_loss: 0.2255, test_loss: 1.3519, test_f1: 0.6993
 epoch: 85, train_loss: 0.2134, test_loss: 1.3409, test_f1: 0.6792
 epoch: 86, train_loss: 0.2065, test_loss: 1.4311, test_f1: 0.7019
 epoch: 87, train_loss: 0.1843, test_loss: 1.4026, test_f1: 0.6835
 epoch: 88, train_loss: 0.2185, test_loss: 1.4202, test_f1: 0.6939
 epoch: 89, train_loss: 0.2050, test_loss: 1.3973, test_f1: 0.6882
 epoch: 90, train_loss: 0.1969, test_loss: 1.4266, test_f1: 0.6937
 epoch: 91, train_loss: 0.2019, test_loss: 1.3642, test_f1: 0.6995
 epoch: 92, train_loss: 0.1872, test_loss: 1.4077, test_f1: 0.6868
 epoch: 93, train_loss: 0.2008, test_loss: 1.3558, test_f1: 0.6932
 epoch: 94, train_loss: 0.1830, test_loss: 1.3636, test_f1: 0.6710
 epoch: 95, train_loss: 0.1965, test_loss: 1.3432, test_f1: 0.6810
 epoch: 96, train_loss: 0.2039, test_loss: 1.3298, test_f1: 0.6769
 epoch: 97, train_loss: 0.1854, test_loss: 1.2315, test_f1: 0.6908
 epoch: 98, train_loss: 0.1772, test_loss: 1.3250, test_f1: 0.6863
 epoch: 99, train_loss: 0.1788, test_loss: 1.3912, test_f1: 0.6911
##################ITERATION #5 ****************************************
 epoch: 0, train_loss: 1.2149, test_loss: 1.0284, test_f1: 0.4748
 epoch: 1, train_loss: 0.9726, test_loss: 0.9254, test_f1: 0.4871
 epoch: 2, train_loss: 0.9222, test_loss: 0.8470, test_f1: 0.5610
 epoch: 3, train_loss: 0.8958, test_loss: 0.8452, test_f1: 0.5470
 epoch: 4, train_loss: 0.8583, test_loss: 0.8817, test_f1: 0.5544
 epoch: 5, train_loss: 0.8602, test_loss: 0.8242, test_f1: 0.6116
 epoch: 6, train_loss: 0.8177, test_loss: 0.9448, test_f1: 0.5557
 epoch: 7, train_loss: 0.7957, test_loss: 0.8581, test_f1: 0.5657
 epoch: 8, train_loss: 0.7735, test_loss: 0.7904, test_f1: 0.6262
 epoch: 9, train_loss: 0.7685, test_loss: 0.7525, test_f1: 0.6372
 epoch: 10, train_loss: 0.7507, test_loss: 0.7909, test_f1: 0.5949
 epoch: 11, train_loss: 0.7555, test_loss: 0.8538, test_f1: 0.6330
 epoch: 12, train_loss: 0.7262, test_loss: 0.8330, test_f1: 0.6025
 epoch: 13, train_loss: 0.7033, test_loss: 0.7348, test_f1: 0.6270
 epoch: 14, train_loss: 0.7040, test_loss: 0.7501, test_f1: 0.6340
 epoch: 15, train_loss: 0.7001, test_loss: 0.8246, test_f1: 0.6227
 epoch: 16, train_loss: 0.6981, test_loss: 0.7382, test_f1: 0.6494
 epoch: 17, train_loss: 0.6720, test_loss: 0.7359, test_f1: 0.6409
 epoch: 18, train_loss: 0.6744, test_loss: 0.6991, test_f1: 0.6482
 epoch: 19, train_loss: 0.6355, test_loss: 0.7801, test_f1: 0.6534
 epoch: 20, train_loss: 0.6354, test_loss: 0.7172, test_f1: 0.6486
 epoch: 21, train_loss: 0.6245, test_loss: 0.9041, test_f1: 0.5646
 epoch: 22, train_loss: 0.6193, test_loss: 0.7576, test_f1: 0.6352
 epoch: 23, train_loss: 0.6272, test_loss: 0.6722, test_f1: 0.6878
 epoch: 24, train_loss: 0.6118, test_loss: 0.7559, test_f1: 0.6442
 epoch: 25, train_loss: 0.5907, test_loss: 0.8063, test_f1: 0.6352
 epoch: 26, train_loss: 0.5747, test_loss: 1.0126, test_f1: 0.5947
 epoch: 27, train_loss: 0.5623, test_loss: 0.7800, test_f1: 0.6517
 epoch: 28, train_loss: 0.5658, test_loss: 0.7822, test_f1: 0.6336
 epoch: 29, train_loss: 0.5660, test_loss: 0.7825, test_f1: 0.6436
 epoch: 30, train_loss: 0.5350, test_loss: 0.7929, test_f1: 0.6287
 epoch: 31, train_loss: 0.5391, test_loss: 0.7605, test_f1: 0.6791
 epoch: 32, train_loss: 0.5223, test_loss: 0.7197, test_f1: 0.6941
 epoch: 33, train_loss: 0.5209, test_loss: 0.7133, test_f1: 0.6640
 epoch: 34, train_loss: 0.5026, test_loss: 0.7517, test_f1: 0.6585
 epoch: 35, train_loss: 0.4762, test_loss: 0.7669, test_f1: 0.6837
 epoch: 36, train_loss: 0.4694, test_loss: 0.8534, test_f1: 0.6608
 epoch: 37, train_loss: 0.4922, test_loss: 0.6773, test_f1: 0.6631
 epoch: 38, train_loss: 0.4804, test_loss: 0.7787, test_f1: 0.6967
 epoch: 39, train_loss: 0.4656, test_loss: 0.7207, test_f1: 0.6791
 epoch: 40, train_loss: 0.4598, test_loss: 0.7719, test_f1: 0.6772
 epoch: 41, train_loss: 0.4330, test_loss: 0.7512, test_f1: 0.6806
 epoch: 42, train_loss: 0.4434, test_loss: 0.8265, test_f1: 0.6720
 epoch: 43, train_loss: 0.4370, test_loss: 0.8000, test_f1: 0.6662
 epoch: 44, train_loss: 0.4147, test_loss: 0.7892, test_f1: 0.7078
 epoch: 45, train_loss: 0.4503, test_loss: 0.8525, test_f1: 0.6860
 epoch: 46, train_loss: 0.4018, test_loss: 0.9546, test_f1: 0.6449
 epoch: 47, train_loss: 0.4083, test_loss: 0.7728, test_f1: 0.6885
 epoch: 48, train_loss: 0.4135, test_loss: 0.9741, test_f1: 0.6867
 epoch: 49, train_loss: 0.4043, test_loss: 0.8584, test_f1: 0.6832
 epoch: 50, train_loss: 0.3821, test_loss: 0.9294, test_f1: 0.6615
 epoch: 51, train_loss: 0.3436, test_loss: 0.8846, test_f1: 0.6956
 epoch: 52, train_loss: 0.3275, test_loss: 0.7844, test_f1: 0.6939
 epoch: 53, train_loss: 0.3056, test_loss: 0.9332, test_f1: 0.7102
 epoch: 54, train_loss: 0.3111, test_loss: 0.9830, test_f1: 0.6960
 epoch: 55, train_loss: 0.3119, test_loss: 0.9450, test_f1: 0.6848
 epoch: 56, train_loss: 0.2875, test_loss: 0.9072, test_f1: 0.6855
 epoch: 57, train_loss: 0.2996, test_loss: 0.9417, test_f1: 0.6853
 epoch: 58, train_loss: 0.2726, test_loss: 0.9102, test_f1: 0.6919
 epoch: 59, train_loss: 0.2672, test_loss: 0.9043, test_f1: 0.6831
 epoch: 60, train_loss: 0.2607, test_loss: 0.9116, test_f1: 0.6997
 epoch: 61, train_loss: 0.2814, test_loss: 0.8663, test_f1: 0.6798
 epoch: 62, train_loss: 0.2602, test_loss: 0.9932, test_f1: 0.6585
 epoch: 63, train_loss: 0.2713, test_loss: 1.0619, test_f1: 0.6883
 epoch: 64, train_loss: 0.2588, test_loss: 0.9559, test_f1: 0.6714
 epoch: 65, train_loss: 0.2591, test_loss: 1.0143, test_f1: 0.6614
 epoch: 66, train_loss: 0.2438, test_loss: 0.9930, test_f1: 0.6739
 epoch: 67, train_loss: 0.2437, test_loss: 1.0782, test_f1: 0.6724
 epoch: 68, train_loss: 0.2431, test_loss: 1.0703, test_f1: 0.6707
 epoch: 69, train_loss: 0.2384, test_loss: 0.9620, test_f1: 0.6891
 epoch: 70, train_loss: 0.2456, test_loss: 1.0241, test_f1: 0.6887
 epoch: 71, train_loss: 0.2433, test_loss: 1.0041, test_f1: 0.6803
 epoch: 72, train_loss: 0.2358, test_loss: 0.9856, test_f1: 0.6998
 epoch: 73, train_loss: 0.2239, test_loss: 1.0379, test_f1: 0.6634
 epoch: 74, train_loss: 0.2260, test_loss: 1.1402, test_f1: 0.6929
 epoch: 75, train_loss: 0.2213, test_loss: 1.2549, test_f1: 0.6849
 epoch: 76, train_loss: 0.2219, test_loss: 1.1453, test_f1: 0.6979
 epoch: 77, train_loss: 0.2000, test_loss: 1.2120, test_f1: 0.6680
 epoch: 78, train_loss: 0.2255, test_loss: 1.1072, test_f1: 0.6902
 epoch: 79, train_loss: 0.2245, test_loss: 1.1282, test_f1: 0.6990
 epoch: 80, train_loss: 0.1997, test_loss: 1.2350, test_f1: 0.6612
 epoch: 81, train_loss: 0.2448, test_loss: 1.2169, test_f1: 0.6898
 epoch: 82, train_loss: 0.2093, test_loss: 1.2336, test_f1: 0.6840
 epoch: 83, train_loss: 0.2048, test_loss: 1.2439, test_f1: 0.6763
 epoch: 84, train_loss: 0.2170, test_loss: 1.4018, test_f1: 0.6677
 epoch: 85, train_loss: 0.2052, test_loss: 1.2641, test_f1: 0.6933
 epoch: 86, train_loss: 0.1968, test_loss: 1.3835, test_f1: 0.6788
 epoch: 87, train_loss: 0.2014, test_loss: 1.3371, test_f1: 0.6695
 epoch: 88, train_loss: 0.2012, test_loss: 1.2555, test_f1: 0.6701
 epoch: 89, train_loss: 0.2104, test_loss: 1.3362, test_f1: 0.6664
 epoch: 90, train_loss: 0.1809, test_loss: 1.4046, test_f1: 0.6921
 epoch: 91, train_loss: 0.1701, test_loss: 1.2485, test_f1: 0.6807
 epoch: 92, train_loss: 0.1891, test_loss: 1.3242, test_f1: 0.6872
 epoch: 93, train_loss: 0.1737, test_loss: 1.4556, test_f1: 0.6569
 epoch: 94, train_loss: 0.1906, test_loss: 1.4760, test_f1: 0.6735
 epoch: 95, train_loss: 0.1961, test_loss: 1.4645, test_f1: 0.6891
 epoch: 96, train_loss: 0.1764, test_loss: 1.5439, test_f1: 0.6768
 epoch: 97, train_loss: 0.1757, test_loss: 1.4414, test_f1: 0.7036
 epoch: 98, train_loss: 0.1662, test_loss: 1.5725, test_f1: 0.6628
 epoch: 99, train_loss: 0.1659, test_loss: 1.5640, test_f1: 0.6764
##################ITERATION #6 ****************************************
 epoch: 0, train_loss: 1.1756, test_loss: 0.9997, test_f1: 0.5300
 epoch: 1, train_loss: 0.9619, test_loss: 0.9680, test_f1: 0.4625
 epoch: 2, train_loss: 0.9145, test_loss: 0.9208, test_f1: 0.5201
 epoch: 3, train_loss: 0.8811, test_loss: 0.9102, test_f1: 0.5130
 epoch: 4, train_loss: 0.8673, test_loss: 0.9369, test_f1: 0.5079
 epoch: 5, train_loss: 0.8484, test_loss: 0.8585, test_f1: 0.5851
 epoch: 6, train_loss: 0.8090, test_loss: 0.9708, test_f1: 0.5206
 epoch: 7, train_loss: 0.8012, test_loss: 0.9025, test_f1: 0.5675
 epoch: 8, train_loss: 0.7741, test_loss: 0.8354, test_f1: 0.5357
 epoch: 9, train_loss: 0.7743, test_loss: 0.8407, test_f1: 0.5791
 epoch: 10, train_loss: 0.7599, test_loss: 0.8123, test_f1: 0.5899
 epoch: 11, train_loss: 0.7410, test_loss: 0.8170, test_f1: 0.6017
 epoch: 12, train_loss: 0.7412, test_loss: 1.0035, test_f1: 0.5640
 epoch: 13, train_loss: 0.7419, test_loss: 0.8806, test_f1: 0.5876
 epoch: 14, train_loss: 0.7100, test_loss: 0.7321, test_f1: 0.6396
 epoch: 15, train_loss: 0.6939, test_loss: 0.8295, test_f1: 0.5936
 epoch: 16, train_loss: 0.6833, test_loss: 0.7796, test_f1: 0.6392
 epoch: 17, train_loss: 0.6743, test_loss: 0.7616, test_f1: 0.6375
 epoch: 18, train_loss: 0.6585, test_loss: 0.7475, test_f1: 0.6290
 epoch: 19, train_loss: 0.6537, test_loss: 0.8422, test_f1: 0.6055
 epoch: 20, train_loss: 0.6362, test_loss: 0.8141, test_f1: 0.6675
 epoch: 21, train_loss: 0.6325, test_loss: 0.7598, test_f1: 0.6571
 epoch: 22, train_loss: 0.6265, test_loss: 0.8634, test_f1: 0.6246
 epoch: 23, train_loss: 0.6084, test_loss: 0.7281, test_f1: 0.6111
 epoch: 24, train_loss: 0.5967, test_loss: 0.7927, test_f1: 0.6326
 epoch: 25, train_loss: 0.5942, test_loss: 0.7979, test_f1: 0.6271
 epoch: 26, train_loss: 0.5843, test_loss: 0.7548, test_f1: 0.6575
 epoch: 27, train_loss: 0.5545, test_loss: 0.7085, test_f1: 0.6670
 epoch: 28, train_loss: 0.5259, test_loss: 0.7808, test_f1: 0.6470
 epoch: 29, train_loss: 0.5497, test_loss: 0.7530, test_f1: 0.6620
 epoch: 30, train_loss: 0.5398, test_loss: 0.9310, test_f1: 0.6271
 epoch: 31, train_loss: 0.5277, test_loss: 0.7801, test_f1: 0.6469
 epoch: 32, train_loss: 0.5562, test_loss: 0.7956, test_f1: 0.6578
 epoch: 33, train_loss: 0.5192, test_loss: 0.7753, test_f1: 0.6544
 epoch: 34, train_loss: 0.5209, test_loss: 0.7885, test_f1: 0.6689
 epoch: 35, train_loss: 0.5117, test_loss: 0.8417, test_f1: 0.6561
 epoch: 36, train_loss: 0.4815, test_loss: 0.9817, test_f1: 0.6285
 epoch: 37, train_loss: 0.4898, test_loss: 0.8376, test_f1: 0.6635
 epoch: 38, train_loss: 0.4668, test_loss: 0.8293, test_f1: 0.6626
 epoch: 39, train_loss: 0.4730, test_loss: 0.6926, test_f1: 0.7051
 epoch: 40, train_loss: 0.4627, test_loss: 0.8210, test_f1: 0.6615
 epoch: 41, train_loss: 0.4631, test_loss: 0.7691, test_f1: 0.6896
 epoch: 42, train_loss: 0.4544, test_loss: 0.8407, test_f1: 0.6771
 epoch: 43, train_loss: 0.4498, test_loss: 0.7891, test_f1: 0.7223
 epoch: 44, train_loss: 0.4622, test_loss: 0.8777, test_f1: 0.6725
 epoch: 45, train_loss: 0.4393, test_loss: 0.8749, test_f1: 0.6903
 epoch: 46, train_loss: 0.4348, test_loss: 0.7981, test_f1: 0.6830
 epoch: 47, train_loss: 0.4136, test_loss: 0.8018, test_f1: 0.6819
 epoch: 48, train_loss: 0.4222, test_loss: 0.8330, test_f1: 0.7005
 epoch: 49, train_loss: 0.4030, test_loss: 0.9473, test_f1: 0.6457
 epoch: 50, train_loss: 0.3998, test_loss: 0.8708, test_f1: 0.6701
 epoch: 51, train_loss: 0.3313, test_loss: 0.8794, test_f1: 0.7089
 epoch: 52, train_loss: 0.3195, test_loss: 0.9097, test_f1: 0.6905
 epoch: 53, train_loss: 0.3068, test_loss: 0.9118, test_f1: 0.7016
 epoch: 54, train_loss: 0.3052, test_loss: 1.0355, test_f1: 0.6816
 epoch: 55, train_loss: 0.3078, test_loss: 1.0062, test_f1: 0.6738
 epoch: 56, train_loss: 0.2955, test_loss: 1.0434, test_f1: 0.6958
 epoch: 57, train_loss: 0.3139, test_loss: 0.9695, test_f1: 0.6747
 epoch: 58, train_loss: 0.2938, test_loss: 1.0352, test_f1: 0.7005
 epoch: 59, train_loss: 0.2883, test_loss: 0.9821, test_f1: 0.6887
 epoch: 60, train_loss: 0.2718, test_loss: 0.9717, test_f1: 0.6834
 epoch: 61, train_loss: 0.2837, test_loss: 1.0492, test_f1: 0.7142
 epoch: 62, train_loss: 0.2917, test_loss: 1.0455, test_f1: 0.6912
 epoch: 63, train_loss: 0.2889, test_loss: 0.9816, test_f1: 0.6867
 epoch: 64, train_loss: 0.2649, test_loss: 0.9947, test_f1: 0.6872
 epoch: 65, train_loss: 0.2458, test_loss: 1.0572, test_f1: 0.7072
 epoch: 66, train_loss: 0.2495, test_loss: 0.9852, test_f1: 0.6853
 epoch: 67, train_loss: 0.2526, test_loss: 1.0635, test_f1: 0.6983
 epoch: 68, train_loss: 0.2545, test_loss: 1.0936, test_f1: 0.6629
 epoch: 69, train_loss: 0.2522, test_loss: 1.0336, test_f1: 0.6933
 epoch: 70, train_loss: 0.2594, test_loss: 1.0201, test_f1: 0.6803
 epoch: 71, train_loss: 0.2702, test_loss: 1.1079, test_f1: 0.7048
 epoch: 72, train_loss: 0.2458, test_loss: 1.0558, test_f1: 0.7036
 epoch: 73, train_loss: 0.2341, test_loss: 1.1231, test_f1: 0.6948
 epoch: 74, train_loss: 0.2325, test_loss: 1.1653, test_f1: 0.6995
 epoch: 75, train_loss: 0.2184, test_loss: 1.1632, test_f1: 0.6695
 epoch: 76, train_loss: 0.2380, test_loss: 1.1810, test_f1: 0.6810
 epoch: 77, train_loss: 0.2252, test_loss: 1.1356, test_f1: 0.6957
 epoch: 78, train_loss: 0.2233, test_loss: 1.1764, test_f1: 0.7026
 epoch: 79, train_loss: 0.2390, test_loss: 1.0723, test_f1: 0.6914
 epoch: 80, train_loss: 0.2203, test_loss: 1.0934, test_f1: 0.6822
 epoch: 81, train_loss: 0.2230, test_loss: 1.1636, test_f1: 0.6882
 epoch: 82, train_loss: 0.2180, test_loss: 1.1674, test_f1: 0.7059
 epoch: 83, train_loss: 0.2388, test_loss: 1.1760, test_f1: 0.6954
 epoch: 84, train_loss: 0.1960, test_loss: 1.2713, test_f1: 0.7121
 epoch: 85, train_loss: 0.2041, test_loss: 1.2537, test_f1: 0.6964
 epoch: 86, train_loss: 0.2061, test_loss: 1.1925, test_f1: 0.7149
 epoch: 87, train_loss: 0.2211, test_loss: 1.2446, test_f1: 0.6927
 epoch: 88, train_loss: 0.1999, test_loss: 1.1731, test_f1: 0.6959
 epoch: 89, train_loss: 0.1968, test_loss: 1.2478, test_f1: 0.6933
 epoch: 90, train_loss: 0.1903, test_loss: 1.2142, test_f1: 0.6943
 epoch: 91, train_loss: 0.1941, test_loss: 1.2186, test_f1: 0.7082
 epoch: 92, train_loss: 0.1904, test_loss: 1.2026, test_f1: 0.6913
 epoch: 93, train_loss: 0.1770, test_loss: 1.3079, test_f1: 0.6978
 epoch: 94, train_loss: 0.1942, test_loss: 1.1070, test_f1: 0.7044
 epoch: 95, train_loss: 0.1958, test_loss: 1.3096, test_f1: 0.6890
 epoch: 96, train_loss: 0.2223, test_loss: 1.1155, test_f1: 0.6894
 epoch: 97, train_loss: 0.2167, test_loss: 1.2066, test_f1: 0.6842
 epoch: 98, train_loss: 0.1764, test_loss: 1.2556, test_f1: 0.7019
 epoch: 99, train_loss: 0.1909, test_loss: 1.2648, test_f1: 0.7153
##################ITERATION #7 ****************************************
 epoch: 0, train_loss: 1.2285, test_loss: 0.9997, test_f1: 0.4581
 epoch: 1, train_loss: 0.9666, test_loss: 0.8727, test_f1: 0.5417
 epoch: 2, train_loss: 0.9307, test_loss: 0.9960, test_f1: 0.5156
 epoch: 3, train_loss: 0.8968, test_loss: 0.8975, test_f1: 0.5647
 epoch: 4, train_loss: 0.8706, test_loss: 0.8616, test_f1: 0.5664
 epoch: 5, train_loss: 0.8412, test_loss: 0.9431, test_f1: 0.5194
 epoch: 6, train_loss: 0.8073, test_loss: 0.8593, test_f1: 0.5511
 epoch: 7, train_loss: 0.7871, test_loss: 0.7563, test_f1: 0.6396
 epoch: 8, train_loss: 0.7827, test_loss: 0.9077, test_f1: 0.5811
 epoch: 9, train_loss: 0.7894, test_loss: 0.8637, test_f1: 0.6074
 epoch: 10, train_loss: 0.7756, test_loss: 0.8949, test_f1: 0.5889
 epoch: 11, train_loss: 0.7458, test_loss: 0.8462, test_f1: 0.5871
 epoch: 12, train_loss: 0.7331, test_loss: 0.8199, test_f1: 0.6117
 epoch: 13, train_loss: 0.7383, test_loss: 0.7796, test_f1: 0.6079
 epoch: 14, train_loss: 0.7069, test_loss: 0.7992, test_f1: 0.6316
 epoch: 15, train_loss: 0.6771, test_loss: 0.7560, test_f1: 0.6278
 epoch: 16, train_loss: 0.6735, test_loss: 0.7850, test_f1: 0.6487
 epoch: 17, train_loss: 0.6746, test_loss: 0.7849, test_f1: 0.6301
 epoch: 18, train_loss: 0.6401, test_loss: 0.7749, test_f1: 0.6194
 epoch: 19, train_loss: 0.6596, test_loss: 0.8189, test_f1: 0.6257
 epoch: 20, train_loss: 0.6310, test_loss: 0.8518, test_f1: 0.6016
 epoch: 21, train_loss: 0.6429, test_loss: 0.8225, test_f1: 0.6282
 epoch: 22, train_loss: 0.5964, test_loss: 0.8565, test_f1: 0.6410
 epoch: 23, train_loss: 0.5924, test_loss: 0.8380, test_f1: 0.6146
 epoch: 24, train_loss: 0.5871, test_loss: 0.7841, test_f1: 0.6458
 epoch: 25, train_loss: 0.5861, test_loss: 0.8459, test_f1: 0.6465
 epoch: 26, train_loss: 0.5932, test_loss: 0.7704, test_f1: 0.6742
 epoch: 27, train_loss: 0.5521, test_loss: 0.7461, test_f1: 0.6729
 epoch: 28, train_loss: 0.5658, test_loss: 0.8500, test_f1: 0.6509
 epoch: 29, train_loss: 0.5513, test_loss: 0.6947, test_f1: 0.6716
 epoch: 30, train_loss: 0.5606, test_loss: 0.8219, test_f1: 0.6556
 epoch: 31, train_loss: 0.5392, test_loss: 0.9377, test_f1: 0.6837
 epoch: 32, train_loss: 0.5194, test_loss: 0.9134, test_f1: 0.6850
 epoch: 33, train_loss: 0.5051, test_loss: 0.8418, test_f1: 0.6561
 epoch: 34, train_loss: 0.4912, test_loss: 0.8948, test_f1: 0.6677
 epoch: 35, train_loss: 0.4913, test_loss: 0.8672, test_f1: 0.6678
 epoch: 36, train_loss: 0.4967, test_loss: 0.9007, test_f1: 0.6989
 epoch: 37, train_loss: 0.4943, test_loss: 0.8206, test_f1: 0.6874
 epoch: 38, train_loss: 0.4840, test_loss: 0.8317, test_f1: 0.6741
 epoch: 39, train_loss: 0.4648, test_loss: 0.8349, test_f1: 0.6721
 epoch: 40, train_loss: 0.4572, test_loss: 0.8692, test_f1: 0.6649
 epoch: 41, train_loss: 0.4705, test_loss: 0.8675, test_f1: 0.6875
 epoch: 42, train_loss: 0.4319, test_loss: 0.8041, test_f1: 0.6949
 epoch: 43, train_loss: 0.4445, test_loss: 0.8610, test_f1: 0.6571
 epoch: 44, train_loss: 0.4258, test_loss: 1.0091, test_f1: 0.6604
 epoch: 45, train_loss: 0.4173, test_loss: 1.0141, test_f1: 0.6778
 epoch: 46, train_loss: 0.4100, test_loss: 0.9583, test_f1: 0.6604
 epoch: 47, train_loss: 0.3974, test_loss: 0.8511, test_f1: 0.7068
 epoch: 48, train_loss: 0.4133, test_loss: 0.9714, test_f1: 0.6811
 epoch: 49, train_loss: 0.3944, test_loss: 0.7823, test_f1: 0.6716
 epoch: 50, train_loss: 0.3930, test_loss: 0.8801, test_f1: 0.6892
 epoch: 51, train_loss: 0.3505, test_loss: 0.9966, test_f1: 0.6722
 epoch: 52, train_loss: 0.3106, test_loss: 0.9255, test_f1: 0.6616
 epoch: 53, train_loss: 0.3042, test_loss: 1.0851, test_f1: 0.6613
 epoch: 54, train_loss: 0.3167, test_loss: 0.9412, test_f1: 0.6755
 epoch: 55, train_loss: 0.2735, test_loss: 1.1150, test_f1: 0.6642
 epoch: 56, train_loss: 0.2659, test_loss: 0.9694, test_f1: 0.6749
 epoch: 57, train_loss: 0.2781, test_loss: 1.1103, test_f1: 0.6747
 epoch: 58, train_loss: 0.2745, test_loss: 1.0591, test_f1: 0.6690
 epoch: 59, train_loss: 0.2795, test_loss: 1.0341, test_f1: 0.6755
 epoch: 60, train_loss: 0.2741, test_loss: 1.0374, test_f1: 0.6785
 epoch: 61, train_loss: 0.2795, test_loss: 1.1650, test_f1: 0.6639
 epoch: 62, train_loss: 0.2855, test_loss: 1.1712, test_f1: 0.6605
 epoch: 63, train_loss: 0.2678, test_loss: 1.1208, test_f1: 0.6532
 epoch: 64, train_loss: 0.2597, test_loss: 1.1268, test_f1: 0.6850
 epoch: 65, train_loss: 0.2424, test_loss: 1.2364, test_f1: 0.6722
 epoch: 66, train_loss: 0.2600, test_loss: 1.1896, test_f1: 0.6728
 epoch: 67, train_loss: 0.2648, test_loss: 1.2854, test_f1: 0.6637
 epoch: 68, train_loss: 0.2511, test_loss: 1.1783, test_f1: 0.6755
 epoch: 69, train_loss: 0.2522, test_loss: 1.1124, test_f1: 0.6558
 epoch: 70, train_loss: 0.2279, test_loss: 1.1227, test_f1: 0.6547
 epoch: 71, train_loss: 0.2544, test_loss: 1.1536, test_f1: 0.6375
 epoch: 72, train_loss: 0.2327, test_loss: 1.2169, test_f1: 0.7055
 epoch: 73, train_loss: 0.2216, test_loss: 1.0597, test_f1: 0.6626
 epoch: 74, train_loss: 0.2297, test_loss: 1.3524, test_f1: 0.6733
 epoch: 75, train_loss: 0.2250, test_loss: 1.3245, test_f1: 0.6704
 epoch: 76, train_loss: 0.2367, test_loss: 1.3535, test_f1: 0.6397
 epoch: 77, train_loss: 0.2138, test_loss: 1.4906, test_f1: 0.6579
 epoch: 78, train_loss: 0.2414, test_loss: 1.2817, test_f1: 0.6622
 epoch: 79, train_loss: 0.2530, test_loss: 1.3869, test_f1: 0.6816
 epoch: 80, train_loss: 0.2097, test_loss: 1.3607, test_f1: 0.6526
 epoch: 81, train_loss: 0.2295, test_loss: 1.4196, test_f1: 0.6489
 epoch: 82, train_loss: 0.2110, test_loss: 1.4702, test_f1: 0.6393
 epoch: 83, train_loss: 0.2002, test_loss: 1.4681, test_f1: 0.6592
 epoch: 84, train_loss: 0.2188, test_loss: 1.3906, test_f1: 0.6710
 epoch: 85, train_loss: 0.1923, test_loss: 1.4963, test_f1: 0.6726
 epoch: 86, train_loss: 0.1961, test_loss: 1.4903, test_f1: 0.6863
 epoch: 87, train_loss: 0.2094, test_loss: 1.3751, test_f1: 0.6423
 epoch: 88, train_loss: 0.1966, test_loss: 1.4594, test_f1: 0.6755
 epoch: 89, train_loss: 0.1851, test_loss: 1.5488, test_f1: 0.6751
 epoch: 90, train_loss: 0.1945, test_loss: 1.5062, test_f1: 0.6732
 epoch: 91, train_loss: 0.2101, test_loss: 1.5130, test_f1: 0.6660
 epoch: 92, train_loss: 0.1998, test_loss: 1.3136, test_f1: 0.6644
 epoch: 93, train_loss: 0.1896, test_loss: 1.4885, test_f1: 0.6777
 epoch: 94, train_loss: 0.2043, test_loss: 1.5706, test_f1: 0.6387
 epoch: 95, train_loss: 0.2062, test_loss: 1.4936, test_f1: 0.6656
 epoch: 96, train_loss: 0.1735, test_loss: 1.5176, test_f1: 0.6562
 epoch: 97, train_loss: 0.1928, test_loss: 1.4656, test_f1: 0.6679
 epoch: 98, train_loss: 0.1949, test_loss: 1.3787, test_f1: 0.6707
 epoch: 99, train_loss: 0.1819, test_loss: 1.4536, test_f1: 0.6537
##################ITERATION #8 ****************************************
 epoch: 0, train_loss: 1.1799, test_loss: 1.0016, test_f1: 0.5071
 epoch: 1, train_loss: 0.9631, test_loss: 0.9591, test_f1: 0.5107
 epoch: 2, train_loss: 0.9334, test_loss: 0.9156, test_f1: 0.5062
 epoch: 3, train_loss: 0.8963, test_loss: 0.9054, test_f1: 0.5016
 epoch: 4, train_loss: 0.8730, test_loss: 0.8312, test_f1: 0.5641
 epoch: 5, train_loss: 0.8282, test_loss: 1.1129, test_f1: 0.5223
 epoch: 6, train_loss: 0.7978, test_loss: 0.8627, test_f1: 0.5922
 epoch: 7, train_loss: 0.7882, test_loss: 0.9036, test_f1: 0.5580
 epoch: 8, train_loss: 0.7870, test_loss: 0.9054, test_f1: 0.5702
 epoch: 9, train_loss: 0.7690, test_loss: 0.8647, test_f1: 0.5832
 epoch: 10, train_loss: 0.7642, test_loss: 0.8401, test_f1: 0.6119
 epoch: 11, train_loss: 0.7185, test_loss: 0.7487, test_f1: 0.6514
 epoch: 12, train_loss: 0.7234, test_loss: 0.8100, test_f1: 0.6422
 epoch: 13, train_loss: 0.6996, test_loss: 0.8338, test_f1: 0.6102
 epoch: 14, train_loss: 0.6873, test_loss: 0.8025, test_f1: 0.6540
 epoch: 15, train_loss: 0.6726, test_loss: 0.8905, test_f1: 0.6241
 epoch: 16, train_loss: 0.6582, test_loss: 0.8305, test_f1: 0.6366
 epoch: 17, train_loss: 0.6565, test_loss: 0.8464, test_f1: 0.6048
 epoch: 18, train_loss: 0.6437, test_loss: 0.8167, test_f1: 0.6420
 epoch: 19, train_loss: 0.6200, test_loss: 0.8640, test_f1: 0.6355
 epoch: 20, train_loss: 0.6146, test_loss: 0.8114, test_f1: 0.6508
 epoch: 21, train_loss: 0.6034, test_loss: 0.8183, test_f1: 0.6596
 epoch: 22, train_loss: 0.5961, test_loss: 0.8904, test_f1: 0.6474
 epoch: 23, train_loss: 0.5793, test_loss: 0.8025, test_f1: 0.6749
 epoch: 24, train_loss: 0.6021, test_loss: 0.8187, test_f1: 0.6716
 epoch: 25, train_loss: 0.5919, test_loss: 0.7484, test_f1: 0.6613
 epoch: 26, train_loss: 0.5582, test_loss: 0.7679, test_f1: 0.6414
 epoch: 27, train_loss: 0.5488, test_loss: 0.7497, test_f1: 0.6795
 epoch: 28, train_loss: 0.5539, test_loss: 0.8009, test_f1: 0.6805
 epoch: 29, train_loss: 0.5459, test_loss: 0.8754, test_f1: 0.6520
 epoch: 30, train_loss: 0.5310, test_loss: 0.9326, test_f1: 0.6620
 epoch: 31, train_loss: 0.5134, test_loss: 0.8716, test_f1: 0.6559
 epoch: 32, train_loss: 0.4877, test_loss: 0.9469, test_f1: 0.6510
 epoch: 33, train_loss: 0.4873, test_loss: 1.0163, test_f1: 0.6284
 epoch: 34, train_loss: 0.4880, test_loss: 0.9435, test_f1: 0.6521
 epoch: 35, train_loss: 0.4790, test_loss: 0.9572, test_f1: 0.6755
 epoch: 36, train_loss: 0.4854, test_loss: 0.8573, test_f1: 0.6718
 epoch: 37, train_loss: 0.4934, test_loss: 0.8923, test_f1: 0.6614
 epoch: 38, train_loss: 0.4578, test_loss: 0.8995, test_f1: 0.6741
 epoch: 39, train_loss: 0.4519, test_loss: 0.9232, test_f1: 0.6825
 epoch: 40, train_loss: 0.4322, test_loss: 0.8435, test_f1: 0.6587
 epoch: 41, train_loss: 0.4414, test_loss: 0.8542, test_f1: 0.6815
 epoch: 42, train_loss: 0.4418, test_loss: 0.8580, test_f1: 0.6730
 epoch: 43, train_loss: 0.4509, test_loss: 0.9003, test_f1: 0.6858
 epoch: 44, train_loss: 0.4172, test_loss: 1.0054, test_f1: 0.6968
 epoch: 45, train_loss: 0.4094, test_loss: 0.9993, test_f1: 0.6772
 epoch: 46, train_loss: 0.4035, test_loss: 0.9633, test_f1: 0.6835
 epoch: 47, train_loss: 0.3770, test_loss: 0.8767, test_f1: 0.6728
 epoch: 48, train_loss: 0.3738, test_loss: 0.8655, test_f1: 0.6869
 epoch: 49, train_loss: 0.3852, test_loss: 0.9303, test_f1: 0.6620
 epoch: 50, train_loss: 0.4051, test_loss: 1.0140, test_f1: 0.6518
 epoch: 51, train_loss: 0.3426, test_loss: 0.9440, test_f1: 0.6894
 epoch: 52, train_loss: 0.3290, test_loss: 0.9473, test_f1: 0.6741
 epoch: 53, train_loss: 0.3083, test_loss: 0.9588, test_f1: 0.6932
 epoch: 54, train_loss: 0.3160, test_loss: 0.9582, test_f1: 0.6897
 epoch: 55, train_loss: 0.2909, test_loss: 1.0832, test_f1: 0.7036
 epoch: 56, train_loss: 0.2982, test_loss: 0.9193, test_f1: 0.7064
 epoch: 57, train_loss: 0.2853, test_loss: 1.0843, test_f1: 0.6932
 epoch: 58, train_loss: 0.2816, test_loss: 1.0268, test_f1: 0.6949
 epoch: 59, train_loss: 0.2830, test_loss: 1.0497, test_f1: 0.6706
 epoch: 60, train_loss: 0.2614, test_loss: 1.0661, test_f1: 0.6759
 epoch: 61, train_loss: 0.2669, test_loss: 1.0824, test_f1: 0.6840
 epoch: 62, train_loss: 0.2533, test_loss: 1.0497, test_f1: 0.6858
 epoch: 63, train_loss: 0.2495, test_loss: 1.1233, test_f1: 0.6668
 epoch: 64, train_loss: 0.2572, test_loss: 1.1752, test_f1: 0.6858
 epoch: 65, train_loss: 0.2531, test_loss: 1.2290, test_f1: 0.6715
 epoch: 66, train_loss: 0.2328, test_loss: 1.1758, test_f1: 0.6702
 epoch: 67, train_loss: 0.2607, test_loss: 1.1570, test_f1: 0.6589
 epoch: 68, train_loss: 0.2856, test_loss: 1.0391, test_f1: 0.6816
 epoch: 69, train_loss: 0.2547, test_loss: 1.1561, test_f1: 0.6548
 epoch: 70, train_loss: 0.2398, test_loss: 1.1815, test_f1: 0.6746
 epoch: 71, train_loss: 0.2358, test_loss: 1.0818, test_f1: 0.6715
 epoch: 72, train_loss: 0.2407, test_loss: 1.0532, test_f1: 0.6857
 epoch: 73, train_loss: 0.2291, test_loss: 1.3057, test_f1: 0.6713
 epoch: 74, train_loss: 0.2675, test_loss: 1.0820, test_f1: 0.6827
 epoch: 75, train_loss: 0.2119, test_loss: 1.1402, test_f1: 0.6720
 epoch: 76, train_loss: 0.2256, test_loss: 1.0856, test_f1: 0.6805
 epoch: 77, train_loss: 0.2268, test_loss: 1.3339, test_f1: 0.6680
 epoch: 78, train_loss: 0.2316, test_loss: 1.3004, test_f1: 0.6759
 epoch: 79, train_loss: 0.2265, test_loss: 1.2193, test_f1: 0.6581
 epoch: 80, train_loss: 0.2112, test_loss: 1.3224, test_f1: 0.6870
 epoch: 81, train_loss: 0.2200, test_loss: 1.2127, test_f1: 0.6754
 epoch: 82, train_loss: 0.2170, test_loss: 1.1250, test_f1: 0.6869
 epoch: 83, train_loss: 0.1980, test_loss: 1.2672, test_f1: 0.6440
 epoch: 84, train_loss: 0.2092, test_loss: 1.2890, test_f1: 0.6815
 epoch: 85, train_loss: 0.1951, test_loss: 1.4045, test_f1: 0.6828
 epoch: 86, train_loss: 0.2056, test_loss: 1.4720, test_f1: 0.6489
 epoch: 87, train_loss: 0.1966, test_loss: 1.4132, test_f1: 0.6763
 epoch: 88, train_loss: 0.2111, test_loss: 1.4155, test_f1: 0.6610
 epoch: 89, train_loss: 0.1857, test_loss: 1.3741, test_f1: 0.6747
 epoch: 90, train_loss: 0.1805, test_loss: 1.2908, test_f1: 0.6728
 epoch: 91, train_loss: 0.1920, test_loss: 1.4036, test_f1: 0.6709
 epoch: 92, train_loss: 0.1953, test_loss: 1.5416, test_f1: 0.6438
 epoch: 93, train_loss: 0.1743, test_loss: 1.2956, test_f1: 0.6820
 epoch: 94, train_loss: 0.1866, test_loss: 1.3409, test_f1: 0.6761
 epoch: 95, train_loss: 0.1799, test_loss: 1.3696, test_f1: 0.6622
 epoch: 96, train_loss: 0.1972, test_loss: 1.3443, test_f1: 0.6670
 epoch: 97, train_loss: 0.1995, test_loss: 1.3013, test_f1: 0.6771
 epoch: 98, train_loss: 0.1965, test_loss: 1.4302, test_f1: 0.6481
 epoch: 99, train_loss: 0.1905, test_loss: 1.2523, test_f1: 0.6413
##################ITERATION #9 ****************************************
 epoch: 0, train_loss: 1.1877, test_loss: 1.0160, test_f1: 0.4348
 epoch: 1, train_loss: 0.9558, test_loss: 0.8778, test_f1: 0.4922
 epoch: 2, train_loss: 0.9064, test_loss: 0.8437, test_f1: 0.5272
 epoch: 3, train_loss: 0.8776, test_loss: 0.9440, test_f1: 0.5512
 epoch: 4, train_loss: 0.8663, test_loss: 0.9181, test_f1: 0.4883
 epoch: 5, train_loss: 0.8422, test_loss: 0.8707, test_f1: 0.5363
 epoch: 6, train_loss: 0.8240, test_loss: 1.0525, test_f1: 0.5128
 epoch: 7, train_loss: 0.8146, test_loss: 0.8161, test_f1: 0.5907
 epoch: 8, train_loss: 0.7863, test_loss: 0.8415, test_f1: 0.5718
 epoch: 9, train_loss: 0.7676, test_loss: 0.7990, test_f1: 0.5937
 epoch: 10, train_loss: 0.7561, test_loss: 0.8347, test_f1: 0.5764
 epoch: 11, train_loss: 0.7528, test_loss: 0.8038, test_f1: 0.5770
 epoch: 12, train_loss: 0.7205, test_loss: 0.8965, test_f1: 0.5757
 epoch: 13, train_loss: 0.7226, test_loss: 0.7784, test_f1: 0.6384
 epoch: 14, train_loss: 0.7014, test_loss: 0.8128, test_f1: 0.6245
 epoch: 15, train_loss: 0.6794, test_loss: 0.7728, test_f1: 0.6493
 epoch: 16, train_loss: 0.6627, test_loss: 0.7985, test_f1: 0.6402
 epoch: 17, train_loss: 0.6668, test_loss: 0.8868, test_f1: 0.6249
 epoch: 18, train_loss: 0.6453, test_loss: 0.7369, test_f1: 0.6437
 epoch: 19, train_loss: 0.6390, test_loss: 0.8040, test_f1: 0.6044
 epoch: 20, train_loss: 0.6537, test_loss: 0.7143, test_f1: 0.6537
 epoch: 21, train_loss: 0.6488, test_loss: 0.8376, test_f1: 0.6530
 epoch: 22, train_loss: 0.5946, test_loss: 0.8280, test_f1: 0.6439
 epoch: 23, train_loss: 0.5893, test_loss: 0.7750, test_f1: 0.6517
 epoch: 24, train_loss: 0.6061, test_loss: 0.9202, test_f1: 0.6266
 epoch: 25, train_loss: 0.5804, test_loss: 0.8273, test_f1: 0.6507
 epoch: 26, train_loss: 0.5864, test_loss: 0.7843, test_f1: 0.6827
 epoch: 27, train_loss: 0.5677, test_loss: 0.7751, test_f1: 0.6572
 epoch: 28, train_loss: 0.5570, test_loss: 0.7456, test_f1: 0.6596
 epoch: 29, train_loss: 0.5315, test_loss: 0.9518, test_f1: 0.6462
 epoch: 30, train_loss: 0.5486, test_loss: 0.8920, test_f1: 0.6372
 epoch: 31, train_loss: 0.5229, test_loss: 0.9766, test_f1: 0.6208
 epoch: 32, train_loss: 0.5199, test_loss: 0.8365, test_f1: 0.6385
 epoch: 33, train_loss: 0.4889, test_loss: 0.8373, test_f1: 0.6502
 epoch: 34, train_loss: 0.5039, test_loss: 0.8006, test_f1: 0.6683
 epoch: 35, train_loss: 0.4974, test_loss: 0.9092, test_f1: 0.6470
 epoch: 36, train_loss: 0.4869, test_loss: 0.7882, test_f1: 0.6755
 epoch: 37, train_loss: 0.4764, test_loss: 0.8012, test_f1: 0.6483
 epoch: 38, train_loss: 0.4573, test_loss: 0.8055, test_f1: 0.6708
 epoch: 39, train_loss: 0.4522, test_loss: 0.8465, test_f1: 0.6544
 epoch: 40, train_loss: 0.4703, test_loss: 0.7906, test_f1: 0.6821
 epoch: 41, train_loss: 0.4449, test_loss: 0.7536, test_f1: 0.6969
 epoch: 42, train_loss: 0.4552, test_loss: 0.9104, test_f1: 0.6465
 epoch: 43, train_loss: 0.4395, test_loss: 0.7920, test_f1: 0.6697
 epoch: 44, train_loss: 0.4446, test_loss: 0.7972, test_f1: 0.6854
 epoch: 45, train_loss: 0.4443, test_loss: 0.7240, test_f1: 0.6889
 epoch: 46, train_loss: 0.4168, test_loss: 0.8698, test_f1: 0.6948
 epoch: 47, train_loss: 0.3956, test_loss: 0.9399, test_f1: 0.6527
 epoch: 48, train_loss: 0.4070, test_loss: 0.7815, test_f1: 0.6930
 epoch: 49, train_loss: 0.4190, test_loss: 0.7741, test_f1: 0.6866
 epoch: 50, train_loss: 0.4252, test_loss: 0.8122, test_f1: 0.6795
 epoch: 51, train_loss: 0.3590, test_loss: 0.9487, test_f1: 0.6692
 epoch: 52, train_loss: 0.3271, test_loss: 0.7978, test_f1: 0.6728
 epoch: 53, train_loss: 0.3103, test_loss: 0.9630, test_f1: 0.6837
 epoch: 54, train_loss: 0.3075, test_loss: 0.8434, test_f1: 0.6841
 epoch: 55, train_loss: 0.2939, test_loss: 1.0535, test_f1: 0.6480
 epoch: 56, train_loss: 0.3065, test_loss: 0.9249, test_f1: 0.6629
 epoch: 57, train_loss: 0.3181, test_loss: 0.9490, test_f1: 0.6760
 epoch: 58, train_loss: 0.2873, test_loss: 0.8915, test_f1: 0.6647
 epoch: 59, train_loss: 0.2697, test_loss: 0.8369, test_f1: 0.6767
 epoch: 60, train_loss: 0.2685, test_loss: 0.9105, test_f1: 0.6890
 epoch: 61, train_loss: 0.2833, test_loss: 0.8847, test_f1: 0.6851
 epoch: 62, train_loss: 0.2845, test_loss: 0.9519, test_f1: 0.6771
 epoch: 63, train_loss: 0.2704, test_loss: 0.8282, test_f1: 0.6797
 epoch: 64, train_loss: 0.2510, test_loss: 0.8424, test_f1: 0.6944
 epoch: 65, train_loss: 0.2616, test_loss: 0.9513, test_f1: 0.6683
 epoch: 66, train_loss: 0.2579, test_loss: 1.0264, test_f1: 0.6657
 epoch: 67, train_loss: 0.2358, test_loss: 0.9543, test_f1: 0.6778
 epoch: 68, train_loss: 0.2664, test_loss: 1.0298, test_f1: 0.6729
 epoch: 69, train_loss: 0.2514, test_loss: 0.9554, test_f1: 0.6831
 epoch: 70, train_loss: 0.2494, test_loss: 0.9702, test_f1: 0.6851
 epoch: 71, train_loss: 0.2367, test_loss: 0.9501, test_f1: 0.6883
 epoch: 72, train_loss: 0.2635, test_loss: 1.0716, test_f1: 0.6585
 epoch: 73, train_loss: 0.2287, test_loss: 1.2148, test_f1: 0.6519
 epoch: 74, train_loss: 0.2686, test_loss: 1.1543, test_f1: 0.6844
 epoch: 75, train_loss: 0.2509, test_loss: 1.0247, test_f1: 0.6768
 epoch: 76, train_loss: 0.2448, test_loss: 1.0338, test_f1: 0.6650
 epoch: 77, train_loss: 0.2314, test_loss: 1.1185, test_f1: 0.6814
 epoch: 78, train_loss: 0.2203, test_loss: 1.1648, test_f1: 0.6706
 epoch: 79, train_loss: 0.2204, test_loss: 1.1296, test_f1: 0.6446
 epoch: 80, train_loss: 0.2164, test_loss: 1.0005, test_f1: 0.6896
 epoch: 81, train_loss: 0.2017, test_loss: 0.9959, test_f1: 0.6800
 epoch: 82, train_loss: 0.2242, test_loss: 0.8860, test_f1: 0.7131
 epoch: 83, train_loss: 0.2204, test_loss: 1.0138, test_f1: 0.6914
 epoch: 84, train_loss: 0.2173, test_loss: 1.0727, test_f1: 0.6746
 epoch: 85, train_loss: 0.2099, test_loss: 1.2066, test_f1: 0.6767
 epoch: 86, train_loss: 0.2033, test_loss: 1.1416, test_f1: 0.6830
 epoch: 87, train_loss: 0.1988, test_loss: 1.0393, test_f1: 0.6844
 epoch: 88, train_loss: 0.2211, test_loss: 1.0450, test_f1: 0.6937
 epoch: 89, train_loss: 0.2087, test_loss: 0.9779, test_f1: 0.7032
 epoch: 90, train_loss: 0.1969, test_loss: 0.9653, test_f1: 0.7032
 epoch: 91, train_loss: 0.1864, test_loss: 1.1354, test_f1: 0.6868
 epoch: 92, train_loss: 0.1754, test_loss: 1.1732, test_f1: 0.6795
 epoch: 93, train_loss: 0.1945, test_loss: 1.1552, test_f1: 0.6743
 epoch: 94, train_loss: 0.1874, test_loss: 1.1569, test_f1: 0.6879
 epoch: 95, train_loss: 0.1903, test_loss: 1.0617, test_f1: 0.6813
 epoch: 96, train_loss: 0.1715, test_loss: 1.1556, test_f1: 0.6840
 epoch: 97, train_loss: 0.1894, test_loss: 1.2257, test_f1: 0.6851
 epoch: 98, train_loss: 0.1746, test_loss: 1.2592, test_f1: 0.6762
 epoch: 99, train_loss: 0.1830, test_loss: 1.2646, test_f1: 0.6767

Training completed in 968.81 seconds
Best F1: 0.7223 at epoch 43
Mean F1 across iterations: 0.7068  0.0087
========================FINAL RESULTS================================
FEGIN weighted F1: 0.7223  0.0087
python main.py --data ltspice_examples --representation component_pin --model FEGIN --layers 3 --hiddens 128 --batch_size 32 --lr 0.001 --emb_size 128 --epochs 100 --save_appendix component_pin_L3_H128_BS32_LR0.001_E128 --no_val
-----



STDERR:
  File "main.py", line 370, in <module>
    main()
  File "main.py", line 254, in main
    dataset = dataset_class(
  File "/home/philip/projects/ltspice_examples_code_repo/Circuit-Completion-Using-GNNs/component_classification_with_link_prediction_head/evaluation/FEGIN/kernel/circuit_datasets.py", line 15, in __init__
    self.data, self.slices = torch.load(self.processed_paths[0])
  File "/home/philip/.local/lib/python3.8/site-packages/torch/serialization.py", line 1040, in load
    warnings.warn(
  File "/usr/lib/python3.8/warnings.py", line 109, in _showwarnmsg
    sw(msg.message, msg.category, msg.filename, msg.lineno,
  File "main.py", line 47, in warn_with_traceback
    traceback.print_stack(file=log)
/home/philip/projects/ltspice_examples_code_repo/Circuit-Completion-Using-GNNs/component_classification_with_link_prediction_head/evaluation/FEGIN/kernel/circuit_datasets.py:15: FutureWarning: You are using `torch.load` with `weights_only=False` (the current default value), which uses the default pickle module implicitly. It is possible to construct malicious pickle data which will execute arbitrary code during unpickling (See https://github.com/pytorch/pytorch/blob/main/SECURITY.md#untrusted-models for more details). In a future release, the default value for `weights_only` will be flipped to `True`. This limits the functions that could be executed during unpickling. Arbitrary objects will no longer be allowed to be loaded via this mode unless they are explicitly allowlisted by the user via `torch.serialization.add_safe_globals`. We recommend you start setting `weights_only=True` for any use case where you don't have full control of the loaded file. Please open an issue on GitHub for any issues related to this experimental feature.
  self.data, self.slices = torch.load(self.processed_paths[0])
