STDOUT:
Results will be saved in /home/philip/projects/ltspice_examples_code_repo/Circuit-Completion-Using-GNNs/component_classification_with_link_prediction_head/evaluation/FEGIN/results/model_FEGIN_dataset_ltspice_examples
Command line input: python main.py --data ltspice_examples --representation component_net --model FEGIN --layers 4 --hiddens 32 --batch_size 256 --lr 0.0001 --emb_size 128 --epochs 100 --save_appendix component_net_L4_H32_BS256_LR0.0001_E128 --no_val
 is saved.
-----
ltspice_examples - FEGIN
Using 4 layers, 32 hidden units, h = 2
Loading component_net representation dataset
ENTERED
Training FEGIN on component_net representation
Train: 3558, Test: 846
##################ITERATION #0 ****************************************
 epoch: 0, train_loss: 1.3614, test_loss: 1.3607, test_f1: 0.2270
 epoch: 1, train_loss: 1.3572, test_loss: 1.3602, test_f1: 0.2270
 epoch: 2, train_loss: 1.3549, test_loss: 1.3598, test_f1: 0.2270
 epoch: 3, train_loss: 1.3517, test_loss: 1.3572, test_f1: 0.2270
 epoch: 4, train_loss: 1.3491, test_loss: 1.3531, test_f1: 0.2270
 epoch: 5, train_loss: 1.3461, test_loss: 1.3482, test_f1: 0.2270
 epoch: 6, train_loss: 1.3440, test_loss: 1.3441, test_f1: 0.2270
 epoch: 7, train_loss: 1.3393, test_loss: 1.3404, test_f1: 0.2270
 epoch: 8, train_loss: 1.3358, test_loss: 1.3362, test_f1: 0.2270
 epoch: 9, train_loss: 1.3326, test_loss: 1.3315, test_f1: 0.2270
 epoch: 10, train_loss: 1.3285, test_loss: 1.3276, test_f1: 0.2270
 epoch: 11, train_loss: 1.3251, test_loss: 1.3244, test_f1: 0.2270
 epoch: 12, train_loss: 1.3210, test_loss: 1.3199, test_f1: 0.2270
 epoch: 13, train_loss: 1.3173, test_loss: 1.3150, test_f1: 0.2270
 epoch: 14, train_loss: 1.3135, test_loss: 1.3111, test_f1: 0.2270
 epoch: 15, train_loss: 1.3086, test_loss: 1.3076, test_f1: 0.2320
 epoch: 16, train_loss: 1.3055, test_loss: 1.3037, test_f1: 0.2320
 epoch: 17, train_loss: 1.3000, test_loss: 1.2996, test_f1: 0.2392
 epoch: 18, train_loss: 1.2970, test_loss: 1.2957, test_f1: 0.2461
 epoch: 19, train_loss: 1.2936, test_loss: 1.2917, test_f1: 0.2506
 epoch: 20, train_loss: 1.2890, test_loss: 1.2881, test_f1: 0.2549
 epoch: 21, train_loss: 1.2827, test_loss: 1.2842, test_f1: 0.2611
 epoch: 22, train_loss: 1.2810, test_loss: 1.2807, test_f1: 0.2677
 epoch: 23, train_loss: 1.2760, test_loss: 1.2759, test_f1: 0.2735
 epoch: 24, train_loss: 1.2709, test_loss: 1.2715, test_f1: 0.2806
 epoch: 25, train_loss: 1.2666, test_loss: 1.2671, test_f1: 0.2867
 epoch: 26, train_loss: 1.2604, test_loss: 1.2621, test_f1: 0.2916
 epoch: 27, train_loss: 1.2584, test_loss: 1.2576, test_f1: 0.2982
 epoch: 28, train_loss: 1.2537, test_loss: 1.2536, test_f1: 0.3044
 epoch: 29, train_loss: 1.2460, test_loss: 1.2479, test_f1: 0.3239
 epoch: 30, train_loss: 1.2425, test_loss: 1.2410, test_f1: 0.3294
 epoch: 31, train_loss: 1.2366, test_loss: 1.2352, test_f1: 0.3341
 epoch: 32, train_loss: 1.2307, test_loss: 1.2295, test_f1: 0.3405
 epoch: 33, train_loss: 1.2275, test_loss: 1.2237, test_f1: 0.3467
 epoch: 34, train_loss: 1.2209, test_loss: 1.2164, test_f1: 0.3466
 epoch: 35, train_loss: 1.2158, test_loss: 1.2091, test_f1: 0.3647
 epoch: 36, train_loss: 1.2131, test_loss: 1.2008, test_f1: 0.3753
 epoch: 37, train_loss: 1.2032, test_loss: 1.1932, test_f1: 0.3806
 epoch: 38, train_loss: 1.1971, test_loss: 1.1874, test_f1: 0.3849
 epoch: 39, train_loss: 1.1917, test_loss: 1.1791, test_f1: 0.3879
 epoch: 40, train_loss: 1.1851, test_loss: 1.1713, test_f1: 0.3934
 epoch: 41, train_loss: 1.1759, test_loss: 1.1635, test_f1: 0.3939
 epoch: 42, train_loss: 1.1700, test_loss: 1.1560, test_f1: 0.3988
 epoch: 43, train_loss: 1.1591, test_loss: 1.1487, test_f1: 0.4041
 epoch: 44, train_loss: 1.1531, test_loss: 1.1416, test_f1: 0.4091
 epoch: 45, train_loss: 1.1454, test_loss: 1.1314, test_f1: 0.4175
 epoch: 46, train_loss: 1.1445, test_loss: 1.1252, test_f1: 0.4226
 epoch: 47, train_loss: 1.1313, test_loss: 1.1161, test_f1: 0.4269
 epoch: 48, train_loss: 1.1238, test_loss: 1.1102, test_f1: 0.4325
 epoch: 49, train_loss: 1.1218, test_loss: 1.1024, test_f1: 0.4296
 epoch: 50, train_loss: 1.1140, test_loss: 1.0937, test_f1: 0.4333
 epoch: 51, train_loss: 1.1137, test_loss: 1.0911, test_f1: 0.4380
 epoch: 52, train_loss: 1.1078, test_loss: 1.0886, test_f1: 0.4448
 epoch: 53, train_loss: 1.1020, test_loss: 1.0834, test_f1: 0.4403
 epoch: 54, train_loss: 1.0980, test_loss: 1.0796, test_f1: 0.4403
 epoch: 55, train_loss: 1.1002, test_loss: 1.0760, test_f1: 0.4536
 epoch: 56, train_loss: 1.0941, test_loss: 1.0729, test_f1: 0.4476
 epoch: 57, train_loss: 1.0897, test_loss: 1.0694, test_f1: 0.4555
 epoch: 58, train_loss: 1.0833, test_loss: 1.0677, test_f1: 0.4534
 epoch: 59, train_loss: 1.0824, test_loss: 1.0629, test_f1: 0.4549
 epoch: 60, train_loss: 1.0785, test_loss: 1.0609, test_f1: 0.4633
 epoch: 61, train_loss: 1.0782, test_loss: 1.0567, test_f1: 0.4686
 epoch: 62, train_loss: 1.0727, test_loss: 1.0524, test_f1: 0.4654
 epoch: 63, train_loss: 1.0728, test_loss: 1.0499, test_f1: 0.4767
 epoch: 64, train_loss: 1.0706, test_loss: 1.0466, test_f1: 0.4807
 epoch: 65, train_loss: 1.0606, test_loss: 1.0438, test_f1: 0.4866
 epoch: 66, train_loss: 1.0557, test_loss: 1.0401, test_f1: 0.4794
 epoch: 67, train_loss: 1.0612, test_loss: 1.0382, test_f1: 0.4830
 epoch: 68, train_loss: 1.0600, test_loss: 1.0369, test_f1: 0.4912
 epoch: 69, train_loss: 1.0551, test_loss: 1.0317, test_f1: 0.4966
 epoch: 70, train_loss: 1.0545, test_loss: 1.0313, test_f1: 0.4931
 epoch: 71, train_loss: 1.0521, test_loss: 1.0275, test_f1: 0.4931
 epoch: 72, train_loss: 1.0504, test_loss: 1.0241, test_f1: 0.4929
 epoch: 73, train_loss: 1.0411, test_loss: 1.0226, test_f1: 0.4938
 epoch: 74, train_loss: 1.0392, test_loss: 1.0200, test_f1: 0.4926
 epoch: 75, train_loss: 1.0380, test_loss: 1.0185, test_f1: 0.4980
 epoch: 76, train_loss: 1.0376, test_loss: 1.0142, test_f1: 0.4968
 epoch: 77, train_loss: 1.0327, test_loss: 1.0108, test_f1: 0.4956
 epoch: 78, train_loss: 1.0293, test_loss: 1.0091, test_f1: 0.4980
 epoch: 79, train_loss: 1.0240, test_loss: 1.0066, test_f1: 0.4966
 epoch: 80, train_loss: 1.0254, test_loss: 1.0057, test_f1: 0.4987
 epoch: 81, train_loss: 1.0273, test_loss: 1.0037, test_f1: 0.4959
 epoch: 82, train_loss: 1.0227, test_loss: 1.0009, test_f1: 0.4903
 epoch: 83, train_loss: 1.0194, test_loss: 0.9955, test_f1: 0.5109
 epoch: 84, train_loss: 1.0147, test_loss: 0.9928, test_f1: 0.5070
 epoch: 85, train_loss: 1.0156, test_loss: 0.9919, test_f1: 0.4994
 epoch: 86, train_loss: 1.0056, test_loss: 0.9887, test_f1: 0.5010
 epoch: 87, train_loss: 1.0121, test_loss: 0.9857, test_f1: 0.5002
 epoch: 88, train_loss: 1.0075, test_loss: 0.9835, test_f1: 0.5040
 epoch: 89, train_loss: 1.0112, test_loss: 0.9835, test_f1: 0.5076
 epoch: 90, train_loss: 0.9992, test_loss: 0.9815, test_f1: 0.5059
 epoch: 91, train_loss: 0.9983, test_loss: 0.9803, test_f1: 0.5068
 epoch: 92, train_loss: 0.9980, test_loss: 0.9796, test_f1: 0.5049
 epoch: 93, train_loss: 0.9947, test_loss: 0.9765, test_f1: 0.5082
 epoch: 94, train_loss: 0.9978, test_loss: 0.9762, test_f1: 0.5036
 epoch: 95, train_loss: 0.9888, test_loss: 0.9740, test_f1: 0.5069
 epoch: 96, train_loss: 0.9905, test_loss: 0.9686, test_f1: 0.5051
 epoch: 97, train_loss: 0.9817, test_loss: 0.9695, test_f1: 0.5086
 epoch: 98, train_loss: 0.9859, test_loss: 0.9664, test_f1: 0.5078
 epoch: 99, train_loss: 0.9825, test_loss: 0.9654, test_f1: 0.5032
##################ITERATION #1 ****************************************
 epoch: 0, train_loss: 1.3273, test_loss: 1.3359, test_f1: 0.2270
 epoch: 1, train_loss: 1.3199, test_loss: 1.3310, test_f1: 0.2270
 epoch: 2, train_loss: 1.3163, test_loss: 1.3251, test_f1: 0.2270
 epoch: 3, train_loss: 1.3114, test_loss: 1.3186, test_f1: 0.2270
 epoch: 4, train_loss: 1.3067, test_loss: 1.3135, test_f1: 0.2270
 epoch: 5, train_loss: 1.3008, test_loss: 1.3075, test_f1: 0.2270
 epoch: 6, train_loss: 1.2971, test_loss: 1.3016, test_f1: 0.2270
 epoch: 7, train_loss: 1.2912, test_loss: 1.2957, test_f1: 0.2270
 epoch: 8, train_loss: 1.2840, test_loss: 1.2899, test_f1: 0.2270
 epoch: 9, train_loss: 1.2804, test_loss: 1.2838, test_f1: 0.2270
 epoch: 10, train_loss: 1.2760, test_loss: 1.2783, test_f1: 0.2270
 epoch: 11, train_loss: 1.2681, test_loss: 1.2722, test_f1: 0.2270
 epoch: 12, train_loss: 1.2657, test_loss: 1.2662, test_f1: 0.2270
 epoch: 13, train_loss: 1.2604, test_loss: 1.2602, test_f1: 0.2270
 epoch: 14, train_loss: 1.2540, test_loss: 1.2544, test_f1: 0.2270
 epoch: 15, train_loss: 1.2501, test_loss: 1.2483, test_f1: 0.2270
 epoch: 16, train_loss: 1.2423, test_loss: 1.2424, test_f1: 0.2270
 epoch: 17, train_loss: 1.2378, test_loss: 1.2365, test_f1: 0.2484
 epoch: 18, train_loss: 1.2355, test_loss: 1.2303, test_f1: 0.2549
 epoch: 19, train_loss: 1.2275, test_loss: 1.2245, test_f1: 0.2709
 epoch: 20, train_loss: 1.2267, test_loss: 1.2195, test_f1: 0.2747
 epoch: 21, train_loss: 1.2213, test_loss: 1.2139, test_f1: 0.2783
 epoch: 22, train_loss: 1.2168, test_loss: 1.2085, test_f1: 0.2819
 epoch: 23, train_loss: 1.2121, test_loss: 1.2028, test_f1: 0.2853
 epoch: 24, train_loss: 1.2025, test_loss: 1.1954, test_f1: 0.2963
 epoch: 25, train_loss: 1.1979, test_loss: 1.1906, test_f1: 0.3337
 epoch: 26, train_loss: 1.1955, test_loss: 1.1850, test_f1: 0.3487
 epoch: 27, train_loss: 1.1924, test_loss: 1.1792, test_f1: 0.3500
 epoch: 28, train_loss: 1.1856, test_loss: 1.1725, test_f1: 0.3700
 epoch: 29, train_loss: 1.1820, test_loss: 1.1663, test_f1: 0.3863
 epoch: 30, train_loss: 1.1717, test_loss: 1.1601, test_f1: 0.4069
 epoch: 31, train_loss: 1.1661, test_loss: 1.1533, test_f1: 0.4121
 epoch: 32, train_loss: 1.1625, test_loss: 1.1463, test_f1: 0.4126
 epoch: 33, train_loss: 1.1606, test_loss: 1.1380, test_f1: 0.4252
 epoch: 34, train_loss: 1.1550, test_loss: 1.1309, test_f1: 0.4309
 epoch: 35, train_loss: 1.1402, test_loss: 1.1239, test_f1: 0.4476
 epoch: 36, train_loss: 1.1367, test_loss: 1.1166, test_f1: 0.4538
 epoch: 37, train_loss: 1.1344, test_loss: 1.1084, test_f1: 0.4595
 epoch: 38, train_loss: 1.1237, test_loss: 1.1008, test_f1: 0.4630
 epoch: 39, train_loss: 1.1172, test_loss: 1.0949, test_f1: 0.4646
 epoch: 40, train_loss: 1.1089, test_loss: 1.0859, test_f1: 0.4727
 epoch: 41, train_loss: 1.1124, test_loss: 1.0837, test_f1: 0.4679
 epoch: 42, train_loss: 1.0995, test_loss: 1.0725, test_f1: 0.4771
 epoch: 43, train_loss: 1.0923, test_loss: 1.0660, test_f1: 0.4785
 epoch: 44, train_loss: 1.0863, test_loss: 1.0617, test_f1: 0.4767
 epoch: 45, train_loss: 1.0792, test_loss: 1.0550, test_f1: 0.4870
 epoch: 46, train_loss: 1.0750, test_loss: 1.0475, test_f1: 0.4860
 epoch: 47, train_loss: 1.0658, test_loss: 1.0453, test_f1: 0.4870
 epoch: 48, train_loss: 1.0620, test_loss: 1.0365, test_f1: 0.4815
 epoch: 49, train_loss: 1.0545, test_loss: 1.0326, test_f1: 0.4785
 epoch: 50, train_loss: 1.0495, test_loss: 1.0237, test_f1: 0.4883
 epoch: 51, train_loss: 1.0433, test_loss: 1.0204, test_f1: 0.4887
 epoch: 52, train_loss: 1.0376, test_loss: 1.0205, test_f1: 0.4851
 epoch: 53, train_loss: 1.0340, test_loss: 1.0185, test_f1: 0.4830
 epoch: 54, train_loss: 1.0365, test_loss: 1.0124, test_f1: 0.4824
 epoch: 55, train_loss: 1.0278, test_loss: 1.0118, test_f1: 0.4849
 epoch: 56, train_loss: 1.0297, test_loss: 1.0092, test_f1: 0.4843
 epoch: 57, train_loss: 1.0285, test_loss: 1.0087, test_f1: 0.4832
 epoch: 58, train_loss: 1.0206, test_loss: 1.0041, test_f1: 0.4848
 epoch: 59, train_loss: 1.0200, test_loss: 1.0028, test_f1: 0.4833
 epoch: 60, train_loss: 1.0102, test_loss: 1.0008, test_f1: 0.4800
 epoch: 61, train_loss: 1.0104, test_loss: 0.9955, test_f1: 0.4821
 epoch: 62, train_loss: 1.0135, test_loss: 0.9972, test_f1: 0.4832
 epoch: 63, train_loss: 1.0001, test_loss: 0.9979, test_f1: 0.4844
 epoch: 64, train_loss: 1.0065, test_loss: 0.9911, test_f1: 0.4871
 epoch: 65, train_loss: 0.9961, test_loss: 0.9895, test_f1: 0.4865
 epoch: 66, train_loss: 0.9977, test_loss: 0.9879, test_f1: 0.4876
 epoch: 67, train_loss: 0.9993, test_loss: 0.9847, test_f1: 0.4849
 epoch: 68, train_loss: 0.9988, test_loss: 0.9862, test_f1: 0.4929
 epoch: 69, train_loss: 0.9960, test_loss: 0.9853, test_f1: 0.4864
 epoch: 70, train_loss: 0.9918, test_loss: 0.9830, test_f1: 0.4817
 epoch: 71, train_loss: 0.9874, test_loss: 0.9842, test_f1: 0.4942
 epoch: 72, train_loss: 0.9873, test_loss: 0.9833, test_f1: 0.4888
 epoch: 73, train_loss: 0.9798, test_loss: 0.9763, test_f1: 0.4928
 epoch: 74, train_loss: 0.9768, test_loss: 0.9788, test_f1: 0.4904
 epoch: 75, train_loss: 0.9849, test_loss: 0.9810, test_f1: 0.4891
 epoch: 76, train_loss: 0.9752, test_loss: 0.9766, test_f1: 0.4856
 epoch: 77, train_loss: 0.9772, test_loss: 0.9740, test_f1: 0.4819
 epoch: 78, train_loss: 0.9817, test_loss: 0.9733, test_f1: 0.4893
 epoch: 79, train_loss: 0.9698, test_loss: 0.9657, test_f1: 0.4930
 epoch: 80, train_loss: 0.9760, test_loss: 0.9677, test_f1: 0.4949
 epoch: 81, train_loss: 0.9690, test_loss: 0.9682, test_f1: 0.4907
 epoch: 82, train_loss: 0.9667, test_loss: 0.9668, test_f1: 0.4871
 epoch: 83, train_loss: 0.9570, test_loss: 0.9652, test_f1: 0.4904
 epoch: 84, train_loss: 0.9664, test_loss: 0.9658, test_f1: 0.4856
 epoch: 85, train_loss: 0.9646, test_loss: 0.9702, test_f1: 0.4910
 epoch: 86, train_loss: 0.9594, test_loss: 0.9627, test_f1: 0.4839
 epoch: 87, train_loss: 0.9635, test_loss: 0.9590, test_f1: 0.4832
 epoch: 88, train_loss: 0.9570, test_loss: 0.9556, test_f1: 0.4867
 epoch: 89, train_loss: 0.9563, test_loss: 0.9627, test_f1: 0.4851
 epoch: 90, train_loss: 0.9497, test_loss: 0.9578, test_f1: 0.4845
 epoch: 91, train_loss: 0.9526, test_loss: 0.9544, test_f1: 0.4872
 epoch: 92, train_loss: 0.9414, test_loss: 0.9647, test_f1: 0.4824
 epoch: 93, train_loss: 0.9511, test_loss: 0.9626, test_f1: 0.4831
 epoch: 94, train_loss: 0.9465, test_loss: 0.9555, test_f1: 0.4893
 epoch: 95, train_loss: 0.9404, test_loss: 0.9491, test_f1: 0.4856
 epoch: 96, train_loss: 0.9429, test_loss: 0.9473, test_f1: 0.4871
 epoch: 97, train_loss: 0.9437, test_loss: 0.9478, test_f1: 0.4868
 epoch: 98, train_loss: 0.9373, test_loss: 0.9459, test_f1: 0.4887
 epoch: 99, train_loss: 0.9371, test_loss: 0.9480, test_f1: 0.4897
##################ITERATION #2 ****************************************
 epoch: 0, train_loss: 1.3191, test_loss: 1.3269, test_f1: 0.2270
 epoch: 1, train_loss: 1.3082, test_loss: 1.3249, test_f1: 0.2270
 epoch: 2, train_loss: 1.2993, test_loss: 1.3161, test_f1: 0.2270
 epoch: 3, train_loss: 1.2878, test_loss: 1.3046, test_f1: 0.2270
 epoch: 4, train_loss: 1.2839, test_loss: 1.2934, test_f1: 0.2270
 epoch: 5, train_loss: 1.2770, test_loss: 1.2819, test_f1: 0.2696
 epoch: 6, train_loss: 1.2704, test_loss: 1.2604, test_f1: 0.3115
 epoch: 7, train_loss: 1.2603, test_loss: 1.2453, test_f1: 0.3194
 epoch: 8, train_loss: 1.2558, test_loss: 1.2351, test_f1: 0.3281
 epoch: 9, train_loss: 1.2466, test_loss: 1.2287, test_f1: 0.3360
 epoch: 10, train_loss: 1.2393, test_loss: 1.2198, test_f1: 0.3431
 epoch: 11, train_loss: 1.2364, test_loss: 1.2133, test_f1: 0.3498
 epoch: 12, train_loss: 1.2301, test_loss: 1.2066, test_f1: 0.3560
 epoch: 13, train_loss: 1.2241, test_loss: 1.1996, test_f1: 0.3612
 epoch: 14, train_loss: 1.2172, test_loss: 1.1929, test_f1: 0.3653
 epoch: 15, train_loss: 1.2174, test_loss: 1.1875, test_f1: 0.3661
 epoch: 16, train_loss: 1.2084, test_loss: 1.1844, test_f1: 0.3654
 epoch: 17, train_loss: 1.2035, test_loss: 1.1776, test_f1: 0.3655
 epoch: 18, train_loss: 1.1948, test_loss: 1.1710, test_f1: 0.3694
 epoch: 19, train_loss: 1.1959, test_loss: 1.1674, test_f1: 0.3713
 epoch: 20, train_loss: 1.1860, test_loss: 1.1615, test_f1: 0.3774
 epoch: 21, train_loss: 1.1806, test_loss: 1.1536, test_f1: 0.3797
 epoch: 22, train_loss: 1.1824, test_loss: 1.1495, test_f1: 0.3812
 epoch: 23, train_loss: 1.1722, test_loss: 1.1460, test_f1: 0.3827
 epoch: 24, train_loss: 1.1709, test_loss: 1.1451, test_f1: 0.3873
 epoch: 25, train_loss: 1.1619, test_loss: 1.1378, test_f1: 0.3961
 epoch: 26, train_loss: 1.1595, test_loss: 1.1326, test_f1: 0.4121
 epoch: 27, train_loss: 1.1548, test_loss: 1.1273, test_f1: 0.4143
 epoch: 28, train_loss: 1.1510, test_loss: 1.1238, test_f1: 0.4154
 epoch: 29, train_loss: 1.1513, test_loss: 1.1196, test_f1: 0.4187
 epoch: 30, train_loss: 1.1398, test_loss: 1.1142, test_f1: 0.4228
 epoch: 31, train_loss: 1.1382, test_loss: 1.1076, test_f1: 0.4355
 epoch: 32, train_loss: 1.1300, test_loss: 1.1038, test_f1: 0.4358
 epoch: 33, train_loss: 1.1229, test_loss: 1.1010, test_f1: 0.4401
 epoch: 34, train_loss: 1.1210, test_loss: 1.0945, test_f1: 0.4429
 epoch: 35, train_loss: 1.1207, test_loss: 1.0903, test_f1: 0.4445
 epoch: 36, train_loss: 1.1201, test_loss: 1.0872, test_f1: 0.4506
 epoch: 37, train_loss: 1.1159, test_loss: 1.0809, test_f1: 0.4560
 epoch: 38, train_loss: 1.1118, test_loss: 1.0761, test_f1: 0.4609
 epoch: 39, train_loss: 1.1071, test_loss: 1.0762, test_f1: 0.4622
 epoch: 40, train_loss: 1.1003, test_loss: 1.0683, test_f1: 0.4577
 epoch: 41, train_loss: 1.0941, test_loss: 1.0650, test_f1: 0.4643
 epoch: 42, train_loss: 1.0865, test_loss: 1.0599, test_f1: 0.4701
 epoch: 43, train_loss: 1.0823, test_loss: 1.0553, test_f1: 0.4695
 epoch: 44, train_loss: 1.0812, test_loss: 1.0504, test_f1: 0.4684
 epoch: 45, train_loss: 1.0778, test_loss: 1.0462, test_f1: 0.4724
 epoch: 46, train_loss: 1.0693, test_loss: 1.0424, test_f1: 0.4724
 epoch: 47, train_loss: 1.0698, test_loss: 1.0427, test_f1: 0.4737
 epoch: 48, train_loss: 1.0600, test_loss: 1.0387, test_f1: 0.4707
 epoch: 49, train_loss: 1.0568, test_loss: 1.0348, test_f1: 0.4693
 epoch: 50, train_loss: 1.0568, test_loss: 1.0323, test_f1: 0.4685
 epoch: 51, train_loss: 1.0470, test_loss: 1.0290, test_f1: 0.4764
 epoch: 52, train_loss: 1.0510, test_loss: 1.0278, test_f1: 0.4648
 epoch: 53, train_loss: 1.0465, test_loss: 1.0273, test_f1: 0.4716
 epoch: 54, train_loss: 1.0434, test_loss: 1.0253, test_f1: 0.4780
 epoch: 55, train_loss: 1.0445, test_loss: 1.0234, test_f1: 0.4766
 epoch: 56, train_loss: 1.0388, test_loss: 1.0232, test_f1: 0.4787
 epoch: 57, train_loss: 1.0346, test_loss: 1.0216, test_f1: 0.4778
 epoch: 58, train_loss: 1.0369, test_loss: 1.0204, test_f1: 0.4787
 epoch: 59, train_loss: 1.0361, test_loss: 1.0194, test_f1: 0.4765
 epoch: 60, train_loss: 1.0307, test_loss: 1.0177, test_f1: 0.4752
 epoch: 61, train_loss: 1.0287, test_loss: 1.0171, test_f1: 0.4759
 epoch: 62, train_loss: 1.0277, test_loss: 1.0166, test_f1: 0.4805
 epoch: 63, train_loss: 1.0307, test_loss: 1.0149, test_f1: 0.4781
 epoch: 64, train_loss: 1.0242, test_loss: 1.0142, test_f1: 0.4730
 epoch: 65, train_loss: 1.0188, test_loss: 1.0123, test_f1: 0.4736
 epoch: 66, train_loss: 1.0192, test_loss: 1.0120, test_f1: 0.4773
 epoch: 67, train_loss: 1.0171, test_loss: 1.0108, test_f1: 0.4800
 epoch: 68, train_loss: 1.0173, test_loss: 1.0079, test_f1: 0.4844
 epoch: 69, train_loss: 1.0195, test_loss: 1.0071, test_f1: 0.4844
 epoch: 70, train_loss: 1.0135, test_loss: 1.0065, test_f1: 0.4819
 epoch: 71, train_loss: 1.0062, test_loss: 1.0055, test_f1: 0.4822
 epoch: 72, train_loss: 1.0107, test_loss: 1.0046, test_f1: 0.4828
 epoch: 73, train_loss: 1.0056, test_loss: 1.0041, test_f1: 0.4828
 epoch: 74, train_loss: 1.0048, test_loss: 1.0034, test_f1: 0.4792
 epoch: 75, train_loss: 1.0049, test_loss: 1.0026, test_f1: 0.4862
 epoch: 76, train_loss: 1.0043, test_loss: 1.0021, test_f1: 0.4831
 epoch: 77, train_loss: 1.0048, test_loss: 1.0006, test_f1: 0.4821
 epoch: 78, train_loss: 0.9983, test_loss: 1.0006, test_f1: 0.4867
 epoch: 79, train_loss: 1.0081, test_loss: 0.9982, test_f1: 0.4865
 epoch: 80, train_loss: 0.9944, test_loss: 0.9976, test_f1: 0.4874
 epoch: 81, train_loss: 0.9959, test_loss: 0.9971, test_f1: 0.4842
 epoch: 82, train_loss: 0.9962, test_loss: 0.9968, test_f1: 0.4949
 epoch: 83, train_loss: 0.9898, test_loss: 0.9968, test_f1: 0.4896
 epoch: 84, train_loss: 0.9936, test_loss: 0.9952, test_f1: 0.4870
 epoch: 85, train_loss: 0.9817, test_loss: 0.9935, test_f1: 0.4891
 epoch: 86, train_loss: 0.9940, test_loss: 0.9930, test_f1: 0.4927
 epoch: 87, train_loss: 0.9885, test_loss: 0.9923, test_f1: 0.4921
 epoch: 88, train_loss: 0.9891, test_loss: 0.9908, test_f1: 0.4910
 epoch: 89, train_loss: 0.9872, test_loss: 0.9903, test_f1: 0.4931
 epoch: 90, train_loss: 0.9804, test_loss: 0.9911, test_f1: 0.4835
 epoch: 91, train_loss: 0.9852, test_loss: 0.9909, test_f1: 0.4859
 epoch: 92, train_loss: 0.9843, test_loss: 0.9895, test_f1: 0.4919
 epoch: 93, train_loss: 0.9853, test_loss: 0.9874, test_f1: 0.4941
 epoch: 94, train_loss: 0.9809, test_loss: 0.9851, test_f1: 0.4968
 epoch: 95, train_loss: 0.9804, test_loss: 0.9858, test_f1: 0.4937
 epoch: 96, train_loss: 0.9861, test_loss: 0.9856, test_f1: 0.4864
 epoch: 97, train_loss: 0.9766, test_loss: 0.9844, test_f1: 0.4845
 epoch: 98, train_loss: 0.9742, test_loss: 0.9846, test_f1: 0.4891
 epoch: 99, train_loss: 0.9744, test_loss: 0.9835, test_f1: 0.4876
##################ITERATION #3 ****************************************
 epoch: 0, train_loss: 1.3124, test_loss: 1.3197, test_f1: 0.2270
 epoch: 1, train_loss: 1.2943, test_loss: 1.3190, test_f1: 0.2270
 epoch: 2, train_loss: 1.2856, test_loss: 1.3096, test_f1: 0.2270
 epoch: 3, train_loss: 1.2769, test_loss: 1.2908, test_f1: 0.2270
 epoch: 4, train_loss: 1.2668, test_loss: 1.2724, test_f1: 0.2270
 epoch: 5, train_loss: 1.2604, test_loss: 1.2547, test_f1: 0.2295
 epoch: 6, train_loss: 1.2512, test_loss: 1.2393, test_f1: 0.2487
 epoch: 7, train_loss: 1.2423, test_loss: 1.2280, test_f1: 0.2698
 epoch: 8, train_loss: 1.2365, test_loss: 1.2205, test_f1: 0.2737
 epoch: 9, train_loss: 1.2291, test_loss: 1.2131, test_f1: 0.2861
 epoch: 10, train_loss: 1.2215, test_loss: 1.2063, test_f1: 0.3079
 epoch: 11, train_loss: 1.2134, test_loss: 1.1981, test_f1: 0.3297
 epoch: 12, train_loss: 1.2074, test_loss: 1.1912, test_f1: 0.3534
 epoch: 13, train_loss: 1.2023, test_loss: 1.1811, test_f1: 0.3697
 epoch: 14, train_loss: 1.1910, test_loss: 1.1724, test_f1: 0.3830
 epoch: 15, train_loss: 1.1841, test_loss: 1.1648, test_f1: 0.3994
 epoch: 16, train_loss: 1.1762, test_loss: 1.1571, test_f1: 0.4081
 epoch: 17, train_loss: 1.1668, test_loss: 1.1496, test_f1: 0.4160
 epoch: 18, train_loss: 1.1629, test_loss: 1.1400, test_f1: 0.4209
 epoch: 19, train_loss: 1.1598, test_loss: 1.1326, test_f1: 0.4225
 epoch: 20, train_loss: 1.1502, test_loss: 1.1249, test_f1: 0.4233
 epoch: 21, train_loss: 1.1432, test_loss: 1.1185, test_f1: 0.4317
 epoch: 22, train_loss: 1.1322, test_loss: 1.1096, test_f1: 0.4453
 epoch: 23, train_loss: 1.1282, test_loss: 1.1020, test_f1: 0.4467
 epoch: 24, train_loss: 1.1181, test_loss: 1.0927, test_f1: 0.4487
 epoch: 25, train_loss: 1.1140, test_loss: 1.0855, test_f1: 0.4486
 epoch: 26, train_loss: 1.1074, test_loss: 1.0797, test_f1: 0.4461
 epoch: 27, train_loss: 1.1000, test_loss: 1.0720, test_f1: 0.4488
 epoch: 28, train_loss: 1.0959, test_loss: 1.0653, test_f1: 0.4351
 epoch: 29, train_loss: 1.0867, test_loss: 1.0593, test_f1: 0.4418
 epoch: 30, train_loss: 1.0818, test_loss: 1.0534, test_f1: 0.4413
 epoch: 31, train_loss: 1.0733, test_loss: 1.0469, test_f1: 0.4456
 epoch: 32, train_loss: 1.0681, test_loss: 1.0435, test_f1: 0.4433
 epoch: 33, train_loss: 1.0664, test_loss: 1.0375, test_f1: 0.4484
 epoch: 34, train_loss: 1.0567, test_loss: 1.0323, test_f1: 0.4530
 epoch: 35, train_loss: 1.0523, test_loss: 1.0224, test_f1: 0.4566
 epoch: 36, train_loss: 1.0411, test_loss: 1.0220, test_f1: 0.4604
 epoch: 37, train_loss: 1.0396, test_loss: 1.0186, test_f1: 0.4604
 epoch: 38, train_loss: 1.0242, test_loss: 1.0115, test_f1: 0.4646
 epoch: 39, train_loss: 1.0250, test_loss: 1.0063, test_f1: 0.4603
 epoch: 40, train_loss: 1.0212, test_loss: 1.0063, test_f1: 0.4617
 epoch: 41, train_loss: 1.0100, test_loss: 1.0034, test_f1: 0.4707
 epoch: 42, train_loss: 1.0131, test_loss: 0.9969, test_f1: 0.4684
 epoch: 43, train_loss: 1.0111, test_loss: 0.9983, test_f1: 0.4771
 epoch: 44, train_loss: 0.9948, test_loss: 0.9951, test_f1: 0.4697
 epoch: 45, train_loss: 0.9991, test_loss: 0.9913, test_f1: 0.4657
 epoch: 46, train_loss: 0.9907, test_loss: 0.9893, test_f1: 0.4673
 epoch: 47, train_loss: 0.9916, test_loss: 0.9847, test_f1: 0.4722
 epoch: 48, train_loss: 0.9915, test_loss: 0.9817, test_f1: 0.4750
 epoch: 49, train_loss: 0.9806, test_loss: 0.9811, test_f1: 0.4706
 epoch: 50, train_loss: 0.9790, test_loss: 0.9786, test_f1: 0.4691
 epoch: 51, train_loss: 0.9770, test_loss: 0.9761, test_f1: 0.4699
 epoch: 52, train_loss: 0.9734, test_loss: 0.9770, test_f1: 0.4731
 epoch: 53, train_loss: 0.9698, test_loss: 0.9753, test_f1: 0.4773
 epoch: 54, train_loss: 0.9655, test_loss: 0.9763, test_f1: 0.4762
 epoch: 55, train_loss: 0.9619, test_loss: 0.9726, test_f1: 0.4701
 epoch: 56, train_loss: 0.9742, test_loss: 0.9730, test_f1: 0.4790
 epoch: 57, train_loss: 0.9622, test_loss: 0.9709, test_f1: 0.4738
 epoch: 58, train_loss: 0.9665, test_loss: 0.9697, test_f1: 0.4780
 epoch: 59, train_loss: 0.9604, test_loss: 0.9699, test_f1: 0.4763
 epoch: 60, train_loss: 0.9615, test_loss: 0.9698, test_f1: 0.4787
 epoch: 61, train_loss: 0.9605, test_loss: 0.9702, test_f1: 0.4814
 epoch: 62, train_loss: 0.9613, test_loss: 0.9665, test_f1: 0.4780
 epoch: 63, train_loss: 0.9542, test_loss: 0.9685, test_f1: 0.4795
 epoch: 64, train_loss: 0.9520, test_loss: 0.9665, test_f1: 0.4811
 epoch: 65, train_loss: 0.9494, test_loss: 0.9655, test_f1: 0.4843
 epoch: 66, train_loss: 0.9506, test_loss: 0.9650, test_f1: 0.4877
 epoch: 67, train_loss: 0.9444, test_loss: 0.9596, test_f1: 0.4835
 epoch: 68, train_loss: 0.9511, test_loss: 0.9667, test_f1: 0.4851
 epoch: 69, train_loss: 0.9409, test_loss: 0.9675, test_f1: 0.4828
 epoch: 70, train_loss: 0.9437, test_loss: 0.9662, test_f1: 0.4816
 epoch: 71, train_loss: 0.9347, test_loss: 0.9633, test_f1: 0.4819
 epoch: 72, train_loss: 0.9424, test_loss: 0.9703, test_f1: 0.4858
 epoch: 73, train_loss: 0.9415, test_loss: 0.9679, test_f1: 0.4831
 epoch: 74, train_loss: 0.9421, test_loss: 0.9704, test_f1: 0.4878
 epoch: 75, train_loss: 0.9438, test_loss: 0.9637, test_f1: 0.4843
 epoch: 76, train_loss: 0.9389, test_loss: 0.9629, test_f1: 0.4888
 epoch: 77, train_loss: 0.9306, test_loss: 0.9635, test_f1: 0.4893
 epoch: 78, train_loss: 0.9365, test_loss: 0.9649, test_f1: 0.4920
 epoch: 79, train_loss: 0.9318, test_loss: 0.9650, test_f1: 0.4937
 epoch: 80, train_loss: 0.9283, test_loss: 0.9643, test_f1: 0.4884
 epoch: 81, train_loss: 0.9332, test_loss: 0.9625, test_f1: 0.4904
 epoch: 82, train_loss: 0.9254, test_loss: 0.9576, test_f1: 0.5040
 epoch: 83, train_loss: 0.9295, test_loss: 0.9642, test_f1: 0.5038
 epoch: 84, train_loss: 0.9225, test_loss: 0.9603, test_f1: 0.5040
 epoch: 85, train_loss: 0.9172, test_loss: 0.9606, test_f1: 0.5006
 epoch: 86, train_loss: 0.9150, test_loss: 0.9553, test_f1: 0.5064
 epoch: 87, train_loss: 0.9139, test_loss: 0.9611, test_f1: 0.5034
 epoch: 88, train_loss: 0.9218, test_loss: 0.9578, test_f1: 0.5026
 epoch: 89, train_loss: 0.9127, test_loss: 0.9497, test_f1: 0.5020
 epoch: 90, train_loss: 0.9151, test_loss: 0.9502, test_f1: 0.5022
 epoch: 91, train_loss: 0.9261, test_loss: 0.9556, test_f1: 0.5084
 epoch: 92, train_loss: 0.9161, test_loss: 0.9558, test_f1: 0.5073
 epoch: 93, train_loss: 0.9138, test_loss: 0.9537, test_f1: 0.5061
 epoch: 94, train_loss: 0.9121, test_loss: 0.9558, test_f1: 0.5032
 epoch: 95, train_loss: 0.9146, test_loss: 0.9567, test_f1: 0.5014
 epoch: 96, train_loss: 0.9044, test_loss: 0.9517, test_f1: 0.5078
 epoch: 97, train_loss: 0.9069, test_loss: 0.9474, test_f1: 0.5052
 epoch: 98, train_loss: 0.9052, test_loss: 0.9470, test_f1: 0.5074
 epoch: 99, train_loss: 0.9068, test_loss: 0.9506, test_f1: 0.5078
##################ITERATION #4 ****************************************
 epoch: 0, train_loss: 1.3039, test_loss: 1.3165, test_f1: 0.2270
 epoch: 1, train_loss: 1.2784, test_loss: 1.3073, test_f1: 0.2270
 epoch: 2, train_loss: 1.2654, test_loss: 1.2901, test_f1: 0.2270
 epoch: 3, train_loss: 1.2576, test_loss: 1.2663, test_f1: 0.2270
 epoch: 4, train_loss: 1.2470, test_loss: 1.2441, test_f1: 0.2374
 epoch: 5, train_loss: 1.2411, test_loss: 1.2210, test_f1: 0.2721
 epoch: 6, train_loss: 1.2365, test_loss: 1.2058, test_f1: 0.2912
 epoch: 7, train_loss: 1.2263, test_loss: 1.1961, test_f1: 0.3044
 epoch: 8, train_loss: 1.2208, test_loss: 1.1883, test_f1: 0.3084
 epoch: 9, train_loss: 1.2159, test_loss: 1.1797, test_f1: 0.3125
 epoch: 10, train_loss: 1.2101, test_loss: 1.1716, test_f1: 0.3278
 epoch: 11, train_loss: 1.2058, test_loss: 1.1636, test_f1: 0.3354
 epoch: 12, train_loss: 1.1938, test_loss: 1.1582, test_f1: 0.3487
 epoch: 13, train_loss: 1.1920, test_loss: 1.1508, test_f1: 0.3738
 epoch: 14, train_loss: 1.1860, test_loss: 1.1423, test_f1: 0.3806
 epoch: 15, train_loss: 1.1717, test_loss: 1.1347, test_f1: 0.3810
 epoch: 16, train_loss: 1.1606, test_loss: 1.1305, test_f1: 0.4063
 epoch: 17, train_loss: 1.1599, test_loss: 1.1240, test_f1: 0.4129
 epoch: 18, train_loss: 1.1574, test_loss: 1.1155, test_f1: 0.4085
 epoch: 19, train_loss: 1.1435, test_loss: 1.1066, test_f1: 0.4129
 epoch: 20, train_loss: 1.1427, test_loss: 1.0991, test_f1: 0.4163
 epoch: 21, train_loss: 1.1360, test_loss: 1.0923, test_f1: 0.4212
 epoch: 22, train_loss: 1.1264, test_loss: 1.0875, test_f1: 0.4348
 epoch: 23, train_loss: 1.1204, test_loss: 1.0797, test_f1: 0.4494
 epoch: 24, train_loss: 1.1151, test_loss: 1.0724, test_f1: 0.4536
 epoch: 25, train_loss: 1.1118, test_loss: 1.0665, test_f1: 0.4617
 epoch: 26, train_loss: 1.0965, test_loss: 1.0594, test_f1: 0.4519
 epoch: 27, train_loss: 1.0911, test_loss: 1.0551, test_f1: 0.4527
 epoch: 28, train_loss: 1.0912, test_loss: 1.0480, test_f1: 0.4555
 epoch: 29, train_loss: 1.0817, test_loss: 1.0444, test_f1: 0.4610
 epoch: 30, train_loss: 1.0777, test_loss: 1.0367, test_f1: 0.4640
 epoch: 31, train_loss: 1.0615, test_loss: 1.0312, test_f1: 0.4631
 epoch: 32, train_loss: 1.0586, test_loss: 1.0206, test_f1: 0.4690
 epoch: 33, train_loss: 1.0536, test_loss: 1.0162, test_f1: 0.4672
 epoch: 34, train_loss: 1.0447, test_loss: 1.0136, test_f1: 0.4613
 epoch: 35, train_loss: 1.0384, test_loss: 1.0071, test_f1: 0.4623
 epoch: 36, train_loss: 1.0377, test_loss: 1.0009, test_f1: 0.4678
 epoch: 37, train_loss: 1.0291, test_loss: 0.9970, test_f1: 0.4648
 epoch: 38, train_loss: 1.0273, test_loss: 0.9919, test_f1: 0.4692
 epoch: 39, train_loss: 1.0208, test_loss: 0.9881, test_f1: 0.4725
 epoch: 40, train_loss: 1.0200, test_loss: 0.9904, test_f1: 0.4747
 epoch: 41, train_loss: 1.0187, test_loss: 0.9810, test_f1: 0.4793
 epoch: 42, train_loss: 1.0104, test_loss: 0.9764, test_f1: 0.4847
 epoch: 43, train_loss: 0.9967, test_loss: 0.9737, test_f1: 0.4757
 epoch: 44, train_loss: 1.0010, test_loss: 0.9679, test_f1: 0.4811
 epoch: 45, train_loss: 0.9986, test_loss: 0.9658, test_f1: 0.4829
 epoch: 46, train_loss: 0.9922, test_loss: 0.9641, test_f1: 0.4905
 epoch: 47, train_loss: 0.9794, test_loss: 0.9624, test_f1: 0.4873
 epoch: 48, train_loss: 0.9858, test_loss: 0.9589, test_f1: 0.4836
 epoch: 49, train_loss: 0.9758, test_loss: 0.9592, test_f1: 0.4901
 epoch: 50, train_loss: 0.9750, test_loss: 0.9626, test_f1: 0.4867
 epoch: 51, train_loss: 0.9705, test_loss: 0.9528, test_f1: 0.4888
 epoch: 52, train_loss: 0.9770, test_loss: 0.9537, test_f1: 0.4941
 epoch: 53, train_loss: 0.9662, test_loss: 0.9528, test_f1: 0.4923
 epoch: 54, train_loss: 0.9531, test_loss: 0.9517, test_f1: 0.4917
 epoch: 55, train_loss: 0.9709, test_loss: 0.9487, test_f1: 0.4971
 epoch: 56, train_loss: 0.9682, test_loss: 0.9474, test_f1: 0.4961
 epoch: 57, train_loss: 0.9607, test_loss: 0.9445, test_f1: 0.4958
 epoch: 58, train_loss: 0.9586, test_loss: 0.9484, test_f1: 0.4956
 epoch: 59, train_loss: 0.9545, test_loss: 0.9485, test_f1: 0.4980
 epoch: 60, train_loss: 0.9523, test_loss: 0.9482, test_f1: 0.4929
 epoch: 61, train_loss: 0.9544, test_loss: 0.9520, test_f1: 0.4922
 epoch: 62, train_loss: 0.9540, test_loss: 0.9500, test_f1: 0.4949
 epoch: 63, train_loss: 0.9592, test_loss: 0.9495, test_f1: 0.4943
 epoch: 64, train_loss: 0.9477, test_loss: 0.9446, test_f1: 0.4999
 epoch: 65, train_loss: 0.9466, test_loss: 0.9483, test_f1: 0.4973
 epoch: 66, train_loss: 0.9459, test_loss: 0.9436, test_f1: 0.4960
 epoch: 67, train_loss: 0.9434, test_loss: 0.9446, test_f1: 0.4978
 epoch: 68, train_loss: 0.9501, test_loss: 0.9469, test_f1: 0.4942
 epoch: 69, train_loss: 0.9476, test_loss: 0.9463, test_f1: 0.4921
 epoch: 70, train_loss: 0.9320, test_loss: 0.9427, test_f1: 0.5000
 epoch: 71, train_loss: 0.9412, test_loss: 0.9436, test_f1: 0.4959
 epoch: 72, train_loss: 0.9381, test_loss: 0.9431, test_f1: 0.4976
 epoch: 73, train_loss: 0.9361, test_loss: 0.9408, test_f1: 0.5018
 epoch: 74, train_loss: 0.9407, test_loss: 0.9449, test_f1: 0.4900
 epoch: 75, train_loss: 0.9287, test_loss: 0.9425, test_f1: 0.4989
 epoch: 76, train_loss: 0.9420, test_loss: 0.9381, test_f1: 0.5001
 epoch: 77, train_loss: 0.9255, test_loss: 0.9392, test_f1: 0.5018
 epoch: 78, train_loss: 0.9313, test_loss: 0.9412, test_f1: 0.4943
 epoch: 79, train_loss: 0.9246, test_loss: 0.9398, test_f1: 0.4943
 epoch: 80, train_loss: 0.9307, test_loss: 0.9424, test_f1: 0.4945
 epoch: 81, train_loss: 0.9311, test_loss: 0.9430, test_f1: 0.4967
 epoch: 82, train_loss: 0.9227, test_loss: 0.9419, test_f1: 0.4959
 epoch: 83, train_loss: 0.9236, test_loss: 0.9433, test_f1: 0.5010
 epoch: 84, train_loss: 0.9275, test_loss: 0.9417, test_f1: 0.5030
 epoch: 85, train_loss: 0.9191, test_loss: 0.9453, test_f1: 0.4955
 epoch: 86, train_loss: 0.9215, test_loss: 0.9484, test_f1: 0.4917
 epoch: 87, train_loss: 0.9153, test_loss: 0.9453, test_f1: 0.4968
 epoch: 88, train_loss: 0.9113, test_loss: 0.9430, test_f1: 0.4975
 epoch: 89, train_loss: 0.9201, test_loss: 0.9430, test_f1: 0.4945
 epoch: 90, train_loss: 0.9211, test_loss: 0.9495, test_f1: 0.5001
 epoch: 91, train_loss: 0.9102, test_loss: 0.9499, test_f1: 0.5041
 epoch: 92, train_loss: 0.9165, test_loss: 0.9427, test_f1: 0.5164
 epoch: 93, train_loss: 0.9153, test_loss: 0.9403, test_f1: 0.5176
 epoch: 94, train_loss: 0.9083, test_loss: 0.9415, test_f1: 0.5131
 epoch: 95, train_loss: 0.9038, test_loss: 0.9434, test_f1: 0.5165
 epoch: 96, train_loss: 0.9168, test_loss: 0.9407, test_f1: 0.5158
 epoch: 97, train_loss: 0.9146, test_loss: 0.9478, test_f1: 0.5050
 epoch: 98, train_loss: 0.9039, test_loss: 0.9483, test_f1: 0.5074
 epoch: 99, train_loss: 0.9056, test_loss: 0.9481, test_f1: 0.5011
##################ITERATION #5 ****************************************
 epoch: 0, train_loss: 1.3073, test_loss: 1.3306, test_f1: 0.2270
 epoch: 1, train_loss: 1.2761, test_loss: 1.3311, test_f1: 0.2270
 epoch: 2, train_loss: 1.2668, test_loss: 1.3272, test_f1: 0.2270
 epoch: 3, train_loss: 1.2508, test_loss: 1.3261, test_f1: 0.2270
 epoch: 4, train_loss: 1.2368, test_loss: 1.3059, test_f1: 0.2526
 epoch: 5, train_loss: 1.2281, test_loss: 1.2432, test_f1: 0.2576
 epoch: 6, train_loss: 1.2207, test_loss: 1.1984, test_f1: 0.2866
 epoch: 7, train_loss: 1.2158, test_loss: 1.1809, test_f1: 0.3022
 epoch: 8, train_loss: 1.2034, test_loss: 1.1704, test_f1: 0.3095
 epoch: 9, train_loss: 1.1943, test_loss: 1.1616, test_f1: 0.3295
 epoch: 10, train_loss: 1.1877, test_loss: 1.1525, test_f1: 0.3445
 epoch: 11, train_loss: 1.1859, test_loss: 1.1435, test_f1: 0.3590
 epoch: 12, train_loss: 1.1722, test_loss: 1.1352, test_f1: 0.3715
 epoch: 13, train_loss: 1.1734, test_loss: 1.1288, test_f1: 0.3905
 epoch: 14, train_loss: 1.1585, test_loss: 1.1200, test_f1: 0.4013
 epoch: 15, train_loss: 1.1547, test_loss: 1.1098, test_f1: 0.4158
 epoch: 16, train_loss: 1.1478, test_loss: 1.1054, test_f1: 0.4201
 epoch: 17, train_loss: 1.1427, test_loss: 1.0984, test_f1: 0.4373
 epoch: 18, train_loss: 1.1375, test_loss: 1.0923, test_f1: 0.4484
 epoch: 19, train_loss: 1.1297, test_loss: 1.0858, test_f1: 0.4520
 epoch: 20, train_loss: 1.1249, test_loss: 1.0810, test_f1: 0.4521
 epoch: 21, train_loss: 1.1156, test_loss: 1.0712, test_f1: 0.4603
 epoch: 22, train_loss: 1.1073, test_loss: 1.0641, test_f1: 0.4621
 epoch: 23, train_loss: 1.1076, test_loss: 1.0575, test_f1: 0.4673
 epoch: 24, train_loss: 1.0992, test_loss: 1.0543, test_f1: 0.4766
 epoch: 25, train_loss: 1.0978, test_loss: 1.0519, test_f1: 0.4763
 epoch: 26, train_loss: 1.0927, test_loss: 1.0443, test_f1: 0.4833
 epoch: 27, train_loss: 1.0780, test_loss: 1.0397, test_f1: 0.4760
 epoch: 28, train_loss: 1.0783, test_loss: 1.0319, test_f1: 0.4747
 epoch: 29, train_loss: 1.0728, test_loss: 1.0256, test_f1: 0.4777
 epoch: 30, train_loss: 1.0676, test_loss: 1.0191, test_f1: 0.4890
 epoch: 31, train_loss: 1.0617, test_loss: 1.0189, test_f1: 0.4736
 epoch: 32, train_loss: 1.0581, test_loss: 1.0132, test_f1: 0.4853
 epoch: 33, train_loss: 1.0503, test_loss: 1.0110, test_f1: 0.4659
 epoch: 34, train_loss: 1.0439, test_loss: 1.0040, test_f1: 0.4698
 epoch: 35, train_loss: 1.0384, test_loss: 0.9998, test_f1: 0.4670
 epoch: 36, train_loss: 1.0327, test_loss: 0.9975, test_f1: 0.4698
 epoch: 37, train_loss: 1.0317, test_loss: 0.9926, test_f1: 0.4787
 epoch: 38, train_loss: 1.0266, test_loss: 0.9874, test_f1: 0.4781
 epoch: 39, train_loss: 1.0282, test_loss: 0.9890, test_f1: 0.4753
 epoch: 40, train_loss: 1.0216, test_loss: 0.9845, test_f1: 0.4742
 epoch: 41, train_loss: 1.0123, test_loss: 0.9771, test_f1: 0.4799
 epoch: 42, train_loss: 1.0157, test_loss: 0.9802, test_f1: 0.4818
 epoch: 43, train_loss: 1.0159, test_loss: 0.9755, test_f1: 0.4958
 epoch: 44, train_loss: 1.0023, test_loss: 0.9727, test_f1: 0.4860
 epoch: 45, train_loss: 0.9977, test_loss: 0.9769, test_f1: 0.4803
 epoch: 46, train_loss: 0.9970, test_loss: 0.9761, test_f1: 0.4750
 epoch: 47, train_loss: 0.9901, test_loss: 0.9681, test_f1: 0.4836
 epoch: 48, train_loss: 0.9960, test_loss: 0.9679, test_f1: 0.4900
 epoch: 49, train_loss: 0.9941, test_loss: 0.9596, test_f1: 0.4907
 epoch: 50, train_loss: 0.9828, test_loss: 0.9709, test_f1: 0.4951
 epoch: 51, train_loss: 0.9808, test_loss: 0.9659, test_f1: 0.4816
 epoch: 52, train_loss: 0.9796, test_loss: 0.9673, test_f1: 0.4917
 epoch: 53, train_loss: 0.9773, test_loss: 0.9593, test_f1: 0.4968
 epoch: 54, train_loss: 0.9772, test_loss: 0.9598, test_f1: 0.4927
 epoch: 55, train_loss: 0.9875, test_loss: 0.9582, test_f1: 0.4942
 epoch: 56, train_loss: 0.9611, test_loss: 0.9578, test_f1: 0.4919
 epoch: 57, train_loss: 0.9777, test_loss: 0.9557, test_f1: 0.4865
 epoch: 58, train_loss: 0.9708, test_loss: 0.9525, test_f1: 0.4928
 epoch: 59, train_loss: 0.9588, test_loss: 0.9510, test_f1: 0.4894
 epoch: 60, train_loss: 0.9707, test_loss: 0.9500, test_f1: 0.4961
 epoch: 61, train_loss: 0.9660, test_loss: 0.9537, test_f1: 0.4956
 epoch: 62, train_loss: 0.9627, test_loss: 0.9463, test_f1: 0.4890
 epoch: 63, train_loss: 0.9589, test_loss: 0.9481, test_f1: 0.4866
 epoch: 64, train_loss: 0.9574, test_loss: 0.9484, test_f1: 0.4922
 epoch: 65, train_loss: 0.9611, test_loss: 0.9463, test_f1: 0.4974
 epoch: 66, train_loss: 0.9606, test_loss: 0.9487, test_f1: 0.4859
 epoch: 67, train_loss: 0.9611, test_loss: 0.9441, test_f1: 0.4871
 epoch: 68, train_loss: 0.9532, test_loss: 0.9439, test_f1: 0.4891
 epoch: 69, train_loss: 0.9619, test_loss: 0.9507, test_f1: 0.4881
 epoch: 70, train_loss: 0.9535, test_loss: 0.9461, test_f1: 0.4962
 epoch: 71, train_loss: 0.9623, test_loss: 0.9397, test_f1: 0.4901
 epoch: 72, train_loss: 0.9540, test_loss: 0.9430, test_f1: 0.4783
 epoch: 73, train_loss: 0.9489, test_loss: 0.9403, test_f1: 0.4958
 epoch: 74, train_loss: 0.9528, test_loss: 0.9360, test_f1: 0.4926
 epoch: 75, train_loss: 0.9435, test_loss: 0.9403, test_f1: 0.4908
 epoch: 76, train_loss: 0.9413, test_loss: 0.9378, test_f1: 0.4920
 epoch: 77, train_loss: 0.9376, test_loss: 0.9376, test_f1: 0.4923
 epoch: 78, train_loss: 0.9458, test_loss: 0.9408, test_f1: 0.5032
 epoch: 79, train_loss: 0.9397, test_loss: 0.9459, test_f1: 0.4937
 epoch: 80, train_loss: 0.9404, test_loss: 0.9461, test_f1: 0.5066
 epoch: 81, train_loss: 0.9484, test_loss: 0.9410, test_f1: 0.5007
 epoch: 82, train_loss: 0.9415, test_loss: 0.9400, test_f1: 0.5024
 epoch: 83, train_loss: 0.9381, test_loss: 0.9309, test_f1: 0.4942
 epoch: 84, train_loss: 0.9354, test_loss: 0.9352, test_f1: 0.5001
 epoch: 85, train_loss: 0.9353, test_loss: 0.9373, test_f1: 0.5058
 epoch: 86, train_loss: 0.9386, test_loss: 0.9314, test_f1: 0.5053
 epoch: 87, train_loss: 0.9356, test_loss: 0.9397, test_f1: 0.5062
 epoch: 88, train_loss: 0.9360, test_loss: 0.9400, test_f1: 0.5124
 epoch: 89, train_loss: 0.9287, test_loss: 0.9397, test_f1: 0.4909
 epoch: 90, train_loss: 0.9337, test_loss: 0.9375, test_f1: 0.5033
 epoch: 91, train_loss: 0.9303, test_loss: 0.9417, test_f1: 0.5071
 epoch: 92, train_loss: 0.9294, test_loss: 0.9359, test_f1: 0.4972
 epoch: 93, train_loss: 0.9278, test_loss: 0.9329, test_f1: 0.5010
 epoch: 94, train_loss: 0.9322, test_loss: 0.9317, test_f1: 0.5104
 epoch: 95, train_loss: 0.9261, test_loss: 0.9348, test_f1: 0.5113
 epoch: 96, train_loss: 0.9303, test_loss: 0.9315, test_f1: 0.5120
 epoch: 97, train_loss: 0.9303, test_loss: 0.9390, test_f1: 0.5083
 epoch: 98, train_loss: 0.9278, test_loss: 0.9317, test_f1: 0.5082
 epoch: 99, train_loss: 0.9217, test_loss: 0.9418, test_f1: 0.5099
##################ITERATION #6 ****************************************
 epoch: 0, train_loss: 1.3256, test_loss: 1.3127, test_f1: 0.2270
 epoch: 1, train_loss: 1.2819, test_loss: 1.3130, test_f1: 0.2270
 epoch: 2, train_loss: 1.2672, test_loss: 1.2965, test_f1: 0.2270
 epoch: 3, train_loss: 1.2448, test_loss: 1.2675, test_f1: 0.2270
 epoch: 4, train_loss: 1.2347, test_loss: 1.2240, test_f1: 0.2716
 epoch: 5, train_loss: 1.2291, test_loss: 1.1935, test_f1: 0.2783
 epoch: 6, train_loss: 1.2164, test_loss: 1.1758, test_f1: 0.2949
 epoch: 7, train_loss: 1.2068, test_loss: 1.1665, test_f1: 0.3048
 epoch: 8, train_loss: 1.1958, test_loss: 1.1552, test_f1: 0.3206
 epoch: 9, train_loss: 1.1901, test_loss: 1.1473, test_f1: 0.3311
 epoch: 10, train_loss: 1.1845, test_loss: 1.1391, test_f1: 0.3493
 epoch: 11, train_loss: 1.1774, test_loss: 1.1316, test_f1: 0.3556
 epoch: 12, train_loss: 1.1680, test_loss: 1.1226, test_f1: 0.3668
 epoch: 13, train_loss: 1.1611, test_loss: 1.1155, test_f1: 0.3789
 epoch: 14, train_loss: 1.1491, test_loss: 1.1073, test_f1: 0.3900
 epoch: 15, train_loss: 1.1451, test_loss: 1.0991, test_f1: 0.3986
 epoch: 16, train_loss: 1.1420, test_loss: 1.0901, test_f1: 0.4150
 epoch: 17, train_loss: 1.1370, test_loss: 1.0832, test_f1: 0.4236
 epoch: 18, train_loss: 1.1252, test_loss: 1.0745, test_f1: 0.4282
 epoch: 19, train_loss: 1.1213, test_loss: 1.0688, test_f1: 0.4287
 epoch: 20, train_loss: 1.1242, test_loss: 1.0622, test_f1: 0.4393
 epoch: 21, train_loss: 1.1050, test_loss: 1.0558, test_f1: 0.4401
 epoch: 22, train_loss: 1.1075, test_loss: 1.0496, test_f1: 0.4473
 epoch: 23, train_loss: 1.1034, test_loss: 1.0425, test_f1: 0.4457
 epoch: 24, train_loss: 1.0907, test_loss: 1.0386, test_f1: 0.4463
 epoch: 25, train_loss: 1.0887, test_loss: 1.0363, test_f1: 0.4610
 epoch: 26, train_loss: 1.0780, test_loss: 1.0308, test_f1: 0.4569
 epoch: 27, train_loss: 1.0834, test_loss: 1.0234, test_f1: 0.4588
 epoch: 28, train_loss: 1.0797, test_loss: 1.0183, test_f1: 0.4693
 epoch: 29, train_loss: 1.0639, test_loss: 1.0166, test_f1: 0.4664
 epoch: 30, train_loss: 1.0583, test_loss: 1.0122, test_f1: 0.4700
 epoch: 31, train_loss: 1.0580, test_loss: 1.0102, test_f1: 0.4562
 epoch: 32, train_loss: 1.0488, test_loss: 1.0070, test_f1: 0.4584
 epoch: 33, train_loss: 1.0514, test_loss: 1.0008, test_f1: 0.4619
 epoch: 34, train_loss: 1.0470, test_loss: 0.9970, test_f1: 0.4711
 epoch: 35, train_loss: 1.0522, test_loss: 0.9969, test_f1: 0.4696
 epoch: 36, train_loss: 1.0387, test_loss: 0.9906, test_f1: 0.4702
 epoch: 37, train_loss: 1.0326, test_loss: 0.9845, test_f1: 0.4728
 epoch: 38, train_loss: 1.0355, test_loss: 0.9836, test_f1: 0.4647
 epoch: 39, train_loss: 1.0259, test_loss: 0.9854, test_f1: 0.4621
 epoch: 40, train_loss: 1.0239, test_loss: 0.9785, test_f1: 0.4658
 epoch: 41, train_loss: 1.0182, test_loss: 0.9757, test_f1: 0.4647
 epoch: 42, train_loss: 1.0122, test_loss: 0.9722, test_f1: 0.4700
 epoch: 43, train_loss: 1.0164, test_loss: 0.9685, test_f1: 0.4845
 epoch: 44, train_loss: 1.0041, test_loss: 0.9642, test_f1: 0.4812
 epoch: 45, train_loss: 1.0044, test_loss: 0.9598, test_f1: 0.4852
 epoch: 46, train_loss: 0.9953, test_loss: 0.9595, test_f1: 0.4818
 epoch: 47, train_loss: 0.9936, test_loss: 0.9597, test_f1: 0.4787
 epoch: 48, train_loss: 0.9898, test_loss: 0.9533, test_f1: 0.4921
 epoch: 49, train_loss: 0.9974, test_loss: 0.9524, test_f1: 0.5114
 epoch: 50, train_loss: 0.9874, test_loss: 0.9445, test_f1: 0.5173
 epoch: 51, train_loss: 0.9922, test_loss: 0.9440, test_f1: 0.5066
 epoch: 52, train_loss: 0.9767, test_loss: 0.9445, test_f1: 0.5119
 epoch: 53, train_loss: 0.9781, test_loss: 0.9473, test_f1: 0.4982
 epoch: 54, train_loss: 0.9803, test_loss: 0.9425, test_f1: 0.5120
 epoch: 55, train_loss: 0.9816, test_loss: 0.9412, test_f1: 0.5148
 epoch: 56, train_loss: 0.9749, test_loss: 0.9382, test_f1: 0.5172
 epoch: 57, train_loss: 0.9786, test_loss: 0.9386, test_f1: 0.5166
 epoch: 58, train_loss: 0.9767, test_loss: 0.9361, test_f1: 0.5160
 epoch: 59, train_loss: 0.9759, test_loss: 0.9368, test_f1: 0.5159
 epoch: 60, train_loss: 0.9786, test_loss: 0.9346, test_f1: 0.5208
 epoch: 61, train_loss: 0.9790, test_loss: 0.9352, test_f1: 0.5190
 epoch: 62, train_loss: 0.9721, test_loss: 0.9344, test_f1: 0.5078
 epoch: 63, train_loss: 0.9648, test_loss: 0.9329, test_f1: 0.5160
 epoch: 64, train_loss: 0.9644, test_loss: 0.9318, test_f1: 0.5195
 epoch: 65, train_loss: 0.9643, test_loss: 0.9296, test_f1: 0.5207
 epoch: 66, train_loss: 0.9613, test_loss: 0.9310, test_f1: 0.5136
 epoch: 67, train_loss: 0.9595, test_loss: 0.9278, test_f1: 0.5194
 epoch: 68, train_loss: 0.9589, test_loss: 0.9267, test_f1: 0.5222
 epoch: 69, train_loss: 0.9567, test_loss: 0.9275, test_f1: 0.5163
 epoch: 70, train_loss: 0.9669, test_loss: 0.9268, test_f1: 0.5197
 epoch: 71, train_loss: 0.9633, test_loss: 0.9261, test_f1: 0.5206
 epoch: 72, train_loss: 0.9558, test_loss: 0.9212, test_f1: 0.5232
 epoch: 73, train_loss: 0.9593, test_loss: 0.9213, test_f1: 0.5204
 epoch: 74, train_loss: 0.9596, test_loss: 0.9216, test_f1: 0.5216
 epoch: 75, train_loss: 0.9507, test_loss: 0.9221, test_f1: 0.5178
 epoch: 76, train_loss: 0.9608, test_loss: 0.9203, test_f1: 0.5242
 epoch: 77, train_loss: 0.9484, test_loss: 0.9189, test_f1: 0.5316
 epoch: 78, train_loss: 0.9517, test_loss: 0.9176, test_f1: 0.5288
 epoch: 79, train_loss: 0.9503, test_loss: 0.9172, test_f1: 0.5218
 epoch: 80, train_loss: 0.9390, test_loss: 0.9165, test_f1: 0.5179
 epoch: 81, train_loss: 0.9432, test_loss: 0.9137, test_f1: 0.5301
 epoch: 82, train_loss: 0.9419, test_loss: 0.9134, test_f1: 0.5303
 epoch: 83, train_loss: 0.9448, test_loss: 0.9138, test_f1: 0.5285
 epoch: 84, train_loss: 0.9492, test_loss: 0.9112, test_f1: 0.5326
 epoch: 85, train_loss: 0.9440, test_loss: 0.9129, test_f1: 0.5293
 epoch: 86, train_loss: 0.9431, test_loss: 0.9120, test_f1: 0.5284
 epoch: 87, train_loss: 0.9440, test_loss: 0.9151, test_f1: 0.5224
 epoch: 88, train_loss: 0.9358, test_loss: 0.9111, test_f1: 0.5216
 epoch: 89, train_loss: 0.9335, test_loss: 0.9109, test_f1: 0.5211
 epoch: 90, train_loss: 0.9463, test_loss: 0.9106, test_f1: 0.5268
 epoch: 91, train_loss: 0.9336, test_loss: 0.9094, test_f1: 0.5228
 epoch: 92, train_loss: 0.9354, test_loss: 0.9075, test_f1: 0.5245
 epoch: 93, train_loss: 0.9331, test_loss: 0.9105, test_f1: 0.5171
 epoch: 94, train_loss: 0.9394, test_loss: 0.9132, test_f1: 0.5106
 epoch: 95, train_loss: 0.9301, test_loss: 0.9118, test_f1: 0.5134
 epoch: 96, train_loss: 0.9258, test_loss: 0.9136, test_f1: 0.5140
 epoch: 97, train_loss: 0.9314, test_loss: 0.9105, test_f1: 0.5109
 epoch: 98, train_loss: 0.9293, test_loss: 0.9085, test_f1: 0.5145
 epoch: 99, train_loss: 0.9241, test_loss: 0.9090, test_f1: 0.5096
##################ITERATION #7 ****************************************
 epoch: 0, train_loss: 1.3627, test_loss: 1.3360, test_f1: 0.2270
 epoch: 1, train_loss: 1.3126, test_loss: 1.3197, test_f1: 0.2270
 epoch: 2, train_loss: 1.2810, test_loss: 1.3117, test_f1: 0.2270
 epoch: 3, train_loss: 1.2738, test_loss: 1.2851, test_f1: 0.2270
 epoch: 4, train_loss: 1.2526, test_loss: 1.2446, test_f1: 0.2270
 epoch: 5, train_loss: 1.2363, test_loss: 1.2196, test_f1: 0.2439
 epoch: 6, train_loss: 1.2292, test_loss: 1.2073, test_f1: 0.2621
 epoch: 7, train_loss: 1.2221, test_loss: 1.1968, test_f1: 0.2763
 epoch: 8, train_loss: 1.2118, test_loss: 1.1861, test_f1: 0.3189
 epoch: 9, train_loss: 1.1979, test_loss: 1.1770, test_f1: 0.3343
 epoch: 10, train_loss: 1.1923, test_loss: 1.1678, test_f1: 0.3494
 epoch: 11, train_loss: 1.1853, test_loss: 1.1568, test_f1: 0.3674
 epoch: 12, train_loss: 1.1815, test_loss: 1.1484, test_f1: 0.3796
 epoch: 13, train_loss: 1.1800, test_loss: 1.1393, test_f1: 0.3986
 epoch: 14, train_loss: 1.1620, test_loss: 1.1311, test_f1: 0.4129
 epoch: 15, train_loss: 1.1571, test_loss: 1.1230, test_f1: 0.4305
 epoch: 16, train_loss: 1.1488, test_loss: 1.1149, test_f1: 0.4308
 epoch: 17, train_loss: 1.1341, test_loss: 1.1058, test_f1: 0.4312
 epoch: 18, train_loss: 1.1274, test_loss: 1.0959, test_f1: 0.4380
 epoch: 19, train_loss: 1.1186, test_loss: 1.0870, test_f1: 0.4400
 epoch: 20, train_loss: 1.1156, test_loss: 1.0783, test_f1: 0.4417
 epoch: 21, train_loss: 1.1056, test_loss: 1.0711, test_f1: 0.4408
 epoch: 22, train_loss: 1.0977, test_loss: 1.0635, test_f1: 0.4557
 epoch: 23, train_loss: 1.0853, test_loss: 1.0547, test_f1: 0.4559
 epoch: 24, train_loss: 1.0867, test_loss: 1.0465, test_f1: 0.4597
 epoch: 25, train_loss: 1.0840, test_loss: 1.0405, test_f1: 0.4598
 epoch: 26, train_loss: 1.0737, test_loss: 1.0333, test_f1: 0.4653
 epoch: 27, train_loss: 1.0695, test_loss: 1.0274, test_f1: 0.4588
 epoch: 28, train_loss: 1.0603, test_loss: 1.0205, test_f1: 0.4690
 epoch: 29, train_loss: 1.0585, test_loss: 1.0156, test_f1: 0.4709
 epoch: 30, train_loss: 1.0500, test_loss: 1.0109, test_f1: 0.4719
 epoch: 31, train_loss: 1.0514, test_loss: 1.0082, test_f1: 0.4730
 epoch: 32, train_loss: 1.0402, test_loss: 1.0039, test_f1: 0.4737
 epoch: 33, train_loss: 1.0332, test_loss: 0.9979, test_f1: 0.4742
 epoch: 34, train_loss: 1.0275, test_loss: 0.9931, test_f1: 0.4741
 epoch: 35, train_loss: 1.0276, test_loss: 0.9906, test_f1: 0.4741
 epoch: 36, train_loss: 1.0155, test_loss: 0.9899, test_f1: 0.4789
 epoch: 37, train_loss: 1.0160, test_loss: 0.9896, test_f1: 0.4797
 epoch: 38, train_loss: 1.0103, test_loss: 0.9821, test_f1: 0.4790
 epoch: 39, train_loss: 1.0033, test_loss: 0.9781, test_f1: 0.4775
 epoch: 40, train_loss: 1.0076, test_loss: 0.9766, test_f1: 0.4775
 epoch: 41, train_loss: 0.9918, test_loss: 0.9774, test_f1: 0.4802
 epoch: 42, train_loss: 1.0016, test_loss: 0.9755, test_f1: 0.4816
 epoch: 43, train_loss: 0.9884, test_loss: 0.9761, test_f1: 0.4815
 epoch: 44, train_loss: 0.9854, test_loss: 0.9784, test_f1: 0.4796
 epoch: 45, train_loss: 0.9815, test_loss: 0.9734, test_f1: 0.4844
 epoch: 46, train_loss: 0.9823, test_loss: 0.9712, test_f1: 0.4815
 epoch: 47, train_loss: 0.9785, test_loss: 0.9670, test_f1: 0.4882
 epoch: 48, train_loss: 0.9748, test_loss: 0.9628, test_f1: 0.4836
 epoch: 49, train_loss: 0.9740, test_loss: 0.9603, test_f1: 0.4918
 epoch: 50, train_loss: 0.9658, test_loss: 0.9652, test_f1: 0.5004
 epoch: 51, train_loss: 0.9595, test_loss: 0.9625, test_f1: 0.4974
 epoch: 52, train_loss: 0.9716, test_loss: 0.9650, test_f1: 0.4956
 epoch: 53, train_loss: 0.9716, test_loss: 0.9677, test_f1: 0.4948
 epoch: 54, train_loss: 0.9626, test_loss: 0.9675, test_f1: 0.4989
 epoch: 55, train_loss: 0.9603, test_loss: 0.9680, test_f1: 0.5022
 epoch: 56, train_loss: 0.9552, test_loss: 0.9627, test_f1: 0.5028
 epoch: 57, train_loss: 0.9598, test_loss: 0.9600, test_f1: 0.5037
 epoch: 58, train_loss: 0.9499, test_loss: 0.9589, test_f1: 0.5047
 epoch: 59, train_loss: 0.9571, test_loss: 0.9616, test_f1: 0.5021
 epoch: 60, train_loss: 0.9582, test_loss: 0.9653, test_f1: 0.4979
 epoch: 61, train_loss: 0.9536, test_loss: 0.9629, test_f1: 0.5004
 epoch: 62, train_loss: 0.9554, test_loss: 0.9623, test_f1: 0.5080
 epoch: 63, train_loss: 0.9628, test_loss: 0.9599, test_f1: 0.5023
 epoch: 64, train_loss: 0.9588, test_loss: 0.9645, test_f1: 0.5034
 epoch: 65, train_loss: 0.9565, test_loss: 0.9677, test_f1: 0.5007
 epoch: 66, train_loss: 0.9513, test_loss: 0.9630, test_f1: 0.5026
 epoch: 67, train_loss: 0.9525, test_loss: 0.9587, test_f1: 0.4972
 epoch: 68, train_loss: 0.9468, test_loss: 0.9597, test_f1: 0.5022
 epoch: 69, train_loss: 0.9489, test_loss: 0.9607, test_f1: 0.5059
 epoch: 70, train_loss: 0.9418, test_loss: 0.9682, test_f1: 0.4990
 epoch: 71, train_loss: 0.9491, test_loss: 0.9626, test_f1: 0.5016
 epoch: 72, train_loss: 0.9420, test_loss: 0.9636, test_f1: 0.5019
 epoch: 73, train_loss: 0.9440, test_loss: 0.9677, test_f1: 0.4990
 epoch: 74, train_loss: 0.9443, test_loss: 0.9676, test_f1: 0.5039
 epoch: 75, train_loss: 0.9431, test_loss: 0.9612, test_f1: 0.4993
 epoch: 76, train_loss: 0.9353, test_loss: 0.9667, test_f1: 0.4988
 epoch: 77, train_loss: 0.9375, test_loss: 0.9655, test_f1: 0.5030
 epoch: 78, train_loss: 0.9330, test_loss: 0.9612, test_f1: 0.4971
 epoch: 79, train_loss: 0.9368, test_loss: 0.9605, test_f1: 0.5006
 epoch: 80, train_loss: 0.9331, test_loss: 0.9662, test_f1: 0.5024
 epoch: 81, train_loss: 0.9404, test_loss: 0.9658, test_f1: 0.5015
 epoch: 82, train_loss: 0.9371, test_loss: 0.9646, test_f1: 0.4995
 epoch: 83, train_loss: 0.9328, test_loss: 0.9617, test_f1: 0.5008
 epoch: 84, train_loss: 0.9330, test_loss: 0.9621, test_f1: 0.5020
 epoch: 85, train_loss: 0.9340, test_loss: 0.9655, test_f1: 0.4986
 epoch: 86, train_loss: 0.9336, test_loss: 0.9652, test_f1: 0.4980
 epoch: 87, train_loss: 0.9231, test_loss: 0.9656, test_f1: 0.5014
 epoch: 88, train_loss: 0.9203, test_loss: 0.9681, test_f1: 0.5003
 epoch: 89, train_loss: 0.9384, test_loss: 0.9663, test_f1: 0.5015
 epoch: 90, train_loss: 0.9322, test_loss: 0.9662, test_f1: 0.5002
 epoch: 91, train_loss: 0.9205, test_loss: 0.9668, test_f1: 0.5086
 epoch: 92, train_loss: 0.9310, test_loss: 0.9630, test_f1: 0.4999
 epoch: 93, train_loss: 0.9317, test_loss: 0.9731, test_f1: 0.4989
 epoch: 94, train_loss: 0.9245, test_loss: 0.9678, test_f1: 0.5024
 epoch: 95, train_loss: 0.9229, test_loss: 0.9740, test_f1: 0.5001
 epoch: 96, train_loss: 0.9195, test_loss: 0.9680, test_f1: 0.5018
 epoch: 97, train_loss: 0.9175, test_loss: 0.9685, test_f1: 0.5044
 epoch: 98, train_loss: 0.9142, test_loss: 0.9661, test_f1: 0.5054
 epoch: 99, train_loss: 0.9187, test_loss: 0.9668, test_f1: 0.4960
##################ITERATION #8 ****************************************
 epoch: 0, train_loss: 1.3430, test_loss: 1.3133, test_f1: 0.2270
 epoch: 1, train_loss: 1.2747, test_loss: 1.2967, test_f1: 0.2270
 epoch: 2, train_loss: 1.2503, test_loss: 1.2832, test_f1: 0.2270
 epoch: 3, train_loss: 1.2286, test_loss: 1.2540, test_f1: 0.2521
 epoch: 4, train_loss: 1.2200, test_loss: 1.2117, test_f1: 0.2587
 epoch: 5, train_loss: 1.2084, test_loss: 1.1708, test_f1: 0.3348
 epoch: 6, train_loss: 1.2027, test_loss: 1.1529, test_f1: 0.3512
 epoch: 7, train_loss: 1.1891, test_loss: 1.1386, test_f1: 0.3682
 epoch: 8, train_loss: 1.1770, test_loss: 1.1297, test_f1: 0.3835
 epoch: 9, train_loss: 1.1753, test_loss: 1.1209, test_f1: 0.3932
 epoch: 10, train_loss: 1.1616, test_loss: 1.1122, test_f1: 0.4136
 epoch: 11, train_loss: 1.1572, test_loss: 1.1049, test_f1: 0.4274
 epoch: 12, train_loss: 1.1493, test_loss: 1.0974, test_f1: 0.4309
 epoch: 13, train_loss: 1.1382, test_loss: 1.0928, test_f1: 0.4347
 epoch: 14, train_loss: 1.1323, test_loss: 1.0859, test_f1: 0.4394
 epoch: 15, train_loss: 1.1377, test_loss: 1.0796, test_f1: 0.4560
 epoch: 16, train_loss: 1.1261, test_loss: 1.0699, test_f1: 0.4550
 epoch: 17, train_loss: 1.1145, test_loss: 1.0641, test_f1: 0.4565
 epoch: 18, train_loss: 1.1072, test_loss: 1.0570, test_f1: 0.4601
 epoch: 19, train_loss: 1.0973, test_loss: 1.0500, test_f1: 0.4669
 epoch: 20, train_loss: 1.0994, test_loss: 1.0437, test_f1: 0.4664
 epoch: 21, train_loss: 1.0825, test_loss: 1.0371, test_f1: 0.4656
 epoch: 22, train_loss: 1.0860, test_loss: 1.0309, test_f1: 0.4755
 epoch: 23, train_loss: 1.0883, test_loss: 1.0272, test_f1: 0.4733
 epoch: 24, train_loss: 1.0745, test_loss: 1.0202, test_f1: 0.4793
 epoch: 25, train_loss: 1.0587, test_loss: 1.0139, test_f1: 0.4750
 epoch: 26, train_loss: 1.0644, test_loss: 1.0097, test_f1: 0.4781
 epoch: 27, train_loss: 1.0569, test_loss: 1.0050, test_f1: 0.4785
 epoch: 28, train_loss: 1.0514, test_loss: 0.9999, test_f1: 0.4786
 epoch: 29, train_loss: 1.0458, test_loss: 0.9939, test_f1: 0.4797
 epoch: 30, train_loss: 1.0401, test_loss: 0.9893, test_f1: 0.4811
 epoch: 31, train_loss: 1.0314, test_loss: 0.9867, test_f1: 0.4817
 epoch: 32, train_loss: 1.0353, test_loss: 0.9825, test_f1: 0.4813
 epoch: 33, train_loss: 1.0237, test_loss: 0.9770, test_f1: 0.4882
 epoch: 34, train_loss: 1.0211, test_loss: 0.9742, test_f1: 0.4855
 epoch: 35, train_loss: 1.0170, test_loss: 0.9698, test_f1: 0.4911
 epoch: 36, train_loss: 1.0087, test_loss: 0.9683, test_f1: 0.4860
 epoch: 37, train_loss: 1.0013, test_loss: 0.9683, test_f1: 0.4826
 epoch: 38, train_loss: 1.0023, test_loss: 0.9654, test_f1: 0.4811
 epoch: 39, train_loss: 0.9999, test_loss: 0.9610, test_f1: 0.4755
 epoch: 40, train_loss: 1.0002, test_loss: 0.9586, test_f1: 0.4794
 epoch: 41, train_loss: 0.9862, test_loss: 0.9589, test_f1: 0.4814
 epoch: 42, train_loss: 0.9882, test_loss: 0.9582, test_f1: 0.4827
 epoch: 43, train_loss: 0.9861, test_loss: 0.9570, test_f1: 0.4863
 epoch: 44, train_loss: 0.9878, test_loss: 0.9542, test_f1: 0.4819
 epoch: 45, train_loss: 0.9788, test_loss: 0.9535, test_f1: 0.4801
 epoch: 46, train_loss: 0.9874, test_loss: 0.9517, test_f1: 0.4857
 epoch: 47, train_loss: 0.9731, test_loss: 0.9521, test_f1: 0.4841
 epoch: 48, train_loss: 0.9684, test_loss: 0.9512, test_f1: 0.4864
 epoch: 49, train_loss: 0.9733, test_loss: 0.9514, test_f1: 0.4961
 epoch: 50, train_loss: 0.9630, test_loss: 0.9529, test_f1: 0.4990
 epoch: 51, train_loss: 0.9660, test_loss: 0.9508, test_f1: 0.4985
 epoch: 52, train_loss: 0.9620, test_loss: 0.9501, test_f1: 0.4987
 epoch: 53, train_loss: 0.9485, test_loss: 0.9493, test_f1: 0.5007
 epoch: 54, train_loss: 0.9592, test_loss: 0.9474, test_f1: 0.5024
 epoch: 55, train_loss: 0.9549, test_loss: 0.9467, test_f1: 0.5016
 epoch: 56, train_loss: 0.9562, test_loss: 0.9489, test_f1: 0.5041
 epoch: 57, train_loss: 0.9604, test_loss: 0.9492, test_f1: 0.5054
 epoch: 58, train_loss: 0.9517, test_loss: 0.9496, test_f1: 0.5030
 epoch: 59, train_loss: 0.9450, test_loss: 0.9474, test_f1: 0.5040
 epoch: 60, train_loss: 0.9481, test_loss: 0.9468, test_f1: 0.5053
 epoch: 61, train_loss: 0.9509, test_loss: 0.9452, test_f1: 0.5027
 epoch: 62, train_loss: 0.9423, test_loss: 0.9490, test_f1: 0.5057
 epoch: 63, train_loss: 0.9516, test_loss: 0.9490, test_f1: 0.5044
 epoch: 64, train_loss: 0.9436, test_loss: 0.9497, test_f1: 0.5041
 epoch: 65, train_loss: 0.9447, test_loss: 0.9479, test_f1: 0.5031
 epoch: 66, train_loss: 0.9421, test_loss: 0.9428, test_f1: 0.5012
 epoch: 67, train_loss: 0.9462, test_loss: 0.9408, test_f1: 0.5025
 epoch: 68, train_loss: 0.9420, test_loss: 0.9415, test_f1: 0.5037
 epoch: 69, train_loss: 0.9517, test_loss: 0.9427, test_f1: 0.5072
 epoch: 70, train_loss: 0.9368, test_loss: 0.9472, test_f1: 0.5035
 epoch: 71, train_loss: 0.9371, test_loss: 0.9452, test_f1: 0.5055
 epoch: 72, train_loss: 0.9410, test_loss: 0.9438, test_f1: 0.5058
 epoch: 73, train_loss: 0.9303, test_loss: 0.9490, test_f1: 0.5081
 epoch: 74, train_loss: 0.9293, test_loss: 0.9458, test_f1: 0.5106
 epoch: 75, train_loss: 0.9321, test_loss: 0.9447, test_f1: 0.5088
 epoch: 76, train_loss: 0.9258, test_loss: 0.9417, test_f1: 0.5082
 epoch: 77, train_loss: 0.9297, test_loss: 0.9449, test_f1: 0.5088
 epoch: 78, train_loss: 0.9305, test_loss: 0.9437, test_f1: 0.5130
 epoch: 79, train_loss: 0.9332, test_loss: 0.9461, test_f1: 0.5092
 epoch: 80, train_loss: 0.9304, test_loss: 0.9434, test_f1: 0.5096
 epoch: 81, train_loss: 0.9254, test_loss: 0.9408, test_f1: 0.5107
 epoch: 82, train_loss: 0.9317, test_loss: 0.9431, test_f1: 0.5106
 epoch: 83, train_loss: 0.9185, test_loss: 0.9460, test_f1: 0.5175
 epoch: 84, train_loss: 0.9227, test_loss: 0.9441, test_f1: 0.5151
 epoch: 85, train_loss: 0.9253, test_loss: 0.9438, test_f1: 0.5129
 epoch: 86, train_loss: 0.9178, test_loss: 0.9441, test_f1: 0.5092
 epoch: 87, train_loss: 0.9257, test_loss: 0.9414, test_f1: 0.5096
 epoch: 88, train_loss: 0.9193, test_loss: 0.9410, test_f1: 0.5135
 epoch: 89, train_loss: 0.9205, test_loss: 0.9434, test_f1: 0.5146
 epoch: 90, train_loss: 0.9160, test_loss: 0.9396, test_f1: 0.5158
 epoch: 91, train_loss: 0.9140, test_loss: 0.9403, test_f1: 0.5188
 epoch: 92, train_loss: 0.9181, test_loss: 0.9423, test_f1: 0.5182
 epoch: 93, train_loss: 0.9129, test_loss: 0.9417, test_f1: 0.5149
 epoch: 94, train_loss: 0.9226, test_loss: 0.9465, test_f1: 0.5119
 epoch: 95, train_loss: 0.9156, test_loss: 0.9452, test_f1: 0.5106
 epoch: 96, train_loss: 0.9149, test_loss: 0.9476, test_f1: 0.5091
 epoch: 97, train_loss: 0.9078, test_loss: 0.9465, test_f1: 0.5140
 epoch: 98, train_loss: 0.9092, test_loss: 0.9447, test_f1: 0.5110
 epoch: 99, train_loss: 0.9105, test_loss: 0.9457, test_f1: 0.5113
##################ITERATION #9 ****************************************
 epoch: 0, train_loss: 1.4078, test_loss: 1.3746, test_f1: 0.2270
 epoch: 1, train_loss: 1.3300, test_loss: 1.3607, test_f1: 0.2270
 epoch: 2, train_loss: 1.2862, test_loss: 1.3312, test_f1: 0.2270
 epoch: 3, train_loss: 1.2638, test_loss: 1.2709, test_f1: 0.2538
 epoch: 4, train_loss: 1.2497, test_loss: 1.2190, test_f1: 0.3192
 epoch: 5, train_loss: 1.2320, test_loss: 1.1912, test_f1: 0.3416
 epoch: 6, train_loss: 1.2188, test_loss: 1.1752, test_f1: 0.3466
 epoch: 7, train_loss: 1.2068, test_loss: 1.1651, test_f1: 0.3579
 epoch: 8, train_loss: 1.1927, test_loss: 1.1548, test_f1: 0.3504
 epoch: 9, train_loss: 1.1867, test_loss: 1.1451, test_f1: 0.3628
 epoch: 10, train_loss: 1.1755, test_loss: 1.1354, test_f1: 0.3661
 epoch: 11, train_loss: 1.1652, test_loss: 1.1266, test_f1: 0.3934
 epoch: 12, train_loss: 1.1551, test_loss: 1.1156, test_f1: 0.4041
 epoch: 13, train_loss: 1.1545, test_loss: 1.1047, test_f1: 0.4219
 epoch: 14, train_loss: 1.1453, test_loss: 1.0965, test_f1: 0.4233
 epoch: 15, train_loss: 1.1329, test_loss: 1.0874, test_f1: 0.4302
 epoch: 16, train_loss: 1.1251, test_loss: 1.0801, test_f1: 0.4389
 epoch: 17, train_loss: 1.1141, test_loss: 1.0712, test_f1: 0.4354
 epoch: 18, train_loss: 1.1111, test_loss: 1.0639, test_f1: 0.4389
 epoch: 19, train_loss: 1.1049, test_loss: 1.0557, test_f1: 0.4401
 epoch: 20, train_loss: 1.0955, test_loss: 1.0497, test_f1: 0.4488
 epoch: 21, train_loss: 1.0935, test_loss: 1.0428, test_f1: 0.4520
 epoch: 22, train_loss: 1.0786, test_loss: 1.0385, test_f1: 0.4489
 epoch: 23, train_loss: 1.0749, test_loss: 1.0345, test_f1: 0.4446
 epoch: 24, train_loss: 1.0645, test_loss: 1.0295, test_f1: 0.4474
 epoch: 25, train_loss: 1.0650, test_loss: 1.0229, test_f1: 0.4601
 epoch: 26, train_loss: 1.0594, test_loss: 1.0230, test_f1: 0.4504
 epoch: 27, train_loss: 1.0562, test_loss: 1.0161, test_f1: 0.4667
 epoch: 28, train_loss: 1.0542, test_loss: 1.0117, test_f1: 0.4631
 epoch: 29, train_loss: 1.0384, test_loss: 1.0079, test_f1: 0.4793
 epoch: 30, train_loss: 1.0299, test_loss: 1.0049, test_f1: 0.4741
 epoch: 31, train_loss: 1.0287, test_loss: 1.0013, test_f1: 0.4830
 epoch: 32, train_loss: 1.0266, test_loss: 0.9975, test_f1: 0.4604
 epoch: 33, train_loss: 1.0302, test_loss: 0.9935, test_f1: 0.4744
 epoch: 34, train_loss: 1.0160, test_loss: 0.9937, test_f1: 0.4790
 epoch: 35, train_loss: 1.0128, test_loss: 0.9875, test_f1: 0.4785
 epoch: 36, train_loss: 1.0080, test_loss: 0.9862, test_f1: 0.4815
 epoch: 37, train_loss: 1.0069, test_loss: 0.9840, test_f1: 0.4893
 epoch: 38, train_loss: 1.0073, test_loss: 0.9791, test_f1: 0.4882
 epoch: 39, train_loss: 1.0023, test_loss: 0.9813, test_f1: 0.4799
 epoch: 40, train_loss: 0.9987, test_loss: 0.9801, test_f1: 0.4940
 epoch: 41, train_loss: 0.9931, test_loss: 0.9782, test_f1: 0.4718
 epoch: 42, train_loss: 0.9878, test_loss: 0.9744, test_f1: 0.4772
 epoch: 43, train_loss: 0.9908, test_loss: 0.9726, test_f1: 0.4834
 epoch: 44, train_loss: 0.9861, test_loss: 0.9739, test_f1: 0.4827
 epoch: 45, train_loss: 0.9744, test_loss: 0.9707, test_f1: 0.4939
 epoch: 46, train_loss: 0.9880, test_loss: 0.9726, test_f1: 0.4850
 epoch: 47, train_loss: 0.9718, test_loss: 0.9729, test_f1: 0.4892
 epoch: 48, train_loss: 0.9730, test_loss: 0.9711, test_f1: 0.4869
 epoch: 49, train_loss: 0.9725, test_loss: 0.9686, test_f1: 0.4970
 epoch: 50, train_loss: 0.9601, test_loss: 0.9684, test_f1: 0.4991
 epoch: 51, train_loss: 0.9649, test_loss: 0.9679, test_f1: 0.4897
 epoch: 52, train_loss: 0.9661, test_loss: 0.9666, test_f1: 0.4896
 epoch: 53, train_loss: 0.9594, test_loss: 0.9654, test_f1: 0.4888
 epoch: 54, train_loss: 0.9587, test_loss: 0.9648, test_f1: 0.4965
 epoch: 55, train_loss: 0.9569, test_loss: 0.9630, test_f1: 0.5037
 epoch: 56, train_loss: 0.9580, test_loss: 0.9637, test_f1: 0.5051
 epoch: 57, train_loss: 0.9511, test_loss: 0.9614, test_f1: 0.4958
 epoch: 58, train_loss: 0.9516, test_loss: 0.9607, test_f1: 0.5066
 epoch: 59, train_loss: 0.9458, test_loss: 0.9617, test_f1: 0.5004
 epoch: 60, train_loss: 0.9463, test_loss: 0.9577, test_f1: 0.5041
 epoch: 61, train_loss: 0.9467, test_loss: 0.9579, test_f1: 0.5091
 epoch: 62, train_loss: 0.9541, test_loss: 0.9577, test_f1: 0.5123
 epoch: 63, train_loss: 0.9503, test_loss: 0.9559, test_f1: 0.5086
 epoch: 64, train_loss: 0.9449, test_loss: 0.9596, test_f1: 0.5097
 epoch: 65, train_loss: 0.9442, test_loss: 0.9594, test_f1: 0.5016
 epoch: 66, train_loss: 0.9372, test_loss: 0.9603, test_f1: 0.4918
 epoch: 67, train_loss: 0.9454, test_loss: 0.9563, test_f1: 0.5096
 epoch: 68, train_loss: 0.9372, test_loss: 0.9585, test_f1: 0.5113
 epoch: 69, train_loss: 0.9387, test_loss: 0.9557, test_f1: 0.5000
 epoch: 70, train_loss: 0.9404, test_loss: 0.9573, test_f1: 0.5015
 epoch: 71, train_loss: 0.9352, test_loss: 0.9595, test_f1: 0.5037
 epoch: 72, train_loss: 0.9327, test_loss: 0.9573, test_f1: 0.5065
 epoch: 73, train_loss: 0.9368, test_loss: 0.9561, test_f1: 0.5026
 epoch: 74, train_loss: 0.9313, test_loss: 0.9552, test_f1: 0.5034
 epoch: 75, train_loss: 0.9328, test_loss: 0.9553, test_f1: 0.5022
 epoch: 76, train_loss: 0.9349, test_loss: 0.9561, test_f1: 0.5032
 epoch: 77, train_loss: 0.9256, test_loss: 0.9551, test_f1: 0.5020
 epoch: 78, train_loss: 0.9374, test_loss: 0.9525, test_f1: 0.5043
 epoch: 79, train_loss: 0.9249, test_loss: 0.9536, test_f1: 0.5047
 epoch: 80, train_loss: 0.9268, test_loss: 0.9535, test_f1: 0.5029
 epoch: 81, train_loss: 0.9191, test_loss: 0.9536, test_f1: 0.5107
 epoch: 82, train_loss: 0.9260, test_loss: 0.9528, test_f1: 0.4978
 epoch: 83, train_loss: 0.9247, test_loss: 0.9512, test_f1: 0.4984
 epoch: 84, train_loss: 0.9247, test_loss: 0.9488, test_f1: 0.4960
 epoch: 85, train_loss: 0.9252, test_loss: 0.9540, test_f1: 0.5010
 epoch: 86, train_loss: 0.9237, test_loss: 0.9488, test_f1: 0.5023
 epoch: 87, train_loss: 0.9229, test_loss: 0.9493, test_f1: 0.4946
 epoch: 88, train_loss: 0.9198, test_loss: 0.9479, test_f1: 0.4944
 epoch: 89, train_loss: 0.9126, test_loss: 0.9469, test_f1: 0.5008
 epoch: 90, train_loss: 0.9160, test_loss: 0.9501, test_f1: 0.4984
 epoch: 91, train_loss: 0.9150, test_loss: 0.9481, test_f1: 0.5011
 epoch: 92, train_loss: 0.9075, test_loss: 0.9482, test_f1: 0.5013
 epoch: 93, train_loss: 0.9193, test_loss: 0.9497, test_f1: 0.4927
 epoch: 94, train_loss: 0.9090, test_loss: 0.9495, test_f1: 0.4998
 epoch: 95, train_loss: 0.9087, test_loss: 0.9508, test_f1: 0.5000
 epoch: 96, train_loss: 0.9227, test_loss: 0.9465, test_f1: 0.5039
 epoch: 97, train_loss: 0.9078, test_loss: 0.9466, test_f1: 0.4970
 epoch: 98, train_loss: 0.9118, test_loss: 0.9486, test_f1: 0.4937
 epoch: 99, train_loss: 0.9101, test_loss: 0.9475, test_f1: 0.5012

Training completed in 396.95 seconds
Best F1: 0.5326 at epoch 84
Mean F1 across iterations: 0.5113  0.0102
========================FINAL RESULTS================================
FEGIN weighted F1: 0.5326  0.0102
python main.py --data ltspice_examples --representation component_net --model FEGIN --layers 4 --hiddens 32 --batch_size 256 --lr 0.0001 --emb_size 128 --epochs 100 --save_appendix component_net_L4_H32_BS256_LR0.0001_E128 --no_val
-----



STDERR:
  File "main.py", line 370, in <module>
    main()
  File "main.py", line 254, in main
    dataset = dataset_class(
  File "/home/philip/projects/ltspice_examples_code_repo/Circuit-Completion-Using-GNNs/component_classification_with_link_prediction_head/evaluation/FEGIN/kernel/circuit_datasets.py", line 15, in __init__
    self.data, self.slices = torch.load(self.processed_paths[0])
  File "/home/philip/.local/lib/python3.8/site-packages/torch/serialization.py", line 1040, in load
    warnings.warn(
  File "/usr/lib/python3.8/warnings.py", line 109, in _showwarnmsg
    sw(msg.message, msg.category, msg.filename, msg.lineno,
  File "main.py", line 47, in warn_with_traceback
    traceback.print_stack(file=log)
/home/philip/projects/ltspice_examples_code_repo/Circuit-Completion-Using-GNNs/component_classification_with_link_prediction_head/evaluation/FEGIN/kernel/circuit_datasets.py:15: FutureWarning: You are using `torch.load` with `weights_only=False` (the current default value), which uses the default pickle module implicitly. It is possible to construct malicious pickle data which will execute arbitrary code during unpickling (See https://github.com/pytorch/pytorch/blob/main/SECURITY.md#untrusted-models for more details). In a future release, the default value for `weights_only` will be flipped to `True`. This limits the functions that could be executed during unpickling. Arbitrary objects will no longer be allowed to be loaded via this mode unless they are explicitly allowlisted by the user via `torch.serialization.add_safe_globals`. We recommend you start setting `weights_only=True` for any use case where you don't have full control of the loaded file. Please open an issue on GitHub for any issues related to this experimental feature.
  self.data, self.slices = torch.load(self.processed_paths[0])
