STDOUT:
Results will be saved in /home/philip/projects/ltspice_examples_code_repo/Circuit-Completion-Using-GNNs/component_classification_with_link_prediction_head/evaluation/FEGIN/results/model_FEGIN_dataset_ltspice_examples
Command line input: python main.py --data ltspice_examples --representation component_pin_net --model FEGIN --layers 6 --hiddens 32 --batch_size 128 --lr 0.0001 --emb_size 128 --epochs 100 --save_appendix component_pin_net_L6_H32_BS128_LR0.0001_E128 --no_val
 is saved.
-----
ltspice_examples - FEGIN
Using 6 layers, 32 hidden units, h = 2
Loading component_pin_net representation dataset
ENTERED
Training FEGIN on component_pin_net representation
Train: 3558, Test: 846
##################ITERATION #0 ****************************************
 epoch: 0, train_loss: 1.3891, test_loss: 1.3903, test_f1: 0.0304
 epoch: 1, train_loss: 1.3818, test_loss: 1.3850, test_f1: 0.1340
 epoch: 2, train_loss: 1.3769, test_loss: 1.3768, test_f1: 0.2490
 epoch: 3, train_loss: 1.3723, test_loss: 1.3689, test_f1: 0.3906
 epoch: 4, train_loss: 1.3659, test_loss: 1.3614, test_f1: 0.4450
 epoch: 5, train_loss: 1.3587, test_loss: 1.3527, test_f1: 0.4254
 epoch: 6, train_loss: 1.3475, test_loss: 1.3405, test_f1: 0.3842
 epoch: 7, train_loss: 1.3352, test_loss: 1.3271, test_f1: 0.3348
 epoch: 8, train_loss: 1.3209, test_loss: 1.3106, test_f1: 0.3330
 epoch: 9, train_loss: 1.3030, test_loss: 1.2935, test_f1: 0.3195
 epoch: 10, train_loss: 1.2887, test_loss: 1.2744, test_f1: 0.3282
 epoch: 11, train_loss: 1.2698, test_loss: 1.2574, test_f1: 0.3334
 epoch: 12, train_loss: 1.2582, test_loss: 1.2424, test_f1: 0.3403
 epoch: 13, train_loss: 1.2420, test_loss: 1.2233, test_f1: 0.3422
 epoch: 14, train_loss: 1.2252, test_loss: 1.2064, test_f1: 0.3420
 epoch: 15, train_loss: 1.2140, test_loss: 1.1899, test_f1: 0.3422
 epoch: 16, train_loss: 1.1973, test_loss: 1.1718, test_f1: 0.3441
 epoch: 17, train_loss: 1.1808, test_loss: 1.1551, test_f1: 0.3441
 epoch: 18, train_loss: 1.1572, test_loss: 1.1388, test_f1: 0.3458
 epoch: 19, train_loss: 1.1478, test_loss: 1.1239, test_f1: 0.3440
 epoch: 20, train_loss: 1.1278, test_loss: 1.1111, test_f1: 0.3460
 epoch: 21, train_loss: 1.1167, test_loss: 1.1039, test_f1: 0.3440
 epoch: 22, train_loss: 1.1021, test_loss: 1.0945, test_f1: 0.3440
 epoch: 23, train_loss: 1.0898, test_loss: 1.0878, test_f1: 0.3460
 epoch: 24, train_loss: 1.0776, test_loss: 1.0829, test_f1: 0.3460
 epoch: 25, train_loss: 1.0652, test_loss: 1.0832, test_f1: 0.3366
 epoch: 26, train_loss: 1.0580, test_loss: 1.0740, test_f1: 0.3460
 epoch: 27, train_loss: 1.0533, test_loss: 1.0714, test_f1: 0.3430
 epoch: 28, train_loss: 1.0430, test_loss: 1.0752, test_f1: 0.3423
 epoch: 29, train_loss: 1.0346, test_loss: 1.0658, test_f1: 0.3635
 epoch: 30, train_loss: 1.0327, test_loss: 1.0623, test_f1: 0.3790
 epoch: 31, train_loss: 1.0324, test_loss: 1.0610, test_f1: 0.3976
 epoch: 32, train_loss: 1.0221, test_loss: 1.0576, test_f1: 0.4102
 epoch: 33, train_loss: 1.0127, test_loss: 1.0569, test_f1: 0.4171
 epoch: 34, train_loss: 1.0101, test_loss: 1.0618, test_f1: 0.4316
 epoch: 35, train_loss: 1.0028, test_loss: 1.0517, test_f1: 0.4498
 epoch: 36, train_loss: 1.0013, test_loss: 1.0645, test_f1: 0.4536
 epoch: 37, train_loss: 1.0018, test_loss: 1.0530, test_f1: 0.4565
 epoch: 38, train_loss: 0.9910, test_loss: 1.0389, test_f1: 0.4615
 epoch: 39, train_loss: 0.9884, test_loss: 1.0333, test_f1: 0.4652
 epoch: 40, train_loss: 0.9830, test_loss: 1.0259, test_f1: 0.4951
 epoch: 41, train_loss: 0.9753, test_loss: 1.0244, test_f1: 0.4829
 epoch: 42, train_loss: 0.9691, test_loss: 1.0346, test_f1: 0.4852
 epoch: 43, train_loss: 0.9652, test_loss: 1.0180, test_f1: 0.5034
 epoch: 44, train_loss: 0.9582, test_loss: 1.0058, test_f1: 0.5045
 epoch: 45, train_loss: 0.9577, test_loss: 1.0139, test_f1: 0.5044
 epoch: 46, train_loss: 0.9534, test_loss: 1.0108, test_f1: 0.4955
 epoch: 47, train_loss: 0.9511, test_loss: 0.9989, test_f1: 0.5017
 epoch: 48, train_loss: 0.9444, test_loss: 0.9943, test_f1: 0.5026
 epoch: 49, train_loss: 0.9403, test_loss: 1.0002, test_f1: 0.5083
 epoch: 50, train_loss: 0.9302, test_loss: 0.9877, test_f1: 0.4979
 epoch: 51, train_loss: 0.9421, test_loss: 0.9894, test_f1: 0.5081
 epoch: 52, train_loss: 0.9293, test_loss: 0.9879, test_f1: 0.5097
 epoch: 53, train_loss: 0.9220, test_loss: 0.9837, test_f1: 0.4970
 epoch: 54, train_loss: 0.9267, test_loss: 0.9916, test_f1: 0.5074
 epoch: 55, train_loss: 0.9334, test_loss: 0.9844, test_f1: 0.5053
 epoch: 56, train_loss: 0.9229, test_loss: 0.9774, test_f1: 0.5099
 epoch: 57, train_loss: 0.9190, test_loss: 0.9788, test_f1: 0.5044
 epoch: 58, train_loss: 0.9255, test_loss: 0.9750, test_f1: 0.5047
 epoch: 59, train_loss: 0.9305, test_loss: 0.9831, test_f1: 0.4975
 epoch: 60, train_loss: 0.9150, test_loss: 0.9805, test_f1: 0.5087
 epoch: 61, train_loss: 0.9192, test_loss: 0.9742, test_f1: 0.5131
 epoch: 62, train_loss: 0.9158, test_loss: 0.9700, test_f1: 0.5036
 epoch: 63, train_loss: 0.9215, test_loss: 0.9730, test_f1: 0.5048
 epoch: 64, train_loss: 0.9128, test_loss: 0.9702, test_f1: 0.5088
 epoch: 65, train_loss: 0.9097, test_loss: 0.9685, test_f1: 0.5005
 epoch: 66, train_loss: 0.9174, test_loss: 0.9722, test_f1: 0.4998
 epoch: 67, train_loss: 0.9159, test_loss: 0.9696, test_f1: 0.4993
 epoch: 68, train_loss: 0.9119, test_loss: 0.9690, test_f1: 0.5069
 epoch: 69, train_loss: 0.9161, test_loss: 0.9603, test_f1: 0.5071
 epoch: 70, train_loss: 0.9128, test_loss: 0.9650, test_f1: 0.4976
 epoch: 71, train_loss: 0.9088, test_loss: 0.9703, test_f1: 0.4999
 epoch: 72, train_loss: 0.8968, test_loss: 0.9697, test_f1: 0.5140
 epoch: 73, train_loss: 0.9134, test_loss: 0.9699, test_f1: 0.5098
 epoch: 74, train_loss: 0.8989, test_loss: 0.9723, test_f1: 0.4958
 epoch: 75, train_loss: 0.8994, test_loss: 0.9647, test_f1: 0.5127
 epoch: 76, train_loss: 0.9049, test_loss: 0.9672, test_f1: 0.5077
 epoch: 77, train_loss: 0.9012, test_loss: 0.9625, test_f1: 0.5065
 epoch: 78, train_loss: 0.8962, test_loss: 0.9603, test_f1: 0.5060
 epoch: 79, train_loss: 0.8994, test_loss: 0.9692, test_f1: 0.5041
 epoch: 80, train_loss: 0.9030, test_loss: 0.9669, test_f1: 0.5074
 epoch: 81, train_loss: 0.9043, test_loss: 0.9637, test_f1: 0.4958
 epoch: 82, train_loss: 0.8930, test_loss: 0.9658, test_f1: 0.5007
 epoch: 83, train_loss: 0.9011, test_loss: 0.9650, test_f1: 0.5068
 epoch: 84, train_loss: 0.8923, test_loss: 0.9629, test_f1: 0.4986
 epoch: 85, train_loss: 0.8911, test_loss: 0.9679, test_f1: 0.5063
 epoch: 86, train_loss: 0.8820, test_loss: 0.9580, test_f1: 0.5096
 epoch: 87, train_loss: 0.8880, test_loss: 0.9654, test_f1: 0.5108
 epoch: 88, train_loss: 0.8870, test_loss: 0.9656, test_f1: 0.5051
 epoch: 89, train_loss: 0.8909, test_loss: 0.9635, test_f1: 0.5087
 epoch: 90, train_loss: 0.8917, test_loss: 0.9576, test_f1: 0.5019
 epoch: 91, train_loss: 0.8885, test_loss: 0.9608, test_f1: 0.4995
 epoch: 92, train_loss: 0.8849, test_loss: 0.9541, test_f1: 0.5091
 epoch: 93, train_loss: 0.8799, test_loss: 0.9580, test_f1: 0.5093
 epoch: 94, train_loss: 0.8809, test_loss: 0.9578, test_f1: 0.4996
 epoch: 95, train_loss: 0.8727, test_loss: 0.9581, test_f1: 0.5000
 epoch: 96, train_loss: 0.8805, test_loss: 0.9518, test_f1: 0.5068
 epoch: 97, train_loss: 0.8893, test_loss: 0.9547, test_f1: 0.5049
 epoch: 98, train_loss: 0.8886, test_loss: 0.9563, test_f1: 0.5088
 epoch: 99, train_loss: 0.8803, test_loss: 0.9592, test_f1: 0.5019
##################ITERATION #1 ****************************************
 epoch: 0, train_loss: 1.3559, test_loss: 1.3739, test_f1: 0.2270
 epoch: 1, train_loss: 1.3334, test_loss: 1.3530, test_f1: 0.2747
 epoch: 2, train_loss: 1.3166, test_loss: 1.3064, test_f1: 0.3790
 epoch: 3, train_loss: 1.2981, test_loss: 1.2786, test_f1: 0.3912
 epoch: 4, train_loss: 1.2777, test_loss: 1.2547, test_f1: 0.3924
 epoch: 5, train_loss: 1.2562, test_loss: 1.2290, test_f1: 0.3894
 epoch: 6, train_loss: 1.2260, test_loss: 1.2034, test_f1: 0.3761
 epoch: 7, train_loss: 1.2073, test_loss: 1.1775, test_f1: 0.3771
 epoch: 8, train_loss: 1.1797, test_loss: 1.1597, test_f1: 0.3716
 epoch: 9, train_loss: 1.1593, test_loss: 1.1438, test_f1: 0.3640
 epoch: 10, train_loss: 1.1412, test_loss: 1.1262, test_f1: 0.3734
 epoch: 11, train_loss: 1.1216, test_loss: 1.1170, test_f1: 0.3573
 epoch: 12, train_loss: 1.1108, test_loss: 1.1056, test_f1: 0.3483
 epoch: 13, train_loss: 1.0963, test_loss: 1.0970, test_f1: 0.3631
 epoch: 14, train_loss: 1.0881, test_loss: 1.0936, test_f1: 0.3739
 epoch: 15, train_loss: 1.0781, test_loss: 1.0841, test_f1: 0.3902
 epoch: 16, train_loss: 1.0670, test_loss: 1.0837, test_f1: 0.3699
 epoch: 17, train_loss: 1.0628, test_loss: 1.0614, test_f1: 0.4112
 epoch: 18, train_loss: 1.0532, test_loss: 1.0697, test_f1: 0.4049
 epoch: 19, train_loss: 1.0473, test_loss: 1.0572, test_f1: 0.4137
 epoch: 20, train_loss: 1.0429, test_loss: 1.0491, test_f1: 0.4260
 epoch: 21, train_loss: 1.0321, test_loss: 1.0509, test_f1: 0.4322
 epoch: 22, train_loss: 1.0298, test_loss: 1.0501, test_f1: 0.4311
 epoch: 23, train_loss: 1.0202, test_loss: 1.0379, test_f1: 0.4510
 epoch: 24, train_loss: 1.0193, test_loss: 1.0370, test_f1: 0.4529
 epoch: 25, train_loss: 1.0115, test_loss: 1.0323, test_f1: 0.4543
 epoch: 26, train_loss: 1.0138, test_loss: 1.0319, test_f1: 0.4636
 epoch: 27, train_loss: 1.0036, test_loss: 1.0249, test_f1: 0.4664
 epoch: 28, train_loss: 1.0095, test_loss: 1.0351, test_f1: 0.4521
 epoch: 29, train_loss: 0.9988, test_loss: 1.0178, test_f1: 0.4713
 epoch: 30, train_loss: 0.9922, test_loss: 1.0096, test_f1: 0.4654
 epoch: 31, train_loss: 0.9906, test_loss: 1.0072, test_f1: 0.4691
 epoch: 32, train_loss: 0.9811, test_loss: 1.0007, test_f1: 0.4654
 epoch: 33, train_loss: 0.9911, test_loss: 0.9989, test_f1: 0.4698
 epoch: 34, train_loss: 0.9746, test_loss: 1.0023, test_f1: 0.4726
 epoch: 35, train_loss: 0.9742, test_loss: 0.9915, test_f1: 0.4808
 epoch: 36, train_loss: 0.9743, test_loss: 0.9845, test_f1: 0.4802
 epoch: 37, train_loss: 0.9769, test_loss: 0.9864, test_f1: 0.4721
 epoch: 38, train_loss: 0.9693, test_loss: 0.9892, test_f1: 0.4822
 epoch: 39, train_loss: 0.9710, test_loss: 0.9771, test_f1: 0.4870
 epoch: 40, train_loss: 0.9569, test_loss: 0.9764, test_f1: 0.4868
 epoch: 41, train_loss: 0.9584, test_loss: 0.9629, test_f1: 0.4952
 epoch: 42, train_loss: 0.9584, test_loss: 0.9650, test_f1: 0.5051
 epoch: 43, train_loss: 0.9448, test_loss: 0.9786, test_f1: 0.5018
 epoch: 44, train_loss: 0.9518, test_loss: 0.9750, test_f1: 0.4998
 epoch: 45, train_loss: 0.9551, test_loss: 0.9822, test_f1: 0.5059
 epoch: 46, train_loss: 0.9458, test_loss: 0.9642, test_f1: 0.5198
 epoch: 47, train_loss: 0.9455, test_loss: 0.9585, test_f1: 0.5139
 epoch: 48, train_loss: 0.9403, test_loss: 0.9600, test_f1: 0.5115
 epoch: 49, train_loss: 0.9423, test_loss: 0.9566, test_f1: 0.5104
 epoch: 50, train_loss: 0.9347, test_loss: 0.9795, test_f1: 0.5096
 epoch: 51, train_loss: 0.9296, test_loss: 0.9563, test_f1: 0.5136
 epoch: 52, train_loss: 0.9285, test_loss: 0.9576, test_f1: 0.5194
 epoch: 53, train_loss: 0.9320, test_loss: 0.9590, test_f1: 0.5186
 epoch: 54, train_loss: 0.9338, test_loss: 0.9492, test_f1: 0.5223
 epoch: 55, train_loss: 0.9319, test_loss: 0.9536, test_f1: 0.5109
 epoch: 56, train_loss: 0.9177, test_loss: 0.9492, test_f1: 0.5227
 epoch: 57, train_loss: 0.9233, test_loss: 0.9590, test_f1: 0.5127
 epoch: 58, train_loss: 0.9271, test_loss: 0.9490, test_f1: 0.5283
 epoch: 59, train_loss: 0.9245, test_loss: 0.9515, test_f1: 0.5154
 epoch: 60, train_loss: 0.9192, test_loss: 0.9494, test_f1: 0.5265
 epoch: 61, train_loss: 0.9237, test_loss: 0.9538, test_f1: 0.5168
 epoch: 62, train_loss: 0.9157, test_loss: 0.9510, test_f1: 0.5236
 epoch: 63, train_loss: 0.9203, test_loss: 0.9539, test_f1: 0.5222
 epoch: 64, train_loss: 0.9165, test_loss: 0.9538, test_f1: 0.5164
 epoch: 65, train_loss: 0.9187, test_loss: 0.9565, test_f1: 0.5198
 epoch: 66, train_loss: 0.9184, test_loss: 0.9504, test_f1: 0.5164
 epoch: 67, train_loss: 0.9174, test_loss: 0.9455, test_f1: 0.5177
 epoch: 68, train_loss: 0.9052, test_loss: 0.9461, test_f1: 0.5186
 epoch: 69, train_loss: 0.9114, test_loss: 0.9463, test_f1: 0.5184
 epoch: 70, train_loss: 0.9144, test_loss: 0.9534, test_f1: 0.5159
 epoch: 71, train_loss: 0.9055, test_loss: 0.9564, test_f1: 0.5202
 epoch: 72, train_loss: 0.9056, test_loss: 0.9511, test_f1: 0.5277
 epoch: 73, train_loss: 0.9011, test_loss: 0.9479, test_f1: 0.5213
 epoch: 74, train_loss: 0.9087, test_loss: 0.9602, test_f1: 0.5260
 epoch: 75, train_loss: 0.9092, test_loss: 0.9512, test_f1: 0.5183
 epoch: 76, train_loss: 0.9072, test_loss: 0.9525, test_f1: 0.5203
 epoch: 77, train_loss: 0.9027, test_loss: 0.9508, test_f1: 0.5294
 epoch: 78, train_loss: 0.8996, test_loss: 0.9481, test_f1: 0.5295
 epoch: 79, train_loss: 0.9079, test_loss: 0.9528, test_f1: 0.5259
 epoch: 80, train_loss: 0.8987, test_loss: 0.9464, test_f1: 0.5229
 epoch: 81, train_loss: 0.8995, test_loss: 0.9517, test_f1: 0.5225
 epoch: 82, train_loss: 0.8960, test_loss: 0.9513, test_f1: 0.5249
 epoch: 83, train_loss: 0.9029, test_loss: 0.9472, test_f1: 0.5259
 epoch: 84, train_loss: 0.8972, test_loss: 0.9447, test_f1: 0.5249
 epoch: 85, train_loss: 0.8926, test_loss: 0.9525, test_f1: 0.5293
 epoch: 86, train_loss: 0.8995, test_loss: 0.9565, test_f1: 0.5328
 epoch: 87, train_loss: 0.8937, test_loss: 0.9514, test_f1: 0.5241
 epoch: 88, train_loss: 0.8948, test_loss: 0.9485, test_f1: 0.5337
 epoch: 89, train_loss: 0.8958, test_loss: 0.9387, test_f1: 0.5328
 epoch: 90, train_loss: 0.8842, test_loss: 0.9502, test_f1: 0.5282
 epoch: 91, train_loss: 0.8963, test_loss: 0.9490, test_f1: 0.5211
 epoch: 92, train_loss: 0.8930, test_loss: 0.9548, test_f1: 0.5264
 epoch: 93, train_loss: 0.8893, test_loss: 0.9549, test_f1: 0.5325
 epoch: 94, train_loss: 0.8875, test_loss: 0.9476, test_f1: 0.5352
 epoch: 95, train_loss: 0.8995, test_loss: 0.9519, test_f1: 0.5274
 epoch: 96, train_loss: 0.8920, test_loss: 0.9504, test_f1: 0.5302
 epoch: 97, train_loss: 0.8879, test_loss: 0.9486, test_f1: 0.5289
 epoch: 98, train_loss: 0.8899, test_loss: 0.9455, test_f1: 0.5253
 epoch: 99, train_loss: 0.8960, test_loss: 0.9572, test_f1: 0.5349
##################ITERATION #2 ****************************************
 epoch: 0, train_loss: 1.3225, test_loss: 1.3356, test_f1: 0.2270
 epoch: 1, train_loss: 1.2992, test_loss: 1.3117, test_f1: 0.2270
 epoch: 2, train_loss: 1.2895, test_loss: 1.2878, test_f1: 0.2270
 epoch: 3, train_loss: 1.2760, test_loss: 1.2682, test_f1: 0.2270
 epoch: 4, train_loss: 1.2648, test_loss: 1.2502, test_f1: 0.2270
 epoch: 5, train_loss: 1.2483, test_loss: 1.2334, test_f1: 0.2270
 epoch: 6, train_loss: 1.2361, test_loss: 1.2178, test_f1: 0.2295
 epoch: 7, train_loss: 1.2237, test_loss: 1.2010, test_f1: 0.2440
 epoch: 8, train_loss: 1.2119, test_loss: 1.1862, test_f1: 0.2454
 epoch: 9, train_loss: 1.1942, test_loss: 1.1704, test_f1: 0.2690
 epoch: 10, train_loss: 1.1855, test_loss: 1.1546, test_f1: 0.3263
 epoch: 11, train_loss: 1.1716, test_loss: 1.1408, test_f1: 0.3779
 epoch: 12, train_loss: 1.1552, test_loss: 1.1235, test_f1: 0.4147
 epoch: 13, train_loss: 1.1412, test_loss: 1.1106, test_f1: 0.3970
 epoch: 14, train_loss: 1.1241, test_loss: 1.0968, test_f1: 0.4263
 epoch: 15, train_loss: 1.1143, test_loss: 1.0821, test_f1: 0.4111
 epoch: 16, train_loss: 1.1014, test_loss: 1.0639, test_f1: 0.4242
 epoch: 17, train_loss: 1.0872, test_loss: 1.0539, test_f1: 0.4182
 epoch: 18, train_loss: 1.0726, test_loss: 1.0409, test_f1: 0.4467
 epoch: 19, train_loss: 1.0588, test_loss: 1.0312, test_f1: 0.4402
 epoch: 20, train_loss: 1.0428, test_loss: 1.0217, test_f1: 0.4540
 epoch: 21, train_loss: 1.0380, test_loss: 1.0151, test_f1: 0.4471
 epoch: 22, train_loss: 1.0281, test_loss: 1.0111, test_f1: 0.4468
 epoch: 23, train_loss: 1.0219, test_loss: 1.0062, test_f1: 0.4748
 epoch: 24, train_loss: 1.0131, test_loss: 1.0078, test_f1: 0.4623
 epoch: 25, train_loss: 1.0003, test_loss: 1.0003, test_f1: 0.4931
 epoch: 26, train_loss: 1.0014, test_loss: 1.0066, test_f1: 0.4576
 epoch: 27, train_loss: 0.9880, test_loss: 0.9916, test_f1: 0.4860
 epoch: 28, train_loss: 0.9894, test_loss: 0.9869, test_f1: 0.4947
 epoch: 29, train_loss: 0.9857, test_loss: 0.9897, test_f1: 0.4835
 epoch: 30, train_loss: 0.9822, test_loss: 0.9857, test_f1: 0.4907
 epoch: 31, train_loss: 0.9710, test_loss: 0.9799, test_f1: 0.4978
 epoch: 32, train_loss: 0.9667, test_loss: 0.9772, test_f1: 0.4945
 epoch: 33, train_loss: 0.9658, test_loss: 0.9825, test_f1: 0.4889
 epoch: 34, train_loss: 0.9612, test_loss: 0.9768, test_f1: 0.5079
 epoch: 35, train_loss: 0.9578, test_loss: 0.9672, test_f1: 0.5003
 epoch: 36, train_loss: 0.9571, test_loss: 0.9755, test_f1: 0.4786
 epoch: 37, train_loss: 0.9533, test_loss: 0.9691, test_f1: 0.5054
 epoch: 38, train_loss: 0.9455, test_loss: 0.9679, test_f1: 0.4962
 epoch: 39, train_loss: 0.9398, test_loss: 0.9547, test_f1: 0.4996
 epoch: 40, train_loss: 0.9397, test_loss: 0.9547, test_f1: 0.5036
 epoch: 41, train_loss: 0.9412, test_loss: 0.9524, test_f1: 0.5084
 epoch: 42, train_loss: 0.9311, test_loss: 0.9484, test_f1: 0.5131
 epoch: 43, train_loss: 0.9357, test_loss: 0.9529, test_f1: 0.5069
 epoch: 44, train_loss: 0.9389, test_loss: 0.9458, test_f1: 0.5144
 epoch: 45, train_loss: 0.9210, test_loss: 0.9575, test_f1: 0.5121
 epoch: 46, train_loss: 0.9250, test_loss: 0.9429, test_f1: 0.5093
 epoch: 47, train_loss: 0.9189, test_loss: 0.9518, test_f1: 0.5128
 epoch: 48, train_loss: 0.9286, test_loss: 0.9505, test_f1: 0.5153
 epoch: 49, train_loss: 0.9110, test_loss: 0.9516, test_f1: 0.5131
 epoch: 50, train_loss: 0.9222, test_loss: 0.9529, test_f1: 0.5145
 epoch: 51, train_loss: 0.9120, test_loss: 0.9381, test_f1: 0.5246
 epoch: 52, train_loss: 0.9106, test_loss: 0.9366, test_f1: 0.5190
 epoch: 53, train_loss: 0.9051, test_loss: 0.9365, test_f1: 0.5159
 epoch: 54, train_loss: 0.9092, test_loss: 0.9410, test_f1: 0.5214
 epoch: 55, train_loss: 0.8998, test_loss: 0.9430, test_f1: 0.5107
 epoch: 56, train_loss: 0.8996, test_loss: 0.9364, test_f1: 0.5249
 epoch: 57, train_loss: 0.9015, test_loss: 0.9277, test_f1: 0.5255
 epoch: 58, train_loss: 0.8973, test_loss: 0.9342, test_f1: 0.5178
 epoch: 59, train_loss: 0.8923, test_loss: 0.9335, test_f1: 0.5271
 epoch: 60, train_loss: 0.8969, test_loss: 0.9336, test_f1: 0.5232
 epoch: 61, train_loss: 0.8968, test_loss: 0.9291, test_f1: 0.5213
 epoch: 62, train_loss: 0.8995, test_loss: 0.9332, test_f1: 0.5207
 epoch: 63, train_loss: 0.8931, test_loss: 0.9307, test_f1: 0.5235
 epoch: 64, train_loss: 0.8940, test_loss: 0.9332, test_f1: 0.5239
 epoch: 65, train_loss: 0.9032, test_loss: 0.9249, test_f1: 0.5289
 epoch: 66, train_loss: 0.8936, test_loss: 0.9283, test_f1: 0.5266
 epoch: 67, train_loss: 0.8952, test_loss: 0.9296, test_f1: 0.5254
 epoch: 68, train_loss: 0.8883, test_loss: 0.9299, test_f1: 0.5250
 epoch: 69, train_loss: 0.8901, test_loss: 0.9311, test_f1: 0.5199
 epoch: 70, train_loss: 0.8911, test_loss: 0.9272, test_f1: 0.5230
 epoch: 71, train_loss: 0.8903, test_loss: 0.9233, test_f1: 0.5284
 epoch: 72, train_loss: 0.8844, test_loss: 0.9297, test_f1: 0.5256
 epoch: 73, train_loss: 0.8804, test_loss: 0.9267, test_f1: 0.5207
 epoch: 74, train_loss: 0.8820, test_loss: 0.9218, test_f1: 0.5208
 epoch: 75, train_loss: 0.8834, test_loss: 0.9163, test_f1: 0.5173
 epoch: 76, train_loss: 0.8857, test_loss: 0.9167, test_f1: 0.5340
 epoch: 77, train_loss: 0.8875, test_loss: 0.9193, test_f1: 0.5277
 epoch: 78, train_loss: 0.8830, test_loss: 0.9238, test_f1: 0.5258
 epoch: 79, train_loss: 0.8908, test_loss: 0.9238, test_f1: 0.5278
 epoch: 80, train_loss: 0.8813, test_loss: 0.9214, test_f1: 0.5223
 epoch: 81, train_loss: 0.8846, test_loss: 0.9206, test_f1: 0.5198
 epoch: 82, train_loss: 0.8762, test_loss: 0.9160, test_f1: 0.5242
 epoch: 83, train_loss: 0.8730, test_loss: 0.9154, test_f1: 0.5272
 epoch: 84, train_loss: 0.8720, test_loss: 0.9116, test_f1: 0.5175
 epoch: 85, train_loss: 0.8740, test_loss: 0.9128, test_f1: 0.5290
 epoch: 86, train_loss: 0.8747, test_loss: 0.9082, test_f1: 0.5316
 epoch: 87, train_loss: 0.8684, test_loss: 0.9073, test_f1: 0.5260
 epoch: 88, train_loss: 0.8724, test_loss: 0.9126, test_f1: 0.5256
 epoch: 89, train_loss: 0.8695, test_loss: 0.9149, test_f1: 0.5326
 epoch: 90, train_loss: 0.8811, test_loss: 0.9142, test_f1: 0.5228
 epoch: 91, train_loss: 0.8717, test_loss: 0.9050, test_f1: 0.5263
 epoch: 92, train_loss: 0.8708, test_loss: 0.9060, test_f1: 0.5219
 epoch: 93, train_loss: 0.8708, test_loss: 0.9103, test_f1: 0.5288
 epoch: 94, train_loss: 0.8708, test_loss: 0.9151, test_f1: 0.5179
 epoch: 95, train_loss: 0.8646, test_loss: 0.9101, test_f1: 0.5350
 epoch: 96, train_loss: 0.8669, test_loss: 0.9077, test_f1: 0.5247
 epoch: 97, train_loss: 0.8675, test_loss: 0.9084, test_f1: 0.5305
 epoch: 98, train_loss: 0.8601, test_loss: 0.9014, test_f1: 0.5286
 epoch: 99, train_loss: 0.8634, test_loss: 0.9067, test_f1: 0.5302
##################ITERATION #3 ****************************************
 epoch: 0, train_loss: 1.3054, test_loss: 1.3385, test_f1: 0.2270
 epoch: 1, train_loss: 1.2675, test_loss: 1.3108, test_f1: 0.2270
 epoch: 2, train_loss: 1.2391, test_loss: 1.2477, test_f1: 0.3059
 epoch: 3, train_loss: 1.2157, test_loss: 1.1936, test_f1: 0.3303
 epoch: 4, train_loss: 1.1939, test_loss: 1.1690, test_f1: 0.3495
 epoch: 5, train_loss: 1.1700, test_loss: 1.1493, test_f1: 0.3532
 epoch: 6, train_loss: 1.1478, test_loss: 1.1349, test_f1: 0.3597
 epoch: 7, train_loss: 1.1286, test_loss: 1.1147, test_f1: 0.3576
 epoch: 8, train_loss: 1.1180, test_loss: 1.1124, test_f1: 0.3671
 epoch: 9, train_loss: 1.1041, test_loss: 1.0937, test_f1: 0.3734
 epoch: 10, train_loss: 1.0877, test_loss: 1.0835, test_f1: 0.3815
 epoch: 11, train_loss: 1.0762, test_loss: 1.0720, test_f1: 0.3896
 epoch: 12, train_loss: 1.0636, test_loss: 1.0706, test_f1: 0.3958
 epoch: 13, train_loss: 1.0561, test_loss: 1.0558, test_f1: 0.4011
 epoch: 14, train_loss: 1.0441, test_loss: 1.0545, test_f1: 0.4106
 epoch: 15, train_loss: 1.0324, test_loss: 1.0459, test_f1: 0.4328
 epoch: 16, train_loss: 1.0237, test_loss: 1.0414, test_f1: 0.4362
 epoch: 17, train_loss: 1.0136, test_loss: 1.0310, test_f1: 0.4492
 epoch: 18, train_loss: 1.0078, test_loss: 1.0217, test_f1: 0.4577
 epoch: 19, train_loss: 1.0028, test_loss: 1.0187, test_f1: 0.4577
 epoch: 20, train_loss: 0.9903, test_loss: 1.0179, test_f1: 0.4736
 epoch: 21, train_loss: 0.9865, test_loss: 1.0012, test_f1: 0.4782
 epoch: 22, train_loss: 0.9819, test_loss: 1.0017, test_f1: 0.4846
 epoch: 23, train_loss: 0.9752, test_loss: 0.9837, test_f1: 0.4972
 epoch: 24, train_loss: 0.9715, test_loss: 1.0045, test_f1: 0.4925
 epoch: 25, train_loss: 0.9636, test_loss: 0.9685, test_f1: 0.4975
 epoch: 26, train_loss: 0.9600, test_loss: 0.9738, test_f1: 0.4954
 epoch: 27, train_loss: 0.9479, test_loss: 0.9730, test_f1: 0.4902
 epoch: 28, train_loss: 0.9514, test_loss: 0.9493, test_f1: 0.4969
 epoch: 29, train_loss: 0.9408, test_loss: 0.9553, test_f1: 0.4967
 epoch: 30, train_loss: 0.9439, test_loss: 0.9419, test_f1: 0.5071
 epoch: 31, train_loss: 0.9330, test_loss: 0.9389, test_f1: 0.5058
 epoch: 32, train_loss: 0.9324, test_loss: 0.9450, test_f1: 0.4954
 epoch: 33, train_loss: 0.9325, test_loss: 0.9366, test_f1: 0.5066
 epoch: 34, train_loss: 0.9224, test_loss: 0.9318, test_f1: 0.5091
 epoch: 35, train_loss: 0.9208, test_loss: 0.9383, test_f1: 0.4952
 epoch: 36, train_loss: 0.9137, test_loss: 0.9281, test_f1: 0.5085
 epoch: 37, train_loss: 0.9147, test_loss: 0.9274, test_f1: 0.5127
 epoch: 38, train_loss: 0.9149, test_loss: 0.9042, test_f1: 0.5148
 epoch: 39, train_loss: 0.9128, test_loss: 0.9200, test_f1: 0.5086
 epoch: 40, train_loss: 0.9028, test_loss: 0.9229, test_f1: 0.5071
 epoch: 41, train_loss: 0.9033, test_loss: 0.9203, test_f1: 0.5097
 epoch: 42, train_loss: 0.9052, test_loss: 0.9226, test_f1: 0.5252
 epoch: 43, train_loss: 0.9010, test_loss: 0.9137, test_f1: 0.5234
 epoch: 44, train_loss: 0.8939, test_loss: 0.9087, test_f1: 0.5202
 epoch: 45, train_loss: 0.9010, test_loss: 0.9082, test_f1: 0.5315
 epoch: 46, train_loss: 0.8931, test_loss: 0.9160, test_f1: 0.5137
 epoch: 47, train_loss: 0.8879, test_loss: 0.9000, test_f1: 0.5360
 epoch: 48, train_loss: 0.8849, test_loss: 0.9440, test_f1: 0.5224
 epoch: 49, train_loss: 0.8890, test_loss: 0.9049, test_f1: 0.5275
 epoch: 50, train_loss: 0.8852, test_loss: 0.9097, test_f1: 0.5369
 epoch: 51, train_loss: 0.8834, test_loss: 0.9060, test_f1: 0.5304
 epoch: 52, train_loss: 0.8771, test_loss: 0.8970, test_f1: 0.5286
 epoch: 53, train_loss: 0.8726, test_loss: 0.9239, test_f1: 0.5224
 epoch: 54, train_loss: 0.8739, test_loss: 0.9182, test_f1: 0.5203
 epoch: 55, train_loss: 0.8704, test_loss: 0.9035, test_f1: 0.5278
 epoch: 56, train_loss: 0.8643, test_loss: 0.9015, test_f1: 0.5345
 epoch: 57, train_loss: 0.8642, test_loss: 0.9032, test_f1: 0.5296
 epoch: 58, train_loss: 0.8719, test_loss: 0.9042, test_f1: 0.5340
 epoch: 59, train_loss: 0.8747, test_loss: 0.9200, test_f1: 0.5281
 epoch: 60, train_loss: 0.8658, test_loss: 0.9056, test_f1: 0.5310
 epoch: 61, train_loss: 0.8706, test_loss: 0.9006, test_f1: 0.5340
 epoch: 62, train_loss: 0.8705, test_loss: 0.9033, test_f1: 0.5330
 epoch: 63, train_loss: 0.8660, test_loss: 0.8948, test_f1: 0.5335
 epoch: 64, train_loss: 0.8653, test_loss: 0.9144, test_f1: 0.5171
 epoch: 65, train_loss: 0.8602, test_loss: 0.8970, test_f1: 0.5308
 epoch: 66, train_loss: 0.8694, test_loss: 0.8996, test_f1: 0.5405
 epoch: 67, train_loss: 0.8705, test_loss: 0.9139, test_f1: 0.5192
 epoch: 68, train_loss: 0.8593, test_loss: 0.9115, test_f1: 0.5155
 epoch: 69, train_loss: 0.8632, test_loss: 0.9082, test_f1: 0.5176
 epoch: 70, train_loss: 0.8658, test_loss: 0.8976, test_f1: 0.5385
 epoch: 71, train_loss: 0.8628, test_loss: 0.9095, test_f1: 0.5241
 epoch: 72, train_loss: 0.8530, test_loss: 0.8889, test_f1: 0.5407
 epoch: 73, train_loss: 0.8558, test_loss: 0.8977, test_f1: 0.5425
 epoch: 74, train_loss: 0.8537, test_loss: 0.8907, test_f1: 0.5310
 epoch: 75, train_loss: 0.8524, test_loss: 0.9028, test_f1: 0.5257
 epoch: 76, train_loss: 0.8458, test_loss: 0.8951, test_f1: 0.5437
 epoch: 77, train_loss: 0.8559, test_loss: 0.8929, test_f1: 0.5309
 epoch: 78, train_loss: 0.8543, test_loss: 0.9065, test_f1: 0.5318
 epoch: 79, train_loss: 0.8571, test_loss: 0.9059, test_f1: 0.5246
 epoch: 80, train_loss: 0.8491, test_loss: 0.9250, test_f1: 0.5252
 epoch: 81, train_loss: 0.8528, test_loss: 0.8989, test_f1: 0.5445
 epoch: 82, train_loss: 0.8498, test_loss: 0.9380, test_f1: 0.5175
 epoch: 83, train_loss: 0.8552, test_loss: 0.8971, test_f1: 0.5437
 epoch: 84, train_loss: 0.8465, test_loss: 0.9155, test_f1: 0.5203
 epoch: 85, train_loss: 0.8519, test_loss: 0.8865, test_f1: 0.5390
 epoch: 86, train_loss: 0.8522, test_loss: 0.8996, test_f1: 0.5381
 epoch: 87, train_loss: 0.8480, test_loss: 0.9275, test_f1: 0.5298
 epoch: 88, train_loss: 0.8480, test_loss: 0.8961, test_f1: 0.5469
 epoch: 89, train_loss: 0.8454, test_loss: 0.8984, test_f1: 0.5293
 epoch: 90, train_loss: 0.8489, test_loss: 0.8994, test_f1: 0.5374
 epoch: 91, train_loss: 0.8441, test_loss: 0.8953, test_f1: 0.5496
 epoch: 92, train_loss: 0.8429, test_loss: 0.8999, test_f1: 0.5449
 epoch: 93, train_loss: 0.8361, test_loss: 0.9056, test_f1: 0.5286
 epoch: 94, train_loss: 0.8407, test_loss: 0.9106, test_f1: 0.5345
 epoch: 95, train_loss: 0.8368, test_loss: 0.8989, test_f1: 0.5466
 epoch: 96, train_loss: 0.8323, test_loss: 0.9058, test_f1: 0.5488
 epoch: 97, train_loss: 0.8377, test_loss: 0.9054, test_f1: 0.5381
 epoch: 98, train_loss: 0.8395, test_loss: 0.9224, test_f1: 0.5352
 epoch: 99, train_loss: 0.8446, test_loss: 0.8932, test_f1: 0.5430
##################ITERATION #4 ****************************************
 epoch: 0, train_loss: 1.2820, test_loss: 1.3121, test_f1: 0.2270
 epoch: 1, train_loss: 1.2302, test_loss: 1.2450, test_f1: 0.2295
 epoch: 2, train_loss: 1.2039, test_loss: 1.1916, test_f1: 0.3230
 epoch: 3, train_loss: 1.1759, test_loss: 1.1526, test_f1: 0.3887
 epoch: 4, train_loss: 1.1510, test_loss: 1.1312, test_f1: 0.4043
 epoch: 5, train_loss: 1.1376, test_loss: 1.1132, test_f1: 0.4326
 epoch: 6, train_loss: 1.1203, test_loss: 1.0994, test_f1: 0.4329
 epoch: 7, train_loss: 1.1049, test_loss: 1.0883, test_f1: 0.4277
 epoch: 8, train_loss: 1.0859, test_loss: 1.0785, test_f1: 0.4307
 epoch: 9, train_loss: 1.0791, test_loss: 1.0720, test_f1: 0.4325
 epoch: 10, train_loss: 1.0635, test_loss: 1.0634, test_f1: 0.4389
 epoch: 11, train_loss: 1.0571, test_loss: 1.0577, test_f1: 0.4472
 epoch: 12, train_loss: 1.0459, test_loss: 1.0568, test_f1: 0.4488
 epoch: 13, train_loss: 1.0469, test_loss: 1.0436, test_f1: 0.4479
 epoch: 14, train_loss: 1.0334, test_loss: 1.0493, test_f1: 0.4439
 epoch: 15, train_loss: 1.0284, test_loss: 1.0370, test_f1: 0.4694
 epoch: 16, train_loss: 1.0216, test_loss: 1.0292, test_f1: 0.4530
 epoch: 17, train_loss: 1.0139, test_loss: 1.0235, test_f1: 0.4692
 epoch: 18, train_loss: 1.0107, test_loss: 1.0250, test_f1: 0.4591
 epoch: 19, train_loss: 1.0098, test_loss: 1.0197, test_f1: 0.4635
 epoch: 20, train_loss: 1.0040, test_loss: 1.0146, test_f1: 0.4740
 epoch: 21, train_loss: 0.9962, test_loss: 1.0063, test_f1: 0.4803
 epoch: 22, train_loss: 0.9958, test_loss: 1.0034, test_f1: 0.4854
 epoch: 23, train_loss: 0.9879, test_loss: 0.9972, test_f1: 0.4748
 epoch: 24, train_loss: 0.9844, test_loss: 1.0098, test_f1: 0.4747
 epoch: 25, train_loss: 0.9769, test_loss: 0.9939, test_f1: 0.4786
 epoch: 26, train_loss: 0.9842, test_loss: 0.9896, test_f1: 0.4922
 epoch: 27, train_loss: 0.9761, test_loss: 0.9922, test_f1: 0.4887
 epoch: 28, train_loss: 0.9654, test_loss: 0.9892, test_f1: 0.5011
 epoch: 29, train_loss: 0.9608, test_loss: 0.9874, test_f1: 0.4875
 epoch: 30, train_loss: 0.9589, test_loss: 0.9856, test_f1: 0.5073
 epoch: 31, train_loss: 0.9571, test_loss: 0.9834, test_f1: 0.4932
 epoch: 32, train_loss: 0.9495, test_loss: 0.9754, test_f1: 0.4957
 epoch: 33, train_loss: 0.9489, test_loss: 0.9713, test_f1: 0.5032
 epoch: 34, train_loss: 0.9492, test_loss: 0.9598, test_f1: 0.5057
 epoch: 35, train_loss: 0.9427, test_loss: 0.9794, test_f1: 0.4974
 epoch: 36, train_loss: 0.9486, test_loss: 0.9725, test_f1: 0.5093
 epoch: 37, train_loss: 0.9339, test_loss: 0.9727, test_f1: 0.5156
 epoch: 38, train_loss: 0.9324, test_loss: 0.9744, test_f1: 0.5099
 epoch: 39, train_loss: 0.9274, test_loss: 0.9599, test_f1: 0.5130
 epoch: 40, train_loss: 0.9262, test_loss: 0.9609, test_f1: 0.5024
 epoch: 41, train_loss: 0.9276, test_loss: 0.9611, test_f1: 0.5024
 epoch: 42, train_loss: 0.9252, test_loss: 0.9639, test_f1: 0.5035
 epoch: 43, train_loss: 0.9173, test_loss: 0.9562, test_f1: 0.5244
 epoch: 44, train_loss: 0.9125, test_loss: 0.9570, test_f1: 0.5148
 epoch: 45, train_loss: 0.9072, test_loss: 0.9524, test_f1: 0.5189
 epoch: 46, train_loss: 0.9176, test_loss: 0.9540, test_f1: 0.5213
 epoch: 47, train_loss: 0.9154, test_loss: 0.9443, test_f1: 0.5066
 epoch: 48, train_loss: 0.9022, test_loss: 0.9273, test_f1: 0.5164
 epoch: 49, train_loss: 0.9056, test_loss: 0.9331, test_f1: 0.5283
 epoch: 50, train_loss: 0.9064, test_loss: 0.9380, test_f1: 0.5211
 epoch: 51, train_loss: 0.8948, test_loss: 0.9389, test_f1: 0.5261
 epoch: 52, train_loss: 0.8959, test_loss: 0.9390, test_f1: 0.5229
 epoch: 53, train_loss: 0.8897, test_loss: 0.9367, test_f1: 0.5175
 epoch: 54, train_loss: 0.8910, test_loss: 0.9305, test_f1: 0.5184
 epoch: 55, train_loss: 0.8958, test_loss: 0.9463, test_f1: 0.5199
 epoch: 56, train_loss: 0.8855, test_loss: 0.9342, test_f1: 0.5210
 epoch: 57, train_loss: 0.8985, test_loss: 0.9428, test_f1: 0.5178
 epoch: 58, train_loss: 0.8892, test_loss: 0.9344, test_f1: 0.5259
 epoch: 59, train_loss: 0.8895, test_loss: 0.9305, test_f1: 0.5164
 epoch: 60, train_loss: 0.8882, test_loss: 0.9421, test_f1: 0.5239
 epoch: 61, train_loss: 0.8839, test_loss: 0.9371, test_f1: 0.5211
 epoch: 62, train_loss: 0.8810, test_loss: 0.9335, test_f1: 0.5244
 epoch: 63, train_loss: 0.8815, test_loss: 0.9405, test_f1: 0.5209
 epoch: 64, train_loss: 0.8869, test_loss: 0.9386, test_f1: 0.5295
 epoch: 65, train_loss: 0.8818, test_loss: 0.9376, test_f1: 0.5250
 epoch: 66, train_loss: 0.8775, test_loss: 0.9376, test_f1: 0.5279
 epoch: 67, train_loss: 0.8769, test_loss: 0.9416, test_f1: 0.5242
 epoch: 68, train_loss: 0.8764, test_loss: 0.9433, test_f1: 0.5275
 epoch: 69, train_loss: 0.8706, test_loss: 0.9393, test_f1: 0.5261
 epoch: 70, train_loss: 0.8797, test_loss: 0.9401, test_f1: 0.5263
 epoch: 71, train_loss: 0.8746, test_loss: 0.9364, test_f1: 0.5305
 epoch: 72, train_loss: 0.8781, test_loss: 0.9403, test_f1: 0.5221
 epoch: 73, train_loss: 0.8725, test_loss: 0.9344, test_f1: 0.5252
 epoch: 74, train_loss: 0.8711, test_loss: 0.9427, test_f1: 0.5247
 epoch: 75, train_loss: 0.8750, test_loss: 0.9288, test_f1: 0.5182
 epoch: 76, train_loss: 0.8658, test_loss: 0.9443, test_f1: 0.5181
 epoch: 77, train_loss: 0.8749, test_loss: 0.9489, test_f1: 0.5208
 epoch: 78, train_loss: 0.8713, test_loss: 0.9408, test_f1: 0.5210
 epoch: 79, train_loss: 0.8635, test_loss: 0.9401, test_f1: 0.5258
 epoch: 80, train_loss: 0.8741, test_loss: 0.9418, test_f1: 0.5164
 epoch: 81, train_loss: 0.8701, test_loss: 0.9517, test_f1: 0.5250
 epoch: 82, train_loss: 0.8718, test_loss: 0.9411, test_f1: 0.5271
 epoch: 83, train_loss: 0.8709, test_loss: 0.9380, test_f1: 0.5178
 epoch: 84, train_loss: 0.8690, test_loss: 0.9514, test_f1: 0.5202
 epoch: 85, train_loss: 0.8694, test_loss: 0.9500, test_f1: 0.5122
 epoch: 86, train_loss: 0.8573, test_loss: 0.9456, test_f1: 0.5258
 epoch: 87, train_loss: 0.8598, test_loss: 0.9461, test_f1: 0.5237
 epoch: 88, train_loss: 0.8656, test_loss: 0.9425, test_f1: 0.5225
 epoch: 89, train_loss: 0.8591, test_loss: 0.9398, test_f1: 0.5179
 epoch: 90, train_loss: 0.8557, test_loss: 0.9427, test_f1: 0.5275
 epoch: 91, train_loss: 0.8594, test_loss: 0.9428, test_f1: 0.5230
 epoch: 92, train_loss: 0.8611, test_loss: 0.9380, test_f1: 0.5242
 epoch: 93, train_loss: 0.8569, test_loss: 0.9409, test_f1: 0.5241
 epoch: 94, train_loss: 0.8576, test_loss: 0.9447, test_f1: 0.5278
 epoch: 95, train_loss: 0.8572, test_loss: 0.9418, test_f1: 0.5330
 epoch: 96, train_loss: 0.8596, test_loss: 0.9350, test_f1: 0.5262
 epoch: 97, train_loss: 0.8510, test_loss: 0.9388, test_f1: 0.5250
 epoch: 98, train_loss: 0.8529, test_loss: 0.9410, test_f1: 0.5314
 epoch: 99, train_loss: 0.8502, test_loss: 0.9403, test_f1: 0.5086
##################ITERATION #5 ****************************************
 epoch: 0, train_loss: 1.2440, test_loss: 1.3577, test_f1: 0.2270
 epoch: 1, train_loss: 1.1782, test_loss: 1.2646, test_f1: 0.3178
 epoch: 2, train_loss: 1.1508, test_loss: 1.1255, test_f1: 0.3432
 epoch: 3, train_loss: 1.1256, test_loss: 1.0832, test_f1: 0.3455
 epoch: 4, train_loss: 1.1142, test_loss: 1.0703, test_f1: 0.3578
 epoch: 5, train_loss: 1.0912, test_loss: 1.0584, test_f1: 0.3606
 epoch: 6, train_loss: 1.0779, test_loss: 1.0491, test_f1: 0.3697
 epoch: 7, train_loss: 1.0696, test_loss: 1.0398, test_f1: 0.3963
 epoch: 8, train_loss: 1.0594, test_loss: 1.0415, test_f1: 0.4071
 epoch: 9, train_loss: 1.0505, test_loss: 1.0356, test_f1: 0.4243
 epoch: 10, train_loss: 1.0358, test_loss: 1.0290, test_f1: 0.4277
 epoch: 11, train_loss: 1.0262, test_loss: 1.0077, test_f1: 0.4443
 epoch: 12, train_loss: 1.0293, test_loss: 1.0117, test_f1: 0.4534
 epoch: 13, train_loss: 1.0129, test_loss: 0.9974, test_f1: 0.4627
 epoch: 14, train_loss: 1.0083, test_loss: 1.0044, test_f1: 0.4610
 epoch: 15, train_loss: 0.9977, test_loss: 0.9965, test_f1: 0.4782
 epoch: 16, train_loss: 0.9932, test_loss: 0.9782, test_f1: 0.4736
 epoch: 17, train_loss: 0.9872, test_loss: 0.9968, test_f1: 0.4810
 epoch: 18, train_loss: 0.9804, test_loss: 0.9795, test_f1: 0.4902
 epoch: 19, train_loss: 0.9783, test_loss: 0.9634, test_f1: 0.4968
 epoch: 20, train_loss: 0.9683, test_loss: 0.9727, test_f1: 0.4868
 epoch: 21, train_loss: 0.9590, test_loss: 0.9715, test_f1: 0.4911
 epoch: 22, train_loss: 0.9557, test_loss: 0.9704, test_f1: 0.4954
 epoch: 23, train_loss: 0.9523, test_loss: 0.9722, test_f1: 0.5077
 epoch: 24, train_loss: 0.9551, test_loss: 0.9700, test_f1: 0.4945
 epoch: 25, train_loss: 0.9365, test_loss: 0.9618, test_f1: 0.4996
 epoch: 26, train_loss: 0.9418, test_loss: 0.9607, test_f1: 0.5039
 epoch: 27, train_loss: 0.9303, test_loss: 0.9563, test_f1: 0.4997
 epoch: 28, train_loss: 0.9174, test_loss: 0.9758, test_f1: 0.4987
 epoch: 29, train_loss: 0.9273, test_loss: 0.9554, test_f1: 0.5022
 epoch: 30, train_loss: 0.9182, test_loss: 0.9598, test_f1: 0.5042
 epoch: 31, train_loss: 0.9139, test_loss: 0.9629, test_f1: 0.5070
 epoch: 32, train_loss: 0.9047, test_loss: 0.9552, test_f1: 0.4984
 epoch: 33, train_loss: 0.9015, test_loss: 0.9672, test_f1: 0.4991
 epoch: 34, train_loss: 0.9077, test_loss: 0.9711, test_f1: 0.5044
 epoch: 35, train_loss: 0.9039, test_loss: 0.9580, test_f1: 0.5088
 epoch: 36, train_loss: 0.8958, test_loss: 0.9681, test_f1: 0.5082
 epoch: 37, train_loss: 0.8910, test_loss: 0.9659, test_f1: 0.5063
 epoch: 38, train_loss: 0.8967, test_loss: 0.9617, test_f1: 0.5268
 epoch: 39, train_loss: 0.8909, test_loss: 0.9724, test_f1: 0.5226
 epoch: 40, train_loss: 0.8831, test_loss: 0.9570, test_f1: 0.5290
 epoch: 41, train_loss: 0.8838, test_loss: 0.9650, test_f1: 0.5153
 epoch: 42, train_loss: 0.8747, test_loss: 0.9642, test_f1: 0.5304
 epoch: 43, train_loss: 0.8746, test_loss: 0.9649, test_f1: 0.5321
 epoch: 44, train_loss: 0.8746, test_loss: 0.9714, test_f1: 0.5253
 epoch: 45, train_loss: 0.8689, test_loss: 0.9636, test_f1: 0.5313
 epoch: 46, train_loss: 0.8736, test_loss: 0.9647, test_f1: 0.5237
 epoch: 47, train_loss: 0.8673, test_loss: 0.9651, test_f1: 0.5287
 epoch: 48, train_loss: 0.8653, test_loss: 0.9778, test_f1: 0.5282
 epoch: 49, train_loss: 0.8628, test_loss: 0.9804, test_f1: 0.5350
 epoch: 50, train_loss: 0.8613, test_loss: 0.9699, test_f1: 0.5377
 epoch: 51, train_loss: 0.8538, test_loss: 0.9647, test_f1: 0.5349
 epoch: 52, train_loss: 0.8524, test_loss: 0.9655, test_f1: 0.5312
 epoch: 53, train_loss: 0.8475, test_loss: 0.9689, test_f1: 0.5374
 epoch: 54, train_loss: 0.8532, test_loss: 0.9618, test_f1: 0.5367
 epoch: 55, train_loss: 0.8485, test_loss: 0.9624, test_f1: 0.5341
 epoch: 56, train_loss: 0.8461, test_loss: 0.9691, test_f1: 0.5301
 epoch: 57, train_loss: 0.8506, test_loss: 0.9647, test_f1: 0.5318
 epoch: 58, train_loss: 0.8449, test_loss: 0.9716, test_f1: 0.5346
 epoch: 59, train_loss: 0.8489, test_loss: 0.9762, test_f1: 0.5391
 epoch: 60, train_loss: 0.8512, test_loss: 0.9637, test_f1: 0.5400
 epoch: 61, train_loss: 0.8441, test_loss: 0.9635, test_f1: 0.5389
 epoch: 62, train_loss: 0.8319, test_loss: 0.9644, test_f1: 0.5343
 epoch: 63, train_loss: 0.8413, test_loss: 0.9745, test_f1: 0.5413
 epoch: 64, train_loss: 0.8394, test_loss: 0.9752, test_f1: 0.5420
 epoch: 65, train_loss: 0.8361, test_loss: 0.9765, test_f1: 0.5392
 epoch: 66, train_loss: 0.8476, test_loss: 0.9820, test_f1: 0.5396
 epoch: 67, train_loss: 0.8333, test_loss: 0.9700, test_f1: 0.5448
 epoch: 68, train_loss: 0.8384, test_loss: 0.9756, test_f1: 0.5444
 epoch: 69, train_loss: 0.8314, test_loss: 0.9732, test_f1: 0.5396
 epoch: 70, train_loss: 0.8344, test_loss: 0.9755, test_f1: 0.5448
 epoch: 71, train_loss: 0.8295, test_loss: 0.9749, test_f1: 0.5482
 epoch: 72, train_loss: 0.8282, test_loss: 0.9823, test_f1: 0.5349
 epoch: 73, train_loss: 0.8312, test_loss: 0.9768, test_f1: 0.5435
 epoch: 74, train_loss: 0.8354, test_loss: 0.9726, test_f1: 0.5438
 epoch: 75, train_loss: 0.8290, test_loss: 0.9861, test_f1: 0.5409
 epoch: 76, train_loss: 0.8309, test_loss: 0.9836, test_f1: 0.5419
 epoch: 77, train_loss: 0.8291, test_loss: 0.9695, test_f1: 0.5439
 epoch: 78, train_loss: 0.8155, test_loss: 0.9778, test_f1: 0.5469
 epoch: 79, train_loss: 0.8283, test_loss: 0.9798, test_f1: 0.5486
 epoch: 80, train_loss: 0.8239, test_loss: 0.9897, test_f1: 0.5349
 epoch: 81, train_loss: 0.8232, test_loss: 0.9814, test_f1: 0.5466
 epoch: 82, train_loss: 0.8227, test_loss: 0.9840, test_f1: 0.5447
 epoch: 83, train_loss: 0.8237, test_loss: 0.9863, test_f1: 0.5474
 epoch: 84, train_loss: 0.8284, test_loss: 0.9846, test_f1: 0.5473
 epoch: 85, train_loss: 0.8249, test_loss: 0.9835, test_f1: 0.5441
 epoch: 86, train_loss: 0.8139, test_loss: 0.9788, test_f1: 0.5503
 epoch: 87, train_loss: 0.8176, test_loss: 0.9820, test_f1: 0.5418
 epoch: 88, train_loss: 0.8136, test_loss: 0.9824, test_f1: 0.5486
 epoch: 89, train_loss: 0.8129, test_loss: 0.9723, test_f1: 0.5491
 epoch: 90, train_loss: 0.8114, test_loss: 0.9878, test_f1: 0.5461
 epoch: 91, train_loss: 0.8209, test_loss: 0.9789, test_f1: 0.5443
 epoch: 92, train_loss: 0.8110, test_loss: 0.9843, test_f1: 0.5489
 epoch: 93, train_loss: 0.8059, test_loss: 0.9812, test_f1: 0.5439
 epoch: 94, train_loss: 0.8078, test_loss: 0.9885, test_f1: 0.5505
 epoch: 95, train_loss: 0.8079, test_loss: 0.9896, test_f1: 0.5363
 epoch: 96, train_loss: 0.8068, test_loss: 0.9900, test_f1: 0.5453
 epoch: 97, train_loss: 0.8045, test_loss: 0.9843, test_f1: 0.5630
 epoch: 98, train_loss: 0.7996, test_loss: 0.9830, test_f1: 0.5538
 epoch: 99, train_loss: 0.8127, test_loss: 0.9737, test_f1: 0.5424
##################ITERATION #6 ****************************************
 epoch: 0, train_loss: 1.3029, test_loss: 1.3342, test_f1: 0.2270
 epoch: 1, train_loss: 1.2292, test_loss: 1.2286, test_f1: 0.3289
 epoch: 2, train_loss: 1.1933, test_loss: 1.1714, test_f1: 0.3410
 epoch: 3, train_loss: 1.1737, test_loss: 1.1336, test_f1: 0.3527
 epoch: 4, train_loss: 1.1413, test_loss: 1.1108, test_f1: 0.3613
 epoch: 5, train_loss: 1.1251, test_loss: 1.0952, test_f1: 0.3781
 epoch: 6, train_loss: 1.1096, test_loss: 1.0813, test_f1: 0.4010
 epoch: 7, train_loss: 1.0970, test_loss: 1.0727, test_f1: 0.4166
 epoch: 8, train_loss: 1.0758, test_loss: 1.0646, test_f1: 0.4295
 epoch: 9, train_loss: 1.0616, test_loss: 1.0649, test_f1: 0.4408
 epoch: 10, train_loss: 1.0588, test_loss: 1.0530, test_f1: 0.4570
 epoch: 11, train_loss: 1.0470, test_loss: 1.0354, test_f1: 0.4606
 epoch: 12, train_loss: 1.0345, test_loss: 1.0370, test_f1: 0.4602
 epoch: 13, train_loss: 1.0304, test_loss: 1.0153, test_f1: 0.4749
 epoch: 14, train_loss: 1.0202, test_loss: 1.0134, test_f1: 0.4745
 epoch: 15, train_loss: 1.0119, test_loss: 1.0082, test_f1: 0.4733
 epoch: 16, train_loss: 1.0092, test_loss: 0.9974, test_f1: 0.4786
 epoch: 17, train_loss: 1.0029, test_loss: 1.0061, test_f1: 0.4700
 epoch: 18, train_loss: 0.9854, test_loss: 0.9822, test_f1: 0.4671
 epoch: 19, train_loss: 0.9893, test_loss: 0.9690, test_f1: 0.4806
 epoch: 20, train_loss: 0.9867, test_loss: 0.9722, test_f1: 0.4778
 epoch: 21, train_loss: 0.9709, test_loss: 0.9571, test_f1: 0.4890
 epoch: 22, train_loss: 0.9736, test_loss: 0.9671, test_f1: 0.4875
 epoch: 23, train_loss: 0.9765, test_loss: 0.9565, test_f1: 0.4810
 epoch: 24, train_loss: 0.9659, test_loss: 0.9558, test_f1: 0.4887
 epoch: 25, train_loss: 0.9515, test_loss: 0.9461, test_f1: 0.4857
 epoch: 26, train_loss: 0.9502, test_loss: 0.9530, test_f1: 0.4981
 epoch: 27, train_loss: 0.9515, test_loss: 0.9650, test_f1: 0.4995
 epoch: 28, train_loss: 0.9428, test_loss: 0.9321, test_f1: 0.5239
 epoch: 29, train_loss: 0.9516, test_loss: 0.9316, test_f1: 0.5177
 epoch: 30, train_loss: 0.9431, test_loss: 0.9283, test_f1: 0.5208
 epoch: 31, train_loss: 0.9357, test_loss: 0.9286, test_f1: 0.5207
 epoch: 32, train_loss: 0.9402, test_loss: 0.9274, test_f1: 0.5186
 epoch: 33, train_loss: 0.9312, test_loss: 0.9192, test_f1: 0.5175
 epoch: 34, train_loss: 0.9378, test_loss: 0.9154, test_f1: 0.5251
 epoch: 35, train_loss: 0.9241, test_loss: 0.9120, test_f1: 0.5230
 epoch: 36, train_loss: 0.9249, test_loss: 0.9007, test_f1: 0.5240
 epoch: 37, train_loss: 0.9158, test_loss: 0.9027, test_f1: 0.5284
 epoch: 38, train_loss: 0.9223, test_loss: 0.8963, test_f1: 0.5306
 epoch: 39, train_loss: 0.9159, test_loss: 0.8961, test_f1: 0.5359
 epoch: 40, train_loss: 0.9094, test_loss: 0.9104, test_f1: 0.5173
 epoch: 41, train_loss: 0.9089, test_loss: 0.9060, test_f1: 0.5399
 epoch: 42, train_loss: 0.9069, test_loss: 0.8882, test_f1: 0.5344
 epoch: 43, train_loss: 0.9015, test_loss: 0.8906, test_f1: 0.5369
 epoch: 44, train_loss: 0.8996, test_loss: 0.9213, test_f1: 0.5189
 epoch: 45, train_loss: 0.9050, test_loss: 0.8899, test_f1: 0.5340
 epoch: 46, train_loss: 0.8931, test_loss: 0.8916, test_f1: 0.5374
 epoch: 47, train_loss: 0.9004, test_loss: 0.9067, test_f1: 0.5292
 epoch: 48, train_loss: 0.8923, test_loss: 0.8935, test_f1: 0.5399
 epoch: 49, train_loss: 0.8960, test_loss: 0.8974, test_f1: 0.5381
 epoch: 50, train_loss: 0.8882, test_loss: 0.8835, test_f1: 0.5379
 epoch: 51, train_loss: 0.8804, test_loss: 0.8849, test_f1: 0.5372
 epoch: 52, train_loss: 0.8798, test_loss: 0.8860, test_f1: 0.5420
 epoch: 53, train_loss: 0.8752, test_loss: 0.8871, test_f1: 0.5319
 epoch: 54, train_loss: 0.8754, test_loss: 0.8886, test_f1: 0.5426
 epoch: 55, train_loss: 0.8824, test_loss: 0.8907, test_f1: 0.5382
 epoch: 56, train_loss: 0.8732, test_loss: 0.8733, test_f1: 0.5530
 epoch: 57, train_loss: 0.8719, test_loss: 0.8933, test_f1: 0.5366
 epoch: 58, train_loss: 0.8634, test_loss: 0.8770, test_f1: 0.5449
 epoch: 59, train_loss: 0.8768, test_loss: 0.8745, test_f1: 0.5524
 epoch: 60, train_loss: 0.8638, test_loss: 0.8696, test_f1: 0.5584
 epoch: 61, train_loss: 0.8718, test_loss: 0.8866, test_f1: 0.5253
 epoch: 62, train_loss: 0.8690, test_loss: 0.8749, test_f1: 0.5458
 epoch: 63, train_loss: 0.8582, test_loss: 0.8697, test_f1: 0.5557
 epoch: 64, train_loss: 0.8683, test_loss: 0.8793, test_f1: 0.5326
 epoch: 65, train_loss: 0.8683, test_loss: 0.8741, test_f1: 0.5407
 epoch: 66, train_loss: 0.8617, test_loss: 0.8701, test_f1: 0.5492
 epoch: 67, train_loss: 0.8654, test_loss: 0.8724, test_f1: 0.5485
 epoch: 68, train_loss: 0.8613, test_loss: 0.8635, test_f1: 0.5549
 epoch: 69, train_loss: 0.8613, test_loss: 0.8613, test_f1: 0.5525
 epoch: 70, train_loss: 0.8602, test_loss: 0.8546, test_f1: 0.5593
 epoch: 71, train_loss: 0.8564, test_loss: 0.8631, test_f1: 0.5564
 epoch: 72, train_loss: 0.8530, test_loss: 0.8715, test_f1: 0.5381
 epoch: 73, train_loss: 0.8494, test_loss: 0.8654, test_f1: 0.5485
 epoch: 74, train_loss: 0.8506, test_loss: 0.8716, test_f1: 0.5351
 epoch: 75, train_loss: 0.8528, test_loss: 0.8728, test_f1: 0.5421
 epoch: 76, train_loss: 0.8550, test_loss: 0.8781, test_f1: 0.5258
 epoch: 77, train_loss: 0.8498, test_loss: 0.8695, test_f1: 0.5392
 epoch: 78, train_loss: 0.8533, test_loss: 0.8773, test_f1: 0.5397
 epoch: 79, train_loss: 0.8488, test_loss: 0.8759, test_f1: 0.5468
 epoch: 80, train_loss: 0.8489, test_loss: 0.8703, test_f1: 0.5406
 epoch: 81, train_loss: 0.8395, test_loss: 0.8590, test_f1: 0.5514
 epoch: 82, train_loss: 0.8489, test_loss: 0.8710, test_f1: 0.5317
 epoch: 83, train_loss: 0.8352, test_loss: 0.8793, test_f1: 0.5432
 epoch: 84, train_loss: 0.8451, test_loss: 0.8737, test_f1: 0.5419
 epoch: 85, train_loss: 0.8495, test_loss: 0.8642, test_f1: 0.5345
 epoch: 86, train_loss: 0.8326, test_loss: 0.8742, test_f1: 0.5453
 epoch: 87, train_loss: 0.8394, test_loss: 0.8787, test_f1: 0.5335
 epoch: 88, train_loss: 0.8332, test_loss: 0.8749, test_f1: 0.5483
 epoch: 89, train_loss: 0.8403, test_loss: 0.8824, test_f1: 0.5441
 epoch: 90, train_loss: 0.8463, test_loss: 0.8704, test_f1: 0.5519
 epoch: 91, train_loss: 0.8297, test_loss: 0.8729, test_f1: 0.5406
 epoch: 92, train_loss: 0.8385, test_loss: 0.8833, test_f1: 0.5415
 epoch: 93, train_loss: 0.8300, test_loss: 0.8682, test_f1: 0.5493
 epoch: 94, train_loss: 0.8455, test_loss: 0.8765, test_f1: 0.5510
 epoch: 95, train_loss: 0.8351, test_loss: 0.8680, test_f1: 0.5567
 epoch: 96, train_loss: 0.8198, test_loss: 0.8700, test_f1: 0.5414
 epoch: 97, train_loss: 0.8301, test_loss: 0.8871, test_f1: 0.5367
 epoch: 98, train_loss: 0.8322, test_loss: 0.8748, test_f1: 0.5477
 epoch: 99, train_loss: 0.8300, test_loss: 0.8733, test_f1: 0.5396
##################ITERATION #7 ****************************************
 epoch: 0, train_loss: 1.2791, test_loss: 1.3105, test_f1: 0.2270
 epoch: 1, train_loss: 1.1905, test_loss: 1.2376, test_f1: 0.2439
 epoch: 2, train_loss: 1.1622, test_loss: 1.1303, test_f1: 0.3492
 epoch: 3, train_loss: 1.1400, test_loss: 1.0973, test_f1: 0.3521
 epoch: 4, train_loss: 1.1131, test_loss: 1.0828, test_f1: 0.3734
 epoch: 5, train_loss: 1.0987, test_loss: 1.0709, test_f1: 0.3754
 epoch: 6, train_loss: 1.0727, test_loss: 1.0604, test_f1: 0.3831
 epoch: 7, train_loss: 1.0695, test_loss: 1.0549, test_f1: 0.4068
 epoch: 8, train_loss: 1.0485, test_loss: 1.0525, test_f1: 0.4146
 epoch: 9, train_loss: 1.0420, test_loss: 1.0418, test_f1: 0.4244
 epoch: 10, train_loss: 1.0357, test_loss: 1.0400, test_f1: 0.4288
 epoch: 11, train_loss: 1.0275, test_loss: 1.0416, test_f1: 0.4338
 epoch: 12, train_loss: 1.0162, test_loss: 1.0340, test_f1: 0.4512
 epoch: 13, train_loss: 1.0085, test_loss: 1.0282, test_f1: 0.4575
 epoch: 14, train_loss: 0.9990, test_loss: 1.0290, test_f1: 0.4657
 epoch: 15, train_loss: 1.0011, test_loss: 1.0267, test_f1: 0.4572
 epoch: 16, train_loss: 0.9943, test_loss: 1.0184, test_f1: 0.4661
 epoch: 17, train_loss: 0.9888, test_loss: 1.0129, test_f1: 0.4628
 epoch: 18, train_loss: 0.9879, test_loss: 1.0048, test_f1: 0.4613
 epoch: 19, train_loss: 0.9751, test_loss: 0.9994, test_f1: 0.4657
 epoch: 20, train_loss: 0.9770, test_loss: 0.9998, test_f1: 0.4665
 epoch: 21, train_loss: 0.9725, test_loss: 0.9996, test_f1: 0.4628
 epoch: 22, train_loss: 0.9656, test_loss: 1.0000, test_f1: 0.4688
 epoch: 23, train_loss: 0.9659, test_loss: 0.9908, test_f1: 0.4820
 epoch: 24, train_loss: 0.9600, test_loss: 0.9917, test_f1: 0.4787
 epoch: 25, train_loss: 0.9496, test_loss: 0.9834, test_f1: 0.4752
 epoch: 26, train_loss: 0.9527, test_loss: 0.9853, test_f1: 0.4966
 epoch: 27, train_loss: 0.9441, test_loss: 0.9825, test_f1: 0.4804
 epoch: 28, train_loss: 0.9404, test_loss: 0.9878, test_f1: 0.4860
 epoch: 29, train_loss: 0.9329, test_loss: 0.9888, test_f1: 0.4724
 epoch: 30, train_loss: 0.9307, test_loss: 0.9718, test_f1: 0.4857
 epoch: 31, train_loss: 0.9281, test_loss: 0.9755, test_f1: 0.5018
 epoch: 32, train_loss: 0.9268, test_loss: 0.9738, test_f1: 0.4984
 epoch: 33, train_loss: 0.9257, test_loss: 0.9660, test_f1: 0.5053
 epoch: 34, train_loss: 0.9211, test_loss: 0.9714, test_f1: 0.4920
 epoch: 35, train_loss: 0.9188, test_loss: 0.9635, test_f1: 0.5011
 epoch: 36, train_loss: 0.9160, test_loss: 0.9575, test_f1: 0.4992
 epoch: 37, train_loss: 0.9125, test_loss: 0.9559, test_f1: 0.5013
 epoch: 38, train_loss: 0.9132, test_loss: 0.9495, test_f1: 0.4957
 epoch: 39, train_loss: 0.9003, test_loss: 0.9463, test_f1: 0.5030
 epoch: 40, train_loss: 0.9081, test_loss: 0.9412, test_f1: 0.5016
 epoch: 41, train_loss: 0.9019, test_loss: 0.9342, test_f1: 0.5065
 epoch: 42, train_loss: 0.9030, test_loss: 0.9250, test_f1: 0.5184
 epoch: 43, train_loss: 0.8950, test_loss: 0.9337, test_f1: 0.5143
 epoch: 44, train_loss: 0.8952, test_loss: 0.9266, test_f1: 0.5170
 epoch: 45, train_loss: 0.8887, test_loss: 0.9178, test_f1: 0.5197
 epoch: 46, train_loss: 0.8856, test_loss: 0.9220, test_f1: 0.5020
 epoch: 47, train_loss: 0.8859, test_loss: 0.9093, test_f1: 0.5206
 epoch: 48, train_loss: 0.8848, test_loss: 0.9088, test_f1: 0.5151
 epoch: 49, train_loss: 0.8694, test_loss: 0.9168, test_f1: 0.5175
 epoch: 50, train_loss: 0.8752, test_loss: 0.9036, test_f1: 0.5250
 epoch: 51, train_loss: 0.8704, test_loss: 0.8913, test_f1: 0.5383
 epoch: 52, train_loss: 0.8782, test_loss: 0.8948, test_f1: 0.5265
 epoch: 53, train_loss: 0.8690, test_loss: 0.9004, test_f1: 0.5208
 epoch: 54, train_loss: 0.8607, test_loss: 0.8992, test_f1: 0.5231
 epoch: 55, train_loss: 0.8673, test_loss: 0.9029, test_f1: 0.5185
 epoch: 56, train_loss: 0.8704, test_loss: 0.9029, test_f1: 0.5213
 epoch: 57, train_loss: 0.8617, test_loss: 0.9004, test_f1: 0.5206
 epoch: 58, train_loss: 0.8725, test_loss: 0.8982, test_f1: 0.5230
 epoch: 59, train_loss: 0.8587, test_loss: 0.8946, test_f1: 0.5290
 epoch: 60, train_loss: 0.8747, test_loss: 0.9015, test_f1: 0.5258
 epoch: 61, train_loss: 0.8651, test_loss: 0.8941, test_f1: 0.5273
 epoch: 62, train_loss: 0.8524, test_loss: 0.8888, test_f1: 0.5250
 epoch: 63, train_loss: 0.8605, test_loss: 0.8827, test_f1: 0.5444
 epoch: 64, train_loss: 0.8561, test_loss: 0.8850, test_f1: 0.5344
 epoch: 65, train_loss: 0.8530, test_loss: 0.8841, test_f1: 0.5341
 epoch: 66, train_loss: 0.8538, test_loss: 0.8916, test_f1: 0.5205
 epoch: 67, train_loss: 0.8519, test_loss: 0.8849, test_f1: 0.5311
 epoch: 68, train_loss: 0.8599, test_loss: 0.8897, test_f1: 0.5235
 epoch: 69, train_loss: 0.8524, test_loss: 0.8912, test_f1: 0.5285
 epoch: 70, train_loss: 0.8480, test_loss: 0.8864, test_f1: 0.5301
 epoch: 71, train_loss: 0.8468, test_loss: 0.8780, test_f1: 0.5394
 epoch: 72, train_loss: 0.8531, test_loss: 0.8739, test_f1: 0.5376
 epoch: 73, train_loss: 0.8489, test_loss: 0.8792, test_f1: 0.5464
 epoch: 74, train_loss: 0.8487, test_loss: 0.8756, test_f1: 0.5402
 epoch: 75, train_loss: 0.8450, test_loss: 0.8773, test_f1: 0.5353
 epoch: 76, train_loss: 0.8444, test_loss: 0.8789, test_f1: 0.5369
 epoch: 77, train_loss: 0.8424, test_loss: 0.8733, test_f1: 0.5382
 epoch: 78, train_loss: 0.8422, test_loss: 0.8696, test_f1: 0.5389
 epoch: 79, train_loss: 0.8313, test_loss: 0.8685, test_f1: 0.5388
 epoch: 80, train_loss: 0.8302, test_loss: 0.8740, test_f1: 0.5417
 epoch: 81, train_loss: 0.8399, test_loss: 0.8698, test_f1: 0.5415
 epoch: 82, train_loss: 0.8408, test_loss: 0.8735, test_f1: 0.5401
 epoch: 83, train_loss: 0.8348, test_loss: 0.8750, test_f1: 0.5553
 epoch: 84, train_loss: 0.8388, test_loss: 0.8731, test_f1: 0.5466
 epoch: 85, train_loss: 0.8391, test_loss: 0.8656, test_f1: 0.5331
 epoch: 86, train_loss: 0.8412, test_loss: 0.8654, test_f1: 0.5324
 epoch: 87, train_loss: 0.8275, test_loss: 0.8715, test_f1: 0.5345
 epoch: 88, train_loss: 0.8276, test_loss: 0.8719, test_f1: 0.5544
 epoch: 89, train_loss: 0.8346, test_loss: 0.8684, test_f1: 0.5402
 epoch: 90, train_loss: 0.8370, test_loss: 0.8611, test_f1: 0.5458
 epoch: 91, train_loss: 0.8365, test_loss: 0.8753, test_f1: 0.5455
 epoch: 92, train_loss: 0.8333, test_loss: 0.8702, test_f1: 0.5328
 epoch: 93, train_loss: 0.8276, test_loss: 0.8562, test_f1: 0.5331
 epoch: 94, train_loss: 0.8254, test_loss: 0.8568, test_f1: 0.5370
 epoch: 95, train_loss: 0.8307, test_loss: 0.8709, test_f1: 0.5316
 epoch: 96, train_loss: 0.8250, test_loss: 0.8620, test_f1: 0.5295
 epoch: 97, train_loss: 0.8201, test_loss: 0.8704, test_f1: 0.5373
 epoch: 98, train_loss: 0.8209, test_loss: 0.8680, test_f1: 0.5360
 epoch: 99, train_loss: 0.8276, test_loss: 0.8696, test_f1: 0.5400
##################ITERATION #8 ****************************************
 epoch: 0, train_loss: 1.3534, test_loss: 1.3545, test_f1: 0.2270
 epoch: 1, train_loss: 1.2454, test_loss: 1.2666, test_f1: 0.2270
 epoch: 2, train_loss: 1.2083, test_loss: 1.1651, test_f1: 0.3422
 epoch: 3, train_loss: 1.1729, test_loss: 1.1264, test_f1: 0.3608
 epoch: 4, train_loss: 1.1482, test_loss: 1.1016, test_f1: 0.3715
 epoch: 5, train_loss: 1.1320, test_loss: 1.0820, test_f1: 0.3868
 epoch: 6, train_loss: 1.1108, test_loss: 1.0677, test_f1: 0.3925
 epoch: 7, train_loss: 1.0910, test_loss: 1.0554, test_f1: 0.4021
 epoch: 8, train_loss: 1.0811, test_loss: 1.0400, test_f1: 0.4224
 epoch: 9, train_loss: 1.0601, test_loss: 1.0358, test_f1: 0.4348
 epoch: 10, train_loss: 1.0493, test_loss: 1.0293, test_f1: 0.4405
 epoch: 11, train_loss: 1.0429, test_loss: 1.0202, test_f1: 0.4444
 epoch: 12, train_loss: 1.0314, test_loss: 1.0088, test_f1: 0.4625
 epoch: 13, train_loss: 1.0203, test_loss: 1.0132, test_f1: 0.4487
 epoch: 14, train_loss: 1.0178, test_loss: 1.0051, test_f1: 0.4638
 epoch: 15, train_loss: 1.0035, test_loss: 1.0018, test_f1: 0.4706
 epoch: 16, train_loss: 1.0028, test_loss: 0.9986, test_f1: 0.4747
 epoch: 17, train_loss: 0.9971, test_loss: 0.9966, test_f1: 0.4797
 epoch: 18, train_loss: 0.9985, test_loss: 0.9873, test_f1: 0.4843
 epoch: 19, train_loss: 0.9795, test_loss: 0.9893, test_f1: 0.4729
 epoch: 20, train_loss: 0.9881, test_loss: 0.9724, test_f1: 0.4904
 epoch: 21, train_loss: 0.9766, test_loss: 0.9760, test_f1: 0.4904
 epoch: 22, train_loss: 0.9823, test_loss: 0.9794, test_f1: 0.4784
 epoch: 23, train_loss: 0.9653, test_loss: 0.9770, test_f1: 0.4774
 epoch: 24, train_loss: 0.9628, test_loss: 0.9707, test_f1: 0.4904
 epoch: 25, train_loss: 0.9579, test_loss: 0.9586, test_f1: 0.4972
 epoch: 26, train_loss: 0.9571, test_loss: 0.9520, test_f1: 0.5124
 epoch: 27, train_loss: 0.9567, test_loss: 0.9675, test_f1: 0.5074
 epoch: 28, train_loss: 0.9441, test_loss: 0.9233, test_f1: 0.5121
 epoch: 29, train_loss: 0.9514, test_loss: 0.9376, test_f1: 0.5084
 epoch: 30, train_loss: 0.9462, test_loss: 0.9444, test_f1: 0.5195
 epoch: 31, train_loss: 0.9407, test_loss: 0.9505, test_f1: 0.4944
 epoch: 32, train_loss: 0.9417, test_loss: 0.9398, test_f1: 0.5035
 epoch: 33, train_loss: 0.9264, test_loss: 0.9278, test_f1: 0.5061
 epoch: 34, train_loss: 0.9334, test_loss: 0.9353, test_f1: 0.5099
 epoch: 35, train_loss: 0.9216, test_loss: 0.9423, test_f1: 0.5124
 epoch: 36, train_loss: 0.9252, test_loss: 0.9229, test_f1: 0.5180
 epoch: 37, train_loss: 0.9233, test_loss: 0.9195, test_f1: 0.5154
 epoch: 38, train_loss: 0.9125, test_loss: 0.9222, test_f1: 0.5147
 epoch: 39, train_loss: 0.9158, test_loss: 0.9084, test_f1: 0.5156
 epoch: 40, train_loss: 0.9127, test_loss: 0.9255, test_f1: 0.5045
 epoch: 41, train_loss: 0.9048, test_loss: 0.9034, test_f1: 0.5213
 epoch: 42, train_loss: 0.9009, test_loss: 0.9036, test_f1: 0.5210
 epoch: 43, train_loss: 0.9016, test_loss: 0.9193, test_f1: 0.5198
 epoch: 44, train_loss: 0.9005, test_loss: 0.9228, test_f1: 0.5166
 epoch: 45, train_loss: 0.9002, test_loss: 0.9275, test_f1: 0.5134
 epoch: 46, train_loss: 0.8950, test_loss: 0.9038, test_f1: 0.5187
 epoch: 47, train_loss: 0.8994, test_loss: 0.9095, test_f1: 0.5212
 epoch: 48, train_loss: 0.8946, test_loss: 0.9144, test_f1: 0.5170
 epoch: 49, train_loss: 0.8903, test_loss: 0.9418, test_f1: 0.5203
 epoch: 50, train_loss: 0.8926, test_loss: 0.9112, test_f1: 0.5167
 epoch: 51, train_loss: 0.8902, test_loss: 0.9020, test_f1: 0.5289
 epoch: 52, train_loss: 0.8921, test_loss: 0.8849, test_f1: 0.5425
 epoch: 53, train_loss: 0.8763, test_loss: 0.8931, test_f1: 0.5266
 epoch: 54, train_loss: 0.8806, test_loss: 0.8825, test_f1: 0.5478
 epoch: 55, train_loss: 0.8779, test_loss: 0.8830, test_f1: 0.5358
 epoch: 56, train_loss: 0.8757, test_loss: 0.9055, test_f1: 0.5271
 epoch: 57, train_loss: 0.8809, test_loss: 0.8839, test_f1: 0.5401
 epoch: 58, train_loss: 0.8809, test_loss: 0.9078, test_f1: 0.5232
 epoch: 59, train_loss: 0.8777, test_loss: 0.8989, test_f1: 0.5316
 epoch: 60, train_loss: 0.8774, test_loss: 0.8927, test_f1: 0.5192
 epoch: 61, train_loss: 0.8716, test_loss: 0.8890, test_f1: 0.5275
 epoch: 62, train_loss: 0.8743, test_loss: 0.8829, test_f1: 0.5419
 epoch: 63, train_loss: 0.8671, test_loss: 0.8817, test_f1: 0.5347
 epoch: 64, train_loss: 0.8633, test_loss: 0.8674, test_f1: 0.5477
 epoch: 65, train_loss: 0.8675, test_loss: 0.8691, test_f1: 0.5526
 epoch: 66, train_loss: 0.8657, test_loss: 0.8692, test_f1: 0.5486
 epoch: 67, train_loss: 0.8709, test_loss: 0.8785, test_f1: 0.5436
 epoch: 68, train_loss: 0.8635, test_loss: 0.8714, test_f1: 0.5517
 epoch: 69, train_loss: 0.8676, test_loss: 0.8929, test_f1: 0.5347
 epoch: 70, train_loss: 0.8681, test_loss: 0.8749, test_f1: 0.5495
 epoch: 71, train_loss: 0.8636, test_loss: 0.8929, test_f1: 0.5377
 epoch: 72, train_loss: 0.8604, test_loss: 0.8628, test_f1: 0.5520
 epoch: 73, train_loss: 0.8579, test_loss: 0.8573, test_f1: 0.5584
 epoch: 74, train_loss: 0.8611, test_loss: 0.8751, test_f1: 0.5518
 epoch: 75, train_loss: 0.8584, test_loss: 0.8743, test_f1: 0.5483
 epoch: 76, train_loss: 0.8566, test_loss: 0.8710, test_f1: 0.5443
 epoch: 77, train_loss: 0.8500, test_loss: 0.8872, test_f1: 0.5284
 epoch: 78, train_loss: 0.8582, test_loss: 0.8609, test_f1: 0.5499
 epoch: 79, train_loss: 0.8478, test_loss: 0.8595, test_f1: 0.5468
 epoch: 80, train_loss: 0.8545, test_loss: 0.8573, test_f1: 0.5566
 epoch: 81, train_loss: 0.8521, test_loss: 0.8541, test_f1: 0.5488
 epoch: 82, train_loss: 0.8535, test_loss: 0.8629, test_f1: 0.5494
 epoch: 83, train_loss: 0.8568, test_loss: 0.8519, test_f1: 0.5530
 epoch: 84, train_loss: 0.8423, test_loss: 0.8598, test_f1: 0.5518
 epoch: 85, train_loss: 0.8514, test_loss: 0.8516, test_f1: 0.5568
 epoch: 86, train_loss: 0.8466, test_loss: 0.8528, test_f1: 0.5433
 epoch: 87, train_loss: 0.8552, test_loss: 0.8536, test_f1: 0.5572
 epoch: 88, train_loss: 0.8555, test_loss: 0.8580, test_f1: 0.5557
 epoch: 89, train_loss: 0.8459, test_loss: 0.8462, test_f1: 0.5551
 epoch: 90, train_loss: 0.8522, test_loss: 0.8520, test_f1: 0.5524
 epoch: 91, train_loss: 0.8427, test_loss: 0.8537, test_f1: 0.5585
 epoch: 92, train_loss: 0.8453, test_loss: 0.8549, test_f1: 0.5500
 epoch: 93, train_loss: 0.8480, test_loss: 0.8495, test_f1: 0.5522
 epoch: 94, train_loss: 0.8402, test_loss: 0.8594, test_f1: 0.5354
 epoch: 95, train_loss: 0.8480, test_loss: 0.8613, test_f1: 0.5465
 epoch: 96, train_loss: 0.8356, test_loss: 0.8470, test_f1: 0.5503
 epoch: 97, train_loss: 0.8403, test_loss: 0.8481, test_f1: 0.5528
 epoch: 98, train_loss: 0.8347, test_loss: 0.8577, test_f1: 0.5483
 epoch: 99, train_loss: 0.8320, test_loss: 0.8518, test_f1: 0.5414
##################ITERATION #9 ****************************************
 epoch: 0, train_loss: 1.3374, test_loss: 1.3926, test_f1: 0.2270
 epoch: 1, train_loss: 1.2026, test_loss: 1.2106, test_f1: 0.2295
 epoch: 2, train_loss: 1.1630, test_loss: 1.0961, test_f1: 0.3547
 epoch: 3, train_loss: 1.1357, test_loss: 1.0567, test_f1: 0.3790
 epoch: 4, train_loss: 1.1116, test_loss: 1.0428, test_f1: 0.4061
 epoch: 5, train_loss: 1.0916, test_loss: 1.0243, test_f1: 0.4203
 epoch: 6, train_loss: 1.0770, test_loss: 1.0081, test_f1: 0.4360
 epoch: 7, train_loss: 1.0537, test_loss: 0.9986, test_f1: 0.4475
 epoch: 8, train_loss: 1.0463, test_loss: 0.9895, test_f1: 0.4548
 epoch: 9, train_loss: 1.0390, test_loss: 0.9812, test_f1: 0.4591
 epoch: 10, train_loss: 1.0270, test_loss: 0.9764, test_f1: 0.4656
 epoch: 11, train_loss: 1.0162, test_loss: 0.9705, test_f1: 0.4661
 epoch: 12, train_loss: 1.0068, test_loss: 0.9632, test_f1: 0.4861
 epoch: 13, train_loss: 0.9996, test_loss: 0.9600, test_f1: 0.4870
 epoch: 14, train_loss: 0.9943, test_loss: 0.9537, test_f1: 0.4918
 epoch: 15, train_loss: 0.9800, test_loss: 0.9535, test_f1: 0.4865
 epoch: 16, train_loss: 0.9805, test_loss: 0.9469, test_f1: 0.4798
 epoch: 17, train_loss: 0.9819, test_loss: 0.9416, test_f1: 0.4877
 epoch: 18, train_loss: 0.9718, test_loss: 0.9414, test_f1: 0.4894
 epoch: 19, train_loss: 0.9682, test_loss: 0.9369, test_f1: 0.4974
 epoch: 20, train_loss: 0.9682, test_loss: 0.9460, test_f1: 0.4865
 epoch: 21, train_loss: 0.9614, test_loss: 0.9398, test_f1: 0.4812
 epoch: 22, train_loss: 0.9593, test_loss: 0.9292, test_f1: 0.5031
 epoch: 23, train_loss: 0.9512, test_loss: 0.9332, test_f1: 0.4921
 epoch: 24, train_loss: 0.9523, test_loss: 0.9284, test_f1: 0.4923
 epoch: 25, train_loss: 0.9452, test_loss: 0.9328, test_f1: 0.4991
 epoch: 26, train_loss: 0.9445, test_loss: 0.9244, test_f1: 0.5025
 epoch: 27, train_loss: 0.9449, test_loss: 0.9331, test_f1: 0.4952
 epoch: 28, train_loss: 0.9363, test_loss: 0.9284, test_f1: 0.5059
 epoch: 29, train_loss: 0.9333, test_loss: 0.9248, test_f1: 0.4997
 epoch: 30, train_loss: 0.9361, test_loss: 0.9291, test_f1: 0.5116
 epoch: 31, train_loss: 0.9209, test_loss: 0.9182, test_f1: 0.4991
 epoch: 32, train_loss: 0.9238, test_loss: 0.9251, test_f1: 0.5032
 epoch: 33, train_loss: 0.9230, test_loss: 0.9138, test_f1: 0.5077
 epoch: 34, train_loss: 0.9182, test_loss: 0.9059, test_f1: 0.5014
 epoch: 35, train_loss: 0.9200, test_loss: 0.9182, test_f1: 0.5043
 epoch: 36, train_loss: 0.9099, test_loss: 0.9115, test_f1: 0.5117
 epoch: 37, train_loss: 0.9133, test_loss: 0.9053, test_f1: 0.5209
 epoch: 38, train_loss: 0.9147, test_loss: 0.9019, test_f1: 0.5051
 epoch: 39, train_loss: 0.9018, test_loss: 0.9136, test_f1: 0.5100
 epoch: 40, train_loss: 0.9055, test_loss: 0.9250, test_f1: 0.5052
 epoch: 41, train_loss: 0.8955, test_loss: 0.9111, test_f1: 0.5113
 epoch: 42, train_loss: 0.8924, test_loss: 0.9145, test_f1: 0.5152
 epoch: 43, train_loss: 0.8978, test_loss: 0.9153, test_f1: 0.5173
 epoch: 44, train_loss: 0.8944, test_loss: 0.9110, test_f1: 0.5172
 epoch: 45, train_loss: 0.8932, test_loss: 0.9080, test_f1: 0.5232
 epoch: 46, train_loss: 0.8907, test_loss: 0.9108, test_f1: 0.5157
 epoch: 47, train_loss: 0.8819, test_loss: 0.9110, test_f1: 0.5201
 epoch: 48, train_loss: 0.8785, test_loss: 0.9026, test_f1: 0.5134
 epoch: 49, train_loss: 0.8811, test_loss: 0.9022, test_f1: 0.5149
 epoch: 50, train_loss: 0.8724, test_loss: 0.9012, test_f1: 0.5123
 epoch: 51, train_loss: 0.8744, test_loss: 0.9067, test_f1: 0.5178
 epoch: 52, train_loss: 0.8777, test_loss: 0.9071, test_f1: 0.5229
 epoch: 53, train_loss: 0.8691, test_loss: 0.9076, test_f1: 0.5167
 epoch: 54, train_loss: 0.8649, test_loss: 0.9111, test_f1: 0.5260
 epoch: 55, train_loss: 0.8714, test_loss: 0.9103, test_f1: 0.5203
 epoch: 56, train_loss: 0.8682, test_loss: 0.9070, test_f1: 0.5211
 epoch: 57, train_loss: 0.8663, test_loss: 0.9061, test_f1: 0.5178
 epoch: 58, train_loss: 0.8651, test_loss: 0.8975, test_f1: 0.5194
 epoch: 59, train_loss: 0.8577, test_loss: 0.9047, test_f1: 0.5202
 epoch: 60, train_loss: 0.8576, test_loss: 0.9049, test_f1: 0.5153
 epoch: 61, train_loss: 0.8608, test_loss: 0.9112, test_f1: 0.5141
 epoch: 62, train_loss: 0.8533, test_loss: 0.9096, test_f1: 0.5184
 epoch: 63, train_loss: 0.8568, test_loss: 0.9074, test_f1: 0.5212
 epoch: 64, train_loss: 0.8639, test_loss: 0.9021, test_f1: 0.5233
 epoch: 65, train_loss: 0.8516, test_loss: 0.8997, test_f1: 0.5244
 epoch: 66, train_loss: 0.8429, test_loss: 0.9013, test_f1: 0.5267
 epoch: 67, train_loss: 0.8557, test_loss: 0.9097, test_f1: 0.5277
 epoch: 68, train_loss: 0.8433, test_loss: 0.9089, test_f1: 0.5299
 epoch: 69, train_loss: 0.8546, test_loss: 0.9204, test_f1: 0.5138
 epoch: 70, train_loss: 0.8432, test_loss: 0.9129, test_f1: 0.5260
 epoch: 71, train_loss: 0.8466, test_loss: 0.9233, test_f1: 0.5188
 epoch: 72, train_loss: 0.8454, test_loss: 0.9101, test_f1: 0.5194
 epoch: 73, train_loss: 0.8447, test_loss: 0.9129, test_f1: 0.5287
 epoch: 74, train_loss: 0.8433, test_loss: 0.9155, test_f1: 0.5198
 epoch: 75, train_loss: 0.8368, test_loss: 0.9146, test_f1: 0.5214
 epoch: 76, train_loss: 0.8433, test_loss: 0.9152, test_f1: 0.5311
 epoch: 77, train_loss: 0.8471, test_loss: 0.9233, test_f1: 0.5326
 epoch: 78, train_loss: 0.8388, test_loss: 0.9171, test_f1: 0.5256
 epoch: 79, train_loss: 0.8462, test_loss: 0.9090, test_f1: 0.5261
 epoch: 80, train_loss: 0.8397, test_loss: 0.9116, test_f1: 0.5306
 epoch: 81, train_loss: 0.8320, test_loss: 0.9167, test_f1: 0.5258
 epoch: 82, train_loss: 0.8322, test_loss: 0.8990, test_f1: 0.5318
 epoch: 83, train_loss: 0.8300, test_loss: 0.9146, test_f1: 0.5204
 epoch: 84, train_loss: 0.8348, test_loss: 0.9232, test_f1: 0.5340
 epoch: 85, train_loss: 0.8444, test_loss: 0.9113, test_f1: 0.5314
 epoch: 86, train_loss: 0.8287, test_loss: 0.9223, test_f1: 0.5270
 epoch: 87, train_loss: 0.8253, test_loss: 0.9153, test_f1: 0.5312
 epoch: 88, train_loss: 0.8315, test_loss: 0.9468, test_f1: 0.5260
 epoch: 89, train_loss: 0.8297, test_loss: 0.9325, test_f1: 0.5372
 epoch: 90, train_loss: 0.8329, test_loss: 0.9202, test_f1: 0.5439
 epoch: 91, train_loss: 0.8261, test_loss: 0.9171, test_f1: 0.5426
 epoch: 92, train_loss: 0.8157, test_loss: 0.9228, test_f1: 0.5377
 epoch: 93, train_loss: 0.8258, test_loss: 0.9168, test_f1: 0.5323
 epoch: 94, train_loss: 0.8300, test_loss: 0.9241, test_f1: 0.5359
 epoch: 95, train_loss: 0.8126, test_loss: 0.9246, test_f1: 0.5390
 epoch: 96, train_loss: 0.8214, test_loss: 0.9269, test_f1: 0.5397
 epoch: 97, train_loss: 0.8191, test_loss: 0.9306, test_f1: 0.5351
 epoch: 98, train_loss: 0.8243, test_loss: 0.9204, test_f1: 0.5397
 epoch: 99, train_loss: 0.8145, test_loss: 0.9329, test_f1: 0.5196

Training completed in 588.41 seconds
Best F1: 0.5630 at epoch 97
Mean F1 across iterations: 0.5447  0.0146
========================FINAL RESULTS================================
FEGIN weighted F1: 0.5630  0.0146
python main.py --data ltspice_examples --representation component_pin_net --model FEGIN --layers 6 --hiddens 32 --batch_size 128 --lr 0.0001 --emb_size 128 --epochs 100 --save_appendix component_pin_net_L6_H32_BS128_LR0.0001_E128 --no_val
-----



STDERR:
  File "main.py", line 370, in <module>
    main()
  File "main.py", line 254, in main
    dataset = dataset_class(
  File "/home/philip/projects/ltspice_examples_code_repo/Circuit-Completion-Using-GNNs/component_classification_with_link_prediction_head/evaluation/FEGIN/kernel/circuit_datasets.py", line 15, in __init__
    self.data, self.slices = torch.load(self.processed_paths[0])
  File "/home/philip/.local/lib/python3.8/site-packages/torch/serialization.py", line 1040, in load
    warnings.warn(
  File "/usr/lib/python3.8/warnings.py", line 109, in _showwarnmsg
    sw(msg.message, msg.category, msg.filename, msg.lineno,
  File "main.py", line 47, in warn_with_traceback
    traceback.print_stack(file=log)
/home/philip/projects/ltspice_examples_code_repo/Circuit-Completion-Using-GNNs/component_classification_with_link_prediction_head/evaluation/FEGIN/kernel/circuit_datasets.py:15: FutureWarning: You are using `torch.load` with `weights_only=False` (the current default value), which uses the default pickle module implicitly. It is possible to construct malicious pickle data which will execute arbitrary code during unpickling (See https://github.com/pytorch/pytorch/blob/main/SECURITY.md#untrusted-models for more details). In a future release, the default value for `weights_only` will be flipped to `True`. This limits the functions that could be executed during unpickling. Arbitrary objects will no longer be allowed to be loaded via this mode unless they are explicitly allowlisted by the user via `torch.serialization.add_safe_globals`. We recommend you start setting `weights_only=True` for any use case where you don't have full control of the loaded file. Please open an issue on GitHub for any issues related to this experimental feature.
  self.data, self.slices = torch.load(self.processed_paths[0])
