STDOUT:
Results will be saved in /home/philip/projects/ltspice_examples_code_repo/Circuit-Completion-Using-GNNs/component_classification_with_link_prediction_head/evaluation/FEGIN/results/model_FEGIN_dataset_ltspice_demos
Command line input: python main.py --data ltspice_demos --representation component_pin --model FEGIN --layers 3 --hiddens 128 --batch_size 128 --lr 0.001 --emb_size 250 --epochs 100 --save_appendix component_pin_L3_H128_BS128_LR0.001_E250 --no_val
 is saved.
-----
ltspice_demos - FEGIN
Using 3 layers, 128 hidden units, h = 2
Loading component_pin representation dataset
ENTERED
Training FEGIN on component_pin representation
Train: 1565, Test: 383
##################ITERATION #0 ****************************************
 epoch: 0, train_loss: 1.2933, test_loss: 1.2940, test_f1: 0.3480
 epoch: 1, train_loss: 1.1619, test_loss: 1.3128, test_f1: 0.3232
 epoch: 2, train_loss: 1.1126, test_loss: 1.3761, test_f1: 0.3495
 epoch: 3, train_loss: 1.0630, test_loss: 1.3479, test_f1: 0.3453
 epoch: 4, train_loss: 0.9736, test_loss: 1.1216, test_f1: 0.4417
 epoch: 5, train_loss: 0.9024, test_loss: 1.1319, test_f1: 0.5127
 epoch: 6, train_loss: 0.8433, test_loss: 1.1133, test_f1: 0.5629
 epoch: 7, train_loss: 0.8316, test_loss: 1.0445, test_f1: 0.5929
 epoch: 8, train_loss: 0.7717, test_loss: 1.0545, test_f1: 0.5209
 epoch: 9, train_loss: 0.7451, test_loss: 1.0392, test_f1: 0.5408
 epoch: 10, train_loss: 0.6954, test_loss: 1.0596, test_f1: 0.5360
 epoch: 11, train_loss: 0.6824, test_loss: 1.0669, test_f1: 0.5796
 epoch: 12, train_loss: 0.6838, test_loss: 0.9729, test_f1: 0.5953
 epoch: 13, train_loss: 0.6432, test_loss: 1.0788, test_f1: 0.5909
 epoch: 14, train_loss: 0.6254, test_loss: 1.0995, test_f1: 0.6320
 epoch: 15, train_loss: 0.6165, test_loss: 1.1082, test_f1: 0.5867
 epoch: 16, train_loss: 0.6090, test_loss: 1.1598, test_f1: 0.5942
 epoch: 17, train_loss: 0.5766, test_loss: 1.1829, test_f1: 0.5909
 epoch: 18, train_loss: 0.5844, test_loss: 1.0772, test_f1: 0.5961
 epoch: 19, train_loss: 0.5282, test_loss: 1.1492, test_f1: 0.5996
 epoch: 20, train_loss: 0.5011, test_loss: 1.3124, test_f1: 0.6375
 epoch: 21, train_loss: 0.5062, test_loss: 1.2735, test_f1: 0.5493
 epoch: 22, train_loss: 0.5026, test_loss: 1.4168, test_f1: 0.6188
 epoch: 23, train_loss: 0.4570, test_loss: 1.4649, test_f1: 0.5887
 epoch: 24, train_loss: 0.4357, test_loss: 1.6243, test_f1: 0.5706
 epoch: 25, train_loss: 0.3975, test_loss: 1.7214, test_f1: 0.5699
 epoch: 26, train_loss: 0.4245, test_loss: 1.3022, test_f1: 0.6746
 epoch: 27, train_loss: 0.4347, test_loss: 1.5007, test_f1: 0.6156
 epoch: 28, train_loss: 0.4490, test_loss: 1.2287, test_f1: 0.6629
 epoch: 29, train_loss: 0.4074, test_loss: 1.4211, test_f1: 0.6135
 epoch: 30, train_loss: 0.3848, test_loss: 1.5945, test_f1: 0.6271
 epoch: 31, train_loss: 0.3600, test_loss: 1.3462, test_f1: 0.6582
 epoch: 32, train_loss: 0.3388, test_loss: 1.4571, test_f1: 0.6391
 epoch: 33, train_loss: 0.3093, test_loss: 2.0465, test_f1: 0.5257
 epoch: 34, train_loss: 0.3406, test_loss: 1.6302, test_f1: 0.6322
 epoch: 35, train_loss: 0.3349, test_loss: 1.5620, test_f1: 0.6559
 epoch: 36, train_loss: 0.2739, test_loss: 1.6663, test_f1: 0.6529
 epoch: 37, train_loss: 0.2814, test_loss: 1.6896, test_f1: 0.6479
 epoch: 38, train_loss: 0.2582, test_loss: 1.9359, test_f1: 0.6860
 epoch: 39, train_loss: 0.2224, test_loss: 1.8600, test_f1: 0.6406
 epoch: 40, train_loss: 0.2724, test_loss: 1.6531, test_f1: 0.6362
 epoch: 41, train_loss: 0.2810, test_loss: 1.8811, test_f1: 0.6714
 epoch: 42, train_loss: 0.2659, test_loss: 1.8162, test_f1: 0.6246
 epoch: 43, train_loss: 0.2591, test_loss: 1.9415, test_f1: 0.6411
 epoch: 44, train_loss: 0.2595, test_loss: 1.9982, test_f1: 0.6168
 epoch: 45, train_loss: 0.2685, test_loss: 1.8351, test_f1: 0.6578
 epoch: 46, train_loss: 0.2577, test_loss: 1.7308, test_f1: 0.6486
 epoch: 47, train_loss: 0.2286, test_loss: 1.8430, test_f1: 0.6460
 epoch: 48, train_loss: 0.2167, test_loss: 2.0070, test_f1: 0.6392
 epoch: 49, train_loss: 0.2463, test_loss: 1.9882, test_f1: 0.6332
 epoch: 50, train_loss: 0.3201, test_loss: 2.2339, test_f1: 0.5311
 epoch: 51, train_loss: 0.2116, test_loss: 1.7846, test_f1: 0.6499
 epoch: 52, train_loss: 0.1921, test_loss: 1.8297, test_f1: 0.6597
 epoch: 53, train_loss: 0.1646, test_loss: 1.9987, test_f1: 0.6828
 epoch: 54, train_loss: 0.1373, test_loss: 1.9648, test_f1: 0.6997
 epoch: 55, train_loss: 0.1284, test_loss: 2.0707, test_f1: 0.6805
 epoch: 56, train_loss: 0.1229, test_loss: 2.2098, test_f1: 0.6755
 epoch: 57, train_loss: 0.1341, test_loss: 2.3090, test_f1: 0.6393
 epoch: 58, train_loss: 0.1169, test_loss: 2.1820, test_f1: 0.6718
 epoch: 59, train_loss: 0.1340, test_loss: 2.2616, test_f1: 0.6595
 epoch: 60, train_loss: 0.1258, test_loss: 2.2212, test_f1: 0.6627
 epoch: 61, train_loss: 0.1162, test_loss: 2.0323, test_f1: 0.6824
 epoch: 62, train_loss: 0.1007, test_loss: 2.0759, test_f1: 0.6806
 epoch: 63, train_loss: 0.1043, test_loss: 2.1601, test_f1: 0.7001
 epoch: 64, train_loss: 0.0970, test_loss: 2.4164, test_f1: 0.6887
 epoch: 65, train_loss: 0.0897, test_loss: 2.3853, test_f1: 0.6525
 epoch: 66, train_loss: 0.0955, test_loss: 2.3526, test_f1: 0.6632
 epoch: 67, train_loss: 0.0971, test_loss: 2.3458, test_f1: 0.6653
 epoch: 68, train_loss: 0.1006, test_loss: 2.5030, test_f1: 0.6770
 epoch: 69, train_loss: 0.0931, test_loss: 2.7252, test_f1: 0.6193
 epoch: 70, train_loss: 0.0774, test_loss: 2.5595, test_f1: 0.6668
 epoch: 71, train_loss: 0.0790, test_loss: 2.4288, test_f1: 0.6969
 epoch: 72, train_loss: 0.0787, test_loss: 2.5737, test_f1: 0.6677
 epoch: 73, train_loss: 0.0937, test_loss: 2.6082, test_f1: 0.6675
 epoch: 74, train_loss: 0.1027, test_loss: 2.8177, test_f1: 0.6659
 epoch: 75, train_loss: 0.1029, test_loss: 2.8809, test_f1: 0.6238
 epoch: 76, train_loss: 0.0820, test_loss: 2.5401, test_f1: 0.6366
 epoch: 77, train_loss: 0.0840, test_loss: 2.4681, test_f1: 0.7096
 epoch: 78, train_loss: 0.0801, test_loss: 2.5169, test_f1: 0.6689
 epoch: 79, train_loss: 0.0825, test_loss: 2.6458, test_f1: 0.6733
 epoch: 80, train_loss: 0.0809, test_loss: 2.7939, test_f1: 0.6642
 epoch: 81, train_loss: 0.0707, test_loss: 2.7404, test_f1: 0.6466
 epoch: 82, train_loss: 0.0589, test_loss: 2.7415, test_f1: 0.6576
 epoch: 83, train_loss: 0.0653, test_loss: 2.8384, test_f1: 0.6531
 epoch: 84, train_loss: 0.1341, test_loss: 2.8245, test_f1: 0.6371
 epoch: 85, train_loss: 0.0979, test_loss: 2.7368, test_f1: 0.6567
 epoch: 86, train_loss: 0.0876, test_loss: 2.6822, test_f1: 0.6754
 epoch: 87, train_loss: 0.0962, test_loss: 2.5359, test_f1: 0.6815
 epoch: 88, train_loss: 0.0876, test_loss: 2.6117, test_f1: 0.6670
 epoch: 89, train_loss: 0.0813, test_loss: 2.9582, test_f1: 0.6543
 epoch: 90, train_loss: 0.1108, test_loss: 2.9892, test_f1: 0.5978
 epoch: 91, train_loss: 0.0754, test_loss: 2.8315, test_f1: 0.6659
 epoch: 92, train_loss: 0.0626, test_loss: 2.7404, test_f1: 0.6825
 epoch: 93, train_loss: 0.0568, test_loss: 2.9392, test_f1: 0.6494
 epoch: 94, train_loss: 0.0755, test_loss: 3.0351, test_f1: 0.6453
 epoch: 95, train_loss: 0.0933, test_loss: 3.2350, test_f1: 0.6077
 epoch: 96, train_loss: 0.0923, test_loss: 2.7942, test_f1: 0.6615
 epoch: 97, train_loss: 0.1098, test_loss: 3.1106, test_f1: 0.6213
 epoch: 98, train_loss: 0.0848, test_loss: 3.1112, test_f1: 0.6102
 epoch: 99, train_loss: 0.0575, test_loss: 2.7496, test_f1: 0.6809
##################ITERATION #1 ****************************************
 epoch: 0, train_loss: 1.1287, test_loss: 1.3543, test_f1: 0.3343
 epoch: 1, train_loss: 0.9397, test_loss: 1.4092, test_f1: 0.3608
 epoch: 2, train_loss: 0.8680, test_loss: 1.5120, test_f1: 0.4600
 epoch: 3, train_loss: 0.8225, test_loss: 1.4036, test_f1: 0.3888
 epoch: 4, train_loss: 0.7799, test_loss: 1.2861, test_f1: 0.3540
 epoch: 5, train_loss: 0.7481, test_loss: 1.4465, test_f1: 0.4571
 epoch: 6, train_loss: 0.7305, test_loss: 1.1385, test_f1: 0.5445
 epoch: 7, train_loss: 0.6894, test_loss: 1.0048, test_f1: 0.6021
 epoch: 8, train_loss: 0.6772, test_loss: 1.1815, test_f1: 0.5984
 epoch: 9, train_loss: 0.6601, test_loss: 1.0618, test_f1: 0.5393
 epoch: 10, train_loss: 0.6550, test_loss: 1.0345, test_f1: 0.5827
 epoch: 11, train_loss: 0.6193, test_loss: 1.2769, test_f1: 0.5690
 epoch: 12, train_loss: 0.6076, test_loss: 1.1923, test_f1: 0.5826
 epoch: 13, train_loss: 0.5822, test_loss: 1.0168, test_f1: 0.6136
 epoch: 14, train_loss: 0.5784, test_loss: 1.1865, test_f1: 0.6004
 epoch: 15, train_loss: 0.5511, test_loss: 1.1741, test_f1: 0.5890
 epoch: 16, train_loss: 0.5377, test_loss: 1.2008, test_f1: 0.5782
 epoch: 17, train_loss: 0.5312, test_loss: 1.2880, test_f1: 0.5796
 epoch: 18, train_loss: 0.5221, test_loss: 1.2323, test_f1: 0.6235
 epoch: 19, train_loss: 0.5108, test_loss: 1.2622, test_f1: 0.5721
 epoch: 20, train_loss: 0.5134, test_loss: 1.3269, test_f1: 0.5472
 epoch: 21, train_loss: 0.4957, test_loss: 1.5523, test_f1: 0.5169
 epoch: 22, train_loss: 0.4635, test_loss: 1.3228, test_f1: 0.5905
 epoch: 23, train_loss: 0.4352, test_loss: 1.4885, test_f1: 0.6185
 epoch: 24, train_loss: 0.3894, test_loss: 1.3071, test_f1: 0.6413
 epoch: 25, train_loss: 0.4119, test_loss: 1.2688, test_f1: 0.6251
 epoch: 26, train_loss: 0.4023, test_loss: 1.6449, test_f1: 0.6021
 epoch: 27, train_loss: 0.3804, test_loss: 1.6324, test_f1: 0.5629
 epoch: 28, train_loss: 0.3927, test_loss: 1.6574, test_f1: 0.6255
 epoch: 29, train_loss: 0.3933, test_loss: 1.5932, test_f1: 0.5616
 epoch: 30, train_loss: 0.3843, test_loss: 1.4685, test_f1: 0.6581
 epoch: 31, train_loss: 0.3806, test_loss: 1.7732, test_f1: 0.5851
 epoch: 32, train_loss: 0.3310, test_loss: 1.7246, test_f1: 0.5423
 epoch: 33, train_loss: 0.3348, test_loss: 1.8037, test_f1: 0.5868
 epoch: 34, train_loss: 0.3114, test_loss: 1.7696, test_f1: 0.6039
 epoch: 35, train_loss: 0.2934, test_loss: 1.7379, test_f1: 0.5938
 epoch: 36, train_loss: 0.2738, test_loss: 2.0360, test_f1: 0.6045
 epoch: 37, train_loss: 0.2714, test_loss: 2.1589, test_f1: 0.6198
 epoch: 38, train_loss: 0.2889, test_loss: 1.9513, test_f1: 0.5837
 epoch: 39, train_loss: 0.3012, test_loss: 1.9065, test_f1: 0.5734
 epoch: 40, train_loss: 0.2979, test_loss: 2.0721, test_f1: 0.5957
 epoch: 41, train_loss: 0.3056, test_loss: 1.6515, test_f1: 0.6239
 epoch: 42, train_loss: 0.2562, test_loss: 1.7338, test_f1: 0.6459
 epoch: 43, train_loss: 0.2272, test_loss: 2.1151, test_f1: 0.6339
 epoch: 44, train_loss: 0.2429, test_loss: 2.2369, test_f1: 0.5812
 epoch: 45, train_loss: 0.2331, test_loss: 1.8719, test_f1: 0.6357
 epoch: 46, train_loss: 0.2117, test_loss: 2.0628, test_f1: 0.6029
 epoch: 47, train_loss: 0.2205, test_loss: 1.8432, test_f1: 0.6474
 epoch: 48, train_loss: 0.1951, test_loss: 2.2644, test_f1: 0.6025
 epoch: 49, train_loss: 0.2586, test_loss: 1.9953, test_f1: 0.5340
 epoch: 50, train_loss: 0.2695, test_loss: 2.1646, test_f1: 0.5873
 epoch: 51, train_loss: 0.2230, test_loss: 1.9169, test_f1: 0.6228
 epoch: 52, train_loss: 0.2169, test_loss: 1.8330, test_f1: 0.6181
 epoch: 53, train_loss: 0.1725, test_loss: 1.9614, test_f1: 0.6286
 epoch: 54, train_loss: 0.1472, test_loss: 2.2583, test_f1: 0.6102
 epoch: 55, train_loss: 0.1414, test_loss: 2.2808, test_f1: 0.6207
 epoch: 56, train_loss: 0.1459, test_loss: 2.1830, test_f1: 0.6222
 epoch: 57, train_loss: 0.1400, test_loss: 2.1250, test_f1: 0.6307
 epoch: 58, train_loss: 0.1256, test_loss: 2.2359, test_f1: 0.6086
 epoch: 59, train_loss: 0.1216, test_loss: 2.3978, test_f1: 0.6096
 epoch: 60, train_loss: 0.1072, test_loss: 2.4004, test_f1: 0.6122
 epoch: 61, train_loss: 0.1181, test_loss: 2.4256, test_f1: 0.6173
 epoch: 62, train_loss: 0.1094, test_loss: 2.6593, test_f1: 0.6033
 epoch: 63, train_loss: 0.0924, test_loss: 2.4521, test_f1: 0.6426
 epoch: 64, train_loss: 0.1207, test_loss: 2.3855, test_f1: 0.6394
 epoch: 65, train_loss: 0.1398, test_loss: 2.4766, test_f1: 0.6330
 epoch: 66, train_loss: 0.1547, test_loss: 2.6892, test_f1: 0.5969
 epoch: 67, train_loss: 0.0960, test_loss: 2.5806, test_f1: 0.6194
 epoch: 68, train_loss: 0.1099, test_loss: 2.5372, test_f1: 0.5983
 epoch: 69, train_loss: 0.1087, test_loss: 2.3668, test_f1: 0.6702
 epoch: 70, train_loss: 0.1249, test_loss: 2.6593, test_f1: 0.6321
 epoch: 71, train_loss: 0.1195, test_loss: 2.6970, test_f1: 0.6478
 epoch: 72, train_loss: 0.1096, test_loss: 2.6978, test_f1: 0.6197
 epoch: 73, train_loss: 0.1344, test_loss: 2.6418, test_f1: 0.5985
 epoch: 74, train_loss: 0.1971, test_loss: 2.7605, test_f1: 0.5947
 epoch: 75, train_loss: 0.1319, test_loss: 2.6389, test_f1: 0.6264
 epoch: 76, train_loss: 0.1059, test_loss: 2.7286, test_f1: 0.6217
 epoch: 77, train_loss: 0.1025, test_loss: 2.7017, test_f1: 0.6176
 epoch: 78, train_loss: 0.1003, test_loss: 2.5848, test_f1: 0.6247
 epoch: 79, train_loss: 0.0907, test_loss: 2.8993, test_f1: 0.5918
 epoch: 80, train_loss: 0.1388, test_loss: 2.6405, test_f1: 0.6067
 epoch: 81, train_loss: 0.1275, test_loss: 2.6743, test_f1: 0.6481
 epoch: 82, train_loss: 0.1106, test_loss: 2.6237, test_f1: 0.6504
 epoch: 83, train_loss: 0.1059, test_loss: 2.7433, test_f1: 0.6169
 epoch: 84, train_loss: 0.0825, test_loss: 2.7702, test_f1: 0.6041
 epoch: 85, train_loss: 0.0856, test_loss: 2.8379, test_f1: 0.6025
 epoch: 86, train_loss: 0.0697, test_loss: 2.7150, test_f1: 0.6295
 epoch: 87, train_loss: 0.0557, test_loss: 2.9621, test_f1: 0.6156
 epoch: 88, train_loss: 0.0625, test_loss: 3.0338, test_f1: 0.6302
 epoch: 89, train_loss: 0.0658, test_loss: 2.9750, test_f1: 0.6448
 epoch: 90, train_loss: 0.0906, test_loss: 2.8696, test_f1: 0.6186
 epoch: 91, train_loss: 0.0799, test_loss: 3.1239, test_f1: 0.5926
 epoch: 92, train_loss: 0.0796, test_loss: 3.1028, test_f1: 0.6121
 epoch: 93, train_loss: 0.0757, test_loss: 3.1285, test_f1: 0.6244
 epoch: 94, train_loss: 0.0764, test_loss: 3.3210, test_f1: 0.5888
 epoch: 95, train_loss: 0.0854, test_loss: 3.0899, test_f1: 0.6116
 epoch: 96, train_loss: 0.0673, test_loss: 2.9320, test_f1: 0.6182
 epoch: 97, train_loss: 0.0969, test_loss: 3.1320, test_f1: 0.6152
 epoch: 98, train_loss: 0.0745, test_loss: 3.1788, test_f1: 0.6107
 epoch: 99, train_loss: 0.0806, test_loss: 3.2165, test_f1: 0.6037
##################ITERATION #2 ****************************************
 epoch: 0, train_loss: 1.1878, test_loss: 1.3850, test_f1: 0.3006
 epoch: 1, train_loss: 0.9882, test_loss: 1.3677, test_f1: 0.3015
 epoch: 2, train_loss: 0.8942, test_loss: 1.4252, test_f1: 0.2906
 epoch: 3, train_loss: 0.8232, test_loss: 1.5147, test_f1: 0.3077
 epoch: 4, train_loss: 0.7753, test_loss: 1.2988, test_f1: 0.4221
 epoch: 5, train_loss: 0.7397, test_loss: 1.1482, test_f1: 0.5422
 epoch: 6, train_loss: 0.7240, test_loss: 1.0084, test_f1: 0.5530
 epoch: 7, train_loss: 0.6920, test_loss: 1.0692, test_f1: 0.5792
 epoch: 8, train_loss: 0.6494, test_loss: 1.1314, test_f1: 0.6280
 epoch: 9, train_loss: 0.6457, test_loss: 1.0482, test_f1: 0.6264
 epoch: 10, train_loss: 0.6110, test_loss: 1.1506, test_f1: 0.6266
 epoch: 11, train_loss: 0.5921, test_loss: 1.2075, test_f1: 0.5892
 epoch: 12, train_loss: 0.5559, test_loss: 1.0259, test_f1: 0.6077
 epoch: 13, train_loss: 0.5539, test_loss: 1.0565, test_f1: 0.6158
 epoch: 14, train_loss: 0.5671, test_loss: 1.1726, test_f1: 0.5726
 epoch: 15, train_loss: 0.5342, test_loss: 1.1505, test_f1: 0.6112
 epoch: 16, train_loss: 0.5166, test_loss: 1.0952, test_f1: 0.5954
 epoch: 17, train_loss: 0.5657, test_loss: 1.1435, test_f1: 0.5897
 epoch: 18, train_loss: 0.5131, test_loss: 1.4508, test_f1: 0.5772
 epoch: 19, train_loss: 0.4651, test_loss: 1.3903, test_f1: 0.6252
 epoch: 20, train_loss: 0.4408, test_loss: 1.3909, test_f1: 0.6131
 epoch: 21, train_loss: 0.4221, test_loss: 1.5172, test_f1: 0.6020
 epoch: 22, train_loss: 0.4254, test_loss: 1.3436, test_f1: 0.6592
 epoch: 23, train_loss: 0.3934, test_loss: 1.4382, test_f1: 0.5896
 epoch: 24, train_loss: 0.3908, test_loss: 1.6282, test_f1: 0.6083
 epoch: 25, train_loss: 0.3869, test_loss: 1.3901, test_f1: 0.6135
 epoch: 26, train_loss: 0.4085, test_loss: 1.2918, test_f1: 0.6506
 epoch: 27, train_loss: 0.3581, test_loss: 1.4066, test_f1: 0.6397
 epoch: 28, train_loss: 0.3364, test_loss: 1.5990, test_f1: 0.5833
 epoch: 29, train_loss: 0.3321, test_loss: 1.5804, test_f1: 0.6743
 epoch: 30, train_loss: 0.3485, test_loss: 1.6082, test_f1: 0.5944
 epoch: 31, train_loss: 0.3531, test_loss: 1.4938, test_f1: 0.6273
 epoch: 32, train_loss: 0.3096, test_loss: 1.5845, test_f1: 0.6151
 epoch: 33, train_loss: 0.3055, test_loss: 1.6021, test_f1: 0.6217
 epoch: 34, train_loss: 0.2927, test_loss: 1.6684, test_f1: 0.6323
 epoch: 35, train_loss: 0.2715, test_loss: 1.7448, test_f1: 0.6203
 epoch: 36, train_loss: 0.2739, test_loss: 1.9449, test_f1: 0.6228
 epoch: 37, train_loss: 0.2802, test_loss: 1.6345, test_f1: 0.6350
 epoch: 38, train_loss: 0.3147, test_loss: 2.2057, test_f1: 0.5732
 epoch: 39, train_loss: 0.3088, test_loss: 1.7380, test_f1: 0.5678
 epoch: 40, train_loss: 0.2785, test_loss: 1.5411, test_f1: 0.6461
 epoch: 41, train_loss: 0.2974, test_loss: 1.6872, test_f1: 0.5977
 epoch: 42, train_loss: 0.2428, test_loss: 1.8259, test_f1: 0.6199
 epoch: 43, train_loss: 0.2294, test_loss: 2.1369, test_f1: 0.5877
 epoch: 44, train_loss: 0.2815, test_loss: 1.8674, test_f1: 0.5910
 epoch: 45, train_loss: 0.2417, test_loss: 1.8676, test_f1: 0.6039
 epoch: 46, train_loss: 0.2295, test_loss: 1.8317, test_f1: 0.6515
 epoch: 47, train_loss: 0.2052, test_loss: 1.8047, test_f1: 0.6374
 epoch: 48, train_loss: 0.1756, test_loss: 1.7113, test_f1: 0.6315
 epoch: 49, train_loss: 0.1782, test_loss: 2.2405, test_f1: 0.6137
 epoch: 50, train_loss: 0.3068, test_loss: 1.9876, test_f1: 0.5899
 epoch: 51, train_loss: 0.2079, test_loss: 1.9316, test_f1: 0.6391
 epoch: 52, train_loss: 0.1835, test_loss: 1.8789, test_f1: 0.6229
 epoch: 53, train_loss: 0.1617, test_loss: 1.9270, test_f1: 0.6585
 epoch: 54, train_loss: 0.1655, test_loss: 2.0031, test_f1: 0.6366
 epoch: 55, train_loss: 0.1287, test_loss: 2.1874, test_f1: 0.6035
 epoch: 56, train_loss: 0.1264, test_loss: 2.0191, test_f1: 0.6422
 epoch: 57, train_loss: 0.1074, test_loss: 2.1991, test_f1: 0.6239
 epoch: 58, train_loss: 0.1122, test_loss: 2.3326, test_f1: 0.6138
 epoch: 59, train_loss: 0.1064, test_loss: 2.1986, test_f1: 0.6240
 epoch: 60, train_loss: 0.1023, test_loss: 2.3707, test_f1: 0.6221
 epoch: 61, train_loss: 0.1334, test_loss: 2.3406, test_f1: 0.6419
 epoch: 62, train_loss: 0.1028, test_loss: 2.4232, test_f1: 0.6167
 epoch: 63, train_loss: 0.0949, test_loss: 2.4426, test_f1: 0.5991
 epoch: 64, train_loss: 0.0937, test_loss: 2.2079, test_f1: 0.6287
 epoch: 65, train_loss: 0.0946, test_loss: 2.5200, test_f1: 0.6139
 epoch: 66, train_loss: 0.0844, test_loss: 2.6886, test_f1: 0.6230
 epoch: 67, train_loss: 0.0794, test_loss: 2.5724, test_f1: 0.6355
 epoch: 68, train_loss: 0.0878, test_loss: 2.4702, test_f1: 0.6175
 epoch: 69, train_loss: 0.0911, test_loss: 2.6613, test_f1: 0.5950
 epoch: 70, train_loss: 0.1182, test_loss: 2.3982, test_f1: 0.6308
 epoch: 71, train_loss: 0.0983, test_loss: 2.9176, test_f1: 0.6111
 epoch: 72, train_loss: 0.0952, test_loss: 2.9611, test_f1: 0.6188
 epoch: 73, train_loss: 0.0937, test_loss: 2.5174, test_f1: 0.6477
 epoch: 74, train_loss: 0.0841, test_loss: 2.7689, test_f1: 0.6039
 epoch: 75, train_loss: 0.0785, test_loss: 2.9085, test_f1: 0.6189
 epoch: 76, train_loss: 0.1093, test_loss: 2.7179, test_f1: 0.6249
 epoch: 77, train_loss: 0.0956, test_loss: 2.8118, test_f1: 0.6448
 epoch: 78, train_loss: 0.1015, test_loss: 2.6105, test_f1: 0.6632
 epoch: 79, train_loss: 0.1061, test_loss: 2.6381, test_f1: 0.6041
 epoch: 80, train_loss: 0.0620, test_loss: 2.5421, test_f1: 0.6256
 epoch: 81, train_loss: 0.0800, test_loss: 2.6352, test_f1: 0.6216
 epoch: 82, train_loss: 0.0836, test_loss: 2.7605, test_f1: 0.6347
 epoch: 83, train_loss: 0.0809, test_loss: 2.9448, test_f1: 0.6438
 epoch: 84, train_loss: 0.0850, test_loss: 3.1121, test_f1: 0.5977
 epoch: 85, train_loss: 0.0823, test_loss: 3.4256, test_f1: 0.5983
 epoch: 86, train_loss: 0.0837, test_loss: 3.0760, test_f1: 0.5944
 epoch: 87, train_loss: 0.0779, test_loss: 2.9915, test_f1: 0.5891
 epoch: 88, train_loss: 0.0807, test_loss: 2.9902, test_f1: 0.6071
 epoch: 89, train_loss: 0.0916, test_loss: 2.9549, test_f1: 0.6028
 epoch: 90, train_loss: 0.1116, test_loss: 2.7445, test_f1: 0.5986
 epoch: 91, train_loss: 0.0820, test_loss: 2.9321, test_f1: 0.6249
 epoch: 92, train_loss: 0.0906, test_loss: 2.8811, test_f1: 0.6271
 epoch: 93, train_loss: 0.0794, test_loss: 2.9824, test_f1: 0.6402
 epoch: 94, train_loss: 0.0612, test_loss: 2.9380, test_f1: 0.6343
 epoch: 95, train_loss: 0.1049, test_loss: 2.9521, test_f1: 0.6296
 epoch: 96, train_loss: 0.1129, test_loss: 2.7426, test_f1: 0.6038
 epoch: 97, train_loss: 0.1133, test_loss: 2.7876, test_f1: 0.6182
 epoch: 98, train_loss: 0.0721, test_loss: 2.9326, test_f1: 0.6324
 epoch: 99, train_loss: 0.0787, test_loss: 2.9601, test_f1: 0.6079
##################ITERATION #3 ****************************************
 epoch: 0, train_loss: 1.1512, test_loss: 1.3628, test_f1: 0.3665
 epoch: 1, train_loss: 0.9540, test_loss: 1.4048, test_f1: 0.2209
 epoch: 2, train_loss: 0.8655, test_loss: 1.4078, test_f1: 0.2298
 epoch: 3, train_loss: 0.8061, test_loss: 1.2050, test_f1: 0.4701
 epoch: 4, train_loss: 0.7689, test_loss: 1.0268, test_f1: 0.6003
 epoch: 5, train_loss: 0.7360, test_loss: 1.0668, test_f1: 0.5314
 epoch: 6, train_loss: 0.7002, test_loss: 1.1746, test_f1: 0.5479
 epoch: 7, train_loss: 0.7006, test_loss: 1.2078, test_f1: 0.5445
 epoch: 8, train_loss: 0.6867, test_loss: 1.2426, test_f1: 0.5681
 epoch: 9, train_loss: 0.6683, test_loss: 1.1136, test_f1: 0.5944
 epoch: 10, train_loss: 0.6266, test_loss: 1.1358, test_f1: 0.5998
 epoch: 11, train_loss: 0.6144, test_loss: 1.2926, test_f1: 0.5782
 epoch: 12, train_loss: 0.6102, test_loss: 1.3086, test_f1: 0.5923
 epoch: 13, train_loss: 0.5805, test_loss: 1.1481, test_f1: 0.5753
 epoch: 14, train_loss: 0.5427, test_loss: 1.2726, test_f1: 0.5281
 epoch: 15, train_loss: 0.5369, test_loss: 1.4964, test_f1: 0.5481
 epoch: 16, train_loss: 0.5112, test_loss: 1.2971, test_f1: 0.5797
 epoch: 17, train_loss: 0.4907, test_loss: 1.3783, test_f1: 0.5134
 epoch: 18, train_loss: 0.4845, test_loss: 1.4976, test_f1: 0.6104
 epoch: 19, train_loss: 0.4955, test_loss: 1.4859, test_f1: 0.5479
 epoch: 20, train_loss: 0.4646, test_loss: 1.5097, test_f1: 0.5536
 epoch: 21, train_loss: 0.4310, test_loss: 1.5647, test_f1: 0.5947
 epoch: 22, train_loss: 0.4144, test_loss: 1.5809, test_f1: 0.5750
 epoch: 23, train_loss: 0.4478, test_loss: 1.6410, test_f1: 0.5472
 epoch: 24, train_loss: 0.4076, test_loss: 1.5131, test_f1: 0.6287
 epoch: 25, train_loss: 0.3817, test_loss: 1.6859, test_f1: 0.5900
 epoch: 26, train_loss: 0.3622, test_loss: 1.6074, test_f1: 0.5755
 epoch: 27, train_loss: 0.3830, test_loss: 1.5443, test_f1: 0.6108
 epoch: 28, train_loss: 0.3842, test_loss: 1.5664, test_f1: 0.6065
 epoch: 29, train_loss: 0.3221, test_loss: 1.5555, test_f1: 0.6064
 epoch: 30, train_loss: 0.3275, test_loss: 1.5685, test_f1: 0.6077
 epoch: 31, train_loss: 0.3383, test_loss: 1.6542, test_f1: 0.5649
 epoch: 32, train_loss: 0.3550, test_loss: 1.6694, test_f1: 0.5616
 epoch: 33, train_loss: 0.3272, test_loss: 1.5634, test_f1: 0.6035
 epoch: 34, train_loss: 0.3173, test_loss: 1.6434, test_f1: 0.5971
 epoch: 35, train_loss: 0.2958, test_loss: 1.7812, test_f1: 0.5872
 epoch: 36, train_loss: 0.2691, test_loss: 1.8804, test_f1: 0.6127
 epoch: 37, train_loss: 0.2440, test_loss: 1.8915, test_f1: 0.6365
 epoch: 38, train_loss: 0.2449, test_loss: 1.7925, test_f1: 0.5727
 epoch: 39, train_loss: 0.2248, test_loss: 2.1015, test_f1: 0.5764
 epoch: 40, train_loss: 0.2491, test_loss: 2.1247, test_f1: 0.5894
 epoch: 41, train_loss: 0.2439, test_loss: 2.1482, test_f1: 0.5555
 epoch: 42, train_loss: 0.2592, test_loss: 2.5192, test_f1: 0.5472
 epoch: 43, train_loss: 0.2173, test_loss: 2.0164, test_f1: 0.5963
 epoch: 44, train_loss: 0.2669, test_loss: 1.8439, test_f1: 0.6304
 epoch: 45, train_loss: 0.2363, test_loss: 1.8876, test_f1: 0.6582
 epoch: 46, train_loss: 0.2418, test_loss: 1.9300, test_f1: 0.6397
 epoch: 47, train_loss: 0.2645, test_loss: 1.6342, test_f1: 0.6580
 epoch: 48, train_loss: 0.2118, test_loss: 1.9691, test_f1: 0.6479
 epoch: 49, train_loss: 0.2255, test_loss: 1.6861, test_f1: 0.6471
 epoch: 50, train_loss: 0.2458, test_loss: 2.0187, test_f1: 0.5920
 epoch: 51, train_loss: 0.1802, test_loss: 1.9357, test_f1: 0.5762
 epoch: 52, train_loss: 0.2269, test_loss: 2.0187, test_f1: 0.5589
 epoch: 53, train_loss: 0.1819, test_loss: 1.9087, test_f1: 0.6075
 epoch: 54, train_loss: 0.1581, test_loss: 1.9253, test_f1: 0.5881
 epoch: 55, train_loss: 0.1476, test_loss: 1.9696, test_f1: 0.6295
 epoch: 56, train_loss: 0.1334, test_loss: 2.2123, test_f1: 0.6006
 epoch: 57, train_loss: 0.1340, test_loss: 2.0702, test_f1: 0.6437
 epoch: 58, train_loss: 0.1306, test_loss: 2.2846, test_f1: 0.6145
 epoch: 59, train_loss: 0.1350, test_loss: 2.1899, test_f1: 0.6596
 epoch: 60, train_loss: 0.1180, test_loss: 2.1108, test_f1: 0.6315
 epoch: 61, train_loss: 0.1110, test_loss: 2.3985, test_f1: 0.5927
 epoch: 62, train_loss: 0.1060, test_loss: 2.3243, test_f1: 0.6214
 epoch: 63, train_loss: 0.0861, test_loss: 2.4202, test_f1: 0.6021
 epoch: 64, train_loss: 0.0949, test_loss: 2.3357, test_f1: 0.6171
 epoch: 65, train_loss: 0.1055, test_loss: 2.4214, test_f1: 0.6178
 epoch: 66, train_loss: 0.0908, test_loss: 2.3625, test_f1: 0.6031
 epoch: 67, train_loss: 0.1196, test_loss: 2.5377, test_f1: 0.6229
 epoch: 68, train_loss: 0.0968, test_loss: 2.5125, test_f1: 0.5923
 epoch: 69, train_loss: 0.0997, test_loss: 2.4558, test_f1: 0.6084
 epoch: 70, train_loss: 0.0954, test_loss: 2.5302, test_f1: 0.6154
 epoch: 71, train_loss: 0.1030, test_loss: 2.2662, test_f1: 0.6212
 epoch: 72, train_loss: 0.1270, test_loss: 2.5921, test_f1: 0.6077
 epoch: 73, train_loss: 0.0998, test_loss: 2.6119, test_f1: 0.6566
 epoch: 74, train_loss: 0.0908, test_loss: 2.5886, test_f1: 0.5699
 epoch: 75, train_loss: 0.0889, test_loss: 2.5024, test_f1: 0.6157
 epoch: 76, train_loss: 0.0663, test_loss: 2.6221, test_f1: 0.6233
 epoch: 77, train_loss: 0.0773, test_loss: 2.5707, test_f1: 0.6139
 epoch: 78, train_loss: 0.0841, test_loss: 2.8433, test_f1: 0.6202
 epoch: 79, train_loss: 0.0785, test_loss: 2.7416, test_f1: 0.6514
 epoch: 80, train_loss: 0.0688, test_loss: 2.7381, test_f1: 0.6146
 epoch: 81, train_loss: 0.0781, test_loss: 2.5610, test_f1: 0.6379
 epoch: 82, train_loss: 0.0758, test_loss: 2.7547, test_f1: 0.6367
 epoch: 83, train_loss: 0.1034, test_loss: 2.7019, test_f1: 0.6455
 epoch: 84, train_loss: 0.1385, test_loss: 2.7605, test_f1: 0.5678
 epoch: 85, train_loss: 0.1105, test_loss: 2.6635, test_f1: 0.5903
 epoch: 86, train_loss: 0.0711, test_loss: 2.7205, test_f1: 0.6114
 epoch: 87, train_loss: 0.0797, test_loss: 3.0310, test_f1: 0.6132
 epoch: 88, train_loss: 0.0715, test_loss: 2.9022, test_f1: 0.6106
 epoch: 89, train_loss: 0.0649, test_loss: 2.8194, test_f1: 0.5954
 epoch: 90, train_loss: 0.0613, test_loss: 2.9758, test_f1: 0.5893
 epoch: 91, train_loss: 0.0742, test_loss: 3.0823, test_f1: 0.6407
 epoch: 92, train_loss: 0.0574, test_loss: 2.9499, test_f1: 0.6285
 epoch: 93, train_loss: 0.0678, test_loss: 3.0368, test_f1: 0.6225
 epoch: 94, train_loss: 0.0720, test_loss: 3.0900, test_f1: 0.6340
 epoch: 95, train_loss: 0.0654, test_loss: 2.7346, test_f1: 0.6431
 epoch: 96, train_loss: 0.0741, test_loss: 2.9520, test_f1: 0.6204
 epoch: 97, train_loss: 0.0699, test_loss: 2.9466, test_f1: 0.5937
 epoch: 98, train_loss: 0.0822, test_loss: 2.9946, test_f1: 0.5975
 epoch: 99, train_loss: 0.0602, test_loss: 3.1138, test_f1: 0.5870
##################ITERATION #4 ****************************************
 epoch: 0, train_loss: 1.1901, test_loss: 1.4037, test_f1: 0.3429
 epoch: 1, train_loss: 1.0017, test_loss: 1.3588, test_f1: 0.3518
 epoch: 2, train_loss: 0.9229, test_loss: 1.2255, test_f1: 0.3925
 epoch: 3, train_loss: 0.8731, test_loss: 1.1634, test_f1: 0.4641
 epoch: 4, train_loss: 0.8064, test_loss: 1.1157, test_f1: 0.5242
 epoch: 5, train_loss: 0.7827, test_loss: 1.0942, test_f1: 0.5815
 epoch: 6, train_loss: 0.7432, test_loss: 1.1314, test_f1: 0.5303
 epoch: 7, train_loss: 0.7280, test_loss: 1.1705, test_f1: 0.5279
 epoch: 8, train_loss: 0.6933, test_loss: 1.1162, test_f1: 0.5892
 epoch: 9, train_loss: 0.6941, test_loss: 1.1268, test_f1: 0.6035
 epoch: 10, train_loss: 0.6315, test_loss: 1.1169, test_f1: 0.5147
 epoch: 11, train_loss: 0.6330, test_loss: 1.2345, test_f1: 0.5105
 epoch: 12, train_loss: 0.6310, test_loss: 1.2185, test_f1: 0.5809
 epoch: 13, train_loss: 0.6062, test_loss: 1.3942, test_f1: 0.5734
 epoch: 14, train_loss: 0.5874, test_loss: 1.3269, test_f1: 0.5592
 epoch: 15, train_loss: 0.5806, test_loss: 1.2905, test_f1: 0.5952
 epoch: 16, train_loss: 0.5386, test_loss: 1.2428, test_f1: 0.5251
 epoch: 17, train_loss: 0.5669, test_loss: 1.0885, test_f1: 0.6338
 epoch: 18, train_loss: 0.5715, test_loss: 1.3790, test_f1: 0.5067
 epoch: 19, train_loss: 0.5763, test_loss: 1.3290, test_f1: 0.5551
 epoch: 20, train_loss: 0.5339, test_loss: 1.1182, test_f1: 0.6277
 epoch: 21, train_loss: 0.4860, test_loss: 1.1923, test_f1: 0.6123
 epoch: 22, train_loss: 0.4482, test_loss: 1.3774, test_f1: 0.5953
 epoch: 23, train_loss: 0.4294, test_loss: 1.3208, test_f1: 0.6319
 epoch: 24, train_loss: 0.4277, test_loss: 1.4949, test_f1: 0.5771
 epoch: 25, train_loss: 0.4230, test_loss: 1.3709, test_f1: 0.5736
 epoch: 26, train_loss: 0.4330, test_loss: 1.4848, test_f1: 0.5867
 epoch: 27, train_loss: 0.4139, test_loss: 1.4255, test_f1: 0.5949
 epoch: 28, train_loss: 0.3778, test_loss: 1.3983, test_f1: 0.6307
 epoch: 29, train_loss: 0.3573, test_loss: 1.6455, test_f1: 0.5773
 epoch: 30, train_loss: 0.3639, test_loss: 1.8029, test_f1: 0.5277
 epoch: 31, train_loss: 0.3731, test_loss: 1.7424, test_f1: 0.6385
 epoch: 32, train_loss: 0.3633, test_loss: 1.7172, test_f1: 0.5679
 epoch: 33, train_loss: 0.3429, test_loss: 1.7719, test_f1: 0.5642
 epoch: 34, train_loss: 0.3354, test_loss: 1.5517, test_f1: 0.5971
 epoch: 35, train_loss: 0.3053, test_loss: 1.9775, test_f1: 0.5693
 epoch: 36, train_loss: 0.3333, test_loss: 2.1206, test_f1: 0.5463
 epoch: 37, train_loss: 0.3150, test_loss: 2.0471, test_f1: 0.5492
 epoch: 38, train_loss: 0.2725, test_loss: 1.9357, test_f1: 0.5542
 epoch: 39, train_loss: 0.2839, test_loss: 1.9669, test_f1: 0.5887
 epoch: 40, train_loss: 0.2850, test_loss: 2.1440, test_f1: 0.5670
 epoch: 41, train_loss: 0.3105, test_loss: 1.8695, test_f1: 0.5766
 epoch: 42, train_loss: 0.3337, test_loss: 2.1573, test_f1: 0.5361
 epoch: 43, train_loss: 0.2745, test_loss: 1.9041, test_f1: 0.6205
 epoch: 44, train_loss: 0.2798, test_loss: 1.8828, test_f1: 0.6012
 epoch: 45, train_loss: 0.3136, test_loss: 1.7778, test_f1: 0.6315
 epoch: 46, train_loss: 0.2395, test_loss: 1.8956, test_f1: 0.6167
 epoch: 47, train_loss: 0.2550, test_loss: 1.5558, test_f1: 0.6248
 epoch: 48, train_loss: 0.2192, test_loss: 1.8921, test_f1: 0.5750
 epoch: 49, train_loss: 0.2293, test_loss: 2.3903, test_f1: 0.5950
 epoch: 50, train_loss: 0.2042, test_loss: 2.0071, test_f1: 0.5481
 epoch: 51, train_loss: 0.2203, test_loss: 2.2087, test_f1: 0.5578
 epoch: 52, train_loss: 0.1694, test_loss: 1.8391, test_f1: 0.6272
 epoch: 53, train_loss: 0.1932, test_loss: 1.8845, test_f1: 0.6260
 epoch: 54, train_loss: 0.1640, test_loss: 1.9311, test_f1: 0.6038
 epoch: 55, train_loss: 0.1526, test_loss: 1.9116, test_f1: 0.6163
 epoch: 56, train_loss: 0.1436, test_loss: 2.0491, test_f1: 0.6095
 epoch: 57, train_loss: 0.1233, test_loss: 2.0851, test_f1: 0.5873
 epoch: 58, train_loss: 0.1176, test_loss: 2.1251, test_f1: 0.5907
 epoch: 59, train_loss: 0.1114, test_loss: 2.2192, test_f1: 0.5745
 epoch: 60, train_loss: 0.1274, test_loss: 2.4096, test_f1: 0.5855
 epoch: 61, train_loss: 0.1001, test_loss: 2.3331, test_f1: 0.5828
 epoch: 62, train_loss: 0.1238, test_loss: 2.7061, test_f1: 0.5583
 epoch: 63, train_loss: 0.1351, test_loss: 2.0833, test_f1: 0.6276
 epoch: 64, train_loss: 0.1466, test_loss: 2.1315, test_f1: 0.6353
 epoch: 65, train_loss: 0.1465, test_loss: 2.5260, test_f1: 0.5824
 epoch: 66, train_loss: 0.1358, test_loss: 2.4358, test_f1: 0.5968
 epoch: 67, train_loss: 0.1391, test_loss: 2.6384, test_f1: 0.6346
 epoch: 68, train_loss: 0.1676, test_loss: 2.3693, test_f1: 0.5991
 epoch: 69, train_loss: 0.1324, test_loss: 2.3561, test_f1: 0.5869
 epoch: 70, train_loss: 0.1096, test_loss: 2.2776, test_f1: 0.6127
 epoch: 71, train_loss: 0.1390, test_loss: 2.4803, test_f1: 0.5569
 epoch: 72, train_loss: 0.0945, test_loss: 2.3217, test_f1: 0.6148
 epoch: 73, train_loss: 0.0945, test_loss: 2.3530, test_f1: 0.6192
 epoch: 74, train_loss: 0.0865, test_loss: 2.5109, test_f1: 0.5957
 epoch: 75, train_loss: 0.1118, test_loss: 2.4925, test_f1: 0.6099
 epoch: 76, train_loss: 0.1067, test_loss: 2.4584, test_f1: 0.5878
 epoch: 77, train_loss: 0.0951, test_loss: 2.4863, test_f1: 0.6042
 epoch: 78, train_loss: 0.0836, test_loss: 2.4668, test_f1: 0.6146
 epoch: 79, train_loss: 0.0962, test_loss: 2.5342, test_f1: 0.6001
 epoch: 80, train_loss: 0.1298, test_loss: 2.6751, test_f1: 0.5723
 epoch: 81, train_loss: 0.1266, test_loss: 2.3700, test_f1: 0.6192
 epoch: 82, train_loss: 0.1168, test_loss: 2.6333, test_f1: 0.6021
 epoch: 83, train_loss: 0.1004, test_loss: 2.7521, test_f1: 0.5771
 epoch: 84, train_loss: 0.0824, test_loss: 2.6114, test_f1: 0.5965
 epoch: 85, train_loss: 0.0833, test_loss: 2.5425, test_f1: 0.5954
 epoch: 86, train_loss: 0.0696, test_loss: 2.7155, test_f1: 0.5945
 epoch: 87, train_loss: 0.0827, test_loss: 2.7095, test_f1: 0.5951
 epoch: 88, train_loss: 0.0645, test_loss: 2.8441, test_f1: 0.5742
 epoch: 89, train_loss: 0.0716, test_loss: 2.7138, test_f1: 0.5915
 epoch: 90, train_loss: 0.0794, test_loss: 3.1229, test_f1: 0.5566
 epoch: 91, train_loss: 0.0728, test_loss: 3.2243, test_f1: 0.5846
 epoch: 92, train_loss: 0.0768, test_loss: 3.5843, test_f1: 0.5573
 epoch: 93, train_loss: 0.0886, test_loss: 2.8907, test_f1: 0.6044
 epoch: 94, train_loss: 0.1337, test_loss: 3.1341, test_f1: 0.5803
 epoch: 95, train_loss: 0.1556, test_loss: 2.8826, test_f1: 0.5654
 epoch: 96, train_loss: 0.1432, test_loss: 3.4125, test_f1: 0.5804
 epoch: 97, train_loss: 0.0990, test_loss: 2.6209, test_f1: 0.5944
 epoch: 98, train_loss: 0.1043, test_loss: 2.4872, test_f1: 0.6098
 epoch: 99, train_loss: 0.0891, test_loss: 2.6549, test_f1: 0.6244
##################ITERATION #5 ****************************************
 epoch: 0, train_loss: 1.2415, test_loss: 1.3154, test_f1: 0.3617
 epoch: 1, train_loss: 0.9784, test_loss: 1.3137, test_f1: 0.3177
 epoch: 2, train_loss: 0.9056, test_loss: 1.2511, test_f1: 0.4060
 epoch: 3, train_loss: 0.8474, test_loss: 1.0950, test_f1: 0.5313
 epoch: 4, train_loss: 0.7939, test_loss: 1.0934, test_f1: 0.5489
 epoch: 5, train_loss: 0.7713, test_loss: 1.0252, test_f1: 0.5754
 epoch: 6, train_loss: 0.7470, test_loss: 1.0590, test_f1: 0.5599
 epoch: 7, train_loss: 0.7148, test_loss: 0.9574, test_f1: 0.5643
 epoch: 8, train_loss: 0.6810, test_loss: 1.0439, test_f1: 0.5985
 epoch: 9, train_loss: 0.6592, test_loss: 1.0532, test_f1: 0.6053
 epoch: 10, train_loss: 0.6374, test_loss: 1.0856, test_f1: 0.6377
 epoch: 11, train_loss: 0.6145, test_loss: 0.9753, test_f1: 0.6150
 epoch: 12, train_loss: 0.5851, test_loss: 1.2218, test_f1: 0.5682
 epoch: 13, train_loss: 0.5929, test_loss: 1.1848, test_f1: 0.5824
 epoch: 14, train_loss: 0.5586, test_loss: 1.2941, test_f1: 0.5718
 epoch: 15, train_loss: 0.5314, test_loss: 1.2810, test_f1: 0.5907
 epoch: 16, train_loss: 0.4963, test_loss: 1.2856, test_f1: 0.5836
 epoch: 17, train_loss: 0.4717, test_loss: 1.3882, test_f1: 0.5899
 epoch: 18, train_loss: 0.4859, test_loss: 1.3109, test_f1: 0.5935
 epoch: 19, train_loss: 0.4424, test_loss: 1.3228, test_f1: 0.6131
 epoch: 20, train_loss: 0.4412, test_loss: 1.5472, test_f1: 0.5336
 epoch: 21, train_loss: 0.4482, test_loss: 1.4720, test_f1: 0.6288
 epoch: 22, train_loss: 0.4238, test_loss: 1.5532, test_f1: 0.5753
 epoch: 23, train_loss: 0.3988, test_loss: 1.5816, test_f1: 0.6251
 epoch: 24, train_loss: 0.4048, test_loss: 1.6078, test_f1: 0.5548
 epoch: 25, train_loss: 0.3760, test_loss: 1.9047, test_f1: 0.5280
 epoch: 26, train_loss: 0.3897, test_loss: 1.6646, test_f1: 0.5624
 epoch: 27, train_loss: 0.3315, test_loss: 1.9339, test_f1: 0.5720
 epoch: 28, train_loss: 0.3615, test_loss: 1.7258, test_f1: 0.5835
 epoch: 29, train_loss: 0.3438, test_loss: 1.8751, test_f1: 0.5818
 epoch: 30, train_loss: 0.3317, test_loss: 2.1729, test_f1: 0.5788
 epoch: 31, train_loss: 0.3426, test_loss: 1.9207, test_f1: 0.6215
 epoch: 32, train_loss: 0.2872, test_loss: 1.6128, test_f1: 0.5875
 epoch: 33, train_loss: 0.2613, test_loss: 1.9297, test_f1: 0.5603
 epoch: 34, train_loss: 0.2597, test_loss: 1.7097, test_f1: 0.6268
 epoch: 35, train_loss: 0.2661, test_loss: 1.7068, test_f1: 0.5949
 epoch: 36, train_loss: 0.2654, test_loss: 2.1527, test_f1: 0.5840
 epoch: 37, train_loss: 0.2759, test_loss: 1.8265, test_f1: 0.6257
 epoch: 38, train_loss: 0.2881, test_loss: 2.1006, test_f1: 0.6101
 epoch: 39, train_loss: 0.3083, test_loss: 2.4422, test_f1: 0.5540
 epoch: 40, train_loss: 0.2810, test_loss: 1.9539, test_f1: 0.5876
 epoch: 41, train_loss: 0.2796, test_loss: 1.8837, test_f1: 0.5945
 epoch: 42, train_loss: 0.2532, test_loss: 1.9197, test_f1: 0.6244
 epoch: 43, train_loss: 0.2261, test_loss: 1.9049, test_f1: 0.6163
 epoch: 44, train_loss: 0.1773, test_loss: 2.0441, test_f1: 0.6039
 epoch: 45, train_loss: 0.1894, test_loss: 2.4973, test_f1: 0.6215
 epoch: 46, train_loss: 0.1882, test_loss: 2.1096, test_f1: 0.5929
 epoch: 47, train_loss: 0.2401, test_loss: 2.7207, test_f1: 0.6059
 epoch: 48, train_loss: 0.2747, test_loss: 2.0044, test_f1: 0.6093
 epoch: 49, train_loss: 0.2512, test_loss: 2.1643, test_f1: 0.5696
 epoch: 50, train_loss: 0.2369, test_loss: 2.2655, test_f1: 0.5802
 epoch: 51, train_loss: 0.1992, test_loss: 2.0198, test_f1: 0.6236
 epoch: 52, train_loss: 0.1788, test_loss: 2.0857, test_f1: 0.6168
 epoch: 53, train_loss: 0.1484, test_loss: 2.0435, test_f1: 0.6366
 epoch: 54, train_loss: 0.1352, test_loss: 2.2324, test_f1: 0.6356
 epoch: 55, train_loss: 0.1362, test_loss: 2.3223, test_f1: 0.6081
 epoch: 56, train_loss: 0.1530, test_loss: 2.2426, test_f1: 0.6116
 epoch: 57, train_loss: 0.1349, test_loss: 2.3592, test_f1: 0.6302
 epoch: 58, train_loss: 0.1312, test_loss: 2.2729, test_f1: 0.6381
 epoch: 59, train_loss: 0.1108, test_loss: 2.4100, test_f1: 0.6063
 epoch: 60, train_loss: 0.0986, test_loss: 2.4248, test_f1: 0.6314
 epoch: 61, train_loss: 0.1210, test_loss: 2.4091, test_f1: 0.6525
 epoch: 62, train_loss: 0.1112, test_loss: 2.4951, test_f1: 0.6308
 epoch: 63, train_loss: 0.1040, test_loss: 2.5060, test_f1: 0.6281
 epoch: 64, train_loss: 0.0938, test_loss: 2.6087, test_f1: 0.6426
 epoch: 65, train_loss: 0.0927, test_loss: 2.4957, test_f1: 0.6090
 epoch: 66, train_loss: 0.1210, test_loss: 2.7223, test_f1: 0.6177
 epoch: 67, train_loss: 0.1221, test_loss: 2.7277, test_f1: 0.6339
 epoch: 68, train_loss: 0.1098, test_loss: 2.6506, test_f1: 0.6242
 epoch: 69, train_loss: 0.1091, test_loss: 2.4019, test_f1: 0.6385
 epoch: 70, train_loss: 0.0916, test_loss: 2.3456, test_f1: 0.6320
 epoch: 71, train_loss: 0.1123, test_loss: 2.7620, test_f1: 0.6054
 epoch: 72, train_loss: 0.1022, test_loss: 2.6848, test_f1: 0.6146
 epoch: 73, train_loss: 0.1039, test_loss: 2.7654, test_f1: 0.6135
 epoch: 74, train_loss: 0.0995, test_loss: 2.6943, test_f1: 0.6446
 epoch: 75, train_loss: 0.1047, test_loss: 2.6881, test_f1: 0.6409
 epoch: 76, train_loss: 0.1054, test_loss: 2.6974, test_f1: 0.6375
 epoch: 77, train_loss: 0.0750, test_loss: 2.7220, test_f1: 0.6322
 epoch: 78, train_loss: 0.1056, test_loss: 2.5038, test_f1: 0.6525
 epoch: 79, train_loss: 0.0917, test_loss: 2.5402, test_f1: 0.6404
 epoch: 80, train_loss: 0.0732, test_loss: 2.7833, test_f1: 0.6244
 epoch: 81, train_loss: 0.1025, test_loss: 2.7264, test_f1: 0.6060
 epoch: 82, train_loss: 0.0903, test_loss: 2.9332, test_f1: 0.6444
 epoch: 83, train_loss: 0.0631, test_loss: 2.8657, test_f1: 0.6551
 epoch: 84, train_loss: 0.0681, test_loss: 2.7834, test_f1: 0.6145
 epoch: 85, train_loss: 0.0660, test_loss: 2.7672, test_f1: 0.6383
 epoch: 86, train_loss: 0.0798, test_loss: 3.0271, test_f1: 0.6496
 epoch: 87, train_loss: 0.0822, test_loss: 2.9835, test_f1: 0.6393
 epoch: 88, train_loss: 0.0615, test_loss: 2.8772, test_f1: 0.6412
 epoch: 89, train_loss: 0.0849, test_loss: 2.9096, test_f1: 0.6227
 epoch: 90, train_loss: 0.0698, test_loss: 2.7980, test_f1: 0.6297
 epoch: 91, train_loss: 0.0761, test_loss: 2.9771, test_f1: 0.6314
 epoch: 92, train_loss: 0.0856, test_loss: 3.0627, test_f1: 0.6285
 epoch: 93, train_loss: 0.0800, test_loss: 2.6403, test_f1: 0.6559
 epoch: 94, train_loss: 0.0824, test_loss: 2.8866, test_f1: 0.6272
 epoch: 95, train_loss: 0.0670, test_loss: 2.9062, test_f1: 0.6398
 epoch: 96, train_loss: 0.0757, test_loss: 3.2119, test_f1: 0.6159
 epoch: 97, train_loss: 0.0619, test_loss: 3.1304, test_f1: 0.6414
 epoch: 98, train_loss: 0.0623, test_loss: 3.2494, test_f1: 0.6190
 epoch: 99, train_loss: 0.0541, test_loss: 3.1764, test_f1: 0.6286
##################ITERATION #6 ****************************************
 epoch: 0, train_loss: 1.1984, test_loss: 1.5362, test_f1: 0.1365
 epoch: 1, train_loss: 0.9787, test_loss: 1.2493, test_f1: 0.3130
 epoch: 2, train_loss: 0.9125, test_loss: 1.1252, test_f1: 0.4566
 epoch: 3, train_loss: 0.8731, test_loss: 1.1443, test_f1: 0.5153
 epoch: 4, train_loss: 0.8166, test_loss: 1.0087, test_f1: 0.5605
 epoch: 5, train_loss: 0.7901, test_loss: 1.0599, test_f1: 0.5066
 epoch: 6, train_loss: 0.7583, test_loss: 0.9699, test_f1: 0.5733
 epoch: 7, train_loss: 0.7558, test_loss: 1.0347, test_f1: 0.6333
 epoch: 8, train_loss: 0.7074, test_loss: 1.0291, test_f1: 0.5765
 epoch: 9, train_loss: 0.7080, test_loss: 1.1440, test_f1: 0.4782
 epoch: 10, train_loss: 0.6984, test_loss: 1.0715, test_f1: 0.5635
 epoch: 11, train_loss: 0.6706, test_loss: 1.0416, test_f1: 0.5971
 epoch: 12, train_loss: 0.6441, test_loss: 1.4889, test_f1: 0.4721
 epoch: 13, train_loss: 0.6584, test_loss: 1.0553, test_f1: 0.5930
 epoch: 14, train_loss: 0.6274, test_loss: 1.1371, test_f1: 0.5873
 epoch: 15, train_loss: 0.6281, test_loss: 1.1680, test_f1: 0.5527
 epoch: 16, train_loss: 0.5973, test_loss: 1.1528, test_f1: 0.5479
 epoch: 17, train_loss: 0.5933, test_loss: 1.1792, test_f1: 0.5707
 epoch: 18, train_loss: 0.5724, test_loss: 1.3843, test_f1: 0.5516
 epoch: 19, train_loss: 0.5422, test_loss: 1.2137, test_f1: 0.6322
 epoch: 20, train_loss: 0.5180, test_loss: 1.7598, test_f1: 0.3912
 epoch: 21, train_loss: 0.5080, test_loss: 1.2356, test_f1: 0.5831
 epoch: 22, train_loss: 0.4739, test_loss: 1.3566, test_f1: 0.5760
 epoch: 23, train_loss: 0.4535, test_loss: 1.2619, test_f1: 0.6347
 epoch: 24, train_loss: 0.4407, test_loss: 1.3766, test_f1: 0.6166
 epoch: 25, train_loss: 0.4174, test_loss: 1.5525, test_f1: 0.5693
 epoch: 26, train_loss: 0.4293, test_loss: 1.4495, test_f1: 0.5361
 epoch: 27, train_loss: 0.4894, test_loss: 1.6549, test_f1: 0.4860
 epoch: 28, train_loss: 0.4217, test_loss: 1.5481, test_f1: 0.5655
 epoch: 29, train_loss: 0.4202, test_loss: 1.2746, test_f1: 0.6106
 epoch: 30, train_loss: 0.4184, test_loss: 1.3394, test_f1: 0.6418
 epoch: 31, train_loss: 0.3581, test_loss: 1.5619, test_f1: 0.5754
 epoch: 32, train_loss: 0.3945, test_loss: 1.6008, test_f1: 0.6220
 epoch: 33, train_loss: 0.3532, test_loss: 1.5090, test_f1: 0.6252
 epoch: 34, train_loss: 0.3467, test_loss: 1.4974, test_f1: 0.5611
 epoch: 35, train_loss: 0.3567, test_loss: 1.7080, test_f1: 0.6078
 epoch: 36, train_loss: 0.3403, test_loss: 2.0663, test_f1: 0.5533
 epoch: 37, train_loss: 0.3492, test_loss: 1.5661, test_f1: 0.5960
 epoch: 38, train_loss: 0.3430, test_loss: 1.4124, test_f1: 0.6789
 epoch: 39, train_loss: 0.3538, test_loss: 1.7901, test_f1: 0.5861
 epoch: 40, train_loss: 0.3630, test_loss: 1.6792, test_f1: 0.6070
 epoch: 41, train_loss: 0.2947, test_loss: 1.5005, test_f1: 0.5862
 epoch: 42, train_loss: 0.2875, test_loss: 1.8294, test_f1: 0.5762
 epoch: 43, train_loss: 0.2894, test_loss: 2.0577, test_f1: 0.5853
 epoch: 44, train_loss: 0.2775, test_loss: 1.8329, test_f1: 0.5550
 epoch: 45, train_loss: 0.2923, test_loss: 1.7949, test_f1: 0.5934
 epoch: 46, train_loss: 0.2636, test_loss: 1.9759, test_f1: 0.5606
 epoch: 47, train_loss: 0.3004, test_loss: 1.9891, test_f1: 0.5850
 epoch: 48, train_loss: 0.2344, test_loss: 2.3059, test_f1: 0.5596
 epoch: 49, train_loss: 0.2550, test_loss: 1.9970, test_f1: 0.5402
 epoch: 50, train_loss: 0.2555, test_loss: 1.9840, test_f1: 0.5619
 epoch: 51, train_loss: 0.2230, test_loss: 1.9843, test_f1: 0.6169
 epoch: 52, train_loss: 0.1998, test_loss: 1.9597, test_f1: 0.6077
 epoch: 53, train_loss: 0.1793, test_loss: 1.9901, test_f1: 0.5897
 epoch: 54, train_loss: 0.1988, test_loss: 2.3027, test_f1: 0.5965
 epoch: 55, train_loss: 0.1460, test_loss: 2.2255, test_f1: 0.6141
 epoch: 56, train_loss: 0.1409, test_loss: 2.0304, test_f1: 0.6090
 epoch: 57, train_loss: 0.1812, test_loss: 2.0848, test_f1: 0.6099
 epoch: 58, train_loss: 0.1641, test_loss: 2.3630, test_f1: 0.5783
 epoch: 59, train_loss: 0.1773, test_loss: 2.0894, test_f1: 0.6000
 epoch: 60, train_loss: 0.1247, test_loss: 2.3443, test_f1: 0.5695
 epoch: 61, train_loss: 0.1288, test_loss: 2.3567, test_f1: 0.5734
 epoch: 62, train_loss: 0.1303, test_loss: 2.3824, test_f1: 0.5942
 epoch: 63, train_loss: 0.1132, test_loss: 2.4810, test_f1: 0.6386
 epoch: 64, train_loss: 0.1363, test_loss: 2.2565, test_f1: 0.5985
 epoch: 65, train_loss: 0.1313, test_loss: 2.2759, test_f1: 0.5996
 epoch: 66, train_loss: 0.1132, test_loss: 2.5152, test_f1: 0.5759
 epoch: 67, train_loss: 0.1086, test_loss: 2.3059, test_f1: 0.6391
 epoch: 68, train_loss: 0.0982, test_loss: 2.4837, test_f1: 0.5796
 epoch: 69, train_loss: 0.0958, test_loss: 2.3262, test_f1: 0.6384
 epoch: 70, train_loss: 0.1268, test_loss: 2.5979, test_f1: 0.5882
 epoch: 71, train_loss: 0.1208, test_loss: 2.2619, test_f1: 0.6310
 epoch: 72, train_loss: 0.1311, test_loss: 2.6398, test_f1: 0.5921
 epoch: 73, train_loss: 0.1147, test_loss: 2.7457, test_f1: 0.5650
 epoch: 74, train_loss: 0.1251, test_loss: 2.4433, test_f1: 0.5838
 epoch: 75, train_loss: 0.1040, test_loss: 2.3844, test_f1: 0.6010
 epoch: 76, train_loss: 0.0911, test_loss: 2.2434, test_f1: 0.6026
 epoch: 77, train_loss: 0.1069, test_loss: 2.4728, test_f1: 0.5941
 epoch: 78, train_loss: 0.1197, test_loss: 2.7332, test_f1: 0.5833
 epoch: 79, train_loss: 0.1632, test_loss: 2.3353, test_f1: 0.5985
 epoch: 80, train_loss: 0.1614, test_loss: 2.6259, test_f1: 0.5742
 epoch: 81, train_loss: 0.1370, test_loss: 2.5174, test_f1: 0.5493
 epoch: 82, train_loss: 0.1145, test_loss: 2.6450, test_f1: 0.5426
 epoch: 83, train_loss: 0.1053, test_loss: 2.5546, test_f1: 0.5795
 epoch: 84, train_loss: 0.0850, test_loss: 2.4233, test_f1: 0.5952
 epoch: 85, train_loss: 0.0927, test_loss: 2.5471, test_f1: 0.6197
 epoch: 86, train_loss: 0.0954, test_loss: 2.2926, test_f1: 0.6129
 epoch: 87, train_loss: 0.0749, test_loss: 2.5739, test_f1: 0.5986
 epoch: 88, train_loss: 0.0920, test_loss: 2.7543, test_f1: 0.5712
 epoch: 89, train_loss: 0.0877, test_loss: 2.6544, test_f1: 0.5867
 epoch: 90, train_loss: 0.0856, test_loss: 2.7495, test_f1: 0.6075
 epoch: 91, train_loss: 0.0877, test_loss: 2.5563, test_f1: 0.5852
 epoch: 92, train_loss: 0.0756, test_loss: 2.7111, test_f1: 0.5932
 epoch: 93, train_loss: 0.1111, test_loss: 2.3325, test_f1: 0.6431
 epoch: 94, train_loss: 0.1198, test_loss: 2.8112, test_f1: 0.5978
 epoch: 95, train_loss: 0.1005, test_loss: 3.0283, test_f1: 0.5982
 epoch: 96, train_loss: 0.1061, test_loss: 2.6693, test_f1: 0.6126
 epoch: 97, train_loss: 0.1086, test_loss: 2.7770, test_f1: 0.6070
 epoch: 98, train_loss: 0.0954, test_loss: 2.6962, test_f1: 0.5802
 epoch: 99, train_loss: 0.0814, test_loss: 2.3725, test_f1: 0.5835
##################ITERATION #7 ****************************************
 epoch: 0, train_loss: 1.2795, test_loss: 1.4924, test_f1: 0.1365
 epoch: 1, train_loss: 1.0064, test_loss: 1.6030, test_f1: 0.1425
 epoch: 2, train_loss: 0.9048, test_loss: 1.5826, test_f1: 0.2898
 epoch: 3, train_loss: 0.8390, test_loss: 1.5351, test_f1: 0.2665
 epoch: 4, train_loss: 0.7929, test_loss: 1.3092, test_f1: 0.4568
 epoch: 5, train_loss: 0.7609, test_loss: 1.2104, test_f1: 0.4984
 epoch: 6, train_loss: 0.7282, test_loss: 1.0757, test_f1: 0.5755
 epoch: 7, train_loss: 0.6721, test_loss: 1.1369, test_f1: 0.5886
 epoch: 8, train_loss: 0.6547, test_loss: 1.1633, test_f1: 0.5718
 epoch: 9, train_loss: 0.6418, test_loss: 1.3884, test_f1: 0.5403
 epoch: 10, train_loss: 0.6330, test_loss: 1.2010, test_f1: 0.5799
 epoch: 11, train_loss: 0.6309, test_loss: 1.0806, test_f1: 0.6106
 epoch: 12, train_loss: 0.6024, test_loss: 1.0980, test_f1: 0.5617
 epoch: 13, train_loss: 0.5813, test_loss: 1.3481, test_f1: 0.5727
 epoch: 14, train_loss: 0.5982, test_loss: 1.2482, test_f1: 0.6035
 epoch: 15, train_loss: 0.5659, test_loss: 1.1928, test_f1: 0.5875
 epoch: 16, train_loss: 0.5224, test_loss: 1.1884, test_f1: 0.6310
 epoch: 17, train_loss: 0.4804, test_loss: 1.2390, test_f1: 0.6223
 epoch: 18, train_loss: 0.4737, test_loss: 1.2518, test_f1: 0.5899
 epoch: 19, train_loss: 0.4834, test_loss: 1.2267, test_f1: 0.6336
 epoch: 20, train_loss: 0.4755, test_loss: 1.3318, test_f1: 0.6122
 epoch: 21, train_loss: 0.4284, test_loss: 1.2144, test_f1: 0.6010
 epoch: 22, train_loss: 0.3928, test_loss: 1.1946, test_f1: 0.6674
 epoch: 23, train_loss: 0.4132, test_loss: 1.4157, test_f1: 0.5675
 epoch: 24, train_loss: 0.3893, test_loss: 1.4162, test_f1: 0.6078
 epoch: 25, train_loss: 0.4038, test_loss: 1.2663, test_f1: 0.6094
 epoch: 26, train_loss: 0.3681, test_loss: 1.2541, test_f1: 0.6412
 epoch: 27, train_loss: 0.3684, test_loss: 1.5941, test_f1: 0.5619
 epoch: 28, train_loss: 0.4249, test_loss: 1.4980, test_f1: 0.5975
 epoch: 29, train_loss: 0.4054, test_loss: 1.2445, test_f1: 0.6270
 epoch: 30, train_loss: 0.3469, test_loss: 1.5805, test_f1: 0.5302
 epoch: 31, train_loss: 0.3337, test_loss: 1.4478, test_f1: 0.6134
 epoch: 32, train_loss: 0.2987, test_loss: 1.5752, test_f1: 0.6135
 epoch: 33, train_loss: 0.2920, test_loss: 1.5821, test_f1: 0.6290
 epoch: 34, train_loss: 0.2679, test_loss: 1.5794, test_f1: 0.6542
 epoch: 35, train_loss: 0.3475, test_loss: 1.4454, test_f1: 0.6483
 epoch: 36, train_loss: 0.2908, test_loss: 1.7405, test_f1: 0.5851
 epoch: 37, train_loss: 0.2812, test_loss: 1.7051, test_f1: 0.6051
 epoch: 38, train_loss: 0.2589, test_loss: 1.8131, test_f1: 0.6250
 epoch: 39, train_loss: 0.2971, test_loss: 1.5268, test_f1: 0.6674
 epoch: 40, train_loss: 0.2450, test_loss: 1.4768, test_f1: 0.6702
 epoch: 41, train_loss: 0.2461, test_loss: 2.0481, test_f1: 0.5947
 epoch: 42, train_loss: 0.2500, test_loss: 1.8694, test_f1: 0.6202
 epoch: 43, train_loss: 0.2236, test_loss: 1.8582, test_f1: 0.6196
 epoch: 44, train_loss: 0.2445, test_loss: 1.8521, test_f1: 0.6288
 epoch: 45, train_loss: 0.2272, test_loss: 1.9769, test_f1: 0.6349
 epoch: 46, train_loss: 0.2529, test_loss: 1.7745, test_f1: 0.6282
 epoch: 47, train_loss: 0.2748, test_loss: 2.0007, test_f1: 0.5778
 epoch: 48, train_loss: 0.2729, test_loss: 1.9906, test_f1: 0.6211
 epoch: 49, train_loss: 0.2557, test_loss: 1.8263, test_f1: 0.6225
 epoch: 50, train_loss: 0.2031, test_loss: 1.8831, test_f1: 0.6362
 epoch: 51, train_loss: 0.1604, test_loss: 1.7495, test_f1: 0.6482
 epoch: 52, train_loss: 0.1395, test_loss: 1.9782, test_f1: 0.6202
 epoch: 53, train_loss: 0.1316, test_loss: 1.9432, test_f1: 0.6442
 epoch: 54, train_loss: 0.1445, test_loss: 1.9055, test_f1: 0.6276
 epoch: 55, train_loss: 0.1724, test_loss: 2.1228, test_f1: 0.6045
 epoch: 56, train_loss: 0.1675, test_loss: 2.1444, test_f1: 0.6094
 epoch: 57, train_loss: 0.1167, test_loss: 1.8926, test_f1: 0.6311
 epoch: 58, train_loss: 0.1203, test_loss: 2.0799, test_f1: 0.6080
 epoch: 59, train_loss: 0.1072, test_loss: 2.2070, test_f1: 0.6034
 epoch: 60, train_loss: 0.0959, test_loss: 2.1800, test_f1: 0.6286
 epoch: 61, train_loss: 0.0923, test_loss: 2.3956, test_f1: 0.6162
 epoch: 62, train_loss: 0.1013, test_loss: 2.4420, test_f1: 0.6455
 epoch: 63, train_loss: 0.0976, test_loss: 2.4924, test_f1: 0.6226
 epoch: 64, train_loss: 0.0932, test_loss: 2.5135, test_f1: 0.5958
 epoch: 65, train_loss: 0.1002, test_loss: 2.4250, test_f1: 0.6205
 epoch: 66, train_loss: 0.1012, test_loss: 2.2224, test_f1: 0.6279
 epoch: 67, train_loss: 0.1163, test_loss: 2.3306, test_f1: 0.5974
 epoch: 68, train_loss: 0.1019, test_loss: 2.3343, test_f1: 0.5960
 epoch: 69, train_loss: 0.0997, test_loss: 2.6111, test_f1: 0.6269
 epoch: 70, train_loss: 0.0882, test_loss: 2.6912, test_f1: 0.6285
 epoch: 71, train_loss: 0.0827, test_loss: 2.6706, test_f1: 0.6098
 epoch: 72, train_loss: 0.1059, test_loss: 2.6980, test_f1: 0.6013
 epoch: 73, train_loss: 0.1101, test_loss: 2.5842, test_f1: 0.6259
 epoch: 74, train_loss: 0.1011, test_loss: 2.5521, test_f1: 0.6368
 epoch: 75, train_loss: 0.1069, test_loss: 2.6606, test_f1: 0.6285
 epoch: 76, train_loss: 0.0861, test_loss: 2.5054, test_f1: 0.6346
 epoch: 77, train_loss: 0.1076, test_loss: 2.5455, test_f1: 0.6029
 epoch: 78, train_loss: 0.0935, test_loss: 2.7298, test_f1: 0.6433
 epoch: 79, train_loss: 0.0943, test_loss: 2.7014, test_f1: 0.6411
 epoch: 80, train_loss: 0.0721, test_loss: 2.6645, test_f1: 0.6214
 epoch: 81, train_loss: 0.0832, test_loss: 2.6540, test_f1: 0.5945
 epoch: 82, train_loss: 0.0845, test_loss: 2.5800, test_f1: 0.6278
 epoch: 83, train_loss: 0.0831, test_loss: 2.6530, test_f1: 0.6221
 epoch: 84, train_loss: 0.0790, test_loss: 2.7454, test_f1: 0.6231
 epoch: 85, train_loss: 0.0894, test_loss: 2.4345, test_f1: 0.6603
 epoch: 86, train_loss: 0.1098, test_loss: 2.8558, test_f1: 0.6089
 epoch: 87, train_loss: 0.0751, test_loss: 2.7946, test_f1: 0.6172
 epoch: 88, train_loss: 0.0783, test_loss: 2.8289, test_f1: 0.6150
 epoch: 89, train_loss: 0.0814, test_loss: 2.9810, test_f1: 0.5965
 epoch: 90, train_loss: 0.0792, test_loss: 3.0070, test_f1: 0.6003
 epoch: 91, train_loss: 0.0800, test_loss: 2.8131, test_f1: 0.6231
 epoch: 92, train_loss: 0.0811, test_loss: 2.8886, test_f1: 0.6189
 epoch: 93, train_loss: 0.0776, test_loss: 2.7266, test_f1: 0.6093
 epoch: 94, train_loss: 0.0739, test_loss: 2.6619, test_f1: 0.6355
 epoch: 95, train_loss: 0.0745, test_loss: 2.8089, test_f1: 0.6538
 epoch: 96, train_loss: 0.0755, test_loss: 2.7173, test_f1: 0.6263
 epoch: 97, train_loss: 0.0788, test_loss: 2.9547, test_f1: 0.6170
 epoch: 98, train_loss: 0.1177, test_loss: 2.6463, test_f1: 0.6260
 epoch: 99, train_loss: 0.0813, test_loss: 2.6731, test_f1: 0.5973
##################ITERATION #8 ****************************************
 epoch: 0, train_loss: 1.2665, test_loss: 1.5732, test_f1: 0.3573
 epoch: 1, train_loss: 1.0377, test_loss: 1.5022, test_f1: 0.2801
 epoch: 2, train_loss: 0.9316, test_loss: 1.3649, test_f1: 0.3266
 epoch: 3, train_loss: 0.8675, test_loss: 1.1035, test_f1: 0.5100
 epoch: 4, train_loss: 0.8270, test_loss: 1.0711, test_f1: 0.5503
 epoch: 5, train_loss: 0.8353, test_loss: 1.1137, test_f1: 0.5114
 epoch: 6, train_loss: 0.7991, test_loss: 1.0543, test_f1: 0.5927
 epoch: 7, train_loss: 0.7534, test_loss: 1.0964, test_f1: 0.5653
 epoch: 8, train_loss: 0.7294, test_loss: 1.0565, test_f1: 0.5506
 epoch: 9, train_loss: 0.6919, test_loss: 1.1140, test_f1: 0.5725
 epoch: 10, train_loss: 0.6850, test_loss: 1.1899, test_f1: 0.5390
 epoch: 11, train_loss: 0.6479, test_loss: 1.2358, test_f1: 0.5342
 epoch: 12, train_loss: 0.6167, test_loss: 1.2884, test_f1: 0.5578
 epoch: 13, train_loss: 0.6609, test_loss: 1.2126, test_f1: 0.5599
 epoch: 14, train_loss: 0.6244, test_loss: 1.1764, test_f1: 0.5951
 epoch: 15, train_loss: 0.6036, test_loss: 1.2663, test_f1: 0.5656
 epoch: 16, train_loss: 0.5685, test_loss: 1.1229, test_f1: 0.5584
 epoch: 17, train_loss: 0.5916, test_loss: 1.3261, test_f1: 0.4987
 epoch: 18, train_loss: 0.5562, test_loss: 1.1664, test_f1: 0.6234
 epoch: 19, train_loss: 0.5283, test_loss: 1.4023, test_f1: 0.6185
 epoch: 20, train_loss: 0.5118, test_loss: 1.4761, test_f1: 0.5472
 epoch: 21, train_loss: 0.5047, test_loss: 1.2829, test_f1: 0.5764
 epoch: 22, train_loss: 0.4862, test_loss: 1.2112, test_f1: 0.6478
 epoch: 23, train_loss: 0.4817, test_loss: 1.4777, test_f1: 0.5878
 epoch: 24, train_loss: 0.4910, test_loss: 1.7084, test_f1: 0.4700
 epoch: 25, train_loss: 0.4730, test_loss: 1.4671, test_f1: 0.5845
 epoch: 26, train_loss: 0.4486, test_loss: 1.4635, test_f1: 0.5555
 epoch: 27, train_loss: 0.4140, test_loss: 1.5482, test_f1: 0.5631
 epoch: 28, train_loss: 0.4050, test_loss: 1.6077, test_f1: 0.5943
 epoch: 29, train_loss: 0.4082, test_loss: 1.5058, test_f1: 0.6039
 epoch: 30, train_loss: 0.4227, test_loss: 1.5516, test_f1: 0.6010
 epoch: 31, train_loss: 0.3891, test_loss: 1.4751, test_f1: 0.6148
 epoch: 32, train_loss: 0.3834, test_loss: 1.4780, test_f1: 0.6320
 epoch: 33, train_loss: 0.3724, test_loss: 1.7522, test_f1: 0.5613
 epoch: 34, train_loss: 0.3980, test_loss: 1.7538, test_f1: 0.5882
 epoch: 35, train_loss: 0.3562, test_loss: 1.8540, test_f1: 0.5951
 epoch: 36, train_loss: 0.3931, test_loss: 1.4867, test_f1: 0.6380
 epoch: 37, train_loss: 0.3839, test_loss: 1.7667, test_f1: 0.5830
 epoch: 38, train_loss: 0.3426, test_loss: 1.5922, test_f1: 0.6285
 epoch: 39, train_loss: 0.3016, test_loss: 1.7230, test_f1: 0.6308
 epoch: 40, train_loss: 0.3369, test_loss: 1.5222, test_f1: 0.6188
 epoch: 41, train_loss: 0.3047, test_loss: 2.0055, test_f1: 0.4930
 epoch: 42, train_loss: 0.3306, test_loss: 1.7956, test_f1: 0.6190
 epoch: 43, train_loss: 0.2678, test_loss: 1.4890, test_f1: 0.6307
 epoch: 44, train_loss: 0.3264, test_loss: 1.7917, test_f1: 0.5885
 epoch: 45, train_loss: 0.3116, test_loss: 1.5479, test_f1: 0.6398
 epoch: 46, train_loss: 0.3091, test_loss: 1.7358, test_f1: 0.6581
 epoch: 47, train_loss: 0.2780, test_loss: 1.8843, test_f1: 0.6080
 epoch: 48, train_loss: 0.3000, test_loss: 1.7289, test_f1: 0.5912
 epoch: 49, train_loss: 0.2582, test_loss: 1.7865, test_f1: 0.5977
 epoch: 50, train_loss: 0.2897, test_loss: 1.6469, test_f1: 0.6025
 epoch: 51, train_loss: 0.2281, test_loss: 1.5930, test_f1: 0.6562
 epoch: 52, train_loss: 0.2154, test_loss: 1.7484, test_f1: 0.6268
 epoch: 53, train_loss: 0.2033, test_loss: 1.9063, test_f1: 0.6016
 epoch: 54, train_loss: 0.1747, test_loss: 1.8188, test_f1: 0.6604
 epoch: 55, train_loss: 0.1646, test_loss: 1.9158, test_f1: 0.6139
 epoch: 56, train_loss: 0.1687, test_loss: 1.9695, test_f1: 0.5942
 epoch: 57, train_loss: 0.1555, test_loss: 1.7723, test_f1: 0.6515
 epoch: 58, train_loss: 0.1432, test_loss: 1.9397, test_f1: 0.6039
 epoch: 59, train_loss: 0.1627, test_loss: 2.0661, test_f1: 0.6260
 epoch: 60, train_loss: 0.1401, test_loss: 2.1888, test_f1: 0.6164
 epoch: 61, train_loss: 0.1623, test_loss: 1.9558, test_f1: 0.6307
 epoch: 62, train_loss: 0.1411, test_loss: 2.1907, test_f1: 0.6047
 epoch: 63, train_loss: 0.1511, test_loss: 2.1207, test_f1: 0.6178
 epoch: 64, train_loss: 0.1364, test_loss: 2.1796, test_f1: 0.5984
 epoch: 65, train_loss: 0.1334, test_loss: 2.2344, test_f1: 0.6183
 epoch: 66, train_loss: 0.1495, test_loss: 2.2101, test_f1: 0.6005
 epoch: 67, train_loss: 0.1508, test_loss: 2.2225, test_f1: 0.6448
 epoch: 68, train_loss: 0.1277, test_loss: 2.4758, test_f1: 0.5759
 epoch: 69, train_loss: 0.1494, test_loss: 2.2852, test_f1: 0.6171
 epoch: 70, train_loss: 0.1294, test_loss: 2.2373, test_f1: 0.6414
 epoch: 71, train_loss: 0.1291, test_loss: 2.2950, test_f1: 0.6425
 epoch: 72, train_loss: 0.0996, test_loss: 2.2069, test_f1: 0.6529
 epoch: 73, train_loss: 0.0996, test_loss: 2.3949, test_f1: 0.6332
 epoch: 74, train_loss: 0.1028, test_loss: 2.2511, test_f1: 0.6399
 epoch: 75, train_loss: 0.1336, test_loss: 2.5126, test_f1: 0.5990
 epoch: 76, train_loss: 0.1366, test_loss: 2.2342, test_f1: 0.6491
 epoch: 77, train_loss: 0.1306, test_loss: 2.2484, test_f1: 0.6560
 epoch: 78, train_loss: 0.1649, test_loss: 2.3980, test_f1: 0.6065
 epoch: 79, train_loss: 0.1374, test_loss: 2.4646, test_f1: 0.6159
 epoch: 80, train_loss: 0.1313, test_loss: 2.3550, test_f1: 0.6300
 epoch: 81, train_loss: 0.1185, test_loss: 2.1913, test_f1: 0.6710
 epoch: 82, train_loss: 0.1288, test_loss: 2.3786, test_f1: 0.6191
 epoch: 83, train_loss: 0.1159, test_loss: 2.4634, test_f1: 0.6461
 epoch: 84, train_loss: 0.0963, test_loss: 2.4010, test_f1: 0.6334
 epoch: 85, train_loss: 0.1052, test_loss: 2.3731, test_f1: 0.6273
 epoch: 86, train_loss: 0.1059, test_loss: 2.5150, test_f1: 0.6410
 epoch: 87, train_loss: 0.1237, test_loss: 2.6746, test_f1: 0.6479
 epoch: 88, train_loss: 0.1338, test_loss: 2.5020, test_f1: 0.6536
 epoch: 89, train_loss: 0.1368, test_loss: 2.3399, test_f1: 0.6108
 epoch: 90, train_loss: 0.1076, test_loss: 2.3477, test_f1: 0.6478
 epoch: 91, train_loss: 0.1043, test_loss: 2.4592, test_f1: 0.6457
 epoch: 92, train_loss: 0.1137, test_loss: 2.4884, test_f1: 0.6346
 epoch: 93, train_loss: 0.1170, test_loss: 2.4412, test_f1: 0.6300
 epoch: 94, train_loss: 0.1368, test_loss: 2.3476, test_f1: 0.6197
 epoch: 95, train_loss: 0.1001, test_loss: 2.2538, test_f1: 0.6704
 epoch: 96, train_loss: 0.0828, test_loss: 2.3822, test_f1: 0.6355
 epoch: 97, train_loss: 0.0768, test_loss: 2.5574, test_f1: 0.6267
 epoch: 98, train_loss: 0.0987, test_loss: 2.6080, test_f1: 0.6175
 epoch: 99, train_loss: 0.1215, test_loss: 2.2383, test_f1: 0.6537
##################ITERATION #9 ****************************************
 epoch: 0, train_loss: 1.2839, test_loss: 1.4634, test_f1: 0.2281
 epoch: 1, train_loss: 1.0092, test_loss: 1.3421, test_f1: 0.3375
 epoch: 2, train_loss: 0.8991, test_loss: 1.2790, test_f1: 0.4105
 epoch: 3, train_loss: 0.8384, test_loss: 1.1104, test_f1: 0.5433
 epoch: 4, train_loss: 0.8072, test_loss: 1.0421, test_f1: 0.6057
 epoch: 5, train_loss: 0.7845, test_loss: 1.0155, test_f1: 0.6090
 epoch: 6, train_loss: 0.7576, test_loss: 1.0542, test_f1: 0.5401
 epoch: 7, train_loss: 0.7172, test_loss: 0.9894, test_f1: 0.5965
 epoch: 8, train_loss: 0.6967, test_loss: 1.0603, test_f1: 0.6218
 epoch: 9, train_loss: 0.6608, test_loss: 1.2008, test_f1: 0.5532
 epoch: 10, train_loss: 0.6495, test_loss: 1.1758, test_f1: 0.5905
 epoch: 11, train_loss: 0.6335, test_loss: 1.1512, test_f1: 0.5538
 epoch: 12, train_loss: 0.6084, test_loss: 1.1716, test_f1: 0.5834
 epoch: 13, train_loss: 0.5972, test_loss: 1.5065, test_f1: 0.5190
 epoch: 14, train_loss: 0.5803, test_loss: 1.0714, test_f1: 0.6161
 epoch: 15, train_loss: 0.5631, test_loss: 1.1279, test_f1: 0.6403
 epoch: 16, train_loss: 0.5444, test_loss: 1.1702, test_f1: 0.6046
 epoch: 17, train_loss: 0.5422, test_loss: 1.4588, test_f1: 0.6033
 epoch: 18, train_loss: 0.5550, test_loss: 1.1547, test_f1: 0.6082
 epoch: 19, train_loss: 0.5190, test_loss: 1.1326, test_f1: 0.6049
 epoch: 20, train_loss: 0.5046, test_loss: 1.4314, test_f1: 0.6127
 epoch: 21, train_loss: 0.4863, test_loss: 1.3701, test_f1: 0.5353
 epoch: 22, train_loss: 0.4720, test_loss: 1.4149, test_f1: 0.5993
 epoch: 23, train_loss: 0.5267, test_loss: 1.2768, test_f1: 0.6068
 epoch: 24, train_loss: 0.4411, test_loss: 1.3639, test_f1: 0.6391
 epoch: 25, train_loss: 0.4406, test_loss: 1.4940, test_f1: 0.5629
 epoch: 26, train_loss: 0.4378, test_loss: 1.3740, test_f1: 0.6292
 epoch: 27, train_loss: 0.4016, test_loss: 1.5035, test_f1: 0.5852
 epoch: 28, train_loss: 0.3956, test_loss: 1.3491, test_f1: 0.6037
 epoch: 29, train_loss: 0.3943, test_loss: 1.3952, test_f1: 0.6061
 epoch: 30, train_loss: 0.3805, test_loss: 1.3605, test_f1: 0.6305
 epoch: 31, train_loss: 0.3832, test_loss: 1.7612, test_f1: 0.6222
 epoch: 32, train_loss: 0.4603, test_loss: 1.6593, test_f1: 0.5557
 epoch: 33, train_loss: 0.4015, test_loss: 1.8458, test_f1: 0.5928
 epoch: 34, train_loss: 0.3679, test_loss: 1.6267, test_f1: 0.5918
 epoch: 35, train_loss: 0.3862, test_loss: 1.5981, test_f1: 0.5972
 epoch: 36, train_loss: 0.3433, test_loss: 1.7056, test_f1: 0.5834
 epoch: 37, train_loss: 0.3570, test_loss: 1.6975, test_f1: 0.6164
 epoch: 38, train_loss: 0.3293, test_loss: 1.5199, test_f1: 0.6283
 epoch: 39, train_loss: 0.3142, test_loss: 1.5334, test_f1: 0.6624
 epoch: 40, train_loss: 0.3114, test_loss: 1.7857, test_f1: 0.6221
 epoch: 41, train_loss: 0.3122, test_loss: 1.7412, test_f1: 0.6320
 epoch: 42, train_loss: 0.3105, test_loss: 1.8463, test_f1: 0.6355
 epoch: 43, train_loss: 0.2848, test_loss: 1.6804, test_f1: 0.5863
 epoch: 44, train_loss: 0.2726, test_loss: 1.7392, test_f1: 0.6007
 epoch: 45, train_loss: 0.2668, test_loss: 1.9787, test_f1: 0.6232
 epoch: 46, train_loss: 0.2962, test_loss: 1.8084, test_f1: 0.6131
 epoch: 47, train_loss: 0.2684, test_loss: 1.8414, test_f1: 0.6089
 epoch: 48, train_loss: 0.2430, test_loss: 1.9151, test_f1: 0.6033
 epoch: 49, train_loss: 0.2380, test_loss: 1.9921, test_f1: 0.6106
 epoch: 50, train_loss: 0.2688, test_loss: 1.7719, test_f1: 0.6075
 epoch: 51, train_loss: 0.2622, test_loss: 1.9269, test_f1: 0.5966
 epoch: 52, train_loss: 0.2019, test_loss: 2.0930, test_f1: 0.5940
 epoch: 53, train_loss: 0.2083, test_loss: 1.9822, test_f1: 0.6154
 epoch: 54, train_loss: 0.1880, test_loss: 1.9200, test_f1: 0.6180
 epoch: 55, train_loss: 0.1688, test_loss: 2.0051, test_f1: 0.6044
 epoch: 56, train_loss: 0.1671, test_loss: 1.9907, test_f1: 0.6061
 epoch: 57, train_loss: 0.1339, test_loss: 2.1089, test_f1: 0.5998
 epoch: 58, train_loss: 0.1500, test_loss: 2.1266, test_f1: 0.5946
 epoch: 59, train_loss: 0.1552, test_loss: 2.0743, test_f1: 0.5949
 epoch: 60, train_loss: 0.1424, test_loss: 2.0971, test_f1: 0.5808
 epoch: 61, train_loss: 0.1430, test_loss: 2.4193, test_f1: 0.5717
 epoch: 62, train_loss: 0.2081, test_loss: 2.1875, test_f1: 0.6098
 epoch: 63, train_loss: 0.1708, test_loss: 2.2252, test_f1: 0.5955
 epoch: 64, train_loss: 0.1834, test_loss: 2.2048, test_f1: 0.6064
 epoch: 65, train_loss: 0.1543, test_loss: 2.3514, test_f1: 0.5795
 epoch: 66, train_loss: 0.1469, test_loss: 2.1913, test_f1: 0.6010
 epoch: 67, train_loss: 0.1268, test_loss: 2.3519, test_f1: 0.5790
 epoch: 68, train_loss: 0.1202, test_loss: 2.2976, test_f1: 0.5777
 epoch: 69, train_loss: 0.1198, test_loss: 2.2230, test_f1: 0.5929
 epoch: 70, train_loss: 0.1088, test_loss: 2.4425, test_f1: 0.5940
 epoch: 71, train_loss: 0.0969, test_loss: 2.4371, test_f1: 0.5840
 epoch: 72, train_loss: 0.1104, test_loss: 2.4673, test_f1: 0.5960
 epoch: 73, train_loss: 0.1392, test_loss: 2.5139, test_f1: 0.5959
 epoch: 74, train_loss: 0.1280, test_loss: 2.4029, test_f1: 0.5948
 epoch: 75, train_loss: 0.1278, test_loss: 2.4166, test_f1: 0.6162
 epoch: 76, train_loss: 0.1086, test_loss: 2.3693, test_f1: 0.6072
 epoch: 77, train_loss: 0.1223, test_loss: 2.4305, test_f1: 0.5884
 epoch: 78, train_loss: 0.1218, test_loss: 2.4769, test_f1: 0.6063
 epoch: 79, train_loss: 0.1267, test_loss: 2.4085, test_f1: 0.6064
 epoch: 80, train_loss: 0.1423, test_loss: 2.2319, test_f1: 0.6299
 epoch: 81, train_loss: 0.1132, test_loss: 2.4990, test_f1: 0.6005
 epoch: 82, train_loss: 0.1100, test_loss: 2.4273, test_f1: 0.5866
 epoch: 83, train_loss: 0.1157, test_loss: 2.4119, test_f1: 0.5972
 epoch: 84, train_loss: 0.0801, test_loss: 2.5969, test_f1: 0.6102
 epoch: 85, train_loss: 0.0997, test_loss: 2.6083, test_f1: 0.6189
 epoch: 86, train_loss: 0.1244, test_loss: 2.6190, test_f1: 0.6060
 epoch: 87, train_loss: 0.0931, test_loss: 2.5197, test_f1: 0.6194
 epoch: 88, train_loss: 0.0989, test_loss: 2.6173, test_f1: 0.5970
 epoch: 89, train_loss: 0.0851, test_loss: 2.4746, test_f1: 0.5895
 epoch: 90, train_loss: 0.1039, test_loss: 2.6138, test_f1: 0.5906
 epoch: 91, train_loss: 0.1181, test_loss: 2.5112, test_f1: 0.5941
 epoch: 92, train_loss: 0.0786, test_loss: 2.5465, test_f1: 0.6340
 epoch: 93, train_loss: 0.0848, test_loss: 2.6139, test_f1: 0.6189
 epoch: 94, train_loss: 0.0707, test_loss: 2.6324, test_f1: 0.6067
 epoch: 95, train_loss: 0.0728, test_loss: 2.7564, test_f1: 0.6411
 epoch: 96, train_loss: 0.1066, test_loss: 2.7793, test_f1: 0.6098
 epoch: 97, train_loss: 0.1080, test_loss: 2.6787, test_f1: 0.6234
 epoch: 98, train_loss: 0.1446, test_loss: 2.6164, test_f1: 0.5980
 epoch: 99, train_loss: 0.1091, test_loss: 2.7708, test_f1: 0.5544

Training completed in 348.93 seconds
Best F1: 0.7096 at epoch 77
Mean F1 across iterations: 0.6691  0.0174
========================FINAL RESULTS================================
FEGIN weighted F1: 0.7096  0.0174
python main.py --data ltspice_demos --representation component_pin --model FEGIN --layers 3 --hiddens 128 --batch_size 128 --lr 0.001 --emb_size 250 --epochs 100 --save_appendix component_pin_L3_H128_BS128_LR0.001_E250 --no_val
-----



STDERR:
  File "main.py", line 370, in <module>
    main()
  File "main.py", line 254, in main
    dataset = dataset_class(
  File "/home/philip/projects/ltspice_examples_code_repo/Circuit-Completion-Using-GNNs/component_classification_with_link_prediction_head/evaluation/FEGIN/kernel/circuit_datasets.py", line 15, in __init__
    self.data, self.slices = torch.load(self.processed_paths[0])
  File "/home/philip/.local/lib/python3.8/site-packages/torch/serialization.py", line 1040, in load
    warnings.warn(
  File "/usr/lib/python3.8/warnings.py", line 109, in _showwarnmsg
    sw(msg.message, msg.category, msg.filename, msg.lineno,
  File "main.py", line 47, in warn_with_traceback
    traceback.print_stack(file=log)
/home/philip/projects/ltspice_examples_code_repo/Circuit-Completion-Using-GNNs/component_classification_with_link_prediction_head/evaluation/FEGIN/kernel/circuit_datasets.py:15: FutureWarning: You are using `torch.load` with `weights_only=False` (the current default value), which uses the default pickle module implicitly. It is possible to construct malicious pickle data which will execute arbitrary code during unpickling (See https://github.com/pytorch/pytorch/blob/main/SECURITY.md#untrusted-models for more details). In a future release, the default value for `weights_only` will be flipped to `True`. This limits the functions that could be executed during unpickling. Arbitrary objects will no longer be allowed to be loaded via this mode unless they are explicitly allowlisted by the user via `torch.serialization.add_safe_globals`. We recommend you start setting `weights_only=True` for any use case where you don't have full control of the loaded file. Please open an issue on GitHub for any issues related to this experimental feature.
  self.data, self.slices = torch.load(self.processed_paths[0])
