STDOUT:
Results will be saved in /home/philip/projects/ltspice_examples_code_repo/Circuit-Completion-Using-GNNs/component_classification_with_link_prediction_head/evaluation/FEGIN/results/model_FEGIN_dataset_ltspice_examples
Command line input: python main.py --data ltspice_examples --representation component_pin --model FEGIN --layers 3 --hiddens 16 --batch_size 128 --lr 0.01 --emb_size 250 --epochs 100 --save_appendix component_pin_L3_H16_BS128_LR0.01_E250 --no_val
 is saved.
-----
ltspice_examples - FEGIN
Using 3 layers, 16 hidden units, h = 2
Loading component_pin representation dataset
ENTERED
Training FEGIN on component_pin representation
Train: 3560, Test: 848
##################ITERATION #0 ****************************************
 epoch: 0, train_loss: 1.2622, test_loss: 1.1953, test_f1: 0.2260
 epoch: 1, train_loss: 1.1105, test_loss: 1.0455, test_f1: 0.4159
 epoch: 2, train_loss: 1.0327, test_loss: 1.0420, test_f1: 0.4181
 epoch: 3, train_loss: 1.0122, test_loss: 1.0538, test_f1: 0.4474
 epoch: 4, train_loss: 1.0094, test_loss: 1.0072, test_f1: 0.4440
 epoch: 5, train_loss: 0.9925, test_loss: 1.0006, test_f1: 0.4021
 epoch: 6, train_loss: 0.9754, test_loss: 0.9786, test_f1: 0.4848
 epoch: 7, train_loss: 0.9673, test_loss: 1.1130, test_f1: 0.4346
 epoch: 8, train_loss: 0.9393, test_loss: 0.9307, test_f1: 0.5033
 epoch: 9, train_loss: 0.9228, test_loss: 0.9823, test_f1: 0.4785
 epoch: 10, train_loss: 0.9046, test_loss: 0.9500, test_f1: 0.4861
 epoch: 11, train_loss: 0.8984, test_loss: 0.9490, test_f1: 0.5164
 epoch: 12, train_loss: 0.8896, test_loss: 0.9278, test_f1: 0.4857
 epoch: 13, train_loss: 0.8874, test_loss: 0.8665, test_f1: 0.5141
 epoch: 14, train_loss: 0.8740, test_loss: 0.9004, test_f1: 0.4914
 epoch: 15, train_loss: 0.8846, test_loss: 0.8629, test_f1: 0.4883
 epoch: 16, train_loss: 0.8678, test_loss: 0.9301, test_f1: 0.5148
 epoch: 17, train_loss: 0.8541, test_loss: 0.8441, test_f1: 0.5479
 epoch: 18, train_loss: 0.8523, test_loss: 0.8433, test_f1: 0.5413
 epoch: 19, train_loss: 0.8481, test_loss: 0.8458, test_f1: 0.5217
 epoch: 20, train_loss: 0.8348, test_loss: 0.8442, test_f1: 0.5123
 epoch: 21, train_loss: 0.8187, test_loss: 1.0089, test_f1: 0.4879
 epoch: 22, train_loss: 0.8209, test_loss: 0.8404, test_f1: 0.5252
 epoch: 23, train_loss: 0.8228, test_loss: 0.8432, test_f1: 0.5254
 epoch: 24, train_loss: 0.8097, test_loss: 0.9262, test_f1: 0.5414
 epoch: 25, train_loss: 0.8021, test_loss: 0.8792, test_f1: 0.5253
 epoch: 26, train_loss: 0.8137, test_loss: 0.9210, test_f1: 0.5088
 epoch: 27, train_loss: 0.8056, test_loss: 1.0608, test_f1: 0.4809
 epoch: 28, train_loss: 0.8241, test_loss: 0.8371, test_f1: 0.5407
 epoch: 29, train_loss: 0.7987, test_loss: 0.8473, test_f1: 0.5304
 epoch: 30, train_loss: 0.7982, test_loss: 0.8252, test_f1: 0.5619
 epoch: 31, train_loss: 0.7936, test_loss: 0.8618, test_f1: 0.5445
 epoch: 32, train_loss: 0.7950, test_loss: 0.9376, test_f1: 0.5280
 epoch: 33, train_loss: 0.7870, test_loss: 0.9640, test_f1: 0.4906
 epoch: 34, train_loss: 0.7714, test_loss: 0.8228, test_f1: 0.5335
 epoch: 35, train_loss: 0.7712, test_loss: 0.8891, test_f1: 0.5353
 epoch: 36, train_loss: 0.7788, test_loss: 0.8850, test_f1: 0.5089
 epoch: 37, train_loss: 0.7868, test_loss: 0.8705, test_f1: 0.5184
 epoch: 38, train_loss: 0.7654, test_loss: 0.8406, test_f1: 0.5443
 epoch: 39, train_loss: 0.7781, test_loss: 0.8405, test_f1: 0.5560
 epoch: 40, train_loss: 0.7589, test_loss: 0.8858, test_f1: 0.5143
 epoch: 41, train_loss: 0.7777, test_loss: 0.8419, test_f1: 0.5335
 epoch: 42, train_loss: 0.7775, test_loss: 0.7620, test_f1: 0.5744
 epoch: 43, train_loss: 0.7472, test_loss: 0.8491, test_f1: 0.5588
 epoch: 44, train_loss: 0.7651, test_loss: 0.8180, test_f1: 0.5501
 epoch: 45, train_loss: 0.7564, test_loss: 0.8003, test_f1: 0.5854
 epoch: 46, train_loss: 0.7584, test_loss: 0.8386, test_f1: 0.5945
 epoch: 47, train_loss: 0.7472, test_loss: 0.8308, test_f1: 0.5779
 epoch: 48, train_loss: 0.7683, test_loss: 0.8152, test_f1: 0.5442
 epoch: 49, train_loss: 0.7607, test_loss: 0.9056, test_f1: 0.5215
 epoch: 50, train_loss: 0.7748, test_loss: 0.8442, test_f1: 0.5530
 epoch: 51, train_loss: 0.7398, test_loss: 0.7933, test_f1: 0.5610
 epoch: 52, train_loss: 0.7318, test_loss: 0.8102, test_f1: 0.5610
 epoch: 53, train_loss: 0.7175, test_loss: 0.8201, test_f1: 0.5684
 epoch: 54, train_loss: 0.7097, test_loss: 0.8060, test_f1: 0.5904
 epoch: 55, train_loss: 0.7087, test_loss: 0.7891, test_f1: 0.5902
 epoch: 56, train_loss: 0.7135, test_loss: 0.8577, test_f1: 0.5747
 epoch: 57, train_loss: 0.6981, test_loss: 0.7898, test_f1: 0.5742
 epoch: 58, train_loss: 0.7288, test_loss: 0.8097, test_f1: 0.5725
 epoch: 59, train_loss: 0.7149, test_loss: 0.7946, test_f1: 0.5847
 epoch: 60, train_loss: 0.7010, test_loss: 0.8064, test_f1: 0.5883
 epoch: 61, train_loss: 0.7013, test_loss: 0.8256, test_f1: 0.5744
 epoch: 62, train_loss: 0.6942, test_loss: 0.8096, test_f1: 0.5790
 epoch: 63, train_loss: 0.6953, test_loss: 0.8030, test_f1: 0.5818
 epoch: 64, train_loss: 0.7002, test_loss: 0.8034, test_f1: 0.5961
 epoch: 65, train_loss: 0.6992, test_loss: 0.7965, test_f1: 0.5653
 epoch: 66, train_loss: 0.6893, test_loss: 0.8163, test_f1: 0.6073
 epoch: 67, train_loss: 0.7071, test_loss: 0.8409, test_f1: 0.5977
 epoch: 68, train_loss: 0.6999, test_loss: 0.7993, test_f1: 0.5969
 epoch: 69, train_loss: 0.6890, test_loss: 0.8120, test_f1: 0.5582
 epoch: 70, train_loss: 0.6897, test_loss: 0.8487, test_f1: 0.5826
 epoch: 71, train_loss: 0.7002, test_loss: 0.8203, test_f1: 0.5986
 epoch: 72, train_loss: 0.6834, test_loss: 0.8610, test_f1: 0.5467
 epoch: 73, train_loss: 0.6829, test_loss: 0.8408, test_f1: 0.6005
 epoch: 74, train_loss: 0.6907, test_loss: 0.8487, test_f1: 0.5525
 epoch: 75, train_loss: 0.6956, test_loss: 0.7569, test_f1: 0.6023
 epoch: 76, train_loss: 0.6923, test_loss: 0.8321, test_f1: 0.5906
 epoch: 77, train_loss: 0.6909, test_loss: 0.8094, test_f1: 0.5752
 epoch: 78, train_loss: 0.6886, test_loss: 0.7945, test_f1: 0.5997
 epoch: 79, train_loss: 0.6717, test_loss: 0.8630, test_f1: 0.5695
 epoch: 80, train_loss: 0.7019, test_loss: 0.8426, test_f1: 0.5641
 epoch: 81, train_loss: 0.6819, test_loss: 0.8142, test_f1: 0.5795
 epoch: 82, train_loss: 0.6798, test_loss: 0.8242, test_f1: 0.5969
 epoch: 83, train_loss: 0.6873, test_loss: 0.8747, test_f1: 0.5489
 epoch: 84, train_loss: 0.6685, test_loss: 0.8085, test_f1: 0.5731
 epoch: 85, train_loss: 0.6758, test_loss: 0.7863, test_f1: 0.6126
 epoch: 86, train_loss: 0.6755, test_loss: 0.7813, test_f1: 0.6180
 epoch: 87, train_loss: 0.6793, test_loss: 0.7869, test_f1: 0.5881
 epoch: 88, train_loss: 0.6859, test_loss: 0.7944, test_f1: 0.5913
 epoch: 89, train_loss: 0.6820, test_loss: 0.8298, test_f1: 0.6049
 epoch: 90, train_loss: 0.6812, test_loss: 0.7570, test_f1: 0.5934
 epoch: 91, train_loss: 0.6704, test_loss: 0.7876, test_f1: 0.6004
 epoch: 92, train_loss: 0.6662, test_loss: 0.8601, test_f1: 0.5749
 epoch: 93, train_loss: 0.6730, test_loss: 0.7932, test_f1: 0.5842
 epoch: 94, train_loss: 0.6585, test_loss: 0.8176, test_f1: 0.5942
 epoch: 95, train_loss: 0.6749, test_loss: 0.8201, test_f1: 0.5696
 epoch: 96, train_loss: 0.6745, test_loss: 0.7668, test_f1: 0.5667
 epoch: 97, train_loss: 0.6615, test_loss: 0.8008, test_f1: 0.6176
 epoch: 98, train_loss: 0.6664, test_loss: 0.8527, test_f1: 0.5802
 epoch: 99, train_loss: 0.6739, test_loss: 0.9014, test_f1: 0.5220
##################ITERATION #1 ****************************************
 epoch: 0, train_loss: 1.1846, test_loss: 1.4451, test_f1: 0.2260
 epoch: 1, train_loss: 1.0540, test_loss: 1.0851, test_f1: 0.3490
 epoch: 2, train_loss: 1.0129, test_loss: 0.9987, test_f1: 0.3569
 epoch: 3, train_loss: 0.9876, test_loss: 1.2645, test_f1: 0.3753
 epoch: 4, train_loss: 0.9735, test_loss: 1.0269, test_f1: 0.4103
 epoch: 5, train_loss: 0.9457, test_loss: 0.9486, test_f1: 0.4454
 epoch: 6, train_loss: 0.9135, test_loss: 0.9242, test_f1: 0.5019
 epoch: 7, train_loss: 0.8920, test_loss: 1.0463, test_f1: 0.4453
 epoch: 8, train_loss: 0.8954, test_loss: 0.9835, test_f1: 0.4466
 epoch: 9, train_loss: 0.8738, test_loss: 1.4394, test_f1: 0.3602
 epoch: 10, train_loss: 0.8910, test_loss: 0.9264, test_f1: 0.5094
 epoch: 11, train_loss: 0.8672, test_loss: 0.8530, test_f1: 0.5211
 epoch: 12, train_loss: 0.8486, test_loss: 0.8824, test_f1: 0.5251
 epoch: 13, train_loss: 0.8376, test_loss: 0.8612, test_f1: 0.5231
 epoch: 14, train_loss: 0.8345, test_loss: 0.8236, test_f1: 0.5417
 epoch: 15, train_loss: 0.8277, test_loss: 0.8591, test_f1: 0.4909
 epoch: 16, train_loss: 0.8223, test_loss: 0.8101, test_f1: 0.5488
 epoch: 17, train_loss: 0.8188, test_loss: 0.9575, test_f1: 0.5063
 epoch: 18, train_loss: 0.8213, test_loss: 0.8606, test_f1: 0.5396
 epoch: 19, train_loss: 0.8166, test_loss: 0.8056, test_f1: 0.5437
 epoch: 20, train_loss: 0.8118, test_loss: 0.8740, test_f1: 0.5183
 epoch: 21, train_loss: 0.7975, test_loss: 0.8921, test_f1: 0.5101
 epoch: 22, train_loss: 0.8248, test_loss: 0.8341, test_f1: 0.5194
 epoch: 23, train_loss: 0.8168, test_loss: 0.9423, test_f1: 0.4726
 epoch: 24, train_loss: 0.7941, test_loss: 0.8511, test_f1: 0.5445
 epoch: 25, train_loss: 0.8048, test_loss: 0.9200, test_f1: 0.5180
 epoch: 26, train_loss: 0.7837, test_loss: 0.8904, test_f1: 0.5005
 epoch: 27, train_loss: 0.7682, test_loss: 0.8161, test_f1: 0.5606
 epoch: 28, train_loss: 0.7669, test_loss: 0.8086, test_f1: 0.5476
 epoch: 29, train_loss: 0.7718, test_loss: 0.8559, test_f1: 0.5390
 epoch: 30, train_loss: 0.7671, test_loss: 0.8097, test_f1: 0.5818
 epoch: 31, train_loss: 0.7750, test_loss: 0.8185, test_f1: 0.5364
 epoch: 32, train_loss: 0.7543, test_loss: 0.8227, test_f1: 0.5347
 epoch: 33, train_loss: 0.7643, test_loss: 0.8126, test_f1: 0.5576
 epoch: 34, train_loss: 0.7477, test_loss: 0.8431, test_f1: 0.5801
 epoch: 35, train_loss: 0.7481, test_loss: 0.8616, test_f1: 0.5333
 epoch: 36, train_loss: 0.7490, test_loss: 1.0542, test_f1: 0.4995
 epoch: 37, train_loss: 0.7459, test_loss: 0.8184, test_f1: 0.5607
 epoch: 38, train_loss: 0.7533, test_loss: 0.8481, test_f1: 0.5498
 epoch: 39, train_loss: 0.7388, test_loss: 0.8772, test_f1: 0.5501
 epoch: 40, train_loss: 0.7481, test_loss: 0.9748, test_f1: 0.5190
 epoch: 41, train_loss: 0.7417, test_loss: 0.9416, test_f1: 0.5185
 epoch: 42, train_loss: 0.7397, test_loss: 0.8003, test_f1: 0.5729
 epoch: 43, train_loss: 0.7428, test_loss: 0.8201, test_f1: 0.5838
 epoch: 44, train_loss: 0.7271, test_loss: 0.8262, test_f1: 0.5975
 epoch: 45, train_loss: 0.7456, test_loss: 0.8349, test_f1: 0.5642
 epoch: 46, train_loss: 0.7342, test_loss: 0.8170, test_f1: 0.5436
 epoch: 47, train_loss: 0.7437, test_loss: 0.8004, test_f1: 0.5769
 epoch: 48, train_loss: 0.7236, test_loss: 0.8610, test_f1: 0.5720
 epoch: 49, train_loss: 0.7233, test_loss: 0.8109, test_f1: 0.5611
 epoch: 50, train_loss: 0.7065, test_loss: 0.8306, test_f1: 0.5453
 epoch: 51, train_loss: 0.6950, test_loss: 0.8085, test_f1: 0.6096
 epoch: 52, train_loss: 0.6964, test_loss: 0.8008, test_f1: 0.5494
 epoch: 53, train_loss: 0.6916, test_loss: 0.8059, test_f1: 0.5705
 epoch: 54, train_loss: 0.6820, test_loss: 0.8111, test_f1: 0.5916
 epoch: 55, train_loss: 0.6893, test_loss: 0.8586, test_f1: 0.5577
 epoch: 56, train_loss: 0.6875, test_loss: 0.8177, test_f1: 0.5736
 epoch: 57, train_loss: 0.6796, test_loss: 0.8141, test_f1: 0.6031
 epoch: 58, train_loss: 0.6572, test_loss: 0.8055, test_f1: 0.5715
 epoch: 59, train_loss: 0.6599, test_loss: 0.8199, test_f1: 0.5727
 epoch: 60, train_loss: 0.6839, test_loss: 0.8048, test_f1: 0.5814
 epoch: 61, train_loss: 0.6672, test_loss: 0.8347, test_f1: 0.5764
 epoch: 62, train_loss: 0.6754, test_loss: 0.7988, test_f1: 0.6229
 epoch: 63, train_loss: 0.6717, test_loss: 0.8265, test_f1: 0.6272
 epoch: 64, train_loss: 0.6726, test_loss: 0.8126, test_f1: 0.5958
 epoch: 65, train_loss: 0.6778, test_loss: 0.7940, test_f1: 0.6348
 epoch: 66, train_loss: 0.6774, test_loss: 0.8111, test_f1: 0.5750
 epoch: 67, train_loss: 0.6644, test_loss: 0.8705, test_f1: 0.6015
 epoch: 68, train_loss: 0.6640, test_loss: 0.8441, test_f1: 0.5950
 epoch: 69, train_loss: 0.6629, test_loss: 0.8035, test_f1: 0.6180
 epoch: 70, train_loss: 0.6553, test_loss: 0.8062, test_f1: 0.6230
 epoch: 71, train_loss: 0.6501, test_loss: 0.8204, test_f1: 0.5925
 epoch: 72, train_loss: 0.6514, test_loss: 0.7875, test_f1: 0.5983
 epoch: 73, train_loss: 0.6548, test_loss: 0.7938, test_f1: 0.6242
 epoch: 74, train_loss: 0.6637, test_loss: 0.8190, test_f1: 0.5879
 epoch: 75, train_loss: 0.6457, test_loss: 0.8630, test_f1: 0.5957
 epoch: 76, train_loss: 0.6371, test_loss: 0.8216, test_f1: 0.5710
 epoch: 77, train_loss: 0.6498, test_loss: 0.8471, test_f1: 0.5716
 epoch: 78, train_loss: 0.6551, test_loss: 0.8220, test_f1: 0.6049
 epoch: 79, train_loss: 0.6455, test_loss: 0.8008, test_f1: 0.6156
 epoch: 80, train_loss: 0.6371, test_loss: 0.7924, test_f1: 0.5840
 epoch: 81, train_loss: 0.6448, test_loss: 0.7934, test_f1: 0.6043
 epoch: 82, train_loss: 0.6335, test_loss: 0.9694, test_f1: 0.5973
 epoch: 83, train_loss: 0.6349, test_loss: 0.8183, test_f1: 0.5881
 epoch: 84, train_loss: 0.6326, test_loss: 0.8637, test_f1: 0.5650
 epoch: 85, train_loss: 0.6548, test_loss: 0.9187, test_f1: 0.5828
 epoch: 86, train_loss: 0.6441, test_loss: 0.8694, test_f1: 0.6097
 epoch: 87, train_loss: 0.6235, test_loss: 0.8609, test_f1: 0.5909
 epoch: 88, train_loss: 0.6403, test_loss: 0.8522, test_f1: 0.5791
 epoch: 89, train_loss: 0.6379, test_loss: 0.9327, test_f1: 0.5736
 epoch: 90, train_loss: 0.6314, test_loss: 0.8166, test_f1: 0.6083
 epoch: 91, train_loss: 0.6265, test_loss: 0.8854, test_f1: 0.6057
 epoch: 92, train_loss: 0.6311, test_loss: 0.8212, test_f1: 0.5835
 epoch: 93, train_loss: 0.6475, test_loss: 0.8331, test_f1: 0.6201
 epoch: 94, train_loss: 0.6391, test_loss: 0.8729, test_f1: 0.5737
 epoch: 95, train_loss: 0.6347, test_loss: 0.8517, test_f1: 0.5841
 epoch: 96, train_loss: 0.6403, test_loss: 0.8886, test_f1: 0.5894
 epoch: 97, train_loss: 0.6382, test_loss: 0.8336, test_f1: 0.5976
 epoch: 98, train_loss: 0.6373, test_loss: 0.8681, test_f1: 0.5805
 epoch: 99, train_loss: 0.6333, test_loss: 0.8957, test_f1: 0.6087
##################ITERATION #2 ****************************************
 epoch: 0, train_loss: 1.1788, test_loss: 1.1664, test_f1: 0.3306
 epoch: 1, train_loss: 1.0525, test_loss: 1.0896, test_f1: 0.4669
 epoch: 2, train_loss: 1.0224, test_loss: 1.0726, test_f1: 0.4431
 epoch: 3, train_loss: 0.9866, test_loss: 1.0084, test_f1: 0.4218
 epoch: 4, train_loss: 0.9903, test_loss: 0.9940, test_f1: 0.4685
 epoch: 5, train_loss: 0.9742, test_loss: 1.0522, test_f1: 0.4317
 epoch: 6, train_loss: 0.9448, test_loss: 1.0047, test_f1: 0.5620
 epoch: 7, train_loss: 0.9594, test_loss: 1.0725, test_f1: 0.4443
 epoch: 8, train_loss: 0.9438, test_loss: 1.0028, test_f1: 0.4833
 epoch: 9, train_loss: 0.9080, test_loss: 0.9383, test_f1: 0.5312
 epoch: 10, train_loss: 0.9147, test_loss: 1.0493, test_f1: 0.4626
 epoch: 11, train_loss: 0.9124, test_loss: 0.9604, test_f1: 0.5113
 epoch: 12, train_loss: 0.9335, test_loss: 0.9363, test_f1: 0.4933
 epoch: 13, train_loss: 0.9082, test_loss: 1.0580, test_f1: 0.4258
 epoch: 14, train_loss: 0.8910, test_loss: 1.0804, test_f1: 0.4653
 epoch: 15, train_loss: 0.8797, test_loss: 1.0605, test_f1: 0.4363
 epoch: 16, train_loss: 0.8890, test_loss: 1.0704, test_f1: 0.5029
 epoch: 17, train_loss: 0.8761, test_loss: 1.0232, test_f1: 0.4631
 epoch: 18, train_loss: 0.8787, test_loss: 0.9765, test_f1: 0.5118
 epoch: 19, train_loss: 0.8554, test_loss: 0.9263, test_f1: 0.5432
 epoch: 20, train_loss: 0.8664, test_loss: 0.9670, test_f1: 0.4872
 epoch: 21, train_loss: 0.8535, test_loss: 1.0588, test_f1: 0.4771
 epoch: 22, train_loss: 0.8459, test_loss: 0.9218, test_f1: 0.5423
 epoch: 23, train_loss: 0.8334, test_loss: 1.0430, test_f1: 0.4661
 epoch: 24, train_loss: 0.8300, test_loss: 0.9141, test_f1: 0.5353
 epoch: 25, train_loss: 0.8421, test_loss: 1.0120, test_f1: 0.4952
 epoch: 26, train_loss: 0.8449, test_loss: 1.0278, test_f1: 0.4725
 epoch: 27, train_loss: 0.8243, test_loss: 0.9522, test_f1: 0.5311
 epoch: 28, train_loss: 0.8255, test_loss: 1.0941, test_f1: 0.5032
 epoch: 29, train_loss: 0.8288, test_loss: 0.9010, test_f1: 0.5121
 epoch: 30, train_loss: 0.8357, test_loss: 1.1027, test_f1: 0.4506
 epoch: 31, train_loss: 0.7957, test_loss: 0.8966, test_f1: 0.5371
 epoch: 32, train_loss: 0.8059, test_loss: 1.0840, test_f1: 0.4616
 epoch: 33, train_loss: 0.8238, test_loss: 0.9559, test_f1: 0.4834
 epoch: 34, train_loss: 0.7974, test_loss: 0.9305, test_f1: 0.5429
 epoch: 35, train_loss: 0.7930, test_loss: 1.0859, test_f1: 0.4641
 epoch: 36, train_loss: 0.8094, test_loss: 0.9733, test_f1: 0.5201
 epoch: 37, train_loss: 0.8082, test_loss: 0.9855, test_f1: 0.5118
 epoch: 38, train_loss: 0.8043, test_loss: 0.8914, test_f1: 0.5942
 epoch: 39, train_loss: 0.7983, test_loss: 0.9159, test_f1: 0.5453
 epoch: 40, train_loss: 0.7854, test_loss: 0.9602, test_f1: 0.5277
 epoch: 41, train_loss: 0.7823, test_loss: 1.5564, test_f1: 0.3879
 epoch: 42, train_loss: 0.7867, test_loss: 0.9894, test_f1: 0.5451
 epoch: 43, train_loss: 0.8022, test_loss: 1.0844, test_f1: 0.4888
 epoch: 44, train_loss: 0.7933, test_loss: 0.9143, test_f1: 0.5339
 epoch: 45, train_loss: 0.7824, test_loss: 0.9051, test_f1: 0.5386
 epoch: 46, train_loss: 0.7911, test_loss: 0.9010, test_f1: 0.5467
 epoch: 47, train_loss: 0.7714, test_loss: 0.9759, test_f1: 0.5251
 epoch: 48, train_loss: 0.7853, test_loss: 0.8864, test_f1: 0.5880
 epoch: 49, train_loss: 0.7982, test_loss: 0.8610, test_f1: 0.5434
 epoch: 50, train_loss: 0.7725, test_loss: 0.9231, test_f1: 0.5154
 epoch: 51, train_loss: 0.7579, test_loss: 0.9270, test_f1: 0.5129
 epoch: 52, train_loss: 0.7462, test_loss: 0.9031, test_f1: 0.5547
 epoch: 53, train_loss: 0.7398, test_loss: 0.9030, test_f1: 0.5742
 epoch: 54, train_loss: 0.7343, test_loss: 0.9077, test_f1: 0.5537
 epoch: 55, train_loss: 0.7141, test_loss: 0.9760, test_f1: 0.5327
 epoch: 56, train_loss: 0.7327, test_loss: 1.0020, test_f1: 0.5055
 epoch: 57, train_loss: 0.7238, test_loss: 0.9698, test_f1: 0.5423
 epoch: 58, train_loss: 0.7384, test_loss: 0.9399, test_f1: 0.5662
 epoch: 59, train_loss: 0.7264, test_loss: 1.0262, test_f1: 0.5485
 epoch: 60, train_loss: 0.7169, test_loss: 0.9637, test_f1: 0.5436
 epoch: 61, train_loss: 0.7115, test_loss: 0.9123, test_f1: 0.5627
 epoch: 62, train_loss: 0.7153, test_loss: 0.9607, test_f1: 0.5981
 epoch: 63, train_loss: 0.7178, test_loss: 1.0587, test_f1: 0.5026
 epoch: 64, train_loss: 0.7180, test_loss: 0.9414, test_f1: 0.5077
 epoch: 65, train_loss: 0.7267, test_loss: 0.9705, test_f1: 0.5562
 epoch: 66, train_loss: 0.6995, test_loss: 0.9473, test_f1: 0.5860
 epoch: 67, train_loss: 0.7018, test_loss: 0.9149, test_f1: 0.6196
 epoch: 68, train_loss: 0.7124, test_loss: 0.8960, test_f1: 0.5821
 epoch: 69, train_loss: 0.7021, test_loss: 0.8802, test_f1: 0.5932
 epoch: 70, train_loss: 0.7088, test_loss: 0.9375, test_f1: 0.5902
 epoch: 71, train_loss: 0.7107, test_loss: 0.8634, test_f1: 0.5776
 epoch: 72, train_loss: 0.6997, test_loss: 0.9080, test_f1: 0.5613
 epoch: 73, train_loss: 0.7090, test_loss: 0.9795, test_f1: 0.5724
 epoch: 74, train_loss: 0.7036, test_loss: 0.8795, test_f1: 0.6144
 epoch: 75, train_loss: 0.6987, test_loss: 1.0640, test_f1: 0.5000
 epoch: 76, train_loss: 0.6927, test_loss: 1.0013, test_f1: 0.5569
 epoch: 77, train_loss: 0.6995, test_loss: 0.9217, test_f1: 0.6095
 epoch: 78, train_loss: 0.6957, test_loss: 0.9191, test_f1: 0.5822
 epoch: 79, train_loss: 0.7022, test_loss: 0.9046, test_f1: 0.6047
 epoch: 80, train_loss: 0.6922, test_loss: 1.1499, test_f1: 0.5030
 epoch: 81, train_loss: 0.6947, test_loss: 0.9410, test_f1: 0.5983
 epoch: 82, train_loss: 0.6927, test_loss: 0.9389, test_f1: 0.5807
 epoch: 83, train_loss: 0.6912, test_loss: 1.0248, test_f1: 0.5651
 epoch: 84, train_loss: 0.6790, test_loss: 0.9246, test_f1: 0.5834
 epoch: 85, train_loss: 0.7000, test_loss: 0.9195, test_f1: 0.5978
 epoch: 86, train_loss: 0.6759, test_loss: 0.9376, test_f1: 0.6073
 epoch: 87, train_loss: 0.6807, test_loss: 0.9040, test_f1: 0.5982
 epoch: 88, train_loss: 0.6688, test_loss: 0.9330, test_f1: 0.6167
 epoch: 89, train_loss: 0.6704, test_loss: 0.9077, test_f1: 0.6221
 epoch: 90, train_loss: 0.6793, test_loss: 0.9221, test_f1: 0.6148
 epoch: 91, train_loss: 0.6771, test_loss: 0.9289, test_f1: 0.6011
 epoch: 92, train_loss: 0.6737, test_loss: 0.9137, test_f1: 0.6099
 epoch: 93, train_loss: 0.6688, test_loss: 0.9522, test_f1: 0.5875
 epoch: 94, train_loss: 0.6720, test_loss: 0.9818, test_f1: 0.6064
 epoch: 95, train_loss: 0.6683, test_loss: 0.8954, test_f1: 0.6074
 epoch: 96, train_loss: 0.6736, test_loss: 1.0034, test_f1: 0.5454
 epoch: 97, train_loss: 0.6822, test_loss: 0.9517, test_f1: 0.6093
 epoch: 98, train_loss: 0.6533, test_loss: 0.9739, test_f1: 0.5794
 epoch: 99, train_loss: 0.6705, test_loss: 0.9741, test_f1: 0.5725
##################ITERATION #3 ****************************************
 epoch: 0, train_loss: 1.1855, test_loss: 1.1227, test_f1: 0.3540
 epoch: 1, train_loss: 1.0545, test_loss: 1.0639, test_f1: 0.3907
 epoch: 2, train_loss: 1.0238, test_loss: 1.0453, test_f1: 0.4593
 epoch: 3, train_loss: 1.0029, test_loss: 1.0026, test_f1: 0.4922
 epoch: 4, train_loss: 0.9667, test_loss: 0.9294, test_f1: 0.5199
 epoch: 5, train_loss: 0.9547, test_loss: 0.9830, test_f1: 0.5364
 epoch: 6, train_loss: 0.9386, test_loss: 0.8827, test_f1: 0.5348
 epoch: 7, train_loss: 0.9174, test_loss: 0.9170, test_f1: 0.5461
 epoch: 8, train_loss: 0.9084, test_loss: 1.0052, test_f1: 0.4640
 epoch: 9, train_loss: 0.9060, test_loss: 0.9993, test_f1: 0.4709
 epoch: 10, train_loss: 0.8902, test_loss: 0.9027, test_f1: 0.5041
 epoch: 11, train_loss: 0.8764, test_loss: 0.9275, test_f1: 0.5094
 epoch: 12, train_loss: 0.8875, test_loss: 0.9025, test_f1: 0.5017
 epoch: 13, train_loss: 0.8779, test_loss: 0.8516, test_f1: 0.5286
 epoch: 14, train_loss: 0.8822, test_loss: 0.8362, test_f1: 0.5409
 epoch: 15, train_loss: 0.8667, test_loss: 0.9019, test_f1: 0.5442
 epoch: 16, train_loss: 0.8487, test_loss: 0.8688, test_f1: 0.5378
 epoch: 17, train_loss: 0.8402, test_loss: 0.8943, test_f1: 0.5229
 epoch: 18, train_loss: 0.8474, test_loss: 0.8515, test_f1: 0.5462
 epoch: 19, train_loss: 0.8402, test_loss: 0.8088, test_f1: 0.5518
 epoch: 20, train_loss: 0.8171, test_loss: 0.8802, test_f1: 0.5357
 epoch: 21, train_loss: 0.8253, test_loss: 0.8341, test_f1: 0.5674
 epoch: 22, train_loss: 0.8069, test_loss: 0.8456, test_f1: 0.5343
 epoch: 23, train_loss: 0.8133, test_loss: 0.8173, test_f1: 0.5456
 epoch: 24, train_loss: 0.8293, test_loss: 0.9234, test_f1: 0.5194
 epoch: 25, train_loss: 0.8364, test_loss: 0.8758, test_f1: 0.5092
 epoch: 26, train_loss: 0.8496, test_loss: 0.8084, test_f1: 0.5378
 epoch: 27, train_loss: 0.8148, test_loss: 0.8813, test_f1: 0.5357
 epoch: 28, train_loss: 0.8128, test_loss: 1.0207, test_f1: 0.5210
 epoch: 29, train_loss: 0.8134, test_loss: 0.8578, test_f1: 0.5433
 epoch: 30, train_loss: 0.8054, test_loss: 0.8850, test_f1: 0.5505
 epoch: 31, train_loss: 0.8235, test_loss: 0.8369, test_f1: 0.5628
 epoch: 32, train_loss: 0.7974, test_loss: 0.9403, test_f1: 0.5169
 epoch: 33, train_loss: 0.7791, test_loss: 0.8296, test_f1: 0.5703
 epoch: 34, train_loss: 0.7902, test_loss: 0.8740, test_f1: 0.5463
 epoch: 35, train_loss: 0.7727, test_loss: 1.0933, test_f1: 0.4842
 epoch: 36, train_loss: 0.7775, test_loss: 0.9409, test_f1: 0.5394
 epoch: 37, train_loss: 0.7962, test_loss: 0.8887, test_f1: 0.5208
 epoch: 38, train_loss: 0.7980, test_loss: 0.8720, test_f1: 0.5526
 epoch: 39, train_loss: 0.7802, test_loss: 0.8867, test_f1: 0.5328
 epoch: 40, train_loss: 0.7616, test_loss: 0.8856, test_f1: 0.5433
 epoch: 41, train_loss: 0.7621, test_loss: 0.8751, test_f1: 0.5271
 epoch: 42, train_loss: 0.7830, test_loss: 0.8338, test_f1: 0.5873
 epoch: 43, train_loss: 0.7686, test_loss: 0.9100, test_f1: 0.5679
 epoch: 44, train_loss: 0.7783, test_loss: 0.9704, test_f1: 0.5135
 epoch: 45, train_loss: 0.7651, test_loss: 0.8831, test_f1: 0.5643
 epoch: 46, train_loss: 0.7657, test_loss: 0.8653, test_f1: 0.5642
 epoch: 47, train_loss: 0.7735, test_loss: 0.8625, test_f1: 0.5571
 epoch: 48, train_loss: 0.7516, test_loss: 0.8792, test_f1: 0.5769
 epoch: 49, train_loss: 0.7640, test_loss: 0.9030, test_f1: 0.5039
 epoch: 50, train_loss: 0.7842, test_loss: 0.8134, test_f1: 0.5571
 epoch: 51, train_loss: 0.7364, test_loss: 0.8548, test_f1: 0.5476
 epoch: 52, train_loss: 0.7240, test_loss: 0.8522, test_f1: 0.5562
 epoch: 53, train_loss: 0.7146, test_loss: 0.8378, test_f1: 0.5853
 epoch: 54, train_loss: 0.7231, test_loss: 0.8497, test_f1: 0.5976
 epoch: 55, train_loss: 0.7134, test_loss: 0.8380, test_f1: 0.5830
 epoch: 56, train_loss: 0.7213, test_loss: 0.8459, test_f1: 0.5806
 epoch: 57, train_loss: 0.7119, test_loss: 0.8398, test_f1: 0.5854
 epoch: 58, train_loss: 0.7200, test_loss: 0.8559, test_f1: 0.5806
 epoch: 59, train_loss: 0.7058, test_loss: 0.8513, test_f1: 0.5795
 epoch: 60, train_loss: 0.7302, test_loss: 0.8457, test_f1: 0.5650
 epoch: 61, train_loss: 0.7173, test_loss: 0.8668, test_f1: 0.5716
 epoch: 62, train_loss: 0.7138, test_loss: 0.8285, test_f1: 0.5566
 epoch: 63, train_loss: 0.7069, test_loss: 0.8692, test_f1: 0.5750
 epoch: 64, train_loss: 0.7106, test_loss: 0.8494, test_f1: 0.5851
 epoch: 65, train_loss: 0.7063, test_loss: 0.8253, test_f1: 0.5726
 epoch: 66, train_loss: 0.7169, test_loss: 0.8478, test_f1: 0.5843
 epoch: 67, train_loss: 0.7027, test_loss: 0.8182, test_f1: 0.5999
 epoch: 68, train_loss: 0.6927, test_loss: 0.8798, test_f1: 0.5587
 epoch: 69, train_loss: 0.6958, test_loss: 0.8800, test_f1: 0.5666
 epoch: 70, train_loss: 0.6931, test_loss: 0.8385, test_f1: 0.5898
 epoch: 71, train_loss: 0.6993, test_loss: 0.8760, test_f1: 0.5647
 epoch: 72, train_loss: 0.6900, test_loss: 0.8515, test_f1: 0.5583
 epoch: 73, train_loss: 0.7030, test_loss: 0.8310, test_f1: 0.6050
 epoch: 74, train_loss: 0.6896, test_loss: 0.8647, test_f1: 0.6112
 epoch: 75, train_loss: 0.7095, test_loss: 0.8284, test_f1: 0.5842
 epoch: 76, train_loss: 0.6953, test_loss: 0.8320, test_f1: 0.5693
 epoch: 77, train_loss: 0.7006, test_loss: 0.8705, test_f1: 0.5922
 epoch: 78, train_loss: 0.6944, test_loss: 0.8324, test_f1: 0.6123
 epoch: 79, train_loss: 0.6859, test_loss: 0.8755, test_f1: 0.5773
 epoch: 80, train_loss: 0.6832, test_loss: 0.8499, test_f1: 0.5991
 epoch: 81, train_loss: 0.6766, test_loss: 0.8227, test_f1: 0.5925
 epoch: 82, train_loss: 0.6788, test_loss: 0.8158, test_f1: 0.5988
 epoch: 83, train_loss: 0.6799, test_loss: 0.8885, test_f1: 0.5932
 epoch: 84, train_loss: 0.6995, test_loss: 0.8448, test_f1: 0.6070
 epoch: 85, train_loss: 0.6717, test_loss: 0.8969, test_f1: 0.5941
 epoch: 86, train_loss: 0.6840, test_loss: 0.8232, test_f1: 0.6148
 epoch: 87, train_loss: 0.6892, test_loss: 0.9046, test_f1: 0.5330
 epoch: 88, train_loss: 0.6787, test_loss: 0.8652, test_f1: 0.5607
 epoch: 89, train_loss: 0.6960, test_loss: 0.8444, test_f1: 0.5839
 epoch: 90, train_loss: 0.6645, test_loss: 0.8653, test_f1: 0.5920
 epoch: 91, train_loss: 0.6685, test_loss: 0.8907, test_f1: 0.5759
 epoch: 92, train_loss: 0.6737, test_loss: 0.8427, test_f1: 0.5875
 epoch: 93, train_loss: 0.6652, test_loss: 0.8940, test_f1: 0.5665
 epoch: 94, train_loss: 0.6874, test_loss: 0.8086, test_f1: 0.5714
 epoch: 95, train_loss: 0.6705, test_loss: 0.8661, test_f1: 0.5987
 epoch: 96, train_loss: 0.6793, test_loss: 0.8842, test_f1: 0.5835
 epoch: 97, train_loss: 0.6809, test_loss: 0.8758, test_f1: 0.5744
 epoch: 98, train_loss: 0.6631, test_loss: 0.8715, test_f1: 0.6247
 epoch: 99, train_loss: 0.6641, test_loss: 0.8455, test_f1: 0.6199
##################ITERATION #4 ****************************************
 epoch: 0, train_loss: 1.1870, test_loss: 1.1092, test_f1: 0.3437
 epoch: 1, train_loss: 1.0389, test_loss: 1.0724, test_f1: 0.3352
 epoch: 2, train_loss: 1.0163, test_loss: 1.1038, test_f1: 0.4159
 epoch: 3, train_loss: 1.0006, test_loss: 1.1597, test_f1: 0.3953
 epoch: 4, train_loss: 0.9937, test_loss: 1.0523, test_f1: 0.4818
 epoch: 5, train_loss: 0.9576, test_loss: 1.1957, test_f1: 0.4234
 epoch: 6, train_loss: 0.9481, test_loss: 1.0430, test_f1: 0.4793
 epoch: 7, train_loss: 0.9275, test_loss: 1.2096, test_f1: 0.4496
 epoch: 8, train_loss: 0.9086, test_loss: 0.9913, test_f1: 0.4763
 epoch: 9, train_loss: 0.9186, test_loss: 1.0494, test_f1: 0.4765
 epoch: 10, train_loss: 0.8992, test_loss: 1.6088, test_f1: 0.3973
 epoch: 11, train_loss: 0.9208, test_loss: 0.9994, test_f1: 0.4999
 epoch: 12, train_loss: 0.8887, test_loss: 1.0322, test_f1: 0.4945
 epoch: 13, train_loss: 0.8939, test_loss: 0.9347, test_f1: 0.5234
 epoch: 14, train_loss: 0.8545, test_loss: 0.9717, test_f1: 0.5223
 epoch: 15, train_loss: 0.8639, test_loss: 1.2633, test_f1: 0.4294
 epoch: 16, train_loss: 0.8626, test_loss: 0.9611, test_f1: 0.5183
 epoch: 17, train_loss: 0.8589, test_loss: 0.8974, test_f1: 0.5352
 epoch: 18, train_loss: 0.8572, test_loss: 0.9311, test_f1: 0.5523
 epoch: 19, train_loss: 0.8460, test_loss: 0.9401, test_f1: 0.5067
 epoch: 20, train_loss: 0.8449, test_loss: 0.9252, test_f1: 0.5558
 epoch: 21, train_loss: 0.8483, test_loss: 1.0253, test_f1: 0.4968
 epoch: 22, train_loss: 0.8378, test_loss: 0.9007, test_f1: 0.5464
 epoch: 23, train_loss: 0.8282, test_loss: 0.8862, test_f1: 0.5439
 epoch: 24, train_loss: 0.8202, test_loss: 1.1143, test_f1: 0.4859
 epoch: 25, train_loss: 0.7996, test_loss: 0.8968, test_f1: 0.5460
 epoch: 26, train_loss: 0.8006, test_loss: 1.0787, test_f1: 0.4592
 epoch: 27, train_loss: 0.7992, test_loss: 0.8978, test_f1: 0.5230
 epoch: 28, train_loss: 0.7950, test_loss: 0.8952, test_f1: 0.5411
 epoch: 29, train_loss: 0.8031, test_loss: 0.9683, test_f1: 0.5167
 epoch: 30, train_loss: 0.7902, test_loss: 1.2277, test_f1: 0.4680
 epoch: 31, train_loss: 0.8032, test_loss: 1.0616, test_f1: 0.5033
 epoch: 32, train_loss: 0.7934, test_loss: 0.9655, test_f1: 0.5231
 epoch: 33, train_loss: 0.8109, test_loss: 1.0511, test_f1: 0.4937
 epoch: 34, train_loss: 0.7918, test_loss: 0.8736, test_f1: 0.5623
 epoch: 35, train_loss: 0.7832, test_loss: 0.8980, test_f1: 0.5397
 epoch: 36, train_loss: 0.7856, test_loss: 0.9127, test_f1: 0.5198
 epoch: 37, train_loss: 0.7775, test_loss: 0.9464, test_f1: 0.5526
 epoch: 38, train_loss: 0.7565, test_loss: 0.9848, test_f1: 0.5041
 epoch: 39, train_loss: 0.7783, test_loss: 0.8923, test_f1: 0.5516
 epoch: 40, train_loss: 0.7728, test_loss: 0.9211, test_f1: 0.5521
 epoch: 41, train_loss: 0.7573, test_loss: 1.1058, test_f1: 0.4667
 epoch: 42, train_loss: 0.7710, test_loss: 0.9223, test_f1: 0.5510
 epoch: 43, train_loss: 0.7712, test_loss: 1.0663, test_f1: 0.5320
 epoch: 44, train_loss: 0.7554, test_loss: 1.2674, test_f1: 0.4638
 epoch: 45, train_loss: 0.7643, test_loss: 0.9511, test_f1: 0.5282
 epoch: 46, train_loss: 0.7749, test_loss: 0.9475, test_f1: 0.5487
 epoch: 47, train_loss: 0.7525, test_loss: 0.9501, test_f1: 0.5665
 epoch: 48, train_loss: 0.7847, test_loss: 0.9303, test_f1: 0.5482
 epoch: 49, train_loss: 0.7574, test_loss: 0.9289, test_f1: 0.6155
 epoch: 50, train_loss: 0.7575, test_loss: 0.9546, test_f1: 0.5704
 epoch: 51, train_loss: 0.7354, test_loss: 0.8973, test_f1: 0.5915
 epoch: 52, train_loss: 0.7182, test_loss: 0.9564, test_f1: 0.5281
 epoch: 53, train_loss: 0.7409, test_loss: 0.9045, test_f1: 0.6050
 epoch: 54, train_loss: 0.7235, test_loss: 0.9237, test_f1: 0.5607
 epoch: 55, train_loss: 0.7064, test_loss: 0.8924, test_f1: 0.6288
 epoch: 56, train_loss: 0.7043, test_loss: 0.9344, test_f1: 0.5944
 epoch: 57, train_loss: 0.7007, test_loss: 0.9226, test_f1: 0.5925
 epoch: 58, train_loss: 0.7103, test_loss: 0.9533, test_f1: 0.5927
 epoch: 59, train_loss: 0.7134, test_loss: 0.9256, test_f1: 0.5668
 epoch: 60, train_loss: 0.7024, test_loss: 0.9365, test_f1: 0.5830
 epoch: 61, train_loss: 0.7098, test_loss: 0.9458, test_f1: 0.5950
 epoch: 62, train_loss: 0.7054, test_loss: 0.9618, test_f1: 0.5581
 epoch: 63, train_loss: 0.6956, test_loss: 0.9372, test_f1: 0.5588
 epoch: 64, train_loss: 0.6939, test_loss: 0.9738, test_f1: 0.5886
 epoch: 65, train_loss: 0.6863, test_loss: 0.9967, test_f1: 0.5647
 epoch: 66, train_loss: 0.7031, test_loss: 0.9641, test_f1: 0.5462
 epoch: 67, train_loss: 0.6884, test_loss: 0.9243, test_f1: 0.5952
 epoch: 68, train_loss: 0.7046, test_loss: 1.0000, test_f1: 0.5649
 epoch: 69, train_loss: 0.7047, test_loss: 0.9204, test_f1: 0.5903
 epoch: 70, train_loss: 0.6877, test_loss: 0.9713, test_f1: 0.6025
 epoch: 71, train_loss: 0.6864, test_loss: 0.8975, test_f1: 0.6426
 epoch: 72, train_loss: 0.7007, test_loss: 0.9871, test_f1: 0.5912
 epoch: 73, train_loss: 0.6750, test_loss: 0.9045, test_f1: 0.6171
 epoch: 74, train_loss: 0.7019, test_loss: 0.9578, test_f1: 0.5928
 epoch: 75, train_loss: 0.6880, test_loss: 0.9619, test_f1: 0.5533
 epoch: 76, train_loss: 0.7194, test_loss: 1.0361, test_f1: 0.6038
 epoch: 77, train_loss: 0.6935, test_loss: 0.9341, test_f1: 0.6492
 epoch: 78, train_loss: 0.6893, test_loss: 0.9079, test_f1: 0.6029
 epoch: 79, train_loss: 0.6947, test_loss: 0.9133, test_f1: 0.5901
 epoch: 80, train_loss: 0.6803, test_loss: 0.9160, test_f1: 0.6420
 epoch: 81, train_loss: 0.6749, test_loss: 0.9495, test_f1: 0.6244
 epoch: 82, train_loss: 0.6747, test_loss: 0.9585, test_f1: 0.6176
 epoch: 83, train_loss: 0.6905, test_loss: 0.9314, test_f1: 0.6116
 epoch: 84, train_loss: 0.6750, test_loss: 1.0745, test_f1: 0.5753
 epoch: 85, train_loss: 0.6805, test_loss: 0.9524, test_f1: 0.5513
 epoch: 86, train_loss: 0.6630, test_loss: 0.9253, test_f1: 0.6230
 epoch: 87, train_loss: 0.6675, test_loss: 1.0604, test_f1: 0.5817
 epoch: 88, train_loss: 0.6701, test_loss: 0.9641, test_f1: 0.5697
 epoch: 89, train_loss: 0.6814, test_loss: 0.9573, test_f1: 0.5969
 epoch: 90, train_loss: 0.6760, test_loss: 0.9540, test_f1: 0.5943
 epoch: 91, train_loss: 0.6780, test_loss: 1.0376, test_f1: 0.5376
 epoch: 92, train_loss: 0.6774, test_loss: 0.9412, test_f1: 0.6081
 epoch: 93, train_loss: 0.6542, test_loss: 0.9458, test_f1: 0.5903
 epoch: 94, train_loss: 0.6650, test_loss: 0.9345, test_f1: 0.5682
 epoch: 95, train_loss: 0.6573, test_loss: 0.9816, test_f1: 0.5977
 epoch: 96, train_loss: 0.6536, test_loss: 0.9189, test_f1: 0.6164
 epoch: 97, train_loss: 0.6494, test_loss: 0.9159, test_f1: 0.6410
 epoch: 98, train_loss: 0.6503, test_loss: 0.8942, test_f1: 0.6242
 epoch: 99, train_loss: 0.6575, test_loss: 1.0222, test_f1: 0.6051
##################ITERATION #5 ****************************************
 epoch: 0, train_loss: 1.1949, test_loss: 1.1681, test_f1: 0.2995
 epoch: 1, train_loss: 1.0533, test_loss: 1.0406, test_f1: 0.3830
 epoch: 2, train_loss: 1.0146, test_loss: 1.0398, test_f1: 0.4544
 epoch: 3, train_loss: 1.0054, test_loss: 1.0617, test_f1: 0.4597
 epoch: 4, train_loss: 1.0010, test_loss: 1.0403, test_f1: 0.5009
 epoch: 5, train_loss: 0.9794, test_loss: 1.0566, test_f1: 0.5010
 epoch: 6, train_loss: 0.9699, test_loss: 0.9988, test_f1: 0.5283
 epoch: 7, train_loss: 0.9442, test_loss: 0.9953, test_f1: 0.5341
 epoch: 8, train_loss: 0.9253, test_loss: 0.9869, test_f1: 0.5111
 epoch: 9, train_loss: 0.9321, test_loss: 0.9658, test_f1: 0.5171
 epoch: 10, train_loss: 0.9088, test_loss: 1.0144, test_f1: 0.5127
 epoch: 11, train_loss: 0.8996, test_loss: 1.0052, test_f1: 0.5141
 epoch: 12, train_loss: 0.9051, test_loss: 0.9376, test_f1: 0.5277
 epoch: 13, train_loss: 0.8752, test_loss: 0.9838, test_f1: 0.5131
 epoch: 14, train_loss: 0.8697, test_loss: 1.0082, test_f1: 0.5054
 epoch: 15, train_loss: 0.8566, test_loss: 0.9170, test_f1: 0.5329
 epoch: 16, train_loss: 0.8562, test_loss: 0.9451, test_f1: 0.5306
 epoch: 17, train_loss: 0.8520, test_loss: 0.9918, test_f1: 0.5497
 epoch: 18, train_loss: 0.8512, test_loss: 0.9209, test_f1: 0.5382
 epoch: 19, train_loss: 0.8333, test_loss: 0.9024, test_f1: 0.5419
 epoch: 20, train_loss: 0.8196, test_loss: 0.9640, test_f1: 0.5225
 epoch: 21, train_loss: 0.8198, test_loss: 0.9297, test_f1: 0.5409
 epoch: 22, train_loss: 0.8297, test_loss: 0.9048, test_f1: 0.5722
 epoch: 23, train_loss: 0.8137, test_loss: 0.8633, test_f1: 0.5692
 epoch: 24, train_loss: 0.8099, test_loss: 0.9043, test_f1: 0.5745
 epoch: 25, train_loss: 0.7983, test_loss: 0.8898, test_f1: 0.5495
 epoch: 26, train_loss: 0.7931, test_loss: 0.9626, test_f1: 0.5354
 epoch: 27, train_loss: 0.8028, test_loss: 0.9389, test_f1: 0.5611
 epoch: 28, train_loss: 0.7952, test_loss: 0.8910, test_f1: 0.5852
 epoch: 29, train_loss: 0.7736, test_loss: 0.8846, test_f1: 0.5996
 epoch: 30, train_loss: 0.7911, test_loss: 1.0223, test_f1: 0.5816
 epoch: 31, train_loss: 0.7825, test_loss: 0.9382, test_f1: 0.5746
 epoch: 32, train_loss: 0.7753, test_loss: 1.0020, test_f1: 0.5820
 epoch: 33, train_loss: 0.7770, test_loss: 0.9291, test_f1: 0.5420
 epoch: 34, train_loss: 0.7648, test_loss: 0.8667, test_f1: 0.5768
 epoch: 35, train_loss: 0.7646, test_loss: 0.9180, test_f1: 0.5666
 epoch: 36, train_loss: 0.7793, test_loss: 0.8623, test_f1: 0.5696
 epoch: 37, train_loss: 0.7566, test_loss: 1.1097, test_f1: 0.5410
 epoch: 38, train_loss: 0.7497, test_loss: 0.9168, test_f1: 0.6146
 epoch: 39, train_loss: 0.7642, test_loss: 0.9335, test_f1: 0.6124
 epoch: 40, train_loss: 0.7833, test_loss: 0.9676, test_f1: 0.5528
 epoch: 41, train_loss: 0.7636, test_loss: 0.9060, test_f1: 0.5923
 epoch: 42, train_loss: 0.7618, test_loss: 0.8700, test_f1: 0.5895
 epoch: 43, train_loss: 0.7685, test_loss: 0.9110, test_f1: 0.6057
 epoch: 44, train_loss: 0.7518, test_loss: 0.9170, test_f1: 0.6056
 epoch: 45, train_loss: 0.7513, test_loss: 0.9755, test_f1: 0.5625
 epoch: 46, train_loss: 0.7558, test_loss: 0.8772, test_f1: 0.5713
 epoch: 47, train_loss: 0.7478, test_loss: 0.9038, test_f1: 0.5961
 epoch: 48, train_loss: 0.7387, test_loss: 0.9033, test_f1: 0.5703
 epoch: 49, train_loss: 0.7446, test_loss: 1.1630, test_f1: 0.5318
 epoch: 50, train_loss: 0.7386, test_loss: 0.8937, test_f1: 0.5685
 epoch: 51, train_loss: 0.7076, test_loss: 0.9557, test_f1: 0.5563
 epoch: 52, train_loss: 0.7203, test_loss: 0.8950, test_f1: 0.6113
 epoch: 53, train_loss: 0.6979, test_loss: 0.8785, test_f1: 0.5903
 epoch: 54, train_loss: 0.7013, test_loss: 0.8823, test_f1: 0.5953
 epoch: 55, train_loss: 0.7051, test_loss: 0.8441, test_f1: 0.6503
 epoch: 56, train_loss: 0.7081, test_loss: 0.8557, test_f1: 0.5853
 epoch: 57, train_loss: 0.6851, test_loss: 0.9015, test_f1: 0.5921
 epoch: 58, train_loss: 0.6974, test_loss: 0.8572, test_f1: 0.6393
 epoch: 59, train_loss: 0.6838, test_loss: 0.8750, test_f1: 0.5803
 epoch: 60, train_loss: 0.6823, test_loss: 0.8410, test_f1: 0.6429
 epoch: 61, train_loss: 0.6894, test_loss: 0.8587, test_f1: 0.6442
 epoch: 62, train_loss: 0.6884, test_loss: 0.8607, test_f1: 0.6060
 epoch: 63, train_loss: 0.6844, test_loss: 0.8566, test_f1: 0.6134
 epoch: 64, train_loss: 0.6796, test_loss: 0.9182, test_f1: 0.5826
 epoch: 65, train_loss: 0.6889, test_loss: 0.9311, test_f1: 0.5671
 epoch: 66, train_loss: 0.6776, test_loss: 0.8818, test_f1: 0.6498
 epoch: 67, train_loss: 0.6819, test_loss: 0.9512, test_f1: 0.5756
 epoch: 68, train_loss: 0.6805, test_loss: 0.8786, test_f1: 0.6192
 epoch: 69, train_loss: 0.7021, test_loss: 0.8523, test_f1: 0.5882
 epoch: 70, train_loss: 0.6900, test_loss: 0.8564, test_f1: 0.6302
 epoch: 71, train_loss: 0.6666, test_loss: 0.8500, test_f1: 0.6006
 epoch: 72, train_loss: 0.6776, test_loss: 0.8101, test_f1: 0.6408
 epoch: 73, train_loss: 0.6883, test_loss: 0.8353, test_f1: 0.6068
 epoch: 74, train_loss: 0.6711, test_loss: 0.8547, test_f1: 0.5925
 epoch: 75, train_loss: 0.6738, test_loss: 0.8642, test_f1: 0.6109
 epoch: 76, train_loss: 0.6738, test_loss: 0.8740, test_f1: 0.6097
 epoch: 77, train_loss: 0.6742, test_loss: 0.8860, test_f1: 0.6388
 epoch: 78, train_loss: 0.6801, test_loss: 0.9500, test_f1: 0.5986
 epoch: 79, train_loss: 0.6579, test_loss: 0.9172, test_f1: 0.5791
 epoch: 80, train_loss: 0.6605, test_loss: 0.8841, test_f1: 0.6185
 epoch: 81, train_loss: 0.6666, test_loss: 0.9330, test_f1: 0.6117
 epoch: 82, train_loss: 0.6640, test_loss: 0.8958, test_f1: 0.6673
 epoch: 83, train_loss: 0.6754, test_loss: 0.8870, test_f1: 0.6398
 epoch: 84, train_loss: 0.6586, test_loss: 0.8641, test_f1: 0.6156
 epoch: 85, train_loss: 0.6620, test_loss: 0.8703, test_f1: 0.6310
 epoch: 86, train_loss: 0.6617, test_loss: 0.9232, test_f1: 0.6008
 epoch: 87, train_loss: 0.6668, test_loss: 0.9202, test_f1: 0.5752
 epoch: 88, train_loss: 0.6468, test_loss: 0.9007, test_f1: 0.6058
 epoch: 89, train_loss: 0.6653, test_loss: 0.8805, test_f1: 0.6318
 epoch: 90, train_loss: 0.6692, test_loss: 0.8917, test_f1: 0.6241
 epoch: 91, train_loss: 0.6634, test_loss: 0.9116, test_f1: 0.6176
 epoch: 92, train_loss: 0.6597, test_loss: 0.8996, test_f1: 0.6153
 epoch: 93, train_loss: 0.6306, test_loss: 0.9143, test_f1: 0.6018
 epoch: 94, train_loss: 0.6573, test_loss: 0.9010, test_f1: 0.6092
 epoch: 95, train_loss: 0.6374, test_loss: 0.9400, test_f1: 0.5873
 epoch: 96, train_loss: 0.6616, test_loss: 0.9031, test_f1: 0.6308
 epoch: 97, train_loss: 0.6784, test_loss: 0.8602, test_f1: 0.6066
 epoch: 98, train_loss: 0.6732, test_loss: 0.9018, test_f1: 0.5990
 epoch: 99, train_loss: 0.6524, test_loss: 0.9662, test_f1: 0.5891
##################ITERATION #6 ****************************************
 epoch: 0, train_loss: 1.1401, test_loss: 1.1378, test_f1: 0.3208
 epoch: 1, train_loss: 1.0560, test_loss: 1.0824, test_f1: 0.4446
 epoch: 2, train_loss: 1.0265, test_loss: 1.0494, test_f1: 0.4252
 epoch: 3, train_loss: 1.0066, test_loss: 1.0393, test_f1: 0.4790
 epoch: 4, train_loss: 0.9874, test_loss: 1.1533, test_f1: 0.3939
 epoch: 5, train_loss: 0.9703, test_loss: 1.0093, test_f1: 0.4876
 epoch: 6, train_loss: 0.9570, test_loss: 0.9990, test_f1: 0.4745
 epoch: 7, train_loss: 0.9242, test_loss: 0.9766, test_f1: 0.4887
 epoch: 8, train_loss: 0.9050, test_loss: 0.9122, test_f1: 0.5043
 epoch: 9, train_loss: 0.8998, test_loss: 0.9907, test_f1: 0.4625
 epoch: 10, train_loss: 0.8972, test_loss: 1.0839, test_f1: 0.4273
 epoch: 11, train_loss: 0.8904, test_loss: 0.9470, test_f1: 0.5239
 epoch: 12, train_loss: 0.8739, test_loss: 0.9316, test_f1: 0.5182
 epoch: 13, train_loss: 0.8575, test_loss: 1.2694, test_f1: 0.4026
 epoch: 14, train_loss: 0.8624, test_loss: 1.1273, test_f1: 0.4813
 epoch: 15, train_loss: 0.8354, test_loss: 0.9060, test_f1: 0.5269
 epoch: 16, train_loss: 0.8360, test_loss: 0.9621, test_f1: 0.4997
 epoch: 17, train_loss: 0.8479, test_loss: 0.9963, test_f1: 0.4564
 epoch: 18, train_loss: 0.8433, test_loss: 1.0232, test_f1: 0.4841
 epoch: 19, train_loss: 0.8265, test_loss: 0.8924, test_f1: 0.5453
 epoch: 20, train_loss: 0.8242, test_loss: 0.9933, test_f1: 0.4763
 epoch: 21, train_loss: 0.8087, test_loss: 0.9185, test_f1: 0.5231
 epoch: 22, train_loss: 0.8151, test_loss: 0.9070, test_f1: 0.5166
 epoch: 23, train_loss: 0.8216, test_loss: 1.0329, test_f1: 0.4898
 epoch: 24, train_loss: 0.8210, test_loss: 0.9077, test_f1: 0.5239
 epoch: 25, train_loss: 0.7970, test_loss: 0.8743, test_f1: 0.5351
 epoch: 26, train_loss: 0.7991, test_loss: 0.8125, test_f1: 0.5627
 epoch: 27, train_loss: 0.7787, test_loss: 0.9112, test_f1: 0.5610
 epoch: 28, train_loss: 0.7907, test_loss: 0.9716, test_f1: 0.5199
 epoch: 29, train_loss: 0.7936, test_loss: 0.8787, test_f1: 0.5778
 epoch: 30, train_loss: 0.7930, test_loss: 0.8740, test_f1: 0.5317
 epoch: 31, train_loss: 0.7908, test_loss: 0.9573, test_f1: 0.5280
 epoch: 32, train_loss: 0.7908, test_loss: 0.8388, test_f1: 0.5420
 epoch: 33, train_loss: 0.7843, test_loss: 0.9119, test_f1: 0.5499
 epoch: 34, train_loss: 0.7998, test_loss: 0.9006, test_f1: 0.4808
 epoch: 35, train_loss: 0.7828, test_loss: 0.9751, test_f1: 0.5193
 epoch: 36, train_loss: 0.7856, test_loss: 0.8760, test_f1: 0.5505
 epoch: 37, train_loss: 0.7796, test_loss: 0.8329, test_f1: 0.5709
 epoch: 38, train_loss: 0.7746, test_loss: 0.9653, test_f1: 0.5273
 epoch: 39, train_loss: 0.7724, test_loss: 0.8890, test_f1: 0.5363
 epoch: 40, train_loss: 0.7787, test_loss: 0.8902, test_f1: 0.5638
 epoch: 41, train_loss: 0.7576, test_loss: 0.8115, test_f1: 0.5661
 epoch: 42, train_loss: 0.7655, test_loss: 0.8346, test_f1: 0.5813
 epoch: 43, train_loss: 0.7571, test_loss: 0.9234, test_f1: 0.5757
 epoch: 44, train_loss: 0.7733, test_loss: 0.8776, test_f1: 0.5518
 epoch: 45, train_loss: 0.7525, test_loss: 0.8892, test_f1: 0.5354
 epoch: 46, train_loss: 0.7410, test_loss: 0.8213, test_f1: 0.5625
 epoch: 47, train_loss: 0.7746, test_loss: 1.2621, test_f1: 0.4116
 epoch: 48, train_loss: 0.7644, test_loss: 0.9457, test_f1: 0.5674
 epoch: 49, train_loss: 0.7460, test_loss: 0.9151, test_f1: 0.5889
 epoch: 50, train_loss: 0.7540, test_loss: 1.1339, test_f1: 0.4987
 epoch: 51, train_loss: 0.7374, test_loss: 0.8240, test_f1: 0.5596
 epoch: 52, train_loss: 0.7110, test_loss: 0.8779, test_f1: 0.5617
 epoch: 53, train_loss: 0.7160, test_loss: 0.8499, test_f1: 0.5889
 epoch: 54, train_loss: 0.7141, test_loss: 0.8651, test_f1: 0.5776
 epoch: 55, train_loss: 0.7111, test_loss: 0.8176, test_f1: 0.5968
 epoch: 56, train_loss: 0.6989, test_loss: 0.8440, test_f1: 0.5772
 epoch: 57, train_loss: 0.7109, test_loss: 0.8575, test_f1: 0.5912
 epoch: 58, train_loss: 0.7081, test_loss: 0.8022, test_f1: 0.6036
 epoch: 59, train_loss: 0.7040, test_loss: 0.8106, test_f1: 0.6262
 epoch: 60, train_loss: 0.7108, test_loss: 0.9127, test_f1: 0.5438
 epoch: 61, train_loss: 0.7105, test_loss: 0.7969, test_f1: 0.6119
 epoch: 62, train_loss: 0.7000, test_loss: 0.9446, test_f1: 0.5683
 epoch: 63, train_loss: 0.6951, test_loss: 0.8508, test_f1: 0.6075
 epoch: 64, train_loss: 0.6993, test_loss: 0.8124, test_f1: 0.5940
 epoch: 65, train_loss: 0.7113, test_loss: 0.8115, test_f1: 0.6116
 epoch: 66, train_loss: 0.7004, test_loss: 1.0063, test_f1: 0.4938
 epoch: 67, train_loss: 0.7094, test_loss: 0.8671, test_f1: 0.5778
 epoch: 68, train_loss: 0.7031, test_loss: 0.8150, test_f1: 0.6074
 epoch: 69, train_loss: 0.6916, test_loss: 0.8517, test_f1: 0.5866
 epoch: 70, train_loss: 0.6881, test_loss: 0.7732, test_f1: 0.6214
 epoch: 71, train_loss: 0.6871, test_loss: 0.8377, test_f1: 0.5636
 epoch: 72, train_loss: 0.6856, test_loss: 0.8497, test_f1: 0.5616
 epoch: 73, train_loss: 0.6905, test_loss: 0.7824, test_f1: 0.6100
 epoch: 74, train_loss: 0.6861, test_loss: 0.8466, test_f1: 0.5701
 epoch: 75, train_loss: 0.6884, test_loss: 0.8470, test_f1: 0.5972
 epoch: 76, train_loss: 0.6916, test_loss: 0.7959, test_f1: 0.6326
 epoch: 77, train_loss: 0.7021, test_loss: 0.8286, test_f1: 0.6000
 epoch: 78, train_loss: 0.6776, test_loss: 0.7996, test_f1: 0.6128
 epoch: 79, train_loss: 0.6720, test_loss: 0.8407, test_f1: 0.6170
 epoch: 80, train_loss: 0.6959, test_loss: 0.8368, test_f1: 0.5850
 epoch: 81, train_loss: 0.6815, test_loss: 0.8300, test_f1: 0.5906
 epoch: 82, train_loss: 0.6859, test_loss: 0.8425, test_f1: 0.6019
 epoch: 83, train_loss: 0.6880, test_loss: 0.8137, test_f1: 0.5960
 epoch: 84, train_loss: 0.6708, test_loss: 0.7970, test_f1: 0.6126
 epoch: 85, train_loss: 0.6799, test_loss: 0.8601, test_f1: 0.5907
 epoch: 86, train_loss: 0.6623, test_loss: 0.8026, test_f1: 0.6074
 epoch: 87, train_loss: 0.6794, test_loss: 0.8285, test_f1: 0.5972
 epoch: 88, train_loss: 0.6696, test_loss: 1.0133, test_f1: 0.5214
 epoch: 89, train_loss: 0.6855, test_loss: 0.7870, test_f1: 0.6232
 epoch: 90, train_loss: 0.6613, test_loss: 0.9287, test_f1: 0.5525
 epoch: 91, train_loss: 0.6767, test_loss: 0.8395, test_f1: 0.6076
 epoch: 92, train_loss: 0.6740, test_loss: 0.9007, test_f1: 0.6124
 epoch: 93, train_loss: 0.6695, test_loss: 0.8056, test_f1: 0.6103
 epoch: 94, train_loss: 0.6744, test_loss: 0.8345, test_f1: 0.5872
 epoch: 95, train_loss: 0.6536, test_loss: 0.8846, test_f1: 0.5813
 epoch: 96, train_loss: 0.6583, test_loss: 0.8019, test_f1: 0.6153
 epoch: 97, train_loss: 0.6696, test_loss: 0.8228, test_f1: 0.6014
 epoch: 98, train_loss: 0.6738, test_loss: 0.8014, test_f1: 0.6162
 epoch: 99, train_loss: 0.6510, test_loss: 0.8157, test_f1: 0.6096
##################ITERATION #7 ****************************************
 epoch: 0, train_loss: 1.1889, test_loss: 1.2131, test_f1: 0.3358
 epoch: 1, train_loss: 1.0592, test_loss: 1.0992, test_f1: 0.3933
 epoch: 2, train_loss: 1.0149, test_loss: 1.0944, test_f1: 0.5063
 epoch: 3, train_loss: 1.0072, test_loss: 0.9946, test_f1: 0.5422
 epoch: 4, train_loss: 0.9708, test_loss: 1.0545, test_f1: 0.4582
 epoch: 5, train_loss: 0.9638, test_loss: 0.9923, test_f1: 0.5273
 epoch: 6, train_loss: 0.9211, test_loss: 0.9865, test_f1: 0.4872
 epoch: 7, train_loss: 0.9363, test_loss: 1.0108, test_f1: 0.5391
 epoch: 8, train_loss: 0.9318, test_loss: 1.0157, test_f1: 0.5319
 epoch: 9, train_loss: 0.9198, test_loss: 0.9785, test_f1: 0.5154
 epoch: 10, train_loss: 0.9128, test_loss: 1.1827, test_f1: 0.4448
 epoch: 11, train_loss: 0.9195, test_loss: 1.0276, test_f1: 0.5229
 epoch: 12, train_loss: 0.8916, test_loss: 0.9394, test_f1: 0.5432
 epoch: 13, train_loss: 0.8790, test_loss: 1.0004, test_f1: 0.5048
 epoch: 14, train_loss: 0.8836, test_loss: 0.9616, test_f1: 0.5300
 epoch: 15, train_loss: 0.8652, test_loss: 0.9041, test_f1: 0.5550
 epoch: 16, train_loss: 0.8678, test_loss: 0.9736, test_f1: 0.5254
 epoch: 17, train_loss: 0.8795, test_loss: 0.9227, test_f1: 0.5096
 epoch: 18, train_loss: 0.8587, test_loss: 0.9174, test_f1: 0.5623
 epoch: 19, train_loss: 0.8653, test_loss: 0.9354, test_f1: 0.5434
 epoch: 20, train_loss: 0.8392, test_loss: 0.9450, test_f1: 0.5536
 epoch: 21, train_loss: 0.8359, test_loss: 0.9053, test_f1: 0.5344
 epoch: 22, train_loss: 0.8517, test_loss: 0.8941, test_f1: 0.5369
 epoch: 23, train_loss: 0.8363, test_loss: 0.9105, test_f1: 0.5509
 epoch: 24, train_loss: 0.8317, test_loss: 0.8810, test_f1: 0.5874
 epoch: 25, train_loss: 0.8224, test_loss: 0.9117, test_f1: 0.5296
 epoch: 26, train_loss: 0.8362, test_loss: 0.8818, test_f1: 0.5832
 epoch: 27, train_loss: 0.8325, test_loss: 0.9259, test_f1: 0.5329
 epoch: 28, train_loss: 0.8246, test_loss: 0.9672, test_f1: 0.5229
 epoch: 29, train_loss: 0.8118, test_loss: 0.9101, test_f1: 0.5712
 epoch: 30, train_loss: 0.8181, test_loss: 0.8732, test_f1: 0.5760
 epoch: 31, train_loss: 0.8247, test_loss: 0.9728, test_f1: 0.5267
 epoch: 32, train_loss: 0.8090, test_loss: 0.9025, test_f1: 0.5551
 epoch: 33, train_loss: 0.8036, test_loss: 0.9457, test_f1: 0.5462
 epoch: 34, train_loss: 0.8024, test_loss: 0.9036, test_f1: 0.5661
 epoch: 35, train_loss: 0.8180, test_loss: 0.9590, test_f1: 0.5598
 epoch: 36, train_loss: 0.8053, test_loss: 0.9350, test_f1: 0.5331
 epoch: 37, train_loss: 0.7931, test_loss: 1.0509, test_f1: 0.5241
 epoch: 38, train_loss: 0.8122, test_loss: 0.9456, test_f1: 0.5469
 epoch: 39, train_loss: 0.8029, test_loss: 0.9974, test_f1: 0.5434
 epoch: 40, train_loss: 0.7955, test_loss: 1.0413, test_f1: 0.5087
 epoch: 41, train_loss: 0.7915, test_loss: 0.9135, test_f1: 0.5628
 epoch: 42, train_loss: 0.7960, test_loss: 0.9324, test_f1: 0.5336
 epoch: 43, train_loss: 0.8007, test_loss: 0.8930, test_f1: 0.5792
 epoch: 44, train_loss: 0.7860, test_loss: 0.9030, test_f1: 0.5661
 epoch: 45, train_loss: 0.7826, test_loss: 1.0365, test_f1: 0.4937
 epoch: 46, train_loss: 0.7821, test_loss: 0.8810, test_f1: 0.6022
 epoch: 47, train_loss: 0.7840, test_loss: 0.9455, test_f1: 0.5470
 epoch: 48, train_loss: 0.7722, test_loss: 0.9318, test_f1: 0.5880
 epoch: 49, train_loss: 0.7812, test_loss: 0.8849, test_f1: 0.5601
 epoch: 50, train_loss: 0.7815, test_loss: 1.1012, test_f1: 0.4667
 epoch: 51, train_loss: 0.7491, test_loss: 0.8598, test_f1: 0.5787
 epoch: 52, train_loss: 0.7500, test_loss: 0.9131, test_f1: 0.5581
 epoch: 53, train_loss: 0.7518, test_loss: 0.9047, test_f1: 0.5871
 epoch: 54, train_loss: 0.7461, test_loss: 0.8536, test_f1: 0.5690
 epoch: 55, train_loss: 0.7390, test_loss: 0.8945, test_f1: 0.5505
 epoch: 56, train_loss: 0.7376, test_loss: 0.8997, test_f1: 0.5734
 epoch: 57, train_loss: 0.7418, test_loss: 0.9093, test_f1: 0.5812
 epoch: 58, train_loss: 0.7447, test_loss: 0.9076, test_f1: 0.5696
 epoch: 59, train_loss: 0.7336, test_loss: 0.9280, test_f1: 0.5466
 epoch: 60, train_loss: 0.7266, test_loss: 0.9098, test_f1: 0.5701
 epoch: 61, train_loss: 0.7282, test_loss: 0.9431, test_f1: 0.5526
 epoch: 62, train_loss: 0.7285, test_loss: 0.9045, test_f1: 0.5970
 epoch: 63, train_loss: 0.7346, test_loss: 0.9285, test_f1: 0.5836
 epoch: 64, train_loss: 0.7273, test_loss: 0.8904, test_f1: 0.5864
 epoch: 65, train_loss: 0.7416, test_loss: 0.8837, test_f1: 0.5464
 epoch: 66, train_loss: 0.7349, test_loss: 0.9123, test_f1: 0.6051
 epoch: 67, train_loss: 0.7441, test_loss: 0.8794, test_f1: 0.6122
 epoch: 68, train_loss: 0.7259, test_loss: 0.9100, test_f1: 0.5945
 epoch: 69, train_loss: 0.7483, test_loss: 0.9049, test_f1: 0.5791
 epoch: 70, train_loss: 0.7126, test_loss: 0.8849, test_f1: 0.5868
 epoch: 71, train_loss: 0.7162, test_loss: 0.8866, test_f1: 0.5996
 epoch: 72, train_loss: 0.7253, test_loss: 0.9684, test_f1: 0.5706
 epoch: 73, train_loss: 0.7408, test_loss: 0.9123, test_f1: 0.5498
 epoch: 74, train_loss: 0.7446, test_loss: 0.8741, test_f1: 0.5679
 epoch: 75, train_loss: 0.7316, test_loss: 0.9073, test_f1: 0.5521
 epoch: 76, train_loss: 0.7302, test_loss: 0.8735, test_f1: 0.6120
 epoch: 77, train_loss: 0.7380, test_loss: 0.8770, test_f1: 0.5662
 epoch: 78, train_loss: 0.7200, test_loss: 0.8799, test_f1: 0.5938
 epoch: 79, train_loss: 0.7132, test_loss: 0.8893, test_f1: 0.6108
 epoch: 80, train_loss: 0.7212, test_loss: 0.8923, test_f1: 0.5776
 epoch: 81, train_loss: 0.7299, test_loss: 0.9155, test_f1: 0.5817
 epoch: 82, train_loss: 0.7103, test_loss: 0.8817, test_f1: 0.6157
 epoch: 83, train_loss: 0.7143, test_loss: 0.8688, test_f1: 0.5858
 epoch: 84, train_loss: 0.7120, test_loss: 0.8721, test_f1: 0.5924
 epoch: 85, train_loss: 0.7134, test_loss: 0.9370, test_f1: 0.5946
 epoch: 86, train_loss: 0.7188, test_loss: 0.9326, test_f1: 0.5971
 epoch: 87, train_loss: 0.7133, test_loss: 0.8724, test_f1: 0.5966
 epoch: 88, train_loss: 0.7117, test_loss: 0.8586, test_f1: 0.5684
 epoch: 89, train_loss: 0.7181, test_loss: 0.9194, test_f1: 0.5865
 epoch: 90, train_loss: 0.6994, test_loss: 0.8832, test_f1: 0.6133
 epoch: 91, train_loss: 0.7088, test_loss: 0.8860, test_f1: 0.5962
 epoch: 92, train_loss: 0.7088, test_loss: 0.8644, test_f1: 0.5930
 epoch: 93, train_loss: 0.7055, test_loss: 0.8912, test_f1: 0.5790
 epoch: 94, train_loss: 0.6906, test_loss: 0.8803, test_f1: 0.5812
 epoch: 95, train_loss: 0.7105, test_loss: 0.8799, test_f1: 0.6113
 epoch: 96, train_loss: 0.6820, test_loss: 0.8413, test_f1: 0.5828
 epoch: 97, train_loss: 0.7086, test_loss: 0.8915, test_f1: 0.5772
 epoch: 98, train_loss: 0.7020, test_loss: 0.8952, test_f1: 0.5824
 epoch: 99, train_loss: 0.7061, test_loss: 0.9311, test_f1: 0.5697
##################ITERATION #8 ****************************************
 epoch: 0, train_loss: 1.1667, test_loss: 1.1171, test_f1: 0.3323
 epoch: 1, train_loss: 1.0239, test_loss: 0.9998, test_f1: 0.5013
 epoch: 2, train_loss: 0.9969, test_loss: 0.9664, test_f1: 0.4990
 epoch: 3, train_loss: 0.9641, test_loss: 0.9233, test_f1: 0.5091
 epoch: 4, train_loss: 0.9391, test_loss: 0.9297, test_f1: 0.4799
 epoch: 5, train_loss: 0.9238, test_loss: 0.9012, test_f1: 0.5007
 epoch: 6, train_loss: 0.9128, test_loss: 0.9074, test_f1: 0.5289
 epoch: 7, train_loss: 0.9077, test_loss: 1.0456, test_f1: 0.4953
 epoch: 8, train_loss: 0.8941, test_loss: 0.9283, test_f1: 0.5439
 epoch: 9, train_loss: 0.8868, test_loss: 0.9262, test_f1: 0.5209
 epoch: 10, train_loss: 0.8863, test_loss: 1.0068, test_f1: 0.5090
 epoch: 11, train_loss: 0.8852, test_loss: 0.9015, test_f1: 0.5360
 epoch: 12, train_loss: 0.8610, test_loss: 0.8899, test_f1: 0.5188
 epoch: 13, train_loss: 0.8534, test_loss: 1.0227, test_f1: 0.4880
 epoch: 14, train_loss: 0.8574, test_loss: 0.9475, test_f1: 0.5184
 epoch: 15, train_loss: 0.8705, test_loss: 0.9775, test_f1: 0.5164
 epoch: 16, train_loss: 0.8612, test_loss: 0.9098, test_f1: 0.5017
 epoch: 17, train_loss: 0.8686, test_loss: 1.0547, test_f1: 0.5186
 epoch: 18, train_loss: 0.8713, test_loss: 1.2042, test_f1: 0.4362
 epoch: 19, train_loss: 0.8669, test_loss: 0.9435, test_f1: 0.5038
 epoch: 20, train_loss: 0.8273, test_loss: 0.9900, test_f1: 0.5188
 epoch: 21, train_loss: 0.8170, test_loss: 0.9460, test_f1: 0.5648
 epoch: 22, train_loss: 0.8129, test_loss: 0.8862, test_f1: 0.5409
 epoch: 23, train_loss: 0.8227, test_loss: 1.0317, test_f1: 0.4700
 epoch: 24, train_loss: 0.8097, test_loss: 0.9667, test_f1: 0.4805
 epoch: 25, train_loss: 0.7984, test_loss: 1.0543, test_f1: 0.4800
 epoch: 26, train_loss: 0.8027, test_loss: 1.0269, test_f1: 0.4552
 epoch: 27, train_loss: 0.8222, test_loss: 0.8804, test_f1: 0.5638
 epoch: 28, train_loss: 0.8003, test_loss: 0.8595, test_f1: 0.5582
 epoch: 29, train_loss: 0.8088, test_loss: 0.9068, test_f1: 0.5364
 epoch: 30, train_loss: 0.8121, test_loss: 1.1295, test_f1: 0.4677
 epoch: 31, train_loss: 0.8098, test_loss: 0.8636, test_f1: 0.5668
 epoch: 32, train_loss: 0.7909, test_loss: 0.8524, test_f1: 0.5923
 epoch: 33, train_loss: 0.8027, test_loss: 0.9262, test_f1: 0.5693
 epoch: 34, train_loss: 0.8012, test_loss: 0.8687, test_f1: 0.5405
 epoch: 35, train_loss: 0.7893, test_loss: 0.9003, test_f1: 0.5354
 epoch: 36, train_loss: 0.7733, test_loss: 0.9401, test_f1: 0.5029
 epoch: 37, train_loss: 0.7654, test_loss: 0.8817, test_f1: 0.5430
 epoch: 38, train_loss: 0.7674, test_loss: 0.8437, test_f1: 0.5367
 epoch: 39, train_loss: 0.7663, test_loss: 0.9620, test_f1: 0.5167
 epoch: 40, train_loss: 0.7519, test_loss: 0.8789, test_f1: 0.5290
 epoch: 41, train_loss: 0.7729, test_loss: 0.8057, test_f1: 0.5864
 epoch: 42, train_loss: 0.7599, test_loss: 0.8478, test_f1: 0.5331
 epoch: 43, train_loss: 0.7728, test_loss: 0.9646, test_f1: 0.5557
 epoch: 44, train_loss: 0.7494, test_loss: 0.8308, test_f1: 0.5472
 epoch: 45, train_loss: 0.7404, test_loss: 0.8769, test_f1: 0.5974
 epoch: 46, train_loss: 0.7634, test_loss: 0.8566, test_f1: 0.5564
 epoch: 47, train_loss: 0.7326, test_loss: 1.0343, test_f1: 0.5045
 epoch: 48, train_loss: 0.7374, test_loss: 0.8478, test_f1: 0.5889
 epoch: 49, train_loss: 0.7327, test_loss: 0.8546, test_f1: 0.5960
 epoch: 50, train_loss: 0.7415, test_loss: 1.1100, test_f1: 0.4780
 epoch: 51, train_loss: 0.7157, test_loss: 0.8815, test_f1: 0.5629
 epoch: 52, train_loss: 0.7151, test_loss: 0.8955, test_f1: 0.5523
 epoch: 53, train_loss: 0.7141, test_loss: 0.8941, test_f1: 0.5608
 epoch: 54, train_loss: 0.7028, test_loss: 0.8462, test_f1: 0.5531
 epoch: 55, train_loss: 0.7048, test_loss: 0.8463, test_f1: 0.6282
 epoch: 56, train_loss: 0.6978, test_loss: 0.8758, test_f1: 0.5729
 epoch: 57, train_loss: 0.6975, test_loss: 0.8857, test_f1: 0.5727
 epoch: 58, train_loss: 0.6905, test_loss: 0.9158, test_f1: 0.5966
 epoch: 59, train_loss: 0.6992, test_loss: 0.8959, test_f1: 0.5788
 epoch: 60, train_loss: 0.7108, test_loss: 0.8916, test_f1: 0.5970
 epoch: 61, train_loss: 0.6812, test_loss: 0.9071, test_f1: 0.6040
 epoch: 62, train_loss: 0.6843, test_loss: 0.8742, test_f1: 0.5949
 epoch: 63, train_loss: 0.6883, test_loss: 0.8447, test_f1: 0.6499
 epoch: 64, train_loss: 0.7058, test_loss: 0.8671, test_f1: 0.5539
 epoch: 65, train_loss: 0.6873, test_loss: 0.8778, test_f1: 0.5959
 epoch: 66, train_loss: 0.6856, test_loss: 0.8759, test_f1: 0.5907
 epoch: 67, train_loss: 0.6761, test_loss: 0.9886, test_f1: 0.5328
 epoch: 68, train_loss: 0.6920, test_loss: 0.8766, test_f1: 0.5246
 epoch: 69, train_loss: 0.6862, test_loss: 0.8617, test_f1: 0.5997
 epoch: 70, train_loss: 0.6801, test_loss: 0.8533, test_f1: 0.6006
 epoch: 71, train_loss: 0.6743, test_loss: 0.9947, test_f1: 0.5236
 epoch: 72, train_loss: 0.6843, test_loss: 0.8917, test_f1: 0.6288
 epoch: 73, train_loss: 0.6820, test_loss: 0.8942, test_f1: 0.5654
 epoch: 74, train_loss: 0.6749, test_loss: 0.8717, test_f1: 0.6080
 epoch: 75, train_loss: 0.6761, test_loss: 0.8807, test_f1: 0.5777
 epoch: 76, train_loss: 0.6820, test_loss: 1.0019, test_f1: 0.5315
 epoch: 77, train_loss: 0.6746, test_loss: 0.9759, test_f1: 0.5594
 epoch: 78, train_loss: 0.6768, test_loss: 0.8701, test_f1: 0.6019
 epoch: 79, train_loss: 0.6749, test_loss: 0.9066, test_f1: 0.6159
 epoch: 80, train_loss: 0.6893, test_loss: 0.8489, test_f1: 0.6214
 epoch: 81, train_loss: 0.6553, test_loss: 0.8516, test_f1: 0.6457
 epoch: 82, train_loss: 0.6651, test_loss: 1.0146, test_f1: 0.5550
 epoch: 83, train_loss: 0.6899, test_loss: 0.9441, test_f1: 0.5913
 epoch: 84, train_loss: 0.6651, test_loss: 0.8772, test_f1: 0.6415
 epoch: 85, train_loss: 0.6620, test_loss: 0.8655, test_f1: 0.6229
 epoch: 86, train_loss: 0.6612, test_loss: 0.9190, test_f1: 0.5964
 epoch: 87, train_loss: 0.6845, test_loss: 0.8835, test_f1: 0.6413
 epoch: 88, train_loss: 0.6520, test_loss: 0.8596, test_f1: 0.6037
 epoch: 89, train_loss: 0.6708, test_loss: 0.8954, test_f1: 0.5940
 epoch: 90, train_loss: 0.6518, test_loss: 0.8872, test_f1: 0.5889
 epoch: 91, train_loss: 0.6502, test_loss: 0.8601, test_f1: 0.6229
 epoch: 92, train_loss: 0.6537, test_loss: 0.8889, test_f1: 0.6140
 epoch: 93, train_loss: 0.6594, test_loss: 0.9313, test_f1: 0.5945
 epoch: 94, train_loss: 0.6511, test_loss: 0.9552, test_f1: 0.5855
 epoch: 95, train_loss: 0.6671, test_loss: 0.8891, test_f1: 0.6237
 epoch: 96, train_loss: 0.6455, test_loss: 0.8672, test_f1: 0.6422
 epoch: 97, train_loss: 0.6418, test_loss: 0.9135, test_f1: 0.5963
 epoch: 98, train_loss: 0.6559, test_loss: 0.8612, test_f1: 0.6238
 epoch: 99, train_loss: 0.6512, test_loss: 0.8752, test_f1: 0.6403
##################ITERATION #9 ****************************************
 epoch: 0, train_loss: 1.1730, test_loss: 1.3380, test_f1: 0.2260
 epoch: 1, train_loss: 1.0546, test_loss: 1.0354, test_f1: 0.3894
 epoch: 2, train_loss: 1.0386, test_loss: 1.1157, test_f1: 0.4490
 epoch: 3, train_loss: 1.0309, test_loss: 1.0219, test_f1: 0.4907
 epoch: 4, train_loss: 0.9963, test_loss: 1.4059, test_f1: 0.3858
 epoch: 5, train_loss: 0.9842, test_loss: 1.0466, test_f1: 0.4729
 epoch: 6, train_loss: 0.9609, test_loss: 1.0001, test_f1: 0.5144
 epoch: 7, train_loss: 0.9582, test_loss: 1.0769, test_f1: 0.4450
 epoch: 8, train_loss: 0.9453, test_loss: 0.9381, test_f1: 0.5242
 epoch: 9, train_loss: 0.9501, test_loss: 1.1040, test_f1: 0.4570
 epoch: 10, train_loss: 0.9387, test_loss: 1.0478, test_f1: 0.4610
 epoch: 11, train_loss: 0.9366, test_loss: 1.0027, test_f1: 0.5203
 epoch: 12, train_loss: 0.9463, test_loss: 1.1216, test_f1: 0.5087
 epoch: 13, train_loss: 0.9181, test_loss: 1.0114, test_f1: 0.5189
 epoch: 14, train_loss: 0.9110, test_loss: 1.0726, test_f1: 0.4597
 epoch: 15, train_loss: 0.9036, test_loss: 0.9360, test_f1: 0.5230
 epoch: 16, train_loss: 0.8884, test_loss: 0.9661, test_f1: 0.5578
 epoch: 17, train_loss: 0.8900, test_loss: 0.9380, test_f1: 0.5272
 epoch: 18, train_loss: 0.8945, test_loss: 0.9370, test_f1: 0.5314
 epoch: 19, train_loss: 0.8939, test_loss: 0.9842, test_f1: 0.5091
 epoch: 20, train_loss: 0.8574, test_loss: 1.1113, test_f1: 0.4813
 epoch: 21, train_loss: 0.8666, test_loss: 0.9729, test_f1: 0.4782
 epoch: 22, train_loss: 0.8502, test_loss: 1.1791, test_f1: 0.4916
 epoch: 23, train_loss: 0.8529, test_loss: 0.9194, test_f1: 0.5510
 epoch: 24, train_loss: 0.8423, test_loss: 0.8929, test_f1: 0.5363
 epoch: 25, train_loss: 0.8167, test_loss: 0.8463, test_f1: 0.5348
 epoch: 26, train_loss: 0.8433, test_loss: 0.9321, test_f1: 0.5237
 epoch: 27, train_loss: 0.8309, test_loss: 0.8657, test_f1: 0.5468
 epoch: 28, train_loss: 0.8258, test_loss: 0.9006, test_f1: 0.5171
 epoch: 29, train_loss: 0.8172, test_loss: 0.9191, test_f1: 0.5308
 epoch: 30, train_loss: 0.7918, test_loss: 0.8793, test_f1: 0.5850
 epoch: 31, train_loss: 0.8023, test_loss: 0.8743, test_f1: 0.5693
 epoch: 32, train_loss: 0.8175, test_loss: 0.9217, test_f1: 0.5080
 epoch: 33, train_loss: 0.8158, test_loss: 0.8932, test_f1: 0.5176
 epoch: 34, train_loss: 0.8141, test_loss: 0.8857, test_f1: 0.5487
 epoch: 35, train_loss: 0.8101, test_loss: 0.9035, test_f1: 0.5293
 epoch: 36, train_loss: 0.8040, test_loss: 0.9200, test_f1: 0.5506
 epoch: 37, train_loss: 0.7972, test_loss: 1.0020, test_f1: 0.5130
 epoch: 38, train_loss: 0.7728, test_loss: 0.8612, test_f1: 0.5413
 epoch: 39, train_loss: 0.7892, test_loss: 0.9448, test_f1: 0.5165
 epoch: 40, train_loss: 0.7874, test_loss: 0.8815, test_f1: 0.5360
 epoch: 41, train_loss: 0.7845, test_loss: 0.9300, test_f1: 0.5154
 epoch: 42, train_loss: 0.7814, test_loss: 0.9645, test_f1: 0.4939
 epoch: 43, train_loss: 0.7743, test_loss: 0.8869, test_f1: 0.5252
 epoch: 44, train_loss: 0.7953, test_loss: 0.8859, test_f1: 0.5644
 epoch: 45, train_loss: 0.7560, test_loss: 0.8604, test_f1: 0.5522
 epoch: 46, train_loss: 0.7757, test_loss: 0.8631, test_f1: 0.5489
 epoch: 47, train_loss: 0.7764, test_loss: 1.0102, test_f1: 0.4700
 epoch: 48, train_loss: 0.7540, test_loss: 0.8983, test_f1: 0.5498
 epoch: 49, train_loss: 0.7469, test_loss: 0.8794, test_f1: 0.5433
 epoch: 50, train_loss: 0.7457, test_loss: 0.8622, test_f1: 0.5434
 epoch: 51, train_loss: 0.7194, test_loss: 0.8843, test_f1: 0.5645
 epoch: 52, train_loss: 0.7208, test_loss: 0.8577, test_f1: 0.5606
 epoch: 53, train_loss: 0.7124, test_loss: 0.8775, test_f1: 0.5533
 epoch: 54, train_loss: 0.7194, test_loss: 0.8820, test_f1: 0.5391
 epoch: 55, train_loss: 0.7077, test_loss: 0.9446, test_f1: 0.5193
 epoch: 56, train_loss: 0.7174, test_loss: 0.9113, test_f1: 0.5409
 epoch: 57, train_loss: 0.7075, test_loss: 0.9714, test_f1: 0.5310
 epoch: 58, train_loss: 0.7098, test_loss: 0.8552, test_f1: 0.5568
 epoch: 59, train_loss: 0.7056, test_loss: 0.8506, test_f1: 0.5624
 epoch: 60, train_loss: 0.7106, test_loss: 0.8597, test_f1: 0.5439
 epoch: 61, train_loss: 0.6937, test_loss: 0.8891, test_f1: 0.5668
 epoch: 62, train_loss: 0.7038, test_loss: 0.8477, test_f1: 0.5480
 epoch: 63, train_loss: 0.6964, test_loss: 0.9205, test_f1: 0.5400
 epoch: 64, train_loss: 0.6924, test_loss: 0.9161, test_f1: 0.5348
 epoch: 65, train_loss: 0.7026, test_loss: 0.9566, test_f1: 0.5389
 epoch: 66, train_loss: 0.6835, test_loss: 0.9097, test_f1: 0.5538
 epoch: 67, train_loss: 0.6860, test_loss: 0.8568, test_f1: 0.5506
 epoch: 68, train_loss: 0.6941, test_loss: 0.9005, test_f1: 0.5581
 epoch: 69, train_loss: 0.7055, test_loss: 0.9197, test_f1: 0.5448
 epoch: 70, train_loss: 0.6846, test_loss: 0.8803, test_f1: 0.5569
 epoch: 71, train_loss: 0.6854, test_loss: 0.9413, test_f1: 0.5393
 epoch: 72, train_loss: 0.6882, test_loss: 0.8695, test_f1: 0.5733
 epoch: 73, train_loss: 0.6887, test_loss: 0.8731, test_f1: 0.5576
 epoch: 74, train_loss: 0.6739, test_loss: 0.8820, test_f1: 0.5784
 epoch: 75, train_loss: 0.6825, test_loss: 0.8583, test_f1: 0.5662
 epoch: 76, train_loss: 0.6778, test_loss: 0.8578, test_f1: 0.5470
 epoch: 77, train_loss: 0.6671, test_loss: 0.8653, test_f1: 0.5501
 epoch: 78, train_loss: 0.6769, test_loss: 0.8544, test_f1: 0.5788
 epoch: 79, train_loss: 0.6835, test_loss: 0.8763, test_f1: 0.6082
 epoch: 80, train_loss: 0.6765, test_loss: 0.8840, test_f1: 0.5629
 epoch: 81, train_loss: 0.6779, test_loss: 0.9559, test_f1: 0.5387
 epoch: 82, train_loss: 0.6739, test_loss: 0.8455, test_f1: 0.5820
 epoch: 83, train_loss: 0.6878, test_loss: 0.8706, test_f1: 0.6089
 epoch: 84, train_loss: 0.6719, test_loss: 0.8864, test_f1: 0.5762
 epoch: 85, train_loss: 0.6723, test_loss: 0.8668, test_f1: 0.5739
 epoch: 86, train_loss: 0.6737, test_loss: 0.8625, test_f1: 0.6006
 epoch: 87, train_loss: 0.6781, test_loss: 0.9122, test_f1: 0.5615
 epoch: 88, train_loss: 0.6683, test_loss: 0.8957, test_f1: 0.5665
 epoch: 89, train_loss: 0.6706, test_loss: 0.8920, test_f1: 0.5568
 epoch: 90, train_loss: 0.6880, test_loss: 0.8816, test_f1: 0.5498
 epoch: 91, train_loss: 0.6650, test_loss: 0.8472, test_f1: 0.5884
 epoch: 92, train_loss: 0.6520, test_loss: 0.8642, test_f1: 0.5716
 epoch: 93, train_loss: 0.6631, test_loss: 0.9265, test_f1: 0.5735
 epoch: 94, train_loss: 0.6601, test_loss: 0.9036, test_f1: 0.5846
 epoch: 95, train_loss: 0.6667, test_loss: 0.9472, test_f1: 0.5282
 epoch: 96, train_loss: 0.6557, test_loss: 0.8838, test_f1: 0.6025
 epoch: 97, train_loss: 0.6788, test_loss: 0.9031, test_f1: 0.5709
 epoch: 98, train_loss: 0.6627, test_loss: 0.9161, test_f1: 0.5739
 epoch: 99, train_loss: 0.6519, test_loss: 0.8578, test_f1: 0.6012

Training completed in 492.01 seconds
Best F1: 0.6673 at epoch 82
Mean F1 across iterations: 0.6323  0.0174
========================FINAL RESULTS================================
FEGIN weighted F1: 0.6673  0.0174
python main.py --data ltspice_examples --representation component_pin --model FEGIN --layers 3 --hiddens 16 --batch_size 128 --lr 0.01 --emb_size 250 --epochs 100 --save_appendix component_pin_L3_H16_BS128_LR0.01_E250 --no_val
-----



STDERR:
  File "main.py", line 370, in <module>
    main()
  File "main.py", line 254, in main
    dataset = dataset_class(
  File "/home/philip/projects/ltspice_examples_code_repo/Circuit-Completion-Using-GNNs/component_classification_with_link_prediction_head/evaluation/FEGIN/kernel/circuit_datasets.py", line 15, in __init__
    self.data, self.slices = torch.load(self.processed_paths[0])
  File "/home/philip/.local/lib/python3.8/site-packages/torch/serialization.py", line 1040, in load
    warnings.warn(
  File "/usr/lib/python3.8/warnings.py", line 109, in _showwarnmsg
    sw(msg.message, msg.category, msg.filename, msg.lineno,
  File "main.py", line 47, in warn_with_traceback
    traceback.print_stack(file=log)
/home/philip/projects/ltspice_examples_code_repo/Circuit-Completion-Using-GNNs/component_classification_with_link_prediction_head/evaluation/FEGIN/kernel/circuit_datasets.py:15: FutureWarning: You are using `torch.load` with `weights_only=False` (the current default value), which uses the default pickle module implicitly. It is possible to construct malicious pickle data which will execute arbitrary code during unpickling (See https://github.com/pytorch/pytorch/blob/main/SECURITY.md#untrusted-models for more details). In a future release, the default value for `weights_only` will be flipped to `True`. This limits the functions that could be executed during unpickling. Arbitrary objects will no longer be allowed to be loaded via this mode unless they are explicitly allowlisted by the user via `torch.serialization.add_safe_globals`. We recommend you start setting `weights_only=True` for any use case where you don't have full control of the loaded file. Please open an issue on GitHub for any issues related to this experimental feature.
  self.data, self.slices = torch.load(self.processed_paths[0])
