STDOUT:
Results will be saved in /home/philip/projects/ltspice_examples_code_repo/Circuit-Completion-Using-GNNs/component_classification_with_link_prediction_head/evaluation/FEGIN/results/model_FEGIN_dataset_ltspice_examples
Command line input: python main.py --data ltspice_examples --representation component_pin_net --model FEGIN --layers 6 --hiddens 16 --batch_size 64 --lr 0.01 --emb_size 512 --epochs 100 --save_appendix component_pin_net_L6_H16_BS64_LR0.01_E512 --no_val
 is saved.
-----
ltspice_examples - FEGIN
Using 6 layers, 16 hidden units, h = 2
Loading component_pin_net representation dataset
ENTERED
Training FEGIN on component_pin_net representation
Train: 3558, Test: 846
##################ITERATION #0 ****************************************
 epoch: 0, train_loss: 1.2252, test_loss: 1.0781, test_f1: 0.3412
 epoch: 1, train_loss: 1.0590, test_loss: 1.1003, test_f1: 0.4241
 epoch: 2, train_loss: 1.0160, test_loss: 1.2270, test_f1: 0.4000
 epoch: 3, train_loss: 0.9901, test_loss: 1.1424, test_f1: 0.4797
 epoch: 4, train_loss: 0.9930, test_loss: 0.9427, test_f1: 0.4884
 epoch: 5, train_loss: 0.9788, test_loss: 1.0685, test_f1: 0.4355
 epoch: 6, train_loss: 0.9841, test_loss: 1.0248, test_f1: 0.4885
 epoch: 7, train_loss: 0.9740, test_loss: 1.0387, test_f1: 0.4763
 epoch: 8, train_loss: 0.9547, test_loss: 0.9694, test_f1: 0.4796
 epoch: 9, train_loss: 0.9509, test_loss: 1.0364, test_f1: 0.4542
 epoch: 10, train_loss: 0.9451, test_loss: 1.0217, test_f1: 0.4880
 epoch: 11, train_loss: 0.9535, test_loss: 0.9063, test_f1: 0.5160
 epoch: 12, train_loss: 0.9327, test_loss: 0.9451, test_f1: 0.5239
 epoch: 13, train_loss: 0.9137, test_loss: 0.8709, test_f1: 0.5378
 epoch: 14, train_loss: 0.9148, test_loss: 0.9185, test_f1: 0.5340
 epoch: 15, train_loss: 0.9046, test_loss: 0.9112, test_f1: 0.5116
 epoch: 16, train_loss: 0.9118, test_loss: 0.9455, test_f1: 0.5215
 epoch: 17, train_loss: 0.9063, test_loss: 0.9147, test_f1: 0.5296
 epoch: 18, train_loss: 0.8947, test_loss: 0.9413, test_f1: 0.5124
 epoch: 19, train_loss: 0.8875, test_loss: 0.9260, test_f1: 0.4891
 epoch: 20, train_loss: 0.8735, test_loss: 1.0346, test_f1: 0.4816
 epoch: 21, train_loss: 0.8842, test_loss: 0.8710, test_f1: 0.5164
 epoch: 22, train_loss: 0.8849, test_loss: 0.9058, test_f1: 0.5339
 epoch: 23, train_loss: 0.8798, test_loss: 0.9685, test_f1: 0.5147
 epoch: 24, train_loss: 0.8784, test_loss: 0.8800, test_f1: 0.5561
 epoch: 25, train_loss: 0.8586, test_loss: 0.8691, test_f1: 0.5183
 epoch: 26, train_loss: 0.8610, test_loss: 0.9069, test_f1: 0.5084
 epoch: 27, train_loss: 0.8526, test_loss: 0.8705, test_f1: 0.5678
 epoch: 28, train_loss: 0.8456, test_loss: 0.9672, test_f1: 0.4925
 epoch: 29, train_loss: 0.8534, test_loss: 0.9323, test_f1: 0.5113
 epoch: 30, train_loss: 0.8656, test_loss: 0.8954, test_f1: 0.5631
 epoch: 31, train_loss: 0.8478, test_loss: 0.8263, test_f1: 0.5537
 epoch: 32, train_loss: 0.8331, test_loss: 0.8422, test_f1: 0.5446
 epoch: 33, train_loss: 0.8373, test_loss: 0.8113, test_f1: 0.5708
 epoch: 34, train_loss: 0.8384, test_loss: 0.8606, test_f1: 0.5819
 epoch: 35, train_loss: 0.8389, test_loss: 0.9813, test_f1: 0.5042
 epoch: 36, train_loss: 0.8248, test_loss: 0.8457, test_f1: 0.5563
 epoch: 37, train_loss: 0.8263, test_loss: 0.9199, test_f1: 0.5259
 epoch: 38, train_loss: 0.8296, test_loss: 0.8121, test_f1: 0.5757
 epoch: 39, train_loss: 0.8151, test_loss: 0.8824, test_f1: 0.5506
 epoch: 40, train_loss: 0.8247, test_loss: 0.7900, test_f1: 0.5740
 epoch: 41, train_loss: 0.7875, test_loss: 0.8424, test_f1: 0.5449
 epoch: 42, train_loss: 0.8144, test_loss: 0.8766, test_f1: 0.5612
 epoch: 43, train_loss: 0.8165, test_loss: 0.9892, test_f1: 0.4780
 epoch: 44, train_loss: 0.7978, test_loss: 0.8022, test_f1: 0.5515
 epoch: 45, train_loss: 0.7926, test_loss: 0.8186, test_f1: 0.5833
 epoch: 46, train_loss: 0.7960, test_loss: 0.8273, test_f1: 0.5804
 epoch: 47, train_loss: 0.8055, test_loss: 0.8412, test_f1: 0.5298
 epoch: 48, train_loss: 0.8143, test_loss: 0.8217, test_f1: 0.5797
 epoch: 49, train_loss: 0.8011, test_loss: 0.8662, test_f1: 0.5423
 epoch: 50, train_loss: 0.8048, test_loss: 0.8362, test_f1: 0.5506
 epoch: 51, train_loss: 0.7865, test_loss: 0.8043, test_f1: 0.5900
 epoch: 52, train_loss: 0.7762, test_loss: 0.7953, test_f1: 0.6232
 epoch: 53, train_loss: 0.7663, test_loss: 0.8199, test_f1: 0.5880
 epoch: 54, train_loss: 0.7569, test_loss: 0.7931, test_f1: 0.5888
 epoch: 55, train_loss: 0.7556, test_loss: 0.7974, test_f1: 0.5815
 epoch: 56, train_loss: 0.7514, test_loss: 0.7750, test_f1: 0.6136
 epoch: 57, train_loss: 0.7544, test_loss: 0.7886, test_f1: 0.6205
 epoch: 58, train_loss: 0.7499, test_loss: 0.8015, test_f1: 0.5910
 epoch: 59, train_loss: 0.7389, test_loss: 0.7780, test_f1: 0.6472
 epoch: 60, train_loss: 0.7503, test_loss: 0.7926, test_f1: 0.5943
 epoch: 61, train_loss: 0.7417, test_loss: 0.8094, test_f1: 0.5930
 epoch: 62, train_loss: 0.7277, test_loss: 0.7879, test_f1: 0.6028
 epoch: 63, train_loss: 0.7268, test_loss: 0.7902, test_f1: 0.5979
 epoch: 64, train_loss: 0.7453, test_loss: 0.7995, test_f1: 0.6095
 epoch: 65, train_loss: 0.7216, test_loss: 0.7577, test_f1: 0.6186
 epoch: 66, train_loss: 0.7381, test_loss: 0.7894, test_f1: 0.6094
 epoch: 67, train_loss: 0.7269, test_loss: 0.8123, test_f1: 0.6075
 epoch: 68, train_loss: 0.7527, test_loss: 0.8126, test_f1: 0.6146
 epoch: 69, train_loss: 0.7273, test_loss: 0.7987, test_f1: 0.5988
 epoch: 70, train_loss: 0.7213, test_loss: 0.7966, test_f1: 0.6014
 epoch: 71, train_loss: 0.7154, test_loss: 0.7854, test_f1: 0.6282
 epoch: 72, train_loss: 0.7183, test_loss: 0.7600, test_f1: 0.6232
 epoch: 73, train_loss: 0.7140, test_loss: 0.7804, test_f1: 0.6497
 epoch: 74, train_loss: 0.7096, test_loss: 0.7765, test_f1: 0.6475
 epoch: 75, train_loss: 0.7204, test_loss: 0.7828, test_f1: 0.6007
 epoch: 76, train_loss: 0.7049, test_loss: 0.7737, test_f1: 0.6280
 epoch: 77, train_loss: 0.7182, test_loss: 0.8010, test_f1: 0.5754
 epoch: 78, train_loss: 0.7312, test_loss: 0.8053, test_f1: 0.5922
 epoch: 79, train_loss: 0.7148, test_loss: 0.8345, test_f1: 0.6269
 epoch: 80, train_loss: 0.6939, test_loss: 0.7782, test_f1: 0.6258
 epoch: 81, train_loss: 0.7254, test_loss: 0.7461, test_f1: 0.6144
 epoch: 82, train_loss: 0.6970, test_loss: 0.8023, test_f1: 0.5971
 epoch: 83, train_loss: 0.7188, test_loss: 0.7357, test_f1: 0.6197
 epoch: 84, train_loss: 0.7171, test_loss: 0.7786, test_f1: 0.6425
 epoch: 85, train_loss: 0.7187, test_loss: 0.7858, test_f1: 0.6025
 epoch: 86, train_loss: 0.6974, test_loss: 0.7570, test_f1: 0.6196
 epoch: 87, train_loss: 0.6976, test_loss: 0.7659, test_f1: 0.6577
 epoch: 88, train_loss: 0.7027, test_loss: 0.7643, test_f1: 0.6366
 epoch: 89, train_loss: 0.7057, test_loss: 0.7637, test_f1: 0.6016
 epoch: 90, train_loss: 0.7224, test_loss: 0.8021, test_f1: 0.6205
 epoch: 91, train_loss: 0.6986, test_loss: 0.7432, test_f1: 0.6468
 epoch: 92, train_loss: 0.6953, test_loss: 0.8163, test_f1: 0.6420
 epoch: 93, train_loss: 0.6822, test_loss: 0.7685, test_f1: 0.6227
 epoch: 94, train_loss: 0.6997, test_loss: 0.7298, test_f1: 0.6686
 epoch: 95, train_loss: 0.7012, test_loss: 0.7719, test_f1: 0.6175
 epoch: 96, train_loss: 0.6977, test_loss: 0.7332, test_f1: 0.6534
 epoch: 97, train_loss: 0.6959, test_loss: 0.7583, test_f1: 0.6459
 epoch: 98, train_loss: 0.6975, test_loss: 0.7719, test_f1: 0.6199
 epoch: 99, train_loss: 0.6795, test_loss: 0.8086, test_f1: 0.5774
##################ITERATION #1 ****************************************
 epoch: 0, train_loss: 1.1141, test_loss: 1.0052, test_f1: 0.4216
 epoch: 1, train_loss: 1.0146, test_loss: 1.0100, test_f1: 0.4388
 epoch: 2, train_loss: 0.9875, test_loss: 0.9995, test_f1: 0.5069
 epoch: 3, train_loss: 0.9658, test_loss: 0.9518, test_f1: 0.4698
 epoch: 4, train_loss: 0.9558, test_loss: 1.0260, test_f1: 0.4259
 epoch: 5, train_loss: 0.9595, test_loss: 0.9163, test_f1: 0.5047
 epoch: 6, train_loss: 0.9440, test_loss: 0.9771, test_f1: 0.4984
 epoch: 7, train_loss: 0.9355, test_loss: 1.5606, test_f1: 0.3337
 epoch: 8, train_loss: 0.9313, test_loss: 0.9298, test_f1: 0.5052
 epoch: 9, train_loss: 0.9296, test_loss: 0.9570, test_f1: 0.5078
 epoch: 10, train_loss: 0.9092, test_loss: 0.9964, test_f1: 0.4802
 epoch: 11, train_loss: 0.9128, test_loss: 1.0740, test_f1: 0.4309
 epoch: 12, train_loss: 0.9228, test_loss: 0.9610, test_f1: 0.4640
 epoch: 13, train_loss: 0.9240, test_loss: 0.9735, test_f1: 0.5132
 epoch: 14, train_loss: 0.9146, test_loss: 0.8596, test_f1: 0.5248
 epoch: 15, train_loss: 0.8990, test_loss: 0.9606, test_f1: 0.4588
 epoch: 16, train_loss: 0.8821, test_loss: 0.8994, test_f1: 0.5087
 epoch: 17, train_loss: 0.8876, test_loss: 0.9798, test_f1: 0.4791
 epoch: 18, train_loss: 0.8775, test_loss: 0.9152, test_f1: 0.5284
 epoch: 19, train_loss: 0.8778, test_loss: 0.8845, test_f1: 0.5137
 epoch: 20, train_loss: 0.8673, test_loss: 0.8418, test_f1: 0.5666
 epoch: 21, train_loss: 0.8698, test_loss: 1.0004, test_f1: 0.5233
 epoch: 22, train_loss: 0.8575, test_loss: 0.8524, test_f1: 0.5584
 epoch: 23, train_loss: 0.8385, test_loss: 0.9156, test_f1: 0.5199
 epoch: 24, train_loss: 0.8586, test_loss: 0.9265, test_f1: 0.4633
 epoch: 25, train_loss: 0.8570, test_loss: 0.9278, test_f1: 0.5091
 epoch: 26, train_loss: 0.8271, test_loss: 0.8585, test_f1: 0.5320
 epoch: 27, train_loss: 0.8399, test_loss: 0.8526, test_f1: 0.5458
 epoch: 28, train_loss: 0.8309, test_loss: 0.8757, test_f1: 0.5653
 epoch: 29, train_loss: 0.8292, test_loss: 0.7721, test_f1: 0.5639
 epoch: 30, train_loss: 0.8270, test_loss: 0.8070, test_f1: 0.5592
 epoch: 31, train_loss: 0.8541, test_loss: 0.8282, test_f1: 0.5451
 epoch: 32, train_loss: 0.8313, test_loss: 0.8719, test_f1: 0.4961
 epoch: 33, train_loss: 0.8091, test_loss: 0.8423, test_f1: 0.5563
 epoch: 34, train_loss: 0.8209, test_loss: 0.9003, test_f1: 0.5324
 epoch: 35, train_loss: 0.8363, test_loss: 0.8754, test_f1: 0.5296
 epoch: 36, train_loss: 0.8083, test_loss: 0.8436, test_f1: 0.5393
 epoch: 37, train_loss: 0.8073, test_loss: 1.0789, test_f1: 0.4845
 epoch: 38, train_loss: 0.8209, test_loss: 0.8786, test_f1: 0.5636
 epoch: 39, train_loss: 0.8054, test_loss: 0.8815, test_f1: 0.5792
 epoch: 40, train_loss: 0.8061, test_loss: 0.8199, test_f1: 0.5581
 epoch: 41, train_loss: 0.7954, test_loss: 0.8282, test_f1: 0.5716
 epoch: 42, train_loss: 0.7911, test_loss: 0.7909, test_f1: 0.5740
 epoch: 43, train_loss: 0.7890, test_loss: 0.8502, test_f1: 0.5459
 epoch: 44, train_loss: 0.7813, test_loss: 0.8668, test_f1: 0.5830
 epoch: 45, train_loss: 0.7848, test_loss: 0.8600, test_f1: 0.5510
 epoch: 46, train_loss: 0.7792, test_loss: 0.8236, test_f1: 0.5916
 epoch: 47, train_loss: 0.8020, test_loss: 0.9108, test_f1: 0.5910
 epoch: 48, train_loss: 0.8059, test_loss: 0.7757, test_f1: 0.5802
 epoch: 49, train_loss: 0.7819, test_loss: 0.9293, test_f1: 0.5575
 epoch: 50, train_loss: 0.7775, test_loss: 0.8484, test_f1: 0.5857
 epoch: 51, train_loss: 0.7685, test_loss: 0.8435, test_f1: 0.5736
 epoch: 52, train_loss: 0.7505, test_loss: 0.8676, test_f1: 0.5651
 epoch: 53, train_loss: 0.7438, test_loss: 0.8379, test_f1: 0.6222
 epoch: 54, train_loss: 0.7624, test_loss: 0.8476, test_f1: 0.5689
 epoch: 55, train_loss: 0.7375, test_loss: 0.8400, test_f1: 0.5698
 epoch: 56, train_loss: 0.7359, test_loss: 0.8380, test_f1: 0.5927
 epoch: 57, train_loss: 0.7322, test_loss: 0.8579, test_f1: 0.5973
 epoch: 58, train_loss: 0.7317, test_loss: 0.7698, test_f1: 0.6230
 epoch: 59, train_loss: 0.7202, test_loss: 0.7981, test_f1: 0.5885
 epoch: 60, train_loss: 0.7468, test_loss: 0.8605, test_f1: 0.5933
 epoch: 61, train_loss: 0.7206, test_loss: 0.8184, test_f1: 0.6068
 epoch: 62, train_loss: 0.7274, test_loss: 0.7812, test_f1: 0.6002
 epoch: 63, train_loss: 0.7242, test_loss: 0.7677, test_f1: 0.5871
 epoch: 64, train_loss: 0.7268, test_loss: 0.8141, test_f1: 0.5909
 epoch: 65, train_loss: 0.7192, test_loss: 0.8225, test_f1: 0.5944
 epoch: 66, train_loss: 0.7234, test_loss: 0.7927, test_f1: 0.5853
 epoch: 67, train_loss: 0.7230, test_loss: 0.8722, test_f1: 0.6258
 epoch: 68, train_loss: 0.7209, test_loss: 0.8333, test_f1: 0.6022
 epoch: 69, train_loss: 0.7173, test_loss: 1.0345, test_f1: 0.5535
 epoch: 70, train_loss: 0.7368, test_loss: 0.7801, test_f1: 0.5943
 epoch: 71, train_loss: 0.7235, test_loss: 0.8062, test_f1: 0.6388
 epoch: 72, train_loss: 0.7098, test_loss: 0.8643, test_f1: 0.5751
 epoch: 73, train_loss: 0.7146, test_loss: 0.8594, test_f1: 0.6279
 epoch: 74, train_loss: 0.7127, test_loss: 0.8102, test_f1: 0.6166
 epoch: 75, train_loss: 0.7079, test_loss: 0.8507, test_f1: 0.6062
 epoch: 76, train_loss: 0.7129, test_loss: 0.8099, test_f1: 0.6193
 epoch: 77, train_loss: 0.7160, test_loss: 0.8322, test_f1: 0.6212
 epoch: 78, train_loss: 0.7004, test_loss: 0.9039, test_f1: 0.5624
 epoch: 79, train_loss: 0.7195, test_loss: 0.8094, test_f1: 0.6143
 epoch: 80, train_loss: 0.6956, test_loss: 0.7954, test_f1: 0.6064
 epoch: 81, train_loss: 0.7017, test_loss: 0.7393, test_f1: 0.6035
 epoch: 82, train_loss: 0.7163, test_loss: 0.8800, test_f1: 0.6044
 epoch: 83, train_loss: 0.7143, test_loss: 0.8124, test_f1: 0.6075
 epoch: 84, train_loss: 0.7018, test_loss: 0.8115, test_f1: 0.6306
 epoch: 85, train_loss: 0.7079, test_loss: 0.8241, test_f1: 0.5976
 epoch: 86, train_loss: 0.7042, test_loss: 0.9629, test_f1: 0.5653
 epoch: 87, train_loss: 0.7178, test_loss: 0.8316, test_f1: 0.6300
 epoch: 88, train_loss: 0.6875, test_loss: 0.8250, test_f1: 0.6224
 epoch: 89, train_loss: 0.7032, test_loss: 0.7342, test_f1: 0.6341
 epoch: 90, train_loss: 0.6951, test_loss: 0.7983, test_f1: 0.6172
 epoch: 91, train_loss: 0.6913, test_loss: 0.7676, test_f1: 0.6081
 epoch: 92, train_loss: 0.6921, test_loss: 0.8152, test_f1: 0.6166
 epoch: 93, train_loss: 0.6860, test_loss: 0.7878, test_f1: 0.6185
 epoch: 94, train_loss: 0.6926, test_loss: 0.8653, test_f1: 0.6188
 epoch: 95, train_loss: 0.7038, test_loss: 0.7721, test_f1: 0.6205
 epoch: 96, train_loss: 0.6856, test_loss: 0.8025, test_f1: 0.6300
 epoch: 97, train_loss: 0.6937, test_loss: 0.8469, test_f1: 0.6215
 epoch: 98, train_loss: 0.6855, test_loss: 0.7845, test_f1: 0.6106
 epoch: 99, train_loss: 0.6970, test_loss: 0.8981, test_f1: 0.5872
##################ITERATION #2 ****************************************
 epoch: 0, train_loss: 1.1180, test_loss: 1.0909, test_f1: 0.3444
 epoch: 1, train_loss: 1.0078, test_loss: 1.0553, test_f1: 0.5051
 epoch: 2, train_loss: 0.9976, test_loss: 1.0265, test_f1: 0.4649
 epoch: 3, train_loss: 0.9752, test_loss: 0.9915, test_f1: 0.4751
 epoch: 4, train_loss: 0.9692, test_loss: 0.9847, test_f1: 0.4762
 epoch: 5, train_loss: 0.9665, test_loss: 1.0049, test_f1: 0.4762
 epoch: 6, train_loss: 1.0132, test_loss: 1.0326, test_f1: 0.4371
 epoch: 7, train_loss: 0.9822, test_loss: 1.0164, test_f1: 0.5052
 epoch: 8, train_loss: 0.9694, test_loss: 0.9974, test_f1: 0.4763
 epoch: 9, train_loss: 0.9611, test_loss: 0.9975, test_f1: 0.4635
 epoch: 10, train_loss: 0.9373, test_loss: 0.9491, test_f1: 0.5136
 epoch: 11, train_loss: 0.9438, test_loss: 0.9075, test_f1: 0.5008
 epoch: 12, train_loss: 0.9263, test_loss: 0.9220, test_f1: 0.5255
 epoch: 13, train_loss: 0.9461, test_loss: 0.9297, test_f1: 0.5068
 epoch: 14, train_loss: 0.9305, test_loss: 1.0031, test_f1: 0.4388
 epoch: 15, train_loss: 0.9243, test_loss: 0.9285, test_f1: 0.5213
 epoch: 16, train_loss: 0.9274, test_loss: 0.9229, test_f1: 0.5356
 epoch: 17, train_loss: 0.9041, test_loss: 0.9110, test_f1: 0.4953
 epoch: 18, train_loss: 0.9101, test_loss: 0.9546, test_f1: 0.4906
 epoch: 19, train_loss: 0.9153, test_loss: 0.9193, test_f1: 0.5157
 epoch: 20, train_loss: 0.9104, test_loss: 0.9763, test_f1: 0.4625
 epoch: 21, train_loss: 0.8926, test_loss: 0.8896, test_f1: 0.5207
 epoch: 22, train_loss: 0.8980, test_loss: 0.8554, test_f1: 0.5256
 epoch: 23, train_loss: 0.8930, test_loss: 0.8929, test_f1: 0.5091
 epoch: 24, train_loss: 0.8956, test_loss: 0.8743, test_f1: 0.5332
 epoch: 25, train_loss: 0.8837, test_loss: 0.8962, test_f1: 0.5225
 epoch: 26, train_loss: 0.8691, test_loss: 0.9031, test_f1: 0.4984
 epoch: 27, train_loss: 0.8797, test_loss: 0.9444, test_f1: 0.5278
 epoch: 28, train_loss: 0.8926, test_loss: 0.9363, test_f1: 0.5232
 epoch: 29, train_loss: 0.8813, test_loss: 0.8892, test_f1: 0.5520
 epoch: 30, train_loss: 0.8659, test_loss: 0.8311, test_f1: 0.5718
 epoch: 31, train_loss: 0.8651, test_loss: 0.9241, test_f1: 0.5159
 epoch: 32, train_loss: 0.8633, test_loss: 0.8742, test_f1: 0.5340
 epoch: 33, train_loss: 0.8530, test_loss: 0.8951, test_f1: 0.5404
 epoch: 34, train_loss: 0.8610, test_loss: 0.8512, test_f1: 0.5552
 epoch: 35, train_loss: 0.8551, test_loss: 0.7858, test_f1: 0.5738
 epoch: 36, train_loss: 0.8547, test_loss: 0.8256, test_f1: 0.5529
 epoch: 37, train_loss: 0.8340, test_loss: 0.7763, test_f1: 0.6325
 epoch: 38, train_loss: 0.8377, test_loss: 0.7792, test_f1: 0.6023
 epoch: 39, train_loss: 0.8429, test_loss: 0.8802, test_f1: 0.5817
 epoch: 40, train_loss: 0.8425, test_loss: 0.8629, test_f1: 0.5584
 epoch: 41, train_loss: 0.8345, test_loss: 0.9132, test_f1: 0.5495
 epoch: 42, train_loss: 0.8286, test_loss: 0.8033, test_f1: 0.5967
 epoch: 43, train_loss: 0.8445, test_loss: 0.7836, test_f1: 0.6262
 epoch: 44, train_loss: 0.8230, test_loss: 0.9134, test_f1: 0.5406
 epoch: 45, train_loss: 0.8292, test_loss: 0.7576, test_f1: 0.6359
 epoch: 46, train_loss: 0.8091, test_loss: 1.0327, test_f1: 0.5879
 epoch: 47, train_loss: 0.8167, test_loss: 0.8631, test_f1: 0.5714
 epoch: 48, train_loss: 0.8240, test_loss: 0.8071, test_f1: 0.6121
 epoch: 49, train_loss: 0.8146, test_loss: 0.8229, test_f1: 0.6284
 epoch: 50, train_loss: 0.8078, test_loss: 0.7927, test_f1: 0.6168
 epoch: 51, train_loss: 0.7809, test_loss: 0.7712, test_f1: 0.5989
 epoch: 52, train_loss: 0.7763, test_loss: 0.8029, test_f1: 0.5953
 epoch: 53, train_loss: 0.7806, test_loss: 0.7557, test_f1: 0.6271
 epoch: 54, train_loss: 0.7827, test_loss: 0.7588, test_f1: 0.6204
 epoch: 55, train_loss: 0.7705, test_loss: 0.7279, test_f1: 0.6620
 epoch: 56, train_loss: 0.7735, test_loss: 0.8206, test_f1: 0.6172
 epoch: 57, train_loss: 0.7847, test_loss: 0.8123, test_f1: 0.6100
 epoch: 58, train_loss: 0.7656, test_loss: 0.8081, test_f1: 0.6149
 epoch: 59, train_loss: 0.7565, test_loss: 0.8431, test_f1: 0.5956
 epoch: 60, train_loss: 0.7679, test_loss: 0.8685, test_f1: 0.6034
 epoch: 61, train_loss: 0.7621, test_loss: 0.7908, test_f1: 0.6069
 epoch: 62, train_loss: 0.7693, test_loss: 0.8596, test_f1: 0.6200
 epoch: 63, train_loss: 0.7532, test_loss: 0.7963, test_f1: 0.6093
 epoch: 64, train_loss: 0.7600, test_loss: 0.7551, test_f1: 0.6504
 epoch: 65, train_loss: 0.7519, test_loss: 0.7781, test_f1: 0.6201
 epoch: 66, train_loss: 0.7562, test_loss: 0.8115, test_f1: 0.6036
 epoch: 67, train_loss: 0.7483, test_loss: 0.8431, test_f1: 0.6212
 epoch: 68, train_loss: 0.7514, test_loss: 0.7559, test_f1: 0.6354
 epoch: 69, train_loss: 0.7457, test_loss: 0.7401, test_f1: 0.6464
 epoch: 70, train_loss: 0.7608, test_loss: 0.8290, test_f1: 0.5947
 epoch: 71, train_loss: 0.7431, test_loss: 0.7147, test_f1: 0.6479
 epoch: 72, train_loss: 0.7451, test_loss: 0.7206, test_f1: 0.6685
 epoch: 73, train_loss: 0.7390, test_loss: 0.7943, test_f1: 0.6244
 epoch: 74, train_loss: 0.7304, test_loss: 0.7970, test_f1: 0.6389
 epoch: 75, train_loss: 0.7343, test_loss: 0.7540, test_f1: 0.6263
 epoch: 76, train_loss: 0.7431, test_loss: 0.7863, test_f1: 0.6271
 epoch: 77, train_loss: 0.7421, test_loss: 0.7919, test_f1: 0.6308
 epoch: 78, train_loss: 0.7341, test_loss: 0.7921, test_f1: 0.6177
 epoch: 79, train_loss: 0.7384, test_loss: 0.8485, test_f1: 0.6120
 epoch: 80, train_loss: 0.7377, test_loss: 0.8113, test_f1: 0.6401
 epoch: 81, train_loss: 0.7406, test_loss: 0.8140, test_f1: 0.6171
 epoch: 82, train_loss: 0.7328, test_loss: 0.7087, test_f1: 0.6781
 epoch: 83, train_loss: 0.7227, test_loss: 0.7489, test_f1: 0.6222
 epoch: 84, train_loss: 0.7481, test_loss: 0.7590, test_f1: 0.6243
 epoch: 85, train_loss: 0.7383, test_loss: 0.7900, test_f1: 0.6239
 epoch: 86, train_loss: 0.7194, test_loss: 0.7499, test_f1: 0.6273
 epoch: 87, train_loss: 0.7283, test_loss: 0.7989, test_f1: 0.6349
 epoch: 88, train_loss: 0.7373, test_loss: 0.7265, test_f1: 0.6445
 epoch: 89, train_loss: 0.7352, test_loss: 0.7463, test_f1: 0.6299
 epoch: 90, train_loss: 0.7330, test_loss: 0.8374, test_f1: 0.6138
 epoch: 91, train_loss: 0.7332, test_loss: 0.7943, test_f1: 0.6058
 epoch: 92, train_loss: 0.7016, test_loss: 0.7287, test_f1: 0.6483
 epoch: 93, train_loss: 0.7119, test_loss: 0.8377, test_f1: 0.6013
 epoch: 94, train_loss: 0.7177, test_loss: 0.7095, test_f1: 0.6660
 epoch: 95, train_loss: 0.7064, test_loss: 0.8000, test_f1: 0.6206
 epoch: 96, train_loss: 0.7288, test_loss: 0.7871, test_f1: 0.6372
 epoch: 97, train_loss: 0.7176, test_loss: 0.7674, test_f1: 0.6386
 epoch: 98, train_loss: 0.7045, test_loss: 0.8194, test_f1: 0.6203
 epoch: 99, train_loss: 0.7017, test_loss: 0.8641, test_f1: 0.5789
##################ITERATION #3 ****************************************
 epoch: 0, train_loss: 1.1734, test_loss: 1.0905, test_f1: 0.4668
 epoch: 1, train_loss: 1.0373, test_loss: 1.0102, test_f1: 0.4444
 epoch: 2, train_loss: 1.0156, test_loss: 0.9938, test_f1: 0.4534
 epoch: 3, train_loss: 0.9869, test_loss: 1.0290, test_f1: 0.4818
 epoch: 4, train_loss: 0.9975, test_loss: 1.0155, test_f1: 0.4600
 epoch: 5, train_loss: 0.9801, test_loss: 0.9735, test_f1: 0.4772
 epoch: 6, train_loss: 0.9626, test_loss: 1.2580, test_f1: 0.4005
 epoch: 7, train_loss: 0.9617, test_loss: 0.9992, test_f1: 0.4418
 epoch: 8, train_loss: 0.9429, test_loss: 0.9602, test_f1: 0.5087
 epoch: 9, train_loss: 0.9382, test_loss: 0.9486, test_f1: 0.5082
 epoch: 10, train_loss: 0.9264, test_loss: 0.9447, test_f1: 0.5207
 epoch: 11, train_loss: 0.9210, test_loss: 0.9400, test_f1: 0.5143
 epoch: 12, train_loss: 0.9133, test_loss: 0.9697, test_f1: 0.5516
 epoch: 13, train_loss: 0.9138, test_loss: 0.9414, test_f1: 0.4716
 epoch: 14, train_loss: 0.9418, test_loss: 0.9552, test_f1: 0.5326
 epoch: 15, train_loss: 0.9244, test_loss: 0.9797, test_f1: 0.4802
 epoch: 16, train_loss: 0.9079, test_loss: 0.8664, test_f1: 0.5515
 epoch: 17, train_loss: 0.9112, test_loss: 0.8316, test_f1: 0.5522
 epoch: 18, train_loss: 0.9003, test_loss: 0.9719, test_f1: 0.5008
 epoch: 19, train_loss: 0.8851, test_loss: 0.9434, test_f1: 0.5085
 epoch: 20, train_loss: 0.8863, test_loss: 0.9032, test_f1: 0.5165
 epoch: 21, train_loss: 0.8692, test_loss: 0.8638, test_f1: 0.5205
 epoch: 22, train_loss: 0.8952, test_loss: 0.8952, test_f1: 0.4909
 epoch: 23, train_loss: 0.9049, test_loss: 0.8841, test_f1: 0.5181
 epoch: 24, train_loss: 0.8680, test_loss: 0.8597, test_f1: 0.5329
 epoch: 25, train_loss: 0.8801, test_loss: 0.9509, test_f1: 0.5015
 epoch: 26, train_loss: 0.8643, test_loss: 0.9166, test_f1: 0.5097
 epoch: 27, train_loss: 0.8645, test_loss: 0.8236, test_f1: 0.5385
 epoch: 28, train_loss: 0.8568, test_loss: 0.8100, test_f1: 0.5339
 epoch: 29, train_loss: 0.8619, test_loss: 0.8452, test_f1: 0.5334
 epoch: 30, train_loss: 0.8711, test_loss: 0.8373, test_f1: 0.5549
 epoch: 31, train_loss: 0.8530, test_loss: 0.8899, test_f1: 0.5734
 epoch: 32, train_loss: 0.8518, test_loss: 0.8529, test_f1: 0.5296
 epoch: 33, train_loss: 0.8507, test_loss: 0.7888, test_f1: 0.5404
 epoch: 34, train_loss: 0.8396, test_loss: 0.8847, test_f1: 0.5366
 epoch: 35, train_loss: 0.8332, test_loss: 0.8585, test_f1: 0.5406
 epoch: 36, train_loss: 0.8526, test_loss: 0.8703, test_f1: 0.5270
 epoch: 37, train_loss: 0.8311, test_loss: 0.9094, test_f1: 0.5163
 epoch: 38, train_loss: 0.8459, test_loss: 1.0618, test_f1: 0.4880
 epoch: 39, train_loss: 0.8385, test_loss: 0.8638, test_f1: 0.5629
 epoch: 40, train_loss: 0.8435, test_loss: 0.8415, test_f1: 0.5284
 epoch: 41, train_loss: 0.8265, test_loss: 0.8602, test_f1: 0.5782
 epoch: 42, train_loss: 0.8200, test_loss: 0.8133, test_f1: 0.5455
 epoch: 43, train_loss: 0.8389, test_loss: 0.8724, test_f1: 0.5624
 epoch: 44, train_loss: 0.8337, test_loss: 0.9004, test_f1: 0.5415
 epoch: 45, train_loss: 0.8312, test_loss: 0.8371, test_f1: 0.5819
 epoch: 46, train_loss: 0.8182, test_loss: 0.8493, test_f1: 0.5413
 epoch: 47, train_loss: 0.8280, test_loss: 0.9393, test_f1: 0.5179
 epoch: 48, train_loss: 0.8157, test_loss: 0.8225, test_f1: 0.5614
 epoch: 49, train_loss: 0.8131, test_loss: 0.7866, test_f1: 0.5577
 epoch: 50, train_loss: 0.8143, test_loss: 0.7741, test_f1: 0.5855
 epoch: 51, train_loss: 0.7915, test_loss: 0.7906, test_f1: 0.5689
 epoch: 52, train_loss: 0.7883, test_loss: 0.7694, test_f1: 0.6251
 epoch: 53, train_loss: 0.7902, test_loss: 0.7987, test_f1: 0.5675
 epoch: 54, train_loss: 0.7982, test_loss: 0.8033, test_f1: 0.5483
 epoch: 55, train_loss: 0.7798, test_loss: 0.7722, test_f1: 0.5590
 epoch: 56, train_loss: 0.7686, test_loss: 0.7650, test_f1: 0.5894
 epoch: 57, train_loss: 0.7836, test_loss: 0.8462, test_f1: 0.5779
 epoch: 58, train_loss: 0.7726, test_loss: 0.7926, test_f1: 0.5796
 epoch: 59, train_loss: 0.7819, test_loss: 0.7953, test_f1: 0.5648
 epoch: 60, train_loss: 0.7708, test_loss: 0.7969, test_f1: 0.5995
 epoch: 61, train_loss: 0.7670, test_loss: 0.7903, test_f1: 0.5752
 epoch: 62, train_loss: 0.7830, test_loss: 0.8559, test_f1: 0.5766
 epoch: 63, train_loss: 0.7611, test_loss: 0.8057, test_f1: 0.5827
 epoch: 64, train_loss: 0.7627, test_loss: 0.7948, test_f1: 0.5685
 epoch: 65, train_loss: 0.7663, test_loss: 0.8172, test_f1: 0.5792
 epoch: 66, train_loss: 0.7682, test_loss: 0.7944, test_f1: 0.5986
 epoch: 67, train_loss: 0.7590, test_loss: 0.8496, test_f1: 0.5645
 epoch: 68, train_loss: 0.7478, test_loss: 0.8191, test_f1: 0.6051
 epoch: 69, train_loss: 0.7792, test_loss: 0.7616, test_f1: 0.6051
 epoch: 70, train_loss: 0.7398, test_loss: 0.8311, test_f1: 0.5684
 epoch: 71, train_loss: 0.7541, test_loss: 0.8180, test_f1: 0.6147
 epoch: 72, train_loss: 0.7526, test_loss: 0.8649, test_f1: 0.5862
 epoch: 73, train_loss: 0.7569, test_loss: 0.8474, test_f1: 0.6121
 epoch: 74, train_loss: 0.7511, test_loss: 0.8279, test_f1: 0.5768
 epoch: 75, train_loss: 0.7408, test_loss: 0.8217, test_f1: 0.5808
 epoch: 76, train_loss: 0.7616, test_loss: 0.9080, test_f1: 0.5875
 epoch: 77, train_loss: 0.7474, test_loss: 0.8669, test_f1: 0.6007
 epoch: 78, train_loss: 0.7398, test_loss: 0.8476, test_f1: 0.5970
 epoch: 79, train_loss: 0.7623, test_loss: 0.8621, test_f1: 0.5901
 epoch: 80, train_loss: 0.7481, test_loss: 0.8176, test_f1: 0.6064
 epoch: 81, train_loss: 0.7460, test_loss: 0.8550, test_f1: 0.5622
 epoch: 82, train_loss: 0.7514, test_loss: 0.8470, test_f1: 0.5835
 epoch: 83, train_loss: 0.7369, test_loss: 0.8338, test_f1: 0.6045
 epoch: 84, train_loss: 0.7409, test_loss: 0.8504, test_f1: 0.5885
 epoch: 85, train_loss: 0.7434, test_loss: 0.8999, test_f1: 0.5671
 epoch: 86, train_loss: 0.7433, test_loss: 0.8268, test_f1: 0.6089
 epoch: 87, train_loss: 0.7369, test_loss: 0.8902, test_f1: 0.5849
 epoch: 88, train_loss: 0.7530, test_loss: 0.8449, test_f1: 0.5999
 epoch: 89, train_loss: 0.7384, test_loss: 0.8516, test_f1: 0.6044
 epoch: 90, train_loss: 0.7336, test_loss: 0.8583, test_f1: 0.6192
 epoch: 91, train_loss: 0.7277, test_loss: 0.9008, test_f1: 0.6060
 epoch: 92, train_loss: 0.7274, test_loss: 0.8751, test_f1: 0.5792
 epoch: 93, train_loss: 0.7202, test_loss: 0.8555, test_f1: 0.5952
 epoch: 94, train_loss: 0.7125, test_loss: 0.8723, test_f1: 0.6018
 epoch: 95, train_loss: 0.7307, test_loss: 0.9019, test_f1: 0.5650
 epoch: 96, train_loss: 0.7444, test_loss: 0.8468, test_f1: 0.6198
 epoch: 97, train_loss: 0.7347, test_loss: 0.8708, test_f1: 0.5685
 epoch: 98, train_loss: 0.7235, test_loss: 0.8384, test_f1: 0.5700
 epoch: 99, train_loss: 0.7152, test_loss: 0.8475, test_f1: 0.6118
##################ITERATION #4 ****************************************
 epoch: 0, train_loss: 1.1775, test_loss: 1.0938, test_f1: 0.3413
 epoch: 1, train_loss: 1.0664, test_loss: 1.0715, test_f1: 0.3676
 epoch: 2, train_loss: 1.0557, test_loss: 1.1424, test_f1: 0.3361
 epoch: 3, train_loss: 1.0483, test_loss: 1.0786, test_f1: 0.4081
 epoch: 4, train_loss: 1.0324, test_loss: 1.0668, test_f1: 0.3684
 epoch: 5, train_loss: 1.0417, test_loss: 1.0647, test_f1: 0.4669
 epoch: 6, train_loss: 1.0151, test_loss: 1.0556, test_f1: 0.4912
 epoch: 7, train_loss: 1.0149, test_loss: 1.0083, test_f1: 0.5062
 epoch: 8, train_loss: 0.9984, test_loss: 1.0438, test_f1: 0.4715
 epoch: 9, train_loss: 0.9788, test_loss: 1.0150, test_f1: 0.4582
 epoch: 10, train_loss: 0.9651, test_loss: 1.2876, test_f1: 0.4041
 epoch: 11, train_loss: 0.9784, test_loss: 1.1180, test_f1: 0.4363
 epoch: 12, train_loss: 0.9543, test_loss: 0.9811, test_f1: 0.4819
 epoch: 13, train_loss: 0.9469, test_loss: 1.0819, test_f1: 0.4861
 epoch: 14, train_loss: 0.9390, test_loss: 0.9934, test_f1: 0.5152
 epoch: 15, train_loss: 0.9386, test_loss: 0.9341, test_f1: 0.4736
 epoch: 16, train_loss: 0.9062, test_loss: 1.0982, test_f1: 0.4944
 epoch: 17, train_loss: 0.9136, test_loss: 1.0149, test_f1: 0.4765
 epoch: 18, train_loss: 0.9221, test_loss: 0.9634, test_f1: 0.5200
 epoch: 19, train_loss: 0.8961, test_loss: 0.9921, test_f1: 0.4919
 epoch: 20, train_loss: 0.8948, test_loss: 0.9744, test_f1: 0.4886
 epoch: 21, train_loss: 0.8877, test_loss: 0.9274, test_f1: 0.5076
 epoch: 22, train_loss: 0.8822, test_loss: 1.0148, test_f1: 0.4709
 epoch: 23, train_loss: 0.8682, test_loss: 0.9166, test_f1: 0.5287
 epoch: 24, train_loss: 0.8740, test_loss: 1.0314, test_f1: 0.4819
 epoch: 25, train_loss: 0.8662, test_loss: 0.9909, test_f1: 0.4822
 epoch: 26, train_loss: 0.8633, test_loss: 0.9558, test_f1: 0.5098
 epoch: 27, train_loss: 0.8555, test_loss: 0.9207, test_f1: 0.5163
 epoch: 28, train_loss: 0.8619, test_loss: 0.9128, test_f1: 0.5051
 epoch: 29, train_loss: 0.8463, test_loss: 0.8590, test_f1: 0.5895
 epoch: 30, train_loss: 0.8376, test_loss: 0.9069, test_f1: 0.5443
 epoch: 31, train_loss: 0.8191, test_loss: 0.8895, test_f1: 0.5558
 epoch: 32, train_loss: 0.8439, test_loss: 0.9263, test_f1: 0.5546
 epoch: 33, train_loss: 0.8202, test_loss: 0.8821, test_f1: 0.5968
 epoch: 34, train_loss: 0.8311, test_loss: 0.9977, test_f1: 0.5052
 epoch: 35, train_loss: 0.8306, test_loss: 0.9214, test_f1: 0.5787
 epoch: 36, train_loss: 0.8161, test_loss: 0.9938, test_f1: 0.4993
 epoch: 37, train_loss: 0.8099, test_loss: 0.8748, test_f1: 0.5480
 epoch: 38, train_loss: 0.8110, test_loss: 0.9125, test_f1: 0.5450
 epoch: 39, train_loss: 0.8101, test_loss: 0.9217, test_f1: 0.5490
 epoch: 40, train_loss: 0.8166, test_loss: 0.8649, test_f1: 0.5571
 epoch: 41, train_loss: 0.8274, test_loss: 0.8401, test_f1: 0.6024
 epoch: 42, train_loss: 0.7959, test_loss: 0.9075, test_f1: 0.5699
 epoch: 43, train_loss: 0.8293, test_loss: 0.9420, test_f1: 0.5160
 epoch: 44, train_loss: 0.8029, test_loss: 0.8934, test_f1: 0.5118
 epoch: 45, train_loss: 0.8042, test_loss: 0.8559, test_f1: 0.5491
 epoch: 46, train_loss: 0.8159, test_loss: 1.0542, test_f1: 0.4858
 epoch: 47, train_loss: 0.8093, test_loss: 0.8479, test_f1: 0.6076
 epoch: 48, train_loss: 0.7889, test_loss: 0.8760, test_f1: 0.5190
 epoch: 49, train_loss: 0.7967, test_loss: 0.8888, test_f1: 0.5515
 epoch: 50, train_loss: 0.7820, test_loss: 0.8735, test_f1: 0.5823
 epoch: 51, train_loss: 0.7701, test_loss: 0.8541, test_f1: 0.6046
 epoch: 52, train_loss: 0.7611, test_loss: 0.8512, test_f1: 0.5827
 epoch: 53, train_loss: 0.7585, test_loss: 0.8209, test_f1: 0.6245
 epoch: 54, train_loss: 0.7494, test_loss: 0.8094, test_f1: 0.5937
 epoch: 55, train_loss: 0.7442, test_loss: 0.8242, test_f1: 0.5781
 epoch: 56, train_loss: 0.7498, test_loss: 0.8381, test_f1: 0.5801
 epoch: 57, train_loss: 0.7410, test_loss: 0.8082, test_f1: 0.6009
 epoch: 58, train_loss: 0.7373, test_loss: 0.8767, test_f1: 0.5722
 epoch: 59, train_loss: 0.7421, test_loss: 0.8565, test_f1: 0.5817
 epoch: 60, train_loss: 0.7601, test_loss: 0.8212, test_f1: 0.5977
 epoch: 61, train_loss: 0.7502, test_loss: 0.8355, test_f1: 0.6051
 epoch: 62, train_loss: 0.7457, test_loss: 0.8521, test_f1: 0.6244
 epoch: 63, train_loss: 0.7180, test_loss: 0.8185, test_f1: 0.6136
 epoch: 64, train_loss: 0.7158, test_loss: 0.8180, test_f1: 0.6242
 epoch: 65, train_loss: 0.7297, test_loss: 0.8775, test_f1: 0.5822
 epoch: 66, train_loss: 0.7264, test_loss: 0.8256, test_f1: 0.6076
 epoch: 67, train_loss: 0.7323, test_loss: 0.8744, test_f1: 0.6070
 epoch: 68, train_loss: 0.7413, test_loss: 0.8625, test_f1: 0.5835
 epoch: 69, train_loss: 0.7234, test_loss: 0.8381, test_f1: 0.6233
 epoch: 70, train_loss: 0.7266, test_loss: 0.8215, test_f1: 0.6081
 epoch: 71, train_loss: 0.7220, test_loss: 0.7978, test_f1: 0.6308
 epoch: 72, train_loss: 0.7268, test_loss: 0.8070, test_f1: 0.6074
 epoch: 73, train_loss: 0.7255, test_loss: 0.8492, test_f1: 0.5947
 epoch: 74, train_loss: 0.7168, test_loss: 0.8326, test_f1: 0.6231
 epoch: 75, train_loss: 0.7314, test_loss: 0.8350, test_f1: 0.6146
 epoch: 76, train_loss: 0.7182, test_loss: 0.8429, test_f1: 0.6165
 epoch: 77, train_loss: 0.7267, test_loss: 0.8313, test_f1: 0.6052
 epoch: 78, train_loss: 0.7123, test_loss: 0.8383, test_f1: 0.6275
 epoch: 79, train_loss: 0.7168, test_loss: 0.8194, test_f1: 0.6039
 epoch: 80, train_loss: 0.7146, test_loss: 0.8250, test_f1: 0.6005
 epoch: 81, train_loss: 0.7160, test_loss: 0.8012, test_f1: 0.5902
 epoch: 82, train_loss: 0.7276, test_loss: 0.8311, test_f1: 0.5911
 epoch: 83, train_loss: 0.7104, test_loss: 0.8242, test_f1: 0.6107
 epoch: 84, train_loss: 0.7088, test_loss: 0.8538, test_f1: 0.6073
 epoch: 85, train_loss: 0.6962, test_loss: 0.8371, test_f1: 0.6282
 epoch: 86, train_loss: 0.7131, test_loss: 0.8057, test_f1: 0.6171
 epoch: 87, train_loss: 0.7132, test_loss: 0.8429, test_f1: 0.6175
 epoch: 88, train_loss: 0.6897, test_loss: 0.8518, test_f1: 0.6079
 epoch: 89, train_loss: 0.6941, test_loss: 0.8460, test_f1: 0.6103
 epoch: 90, train_loss: 0.7030, test_loss: 0.8437, test_f1: 0.5978
 epoch: 91, train_loss: 0.7252, test_loss: 0.8363, test_f1: 0.5935
 epoch: 92, train_loss: 0.7040, test_loss: 0.8381, test_f1: 0.6112
 epoch: 93, train_loss: 0.7108, test_loss: 0.8566, test_f1: 0.5935
 epoch: 94, train_loss: 0.7009, test_loss: 0.8515, test_f1: 0.5852
 epoch: 95, train_loss: 0.6960, test_loss: 0.7895, test_f1: 0.6265
 epoch: 96, train_loss: 0.7020, test_loss: 0.8195, test_f1: 0.6302
 epoch: 97, train_loss: 0.7065, test_loss: 0.8328, test_f1: 0.6068
 epoch: 98, train_loss: 0.7016, test_loss: 0.8698, test_f1: 0.5895
 epoch: 99, train_loss: 0.7093, test_loss: 0.8246, test_f1: 0.6014
##################ITERATION #5 ****************************************
 epoch: 0, train_loss: 1.1315, test_loss: 1.0762, test_f1: 0.3968
 epoch: 1, train_loss: 1.0201, test_loss: 1.0299, test_f1: 0.4705
 epoch: 2, train_loss: 1.0025, test_loss: 1.0376, test_f1: 0.4666
 epoch: 3, train_loss: 0.9917, test_loss: 1.0127, test_f1: 0.4649
 epoch: 4, train_loss: 0.9777, test_loss: 1.0491, test_f1: 0.4420
 epoch: 5, train_loss: 0.9642, test_loss: 1.0640, test_f1: 0.4559
 epoch: 6, train_loss: 0.9580, test_loss: 1.0345, test_f1: 0.4707
 epoch: 7, train_loss: 0.9431, test_loss: 1.0295, test_f1: 0.5020
 epoch: 8, train_loss: 0.9427, test_loss: 0.9872, test_f1: 0.5032
 epoch: 9, train_loss: 0.9262, test_loss: 0.9344, test_f1: 0.5405
 epoch: 10, train_loss: 0.9290, test_loss: 1.0190, test_f1: 0.4649
 epoch: 11, train_loss: 0.9121, test_loss: 1.0675, test_f1: 0.4801
 epoch: 12, train_loss: 0.9131, test_loss: 0.8693, test_f1: 0.5287
 epoch: 13, train_loss: 0.8912, test_loss: 0.9047, test_f1: 0.5289
 epoch: 14, train_loss: 0.8837, test_loss: 0.9546, test_f1: 0.4882
 epoch: 15, train_loss: 0.8715, test_loss: 0.9948, test_f1: 0.4731
 epoch: 16, train_loss: 0.8798, test_loss: 0.8918, test_f1: 0.5729
 epoch: 17, train_loss: 0.8718, test_loss: 0.9340, test_f1: 0.4992
 epoch: 18, train_loss: 0.9025, test_loss: 1.1295, test_f1: 0.4503
 epoch: 19, train_loss: 0.8747, test_loss: 0.8774, test_f1: 0.5440
 epoch: 20, train_loss: 0.8542, test_loss: 0.9200, test_f1: 0.5253
 epoch: 21, train_loss: 0.8539, test_loss: 0.9338, test_f1: 0.5116
 epoch: 22, train_loss: 0.8700, test_loss: 0.8801, test_f1: 0.5783
 epoch: 23, train_loss: 0.8559, test_loss: 0.8943, test_f1: 0.5367
 epoch: 24, train_loss: 0.8465, test_loss: 0.8003, test_f1: 0.5762
 epoch: 25, train_loss: 0.8539, test_loss: 0.8161, test_f1: 0.5528
 epoch: 26, train_loss: 0.8581, test_loss: 0.8212, test_f1: 0.5582
 epoch: 27, train_loss: 0.8443, test_loss: 0.8749, test_f1: 0.5525
 epoch: 28, train_loss: 0.8361, test_loss: 0.8731, test_f1: 0.5142
 epoch: 29, train_loss: 0.8391, test_loss: 0.8405, test_f1: 0.6036
 epoch: 30, train_loss: 0.8281, test_loss: 0.8915, test_f1: 0.5738
 epoch: 31, train_loss: 0.8365, test_loss: 0.9173, test_f1: 0.5464
 epoch: 32, train_loss: 0.8448, test_loss: 0.9253, test_f1: 0.5700
 epoch: 33, train_loss: 0.8502, test_loss: 0.7900, test_f1: 0.5893
 epoch: 34, train_loss: 0.8290, test_loss: 0.9460, test_f1: 0.5482
 epoch: 35, train_loss: 0.8307, test_loss: 1.0218, test_f1: 0.5206
 epoch: 36, train_loss: 0.8196, test_loss: 0.9763, test_f1: 0.5376
 epoch: 37, train_loss: 0.8207, test_loss: 0.8470, test_f1: 0.5860
 epoch: 38, train_loss: 0.8010, test_loss: 0.9393, test_f1: 0.5574
 epoch: 39, train_loss: 0.8192, test_loss: 0.8762, test_f1: 0.5894
 epoch: 40, train_loss: 0.8094, test_loss: 0.9981, test_f1: 0.5450
 epoch: 41, train_loss: 0.8154, test_loss: 0.8703, test_f1: 0.5880
 epoch: 42, train_loss: 0.8066, test_loss: 0.8949, test_f1: 0.5535
 epoch: 43, train_loss: 0.7907, test_loss: 0.8095, test_f1: 0.5831
 epoch: 44, train_loss: 0.8039, test_loss: 0.9439, test_f1: 0.5454
 epoch: 45, train_loss: 0.7980, test_loss: 0.8183, test_f1: 0.5913
 epoch: 46, train_loss: 0.7845, test_loss: 0.8240, test_f1: 0.5989
 epoch: 47, train_loss: 0.7879, test_loss: 0.8455, test_f1: 0.5899
 epoch: 48, train_loss: 0.7700, test_loss: 0.8226, test_f1: 0.5986
 epoch: 49, train_loss: 0.7883, test_loss: 0.9232, test_f1: 0.5467
 epoch: 50, train_loss: 0.7945, test_loss: 0.7899, test_f1: 0.6348
 epoch: 51, train_loss: 0.7648, test_loss: 0.8292, test_f1: 0.6130
 epoch: 52, train_loss: 0.7711, test_loss: 0.8113, test_f1: 0.6259
 epoch: 53, train_loss: 0.7619, test_loss: 0.8011, test_f1: 0.6033
 epoch: 54, train_loss: 0.7523, test_loss: 0.7977, test_f1: 0.6259
 epoch: 55, train_loss: 0.7319, test_loss: 0.8167, test_f1: 0.6170
 epoch: 56, train_loss: 0.7441, test_loss: 0.7915, test_f1: 0.6340
 epoch: 57, train_loss: 0.7421, test_loss: 0.8102, test_f1: 0.6192
 epoch: 58, train_loss: 0.7434, test_loss: 0.8094, test_f1: 0.6317
 epoch: 59, train_loss: 0.7388, test_loss: 0.8180, test_f1: 0.6041
 epoch: 60, train_loss: 0.7303, test_loss: 0.7790, test_f1: 0.6294
 epoch: 61, train_loss: 0.7247, test_loss: 0.7823, test_f1: 0.6504
 epoch: 62, train_loss: 0.7207, test_loss: 0.7877, test_f1: 0.6338
 epoch: 63, train_loss: 0.7219, test_loss: 0.7999, test_f1: 0.6146
 epoch: 64, train_loss: 0.7251, test_loss: 0.8068, test_f1: 0.6439
 epoch: 65, train_loss: 0.7241, test_loss: 0.8442, test_f1: 0.6106
 epoch: 66, train_loss: 0.7261, test_loss: 0.7373, test_f1: 0.6198
 epoch: 67, train_loss: 0.7380, test_loss: 0.8671, test_f1: 0.5832
 epoch: 68, train_loss: 0.7151, test_loss: 0.7539, test_f1: 0.6374
 epoch: 69, train_loss: 0.7345, test_loss: 0.7668, test_f1: 0.6317
 epoch: 70, train_loss: 0.7381, test_loss: 0.7674, test_f1: 0.6423
 epoch: 71, train_loss: 0.7378, test_loss: 0.8895, test_f1: 0.5803
 epoch: 72, train_loss: 0.7317, test_loss: 0.7699, test_f1: 0.6234
 epoch: 73, train_loss: 0.7088, test_loss: 0.7645, test_f1: 0.6370
 epoch: 74, train_loss: 0.7101, test_loss: 0.7504, test_f1: 0.6460
 epoch: 75, train_loss: 0.7235, test_loss: 0.7585, test_f1: 0.6503
 epoch: 76, train_loss: 0.7154, test_loss: 0.7884, test_f1: 0.6284
 epoch: 77, train_loss: 0.7076, test_loss: 0.7787, test_f1: 0.6367
 epoch: 78, train_loss: 0.7018, test_loss: 0.7956, test_f1: 0.6172
 epoch: 79, train_loss: 0.7142, test_loss: 0.7906, test_f1: 0.6424
 epoch: 80, train_loss: 0.7155, test_loss: 0.8396, test_f1: 0.6224
 epoch: 81, train_loss: 0.7116, test_loss: 0.8095, test_f1: 0.6281
 epoch: 82, train_loss: 0.7076, test_loss: 0.7786, test_f1: 0.6453
 epoch: 83, train_loss: 0.7088, test_loss: 0.7698, test_f1: 0.6139
 epoch: 84, train_loss: 0.7025, test_loss: 0.8797, test_f1: 0.5817
 epoch: 85, train_loss: 0.7149, test_loss: 0.7517, test_f1: 0.6377
 epoch: 86, train_loss: 0.7059, test_loss: 0.8287, test_f1: 0.6171
 epoch: 87, train_loss: 0.6930, test_loss: 0.8096, test_f1: 0.6267
 epoch: 88, train_loss: 0.6936, test_loss: 0.8223, test_f1: 0.6257
 epoch: 89, train_loss: 0.6964, test_loss: 0.7869, test_f1: 0.6162
 epoch: 90, train_loss: 0.6966, test_loss: 0.8042, test_f1: 0.6371
 epoch: 91, train_loss: 0.7026, test_loss: 0.7263, test_f1: 0.6520
 epoch: 92, train_loss: 0.6874, test_loss: 0.7271, test_f1: 0.6794
 epoch: 93, train_loss: 0.6936, test_loss: 0.9510, test_f1: 0.5882
 epoch: 94, train_loss: 0.7014, test_loss: 0.8128, test_f1: 0.6152
 epoch: 95, train_loss: 0.6905, test_loss: 0.7889, test_f1: 0.6408
 epoch: 96, train_loss: 0.6873, test_loss: 0.7781, test_f1: 0.6419
 epoch: 97, train_loss: 0.6972, test_loss: 0.7920, test_f1: 0.6179
 epoch: 98, train_loss: 0.6917, test_loss: 0.7927, test_f1: 0.6212
 epoch: 99, train_loss: 0.6899, test_loss: 0.7934, test_f1: 0.6534
##################ITERATION #6 ****************************************
 epoch: 0, train_loss: 1.1430, test_loss: 0.9988, test_f1: 0.5339
 epoch: 1, train_loss: 1.0174, test_loss: 1.0065, test_f1: 0.4825
 epoch: 2, train_loss: 0.9938, test_loss: 1.0525, test_f1: 0.4331
 epoch: 3, train_loss: 0.9817, test_loss: 0.9684, test_f1: 0.4828
 epoch: 4, train_loss: 0.9750, test_loss: 1.0341, test_f1: 0.4914
 epoch: 5, train_loss: 0.9804, test_loss: 1.2544, test_f1: 0.4405
 epoch: 6, train_loss: 0.9713, test_loss: 1.0229, test_f1: 0.4913
 epoch: 7, train_loss: 0.9633, test_loss: 1.0617, test_f1: 0.4811
 epoch: 8, train_loss: 0.9560, test_loss: 0.9676, test_f1: 0.4696
 epoch: 9, train_loss: 0.9394, test_loss: 1.0966, test_f1: 0.4615
 epoch: 10, train_loss: 0.9380, test_loss: 0.9098, test_f1: 0.4759
 epoch: 11, train_loss: 0.9239, test_loss: 1.0086, test_f1: 0.4682
 epoch: 12, train_loss: 0.9215, test_loss: 0.9233, test_f1: 0.5096
 epoch: 13, train_loss: 0.9066, test_loss: 0.9921, test_f1: 0.5283
 epoch: 14, train_loss: 0.9022, test_loss: 0.9113, test_f1: 0.5072
 epoch: 15, train_loss: 0.8985, test_loss: 0.9253, test_f1: 0.5613
 epoch: 16, train_loss: 0.9002, test_loss: 0.9169, test_f1: 0.5274
 epoch: 17, train_loss: 0.8907, test_loss: 0.9619, test_f1: 0.4982
 epoch: 18, train_loss: 0.8943, test_loss: 1.0597, test_f1: 0.5030
 epoch: 19, train_loss: 0.8890, test_loss: 0.8572, test_f1: 0.4993
 epoch: 20, train_loss: 0.8702, test_loss: 0.8525, test_f1: 0.5356
 epoch: 21, train_loss: 0.8758, test_loss: 0.8998, test_f1: 0.5509
 epoch: 22, train_loss: 0.8673, test_loss: 0.8380, test_f1: 0.5372
 epoch: 23, train_loss: 0.8670, test_loss: 0.8978, test_f1: 0.5335
 epoch: 24, train_loss: 0.8730, test_loss: 0.9062, test_f1: 0.5720
 epoch: 25, train_loss: 0.8603, test_loss: 0.9836, test_f1: 0.5362
 epoch: 26, train_loss: 0.8616, test_loss: 0.9338, test_f1: 0.5038
 epoch: 27, train_loss: 0.8413, test_loss: 0.9901, test_f1: 0.5229
 epoch: 28, train_loss: 0.8516, test_loss: 0.9202, test_f1: 0.5242
 epoch: 29, train_loss: 0.8456, test_loss: 0.9400, test_f1: 0.5073
 epoch: 30, train_loss: 0.8390, test_loss: 0.9064, test_f1: 0.5438
 epoch: 31, train_loss: 0.8448, test_loss: 0.8732, test_f1: 0.5373
 epoch: 32, train_loss: 0.8512, test_loss: 0.9830, test_f1: 0.5681
 epoch: 33, train_loss: 0.8543, test_loss: 1.5401, test_f1: 0.3885
 epoch: 34, train_loss: 0.8302, test_loss: 0.8608, test_f1: 0.5771
 epoch: 35, train_loss: 0.8235, test_loss: 0.8815, test_f1: 0.5567
 epoch: 36, train_loss: 0.8189, test_loss: 0.8117, test_f1: 0.5705
 epoch: 37, train_loss: 0.8162, test_loss: 0.8160, test_f1: 0.6066
 epoch: 38, train_loss: 0.8284, test_loss: 0.8784, test_f1: 0.5079
 epoch: 39, train_loss: 0.8446, test_loss: 0.8688, test_f1: 0.5589
 epoch: 40, train_loss: 0.8222, test_loss: 0.8387, test_f1: 0.5847
 epoch: 41, train_loss: 0.8203, test_loss: 0.8451, test_f1: 0.5848
 epoch: 42, train_loss: 0.8161, test_loss: 0.8133, test_f1: 0.5867
 epoch: 43, train_loss: 0.8143, test_loss: 0.8190, test_f1: 0.5926
 epoch: 44, train_loss: 0.8179, test_loss: 0.8472, test_f1: 0.6294
 epoch: 45, train_loss: 0.8016, test_loss: 0.8721, test_f1: 0.5492
 epoch: 46, train_loss: 0.7978, test_loss: 0.8513, test_f1: 0.5837
 epoch: 47, train_loss: 0.7902, test_loss: 0.8241, test_f1: 0.6015
 epoch: 48, train_loss: 0.7801, test_loss: 0.8677, test_f1: 0.5658
 epoch: 49, train_loss: 0.7979, test_loss: 0.8388, test_f1: 0.5939
 epoch: 50, train_loss: 0.8118, test_loss: 0.8539, test_f1: 0.5941
 epoch: 51, train_loss: 0.7773, test_loss: 0.8094, test_f1: 0.6359
 epoch: 52, train_loss: 0.7750, test_loss: 0.8081, test_f1: 0.6255
 epoch: 53, train_loss: 0.7613, test_loss: 0.8167, test_f1: 0.6066
 epoch: 54, train_loss: 0.7566, test_loss: 0.8008, test_f1: 0.6296
 epoch: 55, train_loss: 0.7522, test_loss: 0.8058, test_f1: 0.5951
 epoch: 56, train_loss: 0.7442, test_loss: 0.7987, test_f1: 0.6305
 epoch: 57, train_loss: 0.7531, test_loss: 0.8448, test_f1: 0.6301
 epoch: 58, train_loss: 0.7475, test_loss: 0.8155, test_f1: 0.6221
 epoch: 59, train_loss: 0.7402, test_loss: 0.8098, test_f1: 0.6359
 epoch: 60, train_loss: 0.7590, test_loss: 0.8010, test_f1: 0.6038
 epoch: 61, train_loss: 0.7484, test_loss: 0.7810, test_f1: 0.5870
 epoch: 62, train_loss: 0.7316, test_loss: 0.8551, test_f1: 0.6204
 epoch: 63, train_loss: 0.7329, test_loss: 0.8150, test_f1: 0.6480
 epoch: 64, train_loss: 0.7365, test_loss: 0.7943, test_f1: 0.6159
 epoch: 65, train_loss: 0.7277, test_loss: 0.8412, test_f1: 0.6374
 epoch: 66, train_loss: 0.7295, test_loss: 0.8073, test_f1: 0.6066
 epoch: 67, train_loss: 0.7302, test_loss: 0.8568, test_f1: 0.6479
 epoch: 68, train_loss: 0.7298, test_loss: 0.8432, test_f1: 0.5956
 epoch: 69, train_loss: 0.7446, test_loss: 0.8463, test_f1: 0.6075
 epoch: 70, train_loss: 0.7279, test_loss: 0.8341, test_f1: 0.6062
 epoch: 71, train_loss: 0.7255, test_loss: 0.8525, test_f1: 0.5985
 epoch: 72, train_loss: 0.7211, test_loss: 0.7948, test_f1: 0.6240
 epoch: 73, train_loss: 0.7236, test_loss: 0.8118, test_f1: 0.6296
 epoch: 74, train_loss: 0.7023, test_loss: 0.9682, test_f1: 0.5879
 epoch: 75, train_loss: 0.7448, test_loss: 0.8813, test_f1: 0.5808
 epoch: 76, train_loss: 0.7442, test_loss: 0.8405, test_f1: 0.5957
 epoch: 77, train_loss: 0.7282, test_loss: 0.8407, test_f1: 0.6192
 epoch: 78, train_loss: 0.7257, test_loss: 0.8143, test_f1: 0.6243
 epoch: 79, train_loss: 0.7288, test_loss: 0.8203, test_f1: 0.6393
 epoch: 80, train_loss: 0.7106, test_loss: 0.8515, test_f1: 0.6189
 epoch: 81, train_loss: 0.7168, test_loss: 0.8826, test_f1: 0.6235
 epoch: 82, train_loss: 0.7058, test_loss: 0.8680, test_f1: 0.6228
 epoch: 83, train_loss: 0.7191, test_loss: 0.9920, test_f1: 0.6090
 epoch: 84, train_loss: 0.7145, test_loss: 0.8363, test_f1: 0.6163
 epoch: 85, train_loss: 0.7112, test_loss: 0.8566, test_f1: 0.5935
 epoch: 86, train_loss: 0.7091, test_loss: 0.8578, test_f1: 0.5709
 epoch: 87, train_loss: 0.7076, test_loss: 0.9233, test_f1: 0.5978
 epoch: 88, train_loss: 0.7070, test_loss: 0.8368, test_f1: 0.6175
 epoch: 89, train_loss: 0.7037, test_loss: 0.8471, test_f1: 0.6494
 epoch: 90, train_loss: 0.7214, test_loss: 0.9048, test_f1: 0.6178
 epoch: 91, train_loss: 0.7091, test_loss: 0.8841, test_f1: 0.6102
 epoch: 92, train_loss: 0.7061, test_loss: 0.8563, test_f1: 0.6395
 epoch: 93, train_loss: 0.6927, test_loss: 0.8730, test_f1: 0.6210
 epoch: 94, train_loss: 0.6932, test_loss: 0.7970, test_f1: 0.6336
 epoch: 95, train_loss: 0.7060, test_loss: 0.8856, test_f1: 0.6333
 epoch: 96, train_loss: 0.6905, test_loss: 0.8667, test_f1: 0.6359
 epoch: 97, train_loss: 0.6726, test_loss: 0.8591, test_f1: 0.6240
 epoch: 98, train_loss: 0.6876, test_loss: 0.8666, test_f1: 0.6191
 epoch: 99, train_loss: 0.6811, test_loss: 0.8893, test_f1: 0.6226
##################ITERATION #7 ****************************************
 epoch: 0, train_loss: 1.1148, test_loss: 1.1398, test_f1: 0.3699
 epoch: 1, train_loss: 1.0345, test_loss: 1.0511, test_f1: 0.4540
 epoch: 2, train_loss: 0.9950, test_loss: 1.0304, test_f1: 0.4715
 epoch: 3, train_loss: 0.9849, test_loss: 0.9697, test_f1: 0.4594
 epoch: 4, train_loss: 0.9853, test_loss: 1.0095, test_f1: 0.4727
 epoch: 5, train_loss: 0.9706, test_loss: 0.9882, test_f1: 0.5356
 epoch: 6, train_loss: 0.9596, test_loss: 1.0274, test_f1: 0.5134
 epoch: 7, train_loss: 0.9472, test_loss: 0.9737, test_f1: 0.4972
 epoch: 8, train_loss: 0.9896, test_loss: 1.0054, test_f1: 0.5095
 epoch: 9, train_loss: 0.9580, test_loss: 0.9732, test_f1: 0.5424
 epoch: 10, train_loss: 0.9617, test_loss: 0.9736, test_f1: 0.5515
 epoch: 11, train_loss: 0.9355, test_loss: 1.2150, test_f1: 0.3997
 epoch: 12, train_loss: 0.9265, test_loss: 0.9619, test_f1: 0.5431
 epoch: 13, train_loss: 0.9041, test_loss: 0.9986, test_f1: 0.4905
 epoch: 14, train_loss: 0.8967, test_loss: 1.0225, test_f1: 0.5208
 epoch: 15, train_loss: 0.8825, test_loss: 0.9201, test_f1: 0.5622
 epoch: 16, train_loss: 0.8732, test_loss: 1.1290, test_f1: 0.4731
 epoch: 17, train_loss: 0.8983, test_loss: 0.9224, test_f1: 0.5203
 epoch: 18, train_loss: 0.8633, test_loss: 1.0410, test_f1: 0.4946
 epoch: 19, train_loss: 0.8646, test_loss: 0.9276, test_f1: 0.5359
 epoch: 20, train_loss: 0.8661, test_loss: 0.8224, test_f1: 0.5695
 epoch: 21, train_loss: 0.9009, test_loss: 0.9946, test_f1: 0.5462
 epoch: 22, train_loss: 0.8780, test_loss: 0.9733, test_f1: 0.5320
 epoch: 23, train_loss: 0.8484, test_loss: 0.8409, test_f1: 0.5752
 epoch: 24, train_loss: 0.8534, test_loss: 0.9171, test_f1: 0.5191
 epoch: 25, train_loss: 0.8473, test_loss: 0.9066, test_f1: 0.5539
 epoch: 26, train_loss: 0.8453, test_loss: 0.8727, test_f1: 0.5629
 epoch: 27, train_loss: 0.8359, test_loss: 0.9109, test_f1: 0.5884
 epoch: 28, train_loss: 0.8408, test_loss: 0.8479, test_f1: 0.5981
 epoch: 29, train_loss: 0.8288, test_loss: 0.7759, test_f1: 0.6061
 epoch: 30, train_loss: 0.8369, test_loss: 0.8127, test_f1: 0.6026
 epoch: 31, train_loss: 0.8210, test_loss: 0.9129, test_f1: 0.5276
 epoch: 32, train_loss: 0.8324, test_loss: 0.8691, test_f1: 0.5777
 epoch: 33, train_loss: 0.8144, test_loss: 0.7885, test_f1: 0.6257
 epoch: 34, train_loss: 0.8042, test_loss: 0.8402, test_f1: 0.5755
 epoch: 35, train_loss: 0.8213, test_loss: 0.8521, test_f1: 0.5980
 epoch: 36, train_loss: 0.8001, test_loss: 0.8350, test_f1: 0.5615
 epoch: 37, train_loss: 0.8065, test_loss: 0.7475, test_f1: 0.6183
 epoch: 38, train_loss: 0.7998, test_loss: 0.8036, test_f1: 0.6051
 epoch: 39, train_loss: 0.7694, test_loss: 0.7731, test_f1: 0.5887
 epoch: 40, train_loss: 0.7993, test_loss: 0.8986, test_f1: 0.5664
 epoch: 41, train_loss: 0.8008, test_loss: 0.7716, test_f1: 0.6016
 epoch: 42, train_loss: 0.7976, test_loss: 0.7929, test_f1: 0.6174
 epoch: 43, train_loss: 0.7858, test_loss: 0.7702, test_f1: 0.5983
 epoch: 44, train_loss: 0.7736, test_loss: 0.7706, test_f1: 0.6155
 epoch: 45, train_loss: 0.7744, test_loss: 0.7771, test_f1: 0.6194
 epoch: 46, train_loss: 0.8002, test_loss: 0.7956, test_f1: 0.5584
 epoch: 47, train_loss: 0.7905, test_loss: 0.8188, test_f1: 0.5712
 epoch: 48, train_loss: 0.7752, test_loss: 0.7470, test_f1: 0.6458
 epoch: 49, train_loss: 0.7688, test_loss: 0.8987, test_f1: 0.5518
 epoch: 50, train_loss: 0.7665, test_loss: 0.7295, test_f1: 0.6350
 epoch: 51, train_loss: 0.7375, test_loss: 0.7489, test_f1: 0.6327
 epoch: 52, train_loss: 0.7515, test_loss: 0.7405, test_f1: 0.6215
 epoch: 53, train_loss: 0.7314, test_loss: 0.7714, test_f1: 0.6401
 epoch: 54, train_loss: 0.7217, test_loss: 0.7053, test_f1: 0.6745
 epoch: 55, train_loss: 0.7305, test_loss: 0.7243, test_f1: 0.6397
 epoch: 56, train_loss: 0.7192, test_loss: 0.7087, test_f1: 0.6250
 epoch: 57, train_loss: 0.7178, test_loss: 0.7107, test_f1: 0.6565
 epoch: 58, train_loss: 0.7222, test_loss: 0.7093, test_f1: 0.6443
 epoch: 59, train_loss: 0.7327, test_loss: 0.7476, test_f1: 0.6016
 epoch: 60, train_loss: 0.7103, test_loss: 0.7111, test_f1: 0.6536
 epoch: 61, train_loss: 0.7062, test_loss: 0.7453, test_f1: 0.6623
 epoch: 62, train_loss: 0.7036, test_loss: 0.7614, test_f1: 0.6449
 epoch: 63, train_loss: 0.7288, test_loss: 0.7105, test_f1: 0.6422
 epoch: 64, train_loss: 0.7329, test_loss: 0.7482, test_f1: 0.6388
 epoch: 65, train_loss: 0.7285, test_loss: 0.8403, test_f1: 0.6070
 epoch: 66, train_loss: 0.7132, test_loss: 0.7754, test_f1: 0.6496
 epoch: 67, train_loss: 0.7098, test_loss: 0.7414, test_f1: 0.6407
 epoch: 68, train_loss: 0.7048, test_loss: 0.7592, test_f1: 0.6353
 epoch: 69, train_loss: 0.7003, test_loss: 0.7207, test_f1: 0.6398
 epoch: 70, train_loss: 0.6926, test_loss: 0.7413, test_f1: 0.6417
 epoch: 71, train_loss: 0.6986, test_loss: 0.8114, test_f1: 0.6225
 epoch: 72, train_loss: 0.6997, test_loss: 0.7831, test_f1: 0.6393
 epoch: 73, train_loss: 0.7145, test_loss: 0.7853, test_f1: 0.6287
 epoch: 74, train_loss: 0.6851, test_loss: 0.7694, test_f1: 0.6459
 epoch: 75, train_loss: 0.7021, test_loss: 0.7679, test_f1: 0.6453
 epoch: 76, train_loss: 0.6868, test_loss: 0.7254, test_f1: 0.6261
 epoch: 77, train_loss: 0.6904, test_loss: 0.7269, test_f1: 0.6687
 epoch: 78, train_loss: 0.7078, test_loss: 0.7069, test_f1: 0.6893
 epoch: 79, train_loss: 0.6860, test_loss: 0.7659, test_f1: 0.6225
 epoch: 80, train_loss: 0.6882, test_loss: 0.7788, test_f1: 0.6356
 epoch: 81, train_loss: 0.6980, test_loss: 0.7447, test_f1: 0.6544
 epoch: 82, train_loss: 0.6889, test_loss: 0.6828, test_f1: 0.6783
 epoch: 83, train_loss: 0.6954, test_loss: 0.7376, test_f1: 0.6605
 epoch: 84, train_loss: 0.7019, test_loss: 0.7142, test_f1: 0.6514
 epoch: 85, train_loss: 0.6957, test_loss: 0.6909, test_f1: 0.6806
 epoch: 86, train_loss: 0.6906, test_loss: 0.7161, test_f1: 0.6516
 epoch: 87, train_loss: 0.6922, test_loss: 0.6904, test_f1: 0.6730
 epoch: 88, train_loss: 0.6802, test_loss: 0.7356, test_f1: 0.6412
 epoch: 89, train_loss: 0.6822, test_loss: 0.7309, test_f1: 0.6274
 epoch: 90, train_loss: 0.6804, test_loss: 0.7294, test_f1: 0.6608
 epoch: 91, train_loss: 0.6704, test_loss: 0.6964, test_f1: 0.6695
 epoch: 92, train_loss: 0.6702, test_loss: 0.7351, test_f1: 0.6632
 epoch: 93, train_loss: 0.6919, test_loss: 0.6818, test_f1: 0.6805
 epoch: 94, train_loss: 0.6627, test_loss: 0.6959, test_f1: 0.6691
 epoch: 95, train_loss: 0.6719, test_loss: 0.6993, test_f1: 0.6769
 epoch: 96, train_loss: 0.6687, test_loss: 0.7757, test_f1: 0.6331
 epoch: 97, train_loss: 0.6793, test_loss: 0.7222, test_f1: 0.6492
 epoch: 98, train_loss: 0.6720, test_loss: 0.6853, test_f1: 0.6879
 epoch: 99, train_loss: 0.6717, test_loss: 0.7796, test_f1: 0.6555
##################ITERATION #8 ****************************************
 epoch: 0, train_loss: 1.1493, test_loss: 1.0655, test_f1: 0.4403
 epoch: 1, train_loss: 1.0205, test_loss: 0.9815, test_f1: 0.4738
 epoch: 2, train_loss: 1.0209, test_loss: 1.0084, test_f1: 0.4860
 epoch: 3, train_loss: 0.9960, test_loss: 1.0441, test_f1: 0.4908
 epoch: 4, train_loss: 0.9877, test_loss: 1.0159, test_f1: 0.4724
 epoch: 5, train_loss: 0.9685, test_loss: 1.0097, test_f1: 0.5095
 epoch: 6, train_loss: 0.9564, test_loss: 0.9643, test_f1: 0.4813
 epoch: 7, train_loss: 0.9537, test_loss: 0.9940, test_f1: 0.4719
 epoch: 8, train_loss: 0.9633, test_loss: 0.9810, test_f1: 0.4853
 epoch: 9, train_loss: 0.9356, test_loss: 0.9809, test_f1: 0.5021
 epoch: 10, train_loss: 0.9400, test_loss: 0.9964, test_f1: 0.4820
 epoch: 11, train_loss: 0.9454, test_loss: 0.9372, test_f1: 0.4514
 epoch: 12, train_loss: 0.9488, test_loss: 1.0018, test_f1: 0.4488
 epoch: 13, train_loss: 0.9817, test_loss: 0.9038, test_f1: 0.4960
 epoch: 14, train_loss: 0.9340, test_loss: 0.9635, test_f1: 0.5031
 epoch: 15, train_loss: 0.9285, test_loss: 0.8748, test_f1: 0.5195
 epoch: 16, train_loss: 0.9233, test_loss: 1.1112, test_f1: 0.4610
 epoch: 17, train_loss: 0.9050, test_loss: 0.9578, test_f1: 0.5229
 epoch: 18, train_loss: 0.8974, test_loss: 0.9625, test_f1: 0.5053
 epoch: 19, train_loss: 0.9039, test_loss: 0.8944, test_f1: 0.5011
 epoch: 20, train_loss: 0.9041, test_loss: 0.9796, test_f1: 0.4828
 epoch: 21, train_loss: 0.9016, test_loss: 0.8954, test_f1: 0.4954
 epoch: 22, train_loss: 0.8883, test_loss: 0.9090, test_f1: 0.5122
 epoch: 23, train_loss: 0.8877, test_loss: 0.9410, test_f1: 0.4959
 epoch: 24, train_loss: 0.8932, test_loss: 0.8477, test_f1: 0.5122
 epoch: 25, train_loss: 0.8878, test_loss: 0.9397, test_f1: 0.5449
 epoch: 26, train_loss: 0.8684, test_loss: 0.8942, test_f1: 0.5290
 epoch: 27, train_loss: 0.8677, test_loss: 0.9146, test_f1: 0.5674
 epoch: 28, train_loss: 0.8684, test_loss: 0.9193, test_f1: 0.5198
 epoch: 29, train_loss: 0.8775, test_loss: 0.8968, test_f1: 0.5447
 epoch: 30, train_loss: 0.8749, test_loss: 0.8484, test_f1: 0.5123
 epoch: 31, train_loss: 0.8631, test_loss: 1.1186, test_f1: 0.4011
 epoch: 32, train_loss: 0.8495, test_loss: 1.0183, test_f1: 0.5434
 epoch: 33, train_loss: 0.8660, test_loss: 0.8797, test_f1: 0.5287
 epoch: 34, train_loss: 0.8550, test_loss: 0.8879, test_f1: 0.5421
 epoch: 35, train_loss: 0.8542, test_loss: 0.8616, test_f1: 0.5712
 epoch: 36, train_loss: 0.8487, test_loss: 0.8255, test_f1: 0.5421
 epoch: 37, train_loss: 0.8439, test_loss: 1.0794, test_f1: 0.4778
 epoch: 38, train_loss: 0.8561, test_loss: 0.8675, test_f1: 0.5268
 epoch: 39, train_loss: 0.8507, test_loss: 0.8177, test_f1: 0.5291
 epoch: 40, train_loss: 0.8407, test_loss: 0.8771, test_f1: 0.5459
 epoch: 41, train_loss: 0.8244, test_loss: 0.8411, test_f1: 0.5378
 epoch: 42, train_loss: 0.8344, test_loss: 0.9116, test_f1: 0.5519
 epoch: 43, train_loss: 0.8333, test_loss: 0.8655, test_f1: 0.5388
 epoch: 44, train_loss: 0.8388, test_loss: 0.8870, test_f1: 0.5193
 epoch: 45, train_loss: 0.8350, test_loss: 0.9197, test_f1: 0.5465
 epoch: 46, train_loss: 0.8244, test_loss: 0.7699, test_f1: 0.6222
 epoch: 47, train_loss: 0.8229, test_loss: 0.8152, test_f1: 0.5664
 epoch: 48, train_loss: 0.8120, test_loss: 0.7868, test_f1: 0.5992
 epoch: 49, train_loss: 0.8247, test_loss: 0.8036, test_f1: 0.5740
 epoch: 50, train_loss: 0.8243, test_loss: 0.8794, test_f1: 0.5806
 epoch: 51, train_loss: 0.7988, test_loss: 0.7780, test_f1: 0.5905
 epoch: 52, train_loss: 0.7898, test_loss: 0.7980, test_f1: 0.5581
 epoch: 53, train_loss: 0.7872, test_loss: 0.8341, test_f1: 0.5972
 epoch: 54, train_loss: 0.7899, test_loss: 0.7945, test_f1: 0.5643
 epoch: 55, train_loss: 0.7777, test_loss: 0.7837, test_f1: 0.5994
 epoch: 56, train_loss: 0.7850, test_loss: 0.7697, test_f1: 0.6017
 epoch: 57, train_loss: 0.7776, test_loss: 0.8008, test_f1: 0.6039
 epoch: 58, train_loss: 0.7846, test_loss: 0.8585, test_f1: 0.6103
 epoch: 59, train_loss: 0.7750, test_loss: 0.8481, test_f1: 0.5976
 epoch: 60, train_loss: 0.7763, test_loss: 0.7656, test_f1: 0.6101
 epoch: 61, train_loss: 0.7835, test_loss: 0.8013, test_f1: 0.5805
 epoch: 62, train_loss: 0.7687, test_loss: 0.8296, test_f1: 0.5946
 epoch: 63, train_loss: 0.7797, test_loss: 0.7976, test_f1: 0.5849
 epoch: 64, train_loss: 0.7824, test_loss: 0.7576, test_f1: 0.6290
 epoch: 65, train_loss: 0.7862, test_loss: 0.8776, test_f1: 0.5922
 epoch: 66, train_loss: 0.7751, test_loss: 0.7717, test_f1: 0.6079
 epoch: 67, train_loss: 0.7575, test_loss: 0.7680, test_f1: 0.5839
 epoch: 68, train_loss: 0.7464, test_loss: 0.7616, test_f1: 0.6174
 epoch: 69, train_loss: 0.7561, test_loss: 0.8528, test_f1: 0.6081
 epoch: 70, train_loss: 0.7680, test_loss: 0.8984, test_f1: 0.5706
 epoch: 71, train_loss: 0.7751, test_loss: 0.7504, test_f1: 0.6393
 epoch: 72, train_loss: 0.7565, test_loss: 0.7978, test_f1: 0.5705
 epoch: 73, train_loss: 0.7471, test_loss: 0.8221, test_f1: 0.5605
 epoch: 74, train_loss: 0.7449, test_loss: 0.7637, test_f1: 0.6102
 epoch: 75, train_loss: 0.7463, test_loss: 0.8132, test_f1: 0.5828
 epoch: 76, train_loss: 0.7494, test_loss: 0.8636, test_f1: 0.6246
 epoch: 77, train_loss: 0.7620, test_loss: 0.8431, test_f1: 0.6102
 epoch: 78, train_loss: 0.7468, test_loss: 0.7616, test_f1: 0.6118
 epoch: 79, train_loss: 0.7498, test_loss: 0.8233, test_f1: 0.6080
 epoch: 80, train_loss: 0.7500, test_loss: 0.8088, test_f1: 0.6177
 epoch: 81, train_loss: 0.7407, test_loss: 0.7645, test_f1: 0.5886
 epoch: 82, train_loss: 0.7391, test_loss: 0.7419, test_f1: 0.6376
 epoch: 83, train_loss: 0.7334, test_loss: 0.8098, test_f1: 0.5988
 epoch: 84, train_loss: 0.7432, test_loss: 0.7902, test_f1: 0.6100
 epoch: 85, train_loss: 0.7369, test_loss: 0.7794, test_f1: 0.5974
 epoch: 86, train_loss: 0.7355, test_loss: 0.7401, test_f1: 0.6035
 epoch: 87, train_loss: 0.7195, test_loss: 0.7899, test_f1: 0.6038
 epoch: 88, train_loss: 0.7452, test_loss: 0.7297, test_f1: 0.6439
 epoch: 89, train_loss: 0.7278, test_loss: 0.7685, test_f1: 0.6242
 epoch: 90, train_loss: 0.7265, test_loss: 0.7769, test_f1: 0.5971
 epoch: 91, train_loss: 0.7344, test_loss: 0.7678, test_f1: 0.6157
 epoch: 92, train_loss: 0.7264, test_loss: 0.7937, test_f1: 0.6062
 epoch: 93, train_loss: 0.7333, test_loss: 0.7832, test_f1: 0.6140
 epoch: 94, train_loss: 0.7321, test_loss: 0.7849, test_f1: 0.6257
 epoch: 95, train_loss: 0.7245, test_loss: 0.7832, test_f1: 0.6498
 epoch: 96, train_loss: 0.7374, test_loss: 0.8381, test_f1: 0.5936
 epoch: 97, train_loss: 0.7273, test_loss: 0.7469, test_f1: 0.6042
 epoch: 98, train_loss: 0.7296, test_loss: 0.7900, test_f1: 0.6384
 epoch: 99, train_loss: 0.7362, test_loss: 0.7695, test_f1: 0.6000
##################ITERATION #9 ****************************************
 epoch: 0, train_loss: 1.1617, test_loss: 1.0546, test_f1: 0.4315
 epoch: 1, train_loss: 1.0327, test_loss: 1.0555, test_f1: 0.4718
 epoch: 2, train_loss: 1.0039, test_loss: 1.0185, test_f1: 0.4894
 epoch: 3, train_loss: 1.0053, test_loss: 0.9819, test_f1: 0.5034
 epoch: 4, train_loss: 0.9785, test_loss: 1.0532, test_f1: 0.4742
 epoch: 5, train_loss: 0.9771, test_loss: 0.9846, test_f1: 0.4388
 epoch: 6, train_loss: 0.9800, test_loss: 1.0107, test_f1: 0.4955
 epoch: 7, train_loss: 0.9749, test_loss: 0.9862, test_f1: 0.5060
 epoch: 8, train_loss: 0.9746, test_loss: 1.0726, test_f1: 0.4688
 epoch: 9, train_loss: 0.9510, test_loss: 0.9997, test_f1: 0.4950
 epoch: 10, train_loss: 0.9692, test_loss: 0.9557, test_f1: 0.5033
 epoch: 11, train_loss: 0.9392, test_loss: 0.9626, test_f1: 0.4966
 epoch: 12, train_loss: 0.9370, test_loss: 0.9751, test_f1: 0.4951
 epoch: 13, train_loss: 0.9223, test_loss: 0.9720, test_f1: 0.4924
 epoch: 14, train_loss: 0.9339, test_loss: 0.9552, test_f1: 0.5056
 epoch: 15, train_loss: 0.9183, test_loss: 0.9832, test_f1: 0.4928
 epoch: 16, train_loss: 0.9103, test_loss: 0.8689, test_f1: 0.5549
 epoch: 17, train_loss: 0.8971, test_loss: 1.1305, test_f1: 0.4235
 epoch: 18, train_loss: 0.9013, test_loss: 0.8507, test_f1: 0.5120
 epoch: 19, train_loss: 0.8996, test_loss: 0.8784, test_f1: 0.5226
 epoch: 20, train_loss: 0.8980, test_loss: 1.0137, test_f1: 0.4633
 epoch: 21, train_loss: 0.8991, test_loss: 0.8881, test_f1: 0.5152
 epoch: 22, train_loss: 0.8845, test_loss: 0.8811, test_f1: 0.5064
 epoch: 23, train_loss: 0.8715, test_loss: 0.8335, test_f1: 0.5591
 epoch: 24, train_loss: 0.8743, test_loss: 0.8892, test_f1: 0.5417
 epoch: 25, train_loss: 0.8711, test_loss: 0.8512, test_f1: 0.5537
 epoch: 26, train_loss: 0.8617, test_loss: 0.8483, test_f1: 0.5690
 epoch: 27, train_loss: 0.8652, test_loss: 0.9634, test_f1: 0.5185
 epoch: 28, train_loss: 0.8595, test_loss: 0.8296, test_f1: 0.5296
 epoch: 29, train_loss: 0.8668, test_loss: 0.8230, test_f1: 0.5598
 epoch: 30, train_loss: 0.8718, test_loss: 0.8788, test_f1: 0.5007
 epoch: 31, train_loss: 0.8613, test_loss: 0.8182, test_f1: 0.5465
 epoch: 32, train_loss: 0.8429, test_loss: 0.8636, test_f1: 0.5234
 epoch: 33, train_loss: 0.8487, test_loss: 0.8857, test_f1: 0.5685
 epoch: 34, train_loss: 0.8578, test_loss: 0.9512, test_f1: 0.5359
 epoch: 35, train_loss: 0.8418, test_loss: 0.8689, test_f1: 0.5627
 epoch: 36, train_loss: 0.8345, test_loss: 0.8482, test_f1: 0.5407
 epoch: 37, train_loss: 0.8401, test_loss: 0.7782, test_f1: 0.5934
 epoch: 38, train_loss: 0.8284, test_loss: 0.7877, test_f1: 0.5761
 epoch: 39, train_loss: 0.8437, test_loss: 0.9177, test_f1: 0.5318
 epoch: 40, train_loss: 0.8571, test_loss: 0.9388, test_f1: 0.5250
 epoch: 41, train_loss: 0.8325, test_loss: 0.8873, test_f1: 0.5005
 epoch: 42, train_loss: 0.8248, test_loss: 0.8064, test_f1: 0.5507
 epoch: 43, train_loss: 0.8184, test_loss: 0.8142, test_f1: 0.5621
 epoch: 44, train_loss: 0.8215, test_loss: 0.9111, test_f1: 0.5355
 epoch: 45, train_loss: 0.8245, test_loss: 0.8605, test_f1: 0.5780
 epoch: 46, train_loss: 0.8184, test_loss: 0.9152, test_f1: 0.5604
 epoch: 47, train_loss: 0.8093, test_loss: 0.8123, test_f1: 0.5521
 epoch: 48, train_loss: 0.8149, test_loss: 0.8538, test_f1: 0.5558
 epoch: 49, train_loss: 0.8243, test_loss: 0.8537, test_f1: 0.5402
 epoch: 50, train_loss: 0.8255, test_loss: 0.8454, test_f1: 0.5593
 epoch: 51, train_loss: 0.7951, test_loss: 0.7643, test_f1: 0.5837
 epoch: 52, train_loss: 0.7887, test_loss: 0.7729, test_f1: 0.5996
 epoch: 53, train_loss: 0.7783, test_loss: 0.8321, test_f1: 0.5998
 epoch: 54, train_loss: 0.7714, test_loss: 0.8413, test_f1: 0.6348
 epoch: 55, train_loss: 0.7687, test_loss: 0.8119, test_f1: 0.6325
 epoch: 56, train_loss: 0.7745, test_loss: 0.8169, test_f1: 0.6194
 epoch: 57, train_loss: 0.7818, test_loss: 0.7909, test_f1: 0.6107
 epoch: 58, train_loss: 0.7658, test_loss: 0.7507, test_f1: 0.5708
 epoch: 59, train_loss: 0.7698, test_loss: 0.7980, test_f1: 0.5729
 epoch: 60, train_loss: 0.7797, test_loss: 0.7990, test_f1: 0.6113
 epoch: 61, train_loss: 0.7638, test_loss: 0.8309, test_f1: 0.6297
 epoch: 62, train_loss: 0.7665, test_loss: 0.8417, test_f1: 0.5652
 epoch: 63, train_loss: 0.7638, test_loss: 0.8239, test_f1: 0.6062
 epoch: 64, train_loss: 0.7555, test_loss: 0.7815, test_f1: 0.6676
 epoch: 65, train_loss: 0.7440, test_loss: 0.9237, test_f1: 0.5614
 epoch: 66, train_loss: 0.7464, test_loss: 0.8465, test_f1: 0.6339
 epoch: 67, train_loss: 0.7606, test_loss: 0.8211, test_f1: 0.5874
 epoch: 68, train_loss: 0.7584, test_loss: 0.7854, test_f1: 0.6077
 epoch: 69, train_loss: 0.7452, test_loss: 0.7918, test_f1: 0.6197
 epoch: 70, train_loss: 0.7393, test_loss: 0.7989, test_f1: 0.5752
 epoch: 71, train_loss: 0.7607, test_loss: 0.8041, test_f1: 0.6191
 epoch: 72, train_loss: 0.7474, test_loss: 0.8146, test_f1: 0.6014
 epoch: 73, train_loss: 0.7261, test_loss: 0.8095, test_f1: 0.6325
 epoch: 74, train_loss: 0.7371, test_loss: 0.8290, test_f1: 0.6102
 epoch: 75, train_loss: 0.7429, test_loss: 0.8054, test_f1: 0.6347
 epoch: 76, train_loss: 0.7351, test_loss: 0.8334, test_f1: 0.6134
 epoch: 77, train_loss: 0.7435, test_loss: 0.8273, test_f1: 0.6390
 epoch: 78, train_loss: 0.7388, test_loss: 0.8859, test_f1: 0.6062
 epoch: 79, train_loss: 0.7344, test_loss: 0.8857, test_f1: 0.6012
 epoch: 80, train_loss: 0.7309, test_loss: 0.8346, test_f1: 0.6004
 epoch: 81, train_loss: 0.7346, test_loss: 0.8197, test_f1: 0.6378
 epoch: 82, train_loss: 0.7230, test_loss: 0.8266, test_f1: 0.5979
 epoch: 83, train_loss: 0.7320, test_loss: 0.8370, test_f1: 0.6142
 epoch: 84, train_loss: 0.7406, test_loss: 0.8725, test_f1: 0.6126
 epoch: 85, train_loss: 0.7340, test_loss: 0.8288, test_f1: 0.6227
 epoch: 86, train_loss: 0.7410, test_loss: 0.8213, test_f1: 0.6413
 epoch: 87, train_loss: 0.7203, test_loss: 0.8443, test_f1: 0.6171
 epoch: 88, train_loss: 0.7275, test_loss: 0.8298, test_f1: 0.6559
 epoch: 89, train_loss: 0.7327, test_loss: 0.8490, test_f1: 0.6129
 epoch: 90, train_loss: 0.7253, test_loss: 0.8438, test_f1: 0.6337
 epoch: 91, train_loss: 0.7204, test_loss: 0.9243, test_f1: 0.5961
 epoch: 92, train_loss: 0.7346, test_loss: 0.8743, test_f1: 0.6213
 epoch: 93, train_loss: 0.7248, test_loss: 0.8563, test_f1: 0.6250
 epoch: 94, train_loss: 0.7367, test_loss: 0.8223, test_f1: 0.6191
 epoch: 95, train_loss: 0.7021, test_loss: 0.8462, test_f1: 0.6236
 epoch: 96, train_loss: 0.7247, test_loss: 0.8060, test_f1: 0.6447
 epoch: 97, train_loss: 0.7077, test_loss: 0.8171, test_f1: 0.6437
 epoch: 98, train_loss: 0.7000, test_loss: 0.8151, test_f1: 0.6286
 epoch: 99, train_loss: 0.7075, test_loss: 0.8354, test_f1: 0.6380

Training completed in 1422.02 seconds
Best F1: 0.6893 at epoch 78
Mean F1 across iterations: 0.6577  0.0209
========================FINAL RESULTS================================
FEGIN weighted F1: 0.6893  0.0209
python main.py --data ltspice_examples --representation component_pin_net --model FEGIN --layers 6 --hiddens 16 --batch_size 64 --lr 0.01 --emb_size 512 --epochs 100 --save_appendix component_pin_net_L6_H16_BS64_LR0.01_E512 --no_val
-----



STDERR:
  File "main.py", line 370, in <module>
    main()
  File "main.py", line 254, in main
    dataset = dataset_class(
  File "/home/philip/projects/ltspice_examples_code_repo/Circuit-Completion-Using-GNNs/component_classification_with_link_prediction_head/evaluation/FEGIN/kernel/circuit_datasets.py", line 15, in __init__
    self.data, self.slices = torch.load(self.processed_paths[0])
  File "/home/philip/.local/lib/python3.8/site-packages/torch/serialization.py", line 1040, in load
    warnings.warn(
  File "/usr/lib/python3.8/warnings.py", line 109, in _showwarnmsg
    sw(msg.message, msg.category, msg.filename, msg.lineno,
  File "main.py", line 47, in warn_with_traceback
    traceback.print_stack(file=log)
/home/philip/projects/ltspice_examples_code_repo/Circuit-Completion-Using-GNNs/component_classification_with_link_prediction_head/evaluation/FEGIN/kernel/circuit_datasets.py:15: FutureWarning: You are using `torch.load` with `weights_only=False` (the current default value), which uses the default pickle module implicitly. It is possible to construct malicious pickle data which will execute arbitrary code during unpickling (See https://github.com/pytorch/pytorch/blob/main/SECURITY.md#untrusted-models for more details). In a future release, the default value for `weights_only` will be flipped to `True`. This limits the functions that could be executed during unpickling. Arbitrary objects will no longer be allowed to be loaded via this mode unless they are explicitly allowlisted by the user via `torch.serialization.add_safe_globals`. We recommend you start setting `weights_only=True` for any use case where you don't have full control of the loaded file. Please open an issue on GitHub for any issues related to this experimental feature.
  self.data, self.slices = torch.load(self.processed_paths[0])
