STDOUT:
Results will be saved in /home/philip/projects/ltspice_examples_code_repo/Circuit-Completion-Using-GNNs/component_classification_with_link_prediction_head/evaluation/FEGIN/results/model_FEGIN_dataset_ltspice_examples
Command line input: python main.py --data ltspice_examples --representation component_component --model FEGIN --layers 5 --hiddens 128 --batch_size 256 --lr 0.0001 --emb_size 250 --epochs 100 --save_appendix component_component_L5_H128_BS256_LR0.0001_E250 --no_val
 is saved.
-----
ltspice_examples - FEGIN
Using 5 layers, 128 hidden units, h = 2
Loading component_component representation dataset
ENTERED
Training FEGIN on component_component representation
Train: 3556, Test: 845
##################ITERATION #0 ****************************************
 epoch: 0, train_loss: 1.3908, test_loss: 1.3850, test_f1: 0.0794
 epoch: 1, train_loss: 1.3730, test_loss: 1.3757, test_f1: 0.2828
 epoch: 2, train_loss: 1.3599, test_loss: 1.3593, test_f1: 0.3082
 epoch: 3, train_loss: 1.3432, test_loss: 1.3380, test_f1: 0.2887
 epoch: 4, train_loss: 1.3229, test_loss: 1.3110, test_f1: 0.2817
 epoch: 5, train_loss: 1.3003, test_loss: 1.2826, test_f1: 0.2857
 epoch: 6, train_loss: 1.2745, test_loss: 1.2561, test_f1: 0.2890
 epoch: 7, train_loss: 1.2546, test_loss: 1.2301, test_f1: 0.2990
 epoch: 8, train_loss: 1.2338, test_loss: 1.2100, test_f1: 0.3322
 epoch: 9, train_loss: 1.2176, test_loss: 1.1912, test_f1: 0.3421
 epoch: 10, train_loss: 1.1974, test_loss: 1.1748, test_f1: 0.3409
 epoch: 11, train_loss: 1.1824, test_loss: 1.1607, test_f1: 0.3506
 epoch: 12, train_loss: 1.1636, test_loss: 1.1441, test_f1: 0.3605
 epoch: 13, train_loss: 1.1502, test_loss: 1.1289, test_f1: 0.3839
 epoch: 14, train_loss: 1.1300, test_loss: 1.1247, test_f1: 0.4096
 epoch: 15, train_loss: 1.1140, test_loss: 1.1119, test_f1: 0.4325
 epoch: 16, train_loss: 1.1037, test_loss: 1.1053, test_f1: 0.4325
 epoch: 17, train_loss: 1.0873, test_loss: 1.0839, test_f1: 0.4801
 epoch: 18, train_loss: 1.0678, test_loss: 1.0785, test_f1: 0.4489
 epoch: 19, train_loss: 1.0469, test_loss: 1.0622, test_f1: 0.4767
 epoch: 20, train_loss: 1.0387, test_loss: 1.0629, test_f1: 0.4552
 epoch: 21, train_loss: 1.0244, test_loss: 1.0549, test_f1: 0.4715
 epoch: 22, train_loss: 1.0031, test_loss: 1.0478, test_f1: 0.4744
 epoch: 23, train_loss: 0.9852, test_loss: 1.0533, test_f1: 0.4623
 epoch: 24, train_loss: 0.9791, test_loss: 1.0416, test_f1: 0.4811
 epoch: 25, train_loss: 0.9577, test_loss: 1.0482, test_f1: 0.4740
 epoch: 26, train_loss: 0.9424, test_loss: 1.0467, test_f1: 0.4605
 epoch: 27, train_loss: 0.9355, test_loss: 1.0747, test_f1: 0.4619
 epoch: 28, train_loss: 0.9258, test_loss: 1.1120, test_f1: 0.4610
 epoch: 29, train_loss: 0.9059, test_loss: 1.1268, test_f1: 0.4552
 epoch: 30, train_loss: 0.8958, test_loss: 1.1808, test_f1: 0.4742
 epoch: 31, train_loss: 0.8907, test_loss: 1.1045, test_f1: 0.4965
 epoch: 32, train_loss: 0.8771, test_loss: 1.1383, test_f1: 0.4659
 epoch: 33, train_loss: 0.8735, test_loss: 1.1748, test_f1: 0.4499
 epoch: 34, train_loss: 0.8596, test_loss: 1.2338, test_f1: 0.4629
 epoch: 35, train_loss: 0.8484, test_loss: 1.1884, test_f1: 0.4533
 epoch: 36, train_loss: 0.8349, test_loss: 1.1979, test_f1: 0.4889
 epoch: 37, train_loss: 0.8303, test_loss: 1.2374, test_f1: 0.4799
 epoch: 38, train_loss: 0.8261, test_loss: 1.2691, test_f1: 0.4652
 epoch: 39, train_loss: 0.8149, test_loss: 1.2310, test_f1: 0.4753
 epoch: 40, train_loss: 0.8170, test_loss: 1.2448, test_f1: 0.4516
 epoch: 41, train_loss: 0.7824, test_loss: 1.2812, test_f1: 0.4547
 epoch: 42, train_loss: 0.7846, test_loss: 1.2589, test_f1: 0.4730
 epoch: 43, train_loss: 0.7816, test_loss: 1.2481, test_f1: 0.4672
 epoch: 44, train_loss: 0.7782, test_loss: 1.2697, test_f1: 0.4740
 epoch: 45, train_loss: 0.7588, test_loss: 1.2984, test_f1: 0.4639
 epoch: 46, train_loss: 0.7717, test_loss: 1.2404, test_f1: 0.4710
 epoch: 47, train_loss: 0.7555, test_loss: 1.2152, test_f1: 0.4773
 epoch: 48, train_loss: 0.7503, test_loss: 1.2596, test_f1: 0.4636
 epoch: 49, train_loss: 0.7154, test_loss: 1.2994, test_f1: 0.4815
 epoch: 50, train_loss: 0.7223, test_loss: 1.2851, test_f1: 0.4699
 epoch: 51, train_loss: 0.7109, test_loss: 1.3013, test_f1: 0.4748
 epoch: 52, train_loss: 0.7098, test_loss: 1.2644, test_f1: 0.4764
 epoch: 53, train_loss: 0.6949, test_loss: 1.2864, test_f1: 0.4781
 epoch: 54, train_loss: 0.7014, test_loss: 1.2682, test_f1: 0.4829
 epoch: 55, train_loss: 0.6932, test_loss: 1.3119, test_f1: 0.4760
 epoch: 56, train_loss: 0.6757, test_loss: 1.2675, test_f1: 0.4706
 epoch: 57, train_loss: 0.6808, test_loss: 1.2914, test_f1: 0.4782
 epoch: 58, train_loss: 0.6806, test_loss: 1.3269, test_f1: 0.4682
 epoch: 59, train_loss: 0.6715, test_loss: 1.3147, test_f1: 0.4788
 epoch: 60, train_loss: 0.6598, test_loss: 1.3185, test_f1: 0.4676
 epoch: 61, train_loss: 0.6633, test_loss: 1.2904, test_f1: 0.4867
 epoch: 62, train_loss: 0.6595, test_loss: 1.3251, test_f1: 0.4883
 epoch: 63, train_loss: 0.6569, test_loss: 1.3471, test_f1: 0.4856
 epoch: 64, train_loss: 0.6535, test_loss: 1.3496, test_f1: 0.4959
 epoch: 65, train_loss: 0.6412, test_loss: 1.3409, test_f1: 0.4794
 epoch: 66, train_loss: 0.6476, test_loss: 1.3114, test_f1: 0.4908
 epoch: 67, train_loss: 0.6525, test_loss: 1.3454, test_f1: 0.4791
 epoch: 68, train_loss: 0.6353, test_loss: 1.2943, test_f1: 0.4868
 epoch: 69, train_loss: 0.6563, test_loss: 1.3575, test_f1: 0.4765
 epoch: 70, train_loss: 0.6561, test_loss: 1.3276, test_f1: 0.4861
 epoch: 71, train_loss: 0.6483, test_loss: 1.3283, test_f1: 0.5020
 epoch: 72, train_loss: 0.6359, test_loss: 1.3190, test_f1: 0.4972
 epoch: 73, train_loss: 0.6228, test_loss: 1.3678, test_f1: 0.4784
 epoch: 74, train_loss: 0.6165, test_loss: 1.3815, test_f1: 0.4863
 epoch: 75, train_loss: 0.6225, test_loss: 1.3538, test_f1: 0.4816
 epoch: 76, train_loss: 0.6213, test_loss: 1.3850, test_f1: 0.4826
 epoch: 77, train_loss: 0.6193, test_loss: 1.3763, test_f1: 0.4883
 epoch: 78, train_loss: 0.6154, test_loss: 1.3964, test_f1: 0.4888
 epoch: 79, train_loss: 0.6004, test_loss: 1.4180, test_f1: 0.4856
 epoch: 80, train_loss: 0.6057, test_loss: 1.3997, test_f1: 0.4919
 epoch: 81, train_loss: 0.6055, test_loss: 1.4162, test_f1: 0.4855
 epoch: 82, train_loss: 0.5956, test_loss: 1.4272, test_f1: 0.4776
 epoch: 83, train_loss: 0.6038, test_loss: 1.4227, test_f1: 0.4799
 epoch: 84, train_loss: 0.5962, test_loss: 1.3841, test_f1: 0.4961
 epoch: 85, train_loss: 0.5793, test_loss: 1.3986, test_f1: 0.4952
 epoch: 86, train_loss: 0.5730, test_loss: 1.4754, test_f1: 0.4789
 epoch: 87, train_loss: 0.5789, test_loss: 1.4028, test_f1: 0.4966
 epoch: 88, train_loss: 0.5901, test_loss: 1.4321, test_f1: 0.4797
 epoch: 89, train_loss: 0.5860, test_loss: 1.4684, test_f1: 0.4970
 epoch: 90, train_loss: 0.5780, test_loss: 1.4865, test_f1: 0.4788
 epoch: 91, train_loss: 0.5750, test_loss: 1.5245, test_f1: 0.4878
 epoch: 92, train_loss: 0.5730, test_loss: 1.4959, test_f1: 0.4882
 epoch: 93, train_loss: 0.5629, test_loss: 1.4925, test_f1: 0.4807
 epoch: 94, train_loss: 0.5621, test_loss: 1.4934, test_f1: 0.4989
 epoch: 95, train_loss: 0.5713, test_loss: 1.4783, test_f1: 0.4774
 epoch: 96, train_loss: 0.5619, test_loss: 1.4769, test_f1: 0.4929
 epoch: 97, train_loss: 0.5575, test_loss: 1.4674, test_f1: 0.4898
 epoch: 98, train_loss: 0.5643, test_loss: 1.5425, test_f1: 0.4959
 epoch: 99, train_loss: 0.5450, test_loss: 1.5105, test_f1: 0.4814
##################ITERATION #1 ****************************************
 epoch: 0, train_loss: 1.3401, test_loss: 1.3498, test_f1: 0.2274
 epoch: 1, train_loss: 1.2828, test_loss: 1.3175, test_f1: 0.2274
 epoch: 2, train_loss: 1.2561, test_loss: 1.2816, test_f1: 0.2677
 epoch: 3, train_loss: 1.2326, test_loss: 1.2415, test_f1: 0.3005
 epoch: 4, train_loss: 1.2097, test_loss: 1.2019, test_f1: 0.3508
 epoch: 5, train_loss: 1.1891, test_loss: 1.1764, test_f1: 0.4096
 epoch: 6, train_loss: 1.1741, test_loss: 1.1569, test_f1: 0.4200
 epoch: 7, train_loss: 1.1556, test_loss: 1.1430, test_f1: 0.4225
 epoch: 8, train_loss: 1.1398, test_loss: 1.1283, test_f1: 0.4357
 epoch: 9, train_loss: 1.1161, test_loss: 1.1178, test_f1: 0.4411
 epoch: 10, train_loss: 1.1053, test_loss: 1.1058, test_f1: 0.4551
 epoch: 11, train_loss: 1.0897, test_loss: 1.0962, test_f1: 0.4520
 epoch: 12, train_loss: 1.0679, test_loss: 1.0860, test_f1: 0.4532
 epoch: 13, train_loss: 1.0516, test_loss: 1.0773, test_f1: 0.4599
 epoch: 14, train_loss: 1.0370, test_loss: 1.0732, test_f1: 0.4660
 epoch: 15, train_loss: 1.0218, test_loss: 1.0589, test_f1: 0.4697
 epoch: 16, train_loss: 1.0029, test_loss: 1.0557, test_f1: 0.4745
 epoch: 17, train_loss: 0.9940, test_loss: 1.0428, test_f1: 0.4742
 epoch: 18, train_loss: 0.9731, test_loss: 1.0591, test_f1: 0.4628
 epoch: 19, train_loss: 0.9607, test_loss: 1.0413, test_f1: 0.4804
 epoch: 20, train_loss: 0.9400, test_loss: 1.0436, test_f1: 0.4830
 epoch: 21, train_loss: 0.9184, test_loss: 1.0629, test_f1: 0.4838
 epoch: 22, train_loss: 0.9060, test_loss: 1.0475, test_f1: 0.4834
 epoch: 23, train_loss: 0.8996, test_loss: 1.0754, test_f1: 0.4778
 epoch: 24, train_loss: 0.8871, test_loss: 1.0792, test_f1: 0.4758
 epoch: 25, train_loss: 0.8604, test_loss: 1.0612, test_f1: 0.4657
 epoch: 26, train_loss: 0.8615, test_loss: 1.1241, test_f1: 0.4825
 epoch: 27, train_loss: 0.8282, test_loss: 1.1270, test_f1: 0.4540
 epoch: 28, train_loss: 0.8294, test_loss: 1.0861, test_f1: 0.4650
 epoch: 29, train_loss: 0.8072, test_loss: 1.1402, test_f1: 0.4642
 epoch: 30, train_loss: 0.8116, test_loss: 1.1000, test_f1: 0.4750
 epoch: 31, train_loss: 0.7933, test_loss: 1.1372, test_f1: 0.4733
 epoch: 32, train_loss: 0.7811, test_loss: 1.1615, test_f1: 0.4608
 epoch: 33, train_loss: 0.7738, test_loss: 1.1479, test_f1: 0.4766
 epoch: 34, train_loss: 0.7633, test_loss: 1.1648, test_f1: 0.4608
 epoch: 35, train_loss: 0.7593, test_loss: 1.1452, test_f1: 0.4840
 epoch: 36, train_loss: 0.7504, test_loss: 1.1621, test_f1: 0.4784
 epoch: 37, train_loss: 0.7247, test_loss: 1.1893, test_f1: 0.4816
 epoch: 38, train_loss: 0.7278, test_loss: 1.1682, test_f1: 0.4868
 epoch: 39, train_loss: 0.7101, test_loss: 1.1980, test_f1: 0.4593
 epoch: 40, train_loss: 0.7017, test_loss: 1.2121, test_f1: 0.4611
 epoch: 41, train_loss: 0.7059, test_loss: 1.2396, test_f1: 0.4762
 epoch: 42, train_loss: 0.6962, test_loss: 1.1824, test_f1: 0.4985
 epoch: 43, train_loss: 0.6816, test_loss: 1.2348, test_f1: 0.4757
 epoch: 44, train_loss: 0.6663, test_loss: 1.2580, test_f1: 0.4751
 epoch: 45, train_loss: 0.6907, test_loss: 1.3231, test_f1: 0.4930
 epoch: 46, train_loss: 0.6699, test_loss: 1.2369, test_f1: 0.4942
 epoch: 47, train_loss: 0.6640, test_loss: 1.2936, test_f1: 0.4802
 epoch: 48, train_loss: 0.6613, test_loss: 1.2947, test_f1: 0.4825
 epoch: 49, train_loss: 0.6422, test_loss: 1.3253, test_f1: 0.4805
 epoch: 50, train_loss: 0.6343, test_loss: 1.3193, test_f1: 0.4770
 epoch: 51, train_loss: 0.6219, test_loss: 1.2460, test_f1: 0.4982
 epoch: 52, train_loss: 0.6265, test_loss: 1.2757, test_f1: 0.4913
 epoch: 53, train_loss: 0.6104, test_loss: 1.3127, test_f1: 0.4899
 epoch: 54, train_loss: 0.6050, test_loss: 1.3321, test_f1: 0.4909
 epoch: 55, train_loss: 0.6105, test_loss: 1.3237, test_f1: 0.4787
 epoch: 56, train_loss: 0.6078, test_loss: 1.3671, test_f1: 0.4858
 epoch: 57, train_loss: 0.6020, test_loss: 1.3469, test_f1: 0.4938
 epoch: 58, train_loss: 0.5888, test_loss: 1.3306, test_f1: 0.4882
 epoch: 59, train_loss: 0.5903, test_loss: 1.3619, test_f1: 0.4870
 epoch: 60, train_loss: 0.5901, test_loss: 1.3934, test_f1: 0.4967
 epoch: 61, train_loss: 0.5704, test_loss: 1.3866, test_f1: 0.4936
 epoch: 62, train_loss: 0.5810, test_loss: 1.4015, test_f1: 0.4960
 epoch: 63, train_loss: 0.5723, test_loss: 1.3902, test_f1: 0.4839
 epoch: 64, train_loss: 0.5842, test_loss: 1.3843, test_f1: 0.4911
 epoch: 65, train_loss: 0.5760, test_loss: 1.4296, test_f1: 0.5000
 epoch: 66, train_loss: 0.5750, test_loss: 1.4070, test_f1: 0.4927
 epoch: 67, train_loss: 0.5753, test_loss: 1.4222, test_f1: 0.4931
 epoch: 68, train_loss: 0.5688, test_loss: 1.4161, test_f1: 0.4854
 epoch: 69, train_loss: 0.5710, test_loss: 1.4324, test_f1: 0.4899
 epoch: 70, train_loss: 0.5922, test_loss: 1.4069, test_f1: 0.5037
 epoch: 71, train_loss: 0.5793, test_loss: 1.4337, test_f1: 0.4887
 epoch: 72, train_loss: 0.5621, test_loss: 1.4408, test_f1: 0.4901
 epoch: 73, train_loss: 0.5755, test_loss: 1.4394, test_f1: 0.4894
 epoch: 74, train_loss: 0.5487, test_loss: 1.4009, test_f1: 0.4987
 epoch: 75, train_loss: 0.5572, test_loss: 1.4301, test_f1: 0.4915
 epoch: 76, train_loss: 0.5402, test_loss: 1.4856, test_f1: 0.4899
 epoch: 77, train_loss: 0.5461, test_loss: 1.4257, test_f1: 0.5041
 epoch: 78, train_loss: 0.5433, test_loss: 1.4486, test_f1: 0.4923
 epoch: 79, train_loss: 0.5318, test_loss: 1.4361, test_f1: 0.5142
 epoch: 80, train_loss: 0.5494, test_loss: 1.4719, test_f1: 0.5059
 epoch: 81, train_loss: 0.5329, test_loss: 1.4549, test_f1: 0.4985
 epoch: 82, train_loss: 0.5261, test_loss: 1.4623, test_f1: 0.5016
 epoch: 83, train_loss: 0.5264, test_loss: 1.4896, test_f1: 0.5018
 epoch: 84, train_loss: 0.5155, test_loss: 1.5035, test_f1: 0.4919
 epoch: 85, train_loss: 0.5173, test_loss: 1.5126, test_f1: 0.4969
 epoch: 86, train_loss: 0.5185, test_loss: 1.5297, test_f1: 0.5038
 epoch: 87, train_loss: 0.5197, test_loss: 1.5087, test_f1: 0.5007
 epoch: 88, train_loss: 0.5261, test_loss: 1.4957, test_f1: 0.5017
 epoch: 89, train_loss: 0.5039, test_loss: 1.5035, test_f1: 0.4985
 epoch: 90, train_loss: 0.5277, test_loss: 1.5129, test_f1: 0.4978
 epoch: 91, train_loss: 0.5074, test_loss: 1.5403, test_f1: 0.4964
 epoch: 92, train_loss: 0.5188, test_loss: 1.5561, test_f1: 0.4984
 epoch: 93, train_loss: 0.5157, test_loss: 1.5233, test_f1: 0.4999
 epoch: 94, train_loss: 0.5138, test_loss: 1.5450, test_f1: 0.5034
 epoch: 95, train_loss: 0.5038, test_loss: 1.5472, test_f1: 0.5199
 epoch: 96, train_loss: 0.5114, test_loss: 1.5652, test_f1: 0.5084
 epoch: 97, train_loss: 0.5089, test_loss: 1.5608, test_f1: 0.5037
 epoch: 98, train_loss: 0.5111, test_loss: 1.5317, test_f1: 0.5048
 epoch: 99, train_loss: 0.5120, test_loss: 1.5505, test_f1: 0.5166
##################ITERATION #2 ****************************************
 epoch: 0, train_loss: 1.3427, test_loss: 1.3342, test_f1: 0.2535
 epoch: 1, train_loss: 1.2615, test_loss: 1.2915, test_f1: 0.3114
 epoch: 2, train_loss: 1.2289, test_loss: 1.2398, test_f1: 0.3314
 epoch: 3, train_loss: 1.2068, test_loss: 1.1949, test_f1: 0.4441
 epoch: 4, train_loss: 1.1822, test_loss: 1.1625, test_f1: 0.4474
 epoch: 5, train_loss: 1.1593, test_loss: 1.1422, test_f1: 0.4598
 epoch: 6, train_loss: 1.1435, test_loss: 1.1265, test_f1: 0.4588
 epoch: 7, train_loss: 1.1314, test_loss: 1.1148, test_f1: 0.4527
 epoch: 8, train_loss: 1.1148, test_loss: 1.1016, test_f1: 0.4518
 epoch: 9, train_loss: 1.0997, test_loss: 1.0916, test_f1: 0.4552
 epoch: 10, train_loss: 1.0854, test_loss: 1.0864, test_f1: 0.4553
 epoch: 11, train_loss: 1.0677, test_loss: 1.0711, test_f1: 0.4684
 epoch: 12, train_loss: 1.0458, test_loss: 1.0564, test_f1: 0.4731
 epoch: 13, train_loss: 1.0363, test_loss: 1.0494, test_f1: 0.4752
 epoch: 14, train_loss: 1.0225, test_loss: 1.0455, test_f1: 0.4827
 epoch: 15, train_loss: 1.0096, test_loss: 1.0342, test_f1: 0.4887
 epoch: 16, train_loss: 1.0012, test_loss: 1.0346, test_f1: 0.4857
 epoch: 17, train_loss: 0.9852, test_loss: 1.0300, test_f1: 0.4679
 epoch: 18, train_loss: 0.9690, test_loss: 1.0263, test_f1: 0.4840
 epoch: 19, train_loss: 0.9564, test_loss: 1.0393, test_f1: 0.4853
 epoch: 20, train_loss: 0.9425, test_loss: 1.0330, test_f1: 0.4744
 epoch: 21, train_loss: 0.9373, test_loss: 1.0165, test_f1: 0.4979
 epoch: 22, train_loss: 0.9060, test_loss: 1.0081, test_f1: 0.4921
 epoch: 23, train_loss: 0.8977, test_loss: 1.0257, test_f1: 0.4904
 epoch: 24, train_loss: 0.8951, test_loss: 1.0475, test_f1: 0.4802
 epoch: 25, train_loss: 0.8759, test_loss: 1.0157, test_f1: 0.4915
 epoch: 26, train_loss: 0.8595, test_loss: 1.0323, test_f1: 0.4838
 epoch: 27, train_loss: 0.8558, test_loss: 1.0186, test_f1: 0.4969
 epoch: 28, train_loss: 0.8487, test_loss: 1.0378, test_f1: 0.5100
 epoch: 29, train_loss: 0.8352, test_loss: 0.9970, test_f1: 0.5183
 epoch: 30, train_loss: 0.8321, test_loss: 1.0365, test_f1: 0.5114
 epoch: 31, train_loss: 0.8179, test_loss: 1.0318, test_f1: 0.5202
 epoch: 32, train_loss: 0.8178, test_loss: 1.0355, test_f1: 0.5242
 epoch: 33, train_loss: 0.7978, test_loss: 1.0246, test_f1: 0.5219
 epoch: 34, train_loss: 0.7877, test_loss: 1.0602, test_f1: 0.5122
 epoch: 35, train_loss: 0.7716, test_loss: 1.0562, test_f1: 0.5121
 epoch: 36, train_loss: 0.7679, test_loss: 1.0776, test_f1: 0.5148
 epoch: 37, train_loss: 0.7553, test_loss: 1.0598, test_f1: 0.5194
 epoch: 38, train_loss: 0.7454, test_loss: 1.0432, test_f1: 0.5201
 epoch: 39, train_loss: 0.7342, test_loss: 1.0672, test_f1: 0.5316
 epoch: 40, train_loss: 0.7395, test_loss: 1.0555, test_f1: 0.5149
 epoch: 41, train_loss: 0.7224, test_loss: 1.0964, test_f1: 0.5355
 epoch: 42, train_loss: 0.7255, test_loss: 1.1101, test_f1: 0.5196
 epoch: 43, train_loss: 0.7190, test_loss: 1.1022, test_f1: 0.5195
 epoch: 44, train_loss: 0.7065, test_loss: 1.1082, test_f1: 0.5069
 epoch: 45, train_loss: 0.7015, test_loss: 1.1295, test_f1: 0.5183
 epoch: 46, train_loss: 0.7041, test_loss: 1.1411, test_f1: 0.5112
 epoch: 47, train_loss: 0.6949, test_loss: 1.1608, test_f1: 0.4802
 epoch: 48, train_loss: 0.6953, test_loss: 1.1158, test_f1: 0.5171
 epoch: 49, train_loss: 0.6767, test_loss: 1.1968, test_f1: 0.5055
 epoch: 50, train_loss: 0.6763, test_loss: 1.1950, test_f1: 0.5175
 epoch: 51, train_loss: 0.6633, test_loss: 1.1361, test_f1: 0.5191
 epoch: 52, train_loss: 0.6544, test_loss: 1.1548, test_f1: 0.5036
 epoch: 53, train_loss: 0.6418, test_loss: 1.1769, test_f1: 0.5144
 epoch: 54, train_loss: 0.6423, test_loss: 1.1617, test_f1: 0.5177
 epoch: 55, train_loss: 0.6291, test_loss: 1.1798, test_f1: 0.5122
 epoch: 56, train_loss: 0.6353, test_loss: 1.2110, test_f1: 0.5034
 epoch: 57, train_loss: 0.6215, test_loss: 1.1921, test_f1: 0.4963
 epoch: 58, train_loss: 0.6185, test_loss: 1.1740, test_f1: 0.5072
 epoch: 59, train_loss: 0.6385, test_loss: 1.1774, test_f1: 0.5187
 epoch: 60, train_loss: 0.6183, test_loss: 1.1832, test_f1: 0.5185
 epoch: 61, train_loss: 0.6073, test_loss: 1.2168, test_f1: 0.5148
 epoch: 62, train_loss: 0.6070, test_loss: 1.2061, test_f1: 0.5256
 epoch: 63, train_loss: 0.6137, test_loss: 1.2479, test_f1: 0.5124
 epoch: 64, train_loss: 0.5966, test_loss: 1.2014, test_f1: 0.5247
 epoch: 65, train_loss: 0.5836, test_loss: 1.2031, test_f1: 0.5120
 epoch: 66, train_loss: 0.6018, test_loss: 1.2617, test_f1: 0.5141
 epoch: 67, train_loss: 0.6021, test_loss: 1.2190, test_f1: 0.5210
 epoch: 68, train_loss: 0.5930, test_loss: 1.2564, test_f1: 0.5322
 epoch: 69, train_loss: 0.5882, test_loss: 1.2698, test_f1: 0.5231
 epoch: 70, train_loss: 0.5826, test_loss: 1.2760, test_f1: 0.5206
 epoch: 71, train_loss: 0.5810, test_loss: 1.2845, test_f1: 0.5152
 epoch: 72, train_loss: 0.5750, test_loss: 1.2735, test_f1: 0.5284
 epoch: 73, train_loss: 0.5825, test_loss: 1.2988, test_f1: 0.5067
 epoch: 74, train_loss: 0.5763, test_loss: 1.2921, test_f1: 0.5357
 epoch: 75, train_loss: 0.5811, test_loss: 1.2849, test_f1: 0.5414
 epoch: 76, train_loss: 0.5650, test_loss: 1.2850, test_f1: 0.5444
 epoch: 77, train_loss: 0.5833, test_loss: 1.2621, test_f1: 0.5350
 epoch: 78, train_loss: 0.5734, test_loss: 1.3055, test_f1: 0.5299
 epoch: 79, train_loss: 0.5585, test_loss: 1.2983, test_f1: 0.5247
 epoch: 80, train_loss: 0.5723, test_loss: 1.3041, test_f1: 0.5241
 epoch: 81, train_loss: 0.5671, test_loss: 1.3302, test_f1: 0.5073
 epoch: 82, train_loss: 0.5741, test_loss: 1.2884, test_f1: 0.5409
 epoch: 83, train_loss: 0.5591, test_loss: 1.3268, test_f1: 0.5210
 epoch: 84, train_loss: 0.5486, test_loss: 1.2934, test_f1: 0.5291
 epoch: 85, train_loss: 0.5424, test_loss: 1.3148, test_f1: 0.5092
 epoch: 86, train_loss: 0.5450, test_loss: 1.3443, test_f1: 0.5381
 epoch: 87, train_loss: 0.5366, test_loss: 1.3395, test_f1: 0.5370
 epoch: 88, train_loss: 0.5539, test_loss: 1.3506, test_f1: 0.5139
 epoch: 89, train_loss: 0.5420, test_loss: 1.3627, test_f1: 0.5326
 epoch: 90, train_loss: 0.5221, test_loss: 1.3393, test_f1: 0.5439
 epoch: 91, train_loss: 0.5328, test_loss: 1.3454, test_f1: 0.5330
 epoch: 92, train_loss: 0.5288, test_loss: 1.3759, test_f1: 0.5121
 epoch: 93, train_loss: 0.5510, test_loss: 1.3932, test_f1: 0.5198
 epoch: 94, train_loss: 0.5391, test_loss: 1.3843, test_f1: 0.5227
 epoch: 95, train_loss: 0.5270, test_loss: 1.4324, test_f1: 0.5106
 epoch: 96, train_loss: 0.5317, test_loss: 1.3383, test_f1: 0.5360
 epoch: 97, train_loss: 0.5311, test_loss: 1.3905, test_f1: 0.5182
 epoch: 98, train_loss: 0.5168, test_loss: 1.4013, test_f1: 0.5328
 epoch: 99, train_loss: 0.5202, test_loss: 1.3668, test_f1: 0.5336
##################ITERATION #3 ****************************************
 epoch: 0, train_loss: 1.2900, test_loss: 1.3138, test_f1: 0.2274
 epoch: 1, train_loss: 1.2277, test_loss: 1.2721, test_f1: 0.3065
 epoch: 2, train_loss: 1.2097, test_loss: 1.2335, test_f1: 0.4162
 epoch: 3, train_loss: 1.1869, test_loss: 1.2028, test_f1: 0.4028
 epoch: 4, train_loss: 1.1609, test_loss: 1.1728, test_f1: 0.4253
 epoch: 5, train_loss: 1.1495, test_loss: 1.1475, test_f1: 0.4323
 epoch: 6, train_loss: 1.1315, test_loss: 1.1316, test_f1: 0.4350
 epoch: 7, train_loss: 1.1095, test_loss: 1.1153, test_f1: 0.4321
 epoch: 8, train_loss: 1.1003, test_loss: 1.1035, test_f1: 0.4443
 epoch: 9, train_loss: 1.0854, test_loss: 1.0927, test_f1: 0.4280
 epoch: 10, train_loss: 1.0660, test_loss: 1.0720, test_f1: 0.4443
 epoch: 11, train_loss: 1.0540, test_loss: 1.0620, test_f1: 0.4492
 epoch: 12, train_loss: 1.0339, test_loss: 1.0510, test_f1: 0.4452
 epoch: 13, train_loss: 1.0146, test_loss: 1.0543, test_f1: 0.4653
 epoch: 14, train_loss: 1.0092, test_loss: 1.0369, test_f1: 0.4602
 epoch: 15, train_loss: 0.9874, test_loss: 1.0305, test_f1: 0.4521
 epoch: 16, train_loss: 0.9712, test_loss: 1.0226, test_f1: 0.4549
 epoch: 17, train_loss: 0.9521, test_loss: 1.0169, test_f1: 0.4462
 epoch: 18, train_loss: 0.9413, test_loss: 1.0030, test_f1: 0.4792
 epoch: 19, train_loss: 0.9356, test_loss: 1.0280, test_f1: 0.4545
 epoch: 20, train_loss: 0.9291, test_loss: 1.0087, test_f1: 0.4778
 epoch: 21, train_loss: 0.9201, test_loss: 1.0055, test_f1: 0.4856
 epoch: 22, train_loss: 0.8951, test_loss: 1.0138, test_f1: 0.4596
 epoch: 23, train_loss: 0.8910, test_loss: 1.0070, test_f1: 0.4674
 epoch: 24, train_loss: 0.8850, test_loss: 1.0373, test_f1: 0.4652
 epoch: 25, train_loss: 0.8681, test_loss: 1.0070, test_f1: 0.4738
 epoch: 26, train_loss: 0.8656, test_loss: 1.0176, test_f1: 0.4938
 epoch: 27, train_loss: 0.8512, test_loss: 1.0290, test_f1: 0.4949
 epoch: 28, train_loss: 0.8366, test_loss: 1.0150, test_f1: 0.4949
 epoch: 29, train_loss: 0.8218, test_loss: 1.0136, test_f1: 0.4941
 epoch: 30, train_loss: 0.8230, test_loss: 1.0168, test_f1: 0.5064
 epoch: 31, train_loss: 0.8038, test_loss: 1.0298, test_f1: 0.5090
 epoch: 32, train_loss: 0.7974, test_loss: 1.0283, test_f1: 0.5114
 epoch: 33, train_loss: 0.7830, test_loss: 1.0283, test_f1: 0.4985
 epoch: 34, train_loss: 0.7836, test_loss: 1.0373, test_f1: 0.5079
 epoch: 35, train_loss: 0.7708, test_loss: 1.0411, test_f1: 0.4960
 epoch: 36, train_loss: 0.7573, test_loss: 1.0752, test_f1: 0.4963
 epoch: 37, train_loss: 0.7695, test_loss: 1.0617, test_f1: 0.5028
 epoch: 38, train_loss: 0.7500, test_loss: 1.0503, test_f1: 0.5035
 epoch: 39, train_loss: 0.7450, test_loss: 1.0715, test_f1: 0.4984
 epoch: 40, train_loss: 0.7473, test_loss: 1.0853, test_f1: 0.4982
 epoch: 41, train_loss: 0.7362, test_loss: 1.0615, test_f1: 0.5176
 epoch: 42, train_loss: 0.7247, test_loss: 1.0559, test_f1: 0.5091
 epoch: 43, train_loss: 0.7277, test_loss: 1.0759, test_f1: 0.4928
 epoch: 44, train_loss: 0.7049, test_loss: 1.1076, test_f1: 0.5030
 epoch: 45, train_loss: 0.6889, test_loss: 1.1190, test_f1: 0.4896
 epoch: 46, train_loss: 0.6895, test_loss: 1.0914, test_f1: 0.5086
 epoch: 47, train_loss: 0.6684, test_loss: 1.0943, test_f1: 0.5145
 epoch: 48, train_loss: 0.6688, test_loss: 1.1387, test_f1: 0.5186
 epoch: 49, train_loss: 0.6726, test_loss: 1.1009, test_f1: 0.5154
 epoch: 50, train_loss: 0.6594, test_loss: 1.1341, test_f1: 0.5062
 epoch: 51, train_loss: 0.6471, test_loss: 1.1533, test_f1: 0.5044
 epoch: 52, train_loss: 0.6401, test_loss: 1.1339, test_f1: 0.5041
 epoch: 53, train_loss: 0.6280, test_loss: 1.1608, test_f1: 0.5214
 epoch: 54, train_loss: 0.6256, test_loss: 1.1619, test_f1: 0.5094
 epoch: 55, train_loss: 0.6296, test_loss: 1.1797, test_f1: 0.5080
 epoch: 56, train_loss: 0.6089, test_loss: 1.1632, test_f1: 0.5069
 epoch: 57, train_loss: 0.6262, test_loss: 1.1749, test_f1: 0.5165
 epoch: 58, train_loss: 0.6324, test_loss: 1.1840, test_f1: 0.5120
 epoch: 59, train_loss: 0.6039, test_loss: 1.1730, test_f1: 0.5293
 epoch: 60, train_loss: 0.6088, test_loss: 1.1958, test_f1: 0.5175
 epoch: 61, train_loss: 0.6140, test_loss: 1.1948, test_f1: 0.5231
 epoch: 62, train_loss: 0.5997, test_loss: 1.2122, test_f1: 0.5182
 epoch: 63, train_loss: 0.5911, test_loss: 1.2084, test_f1: 0.5293
 epoch: 64, train_loss: 0.6062, test_loss: 1.2029, test_f1: 0.5318
 epoch: 65, train_loss: 0.5884, test_loss: 1.2138, test_f1: 0.5264
 epoch: 66, train_loss: 0.5997, test_loss: 1.2287, test_f1: 0.5314
 epoch: 67, train_loss: 0.5842, test_loss: 1.2143, test_f1: 0.5362
 epoch: 68, train_loss: 0.5865, test_loss: 1.2365, test_f1: 0.5297
 epoch: 69, train_loss: 0.5841, test_loss: 1.2577, test_f1: 0.5397
 epoch: 70, train_loss: 0.5697, test_loss: 1.2406, test_f1: 0.5341
 epoch: 71, train_loss: 0.5835, test_loss: 1.2456, test_f1: 0.5383
 epoch: 72, train_loss: 0.5610, test_loss: 1.2401, test_f1: 0.5366
 epoch: 73, train_loss: 0.5704, test_loss: 1.2625, test_f1: 0.5343
 epoch: 74, train_loss: 0.5535, test_loss: 1.2452, test_f1: 0.5455
 epoch: 75, train_loss: 0.5606, test_loss: 1.2941, test_f1: 0.5349
 epoch: 76, train_loss: 0.5532, test_loss: 1.2932, test_f1: 0.5333
 epoch: 77, train_loss: 0.5485, test_loss: 1.2955, test_f1: 0.5263
 epoch: 78, train_loss: 0.5434, test_loss: 1.2952, test_f1: 0.5334
 epoch: 79, train_loss: 0.5647, test_loss: 1.2787, test_f1: 0.5303
 epoch: 80, train_loss: 0.5310, test_loss: 1.2897, test_f1: 0.5305
 epoch: 81, train_loss: 0.5539, test_loss: 1.2951, test_f1: 0.5415
 epoch: 82, train_loss: 0.5383, test_loss: 1.2821, test_f1: 0.5482
 epoch: 83, train_loss: 0.5434, test_loss: 1.2987, test_f1: 0.5307
 epoch: 84, train_loss: 0.5326, test_loss: 1.2909, test_f1: 0.5440
 epoch: 85, train_loss: 0.5272, test_loss: 1.3149, test_f1: 0.5418
 epoch: 86, train_loss: 0.5236, test_loss: 1.3073, test_f1: 0.5410
 epoch: 87, train_loss: 0.5103, test_loss: 1.3135, test_f1: 0.5471
 epoch: 88, train_loss: 0.5323, test_loss: 1.3111, test_f1: 0.5472
 epoch: 89, train_loss: 0.5275, test_loss: 1.3122, test_f1: 0.5429
 epoch: 90, train_loss: 0.5100, test_loss: 1.3805, test_f1: 0.5322
 epoch: 91, train_loss: 0.5003, test_loss: 1.3497, test_f1: 0.5329
 epoch: 92, train_loss: 0.5156, test_loss: 1.3467, test_f1: 0.5379
 epoch: 93, train_loss: 0.4936, test_loss: 1.3919, test_f1: 0.5376
 epoch: 94, train_loss: 0.4949, test_loss: 1.3924, test_f1: 0.5288
 epoch: 95, train_loss: 0.4935, test_loss: 1.3574, test_f1: 0.5513
 epoch: 96, train_loss: 0.5020, test_loss: 1.3810, test_f1: 0.5461
 epoch: 97, train_loss: 0.5090, test_loss: 1.3705, test_f1: 0.5394
 epoch: 98, train_loss: 0.4976, test_loss: 1.4053, test_f1: 0.5247
 epoch: 99, train_loss: 0.4940, test_loss: 1.4132, test_f1: 0.5286
##################ITERATION #4 ****************************************
 epoch: 0, train_loss: 1.3004, test_loss: 1.3232, test_f1: 0.2274
 epoch: 1, train_loss: 1.2227, test_loss: 1.2658, test_f1: 0.2612
 epoch: 2, train_loss: 1.2014, test_loss: 1.2153, test_f1: 0.3845
 epoch: 3, train_loss: 1.1801, test_loss: 1.1755, test_f1: 0.4026
 epoch: 4, train_loss: 1.1547, test_loss: 1.1498, test_f1: 0.4361
 epoch: 5, train_loss: 1.1478, test_loss: 1.1252, test_f1: 0.4558
 epoch: 6, train_loss: 1.1280, test_loss: 1.1127, test_f1: 0.4750
 epoch: 7, train_loss: 1.1154, test_loss: 1.0975, test_f1: 0.4664
 epoch: 8, train_loss: 1.0990, test_loss: 1.0869, test_f1: 0.4752
 epoch: 9, train_loss: 1.0750, test_loss: 1.0778, test_f1: 0.4524
 epoch: 10, train_loss: 1.0755, test_loss: 1.0796, test_f1: 0.4658
 epoch: 11, train_loss: 1.0494, test_loss: 1.0808, test_f1: 0.4513
 epoch: 12, train_loss: 1.0442, test_loss: 1.0518, test_f1: 0.4565
 epoch: 13, train_loss: 1.0187, test_loss: 1.0443, test_f1: 0.4583
 epoch: 14, train_loss: 1.0233, test_loss: 1.0465, test_f1: 0.4519
 epoch: 15, train_loss: 1.0072, test_loss: 1.1750, test_f1: 0.4518
 epoch: 16, train_loss: 0.9925, test_loss: 1.0502, test_f1: 0.4542
 epoch: 17, train_loss: 0.9860, test_loss: 1.0386, test_f1: 0.4655
 epoch: 18, train_loss: 0.9759, test_loss: 1.0364, test_f1: 0.4590
 epoch: 19, train_loss: 0.9633, test_loss: 1.2324, test_f1: 0.4427
 epoch: 20, train_loss: 0.9540, test_loss: 1.0550, test_f1: 0.4518
 epoch: 21, train_loss: 0.9281, test_loss: 1.0290, test_f1: 0.4820
 epoch: 22, train_loss: 0.9286, test_loss: 1.0461, test_f1: 0.4719
 epoch: 23, train_loss: 0.9087, test_loss: 1.2267, test_f1: 0.4584
 epoch: 24, train_loss: 0.9014, test_loss: 1.0254, test_f1: 0.4795
 epoch: 25, train_loss: 0.8904, test_loss: 1.0776, test_f1: 0.4484
 epoch: 26, train_loss: 0.8882, test_loss: 1.0524, test_f1: 0.4744
 epoch: 27, train_loss: 0.8661, test_loss: 1.0742, test_f1: 0.4732
 epoch: 28, train_loss: 0.8607, test_loss: 1.1054, test_f1: 0.4489
 epoch: 29, train_loss: 0.8505, test_loss: 1.0688, test_f1: 0.4922
 epoch: 30, train_loss: 0.8445, test_loss: 1.1197, test_f1: 0.4708
 epoch: 31, train_loss: 0.8328, test_loss: 1.1404, test_f1: 0.4656
 epoch: 32, train_loss: 0.8283, test_loss: 1.0996, test_f1: 0.4712
 epoch: 33, train_loss: 0.8242, test_loss: 1.0834, test_f1: 0.4889
 epoch: 34, train_loss: 0.8127, test_loss: 1.0645, test_f1: 0.4856
 epoch: 35, train_loss: 0.8149, test_loss: 1.1295, test_f1: 0.4846
 epoch: 36, train_loss: 0.7968, test_loss: 1.0887, test_f1: 0.4975
 epoch: 37, train_loss: 0.7741, test_loss: 1.2057, test_f1: 0.4702
 epoch: 38, train_loss: 0.7797, test_loss: 1.0937, test_f1: 0.4890
 epoch: 39, train_loss: 0.7685, test_loss: 1.0727, test_f1: 0.4922
 epoch: 40, train_loss: 0.7632, test_loss: 1.4772, test_f1: 0.4776
 epoch: 41, train_loss: 0.7457, test_loss: 1.1683, test_f1: 0.5012
 epoch: 42, train_loss: 0.7545, test_loss: 1.1232, test_f1: 0.5100
 epoch: 43, train_loss: 0.7367, test_loss: 1.4425, test_f1: 0.4903
 epoch: 44, train_loss: 0.7312, test_loss: 1.2161, test_f1: 0.4933
 epoch: 45, train_loss: 0.7376, test_loss: 1.2151, test_f1: 0.5058
 epoch: 46, train_loss: 0.7389, test_loss: 1.3411, test_f1: 0.4851
 epoch: 47, train_loss: 0.7305, test_loss: 1.2195, test_f1: 0.5057
 epoch: 48, train_loss: 0.7160, test_loss: 1.3247, test_f1: 0.4832
 epoch: 49, train_loss: 0.6985, test_loss: 1.4308, test_f1: 0.4884
 epoch: 50, train_loss: 0.6827, test_loss: 1.1712, test_f1: 0.5160
 epoch: 51, train_loss: 0.6812, test_loss: 1.3503, test_f1: 0.5144
 epoch: 52, train_loss: 0.6617, test_loss: 1.3159, test_f1: 0.4880
 epoch: 53, train_loss: 0.6706, test_loss: 1.3105, test_f1: 0.4883
 epoch: 54, train_loss: 0.6768, test_loss: 1.2411, test_f1: 0.5015
 epoch: 55, train_loss: 0.6616, test_loss: 1.2789, test_f1: 0.4929
 epoch: 56, train_loss: 0.6549, test_loss: 1.4195, test_f1: 0.5122
 epoch: 57, train_loss: 0.6571, test_loss: 1.2974, test_f1: 0.5047
 epoch: 58, train_loss: 0.6455, test_loss: 1.4650, test_f1: 0.4971
 epoch: 59, train_loss: 0.6519, test_loss: 1.3267, test_f1: 0.4907
 epoch: 60, train_loss: 0.6540, test_loss: 1.3996, test_f1: 0.4996
 epoch: 61, train_loss: 0.6477, test_loss: 1.3456, test_f1: 0.5042
 epoch: 62, train_loss: 0.6399, test_loss: 1.3551, test_f1: 0.5049
 epoch: 63, train_loss: 0.6293, test_loss: 1.4239, test_f1: 0.4817
 epoch: 64, train_loss: 0.6425, test_loss: 1.4061, test_f1: 0.5088
 epoch: 65, train_loss: 0.6304, test_loss: 1.4100, test_f1: 0.4960
 epoch: 66, train_loss: 0.6236, test_loss: 1.3997, test_f1: 0.5023
 epoch: 67, train_loss: 0.6195, test_loss: 1.3483, test_f1: 0.5299
 epoch: 68, train_loss: 0.6250, test_loss: 1.3639, test_f1: 0.5165
 epoch: 69, train_loss: 0.6066, test_loss: 1.5111, test_f1: 0.5075
 epoch: 70, train_loss: 0.6034, test_loss: 1.3809, test_f1: 0.5213
 epoch: 71, train_loss: 0.6115, test_loss: 1.3535, test_f1: 0.5109
 epoch: 72, train_loss: 0.6155, test_loss: 1.3617, test_f1: 0.5217
 epoch: 73, train_loss: 0.6010, test_loss: 1.4276, test_f1: 0.5018
 epoch: 74, train_loss: 0.5978, test_loss: 1.4259, test_f1: 0.4928
 epoch: 75, train_loss: 0.6078, test_loss: 1.5616, test_f1: 0.5093
 epoch: 76, train_loss: 0.5936, test_loss: 1.4209, test_f1: 0.5177
 epoch: 77, train_loss: 0.6093, test_loss: 1.7268, test_f1: 0.5084
 epoch: 78, train_loss: 0.6041, test_loss: 1.5047, test_f1: 0.5086
 epoch: 79, train_loss: 0.5850, test_loss: 1.5173, test_f1: 0.5141
 epoch: 80, train_loss: 0.5869, test_loss: 1.5412, test_f1: 0.5147
 epoch: 81, train_loss: 0.5717, test_loss: 1.4867, test_f1: 0.5159
 epoch: 82, train_loss: 0.5945, test_loss: 1.4310, test_f1: 0.5224
 epoch: 83, train_loss: 0.5873, test_loss: 1.4879, test_f1: 0.5158
 epoch: 84, train_loss: 0.5733, test_loss: 1.4888, test_f1: 0.5105
 epoch: 85, train_loss: 0.5649, test_loss: 1.5891, test_f1: 0.5102
 epoch: 86, train_loss: 0.5473, test_loss: 1.4809, test_f1: 0.5059
 epoch: 87, train_loss: 0.5905, test_loss: 1.4792, test_f1: 0.5102
 epoch: 88, train_loss: 0.5389, test_loss: 1.4753, test_f1: 0.5204
 epoch: 89, train_loss: 0.5482, test_loss: 1.4855, test_f1: 0.5084
 epoch: 90, train_loss: 0.5510, test_loss: 1.5468, test_f1: 0.5157
 epoch: 91, train_loss: 0.5338, test_loss: 1.5636, test_f1: 0.5073
 epoch: 92, train_loss: 0.5617, test_loss: 1.5546, test_f1: 0.5086
 epoch: 93, train_loss: 0.5409, test_loss: 1.5535, test_f1: 0.4984
 epoch: 94, train_loss: 0.5556, test_loss: 1.5324, test_f1: 0.4989
 epoch: 95, train_loss: 0.5645, test_loss: 1.5920, test_f1: 0.5116
 epoch: 96, train_loss: 0.5386, test_loss: 1.5330, test_f1: 0.5147
 epoch: 97, train_loss: 0.5379, test_loss: 1.6437, test_f1: 0.5098
 epoch: 98, train_loss: 0.5337, test_loss: 1.5331, test_f1: 0.5087
 epoch: 99, train_loss: 0.5443, test_loss: 1.4960, test_f1: 0.5110
##################ITERATION #5 ****************************************
 epoch: 0, train_loss: 1.3154, test_loss: 1.3088, test_f1: 0.2423
 epoch: 1, train_loss: 1.2240, test_loss: 1.2678, test_f1: 0.2571
 epoch: 2, train_loss: 1.2019, test_loss: 1.2151, test_f1: 0.2937
 epoch: 3, train_loss: 1.1727, test_loss: 1.1817, test_f1: 0.3506
 epoch: 4, train_loss: 1.1555, test_loss: 1.1438, test_f1: 0.4258
 epoch: 5, train_loss: 1.1370, test_loss: 1.1246, test_f1: 0.4342
 epoch: 6, train_loss: 1.1259, test_loss: 1.1132, test_f1: 0.4440
 epoch: 7, train_loss: 1.1123, test_loss: 1.1086, test_f1: 0.4309
 epoch: 8, train_loss: 1.1014, test_loss: 1.1091, test_f1: 0.4257
 epoch: 9, train_loss: 1.0871, test_loss: 1.0951, test_f1: 0.4277
 epoch: 10, train_loss: 1.0660, test_loss: 1.0829, test_f1: 0.4443
 epoch: 11, train_loss: 1.0621, test_loss: 1.0791, test_f1: 0.4458
 epoch: 12, train_loss: 1.0471, test_loss: 1.0676, test_f1: 0.4454
 epoch: 13, train_loss: 1.0304, test_loss: 1.0640, test_f1: 0.4502
 epoch: 14, train_loss: 1.0208, test_loss: 1.0587, test_f1: 0.4591
 epoch: 15, train_loss: 1.0118, test_loss: 1.0405, test_f1: 0.4683
 epoch: 16, train_loss: 0.9951, test_loss: 1.0509, test_f1: 0.4442
 epoch: 17, train_loss: 0.9937, test_loss: 1.0401, test_f1: 0.4534
 epoch: 18, train_loss: 0.9732, test_loss: 1.0538, test_f1: 0.4613
 epoch: 19, train_loss: 0.9604, test_loss: 1.1029, test_f1: 0.4731
 epoch: 20, train_loss: 0.9467, test_loss: 1.1716, test_f1: 0.4540
 epoch: 21, train_loss: 0.9324, test_loss: 1.1026, test_f1: 0.4813
 epoch: 22, train_loss: 0.9145, test_loss: 1.1651, test_f1: 0.4623
 epoch: 23, train_loss: 0.9136, test_loss: 1.1219, test_f1: 0.4814
 epoch: 24, train_loss: 0.8982, test_loss: 1.0858, test_f1: 0.4911
 epoch: 25, train_loss: 0.8893, test_loss: 1.1151, test_f1: 0.4757
 epoch: 26, train_loss: 0.8937, test_loss: 1.1428, test_f1: 0.5021
 epoch: 27, train_loss: 0.8650, test_loss: 1.1568, test_f1: 0.4712
 epoch: 28, train_loss: 0.8573, test_loss: 1.1490, test_f1: 0.4763
 epoch: 29, train_loss: 0.8535, test_loss: 1.1895, test_f1: 0.4781
 epoch: 30, train_loss: 0.8341, test_loss: 1.0487, test_f1: 0.4872
 epoch: 31, train_loss: 0.8322, test_loss: 1.1389, test_f1: 0.4814
 epoch: 32, train_loss: 0.8154, test_loss: 1.0551, test_f1: 0.4830
 epoch: 33, train_loss: 0.8050, test_loss: 1.0501, test_f1: 0.4965
 epoch: 34, train_loss: 0.8112, test_loss: 1.1014, test_f1: 0.4702
 epoch: 35, train_loss: 0.7983, test_loss: 1.1204, test_f1: 0.4926
 epoch: 36, train_loss: 0.8013, test_loss: 1.1658, test_f1: 0.4877
 epoch: 37, train_loss: 0.7781, test_loss: 1.3161, test_f1: 0.4803
 epoch: 38, train_loss: 0.7783, test_loss: 1.2735, test_f1: 0.4758
 epoch: 39, train_loss: 0.7668, test_loss: 1.1407, test_f1: 0.5167
 epoch: 40, train_loss: 0.7616, test_loss: 1.1964, test_f1: 0.5008
 epoch: 41, train_loss: 0.7379, test_loss: 1.4049, test_f1: 0.4813
 epoch: 42, train_loss: 0.7256, test_loss: 1.2514, test_f1: 0.4928
 epoch: 43, train_loss: 0.7174, test_loss: 1.2804, test_f1: 0.5073
 epoch: 44, train_loss: 0.7310, test_loss: 1.3636, test_f1: 0.5163
 epoch: 45, train_loss: 0.7164, test_loss: 1.4387, test_f1: 0.4977
 epoch: 46, train_loss: 0.7161, test_loss: 1.3635, test_f1: 0.4885
 epoch: 47, train_loss: 0.7139, test_loss: 1.3028, test_f1: 0.4927
 epoch: 48, train_loss: 0.6903, test_loss: 1.3405, test_f1: 0.5110
 epoch: 49, train_loss: 0.7029, test_loss: 1.2558, test_f1: 0.4947
 epoch: 50, train_loss: 0.6896, test_loss: 1.3079, test_f1: 0.5118
 epoch: 51, train_loss: 0.6666, test_loss: 1.5064, test_f1: 0.4857
 epoch: 52, train_loss: 0.6596, test_loss: 1.4575, test_f1: 0.4925
 epoch: 53, train_loss: 0.6662, test_loss: 1.4592, test_f1: 0.4964
 epoch: 54, train_loss: 0.6547, test_loss: 1.4061, test_f1: 0.5106
 epoch: 55, train_loss: 0.6548, test_loss: 1.4242, test_f1: 0.5041
 epoch: 56, train_loss: 0.6352, test_loss: 1.4395, test_f1: 0.5024
 epoch: 57, train_loss: 0.6273, test_loss: 1.4613, test_f1: 0.5169
 epoch: 58, train_loss: 0.6394, test_loss: 1.4734, test_f1: 0.5081
 epoch: 59, train_loss: 0.6408, test_loss: 1.4780, test_f1: 0.5106
 epoch: 60, train_loss: 0.6223, test_loss: 1.5438, test_f1: 0.5100
 epoch: 61, train_loss: 0.6409, test_loss: 1.4317, test_f1: 0.4959
 epoch: 62, train_loss: 0.6205, test_loss: 1.3755, test_f1: 0.5098
 epoch: 63, train_loss: 0.6313, test_loss: 1.3715, test_f1: 0.5086
 epoch: 64, train_loss: 0.6197, test_loss: 1.4935, test_f1: 0.5037
 epoch: 65, train_loss: 0.6158, test_loss: 1.4377, test_f1: 0.5035
 epoch: 66, train_loss: 0.6127, test_loss: 1.4615, test_f1: 0.5147
 epoch: 67, train_loss: 0.6006, test_loss: 1.4845, test_f1: 0.4916
 epoch: 68, train_loss: 0.6085, test_loss: 1.5314, test_f1: 0.4812
 epoch: 69, train_loss: 0.6124, test_loss: 1.4702, test_f1: 0.5082
 epoch: 70, train_loss: 0.5946, test_loss: 1.4815, test_f1: 0.5211
 epoch: 71, train_loss: 0.6015, test_loss: 1.4230, test_f1: 0.5296
 epoch: 72, train_loss: 0.6009, test_loss: 1.4525, test_f1: 0.5253
 epoch: 73, train_loss: 0.5865, test_loss: 1.5106, test_f1: 0.5141
 epoch: 74, train_loss: 0.5747, test_loss: 1.6552, test_f1: 0.5061
 epoch: 75, train_loss: 0.5716, test_loss: 1.5754, test_f1: 0.5244
 epoch: 76, train_loss: 0.5861, test_loss: 1.4749, test_f1: 0.5263
 epoch: 77, train_loss: 0.5770, test_loss: 1.4238, test_f1: 0.5281
 epoch: 78, train_loss: 0.5707, test_loss: 1.4870, test_f1: 0.5270
 epoch: 79, train_loss: 0.5777, test_loss: 1.5214, test_f1: 0.5234
 epoch: 80, train_loss: 0.5734, test_loss: 1.4735, test_f1: 0.5296
 epoch: 81, train_loss: 0.5564, test_loss: 1.4702, test_f1: 0.5276
 epoch: 82, train_loss: 0.5673, test_loss: 1.4914, test_f1: 0.5160
 epoch: 83, train_loss: 0.5661, test_loss: 1.4382, test_f1: 0.5167
 epoch: 84, train_loss: 0.5691, test_loss: 1.3221, test_f1: 0.5262
 epoch: 85, train_loss: 0.5534, test_loss: 1.3970, test_f1: 0.5300
 epoch: 86, train_loss: 0.5430, test_loss: 1.4625, test_f1: 0.5283
 epoch: 87, train_loss: 0.5583, test_loss: 1.5177, test_f1: 0.5226
 epoch: 88, train_loss: 0.5462, test_loss: 1.4662, test_f1: 0.5123
 epoch: 89, train_loss: 0.5394, test_loss: 1.5566, test_f1: 0.5205
 epoch: 90, train_loss: 0.5302, test_loss: 1.5811, test_f1: 0.5165
 epoch: 91, train_loss: 0.5229, test_loss: 1.5725, test_f1: 0.5145
 epoch: 92, train_loss: 0.5292, test_loss: 1.5867, test_f1: 0.5242
 epoch: 93, train_loss: 0.5464, test_loss: 1.5281, test_f1: 0.5224
 epoch: 94, train_loss: 0.5404, test_loss: 1.4657, test_f1: 0.5306
 epoch: 95, train_loss: 0.5231, test_loss: 1.5181, test_f1: 0.5374
 epoch: 96, train_loss: 0.5226, test_loss: 1.5546, test_f1: 0.5333
 epoch: 97, train_loss: 0.5196, test_loss: 1.5728, test_f1: 0.5365
 epoch: 98, train_loss: 0.5329, test_loss: 1.5039, test_f1: 0.5503
 epoch: 99, train_loss: 0.5141, test_loss: 1.5240, test_f1: 0.5143
##################ITERATION #6 ****************************************
 epoch: 0, train_loss: 1.3272, test_loss: 1.3157, test_f1: 0.2736
 epoch: 1, train_loss: 1.2113, test_loss: 1.2409, test_f1: 0.4084
 epoch: 2, train_loss: 1.1849, test_loss: 1.1804, test_f1: 0.4609
 epoch: 3, train_loss: 1.1530, test_loss: 1.1451, test_f1: 0.4326
 epoch: 4, train_loss: 1.1411, test_loss: 1.1302, test_f1: 0.4448
 epoch: 5, train_loss: 1.1218, test_loss: 1.1103, test_f1: 0.4483
 epoch: 6, train_loss: 1.1063, test_loss: 1.0895, test_f1: 0.4597
 epoch: 7, train_loss: 1.0939, test_loss: 1.0775, test_f1: 0.4563
 epoch: 8, train_loss: 1.0805, test_loss: 1.0626, test_f1: 0.4736
 epoch: 9, train_loss: 1.0736, test_loss: 1.0557, test_f1: 0.4678
 epoch: 10, train_loss: 1.0510, test_loss: 1.0450, test_f1: 0.4763
 epoch: 11, train_loss: 1.0352, test_loss: 1.0462, test_f1: 0.4499
 epoch: 12, train_loss: 1.0228, test_loss: 1.0439, test_f1: 0.4526
 epoch: 13, train_loss: 1.0119, test_loss: 1.0353, test_f1: 0.4715
 epoch: 14, train_loss: 1.0133, test_loss: 1.0418, test_f1: 0.4417
 epoch: 15, train_loss: 0.9913, test_loss: 1.0386, test_f1: 0.4543
 epoch: 16, train_loss: 0.9843, test_loss: 1.0385, test_f1: 0.4633
 epoch: 17, train_loss: 0.9767, test_loss: 1.0387, test_f1: 0.4585
 epoch: 18, train_loss: 0.9711, test_loss: 1.0335, test_f1: 0.4736
 epoch: 19, train_loss: 0.9499, test_loss: 1.0357, test_f1: 0.4583
 epoch: 20, train_loss: 0.9468, test_loss: 1.0530, test_f1: 0.4602
 epoch: 21, train_loss: 0.9415, test_loss: 1.0468, test_f1: 0.4706
 epoch: 22, train_loss: 0.9122, test_loss: 1.0603, test_f1: 0.4775
 epoch: 23, train_loss: 0.9183, test_loss: 1.0401, test_f1: 0.4946
 epoch: 24, train_loss: 0.9129, test_loss: 1.0718, test_f1: 0.4802
 epoch: 25, train_loss: 0.9086, test_loss: 1.0207, test_f1: 0.5052
 epoch: 26, train_loss: 0.8878, test_loss: 1.0646, test_f1: 0.4817
 epoch: 27, train_loss: 0.8776, test_loss: 1.0488, test_f1: 0.4762
 epoch: 28, train_loss: 0.8759, test_loss: 1.0449, test_f1: 0.4961
 epoch: 29, train_loss: 0.8677, test_loss: 1.0620, test_f1: 0.4819
 epoch: 30, train_loss: 0.8538, test_loss: 1.0727, test_f1: 0.4796
 epoch: 31, train_loss: 0.8544, test_loss: 1.0408, test_f1: 0.5010
 epoch: 32, train_loss: 0.8361, test_loss: 1.0941, test_f1: 0.5006
 epoch: 33, train_loss: 0.8389, test_loss: 1.0717, test_f1: 0.5067
 epoch: 34, train_loss: 0.8289, test_loss: 1.1128, test_f1: 0.4966
 epoch: 35, train_loss: 0.8184, test_loss: 1.0837, test_f1: 0.5083
 epoch: 36, train_loss: 0.8107, test_loss: 1.1041, test_f1: 0.4941
 epoch: 37, train_loss: 0.8167, test_loss: 1.1235, test_f1: 0.4822
 epoch: 38, train_loss: 0.7989, test_loss: 1.0908, test_f1: 0.5019
 epoch: 39, train_loss: 0.7842, test_loss: 1.1021, test_f1: 0.5047
 epoch: 40, train_loss: 0.7733, test_loss: 1.1276, test_f1: 0.5087
 epoch: 41, train_loss: 0.7686, test_loss: 1.1128, test_f1: 0.5043
 epoch: 42, train_loss: 0.7731, test_loss: 1.1316, test_f1: 0.5012
 epoch: 43, train_loss: 0.7630, test_loss: 1.1561, test_f1: 0.5059
 epoch: 44, train_loss: 0.7402, test_loss: 1.1961, test_f1: 0.4960
 epoch: 45, train_loss: 0.7360, test_loss: 1.1552, test_f1: 0.4877
 epoch: 46, train_loss: 0.7391, test_loss: 1.1785, test_f1: 0.4938
 epoch: 47, train_loss: 0.7267, test_loss: 1.1866, test_f1: 0.5149
 epoch: 48, train_loss: 0.7242, test_loss: 1.1931, test_f1: 0.5096
 epoch: 49, train_loss: 0.7184, test_loss: 1.2169, test_f1: 0.5417
 epoch: 50, train_loss: 0.6993, test_loss: 1.2046, test_f1: 0.5037
 epoch: 51, train_loss: 0.6923, test_loss: 1.1964, test_f1: 0.4887
 epoch: 52, train_loss: 0.6958, test_loss: 1.2237, test_f1: 0.5039
 epoch: 53, train_loss: 0.6758, test_loss: 1.2388, test_f1: 0.5156
 epoch: 54, train_loss: 0.6730, test_loss: 1.2329, test_f1: 0.5195
 epoch: 55, train_loss: 0.6752, test_loss: 1.2417, test_f1: 0.5113
 epoch: 56, train_loss: 0.6737, test_loss: 1.2415, test_f1: 0.5037
 epoch: 57, train_loss: 0.6616, test_loss: 1.2629, test_f1: 0.5177
 epoch: 58, train_loss: 0.6693, test_loss: 1.2698, test_f1: 0.4950
 epoch: 59, train_loss: 0.6521, test_loss: 1.2916, test_f1: 0.5145
 epoch: 60, train_loss: 0.6563, test_loss: 1.2793, test_f1: 0.5259
 epoch: 61, train_loss: 0.6437, test_loss: 1.2775, test_f1: 0.4988
 epoch: 62, train_loss: 0.6485, test_loss: 1.2823, test_f1: 0.5033
 epoch: 63, train_loss: 0.6514, test_loss: 1.2791, test_f1: 0.5127
 epoch: 64, train_loss: 0.6432, test_loss: 1.3200, test_f1: 0.5170
 epoch: 65, train_loss: 0.6306, test_loss: 1.3115, test_f1: 0.5136
 epoch: 66, train_loss: 0.6513, test_loss: 1.2971, test_f1: 0.5134
 epoch: 67, train_loss: 0.6460, test_loss: 1.3345, test_f1: 0.5048
 epoch: 68, train_loss: 0.6445, test_loss: 1.3020, test_f1: 0.5123
 epoch: 69, train_loss: 0.6284, test_loss: 1.3152, test_f1: 0.5033
 epoch: 70, train_loss: 0.6265, test_loss: 1.2744, test_f1: 0.5180
 epoch: 71, train_loss: 0.6357, test_loss: 1.3222, test_f1: 0.5128
 epoch: 72, train_loss: 0.6255, test_loss: 1.3192, test_f1: 0.5140
 epoch: 73, train_loss: 0.6137, test_loss: 1.2981, test_f1: 0.5110
 epoch: 74, train_loss: 0.6188, test_loss: 1.3400, test_f1: 0.5163
 epoch: 75, train_loss: 0.6135, test_loss: 1.3209, test_f1: 0.5182
 epoch: 76, train_loss: 0.6033, test_loss: 1.3138, test_f1: 0.5348
 epoch: 77, train_loss: 0.5870, test_loss: 1.3878, test_f1: 0.5054
 epoch: 78, train_loss: 0.5988, test_loss: 1.3883, test_f1: 0.5217
 epoch: 79, train_loss: 0.6103, test_loss: 1.3394, test_f1: 0.5075
 epoch: 80, train_loss: 0.5910, test_loss: 1.3983, test_f1: 0.5052
 epoch: 81, train_loss: 0.5932, test_loss: 1.3961, test_f1: 0.5418
 epoch: 82, train_loss: 0.5849, test_loss: 1.3798, test_f1: 0.5306
 epoch: 83, train_loss: 0.5803, test_loss: 1.3951, test_f1: 0.5115
 epoch: 84, train_loss: 0.5786, test_loss: 1.3943, test_f1: 0.5149
 epoch: 85, train_loss: 0.5708, test_loss: 1.4260, test_f1: 0.5058
 epoch: 86, train_loss: 0.5670, test_loss: 1.4000, test_f1: 0.5244
 epoch: 87, train_loss: 0.5687, test_loss: 1.4021, test_f1: 0.5229
 epoch: 88, train_loss: 0.5660, test_loss: 1.4129, test_f1: 0.5121
 epoch: 89, train_loss: 0.5497, test_loss: 1.4315, test_f1: 0.5165
 epoch: 90, train_loss: 0.5566, test_loss: 1.4501, test_f1: 0.5179
 epoch: 91, train_loss: 0.5624, test_loss: 1.4416, test_f1: 0.5306
 epoch: 92, train_loss: 0.5671, test_loss: 1.4075, test_f1: 0.5420
 epoch: 93, train_loss: 0.5562, test_loss: 1.4325, test_f1: 0.5176
 epoch: 94, train_loss: 0.5668, test_loss: 1.4420, test_f1: 0.5222
 epoch: 95, train_loss: 0.5752, test_loss: 1.4712, test_f1: 0.5278
 epoch: 96, train_loss: 0.5426, test_loss: 1.4449, test_f1: 0.5229
 epoch: 97, train_loss: 0.5558, test_loss: 1.5096, test_f1: 0.5164
 epoch: 98, train_loss: 0.5584, test_loss: 1.4771, test_f1: 0.5168
 epoch: 99, train_loss: 0.5522, test_loss: 1.4717, test_f1: 0.5263
##################ITERATION #7 ****************************************
 epoch: 0, train_loss: 1.3211, test_loss: 1.3114, test_f1: 0.2400
 epoch: 1, train_loss: 1.2247, test_loss: 1.2591, test_f1: 0.2918
 epoch: 2, train_loss: 1.1985, test_loss: 1.2027, test_f1: 0.4035
 epoch: 3, train_loss: 1.1698, test_loss: 1.1407, test_f1: 0.4487
 epoch: 4, train_loss: 1.1470, test_loss: 1.1090, test_f1: 0.4722
 epoch: 5, train_loss: 1.1364, test_loss: 1.0842, test_f1: 0.4650
 epoch: 6, train_loss: 1.1026, test_loss: 1.0792, test_f1: 0.4818
 epoch: 7, train_loss: 1.1140, test_loss: 1.0718, test_f1: 0.4645
 epoch: 8, train_loss: 1.0830, test_loss: 1.0600, test_f1: 0.4899
 epoch: 9, train_loss: 1.0668, test_loss: 1.0536, test_f1: 0.4795
 epoch: 10, train_loss: 1.0560, test_loss: 1.0558, test_f1: 0.4735
 epoch: 11, train_loss: 1.0605, test_loss: 1.0425, test_f1: 0.4832
 epoch: 12, train_loss: 1.0307, test_loss: 1.0333, test_f1: 0.4964
 epoch: 13, train_loss: 1.0095, test_loss: 1.0335, test_f1: 0.4992
 epoch: 14, train_loss: 1.0099, test_loss: 1.0261, test_f1: 0.4947
 epoch: 15, train_loss: 0.9942, test_loss: 1.0223, test_f1: 0.4851
 epoch: 16, train_loss: 0.9859, test_loss: 1.0263, test_f1: 0.4853
 epoch: 17, train_loss: 0.9697, test_loss: 1.0153, test_f1: 0.4878
 epoch: 18, train_loss: 0.9636, test_loss: 1.0161, test_f1: 0.4844
 epoch: 19, train_loss: 0.9484, test_loss: 1.0062, test_f1: 0.4940
 epoch: 20, train_loss: 0.9479, test_loss: 1.0236, test_f1: 0.4805
 epoch: 21, train_loss: 0.9326, test_loss: 1.0075, test_f1: 0.4970
 epoch: 22, train_loss: 0.9297, test_loss: 1.0136, test_f1: 0.5018
 epoch: 23, train_loss: 0.9162, test_loss: 1.0128, test_f1: 0.5060
 epoch: 24, train_loss: 0.8974, test_loss: 1.0135, test_f1: 0.4870
 epoch: 25, train_loss: 0.8847, test_loss: 1.0061, test_f1: 0.4812
 epoch: 26, train_loss: 0.8809, test_loss: 1.0210, test_f1: 0.4849
 epoch: 27, train_loss: 0.8720, test_loss: 1.0147, test_f1: 0.4934
 epoch: 28, train_loss: 0.8678, test_loss: 1.0199, test_f1: 0.4809
 epoch: 29, train_loss: 0.8549, test_loss: 1.0090, test_f1: 0.4861
 epoch: 30, train_loss: 0.8465, test_loss: 1.0323, test_f1: 0.4853
 epoch: 31, train_loss: 0.8243, test_loss: 1.0247, test_f1: 0.4791
 epoch: 32, train_loss: 0.8163, test_loss: 1.0283, test_f1: 0.5031
 epoch: 33, train_loss: 0.8097, test_loss: 1.0381, test_f1: 0.4905
 epoch: 34, train_loss: 0.8081, test_loss: 1.0365, test_f1: 0.4796
 epoch: 35, train_loss: 0.7870, test_loss: 1.0505, test_f1: 0.4834
 epoch: 36, train_loss: 0.7990, test_loss: 1.0628, test_f1: 0.4874
 epoch: 37, train_loss: 0.7841, test_loss: 1.0515, test_f1: 0.4906
 epoch: 38, train_loss: 0.7855, test_loss: 1.0696, test_f1: 0.4786
 epoch: 39, train_loss: 0.7690, test_loss: 1.0772, test_f1: 0.4859
 epoch: 40, train_loss: 0.7483, test_loss: 1.0657, test_f1: 0.4914
 epoch: 41, train_loss: 0.7489, test_loss: 1.0706, test_f1: 0.4945
 epoch: 42, train_loss: 0.7507, test_loss: 1.1213, test_f1: 0.4859
 epoch: 43, train_loss: 0.7377, test_loss: 1.0698, test_f1: 0.4969
 epoch: 44, train_loss: 0.7324, test_loss: 1.0621, test_f1: 0.4883
 epoch: 45, train_loss: 0.7186, test_loss: 1.1341, test_f1: 0.4794
 epoch: 46, train_loss: 0.7115, test_loss: 1.1405, test_f1: 0.4605
 epoch: 47, train_loss: 0.6957, test_loss: 1.1338, test_f1: 0.4915
 epoch: 48, train_loss: 0.7090, test_loss: 1.1875, test_f1: 0.5072
 epoch: 49, train_loss: 0.6979, test_loss: 1.1153, test_f1: 0.5005
 epoch: 50, train_loss: 0.6733, test_loss: 1.1545, test_f1: 0.4975
 epoch: 51, train_loss: 0.6629, test_loss: 1.1730, test_f1: 0.4888
 epoch: 52, train_loss: 0.6660, test_loss: 1.1840, test_f1: 0.5021
 epoch: 53, train_loss: 0.6513, test_loss: 1.1519, test_f1: 0.4965
 epoch: 54, train_loss: 0.6312, test_loss: 1.1858, test_f1: 0.5021
 epoch: 55, train_loss: 0.6300, test_loss: 1.1959, test_f1: 0.5158
 epoch: 56, train_loss: 0.6471, test_loss: 1.2019, test_f1: 0.4909
 epoch: 57, train_loss: 0.6303, test_loss: 1.2112, test_f1: 0.5172
 epoch: 58, train_loss: 0.6303, test_loss: 1.2175, test_f1: 0.5044
 epoch: 59, train_loss: 0.6177, test_loss: 1.2079, test_f1: 0.4940
 epoch: 60, train_loss: 0.6183, test_loss: 1.2134, test_f1: 0.5052
 epoch: 61, train_loss: 0.6274, test_loss: 1.2085, test_f1: 0.4944
 epoch: 62, train_loss: 0.6095, test_loss: 1.2390, test_f1: 0.4937
 epoch: 63, train_loss: 0.6205, test_loss: 1.2506, test_f1: 0.4893
 epoch: 64, train_loss: 0.6279, test_loss: 1.2024, test_f1: 0.4930
 epoch: 65, train_loss: 0.6056, test_loss: 1.2325, test_f1: 0.5225
 epoch: 66, train_loss: 0.6098, test_loss: 1.2336, test_f1: 0.5130
 epoch: 67, train_loss: 0.6131, test_loss: 1.2423, test_f1: 0.5087
 epoch: 68, train_loss: 0.6026, test_loss: 1.2584, test_f1: 0.5111
 epoch: 69, train_loss: 0.5994, test_loss: 1.2453, test_f1: 0.4980
 epoch: 70, train_loss: 0.5866, test_loss: 1.2825, test_f1: 0.5018
 epoch: 71, train_loss: 0.6017, test_loss: 1.2402, test_f1: 0.5104
 epoch: 72, train_loss: 0.5846, test_loss: 1.2709, test_f1: 0.5041
 epoch: 73, train_loss: 0.5823, test_loss: 1.2919, test_f1: 0.4982
 epoch: 74, train_loss: 0.5787, test_loss: 1.2956, test_f1: 0.4936
 epoch: 75, train_loss: 0.5787, test_loss: 1.2784, test_f1: 0.5109
 epoch: 76, train_loss: 0.5608, test_loss: 1.3086, test_f1: 0.5072
 epoch: 77, train_loss: 0.5642, test_loss: 1.2859, test_f1: 0.5051
 epoch: 78, train_loss: 0.5760, test_loss: 1.3135, test_f1: 0.5049
 epoch: 79, train_loss: 0.5871, test_loss: 1.3581, test_f1: 0.5074
 epoch: 80, train_loss: 0.5569, test_loss: 1.3078, test_f1: 0.5033
 epoch: 81, train_loss: 0.5772, test_loss: 1.3340, test_f1: 0.5106
 epoch: 82, train_loss: 0.5461, test_loss: 1.3191, test_f1: 0.5082
 epoch: 83, train_loss: 0.5642, test_loss: 1.3356, test_f1: 0.5019
 epoch: 84, train_loss: 0.5343, test_loss: 1.3643, test_f1: 0.4817
 epoch: 85, train_loss: 0.5405, test_loss: 1.3443, test_f1: 0.4978
 epoch: 86, train_loss: 0.5487, test_loss: 1.3947, test_f1: 0.5055
 epoch: 87, train_loss: 0.5402, test_loss: 1.3687, test_f1: 0.5027
 epoch: 88, train_loss: 0.5433, test_loss: 1.3671, test_f1: 0.5013
 epoch: 89, train_loss: 0.5448, test_loss: 1.3532, test_f1: 0.5214
 epoch: 90, train_loss: 0.5475, test_loss: 1.3882, test_f1: 0.4991
 epoch: 91, train_loss: 0.5387, test_loss: 1.3833, test_f1: 0.5120
 epoch: 92, train_loss: 0.5140, test_loss: 1.4376, test_f1: 0.5030
 epoch: 93, train_loss: 0.5386, test_loss: 1.3754, test_f1: 0.5134
 epoch: 94, train_loss: 0.5311, test_loss: 1.4168, test_f1: 0.5043
 epoch: 95, train_loss: 0.5239, test_loss: 1.3902, test_f1: 0.5115
 epoch: 96, train_loss: 0.5284, test_loss: 1.4318, test_f1: 0.5114
 epoch: 97, train_loss: 0.5286, test_loss: 1.4256, test_f1: 0.5095
 epoch: 98, train_loss: 0.5159, test_loss: 1.4602, test_f1: 0.5054
 epoch: 99, train_loss: 0.5188, test_loss: 1.3849, test_f1: 0.5263
##################ITERATION #8 ****************************************
 epoch: 0, train_loss: 1.3624, test_loss: 1.3075, test_f1: 0.2606
 epoch: 1, train_loss: 1.2588, test_loss: 1.2465, test_f1: 0.2278
 epoch: 2, train_loss: 1.2276, test_loss: 1.1923, test_f1: 0.3503
 epoch: 3, train_loss: 1.1994, test_loss: 1.1589, test_f1: 0.4041
 epoch: 4, train_loss: 1.1797, test_loss: 1.1406, test_f1: 0.4465
 epoch: 5, train_loss: 1.1626, test_loss: 1.1252, test_f1: 0.4465
 epoch: 6, train_loss: 1.1410, test_loss: 1.1174, test_f1: 0.4662
 epoch: 7, train_loss: 1.1316, test_loss: 1.0970, test_f1: 0.4701
 epoch: 8, train_loss: 1.1151, test_loss: 1.0914, test_f1: 0.4673
 epoch: 9, train_loss: 1.1038, test_loss: 1.0831, test_f1: 0.4694
 epoch: 10, train_loss: 1.0937, test_loss: 1.0697, test_f1: 0.4793
 epoch: 11, train_loss: 1.0887, test_loss: 1.0833, test_f1: 0.4861
 epoch: 12, train_loss: 1.0683, test_loss: 1.0699, test_f1: 0.4800
 epoch: 13, train_loss: 1.0541, test_loss: 1.0531, test_f1: 0.4778
 epoch: 14, train_loss: 1.0441, test_loss: 1.0488, test_f1: 0.4792
 epoch: 15, train_loss: 1.0451, test_loss: 1.0439, test_f1: 0.4637
 epoch: 16, train_loss: 1.0241, test_loss: 1.0429, test_f1: 0.4622
 epoch: 17, train_loss: 1.0234, test_loss: 1.0436, test_f1: 0.4548
 epoch: 18, train_loss: 1.0231, test_loss: 1.0462, test_f1: 0.4751
 epoch: 19, train_loss: 0.9937, test_loss: 1.0279, test_f1: 0.4812
 epoch: 20, train_loss: 0.9774, test_loss: 1.0167, test_f1: 0.4817
 epoch: 21, train_loss: 0.9830, test_loss: 1.0172, test_f1: 0.4827
 epoch: 22, train_loss: 0.9779, test_loss: 1.0088, test_f1: 0.4742
 epoch: 23, train_loss: 0.9616, test_loss: 1.0122, test_f1: 0.4774
 epoch: 24, train_loss: 0.9551, test_loss: 1.0124, test_f1: 0.4921
 epoch: 25, train_loss: 0.9445, test_loss: 1.0011, test_f1: 0.4982
 epoch: 26, train_loss: 0.9443, test_loss: 1.0008, test_f1: 0.4807
 epoch: 27, train_loss: 0.9304, test_loss: 1.0034, test_f1: 0.4965
 epoch: 28, train_loss: 0.9205, test_loss: 1.0053, test_f1: 0.5100
 epoch: 29, train_loss: 0.9119, test_loss: 1.0111, test_f1: 0.4877
 epoch: 30, train_loss: 0.9080, test_loss: 1.0071, test_f1: 0.4903
 epoch: 31, train_loss: 0.8833, test_loss: 1.0266, test_f1: 0.5011
 epoch: 32, train_loss: 0.8768, test_loss: 1.0095, test_f1: 0.5034
 epoch: 33, train_loss: 0.8839, test_loss: 1.0118, test_f1: 0.5038
 epoch: 34, train_loss: 0.8646, test_loss: 1.0144, test_f1: 0.5042
 epoch: 35, train_loss: 0.8565, test_loss: 1.0123, test_f1: 0.5115
 epoch: 36, train_loss: 0.8418, test_loss: 1.0298, test_f1: 0.4990
 epoch: 37, train_loss: 0.8329, test_loss: 1.0376, test_f1: 0.4995
 epoch: 38, train_loss: 0.8234, test_loss: 1.0404, test_f1: 0.5158
 epoch: 39, train_loss: 0.8292, test_loss: 1.0370, test_f1: 0.4970
 epoch: 40, train_loss: 0.8267, test_loss: 1.0489, test_f1: 0.4922
 epoch: 41, train_loss: 0.8260, test_loss: 1.0536, test_f1: 0.5033
 epoch: 42, train_loss: 0.8062, test_loss: 1.0205, test_f1: 0.5164
 epoch: 43, train_loss: 0.7958, test_loss: 1.0545, test_f1: 0.4885
 epoch: 44, train_loss: 0.7928, test_loss: 1.0435, test_f1: 0.5105
 epoch: 45, train_loss: 0.7939, test_loss: 1.0835, test_f1: 0.4856
 epoch: 46, train_loss: 0.7767, test_loss: 1.0840, test_f1: 0.5098
 epoch: 47, train_loss: 0.7785, test_loss: 1.0800, test_f1: 0.4898
 epoch: 48, train_loss: 0.7686, test_loss: 1.0867, test_f1: 0.5238
 epoch: 49, train_loss: 0.7570, test_loss: 1.0885, test_f1: 0.5039
 epoch: 50, train_loss: 0.7517, test_loss: 1.1050, test_f1: 0.5054
 epoch: 51, train_loss: 0.7310, test_loss: 1.0845, test_f1: 0.4941
 epoch: 52, train_loss: 0.7218, test_loss: 1.0994, test_f1: 0.5054
 epoch: 53, train_loss: 0.7116, test_loss: 1.1165, test_f1: 0.5019
 epoch: 54, train_loss: 0.7134, test_loss: 1.1015, test_f1: 0.5092
 epoch: 55, train_loss: 0.7045, test_loss: 1.1051, test_f1: 0.5305
 epoch: 56, train_loss: 0.7121, test_loss: 1.1118, test_f1: 0.5144
 epoch: 57, train_loss: 0.7081, test_loss: 1.1230, test_f1: 0.5133
 epoch: 58, train_loss: 0.6982, test_loss: 1.1193, test_f1: 0.5017
 epoch: 59, train_loss: 0.6822, test_loss: 1.1455, test_f1: 0.5045
 epoch: 60, train_loss: 0.6881, test_loss: 1.1137, test_f1: 0.5157
 epoch: 61, train_loss: 0.6960, test_loss: 1.1263, test_f1: 0.5101
 epoch: 62, train_loss: 0.6717, test_loss: 1.1302, test_f1: 0.5230
 epoch: 63, train_loss: 0.6860, test_loss: 1.1409, test_f1: 0.5245
 epoch: 64, train_loss: 0.6827, test_loss: 1.1281, test_f1: 0.5087
 epoch: 65, train_loss: 0.6828, test_loss: 1.1422, test_f1: 0.5041
 epoch: 66, train_loss: 0.6683, test_loss: 1.1455, test_f1: 0.5202
 epoch: 67, train_loss: 0.6630, test_loss: 1.1384, test_f1: 0.5198
 epoch: 68, train_loss: 0.6709, test_loss: 1.1451, test_f1: 0.5301
 epoch: 69, train_loss: 0.6649, test_loss: 1.1536, test_f1: 0.5250
 epoch: 70, train_loss: 0.6654, test_loss: 1.1499, test_f1: 0.5201
 epoch: 71, train_loss: 0.6500, test_loss: 1.1708, test_f1: 0.5260
 epoch: 72, train_loss: 0.6582, test_loss: 1.1528, test_f1: 0.5195
 epoch: 73, train_loss: 0.6304, test_loss: 1.1706, test_f1: 0.5199
 epoch: 74, train_loss: 0.6510, test_loss: 1.1800, test_f1: 0.5230
 epoch: 75, train_loss: 0.6388, test_loss: 1.1941, test_f1: 0.5224
 epoch: 76, train_loss: 0.6303, test_loss: 1.1838, test_f1: 0.5054
 epoch: 77, train_loss: 0.6245, test_loss: 1.1882, test_f1: 0.5132
 epoch: 78, train_loss: 0.6309, test_loss: 1.1936, test_f1: 0.5209
 epoch: 79, train_loss: 0.6207, test_loss: 1.1907, test_f1: 0.5200
 epoch: 80, train_loss: 0.6395, test_loss: 1.2184, test_f1: 0.5164
 epoch: 81, train_loss: 0.6198, test_loss: 1.2069, test_f1: 0.5285
 epoch: 82, train_loss: 0.6293, test_loss: 1.2291, test_f1: 0.5201
 epoch: 83, train_loss: 0.6135, test_loss: 1.2248, test_f1: 0.5301
 epoch: 84, train_loss: 0.6151, test_loss: 1.2103, test_f1: 0.5249
 epoch: 85, train_loss: 0.6204, test_loss: 1.2088, test_f1: 0.5388
 epoch: 86, train_loss: 0.6219, test_loss: 1.2165, test_f1: 0.5338
 epoch: 87, train_loss: 0.6033, test_loss: 1.2054, test_f1: 0.5451
 epoch: 88, train_loss: 0.6031, test_loss: 1.2426, test_f1: 0.5162
 epoch: 89, train_loss: 0.5894, test_loss: 1.2565, test_f1: 0.5319
 epoch: 90, train_loss: 0.5934, test_loss: 1.2525, test_f1: 0.5366
 epoch: 91, train_loss: 0.5860, test_loss: 1.2650, test_f1: 0.5277
 epoch: 92, train_loss: 0.6055, test_loss: 1.2327, test_f1: 0.5465
 epoch: 93, train_loss: 0.5889, test_loss: 1.2311, test_f1: 0.5409
 epoch: 94, train_loss: 0.5911, test_loss: 1.2639, test_f1: 0.5346
 epoch: 95, train_loss: 0.5797, test_loss: 1.2622, test_f1: 0.5354
 epoch: 96, train_loss: 0.5631, test_loss: 1.2514, test_f1: 0.5301
 epoch: 97, train_loss: 0.5931, test_loss: 1.2840, test_f1: 0.5390
 epoch: 98, train_loss: 0.5804, test_loss: 1.2963, test_f1: 0.5255
 epoch: 99, train_loss: 0.5735, test_loss: 1.2977, test_f1: 0.5342
##################ITERATION #9 ****************************************
 epoch: 0, train_loss: 1.3664, test_loss: 1.2994, test_f1: 0.2580
 epoch: 1, train_loss: 1.2582, test_loss: 1.2770, test_f1: 0.2473
 epoch: 2, train_loss: 1.2176, test_loss: 1.2329, test_f1: 0.3224
 epoch: 3, train_loss: 1.1998, test_loss: 1.2001, test_f1: 0.3966
 epoch: 4, train_loss: 1.1733, test_loss: 1.1607, test_f1: 0.4394
 epoch: 5, train_loss: 1.1606, test_loss: 1.1390, test_f1: 0.4396
 epoch: 6, train_loss: 1.1368, test_loss: 1.1203, test_f1: 0.4375
 epoch: 7, train_loss: 1.1171, test_loss: 1.1261, test_f1: 0.4352
 epoch: 8, train_loss: 1.1169, test_loss: 1.1198, test_f1: 0.4173
 epoch: 9, train_loss: 1.0912, test_loss: 1.1019, test_f1: 0.4342
 epoch: 10, train_loss: 1.0761, test_loss: 1.1265, test_f1: 0.4018
 epoch: 11, train_loss: 1.0747, test_loss: 1.1087, test_f1: 0.4347
 epoch: 12, train_loss: 1.0588, test_loss: 1.0804, test_f1: 0.4426
 epoch: 13, train_loss: 1.0417, test_loss: 1.0709, test_f1: 0.4422
 epoch: 14, train_loss: 1.0343, test_loss: 1.0736, test_f1: 0.4490
 epoch: 15, train_loss: 1.0208, test_loss: 1.0823, test_f1: 0.4628
 epoch: 16, train_loss: 1.0141, test_loss: 1.0762, test_f1: 0.4649
 epoch: 17, train_loss: 1.0048, test_loss: 1.0760, test_f1: 0.4838
 epoch: 18, train_loss: 0.9943, test_loss: 1.0644, test_f1: 0.4738
 epoch: 19, train_loss: 0.9812, test_loss: 1.0462, test_f1: 0.4752
 epoch: 20, train_loss: 0.9701, test_loss: 1.0463, test_f1: 0.4826
 epoch: 21, train_loss: 0.9681, test_loss: 1.0316, test_f1: 0.4932
 epoch: 22, train_loss: 0.9615, test_loss: 1.0452, test_f1: 0.4865
 epoch: 23, train_loss: 0.9492, test_loss: 1.0546, test_f1: 0.4767
 epoch: 24, train_loss: 0.9450, test_loss: 1.0689, test_f1: 0.4743
 epoch: 25, train_loss: 0.9385, test_loss: 1.0484, test_f1: 0.4858
 epoch: 26, train_loss: 0.9144, test_loss: 1.0680, test_f1: 0.4767
 epoch: 27, train_loss: 0.9025, test_loss: 1.0413, test_f1: 0.4888
 epoch: 28, train_loss: 0.9035, test_loss: 1.0583, test_f1: 0.4878
 epoch: 29, train_loss: 0.8879, test_loss: 1.0376, test_f1: 0.5020
 epoch: 30, train_loss: 0.8815, test_loss: 1.0640, test_f1: 0.5000
 epoch: 31, train_loss: 0.8795, test_loss: 1.0415, test_f1: 0.5101
 epoch: 32, train_loss: 0.8758, test_loss: 1.0598, test_f1: 0.4934
 epoch: 33, train_loss: 0.8591, test_loss: 1.0509, test_f1: 0.5007
 epoch: 34, train_loss: 0.8499, test_loss: 1.0684, test_f1: 0.4928
 epoch: 35, train_loss: 0.8465, test_loss: 1.0672, test_f1: 0.4903
 epoch: 36, train_loss: 0.8530, test_loss: 1.0638, test_f1: 0.4939
 epoch: 37, train_loss: 0.8460, test_loss: 1.0580, test_f1: 0.5023
 epoch: 38, train_loss: 0.8138, test_loss: 1.0961, test_f1: 0.4927
 epoch: 39, train_loss: 0.8247, test_loss: 1.0967, test_f1: 0.5016
 epoch: 40, train_loss: 0.8015, test_loss: 1.1058, test_f1: 0.4892
 epoch: 41, train_loss: 0.8072, test_loss: 1.0836, test_f1: 0.5083
 epoch: 42, train_loss: 0.8013, test_loss: 1.1186, test_f1: 0.4984
 epoch: 43, train_loss: 0.7815, test_loss: 1.1267, test_f1: 0.4918
 epoch: 44, train_loss: 0.7672, test_loss: 1.1397, test_f1: 0.4857
 epoch: 45, train_loss: 0.7751, test_loss: 1.1324, test_f1: 0.4896
 epoch: 46, train_loss: 0.7670, test_loss: 1.1510, test_f1: 0.4854
 epoch: 47, train_loss: 0.7571, test_loss: 1.1443, test_f1: 0.4940
 epoch: 48, train_loss: 0.7425, test_loss: 1.1295, test_f1: 0.5036
 epoch: 49, train_loss: 0.7316, test_loss: 1.1827, test_f1: 0.4722
 epoch: 50, train_loss: 0.7385, test_loss: 1.1357, test_f1: 0.4933
 epoch: 51, train_loss: 0.7403, test_loss: 1.1384, test_f1: 0.4899
 epoch: 52, train_loss: 0.7182, test_loss: 1.1720, test_f1: 0.4959
 epoch: 53, train_loss: 0.7101, test_loss: 1.2053, test_f1: 0.4918
 epoch: 54, train_loss: 0.6946, test_loss: 1.1890, test_f1: 0.4945
 epoch: 55, train_loss: 0.7125, test_loss: 1.1773, test_f1: 0.4891
 epoch: 56, train_loss: 0.7055, test_loss: 1.1798, test_f1: 0.4960
 epoch: 57, train_loss: 0.7057, test_loss: 1.1770, test_f1: 0.5042
 epoch: 58, train_loss: 0.6887, test_loss: 1.1761, test_f1: 0.5049
 epoch: 59, train_loss: 0.7026, test_loss: 1.1788, test_f1: 0.4930
 epoch: 60, train_loss: 0.6952, test_loss: 1.2068, test_f1: 0.4968
 epoch: 61, train_loss: 0.6804, test_loss: 1.2152, test_f1: 0.4905
 epoch: 62, train_loss: 0.6747, test_loss: 1.2356, test_f1: 0.4826
 epoch: 63, train_loss: 0.6748, test_loss: 1.2321, test_f1: 0.4938
 epoch: 64, train_loss: 0.6806, test_loss: 1.2350, test_f1: 0.4880
 epoch: 65, train_loss: 0.6728, test_loss: 1.2510, test_f1: 0.4794
 epoch: 66, train_loss: 0.6619, test_loss: 1.2545, test_f1: 0.4908
 epoch: 67, train_loss: 0.6509, test_loss: 1.2734, test_f1: 0.4778
 epoch: 68, train_loss: 0.6639, test_loss: 1.2471, test_f1: 0.4888
 epoch: 69, train_loss: 0.6590, test_loss: 1.2378, test_f1: 0.4778
 epoch: 70, train_loss: 0.6419, test_loss: 1.2952, test_f1: 0.4801
 epoch: 71, train_loss: 0.6567, test_loss: 1.2430, test_f1: 0.4912
 epoch: 72, train_loss: 0.6554, test_loss: 1.2547, test_f1: 0.4953
 epoch: 73, train_loss: 0.6439, test_loss: 1.2895, test_f1: 0.4959
 epoch: 74, train_loss: 0.6410, test_loss: 1.3012, test_f1: 0.4894
 epoch: 75, train_loss: 0.6430, test_loss: 1.2851, test_f1: 0.4878
 epoch: 76, train_loss: 0.6361, test_loss: 1.3038, test_f1: 0.4809
 epoch: 77, train_loss: 0.6448, test_loss: 1.2928, test_f1: 0.4891
 epoch: 78, train_loss: 0.6245, test_loss: 1.3001, test_f1: 0.4997
 epoch: 79, train_loss: 0.6216, test_loss: 1.2935, test_f1: 0.4967
 epoch: 80, train_loss: 0.6317, test_loss: 1.2994, test_f1: 0.5011
 epoch: 81, train_loss: 0.6205, test_loss: 1.2919, test_f1: 0.4937
 epoch: 82, train_loss: 0.6116, test_loss: 1.3086, test_f1: 0.4854
 epoch: 83, train_loss: 0.6164, test_loss: 1.3129, test_f1: 0.4843
 epoch: 84, train_loss: 0.6121, test_loss: 1.3260, test_f1: 0.4823
 epoch: 85, train_loss: 0.6184, test_loss: 1.2912, test_f1: 0.5035
 epoch: 86, train_loss: 0.6132, test_loss: 1.2808, test_f1: 0.4859
 epoch: 87, train_loss: 0.6058, test_loss: 1.3112, test_f1: 0.4928
 epoch: 88, train_loss: 0.6263, test_loss: 1.3716, test_f1: 0.4862
 epoch: 89, train_loss: 0.6103, test_loss: 1.3194, test_f1: 0.4945
 epoch: 90, train_loss: 0.5936, test_loss: 1.3545, test_f1: 0.5014
 epoch: 91, train_loss: 0.5918, test_loss: 1.3606, test_f1: 0.4898
 epoch: 92, train_loss: 0.6012, test_loss: 1.4018, test_f1: 0.4860
 epoch: 93, train_loss: 0.5950, test_loss: 1.4029, test_f1: 0.4837
 epoch: 94, train_loss: 0.6008, test_loss: 1.3972, test_f1: 0.5069
 epoch: 95, train_loss: 0.5823, test_loss: 1.3764, test_f1: 0.4911
 epoch: 96, train_loss: 0.5955, test_loss: 1.3942, test_f1: 0.4921
 epoch: 97, train_loss: 0.5757, test_loss: 1.3852, test_f1: 0.4957
 epoch: 98, train_loss: 0.5855, test_loss: 1.3728, test_f1: 0.5060
 epoch: 99, train_loss: 0.5712, test_loss: 1.3867, test_f1: 0.4995

Training completed in 412.67 seconds
Best F1: 0.5513 at epoch 95
Mean F1 across iterations: 0.5323  0.0165
========================FINAL RESULTS================================
FEGIN weighted F1: 0.5513  0.0165
python main.py --data ltspice_examples --representation component_component --model FEGIN --layers 5 --hiddens 128 --batch_size 256 --lr 0.0001 --emb_size 250 --epochs 100 --save_appendix component_component_L5_H128_BS256_LR0.0001_E250 --no_val
-----



STDERR:
  File "main.py", line 370, in <module>
    main()
  File "main.py", line 254, in main
    dataset = dataset_class(
  File "/home/philip/projects/ltspice_examples_code_repo/Circuit-Completion-Using-GNNs/component_classification_with_link_prediction_head/evaluation/FEGIN/kernel/circuit_datasets.py", line 15, in __init__
    self.data, self.slices = torch.load(self.processed_paths[0])
  File "/home/philip/.local/lib/python3.8/site-packages/torch/serialization.py", line 1040, in load
    warnings.warn(
  File "/usr/lib/python3.8/warnings.py", line 109, in _showwarnmsg
    sw(msg.message, msg.category, msg.filename, msg.lineno,
  File "main.py", line 47, in warn_with_traceback
    traceback.print_stack(file=log)
/home/philip/projects/ltspice_examples_code_repo/Circuit-Completion-Using-GNNs/component_classification_with_link_prediction_head/evaluation/FEGIN/kernel/circuit_datasets.py:15: FutureWarning: You are using `torch.load` with `weights_only=False` (the current default value), which uses the default pickle module implicitly. It is possible to construct malicious pickle data which will execute arbitrary code during unpickling (See https://github.com/pytorch/pytorch/blob/main/SECURITY.md#untrusted-models for more details). In a future release, the default value for `weights_only` will be flipped to `True`. This limits the functions that could be executed during unpickling. Arbitrary objects will no longer be allowed to be loaded via this mode unless they are explicitly allowlisted by the user via `torch.serialization.add_safe_globals`. We recommend you start setting `weights_only=True` for any use case where you don't have full control of the loaded file. Please open an issue on GitHub for any issues related to this experimental feature.
  self.data, self.slices = torch.load(self.processed_paths[0])
