STDOUT:
Results will be saved in /home/philip/projects/ltspice_examples_code_repo/Circuit-Completion-Using-GNNs/component_classification_with_link_prediction_head/evaluation/FEGIN/results/model_FEGIN_dataset_ltspice_examples
Command line input: python main.py --data ltspice_examples --representation component_pin_net --model FEGIN --layers 4 --hiddens 64 --batch_size 64 --lr 0.001 --emb_size 128 --epochs 100 --save_appendix component_pin_net_L4_H64_BS64_LR0.001_E128 --no_val
 is saved.
-----
ltspice_examples - FEGIN
Using 4 layers, 64 hidden units, h = 2
Loading component_pin_net representation dataset
ENTERED
Training FEGIN on component_pin_net representation
Train: 3558, Test: 846
##################ITERATION #0 ****************************************
 epoch: 0, train_loss: 1.1860, test_loss: 1.0666, test_f1: 0.3631
 epoch: 1, train_loss: 1.0037, test_loss: 1.0459, test_f1: 0.4643
 epoch: 2, train_loss: 0.9713, test_loss: 0.9303, test_f1: 0.5060
 epoch: 3, train_loss: 0.9517, test_loss: 0.9440, test_f1: 0.5221
 epoch: 4, train_loss: 0.9163, test_loss: 0.8723, test_f1: 0.5297
 epoch: 5, train_loss: 0.8947, test_loss: 0.8737, test_f1: 0.5349
 epoch: 6, train_loss: 0.8703, test_loss: 0.8919, test_f1: 0.5696
 epoch: 7, train_loss: 0.8674, test_loss: 0.8876, test_f1: 0.5312
 epoch: 8, train_loss: 0.8437, test_loss: 0.8505, test_f1: 0.5541
 epoch: 9, train_loss: 0.8382, test_loss: 0.8488, test_f1: 0.5444
 epoch: 10, train_loss: 0.8256, test_loss: 0.8749, test_f1: 0.5629
 epoch: 11, train_loss: 0.8147, test_loss: 0.8513, test_f1: 0.5440
 epoch: 12, train_loss: 0.7905, test_loss: 0.8643, test_f1: 0.5651
 epoch: 13, train_loss: 0.7891, test_loss: 0.8748, test_f1: 0.5573
 epoch: 14, train_loss: 0.7582, test_loss: 0.8170, test_f1: 0.5840
 epoch: 15, train_loss: 0.7518, test_loss: 0.8284, test_f1: 0.5557
 epoch: 16, train_loss: 0.7441, test_loss: 0.9112, test_f1: 0.5705
 epoch: 17, train_loss: 0.7225, test_loss: 0.8439, test_f1: 0.6048
 epoch: 18, train_loss: 0.7050, test_loss: 0.8026, test_f1: 0.6010
 epoch: 19, train_loss: 0.7073, test_loss: 0.9309, test_f1: 0.5656
 epoch: 20, train_loss: 0.6884, test_loss: 0.8650, test_f1: 0.5678
 epoch: 21, train_loss: 0.6885, test_loss: 0.9003, test_f1: 0.5602
 epoch: 22, train_loss: 0.6547, test_loss: 0.8513, test_f1: 0.5827
 epoch: 23, train_loss: 0.6648, test_loss: 0.9136, test_f1: 0.6065
 epoch: 24, train_loss: 0.6611, test_loss: 0.8956, test_f1: 0.6122
 epoch: 25, train_loss: 0.6346, test_loss: 0.9716, test_f1: 0.5912
 epoch: 26, train_loss: 0.6199, test_loss: 0.9378, test_f1: 0.6275
 epoch: 27, train_loss: 0.6102, test_loss: 1.0356, test_f1: 0.5788
 epoch: 28, train_loss: 0.6164, test_loss: 0.9313, test_f1: 0.6072
 epoch: 29, train_loss: 0.6179, test_loss: 0.9259, test_f1: 0.6099
 epoch: 30, train_loss: 0.5933, test_loss: 0.9105, test_f1: 0.6335
 epoch: 31, train_loss: 0.5830, test_loss: 0.9332, test_f1: 0.6167
 epoch: 32, train_loss: 0.5655, test_loss: 0.9036, test_f1: 0.6487
 epoch: 33, train_loss: 0.5937, test_loss: 0.9357, test_f1: 0.6381
 epoch: 34, train_loss: 0.5493, test_loss: 0.9179, test_f1: 0.6260
 epoch: 35, train_loss: 0.5624, test_loss: 0.9051, test_f1: 0.6247
 epoch: 36, train_loss: 0.5450, test_loss: 0.8959, test_f1: 0.6446
 epoch: 37, train_loss: 0.5471, test_loss: 0.9788, test_f1: 0.6178
 epoch: 38, train_loss: 0.5234, test_loss: 1.0310, test_f1: 0.6211
 epoch: 39, train_loss: 0.5324, test_loss: 0.9814, test_f1: 0.6325
 epoch: 40, train_loss: 0.5190, test_loss: 0.8849, test_f1: 0.6876
 epoch: 41, train_loss: 0.5148, test_loss: 1.0449, test_f1: 0.6063
 epoch: 42, train_loss: 0.5064, test_loss: 0.9281, test_f1: 0.6508
 epoch: 43, train_loss: 0.4995, test_loss: 0.9974, test_f1: 0.6423
 epoch: 44, train_loss: 0.4791, test_loss: 0.9696, test_f1: 0.6569
 epoch: 45, train_loss: 0.4930, test_loss: 1.0601, test_f1: 0.6334
 epoch: 46, train_loss: 0.4842, test_loss: 1.0562, test_f1: 0.6413
 epoch: 47, train_loss: 0.4787, test_loss: 1.0247, test_f1: 0.6632
 epoch: 48, train_loss: 0.4609, test_loss: 1.1035, test_f1: 0.6315
 epoch: 49, train_loss: 0.4684, test_loss: 1.1070, test_f1: 0.6230
 epoch: 50, train_loss: 0.4665, test_loss: 1.0847, test_f1: 0.6433
 epoch: 51, train_loss: 0.4456, test_loss: 1.0710, test_f1: 0.6473
 epoch: 52, train_loss: 0.4038, test_loss: 1.1043, test_f1: 0.6369
 epoch: 53, train_loss: 0.3925, test_loss: 1.1363, test_f1: 0.6499
 epoch: 54, train_loss: 0.3898, test_loss: 1.1639, test_f1: 0.6524
 epoch: 55, train_loss: 0.3851, test_loss: 1.1843, test_f1: 0.6459
 epoch: 56, train_loss: 0.3682, test_loss: 1.1772, test_f1: 0.6525
 epoch: 57, train_loss: 0.3828, test_loss: 1.1979, test_f1: 0.6466
 epoch: 58, train_loss: 0.3776, test_loss: 1.2320, test_f1: 0.6411
 epoch: 59, train_loss: 0.3726, test_loss: 1.1448, test_f1: 0.6725
 epoch: 60, train_loss: 0.3624, test_loss: 1.2019, test_f1: 0.6427
 epoch: 61, train_loss: 0.3668, test_loss: 1.1323, test_f1: 0.6641
 epoch: 62, train_loss: 0.3542, test_loss: 1.2779, test_f1: 0.6658
 epoch: 63, train_loss: 0.3426, test_loss: 1.2069, test_f1: 0.6597
 epoch: 64, train_loss: 0.3400, test_loss: 1.3140, test_f1: 0.6616
 epoch: 65, train_loss: 0.3664, test_loss: 1.3484, test_f1: 0.6499
 epoch: 66, train_loss: 0.3451, test_loss: 1.3160, test_f1: 0.6608
 epoch: 67, train_loss: 0.3360, test_loss: 1.3380, test_f1: 0.6666
 epoch: 68, train_loss: 0.3498, test_loss: 1.2815, test_f1: 0.6552
 epoch: 69, train_loss: 0.3364, test_loss: 1.3848, test_f1: 0.6663
 epoch: 70, train_loss: 0.3104, test_loss: 1.3071, test_f1: 0.6573
 epoch: 71, train_loss: 0.3146, test_loss: 1.4375, test_f1: 0.6539
 epoch: 72, train_loss: 0.3154, test_loss: 1.5032, test_f1: 0.6656
 epoch: 73, train_loss: 0.3137, test_loss: 1.4129, test_f1: 0.6676
 epoch: 74, train_loss: 0.3124, test_loss: 1.3930, test_f1: 0.6540
 epoch: 75, train_loss: 0.3139, test_loss: 1.4023, test_f1: 0.6641
 epoch: 76, train_loss: 0.3043, test_loss: 1.4648, test_f1: 0.6699
 epoch: 77, train_loss: 0.3039, test_loss: 1.4616, test_f1: 0.6644
 epoch: 78, train_loss: 0.3287, test_loss: 1.3640, test_f1: 0.6717
 epoch: 79, train_loss: 0.2849, test_loss: 1.4364, test_f1: 0.6927
 epoch: 80, train_loss: 0.3003, test_loss: 1.4696, test_f1: 0.6762
 epoch: 81, train_loss: 0.2939, test_loss: 1.4331, test_f1: 0.6762
 epoch: 82, train_loss: 0.2926, test_loss: 1.4054, test_f1: 0.6733
 epoch: 83, train_loss: 0.2756, test_loss: 1.3796, test_f1: 0.6922
 epoch: 84, train_loss: 0.2817, test_loss: 1.3860, test_f1: 0.6588
 epoch: 85, train_loss: 0.2847, test_loss: 1.5676, test_f1: 0.6766
 epoch: 86, train_loss: 0.2972, test_loss: 1.3841, test_f1: 0.6888
 epoch: 87, train_loss: 0.2706, test_loss: 1.4158, test_f1: 0.6666
 epoch: 88, train_loss: 0.2893, test_loss: 1.5768, test_f1: 0.6635
 epoch: 89, train_loss: 0.2689, test_loss: 1.5430, test_f1: 0.6679
 epoch: 90, train_loss: 0.2670, test_loss: 1.5825, test_f1: 0.6525
 epoch: 91, train_loss: 0.2726, test_loss: 1.5481, test_f1: 0.6844
 epoch: 92, train_loss: 0.2747, test_loss: 1.6125, test_f1: 0.6637
 epoch: 93, train_loss: 0.2628, test_loss: 1.7089, test_f1: 0.6653
 epoch: 94, train_loss: 0.2585, test_loss: 1.6463, test_f1: 0.6709
 epoch: 95, train_loss: 0.2620, test_loss: 1.6632, test_f1: 0.6661
 epoch: 96, train_loss: 0.2486, test_loss: 1.7842, test_f1: 0.6543
 epoch: 97, train_loss: 0.2574, test_loss: 1.7419, test_f1: 0.6823
 epoch: 98, train_loss: 0.2464, test_loss: 1.7770, test_f1: 0.6775
 epoch: 99, train_loss: 0.2389, test_loss: 1.6076, test_f1: 0.6975
##################ITERATION #1 ****************************************
 epoch: 0, train_loss: 1.0804, test_loss: 1.1187, test_f1: 0.3437
 epoch: 1, train_loss: 0.9617, test_loss: 0.9517, test_f1: 0.5269
 epoch: 2, train_loss: 0.9305, test_loss: 0.8850, test_f1: 0.5313
 epoch: 3, train_loss: 0.9070, test_loss: 0.8594, test_f1: 0.5648
 epoch: 4, train_loss: 0.8799, test_loss: 0.8334, test_f1: 0.5790
 epoch: 5, train_loss: 0.8564, test_loss: 0.8006, test_f1: 0.5714
 epoch: 6, train_loss: 0.8494, test_loss: 0.8178, test_f1: 0.6095
 epoch: 7, train_loss: 0.8377, test_loss: 0.7769, test_f1: 0.5974
 epoch: 8, train_loss: 0.8136, test_loss: 0.8374, test_f1: 0.6187
 epoch: 9, train_loss: 0.7997, test_loss: 0.7393, test_f1: 0.6144
 epoch: 10, train_loss: 0.7778, test_loss: 0.7404, test_f1: 0.6050
 epoch: 11, train_loss: 0.7681, test_loss: 0.7997, test_f1: 0.6100
 epoch: 12, train_loss: 0.7439, test_loss: 0.7010, test_f1: 0.6366
 epoch: 13, train_loss: 0.7291, test_loss: 0.7484, test_f1: 0.6496
 epoch: 14, train_loss: 0.7171, test_loss: 0.7449, test_f1: 0.6630
 epoch: 15, train_loss: 0.7117, test_loss: 0.6942, test_f1: 0.6636
 epoch: 16, train_loss: 0.6839, test_loss: 0.7207, test_f1: 0.6798
 epoch: 17, train_loss: 0.6797, test_loss: 0.7862, test_f1: 0.6391
 epoch: 18, train_loss: 0.6605, test_loss: 0.7545, test_f1: 0.6479
 epoch: 19, train_loss: 0.6549, test_loss: 0.7157, test_f1: 0.6658
 epoch: 20, train_loss: 0.6485, test_loss: 0.7200, test_f1: 0.6350
 epoch: 21, train_loss: 0.6366, test_loss: 0.7129, test_f1: 0.6577
 epoch: 22, train_loss: 0.6236, test_loss: 0.8376, test_f1: 0.6417
 epoch: 23, train_loss: 0.6146, test_loss: 0.7425, test_f1: 0.6355
 epoch: 24, train_loss: 0.6085, test_loss: 0.7336, test_f1: 0.6712
 epoch: 25, train_loss: 0.5856, test_loss: 0.8173, test_f1: 0.6534
 epoch: 26, train_loss: 0.6009, test_loss: 0.9127, test_f1: 0.6544
 epoch: 27, train_loss: 0.5814, test_loss: 1.0217, test_f1: 0.6424
 epoch: 28, train_loss: 0.5665, test_loss: 0.8507, test_f1: 0.6611
 epoch: 29, train_loss: 0.5763, test_loss: 0.8322, test_f1: 0.6398
 epoch: 30, train_loss: 0.5582, test_loss: 0.9454, test_f1: 0.6550
 epoch: 31, train_loss: 0.5492, test_loss: 0.9363, test_f1: 0.6398
 epoch: 32, train_loss: 0.5321, test_loss: 0.9319, test_f1: 0.6500
 epoch: 33, train_loss: 0.5300, test_loss: 0.9836, test_f1: 0.6520
 epoch: 34, train_loss: 0.5289, test_loss: 1.0081, test_f1: 0.6460
 epoch: 35, train_loss: 0.5205, test_loss: 0.9632, test_f1: 0.6409
 epoch: 36, train_loss: 0.5114, test_loss: 1.0502, test_f1: 0.6363
 epoch: 37, train_loss: 0.5308, test_loss: 1.0385, test_f1: 0.6625
 epoch: 38, train_loss: 0.5219, test_loss: 1.0660, test_f1: 0.6525
 epoch: 39, train_loss: 0.4905, test_loss: 0.9112, test_f1: 0.6786
 epoch: 40, train_loss: 0.4906, test_loss: 1.0421, test_f1: 0.6813
 epoch: 41, train_loss: 0.4868, test_loss: 1.0137, test_f1: 0.6506
 epoch: 42, train_loss: 0.4759, test_loss: 1.1298, test_f1: 0.6573
 epoch: 43, train_loss: 0.4868, test_loss: 1.1238, test_f1: 0.6658
 epoch: 44, train_loss: 0.4699, test_loss: 1.0815, test_f1: 0.6673
 epoch: 45, train_loss: 0.4566, test_loss: 1.1098, test_f1: 0.6719
 epoch: 46, train_loss: 0.4414, test_loss: 1.1809, test_f1: 0.6490
 epoch: 47, train_loss: 0.4466, test_loss: 1.2447, test_f1: 0.6832
 epoch: 48, train_loss: 0.4330, test_loss: 1.1886, test_f1: 0.6520
 epoch: 49, train_loss: 0.4196, test_loss: 1.2963, test_f1: 0.6658
 epoch: 50, train_loss: 0.4130, test_loss: 1.3140, test_f1: 0.6853
 epoch: 51, train_loss: 0.3916, test_loss: 1.3569, test_f1: 0.6712
 epoch: 52, train_loss: 0.3766, test_loss: 1.3412, test_f1: 0.6683
 epoch: 53, train_loss: 0.3567, test_loss: 1.4016, test_f1: 0.6704
 epoch: 54, train_loss: 0.3649, test_loss: 1.4022, test_f1: 0.6761
 epoch: 55, train_loss: 0.3547, test_loss: 1.3468, test_f1: 0.6717
 epoch: 56, train_loss: 0.3439, test_loss: 1.4585, test_f1: 0.6815
 epoch: 57, train_loss: 0.3325, test_loss: 1.4542, test_f1: 0.6897
 epoch: 58, train_loss: 0.3426, test_loss: 1.4868, test_f1: 0.6669
 epoch: 59, train_loss: 0.3326, test_loss: 1.4336, test_f1: 0.6686
 epoch: 60, train_loss: 0.3352, test_loss: 1.4858, test_f1: 0.6617
 epoch: 61, train_loss: 0.3311, test_loss: 1.5513, test_f1: 0.6640
 epoch: 62, train_loss: 0.3112, test_loss: 1.5529, test_f1: 0.6759
 epoch: 63, train_loss: 0.3109, test_loss: 1.5678, test_f1: 0.6698
 epoch: 64, train_loss: 0.3134, test_loss: 1.5224, test_f1: 0.6868
 epoch: 65, train_loss: 0.3007, test_loss: 1.6442, test_f1: 0.6594
 epoch: 66, train_loss: 0.3153, test_loss: 1.6834, test_f1: 0.6682
 epoch: 67, train_loss: 0.3083, test_loss: 1.6225, test_f1: 0.6819
 epoch: 68, train_loss: 0.3315, test_loss: 1.6024, test_f1: 0.6702
 epoch: 69, train_loss: 0.2942, test_loss: 1.7848, test_f1: 0.6735
 epoch: 70, train_loss: 0.2949, test_loss: 1.7324, test_f1: 0.6611
 epoch: 71, train_loss: 0.2858, test_loss: 1.7390, test_f1: 0.6729
 epoch: 72, train_loss: 0.3073, test_loss: 1.5620, test_f1: 0.6976
 epoch: 73, train_loss: 0.3094, test_loss: 1.6761, test_f1: 0.6719
 epoch: 74, train_loss: 0.2907, test_loss: 1.6650, test_f1: 0.6783
 epoch: 75, train_loss: 0.2800, test_loss: 1.7979, test_f1: 0.6743
 epoch: 76, train_loss: 0.2836, test_loss: 1.6921, test_f1: 0.6711
 epoch: 77, train_loss: 0.2857, test_loss: 1.7754, test_f1: 0.6705
 epoch: 78, train_loss: 0.2773, test_loss: 1.8615, test_f1: 0.6728
 epoch: 79, train_loss: 0.2687, test_loss: 1.9428, test_f1: 0.6458
 epoch: 80, train_loss: 0.2692, test_loss: 1.7791, test_f1: 0.6598
 epoch: 81, train_loss: 0.2678, test_loss: 1.8130, test_f1: 0.6878
 epoch: 82, train_loss: 0.2795, test_loss: 1.9085, test_f1: 0.6553
 epoch: 83, train_loss: 0.2708, test_loss: 1.8539, test_f1: 0.6572
 epoch: 84, train_loss: 0.2721, test_loss: 1.9851, test_f1: 0.6767
 epoch: 85, train_loss: 0.2594, test_loss: 1.9820, test_f1: 0.6691
 epoch: 86, train_loss: 0.2484, test_loss: 1.9561, test_f1: 0.6650
 epoch: 87, train_loss: 0.2607, test_loss: 2.0537, test_f1: 0.6648
 epoch: 88, train_loss: 0.2539, test_loss: 1.9106, test_f1: 0.6650
 epoch: 89, train_loss: 0.2371, test_loss: 2.0507, test_f1: 0.6613
 epoch: 90, train_loss: 0.2227, test_loss: 2.0235, test_f1: 0.6661
 epoch: 91, train_loss: 0.2443, test_loss: 2.1378, test_f1: 0.6630
 epoch: 92, train_loss: 0.2254, test_loss: 2.0970, test_f1: 0.6735
 epoch: 93, train_loss: 0.2340, test_loss: 1.9064, test_f1: 0.6763
 epoch: 94, train_loss: 0.2496, test_loss: 2.2378, test_f1: 0.6649
 epoch: 95, train_loss: 0.2482, test_loss: 2.0847, test_f1: 0.6572
 epoch: 96, train_loss: 0.2455, test_loss: 2.2923, test_f1: 0.6544
 epoch: 97, train_loss: 0.2453, test_loss: 2.3340, test_f1: 0.6532
 epoch: 98, train_loss: 0.2275, test_loss: 2.2046, test_f1: 0.6617
 epoch: 99, train_loss: 0.2164, test_loss: 2.3791, test_f1: 0.6425
##################ITERATION #2 ****************************************
 epoch: 0, train_loss: 1.1368, test_loss: 1.1099, test_f1: 0.3467
 epoch: 1, train_loss: 0.9785, test_loss: 0.9076, test_f1: 0.5394
 epoch: 2, train_loss: 0.9263, test_loss: 0.9218, test_f1: 0.4967
 epoch: 3, train_loss: 0.9028, test_loss: 0.8906, test_f1: 0.5456
 epoch: 4, train_loss: 0.8935, test_loss: 0.8858, test_f1: 0.5764
 epoch: 5, train_loss: 0.8578, test_loss: 0.8428, test_f1: 0.5551
 epoch: 6, train_loss: 0.8324, test_loss: 0.8263, test_f1: 0.5819
 epoch: 7, train_loss: 0.8190, test_loss: 0.7670, test_f1: 0.5998
 epoch: 8, train_loss: 0.8094, test_loss: 0.8113, test_f1: 0.5977
 epoch: 9, train_loss: 0.7824, test_loss: 0.7771, test_f1: 0.6037
 epoch: 10, train_loss: 0.7797, test_loss: 0.7392, test_f1: 0.6693
 epoch: 11, train_loss: 0.7615, test_loss: 0.7432, test_f1: 0.6184
 epoch: 12, train_loss: 0.7509, test_loss: 0.7932, test_f1: 0.6076
 epoch: 13, train_loss: 0.7368, test_loss: 0.7475, test_f1: 0.6438
 epoch: 14, train_loss: 0.7194, test_loss: 0.7007, test_f1: 0.6579
 epoch: 15, train_loss: 0.7073, test_loss: 0.7430, test_f1: 0.6362
 epoch: 16, train_loss: 0.6964, test_loss: 0.7315, test_f1: 0.6206
 epoch: 17, train_loss: 0.6850, test_loss: 0.8073, test_f1: 0.6365
 epoch: 18, train_loss: 0.6685, test_loss: 0.7400, test_f1: 0.6433
 epoch: 19, train_loss: 0.6561, test_loss: 0.7658, test_f1: 0.6606
 epoch: 20, train_loss: 0.6520, test_loss: 0.8401, test_f1: 0.6585
 epoch: 21, train_loss: 0.6558, test_loss: 0.8177, test_f1: 0.6677
 epoch: 22, train_loss: 0.6259, test_loss: 0.7821, test_f1: 0.6235
 epoch: 23, train_loss: 0.6168, test_loss: 0.7658, test_f1: 0.6415
 epoch: 24, train_loss: 0.6118, test_loss: 0.8193, test_f1: 0.6288
 epoch: 25, train_loss: 0.6153, test_loss: 0.7177, test_f1: 0.6747
 epoch: 26, train_loss: 0.5903, test_loss: 0.7150, test_f1: 0.6535
 epoch: 27, train_loss: 0.5785, test_loss: 0.6857, test_f1: 0.6877
 epoch: 28, train_loss: 0.5648, test_loss: 0.7777, test_f1: 0.6777
 epoch: 29, train_loss: 0.5722, test_loss: 0.7534, test_f1: 0.6487
 epoch: 30, train_loss: 0.5648, test_loss: 0.8139, test_f1: 0.6809
 epoch: 31, train_loss: 0.5590, test_loss: 0.7021, test_f1: 0.6766
 epoch: 32, train_loss: 0.5472, test_loss: 0.8226, test_f1: 0.6833
 epoch: 33, train_loss: 0.5527, test_loss: 0.8112, test_f1: 0.6652
 epoch: 34, train_loss: 0.5390, test_loss: 0.8896, test_f1: 0.6709
 epoch: 35, train_loss: 0.5229, test_loss: 0.8556, test_f1: 0.6723
 epoch: 36, train_loss: 0.5080, test_loss: 0.9327, test_f1: 0.6431
 epoch: 37, train_loss: 0.5144, test_loss: 0.9197, test_f1: 0.6874
 epoch: 38, train_loss: 0.4853, test_loss: 0.8567, test_f1: 0.6538
 epoch: 39, train_loss: 0.4896, test_loss: 0.7733, test_f1: 0.6858
 epoch: 40, train_loss: 0.4805, test_loss: 0.8879, test_f1: 0.6596
 epoch: 41, train_loss: 0.4892, test_loss: 0.9114, test_f1: 0.6830
 epoch: 42, train_loss: 0.4831, test_loss: 0.7419, test_f1: 0.7033
 epoch: 43, train_loss: 0.4593, test_loss: 0.7396, test_f1: 0.6887
 epoch: 44, train_loss: 0.4786, test_loss: 0.9635, test_f1: 0.6376
 epoch: 45, train_loss: 0.4762, test_loss: 0.8109, test_f1: 0.6851
 epoch: 46, train_loss: 0.4477, test_loss: 1.0264, test_f1: 0.6683
 epoch: 47, train_loss: 0.4407, test_loss: 0.8182, test_f1: 0.6997
 epoch: 48, train_loss: 0.4415, test_loss: 0.8621, test_f1: 0.6757
 epoch: 49, train_loss: 0.4288, test_loss: 0.9290, test_f1: 0.7142
 epoch: 50, train_loss: 0.4312, test_loss: 0.9867, test_f1: 0.6624
 epoch: 51, train_loss: 0.4032, test_loss: 1.0379, test_f1: 0.6726
 epoch: 52, train_loss: 0.3673, test_loss: 1.0511, test_f1: 0.6707
 epoch: 53, train_loss: 0.3563, test_loss: 1.0118, test_f1: 0.6920
 epoch: 54, train_loss: 0.3591, test_loss: 0.8923, test_f1: 0.6768
 epoch: 55, train_loss: 0.3571, test_loss: 1.0358, test_f1: 0.6824
 epoch: 56, train_loss: 0.3433, test_loss: 1.0595, test_f1: 0.6946
 epoch: 57, train_loss: 0.3410, test_loss: 1.0983, test_f1: 0.6846
 epoch: 58, train_loss: 0.3289, test_loss: 1.0390, test_f1: 0.7008
 epoch: 59, train_loss: 0.3325, test_loss: 0.9473, test_f1: 0.6994
 epoch: 60, train_loss: 0.3403, test_loss: 1.1472, test_f1: 0.6922
 epoch: 61, train_loss: 0.3356, test_loss: 1.0819, test_f1: 0.6683
 epoch: 62, train_loss: 0.3219, test_loss: 1.0382, test_f1: 0.6791
 epoch: 63, train_loss: 0.3300, test_loss: 1.0343, test_f1: 0.6891
 epoch: 64, train_loss: 0.3171, test_loss: 1.2436, test_f1: 0.6967
 epoch: 65, train_loss: 0.2908, test_loss: 1.1988, test_f1: 0.6849
 epoch: 66, train_loss: 0.3190, test_loss: 1.1835, test_f1: 0.6955
 epoch: 67, train_loss: 0.2958, test_loss: 1.2348, test_f1: 0.6914
 epoch: 68, train_loss: 0.3151, test_loss: 1.1713, test_f1: 0.6708
 epoch: 69, train_loss: 0.3116, test_loss: 1.4027, test_f1: 0.6744
 epoch: 70, train_loss: 0.3014, test_loss: 1.1470, test_f1: 0.6821
 epoch: 71, train_loss: 0.2971, test_loss: 1.3156, test_f1: 0.6878
 epoch: 72, train_loss: 0.3060, test_loss: 1.2302, test_f1: 0.6677
 epoch: 73, train_loss: 0.2874, test_loss: 1.2233, test_f1: 0.6743
 epoch: 74, train_loss: 0.3111, test_loss: 1.2934, test_f1: 0.6982
 epoch: 75, train_loss: 0.2791, test_loss: 1.2524, test_f1: 0.6885
 epoch: 76, train_loss: 0.2709, test_loss: 1.3171, test_f1: 0.6961
 epoch: 77, train_loss: 0.2714, test_loss: 1.3954, test_f1: 0.6948
 epoch: 78, train_loss: 0.2698, test_loss: 1.4626, test_f1: 0.6845
 epoch: 79, train_loss: 0.2886, test_loss: 1.3865, test_f1: 0.6757
 epoch: 80, train_loss: 0.2744, test_loss: 1.5410, test_f1: 0.6821
 epoch: 81, train_loss: 0.2631, test_loss: 1.3590, test_f1: 0.6651
 epoch: 82, train_loss: 0.2590, test_loss: 1.2808, test_f1: 0.6818
 epoch: 83, train_loss: 0.2793, test_loss: 1.3749, test_f1: 0.6701
 epoch: 84, train_loss: 0.2722, test_loss: 1.3593, test_f1: 0.6785
 epoch: 85, train_loss: 0.2612, test_loss: 1.3828, test_f1: 0.6863
 epoch: 86, train_loss: 0.2567, test_loss: 1.4202, test_f1: 0.6745
 epoch: 87, train_loss: 0.2494, test_loss: 1.4333, test_f1: 0.6874
 epoch: 88, train_loss: 0.2481, test_loss: 1.4392, test_f1: 0.6843
 epoch: 89, train_loss: 0.2504, test_loss: 1.4721, test_f1: 0.6890
 epoch: 90, train_loss: 0.2378, test_loss: 1.4670, test_f1: 0.6826
 epoch: 91, train_loss: 0.2368, test_loss: 1.3713, test_f1: 0.6947
 epoch: 92, train_loss: 0.2350, test_loss: 1.4750, test_f1: 0.6854
 epoch: 93, train_loss: 0.2406, test_loss: 1.4730, test_f1: 0.6624
 epoch: 94, train_loss: 0.2387, test_loss: 1.4812, test_f1: 0.6829
 epoch: 95, train_loss: 0.2378, test_loss: 1.5123, test_f1: 0.6834
 epoch: 96, train_loss: 0.2416, test_loss: 1.4101, test_f1: 0.6814
 epoch: 97, train_loss: 0.2348, test_loss: 1.5498, test_f1: 0.6753
 epoch: 98, train_loss: 0.2119, test_loss: 1.5626, test_f1: 0.6569
 epoch: 99, train_loss: 0.2502, test_loss: 1.3971, test_f1: 0.6873
##################ITERATION #3 ****************************************
 epoch: 0, train_loss: 1.1736, test_loss: 1.2355, test_f1: 0.3644
 epoch: 1, train_loss: 0.9826, test_loss: 0.9253, test_f1: 0.5422
 epoch: 2, train_loss: 0.9330, test_loss: 0.8859, test_f1: 0.5595
 epoch: 3, train_loss: 0.9304, test_loss: 0.8726, test_f1: 0.5582
 epoch: 4, train_loss: 0.9063, test_loss: 0.8756, test_f1: 0.5426
 epoch: 5, train_loss: 0.8758, test_loss: 0.8735, test_f1: 0.5633
 epoch: 6, train_loss: 0.8464, test_loss: 0.8202, test_f1: 0.5665
 epoch: 7, train_loss: 0.8311, test_loss: 0.8226, test_f1: 0.6438
 epoch: 8, train_loss: 0.8170, test_loss: 0.7817, test_f1: 0.6013
 epoch: 9, train_loss: 0.8038, test_loss: 0.8023, test_f1: 0.6250
 epoch: 10, train_loss: 0.7736, test_loss: 0.8526, test_f1: 0.6200
 epoch: 11, train_loss: 0.7652, test_loss: 0.7818, test_f1: 0.6157
 epoch: 12, train_loss: 0.7339, test_loss: 0.8049, test_f1: 0.6468
 epoch: 13, train_loss: 0.7180, test_loss: 0.8197, test_f1: 0.6455
 epoch: 14, train_loss: 0.7080, test_loss: 0.8363, test_f1: 0.6254
 epoch: 15, train_loss: 0.7111, test_loss: 0.7184, test_f1: 0.6717
 epoch: 16, train_loss: 0.7084, test_loss: 0.7435, test_f1: 0.6512
 epoch: 17, train_loss: 0.6750, test_loss: 0.7769, test_f1: 0.6396
 epoch: 18, train_loss: 0.6567, test_loss: 0.9099, test_f1: 0.6474
 epoch: 19, train_loss: 0.6429, test_loss: 0.8577, test_f1: 0.6551
 epoch: 20, train_loss: 0.6574, test_loss: 0.8347, test_f1: 0.6459
 epoch: 21, train_loss: 0.6346, test_loss: 0.7527, test_f1: 0.6820
 epoch: 22, train_loss: 0.6258, test_loss: 0.9055, test_f1: 0.6372
 epoch: 23, train_loss: 0.6047, test_loss: 0.8457, test_f1: 0.6595
 epoch: 24, train_loss: 0.6154, test_loss: 0.9130, test_f1: 0.6533
 epoch: 25, train_loss: 0.5942, test_loss: 0.8231, test_f1: 0.6672
 epoch: 26, train_loss: 0.5776, test_loss: 0.8980, test_f1: 0.6612
 epoch: 27, train_loss: 0.5788, test_loss: 0.9238, test_f1: 0.6778
 epoch: 28, train_loss: 0.5750, test_loss: 0.8932, test_f1: 0.6490
 epoch: 29, train_loss: 0.5797, test_loss: 1.0364, test_f1: 0.6473
 epoch: 30, train_loss: 0.5483, test_loss: 1.0437, test_f1: 0.6175
 epoch: 31, train_loss: 0.5421, test_loss: 0.9484, test_f1: 0.6587
 epoch: 32, train_loss: 0.5366, test_loss: 0.9794, test_f1: 0.6728
 epoch: 33, train_loss: 0.5450, test_loss: 1.0060, test_f1: 0.6416
 epoch: 34, train_loss: 0.5220, test_loss: 1.0035, test_f1: 0.6496
 epoch: 35, train_loss: 0.5250, test_loss: 0.9570, test_f1: 0.6562
 epoch: 36, train_loss: 0.5114, test_loss: 1.0247, test_f1: 0.6512
 epoch: 37, train_loss: 0.5071, test_loss: 0.9118, test_f1: 0.6661
 epoch: 38, train_loss: 0.4948, test_loss: 0.9013, test_f1: 0.6625
 epoch: 39, train_loss: 0.4902, test_loss: 1.0338, test_f1: 0.6335
 epoch: 40, train_loss: 0.4978, test_loss: 1.0024, test_f1: 0.6801
 epoch: 41, train_loss: 0.4724, test_loss: 1.1236, test_f1: 0.6545
 epoch: 42, train_loss: 0.4698, test_loss: 1.0722, test_f1: 0.6605
 epoch: 43, train_loss: 0.4763, test_loss: 1.0803, test_f1: 0.6449
 epoch: 44, train_loss: 0.4475, test_loss: 1.1944, test_f1: 0.6263
 epoch: 45, train_loss: 0.4552, test_loss: 1.1164, test_f1: 0.6518
 epoch: 46, train_loss: 0.4466, test_loss: 1.0170, test_f1: 0.6587
 epoch: 47, train_loss: 0.4414, test_loss: 1.0114, test_f1: 0.6602
 epoch: 48, train_loss: 0.4352, test_loss: 1.1936, test_f1: 0.6561
 epoch: 49, train_loss: 0.4211, test_loss: 1.0834, test_f1: 0.6734
 epoch: 50, train_loss: 0.4503, test_loss: 1.0229, test_f1: 0.6612
 epoch: 51, train_loss: 0.4023, test_loss: 1.0829, test_f1: 0.6505
 epoch: 52, train_loss: 0.3683, test_loss: 1.1164, test_f1: 0.6788
 epoch: 53, train_loss: 0.3452, test_loss: 1.1808, test_f1: 0.6666
 epoch: 54, train_loss: 0.3590, test_loss: 1.1757, test_f1: 0.6658
 epoch: 55, train_loss: 0.3636, test_loss: 1.1821, test_f1: 0.6736
 epoch: 56, train_loss: 0.3323, test_loss: 1.2575, test_f1: 0.6417
 epoch: 57, train_loss: 0.3353, test_loss: 1.1901, test_f1: 0.6726
 epoch: 58, train_loss: 0.3506, test_loss: 1.2677, test_f1: 0.6716
 epoch: 59, train_loss: 0.3240, test_loss: 1.2599, test_f1: 0.6591
 epoch: 60, train_loss: 0.3093, test_loss: 1.2187, test_f1: 0.6670
 epoch: 61, train_loss: 0.2966, test_loss: 1.2865, test_f1: 0.6574
 epoch: 62, train_loss: 0.3335, test_loss: 1.2241, test_f1: 0.6606
 epoch: 63, train_loss: 0.2945, test_loss: 1.3609, test_f1: 0.6484
 epoch: 64, train_loss: 0.3011, test_loss: 1.2642, test_f1: 0.6646
 epoch: 65, train_loss: 0.2921, test_loss: 1.4174, test_f1: 0.6512
 epoch: 66, train_loss: 0.2981, test_loss: 1.3053, test_f1: 0.6707
 epoch: 67, train_loss: 0.2892, test_loss: 1.3055, test_f1: 0.6680
 epoch: 68, train_loss: 0.2876, test_loss: 1.3622, test_f1: 0.6582
 epoch: 69, train_loss: 0.3226, test_loss: 1.5610, test_f1: 0.6650
 epoch: 70, train_loss: 0.2871, test_loss: 1.3263, test_f1: 0.6621
 epoch: 71, train_loss: 0.2875, test_loss: 1.3317, test_f1: 0.6862
 epoch: 72, train_loss: 0.2747, test_loss: 1.4554, test_f1: 0.6626
 epoch: 73, train_loss: 0.2745, test_loss: 1.5123, test_f1: 0.6780
 epoch: 74, train_loss: 0.2849, test_loss: 1.4547, test_f1: 0.6575
 epoch: 75, train_loss: 0.2844, test_loss: 1.4858, test_f1: 0.6553
 epoch: 76, train_loss: 0.2799, test_loss: 1.5495, test_f1: 0.6678
 epoch: 77, train_loss: 0.2732, test_loss: 1.5325, test_f1: 0.6688
 epoch: 78, train_loss: 0.2658, test_loss: 1.4970, test_f1: 0.6670
 epoch: 79, train_loss: 0.2769, test_loss: 1.6231, test_f1: 0.6591
 epoch: 80, train_loss: 0.2677, test_loss: 1.5689, test_f1: 0.6794
 epoch: 81, train_loss: 0.2584, test_loss: 1.6317, test_f1: 0.6563
 epoch: 82, train_loss: 0.2389, test_loss: 1.6225, test_f1: 0.6555
 epoch: 83, train_loss: 0.2608, test_loss: 1.6880, test_f1: 0.6583
 epoch: 84, train_loss: 0.2534, test_loss: 1.6047, test_f1: 0.6577
 epoch: 85, train_loss: 0.2414, test_loss: 1.4713, test_f1: 0.6700
 epoch: 86, train_loss: 0.2487, test_loss: 1.5702, test_f1: 0.6675
 epoch: 87, train_loss: 0.2445, test_loss: 1.5626, test_f1: 0.6689
 epoch: 88, train_loss: 0.2363, test_loss: 1.4340, test_f1: 0.6681
 epoch: 89, train_loss: 0.2434, test_loss: 1.6315, test_f1: 0.6706
 epoch: 90, train_loss: 0.2230, test_loss: 1.6337, test_f1: 0.6585
 epoch: 91, train_loss: 0.2159, test_loss: 1.7533, test_f1: 0.6599
 epoch: 92, train_loss: 0.2508, test_loss: 1.7103, test_f1: 0.6373
 epoch: 93, train_loss: 0.2585, test_loss: 1.6567, test_f1: 0.6689
 epoch: 94, train_loss: 0.2287, test_loss: 1.6718, test_f1: 0.6556
 epoch: 95, train_loss: 0.2213, test_loss: 1.7582, test_f1: 0.6525
 epoch: 96, train_loss: 0.2325, test_loss: 1.7077, test_f1: 0.6561
 epoch: 97, train_loss: 0.2268, test_loss: 1.6723, test_f1: 0.6603
 epoch: 98, train_loss: 0.2136, test_loss: 1.7496, test_f1: 0.6607
 epoch: 99, train_loss: 0.2190, test_loss: 1.7128, test_f1: 0.6370
##################ITERATION #4 ****************************************
 epoch: 0, train_loss: 1.3020, test_loss: 1.2179, test_f1: 0.3751
 epoch: 1, train_loss: 1.0439, test_loss: 0.9833, test_f1: 0.4827
 epoch: 2, train_loss: 0.9812, test_loss: 0.9575, test_f1: 0.5090
 epoch: 3, train_loss: 0.9597, test_loss: 0.9598, test_f1: 0.5090
 epoch: 4, train_loss: 0.9302, test_loss: 0.9469, test_f1: 0.5271
 epoch: 5, train_loss: 0.8856, test_loss: 0.9101, test_f1: 0.5462
 epoch: 6, train_loss: 0.8863, test_loss: 0.9239, test_f1: 0.5611
 epoch: 7, train_loss: 0.8635, test_loss: 0.9136, test_f1: 0.5680
 epoch: 8, train_loss: 0.8385, test_loss: 0.8721, test_f1: 0.5709
 epoch: 9, train_loss: 0.8124, test_loss: 0.8179, test_f1: 0.5768
 epoch: 10, train_loss: 0.7949, test_loss: 0.8569, test_f1: 0.5923
 epoch: 11, train_loss: 0.7848, test_loss: 0.8493, test_f1: 0.6307
 epoch: 12, train_loss: 0.7717, test_loss: 0.8567, test_f1: 0.5951
 epoch: 13, train_loss: 0.7538, test_loss: 0.8116, test_f1: 0.6186
 epoch: 14, train_loss: 0.7474, test_loss: 0.8357, test_f1: 0.6144
 epoch: 15, train_loss: 0.7268, test_loss: 0.7315, test_f1: 0.6367
 epoch: 16, train_loss: 0.7227, test_loss: 0.7605, test_f1: 0.6029
 epoch: 17, train_loss: 0.7146, test_loss: 0.7466, test_f1: 0.6222
 epoch: 18, train_loss: 0.6922, test_loss: 0.7530, test_f1: 0.6412
 epoch: 19, train_loss: 0.6795, test_loss: 0.7926, test_f1: 0.6427
 epoch: 20, train_loss: 0.6755, test_loss: 0.8150, test_f1: 0.6167
 epoch: 21, train_loss: 0.6526, test_loss: 0.7827, test_f1: 0.6495
 epoch: 22, train_loss: 0.6330, test_loss: 0.8095, test_f1: 0.6257
 epoch: 23, train_loss: 0.6299, test_loss: 0.8276, test_f1: 0.6307
 epoch: 24, train_loss: 0.6375, test_loss: 0.9098, test_f1: 0.5724
 epoch: 25, train_loss: 0.6170, test_loss: 0.8256, test_f1: 0.6467
 epoch: 26, train_loss: 0.6142, test_loss: 0.8280, test_f1: 0.6516
 epoch: 27, train_loss: 0.6002, test_loss: 0.7727, test_f1: 0.6310
 epoch: 28, train_loss: 0.5875, test_loss: 0.8397, test_f1: 0.6345
 epoch: 29, train_loss: 0.5767, test_loss: 0.7585, test_f1: 0.6395
 epoch: 30, train_loss: 0.5619, test_loss: 0.7859, test_f1: 0.6579
 epoch: 31, train_loss: 0.5643, test_loss: 0.8280, test_f1: 0.6567
 epoch: 32, train_loss: 0.5738, test_loss: 0.7783, test_f1: 0.6697
 epoch: 33, train_loss: 0.5604, test_loss: 0.8539, test_f1: 0.6464
 epoch: 34, train_loss: 0.5411, test_loss: 0.8447, test_f1: 0.6191
 epoch: 35, train_loss: 0.5397, test_loss: 0.9164, test_f1: 0.6222
 epoch: 36, train_loss: 0.5550, test_loss: 0.9050, test_f1: 0.6608
 epoch: 37, train_loss: 0.5218, test_loss: 0.8527, test_f1: 0.6284
 epoch: 38, train_loss: 0.5185, test_loss: 0.9124, test_f1: 0.6380
 epoch: 39, train_loss: 0.5373, test_loss: 0.8688, test_f1: 0.6689
 epoch: 40, train_loss: 0.5004, test_loss: 0.9785, test_f1: 0.6692
 epoch: 41, train_loss: 0.5102, test_loss: 0.8754, test_f1: 0.6562
 epoch: 42, train_loss: 0.4797, test_loss: 1.0712, test_f1: 0.6501
 epoch: 43, train_loss: 0.4731, test_loss: 1.0342, test_f1: 0.6493
 epoch: 44, train_loss: 0.4612, test_loss: 1.0473, test_f1: 0.6251
 epoch: 45, train_loss: 0.4640, test_loss: 1.0455, test_f1: 0.6346
 epoch: 46, train_loss: 0.4615, test_loss: 0.9756, test_f1: 0.6813
 epoch: 47, train_loss: 0.4709, test_loss: 1.1103, test_f1: 0.6390
 epoch: 48, train_loss: 0.4558, test_loss: 1.0229, test_f1: 0.6527
 epoch: 49, train_loss: 0.4432, test_loss: 0.9849, test_f1: 0.6657
 epoch: 50, train_loss: 0.4280, test_loss: 1.0345, test_f1: 0.6583
 epoch: 51, train_loss: 0.4042, test_loss: 1.0451, test_f1: 0.6602
 epoch: 52, train_loss: 0.3849, test_loss: 1.1637, test_f1: 0.6508
 epoch: 53, train_loss: 0.3729, test_loss: 1.1240, test_f1: 0.6684
 epoch: 54, train_loss: 0.3770, test_loss: 1.2163, test_f1: 0.6569
 epoch: 55, train_loss: 0.3804, test_loss: 1.2091, test_f1: 0.6879
 epoch: 56, train_loss: 0.3805, test_loss: 1.0805, test_f1: 0.6793
 epoch: 57, train_loss: 0.3529, test_loss: 1.0594, test_f1: 0.6513
 epoch: 58, train_loss: 0.3660, test_loss: 1.2077, test_f1: 0.6512
 epoch: 59, train_loss: 0.3507, test_loss: 1.1559, test_f1: 0.6653
 epoch: 60, train_loss: 0.3478, test_loss: 1.1850, test_f1: 0.6565
 epoch: 61, train_loss: 0.3404, test_loss: 1.2188, test_f1: 0.6619
 epoch: 62, train_loss: 0.3401, test_loss: 1.2592, test_f1: 0.6493
 epoch: 63, train_loss: 0.3407, test_loss: 1.1223, test_f1: 0.6779
 epoch: 64, train_loss: 0.3253, test_loss: 1.2285, test_f1: 0.6452
 epoch: 65, train_loss: 0.3279, test_loss: 1.1614, test_f1: 0.6466
 epoch: 66, train_loss: 0.3092, test_loss: 1.3013, test_f1: 0.6613
 epoch: 67, train_loss: 0.3111, test_loss: 1.2061, test_f1: 0.6736
 epoch: 68, train_loss: 0.3349, test_loss: 1.3048, test_f1: 0.6487
 epoch: 69, train_loss: 0.3139, test_loss: 1.2605, test_f1: 0.6461
 epoch: 70, train_loss: 0.3038, test_loss: 1.3758, test_f1: 0.6645
 epoch: 71, train_loss: 0.3292, test_loss: 1.3393, test_f1: 0.6721
 epoch: 72, train_loss: 0.3129, test_loss: 1.3795, test_f1: 0.6720
 epoch: 73, train_loss: 0.3206, test_loss: 1.4447, test_f1: 0.6695
 epoch: 74, train_loss: 0.3093, test_loss: 1.4395, test_f1: 0.6571
 epoch: 75, train_loss: 0.2837, test_loss: 1.3737, test_f1: 0.6606
 epoch: 76, train_loss: 0.2925, test_loss: 1.4476, test_f1: 0.6661
 epoch: 77, train_loss: 0.3060, test_loss: 1.4102, test_f1: 0.6694
 epoch: 78, train_loss: 0.2929, test_loss: 1.4701, test_f1: 0.6709
 epoch: 79, train_loss: 0.2883, test_loss: 1.4376, test_f1: 0.6724
 epoch: 80, train_loss: 0.2996, test_loss: 1.4340, test_f1: 0.6499
 epoch: 81, train_loss: 0.2981, test_loss: 1.4603, test_f1: 0.6632
 epoch: 82, train_loss: 0.2956, test_loss: 1.4712, test_f1: 0.6682
 epoch: 83, train_loss: 0.2750, test_loss: 1.3315, test_f1: 0.6830
 epoch: 84, train_loss: 0.2821, test_loss: 1.5333, test_f1: 0.6499
 epoch: 85, train_loss: 0.2935, test_loss: 1.4389, test_f1: 0.6489
 epoch: 86, train_loss: 0.2780, test_loss: 1.5126, test_f1: 0.6732
 epoch: 87, train_loss: 0.2920, test_loss: 1.5037, test_f1: 0.6578
 epoch: 88, train_loss: 0.2722, test_loss: 1.5287, test_f1: 0.6662
 epoch: 89, train_loss: 0.2640, test_loss: 1.5795, test_f1: 0.6476
 epoch: 90, train_loss: 0.2678, test_loss: 1.6433, test_f1: 0.6530
 epoch: 91, train_loss: 0.2729, test_loss: 1.6090, test_f1: 0.6640
 epoch: 92, train_loss: 0.2646, test_loss: 1.5996, test_f1: 0.6527
 epoch: 93, train_loss: 0.2735, test_loss: 1.5847, test_f1: 0.6705
 epoch: 94, train_loss: 0.2701, test_loss: 1.5932, test_f1: 0.6692
 epoch: 95, train_loss: 0.2737, test_loss: 1.5617, test_f1: 0.6720
 epoch: 96, train_loss: 0.2694, test_loss: 1.5385, test_f1: 0.6524
 epoch: 97, train_loss: 0.2452, test_loss: 1.5419, test_f1: 0.6721
 epoch: 98, train_loss: 0.2459, test_loss: 1.4865, test_f1: 0.6698
 epoch: 99, train_loss: 0.2618, test_loss: 1.7184, test_f1: 0.6484
##################ITERATION #5 ****************************************
 epoch: 0, train_loss: 1.2640, test_loss: 1.0695, test_f1: 0.4698
 epoch: 1, train_loss: 0.9979, test_loss: 1.0012, test_f1: 0.5608
 epoch: 2, train_loss: 0.9602, test_loss: 0.9230, test_f1: 0.5261
 epoch: 3, train_loss: 0.9285, test_loss: 0.9387, test_f1: 0.5509
 epoch: 4, train_loss: 0.9041, test_loss: 0.9005, test_f1: 0.5680
 epoch: 5, train_loss: 0.8679, test_loss: 0.8672, test_f1: 0.6035
 epoch: 6, train_loss: 0.8527, test_loss: 0.9281, test_f1: 0.5897
 epoch: 7, train_loss: 0.8483, test_loss: 0.8977, test_f1: 0.5914
 epoch: 8, train_loss: 0.8155, test_loss: 0.8235, test_f1: 0.5990
 epoch: 9, train_loss: 0.7981, test_loss: 0.8476, test_f1: 0.5882
 epoch: 10, train_loss: 0.7797, test_loss: 0.8531, test_f1: 0.5729
 epoch: 11, train_loss: 0.7754, test_loss: 0.8208, test_f1: 0.6150
 epoch: 12, train_loss: 0.7581, test_loss: 0.8044, test_f1: 0.6016
 epoch: 13, train_loss: 0.7324, test_loss: 0.8191, test_f1: 0.6094
 epoch: 14, train_loss: 0.7393, test_loss: 0.7939, test_f1: 0.6600
 epoch: 15, train_loss: 0.7242, test_loss: 0.7762, test_f1: 0.6577
 epoch: 16, train_loss: 0.6970, test_loss: 0.8963, test_f1: 0.5937
 epoch: 17, train_loss: 0.7045, test_loss: 0.7518, test_f1: 0.6475
 epoch: 18, train_loss: 0.6928, test_loss: 0.8259, test_f1: 0.6707
 epoch: 19, train_loss: 0.6698, test_loss: 0.7713, test_f1: 0.6529
 epoch: 20, train_loss: 0.6682, test_loss: 0.8056, test_f1: 0.6303
 epoch: 21, train_loss: 0.6522, test_loss: 0.7767, test_f1: 0.6425
 epoch: 22, train_loss: 0.6389, test_loss: 0.8797, test_f1: 0.6128
 epoch: 23, train_loss: 0.6429, test_loss: 0.7288, test_f1: 0.6699
 epoch: 24, train_loss: 0.6309, test_loss: 0.8307, test_f1: 0.6385
 epoch: 25, train_loss: 0.6127, test_loss: 0.8134, test_f1: 0.6419
 epoch: 26, train_loss: 0.6171, test_loss: 0.8846, test_f1: 0.6406
 epoch: 27, train_loss: 0.6089, test_loss: 0.8497, test_f1: 0.6243
 epoch: 28, train_loss: 0.6069, test_loss: 0.7320, test_f1: 0.6533
 epoch: 29, train_loss: 0.5993, test_loss: 0.7971, test_f1: 0.6657
 epoch: 30, train_loss: 0.5741, test_loss: 0.7689, test_f1: 0.6519
 epoch: 31, train_loss: 0.5717, test_loss: 0.7777, test_f1: 0.6594
 epoch: 32, train_loss: 0.5670, test_loss: 0.7261, test_f1: 0.6561
 epoch: 33, train_loss: 0.5717, test_loss: 0.8089, test_f1: 0.6490
 epoch: 34, train_loss: 0.5565, test_loss: 0.7835, test_f1: 0.6350
 epoch: 35, train_loss: 0.5554, test_loss: 0.7930, test_f1: 0.6628
 epoch: 36, train_loss: 0.5291, test_loss: 0.7948, test_f1: 0.6713
 epoch: 37, train_loss: 0.5418, test_loss: 0.8260, test_f1: 0.6756
 epoch: 38, train_loss: 0.5420, test_loss: 0.7672, test_f1: 0.6716
 epoch: 39, train_loss: 0.5040, test_loss: 0.8828, test_f1: 0.6509
 epoch: 40, train_loss: 0.5241, test_loss: 0.8148, test_f1: 0.6532
 epoch: 41, train_loss: 0.5208, test_loss: 0.8412, test_f1: 0.6573
 epoch: 42, train_loss: 0.5090, test_loss: 0.8711, test_f1: 0.6658
 epoch: 43, train_loss: 0.5105, test_loss: 0.8896, test_f1: 0.6575
 epoch: 44, train_loss: 0.5069, test_loss: 0.9006, test_f1: 0.6473
 epoch: 45, train_loss: 0.4733, test_loss: 0.8859, test_f1: 0.6565
 epoch: 46, train_loss: 0.4887, test_loss: 0.8138, test_f1: 0.6784
 epoch: 47, train_loss: 0.4758, test_loss: 0.8687, test_f1: 0.6406
 epoch: 48, train_loss: 0.4559, test_loss: 0.8026, test_f1: 0.6913
 epoch: 49, train_loss: 0.4710, test_loss: 0.9572, test_f1: 0.6552
 epoch: 50, train_loss: 0.4612, test_loss: 0.9905, test_f1: 0.6389
 epoch: 51, train_loss: 0.4153, test_loss: 0.9622, test_f1: 0.6532
 epoch: 52, train_loss: 0.4016, test_loss: 0.9395, test_f1: 0.6564
 epoch: 53, train_loss: 0.3945, test_loss: 1.0095, test_f1: 0.6597
 epoch: 54, train_loss: 0.3830, test_loss: 0.9297, test_f1: 0.6833
 epoch: 55, train_loss: 0.3883, test_loss: 0.9472, test_f1: 0.6685
 epoch: 56, train_loss: 0.3668, test_loss: 0.9590, test_f1: 0.6589
 epoch: 57, train_loss: 0.3944, test_loss: 1.0460, test_f1: 0.6484
 epoch: 58, train_loss: 0.3756, test_loss: 1.0220, test_f1: 0.6610
 epoch: 59, train_loss: 0.3867, test_loss: 0.9808, test_f1: 0.6625
 epoch: 60, train_loss: 0.3642, test_loss: 1.0770, test_f1: 0.6502
 epoch: 61, train_loss: 0.3538, test_loss: 0.9682, test_f1: 0.6644
 epoch: 62, train_loss: 0.3536, test_loss: 1.0216, test_f1: 0.6610
 epoch: 63, train_loss: 0.3442, test_loss: 1.0719, test_f1: 0.6572
 epoch: 64, train_loss: 0.3487, test_loss: 1.1271, test_f1: 0.6493
 epoch: 65, train_loss: 0.3404, test_loss: 1.0553, test_f1: 0.6491
 epoch: 66, train_loss: 0.3447, test_loss: 1.1391, test_f1: 0.6542
 epoch: 67, train_loss: 0.3529, test_loss: 1.0897, test_f1: 0.6603
 epoch: 68, train_loss: 0.3286, test_loss: 1.0399, test_f1: 0.6526
 epoch: 69, train_loss: 0.3365, test_loss: 1.0930, test_f1: 0.6544
 epoch: 70, train_loss: 0.3359, test_loss: 1.0363, test_f1: 0.6598
 epoch: 71, train_loss: 0.3298, test_loss: 1.0518, test_f1: 0.6531
 epoch: 72, train_loss: 0.3340, test_loss: 1.1133, test_f1: 0.6675
 epoch: 73, train_loss: 0.3281, test_loss: 1.0784, test_f1: 0.6627
 epoch: 74, train_loss: 0.3163, test_loss: 1.1432, test_f1: 0.6572
 epoch: 75, train_loss: 0.3107, test_loss: 1.1517, test_f1: 0.6491
 epoch: 76, train_loss: 0.2894, test_loss: 1.2117, test_f1: 0.6537
 epoch: 77, train_loss: 0.3157, test_loss: 1.1735, test_f1: 0.6627
 epoch: 78, train_loss: 0.3138, test_loss: 1.1703, test_f1: 0.6602
 epoch: 79, train_loss: 0.3084, test_loss: 1.1129, test_f1: 0.6549
 epoch: 80, train_loss: 0.3300, test_loss: 1.1654, test_f1: 0.6646
 epoch: 81, train_loss: 0.3071, test_loss: 1.1917, test_f1: 0.6478
 epoch: 82, train_loss: 0.3081, test_loss: 1.2661, test_f1: 0.6681
 epoch: 83, train_loss: 0.2938, test_loss: 1.2660, test_f1: 0.6589
 epoch: 84, train_loss: 0.2929, test_loss: 1.2885, test_f1: 0.6456
 epoch: 85, train_loss: 0.2990, test_loss: 1.2782, test_f1: 0.6509
 epoch: 86, train_loss: 0.2784, test_loss: 1.2242, test_f1: 0.6576
 epoch: 87, train_loss: 0.2853, test_loss: 1.2382, test_f1: 0.6493
 epoch: 88, train_loss: 0.2978, test_loss: 1.2328, test_f1: 0.6454
 epoch: 89, train_loss: 0.3061, test_loss: 1.2195, test_f1: 0.6542
 epoch: 90, train_loss: 0.2712, test_loss: 1.2515, test_f1: 0.6473
 epoch: 91, train_loss: 0.2695, test_loss: 1.2493, test_f1: 0.6463
 epoch: 92, train_loss: 0.2854, test_loss: 1.2936, test_f1: 0.6607
 epoch: 93, train_loss: 0.2567, test_loss: 1.2645, test_f1: 0.6604
 epoch: 94, train_loss: 0.2803, test_loss: 1.2789, test_f1: 0.6594
 epoch: 95, train_loss: 0.2749, test_loss: 1.3034, test_f1: 0.6434
 epoch: 96, train_loss: 0.2865, test_loss: 1.3149, test_f1: 0.6504
 epoch: 97, train_loss: 0.2720, test_loss: 1.3245, test_f1: 0.6692
 epoch: 98, train_loss: 0.2708, test_loss: 1.2261, test_f1: 0.6559
 epoch: 99, train_loss: 0.2746, test_loss: 1.2142, test_f1: 0.6594
##################ITERATION #6 ****************************************
 epoch: 0, train_loss: 1.3118, test_loss: 1.0878, test_f1: 0.4600
 epoch: 1, train_loss: 1.0010, test_loss: 0.9717, test_f1: 0.5361
 epoch: 2, train_loss: 0.9689, test_loss: 0.9081, test_f1: 0.5509
 epoch: 3, train_loss: 0.9341, test_loss: 0.9493, test_f1: 0.5413
 epoch: 4, train_loss: 0.8908, test_loss: 0.9119, test_f1: 0.5291
 epoch: 5, train_loss: 0.8819, test_loss: 0.8982, test_f1: 0.5912
 epoch: 6, train_loss: 0.8646, test_loss: 0.8918, test_f1: 0.5903
 epoch: 7, train_loss: 0.8587, test_loss: 0.8431, test_f1: 0.5653
 epoch: 8, train_loss: 0.8184, test_loss: 0.8260, test_f1: 0.6123
 epoch: 9, train_loss: 0.8007, test_loss: 0.9221, test_f1: 0.5912
 epoch: 10, train_loss: 0.7985, test_loss: 0.8397, test_f1: 0.6094
 epoch: 11, train_loss: 0.7785, test_loss: 0.8165, test_f1: 0.5943
 epoch: 12, train_loss: 0.7723, test_loss: 0.7919, test_f1: 0.6039
 epoch: 13, train_loss: 0.7490, test_loss: 0.8580, test_f1: 0.5847
 epoch: 14, train_loss: 0.7684, test_loss: 0.7994, test_f1: 0.6298
 epoch: 15, train_loss: 0.7181, test_loss: 0.8206, test_f1: 0.6352
 epoch: 16, train_loss: 0.7163, test_loss: 0.7727, test_f1: 0.6420
 epoch: 17, train_loss: 0.6916, test_loss: 0.9018, test_f1: 0.5890
 epoch: 18, train_loss: 0.6857, test_loss: 0.8340, test_f1: 0.6397
 epoch: 19, train_loss: 0.6903, test_loss: 0.8803, test_f1: 0.6252
 epoch: 20, train_loss: 0.6826, test_loss: 0.8332, test_f1: 0.6192
 epoch: 21, train_loss: 0.6564, test_loss: 0.7966, test_f1: 0.6162
 epoch: 22, train_loss: 0.6389, test_loss: 0.8173, test_f1: 0.6274
 epoch: 23, train_loss: 0.6426, test_loss: 0.8324, test_f1: 0.6211
 epoch: 24, train_loss: 0.6396, test_loss: 0.8010, test_f1: 0.6450
 epoch: 25, train_loss: 0.6276, test_loss: 0.8480, test_f1: 0.6117
 epoch: 26, train_loss: 0.6213, test_loss: 0.8433, test_f1: 0.6478
 epoch: 27, train_loss: 0.5842, test_loss: 0.9154, test_f1: 0.6544
 epoch: 28, train_loss: 0.6019, test_loss: 0.8404, test_f1: 0.6414
 epoch: 29, train_loss: 0.6003, test_loss: 0.8650, test_f1: 0.6472
 epoch: 30, train_loss: 0.5924, test_loss: 0.8465, test_f1: 0.6342
 epoch: 31, train_loss: 0.5869, test_loss: 0.8757, test_f1: 0.6288
 epoch: 32, train_loss: 0.5736, test_loss: 0.8676, test_f1: 0.6290
 epoch: 33, train_loss: 0.5798, test_loss: 0.9049, test_f1: 0.6285
 epoch: 34, train_loss: 0.5580, test_loss: 0.9078, test_f1: 0.6426
 epoch: 35, train_loss: 0.5434, test_loss: 0.8772, test_f1: 0.6545
 epoch: 36, train_loss: 0.5528, test_loss: 0.9623, test_f1: 0.6273
 epoch: 37, train_loss: 0.5252, test_loss: 0.9067, test_f1: 0.6546
 epoch: 38, train_loss: 0.5333, test_loss: 0.8105, test_f1: 0.6730
 epoch: 39, train_loss: 0.5416, test_loss: 0.8729, test_f1: 0.6431
 epoch: 40, train_loss: 0.5303, test_loss: 0.9343, test_f1: 0.6513
 epoch: 41, train_loss: 0.5361, test_loss: 0.9775, test_f1: 0.6421
 epoch: 42, train_loss: 0.5167, test_loss: 0.9411, test_f1: 0.6351
 epoch: 43, train_loss: 0.5097, test_loss: 0.9149, test_f1: 0.6296
 epoch: 44, train_loss: 0.5076, test_loss: 0.9901, test_f1: 0.6620
 epoch: 45, train_loss: 0.4762, test_loss: 0.9542, test_f1: 0.6616
 epoch: 46, train_loss: 0.4755, test_loss: 0.9803, test_f1: 0.6489
 epoch: 47, train_loss: 0.4833, test_loss: 1.1111, test_f1: 0.6277
 epoch: 48, train_loss: 0.4779, test_loss: 1.0917, test_f1: 0.6495
 epoch: 49, train_loss: 0.4709, test_loss: 1.1060, test_f1: 0.6565
 epoch: 50, train_loss: 0.4532, test_loss: 1.0341, test_f1: 0.6541
 epoch: 51, train_loss: 0.4358, test_loss: 0.9970, test_f1: 0.6570
 epoch: 52, train_loss: 0.3961, test_loss: 0.9942, test_f1: 0.6641
 epoch: 53, train_loss: 0.3842, test_loss: 1.0187, test_f1: 0.6585
 epoch: 54, train_loss: 0.3923, test_loss: 1.0678, test_f1: 0.6644
 epoch: 55, train_loss: 0.3694, test_loss: 1.1013, test_f1: 0.6642
 epoch: 56, train_loss: 0.3726, test_loss: 1.1204, test_f1: 0.6548
 epoch: 57, train_loss: 0.3772, test_loss: 1.0805, test_f1: 0.6681
 epoch: 58, train_loss: 0.3721, test_loss: 1.1329, test_f1: 0.6478
 epoch: 59, train_loss: 0.3736, test_loss: 1.1645, test_f1: 0.6817
 epoch: 60, train_loss: 0.3566, test_loss: 1.1868, test_f1: 0.6555
 epoch: 61, train_loss: 0.3550, test_loss: 1.2272, test_f1: 0.6603
 epoch: 62, train_loss: 0.3620, test_loss: 1.1855, test_f1: 0.6699
 epoch: 63, train_loss: 0.3540, test_loss: 1.2355, test_f1: 0.6675
 epoch: 64, train_loss: 0.3476, test_loss: 1.2820, test_f1: 0.6572
 epoch: 65, train_loss: 0.3539, test_loss: 1.2795, test_f1: 0.6465
 epoch: 66, train_loss: 0.3467, test_loss: 1.2940, test_f1: 0.6488
 epoch: 67, train_loss: 0.3517, test_loss: 1.3353, test_f1: 0.6570
 epoch: 68, train_loss: 0.3442, test_loss: 1.3578, test_f1: 0.6615
 epoch: 69, train_loss: 0.3298, test_loss: 1.4236, test_f1: 0.6669
 epoch: 70, train_loss: 0.3346, test_loss: 1.2742, test_f1: 0.6722
 epoch: 71, train_loss: 0.3162, test_loss: 1.2841, test_f1: 0.6696
 epoch: 72, train_loss: 0.3192, test_loss: 1.3135, test_f1: 0.6544
 epoch: 73, train_loss: 0.3314, test_loss: 1.2980, test_f1: 0.6624
 epoch: 74, train_loss: 0.3023, test_loss: 1.4698, test_f1: 0.6601
 epoch: 75, train_loss: 0.3375, test_loss: 1.4731, test_f1: 0.6595
 epoch: 76, train_loss: 0.3196, test_loss: 1.4849, test_f1: 0.6619
 epoch: 77, train_loss: 0.3183, test_loss: 1.4041, test_f1: 0.6796
 epoch: 78, train_loss: 0.3084, test_loss: 1.5050, test_f1: 0.6589
 epoch: 79, train_loss: 0.2983, test_loss: 1.4160, test_f1: 0.6572
 epoch: 80, train_loss: 0.3092, test_loss: 1.4107, test_f1: 0.6650
 epoch: 81, train_loss: 0.3036, test_loss: 1.3449, test_f1: 0.6708
 epoch: 82, train_loss: 0.2848, test_loss: 1.4644, test_f1: 0.6668
 epoch: 83, train_loss: 0.3194, test_loss: 1.4749, test_f1: 0.6709
 epoch: 84, train_loss: 0.3038, test_loss: 1.5257, test_f1: 0.6628
 epoch: 85, train_loss: 0.2892, test_loss: 1.5130, test_f1: 0.6566
 epoch: 86, train_loss: 0.2945, test_loss: 1.4158, test_f1: 0.6711
 epoch: 87, train_loss: 0.2921, test_loss: 1.4717, test_f1: 0.6576
 epoch: 88, train_loss: 0.2896, test_loss: 1.4644, test_f1: 0.6721
 epoch: 89, train_loss: 0.2838, test_loss: 1.6071, test_f1: 0.6638
 epoch: 90, train_loss: 0.2876, test_loss: 1.6034, test_f1: 0.6698
 epoch: 91, train_loss: 0.2598, test_loss: 1.6112, test_f1: 0.6649
 epoch: 92, train_loss: 0.2953, test_loss: 1.5601, test_f1: 0.6583
 epoch: 93, train_loss: 0.2599, test_loss: 1.6802, test_f1: 0.6693
 epoch: 94, train_loss: 0.2779, test_loss: 1.6683, test_f1: 0.6628
 epoch: 95, train_loss: 0.2780, test_loss: 1.6552, test_f1: 0.6659
 epoch: 96, train_loss: 0.2537, test_loss: 1.7458, test_f1: 0.6626
 epoch: 97, train_loss: 0.2877, test_loss: 1.6837, test_f1: 0.6603
 epoch: 98, train_loss: 0.2769, test_loss: 1.6682, test_f1: 0.6646
 epoch: 99, train_loss: 0.2573, test_loss: 1.6935, test_f1: 0.6743
##################ITERATION #7 ****************************************
 epoch: 0, train_loss: 1.3796, test_loss: 1.1437, test_f1: 0.4003
 epoch: 1, train_loss: 1.0366, test_loss: 1.0171, test_f1: 0.5183
 epoch: 2, train_loss: 0.9774, test_loss: 0.9517, test_f1: 0.5544
 epoch: 3, train_loss: 0.9561, test_loss: 0.9024, test_f1: 0.5644
 epoch: 4, train_loss: 0.9226, test_loss: 0.9233, test_f1: 0.5705
 epoch: 5, train_loss: 0.9023, test_loss: 0.8633, test_f1: 0.5805
 epoch: 6, train_loss: 0.8761, test_loss: 0.8965, test_f1: 0.6005
 epoch: 7, train_loss: 0.8721, test_loss: 0.8445, test_f1: 0.5994
 epoch: 8, train_loss: 0.8523, test_loss: 0.8490, test_f1: 0.6052
 epoch: 9, train_loss: 0.8299, test_loss: 0.8251, test_f1: 0.6005
 epoch: 10, train_loss: 0.7975, test_loss: 0.7607, test_f1: 0.6297
 epoch: 11, train_loss: 0.8087, test_loss: 0.7979, test_f1: 0.6165
 epoch: 12, train_loss: 0.8011, test_loss: 0.8487, test_f1: 0.5702
 epoch: 13, train_loss: 0.7730, test_loss: 0.8085, test_f1: 0.6349
 epoch: 14, train_loss: 0.7677, test_loss: 0.7298, test_f1: 0.6303
 epoch: 15, train_loss: 0.7560, test_loss: 0.7889, test_f1: 0.6131
 epoch: 16, train_loss: 0.7371, test_loss: 0.8092, test_f1: 0.5960
 epoch: 17, train_loss: 0.7434, test_loss: 0.8097, test_f1: 0.6019
 epoch: 18, train_loss: 0.7271, test_loss: 0.7624, test_f1: 0.6019
 epoch: 19, train_loss: 0.7132, test_loss: 0.7998, test_f1: 0.6163
 epoch: 20, train_loss: 0.6987, test_loss: 0.7680, test_f1: 0.6491
 epoch: 21, train_loss: 0.7020, test_loss: 0.7589, test_f1: 0.6267
 epoch: 22, train_loss: 0.6963, test_loss: 0.7552, test_f1: 0.6465
 epoch: 23, train_loss: 0.6865, test_loss: 0.7323, test_f1: 0.6183
 epoch: 24, train_loss: 0.6566, test_loss: 0.8356, test_f1: 0.6203
 epoch: 25, train_loss: 0.6581, test_loss: 0.7772, test_f1: 0.6381
 epoch: 26, train_loss: 0.6597, test_loss: 0.8039, test_f1: 0.6368
 epoch: 27, train_loss: 0.6457, test_loss: 0.7789, test_f1: 0.6575
 epoch: 28, train_loss: 0.6327, test_loss: 0.7668, test_f1: 0.6826
 epoch: 29, train_loss: 0.6143, test_loss: 0.7590, test_f1: 0.6361
 epoch: 30, train_loss: 0.6128, test_loss: 0.7716, test_f1: 0.6652
 epoch: 31, train_loss: 0.5996, test_loss: 0.7987, test_f1: 0.6366
 epoch: 32, train_loss: 0.5935, test_loss: 0.8376, test_f1: 0.6234
 epoch: 33, train_loss: 0.5785, test_loss: 0.7677, test_f1: 0.6504
 epoch: 34, train_loss: 0.5924, test_loss: 0.8685, test_f1: 0.6324
 epoch: 35, train_loss: 0.5791, test_loss: 0.8338, test_f1: 0.6499
 epoch: 36, train_loss: 0.5727, test_loss: 0.7393, test_f1: 0.6807
 epoch: 37, train_loss: 0.5563, test_loss: 0.7842, test_f1: 0.6655
 epoch: 38, train_loss: 0.5613, test_loss: 0.8588, test_f1: 0.6383
 epoch: 39, train_loss: 0.5422, test_loss: 0.8173, test_f1: 0.6576
 epoch: 40, train_loss: 0.5634, test_loss: 0.7942, test_f1: 0.6726
 epoch: 41, train_loss: 0.5493, test_loss: 0.8540, test_f1: 0.6564
 epoch: 42, train_loss: 0.5214, test_loss: 0.8737, test_f1: 0.6498
 epoch: 43, train_loss: 0.5432, test_loss: 0.8326, test_f1: 0.6637
 epoch: 44, train_loss: 0.4975, test_loss: 0.8287, test_f1: 0.6665
 epoch: 45, train_loss: 0.4984, test_loss: 0.8890, test_f1: 0.6537
 epoch: 46, train_loss: 0.5021, test_loss: 0.8252, test_f1: 0.6523
 epoch: 47, train_loss: 0.5042, test_loss: 0.9466, test_f1: 0.6557
 epoch: 48, train_loss: 0.4833, test_loss: 0.9428, test_f1: 0.6540
 epoch: 49, train_loss: 0.5144, test_loss: 0.8844, test_f1: 0.6558
 epoch: 50, train_loss: 0.4834, test_loss: 0.9932, test_f1: 0.6380
 epoch: 51, train_loss: 0.4575, test_loss: 0.9199, test_f1: 0.6672
 epoch: 52, train_loss: 0.4249, test_loss: 0.9442, test_f1: 0.6693
 epoch: 53, train_loss: 0.4086, test_loss: 0.9674, test_f1: 0.6767
 epoch: 54, train_loss: 0.4133, test_loss: 0.9273, test_f1: 0.6712
 epoch: 55, train_loss: 0.4085, test_loss: 0.9920, test_f1: 0.6636
 epoch: 56, train_loss: 0.3841, test_loss: 1.0120, test_f1: 0.6559
 epoch: 57, train_loss: 0.3933, test_loss: 1.0972, test_f1: 0.6524
 epoch: 58, train_loss: 0.3917, test_loss: 1.0455, test_f1: 0.6759
 epoch: 59, train_loss: 0.3980, test_loss: 1.0311, test_f1: 0.6783
 epoch: 60, train_loss: 0.3776, test_loss: 1.1534, test_f1: 0.6805
 epoch: 61, train_loss: 0.3842, test_loss: 1.1136, test_f1: 0.6522
 epoch: 62, train_loss: 0.3831, test_loss: 1.1074, test_f1: 0.6619
 epoch: 63, train_loss: 0.3678, test_loss: 1.0732, test_f1: 0.6406
 epoch: 64, train_loss: 0.3630, test_loss: 1.1850, test_f1: 0.6667
 epoch: 65, train_loss: 0.3554, test_loss: 1.1740, test_f1: 0.6792
 epoch: 66, train_loss: 0.3515, test_loss: 1.2347, test_f1: 0.6645
 epoch: 67, train_loss: 0.3549, test_loss: 1.1018, test_f1: 0.6615
 epoch: 68, train_loss: 0.3596, test_loss: 1.1997, test_f1: 0.6398
 epoch: 69, train_loss: 0.3388, test_loss: 1.2771, test_f1: 0.6532
 epoch: 70, train_loss: 0.3513, test_loss: 1.2228, test_f1: 0.6518
 epoch: 71, train_loss: 0.3794, test_loss: 1.2090, test_f1: 0.6680
 epoch: 72, train_loss: 0.3356, test_loss: 1.2404, test_f1: 0.6607
 epoch: 73, train_loss: 0.3433, test_loss: 1.2269, test_f1: 0.6645
 epoch: 74, train_loss: 0.3448, test_loss: 1.2539, test_f1: 0.6589
 epoch: 75, train_loss: 0.3487, test_loss: 1.1744, test_f1: 0.6547
 epoch: 76, train_loss: 0.3197, test_loss: 1.2930, test_f1: 0.6575
 epoch: 77, train_loss: 0.3285, test_loss: 1.1834, test_f1: 0.6530
 epoch: 78, train_loss: 0.3157, test_loss: 1.2200, test_f1: 0.6706
 epoch: 79, train_loss: 0.3419, test_loss: 1.2972, test_f1: 0.6350
 epoch: 80, train_loss: 0.3293, test_loss: 1.2243, test_f1: 0.6553
 epoch: 81, train_loss: 0.3301, test_loss: 1.2321, test_f1: 0.6645
 epoch: 82, train_loss: 0.3039, test_loss: 1.2836, test_f1: 0.6551
 epoch: 83, train_loss: 0.3049, test_loss: 1.2506, test_f1: 0.6533
 epoch: 84, train_loss: 0.3161, test_loss: 1.2692, test_f1: 0.6568
 epoch: 85, train_loss: 0.3073, test_loss: 1.4438, test_f1: 0.6399
 epoch: 86, train_loss: 0.3049, test_loss: 1.2507, test_f1: 0.6625
 epoch: 87, train_loss: 0.2995, test_loss: 1.3153, test_f1: 0.6641
 epoch: 88, train_loss: 0.3135, test_loss: 1.3198, test_f1: 0.6513
 epoch: 89, train_loss: 0.2956, test_loss: 1.4370, test_f1: 0.6472
 epoch: 90, train_loss: 0.2886, test_loss: 1.4129, test_f1: 0.6496
 epoch: 91, train_loss: 0.2858, test_loss: 1.5212, test_f1: 0.6307
 epoch: 92, train_loss: 0.2751, test_loss: 1.3958, test_f1: 0.6485
 epoch: 93, train_loss: 0.3055, test_loss: 1.4101, test_f1: 0.6599
 epoch: 94, train_loss: 0.3141, test_loss: 1.2725, test_f1: 0.6639
 epoch: 95, train_loss: 0.2633, test_loss: 1.3719, test_f1: 0.6427
 epoch: 96, train_loss: 0.2779, test_loss: 1.3754, test_f1: 0.6618
 epoch: 97, train_loss: 0.2784, test_loss: 1.3361, test_f1: 0.6674
 epoch: 98, train_loss: 0.2940, test_loss: 1.4612, test_f1: 0.6429
 epoch: 99, train_loss: 0.2842, test_loss: 1.4170, test_f1: 0.6509
##################ITERATION #8 ****************************************
 epoch: 0, train_loss: 1.2895, test_loss: 1.2850, test_f1: 0.3476
 epoch: 1, train_loss: 0.9998, test_loss: 0.9200, test_f1: 0.5255
 epoch: 2, train_loss: 0.9623, test_loss: 0.9228, test_f1: 0.5293
 epoch: 3, train_loss: 0.9290, test_loss: 0.9267, test_f1: 0.5178
 epoch: 4, train_loss: 0.9162, test_loss: 0.8980, test_f1: 0.5092
 epoch: 5, train_loss: 0.9041, test_loss: 0.9383, test_f1: 0.5380
 epoch: 6, train_loss: 0.8653, test_loss: 0.9041, test_f1: 0.5064
 epoch: 7, train_loss: 0.8543, test_loss: 0.8546, test_f1: 0.5695
 epoch: 8, train_loss: 0.8363, test_loss: 0.8411, test_f1: 0.5400
 epoch: 9, train_loss: 0.8270, test_loss: 0.8543, test_f1: 0.5683
 epoch: 10, train_loss: 0.8129, test_loss: 0.8090, test_f1: 0.5987
 epoch: 11, train_loss: 0.8111, test_loss: 0.8562, test_f1: 0.5824
 epoch: 12, train_loss: 0.7773, test_loss: 0.8221, test_f1: 0.6067
 epoch: 13, train_loss: 0.7688, test_loss: 0.8840, test_f1: 0.5869
 epoch: 14, train_loss: 0.7583, test_loss: 0.8411, test_f1: 0.5886
 epoch: 15, train_loss: 0.7699, test_loss: 0.8740, test_f1: 0.5935
 epoch: 16, train_loss: 0.7317, test_loss: 0.8481, test_f1: 0.6205
 epoch: 17, train_loss: 0.7320, test_loss: 0.8344, test_f1: 0.5979
 epoch: 18, train_loss: 0.7267, test_loss: 0.8723, test_f1: 0.5910
 epoch: 19, train_loss: 0.6987, test_loss: 0.8392, test_f1: 0.6066
 epoch: 20, train_loss: 0.7009, test_loss: 0.8071, test_f1: 0.6124
 epoch: 21, train_loss: 0.6969, test_loss: 0.7928, test_f1: 0.6202
 epoch: 22, train_loss: 0.6865, test_loss: 0.7909, test_f1: 0.6333
 epoch: 23, train_loss: 0.6528, test_loss: 0.8965, test_f1: 0.6007
 epoch: 24, train_loss: 0.6891, test_loss: 0.8841, test_f1: 0.5799
 epoch: 25, train_loss: 0.6496, test_loss: 0.8088, test_f1: 0.6270
 epoch: 26, train_loss: 0.6388, test_loss: 0.8231, test_f1: 0.6319
 epoch: 27, train_loss: 0.6387, test_loss: 0.8367, test_f1: 0.6396
 epoch: 28, train_loss: 0.6216, test_loss: 0.8557, test_f1: 0.6317
 epoch: 29, train_loss: 0.6232, test_loss: 0.8850, test_f1: 0.6299
 epoch: 30, train_loss: 0.6103, test_loss: 0.8999, test_f1: 0.6123
 epoch: 31, train_loss: 0.6091, test_loss: 0.9272, test_f1: 0.6236
 epoch: 32, train_loss: 0.5938, test_loss: 0.9300, test_f1: 0.6167
 epoch: 33, train_loss: 0.6062, test_loss: 0.9358, test_f1: 0.6184
 epoch: 34, train_loss: 0.6055, test_loss: 0.9536, test_f1: 0.6049
 epoch: 35, train_loss: 0.5783, test_loss: 0.8977, test_f1: 0.6618
 epoch: 36, train_loss: 0.5781, test_loss: 0.9672, test_f1: 0.6297
 epoch: 37, train_loss: 0.5720, test_loss: 0.9550, test_f1: 0.6135
 epoch: 38, train_loss: 0.5445, test_loss: 0.9574, test_f1: 0.6328
 epoch: 39, train_loss: 0.5617, test_loss: 0.9246, test_f1: 0.6423
 epoch: 40, train_loss: 0.5572, test_loss: 0.8859, test_f1: 0.6596
 epoch: 41, train_loss: 0.5443, test_loss: 0.9043, test_f1: 0.6609
 epoch: 42, train_loss: 0.5334, test_loss: 0.9900, test_f1: 0.6240
 epoch: 43, train_loss: 0.5454, test_loss: 0.9950, test_f1: 0.6446
 epoch: 44, train_loss: 0.5532, test_loss: 0.9518, test_f1: 0.6241
 epoch: 45, train_loss: 0.5361, test_loss: 0.9731, test_f1: 0.6496
 epoch: 46, train_loss: 0.5107, test_loss: 1.0142, test_f1: 0.6572
 epoch: 47, train_loss: 0.5141, test_loss: 1.0738, test_f1: 0.6380
 epoch: 48, train_loss: 0.4863, test_loss: 0.9920, test_f1: 0.6630
 epoch: 49, train_loss: 0.5083, test_loss: 0.9919, test_f1: 0.6646
 epoch: 50, train_loss: 0.5112, test_loss: 1.0800, test_f1: 0.6555
 epoch: 51, train_loss: 0.4798, test_loss: 1.0213, test_f1: 0.6356
 epoch: 52, train_loss: 0.4431, test_loss: 1.0682, test_f1: 0.6513
 epoch: 53, train_loss: 0.4326, test_loss: 1.0538, test_f1: 0.6562
 epoch: 54, train_loss: 0.4280, test_loss: 1.1033, test_f1: 0.6592
 epoch: 55, train_loss: 0.4141, test_loss: 1.1099, test_f1: 0.6666
 epoch: 56, train_loss: 0.4168, test_loss: 1.1242, test_f1: 0.6729
 epoch: 57, train_loss: 0.4218, test_loss: 1.1573, test_f1: 0.6509
 epoch: 58, train_loss: 0.4217, test_loss: 1.2077, test_f1: 0.6331
 epoch: 59, train_loss: 0.4078, test_loss: 1.1865, test_f1: 0.6649
 epoch: 60, train_loss: 0.4104, test_loss: 1.1561, test_f1: 0.6538
 epoch: 61, train_loss: 0.4172, test_loss: 1.1047, test_f1: 0.6713
 epoch: 62, train_loss: 0.3908, test_loss: 1.1416, test_f1: 0.6648
 epoch: 63, train_loss: 0.3930, test_loss: 1.1530, test_f1: 0.6547
 epoch: 64, train_loss: 0.3931, test_loss: 1.1675, test_f1: 0.6807
 epoch: 65, train_loss: 0.3906, test_loss: 1.2274, test_f1: 0.6518
 epoch: 66, train_loss: 0.3817, test_loss: 1.1867, test_f1: 0.6608
 epoch: 67, train_loss: 0.3819, test_loss: 1.1764, test_f1: 0.6692
 epoch: 68, train_loss: 0.3646, test_loss: 1.2027, test_f1: 0.6543
 epoch: 69, train_loss: 0.3742, test_loss: 1.2330, test_f1: 0.6683
 epoch: 70, train_loss: 0.3595, test_loss: 1.2446, test_f1: 0.6562
 epoch: 71, train_loss: 0.3675, test_loss: 1.2403, test_f1: 0.6784
 epoch: 72, train_loss: 0.3588, test_loss: 1.2740, test_f1: 0.6537
 epoch: 73, train_loss: 0.3561, test_loss: 1.3692, test_f1: 0.6391
 epoch: 74, train_loss: 0.3548, test_loss: 1.2291, test_f1: 0.6442
 epoch: 75, train_loss: 0.3652, test_loss: 1.2833, test_f1: 0.6820
 epoch: 76, train_loss: 0.3506, test_loss: 1.2847, test_f1: 0.6546
 epoch: 77, train_loss: 0.3410, test_loss: 1.2748, test_f1: 0.6678
 epoch: 78, train_loss: 0.3409, test_loss: 1.3941, test_f1: 0.6675
 epoch: 79, train_loss: 0.3710, test_loss: 1.2157, test_f1: 0.6682
 epoch: 80, train_loss: 0.3285, test_loss: 1.3818, test_f1: 0.6419
 epoch: 81, train_loss: 0.3321, test_loss: 1.3314, test_f1: 0.6578
 epoch: 82, train_loss: 0.3322, test_loss: 1.3889, test_f1: 0.6562
 epoch: 83, train_loss: 0.3365, test_loss: 1.3126, test_f1: 0.6800
 epoch: 84, train_loss: 0.3365, test_loss: 1.3909, test_f1: 0.6719
 epoch: 85, train_loss: 0.3201, test_loss: 1.3731, test_f1: 0.6617
 epoch: 86, train_loss: 0.3308, test_loss: 1.3363, test_f1: 0.6589
 epoch: 87, train_loss: 0.3174, test_loss: 1.4315, test_f1: 0.6570
 epoch: 88, train_loss: 0.3224, test_loss: 1.4147, test_f1: 0.6659
 epoch: 89, train_loss: 0.3123, test_loss: 1.4764, test_f1: 0.6605
 epoch: 90, train_loss: 0.3247, test_loss: 1.4724, test_f1: 0.6513
 epoch: 91, train_loss: 0.3145, test_loss: 1.4621, test_f1: 0.6406
 epoch: 92, train_loss: 0.3120, test_loss: 1.4253, test_f1: 0.6604
 epoch: 93, train_loss: 0.3067, test_loss: 1.4986, test_f1: 0.6449
 epoch: 94, train_loss: 0.3074, test_loss: 1.5608, test_f1: 0.6534
 epoch: 95, train_loss: 0.3154, test_loss: 1.4632, test_f1: 0.6619
 epoch: 96, train_loss: 0.3069, test_loss: 1.4554, test_f1: 0.6473
 epoch: 97, train_loss: 0.3081, test_loss: 1.4522, test_f1: 0.6601
 epoch: 98, train_loss: 0.3080, test_loss: 1.4631, test_f1: 0.6608
 epoch: 99, train_loss: 0.3032, test_loss: 1.5291, test_f1: 0.6545
##################ITERATION #9 ****************************************
 epoch: 0, train_loss: 1.2634, test_loss: 1.1376, test_f1: 0.3480
 epoch: 1, train_loss: 0.9817, test_loss: 0.9360, test_f1: 0.5274
 epoch: 2, train_loss: 0.9408, test_loss: 0.9540, test_f1: 0.5255
 epoch: 3, train_loss: 0.9182, test_loss: 0.8805, test_f1: 0.5256
 epoch: 4, train_loss: 0.8972, test_loss: 0.9277, test_f1: 0.5103
 epoch: 5, train_loss: 0.8840, test_loss: 0.8517, test_f1: 0.5404
 epoch: 6, train_loss: 0.8776, test_loss: 0.9107, test_f1: 0.5337
 epoch: 7, train_loss: 0.8467, test_loss: 0.8949, test_f1: 0.5782
 epoch: 8, train_loss: 0.8344, test_loss: 0.8494, test_f1: 0.5634
 epoch: 9, train_loss: 0.8037, test_loss: 0.8327, test_f1: 0.6182
 epoch: 10, train_loss: 0.7977, test_loss: 0.8292, test_f1: 0.5837
 epoch: 11, train_loss: 0.7930, test_loss: 0.8520, test_f1: 0.5892
 epoch: 12, train_loss: 0.7684, test_loss: 0.8294, test_f1: 0.6146
 epoch: 13, train_loss: 0.7611, test_loss: 0.8186, test_f1: 0.6080
 epoch: 14, train_loss: 0.7582, test_loss: 0.8452, test_f1: 0.6129
 epoch: 15, train_loss: 0.7492, test_loss: 0.7519, test_f1: 0.6267
 epoch: 16, train_loss: 0.7236, test_loss: 0.8023, test_f1: 0.6071
 epoch: 17, train_loss: 0.7215, test_loss: 0.8608, test_f1: 0.5705
 epoch: 18, train_loss: 0.7097, test_loss: 0.7712, test_f1: 0.6270
 epoch: 19, train_loss: 0.6957, test_loss: 0.7729, test_f1: 0.6003
 epoch: 20, train_loss: 0.6786, test_loss: 0.8149, test_f1: 0.6223
 epoch: 21, train_loss: 0.6701, test_loss: 0.8213, test_f1: 0.6276
 epoch: 22, train_loss: 0.6831, test_loss: 0.7652, test_f1: 0.6274
 epoch: 23, train_loss: 0.6699, test_loss: 0.7689, test_f1: 0.6233
 epoch: 24, train_loss: 0.6485, test_loss: 0.7938, test_f1: 0.6296
 epoch: 25, train_loss: 0.6633, test_loss: 0.7725, test_f1: 0.6421
 epoch: 26, train_loss: 0.6310, test_loss: 0.8084, test_f1: 0.6543
 epoch: 27, train_loss: 0.6126, test_loss: 0.8552, test_f1: 0.6316
 epoch: 28, train_loss: 0.5930, test_loss: 0.7893, test_f1: 0.6434
 epoch: 29, train_loss: 0.6019, test_loss: 0.7887, test_f1: 0.6369
 epoch: 30, train_loss: 0.5894, test_loss: 0.8248, test_f1: 0.6536
 epoch: 31, train_loss: 0.5905, test_loss: 0.8056, test_f1: 0.6615
 epoch: 32, train_loss: 0.5667, test_loss: 0.7927, test_f1: 0.6765
 epoch: 33, train_loss: 0.5672, test_loss: 0.7412, test_f1: 0.6696
 epoch: 34, train_loss: 0.5691, test_loss: 0.8168, test_f1: 0.6603
 epoch: 35, train_loss: 0.5414, test_loss: 0.9216, test_f1: 0.6438
 epoch: 36, train_loss: 0.5723, test_loss: 0.8688, test_f1: 0.6666
 epoch: 37, train_loss: 0.5501, test_loss: 0.8408, test_f1: 0.6532
 epoch: 38, train_loss: 0.5605, test_loss: 0.8436, test_f1: 0.6501
 epoch: 39, train_loss: 0.5389, test_loss: 0.7971, test_f1: 0.6590
 epoch: 40, train_loss: 0.5283, test_loss: 0.8948, test_f1: 0.6525
 epoch: 41, train_loss: 0.5190, test_loss: 0.8077, test_f1: 0.6736
 epoch: 42, train_loss: 0.5140, test_loss: 0.8151, test_f1: 0.6706
 epoch: 43, train_loss: 0.5262, test_loss: 0.9044, test_f1: 0.6350
 epoch: 44, train_loss: 0.5118, test_loss: 0.9154, test_f1: 0.6752
 epoch: 45, train_loss: 0.4906, test_loss: 0.7366, test_f1: 0.7006
 epoch: 46, train_loss: 0.4879, test_loss: 1.0219, test_f1: 0.6150
 epoch: 47, train_loss: 0.4839, test_loss: 0.8488, test_f1: 0.6736
 epoch: 48, train_loss: 0.4880, test_loss: 0.9327, test_f1: 0.6669
 epoch: 49, train_loss: 0.4735, test_loss: 0.8778, test_f1: 0.6820
 epoch: 50, train_loss: 0.4964, test_loss: 0.8474, test_f1: 0.6729
 epoch: 51, train_loss: 0.4351, test_loss: 0.9554, test_f1: 0.6715
 epoch: 52, train_loss: 0.4213, test_loss: 0.9219, test_f1: 0.6513
 epoch: 53, train_loss: 0.4144, test_loss: 0.9502, test_f1: 0.6785
 epoch: 54, train_loss: 0.4011, test_loss: 0.9843, test_f1: 0.6831
 epoch: 55, train_loss: 0.3918, test_loss: 1.0028, test_f1: 0.6778
 epoch: 56, train_loss: 0.3976, test_loss: 1.0468, test_f1: 0.6992
 epoch: 57, train_loss: 0.3706, test_loss: 0.9678, test_f1: 0.6944
 epoch: 58, train_loss: 0.3715, test_loss: 0.9855, test_f1: 0.6738
 epoch: 59, train_loss: 0.3810, test_loss: 1.0274, test_f1: 0.7072
 epoch: 60, train_loss: 0.3925, test_loss: 1.0405, test_f1: 0.6757
 epoch: 61, train_loss: 0.3711, test_loss: 1.1205, test_f1: 0.6822
 epoch: 62, train_loss: 0.3602, test_loss: 1.0523, test_f1: 0.7004
 epoch: 63, train_loss: 0.3755, test_loss: 1.1004, test_f1: 0.6724
 epoch: 64, train_loss: 0.3561, test_loss: 1.1480, test_f1: 0.6670
 epoch: 65, train_loss: 0.3682, test_loss: 1.0309, test_f1: 0.6736
 epoch: 66, train_loss: 0.3680, test_loss: 1.1321, test_f1: 0.6850
 epoch: 67, train_loss: 0.3539, test_loss: 1.0974, test_f1: 0.6795
 epoch: 68, train_loss: 0.3370, test_loss: 1.1336, test_f1: 0.6896
 epoch: 69, train_loss: 0.3583, test_loss: 1.1213, test_f1: 0.6890
 epoch: 70, train_loss: 0.3524, test_loss: 1.1602, test_f1: 0.6867
 epoch: 71, train_loss: 0.3301, test_loss: 1.1534, test_f1: 0.6968
 epoch: 72, train_loss: 0.3138, test_loss: 1.1698, test_f1: 0.6818
 epoch: 73, train_loss: 0.3334, test_loss: 1.1538, test_f1: 0.6815
 epoch: 74, train_loss: 0.3087, test_loss: 1.2336, test_f1: 0.6807
 epoch: 75, train_loss: 0.3451, test_loss: 1.1567, test_f1: 0.6863
 epoch: 76, train_loss: 0.3251, test_loss: 1.1434, test_f1: 0.7100
 epoch: 77, train_loss: 0.3193, test_loss: 1.2383, test_f1: 0.6811
 epoch: 78, train_loss: 0.3176, test_loss: 1.2681, test_f1: 0.6800
 epoch: 79, train_loss: 0.3148, test_loss: 1.2194, test_f1: 0.6657
 epoch: 80, train_loss: 0.3155, test_loss: 1.2188, test_f1: 0.6791
 epoch: 81, train_loss: 0.3074, test_loss: 1.3475, test_f1: 0.6754
 epoch: 82, train_loss: 0.2911, test_loss: 1.2547, test_f1: 0.6992
 epoch: 83, train_loss: 0.3209, test_loss: 1.2247, test_f1: 0.7046
 epoch: 84, train_loss: 0.2884, test_loss: 1.2406, test_f1: 0.6703
 epoch: 85, train_loss: 0.2933, test_loss: 1.3131, test_f1: 0.6767
 epoch: 86, train_loss: 0.2865, test_loss: 1.2979, test_f1: 0.6693
 epoch: 87, train_loss: 0.3053, test_loss: 1.3953, test_f1: 0.6705
 epoch: 88, train_loss: 0.2947, test_loss: 1.3264, test_f1: 0.6765
 epoch: 89, train_loss: 0.2755, test_loss: 1.2339, test_f1: 0.6860
 epoch: 90, train_loss: 0.3008, test_loss: 1.4289, test_f1: 0.6587
 epoch: 91, train_loss: 0.2771, test_loss: 1.2876, test_f1: 0.6748
 epoch: 92, train_loss: 0.2774, test_loss: 1.3815, test_f1: 0.6954
 epoch: 93, train_loss: 0.2512, test_loss: 1.3689, test_f1: 0.6766
 epoch: 94, train_loss: 0.2705, test_loss: 1.3830, test_f1: 0.6519
 epoch: 95, train_loss: 0.2923, test_loss: 1.3632, test_f1: 0.6904
 epoch: 96, train_loss: 0.2597, test_loss: 1.4193, test_f1: 0.6767
 epoch: 97, train_loss: 0.2525, test_loss: 1.6113, test_f1: 0.6523
 epoch: 98, train_loss: 0.2640, test_loss: 1.4992, test_f1: 0.6645
 epoch: 99, train_loss: 0.2733, test_loss: 1.4394, test_f1: 0.6788

Training completed in 702.01 seconds
Best F1: 0.7142 at epoch 49
Mean F1 across iterations: 0.6931  0.0110
========================FINAL RESULTS================================
FEGIN weighted F1: 0.7142  0.0110
python main.py --data ltspice_examples --representation component_pin_net --model FEGIN --layers 4 --hiddens 64 --batch_size 64 --lr 0.001 --emb_size 128 --epochs 100 --save_appendix component_pin_net_L4_H64_BS64_LR0.001_E128 --no_val
-----



STDERR:
  File "main.py", line 370, in <module>
    main()
  File "main.py", line 254, in main
    dataset = dataset_class(
  File "/home/philip/projects/ltspice_examples_code_repo/Circuit-Completion-Using-GNNs/component_classification_with_link_prediction_head/evaluation/FEGIN/kernel/circuit_datasets.py", line 15, in __init__
    self.data, self.slices = torch.load(self.processed_paths[0])
  File "/home/philip/.local/lib/python3.8/site-packages/torch/serialization.py", line 1040, in load
    warnings.warn(
  File "/usr/lib/python3.8/warnings.py", line 109, in _showwarnmsg
    sw(msg.message, msg.category, msg.filename, msg.lineno,
  File "main.py", line 47, in warn_with_traceback
    traceback.print_stack(file=log)
/home/philip/projects/ltspice_examples_code_repo/Circuit-Completion-Using-GNNs/component_classification_with_link_prediction_head/evaluation/FEGIN/kernel/circuit_datasets.py:15: FutureWarning: You are using `torch.load` with `weights_only=False` (the current default value), which uses the default pickle module implicitly. It is possible to construct malicious pickle data which will execute arbitrary code during unpickling (See https://github.com/pytorch/pytorch/blob/main/SECURITY.md#untrusted-models for more details). In a future release, the default value for `weights_only` will be flipped to `True`. This limits the functions that could be executed during unpickling. Arbitrary objects will no longer be allowed to be loaded via this mode unless they are explicitly allowlisted by the user via `torch.serialization.add_safe_globals`. We recommend you start setting `weights_only=True` for any use case where you don't have full control of the loaded file. Please open an issue on GitHub for any issues related to this experimental feature.
  self.data, self.slices = torch.load(self.processed_paths[0])
