STDOUT:
Results will be saved in /home/philip/projects/ltspice_examples_code_repo/Circuit-Completion-Using-GNNs/component_classification_with_link_prediction_head/evaluation/FEGIN/results/model_FEGIN_dataset_ltspice_examples
Command line input: python main.py --data ltspice_examples --representation component_pin_net --model FEGIN --layers 6 --hiddens 128 --batch_size 128 --lr 0.01 --emb_size 250 --epochs 100 --save_appendix component_pin_net_L6_H128_BS128_LR0.01_E250 --no_val
 is saved.
-----
ltspice_examples - FEGIN
Using 6 layers, 128 hidden units, h = 2
Loading component_pin_net representation dataset
ENTERED
Training FEGIN on component_pin_net representation
Train: 3558, Test: 846
##################ITERATION #0 ****************************************
 epoch: 0, train_loss: 1.1659, test_loss: 1.2144, test_f1: 0.2952
 epoch: 1, train_loss: 1.0028, test_loss: 0.9622, test_f1: 0.4860
 epoch: 2, train_loss: 0.9622, test_loss: 0.9947, test_f1: 0.4793
 epoch: 3, train_loss: 0.9420, test_loss: 1.0068, test_f1: 0.4844
 epoch: 4, train_loss: 0.9372, test_loss: 1.3250, test_f1: 0.4556
 epoch: 5, train_loss: 0.9355, test_loss: 0.9721, test_f1: 0.4756
 epoch: 6, train_loss: 0.8890, test_loss: 0.9140, test_f1: 0.5061
 epoch: 7, train_loss: 0.8495, test_loss: 0.9568, test_f1: 0.5537
 epoch: 8, train_loss: 0.8300, test_loss: 0.9993, test_f1: 0.4953
 epoch: 9, train_loss: 0.8445, test_loss: 0.8972, test_f1: 0.5938
 epoch: 10, train_loss: 0.8242, test_loss: 1.1339, test_f1: 0.5241
 epoch: 11, train_loss: 0.8011, test_loss: 0.9510, test_f1: 0.6101
 epoch: 12, train_loss: 0.8052, test_loss: 0.9095, test_f1: 0.5508
 epoch: 13, train_loss: 0.7747, test_loss: 0.8851, test_f1: 0.5289
 epoch: 14, train_loss: 0.7602, test_loss: 0.9360, test_f1: 0.5948
 epoch: 15, train_loss: 0.7605, test_loss: 0.8876, test_f1: 0.6304
 epoch: 16, train_loss: 0.7310, test_loss: 1.0483, test_f1: 0.5730
 epoch: 17, train_loss: 0.7312, test_loss: 0.8960, test_f1: 0.5398
 epoch: 18, train_loss: 0.7163, test_loss: 0.9935, test_f1: 0.6047
 epoch: 19, train_loss: 0.7180, test_loss: 0.9461, test_f1: 0.6440
 epoch: 20, train_loss: 0.7257, test_loss: 1.0148, test_f1: 0.5914
 epoch: 21, train_loss: 0.6958, test_loss: 0.9535, test_f1: 0.6203
 epoch: 22, train_loss: 0.6952, test_loss: 1.0620, test_f1: 0.6179
 epoch: 23, train_loss: 0.6943, test_loss: 0.8491, test_f1: 0.6288
 epoch: 24, train_loss: 0.6956, test_loss: 0.9170, test_f1: 0.6120
 epoch: 25, train_loss: 0.6910, test_loss: 0.9744, test_f1: 0.6013
 epoch: 26, train_loss: 0.6732, test_loss: 0.9548, test_f1: 0.5993
 epoch: 27, train_loss: 0.6574, test_loss: 1.1462, test_f1: 0.5425
 epoch: 28, train_loss: 0.6534, test_loss: 0.9467, test_f1: 0.5935
 epoch: 29, train_loss: 0.6441, test_loss: 0.8771, test_f1: 0.6429
 epoch: 30, train_loss: 0.6509, test_loss: 0.9320, test_f1: 0.6034
 epoch: 31, train_loss: 0.6394, test_loss: 0.9398, test_f1: 0.6274
 epoch: 32, train_loss: 0.6042, test_loss: 0.9877, test_f1: 0.6426
 epoch: 33, train_loss: 0.6202, test_loss: 1.0798, test_f1: 0.6230
 epoch: 34, train_loss: 0.6278, test_loss: 0.9675, test_f1: 0.6355
 epoch: 35, train_loss: 0.6128, test_loss: 0.9230, test_f1: 0.6475
 epoch: 36, train_loss: 0.6225, test_loss: 0.8738, test_f1: 0.6105
 epoch: 37, train_loss: 0.6163, test_loss: 1.0671, test_f1: 0.5912
 epoch: 38, train_loss: 0.6005, test_loss: 1.0540, test_f1: 0.6380
 epoch: 39, train_loss: 0.5900, test_loss: 1.2318, test_f1: 0.5896
 epoch: 40, train_loss: 0.5825, test_loss: 1.1777, test_f1: 0.6249
 epoch: 41, train_loss: 0.5950, test_loss: 1.0540, test_f1: 0.6416
 epoch: 42, train_loss: 0.5933, test_loss: 1.0268, test_f1: 0.6341
 epoch: 43, train_loss: 0.6172, test_loss: 0.8994, test_f1: 0.6469
 epoch: 44, train_loss: 0.5810, test_loss: 0.9305, test_f1: 0.6205
 epoch: 45, train_loss: 0.5516, test_loss: 0.8571, test_f1: 0.6164
 epoch: 46, train_loss: 0.5788, test_loss: 1.0458, test_f1: 0.6112
 epoch: 47, train_loss: 0.5663, test_loss: 0.9855, test_f1: 0.6297
 epoch: 48, train_loss: 0.5751, test_loss: 0.9342, test_f1: 0.6627
 epoch: 49, train_loss: 0.5594, test_loss: 0.9711, test_f1: 0.6587
 epoch: 50, train_loss: 0.5413, test_loss: 0.9514, test_f1: 0.6247
 epoch: 51, train_loss: 0.5136, test_loss: 1.1210, test_f1: 0.6359
 epoch: 52, train_loss: 0.4800, test_loss: 1.0404, test_f1: 0.6626
 epoch: 53, train_loss: 0.4602, test_loss: 0.9268, test_f1: 0.6481
 epoch: 54, train_loss: 0.4568, test_loss: 1.0500, test_f1: 0.6585
 epoch: 55, train_loss: 0.4474, test_loss: 0.9530, test_f1: 0.6588
 epoch: 56, train_loss: 0.4437, test_loss: 1.0311, test_f1: 0.6459
 epoch: 57, train_loss: 0.4402, test_loss: 0.9715, test_f1: 0.6447
 epoch: 58, train_loss: 0.4410, test_loss: 0.9977, test_f1: 0.6448
 epoch: 59, train_loss: 0.4183, test_loss: 1.0894, test_f1: 0.6565
 epoch: 60, train_loss: 0.4402, test_loss: 0.9058, test_f1: 0.6510
 epoch: 61, train_loss: 0.4361, test_loss: 1.0329, test_f1: 0.6507
 epoch: 62, train_loss: 0.4294, test_loss: 0.9412, test_f1: 0.6784
 epoch: 63, train_loss: 0.4197, test_loss: 0.9965, test_f1: 0.6835
 epoch: 64, train_loss: 0.3987, test_loss: 1.0653, test_f1: 0.6732
 epoch: 65, train_loss: 0.4168, test_loss: 1.2168, test_f1: 0.6540
 epoch: 66, train_loss: 0.4182, test_loss: 1.1090, test_f1: 0.6798
 epoch: 67, train_loss: 0.3805, test_loss: 1.0953, test_f1: 0.6544
 epoch: 68, train_loss: 0.3910, test_loss: 1.0781, test_f1: 0.6681
 epoch: 69, train_loss: 0.4041, test_loss: 0.9431, test_f1: 0.6779
 epoch: 70, train_loss: 0.3861, test_loss: 0.9818, test_f1: 0.6658
 epoch: 71, train_loss: 0.4025, test_loss: 1.0059, test_f1: 0.6415
 epoch: 72, train_loss: 0.3647, test_loss: 1.0254, test_f1: 0.6711
 epoch: 73, train_loss: 0.3698, test_loss: 0.9972, test_f1: 0.6457
 epoch: 74, train_loss: 0.3603, test_loss: 1.0190, test_f1: 0.6812
 epoch: 75, train_loss: 0.3643, test_loss: 1.1245, test_f1: 0.6373
 epoch: 76, train_loss: 0.3604, test_loss: 0.9413, test_f1: 0.6542
 epoch: 77, train_loss: 0.3500, test_loss: 1.1393, test_f1: 0.6681
 epoch: 78, train_loss: 0.3717, test_loss: 1.0147, test_f1: 0.6812
 epoch: 79, train_loss: 0.3709, test_loss: 1.0648, test_f1: 0.6834
 epoch: 80, train_loss: 0.3373, test_loss: 1.0385, test_f1: 0.7020
 epoch: 81, train_loss: 0.3681, test_loss: 1.0778, test_f1: 0.6448
 epoch: 82, train_loss: 0.3272, test_loss: 1.1613, test_f1: 0.6844
 epoch: 83, train_loss: 0.3235, test_loss: 0.9920, test_f1: 0.6993
 epoch: 84, train_loss: 0.3339, test_loss: 1.1734, test_f1: 0.6398
 epoch: 85, train_loss: 0.3150, test_loss: 1.2268, test_f1: 0.6815
 epoch: 86, train_loss: 0.3679, test_loss: 1.0100, test_f1: 0.6595
 epoch: 87, train_loss: 0.3420, test_loss: 0.9716, test_f1: 0.6888
 epoch: 88, train_loss: 0.3172, test_loss: 1.0853, test_f1: 0.6660
 epoch: 89, train_loss: 0.3084, test_loss: 1.0969, test_f1: 0.6837
 epoch: 90, train_loss: 0.2996, test_loss: 1.0157, test_f1: 0.6875
 epoch: 91, train_loss: 0.3134, test_loss: 1.1836, test_f1: 0.6768
 epoch: 92, train_loss: 0.3069, test_loss: 1.0854, test_f1: 0.6828
 epoch: 93, train_loss: 0.3047, test_loss: 1.0282, test_f1: 0.6659
 epoch: 94, train_loss: 0.3294, test_loss: 1.1001, test_f1: 0.6764
 epoch: 95, train_loss: 0.3125, test_loss: 1.0569, test_f1: 0.6745
 epoch: 96, train_loss: 0.3133, test_loss: 1.0548, test_f1: 0.6710
 epoch: 97, train_loss: 0.3023, test_loss: 1.1486, test_f1: 0.6666
 epoch: 98, train_loss: 0.2864, test_loss: 1.0515, test_f1: 0.7102
 epoch: 99, train_loss: 0.2779, test_loss: 1.2467, test_f1: 0.6355
##################ITERATION #1 ****************************************
 epoch: 0, train_loss: 1.2056, test_loss: 1.2704, test_f1: 0.3045
 epoch: 1, train_loss: 1.0231, test_loss: 1.0397, test_f1: 0.4761
 epoch: 2, train_loss: 0.9978, test_loss: 0.9944, test_f1: 0.4661
 epoch: 3, train_loss: 0.9681, test_loss: 1.0730, test_f1: 0.4568
 epoch: 4, train_loss: 0.9682, test_loss: 0.9526, test_f1: 0.4994
 epoch: 5, train_loss: 0.9393, test_loss: 0.9373, test_f1: 0.5048
 epoch: 6, train_loss: 0.9263, test_loss: 1.0969, test_f1: 0.5433
 epoch: 7, train_loss: 0.9045, test_loss: 1.1276, test_f1: 0.4791
 epoch: 8, train_loss: 0.9013, test_loss: 0.9842, test_f1: 0.5369
 epoch: 9, train_loss: 0.8855, test_loss: 1.0512, test_f1: 0.5031
 epoch: 10, train_loss: 0.8678, test_loss: 0.9274, test_f1: 0.5083
 epoch: 11, train_loss: 0.8717, test_loss: 1.3501, test_f1: 0.4460
 epoch: 12, train_loss: 0.8595, test_loss: 1.1483, test_f1: 0.4772
 epoch: 13, train_loss: 0.8112, test_loss: 0.9978, test_f1: 0.4803
 epoch: 14, train_loss: 0.8234, test_loss: 0.9216, test_f1: 0.5744
 epoch: 15, train_loss: 0.7992, test_loss: 0.8859, test_f1: 0.5549
 epoch: 16, train_loss: 0.7992, test_loss: 1.0345, test_f1: 0.5117
 epoch: 17, train_loss: 0.8044, test_loss: 1.3716, test_f1: 0.4574
 epoch: 18, train_loss: 0.7821, test_loss: 0.8954, test_f1: 0.5689
 epoch: 19, train_loss: 0.7604, test_loss: 0.8109, test_f1: 0.6088
 epoch: 20, train_loss: 0.7668, test_loss: 0.7847, test_f1: 0.5707
 epoch: 21, train_loss: 0.7378, test_loss: 1.0040, test_f1: 0.5853
 epoch: 22, train_loss: 0.7565, test_loss: 0.9442, test_f1: 0.6248
 epoch: 23, train_loss: 0.7408, test_loss: 0.8796, test_f1: 0.6044
 epoch: 24, train_loss: 0.7453, test_loss: 0.9376, test_f1: 0.6158
 epoch: 25, train_loss: 0.7179, test_loss: 1.0454, test_f1: 0.5844
 epoch: 26, train_loss: 0.7274, test_loss: 1.0236, test_f1: 0.6258
 epoch: 27, train_loss: 0.6943, test_loss: 0.8725, test_f1: 0.5872
 epoch: 28, train_loss: 0.7011, test_loss: 0.9253, test_f1: 0.5735
 epoch: 29, train_loss: 0.6972, test_loss: 0.8195, test_f1: 0.6086
 epoch: 30, train_loss: 0.6848, test_loss: 0.7973, test_f1: 0.6144
 epoch: 31, train_loss: 0.6567, test_loss: 0.8768, test_f1: 0.6181
 epoch: 32, train_loss: 0.6641, test_loss: 2.0243, test_f1: 0.2505
 epoch: 33, train_loss: 0.6504, test_loss: 1.0372, test_f1: 0.5184
 epoch: 34, train_loss: 0.6478, test_loss: 1.0086, test_f1: 0.5484
 epoch: 35, train_loss: 0.6566, test_loss: 0.9136, test_f1: 0.6049
 epoch: 36, train_loss: 0.6454, test_loss: 0.9321, test_f1: 0.5604
 epoch: 37, train_loss: 0.6616, test_loss: 0.9631, test_f1: 0.6106
 epoch: 38, train_loss: 0.6567, test_loss: 0.8907, test_f1: 0.6246
 epoch: 39, train_loss: 0.6348, test_loss: 0.9105, test_f1: 0.5934
 epoch: 40, train_loss: 0.6375, test_loss: 0.9524, test_f1: 0.5847
 epoch: 41, train_loss: 0.6134, test_loss: 1.0100, test_f1: 0.6218
 epoch: 42, train_loss: 0.6167, test_loss: 1.0483, test_f1: 0.5836
 epoch: 43, train_loss: 0.5906, test_loss: 1.0113, test_f1: 0.6482
 epoch: 44, train_loss: 0.6245, test_loss: 0.9089, test_f1: 0.6465
 epoch: 45, train_loss: 0.6208, test_loss: 0.9034, test_f1: 0.6103
 epoch: 46, train_loss: 0.5902, test_loss: 0.8814, test_f1: 0.6190
 epoch: 47, train_loss: 0.5828, test_loss: 0.8493, test_f1: 0.6529
 epoch: 48, train_loss: 0.5950, test_loss: 1.0716, test_f1: 0.5713
 epoch: 49, train_loss: 0.5697, test_loss: 0.8637, test_f1: 0.6437
 epoch: 50, train_loss: 0.5565, test_loss: 0.8666, test_f1: 0.6212
 epoch: 51, train_loss: 0.5436, test_loss: 0.9035, test_f1: 0.6741
 epoch: 52, train_loss: 0.5006, test_loss: 0.8939, test_f1: 0.6409
 epoch: 53, train_loss: 0.5024, test_loss: 0.9860, test_f1: 0.6185
 epoch: 54, train_loss: 0.4924, test_loss: 0.9385, test_f1: 0.6649
 epoch: 55, train_loss: 0.4679, test_loss: 0.9905, test_f1: 0.6517
 epoch: 56, train_loss: 0.4626, test_loss: 0.9429, test_f1: 0.6603
 epoch: 57, train_loss: 0.4748, test_loss: 0.9783, test_f1: 0.6729
 epoch: 58, train_loss: 0.4669, test_loss: 0.8583, test_f1: 0.6565
 epoch: 59, train_loss: 0.4491, test_loss: 0.8517, test_f1: 0.6779
 epoch: 60, train_loss: 0.4358, test_loss: 1.0384, test_f1: 0.6777
 epoch: 61, train_loss: 0.4331, test_loss: 1.0032, test_f1: 0.6356
 epoch: 62, train_loss: 0.4506, test_loss: 0.9825, test_f1: 0.6624
 epoch: 63, train_loss: 0.4605, test_loss: 0.9247, test_f1: 0.6274
 epoch: 64, train_loss: 0.4339, test_loss: 1.0021, test_f1: 0.6439
 epoch: 65, train_loss: 0.4072, test_loss: 0.9764, test_f1: 0.6704
 epoch: 66, train_loss: 0.4169, test_loss: 1.0499, test_f1: 0.6881
 epoch: 67, train_loss: 0.4440, test_loss: 0.9905, test_f1: 0.6487
 epoch: 68, train_loss: 0.3999, test_loss: 1.1352, test_f1: 0.6849
 epoch: 69, train_loss: 0.3876, test_loss: 1.1454, test_f1: 0.6411
 epoch: 70, train_loss: 0.3930, test_loss: 1.2735, test_f1: 0.6087
 epoch: 71, train_loss: 0.3964, test_loss: 1.1146, test_f1: 0.6651
 epoch: 72, train_loss: 0.3751, test_loss: 1.0559, test_f1: 0.6571
 epoch: 73, train_loss: 0.3955, test_loss: 1.2234, test_f1: 0.6035
 epoch: 74, train_loss: 0.3966, test_loss: 1.0641, test_f1: 0.6574
 epoch: 75, train_loss: 0.3706, test_loss: 1.0499, test_f1: 0.6382
 epoch: 76, train_loss: 0.3647, test_loss: 1.0582, test_f1: 0.6656
 epoch: 77, train_loss: 0.3782, test_loss: 1.0199, test_f1: 0.6676
 epoch: 78, train_loss: 0.3768, test_loss: 1.0761, test_f1: 0.6305
 epoch: 79, train_loss: 0.3616, test_loss: 1.1041, test_f1: 0.6644
 epoch: 80, train_loss: 0.3775, test_loss: 1.0948, test_f1: 0.5968
 epoch: 81, train_loss: 0.3934, test_loss: 1.1956, test_f1: 0.6161
 epoch: 82, train_loss: 0.3537, test_loss: 1.1337, test_f1: 0.6359
 epoch: 83, train_loss: 0.3618, test_loss: 1.0879, test_f1: 0.6656
 epoch: 84, train_loss: 0.3516, test_loss: 1.2808, test_f1: 0.6416
 epoch: 85, train_loss: 0.3449, test_loss: 1.2162, test_f1: 0.6810
 epoch: 86, train_loss: 0.3454, test_loss: 1.1079, test_f1: 0.6651
 epoch: 87, train_loss: 0.3328, test_loss: 1.0807, test_f1: 0.6745
 epoch: 88, train_loss: 0.3648, test_loss: 1.4598, test_f1: 0.6567
 epoch: 89, train_loss: 0.3431, test_loss: 1.2472, test_f1: 0.6558
 epoch: 90, train_loss: 0.3255, test_loss: 1.1846, test_f1: 0.6310
 epoch: 91, train_loss: 0.3984, test_loss: 1.0786, test_f1: 0.6537
 epoch: 92, train_loss: 0.3736, test_loss: 1.3472, test_f1: 0.6554
 epoch: 93, train_loss: 0.3378, test_loss: 1.3743, test_f1: 0.6216
 epoch: 94, train_loss: 0.3209, test_loss: 1.2464, test_f1: 0.6601
 epoch: 95, train_loss: 0.2997, test_loss: 1.5280, test_f1: 0.6680
 epoch: 96, train_loss: 0.3068, test_loss: 1.3162, test_f1: 0.6663
 epoch: 97, train_loss: 0.3068, test_loss: 1.2739, test_f1: 0.6895
 epoch: 98, train_loss: 0.3050, test_loss: 1.4753, test_f1: 0.6397
 epoch: 99, train_loss: 0.3144, test_loss: 1.4286, test_f1: 0.6326
##################ITERATION #2 ****************************************
 epoch: 0, train_loss: 1.2032, test_loss: 1.1193, test_f1: 0.4505
 epoch: 1, train_loss: 0.9880, test_loss: 1.0582, test_f1: 0.3884
 epoch: 2, train_loss: 0.9645, test_loss: 1.0003, test_f1: 0.4759
 epoch: 3, train_loss: 0.9389, test_loss: 1.0566, test_f1: 0.4586
 epoch: 4, train_loss: 0.9178, test_loss: 1.0073, test_f1: 0.4941
 epoch: 5, train_loss: 0.8961, test_loss: 0.9890, test_f1: 0.4877
 epoch: 6, train_loss: 0.8780, test_loss: 0.9381, test_f1: 0.5401
 epoch: 7, train_loss: 0.8687, test_loss: 0.9470, test_f1: 0.5078
 epoch: 8, train_loss: 0.8620, test_loss: 1.0457, test_f1: 0.5348
 epoch: 9, train_loss: 0.8422, test_loss: 1.0262, test_f1: 0.5006
 epoch: 10, train_loss: 0.8268, test_loss: 0.9974, test_f1: 0.5227
 epoch: 11, train_loss: 0.8275, test_loss: 0.9469, test_f1: 0.5665
 epoch: 12, train_loss: 0.8168, test_loss: 0.9136, test_f1: 0.5667
 epoch: 13, train_loss: 0.7885, test_loss: 0.8541, test_f1: 0.6058
 epoch: 14, train_loss: 0.7881, test_loss: 1.0913, test_f1: 0.4905
 epoch: 15, train_loss: 0.7745, test_loss: 0.8378, test_f1: 0.5983
 epoch: 16, train_loss: 0.7552, test_loss: 0.9588, test_f1: 0.5580
 epoch: 17, train_loss: 0.7575, test_loss: 0.9401, test_f1: 0.6057
 epoch: 18, train_loss: 0.7492, test_loss: 0.7956, test_f1: 0.6025
 epoch: 19, train_loss: 0.7289, test_loss: 0.8674, test_f1: 0.6289
 epoch: 20, train_loss: 0.7319, test_loss: 0.8169, test_f1: 0.5763
 epoch: 21, train_loss: 0.7194, test_loss: 0.8144, test_f1: 0.5713
 epoch: 22, train_loss: 0.7559, test_loss: 1.2434, test_f1: 0.4219
 epoch: 23, train_loss: 0.7225, test_loss: 0.9095, test_f1: 0.5835
 epoch: 24, train_loss: 0.7168, test_loss: 0.9778, test_f1: 0.5859
 epoch: 25, train_loss: 0.6938, test_loss: 1.0093, test_f1: 0.6243
 epoch: 26, train_loss: 0.6818, test_loss: 0.9954, test_f1: 0.6078
 epoch: 27, train_loss: 0.6606, test_loss: 0.8968, test_f1: 0.6163
 epoch: 28, train_loss: 0.6729, test_loss: 0.9361, test_f1: 0.6267
 epoch: 29, train_loss: 0.6695, test_loss: 0.9376, test_f1: 0.5506
 epoch: 30, train_loss: 0.6745, test_loss: 0.8887, test_f1: 0.6061
 epoch: 31, train_loss: 0.6686, test_loss: 1.1446, test_f1: 0.5176
 epoch: 32, train_loss: 0.6395, test_loss: 1.0147, test_f1: 0.6240
 epoch: 33, train_loss: 0.6337, test_loss: 1.1210, test_f1: 0.5989
 epoch: 34, train_loss: 0.6448, test_loss: 0.7338, test_f1: 0.6209
 epoch: 35, train_loss: 0.6199, test_loss: 0.8658, test_f1: 0.6279
 epoch: 36, train_loss: 0.6380, test_loss: 0.8809, test_f1: 0.6597
 epoch: 37, train_loss: 0.6138, test_loss: 0.7932, test_f1: 0.6255
 epoch: 38, train_loss: 0.5947, test_loss: 0.8651, test_f1: 0.6391
 epoch: 39, train_loss: 0.6010, test_loss: 0.8793, test_f1: 0.6452
 epoch: 40, train_loss: 0.6033, test_loss: 0.9314, test_f1: 0.6415
 epoch: 41, train_loss: 0.5918, test_loss: 0.9070, test_f1: 0.6335
 epoch: 42, train_loss: 0.5922, test_loss: 0.8968, test_f1: 0.6112
 epoch: 43, train_loss: 0.5772, test_loss: 0.7821, test_f1: 0.6767
 epoch: 44, train_loss: 0.6154, test_loss: 0.9648, test_f1: 0.6158
 epoch: 45, train_loss: 0.5938, test_loss: 1.1955, test_f1: 0.5476
 epoch: 46, train_loss: 0.5603, test_loss: 0.8491, test_f1: 0.6672
 epoch: 47, train_loss: 0.5638, test_loss: 0.9243, test_f1: 0.6557
 epoch: 48, train_loss: 0.5461, test_loss: 0.8138, test_f1: 0.6337
 epoch: 49, train_loss: 0.5393, test_loss: 0.9681, test_f1: 0.6544
 epoch: 50, train_loss: 0.5544, test_loss: 0.9121, test_f1: 0.6386
 epoch: 51, train_loss: 0.5140, test_loss: 0.9865, test_f1: 0.6412
 epoch: 52, train_loss: 0.4701, test_loss: 0.8843, test_f1: 0.6698
 epoch: 53, train_loss: 0.4541, test_loss: 0.9270, test_f1: 0.6744
 epoch: 54, train_loss: 0.4426, test_loss: 0.9837, test_f1: 0.6423
 epoch: 55, train_loss: 0.4410, test_loss: 0.9009, test_f1: 0.6944
 epoch: 56, train_loss: 0.4416, test_loss: 0.8722, test_f1: 0.6777
 epoch: 57, train_loss: 0.4306, test_loss: 1.1970, test_f1: 0.5971
 epoch: 58, train_loss: 0.4431, test_loss: 0.9613, test_f1: 0.6812
 epoch: 59, train_loss: 0.4215, test_loss: 1.0819, test_f1: 0.6400
 epoch: 60, train_loss: 0.4114, test_loss: 1.0235, test_f1: 0.6710
 epoch: 61, train_loss: 0.4188, test_loss: 0.9935, test_f1: 0.6989
 epoch: 62, train_loss: 0.3896, test_loss: 1.1406, test_f1: 0.6449
 epoch: 63, train_loss: 0.3964, test_loss: 0.9712, test_f1: 0.6843
 epoch: 64, train_loss: 0.4084, test_loss: 1.1284, test_f1: 0.6353
 epoch: 65, train_loss: 0.3963, test_loss: 1.0391, test_f1: 0.6422
 epoch: 66, train_loss: 0.3807, test_loss: 1.0075, test_f1: 0.6710
 epoch: 67, train_loss: 0.3781, test_loss: 1.0617, test_f1: 0.6649
 epoch: 68, train_loss: 0.3903, test_loss: 1.0666, test_f1: 0.6774
 epoch: 69, train_loss: 0.3943, test_loss: 1.0612, test_f1: 0.6722
 epoch: 70, train_loss: 0.3988, test_loss: 1.1146, test_f1: 0.6432
 epoch: 71, train_loss: 0.3990, test_loss: 1.0441, test_f1: 0.6542
 epoch: 72, train_loss: 0.3610, test_loss: 1.0339, test_f1: 0.6705
 epoch: 73, train_loss: 0.3921, test_loss: 1.0068, test_f1: 0.6915
 epoch: 74, train_loss: 0.3560, test_loss: 1.0448, test_f1: 0.6662
 epoch: 75, train_loss: 0.3558, test_loss: 1.0700, test_f1: 0.6945
 epoch: 76, train_loss: 0.3528, test_loss: 1.2789, test_f1: 0.6687
 epoch: 77, train_loss: 0.3468, test_loss: 1.0020, test_f1: 0.6814
 epoch: 78, train_loss: 0.3487, test_loss: 1.0515, test_f1: 0.6647
 epoch: 79, train_loss: 0.3528, test_loss: 1.2921, test_f1: 0.6486
 epoch: 80, train_loss: 0.3374, test_loss: 1.1368, test_f1: 0.6624
 epoch: 81, train_loss: 0.3296, test_loss: 1.0127, test_f1: 0.6713
 epoch: 82, train_loss: 0.3598, test_loss: 1.1595, test_f1: 0.6639
 epoch: 83, train_loss: 0.3608, test_loss: 1.1359, test_f1: 0.6539
 epoch: 84, train_loss: 0.3355, test_loss: 1.1157, test_f1: 0.6681
 epoch: 85, train_loss: 0.3109, test_loss: 1.2660, test_f1: 0.6635
 epoch: 86, train_loss: 0.3288, test_loss: 1.2891, test_f1: 0.6531
 epoch: 87, train_loss: 0.3286, test_loss: 1.2046, test_f1: 0.6566
 epoch: 88, train_loss: 0.3203, test_loss: 1.1573, test_f1: 0.6744
 epoch: 89, train_loss: 0.2981, test_loss: 1.2625, test_f1: 0.6730
 epoch: 90, train_loss: 0.3156, test_loss: 1.2752, test_f1: 0.6543
 epoch: 91, train_loss: 0.3333, test_loss: 1.3270, test_f1: 0.6660
 epoch: 92, train_loss: 0.3286, test_loss: 1.2614, test_f1: 0.6341
 epoch: 93, train_loss: 0.3091, test_loss: 1.1602, test_f1: 0.6720
 epoch: 94, train_loss: 0.2828, test_loss: 1.2695, test_f1: 0.6802
 epoch: 95, train_loss: 0.2944, test_loss: 1.1509, test_f1: 0.6819
 epoch: 96, train_loss: 0.3117, test_loss: 1.1216, test_f1: 0.6551
 epoch: 97, train_loss: 0.2692, test_loss: 1.2223, test_f1: 0.6377
 epoch: 98, train_loss: 0.2796, test_loss: 1.5851, test_f1: 0.6400
 epoch: 99, train_loss: 0.3067, test_loss: 1.1691, test_f1: 0.6739
##################ITERATION #3 ****************************************
 epoch: 0, train_loss: 1.2129, test_loss: 1.4393, test_f1: 0.2635
 epoch: 1, train_loss: 0.9903, test_loss: 0.9743, test_f1: 0.5055
 epoch: 2, train_loss: 0.9598, test_loss: 0.9831, test_f1: 0.4974
 epoch: 3, train_loss: 0.9217, test_loss: 0.9189, test_f1: 0.4979
 epoch: 4, train_loss: 0.9185, test_loss: 0.8861, test_f1: 0.5587
 epoch: 5, train_loss: 0.9042, test_loss: 0.8804, test_f1: 0.4772
 epoch: 6, train_loss: 0.8831, test_loss: 0.9970, test_f1: 0.4534
 epoch: 7, train_loss: 0.8706, test_loss: 0.8953, test_f1: 0.5568
 epoch: 8, train_loss: 0.8804, test_loss: 0.8610, test_f1: 0.5534
 epoch: 9, train_loss: 0.8438, test_loss: 0.8739, test_f1: 0.5044
 epoch: 10, train_loss: 0.8212, test_loss: 0.8570, test_f1: 0.5571
 epoch: 11, train_loss: 0.8216, test_loss: 0.8815, test_f1: 0.5251
 epoch: 12, train_loss: 0.8078, test_loss: 0.8580, test_f1: 0.5578
 epoch: 13, train_loss: 0.7950, test_loss: 0.9873, test_f1: 0.5023
 epoch: 14, train_loss: 0.7945, test_loss: 0.8071, test_f1: 0.5950
 epoch: 15, train_loss: 0.7759, test_loss: 0.8324, test_f1: 0.5214
 epoch: 16, train_loss: 0.7652, test_loss: 1.0615, test_f1: 0.5374
 epoch: 17, train_loss: 0.7668, test_loss: 0.7948, test_f1: 0.5874
 epoch: 18, train_loss: 0.7508, test_loss: 0.8264, test_f1: 0.5899
 epoch: 19, train_loss: 0.7385, test_loss: 0.8530, test_f1: 0.6013
 epoch: 20, train_loss: 0.7664, test_loss: 1.0060, test_f1: 0.5540
 epoch: 21, train_loss: 0.7368, test_loss: 0.9598, test_f1: 0.5837
 epoch: 22, train_loss: 0.7375, test_loss: 0.9224, test_f1: 0.5654
 epoch: 23, train_loss: 0.7099, test_loss: 0.8201, test_f1: 0.6083
 epoch: 24, train_loss: 0.7077, test_loss: 0.8541, test_f1: 0.6375
 epoch: 25, train_loss: 0.7012, test_loss: 0.9750, test_f1: 0.5791
 epoch: 26, train_loss: 0.6836, test_loss: 0.8154, test_f1: 0.6266
 epoch: 27, train_loss: 0.6851, test_loss: 0.9724, test_f1: 0.5903
 epoch: 28, train_loss: 0.6748, test_loss: 0.9922, test_f1: 0.5878
 epoch: 29, train_loss: 0.6531, test_loss: 0.9705, test_f1: 0.6016
 epoch: 30, train_loss: 0.6829, test_loss: 0.8956, test_f1: 0.5844
 epoch: 31, train_loss: 0.6648, test_loss: 0.9437, test_f1: 0.5457
 epoch: 32, train_loss: 0.6675, test_loss: 0.8619, test_f1: 0.5947
 epoch: 33, train_loss: 0.6438, test_loss: 1.0294, test_f1: 0.5904
 epoch: 34, train_loss: 0.6822, test_loss: 0.8340, test_f1: 0.6355
 epoch: 35, train_loss: 0.6324, test_loss: 0.8447, test_f1: 0.6262
 epoch: 36, train_loss: 0.6140, test_loss: 0.8240, test_f1: 0.6697
 epoch: 37, train_loss: 0.5945, test_loss: 0.8877, test_f1: 0.6400
 epoch: 38, train_loss: 0.6135, test_loss: 0.8583, test_f1: 0.6473
 epoch: 39, train_loss: 0.5795, test_loss: 0.9469, test_f1: 0.6304
 epoch: 40, train_loss: 0.5963, test_loss: 0.7208, test_f1: 0.6773
 epoch: 41, train_loss: 0.6161, test_loss: 0.8606, test_f1: 0.6094
 epoch: 42, train_loss: 0.5769, test_loss: 0.8935, test_f1: 0.6740
 epoch: 43, train_loss: 0.5764, test_loss: 0.9589, test_f1: 0.6330
 epoch: 44, train_loss: 0.5396, test_loss: 0.8645, test_f1: 0.6371
 epoch: 45, train_loss: 0.5535, test_loss: 1.0452, test_f1: 0.6183
 epoch: 46, train_loss: 0.5333, test_loss: 0.8828, test_f1: 0.6391
 epoch: 47, train_loss: 0.5436, test_loss: 0.8904, test_f1: 0.6384
 epoch: 48, train_loss: 0.5477, test_loss: 0.9407, test_f1: 0.6449
 epoch: 49, train_loss: 0.5430, test_loss: 0.8867, test_f1: 0.6362
 epoch: 50, train_loss: 0.5465, test_loss: 0.8778, test_f1: 0.6002
 epoch: 51, train_loss: 0.5090, test_loss: 0.8788, test_f1: 0.6577
 epoch: 52, train_loss: 0.4375, test_loss: 0.8294, test_f1: 0.6775
 epoch: 53, train_loss: 0.4227, test_loss: 0.8210, test_f1: 0.6900
 epoch: 54, train_loss: 0.4453, test_loss: 0.9242, test_f1: 0.6432
 epoch: 55, train_loss: 0.4177, test_loss: 0.8489, test_f1: 0.6782
 epoch: 56, train_loss: 0.3955, test_loss: 0.9836, test_f1: 0.6777
 epoch: 57, train_loss: 0.4054, test_loss: 1.0701, test_f1: 0.6432
 epoch: 58, train_loss: 0.4069, test_loss: 0.8668, test_f1: 0.6899
 epoch: 59, train_loss: 0.4148, test_loss: 0.9080, test_f1: 0.6756
 epoch: 60, train_loss: 0.3901, test_loss: 0.9348, test_f1: 0.6459
 epoch: 61, train_loss: 0.3723, test_loss: 1.0604, test_f1: 0.6624
 epoch: 62, train_loss: 0.3804, test_loss: 0.9793, test_f1: 0.6530
 epoch: 63, train_loss: 0.3822, test_loss: 0.8809, test_f1: 0.6789
 epoch: 64, train_loss: 0.3892, test_loss: 0.9485, test_f1: 0.6823
 epoch: 65, train_loss: 0.3652, test_loss: 1.0608, test_f1: 0.6733
 epoch: 66, train_loss: 0.3596, test_loss: 1.0927, test_f1: 0.6657
 epoch: 67, train_loss: 0.3752, test_loss: 1.0131, test_f1: 0.6758
 epoch: 68, train_loss: 0.3451, test_loss: 1.1611, test_f1: 0.6610
 epoch: 69, train_loss: 0.3502, test_loss: 1.0236, test_f1: 0.6637
 epoch: 70, train_loss: 0.3519, test_loss: 1.1211, test_f1: 0.6574
 epoch: 71, train_loss: 0.3673, test_loss: 1.0532, test_f1: 0.6533
 epoch: 72, train_loss: 0.3419, test_loss: 1.1496, test_f1: 0.6791
 epoch: 73, train_loss: 0.3364, test_loss: 1.0415, test_f1: 0.6630
 epoch: 74, train_loss: 0.3317, test_loss: 0.9449, test_f1: 0.6986
 epoch: 75, train_loss: 0.3531, test_loss: 1.0815, test_f1: 0.6662
 epoch: 76, train_loss: 0.3315, test_loss: 1.0023, test_f1: 0.6796
 epoch: 77, train_loss: 0.3561, test_loss: 1.1009, test_f1: 0.6612
 epoch: 78, train_loss: 0.3262, test_loss: 0.9429, test_f1: 0.6760
 epoch: 79, train_loss: 0.3212, test_loss: 1.1679, test_f1: 0.6566
 epoch: 80, train_loss: 0.3013, test_loss: 1.0893, test_f1: 0.6607
 epoch: 81, train_loss: 0.3050, test_loss: 1.1783, test_f1: 0.6583
 epoch: 82, train_loss: 0.3278, test_loss: 1.5222, test_f1: 0.6126
 epoch: 83, train_loss: 0.3237, test_loss: 1.2211, test_f1: 0.6592
 epoch: 84, train_loss: 0.3335, test_loss: 1.0467, test_f1: 0.6859
 epoch: 85, train_loss: 0.3382, test_loss: 1.2236, test_f1: 0.6588
 epoch: 86, train_loss: 0.3016, test_loss: 0.9954, test_f1: 0.6659
 epoch: 87, train_loss: 0.3004, test_loss: 1.1397, test_f1: 0.6563
 epoch: 88, train_loss: 0.2931, test_loss: 1.1189, test_f1: 0.6836
 epoch: 89, train_loss: 0.3077, test_loss: 1.0542, test_f1: 0.6818
 epoch: 90, train_loss: 0.2746, test_loss: 1.2185, test_f1: 0.6588
 epoch: 91, train_loss: 0.2739, test_loss: 1.3078, test_f1: 0.6162
 epoch: 92, train_loss: 0.2666, test_loss: 1.2485, test_f1: 0.6392
 epoch: 93, train_loss: 0.2905, test_loss: 1.1798, test_f1: 0.6567
 epoch: 94, train_loss: 0.2916, test_loss: 1.3368, test_f1: 0.6699
 epoch: 95, train_loss: 0.2838, test_loss: 1.2189, test_f1: 0.6534
 epoch: 96, train_loss: 0.2760, test_loss: 1.2862, test_f1: 0.6860
 epoch: 97, train_loss: 0.2786, test_loss: 1.2498, test_f1: 0.6648
 epoch: 98, train_loss: 0.2822, test_loss: 1.3517, test_f1: 0.6373
 epoch: 99, train_loss: 0.2640, test_loss: 1.2472, test_f1: 0.6553
##################ITERATION #4 ****************************************
 epoch: 0, train_loss: 1.3315, test_loss: 1.3019, test_f1: 0.3311
 epoch: 1, train_loss: 1.0027, test_loss: 0.9744, test_f1: 0.4869
 epoch: 2, train_loss: 0.9515, test_loss: 0.9841, test_f1: 0.4772
 epoch: 3, train_loss: 0.9305, test_loss: 1.0511, test_f1: 0.4436
 epoch: 4, train_loss: 0.9046, test_loss: 0.9285, test_f1: 0.4917
 epoch: 5, train_loss: 0.9013, test_loss: 1.0010, test_f1: 0.4896
 epoch: 6, train_loss: 0.8840, test_loss: 0.9908, test_f1: 0.5120
 epoch: 7, train_loss: 0.8809, test_loss: 0.9550, test_f1: 0.4798
 epoch: 8, train_loss: 0.8469, test_loss: 0.8553, test_f1: 0.5297
 epoch: 9, train_loss: 0.8272, test_loss: 0.8784, test_f1: 0.5486
 epoch: 10, train_loss: 0.8218, test_loss: 0.9087, test_f1: 0.4887
 epoch: 11, train_loss: 0.7945, test_loss: 0.8618, test_f1: 0.5639
 epoch: 12, train_loss: 0.7875, test_loss: 0.9498, test_f1: 0.5069
 epoch: 13, train_loss: 0.7868, test_loss: 0.8547, test_f1: 0.5107
 epoch: 14, train_loss: 0.7848, test_loss: 0.7940, test_f1: 0.5834
 epoch: 15, train_loss: 0.7704, test_loss: 0.8165, test_f1: 0.5616
 epoch: 16, train_loss: 0.7633, test_loss: 0.9564, test_f1: 0.5127
 epoch: 17, train_loss: 0.7506, test_loss: 0.9732, test_f1: 0.5605
 epoch: 18, train_loss: 0.7332, test_loss: 0.8186, test_f1: 0.5835
 epoch: 19, train_loss: 0.7252, test_loss: 0.8216, test_f1: 0.5983
 epoch: 20, train_loss: 0.7195, test_loss: 0.9269, test_f1: 0.5864
 epoch: 21, train_loss: 0.7317, test_loss: 0.7512, test_f1: 0.6362
 epoch: 22, train_loss: 0.7301, test_loss: 0.9667, test_f1: 0.5661
 epoch: 23, train_loss: 0.6994, test_loss: 0.8074, test_f1: 0.6181
 epoch: 24, train_loss: 0.7019, test_loss: 0.7961, test_f1: 0.6036
 epoch: 25, train_loss: 0.6858, test_loss: 0.8664, test_f1: 0.6100
 epoch: 26, train_loss: 0.7155, test_loss: 1.0238, test_f1: 0.5846
 epoch: 27, train_loss: 0.6795, test_loss: 0.7669, test_f1: 0.6011
 epoch: 28, train_loss: 0.6556, test_loss: 0.7986, test_f1: 0.6200
 epoch: 29, train_loss: 0.6604, test_loss: 0.8763, test_f1: 0.5697
 epoch: 30, train_loss: 0.6537, test_loss: 1.2371, test_f1: 0.5758
 epoch: 31, train_loss: 0.6564, test_loss: 1.0081, test_f1: 0.5975
 epoch: 32, train_loss: 0.6427, test_loss: 0.8775, test_f1: 0.6153
 epoch: 33, train_loss: 0.6437, test_loss: 0.9860, test_f1: 0.6188
 epoch: 34, train_loss: 0.6203, test_loss: 0.8311, test_f1: 0.6570
 epoch: 35, train_loss: 0.6316, test_loss: 1.0082, test_f1: 0.5617
 epoch: 36, train_loss: 0.6463, test_loss: 1.0148, test_f1: 0.5982
 epoch: 37, train_loss: 0.6135, test_loss: 0.8237, test_f1: 0.6467
 epoch: 38, train_loss: 0.6053, test_loss: 0.8993, test_f1: 0.6143
 epoch: 39, train_loss: 0.6031, test_loss: 0.9076, test_f1: 0.6359
 epoch: 40, train_loss: 0.6076, test_loss: 0.7914, test_f1: 0.6884
 epoch: 41, train_loss: 0.5800, test_loss: 1.0094, test_f1: 0.6115
 epoch: 42, train_loss: 0.5971, test_loss: 0.9256, test_f1: 0.6278
 epoch: 43, train_loss: 0.6053, test_loss: 0.9998, test_f1: 0.6632
 epoch: 44, train_loss: 0.5723, test_loss: 0.9817, test_f1: 0.6523
 epoch: 45, train_loss: 0.5751, test_loss: 1.0196, test_f1: 0.5853
 epoch: 46, train_loss: 0.5797, test_loss: 0.9685, test_f1: 0.5824
 epoch: 47, train_loss: 0.5663, test_loss: 0.9334, test_f1: 0.6647
 epoch: 48, train_loss: 0.5675, test_loss: 0.9029, test_f1: 0.6680
 epoch: 49, train_loss: 0.5853, test_loss: 0.9972, test_f1: 0.6139
 epoch: 50, train_loss: 0.5563, test_loss: 0.8712, test_f1: 0.6363
 epoch: 51, train_loss: 0.5166, test_loss: 0.8994, test_f1: 0.6471
 epoch: 52, train_loss: 0.4952, test_loss: 0.9774, test_f1: 0.6428
 epoch: 53, train_loss: 0.4754, test_loss: 0.9527, test_f1: 0.6723
 epoch: 54, train_loss: 0.4706, test_loss: 0.9623, test_f1: 0.6744
 epoch: 55, train_loss: 0.4590, test_loss: 1.0043, test_f1: 0.6525
 epoch: 56, train_loss: 0.4332, test_loss: 1.0493, test_f1: 0.6547
 epoch: 57, train_loss: 0.4388, test_loss: 1.0730, test_f1: 0.6917
 epoch: 58, train_loss: 0.4351, test_loss: 1.1026, test_f1: 0.6478
 epoch: 59, train_loss: 0.4341, test_loss: 1.0492, test_f1: 0.6723
 epoch: 60, train_loss: 0.4271, test_loss: 1.0921, test_f1: 0.6721
 epoch: 61, train_loss: 0.4283, test_loss: 1.0632, test_f1: 0.6607
 epoch: 62, train_loss: 0.4290, test_loss: 1.0141, test_f1: 0.6920
 epoch: 63, train_loss: 0.4019, test_loss: 1.1684, test_f1: 0.6504
 epoch: 64, train_loss: 0.4316, test_loss: 1.0818, test_f1: 0.6506
 epoch: 65, train_loss: 0.4021, test_loss: 1.0588, test_f1: 0.6871
 epoch: 66, train_loss: 0.4042, test_loss: 1.1766, test_f1: 0.6709
 epoch: 67, train_loss: 0.3994, test_loss: 1.1204, test_f1: 0.6551
 epoch: 68, train_loss: 0.4206, test_loss: 1.0646, test_f1: 0.6955
 epoch: 69, train_loss: 0.4002, test_loss: 1.2722, test_f1: 0.6606
 epoch: 70, train_loss: 0.3991, test_loss: 1.2664, test_f1: 0.6511
 epoch: 71, train_loss: 0.3912, test_loss: 1.1862, test_f1: 0.6607
 epoch: 72, train_loss: 0.3643, test_loss: 1.0829, test_f1: 0.6776
 epoch: 73, train_loss: 0.4126, test_loss: 1.0922, test_f1: 0.6817
 epoch: 74, train_loss: 0.4039, test_loss: 1.0925, test_f1: 0.7046
 epoch: 75, train_loss: 0.3704, test_loss: 1.2126, test_f1: 0.6779
 epoch: 76, train_loss: 0.3693, test_loss: 1.2046, test_f1: 0.6714
 epoch: 77, train_loss: 0.3635, test_loss: 1.1988, test_f1: 0.6766
 epoch: 78, train_loss: 0.3687, test_loss: 1.3901, test_f1: 0.6520
 epoch: 79, train_loss: 0.3620, test_loss: 1.2365, test_f1: 0.6454
 epoch: 80, train_loss: 0.4323, test_loss: 1.4543, test_f1: 0.5842
 epoch: 81, train_loss: 0.4379, test_loss: 1.0570, test_f1: 0.6776
 epoch: 82, train_loss: 0.4057, test_loss: 1.1640, test_f1: 0.6758
 epoch: 83, train_loss: 0.3951, test_loss: 1.1208, test_f1: 0.6904
 epoch: 84, train_loss: 0.3624, test_loss: 1.2168, test_f1: 0.6741
 epoch: 85, train_loss: 0.3729, test_loss: 1.3240, test_f1: 0.6396
 epoch: 86, train_loss: 0.3449, test_loss: 1.2555, test_f1: 0.6877
 epoch: 87, train_loss: 0.3362, test_loss: 1.2503, test_f1: 0.6817
 epoch: 88, train_loss: 0.3523, test_loss: 1.3204, test_f1: 0.6522
 epoch: 89, train_loss: 0.3275, test_loss: 1.3851, test_f1: 0.6810
 epoch: 90, train_loss: 0.3444, test_loss: 1.3333, test_f1: 0.6726
 epoch: 91, train_loss: 0.3425, test_loss: 1.2889, test_f1: 0.6610
 epoch: 92, train_loss: 0.3437, test_loss: 1.3824, test_f1: 0.6717
 epoch: 93, train_loss: 0.3357, test_loss: 1.3129, test_f1: 0.6391
 epoch: 94, train_loss: 0.3421, test_loss: 1.2881, test_f1: 0.6980
 epoch: 95, train_loss: 0.3034, test_loss: 1.3535, test_f1: 0.6629
 epoch: 96, train_loss: 0.3221, test_loss: 1.4789, test_f1: 0.6790
 epoch: 97, train_loss: 0.3342, test_loss: 1.4938, test_f1: 0.6740
 epoch: 98, train_loss: 0.3093, test_loss: 1.2632, test_f1: 0.6825
 epoch: 99, train_loss: 0.3406, test_loss: 1.2461, test_f1: 0.6845
##################ITERATION #5 ****************************************
 epoch: 0, train_loss: 1.3101, test_loss: 1.0911, test_f1: 0.4203
 epoch: 1, train_loss: 1.0128, test_loss: 1.1596, test_f1: 0.4531
 epoch: 2, train_loss: 0.9864, test_loss: 0.9934, test_f1: 0.4602
 epoch: 3, train_loss: 0.9648, test_loss: 1.0425, test_f1: 0.4687
 epoch: 4, train_loss: 0.9586, test_loss: 0.9478, test_f1: 0.4749
 epoch: 5, train_loss: 0.9290, test_loss: 1.0480, test_f1: 0.4917
 epoch: 6, train_loss: 0.9181, test_loss: 0.9536, test_f1: 0.4925
 epoch: 7, train_loss: 0.9351, test_loss: 1.2016, test_f1: 0.4588
 epoch: 8, train_loss: 0.9228, test_loss: 1.0703, test_f1: 0.4938
 epoch: 9, train_loss: 0.9002, test_loss: 1.0057, test_f1: 0.4636
 epoch: 10, train_loss: 0.9013, test_loss: 1.0882, test_f1: 0.4828
 epoch: 11, train_loss: 0.8842, test_loss: 1.1464, test_f1: 0.4442
 epoch: 12, train_loss: 0.8486, test_loss: 0.9663, test_f1: 0.5011
 epoch: 13, train_loss: 0.8366, test_loss: 0.9355, test_f1: 0.4920
 epoch: 14, train_loss: 0.8459, test_loss: 0.9408, test_f1: 0.5186
 epoch: 15, train_loss: 0.8657, test_loss: 1.0104, test_f1: 0.4667
 epoch: 16, train_loss: 0.8633, test_loss: 1.0022, test_f1: 0.4938
 epoch: 17, train_loss: 0.8278, test_loss: 0.9167, test_f1: 0.5603
 epoch: 18, train_loss: 0.8028, test_loss: 0.9634, test_f1: 0.5275
 epoch: 19, train_loss: 0.8003, test_loss: 1.0258, test_f1: 0.4807
 epoch: 20, train_loss: 0.7904, test_loss: 0.9483, test_f1: 0.4934
 epoch: 21, train_loss: 0.7980, test_loss: 1.0092, test_f1: 0.5496
 epoch: 22, train_loss: 0.7841, test_loss: 1.0824, test_f1: 0.5133
 epoch: 23, train_loss: 0.7774, test_loss: 0.8847, test_f1: 0.5699
 epoch: 24, train_loss: 0.7567, test_loss: 0.8601, test_f1: 0.5880
 epoch: 25, train_loss: 0.7641, test_loss: 0.8448, test_f1: 0.5418
 epoch: 26, train_loss: 0.7423, test_loss: 0.8632, test_f1: 0.5655
 epoch: 27, train_loss: 0.7330, test_loss: 0.8085, test_f1: 0.6049
 epoch: 28, train_loss: 0.7239, test_loss: 0.9543, test_f1: 0.6107
 epoch: 29, train_loss: 0.7333, test_loss: 0.9616, test_f1: 0.5616
 epoch: 30, train_loss: 0.7289, test_loss: 1.0670, test_f1: 0.5703
 epoch: 31, train_loss: 0.7334, test_loss: 0.9205, test_f1: 0.5968
 epoch: 32, train_loss: 0.6966, test_loss: 0.8553, test_f1: 0.5919
 epoch: 33, train_loss: 0.7060, test_loss: 0.9612, test_f1: 0.6129
 epoch: 34, train_loss: 0.7100, test_loss: 0.9255, test_f1: 0.6243
 epoch: 35, train_loss: 0.6984, test_loss: 0.9899, test_f1: 0.5635
 epoch: 36, train_loss: 0.6890, test_loss: 0.9077, test_f1: 0.5818
 epoch: 37, train_loss: 0.6656, test_loss: 0.8401, test_f1: 0.6150
 epoch: 38, train_loss: 0.6739, test_loss: 1.1341, test_f1: 0.5462
 epoch: 39, train_loss: 0.6650, test_loss: 1.0224, test_f1: 0.5723
 epoch: 40, train_loss: 0.6697, test_loss: 1.0398, test_f1: 0.5943
 epoch: 41, train_loss: 0.6562, test_loss: 1.0146, test_f1: 0.6121
 epoch: 42, train_loss: 0.6437, test_loss: 0.8908, test_f1: 0.6092
 epoch: 43, train_loss: 0.6209, test_loss: 0.9827, test_f1: 0.6205
 epoch: 44, train_loss: 0.6433, test_loss: 1.0893, test_f1: 0.6280
 epoch: 45, train_loss: 0.6232, test_loss: 0.9833, test_f1: 0.6085
 epoch: 46, train_loss: 0.6214, test_loss: 1.0004, test_f1: 0.5861
 epoch: 47, train_loss: 0.6111, test_loss: 1.0905, test_f1: 0.5933
 epoch: 48, train_loss: 0.6221, test_loss: 1.1137, test_f1: 0.6564
 epoch: 49, train_loss: 0.5965, test_loss: 1.1384, test_f1: 0.6228
 epoch: 50, train_loss: 0.6020, test_loss: 0.9266, test_f1: 0.6023
 epoch: 51, train_loss: 0.5786, test_loss: 0.9499, test_f1: 0.6641
 epoch: 52, train_loss: 0.5312, test_loss: 0.8367, test_f1: 0.6003
 epoch: 53, train_loss: 0.5201, test_loss: 1.1966, test_f1: 0.6382
 epoch: 54, train_loss: 0.5111, test_loss: 0.9720, test_f1: 0.6442
 epoch: 55, train_loss: 0.4966, test_loss: 1.0738, test_f1: 0.6214
 epoch: 56, train_loss: 0.4836, test_loss: 1.1155, test_f1: 0.6367
 epoch: 57, train_loss: 0.4817, test_loss: 0.9381, test_f1: 0.6380
 epoch: 58, train_loss: 0.4846, test_loss: 0.8498, test_f1: 0.6528
 epoch: 59, train_loss: 0.4794, test_loss: 1.1949, test_f1: 0.6407
 epoch: 60, train_loss: 0.4368, test_loss: 1.2191, test_f1: 0.6308
 epoch: 61, train_loss: 0.4686, test_loss: 0.8477, test_f1: 0.6305
 epoch: 62, train_loss: 0.4608, test_loss: 1.1895, test_f1: 0.6236
 epoch: 63, train_loss: 0.4569, test_loss: 0.9877, test_f1: 0.6121
 epoch: 64, train_loss: 0.4618, test_loss: 0.8808, test_f1: 0.6456
 epoch: 65, train_loss: 0.4758, test_loss: 0.8737, test_f1: 0.6256
 epoch: 66, train_loss: 0.4488, test_loss: 0.9241, test_f1: 0.6320
 epoch: 67, train_loss: 0.4632, test_loss: 1.1292, test_f1: 0.6405
 epoch: 68, train_loss: 0.4683, test_loss: 1.1075, test_f1: 0.6209
 epoch: 69, train_loss: 0.4366, test_loss: 0.9433, test_f1: 0.6582
 epoch: 70, train_loss: 0.4429, test_loss: 0.9627, test_f1: 0.6348
 epoch: 71, train_loss: 0.4301, test_loss: 1.0851, test_f1: 0.6334
 epoch: 72, train_loss: 0.4141, test_loss: 0.8445, test_f1: 0.6407
 epoch: 73, train_loss: 0.4297, test_loss: 0.9656, test_f1: 0.6091
 epoch: 74, train_loss: 0.4137, test_loss: 0.9406, test_f1: 0.6527
 epoch: 75, train_loss: 0.4104, test_loss: 1.0404, test_f1: 0.6654
 epoch: 76, train_loss: 0.3908, test_loss: 0.9150, test_f1: 0.6286
 epoch: 77, train_loss: 0.3992, test_loss: 0.9228, test_f1: 0.6287
 epoch: 78, train_loss: 0.3879, test_loss: 0.9139, test_f1: 0.6322
 epoch: 79, train_loss: 0.3796, test_loss: 1.0301, test_f1: 0.6661
 epoch: 80, train_loss: 0.3772, test_loss: 1.0138, test_f1: 0.6552
 epoch: 81, train_loss: 0.4017, test_loss: 1.0146, test_f1: 0.5993
 epoch: 82, train_loss: 0.4049, test_loss: 1.0804, test_f1: 0.6253
 epoch: 83, train_loss: 0.3701, test_loss: 0.9836, test_f1: 0.6643
 epoch: 84, train_loss: 0.3709, test_loss: 1.4972, test_f1: 0.6302
 epoch: 85, train_loss: 0.3845, test_loss: 0.9423, test_f1: 0.6573
 epoch: 86, train_loss: 0.3955, test_loss: 1.0295, test_f1: 0.6374
 epoch: 87, train_loss: 0.3513, test_loss: 0.9784, test_f1: 0.6421
 epoch: 88, train_loss: 0.3906, test_loss: 1.1958, test_f1: 0.6185
 epoch: 89, train_loss: 0.3748, test_loss: 1.2998, test_f1: 0.6505
 epoch: 90, train_loss: 0.3502, test_loss: 0.9575, test_f1: 0.6586
 epoch: 91, train_loss: 0.3592, test_loss: 0.9532, test_f1: 0.6674
 epoch: 92, train_loss: 0.3535, test_loss: 1.2676, test_f1: 0.6559
 epoch: 93, train_loss: 0.3314, test_loss: 1.3524, test_f1: 0.6147
 epoch: 94, train_loss: 0.3396, test_loss: 1.5509, test_f1: 0.6369
 epoch: 95, train_loss: 0.3559, test_loss: 1.1546, test_f1: 0.6466
 epoch: 96, train_loss: 0.3500, test_loss: 1.2589, test_f1: 0.6495
 epoch: 97, train_loss: 0.3403, test_loss: 1.1662, test_f1: 0.6253
 epoch: 98, train_loss: 0.3476, test_loss: 1.2025, test_f1: 0.6573
 epoch: 99, train_loss: 0.3119, test_loss: 1.1776, test_f1: 0.6658
##################ITERATION #6 ****************************************
 epoch: 0, train_loss: 1.2816, test_loss: 1.1922, test_f1: 0.3720
 epoch: 1, train_loss: 1.0066, test_loss: 1.1073, test_f1: 0.4610
 epoch: 2, train_loss: 0.9717, test_loss: 0.9798, test_f1: 0.4910
 epoch: 3, train_loss: 0.9481, test_loss: 0.9525, test_f1: 0.4960
 epoch: 4, train_loss: 0.9305, test_loss: 0.9943, test_f1: 0.5171
 epoch: 5, train_loss: 0.9174, test_loss: 0.9329, test_f1: 0.4955
 epoch: 6, train_loss: 0.9170, test_loss: 0.9003, test_f1: 0.5652
 epoch: 7, train_loss: 0.8992, test_loss: 0.9202, test_f1: 0.5180
 epoch: 8, train_loss: 0.8713, test_loss: 0.8386, test_f1: 0.5443
 epoch: 9, train_loss: 0.8489, test_loss: 0.9181, test_f1: 0.5583
 epoch: 10, train_loss: 0.8363, test_loss: 0.9280, test_f1: 0.5199
 epoch: 11, train_loss: 0.8265, test_loss: 0.8941, test_f1: 0.5532
 epoch: 12, train_loss: 0.8197, test_loss: 0.9260, test_f1: 0.5276
 epoch: 13, train_loss: 0.8060, test_loss: 0.9160, test_f1: 0.5585
 epoch: 14, train_loss: 0.7756, test_loss: 0.7970, test_f1: 0.5975
 epoch: 15, train_loss: 0.7674, test_loss: 0.8483, test_f1: 0.5675
 epoch: 16, train_loss: 0.7579, test_loss: 0.9202, test_f1: 0.5132
 epoch: 17, train_loss: 0.8042, test_loss: 0.8882, test_f1: 0.5435
 epoch: 18, train_loss: 0.7582, test_loss: 1.1681, test_f1: 0.5120
 epoch: 19, train_loss: 0.7394, test_loss: 0.7736, test_f1: 0.5924
 epoch: 20, train_loss: 0.7153, test_loss: 1.1233, test_f1: 0.5004
 epoch: 21, train_loss: 0.7204, test_loss: 1.0198, test_f1: 0.5334
 epoch: 22, train_loss: 0.7159, test_loss: 0.8611, test_f1: 0.5804
 epoch: 23, train_loss: 0.7197, test_loss: 0.8514, test_f1: 0.6122
 epoch: 24, train_loss: 0.6873, test_loss: 0.9525, test_f1: 0.5558
 epoch: 25, train_loss: 0.6776, test_loss: 0.7438, test_f1: 0.6520
 epoch: 26, train_loss: 0.6764, test_loss: 0.8945, test_f1: 0.6077
 epoch: 27, train_loss: 0.6502, test_loss: 0.9178, test_f1: 0.5959
 epoch: 28, train_loss: 0.6612, test_loss: 0.8377, test_f1: 0.5691
 epoch: 29, train_loss: 0.6548, test_loss: 0.8367, test_f1: 0.6042
 epoch: 30, train_loss: 0.6515, test_loss: 0.7965, test_f1: 0.6106
 epoch: 31, train_loss: 0.6412, test_loss: 0.8594, test_f1: 0.5870
 epoch: 32, train_loss: 0.6286, test_loss: 0.7609, test_f1: 0.6187
 epoch: 33, train_loss: 0.6290, test_loss: 0.8905, test_f1: 0.5613
 epoch: 34, train_loss: 0.6440, test_loss: 0.9039, test_f1: 0.5963
 epoch: 35, train_loss: 0.6329, test_loss: 0.8423, test_f1: 0.6166
 epoch: 36, train_loss: 0.6406, test_loss: 0.9396, test_f1: 0.5787
 epoch: 37, train_loss: 0.6289, test_loss: 0.8569, test_f1: 0.6098
 epoch: 38, train_loss: 0.6266, test_loss: 0.9179, test_f1: 0.5968
 epoch: 39, train_loss: 0.6184, test_loss: 0.9010, test_f1: 0.6241
 epoch: 40, train_loss: 0.5771, test_loss: 0.8200, test_f1: 0.6551
 epoch: 41, train_loss: 0.5971, test_loss: 0.9334, test_f1: 0.6038
 epoch: 42, train_loss: 0.5639, test_loss: 0.9799, test_f1: 0.6035
 epoch: 43, train_loss: 0.5601, test_loss: 1.0302, test_f1: 0.6084
 epoch: 44, train_loss: 0.5633, test_loss: 0.9690, test_f1: 0.5796
 epoch: 45, train_loss: 0.5462, test_loss: 0.8911, test_f1: 0.6337
 epoch: 46, train_loss: 0.5668, test_loss: 0.7540, test_f1: 0.6539
 epoch: 47, train_loss: 0.5258, test_loss: 0.7928, test_f1: 0.6468
 epoch: 48, train_loss: 0.5510, test_loss: 0.9280, test_f1: 0.6194
 epoch: 49, train_loss: 0.5723, test_loss: 0.8317, test_f1: 0.6107
 epoch: 50, train_loss: 0.5938, test_loss: 0.8112, test_f1: 0.6394
 epoch: 51, train_loss: 0.5218, test_loss: 0.8296, test_f1: 0.6468
 epoch: 52, train_loss: 0.4867, test_loss: 0.9227, test_f1: 0.6530
 epoch: 53, train_loss: 0.4670, test_loss: 0.8267, test_f1: 0.6594
 epoch: 54, train_loss: 0.4739, test_loss: 0.8307, test_f1: 0.6664
 epoch: 55, train_loss: 0.4546, test_loss: 0.7992, test_f1: 0.6593
 epoch: 56, train_loss: 0.4573, test_loss: 0.8907, test_f1: 0.6771
 epoch: 57, train_loss: 0.4471, test_loss: 0.8604, test_f1: 0.6437
 epoch: 58, train_loss: 0.4153, test_loss: 0.9629, test_f1: 0.6569
 epoch: 59, train_loss: 0.4368, test_loss: 0.8881, test_f1: 0.6271
 epoch: 60, train_loss: 0.4349, test_loss: 0.9511, test_f1: 0.6403
 epoch: 61, train_loss: 0.4235, test_loss: 0.9594, test_f1: 0.6356
 epoch: 62, train_loss: 0.4194, test_loss: 0.8693, test_f1: 0.6448
 epoch: 63, train_loss: 0.4188, test_loss: 0.9237, test_f1: 0.6510
 epoch: 64, train_loss: 0.4082, test_loss: 0.8853, test_f1: 0.6315
 epoch: 65, train_loss: 0.3750, test_loss: 0.8809, test_f1: 0.6613
 epoch: 66, train_loss: 0.3953, test_loss: 1.0257, test_f1: 0.6497
 epoch: 67, train_loss: 0.4146, test_loss: 1.0993, test_f1: 0.6294
 epoch: 68, train_loss: 0.3964, test_loss: 0.9447, test_f1: 0.6649
 epoch: 69, train_loss: 0.3796, test_loss: 0.9505, test_f1: 0.6462
 epoch: 70, train_loss: 0.3823, test_loss: 0.9068, test_f1: 0.6819
 epoch: 71, train_loss: 0.3960, test_loss: 1.0052, test_f1: 0.6400
 epoch: 72, train_loss: 0.3936, test_loss: 0.8892, test_f1: 0.6409
 epoch: 73, train_loss: 0.3931, test_loss: 1.0628, test_f1: 0.6456
 epoch: 74, train_loss: 0.3839, test_loss: 0.9452, test_f1: 0.6481
 epoch: 75, train_loss: 0.3735, test_loss: 0.9231, test_f1: 0.6598
 epoch: 76, train_loss: 0.3687, test_loss: 0.9342, test_f1: 0.6392
 epoch: 77, train_loss: 0.3720, test_loss: 1.0070, test_f1: 0.6508
 epoch: 78, train_loss: 0.3646, test_loss: 0.9820, test_f1: 0.6538
 epoch: 79, train_loss: 0.3691, test_loss: 0.9570, test_f1: 0.6548
 epoch: 80, train_loss: 0.3723, test_loss: 0.9425, test_f1: 0.6499
 epoch: 81, train_loss: 0.3778, test_loss: 1.0020, test_f1: 0.6378
 epoch: 82, train_loss: 0.3594, test_loss: 1.1254, test_f1: 0.6661
 epoch: 83, train_loss: 0.3549, test_loss: 0.9587, test_f1: 0.6582
 epoch: 84, train_loss: 0.3343, test_loss: 1.1255, test_f1: 0.6376
 epoch: 85, train_loss: 0.3328, test_loss: 1.0741, test_f1: 0.6457
 epoch: 86, train_loss: 0.3410, test_loss: 1.1179, test_f1: 0.6259
 epoch: 87, train_loss: 0.3407, test_loss: 1.0422, test_f1: 0.6585
 epoch: 88, train_loss: 0.3354, test_loss: 1.0044, test_f1: 0.6500
 epoch: 89, train_loss: 0.3486, test_loss: 1.2008, test_f1: 0.6290
 epoch: 90, train_loss: 0.3271, test_loss: 0.9430, test_f1: 0.6767
 epoch: 91, train_loss: 0.3554, test_loss: 1.0526, test_f1: 0.6423
 epoch: 92, train_loss: 0.3241, test_loss: 1.0368, test_f1: 0.6652
 epoch: 93, train_loss: 0.3101, test_loss: 1.1731, test_f1: 0.6056
 epoch: 94, train_loss: 0.3264, test_loss: 1.0207, test_f1: 0.6468
 epoch: 95, train_loss: 0.3083, test_loss: 1.0086, test_f1: 0.6638
 epoch: 96, train_loss: 0.3245, test_loss: 1.0784, test_f1: 0.6250
 epoch: 97, train_loss: 0.2946, test_loss: 0.9929, test_f1: 0.6558
 epoch: 98, train_loss: 0.3101, test_loss: 1.1785, test_f1: 0.6378
 epoch: 99, train_loss: 0.2963, test_loss: 1.0365, test_f1: 0.6477
##################ITERATION #7 ****************************************
 epoch: 0, train_loss: 1.2365, test_loss: 1.3010, test_f1: 0.3606
 epoch: 1, train_loss: 0.9747, test_loss: 1.0585, test_f1: 0.5316
 epoch: 2, train_loss: 0.9227, test_loss: 0.9810, test_f1: 0.4831
 epoch: 3, train_loss: 0.9066, test_loss: 0.9226, test_f1: 0.5048
 epoch: 4, train_loss: 0.8776, test_loss: 0.9360, test_f1: 0.5353
 epoch: 5, train_loss: 0.8800, test_loss: 0.9964, test_f1: 0.4878
 epoch: 6, train_loss: 0.8714, test_loss: 1.0033, test_f1: 0.4947
 epoch: 7, train_loss: 0.8444, test_loss: 0.9092, test_f1: 0.5466
 epoch: 8, train_loss: 0.8315, test_loss: 1.0367, test_f1: 0.5671
 epoch: 9, train_loss: 0.8213, test_loss: 0.9222, test_f1: 0.5582
 epoch: 10, train_loss: 0.8006, test_loss: 0.8977, test_f1: 0.5766
 epoch: 11, train_loss: 0.7660, test_loss: 0.8759, test_f1: 0.5941
 epoch: 12, train_loss: 0.7604, test_loss: 0.9893, test_f1: 0.5411
 epoch: 13, train_loss: 0.7642, test_loss: 0.9649, test_f1: 0.5267
 epoch: 14, train_loss: 0.7895, test_loss: 0.9317, test_f1: 0.4926
 epoch: 15, train_loss: 0.7724, test_loss: 0.8805, test_f1: 0.5647
 epoch: 16, train_loss: 0.7358, test_loss: 0.9614, test_f1: 0.5521
 epoch: 17, train_loss: 0.7411, test_loss: 0.8215, test_f1: 0.5975
 epoch: 18, train_loss: 0.7245, test_loss: 0.9376, test_f1: 0.6218
 epoch: 19, train_loss: 0.7048, test_loss: 1.0566, test_f1: 0.5333
 epoch: 20, train_loss: 0.7351, test_loss: 0.9212, test_f1: 0.5679
 epoch: 21, train_loss: 0.7047, test_loss: 0.9499, test_f1: 0.5447
 epoch: 22, train_loss: 0.7152, test_loss: 1.0361, test_f1: 0.5249
 epoch: 23, train_loss: 0.7269, test_loss: 0.8633, test_f1: 0.5658
 epoch: 24, train_loss: 0.6705, test_loss: 0.9118, test_f1: 0.5540
 epoch: 25, train_loss: 0.6814, test_loss: 0.8569, test_f1: 0.6063
 epoch: 26, train_loss: 0.6618, test_loss: 0.9510, test_f1: 0.5786
 epoch: 27, train_loss: 0.6490, test_loss: 1.0466, test_f1: 0.5751
 epoch: 28, train_loss: 0.6619, test_loss: 1.1293, test_f1: 0.5398
 epoch: 29, train_loss: 0.6432, test_loss: 1.1273, test_f1: 0.5806
 epoch: 30, train_loss: 0.6939, test_loss: 0.9086, test_f1: 0.6194
 epoch: 31, train_loss: 0.6256, test_loss: 1.0099, test_f1: 0.6073
 epoch: 32, train_loss: 0.6301, test_loss: 1.0160, test_f1: 0.6000
 epoch: 33, train_loss: 0.6224, test_loss: 0.9728, test_f1: 0.6169
 epoch: 34, train_loss: 0.6222, test_loss: 0.8747, test_f1: 0.5898
 epoch: 35, train_loss: 0.6081, test_loss: 1.0855, test_f1: 0.5838
 epoch: 36, train_loss: 0.6065, test_loss: 0.9518, test_f1: 0.6452
 epoch: 37, train_loss: 0.5906, test_loss: 1.0021, test_f1: 0.5828
 epoch: 38, train_loss: 0.5954, test_loss: 1.0327, test_f1: 0.6111
 epoch: 39, train_loss: 0.5994, test_loss: 1.1565, test_f1: 0.5529
 epoch: 40, train_loss: 0.5846, test_loss: 0.8850, test_f1: 0.5999
 epoch: 41, train_loss: 0.5894, test_loss: 0.9315, test_f1: 0.6273
 epoch: 42, train_loss: 0.5940, test_loss: 1.4752, test_f1: 0.5343
 epoch: 43, train_loss: 0.5986, test_loss: 0.9735, test_f1: 0.6224
 epoch: 44, train_loss: 0.5663, test_loss: 1.2619, test_f1: 0.5945
 epoch: 45, train_loss: 0.6012, test_loss: 0.9805, test_f1: 0.5766
 epoch: 46, train_loss: 0.5613, test_loss: 1.1188, test_f1: 0.6220
 epoch: 47, train_loss: 0.5402, test_loss: 1.0889, test_f1: 0.5807
 epoch: 48, train_loss: 0.5303, test_loss: 1.0824, test_f1: 0.6382
 epoch: 49, train_loss: 0.5223, test_loss: 0.9904, test_f1: 0.6175
 epoch: 50, train_loss: 0.5289, test_loss: 1.0790, test_f1: 0.6185
 epoch: 51, train_loss: 0.4911, test_loss: 1.0414, test_f1: 0.6374
 epoch: 52, train_loss: 0.4590, test_loss: 1.1215, test_f1: 0.6496
 epoch: 53, train_loss: 0.4374, test_loss: 1.1797, test_f1: 0.6524
 epoch: 54, train_loss: 0.4534, test_loss: 1.1869, test_f1: 0.6437
 epoch: 55, train_loss: 0.4183, test_loss: 1.2281, test_f1: 0.6624
 epoch: 56, train_loss: 0.4473, test_loss: 1.2454, test_f1: 0.6276
 epoch: 57, train_loss: 0.4247, test_loss: 1.0871, test_f1: 0.6697
 epoch: 58, train_loss: 0.4205, test_loss: 1.1584, test_f1: 0.6501
 epoch: 59, train_loss: 0.4241, test_loss: 1.3040, test_f1: 0.6455
 epoch: 60, train_loss: 0.4055, test_loss: 1.2950, test_f1: 0.6446
 epoch: 61, train_loss: 0.4192, test_loss: 1.2165, test_f1: 0.6564
 epoch: 62, train_loss: 0.4140, test_loss: 1.1940, test_f1: 0.6777
 epoch: 63, train_loss: 0.4326, test_loss: 1.3460, test_f1: 0.6459
 epoch: 64, train_loss: 0.3924, test_loss: 1.3938, test_f1: 0.5858
 epoch: 65, train_loss: 0.3933, test_loss: 1.2547, test_f1: 0.6644
 epoch: 66, train_loss: 0.4005, test_loss: 1.3291, test_f1: 0.6628
 epoch: 67, train_loss: 0.3983, test_loss: 1.2790, test_f1: 0.6542
 epoch: 68, train_loss: 0.3807, test_loss: 1.4076, test_f1: 0.5871
 epoch: 69, train_loss: 0.3718, test_loss: 1.2343, test_f1: 0.6413
 epoch: 70, train_loss: 0.3759, test_loss: 1.3945, test_f1: 0.6333
 epoch: 71, train_loss: 0.3559, test_loss: 1.4697, test_f1: 0.6427
 epoch: 72, train_loss: 0.3846, test_loss: 1.2241, test_f1: 0.6821
 epoch: 73, train_loss: 0.3895, test_loss: 1.3655, test_f1: 0.6569
 epoch: 74, train_loss: 0.3611, test_loss: 1.2845, test_f1: 0.6553
 epoch: 75, train_loss: 0.3578, test_loss: 1.1825, test_f1: 0.6294
 epoch: 76, train_loss: 0.3701, test_loss: 1.2646, test_f1: 0.6492
 epoch: 77, train_loss: 0.3761, test_loss: 1.3625, test_f1: 0.6607
 epoch: 78, train_loss: 0.3664, test_loss: 1.5074, test_f1: 0.6206
 epoch: 79, train_loss: 0.3584, test_loss: 1.4690, test_f1: 0.6495
 epoch: 80, train_loss: 0.3424, test_loss: 1.3567, test_f1: 0.6541
 epoch: 81, train_loss: 0.3341, test_loss: 1.4680, test_f1: 0.6576
 epoch: 82, train_loss: 0.3129, test_loss: 1.4677, test_f1: 0.6471
 epoch: 83, train_loss: 0.3310, test_loss: 1.4182, test_f1: 0.6563
 epoch: 84, train_loss: 0.3199, test_loss: 1.4874, test_f1: 0.6296
 epoch: 85, train_loss: 0.3212, test_loss: 1.5389, test_f1: 0.6464
 epoch: 86, train_loss: 0.3226, test_loss: 1.4683, test_f1: 0.6569
 epoch: 87, train_loss: 0.3383, test_loss: 1.5607, test_f1: 0.6510
 epoch: 88, train_loss: 0.3546, test_loss: 1.5592, test_f1: 0.6577
 epoch: 89, train_loss: 0.3254, test_loss: 1.5546, test_f1: 0.6164
 epoch: 90, train_loss: 0.3261, test_loss: 1.4209, test_f1: 0.6458
 epoch: 91, train_loss: 0.3047, test_loss: 1.6276, test_f1: 0.6156
 epoch: 92, train_loss: 0.2967, test_loss: 1.4683, test_f1: 0.6491
 epoch: 93, train_loss: 0.3112, test_loss: 1.7201, test_f1: 0.6261
 epoch: 94, train_loss: 0.2884, test_loss: 1.5376, test_f1: 0.6451
 epoch: 95, train_loss: 0.2935, test_loss: 1.5967, test_f1: 0.6229
 epoch: 96, train_loss: 0.3252, test_loss: 1.6500, test_f1: 0.6407
 epoch: 97, train_loss: 0.3134, test_loss: 1.4901, test_f1: 0.6683
 epoch: 98, train_loss: 0.2977, test_loss: 1.5462, test_f1: 0.6337
 epoch: 99, train_loss: 0.2784, test_loss: 1.6865, test_f1: 0.6537
##################ITERATION #8 ****************************************
 epoch: 0, train_loss: 1.2986, test_loss: 1.4704, test_f1: 0.1778
 epoch: 1, train_loss: 0.9881, test_loss: 1.0081, test_f1: 0.5042
 epoch: 2, train_loss: 0.9577, test_loss: 1.1489, test_f1: 0.4823
 epoch: 3, train_loss: 0.9516, test_loss: 0.9165, test_f1: 0.5379
 epoch: 4, train_loss: 0.9215, test_loss: 0.8939, test_f1: 0.5727
 epoch: 5, train_loss: 0.9209, test_loss: 0.9698, test_f1: 0.5404
 epoch: 6, train_loss: 0.8997, test_loss: 0.9301, test_f1: 0.5588
 epoch: 7, train_loss: 0.8723, test_loss: 1.0309, test_f1: 0.5520
 epoch: 8, train_loss: 0.8560, test_loss: 0.8860, test_f1: 0.5857
 epoch: 9, train_loss: 0.8577, test_loss: 0.9814, test_f1: 0.5414
 epoch: 10, train_loss: 0.8291, test_loss: 0.8861, test_f1: 0.5651
 epoch: 11, train_loss: 0.8290, test_loss: 1.1019, test_f1: 0.5303
 epoch: 12, train_loss: 0.8101, test_loss: 0.8929, test_f1: 0.5537
 epoch: 13, train_loss: 0.7987, test_loss: 0.8998, test_f1: 0.5738
 epoch: 14, train_loss: 0.7870, test_loss: 0.8088, test_f1: 0.6120
 epoch: 15, train_loss: 0.7784, test_loss: 0.9048, test_f1: 0.5749
 epoch: 16, train_loss: 0.7599, test_loss: 1.2165, test_f1: 0.5203
 epoch: 17, train_loss: 0.7567, test_loss: 0.8733, test_f1: 0.5656
 epoch: 18, train_loss: 0.7870, test_loss: 0.9824, test_f1: 0.5640
 epoch: 19, train_loss: 0.7486, test_loss: 0.8636, test_f1: 0.5616
 epoch: 20, train_loss: 0.7244, test_loss: 0.8928, test_f1: 0.5728
 epoch: 21, train_loss: 0.7227, test_loss: 0.7704, test_f1: 0.6302
 epoch: 22, train_loss: 0.7165, test_loss: 0.7726, test_f1: 0.6202
 epoch: 23, train_loss: 0.7093, test_loss: 0.8210, test_f1: 0.5953
 epoch: 24, train_loss: 0.7176, test_loss: 0.8205, test_f1: 0.6151
 epoch: 25, train_loss: 0.6995, test_loss: 0.8761, test_f1: 0.5922
 epoch: 26, train_loss: 0.6884, test_loss: 0.9370, test_f1: 0.5972
 epoch: 27, train_loss: 0.7016, test_loss: 0.8370, test_f1: 0.6283
 epoch: 28, train_loss: 0.6937, test_loss: 0.7829, test_f1: 0.6224
 epoch: 29, train_loss: 0.6871, test_loss: 0.7872, test_f1: 0.6169
 epoch: 30, train_loss: 0.6837, test_loss: 0.7984, test_f1: 0.6194
 epoch: 31, train_loss: 0.6728, test_loss: 1.0109, test_f1: 0.5973
 epoch: 32, train_loss: 0.6513, test_loss: 0.8714, test_f1: 0.6017
 epoch: 33, train_loss: 0.6676, test_loss: 0.8802, test_f1: 0.6202
 epoch: 34, train_loss: 0.6561, test_loss: 0.6991, test_f1: 0.6588
 epoch: 35, train_loss: 0.6370, test_loss: 0.8387, test_f1: 0.5882
 epoch: 36, train_loss: 0.6578, test_loss: 0.7577, test_f1: 0.6589
 epoch: 37, train_loss: 0.6440, test_loss: 0.7564, test_f1: 0.6227
 epoch: 38, train_loss: 0.6404, test_loss: 0.8081, test_f1: 0.6726
 epoch: 39, train_loss: 0.6060, test_loss: 0.7149, test_f1: 0.6626
 epoch: 40, train_loss: 0.6011, test_loss: 0.8966, test_f1: 0.6367
 epoch: 41, train_loss: 0.6035, test_loss: 0.8869, test_f1: 0.6238
 epoch: 42, train_loss: 0.5980, test_loss: 1.1062, test_f1: 0.5868
 epoch: 43, train_loss: 0.6248, test_loss: 0.7564, test_f1: 0.6782
 epoch: 44, train_loss: 0.6033, test_loss: 1.0245, test_f1: 0.5379
 epoch: 45, train_loss: 0.5849, test_loss: 0.9343, test_f1: 0.6596
 epoch: 46, train_loss: 0.5856, test_loss: 0.7992, test_f1: 0.6405
 epoch: 47, train_loss: 0.5684, test_loss: 0.7617, test_f1: 0.6456
 epoch: 48, train_loss: 0.5637, test_loss: 0.8654, test_f1: 0.6344
 epoch: 49, train_loss: 0.5981, test_loss: 0.8963, test_f1: 0.6361
 epoch: 50, train_loss: 0.5304, test_loss: 0.8969, test_f1: 0.6211
 epoch: 51, train_loss: 0.5113, test_loss: 0.7475, test_f1: 0.6672
 epoch: 52, train_loss: 0.4873, test_loss: 0.8138, test_f1: 0.6590
 epoch: 53, train_loss: 0.4679, test_loss: 0.8744, test_f1: 0.6671
 epoch: 54, train_loss: 0.4644, test_loss: 1.0071, test_f1: 0.6524
 epoch: 55, train_loss: 0.4571, test_loss: 0.8219, test_f1: 0.6519
 epoch: 56, train_loss: 0.4395, test_loss: 0.8182, test_f1: 0.6671
 epoch: 57, train_loss: 0.4298, test_loss: 0.9697, test_f1: 0.6401
 epoch: 58, train_loss: 0.4226, test_loss: 0.8279, test_f1: 0.6640
 epoch: 59, train_loss: 0.4447, test_loss: 0.7419, test_f1: 0.6897
 epoch: 60, train_loss: 0.4274, test_loss: 1.0197, test_f1: 0.6757
 epoch: 61, train_loss: 0.4206, test_loss: 0.8948, test_f1: 0.6506
 epoch: 62, train_loss: 0.4261, test_loss: 0.7768, test_f1: 0.6746
 epoch: 63, train_loss: 0.4263, test_loss: 0.9154, test_f1: 0.6609
 epoch: 64, train_loss: 0.4199, test_loss: 0.9354, test_f1: 0.6408
 epoch: 65, train_loss: 0.4133, test_loss: 0.8549, test_f1: 0.6919
 epoch: 66, train_loss: 0.3974, test_loss: 0.9647, test_f1: 0.6476
 epoch: 67, train_loss: 0.4001, test_loss: 0.8524, test_f1: 0.6800
 epoch: 68, train_loss: 0.4061, test_loss: 1.0293, test_f1: 0.6378
 epoch: 69, train_loss: 0.3958, test_loss: 0.8484, test_f1: 0.6675
 epoch: 70, train_loss: 0.3942, test_loss: 1.0135, test_f1: 0.6367
 epoch: 71, train_loss: 0.3884, test_loss: 0.9674, test_f1: 0.6764
 epoch: 72, train_loss: 0.3989, test_loss: 1.1838, test_f1: 0.6831
 epoch: 73, train_loss: 0.3739, test_loss: 0.8896, test_f1: 0.6803
 epoch: 74, train_loss: 0.3722, test_loss: 0.9820, test_f1: 0.6642
 epoch: 75, train_loss: 0.3718, test_loss: 1.1356, test_f1: 0.6334
 epoch: 76, train_loss: 0.3620, test_loss: 0.9695, test_f1: 0.6662
 epoch: 77, train_loss: 0.3988, test_loss: 0.9734, test_f1: 0.6639
 epoch: 78, train_loss: 0.3738, test_loss: 1.0636, test_f1: 0.6663
 epoch: 79, train_loss: 0.3730, test_loss: 1.0011, test_f1: 0.6667
 epoch: 80, train_loss: 0.3462, test_loss: 1.0591, test_f1: 0.6426
 epoch: 81, train_loss: 0.3548, test_loss: 1.0606, test_f1: 0.6429
 epoch: 82, train_loss: 0.3357, test_loss: 1.0529, test_f1: 0.6719
 epoch: 83, train_loss: 0.3630, test_loss: 1.1942, test_f1: 0.6699
 epoch: 84, train_loss: 0.3335, test_loss: 1.1142, test_f1: 0.6285
 epoch: 85, train_loss: 0.3236, test_loss: 1.0836, test_f1: 0.6346
 epoch: 86, train_loss: 0.3200, test_loss: 0.9885, test_f1: 0.6520
 epoch: 87, train_loss: 0.3479, test_loss: 1.0564, test_f1: 0.6443
 epoch: 88, train_loss: 0.3600, test_loss: 1.0572, test_f1: 0.6277
 epoch: 89, train_loss: 0.3329, test_loss: 0.9709, test_f1: 0.6732
 epoch: 90, train_loss: 0.3237, test_loss: 1.1574, test_f1: 0.6447
 epoch: 91, train_loss: 0.3243, test_loss: 1.0675, test_f1: 0.6571
 epoch: 92, train_loss: 0.3001, test_loss: 0.9934, test_f1: 0.6848
 epoch: 93, train_loss: 0.2997, test_loss: 1.0618, test_f1: 0.6777
 epoch: 94, train_loss: 0.3114, test_loss: 1.1373, test_f1: 0.6504
 epoch: 95, train_loss: 0.3254, test_loss: 1.2324, test_f1: 0.6526
 epoch: 96, train_loss: 0.3213, test_loss: 1.1185, test_f1: 0.6566
 epoch: 97, train_loss: 0.3080, test_loss: 1.1781, test_f1: 0.6645
 epoch: 98, train_loss: 0.3025, test_loss: 1.0553, test_f1: 0.6652
 epoch: 99, train_loss: 0.3131, test_loss: 1.1038, test_f1: 0.6535
##################ITERATION #9 ****************************************
 epoch: 0, train_loss: 1.3111, test_loss: 1.4044, test_f1: 0.3669
 epoch: 1, train_loss: 1.0134, test_loss: 1.0037, test_f1: 0.4949
 epoch: 2, train_loss: 0.9797, test_loss: 1.0452, test_f1: 0.5366
 epoch: 3, train_loss: 0.9628, test_loss: 1.0725, test_f1: 0.5533
 epoch: 4, train_loss: 0.9358, test_loss: 1.1706, test_f1: 0.5230
 epoch: 5, train_loss: 0.9326, test_loss: 0.9843, test_f1: 0.5518
 epoch: 6, train_loss: 0.9208, test_loss: 0.9522, test_f1: 0.5532
 epoch: 7, train_loss: 0.9153, test_loss: 1.0801, test_f1: 0.5742
 epoch: 8, train_loss: 0.9053, test_loss: 0.9744, test_f1: 0.5339
 epoch: 9, train_loss: 0.8797, test_loss: 0.9555, test_f1: 0.5565
 epoch: 10, train_loss: 0.8600, test_loss: 1.0412, test_f1: 0.5538
 epoch: 11, train_loss: 0.8740, test_loss: 0.8703, test_f1: 0.5707
 epoch: 12, train_loss: 0.8312, test_loss: 0.9323, test_f1: 0.6217
 epoch: 13, train_loss: 0.8151, test_loss: 0.9924, test_f1: 0.5793
 epoch: 14, train_loss: 0.8125, test_loss: 0.9448, test_f1: 0.5491
 epoch: 15, train_loss: 0.7972, test_loss: 0.8270, test_f1: 0.5880
 epoch: 16, train_loss: 0.7923, test_loss: 0.9306, test_f1: 0.6115
 epoch: 17, train_loss: 0.7924, test_loss: 0.8172, test_f1: 0.6023
 epoch: 18, train_loss: 0.7749, test_loss: 0.8391, test_f1: 0.5763
 epoch: 19, train_loss: 0.7905, test_loss: 0.8544, test_f1: 0.6064
 epoch: 20, train_loss: 0.7877, test_loss: 1.0736, test_f1: 0.5186
 epoch: 21, train_loss: 0.7793, test_loss: 0.7897, test_f1: 0.5725
 epoch: 22, train_loss: 0.7642, test_loss: 0.9560, test_f1: 0.5993
 epoch: 23, train_loss: 0.7528, test_loss: 0.7867, test_f1: 0.5643
 epoch: 24, train_loss: 0.7346, test_loss: 1.0064, test_f1: 0.5871
 epoch: 25, train_loss: 0.7352, test_loss: 1.0362, test_f1: 0.5623
 epoch: 26, train_loss: 0.7316, test_loss: 0.9000, test_f1: 0.5476
 epoch: 27, train_loss: 0.7090, test_loss: 0.9107, test_f1: 0.5930
 epoch: 28, train_loss: 0.7096, test_loss: 0.8478, test_f1: 0.5819
 epoch: 29, train_loss: 0.6915, test_loss: 0.7623, test_f1: 0.6083
 epoch: 30, train_loss: 0.6864, test_loss: 0.7847, test_f1: 0.6187
 epoch: 31, train_loss: 0.7075, test_loss: 0.7773, test_f1: 0.6035
 epoch: 32, train_loss: 0.6864, test_loss: 1.0170, test_f1: 0.6404
 epoch: 33, train_loss: 0.6675, test_loss: 0.8707, test_f1: 0.6456
 epoch: 34, train_loss: 0.6588, test_loss: 1.1482, test_f1: 0.6156
 epoch: 35, train_loss: 0.6710, test_loss: 1.0932, test_f1: 0.5398
 epoch: 36, train_loss: 0.6668, test_loss: 1.0539, test_f1: 0.6537
 epoch: 37, train_loss: 0.6525, test_loss: 1.0672, test_f1: 0.6225
 epoch: 38, train_loss: 0.6561, test_loss: 1.0212, test_f1: 0.6260
 epoch: 39, train_loss: 0.6597, test_loss: 1.3110, test_f1: 0.6242
 epoch: 40, train_loss: 0.6343, test_loss: 0.8163, test_f1: 0.6342
 epoch: 41, train_loss: 0.6261, test_loss: 1.1830, test_f1: 0.6072
 epoch: 42, train_loss: 0.6359, test_loss: 1.0220, test_f1: 0.6050
 epoch: 43, train_loss: 0.6236, test_loss: 0.8455, test_f1: 0.6306
 epoch: 44, train_loss: 0.6002, test_loss: 0.9025, test_f1: 0.5776
 epoch: 45, train_loss: 0.5790, test_loss: 0.7326, test_f1: 0.6342
 epoch: 46, train_loss: 0.6091, test_loss: 1.0518, test_f1: 0.6368
 epoch: 47, train_loss: 0.5904, test_loss: 1.0470, test_f1: 0.6315
 epoch: 48, train_loss: 0.5708, test_loss: 1.0110, test_f1: 0.6219
 epoch: 49, train_loss: 0.6010, test_loss: 1.1257, test_f1: 0.6061
 epoch: 50, train_loss: 0.5956, test_loss: 0.8421, test_f1: 0.6266
 epoch: 51, train_loss: 0.5419, test_loss: 0.9275, test_f1: 0.6788
 epoch: 52, train_loss: 0.5137, test_loss: 0.7301, test_f1: 0.6514
 epoch: 53, train_loss: 0.5162, test_loss: 0.8079, test_f1: 0.6648
 epoch: 54, train_loss: 0.4977, test_loss: 0.8571, test_f1: 0.6288
 epoch: 55, train_loss: 0.5020, test_loss: 1.0560, test_f1: 0.6760
 epoch: 56, train_loss: 0.4651, test_loss: 0.8876, test_f1: 0.7165
 epoch: 57, train_loss: 0.4627, test_loss: 0.8572, test_f1: 0.6671
 epoch: 58, train_loss: 0.4783, test_loss: 0.9205, test_f1: 0.6594
 epoch: 59, train_loss: 0.4817, test_loss: 0.9324, test_f1: 0.6436
 epoch: 60, train_loss: 0.4722, test_loss: 0.9311, test_f1: 0.6831
 epoch: 61, train_loss: 0.4590, test_loss: 1.1055, test_f1: 0.6431
 epoch: 62, train_loss: 0.4498, test_loss: 1.2210, test_f1: 0.6443
 epoch: 63, train_loss: 0.4795, test_loss: 0.9889, test_f1: 0.6521
 epoch: 64, train_loss: 0.4505, test_loss: 1.2301, test_f1: 0.6439
 epoch: 65, train_loss: 0.4327, test_loss: 0.9932, test_f1: 0.6557
 epoch: 66, train_loss: 0.4260, test_loss: 0.9327, test_f1: 0.6376
 epoch: 67, train_loss: 0.4379, test_loss: 0.9934, test_f1: 0.6285
 epoch: 68, train_loss: 0.4427, test_loss: 1.1733, test_f1: 0.6505
 epoch: 69, train_loss: 0.4408, test_loss: 1.0758, test_f1: 0.6649
 epoch: 70, train_loss: 0.4767, test_loss: 0.9317, test_f1: 0.6310
 epoch: 71, train_loss: 0.4436, test_loss: 1.2421, test_f1: 0.6547
 epoch: 72, train_loss: 0.4525, test_loss: 1.1067, test_f1: 0.6612
 epoch: 73, train_loss: 0.4085, test_loss: 0.9784, test_f1: 0.6643
 epoch: 74, train_loss: 0.4214, test_loss: 1.0943, test_f1: 0.6780
 epoch: 75, train_loss: 0.4277, test_loss: 1.2469, test_f1: 0.6374
 epoch: 76, train_loss: 0.4290, test_loss: 1.0997, test_f1: 0.6880
 epoch: 77, train_loss: 0.4144, test_loss: 1.3104, test_f1: 0.6548
 epoch: 78, train_loss: 0.4172, test_loss: 2.7814, test_f1: 0.6534
 epoch: 79, train_loss: 0.4039, test_loss: 1.0661, test_f1: 0.6719
 epoch: 80, train_loss: 0.3921, test_loss: 1.2494, test_f1: 0.6283
 epoch: 81, train_loss: 0.3877, test_loss: 1.1992, test_f1: 0.6535
 epoch: 82, train_loss: 0.3799, test_loss: 1.1537, test_f1: 0.6731
 epoch: 83, train_loss: 0.3767, test_loss: 1.2132, test_f1: 0.6224
 epoch: 84, train_loss: 0.4047, test_loss: 1.3168, test_f1: 0.6492
 epoch: 85, train_loss: 0.3737, test_loss: 1.0072, test_f1: 0.6637
 epoch: 86, train_loss: 0.4046, test_loss: 1.0802, test_f1: 0.6336
 epoch: 87, train_loss: 0.3789, test_loss: 0.9764, test_f1: 0.6604
 epoch: 88, train_loss: 0.3642, test_loss: 1.0721, test_f1: 0.6615
 epoch: 89, train_loss: 0.3630, test_loss: 1.1947, test_f1: 0.6548
 epoch: 90, train_loss: 0.3716, test_loss: 1.2291, test_f1: 0.6462
 epoch: 91, train_loss: 0.3581, test_loss: 1.1544, test_f1: 0.6493
 epoch: 92, train_loss: 0.3646, test_loss: 1.2884, test_f1: 0.6729
 epoch: 93, train_loss: 0.3508, test_loss: 1.1891, test_f1: 0.6481
 epoch: 94, train_loss: 0.3289, test_loss: 1.1130, test_f1: 0.6549
 epoch: 95, train_loss: 0.3590, test_loss: 1.4285, test_f1: 0.6122
 epoch: 96, train_loss: 0.3674, test_loss: 1.1712, test_f1: 0.6609
 epoch: 97, train_loss: 0.3627, test_loss: 1.1154, test_f1: 0.6637
 epoch: 98, train_loss: 0.3785, test_loss: 1.4000, test_f1: 0.6684
 epoch: 99, train_loss: 0.3427, test_loss: 1.2605, test_f1: 0.6502

Training completed in 612.67 seconds
Best F1: 0.7165 at epoch 56
Mean F1 across iterations: 0.6942  0.0140
========================FINAL RESULTS================================
FEGIN weighted F1: 0.7165  0.0140
python main.py --data ltspice_examples --representation component_pin_net --model FEGIN --layers 6 --hiddens 128 --batch_size 128 --lr 0.01 --emb_size 250 --epochs 100 --save_appendix component_pin_net_L6_H128_BS128_LR0.01_E250 --no_val
-----



STDERR:
  File "main.py", line 370, in <module>
    main()
  File "main.py", line 254, in main
    dataset = dataset_class(
  File "/home/philip/projects/ltspice_examples_code_repo/Circuit-Completion-Using-GNNs/component_classification_with_link_prediction_head/evaluation/FEGIN/kernel/circuit_datasets.py", line 15, in __init__
    self.data, self.slices = torch.load(self.processed_paths[0])
  File "/home/philip/.local/lib/python3.8/site-packages/torch/serialization.py", line 1040, in load
    warnings.warn(
  File "/usr/lib/python3.8/warnings.py", line 109, in _showwarnmsg
    sw(msg.message, msg.category, msg.filename, msg.lineno,
  File "main.py", line 47, in warn_with_traceback
    traceback.print_stack(file=log)
/home/philip/projects/ltspice_examples_code_repo/Circuit-Completion-Using-GNNs/component_classification_with_link_prediction_head/evaluation/FEGIN/kernel/circuit_datasets.py:15: FutureWarning: You are using `torch.load` with `weights_only=False` (the current default value), which uses the default pickle module implicitly. It is possible to construct malicious pickle data which will execute arbitrary code during unpickling (See https://github.com/pytorch/pytorch/blob/main/SECURITY.md#untrusted-models for more details). In a future release, the default value for `weights_only` will be flipped to `True`. This limits the functions that could be executed during unpickling. Arbitrary objects will no longer be allowed to be loaded via this mode unless they are explicitly allowlisted by the user via `torch.serialization.add_safe_globals`. We recommend you start setting `weights_only=True` for any use case where you don't have full control of the loaded file. Please open an issue on GitHub for any issues related to this experimental feature.
  self.data, self.slices = torch.load(self.processed_paths[0])
