STDOUT:
Results will be saved in /home/philip/projects/llm_inference_code_repo/Circuit-Completion-Using-GNNs/component_classification_with_link_prediction_head/evaluation/FEGIN/results/model_FEGIN_dataset_ltspice_examples
Command line input: python main.py --data ltspice_examples --representation component_net --model FEGIN --layers 2 --hiddens 128 --batch_size 256 --lr 0.001 --emb_size 250 --epochs 100 --save_appendix component_net_L2_H128_BS256_LR0.001_E250 --no_val
 is saved.
-----
ltspice_examples - FEGIN
Using 2 layers, 128 hidden units, h = 2
Loading component_net representation dataset
ENTERED
Training FEGIN on component_net representation
Train: 3558, Test: 846
##################ITERATION #0 ****************************************
 epoch: 0, train_loss: 1.3040, test_loss: 1.2995, test_f1: 0.2270
 epoch: 1, train_loss: 1.1843, test_loss: 1.2427, test_f1: 0.2408
 epoch: 2, train_loss: 1.0983, test_loss: 1.0928, test_f1: 0.4030
 epoch: 3, train_loss: 1.0196, test_loss: 1.0576, test_f1: 0.4124
 epoch: 4, train_loss: 0.9762, test_loss: 1.0060, test_f1: 0.4782
 epoch: 5, train_loss: 0.9402, test_loss: 0.9423, test_f1: 0.4925
 epoch: 6, train_loss: 0.9261, test_loss: 0.9261, test_f1: 0.5056
 epoch: 7, train_loss: 0.9056, test_loss: 0.8986, test_f1: 0.5286
 epoch: 8, train_loss: 0.8740, test_loss: 0.9506, test_f1: 0.5071
 epoch: 9, train_loss: 0.8651, test_loss: 0.8923, test_f1: 0.5133
 epoch: 10, train_loss: 0.8398, test_loss: 0.9101, test_f1: 0.5145
 epoch: 11, train_loss: 0.8171, test_loss: 0.9708, test_f1: 0.5443
 epoch: 12, train_loss: 0.8141, test_loss: 0.9573, test_f1: 0.5404
 epoch: 13, train_loss: 0.8131, test_loss: 0.9879, test_f1: 0.5392
 epoch: 14, train_loss: 0.7954, test_loss: 0.9477, test_f1: 0.5576
 epoch: 15, train_loss: 0.7744, test_loss: 0.8877, test_f1: 0.5745
 epoch: 16, train_loss: 0.7635, test_loss: 0.9955, test_f1: 0.5548
 epoch: 17, train_loss: 0.7514, test_loss: 0.9236, test_f1: 0.5961
 epoch: 18, train_loss: 0.7489, test_loss: 0.9959, test_f1: 0.5021
 epoch: 19, train_loss: 0.7470, test_loss: 0.9265, test_f1: 0.5566
 epoch: 20, train_loss: 0.7258, test_loss: 0.9499, test_f1: 0.6016
 epoch: 21, train_loss: 0.7118, test_loss: 0.9690, test_f1: 0.5970
 epoch: 22, train_loss: 0.6989, test_loss: 0.9716, test_f1: 0.5949
 epoch: 23, train_loss: 0.6915, test_loss: 1.0118, test_f1: 0.6159
 epoch: 24, train_loss: 0.6975, test_loss: 1.1288, test_f1: 0.5284
 epoch: 25, train_loss: 0.6853, test_loss: 1.0387, test_f1: 0.6065
 epoch: 26, train_loss: 0.6789, test_loss: 1.0115, test_f1: 0.6134
 epoch: 27, train_loss: 0.6612, test_loss: 1.1096, test_f1: 0.6025
 epoch: 28, train_loss: 0.6522, test_loss: 1.1196, test_f1: 0.5800
 epoch: 29, train_loss: 0.6369, test_loss: 1.0345, test_f1: 0.6234
 epoch: 30, train_loss: 0.6249, test_loss: 1.0802, test_f1: 0.6075
 epoch: 31, train_loss: 0.6173, test_loss: 1.1603, test_f1: 0.5982
 epoch: 32, train_loss: 0.6188, test_loss: 1.0867, test_f1: 0.6163
 epoch: 33, train_loss: 0.6066, test_loss: 1.1416, test_f1: 0.6019
 epoch: 34, train_loss: 0.6015, test_loss: 1.2248, test_f1: 0.6174
 epoch: 35, train_loss: 0.5753, test_loss: 1.1520, test_f1: 0.6205
 epoch: 36, train_loss: 0.5656, test_loss: 1.1644, test_f1: 0.6281
 epoch: 37, train_loss: 0.5847, test_loss: 1.1983, test_f1: 0.6160
 epoch: 38, train_loss: 0.5706, test_loss: 1.2539, test_f1: 0.5913
 epoch: 39, train_loss: 0.5631, test_loss: 1.1458, test_f1: 0.6021
 epoch: 40, train_loss: 0.5553, test_loss: 1.3318, test_f1: 0.5842
 epoch: 41, train_loss: 0.5561, test_loss: 1.2039, test_f1: 0.6409
 epoch: 42, train_loss: 0.5408, test_loss: 1.2729, test_f1: 0.5955
 epoch: 43, train_loss: 0.5452, test_loss: 1.2625, test_f1: 0.6083
 epoch: 44, train_loss: 0.5240, test_loss: 1.1867, test_f1: 0.6394
 epoch: 45, train_loss: 0.5186, test_loss: 1.1979, test_f1: 0.6569
 epoch: 46, train_loss: 0.5240, test_loss: 1.2558, test_f1: 0.6642
 epoch: 47, train_loss: 0.4984, test_loss: 1.3160, test_f1: 0.6076
 epoch: 48, train_loss: 0.4855, test_loss: 1.3314, test_f1: 0.6059
 epoch: 49, train_loss: 0.4868, test_loss: 1.3715, test_f1: 0.6344
 epoch: 50, train_loss: 0.4696, test_loss: 1.3373, test_f1: 0.6483
 epoch: 51, train_loss: 0.4413, test_loss: 1.2983, test_f1: 0.6665
 epoch: 52, train_loss: 0.4332, test_loss: 1.3287, test_f1: 0.6739
 epoch: 53, train_loss: 0.4086, test_loss: 1.3396, test_f1: 0.6768
 epoch: 54, train_loss: 0.4164, test_loss: 1.3867, test_f1: 0.6770
 epoch: 55, train_loss: 0.4083, test_loss: 1.4588, test_f1: 0.6779
 epoch: 56, train_loss: 0.4007, test_loss: 1.4470, test_f1: 0.6530
 epoch: 57, train_loss: 0.4134, test_loss: 1.4073, test_f1: 0.6343
 epoch: 58, train_loss: 0.3971, test_loss: 1.3272, test_f1: 0.6784
 epoch: 59, train_loss: 0.4005, test_loss: 1.4579, test_f1: 0.6514
 epoch: 60, train_loss: 0.3856, test_loss: 1.5926, test_f1: 0.6644
 epoch: 61, train_loss: 0.3620, test_loss: 1.4251, test_f1: 0.6873
 epoch: 62, train_loss: 0.3719, test_loss: 1.5386, test_f1: 0.6672
 epoch: 63, train_loss: 0.3608, test_loss: 1.5416, test_f1: 0.6696
 epoch: 64, train_loss: 0.3784, test_loss: 1.5657, test_f1: 0.6743
 epoch: 65, train_loss: 0.3525, test_loss: 1.6319, test_f1: 0.6811
 epoch: 66, train_loss: 0.3509, test_loss: 1.5058, test_f1: 0.6605
 epoch: 67, train_loss: 0.3453, test_loss: 1.5348, test_f1: 0.6703
 epoch: 68, train_loss: 0.3505, test_loss: 1.4907, test_f1: 0.6731
 epoch: 69, train_loss: 0.3512, test_loss: 1.7111, test_f1: 0.6256
 epoch: 70, train_loss: 0.3510, test_loss: 1.5856, test_f1: 0.6465
 epoch: 71, train_loss: 0.3377, test_loss: 1.6110, test_f1: 0.6595
 epoch: 72, train_loss: 0.3425, test_loss: 1.5676, test_f1: 0.6916
 epoch: 73, train_loss: 0.3257, test_loss: 1.7016, test_f1: 0.6497
 epoch: 74, train_loss: 0.3232, test_loss: 1.6651, test_f1: 0.6896
 epoch: 75, train_loss: 0.3240, test_loss: 1.8528, test_f1: 0.6633
 epoch: 76, train_loss: 0.3404, test_loss: 1.7181, test_f1: 0.6267
 epoch: 77, train_loss: 0.3159, test_loss: 1.7669, test_f1: 0.6598
 epoch: 78, train_loss: 0.3268, test_loss: 1.7141, test_f1: 0.6626
 epoch: 79, train_loss: 0.3156, test_loss: 1.8303, test_f1: 0.6772
 epoch: 80, train_loss: 0.3151, test_loss: 1.7375, test_f1: 0.6503
 epoch: 81, train_loss: 0.3099, test_loss: 1.7084, test_f1: 0.6415
 epoch: 82, train_loss: 0.3237, test_loss: 1.7429, test_f1: 0.6367
 epoch: 83, train_loss: 0.2926, test_loss: 1.8181, test_f1: 0.6696
 epoch: 84, train_loss: 0.2948, test_loss: 1.7869, test_f1: 0.6830
 epoch: 85, train_loss: 0.2916, test_loss: 1.8881, test_f1: 0.6683
 epoch: 86, train_loss: 0.3001, test_loss: 1.8064, test_f1: 0.6740
 epoch: 87, train_loss: 0.2886, test_loss: 1.8338, test_f1: 0.6536
 epoch: 88, train_loss: 0.2901, test_loss: 1.8505, test_f1: 0.6776
 epoch: 89, train_loss: 0.2805, test_loss: 1.8408, test_f1: 0.6696
 epoch: 90, train_loss: 0.3001, test_loss: 1.8475, test_f1: 0.6525
 epoch: 91, train_loss: 0.2827, test_loss: 1.8801, test_f1: 0.6764
 epoch: 92, train_loss: 0.2719, test_loss: 2.0121, test_f1: 0.6618
 epoch: 93, train_loss: 0.2637, test_loss: 1.8156, test_f1: 0.6807
 epoch: 94, train_loss: 0.2612, test_loss: 1.9479, test_f1: 0.6637
 epoch: 95, train_loss: 0.2731, test_loss: 1.9161, test_f1: 0.6735
 epoch: 96, train_loss: 0.2544, test_loss: 1.8434, test_f1: 0.6710
 epoch: 97, train_loss: 0.2752, test_loss: 1.9964, test_f1: 0.6789
 epoch: 98, train_loss: 0.2625, test_loss: 1.9627, test_f1: 0.6533
 epoch: 99, train_loss: 0.2541, test_loss: 2.0045, test_f1: 0.6793
##################ITERATION #1 ****************************************
 epoch: 0, train_loss: 1.1939, test_loss: 1.2488, test_f1: 0.2270
 epoch: 1, train_loss: 1.0235, test_loss: 1.1083, test_f1: 0.3400
 epoch: 2, train_loss: 0.9624, test_loss: 1.0175, test_f1: 0.3991
 epoch: 3, train_loss: 0.9245, test_loss: 0.9926, test_f1: 0.4411
 epoch: 4, train_loss: 0.9095, test_loss: 0.9261, test_f1: 0.4790
 epoch: 5, train_loss: 0.8871, test_loss: 0.8969, test_f1: 0.5425
 epoch: 6, train_loss: 0.8677, test_loss: 0.9084, test_f1: 0.5548
 epoch: 7, train_loss: 0.8486, test_loss: 0.8963, test_f1: 0.5602
 epoch: 8, train_loss: 0.8300, test_loss: 1.0621, test_f1: 0.4859
 epoch: 9, train_loss: 0.8099, test_loss: 0.8370, test_f1: 0.5913
 epoch: 10, train_loss: 0.7985, test_loss: 0.9078, test_f1: 0.5803
 epoch: 11, train_loss: 0.7955, test_loss: 0.9478, test_f1: 0.5646
 epoch: 12, train_loss: 0.7866, test_loss: 0.8880, test_f1: 0.5631
 epoch: 13, train_loss: 0.7665, test_loss: 0.8803, test_f1: 0.6087
 epoch: 14, train_loss: 0.7509, test_loss: 0.8851, test_f1: 0.6006
 epoch: 15, train_loss: 0.7640, test_loss: 0.9149, test_f1: 0.5812
 epoch: 16, train_loss: 0.7419, test_loss: 0.9760, test_f1: 0.5711
 epoch: 17, train_loss: 0.7333, test_loss: 0.9319, test_f1: 0.5850
 epoch: 18, train_loss: 0.7272, test_loss: 0.8920, test_f1: 0.6594
 epoch: 19, train_loss: 0.7091, test_loss: 0.9277, test_f1: 0.5831
 epoch: 20, train_loss: 0.7091, test_loss: 1.0032, test_f1: 0.5711
 epoch: 21, train_loss: 0.6905, test_loss: 0.8668, test_f1: 0.6208
 epoch: 22, train_loss: 0.6904, test_loss: 0.9574, test_f1: 0.5305
 epoch: 23, train_loss: 0.6826, test_loss: 0.8804, test_f1: 0.6331
 epoch: 24, train_loss: 0.6686, test_loss: 1.0144, test_f1: 0.6069
 epoch: 25, train_loss: 0.6619, test_loss: 0.9164, test_f1: 0.6076
 epoch: 26, train_loss: 0.6488, test_loss: 0.9965, test_f1: 0.5683
 epoch: 27, train_loss: 0.6554, test_loss: 0.9580, test_f1: 0.6139
 epoch: 28, train_loss: 0.6485, test_loss: 1.0723, test_f1: 0.6000
 epoch: 29, train_loss: 0.6514, test_loss: 1.0159, test_f1: 0.5933
 epoch: 30, train_loss: 0.6296, test_loss: 1.0488, test_f1: 0.6202
 epoch: 31, train_loss: 0.6294, test_loss: 0.9222, test_f1: 0.6385
 epoch: 32, train_loss: 0.6214, test_loss: 0.9526, test_f1: 0.6418
 epoch: 33, train_loss: 0.5901, test_loss: 0.9507, test_f1: 0.6690
 epoch: 34, train_loss: 0.5634, test_loss: 1.0052, test_f1: 0.6410
 epoch: 35, train_loss: 0.5786, test_loss: 1.0367, test_f1: 0.6488
 epoch: 36, train_loss: 0.5444, test_loss: 1.1145, test_f1: 0.6199
 epoch: 37, train_loss: 0.5826, test_loss: 0.9331, test_f1: 0.6525
 epoch: 38, train_loss: 0.5564, test_loss: 1.2795, test_f1: 0.6102
 epoch: 39, train_loss: 0.5493, test_loss: 0.9658, test_f1: 0.6504
 epoch: 40, train_loss: 0.5498, test_loss: 1.0670, test_f1: 0.6690
 epoch: 41, train_loss: 0.5297, test_loss: 1.1266, test_f1: 0.6712
 epoch: 42, train_loss: 0.4970, test_loss: 1.0259, test_f1: 0.6726
 epoch: 43, train_loss: 0.5014, test_loss: 1.0413, test_f1: 0.6624
 epoch: 44, train_loss: 0.4748, test_loss: 1.2179, test_f1: 0.6428
 epoch: 45, train_loss: 0.4877, test_loss: 1.2508, test_f1: 0.6517
 epoch: 46, train_loss: 0.5024, test_loss: 1.0054, test_f1: 0.6833
 epoch: 47, train_loss: 0.4946, test_loss: 1.2449, test_f1: 0.6298
 epoch: 48, train_loss: 0.4763, test_loss: 1.0568, test_f1: 0.6879
 epoch: 49, train_loss: 0.4546, test_loss: 1.1315, test_f1: 0.6743
 epoch: 50, train_loss: 0.4600, test_loss: 1.2149, test_f1: 0.6632
 epoch: 51, train_loss: 0.4321, test_loss: 1.0502, test_f1: 0.6747
 epoch: 52, train_loss: 0.4106, test_loss: 1.1770, test_f1: 0.6577
 epoch: 53, train_loss: 0.3925, test_loss: 1.1359, test_f1: 0.6598
 epoch: 54, train_loss: 0.3843, test_loss: 1.2222, test_f1: 0.6771
 epoch: 55, train_loss: 0.3755, test_loss: 1.1984, test_f1: 0.6867
 epoch: 56, train_loss: 0.3846, test_loss: 1.2281, test_f1: 0.6918
 epoch: 57, train_loss: 0.3678, test_loss: 1.1982, test_f1: 0.6856
 epoch: 58, train_loss: 0.3763, test_loss: 1.2437, test_f1: 0.7034
 epoch: 59, train_loss: 0.3657, test_loss: 1.2172, test_f1: 0.7122
 epoch: 60, train_loss: 0.3645, test_loss: 1.2226, test_f1: 0.6925
 epoch: 61, train_loss: 0.3618, test_loss: 1.3228, test_f1: 0.6554
 epoch: 62, train_loss: 0.3512, test_loss: 1.3209, test_f1: 0.6789
 epoch: 63, train_loss: 0.3521, test_loss: 1.3401, test_f1: 0.6897
 epoch: 64, train_loss: 0.3300, test_loss: 1.2988, test_f1: 0.6951
 epoch: 65, train_loss: 0.3374, test_loss: 1.3827, test_f1: 0.6600
 epoch: 66, train_loss: 0.3459, test_loss: 1.3474, test_f1: 0.6890
 epoch: 67, train_loss: 0.3323, test_loss: 1.4103, test_f1: 0.6782
 epoch: 68, train_loss: 0.3275, test_loss: 1.3786, test_f1: 0.6980
 epoch: 69, train_loss: 0.3333, test_loss: 1.3804, test_f1: 0.6816
 epoch: 70, train_loss: 0.3199, test_loss: 1.5181, test_f1: 0.6336
 epoch: 71, train_loss: 0.3371, test_loss: 1.4088, test_f1: 0.7109
 epoch: 72, train_loss: 0.3113, test_loss: 1.3605, test_f1: 0.6922
 epoch: 73, train_loss: 0.2987, test_loss: 1.5237, test_f1: 0.6897
 epoch: 74, train_loss: 0.2984, test_loss: 1.4664, test_f1: 0.6869
 epoch: 75, train_loss: 0.3012, test_loss: 1.4725, test_f1: 0.6633
 epoch: 76, train_loss: 0.3001, test_loss: 1.4636, test_f1: 0.6889
 epoch: 77, train_loss: 0.3012, test_loss: 1.5529, test_f1: 0.6666
 epoch: 78, train_loss: 0.3071, test_loss: 1.4620, test_f1: 0.6970
 epoch: 79, train_loss: 0.3053, test_loss: 1.6067, test_f1: 0.6709
 epoch: 80, train_loss: 0.3148, test_loss: 1.6367, test_f1: 0.6804
 epoch: 81, train_loss: 0.3034, test_loss: 1.5341, test_f1: 0.6871
 epoch: 82, train_loss: 0.2841, test_loss: 1.5558, test_f1: 0.6733
 epoch: 83, train_loss: 0.2863, test_loss: 1.6273, test_f1: 0.6535
 epoch: 84, train_loss: 0.2818, test_loss: 1.5186, test_f1: 0.6675
 epoch: 85, train_loss: 0.2873, test_loss: 1.7092, test_f1: 0.6733
 epoch: 86, train_loss: 0.2620, test_loss: 1.6191, test_f1: 0.6919
 epoch: 87, train_loss: 0.2640, test_loss: 1.6476, test_f1: 0.6833
 epoch: 88, train_loss: 0.2601, test_loss: 1.5935, test_f1: 0.6850
 epoch: 89, train_loss: 0.2556, test_loss: 1.6104, test_f1: 0.6753
 epoch: 90, train_loss: 0.2461, test_loss: 1.8060, test_f1: 0.6609
 epoch: 91, train_loss: 0.2697, test_loss: 1.6941, test_f1: 0.6710
 epoch: 92, train_loss: 0.2546, test_loss: 1.7419, test_f1: 0.6500
 epoch: 93, train_loss: 0.2403, test_loss: 1.7414, test_f1: 0.6734
 epoch: 94, train_loss: 0.2689, test_loss: 1.6389, test_f1: 0.6619
 epoch: 95, train_loss: 0.2671, test_loss: 1.5272, test_f1: 0.6943
 epoch: 96, train_loss: 0.2698, test_loss: 1.5912, test_f1: 0.6643
 epoch: 97, train_loss: 0.2535, test_loss: 1.9065, test_f1: 0.6622
 epoch: 98, train_loss: 0.2506, test_loss: 1.8494, test_f1: 0.6784
 epoch: 99, train_loss: 0.2510, test_loss: 1.6211, test_f1: 0.6636
##################ITERATION #2 ****************************************
 epoch: 0, train_loss: 1.2369, test_loss: 1.2697, test_f1: 0.2270
 epoch: 1, train_loss: 1.0292, test_loss: 1.1323, test_f1: 0.3222
 epoch: 2, train_loss: 0.9736, test_loss: 1.0305, test_f1: 0.3963
 epoch: 3, train_loss: 0.9353, test_loss: 0.9794, test_f1: 0.4472
 epoch: 4, train_loss: 0.9052, test_loss: 0.9418, test_f1: 0.5290
 epoch: 5, train_loss: 0.8897, test_loss: 0.9539, test_f1: 0.5366
 epoch: 6, train_loss: 0.8598, test_loss: 0.9237, test_f1: 0.5240
 epoch: 7, train_loss: 0.8474, test_loss: 0.8552, test_f1: 0.5567
 epoch: 8, train_loss: 0.8391, test_loss: 0.9202, test_f1: 0.5368
 epoch: 9, train_loss: 0.8336, test_loss: 0.8802, test_f1: 0.5941
 epoch: 10, train_loss: 0.8196, test_loss: 0.8306, test_f1: 0.6126
 epoch: 11, train_loss: 0.7972, test_loss: 0.9468, test_f1: 0.5709
 epoch: 12, train_loss: 0.8017, test_loss: 0.8927, test_f1: 0.5981
 epoch: 13, train_loss: 0.7614, test_loss: 0.9159, test_f1: 0.5902
 epoch: 14, train_loss: 0.7629, test_loss: 0.9436, test_f1: 0.5739
 epoch: 15, train_loss: 0.7472, test_loss: 0.9689, test_f1: 0.5843
 epoch: 16, train_loss: 0.7330, test_loss: 0.9307, test_f1: 0.5812
 epoch: 17, train_loss: 0.7256, test_loss: 0.9583, test_f1: 0.5826
 epoch: 18, train_loss: 0.7156, test_loss: 0.9310, test_f1: 0.5712
 epoch: 19, train_loss: 0.7135, test_loss: 0.9963, test_f1: 0.5941
 epoch: 20, train_loss: 0.6996, test_loss: 0.8942, test_f1: 0.6222
 epoch: 21, train_loss: 0.6936, test_loss: 0.9690, test_f1: 0.6118
 epoch: 22, train_loss: 0.6830, test_loss: 0.9570, test_f1: 0.5804
 epoch: 23, train_loss: 0.6736, test_loss: 0.8637, test_f1: 0.5860
 epoch: 24, train_loss: 0.6547, test_loss: 0.9672, test_f1: 0.6163
 epoch: 25, train_loss: 0.6578, test_loss: 0.9403, test_f1: 0.6241
 epoch: 26, train_loss: 0.6514, test_loss: 1.1085, test_f1: 0.5796
 epoch: 27, train_loss: 0.6535, test_loss: 1.0780, test_f1: 0.5537
 epoch: 28, train_loss: 0.6546, test_loss: 0.9455, test_f1: 0.6446
 epoch: 29, train_loss: 0.6312, test_loss: 0.9508, test_f1: 0.5890
 epoch: 30, train_loss: 0.6258, test_loss: 1.0003, test_f1: 0.5795
 epoch: 31, train_loss: 0.5999, test_loss: 0.9891, test_f1: 0.6320
 epoch: 32, train_loss: 0.5908, test_loss: 1.0338, test_f1: 0.6474
 epoch: 33, train_loss: 0.5979, test_loss: 0.9746, test_f1: 0.6106
 epoch: 34, train_loss: 0.5968, test_loss: 1.0372, test_f1: 0.6089
 epoch: 35, train_loss: 0.5789, test_loss: 1.0537, test_f1: 0.6295
 epoch: 36, train_loss: 0.5518, test_loss: 1.0340, test_f1: 0.6396
 epoch: 37, train_loss: 0.5572, test_loss: 1.0470, test_f1: 0.6271
 epoch: 38, train_loss: 0.5325, test_loss: 1.1214, test_f1: 0.6123
 epoch: 39, train_loss: 0.5247, test_loss: 1.0261, test_f1: 0.6477
 epoch: 40, train_loss: 0.5408, test_loss: 1.1255, test_f1: 0.6060
 epoch: 41, train_loss: 0.5427, test_loss: 1.0792, test_f1: 0.6375
 epoch: 42, train_loss: 0.5156, test_loss: 1.1379, test_f1: 0.6559
 epoch: 43, train_loss: 0.5082, test_loss: 1.0902, test_f1: 0.6450
 epoch: 44, train_loss: 0.4989, test_loss: 0.9655, test_f1: 0.6617
 epoch: 45, train_loss: 0.4852, test_loss: 1.0720, test_f1: 0.6374
 epoch: 46, train_loss: 0.4891, test_loss: 1.1066, test_f1: 0.6607
 epoch: 47, train_loss: 0.4678, test_loss: 1.1652, test_f1: 0.6454
 epoch: 48, train_loss: 0.4836, test_loss: 1.1161, test_f1: 0.6832
 epoch: 49, train_loss: 0.4978, test_loss: 1.1335, test_f1: 0.6454
 epoch: 50, train_loss: 0.4817, test_loss: 1.2166, test_f1: 0.6523
 epoch: 51, train_loss: 0.4440, test_loss: 1.1087, test_f1: 0.6623
 epoch: 52, train_loss: 0.4228, test_loss: 1.0989, test_f1: 0.6691
 epoch: 53, train_loss: 0.4025, test_loss: 1.1768, test_f1: 0.6695
 epoch: 54, train_loss: 0.4011, test_loss: 1.2296, test_f1: 0.6615
 epoch: 55, train_loss: 0.4012, test_loss: 1.2128, test_f1: 0.6679
 epoch: 56, train_loss: 0.3941, test_loss: 1.2273, test_f1: 0.6629
 epoch: 57, train_loss: 0.3977, test_loss: 1.1942, test_f1: 0.6681
 epoch: 58, train_loss: 0.3904, test_loss: 1.2324, test_f1: 0.6774
 epoch: 59, train_loss: 0.3907, test_loss: 1.3041, test_f1: 0.6421
 epoch: 60, train_loss: 0.3837, test_loss: 1.2701, test_f1: 0.6743
 epoch: 61, train_loss: 0.3735, test_loss: 1.3107, test_f1: 0.6794
 epoch: 62, train_loss: 0.3702, test_loss: 1.2902, test_f1: 0.6533
 epoch: 63, train_loss: 0.3599, test_loss: 1.3027, test_f1: 0.6711
 epoch: 64, train_loss: 0.3574, test_loss: 1.3838, test_f1: 0.6427
 epoch: 65, train_loss: 0.3518, test_loss: 1.4366, test_f1: 0.6373
 epoch: 66, train_loss: 0.3635, test_loss: 1.3654, test_f1: 0.6564
 epoch: 67, train_loss: 0.3324, test_loss: 1.2896, test_f1: 0.6780
 epoch: 68, train_loss: 0.3349, test_loss: 1.3777, test_f1: 0.6485
 epoch: 69, train_loss: 0.3607, test_loss: 1.4033, test_f1: 0.6629
 epoch: 70, train_loss: 0.3388, test_loss: 1.3495, test_f1: 0.6685
 epoch: 71, train_loss: 0.3370, test_loss: 1.3348, test_f1: 0.6490
 epoch: 72, train_loss: 0.3349, test_loss: 1.3792, test_f1: 0.6740
 epoch: 73, train_loss: 0.3299, test_loss: 1.4495, test_f1: 0.6554
 epoch: 74, train_loss: 0.3272, test_loss: 1.4540, test_f1: 0.6525
 epoch: 75, train_loss: 0.3189, test_loss: 1.5140, test_f1: 0.6568
 epoch: 76, train_loss: 0.3323, test_loss: 1.5518, test_f1: 0.6433
 epoch: 77, train_loss: 0.3163, test_loss: 1.5262, test_f1: 0.6595
 epoch: 78, train_loss: 0.3027, test_loss: 1.4759, test_f1: 0.6469
 epoch: 79, train_loss: 0.2938, test_loss: 1.6153, test_f1: 0.6386
 epoch: 80, train_loss: 0.3102, test_loss: 1.5129, test_f1: 0.6614
 epoch: 81, train_loss: 0.2814, test_loss: 1.5037, test_f1: 0.6635
 epoch: 82, train_loss: 0.3030, test_loss: 1.5626, test_f1: 0.6420
 epoch: 83, train_loss: 0.3025, test_loss: 1.6454, test_f1: 0.6545
 epoch: 84, train_loss: 0.3060, test_loss: 1.6164, test_f1: 0.6487
 epoch: 85, train_loss: 0.2795, test_loss: 1.7072, test_f1: 0.6621
 epoch: 86, train_loss: 0.2864, test_loss: 1.5861, test_f1: 0.6608
 epoch: 87, train_loss: 0.2749, test_loss: 1.6226, test_f1: 0.6594
 epoch: 88, train_loss: 0.2821, test_loss: 1.8009, test_f1: 0.6362
 epoch: 89, train_loss: 0.2913, test_loss: 1.5183, test_f1: 0.6413
 epoch: 90, train_loss: 0.3027, test_loss: 1.7643, test_f1: 0.6254
 epoch: 91, train_loss: 0.2808, test_loss: 1.7222, test_f1: 0.6548
 epoch: 92, train_loss: 0.2824, test_loss: 1.6489, test_f1: 0.6457
 epoch: 93, train_loss: 0.2878, test_loss: 1.5867, test_f1: 0.6494
 epoch: 94, train_loss: 0.2641, test_loss: 1.6512, test_f1: 0.6747
 epoch: 95, train_loss: 0.2709, test_loss: 1.8184, test_f1: 0.6481
 epoch: 96, train_loss: 0.2544, test_loss: 1.8057, test_f1: 0.6430
 epoch: 97, train_loss: 0.2585, test_loss: 1.6518, test_f1: 0.6499
 epoch: 98, train_loss: 0.2654, test_loss: 1.8964, test_f1: 0.6355
 epoch: 99, train_loss: 0.2580, test_loss: 1.8442, test_f1: 0.6523
##################ITERATION #3 ****************************************
 epoch: 0, train_loss: 1.3132, test_loss: 1.3221, test_f1: 0.2270
 epoch: 1, train_loss: 1.0671, test_loss: 1.2019, test_f1: 0.2416
 epoch: 2, train_loss: 0.9908, test_loss: 1.0452, test_f1: 0.3657
 epoch: 3, train_loss: 0.9405, test_loss: 0.9984, test_f1: 0.4528
 epoch: 4, train_loss: 0.9172, test_loss: 0.9415, test_f1: 0.5284
 epoch: 5, train_loss: 0.8884, test_loss: 0.9099, test_f1: 0.5282
 epoch: 6, train_loss: 0.8632, test_loss: 0.9130, test_f1: 0.5364
 epoch: 7, train_loss: 0.8512, test_loss: 0.8948, test_f1: 0.5633
 epoch: 8, train_loss: 0.8421, test_loss: 0.9299, test_f1: 0.5160
 epoch: 9, train_loss: 0.8177, test_loss: 0.9090, test_f1: 0.5601
 epoch: 10, train_loss: 0.7927, test_loss: 0.9332, test_f1: 0.5454
 epoch: 11, train_loss: 0.7950, test_loss: 0.9261, test_f1: 0.5977
 epoch: 12, train_loss: 0.7694, test_loss: 0.9098, test_f1: 0.5845
 epoch: 13, train_loss: 0.7578, test_loss: 0.9254, test_f1: 0.6136
 epoch: 14, train_loss: 0.7596, test_loss: 0.9121, test_f1: 0.6244
 epoch: 15, train_loss: 0.7514, test_loss: 0.9321, test_f1: 0.6034
 epoch: 16, train_loss: 0.7227, test_loss: 0.9035, test_f1: 0.6064
 epoch: 17, train_loss: 0.7217, test_loss: 0.9468, test_f1: 0.5938
 epoch: 18, train_loss: 0.7158, test_loss: 0.9763, test_f1: 0.5916
 epoch: 19, train_loss: 0.7100, test_loss: 0.9408, test_f1: 0.5890
 epoch: 20, train_loss: 0.6973, test_loss: 0.9594, test_f1: 0.6290
 epoch: 21, train_loss: 0.6781, test_loss: 1.0676, test_f1: 0.5779
 epoch: 22, train_loss: 0.6746, test_loss: 0.9394, test_f1: 0.6452
 epoch: 23, train_loss: 0.6663, test_loss: 0.9875, test_f1: 0.6062
 epoch: 24, train_loss: 0.6527, test_loss: 0.9458, test_f1: 0.5855
 epoch: 25, train_loss: 0.6427, test_loss: 1.0022, test_f1: 0.6145
 epoch: 26, train_loss: 0.6327, test_loss: 1.0083, test_f1: 0.6307
 epoch: 27, train_loss: 0.6246, test_loss: 0.9787, test_f1: 0.6245
 epoch: 28, train_loss: 0.6165, test_loss: 1.0216, test_f1: 0.6175
 epoch: 29, train_loss: 0.6121, test_loss: 1.0195, test_f1: 0.6659
 epoch: 30, train_loss: 0.6161, test_loss: 1.0155, test_f1: 0.5952
 epoch: 31, train_loss: 0.5932, test_loss: 1.0280, test_f1: 0.6398
 epoch: 32, train_loss: 0.5846, test_loss: 1.0224, test_f1: 0.6192
 epoch: 33, train_loss: 0.5684, test_loss: 1.0214, test_f1: 0.6386
 epoch: 34, train_loss: 0.5685, test_loss: 1.1140, test_f1: 0.6467
 epoch: 35, train_loss: 0.5651, test_loss: 1.0351, test_f1: 0.6550
 epoch: 36, train_loss: 0.5515, test_loss: 1.0276, test_f1: 0.6378
 epoch: 37, train_loss: 0.5313, test_loss: 1.1279, test_f1: 0.6424
 epoch: 38, train_loss: 0.5318, test_loss: 1.1102, test_f1: 0.6519
 epoch: 39, train_loss: 0.5229, test_loss: 1.0277, test_f1: 0.6445
 epoch: 40, train_loss: 0.5178, test_loss: 1.3220, test_f1: 0.5953
 epoch: 41, train_loss: 0.5107, test_loss: 1.0792, test_f1: 0.6530
 epoch: 42, train_loss: 0.5168, test_loss: 1.1331, test_f1: 0.6390
 epoch: 43, train_loss: 0.5192, test_loss: 1.1423, test_f1: 0.6223
 epoch: 44, train_loss: 0.5045, test_loss: 1.1783, test_f1: 0.6233
 epoch: 45, train_loss: 0.4839, test_loss: 1.1046, test_f1: 0.6163
 epoch: 46, train_loss: 0.4800, test_loss: 1.1049, test_f1: 0.6274
 epoch: 47, train_loss: 0.4835, test_loss: 1.1366, test_f1: 0.6289
 epoch: 48, train_loss: 0.4483, test_loss: 1.1610, test_f1: 0.6378
 epoch: 49, train_loss: 0.4709, test_loss: 1.1918, test_f1: 0.6595
 epoch: 50, train_loss: 0.4556, test_loss: 1.1908, test_f1: 0.6492
 epoch: 51, train_loss: 0.4328, test_loss: 1.1813, test_f1: 0.6417
 epoch: 52, train_loss: 0.4070, test_loss: 1.2138, test_f1: 0.6375
 epoch: 53, train_loss: 0.3996, test_loss: 1.2590, test_f1: 0.6724
 epoch: 54, train_loss: 0.4076, test_loss: 1.2936, test_f1: 0.6158
 epoch: 55, train_loss: 0.3848, test_loss: 1.2441, test_f1: 0.6317
 epoch: 56, train_loss: 0.3964, test_loss: 1.2172, test_f1: 0.6578
 epoch: 57, train_loss: 0.3835, test_loss: 1.3128, test_f1: 0.6394
 epoch: 58, train_loss: 0.3771, test_loss: 1.2090, test_f1: 0.6621
 epoch: 59, train_loss: 0.3733, test_loss: 1.3593, test_f1: 0.6207
 epoch: 60, train_loss: 0.3594, test_loss: 1.3478, test_f1: 0.6363
 epoch: 61, train_loss: 0.3496, test_loss: 1.4003, test_f1: 0.6584
 epoch: 62, train_loss: 0.3506, test_loss: 1.3602, test_f1: 0.6496
 epoch: 63, train_loss: 0.3565, test_loss: 1.3906, test_f1: 0.6392
 epoch: 64, train_loss: 0.3451, test_loss: 1.2843, test_f1: 0.6581
 epoch: 65, train_loss: 0.3575, test_loss: 1.3526, test_f1: 0.6706
 epoch: 66, train_loss: 0.3326, test_loss: 1.3491, test_f1: 0.6417
 epoch: 67, train_loss: 0.3441, test_loss: 1.3496, test_f1: 0.6625
 epoch: 68, train_loss: 0.3239, test_loss: 1.3940, test_f1: 0.6378
 epoch: 69, train_loss: 0.3285, test_loss: 1.4673, test_f1: 0.6178
 epoch: 70, train_loss: 0.3221, test_loss: 1.3753, test_f1: 0.6600
 epoch: 71, train_loss: 0.3370, test_loss: 1.4066, test_f1: 0.6266
 epoch: 72, train_loss: 0.3169, test_loss: 1.4631, test_f1: 0.6460
 epoch: 73, train_loss: 0.3460, test_loss: 1.4034, test_f1: 0.6580
 epoch: 74, train_loss: 0.3305, test_loss: 1.4156, test_f1: 0.6800
 epoch: 75, train_loss: 0.3180, test_loss: 1.4165, test_f1: 0.6565
 epoch: 76, train_loss: 0.3153, test_loss: 1.4549, test_f1: 0.6488
 epoch: 77, train_loss: 0.3048, test_loss: 1.4238, test_f1: 0.6806
 epoch: 78, train_loss: 0.3100, test_loss: 1.4888, test_f1: 0.6498
 epoch: 79, train_loss: 0.3145, test_loss: 1.5058, test_f1: 0.6389
 epoch: 80, train_loss: 0.3088, test_loss: 1.4372, test_f1: 0.6493
 epoch: 81, train_loss: 0.2998, test_loss: 1.4639, test_f1: 0.6338
 epoch: 82, train_loss: 0.2866, test_loss: 1.5328, test_f1: 0.6405
 epoch: 83, train_loss: 0.2857, test_loss: 1.4855, test_f1: 0.6612
 epoch: 84, train_loss: 0.2929, test_loss: 1.4652, test_f1: 0.6711
 epoch: 85, train_loss: 0.2951, test_loss: 1.5985, test_f1: 0.6377
 epoch: 86, train_loss: 0.2972, test_loss: 1.5702, test_f1: 0.6419
 epoch: 87, train_loss: 0.2766, test_loss: 1.4516, test_f1: 0.6447
 epoch: 88, train_loss: 0.2636, test_loss: 1.5933, test_f1: 0.6486
 epoch: 89, train_loss: 0.2627, test_loss: 1.5406, test_f1: 0.6721
 epoch: 90, train_loss: 0.2554, test_loss: 1.6724, test_f1: 0.6477
 epoch: 91, train_loss: 0.2615, test_loss: 1.5924, test_f1: 0.6637
 epoch: 92, train_loss: 0.2581, test_loss: 1.6139, test_f1: 0.6516
 epoch: 93, train_loss: 0.2458, test_loss: 1.6129, test_f1: 0.6505
 epoch: 94, train_loss: 0.2451, test_loss: 1.5663, test_f1: 0.6645
 epoch: 95, train_loss: 0.2525, test_loss: 1.5885, test_f1: 0.6647
 epoch: 96, train_loss: 0.2535, test_loss: 1.6394, test_f1: 0.6671
 epoch: 97, train_loss: 0.2630, test_loss: 1.6383, test_f1: 0.6423
 epoch: 98, train_loss: 0.2477, test_loss: 1.6293, test_f1: 0.6727
 epoch: 99, train_loss: 0.2528, test_loss: 1.6385, test_f1: 0.6724
##################ITERATION #4 ****************************************
 epoch: 0, train_loss: 1.4198, test_loss: 1.3938, test_f1: 0.2270
 epoch: 1, train_loss: 1.0841, test_loss: 1.1326, test_f1: 0.3274
 epoch: 2, train_loss: 1.0075, test_loss: 1.0777, test_f1: 0.3545
 epoch: 3, train_loss: 0.9535, test_loss: 0.9872, test_f1: 0.4706
 epoch: 4, train_loss: 0.9312, test_loss: 0.9566, test_f1: 0.4741
 epoch: 5, train_loss: 0.8949, test_loss: 0.8905, test_f1: 0.5527
 epoch: 6, train_loss: 0.8735, test_loss: 0.8890, test_f1: 0.5853
 epoch: 7, train_loss: 0.8569, test_loss: 0.8702, test_f1: 0.5924
 epoch: 8, train_loss: 0.8591, test_loss: 0.9056, test_f1: 0.5489
 epoch: 9, train_loss: 0.8330, test_loss: 0.9228, test_f1: 0.5450
 epoch: 10, train_loss: 0.8173, test_loss: 0.8515, test_f1: 0.6135
 epoch: 11, train_loss: 0.8149, test_loss: 0.8786, test_f1: 0.5865
 epoch: 12, train_loss: 0.7962, test_loss: 0.8980, test_f1: 0.5760
 epoch: 13, train_loss: 0.7805, test_loss: 0.8801, test_f1: 0.6047
 epoch: 14, train_loss: 0.7809, test_loss: 0.8644, test_f1: 0.6178
 epoch: 15, train_loss: 0.7588, test_loss: 0.9365, test_f1: 0.5573
 epoch: 16, train_loss: 0.7465, test_loss: 0.8640, test_f1: 0.5914
 epoch: 17, train_loss: 0.7469, test_loss: 0.8304, test_f1: 0.5677
 epoch: 18, train_loss: 0.7203, test_loss: 0.8655, test_f1: 0.6025
 epoch: 19, train_loss: 0.7152, test_loss: 0.8474, test_f1: 0.6149
 epoch: 20, train_loss: 0.7047, test_loss: 0.9176, test_f1: 0.5865
 epoch: 21, train_loss: 0.7212, test_loss: 0.9371, test_f1: 0.5775
 epoch: 22, train_loss: 0.7140, test_loss: 0.8843, test_f1: 0.6650
 epoch: 23, train_loss: 0.6879, test_loss: 0.9150, test_f1: 0.5888
 epoch: 24, train_loss: 0.6993, test_loss: 0.9017, test_f1: 0.6160
 epoch: 25, train_loss: 0.6866, test_loss: 0.9133, test_f1: 0.5967
 epoch: 26, train_loss: 0.6507, test_loss: 0.9033, test_f1: 0.6389
 epoch: 27, train_loss: 0.6500, test_loss: 0.8987, test_f1: 0.6152
 epoch: 28, train_loss: 0.6581, test_loss: 0.9752, test_f1: 0.6165
 epoch: 29, train_loss: 0.6597, test_loss: 0.9805, test_f1: 0.6441
 epoch: 30, train_loss: 0.6424, test_loss: 0.9928, test_f1: 0.5933
 epoch: 31, train_loss: 0.6234, test_loss: 0.8994, test_f1: 0.5960
 epoch: 32, train_loss: 0.6214, test_loss: 0.8731, test_f1: 0.6309
 epoch: 33, train_loss: 0.6240, test_loss: 0.9247, test_f1: 0.6680
 epoch: 34, train_loss: 0.6091, test_loss: 0.9427, test_f1: 0.6139
 epoch: 35, train_loss: 0.5809, test_loss: 0.9601, test_f1: 0.6413
 epoch: 36, train_loss: 0.5891, test_loss: 0.9472, test_f1: 0.6432
 epoch: 37, train_loss: 0.5899, test_loss: 1.0026, test_f1: 0.6068
 epoch: 38, train_loss: 0.5661, test_loss: 0.9390, test_f1: 0.6626
 epoch: 39, train_loss: 0.5721, test_loss: 0.9816, test_f1: 0.6594
 epoch: 40, train_loss: 0.5598, test_loss: 0.9926, test_f1: 0.6491
 epoch: 41, train_loss: 0.5602, test_loss: 1.0790, test_f1: 0.6031
 epoch: 42, train_loss: 0.5500, test_loss: 1.0339, test_f1: 0.6472
 epoch: 43, train_loss: 0.5430, test_loss: 0.9730, test_f1: 0.6820
 epoch: 44, train_loss: 0.5343, test_loss: 1.0061, test_f1: 0.6756
 epoch: 45, train_loss: 0.5209, test_loss: 1.0677, test_f1: 0.6421
 epoch: 46, train_loss: 0.5170, test_loss: 1.0457, test_f1: 0.6548
 epoch: 47, train_loss: 0.5190, test_loss: 1.0645, test_f1: 0.6132
 epoch: 48, train_loss: 0.4954, test_loss: 1.0133, test_f1: 0.6575
 epoch: 49, train_loss: 0.4900, test_loss: 1.0530, test_f1: 0.6422
 epoch: 50, train_loss: 0.4867, test_loss: 1.1117, test_f1: 0.6328
 epoch: 51, train_loss: 0.4751, test_loss: 1.0678, test_f1: 0.6724
 epoch: 52, train_loss: 0.4591, test_loss: 1.0726, test_f1: 0.6543
 epoch: 53, train_loss: 0.4490, test_loss: 1.1294, test_f1: 0.6713
 epoch: 54, train_loss: 0.4435, test_loss: 1.0882, test_f1: 0.6516
 epoch: 55, train_loss: 0.4254, test_loss: 1.1270, test_f1: 0.6522
 epoch: 56, train_loss: 0.4313, test_loss: 1.1357, test_f1: 0.6572
 epoch: 57, train_loss: 0.4189, test_loss: 1.1723, test_f1: 0.6815
 epoch: 58, train_loss: 0.4093, test_loss: 1.1584, test_f1: 0.6618
 epoch: 59, train_loss: 0.4075, test_loss: 1.1141, test_f1: 0.6460
 epoch: 60, train_loss: 0.4012, test_loss: 1.1337, test_f1: 0.6757
 epoch: 61, train_loss: 0.4110, test_loss: 1.1757, test_f1: 0.6617
 epoch: 62, train_loss: 0.3996, test_loss: 1.1654, test_f1: 0.6616
 epoch: 63, train_loss: 0.3970, test_loss: 1.2905, test_f1: 0.6443
 epoch: 64, train_loss: 0.3898, test_loss: 1.1935, test_f1: 0.6588
 epoch: 65, train_loss: 0.3897, test_loss: 1.2103, test_f1: 0.6680
 epoch: 66, train_loss: 0.3974, test_loss: 1.1750, test_f1: 0.6528
 epoch: 67, train_loss: 0.3929, test_loss: 1.2155, test_f1: 0.6782
 epoch: 68, train_loss: 0.3863, test_loss: 1.2504, test_f1: 0.6715
 epoch: 69, train_loss: 0.3820, test_loss: 1.2842, test_f1: 0.6706
 epoch: 70, train_loss: 0.3766, test_loss: 1.2784, test_f1: 0.6632
 epoch: 71, train_loss: 0.3533, test_loss: 1.2800, test_f1: 0.6662
 epoch: 72, train_loss: 0.3612, test_loss: 1.2531, test_f1: 0.6509
 epoch: 73, train_loss: 0.3681, test_loss: 1.2719, test_f1: 0.6686
 epoch: 74, train_loss: 0.3708, test_loss: 1.3536, test_f1: 0.6519
 epoch: 75, train_loss: 0.3532, test_loss: 1.3409, test_f1: 0.6332
 epoch: 76, train_loss: 0.3500, test_loss: 1.3577, test_f1: 0.6266
 epoch: 77, train_loss: 0.3385, test_loss: 1.4409, test_f1: 0.6622
 epoch: 78, train_loss: 0.3397, test_loss: 1.4450, test_f1: 0.6661
 epoch: 79, train_loss: 0.3501, test_loss: 1.3642, test_f1: 0.6244
 epoch: 80, train_loss: 0.3617, test_loss: 1.3214, test_f1: 0.6683
 epoch: 81, train_loss: 0.3624, test_loss: 1.3196, test_f1: 0.6606
 epoch: 82, train_loss: 0.3290, test_loss: 1.3260, test_f1: 0.6514
 epoch: 83, train_loss: 0.3483, test_loss: 1.4623, test_f1: 0.6307
 epoch: 84, train_loss: 0.3429, test_loss: 1.4025, test_f1: 0.6483
 epoch: 85, train_loss: 0.3300, test_loss: 1.4913, test_f1: 0.6357
 epoch: 86, train_loss: 0.3252, test_loss: 1.3526, test_f1: 0.6590
 epoch: 87, train_loss: 0.3123, test_loss: 1.3921, test_f1: 0.6530
 epoch: 88, train_loss: 0.3252, test_loss: 1.4524, test_f1: 0.6534
 epoch: 89, train_loss: 0.3367, test_loss: 1.5365, test_f1: 0.6118
 epoch: 90, train_loss: 0.3328, test_loss: 1.4788, test_f1: 0.6424
 epoch: 91, train_loss: 0.3167, test_loss: 1.4180, test_f1: 0.6196
 epoch: 92, train_loss: 0.3132, test_loss: 1.5027, test_f1: 0.6642
 epoch: 93, train_loss: 0.3066, test_loss: 1.6794, test_f1: 0.6355
 epoch: 94, train_loss: 0.3259, test_loss: 1.7019, test_f1: 0.6373
 epoch: 95, train_loss: 0.3106, test_loss: 1.5277, test_f1: 0.6358
 epoch: 96, train_loss: 0.3128, test_loss: 1.4401, test_f1: 0.6458
 epoch: 97, train_loss: 0.3046, test_loss: 1.5296, test_f1: 0.6215
 epoch: 98, train_loss: 0.2942, test_loss: 1.6617, test_f1: 0.6285
 epoch: 99, train_loss: 0.3111, test_loss: 1.5347, test_f1: 0.6541
##################ITERATION #5 ****************************************
 epoch: 0, train_loss: 1.6250, test_loss: 1.3587, test_f1: 0.2370
 epoch: 1, train_loss: 1.0960, test_loss: 1.1825, test_f1: 0.2733
 epoch: 2, train_loss: 1.0113, test_loss: 1.0566, test_f1: 0.4035
 epoch: 3, train_loss: 0.9686, test_loss: 0.9856, test_f1: 0.4891
 epoch: 4, train_loss: 0.9335, test_loss: 0.9499, test_f1: 0.5051
 epoch: 5, train_loss: 0.9165, test_loss: 0.9015, test_f1: 0.5354
 epoch: 6, train_loss: 0.8900, test_loss: 0.8959, test_f1: 0.5481
 epoch: 7, train_loss: 0.8732, test_loss: 0.8776, test_f1: 0.5689
 epoch: 8, train_loss: 0.8613, test_loss: 0.8762, test_f1: 0.5573
 epoch: 9, train_loss: 0.8452, test_loss: 0.8685, test_f1: 0.5752
 epoch: 10, train_loss: 0.8282, test_loss: 0.9058, test_f1: 0.5659
 epoch: 11, train_loss: 0.8290, test_loss: 0.9009, test_f1: 0.5333
 epoch: 12, train_loss: 0.8045, test_loss: 0.8627, test_f1: 0.5409
 epoch: 13, train_loss: 0.7994, test_loss: 0.8462, test_f1: 0.5669
 epoch: 14, train_loss: 0.7701, test_loss: 0.9135, test_f1: 0.5707
 epoch: 15, train_loss: 0.7717, test_loss: 0.8984, test_f1: 0.5766
 epoch: 16, train_loss: 0.7802, test_loss: 0.8888, test_f1: 0.5855
 epoch: 17, train_loss: 0.7592, test_loss: 0.8838, test_f1: 0.5679
 epoch: 18, train_loss: 0.7435, test_loss: 0.8954, test_f1: 0.5987
 epoch: 19, train_loss: 0.7303, test_loss: 0.9701, test_f1: 0.5280
 epoch: 20, train_loss: 0.7265, test_loss: 0.9168, test_f1: 0.5861
 epoch: 21, train_loss: 0.7277, test_loss: 0.9005, test_f1: 0.6230
 epoch: 22, train_loss: 0.7018, test_loss: 0.9103, test_f1: 0.5632
 epoch: 23, train_loss: 0.6901, test_loss: 0.8892, test_f1: 0.6039
 epoch: 24, train_loss: 0.7007, test_loss: 0.8264, test_f1: 0.6110
 epoch: 25, train_loss: 0.6829, test_loss: 0.9168, test_f1: 0.6046
 epoch: 26, train_loss: 0.6854, test_loss: 0.9066, test_f1: 0.6566
 epoch: 27, train_loss: 0.6740, test_loss: 1.0026, test_f1: 0.5787
 epoch: 28, train_loss: 0.6550, test_loss: 0.9474, test_f1: 0.6130
 epoch: 29, train_loss: 0.6459, test_loss: 0.9917, test_f1: 0.6002
 epoch: 30, train_loss: 0.6387, test_loss: 0.9363, test_f1: 0.6299
 epoch: 31, train_loss: 0.6357, test_loss: 0.9577, test_f1: 0.6229
 epoch: 32, train_loss: 0.6400, test_loss: 0.9713, test_f1: 0.6413
 epoch: 33, train_loss: 0.6223, test_loss: 0.9510, test_f1: 0.6460
 epoch: 34, train_loss: 0.6060, test_loss: 0.9350, test_f1: 0.6469
 epoch: 35, train_loss: 0.5953, test_loss: 0.9651, test_f1: 0.6470
 epoch: 36, train_loss: 0.5750, test_loss: 0.9166, test_f1: 0.6360
 epoch: 37, train_loss: 0.5719, test_loss: 0.9819, test_f1: 0.6208
 epoch: 38, train_loss: 0.5750, test_loss: 1.0032, test_f1: 0.6324
 epoch: 39, train_loss: 0.5775, test_loss: 0.9698, test_f1: 0.6179
 epoch: 40, train_loss: 0.5660, test_loss: 0.9833, test_f1: 0.6402
 epoch: 41, train_loss: 0.5686, test_loss: 1.0529, test_f1: 0.6209
 epoch: 42, train_loss: 0.5358, test_loss: 1.0599, test_f1: 0.6486
 epoch: 43, train_loss: 0.5372, test_loss: 1.0205, test_f1: 0.6340
 epoch: 44, train_loss: 0.5410, test_loss: 1.0800, test_f1: 0.6433
 epoch: 45, train_loss: 0.5327, test_loss: 0.9789, test_f1: 0.6293
 epoch: 46, train_loss: 0.5113, test_loss: 1.0632, test_f1: 0.6265
 epoch: 47, train_loss: 0.5090, test_loss: 1.0023, test_f1: 0.6650
 epoch: 48, train_loss: 0.5137, test_loss: 1.0276, test_f1: 0.6306
 epoch: 49, train_loss: 0.4964, test_loss: 1.1164, test_f1: 0.6214
 epoch: 50, train_loss: 0.4896, test_loss: 1.0662, test_f1: 0.6798
 epoch: 51, train_loss: 0.4682, test_loss: 1.0350, test_f1: 0.6797
 epoch: 52, train_loss: 0.4497, test_loss: 1.0530, test_f1: 0.6576
 epoch: 53, train_loss: 0.4373, test_loss: 1.0645, test_f1: 0.6471
 epoch: 54, train_loss: 0.4269, test_loss: 1.0926, test_f1: 0.6527
 epoch: 55, train_loss: 0.4241, test_loss: 1.1128, test_f1: 0.6400
 epoch: 56, train_loss: 0.4154, test_loss: 1.0945, test_f1: 0.6531
 epoch: 57, train_loss: 0.4287, test_loss: 1.1216, test_f1: 0.6727
 epoch: 58, train_loss: 0.4056, test_loss: 1.1814, test_f1: 0.6571
 epoch: 59, train_loss: 0.4105, test_loss: 1.2091, test_f1: 0.6442
 epoch: 60, train_loss: 0.4050, test_loss: 1.1212, test_f1: 0.6717
 epoch: 61, train_loss: 0.4016, test_loss: 1.1298, test_f1: 0.6585
 epoch: 62, train_loss: 0.3938, test_loss: 1.1901, test_f1: 0.6678
 epoch: 63, train_loss: 0.4017, test_loss: 1.2368, test_f1: 0.6603
 epoch: 64, train_loss: 0.3785, test_loss: 1.1580, test_f1: 0.6597
 epoch: 65, train_loss: 0.3740, test_loss: 1.2479, test_f1: 0.6491
 epoch: 66, train_loss: 0.3939, test_loss: 1.1357, test_f1: 0.6652
 epoch: 67, train_loss: 0.3947, test_loss: 1.1735, test_f1: 0.6704
 epoch: 68, train_loss: 0.3818, test_loss: 1.2040, test_f1: 0.6544
 epoch: 69, train_loss: 0.3803, test_loss: 1.2127, test_f1: 0.6633
 epoch: 70, train_loss: 0.3752, test_loss: 1.2688, test_f1: 0.6310
 epoch: 71, train_loss: 0.3788, test_loss: 1.2901, test_f1: 0.6515
 epoch: 72, train_loss: 0.3790, test_loss: 1.2277, test_f1: 0.6721
 epoch: 73, train_loss: 0.3523, test_loss: 1.2549, test_f1: 0.6398
 epoch: 74, train_loss: 0.3434, test_loss: 1.2283, test_f1: 0.6831
 epoch: 75, train_loss: 0.3627, test_loss: 1.2785, test_f1: 0.6797
 epoch: 76, train_loss: 0.3443, test_loss: 1.3108, test_f1: 0.6632
 epoch: 77, train_loss: 0.3481, test_loss: 1.3274, test_f1: 0.6575
 epoch: 78, train_loss: 0.3425, test_loss: 1.2402, test_f1: 0.6527
 epoch: 79, train_loss: 0.3582, test_loss: 1.2513, test_f1: 0.6939
 epoch: 80, train_loss: 0.3546, test_loss: 1.2845, test_f1: 0.6554
 epoch: 81, train_loss: 0.3172, test_loss: 1.2802, test_f1: 0.6629
 epoch: 82, train_loss: 0.3234, test_loss: 1.3678, test_f1: 0.6622
 epoch: 83, train_loss: 0.3308, test_loss: 1.3111, test_f1: 0.6660
 epoch: 84, train_loss: 0.3308, test_loss: 1.3123, test_f1: 0.6514
 epoch: 85, train_loss: 0.3279, test_loss: 1.3123, test_f1: 0.6458
 epoch: 86, train_loss: 0.3383, test_loss: 1.3896, test_f1: 0.6454
 epoch: 87, train_loss: 0.3280, test_loss: 1.3710, test_f1: 0.6578
 epoch: 88, train_loss: 0.3194, test_loss: 1.3462, test_f1: 0.6466
 epoch: 89, train_loss: 0.3077, test_loss: 1.3252, test_f1: 0.6626
 epoch: 90, train_loss: 0.3046, test_loss: 1.4899, test_f1: 0.6452
 epoch: 91, train_loss: 0.3157, test_loss: 1.3144, test_f1: 0.6925
 epoch: 92, train_loss: 0.3092, test_loss: 1.3551, test_f1: 0.6761
 epoch: 93, train_loss: 0.2999, test_loss: 1.4011, test_f1: 0.6863
 epoch: 94, train_loss: 0.2989, test_loss: 1.3654, test_f1: 0.6445
 epoch: 95, train_loss: 0.2997, test_loss: 1.4288, test_f1: 0.6643
 epoch: 96, train_loss: 0.2898, test_loss: 1.4793, test_f1: 0.6755
 epoch: 97, train_loss: 0.2860, test_loss: 1.4894, test_f1: 0.6500
 epoch: 98, train_loss: 0.2839, test_loss: 1.5826, test_f1: 0.6590
 epoch: 99, train_loss: 0.2929, test_loss: 1.4439, test_f1: 0.6837
##################ITERATION #6 ****************************************
 epoch: 0, train_loss: 1.6768, test_loss: 1.3284, test_f1: 0.2307
 epoch: 1, train_loss: 1.1230, test_loss: 1.2067, test_f1: 0.3169
 epoch: 2, train_loss: 1.0161, test_loss: 1.0737, test_f1: 0.4170
 epoch: 3, train_loss: 0.9521, test_loss: 0.9991, test_f1: 0.4627
 epoch: 4, train_loss: 0.9310, test_loss: 0.9640, test_f1: 0.4921
 epoch: 5, train_loss: 0.8935, test_loss: 0.9394, test_f1: 0.4842
 epoch: 6, train_loss: 0.8894, test_loss: 0.9294, test_f1: 0.5318
 epoch: 7, train_loss: 0.8712, test_loss: 0.9272, test_f1: 0.5185
 epoch: 8, train_loss: 0.8489, test_loss: 0.9084, test_f1: 0.5262
 epoch: 9, train_loss: 0.8304, test_loss: 0.8839, test_f1: 0.5462
 epoch: 10, train_loss: 0.8194, test_loss: 0.9097, test_f1: 0.5642
 epoch: 11, train_loss: 0.8012, test_loss: 0.9149, test_f1: 0.5268
 epoch: 12, train_loss: 0.7964, test_loss: 0.8897, test_f1: 0.5838
 epoch: 13, train_loss: 0.7924, test_loss: 0.9298, test_f1: 0.5559
 epoch: 14, train_loss: 0.7817, test_loss: 0.9269, test_f1: 0.5844
 epoch: 15, train_loss: 0.7716, test_loss: 0.9954, test_f1: 0.5316
 epoch: 16, train_loss: 0.7646, test_loss: 0.9277, test_f1: 0.5955
 epoch: 17, train_loss: 0.7483, test_loss: 0.8916, test_f1: 0.5870
 epoch: 18, train_loss: 0.7333, test_loss: 0.9426, test_f1: 0.5602
 epoch: 19, train_loss: 0.7465, test_loss: 0.9685, test_f1: 0.5608
 epoch: 20, train_loss: 0.7205, test_loss: 0.9102, test_f1: 0.5731
 epoch: 21, train_loss: 0.6995, test_loss: 0.8934, test_f1: 0.5883
 epoch: 22, train_loss: 0.7121, test_loss: 0.9751, test_f1: 0.5862
 epoch: 23, train_loss: 0.7007, test_loss: 0.9438, test_f1: 0.5680
 epoch: 24, train_loss: 0.6768, test_loss: 0.9372, test_f1: 0.5981
 epoch: 25, train_loss: 0.6816, test_loss: 0.9296, test_f1: 0.6233
 epoch: 26, train_loss: 0.6719, test_loss: 0.9735, test_f1: 0.5821
 epoch: 27, train_loss: 0.6623, test_loss: 0.9328, test_f1: 0.5965
 epoch: 28, train_loss: 0.6506, test_loss: 0.9730, test_f1: 0.5635
 epoch: 29, train_loss: 0.6396, test_loss: 0.9489, test_f1: 0.5988
 epoch: 30, train_loss: 0.6381, test_loss: 0.9857, test_f1: 0.5909
 epoch: 31, train_loss: 0.6512, test_loss: 0.9636, test_f1: 0.6033
 epoch: 32, train_loss: 0.6208, test_loss: 0.9829, test_f1: 0.6134
 epoch: 33, train_loss: 0.6096, test_loss: 0.9943, test_f1: 0.6087
 epoch: 34, train_loss: 0.6053, test_loss: 0.9951, test_f1: 0.5937
 epoch: 35, train_loss: 0.5998, test_loss: 1.0167, test_f1: 0.6215
 epoch: 36, train_loss: 0.5942, test_loss: 0.9354, test_f1: 0.6057
 epoch: 37, train_loss: 0.5959, test_loss: 1.2372, test_f1: 0.5094
 epoch: 38, train_loss: 0.5826, test_loss: 1.1033, test_f1: 0.5756
 epoch: 39, train_loss: 0.5753, test_loss: 1.0186, test_f1: 0.6388
 epoch: 40, train_loss: 0.5676, test_loss: 1.1230, test_f1: 0.5846
 epoch: 41, train_loss: 0.5665, test_loss: 0.9108, test_f1: 0.6787
 epoch: 42, train_loss: 0.5651, test_loss: 1.0524, test_f1: 0.6241
 epoch: 43, train_loss: 0.5395, test_loss: 1.0414, test_f1: 0.6427
 epoch: 44, train_loss: 0.5399, test_loss: 0.9971, test_f1: 0.6413
 epoch: 45, train_loss: 0.5476, test_loss: 1.0345, test_f1: 0.6503
 epoch: 46, train_loss: 0.5214, test_loss: 0.9778, test_f1: 0.6655
 epoch: 47, train_loss: 0.5075, test_loss: 1.0580, test_f1: 0.6164
 epoch: 48, train_loss: 0.4997, test_loss: 1.0373, test_f1: 0.6529
 epoch: 49, train_loss: 0.4833, test_loss: 1.0212, test_f1: 0.6399
 epoch: 50, train_loss: 0.4970, test_loss: 0.9524, test_f1: 0.6527
 epoch: 51, train_loss: 0.4762, test_loss: 1.0613, test_f1: 0.6369
 epoch: 52, train_loss: 0.4507, test_loss: 1.0270, test_f1: 0.6597
 epoch: 53, train_loss: 0.4494, test_loss: 1.0801, test_f1: 0.6359
 epoch: 54, train_loss: 0.4179, test_loss: 1.0727, test_f1: 0.6574
 epoch: 55, train_loss: 0.4263, test_loss: 1.0660, test_f1: 0.6446
 epoch: 56, train_loss: 0.4173, test_loss: 1.0697, test_f1: 0.6444
 epoch: 57, train_loss: 0.4199, test_loss: 1.0727, test_f1: 0.6668
 epoch: 58, train_loss: 0.4141, test_loss: 1.1203, test_f1: 0.6409
 epoch: 59, train_loss: 0.4226, test_loss: 1.0839, test_f1: 0.6362
 epoch: 60, train_loss: 0.4127, test_loss: 1.0894, test_f1: 0.6659
 epoch: 61, train_loss: 0.4087, test_loss: 1.0867, test_f1: 0.6497
 epoch: 62, train_loss: 0.4134, test_loss: 1.1219, test_f1: 0.6316
 epoch: 63, train_loss: 0.3944, test_loss: 1.1196, test_f1: 0.6412
 epoch: 64, train_loss: 0.3940, test_loss: 1.1928, test_f1: 0.6325
 epoch: 65, train_loss: 0.3899, test_loss: 1.1291, test_f1: 0.6496
 epoch: 66, train_loss: 0.3919, test_loss: 1.1069, test_f1: 0.6583
 epoch: 67, train_loss: 0.3619, test_loss: 1.1876, test_f1: 0.6449
 epoch: 68, train_loss: 0.3917, test_loss: 1.1262, test_f1: 0.6607
 epoch: 69, train_loss: 0.3805, test_loss: 1.1900, test_f1: 0.6225
 epoch: 70, train_loss: 0.3890, test_loss: 1.1025, test_f1: 0.6505
 epoch: 71, train_loss: 0.3528, test_loss: 1.2185, test_f1: 0.6397
 epoch: 72, train_loss: 0.3643, test_loss: 1.2580, test_f1: 0.6378
 epoch: 73, train_loss: 0.3634, test_loss: 1.2561, test_f1: 0.6292
 epoch: 74, train_loss: 0.3575, test_loss: 1.2527, test_f1: 0.6375
 epoch: 75, train_loss: 0.3589, test_loss: 1.2148, test_f1: 0.6475
 epoch: 76, train_loss: 0.3491, test_loss: 1.1925, test_f1: 0.6564
 epoch: 77, train_loss: 0.3558, test_loss: 1.2232, test_f1: 0.6492
 epoch: 78, train_loss: 0.3435, test_loss: 1.2143, test_f1: 0.6573
 epoch: 79, train_loss: 0.3415, test_loss: 1.2374, test_f1: 0.6475
 epoch: 80, train_loss: 0.3561, test_loss: 1.2539, test_f1: 0.6268
 epoch: 81, train_loss: 0.3421, test_loss: 1.2413, test_f1: 0.6408
 epoch: 82, train_loss: 0.3537, test_loss: 1.2270, test_f1: 0.6601
 epoch: 83, train_loss: 0.3559, test_loss: 1.2239, test_f1: 0.6564
 epoch: 84, train_loss: 0.3474, test_loss: 1.2673, test_f1: 0.6149
 epoch: 85, train_loss: 0.3184, test_loss: 1.2014, test_f1: 0.6414
 epoch: 86, train_loss: 0.3244, test_loss: 1.3056, test_f1: 0.6375
 epoch: 87, train_loss: 0.3283, test_loss: 1.2275, test_f1: 0.6523
 epoch: 88, train_loss: 0.3193, test_loss: 1.2724, test_f1: 0.6345
 epoch: 89, train_loss: 0.3164, test_loss: 1.2649, test_f1: 0.6545
 epoch: 90, train_loss: 0.3100, test_loss: 1.2874, test_f1: 0.6380
 epoch: 91, train_loss: 0.3044, test_loss: 1.3056, test_f1: 0.6520
 epoch: 92, train_loss: 0.3102, test_loss: 1.4185, test_f1: 0.6144
 epoch: 93, train_loss: 0.3023, test_loss: 1.2352, test_f1: 0.6727
 epoch: 94, train_loss: 0.3058, test_loss: 1.3349, test_f1: 0.6298
 epoch: 95, train_loss: 0.3139, test_loss: 1.3624, test_f1: 0.6163
 epoch: 96, train_loss: 0.3049, test_loss: 1.3697, test_f1: 0.6409
 epoch: 97, train_loss: 0.2952, test_loss: 1.3367, test_f1: 0.6322
 epoch: 98, train_loss: 0.3078, test_loss: 1.2605, test_f1: 0.6712
 epoch: 99, train_loss: 0.2952, test_loss: 1.3866, test_f1: 0.6488
##################ITERATION #7 ****************************************
 epoch: 0, train_loss: 1.7871, test_loss: 1.6616, test_f1: 0.2270
 epoch: 1, train_loss: 1.1156, test_loss: 1.2086, test_f1: 0.2337
 epoch: 2, train_loss: 1.0025, test_loss: 1.0610, test_f1: 0.3721
 epoch: 3, train_loss: 0.9610, test_loss: 0.9840, test_f1: 0.4542
 epoch: 4, train_loss: 0.9328, test_loss: 0.9583, test_f1: 0.4832
 epoch: 5, train_loss: 0.9107, test_loss: 0.9394, test_f1: 0.4970
 epoch: 6, train_loss: 0.8837, test_loss: 0.8835, test_f1: 0.5068
 epoch: 7, train_loss: 0.8711, test_loss: 0.9414, test_f1: 0.5200
 epoch: 8, train_loss: 0.8496, test_loss: 0.8824, test_f1: 0.5685
 epoch: 9, train_loss: 0.8248, test_loss: 0.9114, test_f1: 0.5606
 epoch: 10, train_loss: 0.8187, test_loss: 0.8959, test_f1: 0.5774
 epoch: 11, train_loss: 0.8027, test_loss: 0.8446, test_f1: 0.5664
 epoch: 12, train_loss: 0.8021, test_loss: 0.9144, test_f1: 0.5584
 epoch: 13, train_loss: 0.7783, test_loss: 0.8808, test_f1: 0.5891
 epoch: 14, train_loss: 0.7608, test_loss: 0.8955, test_f1: 0.5984
 epoch: 15, train_loss: 0.7548, test_loss: 0.8719, test_f1: 0.5768
 epoch: 16, train_loss: 0.7345, test_loss: 0.8767, test_f1: 0.5824
 epoch: 17, train_loss: 0.7330, test_loss: 0.8555, test_f1: 0.6321
 epoch: 18, train_loss: 0.7378, test_loss: 0.8864, test_f1: 0.5972
 epoch: 19, train_loss: 0.7267, test_loss: 0.8981, test_f1: 0.5578
 epoch: 20, train_loss: 0.7033, test_loss: 0.8730, test_f1: 0.5819
 epoch: 21, train_loss: 0.6976, test_loss: 0.9120, test_f1: 0.6128
 epoch: 22, train_loss: 0.6776, test_loss: 0.9395, test_f1: 0.6029
 epoch: 23, train_loss: 0.6738, test_loss: 0.9490, test_f1: 0.5656
 epoch: 24, train_loss: 0.6714, test_loss: 0.9161, test_f1: 0.6340
 epoch: 25, train_loss: 0.6677, test_loss: 0.9826, test_f1: 0.5703
 epoch: 26, train_loss: 0.6627, test_loss: 0.9048, test_f1: 0.6041
 epoch: 27, train_loss: 0.6245, test_loss: 0.8884, test_f1: 0.6103
 epoch: 28, train_loss: 0.6380, test_loss: 0.9959, test_f1: 0.5805
 epoch: 29, train_loss: 0.6149, test_loss: 0.9774, test_f1: 0.5649
 epoch: 30, train_loss: 0.6094, test_loss: 0.9175, test_f1: 0.6240
 epoch: 31, train_loss: 0.6034, test_loss: 0.9581, test_f1: 0.5761
 epoch: 32, train_loss: 0.5927, test_loss: 0.8731, test_f1: 0.6017
 epoch: 33, train_loss: 0.5911, test_loss: 1.0513, test_f1: 0.5938
 epoch: 34, train_loss: 0.5702, test_loss: 0.9909, test_f1: 0.6054
 epoch: 35, train_loss: 0.5780, test_loss: 0.9074, test_f1: 0.6294
 epoch: 36, train_loss: 0.5704, test_loss: 0.8855, test_f1: 0.6424
 epoch: 37, train_loss: 0.5616, test_loss: 0.9355, test_f1: 0.5772
 epoch: 38, train_loss: 0.5744, test_loss: 0.9585, test_f1: 0.6216
 epoch: 39, train_loss: 0.5440, test_loss: 0.9709, test_f1: 0.6332
 epoch: 40, train_loss: 0.5434, test_loss: 0.9159, test_f1: 0.6407
 epoch: 41, train_loss: 0.5181, test_loss: 1.1082, test_f1: 0.5819
 epoch: 42, train_loss: 0.5354, test_loss: 0.8534, test_f1: 0.6305
 epoch: 43, train_loss: 0.5195, test_loss: 0.9597, test_f1: 0.6332
 epoch: 44, train_loss: 0.5175, test_loss: 1.0902, test_f1: 0.6012
 epoch: 45, train_loss: 0.5215, test_loss: 0.9550, test_f1: 0.6505
 epoch: 46, train_loss: 0.5006, test_loss: 1.0829, test_f1: 0.6082
 epoch: 47, train_loss: 0.5021, test_loss: 1.0869, test_f1: 0.6189
 epoch: 48, train_loss: 0.4916, test_loss: 0.9524, test_f1: 0.6166
 epoch: 49, train_loss: 0.4779, test_loss: 1.0508, test_f1: 0.6260
 epoch: 50, train_loss: 0.4825, test_loss: 1.0141, test_f1: 0.6761
 epoch: 51, train_loss: 0.4580, test_loss: 1.0184, test_f1: 0.6307
 epoch: 52, train_loss: 0.4288, test_loss: 0.9781, test_f1: 0.6472
 epoch: 53, train_loss: 0.4136, test_loss: 0.9838, test_f1: 0.6389
 epoch: 54, train_loss: 0.4200, test_loss: 1.0888, test_f1: 0.6159
 epoch: 55, train_loss: 0.3988, test_loss: 1.0448, test_f1: 0.6329
 epoch: 56, train_loss: 0.4020, test_loss: 1.0779, test_f1: 0.6261
 epoch: 57, train_loss: 0.3989, test_loss: 1.0013, test_f1: 0.6282
 epoch: 58, train_loss: 0.3974, test_loss: 1.0621, test_f1: 0.6602
 epoch: 59, train_loss: 0.3844, test_loss: 1.0737, test_f1: 0.6361
 epoch: 60, train_loss: 0.3849, test_loss: 1.0893, test_f1: 0.6240
 epoch: 61, train_loss: 0.3977, test_loss: 1.1058, test_f1: 0.6342
 epoch: 62, train_loss: 0.3707, test_loss: 1.0725, test_f1: 0.6318
 epoch: 63, train_loss: 0.3828, test_loss: 1.0530, test_f1: 0.6188
 epoch: 64, train_loss: 0.3958, test_loss: 1.2423, test_f1: 0.6164
 epoch: 65, train_loss: 0.3679, test_loss: 1.1334, test_f1: 0.6211
 epoch: 66, train_loss: 0.3581, test_loss: 1.0190, test_f1: 0.6540
 epoch: 67, train_loss: 0.3560, test_loss: 1.1110, test_f1: 0.6186
 epoch: 68, train_loss: 0.3530, test_loss: 1.0773, test_f1: 0.6457
 epoch: 69, train_loss: 0.3521, test_loss: 1.2032, test_f1: 0.6306
 epoch: 70, train_loss: 0.3550, test_loss: 1.0761, test_f1: 0.6379
 epoch: 71, train_loss: 0.3632, test_loss: 1.0959, test_f1: 0.6361
 epoch: 72, train_loss: 0.3585, test_loss: 1.1401, test_f1: 0.6101
 epoch: 73, train_loss: 0.3378, test_loss: 1.2338, test_f1: 0.6277
 epoch: 74, train_loss: 0.3478, test_loss: 1.2003, test_f1: 0.6222
 epoch: 75, train_loss: 0.3321, test_loss: 1.1811, test_f1: 0.6327
 epoch: 76, train_loss: 0.3461, test_loss: 1.1634, test_f1: 0.6493
 epoch: 77, train_loss: 0.3478, test_loss: 1.1353, test_f1: 0.6509
 epoch: 78, train_loss: 0.3456, test_loss: 1.2311, test_f1: 0.6305
 epoch: 79, train_loss: 0.3338, test_loss: 1.1748, test_f1: 0.6478
 epoch: 80, train_loss: 0.3259, test_loss: 1.2227, test_f1: 0.6516
 epoch: 81, train_loss: 0.3230, test_loss: 1.2684, test_f1: 0.6326
 epoch: 82, train_loss: 0.3141, test_loss: 1.2344, test_f1: 0.6461
 epoch: 83, train_loss: 0.3183, test_loss: 1.2816, test_f1: 0.6490
 epoch: 84, train_loss: 0.3121, test_loss: 1.2671, test_f1: 0.6334
 epoch: 85, train_loss: 0.3235, test_loss: 1.3675, test_f1: 0.6271
 epoch: 86, train_loss: 0.3048, test_loss: 1.2875, test_f1: 0.6315
 epoch: 87, train_loss: 0.3143, test_loss: 1.3307, test_f1: 0.6167
 epoch: 88, train_loss: 0.3065, test_loss: 1.2572, test_f1: 0.6366
 epoch: 89, train_loss: 0.3042, test_loss: 1.2217, test_f1: 0.6495
 epoch: 90, train_loss: 0.3058, test_loss: 1.3619, test_f1: 0.6274
 epoch: 91, train_loss: 0.3158, test_loss: 1.4744, test_f1: 0.6339
 epoch: 92, train_loss: 0.3065, test_loss: 1.2600, test_f1: 0.6785
 epoch: 93, train_loss: 0.2892, test_loss: 1.4751, test_f1: 0.6203
 epoch: 94, train_loss: 0.3108, test_loss: 1.3991, test_f1: 0.6318
 epoch: 95, train_loss: 0.2899, test_loss: 1.3569, test_f1: 0.6385
 epoch: 96, train_loss: 0.2904, test_loss: 1.4367, test_f1: 0.6539
 epoch: 97, train_loss: 0.2925, test_loss: 1.3892, test_f1: 0.6530
 epoch: 98, train_loss: 0.2972, test_loss: 1.3975, test_f1: 0.6505
 epoch: 99, train_loss: 0.2983, test_loss: 1.3731, test_f1: 0.6355
##################ITERATION #8 ****************************************
 epoch: 0, train_loss: 2.0440, test_loss: 1.6492, test_f1: 0.2270
 epoch: 1, train_loss: 1.1347, test_loss: 1.3757, test_f1: 0.2694
 epoch: 2, train_loss: 1.0023, test_loss: 1.1024, test_f1: 0.3611
 epoch: 3, train_loss: 0.9480, test_loss: 1.0265, test_f1: 0.4292
 epoch: 4, train_loss: 0.9334, test_loss: 0.9849, test_f1: 0.4658
 epoch: 5, train_loss: 0.9031, test_loss: 0.9553, test_f1: 0.5245
 epoch: 6, train_loss: 0.8747, test_loss: 0.9188, test_f1: 0.5513
 epoch: 7, train_loss: 0.8426, test_loss: 0.8965, test_f1: 0.5705
 epoch: 8, train_loss: 0.8469, test_loss: 0.9029, test_f1: 0.5304
 epoch: 9, train_loss: 0.8239, test_loss: 0.8993, test_f1: 0.5615
 epoch: 10, train_loss: 0.7963, test_loss: 0.9126, test_f1: 0.5568
 epoch: 11, train_loss: 0.7883, test_loss: 0.9096, test_f1: 0.5398
 epoch: 12, train_loss: 0.7900, test_loss: 0.8905, test_f1: 0.5680
 epoch: 13, train_loss: 0.7765, test_loss: 0.8840, test_f1: 0.5896
 epoch: 14, train_loss: 0.7659, test_loss: 0.8795, test_f1: 0.5806
 epoch: 15, train_loss: 0.7605, test_loss: 0.8791, test_f1: 0.5572
 epoch: 16, train_loss: 0.7824, test_loss: 0.9090, test_f1: 0.5973
 epoch: 17, train_loss: 0.7422, test_loss: 0.9840, test_f1: 0.5613
 epoch: 18, train_loss: 0.7300, test_loss: 0.8735, test_f1: 0.5879
 epoch: 19, train_loss: 0.7086, test_loss: 0.9319, test_f1: 0.5475
 epoch: 20, train_loss: 0.7148, test_loss: 0.9014, test_f1: 0.6100
 epoch: 21, train_loss: 0.7034, test_loss: 0.9012, test_f1: 0.6087
 epoch: 22, train_loss: 0.7006, test_loss: 0.9187, test_f1: 0.5661
 epoch: 23, train_loss: 0.6717, test_loss: 0.9205, test_f1: 0.6020
 epoch: 24, train_loss: 0.6801, test_loss: 0.9523, test_f1: 0.5822
 epoch: 25, train_loss: 0.6744, test_loss: 0.9362, test_f1: 0.5811
 epoch: 26, train_loss: 0.6761, test_loss: 0.9041, test_f1: 0.5759
 epoch: 27, train_loss: 0.6569, test_loss: 0.8839, test_f1: 0.5840
 epoch: 28, train_loss: 0.6602, test_loss: 0.9382, test_f1: 0.5844
 epoch: 29, train_loss: 0.6488, test_loss: 0.8892, test_f1: 0.5962
 epoch: 30, train_loss: 0.6325, test_loss: 0.9113, test_f1: 0.6095
 epoch: 31, train_loss: 0.6245, test_loss: 0.9894, test_f1: 0.5809
 epoch: 32, train_loss: 0.6071, test_loss: 0.9255, test_f1: 0.6100
 epoch: 33, train_loss: 0.6205, test_loss: 0.8825, test_f1: 0.6047
 epoch: 34, train_loss: 0.5934, test_loss: 0.9167, test_f1: 0.6043
 epoch: 35, train_loss: 0.6051, test_loss: 0.9303, test_f1: 0.5944
 epoch: 36, train_loss: 0.5969, test_loss: 0.9260, test_f1: 0.5896
 epoch: 37, train_loss: 0.5927, test_loss: 0.9514, test_f1: 0.5865
 epoch: 38, train_loss: 0.5879, test_loss: 1.0424, test_f1: 0.5808
 epoch: 39, train_loss: 0.5827, test_loss: 0.9458, test_f1: 0.6035
 epoch: 40, train_loss: 0.6007, test_loss: 0.9418, test_f1: 0.5730
 epoch: 41, train_loss: 0.5733, test_loss: 0.9367, test_f1: 0.5826
 epoch: 42, train_loss: 0.5556, test_loss: 0.9160, test_f1: 0.6388
 epoch: 43, train_loss: 0.5360, test_loss: 0.9449, test_f1: 0.6050
 epoch: 44, train_loss: 0.5309, test_loss: 0.9974, test_f1: 0.6048
 epoch: 45, train_loss: 0.5362, test_loss: 1.0381, test_f1: 0.5889
 epoch: 46, train_loss: 0.5307, test_loss: 1.0097, test_f1: 0.6159
 epoch: 47, train_loss: 0.5217, test_loss: 0.9961, test_f1: 0.5969
 epoch: 48, train_loss: 0.5032, test_loss: 0.9940, test_f1: 0.5815
 epoch: 49, train_loss: 0.4878, test_loss: 0.9929, test_f1: 0.6242
 epoch: 50, train_loss: 0.5041, test_loss: 0.9491, test_f1: 0.6242
 epoch: 51, train_loss: 0.4913, test_loss: 1.0677, test_f1: 0.6076
 epoch: 52, train_loss: 0.4674, test_loss: 1.0341, test_f1: 0.6279
 epoch: 53, train_loss: 0.4430, test_loss: 0.9748, test_f1: 0.6306
 epoch: 54, train_loss: 0.4426, test_loss: 0.9763, test_f1: 0.6154
 epoch: 55, train_loss: 0.4317, test_loss: 1.0831, test_f1: 0.6266
 epoch: 56, train_loss: 0.4215, test_loss: 1.0186, test_f1: 0.6429
 epoch: 57, train_loss: 0.4236, test_loss: 0.9423, test_f1: 0.6447
 epoch: 58, train_loss: 0.4266, test_loss: 1.0408, test_f1: 0.6339
 epoch: 59, train_loss: 0.4171, test_loss: 1.1132, test_f1: 0.6370
 epoch: 60, train_loss: 0.4265, test_loss: 1.1252, test_f1: 0.6309
 epoch: 61, train_loss: 0.4149, test_loss: 1.1618, test_f1: 0.6377
 epoch: 62, train_loss: 0.4006, test_loss: 1.0136, test_f1: 0.6526
 epoch: 63, train_loss: 0.4085, test_loss: 1.0713, test_f1: 0.6386
 epoch: 64, train_loss: 0.4060, test_loss: 1.0992, test_f1: 0.6459
 epoch: 65, train_loss: 0.4113, test_loss: 1.0561, test_f1: 0.6478
 epoch: 66, train_loss: 0.4010, test_loss: 1.0621, test_f1: 0.6314
 epoch: 67, train_loss: 0.3871, test_loss: 1.1974, test_f1: 0.6212
 epoch: 68, train_loss: 0.4010, test_loss: 1.2030, test_f1: 0.6453
 epoch: 69, train_loss: 0.3799, test_loss: 1.0389, test_f1: 0.6463
 epoch: 70, train_loss: 0.4031, test_loss: 1.1014, test_f1: 0.6351
 epoch: 71, train_loss: 0.3803, test_loss: 1.1444, test_f1: 0.6432
 epoch: 72, train_loss: 0.3666, test_loss: 1.1982, test_f1: 0.6344
 epoch: 73, train_loss: 0.3588, test_loss: 1.0668, test_f1: 0.6326
 epoch: 74, train_loss: 0.3759, test_loss: 1.1527, test_f1: 0.6442
 epoch: 75, train_loss: 0.3641, test_loss: 1.1169, test_f1: 0.6699
 epoch: 76, train_loss: 0.3818, test_loss: 1.1712, test_f1: 0.6437
 epoch: 77, train_loss: 0.3677, test_loss: 1.1690, test_f1: 0.6691
 epoch: 78, train_loss: 0.3714, test_loss: 1.2748, test_f1: 0.6481
 epoch: 79, train_loss: 0.3723, test_loss: 1.1856, test_f1: 0.6361
 epoch: 80, train_loss: 0.3405, test_loss: 1.3287, test_f1: 0.6480
 epoch: 81, train_loss: 0.3539, test_loss: 1.1606, test_f1: 0.6492
 epoch: 82, train_loss: 0.3592, test_loss: 1.2404, test_f1: 0.6430
 epoch: 83, train_loss: 0.3430, test_loss: 1.2224, test_f1: 0.6618
 epoch: 84, train_loss: 0.3430, test_loss: 1.3196, test_f1: 0.6447
 epoch: 85, train_loss: 0.3447, test_loss: 1.2303, test_f1: 0.6445
 epoch: 86, train_loss: 0.3517, test_loss: 1.3171, test_f1: 0.6553
 epoch: 87, train_loss: 0.3508, test_loss: 1.2410, test_f1: 0.6441
 epoch: 88, train_loss: 0.3481, test_loss: 1.2296, test_f1: 0.6545
 epoch: 89, train_loss: 0.3236, test_loss: 1.2321, test_f1: 0.6449
 epoch: 90, train_loss: 0.3356, test_loss: 1.3801, test_f1: 0.6721
 epoch: 91, train_loss: 0.3223, test_loss: 1.3856, test_f1: 0.6675
 epoch: 92, train_loss: 0.3276, test_loss: 1.2648, test_f1: 0.6609
 epoch: 93, train_loss: 0.3271, test_loss: 1.2758, test_f1: 0.6511
 epoch: 94, train_loss: 0.3260, test_loss: 1.2942, test_f1: 0.6570
 epoch: 95, train_loss: 0.3224, test_loss: 1.3745, test_f1: 0.6634
 epoch: 96, train_loss: 0.3200, test_loss: 1.3653, test_f1: 0.6415
 epoch: 97, train_loss: 0.3149, test_loss: 1.3940, test_f1: 0.6400
 epoch: 98, train_loss: 0.3324, test_loss: 1.4461, test_f1: 0.6356
 epoch: 99, train_loss: 0.3203, test_loss: 1.3849, test_f1: 0.6362
##################ITERATION #9 ****************************************
 epoch: 0, train_loss: 1.9928, test_loss: 1.9203, test_f1: 0.2270
 epoch: 1, train_loss: 1.0996, test_loss: 1.3293, test_f1: 0.2270
 epoch: 2, train_loss: 1.0195, test_loss: 1.0412, test_f1: 0.3903
 epoch: 3, train_loss: 0.9714, test_loss: 0.9725, test_f1: 0.4465
 epoch: 4, train_loss: 0.9468, test_loss: 0.9624, test_f1: 0.4467
 epoch: 5, train_loss: 0.9303, test_loss: 0.9513, test_f1: 0.4649
 epoch: 6, train_loss: 0.8964, test_loss: 0.9621, test_f1: 0.4613
 epoch: 7, train_loss: 0.8914, test_loss: 0.9179, test_f1: 0.5148
 epoch: 8, train_loss: 0.8574, test_loss: 0.9058, test_f1: 0.5279
 epoch: 9, train_loss: 0.8484, test_loss: 0.9785, test_f1: 0.5212
 epoch: 10, train_loss: 0.8391, test_loss: 0.9262, test_f1: 0.5152
 epoch: 11, train_loss: 0.8229, test_loss: 0.9501, test_f1: 0.5387
 epoch: 12, train_loss: 0.8158, test_loss: 1.0359, test_f1: 0.4993
 epoch: 13, train_loss: 0.7973, test_loss: 0.9920, test_f1: 0.4994
 epoch: 14, train_loss: 0.7894, test_loss: 0.9487, test_f1: 0.5501
 epoch: 15, train_loss: 0.7756, test_loss: 0.9264, test_f1: 0.5627
 epoch: 16, train_loss: 0.7599, test_loss: 0.9142, test_f1: 0.5851
 epoch: 17, train_loss: 0.7627, test_loss: 0.9137, test_f1: 0.5573
 epoch: 18, train_loss: 0.7394, test_loss: 0.9526, test_f1: 0.5700
 epoch: 19, train_loss: 0.7366, test_loss: 0.9750, test_f1: 0.5474
 epoch: 20, train_loss: 0.7242, test_loss: 0.9826, test_f1: 0.5605
 epoch: 21, train_loss: 0.7337, test_loss: 0.9385, test_f1: 0.5850
 epoch: 22, train_loss: 0.7197, test_loss: 0.9555, test_f1: 0.5699
 epoch: 23, train_loss: 0.7044, test_loss: 0.9360, test_f1: 0.5912
 epoch: 24, train_loss: 0.6929, test_loss: 1.0276, test_f1: 0.5297
 epoch: 25, train_loss: 0.6773, test_loss: 1.0572, test_f1: 0.5438
 epoch: 26, train_loss: 0.6747, test_loss: 0.9884, test_f1: 0.5704
 epoch: 27, train_loss: 0.6850, test_loss: 1.0213, test_f1: 0.5767
 epoch: 28, train_loss: 0.6605, test_loss: 0.9717, test_f1: 0.5607
 epoch: 29, train_loss: 0.6413, test_loss: 0.9718, test_f1: 0.6225
 epoch: 30, train_loss: 0.6400, test_loss: 0.9550, test_f1: 0.5739
 epoch: 31, train_loss: 0.6335, test_loss: 1.0289, test_f1: 0.5744
 epoch: 32, train_loss: 0.6205, test_loss: 0.9790, test_f1: 0.5834
 epoch: 33, train_loss: 0.6318, test_loss: 0.9672, test_f1: 0.5964
 epoch: 34, train_loss: 0.6083, test_loss: 1.0376, test_f1: 0.5779
 epoch: 35, train_loss: 0.5986, test_loss: 1.1160, test_f1: 0.5758
 epoch: 36, train_loss: 0.6100, test_loss: 0.9765, test_f1: 0.5922
 epoch: 37, train_loss: 0.6059, test_loss: 1.0408, test_f1: 0.5809
 epoch: 38, train_loss: 0.5932, test_loss: 1.0877, test_f1: 0.5587
 epoch: 39, train_loss: 0.5977, test_loss: 1.0890, test_f1: 0.5866
 epoch: 40, train_loss: 0.5699, test_loss: 1.1658, test_f1: 0.5543
 epoch: 41, train_loss: 0.5847, test_loss: 1.0741, test_f1: 0.5716
 epoch: 42, train_loss: 0.5699, test_loss: 1.0163, test_f1: 0.6201
 epoch: 43, train_loss: 0.5419, test_loss: 1.0178, test_f1: 0.5758
 epoch: 44, train_loss: 0.5491, test_loss: 1.0907, test_f1: 0.6110
 epoch: 45, train_loss: 0.5450, test_loss: 1.0418, test_f1: 0.6210
 epoch: 46, train_loss: 0.5456, test_loss: 1.1637, test_f1: 0.5952
 epoch: 47, train_loss: 0.5336, test_loss: 1.1076, test_f1: 0.6006
 epoch: 48, train_loss: 0.5129, test_loss: 1.1052, test_f1: 0.5872
 epoch: 49, train_loss: 0.5150, test_loss: 1.0957, test_f1: 0.6077
 epoch: 50, train_loss: 0.5019, test_loss: 1.1449, test_f1: 0.5790
 epoch: 51, train_loss: 0.4986, test_loss: 1.1684, test_f1: 0.5992
 epoch: 52, train_loss: 0.4623, test_loss: 1.1578, test_f1: 0.6043
 epoch: 53, train_loss: 0.4472, test_loss: 1.1629, test_f1: 0.6064
 epoch: 54, train_loss: 0.4591, test_loss: 1.2157, test_f1: 0.6122
 epoch: 55, train_loss: 0.4526, test_loss: 1.2106, test_f1: 0.5843
 epoch: 56, train_loss: 0.4335, test_loss: 1.1143, test_f1: 0.6265
 epoch: 57, train_loss: 0.4204, test_loss: 1.1685, test_f1: 0.6164
 epoch: 58, train_loss: 0.4500, test_loss: 1.2236, test_f1: 0.6215
 epoch: 59, train_loss: 0.4230, test_loss: 1.2331, test_f1: 0.6003
 epoch: 60, train_loss: 0.4158, test_loss: 1.2473, test_f1: 0.6061
 epoch: 61, train_loss: 0.4195, test_loss: 1.2335, test_f1: 0.6063
 epoch: 62, train_loss: 0.4150, test_loss: 1.1487, test_f1: 0.6342
 epoch: 63, train_loss: 0.4152, test_loss: 1.1971, test_f1: 0.6112
 epoch: 64, train_loss: 0.4145, test_loss: 1.1507, test_f1: 0.6300
 epoch: 65, train_loss: 0.4075, test_loss: 1.2692, test_f1: 0.6089
 epoch: 66, train_loss: 0.4027, test_loss: 1.2103, test_f1: 0.6324
 epoch: 67, train_loss: 0.4049, test_loss: 1.1889, test_f1: 0.6241
 epoch: 68, train_loss: 0.3896, test_loss: 1.2610, test_f1: 0.6064
 epoch: 69, train_loss: 0.3961, test_loss: 1.3399, test_f1: 0.6086
 epoch: 70, train_loss: 0.3757, test_loss: 1.2047, test_f1: 0.6379
 epoch: 71, train_loss: 0.3781, test_loss: 1.3705, test_f1: 0.6260
 epoch: 72, train_loss: 0.3815, test_loss: 1.2744, test_f1: 0.6229
 epoch: 73, train_loss: 0.3675, test_loss: 1.2576, test_f1: 0.6430
 epoch: 74, train_loss: 0.3587, test_loss: 1.3201, test_f1: 0.6147
 epoch: 75, train_loss: 0.3693, test_loss: 1.2619, test_f1: 0.6252
 epoch: 76, train_loss: 0.3709, test_loss: 1.3384, test_f1: 0.6171
 epoch: 77, train_loss: 0.3766, test_loss: 1.2935, test_f1: 0.6323
 epoch: 78, train_loss: 0.3631, test_loss: 1.3054, test_f1: 0.6296
 epoch: 79, train_loss: 0.3553, test_loss: 1.3348, test_f1: 0.6312
 epoch: 80, train_loss: 0.3544, test_loss: 1.3451, test_f1: 0.6250
 epoch: 81, train_loss: 0.3514, test_loss: 1.2836, test_f1: 0.6250
 epoch: 82, train_loss: 0.3397, test_loss: 1.3209, test_f1: 0.6362
 epoch: 83, train_loss: 0.3630, test_loss: 1.3989, test_f1: 0.6070
 epoch: 84, train_loss: 0.3526, test_loss: 1.4162, test_f1: 0.6232
 epoch: 85, train_loss: 0.3528, test_loss: 1.3137, test_f1: 0.6371
 epoch: 86, train_loss: 0.3350, test_loss: 1.3371, test_f1: 0.6300
 epoch: 87, train_loss: 0.3587, test_loss: 1.3983, test_f1: 0.6278
 epoch: 88, train_loss: 0.3488, test_loss: 1.3545, test_f1: 0.6344
 epoch: 89, train_loss: 0.3338, test_loss: 1.4626, test_f1: 0.5975
 epoch: 90, train_loss: 0.3272, test_loss: 1.3436, test_f1: 0.6348
 epoch: 91, train_loss: 0.3280, test_loss: 1.4873, test_f1: 0.6160
 epoch: 92, train_loss: 0.3108, test_loss: 1.5263, test_f1: 0.6308
 epoch: 93, train_loss: 0.3399, test_loss: 1.3799, test_f1: 0.6341
 epoch: 94, train_loss: 0.3345, test_loss: 1.5017, test_f1: 0.6243
 epoch: 95, train_loss: 0.3316, test_loss: 1.4171, test_f1: 0.6203
 epoch: 96, train_loss: 0.3232, test_loss: 1.4517, test_f1: 0.6335
 epoch: 97, train_loss: 0.3144, test_loss: 1.5067, test_f1: 0.6447
 epoch: 98, train_loss: 0.3105, test_loss: 1.4745, test_f1: 0.6435
 epoch: 99, train_loss: 0.3327, test_loss: 1.4532, test_f1: 0.6480

Training completed in 663.63 seconds
Best F1: 0.7122 at epoch 59
Mean F1 across iterations: 0.6821  0.0156
========================FINAL RESULTS================================
FEGIN weighted F1: 0.7122  0.0156
python main.py --data ltspice_examples --representation component_net --model FEGIN --layers 2 --hiddens 128 --batch_size 256 --lr 0.001 --emb_size 250 --epochs 100 --save_appendix component_net_L2_H128_BS256_LR0.001_E250 --no_val
-----



STDERR:
  File "main.py", line 370, in <module>
    main()
  File "main.py", line 254, in main
    dataset = dataset_class(
  File "/home/philip/projects/llm_inference_code_repo/Circuit-Completion-Using-GNNs/component_classification_with_link_prediction_head/evaluation/FEGIN/kernel/circuit_datasets.py", line 15, in __init__
    self.data, self.slices = torch.load(self.processed_paths[0])
  File "/home/philip/.local/lib/python3.8/site-packages/torch/serialization.py", line 1040, in load
    warnings.warn(
  File "/usr/lib/python3.8/warnings.py", line 109, in _showwarnmsg
    sw(msg.message, msg.category, msg.filename, msg.lineno,
  File "main.py", line 47, in warn_with_traceback
    traceback.print_stack(file=log)
/home/philip/projects/llm_inference_code_repo/Circuit-Completion-Using-GNNs/component_classification_with_link_prediction_head/evaluation/FEGIN/kernel/circuit_datasets.py:15: FutureWarning: You are using `torch.load` with `weights_only=False` (the current default value), which uses the default pickle module implicitly. It is possible to construct malicious pickle data which will execute arbitrary code during unpickling (See https://github.com/pytorch/pytorch/blob/main/SECURITY.md#untrusted-models for more details). In a future release, the default value for `weights_only` will be flipped to `True`. This limits the functions that could be executed during unpickling. Arbitrary objects will no longer be allowed to be loaded via this mode unless they are explicitly allowlisted by the user via `torch.serialization.add_safe_globals`. We recommend you start setting `weights_only=True` for any use case where you don't have full control of the loaded file. Please open an issue on GitHub for any issues related to this experimental feature.
  self.data, self.slices = torch.load(self.processed_paths[0])
