STDOUT:
Results will be saved in /home/philip/projects/ltspice_examples_code_repo/Circuit-Completion-Using-GNNs/component_classification_with_link_prediction_head/evaluation/FEGIN/results/model_FEGIN_dataset_ltspice_examples
Command line input: python main.py --data ltspice_examples --representation component_pin_net --model FEGIN --layers 4 --hiddens 32 --batch_size 64 --lr 0.001 --emb_size 512 --epochs 100 --save_appendix component_pin_net_L4_H32_BS64_LR0.001_E512 --no_val
 is saved.
-----
ltspice_examples - FEGIN
Using 4 layers, 32 hidden units, h = 2
Loading component_pin_net representation dataset
ENTERED
Training FEGIN on component_pin_net representation
Train: 3558, Test: 846
##################ITERATION #0 ****************************************
 epoch: 0, train_loss: 1.2574, test_loss: 1.1021, test_f1: 0.3738
 epoch: 1, train_loss: 1.0624, test_loss: 1.0507, test_f1: 0.3542
 epoch: 2, train_loss: 1.0343, test_loss: 1.0195, test_f1: 0.4050
 epoch: 3, train_loss: 1.0142, test_loss: 1.0190, test_f1: 0.4104
 epoch: 4, train_loss: 0.9946, test_loss: 0.9986, test_f1: 0.4148
 epoch: 5, train_loss: 0.9795, test_loss: 0.9654, test_f1: 0.4821
 epoch: 6, train_loss: 0.9603, test_loss: 0.9338, test_f1: 0.5167
 epoch: 7, train_loss: 0.9419, test_loss: 0.9969, test_f1: 0.4687
 epoch: 8, train_loss: 0.9320, test_loss: 0.9487, test_f1: 0.5132
 epoch: 9, train_loss: 0.9272, test_loss: 0.9135, test_f1: 0.5065
 epoch: 10, train_loss: 0.9132, test_loss: 0.8984, test_f1: 0.5233
 epoch: 11, train_loss: 0.9007, test_loss: 0.9656, test_f1: 0.5133
 epoch: 12, train_loss: 0.8957, test_loss: 0.9249, test_f1: 0.4850
 epoch: 13, train_loss: 0.8787, test_loss: 0.9256, test_f1: 0.5258
 epoch: 14, train_loss: 0.8706, test_loss: 0.8959, test_f1: 0.5310
 epoch: 15, train_loss: 0.8629, test_loss: 0.8939, test_f1: 0.5537
 epoch: 16, train_loss: 0.8475, test_loss: 0.8959, test_f1: 0.5000
 epoch: 17, train_loss: 0.8480, test_loss: 0.8590, test_f1: 0.5270
 epoch: 18, train_loss: 0.8385, test_loss: 0.8330, test_f1: 0.5631
 epoch: 19, train_loss: 0.8254, test_loss: 0.8470, test_f1: 0.5323
 epoch: 20, train_loss: 0.8144, test_loss: 0.8967, test_f1: 0.5881
 epoch: 21, train_loss: 0.8235, test_loss: 0.8448, test_f1: 0.5308
 epoch: 22, train_loss: 0.8110, test_loss: 0.8501, test_f1: 0.5324
 epoch: 23, train_loss: 0.7956, test_loss: 0.8491, test_f1: 0.5202
 epoch: 24, train_loss: 0.8050, test_loss: 0.8481, test_f1: 0.5402
 epoch: 25, train_loss: 0.7811, test_loss: 0.8847, test_f1: 0.5416
 epoch: 26, train_loss: 0.7885, test_loss: 0.9333, test_f1: 0.5112
 epoch: 27, train_loss: 0.7906, test_loss: 0.8335, test_f1: 0.5565
 epoch: 28, train_loss: 0.7701, test_loss: 0.8659, test_f1: 0.5387
 epoch: 29, train_loss: 0.7693, test_loss: 0.8640, test_f1: 0.5388
 epoch: 30, train_loss: 0.7608, test_loss: 0.8847, test_f1: 0.5636
 epoch: 31, train_loss: 0.7617, test_loss: 0.9122, test_f1: 0.5513
 epoch: 32, train_loss: 0.7451, test_loss: 0.8649, test_f1: 0.5933
 epoch: 33, train_loss: 0.7334, test_loss: 0.9374, test_f1: 0.5552
 epoch: 34, train_loss: 0.7301, test_loss: 0.8763, test_f1: 0.5874
 epoch: 35, train_loss: 0.7537, test_loss: 0.8915, test_f1: 0.5977
 epoch: 36, train_loss: 0.7484, test_loss: 0.8429, test_f1: 0.5946
 epoch: 37, train_loss: 0.7158, test_loss: 0.8473, test_f1: 0.5954
 epoch: 38, train_loss: 0.7115, test_loss: 0.9135, test_f1: 0.6253
 epoch: 39, train_loss: 0.7155, test_loss: 0.9231, test_f1: 0.5738
 epoch: 40, train_loss: 0.7120, test_loss: 0.9863, test_f1: 0.6067
 epoch: 41, train_loss: 0.6971, test_loss: 0.9074, test_f1: 0.5884
 epoch: 42, train_loss: 0.6976, test_loss: 0.9051, test_f1: 0.6084
 epoch: 43, train_loss: 0.7100, test_loss: 0.8487, test_f1: 0.6087
 epoch: 44, train_loss: 0.7019, test_loss: 0.9621, test_f1: 0.5800
 epoch: 45, train_loss: 0.6865, test_loss: 0.8814, test_f1: 0.6074
 epoch: 46, train_loss: 0.6877, test_loss: 0.9741, test_f1: 0.5984
 epoch: 47, train_loss: 0.6743, test_loss: 0.9728, test_f1: 0.6055
 epoch: 48, train_loss: 0.6796, test_loss: 0.9657, test_f1: 0.5744
 epoch: 49, train_loss: 0.6736, test_loss: 1.0786, test_f1: 0.5863
 epoch: 50, train_loss: 0.6635, test_loss: 0.9220, test_f1: 0.6360
 epoch: 51, train_loss: 0.6584, test_loss: 0.9200, test_f1: 0.6190
 epoch: 52, train_loss: 0.6372, test_loss: 0.9233, test_f1: 0.6374
 epoch: 53, train_loss: 0.6414, test_loss: 0.9423, test_f1: 0.6248
 epoch: 54, train_loss: 0.6158, test_loss: 0.9349, test_f1: 0.6319
 epoch: 55, train_loss: 0.6237, test_loss: 0.9368, test_f1: 0.6386
 epoch: 56, train_loss: 0.6186, test_loss: 0.9773, test_f1: 0.6405
 epoch: 57, train_loss: 0.6184, test_loss: 1.0248, test_f1: 0.6285
 epoch: 58, train_loss: 0.6134, test_loss: 1.0435, test_f1: 0.6150
 epoch: 59, train_loss: 0.6068, test_loss: 1.0168, test_f1: 0.6198
 epoch: 60, train_loss: 0.6039, test_loss: 0.9551, test_f1: 0.6408
 epoch: 61, train_loss: 0.6061, test_loss: 0.9704, test_f1: 0.6211
 epoch: 62, train_loss: 0.5966, test_loss: 0.9823, test_f1: 0.6161
 epoch: 63, train_loss: 0.5916, test_loss: 0.9841, test_f1: 0.6313
 epoch: 64, train_loss: 0.6060, test_loss: 1.0724, test_f1: 0.6395
 epoch: 65, train_loss: 0.6052, test_loss: 1.0035, test_f1: 0.6441
 epoch: 66, train_loss: 0.5870, test_loss: 0.9848, test_f1: 0.6218
 epoch: 67, train_loss: 0.6052, test_loss: 0.9664, test_f1: 0.6068
 epoch: 68, train_loss: 0.5962, test_loss: 0.9110, test_f1: 0.6272
 epoch: 69, train_loss: 0.5870, test_loss: 0.9259, test_f1: 0.6417
 epoch: 70, train_loss: 0.5848, test_loss: 0.9238, test_f1: 0.6290
 epoch: 71, train_loss: 0.5842, test_loss: 1.0626, test_f1: 0.6460
 epoch: 72, train_loss: 0.5851, test_loss: 1.0785, test_f1: 0.6275
 epoch: 73, train_loss: 0.5830, test_loss: 0.9700, test_f1: 0.6469
 epoch: 74, train_loss: 0.5806, test_loss: 0.9805, test_f1: 0.6396
 epoch: 75, train_loss: 0.5840, test_loss: 1.0171, test_f1: 0.6353
 epoch: 76, train_loss: 0.5699, test_loss: 0.9916, test_f1: 0.6383
 epoch: 77, train_loss: 0.5551, test_loss: 0.9835, test_f1: 0.6421
 epoch: 78, train_loss: 0.5829, test_loss: 1.0112, test_f1: 0.6343
 epoch: 79, train_loss: 0.5592, test_loss: 0.9614, test_f1: 0.6469
 epoch: 80, train_loss: 0.5609, test_loss: 0.9638, test_f1: 0.6426
 epoch: 81, train_loss: 0.5782, test_loss: 1.0079, test_f1: 0.6457
 epoch: 82, train_loss: 0.5531, test_loss: 1.0220, test_f1: 0.6583
 epoch: 83, train_loss: 0.5488, test_loss: 0.9635, test_f1: 0.6480
 epoch: 84, train_loss: 0.5576, test_loss: 1.0468, test_f1: 0.6331
 epoch: 85, train_loss: 0.5391, test_loss: 0.9451, test_f1: 0.6596
 epoch: 86, train_loss: 0.5475, test_loss: 1.1051, test_f1: 0.6487
 epoch: 87, train_loss: 0.5519, test_loss: 1.0231, test_f1: 0.6236
 epoch: 88, train_loss: 0.5469, test_loss: 1.1196, test_f1: 0.6360
 epoch: 89, train_loss: 0.5447, test_loss: 1.1077, test_f1: 0.6248
 epoch: 90, train_loss: 0.5454, test_loss: 1.1166, test_f1: 0.6330
 epoch: 91, train_loss: 0.5533, test_loss: 1.0886, test_f1: 0.6321
 epoch: 92, train_loss: 0.5595, test_loss: 1.1232, test_f1: 0.6316
 epoch: 93, train_loss: 0.5260, test_loss: 1.2114, test_f1: 0.6461
 epoch: 94, train_loss: 0.5387, test_loss: 1.0732, test_f1: 0.6358
 epoch: 95, train_loss: 0.5437, test_loss: 1.0840, test_f1: 0.6484
 epoch: 96, train_loss: 0.5338, test_loss: 1.1338, test_f1: 0.6251
 epoch: 97, train_loss: 0.5228, test_loss: 1.1834, test_f1: 0.6460
 epoch: 98, train_loss: 0.5310, test_loss: 1.1586, test_f1: 0.6413
 epoch: 99, train_loss: 0.5096, test_loss: 1.0638, test_f1: 0.6369
##################ITERATION #1 ****************************************
 epoch: 0, train_loss: 1.1172, test_loss: 1.0536, test_f1: 0.4352
 epoch: 1, train_loss: 0.9974, test_loss: 0.9744, test_f1: 0.4964
 epoch: 2, train_loss: 0.9729, test_loss: 0.9256, test_f1: 0.5208
 epoch: 3, train_loss: 0.9460, test_loss: 0.9190, test_f1: 0.4970
 epoch: 4, train_loss: 0.9261, test_loss: 0.9017, test_f1: 0.5245
 epoch: 5, train_loss: 0.9161, test_loss: 0.8696, test_f1: 0.5538
 epoch: 6, train_loss: 0.8953, test_loss: 0.8506, test_f1: 0.5297
 epoch: 7, train_loss: 0.8829, test_loss: 0.8443, test_f1: 0.5444
 epoch: 8, train_loss: 0.8792, test_loss: 0.8312, test_f1: 0.5539
 epoch: 9, train_loss: 0.8649, test_loss: 0.8404, test_f1: 0.5498
 epoch: 10, train_loss: 0.8470, test_loss: 0.8163, test_f1: 0.5609
 epoch: 11, train_loss: 0.8442, test_loss: 0.8235, test_f1: 0.5507
 epoch: 12, train_loss: 0.8285, test_loss: 0.8313, test_f1: 0.5544
 epoch: 13, train_loss: 0.8279, test_loss: 0.7812, test_f1: 0.5580
 epoch: 14, train_loss: 0.8055, test_loss: 0.7545, test_f1: 0.6179
 epoch: 15, train_loss: 0.7978, test_loss: 0.7771, test_f1: 0.5946
 epoch: 16, train_loss: 0.7922, test_loss: 0.7886, test_f1: 0.5787
 epoch: 17, train_loss: 0.8008, test_loss: 0.7925, test_f1: 0.5511
 epoch: 18, train_loss: 0.7774, test_loss: 0.8036, test_f1: 0.5555
 epoch: 19, train_loss: 0.7720, test_loss: 0.7798, test_f1: 0.5855
 epoch: 20, train_loss: 0.7602, test_loss: 0.7330, test_f1: 0.5941
 epoch: 21, train_loss: 0.7527, test_loss: 0.8341, test_f1: 0.5737
 epoch: 22, train_loss: 0.7472, test_loss: 0.7643, test_f1: 0.6228
 epoch: 23, train_loss: 0.7520, test_loss: 0.7975, test_f1: 0.6220
 epoch: 24, train_loss: 0.7421, test_loss: 0.7449, test_f1: 0.6314
 epoch: 25, train_loss: 0.7439, test_loss: 0.7723, test_f1: 0.5891
 epoch: 26, train_loss: 0.7153, test_loss: 0.7546, test_f1: 0.6298
 epoch: 27, train_loss: 0.7051, test_loss: 0.7302, test_f1: 0.6468
 epoch: 28, train_loss: 0.7113, test_loss: 0.7431, test_f1: 0.6480
 epoch: 29, train_loss: 0.7032, test_loss: 0.7806, test_f1: 0.6200
 epoch: 30, train_loss: 0.6971, test_loss: 0.7653, test_f1: 0.6010
 epoch: 31, train_loss: 0.6836, test_loss: 0.7818, test_f1: 0.6279
 epoch: 32, train_loss: 0.6822, test_loss: 0.6916, test_f1: 0.6324
 epoch: 33, train_loss: 0.6746, test_loss: 0.7525, test_f1: 0.6299
 epoch: 34, train_loss: 0.6784, test_loss: 0.7430, test_f1: 0.6198
 epoch: 35, train_loss: 0.6769, test_loss: 0.7140, test_f1: 0.6231
 epoch: 36, train_loss: 0.6747, test_loss: 0.7656, test_f1: 0.6464
 epoch: 37, train_loss: 0.6665, test_loss: 0.7686, test_f1: 0.6375
 epoch: 38, train_loss: 0.6643, test_loss: 0.8447, test_f1: 0.6158
 epoch: 39, train_loss: 0.6650, test_loss: 0.7222, test_f1: 0.6494
 epoch: 40, train_loss: 0.6650, test_loss: 0.7393, test_f1: 0.6395
 epoch: 41, train_loss: 0.6398, test_loss: 0.7364, test_f1: 0.6407
 epoch: 42, train_loss: 0.6340, test_loss: 0.7009, test_f1: 0.6609
 epoch: 43, train_loss: 0.6414, test_loss: 0.7760, test_f1: 0.6498
 epoch: 44, train_loss: 0.6531, test_loss: 0.7358, test_f1: 0.6303
 epoch: 45, train_loss: 0.6387, test_loss: 0.8434, test_f1: 0.6200
 epoch: 46, train_loss: 0.6371, test_loss: 0.7912, test_f1: 0.6179
 epoch: 47, train_loss: 0.6114, test_loss: 0.7029, test_f1: 0.6773
 epoch: 48, train_loss: 0.6265, test_loss: 0.8229, test_f1: 0.6316
 epoch: 49, train_loss: 0.6125, test_loss: 0.7950, test_f1: 0.6364
 epoch: 50, train_loss: 0.6027, test_loss: 0.6791, test_f1: 0.6949
 epoch: 51, train_loss: 0.5924, test_loss: 0.6939, test_f1: 0.6862
 epoch: 52, train_loss: 0.5874, test_loss: 0.7735, test_f1: 0.6555
 epoch: 53, train_loss: 0.5666, test_loss: 0.7302, test_f1: 0.6602
 epoch: 54, train_loss: 0.5713, test_loss: 0.7909, test_f1: 0.6574
 epoch: 55, train_loss: 0.5699, test_loss: 0.7427, test_f1: 0.6623
 epoch: 56, train_loss: 0.5726, test_loss: 0.7135, test_f1: 0.6775
 epoch: 57, train_loss: 0.5669, test_loss: 0.7566, test_f1: 0.6575
 epoch: 58, train_loss: 0.5525, test_loss: 0.7589, test_f1: 0.6669
 epoch: 59, train_loss: 0.5557, test_loss: 0.7896, test_f1: 0.6547
 epoch: 60, train_loss: 0.5605, test_loss: 0.7363, test_f1: 0.6770
 epoch: 61, train_loss: 0.5405, test_loss: 0.7589, test_f1: 0.6664
 epoch: 62, train_loss: 0.5431, test_loss: 0.7331, test_f1: 0.6678
 epoch: 63, train_loss: 0.5457, test_loss: 0.8270, test_f1: 0.6566
 epoch: 64, train_loss: 0.5403, test_loss: 0.7378, test_f1: 0.6791
 epoch: 65, train_loss: 0.5549, test_loss: 0.7821, test_f1: 0.6589
 epoch: 66, train_loss: 0.5197, test_loss: 0.7605, test_f1: 0.6732
 epoch: 67, train_loss: 0.5316, test_loss: 0.7791, test_f1: 0.6611
 epoch: 68, train_loss: 0.5297, test_loss: 0.8505, test_f1: 0.6665
 epoch: 69, train_loss: 0.5309, test_loss: 0.7791, test_f1: 0.6783
 epoch: 70, train_loss: 0.5278, test_loss: 0.7988, test_f1: 0.6735
 epoch: 71, train_loss: 0.5228, test_loss: 0.7988, test_f1: 0.6780
 epoch: 72, train_loss: 0.5077, test_loss: 0.8233, test_f1: 0.6680
 epoch: 73, train_loss: 0.5183, test_loss: 0.9122, test_f1: 0.6470
 epoch: 74, train_loss: 0.5315, test_loss: 0.8965, test_f1: 0.6623
 epoch: 75, train_loss: 0.5184, test_loss: 0.9615, test_f1: 0.6511
 epoch: 76, train_loss: 0.5099, test_loss: 0.8442, test_f1: 0.6600
 epoch: 77, train_loss: 0.5188, test_loss: 1.0038, test_f1: 0.6490
 epoch: 78, train_loss: 0.5017, test_loss: 0.7854, test_f1: 0.6447
 epoch: 79, train_loss: 0.4956, test_loss: 0.9390, test_f1: 0.6620
 epoch: 80, train_loss: 0.4972, test_loss: 0.8437, test_f1: 0.6686
 epoch: 81, train_loss: 0.5048, test_loss: 0.8545, test_f1: 0.6732
 epoch: 82, train_loss: 0.5095, test_loss: 1.0965, test_f1: 0.6393
 epoch: 83, train_loss: 0.5003, test_loss: 0.9267, test_f1: 0.6483
 epoch: 84, train_loss: 0.4798, test_loss: 0.8701, test_f1: 0.6565
 epoch: 85, train_loss: 0.4867, test_loss: 0.9529, test_f1: 0.6437
 epoch: 86, train_loss: 0.4946, test_loss: 0.9442, test_f1: 0.6507
 epoch: 87, train_loss: 0.4934, test_loss: 1.0443, test_f1: 0.6668
 epoch: 88, train_loss: 0.4873, test_loss: 0.9339, test_f1: 0.6479
 epoch: 89, train_loss: 0.4981, test_loss: 0.9687, test_f1: 0.6669
 epoch: 90, train_loss: 0.4662, test_loss: 0.9543, test_f1: 0.6775
 epoch: 91, train_loss: 0.4773, test_loss: 0.9586, test_f1: 0.6720
 epoch: 92, train_loss: 0.4551, test_loss: 0.9529, test_f1: 0.6552
 epoch: 93, train_loss: 0.4877, test_loss: 1.1062, test_f1: 0.6367
 epoch: 94, train_loss: 0.4935, test_loss: 1.0090, test_f1: 0.6676
 epoch: 95, train_loss: 0.4835, test_loss: 1.0561, test_f1: 0.6754
 epoch: 96, train_loss: 0.4664, test_loss: 0.9552, test_f1: 0.6659
 epoch: 97, train_loss: 0.4728, test_loss: 1.0046, test_f1: 0.6491
 epoch: 98, train_loss: 0.4874, test_loss: 0.9281, test_f1: 0.6603
 epoch: 99, train_loss: 0.4644, test_loss: 1.0179, test_f1: 0.6689
##################ITERATION #2 ****************************************
 epoch: 0, train_loss: 1.1293, test_loss: 1.1840, test_f1: 0.3290
 epoch: 1, train_loss: 0.9910, test_loss: 0.9871, test_f1: 0.4784
 epoch: 2, train_loss: 0.9727, test_loss: 0.9608, test_f1: 0.4868
 epoch: 3, train_loss: 0.9456, test_loss: 0.9381, test_f1: 0.5175
 epoch: 4, train_loss: 0.9351, test_loss: 0.9631, test_f1: 0.5180
 epoch: 5, train_loss: 0.9090, test_loss: 0.8724, test_f1: 0.5236
 epoch: 6, train_loss: 0.8942, test_loss: 0.8515, test_f1: 0.5338
 epoch: 7, train_loss: 0.8863, test_loss: 0.8925, test_f1: 0.5605
 epoch: 8, train_loss: 0.8792, test_loss: 0.8957, test_f1: 0.5404
 epoch: 9, train_loss: 0.8681, test_loss: 0.8139, test_f1: 0.5911
 epoch: 10, train_loss: 0.8507, test_loss: 0.8566, test_f1: 0.5787
 epoch: 11, train_loss: 0.8342, test_loss: 0.8323, test_f1: 0.5159
 epoch: 12, train_loss: 0.8425, test_loss: 0.8268, test_f1: 0.5804
 epoch: 13, train_loss: 0.8319, test_loss: 0.8060, test_f1: 0.5686
 epoch: 14, train_loss: 0.8152, test_loss: 0.8185, test_f1: 0.5768
 epoch: 15, train_loss: 0.8041, test_loss: 0.8497, test_f1: 0.6025
 epoch: 16, train_loss: 0.7916, test_loss: 0.8674, test_f1: 0.6244
 epoch: 17, train_loss: 0.7892, test_loss: 0.8257, test_f1: 0.6096
 epoch: 18, train_loss: 0.7869, test_loss: 0.7919, test_f1: 0.6254
 epoch: 19, train_loss: 0.7614, test_loss: 0.7925, test_f1: 0.6077
 epoch: 20, train_loss: 0.7658, test_loss: 0.7644, test_f1: 0.5996
 epoch: 21, train_loss: 0.7574, test_loss: 0.7622, test_f1: 0.6189
 epoch: 22, train_loss: 0.7451, test_loss: 0.8075, test_f1: 0.6184
 epoch: 23, train_loss: 0.7336, test_loss: 0.8186, test_f1: 0.6370
 epoch: 24, train_loss: 0.7267, test_loss: 0.7885, test_f1: 0.6355
 epoch: 25, train_loss: 0.7282, test_loss: 0.8008, test_f1: 0.6253
 epoch: 26, train_loss: 0.7077, test_loss: 0.8030, test_f1: 0.6134
 epoch: 27, train_loss: 0.7083, test_loss: 0.7649, test_f1: 0.6545
 epoch: 28, train_loss: 0.7025, test_loss: 0.7774, test_f1: 0.6186
 epoch: 29, train_loss: 0.6841, test_loss: 0.7835, test_f1: 0.6241
 epoch: 30, train_loss: 0.6852, test_loss: 0.7681, test_f1: 0.6393
 epoch: 31, train_loss: 0.6806, test_loss: 0.8006, test_f1: 0.6499
 epoch: 32, train_loss: 0.6816, test_loss: 0.7843, test_f1: 0.6544
 epoch: 33, train_loss: 0.6925, test_loss: 0.7995, test_f1: 0.6364
 epoch: 34, train_loss: 0.6567, test_loss: 0.7515, test_f1: 0.6406
 epoch: 35, train_loss: 0.6676, test_loss: 0.7848, test_f1: 0.6323
 epoch: 36, train_loss: 0.6696, test_loss: 0.7646, test_f1: 0.6313
 epoch: 37, train_loss: 0.6671, test_loss: 0.7745, test_f1: 0.6153
 epoch: 38, train_loss: 0.6447, test_loss: 0.7826, test_f1: 0.6605
 epoch: 39, train_loss: 0.6525, test_loss: 0.7460, test_f1: 0.6408
 epoch: 40, train_loss: 0.6281, test_loss: 0.7698, test_f1: 0.6533
 epoch: 41, train_loss: 0.6536, test_loss: 0.8089, test_f1: 0.6284
 epoch: 42, train_loss: 0.6386, test_loss: 0.7266, test_f1: 0.6608
 epoch: 43, train_loss: 0.6338, test_loss: 0.7914, test_f1: 0.6040
 epoch: 44, train_loss: 0.6381, test_loss: 0.8132, test_f1: 0.6361
 epoch: 45, train_loss: 0.6164, test_loss: 0.7450, test_f1: 0.6615
 epoch: 46, train_loss: 0.6149, test_loss: 0.7810, test_f1: 0.6273
 epoch: 47, train_loss: 0.5891, test_loss: 0.7305, test_f1: 0.6555
 epoch: 48, train_loss: 0.6140, test_loss: 0.8775, test_f1: 0.6416
 epoch: 49, train_loss: 0.6032, test_loss: 0.7269, test_f1: 0.6613
 epoch: 50, train_loss: 0.6049, test_loss: 0.8217, test_f1: 0.6652
 epoch: 51, train_loss: 0.5794, test_loss: 0.7916, test_f1: 0.6547
 epoch: 52, train_loss: 0.5574, test_loss: 0.8048, test_f1: 0.6498
 epoch: 53, train_loss: 0.5609, test_loss: 0.8048, test_f1: 0.6534
 epoch: 54, train_loss: 0.5556, test_loss: 0.8325, test_f1: 0.6512
 epoch: 55, train_loss: 0.5470, test_loss: 0.7934, test_f1: 0.6728
 epoch: 56, train_loss: 0.5581, test_loss: 0.7389, test_f1: 0.6606
 epoch: 57, train_loss: 0.5479, test_loss: 0.7532, test_f1: 0.6505
 epoch: 58, train_loss: 0.5386, test_loss: 0.8142, test_f1: 0.6487
 epoch: 59, train_loss: 0.5407, test_loss: 0.7862, test_f1: 0.6314
 epoch: 60, train_loss: 0.5342, test_loss: 0.7809, test_f1: 0.6613
 epoch: 61, train_loss: 0.5215, test_loss: 0.8477, test_f1: 0.6396
 epoch: 62, train_loss: 0.5343, test_loss: 0.8211, test_f1: 0.6481
 epoch: 63, train_loss: 0.5466, test_loss: 0.8476, test_f1: 0.6532
 epoch: 64, train_loss: 0.5284, test_loss: 0.8200, test_f1: 0.6464
 epoch: 65, train_loss: 0.5108, test_loss: 0.8932, test_f1: 0.6530
 epoch: 66, train_loss: 0.5273, test_loss: 0.8444, test_f1: 0.6408
 epoch: 67, train_loss: 0.5083, test_loss: 0.8372, test_f1: 0.6471
 epoch: 68, train_loss: 0.5087, test_loss: 0.8417, test_f1: 0.6442
 epoch: 69, train_loss: 0.5204, test_loss: 0.8744, test_f1: 0.6356
 epoch: 70, train_loss: 0.5376, test_loss: 0.8431, test_f1: 0.6390
 epoch: 71, train_loss: 0.5240, test_loss: 0.8670, test_f1: 0.6320
 epoch: 72, train_loss: 0.5179, test_loss: 0.8743, test_f1: 0.6456
 epoch: 73, train_loss: 0.4981, test_loss: 0.8661, test_f1: 0.6412
 epoch: 74, train_loss: 0.5015, test_loss: 0.8654, test_f1: 0.6455
 epoch: 75, train_loss: 0.5005, test_loss: 0.9079, test_f1: 0.6495
 epoch: 76, train_loss: 0.5036, test_loss: 0.8909, test_f1: 0.6653
 epoch: 77, train_loss: 0.4931, test_loss: 0.8921, test_f1: 0.6504
 epoch: 78, train_loss: 0.5168, test_loss: 0.8928, test_f1: 0.6405
 epoch: 79, train_loss: 0.5035, test_loss: 0.9226, test_f1: 0.6312
 epoch: 80, train_loss: 0.4967, test_loss: 0.8469, test_f1: 0.6425
 epoch: 81, train_loss: 0.4945, test_loss: 0.9086, test_f1: 0.6371
 epoch: 82, train_loss: 0.4894, test_loss: 0.8547, test_f1: 0.6380
 epoch: 83, train_loss: 0.4915, test_loss: 0.8934, test_f1: 0.6477
 epoch: 84, train_loss: 0.4881, test_loss: 0.8804, test_f1: 0.6529
 epoch: 85, train_loss: 0.4959, test_loss: 0.8451, test_f1: 0.6704
 epoch: 86, train_loss: 0.4818, test_loss: 0.8169, test_f1: 0.6620
 epoch: 87, train_loss: 0.4757, test_loss: 0.9066, test_f1: 0.6563
 epoch: 88, train_loss: 0.4804, test_loss: 0.9103, test_f1: 0.6582
 epoch: 89, train_loss: 0.4709, test_loss: 0.9328, test_f1: 0.6479
 epoch: 90, train_loss: 0.4804, test_loss: 0.9469, test_f1: 0.6469
 epoch: 91, train_loss: 0.4783, test_loss: 0.9139, test_f1: 0.6516
 epoch: 92, train_loss: 0.4681, test_loss: 0.9714, test_f1: 0.6315
 epoch: 93, train_loss: 0.4753, test_loss: 0.9313, test_f1: 0.6423
 epoch: 94, train_loss: 0.4870, test_loss: 0.9248, test_f1: 0.6537
 epoch: 95, train_loss: 0.4668, test_loss: 0.9449, test_f1: 0.6633
 epoch: 96, train_loss: 0.4769, test_loss: 0.8688, test_f1: 0.6692
 epoch: 97, train_loss: 0.4693, test_loss: 0.8288, test_f1: 0.6640
 epoch: 98, train_loss: 0.4704, test_loss: 0.8030, test_f1: 0.6656
 epoch: 99, train_loss: 0.4640, test_loss: 0.8714, test_f1: 0.6527
##################ITERATION #3 ****************************************
 epoch: 0, train_loss: 1.1549, test_loss: 1.3318, test_f1: 0.2137
 epoch: 1, train_loss: 1.0066, test_loss: 0.9774, test_f1: 0.4575
 epoch: 2, train_loss: 0.9730, test_loss: 0.9132, test_f1: 0.5120
 epoch: 3, train_loss: 0.9445, test_loss: 0.9068, test_f1: 0.5332
 epoch: 4, train_loss: 0.9211, test_loss: 0.9094, test_f1: 0.5465
 epoch: 5, train_loss: 0.9126, test_loss: 0.8966, test_f1: 0.5443
 epoch: 6, train_loss: 0.8882, test_loss: 0.9492, test_f1: 0.5001
 epoch: 7, train_loss: 0.8654, test_loss: 0.8647, test_f1: 0.5398
 epoch: 8, train_loss: 0.8714, test_loss: 0.8599, test_f1: 0.5606
 epoch: 9, train_loss: 0.8549, test_loss: 0.8338, test_f1: 0.5749
 epoch: 10, train_loss: 0.8381, test_loss: 0.8484, test_f1: 0.5914
 epoch: 11, train_loss: 0.8218, test_loss: 0.8564, test_f1: 0.5900
 epoch: 12, train_loss: 0.8097, test_loss: 0.8016, test_f1: 0.5701
 epoch: 13, train_loss: 0.8014, test_loss: 0.7694, test_f1: 0.6052
 epoch: 14, train_loss: 0.7769, test_loss: 0.8087, test_f1: 0.6293
 epoch: 15, train_loss: 0.7699, test_loss: 0.8051, test_f1: 0.6089
 epoch: 16, train_loss: 0.7644, test_loss: 0.8136, test_f1: 0.5928
 epoch: 17, train_loss: 0.7634, test_loss: 0.8331, test_f1: 0.6287
 epoch: 18, train_loss: 0.7530, test_loss: 0.7596, test_f1: 0.6387
 epoch: 19, train_loss: 0.7307, test_loss: 0.8132, test_f1: 0.6104
 epoch: 20, train_loss: 0.7406, test_loss: 0.7749, test_f1: 0.6294
 epoch: 21, train_loss: 0.7197, test_loss: 0.7692, test_f1: 0.6211
 epoch: 22, train_loss: 0.7237, test_loss: 0.7798, test_f1: 0.6326
 epoch: 23, train_loss: 0.7210, test_loss: 0.8111, test_f1: 0.6220
 epoch: 24, train_loss: 0.7038, test_loss: 0.7228, test_f1: 0.6470
 epoch: 25, train_loss: 0.7040, test_loss: 0.7757, test_f1: 0.6293
 epoch: 26, train_loss: 0.7202, test_loss: 0.7746, test_f1: 0.6219
 epoch: 27, train_loss: 0.6966, test_loss: 0.7676, test_f1: 0.6002
 epoch: 28, train_loss: 0.7032, test_loss: 0.7446, test_f1: 0.6473
 epoch: 29, train_loss: 0.6753, test_loss: 0.7522, test_f1: 0.6762
 epoch: 30, train_loss: 0.6739, test_loss: 0.7648, test_f1: 0.5982
 epoch: 31, train_loss: 0.6785, test_loss: 0.8103, test_f1: 0.6251
 epoch: 32, train_loss: 0.6673, test_loss: 0.7581, test_f1: 0.6348
 epoch: 33, train_loss: 0.6559, test_loss: 0.7401, test_f1: 0.6465
 epoch: 34, train_loss: 0.6524, test_loss: 0.8039, test_f1: 0.6263
 epoch: 35, train_loss: 0.6498, test_loss: 0.7740, test_f1: 0.6059
 epoch: 36, train_loss: 0.6556, test_loss: 0.7763, test_f1: 0.6352
 epoch: 37, train_loss: 0.6337, test_loss: 0.7006, test_f1: 0.6724
 epoch: 38, train_loss: 0.6425, test_loss: 0.7782, test_f1: 0.6298
 epoch: 39, train_loss: 0.6294, test_loss: 0.7306, test_f1: 0.6483
 epoch: 40, train_loss: 0.6238, test_loss: 0.7652, test_f1: 0.6642
 epoch: 41, train_loss: 0.6213, test_loss: 0.7763, test_f1: 0.6551
 epoch: 42, train_loss: 0.6062, test_loss: 0.7465, test_f1: 0.6736
 epoch: 43, train_loss: 0.6279, test_loss: 0.7639, test_f1: 0.6507
 epoch: 44, train_loss: 0.5981, test_loss: 0.8106, test_f1: 0.6355
 epoch: 45, train_loss: 0.6105, test_loss: 0.7225, test_f1: 0.6726
 epoch: 46, train_loss: 0.6059, test_loss: 0.7334, test_f1: 0.6702
 epoch: 47, train_loss: 0.5913, test_loss: 0.7609, test_f1: 0.6509
 epoch: 48, train_loss: 0.5991, test_loss: 0.7745, test_f1: 0.6435
 epoch: 49, train_loss: 0.6076, test_loss: 0.7220, test_f1: 0.6424
 epoch: 50, train_loss: 0.5824, test_loss: 0.7233, test_f1: 0.6538
 epoch: 51, train_loss: 0.5520, test_loss: 0.7249, test_f1: 0.6637
 epoch: 52, train_loss: 0.5517, test_loss: 0.8481, test_f1: 0.6359
 epoch: 53, train_loss: 0.5496, test_loss: 0.7417, test_f1: 0.6677
 epoch: 54, train_loss: 0.5244, test_loss: 0.8806, test_f1: 0.6253
 epoch: 55, train_loss: 0.5394, test_loss: 0.7582, test_f1: 0.6675
 epoch: 56, train_loss: 0.5167, test_loss: 0.7923, test_f1: 0.6574
 epoch: 57, train_loss: 0.5266, test_loss: 0.7907, test_f1: 0.6640
 epoch: 58, train_loss: 0.5195, test_loss: 0.7778, test_f1: 0.6602
 epoch: 59, train_loss: 0.5123, test_loss: 0.7553, test_f1: 0.6530
 epoch: 60, train_loss: 0.5226, test_loss: 0.8525, test_f1: 0.6397
 epoch: 61, train_loss: 0.5205, test_loss: 0.9232, test_f1: 0.6329
 epoch: 62, train_loss: 0.5290, test_loss: 0.8007, test_f1: 0.6644
 epoch: 63, train_loss: 0.5003, test_loss: 0.7920, test_f1: 0.6652
 epoch: 64, train_loss: 0.5074, test_loss: 0.8035, test_f1: 0.6631
 epoch: 65, train_loss: 0.5049, test_loss: 0.8387, test_f1: 0.6392
 epoch: 66, train_loss: 0.5100, test_loss: 0.8651, test_f1: 0.6794
 epoch: 67, train_loss: 0.5007, test_loss: 0.8522, test_f1: 0.6614
 epoch: 68, train_loss: 0.5004, test_loss: 0.8214, test_f1: 0.6669
 epoch: 69, train_loss: 0.5096, test_loss: 0.8139, test_f1: 0.6804
 epoch: 70, train_loss: 0.5008, test_loss: 0.8384, test_f1: 0.6416
 epoch: 71, train_loss: 0.5018, test_loss: 0.9165, test_f1: 0.6616
 epoch: 72, train_loss: 0.4916, test_loss: 0.9259, test_f1: 0.6338
 epoch: 73, train_loss: 0.5066, test_loss: 0.8548, test_f1: 0.6666
 epoch: 74, train_loss: 0.4950, test_loss: 0.9443, test_f1: 0.6572
 epoch: 75, train_loss: 0.4884, test_loss: 0.8688, test_f1: 0.6630
 epoch: 76, train_loss: 0.4805, test_loss: 0.8888, test_f1: 0.6561
 epoch: 77, train_loss: 0.4916, test_loss: 0.9741, test_f1: 0.6263
 epoch: 78, train_loss: 0.4732, test_loss: 0.9489, test_f1: 0.6406
 epoch: 79, train_loss: 0.4766, test_loss: 0.9486, test_f1: 0.6363
 epoch: 80, train_loss: 0.4756, test_loss: 0.8778, test_f1: 0.6704
 epoch: 81, train_loss: 0.4625, test_loss: 0.9196, test_f1: 0.6492
 epoch: 82, train_loss: 0.4779, test_loss: 0.9585, test_f1: 0.6561
 epoch: 83, train_loss: 0.4784, test_loss: 0.9611, test_f1: 0.6369
 epoch: 84, train_loss: 0.4728, test_loss: 0.9117, test_f1: 0.6635
 epoch: 85, train_loss: 0.4711, test_loss: 0.9831, test_f1: 0.6349
 epoch: 86, train_loss: 0.4449, test_loss: 0.9204, test_f1: 0.6616
 epoch: 87, train_loss: 0.4730, test_loss: 0.9924, test_f1: 0.6536
 epoch: 88, train_loss: 0.4632, test_loss: 0.9912, test_f1: 0.6424
 epoch: 89, train_loss: 0.4492, test_loss: 0.9936, test_f1: 0.6570
 epoch: 90, train_loss: 0.4418, test_loss: 0.9147, test_f1: 0.6421
 epoch: 91, train_loss: 0.4379, test_loss: 0.9985, test_f1: 0.6433
 epoch: 92, train_loss: 0.4581, test_loss: 0.9942, test_f1: 0.6450
 epoch: 93, train_loss: 0.4535, test_loss: 0.9857, test_f1: 0.6590
 epoch: 94, train_loss: 0.4594, test_loss: 1.0156, test_f1: 0.6530
 epoch: 95, train_loss: 0.4677, test_loss: 0.9704, test_f1: 0.6498
 epoch: 96, train_loss: 0.4374, test_loss: 0.9787, test_f1: 0.6589
 epoch: 97, train_loss: 0.4444, test_loss: 1.0949, test_f1: 0.6461
 epoch: 98, train_loss: 0.4257, test_loss: 1.0983, test_f1: 0.6686
 epoch: 99, train_loss: 0.4367, test_loss: 1.0969, test_f1: 0.6479
##################ITERATION #4 ****************************************
 epoch: 0, train_loss: 1.2097, test_loss: 1.1123, test_f1: 0.4128
 epoch: 1, train_loss: 1.0150, test_loss: 0.9880, test_f1: 0.4770
 epoch: 2, train_loss: 0.9902, test_loss: 0.9635, test_f1: 0.4945
 epoch: 3, train_loss: 0.9502, test_loss: 0.9492, test_f1: 0.5151
 epoch: 4, train_loss: 0.9406, test_loss: 0.9450, test_f1: 0.4674
 epoch: 5, train_loss: 0.9186, test_loss: 0.9019, test_f1: 0.5122
 epoch: 6, train_loss: 0.9113, test_loss: 0.9132, test_f1: 0.5181
 epoch: 7, train_loss: 0.8916, test_loss: 0.9061, test_f1: 0.5175
 epoch: 8, train_loss: 0.8815, test_loss: 0.9115, test_f1: 0.5430
 epoch: 9, train_loss: 0.8720, test_loss: 0.9150, test_f1: 0.5542
 epoch: 10, train_loss: 0.8625, test_loss: 0.9321, test_f1: 0.5397
 epoch: 11, train_loss: 0.8568, test_loss: 0.8914, test_f1: 0.5422
 epoch: 12, train_loss: 0.8383, test_loss: 0.9375, test_f1: 0.5087
 epoch: 13, train_loss: 0.8174, test_loss: 0.9680, test_f1: 0.5202
 epoch: 14, train_loss: 0.8305, test_loss: 0.8809, test_f1: 0.5847
 epoch: 15, train_loss: 0.8079, test_loss: 0.9035, test_f1: 0.5497
 epoch: 16, train_loss: 0.7980, test_loss: 0.8927, test_f1: 0.5791
 epoch: 17, train_loss: 0.7921, test_loss: 0.8631, test_f1: 0.5825
 epoch: 18, train_loss: 0.7866, test_loss: 0.9021, test_f1: 0.5834
 epoch: 19, train_loss: 0.7738, test_loss: 0.8800, test_f1: 0.6037
 epoch: 20, train_loss: 0.7641, test_loss: 0.8251, test_f1: 0.6019
 epoch: 21, train_loss: 0.7646, test_loss: 0.8824, test_f1: 0.5809
 epoch: 22, train_loss: 0.7490, test_loss: 0.8899, test_f1: 0.5581
 epoch: 23, train_loss: 0.7443, test_loss: 0.8703, test_f1: 0.5729
 epoch: 24, train_loss: 0.7234, test_loss: 0.8858, test_f1: 0.5917
 epoch: 25, train_loss: 0.7246, test_loss: 0.8526, test_f1: 0.5938
 epoch: 26, train_loss: 0.7308, test_loss: 0.8418, test_f1: 0.6048
 epoch: 27, train_loss: 0.7262, test_loss: 0.8554, test_f1: 0.5990
 epoch: 28, train_loss: 0.7003, test_loss: 0.8207, test_f1: 0.6185
 epoch: 29, train_loss: 0.7000, test_loss: 0.8237, test_f1: 0.6103
 epoch: 30, train_loss: 0.6936, test_loss: 0.8794, test_f1: 0.5897
 epoch: 31, train_loss: 0.7024, test_loss: 0.8236, test_f1: 0.6179
 epoch: 32, train_loss: 0.6990, test_loss: 0.8066, test_f1: 0.6071
 epoch: 33, train_loss: 0.6789, test_loss: 0.8687, test_f1: 0.5817
 epoch: 34, train_loss: 0.6705, test_loss: 0.8384, test_f1: 0.6104
 epoch: 35, train_loss: 0.6694, test_loss: 0.9199, test_f1: 0.5929
 epoch: 36, train_loss: 0.6894, test_loss: 0.9042, test_f1: 0.6206
 epoch: 37, train_loss: 0.6552, test_loss: 0.7736, test_f1: 0.6192
 epoch: 38, train_loss: 0.6438, test_loss: 0.8113, test_f1: 0.6241
 epoch: 39, train_loss: 0.6415, test_loss: 0.8565, test_f1: 0.6299
 epoch: 40, train_loss: 0.6209, test_loss: 0.8462, test_f1: 0.6366
 epoch: 41, train_loss: 0.6444, test_loss: 0.9237, test_f1: 0.6124
 epoch: 42, train_loss: 0.6275, test_loss: 0.9002, test_f1: 0.6314
 epoch: 43, train_loss: 0.6191, test_loss: 0.8145, test_f1: 0.6337
 epoch: 44, train_loss: 0.6229, test_loss: 0.9073, test_f1: 0.6204
 epoch: 45, train_loss: 0.6151, test_loss: 0.8703, test_f1: 0.6248
 epoch: 46, train_loss: 0.6242, test_loss: 0.8319, test_f1: 0.6411
 epoch: 47, train_loss: 0.6160, test_loss: 0.9354, test_f1: 0.6318
 epoch: 48, train_loss: 0.5891, test_loss: 0.8373, test_f1: 0.6193
 epoch: 49, train_loss: 0.5985, test_loss: 0.8552, test_f1: 0.6355
 epoch: 50, train_loss: 0.5922, test_loss: 0.8580, test_f1: 0.6291
 epoch: 51, train_loss: 0.5750, test_loss: 0.8768, test_f1: 0.6522
 epoch: 52, train_loss: 0.5639, test_loss: 0.9028, test_f1: 0.6174
 epoch: 53, train_loss: 0.5567, test_loss: 0.8968, test_f1: 0.6497
 epoch: 54, train_loss: 0.5506, test_loss: 0.8859, test_f1: 0.6536
 epoch: 55, train_loss: 0.5409, test_loss: 0.9470, test_f1: 0.6390
 epoch: 56, train_loss: 0.5438, test_loss: 0.9141, test_f1: 0.6323
 epoch: 57, train_loss: 0.5405, test_loss: 0.8211, test_f1: 0.6604
 epoch: 58, train_loss: 0.5292, test_loss: 0.8628, test_f1: 0.6501
 epoch: 59, train_loss: 0.5394, test_loss: 0.8799, test_f1: 0.6636
 epoch: 60, train_loss: 0.5270, test_loss: 0.9288, test_f1: 0.6539
 epoch: 61, train_loss: 0.5350, test_loss: 0.8720, test_f1: 0.6555
 epoch: 62, train_loss: 0.5217, test_loss: 0.9274, test_f1: 0.6513
 epoch: 63, train_loss: 0.5197, test_loss: 1.0389, test_f1: 0.6117
 epoch: 64, train_loss: 0.5380, test_loss: 0.8696, test_f1: 0.6553
 epoch: 65, train_loss: 0.5132, test_loss: 0.9301, test_f1: 0.6434
 epoch: 66, train_loss: 0.5119, test_loss: 0.8887, test_f1: 0.6759
 epoch: 67, train_loss: 0.5016, test_loss: 0.9346, test_f1: 0.6367
 epoch: 68, train_loss: 0.5206, test_loss: 0.9919, test_f1: 0.6226
 epoch: 69, train_loss: 0.5039, test_loss: 0.9038, test_f1: 0.6607
 epoch: 70, train_loss: 0.5013, test_loss: 1.0264, test_f1: 0.6382
 epoch: 71, train_loss: 0.5008, test_loss: 1.0209, test_f1: 0.6302
 epoch: 72, train_loss: 0.4921, test_loss: 0.9927, test_f1: 0.6135
 epoch: 73, train_loss: 0.4934, test_loss: 0.9234, test_f1: 0.6546
 epoch: 74, train_loss: 0.5002, test_loss: 1.0016, test_f1: 0.6354
 epoch: 75, train_loss: 0.4896, test_loss: 0.9952, test_f1: 0.6519
 epoch: 76, train_loss: 0.4917, test_loss: 1.2302, test_f1: 0.5980
 epoch: 77, train_loss: 0.4906, test_loss: 1.0962, test_f1: 0.6300
 epoch: 78, train_loss: 0.4876, test_loss: 1.0568, test_f1: 0.6281
 epoch: 79, train_loss: 0.4852, test_loss: 1.0382, test_f1: 0.6202
 epoch: 80, train_loss: 0.4712, test_loss: 1.0666, test_f1: 0.6494
 epoch: 81, train_loss: 0.4835, test_loss: 1.0715, test_f1: 0.6272
 epoch: 82, train_loss: 0.4745, test_loss: 1.0525, test_f1: 0.6394
 epoch: 83, train_loss: 0.4754, test_loss: 1.0396, test_f1: 0.6549
 epoch: 84, train_loss: 0.4705, test_loss: 1.0976, test_f1: 0.6258
 epoch: 85, train_loss: 0.4653, test_loss: 1.1155, test_f1: 0.6365
 epoch: 86, train_loss: 0.4606, test_loss: 1.0923, test_f1: 0.6551
 epoch: 87, train_loss: 0.4631, test_loss: 1.0983, test_f1: 0.6186
 epoch: 88, train_loss: 0.4748, test_loss: 1.1382, test_f1: 0.6235
 epoch: 89, train_loss: 0.4643, test_loss: 1.1149, test_f1: 0.6417
 epoch: 90, train_loss: 0.4821, test_loss: 1.0491, test_f1: 0.6577
 epoch: 91, train_loss: 0.4556, test_loss: 1.1069, test_f1: 0.6611
 epoch: 92, train_loss: 0.4571, test_loss: 1.0647, test_f1: 0.6734
 epoch: 93, train_loss: 0.4677, test_loss: 1.0982, test_f1: 0.6379
 epoch: 94, train_loss: 0.4597, test_loss: 1.0981, test_f1: 0.6552
 epoch: 95, train_loss: 0.4473, test_loss: 1.1537, test_f1: 0.6279
 epoch: 96, train_loss: 0.4356, test_loss: 1.1105, test_f1: 0.6381
 epoch: 97, train_loss: 0.4301, test_loss: 1.1239, test_f1: 0.6418
 epoch: 98, train_loss: 0.4343, test_loss: 1.2454, test_f1: 0.6243
 epoch: 99, train_loss: 0.4451, test_loss: 1.1921, test_f1: 0.6406
##################ITERATION #5 ****************************************
 epoch: 0, train_loss: 1.3192, test_loss: 1.3464, test_f1: 0.3140
 epoch: 1, train_loss: 1.0585, test_loss: 1.0017, test_f1: 0.4723
 epoch: 2, train_loss: 1.0089, test_loss: 0.9369, test_f1: 0.5082
 epoch: 3, train_loss: 0.9727, test_loss: 0.9579, test_f1: 0.4891
 epoch: 4, train_loss: 0.9594, test_loss: 0.9325, test_f1: 0.5337
 epoch: 5, train_loss: 0.9368, test_loss: 0.9273, test_f1: 0.5235
 epoch: 6, train_loss: 0.9141, test_loss: 0.8952, test_f1: 0.5341
 epoch: 7, train_loss: 0.9050, test_loss: 0.8981, test_f1: 0.5395
 epoch: 8, train_loss: 0.8831, test_loss: 0.9008, test_f1: 0.5502
 epoch: 9, train_loss: 0.8820, test_loss: 0.9065, test_f1: 0.5229
 epoch: 10, train_loss: 0.8660, test_loss: 0.8667, test_f1: 0.5366
 epoch: 11, train_loss: 0.8465, test_loss: 0.8367, test_f1: 0.5488
 epoch: 12, train_loss: 0.8226, test_loss: 0.8644, test_f1: 0.5622
 epoch: 13, train_loss: 0.8207, test_loss: 0.8543, test_f1: 0.5520
 epoch: 14, train_loss: 0.8247, test_loss: 0.9140, test_f1: 0.5370
 epoch: 15, train_loss: 0.8063, test_loss: 0.8614, test_f1: 0.5817
 epoch: 16, train_loss: 0.7791, test_loss: 0.8346, test_f1: 0.5986
 epoch: 17, train_loss: 0.7906, test_loss: 0.8210, test_f1: 0.5749
 epoch: 18, train_loss: 0.7763, test_loss: 0.8136, test_f1: 0.6169
 epoch: 19, train_loss: 0.7625, test_loss: 0.8370, test_f1: 0.5863
 epoch: 20, train_loss: 0.7450, test_loss: 0.8166, test_f1: 0.5910
 epoch: 21, train_loss: 0.7510, test_loss: 0.8020, test_f1: 0.6270
 epoch: 22, train_loss: 0.7561, test_loss: 0.7957, test_f1: 0.6180
 epoch: 23, train_loss: 0.7246, test_loss: 0.8327, test_f1: 0.5971
 epoch: 24, train_loss: 0.7285, test_loss: 0.7937, test_f1: 0.6109
 epoch: 25, train_loss: 0.7075, test_loss: 0.8008, test_f1: 0.6121
 epoch: 26, train_loss: 0.7149, test_loss: 0.7903, test_f1: 0.6150
 epoch: 27, train_loss: 0.7046, test_loss: 0.7913, test_f1: 0.5842
 epoch: 28, train_loss: 0.6920, test_loss: 0.7307, test_f1: 0.6498
 epoch: 29, train_loss: 0.6910, test_loss: 0.7116, test_f1: 0.6601
 epoch: 30, train_loss: 0.6651, test_loss: 0.7652, test_f1: 0.6441
 epoch: 31, train_loss: 0.6706, test_loss: 0.8116, test_f1: 0.6223
 epoch: 32, train_loss: 0.6640, test_loss: 0.8163, test_f1: 0.6152
 epoch: 33, train_loss: 0.6594, test_loss: 0.7925, test_f1: 0.6289
 epoch: 34, train_loss: 0.6562, test_loss: 0.7259, test_f1: 0.6480
 epoch: 35, train_loss: 0.6508, test_loss: 0.7896, test_f1: 0.5870
 epoch: 36, train_loss: 0.6368, test_loss: 0.7280, test_f1: 0.6601
 epoch: 37, train_loss: 0.6343, test_loss: 0.8031, test_f1: 0.6419
 epoch: 38, train_loss: 0.6357, test_loss: 0.7494, test_f1: 0.6554
 epoch: 39, train_loss: 0.6229, test_loss: 0.8198, test_f1: 0.6200
 epoch: 40, train_loss: 0.6307, test_loss: 0.7208, test_f1: 0.6765
 epoch: 41, train_loss: 0.6105, test_loss: 0.7594, test_f1: 0.6301
 epoch: 42, train_loss: 0.6120, test_loss: 0.7616, test_f1: 0.6649
 epoch: 43, train_loss: 0.6024, test_loss: 0.7775, test_f1: 0.6771
 epoch: 44, train_loss: 0.5914, test_loss: 0.7739, test_f1: 0.6455
 epoch: 45, train_loss: 0.6149, test_loss: 0.7718, test_f1: 0.6456
 epoch: 46, train_loss: 0.5896, test_loss: 0.7342, test_f1: 0.6519
 epoch: 47, train_loss: 0.6040, test_loss: 0.8074, test_f1: 0.6333
 epoch: 48, train_loss: 0.5693, test_loss: 0.8004, test_f1: 0.6405
 epoch: 49, train_loss: 0.5871, test_loss: 0.8405, test_f1: 0.6288
 epoch: 50, train_loss: 0.5759, test_loss: 0.7466, test_f1: 0.6533
 epoch: 51, train_loss: 0.5502, test_loss: 0.7392, test_f1: 0.6558
 epoch: 52, train_loss: 0.5360, test_loss: 0.7621, test_f1: 0.6485
 epoch: 53, train_loss: 0.5243, test_loss: 0.7688, test_f1: 0.6672
 epoch: 54, train_loss: 0.5271, test_loss: 0.7781, test_f1: 0.6510
 epoch: 55, train_loss: 0.5274, test_loss: 0.7245, test_f1: 0.6799
 epoch: 56, train_loss: 0.5218, test_loss: 0.7266, test_f1: 0.6707
 epoch: 57, train_loss: 0.5314, test_loss: 0.7187, test_f1: 0.6662
 epoch: 58, train_loss: 0.5181, test_loss: 0.7759, test_f1: 0.6623
 epoch: 59, train_loss: 0.5274, test_loss: 0.7723, test_f1: 0.6614
 epoch: 60, train_loss: 0.5064, test_loss: 0.7371, test_f1: 0.6774
 epoch: 61, train_loss: 0.5201, test_loss: 0.8113, test_f1: 0.6516
 epoch: 62, train_loss: 0.5161, test_loss: 0.7668, test_f1: 0.6768
 epoch: 63, train_loss: 0.5241, test_loss: 0.7547, test_f1: 0.6540
 epoch: 64, train_loss: 0.5171, test_loss: 0.7559, test_f1: 0.6591
 epoch: 65, train_loss: 0.5086, test_loss: 0.7547, test_f1: 0.6682
 epoch: 66, train_loss: 0.5059, test_loss: 0.7774, test_f1: 0.6927
 epoch: 67, train_loss: 0.4854, test_loss: 0.7669, test_f1: 0.6537
 epoch: 68, train_loss: 0.5072, test_loss: 0.7536, test_f1: 0.6609
 epoch: 69, train_loss: 0.4979, test_loss: 0.7774, test_f1: 0.6654
 epoch: 70, train_loss: 0.4784, test_loss: 0.7801, test_f1: 0.6497
 epoch: 71, train_loss: 0.5109, test_loss: 0.7769, test_f1: 0.6626
 epoch: 72, train_loss: 0.4838, test_loss: 0.7397, test_f1: 0.6853
 epoch: 73, train_loss: 0.4860, test_loss: 0.7981, test_f1: 0.6687
 epoch: 74, train_loss: 0.4869, test_loss: 0.7436, test_f1: 0.6878
 epoch: 75, train_loss: 0.4838, test_loss: 0.7865, test_f1: 0.6628
 epoch: 76, train_loss: 0.4712, test_loss: 0.7895, test_f1: 0.6690
 epoch: 77, train_loss: 0.4750, test_loss: 0.7585, test_f1: 0.6669
 epoch: 78, train_loss: 0.4534, test_loss: 0.7685, test_f1: 0.6857
 epoch: 79, train_loss: 0.4855, test_loss: 0.7559, test_f1: 0.6807
 epoch: 80, train_loss: 0.4655, test_loss: 0.7510, test_f1: 0.6816
 epoch: 81, train_loss: 0.4723, test_loss: 0.7503, test_f1: 0.6928
 epoch: 82, train_loss: 0.4745, test_loss: 0.8650, test_f1: 0.6523
 epoch: 83, train_loss: 0.4473, test_loss: 0.8074, test_f1: 0.6654
 epoch: 84, train_loss: 0.4526, test_loss: 0.7985, test_f1: 0.6713
 epoch: 85, train_loss: 0.4462, test_loss: 0.7573, test_f1: 0.6883
 epoch: 86, train_loss: 0.4497, test_loss: 0.8161, test_f1: 0.6591
 epoch: 87, train_loss: 0.4650, test_loss: 0.7554, test_f1: 0.7121
 epoch: 88, train_loss: 0.4605, test_loss: 0.8231, test_f1: 0.6788
 epoch: 89, train_loss: 0.4586, test_loss: 0.7822, test_f1: 0.6666
 epoch: 90, train_loss: 0.4615, test_loss: 0.7336, test_f1: 0.7102
 epoch: 91, train_loss: 0.4472, test_loss: 0.7829, test_f1: 0.6904
 epoch: 92, train_loss: 0.4346, test_loss: 0.8293, test_f1: 0.6765
 epoch: 93, train_loss: 0.4463, test_loss: 0.8011, test_f1: 0.6555
 epoch: 94, train_loss: 0.4486, test_loss: 0.8049, test_f1: 0.6827
 epoch: 95, train_loss: 0.4387, test_loss: 0.7776, test_f1: 0.6883
 epoch: 96, train_loss: 0.4463, test_loss: 0.8642, test_f1: 0.6588
 epoch: 97, train_loss: 0.4389, test_loss: 0.8279, test_f1: 0.6682
 epoch: 98, train_loss: 0.4503, test_loss: 0.7953, test_f1: 0.6656
 epoch: 99, train_loss: 0.4314, test_loss: 0.8194, test_f1: 0.6526
##################ITERATION #6 ****************************************
 epoch: 0, train_loss: 1.3310, test_loss: 1.1276, test_f1: 0.4057
 epoch: 1, train_loss: 1.0808, test_loss: 1.0088, test_f1: 0.4893
 epoch: 2, train_loss: 1.0067, test_loss: 0.9586, test_f1: 0.5009
 epoch: 3, train_loss: 0.9668, test_loss: 0.9653, test_f1: 0.5305
 epoch: 4, train_loss: 0.9510, test_loss: 0.9421, test_f1: 0.5177
 epoch: 5, train_loss: 0.9327, test_loss: 0.9441, test_f1: 0.5139
 epoch: 6, train_loss: 0.9117, test_loss: 0.9409, test_f1: 0.5556
 epoch: 7, train_loss: 0.9020, test_loss: 0.9223, test_f1: 0.5290
 epoch: 8, train_loss: 0.8861, test_loss: 0.9091, test_f1: 0.5629
 epoch: 9, train_loss: 0.8775, test_loss: 0.9036, test_f1: 0.5292
 epoch: 10, train_loss: 0.8579, test_loss: 0.8809, test_f1: 0.5912
 epoch: 11, train_loss: 0.8330, test_loss: 0.8641, test_f1: 0.5950
 epoch: 12, train_loss: 0.8369, test_loss: 0.8428, test_f1: 0.5778
 epoch: 13, train_loss: 0.8201, test_loss: 0.8533, test_f1: 0.5597
 epoch: 14, train_loss: 0.8274, test_loss: 0.8584, test_f1: 0.6173
 epoch: 15, train_loss: 0.8131, test_loss: 0.8234, test_f1: 0.5708
 epoch: 16, train_loss: 0.7880, test_loss: 0.8302, test_f1: 0.6307
 epoch: 17, train_loss: 0.7895, test_loss: 0.8235, test_f1: 0.5801
 epoch: 18, train_loss: 0.7840, test_loss: 0.8344, test_f1: 0.6299
 epoch: 19, train_loss: 0.7703, test_loss: 0.8111, test_f1: 0.6297
 epoch: 20, train_loss: 0.7649, test_loss: 0.8380, test_f1: 0.5971
 epoch: 21, train_loss: 0.7437, test_loss: 0.8051, test_f1: 0.6113
 epoch: 22, train_loss: 0.7473, test_loss: 0.8368, test_f1: 0.5869
 epoch: 23, train_loss: 0.7399, test_loss: 0.8827, test_f1: 0.6305
 epoch: 24, train_loss: 0.7345, test_loss: 0.7817, test_f1: 0.6253
 epoch: 25, train_loss: 0.7288, test_loss: 0.7974, test_f1: 0.6568
 epoch: 26, train_loss: 0.7294, test_loss: 0.7724, test_f1: 0.6414
 epoch: 27, train_loss: 0.7049, test_loss: 0.8488, test_f1: 0.6282
 epoch: 28, train_loss: 0.7255, test_loss: 0.7571, test_f1: 0.6649
 epoch: 29, train_loss: 0.7168, test_loss: 0.7889, test_f1: 0.6510
 epoch: 30, train_loss: 0.7036, test_loss: 0.7961, test_f1: 0.6404
 epoch: 31, train_loss: 0.6920, test_loss: 0.8051, test_f1: 0.6229
 epoch: 32, train_loss: 0.6910, test_loss: 0.7955, test_f1: 0.6346
 epoch: 33, train_loss: 0.6708, test_loss: 0.7799, test_f1: 0.6670
 epoch: 34, train_loss: 0.6806, test_loss: 0.8184, test_f1: 0.6583
 epoch: 35, train_loss: 0.6707, test_loss: 0.7877, test_f1: 0.6538
 epoch: 36, train_loss: 0.6680, test_loss: 0.8552, test_f1: 0.6517
 epoch: 37, train_loss: 0.6795, test_loss: 0.7831, test_f1: 0.6382
 epoch: 38, train_loss: 0.6643, test_loss: 0.7515, test_f1: 0.6538
 epoch: 39, train_loss: 0.6524, test_loss: 0.8037, test_f1: 0.6549
 epoch: 40, train_loss: 0.6587, test_loss: 0.8031, test_f1: 0.6539
 epoch: 41, train_loss: 0.6413, test_loss: 0.8016, test_f1: 0.6704
 epoch: 42, train_loss: 0.6410, test_loss: 0.8288, test_f1: 0.6444
 epoch: 43, train_loss: 0.6521, test_loss: 0.8327, test_f1: 0.6085
 epoch: 44, train_loss: 0.6330, test_loss: 0.7681, test_f1: 0.6534
 epoch: 45, train_loss: 0.6378, test_loss: 0.7852, test_f1: 0.6344
 epoch: 46, train_loss: 0.6261, test_loss: 0.7333, test_f1: 0.7053
 epoch: 47, train_loss: 0.6307, test_loss: 0.7855, test_f1: 0.6658
 epoch: 48, train_loss: 0.6230, test_loss: 0.8243, test_f1: 0.6536
 epoch: 49, train_loss: 0.6097, test_loss: 0.7997, test_f1: 0.6708
 epoch: 50, train_loss: 0.6257, test_loss: 0.8375, test_f1: 0.6175
 epoch: 51, train_loss: 0.5970, test_loss: 0.7642, test_f1: 0.6731
 epoch: 52, train_loss: 0.5650, test_loss: 0.8011, test_f1: 0.6892
 epoch: 53, train_loss: 0.5765, test_loss: 0.8160, test_f1: 0.6582
 epoch: 54, train_loss: 0.5668, test_loss: 0.7982, test_f1: 0.6774
 epoch: 55, train_loss: 0.5556, test_loss: 0.8298, test_f1: 0.6805
 epoch: 56, train_loss: 0.5636, test_loss: 0.7800, test_f1: 0.6596
 epoch: 57, train_loss: 0.5686, test_loss: 0.8156, test_f1: 0.6621
 epoch: 58, train_loss: 0.5635, test_loss: 0.8052, test_f1: 0.6494
 epoch: 59, train_loss: 0.5604, test_loss: 0.8104, test_f1: 0.6754
 epoch: 60, train_loss: 0.5678, test_loss: 0.8305, test_f1: 0.6492
 epoch: 61, train_loss: 0.5491, test_loss: 0.8045, test_f1: 0.6726
 epoch: 62, train_loss: 0.5389, test_loss: 0.7964, test_f1: 0.6733
 epoch: 63, train_loss: 0.5527, test_loss: 0.8307, test_f1: 0.6495
 epoch: 64, train_loss: 0.5337, test_loss: 0.8292, test_f1: 0.6644
 epoch: 65, train_loss: 0.5364, test_loss: 0.8602, test_f1: 0.6690
 epoch: 66, train_loss: 0.5381, test_loss: 0.8212, test_f1: 0.6543
 epoch: 67, train_loss: 0.5387, test_loss: 0.9338, test_f1: 0.6407
 epoch: 68, train_loss: 0.5349, test_loss: 0.8947, test_f1: 0.6457
 epoch: 69, train_loss: 0.5239, test_loss: 0.8788, test_f1: 0.6386
 epoch: 70, train_loss: 0.5152, test_loss: 0.8424, test_f1: 0.6522
 epoch: 71, train_loss: 0.5195, test_loss: 0.8508, test_f1: 0.6805
 epoch: 72, train_loss: 0.5286, test_loss: 0.9013, test_f1: 0.6398
 epoch: 73, train_loss: 0.5333, test_loss: 0.8339, test_f1: 0.6688
 epoch: 74, train_loss: 0.5320, test_loss: 0.8601, test_f1: 0.6850
 epoch: 75, train_loss: 0.5107, test_loss: 0.8131, test_f1: 0.6829
 epoch: 76, train_loss: 0.4932, test_loss: 0.8878, test_f1: 0.6685
 epoch: 77, train_loss: 0.5013, test_loss: 0.9253, test_f1: 0.6542
 epoch: 78, train_loss: 0.5279, test_loss: 0.8610, test_f1: 0.6659
 epoch: 79, train_loss: 0.4894, test_loss: 0.9169, test_f1: 0.6580
 epoch: 80, train_loss: 0.4899, test_loss: 0.8598, test_f1: 0.6858
 epoch: 81, train_loss: 0.4995, test_loss: 0.9492, test_f1: 0.6548
 epoch: 82, train_loss: 0.5021, test_loss: 0.9355, test_f1: 0.6631
 epoch: 83, train_loss: 0.5008, test_loss: 0.8922, test_f1: 0.6538
 epoch: 84, train_loss: 0.5126, test_loss: 0.9170, test_f1: 0.6556
 epoch: 85, train_loss: 0.5030, test_loss: 0.9842, test_f1: 0.6588
 epoch: 86, train_loss: 0.4952, test_loss: 0.9460, test_f1: 0.6593
 epoch: 87, train_loss: 0.4923, test_loss: 1.0476, test_f1: 0.6288
 epoch: 88, train_loss: 0.4772, test_loss: 0.9568, test_f1: 0.6516
 epoch: 89, train_loss: 0.4781, test_loss: 1.0360, test_f1: 0.6275
 epoch: 90, train_loss: 0.4960, test_loss: 0.9626, test_f1: 0.6571
 epoch: 91, train_loss: 0.4715, test_loss: 0.9612, test_f1: 0.6538
 epoch: 92, train_loss: 0.4916, test_loss: 0.9434, test_f1: 0.6668
 epoch: 93, train_loss: 0.4930, test_loss: 0.9913, test_f1: 0.6579
 epoch: 94, train_loss: 0.4862, test_loss: 0.9841, test_f1: 0.6663
 epoch: 95, train_loss: 0.4676, test_loss: 0.9998, test_f1: 0.6477
 epoch: 96, train_loss: 0.4805, test_loss: 0.9134, test_f1: 0.6742
 epoch: 97, train_loss: 0.5037, test_loss: 1.0620, test_f1: 0.6264
 epoch: 98, train_loss: 0.4747, test_loss: 0.9600, test_f1: 0.6767
 epoch: 99, train_loss: 0.4668, test_loss: 0.9262, test_f1: 0.6784
##################ITERATION #7 ****************************************
 epoch: 0, train_loss: 1.2342, test_loss: 1.2457, test_f1: 0.3944
 epoch: 1, train_loss: 1.0183, test_loss: 0.9763, test_f1: 0.4988
 epoch: 2, train_loss: 0.9768, test_loss: 0.9369, test_f1: 0.5177
 epoch: 3, train_loss: 0.9520, test_loss: 0.9124, test_f1: 0.5176
 epoch: 4, train_loss: 0.9358, test_loss: 0.9116, test_f1: 0.5162
 epoch: 5, train_loss: 0.9106, test_loss: 0.9530, test_f1: 0.5215
 epoch: 6, train_loss: 0.8979, test_loss: 0.9096, test_f1: 0.5840
 epoch: 7, train_loss: 0.8878, test_loss: 0.9142, test_f1: 0.5835
 epoch: 8, train_loss: 0.8787, test_loss: 0.9196, test_f1: 0.5554
 epoch: 9, train_loss: 0.8666, test_loss: 0.8774, test_f1: 0.5597
 epoch: 10, train_loss: 0.8406, test_loss: 0.8535, test_f1: 0.6000
 epoch: 11, train_loss: 0.8410, test_loss: 0.8639, test_f1: 0.5986
 epoch: 12, train_loss: 0.8246, test_loss: 0.9002, test_f1: 0.5794
 epoch: 13, train_loss: 0.8077, test_loss: 0.8879, test_f1: 0.6114
 epoch: 14, train_loss: 0.8077, test_loss: 0.8800, test_f1: 0.5936
 epoch: 15, train_loss: 0.8039, test_loss: 0.8650, test_f1: 0.5980
 epoch: 16, train_loss: 0.7817, test_loss: 0.8778, test_f1: 0.6206
 epoch: 17, train_loss: 0.7704, test_loss: 0.8729, test_f1: 0.6047
 epoch: 18, train_loss: 0.7693, test_loss: 0.8787, test_f1: 0.5852
 epoch: 19, train_loss: 0.7602, test_loss: 0.8874, test_f1: 0.6324
 epoch: 20, train_loss: 0.7623, test_loss: 0.8371, test_f1: 0.6193
 epoch: 21, train_loss: 0.7486, test_loss: 0.8702, test_f1: 0.5992
 epoch: 22, train_loss: 0.7464, test_loss: 0.8763, test_f1: 0.6323
 epoch: 23, train_loss: 0.7234, test_loss: 0.7977, test_f1: 0.6330
 epoch: 24, train_loss: 0.7234, test_loss: 0.8140, test_f1: 0.6316
 epoch: 25, train_loss: 0.7276, test_loss: 0.8485, test_f1: 0.6360
 epoch: 26, train_loss: 0.7045, test_loss: 0.8174, test_f1: 0.6410
 epoch: 27, train_loss: 0.7093, test_loss: 0.7652, test_f1: 0.6530
 epoch: 28, train_loss: 0.7106, test_loss: 0.8073, test_f1: 0.6570
 epoch: 29, train_loss: 0.6968, test_loss: 0.8121, test_f1: 0.6308
 epoch: 30, train_loss: 0.6961, test_loss: 0.7671, test_f1: 0.6197
 epoch: 31, train_loss: 0.7005, test_loss: 0.8309, test_f1: 0.6197
 epoch: 32, train_loss: 0.6727, test_loss: 0.8315, test_f1: 0.6353
 epoch: 33, train_loss: 0.6624, test_loss: 0.8374, test_f1: 0.6215
 epoch: 34, train_loss: 0.6612, test_loss: 0.8007, test_f1: 0.6478
 epoch: 35, train_loss: 0.6707, test_loss: 0.7742, test_f1: 0.6390
 epoch: 36, train_loss: 0.6565, test_loss: 0.8082, test_f1: 0.6451
 epoch: 37, train_loss: 0.6399, test_loss: 0.7942, test_f1: 0.6493
 epoch: 38, train_loss: 0.6608, test_loss: 0.8639, test_f1: 0.6395
 epoch: 39, train_loss: 0.6559, test_loss: 0.7818, test_f1: 0.6482
 epoch: 40, train_loss: 0.6725, test_loss: 0.8249, test_f1: 0.6362
 epoch: 41, train_loss: 0.6394, test_loss: 0.8210, test_f1: 0.6373
 epoch: 42, train_loss: 0.6221, test_loss: 0.8500, test_f1: 0.6439
 epoch: 43, train_loss: 0.6128, test_loss: 0.8629, test_f1: 0.6335
 epoch: 44, train_loss: 0.6346, test_loss: 0.8419, test_f1: 0.6434
 epoch: 45, train_loss: 0.6187, test_loss: 0.9535, test_f1: 0.5901
 epoch: 46, train_loss: 0.6213, test_loss: 0.8131, test_f1: 0.6322
 epoch: 47, train_loss: 0.6241, test_loss: 0.8343, test_f1: 0.6353
 epoch: 48, train_loss: 0.6049, test_loss: 0.7546, test_f1: 0.6730
 epoch: 49, train_loss: 0.6386, test_loss: 0.7470, test_f1: 0.6673
 epoch: 50, train_loss: 0.5966, test_loss: 0.8169, test_f1: 0.6338
 epoch: 51, train_loss: 0.5600, test_loss: 0.7988, test_f1: 0.6621
 epoch: 52, train_loss: 0.5599, test_loss: 0.8562, test_f1: 0.6438
 epoch: 53, train_loss: 0.5476, test_loss: 0.8130, test_f1: 0.6502
 epoch: 54, train_loss: 0.5391, test_loss: 0.8701, test_f1: 0.6431
 epoch: 55, train_loss: 0.5418, test_loss: 0.8418, test_f1: 0.6479
 epoch: 56, train_loss: 0.5572, test_loss: 0.7976, test_f1: 0.6509
 epoch: 57, train_loss: 0.5425, test_loss: 0.8498, test_f1: 0.6504
 epoch: 58, train_loss: 0.5370, test_loss: 0.8915, test_f1: 0.6364
 epoch: 59, train_loss: 0.5301, test_loss: 0.8613, test_f1: 0.6487
 epoch: 60, train_loss: 0.5319, test_loss: 0.8109, test_f1: 0.6629
 epoch: 61, train_loss: 0.5460, test_loss: 0.8070, test_f1: 0.6446
 epoch: 62, train_loss: 0.5277, test_loss: 0.8630, test_f1: 0.6484
 epoch: 63, train_loss: 0.5275, test_loss: 0.7939, test_f1: 0.6794
 epoch: 64, train_loss: 0.5409, test_loss: 0.8358, test_f1: 0.6548
 epoch: 65, train_loss: 0.5242, test_loss: 0.8373, test_f1: 0.6468
 epoch: 66, train_loss: 0.5179, test_loss: 0.8838, test_f1: 0.6466
 epoch: 67, train_loss: 0.5141, test_loss: 0.8832, test_f1: 0.6498
 epoch: 68, train_loss: 0.5368, test_loss: 0.9190, test_f1: 0.6491
 epoch: 69, train_loss: 0.5092, test_loss: 0.8991, test_f1: 0.6572
 epoch: 70, train_loss: 0.5213, test_loss: 0.8431, test_f1: 0.6712
 epoch: 71, train_loss: 0.5067, test_loss: 0.8841, test_f1: 0.6521
 epoch: 72, train_loss: 0.5216, test_loss: 0.8945, test_f1: 0.6501
 epoch: 73, train_loss: 0.4851, test_loss: 0.9118, test_f1: 0.6580
 epoch: 74, train_loss: 0.5127, test_loss: 0.8829, test_f1: 0.6470
 epoch: 75, train_loss: 0.5094, test_loss: 0.8485, test_f1: 0.6825
 epoch: 76, train_loss: 0.5108, test_loss: 0.9324, test_f1: 0.6391
 epoch: 77, train_loss: 0.5035, test_loss: 0.9214, test_f1: 0.6588
 epoch: 78, train_loss: 0.5005, test_loss: 0.9341, test_f1: 0.6554
 epoch: 79, train_loss: 0.5018, test_loss: 0.8909, test_f1: 0.6589
 epoch: 80, train_loss: 0.4911, test_loss: 0.9275, test_f1: 0.6607
 epoch: 81, train_loss: 0.5114, test_loss: 0.9839, test_f1: 0.6468
 epoch: 82, train_loss: 0.5043, test_loss: 0.9605, test_f1: 0.6568
 epoch: 83, train_loss: 0.4870, test_loss: 0.9340, test_f1: 0.6537
 epoch: 84, train_loss: 0.4979, test_loss: 0.8867, test_f1: 0.6650
 epoch: 85, train_loss: 0.4796, test_loss: 1.0161, test_f1: 0.6418
 epoch: 86, train_loss: 0.4951, test_loss: 0.9631, test_f1: 0.6378
 epoch: 87, train_loss: 0.4870, test_loss: 0.9283, test_f1: 0.6470
 epoch: 88, train_loss: 0.4887, test_loss: 0.9315, test_f1: 0.6389
 epoch: 89, train_loss: 0.4788, test_loss: 0.9639, test_f1: 0.6484
 epoch: 90, train_loss: 0.4795, test_loss: 0.9442, test_f1: 0.6565
 epoch: 91, train_loss: 0.4871, test_loss: 0.9531, test_f1: 0.6473
 epoch: 92, train_loss: 0.4720, test_loss: 0.9249, test_f1: 0.6542
 epoch: 93, train_loss: 0.4711, test_loss: 1.0245, test_f1: 0.6454
 epoch: 94, train_loss: 0.4642, test_loss: 0.9911, test_f1: 0.6428
 epoch: 95, train_loss: 0.4741, test_loss: 0.9560, test_f1: 0.6480
 epoch: 96, train_loss: 0.4777, test_loss: 0.9773, test_f1: 0.6289
 epoch: 97, train_loss: 0.4799, test_loss: 0.9536, test_f1: 0.6465
 epoch: 98, train_loss: 0.4517, test_loss: 1.0647, test_f1: 0.6487
 epoch: 99, train_loss: 0.4710, test_loss: 1.0530, test_f1: 0.6603
##################ITERATION #8 ****************************************
 epoch: 0, train_loss: 1.3675, test_loss: 1.1535, test_f1: 0.4360
 epoch: 1, train_loss: 1.0619, test_loss: 1.0106, test_f1: 0.4972
 epoch: 2, train_loss: 1.0200, test_loss: 1.0051, test_f1: 0.4871
 epoch: 3, train_loss: 0.9800, test_loss: 0.9937, test_f1: 0.4938
 epoch: 4, train_loss: 0.9642, test_loss: 0.9676, test_f1: 0.5541
 epoch: 5, train_loss: 0.9579, test_loss: 0.9614, test_f1: 0.5089
 epoch: 6, train_loss: 0.9303, test_loss: 0.9549, test_f1: 0.5101
 epoch: 7, train_loss: 0.9177, test_loss: 0.9115, test_f1: 0.5107
 epoch: 8, train_loss: 0.9210, test_loss: 0.9184, test_f1: 0.5438
 epoch: 9, train_loss: 0.8914, test_loss: 0.8714, test_f1: 0.5578
 epoch: 10, train_loss: 0.8824, test_loss: 0.8697, test_f1: 0.5588
 epoch: 11, train_loss: 0.8890, test_loss: 0.9265, test_f1: 0.5097
 epoch: 12, train_loss: 0.8706, test_loss: 0.8960, test_f1: 0.5672
 epoch: 13, train_loss: 0.8603, test_loss: 0.8615, test_f1: 0.5535
 epoch: 14, train_loss: 0.8543, test_loss: 0.9027, test_f1: 0.5471
 epoch: 15, train_loss: 0.8411, test_loss: 0.8659, test_f1: 0.5893
 epoch: 16, train_loss: 0.8399, test_loss: 0.8130, test_f1: 0.5967
 epoch: 17, train_loss: 0.8316, test_loss: 0.8149, test_f1: 0.5660
 epoch: 18, train_loss: 0.8350, test_loss: 0.8639, test_f1: 0.5260
 epoch: 19, train_loss: 0.8171, test_loss: 0.8423, test_f1: 0.5500
 epoch: 20, train_loss: 0.8081, test_loss: 0.9042, test_f1: 0.5793
 epoch: 21, train_loss: 0.7831, test_loss: 0.8178, test_f1: 0.6163
 epoch: 22, train_loss: 0.7803, test_loss: 0.8173, test_f1: 0.5756
 epoch: 23, train_loss: 0.7766, test_loss: 0.8712, test_f1: 0.5492
 epoch: 24, train_loss: 0.7771, test_loss: 0.8279, test_f1: 0.5895
 epoch: 25, train_loss: 0.7496, test_loss: 0.7782, test_f1: 0.6624
 epoch: 26, train_loss: 0.7672, test_loss: 0.8184, test_f1: 0.6220
 epoch: 27, train_loss: 0.7517, test_loss: 0.7428, test_f1: 0.6102
 epoch: 28, train_loss: 0.7422, test_loss: 0.7384, test_f1: 0.6307
 epoch: 29, train_loss: 0.7432, test_loss: 0.8164, test_f1: 0.6219
 epoch: 30, train_loss: 0.7381, test_loss: 0.7692, test_f1: 0.6238
 epoch: 31, train_loss: 0.7237, test_loss: 0.8672, test_f1: 0.6338
 epoch: 32, train_loss: 0.7384, test_loss: 0.7113, test_f1: 0.6795
 epoch: 33, train_loss: 0.7058, test_loss: 0.7712, test_f1: 0.6261
 epoch: 34, train_loss: 0.7232, test_loss: 0.7953, test_f1: 0.6384
 epoch: 35, train_loss: 0.6986, test_loss: 0.7440, test_f1: 0.6018
 epoch: 36, train_loss: 0.7124, test_loss: 0.7240, test_f1: 0.6414
 epoch: 37, train_loss: 0.6938, test_loss: 0.8111, test_f1: 0.6299
 epoch: 38, train_loss: 0.6903, test_loss: 0.8135, test_f1: 0.6305
 epoch: 39, train_loss: 0.7021, test_loss: 0.7724, test_f1: 0.6309
 epoch: 40, train_loss: 0.7032, test_loss: 0.7579, test_f1: 0.6499
 epoch: 41, train_loss: 0.6970, test_loss: 0.7603, test_f1: 0.6347
 epoch: 42, train_loss: 0.6872, test_loss: 0.8206, test_f1: 0.6218
 epoch: 43, train_loss: 0.6706, test_loss: 0.7467, test_f1: 0.6315
 epoch: 44, train_loss: 0.6775, test_loss: 0.7624, test_f1: 0.6653
 epoch: 45, train_loss: 0.6722, test_loss: 0.8480, test_f1: 0.6125
 epoch: 46, train_loss: 0.6749, test_loss: 0.7615, test_f1: 0.6155
 epoch: 47, train_loss: 0.6944, test_loss: 0.7583, test_f1: 0.6253
 epoch: 48, train_loss: 0.6821, test_loss: 0.7791, test_f1: 0.6652
 epoch: 49, train_loss: 0.6365, test_loss: 0.8024, test_f1: 0.6362
 epoch: 50, train_loss: 0.6407, test_loss: 0.7352, test_f1: 0.6701
 epoch: 51, train_loss: 0.6224, test_loss: 0.7284, test_f1: 0.6498
 epoch: 52, train_loss: 0.6076, test_loss: 0.7808, test_f1: 0.6645
 epoch: 53, train_loss: 0.6082, test_loss: 0.7243, test_f1: 0.6802
 epoch: 54, train_loss: 0.6039, test_loss: 0.7485, test_f1: 0.6696
 epoch: 55, train_loss: 0.5990, test_loss: 0.8087, test_f1: 0.6576
 epoch: 56, train_loss: 0.5844, test_loss: 0.7682, test_f1: 0.6653
 epoch: 57, train_loss: 0.5872, test_loss: 0.7535, test_f1: 0.6623
 epoch: 58, train_loss: 0.5929, test_loss: 0.7844, test_f1: 0.6870
 epoch: 59, train_loss: 0.5880, test_loss: 0.7515, test_f1: 0.6650
 epoch: 60, train_loss: 0.5606, test_loss: 0.7418, test_f1: 0.6897
 epoch: 61, train_loss: 0.5639, test_loss: 0.7120, test_f1: 0.6663
 epoch: 62, train_loss: 0.5735, test_loss: 0.7309, test_f1: 0.6917
 epoch: 63, train_loss: 0.5575, test_loss: 0.7946, test_f1: 0.6562
 epoch: 64, train_loss: 0.5726, test_loss: 0.8212, test_f1: 0.6576
 epoch: 65, train_loss: 0.5522, test_loss: 0.8278, test_f1: 0.6720
 epoch: 66, train_loss: 0.5551, test_loss: 0.8351, test_f1: 0.6656
 epoch: 67, train_loss: 0.5720, test_loss: 0.7676, test_f1: 0.7008
 epoch: 68, train_loss: 0.5578, test_loss: 0.8334, test_f1: 0.6671
 epoch: 69, train_loss: 0.5790, test_loss: 0.7855, test_f1: 0.6797
 epoch: 70, train_loss: 0.5513, test_loss: 0.7708, test_f1: 0.6518
 epoch: 71, train_loss: 0.5590, test_loss: 0.7762, test_f1: 0.6845
 epoch: 72, train_loss: 0.5540, test_loss: 0.7499, test_f1: 0.6784
 epoch: 73, train_loss: 0.5358, test_loss: 0.7990, test_f1: 0.6825
 epoch: 74, train_loss: 0.5559, test_loss: 0.7721, test_f1: 0.6708
 epoch: 75, train_loss: 0.5455, test_loss: 0.7807, test_f1: 0.6871
 epoch: 76, train_loss: 0.5422, test_loss: 0.8362, test_f1: 0.6696
 epoch: 77, train_loss: 0.5404, test_loss: 0.8240, test_f1: 0.6591
 epoch: 78, train_loss: 0.5316, test_loss: 0.8021, test_f1: 0.6722
 epoch: 79, train_loss: 0.5401, test_loss: 0.7918, test_f1: 0.6867
 epoch: 80, train_loss: 0.5203, test_loss: 0.7952, test_f1: 0.6936
 epoch: 81, train_loss: 0.5222, test_loss: 0.8095, test_f1: 0.6970
 epoch: 82, train_loss: 0.5313, test_loss: 0.8937, test_f1: 0.6758
 epoch: 83, train_loss: 0.5401, test_loss: 0.7770, test_f1: 0.6797
 epoch: 84, train_loss: 0.5207, test_loss: 0.7920, test_f1: 0.6888
 epoch: 85, train_loss: 0.5172, test_loss: 0.7954, test_f1: 0.6776
 epoch: 86, train_loss: 0.5367, test_loss: 0.7569, test_f1: 0.7074
 epoch: 87, train_loss: 0.5114, test_loss: 0.7520, test_f1: 0.6892
 epoch: 88, train_loss: 0.5123, test_loss: 0.7619, test_f1: 0.7078
 epoch: 89, train_loss: 0.5137, test_loss: 0.8666, test_f1: 0.6804
 epoch: 90, train_loss: 0.5312, test_loss: 0.8267, test_f1: 0.6956
 epoch: 91, train_loss: 0.4947, test_loss: 0.7648, test_f1: 0.7143
 epoch: 92, train_loss: 0.5118, test_loss: 0.8661, test_f1: 0.6631
 epoch: 93, train_loss: 0.5071, test_loss: 0.7803, test_f1: 0.6947
 epoch: 94, train_loss: 0.5095, test_loss: 0.8489, test_f1: 0.6758
 epoch: 95, train_loss: 0.4892, test_loss: 0.8656, test_f1: 0.6850
 epoch: 96, train_loss: 0.4961, test_loss: 0.8825, test_f1: 0.6678
 epoch: 97, train_loss: 0.5006, test_loss: 0.9090, test_f1: 0.6572
 epoch: 98, train_loss: 0.5012, test_loss: 0.8254, test_f1: 0.6879
 epoch: 99, train_loss: 0.5024, test_loss: 0.8438, test_f1: 0.6871
##################ITERATION #9 ****************************************
 epoch: 0, train_loss: 1.4404, test_loss: 1.4664, test_f1: 0.3006
 epoch: 1, train_loss: 1.0567, test_loss: 0.9374, test_f1: 0.5338
 epoch: 2, train_loss: 1.0001, test_loss: 0.9065, test_f1: 0.5238
 epoch: 3, train_loss: 0.9763, test_loss: 0.9103, test_f1: 0.5196
 epoch: 4, train_loss: 0.9476, test_loss: 0.9205, test_f1: 0.5151
 epoch: 5, train_loss: 0.9352, test_loss: 0.8864, test_f1: 0.5062
 epoch: 6, train_loss: 0.9172, test_loss: 0.9090, test_f1: 0.5342
 epoch: 7, train_loss: 0.9160, test_loss: 0.9068, test_f1: 0.5496
 epoch: 8, train_loss: 0.8973, test_loss: 0.9104, test_f1: 0.5056
 epoch: 9, train_loss: 0.8709, test_loss: 0.9246, test_f1: 0.5251
 epoch: 10, train_loss: 0.8740, test_loss: 0.8977, test_f1: 0.5563
 epoch: 11, train_loss: 0.8666, test_loss: 0.8602, test_f1: 0.5541
 epoch: 12, train_loss: 0.8559, test_loss: 0.8886, test_f1: 0.5325
 epoch: 13, train_loss: 0.8412, test_loss: 0.8754, test_f1: 0.5506
 epoch: 14, train_loss: 0.8284, test_loss: 0.8787, test_f1: 0.5500
 epoch: 15, train_loss: 0.8389, test_loss: 0.8683, test_f1: 0.5559
 epoch: 16, train_loss: 0.8242, test_loss: 0.8516, test_f1: 0.5467
 epoch: 17, train_loss: 0.8105, test_loss: 0.8418, test_f1: 0.5793
 epoch: 18, train_loss: 0.8147, test_loss: 0.8621, test_f1: 0.5416
 epoch: 19, train_loss: 0.8079, test_loss: 0.8243, test_f1: 0.5897
 epoch: 20, train_loss: 0.8164, test_loss: 0.8396, test_f1: 0.5579
 epoch: 21, train_loss: 0.7949, test_loss: 0.8743, test_f1: 0.5798
 epoch: 22, train_loss: 0.7857, test_loss: 0.8122, test_f1: 0.5934
 epoch: 23, train_loss: 0.7866, test_loss: 0.8581, test_f1: 0.5418
 epoch: 24, train_loss: 0.7734, test_loss: 0.7953, test_f1: 0.5874
 epoch: 25, train_loss: 0.7719, test_loss: 0.8200, test_f1: 0.5845
 epoch: 26, train_loss: 0.7731, test_loss: 0.8432, test_f1: 0.5785
 epoch: 27, train_loss: 0.7652, test_loss: 0.8565, test_f1: 0.5585
 epoch: 28, train_loss: 0.7591, test_loss: 0.8287, test_f1: 0.5969
 epoch: 29, train_loss: 0.7677, test_loss: 0.8502, test_f1: 0.5832
 epoch: 30, train_loss: 0.7276, test_loss: 0.8669, test_f1: 0.5614
 epoch: 31, train_loss: 0.7298, test_loss: 0.8308, test_f1: 0.5822
 epoch: 32, train_loss: 0.7342, test_loss: 0.8212, test_f1: 0.6077
 epoch: 33, train_loss: 0.7304, test_loss: 0.7927, test_f1: 0.5778
 epoch: 34, train_loss: 0.7247, test_loss: 0.8517, test_f1: 0.6184
 epoch: 35, train_loss: 0.7128, test_loss: 0.8280, test_f1: 0.6266
 epoch: 36, train_loss: 0.7264, test_loss: 0.8388, test_f1: 0.5968
 epoch: 37, train_loss: 0.7094, test_loss: 0.7980, test_f1: 0.6095
 epoch: 38, train_loss: 0.6949, test_loss: 0.8426, test_f1: 0.5970
 epoch: 39, train_loss: 0.6800, test_loss: 0.8693, test_f1: 0.5962
 epoch: 40, train_loss: 0.6885, test_loss: 0.8005, test_f1: 0.5997
 epoch: 41, train_loss: 0.6957, test_loss: 0.8663, test_f1: 0.6080
 epoch: 42, train_loss: 0.7007, test_loss: 0.8513, test_f1: 0.6166
 epoch: 43, train_loss: 0.6843, test_loss: 0.8578, test_f1: 0.5987
 epoch: 44, train_loss: 0.6844, test_loss: 0.8951, test_f1: 0.6077
 epoch: 45, train_loss: 0.6763, test_loss: 0.8677, test_f1: 0.5938
 epoch: 46, train_loss: 0.6717, test_loss: 0.8879, test_f1: 0.6135
 epoch: 47, train_loss: 0.6634, test_loss: 0.8388, test_f1: 0.6337
 epoch: 48, train_loss: 0.6455, test_loss: 0.8556, test_f1: 0.6217
 epoch: 49, train_loss: 0.6456, test_loss: 0.7793, test_f1: 0.6297
 epoch: 50, train_loss: 0.6558, test_loss: 0.8240, test_f1: 0.6277
 epoch: 51, train_loss: 0.6426, test_loss: 0.7757, test_f1: 0.6187
 epoch: 52, train_loss: 0.6293, test_loss: 0.7844, test_f1: 0.6287
 epoch: 53, train_loss: 0.5964, test_loss: 0.7903, test_f1: 0.6404
 epoch: 54, train_loss: 0.6084, test_loss: 0.8310, test_f1: 0.6275
 epoch: 55, train_loss: 0.6088, test_loss: 0.8301, test_f1: 0.6318
 epoch: 56, train_loss: 0.5883, test_loss: 0.8065, test_f1: 0.6412
 epoch: 57, train_loss: 0.6100, test_loss: 0.8310, test_f1: 0.6629
 epoch: 58, train_loss: 0.5959, test_loss: 0.7866, test_f1: 0.6903
 epoch: 59, train_loss: 0.5923, test_loss: 0.8321, test_f1: 0.6677
 epoch: 60, train_loss: 0.5949, test_loss: 0.7796, test_f1: 0.6255
 epoch: 61, train_loss: 0.5869, test_loss: 0.8074, test_f1: 0.6326
 epoch: 62, train_loss: 0.5805, test_loss: 0.7974, test_f1: 0.6468
 epoch: 63, train_loss: 0.5751, test_loss: 0.8145, test_f1: 0.6464
 epoch: 64, train_loss: 0.5657, test_loss: 0.8392, test_f1: 0.6534
 epoch: 65, train_loss: 0.5901, test_loss: 0.8560, test_f1: 0.6618
 epoch: 66, train_loss: 0.5809, test_loss: 0.8325, test_f1: 0.6558
 epoch: 67, train_loss: 0.5817, test_loss: 0.8269, test_f1: 0.6593
 epoch: 68, train_loss: 0.5663, test_loss: 0.8137, test_f1: 0.6415
 epoch: 69, train_loss: 0.5655, test_loss: 0.8331, test_f1: 0.6669
 epoch: 70, train_loss: 0.5661, test_loss: 0.8361, test_f1: 0.6579
 epoch: 71, train_loss: 0.5679, test_loss: 0.8485, test_f1: 0.6475
 epoch: 72, train_loss: 0.5534, test_loss: 0.8196, test_f1: 0.6701
 epoch: 73, train_loss: 0.5608, test_loss: 0.8095, test_f1: 0.6431
 epoch: 74, train_loss: 0.5558, test_loss: 0.8586, test_f1: 0.6466
 epoch: 75, train_loss: 0.5377, test_loss: 0.8357, test_f1: 0.6477
 epoch: 76, train_loss: 0.5546, test_loss: 0.9041, test_f1: 0.6368
 epoch: 77, train_loss: 0.5365, test_loss: 0.8316, test_f1: 0.6698
 epoch: 78, train_loss: 0.5437, test_loss: 0.8709, test_f1: 0.6675
 epoch: 79, train_loss: 0.5617, test_loss: 0.8851, test_f1: 0.6502
 epoch: 80, train_loss: 0.5424, test_loss: 0.8264, test_f1: 0.6866
 epoch: 81, train_loss: 0.5343, test_loss: 0.8902, test_f1: 0.6300
 epoch: 82, train_loss: 0.5417, test_loss: 0.8860, test_f1: 0.6529
 epoch: 83, train_loss: 0.5374, test_loss: 0.8964, test_f1: 0.6451
 epoch: 84, train_loss: 0.5273, test_loss: 0.8247, test_f1: 0.6671
 epoch: 85, train_loss: 0.5306, test_loss: 0.8614, test_f1: 0.6627
 epoch: 86, train_loss: 0.5431, test_loss: 0.8109, test_f1: 0.6660
 epoch: 87, train_loss: 0.5266, test_loss: 0.8587, test_f1: 0.6719
 epoch: 88, train_loss: 0.5153, test_loss: 0.8372, test_f1: 0.6561
 epoch: 89, train_loss: 0.5262, test_loss: 0.8339, test_f1: 0.6633
 epoch: 90, train_loss: 0.5380, test_loss: 0.9565, test_f1: 0.6511
 epoch: 91, train_loss: 0.5220, test_loss: 0.9585, test_f1: 0.6765
 epoch: 92, train_loss: 0.5146, test_loss: 0.8851, test_f1: 0.6710
 epoch: 93, train_loss: 0.5198, test_loss: 0.8809, test_f1: 0.6710
 epoch: 94, train_loss: 0.5063, test_loss: 0.9643, test_f1: 0.6406
 epoch: 95, train_loss: 0.5093, test_loss: 0.9073, test_f1: 0.6557
 epoch: 96, train_loss: 0.5142, test_loss: 0.9406, test_f1: 0.6498
 epoch: 97, train_loss: 0.5136, test_loss: 0.8939, test_f1: 0.6695
 epoch: 98, train_loss: 0.5100, test_loss: 0.9216, test_f1: 0.6508
 epoch: 99, train_loss: 0.5217, test_loss: 0.9310, test_f1: 0.6622

Training completed in 704.68 seconds
Best F1: 0.7143 at epoch 91
Mean F1 across iterations: 0.6888  0.0170
========================FINAL RESULTS================================
FEGIN weighted F1: 0.7143  0.0170
python main.py --data ltspice_examples --representation component_pin_net --model FEGIN --layers 4 --hiddens 32 --batch_size 64 --lr 0.001 --emb_size 512 --epochs 100 --save_appendix component_pin_net_L4_H32_BS64_LR0.001_E512 --no_val
-----



STDERR:
  File "main.py", line 370, in <module>
    main()
  File "main.py", line 254, in main
    dataset = dataset_class(
  File "/home/philip/projects/ltspice_examples_code_repo/Circuit-Completion-Using-GNNs/component_classification_with_link_prediction_head/evaluation/FEGIN/kernel/circuit_datasets.py", line 15, in __init__
    self.data, self.slices = torch.load(self.processed_paths[0])
  File "/home/philip/.local/lib/python3.8/site-packages/torch/serialization.py", line 1040, in load
    warnings.warn(
  File "/usr/lib/python3.8/warnings.py", line 109, in _showwarnmsg
    sw(msg.message, msg.category, msg.filename, msg.lineno,
  File "main.py", line 47, in warn_with_traceback
    traceback.print_stack(file=log)
/home/philip/projects/ltspice_examples_code_repo/Circuit-Completion-Using-GNNs/component_classification_with_link_prediction_head/evaluation/FEGIN/kernel/circuit_datasets.py:15: FutureWarning: You are using `torch.load` with `weights_only=False` (the current default value), which uses the default pickle module implicitly. It is possible to construct malicious pickle data which will execute arbitrary code during unpickling (See https://github.com/pytorch/pytorch/blob/main/SECURITY.md#untrusted-models for more details). In a future release, the default value for `weights_only` will be flipped to `True`. This limits the functions that could be executed during unpickling. Arbitrary objects will no longer be allowed to be loaded via this mode unless they are explicitly allowlisted by the user via `torch.serialization.add_safe_globals`. We recommend you start setting `weights_only=True` for any use case where you don't have full control of the loaded file. Please open an issue on GitHub for any issues related to this experimental feature.
  self.data, self.slices = torch.load(self.processed_paths[0])
