STDOUT:
Results will be saved in /home/philip/projects/ltspice_examples_code_repo/Circuit-Completion-Using-GNNs/component_classification_with_link_prediction_head/evaluation/FEGIN/results/model_FEGIN_dataset_ltspice_examples
Command line input: python main.py --data ltspice_examples --representation component_component --model FEGIN --layers 3 --hiddens 16 --batch_size 256 --lr 0.001 --emb_size 128 --epochs 100 --save_appendix component_component_L3_H16_BS256_LR0.001_E128 --no_val
 is saved.
-----
ltspice_examples - FEGIN
Using 3 layers, 16 hidden units, h = 2
Loading component_component representation dataset
ENTERED
Training FEGIN on component_component representation
Train: 3556, Test: 845
##################ITERATION #0 ****************************************
 epoch: 0, train_loss: 1.3529, test_loss: 1.3466, test_f1: 0.2274
 epoch: 1, train_loss: 1.3288, test_loss: 1.3299, test_f1: 0.2274
 epoch: 2, train_loss: 1.3120, test_loss: 1.3087, test_f1: 0.2274
 epoch: 3, train_loss: 1.2965, test_loss: 1.2914, test_f1: 0.2274
 epoch: 4, train_loss: 1.2839, test_loss: 1.2820, test_f1: 0.2274
 epoch: 5, train_loss: 1.2761, test_loss: 1.2748, test_f1: 0.2274
 epoch: 6, train_loss: 1.2615, test_loss: 1.2636, test_f1: 0.2274
 epoch: 7, train_loss: 1.2526, test_loss: 1.2496, test_f1: 0.3043
 epoch: 8, train_loss: 1.2462, test_loss: 1.2382, test_f1: 0.3418
 epoch: 9, train_loss: 1.2366, test_loss: 1.2287, test_f1: 0.3469
 epoch: 10, train_loss: 1.2346, test_loss: 1.2214, test_f1: 0.3361
 epoch: 11, train_loss: 1.2208, test_loss: 1.2131, test_f1: 0.3369
 epoch: 12, train_loss: 1.2128, test_loss: 1.2041, test_f1: 0.3389
 epoch: 13, train_loss: 1.2026, test_loss: 1.1980, test_f1: 0.3416
 epoch: 14, train_loss: 1.1977, test_loss: 1.1952, test_f1: 0.3376
 epoch: 15, train_loss: 1.1934, test_loss: 1.1880, test_f1: 0.3644
 epoch: 16, train_loss: 1.1932, test_loss: 1.1807, test_f1: 0.3503
 epoch: 17, train_loss: 1.1803, test_loss: 1.1738, test_f1: 0.3513
 epoch: 18, train_loss: 1.1697, test_loss: 1.1697, test_f1: 0.3445
 epoch: 19, train_loss: 1.1696, test_loss: 1.1662, test_f1: 0.3507
 epoch: 20, train_loss: 1.1628, test_loss: 1.1645, test_f1: 0.3546
 epoch: 21, train_loss: 1.1566, test_loss: 1.1508, test_f1: 0.3481
 epoch: 22, train_loss: 1.1472, test_loss: 1.1476, test_f1: 0.3437
 epoch: 23, train_loss: 1.1439, test_loss: 1.1531, test_f1: 0.3538
 epoch: 24, train_loss: 1.1434, test_loss: 1.1378, test_f1: 0.3537
 epoch: 25, train_loss: 1.1294, test_loss: 1.1301, test_f1: 0.4034
 epoch: 26, train_loss: 1.1209, test_loss: 1.1248, test_f1: 0.4204
 epoch: 27, train_loss: 1.1187, test_loss: 1.1243, test_f1: 0.4349
 epoch: 28, train_loss: 1.1138, test_loss: 1.1230, test_f1: 0.4373
 epoch: 29, train_loss: 1.1067, test_loss: 1.1198, test_f1: 0.4516
 epoch: 30, train_loss: 1.0977, test_loss: 1.1191, test_f1: 0.4447
 epoch: 31, train_loss: 1.0929, test_loss: 1.1034, test_f1: 0.4497
 epoch: 32, train_loss: 1.0857, test_loss: 1.0947, test_f1: 0.4609
 epoch: 33, train_loss: 1.0699, test_loss: 1.0984, test_f1: 0.4318
 epoch: 34, train_loss: 1.0766, test_loss: 1.0993, test_f1: 0.4413
 epoch: 35, train_loss: 1.0737, test_loss: 1.0861, test_f1: 0.4365
 epoch: 36, train_loss: 1.0671, test_loss: 1.0826, test_f1: 0.4468
 epoch: 37, train_loss: 1.0600, test_loss: 1.0748, test_f1: 0.4419
 epoch: 38, train_loss: 1.0544, test_loss: 1.0700, test_f1: 0.4379
 epoch: 39, train_loss: 1.0469, test_loss: 1.0679, test_f1: 0.4450
 epoch: 40, train_loss: 1.0273, test_loss: 1.0477, test_f1: 0.4574
 epoch: 41, train_loss: 1.0263, test_loss: 1.0479, test_f1: 0.4597
 epoch: 42, train_loss: 1.0325, test_loss: 1.0484, test_f1: 0.4607
 epoch: 43, train_loss: 1.0231, test_loss: 1.0341, test_f1: 0.4699
 epoch: 44, train_loss: 1.0144, test_loss: 1.0410, test_f1: 0.4649
 epoch: 45, train_loss: 1.0083, test_loss: 1.0196, test_f1: 0.4925
 epoch: 46, train_loss: 1.0072, test_loss: 1.0235, test_f1: 0.4749
 epoch: 47, train_loss: 0.9942, test_loss: 1.0105, test_f1: 0.4936
 epoch: 48, train_loss: 0.9966, test_loss: 1.0177, test_f1: 0.4797
 epoch: 49, train_loss: 0.9916, test_loss: 1.0130, test_f1: 0.4835
 epoch: 50, train_loss: 0.9821, test_loss: 1.0048, test_f1: 0.4961
 epoch: 51, train_loss: 0.9810, test_loss: 0.9995, test_f1: 0.5141
 epoch: 52, train_loss: 0.9767, test_loss: 0.9926, test_f1: 0.5062
 epoch: 53, train_loss: 0.9699, test_loss: 1.0042, test_f1: 0.5008
 epoch: 54, train_loss: 0.9593, test_loss: 0.9969, test_f1: 0.5033
 epoch: 55, train_loss: 0.9622, test_loss: 1.0032, test_f1: 0.4945
 epoch: 56, train_loss: 0.9666, test_loss: 0.9977, test_f1: 0.5100
 epoch: 57, train_loss: 0.9644, test_loss: 0.9828, test_f1: 0.5086
 epoch: 58, train_loss: 0.9614, test_loss: 0.9877, test_f1: 0.5189
 epoch: 59, train_loss: 0.9584, test_loss: 0.9815, test_f1: 0.5062
 epoch: 60, train_loss: 0.9618, test_loss: 0.9946, test_f1: 0.5008
 epoch: 61, train_loss: 0.9475, test_loss: 0.9822, test_f1: 0.5297
 epoch: 62, train_loss: 0.9526, test_loss: 0.9821, test_f1: 0.5169
 epoch: 63, train_loss: 0.9471, test_loss: 0.9875, test_f1: 0.5083
 epoch: 64, train_loss: 0.9494, test_loss: 0.9813, test_f1: 0.5083
 epoch: 65, train_loss: 0.9454, test_loss: 0.9877, test_f1: 0.5149
 epoch: 66, train_loss: 0.9450, test_loss: 0.9868, test_f1: 0.5174
 epoch: 67, train_loss: 0.9429, test_loss: 0.9963, test_f1: 0.5000
 epoch: 68, train_loss: 0.9427, test_loss: 0.9901, test_f1: 0.5167
 epoch: 69, train_loss: 0.9419, test_loss: 0.9881, test_f1: 0.5103
 epoch: 70, train_loss: 0.9484, test_loss: 0.9864, test_f1: 0.5096
 epoch: 71, train_loss: 0.9337, test_loss: 0.9852, test_f1: 0.5235
 epoch: 72, train_loss: 0.9327, test_loss: 0.9930, test_f1: 0.5085
 epoch: 73, train_loss: 0.9407, test_loss: 0.9989, test_f1: 0.5128
 epoch: 74, train_loss: 0.9337, test_loss: 0.9885, test_f1: 0.5195
 epoch: 75, train_loss: 0.9237, test_loss: 0.9955, test_f1: 0.5158
 epoch: 76, train_loss: 0.9276, test_loss: 0.9849, test_f1: 0.5203
 epoch: 77, train_loss: 0.9312, test_loss: 0.9827, test_f1: 0.5233
 epoch: 78, train_loss: 0.9269, test_loss: 0.9957, test_f1: 0.5157
 epoch: 79, train_loss: 0.9225, test_loss: 0.9978, test_f1: 0.5152
 epoch: 80, train_loss: 0.9097, test_loss: 0.9935, test_f1: 0.5103
 epoch: 81, train_loss: 0.9210, test_loss: 0.9774, test_f1: 0.5288
 epoch: 82, train_loss: 0.9164, test_loss: 0.9839, test_f1: 0.5339
 epoch: 83, train_loss: 0.9153, test_loss: 1.0051, test_f1: 0.5083
 epoch: 84, train_loss: 0.9234, test_loss: 0.9821, test_f1: 0.5202
 epoch: 85, train_loss: 0.9126, test_loss: 0.9973, test_f1: 0.5277
 epoch: 86, train_loss: 0.9103, test_loss: 1.0001, test_f1: 0.5144
 epoch: 87, train_loss: 0.9103, test_loss: 1.0047, test_f1: 0.5186
 epoch: 88, train_loss: 0.9115, test_loss: 0.9907, test_f1: 0.5214
 epoch: 89, train_loss: 0.9049, test_loss: 1.0025, test_f1: 0.5141
 epoch: 90, train_loss: 0.9096, test_loss: 1.0035, test_f1: 0.5164
 epoch: 91, train_loss: 0.9027, test_loss: 0.9956, test_f1: 0.5126
 epoch: 92, train_loss: 0.8935, test_loss: 1.0068, test_f1: 0.5195
 epoch: 93, train_loss: 0.8958, test_loss: 1.0045, test_f1: 0.5041
 epoch: 94, train_loss: 0.8928, test_loss: 1.0074, test_f1: 0.5219
 epoch: 95, train_loss: 0.9026, test_loss: 1.0095, test_f1: 0.5107
 epoch: 96, train_loss: 0.8989, test_loss: 0.9942, test_f1: 0.5167
 epoch: 97, train_loss: 0.8945, test_loss: 1.0220, test_f1: 0.5191
 epoch: 98, train_loss: 0.8996, test_loss: 1.0016, test_f1: 0.5128
 epoch: 99, train_loss: 0.8922, test_loss: 1.0057, test_f1: 0.5099
##################ITERATION #1 ****************************************
 epoch: 0, train_loss: 1.3792, test_loss: 1.3796, test_f1: 0.2274
 epoch: 1, train_loss: 1.3300, test_loss: 1.3501, test_f1: 0.2274
 epoch: 2, train_loss: 1.3020, test_loss: 1.3079, test_f1: 0.2555
 epoch: 3, train_loss: 1.2841, test_loss: 1.2793, test_f1: 0.2555
 epoch: 4, train_loss: 1.2643, test_loss: 1.2602, test_f1: 0.2555
 epoch: 5, train_loss: 1.2540, test_loss: 1.2407, test_f1: 0.2895
 epoch: 6, train_loss: 1.2338, test_loss: 1.2200, test_f1: 0.3192
 epoch: 7, train_loss: 1.2276, test_loss: 1.2051, test_f1: 0.3241
 epoch: 8, train_loss: 1.2171, test_loss: 1.1954, test_f1: 0.3446
 epoch: 9, train_loss: 1.2090, test_loss: 1.1868, test_f1: 0.3458
 epoch: 10, train_loss: 1.1983, test_loss: 1.1781, test_f1: 0.3614
 epoch: 11, train_loss: 1.1911, test_loss: 1.1664, test_f1: 0.3950
 epoch: 12, train_loss: 1.1864, test_loss: 1.1615, test_f1: 0.3720
 epoch: 13, train_loss: 1.1797, test_loss: 1.1551, test_f1: 0.4004
 epoch: 14, train_loss: 1.1725, test_loss: 1.1534, test_f1: 0.4009
 epoch: 15, train_loss: 1.1726, test_loss: 1.1498, test_f1: 0.3960
 epoch: 16, train_loss: 1.1601, test_loss: 1.1564, test_f1: 0.4100
 epoch: 17, train_loss: 1.1541, test_loss: 1.1409, test_f1: 0.4070
 epoch: 18, train_loss: 1.1548, test_loss: 1.1414, test_f1: 0.4104
 epoch: 19, train_loss: 1.1436, test_loss: 1.1345, test_f1: 0.4172
 epoch: 20, train_loss: 1.1416, test_loss: 1.1318, test_f1: 0.4118
 epoch: 21, train_loss: 1.1337, test_loss: 1.1269, test_f1: 0.4265
 epoch: 22, train_loss: 1.1308, test_loss: 1.1252, test_f1: 0.4194
 epoch: 23, train_loss: 1.1296, test_loss: 1.1213, test_f1: 0.4205
 epoch: 24, train_loss: 1.1279, test_loss: 1.1183, test_f1: 0.4275
 epoch: 25, train_loss: 1.1224, test_loss: 1.1090, test_f1: 0.4368
 epoch: 26, train_loss: 1.1141, test_loss: 1.1141, test_f1: 0.4361
 epoch: 27, train_loss: 1.1141, test_loss: 1.1078, test_f1: 0.4333
 epoch: 28, train_loss: 1.1122, test_loss: 1.1135, test_f1: 0.4400
 epoch: 29, train_loss: 1.1052, test_loss: 1.0901, test_f1: 0.4562
 epoch: 30, train_loss: 1.0926, test_loss: 1.1187, test_f1: 0.4439
 epoch: 31, train_loss: 1.0955, test_loss: 1.0766, test_f1: 0.4602
 epoch: 32, train_loss: 1.0935, test_loss: 1.0974, test_f1: 0.4436
 epoch: 33, train_loss: 1.0893, test_loss: 1.0700, test_f1: 0.4530
 epoch: 34, train_loss: 1.0777, test_loss: 1.1015, test_f1: 0.4299
 epoch: 35, train_loss: 1.0868, test_loss: 1.0866, test_f1: 0.4514
 epoch: 36, train_loss: 1.0736, test_loss: 1.0863, test_f1: 0.4497
 epoch: 37, train_loss: 1.0779, test_loss: 1.0536, test_f1: 0.4594
 epoch: 38, train_loss: 1.0641, test_loss: 1.0701, test_f1: 0.4446
 epoch: 39, train_loss: 1.0685, test_loss: 1.0924, test_f1: 0.4431
 epoch: 40, train_loss: 1.0560, test_loss: 1.0845, test_f1: 0.4481
 epoch: 41, train_loss: 1.0490, test_loss: 1.0511, test_f1: 0.4576
 epoch: 42, train_loss: 1.0446, test_loss: 1.0890, test_f1: 0.4400
 epoch: 43, train_loss: 1.0538, test_loss: 1.0518, test_f1: 0.4551
 epoch: 44, train_loss: 1.0429, test_loss: 1.0766, test_f1: 0.4495
 epoch: 45, train_loss: 1.0459, test_loss: 1.0560, test_f1: 0.4574
 epoch: 46, train_loss: 1.0471, test_loss: 1.0580, test_f1: 0.4526
 epoch: 47, train_loss: 1.0364, test_loss: 1.0340, test_f1: 0.4606
 epoch: 48, train_loss: 1.0290, test_loss: 1.0524, test_f1: 0.4548
 epoch: 49, train_loss: 1.0275, test_loss: 1.0806, test_f1: 0.4494
 epoch: 50, train_loss: 1.0285, test_loss: 1.0432, test_f1: 0.4546
 epoch: 51, train_loss: 1.0244, test_loss: 1.0425, test_f1: 0.4551
 epoch: 52, train_loss: 1.0175, test_loss: 1.0362, test_f1: 0.4573
 epoch: 53, train_loss: 1.0125, test_loss: 1.0505, test_f1: 0.4575
 epoch: 54, train_loss: 1.0039, test_loss: 1.0435, test_f1: 0.4644
 epoch: 55, train_loss: 1.0056, test_loss: 1.0332, test_f1: 0.4667
 epoch: 56, train_loss: 1.0195, test_loss: 1.0342, test_f1: 0.4604
 epoch: 57, train_loss: 1.0175, test_loss: 1.0332, test_f1: 0.4659
 epoch: 58, train_loss: 1.0035, test_loss: 1.0398, test_f1: 0.4519
 epoch: 59, train_loss: 1.0000, test_loss: 1.0463, test_f1: 0.4555
 epoch: 60, train_loss: 0.9989, test_loss: 1.0255, test_f1: 0.4808
 epoch: 61, train_loss: 1.0054, test_loss: 1.0297, test_f1: 0.4837
 epoch: 62, train_loss: 0.9954, test_loss: 1.0264, test_f1: 0.4596
 epoch: 63, train_loss: 0.9909, test_loss: 1.0208, test_f1: 0.4876
 epoch: 64, train_loss: 1.0031, test_loss: 1.0225, test_f1: 0.4670
 epoch: 65, train_loss: 0.9975, test_loss: 1.0225, test_f1: 0.4540
 epoch: 66, train_loss: 0.9915, test_loss: 1.0174, test_f1: 0.4798
 epoch: 67, train_loss: 1.0026, test_loss: 1.0257, test_f1: 0.4616
 epoch: 68, train_loss: 0.9996, test_loss: 1.0115, test_f1: 0.4867
 epoch: 69, train_loss: 0.9878, test_loss: 1.0419, test_f1: 0.4705
 epoch: 70, train_loss: 0.9866, test_loss: 1.0348, test_f1: 0.4719
 epoch: 71, train_loss: 0.9844, test_loss: 1.0271, test_f1: 0.4773
 epoch: 72, train_loss: 0.9754, test_loss: 1.0389, test_f1: 0.4694
 epoch: 73, train_loss: 0.9828, test_loss: 1.0314, test_f1: 0.4835
 epoch: 74, train_loss: 0.9803, test_loss: 1.0359, test_f1: 0.4757
 epoch: 75, train_loss: 0.9697, test_loss: 1.0321, test_f1: 0.4849
 epoch: 76, train_loss: 0.9667, test_loss: 1.0329, test_f1: 0.4793
 epoch: 77, train_loss: 0.9707, test_loss: 1.0305, test_f1: 0.4742
 epoch: 78, train_loss: 0.9726, test_loss: 1.0132, test_f1: 0.4890
 epoch: 79, train_loss: 0.9795, test_loss: 1.0597, test_f1: 0.4701
 epoch: 80, train_loss: 0.9727, test_loss: 1.0375, test_f1: 0.4934
 epoch: 81, train_loss: 0.9767, test_loss: 1.0405, test_f1: 0.4704
 epoch: 82, train_loss: 0.9715, test_loss: 1.0329, test_f1: 0.4886
 epoch: 83, train_loss: 0.9733, test_loss: 1.0326, test_f1: 0.4834
 epoch: 84, train_loss: 0.9637, test_loss: 1.0198, test_f1: 0.4704
 epoch: 85, train_loss: 0.9602, test_loss: 1.0278, test_f1: 0.4855
 epoch: 86, train_loss: 0.9576, test_loss: 1.0164, test_f1: 0.5033
 epoch: 87, train_loss: 0.9658, test_loss: 1.0351, test_f1: 0.4767
 epoch: 88, train_loss: 0.9767, test_loss: 1.0434, test_f1: 0.4710
 epoch: 89, train_loss: 0.9600, test_loss: 1.0330, test_f1: 0.5010
 epoch: 90, train_loss: 0.9662, test_loss: 1.0211, test_f1: 0.4808
 epoch: 91, train_loss: 0.9620, test_loss: 1.0417, test_f1: 0.4754
 epoch: 92, train_loss: 0.9605, test_loss: 1.0374, test_f1: 0.4895
 epoch: 93, train_loss: 0.9564, test_loss: 1.0137, test_f1: 0.4861
 epoch: 94, train_loss: 0.9470, test_loss: 1.0248, test_f1: 0.4780
 epoch: 95, train_loss: 0.9510, test_loss: 1.0337, test_f1: 0.4991
 epoch: 96, train_loss: 0.9616, test_loss: 1.0088, test_f1: 0.4913
 epoch: 97, train_loss: 0.9594, test_loss: 1.0174, test_f1: 0.4862
 epoch: 98, train_loss: 0.9554, test_loss: 1.0227, test_f1: 0.5032
 epoch: 99, train_loss: 0.9535, test_loss: 1.0210, test_f1: 0.4921
##################ITERATION #2 ****************************************
 epoch: 0, train_loss: 1.3514, test_loss: 1.3418, test_f1: 0.2274
 epoch: 1, train_loss: 1.2998, test_loss: 1.3125, test_f1: 0.2274
 epoch: 2, train_loss: 1.2761, test_loss: 1.2846, test_f1: 0.2274
 epoch: 3, train_loss: 1.2612, test_loss: 1.2558, test_f1: 0.2274
 epoch: 4, train_loss: 1.2557, test_loss: 1.2374, test_f1: 0.2860
 epoch: 5, train_loss: 1.2385, test_loss: 1.2250, test_f1: 0.2895
 epoch: 6, train_loss: 1.2348, test_loss: 1.2152, test_f1: 0.3016
 epoch: 7, train_loss: 1.2258, test_loss: 1.2055, test_f1: 0.2955
 epoch: 8, train_loss: 1.2203, test_loss: 1.1966, test_f1: 0.3036
 epoch: 9, train_loss: 1.2119, test_loss: 1.1923, test_f1: 0.3500
 epoch: 10, train_loss: 1.2023, test_loss: 1.1743, test_f1: 0.3775
 epoch: 11, train_loss: 1.1999, test_loss: 1.2139, test_f1: 0.4024
 epoch: 12, train_loss: 1.1946, test_loss: 1.1602, test_f1: 0.4150
 epoch: 13, train_loss: 1.1909, test_loss: 1.1820, test_f1: 0.4071
 epoch: 14, train_loss: 1.1816, test_loss: 1.1496, test_f1: 0.3937
 epoch: 15, train_loss: 1.1697, test_loss: 1.1543, test_f1: 0.4197
 epoch: 16, train_loss: 1.1678, test_loss: 1.1348, test_f1: 0.4598
 epoch: 17, train_loss: 1.1577, test_loss: 1.1371, test_f1: 0.4376
 epoch: 18, train_loss: 1.1614, test_loss: 1.1553, test_f1: 0.4155
 epoch: 19, train_loss: 1.1543, test_loss: 1.1205, test_f1: 0.4441
 epoch: 20, train_loss: 1.1477, test_loss: 1.1153, test_f1: 0.4326
 epoch: 21, train_loss: 1.1442, test_loss: 1.1227, test_f1: 0.4352
 epoch: 22, train_loss: 1.1350, test_loss: 1.1076, test_f1: 0.4660
 epoch: 23, train_loss: 1.1288, test_loss: 1.0985, test_f1: 0.4478
 epoch: 24, train_loss: 1.1322, test_loss: 1.1172, test_f1: 0.4251
 epoch: 25, train_loss: 1.1291, test_loss: 1.1037, test_f1: 0.4339
 epoch: 26, train_loss: 1.1211, test_loss: 1.0904, test_f1: 0.4520
 epoch: 27, train_loss: 1.1134, test_loss: 1.0818, test_f1: 0.4531
 epoch: 28, train_loss: 1.1111, test_loss: 1.0827, test_f1: 0.4457
 epoch: 29, train_loss: 1.1109, test_loss: 1.0709, test_f1: 0.4673
 epoch: 30, train_loss: 1.0989, test_loss: 1.1092, test_f1: 0.4260
 epoch: 31, train_loss: 1.0951, test_loss: 1.1126, test_f1: 0.4390
 epoch: 32, train_loss: 1.0924, test_loss: 1.0617, test_f1: 0.4405
 epoch: 33, train_loss: 1.0871, test_loss: 1.0847, test_f1: 0.4500
 epoch: 34, train_loss: 1.0824, test_loss: 1.0630, test_f1: 0.4610
 epoch: 35, train_loss: 1.0779, test_loss: 1.0608, test_f1: 0.4537
 epoch: 36, train_loss: 1.0766, test_loss: 1.0462, test_f1: 0.4588
 epoch: 37, train_loss: 1.0843, test_loss: 1.0468, test_f1: 0.4471
 epoch: 38, train_loss: 1.0629, test_loss: 1.0543, test_f1: 0.4532
 epoch: 39, train_loss: 1.0713, test_loss: 1.0541, test_f1: 0.4586
 epoch: 40, train_loss: 1.0602, test_loss: 1.0360, test_f1: 0.4863
 epoch: 41, train_loss: 1.0601, test_loss: 1.0468, test_f1: 0.4598
 epoch: 42, train_loss: 1.0499, test_loss: 1.0531, test_f1: 0.4624
 epoch: 43, train_loss: 1.0473, test_loss: 1.0419, test_f1: 0.4532
 epoch: 44, train_loss: 1.0348, test_loss: 1.0449, test_f1: 0.4769
 epoch: 45, train_loss: 1.0418, test_loss: 1.0140, test_f1: 0.4829
 epoch: 46, train_loss: 1.0382, test_loss: 1.0146, test_f1: 0.4820
 epoch: 47, train_loss: 1.0339, test_loss: 1.0410, test_f1: 0.4709
 epoch: 48, train_loss: 1.0336, test_loss: 1.0477, test_f1: 0.4532
 epoch: 49, train_loss: 1.0285, test_loss: 1.0261, test_f1: 0.4659
 epoch: 50, train_loss: 1.0195, test_loss: 1.0126, test_f1: 0.4718
 epoch: 51, train_loss: 1.0282, test_loss: 1.0241, test_f1: 0.4798
 epoch: 52, train_loss: 1.0145, test_loss: 1.0212, test_f1: 0.4739
 epoch: 53, train_loss: 1.0076, test_loss: 1.0491, test_f1: 0.4597
 epoch: 54, train_loss: 1.0098, test_loss: 1.0044, test_f1: 0.4720
 epoch: 55, train_loss: 1.0087, test_loss: 1.0522, test_f1: 0.4652
 epoch: 56, train_loss: 1.0097, test_loss: 1.0317, test_f1: 0.4719
 epoch: 57, train_loss: 0.9952, test_loss: 1.0403, test_f1: 0.4705
 epoch: 58, train_loss: 1.0131, test_loss: 1.0239, test_f1: 0.4699
 epoch: 59, train_loss: 1.0062, test_loss: 1.0182, test_f1: 0.4712
 epoch: 60, train_loss: 1.0023, test_loss: 1.0473, test_f1: 0.4706
 epoch: 61, train_loss: 0.9924, test_loss: 1.0156, test_f1: 0.4724
 epoch: 62, train_loss: 0.9910, test_loss: 1.0400, test_f1: 0.4612
 epoch: 63, train_loss: 0.9782, test_loss: 1.0535, test_f1: 0.4635
 epoch: 64, train_loss: 0.9859, test_loss: 1.0061, test_f1: 0.4718
 epoch: 65, train_loss: 0.9933, test_loss: 1.0445, test_f1: 0.4718
 epoch: 66, train_loss: 0.9891, test_loss: 1.0284, test_f1: 0.4638
 epoch: 67, train_loss: 0.9981, test_loss: 1.0710, test_f1: 0.4656
 epoch: 68, train_loss: 0.9804, test_loss: 1.0340, test_f1: 0.4721
 epoch: 69, train_loss: 0.9738, test_loss: 1.0567, test_f1: 0.4760
 epoch: 70, train_loss: 0.9739, test_loss: 1.0297, test_f1: 0.4646
 epoch: 71, train_loss: 0.9840, test_loss: 1.0288, test_f1: 0.4715
 epoch: 72, train_loss: 0.9736, test_loss: 1.0571, test_f1: 0.4706
 epoch: 73, train_loss: 0.9716, test_loss: 1.0361, test_f1: 0.4676
 epoch: 74, train_loss: 0.9683, test_loss: 1.0414, test_f1: 0.4686
 epoch: 75, train_loss: 0.9691, test_loss: 1.0387, test_f1: 0.4654
 epoch: 76, train_loss: 0.9789, test_loss: 1.0475, test_f1: 0.4691
 epoch: 77, train_loss: 0.9783, test_loss: 1.0519, test_f1: 0.4742
 epoch: 78, train_loss: 0.9693, test_loss: 1.0373, test_f1: 0.4791
 epoch: 79, train_loss: 0.9719, test_loss: 1.0440, test_f1: 0.4701
 epoch: 80, train_loss: 0.9622, test_loss: 1.0309, test_f1: 0.4744
 epoch: 81, train_loss: 0.9651, test_loss: 1.0384, test_f1: 0.4805
 epoch: 82, train_loss: 0.9593, test_loss: 1.0315, test_f1: 0.4764
 epoch: 83, train_loss: 0.9635, test_loss: 1.0228, test_f1: 0.4793
 epoch: 84, train_loss: 0.9622, test_loss: 1.0414, test_f1: 0.4663
 epoch: 85, train_loss: 0.9564, test_loss: 1.0524, test_f1: 0.4663
 epoch: 86, train_loss: 0.9626, test_loss: 1.0232, test_f1: 0.4700
 epoch: 87, train_loss: 0.9622, test_loss: 1.0387, test_f1: 0.4697
 epoch: 88, train_loss: 0.9554, test_loss: 1.0434, test_f1: 0.4681
 epoch: 89, train_loss: 0.9567, test_loss: 1.0550, test_f1: 0.4714
 epoch: 90, train_loss: 0.9505, test_loss: 1.0139, test_f1: 0.4690
 epoch: 91, train_loss: 0.9492, test_loss: 1.0573, test_f1: 0.4627
 epoch: 92, train_loss: 0.9511, test_loss: 1.0417, test_f1: 0.4706
 epoch: 93, train_loss: 0.9564, test_loss: 1.0613, test_f1: 0.4728
 epoch: 94, train_loss: 0.9406, test_loss: 1.0292, test_f1: 0.4734
 epoch: 95, train_loss: 0.9416, test_loss: 1.0441, test_f1: 0.4750
 epoch: 96, train_loss: 0.9482, test_loss: 1.0296, test_f1: 0.4626
 epoch: 97, train_loss: 0.9480, test_loss: 1.0397, test_f1: 0.4724
 epoch: 98, train_loss: 0.9477, test_loss: 1.0489, test_f1: 0.4713
 epoch: 99, train_loss: 0.9347, test_loss: 1.0447, test_f1: 0.4745
##################ITERATION #3 ****************************************
 epoch: 0, train_loss: 1.4829, test_loss: 1.4767, test_f1: 0.1238
 epoch: 1, train_loss: 1.3282, test_loss: 1.3610, test_f1: 0.2340
 epoch: 2, train_loss: 1.3039, test_loss: 1.3104, test_f1: 0.2274
 epoch: 3, train_loss: 1.2769, test_loss: 1.2753, test_f1: 0.2274
 epoch: 4, train_loss: 1.2687, test_loss: 1.2454, test_f1: 0.2276
 epoch: 5, train_loss: 1.2589, test_loss: 1.2262, test_f1: 0.2555
 epoch: 6, train_loss: 1.2449, test_loss: 1.2177, test_f1: 0.2636
 epoch: 7, train_loss: 1.2430, test_loss: 1.2103, test_f1: 0.2841
 epoch: 8, train_loss: 1.2290, test_loss: 1.2013, test_f1: 0.3121
 epoch: 9, train_loss: 1.2239, test_loss: 1.1876, test_f1: 0.3233
 epoch: 10, train_loss: 1.2147, test_loss: 1.1802, test_f1: 0.3425
 epoch: 11, train_loss: 1.2049, test_loss: 1.1670, test_f1: 0.3676
 epoch: 12, train_loss: 1.1970, test_loss: 1.1585, test_f1: 0.3667
 epoch: 13, train_loss: 1.1903, test_loss: 1.1524, test_f1: 0.3688
 epoch: 14, train_loss: 1.1781, test_loss: 1.1384, test_f1: 0.3951
 epoch: 15, train_loss: 1.1686, test_loss: 1.1319, test_f1: 0.4024
 epoch: 16, train_loss: 1.1638, test_loss: 1.1200, test_f1: 0.4149
 epoch: 17, train_loss: 1.1510, test_loss: 1.1147, test_f1: 0.4144
 epoch: 18, train_loss: 1.1413, test_loss: 1.1121, test_f1: 0.4037
 epoch: 19, train_loss: 1.1472, test_loss: 1.0910, test_f1: 0.4344
 epoch: 20, train_loss: 1.1358, test_loss: 1.0962, test_f1: 0.4089
 epoch: 21, train_loss: 1.1243, test_loss: 1.0777, test_f1: 0.4272
 epoch: 22, train_loss: 1.1233, test_loss: 1.0736, test_f1: 0.4191
 epoch: 23, train_loss: 1.1160, test_loss: 1.0695, test_f1: 0.4190
 epoch: 24, train_loss: 1.1039, test_loss: 1.0607, test_f1: 0.4231
 epoch: 25, train_loss: 1.1034, test_loss: 1.0738, test_f1: 0.3984
 epoch: 26, train_loss: 1.0977, test_loss: 1.0621, test_f1: 0.4268
 epoch: 27, train_loss: 1.0985, test_loss: 1.0518, test_f1: 0.4149
 epoch: 28, train_loss: 1.0817, test_loss: 1.0625, test_f1: 0.4203
 epoch: 29, train_loss: 1.0849, test_loss: 1.0286, test_f1: 0.4453
 epoch: 30, train_loss: 1.0720, test_loss: 1.0332, test_f1: 0.4318
 epoch: 31, train_loss: 1.0733, test_loss: 1.0279, test_f1: 0.4418
 epoch: 32, train_loss: 1.0686, test_loss: 1.0137, test_f1: 0.4518
 epoch: 33, train_loss: 1.0600, test_loss: 1.0109, test_f1: 0.4486
 epoch: 34, train_loss: 1.0534, test_loss: 1.0072, test_f1: 0.4458
 epoch: 35, train_loss: 1.0500, test_loss: 1.0119, test_f1: 0.4499
 epoch: 36, train_loss: 1.0422, test_loss: 1.0141, test_f1: 0.4402
 epoch: 37, train_loss: 1.0414, test_loss: 1.0204, test_f1: 0.4320
 epoch: 38, train_loss: 1.0391, test_loss: 0.9892, test_f1: 0.4663
 epoch: 39, train_loss: 1.0344, test_loss: 0.9986, test_f1: 0.4682
 epoch: 40, train_loss: 1.0291, test_loss: 0.9855, test_f1: 0.4581
 epoch: 41, train_loss: 1.0230, test_loss: 0.9931, test_f1: 0.4384
 epoch: 42, train_loss: 1.0183, test_loss: 0.9774, test_f1: 0.4636
 epoch: 43, train_loss: 1.0117, test_loss: 0.9765, test_f1: 0.4469
 epoch: 44, train_loss: 1.0075, test_loss: 0.9689, test_f1: 0.4594
 epoch: 45, train_loss: 1.0056, test_loss: 0.9839, test_f1: 0.4298
 epoch: 46, train_loss: 1.0073, test_loss: 0.9713, test_f1: 0.4440
 epoch: 47, train_loss: 0.9944, test_loss: 0.9694, test_f1: 0.4457
 epoch: 48, train_loss: 0.9926, test_loss: 0.9797, test_f1: 0.4521
 epoch: 49, train_loss: 0.9891, test_loss: 0.9779, test_f1: 0.4726
 epoch: 50, train_loss: 0.9786, test_loss: 0.9682, test_f1: 0.4527
 epoch: 51, train_loss: 0.9857, test_loss: 0.9721, test_f1: 0.4640
 epoch: 52, train_loss: 0.9845, test_loss: 0.9850, test_f1: 0.4695
 epoch: 53, train_loss: 0.9750, test_loss: 0.9862, test_f1: 0.4653
 epoch: 54, train_loss: 0.9849, test_loss: 0.9712, test_f1: 0.4618
 epoch: 55, train_loss: 0.9737, test_loss: 0.9819, test_f1: 0.4653
 epoch: 56, train_loss: 0.9735, test_loss: 0.9790, test_f1: 0.4552
 epoch: 57, train_loss: 0.9753, test_loss: 0.9807, test_f1: 0.4544
 epoch: 58, train_loss: 0.9765, test_loss: 0.9767, test_f1: 0.4544
 epoch: 59, train_loss: 0.9698, test_loss: 0.9908, test_f1: 0.4583
 epoch: 60, train_loss: 0.9694, test_loss: 0.9827, test_f1: 0.4670
 epoch: 61, train_loss: 0.9570, test_loss: 0.9949, test_f1: 0.4531
 epoch: 62, train_loss: 0.9690, test_loss: 0.9885, test_f1: 0.4681
 epoch: 63, train_loss: 0.9560, test_loss: 0.9795, test_f1: 0.4474
 epoch: 64, train_loss: 0.9629, test_loss: 0.9698, test_f1: 0.4705
 epoch: 65, train_loss: 0.9573, test_loss: 0.9755, test_f1: 0.4667
 epoch: 66, train_loss: 0.9585, test_loss: 0.9880, test_f1: 0.4568
 epoch: 67, train_loss: 0.9553, test_loss: 0.9929, test_f1: 0.4489
 epoch: 68, train_loss: 0.9513, test_loss: 0.9931, test_f1: 0.4523
 epoch: 69, train_loss: 0.9555, test_loss: 0.9881, test_f1: 0.4753
 epoch: 70, train_loss: 0.9499, test_loss: 0.9995, test_f1: 0.4693
 epoch: 71, train_loss: 0.9622, test_loss: 0.9968, test_f1: 0.4672
 epoch: 72, train_loss: 0.9494, test_loss: 0.9993, test_f1: 0.4573
 epoch: 73, train_loss: 0.9415, test_loss: 1.0069, test_f1: 0.4681
 epoch: 74, train_loss: 0.9405, test_loss: 1.0126, test_f1: 0.4612
 epoch: 75, train_loss: 0.9581, test_loss: 1.0152, test_f1: 0.4748
 epoch: 76, train_loss: 0.9406, test_loss: 1.0170, test_f1: 0.4586
 epoch: 77, train_loss: 0.9419, test_loss: 0.9958, test_f1: 0.4676
 epoch: 78, train_loss: 0.9490, test_loss: 1.0154, test_f1: 0.4637
 epoch: 79, train_loss: 0.9509, test_loss: 1.0021, test_f1: 0.4795
 epoch: 80, train_loss: 0.9347, test_loss: 0.9972, test_f1: 0.4556
 epoch: 81, train_loss: 0.9408, test_loss: 1.0084, test_f1: 0.4571
 epoch: 82, train_loss: 0.9386, test_loss: 1.0143, test_f1: 0.4653
 epoch: 83, train_loss: 0.9453, test_loss: 1.0199, test_f1: 0.4585
 epoch: 84, train_loss: 0.9381, test_loss: 1.0147, test_f1: 0.4714
 epoch: 85, train_loss: 0.9380, test_loss: 1.0169, test_f1: 0.4707
 epoch: 86, train_loss: 0.9371, test_loss: 1.0084, test_f1: 0.4544
 epoch: 87, train_loss: 0.9329, test_loss: 1.0398, test_f1: 0.4516
 epoch: 88, train_loss: 0.9240, test_loss: 1.0330, test_f1: 0.4405
 epoch: 89, train_loss: 0.9295, test_loss: 1.0264, test_f1: 0.4649
 epoch: 90, train_loss: 0.9265, test_loss: 1.0225, test_f1: 0.4733
 epoch: 91, train_loss: 0.9313, test_loss: 1.0298, test_f1: 0.4643
 epoch: 92, train_loss: 0.9253, test_loss: 1.0061, test_f1: 0.4785
 epoch: 93, train_loss: 0.9273, test_loss: 1.0350, test_f1: 0.4808
 epoch: 94, train_loss: 0.9275, test_loss: 1.0263, test_f1: 0.4756
 epoch: 95, train_loss: 0.9240, test_loss: 1.0288, test_f1: 0.4686
 epoch: 96, train_loss: 0.9213, test_loss: 1.0306, test_f1: 0.4812
 epoch: 97, train_loss: 0.9201, test_loss: 1.0231, test_f1: 0.4785
 epoch: 98, train_loss: 0.9189, test_loss: 1.0109, test_f1: 0.4812
 epoch: 99, train_loss: 0.9215, test_loss: 1.0201, test_f1: 0.4779
##################ITERATION #4 ****************************************
 epoch: 0, train_loss: 1.3445, test_loss: 1.3228, test_f1: 0.2274
 epoch: 1, train_loss: 1.2899, test_loss: 1.2940, test_f1: 0.2274
 epoch: 2, train_loss: 1.2646, test_loss: 1.2532, test_f1: 0.2776
 epoch: 3, train_loss: 1.2487, test_loss: 1.2296, test_f1: 0.2869
 epoch: 4, train_loss: 1.2380, test_loss: 1.2155, test_f1: 0.2862
 epoch: 5, train_loss: 1.2325, test_loss: 1.2069, test_f1: 0.2991
 epoch: 6, train_loss: 1.2178, test_loss: 1.1944, test_f1: 0.3190
 epoch: 7, train_loss: 1.2121, test_loss: 1.1886, test_f1: 0.3289
 epoch: 8, train_loss: 1.2086, test_loss: 1.1838, test_f1: 0.3243
 epoch: 9, train_loss: 1.2035, test_loss: 1.1645, test_f1: 0.3962
 epoch: 10, train_loss: 1.1914, test_loss: 1.1531, test_f1: 0.3913
 epoch: 11, train_loss: 1.1815, test_loss: 1.1406, test_f1: 0.3839
 epoch: 12, train_loss: 1.1787, test_loss: 1.1288, test_f1: 0.4107
 epoch: 13, train_loss: 1.1633, test_loss: 1.1182, test_f1: 0.4344
 epoch: 14, train_loss: 1.1588, test_loss: 1.1109, test_f1: 0.4440
 epoch: 15, train_loss: 1.1557, test_loss: 1.1034, test_f1: 0.4319
 epoch: 16, train_loss: 1.1497, test_loss: 1.0964, test_f1: 0.4419
 epoch: 17, train_loss: 1.1375, test_loss: 1.0841, test_f1: 0.4467
 epoch: 18, train_loss: 1.1298, test_loss: 1.0739, test_f1: 0.4454
 epoch: 19, train_loss: 1.1356, test_loss: 1.0706, test_f1: 0.4462
 epoch: 20, train_loss: 1.1199, test_loss: 1.0551, test_f1: 0.4486
 epoch: 21, train_loss: 1.1114, test_loss: 1.0496, test_f1: 0.4459
 epoch: 22, train_loss: 1.1068, test_loss: 1.0483, test_f1: 0.4488
 epoch: 23, train_loss: 1.0998, test_loss: 1.0430, test_f1: 0.4508
 epoch: 24, train_loss: 1.0955, test_loss: 1.0400, test_f1: 0.4752
 epoch: 25, train_loss: 1.0888, test_loss: 1.0390, test_f1: 0.4525
 epoch: 26, train_loss: 1.0739, test_loss: 1.0146, test_f1: 0.4469
 epoch: 27, train_loss: 1.0745, test_loss: 1.0083, test_f1: 0.4603
 epoch: 28, train_loss: 1.0719, test_loss: 1.0072, test_f1: 0.4653
 epoch: 29, train_loss: 1.0615, test_loss: 1.0132, test_f1: 0.4609
 epoch: 30, train_loss: 1.0683, test_loss: 0.9932, test_f1: 0.4640
 epoch: 31, train_loss: 1.0531, test_loss: 1.0136, test_f1: 0.4454
 epoch: 32, train_loss: 1.0562, test_loss: 0.9784, test_f1: 0.4761
 epoch: 33, train_loss: 1.0406, test_loss: 0.9796, test_f1: 0.4650
 epoch: 34, train_loss: 1.0415, test_loss: 0.9788, test_f1: 0.4774
 epoch: 35, train_loss: 1.0418, test_loss: 0.9876, test_f1: 0.4725
 epoch: 36, train_loss: 1.0353, test_loss: 0.9799, test_f1: 0.4724
 epoch: 37, train_loss: 1.0474, test_loss: 0.9865, test_f1: 0.4718
 epoch: 38, train_loss: 1.0228, test_loss: 0.9749, test_f1: 0.4680
 epoch: 39, train_loss: 1.0266, test_loss: 0.9748, test_f1: 0.4698
 epoch: 40, train_loss: 1.0208, test_loss: 0.9678, test_f1: 0.4748
 epoch: 41, train_loss: 1.0178, test_loss: 0.9775, test_f1: 0.4764
 epoch: 42, train_loss: 1.0150, test_loss: 0.9880, test_f1: 0.4648
 epoch: 43, train_loss: 1.0141, test_loss: 0.9700, test_f1: 0.4703
 epoch: 44, train_loss: 1.0089, test_loss: 0.9759, test_f1: 0.4751
 epoch: 45, train_loss: 1.0010, test_loss: 0.9670, test_f1: 0.4811
 epoch: 46, train_loss: 0.9926, test_loss: 0.9663, test_f1: 0.4635
 epoch: 47, train_loss: 0.9956, test_loss: 0.9579, test_f1: 0.4923
 epoch: 48, train_loss: 1.0004, test_loss: 0.9744, test_f1: 0.4833
 epoch: 49, train_loss: 0.9876, test_loss: 0.9642, test_f1: 0.4984
 epoch: 50, train_loss: 0.9837, test_loss: 0.9633, test_f1: 0.4731
 epoch: 51, train_loss: 0.9839, test_loss: 0.9691, test_f1: 0.4728
 epoch: 52, train_loss: 0.9704, test_loss: 0.9653, test_f1: 0.4760
 epoch: 53, train_loss: 0.9793, test_loss: 0.9620, test_f1: 0.4828
 epoch: 54, train_loss: 0.9910, test_loss: 0.9641, test_f1: 0.4814
 epoch: 55, train_loss: 0.9760, test_loss: 0.9624, test_f1: 0.5025
 epoch: 56, train_loss: 0.9735, test_loss: 0.9572, test_f1: 0.4955
 epoch: 57, train_loss: 0.9689, test_loss: 0.9655, test_f1: 0.4863
 epoch: 58, train_loss: 0.9669, test_loss: 0.9581, test_f1: 0.5007
 epoch: 59, train_loss: 0.9689, test_loss: 0.9602, test_f1: 0.5037
 epoch: 60, train_loss: 0.9683, test_loss: 0.9523, test_f1: 0.5004
 epoch: 61, train_loss: 0.9682, test_loss: 0.9570, test_f1: 0.4876
 epoch: 62, train_loss: 0.9572, test_loss: 0.9639, test_f1: 0.4814
 epoch: 63, train_loss: 0.9727, test_loss: 0.9608, test_f1: 0.4867
 epoch: 64, train_loss: 0.9601, test_loss: 0.9812, test_f1: 0.4897
 epoch: 65, train_loss: 0.9671, test_loss: 0.9663, test_f1: 0.4921
 epoch: 66, train_loss: 0.9727, test_loss: 0.9731, test_f1: 0.4801
 epoch: 67, train_loss: 0.9670, test_loss: 0.9636, test_f1: 0.4818
 epoch: 68, train_loss: 0.9637, test_loss: 0.9716, test_f1: 0.4805
 epoch: 69, train_loss: 0.9555, test_loss: 0.9721, test_f1: 0.4877
 epoch: 70, train_loss: 0.9525, test_loss: 0.9751, test_f1: 0.5016
 epoch: 71, train_loss: 0.9501, test_loss: 0.9699, test_f1: 0.5016
 epoch: 72, train_loss: 0.9495, test_loss: 0.9701, test_f1: 0.4789
 epoch: 73, train_loss: 0.9533, test_loss: 0.9640, test_f1: 0.4862
 epoch: 74, train_loss: 0.9528, test_loss: 0.9702, test_f1: 0.4929
 epoch: 75, train_loss: 0.9451, test_loss: 0.9681, test_f1: 0.4697
 epoch: 76, train_loss: 0.9451, test_loss: 0.9670, test_f1: 0.4846
 epoch: 77, train_loss: 0.9634, test_loss: 0.9692, test_f1: 0.4811
 epoch: 78, train_loss: 0.9509, test_loss: 0.9667, test_f1: 0.4806
 epoch: 79, train_loss: 0.9487, test_loss: 0.9626, test_f1: 0.4972
 epoch: 80, train_loss: 0.9354, test_loss: 0.9580, test_f1: 0.4904
 epoch: 81, train_loss: 0.9412, test_loss: 0.9856, test_f1: 0.4768
 epoch: 82, train_loss: 0.9557, test_loss: 0.9594, test_f1: 0.4949
 epoch: 83, train_loss: 0.9514, test_loss: 0.9650, test_f1: 0.4891
 epoch: 84, train_loss: 0.9459, test_loss: 0.9713, test_f1: 0.4878
 epoch: 85, train_loss: 0.9486, test_loss: 0.9596, test_f1: 0.4872
 epoch: 86, train_loss: 0.9340, test_loss: 0.9608, test_f1: 0.5077
 epoch: 87, train_loss: 0.9378, test_loss: 0.9540, test_f1: 0.5012
 epoch: 88, train_loss: 0.9336, test_loss: 0.9563, test_f1: 0.4993
 epoch: 89, train_loss: 0.9333, test_loss: 0.9472, test_f1: 0.5048
 epoch: 90, train_loss: 0.9293, test_loss: 0.9523, test_f1: 0.5063
 epoch: 91, train_loss: 0.9382, test_loss: 0.9433, test_f1: 0.4840
 epoch: 92, train_loss: 0.9284, test_loss: 0.9530, test_f1: 0.4844
 epoch: 93, train_loss: 0.9344, test_loss: 0.9417, test_f1: 0.4913
 epoch: 94, train_loss: 0.9390, test_loss: 0.9384, test_f1: 0.4880
 epoch: 95, train_loss: 0.9223, test_loss: 0.9567, test_f1: 0.4929
 epoch: 96, train_loss: 0.9332, test_loss: 0.9459, test_f1: 0.4785
 epoch: 97, train_loss: 0.9343, test_loss: 0.9571, test_f1: 0.4877
 epoch: 98, train_loss: 0.9318, test_loss: 0.9489, test_f1: 0.4876
 epoch: 99, train_loss: 0.9304, test_loss: 0.9529, test_f1: 0.4947
##################ITERATION #5 ****************************************
 epoch: 0, train_loss: 1.3475, test_loss: 1.3269, test_f1: 0.2274
 epoch: 1, train_loss: 1.2897, test_loss: 1.3114, test_f1: 0.2274
 epoch: 2, train_loss: 1.2747, test_loss: 1.2905, test_f1: 0.2276
 epoch: 3, train_loss: 1.2549, test_loss: 1.2625, test_f1: 0.2497
 epoch: 4, train_loss: 1.2479, test_loss: 1.2374, test_f1: 0.2697
 epoch: 5, train_loss: 1.2398, test_loss: 1.2163, test_f1: 0.3131
 epoch: 6, train_loss: 1.2303, test_loss: 1.1994, test_f1: 0.3174
 epoch: 7, train_loss: 1.2177, test_loss: 1.1842, test_f1: 0.3749
 epoch: 8, train_loss: 1.2176, test_loss: 1.1767, test_f1: 0.3810
 epoch: 9, train_loss: 1.2106, test_loss: 1.1612, test_f1: 0.3983
 epoch: 10, train_loss: 1.2004, test_loss: 1.1561, test_f1: 0.3923
 epoch: 11, train_loss: 1.1859, test_loss: 1.1553, test_f1: 0.4023
 epoch: 12, train_loss: 1.1817, test_loss: 1.1409, test_f1: 0.3954
 epoch: 13, train_loss: 1.1733, test_loss: 1.1412, test_f1: 0.4056
 epoch: 14, train_loss: 1.1664, test_loss: 1.1342, test_f1: 0.4028
 epoch: 15, train_loss: 1.1599, test_loss: 1.1319, test_f1: 0.4001
 epoch: 16, train_loss: 1.1454, test_loss: 1.1317, test_f1: 0.3981
 epoch: 17, train_loss: 1.1473, test_loss: 1.1256, test_f1: 0.3947
 epoch: 18, train_loss: 1.1473, test_loss: 1.1246, test_f1: 0.3982
 epoch: 19, train_loss: 1.1325, test_loss: 1.1215, test_f1: 0.4079
 epoch: 20, train_loss: 1.1241, test_loss: 1.1198, test_f1: 0.3993
 epoch: 21, train_loss: 1.1171, test_loss: 1.1119, test_f1: 0.4189
 epoch: 22, train_loss: 1.1218, test_loss: 1.1138, test_f1: 0.4048
 epoch: 23, train_loss: 1.1203, test_loss: 1.1140, test_f1: 0.4126
 epoch: 24, train_loss: 1.1210, test_loss: 1.1165, test_f1: 0.4016
 epoch: 25, train_loss: 1.1179, test_loss: 1.1112, test_f1: 0.4106
 epoch: 26, train_loss: 1.1035, test_loss: 1.1250, test_f1: 0.4028
 epoch: 27, train_loss: 1.1028, test_loss: 1.0874, test_f1: 0.4109
 epoch: 28, train_loss: 1.1100, test_loss: 1.0846, test_f1: 0.4101
 epoch: 29, train_loss: 1.0970, test_loss: 1.0885, test_f1: 0.4147
 epoch: 30, train_loss: 1.0897, test_loss: 1.0923, test_f1: 0.4168
 epoch: 31, train_loss: 1.0860, test_loss: 1.0862, test_f1: 0.4235
 epoch: 32, train_loss: 1.0857, test_loss: 1.0761, test_f1: 0.4285
 epoch: 33, train_loss: 1.0735, test_loss: 1.0927, test_f1: 0.4129
 epoch: 34, train_loss: 1.0780, test_loss: 1.0724, test_f1: 0.4427
 epoch: 35, train_loss: 1.0734, test_loss: 1.0719, test_f1: 0.4228
 epoch: 36, train_loss: 1.0738, test_loss: 1.0702, test_f1: 0.4363
 epoch: 37, train_loss: 1.0615, test_loss: 1.0950, test_f1: 0.4193
 epoch: 38, train_loss: 1.0607, test_loss: 1.0833, test_f1: 0.4231
 epoch: 39, train_loss: 1.0574, test_loss: 1.0657, test_f1: 0.4336
 epoch: 40, train_loss: 1.0464, test_loss: 1.0710, test_f1: 0.4416
 epoch: 41, train_loss: 1.0491, test_loss: 1.0636, test_f1: 0.4374
 epoch: 42, train_loss: 1.0465, test_loss: 1.0531, test_f1: 0.4451
 epoch: 43, train_loss: 1.0378, test_loss: 1.0439, test_f1: 0.4645
 epoch: 44, train_loss: 1.0403, test_loss: 1.0585, test_f1: 0.4486
 epoch: 45, train_loss: 1.0346, test_loss: 1.0515, test_f1: 0.4517
 epoch: 46, train_loss: 1.0405, test_loss: 1.0552, test_f1: 0.4372
 epoch: 47, train_loss: 1.0360, test_loss: 1.0415, test_f1: 0.4294
 epoch: 48, train_loss: 1.0242, test_loss: 1.0678, test_f1: 0.4248
 epoch: 49, train_loss: 1.0252, test_loss: 1.0288, test_f1: 0.4557
 epoch: 50, train_loss: 1.0347, test_loss: 1.0489, test_f1: 0.4336
 epoch: 51, train_loss: 1.0236, test_loss: 1.0285, test_f1: 0.4441
 epoch: 52, train_loss: 1.0144, test_loss: 1.0348, test_f1: 0.4398
 epoch: 53, train_loss: 1.0147, test_loss: 1.0269, test_f1: 0.4452
 epoch: 54, train_loss: 1.0161, test_loss: 1.0295, test_f1: 0.4478
 epoch: 55, train_loss: 1.0056, test_loss: 1.0236, test_f1: 0.4524
 epoch: 56, train_loss: 1.0121, test_loss: 1.0318, test_f1: 0.4454
 epoch: 57, train_loss: 0.9990, test_loss: 1.0204, test_f1: 0.4624
 epoch: 58, train_loss: 0.9959, test_loss: 1.0173, test_f1: 0.4574
 epoch: 59, train_loss: 1.0007, test_loss: 1.0222, test_f1: 0.4574
 epoch: 60, train_loss: 1.0056, test_loss: 1.0323, test_f1: 0.4352
 epoch: 61, train_loss: 1.0111, test_loss: 1.0307, test_f1: 0.4433
 epoch: 62, train_loss: 0.9980, test_loss: 1.0244, test_f1: 0.4431
 epoch: 63, train_loss: 1.0092, test_loss: 1.0278, test_f1: 0.4521
 epoch: 64, train_loss: 0.9902, test_loss: 1.0143, test_f1: 0.4610
 epoch: 65, train_loss: 0.9940, test_loss: 1.0178, test_f1: 0.4458
 epoch: 66, train_loss: 1.0010, test_loss: 1.0201, test_f1: 0.4449
 epoch: 67, train_loss: 0.9897, test_loss: 1.0185, test_f1: 0.4461
 epoch: 68, train_loss: 0.9865, test_loss: 1.0153, test_f1: 0.4507
 epoch: 69, train_loss: 0.9863, test_loss: 1.0190, test_f1: 0.4427
 epoch: 70, train_loss: 0.9817, test_loss: 1.0166, test_f1: 0.4418
 epoch: 71, train_loss: 0.9769, test_loss: 1.0352, test_f1: 0.4323
 epoch: 72, train_loss: 0.9863, test_loss: 1.0140, test_f1: 0.4555
 epoch: 73, train_loss: 0.9691, test_loss: 1.0231, test_f1: 0.4554
 epoch: 74, train_loss: 0.9723, test_loss: 1.0136, test_f1: 0.4588
 epoch: 75, train_loss: 0.9738, test_loss: 1.0271, test_f1: 0.4484
 epoch: 76, train_loss: 0.9769, test_loss: 1.0200, test_f1: 0.4523
 epoch: 77, train_loss: 0.9819, test_loss: 1.0209, test_f1: 0.4563
 epoch: 78, train_loss: 0.9792, test_loss: 1.0315, test_f1: 0.4462
 epoch: 79, train_loss: 0.9621, test_loss: 1.0224, test_f1: 0.4748
 epoch: 80, train_loss: 0.9720, test_loss: 1.0146, test_f1: 0.4530
 epoch: 81, train_loss: 0.9674, test_loss: 1.0266, test_f1: 0.4442
 epoch: 82, train_loss: 0.9695, test_loss: 1.0287, test_f1: 0.4442
 epoch: 83, train_loss: 0.9593, test_loss: 1.0240, test_f1: 0.4534
 epoch: 84, train_loss: 0.9743, test_loss: 1.0234, test_f1: 0.4467
 epoch: 85, train_loss: 0.9629, test_loss: 1.0247, test_f1: 0.4659
 epoch: 86, train_loss: 0.9615, test_loss: 1.0281, test_f1: 0.4528
 epoch: 87, train_loss: 0.9676, test_loss: 1.0201, test_f1: 0.4572
 epoch: 88, train_loss: 0.9651, test_loss: 1.0367, test_f1: 0.4646
 epoch: 89, train_loss: 0.9593, test_loss: 1.0456, test_f1: 0.4498
 epoch: 90, train_loss: 0.9578, test_loss: 1.0272, test_f1: 0.4686
 epoch: 91, train_loss: 0.9563, test_loss: 1.0318, test_f1: 0.4593
 epoch: 92, train_loss: 0.9651, test_loss: 1.0218, test_f1: 0.4664
 epoch: 93, train_loss: 0.9527, test_loss: 1.0298, test_f1: 0.4805
 epoch: 94, train_loss: 0.9623, test_loss: 1.0221, test_f1: 0.4650
 epoch: 95, train_loss: 0.9568, test_loss: 1.0166, test_f1: 0.4618
 epoch: 96, train_loss: 0.9640, test_loss: 1.0344, test_f1: 0.4527
 epoch: 97, train_loss: 0.9549, test_loss: 1.0338, test_f1: 0.4520
 epoch: 98, train_loss: 0.9457, test_loss: 1.0191, test_f1: 0.4663
 epoch: 99, train_loss: 0.9505, test_loss: 1.0327, test_f1: 0.4372
##################ITERATION #6 ****************************************
 epoch: 0, train_loss: 1.4755, test_loss: 1.3723, test_f1: 0.2274
 epoch: 1, train_loss: 1.3318, test_loss: 1.3531, test_f1: 0.2274
 epoch: 2, train_loss: 1.3090, test_loss: 1.3138, test_f1: 0.2300
 epoch: 3, train_loss: 1.2860, test_loss: 1.2765, test_f1: 0.2362
 epoch: 4, train_loss: 1.2764, test_loss: 1.2570, test_f1: 0.2869
 epoch: 5, train_loss: 1.2559, test_loss: 1.2442, test_f1: 0.2803
 epoch: 6, train_loss: 1.2533, test_loss: 1.2409, test_f1: 0.2812
 epoch: 7, train_loss: 1.2451, test_loss: 1.2317, test_f1: 0.3190
 epoch: 8, train_loss: 1.2428, test_loss: 1.2263, test_f1: 0.3257
 epoch: 9, train_loss: 1.2415, test_loss: 1.2268, test_f1: 0.3172
 epoch: 10, train_loss: 1.2279, test_loss: 1.2177, test_f1: 0.3293
 epoch: 11, train_loss: 1.2334, test_loss: 1.2152, test_f1: 0.3345
 epoch: 12, train_loss: 1.2133, test_loss: 1.2172, test_f1: 0.3336
 epoch: 13, train_loss: 1.2181, test_loss: 1.2114, test_f1: 0.3496
 epoch: 14, train_loss: 1.2028, test_loss: 1.2056, test_f1: 0.3568
 epoch: 15, train_loss: 1.2010, test_loss: 1.2055, test_f1: 0.3675
 epoch: 16, train_loss: 1.1933, test_loss: 1.2027, test_f1: 0.3821
 epoch: 17, train_loss: 1.1941, test_loss: 1.1889, test_f1: 0.3826
 epoch: 18, train_loss: 1.1913, test_loss: 1.1923, test_f1: 0.3782
 epoch: 19, train_loss: 1.1886, test_loss: 1.1861, test_f1: 0.3719
 epoch: 20, train_loss: 1.1767, test_loss: 1.1842, test_f1: 0.3863
 epoch: 21, train_loss: 1.1732, test_loss: 1.1836, test_f1: 0.3867
 epoch: 22, train_loss: 1.1738, test_loss: 1.1796, test_f1: 0.3989
 epoch: 23, train_loss: 1.1709, test_loss: 1.1803, test_f1: 0.3802
 epoch: 24, train_loss: 1.1613, test_loss: 1.1682, test_f1: 0.3973
 epoch: 25, train_loss: 1.1590, test_loss: 1.1641, test_f1: 0.4020
 epoch: 26, train_loss: 1.1504, test_loss: 1.1574, test_f1: 0.3917
 epoch: 27, train_loss: 1.1548, test_loss: 1.1430, test_f1: 0.4053
 epoch: 28, train_loss: 1.1480, test_loss: 1.1416, test_f1: 0.4013
 epoch: 29, train_loss: 1.1376, test_loss: 1.1487, test_f1: 0.4112
 epoch: 30, train_loss: 1.1210, test_loss: 1.1365, test_f1: 0.4252
 epoch: 31, train_loss: 1.1226, test_loss: 1.1172, test_f1: 0.4306
 epoch: 32, train_loss: 1.1270, test_loss: 1.1202, test_f1: 0.4113
 epoch: 33, train_loss: 1.1164, test_loss: 1.1200, test_f1: 0.4277
 epoch: 34, train_loss: 1.1071, test_loss: 1.0864, test_f1: 0.4411
 epoch: 35, train_loss: 1.1138, test_loss: 1.0963, test_f1: 0.4300
 epoch: 36, train_loss: 1.0995, test_loss: 1.0973, test_f1: 0.4331
 epoch: 37, train_loss: 1.0969, test_loss: 1.0863, test_f1: 0.4276
 epoch: 38, train_loss: 1.0842, test_loss: 1.0746, test_f1: 0.4416
 epoch: 39, train_loss: 1.0702, test_loss: 1.0441, test_f1: 0.4520
 epoch: 40, train_loss: 1.0703, test_loss: 1.0574, test_f1: 0.4309
 epoch: 41, train_loss: 1.0572, test_loss: 1.0269, test_f1: 0.4453
 epoch: 42, train_loss: 1.0591, test_loss: 1.0317, test_f1: 0.4506
 epoch: 43, train_loss: 1.0393, test_loss: 1.0095, test_f1: 0.4516
 epoch: 44, train_loss: 1.0386, test_loss: 1.0046, test_f1: 0.4601
 epoch: 45, train_loss: 1.0270, test_loss: 1.0050, test_f1: 0.4686
 epoch: 46, train_loss: 1.0278, test_loss: 1.0003, test_f1: 0.4781
 epoch: 47, train_loss: 1.0190, test_loss: 0.9925, test_f1: 0.4807
 epoch: 48, train_loss: 1.0170, test_loss: 0.9992, test_f1: 0.4745
 epoch: 49, train_loss: 1.0136, test_loss: 0.9622, test_f1: 0.4857
 epoch: 50, train_loss: 0.9969, test_loss: 0.9578, test_f1: 0.4867
 epoch: 51, train_loss: 0.9923, test_loss: 0.9507, test_f1: 0.4804
 epoch: 52, train_loss: 0.9937, test_loss: 0.9475, test_f1: 0.4796
 epoch: 53, train_loss: 0.9952, test_loss: 0.9558, test_f1: 0.4901
 epoch: 54, train_loss: 0.9805, test_loss: 0.9470, test_f1: 0.4889
 epoch: 55, train_loss: 0.9815, test_loss: 0.9477, test_f1: 0.4885
 epoch: 56, train_loss: 0.9704, test_loss: 0.9838, test_f1: 0.4673
 epoch: 57, train_loss: 0.9693, test_loss: 0.9585, test_f1: 0.4673
 epoch: 58, train_loss: 0.9616, test_loss: 0.9739, test_f1: 0.4702
 epoch: 59, train_loss: 0.9615, test_loss: 0.9439, test_f1: 0.4715
 epoch: 60, train_loss: 0.9630, test_loss: 0.9376, test_f1: 0.4945
 epoch: 61, train_loss: 0.9578, test_loss: 0.9337, test_f1: 0.4877
 epoch: 62, train_loss: 0.9692, test_loss: 0.9417, test_f1: 0.4798
 epoch: 63, train_loss: 0.9533, test_loss: 0.9476, test_f1: 0.4786
 epoch: 64, train_loss: 0.9536, test_loss: 0.9386, test_f1: 0.4853
 epoch: 65, train_loss: 0.9497, test_loss: 0.9443, test_f1: 0.4804
 epoch: 66, train_loss: 0.9490, test_loss: 0.9687, test_f1: 0.4644
 epoch: 67, train_loss: 0.9434, test_loss: 0.9684, test_f1: 0.4543
 epoch: 68, train_loss: 0.9532, test_loss: 0.9324, test_f1: 0.4764
 epoch: 69, train_loss: 0.9394, test_loss: 0.9432, test_f1: 0.4807
 epoch: 70, train_loss: 0.9320, test_loss: 0.9693, test_f1: 0.4681
 epoch: 71, train_loss: 0.9428, test_loss: 0.9634, test_f1: 0.4649
 epoch: 72, train_loss: 0.9361, test_loss: 0.9518, test_f1: 0.4654
 epoch: 73, train_loss: 0.9309, test_loss: 0.9638, test_f1: 0.4642
 epoch: 74, train_loss: 0.9408, test_loss: 1.0173, test_f1: 0.4621
 epoch: 75, train_loss: 0.9406, test_loss: 0.9306, test_f1: 0.4854
 epoch: 76, train_loss: 0.9285, test_loss: 0.9317, test_f1: 0.4829
 epoch: 77, train_loss: 0.9227, test_loss: 0.9513, test_f1: 0.4884
 epoch: 78, train_loss: 0.9292, test_loss: 0.9622, test_f1: 0.4695
 epoch: 79, train_loss: 0.9190, test_loss: 0.9545, test_f1: 0.4702
 epoch: 80, train_loss: 0.9247, test_loss: 0.9784, test_f1: 0.4645
 epoch: 81, train_loss: 0.9225, test_loss: 0.9887, test_f1: 0.4701
 epoch: 82, train_loss: 0.9251, test_loss: 0.9398, test_f1: 0.4843
 epoch: 83, train_loss: 0.9146, test_loss: 0.9617, test_f1: 0.4692
 epoch: 84, train_loss: 0.9157, test_loss: 0.9445, test_f1: 0.4734
 epoch: 85, train_loss: 0.9090, test_loss: 0.9543, test_f1: 0.4743
 epoch: 86, train_loss: 0.9184, test_loss: 0.9839, test_f1: 0.4630
 epoch: 87, train_loss: 0.9051, test_loss: 0.9691, test_f1: 0.4665
 epoch: 88, train_loss: 0.9224, test_loss: 0.9657, test_f1: 0.4648
 epoch: 89, train_loss: 0.9066, test_loss: 1.0358, test_f1: 0.4676
 epoch: 90, train_loss: 0.9042, test_loss: 0.9807, test_f1: 0.4591
 epoch: 91, train_loss: 0.9079, test_loss: 0.9531, test_f1: 0.4816
 epoch: 92, train_loss: 0.9021, test_loss: 0.9673, test_f1: 0.4766
 epoch: 93, train_loss: 0.9069, test_loss: 0.9882, test_f1: 0.4603
 epoch: 94, train_loss: 0.9038, test_loss: 0.9768, test_f1: 0.4597
 epoch: 95, train_loss: 0.8985, test_loss: 0.9565, test_f1: 0.4728
 epoch: 96, train_loss: 0.8932, test_loss: 1.0134, test_f1: 0.4662
 epoch: 97, train_loss: 0.8922, test_loss: 0.9459, test_f1: 0.4741
 epoch: 98, train_loss: 0.8963, test_loss: 1.0884, test_f1: 0.4691
 epoch: 99, train_loss: 0.8934, test_loss: 1.1426, test_f1: 0.4709
##################ITERATION #7 ****************************************
 epoch: 0, train_loss: 1.3498, test_loss: 1.3228, test_f1: 0.2274
 epoch: 1, train_loss: 1.2832, test_loss: 1.2758, test_f1: 0.2274
 epoch: 2, train_loss: 1.2665, test_loss: 1.2534, test_f1: 0.2399
 epoch: 3, train_loss: 1.2486, test_loss: 1.2237, test_f1: 0.2562
 epoch: 4, train_loss: 1.2497, test_loss: 1.2057, test_f1: 0.3126
 epoch: 5, train_loss: 1.2340, test_loss: 1.2014, test_f1: 0.3159
 epoch: 6, train_loss: 1.2342, test_loss: 1.1951, test_f1: 0.3424
 epoch: 7, train_loss: 1.2216, test_loss: 1.1874, test_f1: 0.3435
 epoch: 8, train_loss: 1.2219, test_loss: 1.1807, test_f1: 0.3512
 epoch: 9, train_loss: 1.2064, test_loss: 1.1726, test_f1: 0.3564
 epoch: 10, train_loss: 1.2035, test_loss: 1.1608, test_f1: 0.3783
 epoch: 11, train_loss: 1.1981, test_loss: 1.1606, test_f1: 0.3721
 epoch: 12, train_loss: 1.1963, test_loss: 1.1560, test_f1: 0.3788
 epoch: 13, train_loss: 1.1818, test_loss: 1.1469, test_f1: 0.3811
 epoch: 14, train_loss: 1.1917, test_loss: 1.1432, test_f1: 0.3914
 epoch: 15, train_loss: 1.1816, test_loss: 1.1401, test_f1: 0.3923
 epoch: 16, train_loss: 1.1820, test_loss: 1.1302, test_f1: 0.3774
 epoch: 17, train_loss: 1.1634, test_loss: 1.1344, test_f1: 0.3984
 epoch: 18, train_loss: 1.1614, test_loss: 1.1179, test_f1: 0.3792
 epoch: 19, train_loss: 1.1541, test_loss: 1.1113, test_f1: 0.3984
 epoch: 20, train_loss: 1.1487, test_loss: 1.1157, test_f1: 0.3766
 epoch: 21, train_loss: 1.1391, test_loss: 1.0974, test_f1: 0.4057
 epoch: 22, train_loss: 1.1415, test_loss: 1.1041, test_f1: 0.3894
 epoch: 23, train_loss: 1.1336, test_loss: 1.0870, test_f1: 0.4098
 epoch: 24, train_loss: 1.1260, test_loss: 1.0759, test_f1: 0.4151
 epoch: 25, train_loss: 1.1218, test_loss: 1.0816, test_f1: 0.4198
 epoch: 26, train_loss: 1.1150, test_loss: 1.0738, test_f1: 0.4172
 epoch: 27, train_loss: 1.1090, test_loss: 1.0659, test_f1: 0.4242
 epoch: 28, train_loss: 1.1009, test_loss: 1.0664, test_f1: 0.4232
 epoch: 29, train_loss: 1.1018, test_loss: 1.0675, test_f1: 0.4206
 epoch: 30, train_loss: 1.0909, test_loss: 1.0527, test_f1: 0.4228
 epoch: 31, train_loss: 1.0968, test_loss: 1.0783, test_f1: 0.4188
 epoch: 32, train_loss: 1.0912, test_loss: 1.0621, test_f1: 0.4242
 epoch: 33, train_loss: 1.0806, test_loss: 1.0532, test_f1: 0.4375
 epoch: 34, train_loss: 1.0780, test_loss: 1.0650, test_f1: 0.4352
 epoch: 35, train_loss: 1.0766, test_loss: 1.0704, test_f1: 0.4324
 epoch: 36, train_loss: 1.0615, test_loss: 1.0679, test_f1: 0.4261
 epoch: 37, train_loss: 1.0642, test_loss: 1.0521, test_f1: 0.4490
 epoch: 38, train_loss: 1.0593, test_loss: 1.0452, test_f1: 0.4382
 epoch: 39, train_loss: 1.0585, test_loss: 1.0402, test_f1: 0.4412
 epoch: 40, train_loss: 1.0431, test_loss: 1.0542, test_f1: 0.4361
 epoch: 41, train_loss: 1.0476, test_loss: 1.0676, test_f1: 0.4246
 epoch: 42, train_loss: 1.0421, test_loss: 1.0661, test_f1: 0.4240
 epoch: 43, train_loss: 1.0524, test_loss: 1.0454, test_f1: 0.4557
 epoch: 44, train_loss: 1.0519, test_loss: 1.0509, test_f1: 0.4397
 epoch: 45, train_loss: 1.0410, test_loss: 1.0506, test_f1: 0.4360
 epoch: 46, train_loss: 1.0426, test_loss: 1.0322, test_f1: 0.4445
 epoch: 47, train_loss: 1.0332, test_loss: 1.0584, test_f1: 0.4146
 epoch: 48, train_loss: 1.0167, test_loss: 1.0792, test_f1: 0.4240
 epoch: 49, train_loss: 1.0212, test_loss: 1.0472, test_f1: 0.4386
 epoch: 50, train_loss: 1.0276, test_loss: 1.0714, test_f1: 0.4265
 epoch: 51, train_loss: 1.0119, test_loss: 1.0516, test_f1: 0.4354
 epoch: 52, train_loss: 1.0133, test_loss: 1.0378, test_f1: 0.4396
 epoch: 53, train_loss: 1.0052, test_loss: 1.0393, test_f1: 0.4414
 epoch: 54, train_loss: 1.0014, test_loss: 1.0414, test_f1: 0.4419
 epoch: 55, train_loss: 1.0025, test_loss: 1.0341, test_f1: 0.4375
 epoch: 56, train_loss: 1.0044, test_loss: 1.0428, test_f1: 0.4403
 epoch: 57, train_loss: 0.9946, test_loss: 1.0694, test_f1: 0.4298
 epoch: 58, train_loss: 0.9975, test_loss: 1.0544, test_f1: 0.4232
 epoch: 59, train_loss: 0.9873, test_loss: 1.0581, test_f1: 0.4391
 epoch: 60, train_loss: 0.9925, test_loss: 1.0542, test_f1: 0.4272
 epoch: 61, train_loss: 0.9906, test_loss: 1.0358, test_f1: 0.4407
 epoch: 62, train_loss: 0.9851, test_loss: 1.0361, test_f1: 0.4436
 epoch: 63, train_loss: 0.9935, test_loss: 1.0629, test_f1: 0.4298
 epoch: 64, train_loss: 0.9762, test_loss: 1.1027, test_f1: 0.4283
 epoch: 65, train_loss: 0.9835, test_loss: 1.1189, test_f1: 0.4273
 epoch: 66, train_loss: 0.9857, test_loss: 1.0662, test_f1: 0.4326
 epoch: 67, train_loss: 0.9801, test_loss: 1.0616, test_f1: 0.4341
 epoch: 68, train_loss: 0.9857, test_loss: 1.0621, test_f1: 0.4345
 epoch: 69, train_loss: 0.9800, test_loss: 1.1004, test_f1: 0.4310
 epoch: 70, train_loss: 0.9766, test_loss: 1.0773, test_f1: 0.4364
 epoch: 71, train_loss: 0.9737, test_loss: 1.0885, test_f1: 0.4305
 epoch: 72, train_loss: 0.9686, test_loss: 1.0694, test_f1: 0.4327
 epoch: 73, train_loss: 0.9729, test_loss: 1.0960, test_f1: 0.4244
 epoch: 74, train_loss: 0.9628, test_loss: 1.1268, test_f1: 0.4322
 epoch: 75, train_loss: 0.9752, test_loss: 1.0661, test_f1: 0.4431
 epoch: 76, train_loss: 0.9691, test_loss: 1.1003, test_f1: 0.4343
 epoch: 77, train_loss: 0.9640, test_loss: 1.0820, test_f1: 0.4525
 epoch: 78, train_loss: 0.9639, test_loss: 1.0753, test_f1: 0.4316
 epoch: 79, train_loss: 0.9578, test_loss: 1.0660, test_f1: 0.4500
 epoch: 80, train_loss: 0.9491, test_loss: 1.0970, test_f1: 0.4383
 epoch: 81, train_loss: 0.9513, test_loss: 1.1199, test_f1: 0.4362
 epoch: 82, train_loss: 0.9577, test_loss: 1.0993, test_f1: 0.4387
 epoch: 83, train_loss: 0.9516, test_loss: 1.0834, test_f1: 0.4440
 epoch: 84, train_loss: 0.9505, test_loss: 1.1201, test_f1: 0.4482
 epoch: 85, train_loss: 0.9557, test_loss: 1.0984, test_f1: 0.4495
 epoch: 86, train_loss: 0.9480, test_loss: 1.0821, test_f1: 0.4467
 epoch: 87, train_loss: 0.9413, test_loss: 1.1280, test_f1: 0.4520
 epoch: 88, train_loss: 0.9539, test_loss: 1.1680, test_f1: 0.4466
 epoch: 89, train_loss: 0.9418, test_loss: 1.1390, test_f1: 0.4275
 epoch: 90, train_loss: 0.9468, test_loss: 1.1663, test_f1: 0.4316
 epoch: 91, train_loss: 0.9482, test_loss: 1.1154, test_f1: 0.4369
 epoch: 92, train_loss: 0.9543, test_loss: 1.1242, test_f1: 0.4459
 epoch: 93, train_loss: 0.9398, test_loss: 1.1144, test_f1: 0.4302
 epoch: 94, train_loss: 0.9312, test_loss: 1.1369, test_f1: 0.4534
 epoch: 95, train_loss: 0.9369, test_loss: 1.1431, test_f1: 0.4494
 epoch: 96, train_loss: 0.9297, test_loss: 1.1317, test_f1: 0.4300
 epoch: 97, train_loss: 0.9421, test_loss: 1.1334, test_f1: 0.4357
 epoch: 98, train_loss: 0.9375, test_loss: 1.1267, test_f1: 0.4432
 epoch: 99, train_loss: 0.9269, test_loss: 1.1820, test_f1: 0.4476
##################ITERATION #8 ****************************************
 epoch: 0, train_loss: 1.3523, test_loss: 1.3221, test_f1: 0.2274
 epoch: 1, train_loss: 1.3022, test_loss: 1.2974, test_f1: 0.2274
 epoch: 2, train_loss: 1.2696, test_loss: 1.2722, test_f1: 0.2420
 epoch: 3, train_loss: 1.2637, test_loss: 1.2499, test_f1: 0.2609
 epoch: 4, train_loss: 1.2446, test_loss: 1.2346, test_f1: 0.2759
 epoch: 5, train_loss: 1.2457, test_loss: 1.2218, test_f1: 0.2966
 epoch: 6, train_loss: 1.2322, test_loss: 1.2052, test_f1: 0.3519
 epoch: 7, train_loss: 1.2186, test_loss: 1.1941, test_f1: 0.3645
 epoch: 8, train_loss: 1.2143, test_loss: 1.1772, test_f1: 0.3694
 epoch: 9, train_loss: 1.2035, test_loss: 1.1681, test_f1: 0.4028
 epoch: 10, train_loss: 1.2012, test_loss: 1.1572, test_f1: 0.4097
 epoch: 11, train_loss: 1.1821, test_loss: 1.1508, test_f1: 0.4103
 epoch: 12, train_loss: 1.1758, test_loss: 1.1327, test_f1: 0.4138
 epoch: 13, train_loss: 1.1734, test_loss: 1.1273, test_f1: 0.4207
 epoch: 14, train_loss: 1.1686, test_loss: 1.1198, test_f1: 0.4231
 epoch: 15, train_loss: 1.1605, test_loss: 1.1126, test_f1: 0.4149
 epoch: 16, train_loss: 1.1544, test_loss: 1.1139, test_f1: 0.4283
 epoch: 17, train_loss: 1.1532, test_loss: 1.0970, test_f1: 0.4298
 epoch: 18, train_loss: 1.1341, test_loss: 1.0950, test_f1: 0.4361
 epoch: 19, train_loss: 1.1397, test_loss: 1.0797, test_f1: 0.4505
 epoch: 20, train_loss: 1.1353, test_loss: 1.0788, test_f1: 0.4387
 epoch: 21, train_loss: 1.1298, test_loss: 1.0827, test_f1: 0.4448
 epoch: 22, train_loss: 1.1160, test_loss: 1.0623, test_f1: 0.4440
 epoch: 23, train_loss: 1.1201, test_loss: 1.0548, test_f1: 0.4519
 epoch: 24, train_loss: 1.0974, test_loss: 1.0537, test_f1: 0.4562
 epoch: 25, train_loss: 1.0960, test_loss: 1.0334, test_f1: 0.4614
 epoch: 26, train_loss: 1.0916, test_loss: 1.0330, test_f1: 0.4665
 epoch: 27, train_loss: 1.0940, test_loss: 1.0314, test_f1: 0.4530
 epoch: 28, train_loss: 1.0768, test_loss: 1.0270, test_f1: 0.4544
 epoch: 29, train_loss: 1.0747, test_loss: 1.0158, test_f1: 0.4675
 epoch: 30, train_loss: 1.0740, test_loss: 1.0157, test_f1: 0.4507
 epoch: 31, train_loss: 1.0703, test_loss: 1.0226, test_f1: 0.4505
 epoch: 32, train_loss: 1.0719, test_loss: 1.0154, test_f1: 0.4657
 epoch: 33, train_loss: 1.0711, test_loss: 1.0009, test_f1: 0.4499
 epoch: 34, train_loss: 1.0581, test_loss: 1.0440, test_f1: 0.4537
 epoch: 35, train_loss: 1.0511, test_loss: 1.0551, test_f1: 0.4400
 epoch: 36, train_loss: 1.0575, test_loss: 1.0353, test_f1: 0.4464
 epoch: 37, train_loss: 1.0430, test_loss: 0.9937, test_f1: 0.4611
 epoch: 38, train_loss: 1.0419, test_loss: 1.0228, test_f1: 0.4486
 epoch: 39, train_loss: 1.0354, test_loss: 1.0395, test_f1: 0.4541
 epoch: 40, train_loss: 1.0324, test_loss: 1.0353, test_f1: 0.4392
 epoch: 41, train_loss: 1.0273, test_loss: 0.9732, test_f1: 0.4689
 epoch: 42, train_loss: 1.0272, test_loss: 1.0175, test_f1: 0.4494
 epoch: 43, train_loss: 1.0264, test_loss: 1.0300, test_f1: 0.4421
 epoch: 44, train_loss: 1.0170, test_loss: 1.0199, test_f1: 0.4551
 epoch: 45, train_loss: 1.0132, test_loss: 0.9890, test_f1: 0.4630
 epoch: 46, train_loss: 1.0128, test_loss: 1.0212, test_f1: 0.4609
 epoch: 47, train_loss: 1.0095, test_loss: 0.9916, test_f1: 0.4712
 epoch: 48, train_loss: 1.0142, test_loss: 1.0153, test_f1: 0.4521
 epoch: 49, train_loss: 0.9985, test_loss: 0.9719, test_f1: 0.4843
 epoch: 50, train_loss: 1.0168, test_loss: 0.9623, test_f1: 0.4867
 epoch: 51, train_loss: 0.9952, test_loss: 0.9609, test_f1: 0.4759
 epoch: 52, train_loss: 0.9929, test_loss: 0.9775, test_f1: 0.4646
 epoch: 53, train_loss: 0.9803, test_loss: 0.9729, test_f1: 0.4737
 epoch: 54, train_loss: 1.0023, test_loss: 0.9598, test_f1: 0.4773
 epoch: 55, train_loss: 0.9791, test_loss: 0.9798, test_f1: 0.4693
 epoch: 56, train_loss: 0.9876, test_loss: 0.9868, test_f1: 0.4594
 epoch: 57, train_loss: 0.9784, test_loss: 0.9828, test_f1: 0.4579
 epoch: 58, train_loss: 0.9716, test_loss: 1.0053, test_f1: 0.4569
 epoch: 59, train_loss: 0.9734, test_loss: 1.0259, test_f1: 0.4638
 epoch: 60, train_loss: 0.9774, test_loss: 0.9641, test_f1: 0.4834
 epoch: 61, train_loss: 0.9705, test_loss: 1.0052, test_f1: 0.4594
 epoch: 62, train_loss: 0.9702, test_loss: 1.0352, test_f1: 0.4589
 epoch: 63, train_loss: 0.9705, test_loss: 1.0124, test_f1: 0.4573
 epoch: 64, train_loss: 0.9761, test_loss: 0.9831, test_f1: 0.4752
 epoch: 65, train_loss: 0.9753, test_loss: 0.9992, test_f1: 0.4616
 epoch: 66, train_loss: 0.9713, test_loss: 0.9702, test_f1: 0.4810
 epoch: 67, train_loss: 0.9588, test_loss: 0.9688, test_f1: 0.4698
 epoch: 68, train_loss: 0.9669, test_loss: 0.9843, test_f1: 0.4652
 epoch: 69, train_loss: 0.9667, test_loss: 0.9756, test_f1: 0.4716
 epoch: 70, train_loss: 0.9561, test_loss: 0.9654, test_f1: 0.4826
 epoch: 71, train_loss: 0.9586, test_loss: 0.9756, test_f1: 0.4709
 epoch: 72, train_loss: 0.9566, test_loss: 0.9589, test_f1: 0.4713
 epoch: 73, train_loss: 0.9550, test_loss: 0.9812, test_f1: 0.4689
 epoch: 74, train_loss: 0.9508, test_loss: 0.9987, test_f1: 0.4652
 epoch: 75, train_loss: 0.9555, test_loss: 0.9799, test_f1: 0.4813
 epoch: 76, train_loss: 0.9596, test_loss: 0.9995, test_f1: 0.4672
 epoch: 77, train_loss: 0.9516, test_loss: 0.9586, test_f1: 0.4810
 epoch: 78, train_loss: 0.9472, test_loss: 0.9665, test_f1: 0.4809
 epoch: 79, train_loss: 0.9527, test_loss: 0.9839, test_f1: 0.4798
 epoch: 80, train_loss: 0.9444, test_loss: 0.9700, test_f1: 0.4921
 epoch: 81, train_loss: 0.9474, test_loss: 0.9692, test_f1: 0.4883
 epoch: 82, train_loss: 0.9400, test_loss: 0.9664, test_f1: 0.4889
 epoch: 83, train_loss: 0.9291, test_loss: 0.9796, test_f1: 0.4756
 epoch: 84, train_loss: 0.9402, test_loss: 0.9896, test_f1: 0.4704
 epoch: 85, train_loss: 0.9312, test_loss: 0.9761, test_f1: 0.4910
 epoch: 86, train_loss: 0.9280, test_loss: 0.9676, test_f1: 0.4833
 epoch: 87, train_loss: 0.9430, test_loss: 0.9932, test_f1: 0.4711
 epoch: 88, train_loss: 0.9350, test_loss: 0.9602, test_f1: 0.4927
 epoch: 89, train_loss: 0.9314, test_loss: 1.0260, test_f1: 0.4652
 epoch: 90, train_loss: 0.9296, test_loss: 0.9901, test_f1: 0.4782
 epoch: 91, train_loss: 0.9284, test_loss: 0.9851, test_f1: 0.4876
 epoch: 92, train_loss: 0.9237, test_loss: 1.0034, test_f1: 0.4797
 epoch: 93, train_loss: 0.9309, test_loss: 0.9956, test_f1: 0.4788
 epoch: 94, train_loss: 0.9201, test_loss: 0.9862, test_f1: 0.4883
 epoch: 95, train_loss: 0.9319, test_loss: 1.0323, test_f1: 0.4660
 epoch: 96, train_loss: 0.9304, test_loss: 0.9877, test_f1: 0.4821
 epoch: 97, train_loss: 0.9186, test_loss: 1.0073, test_f1: 0.4713
 epoch: 98, train_loss: 0.9092, test_loss: 0.9752, test_f1: 0.4848
 epoch: 99, train_loss: 0.9233, test_loss: 0.9891, test_f1: 0.4767
##################ITERATION #9 ****************************************
 epoch: 0, train_loss: 1.6123, test_loss: 1.3164, test_f1: 0.2274
 epoch: 1, train_loss: 1.3429, test_loss: 1.2759, test_f1: 0.2300
 epoch: 2, train_loss: 1.2905, test_loss: 1.2483, test_f1: 0.2378
 epoch: 3, train_loss: 1.2824, test_loss: 1.2223, test_f1: 0.2698
 epoch: 4, train_loss: 1.2628, test_loss: 1.2028, test_f1: 0.2911
 epoch: 5, train_loss: 1.2419, test_loss: 1.1901, test_f1: 0.3125
 epoch: 6, train_loss: 1.2376, test_loss: 1.1780, test_f1: 0.3627
 epoch: 7, train_loss: 1.2340, test_loss: 1.1785, test_f1: 0.3591
 epoch: 8, train_loss: 1.2225, test_loss: 1.1738, test_f1: 0.3871
 epoch: 9, train_loss: 1.2207, test_loss: 1.1616, test_f1: 0.3845
 epoch: 10, train_loss: 1.2116, test_loss: 1.1544, test_f1: 0.3859
 epoch: 11, train_loss: 1.1970, test_loss: 1.1495, test_f1: 0.3896
 epoch: 12, train_loss: 1.1927, test_loss: 1.1415, test_f1: 0.4014
 epoch: 13, train_loss: 1.1855, test_loss: 1.1380, test_f1: 0.3985
 epoch: 14, train_loss: 1.1641, test_loss: 1.1333, test_f1: 0.4078
 epoch: 15, train_loss: 1.1630, test_loss: 1.1257, test_f1: 0.4191
 epoch: 16, train_loss: 1.1507, test_loss: 1.1151, test_f1: 0.4224
 epoch: 17, train_loss: 1.1442, test_loss: 1.1068, test_f1: 0.4277
 epoch: 18, train_loss: 1.1449, test_loss: 1.1066, test_f1: 0.4193
 epoch: 19, train_loss: 1.1378, test_loss: 1.1080, test_f1: 0.4253
 epoch: 20, train_loss: 1.1321, test_loss: 1.0971, test_f1: 0.4280
 epoch: 21, train_loss: 1.1244, test_loss: 1.0909, test_f1: 0.4336
 epoch: 22, train_loss: 1.1244, test_loss: 1.0806, test_f1: 0.4324
 epoch: 23, train_loss: 1.1137, test_loss: 1.0829, test_f1: 0.4299
 epoch: 24, train_loss: 1.1104, test_loss: 1.0758, test_f1: 0.4322
 epoch: 25, train_loss: 1.1005, test_loss: 1.0710, test_f1: 0.4387
 epoch: 26, train_loss: 1.0991, test_loss: 1.0737, test_f1: 0.4374
 epoch: 27, train_loss: 1.0895, test_loss: 1.0637, test_f1: 0.4441
 epoch: 28, train_loss: 1.0819, test_loss: 1.0641, test_f1: 0.4447
 epoch: 29, train_loss: 1.0797, test_loss: 1.0440, test_f1: 0.4531
 epoch: 30, train_loss: 1.0794, test_loss: 1.0372, test_f1: 0.4490
 epoch: 31, train_loss: 1.0769, test_loss: 1.0351, test_f1: 0.4477
 epoch: 32, train_loss: 1.0669, test_loss: 1.0399, test_f1: 0.4422
 epoch: 33, train_loss: 1.0736, test_loss: 1.0285, test_f1: 0.4496
 epoch: 34, train_loss: 1.0536, test_loss: 1.0313, test_f1: 0.4537
 epoch: 35, train_loss: 1.0612, test_loss: 1.0148, test_f1: 0.4572
 epoch: 36, train_loss: 1.0484, test_loss: 1.0198, test_f1: 0.4451
 epoch: 37, train_loss: 1.0491, test_loss: 1.0153, test_f1: 0.4482
 epoch: 38, train_loss: 1.0392, test_loss: 1.0172, test_f1: 0.4486
 epoch: 39, train_loss: 1.0357, test_loss: 1.0123, test_f1: 0.4541
 epoch: 40, train_loss: 1.0390, test_loss: 0.9996, test_f1: 0.4579
 epoch: 41, train_loss: 1.0338, test_loss: 0.9960, test_f1: 0.4583
 epoch: 42, train_loss: 1.0256, test_loss: 0.9878, test_f1: 0.4644
 epoch: 43, train_loss: 1.0214, test_loss: 0.9839, test_f1: 0.4665
 epoch: 44, train_loss: 1.0135, test_loss: 0.9980, test_f1: 0.4516
 epoch: 45, train_loss: 1.0181, test_loss: 0.9728, test_f1: 0.4678
 epoch: 46, train_loss: 0.9988, test_loss: 0.9808, test_f1: 0.4678
 epoch: 47, train_loss: 1.0026, test_loss: 0.9630, test_f1: 0.4653
 epoch: 48, train_loss: 1.0158, test_loss: 0.9752, test_f1: 0.4578
 epoch: 49, train_loss: 1.0147, test_loss: 0.9715, test_f1: 0.4623
 epoch: 50, train_loss: 1.0064, test_loss: 0.9737, test_f1: 0.4492
 epoch: 51, train_loss: 0.9964, test_loss: 0.9690, test_f1: 0.4545
 epoch: 52, train_loss: 0.9950, test_loss: 0.9709, test_f1: 0.4553
 epoch: 53, train_loss: 1.0004, test_loss: 0.9587, test_f1: 0.4652
 epoch: 54, train_loss: 0.9945, test_loss: 0.9622, test_f1: 0.4576
 epoch: 55, train_loss: 0.9840, test_loss: 0.9653, test_f1: 0.4553
 epoch: 56, train_loss: 0.9835, test_loss: 0.9664, test_f1: 0.4533
 epoch: 57, train_loss: 0.9821, test_loss: 0.9596, test_f1: 0.4528
 epoch: 58, train_loss: 0.9847, test_loss: 0.9613, test_f1: 0.4559
 epoch: 59, train_loss: 0.9871, test_loss: 0.9527, test_f1: 0.4631
 epoch: 60, train_loss: 0.9710, test_loss: 0.9572, test_f1: 0.4581
 epoch: 61, train_loss: 0.9675, test_loss: 0.9605, test_f1: 0.4572
 epoch: 62, train_loss: 0.9762, test_loss: 0.9582, test_f1: 0.4536
 epoch: 63, train_loss: 0.9750, test_loss: 0.9564, test_f1: 0.4577
 epoch: 64, train_loss: 0.9726, test_loss: 0.9682, test_f1: 0.4457
 epoch: 65, train_loss: 0.9688, test_loss: 0.9587, test_f1: 0.4470
 epoch: 66, train_loss: 0.9695, test_loss: 0.9556, test_f1: 0.4612
 epoch: 67, train_loss: 0.9591, test_loss: 0.9600, test_f1: 0.4550
 epoch: 68, train_loss: 0.9666, test_loss: 0.9563, test_f1: 0.4587
 epoch: 69, train_loss: 0.9566, test_loss: 0.9588, test_f1: 0.4600
 epoch: 70, train_loss: 0.9596, test_loss: 0.9639, test_f1: 0.4574
 epoch: 71, train_loss: 0.9617, test_loss: 0.9581, test_f1: 0.4627
 epoch: 72, train_loss: 0.9620, test_loss: 0.9596, test_f1: 0.4544
 epoch: 73, train_loss: 0.9499, test_loss: 0.9773, test_f1: 0.4560
 epoch: 74, train_loss: 0.9585, test_loss: 0.9707, test_f1: 0.4505
 epoch: 75, train_loss: 0.9661, test_loss: 0.9645, test_f1: 0.4502
 epoch: 76, train_loss: 0.9491, test_loss: 0.9802, test_f1: 0.4468
 epoch: 77, train_loss: 0.9556, test_loss: 0.9679, test_f1: 0.4678
 epoch: 78, train_loss: 0.9478, test_loss: 0.9756, test_f1: 0.4581
 epoch: 79, train_loss: 0.9482, test_loss: 0.9740, test_f1: 0.4403
 epoch: 80, train_loss: 0.9507, test_loss: 0.9617, test_f1: 0.4577
 epoch: 81, train_loss: 0.9521, test_loss: 0.9692, test_f1: 0.4581
 epoch: 82, train_loss: 0.9343, test_loss: 0.9649, test_f1: 0.4610
 epoch: 83, train_loss: 0.9379, test_loss: 0.9698, test_f1: 0.4503
 epoch: 84, train_loss: 0.9407, test_loss: 0.9638, test_f1: 0.4519
 epoch: 85, train_loss: 0.9397, test_loss: 0.9578, test_f1: 0.4707
 epoch: 86, train_loss: 0.9332, test_loss: 0.9666, test_f1: 0.4613
 epoch: 87, train_loss: 0.9394, test_loss: 0.9714, test_f1: 0.4614
 epoch: 88, train_loss: 0.9427, test_loss: 0.9800, test_f1: 0.4672
 epoch: 89, train_loss: 0.9259, test_loss: 0.9668, test_f1: 0.4749
 epoch: 90, train_loss: 0.9325, test_loss: 0.9634, test_f1: 0.4711
 epoch: 91, train_loss: 0.9333, test_loss: 0.9912, test_f1: 0.4525
 epoch: 92, train_loss: 0.9281, test_loss: 0.9730, test_f1: 0.4721
 epoch: 93, train_loss: 0.9275, test_loss: 0.9654, test_f1: 0.4746
 epoch: 94, train_loss: 0.9236, test_loss: 0.9612, test_f1: 0.4743
 epoch: 95, train_loss: 0.9336, test_loss: 0.9601, test_f1: 0.4639
 epoch: 96, train_loss: 0.9270, test_loss: 0.9562, test_f1: 0.4782
 epoch: 97, train_loss: 0.9271, test_loss: 0.9917, test_f1: 0.4675
 epoch: 98, train_loss: 0.9269, test_loss: 0.9756, test_f1: 0.4648
 epoch: 99, train_loss: 0.9224, test_loss: 0.9860, test_f1: 0.4558

Training completed in 370.44 seconds
Best F1: 0.5339 at epoch 82
Mean F1 across iterations: 0.4914  0.0198
========================FINAL RESULTS================================
FEGIN weighted F1: 0.5339  0.0198
python main.py --data ltspice_examples --representation component_component --model FEGIN --layers 3 --hiddens 16 --batch_size 256 --lr 0.001 --emb_size 128 --epochs 100 --save_appendix component_component_L3_H16_BS256_LR0.001_E128 --no_val
-----



STDERR:
  File "main.py", line 370, in <module>
    main()
  File "main.py", line 254, in main
    dataset = dataset_class(
  File "/home/philip/projects/ltspice_examples_code_repo/Circuit-Completion-Using-GNNs/component_classification_with_link_prediction_head/evaluation/FEGIN/kernel/circuit_datasets.py", line 15, in __init__
    self.data, self.slices = torch.load(self.processed_paths[0])
  File "/home/philip/.local/lib/python3.8/site-packages/torch/serialization.py", line 1040, in load
    warnings.warn(
  File "/usr/lib/python3.8/warnings.py", line 109, in _showwarnmsg
    sw(msg.message, msg.category, msg.filename, msg.lineno,
  File "main.py", line 47, in warn_with_traceback
    traceback.print_stack(file=log)
/home/philip/projects/ltspice_examples_code_repo/Circuit-Completion-Using-GNNs/component_classification_with_link_prediction_head/evaluation/FEGIN/kernel/circuit_datasets.py:15: FutureWarning: You are using `torch.load` with `weights_only=False` (the current default value), which uses the default pickle module implicitly. It is possible to construct malicious pickle data which will execute arbitrary code during unpickling (See https://github.com/pytorch/pytorch/blob/main/SECURITY.md#untrusted-models for more details). In a future release, the default value for `weights_only` will be flipped to `True`. This limits the functions that could be executed during unpickling. Arbitrary objects will no longer be allowed to be loaded via this mode unless they are explicitly allowlisted by the user via `torch.serialization.add_safe_globals`. We recommend you start setting `weights_only=True` for any use case where you don't have full control of the loaded file. Please open an issue on GitHub for any issues related to this experimental feature.
  self.data, self.slices = torch.load(self.processed_paths[0])
