STDOUT:
Results will be saved in /home/philip/projects/ltspice_examples_code_repo/Circuit-Completion-Using-GNNs/component_classification_with_link_prediction_head/evaluation/FEGIN/results/model_FEGIN_dataset_ltspice_demos
Command line input: python main.py --data ltspice_demos --representation component_component --model FEGIN --layers 4 --hiddens 16 --batch_size 128 --lr 0.001 --emb_size 250 --epochs 100 --save_appendix component_component_L4_H16_BS128_LR0.001_E250 --no_val
 is saved.
-----
ltspice_demos - FEGIN
Using 4 layers, 16 hidden units, h = 2
Loading component_component representation dataset
ENTERED
Training FEGIN on component_component representation
Train: 1565, Test: 383
##################ITERATION #0 ****************************************
 epoch: 0, train_loss: 1.3654, test_loss: 1.3583, test_f1: 0.2281
 epoch: 1, train_loss: 1.3497, test_loss: 1.3519, test_f1: 0.2281
 epoch: 2, train_loss: 1.3403, test_loss: 1.3455, test_f1: 0.2281
 epoch: 3, train_loss: 1.3303, test_loss: 1.3367, test_f1: 0.2281
 epoch: 4, train_loss: 1.3160, test_loss: 1.3266, test_f1: 0.2281
 epoch: 5, train_loss: 1.2970, test_loss: 1.3137, test_f1: 0.2281
 epoch: 6, train_loss: 1.2789, test_loss: 1.2981, test_f1: 0.2281
 epoch: 7, train_loss: 1.2559, test_loss: 1.2822, test_f1: 0.2281
 epoch: 8, train_loss: 1.2292, test_loss: 1.2664, test_f1: 0.2281
 epoch: 9, train_loss: 1.2125, test_loss: 1.2561, test_f1: 0.2281
 epoch: 10, train_loss: 1.2022, test_loss: 1.2493, test_f1: 0.2623
 epoch: 11, train_loss: 1.1870, test_loss: 1.2421, test_f1: 0.3108
 epoch: 12, train_loss: 1.1789, test_loss: 1.2582, test_f1: 0.3090
 epoch: 13, train_loss: 1.1660, test_loss: 1.2642, test_f1: 0.3385
 epoch: 14, train_loss: 1.1531, test_loss: 1.2659, test_f1: 0.3865
 epoch: 15, train_loss: 1.1498, test_loss: 1.2600, test_f1: 0.3528
 epoch: 16, train_loss: 1.1314, test_loss: 1.3200, test_f1: 0.3220
 epoch: 17, train_loss: 1.1336, test_loss: 1.3836, test_f1: 0.3298
 epoch: 18, train_loss: 1.1304, test_loss: 1.3812, test_f1: 0.3409
 epoch: 19, train_loss: 1.1136, test_loss: 1.3962, test_f1: 0.3460
 epoch: 20, train_loss: 1.1121, test_loss: 1.3863, test_f1: 0.3351
 epoch: 21, train_loss: 1.0988, test_loss: 1.4085, test_f1: 0.3261
 epoch: 22, train_loss: 1.0908, test_loss: 1.3913, test_f1: 0.3425
 epoch: 23, train_loss: 1.0904, test_loss: 1.4046, test_f1: 0.3550
 epoch: 24, train_loss: 1.0667, test_loss: 1.4141, test_f1: 0.3523
 epoch: 25, train_loss: 1.0695, test_loss: 1.4413, test_f1: 0.3850
 epoch: 26, train_loss: 1.0571, test_loss: 1.4598, test_f1: 0.3869
 epoch: 27, train_loss: 1.0695, test_loss: 1.3368, test_f1: 0.3804
 epoch: 28, train_loss: 1.0522, test_loss: 1.4594, test_f1: 0.3983
 epoch: 29, train_loss: 1.0590, test_loss: 1.4387, test_f1: 0.3906
 epoch: 30, train_loss: 1.0359, test_loss: 1.4352, test_f1: 0.4055
 epoch: 31, train_loss: 1.0402, test_loss: 1.3012, test_f1: 0.4064
 epoch: 32, train_loss: 1.0316, test_loss: 1.2943, test_f1: 0.4027
 epoch: 33, train_loss: 1.0185, test_loss: 1.4590, test_f1: 0.4061
 epoch: 34, train_loss: 1.0158, test_loss: 1.4960, test_f1: 0.4316
 epoch: 35, train_loss: 1.0202, test_loss: 1.4522, test_f1: 0.4178
 epoch: 36, train_loss: 1.0076, test_loss: 1.4286, test_f1: 0.4173
 epoch: 37, train_loss: 1.0086, test_loss: 1.7967, test_f1: 0.4260
 epoch: 38, train_loss: 0.9971, test_loss: 1.6514, test_f1: 0.4350
 epoch: 39, train_loss: 0.9970, test_loss: 1.7491, test_f1: 0.4280
 epoch: 40, train_loss: 0.9803, test_loss: 1.7598, test_f1: 0.4289
 epoch: 41, train_loss: 0.9919, test_loss: 1.5948, test_f1: 0.4341
 epoch: 42, train_loss: 0.9819, test_loss: 1.9622, test_f1: 0.4563
 epoch: 43, train_loss: 0.9814, test_loss: 1.7096, test_f1: 0.4485
 epoch: 44, train_loss: 0.9809, test_loss: 1.5280, test_f1: 0.4589
 epoch: 45, train_loss: 0.9680, test_loss: 1.5463, test_f1: 0.4612
 epoch: 46, train_loss: 0.9591, test_loss: 1.6553, test_f1: 0.4486
 epoch: 47, train_loss: 0.9468, test_loss: 1.5774, test_f1: 0.4662
 epoch: 48, train_loss: 0.9422, test_loss: 1.6391, test_f1: 0.4432
 epoch: 49, train_loss: 0.9370, test_loss: 1.5492, test_f1: 0.4647
 epoch: 50, train_loss: 0.9477, test_loss: 1.6203, test_f1: 0.4754
 epoch: 51, train_loss: 0.9242, test_loss: 1.4781, test_f1: 0.4726
 epoch: 52, train_loss: 0.9124, test_loss: 1.7058, test_f1: 0.4667
 epoch: 53, train_loss: 0.9183, test_loss: 1.6963, test_f1: 0.4606
 epoch: 54, train_loss: 0.9172, test_loss: 1.5536, test_f1: 0.4708
 epoch: 55, train_loss: 0.9186, test_loss: 1.6183, test_f1: 0.4835
 epoch: 56, train_loss: 0.9130, test_loss: 1.6090, test_f1: 0.4786
 epoch: 57, train_loss: 0.9003, test_loss: 1.6961, test_f1: 0.4739
 epoch: 58, train_loss: 0.8926, test_loss: 1.7235, test_f1: 0.4765
 epoch: 59, train_loss: 0.9006, test_loss: 1.7743, test_f1: 0.4940
 epoch: 60, train_loss: 0.8995, test_loss: 1.6487, test_f1: 0.4780
 epoch: 61, train_loss: 0.9046, test_loss: 1.7081, test_f1: 0.4634
 epoch: 62, train_loss: 0.9035, test_loss: 1.6250, test_f1: 0.4889
 epoch: 63, train_loss: 0.9058, test_loss: 1.5467, test_f1: 0.4606
 epoch: 64, train_loss: 0.8978, test_loss: 1.6100, test_f1: 0.4656
 epoch: 65, train_loss: 0.8805, test_loss: 1.6477, test_f1: 0.4782
 epoch: 66, train_loss: 0.8895, test_loss: 1.6831, test_f1: 0.4736
 epoch: 67, train_loss: 0.8803, test_loss: 1.7343, test_f1: 0.4554
 epoch: 68, train_loss: 0.8833, test_loss: 1.7698, test_f1: 0.4498
 epoch: 69, train_loss: 0.8808, test_loss: 1.8538, test_f1: 0.4574
 epoch: 70, train_loss: 0.8806, test_loss: 1.7851, test_f1: 0.4652
 epoch: 71, train_loss: 0.8717, test_loss: 1.8086, test_f1: 0.4570
 epoch: 72, train_loss: 0.8702, test_loss: 1.7172, test_f1: 0.4699
 epoch: 73, train_loss: 0.8699, test_loss: 1.7686, test_f1: 0.4722
 epoch: 74, train_loss: 0.8778, test_loss: 1.8542, test_f1: 0.4864
 epoch: 75, train_loss: 0.8498, test_loss: 1.8696, test_f1: 0.4468
 epoch: 76, train_loss: 0.8700, test_loss: 1.8665, test_f1: 0.4732
 epoch: 77, train_loss: 0.8595, test_loss: 1.6794, test_f1: 0.4722
 epoch: 78, train_loss: 0.8632, test_loss: 1.7857, test_f1: 0.4602
 epoch: 79, train_loss: 0.8612, test_loss: 1.9144, test_f1: 0.4498
 epoch: 80, train_loss: 0.8556, test_loss: 1.8547, test_f1: 0.4575
 epoch: 81, train_loss: 0.8567, test_loss: 1.8808, test_f1: 0.4517
 epoch: 82, train_loss: 0.8449, test_loss: 1.7704, test_f1: 0.4546
 epoch: 83, train_loss: 0.8583, test_loss: 1.7772, test_f1: 0.4553
 epoch: 84, train_loss: 0.8453, test_loss: 1.8550, test_f1: 0.4489
 epoch: 85, train_loss: 0.8465, test_loss: 2.0724, test_f1: 0.4699
 epoch: 86, train_loss: 0.8515, test_loss: 1.7203, test_f1: 0.4635
 epoch: 87, train_loss: 0.8561, test_loss: 1.5231, test_f1: 0.4658
 epoch: 88, train_loss: 0.8470, test_loss: 1.6222, test_f1: 0.4540
 epoch: 89, train_loss: 0.8540, test_loss: 1.8182, test_f1: 0.4644
 epoch: 90, train_loss: 0.8432, test_loss: 1.8776, test_f1: 0.4810
 epoch: 91, train_loss: 0.8356, test_loss: 1.8007, test_f1: 0.4628
 epoch: 92, train_loss: 0.8522, test_loss: 1.8828, test_f1: 0.4681
 epoch: 93, train_loss: 0.8367, test_loss: 1.7229, test_f1: 0.4734
 epoch: 94, train_loss: 0.8347, test_loss: 1.4798, test_f1: 0.4810
 epoch: 95, train_loss: 0.8405, test_loss: 1.5144, test_f1: 0.4669
 epoch: 96, train_loss: 0.8206, test_loss: 1.6238, test_f1: 0.4573
 epoch: 97, train_loss: 0.8221, test_loss: 1.6699, test_f1: 0.4676
 epoch: 98, train_loss: 0.8303, test_loss: 1.7408, test_f1: 0.4587
 epoch: 99, train_loss: 0.8304, test_loss: 1.6866, test_f1: 0.4659
##################ITERATION #1 ****************************************
 epoch: 0, train_loss: 1.3127, test_loss: 1.3172, test_f1: 0.2281
 epoch: 1, train_loss: 1.2675, test_loss: 1.3103, test_f1: 0.2281
 epoch: 2, train_loss: 1.2493, test_loss: 1.3105, test_f1: 0.2281
 epoch: 3, train_loss: 1.2307, test_loss: 1.3000, test_f1: 0.2281
 epoch: 4, train_loss: 1.2171, test_loss: 1.2927, test_f1: 0.2793
 epoch: 5, train_loss: 1.2175, test_loss: 1.2837, test_f1: 0.3071
 epoch: 6, train_loss: 1.2080, test_loss: 1.2806, test_f1: 0.3247
 epoch: 7, train_loss: 1.1994, test_loss: 1.2685, test_f1: 0.3314
 epoch: 8, train_loss: 1.2012, test_loss: 1.2604, test_f1: 0.3248
 epoch: 9, train_loss: 1.1933, test_loss: 1.2579, test_f1: 0.3257
 epoch: 10, train_loss: 1.1843, test_loss: 1.2505, test_f1: 0.3313
 epoch: 11, train_loss: 1.1821, test_loss: 1.2420, test_f1: 0.3267
 epoch: 12, train_loss: 1.1702, test_loss: 1.2301, test_f1: 0.3240
 epoch: 13, train_loss: 1.1678, test_loss: 1.2256, test_f1: 0.3291
 epoch: 14, train_loss: 1.1600, test_loss: 1.2176, test_f1: 0.3398
 epoch: 15, train_loss: 1.1477, test_loss: 1.2073, test_f1: 0.3661
 epoch: 16, train_loss: 1.1405, test_loss: 1.2001, test_f1: 0.3767
 epoch: 17, train_loss: 1.1260, test_loss: 1.1983, test_f1: 0.3918
 epoch: 18, train_loss: 1.1211, test_loss: 1.1911, test_f1: 0.4213
 epoch: 19, train_loss: 1.1151, test_loss: 1.1836, test_f1: 0.4223
 epoch: 20, train_loss: 1.0989, test_loss: 1.1763, test_f1: 0.4332
 epoch: 21, train_loss: 1.0985, test_loss: 1.1872, test_f1: 0.4484
 epoch: 22, train_loss: 1.0970, test_loss: 1.1949, test_f1: 0.4153
 epoch: 23, train_loss: 1.0851, test_loss: 1.1650, test_f1: 0.4621
 epoch: 24, train_loss: 1.0733, test_loss: 1.1638, test_f1: 0.4630
 epoch: 25, train_loss: 1.0680, test_loss: 1.1608, test_f1: 0.4604
 epoch: 26, train_loss: 1.0600, test_loss: 1.1697, test_f1: 0.4400
 epoch: 27, train_loss: 1.0480, test_loss: 1.1905, test_f1: 0.4496
 epoch: 28, train_loss: 1.0445, test_loss: 1.1992, test_f1: 0.4549
 epoch: 29, train_loss: 1.0234, test_loss: 1.2199, test_f1: 0.4753
 epoch: 30, train_loss: 1.0393, test_loss: 1.2195, test_f1: 0.4856
 epoch: 31, train_loss: 1.0077, test_loss: 1.2094, test_f1: 0.4880
 epoch: 32, train_loss: 1.0186, test_loss: 1.1993, test_f1: 0.4651
 epoch: 33, train_loss: 0.9986, test_loss: 1.1819, test_f1: 0.4560
 epoch: 34, train_loss: 0.9955, test_loss: 1.1732, test_f1: 0.4811
 epoch: 35, train_loss: 0.9908, test_loss: 1.1702, test_f1: 0.4205
 epoch: 36, train_loss: 0.9869, test_loss: 1.1878, test_f1: 0.4758
 epoch: 37, train_loss: 0.9726, test_loss: 1.1774, test_f1: 0.4901
 epoch: 38, train_loss: 0.9798, test_loss: 1.1836, test_f1: 0.5007
 epoch: 39, train_loss: 0.9821, test_loss: 1.1504, test_f1: 0.5018
 epoch: 40, train_loss: 0.9691, test_loss: 1.1506, test_f1: 0.5125
 epoch: 41, train_loss: 0.9666, test_loss: 1.1555, test_f1: 0.5071
 epoch: 42, train_loss: 0.9476, test_loss: 1.1661, test_f1: 0.4921
 epoch: 43, train_loss: 0.9623, test_loss: 1.1555, test_f1: 0.5180
 epoch: 44, train_loss: 0.9252, test_loss: 1.1572, test_f1: 0.5137
 epoch: 45, train_loss: 0.9330, test_loss: 1.1791, test_f1: 0.5025
 epoch: 46, train_loss: 0.9289, test_loss: 1.1694, test_f1: 0.5261
 epoch: 47, train_loss: 0.9184, test_loss: 1.2018, test_f1: 0.4958
 epoch: 48, train_loss: 0.9320, test_loss: 1.2174, test_f1: 0.4562
 epoch: 49, train_loss: 0.9161, test_loss: 1.1792, test_f1: 0.4744
 epoch: 50, train_loss: 0.9168, test_loss: 1.1817, test_f1: 0.4761
 epoch: 51, train_loss: 0.8971, test_loss: 1.1570, test_f1: 0.5299
 epoch: 52, train_loss: 0.8967, test_loss: 1.1551, test_f1: 0.5246
 epoch: 53, train_loss: 0.9015, test_loss: 1.1551, test_f1: 0.5211
 epoch: 54, train_loss: 0.8898, test_loss: 1.1740, test_f1: 0.4998
 epoch: 55, train_loss: 0.8926, test_loss: 1.1823, test_f1: 0.5063
 epoch: 56, train_loss: 0.8811, test_loss: 1.1803, test_f1: 0.5292
 epoch: 57, train_loss: 0.8798, test_loss: 1.1621, test_f1: 0.5284
 epoch: 58, train_loss: 0.8911, test_loss: 1.1851, test_f1: 0.5022
 epoch: 59, train_loss: 0.8720, test_loss: 1.1723, test_f1: 0.5461
 epoch: 60, train_loss: 0.8838, test_loss: 1.1678, test_f1: 0.5299
 epoch: 61, train_loss: 0.8655, test_loss: 1.1791, test_f1: 0.5258
 epoch: 62, train_loss: 0.8772, test_loss: 1.2214, test_f1: 0.5205
 epoch: 63, train_loss: 0.8685, test_loss: 1.1877, test_f1: 0.5173
 epoch: 64, train_loss: 0.8772, test_loss: 1.1937, test_f1: 0.5356
 epoch: 65, train_loss: 0.8603, test_loss: 1.1880, test_f1: 0.5074
 epoch: 66, train_loss: 0.8673, test_loss: 1.2142, test_f1: 0.5124
 epoch: 67, train_loss: 0.8811, test_loss: 1.2093, test_f1: 0.5277
 epoch: 68, train_loss: 0.8700, test_loss: 1.1828, test_f1: 0.5351
 epoch: 69, train_loss: 0.8522, test_loss: 1.1892, test_f1: 0.5338
 epoch: 70, train_loss: 0.8591, test_loss: 1.1972, test_f1: 0.5317
 epoch: 71, train_loss: 0.8558, test_loss: 1.2174, test_f1: 0.5102
 epoch: 72, train_loss: 0.8461, test_loss: 1.2641, test_f1: 0.5096
 epoch: 73, train_loss: 0.8508, test_loss: 1.2298, test_f1: 0.5282
 epoch: 74, train_loss: 0.8501, test_loss: 1.1862, test_f1: 0.5163
 epoch: 75, train_loss: 0.8479, test_loss: 1.1861, test_f1: 0.5243
 epoch: 76, train_loss: 0.8632, test_loss: 1.2265, test_f1: 0.5107
 epoch: 77, train_loss: 0.8541, test_loss: 1.2334, test_f1: 0.5015
 epoch: 78, train_loss: 0.8603, test_loss: 1.2221, test_f1: 0.5362
 epoch: 79, train_loss: 0.8490, test_loss: 1.2417, test_f1: 0.4910
 epoch: 80, train_loss: 0.8405, test_loss: 1.2291, test_f1: 0.4978
 epoch: 81, train_loss: 0.8375, test_loss: 1.2333, test_f1: 0.5075
 epoch: 82, train_loss: 0.8267, test_loss: 1.2659, test_f1: 0.4832
 epoch: 83, train_loss: 0.8496, test_loss: 1.2511, test_f1: 0.5190
 epoch: 84, train_loss: 0.8521, test_loss: 1.2930, test_f1: 0.5297
 epoch: 85, train_loss: 0.8343, test_loss: 1.2876, test_f1: 0.4973
 epoch: 86, train_loss: 0.8393, test_loss: 1.2480, test_f1: 0.5375
 epoch: 87, train_loss: 0.8345, test_loss: 1.2519, test_f1: 0.5535
 epoch: 88, train_loss: 0.8266, test_loss: 1.2623, test_f1: 0.5513
 epoch: 89, train_loss: 0.8167, test_loss: 1.2373, test_f1: 0.5388
 epoch: 90, train_loss: 0.8281, test_loss: 1.2472, test_f1: 0.5001
 epoch: 91, train_loss: 0.8220, test_loss: 1.2393, test_f1: 0.5300
 epoch: 92, train_loss: 0.8386, test_loss: 1.2430, test_f1: 0.5164
 epoch: 93, train_loss: 0.8257, test_loss: 1.2682, test_f1: 0.5343
 epoch: 94, train_loss: 0.8173, test_loss: 1.2709, test_f1: 0.5288
 epoch: 95, train_loss: 0.8014, test_loss: 1.3006, test_f1: 0.5246
 epoch: 96, train_loss: 0.8264, test_loss: 1.2599, test_f1: 0.5430
 epoch: 97, train_loss: 0.8209, test_loss: 1.2522, test_f1: 0.5369
 epoch: 98, train_loss: 0.8101, test_loss: 1.2627, test_f1: 0.5434
 epoch: 99, train_loss: 0.8210, test_loss: 1.2981, test_f1: 0.5202
##################ITERATION #2 ****************************************
 epoch: 0, train_loss: 1.3765, test_loss: 1.3617, test_f1: 0.2281
 epoch: 1, train_loss: 1.2852, test_loss: 1.3178, test_f1: 0.2281
 epoch: 2, train_loss: 1.2665, test_loss: 1.3002, test_f1: 0.2281
 epoch: 3, train_loss: 1.2449, test_loss: 1.2912, test_f1: 0.2281
 epoch: 4, train_loss: 1.2287, test_loss: 1.2814, test_f1: 0.2281
 epoch: 5, train_loss: 1.2184, test_loss: 1.2720, test_f1: 0.2281
 epoch: 6, train_loss: 1.2113, test_loss: 1.2661, test_f1: 0.2281
 epoch: 7, train_loss: 1.2034, test_loss: 1.2599, test_f1: 0.2293
 epoch: 8, train_loss: 1.1922, test_loss: 1.2573, test_f1: 0.2600
 epoch: 9, train_loss: 1.1888, test_loss: 1.2513, test_f1: 0.3077
 epoch: 10, train_loss: 1.1708, test_loss: 1.2377, test_f1: 0.3152
 epoch: 11, train_loss: 1.1590, test_loss: 1.2269, test_f1: 0.3512
 epoch: 12, train_loss: 1.1543, test_loss: 1.2282, test_f1: 0.3722
 epoch: 13, train_loss: 1.1451, test_loss: 1.2305, test_f1: 0.3784
 epoch: 14, train_loss: 1.1347, test_loss: 1.2323, test_f1: 0.4112
 epoch: 15, train_loss: 1.1351, test_loss: 1.2194, test_f1: 0.4027
 epoch: 16, train_loss: 1.1242, test_loss: 1.2192, test_f1: 0.3694
 epoch: 17, train_loss: 1.1186, test_loss: 1.2036, test_f1: 0.4063
 epoch: 18, train_loss: 1.1053, test_loss: 1.2008, test_f1: 0.4177
 epoch: 19, train_loss: 1.1078, test_loss: 1.2013, test_f1: 0.4217
 epoch: 20, train_loss: 1.0901, test_loss: 1.1998, test_f1: 0.4199
 epoch: 21, train_loss: 1.0871, test_loss: 1.2092, test_f1: 0.4055
 epoch: 22, train_loss: 1.0940, test_loss: 1.2072, test_f1: 0.3935
 epoch: 23, train_loss: 1.0741, test_loss: 1.2030, test_f1: 0.4174
 epoch: 24, train_loss: 1.0662, test_loss: 1.2168, test_f1: 0.3926
 epoch: 25, train_loss: 1.0544, test_loss: 1.1935, test_f1: 0.3887
 epoch: 26, train_loss: 1.0382, test_loss: 1.2050, test_f1: 0.4089
 epoch: 27, train_loss: 1.0525, test_loss: 1.1987, test_f1: 0.4075
 epoch: 28, train_loss: 1.0323, test_loss: 1.2265, test_f1: 0.4003
 epoch: 29, train_loss: 1.0258, test_loss: 1.2131, test_f1: 0.4326
 epoch: 30, train_loss: 1.0207, test_loss: 1.2022, test_f1: 0.4084
 epoch: 31, train_loss: 1.0185, test_loss: 1.1978, test_f1: 0.4047
 epoch: 32, train_loss: 1.0019, test_loss: 1.1986, test_f1: 0.4183
 epoch: 33, train_loss: 1.0010, test_loss: 1.2045, test_f1: 0.4565
 epoch: 34, train_loss: 0.9996, test_loss: 1.1997, test_f1: 0.4232
 epoch: 35, train_loss: 0.9943, test_loss: 1.1971, test_f1: 0.4591
 epoch: 36, train_loss: 0.9902, test_loss: 1.2146, test_f1: 0.4670
 epoch: 37, train_loss: 0.9850, test_loss: 1.2382, test_f1: 0.4451
 epoch: 38, train_loss: 0.9762, test_loss: 1.2028, test_f1: 0.4329
 epoch: 39, train_loss: 0.9751, test_loss: 1.2203, test_f1: 0.4133
 epoch: 40, train_loss: 0.9738, test_loss: 1.2203, test_f1: 0.4724
 epoch: 41, train_loss: 0.9642, test_loss: 1.2067, test_f1: 0.4649
 epoch: 42, train_loss: 0.9641, test_loss: 1.1882, test_f1: 0.4444
 epoch: 43, train_loss: 0.9682, test_loss: 1.2132, test_f1: 0.4730
 epoch: 44, train_loss: 0.9558, test_loss: 1.2395, test_f1: 0.4271
 epoch: 45, train_loss: 0.9515, test_loss: 1.2559, test_f1: 0.4457
 epoch: 46, train_loss: 0.9435, test_loss: 1.2258, test_f1: 0.4696
 epoch: 47, train_loss: 0.9526, test_loss: 1.2284, test_f1: 0.4453
 epoch: 48, train_loss: 0.9426, test_loss: 1.2423, test_f1: 0.4578
 epoch: 49, train_loss: 0.9250, test_loss: 1.2269, test_f1: 0.4311
 epoch: 50, train_loss: 0.9178, test_loss: 1.1913, test_f1: 0.4932
 epoch: 51, train_loss: 0.9356, test_loss: 1.2366, test_f1: 0.4662
 epoch: 52, train_loss: 0.9255, test_loss: 1.2276, test_f1: 0.4731
 epoch: 53, train_loss: 0.9089, test_loss: 1.2555, test_f1: 0.4697
 epoch: 54, train_loss: 0.9190, test_loss: 1.3101, test_f1: 0.4527
 epoch: 55, train_loss: 0.9089, test_loss: 1.2595, test_f1: 0.4523
 epoch: 56, train_loss: 0.9091, test_loss: 1.2419, test_f1: 0.4479
 epoch: 57, train_loss: 0.9145, test_loss: 1.2550, test_f1: 0.4789
 epoch: 58, train_loss: 0.9009, test_loss: 1.2499, test_f1: 0.4795
 epoch: 59, train_loss: 0.9007, test_loss: 1.2677, test_f1: 0.4478
 epoch: 60, train_loss: 0.9030, test_loss: 1.2612, test_f1: 0.4756
 epoch: 61, train_loss: 0.8914, test_loss: 1.2295, test_f1: 0.4590
 epoch: 62, train_loss: 0.8942, test_loss: 1.2505, test_f1: 0.4512
 epoch: 63, train_loss: 0.8881, test_loss: 1.2619, test_f1: 0.4709
 epoch: 64, train_loss: 0.8973, test_loss: 1.3217, test_f1: 0.4450
 epoch: 65, train_loss: 0.8885, test_loss: 1.2914, test_f1: 0.4554
 epoch: 66, train_loss: 0.8833, test_loss: 1.2286, test_f1: 0.4890
 epoch: 67, train_loss: 0.8898, test_loss: 1.2678, test_f1: 0.4988
 epoch: 68, train_loss: 0.8871, test_loss: 1.3231, test_f1: 0.4688
 epoch: 69, train_loss: 0.8824, test_loss: 1.3531, test_f1: 0.4690
 epoch: 70, train_loss: 0.8744, test_loss: 1.2789, test_f1: 0.4881
 epoch: 71, train_loss: 0.8670, test_loss: 1.3157, test_f1: 0.4901
 epoch: 72, train_loss: 0.8721, test_loss: 1.3213, test_f1: 0.4778
 epoch: 73, train_loss: 0.8753, test_loss: 1.3020, test_f1: 0.4776
 epoch: 74, train_loss: 0.8765, test_loss: 1.3027, test_f1: 0.5091
 epoch: 75, train_loss: 0.8521, test_loss: 1.2775, test_f1: 0.4857
 epoch: 76, train_loss: 0.8723, test_loss: 1.3100, test_f1: 0.4967
 epoch: 77, train_loss: 0.8701, test_loss: 1.3310, test_f1: 0.4939
 epoch: 78, train_loss: 0.8678, test_loss: 1.3531, test_f1: 0.4733
 epoch: 79, train_loss: 0.8588, test_loss: 1.3244, test_f1: 0.4984
 epoch: 80, train_loss: 0.8597, test_loss: 1.3661, test_f1: 0.5018
 epoch: 81, train_loss: 0.8545, test_loss: 1.3197, test_f1: 0.5112
 epoch: 82, train_loss: 0.8431, test_loss: 1.3715, test_f1: 0.4585
 epoch: 83, train_loss: 0.8501, test_loss: 1.3437, test_f1: 0.5055
 epoch: 84, train_loss: 0.8560, test_loss: 1.3476, test_f1: 0.4903
 epoch: 85, train_loss: 0.8522, test_loss: 1.3176, test_f1: 0.5309
 epoch: 86, train_loss: 0.8479, test_loss: 1.3231, test_f1: 0.4621
 epoch: 87, train_loss: 0.8638, test_loss: 1.3260, test_f1: 0.5247
 epoch: 88, train_loss: 0.8489, test_loss: 1.3340, test_f1: 0.5237
 epoch: 89, train_loss: 0.8459, test_loss: 1.3807, test_f1: 0.4768
 epoch: 90, train_loss: 0.8508, test_loss: 1.3305, test_f1: 0.5204
 epoch: 91, train_loss: 0.8431, test_loss: 1.2996, test_f1: 0.5283
 epoch: 92, train_loss: 0.8651, test_loss: 1.2774, test_f1: 0.5381
 epoch: 93, train_loss: 0.8406, test_loss: 1.3204, test_f1: 0.5056
 epoch: 94, train_loss: 0.8418, test_loss: 1.4166, test_f1: 0.5063
 epoch: 95, train_loss: 0.8412, test_loss: 1.3593, test_f1: 0.5212
 epoch: 96, train_loss: 0.8398, test_loss: 1.3542, test_f1: 0.5343
 epoch: 97, train_loss: 0.8407, test_loss: 1.3137, test_f1: 0.5013
 epoch: 98, train_loss: 0.8362, test_loss: 1.3347, test_f1: 0.5378
 epoch: 99, train_loss: 0.8179, test_loss: 1.3788, test_f1: 0.5110
##################ITERATION #3 ****************************************
 epoch: 0, train_loss: 1.3365, test_loss: 1.3556, test_f1: 0.2281
 epoch: 1, train_loss: 1.2492, test_loss: 1.3098, test_f1: 0.2281
 epoch: 2, train_loss: 1.2113, test_loss: 1.2799, test_f1: 0.2270
 epoch: 3, train_loss: 1.1982, test_loss: 1.2739, test_f1: 0.2672
 epoch: 4, train_loss: 1.1726, test_loss: 1.2616, test_f1: 0.3224
 epoch: 5, train_loss: 1.1513, test_loss: 1.2353, test_f1: 0.3364
 epoch: 6, train_loss: 1.1433, test_loss: 1.2360, test_f1: 0.3707
 epoch: 7, train_loss: 1.1212, test_loss: 1.2232, test_f1: 0.4109
 epoch: 8, train_loss: 1.1101, test_loss: 1.2242, test_f1: 0.4025
 epoch: 9, train_loss: 1.0871, test_loss: 1.1938, test_f1: 0.3989
 epoch: 10, train_loss: 1.0919, test_loss: 1.1924, test_f1: 0.4276
 epoch: 11, train_loss: 1.0687, test_loss: 1.1986, test_f1: 0.4203
 epoch: 12, train_loss: 1.0563, test_loss: 1.2100, test_f1: 0.4317
 epoch: 13, train_loss: 1.0582, test_loss: 1.1991, test_f1: 0.4233
 epoch: 14, train_loss: 1.0472, test_loss: 1.1992, test_f1: 0.4239
 epoch: 15, train_loss: 1.0304, test_loss: 1.2139, test_f1: 0.4356
 epoch: 16, train_loss: 1.0437, test_loss: 1.2230, test_f1: 0.4441
 epoch: 17, train_loss: 1.0180, test_loss: 1.2245, test_f1: 0.4823
 epoch: 18, train_loss: 1.0216, test_loss: 1.2506, test_f1: 0.4547
 epoch: 19, train_loss: 1.0078, test_loss: 1.2504, test_f1: 0.4631
 epoch: 20, train_loss: 1.0163, test_loss: 1.2231, test_f1: 0.4625
 epoch: 21, train_loss: 0.9986, test_loss: 1.2077, test_f1: 0.4803
 epoch: 22, train_loss: 1.0003, test_loss: 1.2197, test_f1: 0.4484
 epoch: 23, train_loss: 0.9958, test_loss: 1.2174, test_f1: 0.5160
 epoch: 24, train_loss: 0.9854, test_loss: 1.1938, test_f1: 0.4847
 epoch: 25, train_loss: 0.9766, test_loss: 1.2429, test_f1: 0.4826
 epoch: 26, train_loss: 0.9672, test_loss: 1.2191, test_f1: 0.4988
 epoch: 27, train_loss: 0.9584, test_loss: 1.1887, test_f1: 0.5194
 epoch: 28, train_loss: 0.9687, test_loss: 1.2170, test_f1: 0.5114
 epoch: 29, train_loss: 0.9615, test_loss: 1.2105, test_f1: 0.5203
 epoch: 30, train_loss: 0.9504, test_loss: 1.2174, test_f1: 0.5114
 epoch: 31, train_loss: 0.9464, test_loss: 1.2114, test_f1: 0.5178
 epoch: 32, train_loss: 0.9420, test_loss: 1.2314, test_f1: 0.5072
 epoch: 33, train_loss: 0.9359, test_loss: 1.2373, test_f1: 0.5030
 epoch: 34, train_loss: 0.9409, test_loss: 1.2546, test_f1: 0.5168
 epoch: 35, train_loss: 0.9137, test_loss: 1.2527, test_f1: 0.5148
 epoch: 36, train_loss: 0.9217, test_loss: 1.2471, test_f1: 0.5376
 epoch: 37, train_loss: 0.9425, test_loss: 1.2374, test_f1: 0.5305
 epoch: 38, train_loss: 0.9269, test_loss: 1.2596, test_f1: 0.5327
 epoch: 39, train_loss: 0.9041, test_loss: 1.2668, test_f1: 0.5003
 epoch: 40, train_loss: 0.9187, test_loss: 1.2625, test_f1: 0.5173
 epoch: 41, train_loss: 0.9153, test_loss: 1.2516, test_f1: 0.5181
 epoch: 42, train_loss: 0.9283, test_loss: 1.2539, test_f1: 0.4979
 epoch: 43, train_loss: 0.8951, test_loss: 1.2585, test_f1: 0.5041
 epoch: 44, train_loss: 0.8916, test_loss: 1.2506, test_f1: 0.5184
 epoch: 45, train_loss: 0.8955, test_loss: 1.2465, test_f1: 0.5503
 epoch: 46, train_loss: 0.9095, test_loss: 1.2743, test_f1: 0.5486
 epoch: 47, train_loss: 0.8733, test_loss: 1.2666, test_f1: 0.5139
 epoch: 48, train_loss: 0.8697, test_loss: 1.3114, test_f1: 0.5027
 epoch: 49, train_loss: 0.8841, test_loss: 1.2984, test_f1: 0.5056
 epoch: 50, train_loss: 0.8566, test_loss: 1.2903, test_f1: 0.5211
 epoch: 51, train_loss: 0.8592, test_loss: 1.3125, test_f1: 0.5130
 epoch: 52, train_loss: 0.8593, test_loss: 1.3103, test_f1: 0.5019
 epoch: 53, train_loss: 0.8531, test_loss: 1.2954, test_f1: 0.5072
 epoch: 54, train_loss: 0.8464, test_loss: 1.2932, test_f1: 0.5154
 epoch: 55, train_loss: 0.8608, test_loss: 1.2717, test_f1: 0.5310
 epoch: 56, train_loss: 0.8567, test_loss: 1.2539, test_f1: 0.5231
 epoch: 57, train_loss: 0.8637, test_loss: 1.2723, test_f1: 0.5322
 epoch: 58, train_loss: 0.8529, test_loss: 1.2843, test_f1: 0.5214
 epoch: 59, train_loss: 0.8531, test_loss: 1.2945, test_f1: 0.4920
 epoch: 60, train_loss: 0.8491, test_loss: 1.2878, test_f1: 0.4954
 epoch: 61, train_loss: 0.8454, test_loss: 1.2718, test_f1: 0.5380
 epoch: 62, train_loss: 0.8551, test_loss: 1.2692, test_f1: 0.5360
 epoch: 63, train_loss: 0.8254, test_loss: 1.2763, test_f1: 0.5432
 epoch: 64, train_loss: 0.8477, test_loss: 1.2823, test_f1: 0.5528
 epoch: 65, train_loss: 0.8381, test_loss: 1.2884, test_f1: 0.5337
 epoch: 66, train_loss: 0.8490, test_loss: 1.2825, test_f1: 0.5203
 epoch: 67, train_loss: 0.8280, test_loss: 1.3192, test_f1: 0.5232
 epoch: 68, train_loss: 0.8346, test_loss: 1.3335, test_f1: 0.5070
 epoch: 69, train_loss: 0.8271, test_loss: 1.2973, test_f1: 0.5207
 epoch: 70, train_loss: 0.8310, test_loss: 1.2878, test_f1: 0.5122
 epoch: 71, train_loss: 0.8497, test_loss: 1.2975, test_f1: 0.5095
 epoch: 72, train_loss: 0.8261, test_loss: 1.2995, test_f1: 0.5196
 epoch: 73, train_loss: 0.8395, test_loss: 1.2959, test_f1: 0.5239
 epoch: 74, train_loss: 0.8390, test_loss: 1.2932, test_f1: 0.5158
 epoch: 75, train_loss: 0.8310, test_loss: 1.3121, test_f1: 0.5302
 epoch: 76, train_loss: 0.8169, test_loss: 1.3074, test_f1: 0.5251
 epoch: 77, train_loss: 0.8171, test_loss: 1.3052, test_f1: 0.5032
 epoch: 78, train_loss: 0.8078, test_loss: 1.3073, test_f1: 0.5059
 epoch: 79, train_loss: 0.8095, test_loss: 1.2972, test_f1: 0.5119
 epoch: 80, train_loss: 0.8177, test_loss: 1.3068, test_f1: 0.4859
 epoch: 81, train_loss: 0.8229, test_loss: 1.3418, test_f1: 0.4862
 epoch: 82, train_loss: 0.7958, test_loss: 1.3225, test_f1: 0.5062
 epoch: 83, train_loss: 0.8144, test_loss: 1.3174, test_f1: 0.5278
 epoch: 84, train_loss: 0.8046, test_loss: 1.3354, test_f1: 0.5088
 epoch: 85, train_loss: 0.8042, test_loss: 1.3228, test_f1: 0.5141
 epoch: 86, train_loss: 0.7960, test_loss: 1.3122, test_f1: 0.5200
 epoch: 87, train_loss: 0.8289, test_loss: 1.3025, test_f1: 0.4983
 epoch: 88, train_loss: 0.8150, test_loss: 1.3235, test_f1: 0.4833
 epoch: 89, train_loss: 0.7934, test_loss: 1.3211, test_f1: 0.4896
 epoch: 90, train_loss: 0.7929, test_loss: 1.3269, test_f1: 0.5106
 epoch: 91, train_loss: 0.8067, test_loss: 1.3274, test_f1: 0.5084
 epoch: 92, train_loss: 0.7994, test_loss: 1.3456, test_f1: 0.5137
 epoch: 93, train_loss: 0.7988, test_loss: 1.3586, test_f1: 0.5063
 epoch: 94, train_loss: 0.8169, test_loss: 1.3703, test_f1: 0.4918
 epoch: 95, train_loss: 0.8073, test_loss: 1.3413, test_f1: 0.4917
 epoch: 96, train_loss: 0.8075, test_loss: 1.3524, test_f1: 0.4875
 epoch: 97, train_loss: 0.7920, test_loss: 1.3758, test_f1: 0.5038
 epoch: 98, train_loss: 0.8083, test_loss: 1.3403, test_f1: 0.5065
 epoch: 99, train_loss: 0.8041, test_loss: 1.3285, test_f1: 0.5355
##################ITERATION #4 ****************************************
 epoch: 0, train_loss: 1.3385, test_loss: 1.3663, test_f1: 0.2404
 epoch: 1, train_loss: 1.2396, test_loss: 1.4030, test_f1: 0.2404
 epoch: 2, train_loss: 1.2273, test_loss: 1.4324, test_f1: 0.2391
 epoch: 3, train_loss: 1.2113, test_loss: 1.4691, test_f1: 0.2628
 epoch: 4, train_loss: 1.1874, test_loss: 1.3983, test_f1: 0.2897
 epoch: 5, train_loss: 1.1883, test_loss: 1.3222, test_f1: 0.2922
 epoch: 6, train_loss: 1.1745, test_loss: 1.3120, test_f1: 0.3015
 epoch: 7, train_loss: 1.1624, test_loss: 1.3147, test_f1: 0.3200
 epoch: 8, train_loss: 1.1535, test_loss: 1.2939, test_f1: 0.3216
 epoch: 9, train_loss: 1.1522, test_loss: 1.2825, test_f1: 0.3687
 epoch: 10, train_loss: 1.1486, test_loss: 1.3215, test_f1: 0.3724
 epoch: 11, train_loss: 1.1268, test_loss: 1.3112, test_f1: 0.3809
 epoch: 12, train_loss: 1.1363, test_loss: 1.2855, test_f1: 0.3753
 epoch: 13, train_loss: 1.1243, test_loss: 1.2541, test_f1: 0.3982
 epoch: 14, train_loss: 1.1152, test_loss: 1.2415, test_f1: 0.4168
 epoch: 15, train_loss: 1.1131, test_loss: 1.2578, test_f1: 0.4051
 epoch: 16, train_loss: 1.1057, test_loss: 1.2505, test_f1: 0.4046
 epoch: 17, train_loss: 1.0885, test_loss: 1.2222, test_f1: 0.4010
 epoch: 18, train_loss: 1.0878, test_loss: 1.2067, test_f1: 0.3988
 epoch: 19, train_loss: 1.0678, test_loss: 1.2010, test_f1: 0.4377
 epoch: 20, train_loss: 1.0540, test_loss: 1.2006, test_f1: 0.4034
 epoch: 21, train_loss: 1.0534, test_loss: 1.1949, test_f1: 0.3955
 epoch: 22, train_loss: 1.0473, test_loss: 1.1666, test_f1: 0.4168
 epoch: 23, train_loss: 1.0416, test_loss: 1.1692, test_f1: 0.4366
 epoch: 24, train_loss: 1.0345, test_loss: 1.1497, test_f1: 0.4809
 epoch: 25, train_loss: 1.0176, test_loss: 1.1533, test_f1: 0.4785
 epoch: 26, train_loss: 1.0194, test_loss: 1.1664, test_f1: 0.5039
 epoch: 27, train_loss: 1.0142, test_loss: 1.1561, test_f1: 0.4820
 epoch: 28, train_loss: 1.0172, test_loss: 1.1829, test_f1: 0.4957
 epoch: 29, train_loss: 1.0119, test_loss: 1.2331, test_f1: 0.5165
 epoch: 30, train_loss: 0.9946, test_loss: 1.2571, test_f1: 0.4995
 epoch: 31, train_loss: 0.9875, test_loss: 1.2885, test_f1: 0.5034
 epoch: 32, train_loss: 0.9947, test_loss: 1.3008, test_f1: 0.5110
 epoch: 33, train_loss: 0.9744, test_loss: 1.3201, test_f1: 0.5403
 epoch: 34, train_loss: 0.9760, test_loss: 1.2883, test_f1: 0.5142
 epoch: 35, train_loss: 0.9685, test_loss: 1.3155, test_f1: 0.5062
 epoch: 36, train_loss: 0.9798, test_loss: 1.3382, test_f1: 0.5202
 epoch: 37, train_loss: 0.9499, test_loss: 1.3275, test_f1: 0.5326
 epoch: 38, train_loss: 0.9262, test_loss: 1.3374, test_f1: 0.5646
 epoch: 39, train_loss: 0.9359, test_loss: 1.2597, test_f1: 0.5490
 epoch: 40, train_loss: 0.9388, test_loss: 1.2294, test_f1: 0.5368
 epoch: 41, train_loss: 0.9286, test_loss: 1.2382, test_f1: 0.5576
 epoch: 42, train_loss: 0.9122, test_loss: 1.3230, test_f1: 0.5392
 epoch: 43, train_loss: 0.9234, test_loss: 1.2075, test_f1: 0.5333
 epoch: 44, train_loss: 0.8993, test_loss: 1.1476, test_f1: 0.5401
 epoch: 45, train_loss: 0.9117, test_loss: 1.1475, test_f1: 0.5538
 epoch: 46, train_loss: 0.9010, test_loss: 1.2461, test_f1: 0.5375
 epoch: 47, train_loss: 0.9104, test_loss: 1.2667, test_f1: 0.5471
 epoch: 48, train_loss: 0.8996, test_loss: 1.2855, test_f1: 0.4547
 epoch: 49, train_loss: 0.9083, test_loss: 1.2875, test_f1: 0.5265
 epoch: 50, train_loss: 0.8937, test_loss: 1.1669, test_f1: 0.5259
 epoch: 51, train_loss: 0.8687, test_loss: 1.1634, test_f1: 0.5347
 epoch: 52, train_loss: 0.8710, test_loss: 1.1121, test_f1: 0.5448
 epoch: 53, train_loss: 0.8782, test_loss: 1.0770, test_f1: 0.5384
 epoch: 54, train_loss: 0.8743, test_loss: 1.1007, test_f1: 0.5401
 epoch: 55, train_loss: 0.8673, test_loss: 1.1310, test_f1: 0.5303
 epoch: 56, train_loss: 0.8582, test_loss: 1.1171, test_f1: 0.5598
 epoch: 57, train_loss: 0.8765, test_loss: 1.1047, test_f1: 0.5698
 epoch: 58, train_loss: 0.8542, test_loss: 1.0988, test_f1: 0.5648
 epoch: 59, train_loss: 0.8639, test_loss: 1.0879, test_f1: 0.5630
 epoch: 60, train_loss: 0.8522, test_loss: 1.0880, test_f1: 0.5830
 epoch: 61, train_loss: 0.8523, test_loss: 1.1133, test_f1: 0.5740
 epoch: 62, train_loss: 0.8581, test_loss: 1.1025, test_f1: 0.5690
 epoch: 63, train_loss: 0.8460, test_loss: 1.0954, test_f1: 0.5546
 epoch: 64, train_loss: 0.8620, test_loss: 1.1597, test_f1: 0.5714
 epoch: 65, train_loss: 0.8427, test_loss: 1.1515, test_f1: 0.5642
 epoch: 66, train_loss: 0.8400, test_loss: 1.1530, test_f1: 0.5556
 epoch: 67, train_loss: 0.8540, test_loss: 1.1423, test_f1: 0.5686
 epoch: 68, train_loss: 0.8440, test_loss: 1.2896, test_f1: 0.5625
 epoch: 69, train_loss: 0.8525, test_loss: 1.1754, test_f1: 0.5469
 epoch: 70, train_loss: 0.8446, test_loss: 1.1371, test_f1: 0.5528
 epoch: 71, train_loss: 0.8528, test_loss: 1.1318, test_f1: 0.5503
 epoch: 72, train_loss: 0.8280, test_loss: 1.1177, test_f1: 0.5493
 epoch: 73, train_loss: 0.8376, test_loss: 1.1062, test_f1: 0.5504
 epoch: 74, train_loss: 0.8336, test_loss: 1.0990, test_f1: 0.5542
 epoch: 75, train_loss: 0.8425, test_loss: 1.1378, test_f1: 0.5791
 epoch: 76, train_loss: 0.8321, test_loss: 1.0917, test_f1: 0.5858
 epoch: 77, train_loss: 0.8337, test_loss: 1.1317, test_f1: 0.5707
 epoch: 78, train_loss: 0.8245, test_loss: 1.1368, test_f1: 0.5623
 epoch: 79, train_loss: 0.8266, test_loss: 1.1037, test_f1: 0.5577
 epoch: 80, train_loss: 0.8095, test_loss: 1.0906, test_f1: 0.5621
 epoch: 81, train_loss: 0.8250, test_loss: 1.0947, test_f1: 0.5533
 epoch: 82, train_loss: 0.8281, test_loss: 1.0977, test_f1: 0.5565
 epoch: 83, train_loss: 0.8086, test_loss: 1.0852, test_f1: 0.5761
 epoch: 84, train_loss: 0.8098, test_loss: 1.0882, test_f1: 0.5848
 epoch: 85, train_loss: 0.8087, test_loss: 1.1047, test_f1: 0.5829
 epoch: 86, train_loss: 0.8018, test_loss: 1.1046, test_f1: 0.5779
 epoch: 87, train_loss: 0.8168, test_loss: 1.1093, test_f1: 0.5719
 epoch: 88, train_loss: 0.8206, test_loss: 1.1185, test_f1: 0.5631
 epoch: 89, train_loss: 0.8072, test_loss: 1.1138, test_f1: 0.6026
 epoch: 90, train_loss: 0.8091, test_loss: 1.1416, test_f1: 0.5612
 epoch: 91, train_loss: 0.8185, test_loss: 1.1505, test_f1: 0.5572
 epoch: 92, train_loss: 0.7960, test_loss: 1.1217, test_f1: 0.5582
 epoch: 93, train_loss: 0.8068, test_loss: 1.1591, test_f1: 0.5475
 epoch: 94, train_loss: 0.8094, test_loss: 1.1371, test_f1: 0.5844
 epoch: 95, train_loss: 0.8148, test_loss: 1.1476, test_f1: 0.5706
 epoch: 96, train_loss: 0.7980, test_loss: 1.1488, test_f1: 0.5523
 epoch: 97, train_loss: 0.7908, test_loss: 1.1502, test_f1: 0.5795
 epoch: 98, train_loss: 0.8065, test_loss: 1.1791, test_f1: 0.5419
 epoch: 99, train_loss: 0.8037, test_loss: 1.1548, test_f1: 0.5698
##################ITERATION #5 ****************************************
 epoch: 0, train_loss: 1.3105, test_loss: 1.3540, test_f1: 0.2281
 epoch: 1, train_loss: 1.2761, test_loss: 1.3377, test_f1: 0.2281
 epoch: 2, train_loss: 1.2564, test_loss: 1.3127, test_f1: 0.2270
 epoch: 3, train_loss: 1.2347, test_loss: 1.2930, test_f1: 0.2248
 epoch: 4, train_loss: 1.2256, test_loss: 1.2854, test_f1: 0.2231
 epoch: 5, train_loss: 1.2162, test_loss: 1.2695, test_f1: 0.2410
 epoch: 6, train_loss: 1.2135, test_loss: 1.2576, test_f1: 0.2253
 epoch: 7, train_loss: 1.2012, test_loss: 1.2481, test_f1: 0.2372
 epoch: 8, train_loss: 1.2008, test_loss: 1.2467, test_f1: 0.2678
 epoch: 9, train_loss: 1.1865, test_loss: 1.2547, test_f1: 0.2559
 epoch: 10, train_loss: 1.1800, test_loss: 1.2379, test_f1: 0.2890
 epoch: 11, train_loss: 1.1828, test_loss: 1.2319, test_f1: 0.2870
 epoch: 12, train_loss: 1.1762, test_loss: 1.2211, test_f1: 0.2946
 epoch: 13, train_loss: 1.1775, test_loss: 1.2330, test_f1: 0.3085
 epoch: 14, train_loss: 1.1604, test_loss: 1.2176, test_f1: 0.3107
 epoch: 15, train_loss: 1.1714, test_loss: 1.2170, test_f1: 0.3015
 epoch: 16, train_loss: 1.1578, test_loss: 1.2112, test_f1: 0.3403
 epoch: 17, train_loss: 1.1630, test_loss: 1.2148, test_f1: 0.3343
 epoch: 18, train_loss: 1.1540, test_loss: 1.2109, test_f1: 0.3510
 epoch: 19, train_loss: 1.1492, test_loss: 1.2256, test_f1: 0.3229
 epoch: 20, train_loss: 1.1555, test_loss: 1.2200, test_f1: 0.3032
 epoch: 21, train_loss: 1.1282, test_loss: 1.2477, test_f1: 0.3268
 epoch: 22, train_loss: 1.1365, test_loss: 1.2273, test_f1: 0.3273
 epoch: 23, train_loss: 1.1388, test_loss: 1.2404, test_f1: 0.3274
 epoch: 24, train_loss: 1.1359, test_loss: 1.2105, test_f1: 0.3613
 epoch: 25, train_loss: 1.1277, test_loss: 1.1912, test_f1: 0.3792
 epoch: 26, train_loss: 1.1123, test_loss: 1.2121, test_f1: 0.3670
 epoch: 27, train_loss: 1.1278, test_loss: 1.1938, test_f1: 0.3612
 epoch: 28, train_loss: 1.1004, test_loss: 1.1927, test_f1: 0.3709
 epoch: 29, train_loss: 1.1240, test_loss: 1.1793, test_f1: 0.3877
 epoch: 30, train_loss: 1.0984, test_loss: 1.1717, test_f1: 0.3560
 epoch: 31, train_loss: 1.1141, test_loss: 1.1743, test_f1: 0.3908
 epoch: 32, train_loss: 1.0915, test_loss: 1.1980, test_f1: 0.3927
 epoch: 33, train_loss: 1.0944, test_loss: 1.1846, test_f1: 0.3700
 epoch: 34, train_loss: 1.0900, test_loss: 1.1753, test_f1: 0.3762
 epoch: 35, train_loss: 1.0910, test_loss: 1.1655, test_f1: 0.3862
 epoch: 36, train_loss: 1.1009, test_loss: 1.1727, test_f1: 0.3751
 epoch: 37, train_loss: 1.0844, test_loss: 1.1825, test_f1: 0.3803
 epoch: 38, train_loss: 1.0669, test_loss: 1.1624, test_f1: 0.3910
 epoch: 39, train_loss: 1.0696, test_loss: 1.1796, test_f1: 0.3739
 epoch: 40, train_loss: 1.0631, test_loss: 1.1743, test_f1: 0.3800
 epoch: 41, train_loss: 1.0536, test_loss: 1.1607, test_f1: 0.3928
 epoch: 42, train_loss: 1.0429, test_loss: 1.1748, test_f1: 0.4036
 epoch: 43, train_loss: 1.0436, test_loss: 1.1934, test_f1: 0.4126
 epoch: 44, train_loss: 1.0384, test_loss: 1.2038, test_f1: 0.4244
 epoch: 45, train_loss: 1.0404, test_loss: 1.2032, test_f1: 0.4152
 epoch: 46, train_loss: 1.0275, test_loss: 1.1780, test_f1: 0.4073
 epoch: 47, train_loss: 1.0408, test_loss: 1.2230, test_f1: 0.4320
 epoch: 48, train_loss: 1.0111, test_loss: 1.2104, test_f1: 0.4180
 epoch: 49, train_loss: 1.0185, test_loss: 1.2299, test_f1: 0.4366
 epoch: 50, train_loss: 1.0142, test_loss: 1.1895, test_f1: 0.4104
 epoch: 51, train_loss: 1.0099, test_loss: 1.2205, test_f1: 0.4197
 epoch: 52, train_loss: 0.9891, test_loss: 1.3268, test_f1: 0.4153
 epoch: 53, train_loss: 0.9951, test_loss: 1.2988, test_f1: 0.4394
 epoch: 54, train_loss: 1.0025, test_loss: 1.2645, test_f1: 0.4380
 epoch: 55, train_loss: 0.9862, test_loss: 1.2994, test_f1: 0.4355
 epoch: 56, train_loss: 0.9868, test_loss: 1.2978, test_f1: 0.4466
 epoch: 57, train_loss: 0.9943, test_loss: 1.2802, test_f1: 0.4297
 epoch: 58, train_loss: 0.9892, test_loss: 1.2790, test_f1: 0.4441
 epoch: 59, train_loss: 0.9804, test_loss: 1.3032, test_f1: 0.4452
 epoch: 60, train_loss: 0.9734, test_loss: 1.3287, test_f1: 0.4555
 epoch: 61, train_loss: 0.9722, test_loss: 1.3523, test_f1: 0.4505
 epoch: 62, train_loss: 0.9738, test_loss: 1.3975, test_f1: 0.4510
 epoch: 63, train_loss: 0.9750, test_loss: 1.3940, test_f1: 0.4195
 epoch: 64, train_loss: 0.9687, test_loss: 1.3061, test_f1: 0.4480
 epoch: 65, train_loss: 0.9808, test_loss: 1.3033, test_f1: 0.4759
 epoch: 66, train_loss: 0.9747, test_loss: 1.4066, test_f1: 0.4625
 epoch: 67, train_loss: 0.9648, test_loss: 1.4061, test_f1: 0.4492
 epoch: 68, train_loss: 0.9651, test_loss: 1.3721, test_f1: 0.4666
 epoch: 69, train_loss: 0.9535, test_loss: 1.4010, test_f1: 0.4476
 epoch: 70, train_loss: 0.9649, test_loss: 1.3751, test_f1: 0.4460
 epoch: 71, train_loss: 0.9535, test_loss: 1.3213, test_f1: 0.4588
 epoch: 72, train_loss: 0.9501, test_loss: 1.3712, test_f1: 0.4576
 epoch: 73, train_loss: 0.9659, test_loss: 1.4029, test_f1: 0.4580
 epoch: 74, train_loss: 0.9473, test_loss: 1.4469, test_f1: 0.4494
 epoch: 75, train_loss: 0.9345, test_loss: 1.4104, test_f1: 0.4401
 epoch: 76, train_loss: 0.9357, test_loss: 1.4356, test_f1: 0.4402
 epoch: 77, train_loss: 0.9403, test_loss: 1.4127, test_f1: 0.4535
 epoch: 78, train_loss: 0.9274, test_loss: 1.4393, test_f1: 0.4379
 epoch: 79, train_loss: 0.9447, test_loss: 1.4903, test_f1: 0.4452
 epoch: 80, train_loss: 0.9444, test_loss: 1.4176, test_f1: 0.4604
 epoch: 81, train_loss: 0.9432, test_loss: 1.4921, test_f1: 0.4771
 epoch: 82, train_loss: 0.9483, test_loss: 1.4476, test_f1: 0.4845
 epoch: 83, train_loss: 0.9485, test_loss: 1.4643, test_f1: 0.4689
 epoch: 84, train_loss: 0.9444, test_loss: 1.4497, test_f1: 0.4711
 epoch: 85, train_loss: 0.9464, test_loss: 1.4548, test_f1: 0.4530
 epoch: 86, train_loss: 0.9435, test_loss: 1.5209, test_f1: 0.4830
 epoch: 87, train_loss: 0.9210, test_loss: 1.5123, test_f1: 0.4965
 epoch: 88, train_loss: 0.9078, test_loss: 1.5118, test_f1: 0.4449
 epoch: 89, train_loss: 0.9021, test_loss: 1.5261, test_f1: 0.4574
 epoch: 90, train_loss: 0.9242, test_loss: 1.4721, test_f1: 0.4658
 epoch: 91, train_loss: 0.9336, test_loss: 1.4889, test_f1: 0.4812
 epoch: 92, train_loss: 0.9161, test_loss: 1.5216, test_f1: 0.4785
 epoch: 93, train_loss: 0.9297, test_loss: 1.5127, test_f1: 0.5027
 epoch: 94, train_loss: 0.9157, test_loss: 1.4930, test_f1: 0.5077
 epoch: 95, train_loss: 0.9387, test_loss: 1.4927, test_f1: 0.4663
 epoch: 96, train_loss: 0.9323, test_loss: 1.7627, test_f1: 0.4535
 epoch: 97, train_loss: 0.9209, test_loss: 1.7642, test_f1: 0.4507
 epoch: 98, train_loss: 0.9133, test_loss: 1.6433, test_f1: 0.5110
 epoch: 99, train_loss: 0.9098, test_loss: 1.5534, test_f1: 0.5231
##################ITERATION #6 ****************************************
 epoch: 0, train_loss: 1.2899, test_loss: 1.3713, test_f1: 0.2354
 epoch: 1, train_loss: 1.2514, test_loss: 1.3638, test_f1: 0.2404
 epoch: 2, train_loss: 1.2429, test_loss: 1.3502, test_f1: 0.2341
 epoch: 3, train_loss: 1.2260, test_loss: 1.3647, test_f1: 0.2512
 epoch: 4, train_loss: 1.2139, test_loss: 1.3663, test_f1: 0.2639
 epoch: 5, train_loss: 1.2150, test_loss: 1.3621, test_f1: 0.2774
 epoch: 6, train_loss: 1.1930, test_loss: 1.3314, test_f1: 0.3094
 epoch: 7, train_loss: 1.1989, test_loss: 1.3121, test_f1: 0.2814
 epoch: 8, train_loss: 1.1887, test_loss: 1.3011, test_f1: 0.3078
 epoch: 9, train_loss: 1.1893, test_loss: 1.3060, test_f1: 0.3129
 epoch: 10, train_loss: 1.1737, test_loss: 1.3248, test_f1: 0.3073
 epoch: 11, train_loss: 1.1762, test_loss: 1.3136, test_f1: 0.3440
 epoch: 12, train_loss: 1.1648, test_loss: 1.2982, test_f1: 0.3596
 epoch: 13, train_loss: 1.1645, test_loss: 1.2837, test_f1: 0.3799
 epoch: 14, train_loss: 1.1560, test_loss: 1.2676, test_f1: 0.3787
 epoch: 15, train_loss: 1.1523, test_loss: 1.2684, test_f1: 0.3866
 epoch: 16, train_loss: 1.1378, test_loss: 1.2951, test_f1: 0.3894
 epoch: 17, train_loss: 1.1367, test_loss: 1.2819, test_f1: 0.3764
 epoch: 18, train_loss: 1.1398, test_loss: 1.2793, test_f1: 0.3885
 epoch: 19, train_loss: 1.1275, test_loss: 1.2572, test_f1: 0.4032
 epoch: 20, train_loss: 1.1360, test_loss: 1.2533, test_f1: 0.4065
 epoch: 21, train_loss: 1.1253, test_loss: 1.2817, test_f1: 0.3950
 epoch: 22, train_loss: 1.1185, test_loss: 1.3140, test_f1: 0.3860
 epoch: 23, train_loss: 1.1109, test_loss: 1.3097, test_f1: 0.3894
 epoch: 24, train_loss: 1.0998, test_loss: 1.3143, test_f1: 0.3844
 epoch: 25, train_loss: 1.1140, test_loss: 1.2881, test_f1: 0.3879
 epoch: 26, train_loss: 1.1028, test_loss: 1.2933, test_f1: 0.4017
 epoch: 27, train_loss: 1.1016, test_loss: 1.2970, test_f1: 0.3823
 epoch: 28, train_loss: 1.0999, test_loss: 1.2970, test_f1: 0.3769
 epoch: 29, train_loss: 1.0973, test_loss: 1.3059, test_f1: 0.3949
 epoch: 30, train_loss: 1.0803, test_loss: 1.2812, test_f1: 0.3926
 epoch: 31, train_loss: 1.0836, test_loss: 1.2787, test_f1: 0.3964
 epoch: 32, train_loss: 1.0861, test_loss: 1.2644, test_f1: 0.3824
 epoch: 33, train_loss: 1.0895, test_loss: 1.2902, test_f1: 0.3940
 epoch: 34, train_loss: 1.0764, test_loss: 1.3150, test_f1: 0.4075
 epoch: 35, train_loss: 1.0703, test_loss: 1.2770, test_f1: 0.4289
 epoch: 36, train_loss: 1.0674, test_loss: 1.2966, test_f1: 0.4219
 epoch: 37, train_loss: 1.0643, test_loss: 1.2822, test_f1: 0.4003
 epoch: 38, train_loss: 1.0585, test_loss: 1.2913, test_f1: 0.4253
 epoch: 39, train_loss: 1.0535, test_loss: 1.2837, test_f1: 0.4294
 epoch: 40, train_loss: 1.0474, test_loss: 1.3038, test_f1: 0.4109
 epoch: 41, train_loss: 1.0569, test_loss: 1.2881, test_f1: 0.4212
 epoch: 42, train_loss: 1.0402, test_loss: 1.2924, test_f1: 0.3993
 epoch: 43, train_loss: 1.0399, test_loss: 1.2795, test_f1: 0.4334
 epoch: 44, train_loss: 1.0448, test_loss: 1.3220, test_f1: 0.4290
 epoch: 45, train_loss: 1.0277, test_loss: 1.3421, test_f1: 0.4297
 epoch: 46, train_loss: 1.0225, test_loss: 1.3213, test_f1: 0.3928
 epoch: 47, train_loss: 1.0290, test_loss: 1.3238, test_f1: 0.4290
 epoch: 48, train_loss: 1.0289, test_loss: 1.3432, test_f1: 0.4334
 epoch: 49, train_loss: 1.0338, test_loss: 1.3551, test_f1: 0.4761
 epoch: 50, train_loss: 1.0239, test_loss: 1.3160, test_f1: 0.4676
 epoch: 51, train_loss: 0.9990, test_loss: 1.3139, test_f1: 0.4497
 epoch: 52, train_loss: 1.0036, test_loss: 1.3255, test_f1: 0.4936
 epoch: 53, train_loss: 1.0244, test_loss: 1.3236, test_f1: 0.4832
 epoch: 54, train_loss: 1.0104, test_loss: 1.3121, test_f1: 0.4457
 epoch: 55, train_loss: 1.0084, test_loss: 1.3168, test_f1: 0.4170
 epoch: 56, train_loss: 1.0036, test_loss: 1.3337, test_f1: 0.4342
 epoch: 57, train_loss: 1.0049, test_loss: 1.3309, test_f1: 0.4584
 epoch: 58, train_loss: 0.9915, test_loss: 1.3138, test_f1: 0.4536
 epoch: 59, train_loss: 0.9931, test_loss: 1.3144, test_f1: 0.4454
 epoch: 60, train_loss: 0.9973, test_loss: 1.3127, test_f1: 0.4770
 epoch: 61, train_loss: 0.9875, test_loss: 1.3096, test_f1: 0.5200
 epoch: 62, train_loss: 0.9902, test_loss: 1.3080, test_f1: 0.4654
 epoch: 63, train_loss: 0.9919, test_loss: 1.3287, test_f1: 0.4744
 epoch: 64, train_loss: 0.9772, test_loss: 1.3214, test_f1: 0.4791
 epoch: 65, train_loss: 0.9845, test_loss: 1.3121, test_f1: 0.5008
 epoch: 66, train_loss: 0.9711, test_loss: 1.3080, test_f1: 0.4949
 epoch: 67, train_loss: 0.9791, test_loss: 1.3298, test_f1: 0.4703
 epoch: 68, train_loss: 0.9861, test_loss: 1.3324, test_f1: 0.4754
 epoch: 69, train_loss: 0.9837, test_loss: 1.3187, test_f1: 0.4920
 epoch: 70, train_loss: 0.9675, test_loss: 1.3133, test_f1: 0.4658
 epoch: 71, train_loss: 0.9801, test_loss: 1.3255, test_f1: 0.4747
 epoch: 72, train_loss: 0.9682, test_loss: 1.3209, test_f1: 0.4888
 epoch: 73, train_loss: 0.9865, test_loss: 1.3020, test_f1: 0.4896
 epoch: 74, train_loss: 0.9726, test_loss: 1.3146, test_f1: 0.4797
 epoch: 75, train_loss: 0.9859, test_loss: 1.3232, test_f1: 0.4843
 epoch: 76, train_loss: 0.9700, test_loss: 1.3200, test_f1: 0.4686
 epoch: 77, train_loss: 0.9688, test_loss: 1.3273, test_f1: 0.5153
 epoch: 78, train_loss: 0.9713, test_loss: 1.3695, test_f1: 0.4954
 epoch: 79, train_loss: 0.9705, test_loss: 1.3523, test_f1: 0.4814
 epoch: 80, train_loss: 0.9572, test_loss: 1.3304, test_f1: 0.4912
 epoch: 81, train_loss: 0.9520, test_loss: 1.3437, test_f1: 0.4725
 epoch: 82, train_loss: 0.9449, test_loss: 1.3062, test_f1: 0.4915
 epoch: 83, train_loss: 0.9470, test_loss: 1.2961, test_f1: 0.5280
 epoch: 84, train_loss: 0.9546, test_loss: 1.2898, test_f1: 0.5190
 epoch: 85, train_loss: 0.9394, test_loss: 1.3203, test_f1: 0.5080
 epoch: 86, train_loss: 0.9416, test_loss: 1.3089, test_f1: 0.4920
 epoch: 87, train_loss: 0.9526, test_loss: 1.2912, test_f1: 0.4981
 epoch: 88, train_loss: 0.9503, test_loss: 1.3250, test_f1: 0.4883
 epoch: 89, train_loss: 0.9469, test_loss: 1.3182, test_f1: 0.5263
 epoch: 90, train_loss: 0.9460, test_loss: 1.3596, test_f1: 0.4998
 epoch: 91, train_loss: 0.9366, test_loss: 1.3403, test_f1: 0.5403
 epoch: 92, train_loss: 0.9458, test_loss: 1.3286, test_f1: 0.5206
 epoch: 93, train_loss: 0.9412, test_loss: 1.3320, test_f1: 0.5028
 epoch: 94, train_loss: 0.9443, test_loss: 1.3622, test_f1: 0.5163
 epoch: 95, train_loss: 0.9264, test_loss: 1.3299, test_f1: 0.4894
 epoch: 96, train_loss: 0.9335, test_loss: 1.3261, test_f1: 0.5123
 epoch: 97, train_loss: 0.9424, test_loss: 1.3476, test_f1: 0.5381
 epoch: 98, train_loss: 0.9339, test_loss: 1.3046, test_f1: 0.5303
 epoch: 99, train_loss: 0.9139, test_loss: 1.2840, test_f1: 0.5283
##################ITERATION #7 ****************************************
 epoch: 0, train_loss: 1.2991, test_loss: 1.3156, test_f1: 0.2281
 epoch: 1, train_loss: 1.2274, test_loss: 1.2928, test_f1: 0.2281
 epoch: 2, train_loss: 1.2102, test_loss: 1.2572, test_f1: 0.2424
 epoch: 3, train_loss: 1.2065, test_loss: 1.2657, test_f1: 0.3340
 epoch: 4, train_loss: 1.1861, test_loss: 1.2685, test_f1: 0.2904
 epoch: 5, train_loss: 1.1583, test_loss: 1.2429, test_f1: 0.3395
 epoch: 6, train_loss: 1.1637, test_loss: 1.2483, test_f1: 0.3311
 epoch: 7, train_loss: 1.1523, test_loss: 1.2456, test_f1: 0.3379
 epoch: 8, train_loss: 1.1604, test_loss: 1.2370, test_f1: 0.3307
 epoch: 9, train_loss: 1.1415, test_loss: 1.2583, test_f1: 0.3370
 epoch: 10, train_loss: 1.1361, test_loss: 1.2488, test_f1: 0.3491
 epoch: 11, train_loss: 1.1225, test_loss: 1.2142, test_f1: 0.3644
 epoch: 12, train_loss: 1.1308, test_loss: 1.2171, test_f1: 0.3956
 epoch: 13, train_loss: 1.1049, test_loss: 1.2428, test_f1: 0.3727
 epoch: 14, train_loss: 1.0963, test_loss: 1.2449, test_f1: 0.3735
 epoch: 15, train_loss: 1.1098, test_loss: 1.2331, test_f1: 0.3904
 epoch: 16, train_loss: 1.0973, test_loss: 1.2353, test_f1: 0.3803
 epoch: 17, train_loss: 1.0828, test_loss: 1.2075, test_f1: 0.3675
 epoch: 18, train_loss: 1.0888, test_loss: 1.2215, test_f1: 0.3809
 epoch: 19, train_loss: 1.0826, test_loss: 1.2047, test_f1: 0.4228
 epoch: 20, train_loss: 1.0898, test_loss: 1.2301, test_f1: 0.3933
 epoch: 21, train_loss: 1.0671, test_loss: 1.2176, test_f1: 0.3665
 epoch: 22, train_loss: 1.0767, test_loss: 1.2283, test_f1: 0.4277
 epoch: 23, train_loss: 1.0635, test_loss: 1.2167, test_f1: 0.4184
 epoch: 24, train_loss: 1.0437, test_loss: 1.2133, test_f1: 0.4091
 epoch: 25, train_loss: 1.0396, test_loss: 1.2177, test_f1: 0.4432
 epoch: 26, train_loss: 1.0497, test_loss: 1.2196, test_f1: 0.4120
 epoch: 27, train_loss: 1.0546, test_loss: 1.2200, test_f1: 0.3771
 epoch: 28, train_loss: 1.0402, test_loss: 1.1935, test_f1: 0.4187
 epoch: 29, train_loss: 1.0250, test_loss: 1.2137, test_f1: 0.4461
 epoch: 30, train_loss: 1.0112, test_loss: 1.2152, test_f1: 0.4635
 epoch: 31, train_loss: 1.0104, test_loss: 1.2384, test_f1: 0.4942
 epoch: 32, train_loss: 1.0062, test_loss: 1.2281, test_f1: 0.4723
 epoch: 33, train_loss: 1.0110, test_loss: 1.2205, test_f1: 0.4346
 epoch: 34, train_loss: 0.9978, test_loss: 1.1874, test_f1: 0.4898
 epoch: 35, train_loss: 1.0089, test_loss: 1.1841, test_f1: 0.4480
 epoch: 36, train_loss: 0.9853, test_loss: 1.2136, test_f1: 0.4145
 epoch: 37, train_loss: 1.0053, test_loss: 1.2102, test_f1: 0.4738
 epoch: 38, train_loss: 0.9787, test_loss: 1.1862, test_f1: 0.4718
 epoch: 39, train_loss: 0.9755, test_loss: 1.1876, test_f1: 0.4950
 epoch: 40, train_loss: 0.9752, test_loss: 1.2061, test_f1: 0.5015
 epoch: 41, train_loss: 0.9896, test_loss: 1.2433, test_f1: 0.4865
 epoch: 42, train_loss: 0.9825, test_loss: 1.2089, test_f1: 0.4307
 epoch: 43, train_loss: 0.9594, test_loss: 1.2157, test_f1: 0.4671
 epoch: 44, train_loss: 0.9804, test_loss: 1.2130, test_f1: 0.4752
 epoch: 45, train_loss: 0.9513, test_loss: 1.2228, test_f1: 0.4899
 epoch: 46, train_loss: 0.9567, test_loss: 1.2054, test_f1: 0.4719
 epoch: 47, train_loss: 0.9492, test_loss: 1.1997, test_f1: 0.5143
 epoch: 48, train_loss: 0.9514, test_loss: 1.2092, test_f1: 0.4773
 epoch: 49, train_loss: 0.9561, test_loss: 1.1861, test_f1: 0.4943
 epoch: 50, train_loss: 0.9386, test_loss: 1.2341, test_f1: 0.4714
 epoch: 51, train_loss: 0.9449, test_loss: 1.2268, test_f1: 0.4562
 epoch: 52, train_loss: 0.9204, test_loss: 1.2062, test_f1: 0.5040
 epoch: 53, train_loss: 0.9343, test_loss: 1.1784, test_f1: 0.5064
 epoch: 54, train_loss: 0.9184, test_loss: 1.1626, test_f1: 0.4723
 epoch: 55, train_loss: 0.9258, test_loss: 1.1958, test_f1: 0.4978
 epoch: 56, train_loss: 0.9075, test_loss: 1.1925, test_f1: 0.4939
 epoch: 57, train_loss: 0.9086, test_loss: 1.1774, test_f1: 0.5192
 epoch: 58, train_loss: 0.9082, test_loss: 1.1770, test_f1: 0.5110
 epoch: 59, train_loss: 0.9364, test_loss: 1.1689, test_f1: 0.5074
 epoch: 60, train_loss: 0.9110, test_loss: 1.1874, test_f1: 0.4799
 epoch: 61, train_loss: 0.9126, test_loss: 1.1767, test_f1: 0.5230
 epoch: 62, train_loss: 0.9176, test_loss: 1.1807, test_f1: 0.5114
 epoch: 63, train_loss: 0.8949, test_loss: 1.2294, test_f1: 0.5021
 epoch: 64, train_loss: 0.9067, test_loss: 1.1663, test_f1: 0.5044
 epoch: 65, train_loss: 0.9017, test_loss: 1.1861, test_f1: 0.4863
 epoch: 66, train_loss: 0.8954, test_loss: 1.1752, test_f1: 0.5058
 epoch: 67, train_loss: 0.8869, test_loss: 1.1810, test_f1: 0.5071
 epoch: 68, train_loss: 0.9015, test_loss: 1.1817, test_f1: 0.4695
 epoch: 69, train_loss: 0.8956, test_loss: 1.1761, test_f1: 0.4804
 epoch: 70, train_loss: 0.8909, test_loss: 1.1596, test_f1: 0.4938
 epoch: 71, train_loss: 0.8905, test_loss: 1.1639, test_f1: 0.5541
 epoch: 72, train_loss: 0.8872, test_loss: 1.1940, test_f1: 0.4627
 epoch: 73, train_loss: 0.8909, test_loss: 1.1871, test_f1: 0.5030
 epoch: 74, train_loss: 0.8657, test_loss: 1.1803, test_f1: 0.5417
 epoch: 75, train_loss: 0.8813, test_loss: 1.1560, test_f1: 0.5701
 epoch: 76, train_loss: 0.8718, test_loss: 1.1853, test_f1: 0.5115
 epoch: 77, train_loss: 0.8676, test_loss: 1.1834, test_f1: 0.5214
 epoch: 78, train_loss: 0.8799, test_loss: 1.1727, test_f1: 0.5419
 epoch: 79, train_loss: 0.8801, test_loss: 1.1500, test_f1: 0.5480
 epoch: 80, train_loss: 0.8745, test_loss: 1.1438, test_f1: 0.4850
 epoch: 81, train_loss: 0.8775, test_loss: 1.1811, test_f1: 0.5613
 epoch: 82, train_loss: 0.8665, test_loss: 1.1523, test_f1: 0.5764
 epoch: 83, train_loss: 0.8753, test_loss: 1.1405, test_f1: 0.5346
 epoch: 84, train_loss: 0.8628, test_loss: 1.1551, test_f1: 0.5221
 epoch: 85, train_loss: 0.8637, test_loss: 1.1729, test_f1: 0.4904
 epoch: 86, train_loss: 0.8606, test_loss: 1.1508, test_f1: 0.5113
 epoch: 87, train_loss: 0.8488, test_loss: 1.1699, test_f1: 0.5440
 epoch: 88, train_loss: 0.8699, test_loss: 1.1729, test_f1: 0.5413
 epoch: 89, train_loss: 0.8541, test_loss: 1.1587, test_f1: 0.5483
 epoch: 90, train_loss: 0.8841, test_loss: 1.1929, test_f1: 0.5413
 epoch: 91, train_loss: 0.8338, test_loss: 1.1743, test_f1: 0.5644
 epoch: 92, train_loss: 0.8696, test_loss: 1.1892, test_f1: 0.5023
 epoch: 93, train_loss: 0.8373, test_loss: 1.1845, test_f1: 0.5322
 epoch: 94, train_loss: 0.8733, test_loss: 1.1885, test_f1: 0.5416
 epoch: 95, train_loss: 0.8534, test_loss: 1.1764, test_f1: 0.5676
 epoch: 96, train_loss: 0.8514, test_loss: 1.1601, test_f1: 0.5404
 epoch: 97, train_loss: 0.8333, test_loss: 1.1840, test_f1: 0.5324
 epoch: 98, train_loss: 0.8546, test_loss: 1.2087, test_f1: 0.5592
 epoch: 99, train_loss: 0.8430, test_loss: 1.1989, test_f1: 0.5260
##################ITERATION #8 ****************************************
 epoch: 0, train_loss: 1.2990, test_loss: 1.3848, test_f1: 0.2354
 epoch: 1, train_loss: 1.2518, test_loss: 1.3750, test_f1: 0.2354
 epoch: 2, train_loss: 1.2244, test_loss: 1.3410, test_f1: 0.2643
 epoch: 3, train_loss: 1.2184, test_loss: 1.3416, test_f1: 0.2586
 epoch: 4, train_loss: 1.2010, test_loss: 1.3366, test_f1: 0.2622
 epoch: 5, train_loss: 1.1869, test_loss: 1.3375, test_f1: 0.2742
 epoch: 6, train_loss: 1.1830, test_loss: 1.3214, test_f1: 0.3041
 epoch: 7, train_loss: 1.1707, test_loss: 1.2463, test_f1: 0.3002
 epoch: 8, train_loss: 1.1541, test_loss: 1.2382, test_f1: 0.3054
 epoch: 9, train_loss: 1.1361, test_loss: 1.2349, test_f1: 0.3226
 epoch: 10, train_loss: 1.1261, test_loss: 1.2435, test_f1: 0.3874
 epoch: 11, train_loss: 1.1067, test_loss: 1.2211, test_f1: 0.4295
 epoch: 12, train_loss: 1.1167, test_loss: 1.2325, test_f1: 0.4103
 epoch: 13, train_loss: 1.1063, test_loss: 1.2156, test_f1: 0.4227
 epoch: 14, train_loss: 1.0818, test_loss: 1.2519, test_f1: 0.4611
 epoch: 15, train_loss: 1.0748, test_loss: 1.2362, test_f1: 0.4746
 epoch: 16, train_loss: 1.0762, test_loss: 1.2228, test_f1: 0.4780
 epoch: 17, train_loss: 1.0584, test_loss: 1.2420, test_f1: 0.5005
 epoch: 18, train_loss: 1.0504, test_loss: 1.2312, test_f1: 0.4773
 epoch: 19, train_loss: 1.0355, test_loss: 1.2335, test_f1: 0.4562
 epoch: 20, train_loss: 1.0310, test_loss: 1.1820, test_f1: 0.4886
 epoch: 21, train_loss: 1.0344, test_loss: 1.2034, test_f1: 0.5111
 epoch: 22, train_loss: 1.0177, test_loss: 1.1841, test_f1: 0.5290
 epoch: 23, train_loss: 1.0110, test_loss: 1.1968, test_f1: 0.5154
 epoch: 24, train_loss: 1.0025, test_loss: 1.2191, test_f1: 0.5128
 epoch: 25, train_loss: 0.9805, test_loss: 1.2162, test_f1: 0.5209
 epoch: 26, train_loss: 0.9797, test_loss: 1.1901, test_f1: 0.5336
 epoch: 27, train_loss: 0.9911, test_loss: 1.1741, test_f1: 0.5330
 epoch: 28, train_loss: 0.9855, test_loss: 1.1915, test_f1: 0.4929
 epoch: 29, train_loss: 0.9662, test_loss: 1.1521, test_f1: 0.5252
 epoch: 30, train_loss: 0.9608, test_loss: 1.2075, test_f1: 0.5038
 epoch: 31, train_loss: 0.9729, test_loss: 1.1710, test_f1: 0.5460
 epoch: 32, train_loss: 0.9494, test_loss: 1.2090, test_f1: 0.5251
 epoch: 33, train_loss: 0.9672, test_loss: 1.1656, test_f1: 0.5244
 epoch: 34, train_loss: 0.9404, test_loss: 1.1867, test_f1: 0.4974
 epoch: 35, train_loss: 0.9338, test_loss: 1.2075, test_f1: 0.5265
 epoch: 36, train_loss: 0.9408, test_loss: 1.2376, test_f1: 0.4676
 epoch: 37, train_loss: 0.9429, test_loss: 1.1605, test_f1: 0.5546
 epoch: 38, train_loss: 0.9396, test_loss: 1.1953, test_f1: 0.5315
 epoch: 39, train_loss: 0.9426, test_loss: 1.1870, test_f1: 0.4723
 epoch: 40, train_loss: 0.9430, test_loss: 1.1767, test_f1: 0.4917
 epoch: 41, train_loss: 0.9168, test_loss: 1.1387, test_f1: 0.5268
 epoch: 42, train_loss: 0.9153, test_loss: 1.1746, test_f1: 0.4969
 epoch: 43, train_loss: 0.9261, test_loss: 1.1369, test_f1: 0.5265
 epoch: 44, train_loss: 0.9026, test_loss: 1.1294, test_f1: 0.5253
 epoch: 45, train_loss: 0.9313, test_loss: 1.1616, test_f1: 0.5376
 epoch: 46, train_loss: 0.8969, test_loss: 1.1417, test_f1: 0.5530
 epoch: 47, train_loss: 0.9046, test_loss: 1.1367, test_f1: 0.5225
 epoch: 48, train_loss: 0.8979, test_loss: 1.1462, test_f1: 0.5268
 epoch: 49, train_loss: 0.8869, test_loss: 1.1438, test_f1: 0.5242
 epoch: 50, train_loss: 0.8855, test_loss: 1.2858, test_f1: 0.5003
 epoch: 51, train_loss: 0.8834, test_loss: 1.1528, test_f1: 0.5521
 epoch: 52, train_loss: 0.8704, test_loss: 1.1518, test_f1: 0.5329
 epoch: 53, train_loss: 0.8707, test_loss: 1.1945, test_f1: 0.5106
 epoch: 54, train_loss: 0.8679, test_loss: 1.1983, test_f1: 0.5379
 epoch: 55, train_loss: 0.8664, test_loss: 1.1797, test_f1: 0.5465
 epoch: 56, train_loss: 0.8672, test_loss: 1.1720, test_f1: 0.5348
 epoch: 57, train_loss: 0.8671, test_loss: 1.1972, test_f1: 0.5316
 epoch: 58, train_loss: 0.8563, test_loss: 1.1795, test_f1: 0.5073
 epoch: 59, train_loss: 0.8557, test_loss: 1.1758, test_f1: 0.5317
 epoch: 60, train_loss: 0.8606, test_loss: 1.1688, test_f1: 0.5483
 epoch: 61, train_loss: 0.8632, test_loss: 1.1956, test_f1: 0.5263
 epoch: 62, train_loss: 0.8554, test_loss: 1.1928, test_f1: 0.5329
 epoch: 63, train_loss: 0.8755, test_loss: 1.1998, test_f1: 0.5129
 epoch: 64, train_loss: 0.8556, test_loss: 1.1717, test_f1: 0.5404
 epoch: 65, train_loss: 0.8532, test_loss: 1.1840, test_f1: 0.5210
 epoch: 66, train_loss: 0.8400, test_loss: 1.1809, test_f1: 0.5243
 epoch: 67, train_loss: 0.8460, test_loss: 1.1995, test_f1: 0.5288
 epoch: 68, train_loss: 0.8503, test_loss: 1.1835, test_f1: 0.5315
 epoch: 69, train_loss: 0.8450, test_loss: 1.1963, test_f1: 0.5428
 epoch: 70, train_loss: 0.8352, test_loss: 1.1944, test_f1: 0.5157
 epoch: 71, train_loss: 0.8570, test_loss: 1.2014, test_f1: 0.5111
 epoch: 72, train_loss: 0.8536, test_loss: 1.1927, test_f1: 0.5390
 epoch: 73, train_loss: 0.8402, test_loss: 1.2066, test_f1: 0.5117
 epoch: 74, train_loss: 0.8310, test_loss: 1.2174, test_f1: 0.5263
 epoch: 75, train_loss: 0.8339, test_loss: 1.2144, test_f1: 0.5174
 epoch: 76, train_loss: 0.8595, test_loss: 1.2221, test_f1: 0.5236
 epoch: 77, train_loss: 0.8319, test_loss: 1.2037, test_f1: 0.5184
 epoch: 78, train_loss: 0.8164, test_loss: 1.2507, test_f1: 0.5120
 epoch: 79, train_loss: 0.8387, test_loss: 1.2493, test_f1: 0.5075
 epoch: 80, train_loss: 0.8305, test_loss: 1.2588, test_f1: 0.5170
 epoch: 81, train_loss: 0.8351, test_loss: 1.2965, test_f1: 0.5430
 epoch: 82, train_loss: 0.8172, test_loss: 1.2561, test_f1: 0.5432
 epoch: 83, train_loss: 0.8250, test_loss: 1.2053, test_f1: 0.5364
 epoch: 84, train_loss: 0.8335, test_loss: 1.2627, test_f1: 0.5344
 epoch: 85, train_loss: 0.8447, test_loss: 1.2280, test_f1: 0.5222
 epoch: 86, train_loss: 0.8100, test_loss: 1.3121, test_f1: 0.5277
 epoch: 87, train_loss: 0.8270, test_loss: 1.3545, test_f1: 0.5497
 epoch: 88, train_loss: 0.8239, test_loss: 1.3280, test_f1: 0.5383
 epoch: 89, train_loss: 0.8199, test_loss: 1.2436, test_f1: 0.5491
 epoch: 90, train_loss: 0.8181, test_loss: 1.2857, test_f1: 0.5381
 epoch: 91, train_loss: 0.7970, test_loss: 1.2576, test_f1: 0.5370
 epoch: 92, train_loss: 0.8163, test_loss: 1.3207, test_f1: 0.5458
 epoch: 93, train_loss: 0.8113, test_loss: 1.3068, test_f1: 0.5248
 epoch: 94, train_loss: 0.8230, test_loss: 1.2826, test_f1: 0.5439
 epoch: 95, train_loss: 0.8184, test_loss: 1.2570, test_f1: 0.5321
 epoch: 96, train_loss: 0.8020, test_loss: 1.2947, test_f1: 0.5078
 epoch: 97, train_loss: 0.8110, test_loss: 1.2895, test_f1: 0.5235
 epoch: 98, train_loss: 0.8117, test_loss: 1.3762, test_f1: 0.5351
 epoch: 99, train_loss: 0.8124, test_loss: 1.3134, test_f1: 0.5281
##################ITERATION #9 ****************************************
 epoch: 0, train_loss: 2.1336, test_loss: 1.6629, test_f1: 0.0523
 epoch: 1, train_loss: 1.4615, test_loss: 1.4401, test_f1: 0.2333
 epoch: 2, train_loss: 1.3622, test_loss: 1.4345, test_f1: 0.2675
 epoch: 3, train_loss: 1.3180, test_loss: 1.4443, test_f1: 0.2618
 epoch: 4, train_loss: 1.2735, test_loss: 1.3666, test_f1: 0.2687
 epoch: 5, train_loss: 1.2541, test_loss: 1.3414, test_f1: 0.2797
 epoch: 6, train_loss: 1.2385, test_loss: 1.3423, test_f1: 0.3139
 epoch: 7, train_loss: 1.2395, test_loss: 1.3464, test_f1: 0.3258
 epoch: 8, train_loss: 1.2279, test_loss: 1.3205, test_f1: 0.3353
 epoch: 9, train_loss: 1.2018, test_loss: 1.3098, test_f1: 0.3270
 epoch: 10, train_loss: 1.1857, test_loss: 1.3555, test_f1: 0.3319
 epoch: 11, train_loss: 1.1932, test_loss: 1.3119, test_f1: 0.3321
 epoch: 12, train_loss: 1.1742, test_loss: 1.3519, test_f1: 0.3307
 epoch: 13, train_loss: 1.1790, test_loss: 1.2976, test_f1: 0.3282
 epoch: 14, train_loss: 1.1546, test_loss: 1.2961, test_f1: 0.3297
 epoch: 15, train_loss: 1.1534, test_loss: 1.2474, test_f1: 0.3350
 epoch: 16, train_loss: 1.1335, test_loss: 1.2412, test_f1: 0.3548
 epoch: 17, train_loss: 1.1305, test_loss: 1.2309, test_f1: 0.3545
 epoch: 18, train_loss: 1.1152, test_loss: 1.2320, test_f1: 0.3632
 epoch: 19, train_loss: 1.1262, test_loss: 1.2452, test_f1: 0.4180
 epoch: 20, train_loss: 1.1131, test_loss: 1.2917, test_f1: 0.4043
 epoch: 21, train_loss: 1.0873, test_loss: 1.2103, test_f1: 0.4350
 epoch: 22, train_loss: 1.0841, test_loss: 1.2275, test_f1: 0.4448
 epoch: 23, train_loss: 1.0797, test_loss: 1.2286, test_f1: 0.4419
 epoch: 24, train_loss: 1.0730, test_loss: 1.2513, test_f1: 0.4550
 epoch: 25, train_loss: 1.0589, test_loss: 1.2428, test_f1: 0.4387
 epoch: 26, train_loss: 1.0637, test_loss: 1.1866, test_f1: 0.4482
 epoch: 27, train_loss: 1.0496, test_loss: 1.1863, test_f1: 0.4475
 epoch: 28, train_loss: 1.0512, test_loss: 1.2248, test_f1: 0.4531
 epoch: 29, train_loss: 1.0476, test_loss: 1.2112, test_f1: 0.4678
 epoch: 30, train_loss: 1.0500, test_loss: 1.1764, test_f1: 0.4822
 epoch: 31, train_loss: 1.0259, test_loss: 1.1671, test_f1: 0.4568
 epoch: 32, train_loss: 1.0424, test_loss: 1.1778, test_f1: 0.4584
 epoch: 33, train_loss: 1.0266, test_loss: 1.2035, test_f1: 0.4689
 epoch: 34, train_loss: 1.0210, test_loss: 1.1469, test_f1: 0.4844
 epoch: 35, train_loss: 1.0124, test_loss: 1.1421, test_f1: 0.4936
 epoch: 36, train_loss: 1.0102, test_loss: 1.1426, test_f1: 0.4873
 epoch: 37, train_loss: 1.0090, test_loss: 1.1589, test_f1: 0.4557
 epoch: 38, train_loss: 1.0037, test_loss: 1.1507, test_f1: 0.4696
 epoch: 39, train_loss: 0.9859, test_loss: 1.1559, test_f1: 0.4979
 epoch: 40, train_loss: 0.9993, test_loss: 1.1498, test_f1: 0.4886
 epoch: 41, train_loss: 0.9695, test_loss: 1.1599, test_f1: 0.4840
 epoch: 42, train_loss: 0.9764, test_loss: 1.1675, test_f1: 0.4524
 epoch: 43, train_loss: 0.9708, test_loss: 1.1809, test_f1: 0.4582
 epoch: 44, train_loss: 0.9641, test_loss: 1.1862, test_f1: 0.4729
 epoch: 45, train_loss: 0.9789, test_loss: 1.1535, test_f1: 0.4805
 epoch: 46, train_loss: 0.9716, test_loss: 1.1737, test_f1: 0.5119
 epoch: 47, train_loss: 0.9546, test_loss: 1.2131, test_f1: 0.4921
 epoch: 48, train_loss: 0.9462, test_loss: 1.1785, test_f1: 0.5105
 epoch: 49, train_loss: 0.9423, test_loss: 1.1883, test_f1: 0.4977
 epoch: 50, train_loss: 0.9357, test_loss: 1.1783, test_f1: 0.4649
 epoch: 51, train_loss: 0.9533, test_loss: 1.1804, test_f1: 0.4699
 epoch: 52, train_loss: 0.9525, test_loss: 1.1465, test_f1: 0.5080
 epoch: 53, train_loss: 0.9338, test_loss: 1.1546, test_f1: 0.5088
 epoch: 54, train_loss: 0.9472, test_loss: 1.1718, test_f1: 0.5267
 epoch: 55, train_loss: 0.9293, test_loss: 1.1827, test_f1: 0.4893
 epoch: 56, train_loss: 0.9366, test_loss: 1.2150, test_f1: 0.4688
 epoch: 57, train_loss: 0.9307, test_loss: 1.2117, test_f1: 0.4648
 epoch: 58, train_loss: 0.9190, test_loss: 1.2127, test_f1: 0.4920
 epoch: 59, train_loss: 0.9220, test_loss: 1.1744, test_f1: 0.5066
 epoch: 60, train_loss: 0.9122, test_loss: 1.2137, test_f1: 0.4937
 epoch: 61, train_loss: 0.9144, test_loss: 1.2061, test_f1: 0.4864
 epoch: 62, train_loss: 0.9128, test_loss: 1.1864, test_f1: 0.5053
 epoch: 63, train_loss: 0.9222, test_loss: 1.1916, test_f1: 0.4805
 epoch: 64, train_loss: 0.9153, test_loss: 1.1842, test_f1: 0.4940
 epoch: 65, train_loss: 0.8959, test_loss: 1.1681, test_f1: 0.5050
 epoch: 66, train_loss: 0.9339, test_loss: 1.1823, test_f1: 0.5114
 epoch: 67, train_loss: 0.9111, test_loss: 1.1713, test_f1: 0.4810
 epoch: 68, train_loss: 0.9098, test_loss: 1.1906, test_f1: 0.4803
 epoch: 69, train_loss: 0.9086, test_loss: 1.1541, test_f1: 0.4734
 epoch: 70, train_loss: 0.9141, test_loss: 1.1821, test_f1: 0.4865
 epoch: 71, train_loss: 0.9067, test_loss: 1.1687, test_f1: 0.5100
 epoch: 72, train_loss: 0.9054, test_loss: 1.2119, test_f1: 0.4911
 epoch: 73, train_loss: 0.9084, test_loss: 1.1681, test_f1: 0.4745
 epoch: 74, train_loss: 0.9061, test_loss: 1.1750, test_f1: 0.4798
 epoch: 75, train_loss: 0.8892, test_loss: 1.1780, test_f1: 0.4832
 epoch: 76, train_loss: 0.8898, test_loss: 1.1880, test_f1: 0.5169
 epoch: 77, train_loss: 0.8731, test_loss: 1.1658, test_f1: 0.4734
 epoch: 78, train_loss: 0.8780, test_loss: 1.1822, test_f1: 0.4809
 epoch: 79, train_loss: 0.8977, test_loss: 1.1600, test_f1: 0.4897
 epoch: 80, train_loss: 0.8831, test_loss: 1.1962, test_f1: 0.4836
 epoch: 81, train_loss: 0.8893, test_loss: 1.1899, test_f1: 0.5012
 epoch: 82, train_loss: 0.8887, test_loss: 1.1789, test_f1: 0.4821
 epoch: 83, train_loss: 0.8888, test_loss: 1.1816, test_f1: 0.4860
 epoch: 84, train_loss: 0.8770, test_loss: 1.1770, test_f1: 0.4874
 epoch: 85, train_loss: 0.8814, test_loss: 1.1750, test_f1: 0.5018
 epoch: 86, train_loss: 0.8683, test_loss: 1.1683, test_f1: 0.4990
 epoch: 87, train_loss: 0.8854, test_loss: 1.1597, test_f1: 0.4779
 epoch: 88, train_loss: 0.8788, test_loss: 1.1767, test_f1: 0.5025
 epoch: 89, train_loss: 0.8721, test_loss: 1.1938, test_f1: 0.4563
 epoch: 90, train_loss: 0.8935, test_loss: 1.1917, test_f1: 0.4743
 epoch: 91, train_loss: 0.8679, test_loss: 1.1959, test_f1: 0.4752
 epoch: 92, train_loss: 0.8788, test_loss: 1.2283, test_f1: 0.4815
 epoch: 93, train_loss: 0.8751, test_loss: 1.2094, test_f1: 0.4751
 epoch: 94, train_loss: 0.8577, test_loss: 1.1664, test_f1: 0.5054
 epoch: 95, train_loss: 0.8679, test_loss: 1.1672, test_f1: 0.5170
 epoch: 96, train_loss: 0.8496, test_loss: 1.1663, test_f1: 0.5130
 epoch: 97, train_loss: 0.8563, test_loss: 1.1806, test_f1: 0.5132
 epoch: 98, train_loss: 0.8604, test_loss: 1.1766, test_f1: 0.4992
 epoch: 99, train_loss: 0.8615, test_loss: 1.1751, test_f1: 0.5044

Training completed in 343.94 seconds
Best F1: 0.6026 at epoch 89
Mean F1 across iterations: 0.5462  0.0283
========================FINAL RESULTS================================
FEGIN weighted F1: 0.6026  0.0283
python main.py --data ltspice_demos --representation component_component --model FEGIN --layers 4 --hiddens 16 --batch_size 128 --lr 0.001 --emb_size 250 --epochs 100 --save_appendix component_component_L4_H16_BS128_LR0.001_E250 --no_val
-----



STDERR:
  File "main.py", line 370, in <module>
    main()
  File "main.py", line 254, in main
    dataset = dataset_class(
  File "/home/philip/projects/ltspice_examples_code_repo/Circuit-Completion-Using-GNNs/component_classification_with_link_prediction_head/evaluation/FEGIN/kernel/circuit_datasets.py", line 15, in __init__
    self.data, self.slices = torch.load(self.processed_paths[0])
  File "/home/philip/.local/lib/python3.8/site-packages/torch/serialization.py", line 1040, in load
    warnings.warn(
  File "/usr/lib/python3.8/warnings.py", line 109, in _showwarnmsg
    sw(msg.message, msg.category, msg.filename, msg.lineno,
  File "main.py", line 47, in warn_with_traceback
    traceback.print_stack(file=log)
/home/philip/projects/ltspice_examples_code_repo/Circuit-Completion-Using-GNNs/component_classification_with_link_prediction_head/evaluation/FEGIN/kernel/circuit_datasets.py:15: FutureWarning: You are using `torch.load` with `weights_only=False` (the current default value), which uses the default pickle module implicitly. It is possible to construct malicious pickle data which will execute arbitrary code during unpickling (See https://github.com/pytorch/pytorch/blob/main/SECURITY.md#untrusted-models for more details). In a future release, the default value for `weights_only` will be flipped to `True`. This limits the functions that could be executed during unpickling. Arbitrary objects will no longer be allowed to be loaded via this mode unless they are explicitly allowlisted by the user via `torch.serialization.add_safe_globals`. We recommend you start setting `weights_only=True` for any use case where you don't have full control of the loaded file. Please open an issue on GitHub for any issues related to this experimental feature.
  self.data, self.slices = torch.load(self.processed_paths[0])
