STDOUT:
Results will be saved in /home/philip/projects/llm_inference_code_repo/Circuit-Completion-Using-GNNs/component_classification_with_link_prediction_head/evaluation/FEGIN/results/model_FEGIN_dataset_ltspice_examples
Command line input: python main.py --data ltspice_examples --representation component_pin --model FEGIN --layers 3 --hiddens 16 --batch_size 64 --lr 0.001 --emb_size 250 --epochs 100 --save_appendix component_pin_L3_H16_BS64_LR0.001_E250 --no_val
 is saved.
-----
ltspice_examples - FEGIN
Using 3 layers, 16 hidden units, h = 2
Loading component_pin representation dataset
ENTERED
Training FEGIN on component_pin representation
Train: 3560, Test: 848
##################ITERATION #0 ****************************************
 epoch: 0, train_loss: 1.3422, test_loss: 1.3324, test_f1: 0.2260
 epoch: 1, train_loss: 1.3001, test_loss: 1.2681, test_f1: 0.2260
 epoch: 2, train_loss: 1.2310, test_loss: 1.1757, test_f1: 0.2260
 epoch: 3, train_loss: 1.1505, test_loss: 1.0787, test_f1: 0.3773
 epoch: 4, train_loss: 1.0657, test_loss: 1.0460, test_f1: 0.4619
 epoch: 5, train_loss: 1.0326, test_loss: 1.0351, test_f1: 0.4344
 epoch: 6, train_loss: 1.0199, test_loss: 1.0632, test_f1: 0.4824
 epoch: 7, train_loss: 1.0086, test_loss: 1.0209, test_f1: 0.4689
 epoch: 8, train_loss: 1.0232, test_loss: 1.1407, test_f1: 0.4080
 epoch: 9, train_loss: 1.0154, test_loss: 1.0206, test_f1: 0.4490
 epoch: 10, train_loss: 0.9993, test_loss: 1.0134, test_f1: 0.4640
 epoch: 11, train_loss: 0.9932, test_loss: 1.0307, test_f1: 0.4349
 epoch: 12, train_loss: 0.9795, test_loss: 1.0111, test_f1: 0.4611
 epoch: 13, train_loss: 0.9687, test_loss: 0.9856, test_f1: 0.4801
 epoch: 14, train_loss: 0.9730, test_loss: 0.9933, test_f1: 0.4885
 epoch: 15, train_loss: 0.9579, test_loss: 0.9832, test_f1: 0.4952
 epoch: 16, train_loss: 0.9520, test_loss: 0.9976, test_f1: 0.4772
 epoch: 17, train_loss: 0.9280, test_loss: 0.9949, test_f1: 0.4914
 epoch: 18, train_loss: 0.9284, test_loss: 0.9898, test_f1: 0.4810
 epoch: 19, train_loss: 0.9161, test_loss: 1.0152, test_f1: 0.4770
 epoch: 20, train_loss: 0.9194, test_loss: 0.9998, test_f1: 0.4971
 epoch: 21, train_loss: 0.9227, test_loss: 1.0451, test_f1: 0.4802
 epoch: 22, train_loss: 0.9105, test_loss: 1.0224, test_f1: 0.4720
 epoch: 23, train_loss: 0.8969, test_loss: 1.0112, test_f1: 0.5044
 epoch: 24, train_loss: 0.8935, test_loss: 0.9830, test_f1: 0.5093
 epoch: 25, train_loss: 0.8884, test_loss: 1.0136, test_f1: 0.4516
 epoch: 26, train_loss: 0.8849, test_loss: 1.0228, test_f1: 0.4749
 epoch: 27, train_loss: 0.8918, test_loss: 1.0054, test_f1: 0.4951
 epoch: 28, train_loss: 0.8816, test_loss: 1.0024, test_f1: 0.4961
 epoch: 29, train_loss: 0.8624, test_loss: 1.0317, test_f1: 0.4924
 epoch: 30, train_loss: 0.8700, test_loss: 0.9745, test_f1: 0.5051
 epoch: 31, train_loss: 0.8685, test_loss: 1.0116, test_f1: 0.4910
 epoch: 32, train_loss: 0.8588, test_loss: 1.0316, test_f1: 0.4870
 epoch: 33, train_loss: 0.8586, test_loss: 1.0628, test_f1: 0.4652
 epoch: 34, train_loss: 0.8535, test_loss: 0.9674, test_f1: 0.5132
 epoch: 35, train_loss: 0.8466, test_loss: 0.9986, test_f1: 0.5043
 epoch: 36, train_loss: 0.8434, test_loss: 1.0885, test_f1: 0.4395
 epoch: 37, train_loss: 0.8493, test_loss: 0.9817, test_f1: 0.5161
 epoch: 38, train_loss: 0.8445, test_loss: 0.9884, test_f1: 0.5002
 epoch: 39, train_loss: 0.8500, test_loss: 1.0170, test_f1: 0.4832
 epoch: 40, train_loss: 0.8362, test_loss: 0.9826, test_f1: 0.5023
 epoch: 41, train_loss: 0.8149, test_loss: 0.9708, test_f1: 0.5292
 epoch: 42, train_loss: 0.8186, test_loss: 1.0316, test_f1: 0.4854
 epoch: 43, train_loss: 0.8204, test_loss: 1.0134, test_f1: 0.4950
 epoch: 44, train_loss: 0.8333, test_loss: 0.9752, test_f1: 0.5247
 epoch: 45, train_loss: 0.8374, test_loss: 0.9391, test_f1: 0.5337
 epoch: 46, train_loss: 0.8370, test_loss: 0.9467, test_f1: 0.5166
 epoch: 47, train_loss: 0.8258, test_loss: 0.9945, test_f1: 0.4998
 epoch: 48, train_loss: 0.8260, test_loss: 0.9696, test_f1: 0.5145
 epoch: 49, train_loss: 0.8157, test_loss: 0.9915, test_f1: 0.5210
 epoch: 50, train_loss: 0.8084, test_loss: 0.9517, test_f1: 0.5153
 epoch: 51, train_loss: 0.7999, test_loss: 0.9707, test_f1: 0.5131
 epoch: 52, train_loss: 0.7898, test_loss: 0.9679, test_f1: 0.5128
 epoch: 53, train_loss: 0.7939, test_loss: 0.9780, test_f1: 0.5235
 epoch: 54, train_loss: 0.7907, test_loss: 0.9566, test_f1: 0.5278
 epoch: 55, train_loss: 0.7952, test_loss: 0.9938, test_f1: 0.4920
 epoch: 56, train_loss: 0.7899, test_loss: 0.9741, test_f1: 0.5187
 epoch: 57, train_loss: 0.7945, test_loss: 0.9589, test_f1: 0.5160
 epoch: 58, train_loss: 0.7931, test_loss: 0.9754, test_f1: 0.5053
 epoch: 59, train_loss: 0.7862, test_loss: 0.9790, test_f1: 0.5248
 epoch: 60, train_loss: 0.7782, test_loss: 0.9458, test_f1: 0.5287
 epoch: 61, train_loss: 0.7817, test_loss: 0.9944, test_f1: 0.5145
 epoch: 62, train_loss: 0.7887, test_loss: 0.9784, test_f1: 0.5242
 epoch: 63, train_loss: 0.7798, test_loss: 0.9880, test_f1: 0.4989
 epoch: 64, train_loss: 0.7869, test_loss: 0.9810, test_f1: 0.5106
 epoch: 65, train_loss: 0.7866, test_loss: 0.9812, test_f1: 0.5155
 epoch: 66, train_loss: 0.7754, test_loss: 0.9693, test_f1: 0.5145
 epoch: 67, train_loss: 0.7756, test_loss: 0.9922, test_f1: 0.5204
 epoch: 68, train_loss: 0.7682, test_loss: 0.9855, test_f1: 0.5150
 epoch: 69, train_loss: 0.7602, test_loss: 0.9928, test_f1: 0.5129
 epoch: 70, train_loss: 0.7615, test_loss: 0.9769, test_f1: 0.5126
 epoch: 71, train_loss: 0.7750, test_loss: 0.9688, test_f1: 0.4931
 epoch: 72, train_loss: 0.7667, test_loss: 0.9602, test_f1: 0.5265
 epoch: 73, train_loss: 0.7642, test_loss: 0.9579, test_f1: 0.5256
 epoch: 74, train_loss: 0.7716, test_loss: 0.9689, test_f1: 0.5064
 epoch: 75, train_loss: 0.7647, test_loss: 0.9592, test_f1: 0.5314
 epoch: 76, train_loss: 0.7583, test_loss: 0.9704, test_f1: 0.5115
 epoch: 77, train_loss: 0.7677, test_loss: 0.9757, test_f1: 0.5172
 epoch: 78, train_loss: 0.7702, test_loss: 0.9684, test_f1: 0.5352
 epoch: 79, train_loss: 0.7587, test_loss: 0.9779, test_f1: 0.5068
 epoch: 80, train_loss: 0.7669, test_loss: 1.0040, test_f1: 0.5025
 epoch: 81, train_loss: 0.7550, test_loss: 0.9843, test_f1: 0.5268
 epoch: 82, train_loss: 0.7576, test_loss: 0.9792, test_f1: 0.5121
 epoch: 83, train_loss: 0.7490, test_loss: 0.9799, test_f1: 0.5156
 epoch: 84, train_loss: 0.7672, test_loss: 0.9814, test_f1: 0.5229
 epoch: 85, train_loss: 0.7535, test_loss: 0.9619, test_f1: 0.5254
 epoch: 86, train_loss: 0.7529, test_loss: 0.9481, test_f1: 0.5369
 epoch: 87, train_loss: 0.7580, test_loss: 0.9494, test_f1: 0.5315
 epoch: 88, train_loss: 0.7607, test_loss: 0.9784, test_f1: 0.5059
 epoch: 89, train_loss: 0.7440, test_loss: 0.9523, test_f1: 0.5182
 epoch: 90, train_loss: 0.7515, test_loss: 0.9504, test_f1: 0.5160
 epoch: 91, train_loss: 0.7480, test_loss: 0.9456, test_f1: 0.5261
 epoch: 92, train_loss: 0.7550, test_loss: 0.9933, test_f1: 0.5226
 epoch: 93, train_loss: 0.7415, test_loss: 0.9770, test_f1: 0.5263
 epoch: 94, train_loss: 0.7416, test_loss: 0.9870, test_f1: 0.5324
 epoch: 95, train_loss: 0.7494, test_loss: 0.9525, test_f1: 0.5229
 epoch: 96, train_loss: 0.7483, test_loss: 0.9239, test_f1: 0.5281
 epoch: 97, train_loss: 0.7520, test_loss: 0.9628, test_f1: 0.5236
 epoch: 98, train_loss: 0.7374, test_loss: 0.9338, test_f1: 0.5348
 epoch: 99, train_loss: 0.7447, test_loss: 0.9451, test_f1: 0.5314
##################ITERATION #1 ****************************************
 epoch: 0, train_loss: 1.2681, test_loss: 1.2237, test_f1: 0.2260
 epoch: 1, train_loss: 1.1908, test_loss: 1.1553, test_f1: 0.3057
 epoch: 2, train_loss: 1.1229, test_loss: 1.0710, test_f1: 0.3503
 epoch: 3, train_loss: 1.0575, test_loss: 1.0587, test_f1: 0.3477
 epoch: 4, train_loss: 1.0334, test_loss: 1.1420, test_f1: 0.3400
 epoch: 5, train_loss: 1.0135, test_loss: 1.1309, test_f1: 0.3457
 epoch: 6, train_loss: 1.0066, test_loss: 0.9880, test_f1: 0.4167
 epoch: 7, train_loss: 1.0070, test_loss: 1.0240, test_f1: 0.3982
 epoch: 8, train_loss: 0.9914, test_loss: 1.0120, test_f1: 0.3902
 epoch: 9, train_loss: 0.9869, test_loss: 0.9744, test_f1: 0.4651
 epoch: 10, train_loss: 0.9810, test_loss: 0.9640, test_f1: 0.4208
 epoch: 11, train_loss: 0.9688, test_loss: 1.0431, test_f1: 0.4275
 epoch: 12, train_loss: 0.9665, test_loss: 1.0049, test_f1: 0.4268
 epoch: 13, train_loss: 0.9622, test_loss: 1.0369, test_f1: 0.4128
 epoch: 14, train_loss: 0.9590, test_loss: 0.9743, test_f1: 0.4738
 epoch: 15, train_loss: 0.9455, test_loss: 0.9815, test_f1: 0.4657
 epoch: 16, train_loss: 0.9299, test_loss: 0.9358, test_f1: 0.4820
 epoch: 17, train_loss: 0.9228, test_loss: 0.9666, test_f1: 0.4476
 epoch: 18, train_loss: 0.9228, test_loss: 0.9451, test_f1: 0.5132
 epoch: 19, train_loss: 0.9164, test_loss: 0.9414, test_f1: 0.4863
 epoch: 20, train_loss: 0.9172, test_loss: 0.9506, test_f1: 0.5061
 epoch: 21, train_loss: 0.8950, test_loss: 1.0233, test_f1: 0.4921
 epoch: 22, train_loss: 0.8937, test_loss: 0.9390, test_f1: 0.5138
 epoch: 23, train_loss: 0.8969, test_loss: 0.9337, test_f1: 0.5182
 epoch: 24, train_loss: 0.8979, test_loss: 0.9347, test_f1: 0.5296
 epoch: 25, train_loss: 0.8814, test_loss: 0.9744, test_f1: 0.4656
 epoch: 26, train_loss: 0.8835, test_loss: 0.9326, test_f1: 0.5263
 epoch: 27, train_loss: 0.8729, test_loss: 0.9787, test_f1: 0.4728
 epoch: 28, train_loss: 0.8712, test_loss: 0.9433, test_f1: 0.5056
 epoch: 29, train_loss: 0.8737, test_loss: 0.8965, test_f1: 0.5376
 epoch: 30, train_loss: 0.8561, test_loss: 0.9714, test_f1: 0.5197
 epoch: 31, train_loss: 0.8691, test_loss: 0.9603, test_f1: 0.4974
 epoch: 32, train_loss: 0.8600, test_loss: 0.9191, test_f1: 0.5077
 epoch: 33, train_loss: 0.8465, test_loss: 0.8963, test_f1: 0.5134
 epoch: 34, train_loss: 0.8511, test_loss: 0.8965, test_f1: 0.5383
 epoch: 35, train_loss: 0.8532, test_loss: 0.9119, test_f1: 0.5139
 epoch: 36, train_loss: 0.8552, test_loss: 1.0308, test_f1: 0.4743
 epoch: 37, train_loss: 0.8492, test_loss: 0.9613, test_f1: 0.5000
 epoch: 38, train_loss: 0.8419, test_loss: 0.8967, test_f1: 0.5090
 epoch: 39, train_loss: 0.8452, test_loss: 0.9102, test_f1: 0.5133
 epoch: 40, train_loss: 0.8431, test_loss: 0.8800, test_f1: 0.5249
 epoch: 41, train_loss: 0.8328, test_loss: 0.9100, test_f1: 0.5324
 epoch: 42, train_loss: 0.8269, test_loss: 0.8932, test_f1: 0.5266
 epoch: 43, train_loss: 0.8235, test_loss: 0.8987, test_f1: 0.5351
 epoch: 44, train_loss: 0.8210, test_loss: 0.9637, test_f1: 0.4923
 epoch: 45, train_loss: 0.8301, test_loss: 0.9036, test_f1: 0.5152
 epoch: 46, train_loss: 0.8198, test_loss: 0.9247, test_f1: 0.5040
 epoch: 47, train_loss: 0.8271, test_loss: 0.8915, test_f1: 0.5104
 epoch: 48, train_loss: 0.8174, test_loss: 0.9668, test_f1: 0.5015
 epoch: 49, train_loss: 0.8160, test_loss: 0.9075, test_f1: 0.4996
 epoch: 50, train_loss: 0.8121, test_loss: 0.8965, test_f1: 0.5194
 epoch: 51, train_loss: 0.8026, test_loss: 0.8749, test_f1: 0.5388
 epoch: 52, train_loss: 0.7891, test_loss: 0.8746, test_f1: 0.5437
 epoch: 53, train_loss: 0.7947, test_loss: 0.8690, test_f1: 0.5366
 epoch: 54, train_loss: 0.7932, test_loss: 0.8741, test_f1: 0.5365
 epoch: 55, train_loss: 0.7899, test_loss: 0.8618, test_f1: 0.5490
 epoch: 56, train_loss: 0.7903, test_loss: 0.8808, test_f1: 0.5398
 epoch: 57, train_loss: 0.7910, test_loss: 0.8522, test_f1: 0.5593
 epoch: 58, train_loss: 0.7832, test_loss: 0.8734, test_f1: 0.5404
 epoch: 59, train_loss: 0.7697, test_loss: 0.8791, test_f1: 0.5372
 epoch: 60, train_loss: 0.7806, test_loss: 0.8918, test_f1: 0.5487
 epoch: 61, train_loss: 0.7897, test_loss: 0.8800, test_f1: 0.5329
 epoch: 62, train_loss: 0.7850, test_loss: 0.8864, test_f1: 0.5438
 epoch: 63, train_loss: 0.7780, test_loss: 0.8728, test_f1: 0.5488
 epoch: 64, train_loss: 0.7759, test_loss: 0.8642, test_f1: 0.5521
 epoch: 65, train_loss: 0.7731, test_loss: 0.9092, test_f1: 0.5199
 epoch: 66, train_loss: 0.7788, test_loss: 0.9036, test_f1: 0.5551
 epoch: 67, train_loss: 0.7682, test_loss: 0.8945, test_f1: 0.5498
 epoch: 68, train_loss: 0.7759, test_loss: 0.8869, test_f1: 0.5307
 epoch: 69, train_loss: 0.7757, test_loss: 0.8818, test_f1: 0.5413
 epoch: 70, train_loss: 0.7675, test_loss: 0.9057, test_f1: 0.5291
 epoch: 71, train_loss: 0.7643, test_loss: 0.9017, test_f1: 0.5274
 epoch: 72, train_loss: 0.7736, test_loss: 0.8904, test_f1: 0.5299
 epoch: 73, train_loss: 0.7716, test_loss: 0.8980, test_f1: 0.5295
 epoch: 74, train_loss: 0.7670, test_loss: 0.8997, test_f1: 0.5378
 epoch: 75, train_loss: 0.7625, test_loss: 0.8902, test_f1: 0.5179
 epoch: 76, train_loss: 0.7680, test_loss: 0.8739, test_f1: 0.5240
 epoch: 77, train_loss: 0.7587, test_loss: 0.8679, test_f1: 0.5357
 epoch: 78, train_loss: 0.7565, test_loss: 0.8751, test_f1: 0.5428
 epoch: 79, train_loss: 0.7520, test_loss: 0.9158, test_f1: 0.5030
 epoch: 80, train_loss: 0.7621, test_loss: 0.9145, test_f1: 0.5108
 epoch: 81, train_loss: 0.7531, test_loss: 0.8625, test_f1: 0.5560
 epoch: 82, train_loss: 0.7502, test_loss: 0.8620, test_f1: 0.5496
 epoch: 83, train_loss: 0.7449, test_loss: 0.8991, test_f1: 0.5189
 epoch: 84, train_loss: 0.7456, test_loss: 0.8913, test_f1: 0.5283
 epoch: 85, train_loss: 0.7535, test_loss: 0.9274, test_f1: 0.5260
 epoch: 86, train_loss: 0.7470, test_loss: 0.9152, test_f1: 0.5246
 epoch: 87, train_loss: 0.7509, test_loss: 0.9045, test_f1: 0.5278
 epoch: 88, train_loss: 0.7473, test_loss: 0.9063, test_f1: 0.5209
 epoch: 89, train_loss: 0.7512, test_loss: 0.9017, test_f1: 0.5297
 epoch: 90, train_loss: 0.7472, test_loss: 0.9266, test_f1: 0.5222
 epoch: 91, train_loss: 0.7489, test_loss: 0.8976, test_f1: 0.5205
 epoch: 92, train_loss: 0.7355, test_loss: 0.9095, test_f1: 0.5184
 epoch: 93, train_loss: 0.7515, test_loss: 0.8920, test_f1: 0.5243
 epoch: 94, train_loss: 0.7507, test_loss: 0.9081, test_f1: 0.5283
 epoch: 95, train_loss: 0.7363, test_loss: 0.9186, test_f1: 0.5032
 epoch: 96, train_loss: 0.7353, test_loss: 0.9143, test_f1: 0.5291
 epoch: 97, train_loss: 0.7301, test_loss: 0.9134, test_f1: 0.5169
 epoch: 98, train_loss: 0.7298, test_loss: 0.9155, test_f1: 0.5276
 epoch: 99, train_loss: 0.7402, test_loss: 0.8741, test_f1: 0.5401
##################ITERATION #2 ****************************************
 epoch: 0, train_loss: 1.2252, test_loss: 1.1859, test_f1: 0.2680
 epoch: 1, train_loss: 1.1019, test_loss: 1.0688, test_f1: 0.3370
 epoch: 2, train_loss: 1.0694, test_loss: 1.0226, test_f1: 0.3455
 epoch: 3, train_loss: 1.0624, test_loss: 1.0209, test_f1: 0.3581
 epoch: 4, train_loss: 1.0395, test_loss: 1.0172, test_f1: 0.3857
 epoch: 5, train_loss: 1.0195, test_loss: 1.1483, test_f1: 0.3715
 epoch: 6, train_loss: 1.0027, test_loss: 1.0338, test_f1: 0.4624
 epoch: 7, train_loss: 0.9987, test_loss: 1.0940, test_f1: 0.4704
 epoch: 8, train_loss: 0.9935, test_loss: 1.0643, test_f1: 0.4639
 epoch: 9, train_loss: 0.9681, test_loss: 0.9675, test_f1: 0.4880
 epoch: 10, train_loss: 0.9622, test_loss: 1.0510, test_f1: 0.4561
 epoch: 11, train_loss: 0.9535, test_loss: 0.9491, test_f1: 0.4797
 epoch: 12, train_loss: 0.9409, test_loss: 0.9373, test_f1: 0.4939
 epoch: 13, train_loss: 0.9273, test_loss: 0.9324, test_f1: 0.4964
 epoch: 14, train_loss: 0.9258, test_loss: 1.0209, test_f1: 0.4516
 epoch: 15, train_loss: 0.9231, test_loss: 1.0064, test_f1: 0.4772
 epoch: 16, train_loss: 0.9149, test_loss: 0.9474, test_f1: 0.5094
 epoch: 17, train_loss: 0.8984, test_loss: 0.9083, test_f1: 0.4981
 epoch: 18, train_loss: 0.8971, test_loss: 0.9106, test_f1: 0.5125
 epoch: 19, train_loss: 0.8978, test_loss: 0.9370, test_f1: 0.4745
 epoch: 20, train_loss: 0.9007, test_loss: 0.9279, test_f1: 0.5166
 epoch: 21, train_loss: 0.8912, test_loss: 0.9222, test_f1: 0.5010
 epoch: 22, train_loss: 0.8733, test_loss: 0.8803, test_f1: 0.5028
 epoch: 23, train_loss: 0.8760, test_loss: 0.9270, test_f1: 0.5110
 epoch: 24, train_loss: 0.8857, test_loss: 0.9127, test_f1: 0.5128
 epoch: 25, train_loss: 0.8700, test_loss: 0.9309, test_f1: 0.5139
 epoch: 26, train_loss: 0.8670, test_loss: 0.9023, test_f1: 0.5309
 epoch: 27, train_loss: 0.8751, test_loss: 0.9285, test_f1: 0.5187
 epoch: 28, train_loss: 0.8529, test_loss: 0.9150, test_f1: 0.5173
 epoch: 29, train_loss: 0.8610, test_loss: 0.9295, test_f1: 0.5295
 epoch: 30, train_loss: 0.8590, test_loss: 0.9100, test_f1: 0.5007
 epoch: 31, train_loss: 0.8542, test_loss: 0.8936, test_f1: 0.5142
 epoch: 32, train_loss: 0.8474, test_loss: 0.8859, test_f1: 0.5176
 epoch: 33, train_loss: 0.8539, test_loss: 0.9078, test_f1: 0.5140
 epoch: 34, train_loss: 0.8495, test_loss: 0.9535, test_f1: 0.5209
 epoch: 35, train_loss: 0.8454, test_loss: 0.9229, test_f1: 0.4967
 epoch: 36, train_loss: 0.8611, test_loss: 0.8968, test_f1: 0.5209
 epoch: 37, train_loss: 0.8462, test_loss: 0.9133, test_f1: 0.5143
 epoch: 38, train_loss: 0.8411, test_loss: 0.9204, test_f1: 0.5122
 epoch: 39, train_loss: 0.8360, test_loss: 0.9501, test_f1: 0.5151
 epoch: 40, train_loss: 0.8435, test_loss: 0.9173, test_f1: 0.5109
 epoch: 41, train_loss: 0.8379, test_loss: 0.8639, test_f1: 0.5060
 epoch: 42, train_loss: 0.8428, test_loss: 0.9809, test_f1: 0.4879
 epoch: 43, train_loss: 0.8414, test_loss: 0.8702, test_f1: 0.5038
 epoch: 44, train_loss: 0.8365, test_loss: 0.9437, test_f1: 0.5356
 epoch: 45, train_loss: 0.8293, test_loss: 1.0140, test_f1: 0.4863
 epoch: 46, train_loss: 0.8287, test_loss: 0.9020, test_f1: 0.5196
 epoch: 47, train_loss: 0.8261, test_loss: 0.9103, test_f1: 0.4938
 epoch: 48, train_loss: 0.8221, test_loss: 0.9008, test_f1: 0.5283
 epoch: 49, train_loss: 0.8252, test_loss: 0.9268, test_f1: 0.5178
 epoch: 50, train_loss: 0.8080, test_loss: 0.9119, test_f1: 0.5077
 epoch: 51, train_loss: 0.8046, test_loss: 0.8788, test_f1: 0.5282
 epoch: 52, train_loss: 0.8123, test_loss: 0.8980, test_f1: 0.5022
 epoch: 53, train_loss: 0.8041, test_loss: 0.9024, test_f1: 0.5015
 epoch: 54, train_loss: 0.8075, test_loss: 0.8965, test_f1: 0.5203
 epoch: 55, train_loss: 0.8020, test_loss: 0.9020, test_f1: 0.5133
 epoch: 56, train_loss: 0.7987, test_loss: 0.9444, test_f1: 0.4839
 epoch: 57, train_loss: 0.7855, test_loss: 0.9331, test_f1: 0.4973
 epoch: 58, train_loss: 0.7992, test_loss: 0.9635, test_f1: 0.4878
 epoch: 59, train_loss: 0.7925, test_loss: 0.8994, test_f1: 0.5023
 epoch: 60, train_loss: 0.7990, test_loss: 0.9378, test_f1: 0.4998
 epoch: 61, train_loss: 0.8098, test_loss: 0.9030, test_f1: 0.5126
 epoch: 62, train_loss: 0.8020, test_loss: 0.9070, test_f1: 0.5015
 epoch: 63, train_loss: 0.7945, test_loss: 0.9212, test_f1: 0.5028
 epoch: 64, train_loss: 0.7917, test_loss: 0.9084, test_f1: 0.5195
 epoch: 65, train_loss: 0.7810, test_loss: 0.9049, test_f1: 0.5031
 epoch: 66, train_loss: 0.7977, test_loss: 0.9127, test_f1: 0.5211
 epoch: 67, train_loss: 0.7927, test_loss: 0.9448, test_f1: 0.4925
 epoch: 68, train_loss: 0.7852, test_loss: 0.9263, test_f1: 0.5036
 epoch: 69, train_loss: 0.7912, test_loss: 0.8956, test_f1: 0.5144
 epoch: 70, train_loss: 0.7878, test_loss: 0.8853, test_f1: 0.5205
 epoch: 71, train_loss: 0.7825, test_loss: 0.9083, test_f1: 0.5210
 epoch: 72, train_loss: 0.7880, test_loss: 0.9052, test_f1: 0.4969
 epoch: 73, train_loss: 0.7828, test_loss: 0.9003, test_f1: 0.4989
 epoch: 74, train_loss: 0.7900, test_loss: 0.9147, test_f1: 0.5034
 epoch: 75, train_loss: 0.7863, test_loss: 0.9621, test_f1: 0.4917
 epoch: 76, train_loss: 0.7834, test_loss: 0.8822, test_f1: 0.5066
 epoch: 77, train_loss: 0.7767, test_loss: 0.9208, test_f1: 0.5025
 epoch: 78, train_loss: 0.7790, test_loss: 0.9065, test_f1: 0.5145
 epoch: 79, train_loss: 0.7764, test_loss: 0.9064, test_f1: 0.5278
 epoch: 80, train_loss: 0.7762, test_loss: 0.9096, test_f1: 0.5008
 epoch: 81, train_loss: 0.7758, test_loss: 0.8922, test_f1: 0.5359
 epoch: 82, train_loss: 0.7722, test_loss: 0.9044, test_f1: 0.5146
 epoch: 83, train_loss: 0.7787, test_loss: 0.8926, test_f1: 0.5239
 epoch: 84, train_loss: 0.7754, test_loss: 0.9193, test_f1: 0.5231
 epoch: 85, train_loss: 0.7686, test_loss: 0.8799, test_f1: 0.5227
 epoch: 86, train_loss: 0.7729, test_loss: 0.8869, test_f1: 0.5125
 epoch: 87, train_loss: 0.7707, test_loss: 0.8910, test_f1: 0.5195
 epoch: 88, train_loss: 0.7762, test_loss: 0.9282, test_f1: 0.5111
 epoch: 89, train_loss: 0.7723, test_loss: 0.9194, test_f1: 0.4979
 epoch: 90, train_loss: 0.7569, test_loss: 0.8759, test_f1: 0.5278
 epoch: 91, train_loss: 0.7629, test_loss: 0.9120, test_f1: 0.5010
 epoch: 92, train_loss: 0.7724, test_loss: 0.9386, test_f1: 0.4957
 epoch: 93, train_loss: 0.7650, test_loss: 0.8961, test_f1: 0.5109
 epoch: 94, train_loss: 0.7592, test_loss: 0.9193, test_f1: 0.5204
 epoch: 95, train_loss: 0.7654, test_loss: 0.9451, test_f1: 0.4969
 epoch: 96, train_loss: 0.7663, test_loss: 0.9464, test_f1: 0.5104
 epoch: 97, train_loss: 0.7768, test_loss: 0.9513, test_f1: 0.5110
 epoch: 98, train_loss: 0.7746, test_loss: 0.8834, test_f1: 0.5391
 epoch: 99, train_loss: 0.7669, test_loss: 0.9144, test_f1: 0.5182
##################ITERATION #3 ****************************************
 epoch: 0, train_loss: 1.2382, test_loss: 1.1671, test_f1: 0.2612
 epoch: 1, train_loss: 1.1182, test_loss: 1.0765, test_f1: 0.3429
 epoch: 2, train_loss: 1.0682, test_loss: 1.0383, test_f1: 0.3551
 epoch: 3, train_loss: 1.0405, test_loss: 1.0083, test_f1: 0.4286
 epoch: 4, train_loss: 1.0295, test_loss: 1.0129, test_f1: 0.4148
 epoch: 5, train_loss: 1.0099, test_loss: 1.0119, test_f1: 0.4470
 epoch: 6, train_loss: 0.9949, test_loss: 1.0208, test_f1: 0.4336
 epoch: 7, train_loss: 1.0058, test_loss: 0.9893, test_f1: 0.4747
 epoch: 8, train_loss: 0.9725, test_loss: 0.9829, test_f1: 0.4449
 epoch: 9, train_loss: 0.9787, test_loss: 0.9793, test_f1: 0.4751
 epoch: 10, train_loss: 0.9680, test_loss: 0.9642, test_f1: 0.4802
 epoch: 11, train_loss: 0.9611, test_loss: 0.9706, test_f1: 0.4965
 epoch: 12, train_loss: 0.9411, test_loss: 0.9366, test_f1: 0.4897
 epoch: 13, train_loss: 0.9360, test_loss: 0.9684, test_f1: 0.4939
 epoch: 14, train_loss: 0.9349, test_loss: 0.9384, test_f1: 0.4906
 epoch: 15, train_loss: 0.9279, test_loss: 0.9720, test_f1: 0.4785
 epoch: 16, train_loss: 0.9129, test_loss: 0.9145, test_f1: 0.5062
 epoch: 17, train_loss: 0.9047, test_loss: 0.9204, test_f1: 0.5052
 epoch: 18, train_loss: 0.9050, test_loss: 0.9304, test_f1: 0.5149
 epoch: 19, train_loss: 0.8839, test_loss: 0.9529, test_f1: 0.5134
 epoch: 20, train_loss: 0.8827, test_loss: 0.9146, test_f1: 0.5142
 epoch: 21, train_loss: 0.8832, test_loss: 0.9353, test_f1: 0.5022
 epoch: 22, train_loss: 0.8782, test_loss: 0.9184, test_f1: 0.5077
 epoch: 23, train_loss: 0.8736, test_loss: 0.9156, test_f1: 0.5272
 epoch: 24, train_loss: 0.8633, test_loss: 0.9359, test_f1: 0.5154
 epoch: 25, train_loss: 0.8618, test_loss: 0.9208, test_f1: 0.5085
 epoch: 26, train_loss: 0.8709, test_loss: 0.9028, test_f1: 0.5346
 epoch: 27, train_loss: 0.8621, test_loss: 0.9031, test_f1: 0.5226
 epoch: 28, train_loss: 0.8439, test_loss: 0.9148, test_f1: 0.5394
 epoch: 29, train_loss: 0.8471, test_loss: 0.9377, test_f1: 0.5120
 epoch: 30, train_loss: 0.8483, test_loss: 0.9230, test_f1: 0.5263
 epoch: 31, train_loss: 0.8209, test_loss: 0.9348, test_f1: 0.5202
 epoch: 32, train_loss: 0.8345, test_loss: 0.9263, test_f1: 0.5260
 epoch: 33, train_loss: 0.8300, test_loss: 0.8869, test_f1: 0.5323
 epoch: 34, train_loss: 0.8400, test_loss: 0.9301, test_f1: 0.5277
 epoch: 35, train_loss: 0.8227, test_loss: 0.8491, test_f1: 0.5404
 epoch: 36, train_loss: 0.8278, test_loss: 0.9106, test_f1: 0.5269
 epoch: 37, train_loss: 0.8116, test_loss: 0.8483, test_f1: 0.5462
 epoch: 38, train_loss: 0.8237, test_loss: 0.8972, test_f1: 0.5209
 epoch: 39, train_loss: 0.8145, test_loss: 0.8792, test_f1: 0.5323
 epoch: 40, train_loss: 0.8022, test_loss: 0.8780, test_f1: 0.5227
 epoch: 41, train_loss: 0.8066, test_loss: 0.8563, test_f1: 0.5420
 epoch: 42, train_loss: 0.7944, test_loss: 0.8633, test_f1: 0.5371
 epoch: 43, train_loss: 0.8043, test_loss: 0.8828, test_f1: 0.5358
 epoch: 44, train_loss: 0.8014, test_loss: 0.9265, test_f1: 0.5401
 epoch: 45, train_loss: 0.7942, test_loss: 0.8706, test_f1: 0.5188
 epoch: 46, train_loss: 0.7901, test_loss: 0.8600, test_f1: 0.5393
 epoch: 47, train_loss: 0.8001, test_loss: 0.8427, test_f1: 0.5445
 epoch: 48, train_loss: 0.7897, test_loss: 0.8725, test_f1: 0.5412
 epoch: 49, train_loss: 0.7703, test_loss: 0.8755, test_f1: 0.5266
 epoch: 50, train_loss: 0.7857, test_loss: 0.9078, test_f1: 0.5600
 epoch: 51, train_loss: 0.7834, test_loss: 0.8387, test_f1: 0.5563
 epoch: 52, train_loss: 0.7679, test_loss: 0.8439, test_f1: 0.5457
 epoch: 53, train_loss: 0.7500, test_loss: 0.8357, test_f1: 0.5557
 epoch: 54, train_loss: 0.7571, test_loss: 0.8496, test_f1: 0.5471
 epoch: 55, train_loss: 0.7621, test_loss: 0.8524, test_f1: 0.5453
 epoch: 56, train_loss: 0.7587, test_loss: 0.8619, test_f1: 0.5462
 epoch: 57, train_loss: 0.7609, test_loss: 0.8256, test_f1: 0.5535
 epoch: 58, train_loss: 0.7638, test_loss: 0.8629, test_f1: 0.5541
 epoch: 59, train_loss: 0.7569, test_loss: 0.8268, test_f1: 0.5571
 epoch: 60, train_loss: 0.7511, test_loss: 0.8478, test_f1: 0.5468
 epoch: 61, train_loss: 0.7632, test_loss: 0.8601, test_f1: 0.5663
 epoch: 62, train_loss: 0.7603, test_loss: 0.8699, test_f1: 0.5463
 epoch: 63, train_loss: 0.7573, test_loss: 0.8634, test_f1: 0.5453
 epoch: 64, train_loss: 0.7467, test_loss: 0.8300, test_f1: 0.5580
 epoch: 65, train_loss: 0.7437, test_loss: 0.8520, test_f1: 0.5511
 epoch: 66, train_loss: 0.7422, test_loss: 0.8607, test_f1: 0.5542
 epoch: 67, train_loss: 0.7509, test_loss: 0.8215, test_f1: 0.5548
 epoch: 68, train_loss: 0.7456, test_loss: 0.8607, test_f1: 0.5588
 epoch: 69, train_loss: 0.7425, test_loss: 0.8072, test_f1: 0.5651
 epoch: 70, train_loss: 0.7429, test_loss: 0.8186, test_f1: 0.5515
 epoch: 71, train_loss: 0.7445, test_loss: 0.8421, test_f1: 0.5565
 epoch: 72, train_loss: 0.7518, test_loss: 0.8482, test_f1: 0.5737
 epoch: 73, train_loss: 0.7664, test_loss: 0.8320, test_f1: 0.5675
 epoch: 74, train_loss: 0.7472, test_loss: 0.8452, test_f1: 0.5529
 epoch: 75, train_loss: 0.7498, test_loss: 0.8328, test_f1: 0.5604
 epoch: 76, train_loss: 0.7284, test_loss: 0.8503, test_f1: 0.5472
 epoch: 77, train_loss: 0.7548, test_loss: 0.8174, test_f1: 0.5585
 epoch: 78, train_loss: 0.7388, test_loss: 0.8187, test_f1: 0.5551
 epoch: 79, train_loss: 0.7412, test_loss: 0.8389, test_f1: 0.5537
 epoch: 80, train_loss: 0.7213, test_loss: 0.8072, test_f1: 0.5711
 epoch: 81, train_loss: 0.7334, test_loss: 0.8250, test_f1: 0.5597
 epoch: 82, train_loss: 0.7256, test_loss: 0.8996, test_f1: 0.5619
 epoch: 83, train_loss: 0.7243, test_loss: 0.8253, test_f1: 0.5661
 epoch: 84, train_loss: 0.7375, test_loss: 0.8265, test_f1: 0.5663
 epoch: 85, train_loss: 0.7331, test_loss: 0.8521, test_f1: 0.5617
 epoch: 86, train_loss: 0.7252, test_loss: 0.8143, test_f1: 0.5669
 epoch: 87, train_loss: 0.7331, test_loss: 0.8369, test_f1: 0.5458
 epoch: 88, train_loss: 0.7347, test_loss: 0.8118, test_f1: 0.5594
 epoch: 89, train_loss: 0.7298, test_loss: 0.8517, test_f1: 0.5464
 epoch: 90, train_loss: 0.7291, test_loss: 0.8080, test_f1: 0.5680
 epoch: 91, train_loss: 0.7112, test_loss: 0.8520, test_f1: 0.5536
 epoch: 92, train_loss: 0.7267, test_loss: 0.8227, test_f1: 0.5581
 epoch: 93, train_loss: 0.7195, test_loss: 0.8783, test_f1: 0.5650
 epoch: 94, train_loss: 0.7187, test_loss: 0.8468, test_f1: 0.5552
 epoch: 95, train_loss: 0.7226, test_loss: 0.8286, test_f1: 0.5534
 epoch: 96, train_loss: 0.7227, test_loss: 0.8104, test_f1: 0.5579
 epoch: 97, train_loss: 0.7243, test_loss: 0.9100, test_f1: 0.5439
 epoch: 98, train_loss: 0.7214, test_loss: 0.8448, test_f1: 0.5559
 epoch: 99, train_loss: 0.7225, test_loss: 0.8468, test_f1: 0.5555
##################ITERATION #4 ****************************************
 epoch: 0, train_loss: 1.2885, test_loss: 1.3119, test_f1: 0.2388
 epoch: 1, train_loss: 1.1505, test_loss: 1.0531, test_f1: 0.4087
 epoch: 2, train_loss: 1.0980, test_loss: 1.0429, test_f1: 0.3701
 epoch: 3, train_loss: 1.0632, test_loss: 1.0193, test_f1: 0.4291
 epoch: 4, train_loss: 1.0478, test_loss: 1.0138, test_f1: 0.4018
 epoch: 5, train_loss: 1.0459, test_loss: 1.0094, test_f1: 0.4660
 epoch: 6, train_loss: 1.0204, test_loss: 1.0313, test_f1: 0.4280
 epoch: 7, train_loss: 1.0138, test_loss: 1.0195, test_f1: 0.4517
 epoch: 8, train_loss: 1.0070, test_loss: 1.0340, test_f1: 0.4375
 epoch: 9, train_loss: 0.9934, test_loss: 1.0074, test_f1: 0.4635
 epoch: 10, train_loss: 0.9948, test_loss: 1.0178, test_f1: 0.4443
 epoch: 11, train_loss: 0.9974, test_loss: 1.0112, test_f1: 0.4753
 epoch: 12, train_loss: 0.9827, test_loss: 1.0166, test_f1: 0.4725
 epoch: 13, train_loss: 0.9857, test_loss: 1.0116, test_f1: 0.4652
 epoch: 14, train_loss: 0.9824, test_loss: 1.0049, test_f1: 0.4758
 epoch: 15, train_loss: 0.9782, test_loss: 1.0074, test_f1: 0.4756
 epoch: 16, train_loss: 0.9663, test_loss: 1.0317, test_f1: 0.4756
 epoch: 17, train_loss: 0.9560, test_loss: 0.9952, test_f1: 0.4869
 epoch: 18, train_loss: 0.9526, test_loss: 1.0083, test_f1: 0.4937
 epoch: 19, train_loss: 0.9575, test_loss: 0.9929, test_f1: 0.4799
 epoch: 20, train_loss: 0.9507, test_loss: 1.0283, test_f1: 0.4595
 epoch: 21, train_loss: 0.9429, test_loss: 0.9925, test_f1: 0.4881
 epoch: 22, train_loss: 0.9319, test_loss: 1.0053, test_f1: 0.4698
 epoch: 23, train_loss: 0.9354, test_loss: 0.9723, test_f1: 0.5007
 epoch: 24, train_loss: 0.9297, test_loss: 0.9595, test_f1: 0.4883
 epoch: 25, train_loss: 0.9180, test_loss: 0.9980, test_f1: 0.5075
 epoch: 26, train_loss: 0.9140, test_loss: 0.9950, test_f1: 0.5040
 epoch: 27, train_loss: 0.9159, test_loss: 0.9929, test_f1: 0.4881
 epoch: 28, train_loss: 0.9098, test_loss: 0.9730, test_f1: 0.4947
 epoch: 29, train_loss: 0.9081, test_loss: 0.9686, test_f1: 0.5087
 epoch: 30, train_loss: 0.9015, test_loss: 0.9527, test_f1: 0.4876
 epoch: 31, train_loss: 0.9008, test_loss: 0.9549, test_f1: 0.4975
 epoch: 32, train_loss: 0.8959, test_loss: 1.0184, test_f1: 0.4549
 epoch: 33, train_loss: 0.8891, test_loss: 0.9651, test_f1: 0.5152
 epoch: 34, train_loss: 0.8908, test_loss: 1.0020, test_f1: 0.4888
 epoch: 35, train_loss: 0.8768, test_loss: 0.9272, test_f1: 0.5158
 epoch: 36, train_loss: 0.8768, test_loss: 0.9611, test_f1: 0.5149
 epoch: 37, train_loss: 0.8849, test_loss: 0.9258, test_f1: 0.5226
 epoch: 38, train_loss: 0.8650, test_loss: 1.0007, test_f1: 0.4836
 epoch: 39, train_loss: 0.8821, test_loss: 0.9552, test_f1: 0.5160
 epoch: 40, train_loss: 0.8689, test_loss: 0.9655, test_f1: 0.5156
 epoch: 41, train_loss: 0.8831, test_loss: 0.9270, test_f1: 0.5118
 epoch: 42, train_loss: 0.8774, test_loss: 0.9973, test_f1: 0.4963
 epoch: 43, train_loss: 0.8595, test_loss: 0.9244, test_f1: 0.5310
 epoch: 44, train_loss: 0.8521, test_loss: 0.9510, test_f1: 0.4965
 epoch: 45, train_loss: 0.8696, test_loss: 0.9343, test_f1: 0.5261
 epoch: 46, train_loss: 0.8568, test_loss: 0.9353, test_f1: 0.5316
 epoch: 47, train_loss: 0.8554, test_loss: 0.9208, test_f1: 0.5248
 epoch: 48, train_loss: 0.8536, test_loss: 0.9750, test_f1: 0.4927
 epoch: 49, train_loss: 0.8562, test_loss: 0.9150, test_f1: 0.5140
 epoch: 50, train_loss: 0.8376, test_loss: 0.9560, test_f1: 0.5002
 epoch: 51, train_loss: 0.8336, test_loss: 0.9359, test_f1: 0.5017
 epoch: 52, train_loss: 0.8454, test_loss: 0.9304, test_f1: 0.5064
 epoch: 53, train_loss: 0.8344, test_loss: 0.9290, test_f1: 0.5136
 epoch: 54, train_loss: 0.8255, test_loss: 0.9547, test_f1: 0.5003
 epoch: 55, train_loss: 0.8192, test_loss: 0.9154, test_f1: 0.5175
 epoch: 56, train_loss: 0.8170, test_loss: 0.9541, test_f1: 0.4989
 epoch: 57, train_loss: 0.8204, test_loss: 0.9495, test_f1: 0.5049
 epoch: 58, train_loss: 0.8192, test_loss: 0.9449, test_f1: 0.5051
 epoch: 59, train_loss: 0.8094, test_loss: 0.9992, test_f1: 0.4852
 epoch: 60, train_loss: 0.8227, test_loss: 0.9862, test_f1: 0.4893
 epoch: 61, train_loss: 0.8125, test_loss: 0.9303, test_f1: 0.5076
 epoch: 62, train_loss: 0.8091, test_loss: 0.9193, test_f1: 0.5107
 epoch: 63, train_loss: 0.8144, test_loss: 0.9865, test_f1: 0.4943
 epoch: 64, train_loss: 0.8246, test_loss: 0.9571, test_f1: 0.5118
 epoch: 65, train_loss: 0.7949, test_loss: 0.9852, test_f1: 0.4964
 epoch: 66, train_loss: 0.8108, test_loss: 0.9498, test_f1: 0.4997
 epoch: 67, train_loss: 0.8138, test_loss: 0.9899, test_f1: 0.4943
 epoch: 68, train_loss: 0.8132, test_loss: 0.9568, test_f1: 0.4981
 epoch: 69, train_loss: 0.8081, test_loss: 0.9465, test_f1: 0.5013
 epoch: 70, train_loss: 0.8106, test_loss: 0.9941, test_f1: 0.5001
 epoch: 71, train_loss: 0.8039, test_loss: 0.9717, test_f1: 0.4935
 epoch: 72, train_loss: 0.8045, test_loss: 0.9340, test_f1: 0.4980
 epoch: 73, train_loss: 0.8046, test_loss: 1.0332, test_f1: 0.4883
 epoch: 74, train_loss: 0.8109, test_loss: 0.9711, test_f1: 0.5042
 epoch: 75, train_loss: 0.7983, test_loss: 0.9480, test_f1: 0.5059
 epoch: 76, train_loss: 0.7981, test_loss: 0.9599, test_f1: 0.4983
 epoch: 77, train_loss: 0.7993, test_loss: 0.9386, test_f1: 0.5068
 epoch: 78, train_loss: 0.8099, test_loss: 0.9594, test_f1: 0.5038
 epoch: 79, train_loss: 0.8060, test_loss: 0.9551, test_f1: 0.4909
 epoch: 80, train_loss: 0.7888, test_loss: 0.9554, test_f1: 0.4997
 epoch: 81, train_loss: 0.7901, test_loss: 0.9726, test_f1: 0.4937
 epoch: 82, train_loss: 0.7947, test_loss: 0.9507, test_f1: 0.5005
 epoch: 83, train_loss: 0.7968, test_loss: 0.9447, test_f1: 0.4993
 epoch: 84, train_loss: 0.7828, test_loss: 0.9459, test_f1: 0.5127
 epoch: 85, train_loss: 0.7796, test_loss: 0.9609, test_f1: 0.5004
 epoch: 86, train_loss: 0.7881, test_loss: 0.9790, test_f1: 0.5012
 epoch: 87, train_loss: 0.7820, test_loss: 0.9524, test_f1: 0.5016
 epoch: 88, train_loss: 0.7886, test_loss: 0.9713, test_f1: 0.4998
 epoch: 89, train_loss: 0.7904, test_loss: 0.9674, test_f1: 0.4990
 epoch: 90, train_loss: 0.7874, test_loss: 0.9636, test_f1: 0.5026
 epoch: 91, train_loss: 0.7769, test_loss: 0.9461, test_f1: 0.5020
 epoch: 92, train_loss: 0.7769, test_loss: 0.9766, test_f1: 0.5067
 epoch: 93, train_loss: 0.7902, test_loss: 0.9874, test_f1: 0.5005
 epoch: 94, train_loss: 0.7771, test_loss: 0.9684, test_f1: 0.5074
 epoch: 95, train_loss: 0.7691, test_loss: 0.9526, test_f1: 0.5057
 epoch: 96, train_loss: 0.7863, test_loss: 0.9521, test_f1: 0.4999
 epoch: 97, train_loss: 0.7955, test_loss: 0.9884, test_f1: 0.5034
 epoch: 98, train_loss: 0.7804, test_loss: 0.9651, test_f1: 0.4999
 epoch: 99, train_loss: 0.7764, test_loss: 1.0047, test_f1: 0.5044
##################ITERATION #5 ****************************************
 epoch: 0, train_loss: 1.1953, test_loss: 1.0789, test_f1: 0.3516
 epoch: 1, train_loss: 1.0808, test_loss: 1.0486, test_f1: 0.3902
 epoch: 2, train_loss: 1.0476, test_loss: 1.0377, test_f1: 0.4253
 epoch: 3, train_loss: 1.0217, test_loss: 1.0135, test_f1: 0.4051
 epoch: 4, train_loss: 1.0116, test_loss: 1.0049, test_f1: 0.4581
 epoch: 5, train_loss: 0.9908, test_loss: 1.0362, test_f1: 0.4356
 epoch: 6, train_loss: 0.9838, test_loss: 0.9814, test_f1: 0.4465
 epoch: 7, train_loss: 0.9637, test_loss: 0.9977, test_f1: 0.4339
 epoch: 8, train_loss: 0.9550, test_loss: 0.9527, test_f1: 0.4587
 epoch: 9, train_loss: 0.9452, test_loss: 0.9731, test_f1: 0.4703
 epoch: 10, train_loss: 0.9471, test_loss: 0.9585, test_f1: 0.4414
 epoch: 11, train_loss: 0.9406, test_loss: 1.0005, test_f1: 0.4600
 epoch: 12, train_loss: 0.9291, test_loss: 0.9474, test_f1: 0.4909
 epoch: 13, train_loss: 0.9339, test_loss: 0.9252, test_f1: 0.5083
 epoch: 14, train_loss: 0.9231, test_loss: 0.9361, test_f1: 0.4924
 epoch: 15, train_loss: 0.9146, test_loss: 0.9571, test_f1: 0.4798
 epoch: 16, train_loss: 0.9136, test_loss: 0.9238, test_f1: 0.4885
 epoch: 17, train_loss: 0.9198, test_loss: 1.0210, test_f1: 0.4786
 epoch: 18, train_loss: 0.9044, test_loss: 0.9858, test_f1: 0.5051
 epoch: 19, train_loss: 0.9089, test_loss: 0.9283, test_f1: 0.5198
 epoch: 20, train_loss: 0.9118, test_loss: 0.9752, test_f1: 0.4969
 epoch: 21, train_loss: 0.9018, test_loss: 0.9911, test_f1: 0.4720
 epoch: 22, train_loss: 0.9021, test_loss: 0.9802, test_f1: 0.4953
 epoch: 23, train_loss: 0.8897, test_loss: 0.9745, test_f1: 0.5023
 epoch: 24, train_loss: 0.8917, test_loss: 1.0156, test_f1: 0.4536
 epoch: 25, train_loss: 0.8734, test_loss: 0.9718, test_f1: 0.4860
 epoch: 26, train_loss: 0.8831, test_loss: 0.9380, test_f1: 0.5042
 epoch: 27, train_loss: 0.8789, test_loss: 0.9300, test_f1: 0.5271
 epoch: 28, train_loss: 0.8749, test_loss: 0.9362, test_f1: 0.5143
 epoch: 29, train_loss: 0.8599, test_loss: 0.9724, test_f1: 0.5095
 epoch: 30, train_loss: 0.8700, test_loss: 0.9304, test_f1: 0.5243
 epoch: 31, train_loss: 0.8615, test_loss: 0.9525, test_f1: 0.5019
 epoch: 32, train_loss: 0.8580, test_loss: 1.0915, test_f1: 0.4572
 epoch: 33, train_loss: 0.8592, test_loss: 0.9142, test_f1: 0.5336
 epoch: 34, train_loss: 0.8575, test_loss: 0.9721, test_f1: 0.4975
 epoch: 35, train_loss: 0.8513, test_loss: 0.9110, test_f1: 0.5396
 epoch: 36, train_loss: 0.8445, test_loss: 1.0101, test_f1: 0.4775
 epoch: 37, train_loss: 0.8488, test_loss: 0.9723, test_f1: 0.4915
 epoch: 38, train_loss: 0.8410, test_loss: 0.8999, test_f1: 0.5366
 epoch: 39, train_loss: 0.8411, test_loss: 1.0078, test_f1: 0.4901
 epoch: 40, train_loss: 0.8333, test_loss: 0.9289, test_f1: 0.5118
 epoch: 41, train_loss: 0.8364, test_loss: 0.9491, test_f1: 0.5275
 epoch: 42, train_loss: 0.8298, test_loss: 0.9739, test_f1: 0.5281
 epoch: 43, train_loss: 0.8253, test_loss: 0.9397, test_f1: 0.5222
 epoch: 44, train_loss: 0.8341, test_loss: 0.9921, test_f1: 0.5141
 epoch: 45, train_loss: 0.8328, test_loss: 1.0852, test_f1: 0.4803
 epoch: 46, train_loss: 0.8219, test_loss: 0.9775, test_f1: 0.5029
 epoch: 47, train_loss: 0.8258, test_loss: 0.9207, test_f1: 0.5433
 epoch: 48, train_loss: 0.8223, test_loss: 0.9981, test_f1: 0.5018
 epoch: 49, train_loss: 0.8185, test_loss: 0.8920, test_f1: 0.5372
 epoch: 50, train_loss: 0.8162, test_loss: 0.9502, test_f1: 0.5097
 epoch: 51, train_loss: 0.8219, test_loss: 0.9671, test_f1: 0.5049
 epoch: 52, train_loss: 0.8126, test_loss: 0.9839, test_f1: 0.4966
 epoch: 53, train_loss: 0.8027, test_loss: 0.9409, test_f1: 0.5233
 epoch: 54, train_loss: 0.8002, test_loss: 0.9160, test_f1: 0.5322
 epoch: 55, train_loss: 0.7936, test_loss: 0.9734, test_f1: 0.5190
 epoch: 56, train_loss: 0.8055, test_loss: 0.9965, test_f1: 0.4951
 epoch: 57, train_loss: 0.7936, test_loss: 0.9395, test_f1: 0.5306
 epoch: 58, train_loss: 0.8003, test_loss: 0.8994, test_f1: 0.5470
 epoch: 59, train_loss: 0.7939, test_loss: 0.9519, test_f1: 0.5142
 epoch: 60, train_loss: 0.7982, test_loss: 0.9598, test_f1: 0.5047
 epoch: 61, train_loss: 0.8044, test_loss: 0.9094, test_f1: 0.5269
 epoch: 62, train_loss: 0.8010, test_loss: 0.8969, test_f1: 0.5539
 epoch: 63, train_loss: 0.7817, test_loss: 0.9852, test_f1: 0.5186
 epoch: 64, train_loss: 0.7940, test_loss: 0.8810, test_f1: 0.5395
 epoch: 65, train_loss: 0.7921, test_loss: 0.9403, test_f1: 0.5252
 epoch: 66, train_loss: 0.7824, test_loss: 0.8767, test_f1: 0.5335
 epoch: 67, train_loss: 0.7901, test_loss: 0.9796, test_f1: 0.5051
 epoch: 68, train_loss: 0.7936, test_loss: 0.8548, test_f1: 0.5426
 epoch: 69, train_loss: 0.7892, test_loss: 0.9139, test_f1: 0.5278
 epoch: 70, train_loss: 0.7771, test_loss: 0.9391, test_f1: 0.5249
 epoch: 71, train_loss: 0.7911, test_loss: 0.8974, test_f1: 0.5460
 epoch: 72, train_loss: 0.7850, test_loss: 0.9035, test_f1: 0.5270
 epoch: 73, train_loss: 0.7835, test_loss: 0.9358, test_f1: 0.5307
 epoch: 74, train_loss: 0.7802, test_loss: 0.9018, test_f1: 0.5464
 epoch: 75, train_loss: 0.7922, test_loss: 0.9520, test_f1: 0.5207
 epoch: 76, train_loss: 0.7858, test_loss: 0.9241, test_f1: 0.5284
 epoch: 77, train_loss: 0.7826, test_loss: 0.9088, test_f1: 0.5369
 epoch: 78, train_loss: 0.7774, test_loss: 0.8797, test_f1: 0.5450
 epoch: 79, train_loss: 0.7804, test_loss: 0.8967, test_f1: 0.5528
 epoch: 80, train_loss: 0.7840, test_loss: 0.9067, test_f1: 0.5468
 epoch: 81, train_loss: 0.7724, test_loss: 0.9603, test_f1: 0.5319
 epoch: 82, train_loss: 0.7758, test_loss: 0.9349, test_f1: 0.5334
 epoch: 83, train_loss: 0.7774, test_loss: 0.9395, test_f1: 0.5184
 epoch: 84, train_loss: 0.7740, test_loss: 0.8733, test_f1: 0.5417
 epoch: 85, train_loss: 0.7829, test_loss: 0.9197, test_f1: 0.5379
 epoch: 86, train_loss: 0.7812, test_loss: 0.9515, test_f1: 0.5417
 epoch: 87, train_loss: 0.7759, test_loss: 0.9824, test_f1: 0.5291
 epoch: 88, train_loss: 0.7700, test_loss: 0.9342, test_f1: 0.5353
 epoch: 89, train_loss: 0.7566, test_loss: 0.9290, test_f1: 0.5336
 epoch: 90, train_loss: 0.7701, test_loss: 0.9609, test_f1: 0.5241
 epoch: 91, train_loss: 0.7634, test_loss: 0.9576, test_f1: 0.5341
 epoch: 92, train_loss: 0.7606, test_loss: 0.9232, test_f1: 0.5571
 epoch: 93, train_loss: 0.7656, test_loss: 0.9414, test_f1: 0.5317
 epoch: 94, train_loss: 0.7655, test_loss: 0.9046, test_f1: 0.5490
 epoch: 95, train_loss: 0.7636, test_loss: 0.9087, test_f1: 0.5446
 epoch: 96, train_loss: 0.7690, test_loss: 0.9155, test_f1: 0.5470
 epoch: 97, train_loss: 0.7725, test_loss: 0.8835, test_f1: 0.5492
 epoch: 98, train_loss: 0.7612, test_loss: 0.9552, test_f1: 0.5307
 epoch: 99, train_loss: 0.7605, test_loss: 0.9780, test_f1: 0.5167
##################ITERATION #6 ****************************************
 epoch: 0, train_loss: 1.2349, test_loss: 1.5472, test_f1: 0.2486
 epoch: 1, train_loss: 1.0842, test_loss: 1.0169, test_f1: 0.4216
 epoch: 2, train_loss: 1.0598, test_loss: 0.9997, test_f1: 0.4560
 epoch: 3, train_loss: 1.0396, test_loss: 1.0005, test_f1: 0.4442
 epoch: 4, train_loss: 1.0288, test_loss: 1.0183, test_f1: 0.4403
 epoch: 5, train_loss: 1.0094, test_loss: 1.0036, test_f1: 0.4633
 epoch: 6, train_loss: 1.0083, test_loss: 0.9887, test_f1: 0.4769
 epoch: 7, train_loss: 0.9951, test_loss: 1.0119, test_f1: 0.4685
 epoch: 8, train_loss: 0.9841, test_loss: 0.9748, test_f1: 0.4983
 epoch: 9, train_loss: 0.9815, test_loss: 1.0321, test_f1: 0.4605
 epoch: 10, train_loss: 0.9848, test_loss: 0.9825, test_f1: 0.4848
 epoch: 11, train_loss: 0.9547, test_loss: 0.9471, test_f1: 0.5023
 epoch: 12, train_loss: 0.9502, test_loss: 0.9998, test_f1: 0.4969
 epoch: 13, train_loss: 0.9363, test_loss: 0.9672, test_f1: 0.4974
 epoch: 14, train_loss: 0.9405, test_loss: 0.9285, test_f1: 0.4989
 epoch: 15, train_loss: 0.9348, test_loss: 0.9353, test_f1: 0.4871
 epoch: 16, train_loss: 0.9329, test_loss: 0.9730, test_f1: 0.4962
 epoch: 17, train_loss: 0.9044, test_loss: 0.9171, test_f1: 0.5235
 epoch: 18, train_loss: 0.9081, test_loss: 0.9033, test_f1: 0.5391
 epoch: 19, train_loss: 0.9002, test_loss: 0.8975, test_f1: 0.5309
 epoch: 20, train_loss: 0.8995, test_loss: 0.8873, test_f1: 0.5342
 epoch: 21, train_loss: 0.9005, test_loss: 0.9447, test_f1: 0.5189
 epoch: 22, train_loss: 0.8949, test_loss: 0.9313, test_f1: 0.5162
 epoch: 23, train_loss: 0.8746, test_loss: 0.9002, test_f1: 0.5340
 epoch: 24, train_loss: 0.8676, test_loss: 0.9046, test_f1: 0.5235
 epoch: 25, train_loss: 0.8780, test_loss: 0.9124, test_f1: 0.5278
 epoch: 26, train_loss: 0.8717, test_loss: 0.9253, test_f1: 0.5081
 epoch: 27, train_loss: 0.8564, test_loss: 0.9060, test_f1: 0.5368
 epoch: 28, train_loss: 0.8720, test_loss: 0.8911, test_f1: 0.5279
 epoch: 29, train_loss: 0.8623, test_loss: 0.8889, test_f1: 0.5277
 epoch: 30, train_loss: 0.8467, test_loss: 0.8534, test_f1: 0.5456
 epoch: 31, train_loss: 0.8552, test_loss: 0.8991, test_f1: 0.5240
 epoch: 32, train_loss: 0.8522, test_loss: 0.8566, test_f1: 0.5380
 epoch: 33, train_loss: 0.8379, test_loss: 0.8913, test_f1: 0.5393
 epoch: 34, train_loss: 0.8436, test_loss: 0.9054, test_f1: 0.5232
 epoch: 35, train_loss: 0.8438, test_loss: 0.8897, test_f1: 0.5213
 epoch: 36, train_loss: 0.8285, test_loss: 0.8559, test_f1: 0.5471
 epoch: 37, train_loss: 0.8270, test_loss: 0.9340, test_f1: 0.5075
 epoch: 38, train_loss: 0.8279, test_loss: 0.8943, test_f1: 0.5238
 epoch: 39, train_loss: 0.8286, test_loss: 0.8829, test_f1: 0.5273
 epoch: 40, train_loss: 0.8205, test_loss: 0.8993, test_f1: 0.5421
 epoch: 41, train_loss: 0.8059, test_loss: 0.8952, test_f1: 0.5226
 epoch: 42, train_loss: 0.8132, test_loss: 0.8728, test_f1: 0.5299
 epoch: 43, train_loss: 0.8027, test_loss: 0.9043, test_f1: 0.5090
 epoch: 44, train_loss: 0.8208, test_loss: 0.8862, test_f1: 0.5335
 epoch: 45, train_loss: 0.8044, test_loss: 0.8481, test_f1: 0.5377
 epoch: 46, train_loss: 0.8147, test_loss: 0.9108, test_f1: 0.5193
 epoch: 47, train_loss: 0.8084, test_loss: 0.8540, test_f1: 0.5460
 epoch: 48, train_loss: 0.8060, test_loss: 0.8861, test_f1: 0.5254
 epoch: 49, train_loss: 0.7923, test_loss: 0.8966, test_f1: 0.5275
 epoch: 50, train_loss: 0.8208, test_loss: 0.8823, test_f1: 0.5286
 epoch: 51, train_loss: 0.7865, test_loss: 0.8578, test_f1: 0.5373
 epoch: 52, train_loss: 0.7808, test_loss: 0.8742, test_f1: 0.5435
 epoch: 53, train_loss: 0.7916, test_loss: 0.8638, test_f1: 0.5528
 epoch: 54, train_loss: 0.7720, test_loss: 0.8788, test_f1: 0.5250
 epoch: 55, train_loss: 0.7787, test_loss: 0.8798, test_f1: 0.5464
 epoch: 56, train_loss: 0.7796, test_loss: 0.8871, test_f1: 0.5323
 epoch: 57, train_loss: 0.7780, test_loss: 0.8626, test_f1: 0.5410
 epoch: 58, train_loss: 0.7722, test_loss: 0.8389, test_f1: 0.5404
 epoch: 59, train_loss: 0.7698, test_loss: 0.8901, test_f1: 0.5495
 epoch: 60, train_loss: 0.7759, test_loss: 0.9497, test_f1: 0.5048
 epoch: 61, train_loss: 0.7694, test_loss: 0.9077, test_f1: 0.5207
 epoch: 62, train_loss: 0.7650, test_loss: 0.8553, test_f1: 0.5383
 epoch: 63, train_loss: 0.7695, test_loss: 0.8930, test_f1: 0.5443
 epoch: 64, train_loss: 0.7671, test_loss: 0.8705, test_f1: 0.5401
 epoch: 65, train_loss: 0.7663, test_loss: 0.8880, test_f1: 0.5384
 epoch: 66, train_loss: 0.7613, test_loss: 0.9313, test_f1: 0.5167
 epoch: 67, train_loss: 0.7653, test_loss: 0.8727, test_f1: 0.5413
 epoch: 68, train_loss: 0.7642, test_loss: 0.8879, test_f1: 0.5353
 epoch: 69, train_loss: 0.7687, test_loss: 0.8562, test_f1: 0.5460
 epoch: 70, train_loss: 0.7598, test_loss: 0.8798, test_f1: 0.5309
 epoch: 71, train_loss: 0.7519, test_loss: 0.9132, test_f1: 0.5225
 epoch: 72, train_loss: 0.7535, test_loss: 0.8942, test_f1: 0.5233
 epoch: 73, train_loss: 0.7618, test_loss: 0.9120, test_f1: 0.5263
 epoch: 74, train_loss: 0.7465, test_loss: 0.8738, test_f1: 0.5303
 epoch: 75, train_loss: 0.7446, test_loss: 0.8910, test_f1: 0.5143
 epoch: 76, train_loss: 0.7536, test_loss: 0.9187, test_f1: 0.5277
 epoch: 77, train_loss: 0.7477, test_loss: 0.8574, test_f1: 0.5324
 epoch: 78, train_loss: 0.7493, test_loss: 0.9094, test_f1: 0.5110
 epoch: 79, train_loss: 0.7420, test_loss: 0.8975, test_f1: 0.5265
 epoch: 80, train_loss: 0.7365, test_loss: 0.8943, test_f1: 0.5400
 epoch: 81, train_loss: 0.7462, test_loss: 0.9271, test_f1: 0.5210
 epoch: 82, train_loss: 0.7397, test_loss: 0.8804, test_f1: 0.5393
 epoch: 83, train_loss: 0.7398, test_loss: 0.8542, test_f1: 0.5442
 epoch: 84, train_loss: 0.7418, test_loss: 0.9452, test_f1: 0.5161
 epoch: 85, train_loss: 0.7535, test_loss: 0.8772, test_f1: 0.5397
 epoch: 86, train_loss: 0.7480, test_loss: 0.8693, test_f1: 0.5438
 epoch: 87, train_loss: 0.7432, test_loss: 0.8931, test_f1: 0.5387
 epoch: 88, train_loss: 0.7406, test_loss: 0.9250, test_f1: 0.5266
 epoch: 89, train_loss: 0.7329, test_loss: 0.8837, test_f1: 0.5341
 epoch: 90, train_loss: 0.7416, test_loss: 0.8820, test_f1: 0.5521
 epoch: 91, train_loss: 0.7476, test_loss: 0.8902, test_f1: 0.5450
 epoch: 92, train_loss: 0.7407, test_loss: 0.9420, test_f1: 0.5230
 epoch: 93, train_loss: 0.7475, test_loss: 0.8410, test_f1: 0.5306
 epoch: 94, train_loss: 0.7321, test_loss: 0.8697, test_f1: 0.5316
 epoch: 95, train_loss: 0.7406, test_loss: 0.8580, test_f1: 0.5445
 epoch: 96, train_loss: 0.7278, test_loss: 0.8676, test_f1: 0.5354
 epoch: 97, train_loss: 0.7341, test_loss: 0.8630, test_f1: 0.5304
 epoch: 98, train_loss: 0.7228, test_loss: 0.8992, test_f1: 0.5332
 epoch: 99, train_loss: 0.7332, test_loss: 0.8838, test_f1: 0.5397
##################ITERATION #7 ****************************************
 epoch: 0, train_loss: 1.2905, test_loss: 1.1440, test_f1: 0.2441
 epoch: 1, train_loss: 1.1525, test_loss: 1.0478, test_f1: 0.4605
 epoch: 2, train_loss: 1.0768, test_loss: 1.0440, test_f1: 0.4575
 epoch: 3, train_loss: 1.0351, test_loss: 1.0192, test_f1: 0.4931
 epoch: 4, train_loss: 1.0157, test_loss: 1.0082, test_f1: 0.4875
 epoch: 5, train_loss: 0.9944, test_loss: 1.0034, test_f1: 0.4950
 epoch: 6, train_loss: 0.9837, test_loss: 1.0102, test_f1: 0.4666
 epoch: 7, train_loss: 0.9639, test_loss: 0.9826, test_f1: 0.5092
 epoch: 8, train_loss: 0.9531, test_loss: 1.0567, test_f1: 0.4530
 epoch: 9, train_loss: 0.9382, test_loss: 1.0045, test_f1: 0.4655
 epoch: 10, train_loss: 0.9441, test_loss: 1.0009, test_f1: 0.4850
 epoch: 11, train_loss: 0.9242, test_loss: 1.0162, test_f1: 0.5082
 epoch: 12, train_loss: 0.9118, test_loss: 0.9773, test_f1: 0.4938
 epoch: 13, train_loss: 0.9044, test_loss: 1.0620, test_f1: 0.4811
 epoch: 14, train_loss: 0.9261, test_loss: 0.9588, test_f1: 0.5066
 epoch: 15, train_loss: 0.9011, test_loss: 0.9740, test_f1: 0.5059
 epoch: 16, train_loss: 0.8791, test_loss: 0.9608, test_f1: 0.5047
 epoch: 17, train_loss: 0.8775, test_loss: 0.9867, test_f1: 0.4934
 epoch: 18, train_loss: 0.8813, test_loss: 0.9822, test_f1: 0.5203
 epoch: 19, train_loss: 0.8627, test_loss: 0.9882, test_f1: 0.5149
 epoch: 20, train_loss: 0.8622, test_loss: 0.9805, test_f1: 0.5070
 epoch: 21, train_loss: 0.8646, test_loss: 0.9746, test_f1: 0.5228
 epoch: 22, train_loss: 0.8578, test_loss: 0.9632, test_f1: 0.5213
 epoch: 23, train_loss: 0.8459, test_loss: 0.9583, test_f1: 0.5250
 epoch: 24, train_loss: 0.8477, test_loss: 1.0069, test_f1: 0.4923
 epoch: 25, train_loss: 0.8438, test_loss: 0.9435, test_f1: 0.5491
 epoch: 26, train_loss: 0.8410, test_loss: 0.9962, test_f1: 0.5216
 epoch: 27, train_loss: 0.8372, test_loss: 0.9729, test_f1: 0.4968
 epoch: 28, train_loss: 0.8397, test_loss: 0.9439, test_f1: 0.5305
 epoch: 29, train_loss: 0.8327, test_loss: 0.9880, test_f1: 0.4985
 epoch: 30, train_loss: 0.8283, test_loss: 0.9710, test_f1: 0.5296
 epoch: 31, train_loss: 0.8333, test_loss: 0.9846, test_f1: 0.5284
 epoch: 32, train_loss: 0.8346, test_loss: 0.9685, test_f1: 0.5512
 epoch: 33, train_loss: 0.8145, test_loss: 0.9950, test_f1: 0.5201
 epoch: 34, train_loss: 0.8144, test_loss: 0.9792, test_f1: 0.5410
 epoch: 35, train_loss: 0.8077, test_loss: 0.9601, test_f1: 0.5555
 epoch: 36, train_loss: 0.8154, test_loss: 0.9075, test_f1: 0.5291
 epoch: 37, train_loss: 0.8171, test_loss: 0.9442, test_f1: 0.5474
 epoch: 38, train_loss: 0.8029, test_loss: 0.9869, test_f1: 0.5419
 epoch: 39, train_loss: 0.7894, test_loss: 0.8838, test_f1: 0.5562
 epoch: 40, train_loss: 0.7992, test_loss: 0.9562, test_f1: 0.5445
 epoch: 41, train_loss: 0.7925, test_loss: 0.9664, test_f1: 0.5336
 epoch: 42, train_loss: 0.8047, test_loss: 0.9589, test_f1: 0.5402
 epoch: 43, train_loss: 0.7979, test_loss: 0.9750, test_f1: 0.5472
 epoch: 44, train_loss: 0.8091, test_loss: 0.9280, test_f1: 0.5527
 epoch: 45, train_loss: 0.7990, test_loss: 0.9516, test_f1: 0.5459
 epoch: 46, train_loss: 0.7854, test_loss: 0.9909, test_f1: 0.5336
 epoch: 47, train_loss: 0.7800, test_loss: 0.9479, test_f1: 0.5443
 epoch: 48, train_loss: 0.7888, test_loss: 0.9914, test_f1: 0.5259
 epoch: 49, train_loss: 0.7820, test_loss: 0.9553, test_f1: 0.5356
 epoch: 50, train_loss: 0.7815, test_loss: 0.9692, test_f1: 0.5313
 epoch: 51, train_loss: 0.7674, test_loss: 0.9679, test_f1: 0.5448
 epoch: 52, train_loss: 0.7590, test_loss: 0.9578, test_f1: 0.5543
 epoch: 53, train_loss: 0.7608, test_loss: 0.9767, test_f1: 0.5416
 epoch: 54, train_loss: 0.7598, test_loss: 0.9650, test_f1: 0.5294
 epoch: 55, train_loss: 0.7509, test_loss: 0.9854, test_f1: 0.5278
 epoch: 56, train_loss: 0.7530, test_loss: 0.9867, test_f1: 0.5272
 epoch: 57, train_loss: 0.7512, test_loss: 0.9786, test_f1: 0.5578
 epoch: 58, train_loss: 0.7609, test_loss: 1.0039, test_f1: 0.5292
 epoch: 59, train_loss: 0.7504, test_loss: 0.9493, test_f1: 0.5451
 epoch: 60, train_loss: 0.7602, test_loss: 0.9576, test_f1: 0.5432
 epoch: 61, train_loss: 0.7486, test_loss: 0.9863, test_f1: 0.5508
 epoch: 62, train_loss: 0.7509, test_loss: 0.9473, test_f1: 0.5461
 epoch: 63, train_loss: 0.7499, test_loss: 0.9554, test_f1: 0.5300
 epoch: 64, train_loss: 0.7522, test_loss: 0.9737, test_f1: 0.5365
 epoch: 65, train_loss: 0.7568, test_loss: 0.9418, test_f1: 0.5410
 epoch: 66, train_loss: 0.7462, test_loss: 0.9478, test_f1: 0.5531
 epoch: 67, train_loss: 0.7487, test_loss: 0.9536, test_f1: 0.5360
 epoch: 68, train_loss: 0.7468, test_loss: 0.9414, test_f1: 0.5646
 epoch: 69, train_loss: 0.7508, test_loss: 0.9327, test_f1: 0.5548
 epoch: 70, train_loss: 0.7451, test_loss: 0.9282, test_f1: 0.5801
 epoch: 71, train_loss: 0.7506, test_loss: 0.9896, test_f1: 0.5458
 epoch: 72, train_loss: 0.7445, test_loss: 0.9945, test_f1: 0.5545
 epoch: 73, train_loss: 0.7506, test_loss: 0.9634, test_f1: 0.5387
 epoch: 74, train_loss: 0.7355, test_loss: 0.9969, test_f1: 0.5410
 epoch: 75, train_loss: 0.7374, test_loss: 0.9768, test_f1: 0.5482
 epoch: 76, train_loss: 0.7439, test_loss: 1.0045, test_f1: 0.5403
 epoch: 77, train_loss: 0.7282, test_loss: 1.0040, test_f1: 0.5428
 epoch: 78, train_loss: 0.7344, test_loss: 0.9675, test_f1: 0.5519
 epoch: 79, train_loss: 0.7379, test_loss: 0.9373, test_f1: 0.5643
 epoch: 80, train_loss: 0.7219, test_loss: 0.9706, test_f1: 0.5382
 epoch: 81, train_loss: 0.7306, test_loss: 0.9646, test_f1: 0.5518
 epoch: 82, train_loss: 0.7380, test_loss: 1.0034, test_f1: 0.5472
 epoch: 83, train_loss: 0.7247, test_loss: 1.0016, test_f1: 0.5502
 epoch: 84, train_loss: 0.7306, test_loss: 0.9378, test_f1: 0.5648
 epoch: 85, train_loss: 0.7411, test_loss: 0.9714, test_f1: 0.5491
 epoch: 86, train_loss: 0.7338, test_loss: 0.9800, test_f1: 0.5471
 epoch: 87, train_loss: 0.7265, test_loss: 0.9470, test_f1: 0.5762
 epoch: 88, train_loss: 0.7312, test_loss: 1.0108, test_f1: 0.5577
 epoch: 89, train_loss: 0.7212, test_loss: 0.9867, test_f1: 0.5499
 epoch: 90, train_loss: 0.7247, test_loss: 0.9895, test_f1: 0.5436
 epoch: 91, train_loss: 0.7255, test_loss: 0.9564, test_f1: 0.5575
 epoch: 92, train_loss: 0.7101, test_loss: 1.0292, test_f1: 0.5503
 epoch: 93, train_loss: 0.7342, test_loss: 0.9659, test_f1: 0.5771
 epoch: 94, train_loss: 0.7240, test_loss: 0.9528, test_f1: 0.5478
 epoch: 95, train_loss: 0.7289, test_loss: 0.9442, test_f1: 0.5734
 epoch: 96, train_loss: 0.7219, test_loss: 1.0051, test_f1: 0.5577
 epoch: 97, train_loss: 0.7222, test_loss: 0.9535, test_f1: 0.5602
 epoch: 98, train_loss: 0.7275, test_loss: 0.9562, test_f1: 0.5545
 epoch: 99, train_loss: 0.7156, test_loss: 0.9888, test_f1: 0.5519
##################ITERATION #8 ****************************************
 epoch: 0, train_loss: 1.3344, test_loss: 1.1405, test_f1: 0.3731
 epoch: 1, train_loss: 1.1517, test_loss: 1.0681, test_f1: 0.3931
 epoch: 2, train_loss: 1.1093, test_loss: 1.0374, test_f1: 0.4187
 epoch: 3, train_loss: 1.0673, test_loss: 1.0327, test_f1: 0.4598
 epoch: 4, train_loss: 1.0454, test_loss: 0.9955, test_f1: 0.4676
 epoch: 5, train_loss: 1.0311, test_loss: 0.9941, test_f1: 0.5033
 epoch: 6, train_loss: 1.0159, test_loss: 0.9827, test_f1: 0.4745
 epoch: 7, train_loss: 1.0099, test_loss: 0.9742, test_f1: 0.4922
 epoch: 8, train_loss: 0.9972, test_loss: 0.9890, test_f1: 0.4937
 epoch: 9, train_loss: 0.9922, test_loss: 0.9699, test_f1: 0.5146
 epoch: 10, train_loss: 0.9853, test_loss: 0.9521, test_f1: 0.5172
 epoch: 11, train_loss: 0.9712, test_loss: 1.0010, test_f1: 0.4942
 epoch: 12, train_loss: 0.9646, test_loss: 0.9445, test_f1: 0.5019
 epoch: 13, train_loss: 0.9548, test_loss: 0.9247, test_f1: 0.5276
 epoch: 14, train_loss: 0.9630, test_loss: 0.9340, test_f1: 0.5154
 epoch: 15, train_loss: 0.9333, test_loss: 0.9359, test_f1: 0.5061
 epoch: 16, train_loss: 0.9320, test_loss: 0.9275, test_f1: 0.4985
 epoch: 17, train_loss: 0.9321, test_loss: 0.8982, test_f1: 0.5269
 epoch: 18, train_loss: 0.9239, test_loss: 0.9115, test_f1: 0.5177
 epoch: 19, train_loss: 0.9225, test_loss: 0.9177, test_f1: 0.5338
 epoch: 20, train_loss: 0.9140, test_loss: 0.9325, test_f1: 0.5085
 epoch: 21, train_loss: 0.9110, test_loss: 0.9038, test_f1: 0.5250
 epoch: 22, train_loss: 0.9048, test_loss: 0.9071, test_f1: 0.5354
 epoch: 23, train_loss: 0.8974, test_loss: 0.8860, test_f1: 0.5690
 epoch: 24, train_loss: 0.9054, test_loss: 0.8849, test_f1: 0.5489
 epoch: 25, train_loss: 0.8929, test_loss: 0.9027, test_f1: 0.5483
 epoch: 26, train_loss: 0.8844, test_loss: 0.9004, test_f1: 0.5263
 epoch: 27, train_loss: 0.8738, test_loss: 0.8909, test_f1: 0.5617
 epoch: 28, train_loss: 0.8757, test_loss: 0.9165, test_f1: 0.5372
 epoch: 29, train_loss: 0.8648, test_loss: 0.8613, test_f1: 0.5469
 epoch: 30, train_loss: 0.8598, test_loss: 0.8942, test_f1: 0.5441
 epoch: 31, train_loss: 0.8653, test_loss: 0.9124, test_f1: 0.5586
 epoch: 32, train_loss: 0.8665, test_loss: 0.9032, test_f1: 0.5549
 epoch: 33, train_loss: 0.8706, test_loss: 0.9319, test_f1: 0.5388
 epoch: 34, train_loss: 0.8696, test_loss: 0.9348, test_f1: 0.5336
 epoch: 35, train_loss: 0.8687, test_loss: 0.8870, test_f1: 0.5508
 epoch: 36, train_loss: 0.8494, test_loss: 0.8828, test_f1: 0.5491
 epoch: 37, train_loss: 0.8359, test_loss: 0.9364, test_f1: 0.5318
 epoch: 38, train_loss: 0.8416, test_loss: 0.8758, test_f1: 0.5578
 epoch: 39, train_loss: 0.8411, test_loss: 0.8596, test_f1: 0.5631
 epoch: 40, train_loss: 0.8484, test_loss: 0.9087, test_f1: 0.5536
 epoch: 41, train_loss: 0.8434, test_loss: 0.8760, test_f1: 0.5541
 epoch: 42, train_loss: 0.8362, test_loss: 0.9068, test_f1: 0.5597
 epoch: 43, train_loss: 0.8237, test_loss: 0.8801, test_f1: 0.5425
 epoch: 44, train_loss: 0.8391, test_loss: 0.8687, test_f1: 0.5598
 epoch: 45, train_loss: 0.8231, test_loss: 0.8936, test_f1: 0.5526
 epoch: 46, train_loss: 0.8295, test_loss: 0.9200, test_f1: 0.5316
 epoch: 47, train_loss: 0.8240, test_loss: 0.9098, test_f1: 0.5426
 epoch: 48, train_loss: 0.8119, test_loss: 0.8761, test_f1: 0.5647
 epoch: 49, train_loss: 0.8231, test_loss: 0.8952, test_f1: 0.5624
 epoch: 50, train_loss: 0.8172, test_loss: 0.8309, test_f1: 0.5842
 epoch: 51, train_loss: 0.8135, test_loss: 0.8616, test_f1: 0.5533
 epoch: 52, train_loss: 0.8092, test_loss: 0.8842, test_f1: 0.5645
 epoch: 53, train_loss: 0.8005, test_loss: 0.8591, test_f1: 0.5567
 epoch: 54, train_loss: 0.7922, test_loss: 0.8889, test_f1: 0.5474
 epoch: 55, train_loss: 0.7970, test_loss: 0.8633, test_f1: 0.5622
 epoch: 56, train_loss: 0.8026, test_loss: 0.8843, test_f1: 0.5535
 epoch: 57, train_loss: 0.7912, test_loss: 0.8324, test_f1: 0.5509
 epoch: 58, train_loss: 0.7949, test_loss: 0.8793, test_f1: 0.5444
 epoch: 59, train_loss: 0.7963, test_loss: 0.8686, test_f1: 0.5614
 epoch: 60, train_loss: 0.7921, test_loss: 0.8690, test_f1: 0.5661
 epoch: 61, train_loss: 0.7889, test_loss: 0.9079, test_f1: 0.5550
 epoch: 62, train_loss: 0.7863, test_loss: 0.8765, test_f1: 0.5485
 epoch: 63, train_loss: 0.7826, test_loss: 0.8643, test_f1: 0.5707
 epoch: 64, train_loss: 0.7805, test_loss: 0.8937, test_f1: 0.5604
 epoch: 65, train_loss: 0.7900, test_loss: 0.8750, test_f1: 0.5737
 epoch: 66, train_loss: 0.7879, test_loss: 0.8867, test_f1: 0.5605
 epoch: 67, train_loss: 0.7821, test_loss: 0.8775, test_f1: 0.5647
 epoch: 68, train_loss: 0.7790, test_loss: 0.8705, test_f1: 0.5636
 epoch: 69, train_loss: 0.7815, test_loss: 0.8605, test_f1: 0.5641
 epoch: 70, train_loss: 0.7847, test_loss: 0.8700, test_f1: 0.5708
 epoch: 71, train_loss: 0.7748, test_loss: 0.8901, test_f1: 0.5726
 epoch: 72, train_loss: 0.7787, test_loss: 0.8834, test_f1: 0.5644
 epoch: 73, train_loss: 0.7707, test_loss: 0.8843, test_f1: 0.5540
 epoch: 74, train_loss: 0.7694, test_loss: 0.8644, test_f1: 0.5661
 epoch: 75, train_loss: 0.7697, test_loss: 0.9119, test_f1: 0.5407
 epoch: 76, train_loss: 0.7837, test_loss: 0.8664, test_f1: 0.5572
 epoch: 77, train_loss: 0.7780, test_loss: 0.9021, test_f1: 0.5443
 epoch: 78, train_loss: 0.7867, test_loss: 0.8999, test_f1: 0.5355
 epoch: 79, train_loss: 0.7714, test_loss: 0.8712, test_f1: 0.5584
 epoch: 80, train_loss: 0.7768, test_loss: 0.8846, test_f1: 0.5386
 epoch: 81, train_loss: 0.7656, test_loss: 0.8909, test_f1: 0.5716
 epoch: 82, train_loss: 0.7807, test_loss: 0.8712, test_f1: 0.5612
 epoch: 83, train_loss: 0.7741, test_loss: 0.9069, test_f1: 0.5487
 epoch: 84, train_loss: 0.7687, test_loss: 0.9056, test_f1: 0.5438
 epoch: 85, train_loss: 0.7599, test_loss: 0.8686, test_f1: 0.5764
 epoch: 86, train_loss: 0.7694, test_loss: 0.9291, test_f1: 0.5424
 epoch: 87, train_loss: 0.7657, test_loss: 0.8850, test_f1: 0.5418
 epoch: 88, train_loss: 0.7700, test_loss: 0.8937, test_f1: 0.5673
 epoch: 89, train_loss: 0.7589, test_loss: 0.9014, test_f1: 0.5566
 epoch: 90, train_loss: 0.7603, test_loss: 0.8988, test_f1: 0.5562
 epoch: 91, train_loss: 0.7584, test_loss: 0.8978, test_f1: 0.5501
 epoch: 92, train_loss: 0.7574, test_loss: 0.9042, test_f1: 0.5673
 epoch: 93, train_loss: 0.7689, test_loss: 0.8945, test_f1: 0.5572
 epoch: 94, train_loss: 0.7598, test_loss: 0.8839, test_f1: 0.5594
 epoch: 95, train_loss: 0.7605, test_loss: 0.9262, test_f1: 0.5416
 epoch: 96, train_loss: 0.7598, test_loss: 0.8926, test_f1: 0.5629
 epoch: 97, train_loss: 0.7627, test_loss: 0.9021, test_f1: 0.5602
 epoch: 98, train_loss: 0.7623, test_loss: 0.8811, test_f1: 0.5532
 epoch: 99, train_loss: 0.7568, test_loss: 0.9248, test_f1: 0.5472
##################ITERATION #9 ****************************************
 epoch: 0, train_loss: 1.1987, test_loss: 1.1148, test_f1: 0.3494
 epoch: 1, train_loss: 1.0545, test_loss: 0.9877, test_f1: 0.4711
 epoch: 2, train_loss: 1.0195, test_loss: 0.9649, test_f1: 0.4727
 epoch: 3, train_loss: 0.9959, test_loss: 0.9522, test_f1: 0.4867
 epoch: 4, train_loss: 0.9884, test_loss: 0.9749, test_f1: 0.4923
 epoch: 5, train_loss: 0.9681, test_loss: 0.9356, test_f1: 0.4959
 epoch: 6, train_loss: 0.9567, test_loss: 0.9027, test_f1: 0.4941
 epoch: 7, train_loss: 0.9485, test_loss: 0.9057, test_f1: 0.4930
 epoch: 8, train_loss: 0.9452, test_loss: 0.9035, test_f1: 0.5127
 epoch: 9, train_loss: 0.9278, test_loss: 0.9232, test_f1: 0.5083
 epoch: 10, train_loss: 0.9195, test_loss: 0.8879, test_f1: 0.5097
 epoch: 11, train_loss: 0.9215, test_loss: 0.9046, test_f1: 0.5150
 epoch: 12, train_loss: 0.9201, test_loss: 0.9862, test_f1: 0.4970
 epoch: 13, train_loss: 0.9020, test_loss: 0.8767, test_f1: 0.5135
 epoch: 14, train_loss: 0.9006, test_loss: 0.8961, test_f1: 0.5109
 epoch: 15, train_loss: 0.9006, test_loss: 0.8673, test_f1: 0.5312
 epoch: 16, train_loss: 0.8831, test_loss: 0.8615, test_f1: 0.5149
 epoch: 17, train_loss: 0.9018, test_loss: 0.8726, test_f1: 0.5313
 epoch: 18, train_loss: 0.8814, test_loss: 0.8812, test_f1: 0.5284
 epoch: 19, train_loss: 0.8733, test_loss: 0.8792, test_f1: 0.5415
 epoch: 20, train_loss: 0.8663, test_loss: 0.8820, test_f1: 0.5231
 epoch: 21, train_loss: 0.8626, test_loss: 0.8560, test_f1: 0.5372
 epoch: 22, train_loss: 0.8679, test_loss: 0.8592, test_f1: 0.5227
 epoch: 23, train_loss: 0.8532, test_loss: 0.8213, test_f1: 0.5467
 epoch: 24, train_loss: 0.8508, test_loss: 0.8647, test_f1: 0.5275
 epoch: 25, train_loss: 0.8487, test_loss: 0.8747, test_f1: 0.5428
 epoch: 26, train_loss: 0.8458, test_loss: 0.8748, test_f1: 0.5364
 epoch: 27, train_loss: 0.8464, test_loss: 0.8508, test_f1: 0.5297
 epoch: 28, train_loss: 0.8372, test_loss: 0.8479, test_f1: 0.5267
 epoch: 29, train_loss: 0.8338, test_loss: 0.8414, test_f1: 0.5406
 epoch: 30, train_loss: 0.8234, test_loss: 0.8278, test_f1: 0.5530
 epoch: 31, train_loss: 0.8279, test_loss: 0.8643, test_f1: 0.5259
 epoch: 32, train_loss: 0.8208, test_loss: 0.8372, test_f1: 0.5580
 epoch: 33, train_loss: 0.8210, test_loss: 0.9147, test_f1: 0.5134
 epoch: 34, train_loss: 0.8185, test_loss: 0.9200, test_f1: 0.5034
 epoch: 35, train_loss: 0.8192, test_loss: 0.8981, test_f1: 0.5166
 epoch: 36, train_loss: 0.8111, test_loss: 0.8613, test_f1: 0.5365
 epoch: 37, train_loss: 0.8014, test_loss: 0.8812, test_f1: 0.5066
 epoch: 38, train_loss: 0.7929, test_loss: 0.8775, test_f1: 0.5446
 epoch: 39, train_loss: 0.7998, test_loss: 0.8852, test_f1: 0.5241
 epoch: 40, train_loss: 0.7823, test_loss: 0.8832, test_f1: 0.5293
 epoch: 41, train_loss: 0.8031, test_loss: 0.8745, test_f1: 0.5244
 epoch: 42, train_loss: 0.7939, test_loss: 0.8926, test_f1: 0.5244
 epoch: 43, train_loss: 0.7997, test_loss: 1.1241, test_f1: 0.5161
 epoch: 44, train_loss: 0.7977, test_loss: 0.8481, test_f1: 0.5377
 epoch: 45, train_loss: 0.7814, test_loss: 0.8960, test_f1: 0.5416
 epoch: 46, train_loss: 0.7656, test_loss: 0.8763, test_f1: 0.5346
 epoch: 47, train_loss: 0.7741, test_loss: 0.9078, test_f1: 0.5250
 epoch: 48, train_loss: 0.7928, test_loss: 0.8833, test_f1: 0.5339
 epoch: 49, train_loss: 0.7746, test_loss: 0.9354, test_f1: 0.5501
 epoch: 50, train_loss: 0.7746, test_loss: 0.9911, test_f1: 0.5067
 epoch: 51, train_loss: 0.7642, test_loss: 0.8582, test_f1: 0.5437
 epoch: 52, train_loss: 0.7588, test_loss: 0.8663, test_f1: 0.5515
 epoch: 53, train_loss: 0.7557, test_loss: 0.8712, test_f1: 0.5485
 epoch: 54, train_loss: 0.7561, test_loss: 0.8652, test_f1: 0.5507
 epoch: 55, train_loss: 0.7510, test_loss: 0.8501, test_f1: 0.5536
 epoch: 56, train_loss: 0.7486, test_loss: 0.9028, test_f1: 0.5365
 epoch: 57, train_loss: 0.7446, test_loss: 0.8513, test_f1: 0.5614
 epoch: 58, train_loss: 0.7417, test_loss: 0.8632, test_f1: 0.5535
 epoch: 59, train_loss: 0.7499, test_loss: 0.8800, test_f1: 0.5463
 epoch: 60, train_loss: 0.7539, test_loss: 0.8756, test_f1: 0.5470
 epoch: 61, train_loss: 0.7454, test_loss: 0.8794, test_f1: 0.5348
 epoch: 62, train_loss: 0.7430, test_loss: 0.9448, test_f1: 0.5264
 epoch: 63, train_loss: 0.7466, test_loss: 0.8615, test_f1: 0.5576
 epoch: 64, train_loss: 0.7400, test_loss: 0.8654, test_f1: 0.5510
 epoch: 65, train_loss: 0.7378, test_loss: 0.8434, test_f1: 0.5448
 epoch: 66, train_loss: 0.7306, test_loss: 0.8509, test_f1: 0.5507
 epoch: 67, train_loss: 0.7426, test_loss: 0.8693, test_f1: 0.5585
 epoch: 68, train_loss: 0.7330, test_loss: 0.8802, test_f1: 0.5464
 epoch: 69, train_loss: 0.7261, test_loss: 0.8506, test_f1: 0.5594
 epoch: 70, train_loss: 0.7292, test_loss: 0.8539, test_f1: 0.5573
 epoch: 71, train_loss: 0.7348, test_loss: 0.8501, test_f1: 0.5642
 epoch: 72, train_loss: 0.7197, test_loss: 0.8439, test_f1: 0.5604
 epoch: 73, train_loss: 0.7357, test_loss: 0.8725, test_f1: 0.5483
 epoch: 74, train_loss: 0.7326, test_loss: 0.8618, test_f1: 0.5521
 epoch: 75, train_loss: 0.7294, test_loss: 0.8436, test_f1: 0.5590
 epoch: 76, train_loss: 0.7334, test_loss: 0.8665, test_f1: 0.5582
 epoch: 77, train_loss: 0.7251, test_loss: 0.8925, test_f1: 0.5548
 epoch: 78, train_loss: 0.7276, test_loss: 0.8880, test_f1: 0.5605
 epoch: 79, train_loss: 0.7341, test_loss: 0.8984, test_f1: 0.5563
 epoch: 80, train_loss: 0.7299, test_loss: 0.8582, test_f1: 0.5546
 epoch: 81, train_loss: 0.7245, test_loss: 0.8506, test_f1: 0.5572
 epoch: 82, train_loss: 0.7200, test_loss: 0.8858, test_f1: 0.5505
 epoch: 83, train_loss: 0.7303, test_loss: 0.8413, test_f1: 0.5596
 epoch: 84, train_loss: 0.7182, test_loss: 0.8634, test_f1: 0.5615
 epoch: 85, train_loss: 0.7154, test_loss: 0.8699, test_f1: 0.5669
 epoch: 86, train_loss: 0.7200, test_loss: 0.8245, test_f1: 0.5710
 epoch: 87, train_loss: 0.7137, test_loss: 0.8526, test_f1: 0.5690
 epoch: 88, train_loss: 0.7234, test_loss: 0.8677, test_f1: 0.5612
 epoch: 89, train_loss: 0.7166, test_loss: 0.8574, test_f1: 0.5595
 epoch: 90, train_loss: 0.7057, test_loss: 0.8962, test_f1: 0.5529
 epoch: 91, train_loss: 0.7152, test_loss: 0.8668, test_f1: 0.5620
 epoch: 92, train_loss: 0.7087, test_loss: 0.9292, test_f1: 0.5413
 epoch: 93, train_loss: 0.7122, test_loss: 0.8573, test_f1: 0.5578
 epoch: 94, train_loss: 0.7141, test_loss: 0.9005, test_f1: 0.5501
 epoch: 95, train_loss: 0.7055, test_loss: 0.8667, test_f1: 0.5609
 epoch: 96, train_loss: 0.7177, test_loss: 0.8750, test_f1: 0.5709
 epoch: 97, train_loss: 0.7009, test_loss: 0.8745, test_f1: 0.5646
 epoch: 98, train_loss: 0.7012, test_loss: 0.8562, test_f1: 0.5570
 epoch: 99, train_loss: 0.7095, test_loss: 0.8311, test_f1: 0.5648

Training completed in 771.01 seconds
Best F1: 0.5842 at epoch 50
Mean F1 across iterations: 0.5586  0.0177
========================FINAL RESULTS================================
FEGIN weighted F1: 0.5842  0.0177
python main.py --data ltspice_examples --representation component_pin --model FEGIN --layers 3 --hiddens 16 --batch_size 64 --lr 0.001 --emb_size 250 --epochs 100 --save_appendix component_pin_L3_H16_BS64_LR0.001_E250 --no_val
-----



STDERR:
  File "main.py", line 370, in <module>
    main()
  File "main.py", line 254, in main
    dataset = dataset_class(
  File "/home/philip/projects/llm_inference_code_repo/Circuit-Completion-Using-GNNs/component_classification_with_link_prediction_head/evaluation/FEGIN/kernel/circuit_datasets.py", line 15, in __init__
    self.data, self.slices = torch.load(self.processed_paths[0])
  File "/home/philip/.local/lib/python3.8/site-packages/torch/serialization.py", line 1040, in load
    warnings.warn(
  File "/usr/lib/python3.8/warnings.py", line 109, in _showwarnmsg
    sw(msg.message, msg.category, msg.filename, msg.lineno,
  File "main.py", line 47, in warn_with_traceback
    traceback.print_stack(file=log)
/home/philip/projects/llm_inference_code_repo/Circuit-Completion-Using-GNNs/component_classification_with_link_prediction_head/evaluation/FEGIN/kernel/circuit_datasets.py:15: FutureWarning: You are using `torch.load` with `weights_only=False` (the current default value), which uses the default pickle module implicitly. It is possible to construct malicious pickle data which will execute arbitrary code during unpickling (See https://github.com/pytorch/pytorch/blob/main/SECURITY.md#untrusted-models for more details). In a future release, the default value for `weights_only` will be flipped to `True`. This limits the functions that could be executed during unpickling. Arbitrary objects will no longer be allowed to be loaded via this mode unless they are explicitly allowlisted by the user via `torch.serialization.add_safe_globals`. We recommend you start setting `weights_only=True` for any use case where you don't have full control of the loaded file. Please open an issue on GitHub for any issues related to this experimental feature.
  self.data, self.slices = torch.load(self.processed_paths[0])
