STDOUT:
Results will be saved in /home/philip/projects/ltspice_examples_code_repo/Circuit-Completion-Using-GNNs/component_classification_with_link_prediction_head/evaluation/FEGIN/results/model_FEGIN_dataset_ltspice_demos
Command line input: python main.py --data ltspice_demos --representation component_pin_net --model FEGIN --layers 4 --hiddens 64 --batch_size 64 --lr 0.001 --emb_size 128 --epochs 100 --save_appendix component_pin_net_L4_H64_BS64_LR0.001_E128 --no_val
 is saved.
-----
ltspice_demos - FEGIN
Using 4 layers, 64 hidden units, h = 2
Loading component_pin_net representation dataset
ENTERED
Training FEGIN on component_pin_net representation
Train: 1565, Test: 383
##################ITERATION #0 ****************************************
 epoch: 0, train_loss: 1.2782, test_loss: 1.3049, test_f1: 0.3232
 epoch: 1, train_loss: 1.0883, test_loss: 1.1954, test_f1: 0.4350
 epoch: 2, train_loss: 1.0238, test_loss: 1.1171, test_f1: 0.4641
 epoch: 3, train_loss: 0.9930, test_loss: 1.0780, test_f1: 0.4346
 epoch: 4, train_loss: 0.9655, test_loss: 1.0592, test_f1: 0.4662
 epoch: 5, train_loss: 0.9511, test_loss: 1.0872, test_f1: 0.4811
 epoch: 6, train_loss: 0.9487, test_loss: 1.1055, test_f1: 0.4685
 epoch: 7, train_loss: 0.9248, test_loss: 1.1999, test_f1: 0.4861
 epoch: 8, train_loss: 0.9036, test_loss: 1.0210, test_f1: 0.5273
 epoch: 9, train_loss: 0.9021, test_loss: 1.0653, test_f1: 0.5564
 epoch: 10, train_loss: 0.8771, test_loss: 1.1353, test_f1: 0.5133
 epoch: 11, train_loss: 0.8625, test_loss: 1.0065, test_f1: 0.5636
 epoch: 12, train_loss: 0.8368, test_loss: 1.0319, test_f1: 0.5456
 epoch: 13, train_loss: 0.8195, test_loss: 1.0058, test_f1: 0.5655
 epoch: 14, train_loss: 0.8073, test_loss: 1.0293, test_f1: 0.5430
 epoch: 15, train_loss: 0.7776, test_loss: 1.1533, test_f1: 0.5547
 epoch: 16, train_loss: 0.7758, test_loss: 1.0590, test_f1: 0.5437
 epoch: 17, train_loss: 0.7269, test_loss: 1.0365, test_f1: 0.6003
 epoch: 18, train_loss: 0.6949, test_loss: 1.1081, test_f1: 0.5674
 epoch: 19, train_loss: 0.6978, test_loss: 1.2526, test_f1: 0.5448
 epoch: 20, train_loss: 0.6921, test_loss: 1.0727, test_f1: 0.5499
 epoch: 21, train_loss: 0.6656, test_loss: 1.0825, test_f1: 0.5964
 epoch: 22, train_loss: 0.6202, test_loss: 1.0963, test_f1: 0.5760
 epoch: 23, train_loss: 0.5973, test_loss: 1.0485, test_f1: 0.6087
 epoch: 24, train_loss: 0.5962, test_loss: 1.0727, test_f1: 0.6194
 epoch: 25, train_loss: 0.5810, test_loss: 1.0463, test_f1: 0.6231
 epoch: 26, train_loss: 0.5689, test_loss: 1.3231, test_f1: 0.5720
 epoch: 27, train_loss: 0.5721, test_loss: 1.2027, test_f1: 0.5931
 epoch: 28, train_loss: 0.5519, test_loss: 1.2810, test_f1: 0.6070
 epoch: 29, train_loss: 0.5299, test_loss: 1.2002, test_f1: 0.6377
 epoch: 30, train_loss: 0.5259, test_loss: 1.0883, test_f1: 0.6182
 epoch: 31, train_loss: 0.5142, test_loss: 1.2453, test_f1: 0.5774
 epoch: 32, train_loss: 0.4959, test_loss: 1.2031, test_f1: 0.6273
 epoch: 33, train_loss: 0.5108, test_loss: 1.2690, test_f1: 0.6209
 epoch: 34, train_loss: 0.4931, test_loss: 1.1125, test_f1: 0.6475
 epoch: 35, train_loss: 0.4424, test_loss: 1.3602, test_f1: 0.6179
 epoch: 36, train_loss: 0.4258, test_loss: 1.5988, test_f1: 0.5987
 epoch: 37, train_loss: 0.4354, test_loss: 1.4040, test_f1: 0.5910
 epoch: 38, train_loss: 0.4319, test_loss: 1.3658, test_f1: 0.5967
 epoch: 39, train_loss: 0.3786, test_loss: 1.3558, test_f1: 0.6429
 epoch: 40, train_loss: 0.4190, test_loss: 1.2189, test_f1: 0.6477
 epoch: 41, train_loss: 0.3917, test_loss: 1.5097, test_f1: 0.5894
 epoch: 42, train_loss: 0.3833, test_loss: 1.5254, test_f1: 0.6093
 epoch: 43, train_loss: 0.4097, test_loss: 1.4492, test_f1: 0.6297
 epoch: 44, train_loss: 0.3699, test_loss: 1.6733, test_f1: 0.5760
 epoch: 45, train_loss: 0.3686, test_loss: 1.5948, test_f1: 0.6231
 epoch: 46, train_loss: 0.3601, test_loss: 1.5781, test_f1: 0.6173
 epoch: 47, train_loss: 0.3494, test_loss: 1.4906, test_f1: 0.6193
 epoch: 48, train_loss: 0.3175, test_loss: 1.8177, test_f1: 0.5859
 epoch: 49, train_loss: 0.3089, test_loss: 1.7477, test_f1: 0.5976
 epoch: 50, train_loss: 0.3588, test_loss: 1.6507, test_f1: 0.5948
 epoch: 51, train_loss: 0.2849, test_loss: 1.7159, test_f1: 0.6298
 epoch: 52, train_loss: 0.2494, test_loss: 1.8612, test_f1: 0.6174
 epoch: 53, train_loss: 0.2488, test_loss: 1.8406, test_f1: 0.6379
 epoch: 54, train_loss: 0.2239, test_loss: 1.8852, test_f1: 0.6121
 epoch: 55, train_loss: 0.2388, test_loss: 1.8505, test_f1: 0.6085
 epoch: 56, train_loss: 0.2200, test_loss: 1.9026, test_f1: 0.6537
 epoch: 57, train_loss: 0.2326, test_loss: 2.0482, test_f1: 0.6120
 epoch: 58, train_loss: 0.2237, test_loss: 2.1596, test_f1: 0.6082
 epoch: 59, train_loss: 0.2434, test_loss: 2.1613, test_f1: 0.5964
 epoch: 60, train_loss: 0.2288, test_loss: 2.1084, test_f1: 0.6105
 epoch: 61, train_loss: 0.2078, test_loss: 2.2706, test_f1: 0.5942
 epoch: 62, train_loss: 0.2047, test_loss: 2.2070, test_f1: 0.5972
 epoch: 63, train_loss: 0.1984, test_loss: 2.0658, test_f1: 0.6424
 epoch: 64, train_loss: 0.1796, test_loss: 2.3089, test_f1: 0.6337
 epoch: 65, train_loss: 0.1816, test_loss: 2.0688, test_f1: 0.6502
 epoch: 66, train_loss: 0.1897, test_loss: 2.3670, test_f1: 0.5935
 epoch: 67, train_loss: 0.1764, test_loss: 2.2717, test_f1: 0.6194
 epoch: 68, train_loss: 0.1729, test_loss: 2.3635, test_f1: 0.6091
 epoch: 69, train_loss: 0.2024, test_loss: 2.6451, test_f1: 0.5947
 epoch: 70, train_loss: 0.2077, test_loss: 2.3424, test_f1: 0.6396
 epoch: 71, train_loss: 0.1754, test_loss: 2.4330, test_f1: 0.6131
 epoch: 72, train_loss: 0.1664, test_loss: 2.4519, test_f1: 0.6399
 epoch: 73, train_loss: 0.1847, test_loss: 2.6156, test_f1: 0.5934
 epoch: 74, train_loss: 0.1699, test_loss: 2.4376, test_f1: 0.6380
 epoch: 75, train_loss: 0.1541, test_loss: 2.6643, test_f1: 0.6049
 epoch: 76, train_loss: 0.1496, test_loss: 2.3752, test_f1: 0.6342
 epoch: 77, train_loss: 0.1362, test_loss: 2.8859, test_f1: 0.6068
 epoch: 78, train_loss: 0.1366, test_loss: 2.7519, test_f1: 0.6215
 epoch: 79, train_loss: 0.1519, test_loss: 2.5683, test_f1: 0.6163
 epoch: 80, train_loss: 0.1542, test_loss: 3.1513, test_f1: 0.5641
 epoch: 81, train_loss: 0.1576, test_loss: 2.8225, test_f1: 0.6035
 epoch: 82, train_loss: 0.1497, test_loss: 2.9002, test_f1: 0.6070
 epoch: 83, train_loss: 0.1319, test_loss: 2.6482, test_f1: 0.5994
 epoch: 84, train_loss: 0.1560, test_loss: 2.7247, test_f1: 0.6314
 epoch: 85, train_loss: 0.1837, test_loss: 2.8084, test_f1: 0.6215
 epoch: 86, train_loss: 0.1325, test_loss: 2.7746, test_f1: 0.6139
 epoch: 87, train_loss: 0.1341, test_loss: 2.6692, test_f1: 0.6349
 epoch: 88, train_loss: 0.1393, test_loss: 2.9805, test_f1: 0.5852
 epoch: 89, train_loss: 0.1271, test_loss: 2.8266, test_f1: 0.6273
 epoch: 90, train_loss: 0.1264, test_loss: 3.2411, test_f1: 0.5809
 epoch: 91, train_loss: 0.1435, test_loss: 2.9385, test_f1: 0.5989
 epoch: 92, train_loss: 0.1191, test_loss: 3.0126, test_f1: 0.6226
 epoch: 93, train_loss: 0.1502, test_loss: 3.1299, test_f1: 0.6065
 epoch: 94, train_loss: 0.1549, test_loss: 3.1433, test_f1: 0.5788
 epoch: 95, train_loss: 0.1404, test_loss: 3.3892, test_f1: 0.5823
 epoch: 96, train_loss: 0.1327, test_loss: 3.1418, test_f1: 0.5805
 epoch: 97, train_loss: 0.1277, test_loss: 3.1172, test_f1: 0.6093
 epoch: 98, train_loss: 0.1204, test_loss: 3.0860, test_f1: 0.5957
 epoch: 99, train_loss: 0.1108, test_loss: 3.0934, test_f1: 0.5996
##################ITERATION #1 ****************************************
 epoch: 0, train_loss: 1.1182, test_loss: 2.3563, test_f1: 0.0301
 epoch: 1, train_loss: 0.9903, test_loss: 2.5114, test_f1: 0.1054
 epoch: 2, train_loss: 0.9612, test_loss: 1.1439, test_f1: 0.4388
 epoch: 3, train_loss: 0.9278, test_loss: 1.0314, test_f1: 0.5524
 epoch: 4, train_loss: 0.8956, test_loss: 1.0377, test_f1: 0.5582
 epoch: 5, train_loss: 0.8820, test_loss: 1.0084, test_f1: 0.5586
 epoch: 6, train_loss: 0.8427, test_loss: 0.9995, test_f1: 0.5173
 epoch: 7, train_loss: 0.8470, test_loss: 1.0030, test_f1: 0.5564
 epoch: 8, train_loss: 0.8114, test_loss: 1.0540, test_f1: 0.5735
 epoch: 9, train_loss: 0.7827, test_loss: 1.1640, test_f1: 0.5138
 epoch: 10, train_loss: 0.7900, test_loss: 1.0337, test_f1: 0.5609
 epoch: 11, train_loss: 0.7502, test_loss: 1.0721, test_f1: 0.5711
 epoch: 12, train_loss: 0.7417, test_loss: 0.9816, test_f1: 0.6335
 epoch: 13, train_loss: 0.7185, test_loss: 0.9821, test_f1: 0.6007
 epoch: 14, train_loss: 0.6960, test_loss: 1.1186, test_f1: 0.6054
 epoch: 15, train_loss: 0.6872, test_loss: 1.0048, test_f1: 0.5893
 epoch: 16, train_loss: 0.6718, test_loss: 1.0135, test_f1: 0.6293
 epoch: 17, train_loss: 0.6489, test_loss: 1.1059, test_f1: 0.5862
 epoch: 18, train_loss: 0.6384, test_loss: 1.0904, test_f1: 0.6232
 epoch: 19, train_loss: 0.6345, test_loss: 0.9713, test_f1: 0.6322
 epoch: 20, train_loss: 0.6270, test_loss: 1.0555, test_f1: 0.5942
 epoch: 21, train_loss: 0.5865, test_loss: 1.0134, test_f1: 0.6276
 epoch: 22, train_loss: 0.5756, test_loss: 1.0996, test_f1: 0.6269
 epoch: 23, train_loss: 0.5715, test_loss: 1.1458, test_f1: 0.5644
 epoch: 24, train_loss: 0.5624, test_loss: 1.1521, test_f1: 0.6108
 epoch: 25, train_loss: 0.5228, test_loss: 1.1438, test_f1: 0.6464
 epoch: 26, train_loss: 0.5410, test_loss: 1.0869, test_f1: 0.6564
 epoch: 27, train_loss: 0.5140, test_loss: 1.2101, test_f1: 0.6001
 epoch: 28, train_loss: 0.5038, test_loss: 1.1840, test_f1: 0.6591
 epoch: 29, train_loss: 0.4914, test_loss: 1.1650, test_f1: 0.6540
 epoch: 30, train_loss: 0.4917, test_loss: 1.2508, test_f1: 0.6420
 epoch: 31, train_loss: 0.4816, test_loss: 1.2389, test_f1: 0.6166
 epoch: 32, train_loss: 0.4734, test_loss: 1.3576, test_f1: 0.5766
 epoch: 33, train_loss: 0.4929, test_loss: 1.2457, test_f1: 0.6430
 epoch: 34, train_loss: 0.4604, test_loss: 1.2128, test_f1: 0.6299
 epoch: 35, train_loss: 0.4480, test_loss: 1.2729, test_f1: 0.5840
 epoch: 36, train_loss: 0.4454, test_loss: 1.2754, test_f1: 0.6340
 epoch: 37, train_loss: 0.4595, test_loss: 1.3323, test_f1: 0.6455
 epoch: 38, train_loss: 0.4298, test_loss: 1.3738, test_f1: 0.6049
 epoch: 39, train_loss: 0.4137, test_loss: 1.2619, test_f1: 0.6613
 epoch: 40, train_loss: 0.4259, test_loss: 1.5851, test_f1: 0.6073
 epoch: 41, train_loss: 0.3920, test_loss: 1.3426, test_f1: 0.6220
 epoch: 42, train_loss: 0.4069, test_loss: 1.3985, test_f1: 0.6407
 epoch: 43, train_loss: 0.3712, test_loss: 1.4730, test_f1: 0.6268
 epoch: 44, train_loss: 0.3839, test_loss: 1.4819, test_f1: 0.6519
 epoch: 45, train_loss: 0.3804, test_loss: 1.4671, test_f1: 0.6145
 epoch: 46, train_loss: 0.3837, test_loss: 1.6366, test_f1: 0.6076
 epoch: 47, train_loss: 0.3532, test_loss: 1.6564, test_f1: 0.5988
 epoch: 48, train_loss: 0.3500, test_loss: 1.4779, test_f1: 0.6452
 epoch: 49, train_loss: 0.3483, test_loss: 2.0450, test_f1: 0.5848
 epoch: 50, train_loss: 0.3245, test_loss: 1.6358, test_f1: 0.5797
 epoch: 51, train_loss: 0.2868, test_loss: 1.7107, test_f1: 0.6163
 epoch: 52, train_loss: 0.2764, test_loss: 1.8063, test_f1: 0.6296
 epoch: 53, train_loss: 0.2814, test_loss: 1.7531, test_f1: 0.6277
 epoch: 54, train_loss: 0.2607, test_loss: 1.7896, test_f1: 0.6266
 epoch: 55, train_loss: 0.2566, test_loss: 1.7776, test_f1: 0.6263
 epoch: 56, train_loss: 0.2380, test_loss: 1.7770, test_f1: 0.6578
 epoch: 57, train_loss: 0.2313, test_loss: 1.8307, test_f1: 0.6527
 epoch: 58, train_loss: 0.2370, test_loss: 1.7814, test_f1: 0.6508
 epoch: 59, train_loss: 0.2234, test_loss: 1.9076, test_f1: 0.6090
 epoch: 60, train_loss: 0.2095, test_loss: 1.9884, test_f1: 0.6488
 epoch: 61, train_loss: 0.2093, test_loss: 1.9680, test_f1: 0.6174
 epoch: 62, train_loss: 0.2133, test_loss: 1.9779, test_f1: 0.6317
 epoch: 63, train_loss: 0.2077, test_loss: 1.9688, test_f1: 0.6503
 epoch: 64, train_loss: 0.2145, test_loss: 2.1811, test_f1: 0.6197
 epoch: 65, train_loss: 0.2097, test_loss: 2.0982, test_f1: 0.6335
 epoch: 66, train_loss: 0.1880, test_loss: 2.1605, test_f1: 0.6428
 epoch: 67, train_loss: 0.2100, test_loss: 2.2521, test_f1: 0.6329
 epoch: 68, train_loss: 0.2145, test_loss: 2.0658, test_f1: 0.6263
 epoch: 69, train_loss: 0.1956, test_loss: 1.9969, test_f1: 0.6452
 epoch: 70, train_loss: 0.1745, test_loss: 1.9922, test_f1: 0.6520
 epoch: 71, train_loss: 0.1703, test_loss: 2.2783, test_f1: 0.6262
 epoch: 72, train_loss: 0.1816, test_loss: 2.2096, test_f1: 0.6411
 epoch: 73, train_loss: 0.1851, test_loss: 2.2495, test_f1: 0.6346
 epoch: 74, train_loss: 0.1822, test_loss: 2.1253, test_f1: 0.6464
 epoch: 75, train_loss: 0.1511, test_loss: 2.2790, test_f1: 0.6400
 epoch: 76, train_loss: 0.1934, test_loss: 2.1516, test_f1: 0.6267
 epoch: 77, train_loss: 0.1560, test_loss: 2.3133, test_f1: 0.6252
 epoch: 78, train_loss: 0.1463, test_loss: 2.3640, test_f1: 0.6169
 epoch: 79, train_loss: 0.1466, test_loss: 2.2966, test_f1: 0.6319
 epoch: 80, train_loss: 0.1536, test_loss: 2.3766, test_f1: 0.6329
 epoch: 81, train_loss: 0.1482, test_loss: 2.4943, test_f1: 0.6375
 epoch: 82, train_loss: 0.1792, test_loss: 2.2233, test_f1: 0.6530
 epoch: 83, train_loss: 0.1677, test_loss: 2.4154, test_f1: 0.6146
 epoch: 84, train_loss: 0.1594, test_loss: 2.3688, test_f1: 0.6478
 epoch: 85, train_loss: 0.1332, test_loss: 2.6075, test_f1: 0.6154
 epoch: 86, train_loss: 0.1468, test_loss: 2.5891, test_f1: 0.6441
 epoch: 87, train_loss: 0.1384, test_loss: 2.4660, test_f1: 0.6406
 epoch: 88, train_loss: 0.1278, test_loss: 2.6716, test_f1: 0.6221
 epoch: 89, train_loss: 0.1182, test_loss: 2.5390, test_f1: 0.6261
 epoch: 90, train_loss: 0.1514, test_loss: 2.4424, test_f1: 0.6481
 epoch: 91, train_loss: 0.1385, test_loss: 2.5409, test_f1: 0.6380
 epoch: 92, train_loss: 0.1437, test_loss: 2.5565, test_f1: 0.6799
 epoch: 93, train_loss: 0.1299, test_loss: 2.6209, test_f1: 0.6243
 epoch: 94, train_loss: 0.1110, test_loss: 2.5596, test_f1: 0.6608
 epoch: 95, train_loss: 0.1340, test_loss: 2.8098, test_f1: 0.6063
 epoch: 96, train_loss: 0.1506, test_loss: 2.8790, test_f1: 0.6360
 epoch: 97, train_loss: 0.1542, test_loss: 2.6753, test_f1: 0.6091
 epoch: 98, train_loss: 0.1197, test_loss: 2.8369, test_f1: 0.6144
 epoch: 99, train_loss: 0.1047, test_loss: 2.9706, test_f1: 0.6310
##################ITERATION #2 ****************************************
 epoch: 0, train_loss: 1.1504, test_loss: 1.3269, test_f1: 0.1365
 epoch: 1, train_loss: 0.9765, test_loss: 1.1390, test_f1: 0.4520
 epoch: 2, train_loss: 0.9347, test_loss: 1.0237, test_f1: 0.5149
 epoch: 3, train_loss: 0.8844, test_loss: 1.0124, test_f1: 0.5904
 epoch: 4, train_loss: 0.8484, test_loss: 1.0195, test_f1: 0.5531
 epoch: 5, train_loss: 0.8478, test_loss: 1.0408, test_f1: 0.5642
 epoch: 6, train_loss: 0.8068, test_loss: 1.0560, test_f1: 0.5473
 epoch: 7, train_loss: 0.7763, test_loss: 1.0085, test_f1: 0.5695
 epoch: 8, train_loss: 0.7711, test_loss: 1.0414, test_f1: 0.5877
 epoch: 9, train_loss: 0.7441, test_loss: 1.1190, test_f1: 0.5133
 epoch: 10, train_loss: 0.7139, test_loss: 1.0678, test_f1: 0.5735
 epoch: 11, train_loss: 0.7067, test_loss: 1.0388, test_f1: 0.6023
 epoch: 12, train_loss: 0.6863, test_loss: 1.0710, test_f1: 0.5761
 epoch: 13, train_loss: 0.6846, test_loss: 1.0179, test_f1: 0.5935
 epoch: 14, train_loss: 0.6499, test_loss: 1.1170, test_f1: 0.5907
 epoch: 15, train_loss: 0.6138, test_loss: 1.0946, test_f1: 0.5342
 epoch: 16, train_loss: 0.5831, test_loss: 1.1592, test_f1: 0.6095
 epoch: 17, train_loss: 0.6140, test_loss: 1.1859, test_f1: 0.5731
 epoch: 18, train_loss: 0.5825, test_loss: 1.3814, test_f1: 0.5232
 epoch: 19, train_loss: 0.5951, test_loss: 1.1652, test_f1: 0.5766
 epoch: 20, train_loss: 0.5557, test_loss: 1.2107, test_f1: 0.5996
 epoch: 21, train_loss: 0.6111, test_loss: 1.1886, test_f1: 0.5869
 epoch: 22, train_loss: 0.5724, test_loss: 1.2284, test_f1: 0.5856
 epoch: 23, train_loss: 0.5367, test_loss: 1.1840, test_f1: 0.5825
 epoch: 24, train_loss: 0.5305, test_loss: 1.3100, test_f1: 0.6225
 epoch: 25, train_loss: 0.5314, test_loss: 1.2897, test_f1: 0.6117
 epoch: 26, train_loss: 0.4941, test_loss: 1.2905, test_f1: 0.6023
 epoch: 27, train_loss: 0.5052, test_loss: 1.3231, test_f1: 0.6086
 epoch: 28, train_loss: 0.4976, test_loss: 1.3861, test_f1: 0.5920
 epoch: 29, train_loss: 0.4572, test_loss: 1.4518, test_f1: 0.5926
 epoch: 30, train_loss: 0.4367, test_loss: 1.5109, test_f1: 0.5671
 epoch: 31, train_loss: 0.4974, test_loss: 1.3570, test_f1: 0.6158
 epoch: 32, train_loss: 0.4523, test_loss: 1.4277, test_f1: 0.5856
 epoch: 33, train_loss: 0.4242, test_loss: 1.6429, test_f1: 0.5768
 epoch: 34, train_loss: 0.4213, test_loss: 1.5741, test_f1: 0.6052
 epoch: 35, train_loss: 0.4122, test_loss: 1.4435, test_f1: 0.5871
 epoch: 36, train_loss: 0.4163, test_loss: 1.6086, test_f1: 0.5865
 epoch: 37, train_loss: 0.4040, test_loss: 1.5926, test_f1: 0.6034
 epoch: 38, train_loss: 0.3797, test_loss: 1.5966, test_f1: 0.6116
 epoch: 39, train_loss: 0.3781, test_loss: 1.6291, test_f1: 0.6085
 epoch: 40, train_loss: 0.4093, test_loss: 1.6397, test_f1: 0.5903
 epoch: 41, train_loss: 0.3654, test_loss: 1.9345, test_f1: 0.5559
 epoch: 42, train_loss: 0.3400, test_loss: 1.7542, test_f1: 0.5781
 epoch: 43, train_loss: 0.3448, test_loss: 1.8832, test_f1: 0.6001
 epoch: 44, train_loss: 0.3569, test_loss: 1.7121, test_f1: 0.5871
 epoch: 45, train_loss: 0.3459, test_loss: 2.1415, test_f1: 0.5457
 epoch: 46, train_loss: 0.3244, test_loss: 1.7730, test_f1: 0.6053
 epoch: 47, train_loss: 0.3149, test_loss: 1.8620, test_f1: 0.5989
 epoch: 48, train_loss: 0.3251, test_loss: 1.7922, test_f1: 0.5733
 epoch: 49, train_loss: 0.3130, test_loss: 1.9375, test_f1: 0.6181
 epoch: 50, train_loss: 0.3348, test_loss: 1.8547, test_f1: 0.6199
 epoch: 51, train_loss: 0.2588, test_loss: 2.0441, test_f1: 0.6012
 epoch: 52, train_loss: 0.2462, test_loss: 2.1231, test_f1: 0.5962
 epoch: 53, train_loss: 0.2209, test_loss: 2.1679, test_f1: 0.5968
 epoch: 54, train_loss: 0.2387, test_loss: 2.3287, test_f1: 0.5725
 epoch: 55, train_loss: 0.2222, test_loss: 2.2707, test_f1: 0.5660
 epoch: 56, train_loss: 0.2387, test_loss: 2.3580, test_f1: 0.5725
 epoch: 57, train_loss: 0.1964, test_loss: 2.3322, test_f1: 0.5752
 epoch: 58, train_loss: 0.1977, test_loss: 2.5384, test_f1: 0.5944
 epoch: 59, train_loss: 0.2005, test_loss: 2.6268, test_f1: 0.5733
 epoch: 60, train_loss: 0.2080, test_loss: 2.3677, test_f1: 0.6119
 epoch: 61, train_loss: 0.2068, test_loss: 2.2284, test_f1: 0.6106
 epoch: 62, train_loss: 0.2092, test_loss: 2.5410, test_f1: 0.6062
 epoch: 63, train_loss: 0.2141, test_loss: 2.4416, test_f1: 0.5944
 epoch: 64, train_loss: 0.1716, test_loss: 2.5278, test_f1: 0.5791
 epoch: 65, train_loss: 0.1947, test_loss: 2.5158, test_f1: 0.5988
 epoch: 66, train_loss: 0.1693, test_loss: 2.6055, test_f1: 0.5772
 epoch: 67, train_loss: 0.1657, test_loss: 2.4845, test_f1: 0.5996
 epoch: 68, train_loss: 0.1591, test_loss: 2.7840, test_f1: 0.5788
 epoch: 69, train_loss: 0.1549, test_loss: 2.6086, test_f1: 0.5863
 epoch: 70, train_loss: 0.1656, test_loss: 2.8988, test_f1: 0.5476
 epoch: 71, train_loss: 0.1709, test_loss: 2.8532, test_f1: 0.5916
 epoch: 72, train_loss: 0.1534, test_loss: 2.6625, test_f1: 0.5911
 epoch: 73, train_loss: 0.1634, test_loss: 2.7733, test_f1: 0.6021
 epoch: 74, train_loss: 0.1493, test_loss: 2.7626, test_f1: 0.5957
 epoch: 75, train_loss: 0.1701, test_loss: 3.1136, test_f1: 0.5366
 epoch: 76, train_loss: 0.1805, test_loss: 2.7363, test_f1: 0.5979
 epoch: 77, train_loss: 0.1946, test_loss: 2.8410, test_f1: 0.5982
 epoch: 78, train_loss: 0.2012, test_loss: 2.6004, test_f1: 0.6074
 epoch: 79, train_loss: 0.1584, test_loss: 2.9608, test_f1: 0.5554
 epoch: 80, train_loss: 0.1842, test_loss: 3.0495, test_f1: 0.5509
 epoch: 81, train_loss: 0.1388, test_loss: 2.8245, test_f1: 0.5692
 epoch: 82, train_loss: 0.1408, test_loss: 2.7987, test_f1: 0.6006
 epoch: 83, train_loss: 0.1381, test_loss: 2.8807, test_f1: 0.5793
 epoch: 84, train_loss: 0.1389, test_loss: 3.1416, test_f1: 0.5538
 epoch: 85, train_loss: 0.1396, test_loss: 3.0447, test_f1: 0.5675
 epoch: 86, train_loss: 0.1510, test_loss: 3.0798, test_f1: 0.5734
 epoch: 87, train_loss: 0.1438, test_loss: 3.0873, test_f1: 0.5860
 epoch: 88, train_loss: 0.1154, test_loss: 3.2833, test_f1: 0.5507
 epoch: 89, train_loss: 0.1244, test_loss: 3.3245, test_f1: 0.5665
 epoch: 90, train_loss: 0.1130, test_loss: 3.2912, test_f1: 0.5559
 epoch: 91, train_loss: 0.1222, test_loss: 2.9776, test_f1: 0.5896
 epoch: 92, train_loss: 0.1304, test_loss: 3.0141, test_f1: 0.5827
 epoch: 93, train_loss: 0.1480, test_loss: 3.4301, test_f1: 0.5555
 epoch: 94, train_loss: 0.1443, test_loss: 3.4353, test_f1: 0.5336
 epoch: 95, train_loss: 0.1533, test_loss: 3.0671, test_f1: 0.5858
 epoch: 96, train_loss: 0.1299, test_loss: 3.2526, test_f1: 0.5914
 epoch: 97, train_loss: 0.1876, test_loss: 3.3927, test_f1: 0.5772
 epoch: 98, train_loss: 0.1481, test_loss: 2.9883, test_f1: 0.6320
 epoch: 99, train_loss: 0.1355, test_loss: 3.5885, test_f1: 0.5644
##################ITERATION #3 ****************************************
 epoch: 0, train_loss: 1.1515, test_loss: 1.2689, test_f1: 0.2281
 epoch: 1, train_loss: 0.9830, test_loss: 1.0999, test_f1: 0.5331
 epoch: 2, train_loss: 0.9330, test_loss: 1.0251, test_f1: 0.5658
 epoch: 3, train_loss: 0.8889, test_loss: 1.0366, test_f1: 0.5310
 epoch: 4, train_loss: 0.8627, test_loss: 1.0425, test_f1: 0.5060
 epoch: 5, train_loss: 0.8219, test_loss: 1.0293, test_f1: 0.5781
 epoch: 6, train_loss: 0.8029, test_loss: 1.0248, test_f1: 0.5913
 epoch: 7, train_loss: 0.7772, test_loss: 1.0225, test_f1: 0.5769
 epoch: 8, train_loss: 0.7471, test_loss: 1.0576, test_f1: 0.6134
 epoch: 9, train_loss: 0.7323, test_loss: 1.1149, test_f1: 0.5930
 epoch: 10, train_loss: 0.7128, test_loss: 1.0125, test_f1: 0.6070
 epoch: 11, train_loss: 0.6954, test_loss: 1.1268, test_f1: 0.6056
 epoch: 12, train_loss: 0.6586, test_loss: 1.1530, test_f1: 0.6087
 epoch: 13, train_loss: 0.6606, test_loss: 1.1904, test_f1: 0.6016
 epoch: 14, train_loss: 0.6192, test_loss: 1.2315, test_f1: 0.6079
 epoch: 15, train_loss: 0.5916, test_loss: 1.1623, test_f1: 0.6456
 epoch: 16, train_loss: 0.5942, test_loss: 1.3718, test_f1: 0.5901
 epoch: 17, train_loss: 0.6070, test_loss: 1.2810, test_f1: 0.5968
 epoch: 18, train_loss: 0.5724, test_loss: 1.3665, test_f1: 0.6239
 epoch: 19, train_loss: 0.5561, test_loss: 1.2542, test_f1: 0.5929
 epoch: 20, train_loss: 0.5800, test_loss: 1.3090, test_f1: 0.6338
 epoch: 21, train_loss: 0.5367, test_loss: 1.3174, test_f1: 0.6099
 epoch: 22, train_loss: 0.5156, test_loss: 1.4432, test_f1: 0.6434
 epoch: 23, train_loss: 0.5104, test_loss: 1.5804, test_f1: 0.5951
 epoch: 24, train_loss: 0.5081, test_loss: 1.3937, test_f1: 0.6368
 epoch: 25, train_loss: 0.4977, test_loss: 1.3557, test_f1: 0.6172
 epoch: 26, train_loss: 0.4615, test_loss: 1.4881, test_f1: 0.6308
 epoch: 27, train_loss: 0.4499, test_loss: 1.4331, test_f1: 0.6212
 epoch: 28, train_loss: 0.4577, test_loss: 1.8714, test_f1: 0.5827
 epoch: 29, train_loss: 0.4602, test_loss: 1.5613, test_f1: 0.6125
 epoch: 30, train_loss: 0.4609, test_loss: 1.6535, test_f1: 0.5963
 epoch: 31, train_loss: 0.4324, test_loss: 1.6766, test_f1: 0.6180
 epoch: 32, train_loss: 0.4099, test_loss: 1.5716, test_f1: 0.6065
 epoch: 33, train_loss: 0.4089, test_loss: 1.6477, test_f1: 0.6013
 epoch: 34, train_loss: 0.3732, test_loss: 1.7510, test_f1: 0.6144
 epoch: 35, train_loss: 0.4564, test_loss: 1.6646, test_f1: 0.6168
 epoch: 36, train_loss: 0.3855, test_loss: 1.7689, test_f1: 0.5813
 epoch: 37, train_loss: 0.3832, test_loss: 1.7153, test_f1: 0.5950
 epoch: 38, train_loss: 0.4077, test_loss: 1.7151, test_f1: 0.5885
 epoch: 39, train_loss: 0.3745, test_loss: 1.8521, test_f1: 0.5906
 epoch: 40, train_loss: 0.3670, test_loss: 1.8601, test_f1: 0.5995
 epoch: 41, train_loss: 0.3640, test_loss: 1.8509, test_f1: 0.5919
 epoch: 42, train_loss: 0.3513, test_loss: 1.8464, test_f1: 0.6041
 epoch: 43, train_loss: 0.3162, test_loss: 1.9848, test_f1: 0.5808
 epoch: 44, train_loss: 0.3839, test_loss: 1.7525, test_f1: 0.5944
 epoch: 45, train_loss: 0.3200, test_loss: 1.8282, test_f1: 0.5969
 epoch: 46, train_loss: 0.3079, test_loss: 1.9589, test_f1: 0.5753
 epoch: 47, train_loss: 0.3025, test_loss: 2.0211, test_f1: 0.5925
 epoch: 48, train_loss: 0.2872, test_loss: 2.0591, test_f1: 0.5890
 epoch: 49, train_loss: 0.3274, test_loss: 1.8351, test_f1: 0.6119
 epoch: 50, train_loss: 0.3066, test_loss: 2.0739, test_f1: 0.5821
 epoch: 51, train_loss: 0.2572, test_loss: 2.1743, test_f1: 0.5865
 epoch: 52, train_loss: 0.2218, test_loss: 2.1261, test_f1: 0.5960
 epoch: 53, train_loss: 0.2066, test_loss: 2.2213, test_f1: 0.5961
 epoch: 54, train_loss: 0.2004, test_loss: 2.2987, test_f1: 0.6239
 epoch: 55, train_loss: 0.2174, test_loss: 2.2892, test_f1: 0.5832
 epoch: 56, train_loss: 0.1959, test_loss: 2.2551, test_f1: 0.5999
 epoch: 57, train_loss: 0.1904, test_loss: 2.3698, test_f1: 0.5801
 epoch: 58, train_loss: 0.1819, test_loss: 2.4589, test_f1: 0.5963
 epoch: 59, train_loss: 0.1633, test_loss: 2.2469, test_f1: 0.6291
 epoch: 60, train_loss: 0.1776, test_loss: 2.3190, test_f1: 0.5864
 epoch: 61, train_loss: 0.1895, test_loss: 2.4066, test_f1: 0.6209
 epoch: 62, train_loss: 0.1891, test_loss: 2.6228, test_f1: 0.5810
 epoch: 63, train_loss: 0.2071, test_loss: 2.5757, test_f1: 0.5770
 epoch: 64, train_loss: 0.1667, test_loss: 2.4023, test_f1: 0.6014
 epoch: 65, train_loss: 0.1640, test_loss: 2.5030, test_f1: 0.5901
 epoch: 66, train_loss: 0.1632, test_loss: 2.6077, test_f1: 0.5951
 epoch: 67, train_loss: 0.1674, test_loss: 2.7531, test_f1: 0.6072
 epoch: 68, train_loss: 0.1702, test_loss: 2.5531, test_f1: 0.5966
 epoch: 69, train_loss: 0.1776, test_loss: 2.7239, test_f1: 0.5721
 epoch: 70, train_loss: 0.1692, test_loss: 2.5435, test_f1: 0.5814
 epoch: 71, train_loss: 0.1680, test_loss: 2.5849, test_f1: 0.5930
 epoch: 72, train_loss: 0.1324, test_loss: 2.7069, test_f1: 0.5858
 epoch: 73, train_loss: 0.1577, test_loss: 2.9236, test_f1: 0.5669
 epoch: 74, train_loss: 0.1609, test_loss: 2.6895, test_f1: 0.5928
 epoch: 75, train_loss: 0.1370, test_loss: 2.6318, test_f1: 0.6018
 epoch: 76, train_loss: 0.1238, test_loss: 2.7836, test_f1: 0.5798
 epoch: 77, train_loss: 0.1441, test_loss: 2.7911, test_f1: 0.5899
 epoch: 78, train_loss: 0.1446, test_loss: 3.1813, test_f1: 0.5800
 epoch: 79, train_loss: 0.1736, test_loss: 2.5790, test_f1: 0.6017
 epoch: 80, train_loss: 0.1422, test_loss: 2.8724, test_f1: 0.5981
 epoch: 81, train_loss: 0.1533, test_loss: 2.8954, test_f1: 0.5854
 epoch: 82, train_loss: 0.1455, test_loss: 2.7939, test_f1: 0.6096
 epoch: 83, train_loss: 0.1804, test_loss: 2.9830, test_f1: 0.5708
 epoch: 84, train_loss: 0.1416, test_loss: 2.8693, test_f1: 0.5908
 epoch: 85, train_loss: 0.1267, test_loss: 2.7200, test_f1: 0.6427
 epoch: 86, train_loss: 0.1329, test_loss: 3.0125, test_f1: 0.5728
 epoch: 87, train_loss: 0.1013, test_loss: 3.0397, test_f1: 0.5978
 epoch: 88, train_loss: 0.1289, test_loss: 2.9933, test_f1: 0.5827
 epoch: 89, train_loss: 0.1028, test_loss: 3.1518, test_f1: 0.5736
 epoch: 90, train_loss: 0.1118, test_loss: 2.9738, test_f1: 0.6141
 epoch: 91, train_loss: 0.1251, test_loss: 3.0205, test_f1: 0.5989
 epoch: 92, train_loss: 0.1102, test_loss: 3.1464, test_f1: 0.6174
 epoch: 93, train_loss: 0.1209, test_loss: 3.1341, test_f1: 0.5643
 epoch: 94, train_loss: 0.1128, test_loss: 3.4291, test_f1: 0.5768
 epoch: 95, train_loss: 0.1166, test_loss: 3.0784, test_f1: 0.6137
 epoch: 96, train_loss: 0.1159, test_loss: 3.3008, test_f1: 0.5709
 epoch: 97, train_loss: 0.1225, test_loss: 3.3386, test_f1: 0.5812
 epoch: 98, train_loss: 0.1047, test_loss: 3.4261, test_f1: 0.6003
 epoch: 99, train_loss: 0.0962, test_loss: 3.2610, test_f1: 0.5906
##################ITERATION #4 ****************************************
 epoch: 0, train_loss: 1.2052, test_loss: 1.4130, test_f1: 0.3196
 epoch: 1, train_loss: 1.0202, test_loss: 1.1768, test_f1: 0.4312
 epoch: 2, train_loss: 0.9352, test_loss: 1.0732, test_f1: 0.4700
 epoch: 3, train_loss: 0.8962, test_loss: 1.0382, test_f1: 0.5739
 epoch: 4, train_loss: 0.8884, test_loss: 1.0548, test_f1: 0.5595
 epoch: 5, train_loss: 0.8528, test_loss: 1.0692, test_f1: 0.5461
 epoch: 6, train_loss: 0.8108, test_loss: 1.0901, test_f1: 0.5616
 epoch: 7, train_loss: 0.7986, test_loss: 1.0531, test_f1: 0.5388
 epoch: 8, train_loss: 0.7587, test_loss: 1.1751, test_f1: 0.5062
 epoch: 9, train_loss: 0.7481, test_loss: 1.1089, test_f1: 0.5747
 epoch: 10, train_loss: 0.7572, test_loss: 1.0616, test_f1: 0.6117
 epoch: 11, train_loss: 0.7194, test_loss: 1.1093, test_f1: 0.5699
 epoch: 12, train_loss: 0.6959, test_loss: 1.1664, test_f1: 0.5299
 epoch: 13, train_loss: 0.6691, test_loss: 1.1468, test_f1: 0.5781
 epoch: 14, train_loss: 0.6611, test_loss: 1.1189, test_f1: 0.5864
 epoch: 15, train_loss: 0.6502, test_loss: 1.1591, test_f1: 0.6098
 epoch: 16, train_loss: 0.6241, test_loss: 1.1696, test_f1: 0.5713
 epoch: 17, train_loss: 0.6036, test_loss: 1.2271, test_f1: 0.6015
 epoch: 18, train_loss: 0.6052, test_loss: 1.2101, test_f1: 0.6380
 epoch: 19, train_loss: 0.5684, test_loss: 1.2134, test_f1: 0.6234
 epoch: 20, train_loss: 0.5763, test_loss: 1.3739, test_f1: 0.5556
 epoch: 21, train_loss: 0.5561, test_loss: 1.2047, test_f1: 0.6052
 epoch: 22, train_loss: 0.5293, test_loss: 1.4529, test_f1: 0.5848
 epoch: 23, train_loss: 0.5345, test_loss: 1.3769, test_f1: 0.6130
 epoch: 24, train_loss: 0.5029, test_loss: 1.2914, test_f1: 0.6299
 epoch: 25, train_loss: 0.4744, test_loss: 1.3919, test_f1: 0.5929
 epoch: 26, train_loss: 0.4819, test_loss: 1.4157, test_f1: 0.6046
 epoch: 27, train_loss: 0.4779, test_loss: 1.4314, test_f1: 0.6067
 epoch: 28, train_loss: 0.4454, test_loss: 1.5870, test_f1: 0.5899
 epoch: 29, train_loss: 0.4700, test_loss: 1.5303, test_f1: 0.5748
 epoch: 30, train_loss: 0.4550, test_loss: 1.5871, test_f1: 0.6004
 epoch: 31, train_loss: 0.4617, test_loss: 1.6192, test_f1: 0.5927
 epoch: 32, train_loss: 0.4453, test_loss: 1.5772, test_f1: 0.5753
 epoch: 33, train_loss: 0.3828, test_loss: 1.6078, test_f1: 0.6332
 epoch: 34, train_loss: 0.3803, test_loss: 1.6362, test_f1: 0.6242
 epoch: 35, train_loss: 0.3846, test_loss: 1.6679, test_f1: 0.6004
 epoch: 36, train_loss: 0.3741, test_loss: 1.6262, test_f1: 0.5829
 epoch: 37, train_loss: 0.3778, test_loss: 1.8201, test_f1: 0.6087
 epoch: 38, train_loss: 0.3585, test_loss: 1.8016, test_f1: 0.6281
 epoch: 39, train_loss: 0.3362, test_loss: 1.7569, test_f1: 0.5687
 epoch: 40, train_loss: 0.3598, test_loss: 1.9392, test_f1: 0.5832
 epoch: 41, train_loss: 0.3483, test_loss: 1.7599, test_f1: 0.6252
 epoch: 42, train_loss: 0.3463, test_loss: 1.9737, test_f1: 0.5687
 epoch: 43, train_loss: 0.3248, test_loss: 1.8727, test_f1: 0.6185
 epoch: 44, train_loss: 0.2920, test_loss: 1.8658, test_f1: 0.6322
 epoch: 45, train_loss: 0.3186, test_loss: 2.2787, test_f1: 0.5651
 epoch: 46, train_loss: 0.3144, test_loss: 1.9163, test_f1: 0.6069
 epoch: 47, train_loss: 0.2966, test_loss: 1.8868, test_f1: 0.5997
 epoch: 48, train_loss: 0.2669, test_loss: 2.1239, test_f1: 0.5918
 epoch: 49, train_loss: 0.2584, test_loss: 2.1555, test_f1: 0.6465
 epoch: 50, train_loss: 0.2751, test_loss: 2.2050, test_f1: 0.5817
 epoch: 51, train_loss: 0.2717, test_loss: 2.1481, test_f1: 0.5835
 epoch: 52, train_loss: 0.2116, test_loss: 2.0822, test_f1: 0.6177
 epoch: 53, train_loss: 0.2075, test_loss: 2.2612, test_f1: 0.6061
 epoch: 54, train_loss: 0.1935, test_loss: 2.3176, test_f1: 0.6039
 epoch: 55, train_loss: 0.1726, test_loss: 2.2770, test_f1: 0.5974
 epoch: 56, train_loss: 0.1880, test_loss: 2.2122, test_f1: 0.6138
 epoch: 57, train_loss: 0.1881, test_loss: 2.2826, test_f1: 0.6168
 epoch: 58, train_loss: 0.1841, test_loss: 2.3518, test_f1: 0.6083
 epoch: 59, train_loss: 0.1733, test_loss: 2.4094, test_f1: 0.6167
 epoch: 60, train_loss: 0.1712, test_loss: 2.4113, test_f1: 0.6251
 epoch: 61, train_loss: 0.1658, test_loss: 2.3569, test_f1: 0.6221
 epoch: 62, train_loss: 0.1651, test_loss: 2.4623, test_f1: 0.5980
 epoch: 63, train_loss: 0.1473, test_loss: 2.4679, test_f1: 0.6176
 epoch: 64, train_loss: 0.1405, test_loss: 2.5417, test_f1: 0.6051
 epoch: 65, train_loss: 0.1698, test_loss: 2.5368, test_f1: 0.6264
 epoch: 66, train_loss: 0.1696, test_loss: 2.4053, test_f1: 0.6238
 epoch: 67, train_loss: 0.1500, test_loss: 2.6318, test_f1: 0.6146
 epoch: 68, train_loss: 0.1916, test_loss: 2.5165, test_f1: 0.6206
 epoch: 69, train_loss: 0.1509, test_loss: 2.5585, test_f1: 0.6267
 epoch: 70, train_loss: 0.1611, test_loss: 2.5276, test_f1: 0.6350
 epoch: 71, train_loss: 0.1697, test_loss: 2.6634, test_f1: 0.6216
 epoch: 72, train_loss: 0.1554, test_loss: 2.8544, test_f1: 0.6016
 epoch: 73, train_loss: 0.1449, test_loss: 2.6974, test_f1: 0.6153
 epoch: 74, train_loss: 0.1436, test_loss: 2.9475, test_f1: 0.6064
 epoch: 75, train_loss: 0.1370, test_loss: 2.8298, test_f1: 0.6225
 epoch: 76, train_loss: 0.1367, test_loss: 3.0527, test_f1: 0.5715
 epoch: 77, train_loss: 0.1502, test_loss: 2.6883, test_f1: 0.6079
 epoch: 78, train_loss: 0.1533, test_loss: 2.8055, test_f1: 0.6154
 epoch: 79, train_loss: 0.1484, test_loss: 2.8388, test_f1: 0.6137
 epoch: 80, train_loss: 0.1477, test_loss: 2.9620, test_f1: 0.6195
 epoch: 81, train_loss: 0.1138, test_loss: 2.9201, test_f1: 0.5888
 epoch: 82, train_loss: 0.1412, test_loss: 2.9250, test_f1: 0.5897
 epoch: 83, train_loss: 0.1140, test_loss: 3.0045, test_f1: 0.5942
 epoch: 84, train_loss: 0.1322, test_loss: 3.0169, test_f1: 0.5790
 epoch: 85, train_loss: 0.1399, test_loss: 2.9999, test_f1: 0.5823
 epoch: 86, train_loss: 0.1416, test_loss: 3.0634, test_f1: 0.6013
 epoch: 87, train_loss: 0.1304, test_loss: 3.0032, test_f1: 0.6016
 epoch: 88, train_loss: 0.1466, test_loss: 3.0754, test_f1: 0.5929
 epoch: 89, train_loss: 0.1296, test_loss: 2.9721, test_f1: 0.6205
 epoch: 90, train_loss: 0.1343, test_loss: 2.9907, test_f1: 0.6173
 epoch: 91, train_loss: 0.1213, test_loss: 2.8275, test_f1: 0.6071
 epoch: 92, train_loss: 0.1218, test_loss: 3.0360, test_f1: 0.6059
 epoch: 93, train_loss: 0.1218, test_loss: 3.2543, test_f1: 0.5932
 epoch: 94, train_loss: 0.0962, test_loss: 3.1164, test_f1: 0.6029
 epoch: 95, train_loss: 0.1147, test_loss: 3.2064, test_f1: 0.6120
 epoch: 96, train_loss: 0.1460, test_loss: 3.0419, test_f1: 0.5948
 epoch: 97, train_loss: 0.1202, test_loss: 3.1090, test_f1: 0.6014
 epoch: 98, train_loss: 0.1115, test_loss: 3.0211, test_f1: 0.6151
 epoch: 99, train_loss: 0.1068, test_loss: 3.1538, test_f1: 0.6008
##################ITERATION #5 ****************************************
 epoch: 0, train_loss: 1.3642, test_loss: 1.2632, test_f1: 0.2281
 epoch: 1, train_loss: 1.0863, test_loss: 1.1809, test_f1: 0.3717
 epoch: 2, train_loss: 0.9927, test_loss: 1.0680, test_f1: 0.5100
 epoch: 3, train_loss: 0.9625, test_loss: 1.0539, test_f1: 0.5206
 epoch: 4, train_loss: 0.9094, test_loss: 1.0925, test_f1: 0.5209
 epoch: 5, train_loss: 0.8804, test_loss: 1.0582, test_f1: 0.5318
 epoch: 6, train_loss: 0.8577, test_loss: 1.0736, test_f1: 0.5206
 epoch: 7, train_loss: 0.8383, test_loss: 1.0581, test_f1: 0.5712
 epoch: 8, train_loss: 0.7832, test_loss: 1.1111, test_f1: 0.5377
 epoch: 9, train_loss: 0.7819, test_loss: 1.0986, test_f1: 0.5706
 epoch: 10, train_loss: 0.7731, test_loss: 1.0543, test_f1: 0.5713
 epoch: 11, train_loss: 0.7454, test_loss: 1.1216, test_f1: 0.5581
 epoch: 12, train_loss: 0.7409, test_loss: 1.1403, test_f1: 0.5789
 epoch: 13, train_loss: 0.7119, test_loss: 1.1198, test_f1: 0.5985
 epoch: 14, train_loss: 0.6958, test_loss: 1.1518, test_f1: 0.5837
 epoch: 15, train_loss: 0.6864, test_loss: 1.2173, test_f1: 0.5951
 epoch: 16, train_loss: 0.6677, test_loss: 1.1804, test_f1: 0.5950
 epoch: 17, train_loss: 0.6344, test_loss: 1.1205, test_f1: 0.5863
 epoch: 18, train_loss: 0.6305, test_loss: 1.1520, test_f1: 0.6007
 epoch: 19, train_loss: 0.6263, test_loss: 1.1856, test_f1: 0.6091
 epoch: 20, train_loss: 0.5885, test_loss: 1.2327, test_f1: 0.6140
 epoch: 21, train_loss: 0.5693, test_loss: 1.3307, test_f1: 0.5834
 epoch: 22, train_loss: 0.5463, test_loss: 1.2929, test_f1: 0.5588
 epoch: 23, train_loss: 0.5634, test_loss: 1.2752, test_f1: 0.6443
 epoch: 24, train_loss: 0.5572, test_loss: 1.3002, test_f1: 0.6124
 epoch: 25, train_loss: 0.5311, test_loss: 1.2669, test_f1: 0.6085
 epoch: 26, train_loss: 0.5255, test_loss: 1.2707, test_f1: 0.6031
 epoch: 27, train_loss: 0.5290, test_loss: 1.3964, test_f1: 0.5688
 epoch: 28, train_loss: 0.5088, test_loss: 1.4485, test_f1: 0.5840
 epoch: 29, train_loss: 0.4935, test_loss: 1.4541, test_f1: 0.5888
 epoch: 30, train_loss: 0.5117, test_loss: 1.3193, test_f1: 0.6185
 epoch: 31, train_loss: 0.4837, test_loss: 1.3464, test_f1: 0.6260
 epoch: 32, train_loss: 0.4618, test_loss: 1.5636, test_f1: 0.5896
 epoch: 33, train_loss: 0.4534, test_loss: 1.5618, test_f1: 0.5735
 epoch: 34, train_loss: 0.4653, test_loss: 1.5069, test_f1: 0.6241
 epoch: 35, train_loss: 0.4513, test_loss: 1.4373, test_f1: 0.6096
 epoch: 36, train_loss: 0.4577, test_loss: 1.5006, test_f1: 0.6045
 epoch: 37, train_loss: 0.4354, test_loss: 1.5734, test_f1: 0.6066
 epoch: 38, train_loss: 0.4296, test_loss: 1.6597, test_f1: 0.5767
 epoch: 39, train_loss: 0.4262, test_loss: 1.6856, test_f1: 0.5936
 epoch: 40, train_loss: 0.4373, test_loss: 1.7170, test_f1: 0.6168
 epoch: 41, train_loss: 0.4115, test_loss: 1.6328, test_f1: 0.6466
 epoch: 42, train_loss: 0.3932, test_loss: 1.7107, test_f1: 0.5884
 epoch: 43, train_loss: 0.3683, test_loss: 1.6580, test_f1: 0.5997
 epoch: 44, train_loss: 0.3759, test_loss: 1.7370, test_f1: 0.6325
 epoch: 45, train_loss: 0.3466, test_loss: 1.8254, test_f1: 0.6038
 epoch: 46, train_loss: 0.3539, test_loss: 1.7020, test_f1: 0.5955
 epoch: 47, train_loss: 0.3513, test_loss: 1.9288, test_f1: 0.6201
 epoch: 48, train_loss: 0.3286, test_loss: 1.7446, test_f1: 0.6316
 epoch: 49, train_loss: 0.3559, test_loss: 1.8879, test_f1: 0.6390
 epoch: 50, train_loss: 0.3086, test_loss: 2.0086, test_f1: 0.5823
 epoch: 51, train_loss: 0.2669, test_loss: 1.9939, test_f1: 0.6306
 epoch: 52, train_loss: 0.2617, test_loss: 2.0852, test_f1: 0.6042
 epoch: 53, train_loss: 0.2554, test_loss: 2.0358, test_f1: 0.6164
 epoch: 54, train_loss: 0.2412, test_loss: 2.0147, test_f1: 0.6384
 epoch: 55, train_loss: 0.2220, test_loss: 2.1738, test_f1: 0.5953
 epoch: 56, train_loss: 0.2425, test_loss: 2.1297, test_f1: 0.6314
 epoch: 57, train_loss: 0.2304, test_loss: 2.1486, test_f1: 0.6287
 epoch: 58, train_loss: 0.2324, test_loss: 2.1062, test_f1: 0.6523
 epoch: 59, train_loss: 0.2236, test_loss: 2.1687, test_f1: 0.6248
 epoch: 60, train_loss: 0.2276, test_loss: 2.3030, test_f1: 0.6429
 epoch: 61, train_loss: 0.2126, test_loss: 2.2071, test_f1: 0.6270
 epoch: 62, train_loss: 0.2257, test_loss: 2.4036, test_f1: 0.6056
 epoch: 63, train_loss: 0.2198, test_loss: 2.2926, test_f1: 0.6242
 epoch: 64, train_loss: 0.2207, test_loss: 2.4823, test_f1: 0.6043
 epoch: 65, train_loss: 0.1973, test_loss: 2.4100, test_f1: 0.6503
 epoch: 66, train_loss: 0.1976, test_loss: 2.5247, test_f1: 0.6141
 epoch: 67, train_loss: 0.1946, test_loss: 2.4223, test_f1: 0.5926
 epoch: 68, train_loss: 0.1946, test_loss: 2.4082, test_f1: 0.6082
 epoch: 69, train_loss: 0.2056, test_loss: 2.5015, test_f1: 0.6129
 epoch: 70, train_loss: 0.2074, test_loss: 2.3745, test_f1: 0.6248
 epoch: 71, train_loss: 0.1715, test_loss: 2.5788, test_f1: 0.6018
 epoch: 72, train_loss: 0.1681, test_loss: 2.4982, test_f1: 0.6279
 epoch: 73, train_loss: 0.1696, test_loss: 2.5975, test_f1: 0.6355
 epoch: 74, train_loss: 0.1970, test_loss: 2.5978, test_f1: 0.5925
 epoch: 75, train_loss: 0.1948, test_loss: 2.7108, test_f1: 0.6124
 epoch: 76, train_loss: 0.1816, test_loss: 2.6949, test_f1: 0.5989
 epoch: 77, train_loss: 0.1938, test_loss: 2.7412, test_f1: 0.6286
 epoch: 78, train_loss: 0.1807, test_loss: 2.7214, test_f1: 0.6319
 epoch: 79, train_loss: 0.1531, test_loss: 2.7431, test_f1: 0.6194
 epoch: 80, train_loss: 0.1665, test_loss: 2.7871, test_f1: 0.6258
 epoch: 81, train_loss: 0.1858, test_loss: 2.9225, test_f1: 0.5874
 epoch: 82, train_loss: 0.1916, test_loss: 2.7926, test_f1: 0.6033
 epoch: 83, train_loss: 0.1507, test_loss: 2.8886, test_f1: 0.5942
 epoch: 84, train_loss: 0.1597, test_loss: 2.7652, test_f1: 0.6215
 epoch: 85, train_loss: 0.1595, test_loss: 2.7899, test_f1: 0.6387
 epoch: 86, train_loss: 0.1540, test_loss: 2.9464, test_f1: 0.5907
 epoch: 87, train_loss: 0.1628, test_loss: 2.8719, test_f1: 0.6406
 epoch: 88, train_loss: 0.1250, test_loss: 3.1115, test_f1: 0.6093
 epoch: 89, train_loss: 0.1304, test_loss: 3.0163, test_f1: 0.6156
 epoch: 90, train_loss: 0.1286, test_loss: 3.1131, test_f1: 0.5997
 epoch: 91, train_loss: 0.1548, test_loss: 3.1338, test_f1: 0.6324
 epoch: 92, train_loss: 0.1520, test_loss: 2.9648, test_f1: 0.6208
 epoch: 93, train_loss: 0.1329, test_loss: 3.1550, test_f1: 0.5940
 epoch: 94, train_loss: 0.1613, test_loss: 3.0644, test_f1: 0.5933
 epoch: 95, train_loss: 0.1639, test_loss: 3.1027, test_f1: 0.6239
 epoch: 96, train_loss: 0.1494, test_loss: 2.8577, test_f1: 0.6241
 epoch: 97, train_loss: 0.1460, test_loss: 3.0746, test_f1: 0.6056
 epoch: 98, train_loss: 0.1380, test_loss: 3.2116, test_f1: 0.6085
 epoch: 99, train_loss: 0.1266, test_loss: 3.2017, test_f1: 0.6061
##################ITERATION #6 ****************************************
 epoch: 0, train_loss: 1.3186, test_loss: 1.3551, test_f1: 0.2180
 epoch: 1, train_loss: 1.0484, test_loss: 1.4001, test_f1: 0.2543
 epoch: 2, train_loss: 0.9851, test_loss: 1.0416, test_f1: 0.5831
 epoch: 3, train_loss: 0.9069, test_loss: 1.1569, test_f1: 0.5095
 epoch: 4, train_loss: 0.8899, test_loss: 1.0926, test_f1: 0.5233
 epoch: 5, train_loss: 0.8455, test_loss: 1.1138, test_f1: 0.5731
 epoch: 6, train_loss: 0.8371, test_loss: 1.1211, test_f1: 0.5511
 epoch: 7, train_loss: 0.8107, test_loss: 1.0666, test_f1: 0.5616
 epoch: 8, train_loss: 0.7760, test_loss: 1.1246, test_f1: 0.5327
 epoch: 9, train_loss: 0.7562, test_loss: 1.1157, test_f1: 0.5511
 epoch: 10, train_loss: 0.7572, test_loss: 1.1233, test_f1: 0.5801
 epoch: 11, train_loss: 0.7263, test_loss: 1.1593, test_f1: 0.5749
 epoch: 12, train_loss: 0.7098, test_loss: 1.1813, test_f1: 0.5192
 epoch: 13, train_loss: 0.7107, test_loss: 1.1235, test_f1: 0.5764
 epoch: 14, train_loss: 0.6985, test_loss: 1.2126, test_f1: 0.5357
 epoch: 15, train_loss: 0.6765, test_loss: 1.1805, test_f1: 0.5608
 epoch: 16, train_loss: 0.6543, test_loss: 1.1964, test_f1: 0.5571
 epoch: 17, train_loss: 0.6334, test_loss: 1.2445, test_f1: 0.5827
 epoch: 18, train_loss: 0.6243, test_loss: 1.2783, test_f1: 0.5393
 epoch: 19, train_loss: 0.6256, test_loss: 1.3580, test_f1: 0.5947
 epoch: 20, train_loss: 0.6107, test_loss: 1.3182, test_f1: 0.6045
 epoch: 21, train_loss: 0.5802, test_loss: 1.3220, test_f1: 0.6075
 epoch: 22, train_loss: 0.5707, test_loss: 1.4127, test_f1: 0.5294
 epoch: 23, train_loss: 0.5981, test_loss: 1.3406, test_f1: 0.5826
 epoch: 24, train_loss: 0.5606, test_loss: 1.3909, test_f1: 0.5954
 epoch: 25, train_loss: 0.5283, test_loss: 1.4264, test_f1: 0.5588
 epoch: 26, train_loss: 0.5238, test_loss: 1.3942, test_f1: 0.6033
 epoch: 27, train_loss: 0.5345, test_loss: 1.4722, test_f1: 0.5836
 epoch: 28, train_loss: 0.4947, test_loss: 1.6274, test_f1: 0.5314
 epoch: 29, train_loss: 0.5055, test_loss: 1.5342, test_f1: 0.5344
 epoch: 30, train_loss: 0.5104, test_loss: 1.5158, test_f1: 0.5996
 epoch: 31, train_loss: 0.5070, test_loss: 1.5336, test_f1: 0.5941
 epoch: 32, train_loss: 0.4725, test_loss: 1.6589, test_f1: 0.5595
 epoch: 33, train_loss: 0.4552, test_loss: 1.6513, test_f1: 0.5543
 epoch: 34, train_loss: 0.3993, test_loss: 1.6359, test_f1: 0.5997
 epoch: 35, train_loss: 0.4121, test_loss: 1.7929, test_f1: 0.5852
 epoch: 36, train_loss: 0.4246, test_loss: 1.6649, test_f1: 0.6170
 epoch: 37, train_loss: 0.4447, test_loss: 1.7063, test_f1: 0.5951
 epoch: 38, train_loss: 0.4218, test_loss: 1.7965, test_f1: 0.5911
 epoch: 39, train_loss: 0.3878, test_loss: 1.9448, test_f1: 0.5673
 epoch: 40, train_loss: 0.3729, test_loss: 1.8923, test_f1: 0.5634
 epoch: 41, train_loss: 0.3709, test_loss: 2.0280, test_f1: 0.5574
 epoch: 42, train_loss: 0.3393, test_loss: 1.9312, test_f1: 0.5824
 epoch: 43, train_loss: 0.3524, test_loss: 1.9316, test_f1: 0.5900
 epoch: 44, train_loss: 0.3588, test_loss: 1.7653, test_f1: 0.6269
 epoch: 45, train_loss: 0.3348, test_loss: 2.1670, test_f1: 0.6018
 epoch: 46, train_loss: 0.3813, test_loss: 2.1043, test_f1: 0.6022
 epoch: 47, train_loss: 0.3965, test_loss: 1.8666, test_f1: 0.5953
 epoch: 48, train_loss: 0.3556, test_loss: 1.8365, test_f1: 0.5799
 epoch: 49, train_loss: 0.3385, test_loss: 2.1246, test_f1: 0.5751
 epoch: 50, train_loss: 0.3409, test_loss: 2.2020, test_f1: 0.5982
 epoch: 51, train_loss: 0.2866, test_loss: 1.8478, test_f1: 0.6086
 epoch: 52, train_loss: 0.2573, test_loss: 2.0461, test_f1: 0.6125
 epoch: 53, train_loss: 0.2320, test_loss: 2.0928, test_f1: 0.6106
 epoch: 54, train_loss: 0.2323, test_loss: 2.0540, test_f1: 0.6005
 epoch: 55, train_loss: 0.2158, test_loss: 2.1843, test_f1: 0.5907
 epoch: 56, train_loss: 0.2037, test_loss: 2.1625, test_f1: 0.6088
 epoch: 57, train_loss: 0.2299, test_loss: 2.1617, test_f1: 0.5741
 epoch: 58, train_loss: 0.2258, test_loss: 2.2379, test_f1: 0.6055
 epoch: 59, train_loss: 0.2117, test_loss: 2.2320, test_f1: 0.6083
 epoch: 60, train_loss: 0.2290, test_loss: 2.3248, test_f1: 0.5753
 epoch: 61, train_loss: 0.2194, test_loss: 2.2699, test_f1: 0.6035
 epoch: 62, train_loss: 0.1965, test_loss: 2.2084, test_f1: 0.6279
 epoch: 63, train_loss: 0.2121, test_loss: 2.4356, test_f1: 0.6073
 epoch: 64, train_loss: 0.1956, test_loss: 2.3737, test_f1: 0.5825
 epoch: 65, train_loss: 0.1960, test_loss: 2.3603, test_f1: 0.6114
 epoch: 66, train_loss: 0.2002, test_loss: 2.4643, test_f1: 0.5918
 epoch: 67, train_loss: 0.1992, test_loss: 2.5508, test_f1: 0.5939
 epoch: 68, train_loss: 0.1743, test_loss: 2.3554, test_f1: 0.5929
 epoch: 69, train_loss: 0.1964, test_loss: 2.4653, test_f1: 0.5864
 epoch: 70, train_loss: 0.1871, test_loss: 2.5063, test_f1: 0.5928
 epoch: 71, train_loss: 0.1639, test_loss: 2.5112, test_f1: 0.6060
 epoch: 72, train_loss: 0.1846, test_loss: 2.5898, test_f1: 0.5735
 epoch: 73, train_loss: 0.1537, test_loss: 2.6121, test_f1: 0.5991
 epoch: 74, train_loss: 0.1671, test_loss: 2.5285, test_f1: 0.5975
 epoch: 75, train_loss: 0.1640, test_loss: 2.6240, test_f1: 0.5890
 epoch: 76, train_loss: 0.1767, test_loss: 2.5006, test_f1: 0.5916
 epoch: 77, train_loss: 0.1703, test_loss: 2.7184, test_f1: 0.5935
 epoch: 78, train_loss: 0.1793, test_loss: 2.6591, test_f1: 0.5983
 epoch: 79, train_loss: 0.1571, test_loss: 2.7135, test_f1: 0.5920
 epoch: 80, train_loss: 0.1405, test_loss: 2.7353, test_f1: 0.5935
 epoch: 81, train_loss: 0.1304, test_loss: 2.8745, test_f1: 0.5822
 epoch: 82, train_loss: 0.2047, test_loss: 2.7734, test_f1: 0.5915
 epoch: 83, train_loss: 0.1680, test_loss: 2.7779, test_f1: 0.5821
 epoch: 84, train_loss: 0.1387, test_loss: 2.7948, test_f1: 0.5786
 epoch: 85, train_loss: 0.1610, test_loss: 2.7139, test_f1: 0.6102
 epoch: 86, train_loss: 0.1701, test_loss: 2.8359, test_f1: 0.6082
 epoch: 87, train_loss: 0.1434, test_loss: 2.8949, test_f1: 0.5705
 epoch: 88, train_loss: 0.1792, test_loss: 2.7719, test_f1: 0.5705
 epoch: 89, train_loss: 0.1452, test_loss: 2.7388, test_f1: 0.6006
 epoch: 90, train_loss: 0.1338, test_loss: 2.8249, test_f1: 0.6026
 epoch: 91, train_loss: 0.1384, test_loss: 2.9795, test_f1: 0.5862
 epoch: 92, train_loss: 0.1305, test_loss: 2.9403, test_f1: 0.5828
 epoch: 93, train_loss: 0.1280, test_loss: 2.9310, test_f1: 0.5800
 epoch: 94, train_loss: 0.1480, test_loss: 3.0424, test_f1: 0.5700
 epoch: 95, train_loss: 0.1463, test_loss: 2.9407, test_f1: 0.6301
 epoch: 96, train_loss: 0.1690, test_loss: 2.9210, test_f1: 0.6322
 epoch: 97, train_loss: 0.1501, test_loss: 2.9745, test_f1: 0.5721
 epoch: 98, train_loss: 0.1345, test_loss: 3.0850, test_f1: 0.5926
 epoch: 99, train_loss: 0.1393, test_loss: 3.1009, test_f1: 0.6205
##################ITERATION #7 ****************************************
 epoch: 0, train_loss: 1.4529, test_loss: 1.6159, test_f1: 0.1365
 epoch: 1, train_loss: 1.1091, test_loss: 1.6046, test_f1: 0.2375
 epoch: 2, train_loss: 0.9653, test_loss: 1.0960, test_f1: 0.4894
 epoch: 3, train_loss: 0.9155, test_loss: 1.0972, test_f1: 0.5249
 epoch: 4, train_loss: 0.8843, test_loss: 1.1063, test_f1: 0.5189
 epoch: 5, train_loss: 0.8408, test_loss: 1.1190, test_f1: 0.5232
 epoch: 6, train_loss: 0.8084, test_loss: 1.1377, test_f1: 0.5243
 epoch: 7, train_loss: 0.8335, test_loss: 1.1090, test_f1: 0.5324
 epoch: 8, train_loss: 0.7652, test_loss: 1.0930, test_f1: 0.6144
 epoch: 9, train_loss: 0.7581, test_loss: 1.0960, test_f1: 0.5892
 epoch: 10, train_loss: 0.7231, test_loss: 1.0992, test_f1: 0.5989
 epoch: 11, train_loss: 0.6860, test_loss: 1.0063, test_f1: 0.6211
 epoch: 12, train_loss: 0.7092, test_loss: 1.1268, test_f1: 0.5555
 epoch: 13, train_loss: 0.6894, test_loss: 1.0416, test_f1: 0.6072
 epoch: 14, train_loss: 0.6605, test_loss: 1.2143, test_f1: 0.5458
 epoch: 15, train_loss: 0.6507, test_loss: 1.1454, test_f1: 0.6284
 epoch: 16, train_loss: 0.6328, test_loss: 1.3015, test_f1: 0.5781
 epoch: 17, train_loss: 0.6502, test_loss: 1.2462, test_f1: 0.5984
 epoch: 18, train_loss: 0.6309, test_loss: 1.1887, test_f1: 0.5967
 epoch: 19, train_loss: 0.6138, test_loss: 1.3364, test_f1: 0.6233
 epoch: 20, train_loss: 0.5884, test_loss: 1.1465, test_f1: 0.6116
 epoch: 21, train_loss: 0.5548, test_loss: 1.2740, test_f1: 0.5752
 epoch: 22, train_loss: 0.5394, test_loss: 1.3310, test_f1: 0.5593
 epoch: 23, train_loss: 0.5566, test_loss: 1.2463, test_f1: 0.5975
 epoch: 24, train_loss: 0.5325, test_loss: 1.4795, test_f1: 0.5599
 epoch: 25, train_loss: 0.5204, test_loss: 1.3595, test_f1: 0.5773
 epoch: 26, train_loss: 0.4947, test_loss: 1.3455, test_f1: 0.6006
 epoch: 27, train_loss: 0.4969, test_loss: 1.4411, test_f1: 0.5914
 epoch: 28, train_loss: 0.4760, test_loss: 1.4673, test_f1: 0.5707
 epoch: 29, train_loss: 0.4784, test_loss: 1.3817, test_f1: 0.5839
 epoch: 30, train_loss: 0.4960, test_loss: 1.3251, test_f1: 0.6083
 epoch: 31, train_loss: 0.4609, test_loss: 1.5442, test_f1: 0.5921
 epoch: 32, train_loss: 0.4377, test_loss: 1.6008, test_f1: 0.5855
 epoch: 33, train_loss: 0.3972, test_loss: 1.6335, test_f1: 0.5806
 epoch: 34, train_loss: 0.4145, test_loss: 1.6368, test_f1: 0.6006
 epoch: 35, train_loss: 0.3846, test_loss: 1.7593, test_f1: 0.5624
 epoch: 36, train_loss: 0.4232, test_loss: 1.7765, test_f1: 0.5230
 epoch: 37, train_loss: 0.4327, test_loss: 1.4899, test_f1: 0.5891
 epoch: 38, train_loss: 0.3944, test_loss: 1.6316, test_f1: 0.5857
 epoch: 39, train_loss: 0.3960, test_loss: 1.6897, test_f1: 0.5951
 epoch: 40, train_loss: 0.3673, test_loss: 1.7106, test_f1: 0.6027
 epoch: 41, train_loss: 0.3406, test_loss: 1.8492, test_f1: 0.6219
 epoch: 42, train_loss: 0.3420, test_loss: 1.7373, test_f1: 0.6027
 epoch: 43, train_loss: 0.3320, test_loss: 1.8428, test_f1: 0.5864
 epoch: 44, train_loss: 0.3279, test_loss: 1.7372, test_f1: 0.6399
 epoch: 45, train_loss: 0.2975, test_loss: 1.8746, test_f1: 0.6198
 epoch: 46, train_loss: 0.3290, test_loss: 2.0808, test_f1: 0.5439
 epoch: 47, train_loss: 0.3086, test_loss: 1.8514, test_f1: 0.6062
 epoch: 48, train_loss: 0.3011, test_loss: 1.8542, test_f1: 0.6146
 epoch: 49, train_loss: 0.3024, test_loss: 2.0642, test_f1: 0.5943
 epoch: 50, train_loss: 0.2610, test_loss: 2.1201, test_f1: 0.5743
 epoch: 51, train_loss: 0.2280, test_loss: 2.0241, test_f1: 0.6041
 epoch: 52, train_loss: 0.2173, test_loss: 2.0232, test_f1: 0.6040
 epoch: 53, train_loss: 0.1874, test_loss: 2.1583, test_f1: 0.6015
 epoch: 54, train_loss: 0.2018, test_loss: 2.2236, test_f1: 0.6087
 epoch: 55, train_loss: 0.1795, test_loss: 2.3424, test_f1: 0.5985
 epoch: 56, train_loss: 0.1801, test_loss: 2.3387, test_f1: 0.6134
 epoch: 57, train_loss: 0.1954, test_loss: 2.2976, test_f1: 0.6079
 epoch: 58, train_loss: 0.1932, test_loss: 2.3558, test_f1: 0.5986
 epoch: 59, train_loss: 0.1816, test_loss: 2.4701, test_f1: 0.5904
 epoch: 60, train_loss: 0.1915, test_loss: 2.2584, test_f1: 0.6121
 epoch: 61, train_loss: 0.1647, test_loss: 2.3952, test_f1: 0.6201
 epoch: 62, train_loss: 0.1684, test_loss: 2.6588, test_f1: 0.5820
 epoch: 63, train_loss: 0.1780, test_loss: 2.5185, test_f1: 0.6119
 epoch: 64, train_loss: 0.1693, test_loss: 2.4325, test_f1: 0.5895
 epoch: 65, train_loss: 0.1839, test_loss: 2.4687, test_f1: 0.6048
 epoch: 66, train_loss: 0.1535, test_loss: 2.5258, test_f1: 0.5940
 epoch: 67, train_loss: 0.1733, test_loss: 2.5056, test_f1: 0.6031
 epoch: 68, train_loss: 0.1458, test_loss: 2.4930, test_f1: 0.5957
 epoch: 69, train_loss: 0.1786, test_loss: 2.6050, test_f1: 0.5832
 epoch: 70, train_loss: 0.1632, test_loss: 2.5786, test_f1: 0.6006
 epoch: 71, train_loss: 0.1475, test_loss: 2.4705, test_f1: 0.6229
 epoch: 72, train_loss: 0.1533, test_loss: 2.7071, test_f1: 0.5903
 epoch: 73, train_loss: 0.1451, test_loss: 2.6952, test_f1: 0.6076
 epoch: 74, train_loss: 0.1485, test_loss: 2.7152, test_f1: 0.5975
 epoch: 75, train_loss: 0.1828, test_loss: 2.5660, test_f1: 0.6006
 epoch: 76, train_loss: 0.1774, test_loss: 2.7528, test_f1: 0.5871
 epoch: 77, train_loss: 0.1829, test_loss: 2.7037, test_f1: 0.6139
 epoch: 78, train_loss: 0.1596, test_loss: 2.6883, test_f1: 0.6178
 epoch: 79, train_loss: 0.1273, test_loss: 2.7368, test_f1: 0.6010
 epoch: 80, train_loss: 0.1361, test_loss: 2.7456, test_f1: 0.6069
 epoch: 81, train_loss: 0.1451, test_loss: 2.6762, test_f1: 0.6061
 epoch: 82, train_loss: 0.1771, test_loss: 2.6266, test_f1: 0.6121
 epoch: 83, train_loss: 0.1300, test_loss: 2.7340, test_f1: 0.5869
 epoch: 84, train_loss: 0.1457, test_loss: 2.7328, test_f1: 0.6312
 epoch: 85, train_loss: 0.1521, test_loss: 2.7582, test_f1: 0.6281
 epoch: 86, train_loss: 0.1288, test_loss: 2.8033, test_f1: 0.5976
 epoch: 87, train_loss: 0.1512, test_loss: 2.8626, test_f1: 0.5932
 epoch: 88, train_loss: 0.1449, test_loss: 2.7148, test_f1: 0.6120
 epoch: 89, train_loss: 0.1229, test_loss: 2.7581, test_f1: 0.6105
 epoch: 90, train_loss: 0.1046, test_loss: 2.8247, test_f1: 0.6020
 epoch: 91, train_loss: 0.1096, test_loss: 2.9738, test_f1: 0.6008
 epoch: 92, train_loss: 0.1180, test_loss: 3.1195, test_f1: 0.5704
 epoch: 93, train_loss: 0.1241, test_loss: 2.9772, test_f1: 0.6107
 epoch: 94, train_loss: 0.1428, test_loss: 3.1315, test_f1: 0.6025
 epoch: 95, train_loss: 0.1250, test_loss: 2.8722, test_f1: 0.6337
 epoch: 96, train_loss: 0.1241, test_loss: 3.0076, test_f1: 0.6227
 epoch: 97, train_loss: 0.1576, test_loss: 2.8098, test_f1: 0.6297
 epoch: 98, train_loss: 0.1325, test_loss: 3.0104, test_f1: 0.5994
 epoch: 99, train_loss: 0.1093, test_loss: 3.0071, test_f1: 0.6051
##################ITERATION #8 ****************************************
 epoch: 0, train_loss: 1.4905, test_loss: 1.5934, test_f1: 0.1365
 epoch: 1, train_loss: 1.0942, test_loss: 1.4520, test_f1: 0.2329
 epoch: 2, train_loss: 1.0233, test_loss: 1.0895, test_f1: 0.5006
 epoch: 3, train_loss: 0.9412, test_loss: 1.1106, test_f1: 0.5488
 epoch: 4, train_loss: 0.8955, test_loss: 1.1057, test_f1: 0.5547
 epoch: 5, train_loss: 0.8835, test_loss: 1.0873, test_f1: 0.5857
 epoch: 6, train_loss: 0.8655, test_loss: 1.1125, test_f1: 0.5563
 epoch: 7, train_loss: 0.8381, test_loss: 1.0648, test_f1: 0.5814
 epoch: 8, train_loss: 0.8267, test_loss: 1.0517, test_f1: 0.6150
 epoch: 9, train_loss: 0.7714, test_loss: 1.0814, test_f1: 0.5932
 epoch: 10, train_loss: 0.7669, test_loss: 1.0904, test_f1: 0.5423
 epoch: 11, train_loss: 0.7584, test_loss: 1.0685, test_f1: 0.6059
 epoch: 12, train_loss: 0.7651, test_loss: 1.0798, test_f1: 0.5772
 epoch: 13, train_loss: 0.7466, test_loss: 1.1366, test_f1: 0.5918
 epoch: 14, train_loss: 0.7070, test_loss: 1.1134, test_f1: 0.6112
 epoch: 15, train_loss: 0.6953, test_loss: 1.1321, test_f1: 0.6004
 epoch: 16, train_loss: 0.6941, test_loss: 1.1525, test_f1: 0.6209
 epoch: 17, train_loss: 0.6795, test_loss: 1.2389, test_f1: 0.5853
 epoch: 18, train_loss: 0.6754, test_loss: 1.1197, test_f1: 0.6165
 epoch: 19, train_loss: 0.6407, test_loss: 1.2457, test_f1: 0.5922
 epoch: 20, train_loss: 0.6109, test_loss: 1.1983, test_f1: 0.6422
 epoch: 21, train_loss: 0.5984, test_loss: 1.2695, test_f1: 0.6016
 epoch: 22, train_loss: 0.6195, test_loss: 1.2426, test_f1: 0.6003
 epoch: 23, train_loss: 0.5850, test_loss: 1.1989, test_f1: 0.5802
 epoch: 24, train_loss: 0.5967, test_loss: 1.2448, test_f1: 0.6335
 epoch: 25, train_loss: 0.6161, test_loss: 1.2528, test_f1: 0.6122
 epoch: 26, train_loss: 0.5914, test_loss: 1.2417, test_f1: 0.6086
 epoch: 27, train_loss: 0.5485, test_loss: 1.2184, test_f1: 0.6404
 epoch: 28, train_loss: 0.5330, test_loss: 1.2928, test_f1: 0.6232
 epoch: 29, train_loss: 0.5250, test_loss: 1.2701, test_f1: 0.6311
 epoch: 30, train_loss: 0.5216, test_loss: 1.4227, test_f1: 0.6152
 epoch: 31, train_loss: 0.4931, test_loss: 1.2861, test_f1: 0.6313
 epoch: 32, train_loss: 0.4845, test_loss: 1.4277, test_f1: 0.5992
 epoch: 33, train_loss: 0.4439, test_loss: 1.4763, test_f1: 0.6078
 epoch: 34, train_loss: 0.5012, test_loss: 1.5122, test_f1: 0.5821
 epoch: 35, train_loss: 0.4766, test_loss: 1.4798, test_f1: 0.5972
 epoch: 36, train_loss: 0.4636, test_loss: 1.5216, test_f1: 0.5853
 epoch: 37, train_loss: 0.4834, test_loss: 1.5013, test_f1: 0.6014
 epoch: 38, train_loss: 0.4493, test_loss: 1.4941, test_f1: 0.6271
 epoch: 39, train_loss: 0.4384, test_loss: 1.7142, test_f1: 0.5863
 epoch: 40, train_loss: 0.4514, test_loss: 1.6213, test_f1: 0.6215
 epoch: 41, train_loss: 0.4265, test_loss: 1.5826, test_f1: 0.6240
 epoch: 42, train_loss: 0.4141, test_loss: 1.5806, test_f1: 0.6202
 epoch: 43, train_loss: 0.4107, test_loss: 1.6392, test_f1: 0.6282
 epoch: 44, train_loss: 0.4014, test_loss: 1.6278, test_f1: 0.6130
 epoch: 45, train_loss: 0.3991, test_loss: 1.7214, test_f1: 0.5882
 epoch: 46, train_loss: 0.3770, test_loss: 1.7093, test_f1: 0.5844
 epoch: 47, train_loss: 0.3681, test_loss: 1.9676, test_f1: 0.5502
 epoch: 48, train_loss: 0.3662, test_loss: 1.9008, test_f1: 0.5977
 epoch: 49, train_loss: 0.3862, test_loss: 1.6480, test_f1: 0.6280
 epoch: 50, train_loss: 0.3606, test_loss: 1.8316, test_f1: 0.6055
 epoch: 51, train_loss: 0.3061, test_loss: 1.8148, test_f1: 0.6462
 epoch: 52, train_loss: 0.2833, test_loss: 1.8497, test_f1: 0.6153
 epoch: 53, train_loss: 0.2709, test_loss: 1.8309, test_f1: 0.6362
 epoch: 54, train_loss: 0.2985, test_loss: 1.9658, test_f1: 0.5943
 epoch: 55, train_loss: 0.2746, test_loss: 1.9411, test_f1: 0.6236
 epoch: 56, train_loss: 0.2766, test_loss: 2.0571, test_f1: 0.5972
 epoch: 57, train_loss: 0.2543, test_loss: 1.9998, test_f1: 0.6080
 epoch: 58, train_loss: 0.2429, test_loss: 2.1290, test_f1: 0.6000
 epoch: 59, train_loss: 0.2751, test_loss: 2.0577, test_f1: 0.5947
 epoch: 60, train_loss: 0.2557, test_loss: 2.0864, test_f1: 0.5932
 epoch: 61, train_loss: 0.2349, test_loss: 1.9761, test_f1: 0.5952
 epoch: 62, train_loss: 0.2516, test_loss: 2.1758, test_f1: 0.6027
 epoch: 63, train_loss: 0.2320, test_loss: 2.2125, test_f1: 0.5991
 epoch: 64, train_loss: 0.2344, test_loss: 2.2063, test_f1: 0.5817
 epoch: 65, train_loss: 0.2284, test_loss: 2.0532, test_f1: 0.5889
 epoch: 66, train_loss: 0.2042, test_loss: 2.2432, test_f1: 0.6141
 epoch: 67, train_loss: 0.2139, test_loss: 2.1436, test_f1: 0.5840
 epoch: 68, train_loss: 0.2056, test_loss: 2.2497, test_f1: 0.5894
 epoch: 69, train_loss: 0.2079, test_loss: 2.3324, test_f1: 0.5971
 epoch: 70, train_loss: 0.2171, test_loss: 2.2234, test_f1: 0.6127
 epoch: 71, train_loss: 0.2090, test_loss: 2.2890, test_f1: 0.5785
 epoch: 72, train_loss: 0.2236, test_loss: 2.5455, test_f1: 0.5854
 epoch: 73, train_loss: 0.1955, test_loss: 2.4417, test_f1: 0.5706
 epoch: 74, train_loss: 0.1750, test_loss: 2.2569, test_f1: 0.5960
 epoch: 75, train_loss: 0.1817, test_loss: 2.3806, test_f1: 0.6318
 epoch: 76, train_loss: 0.1757, test_loss: 2.4663, test_f1: 0.5789
 epoch: 77, train_loss: 0.1976, test_loss: 2.4098, test_f1: 0.6319
 epoch: 78, train_loss: 0.2013, test_loss: 2.6293, test_f1: 0.5633
 epoch: 79, train_loss: 0.1879, test_loss: 2.3460, test_f1: 0.5979
 epoch: 80, train_loss: 0.2121, test_loss: 2.2755, test_f1: 0.6348
 epoch: 81, train_loss: 0.1906, test_loss: 2.3537, test_f1: 0.6142
 epoch: 82, train_loss: 0.1896, test_loss: 2.5213, test_f1: 0.6102
 epoch: 83, train_loss: 0.1884, test_loss: 2.5551, test_f1: 0.6008
 epoch: 84, train_loss: 0.1848, test_loss: 2.5284, test_f1: 0.6041
 epoch: 85, train_loss: 0.1978, test_loss: 2.4494, test_f1: 0.6108
 epoch: 86, train_loss: 0.1689, test_loss: 2.3928, test_f1: 0.6039
 epoch: 87, train_loss: 0.1735, test_loss: 2.5285, test_f1: 0.6090
 epoch: 88, train_loss: 0.1794, test_loss: 2.3741, test_f1: 0.6320
 epoch: 89, train_loss: 0.1858, test_loss: 2.5747, test_f1: 0.6280
 epoch: 90, train_loss: 0.1517, test_loss: 2.4370, test_f1: 0.6376
 epoch: 91, train_loss: 0.1854, test_loss: 2.5454, test_f1: 0.6114
 epoch: 92, train_loss: 0.1643, test_loss: 2.5713, test_f1: 0.6230
 epoch: 93, train_loss: 0.1527, test_loss: 2.7762, test_f1: 0.5754
 epoch: 94, train_loss: 0.1543, test_loss: 2.5481, test_f1: 0.6140
 epoch: 95, train_loss: 0.1677, test_loss: 2.7368, test_f1: 0.5597
 epoch: 96, train_loss: 0.1401, test_loss: 2.5759, test_f1: 0.5915
 epoch: 97, train_loss: 0.1503, test_loss: 2.7888, test_f1: 0.6121
 epoch: 98, train_loss: 0.1577, test_loss: 2.8828, test_f1: 0.5736
 epoch: 99, train_loss: 0.1938, test_loss: 2.7705, test_f1: 0.6040
##################ITERATION #9 ****************************************
 epoch: 0, train_loss: 1.5360, test_loss: 1.3259, test_f1: 0.2281
 epoch: 1, train_loss: 1.1194, test_loss: 1.2125, test_f1: 0.3435
 epoch: 2, train_loss: 0.9811, test_loss: 1.1175, test_f1: 0.5013
 epoch: 3, train_loss: 0.9401, test_loss: 1.0363, test_f1: 0.5514
 epoch: 4, train_loss: 0.8770, test_loss: 1.1500, test_f1: 0.4810
 epoch: 5, train_loss: 0.8522, test_loss: 1.1309, test_f1: 0.5351
 epoch: 6, train_loss: 0.8370, test_loss: 1.1084, test_f1: 0.5400
 epoch: 7, train_loss: 0.8107, test_loss: 1.0893, test_f1: 0.5654
 epoch: 8, train_loss: 0.7785, test_loss: 1.1132, test_f1: 0.5572
 epoch: 9, train_loss: 0.7589, test_loss: 1.1254, test_f1: 0.5687
 epoch: 10, train_loss: 0.7527, test_loss: 1.1449, test_f1: 0.5603
 epoch: 11, train_loss: 0.7131, test_loss: 1.1358, test_f1: 0.5816
 epoch: 12, train_loss: 0.6994, test_loss: 1.1760, test_f1: 0.5772
 epoch: 13, train_loss: 0.6985, test_loss: 1.2672, test_f1: 0.5455
 epoch: 14, train_loss: 0.6768, test_loss: 1.1900, test_f1: 0.5745
 epoch: 15, train_loss: 0.6388, test_loss: 1.1898, test_f1: 0.5862
 epoch: 16, train_loss: 0.6082, test_loss: 1.2063, test_f1: 0.6087
 epoch: 17, train_loss: 0.5942, test_loss: 1.2197, test_f1: 0.5476
 epoch: 18, train_loss: 0.6116, test_loss: 1.2650, test_f1: 0.5589
 epoch: 19, train_loss: 0.6073, test_loss: 1.2112, test_f1: 0.6080
 epoch: 20, train_loss: 0.6117, test_loss: 1.2835, test_f1: 0.5498
 epoch: 21, train_loss: 0.5729, test_loss: 1.1835, test_f1: 0.6336
 epoch: 22, train_loss: 0.5508, test_loss: 1.3367, test_f1: 0.5740
 epoch: 23, train_loss: 0.5567, test_loss: 1.3447, test_f1: 0.5954
 epoch: 24, train_loss: 0.5683, test_loss: 1.3033, test_f1: 0.5943
 epoch: 25, train_loss: 0.5756, test_loss: 1.2750, test_f1: 0.6289
 epoch: 26, train_loss: 0.5533, test_loss: 1.3175, test_f1: 0.5596
 epoch: 27, train_loss: 0.5269, test_loss: 1.4350, test_f1: 0.5642
 epoch: 28, train_loss: 0.5019, test_loss: 1.4305, test_f1: 0.5946
 epoch: 29, train_loss: 0.5016, test_loss: 1.4357, test_f1: 0.5916
 epoch: 30, train_loss: 0.4610, test_loss: 1.5180, test_f1: 0.5939
 epoch: 31, train_loss: 0.4794, test_loss: 1.5437, test_f1: 0.5700
 epoch: 32, train_loss: 0.4688, test_loss: 1.5129, test_f1: 0.6315
 epoch: 33, train_loss: 0.4601, test_loss: 1.7657, test_f1: 0.5791
 epoch: 34, train_loss: 0.4555, test_loss: 1.5730, test_f1: 0.5895
 epoch: 35, train_loss: 0.4363, test_loss: 1.5539, test_f1: 0.5810
 epoch: 36, train_loss: 0.4491, test_loss: 1.5616, test_f1: 0.5985
 epoch: 37, train_loss: 0.4444, test_loss: 1.5907, test_f1: 0.6023
 epoch: 38, train_loss: 0.3921, test_loss: 1.6476, test_f1: 0.5779
 epoch: 39, train_loss: 0.4227, test_loss: 1.7543, test_f1: 0.5056
 epoch: 40, train_loss: 0.3983, test_loss: 1.8625, test_f1: 0.5768
 epoch: 41, train_loss: 0.3777, test_loss: 1.9400, test_f1: 0.6026
 epoch: 42, train_loss: 0.3815, test_loss: 1.7626, test_f1: 0.5485
 epoch: 43, train_loss: 0.3738, test_loss: 1.6922, test_f1: 0.5808
 epoch: 44, train_loss: 0.3636, test_loss: 2.0978, test_f1: 0.5639
 epoch: 45, train_loss: 0.3550, test_loss: 1.9342, test_f1: 0.5821
 epoch: 46, train_loss: 0.3481, test_loss: 2.0045, test_f1: 0.6116
 epoch: 47, train_loss: 0.3602, test_loss: 1.9571, test_f1: 0.5602
 epoch: 48, train_loss: 0.3740, test_loss: 1.9464, test_f1: 0.5851
 epoch: 49, train_loss: 0.3347, test_loss: 2.0626, test_f1: 0.5869
 epoch: 50, train_loss: 0.3437, test_loss: 2.2801, test_f1: 0.5852
 epoch: 51, train_loss: 0.3145, test_loss: 1.9031, test_f1: 0.5918
 epoch: 52, train_loss: 0.2956, test_loss: 2.1648, test_f1: 0.5619
 epoch: 53, train_loss: 0.2391, test_loss: 2.1273, test_f1: 0.5777
 epoch: 54, train_loss: 0.2538, test_loss: 2.1777, test_f1: 0.5740
 epoch: 55, train_loss: 0.2582, test_loss: 1.9799, test_f1: 0.5784
 epoch: 56, train_loss: 0.2604, test_loss: 2.2620, test_f1: 0.5708
 epoch: 57, train_loss: 0.2413, test_loss: 2.2889, test_f1: 0.5829
 epoch: 58, train_loss: 0.2565, test_loss: 2.1726, test_f1: 0.6002
 epoch: 59, train_loss: 0.2436, test_loss: 2.1769, test_f1: 0.6048
 epoch: 60, train_loss: 0.2459, test_loss: 2.1800, test_f1: 0.5849
 epoch: 61, train_loss: 0.2390, test_loss: 2.0612, test_f1: 0.5893
 epoch: 62, train_loss: 0.2437, test_loss: 2.2776, test_f1: 0.5911
 epoch: 63, train_loss: 0.2225, test_loss: 2.4123, test_f1: 0.5751
 epoch: 64, train_loss: 0.2059, test_loss: 2.4565, test_f1: 0.5766
 epoch: 65, train_loss: 0.2156, test_loss: 2.2834, test_f1: 0.5626
 epoch: 66, train_loss: 0.2253, test_loss: 2.3461, test_f1: 0.5644
 epoch: 67, train_loss: 0.2054, test_loss: 2.4193, test_f1: 0.5841
 epoch: 68, train_loss: 0.2029, test_loss: 2.2280, test_f1: 0.5788
 epoch: 69, train_loss: 0.2109, test_loss: 2.4674, test_f1: 0.5919
 epoch: 70, train_loss: 0.2282, test_loss: 2.4873, test_f1: 0.5798
 epoch: 71, train_loss: 0.2167, test_loss: 2.5934, test_f1: 0.5664
 epoch: 72, train_loss: 0.1972, test_loss: 2.5669, test_f1: 0.5703
 epoch: 73, train_loss: 0.1808, test_loss: 2.2926, test_f1: 0.5756
 epoch: 74, train_loss: 0.1787, test_loss: 2.3538, test_f1: 0.5850
 epoch: 75, train_loss: 0.1889, test_loss: 2.2799, test_f1: 0.6016
 epoch: 76, train_loss: 0.1723, test_loss: 2.5615, test_f1: 0.5630
 epoch: 77, train_loss: 0.1762, test_loss: 2.4627, test_f1: 0.5595
 epoch: 78, train_loss: 0.1978, test_loss: 2.8943, test_f1: 0.5470
 epoch: 79, train_loss: 0.1783, test_loss: 2.6987, test_f1: 0.5627
 epoch: 80, train_loss: 0.1695, test_loss: 2.5061, test_f1: 0.5589
 epoch: 81, train_loss: 0.1717, test_loss: 2.3970, test_f1: 0.5780
 epoch: 82, train_loss: 0.1777, test_loss: 2.5894, test_f1: 0.5920
 epoch: 83, train_loss: 0.1806, test_loss: 2.4624, test_f1: 0.5910
 epoch: 84, train_loss: 0.1751, test_loss: 2.5632, test_f1: 0.5608
 epoch: 85, train_loss: 0.1789, test_loss: 2.2945, test_f1: 0.5790
 epoch: 86, train_loss: 0.2035, test_loss: 2.5230, test_f1: 0.5908
 epoch: 87, train_loss: 0.1740, test_loss: 2.3372, test_f1: 0.6091
 epoch: 88, train_loss: 0.1666, test_loss: 2.5105, test_f1: 0.5963
 epoch: 89, train_loss: 0.1814, test_loss: 2.5550, test_f1: 0.5832
 epoch: 90, train_loss: 0.1742, test_loss: 2.6491, test_f1: 0.5850
 epoch: 91, train_loss: 0.1518, test_loss: 2.6196, test_f1: 0.5971
 epoch: 92, train_loss: 0.1785, test_loss: 2.6394, test_f1: 0.6003
 epoch: 93, train_loss: 0.1680, test_loss: 2.3642, test_f1: 0.6057
 epoch: 94, train_loss: 0.1508, test_loss: 2.6395, test_f1: 0.5964
 epoch: 95, train_loss: 0.1646, test_loss: 2.5316, test_f1: 0.5697
 epoch: 96, train_loss: 0.1495, test_loss: 2.4906, test_f1: 0.5990
 epoch: 97, train_loss: 0.1570, test_loss: 2.7678, test_f1: 0.5868
 epoch: 98, train_loss: 0.1218, test_loss: 2.5755, test_f1: 0.5887
 epoch: 99, train_loss: 0.1533, test_loss: 2.4996, test_f1: 0.6113

Training completed in 458.38 seconds
Best F1: 0.6799 at epoch 92
Mean F1 across iterations: 0.6462  0.0135
========================FINAL RESULTS================================
FEGIN weighted F1: 0.6799  0.0135
python main.py --data ltspice_demos --representation component_pin_net --model FEGIN --layers 4 --hiddens 64 --batch_size 64 --lr 0.001 --emb_size 128 --epochs 100 --save_appendix component_pin_net_L4_H64_BS64_LR0.001_E128 --no_val
-----



STDERR:
  File "main.py", line 370, in <module>
    main()
  File "main.py", line 254, in main
    dataset = dataset_class(
  File "/home/philip/projects/ltspice_examples_code_repo/Circuit-Completion-Using-GNNs/component_classification_with_link_prediction_head/evaluation/FEGIN/kernel/circuit_datasets.py", line 15, in __init__
    self.data, self.slices = torch.load(self.processed_paths[0])
  File "/home/philip/.local/lib/python3.8/site-packages/torch/serialization.py", line 1040, in load
    warnings.warn(
  File "/usr/lib/python3.8/warnings.py", line 109, in _showwarnmsg
    sw(msg.message, msg.category, msg.filename, msg.lineno,
  File "main.py", line 47, in warn_with_traceback
    traceback.print_stack(file=log)
/home/philip/projects/ltspice_examples_code_repo/Circuit-Completion-Using-GNNs/component_classification_with_link_prediction_head/evaluation/FEGIN/kernel/circuit_datasets.py:15: FutureWarning: You are using `torch.load` with `weights_only=False` (the current default value), which uses the default pickle module implicitly. It is possible to construct malicious pickle data which will execute arbitrary code during unpickling (See https://github.com/pytorch/pytorch/blob/main/SECURITY.md#untrusted-models for more details). In a future release, the default value for `weights_only` will be flipped to `True`. This limits the functions that could be executed during unpickling. Arbitrary objects will no longer be allowed to be loaded via this mode unless they are explicitly allowlisted by the user via `torch.serialization.add_safe_globals`. We recommend you start setting `weights_only=True` for any use case where you don't have full control of the loaded file. Please open an issue on GitHub for any issues related to this experimental feature.
  self.data, self.slices = torch.load(self.processed_paths[0])
