STDOUT:
Results will be saved in /home/philip/projects/ltspice_examples_code_repo/Circuit-Completion-Using-GNNs/component_classification_with_link_prediction_head/evaluation/FEGIN/results/model_FEGIN_dataset_ltspice_examples
Command line input: python main.py --data ltspice_examples --representation component_pin_net --model FEGIN --layers 2 --hiddens 128 --batch_size 64 --lr 0.001 --emb_size 128 --epochs 100 --save_appendix component_pin_net_L2_H128_BS64_LR0.001_E128 --no_val
 is saved.
-----
ltspice_examples - FEGIN
Using 2 layers, 128 hidden units, h = 2
Loading component_pin_net representation dataset
ENTERED
Training FEGIN on component_pin_net representation
Train: 3558, Test: 846
##################ITERATION #0 ****************************************
 epoch: 0, train_loss: 1.1339, test_loss: 1.0408, test_f1: 0.3927
 epoch: 1, train_loss: 0.9898, test_loss: 0.9471, test_f1: 0.4954
 epoch: 2, train_loss: 0.9553, test_loss: 0.9546, test_f1: 0.5129
 epoch: 3, train_loss: 0.9299, test_loss: 0.9217, test_f1: 0.5037
 epoch: 4, train_loss: 0.9130, test_loss: 0.8887, test_f1: 0.5462
 epoch: 5, train_loss: 0.8875, test_loss: 0.8623, test_f1: 0.5254
 epoch: 6, train_loss: 0.8669, test_loss: 0.8637, test_f1: 0.5487
 epoch: 7, train_loss: 0.8479, test_loss: 0.9251, test_f1: 0.5146
 epoch: 8, train_loss: 0.8384, test_loss: 0.8371, test_f1: 0.5531
 epoch: 9, train_loss: 0.8111, test_loss: 0.8028, test_f1: 0.5871
 epoch: 10, train_loss: 0.7986, test_loss: 0.8787, test_f1: 0.6072
 epoch: 11, train_loss: 0.7849, test_loss: 0.7952, test_f1: 0.6046
 epoch: 12, train_loss: 0.7668, test_loss: 0.8698, test_f1: 0.5788
 epoch: 13, train_loss: 0.7419, test_loss: 0.7984, test_f1: 0.5806
 epoch: 14, train_loss: 0.7419, test_loss: 0.7746, test_f1: 0.6307
 epoch: 15, train_loss: 0.7204, test_loss: 0.7732, test_f1: 0.6301
 epoch: 16, train_loss: 0.7028, test_loss: 0.7912, test_f1: 0.6244
 epoch: 17, train_loss: 0.6963, test_loss: 0.8097, test_f1: 0.6301
 epoch: 18, train_loss: 0.6843, test_loss: 0.7861, test_f1: 0.6145
 epoch: 19, train_loss: 0.6636, test_loss: 0.7182, test_f1: 0.6644
 epoch: 20, train_loss: 0.6540, test_loss: 0.7459, test_f1: 0.6333
 epoch: 21, train_loss: 0.6314, test_loss: 0.7302, test_f1: 0.6482
 epoch: 22, train_loss: 0.6359, test_loss: 0.7711, test_f1: 0.6453
 epoch: 23, train_loss: 0.6214, test_loss: 0.7294, test_f1: 0.6586
 epoch: 24, train_loss: 0.6180, test_loss: 0.7564, test_f1: 0.6520
 epoch: 25, train_loss: 0.6117, test_loss: 0.6781, test_f1: 0.6787
 epoch: 26, train_loss: 0.6022, test_loss: 0.8004, test_f1: 0.6443
 epoch: 27, train_loss: 0.5960, test_loss: 0.7048, test_f1: 0.6730
 epoch: 28, train_loss: 0.5906, test_loss: 0.7650, test_f1: 0.6564
 epoch: 29, train_loss: 0.5580, test_loss: 0.8241, test_f1: 0.6385
 epoch: 30, train_loss: 0.5508, test_loss: 0.8183, test_f1: 0.6668
 epoch: 31, train_loss: 0.5532, test_loss: 0.7574, test_f1: 0.6750
 epoch: 32, train_loss: 0.5391, test_loss: 0.7610, test_f1: 0.6638
 epoch: 33, train_loss: 0.5143, test_loss: 0.8746, test_f1: 0.6513
 epoch: 34, train_loss: 0.5305, test_loss: 0.7843, test_f1: 0.6982
 epoch: 35, train_loss: 0.5078, test_loss: 0.8837, test_f1: 0.6586
 epoch: 36, train_loss: 0.5041, test_loss: 0.7822, test_f1: 0.6741
 epoch: 37, train_loss: 0.4969, test_loss: 0.9381, test_f1: 0.6655
 epoch: 38, train_loss: 0.4861, test_loss: 0.8718, test_f1: 0.6640
 epoch: 39, train_loss: 0.4703, test_loss: 0.7979, test_f1: 0.6764
 epoch: 40, train_loss: 0.4758, test_loss: 0.9688, test_f1: 0.6562
 epoch: 41, train_loss: 0.4621, test_loss: 0.8070, test_f1: 0.6819
 epoch: 42, train_loss: 0.4589, test_loss: 0.9452, test_f1: 0.6695
 epoch: 43, train_loss: 0.4432, test_loss: 0.8030, test_f1: 0.6769
 epoch: 44, train_loss: 0.4257, test_loss: 0.8008, test_f1: 0.6759
 epoch: 45, train_loss: 0.4575, test_loss: 0.8843, test_f1: 0.6590
 epoch: 46, train_loss: 0.4285, test_loss: 0.9399, test_f1: 0.6821
 epoch: 47, train_loss: 0.4182, test_loss: 0.8128, test_f1: 0.7083
 epoch: 48, train_loss: 0.3978, test_loss: 0.9229, test_f1: 0.6515
 epoch: 49, train_loss: 0.4181, test_loss: 0.9582, test_f1: 0.6767
 epoch: 50, train_loss: 0.3987, test_loss: 0.9191, test_f1: 0.6823
 epoch: 51, train_loss: 0.3728, test_loss: 0.9778, test_f1: 0.6772
 epoch: 52, train_loss: 0.3429, test_loss: 0.9924, test_f1: 0.6665
 epoch: 53, train_loss: 0.3329, test_loss: 0.9451, test_f1: 0.6633
 epoch: 54, train_loss: 0.3245, test_loss: 1.0414, test_f1: 0.7017
 epoch: 55, train_loss: 0.3212, test_loss: 0.9832, test_f1: 0.6852
 epoch: 56, train_loss: 0.3204, test_loss: 0.9907, test_f1: 0.6802
 epoch: 57, train_loss: 0.3037, test_loss: 1.1167, test_f1: 0.6785
 epoch: 58, train_loss: 0.3095, test_loss: 1.1576, test_f1: 0.6673
 epoch: 59, train_loss: 0.3069, test_loss: 1.1164, test_f1: 0.6662
 epoch: 60, train_loss: 0.3085, test_loss: 1.1290, test_f1: 0.6895
 epoch: 61, train_loss: 0.2986, test_loss: 0.9588, test_f1: 0.7119
 epoch: 62, train_loss: 0.2976, test_loss: 1.1526, test_f1: 0.6668
 epoch: 63, train_loss: 0.3042, test_loss: 1.0470, test_f1: 0.6984
 epoch: 64, train_loss: 0.2943, test_loss: 1.1108, test_f1: 0.6640
 epoch: 65, train_loss: 0.2800, test_loss: 1.2826, test_f1: 0.6835
 epoch: 66, train_loss: 0.2849, test_loss: 1.2095, test_f1: 0.6872
 epoch: 67, train_loss: 0.2923, test_loss: 1.2123, test_f1: 0.6701
 epoch: 68, train_loss: 0.2781, test_loss: 1.2436, test_f1: 0.6652
 epoch: 69, train_loss: 0.2713, test_loss: 1.2042, test_f1: 0.6656
 epoch: 70, train_loss: 0.2596, test_loss: 1.1414, test_f1: 0.6939
 epoch: 71, train_loss: 0.2788, test_loss: 1.2226, test_f1: 0.6801
 epoch: 72, train_loss: 0.2547, test_loss: 1.4575, test_f1: 0.6660
 epoch: 73, train_loss: 0.2635, test_loss: 1.2927, test_f1: 0.6857
 epoch: 74, train_loss: 0.2462, test_loss: 1.3032, test_f1: 0.6672
 epoch: 75, train_loss: 0.2509, test_loss: 1.2806, test_f1: 0.6707
 epoch: 76, train_loss: 0.2422, test_loss: 1.4175, test_f1: 0.6565
 epoch: 77, train_loss: 0.2523, test_loss: 1.3692, test_f1: 0.6569
 epoch: 78, train_loss: 0.2544, test_loss: 1.2905, test_f1: 0.7089
 epoch: 79, train_loss: 0.2715, test_loss: 1.3352, test_f1: 0.6763
 epoch: 80, train_loss: 0.2298, test_loss: 1.3248, test_f1: 0.6842
 epoch: 81, train_loss: 0.2296, test_loss: 1.3404, test_f1: 0.6738
 epoch: 82, train_loss: 0.2551, test_loss: 1.4665, test_f1: 0.6803
 epoch: 83, train_loss: 0.2502, test_loss: 1.2915, test_f1: 0.6805
 epoch: 84, train_loss: 0.2245, test_loss: 1.4168, test_f1: 0.6598
 epoch: 85, train_loss: 0.2237, test_loss: 1.3916, test_f1: 0.6932
 epoch: 86, train_loss: 0.2222, test_loss: 1.3850, test_f1: 0.6972
 epoch: 87, train_loss: 0.2233, test_loss: 1.5542, test_f1: 0.6623
 epoch: 88, train_loss: 0.2291, test_loss: 1.3946, test_f1: 0.6695
 epoch: 89, train_loss: 0.2144, test_loss: 1.5464, test_f1: 0.6713
 epoch: 90, train_loss: 0.2039, test_loss: 1.4312, test_f1: 0.6687
 epoch: 91, train_loss: 0.2194, test_loss: 1.4543, test_f1: 0.6793
 epoch: 92, train_loss: 0.2102, test_loss: 1.4800, test_f1: 0.7014
 epoch: 93, train_loss: 0.2014, test_loss: 1.4566, test_f1: 0.6688
 epoch: 94, train_loss: 0.2001, test_loss: 1.6394, test_f1: 0.6687
 epoch: 95, train_loss: 0.2073, test_loss: 1.4622, test_f1: 0.6835
 epoch: 96, train_loss: 0.1950, test_loss: 1.5269, test_f1: 0.6753
 epoch: 97, train_loss: 0.2012, test_loss: 1.4590, test_f1: 0.6714
 epoch: 98, train_loss: 0.2004, test_loss: 1.4653, test_f1: 0.6659
 epoch: 99, train_loss: 0.1860, test_loss: 1.6226, test_f1: 0.6594
##################ITERATION #1 ****************************************
 epoch: 0, train_loss: 1.0580, test_loss: 0.9803, test_f1: 0.5094
 epoch: 1, train_loss: 0.9529, test_loss: 0.8950, test_f1: 0.5094
 epoch: 2, train_loss: 0.9077, test_loss: 0.8857, test_f1: 0.5458
 epoch: 3, train_loss: 0.8880, test_loss: 0.8312, test_f1: 0.5972
 epoch: 4, train_loss: 0.8630, test_loss: 0.8132, test_f1: 0.6303
 epoch: 5, train_loss: 0.8359, test_loss: 0.8501, test_f1: 0.5807
 epoch: 6, train_loss: 0.8064, test_loss: 0.8061, test_f1: 0.6268
 epoch: 7, train_loss: 0.7956, test_loss: 0.7726, test_f1: 0.6090
 epoch: 8, train_loss: 0.7670, test_loss: 0.7397, test_f1: 0.6458
 epoch: 9, train_loss: 0.7354, test_loss: 0.7392, test_f1: 0.6302
 epoch: 10, train_loss: 0.7271, test_loss: 0.7253, test_f1: 0.6554
 epoch: 11, train_loss: 0.7118, test_loss: 0.7744, test_f1: 0.6248
 epoch: 12, train_loss: 0.6955, test_loss: 0.7012, test_f1: 0.6595
 epoch: 13, train_loss: 0.6876, test_loss: 0.7709, test_f1: 0.6457
 epoch: 14, train_loss: 0.6804, test_loss: 0.6956, test_f1: 0.6919
 epoch: 15, train_loss: 0.6353, test_loss: 0.7012, test_f1: 0.6903
 epoch: 16, train_loss: 0.6362, test_loss: 0.7021, test_f1: 0.6697
 epoch: 17, train_loss: 0.6327, test_loss: 0.7169, test_f1: 0.6667
 epoch: 18, train_loss: 0.6064, test_loss: 0.8218, test_f1: 0.6745
 epoch: 19, train_loss: 0.5952, test_loss: 0.8097, test_f1: 0.6899
 epoch: 20, train_loss: 0.6083, test_loss: 0.7681, test_f1: 0.6640
 epoch: 21, train_loss: 0.5814, test_loss: 0.7527, test_f1: 0.6667
 epoch: 22, train_loss: 0.5660, test_loss: 0.8473, test_f1: 0.6534
 epoch: 23, train_loss: 0.5564, test_loss: 0.8488, test_f1: 0.6502
 epoch: 24, train_loss: 0.5356, test_loss: 0.8150, test_f1: 0.6585
 epoch: 25, train_loss: 0.5297, test_loss: 0.8518, test_f1: 0.6698
 epoch: 26, train_loss: 0.5259, test_loss: 0.7313, test_f1: 0.6718
 epoch: 27, train_loss: 0.5084, test_loss: 0.9060, test_f1: 0.6591
 epoch: 28, train_loss: 0.5172, test_loss: 0.8420, test_f1: 0.6715
 epoch: 29, train_loss: 0.4858, test_loss: 0.9124, test_f1: 0.6887
 epoch: 30, train_loss: 0.5131, test_loss: 0.8793, test_f1: 0.6583
 epoch: 31, train_loss: 0.4792, test_loss: 0.8635, test_f1: 0.6555
 epoch: 32, train_loss: 0.4681, test_loss: 0.8178, test_f1: 0.6803
 epoch: 33, train_loss: 0.4755, test_loss: 0.8324, test_f1: 0.6855
 epoch: 34, train_loss: 0.4402, test_loss: 0.7915, test_f1: 0.6927
 epoch: 35, train_loss: 0.4388, test_loss: 0.8744, test_f1: 0.7066
 epoch: 36, train_loss: 0.4309, test_loss: 0.9217, test_f1: 0.6707
 epoch: 37, train_loss: 0.4190, test_loss: 0.9050, test_f1: 0.6812
 epoch: 38, train_loss: 0.4518, test_loss: 0.9303, test_f1: 0.6747
 epoch: 39, train_loss: 0.4144, test_loss: 0.8711, test_f1: 0.6742
 epoch: 40, train_loss: 0.4074, test_loss: 0.7663, test_f1: 0.6769
 epoch: 41, train_loss: 0.4068, test_loss: 1.0031, test_f1: 0.6649
 epoch: 42, train_loss: 0.3998, test_loss: 0.9148, test_f1: 0.6941
 epoch: 43, train_loss: 0.3894, test_loss: 0.9626, test_f1: 0.6700
 epoch: 44, train_loss: 0.3839, test_loss: 0.9340, test_f1: 0.7083
 epoch: 45, train_loss: 0.3617, test_loss: 1.0517, test_f1: 0.6820
 epoch: 46, train_loss: 0.3572, test_loss: 1.0581, test_f1: 0.6610
 epoch: 47, train_loss: 0.3707, test_loss: 1.0526, test_f1: 0.6850
 epoch: 48, train_loss: 0.3723, test_loss: 0.9138, test_f1: 0.6870
 epoch: 49, train_loss: 0.3619, test_loss: 1.1006, test_f1: 0.6561
 epoch: 50, train_loss: 0.3320, test_loss: 1.1973, test_f1: 0.6794
 epoch: 51, train_loss: 0.3141, test_loss: 1.1153, test_f1: 0.6795
 epoch: 52, train_loss: 0.2910, test_loss: 1.1038, test_f1: 0.6969
 epoch: 53, train_loss: 0.2901, test_loss: 1.2476, test_f1: 0.6886
 epoch: 54, train_loss: 0.2731, test_loss: 1.2925, test_f1: 0.6656
 epoch: 55, train_loss: 0.2798, test_loss: 1.1480, test_f1: 0.7052
 epoch: 56, train_loss: 0.2555, test_loss: 1.2311, test_f1: 0.6942
 epoch: 57, train_loss: 0.2609, test_loss: 1.3448, test_f1: 0.6782
 epoch: 58, train_loss: 0.2527, test_loss: 1.3484, test_f1: 0.6776
 epoch: 59, train_loss: 0.2708, test_loss: 1.3018, test_f1: 0.7033
 epoch: 60, train_loss: 0.2560, test_loss: 1.2234, test_f1: 0.6882
 epoch: 61, train_loss: 0.2384, test_loss: 1.3124, test_f1: 0.6751
 epoch: 62, train_loss: 0.2333, test_loss: 1.3022, test_f1: 0.6996
 epoch: 63, train_loss: 0.2265, test_loss: 1.3172, test_f1: 0.6749
 epoch: 64, train_loss: 0.2472, test_loss: 1.3446, test_f1: 0.6808
 epoch: 65, train_loss: 0.2600, test_loss: 1.3727, test_f1: 0.6745
 epoch: 66, train_loss: 0.2263, test_loss: 1.4533, test_f1: 0.6751
 epoch: 67, train_loss: 0.2359, test_loss: 1.3621, test_f1: 0.6559
 epoch: 68, train_loss: 0.2234, test_loss: 1.4295, test_f1: 0.6722
 epoch: 69, train_loss: 0.2258, test_loss: 1.3868, test_f1: 0.6788
 epoch: 70, train_loss: 0.2180, test_loss: 1.2917, test_f1: 0.6797
 epoch: 71, train_loss: 0.2273, test_loss: 1.5572, test_f1: 0.6584
 epoch: 72, train_loss: 0.2225, test_loss: 1.3032, test_f1: 0.6822
 epoch: 73, train_loss: 0.2278, test_loss: 1.4569, test_f1: 0.6890
 epoch: 74, train_loss: 0.2167, test_loss: 1.4906, test_f1: 0.6800
 epoch: 75, train_loss: 0.2060, test_loss: 1.4260, test_f1: 0.6838
 epoch: 76, train_loss: 0.1944, test_loss: 1.4692, test_f1: 0.6820
 epoch: 77, train_loss: 0.1887, test_loss: 1.4588, test_f1: 0.6739
 epoch: 78, train_loss: 0.1905, test_loss: 1.5779, test_f1: 0.6855
 epoch: 79, train_loss: 0.2046, test_loss: 1.4583, test_f1: 0.6728
 epoch: 80, train_loss: 0.1949, test_loss: 1.5124, test_f1: 0.6775
 epoch: 81, train_loss: 0.1871, test_loss: 1.4781, test_f1: 0.6853
 epoch: 82, train_loss: 0.1861, test_loss: 1.5613, test_f1: 0.6970
 epoch: 83, train_loss: 0.1967, test_loss: 1.6493, test_f1: 0.6775
 epoch: 84, train_loss: 0.1989, test_loss: 1.5099, test_f1: 0.6889
 epoch: 85, train_loss: 0.2079, test_loss: 1.5596, test_f1: 0.6764
 epoch: 86, train_loss: 0.1906, test_loss: 1.5240, test_f1: 0.6835
 epoch: 87, train_loss: 0.2009, test_loss: 1.5121, test_f1: 0.6844
 epoch: 88, train_loss: 0.2031, test_loss: 1.6291, test_f1: 0.6774
 epoch: 89, train_loss: 0.2061, test_loss: 1.5864, test_f1: 0.6719
 epoch: 90, train_loss: 0.1764, test_loss: 1.6169, test_f1: 0.6901
 epoch: 91, train_loss: 0.1836, test_loss: 1.5985, test_f1: 0.6735
 epoch: 92, train_loss: 0.1795, test_loss: 1.4852, test_f1: 0.6877
 epoch: 93, train_loss: 0.1836, test_loss: 1.6785, test_f1: 0.6706
 epoch: 94, train_loss: 0.1780, test_loss: 1.6168, test_f1: 0.6746
 epoch: 95, train_loss: 0.1737, test_loss: 1.5637, test_f1: 0.6843
 epoch: 96, train_loss: 0.1625, test_loss: 1.6392, test_f1: 0.6862
 epoch: 97, train_loss: 0.1671, test_loss: 1.6658, test_f1: 0.6768
 epoch: 98, train_loss: 0.1563, test_loss: 1.8363, test_f1: 0.6713
 epoch: 99, train_loss: 0.1672, test_loss: 1.7119, test_f1: 0.6737
##################ITERATION #2 ****************************************
 epoch: 0, train_loss: 1.1428, test_loss: 1.0098, test_f1: 0.4919
 epoch: 1, train_loss: 0.9424, test_loss: 0.9274, test_f1: 0.5208
 epoch: 2, train_loss: 0.8941, test_loss: 0.8778, test_f1: 0.5276
 epoch: 3, train_loss: 0.8656, test_loss: 0.8804, test_f1: 0.5967
 epoch: 4, train_loss: 0.8550, test_loss: 0.9452, test_f1: 0.5572
 epoch: 5, train_loss: 0.8225, test_loss: 0.7837, test_f1: 0.6075
 epoch: 6, train_loss: 0.8046, test_loss: 0.8212, test_f1: 0.6090
 epoch: 7, train_loss: 0.8028, test_loss: 0.7899, test_f1: 0.6114
 epoch: 8, train_loss: 0.7575, test_loss: 0.8165, test_f1: 0.6054
 epoch: 9, train_loss: 0.7500, test_loss: 0.7689, test_f1: 0.6523
 epoch: 10, train_loss: 0.7261, test_loss: 0.8097, test_f1: 0.6112
 epoch: 11, train_loss: 0.7198, test_loss: 0.7934, test_f1: 0.6117
 epoch: 12, train_loss: 0.6970, test_loss: 0.7526, test_f1: 0.6559
 epoch: 13, train_loss: 0.6987, test_loss: 0.7760, test_f1: 0.6168
 epoch: 14, train_loss: 0.6687, test_loss: 0.8438, test_f1: 0.6233
 epoch: 15, train_loss: 0.6567, test_loss: 0.8129, test_f1: 0.6468
 epoch: 16, train_loss: 0.6424, test_loss: 0.7652, test_f1: 0.6689
 epoch: 17, train_loss: 0.6308, test_loss: 0.7680, test_f1: 0.6415
 epoch: 18, train_loss: 0.6203, test_loss: 0.7684, test_f1: 0.6809
 epoch: 19, train_loss: 0.6159, test_loss: 0.7836, test_f1: 0.6502
 epoch: 20, train_loss: 0.6073, test_loss: 0.7804, test_f1: 0.6440
 epoch: 21, train_loss: 0.5868, test_loss: 0.7946, test_f1: 0.6426
 epoch: 22, train_loss: 0.5885, test_loss: 0.8161, test_f1: 0.6548
 epoch: 23, train_loss: 0.5620, test_loss: 0.8850, test_f1: 0.6751
 epoch: 24, train_loss: 0.5681, test_loss: 0.8686, test_f1: 0.6566
 epoch: 25, train_loss: 0.5599, test_loss: 0.8231, test_f1: 0.6714
 epoch: 26, train_loss: 0.5385, test_loss: 0.8243, test_f1: 0.6709
 epoch: 27, train_loss: 0.5279, test_loss: 0.7693, test_f1: 0.6749
 epoch: 28, train_loss: 0.5249, test_loss: 0.8998, test_f1: 0.6626
 epoch: 29, train_loss: 0.5176, test_loss: 0.8850, test_f1: 0.6435
 epoch: 30, train_loss: 0.5002, test_loss: 0.8030, test_f1: 0.6761
 epoch: 31, train_loss: 0.4894, test_loss: 0.8598, test_f1: 0.6763
 epoch: 32, train_loss: 0.4944, test_loss: 0.8318, test_f1: 0.6811
 epoch: 33, train_loss: 0.4888, test_loss: 0.8553, test_f1: 0.6716
 epoch: 34, train_loss: 0.4523, test_loss: 0.8451, test_f1: 0.6692
 epoch: 35, train_loss: 0.4508, test_loss: 0.8861, test_f1: 0.6581
 epoch: 36, train_loss: 0.4386, test_loss: 0.8617, test_f1: 0.6619
 epoch: 37, train_loss: 0.4364, test_loss: 0.9508, test_f1: 0.6522
 epoch: 38, train_loss: 0.4328, test_loss: 0.8921, test_f1: 0.6663
 epoch: 39, train_loss: 0.4529, test_loss: 0.9960, test_f1: 0.6589
 epoch: 40, train_loss: 0.4071, test_loss: 0.9318, test_f1: 0.6704
 epoch: 41, train_loss: 0.4093, test_loss: 0.9337, test_f1: 0.6759
 epoch: 42, train_loss: 0.4187, test_loss: 1.0055, test_f1: 0.6503
 epoch: 43, train_loss: 0.4478, test_loss: 0.9172, test_f1: 0.6630
 epoch: 44, train_loss: 0.4041, test_loss: 0.9761, test_f1: 0.6952
 epoch: 45, train_loss: 0.4013, test_loss: 1.0323, test_f1: 0.6627
 epoch: 46, train_loss: 0.3787, test_loss: 0.9842, test_f1: 0.6815
 epoch: 47, train_loss: 0.3822, test_loss: 1.0284, test_f1: 0.6568
 epoch: 48, train_loss: 0.3763, test_loss: 0.9639, test_f1: 0.6819
 epoch: 49, train_loss: 0.3612, test_loss: 1.0149, test_f1: 0.6664
 epoch: 50, train_loss: 0.3694, test_loss: 1.0633, test_f1: 0.6793
 epoch: 51, train_loss: 0.3247, test_loss: 0.9868, test_f1: 0.6894
 epoch: 52, train_loss: 0.3060, test_loss: 1.0552, test_f1: 0.6658
 epoch: 53, train_loss: 0.3103, test_loss: 1.0255, test_f1: 0.6700
 epoch: 54, train_loss: 0.2894, test_loss: 1.1748, test_f1: 0.6705
 epoch: 55, train_loss: 0.2743, test_loss: 1.1479, test_f1: 0.6761
 epoch: 56, train_loss: 0.2868, test_loss: 1.1659, test_f1: 0.6792
 epoch: 57, train_loss: 0.2668, test_loss: 1.1324, test_f1: 0.6799
 epoch: 58, train_loss: 0.2705, test_loss: 1.1394, test_f1: 0.6763
 epoch: 59, train_loss: 0.2491, test_loss: 1.1975, test_f1: 0.6777
 epoch: 60, train_loss: 0.2535, test_loss: 1.1926, test_f1: 0.6796
 epoch: 61, train_loss: 0.2701, test_loss: 1.1472, test_f1: 0.6871
 epoch: 62, train_loss: 0.2519, test_loss: 1.1767, test_f1: 0.6929
 epoch: 63, train_loss: 0.2451, test_loss: 1.2218, test_f1: 0.6823
 epoch: 64, train_loss: 0.2495, test_loss: 1.1843, test_f1: 0.6807
 epoch: 65, train_loss: 0.2414, test_loss: 1.2394, test_f1: 0.6826
 epoch: 66, train_loss: 0.2373, test_loss: 1.1508, test_f1: 0.6843
 epoch: 67, train_loss: 0.2366, test_loss: 1.3684, test_f1: 0.6730
 epoch: 68, train_loss: 0.2484, test_loss: 1.2159, test_f1: 0.6928
 epoch: 69, train_loss: 0.2464, test_loss: 1.1998, test_f1: 0.6824
 epoch: 70, train_loss: 0.2276, test_loss: 1.2241, test_f1: 0.6888
 epoch: 71, train_loss: 0.2136, test_loss: 1.2243, test_f1: 0.6880
 epoch: 72, train_loss: 0.2250, test_loss: 1.2902, test_f1: 0.6978
 epoch: 73, train_loss: 0.2138, test_loss: 1.3033, test_f1: 0.6792
 epoch: 74, train_loss: 0.2265, test_loss: 1.3205, test_f1: 0.6924
 epoch: 75, train_loss: 0.2150, test_loss: 1.4659, test_f1: 0.6544
 epoch: 76, train_loss: 0.2251, test_loss: 1.3680, test_f1: 0.6769
 epoch: 77, train_loss: 0.2182, test_loss: 1.3156, test_f1: 0.6832
 epoch: 78, train_loss: 0.2228, test_loss: 1.2557, test_f1: 0.6811
 epoch: 79, train_loss: 0.1926, test_loss: 1.3643, test_f1: 0.6733
 epoch: 80, train_loss: 0.2126, test_loss: 1.3119, test_f1: 0.6898
 epoch: 81, train_loss: 0.2341, test_loss: 1.2997, test_f1: 0.6729
 epoch: 82, train_loss: 0.2017, test_loss: 1.4019, test_f1: 0.6703
 epoch: 83, train_loss: 0.1980, test_loss: 1.3062, test_f1: 0.6827
 epoch: 84, train_loss: 0.2243, test_loss: 1.3597, test_f1: 0.6702
 epoch: 85, train_loss: 0.1970, test_loss: 1.3061, test_f1: 0.6816
 epoch: 86, train_loss: 0.2112, test_loss: 1.3713, test_f1: 0.6680
 epoch: 87, train_loss: 0.1978, test_loss: 1.4160, test_f1: 0.6838
 epoch: 88, train_loss: 0.1936, test_loss: 1.3385, test_f1: 0.6856
 epoch: 89, train_loss: 0.1872, test_loss: 1.5092, test_f1: 0.6748
 epoch: 90, train_loss: 0.1790, test_loss: 1.5164, test_f1: 0.6789
 epoch: 91, train_loss: 0.1846, test_loss: 1.4322, test_f1: 0.6902
 epoch: 92, train_loss: 0.1814, test_loss: 1.5384, test_f1: 0.6665
 epoch: 93, train_loss: 0.1740, test_loss: 1.4959, test_f1: 0.6756
 epoch: 94, train_loss: 0.1850, test_loss: 1.4728, test_f1: 0.6913
 epoch: 95, train_loss: 0.1741, test_loss: 1.4268, test_f1: 0.6814
 epoch: 96, train_loss: 0.1724, test_loss: 1.5123, test_f1: 0.6620
 epoch: 97, train_loss: 0.1765, test_loss: 1.4771, test_f1: 0.6943
 epoch: 98, train_loss: 0.1813, test_loss: 1.4498, test_f1: 0.6703
 epoch: 99, train_loss: 0.1905, test_loss: 1.4347, test_f1: 0.6737
##################ITERATION #3 ****************************************
 epoch: 0, train_loss: 1.2053, test_loss: 0.9668, test_f1: 0.4712
 epoch: 1, train_loss: 0.9628, test_loss: 0.8964, test_f1: 0.5274
 epoch: 2, train_loss: 0.9130, test_loss: 0.9116, test_f1: 0.4965
 epoch: 3, train_loss: 0.8949, test_loss: 0.8712, test_f1: 0.5362
 epoch: 4, train_loss: 0.8713, test_loss: 0.8104, test_f1: 0.5906
 epoch: 5, train_loss: 0.8367, test_loss: 0.8173, test_f1: 0.5664
 epoch: 6, train_loss: 0.8252, test_loss: 0.8315, test_f1: 0.5767
 epoch: 7, train_loss: 0.8110, test_loss: 0.7922, test_f1: 0.6100
 epoch: 8, train_loss: 0.7847, test_loss: 0.8082, test_f1: 0.6210
 epoch: 9, train_loss: 0.7646, test_loss: 0.8140, test_f1: 0.6007
 epoch: 10, train_loss: 0.7436, test_loss: 0.8023, test_f1: 0.6300
 epoch: 11, train_loss: 0.7216, test_loss: 0.7802, test_f1: 0.5997
 epoch: 12, train_loss: 0.7048, test_loss: 0.7143, test_f1: 0.6717
 epoch: 13, train_loss: 0.7184, test_loss: 0.7414, test_f1: 0.6278
 epoch: 14, train_loss: 0.7025, test_loss: 0.7474, test_f1: 0.6293
 epoch: 15, train_loss: 0.6876, test_loss: 0.7194, test_f1: 0.6295
 epoch: 16, train_loss: 0.6550, test_loss: 0.7279, test_f1: 0.6417
 epoch: 17, train_loss: 0.6579, test_loss: 0.7168, test_f1: 0.6658
 epoch: 18, train_loss: 0.6274, test_loss: 0.7453, test_f1: 0.6550
 epoch: 19, train_loss: 0.6388, test_loss: 0.7341, test_f1: 0.6683
 epoch: 20, train_loss: 0.6241, test_loss: 0.7476, test_f1: 0.6593
 epoch: 21, train_loss: 0.6109, test_loss: 0.8591, test_f1: 0.6297
 epoch: 22, train_loss: 0.6064, test_loss: 0.7136, test_f1: 0.6844
 epoch: 23, train_loss: 0.5948, test_loss: 0.7844, test_f1: 0.6602
 epoch: 24, train_loss: 0.5810, test_loss: 0.7617, test_f1: 0.6857
 epoch: 25, train_loss: 0.5771, test_loss: 0.7634, test_f1: 0.6826
 epoch: 26, train_loss: 0.5692, test_loss: 0.7459, test_f1: 0.6577
 epoch: 27, train_loss: 0.5628, test_loss: 0.8212, test_f1: 0.6776
 epoch: 28, train_loss: 0.5599, test_loss: 0.7249, test_f1: 0.6850
 epoch: 29, train_loss: 0.5340, test_loss: 0.7585, test_f1: 0.6600
 epoch: 30, train_loss: 0.5071, test_loss: 0.7563, test_f1: 0.6721
 epoch: 31, train_loss: 0.5048, test_loss: 0.8710, test_f1: 0.6618
 epoch: 32, train_loss: 0.5106, test_loss: 0.7854, test_f1: 0.6841
 epoch: 33, train_loss: 0.5133, test_loss: 0.7991, test_f1: 0.6672
 epoch: 34, train_loss: 0.5021, test_loss: 0.7952, test_f1: 0.6967
 epoch: 35, train_loss: 0.4997, test_loss: 0.7789, test_f1: 0.6919
 epoch: 36, train_loss: 0.4735, test_loss: 0.8303, test_f1: 0.6734
 epoch: 37, train_loss: 0.4358, test_loss: 0.9486, test_f1: 0.6511
 epoch: 38, train_loss: 0.4464, test_loss: 0.8691, test_f1: 0.6879
 epoch: 39, train_loss: 0.4663, test_loss: 0.9077, test_f1: 0.6675
 epoch: 40, train_loss: 0.4468, test_loss: 0.9370, test_f1: 0.6489
 epoch: 41, train_loss: 0.4506, test_loss: 1.1003, test_f1: 0.6440
 epoch: 42, train_loss: 0.4240, test_loss: 0.9470, test_f1: 0.6705
 epoch: 43, train_loss: 0.4210, test_loss: 0.8806, test_f1: 0.6887
 epoch: 44, train_loss: 0.4341, test_loss: 0.9089, test_f1: 0.6762
 epoch: 45, train_loss: 0.4145, test_loss: 0.8933, test_f1: 0.6701
 epoch: 46, train_loss: 0.4103, test_loss: 0.9362, test_f1: 0.6474
 epoch: 47, train_loss: 0.3907, test_loss: 0.8902, test_f1: 0.6819
 epoch: 48, train_loss: 0.4178, test_loss: 1.0330, test_f1: 0.6767
 epoch: 49, train_loss: 0.3839, test_loss: 1.0390, test_f1: 0.6594
 epoch: 50, train_loss: 0.3803, test_loss: 1.0325, test_f1: 0.6763
 epoch: 51, train_loss: 0.3459, test_loss: 1.0281, test_f1: 0.6877
 epoch: 52, train_loss: 0.3329, test_loss: 1.0843, test_f1: 0.6750
 epoch: 53, train_loss: 0.3309, test_loss: 1.0396, test_f1: 0.7047
 epoch: 54, train_loss: 0.3032, test_loss: 1.0756, test_f1: 0.6977
 epoch: 55, train_loss: 0.2963, test_loss: 1.1584, test_f1: 0.6750
 epoch: 56, train_loss: 0.3008, test_loss: 1.1846, test_f1: 0.6807
 epoch: 57, train_loss: 0.2895, test_loss: 1.1578, test_f1: 0.6797
 epoch: 58, train_loss: 0.3015, test_loss: 1.1583, test_f1: 0.6832
 epoch: 59, train_loss: 0.2932, test_loss: 1.1606, test_f1: 0.6940
 epoch: 60, train_loss: 0.2837, test_loss: 1.1537, test_f1: 0.6938
 epoch: 61, train_loss: 0.3076, test_loss: 1.2018, test_f1: 0.6920
 epoch: 62, train_loss: 0.2754, test_loss: 1.2065, test_f1: 0.6866
 epoch: 63, train_loss: 0.2765, test_loss: 1.2290, test_f1: 0.6758
 epoch: 64, train_loss: 0.2697, test_loss: 1.1922, test_f1: 0.6816
 epoch: 65, train_loss: 0.2564, test_loss: 1.2641, test_f1: 0.6837
 epoch: 66, train_loss: 0.2634, test_loss: 1.2845, test_f1: 0.6863
 epoch: 67, train_loss: 0.2701, test_loss: 1.3237, test_f1: 0.6931
 epoch: 68, train_loss: 0.2649, test_loss: 1.2414, test_f1: 0.6748
 epoch: 69, train_loss: 0.2336, test_loss: 1.2758, test_f1: 0.6871
 epoch: 70, train_loss: 0.2535, test_loss: 1.2149, test_f1: 0.6979
 epoch: 71, train_loss: 0.2521, test_loss: 1.3295, test_f1: 0.6767
 epoch: 72, train_loss: 0.2465, test_loss: 1.2646, test_f1: 0.6769
 epoch: 73, train_loss: 0.2410, test_loss: 1.2742, test_f1: 0.6979
 epoch: 74, train_loss: 0.2457, test_loss: 1.2923, test_f1: 0.6889
 epoch: 75, train_loss: 0.2460, test_loss: 1.3128, test_f1: 0.6652
 epoch: 76, train_loss: 0.2316, test_loss: 1.3549, test_f1: 0.7010
 epoch: 77, train_loss: 0.2332, test_loss: 1.2961, test_f1: 0.6859
 epoch: 78, train_loss: 0.2334, test_loss: 1.3657, test_f1: 0.6825
 epoch: 79, train_loss: 0.2207, test_loss: 1.4026, test_f1: 0.6893
 epoch: 80, train_loss: 0.2200, test_loss: 1.3879, test_f1: 0.6748
 epoch: 81, train_loss: 0.2260, test_loss: 1.3825, test_f1: 0.6788
 epoch: 82, train_loss: 0.2324, test_loss: 1.3860, test_f1: 0.6717
 epoch: 83, train_loss: 0.2309, test_loss: 1.3689, test_f1: 0.6823
 epoch: 84, train_loss: 0.2101, test_loss: 1.4249, test_f1: 0.6671
 epoch: 85, train_loss: 0.2287, test_loss: 1.3940, test_f1: 0.6744
 epoch: 86, train_loss: 0.2239, test_loss: 1.3812, test_f1: 0.6848
 epoch: 87, train_loss: 0.2143, test_loss: 1.3287, test_f1: 0.6854
 epoch: 88, train_loss: 0.1847, test_loss: 1.4487, test_f1: 0.6781
 epoch: 89, train_loss: 0.2079, test_loss: 1.3947, test_f1: 0.6829
 epoch: 90, train_loss: 0.1989, test_loss: 1.4790, test_f1: 0.6794
 epoch: 91, train_loss: 0.2286, test_loss: 1.4482, test_f1: 0.6816
 epoch: 92, train_loss: 0.1973, test_loss: 1.4359, test_f1: 0.6862
 epoch: 93, train_loss: 0.1953, test_loss: 1.3617, test_f1: 0.6944
 epoch: 94, train_loss: 0.2097, test_loss: 1.4374, test_f1: 0.6888
 epoch: 95, train_loss: 0.1801, test_loss: 1.4283, test_f1: 0.6891
 epoch: 96, train_loss: 0.1820, test_loss: 1.5093, test_f1: 0.6807
 epoch: 97, train_loss: 0.1879, test_loss: 1.5157, test_f1: 0.6762
 epoch: 98, train_loss: 0.1779, test_loss: 1.4224, test_f1: 0.6852
 epoch: 99, train_loss: 0.2032, test_loss: 1.4791, test_f1: 0.6873
##################ITERATION #4 ****************************************
 epoch: 0, train_loss: 1.2834, test_loss: 0.9986, test_f1: 0.5038
 epoch: 1, train_loss: 0.9887, test_loss: 0.9165, test_f1: 0.5284
 epoch: 2, train_loss: 0.9127, test_loss: 0.9012, test_f1: 0.5691
 epoch: 3, train_loss: 0.8987, test_loss: 0.8919, test_f1: 0.5421
 epoch: 4, train_loss: 0.8832, test_loss: 0.8937, test_f1: 0.5634
 epoch: 5, train_loss: 0.8289, test_loss: 0.8113, test_f1: 0.6080
 epoch: 6, train_loss: 0.8100, test_loss: 0.8267, test_f1: 0.6109
 epoch: 7, train_loss: 0.8052, test_loss: 0.8658, test_f1: 0.5991
 epoch: 8, train_loss: 0.7888, test_loss: 0.8079, test_f1: 0.6362
 epoch: 9, train_loss: 0.7653, test_loss: 0.8288, test_f1: 0.6220
 epoch: 10, train_loss: 0.7556, test_loss: 0.8009, test_f1: 0.6231
 epoch: 11, train_loss: 0.7538, test_loss: 0.7810, test_f1: 0.6334
 epoch: 12, train_loss: 0.7240, test_loss: 0.8310, test_f1: 0.6062
 epoch: 13, train_loss: 0.7268, test_loss: 0.7837, test_f1: 0.6407
 epoch: 14, train_loss: 0.6927, test_loss: 0.8058, test_f1: 0.6298
 epoch: 15, train_loss: 0.6859, test_loss: 0.9009, test_f1: 0.6045
 epoch: 16, train_loss: 0.6733, test_loss: 0.7857, test_f1: 0.6305
 epoch: 17, train_loss: 0.6573, test_loss: 0.8264, test_f1: 0.6357
 epoch: 18, train_loss: 0.6555, test_loss: 0.8490, test_f1: 0.6450
 epoch: 19, train_loss: 0.6415, test_loss: 0.9008, test_f1: 0.6271
 epoch: 20, train_loss: 0.6311, test_loss: 0.8381, test_f1: 0.6630
 epoch: 21, train_loss: 0.6163, test_loss: 0.8924, test_f1: 0.6347
 epoch: 22, train_loss: 0.6021, test_loss: 0.8126, test_f1: 0.6621
 epoch: 23, train_loss: 0.5981, test_loss: 0.8251, test_f1: 0.6370
 epoch: 24, train_loss: 0.5826, test_loss: 0.8655, test_f1: 0.6391
 epoch: 25, train_loss: 0.5903, test_loss: 0.8960, test_f1: 0.6481
 epoch: 26, train_loss: 0.5903, test_loss: 0.8244, test_f1: 0.6716
 epoch: 27, train_loss: 0.5468, test_loss: 0.8801, test_f1: 0.6573
 epoch: 28, train_loss: 0.5540, test_loss: 0.8579, test_f1: 0.6576
 epoch: 29, train_loss: 0.5448, test_loss: 0.8890, test_f1: 0.6637
 epoch: 30, train_loss: 0.5249, test_loss: 0.9161, test_f1: 0.6503
 epoch: 31, train_loss: 0.5154, test_loss: 0.8644, test_f1: 0.6660
 epoch: 32, train_loss: 0.5070, test_loss: 0.9028, test_f1: 0.6453
 epoch: 33, train_loss: 0.5058, test_loss: 0.9151, test_f1: 0.6462
 epoch: 34, train_loss: 0.5029, test_loss: 0.9662, test_f1: 0.6430
 epoch: 35, train_loss: 0.4970, test_loss: 0.9529, test_f1: 0.6649
 epoch: 36, train_loss: 0.4821, test_loss: 0.9330, test_f1: 0.6709
 epoch: 37, train_loss: 0.4739, test_loss: 0.8886, test_f1: 0.6516
 epoch: 38, train_loss: 0.4773, test_loss: 0.9367, test_f1: 0.6703
 epoch: 39, train_loss: 0.4586, test_loss: 0.9034, test_f1: 0.6950
 epoch: 40, train_loss: 0.4502, test_loss: 0.9177, test_f1: 0.6696
 epoch: 41, train_loss: 0.4306, test_loss: 0.9694, test_f1: 0.6379
 epoch: 42, train_loss: 0.4299, test_loss: 0.9395, test_f1: 0.6653
 epoch: 43, train_loss: 0.4182, test_loss: 0.9949, test_f1: 0.6564
 epoch: 44, train_loss: 0.4233, test_loss: 0.9815, test_f1: 0.6658
 epoch: 45, train_loss: 0.4105, test_loss: 0.9773, test_f1: 0.6747
 epoch: 46, train_loss: 0.4305, test_loss: 1.0491, test_f1: 0.6443
 epoch: 47, train_loss: 0.4121, test_loss: 0.9879, test_f1: 0.6753
 epoch: 48, train_loss: 0.3844, test_loss: 1.0661, test_f1: 0.6529
 epoch: 49, train_loss: 0.3769, test_loss: 1.0965, test_f1: 0.6624
 epoch: 50, train_loss: 0.3904, test_loss: 1.0781, test_f1: 0.6503
 epoch: 51, train_loss: 0.3435, test_loss: 1.0497, test_f1: 0.6778
 epoch: 52, train_loss: 0.3199, test_loss: 1.1193, test_f1: 0.6795
 epoch: 53, train_loss: 0.3196, test_loss: 1.0677, test_f1: 0.6907
 epoch: 54, train_loss: 0.2962, test_loss: 1.1266, test_f1: 0.6750
 epoch: 55, train_loss: 0.3071, test_loss: 1.1617, test_f1: 0.6825
 epoch: 56, train_loss: 0.2874, test_loss: 1.1819, test_f1: 0.6866
 epoch: 57, train_loss: 0.2976, test_loss: 1.2054, test_f1: 0.6544
 epoch: 58, train_loss: 0.2894, test_loss: 1.1551, test_f1: 0.6809
 epoch: 59, train_loss: 0.2645, test_loss: 1.2382, test_f1: 0.6727
 epoch: 60, train_loss: 0.2967, test_loss: 1.1041, test_f1: 0.6786
 epoch: 61, train_loss: 0.2826, test_loss: 1.2583, test_f1: 0.6758
 epoch: 62, train_loss: 0.2863, test_loss: 1.1175, test_f1: 0.6794
 epoch: 63, train_loss: 0.2720, test_loss: 1.1006, test_f1: 0.6823
 epoch: 64, train_loss: 0.2584, test_loss: 1.2504, test_f1: 0.6666
 epoch: 65, train_loss: 0.2627, test_loss: 1.1553, test_f1: 0.6766
 epoch: 66, train_loss: 0.2638, test_loss: 1.3147, test_f1: 0.6754
 epoch: 67, train_loss: 0.2385, test_loss: 1.2361, test_f1: 0.6912
 epoch: 68, train_loss: 0.2527, test_loss: 1.2553, test_f1: 0.6823
 epoch: 69, train_loss: 0.2588, test_loss: 1.2263, test_f1: 0.6925
 epoch: 70, train_loss: 0.2624, test_loss: 1.2169, test_f1: 0.6854
 epoch: 71, train_loss: 0.2498, test_loss: 1.1680, test_f1: 0.7165
 epoch: 72, train_loss: 0.2406, test_loss: 1.3160, test_f1: 0.6873
 epoch: 73, train_loss: 0.2607, test_loss: 1.3389, test_f1: 0.6654
 epoch: 74, train_loss: 0.2570, test_loss: 1.2279, test_f1: 0.6846
 epoch: 75, train_loss: 0.2374, test_loss: 1.2945, test_f1: 0.6761
 epoch: 76, train_loss: 0.2391, test_loss: 1.3043, test_f1: 0.6851
 epoch: 77, train_loss: 0.2099, test_loss: 1.3208, test_f1: 0.6702
 epoch: 78, train_loss: 0.2200, test_loss: 1.4563, test_f1: 0.6579
 epoch: 79, train_loss: 0.2386, test_loss: 1.4174, test_f1: 0.6721
 epoch: 80, train_loss: 0.2162, test_loss: 1.3831, test_f1: 0.6703
 epoch: 81, train_loss: 0.2282, test_loss: 1.3376, test_f1: 0.6642
 epoch: 82, train_loss: 0.2132, test_loss: 1.4923, test_f1: 0.6715
 epoch: 83, train_loss: 0.2276, test_loss: 1.3877, test_f1: 0.6784
 epoch: 84, train_loss: 0.2151, test_loss: 1.5001, test_f1: 0.6758
 epoch: 85, train_loss: 0.2107, test_loss: 1.4966, test_f1: 0.6732
 epoch: 86, train_loss: 0.2071, test_loss: 1.5205, test_f1: 0.6836
 epoch: 87, train_loss: 0.2129, test_loss: 1.4534, test_f1: 0.6700
 epoch: 88, train_loss: 0.2099, test_loss: 1.4035, test_f1: 0.6883
 epoch: 89, train_loss: 0.2226, test_loss: 1.4930, test_f1: 0.6697
 epoch: 90, train_loss: 0.2119, test_loss: 1.4281, test_f1: 0.6788
 epoch: 91, train_loss: 0.1935, test_loss: 1.4464, test_f1: 0.7046
 epoch: 92, train_loss: 0.1964, test_loss: 1.4616, test_f1: 0.6660
 epoch: 93, train_loss: 0.1978, test_loss: 1.5924, test_f1: 0.6560
 epoch: 94, train_loss: 0.1982, test_loss: 1.4557, test_f1: 0.6869
 epoch: 95, train_loss: 0.2059, test_loss: 1.3975, test_f1: 0.6977
 epoch: 96, train_loss: 0.2032, test_loss: 1.4194, test_f1: 0.6845
 epoch: 97, train_loss: 0.2040, test_loss: 1.4145, test_f1: 0.6814
 epoch: 98, train_loss: 0.1872, test_loss: 1.5418, test_f1: 0.6624
 epoch: 99, train_loss: 0.1965, test_loss: 1.4801, test_f1: 0.6823
##################ITERATION #5 ****************************************
 epoch: 0, train_loss: 1.3718, test_loss: 1.0868, test_f1: 0.3750
 epoch: 1, train_loss: 0.9859, test_loss: 0.9099, test_f1: 0.5463
 epoch: 2, train_loss: 0.9273, test_loss: 0.9139, test_f1: 0.5123
 epoch: 3, train_loss: 0.8937, test_loss: 0.9227, test_f1: 0.5775
 epoch: 4, train_loss: 0.8668, test_loss: 0.9015, test_f1: 0.5506
 epoch: 5, train_loss: 0.8303, test_loss: 0.8408, test_f1: 0.6110
 epoch: 6, train_loss: 0.8293, test_loss: 0.8671, test_f1: 0.6062
 epoch: 7, train_loss: 0.8125, test_loss: 0.8482, test_f1: 0.5797
 epoch: 8, train_loss: 0.7819, test_loss: 0.7908, test_f1: 0.6307
 epoch: 9, train_loss: 0.7633, test_loss: 0.8569, test_f1: 0.5994
 epoch: 10, train_loss: 0.7373, test_loss: 0.7861, test_f1: 0.6072
 epoch: 11, train_loss: 0.7306, test_loss: 0.7848, test_f1: 0.6194
 epoch: 12, train_loss: 0.7147, test_loss: 0.8325, test_f1: 0.6091
 epoch: 13, train_loss: 0.7005, test_loss: 0.7646, test_f1: 0.6364
 epoch: 14, train_loss: 0.6697, test_loss: 0.7648, test_f1: 0.6452
 epoch: 15, train_loss: 0.7091, test_loss: 0.7838, test_f1: 0.6358
 epoch: 16, train_loss: 0.6581, test_loss: 0.7216, test_f1: 0.6462
 epoch: 17, train_loss: 0.6614, test_loss: 0.7562, test_f1: 0.6449
 epoch: 18, train_loss: 0.6470, test_loss: 0.7769, test_f1: 0.6371
 epoch: 19, train_loss: 0.6054, test_loss: 0.7489, test_f1: 0.6556
 epoch: 20, train_loss: 0.6252, test_loss: 0.7722, test_f1: 0.6327
 epoch: 21, train_loss: 0.6178, test_loss: 0.7842, test_f1: 0.6435
 epoch: 22, train_loss: 0.6020, test_loss: 0.7748, test_f1: 0.6259
 epoch: 23, train_loss: 0.5869, test_loss: 0.8048, test_f1: 0.6392
 epoch: 24, train_loss: 0.5728, test_loss: 0.7965, test_f1: 0.6414
 epoch: 25, train_loss: 0.5722, test_loss: 0.7531, test_f1: 0.6530
 epoch: 26, train_loss: 0.5668, test_loss: 0.7656, test_f1: 0.6793
 epoch: 27, train_loss: 0.5568, test_loss: 0.8100, test_f1: 0.6707
 epoch: 28, train_loss: 0.5630, test_loss: 0.9140, test_f1: 0.6479
 epoch: 29, train_loss: 0.5454, test_loss: 0.7703, test_f1: 0.6542
 epoch: 30, train_loss: 0.5219, test_loss: 0.8259, test_f1: 0.6918
 epoch: 31, train_loss: 0.5193, test_loss: 0.8186, test_f1: 0.6376
 epoch: 32, train_loss: 0.4830, test_loss: 0.9158, test_f1: 0.6552
 epoch: 33, train_loss: 0.4963, test_loss: 0.8219, test_f1: 0.6661
 epoch: 34, train_loss: 0.5154, test_loss: 0.8688, test_f1: 0.6801
 epoch: 35, train_loss: 0.4636, test_loss: 0.8271, test_f1: 0.6491
 epoch: 36, train_loss: 0.4744, test_loss: 0.8916, test_f1: 0.6734
 epoch: 37, train_loss: 0.4876, test_loss: 0.8721, test_f1: 0.6667
 epoch: 38, train_loss: 0.4558, test_loss: 0.8748, test_f1: 0.6561
 epoch: 39, train_loss: 0.4993, test_loss: 0.8367, test_f1: 0.6676
 epoch: 40, train_loss: 0.4452, test_loss: 0.9136, test_f1: 0.6653
 epoch: 41, train_loss: 0.4448, test_loss: 0.8918, test_f1: 0.6710
 epoch: 42, train_loss: 0.4342, test_loss: 0.9953, test_f1: 0.6570
 epoch: 43, train_loss: 0.4239, test_loss: 0.8659, test_f1: 0.6378
 epoch: 44, train_loss: 0.4405, test_loss: 0.9386, test_f1: 0.6413
 epoch: 45, train_loss: 0.4079, test_loss: 0.8812, test_f1: 0.6570
 epoch: 46, train_loss: 0.3991, test_loss: 0.9869, test_f1: 0.6602
 epoch: 47, train_loss: 0.4109, test_loss: 0.9271, test_f1: 0.6627
 epoch: 48, train_loss: 0.4040, test_loss: 0.8995, test_f1: 0.6633
 epoch: 49, train_loss: 0.3757, test_loss: 0.9535, test_f1: 0.6739
 epoch: 50, train_loss: 0.3726, test_loss: 0.9963, test_f1: 0.6765
 epoch: 51, train_loss: 0.3392, test_loss: 0.9792, test_f1: 0.6702
 epoch: 52, train_loss: 0.3290, test_loss: 1.0234, test_f1: 0.6560
 epoch: 53, train_loss: 0.3077, test_loss: 1.1433, test_f1: 0.6595
 epoch: 54, train_loss: 0.3114, test_loss: 1.1214, test_f1: 0.6658
 epoch: 55, train_loss: 0.3067, test_loss: 1.0330, test_f1: 0.6634
 epoch: 56, train_loss: 0.3143, test_loss: 1.0903, test_f1: 0.6816
 epoch: 57, train_loss: 0.2951, test_loss: 1.0819, test_f1: 0.6727
 epoch: 58, train_loss: 0.3101, test_loss: 1.1285, test_f1: 0.6848
 epoch: 59, train_loss: 0.2778, test_loss: 1.1190, test_f1: 0.6790
 epoch: 60, train_loss: 0.3034, test_loss: 1.0462, test_f1: 0.6744
 epoch: 61, train_loss: 0.2723, test_loss: 1.1524, test_f1: 0.6712
 epoch: 62, train_loss: 0.2762, test_loss: 1.1108, test_f1: 0.6895
 epoch: 63, train_loss: 0.2884, test_loss: 1.1105, test_f1: 0.6783
 epoch: 64, train_loss: 0.2596, test_loss: 1.0978, test_f1: 0.6823
 epoch: 65, train_loss: 0.2727, test_loss: 1.2019, test_f1: 0.6759
 epoch: 66, train_loss: 0.2599, test_loss: 1.1970, test_f1: 0.6888
 epoch: 67, train_loss: 0.2624, test_loss: 1.1360, test_f1: 0.6783
 epoch: 68, train_loss: 0.2526, test_loss: 1.1442, test_f1: 0.6802
 epoch: 69, train_loss: 0.2578, test_loss: 1.2500, test_f1: 0.6740
 epoch: 70, train_loss: 0.2625, test_loss: 1.2194, test_f1: 0.6691
 epoch: 71, train_loss: 0.2638, test_loss: 1.1945, test_f1: 0.6741
 epoch: 72, train_loss: 0.2463, test_loss: 1.2081, test_f1: 0.6777
 epoch: 73, train_loss: 0.2356, test_loss: 1.1927, test_f1: 0.6851
 epoch: 74, train_loss: 0.2318, test_loss: 1.2269, test_f1: 0.6666
 epoch: 75, train_loss: 0.2269, test_loss: 1.2915, test_f1: 0.6747
 epoch: 76, train_loss: 0.2382, test_loss: 1.2285, test_f1: 0.6797
 epoch: 77, train_loss: 0.2297, test_loss: 1.2664, test_f1: 0.6743
 epoch: 78, train_loss: 0.2380, test_loss: 1.2296, test_f1: 0.6875
 epoch: 79, train_loss: 0.2431, test_loss: 1.3295, test_f1: 0.6675
 epoch: 80, train_loss: 0.2420, test_loss: 1.1986, test_f1: 0.6812
 epoch: 81, train_loss: 0.2376, test_loss: 1.2910, test_f1: 0.6800
 epoch: 82, train_loss: 0.2386, test_loss: 1.1915, test_f1: 0.6953
 epoch: 83, train_loss: 0.2096, test_loss: 1.2941, test_f1: 0.6891
 epoch: 84, train_loss: 0.2384, test_loss: 1.2689, test_f1: 0.6896
 epoch: 85, train_loss: 0.2066, test_loss: 1.4072, test_f1: 0.6765
 epoch: 86, train_loss: 0.2109, test_loss: 1.2792, test_f1: 0.6762
 epoch: 87, train_loss: 0.2233, test_loss: 1.2864, test_f1: 0.6785
 epoch: 88, train_loss: 0.2151, test_loss: 1.2682, test_f1: 0.6869
 epoch: 89, train_loss: 0.1985, test_loss: 1.4094, test_f1: 0.6869
 epoch: 90, train_loss: 0.1931, test_loss: 1.4325, test_f1: 0.6772
 epoch: 91, train_loss: 0.2093, test_loss: 1.4413, test_f1: 0.6781
 epoch: 92, train_loss: 0.2303, test_loss: 1.2527, test_f1: 0.6969
 epoch: 93, train_loss: 0.1936, test_loss: 1.3992, test_f1: 0.6781
 epoch: 94, train_loss: 0.2105, test_loss: 1.4660, test_f1: 0.6783
 epoch: 95, train_loss: 0.1988, test_loss: 1.4070, test_f1: 0.6640
 epoch: 96, train_loss: 0.1921, test_loss: 1.4712, test_f1: 0.6758
 epoch: 97, train_loss: 0.2004, test_loss: 1.3975, test_f1: 0.6972
 epoch: 98, train_loss: 0.2062, test_loss: 1.4421, test_f1: 0.6753
 epoch: 99, train_loss: 0.1808, test_loss: 1.4116, test_f1: 0.6746
##################ITERATION #6 ****************************************
 epoch: 0, train_loss: 1.3120, test_loss: 1.0243, test_f1: 0.5140
 epoch: 1, train_loss: 0.9601, test_loss: 0.9741, test_f1: 0.4975
 epoch: 2, train_loss: 0.9241, test_loss: 0.8794, test_f1: 0.5473
 epoch: 3, train_loss: 0.8918, test_loss: 0.9088, test_f1: 0.5250
 epoch: 4, train_loss: 0.8754, test_loss: 0.8530, test_f1: 0.5628
 epoch: 5, train_loss: 0.8470, test_loss: 0.8528, test_f1: 0.5502
 epoch: 6, train_loss: 0.8261, test_loss: 0.8201, test_f1: 0.5856
 epoch: 7, train_loss: 0.8144, test_loss: 0.8275, test_f1: 0.6053
 epoch: 8, train_loss: 0.8019, test_loss: 0.7971, test_f1: 0.6036
 epoch: 9, train_loss: 0.7792, test_loss: 0.8144, test_f1: 0.6074
 epoch: 10, train_loss: 0.7736, test_loss: 0.8140, test_f1: 0.5887
 epoch: 11, train_loss: 0.7561, test_loss: 0.8354, test_f1: 0.6215
 epoch: 12, train_loss: 0.7343, test_loss: 0.8647, test_f1: 0.6114
 epoch: 13, train_loss: 0.7167, test_loss: 0.7723, test_f1: 0.6494
 epoch: 14, train_loss: 0.7281, test_loss: 0.8196, test_f1: 0.5891
 epoch: 15, train_loss: 0.6972, test_loss: 0.7803, test_f1: 0.6493
 epoch: 16, train_loss: 0.6722, test_loss: 0.7671, test_f1: 0.6349
 epoch: 17, train_loss: 0.6733, test_loss: 0.8279, test_f1: 0.6216
 epoch: 18, train_loss: 0.6501, test_loss: 0.7887, test_f1: 0.6399
 epoch: 19, train_loss: 0.6618, test_loss: 0.7668, test_f1: 0.6382
 epoch: 20, train_loss: 0.6441, test_loss: 0.7725, test_f1: 0.6320
 epoch: 21, train_loss: 0.6218, test_loss: 0.7925, test_f1: 0.6440
 epoch: 22, train_loss: 0.6239, test_loss: 0.7741, test_f1: 0.6532
 epoch: 23, train_loss: 0.5948, test_loss: 0.7972, test_f1: 0.6439
 epoch: 24, train_loss: 0.5847, test_loss: 0.7816, test_f1: 0.6707
 epoch: 25, train_loss: 0.5780, test_loss: 0.8359, test_f1: 0.6372
 epoch: 26, train_loss: 0.5695, test_loss: 0.8335, test_f1: 0.6316
 epoch: 27, train_loss: 0.5605, test_loss: 0.8794, test_f1: 0.6468
 epoch: 28, train_loss: 0.5638, test_loss: 0.9735, test_f1: 0.6258
 epoch: 29, train_loss: 0.5455, test_loss: 0.8524, test_f1: 0.6793
 epoch: 30, train_loss: 0.5416, test_loss: 0.8527, test_f1: 0.6788
 epoch: 31, train_loss: 0.5207, test_loss: 0.9266, test_f1: 0.6570
 epoch: 32, train_loss: 0.5100, test_loss: 0.8182, test_f1: 0.6801
 epoch: 33, train_loss: 0.5202, test_loss: 0.8914, test_f1: 0.6477
 epoch: 34, train_loss: 0.4952, test_loss: 0.8299, test_f1: 0.7111
 epoch: 35, train_loss: 0.4991, test_loss: 0.8636, test_f1: 0.6713
 epoch: 36, train_loss: 0.4978, test_loss: 0.8373, test_f1: 0.6943
 epoch: 37, train_loss: 0.4738, test_loss: 0.9083, test_f1: 0.6875
 epoch: 38, train_loss: 0.4847, test_loss: 0.8864, test_f1: 0.6468
 epoch: 39, train_loss: 0.4540, test_loss: 0.9072, test_f1: 0.6509
 epoch: 40, train_loss: 0.4555, test_loss: 0.9088, test_f1: 0.6992
 epoch: 41, train_loss: 0.4573, test_loss: 0.9310, test_f1: 0.6578
 epoch: 42, train_loss: 0.4805, test_loss: 0.8937, test_f1: 0.6642
 epoch: 43, train_loss: 0.4353, test_loss: 1.0203, test_f1: 0.6530
 epoch: 44, train_loss: 0.4421, test_loss: 0.9476, test_f1: 0.7001
 epoch: 45, train_loss: 0.4410, test_loss: 0.9201, test_f1: 0.6717
 epoch: 46, train_loss: 0.4404, test_loss: 0.9126, test_f1: 0.6655
 epoch: 47, train_loss: 0.4213, test_loss: 0.9152, test_f1: 0.6810
 epoch: 48, train_loss: 0.3981, test_loss: 1.0185, test_f1: 0.6658
 epoch: 49, train_loss: 0.3909, test_loss: 1.0540, test_f1: 0.6652
 epoch: 50, train_loss: 0.3832, test_loss: 1.0140, test_f1: 0.6800
 epoch: 51, train_loss: 0.3638, test_loss: 1.0601, test_f1: 0.6884
 epoch: 52, train_loss: 0.3408, test_loss: 1.1121, test_f1: 0.6902
 epoch: 53, train_loss: 0.3162, test_loss: 1.0590, test_f1: 0.7034
 epoch: 54, train_loss: 0.3188, test_loss: 1.0762, test_f1: 0.6834
 epoch: 55, train_loss: 0.3232, test_loss: 1.0261, test_f1: 0.6899
 epoch: 56, train_loss: 0.3198, test_loss: 1.0911, test_f1: 0.6865
 epoch: 57, train_loss: 0.3102, test_loss: 1.1159, test_f1: 0.6605
 epoch: 58, train_loss: 0.3170, test_loss: 1.0585, test_f1: 0.6850
 epoch: 59, train_loss: 0.3047, test_loss: 1.1488, test_f1: 0.6853
 epoch: 60, train_loss: 0.2932, test_loss: 1.1770, test_f1: 0.6826
 epoch: 61, train_loss: 0.3015, test_loss: 1.1638, test_f1: 0.6957
 epoch: 62, train_loss: 0.2808, test_loss: 1.1972, test_f1: 0.6829
 epoch: 63, train_loss: 0.2749, test_loss: 1.1966, test_f1: 0.6912
 epoch: 64, train_loss: 0.2938, test_loss: 1.1928, test_f1: 0.6888
 epoch: 65, train_loss: 0.2708, test_loss: 1.1834, test_f1: 0.6758
 epoch: 66, train_loss: 0.2779, test_loss: 1.2507, test_f1: 0.6691
 epoch: 67, train_loss: 0.2964, test_loss: 1.2373, test_f1: 0.6641
 epoch: 68, train_loss: 0.2838, test_loss: 1.1217, test_f1: 0.6881
 epoch: 69, train_loss: 0.2735, test_loss: 1.1293, test_f1: 0.6966
 epoch: 70, train_loss: 0.2688, test_loss: 1.1196, test_f1: 0.6944
 epoch: 71, train_loss: 0.2717, test_loss: 1.1838, test_f1: 0.6929
 epoch: 72, train_loss: 0.2607, test_loss: 1.2156, test_f1: 0.6780
 epoch: 73, train_loss: 0.2507, test_loss: 1.2236, test_f1: 0.6772
 epoch: 74, train_loss: 0.2449, test_loss: 1.2560, test_f1: 0.6754
 epoch: 75, train_loss: 0.2597, test_loss: 1.1862, test_f1: 0.6780
 epoch: 76, train_loss: 0.2497, test_loss: 1.2849, test_f1: 0.6868
 epoch: 77, train_loss: 0.2636, test_loss: 1.2943, test_f1: 0.6530
 epoch: 78, train_loss: 0.2479, test_loss: 1.1886, test_f1: 0.6968
 epoch: 79, train_loss: 0.2392, test_loss: 1.3589, test_f1: 0.6803
 epoch: 80, train_loss: 0.2293, test_loss: 1.2947, test_f1: 0.6744
 epoch: 81, train_loss: 0.2381, test_loss: 1.3078, test_f1: 0.6476
 epoch: 82, train_loss: 0.2282, test_loss: 1.2449, test_f1: 0.6848
 epoch: 83, train_loss: 0.2314, test_loss: 1.3348, test_f1: 0.6897
 epoch: 84, train_loss: 0.2316, test_loss: 1.4296, test_f1: 0.6522
 epoch: 85, train_loss: 0.2076, test_loss: 1.4599, test_f1: 0.6837
 epoch: 86, train_loss: 0.2387, test_loss: 1.4073, test_f1: 0.6819
 epoch: 87, train_loss: 0.2197, test_loss: 1.3926, test_f1: 0.6637
 epoch: 88, train_loss: 0.2057, test_loss: 1.3057, test_f1: 0.6943
 epoch: 89, train_loss: 0.2527, test_loss: 1.4099, test_f1: 0.6722
 epoch: 90, train_loss: 0.2236, test_loss: 1.3133, test_f1: 0.6886
 epoch: 91, train_loss: 0.2011, test_loss: 1.4310, test_f1: 0.6802
 epoch: 92, train_loss: 0.2078, test_loss: 1.3018, test_f1: 0.7128
 epoch: 93, train_loss: 0.2126, test_loss: 1.3818, test_f1: 0.7010
 epoch: 94, train_loss: 0.1940, test_loss: 1.4129, test_f1: 0.6877
 epoch: 95, train_loss: 0.2025, test_loss: 1.3790, test_f1: 0.6686
 epoch: 96, train_loss: 0.2020, test_loss: 1.3661, test_f1: 0.6881
 epoch: 97, train_loss: 0.1893, test_loss: 1.3615, test_f1: 0.6865
 epoch: 98, train_loss: 0.2223, test_loss: 1.4612, test_f1: 0.6544
 epoch: 99, train_loss: 0.2102, test_loss: 1.3324, test_f1: 0.6639
##################ITERATION #7 ****************************************
 epoch: 0, train_loss: 1.2565, test_loss: 1.0580, test_f1: 0.4385
 epoch: 1, train_loss: 0.9685, test_loss: 0.9380, test_f1: 0.5327
 epoch: 2, train_loss: 0.9369, test_loss: 0.9146, test_f1: 0.5549
 epoch: 3, train_loss: 0.9127, test_loss: 0.9249, test_f1: 0.5471
 epoch: 4, train_loss: 0.8771, test_loss: 0.8274, test_f1: 0.5742
 epoch: 5, train_loss: 0.8514, test_loss: 0.8491, test_f1: 0.5656
 epoch: 6, train_loss: 0.8488, test_loss: 0.8448, test_f1: 0.5858
 epoch: 7, train_loss: 0.8136, test_loss: 0.7932, test_f1: 0.5993
 epoch: 8, train_loss: 0.7779, test_loss: 0.8484, test_f1: 0.6252
 epoch: 9, train_loss: 0.7794, test_loss: 0.7750, test_f1: 0.6584
 epoch: 10, train_loss: 0.7574, test_loss: 0.8234, test_f1: 0.6162
 epoch: 11, train_loss: 0.7466, test_loss: 0.7762, test_f1: 0.6051
 epoch: 12, train_loss: 0.7314, test_loss: 0.7964, test_f1: 0.6511
 epoch: 13, train_loss: 0.7257, test_loss: 0.7828, test_f1: 0.6300
 epoch: 14, train_loss: 0.7012, test_loss: 0.7111, test_f1: 0.6436
 epoch: 15, train_loss: 0.6668, test_loss: 0.7565, test_f1: 0.6752
 epoch: 16, train_loss: 0.6687, test_loss: 0.7839, test_f1: 0.6234
 epoch: 17, train_loss: 0.6475, test_loss: 0.8383, test_f1: 0.6016
 epoch: 18, train_loss: 0.6553, test_loss: 0.7641, test_f1: 0.6655
 epoch: 19, train_loss: 0.6449, test_loss: 0.7311, test_f1: 0.6375
 epoch: 20, train_loss: 0.6262, test_loss: 0.7589, test_f1: 0.6572
 epoch: 21, train_loss: 0.6161, test_loss: 0.7507, test_f1: 0.6520
 epoch: 22, train_loss: 0.6091, test_loss: 0.7019, test_f1: 0.6759
 epoch: 23, train_loss: 0.6017, test_loss: 0.7911, test_f1: 0.6429
 epoch: 24, train_loss: 0.5727, test_loss: 0.7469, test_f1: 0.6574
 epoch: 25, train_loss: 0.5731, test_loss: 0.7224, test_f1: 0.6701
 epoch: 26, train_loss: 0.5609, test_loss: 0.8065, test_f1: 0.6221
 epoch: 27, train_loss: 0.5549, test_loss: 0.7602, test_f1: 0.6592
 epoch: 28, train_loss: 0.5559, test_loss: 0.7555, test_f1: 0.6767
 epoch: 29, train_loss: 0.5636, test_loss: 0.7580, test_f1: 0.6732
 epoch: 30, train_loss: 0.5026, test_loss: 0.7631, test_f1: 0.6777
 epoch: 31, train_loss: 0.5278, test_loss: 0.7797, test_f1: 0.6738
 epoch: 32, train_loss: 0.5629, test_loss: 0.7553, test_f1: 0.6468
 epoch: 33, train_loss: 0.4999, test_loss: 0.8262, test_f1: 0.6555
 epoch: 34, train_loss: 0.4936, test_loss: 0.7771, test_f1: 0.6888
 epoch: 35, train_loss: 0.4959, test_loss: 0.8026, test_f1: 0.6763
 epoch: 36, train_loss: 0.4825, test_loss: 0.7789, test_f1: 0.6999
 epoch: 37, train_loss: 0.4747, test_loss: 0.9141, test_f1: 0.6834
 epoch: 38, train_loss: 0.4745, test_loss: 0.8779, test_f1: 0.6594
 epoch: 39, train_loss: 0.4665, test_loss: 0.8811, test_f1: 0.6736
 epoch: 40, train_loss: 0.4662, test_loss: 0.8110, test_f1: 0.6557
 epoch: 41, train_loss: 0.4662, test_loss: 0.8284, test_f1: 0.6872
 epoch: 42, train_loss: 0.4310, test_loss: 0.9151, test_f1: 0.6724
 epoch: 43, train_loss: 0.4490, test_loss: 0.8957, test_f1: 0.6133
 epoch: 44, train_loss: 0.4465, test_loss: 0.9605, test_f1: 0.6530
 epoch: 45, train_loss: 0.4219, test_loss: 0.9331, test_f1: 0.6576
 epoch: 46, train_loss: 0.4179, test_loss: 0.8881, test_f1: 0.6621
 epoch: 47, train_loss: 0.4035, test_loss: 0.9294, test_f1: 0.6785
 epoch: 48, train_loss: 0.4038, test_loss: 0.9120, test_f1: 0.6501
 epoch: 49, train_loss: 0.4035, test_loss: 0.9647, test_f1: 0.6521
 epoch: 50, train_loss: 0.3871, test_loss: 0.9358, test_f1: 0.6494
 epoch: 51, train_loss: 0.3652, test_loss: 0.9893, test_f1: 0.6689
 epoch: 52, train_loss: 0.3558, test_loss: 0.9512, test_f1: 0.6683
 epoch: 53, train_loss: 0.3154, test_loss: 1.0177, test_f1: 0.6755
 epoch: 54, train_loss: 0.3112, test_loss: 1.0279, test_f1: 0.6574
 epoch: 55, train_loss: 0.3294, test_loss: 1.0317, test_f1: 0.6782
 epoch: 56, train_loss: 0.3075, test_loss: 1.0898, test_f1: 0.6711
 epoch: 57, train_loss: 0.3076, test_loss: 1.0533, test_f1: 0.6594
 epoch: 58, train_loss: 0.3058, test_loss: 1.0872, test_f1: 0.6716
 epoch: 59, train_loss: 0.3024, test_loss: 1.0231, test_f1: 0.6715
 epoch: 60, train_loss: 0.2905, test_loss: 0.9958, test_f1: 0.6756
 epoch: 61, train_loss: 0.3047, test_loss: 1.0474, test_f1: 0.6613
 epoch: 62, train_loss: 0.3104, test_loss: 1.0561, test_f1: 0.6618
 epoch: 63, train_loss: 0.2898, test_loss: 1.0888, test_f1: 0.6830
 epoch: 64, train_loss: 0.2902, test_loss: 1.0428, test_f1: 0.6626
 epoch: 65, train_loss: 0.2823, test_loss: 1.1616, test_f1: 0.6561
 epoch: 66, train_loss: 0.2607, test_loss: 1.1456, test_f1: 0.6590
 epoch: 67, train_loss: 0.2823, test_loss: 1.2227, test_f1: 0.6525
 epoch: 68, train_loss: 0.2724, test_loss: 1.1956, test_f1: 0.6444
 epoch: 69, train_loss: 0.2761, test_loss: 1.1782, test_f1: 0.6565
 epoch: 70, train_loss: 0.2576, test_loss: 1.1705, test_f1: 0.6513
 epoch: 71, train_loss: 0.2694, test_loss: 1.1988, test_f1: 0.6505
 epoch: 72, train_loss: 0.2725, test_loss: 1.1657, test_f1: 0.6699
 epoch: 73, train_loss: 0.2786, test_loss: 1.2327, test_f1: 0.6563
 epoch: 74, train_loss: 0.2692, test_loss: 1.2015, test_f1: 0.6866
 epoch: 75, train_loss: 0.2474, test_loss: 1.2755, test_f1: 0.6611
 epoch: 76, train_loss: 0.2450, test_loss: 1.3028, test_f1: 0.6571
 epoch: 77, train_loss: 0.2264, test_loss: 1.2879, test_f1: 0.6396
 epoch: 78, train_loss: 0.2428, test_loss: 1.2755, test_f1: 0.6597
 epoch: 79, train_loss: 0.2443, test_loss: 1.1997, test_f1: 0.6689
 epoch: 80, train_loss: 0.2311, test_loss: 1.3068, test_f1: 0.6769
 epoch: 81, train_loss: 0.2365, test_loss: 1.2505, test_f1: 0.6891
 epoch: 82, train_loss: 0.2287, test_loss: 1.2786, test_f1: 0.6851
 epoch: 83, train_loss: 0.2399, test_loss: 1.3707, test_f1: 0.6553
 epoch: 84, train_loss: 0.2499, test_loss: 1.3293, test_f1: 0.6379
 epoch: 85, train_loss: 0.2330, test_loss: 1.3457, test_f1: 0.6560
 epoch: 86, train_loss: 0.2288, test_loss: 1.3257, test_f1: 0.6463
 epoch: 87, train_loss: 0.2216, test_loss: 1.3107, test_f1: 0.6605
 epoch: 88, train_loss: 0.2355, test_loss: 1.2337, test_f1: 0.6911
 epoch: 89, train_loss: 0.2070, test_loss: 1.2173, test_f1: 0.6693
 epoch: 90, train_loss: 0.2152, test_loss: 1.3724, test_f1: 0.6850
 epoch: 91, train_loss: 0.2246, test_loss: 1.3939, test_f1: 0.6737
 epoch: 92, train_loss: 0.2013, test_loss: 1.3894, test_f1: 0.6629
 epoch: 93, train_loss: 0.2092, test_loss: 1.3526, test_f1: 0.6667
 epoch: 94, train_loss: 0.2174, test_loss: 1.3200, test_f1: 0.6732
 epoch: 95, train_loss: 0.2149, test_loss: 1.3825, test_f1: 0.6792
 epoch: 96, train_loss: 0.2109, test_loss: 1.3592, test_f1: 0.6927
 epoch: 97, train_loss: 0.2222, test_loss: 1.3345, test_f1: 0.6890
 epoch: 98, train_loss: 0.2160, test_loss: 1.4346, test_f1: 0.6805
 epoch: 99, train_loss: 0.2056, test_loss: 1.3063, test_f1: 0.6893
##################ITERATION #8 ****************************************
 epoch: 0, train_loss: 1.2699, test_loss: 0.9849, test_f1: 0.4628
 epoch: 1, train_loss: 0.9771, test_loss: 0.9171, test_f1: 0.5141
 epoch: 2, train_loss: 0.9378, test_loss: 0.9019, test_f1: 0.5095
 epoch: 3, train_loss: 0.9055, test_loss: 0.8596, test_f1: 0.5398
 epoch: 4, train_loss: 0.8729, test_loss: 0.8347, test_f1: 0.5826
 epoch: 5, train_loss: 0.8539, test_loss: 0.8388, test_f1: 0.5666
 epoch: 6, train_loss: 0.8383, test_loss: 0.7942, test_f1: 0.6134
 epoch: 7, train_loss: 0.8161, test_loss: 0.8554, test_f1: 0.5183
 epoch: 8, train_loss: 0.8104, test_loss: 0.8184, test_f1: 0.6111
 epoch: 9, train_loss: 0.7708, test_loss: 0.7962, test_f1: 0.5981
 epoch: 10, train_loss: 0.7580, test_loss: 0.8081, test_f1: 0.6120
 epoch: 11, train_loss: 0.7466, test_loss: 0.7503, test_f1: 0.6211
 epoch: 12, train_loss: 0.7214, test_loss: 0.7294, test_f1: 0.6466
 epoch: 13, train_loss: 0.7078, test_loss: 0.7529, test_f1: 0.6472
 epoch: 14, train_loss: 0.7223, test_loss: 0.7465, test_f1: 0.6235
 epoch: 15, train_loss: 0.6861, test_loss: 0.7439, test_f1: 0.6167
 epoch: 16, train_loss: 0.6901, test_loss: 0.7774, test_f1: 0.6140
 epoch: 17, train_loss: 0.6670, test_loss: 0.7334, test_f1: 0.6481
 epoch: 18, train_loss: 0.6452, test_loss: 0.7914, test_f1: 0.6810
 epoch: 19, train_loss: 0.6443, test_loss: 0.7802, test_f1: 0.6377
 epoch: 20, train_loss: 0.6451, test_loss: 0.7350, test_f1: 0.6617
 epoch: 21, train_loss: 0.6272, test_loss: 0.7211, test_f1: 0.6625
 epoch: 22, train_loss: 0.6078, test_loss: 0.7195, test_f1: 0.6319
 epoch: 23, train_loss: 0.6015, test_loss: 0.7944, test_f1: 0.6626
 epoch: 24, train_loss: 0.5778, test_loss: 0.8274, test_f1: 0.6442
 epoch: 25, train_loss: 0.5812, test_loss: 0.7983, test_f1: 0.6370
 epoch: 26, train_loss: 0.5710, test_loss: 0.8039, test_f1: 0.6659
 epoch: 27, train_loss: 0.5635, test_loss: 0.7192, test_f1: 0.6731
 epoch: 28, train_loss: 0.5563, test_loss: 0.7671, test_f1: 0.6371
 epoch: 29, train_loss: 0.5413, test_loss: 0.7840, test_f1: 0.6575
 epoch: 30, train_loss: 0.5104, test_loss: 0.8126, test_f1: 0.6864
 epoch: 31, train_loss: 0.5071, test_loss: 0.8047, test_f1: 0.6865
 epoch: 32, train_loss: 0.5218, test_loss: 0.7827, test_f1: 0.6546
 epoch: 33, train_loss: 0.5160, test_loss: 0.7199, test_f1: 0.6935
 epoch: 34, train_loss: 0.4935, test_loss: 0.7926, test_f1: 0.6595
 epoch: 35, train_loss: 0.4908, test_loss: 0.8376, test_f1: 0.6394
 epoch: 36, train_loss: 0.4926, test_loss: 0.7599, test_f1: 0.6688
 epoch: 37, train_loss: 0.4746, test_loss: 0.7715, test_f1: 0.6975
 epoch: 38, train_loss: 0.4554, test_loss: 0.8024, test_f1: 0.6663
 epoch: 39, train_loss: 0.4684, test_loss: 0.8325, test_f1: 0.6699
 epoch: 40, train_loss: 0.4761, test_loss: 0.9008, test_f1: 0.6754
 epoch: 41, train_loss: 0.4433, test_loss: 0.7827, test_f1: 0.6570
 epoch: 42, train_loss: 0.4563, test_loss: 0.8125, test_f1: 0.6764
 epoch: 43, train_loss: 0.4276, test_loss: 0.9256, test_f1: 0.6749
 epoch: 44, train_loss: 0.4159, test_loss: 0.8712, test_f1: 0.6835
 epoch: 45, train_loss: 0.4175, test_loss: 0.8774, test_f1: 0.6497
 epoch: 46, train_loss: 0.4062, test_loss: 0.8466, test_f1: 0.6613
 epoch: 47, train_loss: 0.3960, test_loss: 0.8560, test_f1: 0.6610
 epoch: 48, train_loss: 0.3883, test_loss: 0.8787, test_f1: 0.6701
 epoch: 49, train_loss: 0.3845, test_loss: 0.9091, test_f1: 0.6672
 epoch: 50, train_loss: 0.4031, test_loss: 0.9651, test_f1: 0.6571
 epoch: 51, train_loss: 0.3422, test_loss: 0.9505, test_f1: 0.6733
 epoch: 52, train_loss: 0.3356, test_loss: 0.9762, test_f1: 0.6862
 epoch: 53, train_loss: 0.3143, test_loss: 1.0237, test_f1: 0.6633
 epoch: 54, train_loss: 0.2917, test_loss: 1.0435, test_f1: 0.6757
 epoch: 55, train_loss: 0.3061, test_loss: 1.0722, test_f1: 0.6716
 epoch: 56, train_loss: 0.2946, test_loss: 1.1157, test_f1: 0.6635
 epoch: 57, train_loss: 0.3222, test_loss: 1.0299, test_f1: 0.6758
 epoch: 58, train_loss: 0.2947, test_loss: 1.0341, test_f1: 0.6951
 epoch: 59, train_loss: 0.2786, test_loss: 1.0462, test_f1: 0.6781
 epoch: 60, train_loss: 0.2839, test_loss: 1.0580, test_f1: 0.6816
 epoch: 61, train_loss: 0.2752, test_loss: 1.1474, test_f1: 0.6571
 epoch: 62, train_loss: 0.2630, test_loss: 1.1409, test_f1: 0.6744
 epoch: 63, train_loss: 0.2715, test_loss: 1.1530, test_f1: 0.6645
 epoch: 64, train_loss: 0.2822, test_loss: 1.0695, test_f1: 0.6886
 epoch: 65, train_loss: 0.2715, test_loss: 1.1325, test_f1: 0.6830
 epoch: 66, train_loss: 0.2655, test_loss: 1.1768, test_f1: 0.6697
 epoch: 67, train_loss: 0.2546, test_loss: 1.2212, test_f1: 0.6734
 epoch: 68, train_loss: 0.2561, test_loss: 1.2283, test_f1: 0.6851
 epoch: 69, train_loss: 0.2625, test_loss: 1.2717, test_f1: 0.6659
 epoch: 70, train_loss: 0.2354, test_loss: 1.3155, test_f1: 0.6868
 epoch: 71, train_loss: 0.2500, test_loss: 1.2353, test_f1: 0.6685
 epoch: 72, train_loss: 0.2638, test_loss: 1.2307, test_f1: 0.6807
 epoch: 73, train_loss: 0.2559, test_loss: 1.1546, test_f1: 0.6747
 epoch: 74, train_loss: 0.2236, test_loss: 1.2099, test_f1: 0.6889
 epoch: 75, train_loss: 0.2385, test_loss: 1.3271, test_f1: 0.6667
 epoch: 76, train_loss: 0.2361, test_loss: 1.3475, test_f1: 0.6686
 epoch: 77, train_loss: 0.2443, test_loss: 1.3847, test_f1: 0.6725
 epoch: 78, train_loss: 0.2426, test_loss: 1.3181, test_f1: 0.6696
 epoch: 79, train_loss: 0.2225, test_loss: 1.2990, test_f1: 0.6674
 epoch: 80, train_loss: 0.2328, test_loss: 1.3237, test_f1: 0.6693
 epoch: 81, train_loss: 0.2179, test_loss: 1.4185, test_f1: 0.6566
 epoch: 82, train_loss: 0.2118, test_loss: 1.2851, test_f1: 0.6729
 epoch: 83, train_loss: 0.2172, test_loss: 1.3710, test_f1: 0.6687
 epoch: 84, train_loss: 0.2144, test_loss: 1.2912, test_f1: 0.6699
 epoch: 85, train_loss: 0.2296, test_loss: 1.3602, test_f1: 0.6714
 epoch: 86, train_loss: 0.2182, test_loss: 1.3491, test_f1: 0.6638
 epoch: 87, train_loss: 0.2084, test_loss: 1.3067, test_f1: 0.6747
 epoch: 88, train_loss: 0.2176, test_loss: 1.4187, test_f1: 0.6502
 epoch: 89, train_loss: 0.2152, test_loss: 1.2789, test_f1: 0.6797
 epoch: 90, train_loss: 0.2165, test_loss: 1.3813, test_f1: 0.6665
 epoch: 91, train_loss: 0.2068, test_loss: 1.3346, test_f1: 0.6754
 epoch: 92, train_loss: 0.2195, test_loss: 1.3254, test_f1: 0.6667
 epoch: 93, train_loss: 0.1974, test_loss: 1.3108, test_f1: 0.6791
 epoch: 94, train_loss: 0.1953, test_loss: 1.4041, test_f1: 0.6736
 epoch: 95, train_loss: 0.1997, test_loss: 1.3876, test_f1: 0.6741
 epoch: 96, train_loss: 0.1985, test_loss: 1.3466, test_f1: 0.6762
 epoch: 97, train_loss: 0.2124, test_loss: 1.2433, test_f1: 0.6823
 epoch: 98, train_loss: 0.1933, test_loss: 1.4261, test_f1: 0.6887
 epoch: 99, train_loss: 0.2005, test_loss: 1.4275, test_f1: 0.6653
##################ITERATION #9 ****************************************
 epoch: 0, train_loss: 1.3708, test_loss: 1.0081, test_f1: 0.4228
 epoch: 1, train_loss: 0.9705, test_loss: 0.8887, test_f1: 0.5561
 epoch: 2, train_loss: 0.9129, test_loss: 0.8536, test_f1: 0.5763
 epoch: 3, train_loss: 0.8980, test_loss: 0.8225, test_f1: 0.5928
 epoch: 4, train_loss: 0.8698, test_loss: 0.8421, test_f1: 0.5864
 epoch: 5, train_loss: 0.8431, test_loss: 0.7911, test_f1: 0.6063
 epoch: 6, train_loss: 0.8272, test_loss: 0.8236, test_f1: 0.6056
 epoch: 7, train_loss: 0.8030, test_loss: 0.7951, test_f1: 0.6388
 epoch: 8, train_loss: 0.7684, test_loss: 0.7371, test_f1: 0.6537
 epoch: 9, train_loss: 0.7632, test_loss: 0.7568, test_f1: 0.6211
 epoch: 10, train_loss: 0.7540, test_loss: 0.7471, test_f1: 0.6306
 epoch: 11, train_loss: 0.7282, test_loss: 0.7581, test_f1: 0.6317
 epoch: 12, train_loss: 0.7167, test_loss: 0.7401, test_f1: 0.6514
 epoch: 13, train_loss: 0.7073, test_loss: 0.7473, test_f1: 0.6423
 epoch: 14, train_loss: 0.6634, test_loss: 0.7243, test_f1: 0.6539
 epoch: 15, train_loss: 0.6889, test_loss: 0.7204, test_f1: 0.6602
 epoch: 16, train_loss: 0.6570, test_loss: 0.7757, test_f1: 0.6631
 epoch: 17, train_loss: 0.6625, test_loss: 0.7415, test_f1: 0.6805
 epoch: 18, train_loss: 0.6340, test_loss: 0.7679, test_f1: 0.6517
 epoch: 19, train_loss: 0.6319, test_loss: 0.7405, test_f1: 0.6545
 epoch: 20, train_loss: 0.6227, test_loss: 0.7804, test_f1: 0.6505
 epoch: 21, train_loss: 0.6167, test_loss: 0.7694, test_f1: 0.6489
 epoch: 22, train_loss: 0.5861, test_loss: 0.7098, test_f1: 0.6812
 epoch: 23, train_loss: 0.5908, test_loss: 0.7916, test_f1: 0.6718
 epoch: 24, train_loss: 0.5895, test_loss: 0.7279, test_f1: 0.6652
 epoch: 25, train_loss: 0.5723, test_loss: 0.8072, test_f1: 0.6497
 epoch: 26, train_loss: 0.5497, test_loss: 0.7432, test_f1: 0.6969
 epoch: 27, train_loss: 0.5452, test_loss: 0.7625, test_f1: 0.6726
 epoch: 28, train_loss: 0.5436, test_loss: 0.7889, test_f1: 0.6646
 epoch: 29, train_loss: 0.5239, test_loss: 0.8192, test_f1: 0.6608
 epoch: 30, train_loss: 0.5107, test_loss: 0.7496, test_f1: 0.6863
 epoch: 31, train_loss: 0.4999, test_loss: 0.9174, test_f1: 0.6603
 epoch: 32, train_loss: 0.5227, test_loss: 0.7692, test_f1: 0.6632
 epoch: 33, train_loss: 0.4902, test_loss: 0.7745, test_f1: 0.6543
 epoch: 34, train_loss: 0.4874, test_loss: 0.8267, test_f1: 0.6646
 epoch: 35, train_loss: 0.4854, test_loss: 0.8521, test_f1: 0.6638
 epoch: 36, train_loss: 0.4827, test_loss: 0.8433, test_f1: 0.6556
 epoch: 37, train_loss: 0.4620, test_loss: 0.8536, test_f1: 0.6705
 epoch: 38, train_loss: 0.4809, test_loss: 0.8332, test_f1: 0.6717
 epoch: 39, train_loss: 0.4756, test_loss: 0.8224, test_f1: 0.6638
 epoch: 40, train_loss: 0.4373, test_loss: 0.8476, test_f1: 0.7051
 epoch: 41, train_loss: 0.4474, test_loss: 0.8392, test_f1: 0.6726
 epoch: 42, train_loss: 0.4400, test_loss: 0.8956, test_f1: 0.6897
 epoch: 43, train_loss: 0.4283, test_loss: 0.9349, test_f1: 0.6692
 epoch: 44, train_loss: 0.4164, test_loss: 0.8427, test_f1: 0.6832
 epoch: 45, train_loss: 0.3958, test_loss: 1.0459, test_f1: 0.6575
 epoch: 46, train_loss: 0.4163, test_loss: 0.9826, test_f1: 0.6619
 epoch: 47, train_loss: 0.3973, test_loss: 0.9264, test_f1: 0.6569
 epoch: 48, train_loss: 0.3953, test_loss: 0.9700, test_f1: 0.6753
 epoch: 49, train_loss: 0.3896, test_loss: 0.9979, test_f1: 0.6807
 epoch: 50, train_loss: 0.3775, test_loss: 0.9858, test_f1: 0.6572
 epoch: 51, train_loss: 0.3490, test_loss: 1.1040, test_f1: 0.6629
 epoch: 52, train_loss: 0.3176, test_loss: 1.1192, test_f1: 0.6687
 epoch: 53, train_loss: 0.3164, test_loss: 1.1600, test_f1: 0.6667
 epoch: 54, train_loss: 0.3171, test_loss: 1.0828, test_f1: 0.6856
 epoch: 55, train_loss: 0.2962, test_loss: 1.0770, test_f1: 0.6787
 epoch: 56, train_loss: 0.2898, test_loss: 1.0317, test_f1: 0.6827
 epoch: 57, train_loss: 0.2751, test_loss: 1.1198, test_f1: 0.6796
 epoch: 58, train_loss: 0.2894, test_loss: 1.0693, test_f1: 0.6922
 epoch: 59, train_loss: 0.2854, test_loss: 1.2037, test_f1: 0.6538
 epoch: 60, train_loss: 0.2753, test_loss: 1.1274, test_f1: 0.6695
 epoch: 61, train_loss: 0.2845, test_loss: 1.2144, test_f1: 0.6580
 epoch: 62, train_loss: 0.2712, test_loss: 1.2095, test_f1: 0.6596
 epoch: 63, train_loss: 0.2762, test_loss: 1.1302, test_f1: 0.6841
 epoch: 64, train_loss: 0.2652, test_loss: 1.2278, test_f1: 0.6577
 epoch: 65, train_loss: 0.2461, test_loss: 1.1512, test_f1: 0.6751
 epoch: 66, train_loss: 0.2644, test_loss: 1.2282, test_f1: 0.6796
 epoch: 67, train_loss: 0.2489, test_loss: 1.1808, test_f1: 0.6645
 epoch: 68, train_loss: 0.2695, test_loss: 1.2904, test_f1: 0.6742
 epoch: 69, train_loss: 0.2435, test_loss: 1.2012, test_f1: 0.6743
 epoch: 70, train_loss: 0.2534, test_loss: 1.2860, test_f1: 0.6741
 epoch: 71, train_loss: 0.2459, test_loss: 1.1787, test_f1: 0.6751
 epoch: 72, train_loss: 0.2326, test_loss: 1.2365, test_f1: 0.6620
 epoch: 73, train_loss: 0.2242, test_loss: 1.2384, test_f1: 0.6611
 epoch: 74, train_loss: 0.2321, test_loss: 1.2773, test_f1: 0.6691
 epoch: 75, train_loss: 0.2509, test_loss: 1.4287, test_f1: 0.6566
 epoch: 76, train_loss: 0.2295, test_loss: 1.4551, test_f1: 0.6504
 epoch: 77, train_loss: 0.2522, test_loss: 1.2663, test_f1: 0.6708
 epoch: 78, train_loss: 0.2339, test_loss: 1.2620, test_f1: 0.6747
 epoch: 79, train_loss: 0.2195, test_loss: 1.4334, test_f1: 0.6887
 epoch: 80, train_loss: 0.2313, test_loss: 1.3650, test_f1: 0.6677
 epoch: 81, train_loss: 0.2305, test_loss: 1.3889, test_f1: 0.6675
 epoch: 82, train_loss: 0.2370, test_loss: 1.3227, test_f1: 0.6786
 epoch: 83, train_loss: 0.2264, test_loss: 1.3662, test_f1: 0.6764
 epoch: 84, train_loss: 0.2021, test_loss: 1.4656, test_f1: 0.6614
 epoch: 85, train_loss: 0.1981, test_loss: 1.3574, test_f1: 0.6526
 epoch: 86, train_loss: 0.2198, test_loss: 1.5022, test_f1: 0.6691
 epoch: 87, train_loss: 0.2144, test_loss: 1.4765, test_f1: 0.6748
 epoch: 88, train_loss: 0.1800, test_loss: 1.5082, test_f1: 0.6618
 epoch: 89, train_loss: 0.1996, test_loss: 1.5292, test_f1: 0.6651
 epoch: 90, train_loss: 0.2037, test_loss: 1.4306, test_f1: 0.6611
 epoch: 91, train_loss: 0.2058, test_loss: 1.5265, test_f1: 0.6586
 epoch: 92, train_loss: 0.1828, test_loss: 1.4447, test_f1: 0.6694
 epoch: 93, train_loss: 0.1815, test_loss: 1.6024, test_f1: 0.6742
 epoch: 94, train_loss: 0.1864, test_loss: 1.5029, test_f1: 0.6654
 epoch: 95, train_loss: 0.2030, test_loss: 1.5020, test_f1: 0.6618
 epoch: 96, train_loss: 0.2066, test_loss: 1.5612, test_f1: 0.6738
 epoch: 97, train_loss: 0.1857, test_loss: 1.5950, test_f1: 0.6598
 epoch: 98, train_loss: 0.1851, test_loss: 1.5849, test_f1: 0.6555
 epoch: 99, train_loss: 0.1820, test_loss: 1.5593, test_f1: 0.6528

Training completed in 600.66 seconds
Best F1: 0.7165 at epoch 71
Mean F1 across iterations: 0.7052  0.0067
========================FINAL RESULTS================================
FEGIN weighted F1: 0.7165  0.0067
python main.py --data ltspice_examples --representation component_pin_net --model FEGIN --layers 2 --hiddens 128 --batch_size 64 --lr 0.001 --emb_size 128 --epochs 100 --save_appendix component_pin_net_L2_H128_BS64_LR0.001_E128 --no_val
-----



STDERR:
  File "main.py", line 370, in <module>
    main()
  File "main.py", line 254, in main
    dataset = dataset_class(
  File "/home/philip/projects/ltspice_examples_code_repo/Circuit-Completion-Using-GNNs/component_classification_with_link_prediction_head/evaluation/FEGIN/kernel/circuit_datasets.py", line 15, in __init__
    self.data, self.slices = torch.load(self.processed_paths[0])
  File "/home/philip/.local/lib/python3.8/site-packages/torch/serialization.py", line 1040, in load
    warnings.warn(
  File "/usr/lib/python3.8/warnings.py", line 109, in _showwarnmsg
    sw(msg.message, msg.category, msg.filename, msg.lineno,
  File "main.py", line 47, in warn_with_traceback
    traceback.print_stack(file=log)
/home/philip/projects/ltspice_examples_code_repo/Circuit-Completion-Using-GNNs/component_classification_with_link_prediction_head/evaluation/FEGIN/kernel/circuit_datasets.py:15: FutureWarning: You are using `torch.load` with `weights_only=False` (the current default value), which uses the default pickle module implicitly. It is possible to construct malicious pickle data which will execute arbitrary code during unpickling (See https://github.com/pytorch/pytorch/blob/main/SECURITY.md#untrusted-models for more details). In a future release, the default value for `weights_only` will be flipped to `True`. This limits the functions that could be executed during unpickling. Arbitrary objects will no longer be allowed to be loaded via this mode unless they are explicitly allowlisted by the user via `torch.serialization.add_safe_globals`. We recommend you start setting `weights_only=True` for any use case where you don't have full control of the loaded file. Please open an issue on GitHub for any issues related to this experimental feature.
  self.data, self.slices = torch.load(self.processed_paths[0])
