STDOUT:
Results will be saved in /home/philip/projects/ltspice_examples_code_repo/Circuit-Completion-Using-GNNs/component_classification_with_link_prediction_head/evaluation/FEGIN/results/model_FEGIN_dataset_ltspice_demos
Command line input: python main.py --data ltspice_demos --representation component_net --model FEGIN --layers 6 --hiddens 128 --batch_size 256 --lr 0.0001 --emb_size 512 --epochs 100 --save_appendix component_net_L6_H128_BS256_LR0.0001_E512 --no_val
 is saved.
-----
ltspice_demos - FEGIN
Using 6 layers, 128 hidden units, h = 2
Loading component_net representation dataset
ENTERED
Training FEGIN on component_net representation
Train: 1565, Test: 383
##################ITERATION #0 ****************************************
 epoch: 0, train_loss: 1.3740, test_loss: 1.3732, test_f1: 0.2281
 epoch: 1, train_loss: 1.3584, test_loss: 1.3721, test_f1: 0.2281
 epoch: 2, train_loss: 1.3497, test_loss: 1.3703, test_f1: 0.2281
 epoch: 3, train_loss: 1.3393, test_loss: 1.3672, test_f1: 0.2281
 epoch: 4, train_loss: 1.3285, test_loss: 1.3625, test_f1: 0.2281
 epoch: 5, train_loss: 1.3138, test_loss: 1.3559, test_f1: 0.2281
 epoch: 6, train_loss: 1.2991, test_loss: 1.3484, test_f1: 0.2281
 epoch: 7, train_loss: 1.2838, test_loss: 1.3362, test_f1: 0.2281
 epoch: 8, train_loss: 1.2635, test_loss: 1.3198, test_f1: 0.2281
 epoch: 9, train_loss: 1.2448, test_loss: 1.3004, test_f1: 0.2337
 epoch: 10, train_loss: 1.2222, test_loss: 1.2803, test_f1: 0.2719
 epoch: 11, train_loss: 1.2027, test_loss: 1.2511, test_f1: 0.2986
 epoch: 12, train_loss: 1.1829, test_loss: 1.2279, test_f1: 0.3027
 epoch: 13, train_loss: 1.1662, test_loss: 1.2114, test_f1: 0.2746
 epoch: 14, train_loss: 1.1504, test_loss: 1.1960, test_f1: 0.2763
 epoch: 15, train_loss: 1.1372, test_loss: 1.1861, test_f1: 0.2884
 epoch: 16, train_loss: 1.1318, test_loss: 1.1779, test_f1: 0.2884
 epoch: 17, train_loss: 1.1164, test_loss: 1.1678, test_f1: 0.3562
 epoch: 18, train_loss: 1.1107, test_loss: 1.1659, test_f1: 0.3387
 epoch: 19, train_loss: 1.1008, test_loss: 1.1645, test_f1: 0.3408
 epoch: 20, train_loss: 1.0909, test_loss: 1.1515, test_f1: 0.3372
 epoch: 21, train_loss: 1.0876, test_loss: 1.1458, test_f1: 0.3441
 epoch: 22, train_loss: 1.0808, test_loss: 1.1404, test_f1: 0.3553
 epoch: 23, train_loss: 1.0734, test_loss: 1.1375, test_f1: 0.3553
 epoch: 24, train_loss: 1.0666, test_loss: 1.1225, test_f1: 0.3885
 epoch: 25, train_loss: 1.0575, test_loss: 1.1263, test_f1: 0.4242
 epoch: 26, train_loss: 1.0566, test_loss: 1.1144, test_f1: 0.4493
 epoch: 27, train_loss: 1.0478, test_loss: 1.1052, test_f1: 0.4618
 epoch: 28, train_loss: 1.0381, test_loss: 1.1078, test_f1: 0.4863
 epoch: 29, train_loss: 1.0323, test_loss: 1.0996, test_f1: 0.4978
 epoch: 30, train_loss: 1.0219, test_loss: 1.0959, test_f1: 0.5174
 epoch: 31, train_loss: 1.0213, test_loss: 1.1032, test_f1: 0.5112
 epoch: 32, train_loss: 1.0085, test_loss: 1.0988, test_f1: 0.5161
 epoch: 33, train_loss: 0.9989, test_loss: 1.0912, test_f1: 0.5079
 epoch: 34, train_loss: 0.9938, test_loss: 1.0662, test_f1: 0.5484
 epoch: 35, train_loss: 0.9861, test_loss: 1.0949, test_f1: 0.5227
 epoch: 36, train_loss: 0.9846, test_loss: 1.0668, test_f1: 0.5332
 epoch: 37, train_loss: 0.9646, test_loss: 1.0594, test_f1: 0.5551
 epoch: 38, train_loss: 0.9514, test_loss: 1.0349, test_f1: 0.5565
 epoch: 39, train_loss: 0.9499, test_loss: 1.0154, test_f1: 0.5492
 epoch: 40, train_loss: 0.9355, test_loss: 1.0207, test_f1: 0.5337
 epoch: 41, train_loss: 0.9279, test_loss: 1.0635, test_f1: 0.5404
 epoch: 42, train_loss: 0.9164, test_loss: 1.0286, test_f1: 0.5425
 epoch: 43, train_loss: 0.9083, test_loss: 1.0422, test_f1: 0.5268
 epoch: 44, train_loss: 0.8982, test_loss: 1.0252, test_f1: 0.5430
 epoch: 45, train_loss: 0.8856, test_loss: 1.0485, test_f1: 0.5336
 epoch: 46, train_loss: 0.8761, test_loss: 1.0554, test_f1: 0.5498
 epoch: 47, train_loss: 0.8628, test_loss: 1.0006, test_f1: 0.5340
 epoch: 48, train_loss: 0.8608, test_loss: 1.0018, test_f1: 0.5500
 epoch: 49, train_loss: 0.8533, test_loss: 0.9893, test_f1: 0.5581
 epoch: 50, train_loss: 0.8464, test_loss: 1.0168, test_f1: 0.5506
 epoch: 51, train_loss: 0.8390, test_loss: 0.9896, test_f1: 0.5336
 epoch: 52, train_loss: 0.8297, test_loss: 1.0302, test_f1: 0.5288
 epoch: 53, train_loss: 0.8306, test_loss: 1.0311, test_f1: 0.5443
 epoch: 54, train_loss: 0.8210, test_loss: 1.0202, test_f1: 0.5512
 epoch: 55, train_loss: 0.8120, test_loss: 1.0482, test_f1: 0.5455
 epoch: 56, train_loss: 0.8130, test_loss: 1.0499, test_f1: 0.5437
 epoch: 57, train_loss: 0.8104, test_loss: 1.0127, test_f1: 0.5494
 epoch: 58, train_loss: 0.7974, test_loss: 1.0938, test_f1: 0.5440
 epoch: 59, train_loss: 0.8006, test_loss: 1.0445, test_f1: 0.5468
 epoch: 60, train_loss: 0.7966, test_loss: 1.0369, test_f1: 0.5429
 epoch: 61, train_loss: 0.7979, test_loss: 1.0688, test_f1: 0.5452
 epoch: 62, train_loss: 0.7886, test_loss: 1.1095, test_f1: 0.5495
 epoch: 63, train_loss: 0.7842, test_loss: 1.0320, test_f1: 0.5468
 epoch: 64, train_loss: 0.7809, test_loss: 1.0659, test_f1: 0.5469
 epoch: 65, train_loss: 0.7809, test_loss: 1.0928, test_f1: 0.5493
 epoch: 66, train_loss: 0.7871, test_loss: 1.0548, test_f1: 0.5476
 epoch: 67, train_loss: 0.7750, test_loss: 1.0498, test_f1: 0.5575
 epoch: 68, train_loss: 0.7620, test_loss: 1.0384, test_f1: 0.5623
 epoch: 69, train_loss: 0.7647, test_loss: 1.0374, test_f1: 0.5518
 epoch: 70, train_loss: 0.7636, test_loss: 1.0495, test_f1: 0.5520
 epoch: 71, train_loss: 0.7660, test_loss: 1.1226, test_f1: 0.5551
 epoch: 72, train_loss: 0.7716, test_loss: 1.1026, test_f1: 0.5533
 epoch: 73, train_loss: 0.7616, test_loss: 1.0286, test_f1: 0.5648
 epoch: 74, train_loss: 0.7488, test_loss: 1.0414, test_f1: 0.5629
 epoch: 75, train_loss: 0.7416, test_loss: 1.0847, test_f1: 0.5624
 epoch: 76, train_loss: 0.7485, test_loss: 1.0545, test_f1: 0.5879
 epoch: 77, train_loss: 0.7424, test_loss: 1.0707, test_f1: 0.5786
 epoch: 78, train_loss: 0.7412, test_loss: 1.1201, test_f1: 0.5666
 epoch: 79, train_loss: 0.7406, test_loss: 1.1211, test_f1: 0.5582
 epoch: 80, train_loss: 0.7375, test_loss: 1.0832, test_f1: 0.5513
 epoch: 81, train_loss: 0.7381, test_loss: 1.0996, test_f1: 0.5516
 epoch: 82, train_loss: 0.7495, test_loss: 1.0825, test_f1: 0.5454
 epoch: 83, train_loss: 0.7310, test_loss: 1.0949, test_f1: 0.5536
 epoch: 84, train_loss: 0.7315, test_loss: 1.0907, test_f1: 0.5830
 epoch: 85, train_loss: 0.7265, test_loss: 1.1784, test_f1: 0.5690
 epoch: 86, train_loss: 0.7248, test_loss: 1.1838, test_f1: 0.5570
 epoch: 87, train_loss: 0.7180, test_loss: 1.1591, test_f1: 0.5421
 epoch: 88, train_loss: 0.7189, test_loss: 1.1363, test_f1: 0.5413
 epoch: 89, train_loss: 0.7179, test_loss: 1.0787, test_f1: 0.5640
 epoch: 90, train_loss: 0.7161, test_loss: 1.1245, test_f1: 0.5820
 epoch: 91, train_loss: 0.7171, test_loss: 1.1787, test_f1: 0.5823
 epoch: 92, train_loss: 0.7056, test_loss: 1.1338, test_f1: 0.5696
 epoch: 93, train_loss: 0.7083, test_loss: 1.1004, test_f1: 0.5652
 epoch: 94, train_loss: 0.6933, test_loss: 1.1477, test_f1: 0.5677
 epoch: 95, train_loss: 0.7032, test_loss: 1.2000, test_f1: 0.5591
 epoch: 96, train_loss: 0.7022, test_loss: 1.1629, test_f1: 0.5759
 epoch: 97, train_loss: 0.7003, test_loss: 1.1723, test_f1: 0.5715
 epoch: 98, train_loss: 0.6985, test_loss: 1.2336, test_f1: 0.5864
 epoch: 99, train_loss: 0.7061, test_loss: 1.1551, test_f1: 0.5881
##################ITERATION #1 ****************************************
 epoch: 0, train_loss: 1.3271, test_loss: 1.3646, test_f1: 0.2281
 epoch: 1, train_loss: 1.2816, test_loss: 1.3601, test_f1: 0.2281
 epoch: 2, train_loss: 1.2588, test_loss: 1.3537, test_f1: 0.2281
 epoch: 3, train_loss: 1.2360, test_loss: 1.3435, test_f1: 0.2281
 epoch: 4, train_loss: 1.2118, test_loss: 1.3321, test_f1: 0.2281
 epoch: 5, train_loss: 1.1957, test_loss: 1.3196, test_f1: 0.2281
 epoch: 6, train_loss: 1.1756, test_loss: 1.3043, test_f1: 0.2392
 epoch: 7, train_loss: 1.1586, test_loss: 1.2869, test_f1: 0.2390
 epoch: 8, train_loss: 1.1440, test_loss: 1.2685, test_f1: 0.2523
 epoch: 9, train_loss: 1.1325, test_loss: 1.2528, test_f1: 0.2500
 epoch: 10, train_loss: 1.1215, test_loss: 1.2325, test_f1: 0.2828
 epoch: 11, train_loss: 1.1096, test_loss: 1.2041, test_f1: 0.3381
 epoch: 12, train_loss: 1.0960, test_loss: 1.1794, test_f1: 0.4001
 epoch: 13, train_loss: 1.0828, test_loss: 1.1586, test_f1: 0.4630
 epoch: 14, train_loss: 1.0799, test_loss: 1.1463, test_f1: 0.4858
 epoch: 15, train_loss: 1.0714, test_loss: 1.1375, test_f1: 0.5020
 epoch: 16, train_loss: 1.0566, test_loss: 1.1281, test_f1: 0.5039
 epoch: 17, train_loss: 1.0468, test_loss: 1.1222, test_f1: 0.5075
 epoch: 18, train_loss: 1.0402, test_loss: 1.1071, test_f1: 0.5132
 epoch: 19, train_loss: 1.0281, test_loss: 1.0983, test_f1: 0.5233
 epoch: 20, train_loss: 1.0177, test_loss: 1.0940, test_f1: 0.5078
 epoch: 21, train_loss: 1.0140, test_loss: 1.0929, test_f1: 0.5264
 epoch: 22, train_loss: 1.0088, test_loss: 1.0891, test_f1: 0.5117
 epoch: 23, train_loss: 0.9936, test_loss: 1.0778, test_f1: 0.5229
 epoch: 24, train_loss: 0.9877, test_loss: 1.0775, test_f1: 0.5285
 epoch: 25, train_loss: 0.9809, test_loss: 1.0630, test_f1: 0.5368
 epoch: 26, train_loss: 0.9668, test_loss: 1.0627, test_f1: 0.5444
 epoch: 27, train_loss: 0.9529, test_loss: 1.0545, test_f1: 0.5447
 epoch: 28, train_loss: 0.9479, test_loss: 1.0491, test_f1: 0.5438
 epoch: 29, train_loss: 0.9455, test_loss: 1.0484, test_f1: 0.5470
 epoch: 30, train_loss: 0.9402, test_loss: 1.0455, test_f1: 0.5490
 epoch: 31, train_loss: 0.9331, test_loss: 1.0489, test_f1: 0.5372
 epoch: 32, train_loss: 0.9190, test_loss: 1.0389, test_f1: 0.5598
 epoch: 33, train_loss: 0.9128, test_loss: 1.0510, test_f1: 0.5591
 epoch: 34, train_loss: 0.9064, test_loss: 1.0195, test_f1: 0.5670
 epoch: 35, train_loss: 0.8961, test_loss: 1.0401, test_f1: 0.5546
 epoch: 36, train_loss: 0.8925, test_loss: 1.0991, test_f1: 0.5457
 epoch: 37, train_loss: 0.8888, test_loss: 1.1094, test_f1: 0.5260
 epoch: 38, train_loss: 0.8805, test_loss: 1.0515, test_f1: 0.5673
 epoch: 39, train_loss: 0.8741, test_loss: 1.0450, test_f1: 0.5595
 epoch: 40, train_loss: 0.8654, test_loss: 1.0284, test_f1: 0.5776
 epoch: 41, train_loss: 0.8486, test_loss: 1.0595, test_f1: 0.5707
 epoch: 42, train_loss: 0.8536, test_loss: 1.0422, test_f1: 0.5685
 epoch: 43, train_loss: 0.8471, test_loss: 1.0393, test_f1: 0.5749
 epoch: 44, train_loss: 0.8393, test_loss: 1.0194, test_f1: 0.5835
 epoch: 45, train_loss: 0.8351, test_loss: 1.0670, test_f1: 0.5551
 epoch: 46, train_loss: 0.8186, test_loss: 1.0431, test_f1: 0.5560
 epoch: 47, train_loss: 0.8216, test_loss: 1.0428, test_f1: 0.5603
 epoch: 48, train_loss: 0.8055, test_loss: 1.0717, test_f1: 0.5666
 epoch: 49, train_loss: 0.8037, test_loss: 1.0763, test_f1: 0.5768
 epoch: 50, train_loss: 0.8082, test_loss: 1.0497, test_f1: 0.5808
 epoch: 51, train_loss: 0.8029, test_loss: 1.0598, test_f1: 0.5741
 epoch: 52, train_loss: 0.7932, test_loss: 1.1097, test_f1: 0.5616
 epoch: 53, train_loss: 0.7968, test_loss: 1.1068, test_f1: 0.5549
 epoch: 54, train_loss: 0.7882, test_loss: 1.1033, test_f1: 0.5701
 epoch: 55, train_loss: 0.7870, test_loss: 1.0802, test_f1: 0.5728
 epoch: 56, train_loss: 0.7807, test_loss: 1.0652, test_f1: 0.5676
 epoch: 57, train_loss: 0.7750, test_loss: 1.1008, test_f1: 0.5644
 epoch: 58, train_loss: 0.7877, test_loss: 1.0945, test_f1: 0.5666
 epoch: 59, train_loss: 0.7666, test_loss: 1.0955, test_f1: 0.5743
 epoch: 60, train_loss: 0.7752, test_loss: 1.1098, test_f1: 0.5728
 epoch: 61, train_loss: 0.7709, test_loss: 1.0789, test_f1: 0.5854
 epoch: 62, train_loss: 0.7646, test_loss: 1.0777, test_f1: 0.5747
 epoch: 63, train_loss: 0.7575, test_loss: 1.1177, test_f1: 0.5639
 epoch: 64, train_loss: 0.7616, test_loss: 1.1090, test_f1: 0.5734
 epoch: 65, train_loss: 0.7455, test_loss: 1.1154, test_f1: 0.5600
 epoch: 66, train_loss: 0.7524, test_loss: 1.1235, test_f1: 0.5672
 epoch: 67, train_loss: 0.7558, test_loss: 1.1061, test_f1: 0.5881
 epoch: 68, train_loss: 0.7422, test_loss: 1.1154, test_f1: 0.5918
 epoch: 69, train_loss: 0.7432, test_loss: 1.1394, test_f1: 0.5627
 epoch: 70, train_loss: 0.7402, test_loss: 1.1485, test_f1: 0.5668
 epoch: 71, train_loss: 0.7462, test_loss: 1.1369, test_f1: 0.5731
 epoch: 72, train_loss: 0.7362, test_loss: 1.1294, test_f1: 0.5650
 epoch: 73, train_loss: 0.7406, test_loss: 1.1295, test_f1: 0.5719
 epoch: 74, train_loss: 0.7323, test_loss: 1.1058, test_f1: 0.5645
 epoch: 75, train_loss: 0.7305, test_loss: 1.1116, test_f1: 0.5730
 epoch: 76, train_loss: 0.7329, test_loss: 1.1810, test_f1: 0.5655
 epoch: 77, train_loss: 0.7312, test_loss: 1.1796, test_f1: 0.5630
 epoch: 78, train_loss: 0.7313, test_loss: 1.1847, test_f1: 0.5779
 epoch: 79, train_loss: 0.7309, test_loss: 1.1507, test_f1: 0.5792
 epoch: 80, train_loss: 0.7247, test_loss: 1.1511, test_f1: 0.5787
 epoch: 81, train_loss: 0.7356, test_loss: 1.1959, test_f1: 0.5702
 epoch: 82, train_loss: 0.7136, test_loss: 1.2446, test_f1: 0.5274
 epoch: 83, train_loss: 0.7154, test_loss: 1.2367, test_f1: 0.5473
 epoch: 84, train_loss: 0.7128, test_loss: 1.2084, test_f1: 0.5629
 epoch: 85, train_loss: 0.7160, test_loss: 1.1994, test_f1: 0.5674
 epoch: 86, train_loss: 0.7211, test_loss: 1.1827, test_f1: 0.5741
 epoch: 87, train_loss: 0.7156, test_loss: 1.2025, test_f1: 0.5645
 epoch: 88, train_loss: 0.7097, test_loss: 1.2087, test_f1: 0.5674
 epoch: 89, train_loss: 0.7066, test_loss: 1.1958, test_f1: 0.5701
 epoch: 90, train_loss: 0.7079, test_loss: 1.2278, test_f1: 0.5755
 epoch: 91, train_loss: 0.7010, test_loss: 1.1721, test_f1: 0.5797
 epoch: 92, train_loss: 0.6956, test_loss: 1.1659, test_f1: 0.5611
 epoch: 93, train_loss: 0.7057, test_loss: 1.1924, test_f1: 0.5644
 epoch: 94, train_loss: 0.6959, test_loss: 1.2133, test_f1: 0.5616
 epoch: 95, train_loss: 0.6990, test_loss: 1.1777, test_f1: 0.5662
 epoch: 96, train_loss: 0.6974, test_loss: 1.1562, test_f1: 0.5591
 epoch: 97, train_loss: 0.6965, test_loss: 1.1379, test_f1: 0.5624
 epoch: 98, train_loss: 0.7027, test_loss: 1.1721, test_f1: 0.5746
 epoch: 99, train_loss: 0.6839, test_loss: 1.2114, test_f1: 0.5646
##################ITERATION #2 ****************************************
 epoch: 0, train_loss: 1.2765, test_loss: 1.3481, test_f1: 0.2281
 epoch: 1, train_loss: 1.2182, test_loss: 1.3443, test_f1: 0.2281
 epoch: 2, train_loss: 1.1893, test_loss: 1.3396, test_f1: 0.2281
 epoch: 3, train_loss: 1.1707, test_loss: 1.3287, test_f1: 0.2281
 epoch: 4, train_loss: 1.1491, test_loss: 1.3089, test_f1: 0.2281
 epoch: 5, train_loss: 1.1341, test_loss: 1.2897, test_f1: 0.2281
 epoch: 6, train_loss: 1.1166, test_loss: 1.2785, test_f1: 0.2443
 epoch: 7, train_loss: 1.1076, test_loss: 1.2623, test_f1: 0.2753
 epoch: 8, train_loss: 1.0885, test_loss: 1.2450, test_f1: 0.3315
 epoch: 9, train_loss: 1.0793, test_loss: 1.2226, test_f1: 0.3783
 epoch: 10, train_loss: 1.0617, test_loss: 1.1801, test_f1: 0.3995
 epoch: 11, train_loss: 1.0599, test_loss: 1.1474, test_f1: 0.4071
 epoch: 12, train_loss: 1.0486, test_loss: 1.1306, test_f1: 0.4586
 epoch: 13, train_loss: 1.0363, test_loss: 1.1198, test_f1: 0.4834
 epoch: 14, train_loss: 1.0288, test_loss: 1.1069, test_f1: 0.4829
 epoch: 15, train_loss: 1.0115, test_loss: 1.1034, test_f1: 0.4711
 epoch: 16, train_loss: 1.0023, test_loss: 1.0943, test_f1: 0.4737
 epoch: 17, train_loss: 0.9940, test_loss: 1.0841, test_f1: 0.4754
 epoch: 18, train_loss: 0.9864, test_loss: 1.0863, test_f1: 0.5094
 epoch: 19, train_loss: 0.9756, test_loss: 1.0827, test_f1: 0.5131
 epoch: 20, train_loss: 0.9661, test_loss: 1.0887, test_f1: 0.5085
 epoch: 21, train_loss: 0.9587, test_loss: 1.0854, test_f1: 0.5112
 epoch: 22, train_loss: 0.9584, test_loss: 1.0767, test_f1: 0.5138
 epoch: 23, train_loss: 0.9385, test_loss: 1.0774, test_f1: 0.5231
 epoch: 24, train_loss: 0.9401, test_loss: 1.0645, test_f1: 0.5347
 epoch: 25, train_loss: 0.9254, test_loss: 1.0424, test_f1: 0.5304
 epoch: 26, train_loss: 0.9134, test_loss: 1.0442, test_f1: 0.5301
 epoch: 27, train_loss: 0.9170, test_loss: 1.0481, test_f1: 0.5424
 epoch: 28, train_loss: 0.9086, test_loss: 1.0423, test_f1: 0.5632
 epoch: 29, train_loss: 0.9006, test_loss: 1.0395, test_f1: 0.5542
 epoch: 30, train_loss: 0.8994, test_loss: 1.0551, test_f1: 0.5576
 epoch: 31, train_loss: 0.8865, test_loss: 1.0498, test_f1: 0.5494
 epoch: 32, train_loss: 0.8800, test_loss: 1.0480, test_f1: 0.5534
 epoch: 33, train_loss: 0.8768, test_loss: 1.0314, test_f1: 0.5633
 epoch: 34, train_loss: 0.8701, test_loss: 1.0646, test_f1: 0.5657
 epoch: 35, train_loss: 0.8682, test_loss: 1.0436, test_f1: 0.5682
 epoch: 36, train_loss: 0.8600, test_loss: 1.0340, test_f1: 0.5683
 epoch: 37, train_loss: 0.8572, test_loss: 1.0445, test_f1: 0.5701
 epoch: 38, train_loss: 0.8482, test_loss: 1.0340, test_f1: 0.5694
 epoch: 39, train_loss: 0.8459, test_loss: 1.0693, test_f1: 0.5620
 epoch: 40, train_loss: 0.8429, test_loss: 1.0287, test_f1: 0.5650
 epoch: 41, train_loss: 0.8266, test_loss: 1.0588, test_f1: 0.5719
 epoch: 42, train_loss: 0.8201, test_loss: 1.0863, test_f1: 0.5689
 epoch: 43, train_loss: 0.8234, test_loss: 1.0801, test_f1: 0.5679
 epoch: 44, train_loss: 0.8282, test_loss: 1.0847, test_f1: 0.5766
 epoch: 45, train_loss: 0.8232, test_loss: 1.0735, test_f1: 0.5804
 epoch: 46, train_loss: 0.8056, test_loss: 1.0756, test_f1: 0.5702
 epoch: 47, train_loss: 0.8053, test_loss: 1.0660, test_f1: 0.5777
 epoch: 48, train_loss: 0.8018, test_loss: 1.0885, test_f1: 0.5667
 epoch: 49, train_loss: 0.7860, test_loss: 1.0972, test_f1: 0.5747
 epoch: 50, train_loss: 0.8022, test_loss: 1.0898, test_f1: 0.5765
 epoch: 51, train_loss: 0.7919, test_loss: 1.0863, test_f1: 0.5734
 epoch: 52, train_loss: 0.7865, test_loss: 1.1231, test_f1: 0.5832
 epoch: 53, train_loss: 0.7843, test_loss: 1.1274, test_f1: 0.5728
 epoch: 54, train_loss: 0.7735, test_loss: 1.1054, test_f1: 0.5597
 epoch: 55, train_loss: 0.7773, test_loss: 1.1024, test_f1: 0.5702
 epoch: 56, train_loss: 0.7691, test_loss: 1.0896, test_f1: 0.5677
 epoch: 57, train_loss: 0.7708, test_loss: 1.1005, test_f1: 0.5717
 epoch: 58, train_loss: 0.7783, test_loss: 1.1328, test_f1: 0.5586
 epoch: 59, train_loss: 0.7720, test_loss: 1.0917, test_f1: 0.5635
 epoch: 60, train_loss: 0.7637, test_loss: 1.0785, test_f1: 0.5692
 epoch: 61, train_loss: 0.7599, test_loss: 1.0823, test_f1: 0.5653
 epoch: 62, train_loss: 0.7656, test_loss: 1.1265, test_f1: 0.5609
 epoch: 63, train_loss: 0.7586, test_loss: 1.1222, test_f1: 0.5593
 epoch: 64, train_loss: 0.7576, test_loss: 1.1012, test_f1: 0.5655
 epoch: 65, train_loss: 0.7472, test_loss: 1.1080, test_f1: 0.5636
 epoch: 66, train_loss: 0.7479, test_loss: 1.1300, test_f1: 0.5773
 epoch: 67, train_loss: 0.7388, test_loss: 1.1427, test_f1: 0.5597
 epoch: 68, train_loss: 0.7479, test_loss: 1.1604, test_f1: 0.5632
 epoch: 69, train_loss: 0.7393, test_loss: 1.1670, test_f1: 0.5686
 epoch: 70, train_loss: 0.7318, test_loss: 1.1816, test_f1: 0.5558
 epoch: 71, train_loss: 0.7466, test_loss: 1.1643, test_f1: 0.5479
 epoch: 72, train_loss: 0.7347, test_loss: 1.1442, test_f1: 0.5444
 epoch: 73, train_loss: 0.7397, test_loss: 1.1193, test_f1: 0.5567
 epoch: 74, train_loss: 0.7491, test_loss: 1.1087, test_f1: 0.5736
 epoch: 75, train_loss: 0.7389, test_loss: 1.1503, test_f1: 0.5607
 epoch: 76, train_loss: 0.7468, test_loss: 1.1658, test_f1: 0.5641
 epoch: 77, train_loss: 0.7387, test_loss: 1.1674, test_f1: 0.5507
 epoch: 78, train_loss: 0.7301, test_loss: 1.1791, test_f1: 0.5614
 epoch: 79, train_loss: 0.7311, test_loss: 1.1847, test_f1: 0.5708
 epoch: 80, train_loss: 0.7279, test_loss: 1.1920, test_f1: 0.5604
 epoch: 81, train_loss: 0.7185, test_loss: 1.2057, test_f1: 0.5550
 epoch: 82, train_loss: 0.7170, test_loss: 1.2116, test_f1: 0.5609
 epoch: 83, train_loss: 0.7184, test_loss: 1.1982, test_f1: 0.5570
 epoch: 84, train_loss: 0.7250, test_loss: 1.1730, test_f1: 0.5597
 epoch: 85, train_loss: 0.7130, test_loss: 1.1906, test_f1: 0.5666
 epoch: 86, train_loss: 0.7123, test_loss: 1.2057, test_f1: 0.5668
 epoch: 87, train_loss: 0.7099, test_loss: 1.1907, test_f1: 0.5645
 epoch: 88, train_loss: 0.7130, test_loss: 1.2006, test_f1: 0.5591
 epoch: 89, train_loss: 0.7064, test_loss: 1.2175, test_f1: 0.5491
 epoch: 90, train_loss: 0.7128, test_loss: 1.2314, test_f1: 0.5495
 epoch: 91, train_loss: 0.7056, test_loss: 1.1906, test_f1: 0.5651
 epoch: 92, train_loss: 0.7125, test_loss: 1.1873, test_f1: 0.5612
 epoch: 93, train_loss: 0.7145, test_loss: 1.1950, test_f1: 0.5682
 epoch: 94, train_loss: 0.7027, test_loss: 1.1746, test_f1: 0.5641
 epoch: 95, train_loss: 0.7071, test_loss: 1.1822, test_f1: 0.5673
 epoch: 96, train_loss: 0.6962, test_loss: 1.1788, test_f1: 0.5700
 epoch: 97, train_loss: 0.6953, test_loss: 1.1665, test_f1: 0.5701
 epoch: 98, train_loss: 0.6958, test_loss: 1.1515, test_f1: 0.5744
 epoch: 99, train_loss: 0.6813, test_loss: 1.1938, test_f1: 0.5632
##################ITERATION #3 ****************************************
 epoch: 0, train_loss: 1.2722, test_loss: 1.3468, test_f1: 0.2281
 epoch: 1, train_loss: 1.1918, test_loss: 1.3400, test_f1: 0.2281
 epoch: 2, train_loss: 1.1665, test_loss: 1.3344, test_f1: 0.2281
 epoch: 3, train_loss: 1.1351, test_loss: 1.3236, test_f1: 0.2281
 epoch: 4, train_loss: 1.1156, test_loss: 1.3021, test_f1: 0.2336
 epoch: 5, train_loss: 1.1028, test_loss: 1.2726, test_f1: 0.2558
 epoch: 6, train_loss: 1.0887, test_loss: 1.2437, test_f1: 0.3224
 epoch: 7, train_loss: 1.0683, test_loss: 1.2142, test_f1: 0.3438
 epoch: 8, train_loss: 1.0587, test_loss: 1.1910, test_f1: 0.3903
 epoch: 9, train_loss: 1.0469, test_loss: 1.1767, test_f1: 0.3868
 epoch: 10, train_loss: 1.0277, test_loss: 1.1597, test_f1: 0.4512
 epoch: 11, train_loss: 1.0202, test_loss: 1.1386, test_f1: 0.4968
 epoch: 12, train_loss: 1.0145, test_loss: 1.1165, test_f1: 0.4977
 epoch: 13, train_loss: 0.9991, test_loss: 1.1174, test_f1: 0.4955
 epoch: 14, train_loss: 0.9868, test_loss: 1.1171, test_f1: 0.4983
 epoch: 15, train_loss: 0.9835, test_loss: 1.1181, test_f1: 0.5052
 epoch: 16, train_loss: 0.9685, test_loss: 1.1116, test_f1: 0.5194
 epoch: 17, train_loss: 0.9588, test_loss: 1.1073, test_f1: 0.5277
 epoch: 18, train_loss: 0.9537, test_loss: 1.1472, test_f1: 0.5281
 epoch: 19, train_loss: 0.9515, test_loss: 1.1387, test_f1: 0.5273
 epoch: 20, train_loss: 0.9345, test_loss: 1.1499, test_f1: 0.5240
 epoch: 21, train_loss: 0.9303, test_loss: 1.2080, test_f1: 0.5406
 epoch: 22, train_loss: 0.9263, test_loss: 1.1625, test_f1: 0.5367
 epoch: 23, train_loss: 0.9105, test_loss: 1.0966, test_f1: 0.5313
 epoch: 24, train_loss: 0.9125, test_loss: 1.0943, test_f1: 0.5435
 epoch: 25, train_loss: 0.9068, test_loss: 1.1123, test_f1: 0.5560
 epoch: 26, train_loss: 0.8927, test_loss: 1.1090, test_f1: 0.5474
 epoch: 27, train_loss: 0.8813, test_loss: 1.1170, test_f1: 0.5555
 epoch: 28, train_loss: 0.8820, test_loss: 1.1179, test_f1: 0.5338
 epoch: 29, train_loss: 0.8694, test_loss: 1.1932, test_f1: 0.5467
 epoch: 30, train_loss: 0.8680, test_loss: 1.1992, test_f1: 0.5556
 epoch: 31, train_loss: 0.8528, test_loss: 1.2196, test_f1: 0.5613
 epoch: 32, train_loss: 0.8580, test_loss: 1.1942, test_f1: 0.5631
 epoch: 33, train_loss: 0.8503, test_loss: 1.2494, test_f1: 0.5589
 epoch: 34, train_loss: 0.8380, test_loss: 1.2864, test_f1: 0.5609
 epoch: 35, train_loss: 0.8428, test_loss: 1.2508, test_f1: 0.5680
 epoch: 36, train_loss: 0.8301, test_loss: 1.2045, test_f1: 0.5628
 epoch: 37, train_loss: 0.8315, test_loss: 1.2032, test_f1: 0.5720
 epoch: 38, train_loss: 0.8214, test_loss: 1.1975, test_f1: 0.5513
 epoch: 39, train_loss: 0.8150, test_loss: 1.1842, test_f1: 0.5791
 epoch: 40, train_loss: 0.8112, test_loss: 1.2051, test_f1: 0.5746
 epoch: 41, train_loss: 0.8008, test_loss: 1.2188, test_f1: 0.5558
 epoch: 42, train_loss: 0.7970, test_loss: 1.1755, test_f1: 0.5823
 epoch: 43, train_loss: 0.7990, test_loss: 1.2168, test_f1: 0.5486
 epoch: 44, train_loss: 0.7975, test_loss: 1.2327, test_f1: 0.5570
 epoch: 45, train_loss: 0.7982, test_loss: 1.2939, test_f1: 0.5656
 epoch: 46, train_loss: 0.7838, test_loss: 1.3769, test_f1: 0.5478
 epoch: 47, train_loss: 0.7768, test_loss: 1.2706, test_f1: 0.5585
 epoch: 48, train_loss: 0.7759, test_loss: 1.2269, test_f1: 0.5645
 epoch: 49, train_loss: 0.7807, test_loss: 1.2198, test_f1: 0.5659
 epoch: 50, train_loss: 0.7764, test_loss: 1.1858, test_f1: 0.5544
 epoch: 51, train_loss: 0.7635, test_loss: 1.1820, test_f1: 0.5698
 epoch: 52, train_loss: 0.7541, test_loss: 1.1850, test_f1: 0.5720
 epoch: 53, train_loss: 0.7517, test_loss: 1.2044, test_f1: 0.5715
 epoch: 54, train_loss: 0.7555, test_loss: 1.2163, test_f1: 0.5804
 epoch: 55, train_loss: 0.7416, test_loss: 1.2856, test_f1: 0.5759
 epoch: 56, train_loss: 0.7442, test_loss: 1.2313, test_f1: 0.5766
 epoch: 57, train_loss: 0.7467, test_loss: 1.2263, test_f1: 0.5653
 epoch: 58, train_loss: 0.7402, test_loss: 1.2661, test_f1: 0.5670
 epoch: 59, train_loss: 0.7383, test_loss: 1.2808, test_f1: 0.5658
 epoch: 60, train_loss: 0.7288, test_loss: 1.2713, test_f1: 0.5512
 epoch: 61, train_loss: 0.7241, test_loss: 1.2519, test_f1: 0.5565
 epoch: 62, train_loss: 0.7253, test_loss: 1.2981, test_f1: 0.5629
 epoch: 63, train_loss: 0.7229, test_loss: 1.3128, test_f1: 0.5575
 epoch: 64, train_loss: 0.7251, test_loss: 1.3773, test_f1: 0.5610
 epoch: 65, train_loss: 0.7256, test_loss: 1.3689, test_f1: 0.5725
 epoch: 66, train_loss: 0.7193, test_loss: 1.3466, test_f1: 0.5675
 epoch: 67, train_loss: 0.7135, test_loss: 1.3320, test_f1: 0.5784
 epoch: 68, train_loss: 0.7160, test_loss: 1.2900, test_f1: 0.5694
 epoch: 69, train_loss: 0.7121, test_loss: 1.2670, test_f1: 0.5642
 epoch: 70, train_loss: 0.7197, test_loss: 1.2667, test_f1: 0.5679
 epoch: 71, train_loss: 0.7041, test_loss: 1.2375, test_f1: 0.5832
 epoch: 72, train_loss: 0.7078, test_loss: 1.2700, test_f1: 0.5745
 epoch: 73, train_loss: 0.6871, test_loss: 1.3170, test_f1: 0.5852
 epoch: 74, train_loss: 0.7017, test_loss: 1.2899, test_f1: 0.5769
 epoch: 75, train_loss: 0.6997, test_loss: 1.2806, test_f1: 0.5681
 epoch: 76, train_loss: 0.6927, test_loss: 1.2849, test_f1: 0.5712
 epoch: 77, train_loss: 0.6840, test_loss: 1.3133, test_f1: 0.5671
 epoch: 78, train_loss: 0.6906, test_loss: 1.3131, test_f1: 0.5582
 epoch: 79, train_loss: 0.6995, test_loss: 1.2422, test_f1: 0.5671
 epoch: 80, train_loss: 0.6948, test_loss: 1.1972, test_f1: 0.5643
 epoch: 81, train_loss: 0.6796, test_loss: 1.1705, test_f1: 0.5636
 epoch: 82, train_loss: 0.6942, test_loss: 1.2820, test_f1: 0.5756
 epoch: 83, train_loss: 0.6811, test_loss: 1.2709, test_f1: 0.5964
 epoch: 84, train_loss: 0.6805, test_loss: 1.3082, test_f1: 0.5857
 epoch: 85, train_loss: 0.6720, test_loss: 1.3517, test_f1: 0.5745
 epoch: 86, train_loss: 0.6848, test_loss: 1.3550, test_f1: 0.5837
 epoch: 87, train_loss: 0.6720, test_loss: 1.3318, test_f1: 0.5765
 epoch: 88, train_loss: 0.6675, test_loss: 1.3433, test_f1: 0.5762
 epoch: 89, train_loss: 0.6609, test_loss: 1.3844, test_f1: 0.5746
 epoch: 90, train_loss: 0.6746, test_loss: 1.3932, test_f1: 0.5871
 epoch: 91, train_loss: 0.6687, test_loss: 1.3416, test_f1: 0.5780
 epoch: 92, train_loss: 0.6697, test_loss: 1.2522, test_f1: 0.5711
 epoch: 93, train_loss: 0.6741, test_loss: 1.2452, test_f1: 0.5699
 epoch: 94, train_loss: 0.6778, test_loss: 1.3290, test_f1: 0.5781
 epoch: 95, train_loss: 0.6602, test_loss: 1.3576, test_f1: 0.5670
 epoch: 96, train_loss: 0.6612, test_loss: 1.4897, test_f1: 0.5589
 epoch: 97, train_loss: 0.6590, test_loss: 1.3171, test_f1: 0.5502
 epoch: 98, train_loss: 0.6538, test_loss: 1.3915, test_f1: 0.5795
 epoch: 99, train_loss: 0.6402, test_loss: 1.4425, test_f1: 0.5887
##################ITERATION #4 ****************************************
 epoch: 0, train_loss: 1.2584, test_loss: 1.3277, test_f1: 0.2281
 epoch: 1, train_loss: 1.1907, test_loss: 1.3194, test_f1: 0.2281
 epoch: 2, train_loss: 1.1620, test_loss: 1.3158, test_f1: 0.2281
 epoch: 3, train_loss: 1.1356, test_loss: 1.3076, test_f1: 0.2281
 epoch: 4, train_loss: 1.1199, test_loss: 1.2965, test_f1: 0.2281
 epoch: 5, train_loss: 1.1065, test_loss: 1.2802, test_f1: 0.2281
 epoch: 6, train_loss: 1.0876, test_loss: 1.2628, test_f1: 0.2475
 epoch: 7, train_loss: 1.0870, test_loss: 1.2497, test_f1: 0.3409
 epoch: 8, train_loss: 1.0632, test_loss: 1.2377, test_f1: 0.3841
 epoch: 9, train_loss: 1.0540, test_loss: 1.2187, test_f1: 0.4062
 epoch: 10, train_loss: 1.0477, test_loss: 1.1936, test_f1: 0.4204
 epoch: 11, train_loss: 1.0426, test_loss: 1.1722, test_f1: 0.4265
 epoch: 12, train_loss: 1.0279, test_loss: 1.1559, test_f1: 0.4380
 epoch: 13, train_loss: 1.0193, test_loss: 1.1282, test_f1: 0.4743
 epoch: 14, train_loss: 1.0081, test_loss: 1.1098, test_f1: 0.5029
 epoch: 15, train_loss: 0.9946, test_loss: 1.1008, test_f1: 0.5114
 epoch: 16, train_loss: 0.9884, test_loss: 1.0951, test_f1: 0.5168
 epoch: 17, train_loss: 0.9795, test_loss: 1.0795, test_f1: 0.5187
 epoch: 18, train_loss: 0.9728, test_loss: 1.0801, test_f1: 0.5245
 epoch: 19, train_loss: 0.9665, test_loss: 1.0780, test_f1: 0.5192
 epoch: 20, train_loss: 0.9494, test_loss: 1.0613, test_f1: 0.5340
 epoch: 21, train_loss: 0.9431, test_loss: 1.0538, test_f1: 0.4950
 epoch: 22, train_loss: 0.9413, test_loss: 1.0581, test_f1: 0.5228
 epoch: 23, train_loss: 0.9386, test_loss: 1.0834, test_f1: 0.4756
 epoch: 24, train_loss: 0.9360, test_loss: 1.0747, test_f1: 0.4836
 epoch: 25, train_loss: 0.9247, test_loss: 1.0495, test_f1: 0.5098
 epoch: 26, train_loss: 0.9244, test_loss: 1.0409, test_f1: 0.5504
 epoch: 27, train_loss: 0.9143, test_loss: 1.0497, test_f1: 0.5399
 epoch: 28, train_loss: 0.9046, test_loss: 1.0326, test_f1: 0.5462
 epoch: 29, train_loss: 0.8929, test_loss: 1.0078, test_f1: 0.5489
 epoch: 30, train_loss: 0.8892, test_loss: 1.0020, test_f1: 0.5556
 epoch: 31, train_loss: 0.8889, test_loss: 1.0299, test_f1: 0.5621
 epoch: 32, train_loss: 0.8775, test_loss: 1.0257, test_f1: 0.5648
 epoch: 33, train_loss: 0.8578, test_loss: 1.0306, test_f1: 0.5701
 epoch: 34, train_loss: 0.8617, test_loss: 1.0104, test_f1: 0.5784
 epoch: 35, train_loss: 0.8481, test_loss: 1.0365, test_f1: 0.5591
 epoch: 36, train_loss: 0.8413, test_loss: 1.0309, test_f1: 0.5633
 epoch: 37, train_loss: 0.8503, test_loss: 1.0315, test_f1: 0.5579
 epoch: 38, train_loss: 0.8472, test_loss: 1.0212, test_f1: 0.5785
 epoch: 39, train_loss: 0.8382, test_loss: 1.0456, test_f1: 0.5544
 epoch: 40, train_loss: 0.8523, test_loss: 1.0585, test_f1: 0.5588
 epoch: 41, train_loss: 0.8451, test_loss: 1.0276, test_f1: 0.5646
 epoch: 42, train_loss: 0.8423, test_loss: 1.0433, test_f1: 0.5487
 epoch: 43, train_loss: 0.8355, test_loss: 1.0696, test_f1: 0.5460
 epoch: 44, train_loss: 0.8284, test_loss: 1.0258, test_f1: 0.5754
 epoch: 45, train_loss: 0.8186, test_loss: 1.0132, test_f1: 0.5706
 epoch: 46, train_loss: 0.8252, test_loss: 0.9933, test_f1: 0.5887
 epoch: 47, train_loss: 0.8216, test_loss: 1.0063, test_f1: 0.5873
 epoch: 48, train_loss: 0.8069, test_loss: 1.0345, test_f1: 0.5789
 epoch: 49, train_loss: 0.7983, test_loss: 1.0593, test_f1: 0.5784
 epoch: 50, train_loss: 0.8241, test_loss: 1.0735, test_f1: 0.5622
 epoch: 51, train_loss: 0.7952, test_loss: 1.0651, test_f1: 0.5723
 epoch: 52, train_loss: 0.7943, test_loss: 1.0736, test_f1: 0.5664
 epoch: 53, train_loss: 0.7839, test_loss: 1.0866, test_f1: 0.5640
 epoch: 54, train_loss: 0.7690, test_loss: 1.1030, test_f1: 0.5697
 epoch: 55, train_loss: 0.7790, test_loss: 1.0993, test_f1: 0.5675
 epoch: 56, train_loss: 0.7762, test_loss: 1.0369, test_f1: 0.5799
 epoch: 57, train_loss: 0.7780, test_loss: 1.0677, test_f1: 0.5720
 epoch: 58, train_loss: 0.7769, test_loss: 1.1025, test_f1: 0.5444
 epoch: 59, train_loss: 0.7686, test_loss: 1.0725, test_f1: 0.5376
 epoch: 60, train_loss: 0.7684, test_loss: 1.0532, test_f1: 0.5672
 epoch: 61, train_loss: 0.7654, test_loss: 1.0502, test_f1: 0.5728
 epoch: 62, train_loss: 0.7606, test_loss: 1.0718, test_f1: 0.5749
 epoch: 63, train_loss: 0.7607, test_loss: 1.0898, test_f1: 0.5474
 epoch: 64, train_loss: 0.7525, test_loss: 1.0781, test_f1: 0.5538
 epoch: 65, train_loss: 0.7468, test_loss: 1.0585, test_f1: 0.5615
 epoch: 66, train_loss: 0.7367, test_loss: 1.0687, test_f1: 0.5605
 epoch: 67, train_loss: 0.7405, test_loss: 1.0768, test_f1: 0.5451
 epoch: 68, train_loss: 0.7533, test_loss: 1.0930, test_f1: 0.5467
 epoch: 69, train_loss: 0.7440, test_loss: 1.1153, test_f1: 0.5523
 epoch: 70, train_loss: 0.7419, test_loss: 1.1153, test_f1: 0.5528
 epoch: 71, train_loss: 0.7410, test_loss: 1.1508, test_f1: 0.5484
 epoch: 72, train_loss: 0.7451, test_loss: 1.1592, test_f1: 0.5607
 epoch: 73, train_loss: 0.7473, test_loss: 1.1702, test_f1: 0.5513
 epoch: 74, train_loss: 0.7253, test_loss: 1.1412, test_f1: 0.5526
 epoch: 75, train_loss: 0.7211, test_loss: 1.1433, test_f1: 0.5429
 epoch: 76, train_loss: 0.7379, test_loss: 1.1232, test_f1: 0.5622
 epoch: 77, train_loss: 0.7227, test_loss: 1.1306, test_f1: 0.5600
 epoch: 78, train_loss: 0.7227, test_loss: 1.1273, test_f1: 0.5649
 epoch: 79, train_loss: 0.7241, test_loss: 1.1239, test_f1: 0.5687
 epoch: 80, train_loss: 0.7275, test_loss: 1.1220, test_f1: 0.5561
 epoch: 81, train_loss: 0.7266, test_loss: 1.1212, test_f1: 0.5693
 epoch: 82, train_loss: 0.7248, test_loss: 1.1223, test_f1: 0.5709
 epoch: 83, train_loss: 0.7094, test_loss: 1.1057, test_f1: 0.5556
 epoch: 84, train_loss: 0.7137, test_loss: 1.1279, test_f1: 0.5646
 epoch: 85, train_loss: 0.7208, test_loss: 1.1457, test_f1: 0.5634
 epoch: 86, train_loss: 0.7069, test_loss: 1.1473, test_f1: 0.5605
 epoch: 87, train_loss: 0.7302, test_loss: 1.1089, test_f1: 0.5550
 epoch: 88, train_loss: 0.7161, test_loss: 1.1397, test_f1: 0.5558
 epoch: 89, train_loss: 0.7035, test_loss: 1.1625, test_f1: 0.5461
 epoch: 90, train_loss: 0.7117, test_loss: 1.1840, test_f1: 0.5404
 epoch: 91, train_loss: 0.7127, test_loss: 1.1585, test_f1: 0.5465
 epoch: 92, train_loss: 0.7061, test_loss: 1.1650, test_f1: 0.5514
 epoch: 93, train_loss: 0.7094, test_loss: 1.1844, test_f1: 0.5445
 epoch: 94, train_loss: 0.6967, test_loss: 1.1638, test_f1: 0.5479
 epoch: 95, train_loss: 0.6973, test_loss: 1.1297, test_f1: 0.5620
 epoch: 96, train_loss: 0.6986, test_loss: 1.1519, test_f1: 0.5648
 epoch: 97, train_loss: 0.6932, test_loss: 1.1377, test_f1: 0.5686
 epoch: 98, train_loss: 0.6927, test_loss: 1.1455, test_f1: 0.5488
 epoch: 99, train_loss: 0.6903, test_loss: 1.1830, test_f1: 0.5517
##################ITERATION #5 ****************************************
 epoch: 0, train_loss: 1.2265, test_loss: 1.3708, test_f1: 0.2281
 epoch: 1, train_loss: 1.1436, test_loss: 1.3698, test_f1: 0.2281
 epoch: 2, train_loss: 1.1203, test_loss: 1.3664, test_f1: 0.3011
 epoch: 3, train_loss: 1.0900, test_loss: 1.3638, test_f1: 0.2384
 epoch: 4, train_loss: 1.0754, test_loss: 1.3463, test_f1: 0.2728
 epoch: 5, train_loss: 1.0627, test_loss: 1.3148, test_f1: 0.3092
 epoch: 6, train_loss: 1.0473, test_loss: 1.2716, test_f1: 0.3946
 epoch: 7, train_loss: 1.0368, test_loss: 1.2344, test_f1: 0.4208
 epoch: 8, train_loss: 1.0211, test_loss: 1.1893, test_f1: 0.4710
 epoch: 9, train_loss: 1.0091, test_loss: 1.1601, test_f1: 0.4851
 epoch: 10, train_loss: 0.9931, test_loss: 1.1299, test_f1: 0.5001
 epoch: 11, train_loss: 0.9825, test_loss: 1.1046, test_f1: 0.4896
 epoch: 12, train_loss: 0.9773, test_loss: 1.0911, test_f1: 0.4723
 epoch: 13, train_loss: 0.9691, test_loss: 1.0654, test_f1: 0.4878
 epoch: 14, train_loss: 0.9572, test_loss: 1.0486, test_f1: 0.5007
 epoch: 15, train_loss: 0.9442, test_loss: 1.0409, test_f1: 0.5101
 epoch: 16, train_loss: 0.9422, test_loss: 1.0432, test_f1: 0.5124
 epoch: 17, train_loss: 0.9247, test_loss: 1.0416, test_f1: 0.5274
 epoch: 18, train_loss: 0.9181, test_loss: 1.0342, test_f1: 0.5134
 epoch: 19, train_loss: 0.9083, test_loss: 1.0264, test_f1: 0.5271
 epoch: 20, train_loss: 0.8991, test_loss: 1.0026, test_f1: 0.5244
 epoch: 21, train_loss: 0.8963, test_loss: 1.0081, test_f1: 0.5305
 epoch: 22, train_loss: 0.8990, test_loss: 1.0279, test_f1: 0.5350
 epoch: 23, train_loss: 0.8948, test_loss: 1.0308, test_f1: 0.5309
 epoch: 24, train_loss: 0.8801, test_loss: 1.0225, test_f1: 0.5272
 epoch: 25, train_loss: 0.8715, test_loss: 0.9819, test_f1: 0.5247
 epoch: 26, train_loss: 0.8610, test_loss: 0.9986, test_f1: 0.5397
 epoch: 27, train_loss: 0.8588, test_loss: 1.0144, test_f1: 0.5305
 epoch: 28, train_loss: 0.8587, test_loss: 1.0135, test_f1: 0.5338
 epoch: 29, train_loss: 0.8378, test_loss: 1.0262, test_f1: 0.5444
 epoch: 30, train_loss: 0.8395, test_loss: 1.0360, test_f1: 0.5487
 epoch: 31, train_loss: 0.8390, test_loss: 1.0646, test_f1: 0.5455
 epoch: 32, train_loss: 0.8401, test_loss: 1.0416, test_f1: 0.5542
 epoch: 33, train_loss: 0.8322, test_loss: 1.0701, test_f1: 0.5540
 epoch: 34, train_loss: 0.8420, test_loss: 1.0320, test_f1: 0.5566
 epoch: 35, train_loss: 0.8251, test_loss: 1.0233, test_f1: 0.5597
 epoch: 36, train_loss: 0.8268, test_loss: 1.0362, test_f1: 0.5600
 epoch: 37, train_loss: 0.8228, test_loss: 1.0365, test_f1: 0.5665
 epoch: 38, train_loss: 0.8074, test_loss: 1.0189, test_f1: 0.5615
 epoch: 39, train_loss: 0.8022, test_loss: 1.0376, test_f1: 0.5526
 epoch: 40, train_loss: 0.8107, test_loss: 1.0464, test_f1: 0.5521
 epoch: 41, train_loss: 0.7951, test_loss: 1.0520, test_f1: 0.5672
 epoch: 42, train_loss: 0.8090, test_loss: 1.0261, test_f1: 0.5513
 epoch: 43, train_loss: 0.8004, test_loss: 1.0535, test_f1: 0.5378
 epoch: 44, train_loss: 0.7876, test_loss: 1.0453, test_f1: 0.5463
 epoch: 45, train_loss: 0.7814, test_loss: 1.0309, test_f1: 0.5555
 epoch: 46, train_loss: 0.7879, test_loss: 0.9804, test_f1: 0.5794
 epoch: 47, train_loss: 0.7859, test_loss: 0.9884, test_f1: 0.5749
 epoch: 48, train_loss: 0.7699, test_loss: 0.9995, test_f1: 0.5731
 epoch: 49, train_loss: 0.7710, test_loss: 1.0496, test_f1: 0.5762
 epoch: 50, train_loss: 0.7674, test_loss: 1.0240, test_f1: 0.5733
 epoch: 51, train_loss: 0.7526, test_loss: 1.0372, test_f1: 0.5774
 epoch: 52, train_loss: 0.7454, test_loss: 1.0468, test_f1: 0.5793
 epoch: 53, train_loss: 0.7445, test_loss: 1.0319, test_f1: 0.5829
 epoch: 54, train_loss: 0.7503, test_loss: 1.0482, test_f1: 0.5974
 epoch: 55, train_loss: 0.7512, test_loss: 1.0199, test_f1: 0.6024
 epoch: 56, train_loss: 0.7472, test_loss: 1.0064, test_f1: 0.5993
 epoch: 57, train_loss: 0.7386, test_loss: 1.0125, test_f1: 0.5900
 epoch: 58, train_loss: 0.7435, test_loss: 1.0235, test_f1: 0.5928
 epoch: 59, train_loss: 0.7260, test_loss: 1.0241, test_f1: 0.5924
 epoch: 60, train_loss: 0.7304, test_loss: 1.0718, test_f1: 0.5861
 epoch: 61, train_loss: 0.7385, test_loss: 1.0870, test_f1: 0.5818
 epoch: 62, train_loss: 0.7240, test_loss: 1.0525, test_f1: 0.5812
 epoch: 63, train_loss: 0.7352, test_loss: 1.0265, test_f1: 0.5688
 epoch: 64, train_loss: 0.7253, test_loss: 1.0379, test_f1: 0.5991
 epoch: 65, train_loss: 0.7191, test_loss: 1.0819, test_f1: 0.5697
 epoch: 66, train_loss: 0.7238, test_loss: 1.1202, test_f1: 0.5521
 epoch: 67, train_loss: 0.7236, test_loss: 1.0702, test_f1: 0.5839
 epoch: 68, train_loss: 0.7197, test_loss: 1.0642, test_f1: 0.5898
 epoch: 69, train_loss: 0.7102, test_loss: 1.0865, test_f1: 0.5857
 epoch: 70, train_loss: 0.7154, test_loss: 1.0668, test_f1: 0.5821
 epoch: 71, train_loss: 0.7129, test_loss: 1.0427, test_f1: 0.5961
 epoch: 72, train_loss: 0.7123, test_loss: 1.0643, test_f1: 0.6031
 epoch: 73, train_loss: 0.7070, test_loss: 1.0532, test_f1: 0.6074
 epoch: 74, train_loss: 0.7118, test_loss: 1.0690, test_f1: 0.6042
 epoch: 75, train_loss: 0.7013, test_loss: 1.0920, test_f1: 0.5934
 epoch: 76, train_loss: 0.7156, test_loss: 1.0755, test_f1: 0.5966
 epoch: 77, train_loss: 0.7083, test_loss: 1.0800, test_f1: 0.5764
 epoch: 78, train_loss: 0.7126, test_loss: 1.0843, test_f1: 0.5916
 epoch: 79, train_loss: 0.7100, test_loss: 1.0912, test_f1: 0.5831
 epoch: 80, train_loss: 0.6953, test_loss: 1.0906, test_f1: 0.5847
 epoch: 81, train_loss: 0.6858, test_loss: 1.0613, test_f1: 0.6096
 epoch: 82, train_loss: 0.6828, test_loss: 1.0605, test_f1: 0.5906
 epoch: 83, train_loss: 0.6901, test_loss: 1.0640, test_f1: 0.5892
 epoch: 84, train_loss: 0.6910, test_loss: 1.0558, test_f1: 0.5944
 epoch: 85, train_loss: 0.6825, test_loss: 1.0890, test_f1: 0.5775
 epoch: 86, train_loss: 0.6790, test_loss: 1.1136, test_f1: 0.5807
 epoch: 87, train_loss: 0.6779, test_loss: 1.1160, test_f1: 0.5869
 epoch: 88, train_loss: 0.6853, test_loss: 1.0976, test_f1: 0.5718
 epoch: 89, train_loss: 0.6798, test_loss: 1.0898, test_f1: 0.5636
 epoch: 90, train_loss: 0.6707, test_loss: 1.0958, test_f1: 0.5795
 epoch: 91, train_loss: 0.6666, test_loss: 1.1095, test_f1: 0.5690
 epoch: 92, train_loss: 0.6739, test_loss: 1.1194, test_f1: 0.5639
 epoch: 93, train_loss: 0.6703, test_loss: 1.1066, test_f1: 0.5894
 epoch: 94, train_loss: 0.6693, test_loss: 1.1278, test_f1: 0.5758
 epoch: 95, train_loss: 0.6606, test_loss: 1.1437, test_f1: 0.5761
 epoch: 96, train_loss: 0.6679, test_loss: 1.1235, test_f1: 0.5887
 epoch: 97, train_loss: 0.6673, test_loss: 1.1439, test_f1: 0.5920
 epoch: 98, train_loss: 0.6573, test_loss: 1.1964, test_f1: 0.5870
 epoch: 99, train_loss: 0.6660, test_loss: 1.1843, test_f1: 0.5784
##################ITERATION #6 ****************************************
 epoch: 0, train_loss: 1.2285, test_loss: 1.3539, test_f1: 0.2281
 epoch: 1, train_loss: 1.1414, test_loss: 1.3482, test_f1: 0.2281
 epoch: 2, train_loss: 1.1071, test_loss: 1.3619, test_f1: 0.2718
 epoch: 3, train_loss: 1.0872, test_loss: 1.3662, test_f1: 0.2281
 epoch: 4, train_loss: 1.0615, test_loss: 1.3334, test_f1: 0.2837
 epoch: 5, train_loss: 1.0515, test_loss: 1.2822, test_f1: 0.3501
 epoch: 6, train_loss: 1.0300, test_loss: 1.2521, test_f1: 0.4001
 epoch: 7, train_loss: 1.0333, test_loss: 1.2056, test_f1: 0.4380
 epoch: 8, train_loss: 1.0012, test_loss: 1.1581, test_f1: 0.4883
 epoch: 9, train_loss: 0.9967, test_loss: 1.1424, test_f1: 0.4588
 epoch: 10, train_loss: 0.9851, test_loss: 1.1232, test_f1: 0.4783
 epoch: 11, train_loss: 0.9661, test_loss: 1.1154, test_f1: 0.4802
 epoch: 12, train_loss: 0.9737, test_loss: 1.1113, test_f1: 0.4867
 epoch: 13, train_loss: 0.9564, test_loss: 1.0918, test_f1: 0.5045
 epoch: 14, train_loss: 0.9564, test_loss: 1.0543, test_f1: 0.5207
 epoch: 15, train_loss: 0.9471, test_loss: 1.0512, test_f1: 0.5357
 epoch: 16, train_loss: 0.9324, test_loss: 1.0667, test_f1: 0.5364
 epoch: 17, train_loss: 0.9260, test_loss: 1.0711, test_f1: 0.5439
 epoch: 18, train_loss: 0.9208, test_loss: 1.0547, test_f1: 0.5412
 epoch: 19, train_loss: 0.9054, test_loss: 1.0359, test_f1: 0.5499
 epoch: 20, train_loss: 0.9003, test_loss: 1.0550, test_f1: 0.5468
 epoch: 21, train_loss: 0.8920, test_loss: 1.0559, test_f1: 0.5464
 epoch: 22, train_loss: 0.8932, test_loss: 1.0431, test_f1: 0.5563
 epoch: 23, train_loss: 0.8832, test_loss: 1.0428, test_f1: 0.5612
 epoch: 24, train_loss: 0.8856, test_loss: 1.0426, test_f1: 0.5569
 epoch: 25, train_loss: 0.8729, test_loss: 1.0529, test_f1: 0.5430
 epoch: 26, train_loss: 0.8664, test_loss: 1.0635, test_f1: 0.5591
 epoch: 27, train_loss: 0.8641, test_loss: 1.0760, test_f1: 0.5469
 epoch: 28, train_loss: 0.8567, test_loss: 1.0813, test_f1: 0.5548
 epoch: 29, train_loss: 0.8484, test_loss: 1.0797, test_f1: 0.5532
 epoch: 30, train_loss: 0.8410, test_loss: 1.1052, test_f1: 0.5430
 epoch: 31, train_loss: 0.8392, test_loss: 1.0973, test_f1: 0.5576
 epoch: 32, train_loss: 0.8386, test_loss: 1.0805, test_f1: 0.5660
 epoch: 33, train_loss: 0.8435, test_loss: 1.0911, test_f1: 0.5596
 epoch: 34, train_loss: 0.8304, test_loss: 1.0804, test_f1: 0.5616
 epoch: 35, train_loss: 0.8171, test_loss: 1.0887, test_f1: 0.5532
 epoch: 36, train_loss: 0.8249, test_loss: 1.1040, test_f1: 0.5577
 epoch: 37, train_loss: 0.8183, test_loss: 1.0849, test_f1: 0.5493
 epoch: 38, train_loss: 0.8183, test_loss: 1.0938, test_f1: 0.5659
 epoch: 39, train_loss: 0.8066, test_loss: 1.1042, test_f1: 0.5747
 epoch: 40, train_loss: 0.8000, test_loss: 1.1101, test_f1: 0.5836
 epoch: 41, train_loss: 0.7949, test_loss: 1.0781, test_f1: 0.5891
 epoch: 42, train_loss: 0.8067, test_loss: 1.1033, test_f1: 0.5723
 epoch: 43, train_loss: 0.7871, test_loss: 1.1382, test_f1: 0.5666
 epoch: 44, train_loss: 0.8023, test_loss: 1.1323, test_f1: 0.5674
 epoch: 45, train_loss: 0.7893, test_loss: 1.1443, test_f1: 0.5500
 epoch: 46, train_loss: 0.7823, test_loss: 1.1738, test_f1: 0.5529
 epoch: 47, train_loss: 0.7745, test_loss: 1.1654, test_f1: 0.5570
 epoch: 48, train_loss: 0.7704, test_loss: 1.1516, test_f1: 0.5702
 epoch: 49, train_loss: 0.7540, test_loss: 1.1305, test_f1: 0.5956
 epoch: 50, train_loss: 0.7701, test_loss: 1.1675, test_f1: 0.5666
 epoch: 51, train_loss: 0.7572, test_loss: 1.1537, test_f1: 0.5589
 epoch: 52, train_loss: 0.7609, test_loss: 1.1290, test_f1: 0.5941
 epoch: 53, train_loss: 0.7622, test_loss: 1.1418, test_f1: 0.5921
 epoch: 54, train_loss: 0.7470, test_loss: 1.1699, test_f1: 0.6060
 epoch: 55, train_loss: 0.7510, test_loss: 1.1710, test_f1: 0.5914
 epoch: 56, train_loss: 0.7393, test_loss: 1.1484, test_f1: 0.5787
 epoch: 57, train_loss: 0.7389, test_loss: 1.1565, test_f1: 0.5834
 epoch: 58, train_loss: 0.7302, test_loss: 1.1608, test_f1: 0.5724
 epoch: 59, train_loss: 0.7220, test_loss: 1.1083, test_f1: 0.5646
 epoch: 60, train_loss: 0.7294, test_loss: 1.1190, test_f1: 0.5675
 epoch: 61, train_loss: 0.7219, test_loss: 1.1278, test_f1: 0.5787
 epoch: 62, train_loss: 0.7231, test_loss: 1.1353, test_f1: 0.5811
 epoch: 63, train_loss: 0.7184, test_loss: 1.1133, test_f1: 0.5838
 epoch: 64, train_loss: 0.7236, test_loss: 1.1052, test_f1: 0.5931
 epoch: 65, train_loss: 0.7099, test_loss: 1.1087, test_f1: 0.5920
 epoch: 66, train_loss: 0.7150, test_loss: 1.1614, test_f1: 0.5952
 epoch: 67, train_loss: 0.7144, test_loss: 1.1721, test_f1: 0.5853
 epoch: 68, train_loss: 0.7041, test_loss: 1.1718, test_f1: 0.5860
 epoch: 69, train_loss: 0.7033, test_loss: 1.1740, test_f1: 0.5872
 epoch: 70, train_loss: 0.7173, test_loss: 1.1656, test_f1: 0.5948
 epoch: 71, train_loss: 0.7086, test_loss: 1.1798, test_f1: 0.5785
 epoch: 72, train_loss: 0.7032, test_loss: 1.1774, test_f1: 0.5769
 epoch: 73, train_loss: 0.7098, test_loss: 1.2034, test_f1: 0.5972
 epoch: 74, train_loss: 0.6987, test_loss: 1.2052, test_f1: 0.5767
 epoch: 75, train_loss: 0.7065, test_loss: 1.1710, test_f1: 0.5788
 epoch: 76, train_loss: 0.7044, test_loss: 1.1590, test_f1: 0.5952
 epoch: 77, train_loss: 0.6908, test_loss: 1.1815, test_f1: 0.5890
 epoch: 78, train_loss: 0.6991, test_loss: 1.2111, test_f1: 0.5884
 epoch: 79, train_loss: 0.6836, test_loss: 1.1993, test_f1: 0.5745
 epoch: 80, train_loss: 0.6868, test_loss: 1.2640, test_f1: 0.5777
 epoch: 81, train_loss: 0.6817, test_loss: 1.2777, test_f1: 0.5656
 epoch: 82, train_loss: 0.6793, test_loss: 1.2288, test_f1: 0.5750
 epoch: 83, train_loss: 0.6905, test_loss: 1.1917, test_f1: 0.5904
 epoch: 84, train_loss: 0.6852, test_loss: 1.2086, test_f1: 0.5857
 epoch: 85, train_loss: 0.6820, test_loss: 1.2444, test_f1: 0.5850
 epoch: 86, train_loss: 0.6777, test_loss: 1.2176, test_f1: 0.5813
 epoch: 87, train_loss: 0.6679, test_loss: 1.2039, test_f1: 0.5943
 epoch: 88, train_loss: 0.6802, test_loss: 1.2156, test_f1: 0.5782
 epoch: 89, train_loss: 0.6709, test_loss: 1.2093, test_f1: 0.5866
 epoch: 90, train_loss: 0.6666, test_loss: 1.2477, test_f1: 0.5777
 epoch: 91, train_loss: 0.6729, test_loss: 1.2572, test_f1: 0.5916
 epoch: 92, train_loss: 0.6858, test_loss: 1.2302, test_f1: 0.5969
 epoch: 93, train_loss: 0.6830, test_loss: 1.2321, test_f1: 0.6009
 epoch: 94, train_loss: 0.6754, test_loss: 1.2150, test_f1: 0.5856
 epoch: 95, train_loss: 0.6712, test_loss: 1.2759, test_f1: 0.5845
 epoch: 96, train_loss: 0.6695, test_loss: 1.2754, test_f1: 0.5816
 epoch: 97, train_loss: 0.6595, test_loss: 1.2692, test_f1: 0.5755
 epoch: 98, train_loss: 0.6608, test_loss: 1.2511, test_f1: 0.5847
 epoch: 99, train_loss: 0.6661, test_loss: 1.2410, test_f1: 0.6012
##################ITERATION #7 ****************************************
 epoch: 0, train_loss: 1.2191, test_loss: 1.3762, test_f1: 0.2281
 epoch: 1, train_loss: 1.1276, test_loss: 1.4108, test_f1: 0.1054
 epoch: 2, train_loss: 1.1087, test_loss: 1.4450, test_f1: 0.0831
 epoch: 3, train_loss: 1.0787, test_loss: 1.4415, test_f1: 0.0936
 epoch: 4, train_loss: 1.0631, test_loss: 1.3881, test_f1: 0.1958
 epoch: 5, train_loss: 1.0435, test_loss: 1.3339, test_f1: 0.2689
 epoch: 6, train_loss: 1.0333, test_loss: 1.2933, test_f1: 0.3279
 epoch: 7, train_loss: 1.0259, test_loss: 1.2377, test_f1: 0.3778
 epoch: 8, train_loss: 1.0144, test_loss: 1.2011, test_f1: 0.3769
 epoch: 9, train_loss: 0.9862, test_loss: 1.1355, test_f1: 0.4417
 epoch: 10, train_loss: 0.9828, test_loss: 1.1248, test_f1: 0.4783
 epoch: 11, train_loss: 0.9776, test_loss: 1.1095, test_f1: 0.4966
 epoch: 12, train_loss: 0.9647, test_loss: 1.1025, test_f1: 0.4947
 epoch: 13, train_loss: 0.9534, test_loss: 1.0798, test_f1: 0.5037
 epoch: 14, train_loss: 0.9560, test_loss: 1.0788, test_f1: 0.5201
 epoch: 15, train_loss: 0.9457, test_loss: 1.0719, test_f1: 0.5368
 epoch: 16, train_loss: 0.9416, test_loss: 1.0583, test_f1: 0.5283
 epoch: 17, train_loss: 0.9284, test_loss: 1.0784, test_f1: 0.4862
 epoch: 18, train_loss: 0.9257, test_loss: 1.0716, test_f1: 0.4964
 epoch: 19, train_loss: 0.9269, test_loss: 1.0713, test_f1: 0.5133
 epoch: 20, train_loss: 0.9083, test_loss: 1.0631, test_f1: 0.5347
 epoch: 21, train_loss: 0.8965, test_loss: 1.0584, test_f1: 0.5465
 epoch: 22, train_loss: 0.8931, test_loss: 1.0643, test_f1: 0.5190
 epoch: 23, train_loss: 0.8922, test_loss: 1.0684, test_f1: 0.5179
 epoch: 24, train_loss: 0.8716, test_loss: 1.0747, test_f1: 0.5271
 epoch: 25, train_loss: 0.8806, test_loss: 1.0725, test_f1: 0.5529
 epoch: 26, train_loss: 0.8737, test_loss: 1.0409, test_f1: 0.5393
 epoch: 27, train_loss: 0.8564, test_loss: 1.0643, test_f1: 0.5453
 epoch: 28, train_loss: 0.8579, test_loss: 1.0649, test_f1: 0.5461
 epoch: 29, train_loss: 0.8522, test_loss: 1.0431, test_f1: 0.5531
 epoch: 30, train_loss: 0.8427, test_loss: 1.0412, test_f1: 0.5624
 epoch: 31, train_loss: 0.8391, test_loss: 1.0527, test_f1: 0.5520
 epoch: 32, train_loss: 0.8399, test_loss: 1.0724, test_f1: 0.5665
 epoch: 33, train_loss: 0.8313, test_loss: 1.0790, test_f1: 0.5541
 epoch: 34, train_loss: 0.8315, test_loss: 1.0598, test_f1: 0.5645
 epoch: 35, train_loss: 0.8267, test_loss: 1.0607, test_f1: 0.5649
 epoch: 36, train_loss: 0.8180, test_loss: 1.0630, test_f1: 0.5720
 epoch: 37, train_loss: 0.8142, test_loss: 1.0749, test_f1: 0.5668
 epoch: 38, train_loss: 0.8084, test_loss: 1.0806, test_f1: 0.5635
 epoch: 39, train_loss: 0.8000, test_loss: 1.0439, test_f1: 0.5655
 epoch: 40, train_loss: 0.7955, test_loss: 1.0595, test_f1: 0.5684
 epoch: 41, train_loss: 0.7941, test_loss: 1.0751, test_f1: 0.5869
 epoch: 42, train_loss: 0.7870, test_loss: 1.0606, test_f1: 0.5753
 epoch: 43, train_loss: 0.7795, test_loss: 1.0415, test_f1: 0.5730
 epoch: 44, train_loss: 0.7868, test_loss: 1.0910, test_f1: 0.5758
 epoch: 45, train_loss: 0.7695, test_loss: 1.1154, test_f1: 0.5836
 epoch: 46, train_loss: 0.7662, test_loss: 1.0707, test_f1: 0.5723
 epoch: 47, train_loss: 0.7770, test_loss: 1.0758, test_f1: 0.5600
 epoch: 48, train_loss: 0.7728, test_loss: 1.0767, test_f1: 0.5595
 epoch: 49, train_loss: 0.7695, test_loss: 1.1058, test_f1: 0.5656
 epoch: 50, train_loss: 0.7570, test_loss: 1.1304, test_f1: 0.5583
 epoch: 51, train_loss: 0.7514, test_loss: 1.1180, test_f1: 0.5468
 epoch: 52, train_loss: 0.7617, test_loss: 1.0990, test_f1: 0.5679
 epoch: 53, train_loss: 0.7318, test_loss: 1.0859, test_f1: 0.5645
 epoch: 54, train_loss: 0.7486, test_loss: 1.0665, test_f1: 0.5743
 epoch: 55, train_loss: 0.7431, test_loss: 1.0600, test_f1: 0.5671
 epoch: 56, train_loss: 0.7425, test_loss: 1.0570, test_f1: 0.5687
 epoch: 57, train_loss: 0.7351, test_loss: 1.0739, test_f1: 0.5795
 epoch: 58, train_loss: 0.7315, test_loss: 1.0768, test_f1: 0.5941
 epoch: 59, train_loss: 0.7258, test_loss: 1.0945, test_f1: 0.5774
 epoch: 60, train_loss: 0.7278, test_loss: 1.0821, test_f1: 0.5962
 epoch: 61, train_loss: 0.7220, test_loss: 1.0870, test_f1: 0.5865
 epoch: 62, train_loss: 0.7166, test_loss: 1.0912, test_f1: 0.5720
 epoch: 63, train_loss: 0.7174, test_loss: 1.0855, test_f1: 0.5643
 epoch: 64, train_loss: 0.7061, test_loss: 1.0948, test_f1: 0.5673
 epoch: 65, train_loss: 0.7096, test_loss: 1.1028, test_f1: 0.5656
 epoch: 66, train_loss: 0.7087, test_loss: 1.0969, test_f1: 0.5855
 epoch: 67, train_loss: 0.7131, test_loss: 1.1046, test_f1: 0.5807
 epoch: 68, train_loss: 0.7008, test_loss: 1.1365, test_f1: 0.5742
 epoch: 69, train_loss: 0.7080, test_loss: 1.1400, test_f1: 0.5776
 epoch: 70, train_loss: 0.7166, test_loss: 1.1252, test_f1: 0.5685
 epoch: 71, train_loss: 0.7079, test_loss: 1.0684, test_f1: 0.5794
 epoch: 72, train_loss: 0.7036, test_loss: 1.0780, test_f1: 0.5779
 epoch: 73, train_loss: 0.7110, test_loss: 1.1287, test_f1: 0.5891
 epoch: 74, train_loss: 0.7005, test_loss: 1.1200, test_f1: 0.5880
 epoch: 75, train_loss: 0.6965, test_loss: 1.0918, test_f1: 0.5700
 epoch: 76, train_loss: 0.6968, test_loss: 1.1309, test_f1: 0.5921
 epoch: 77, train_loss: 0.6898, test_loss: 1.1265, test_f1: 0.5794
 epoch: 78, train_loss: 0.6931, test_loss: 1.1465, test_f1: 0.5672
 epoch: 79, train_loss: 0.6853, test_loss: 1.1541, test_f1: 0.5663
 epoch: 80, train_loss: 0.6901, test_loss: 1.1366, test_f1: 0.5835
 epoch: 81, train_loss: 0.6833, test_loss: 1.1149, test_f1: 0.5818
 epoch: 82, train_loss: 0.6835, test_loss: 1.1090, test_f1: 0.5786
 epoch: 83, train_loss: 0.6979, test_loss: 1.1176, test_f1: 0.5977
 epoch: 84, train_loss: 0.6907, test_loss: 1.1311, test_f1: 0.6022
 epoch: 85, train_loss: 0.6919, test_loss: 1.1272, test_f1: 0.5939
 epoch: 86, train_loss: 0.6734, test_loss: 1.1556, test_f1: 0.5949
 epoch: 87, train_loss: 0.6834, test_loss: 1.1415, test_f1: 0.6185
 epoch: 88, train_loss: 0.6695, test_loss: 1.1528, test_f1: 0.5875
 epoch: 89, train_loss: 0.6816, test_loss: 1.1006, test_f1: 0.6076
 epoch: 90, train_loss: 0.6804, test_loss: 1.1026, test_f1: 0.6000
 epoch: 91, train_loss: 0.6909, test_loss: 1.0983, test_f1: 0.6049
 epoch: 92, train_loss: 0.6686, test_loss: 1.1348, test_f1: 0.5920
 epoch: 93, train_loss: 0.6765, test_loss: 1.1724, test_f1: 0.5849
 epoch: 94, train_loss: 0.6673, test_loss: 1.2228, test_f1: 0.5712
 epoch: 95, train_loss: 0.6703, test_loss: 1.2392, test_f1: 0.5697
 epoch: 96, train_loss: 0.6542, test_loss: 1.2261, test_f1: 0.5641
 epoch: 97, train_loss: 0.6709, test_loss: 1.1645, test_f1: 0.5578
 epoch: 98, train_loss: 0.6646, test_loss: 1.1547, test_f1: 0.5717
 epoch: 99, train_loss: 0.6692, test_loss: 1.1661, test_f1: 0.5797
##################ITERATION #8 ****************************************
 epoch: 0, train_loss: 1.2254, test_loss: 1.3395, test_f1: 0.2281
 epoch: 1, train_loss: 1.1406, test_loss: 1.3654, test_f1: 0.2281
 epoch: 2, train_loss: 1.1090, test_loss: 1.3975, test_f1: 0.1484
 epoch: 3, train_loss: 1.0868, test_loss: 1.4166, test_f1: 0.1047
 epoch: 4, train_loss: 1.0579, test_loss: 1.3614, test_f1: 0.1989
 epoch: 5, train_loss: 1.0462, test_loss: 1.2798, test_f1: 0.3275
 epoch: 6, train_loss: 1.0347, test_loss: 1.2286, test_f1: 0.3584
 epoch: 7, train_loss: 1.0146, test_loss: 1.1974, test_f1: 0.4151
 epoch: 8, train_loss: 1.0084, test_loss: 1.1816, test_f1: 0.4503
 epoch: 9, train_loss: 0.9967, test_loss: 1.1637, test_f1: 0.4722
 epoch: 10, train_loss: 0.9791, test_loss: 1.1558, test_f1: 0.4396
 epoch: 11, train_loss: 0.9698, test_loss: 1.1125, test_f1: 0.4776
 epoch: 12, train_loss: 0.9629, test_loss: 1.0975, test_f1: 0.4937
 epoch: 13, train_loss: 0.9682, test_loss: 1.0789, test_f1: 0.5297
 epoch: 14, train_loss: 0.9555, test_loss: 1.0630, test_f1: 0.5306
 epoch: 15, train_loss: 0.9451, test_loss: 1.0607, test_f1: 0.5398
 epoch: 16, train_loss: 0.9290, test_loss: 1.0592, test_f1: 0.5284
 epoch: 17, train_loss: 0.9334, test_loss: 1.0479, test_f1: 0.5421
 epoch: 18, train_loss: 0.9223, test_loss: 1.0443, test_f1: 0.5580
 epoch: 19, train_loss: 0.9114, test_loss: 1.0385, test_f1: 0.5602
 epoch: 20, train_loss: 0.9024, test_loss: 1.0393, test_f1: 0.5568
 epoch: 21, train_loss: 0.8932, test_loss: 1.0352, test_f1: 0.5517
 epoch: 22, train_loss: 0.8878, test_loss: 1.0265, test_f1: 0.5586
 epoch: 23, train_loss: 0.8863, test_loss: 1.0284, test_f1: 0.5737
 epoch: 24, train_loss: 0.8894, test_loss: 1.0246, test_f1: 0.5567
 epoch: 25, train_loss: 0.8682, test_loss: 1.0320, test_f1: 0.5585
 epoch: 26, train_loss: 0.8807, test_loss: 1.0294, test_f1: 0.5603
 epoch: 27, train_loss: 0.8549, test_loss: 1.0509, test_f1: 0.5600
 epoch: 28, train_loss: 0.8482, test_loss: 1.0305, test_f1: 0.5753
 epoch: 29, train_loss: 0.8561, test_loss: 1.0257, test_f1: 0.5781
 epoch: 30, train_loss: 0.8432, test_loss: 1.0326, test_f1: 0.5815
 epoch: 31, train_loss: 0.8353, test_loss: 1.0616, test_f1: 0.5845
 epoch: 32, train_loss: 0.8399, test_loss: 1.0512, test_f1: 0.5790
 epoch: 33, train_loss: 0.8361, test_loss: 1.0160, test_f1: 0.5893
 epoch: 34, train_loss: 0.8413, test_loss: 1.0006, test_f1: 0.5781
 epoch: 35, train_loss: 0.8399, test_loss: 1.0286, test_f1: 0.5706
 epoch: 36, train_loss: 0.8123, test_loss: 1.0493, test_f1: 0.5743
 epoch: 37, train_loss: 0.8105, test_loss: 1.0572, test_f1: 0.5965
 epoch: 38, train_loss: 0.8142, test_loss: 1.0620, test_f1: 0.5872
 epoch: 39, train_loss: 0.7965, test_loss: 1.0864, test_f1: 0.5933
 epoch: 40, train_loss: 0.8126, test_loss: 1.1059, test_f1: 0.5748
 epoch: 41, train_loss: 0.8005, test_loss: 1.0978, test_f1: 0.5850
 epoch: 42, train_loss: 0.7956, test_loss: 1.0751, test_f1: 0.5996
 epoch: 43, train_loss: 0.7979, test_loss: 1.0806, test_f1: 0.5792
 epoch: 44, train_loss: 0.7906, test_loss: 1.0561, test_f1: 0.5669
 epoch: 45, train_loss: 0.7881, test_loss: 1.0375, test_f1: 0.5869
 epoch: 46, train_loss: 0.7833, test_loss: 1.0740, test_f1: 0.5930
 epoch: 47, train_loss: 0.7755, test_loss: 1.0756, test_f1: 0.5961
 epoch: 48, train_loss: 0.7759, test_loss: 1.0642, test_f1: 0.5950
 epoch: 49, train_loss: 0.7880, test_loss: 1.0702, test_f1: 0.5842
 epoch: 50, train_loss: 0.7590, test_loss: 1.0316, test_f1: 0.5975
 epoch: 51, train_loss: 0.7585, test_loss: 1.0411, test_f1: 0.5819
 epoch: 52, train_loss: 0.7601, test_loss: 1.0885, test_f1: 0.5817
 epoch: 53, train_loss: 0.7432, test_loss: 1.0885, test_f1: 0.5805
 epoch: 54, train_loss: 0.7634, test_loss: 1.0944, test_f1: 0.5759
 epoch: 55, train_loss: 0.7524, test_loss: 1.0851, test_f1: 0.5987
 epoch: 56, train_loss: 0.7366, test_loss: 1.0858, test_f1: 0.5803
 epoch: 57, train_loss: 0.7472, test_loss: 1.0901, test_f1: 0.5775
 epoch: 58, train_loss: 0.7415, test_loss: 1.0869, test_f1: 0.5810
 epoch: 59, train_loss: 0.7239, test_loss: 1.1138, test_f1: 0.5810
 epoch: 60, train_loss: 0.7363, test_loss: 1.1386, test_f1: 0.5775
 epoch: 61, train_loss: 0.7219, test_loss: 1.1448, test_f1: 0.5779
 epoch: 62, train_loss: 0.7324, test_loss: 1.1402, test_f1: 0.5931
 epoch: 63, train_loss: 0.7382, test_loss: 1.1182, test_f1: 0.5874
 epoch: 64, train_loss: 0.7337, test_loss: 1.1363, test_f1: 0.6009
 epoch: 65, train_loss: 0.7211, test_loss: 1.1476, test_f1: 0.5837
 epoch: 66, train_loss: 0.7236, test_loss: 1.1263, test_f1: 0.5891
 epoch: 67, train_loss: 0.7131, test_loss: 1.1168, test_f1: 0.6035
 epoch: 68, train_loss: 0.7255, test_loss: 1.1543, test_f1: 0.6068
 epoch: 69, train_loss: 0.7292, test_loss: 1.1891, test_f1: 0.5824
 epoch: 70, train_loss: 0.7158, test_loss: 1.1752, test_f1: 0.5875
 epoch: 71, train_loss: 0.7186, test_loss: 1.1516, test_f1: 0.5977
 epoch: 72, train_loss: 0.7077, test_loss: 1.1225, test_f1: 0.5914
 epoch: 73, train_loss: 0.7121, test_loss: 1.1178, test_f1: 0.5884
 epoch: 74, train_loss: 0.7141, test_loss: 1.1738, test_f1: 0.5862
 epoch: 75, train_loss: 0.7012, test_loss: 1.1669, test_f1: 0.6103
 epoch: 76, train_loss: 0.6983, test_loss: 1.1906, test_f1: 0.5924
 epoch: 77, train_loss: 0.6996, test_loss: 1.1863, test_f1: 0.5979
 epoch: 78, train_loss: 0.6969, test_loss: 1.1984, test_f1: 0.5889
 epoch: 79, train_loss: 0.6982, test_loss: 1.1768, test_f1: 0.5782
 epoch: 80, train_loss: 0.6926, test_loss: 1.1978, test_f1: 0.5831
 epoch: 81, train_loss: 0.6971, test_loss: 1.1676, test_f1: 0.5932
 epoch: 82, train_loss: 0.6950, test_loss: 1.1663, test_f1: 0.5928
 epoch: 83, train_loss: 0.6882, test_loss: 1.1635, test_f1: 0.5881
 epoch: 84, train_loss: 0.6905, test_loss: 1.1773, test_f1: 0.5853
 epoch: 85, train_loss: 0.6970, test_loss: 1.1478, test_f1: 0.6150
 epoch: 86, train_loss: 0.6924, test_loss: 1.1859, test_f1: 0.5952
 epoch: 87, train_loss: 0.6814, test_loss: 1.1871, test_f1: 0.6039
 epoch: 88, train_loss: 0.6698, test_loss: 1.1836, test_f1: 0.5905
 epoch: 89, train_loss: 0.6838, test_loss: 1.1726, test_f1: 0.5851
 epoch: 90, train_loss: 0.6890, test_loss: 1.1811, test_f1: 0.5908
 epoch: 91, train_loss: 0.6713, test_loss: 1.1979, test_f1: 0.5912
 epoch: 92, train_loss: 0.6695, test_loss: 1.1973, test_f1: 0.5855
 epoch: 93, train_loss: 0.6610, test_loss: 1.1744, test_f1: 0.5884
 epoch: 94, train_loss: 0.6689, test_loss: 1.2056, test_f1: 0.5976
 epoch: 95, train_loss: 0.6622, test_loss: 1.2737, test_f1: 0.5726
 epoch: 96, train_loss: 0.6761, test_loss: 1.2986, test_f1: 0.5725
 epoch: 97, train_loss: 0.6808, test_loss: 1.2845, test_f1: 0.5782
 epoch: 98, train_loss: 0.6718, test_loss: 1.2147, test_f1: 0.5983
 epoch: 99, train_loss: 0.6679, test_loss: 1.1977, test_f1: 0.5877
##################ITERATION #9 ****************************************
 epoch: 0, train_loss: 1.2302, test_loss: 1.3233, test_f1: 0.2281
 epoch: 1, train_loss: 1.1354, test_loss: 1.3343, test_f1: 0.2281
 epoch: 2, train_loss: 1.1068, test_loss: 1.3283, test_f1: 0.2281
 epoch: 3, train_loss: 1.0838, test_loss: 1.3008, test_f1: 0.2281
 epoch: 4, train_loss: 1.0622, test_loss: 1.2742, test_f1: 0.3156
 epoch: 5, train_loss: 1.0486, test_loss: 1.2523, test_f1: 0.3540
 epoch: 6, train_loss: 1.0337, test_loss: 1.2174, test_f1: 0.4429
 epoch: 7, train_loss: 1.0248, test_loss: 1.1733, test_f1: 0.4435
 epoch: 8, train_loss: 1.0067, test_loss: 1.1471, test_f1: 0.4446
 epoch: 9, train_loss: 1.0070, test_loss: 1.1173, test_f1: 0.4491
 epoch: 10, train_loss: 0.9846, test_loss: 1.0863, test_f1: 0.5188
 epoch: 11, train_loss: 0.9871, test_loss: 1.0695, test_f1: 0.5317
 epoch: 12, train_loss: 0.9720, test_loss: 1.0695, test_f1: 0.5191
 epoch: 13, train_loss: 0.9688, test_loss: 1.0619, test_f1: 0.5349
 epoch: 14, train_loss: 0.9487, test_loss: 1.0514, test_f1: 0.5428
 epoch: 15, train_loss: 0.9549, test_loss: 1.0412, test_f1: 0.5543
 epoch: 16, train_loss: 0.9373, test_loss: 1.0393, test_f1: 0.5167
 epoch: 17, train_loss: 0.9235, test_loss: 1.0587, test_f1: 0.5291
 epoch: 18, train_loss: 0.9378, test_loss: 1.0493, test_f1: 0.5279
 epoch: 19, train_loss: 0.9118, test_loss: 1.0382, test_f1: 0.5299
 epoch: 20, train_loss: 0.9088, test_loss: 1.0372, test_f1: 0.5408
 epoch: 21, train_loss: 0.9011, test_loss: 1.0495, test_f1: 0.5419
 epoch: 22, train_loss: 0.8957, test_loss: 1.0431, test_f1: 0.5445
 epoch: 23, train_loss: 0.9147, test_loss: 1.0418, test_f1: 0.5387
 epoch: 24, train_loss: 0.8970, test_loss: 1.0424, test_f1: 0.5592
 epoch: 25, train_loss: 0.8939, test_loss: 1.0267, test_f1: 0.5350
 epoch: 26, train_loss: 0.8860, test_loss: 1.0086, test_f1: 0.5396
 epoch: 27, train_loss: 0.8829, test_loss: 0.9902, test_f1: 0.5552
 epoch: 28, train_loss: 0.8766, test_loss: 0.9957, test_f1: 0.5525
 epoch: 29, train_loss: 0.8690, test_loss: 1.0227, test_f1: 0.5432
 epoch: 30, train_loss: 0.8622, test_loss: 1.0169, test_f1: 0.5436
 epoch: 31, train_loss: 0.8665, test_loss: 1.0023, test_f1: 0.5380
 epoch: 32, train_loss: 0.8568, test_loss: 1.0321, test_f1: 0.5402
 epoch: 33, train_loss: 0.8425, test_loss: 1.0367, test_f1: 0.5616
 epoch: 34, train_loss: 0.8441, test_loss: 1.0355, test_f1: 0.5651
 epoch: 35, train_loss: 0.8561, test_loss: 0.9987, test_f1: 0.5786
 epoch: 36, train_loss: 0.8457, test_loss: 1.0055, test_f1: 0.5555
 epoch: 37, train_loss: 0.8427, test_loss: 0.9892, test_f1: 0.5391
 epoch: 38, train_loss: 0.8367, test_loss: 1.0054, test_f1: 0.5486
 epoch: 39, train_loss: 0.8309, test_loss: 0.9996, test_f1: 0.5667
 epoch: 40, train_loss: 0.8167, test_loss: 0.9912, test_f1: 0.5700
 epoch: 41, train_loss: 0.8000, test_loss: 0.9823, test_f1: 0.5747
 epoch: 42, train_loss: 0.8081, test_loss: 0.9828, test_f1: 0.5800
 epoch: 43, train_loss: 0.7994, test_loss: 0.9891, test_f1: 0.5773
 epoch: 44, train_loss: 0.7985, test_loss: 0.9699, test_f1: 0.5733
 epoch: 45, train_loss: 0.8053, test_loss: 0.9778, test_f1: 0.5704
 epoch: 46, train_loss: 0.7999, test_loss: 0.9834, test_f1: 0.5780
 epoch: 47, train_loss: 0.8002, test_loss: 0.9938, test_f1: 0.5718
 epoch: 48, train_loss: 0.7854, test_loss: 0.9804, test_f1: 0.5611
 epoch: 49, train_loss: 0.7973, test_loss: 1.0170, test_f1: 0.5537
 epoch: 50, train_loss: 0.7955, test_loss: 1.0436, test_f1: 0.5561
 epoch: 51, train_loss: 0.7933, test_loss: 1.0106, test_f1: 0.5794
 epoch: 52, train_loss: 0.7917, test_loss: 0.9896, test_f1: 0.5743
 epoch: 53, train_loss: 0.7853, test_loss: 0.9923, test_f1: 0.5851
 epoch: 54, train_loss: 0.7752, test_loss: 0.9956, test_f1: 0.5808
 epoch: 55, train_loss: 0.7654, test_loss: 1.0041, test_f1: 0.5867
 epoch: 56, train_loss: 0.7708, test_loss: 0.9991, test_f1: 0.5754
 epoch: 57, train_loss: 0.7583, test_loss: 1.0052, test_f1: 0.5652
 epoch: 58, train_loss: 0.7712, test_loss: 0.9915, test_f1: 0.5727
 epoch: 59, train_loss: 0.7574, test_loss: 0.9991, test_f1: 0.5801
 epoch: 60, train_loss: 0.7547, test_loss: 1.0034, test_f1: 0.5692
 epoch: 61, train_loss: 0.7652, test_loss: 1.0001, test_f1: 0.5913
 epoch: 62, train_loss: 0.7556, test_loss: 0.9820, test_f1: 0.5753
 epoch: 63, train_loss: 0.7532, test_loss: 0.9732, test_f1: 0.5792
 epoch: 64, train_loss: 0.7519, test_loss: 0.9772, test_f1: 0.5813
 epoch: 65, train_loss: 0.7460, test_loss: 0.9708, test_f1: 0.5835
 epoch: 66, train_loss: 0.7380, test_loss: 0.9783, test_f1: 0.5779
 epoch: 67, train_loss: 0.7414, test_loss: 0.9692, test_f1: 0.5782
 epoch: 68, train_loss: 0.7413, test_loss: 0.9566, test_f1: 0.5734
 epoch: 69, train_loss: 0.7378, test_loss: 0.9574, test_f1: 0.5741
 epoch: 70, train_loss: 0.7374, test_loss: 0.9590, test_f1: 0.5883
 epoch: 71, train_loss: 0.7392, test_loss: 0.9772, test_f1: 0.5815
 epoch: 72, train_loss: 0.7275, test_loss: 0.9903, test_f1: 0.5846
 epoch: 73, train_loss: 0.7290, test_loss: 0.9773, test_f1: 0.5701
 epoch: 74, train_loss: 0.7389, test_loss: 0.9678, test_f1: 0.5833
 epoch: 75, train_loss: 0.7277, test_loss: 0.9767, test_f1: 0.5851
 epoch: 76, train_loss: 0.7388, test_loss: 1.0084, test_f1: 0.5879
 epoch: 77, train_loss: 0.7306, test_loss: 0.9803, test_f1: 0.5968
 epoch: 78, train_loss: 0.7200, test_loss: 0.9708, test_f1: 0.5877
 epoch: 79, train_loss: 0.7273, test_loss: 0.9747, test_f1: 0.5938
 epoch: 80, train_loss: 0.7286, test_loss: 0.9962, test_f1: 0.5883
 epoch: 81, train_loss: 0.7296, test_loss: 0.9852, test_f1: 0.5847
 epoch: 82, train_loss: 0.7227, test_loss: 0.9672, test_f1: 0.5930
 epoch: 83, train_loss: 0.7265, test_loss: 0.9625, test_f1: 0.6046
 epoch: 84, train_loss: 0.7287, test_loss: 0.9814, test_f1: 0.5885
 epoch: 85, train_loss: 0.7152, test_loss: 0.9731, test_f1: 0.5909
 epoch: 86, train_loss: 0.7212, test_loss: 0.9754, test_f1: 0.5946
 epoch: 87, train_loss: 0.7098, test_loss: 0.9883, test_f1: 0.6020
 epoch: 88, train_loss: 0.7076, test_loss: 1.0061, test_f1: 0.5909
 epoch: 89, train_loss: 0.7111, test_loss: 0.9982, test_f1: 0.5991
 epoch: 90, train_loss: 0.7052, test_loss: 0.9684, test_f1: 0.5813
 epoch: 91, train_loss: 0.6874, test_loss: 0.9720, test_f1: 0.5839
 epoch: 92, train_loss: 0.6990, test_loss: 0.9773, test_f1: 0.5973
 epoch: 93, train_loss: 0.7029, test_loss: 0.9929, test_f1: 0.6014
 epoch: 94, train_loss: 0.6974, test_loss: 1.0212, test_f1: 0.5981
 epoch: 95, train_loss: 0.6943, test_loss: 1.0150, test_f1: 0.6076
 epoch: 96, train_loss: 0.6912, test_loss: 0.9923, test_f1: 0.6011
 epoch: 97, train_loss: 0.7020, test_loss: 0.9689, test_f1: 0.6041
 epoch: 98, train_loss: 0.6969, test_loss: 0.9832, test_f1: 0.6070
 epoch: 99, train_loss: 0.6868, test_loss: 1.0007, test_f1: 0.5959

Training completed in 327.75 seconds
Best F1: 0.6185 at epoch 87
Mean F1 across iterations: 0.6005  0.0118
========================FINAL RESULTS================================
FEGIN weighted F1: 0.6185  0.0118
python main.py --data ltspice_demos --representation component_net --model FEGIN --layers 6 --hiddens 128 --batch_size 256 --lr 0.0001 --emb_size 512 --epochs 100 --save_appendix component_net_L6_H128_BS256_LR0.0001_E512 --no_val
-----



STDERR:
  File "main.py", line 370, in <module>
    main()
  File "main.py", line 254, in main
    dataset = dataset_class(
  File "/home/philip/projects/ltspice_examples_code_repo/Circuit-Completion-Using-GNNs/component_classification_with_link_prediction_head/evaluation/FEGIN/kernel/circuit_datasets.py", line 15, in __init__
    self.data, self.slices = torch.load(self.processed_paths[0])
  File "/home/philip/.local/lib/python3.8/site-packages/torch/serialization.py", line 1040, in load
    warnings.warn(
  File "/usr/lib/python3.8/warnings.py", line 109, in _showwarnmsg
    sw(msg.message, msg.category, msg.filename, msg.lineno,
  File "main.py", line 47, in warn_with_traceback
    traceback.print_stack(file=log)
/home/philip/projects/ltspice_examples_code_repo/Circuit-Completion-Using-GNNs/component_classification_with_link_prediction_head/evaluation/FEGIN/kernel/circuit_datasets.py:15: FutureWarning: You are using `torch.load` with `weights_only=False` (the current default value), which uses the default pickle module implicitly. It is possible to construct malicious pickle data which will execute arbitrary code during unpickling (See https://github.com/pytorch/pytorch/blob/main/SECURITY.md#untrusted-models for more details). In a future release, the default value for `weights_only` will be flipped to `True`. This limits the functions that could be executed during unpickling. Arbitrary objects will no longer be allowed to be loaded via this mode unless they are explicitly allowlisted by the user via `torch.serialization.add_safe_globals`. We recommend you start setting `weights_only=True` for any use case where you don't have full control of the loaded file. Please open an issue on GitHub for any issues related to this experimental feature.
  self.data, self.slices = torch.load(self.processed_paths[0])
