STDOUT:
Results will be saved in /home/philip/projects/ltspice_examples_code_repo/Circuit-Completion-Using-GNNs/component_classification_with_link_prediction_head/evaluation/FEGIN/results/model_FEGIN_dataset_ltspice_examples
Command line input: python main.py --data ltspice_examples --representation component_component --model FEGIN --layers 5 --hiddens 128 --batch_size 256 --lr 0.001 --emb_size 512 --epochs 100 --save_appendix component_component_L5_H128_BS256_LR0.001_E512 --no_val
 is saved.
-----
ltspice_examples - FEGIN
Using 5 layers, 128 hidden units, h = 2
Loading component_component representation dataset
ENTERED
Training FEGIN on component_component representation
Train: 3556, Test: 845
##################ITERATION #0 ****************************************
 epoch: 0, train_loss: 1.3150, test_loss: 1.2850, test_f1: 0.2274
 epoch: 1, train_loss: 1.1999, test_loss: 1.2053, test_f1: 0.3326
 epoch: 2, train_loss: 1.1434, test_loss: 1.1529, test_f1: 0.3354
 epoch: 3, train_loss: 1.0901, test_loss: 1.1033, test_f1: 0.4244
 epoch: 4, train_loss: 1.0402, test_loss: 1.0367, test_f1: 0.4626
 epoch: 5, train_loss: 1.0013, test_loss: 0.9916, test_f1: 0.5142
 epoch: 6, train_loss: 0.9556, test_loss: 1.0319, test_f1: 0.4858
 epoch: 7, train_loss: 0.9186, test_loss: 1.0431, test_f1: 0.5006
 epoch: 8, train_loss: 0.9141, test_loss: 1.0127, test_f1: 0.4833
 epoch: 9, train_loss: 0.8750, test_loss: 1.0628, test_f1: 0.4868
 epoch: 10, train_loss: 0.8387, test_loss: 1.0759, test_f1: 0.4936
 epoch: 11, train_loss: 0.8260, test_loss: 1.2019, test_f1: 0.4896
 epoch: 12, train_loss: 0.8021, test_loss: 1.1219, test_f1: 0.4948
 epoch: 13, train_loss: 0.8037, test_loss: 1.0878, test_f1: 0.5002
 epoch: 14, train_loss: 0.7758, test_loss: 1.1109, test_f1: 0.4986
 epoch: 15, train_loss: 0.7412, test_loss: 1.0968, test_f1: 0.5151
 epoch: 16, train_loss: 0.7278, test_loss: 1.2842, test_f1: 0.5094
 epoch: 17, train_loss: 0.7141, test_loss: 1.4284, test_f1: 0.4944
 epoch: 18, train_loss: 0.7092, test_loss: 1.2870, test_f1: 0.5211
 epoch: 19, train_loss: 0.6795, test_loss: 1.2479, test_f1: 0.5302
 epoch: 20, train_loss: 0.6640, test_loss: 1.5596, test_f1: 0.4889
 epoch: 21, train_loss: 0.6480, test_loss: 1.3807, test_f1: 0.5195
 epoch: 22, train_loss: 0.6352, test_loss: 1.5186, test_f1: 0.5318
 epoch: 23, train_loss: 0.5988, test_loss: 1.5496, test_f1: 0.5067
 epoch: 24, train_loss: 0.6116, test_loss: 1.6793, test_f1: 0.5179
 epoch: 25, train_loss: 0.6315, test_loss: 1.7046, test_f1: 0.5077
 epoch: 26, train_loss: 0.6095, test_loss: 1.3851, test_f1: 0.5393
 epoch: 27, train_loss: 0.5984, test_loss: 1.5681, test_f1: 0.5069
 epoch: 28, train_loss: 0.5887, test_loss: 1.6927, test_f1: 0.5185
 epoch: 29, train_loss: 0.5619, test_loss: 1.5422, test_f1: 0.5526
 epoch: 30, train_loss: 0.5338, test_loss: 1.6179, test_f1: 0.5287
 epoch: 31, train_loss: 0.5422, test_loss: 1.8686, test_f1: 0.4850
 epoch: 32, train_loss: 0.5489, test_loss: 1.9951, test_f1: 0.5010
 epoch: 33, train_loss: 0.5433, test_loss: 1.7503, test_f1: 0.5172
 epoch: 34, train_loss: 0.5274, test_loss: 1.8698, test_f1: 0.5035
 epoch: 35, train_loss: 0.4680, test_loss: 1.8243, test_f1: 0.4999
 epoch: 36, train_loss: 0.4838, test_loss: 1.8172, test_f1: 0.5034
 epoch: 37, train_loss: 0.4678, test_loss: 1.5765, test_f1: 0.5383
 epoch: 38, train_loss: 0.4788, test_loss: 2.1458, test_f1: 0.4798
 epoch: 39, train_loss: 0.4492, test_loss: 1.7540, test_f1: 0.5214
 epoch: 40, train_loss: 0.4605, test_loss: 1.9321, test_f1: 0.5097
 epoch: 41, train_loss: 0.4404, test_loss: 1.8978, test_f1: 0.4702
 epoch: 42, train_loss: 0.4249, test_loss: 2.0572, test_f1: 0.5376
 epoch: 43, train_loss: 0.4301, test_loss: 1.7940, test_f1: 0.5242
 epoch: 44, train_loss: 0.4482, test_loss: 2.1782, test_f1: 0.4999
 epoch: 45, train_loss: 0.4281, test_loss: 1.8063, test_f1: 0.5129
 epoch: 46, train_loss: 0.4224, test_loss: 1.9785, test_f1: 0.5042
 epoch: 47, train_loss: 0.4254, test_loss: 2.1598, test_f1: 0.4874
 epoch: 48, train_loss: 0.4076, test_loss: 2.0046, test_f1: 0.5360
 epoch: 49, train_loss: 0.3956, test_loss: 2.0697, test_f1: 0.5071
 epoch: 50, train_loss: 0.3758, test_loss: 2.1460, test_f1: 0.5243
 epoch: 51, train_loss: 0.3411, test_loss: 2.2937, test_f1: 0.5019
 epoch: 52, train_loss: 0.3127, test_loss: 2.2822, test_f1: 0.5186
 epoch: 53, train_loss: 0.2991, test_loss: 2.3359, test_f1: 0.5376
 epoch: 54, train_loss: 0.2926, test_loss: 2.5901, test_f1: 0.5352
 epoch: 55, train_loss: 0.2641, test_loss: 2.4789, test_f1: 0.5160
 epoch: 56, train_loss: 0.2606, test_loss: 2.6943, test_f1: 0.5074
 epoch: 57, train_loss: 0.2577, test_loss: 2.6080, test_f1: 0.5246
 epoch: 58, train_loss: 0.2518, test_loss: 2.6351, test_f1: 0.5191
 epoch: 59, train_loss: 0.2506, test_loss: 2.9536, test_f1: 0.5120
 epoch: 60, train_loss: 0.2584, test_loss: 2.8155, test_f1: 0.5112
 epoch: 61, train_loss: 0.2523, test_loss: 2.8227, test_f1: 0.5039
 epoch: 62, train_loss: 0.2512, test_loss: 2.9418, test_f1: 0.5226
 epoch: 63, train_loss: 0.2254, test_loss: 2.8798, test_f1: 0.4963
 epoch: 64, train_loss: 0.2302, test_loss: 2.8463, test_f1: 0.4960
 epoch: 65, train_loss: 0.2241, test_loss: 2.8880, test_f1: 0.5123
 epoch: 66, train_loss: 0.2356, test_loss: 2.9209, test_f1: 0.5103
 epoch: 67, train_loss: 0.2590, test_loss: 3.1901, test_f1: 0.5114
 epoch: 68, train_loss: 0.2481, test_loss: 2.9670, test_f1: 0.5095
 epoch: 69, train_loss: 0.2353, test_loss: 2.7472, test_f1: 0.5255
 epoch: 70, train_loss: 0.2266, test_loss: 3.1213, test_f1: 0.5308
 epoch: 71, train_loss: 0.2253, test_loss: 3.0349, test_f1: 0.4738
 epoch: 72, train_loss: 0.2274, test_loss: 2.8634, test_f1: 0.5150
 epoch: 73, train_loss: 0.2246, test_loss: 3.0743, test_f1: 0.5160
 epoch: 74, train_loss: 0.2078, test_loss: 2.9293, test_f1: 0.5199
 epoch: 75, train_loss: 0.2095, test_loss: 3.1651, test_f1: 0.5146
 epoch: 76, train_loss: 0.2226, test_loss: 3.3910, test_f1: 0.4945
 epoch: 77, train_loss: 0.2261, test_loss: 3.2703, test_f1: 0.5205
 epoch: 78, train_loss: 0.2119, test_loss: 3.5147, test_f1: 0.4988
 epoch: 79, train_loss: 0.2056, test_loss: 3.2714, test_f1: 0.5087
 epoch: 80, train_loss: 0.2025, test_loss: 3.3644, test_f1: 0.5078
 epoch: 81, train_loss: 0.2036, test_loss: 3.1855, test_f1: 0.5197
 epoch: 82, train_loss: 0.1999, test_loss: 3.4133, test_f1: 0.5178
 epoch: 83, train_loss: 0.1981, test_loss: 3.1054, test_f1: 0.5124
 epoch: 84, train_loss: 0.2015, test_loss: 3.2740, test_f1: 0.5153
 epoch: 85, train_loss: 0.2070, test_loss: 3.7440, test_f1: 0.5076
 epoch: 86, train_loss: 0.1959, test_loss: 3.2449, test_f1: 0.5147
 epoch: 87, train_loss: 0.1852, test_loss: 3.3289, test_f1: 0.5213
 epoch: 88, train_loss: 0.1947, test_loss: 3.0930, test_f1: 0.5184
 epoch: 89, train_loss: 0.1955, test_loss: 3.3815, test_f1: 0.5132
 epoch: 90, train_loss: 0.1609, test_loss: 3.3179, test_f1: 0.5176
 epoch: 91, train_loss: 0.1744, test_loss: 3.4318, test_f1: 0.5147
 epoch: 92, train_loss: 0.1738, test_loss: 3.9184, test_f1: 0.4901
 epoch: 93, train_loss: 0.1540, test_loss: 3.5430, test_f1: 0.5110
 epoch: 94, train_loss: 0.1556, test_loss: 3.4107, test_f1: 0.5168
 epoch: 95, train_loss: 0.1785, test_loss: 3.7369, test_f1: 0.5183
 epoch: 96, train_loss: 0.1644, test_loss: 3.5977, test_f1: 0.5140
 epoch: 97, train_loss: 0.1680, test_loss: 3.4873, test_f1: 0.5233
 epoch: 98, train_loss: 0.1596, test_loss: 3.6224, test_f1: 0.5175
 epoch: 99, train_loss: 0.1511, test_loss: 3.7102, test_f1: 0.5090
##################ITERATION #1 ****************************************
 epoch: 0, train_loss: 1.2408, test_loss: 1.2561, test_f1: 0.2274
 epoch: 1, train_loss: 1.1228, test_loss: 1.1631, test_f1: 0.4001
 epoch: 2, train_loss: 1.0589, test_loss: 1.0923, test_f1: 0.4580
 epoch: 3, train_loss: 1.0155, test_loss: 1.0472, test_f1: 0.4506
 epoch: 4, train_loss: 0.9799, test_loss: 1.0189, test_f1: 0.4909
 epoch: 5, train_loss: 0.9484, test_loss: 0.9818, test_f1: 0.5228
 epoch: 6, train_loss: 0.8962, test_loss: 0.9945, test_f1: 0.5043
 epoch: 7, train_loss: 0.8613, test_loss: 1.1013, test_f1: 0.5121
 epoch: 8, train_loss: 0.8517, test_loss: 1.0350, test_f1: 0.5317
 epoch: 9, train_loss: 0.8253, test_loss: 1.0699, test_f1: 0.4913
 epoch: 10, train_loss: 0.8103, test_loss: 1.3785, test_f1: 0.4753
 epoch: 11, train_loss: 0.7918, test_loss: 1.1195, test_f1: 0.5236
 epoch: 12, train_loss: 0.7655, test_loss: 1.2761, test_f1: 0.5162
 epoch: 13, train_loss: 0.7639, test_loss: 1.3164, test_f1: 0.4822
 epoch: 14, train_loss: 0.7611, test_loss: 1.1460, test_f1: 0.5086
 epoch: 15, train_loss: 0.7131, test_loss: 1.2681, test_f1: 0.5103
 epoch: 16, train_loss: 0.7139, test_loss: 1.2291, test_f1: 0.5226
 epoch: 17, train_loss: 0.6957, test_loss: 1.3011, test_f1: 0.5183
 epoch: 18, train_loss: 0.6776, test_loss: 1.2816, test_f1: 0.5127
 epoch: 19, train_loss: 0.6616, test_loss: 1.4859, test_f1: 0.5245
 epoch: 20, train_loss: 0.6811, test_loss: 1.1675, test_f1: 0.5290
 epoch: 21, train_loss: 0.6310, test_loss: 1.3262, test_f1: 0.5309
 epoch: 22, train_loss: 0.6062, test_loss: 1.3947, test_f1: 0.5324
 epoch: 23, train_loss: 0.6205, test_loss: 1.4112, test_f1: 0.5179
 epoch: 24, train_loss: 0.6029, test_loss: 1.4109, test_f1: 0.5585
 epoch: 25, train_loss: 0.5735, test_loss: 1.3876, test_f1: 0.5402
 epoch: 26, train_loss: 0.5674, test_loss: 1.3927, test_f1: 0.5478
 epoch: 27, train_loss: 0.5483, test_loss: 1.3680, test_f1: 0.5502
 epoch: 28, train_loss: 0.5727, test_loss: 1.4626, test_f1: 0.5176
 epoch: 29, train_loss: 0.5319, test_loss: 1.4569, test_f1: 0.5449
 epoch: 30, train_loss: 0.5326, test_loss: 1.4448, test_f1: 0.5302
 epoch: 31, train_loss: 0.4960, test_loss: 1.7075, test_f1: 0.5419
 epoch: 32, train_loss: 0.5051, test_loss: 1.5878, test_f1: 0.5213
 epoch: 33, train_loss: 0.5091, test_loss: 1.8896, test_f1: 0.5403
 epoch: 34, train_loss: 0.4886, test_loss: 1.6371, test_f1: 0.5330
 epoch: 35, train_loss: 0.4787, test_loss: 1.4592, test_f1: 0.5179
 epoch: 36, train_loss: 0.4850, test_loss: 1.8031, test_f1: 0.5220
 epoch: 37, train_loss: 0.4566, test_loss: 1.6844, test_f1: 0.5212
 epoch: 38, train_loss: 0.4790, test_loss: 1.8708, test_f1: 0.5099
 epoch: 39, train_loss: 0.4660, test_loss: 1.9585, test_f1: 0.5245
 epoch: 40, train_loss: 0.4846, test_loss: 1.7925, test_f1: 0.4917
 epoch: 41, train_loss: 0.4465, test_loss: 2.0396, test_f1: 0.5319
 epoch: 42, train_loss: 0.4572, test_loss: 1.9086, test_f1: 0.5088
 epoch: 43, train_loss: 0.4318, test_loss: 1.6917, test_f1: 0.5461
 epoch: 44, train_loss: 0.4066, test_loss: 1.7173, test_f1: 0.5445
 epoch: 45, train_loss: 0.3950, test_loss: 1.8683, test_f1: 0.5132
 epoch: 46, train_loss: 0.3858, test_loss: 2.1447, test_f1: 0.5194
 epoch: 47, train_loss: 0.3933, test_loss: 1.8372, test_f1: 0.5345
 epoch: 48, train_loss: 0.3883, test_loss: 2.1985, test_f1: 0.5346
 epoch: 49, train_loss: 0.3850, test_loss: 1.9495, test_f1: 0.5344
 epoch: 50, train_loss: 0.3546, test_loss: 2.0859, test_f1: 0.5463
 epoch: 51, train_loss: 0.3230, test_loss: 2.1207, test_f1: 0.5516
 epoch: 52, train_loss: 0.3004, test_loss: 2.2061, test_f1: 0.5511
 epoch: 53, train_loss: 0.2851, test_loss: 2.1732, test_f1: 0.5279
 epoch: 54, train_loss: 0.2659, test_loss: 2.2907, test_f1: 0.5643
 epoch: 55, train_loss: 0.2654, test_loss: 2.3971, test_f1: 0.5494
 epoch: 56, train_loss: 0.2507, test_loss: 2.4614, test_f1: 0.5486
 epoch: 57, train_loss: 0.2584, test_loss: 2.4906, test_f1: 0.5559
 epoch: 58, train_loss: 0.2311, test_loss: 2.5758, test_f1: 0.5333
 epoch: 59, train_loss: 0.2433, test_loss: 2.5565, test_f1: 0.5455
 epoch: 60, train_loss: 0.2538, test_loss: 2.4705, test_f1: 0.5234
 epoch: 61, train_loss: 0.2189, test_loss: 2.6282, test_f1: 0.5408
 epoch: 62, train_loss: 0.2384, test_loss: 2.7384, test_f1: 0.5560
 epoch: 63, train_loss: 0.2388, test_loss: 2.8116, test_f1: 0.5451
 epoch: 64, train_loss: 0.2342, test_loss: 2.7838, test_f1: 0.5547
 epoch: 65, train_loss: 0.2224, test_loss: 2.6913, test_f1: 0.5268
 epoch: 66, train_loss: 0.2174, test_loss: 2.9403, test_f1: 0.5203
 epoch: 67, train_loss: 0.2141, test_loss: 2.6757, test_f1: 0.5333
 epoch: 68, train_loss: 0.2316, test_loss: 2.9910, test_f1: 0.4976
 epoch: 69, train_loss: 0.2225, test_loss: 2.6057, test_f1: 0.5208
 epoch: 70, train_loss: 0.2404, test_loss: 2.6641, test_f1: 0.5475
 epoch: 71, train_loss: 0.2360, test_loss: 2.8548, test_f1: 0.5227
 epoch: 72, train_loss: 0.2253, test_loss: 2.6267, test_f1: 0.5361
 epoch: 73, train_loss: 0.2324, test_loss: 2.8031, test_f1: 0.5181
 epoch: 74, train_loss: 0.2157, test_loss: 2.8342, test_f1: 0.5397
 epoch: 75, train_loss: 0.2228, test_loss: 2.8472, test_f1: 0.5316
 epoch: 76, train_loss: 0.2223, test_loss: 2.9047, test_f1: 0.5321
 epoch: 77, train_loss: 0.2167, test_loss: 2.9862, test_f1: 0.5069
 epoch: 78, train_loss: 0.1793, test_loss: 2.9670, test_f1: 0.5328
 epoch: 79, train_loss: 0.1748, test_loss: 3.1167, test_f1: 0.5454
 epoch: 80, train_loss: 0.1894, test_loss: 3.0747, test_f1: 0.5311
 epoch: 81, train_loss: 0.2023, test_loss: 2.8625, test_f1: 0.5554
 epoch: 82, train_loss: 0.1930, test_loss: 3.0514, test_f1: 0.5183
 epoch: 83, train_loss: 0.1904, test_loss: 3.0875, test_f1: 0.5211
 epoch: 84, train_loss: 0.1904, test_loss: 3.0929, test_f1: 0.5256
 epoch: 85, train_loss: 0.1795, test_loss: 3.0260, test_f1: 0.5193
 epoch: 86, train_loss: 0.1721, test_loss: 3.5408, test_f1: 0.5236
 epoch: 87, train_loss: 0.1775, test_loss: 3.2104, test_f1: 0.5221
 epoch: 88, train_loss: 0.1800, test_loss: 3.2870, test_f1: 0.5104
 epoch: 89, train_loss: 0.1717, test_loss: 3.2265, test_f1: 0.5491
 epoch: 90, train_loss: 0.1789, test_loss: 3.1930, test_f1: 0.5592
 epoch: 91, train_loss: 0.1708, test_loss: 3.2078, test_f1: 0.5509
 epoch: 92, train_loss: 0.1718, test_loss: 3.1350, test_f1: 0.5378
 epoch: 93, train_loss: 0.1940, test_loss: 3.5171, test_f1: 0.5050
 epoch: 94, train_loss: 0.1766, test_loss: 3.3854, test_f1: 0.5190
 epoch: 95, train_loss: 0.1698, test_loss: 3.2030, test_f1: 0.5251
 epoch: 96, train_loss: 0.1673, test_loss: 3.5468, test_f1: 0.5317
 epoch: 97, train_loss: 0.1690, test_loss: 3.2680, test_f1: 0.5451
 epoch: 98, train_loss: 0.1653, test_loss: 3.2924, test_f1: 0.5333
 epoch: 99, train_loss: 0.1604, test_loss: 3.6849, test_f1: 0.5056
##################ITERATION #2 ****************************************
 epoch: 0, train_loss: 1.2843, test_loss: 1.2591, test_f1: 0.3024
 epoch: 1, train_loss: 1.1435, test_loss: 1.1755, test_f1: 0.4137
 epoch: 2, train_loss: 1.0830, test_loss: 1.1278, test_f1: 0.4167
 epoch: 3, train_loss: 1.0252, test_loss: 1.0421, test_f1: 0.4870
 epoch: 4, train_loss: 0.9941, test_loss: 1.0087, test_f1: 0.5206
 epoch: 5, train_loss: 0.9730, test_loss: 1.0657, test_f1: 0.5060
 epoch: 6, train_loss: 0.9501, test_loss: 0.9791, test_f1: 0.5424
 epoch: 7, train_loss: 0.9204, test_loss: 0.9444, test_f1: 0.5388
 epoch: 8, train_loss: 0.8941, test_loss: 1.0803, test_f1: 0.5057
 epoch: 9, train_loss: 0.8898, test_loss: 1.0109, test_f1: 0.5274
 epoch: 10, train_loss: 0.8762, test_loss: 1.0632, test_f1: 0.4970
 epoch: 11, train_loss: 0.8387, test_loss: 1.2094, test_f1: 0.4799
 epoch: 12, train_loss: 0.8231, test_loss: 1.0036, test_f1: 0.5387
 epoch: 13, train_loss: 0.8261, test_loss: 1.0218, test_f1: 0.5393
 epoch: 14, train_loss: 0.7900, test_loss: 1.0130, test_f1: 0.5436
 epoch: 15, train_loss: 0.7817, test_loss: 1.1532, test_f1: 0.5265
 epoch: 16, train_loss: 0.7699, test_loss: 1.0973, test_f1: 0.4898
 epoch: 17, train_loss: 0.7743, test_loss: 1.0703, test_f1: 0.5173
 epoch: 18, train_loss: 0.7411, test_loss: 1.0699, test_f1: 0.5110
 epoch: 19, train_loss: 0.7186, test_loss: 1.3005, test_f1: 0.4877
 epoch: 20, train_loss: 0.6932, test_loss: 1.1198, test_f1: 0.5064
 epoch: 21, train_loss: 0.6826, test_loss: 1.3090, test_f1: 0.5150
 epoch: 22, train_loss: 0.6809, test_loss: 1.4242, test_f1: 0.5134
 epoch: 23, train_loss: 0.6902, test_loss: 1.4165, test_f1: 0.4786
 epoch: 24, train_loss: 0.6679, test_loss: 1.2168, test_f1: 0.5309
 epoch: 25, train_loss: 0.6589, test_loss: 1.1936, test_f1: 0.5161
 epoch: 26, train_loss: 0.6560, test_loss: 1.4004, test_f1: 0.5293
 epoch: 27, train_loss: 0.6217, test_loss: 1.2220, test_f1: 0.5260
 epoch: 28, train_loss: 0.6029, test_loss: 1.3524, test_f1: 0.5010
 epoch: 29, train_loss: 0.6060, test_loss: 1.2952, test_f1: 0.5229
 epoch: 30, train_loss: 0.6040, test_loss: 1.3944, test_f1: 0.5240
 epoch: 31, train_loss: 0.5904, test_loss: 1.2657, test_f1: 0.5386
 epoch: 32, train_loss: 0.5701, test_loss: 1.5499, test_f1: 0.5262
 epoch: 33, train_loss: 0.5594, test_loss: 1.4605, test_f1: 0.5056
 epoch: 34, train_loss: 0.5384, test_loss: 1.4062, test_f1: 0.5375
 epoch: 35, train_loss: 0.5433, test_loss: 1.3610, test_f1: 0.5422
 epoch: 36, train_loss: 0.5499, test_loss: 1.6298, test_f1: 0.5492
 epoch: 37, train_loss: 0.5502, test_loss: 1.4136, test_f1: 0.5400
 epoch: 38, train_loss: 0.5306, test_loss: 1.4106, test_f1: 0.5378
 epoch: 39, train_loss: 0.5273, test_loss: 1.4551, test_f1: 0.5514
 epoch: 40, train_loss: 0.5249, test_loss: 1.5934, test_f1: 0.5368
 epoch: 41, train_loss: 0.5086, test_loss: 1.6827, test_f1: 0.5373
 epoch: 42, train_loss: 0.4914, test_loss: 1.6057, test_f1: 0.5230
 epoch: 43, train_loss: 0.4822, test_loss: 1.7831, test_f1: 0.4763
 epoch: 44, train_loss: 0.4947, test_loss: 1.6508, test_f1: 0.5432
 epoch: 45, train_loss: 0.4587, test_loss: 1.5765, test_f1: 0.5418
 epoch: 46, train_loss: 0.4664, test_loss: 1.7549, test_f1: 0.5381
 epoch: 47, train_loss: 0.4478, test_loss: 1.7039, test_f1: 0.5271
 epoch: 48, train_loss: 0.4526, test_loss: 2.1918, test_f1: 0.5348
 epoch: 49, train_loss: 0.4720, test_loss: 2.4133, test_f1: 0.5185
 epoch: 50, train_loss: 0.4738, test_loss: 1.5662, test_f1: 0.5406
 epoch: 51, train_loss: 0.4121, test_loss: 1.7605, test_f1: 0.5372
 epoch: 52, train_loss: 0.3752, test_loss: 1.7211, test_f1: 0.5527
 epoch: 53, train_loss: 0.3641, test_loss: 1.8359, test_f1: 0.5166
 epoch: 54, train_loss: 0.3341, test_loss: 1.8718, test_f1: 0.5388
 epoch: 55, train_loss: 0.3414, test_loss: 1.9738, test_f1: 0.5243
 epoch: 56, train_loss: 0.3370, test_loss: 2.0748, test_f1: 0.5357
 epoch: 57, train_loss: 0.3489, test_loss: 1.9637, test_f1: 0.5275
 epoch: 58, train_loss: 0.3232, test_loss: 2.0711, test_f1: 0.5387
 epoch: 59, train_loss: 0.3077, test_loss: 2.0994, test_f1: 0.5623
 epoch: 60, train_loss: 0.3122, test_loss: 2.1628, test_f1: 0.5550
 epoch: 61, train_loss: 0.2929, test_loss: 2.3635, test_f1: 0.5349
 epoch: 62, train_loss: 0.2876, test_loss: 2.0569, test_f1: 0.5409
 epoch: 63, train_loss: 0.2866, test_loss: 2.2927, test_f1: 0.5323
 epoch: 64, train_loss: 0.2956, test_loss: 2.0453, test_f1: 0.5566
 epoch: 65, train_loss: 0.2850, test_loss: 2.1471, test_f1: 0.5491
 epoch: 66, train_loss: 0.2859, test_loss: 2.5549, test_f1: 0.5186
 epoch: 67, train_loss: 0.2764, test_loss: 2.2190, test_f1: 0.5419
 epoch: 68, train_loss: 0.2838, test_loss: 2.2739, test_f1: 0.5658
 epoch: 69, train_loss: 0.2737, test_loss: 2.4193, test_f1: 0.5343
 epoch: 70, train_loss: 0.2742, test_loss: 2.1857, test_f1: 0.5435
 epoch: 71, train_loss: 0.2851, test_loss: 2.3661, test_f1: 0.4775
 epoch: 72, train_loss: 0.2795, test_loss: 2.6818, test_f1: 0.5115
 epoch: 73, train_loss: 0.2676, test_loss: 2.3827, test_f1: 0.5465
 epoch: 74, train_loss: 0.2619, test_loss: 2.4458, test_f1: 0.5297
 epoch: 75, train_loss: 0.2543, test_loss: 2.3322, test_f1: 0.5595
 epoch: 76, train_loss: 0.2515, test_loss: 2.3345, test_f1: 0.5744
 epoch: 77, train_loss: 0.2597, test_loss: 2.2929, test_f1: 0.5561
 epoch: 78, train_loss: 0.2685, test_loss: 2.4607, test_f1: 0.5257
 epoch: 79, train_loss: 0.2380, test_loss: 2.3980, test_f1: 0.5486
 epoch: 80, train_loss: 0.2270, test_loss: 2.7350, test_f1: 0.5248
 epoch: 81, train_loss: 0.2470, test_loss: 2.3664, test_f1: 0.5523
 epoch: 82, train_loss: 0.2591, test_loss: 2.4918, test_f1: 0.5465
 epoch: 83, train_loss: 0.2422, test_loss: 2.3400, test_f1: 0.5563
 epoch: 84, train_loss: 0.2361, test_loss: 2.6715, test_f1: 0.5375
 epoch: 85, train_loss: 0.2389, test_loss: 2.5577, test_f1: 0.5519
 epoch: 86, train_loss: 0.2392, test_loss: 2.8411, test_f1: 0.5279
 epoch: 87, train_loss: 0.2341, test_loss: 2.8390, test_f1: 0.5420
 epoch: 88, train_loss: 0.2382, test_loss: 2.7695, test_f1: 0.5452
 epoch: 89, train_loss: 0.2481, test_loss: 2.6048, test_f1: 0.5454
 epoch: 90, train_loss: 0.2258, test_loss: 2.7224, test_f1: 0.5332
 epoch: 91, train_loss: 0.2342, test_loss: 2.7080, test_f1: 0.4819
 epoch: 92, train_loss: 0.3208, test_loss: 2.7133, test_f1: 0.5330
 epoch: 93, train_loss: 0.2800, test_loss: 2.3844, test_f1: 0.5088
 epoch: 94, train_loss: 0.2376, test_loss: 2.5840, test_f1: 0.5274
 epoch: 95, train_loss: 0.2199, test_loss: 2.4845, test_f1: 0.5333
 epoch: 96, train_loss: 0.2177, test_loss: 2.5604, test_f1: 0.5410
 epoch: 97, train_loss: 0.2242, test_loss: 2.5332, test_f1: 0.5303
 epoch: 98, train_loss: 0.2249, test_loss: 2.7156, test_f1: 0.5559
 epoch: 99, train_loss: 0.2418, test_loss: 2.6698, test_f1: 0.5472
##################ITERATION #3 ****************************************
 epoch: 0, train_loss: 1.3031, test_loss: 1.2442, test_f1: 0.2964
 epoch: 1, train_loss: 1.1529, test_loss: 1.2005, test_f1: 0.4164
 epoch: 2, train_loss: 1.0909, test_loss: 1.1025, test_f1: 0.4386
 epoch: 3, train_loss: 1.0264, test_loss: 1.0381, test_f1: 0.4766
 epoch: 4, train_loss: 1.0014, test_loss: 1.0506, test_f1: 0.4400
 epoch: 5, train_loss: 0.9603, test_loss: 1.0430, test_f1: 0.4833
 epoch: 6, train_loss: 0.9148, test_loss: 1.0046, test_f1: 0.4948
 epoch: 7, train_loss: 0.8941, test_loss: 1.0850, test_f1: 0.4651
 epoch: 8, train_loss: 0.8866, test_loss: 1.1132, test_f1: 0.4776
 epoch: 9, train_loss: 0.8548, test_loss: 1.0450, test_f1: 0.4828
 epoch: 10, train_loss: 0.8259, test_loss: 1.1150, test_f1: 0.4735
 epoch: 11, train_loss: 0.8123, test_loss: 1.1194, test_f1: 0.5014
 epoch: 12, train_loss: 0.7829, test_loss: 1.1157, test_f1: 0.4972
 epoch: 13, train_loss: 0.7611, test_loss: 1.1460, test_f1: 0.4939
 epoch: 14, train_loss: 0.7538, test_loss: 1.1723, test_f1: 0.5344
 epoch: 15, train_loss: 0.7394, test_loss: 1.1834, test_f1: 0.5244
 epoch: 16, train_loss: 0.7038, test_loss: 1.1023, test_f1: 0.5310
 epoch: 17, train_loss: 0.7060, test_loss: 1.3977, test_f1: 0.4812
 epoch: 18, train_loss: 0.6789, test_loss: 1.1884, test_f1: 0.5275
 epoch: 19, train_loss: 0.6465, test_loss: 1.2697, test_f1: 0.5392
 epoch: 20, train_loss: 0.6804, test_loss: 1.3775, test_f1: 0.5287
 epoch: 21, train_loss: 0.6437, test_loss: 1.4256, test_f1: 0.5290
 epoch: 22, train_loss: 0.6247, test_loss: 1.2557, test_f1: 0.5284
 epoch: 23, train_loss: 0.6129, test_loss: 1.3752, test_f1: 0.5410
 epoch: 24, train_loss: 0.6060, test_loss: 1.3510, test_f1: 0.5215
 epoch: 25, train_loss: 0.5846, test_loss: 1.4900, test_f1: 0.5090
 epoch: 26, train_loss: 0.5656, test_loss: 1.3978, test_f1: 0.5365
 epoch: 27, train_loss: 0.5626, test_loss: 1.5086, test_f1: 0.5389
 epoch: 28, train_loss: 0.5443, test_loss: 1.5497, test_f1: 0.5148
 epoch: 29, train_loss: 0.5323, test_loss: 1.3631, test_f1: 0.4839
 epoch: 30, train_loss: 0.5442, test_loss: 1.5498, test_f1: 0.5220
 epoch: 31, train_loss: 0.5007, test_loss: 1.4525, test_f1: 0.5622
 epoch: 32, train_loss: 0.5006, test_loss: 1.5719, test_f1: 0.5071
 epoch: 33, train_loss: 0.4870, test_loss: 1.6815, test_f1: 0.5059
 epoch: 34, train_loss: 0.4976, test_loss: 1.6584, test_f1: 0.5112
 epoch: 35, train_loss: 0.4848, test_loss: 1.4693, test_f1: 0.5512
 epoch: 36, train_loss: 0.4605, test_loss: 1.6740, test_f1: 0.4956
 epoch: 37, train_loss: 0.4591, test_loss: 1.7365, test_f1: 0.5596
 epoch: 38, train_loss: 0.4614, test_loss: 1.8237, test_f1: 0.5064
 epoch: 39, train_loss: 0.4532, test_loss: 1.6031, test_f1: 0.5294
 epoch: 40, train_loss: 0.4566, test_loss: 1.7055, test_f1: 0.5149
 epoch: 41, train_loss: 0.4347, test_loss: 1.8406, test_f1: 0.5082
 epoch: 42, train_loss: 0.4393, test_loss: 1.7640, test_f1: 0.5285
 epoch: 43, train_loss: 0.4441, test_loss: 1.7368, test_f1: 0.5465
 epoch: 44, train_loss: 0.4181, test_loss: 1.5580, test_f1: 0.5421
 epoch: 45, train_loss: 0.3883, test_loss: 2.1926, test_f1: 0.4896
 epoch: 46, train_loss: 0.4088, test_loss: 1.7245, test_f1: 0.5254
 epoch: 47, train_loss: 0.4178, test_loss: 1.9328, test_f1: 0.4911
 epoch: 48, train_loss: 0.4060, test_loss: 1.8974, test_f1: 0.5230
 epoch: 49, train_loss: 0.3889, test_loss: 2.1046, test_f1: 0.5115
 epoch: 50, train_loss: 0.4011, test_loss: 1.8251, test_f1: 0.5062
 epoch: 51, train_loss: 0.3601, test_loss: 1.8684, test_f1: 0.5186
 epoch: 52, train_loss: 0.3114, test_loss: 1.8765, test_f1: 0.5371
 epoch: 53, train_loss: 0.2813, test_loss: 2.1337, test_f1: 0.5422
 epoch: 54, train_loss: 0.2816, test_loss: 2.1186, test_f1: 0.5152
 epoch: 55, train_loss: 0.2573, test_loss: 2.1863, test_f1: 0.5222
 epoch: 56, train_loss: 0.2551, test_loss: 2.2060, test_f1: 0.5194
 epoch: 57, train_loss: 0.2594, test_loss: 2.2140, test_f1: 0.5361
 epoch: 58, train_loss: 0.2822, test_loss: 2.2972, test_f1: 0.5290
 epoch: 59, train_loss: 0.2710, test_loss: 2.3525, test_f1: 0.5185
 epoch: 60, train_loss: 0.2629, test_loss: 2.3342, test_f1: 0.5084
 epoch: 61, train_loss: 0.2611, test_loss: 2.2440, test_f1: 0.5241
 epoch: 62, train_loss: 0.2389, test_loss: 2.3107, test_f1: 0.5228
 epoch: 63, train_loss: 0.2309, test_loss: 2.4814, test_f1: 0.5219
 epoch: 64, train_loss: 0.2532, test_loss: 2.4646, test_f1: 0.5543
 epoch: 65, train_loss: 0.2390, test_loss: 2.6828, test_f1: 0.5132
 epoch: 66, train_loss: 0.2393, test_loss: 2.5282, test_f1: 0.5214
 epoch: 67, train_loss: 0.2282, test_loss: 2.4874, test_f1: 0.5369
 epoch: 68, train_loss: 0.2246, test_loss: 2.4931, test_f1: 0.5152
 epoch: 69, train_loss: 0.2283, test_loss: 2.7022, test_f1: 0.5301
 epoch: 70, train_loss: 0.2200, test_loss: 2.5007, test_f1: 0.5206
 epoch: 71, train_loss: 0.2325, test_loss: 2.3581, test_f1: 0.5360
 epoch: 72, train_loss: 0.2368, test_loss: 2.5436, test_f1: 0.5316
 epoch: 73, train_loss: 0.2346, test_loss: 2.5004, test_f1: 0.5343
 epoch: 74, train_loss: 0.2058, test_loss: 2.5487, test_f1: 0.5289
 epoch: 75, train_loss: 0.2075, test_loss: 2.4796, test_f1: 0.5223
 epoch: 76, train_loss: 0.2099, test_loss: 2.6374, test_f1: 0.5502
 epoch: 77, train_loss: 0.2076, test_loss: 2.6311, test_f1: 0.5212
 epoch: 78, train_loss: 0.1925, test_loss: 2.6525, test_f1: 0.5242
 epoch: 79, train_loss: 0.1891, test_loss: 2.7902, test_f1: 0.5066
 epoch: 80, train_loss: 0.2131, test_loss: 2.5846, test_f1: 0.5142
 epoch: 81, train_loss: 0.2296, test_loss: 3.0000, test_f1: 0.5014
 epoch: 82, train_loss: 0.1919, test_loss: 2.6045, test_f1: 0.5451
 epoch: 83, train_loss: 0.2134, test_loss: 2.6559, test_f1: 0.5383
 epoch: 84, train_loss: 0.1987, test_loss: 2.7089, test_f1: 0.5131
 epoch: 85, train_loss: 0.1798, test_loss: 2.8679, test_f1: 0.5338
 epoch: 86, train_loss: 0.1811, test_loss: 2.9534, test_f1: 0.5002
 epoch: 87, train_loss: 0.1853, test_loss: 2.9294, test_f1: 0.5202
 epoch: 88, train_loss: 0.1757, test_loss: 3.0063, test_f1: 0.5205
 epoch: 89, train_loss: 0.1585, test_loss: 2.8955, test_f1: 0.5373
 epoch: 90, train_loss: 0.1689, test_loss: 3.0842, test_f1: 0.5270
 epoch: 91, train_loss: 0.1622, test_loss: 3.0738, test_f1: 0.4788
 epoch: 92, train_loss: 0.1708, test_loss: 3.0278, test_f1: 0.5240
 epoch: 93, train_loss: 0.1424, test_loss: 3.0985, test_f1: 0.5293
 epoch: 94, train_loss: 0.1658, test_loss: 3.0943, test_f1: 0.5308
 epoch: 95, train_loss: 0.1843, test_loss: 2.8182, test_f1: 0.5332
 epoch: 96, train_loss: 0.1700, test_loss: 3.1846, test_f1: 0.5312
 epoch: 97, train_loss: 0.1798, test_loss: 3.3450, test_f1: 0.5350
 epoch: 98, train_loss: 0.1833, test_loss: 2.9412, test_f1: 0.5081
 epoch: 99, train_loss: 0.1732, test_loss: 3.2728, test_f1: 0.5141
##################ITERATION #4 ****************************************
 epoch: 0, train_loss: 1.3339, test_loss: 1.2589, test_f1: 0.3051
 epoch: 1, train_loss: 1.1987, test_loss: 1.1800, test_f1: 0.4549
 epoch: 2, train_loss: 1.1213, test_loss: 1.0894, test_f1: 0.4663
 epoch: 3, train_loss: 1.0714, test_loss: 1.0341, test_f1: 0.4923
 epoch: 4, train_loss: 1.0344, test_loss: 1.0116, test_f1: 0.5191
 epoch: 5, train_loss: 0.9950, test_loss: 1.0180, test_f1: 0.5040
 epoch: 6, train_loss: 0.9772, test_loss: 1.0217, test_f1: 0.4764
 epoch: 7, train_loss: 0.9453, test_loss: 0.9845, test_f1: 0.5005
 epoch: 8, train_loss: 0.9113, test_loss: 1.0431, test_f1: 0.4976
 epoch: 9, train_loss: 0.8959, test_loss: 1.0795, test_f1: 0.4567
 epoch: 10, train_loss: 0.8787, test_loss: 0.9890, test_f1: 0.5462
 epoch: 11, train_loss: 0.8499, test_loss: 1.0432, test_f1: 0.4715
 epoch: 12, train_loss: 0.8369, test_loss: 1.0557, test_f1: 0.4986
 epoch: 13, train_loss: 0.8352, test_loss: 1.0643, test_f1: 0.5322
 epoch: 14, train_loss: 0.8169, test_loss: 1.0863, test_f1: 0.5172
 epoch: 15, train_loss: 0.7959, test_loss: 0.9718, test_f1: 0.5737
 epoch: 16, train_loss: 0.7738, test_loss: 1.0653, test_f1: 0.5190
 epoch: 17, train_loss: 0.7457, test_loss: 1.1828, test_f1: 0.5274
 epoch: 18, train_loss: 0.7489, test_loss: 1.1096, test_f1: 0.5351
 epoch: 19, train_loss: 0.7454, test_loss: 1.2955, test_f1: 0.4936
 epoch: 20, train_loss: 0.7269, test_loss: 1.0953, test_f1: 0.5606
 epoch: 21, train_loss: 0.7264, test_loss: 1.0656, test_f1: 0.5375
 epoch: 22, train_loss: 0.6873, test_loss: 1.2126, test_f1: 0.5242
 epoch: 23, train_loss: 0.6814, test_loss: 1.2879, test_f1: 0.5393
 epoch: 24, train_loss: 0.6563, test_loss: 1.2499, test_f1: 0.5566
 epoch: 25, train_loss: 0.6371, test_loss: 1.5437, test_f1: 0.5158
 epoch: 26, train_loss: 0.6426, test_loss: 1.3009, test_f1: 0.5425
 epoch: 27, train_loss: 0.6483, test_loss: 1.1969, test_f1: 0.5507
 epoch: 28, train_loss: 0.6212, test_loss: 1.4621, test_f1: 0.5192
 epoch: 29, train_loss: 0.6157, test_loss: 1.5167, test_f1: 0.5512
 epoch: 30, train_loss: 0.6254, test_loss: 1.3669, test_f1: 0.5667
 epoch: 31, train_loss: 0.5936, test_loss: 1.4164, test_f1: 0.5323
 epoch: 32, train_loss: 0.5915, test_loss: 1.3572, test_f1: 0.5690
 epoch: 33, train_loss: 0.5580, test_loss: 1.5897, test_f1: 0.5569
 epoch: 34, train_loss: 0.5669, test_loss: 1.6136, test_f1: 0.5241
 epoch: 35, train_loss: 0.5797, test_loss: 1.4131, test_f1: 0.5280
 epoch: 36, train_loss: 0.5584, test_loss: 1.6349, test_f1: 0.5255
 epoch: 37, train_loss: 0.5483, test_loss: 1.5167, test_f1: 0.5286
 epoch: 38, train_loss: 0.5464, test_loss: 1.5525, test_f1: 0.5315
 epoch: 39, train_loss: 0.5341, test_loss: 1.6296, test_f1: 0.5542
 epoch: 40, train_loss: 0.5228, test_loss: 1.5111, test_f1: 0.5575
 epoch: 41, train_loss: 0.4911, test_loss: 1.5688, test_f1: 0.5269
 epoch: 42, train_loss: 0.5108, test_loss: 1.8180, test_f1: 0.5425
 epoch: 43, train_loss: 0.4804, test_loss: 1.6947, test_f1: 0.5357
 epoch: 44, train_loss: 0.5317, test_loss: 1.6581, test_f1: 0.5241
 epoch: 45, train_loss: 0.4940, test_loss: 1.6958, test_f1: 0.5308
 epoch: 46, train_loss: 0.4852, test_loss: 1.6652, test_f1: 0.5536
 epoch: 47, train_loss: 0.5173, test_loss: 1.9924, test_f1: 0.5335
 epoch: 48, train_loss: 0.5204, test_loss: 1.6405, test_f1: 0.5437
 epoch: 49, train_loss: 0.4786, test_loss: 1.6276, test_f1: 0.5665
 epoch: 50, train_loss: 0.4572, test_loss: 1.5290, test_f1: 0.5586
 epoch: 51, train_loss: 0.4160, test_loss: 1.7590, test_f1: 0.5631
 epoch: 52, train_loss: 0.3774, test_loss: 1.6562, test_f1: 0.5867
 epoch: 53, train_loss: 0.3594, test_loss: 1.8873, test_f1: 0.5685
 epoch: 54, train_loss: 0.3569, test_loss: 1.9704, test_f1: 0.5656
 epoch: 55, train_loss: 0.3554, test_loss: 1.9904, test_f1: 0.5628
 epoch: 56, train_loss: 0.3542, test_loss: 1.9627, test_f1: 0.5537
 epoch: 57, train_loss: 0.3371, test_loss: 1.9044, test_f1: 0.5701
 epoch: 58, train_loss: 0.3369, test_loss: 2.0177, test_f1: 0.5624
 epoch: 59, train_loss: 0.3449, test_loss: 1.9612, test_f1: 0.5714
 epoch: 60, train_loss: 0.3350, test_loss: 2.0084, test_f1: 0.5700
 epoch: 61, train_loss: 0.3272, test_loss: 2.0527, test_f1: 0.5402
 epoch: 62, train_loss: 0.3399, test_loss: 1.9839, test_f1: 0.5693
 epoch: 63, train_loss: 0.3330, test_loss: 2.0692, test_f1: 0.5689
 epoch: 64, train_loss: 0.3313, test_loss: 1.9605, test_f1: 0.5659
 epoch: 65, train_loss: 0.3293, test_loss: 2.1043, test_f1: 0.5674
 epoch: 66, train_loss: 0.3234, test_loss: 2.0122, test_f1: 0.5531
 epoch: 67, train_loss: 0.3049, test_loss: 1.9579, test_f1: 0.5597
 epoch: 68, train_loss: 0.2911, test_loss: 2.0546, test_f1: 0.5420
 epoch: 69, train_loss: 0.2950, test_loss: 2.1017, test_f1: 0.5485
 epoch: 70, train_loss: 0.2820, test_loss: 2.0686, test_f1: 0.5614
 epoch: 71, train_loss: 0.2953, test_loss: 2.0595, test_f1: 0.5522
 epoch: 72, train_loss: 0.2970, test_loss: 2.1332, test_f1: 0.5426
 epoch: 73, train_loss: 0.2925, test_loss: 2.1679, test_f1: 0.5508
 epoch: 74, train_loss: 0.2941, test_loss: 2.1638, test_f1: 0.5376
 epoch: 75, train_loss: 0.2862, test_loss: 2.1460, test_f1: 0.5340
 epoch: 76, train_loss: 0.2905, test_loss: 2.2196, test_f1: 0.5564
 epoch: 77, train_loss: 0.3086, test_loss: 2.2376, test_f1: 0.5328
 epoch: 78, train_loss: 0.2921, test_loss: 2.2411, test_f1: 0.5391
 epoch: 79, train_loss: 0.2785, test_loss: 2.1969, test_f1: 0.5497
 epoch: 80, train_loss: 0.2740, test_loss: 2.3078, test_f1: 0.5375
 epoch: 81, train_loss: 0.2591, test_loss: 2.1329, test_f1: 0.5601
 epoch: 82, train_loss: 0.2758, test_loss: 2.0569, test_f1: 0.5669
 epoch: 83, train_loss: 0.2709, test_loss: 2.2908, test_f1: 0.5561
 epoch: 84, train_loss: 0.2647, test_loss: 2.3437, test_f1: 0.5343
 epoch: 85, train_loss: 0.2761, test_loss: 2.4798, test_f1: 0.5369
 epoch: 86, train_loss: 0.2602, test_loss: 2.2877, test_f1: 0.5719
 epoch: 87, train_loss: 0.2698, test_loss: 2.3482, test_f1: 0.5525
 epoch: 88, train_loss: 0.2450, test_loss: 2.2969, test_f1: 0.5549
 epoch: 89, train_loss: 0.2510, test_loss: 2.3257, test_f1: 0.5593
 epoch: 90, train_loss: 0.2451, test_loss: 2.5146, test_f1: 0.5388
 epoch: 91, train_loss: 0.2375, test_loss: 2.7860, test_f1: 0.5523
 epoch: 92, train_loss: 0.2516, test_loss: 2.3342, test_f1: 0.5688
 epoch: 93, train_loss: 0.2334, test_loss: 2.4673, test_f1: 0.5539
 epoch: 94, train_loss: 0.2511, test_loss: 2.5190, test_f1: 0.5452
 epoch: 95, train_loss: 0.2483, test_loss: 2.5228, test_f1: 0.5246
 epoch: 96, train_loss: 0.2425, test_loss: 2.7085, test_f1: 0.5451
 epoch: 97, train_loss: 0.2392, test_loss: 2.2671, test_f1: 0.5547
 epoch: 98, train_loss: 0.2259, test_loss: 2.7098, test_f1: 0.5537
 epoch: 99, train_loss: 0.2376, test_loss: 2.7203, test_f1: 0.5303
##################ITERATION #5 ****************************************
 epoch: 0, train_loss: 1.4268, test_loss: 1.3053, test_f1: 0.3443
 epoch: 1, train_loss: 1.2177, test_loss: 1.2255, test_f1: 0.4215
 epoch: 2, train_loss: 1.1395, test_loss: 1.1411, test_f1: 0.4113
 epoch: 3, train_loss: 1.0681, test_loss: 1.0635, test_f1: 0.4851
 epoch: 4, train_loss: 1.0352, test_loss: 1.0079, test_f1: 0.5071
 epoch: 5, train_loss: 0.9952, test_loss: 1.0468, test_f1: 0.4620
 epoch: 6, train_loss: 0.9749, test_loss: 1.0093, test_f1: 0.5023
 epoch: 7, train_loss: 0.9362, test_loss: 1.0007, test_f1: 0.4984
 epoch: 8, train_loss: 0.9124, test_loss: 1.0185, test_f1: 0.4844
 epoch: 9, train_loss: 0.8755, test_loss: 1.1280, test_f1: 0.4819
 epoch: 10, train_loss: 0.8499, test_loss: 1.0668, test_f1: 0.4793
 epoch: 11, train_loss: 0.8404, test_loss: 1.1319, test_f1: 0.4915
 epoch: 12, train_loss: 0.8293, test_loss: 1.0051, test_f1: 0.5028
 epoch: 13, train_loss: 0.7859, test_loss: 1.1483, test_f1: 0.4915
 epoch: 14, train_loss: 0.7668, test_loss: 1.1896, test_f1: 0.4965
 epoch: 15, train_loss: 0.7513, test_loss: 1.1289, test_f1: 0.5223
 epoch: 16, train_loss: 0.7486, test_loss: 1.1770, test_f1: 0.4823
 epoch: 17, train_loss: 0.7265, test_loss: 1.1793, test_f1: 0.4957
 epoch: 18, train_loss: 0.7322, test_loss: 1.0896, test_f1: 0.5396
 epoch: 19, train_loss: 0.6985, test_loss: 1.1851, test_f1: 0.4992
 epoch: 20, train_loss: 0.6920, test_loss: 1.1304, test_f1: 0.5169
 epoch: 21, train_loss: 0.6646, test_loss: 1.2849, test_f1: 0.4837
 epoch: 22, train_loss: 0.6406, test_loss: 1.3043, test_f1: 0.4946
 epoch: 23, train_loss: 0.6493, test_loss: 1.2628, test_f1: 0.5124
 epoch: 24, train_loss: 0.6360, test_loss: 1.2569, test_f1: 0.5289
 epoch: 25, train_loss: 0.6398, test_loss: 1.3096, test_f1: 0.5172
 epoch: 26, train_loss: 0.6171, test_loss: 1.3845, test_f1: 0.4985
 epoch: 27, train_loss: 0.6055, test_loss: 1.3390, test_f1: 0.5175
 epoch: 28, train_loss: 0.5813, test_loss: 1.3944, test_f1: 0.5001
 epoch: 29, train_loss: 0.5843, test_loss: 1.4480, test_f1: 0.5255
 epoch: 30, train_loss: 0.5725, test_loss: 1.4385, test_f1: 0.5096
 epoch: 31, train_loss: 0.5378, test_loss: 1.4195, test_f1: 0.5197
 epoch: 32, train_loss: 0.5357, test_loss: 1.5572, test_f1: 0.5246
 epoch: 33, train_loss: 0.5292, test_loss: 1.6164, test_f1: 0.5380
 epoch: 34, train_loss: 0.5178, test_loss: 1.6085, test_f1: 0.5131
 epoch: 35, train_loss: 0.5073, test_loss: 1.6041, test_f1: 0.5166
 epoch: 36, train_loss: 0.5175, test_loss: 1.3590, test_f1: 0.5515
 epoch: 37, train_loss: 0.4933, test_loss: 1.6452, test_f1: 0.5389
 epoch: 38, train_loss: 0.5022, test_loss: 1.6133, test_f1: 0.5399
 epoch: 39, train_loss: 0.4998, test_loss: 1.5652, test_f1: 0.5260
 epoch: 40, train_loss: 0.4753, test_loss: 1.6784, test_f1: 0.4900
 epoch: 41, train_loss: 0.4730, test_loss: 1.7179, test_f1: 0.5330
 epoch: 42, train_loss: 0.4453, test_loss: 1.7764, test_f1: 0.5252
 epoch: 43, train_loss: 0.4321, test_loss: 1.8066, test_f1: 0.5471
 epoch: 44, train_loss: 0.4427, test_loss: 1.8027, test_f1: 0.5124
 epoch: 45, train_loss: 0.4274, test_loss: 1.8693, test_f1: 0.5335
 epoch: 46, train_loss: 0.4524, test_loss: 2.0861, test_f1: 0.5018
 epoch: 47, train_loss: 0.4610, test_loss: 1.7132, test_f1: 0.5334
 epoch: 48, train_loss: 0.4271, test_loss: 1.8700, test_f1: 0.5317
 epoch: 49, train_loss: 0.4478, test_loss: 1.7656, test_f1: 0.5401
 epoch: 50, train_loss: 0.4249, test_loss: 1.7354, test_f1: 0.5344
 epoch: 51, train_loss: 0.3858, test_loss: 1.7430, test_f1: 0.5173
 epoch: 52, train_loss: 0.3345, test_loss: 1.7399, test_f1: 0.5425
 epoch: 53, train_loss: 0.3254, test_loss: 1.9501, test_f1: 0.5272
 epoch: 54, train_loss: 0.3250, test_loss: 1.8926, test_f1: 0.5392
 epoch: 55, train_loss: 0.3261, test_loss: 2.0354, test_f1: 0.5440
 epoch: 56, train_loss: 0.3108, test_loss: 2.0897, test_f1: 0.5272
 epoch: 57, train_loss: 0.3006, test_loss: 2.1113, test_f1: 0.5451
 epoch: 58, train_loss: 0.2874, test_loss: 2.0865, test_f1: 0.5378
 epoch: 59, train_loss: 0.2983, test_loss: 2.2460, test_f1: 0.5440
 epoch: 60, train_loss: 0.2965, test_loss: 2.1160, test_f1: 0.5368
 epoch: 61, train_loss: 0.2831, test_loss: 2.2149, test_f1: 0.5072
 epoch: 62, train_loss: 0.2856, test_loss: 2.0479, test_f1: 0.5548
 epoch: 63, train_loss: 0.2831, test_loss: 2.4588, test_f1: 0.5384
 epoch: 64, train_loss: 0.2875, test_loss: 2.3589, test_f1: 0.5211
 epoch: 65, train_loss: 0.2669, test_loss: 2.3512, test_f1: 0.5238
 epoch: 66, train_loss: 0.2735, test_loss: 2.5139, test_f1: 0.5392
 epoch: 67, train_loss: 0.2578, test_loss: 2.3939, test_f1: 0.5462
 epoch: 68, train_loss: 0.2625, test_loss: 2.4773, test_f1: 0.5344
 epoch: 69, train_loss: 0.2561, test_loss: 2.4199, test_f1: 0.5590
 epoch: 70, train_loss: 0.2707, test_loss: 2.5181, test_f1: 0.5427
 epoch: 71, train_loss: 0.2543, test_loss: 2.3056, test_f1: 0.5738
 epoch: 72, train_loss: 0.2529, test_loss: 2.4667, test_f1: 0.5329
 epoch: 73, train_loss: 0.2528, test_loss: 2.4217, test_f1: 0.5467
 epoch: 74, train_loss: 0.2451, test_loss: 2.5261, test_f1: 0.5288
 epoch: 75, train_loss: 0.2277, test_loss: 2.2919, test_f1: 0.5801
 epoch: 76, train_loss: 0.2305, test_loss: 2.5247, test_f1: 0.5341
 epoch: 77, train_loss: 0.2322, test_loss: 2.5476, test_f1: 0.5441
 epoch: 78, train_loss: 0.2499, test_loss: 2.5173, test_f1: 0.5272
 epoch: 79, train_loss: 0.2526, test_loss: 2.4446, test_f1: 0.5580
 epoch: 80, train_loss: 0.2470, test_loss: 2.3938, test_f1: 0.5475
 epoch: 81, train_loss: 0.2399, test_loss: 2.5466, test_f1: 0.5245
 epoch: 82, train_loss: 0.2281, test_loss: 2.5563, test_f1: 0.5573
 epoch: 83, train_loss: 0.2292, test_loss: 2.5790, test_f1: 0.5376
 epoch: 84, train_loss: 0.2238, test_loss: 2.6578, test_f1: 0.5186
 epoch: 85, train_loss: 0.2196, test_loss: 2.6689, test_f1: 0.5448
 epoch: 86, train_loss: 0.2158, test_loss: 2.7466, test_f1: 0.5465
 epoch: 87, train_loss: 0.2221, test_loss: 2.6564, test_f1: 0.5366
 epoch: 88, train_loss: 0.2128, test_loss: 2.7273, test_f1: 0.5280
 epoch: 89, train_loss: 0.2017, test_loss: 2.7469, test_f1: 0.5436
 epoch: 90, train_loss: 0.2075, test_loss: 2.8179, test_f1: 0.5261
 epoch: 91, train_loss: 0.2045, test_loss: 2.9107, test_f1: 0.5263
 epoch: 92, train_loss: 0.1980, test_loss: 2.8514, test_f1: 0.5549
 epoch: 93, train_loss: 0.2085, test_loss: 2.9313, test_f1: 0.5278
 epoch: 94, train_loss: 0.2312, test_loss: 2.9505, test_f1: 0.5327
 epoch: 95, train_loss: 0.2035, test_loss: 2.9415, test_f1: 0.5291
 epoch: 96, train_loss: 0.2078, test_loss: 2.9517, test_f1: 0.5480
 epoch: 97, train_loss: 0.1791, test_loss: 2.8484, test_f1: 0.5459
 epoch: 98, train_loss: 0.1912, test_loss: 2.7621, test_f1: 0.5488
 epoch: 99, train_loss: 0.1721, test_loss: 3.0460, test_f1: 0.5470
##################ITERATION #6 ****************************************
 epoch: 0, train_loss: 1.5240, test_loss: 1.2877, test_f1: 0.3312
 epoch: 1, train_loss: 1.2068, test_loss: 1.1572, test_f1: 0.4457
 epoch: 2, train_loss: 1.1270, test_loss: 1.0914, test_f1: 0.4577
 epoch: 3, train_loss: 1.0479, test_loss: 1.0318, test_f1: 0.5274
 epoch: 4, train_loss: 1.0178, test_loss: 1.0046, test_f1: 0.5044
 epoch: 5, train_loss: 0.9867, test_loss: 1.0205, test_f1: 0.4916
 epoch: 6, train_loss: 0.9625, test_loss: 0.9949, test_f1: 0.4948
 epoch: 7, train_loss: 0.9291, test_loss: 0.9703, test_f1: 0.5139
 epoch: 8, train_loss: 0.9086, test_loss: 1.0049, test_f1: 0.4925
 epoch: 9, train_loss: 0.8777, test_loss: 0.9687, test_f1: 0.5407
 epoch: 10, train_loss: 0.8659, test_loss: 0.9890, test_f1: 0.5318
 epoch: 11, train_loss: 0.8480, test_loss: 1.0090, test_f1: 0.5213
 epoch: 12, train_loss: 0.8095, test_loss: 1.0320, test_f1: 0.5254
 epoch: 13, train_loss: 0.7995, test_loss: 1.0332, test_f1: 0.5228
 epoch: 14, train_loss: 0.7763, test_loss: 0.9921, test_f1: 0.5434
 epoch: 15, train_loss: 0.7515, test_loss: 1.0407, test_f1: 0.5361
 epoch: 16, train_loss: 0.7223, test_loss: 1.0675, test_f1: 0.5120
 epoch: 17, train_loss: 0.7299, test_loss: 1.0719, test_f1: 0.5254
 epoch: 18, train_loss: 0.7167, test_loss: 1.0451, test_f1: 0.5394
 epoch: 19, train_loss: 0.7202, test_loss: 1.1575, test_f1: 0.5119
 epoch: 20, train_loss: 0.6961, test_loss: 1.1057, test_f1: 0.5156
 epoch: 21, train_loss: 0.6842, test_loss: 1.1935, test_f1: 0.5671
 epoch: 22, train_loss: 0.6619, test_loss: 1.2328, test_f1: 0.5463
 epoch: 23, train_loss: 0.6303, test_loss: 1.1592, test_f1: 0.5654
 epoch: 24, train_loss: 0.6263, test_loss: 1.1922, test_f1: 0.5669
 epoch: 25, train_loss: 0.6305, test_loss: 1.2845, test_f1: 0.5485
 epoch: 26, train_loss: 0.6182, test_loss: 1.2101, test_f1: 0.5256
 epoch: 27, train_loss: 0.6155, test_loss: 1.3260, test_f1: 0.5135
 epoch: 28, train_loss: 0.5981, test_loss: 1.2996, test_f1: 0.5261
 epoch: 29, train_loss: 0.5788, test_loss: 1.2830, test_f1: 0.5534
 epoch: 30, train_loss: 0.5546, test_loss: 1.3056, test_f1: 0.5570
 epoch: 31, train_loss: 0.5254, test_loss: 1.3389, test_f1: 0.5248
 epoch: 32, train_loss: 0.5389, test_loss: 1.2925, test_f1: 0.5396
 epoch: 33, train_loss: 0.5408, test_loss: 1.3048, test_f1: 0.5371
 epoch: 34, train_loss: 0.5404, test_loss: 1.5346, test_f1: 0.5178
 epoch: 35, train_loss: 0.5286, test_loss: 1.4173, test_f1: 0.5353
 epoch: 36, train_loss: 0.5094, test_loss: 1.3942, test_f1: 0.5331
 epoch: 37, train_loss: 0.5238, test_loss: 1.4401, test_f1: 0.5401
 epoch: 38, train_loss: 0.4955, test_loss: 1.4705, test_f1: 0.5577
 epoch: 39, train_loss: 0.4664, test_loss: 1.6380, test_f1: 0.5443
 epoch: 40, train_loss: 0.4629, test_loss: 1.4893, test_f1: 0.5351
 epoch: 41, train_loss: 0.4489, test_loss: 1.6648, test_f1: 0.5269
 epoch: 42, train_loss: 0.4518, test_loss: 1.5013, test_f1: 0.5496
 epoch: 43, train_loss: 0.4554, test_loss: 1.6170, test_f1: 0.5708
 epoch: 44, train_loss: 0.4466, test_loss: 1.7771, test_f1: 0.5413
 epoch: 45, train_loss: 0.4592, test_loss: 1.5777, test_f1: 0.5536
 epoch: 46, train_loss: 0.4280, test_loss: 1.6870, test_f1: 0.5443
 epoch: 47, train_loss: 0.4329, test_loss: 1.6435, test_f1: 0.5587
 epoch: 48, train_loss: 0.4127, test_loss: 1.7686, test_f1: 0.5455
 epoch: 49, train_loss: 0.3990, test_loss: 1.8786, test_f1: 0.5440
 epoch: 50, train_loss: 0.4156, test_loss: 1.7549, test_f1: 0.5296
 epoch: 51, train_loss: 0.3678, test_loss: 1.7163, test_f1: 0.5690
 epoch: 52, train_loss: 0.3335, test_loss: 1.8260, test_f1: 0.5495
 epoch: 53, train_loss: 0.3003, test_loss: 1.9499, test_f1: 0.5593
 epoch: 54, train_loss: 0.3114, test_loss: 2.0547, test_f1: 0.5558
 epoch: 55, train_loss: 0.3053, test_loss: 2.0326, test_f1: 0.5642
 epoch: 56, train_loss: 0.2880, test_loss: 2.0635, test_f1: 0.5503
 epoch: 57, train_loss: 0.2647, test_loss: 2.0381, test_f1: 0.5546
 epoch: 58, train_loss: 0.2805, test_loss: 2.2565, test_f1: 0.5339
 epoch: 59, train_loss: 0.2864, test_loss: 2.1140, test_f1: 0.5525
 epoch: 60, train_loss: 0.2867, test_loss: 2.0069, test_f1: 0.5583
 epoch: 61, train_loss: 0.2738, test_loss: 2.1597, test_f1: 0.5532
 epoch: 62, train_loss: 0.2676, test_loss: 2.1020, test_f1: 0.5237
 epoch: 63, train_loss: 0.2678, test_loss: 2.1944, test_f1: 0.5568
 epoch: 64, train_loss: 0.2653, test_loss: 2.1215, test_f1: 0.5641
 epoch: 65, train_loss: 0.2542, test_loss: 2.4855, test_f1: 0.5451
 epoch: 66, train_loss: 0.2637, test_loss: 2.3237, test_f1: 0.5400
 epoch: 67, train_loss: 0.2597, test_loss: 2.2735, test_f1: 0.5445
 epoch: 68, train_loss: 0.2536, test_loss: 2.4096, test_f1: 0.5331
 epoch: 69, train_loss: 0.2419, test_loss: 2.4025, test_f1: 0.5375
 epoch: 70, train_loss: 0.2332, test_loss: 2.3199, test_f1: 0.5534
 epoch: 71, train_loss: 0.2519, test_loss: 2.4892, test_f1: 0.5353
 epoch: 72, train_loss: 0.2567, test_loss: 2.3702, test_f1: 0.5509
 epoch: 73, train_loss: 0.2543, test_loss: 2.4780, test_f1: 0.5201
 epoch: 74, train_loss: 0.2584, test_loss: 2.1246, test_f1: 0.5655
 epoch: 75, train_loss: 0.2483, test_loss: 2.3057, test_f1: 0.5638
 epoch: 76, train_loss: 0.2259, test_loss: 2.4165, test_f1: 0.5439
 epoch: 77, train_loss: 0.2176, test_loss: 2.4492, test_f1: 0.5578
 epoch: 78, train_loss: 0.2283, test_loss: 2.4418, test_f1: 0.5215
 epoch: 79, train_loss: 0.2162, test_loss: 2.3820, test_f1: 0.5512
 epoch: 80, train_loss: 0.2142, test_loss: 2.4565, test_f1: 0.5390
 epoch: 81, train_loss: 0.2027, test_loss: 2.6036, test_f1: 0.5412
 epoch: 82, train_loss: 0.2194, test_loss: 2.7647, test_f1: 0.5292
 epoch: 83, train_loss: 0.2097, test_loss: 2.5696, test_f1: 0.5470
 epoch: 84, train_loss: 0.2129, test_loss: 2.7342, test_f1: 0.5227
 epoch: 85, train_loss: 0.1984, test_loss: 2.6380, test_f1: 0.5523
 epoch: 86, train_loss: 0.1945, test_loss: 2.6028, test_f1: 0.5525
 epoch: 87, train_loss: 0.2053, test_loss: 2.7696, test_f1: 0.5356
 epoch: 88, train_loss: 0.2068, test_loss: 2.8031, test_f1: 0.5276
 epoch: 89, train_loss: 0.1991, test_loss: 2.7638, test_f1: 0.5454
 epoch: 90, train_loss: 0.1925, test_loss: 2.5946, test_f1: 0.5431
 epoch: 91, train_loss: 0.1945, test_loss: 2.4204, test_f1: 0.5720
 epoch: 92, train_loss: 0.2023, test_loss: 2.8247, test_f1: 0.5731
 epoch: 93, train_loss: 0.1845, test_loss: 2.7293, test_f1: 0.5466
 epoch: 94, train_loss: 0.1878, test_loss: 2.6446, test_f1: 0.5501
 epoch: 95, train_loss: 0.1879, test_loss: 2.7766, test_f1: 0.5430
 epoch: 96, train_loss: 0.1882, test_loss: 2.7702, test_f1: 0.5588
 epoch: 97, train_loss: 0.1764, test_loss: 2.6692, test_f1: 0.5375
 epoch: 98, train_loss: 0.1814, test_loss: 2.7794, test_f1: 0.5381
 epoch: 99, train_loss: 0.1758, test_loss: 2.7713, test_f1: 0.5378
##################ITERATION #7 ****************************************
 epoch: 0, train_loss: 1.5544, test_loss: 1.2703, test_f1: 0.2792
 epoch: 1, train_loss: 1.2067, test_loss: 1.2248, test_f1: 0.3900
 epoch: 2, train_loss: 1.1370, test_loss: 1.1435, test_f1: 0.4556
 epoch: 3, train_loss: 1.0777, test_loss: 1.0717, test_f1: 0.4184
 epoch: 4, train_loss: 1.0130, test_loss: 0.9828, test_f1: 0.5035
 epoch: 5, train_loss: 0.9861, test_loss: 0.9887, test_f1: 0.5063
 epoch: 6, train_loss: 0.9604, test_loss: 0.9813, test_f1: 0.5064
 epoch: 7, train_loss: 0.9183, test_loss: 0.9622, test_f1: 0.5162
 epoch: 8, train_loss: 0.8963, test_loss: 1.0167, test_f1: 0.5065
 epoch: 9, train_loss: 0.8824, test_loss: 1.0498, test_f1: 0.5249
 epoch: 10, train_loss: 0.8737, test_loss: 0.9992, test_f1: 0.5020
 epoch: 11, train_loss: 0.8454, test_loss: 1.0717, test_f1: 0.5079
 epoch: 12, train_loss: 0.8141, test_loss: 1.0708, test_f1: 0.5146
 epoch: 13, train_loss: 0.8038, test_loss: 1.1618, test_f1: 0.4794
 epoch: 14, train_loss: 0.7838, test_loss: 1.0271, test_f1: 0.5396
 epoch: 15, train_loss: 0.7755, test_loss: 1.0796, test_f1: 0.5258
 epoch: 16, train_loss: 0.7690, test_loss: 1.1385, test_f1: 0.5269
 epoch: 17, train_loss: 0.7551, test_loss: 1.2012, test_f1: 0.5051
 epoch: 18, train_loss: 0.7459, test_loss: 1.1391, test_f1: 0.5204
 epoch: 19, train_loss: 0.7382, test_loss: 1.1636, test_f1: 0.4875
 epoch: 20, train_loss: 0.7269, test_loss: 1.2260, test_f1: 0.4897
 epoch: 21, train_loss: 0.7026, test_loss: 1.1711, test_f1: 0.5528
 epoch: 22, train_loss: 0.6897, test_loss: 1.2864, test_f1: 0.5010
 epoch: 23, train_loss: 0.6630, test_loss: 1.3180, test_f1: 0.4945
 epoch: 24, train_loss: 0.6625, test_loss: 1.3422, test_f1: 0.4956
 epoch: 25, train_loss: 0.6454, test_loss: 1.3062, test_f1: 0.5080
 epoch: 26, train_loss: 0.6187, test_loss: 1.3512, test_f1: 0.5259
 epoch: 27, train_loss: 0.6288, test_loss: 1.2827, test_f1: 0.5337
 epoch: 28, train_loss: 0.5970, test_loss: 1.3472, test_f1: 0.5153
 epoch: 29, train_loss: 0.5843, test_loss: 1.4562, test_f1: 0.5175
 epoch: 30, train_loss: 0.5760, test_loss: 1.4451, test_f1: 0.5277
 epoch: 31, train_loss: 0.5690, test_loss: 1.4871, test_f1: 0.5204
 epoch: 32, train_loss: 0.5445, test_loss: 1.3641, test_f1: 0.5662
 epoch: 33, train_loss: 0.5874, test_loss: 1.5931, test_f1: 0.4843
 epoch: 34, train_loss: 0.5710, test_loss: 1.4576, test_f1: 0.5132
 epoch: 35, train_loss: 0.5475, test_loss: 1.5634, test_f1: 0.5238
 epoch: 36, train_loss: 0.5268, test_loss: 1.4840, test_f1: 0.5498
 epoch: 37, train_loss: 0.5301, test_loss: 1.5648, test_f1: 0.5541
 epoch: 38, train_loss: 0.5321, test_loss: 1.4952, test_f1: 0.5614
 epoch: 39, train_loss: 0.5208, test_loss: 1.5863, test_f1: 0.5262
 epoch: 40, train_loss: 0.4977, test_loss: 1.4156, test_f1: 0.5632
 epoch: 41, train_loss: 0.4809, test_loss: 1.6517, test_f1: 0.5238
 epoch: 42, train_loss: 0.4864, test_loss: 1.5989, test_f1: 0.5398
 epoch: 43, train_loss: 0.4601, test_loss: 1.8098, test_f1: 0.4940
 epoch: 44, train_loss: 0.4569, test_loss: 1.6420, test_f1: 0.5667
 epoch: 45, train_loss: 0.4680, test_loss: 1.8858, test_f1: 0.5477
 epoch: 46, train_loss: 0.4545, test_loss: 1.6149, test_f1: 0.5499
 epoch: 47, train_loss: 0.4627, test_loss: 1.6989, test_f1: 0.5084
 epoch: 48, train_loss: 0.4473, test_loss: 1.7116, test_f1: 0.5362
 epoch: 49, train_loss: 0.4461, test_loss: 1.8396, test_f1: 0.5460
 epoch: 50, train_loss: 0.4343, test_loss: 1.6895, test_f1: 0.5121
 epoch: 51, train_loss: 0.3966, test_loss: 1.7459, test_f1: 0.5443
 epoch: 52, train_loss: 0.3686, test_loss: 1.8514, test_f1: 0.5328
 epoch: 53, train_loss: 0.3373, test_loss: 1.8562, test_f1: 0.5372
 epoch: 54, train_loss: 0.3212, test_loss: 2.0175, test_f1: 0.5207
 epoch: 55, train_loss: 0.3011, test_loss: 1.8694, test_f1: 0.5836
 epoch: 56, train_loss: 0.3028, test_loss: 2.1445, test_f1: 0.5341
 epoch: 57, train_loss: 0.2964, test_loss: 2.1823, test_f1: 0.5469
 epoch: 58, train_loss: 0.3252, test_loss: 2.1450, test_f1: 0.5209
 epoch: 59, train_loss: 0.3008, test_loss: 2.0188, test_f1: 0.5464
 epoch: 60, train_loss: 0.2803, test_loss: 2.1671, test_f1: 0.5454
 epoch: 61, train_loss: 0.2784, test_loss: 2.2079, test_f1: 0.5461
 epoch: 62, train_loss: 0.2832, test_loss: 2.2077, test_f1: 0.5213
 epoch: 63, train_loss: 0.2837, test_loss: 2.1859, test_f1: 0.5303
 epoch: 64, train_loss: 0.2740, test_loss: 2.1983, test_f1: 0.5436
 epoch: 65, train_loss: 0.2775, test_loss: 2.2066, test_f1: 0.5359
 epoch: 66, train_loss: 0.2666, test_loss: 2.1734, test_f1: 0.5470
 epoch: 67, train_loss: 0.2731, test_loss: 2.2954, test_f1: 0.5411
 epoch: 68, train_loss: 0.2557, test_loss: 2.4027, test_f1: 0.5317
 epoch: 69, train_loss: 0.2586, test_loss: 2.1895, test_f1: 0.5236
 epoch: 70, train_loss: 0.2619, test_loss: 2.4401, test_f1: 0.5256
 epoch: 71, train_loss: 0.2462, test_loss: 2.4384, test_f1: 0.5275
 epoch: 72, train_loss: 0.2474, test_loss: 2.4423, test_f1: 0.5384
 epoch: 73, train_loss: 0.2604, test_loss: 2.3592, test_f1: 0.5307
 epoch: 74, train_loss: 0.2347, test_loss: 2.4966, test_f1: 0.5197
 epoch: 75, train_loss: 0.2608, test_loss: 2.3164, test_f1: 0.5470
 epoch: 76, train_loss: 0.2431, test_loss: 2.4795, test_f1: 0.5380
 epoch: 77, train_loss: 0.2443, test_loss: 2.3442, test_f1: 0.5593
 epoch: 78, train_loss: 0.2388, test_loss: 2.4886, test_f1: 0.5561
 epoch: 79, train_loss: 0.2528, test_loss: 2.4756, test_f1: 0.5044
 epoch: 80, train_loss: 0.2454, test_loss: 2.3773, test_f1: 0.5160
 epoch: 81, train_loss: 0.2335, test_loss: 2.4720, test_f1: 0.5172
 epoch: 82, train_loss: 0.2353, test_loss: 2.6216, test_f1: 0.5328
 epoch: 83, train_loss: 0.2208, test_loss: 2.6116, test_f1: 0.5402
 epoch: 84, train_loss: 0.2249, test_loss: 2.6224, test_f1: 0.5198
 epoch: 85, train_loss: 0.2196, test_loss: 2.5788, test_f1: 0.5246
 epoch: 86, train_loss: 0.2233, test_loss: 2.5406, test_f1: 0.5457
 epoch: 87, train_loss: 0.2159, test_loss: 2.4786, test_f1: 0.5424
 epoch: 88, train_loss: 0.2130, test_loss: 2.6800, test_f1: 0.5279
 epoch: 89, train_loss: 0.2137, test_loss: 2.6893, test_f1: 0.5337
 epoch: 90, train_loss: 0.2232, test_loss: 2.5473, test_f1: 0.5462
 epoch: 91, train_loss: 0.2083, test_loss: 2.6061, test_f1: 0.5068
 epoch: 92, train_loss: 0.2136, test_loss: 2.7084, test_f1: 0.5505
 epoch: 93, train_loss: 0.1932, test_loss: 2.7273, test_f1: 0.5488
 epoch: 94, train_loss: 0.2049, test_loss: 2.6945, test_f1: 0.5378
 epoch: 95, train_loss: 0.2037, test_loss: 2.7415, test_f1: 0.5194
 epoch: 96, train_loss: 0.2141, test_loss: 2.6707, test_f1: 0.5493
 epoch: 97, train_loss: 0.2128, test_loss: 2.6453, test_f1: 0.5348
 epoch: 98, train_loss: 0.1920, test_loss: 2.7091, test_f1: 0.5292
 epoch: 99, train_loss: 0.2039, test_loss: 2.8535, test_f1: 0.5235
##################ITERATION #8 ****************************************
 epoch: 0, train_loss: 1.5849, test_loss: 1.3590, test_f1: 0.3320
 epoch: 1, train_loss: 1.2235, test_loss: 1.2425, test_f1: 0.3412
 epoch: 2, train_loss: 1.1285, test_loss: 1.1186, test_f1: 0.4513
 epoch: 3, train_loss: 1.0757, test_loss: 1.0886, test_f1: 0.4627
 epoch: 4, train_loss: 1.0289, test_loss: 1.0078, test_f1: 0.4925
 epoch: 5, train_loss: 0.9961, test_loss: 0.9888, test_f1: 0.5118
 epoch: 6, train_loss: 0.9700, test_loss: 0.9879, test_f1: 0.4924
 epoch: 7, train_loss: 0.9592, test_loss: 1.0055, test_f1: 0.4867
 epoch: 8, train_loss: 0.9277, test_loss: 1.0429, test_f1: 0.4850
 epoch: 9, train_loss: 0.9209, test_loss: 1.0468, test_f1: 0.4988
 epoch: 10, train_loss: 0.9043, test_loss: 1.0192, test_f1: 0.4961
 epoch: 11, train_loss: 0.8953, test_loss: 1.0348, test_f1: 0.4967
 epoch: 12, train_loss: 0.8552, test_loss: 1.0054, test_f1: 0.5320
 epoch: 13, train_loss: 0.8514, test_loss: 1.0501, test_f1: 0.5120
 epoch: 14, train_loss: 0.8507, test_loss: 0.9991, test_f1: 0.5140
 epoch: 15, train_loss: 0.8256, test_loss: 1.0689, test_f1: 0.5036
 epoch: 16, train_loss: 0.8171, test_loss: 1.0692, test_f1: 0.5198
 epoch: 17, train_loss: 0.7991, test_loss: 1.0705, test_f1: 0.5051
 epoch: 18, train_loss: 0.7782, test_loss: 1.2259, test_f1: 0.4944
 epoch: 19, train_loss: 0.7667, test_loss: 1.2200, test_f1: 0.5081
 epoch: 20, train_loss: 0.7403, test_loss: 1.0588, test_f1: 0.5541
 epoch: 21, train_loss: 0.7354, test_loss: 1.1225, test_f1: 0.5197
 epoch: 22, train_loss: 0.7135, test_loss: 1.0946, test_f1: 0.5284
 epoch: 23, train_loss: 0.7210, test_loss: 1.2245, test_f1: 0.5267
 epoch: 24, train_loss: 0.7032, test_loss: 1.1374, test_f1: 0.5357
 epoch: 25, train_loss: 0.6962, test_loss: 1.1342, test_f1: 0.5397
 epoch: 26, train_loss: 0.6865, test_loss: 1.1786, test_f1: 0.5090
 epoch: 27, train_loss: 0.6667, test_loss: 1.2370, test_f1: 0.5117
 epoch: 28, train_loss: 0.6554, test_loss: 1.2702, test_f1: 0.5355
 epoch: 29, train_loss: 0.6697, test_loss: 1.2251, test_f1: 0.5325
 epoch: 30, train_loss: 0.6624, test_loss: 1.1171, test_f1: 0.5575
 epoch: 31, train_loss: 0.6238, test_loss: 1.1688, test_f1: 0.5277
 epoch: 32, train_loss: 0.6292, test_loss: 1.1882, test_f1: 0.5571
 epoch: 33, train_loss: 0.6311, test_loss: 1.3124, test_f1: 0.5245
 epoch: 34, train_loss: 0.6128, test_loss: 1.1789, test_f1: 0.5405
 epoch: 35, train_loss: 0.5938, test_loss: 1.2489, test_f1: 0.5395
 epoch: 36, train_loss: 0.5694, test_loss: 1.3319, test_f1: 0.5402
 epoch: 37, train_loss: 0.5653, test_loss: 1.3339, test_f1: 0.5627
 epoch: 38, train_loss: 0.5999, test_loss: 1.4105, test_f1: 0.5482
 epoch: 39, train_loss: 0.5871, test_loss: 1.2389, test_f1: 0.5405
 epoch: 40, train_loss: 0.5511, test_loss: 1.3770, test_f1: 0.5391
 epoch: 41, train_loss: 0.5349, test_loss: 1.2893, test_f1: 0.5732
 epoch: 42, train_loss: 0.5630, test_loss: 1.4701, test_f1: 0.5008
 epoch: 43, train_loss: 0.5308, test_loss: 1.4262, test_f1: 0.5223
 epoch: 44, train_loss: 0.5350, test_loss: 1.4387, test_f1: 0.5561
 epoch: 45, train_loss: 0.5226, test_loss: 1.3889, test_f1: 0.5551
 epoch: 46, train_loss: 0.5294, test_loss: 1.5263, test_f1: 0.5208
 epoch: 47, train_loss: 0.4942, test_loss: 1.3058, test_f1: 0.5873
 epoch: 48, train_loss: 0.4972, test_loss: 1.6820, test_f1: 0.5402
 epoch: 49, train_loss: 0.5008, test_loss: 1.4173, test_f1: 0.5291
 epoch: 50, train_loss: 0.5095, test_loss: 1.4212, test_f1: 0.5611
 epoch: 51, train_loss: 0.4536, test_loss: 1.4385, test_f1: 0.5629
 epoch: 52, train_loss: 0.4079, test_loss: 1.4969, test_f1: 0.5448
 epoch: 53, train_loss: 0.3780, test_loss: 1.5760, test_f1: 0.5591
 epoch: 54, train_loss: 0.4001, test_loss: 1.6735, test_f1: 0.5391
 epoch: 55, train_loss: 0.3689, test_loss: 1.6086, test_f1: 0.5584
 epoch: 56, train_loss: 0.3559, test_loss: 1.8134, test_f1: 0.5467
 epoch: 57, train_loss: 0.3679, test_loss: 1.8939, test_f1: 0.5194
 epoch: 58, train_loss: 0.3716, test_loss: 1.6659, test_f1: 0.5753
 epoch: 59, train_loss: 0.3666, test_loss: 1.6863, test_f1: 0.5376
 epoch: 60, train_loss: 0.3445, test_loss: 1.6463, test_f1: 0.5712
 epoch: 61, train_loss: 0.3387, test_loss: 1.6635, test_f1: 0.5561
 epoch: 62, train_loss: 0.3372, test_loss: 1.8281, test_f1: 0.5401
 epoch: 63, train_loss: 0.3309, test_loss: 1.8730, test_f1: 0.5463
 epoch: 64, train_loss: 0.3322, test_loss: 1.8281, test_f1: 0.5248
 epoch: 65, train_loss: 0.3237, test_loss: 1.7915, test_f1: 0.5612
 epoch: 66, train_loss: 0.3272, test_loss: 1.8954, test_f1: 0.5469
 epoch: 67, train_loss: 0.3075, test_loss: 1.8845, test_f1: 0.5163
 epoch: 68, train_loss: 0.3313, test_loss: 2.0229, test_f1: 0.5389
 epoch: 69, train_loss: 0.3255, test_loss: 1.9226, test_f1: 0.5396
 epoch: 70, train_loss: 0.3054, test_loss: 1.9463, test_f1: 0.5409
 epoch: 71, train_loss: 0.3081, test_loss: 1.8101, test_f1: 0.5349
 epoch: 72, train_loss: 0.3121, test_loss: 1.7860, test_f1: 0.5493
 epoch: 73, train_loss: 0.3012, test_loss: 2.0949, test_f1: 0.5249
 epoch: 74, train_loss: 0.3008, test_loss: 1.8825, test_f1: 0.5398
 epoch: 75, train_loss: 0.2985, test_loss: 2.0062, test_f1: 0.5244
 epoch: 76, train_loss: 0.2762, test_loss: 1.9884, test_f1: 0.5296
 epoch: 77, train_loss: 0.2609, test_loss: 1.9850, test_f1: 0.5506
 epoch: 78, train_loss: 0.2749, test_loss: 1.9938, test_f1: 0.5378
 epoch: 79, train_loss: 0.2749, test_loss: 2.2310, test_f1: 0.5497
 epoch: 80, train_loss: 0.2761, test_loss: 2.0972, test_f1: 0.5313
 epoch: 81, train_loss: 0.2973, test_loss: 2.2697, test_f1: 0.5237
 epoch: 82, train_loss: 0.3016, test_loss: 1.9708, test_f1: 0.5575
 epoch: 83, train_loss: 0.2750, test_loss: 2.0529, test_f1: 0.5511
 epoch: 84, train_loss: 0.2660, test_loss: 2.0406, test_f1: 0.5438
 epoch: 85, train_loss: 0.2734, test_loss: 2.1711, test_f1: 0.5207
 epoch: 86, train_loss: 0.2772, test_loss: 2.0307, test_f1: 0.5364
 epoch: 87, train_loss: 0.2551, test_loss: 2.3694, test_f1: 0.5272
 epoch: 88, train_loss: 0.2501, test_loss: 2.2429, test_f1: 0.5417
 epoch: 89, train_loss: 0.2302, test_loss: 2.1653, test_f1: 0.5251
 epoch: 90, train_loss: 0.2430, test_loss: 2.3285, test_f1: 0.5366
 epoch: 91, train_loss: 0.2307, test_loss: 2.2088, test_f1: 0.5399
 epoch: 92, train_loss: 0.2595, test_loss: 2.5804, test_f1: 0.5220
 epoch: 93, train_loss: 0.2693, test_loss: 2.1885, test_f1: 0.5476
 epoch: 94, train_loss: 0.2617, test_loss: 2.1492, test_f1: 0.5489
 epoch: 95, train_loss: 0.2525, test_loss: 2.2704, test_f1: 0.5370
 epoch: 96, train_loss: 0.2363, test_loss: 2.0755, test_f1: 0.5788
 epoch: 97, train_loss: 0.2348, test_loss: 2.4345, test_f1: 0.5346
 epoch: 98, train_loss: 0.2286, test_loss: 2.3996, test_f1: 0.5334
 epoch: 99, train_loss: 0.2200, test_loss: 2.2480, test_f1: 0.5350
##################ITERATION #9 ****************************************
 epoch: 0, train_loss: 1.6296, test_loss: 1.3242, test_f1: 0.2589
 epoch: 1, train_loss: 1.2567, test_loss: 1.2083, test_f1: 0.3262
 epoch: 2, train_loss: 1.1279, test_loss: 1.1410, test_f1: 0.4211
 epoch: 3, train_loss: 1.0900, test_loss: 1.1038, test_f1: 0.4466
 epoch: 4, train_loss: 1.0569, test_loss: 1.0958, test_f1: 0.4529
 epoch: 5, train_loss: 1.0402, test_loss: 1.0237, test_f1: 0.4604
 epoch: 6, train_loss: 0.9919, test_loss: 1.0381, test_f1: 0.4346
 epoch: 7, train_loss: 0.9635, test_loss: 1.0364, test_f1: 0.4675
 epoch: 8, train_loss: 0.9389, test_loss: 1.1086, test_f1: 0.4802
 epoch: 9, train_loss: 0.9145, test_loss: 1.0402, test_f1: 0.4811
 epoch: 10, train_loss: 0.8949, test_loss: 1.0131, test_f1: 0.5043
 epoch: 11, train_loss: 0.8875, test_loss: 0.9820, test_f1: 0.5588
 epoch: 12, train_loss: 0.8526, test_loss: 0.9697, test_f1: 0.5351
 epoch: 13, train_loss: 0.8429, test_loss: 0.9818, test_f1: 0.5240
 epoch: 14, train_loss: 0.8326, test_loss: 1.0903, test_f1: 0.4698
 epoch: 15, train_loss: 0.8276, test_loss: 1.0089, test_f1: 0.5302
 epoch: 16, train_loss: 0.7844, test_loss: 0.9853, test_f1: 0.5215
 epoch: 17, train_loss: 0.7892, test_loss: 1.0038, test_f1: 0.5356
 epoch: 18, train_loss: 0.7589, test_loss: 1.0136, test_f1: 0.5240
 epoch: 19, train_loss: 0.7262, test_loss: 0.9995, test_f1: 0.5296
 epoch: 20, train_loss: 0.7165, test_loss: 1.0515, test_f1: 0.5188
 epoch: 21, train_loss: 0.7060, test_loss: 1.0961, test_f1: 0.5081
 epoch: 22, train_loss: 0.7044, test_loss: 1.1589, test_f1: 0.5379
 epoch: 23, train_loss: 0.6973, test_loss: 1.1684, test_f1: 0.4953
 epoch: 24, train_loss: 0.6832, test_loss: 1.1699, test_f1: 0.4935
 epoch: 25, train_loss: 0.6727, test_loss: 1.1292, test_f1: 0.4990
 epoch: 26, train_loss: 0.6479, test_loss: 1.2125, test_f1: 0.4780
 epoch: 27, train_loss: 0.6683, test_loss: 1.2030, test_f1: 0.5125
 epoch: 28, train_loss: 0.6534, test_loss: 1.2152, test_f1: 0.5265
 epoch: 29, train_loss: 0.6435, test_loss: 1.2611, test_f1: 0.4898
 epoch: 30, train_loss: 0.6286, test_loss: 1.2096, test_f1: 0.5154
 epoch: 31, train_loss: 0.6426, test_loss: 1.3174, test_f1: 0.4901
 epoch: 32, train_loss: 0.6207, test_loss: 1.3739, test_f1: 0.5181
 epoch: 33, train_loss: 0.5992, test_loss: 1.3368, test_f1: 0.5171
 epoch: 34, train_loss: 0.5852, test_loss: 1.2867, test_f1: 0.5124
 epoch: 35, train_loss: 0.6007, test_loss: 1.3396, test_f1: 0.5367
 epoch: 36, train_loss: 0.5945, test_loss: 1.4063, test_f1: 0.4977
 epoch: 37, train_loss: 0.5746, test_loss: 1.4091, test_f1: 0.5095
 epoch: 38, train_loss: 0.5494, test_loss: 1.2992, test_f1: 0.5158
 epoch: 39, train_loss: 0.5439, test_loss: 1.3433, test_f1: 0.5279
 epoch: 40, train_loss: 0.5419, test_loss: 1.4133, test_f1: 0.5080
 epoch: 41, train_loss: 0.5343, test_loss: 1.4356, test_f1: 0.5080
 epoch: 42, train_loss: 0.5413, test_loss: 1.3307, test_f1: 0.5160
 epoch: 43, train_loss: 0.5278, test_loss: 1.5973, test_f1: 0.4894
 epoch: 44, train_loss: 0.5189, test_loss: 1.4735, test_f1: 0.5281
 epoch: 45, train_loss: 0.5298, test_loss: 1.6049, test_f1: 0.5158
 epoch: 46, train_loss: 0.5054, test_loss: 1.4142, test_f1: 0.5380
 epoch: 47, train_loss: 0.4782, test_loss: 1.6335, test_f1: 0.5197
 epoch: 48, train_loss: 0.4879, test_loss: 1.7052, test_f1: 0.5126
 epoch: 49, train_loss: 0.4738, test_loss: 1.4676, test_f1: 0.5300
 epoch: 50, train_loss: 0.4655, test_loss: 1.7584, test_f1: 0.5125
 epoch: 51, train_loss: 0.4461, test_loss: 1.6011, test_f1: 0.5210
 epoch: 52, train_loss: 0.4075, test_loss: 1.8273, test_f1: 0.5268
 epoch: 53, train_loss: 0.3854, test_loss: 1.7898, test_f1: 0.5152
 epoch: 54, train_loss: 0.3751, test_loss: 1.8035, test_f1: 0.5176
 epoch: 55, train_loss: 0.3606, test_loss: 1.7439, test_f1: 0.5117
 epoch: 56, train_loss: 0.3716, test_loss: 1.8552, test_f1: 0.5263
 epoch: 57, train_loss: 0.3641, test_loss: 1.7838, test_f1: 0.5092
 epoch: 58, train_loss: 0.3520, test_loss: 1.9266, test_f1: 0.5094
 epoch: 59, train_loss: 0.3780, test_loss: 1.9357, test_f1: 0.5157
 epoch: 60, train_loss: 0.3740, test_loss: 1.8897, test_f1: 0.5149
 epoch: 61, train_loss: 0.3469, test_loss: 1.7236, test_f1: 0.5398
 epoch: 62, train_loss: 0.3359, test_loss: 1.9107, test_f1: 0.5186
 epoch: 63, train_loss: 0.3330, test_loss: 2.0623, test_f1: 0.5243
 epoch: 64, train_loss: 0.3253, test_loss: 1.9751, test_f1: 0.5202
 epoch: 65, train_loss: 0.3080, test_loss: 1.9564, test_f1: 0.5313
 epoch: 66, train_loss: 0.3108, test_loss: 2.0128, test_f1: 0.5295
 epoch: 67, train_loss: 0.3093, test_loss: 2.0817, test_f1: 0.5208
 epoch: 68, train_loss: 0.2964, test_loss: 2.0820, test_f1: 0.5194
 epoch: 69, train_loss: 0.3144, test_loss: 2.0665, test_f1: 0.5019
 epoch: 70, train_loss: 0.3011, test_loss: 2.1626, test_f1: 0.5243
 epoch: 71, train_loss: 0.3081, test_loss: 2.0907, test_f1: 0.5137
 epoch: 72, train_loss: 0.3015, test_loss: 2.2072, test_f1: 0.5148
 epoch: 73, train_loss: 0.2869, test_loss: 2.1998, test_f1: 0.5352
 epoch: 74, train_loss: 0.2852, test_loss: 2.1476, test_f1: 0.5247
 epoch: 75, train_loss: 0.2938, test_loss: 2.1660, test_f1: 0.5199
 epoch: 76, train_loss: 0.2953, test_loss: 2.1632, test_f1: 0.5103
 epoch: 77, train_loss: 0.2919, test_loss: 2.2810, test_f1: 0.5190
 epoch: 78, train_loss: 0.2640, test_loss: 2.1516, test_f1: 0.5393
 epoch: 79, train_loss: 0.2809, test_loss: 2.2370, test_f1: 0.5283
 epoch: 80, train_loss: 0.2786, test_loss: 2.3239, test_f1: 0.5193
 epoch: 81, train_loss: 0.2674, test_loss: 2.3352, test_f1: 0.5204
 epoch: 82, train_loss: 0.2687, test_loss: 2.4004, test_f1: 0.5331
 epoch: 83, train_loss: 0.2618, test_loss: 2.2282, test_f1: 0.5314
 epoch: 84, train_loss: 0.2775, test_loss: 2.3541, test_f1: 0.5177
 epoch: 85, train_loss: 0.2571, test_loss: 2.2183, test_f1: 0.5528
 epoch: 86, train_loss: 0.2698, test_loss: 2.2707, test_f1: 0.5414
 epoch: 87, train_loss: 0.2514, test_loss: 2.5255, test_f1: 0.5026
 epoch: 88, train_loss: 0.2580, test_loss: 2.4403, test_f1: 0.5229
 epoch: 89, train_loss: 0.2452, test_loss: 2.4728, test_f1: 0.5310
 epoch: 90, train_loss: 0.2452, test_loss: 2.3420, test_f1: 0.5298
 epoch: 91, train_loss: 0.2375, test_loss: 2.4444, test_f1: 0.4883
 epoch: 92, train_loss: 0.2466, test_loss: 2.2820, test_f1: 0.5327
 epoch: 93, train_loss: 0.2562, test_loss: 2.4360, test_f1: 0.5293
 epoch: 94, train_loss: 0.2457, test_loss: 2.4027, test_f1: 0.5331
 epoch: 95, train_loss: 0.2443, test_loss: 2.4953, test_f1: 0.5184
 epoch: 96, train_loss: 0.2454, test_loss: 2.4543, test_f1: 0.5276
 epoch: 97, train_loss: 0.2146, test_loss: 2.4123, test_f1: 0.5221
 epoch: 98, train_loss: 0.2324, test_loss: 2.6107, test_f1: 0.5165
 epoch: 99, train_loss: 0.2283, test_loss: 2.5155, test_f1: 0.5490

Training completed in 418.69 seconds
Best F1: 0.5873 at epoch 47
Mean F1 across iterations: 0.5723  0.0117
========================FINAL RESULTS================================
FEGIN weighted F1: 0.5873  0.0117
python main.py --data ltspice_examples --representation component_component --model FEGIN --layers 5 --hiddens 128 --batch_size 256 --lr 0.001 --emb_size 512 --epochs 100 --save_appendix component_component_L5_H128_BS256_LR0.001_E512 --no_val
-----



STDERR:
  File "main.py", line 370, in <module>
    main()
  File "main.py", line 254, in main
    dataset = dataset_class(
  File "/home/philip/projects/ltspice_examples_code_repo/Circuit-Completion-Using-GNNs/component_classification_with_link_prediction_head/evaluation/FEGIN/kernel/circuit_datasets.py", line 15, in __init__
    self.data, self.slices = torch.load(self.processed_paths[0])
  File "/home/philip/.local/lib/python3.8/site-packages/torch/serialization.py", line 1040, in load
    warnings.warn(
  File "/usr/lib/python3.8/warnings.py", line 109, in _showwarnmsg
    sw(msg.message, msg.category, msg.filename, msg.lineno,
  File "main.py", line 47, in warn_with_traceback
    traceback.print_stack(file=log)
/home/philip/projects/ltspice_examples_code_repo/Circuit-Completion-Using-GNNs/component_classification_with_link_prediction_head/evaluation/FEGIN/kernel/circuit_datasets.py:15: FutureWarning: You are using `torch.load` with `weights_only=False` (the current default value), which uses the default pickle module implicitly. It is possible to construct malicious pickle data which will execute arbitrary code during unpickling (See https://github.com/pytorch/pytorch/blob/main/SECURITY.md#untrusted-models for more details). In a future release, the default value for `weights_only` will be flipped to `True`. This limits the functions that could be executed during unpickling. Arbitrary objects will no longer be allowed to be loaded via this mode unless they are explicitly allowlisted by the user via `torch.serialization.add_safe_globals`. We recommend you start setting `weights_only=True` for any use case where you don't have full control of the loaded file. Please open an issue on GitHub for any issues related to this experimental feature.
  self.data, self.slices = torch.load(self.processed_paths[0])
