STDOUT:
Results will be saved in /home/philip/projects/ltspice_examples_code_repo/Circuit-Completion-Using-GNNs/component_classification_with_link_prediction_head/evaluation/FEGIN/results/model_FEGIN_dataset_ltspice_examples
Command line input: python main.py --data ltspice_examples --representation component_pin --model FEGIN --layers 6 --hiddens 16 --batch_size 256 --lr 0.0001 --emb_size 512 --epochs 100 --save_appendix component_pin_L6_H16_BS256_LR0.0001_E512 --no_val
 is saved.
-----
ltspice_examples - FEGIN
Using 6 layers, 16 hidden units, h = 2
Loading component_pin representation dataset
ENTERED
Training FEGIN on component_pin representation
Train: 3560, Test: 848
##################ITERATION #0 ****************************************
 epoch: 0, train_loss: 1.4665, test_loss: 1.4547, test_f1: 0.0789
 epoch: 1, train_loss: 1.4638, test_loss: 1.4529, test_f1: 0.0789
 epoch: 2, train_loss: 1.4622, test_loss: 1.4514, test_f1: 0.0789
 epoch: 3, train_loss: 1.4605, test_loss: 1.4498, test_f1: 0.0789
 epoch: 4, train_loss: 1.4590, test_loss: 1.4484, test_f1: 0.0789
 epoch: 5, train_loss: 1.4574, test_loss: 1.4468, test_f1: 0.0789
 epoch: 6, train_loss: 1.4557, test_loss: 1.4452, test_f1: 0.0789
 epoch: 7, train_loss: 1.4541, test_loss: 1.4436, test_f1: 0.0789
 epoch: 8, train_loss: 1.4526, test_loss: 1.4421, test_f1: 0.0789
 epoch: 9, train_loss: 1.4508, test_loss: 1.4407, test_f1: 0.0789
 epoch: 10, train_loss: 1.4493, test_loss: 1.4394, test_f1: 0.0789
 epoch: 11, train_loss: 1.4478, test_loss: 1.4380, test_f1: 0.0789
 epoch: 12, train_loss: 1.4465, test_loss: 1.4365, test_f1: 0.0789
 epoch: 13, train_loss: 1.4449, test_loss: 1.4353, test_f1: 0.0789
 epoch: 14, train_loss: 1.4430, test_loss: 1.4337, test_f1: 0.0789
 epoch: 15, train_loss: 1.4413, test_loss: 1.4322, test_f1: 0.0789
 epoch: 16, train_loss: 1.4398, test_loss: 1.4307, test_f1: 0.0789
 epoch: 17, train_loss: 1.4381, test_loss: 1.4291, test_f1: 0.0789
 epoch: 18, train_loss: 1.4366, test_loss: 1.4277, test_f1: 0.0789
 epoch: 19, train_loss: 1.4349, test_loss: 1.4261, test_f1: 0.0789
 epoch: 20, train_loss: 1.4329, test_loss: 1.4246, test_f1: 0.0789
 epoch: 21, train_loss: 1.4315, test_loss: 1.4231, test_f1: 0.0789
 epoch: 22, train_loss: 1.4297, test_loss: 1.4215, test_f1: 0.0791
 epoch: 23, train_loss: 1.4284, test_loss: 1.4197, test_f1: 0.0794
 epoch: 24, train_loss: 1.4269, test_loss: 1.4183, test_f1: 0.0794
 epoch: 25, train_loss: 1.4249, test_loss: 1.4164, test_f1: 0.0829
 epoch: 26, train_loss: 1.4238, test_loss: 1.4149, test_f1: 0.0997
 epoch: 27, train_loss: 1.4214, test_loss: 1.4131, test_f1: 0.1108
 epoch: 28, train_loss: 1.4193, test_loss: 1.4114, test_f1: 0.1395
 epoch: 29, train_loss: 1.4173, test_loss: 1.4093, test_f1: 0.1563
 epoch: 30, train_loss: 1.4155, test_loss: 1.4073, test_f1: 0.1679
 epoch: 31, train_loss: 1.4129, test_loss: 1.4050, test_f1: 0.1685
 epoch: 32, train_loss: 1.4109, test_loss: 1.4025, test_f1: 0.1726
 epoch: 33, train_loss: 1.4080, test_loss: 1.3999, test_f1: 0.1861
 epoch: 34, train_loss: 1.4060, test_loss: 1.3970, test_f1: 0.1945
 epoch: 35, train_loss: 1.4012, test_loss: 1.3936, test_f1: 0.2004
 epoch: 36, train_loss: 1.3985, test_loss: 1.3903, test_f1: 0.2051
 epoch: 37, train_loss: 1.3936, test_loss: 1.3866, test_f1: 0.2026
 epoch: 38, train_loss: 1.3918, test_loss: 1.3828, test_f1: 0.1981
 epoch: 39, train_loss: 1.3866, test_loss: 1.3783, test_f1: 0.1966
 epoch: 40, train_loss: 1.3833, test_loss: 1.3741, test_f1: 0.1987
 epoch: 41, train_loss: 1.3778, test_loss: 1.3685, test_f1: 0.2011
 epoch: 42, train_loss: 1.3722, test_loss: 1.3633, test_f1: 0.1989
 epoch: 43, train_loss: 1.3663, test_loss: 1.3578, test_f1: 0.2013
 epoch: 44, train_loss: 1.3627, test_loss: 1.3527, test_f1: 0.2099
 epoch: 45, train_loss: 1.3554, test_loss: 1.3472, test_f1: 0.2507
 epoch: 46, train_loss: 1.3505, test_loss: 1.3411, test_f1: 0.2821
 epoch: 47, train_loss: 1.3454, test_loss: 1.3339, test_f1: 0.3070
 epoch: 48, train_loss: 1.3369, test_loss: 1.3277, test_f1: 0.2994
 epoch: 49, train_loss: 1.3343, test_loss: 1.3210, test_f1: 0.3085
 epoch: 50, train_loss: 1.3251, test_loss: 1.3148, test_f1: 0.3194
 epoch: 51, train_loss: 1.3211, test_loss: 1.3116, test_f1: 0.3133
 epoch: 52, train_loss: 1.3154, test_loss: 1.3087, test_f1: 0.3042
 epoch: 53, train_loss: 1.3183, test_loss: 1.3054, test_f1: 0.3119
 epoch: 54, train_loss: 1.3145, test_loss: 1.3022, test_f1: 0.3132
 epoch: 55, train_loss: 1.3140, test_loss: 1.2990, test_f1: 0.3049
 epoch: 56, train_loss: 1.3095, test_loss: 1.2961, test_f1: 0.3062
 epoch: 57, train_loss: 1.3044, test_loss: 1.2935, test_f1: 0.3068
 epoch: 58, train_loss: 1.3051, test_loss: 1.2908, test_f1: 0.3023
 epoch: 59, train_loss: 1.3020, test_loss: 1.2886, test_f1: 0.2876
 epoch: 60, train_loss: 1.2987, test_loss: 1.2858, test_f1: 0.2802
 epoch: 61, train_loss: 1.2963, test_loss: 1.2833, test_f1: 0.2768
 epoch: 62, train_loss: 1.2966, test_loss: 1.2813, test_f1: 0.2750
 epoch: 63, train_loss: 1.2955, test_loss: 1.2784, test_f1: 0.2742
 epoch: 64, train_loss: 1.2901, test_loss: 1.2758, test_f1: 0.2754
 epoch: 65, train_loss: 1.2877, test_loss: 1.2733, test_f1: 0.2732
 epoch: 66, train_loss: 1.2880, test_loss: 1.2714, test_f1: 0.2752
 epoch: 67, train_loss: 1.2832, test_loss: 1.2690, test_f1: 0.2746
 epoch: 68, train_loss: 1.2849, test_loss: 1.2671, test_f1: 0.2732
 epoch: 69, train_loss: 1.2836, test_loss: 1.2659, test_f1: 0.2714
 epoch: 70, train_loss: 1.2818, test_loss: 1.2639, test_f1: 0.2630
 epoch: 71, train_loss: 1.2795, test_loss: 1.2617, test_f1: 0.2439
 epoch: 72, train_loss: 1.2750, test_loss: 1.2599, test_f1: 0.2433
 epoch: 73, train_loss: 1.2758, test_loss: 1.2585, test_f1: 0.2396
 epoch: 74, train_loss: 1.2722, test_loss: 1.2563, test_f1: 0.2472
 epoch: 75, train_loss: 1.2733, test_loss: 1.2550, test_f1: 0.2398
 epoch: 76, train_loss: 1.2729, test_loss: 1.2535, test_f1: 0.2408
 epoch: 77, train_loss: 1.2692, test_loss: 1.2519, test_f1: 0.2445
 epoch: 78, train_loss: 1.2676, test_loss: 1.2498, test_f1: 0.2392
 epoch: 79, train_loss: 1.2672, test_loss: 1.2482, test_f1: 0.2388
 epoch: 80, train_loss: 1.2652, test_loss: 1.2471, test_f1: 0.2385
 epoch: 81, train_loss: 1.2580, test_loss: 1.2450, test_f1: 0.2355
 epoch: 82, train_loss: 1.2656, test_loss: 1.2437, test_f1: 0.2473
 epoch: 83, train_loss: 1.2640, test_loss: 1.2419, test_f1: 0.2490
 epoch: 84, train_loss: 1.2611, test_loss: 1.2408, test_f1: 0.2494
 epoch: 85, train_loss: 1.2616, test_loss: 1.2391, test_f1: 0.2496
 epoch: 86, train_loss: 1.2550, test_loss: 1.2381, test_f1: 0.2503
 epoch: 87, train_loss: 1.2556, test_loss: 1.2369, test_f1: 0.2525
 epoch: 88, train_loss: 1.2541, test_loss: 1.2357, test_f1: 0.2581
 epoch: 89, train_loss: 1.2488, test_loss: 1.2336, test_f1: 0.2634
 epoch: 90, train_loss: 1.2552, test_loss: 1.2329, test_f1: 0.2710
 epoch: 91, train_loss: 1.2504, test_loss: 1.2314, test_f1: 0.2676
 epoch: 92, train_loss: 1.2477, test_loss: 1.2305, test_f1: 0.2787
 epoch: 93, train_loss: 1.2504, test_loss: 1.2290, test_f1: 0.2785
 epoch: 94, train_loss: 1.2511, test_loss: 1.2282, test_f1: 0.2873
 epoch: 95, train_loss: 1.2483, test_loss: 1.2263, test_f1: 0.2917
 epoch: 96, train_loss: 1.2462, test_loss: 1.2251, test_f1: 0.2891
 epoch: 97, train_loss: 1.2394, test_loss: 1.2235, test_f1: 0.2938
 epoch: 98, train_loss: 1.2447, test_loss: 1.2222, test_f1: 0.3012
 epoch: 99, train_loss: 1.2423, test_loss: 1.2208, test_f1: 0.3032
##################ITERATION #1 ****************************************
 epoch: 0, train_loss: 1.4187, test_loss: 1.4119, test_f1: 0.0789
 epoch: 1, train_loss: 1.4160, test_loss: 1.4101, test_f1: 0.0789
 epoch: 2, train_loss: 1.4142, test_loss: 1.4080, test_f1: 0.0789
 epoch: 3, train_loss: 1.4126, test_loss: 1.4065, test_f1: 0.0789
 epoch: 4, train_loss: 1.4107, test_loss: 1.4046, test_f1: 0.0789
 epoch: 5, train_loss: 1.4084, test_loss: 1.4030, test_f1: 0.0789
 epoch: 6, train_loss: 1.4059, test_loss: 1.4012, test_f1: 0.0789
 epoch: 7, train_loss: 1.4021, test_loss: 1.3987, test_f1: 0.0789
 epoch: 8, train_loss: 1.3986, test_loss: 1.3958, test_f1: 0.0789
 epoch: 9, train_loss: 1.3953, test_loss: 1.3928, test_f1: 0.0789
 epoch: 10, train_loss: 1.3910, test_loss: 1.3891, test_f1: 0.0789
 epoch: 11, train_loss: 1.3880, test_loss: 1.3846, test_f1: 0.0789
 epoch: 12, train_loss: 1.3834, test_loss: 1.3801, test_f1: 0.0789
 epoch: 13, train_loss: 1.3778, test_loss: 1.3753, test_f1: 0.1506
 epoch: 14, train_loss: 1.3742, test_loss: 1.3708, test_f1: 0.2001
 epoch: 15, train_loss: 1.3672, test_loss: 1.3666, test_f1: 0.2596
 epoch: 16, train_loss: 1.3640, test_loss: 1.3625, test_f1: 0.2669
 epoch: 17, train_loss: 1.3596, test_loss: 1.3583, test_f1: 0.2663
 epoch: 18, train_loss: 1.3555, test_loss: 1.3540, test_f1: 0.2708
 epoch: 19, train_loss: 1.3506, test_loss: 1.3497, test_f1: 0.2731
 epoch: 20, train_loss: 1.3422, test_loss: 1.3450, test_f1: 0.2683
 epoch: 21, train_loss: 1.3369, test_loss: 1.3407, test_f1: 0.2702
 epoch: 22, train_loss: 1.3331, test_loss: 1.3361, test_f1: 0.2712
 epoch: 23, train_loss: 1.3294, test_loss: 1.3314, test_f1: 0.2754
 epoch: 24, train_loss: 1.3263, test_loss: 1.3265, test_f1: 0.2758
 epoch: 25, train_loss: 1.3207, test_loss: 1.3220, test_f1: 0.2665
 epoch: 26, train_loss: 1.3151, test_loss: 1.3173, test_f1: 0.2649
 epoch: 27, train_loss: 1.3079, test_loss: 1.3129, test_f1: 0.2698
 epoch: 28, train_loss: 1.3050, test_loss: 1.3093, test_f1: 0.2677
 epoch: 29, train_loss: 1.3031, test_loss: 1.3052, test_f1: 0.2633
 epoch: 30, train_loss: 1.2981, test_loss: 1.3013, test_f1: 0.2564
 epoch: 31, train_loss: 1.2933, test_loss: 1.2974, test_f1: 0.2571
 epoch: 32, train_loss: 1.2907, test_loss: 1.2942, test_f1: 0.2531
 epoch: 33, train_loss: 1.2874, test_loss: 1.2907, test_f1: 0.2502
 epoch: 34, train_loss: 1.2830, test_loss: 1.2864, test_f1: 0.2522
 epoch: 35, train_loss: 1.2798, test_loss: 1.2832, test_f1: 0.2318
 epoch: 36, train_loss: 1.2765, test_loss: 1.2806, test_f1: 0.2313
 epoch: 37, train_loss: 1.2734, test_loss: 1.2771, test_f1: 0.2312
 epoch: 38, train_loss: 1.2726, test_loss: 1.2735, test_f1: 0.2336
 epoch: 39, train_loss: 1.2670, test_loss: 1.2686, test_f1: 0.2337
 epoch: 40, train_loss: 1.2669, test_loss: 1.2648, test_f1: 0.2309
 epoch: 41, train_loss: 1.2670, test_loss: 1.2637, test_f1: 0.2331
 epoch: 42, train_loss: 1.2636, test_loss: 1.2612, test_f1: 0.2320
 epoch: 43, train_loss: 1.2617, test_loss: 1.2588, test_f1: 0.2317
 epoch: 44, train_loss: 1.2596, test_loss: 1.2555, test_f1: 0.2315
 epoch: 45, train_loss: 1.2533, test_loss: 1.2531, test_f1: 0.2317
 epoch: 46, train_loss: 1.2569, test_loss: 1.2510, test_f1: 0.2472
 epoch: 47, train_loss: 1.2537, test_loss: 1.2492, test_f1: 0.2323
 epoch: 48, train_loss: 1.2507, test_loss: 1.2473, test_f1: 0.2683
 epoch: 49, train_loss: 1.2517, test_loss: 1.2453, test_f1: 0.2457
 epoch: 50, train_loss: 1.2505, test_loss: 1.2423, test_f1: 0.2611
 epoch: 51, train_loss: 1.2481, test_loss: 1.2419, test_f1: 0.2588
 epoch: 52, train_loss: 1.2481, test_loss: 1.2410, test_f1: 0.2576
 epoch: 53, train_loss: 1.2435, test_loss: 1.2401, test_f1: 0.2607
 epoch: 54, train_loss: 1.2439, test_loss: 1.2399, test_f1: 0.2652
 epoch: 55, train_loss: 1.2430, test_loss: 1.2395, test_f1: 0.2644
 epoch: 56, train_loss: 1.2432, test_loss: 1.2385, test_f1: 0.2632
 epoch: 57, train_loss: 1.2425, test_loss: 1.2381, test_f1: 0.2631
 epoch: 58, train_loss: 1.2455, test_loss: 1.2368, test_f1: 0.2651
 epoch: 59, train_loss: 1.2397, test_loss: 1.2364, test_f1: 0.2649
 epoch: 60, train_loss: 1.2373, test_loss: 1.2357, test_f1: 0.2650
 epoch: 61, train_loss: 1.2376, test_loss: 1.2360, test_f1: 0.2648
 epoch: 62, train_loss: 1.2390, test_loss: 1.2348, test_f1: 0.2638
 epoch: 63, train_loss: 1.2374, test_loss: 1.2330, test_f1: 0.2654
 epoch: 64, train_loss: 1.2385, test_loss: 1.2328, test_f1: 0.2654
 epoch: 65, train_loss: 1.2350, test_loss: 1.2314, test_f1: 0.2649
 epoch: 66, train_loss: 1.2360, test_loss: 1.2307, test_f1: 0.2661
 epoch: 67, train_loss: 1.2358, test_loss: 1.2297, test_f1: 0.2710
 epoch: 68, train_loss: 1.2417, test_loss: 1.2299, test_f1: 0.2733
 epoch: 69, train_loss: 1.2301, test_loss: 1.2287, test_f1: 0.2723
 epoch: 70, train_loss: 1.2372, test_loss: 1.2281, test_f1: 0.2732
 epoch: 71, train_loss: 1.2343, test_loss: 1.2267, test_f1: 0.2737
 epoch: 72, train_loss: 1.2359, test_loss: 1.2264, test_f1: 0.2736
 epoch: 73, train_loss: 1.2343, test_loss: 1.2257, test_f1: 0.2767
 epoch: 74, train_loss: 1.2341, test_loss: 1.2251, test_f1: 0.2762
 epoch: 75, train_loss: 1.2312, test_loss: 1.2240, test_f1: 0.2732
 epoch: 76, train_loss: 1.2335, test_loss: 1.2242, test_f1: 0.2741
 epoch: 77, train_loss: 1.2267, test_loss: 1.2238, test_f1: 0.2746
 epoch: 78, train_loss: 1.2272, test_loss: 1.2236, test_f1: 0.2754
 epoch: 79, train_loss: 1.2326, test_loss: 1.2233, test_f1: 0.2743
 epoch: 80, train_loss: 1.2292, test_loss: 1.2221, test_f1: 0.2730
 epoch: 81, train_loss: 1.2269, test_loss: 1.2221, test_f1: 0.2747
 epoch: 82, train_loss: 1.2283, test_loss: 1.2206, test_f1: 0.2728
 epoch: 83, train_loss: 1.2278, test_loss: 1.2209, test_f1: 0.2740
 epoch: 84, train_loss: 1.2286, test_loss: 1.2197, test_f1: 0.2729
 epoch: 85, train_loss: 1.2281, test_loss: 1.2194, test_f1: 0.2732
 epoch: 86, train_loss: 1.2266, test_loss: 1.2187, test_f1: 0.2752
 epoch: 87, train_loss: 1.2286, test_loss: 1.2174, test_f1: 0.2703
 epoch: 88, train_loss: 1.2266, test_loss: 1.2163, test_f1: 0.2694
 epoch: 89, train_loss: 1.2277, test_loss: 1.2159, test_f1: 0.2704
 epoch: 90, train_loss: 1.2255, test_loss: 1.2153, test_f1: 0.2708
 epoch: 91, train_loss: 1.2256, test_loss: 1.2145, test_f1: 0.2681
 epoch: 92, train_loss: 1.2251, test_loss: 1.2147, test_f1: 0.2717
 epoch: 93, train_loss: 1.2264, test_loss: 1.2154, test_f1: 0.2727
 epoch: 94, train_loss: 1.2280, test_loss: 1.2166, test_f1: 0.2804
 epoch: 95, train_loss: 1.2250, test_loss: 1.2133, test_f1: 0.2729
 epoch: 96, train_loss: 1.2242, test_loss: 1.2132, test_f1: 0.2755
 epoch: 97, train_loss: 1.2198, test_loss: 1.2129, test_f1: 0.2773
 epoch: 98, train_loss: 1.2256, test_loss: 1.2142, test_f1: 0.2826
 epoch: 99, train_loss: 1.2164, test_loss: 1.2120, test_f1: 0.2782
##################ITERATION #2 ****************************************
 epoch: 0, train_loss: 1.3779, test_loss: 1.3781, test_f1: 0.0789
 epoch: 1, train_loss: 1.3743, test_loss: 1.3756, test_f1: 0.0789
 epoch: 2, train_loss: 1.3706, test_loss: 1.3724, test_f1: 0.1437
 epoch: 3, train_loss: 1.3684, test_loss: 1.3724, test_f1: 0.1768
 epoch: 4, train_loss: 1.3656, test_loss: 1.3694, test_f1: 0.2826
 epoch: 5, train_loss: 1.3632, test_loss: 1.3653, test_f1: 0.2644
 epoch: 6, train_loss: 1.3601, test_loss: 1.3606, test_f1: 0.2601
 epoch: 7, train_loss: 1.3563, test_loss: 1.3572, test_f1: 0.2389
 epoch: 8, train_loss: 1.3532, test_loss: 1.3539, test_f1: 0.2264
 epoch: 9, train_loss: 1.3499, test_loss: 1.3515, test_f1: 0.2262
 epoch: 10, train_loss: 1.3477, test_loss: 1.3485, test_f1: 0.2262
 epoch: 11, train_loss: 1.3451, test_loss: 1.3448, test_f1: 0.2262
 epoch: 12, train_loss: 1.3414, test_loss: 1.3418, test_f1: 0.2262
 epoch: 13, train_loss: 1.3374, test_loss: 1.3386, test_f1: 0.2262
 epoch: 14, train_loss: 1.3332, test_loss: 1.3356, test_f1: 0.2260
 epoch: 15, train_loss: 1.3317, test_loss: 1.3318, test_f1: 0.2260
 epoch: 16, train_loss: 1.3254, test_loss: 1.3278, test_f1: 0.2260
 epoch: 17, train_loss: 1.3209, test_loss: 1.3243, test_f1: 0.2260
 epoch: 18, train_loss: 1.3185, test_loss: 1.3200, test_f1: 0.2260
 epoch: 19, train_loss: 1.3129, test_loss: 1.3154, test_f1: 0.2260
 epoch: 20, train_loss: 1.3090, test_loss: 1.3115, test_f1: 0.2260
 epoch: 21, train_loss: 1.3043, test_loss: 1.3072, test_f1: 0.2260
 epoch: 22, train_loss: 1.2983, test_loss: 1.3016, test_f1: 0.2260
 epoch: 23, train_loss: 1.2928, test_loss: 1.2982, test_f1: 0.2260
 epoch: 24, train_loss: 1.2891, test_loss: 1.2933, test_f1: 0.2260
 epoch: 25, train_loss: 1.2832, test_loss: 1.2884, test_f1: 0.2260
 epoch: 26, train_loss: 1.2785, test_loss: 1.2834, test_f1: 0.2260
 epoch: 27, train_loss: 1.2740, test_loss: 1.2783, test_f1: 0.2260
 epoch: 28, train_loss: 1.2712, test_loss: 1.2743, test_f1: 0.2260
 epoch: 29, train_loss: 1.2665, test_loss: 1.2693, test_f1: 0.2260
 epoch: 30, train_loss: 1.2618, test_loss: 1.2644, test_f1: 0.2260
 epoch: 31, train_loss: 1.2597, test_loss: 1.2610, test_f1: 0.2260
 epoch: 32, train_loss: 1.2591, test_loss: 1.2571, test_f1: 0.2260
 epoch: 33, train_loss: 1.2532, test_loss: 1.2546, test_f1: 0.2260
 epoch: 34, train_loss: 1.2539, test_loss: 1.2505, test_f1: 0.2260
 epoch: 35, train_loss: 1.2492, test_loss: 1.2492, test_f1: 0.2260
 epoch: 36, train_loss: 1.2459, test_loss: 1.2462, test_f1: 0.2260
 epoch: 37, train_loss: 1.2425, test_loss: 1.2427, test_f1: 0.2260
 epoch: 38, train_loss: 1.2403, test_loss: 1.2401, test_f1: 0.2262
 epoch: 39, train_loss: 1.2398, test_loss: 1.2377, test_f1: 0.2262
 epoch: 40, train_loss: 1.2342, test_loss: 1.2342, test_f1: 0.2264
 epoch: 41, train_loss: 1.2327, test_loss: 1.2332, test_f1: 0.2262
 epoch: 42, train_loss: 1.2280, test_loss: 1.2300, test_f1: 0.2266
 epoch: 43, train_loss: 1.2266, test_loss: 1.2288, test_f1: 0.2262
 epoch: 44, train_loss: 1.2223, test_loss: 1.2248, test_f1: 0.2270
 epoch: 45, train_loss: 1.2186, test_loss: 1.2214, test_f1: 0.2295
 epoch: 46, train_loss: 1.2205, test_loss: 1.2185, test_f1: 0.2303
 epoch: 47, train_loss: 1.2202, test_loss: 1.2161, test_f1: 0.2299
 epoch: 48, train_loss: 1.2162, test_loss: 1.2142, test_f1: 0.2301
 epoch: 49, train_loss: 1.2129, test_loss: 1.2132, test_f1: 0.2327
 epoch: 50, train_loss: 1.2143, test_loss: 1.2130, test_f1: 0.2305
 epoch: 51, train_loss: 1.2109, test_loss: 1.2094, test_f1: 0.2331
 epoch: 52, train_loss: 1.2129, test_loss: 1.2085, test_f1: 0.2337
 epoch: 53, train_loss: 1.2075, test_loss: 1.2085, test_f1: 0.2337
 epoch: 54, train_loss: 1.2084, test_loss: 1.2067, test_f1: 0.2327
 epoch: 55, train_loss: 1.2107, test_loss: 1.2066, test_f1: 0.2335
 epoch: 56, train_loss: 1.2060, test_loss: 1.2050, test_f1: 0.2339
 epoch: 57, train_loss: 1.2035, test_loss: 1.2036, test_f1: 0.2339
 epoch: 58, train_loss: 1.2021, test_loss: 1.2026, test_f1: 0.2335
 epoch: 59, train_loss: 1.2083, test_loss: 1.2023, test_f1: 0.2341
 epoch: 60, train_loss: 1.2047, test_loss: 1.2009, test_f1: 0.2350
 epoch: 61, train_loss: 1.2001, test_loss: 1.2001, test_f1: 0.2350
 epoch: 62, train_loss: 1.2033, test_loss: 1.1996, test_f1: 0.2354
 epoch: 63, train_loss: 1.2022, test_loss: 1.1987, test_f1: 0.2354
 epoch: 64, train_loss: 1.1995, test_loss: 1.1976, test_f1: 0.2354
 epoch: 65, train_loss: 1.1988, test_loss: 1.1968, test_f1: 0.2352
 epoch: 66, train_loss: 1.1976, test_loss: 1.1964, test_f1: 0.2358
 epoch: 67, train_loss: 1.1979, test_loss: 1.1960, test_f1: 0.2360
 epoch: 68, train_loss: 1.1936, test_loss: 1.1949, test_f1: 0.2427
 epoch: 69, train_loss: 1.1914, test_loss: 1.1954, test_f1: 0.2504
 epoch: 70, train_loss: 1.2027, test_loss: 1.1951, test_f1: 0.2487
 epoch: 71, train_loss: 1.1927, test_loss: 1.1944, test_f1: 0.2465
 epoch: 72, train_loss: 1.1961, test_loss: 1.1932, test_f1: 0.2470
 epoch: 73, train_loss: 1.1951, test_loss: 1.1923, test_f1: 0.2473
 epoch: 74, train_loss: 1.1891, test_loss: 1.1918, test_f1: 0.2471
 epoch: 75, train_loss: 1.1895, test_loss: 1.1905, test_f1: 0.2481
 epoch: 76, train_loss: 1.1909, test_loss: 1.1899, test_f1: 0.2490
 epoch: 77, train_loss: 1.1894, test_loss: 1.1897, test_f1: 0.2478
 epoch: 78, train_loss: 1.1906, test_loss: 1.1888, test_f1: 0.2476
 epoch: 79, train_loss: 1.1852, test_loss: 1.1881, test_f1: 0.2497
 epoch: 80, train_loss: 1.1901, test_loss: 1.1869, test_f1: 0.2505
 epoch: 81, train_loss: 1.1857, test_loss: 1.1863, test_f1: 0.2509
 epoch: 82, train_loss: 1.1860, test_loss: 1.1853, test_f1: 0.2500
 epoch: 83, train_loss: 1.1827, test_loss: 1.1854, test_f1: 0.2511
 epoch: 84, train_loss: 1.1851, test_loss: 1.1843, test_f1: 0.2502
 epoch: 85, train_loss: 1.1839, test_loss: 1.1843, test_f1: 0.2508
 epoch: 86, train_loss: 1.1851, test_loss: 1.1836, test_f1: 0.2525
 epoch: 87, train_loss: 1.1855, test_loss: 1.1836, test_f1: 0.2505
 epoch: 88, train_loss: 1.1810, test_loss: 1.1831, test_f1: 0.2534
 epoch: 89, train_loss: 1.1811, test_loss: 1.1824, test_f1: 0.2622
 epoch: 90, train_loss: 1.1768, test_loss: 1.1818, test_f1: 0.2522
 epoch: 91, train_loss: 1.1807, test_loss: 1.1815, test_f1: 0.2515
 epoch: 92, train_loss: 1.1753, test_loss: 1.1811, test_f1: 0.2547
 epoch: 93, train_loss: 1.1766, test_loss: 1.1793, test_f1: 0.2678
 epoch: 94, train_loss: 1.1732, test_loss: 1.1794, test_f1: 0.2712
 epoch: 95, train_loss: 1.1782, test_loss: 1.1795, test_f1: 0.2784
 epoch: 96, train_loss: 1.1759, test_loss: 1.1783, test_f1: 0.2732
 epoch: 97, train_loss: 1.1758, test_loss: 1.1780, test_f1: 0.2736
 epoch: 98, train_loss: 1.1770, test_loss: 1.1769, test_f1: 0.2793
 epoch: 99, train_loss: 1.1753, test_loss: 1.1774, test_f1: 0.2837
##################ITERATION #3 ****************************************
 epoch: 0, train_loss: 1.3693, test_loss: 1.3706, test_f1: 0.2260
 epoch: 1, train_loss: 1.3654, test_loss: 1.3679, test_f1: 0.2260
 epoch: 2, train_loss: 1.3619, test_loss: 1.3659, test_f1: 0.2260
 epoch: 3, train_loss: 1.3594, test_loss: 1.3613, test_f1: 0.2260
 epoch: 4, train_loss: 1.3570, test_loss: 1.3594, test_f1: 0.2260
 epoch: 5, train_loss: 1.3543, test_loss: 1.3570, test_f1: 0.2260
 epoch: 6, train_loss: 1.3495, test_loss: 1.3526, test_f1: 0.2260
 epoch: 7, train_loss: 1.3463, test_loss: 1.3479, test_f1: 0.2260
 epoch: 8, train_loss: 1.3428, test_loss: 1.3438, test_f1: 0.2260
 epoch: 9, train_loss: 1.3391, test_loss: 1.3401, test_f1: 0.2260
 epoch: 10, train_loss: 1.3360, test_loss: 1.3362, test_f1: 0.2260
 epoch: 11, train_loss: 1.3310, test_loss: 1.3319, test_f1: 0.2260
 epoch: 12, train_loss: 1.3283, test_loss: 1.3270, test_f1: 0.2260
 epoch: 13, train_loss: 1.3223, test_loss: 1.3223, test_f1: 0.2260
 epoch: 14, train_loss: 1.3176, test_loss: 1.3183, test_f1: 0.2260
 epoch: 15, train_loss: 1.3135, test_loss: 1.3131, test_f1: 0.2260
 epoch: 16, train_loss: 1.3094, test_loss: 1.3084, test_f1: 0.2260
 epoch: 17, train_loss: 1.3044, test_loss: 1.3042, test_f1: 0.2260
 epoch: 18, train_loss: 1.3012, test_loss: 1.2994, test_f1: 0.2260
 epoch: 19, train_loss: 1.2954, test_loss: 1.2953, test_f1: 0.2260
 epoch: 20, train_loss: 1.2913, test_loss: 1.2912, test_f1: 0.2260
 epoch: 21, train_loss: 1.2871, test_loss: 1.2865, test_f1: 0.2260
 epoch: 22, train_loss: 1.2828, test_loss: 1.2817, test_f1: 0.2260
 epoch: 23, train_loss: 1.2816, test_loss: 1.2770, test_f1: 0.2260
 epoch: 24, train_loss: 1.2775, test_loss: 1.2735, test_f1: 0.2260
 epoch: 25, train_loss: 1.2752, test_loss: 1.2696, test_f1: 0.2260
 epoch: 26, train_loss: 1.2709, test_loss: 1.2655, test_f1: 0.2260
 epoch: 27, train_loss: 1.2688, test_loss: 1.2613, test_f1: 0.2260
 epoch: 28, train_loss: 1.2634, test_loss: 1.2578, test_f1: 0.2260
 epoch: 29, train_loss: 1.2637, test_loss: 1.2539, test_f1: 0.2260
 epoch: 30, train_loss: 1.2570, test_loss: 1.2511, test_f1: 0.2260
 epoch: 31, train_loss: 1.2554, test_loss: 1.2474, test_f1: 0.2260
 epoch: 32, train_loss: 1.2547, test_loss: 1.2454, test_f1: 0.2260
 epoch: 33, train_loss: 1.2549, test_loss: 1.2436, test_f1: 0.2260
 epoch: 34, train_loss: 1.2493, test_loss: 1.2400, test_f1: 0.2260
 epoch: 35, train_loss: 1.2464, test_loss: 1.2369, test_f1: 0.2260
 epoch: 36, train_loss: 1.2487, test_loss: 1.2348, test_f1: 0.2260
 epoch: 37, train_loss: 1.2443, test_loss: 1.2317, test_f1: 0.2260
 epoch: 38, train_loss: 1.2471, test_loss: 1.2307, test_f1: 0.2260
 epoch: 39, train_loss: 1.2387, test_loss: 1.2283, test_f1: 0.2260
 epoch: 40, train_loss: 1.2402, test_loss: 1.2266, test_f1: 0.2260
 epoch: 41, train_loss: 1.2382, test_loss: 1.2241, test_f1: 0.2260
 epoch: 42, train_loss: 1.2345, test_loss: 1.2223, test_f1: 0.2260
 epoch: 43, train_loss: 1.2363, test_loss: 1.2199, test_f1: 0.2260
 epoch: 44, train_loss: 1.2363, test_loss: 1.2181, test_f1: 0.2260
 epoch: 45, train_loss: 1.2349, test_loss: 1.2163, test_f1: 0.2260
 epoch: 46, train_loss: 1.2298, test_loss: 1.2140, test_f1: 0.2260
 epoch: 47, train_loss: 1.2334, test_loss: 1.2130, test_f1: 0.2260
 epoch: 48, train_loss: 1.2301, test_loss: 1.2117, test_f1: 0.2260
 epoch: 49, train_loss: 1.2277, test_loss: 1.2101, test_f1: 0.2260
 epoch: 50, train_loss: 1.2276, test_loss: 1.2076, test_f1: 0.2260
 epoch: 51, train_loss: 1.2271, test_loss: 1.2072, test_f1: 0.2260
 epoch: 52, train_loss: 1.2247, test_loss: 1.2067, test_f1: 0.2260
 epoch: 53, train_loss: 1.2229, test_loss: 1.2044, test_f1: 0.2260
 epoch: 54, train_loss: 1.2184, test_loss: 1.2041, test_f1: 0.2260
 epoch: 55, train_loss: 1.2215, test_loss: 1.2039, test_f1: 0.2260
 epoch: 56, train_loss: 1.2198, test_loss: 1.2022, test_f1: 0.2260
 epoch: 57, train_loss: 1.2191, test_loss: 1.2020, test_f1: 0.2260
 epoch: 58, train_loss: 1.2197, test_loss: 1.2014, test_f1: 0.2260
 epoch: 59, train_loss: 1.2166, test_loss: 1.2004, test_f1: 0.2260
 epoch: 60, train_loss: 1.2208, test_loss: 1.1995, test_f1: 0.2260
 epoch: 61, train_loss: 1.2197, test_loss: 1.1986, test_f1: 0.2260
 epoch: 62, train_loss: 1.2163, test_loss: 1.1980, test_f1: 0.2260
 epoch: 63, train_loss: 1.2184, test_loss: 1.1971, test_f1: 0.2260
 epoch: 64, train_loss: 1.2173, test_loss: 1.1966, test_f1: 0.2260
 epoch: 65, train_loss: 1.2140, test_loss: 1.1958, test_f1: 0.2260
 epoch: 66, train_loss: 1.2153, test_loss: 1.1950, test_f1: 0.2260
 epoch: 67, train_loss: 1.2142, test_loss: 1.1941, test_f1: 0.2260
 epoch: 68, train_loss: 1.2160, test_loss: 1.1934, test_f1: 0.2260
 epoch: 69, train_loss: 1.2128, test_loss: 1.1930, test_f1: 0.2260
 epoch: 70, train_loss: 1.2119, test_loss: 1.1923, test_f1: 0.2260
 epoch: 71, train_loss: 1.2129, test_loss: 1.1921, test_f1: 0.2260
 epoch: 72, train_loss: 1.2113, test_loss: 1.1909, test_f1: 0.2260
 epoch: 73, train_loss: 1.2126, test_loss: 1.1900, test_f1: 0.2260
 epoch: 74, train_loss: 1.2091, test_loss: 1.1897, test_f1: 0.2260
 epoch: 75, train_loss: 1.2086, test_loss: 1.1887, test_f1: 0.2260
 epoch: 76, train_loss: 1.2080, test_loss: 1.1884, test_f1: 0.2260
 epoch: 77, train_loss: 1.2083, test_loss: 1.1872, test_f1: 0.2260
 epoch: 78, train_loss: 1.2074, test_loss: 1.1862, test_f1: 0.2260
 epoch: 79, train_loss: 1.2067, test_loss: 1.1861, test_f1: 0.2260
 epoch: 80, train_loss: 1.2067, test_loss: 1.1860, test_f1: 0.2260
 epoch: 81, train_loss: 1.2047, test_loss: 1.1851, test_f1: 0.2260
 epoch: 82, train_loss: 1.1998, test_loss: 1.1842, test_f1: 0.2260
 epoch: 83, train_loss: 1.2017, test_loss: 1.1845, test_f1: 0.2260
 epoch: 84, train_loss: 1.2017, test_loss: 1.1828, test_f1: 0.2260
 epoch: 85, train_loss: 1.2035, test_loss: 1.1827, test_f1: 0.2260
 epoch: 86, train_loss: 1.2008, test_loss: 1.1814, test_f1: 0.2260
 epoch: 87, train_loss: 1.2029, test_loss: 1.1812, test_f1: 0.2260
 epoch: 88, train_loss: 1.2011, test_loss: 1.1806, test_f1: 0.2260
 epoch: 89, train_loss: 1.1970, test_loss: 1.1795, test_f1: 0.2260
 epoch: 90, train_loss: 1.2046, test_loss: 1.1791, test_f1: 0.2260
 epoch: 91, train_loss: 1.1983, test_loss: 1.1786, test_f1: 0.2260
 epoch: 92, train_loss: 1.2008, test_loss: 1.1783, test_f1: 0.2260
 epoch: 93, train_loss: 1.1992, test_loss: 1.1778, test_f1: 0.2260
 epoch: 94, train_loss: 1.1997, test_loss: 1.1772, test_f1: 0.2260
 epoch: 95, train_loss: 1.1962, test_loss: 1.1762, test_f1: 0.2260
 epoch: 96, train_loss: 1.1953, test_loss: 1.1756, test_f1: 0.2260
 epoch: 97, train_loss: 1.1955, test_loss: 1.1749, test_f1: 0.2260
 epoch: 98, train_loss: 1.1950, test_loss: 1.1745, test_f1: 0.2260
 epoch: 99, train_loss: 1.1922, test_loss: 1.1737, test_f1: 0.2260
##################ITERATION #4 ****************************************
 epoch: 0, train_loss: 1.3479, test_loss: 1.3616, test_f1: 0.2260
 epoch: 1, train_loss: 1.3421, test_loss: 1.3602, test_f1: 0.2260
 epoch: 2, train_loss: 1.3402, test_loss: 1.3566, test_f1: 0.2260
 epoch: 3, train_loss: 1.3352, test_loss: 1.3450, test_f1: 0.2260
 epoch: 4, train_loss: 1.3305, test_loss: 1.3348, test_f1: 0.2260
 epoch: 5, train_loss: 1.3276, test_loss: 1.3284, test_f1: 0.2260
 epoch: 6, train_loss: 1.3249, test_loss: 1.3248, test_f1: 0.2260
 epoch: 7, train_loss: 1.3204, test_loss: 1.3192, test_f1: 0.2260
 epoch: 8, train_loss: 1.3166, test_loss: 1.3145, test_f1: 0.2260
 epoch: 9, train_loss: 1.3117, test_loss: 1.3096, test_f1: 0.2260
 epoch: 10, train_loss: 1.3073, test_loss: 1.3050, test_f1: 0.2260
 epoch: 11, train_loss: 1.3042, test_loss: 1.3010, test_f1: 0.2260
 epoch: 12, train_loss: 1.2993, test_loss: 1.2975, test_f1: 0.2260
 epoch: 13, train_loss: 1.2966, test_loss: 1.2945, test_f1: 0.2260
 epoch: 14, train_loss: 1.2917, test_loss: 1.2893, test_f1: 0.2260
 epoch: 15, train_loss: 1.2875, test_loss: 1.2859, test_f1: 0.2260
 epoch: 16, train_loss: 1.2851, test_loss: 1.2815, test_f1: 0.2260
 epoch: 17, train_loss: 1.2808, test_loss: 1.2772, test_f1: 0.2260
 epoch: 18, train_loss: 1.2781, test_loss: 1.2734, test_f1: 0.2260
 epoch: 19, train_loss: 1.2753, test_loss: 1.2692, test_f1: 0.2260
 epoch: 20, train_loss: 1.2706, test_loss: 1.2651, test_f1: 0.2260
 epoch: 21, train_loss: 1.2671, test_loss: 1.2601, test_f1: 0.2260
 epoch: 22, train_loss: 1.2631, test_loss: 1.2557, test_f1: 0.2260
 epoch: 23, train_loss: 1.2550, test_loss: 1.2523, test_f1: 0.2260
 epoch: 24, train_loss: 1.2517, test_loss: 1.2466, test_f1: 0.2260
 epoch: 25, train_loss: 1.2516, test_loss: 1.2413, test_f1: 0.2260
 epoch: 26, train_loss: 1.2443, test_loss: 1.2368, test_f1: 0.2260
 epoch: 27, train_loss: 1.2427, test_loss: 1.2328, test_f1: 0.2260
 epoch: 28, train_loss: 1.2397, test_loss: 1.2284, test_f1: 0.2260
 epoch: 29, train_loss: 1.2358, test_loss: 1.2252, test_f1: 0.2260
 epoch: 30, train_loss: 1.2302, test_loss: 1.2207, test_f1: 0.2260
 epoch: 31, train_loss: 1.2314, test_loss: 1.2172, test_f1: 0.2260
 epoch: 32, train_loss: 1.2268, test_loss: 1.2163, test_f1: 0.2260
 epoch: 33, train_loss: 1.2224, test_loss: 1.2118, test_f1: 0.2260
 epoch: 34, train_loss: 1.2199, test_loss: 1.2079, test_f1: 0.2260
 epoch: 35, train_loss: 1.2223, test_loss: 1.2067, test_f1: 0.2260
 epoch: 36, train_loss: 1.2169, test_loss: 1.2042, test_f1: 0.2260
 epoch: 37, train_loss: 1.2158, test_loss: 1.2033, test_f1: 0.2260
 epoch: 38, train_loss: 1.2160, test_loss: 1.2000, test_f1: 0.2260
 epoch: 39, train_loss: 1.2137, test_loss: 1.1982, test_f1: 0.2260
 epoch: 40, train_loss: 1.2126, test_loss: 1.1964, test_f1: 0.2260
 epoch: 41, train_loss: 1.2099, test_loss: 1.1954, test_f1: 0.2260
 epoch: 42, train_loss: 1.2096, test_loss: 1.1939, test_f1: 0.2260
 epoch: 43, train_loss: 1.2084, test_loss: 1.1926, test_f1: 0.2260
 epoch: 44, train_loss: 1.2060, test_loss: 1.1910, test_f1: 0.2260
 epoch: 45, train_loss: 1.2026, test_loss: 1.1904, test_f1: 0.2260
 epoch: 46, train_loss: 1.2067, test_loss: 1.1885, test_f1: 0.2260
 epoch: 47, train_loss: 1.2053, test_loss: 1.1869, test_f1: 0.2260
 epoch: 48, train_loss: 1.2016, test_loss: 1.1849, test_f1: 0.2260
 epoch: 49, train_loss: 1.1970, test_loss: 1.1843, test_f1: 0.2260
 epoch: 50, train_loss: 1.2009, test_loss: 1.1843, test_f1: 0.2260
 epoch: 51, train_loss: 1.1982, test_loss: 1.1832, test_f1: 0.2260
 epoch: 52, train_loss: 1.1956, test_loss: 1.1827, test_f1: 0.2260
 epoch: 53, train_loss: 1.1961, test_loss: 1.1819, test_f1: 0.2260
 epoch: 54, train_loss: 1.1995, test_loss: 1.1815, test_f1: 0.2260
 epoch: 55, train_loss: 1.1949, test_loss: 1.1808, test_f1: 0.2260
 epoch: 56, train_loss: 1.1943, test_loss: 1.1801, test_f1: 0.2260
 epoch: 57, train_loss: 1.1942, test_loss: 1.1792, test_f1: 0.2260
 epoch: 58, train_loss: 1.1935, test_loss: 1.1784, test_f1: 0.2260
 epoch: 59, train_loss: 1.1911, test_loss: 1.1780, test_f1: 0.2260
 epoch: 60, train_loss: 1.1950, test_loss: 1.1772, test_f1: 0.2260
 epoch: 61, train_loss: 1.1903, test_loss: 1.1771, test_f1: 0.2260
 epoch: 62, train_loss: 1.1935, test_loss: 1.1770, test_f1: 0.2260
 epoch: 63, train_loss: 1.1949, test_loss: 1.1760, test_f1: 0.2260
 epoch: 64, train_loss: 1.1922, test_loss: 1.1757, test_f1: 0.2260
 epoch: 65, train_loss: 1.1891, test_loss: 1.1752, test_f1: 0.2260
 epoch: 66, train_loss: 1.1867, test_loss: 1.1753, test_f1: 0.2260
 epoch: 67, train_loss: 1.1902, test_loss: 1.1741, test_f1: 0.2260
 epoch: 68, train_loss: 1.1866, test_loss: 1.1737, test_f1: 0.2260
 epoch: 69, train_loss: 1.1880, test_loss: 1.1734, test_f1: 0.2260
 epoch: 70, train_loss: 1.1897, test_loss: 1.1726, test_f1: 0.2260
 epoch: 71, train_loss: 1.1862, test_loss: 1.1726, test_f1: 0.2260
 epoch: 72, train_loss: 1.1870, test_loss: 1.1717, test_f1: 0.2260
 epoch: 73, train_loss: 1.1885, test_loss: 1.1711, test_f1: 0.2260
 epoch: 74, train_loss: 1.1883, test_loss: 1.1709, test_f1: 0.2260
 epoch: 75, train_loss: 1.1871, test_loss: 1.1714, test_f1: 0.2260
 epoch: 76, train_loss: 1.1910, test_loss: 1.1714, test_f1: 0.2260
 epoch: 77, train_loss: 1.1890, test_loss: 1.1702, test_f1: 0.2260
 epoch: 78, train_loss: 1.1866, test_loss: 1.1702, test_f1: 0.2260
 epoch: 79, train_loss: 1.1869, test_loss: 1.1701, test_f1: 0.2260
 epoch: 80, train_loss: 1.1833, test_loss: 1.1697, test_f1: 0.2260
 epoch: 81, train_loss: 1.1885, test_loss: 1.1696, test_f1: 0.2260
 epoch: 82, train_loss: 1.1808, test_loss: 1.1689, test_f1: 0.2260
 epoch: 83, train_loss: 1.1826, test_loss: 1.1673, test_f1: 0.2260
 epoch: 84, train_loss: 1.1805, test_loss: 1.1666, test_f1: 0.2260
 epoch: 85, train_loss: 1.1857, test_loss: 1.1657, test_f1: 0.2260
 epoch: 86, train_loss: 1.1801, test_loss: 1.1660, test_f1: 0.2260
 epoch: 87, train_loss: 1.1782, test_loss: 1.1662, test_f1: 0.2260
 epoch: 88, train_loss: 1.1805, test_loss: 1.1649, test_f1: 0.2260
 epoch: 89, train_loss: 1.1779, test_loss: 1.1653, test_f1: 0.2260
 epoch: 90, train_loss: 1.1806, test_loss: 1.1645, test_f1: 0.2260
 epoch: 91, train_loss: 1.1772, test_loss: 1.1637, test_f1: 0.2260
 epoch: 92, train_loss: 1.1806, test_loss: 1.1633, test_f1: 0.2260
 epoch: 93, train_loss: 1.1792, test_loss: 1.1628, test_f1: 0.2260
 epoch: 94, train_loss: 1.1765, test_loss: 1.1621, test_f1: 0.2260
 epoch: 95, train_loss: 1.1773, test_loss: 1.1617, test_f1: 0.2260
 epoch: 96, train_loss: 1.1776, test_loss: 1.1618, test_f1: 0.2335
 epoch: 97, train_loss: 1.1762, test_loss: 1.1625, test_f1: 0.2808
 epoch: 98, train_loss: 1.1731, test_loss: 1.1608, test_f1: 0.3003
 epoch: 99, train_loss: 1.1745, test_loss: 1.1607, test_f1: 0.3160
##################ITERATION #5 ****************************************
 epoch: 0, train_loss: 1.3158, test_loss: 1.3336, test_f1: 0.2260
 epoch: 1, train_loss: 1.3113, test_loss: 1.3290, test_f1: 0.2260
 epoch: 2, train_loss: 1.3057, test_loss: 1.3241, test_f1: 0.2260
 epoch: 3, train_loss: 1.3004, test_loss: 1.3166, test_f1: 0.2260
 epoch: 4, train_loss: 1.2964, test_loss: 1.3078, test_f1: 0.2260
 epoch: 5, train_loss: 1.2920, test_loss: 1.3001, test_f1: 0.2260
 epoch: 6, train_loss: 1.2892, test_loss: 1.2939, test_f1: 0.2260
 epoch: 7, train_loss: 1.2848, test_loss: 1.2881, test_f1: 0.2260
 epoch: 8, train_loss: 1.2818, test_loss: 1.2835, test_f1: 0.2260
 epoch: 9, train_loss: 1.2785, test_loss: 1.2787, test_f1: 0.2260
 epoch: 10, train_loss: 1.2741, test_loss: 1.2736, test_f1: 0.2260
 epoch: 11, train_loss: 1.2718, test_loss: 1.2690, test_f1: 0.2260
 epoch: 12, train_loss: 1.2686, test_loss: 1.2649, test_f1: 0.2260
 epoch: 13, train_loss: 1.2614, test_loss: 1.2601, test_f1: 0.2260
 epoch: 14, train_loss: 1.2611, test_loss: 1.2550, test_f1: 0.2260
 epoch: 15, train_loss: 1.2553, test_loss: 1.2494, test_f1: 0.2260
 epoch: 16, train_loss: 1.2555, test_loss: 1.2450, test_f1: 0.2260
 epoch: 17, train_loss: 1.2482, test_loss: 1.2405, test_f1: 0.2260
 epoch: 18, train_loss: 1.2504, test_loss: 1.2371, test_f1: 0.2260
 epoch: 19, train_loss: 1.2444, test_loss: 1.2336, test_f1: 0.2260
 epoch: 20, train_loss: 1.2412, test_loss: 1.2299, test_f1: 0.2260
 epoch: 21, train_loss: 1.2345, test_loss: 1.2267, test_f1: 0.2260
 epoch: 22, train_loss: 1.2363, test_loss: 1.2231, test_f1: 0.2260
 epoch: 23, train_loss: 1.2368, test_loss: 1.2202, test_f1: 0.2260
 epoch: 24, train_loss: 1.2331, test_loss: 1.2171, test_f1: 0.2260
 epoch: 25, train_loss: 1.2275, test_loss: 1.2140, test_f1: 0.2260
 epoch: 26, train_loss: 1.2306, test_loss: 1.2114, test_f1: 0.2260
 epoch: 27, train_loss: 1.2220, test_loss: 1.2092, test_f1: 0.2260
 epoch: 28, train_loss: 1.2199, test_loss: 1.2060, test_f1: 0.2260
 epoch: 29, train_loss: 1.2226, test_loss: 1.2030, test_f1: 0.2260
 epoch: 30, train_loss: 1.2167, test_loss: 1.2018, test_f1: 0.2260
 epoch: 31, train_loss: 1.2123, test_loss: 1.1978, test_f1: 0.2260
 epoch: 32, train_loss: 1.2157, test_loss: 1.1947, test_f1: 0.2260
 epoch: 33, train_loss: 1.2136, test_loss: 1.1924, test_f1: 0.2260
 epoch: 34, train_loss: 1.2106, test_loss: 1.1896, test_f1: 0.2260
 epoch: 35, train_loss: 1.2090, test_loss: 1.1888, test_f1: 0.2260
 epoch: 36, train_loss: 1.2075, test_loss: 1.1864, test_f1: 0.2260
 epoch: 37, train_loss: 1.2011, test_loss: 1.1837, test_f1: 0.2260
 epoch: 38, train_loss: 1.1967, test_loss: 1.1808, test_f1: 0.2260
 epoch: 39, train_loss: 1.2019, test_loss: 1.1795, test_f1: 0.2260
 epoch: 40, train_loss: 1.1986, test_loss: 1.1773, test_f1: 0.2260
 epoch: 41, train_loss: 1.1986, test_loss: 1.1748, test_f1: 0.2260
 epoch: 42, train_loss: 1.1976, test_loss: 1.1732, test_f1: 0.2260
 epoch: 43, train_loss: 1.1913, test_loss: 1.1722, test_f1: 0.2260
 epoch: 44, train_loss: 1.1869, test_loss: 1.1698, test_f1: 0.2260
 epoch: 45, train_loss: 1.1905, test_loss: 1.1678, test_f1: 0.2452
 epoch: 46, train_loss: 1.1841, test_loss: 1.1664, test_f1: 0.2772
 epoch: 47, train_loss: 1.1869, test_loss: 1.1648, test_f1: 0.2988
 epoch: 48, train_loss: 1.1842, test_loss: 1.1626, test_f1: 0.3186
 epoch: 49, train_loss: 1.1818, test_loss: 1.1613, test_f1: 0.3287
 epoch: 50, train_loss: 1.1777, test_loss: 1.1593, test_f1: 0.3358
 epoch: 51, train_loss: 1.1804, test_loss: 1.1584, test_f1: 0.3370
 epoch: 52, train_loss: 1.1844, test_loss: 1.1579, test_f1: 0.3392
 epoch: 53, train_loss: 1.1772, test_loss: 1.1573, test_f1: 0.3392
 epoch: 54, train_loss: 1.1779, test_loss: 1.1561, test_f1: 0.3426
 epoch: 55, train_loss: 1.1743, test_loss: 1.1554, test_f1: 0.3437
 epoch: 56, train_loss: 1.1784, test_loss: 1.1552, test_f1: 0.3437
 epoch: 57, train_loss: 1.1716, test_loss: 1.1540, test_f1: 0.3437
 epoch: 58, train_loss: 1.1715, test_loss: 1.1527, test_f1: 0.3458
 epoch: 59, train_loss: 1.1701, test_loss: 1.1524, test_f1: 0.3469
 epoch: 60, train_loss: 1.1718, test_loss: 1.1517, test_f1: 0.3479
 epoch: 61, train_loss: 1.1724, test_loss: 1.1512, test_f1: 0.3490
 epoch: 62, train_loss: 1.1697, test_loss: 1.1502, test_f1: 0.3500
 epoch: 63, train_loss: 1.1683, test_loss: 1.1496, test_f1: 0.3476
 epoch: 64, train_loss: 1.1690, test_loss: 1.1481, test_f1: 0.3500
 epoch: 65, train_loss: 1.1724, test_loss: 1.1479, test_f1: 0.3476
 epoch: 66, train_loss: 1.1660, test_loss: 1.1467, test_f1: 0.3500
 epoch: 67, train_loss: 1.1667, test_loss: 1.1465, test_f1: 0.3486
 epoch: 68, train_loss: 1.1639, test_loss: 1.1455, test_f1: 0.3486
 epoch: 69, train_loss: 1.1698, test_loss: 1.1453, test_f1: 0.3458
 epoch: 70, train_loss: 1.1662, test_loss: 1.1451, test_f1: 0.3469
 epoch: 71, train_loss: 1.1617, test_loss: 1.1437, test_f1: 0.3462
 epoch: 72, train_loss: 1.1617, test_loss: 1.1427, test_f1: 0.3465
 epoch: 73, train_loss: 1.1609, test_loss: 1.1421, test_f1: 0.3475
 epoch: 74, train_loss: 1.1646, test_loss: 1.1424, test_f1: 0.3462
 epoch: 75, train_loss: 1.1561, test_loss: 1.1408, test_f1: 0.3472
 epoch: 76, train_loss: 1.1615, test_loss: 1.1400, test_f1: 0.3462
 epoch: 77, train_loss: 1.1551, test_loss: 1.1389, test_f1: 0.3462
 epoch: 78, train_loss: 1.1599, test_loss: 1.1380, test_f1: 0.3452
 epoch: 79, train_loss: 1.1614, test_loss: 1.1383, test_f1: 0.3452
 epoch: 80, train_loss: 1.1585, test_loss: 1.1382, test_f1: 0.3421
 epoch: 81, train_loss: 1.1551, test_loss: 1.1366, test_f1: 0.3411
 epoch: 82, train_loss: 1.1549, test_loss: 1.1357, test_f1: 0.3462
 epoch: 83, train_loss: 1.1535, test_loss: 1.1351, test_f1: 0.3462
 epoch: 84, train_loss: 1.1621, test_loss: 1.1349, test_f1: 0.3410
 epoch: 85, train_loss: 1.1514, test_loss: 1.1336, test_f1: 0.3431
 epoch: 86, train_loss: 1.1548, test_loss: 1.1337, test_f1: 0.3391
 epoch: 87, train_loss: 1.1499, test_loss: 1.1324, test_f1: 0.3431
 epoch: 88, train_loss: 1.1468, test_loss: 1.1318, test_f1: 0.3451
 epoch: 89, train_loss: 1.1517, test_loss: 1.1316, test_f1: 0.3410
 epoch: 90, train_loss: 1.1479, test_loss: 1.1306, test_f1: 0.3450
 epoch: 91, train_loss: 1.1506, test_loss: 1.1309, test_f1: 0.3419
 epoch: 92, train_loss: 1.1509, test_loss: 1.1301, test_f1: 0.3419
 epoch: 93, train_loss: 1.1493, test_loss: 1.1292, test_f1: 0.3419
 epoch: 94, train_loss: 1.1512, test_loss: 1.1277, test_f1: 0.3419
 epoch: 95, train_loss: 1.1442, test_loss: 1.1266, test_f1: 0.3410
 epoch: 96, train_loss: 1.1467, test_loss: 1.1262, test_f1: 0.3419
 epoch: 97, train_loss: 1.1421, test_loss: 1.1254, test_f1: 0.3410
 epoch: 98, train_loss: 1.1471, test_loss: 1.1252, test_f1: 0.3419
 epoch: 99, train_loss: 1.1440, test_loss: 1.1248, test_f1: 0.3410
##################ITERATION #6 ****************************************
 epoch: 0, train_loss: 1.3241, test_loss: 1.3291, test_f1: 0.2260
 epoch: 1, train_loss: 1.3180, test_loss: 1.3268, test_f1: 0.2260
 epoch: 2, train_loss: 1.3133, test_loss: 1.3281, test_f1: 0.2260
 epoch: 3, train_loss: 1.3106, test_loss: 1.3211, test_f1: 0.2260
 epoch: 4, train_loss: 1.3050, test_loss: 1.3128, test_f1: 0.2260
 epoch: 5, train_loss: 1.3020, test_loss: 1.3084, test_f1: 0.2260
 epoch: 6, train_loss: 1.2984, test_loss: 1.3054, test_f1: 0.2260
 epoch: 7, train_loss: 1.2950, test_loss: 1.3020, test_f1: 0.2260
 epoch: 8, train_loss: 1.2905, test_loss: 1.2985, test_f1: 0.2260
 epoch: 9, train_loss: 1.2889, test_loss: 1.2961, test_f1: 0.2260
 epoch: 10, train_loss: 1.2861, test_loss: 1.2928, test_f1: 0.2260
 epoch: 11, train_loss: 1.2845, test_loss: 1.2902, test_f1: 0.2260
 epoch: 12, train_loss: 1.2794, test_loss: 1.2877, test_f1: 0.2260
 epoch: 13, train_loss: 1.2768, test_loss: 1.2840, test_f1: 0.2260
 epoch: 14, train_loss: 1.2717, test_loss: 1.2807, test_f1: 0.2260
 epoch: 15, train_loss: 1.2694, test_loss: 1.2774, test_f1: 0.2260
 epoch: 16, train_loss: 1.2676, test_loss: 1.2738, test_f1: 0.2260
 epoch: 17, train_loss: 1.2631, test_loss: 1.2708, test_f1: 0.2260
 epoch: 18, train_loss: 1.2614, test_loss: 1.2672, test_f1: 0.2260
 epoch: 19, train_loss: 1.2574, test_loss: 1.2624, test_f1: 0.2260
 epoch: 20, train_loss: 1.2553, test_loss: 1.2593, test_f1: 0.2260
 epoch: 21, train_loss: 1.2511, test_loss: 1.2558, test_f1: 0.2260
 epoch: 22, train_loss: 1.2472, test_loss: 1.2510, test_f1: 0.2260
 epoch: 23, train_loss: 1.2467, test_loss: 1.2475, test_f1: 0.2260
 epoch: 24, train_loss: 1.2416, test_loss: 1.2435, test_f1: 0.2260
 epoch: 25, train_loss: 1.2418, test_loss: 1.2401, test_f1: 0.2260
 epoch: 26, train_loss: 1.2373, test_loss: 1.2374, test_f1: 0.2260
 epoch: 27, train_loss: 1.2391, test_loss: 1.2343, test_f1: 0.2260
 epoch: 28, train_loss: 1.2325, test_loss: 1.2298, test_f1: 0.2260
 epoch: 29, train_loss: 1.2301, test_loss: 1.2260, test_f1: 0.2260
 epoch: 30, train_loss: 1.2290, test_loss: 1.2226, test_f1: 0.2260
 epoch: 31, train_loss: 1.2264, test_loss: 1.2196, test_f1: 0.2260
 epoch: 32, train_loss: 1.2236, test_loss: 1.2171, test_f1: 0.2260
 epoch: 33, train_loss: 1.2253, test_loss: 1.2137, test_f1: 0.2260
 epoch: 34, train_loss: 1.2183, test_loss: 1.2120, test_f1: 0.2260
 epoch: 35, train_loss: 1.2173, test_loss: 1.2100, test_f1: 0.2260
 epoch: 36, train_loss: 1.2146, test_loss: 1.2072, test_f1: 0.2260
 epoch: 37, train_loss: 1.2153, test_loss: 1.2048, test_f1: 0.2260
 epoch: 38, train_loss: 1.2142, test_loss: 1.2027, test_f1: 0.2260
 epoch: 39, train_loss: 1.2102, test_loss: 1.2008, test_f1: 0.2260
 epoch: 40, train_loss: 1.2096, test_loss: 1.1988, test_f1: 0.2260
 epoch: 41, train_loss: 1.2096, test_loss: 1.1960, test_f1: 0.2260
 epoch: 42, train_loss: 1.2061, test_loss: 1.1946, test_f1: 0.2260
 epoch: 43, train_loss: 1.2002, test_loss: 1.1916, test_f1: 0.2286
 epoch: 44, train_loss: 1.1980, test_loss: 1.1894, test_f1: 0.2311
 epoch: 45, train_loss: 1.1998, test_loss: 1.1874, test_f1: 0.2335
 epoch: 46, train_loss: 1.1976, test_loss: 1.1849, test_f1: 0.2406
 epoch: 47, train_loss: 1.1967, test_loss: 1.1834, test_f1: 0.2539
 epoch: 48, train_loss: 1.1978, test_loss: 1.1816, test_f1: 0.2581
 epoch: 49, train_loss: 1.1916, test_loss: 1.1805, test_f1: 0.2661
 epoch: 50, train_loss: 1.1893, test_loss: 1.1774, test_f1: 0.2661
 epoch: 51, train_loss: 1.1872, test_loss: 1.1757, test_f1: 0.2718
 epoch: 52, train_loss: 1.1845, test_loss: 1.1746, test_f1: 0.2825
 epoch: 53, train_loss: 1.1855, test_loss: 1.1759, test_f1: 0.2909
 epoch: 54, train_loss: 1.1832, test_loss: 1.1745, test_f1: 0.2957
 epoch: 55, train_loss: 1.1828, test_loss: 1.1730, test_f1: 0.2925
 epoch: 56, train_loss: 1.1819, test_loss: 1.1716, test_f1: 0.2957
 epoch: 57, train_loss: 1.1850, test_loss: 1.1696, test_f1: 0.3062
 epoch: 58, train_loss: 1.1886, test_loss: 1.1693, test_f1: 0.3091
 epoch: 59, train_loss: 1.1813, test_loss: 1.1683, test_f1: 0.3146
 epoch: 60, train_loss: 1.1807, test_loss: 1.1674, test_f1: 0.3186
 epoch: 61, train_loss: 1.1790, test_loss: 1.1672, test_f1: 0.3199
 epoch: 62, train_loss: 1.1758, test_loss: 1.1645, test_f1: 0.3199
 epoch: 63, train_loss: 1.1780, test_loss: 1.1642, test_f1: 0.3225
 epoch: 64, train_loss: 1.1778, test_loss: 1.1636, test_f1: 0.3275
 epoch: 65, train_loss: 1.1751, test_loss: 1.1632, test_f1: 0.3263
 epoch: 66, train_loss: 1.1769, test_loss: 1.1624, test_f1: 0.3311
 epoch: 67, train_loss: 1.1731, test_loss: 1.1619, test_f1: 0.3311
 epoch: 68, train_loss: 1.1725, test_loss: 1.1608, test_f1: 0.3299
 epoch: 69, train_loss: 1.1701, test_loss: 1.1597, test_f1: 0.3299
 epoch: 70, train_loss: 1.1751, test_loss: 1.1581, test_f1: 0.3299
 epoch: 71, train_loss: 1.1696, test_loss: 1.1572, test_f1: 0.3323
 epoch: 72, train_loss: 1.1707, test_loss: 1.1556, test_f1: 0.3347
 epoch: 73, train_loss: 1.1677, test_loss: 1.1554, test_f1: 0.3370
 epoch: 74, train_loss: 1.1665, test_loss: 1.1545, test_f1: 0.3370
 epoch: 75, train_loss: 1.1702, test_loss: 1.1538, test_f1: 0.3370
 epoch: 76, train_loss: 1.1702, test_loss: 1.1544, test_f1: 0.3370
 epoch: 77, train_loss: 1.1676, test_loss: 1.1530, test_f1: 0.3381
 epoch: 78, train_loss: 1.1643, test_loss: 1.1531, test_f1: 0.3381
 epoch: 79, train_loss: 1.1623, test_loss: 1.1503, test_f1: 0.3404
 epoch: 80, train_loss: 1.1617, test_loss: 1.1497, test_f1: 0.3392
 epoch: 81, train_loss: 1.1618, test_loss: 1.1503, test_f1: 0.3415
 epoch: 82, train_loss: 1.1611, test_loss: 1.1492, test_f1: 0.3415
 epoch: 83, train_loss: 1.1606, test_loss: 1.1474, test_f1: 0.3437
 epoch: 84, train_loss: 1.1648, test_loss: 1.1451, test_f1: 0.3415
 epoch: 85, train_loss: 1.1581, test_loss: 1.1454, test_f1: 0.3426
 epoch: 86, train_loss: 1.1594, test_loss: 1.1442, test_f1: 0.3437
 epoch: 87, train_loss: 1.1518, test_loss: 1.1448, test_f1: 0.3469
 epoch: 88, train_loss: 1.1555, test_loss: 1.1441, test_f1: 0.3458
 epoch: 89, train_loss: 1.1582, test_loss: 1.1440, test_f1: 0.3458
 epoch: 90, train_loss: 1.1543, test_loss: 1.1432, test_f1: 0.3469
 epoch: 91, train_loss: 1.1559, test_loss: 1.1413, test_f1: 0.3469
 epoch: 92, train_loss: 1.1515, test_loss: 1.1407, test_f1: 0.3458
 epoch: 93, train_loss: 1.1500, test_loss: 1.1399, test_f1: 0.3469
 epoch: 94, train_loss: 1.1503, test_loss: 1.1395, test_f1: 0.3479
 epoch: 95, train_loss: 1.1529, test_loss: 1.1389, test_f1: 0.3479
 epoch: 96, train_loss: 1.1479, test_loss: 1.1384, test_f1: 0.3469
 epoch: 97, train_loss: 1.1513, test_loss: 1.1383, test_f1: 0.3479
 epoch: 98, train_loss: 1.1475, test_loss: 1.1373, test_f1: 0.3505
 epoch: 99, train_loss: 1.1467, test_loss: 1.1353, test_f1: 0.3515
##################ITERATION #7 ****************************************
 epoch: 0, train_loss: 1.3800, test_loss: 1.4127, test_f1: 0.0303
 epoch: 1, train_loss: 1.3700, test_loss: 1.4122, test_f1: 0.0303
 epoch: 2, train_loss: 1.3625, test_loss: 1.4092, test_f1: 0.0298
 epoch: 3, train_loss: 1.3562, test_loss: 1.4014, test_f1: 0.1278
 epoch: 4, train_loss: 1.3478, test_loss: 1.3884, test_f1: 0.1960
 epoch: 5, train_loss: 1.3414, test_loss: 1.3742, test_f1: 0.2043
 epoch: 6, train_loss: 1.3319, test_loss: 1.3613, test_f1: 0.2233
 epoch: 7, train_loss: 1.3265, test_loss: 1.3513, test_f1: 0.2293
 epoch: 8, train_loss: 1.3178, test_loss: 1.3378, test_f1: 0.2311
 epoch: 9, train_loss: 1.3059, test_loss: 1.3290, test_f1: 0.2282
 epoch: 10, train_loss: 1.2994, test_loss: 1.3162, test_f1: 0.2286
 epoch: 11, train_loss: 1.2909, test_loss: 1.3052, test_f1: 0.2286
 epoch: 12, train_loss: 1.2822, test_loss: 1.2959, test_f1: 0.2260
 epoch: 13, train_loss: 1.2811, test_loss: 1.2873, test_f1: 0.2260
 epoch: 14, train_loss: 1.2700, test_loss: 1.2772, test_f1: 0.2286
 epoch: 15, train_loss: 1.2636, test_loss: 1.2694, test_f1: 0.2286
 epoch: 16, train_loss: 1.2649, test_loss: 1.2628, test_f1: 0.2286
 epoch: 17, train_loss: 1.2577, test_loss: 1.2580, test_f1: 0.2286
 epoch: 18, train_loss: 1.2523, test_loss: 1.2503, test_f1: 0.2383
 epoch: 19, train_loss: 1.2420, test_loss: 1.2403, test_f1: 0.2335
 epoch: 20, train_loss: 1.2430, test_loss: 1.2378, test_f1: 0.2496
 epoch: 21, train_loss: 1.2389, test_loss: 1.2318, test_f1: 0.2621
 epoch: 22, train_loss: 1.2296, test_loss: 1.2213, test_f1: 0.2601
 epoch: 23, train_loss: 1.2271, test_loss: 1.2206, test_f1: 0.2790
 epoch: 24, train_loss: 1.2198, test_loss: 1.2071, test_f1: 0.2680
 epoch: 25, train_loss: 1.2159, test_loss: 1.2052, test_f1: 0.2808
 epoch: 26, train_loss: 1.2147, test_loss: 1.1990, test_f1: 0.2972
 epoch: 27, train_loss: 1.2106, test_loss: 1.1946, test_f1: 0.3076
 epoch: 28, train_loss: 1.2069, test_loss: 1.1964, test_f1: 0.3076
 epoch: 29, train_loss: 1.2067, test_loss: 1.1848, test_f1: 0.3076
 epoch: 30, train_loss: 1.2017, test_loss: 1.1853, test_f1: 0.3132
 epoch: 31, train_loss: 1.1961, test_loss: 1.1781, test_f1: 0.3105
 epoch: 32, train_loss: 1.1922, test_loss: 1.1764, test_f1: 0.3186
 epoch: 33, train_loss: 1.1880, test_loss: 1.1669, test_f1: 0.3160
 epoch: 34, train_loss: 1.1898, test_loss: 1.1634, test_f1: 0.3186
 epoch: 35, train_loss: 1.1853, test_loss: 1.1676, test_f1: 0.3263
 epoch: 36, train_loss: 1.1806, test_loss: 1.1624, test_f1: 0.3311
 epoch: 37, train_loss: 1.1784, test_loss: 1.1564, test_f1: 0.3299
 epoch: 38, train_loss: 1.1716, test_loss: 1.1520, test_f1: 0.3311
 epoch: 39, train_loss: 1.1713, test_loss: 1.1453, test_f1: 0.3287
 epoch: 40, train_loss: 1.1723, test_loss: 1.1455, test_f1: 0.3392
 epoch: 41, train_loss: 1.1649, test_loss: 1.1383, test_f1: 0.3358
 epoch: 42, train_loss: 1.1643, test_loss: 1.1353, test_f1: 0.3323
 epoch: 43, train_loss: 1.1644, test_loss: 1.1350, test_f1: 0.3404
 epoch: 44, train_loss: 1.1620, test_loss: 1.1301, test_f1: 0.3358
 epoch: 45, train_loss: 1.1628, test_loss: 1.1277, test_f1: 0.3404
 epoch: 46, train_loss: 1.1557, test_loss: 1.1252, test_f1: 0.3415
 epoch: 47, train_loss: 1.1515, test_loss: 1.1250, test_f1: 0.3477
 epoch: 48, train_loss: 1.1551, test_loss: 1.1200, test_f1: 0.3502
 epoch: 49, train_loss: 1.1438, test_loss: 1.1171, test_f1: 0.3513
 epoch: 50, train_loss: 1.1487, test_loss: 1.1164, test_f1: 0.3549
 epoch: 51, train_loss: 1.1433, test_loss: 1.1139, test_f1: 0.3573
 epoch: 52, train_loss: 1.1465, test_loss: 1.1131, test_f1: 0.3573
 epoch: 53, train_loss: 1.1464, test_loss: 1.1118, test_f1: 0.3573
 epoch: 54, train_loss: 1.1428, test_loss: 1.1129, test_f1: 0.3573
 epoch: 55, train_loss: 1.1359, test_loss: 1.1121, test_f1: 0.3573
 epoch: 56, train_loss: 1.1365, test_loss: 1.1107, test_f1: 0.3573
 epoch: 57, train_loss: 1.1445, test_loss: 1.1096, test_f1: 0.3595
 epoch: 58, train_loss: 1.1358, test_loss: 1.1068, test_f1: 0.3573
 epoch: 59, train_loss: 1.1404, test_loss: 1.1062, test_f1: 0.3584
 epoch: 60, train_loss: 1.1366, test_loss: 1.1066, test_f1: 0.3595
 epoch: 61, train_loss: 1.1350, test_loss: 1.1057, test_f1: 0.3584
 epoch: 62, train_loss: 1.1368, test_loss: 1.1047, test_f1: 0.3616
 epoch: 63, train_loss: 1.1317, test_loss: 1.1036, test_f1: 0.3638
 epoch: 64, train_loss: 1.1363, test_loss: 1.1020, test_f1: 0.3628
 epoch: 65, train_loss: 1.1329, test_loss: 1.1030, test_f1: 0.3638
 epoch: 66, train_loss: 1.1314, test_loss: 1.1020, test_f1: 0.3597
 epoch: 67, train_loss: 1.1291, test_loss: 1.1020, test_f1: 0.3605
 epoch: 68, train_loss: 1.1329, test_loss: 1.1017, test_f1: 0.3626
 epoch: 69, train_loss: 1.1278, test_loss: 1.1000, test_f1: 0.3626
 epoch: 70, train_loss: 1.1254, test_loss: 1.0980, test_f1: 0.3628
 epoch: 71, train_loss: 1.1296, test_loss: 1.0976, test_f1: 0.3648
 epoch: 72, train_loss: 1.1249, test_loss: 1.0971, test_f1: 0.3663
 epoch: 73, train_loss: 1.1225, test_loss: 1.0971, test_f1: 0.3697
 epoch: 74, train_loss: 1.1253, test_loss: 1.0961, test_f1: 0.3673
 epoch: 75, train_loss: 1.1237, test_loss: 1.0943, test_f1: 0.3687
 epoch: 76, train_loss: 1.1221, test_loss: 1.0949, test_f1: 0.3697
 epoch: 77, train_loss: 1.1204, test_loss: 1.0929, test_f1: 0.3687
 epoch: 78, train_loss: 1.1215, test_loss: 1.0933, test_f1: 0.3673
 epoch: 79, train_loss: 1.1170, test_loss: 1.0940, test_f1: 0.3747
 epoch: 80, train_loss: 1.1221, test_loss: 1.0906, test_f1: 0.3687
 epoch: 81, train_loss: 1.1182, test_loss: 1.0898, test_f1: 0.3687
 epoch: 82, train_loss: 1.1170, test_loss: 1.0895, test_f1: 0.3728
 epoch: 83, train_loss: 1.1208, test_loss: 1.0892, test_f1: 0.3747
 epoch: 84, train_loss: 1.1148, test_loss: 1.0900, test_f1: 0.3757
 epoch: 85, train_loss: 1.1126, test_loss: 1.0918, test_f1: 0.3750
 epoch: 86, train_loss: 1.1183, test_loss: 1.0891, test_f1: 0.3728
 epoch: 87, train_loss: 1.1138, test_loss: 1.0877, test_f1: 0.3689
 epoch: 88, train_loss: 1.1150, test_loss: 1.0870, test_f1: 0.3763
 epoch: 89, train_loss: 1.1112, test_loss: 1.0863, test_f1: 0.3763
 epoch: 90, train_loss: 1.1170, test_loss: 1.0844, test_f1: 0.3743
 epoch: 91, train_loss: 1.1107, test_loss: 1.0843, test_f1: 0.3753
 epoch: 92, train_loss: 1.1092, test_loss: 1.0848, test_f1: 0.3783
 epoch: 93, train_loss: 1.1071, test_loss: 1.0833, test_f1: 0.3783
 epoch: 94, train_loss: 1.1106, test_loss: 1.0861, test_f1: 0.3770
 epoch: 95, train_loss: 1.1094, test_loss: 1.0858, test_f1: 0.3787
 epoch: 96, train_loss: 1.1073, test_loss: 1.0839, test_f1: 0.3828
 epoch: 97, train_loss: 1.1104, test_loss: 1.0820, test_f1: 0.3814
 epoch: 98, train_loss: 1.1049, test_loss: 1.0820, test_f1: 0.3801
 epoch: 99, train_loss: 1.1073, test_loss: 1.0801, test_f1: 0.3828
##################ITERATION #8 ****************************************
 epoch: 0, train_loss: 1.3154, test_loss: 1.3273, test_f1: 0.2260
 epoch: 1, train_loss: 1.3053, test_loss: 1.3230, test_f1: 0.2260
 epoch: 2, train_loss: 1.3002, test_loss: 1.3178, test_f1: 0.2260
 epoch: 3, train_loss: 1.2937, test_loss: 1.3072, test_f1: 0.2260
 epoch: 4, train_loss: 1.2903, test_loss: 1.2999, test_f1: 0.2260
 epoch: 5, train_loss: 1.2855, test_loss: 1.2937, test_f1: 0.2260
 epoch: 6, train_loss: 1.2812, test_loss: 1.2878, test_f1: 0.2260
 epoch: 7, train_loss: 1.2775, test_loss: 1.2825, test_f1: 0.2260
 epoch: 8, train_loss: 1.2725, test_loss: 1.2757, test_f1: 0.2260
 epoch: 9, train_loss: 1.2680, test_loss: 1.2727, test_f1: 0.2260
 epoch: 10, train_loss: 1.2644, test_loss: 1.2677, test_f1: 0.2260
 epoch: 11, train_loss: 1.2617, test_loss: 1.2636, test_f1: 0.2260
 epoch: 12, train_loss: 1.2548, test_loss: 1.2589, test_f1: 0.2260
 epoch: 13, train_loss: 1.2497, test_loss: 1.2536, test_f1: 0.2260
 epoch: 14, train_loss: 1.2504, test_loss: 1.2491, test_f1: 0.2260
 epoch: 15, train_loss: 1.2477, test_loss: 1.2452, test_f1: 0.2260
 epoch: 16, train_loss: 1.2470, test_loss: 1.2412, test_f1: 0.2260
 epoch: 17, train_loss: 1.2387, test_loss: 1.2364, test_f1: 0.2260
 epoch: 18, train_loss: 1.2354, test_loss: 1.2336, test_f1: 0.2260
 epoch: 19, train_loss: 1.2322, test_loss: 1.2303, test_f1: 0.2260
 epoch: 20, train_loss: 1.2333, test_loss: 1.2237, test_f1: 0.2260
 epoch: 21, train_loss: 1.2271, test_loss: 1.2192, test_f1: 0.2260
 epoch: 22, train_loss: 1.2215, test_loss: 1.2145, test_f1: 0.2260
 epoch: 23, train_loss: 1.2184, test_loss: 1.2114, test_f1: 0.2260
 epoch: 24, train_loss: 1.2153, test_loss: 1.2063, test_f1: 0.2311
 epoch: 25, train_loss: 1.2152, test_loss: 1.2034, test_f1: 0.2335
 epoch: 26, train_loss: 1.2114, test_loss: 1.2010, test_f1: 0.2383
 epoch: 27, train_loss: 1.2054, test_loss: 1.1951, test_f1: 0.2429
 epoch: 28, train_loss: 1.2063, test_loss: 1.1918, test_f1: 0.2581
 epoch: 29, train_loss: 1.2082, test_loss: 1.1890, test_f1: 0.2909
 epoch: 30, train_loss: 1.1957, test_loss: 1.1844, test_f1: 0.3033
 epoch: 31, train_loss: 1.1980, test_loss: 1.1824, test_f1: 0.3212
 epoch: 32, train_loss: 1.1950, test_loss: 1.1775, test_f1: 0.3212
 epoch: 33, train_loss: 1.1923, test_loss: 1.1744, test_f1: 0.3311
 epoch: 34, train_loss: 1.1857, test_loss: 1.1725, test_f1: 0.3358
 epoch: 35, train_loss: 1.1848, test_loss: 1.1682, test_f1: 0.3381
 epoch: 36, train_loss: 1.1828, test_loss: 1.1642, test_f1: 0.3392
 epoch: 37, train_loss: 1.1799, test_loss: 1.1640, test_f1: 0.3437
 epoch: 38, train_loss: 1.1762, test_loss: 1.1586, test_f1: 0.3437
 epoch: 39, train_loss: 1.1784, test_loss: 1.1570, test_f1: 0.3447
 epoch: 40, train_loss: 1.1725, test_loss: 1.1522, test_f1: 0.3437
 epoch: 41, train_loss: 1.1728, test_loss: 1.1528, test_f1: 0.3455
 epoch: 42, train_loss: 1.1702, test_loss: 1.1508, test_f1: 0.3462
 epoch: 43, train_loss: 1.1674, test_loss: 1.1490, test_f1: 0.3489
 epoch: 44, train_loss: 1.1685, test_loss: 1.1469, test_f1: 0.3421
 epoch: 45, train_loss: 1.1618, test_loss: 1.1437, test_f1: 0.3381
 epoch: 46, train_loss: 1.1662, test_loss: 1.1468, test_f1: 0.3410
 epoch: 47, train_loss: 1.1618, test_loss: 1.1429, test_f1: 0.3410
 epoch: 48, train_loss: 1.1535, test_loss: 1.1392, test_f1: 0.3391
 epoch: 49, train_loss: 1.1530, test_loss: 1.1391, test_f1: 0.3400
 epoch: 50, train_loss: 1.1522, test_loss: 1.1346, test_f1: 0.3410
 epoch: 51, train_loss: 1.1470, test_loss: 1.1340, test_f1: 0.3400
 epoch: 52, train_loss: 1.1566, test_loss: 1.1312, test_f1: 0.3400
 epoch: 53, train_loss: 1.1492, test_loss: 1.1320, test_f1: 0.3381
 epoch: 54, train_loss: 1.1497, test_loss: 1.1306, test_f1: 0.3410
 epoch: 55, train_loss: 1.1465, test_loss: 1.1318, test_f1: 0.3381
 epoch: 56, train_loss: 1.1472, test_loss: 1.1293, test_f1: 0.3390
 epoch: 57, train_loss: 1.1514, test_loss: 1.1290, test_f1: 0.3410
 epoch: 58, train_loss: 1.1476, test_loss: 1.1288, test_f1: 0.3390
 epoch: 59, train_loss: 1.1466, test_loss: 1.1294, test_f1: 0.3386
 epoch: 60, train_loss: 1.1432, test_loss: 1.1269, test_f1: 0.3390
 epoch: 61, train_loss: 1.1426, test_loss: 1.1242, test_f1: 0.3410
 epoch: 62, train_loss: 1.1431, test_loss: 1.1233, test_f1: 0.3419
 epoch: 63, train_loss: 1.1407, test_loss: 1.1226, test_f1: 0.3419
 epoch: 64, train_loss: 1.1383, test_loss: 1.1214, test_f1: 0.3419
 epoch: 65, train_loss: 1.1410, test_loss: 1.1211, test_f1: 0.3419
 epoch: 66, train_loss: 1.1408, test_loss: 1.1214, test_f1: 0.3417
 epoch: 67, train_loss: 1.1378, test_loss: 1.1199, test_f1: 0.3397
 epoch: 68, train_loss: 1.1374, test_loss: 1.1178, test_f1: 0.3429
 epoch: 69, train_loss: 1.1358, test_loss: 1.1173, test_f1: 0.3417
 epoch: 70, train_loss: 1.1332, test_loss: 1.1188, test_f1: 0.3384
 epoch: 71, train_loss: 1.1376, test_loss: 1.1179, test_f1: 0.3386
 epoch: 72, train_loss: 1.1307, test_loss: 1.1146, test_f1: 0.3419
 epoch: 73, train_loss: 1.1312, test_loss: 1.1148, test_f1: 0.3419
 epoch: 74, train_loss: 1.1306, test_loss: 1.1150, test_f1: 0.3423
 epoch: 75, train_loss: 1.1350, test_loss: 1.1133, test_f1: 0.3442
 epoch: 76, train_loss: 1.1321, test_loss: 1.1116, test_f1: 0.3445
 epoch: 77, train_loss: 1.1304, test_loss: 1.1114, test_f1: 0.3454
 epoch: 78, train_loss: 1.1260, test_loss: 1.1112, test_f1: 0.3505
 epoch: 79, train_loss: 1.1287, test_loss: 1.1090, test_f1: 0.3505
 epoch: 80, train_loss: 1.1280, test_loss: 1.1096, test_f1: 0.3493
 epoch: 81, train_loss: 1.1239, test_loss: 1.1084, test_f1: 0.3530
 epoch: 82, train_loss: 1.1240, test_loss: 1.1055, test_f1: 0.3540
 epoch: 83, train_loss: 1.1278, test_loss: 1.1066, test_f1: 0.3540
 epoch: 84, train_loss: 1.1246, test_loss: 1.1056, test_f1: 0.3539
 epoch: 85, train_loss: 1.1239, test_loss: 1.1050, test_f1: 0.3549
 epoch: 86, train_loss: 1.1207, test_loss: 1.1043, test_f1: 0.3565
 epoch: 87, train_loss: 1.1199, test_loss: 1.1048, test_f1: 0.3564
 epoch: 88, train_loss: 1.1166, test_loss: 1.1037, test_f1: 0.3539
 epoch: 89, train_loss: 1.1179, test_loss: 1.1037, test_f1: 0.3539
 epoch: 90, train_loss: 1.1214, test_loss: 1.1049, test_f1: 0.3518
 epoch: 91, train_loss: 1.1153, test_loss: 1.1022, test_f1: 0.3543
 epoch: 92, train_loss: 1.1195, test_loss: 1.0978, test_f1: 0.3574
 epoch: 93, train_loss: 1.1230, test_loss: 1.0987, test_f1: 0.3574
 epoch: 94, train_loss: 1.1163, test_loss: 1.0997, test_f1: 0.3564
 epoch: 95, train_loss: 1.1152, test_loss: 1.0991, test_f1: 0.3543
 epoch: 96, train_loss: 1.1182, test_loss: 1.0973, test_f1: 0.3564
 epoch: 97, train_loss: 1.1150, test_loss: 1.0968, test_f1: 0.3564
 epoch: 98, train_loss: 1.1180, test_loss: 1.0956, test_f1: 0.3574
 epoch: 99, train_loss: 1.1099, test_loss: 1.0944, test_f1: 0.3564
##################ITERATION #9 ****************************************
 epoch: 0, train_loss: 1.3353, test_loss: 1.3539, test_f1: 0.2260
 epoch: 1, train_loss: 1.3211, test_loss: 1.3560, test_f1: 0.2260
 epoch: 2, train_loss: 1.3127, test_loss: 1.3618, test_f1: 0.2260
 epoch: 3, train_loss: 1.3031, test_loss: 1.3560, test_f1: 0.2260
 epoch: 4, train_loss: 1.2972, test_loss: 1.3375, test_f1: 0.2260
 epoch: 5, train_loss: 1.2901, test_loss: 1.3066, test_f1: 0.2260
 epoch: 6, train_loss: 1.2804, test_loss: 1.2923, test_f1: 0.2260
 epoch: 7, train_loss: 1.2760, test_loss: 1.2825, test_f1: 0.2260
 epoch: 8, train_loss: 1.2722, test_loss: 1.2754, test_f1: 0.2260
 epoch: 9, train_loss: 1.2651, test_loss: 1.2687, test_f1: 0.2260
 epoch: 10, train_loss: 1.2575, test_loss: 1.2604, test_f1: 0.2260
 epoch: 11, train_loss: 1.2542, test_loss: 1.2547, test_f1: 0.2260
 epoch: 12, train_loss: 1.2495, test_loss: 1.2490, test_f1: 0.2260
 epoch: 13, train_loss: 1.2432, test_loss: 1.2435, test_f1: 0.2260
 epoch: 14, train_loss: 1.2379, test_loss: 1.2375, test_f1: 0.2260
 epoch: 15, train_loss: 1.2362, test_loss: 1.2324, test_f1: 0.2260
 epoch: 16, train_loss: 1.2319, test_loss: 1.2284, test_f1: 0.2260
 epoch: 17, train_loss: 1.2303, test_loss: 1.2241, test_f1: 0.2260
 epoch: 18, train_loss: 1.2234, test_loss: 1.2181, test_f1: 0.2260
 epoch: 19, train_loss: 1.2242, test_loss: 1.2130, test_f1: 0.2260
 epoch: 20, train_loss: 1.2160, test_loss: 1.2081, test_f1: 0.2260
 epoch: 21, train_loss: 1.2154, test_loss: 1.2045, test_f1: 0.2260
 epoch: 22, train_loss: 1.2136, test_loss: 1.2011, test_f1: 0.2359
 epoch: 23, train_loss: 1.2124, test_loss: 1.1978, test_f1: 0.2518
 epoch: 24, train_loss: 1.2064, test_loss: 1.1941, test_f1: 0.2699
 epoch: 25, train_loss: 1.2041, test_loss: 1.1898, test_f1: 0.2941
 epoch: 26, train_loss: 1.1992, test_loss: 1.1843, test_f1: 0.3062
 epoch: 27, train_loss: 1.1964, test_loss: 1.1808, test_f1: 0.3263
 epoch: 28, train_loss: 1.1936, test_loss: 1.1770, test_f1: 0.3335
 epoch: 29, train_loss: 1.1923, test_loss: 1.1741, test_f1: 0.3447
 epoch: 30, train_loss: 1.1903, test_loss: 1.1700, test_f1: 0.3484
 epoch: 31, train_loss: 1.1880, test_loss: 1.1662, test_f1: 0.3494
 epoch: 32, train_loss: 1.1819, test_loss: 1.1631, test_f1: 0.3494
 epoch: 33, train_loss: 1.1794, test_loss: 1.1601, test_f1: 0.3494
 epoch: 34, train_loss: 1.1784, test_loss: 1.1573, test_f1: 0.3491
 epoch: 35, train_loss: 1.1739, test_loss: 1.1542, test_f1: 0.3494
 epoch: 36, train_loss: 1.1714, test_loss: 1.1505, test_f1: 0.3484
 epoch: 37, train_loss: 1.1701, test_loss: 1.1485, test_f1: 0.3494
 epoch: 38, train_loss: 1.1693, test_loss: 1.1464, test_f1: 0.3484
 epoch: 39, train_loss: 1.1669, test_loss: 1.1436, test_f1: 0.3504
 epoch: 40, train_loss: 1.1652, test_loss: 1.1399, test_f1: 0.3534
 epoch: 41, train_loss: 1.1612, test_loss: 1.1365, test_f1: 0.3534
 epoch: 42, train_loss: 1.1550, test_loss: 1.1346, test_f1: 0.3574
 epoch: 43, train_loss: 1.1548, test_loss: 1.1323, test_f1: 0.3635
 epoch: 44, train_loss: 1.1511, test_loss: 1.1298, test_f1: 0.3669
 epoch: 45, train_loss: 1.1521, test_loss: 1.1268, test_f1: 0.3656
 epoch: 46, train_loss: 1.1490, test_loss: 1.1244, test_f1: 0.3656
 epoch: 47, train_loss: 1.1458, test_loss: 1.1227, test_f1: 0.3675
 epoch: 48, train_loss: 1.1417, test_loss: 1.1230, test_f1: 0.3674
 epoch: 49, train_loss: 1.1437, test_loss: 1.1206, test_f1: 0.3674
 epoch: 50, train_loss: 1.1441, test_loss: 1.1180, test_f1: 0.3699
 epoch: 51, train_loss: 1.1372, test_loss: 1.1171, test_f1: 0.3699
 epoch: 52, train_loss: 1.1352, test_loss: 1.1140, test_f1: 0.3699
 epoch: 53, train_loss: 1.1306, test_loss: 1.1124, test_f1: 0.3723
 epoch: 54, train_loss: 1.1319, test_loss: 1.1110, test_f1: 0.3738
 epoch: 55, train_loss: 1.1336, test_loss: 1.1107, test_f1: 0.3832
 epoch: 56, train_loss: 1.1287, test_loss: 1.1084, test_f1: 0.3750
 epoch: 57, train_loss: 1.1284, test_loss: 1.1081, test_f1: 0.3751
 epoch: 58, train_loss: 1.1308, test_loss: 1.1078, test_f1: 0.3857
 epoch: 59, train_loss: 1.1324, test_loss: 1.1052, test_f1: 0.3842
 epoch: 60, train_loss: 1.1286, test_loss: 1.1053, test_f1: 0.3750
 epoch: 61, train_loss: 1.1270, test_loss: 1.1057, test_f1: 0.3675
 epoch: 62, train_loss: 1.1201, test_loss: 1.1051, test_f1: 0.3649
 epoch: 63, train_loss: 1.1263, test_loss: 1.1046, test_f1: 0.3643
 epoch: 64, train_loss: 1.1196, test_loss: 1.1032, test_f1: 0.3652
 epoch: 65, train_loss: 1.1196, test_loss: 1.1035, test_f1: 0.3652
 epoch: 66, train_loss: 1.1191, test_loss: 1.1024, test_f1: 0.3643
 epoch: 67, train_loss: 1.1219, test_loss: 1.1010, test_f1: 0.3643
 epoch: 68, train_loss: 1.1250, test_loss: 1.1009, test_f1: 0.3643
 epoch: 69, train_loss: 1.1159, test_loss: 1.1000, test_f1: 0.3643
 epoch: 70, train_loss: 1.1175, test_loss: 1.0988, test_f1: 0.3676
 epoch: 71, train_loss: 1.1162, test_loss: 1.0978, test_f1: 0.3696
 epoch: 72, train_loss: 1.1186, test_loss: 1.0965, test_f1: 0.3696
 epoch: 73, train_loss: 1.1134, test_loss: 1.0960, test_f1: 0.3696
 epoch: 74, train_loss: 1.1142, test_loss: 1.0951, test_f1: 0.3674
 epoch: 75, train_loss: 1.1117, test_loss: 1.0942, test_f1: 0.3667
 epoch: 76, train_loss: 1.1116, test_loss: 1.0930, test_f1: 0.3681
 epoch: 77, train_loss: 1.1179, test_loss: 1.0920, test_f1: 0.3694
 epoch: 78, train_loss: 1.1085, test_loss: 1.0923, test_f1: 0.3674
 epoch: 79, train_loss: 1.1057, test_loss: 1.0915, test_f1: 0.3728
 epoch: 80, train_loss: 1.1111, test_loss: 1.0894, test_f1: 0.3897
 epoch: 81, train_loss: 1.1089, test_loss: 1.0883, test_f1: 0.3815
 epoch: 82, train_loss: 1.1068, test_loss: 1.0882, test_f1: 0.4039
 epoch: 83, train_loss: 1.1046, test_loss: 1.0881, test_f1: 0.3939
 epoch: 84, train_loss: 1.1027, test_loss: 1.0862, test_f1: 0.3826
 epoch: 85, train_loss: 1.1050, test_loss: 1.0866, test_f1: 0.3784
 epoch: 86, train_loss: 1.1049, test_loss: 1.0845, test_f1: 0.3797
 epoch: 87, train_loss: 1.1060, test_loss: 1.0843, test_f1: 0.3935
 epoch: 88, train_loss: 1.0993, test_loss: 1.0847, test_f1: 0.4072
 epoch: 89, train_loss: 1.0972, test_loss: 1.0829, test_f1: 0.4042
 epoch: 90, train_loss: 1.0939, test_loss: 1.0822, test_f1: 0.4072
 epoch: 91, train_loss: 1.0962, test_loss: 1.0823, test_f1: 0.3812
 epoch: 92, train_loss: 1.1019, test_loss: 1.0819, test_f1: 0.3805
 epoch: 93, train_loss: 1.0973, test_loss: 1.0815, test_f1: 0.3786
 epoch: 94, train_loss: 1.0960, test_loss: 1.0805, test_f1: 0.3790
 epoch: 95, train_loss: 1.0957, test_loss: 1.0792, test_f1: 0.3840
 epoch: 96, train_loss: 1.0838, test_loss: 1.0790, test_f1: 0.4051
 epoch: 97, train_loss: 1.0970, test_loss: 1.0774, test_f1: 0.4073
 epoch: 98, train_loss: 1.0945, test_loss: 1.0759, test_f1: 0.4155
 epoch: 99, train_loss: 1.0952, test_loss: 1.0753, test_f1: 0.3893

Training completed in 447.96 seconds
Best F1: 0.4155 at epoch 98
Mean F1 across iterations: 0.3285  0.0521
========================FINAL RESULTS================================
FEGIN weighted F1: 0.4155  0.0521
python main.py --data ltspice_examples --representation component_pin --model FEGIN --layers 6 --hiddens 16 --batch_size 256 --lr 0.0001 --emb_size 512 --epochs 100 --save_appendix component_pin_L6_H16_BS256_LR0.0001_E512 --no_val
-----



STDERR:
  File "main.py", line 370, in <module>
    main()
  File "main.py", line 254, in main
    dataset = dataset_class(
  File "/home/philip/projects/ltspice_examples_code_repo/Circuit-Completion-Using-GNNs/component_classification_with_link_prediction_head/evaluation/FEGIN/kernel/circuit_datasets.py", line 15, in __init__
    self.data, self.slices = torch.load(self.processed_paths[0])
  File "/home/philip/.local/lib/python3.8/site-packages/torch/serialization.py", line 1040, in load
    warnings.warn(
  File "/usr/lib/python3.8/warnings.py", line 109, in _showwarnmsg
    sw(msg.message, msg.category, msg.filename, msg.lineno,
  File "main.py", line 47, in warn_with_traceback
    traceback.print_stack(file=log)
/home/philip/projects/ltspice_examples_code_repo/Circuit-Completion-Using-GNNs/component_classification_with_link_prediction_head/evaluation/FEGIN/kernel/circuit_datasets.py:15: FutureWarning: You are using `torch.load` with `weights_only=False` (the current default value), which uses the default pickle module implicitly. It is possible to construct malicious pickle data which will execute arbitrary code during unpickling (See https://github.com/pytorch/pytorch/blob/main/SECURITY.md#untrusted-models for more details). In a future release, the default value for `weights_only` will be flipped to `True`. This limits the functions that could be executed during unpickling. Arbitrary objects will no longer be allowed to be loaded via this mode unless they are explicitly allowlisted by the user via `torch.serialization.add_safe_globals`. We recommend you start setting `weights_only=True` for any use case where you don't have full control of the loaded file. Please open an issue on GitHub for any issues related to this experimental feature.
  self.data, self.slices = torch.load(self.processed_paths[0])
