STDOUT:
Results will be saved in /home/philip/projects/llm_inference_code_repo/Circuit-Completion-Using-GNNs/component_classification_with_link_prediction_head/evaluation/FEGIN/results/model_FEGIN_dataset_ltspice_examples
Command line input: python main.py --data ltspice_examples --representation component_net --model FEGIN --layers 4 --hiddens 32 --batch_size 128 --lr 0.01 --emb_size 250 --epochs 100 --save_appendix component_net_L4_H32_BS128_LR0.01_E250 --no_val
 is saved.
-----
ltspice_examples - FEGIN
Using 4 layers, 32 hidden units, h = 2
Loading component_net representation dataset
ENTERED
Training FEGIN on component_net representation
Train: 3558, Test: 846
##################ITERATION #0 ****************************************
 epoch: 0, train_loss: 1.2315, test_loss: 1.2398, test_f1: 0.2613
 epoch: 1, train_loss: 1.0384, test_loss: 1.0290, test_f1: 0.4874
 epoch: 2, train_loss: 0.9804, test_loss: 0.9829, test_f1: 0.4757
 epoch: 3, train_loss: 0.9593, test_loss: 1.0231, test_f1: 0.4608
 epoch: 4, train_loss: 0.9495, test_loss: 0.9586, test_f1: 0.4579
 epoch: 5, train_loss: 0.9493, test_loss: 0.9856, test_f1: 0.4917
 epoch: 6, train_loss: 0.9430, test_loss: 0.9056, test_f1: 0.5395
 epoch: 7, train_loss: 0.9256, test_loss: 0.9293, test_f1: 0.5243
 epoch: 8, train_loss: 0.9121, test_loss: 0.9191, test_f1: 0.4990
 epoch: 9, train_loss: 0.8971, test_loss: 0.9036, test_f1: 0.5094
 epoch: 10, train_loss: 0.9006, test_loss: 0.9084, test_f1: 0.5260
 epoch: 11, train_loss: 0.8888, test_loss: 0.9680, test_f1: 0.5416
 epoch: 12, train_loss: 0.8987, test_loss: 0.9041, test_f1: 0.5095
 epoch: 13, train_loss: 0.8751, test_loss: 1.0448, test_f1: 0.4894
 epoch: 14, train_loss: 0.8931, test_loss: 0.9056, test_f1: 0.4995
 epoch: 15, train_loss: 0.8760, test_loss: 0.9187, test_f1: 0.4986
 epoch: 16, train_loss: 0.8712, test_loss: 0.9082, test_f1: 0.4946
 epoch: 17, train_loss: 0.8556, test_loss: 0.9517, test_f1: 0.5108
 epoch: 18, train_loss: 0.8705, test_loss: 0.9467, test_f1: 0.5011
 epoch: 19, train_loss: 0.8714, test_loss: 0.9521, test_f1: 0.5201
 epoch: 20, train_loss: 0.8644, test_loss: 0.9285, test_f1: 0.5217
 epoch: 21, train_loss: 0.8459, test_loss: 0.9784, test_f1: 0.5008
 epoch: 22, train_loss: 0.8573, test_loss: 0.9390, test_f1: 0.5201
 epoch: 23, train_loss: 0.8442, test_loss: 0.9312, test_f1: 0.5458
 epoch: 24, train_loss: 0.8415, test_loss: 0.9086, test_f1: 0.5097
 epoch: 25, train_loss: 0.8424, test_loss: 0.9327, test_f1: 0.5336
 epoch: 26, train_loss: 0.8347, test_loss: 0.9862, test_f1: 0.5074
 epoch: 27, train_loss: 0.8320, test_loss: 0.9248, test_f1: 0.5378
 epoch: 28, train_loss: 0.8264, test_loss: 0.9940, test_f1: 0.5335
 epoch: 29, train_loss: 0.7970, test_loss: 0.9820, test_f1: 0.5776
 epoch: 30, train_loss: 0.8116, test_loss: 0.9203, test_f1: 0.5668
 epoch: 31, train_loss: 0.8042, test_loss: 0.9767, test_f1: 0.5130
 epoch: 32, train_loss: 0.8177, test_loss: 1.0631, test_f1: 0.5065
 epoch: 33, train_loss: 0.8198, test_loss: 0.9354, test_f1: 0.5358
 epoch: 34, train_loss: 0.8017, test_loss: 0.9331, test_f1: 0.5780
 epoch: 35, train_loss: 0.8008, test_loss: 0.9173, test_f1: 0.5338
 epoch: 36, train_loss: 0.7891, test_loss: 0.9124, test_f1: 0.5674
 epoch: 37, train_loss: 0.7807, test_loss: 1.0072, test_f1: 0.5488
 epoch: 38, train_loss: 0.7963, test_loss: 0.9975, test_f1: 0.5432
 epoch: 39, train_loss: 0.7956, test_loss: 0.9431, test_f1: 0.5729
 epoch: 40, train_loss: 0.7880, test_loss: 0.9440, test_f1: 0.5488
 epoch: 41, train_loss: 0.7733, test_loss: 0.9718, test_f1: 0.5622
 epoch: 42, train_loss: 0.7711, test_loss: 1.0086, test_f1: 0.5774
 epoch: 43, train_loss: 0.7731, test_loss: 0.9398, test_f1: 0.5742
 epoch: 44, train_loss: 0.7454, test_loss: 0.9839, test_f1: 0.5718
 epoch: 45, train_loss: 0.7658, test_loss: 0.9570, test_f1: 0.5918
 epoch: 46, train_loss: 0.7669, test_loss: 0.9684, test_f1: 0.5951
 epoch: 47, train_loss: 0.7414, test_loss: 0.9200, test_f1: 0.6000
 epoch: 48, train_loss: 0.7512, test_loss: 0.9631, test_f1: 0.5598
 epoch: 49, train_loss: 0.7533, test_loss: 0.9472, test_f1: 0.5714
 epoch: 50, train_loss: 0.7629, test_loss: 0.9601, test_f1: 0.5643
 epoch: 51, train_loss: 0.7369, test_loss: 0.9655, test_f1: 0.6154
 epoch: 52, train_loss: 0.7100, test_loss: 0.9352, test_f1: 0.5915
 epoch: 53, train_loss: 0.6954, test_loss: 0.9379, test_f1: 0.5994
 epoch: 54, train_loss: 0.7023, test_loss: 0.9084, test_f1: 0.6071
 epoch: 55, train_loss: 0.6872, test_loss: 0.9494, test_f1: 0.5985
 epoch: 56, train_loss: 0.6863, test_loss: 0.9119, test_f1: 0.5850
 epoch: 57, train_loss: 0.6746, test_loss: 0.9146, test_f1: 0.6245
 epoch: 58, train_loss: 0.6751, test_loss: 0.9509, test_f1: 0.6268
 epoch: 59, train_loss: 0.6685, test_loss: 0.8727, test_f1: 0.5991
 epoch: 60, train_loss: 0.6756, test_loss: 1.0526, test_f1: 0.5799
 epoch: 61, train_loss: 0.6709, test_loss: 0.9749, test_f1: 0.6136
 epoch: 62, train_loss: 0.6809, test_loss: 0.9259, test_f1: 0.6088
 epoch: 63, train_loss: 0.6826, test_loss: 0.8982, test_f1: 0.6230
 epoch: 64, train_loss: 0.6678, test_loss: 0.9481, test_f1: 0.6048
 epoch: 65, train_loss: 0.6649, test_loss: 0.9524, test_f1: 0.6260
 epoch: 66, train_loss: 0.6645, test_loss: 0.9145, test_f1: 0.6006
 epoch: 67, train_loss: 0.6570, test_loss: 0.9354, test_f1: 0.6258
 epoch: 68, train_loss: 0.6679, test_loss: 0.9606, test_f1: 0.6080
 epoch: 69, train_loss: 0.6472, test_loss: 1.1093, test_f1: 0.5580
 epoch: 70, train_loss: 0.6620, test_loss: 0.9831, test_f1: 0.6054
 epoch: 71, train_loss: 0.6486, test_loss: 0.9105, test_f1: 0.6219
 epoch: 72, train_loss: 0.6498, test_loss: 0.9456, test_f1: 0.6126
 epoch: 73, train_loss: 0.6507, test_loss: 0.9675, test_f1: 0.6247
 epoch: 74, train_loss: 0.6709, test_loss: 0.9298, test_f1: 0.6114
 epoch: 75, train_loss: 0.6415, test_loss: 0.9381, test_f1: 0.6165
 epoch: 76, train_loss: 0.6327, test_loss: 0.9879, test_f1: 0.6129
 epoch: 77, train_loss: 0.6418, test_loss: 0.9759, test_f1: 0.6140
 epoch: 78, train_loss: 0.6461, test_loss: 0.9725, test_f1: 0.6287
 epoch: 79, train_loss: 0.6291, test_loss: 0.9164, test_f1: 0.6299
 epoch: 80, train_loss: 0.6452, test_loss: 0.9678, test_f1: 0.5858
 epoch: 81, train_loss: 0.6082, test_loss: 0.9551, test_f1: 0.6288
 epoch: 82, train_loss: 0.6213, test_loss: 0.8990, test_f1: 0.6464
 epoch: 83, train_loss: 0.6369, test_loss: 1.0836, test_f1: 0.5965
 epoch: 84, train_loss: 0.6204, test_loss: 0.8982, test_f1: 0.6120
 epoch: 85, train_loss: 0.6163, test_loss: 0.9414, test_f1: 0.6211
 epoch: 86, train_loss: 0.6071, test_loss: 0.9444, test_f1: 0.6346
 epoch: 87, train_loss: 0.6142, test_loss: 0.9907, test_f1: 0.6424
 epoch: 88, train_loss: 0.6244, test_loss: 0.9202, test_f1: 0.6297
 epoch: 89, train_loss: 0.6246, test_loss: 1.1384, test_f1: 0.5847
 epoch: 90, train_loss: 0.6329, test_loss: 1.0129, test_f1: 0.6277
 epoch: 91, train_loss: 0.5992, test_loss: 0.9276, test_f1: 0.6496
 epoch: 92, train_loss: 0.5900, test_loss: 1.0953, test_f1: 0.6293
 epoch: 93, train_loss: 0.5825, test_loss: 1.0694, test_f1: 0.5845
 epoch: 94, train_loss: 0.5894, test_loss: 0.9586, test_f1: 0.6173
 epoch: 95, train_loss: 0.6216, test_loss: 0.9037, test_f1: 0.5980
 epoch: 96, train_loss: 0.6333, test_loss: 1.0453, test_f1: 0.6034
 epoch: 97, train_loss: 0.5940, test_loss: 0.9482, test_f1: 0.6373
 epoch: 98, train_loss: 0.6123, test_loss: 0.9574, test_f1: 0.6362
 epoch: 99, train_loss: 0.5850, test_loss: 0.9475, test_f1: 0.6462
##################ITERATION #1 ****************************************
 epoch: 0, train_loss: 1.1996, test_loss: 1.1592, test_f1: 0.3122
 epoch: 1, train_loss: 1.0377, test_loss: 1.0486, test_f1: 0.4182
 epoch: 2, train_loss: 0.9925, test_loss: 0.9845, test_f1: 0.4487
 epoch: 3, train_loss: 0.9530, test_loss: 0.9685, test_f1: 0.5301
 epoch: 4, train_loss: 0.9445, test_loss: 0.8959, test_f1: 0.5035
 epoch: 5, train_loss: 0.9250, test_loss: 1.0223, test_f1: 0.4847
 epoch: 6, train_loss: 0.9179, test_loss: 0.9368, test_f1: 0.5131
 epoch: 7, train_loss: 0.9046, test_loss: 1.0214, test_f1: 0.5130
 epoch: 8, train_loss: 0.9016, test_loss: 0.8802, test_f1: 0.5312
 epoch: 9, train_loss: 0.9002, test_loss: 0.8938, test_f1: 0.5791
 epoch: 10, train_loss: 0.8694, test_loss: 0.9868, test_f1: 0.4658
 epoch: 11, train_loss: 0.8794, test_loss: 0.9597, test_f1: 0.5113
 epoch: 12, train_loss: 0.8702, test_loss: 0.9600, test_f1: 0.5237
 epoch: 13, train_loss: 0.8757, test_loss: 0.9716, test_f1: 0.5301
 epoch: 14, train_loss: 0.8585, test_loss: 1.0057, test_f1: 0.5470
 epoch: 15, train_loss: 0.8531, test_loss: 0.9968, test_f1: 0.5376
 epoch: 16, train_loss: 0.8564, test_loss: 0.9581, test_f1: 0.5675
 epoch: 17, train_loss: 0.8332, test_loss: 0.9108, test_f1: 0.5523
 epoch: 18, train_loss: 0.8421, test_loss: 0.9367, test_f1: 0.4965
 epoch: 19, train_loss: 0.8376, test_loss: 1.0406, test_f1: 0.5709
 epoch: 20, train_loss: 0.8445, test_loss: 0.9472, test_f1: 0.5141
 epoch: 21, train_loss: 0.8108, test_loss: 0.9829, test_f1: 0.5358
 epoch: 22, train_loss: 0.8099, test_loss: 1.0190, test_f1: 0.5361
 epoch: 23, train_loss: 0.8210, test_loss: 1.0517, test_f1: 0.5029
 epoch: 24, train_loss: 0.8109, test_loss: 0.9468, test_f1: 0.5456
 epoch: 25, train_loss: 0.8248, test_loss: 0.9743, test_f1: 0.5104
 epoch: 26, train_loss: 0.8043, test_loss: 1.0019, test_f1: 0.5459
 epoch: 27, train_loss: 0.7939, test_loss: 1.0582, test_f1: 0.5011
 epoch: 28, train_loss: 0.7821, test_loss: 0.9901, test_f1: 0.5903
 epoch: 29, train_loss: 0.7960, test_loss: 0.9659, test_f1: 0.5596
 epoch: 30, train_loss: 0.7919, test_loss: 1.0027, test_f1: 0.5662
 epoch: 31, train_loss: 0.7737, test_loss: 0.9615, test_f1: 0.5898
 epoch: 32, train_loss: 0.7850, test_loss: 0.9346, test_f1: 0.5741
 epoch: 33, train_loss: 0.7807, test_loss: 1.0657, test_f1: 0.4953
 epoch: 34, train_loss: 0.8004, test_loss: 0.9738, test_f1: 0.5274
 epoch: 35, train_loss: 0.7791, test_loss: 0.9390, test_f1: 0.5547
 epoch: 36, train_loss: 0.7600, test_loss: 0.9495, test_f1: 0.5679
 epoch: 37, train_loss: 0.7443, test_loss: 0.9037, test_f1: 0.6136
 epoch: 38, train_loss: 0.7616, test_loss: 0.9797, test_f1: 0.5555
 epoch: 39, train_loss: 0.7503, test_loss: 0.9688, test_f1: 0.5792
 epoch: 40, train_loss: 0.7664, test_loss: 0.9050, test_f1: 0.5833
 epoch: 41, train_loss: 0.7560, test_loss: 0.9447, test_f1: 0.5920
 epoch: 42, train_loss: 0.7370, test_loss: 0.8320, test_f1: 0.6011
 epoch: 43, train_loss: 0.7429, test_loss: 1.0115, test_f1: 0.5953
 epoch: 44, train_loss: 0.7443, test_loss: 0.9568, test_f1: 0.5821
 epoch: 45, train_loss: 0.7422, test_loss: 0.9815, test_f1: 0.6064
 epoch: 46, train_loss: 0.7245, test_loss: 1.1536, test_f1: 0.5370
 epoch: 47, train_loss: 0.7133, test_loss: 0.9330, test_f1: 0.6287
 epoch: 48, train_loss: 0.7356, test_loss: 0.9785, test_f1: 0.6027
 epoch: 49, train_loss: 0.7300, test_loss: 0.9529, test_f1: 0.6149
 epoch: 50, train_loss: 0.7020, test_loss: 0.9544, test_f1: 0.6086
 epoch: 51, train_loss: 0.6864, test_loss: 0.9645, test_f1: 0.6021
 epoch: 52, train_loss: 0.6796, test_loss: 0.9577, test_f1: 0.6054
 epoch: 53, train_loss: 0.6801, test_loss: 0.9497, test_f1: 0.6316
 epoch: 54, train_loss: 0.6588, test_loss: 1.0307, test_f1: 0.5929
 epoch: 55, train_loss: 0.6733, test_loss: 0.9357, test_f1: 0.6422
 epoch: 56, train_loss: 0.6607, test_loss: 0.9249, test_f1: 0.6273
 epoch: 57, train_loss: 0.6584, test_loss: 0.9257, test_f1: 0.6353
 epoch: 58, train_loss: 0.6480, test_loss: 1.0108, test_f1: 0.6338
 epoch: 59, train_loss: 0.6569, test_loss: 0.9552, test_f1: 0.6179
 epoch: 60, train_loss: 0.6449, test_loss: 0.9695, test_f1: 0.6134
 epoch: 61, train_loss: 0.6500, test_loss: 0.9719, test_f1: 0.6386
 epoch: 62, train_loss: 0.6448, test_loss: 0.9873, test_f1: 0.6157
 epoch: 63, train_loss: 0.6417, test_loss: 0.9538, test_f1: 0.6462
 epoch: 64, train_loss: 0.6345, test_loss: 0.9982, test_f1: 0.6253
 epoch: 65, train_loss: 0.6345, test_loss: 0.9316, test_f1: 0.6321
 epoch: 66, train_loss: 0.6283, test_loss: 0.9518, test_f1: 0.6349
 epoch: 67, train_loss: 0.6349, test_loss: 0.9937, test_f1: 0.6360
 epoch: 68, train_loss: 0.6415, test_loss: 1.0042, test_f1: 0.6200
 epoch: 69, train_loss: 0.6296, test_loss: 0.9719, test_f1: 0.6329
 epoch: 70, train_loss: 0.6231, test_loss: 1.0174, test_f1: 0.6280
 epoch: 71, train_loss: 0.6057, test_loss: 0.9775, test_f1: 0.6652
 epoch: 72, train_loss: 0.6174, test_loss: 0.9990, test_f1: 0.6535
 epoch: 73, train_loss: 0.6052, test_loss: 0.9653, test_f1: 0.6292
 epoch: 74, train_loss: 0.6037, test_loss: 0.9916, test_f1: 0.6514
 epoch: 75, train_loss: 0.6017, test_loss: 1.0253, test_f1: 0.6456
 epoch: 76, train_loss: 0.6066, test_loss: 0.9385, test_f1: 0.6238
 epoch: 77, train_loss: 0.5869, test_loss: 0.9545, test_f1: 0.6586
 epoch: 78, train_loss: 0.6061, test_loss: 0.9783, test_f1: 0.6382
 epoch: 79, train_loss: 0.6004, test_loss: 1.0051, test_f1: 0.6431
 epoch: 80, train_loss: 0.6106, test_loss: 1.0361, test_f1: 0.6154
 epoch: 81, train_loss: 0.5988, test_loss: 0.9556, test_f1: 0.6496
 epoch: 82, train_loss: 0.6134, test_loss: 1.0433, test_f1: 0.6472
 epoch: 83, train_loss: 0.6130, test_loss: 0.9622, test_f1: 0.6564
 epoch: 84, train_loss: 0.5887, test_loss: 1.0341, test_f1: 0.6450
 epoch: 85, train_loss: 0.5867, test_loss: 1.0571, test_f1: 0.6160
 epoch: 86, train_loss: 0.5966, test_loss: 0.9695, test_f1: 0.6083
 epoch: 87, train_loss: 0.6045, test_loss: 1.0882, test_f1: 0.6023
 epoch: 88, train_loss: 0.6044, test_loss: 0.9861, test_f1: 0.6439
 epoch: 89, train_loss: 0.5864, test_loss: 1.0407, test_f1: 0.6448
 epoch: 90, train_loss: 0.5900, test_loss: 1.0587, test_f1: 0.6184
 epoch: 91, train_loss: 0.5855, test_loss: 0.9731, test_f1: 0.6261
 epoch: 92, train_loss: 0.5788, test_loss: 0.9593, test_f1: 0.6359
 epoch: 93, train_loss: 0.5997, test_loss: 1.1006, test_f1: 0.5908
 epoch: 94, train_loss: 0.5827, test_loss: 1.0469, test_f1: 0.6375
 epoch: 95, train_loss: 0.5814, test_loss: 1.0202, test_f1: 0.6147
 epoch: 96, train_loss: 0.5743, test_loss: 1.0053, test_f1: 0.6252
 epoch: 97, train_loss: 0.5622, test_loss: 1.0309, test_f1: 0.6419
 epoch: 98, train_loss: 0.5872, test_loss: 1.0579, test_f1: 0.6497
 epoch: 99, train_loss: 0.5625, test_loss: 1.0359, test_f1: 0.6524
##################ITERATION #2 ****************************************
 epoch: 0, train_loss: 1.1502, test_loss: 1.0733, test_f1: 0.3661
 epoch: 1, train_loss: 1.0000, test_loss: 0.9939, test_f1: 0.5168
 epoch: 2, train_loss: 0.9611, test_loss: 0.9892, test_f1: 0.4856
 epoch: 3, train_loss: 0.9420, test_loss: 1.0819, test_f1: 0.4187
 epoch: 4, train_loss: 0.9154, test_loss: 0.9981, test_f1: 0.5162
 epoch: 5, train_loss: 0.9087, test_loss: 0.9861, test_f1: 0.5232
 epoch: 6, train_loss: 0.9010, test_loss: 1.0312, test_f1: 0.4644
 epoch: 7, train_loss: 0.8820, test_loss: 0.9265, test_f1: 0.5411
 epoch: 8, train_loss: 0.8938, test_loss: 0.9676, test_f1: 0.5582
 epoch: 9, train_loss: 0.8845, test_loss: 0.9664, test_f1: 0.5231
 epoch: 10, train_loss: 0.8634, test_loss: 0.9676, test_f1: 0.5097
 epoch: 11, train_loss: 0.8518, test_loss: 0.9385, test_f1: 0.5444
 epoch: 12, train_loss: 0.8525, test_loss: 0.9538, test_f1: 0.5545
 epoch: 13, train_loss: 0.8650, test_loss: 0.9729, test_f1: 0.5387
 epoch: 14, train_loss: 0.8443, test_loss: 1.0098, test_f1: 0.5281
 epoch: 15, train_loss: 0.8319, test_loss: 0.9623, test_f1: 0.5618
 epoch: 16, train_loss: 0.8221, test_loss: 0.9494, test_f1: 0.5694
 epoch: 17, train_loss: 0.8361, test_loss: 0.9702, test_f1: 0.5774
 epoch: 18, train_loss: 0.8211, test_loss: 0.9371, test_f1: 0.5963
 epoch: 19, train_loss: 0.8067, test_loss: 0.9210, test_f1: 0.5971
 epoch: 20, train_loss: 0.7977, test_loss: 0.9173, test_f1: 0.5582
 epoch: 21, train_loss: 0.8081, test_loss: 0.9124, test_f1: 0.5832
 epoch: 22, train_loss: 0.7988, test_loss: 0.9437, test_f1: 0.5933
 epoch: 23, train_loss: 0.7767, test_loss: 1.0094, test_f1: 0.6085
 epoch: 24, train_loss: 0.8102, test_loss: 1.0044, test_f1: 0.5108
 epoch: 25, train_loss: 0.7871, test_loss: 0.9889, test_f1: 0.5607
 epoch: 26, train_loss: 0.7752, test_loss: 0.9492, test_f1: 0.5612
 epoch: 27, train_loss: 0.7821, test_loss: 0.9300, test_f1: 0.5637
 epoch: 28, train_loss: 0.7690, test_loss: 1.0164, test_f1: 0.5626
 epoch: 29, train_loss: 0.7547, test_loss: 1.0135, test_f1: 0.6120
 epoch: 30, train_loss: 0.7558, test_loss: 0.9962, test_f1: 0.6013
 epoch: 31, train_loss: 0.7579, test_loss: 0.8522, test_f1: 0.5821
 epoch: 32, train_loss: 0.7505, test_loss: 1.0138, test_f1: 0.5712
 epoch: 33, train_loss: 0.7399, test_loss: 0.9307, test_f1: 0.6311
 epoch: 34, train_loss: 0.7199, test_loss: 0.9906, test_f1: 0.5955
 epoch: 35, train_loss: 0.7288, test_loss: 1.2454, test_f1: 0.5587
 epoch: 36, train_loss: 0.7303, test_loss: 0.8779, test_f1: 0.6244
 epoch: 37, train_loss: 0.7172, test_loss: 1.0842, test_f1: 0.5793
 epoch: 38, train_loss: 0.7015, test_loss: 0.9169, test_f1: 0.6070
 epoch: 39, train_loss: 0.7032, test_loss: 1.0086, test_f1: 0.6316
 epoch: 40, train_loss: 0.7079, test_loss: 1.0542, test_f1: 0.5793
 epoch: 41, train_loss: 0.7150, test_loss: 1.0799, test_f1: 0.5542
 epoch: 42, train_loss: 0.7073, test_loss: 1.0043, test_f1: 0.5923
 epoch: 43, train_loss: 0.6986, test_loss: 0.9950, test_f1: 0.5991
 epoch: 44, train_loss: 0.6953, test_loss: 0.9296, test_f1: 0.6293
 epoch: 45, train_loss: 0.6991, test_loss: 1.0741, test_f1: 0.6162
 epoch: 46, train_loss: 0.6928, test_loss: 1.0693, test_f1: 0.6209
 epoch: 47, train_loss: 0.6871, test_loss: 0.9970, test_f1: 0.6258
 epoch: 48, train_loss: 0.6768, test_loss: 1.1889, test_f1: 0.6273
 epoch: 49, train_loss: 0.6713, test_loss: 1.0434, test_f1: 0.6418
 epoch: 50, train_loss: 0.6700, test_loss: 1.0516, test_f1: 0.5761
 epoch: 51, train_loss: 0.6539, test_loss: 0.9814, test_f1: 0.6532
 epoch: 52, train_loss: 0.6361, test_loss: 0.9620, test_f1: 0.6579
 epoch: 53, train_loss: 0.6254, test_loss: 1.0228, test_f1: 0.6368
 epoch: 54, train_loss: 0.6296, test_loss: 1.0412, test_f1: 0.6478
 epoch: 55, train_loss: 0.6062, test_loss: 1.0859, test_f1: 0.6570
 epoch: 56, train_loss: 0.6091, test_loss: 1.0269, test_f1: 0.6388
 epoch: 57, train_loss: 0.6079, test_loss: 1.0299, test_f1: 0.6451
 epoch: 58, train_loss: 0.6195, test_loss: 1.0341, test_f1: 0.6391
 epoch: 59, train_loss: 0.6138, test_loss: 1.0164, test_f1: 0.6525
 epoch: 60, train_loss: 0.5944, test_loss: 1.1061, test_f1: 0.6335
 epoch: 61, train_loss: 0.6035, test_loss: 1.0383, test_f1: 0.6595
 epoch: 62, train_loss: 0.6149, test_loss: 1.0291, test_f1: 0.6400
 epoch: 63, train_loss: 0.5839, test_loss: 1.0786, test_f1: 0.6417
 epoch: 64, train_loss: 0.6004, test_loss: 1.1034, test_f1: 0.6769
 epoch: 65, train_loss: 0.5941, test_loss: 1.1288, test_f1: 0.6397
 epoch: 66, train_loss: 0.5886, test_loss: 1.0989, test_f1: 0.6450
 epoch: 67, train_loss: 0.5967, test_loss: 1.0075, test_f1: 0.6356
 epoch: 68, train_loss: 0.5788, test_loss: 1.0677, test_f1: 0.6386
 epoch: 69, train_loss: 0.5723, test_loss: 1.0718, test_f1: 0.6341
 epoch: 70, train_loss: 0.5703, test_loss: 1.0724, test_f1: 0.6615
 epoch: 71, train_loss: 0.5814, test_loss: 1.0148, test_f1: 0.6550
 epoch: 72, train_loss: 0.5806, test_loss: 1.0882, test_f1: 0.6522
 epoch: 73, train_loss: 0.5599, test_loss: 1.0954, test_f1: 0.6334
 epoch: 74, train_loss: 0.5772, test_loss: 1.0073, test_f1: 0.6478
 epoch: 75, train_loss: 0.5821, test_loss: 1.1430, test_f1: 0.6273
 epoch: 76, train_loss: 0.5604, test_loss: 1.1101, test_f1: 0.6531
 epoch: 77, train_loss: 0.5761, test_loss: 1.1312, test_f1: 0.6453
 epoch: 78, train_loss: 0.5660, test_loss: 0.9985, test_f1: 0.6529
 epoch: 79, train_loss: 0.5685, test_loss: 1.1307, test_f1: 0.6417
 epoch: 80, train_loss: 0.5664, test_loss: 1.0756, test_f1: 0.6548
 epoch: 81, train_loss: 0.5538, test_loss: 1.0133, test_f1: 0.6547
 epoch: 82, train_loss: 0.5708, test_loss: 1.0570, test_f1: 0.6148
 epoch: 83, train_loss: 0.5611, test_loss: 1.0067, test_f1: 0.6491
 epoch: 84, train_loss: 0.5591, test_loss: 1.0478, test_f1: 0.6593
 epoch: 85, train_loss: 0.5608, test_loss: 1.1600, test_f1: 0.6356
 epoch: 86, train_loss: 0.5712, test_loss: 1.0495, test_f1: 0.6649
 epoch: 87, train_loss: 0.5633, test_loss: 1.1193, test_f1: 0.6281
 epoch: 88, train_loss: 0.5393, test_loss: 1.0844, test_f1: 0.6450
 epoch: 89, train_loss: 0.5465, test_loss: 1.1358, test_f1: 0.6348
 epoch: 90, train_loss: 0.5698, test_loss: 1.2736, test_f1: 0.6274
 epoch: 91, train_loss: 0.5364, test_loss: 1.1275, test_f1: 0.6720
 epoch: 92, train_loss: 0.5395, test_loss: 1.0649, test_f1: 0.6541
 epoch: 93, train_loss: 0.5294, test_loss: 1.1315, test_f1: 0.6769
 epoch: 94, train_loss: 0.5397, test_loss: 1.1039, test_f1: 0.6733
 epoch: 95, train_loss: 0.5563, test_loss: 1.1570, test_f1: 0.6521
 epoch: 96, train_loss: 0.5605, test_loss: 1.1481, test_f1: 0.6369
 epoch: 97, train_loss: 0.5450, test_loss: 1.1429, test_f1: 0.6626
 epoch: 98, train_loss: 0.5330, test_loss: 1.2239, test_f1: 0.6412
 epoch: 99, train_loss: 0.5400, test_loss: 1.1388, test_f1: 0.6665
##################ITERATION #3 ****************************************
 epoch: 0, train_loss: 1.2149, test_loss: 1.2813, test_f1: 0.2990
 epoch: 1, train_loss: 1.0253, test_loss: 1.0244, test_f1: 0.4806
 epoch: 2, train_loss: 1.0016, test_loss: 0.9811, test_f1: 0.4596
 epoch: 3, train_loss: 0.9757, test_loss: 0.9521, test_f1: 0.5021
 epoch: 4, train_loss: 0.9474, test_loss: 1.0231, test_f1: 0.4612
 epoch: 5, train_loss: 0.9311, test_loss: 0.9662, test_f1: 0.4763
 epoch: 6, train_loss: 0.9399, test_loss: 0.9697, test_f1: 0.5031
 epoch: 7, train_loss: 0.9325, test_loss: 0.9690, test_f1: 0.5048
 epoch: 8, train_loss: 0.9093, test_loss: 0.9172, test_f1: 0.5009
 epoch: 9, train_loss: 0.9158, test_loss: 0.9608, test_f1: 0.4657
 epoch: 10, train_loss: 0.8988, test_loss: 1.0047, test_f1: 0.4659
 epoch: 11, train_loss: 0.8870, test_loss: 0.9457, test_f1: 0.5484
 epoch: 12, train_loss: 0.8799, test_loss: 0.9195, test_f1: 0.5321
 epoch: 13, train_loss: 0.8845, test_loss: 0.9864, test_f1: 0.5016
 epoch: 14, train_loss: 0.9148, test_loss: 1.0488, test_f1: 0.4975
 epoch: 15, train_loss: 0.9235, test_loss: 0.9355, test_f1: 0.4881
 epoch: 16, train_loss: 0.8814, test_loss: 0.9535, test_f1: 0.5446
 epoch: 17, train_loss: 0.8929, test_loss: 0.8897, test_f1: 0.4994
 epoch: 18, train_loss: 0.8826, test_loss: 0.9486, test_f1: 0.5067
 epoch: 19, train_loss: 0.8605, test_loss: 0.9075, test_f1: 0.5201
 epoch: 20, train_loss: 0.8527, test_loss: 0.9241, test_f1: 0.5100
 epoch: 21, train_loss: 0.8403, test_loss: 0.9230, test_f1: 0.5032
 epoch: 22, train_loss: 0.8465, test_loss: 0.8583, test_f1: 0.5086
 epoch: 23, train_loss: 0.8565, test_loss: 0.9389, test_f1: 0.5080
 epoch: 24, train_loss: 0.8436, test_loss: 0.8874, test_f1: 0.4934
 epoch: 25, train_loss: 0.8359, test_loss: 0.9272, test_f1: 0.5153
 epoch: 26, train_loss: 0.8319, test_loss: 0.8689, test_f1: 0.5896
 epoch: 27, train_loss: 0.8251, test_loss: 0.8849, test_f1: 0.5734
 epoch: 28, train_loss: 0.8392, test_loss: 0.8226, test_f1: 0.5728
 epoch: 29, train_loss: 0.8111, test_loss: 0.8818, test_f1: 0.5302
 epoch: 30, train_loss: 0.8131, test_loss: 0.8601, test_f1: 0.5789
 epoch: 31, train_loss: 0.8022, test_loss: 0.9346, test_f1: 0.5656
 epoch: 32, train_loss: 0.8131, test_loss: 0.9011, test_f1: 0.5474
 epoch: 33, train_loss: 0.8251, test_loss: 0.8897, test_f1: 0.5522
 epoch: 34, train_loss: 0.8086, test_loss: 0.9112, test_f1: 0.5591
 epoch: 35, train_loss: 0.8197, test_loss: 0.8726, test_f1: 0.5736
 epoch: 36, train_loss: 0.8108, test_loss: 0.8896, test_f1: 0.5223
 epoch: 37, train_loss: 0.8126, test_loss: 0.8843, test_f1: 0.5928
 epoch: 38, train_loss: 0.8325, test_loss: 0.8679, test_f1: 0.5090
 epoch: 39, train_loss: 0.8039, test_loss: 0.8708, test_f1: 0.5817
 epoch: 40, train_loss: 0.7894, test_loss: 0.9043, test_f1: 0.5835
 epoch: 41, train_loss: 0.7784, test_loss: 0.9520, test_f1: 0.5916
 epoch: 42, train_loss: 0.7828, test_loss: 0.9067, test_f1: 0.6189
 epoch: 43, train_loss: 0.7676, test_loss: 0.8307, test_f1: 0.5927
 epoch: 44, train_loss: 0.7876, test_loss: 0.8943, test_f1: 0.6056
 epoch: 45, train_loss: 0.7810, test_loss: 0.8324, test_f1: 0.6108
 epoch: 46, train_loss: 0.7723, test_loss: 0.9172, test_f1: 0.5714
 epoch: 47, train_loss: 0.7753, test_loss: 0.8890, test_f1: 0.5582
 epoch: 48, train_loss: 0.7706, test_loss: 0.9015, test_f1: 0.6350
 epoch: 49, train_loss: 0.7589, test_loss: 0.9400, test_f1: 0.5474
 epoch: 50, train_loss: 0.7446, test_loss: 0.9188, test_f1: 0.5350
 epoch: 51, train_loss: 0.7339, test_loss: 0.8366, test_f1: 0.6251
 epoch: 52, train_loss: 0.7112, test_loss: 0.8540, test_f1: 0.6372
 epoch: 53, train_loss: 0.7035, test_loss: 0.8522, test_f1: 0.6714
 epoch: 54, train_loss: 0.7158, test_loss: 0.8463, test_f1: 0.6340
 epoch: 55, train_loss: 0.6976, test_loss: 0.8211, test_f1: 0.6188
 epoch: 56, train_loss: 0.6901, test_loss: 0.8404, test_f1: 0.6347
 epoch: 57, train_loss: 0.7017, test_loss: 0.8291, test_f1: 0.6388
 epoch: 58, train_loss: 0.7028, test_loss: 0.8252, test_f1: 0.6393
 epoch: 59, train_loss: 0.6720, test_loss: 0.8181, test_f1: 0.6684
 epoch: 60, train_loss: 0.6776, test_loss: 0.8494, test_f1: 0.6498
 epoch: 61, train_loss: 0.6700, test_loss: 0.8441, test_f1: 0.6772
 epoch: 62, train_loss: 0.6965, test_loss: 0.8222, test_f1: 0.6351
 epoch: 63, train_loss: 0.6739, test_loss: 0.8532, test_f1: 0.6521
 epoch: 64, train_loss: 0.6813, test_loss: 0.8470, test_f1: 0.6264
 epoch: 65, train_loss: 0.6804, test_loss: 0.8382, test_f1: 0.6238
 epoch: 66, train_loss: 0.6791, test_loss: 0.8131, test_f1: 0.6720
 epoch: 67, train_loss: 0.6898, test_loss: 0.8569, test_f1: 0.6317
 epoch: 68, train_loss: 0.6739, test_loss: 0.8296, test_f1: 0.6151
 epoch: 69, train_loss: 0.6674, test_loss: 0.8419, test_f1: 0.6201
 epoch: 70, train_loss: 0.6612, test_loss: 0.8203, test_f1: 0.6439
 epoch: 71, train_loss: 0.6599, test_loss: 0.8505, test_f1: 0.6493
 epoch: 72, train_loss: 0.6464, test_loss: 0.8394, test_f1: 0.6533
 epoch: 73, train_loss: 0.6608, test_loss: 0.8116, test_f1: 0.6294
 epoch: 74, train_loss: 0.6656, test_loss: 0.8945, test_f1: 0.6283
 epoch: 75, train_loss: 0.6551, test_loss: 0.8405, test_f1: 0.6400
 epoch: 76, train_loss: 0.6368, test_loss: 0.8679, test_f1: 0.6519
 epoch: 77, train_loss: 0.6472, test_loss: 0.8035, test_f1: 0.6627
 epoch: 78, train_loss: 0.6747, test_loss: 0.8085, test_f1: 0.6016
 epoch: 79, train_loss: 0.6508, test_loss: 0.8373, test_f1: 0.6456
 epoch: 80, train_loss: 0.6465, test_loss: 0.8256, test_f1: 0.6754
 epoch: 81, train_loss: 0.6241, test_loss: 0.8381, test_f1: 0.6346
 epoch: 82, train_loss: 0.6297, test_loss: 0.7859, test_f1: 0.6769
 epoch: 83, train_loss: 0.6060, test_loss: 0.8490, test_f1: 0.6668
 epoch: 84, train_loss: 0.6323, test_loss: 0.8139, test_f1: 0.6324
 epoch: 85, train_loss: 0.6481, test_loss: 0.8733, test_f1: 0.6370
 epoch: 86, train_loss: 0.6403, test_loss: 0.8941, test_f1: 0.6610
 epoch: 87, train_loss: 0.6388, test_loss: 0.8323, test_f1: 0.6260
 epoch: 88, train_loss: 0.6553, test_loss: 0.8796, test_f1: 0.6279
 epoch: 89, train_loss: 0.6241, test_loss: 0.8513, test_f1: 0.6195
 epoch: 90, train_loss: 0.6298, test_loss: 0.8384, test_f1: 0.6375
 epoch: 91, train_loss: 0.6365, test_loss: 0.8636, test_f1: 0.6490
 epoch: 92, train_loss: 0.6218, test_loss: 0.8124, test_f1: 0.6412
 epoch: 93, train_loss: 0.6225, test_loss: 0.8870, test_f1: 0.6428
 epoch: 94, train_loss: 0.6123, test_loss: 0.8562, test_f1: 0.6293
 epoch: 95, train_loss: 0.6184, test_loss: 0.8462, test_f1: 0.6510
 epoch: 96, train_loss: 0.6207, test_loss: 0.8551, test_f1: 0.6232
 epoch: 97, train_loss: 0.6302, test_loss: 0.8921, test_f1: 0.6319
 epoch: 98, train_loss: 0.6064, test_loss: 0.8561, test_f1: 0.6374
 epoch: 99, train_loss: 0.6013, test_loss: 0.9086, test_f1: 0.6421
##################ITERATION #4 ****************************************
 epoch: 0, train_loss: 1.2357, test_loss: 1.2721, test_f1: 0.3066
 epoch: 1, train_loss: 1.0555, test_loss: 1.0553, test_f1: 0.4206
 epoch: 2, train_loss: 0.9955, test_loss: 1.0539, test_f1: 0.4702
 epoch: 3, train_loss: 0.9748, test_loss: 1.0072, test_f1: 0.4987
 epoch: 4, train_loss: 0.9724, test_loss: 0.9762, test_f1: 0.4964
 epoch: 5, train_loss: 0.9512, test_loss: 0.9939, test_f1: 0.4808
 epoch: 6, train_loss: 0.9414, test_loss: 0.9892, test_f1: 0.5246
 epoch: 7, train_loss: 0.9306, test_loss: 1.0155, test_f1: 0.4659
 epoch: 8, train_loss: 0.9282, test_loss: 0.9794, test_f1: 0.4984
 epoch: 9, train_loss: 0.9228, test_loss: 1.0700, test_f1: 0.4530
 epoch: 10, train_loss: 0.9160, test_loss: 0.9896, test_f1: 0.4694
 epoch: 11, train_loss: 0.9080, test_loss: 0.9687, test_f1: 0.5110
 epoch: 12, train_loss: 0.9088, test_loss: 0.9407, test_f1: 0.5199
 epoch: 13, train_loss: 0.8980, test_loss: 0.9558, test_f1: 0.4962
 epoch: 14, train_loss: 0.8922, test_loss: 1.0022, test_f1: 0.5368
 epoch: 15, train_loss: 0.8954, test_loss: 0.9604, test_f1: 0.5428
 epoch: 16, train_loss: 0.8914, test_loss: 0.9639, test_f1: 0.5024
 epoch: 17, train_loss: 0.8853, test_loss: 0.9839, test_f1: 0.4929
 epoch: 18, train_loss: 0.8848, test_loss: 0.9966, test_f1: 0.4907
 epoch: 19, train_loss: 0.8805, test_loss: 1.1159, test_f1: 0.5057
 epoch: 20, train_loss: 0.8559, test_loss: 0.9083, test_f1: 0.5642
 epoch: 21, train_loss: 0.8482, test_loss: 0.9749, test_f1: 0.5391
 epoch: 22, train_loss: 0.8577, test_loss: 0.9627, test_f1: 0.5008
 epoch: 23, train_loss: 0.8595, test_loss: 0.9642, test_f1: 0.5241
 epoch: 24, train_loss: 0.8510, test_loss: 1.0696, test_f1: 0.4731
 epoch: 25, train_loss: 0.8460, test_loss: 0.9804, test_f1: 0.5856
 epoch: 26, train_loss: 0.8529, test_loss: 0.9112, test_f1: 0.5366
 epoch: 27, train_loss: 0.8395, test_loss: 0.9351, test_f1: 0.5702
 epoch: 28, train_loss: 0.8239, test_loss: 1.0312, test_f1: 0.5318
 epoch: 29, train_loss: 0.8418, test_loss: 1.1173, test_f1: 0.4570
 epoch: 30, train_loss: 0.8464, test_loss: 0.9490, test_f1: 0.5070
 epoch: 31, train_loss: 0.8243, test_loss: 0.9786, test_f1: 0.5415
 epoch: 32, train_loss: 0.8224, test_loss: 0.9298, test_f1: 0.5528
 epoch: 33, train_loss: 0.8051, test_loss: 0.9318, test_f1: 0.5779
 epoch: 34, train_loss: 0.8136, test_loss: 0.9588, test_f1: 0.5673
 epoch: 35, train_loss: 0.8057, test_loss: 0.9706, test_f1: 0.5944
 epoch: 36, train_loss: 0.8065, test_loss: 0.9198, test_f1: 0.5622
 epoch: 37, train_loss: 0.8050, test_loss: 0.9497, test_f1: 0.5807
 epoch: 38, train_loss: 0.7957, test_loss: 0.9489, test_f1: 0.6039
 epoch: 39, train_loss: 0.7983, test_loss: 0.9306, test_f1: 0.5758
 epoch: 40, train_loss: 0.7742, test_loss: 0.9141, test_f1: 0.6187
 epoch: 41, train_loss: 0.7806, test_loss: 0.9120, test_f1: 0.6044
 epoch: 42, train_loss: 0.7914, test_loss: 1.1135, test_f1: 0.5046
 epoch: 43, train_loss: 0.7906, test_loss: 0.9364, test_f1: 0.5933
 epoch: 44, train_loss: 0.7866, test_loss: 1.0306, test_f1: 0.5883
 epoch: 45, train_loss: 0.7815, test_loss: 0.9012, test_f1: 0.5829
 epoch: 46, train_loss: 0.7556, test_loss: 0.8454, test_f1: 0.6247
 epoch: 47, train_loss: 0.7640, test_loss: 0.8793, test_f1: 0.6120
 epoch: 48, train_loss: 0.7785, test_loss: 0.9117, test_f1: 0.5958
 epoch: 49, train_loss: 0.7570, test_loss: 0.8828, test_f1: 0.5957
 epoch: 50, train_loss: 0.7851, test_loss: 0.9319, test_f1: 0.5733
 epoch: 51, train_loss: 0.7654, test_loss: 0.9134, test_f1: 0.5798
 epoch: 52, train_loss: 0.7455, test_loss: 0.9142, test_f1: 0.6009
 epoch: 53, train_loss: 0.7239, test_loss: 0.8957, test_f1: 0.6046
 epoch: 54, train_loss: 0.7119, test_loss: 0.9361, test_f1: 0.6172
 epoch: 55, train_loss: 0.7177, test_loss: 0.9100, test_f1: 0.6059
 epoch: 56, train_loss: 0.7093, test_loss: 0.8803, test_f1: 0.6193
 epoch: 57, train_loss: 0.7166, test_loss: 0.8798, test_f1: 0.6284
 epoch: 58, train_loss: 0.6986, test_loss: 0.9940, test_f1: 0.5938
 epoch: 59, train_loss: 0.7191, test_loss: 0.9311, test_f1: 0.6083
 epoch: 60, train_loss: 0.7079, test_loss: 0.8881, test_f1: 0.6092
 epoch: 61, train_loss: 0.7003, test_loss: 0.8644, test_f1: 0.6175
 epoch: 62, train_loss: 0.6960, test_loss: 0.9109, test_f1: 0.6108
 epoch: 63, train_loss: 0.6939, test_loss: 0.9374, test_f1: 0.5928
 epoch: 64, train_loss: 0.6904, test_loss: 0.8953, test_f1: 0.6159
 epoch: 65, train_loss: 0.6737, test_loss: 0.9071, test_f1: 0.6434
 epoch: 66, train_loss: 0.6809, test_loss: 0.9475, test_f1: 0.6352
 epoch: 67, train_loss: 0.6749, test_loss: 0.9408, test_f1: 0.6039
 epoch: 68, train_loss: 0.6607, test_loss: 0.9845, test_f1: 0.6014
 epoch: 69, train_loss: 0.6674, test_loss: 1.0214, test_f1: 0.5799
 epoch: 70, train_loss: 0.6735, test_loss: 0.9303, test_f1: 0.6141
 epoch: 71, train_loss: 0.6753, test_loss: 0.9244, test_f1: 0.6304
 epoch: 72, train_loss: 0.6567, test_loss: 0.9124, test_f1: 0.6295
 epoch: 73, train_loss: 0.6689, test_loss: 0.9614, test_f1: 0.6172
 epoch: 74, train_loss: 0.6632, test_loss: 0.9939, test_f1: 0.6219
 epoch: 75, train_loss: 0.6718, test_loss: 0.9396, test_f1: 0.6149
 epoch: 76, train_loss: 0.6445, test_loss: 0.9613, test_f1: 0.6273
 epoch: 77, train_loss: 0.6428, test_loss: 0.9600, test_f1: 0.6030
 epoch: 78, train_loss: 0.6616, test_loss: 0.9457, test_f1: 0.6389
 epoch: 79, train_loss: 0.6463, test_loss: 0.9309, test_f1: 0.6283
 epoch: 80, train_loss: 0.6463, test_loss: 0.9534, test_f1: 0.6312
 epoch: 81, train_loss: 0.6385, test_loss: 0.9560, test_f1: 0.6206
 epoch: 82, train_loss: 0.6533, test_loss: 0.9512, test_f1: 0.6317
 epoch: 83, train_loss: 0.6326, test_loss: 0.9228, test_f1: 0.6328
 epoch: 84, train_loss: 0.6413, test_loss: 1.0280, test_f1: 0.6083
 epoch: 85, train_loss: 0.6369, test_loss: 0.9799, test_f1: 0.6345
 epoch: 86, train_loss: 0.6497, test_loss: 0.9547, test_f1: 0.6118
 epoch: 87, train_loss: 0.6335, test_loss: 1.0178, test_f1: 0.6144
 epoch: 88, train_loss: 0.6499, test_loss: 1.0176, test_f1: 0.6209
 epoch: 89, train_loss: 0.6379, test_loss: 1.0122, test_f1: 0.6261
 epoch: 90, train_loss: 0.6255, test_loss: 0.9948, test_f1: 0.6304
 epoch: 91, train_loss: 0.6310, test_loss: 0.9650, test_f1: 0.6216
 epoch: 92, train_loss: 0.6216, test_loss: 1.0274, test_f1: 0.5835
 epoch: 93, train_loss: 0.6159, test_loss: 0.9400, test_f1: 0.6392
 epoch: 94, train_loss: 0.6108, test_loss: 1.0309, test_f1: 0.6273
 epoch: 95, train_loss: 0.6181, test_loss: 1.0495, test_f1: 0.6057
 epoch: 96, train_loss: 0.6173, test_loss: 1.0105, test_f1: 0.6185
 epoch: 97, train_loss: 0.6154, test_loss: 0.9877, test_f1: 0.6403
 epoch: 98, train_loss: 0.6186, test_loss: 0.9806, test_f1: 0.6230
 epoch: 99, train_loss: 0.6081, test_loss: 0.9917, test_f1: 0.6235
##################ITERATION #5 ****************************************
 epoch: 0, train_loss: 1.2205, test_loss: 1.3080, test_f1: 0.2563
 epoch: 1, train_loss: 1.0568, test_loss: 0.9818, test_f1: 0.4682
 epoch: 2, train_loss: 0.9991, test_loss: 0.9776, test_f1: 0.4812
 epoch: 3, train_loss: 0.9599, test_loss: 0.9756, test_f1: 0.4812
 epoch: 4, train_loss: 0.9414, test_loss: 1.0993, test_f1: 0.4599
 epoch: 5, train_loss: 0.9643, test_loss: 0.9392, test_f1: 0.4985
 epoch: 6, train_loss: 0.9427, test_loss: 1.0038, test_f1: 0.4981
 epoch: 7, train_loss: 0.9303, test_loss: 0.9720, test_f1: 0.5038
 epoch: 8, train_loss: 0.9199, test_loss: 0.9690, test_f1: 0.5190
 epoch: 9, train_loss: 0.9075, test_loss: 0.9852, test_f1: 0.4888
 epoch: 10, train_loss: 0.9053, test_loss: 0.9779, test_f1: 0.5129
 epoch: 11, train_loss: 0.9103, test_loss: 1.0490, test_f1: 0.4943
 epoch: 12, train_loss: 0.9042, test_loss: 0.9388, test_f1: 0.5481
 epoch: 13, train_loss: 0.8909, test_loss: 0.9854, test_f1: 0.4917
 epoch: 14, train_loss: 0.8741, test_loss: 0.9791, test_f1: 0.5748
 epoch: 15, train_loss: 0.8706, test_loss: 0.9436, test_f1: 0.5645
 epoch: 16, train_loss: 0.8646, test_loss: 0.9523, test_f1: 0.5325
 epoch: 17, train_loss: 0.8472, test_loss: 1.0101, test_f1: 0.5187
 epoch: 18, train_loss: 0.8373, test_loss: 0.9667, test_f1: 0.5217
 epoch: 19, train_loss: 0.8541, test_loss: 1.0035, test_f1: 0.4963
 epoch: 20, train_loss: 0.8633, test_loss: 0.8634, test_f1: 0.5318
 epoch: 21, train_loss: 0.8583, test_loss: 0.9619, test_f1: 0.4737
 epoch: 22, train_loss: 0.8363, test_loss: 1.0466, test_f1: 0.5074
 epoch: 23, train_loss: 0.8471, test_loss: 0.9760, test_f1: 0.5233
 epoch: 24, train_loss: 0.8253, test_loss: 0.9585, test_f1: 0.5300
 epoch: 25, train_loss: 0.8234, test_loss: 0.9362, test_f1: 0.5383
 epoch: 26, train_loss: 0.8279, test_loss: 0.9339, test_f1: 0.5524
 epoch: 27, train_loss: 0.8256, test_loss: 0.9783, test_f1: 0.5298
 epoch: 28, train_loss: 0.8247, test_loss: 0.9594, test_f1: 0.5336
 epoch: 29, train_loss: 0.8493, test_loss: 0.8994, test_f1: 0.5332
 epoch: 30, train_loss: 0.8200, test_loss: 0.8443, test_f1: 0.5691
 epoch: 31, train_loss: 0.8048, test_loss: 0.9420, test_f1: 0.5966
 epoch: 32, train_loss: 0.8019, test_loss: 0.9475, test_f1: 0.5519
 epoch: 33, train_loss: 0.7942, test_loss: 0.9017, test_f1: 0.5289
 epoch: 34, train_loss: 0.7841, test_loss: 0.9124, test_f1: 0.5439
 epoch: 35, train_loss: 0.7890, test_loss: 0.8882, test_f1: 0.5820
 epoch: 36, train_loss: 0.7936, test_loss: 0.9105, test_f1: 0.5921
 epoch: 37, train_loss: 0.7810, test_loss: 0.9038, test_f1: 0.5658
 epoch: 38, train_loss: 0.7710, test_loss: 1.0398, test_f1: 0.5532
 epoch: 39, train_loss: 0.7776, test_loss: 0.8879, test_f1: 0.6005
 epoch: 40, train_loss: 0.7902, test_loss: 0.9866, test_f1: 0.5501
 epoch: 41, train_loss: 0.7914, test_loss: 0.8419, test_f1: 0.5449
 epoch: 42, train_loss: 0.7844, test_loss: 0.9711, test_f1: 0.5167
 epoch: 43, train_loss: 0.7665, test_loss: 0.8897, test_f1: 0.6150
 epoch: 44, train_loss: 0.7491, test_loss: 0.8714, test_f1: 0.5674
 epoch: 45, train_loss: 0.7539, test_loss: 0.8999, test_f1: 0.5851
 epoch: 46, train_loss: 0.7593, test_loss: 0.9607, test_f1: 0.5624
 epoch: 47, train_loss: 0.7746, test_loss: 1.0650, test_f1: 0.5354
 epoch: 48, train_loss: 0.7530, test_loss: 0.9670, test_f1: 0.5348
 epoch: 49, train_loss: 0.7520, test_loss: 0.9616, test_f1: 0.5628
 epoch: 50, train_loss: 0.7467, test_loss: 0.8570, test_f1: 0.5751
 epoch: 51, train_loss: 0.7126, test_loss: 0.9056, test_f1: 0.5941
 epoch: 52, train_loss: 0.6990, test_loss: 0.8641, test_f1: 0.6038
 epoch: 53, train_loss: 0.7005, test_loss: 0.8267, test_f1: 0.6140
 epoch: 54, train_loss: 0.6827, test_loss: 0.8574, test_f1: 0.6071
 epoch: 55, train_loss: 0.6907, test_loss: 0.8249, test_f1: 0.6439
 epoch: 56, train_loss: 0.6839, test_loss: 0.8560, test_f1: 0.6505
 epoch: 57, train_loss: 0.6869, test_loss: 0.9532, test_f1: 0.6119
 epoch: 58, train_loss: 0.6705, test_loss: 0.8292, test_f1: 0.5918
 epoch: 59, train_loss: 0.6929, test_loss: 0.9276, test_f1: 0.5705
 epoch: 60, train_loss: 0.6725, test_loss: 0.8861, test_f1: 0.6128
 epoch: 61, train_loss: 0.6669, test_loss: 0.9000, test_f1: 0.5945
 epoch: 62, train_loss: 0.6607, test_loss: 0.9953, test_f1: 0.5835
 epoch: 63, train_loss: 0.6486, test_loss: 1.0070, test_f1: 0.5870
 epoch: 64, train_loss: 0.6629, test_loss: 0.9921, test_f1: 0.5530
 epoch: 65, train_loss: 0.6658, test_loss: 0.9452, test_f1: 0.6166
 epoch: 66, train_loss: 0.6441, test_loss: 0.9207, test_f1: 0.5923
 epoch: 67, train_loss: 0.6520, test_loss: 0.9293, test_f1: 0.5984
 epoch: 68, train_loss: 0.6476, test_loss: 1.0080, test_f1: 0.5910
 epoch: 69, train_loss: 0.6582, test_loss: 0.9426, test_f1: 0.5677
 epoch: 70, train_loss: 0.6501, test_loss: 0.8856, test_f1: 0.6081
 epoch: 71, train_loss: 0.6524, test_loss: 1.0284, test_f1: 0.5797
 epoch: 72, train_loss: 0.6526, test_loss: 0.9500, test_f1: 0.6067
 epoch: 73, train_loss: 0.6316, test_loss: 0.9776, test_f1: 0.5827
 epoch: 74, train_loss: 0.6595, test_loss: 0.9455, test_f1: 0.5866
 epoch: 75, train_loss: 0.6576, test_loss: 1.0573, test_f1: 0.5391
 epoch: 76, train_loss: 0.6555, test_loss: 0.9471, test_f1: 0.5876
 epoch: 77, train_loss: 0.6570, test_loss: 0.9347, test_f1: 0.6208
 epoch: 78, train_loss: 0.6241, test_loss: 0.9362, test_f1: 0.6075
 epoch: 79, train_loss: 0.6271, test_loss: 0.8793, test_f1: 0.6324
 epoch: 80, train_loss: 0.6237, test_loss: 0.8993, test_f1: 0.6534
 epoch: 81, train_loss: 0.6358, test_loss: 0.8750, test_f1: 0.6428
 epoch: 82, train_loss: 0.6263, test_loss: 0.9517, test_f1: 0.6203
 epoch: 83, train_loss: 0.6228, test_loss: 0.9254, test_f1: 0.6190
 epoch: 84, train_loss: 0.6208, test_loss: 0.9054, test_f1: 0.6565
 epoch: 85, train_loss: 0.6136, test_loss: 0.9143, test_f1: 0.6375
 epoch: 86, train_loss: 0.6180, test_loss: 0.9246, test_f1: 0.5945
 epoch: 87, train_loss: 0.6091, test_loss: 1.0406, test_f1: 0.6085
 epoch: 88, train_loss: 0.6099, test_loss: 1.0006, test_f1: 0.6138
 epoch: 89, train_loss: 0.6018, test_loss: 0.9468, test_f1: 0.6433
 epoch: 90, train_loss: 0.5962, test_loss: 0.9289, test_f1: 0.6380
 epoch: 91, train_loss: 0.6041, test_loss: 1.0087, test_f1: 0.5991
 epoch: 92, train_loss: 0.6080, test_loss: 0.9799, test_f1: 0.6476
 epoch: 93, train_loss: 0.5974, test_loss: 0.9756, test_f1: 0.6502
 epoch: 94, train_loss: 0.6233, test_loss: 1.0064, test_f1: 0.5926
 epoch: 95, train_loss: 0.5944, test_loss: 0.9658, test_f1: 0.6035
 epoch: 96, train_loss: 0.5942, test_loss: 0.9499, test_f1: 0.6227
 epoch: 97, train_loss: 0.6222, test_loss: 0.9973, test_f1: 0.6312
 epoch: 98, train_loss: 0.6000, test_loss: 1.0639, test_f1: 0.6063
 epoch: 99, train_loss: 0.6057, test_loss: 0.9823, test_f1: 0.6485
##################ITERATION #6 ****************************************
 epoch: 0, train_loss: 1.2281, test_loss: 1.3601, test_f1: 0.3191
 epoch: 1, train_loss: 1.0366, test_loss: 1.0060, test_f1: 0.4655
 epoch: 2, train_loss: 0.9824, test_loss: 0.9658, test_f1: 0.4377
 epoch: 3, train_loss: 0.9702, test_loss: 0.9435, test_f1: 0.4947
 epoch: 4, train_loss: 0.9537, test_loss: 0.9602, test_f1: 0.4930
 epoch: 5, train_loss: 0.9306, test_loss: 0.9558, test_f1: 0.4944
 epoch: 6, train_loss: 0.9285, test_loss: 0.9081, test_f1: 0.5371
 epoch: 7, train_loss: 0.9276, test_loss: 0.9245, test_f1: 0.5170
 epoch: 8, train_loss: 0.9126, test_loss: 1.0304, test_f1: 0.5012
 epoch: 9, train_loss: 0.8961, test_loss: 0.9282, test_f1: 0.5010
 epoch: 10, train_loss: 0.8934, test_loss: 0.9034, test_f1: 0.5013
 epoch: 11, train_loss: 0.8743, test_loss: 0.9515, test_f1: 0.5522
 epoch: 12, train_loss: 0.8769, test_loss: 1.0060, test_f1: 0.4855
 epoch: 13, train_loss: 0.8737, test_loss: 0.8957, test_f1: 0.4919
 epoch: 14, train_loss: 0.8865, test_loss: 0.9653, test_f1: 0.5041
 epoch: 15, train_loss: 0.8618, test_loss: 0.9867, test_f1: 0.4953
 epoch: 16, train_loss: 0.8649, test_loss: 0.9264, test_f1: 0.5189
 epoch: 17, train_loss: 0.8499, test_loss: 0.9294, test_f1: 0.5409
 epoch: 18, train_loss: 0.8439, test_loss: 0.9467, test_f1: 0.5414
 epoch: 19, train_loss: 0.8331, test_loss: 0.9335, test_f1: 0.5228
 epoch: 20, train_loss: 0.8283, test_loss: 0.9392, test_f1: 0.5615
 epoch: 21, train_loss: 0.8209, test_loss: 0.8372, test_f1: 0.5352
 epoch: 22, train_loss: 0.8139, test_loss: 0.9805, test_f1: 0.5037
 epoch: 23, train_loss: 0.8213, test_loss: 1.0571, test_f1: 0.4830
 epoch: 24, train_loss: 0.8094, test_loss: 0.9460, test_f1: 0.5134
 epoch: 25, train_loss: 0.8037, test_loss: 0.9862, test_f1: 0.5324
 epoch: 26, train_loss: 0.8139, test_loss: 0.9354, test_f1: 0.5156
 epoch: 27, train_loss: 0.8134, test_loss: 0.9415, test_f1: 0.5342
 epoch: 28, train_loss: 0.7954, test_loss: 0.9600, test_f1: 0.5413
 epoch: 29, train_loss: 0.7934, test_loss: 1.0613, test_f1: 0.5163
 epoch: 30, train_loss: 0.7836, test_loss: 0.9541, test_f1: 0.5577
 epoch: 31, train_loss: 0.7935, test_loss: 0.9761, test_f1: 0.5171
 epoch: 32, train_loss: 0.7949, test_loss: 0.9013, test_f1: 0.5715
 epoch: 33, train_loss: 0.7839, test_loss: 0.9386, test_f1: 0.5880
 epoch: 34, train_loss: 0.7828, test_loss: 0.8773, test_f1: 0.5753
 epoch: 35, train_loss: 0.7616, test_loss: 1.0525, test_f1: 0.5343
 epoch: 36, train_loss: 0.7868, test_loss: 0.9675, test_f1: 0.5695
 epoch: 37, train_loss: 0.7811, test_loss: 0.9463, test_f1: 0.5925
 epoch: 38, train_loss: 0.7851, test_loss: 0.9813, test_f1: 0.5577
 epoch: 39, train_loss: 0.7760, test_loss: 0.9740, test_f1: 0.4976
 epoch: 40, train_loss: 0.7848, test_loss: 0.8933, test_f1: 0.6215
 epoch: 41, train_loss: 0.7765, test_loss: 0.9909, test_f1: 0.5628
 epoch: 42, train_loss: 0.7682, test_loss: 0.9107, test_f1: 0.6001
 epoch: 43, train_loss: 0.7543, test_loss: 0.9081, test_f1: 0.5919
 epoch: 44, train_loss: 0.7412, test_loss: 0.8979, test_f1: 0.6161
 epoch: 45, train_loss: 0.7331, test_loss: 0.8993, test_f1: 0.6070
 epoch: 46, train_loss: 0.7645, test_loss: 0.9113, test_f1: 0.5931
 epoch: 47, train_loss: 0.7668, test_loss: 0.9021, test_f1: 0.6020
 epoch: 48, train_loss: 0.7399, test_loss: 0.9046, test_f1: 0.5963
 epoch: 49, train_loss: 0.7231, test_loss: 0.8972, test_f1: 0.5759
 epoch: 50, train_loss: 0.7369, test_loss: 0.8889, test_f1: 0.6003
 epoch: 51, train_loss: 0.7222, test_loss: 0.8885, test_f1: 0.6143
 epoch: 52, train_loss: 0.6896, test_loss: 0.8472, test_f1: 0.6304
 epoch: 53, train_loss: 0.6751, test_loss: 0.8562, test_f1: 0.6110
 epoch: 54, train_loss: 0.6877, test_loss: 0.8546, test_f1: 0.6212
 epoch: 55, train_loss: 0.6652, test_loss: 0.8676, test_f1: 0.6176
 epoch: 56, train_loss: 0.6724, test_loss: 0.9083, test_f1: 0.5921
 epoch: 57, train_loss: 0.6721, test_loss: 0.8834, test_f1: 0.6241
 epoch: 58, train_loss: 0.6795, test_loss: 0.8987, test_f1: 0.6251
 epoch: 59, train_loss: 0.6478, test_loss: 0.8989, test_f1: 0.6381
 epoch: 60, train_loss: 0.6624, test_loss: 0.8888, test_f1: 0.6326
 epoch: 61, train_loss: 0.6694, test_loss: 0.8842, test_f1: 0.6451
 epoch: 62, train_loss: 0.6621, test_loss: 0.8819, test_f1: 0.6564
 epoch: 63, train_loss: 0.6369, test_loss: 0.8818, test_f1: 0.6671
 epoch: 64, train_loss: 0.6347, test_loss: 0.8952, test_f1: 0.6181
 epoch: 65, train_loss: 0.6369, test_loss: 0.8716, test_f1: 0.6630
 epoch: 66, train_loss: 0.6502, test_loss: 0.8901, test_f1: 0.6277
 epoch: 67, train_loss: 0.6372, test_loss: 0.8734, test_f1: 0.6461
 epoch: 68, train_loss: 0.6286, test_loss: 0.9449, test_f1: 0.6318
 epoch: 69, train_loss: 0.6311, test_loss: 0.8888, test_f1: 0.6306
 epoch: 70, train_loss: 0.6212, test_loss: 0.8804, test_f1: 0.6322
 epoch: 71, train_loss: 0.6215, test_loss: 0.9103, test_f1: 0.6315
 epoch: 72, train_loss: 0.6342, test_loss: 0.8892, test_f1: 0.6328
 epoch: 73, train_loss: 0.6468, test_loss: 0.9185, test_f1: 0.6082
 epoch: 74, train_loss: 0.6269, test_loss: 0.9142, test_f1: 0.6214
 epoch: 75, train_loss: 0.6440, test_loss: 0.9080, test_f1: 0.6309
 epoch: 76, train_loss: 0.6436, test_loss: 0.8854, test_f1: 0.6475
 epoch: 77, train_loss: 0.6129, test_loss: 0.8886, test_f1: 0.6209
 epoch: 78, train_loss: 0.6095, test_loss: 0.9268, test_f1: 0.6136
 epoch: 79, train_loss: 0.6174, test_loss: 0.8806, test_f1: 0.6042
 epoch: 80, train_loss: 0.6159, test_loss: 0.9717, test_f1: 0.6306
 epoch: 81, train_loss: 0.6172, test_loss: 0.9011, test_f1: 0.6243
 epoch: 82, train_loss: 0.6199, test_loss: 0.9169, test_f1: 0.6199
 epoch: 83, train_loss: 0.6077, test_loss: 0.8786, test_f1: 0.6551
 epoch: 84, train_loss: 0.6023, test_loss: 0.9068, test_f1: 0.6452
 epoch: 85, train_loss: 0.5954, test_loss: 0.9245, test_f1: 0.6425
 epoch: 86, train_loss: 0.6052, test_loss: 1.0056, test_f1: 0.6029
 epoch: 87, train_loss: 0.6009, test_loss: 0.8530, test_f1: 0.6617
 epoch: 88, train_loss: 0.6262, test_loss: 0.9375, test_f1: 0.6572
 epoch: 89, train_loss: 0.6097, test_loss: 0.9399, test_f1: 0.5823
 epoch: 90, train_loss: 0.5857, test_loss: 0.9844, test_f1: 0.6789
 epoch: 91, train_loss: 0.5992, test_loss: 0.9091, test_f1: 0.6574
 epoch: 92, train_loss: 0.5834, test_loss: 0.9466, test_f1: 0.6381
 epoch: 93, train_loss: 0.5781, test_loss: 0.9596, test_f1: 0.6105
 epoch: 94, train_loss: 0.5974, test_loss: 0.9347, test_f1: 0.6608
 epoch: 95, train_loss: 0.5937, test_loss: 0.9170, test_f1: 0.6310
 epoch: 96, train_loss: 0.5722, test_loss: 0.9495, test_f1: 0.6421
 epoch: 97, train_loss: 0.5749, test_loss: 0.9436, test_f1: 0.6598
 epoch: 98, train_loss: 0.5718, test_loss: 0.9631, test_f1: 0.6527
 epoch: 99, train_loss: 0.5645, test_loss: 0.9370, test_f1: 0.6752
##################ITERATION #7 ****************************************
 epoch: 0, train_loss: 1.1952, test_loss: 1.1020, test_f1: 0.4141
 epoch: 1, train_loss: 1.0213, test_loss: 1.0189, test_f1: 0.5024
 epoch: 2, train_loss: 0.9839, test_loss: 1.0377, test_f1: 0.5110
 epoch: 3, train_loss: 0.9651, test_loss: 1.0003, test_f1: 0.4621
 epoch: 4, train_loss: 0.9406, test_loss: 0.9642, test_f1: 0.5256
 epoch: 5, train_loss: 0.9335, test_loss: 0.9761, test_f1: 0.5358
 epoch: 6, train_loss: 0.9258, test_loss: 0.9626, test_f1: 0.5751
 epoch: 7, train_loss: 0.9126, test_loss: 0.9931, test_f1: 0.5137
 epoch: 8, train_loss: 0.8983, test_loss: 0.9656, test_f1: 0.5292
 epoch: 9, train_loss: 0.8942, test_loss: 0.9711, test_f1: 0.5009
 epoch: 10, train_loss: 0.8870, test_loss: 0.9334, test_f1: 0.5281
 epoch: 11, train_loss: 0.9007, test_loss: 0.8990, test_f1: 0.5335
 epoch: 12, train_loss: 0.8760, test_loss: 0.9462, test_f1: 0.5520
 epoch: 13, train_loss: 0.8734, test_loss: 0.9406, test_f1: 0.5442
 epoch: 14, train_loss: 0.8601, test_loss: 0.9667, test_f1: 0.5462
 epoch: 15, train_loss: 0.8468, test_loss: 0.9293, test_f1: 0.5422
 epoch: 16, train_loss: 0.8594, test_loss: 0.9173, test_f1: 0.5499
 epoch: 17, train_loss: 0.8485, test_loss: 0.9381, test_f1: 0.5500
 epoch: 18, train_loss: 0.8497, test_loss: 0.9626, test_f1: 0.5532
 epoch: 19, train_loss: 0.8512, test_loss: 0.9485, test_f1: 0.5823
 epoch: 20, train_loss: 0.8258, test_loss: 0.9533, test_f1: 0.5431
 epoch: 21, train_loss: 0.8166, test_loss: 0.9392, test_f1: 0.5580
 epoch: 22, train_loss: 0.8179, test_loss: 0.9547, test_f1: 0.5402
 epoch: 23, train_loss: 0.8150, test_loss: 1.1066, test_f1: 0.5181
 epoch: 24, train_loss: 0.8097, test_loss: 0.8722, test_f1: 0.6194
 epoch: 25, train_loss: 0.7984, test_loss: 0.9509, test_f1: 0.5353
 epoch: 26, train_loss: 0.7957, test_loss: 0.9051, test_f1: 0.5855
 epoch: 27, train_loss: 0.8021, test_loss: 0.9420, test_f1: 0.5436
 epoch: 28, train_loss: 0.7880, test_loss: 0.9603, test_f1: 0.5703
 epoch: 29, train_loss: 0.8063, test_loss: 0.9329, test_f1: 0.5496
 epoch: 30, train_loss: 0.7929, test_loss: 0.9348, test_f1: 0.5378
 epoch: 31, train_loss: 0.7809, test_loss: 1.0034, test_f1: 0.5169
 epoch: 32, train_loss: 0.7848, test_loss: 0.8938, test_f1: 0.5994
 epoch: 33, train_loss: 0.7764, test_loss: 0.9535, test_f1: 0.5653
 epoch: 34, train_loss: 0.7695, test_loss: 0.9827, test_f1: 0.5996
 epoch: 35, train_loss: 0.7732, test_loss: 0.8864, test_f1: 0.5776
 epoch: 36, train_loss: 0.7593, test_loss: 0.9272, test_f1: 0.5658
 epoch: 37, train_loss: 0.7587, test_loss: 0.9591, test_f1: 0.5739
 epoch: 38, train_loss: 0.7528, test_loss: 1.0074, test_f1: 0.5509
 epoch: 39, train_loss: 0.7428, test_loss: 0.9877, test_f1: 0.5560
 epoch: 40, train_loss: 0.7447, test_loss: 0.9594, test_f1: 0.5887
 epoch: 41, train_loss: 0.7545, test_loss: 0.9013, test_f1: 0.6053
 epoch: 42, train_loss: 0.7519, test_loss: 0.9152, test_f1: 0.5916
 epoch: 43, train_loss: 0.7444, test_loss: 0.9242, test_f1: 0.6224
 epoch: 44, train_loss: 0.7294, test_loss: 0.9031, test_f1: 0.5858
 epoch: 45, train_loss: 0.7308, test_loss: 0.9244, test_f1: 0.5537
 epoch: 46, train_loss: 0.7276, test_loss: 0.8986, test_f1: 0.6208
 epoch: 47, train_loss: 0.7153, test_loss: 0.8565, test_f1: 0.6489
 epoch: 48, train_loss: 0.7175, test_loss: 0.9219, test_f1: 0.5883
 epoch: 49, train_loss: 0.7176, test_loss: 0.9490, test_f1: 0.5630
 epoch: 50, train_loss: 0.7288, test_loss: 0.9062, test_f1: 0.5783
 epoch: 51, train_loss: 0.6883, test_loss: 0.8655, test_f1: 0.6142
 epoch: 52, train_loss: 0.6715, test_loss: 0.8995, test_f1: 0.6447
 epoch: 53, train_loss: 0.6721, test_loss: 0.8862, test_f1: 0.6286
 epoch: 54, train_loss: 0.6608, test_loss: 0.9294, test_f1: 0.6202
 epoch: 55, train_loss: 0.6692, test_loss: 0.9298, test_f1: 0.6108
 epoch: 56, train_loss: 0.6485, test_loss: 0.9381, test_f1: 0.5798
 epoch: 57, train_loss: 0.6580, test_loss: 0.8607, test_f1: 0.6357
 epoch: 58, train_loss: 0.6415, test_loss: 0.9656, test_f1: 0.6115
 epoch: 59, train_loss: 0.6522, test_loss: 0.9579, test_f1: 0.6312
 epoch: 60, train_loss: 0.6462, test_loss: 0.9132, test_f1: 0.6222
 epoch: 61, train_loss: 0.6435, test_loss: 0.9080, test_f1: 0.6369
 epoch: 62, train_loss: 0.6207, test_loss: 0.9514, test_f1: 0.6166
 epoch: 63, train_loss: 0.6380, test_loss: 0.8961, test_f1: 0.6278
 epoch: 64, train_loss: 0.6381, test_loss: 0.9858, test_f1: 0.5989
 epoch: 65, train_loss: 0.6289, test_loss: 0.9444, test_f1: 0.6529
 epoch: 66, train_loss: 0.6252, test_loss: 0.9250, test_f1: 0.6283
 epoch: 67, train_loss: 0.6187, test_loss: 1.0532, test_f1: 0.5786
 epoch: 68, train_loss: 0.6274, test_loss: 0.9362, test_f1: 0.6154
 epoch: 69, train_loss: 0.6177, test_loss: 0.9294, test_f1: 0.6620
 epoch: 70, train_loss: 0.6053, test_loss: 0.9769, test_f1: 0.5827
 epoch: 71, train_loss: 0.6134, test_loss: 1.0970, test_f1: 0.5650
 epoch: 72, train_loss: 0.6073, test_loss: 0.9281, test_f1: 0.6173
 epoch: 73, train_loss: 0.6065, test_loss: 0.9058, test_f1: 0.6357
 epoch: 74, train_loss: 0.6184, test_loss: 0.9503, test_f1: 0.6348
 epoch: 75, train_loss: 0.5872, test_loss: 0.9537, test_f1: 0.6346
 epoch: 76, train_loss: 0.6067, test_loss: 0.9325, test_f1: 0.6292
 epoch: 77, train_loss: 0.6035, test_loss: 0.9397, test_f1: 0.6364
 epoch: 78, train_loss: 0.5873, test_loss: 0.9112, test_f1: 0.6521
 epoch: 79, train_loss: 0.5972, test_loss: 1.0461, test_f1: 0.6080
 epoch: 80, train_loss: 0.5876, test_loss: 0.9390, test_f1: 0.6293
 epoch: 81, train_loss: 0.5999, test_loss: 1.0616, test_f1: 0.5822
 epoch: 82, train_loss: 0.6013, test_loss: 1.0579, test_f1: 0.5823
 epoch: 83, train_loss: 0.5968, test_loss: 0.9314, test_f1: 0.6261
 epoch: 84, train_loss: 0.5852, test_loss: 0.9307, test_f1: 0.6424
 epoch: 85, train_loss: 0.5952, test_loss: 0.9398, test_f1: 0.6390
 epoch: 86, train_loss: 0.5833, test_loss: 1.0073, test_f1: 0.6275
 epoch: 87, train_loss: 0.5748, test_loss: 0.9211, test_f1: 0.6423
 epoch: 88, train_loss: 0.5790, test_loss: 1.0094, test_f1: 0.6219
 epoch: 89, train_loss: 0.5765, test_loss: 1.0457, test_f1: 0.6129
 epoch: 90, train_loss: 0.5655, test_loss: 0.9716, test_f1: 0.6453
 epoch: 91, train_loss: 0.5841, test_loss: 1.0284, test_f1: 0.6174
 epoch: 92, train_loss: 0.5873, test_loss: 0.9484, test_f1: 0.6206
 epoch: 93, train_loss: 0.5720, test_loss: 0.9742, test_f1: 0.6497
 epoch: 94, train_loss: 0.5740, test_loss: 0.9324, test_f1: 0.6309
 epoch: 95, train_loss: 0.5586, test_loss: 1.0215, test_f1: 0.6262
 epoch: 96, train_loss: 0.5522, test_loss: 1.0776, test_f1: 0.6156
 epoch: 97, train_loss: 0.5563, test_loss: 0.9559, test_f1: 0.6049
 epoch: 98, train_loss: 0.5467, test_loss: 1.0107, test_f1: 0.5901
 epoch: 99, train_loss: 0.5562, test_loss: 1.0424, test_f1: 0.6139
##################ITERATION #8 ****************************************
 epoch: 0, train_loss: 1.2445, test_loss: 1.1762, test_f1: 0.2919
 epoch: 1, train_loss: 1.0455, test_loss: 1.0732, test_f1: 0.3499
 epoch: 2, train_loss: 0.9950, test_loss: 0.9649, test_f1: 0.4530
 epoch: 3, train_loss: 0.9724, test_loss: 1.0298, test_f1: 0.4408
 epoch: 4, train_loss: 1.0008, test_loss: 1.0431, test_f1: 0.4626
 epoch: 5, train_loss: 0.9691, test_loss: 1.0222, test_f1: 0.4513
 epoch: 6, train_loss: 0.9614, test_loss: 1.0750, test_f1: 0.4531
 epoch: 7, train_loss: 0.9598, test_loss: 0.9946, test_f1: 0.4844
 epoch: 8, train_loss: 0.9543, test_loss: 1.0247, test_f1: 0.4548
 epoch: 9, train_loss: 0.9242, test_loss: 0.9226, test_f1: 0.5238
 epoch: 10, train_loss: 0.9319, test_loss: 0.9970, test_f1: 0.5013
 epoch: 11, train_loss: 0.9242, test_loss: 1.0381, test_f1: 0.4086
 epoch: 12, train_loss: 0.9650, test_loss: 1.0032, test_f1: 0.4821
 epoch: 13, train_loss: 0.9440, test_loss: 0.9454, test_f1: 0.5289
 epoch: 14, train_loss: 0.9338, test_loss: 0.9728, test_f1: 0.5039
 epoch: 15, train_loss: 0.9173, test_loss: 0.9839, test_f1: 0.5101
 epoch: 16, train_loss: 0.9189, test_loss: 0.9241, test_f1: 0.4843
 epoch: 17, train_loss: 0.9044, test_loss: 0.9721, test_f1: 0.5232
 epoch: 18, train_loss: 0.9029, test_loss: 1.0070, test_f1: 0.5109
 epoch: 19, train_loss: 0.8954, test_loss: 0.9519, test_f1: 0.5185
 epoch: 20, train_loss: 0.8862, test_loss: 0.9564, test_f1: 0.5395
 epoch: 21, train_loss: 0.8740, test_loss: 0.9765, test_f1: 0.5268
 epoch: 22, train_loss: 0.8567, test_loss: 0.9523, test_f1: 0.5615
 epoch: 23, train_loss: 0.8642, test_loss: 1.0071, test_f1: 0.5742
 epoch: 24, train_loss: 0.8552, test_loss: 0.8464, test_f1: 0.5348
 epoch: 25, train_loss: 0.8686, test_loss: 1.0020, test_f1: 0.5216
 epoch: 26, train_loss: 0.8641, test_loss: 0.9271, test_f1: 0.5698
 epoch: 27, train_loss: 0.8486, test_loss: 0.9514, test_f1: 0.5510
 epoch: 28, train_loss: 0.8385, test_loss: 0.9163, test_f1: 0.6138
 epoch: 29, train_loss: 0.8348, test_loss: 1.0055, test_f1: 0.5262
 epoch: 30, train_loss: 0.8363, test_loss: 0.9387, test_f1: 0.5790
 epoch: 31, train_loss: 0.8110, test_loss: 0.9241, test_f1: 0.5860
 epoch: 32, train_loss: 0.8135, test_loss: 0.9121, test_f1: 0.5971
 epoch: 33, train_loss: 0.8178, test_loss: 0.9134, test_f1: 0.5571
 epoch: 34, train_loss: 0.7916, test_loss: 0.9873, test_f1: 0.5745
 epoch: 35, train_loss: 0.7992, test_loss: 1.0415, test_f1: 0.5437
 epoch: 36, train_loss: 0.7998, test_loss: 0.9972, test_f1: 0.5763
 epoch: 37, train_loss: 0.7807, test_loss: 0.8921, test_f1: 0.6085
 epoch: 38, train_loss: 0.7822, test_loss: 0.8925, test_f1: 0.5914
 epoch: 39, train_loss: 0.7784, test_loss: 0.8915, test_f1: 0.6296
 epoch: 40, train_loss: 0.7729, test_loss: 0.8563, test_f1: 0.6272
 epoch: 41, train_loss: 0.7694, test_loss: 0.9301, test_f1: 0.5859
 epoch: 42, train_loss: 0.7989, test_loss: 0.9329, test_f1: 0.5534
 epoch: 43, train_loss: 0.7838, test_loss: 0.8896, test_f1: 0.6149
 epoch: 44, train_loss: 0.7723, test_loss: 0.9325, test_f1: 0.5859
 epoch: 45, train_loss: 0.7512, test_loss: 0.9328, test_f1: 0.5772
 epoch: 46, train_loss: 0.7562, test_loss: 0.9127, test_f1: 0.5907
 epoch: 47, train_loss: 0.7443, test_loss: 0.9156, test_f1: 0.6145
 epoch: 48, train_loss: 0.7486, test_loss: 0.9433, test_f1: 0.6082
 epoch: 49, train_loss: 0.7452, test_loss: 0.9155, test_f1: 0.6338
 epoch: 50, train_loss: 0.7441, test_loss: 0.9297, test_f1: 0.6240
 epoch: 51, train_loss: 0.7377, test_loss: 0.9040, test_f1: 0.6270
 epoch: 52, train_loss: 0.6949, test_loss: 0.8701, test_f1: 0.6275
 epoch: 53, train_loss: 0.7051, test_loss: 0.9178, test_f1: 0.6477
 epoch: 54, train_loss: 0.6799, test_loss: 0.9525, test_f1: 0.6208
 epoch: 55, train_loss: 0.6709, test_loss: 0.8965, test_f1: 0.6484
 epoch: 56, train_loss: 0.6761, test_loss: 0.9520, test_f1: 0.6203
 epoch: 57, train_loss: 0.6722, test_loss: 0.9212, test_f1: 0.6398
 epoch: 58, train_loss: 0.6857, test_loss: 0.9040, test_f1: 0.6752
 epoch: 59, train_loss: 0.6830, test_loss: 0.9244, test_f1: 0.6393
 epoch: 60, train_loss: 0.6669, test_loss: 0.9323, test_f1: 0.6227
 epoch: 61, train_loss: 0.6620, test_loss: 0.9601, test_f1: 0.6353
 epoch: 62, train_loss: 0.6590, test_loss: 0.9299, test_f1: 0.6486
 epoch: 63, train_loss: 0.6698, test_loss: 0.9189, test_f1: 0.6228
 epoch: 64, train_loss: 0.6527, test_loss: 0.9257, test_f1: 0.6524
 epoch: 65, train_loss: 0.6471, test_loss: 1.0245, test_f1: 0.6387
 epoch: 66, train_loss: 0.6677, test_loss: 1.0480, test_f1: 0.6303
 epoch: 67, train_loss: 0.6548, test_loss: 0.9700, test_f1: 0.6509
 epoch: 68, train_loss: 0.6403, test_loss: 0.9492, test_f1: 0.6391
 epoch: 69, train_loss: 0.6444, test_loss: 0.9329, test_f1: 0.6150
 epoch: 70, train_loss: 0.6408, test_loss: 1.0035, test_f1: 0.6484
 epoch: 71, train_loss: 0.6251, test_loss: 1.0463, test_f1: 0.6188
 epoch: 72, train_loss: 0.6466, test_loss: 0.8959, test_f1: 0.6610
 epoch: 73, train_loss: 0.6488, test_loss: 0.9698, test_f1: 0.6437
 epoch: 74, train_loss: 0.6307, test_loss: 0.8754, test_f1: 0.6751
 epoch: 75, train_loss: 0.6327, test_loss: 0.9328, test_f1: 0.6553
 epoch: 76, train_loss: 0.6548, test_loss: 0.9409, test_f1: 0.6484
 epoch: 77, train_loss: 0.6076, test_loss: 0.9149, test_f1: 0.6552
 epoch: 78, train_loss: 0.6162, test_loss: 1.0184, test_f1: 0.6583
 epoch: 79, train_loss: 0.6209, test_loss: 0.9740, test_f1: 0.6369
 epoch: 80, train_loss: 0.6177, test_loss: 0.9195, test_f1: 0.6677
 epoch: 81, train_loss: 0.6115, test_loss: 0.8781, test_f1: 0.6328
 epoch: 82, train_loss: 0.6192, test_loss: 0.9350, test_f1: 0.6863
 epoch: 83, train_loss: 0.6135, test_loss: 0.9380, test_f1: 0.6647
 epoch: 84, train_loss: 0.6414, test_loss: 0.9637, test_f1: 0.6733
 epoch: 85, train_loss: 0.6077, test_loss: 0.9131, test_f1: 0.6661
 epoch: 86, train_loss: 0.6188, test_loss: 0.9255, test_f1: 0.6603
 epoch: 87, train_loss: 0.5952, test_loss: 0.9748, test_f1: 0.6530
 epoch: 88, train_loss: 0.6113, test_loss: 0.9486, test_f1: 0.6509
 epoch: 89, train_loss: 0.6060, test_loss: 0.9944, test_f1: 0.6668
 epoch: 90, train_loss: 0.5901, test_loss: 1.0231, test_f1: 0.6157
 epoch: 91, train_loss: 0.6156, test_loss: 0.9319, test_f1: 0.6649
 epoch: 92, train_loss: 0.6178, test_loss: 1.0002, test_f1: 0.6514
 epoch: 93, train_loss: 0.6011, test_loss: 0.9676, test_f1: 0.6503
 epoch: 94, train_loss: 0.6153, test_loss: 1.0494, test_f1: 0.6462
 epoch: 95, train_loss: 0.5980, test_loss: 0.9219, test_f1: 0.6562
 epoch: 96, train_loss: 0.5937, test_loss: 0.9207, test_f1: 0.6411
 epoch: 97, train_loss: 0.5841, test_loss: 0.9469, test_f1: 0.6740
 epoch: 98, train_loss: 0.5683, test_loss: 0.9109, test_f1: 0.6732
 epoch: 99, train_loss: 0.5807, test_loss: 0.9171, test_f1: 0.6657
##################ITERATION #9 ****************************************
 epoch: 0, train_loss: 1.1813, test_loss: 1.2392, test_f1: 0.2757
 epoch: 1, train_loss: 1.0221, test_loss: 0.9983, test_f1: 0.4685
 epoch: 2, train_loss: 0.9869, test_loss: 1.0001, test_f1: 0.4866
 epoch: 3, train_loss: 0.9516, test_loss: 0.9938, test_f1: 0.5103
 epoch: 4, train_loss: 0.9420, test_loss: 1.0328, test_f1: 0.4568
 epoch: 5, train_loss: 0.9458, test_loss: 0.9746, test_f1: 0.5010
 epoch: 6, train_loss: 0.9391, test_loss: 0.9636, test_f1: 0.5099
 epoch: 7, train_loss: 0.9302, test_loss: 0.9281, test_f1: 0.4982
 epoch: 8, train_loss: 0.9104, test_loss: 0.8852, test_f1: 0.5586
 epoch: 9, train_loss: 0.9073, test_loss: 0.8989, test_f1: 0.5145
 epoch: 10, train_loss: 0.8943, test_loss: 0.9818, test_f1: 0.5130
 epoch: 11, train_loss: 0.8803, test_loss: 0.9379, test_f1: 0.5581
 epoch: 12, train_loss: 0.8896, test_loss: 0.9364, test_f1: 0.5033
 epoch: 13, train_loss: 0.8621, test_loss: 1.0675, test_f1: 0.4997
 epoch: 14, train_loss: 0.8739, test_loss: 1.0584, test_f1: 0.4594
 epoch: 15, train_loss: 0.8722, test_loss: 0.9905, test_f1: 0.5039
 epoch: 16, train_loss: 0.8661, test_loss: 1.0584, test_f1: 0.4670
 epoch: 17, train_loss: 0.8648, test_loss: 0.9240, test_f1: 0.5051
 epoch: 18, train_loss: 0.8551, test_loss: 0.8945, test_f1: 0.5659
 epoch: 19, train_loss: 0.8631, test_loss: 0.9706, test_f1: 0.5623
 epoch: 20, train_loss: 0.8341, test_loss: 0.9559, test_f1: 0.4928
 epoch: 21, train_loss: 0.8446, test_loss: 0.9073, test_f1: 0.5517
 epoch: 22, train_loss: 0.8397, test_loss: 0.9371, test_f1: 0.6025
 epoch: 23, train_loss: 0.8350, test_loss: 0.9121, test_f1: 0.5195
 epoch: 24, train_loss: 0.8265, test_loss: 0.9484, test_f1: 0.5205
 epoch: 25, train_loss: 0.8337, test_loss: 0.9629, test_f1: 0.5766
 epoch: 26, train_loss: 0.8320, test_loss: 0.9113, test_f1: 0.5515
 epoch: 27, train_loss: 0.8218, test_loss: 0.9644, test_f1: 0.5784
 epoch: 28, train_loss: 0.8158, test_loss: 0.9389, test_f1: 0.5416
 epoch: 29, train_loss: 0.8072, test_loss: 0.8712, test_f1: 0.5569
 epoch: 30, train_loss: 0.7922, test_loss: 0.9570, test_f1: 0.5258
 epoch: 31, train_loss: 0.7929, test_loss: 0.9315, test_f1: 0.5606
 epoch: 32, train_loss: 0.7860, test_loss: 0.9754, test_f1: 0.5867
 epoch: 33, train_loss: 0.7700, test_loss: 0.8672, test_f1: 0.5559
 epoch: 34, train_loss: 0.7823, test_loss: 0.9469, test_f1: 0.5757
 epoch: 35, train_loss: 0.7880, test_loss: 1.0243, test_f1: 0.5288
 epoch: 36, train_loss: 0.7721, test_loss: 0.9356, test_f1: 0.5887
 epoch: 37, train_loss: 0.7424, test_loss: 0.9619, test_f1: 0.5565
 epoch: 38, train_loss: 0.7598, test_loss: 0.9380, test_f1: 0.5777
 epoch: 39, train_loss: 0.7668, test_loss: 0.9212, test_f1: 0.5358
 epoch: 40, train_loss: 0.7508, test_loss: 1.0068, test_f1: 0.5211
 epoch: 41, train_loss: 0.7636, test_loss: 0.8915, test_f1: 0.5734
 epoch: 42, train_loss: 0.7322, test_loss: 0.9360, test_f1: 0.5584
 epoch: 43, train_loss: 0.7304, test_loss: 0.8678, test_f1: 0.6258
 epoch: 44, train_loss: 0.7358, test_loss: 1.0075, test_f1: 0.5658
 epoch: 45, train_loss: 0.7465, test_loss: 0.9543, test_f1: 0.5405
 epoch: 46, train_loss: 0.7399, test_loss: 0.9263, test_f1: 0.6045
 epoch: 47, train_loss: 0.7136, test_loss: 0.8821, test_f1: 0.6048
 epoch: 48, train_loss: 0.7201, test_loss: 0.9950, test_f1: 0.5955
 epoch: 49, train_loss: 0.7294, test_loss: 0.9996, test_f1: 0.5548
 epoch: 50, train_loss: 0.7230, test_loss: 0.9030, test_f1: 0.6278
 epoch: 51, train_loss: 0.6974, test_loss: 0.9078, test_f1: 0.6290
 epoch: 52, train_loss: 0.6645, test_loss: 0.9024, test_f1: 0.6391
 epoch: 53, train_loss: 0.6494, test_loss: 0.9536, test_f1: 0.6175
 epoch: 54, train_loss: 0.6489, test_loss: 0.8924, test_f1: 0.6332
 epoch: 55, train_loss: 0.6563, test_loss: 0.8994, test_f1: 0.5916
 epoch: 56, train_loss: 0.6553, test_loss: 0.8893, test_f1: 0.6031
 epoch: 57, train_loss: 0.6474, test_loss: 0.9370, test_f1: 0.5960
 epoch: 58, train_loss: 0.6394, test_loss: 0.9021, test_f1: 0.6375
 epoch: 59, train_loss: 0.6390, test_loss: 0.9138, test_f1: 0.6322
 epoch: 60, train_loss: 0.6454, test_loss: 0.9142, test_f1: 0.6120
 epoch: 61, train_loss: 0.6425, test_loss: 0.9418, test_f1: 0.6176
 epoch: 62, train_loss: 0.6283, test_loss: 0.8889, test_f1: 0.6251
 epoch: 63, train_loss: 0.6331, test_loss: 1.0960, test_f1: 0.5873
 epoch: 64, train_loss: 0.6422, test_loss: 0.9743, test_f1: 0.6057
 epoch: 65, train_loss: 0.6184, test_loss: 0.8728, test_f1: 0.6486
 epoch: 66, train_loss: 0.6310, test_loss: 0.8949, test_f1: 0.6028
 epoch: 67, train_loss: 0.6227, test_loss: 0.9140, test_f1: 0.6013
 epoch: 68, train_loss: 0.6288, test_loss: 0.8363, test_f1: 0.6710
 epoch: 69, train_loss: 0.6019, test_loss: 0.9777, test_f1: 0.6081
 epoch: 70, train_loss: 0.5983, test_loss: 0.9581, test_f1: 0.6049
 epoch: 71, train_loss: 0.6017, test_loss: 0.9194, test_f1: 0.6461
 epoch: 72, train_loss: 0.6315, test_loss: 0.9164, test_f1: 0.6568
 epoch: 73, train_loss: 0.6124, test_loss: 0.9300, test_f1: 0.6380
 epoch: 74, train_loss: 0.5987, test_loss: 0.9494, test_f1: 0.6246
 epoch: 75, train_loss: 0.5973, test_loss: 0.8938, test_f1: 0.6257
 epoch: 76, train_loss: 0.6025, test_loss: 0.9369, test_f1: 0.6482
 epoch: 77, train_loss: 0.5978, test_loss: 0.9780, test_f1: 0.6025
 epoch: 78, train_loss: 0.6055, test_loss: 0.9758, test_f1: 0.6294
 epoch: 79, train_loss: 0.6102, test_loss: 1.0002, test_f1: 0.6011
 epoch: 80, train_loss: 0.5861, test_loss: 0.9197, test_f1: 0.6460
 epoch: 81, train_loss: 0.5985, test_loss: 0.9578, test_f1: 0.6462
 epoch: 82, train_loss: 0.5974, test_loss: 0.9583, test_f1: 0.6261
 epoch: 83, train_loss: 0.5804, test_loss: 0.9598, test_f1: 0.6257
 epoch: 84, train_loss: 0.5877, test_loss: 0.9249, test_f1: 0.6020
 epoch: 85, train_loss: 0.5783, test_loss: 1.0526, test_f1: 0.5848
 epoch: 86, train_loss: 0.5781, test_loss: 1.0102, test_f1: 0.6314
 epoch: 87, train_loss: 0.5807, test_loss: 0.9744, test_f1: 0.6165
 epoch: 88, train_loss: 0.5714, test_loss: 1.0201, test_f1: 0.6158
 epoch: 89, train_loss: 0.5689, test_loss: 0.9466, test_f1: 0.6485
 epoch: 90, train_loss: 0.5826, test_loss: 0.9119, test_f1: 0.6536
 epoch: 91, train_loss: 0.5807, test_loss: 0.8735, test_f1: 0.6507
 epoch: 92, train_loss: 0.5617, test_loss: 1.0435, test_f1: 0.6056
 epoch: 93, train_loss: 0.5724, test_loss: 0.9846, test_f1: 0.5994
 epoch: 94, train_loss: 0.5675, test_loss: 0.9843, test_f1: 0.6444
 epoch: 95, train_loss: 0.5736, test_loss: 1.0247, test_f1: 0.6319
 epoch: 96, train_loss: 0.5750, test_loss: 0.9822, test_f1: 0.6239
 epoch: 97, train_loss: 0.5596, test_loss: 0.9379, test_f1: 0.6639
 epoch: 98, train_loss: 0.5676, test_loss: 0.9936, test_f1: 0.6044
 epoch: 99, train_loss: 0.5643, test_loss: 0.9769, test_f1: 0.6313

Training completed in 649.46 seconds
Best F1: 0.6863 at epoch 82
Mean F1 across iterations: 0.6667  0.0131
========================FINAL RESULTS================================
FEGIN weighted F1: 0.6863  0.0131
python main.py --data ltspice_examples --representation component_net --model FEGIN --layers 4 --hiddens 32 --batch_size 128 --lr 0.01 --emb_size 250 --epochs 100 --save_appendix component_net_L4_H32_BS128_LR0.01_E250 --no_val
-----



STDERR:
  File "main.py", line 370, in <module>
    main()
  File "main.py", line 254, in main
    dataset = dataset_class(
  File "/home/philip/projects/llm_inference_code_repo/Circuit-Completion-Using-GNNs/component_classification_with_link_prediction_head/evaluation/FEGIN/kernel/circuit_datasets.py", line 15, in __init__
    self.data, self.slices = torch.load(self.processed_paths[0])
  File "/home/philip/.local/lib/python3.8/site-packages/torch/serialization.py", line 1040, in load
    warnings.warn(
  File "/usr/lib/python3.8/warnings.py", line 109, in _showwarnmsg
    sw(msg.message, msg.category, msg.filename, msg.lineno,
  File "main.py", line 47, in warn_with_traceback
    traceback.print_stack(file=log)
/home/philip/projects/llm_inference_code_repo/Circuit-Completion-Using-GNNs/component_classification_with_link_prediction_head/evaluation/FEGIN/kernel/circuit_datasets.py:15: FutureWarning: You are using `torch.load` with `weights_only=False` (the current default value), which uses the default pickle module implicitly. It is possible to construct malicious pickle data which will execute arbitrary code during unpickling (See https://github.com/pytorch/pytorch/blob/main/SECURITY.md#untrusted-models for more details). In a future release, the default value for `weights_only` will be flipped to `True`. This limits the functions that could be executed during unpickling. Arbitrary objects will no longer be allowed to be loaded via this mode unless they are explicitly allowlisted by the user via `torch.serialization.add_safe_globals`. We recommend you start setting `weights_only=True` for any use case where you don't have full control of the loaded file. Please open an issue on GitHub for any issues related to this experimental feature.
  self.data, self.slices = torch.load(self.processed_paths[0])
