STDOUT:
Results will be saved in /home/philip/projects/llm_inference_code_repo/Circuit-Completion-Using-GNNs/component_classification_with_link_prediction_head/evaluation/FEGIN/results/model_FEGIN_dataset_ltspice_examples
Command line input: python main.py --data ltspice_examples --representation component_component --model FEGIN --layers 5 --hiddens 32 --batch_size 32 --lr 0.0001 --emb_size 512 --epochs 100 --save_appendix component_component_L5_H32_BS32_LR0.0001_E512 --no_val
 is saved.
-----
ltspice_examples - FEGIN
Using 5 layers, 32 hidden units, h = 2
Loading component_component representation dataset
ENTERED
Training FEGIN on component_component representation
Train: 3556, Test: 845
##################ITERATION #0 ****************************************
 epoch: 0, train_loss: 1.3508, test_loss: 1.3445, test_f1: 0.2274
 epoch: 1, train_loss: 1.3317, test_loss: 1.3322, test_f1: 0.2274
 epoch: 2, train_loss: 1.3176, test_loss: 1.3191, test_f1: 0.2274
 epoch: 3, train_loss: 1.3040, test_loss: 1.3109, test_f1: 0.2274
 epoch: 4, train_loss: 1.2946, test_loss: 1.2953, test_f1: 0.2274
 epoch: 5, train_loss: 1.2857, test_loss: 1.2906, test_f1: 0.2274
 epoch: 6, train_loss: 1.2769, test_loss: 1.2905, test_f1: 0.2274
 epoch: 7, train_loss: 1.2704, test_loss: 1.2738, test_f1: 0.2274
 epoch: 8, train_loss: 1.2645, test_loss: 1.2691, test_f1: 0.2274
 epoch: 9, train_loss: 1.2567, test_loss: 1.2613, test_f1: 0.2274
 epoch: 10, train_loss: 1.2526, test_loss: 1.2630, test_f1: 0.2274
 epoch: 11, train_loss: 1.2465, test_loss: 1.2476, test_f1: 0.2274
 epoch: 12, train_loss: 1.2408, test_loss: 1.2535, test_f1: 0.2274
 epoch: 13, train_loss: 1.2372, test_loss: 1.2338, test_f1: 0.2274
 epoch: 14, train_loss: 1.2318, test_loss: 1.2273, test_f1: 0.2274
 epoch: 15, train_loss: 1.2283, test_loss: 1.2244, test_f1: 0.2340
 epoch: 16, train_loss: 1.2279, test_loss: 1.2182, test_f1: 0.2364
 epoch: 17, train_loss: 1.2242, test_loss: 1.2153, test_f1: 0.2589
 epoch: 18, train_loss: 1.2181, test_loss: 1.2081, test_f1: 0.2681
 epoch: 19, train_loss: 1.2149, test_loss: 1.2057, test_f1: 0.3070
 epoch: 20, train_loss: 1.2045, test_loss: 1.2036, test_f1: 0.3118
 epoch: 21, train_loss: 1.2057, test_loss: 1.1886, test_f1: 0.3603
 epoch: 22, train_loss: 1.2029, test_loss: 1.1880, test_f1: 0.3518
 epoch: 23, train_loss: 1.1999, test_loss: 1.1812, test_f1: 0.3806
 epoch: 24, train_loss: 1.1948, test_loss: 1.1709, test_f1: 0.3862
 epoch: 25, train_loss: 1.1884, test_loss: 1.1691, test_f1: 0.3813
 epoch: 26, train_loss: 1.1828, test_loss: 1.1674, test_f1: 0.3770
 epoch: 27, train_loss: 1.1845, test_loss: 1.1578, test_f1: 0.3842
 epoch: 28, train_loss: 1.1853, test_loss: 1.1610, test_f1: 0.3803
 epoch: 29, train_loss: 1.1705, test_loss: 1.1578, test_f1: 0.3796
 epoch: 30, train_loss: 1.1708, test_loss: 1.1560, test_f1: 0.4359
 epoch: 31, train_loss: 1.1591, test_loss: 1.1525, test_f1: 0.4509
 epoch: 32, train_loss: 1.1570, test_loss: 1.1512, test_f1: 0.4369
 epoch: 33, train_loss: 1.1622, test_loss: 1.1409, test_f1: 0.4584
 epoch: 34, train_loss: 1.1548, test_loss: 1.1403, test_f1: 0.4746
 epoch: 35, train_loss: 1.1541, test_loss: 1.1335, test_f1: 0.4759
 epoch: 36, train_loss: 1.1428, test_loss: 1.1464, test_f1: 0.4504
 epoch: 37, train_loss: 1.1433, test_loss: 1.1428, test_f1: 0.4466
 epoch: 38, train_loss: 1.1439, test_loss: 1.1253, test_f1: 0.4760
 epoch: 39, train_loss: 1.1460, test_loss: 1.1306, test_f1: 0.4822
 epoch: 40, train_loss: 1.1386, test_loss: 1.1259, test_f1: 0.4884
 epoch: 41, train_loss: 1.1298, test_loss: 1.1201, test_f1: 0.4845
 epoch: 42, train_loss: 1.1360, test_loss: 1.1117, test_f1: 0.4863
 epoch: 43, train_loss: 1.1265, test_loss: 1.1182, test_f1: 0.4505
 epoch: 44, train_loss: 1.1164, test_loss: 1.1138, test_f1: 0.4746
 epoch: 45, train_loss: 1.1244, test_loss: 1.1304, test_f1: 0.4731
 epoch: 46, train_loss: 1.1273, test_loss: 1.1250, test_f1: 0.4574
 epoch: 47, train_loss: 1.1149, test_loss: 1.1198, test_f1: 0.4554
 epoch: 48, train_loss: 1.1061, test_loss: 1.1209, test_f1: 0.4469
 epoch: 49, train_loss: 1.1055, test_loss: 1.1131, test_f1: 0.4507
 epoch: 50, train_loss: 1.1104, test_loss: 1.1181, test_f1: 0.4626
 epoch: 51, train_loss: 1.1105, test_loss: 1.1328, test_f1: 0.4523
 epoch: 52, train_loss: 1.1098, test_loss: 1.1169, test_f1: 0.4521
 epoch: 53, train_loss: 1.1085, test_loss: 1.1064, test_f1: 0.4506
 epoch: 54, train_loss: 1.1077, test_loss: 1.1130, test_f1: 0.4546
 epoch: 55, train_loss: 1.1044, test_loss: 1.1200, test_f1: 0.4435
 epoch: 56, train_loss: 1.1000, test_loss: 1.1082, test_f1: 0.4709
 epoch: 57, train_loss: 1.0931, test_loss: 1.0995, test_f1: 0.4728
 epoch: 58, train_loss: 1.1019, test_loss: 1.0968, test_f1: 0.4649
 epoch: 59, train_loss: 1.0988, test_loss: 1.0981, test_f1: 0.4702
 epoch: 60, train_loss: 1.0935, test_loss: 1.0910, test_f1: 0.4669
 epoch: 61, train_loss: 1.0917, test_loss: 1.1132, test_f1: 0.4520
 epoch: 62, train_loss: 1.0972, test_loss: 1.1101, test_f1: 0.4700
 epoch: 63, train_loss: 1.0922, test_loss: 1.1108, test_f1: 0.4572
 epoch: 64, train_loss: 1.0901, test_loss: 1.1110, test_f1: 0.4607
 epoch: 65, train_loss: 1.0871, test_loss: 1.1272, test_f1: 0.4637
 epoch: 66, train_loss: 1.0909, test_loss: 1.1051, test_f1: 0.4612
 epoch: 67, train_loss: 1.0877, test_loss: 1.1251, test_f1: 0.4391
 epoch: 68, train_loss: 1.0865, test_loss: 1.1266, test_f1: 0.4423
 epoch: 69, train_loss: 1.0871, test_loss: 1.1371, test_f1: 0.4404
 epoch: 70, train_loss: 1.0798, test_loss: 1.0879, test_f1: 0.4589
 epoch: 71, train_loss: 1.0842, test_loss: 1.1260, test_f1: 0.4403
 epoch: 72, train_loss: 1.0862, test_loss: 1.0767, test_f1: 0.4753
 epoch: 73, train_loss: 1.0906, test_loss: 1.1144, test_f1: 0.4357
 epoch: 74, train_loss: 1.0837, test_loss: 1.1455, test_f1: 0.4330
 epoch: 75, train_loss: 1.0772, test_loss: 1.1437, test_f1: 0.4321
 epoch: 76, train_loss: 1.0749, test_loss: 1.1224, test_f1: 0.4364
 epoch: 77, train_loss: 1.0673, test_loss: 1.1072, test_f1: 0.4505
 epoch: 78, train_loss: 1.0852, test_loss: 1.1088, test_f1: 0.4407
 epoch: 79, train_loss: 1.0794, test_loss: 1.1139, test_f1: 0.4470
 epoch: 80, train_loss: 1.0701, test_loss: 1.0986, test_f1: 0.4605
 epoch: 81, train_loss: 1.0834, test_loss: 1.0907, test_f1: 0.4708
 epoch: 82, train_loss: 1.0780, test_loss: 1.1243, test_f1: 0.4521
 epoch: 83, train_loss: 1.0777, test_loss: 1.1216, test_f1: 0.4383
 epoch: 84, train_loss: 1.0761, test_loss: 1.1242, test_f1: 0.4327
 epoch: 85, train_loss: 1.0780, test_loss: 1.1346, test_f1: 0.4404
 epoch: 86, train_loss: 1.0784, test_loss: 1.0977, test_f1: 0.4584
 epoch: 87, train_loss: 1.0712, test_loss: 1.1219, test_f1: 0.4426
 epoch: 88, train_loss: 1.0721, test_loss: 1.1056, test_f1: 0.4457
 epoch: 89, train_loss: 1.0800, test_loss: 1.1595, test_f1: 0.4169
 epoch: 90, train_loss: 1.0719, test_loss: 1.0867, test_f1: 0.4612
 epoch: 91, train_loss: 1.0453, test_loss: 1.1019, test_f1: 0.4447
 epoch: 92, train_loss: 1.0768, test_loss: 1.1104, test_f1: 0.4320
 epoch: 93, train_loss: 1.0662, test_loss: 1.0905, test_f1: 0.4540
 epoch: 94, train_loss: 1.0696, test_loss: 1.1056, test_f1: 0.4363
 epoch: 95, train_loss: 1.0701, test_loss: 1.1216, test_f1: 0.4437
 epoch: 96, train_loss: 1.0653, test_loss: 1.1639, test_f1: 0.4199
 epoch: 97, train_loss: 1.0721, test_loss: 1.0881, test_f1: 0.4476
 epoch: 98, train_loss: 1.0631, test_loss: 1.0936, test_f1: 0.4511
 epoch: 99, train_loss: 1.0703, test_loss: 1.0896, test_f1: 0.4602
##################ITERATION #1 ****************************************
 epoch: 0, train_loss: 1.3251, test_loss: 1.3075, test_f1: 0.2325
 epoch: 1, train_loss: 1.2949, test_loss: 1.2934, test_f1: 0.2371
 epoch: 2, train_loss: 1.2785, test_loss: 1.2767, test_f1: 0.2371
 epoch: 3, train_loss: 1.2663, test_loss: 1.2594, test_f1: 0.2346
 epoch: 4, train_loss: 1.2589, test_loss: 1.2523, test_f1: 0.2390
 epoch: 5, train_loss: 1.2455, test_loss: 1.2385, test_f1: 0.2488
 epoch: 6, train_loss: 1.2374, test_loss: 1.2282, test_f1: 0.2813
 epoch: 7, train_loss: 1.2299, test_loss: 1.2142, test_f1: 0.2813
 epoch: 8, train_loss: 1.2201, test_loss: 1.2054, test_f1: 0.2702
 epoch: 9, train_loss: 1.2194, test_loss: 1.1972, test_f1: 0.3062
 epoch: 10, train_loss: 1.2070, test_loss: 1.1887, test_f1: 0.3264
 epoch: 11, train_loss: 1.2074, test_loss: 1.1878, test_f1: 0.3425
 epoch: 12, train_loss: 1.2044, test_loss: 1.1752, test_f1: 0.3498
 epoch: 13, train_loss: 1.1955, test_loss: 1.1699, test_f1: 0.3748
 epoch: 14, train_loss: 1.1953, test_loss: 1.1700, test_f1: 0.3942
 epoch: 15, train_loss: 1.1849, test_loss: 1.1558, test_f1: 0.4004
 epoch: 16, train_loss: 1.1856, test_loss: 1.1494, test_f1: 0.4213
 epoch: 17, train_loss: 1.1783, test_loss: 1.1417, test_f1: 0.4330
 epoch: 18, train_loss: 1.1718, test_loss: 1.1495, test_f1: 0.4182
 epoch: 19, train_loss: 1.1747, test_loss: 1.1274, test_f1: 0.4521
 epoch: 20, train_loss: 1.1709, test_loss: 1.1335, test_f1: 0.4385
 epoch: 21, train_loss: 1.1622, test_loss: 1.1294, test_f1: 0.4348
 epoch: 22, train_loss: 1.1656, test_loss: 1.1249, test_f1: 0.4344
 epoch: 23, train_loss: 1.1536, test_loss: 1.1132, test_f1: 0.4502
 epoch: 24, train_loss: 1.1528, test_loss: 1.1140, test_f1: 0.4459
 epoch: 25, train_loss: 1.1454, test_loss: 1.1078, test_f1: 0.4383
 epoch: 26, train_loss: 1.1425, test_loss: 1.0977, test_f1: 0.4660
 epoch: 27, train_loss: 1.1401, test_loss: 1.0876, test_f1: 0.4527
 epoch: 28, train_loss: 1.1388, test_loss: 1.0971, test_f1: 0.4463
 epoch: 29, train_loss: 1.1252, test_loss: 1.0808, test_f1: 0.4457
 epoch: 30, train_loss: 1.1284, test_loss: 1.0753, test_f1: 0.4697
 epoch: 31, train_loss: 1.1279, test_loss: 1.0764, test_f1: 0.4582
 epoch: 32, train_loss: 1.1237, test_loss: 1.0683, test_f1: 0.4683
 epoch: 33, train_loss: 1.1170, test_loss: 1.0679, test_f1: 0.4691
 epoch: 34, train_loss: 1.1142, test_loss: 1.0651, test_f1: 0.4719
 epoch: 35, train_loss: 1.1158, test_loss: 1.0580, test_f1: 0.4743
 epoch: 36, train_loss: 1.1085, test_loss: 1.0433, test_f1: 0.4899
 epoch: 37, train_loss: 1.1130, test_loss: 1.0462, test_f1: 0.4752
 epoch: 38, train_loss: 1.1097, test_loss: 1.0442, test_f1: 0.4719
 epoch: 39, train_loss: 1.1006, test_loss: 1.0386, test_f1: 0.4693
 epoch: 40, train_loss: 1.0978, test_loss: 1.0360, test_f1: 0.4814
 epoch: 41, train_loss: 1.0992, test_loss: 1.0382, test_f1: 0.4736
 epoch: 42, train_loss: 1.0902, test_loss: 1.0209, test_f1: 0.4936
 epoch: 43, train_loss: 1.0931, test_loss: 1.0335, test_f1: 0.4817
 epoch: 44, train_loss: 1.0830, test_loss: 1.0299, test_f1: 0.4750
 epoch: 45, train_loss: 1.0848, test_loss: 1.0169, test_f1: 0.4841
 epoch: 46, train_loss: 1.0905, test_loss: 1.0217, test_f1: 0.4816
 epoch: 47, train_loss: 1.0805, test_loss: 1.0094, test_f1: 0.4805
 epoch: 48, train_loss: 1.0785, test_loss: 1.0042, test_f1: 0.4832
 epoch: 49, train_loss: 1.0745, test_loss: 1.0085, test_f1: 0.4808
 epoch: 50, train_loss: 1.0766, test_loss: 1.0184, test_f1: 0.4716
 epoch: 51, train_loss: 1.0728, test_loss: 1.0065, test_f1: 0.4807
 epoch: 52, train_loss: 1.0634, test_loss: 1.0136, test_f1: 0.4584
 epoch: 53, train_loss: 1.0722, test_loss: 0.9999, test_f1: 0.4948
 epoch: 54, train_loss: 1.0614, test_loss: 1.0076, test_f1: 0.4597
 epoch: 55, train_loss: 1.0660, test_loss: 1.0042, test_f1: 0.4619
 epoch: 56, train_loss: 1.0624, test_loss: 1.0111, test_f1: 0.4822
 epoch: 57, train_loss: 1.0566, test_loss: 1.0377, test_f1: 0.4441
 epoch: 58, train_loss: 1.0538, test_loss: 0.9990, test_f1: 0.4668
 epoch: 59, train_loss: 1.0510, test_loss: 0.9949, test_f1: 0.4728
 epoch: 60, train_loss: 1.0528, test_loss: 0.9964, test_f1: 0.4661
 epoch: 61, train_loss: 1.0579, test_loss: 0.9818, test_f1: 0.4932
 epoch: 62, train_loss: 1.0623, test_loss: 0.9959, test_f1: 0.4821
 epoch: 63, train_loss: 1.0541, test_loss: 0.9897, test_f1: 0.4887
 epoch: 64, train_loss: 1.0533, test_loss: 0.9797, test_f1: 0.4886
 epoch: 65, train_loss: 1.0574, test_loss: 0.9923, test_f1: 0.4750
 epoch: 66, train_loss: 1.0473, test_loss: 1.0089, test_f1: 0.4410
 epoch: 67, train_loss: 1.0441, test_loss: 0.9905, test_f1: 0.4776
 epoch: 68, train_loss: 1.0420, test_loss: 0.9955, test_f1: 0.4597
 epoch: 69, train_loss: 1.0364, test_loss: 0.9964, test_f1: 0.4710
 epoch: 70, train_loss: 1.0473, test_loss: 0.9738, test_f1: 0.4781
 epoch: 71, train_loss: 1.0413, test_loss: 0.9857, test_f1: 0.4793
 epoch: 72, train_loss: 1.0412, test_loss: 0.9945, test_f1: 0.4724
 epoch: 73, train_loss: 1.0401, test_loss: 0.9889, test_f1: 0.4869
 epoch: 74, train_loss: 1.0475, test_loss: 0.9834, test_f1: 0.4839
 epoch: 75, train_loss: 1.0379, test_loss: 0.9850, test_f1: 0.4940
 epoch: 76, train_loss: 1.0414, test_loss: 0.9777, test_f1: 0.5036
 epoch: 77, train_loss: 1.0331, test_loss: 0.9867, test_f1: 0.4694
 epoch: 78, train_loss: 1.0318, test_loss: 1.0243, test_f1: 0.4502
 epoch: 79, train_loss: 1.0438, test_loss: 0.9843, test_f1: 0.4962
 epoch: 80, train_loss: 1.0377, test_loss: 0.9769, test_f1: 0.4764
 epoch: 81, train_loss: 1.0285, test_loss: 1.0068, test_f1: 0.4688
 epoch: 82, train_loss: 1.0311, test_loss: 0.9783, test_f1: 0.4942
 epoch: 83, train_loss: 1.0347, test_loss: 0.9854, test_f1: 0.4712
 epoch: 84, train_loss: 1.0283, test_loss: 0.9743, test_f1: 0.4807
 epoch: 85, train_loss: 1.0275, test_loss: 0.9881, test_f1: 0.5146
 epoch: 86, train_loss: 1.0268, test_loss: 0.9727, test_f1: 0.4928
 epoch: 87, train_loss: 1.0135, test_loss: 0.9828, test_f1: 0.4746
 epoch: 88, train_loss: 1.0350, test_loss: 0.9808, test_f1: 0.4822
 epoch: 89, train_loss: 1.0293, test_loss: 0.9742, test_f1: 0.5085
 epoch: 90, train_loss: 1.0319, test_loss: 0.9821, test_f1: 0.4875
 epoch: 91, train_loss: 1.0167, test_loss: 0.9887, test_f1: 0.4840
 epoch: 92, train_loss: 1.0257, test_loss: 0.9790, test_f1: 0.4812
 epoch: 93, train_loss: 1.0188, test_loss: 0.9817, test_f1: 0.4868
 epoch: 94, train_loss: 1.0270, test_loss: 0.9754, test_f1: 0.4831
 epoch: 95, train_loss: 1.0203, test_loss: 0.9822, test_f1: 0.4775
 epoch: 96, train_loss: 1.0208, test_loss: 0.9752, test_f1: 0.4875
 epoch: 97, train_loss: 1.0196, test_loss: 0.9879, test_f1: 0.4861
 epoch: 98, train_loss: 1.0200, test_loss: 0.9820, test_f1: 0.4862
 epoch: 99, train_loss: 1.0127, test_loss: 0.9789, test_f1: 0.4826
##################ITERATION #2 ****************************************
 epoch: 0, train_loss: 1.3264, test_loss: 1.2893, test_f1: 0.2274
 epoch: 1, train_loss: 1.2871, test_loss: 1.2764, test_f1: 0.2274
 epoch: 2, train_loss: 1.2735, test_loss: 1.2659, test_f1: 0.2274
 epoch: 3, train_loss: 1.2561, test_loss: 1.2431, test_f1: 0.2416
 epoch: 4, train_loss: 1.2488, test_loss: 1.2293, test_f1: 0.2593
 epoch: 5, train_loss: 1.2432, test_loss: 1.2190, test_f1: 0.2550
 epoch: 6, train_loss: 1.2371, test_loss: 1.2039, test_f1: 0.2734
 epoch: 7, train_loss: 1.2308, test_loss: 1.1971, test_f1: 0.2779
 epoch: 8, train_loss: 1.2217, test_loss: 1.1865, test_f1: 0.2911
 epoch: 9, train_loss: 1.2165, test_loss: 1.1699, test_f1: 0.3037
 epoch: 10, train_loss: 1.2170, test_loss: 1.1677, test_f1: 0.3297
 epoch: 11, train_loss: 1.1962, test_loss: 1.1537, test_f1: 0.3502
 epoch: 12, train_loss: 1.1959, test_loss: 1.1530, test_f1: 0.3439
 epoch: 13, train_loss: 1.1880, test_loss: 1.1395, test_f1: 0.4240
 epoch: 14, train_loss: 1.1810, test_loss: 1.1282, test_f1: 0.3893
 epoch: 15, train_loss: 1.1784, test_loss: 1.1210, test_f1: 0.4230
 epoch: 16, train_loss: 1.1701, test_loss: 1.1103, test_f1: 0.4409
 epoch: 17, train_loss: 1.1621, test_loss: 1.1103, test_f1: 0.4293
 epoch: 18, train_loss: 1.1588, test_loss: 1.1111, test_f1: 0.4257
 epoch: 19, train_loss: 1.1500, test_loss: 1.0898, test_f1: 0.4262
 epoch: 20, train_loss: 1.1481, test_loss: 1.0851, test_f1: 0.4223
 epoch: 21, train_loss: 1.1411, test_loss: 1.0811, test_f1: 0.4165
 epoch: 22, train_loss: 1.1407, test_loss: 1.0713, test_f1: 0.4234
 epoch: 23, train_loss: 1.1404, test_loss: 1.0717, test_f1: 0.4274
 epoch: 24, train_loss: 1.1320, test_loss: 1.0774, test_f1: 0.4280
 epoch: 25, train_loss: 1.1224, test_loss: 1.0590, test_f1: 0.4380
 epoch: 26, train_loss: 1.1244, test_loss: 1.0647, test_f1: 0.4351
 epoch: 27, train_loss: 1.1301, test_loss: 1.0624, test_f1: 0.4332
 epoch: 28, train_loss: 1.1254, test_loss: 1.0595, test_f1: 0.4378
 epoch: 29, train_loss: 1.1171, test_loss: 1.0498, test_f1: 0.4380
 epoch: 30, train_loss: 1.1140, test_loss: 1.0483, test_f1: 0.4493
 epoch: 31, train_loss: 1.1063, test_loss: 1.0416, test_f1: 0.4443
 epoch: 32, train_loss: 1.1140, test_loss: 1.0401, test_f1: 0.4392
 epoch: 33, train_loss: 1.1089, test_loss: 1.0353, test_f1: 0.4477
 epoch: 34, train_loss: 1.1088, test_loss: 1.0390, test_f1: 0.4436
 epoch: 35, train_loss: 1.1058, test_loss: 1.0287, test_f1: 0.4535
 epoch: 36, train_loss: 1.0981, test_loss: 1.0271, test_f1: 0.4560
 epoch: 37, train_loss: 1.0915, test_loss: 1.0219, test_f1: 0.4473
 epoch: 38, train_loss: 1.1013, test_loss: 1.0357, test_f1: 0.4357
 epoch: 39, train_loss: 1.0896, test_loss: 1.0255, test_f1: 0.4527
 epoch: 40, train_loss: 1.0899, test_loss: 1.0241, test_f1: 0.4449
 epoch: 41, train_loss: 1.0826, test_loss: 1.0230, test_f1: 0.4472
 epoch: 42, train_loss: 1.0924, test_loss: 1.0133, test_f1: 0.4560
 epoch: 43, train_loss: 1.0827, test_loss: 1.0325, test_f1: 0.4409
 epoch: 44, train_loss: 1.0812, test_loss: 1.0162, test_f1: 0.4461
 epoch: 45, train_loss: 1.0767, test_loss: 1.0199, test_f1: 0.4652
 epoch: 46, train_loss: 1.0785, test_loss: 1.0141, test_f1: 0.4812
 epoch: 47, train_loss: 1.0778, test_loss: 1.0105, test_f1: 0.4821
 epoch: 48, train_loss: 1.0785, test_loss: 1.0136, test_f1: 0.4775
 epoch: 49, train_loss: 1.0760, test_loss: 1.0209, test_f1: 0.4522
 epoch: 50, train_loss: 1.0694, test_loss: 1.0149, test_f1: 0.4524
 epoch: 51, train_loss: 1.0623, test_loss: 1.0102, test_f1: 0.4775
 epoch: 52, train_loss: 1.0645, test_loss: 1.0181, test_f1: 0.4525
 epoch: 53, train_loss: 1.0599, test_loss: 1.0061, test_f1: 0.4565
 epoch: 54, train_loss: 1.0641, test_loss: 1.0287, test_f1: 0.4543
 epoch: 55, train_loss: 1.0574, test_loss: 1.0285, test_f1: 0.4451
 epoch: 56, train_loss: 1.0740, test_loss: 1.0258, test_f1: 0.4428
 epoch: 57, train_loss: 1.0631, test_loss: 1.0037, test_f1: 0.4495
 epoch: 58, train_loss: 1.0577, test_loss: 1.0183, test_f1: 0.4464
 epoch: 59, train_loss: 1.0548, test_loss: 1.0027, test_f1: 0.4544
 epoch: 60, train_loss: 1.0574, test_loss: 1.0081, test_f1: 0.4590
 epoch: 61, train_loss: 1.0540, test_loss: 1.0017, test_f1: 0.4873
 epoch: 62, train_loss: 1.0582, test_loss: 1.0016, test_f1: 0.4825
 epoch: 63, train_loss: 1.0489, test_loss: 0.9980, test_f1: 0.4803
 epoch: 64, train_loss: 1.0507, test_loss: 1.0044, test_f1: 0.4662
 epoch: 65, train_loss: 1.0577, test_loss: 1.0217, test_f1: 0.4597
 epoch: 66, train_loss: 1.0465, test_loss: 0.9978, test_f1: 0.4728
 epoch: 67, train_loss: 1.0482, test_loss: 1.0033, test_f1: 0.4499
 epoch: 68, train_loss: 1.0502, test_loss: 1.0119, test_f1: 0.4519
 epoch: 69, train_loss: 1.0555, test_loss: 1.0045, test_f1: 0.4831
 epoch: 70, train_loss: 1.0502, test_loss: 1.0197, test_f1: 0.4651
 epoch: 71, train_loss: 1.0430, test_loss: 1.0146, test_f1: 0.4744
 epoch: 72, train_loss: 1.0427, test_loss: 1.0276, test_f1: 0.4451
 epoch: 73, train_loss: 1.0414, test_loss: 0.9965, test_f1: 0.4709
 epoch: 74, train_loss: 1.0417, test_loss: 0.9951, test_f1: 0.4729
 epoch: 75, train_loss: 1.0406, test_loss: 0.9929, test_f1: 0.4726
 epoch: 76, train_loss: 1.0344, test_loss: 1.0020, test_f1: 0.4820
 epoch: 77, train_loss: 1.0385, test_loss: 1.0192, test_f1: 0.4620
 epoch: 78, train_loss: 1.0368, test_loss: 1.0046, test_f1: 0.4536
 epoch: 79, train_loss: 1.0445, test_loss: 1.0075, test_f1: 0.4548
 epoch: 80, train_loss: 1.0396, test_loss: 0.9984, test_f1: 0.4510
 epoch: 81, train_loss: 1.0406, test_loss: 1.0010, test_f1: 0.4790
 epoch: 82, train_loss: 1.0350, test_loss: 0.9947, test_f1: 0.4851
 epoch: 83, train_loss: 1.0317, test_loss: 1.0022, test_f1: 0.4627
 epoch: 84, train_loss: 1.0421, test_loss: 0.9904, test_f1: 0.4761
 epoch: 85, train_loss: 1.0315, test_loss: 0.9995, test_f1: 0.4521
 epoch: 86, train_loss: 1.0411, test_loss: 1.0235, test_f1: 0.4525
 epoch: 87, train_loss: 1.0265, test_loss: 0.9940, test_f1: 0.4641
 epoch: 88, train_loss: 1.0260, test_loss: 0.9966, test_f1: 0.4903
 epoch: 89, train_loss: 1.0352, test_loss: 0.9913, test_f1: 0.4548
 epoch: 90, train_loss: 1.0379, test_loss: 1.0008, test_f1: 0.4619
 epoch: 91, train_loss: 1.0295, test_loss: 1.0072, test_f1: 0.4480
 epoch: 92, train_loss: 1.0299, test_loss: 0.9973, test_f1: 0.4616
 epoch: 93, train_loss: 1.0237, test_loss: 1.0064, test_f1: 0.4533
 epoch: 94, train_loss: 1.0256, test_loss: 1.0059, test_f1: 0.4733
 epoch: 95, train_loss: 1.0240, test_loss: 0.9915, test_f1: 0.4594
 epoch: 96, train_loss: 1.0211, test_loss: 1.0070, test_f1: 0.4498
 epoch: 97, train_loss: 1.0249, test_loss: 1.0017, test_f1: 0.4584
 epoch: 98, train_loss: 1.0363, test_loss: 1.0123, test_f1: 0.4686
 epoch: 99, train_loss: 1.0226, test_loss: 0.9999, test_f1: 0.4549
##################ITERATION #3 ****************************************
 epoch: 0, train_loss: 1.3003, test_loss: 1.2765, test_f1: 0.2276
 epoch: 1, train_loss: 1.2593, test_loss: 1.2405, test_f1: 0.2474
 epoch: 2, train_loss: 1.2427, test_loss: 1.2323, test_f1: 0.2815
 epoch: 3, train_loss: 1.2289, test_loss: 1.2107, test_f1: 0.3177
 epoch: 4, train_loss: 1.2200, test_loss: 1.1923, test_f1: 0.3586
 epoch: 5, train_loss: 1.2170, test_loss: 1.1783, test_f1: 0.3996
 epoch: 6, train_loss: 1.2065, test_loss: 1.1655, test_f1: 0.4083
 epoch: 7, train_loss: 1.1989, test_loss: 1.1548, test_f1: 0.4211
 epoch: 8, train_loss: 1.1934, test_loss: 1.1498, test_f1: 0.4269
 epoch: 9, train_loss: 1.1838, test_loss: 1.1421, test_f1: 0.4304
 epoch: 10, train_loss: 1.1786, test_loss: 1.1326, test_f1: 0.4395
 epoch: 11, train_loss: 1.1668, test_loss: 1.1169, test_f1: 0.4371
 epoch: 12, train_loss: 1.1592, test_loss: 1.1073, test_f1: 0.4435
 epoch: 13, train_loss: 1.1567, test_loss: 1.1022, test_f1: 0.4394
 epoch: 14, train_loss: 1.1501, test_loss: 1.1017, test_f1: 0.4396
 epoch: 15, train_loss: 1.1511, test_loss: 1.0864, test_f1: 0.4378
 epoch: 16, train_loss: 1.1462, test_loss: 1.0822, test_f1: 0.4354
 epoch: 17, train_loss: 1.1383, test_loss: 1.1412, test_f1: 0.4217
 epoch: 18, train_loss: 1.1371, test_loss: 1.0775, test_f1: 0.4528
 epoch: 19, train_loss: 1.1280, test_loss: 1.0747, test_f1: 0.4466
 epoch: 20, train_loss: 1.1227, test_loss: 1.0668, test_f1: 0.4406
 epoch: 21, train_loss: 1.1178, test_loss: 1.0601, test_f1: 0.4793
 epoch: 22, train_loss: 1.1235, test_loss: 1.0777, test_f1: 0.4343
 epoch: 23, train_loss: 1.1138, test_loss: 1.0549, test_f1: 0.4376
 epoch: 24, train_loss: 1.1008, test_loss: 1.0600, test_f1: 0.4479
 epoch: 25, train_loss: 1.1054, test_loss: 1.0472, test_f1: 0.4528
 epoch: 26, train_loss: 1.1016, test_loss: 1.0447, test_f1: 0.4455
 epoch: 27, train_loss: 1.0996, test_loss: 1.0488, test_f1: 0.4322
 epoch: 28, train_loss: 1.0950, test_loss: 1.0383, test_f1: 0.4551
 epoch: 29, train_loss: 1.0925, test_loss: 1.0453, test_f1: 0.4488
 epoch: 30, train_loss: 1.0885, test_loss: 1.0414, test_f1: 0.4494
 epoch: 31, train_loss: 1.0809, test_loss: 1.0285, test_f1: 0.4666
 epoch: 32, train_loss: 1.0951, test_loss: 1.0414, test_f1: 0.4374
 epoch: 33, train_loss: 1.0758, test_loss: 1.0202, test_f1: 0.4731
 epoch: 34, train_loss: 1.0776, test_loss: 1.0242, test_f1: 0.4714
 epoch: 35, train_loss: 1.0780, test_loss: 1.0307, test_f1: 0.4651
 epoch: 36, train_loss: 1.0695, test_loss: 1.0160, test_f1: 0.4666
 epoch: 37, train_loss: 1.0683, test_loss: 1.0155, test_f1: 0.4667
 epoch: 38, train_loss: 1.0596, test_loss: 1.0222, test_f1: 0.4704
 epoch: 39, train_loss: 1.0671, test_loss: 1.0054, test_f1: 0.4623
 epoch: 40, train_loss: 1.0618, test_loss: 1.0164, test_f1: 0.4791
 epoch: 41, train_loss: 1.0590, test_loss: 0.9995, test_f1: 0.4849
 epoch: 42, train_loss: 1.0532, test_loss: 0.9923, test_f1: 0.4976
 epoch: 43, train_loss: 1.0516, test_loss: 1.0094, test_f1: 0.4871
 epoch: 44, train_loss: 1.0490, test_loss: 1.0062, test_f1: 0.4900
 epoch: 45, train_loss: 1.0432, test_loss: 1.0022, test_f1: 0.4882
 epoch: 46, train_loss: 1.0525, test_loss: 0.9966, test_f1: 0.4971
 epoch: 47, train_loss: 1.0407, test_loss: 0.9950, test_f1: 0.4960
 epoch: 48, train_loss: 1.0443, test_loss: 0.9998, test_f1: 0.4549
 epoch: 49, train_loss: 1.0328, test_loss: 0.9987, test_f1: 0.5021
 epoch: 50, train_loss: 1.0368, test_loss: 0.9781, test_f1: 0.5105
 epoch: 51, train_loss: 1.0265, test_loss: 0.9758, test_f1: 0.5109
 epoch: 52, train_loss: 1.0343, test_loss: 0.9754, test_f1: 0.5061
 epoch: 53, train_loss: 1.0319, test_loss: 0.9785, test_f1: 0.5059
 epoch: 54, train_loss: 1.0352, test_loss: 0.9885, test_f1: 0.4951
 epoch: 55, train_loss: 1.0253, test_loss: 0.9853, test_f1: 0.4707
 epoch: 56, train_loss: 1.0324, test_loss: 0.9711, test_f1: 0.5122
 epoch: 57, train_loss: 1.0262, test_loss: 0.9745, test_f1: 0.5054
 epoch: 58, train_loss: 1.0257, test_loss: 0.9654, test_f1: 0.5054
 epoch: 59, train_loss: 1.0280, test_loss: 0.9800, test_f1: 0.5027
 epoch: 60, train_loss: 1.0361, test_loss: 0.9801, test_f1: 0.5049
 epoch: 61, train_loss: 1.0254, test_loss: 0.9779, test_f1: 0.4990
 epoch: 62, train_loss: 1.0210, test_loss: 0.9728, test_f1: 0.4946
 epoch: 63, train_loss: 1.0286, test_loss: 0.9950, test_f1: 0.4716
 epoch: 64, train_loss: 1.0091, test_loss: 0.9658, test_f1: 0.4882
 epoch: 65, train_loss: 1.0204, test_loss: 0.9759, test_f1: 0.4882
 epoch: 66, train_loss: 1.0206, test_loss: 0.9643, test_f1: 0.5162
 epoch: 67, train_loss: 1.0236, test_loss: 0.9591, test_f1: 0.5115
 epoch: 68, train_loss: 1.0155, test_loss: 0.9684, test_f1: 0.4854
 epoch: 69, train_loss: 1.0082, test_loss: 0.9550, test_f1: 0.5201
 epoch: 70, train_loss: 1.0198, test_loss: 0.9596, test_f1: 0.5102
 epoch: 71, train_loss: 1.0113, test_loss: 0.9694, test_f1: 0.4778
 epoch: 72, train_loss: 1.0250, test_loss: 0.9668, test_f1: 0.5062
 epoch: 73, train_loss: 1.0154, test_loss: 0.9555, test_f1: 0.5111
 epoch: 74, train_loss: 1.0099, test_loss: 0.9650, test_f1: 0.5172
 epoch: 75, train_loss: 1.0057, test_loss: 0.9518, test_f1: 0.5229
 epoch: 76, train_loss: 1.0006, test_loss: 0.9616, test_f1: 0.5151
 epoch: 77, train_loss: 1.0136, test_loss: 0.9639, test_f1: 0.5054
 epoch: 78, train_loss: 1.0032, test_loss: 0.9651, test_f1: 0.5071
 epoch: 79, train_loss: 1.0079, test_loss: 0.9772, test_f1: 0.5055
 epoch: 80, train_loss: 1.0062, test_loss: 0.9689, test_f1: 0.5087
 epoch: 81, train_loss: 0.9961, test_loss: 0.9609, test_f1: 0.5219
 epoch: 82, train_loss: 1.0086, test_loss: 0.9588, test_f1: 0.5111
 epoch: 83, train_loss: 1.0017, test_loss: 0.9498, test_f1: 0.4952
 epoch: 84, train_loss: 1.0053, test_loss: 0.9463, test_f1: 0.5151
 epoch: 85, train_loss: 0.9975, test_loss: 0.9577, test_f1: 0.4849
 epoch: 86, train_loss: 1.0029, test_loss: 0.9484, test_f1: 0.5139
 epoch: 87, train_loss: 0.9978, test_loss: 0.9418, test_f1: 0.5160
 epoch: 88, train_loss: 0.9930, test_loss: 0.9630, test_f1: 0.4863
 epoch: 89, train_loss: 0.9943, test_loss: 0.9455, test_f1: 0.5188
 epoch: 90, train_loss: 0.9969, test_loss: 0.9641, test_f1: 0.5087
 epoch: 91, train_loss: 1.0010, test_loss: 0.9572, test_f1: 0.5086
 epoch: 92, train_loss: 0.9927, test_loss: 0.9462, test_f1: 0.5153
 epoch: 93, train_loss: 0.9884, test_loss: 0.9635, test_f1: 0.5189
 epoch: 94, train_loss: 0.9902, test_loss: 0.9663, test_f1: 0.4999
 epoch: 95, train_loss: 1.0012, test_loss: 0.9580, test_f1: 0.5021
 epoch: 96, train_loss: 0.9945, test_loss: 0.9360, test_f1: 0.5165
 epoch: 97, train_loss: 0.9959, test_loss: 0.9432, test_f1: 0.5119
 epoch: 98, train_loss: 0.9916, test_loss: 0.9655, test_f1: 0.5028
 epoch: 99, train_loss: 1.0033, test_loss: 0.9530, test_f1: 0.5191
##################ITERATION #4 ****************************************
 epoch: 0, train_loss: 1.3091, test_loss: 1.2600, test_f1: 0.2551
 epoch: 1, train_loss: 1.2636, test_loss: 1.2380, test_f1: 0.2855
 epoch: 2, train_loss: 1.2523, test_loss: 1.2249, test_f1: 0.2870
 epoch: 3, train_loss: 1.2477, test_loss: 1.2212, test_f1: 0.3042
 epoch: 4, train_loss: 1.2358, test_loss: 1.2136, test_f1: 0.3403
 epoch: 5, train_loss: 1.2292, test_loss: 1.2014, test_f1: 0.3481
 epoch: 6, train_loss: 1.2231, test_loss: 1.1935, test_f1: 0.3979
 epoch: 7, train_loss: 1.2199, test_loss: 1.1887, test_f1: 0.3918
 epoch: 8, train_loss: 1.2136, test_loss: 1.1779, test_f1: 0.3899
 epoch: 9, train_loss: 1.2049, test_loss: 1.1727, test_f1: 0.4096
 epoch: 10, train_loss: 1.2038, test_loss: 1.1668, test_f1: 0.3972
 epoch: 11, train_loss: 1.1937, test_loss: 1.1540, test_f1: 0.4277
 epoch: 12, train_loss: 1.1861, test_loss: 1.1489, test_f1: 0.4235
 epoch: 13, train_loss: 1.1808, test_loss: 1.1437, test_f1: 0.4079
 epoch: 14, train_loss: 1.1763, test_loss: 1.1359, test_f1: 0.4021
 epoch: 15, train_loss: 1.1716, test_loss: 1.1337, test_f1: 0.3999
 epoch: 16, train_loss: 1.1677, test_loss: 1.1192, test_f1: 0.4062
 epoch: 17, train_loss: 1.1562, test_loss: 1.1148, test_f1: 0.4028
 epoch: 18, train_loss: 1.1510, test_loss: 1.1007, test_f1: 0.4204
 epoch: 19, train_loss: 1.1502, test_loss: 1.1116, test_f1: 0.4038
 epoch: 20, train_loss: 1.1462, test_loss: 1.0998, test_f1: 0.4123
 epoch: 21, train_loss: 1.1409, test_loss: 1.0913, test_f1: 0.4189
 epoch: 22, train_loss: 1.1399, test_loss: 1.1062, test_f1: 0.4193
 epoch: 23, train_loss: 1.1336, test_loss: 1.0924, test_f1: 0.4129
 epoch: 24, train_loss: 1.1427, test_loss: 1.0850, test_f1: 0.4192
 epoch: 25, train_loss: 1.1292, test_loss: 1.1183, test_f1: 0.4059
 epoch: 26, train_loss: 1.1206, test_loss: 1.0732, test_f1: 0.4256
 epoch: 27, train_loss: 1.1204, test_loss: 1.0647, test_f1: 0.4359
 epoch: 28, train_loss: 1.1136, test_loss: 1.0741, test_f1: 0.4162
 epoch: 29, train_loss: 1.1097, test_loss: 1.0608, test_f1: 0.4239
 epoch: 30, train_loss: 1.1132, test_loss: 1.0636, test_f1: 0.4280
 epoch: 31, train_loss: 1.1077, test_loss: 1.0653, test_f1: 0.4239
 epoch: 32, train_loss: 1.1073, test_loss: 1.0637, test_f1: 0.4252
 epoch: 33, train_loss: 1.0985, test_loss: 1.0716, test_f1: 0.4209
 epoch: 34, train_loss: 1.0976, test_loss: 1.0432, test_f1: 0.4364
 epoch: 35, train_loss: 1.0864, test_loss: 1.0465, test_f1: 0.4310
 epoch: 36, train_loss: 1.1023, test_loss: 1.0428, test_f1: 0.4246
 epoch: 37, train_loss: 1.0933, test_loss: 1.0569, test_f1: 0.4272
 epoch: 38, train_loss: 1.0787, test_loss: 1.0468, test_f1: 0.4410
 epoch: 39, train_loss: 1.0837, test_loss: 1.0777, test_f1: 0.4051
 epoch: 40, train_loss: 1.0774, test_loss: 1.0485, test_f1: 0.4270
 epoch: 41, train_loss: 1.0795, test_loss: 1.0523, test_f1: 0.4118
 epoch: 42, train_loss: 1.0777, test_loss: 1.0465, test_f1: 0.4235
 epoch: 43, train_loss: 1.0753, test_loss: 1.0436, test_f1: 0.4288
 epoch: 44, train_loss: 1.0718, test_loss: 1.0365, test_f1: 0.4205
 epoch: 45, train_loss: 1.0770, test_loss: 1.0404, test_f1: 0.4376
 epoch: 46, train_loss: 1.0702, test_loss: 1.0482, test_f1: 0.4173
 epoch: 47, train_loss: 1.0673, test_loss: 1.0363, test_f1: 0.4250
 epoch: 48, train_loss: 1.0688, test_loss: 1.0556, test_f1: 0.4263
 epoch: 49, train_loss: 1.0679, test_loss: 1.0392, test_f1: 0.4347
 epoch: 50, train_loss: 1.0635, test_loss: 1.0148, test_f1: 0.4450
 epoch: 51, train_loss: 1.0598, test_loss: 1.0337, test_f1: 0.4336
 epoch: 52, train_loss: 1.0528, test_loss: 1.0074, test_f1: 0.4507
 epoch: 53, train_loss: 1.0570, test_loss: 1.0165, test_f1: 0.4389
 epoch: 54, train_loss: 1.0553, test_loss: 1.0268, test_f1: 0.4307
 epoch: 55, train_loss: 1.0534, test_loss: 1.0168, test_f1: 0.4409
 epoch: 56, train_loss: 1.0581, test_loss: 1.0130, test_f1: 0.4490
 epoch: 57, train_loss: 1.0480, test_loss: 1.0144, test_f1: 0.4464
 epoch: 58, train_loss: 1.0497, test_loss: 1.0292, test_f1: 0.4453
 epoch: 59, train_loss: 1.0436, test_loss: 1.0143, test_f1: 0.4509
 epoch: 60, train_loss: 1.0440, test_loss: 1.0100, test_f1: 0.4450
 epoch: 61, train_loss: 1.0435, test_loss: 1.0135, test_f1: 0.4423
 epoch: 62, train_loss: 1.0431, test_loss: 1.0088, test_f1: 0.4560
 epoch: 63, train_loss: 1.0437, test_loss: 1.0246, test_f1: 0.4454
 epoch: 64, train_loss: 1.0416, test_loss: 1.0234, test_f1: 0.4489
 epoch: 65, train_loss: 1.0406, test_loss: 1.0067, test_f1: 0.4487
 epoch: 66, train_loss: 1.0383, test_loss: 1.0278, test_f1: 0.4348
 epoch: 67, train_loss: 1.0314, test_loss: 1.0250, test_f1: 0.4384
 epoch: 68, train_loss: 1.0400, test_loss: 1.0154, test_f1: 0.4499
 epoch: 69, train_loss: 1.0465, test_loss: 1.0625, test_f1: 0.4192
 epoch: 70, train_loss: 1.0267, test_loss: 1.0440, test_f1: 0.4240
 epoch: 71, train_loss: 1.0226, test_loss: 1.0228, test_f1: 0.4405
 epoch: 72, train_loss: 1.0228, test_loss: 0.9971, test_f1: 0.4716
 epoch: 73, train_loss: 1.0336, test_loss: 1.0299, test_f1: 0.4402
 epoch: 74, train_loss: 1.0261, test_loss: 1.0116, test_f1: 0.4339
 epoch: 75, train_loss: 1.0365, test_loss: 1.0255, test_f1: 0.4377
 epoch: 76, train_loss: 1.0216, test_loss: 1.0066, test_f1: 0.4575
 epoch: 77, train_loss: 1.0317, test_loss: 1.0422, test_f1: 0.4386
 epoch: 78, train_loss: 1.0274, test_loss: 1.0265, test_f1: 0.4360
 epoch: 79, train_loss: 1.0360, test_loss: 1.0262, test_f1: 0.4302
 epoch: 80, train_loss: 1.0258, test_loss: 1.0305, test_f1: 0.4442
 epoch: 81, train_loss: 1.0110, test_loss: 1.0323, test_f1: 0.4471
 epoch: 82, train_loss: 1.0127, test_loss: 1.0720, test_f1: 0.4214
 epoch: 83, train_loss: 1.0224, test_loss: 1.0081, test_f1: 0.4483
 epoch: 84, train_loss: 1.0158, test_loss: 1.0048, test_f1: 0.4480
 epoch: 85, train_loss: 1.0145, test_loss: 1.0349, test_f1: 0.4336
 epoch: 86, train_loss: 1.0185, test_loss: 1.0080, test_f1: 0.4489
 epoch: 87, train_loss: 1.0228, test_loss: 1.0640, test_f1: 0.4294
 epoch: 88, train_loss: 1.0154, test_loss: 1.0330, test_f1: 0.4266
 epoch: 89, train_loss: 1.0121, test_loss: 1.0089, test_f1: 0.4519
 epoch: 90, train_loss: 1.0178, test_loss: 1.0349, test_f1: 0.4402
 epoch: 91, train_loss: 1.0218, test_loss: 1.0373, test_f1: 0.4264
 epoch: 92, train_loss: 1.0096, test_loss: 1.0242, test_f1: 0.4443
 epoch: 93, train_loss: 1.0182, test_loss: 1.0129, test_f1: 0.4484
 epoch: 94, train_loss: 1.0147, test_loss: 1.0258, test_f1: 0.4362
 epoch: 95, train_loss: 1.0090, test_loss: 1.0063, test_f1: 0.4436
 epoch: 96, train_loss: 1.0148, test_loss: 1.0265, test_f1: 0.4545
 epoch: 97, train_loss: 1.0165, test_loss: 1.0082, test_f1: 0.4604
 epoch: 98, train_loss: 1.0108, test_loss: 0.9869, test_f1: 0.4562
 epoch: 99, train_loss: 0.9974, test_loss: 1.0191, test_f1: 0.4427
##################ITERATION #5 ****************************************
 epoch: 0, train_loss: 1.3068, test_loss: 1.2798, test_f1: 0.2706
 epoch: 1, train_loss: 1.2765, test_loss: 1.2621, test_f1: 0.2649
 epoch: 2, train_loss: 1.2604, test_loss: 1.2425, test_f1: 0.2978
 epoch: 3, train_loss: 1.2497, test_loss: 1.2402, test_f1: 0.3039
 epoch: 4, train_loss: 1.2460, test_loss: 1.2275, test_f1: 0.3375
 epoch: 5, train_loss: 1.2375, test_loss: 1.2233, test_f1: 0.3396
 epoch: 6, train_loss: 1.2396, test_loss: 1.2160, test_f1: 0.3388
 epoch: 7, train_loss: 1.2207, test_loss: 1.2045, test_f1: 0.3673
 epoch: 8, train_loss: 1.2187, test_loss: 1.1940, test_f1: 0.3897
 epoch: 9, train_loss: 1.2090, test_loss: 1.1910, test_f1: 0.3964
 epoch: 10, train_loss: 1.2094, test_loss: 1.1856, test_f1: 0.3986
 epoch: 11, train_loss: 1.1982, test_loss: 1.1881, test_f1: 0.3903
 epoch: 12, train_loss: 1.2010, test_loss: 1.1870, test_f1: 0.4028
 epoch: 13, train_loss: 1.2007, test_loss: 1.1899, test_f1: 0.4040
 epoch: 14, train_loss: 1.1926, test_loss: 1.1819, test_f1: 0.4093
 epoch: 15, train_loss: 1.1902, test_loss: 1.1794, test_f1: 0.4098
 epoch: 16, train_loss: 1.1799, test_loss: 1.1877, test_f1: 0.3974
 epoch: 17, train_loss: 1.1787, test_loss: 1.1752, test_f1: 0.3945
 epoch: 18, train_loss: 1.1754, test_loss: 1.1731, test_f1: 0.4092
 epoch: 19, train_loss: 1.1781, test_loss: 1.1707, test_f1: 0.4110
 epoch: 20, train_loss: 1.1682, test_loss: 1.1700, test_f1: 0.4055
 epoch: 21, train_loss: 1.1615, test_loss: 1.1504, test_f1: 0.4088
 epoch: 22, train_loss: 1.1618, test_loss: 1.1684, test_f1: 0.3981
 epoch: 23, train_loss: 1.1547, test_loss: 1.1542, test_f1: 0.4167
 epoch: 24, train_loss: 1.1549, test_loss: 1.1527, test_f1: 0.3991
 epoch: 25, train_loss: 1.1433, test_loss: 1.1620, test_f1: 0.4122
 epoch: 26, train_loss: 1.1530, test_loss: 1.1351, test_f1: 0.4086
 epoch: 27, train_loss: 1.1358, test_loss: 1.1355, test_f1: 0.4172
 epoch: 28, train_loss: 1.1381, test_loss: 1.1316, test_f1: 0.4363
 epoch: 29, train_loss: 1.1325, test_loss: 1.1325, test_f1: 0.4236
 epoch: 30, train_loss: 1.1242, test_loss: 1.1259, test_f1: 0.4226
 epoch: 31, train_loss: 1.1326, test_loss: 1.1355, test_f1: 0.4233
 epoch: 32, train_loss: 1.1140, test_loss: 1.1225, test_f1: 0.4253
 epoch: 33, train_loss: 1.1229, test_loss: 1.1118, test_f1: 0.4231
 epoch: 34, train_loss: 1.1198, test_loss: 1.1282, test_f1: 0.4127
 epoch: 35, train_loss: 1.1147, test_loss: 1.1298, test_f1: 0.4133
 epoch: 36, train_loss: 1.1060, test_loss: 1.1476, test_f1: 0.3845
 epoch: 37, train_loss: 1.1098, test_loss: 1.1140, test_f1: 0.4081
 epoch: 38, train_loss: 1.1095, test_loss: 1.1031, test_f1: 0.4217
 epoch: 39, train_loss: 1.1008, test_loss: 1.0985, test_f1: 0.4225
 epoch: 40, train_loss: 1.0857, test_loss: 1.1149, test_f1: 0.4005
 epoch: 41, train_loss: 1.0836, test_loss: 1.0987, test_f1: 0.4125
 epoch: 42, train_loss: 1.0887, test_loss: 1.1027, test_f1: 0.4094
 epoch: 43, train_loss: 1.0932, test_loss: 1.0862, test_f1: 0.4276
 epoch: 44, train_loss: 1.0867, test_loss: 1.1041, test_f1: 0.4082
 epoch: 45, train_loss: 1.0879, test_loss: 1.1190, test_f1: 0.4172
 epoch: 46, train_loss: 1.0795, test_loss: 1.0760, test_f1: 0.4374
 epoch: 47, train_loss: 1.0750, test_loss: 1.1084, test_f1: 0.4062
 epoch: 48, train_loss: 1.0743, test_loss: 1.0734, test_f1: 0.4277
 epoch: 49, train_loss: 1.0735, test_loss: 1.0877, test_f1: 0.4339
 epoch: 50, train_loss: 1.0746, test_loss: 1.0625, test_f1: 0.4376
 epoch: 51, train_loss: 1.0687, test_loss: 1.1061, test_f1: 0.4191
 epoch: 52, train_loss: 1.0681, test_loss: 1.0855, test_f1: 0.4206
 epoch: 53, train_loss: 1.0580, test_loss: 1.0765, test_f1: 0.4173
 epoch: 54, train_loss: 1.0575, test_loss: 1.0718, test_f1: 0.4412
 epoch: 55, train_loss: 1.0660, test_loss: 1.0670, test_f1: 0.4268
 epoch: 56, train_loss: 1.0570, test_loss: 1.0876, test_f1: 0.4238
 epoch: 57, train_loss: 1.0573, test_loss: 1.0675, test_f1: 0.4323
 epoch: 58, train_loss: 1.0560, test_loss: 1.0967, test_f1: 0.4002
 epoch: 59, train_loss: 1.0524, test_loss: 1.0723, test_f1: 0.4334
 epoch: 60, train_loss: 1.0513, test_loss: 1.0846, test_f1: 0.4325
 epoch: 61, train_loss: 1.0557, test_loss: 1.0852, test_f1: 0.4249
 epoch: 62, train_loss: 1.0543, test_loss: 1.0742, test_f1: 0.4328
 epoch: 63, train_loss: 1.0532, test_loss: 1.0810, test_f1: 0.4340
 epoch: 64, train_loss: 1.0637, test_loss: 1.0691, test_f1: 0.4152
 epoch: 65, train_loss: 1.0454, test_loss: 1.0845, test_f1: 0.4307
 epoch: 66, train_loss: 1.0527, test_loss: 1.1032, test_f1: 0.4128
 epoch: 67, train_loss: 1.0526, test_loss: 1.1015, test_f1: 0.4246
 epoch: 68, train_loss: 1.0495, test_loss: 1.0732, test_f1: 0.4341
 epoch: 69, train_loss: 1.0426, test_loss: 1.0758, test_f1: 0.4307
 epoch: 70, train_loss: 1.0410, test_loss: 1.0664, test_f1: 0.4295
 epoch: 71, train_loss: 1.0421, test_loss: 1.0718, test_f1: 0.4318
 epoch: 72, train_loss: 1.0388, test_loss: 1.0710, test_f1: 0.4311
 epoch: 73, train_loss: 1.0374, test_loss: 1.0766, test_f1: 0.4290
 epoch: 74, train_loss: 1.0411, test_loss: 1.0779, test_f1: 0.4154
 epoch: 75, train_loss: 1.0448, test_loss: 1.1137, test_f1: 0.4239
 epoch: 76, train_loss: 1.0391, test_loss: 1.0856, test_f1: 0.4362
 epoch: 77, train_loss: 1.0388, test_loss: 1.0596, test_f1: 0.4256
 epoch: 78, train_loss: 1.0244, test_loss: 1.1100, test_f1: 0.4159
 epoch: 79, train_loss: 1.0403, test_loss: 1.0959, test_f1: 0.4338
 epoch: 80, train_loss: 1.0346, test_loss: 1.0504, test_f1: 0.4438
 epoch: 81, train_loss: 1.0279, test_loss: 1.0624, test_f1: 0.4390
 epoch: 82, train_loss: 1.0290, test_loss: 1.0557, test_f1: 0.4486
 epoch: 83, train_loss: 1.0280, test_loss: 1.0566, test_f1: 0.4612
 epoch: 84, train_loss: 1.0329, test_loss: 1.0783, test_f1: 0.4350
 epoch: 85, train_loss: 1.0342, test_loss: 1.0514, test_f1: 0.4499
 epoch: 86, train_loss: 1.0355, test_loss: 1.0486, test_f1: 0.4481
 epoch: 87, train_loss: 1.0155, test_loss: 1.0533, test_f1: 0.4497
 epoch: 88, train_loss: 1.0140, test_loss: 1.0506, test_f1: 0.4527
 epoch: 89, train_loss: 1.0270, test_loss: 1.0580, test_f1: 0.4353
 epoch: 90, train_loss: 1.0311, test_loss: 1.0385, test_f1: 0.4428
 epoch: 91, train_loss: 1.0264, test_loss: 1.0674, test_f1: 0.4216
 epoch: 92, train_loss: 1.0194, test_loss: 1.0514, test_f1: 0.4554
 epoch: 93, train_loss: 1.0249, test_loss: 1.0521, test_f1: 0.4487
 epoch: 94, train_loss: 1.0276, test_loss: 1.0453, test_f1: 0.4378
 epoch: 95, train_loss: 1.0151, test_loss: 1.0465, test_f1: 0.4381
 epoch: 96, train_loss: 1.0249, test_loss: 1.0597, test_f1: 0.4406
 epoch: 97, train_loss: 1.0135, test_loss: 1.0343, test_f1: 0.4546
 epoch: 98, train_loss: 1.0154, test_loss: 1.0571, test_f1: 0.4542
 epoch: 99, train_loss: 1.0126, test_loss: 1.0497, test_f1: 0.4479
##################ITERATION #6 ****************************************
 epoch: 0, train_loss: 1.3357, test_loss: 1.2557, test_f1: 0.2266
 epoch: 1, train_loss: 1.2746, test_loss: 1.2477, test_f1: 0.2462
 epoch: 2, train_loss: 1.2611, test_loss: 1.2506, test_f1: 0.2852
 epoch: 3, train_loss: 1.2590, test_loss: 1.2163, test_f1: 0.2875
 epoch: 4, train_loss: 1.2428, test_loss: 1.2046, test_f1: 0.3353
 epoch: 5, train_loss: 1.2359, test_loss: 1.2050, test_f1: 0.3588
 epoch: 6, train_loss: 1.2287, test_loss: 1.1930, test_f1: 0.3694
 epoch: 7, train_loss: 1.2240, test_loss: 1.1823, test_f1: 0.3900
 epoch: 8, train_loss: 1.2193, test_loss: 1.1743, test_f1: 0.3900
 epoch: 9, train_loss: 1.2235, test_loss: 1.1743, test_f1: 0.3804
 epoch: 10, train_loss: 1.2043, test_loss: 1.1658, test_f1: 0.4122
 epoch: 11, train_loss: 1.1994, test_loss: 1.1753, test_f1: 0.4136
 epoch: 12, train_loss: 1.1973, test_loss: 1.1493, test_f1: 0.4243
 epoch: 13, train_loss: 1.1898, test_loss: 1.1459, test_f1: 0.4309
 epoch: 14, train_loss: 1.1856, test_loss: 1.1382, test_f1: 0.4230
 epoch: 15, train_loss: 1.1852, test_loss: 1.1463, test_f1: 0.4055
 epoch: 16, train_loss: 1.1753, test_loss: 1.1327, test_f1: 0.4355
 epoch: 17, train_loss: 1.1746, test_loss: 1.1213, test_f1: 0.4233
 epoch: 18, train_loss: 1.1610, test_loss: 1.1072, test_f1: 0.4462
 epoch: 19, train_loss: 1.1592, test_loss: 1.1020, test_f1: 0.4305
 epoch: 20, train_loss: 1.1563, test_loss: 1.1238, test_f1: 0.4280
 epoch: 21, train_loss: 1.1471, test_loss: 1.1478, test_f1: 0.4423
 epoch: 22, train_loss: 1.1520, test_loss: 1.0928, test_f1: 0.4297
 epoch: 23, train_loss: 1.1401, test_loss: 1.1214, test_f1: 0.4518
 epoch: 24, train_loss: 1.1298, test_loss: 1.1071, test_f1: 0.4547
 epoch: 25, train_loss: 1.1215, test_loss: 1.0821, test_f1: 0.4448
 epoch: 26, train_loss: 1.1222, test_loss: 1.0638, test_f1: 0.4508
 epoch: 27, train_loss: 1.1166, test_loss: 1.1007, test_f1: 0.4512
 epoch: 28, train_loss: 1.1027, test_loss: 1.0601, test_f1: 0.4433
 epoch: 29, train_loss: 1.1059, test_loss: 1.0745, test_f1: 0.4462
 epoch: 30, train_loss: 1.0966, test_loss: 1.0527, test_f1: 0.4554
 epoch: 31, train_loss: 1.0966, test_loss: 1.0279, test_f1: 0.4692
 epoch: 32, train_loss: 1.0914, test_loss: 1.0346, test_f1: 0.4568
 epoch: 33, train_loss: 1.0831, test_loss: 1.0270, test_f1: 0.4572
 epoch: 34, train_loss: 1.0893, test_loss: 1.0261, test_f1: 0.4581
 epoch: 35, train_loss: 1.0946, test_loss: 1.0331, test_f1: 0.4703
 epoch: 36, train_loss: 1.0753, test_loss: 1.0204, test_f1: 0.4479
 epoch: 37, train_loss: 1.0721, test_loss: 1.0082, test_f1: 0.4701
 epoch: 38, train_loss: 1.0698, test_loss: 1.0054, test_f1: 0.4503
 epoch: 39, train_loss: 1.0594, test_loss: 1.0036, test_f1: 0.4666
 epoch: 40, train_loss: 1.0599, test_loss: 0.9928, test_f1: 0.4643
 epoch: 41, train_loss: 1.0626, test_loss: 0.9896, test_f1: 0.4794
 epoch: 42, train_loss: 1.0518, test_loss: 0.9888, test_f1: 0.4873
 epoch: 43, train_loss: 1.0474, test_loss: 0.9915, test_f1: 0.4830
 epoch: 44, train_loss: 1.0473, test_loss: 0.9859, test_f1: 0.4584
 epoch: 45, train_loss: 1.0465, test_loss: 0.9917, test_f1: 0.4829
 epoch: 46, train_loss: 1.0395, test_loss: 0.9953, test_f1: 0.4777
 epoch: 47, train_loss: 1.0398, test_loss: 0.9895, test_f1: 0.4584
 epoch: 48, train_loss: 1.0291, test_loss: 0.9951, test_f1: 0.4784
 epoch: 49, train_loss: 1.0329, test_loss: 0.9760, test_f1: 0.4829
 epoch: 50, train_loss: 1.0370, test_loss: 0.9881, test_f1: 0.4669
 epoch: 51, train_loss: 1.0225, test_loss: 0.9827, test_f1: 0.4591
 epoch: 52, train_loss: 1.0241, test_loss: 0.9601, test_f1: 0.4763
 epoch: 53, train_loss: 1.0339, test_loss: 0.9521, test_f1: 0.4602
 epoch: 54, train_loss: 1.0203, test_loss: 0.9761, test_f1: 0.4760
 epoch: 55, train_loss: 1.0139, test_loss: 0.9731, test_f1: 0.4428
 epoch: 56, train_loss: 1.0205, test_loss: 0.9658, test_f1: 0.4627
 epoch: 57, train_loss: 1.0207, test_loss: 0.9438, test_f1: 0.4731
 epoch: 58, train_loss: 1.0213, test_loss: 0.9710, test_f1: 0.4798
 epoch: 59, train_loss: 1.0168, test_loss: 0.9883, test_f1: 0.4769
 epoch: 60, train_loss: 1.0091, test_loss: 0.9529, test_f1: 0.4663
 epoch: 61, train_loss: 1.0113, test_loss: 0.9549, test_f1: 0.4598
 epoch: 62, train_loss: 1.0119, test_loss: 0.9528, test_f1: 0.4806
 epoch: 63, train_loss: 1.0179, test_loss: 0.9519, test_f1: 0.4630
 epoch: 64, train_loss: 1.0086, test_loss: 0.9493, test_f1: 0.4780
 epoch: 65, train_loss: 1.0064, test_loss: 0.9451, test_f1: 0.4752
 epoch: 66, train_loss: 1.0125, test_loss: 0.9659, test_f1: 0.4978
 epoch: 67, train_loss: 1.0067, test_loss: 0.9471, test_f1: 0.4746
 epoch: 68, train_loss: 1.0128, test_loss: 0.9390, test_f1: 0.4758
 epoch: 69, train_loss: 1.0098, test_loss: 0.9468, test_f1: 0.4733
 epoch: 70, train_loss: 1.0113, test_loss: 0.9485, test_f1: 0.4819
 epoch: 71, train_loss: 1.0038, test_loss: 0.9458, test_f1: 0.4936
 epoch: 72, train_loss: 1.0031, test_loss: 0.9714, test_f1: 0.4787
 epoch: 73, train_loss: 0.9958, test_loss: 0.9602, test_f1: 0.4754
 epoch: 74, train_loss: 0.9979, test_loss: 0.9390, test_f1: 0.4848
 epoch: 75, train_loss: 0.9939, test_loss: 0.9814, test_f1: 0.4782
 epoch: 76, train_loss: 0.9935, test_loss: 0.9384, test_f1: 0.4614
 epoch: 77, train_loss: 1.0048, test_loss: 0.9565, test_f1: 0.4874
 epoch: 78, train_loss: 0.9993, test_loss: 0.9456, test_f1: 0.4688
 epoch: 79, train_loss: 1.0048, test_loss: 0.9577, test_f1: 0.4596
 epoch: 80, train_loss: 0.9979, test_loss: 0.9459, test_f1: 0.4683
 epoch: 81, train_loss: 0.9928, test_loss: 0.9420, test_f1: 0.4818
 epoch: 82, train_loss: 0.9924, test_loss: 0.9609, test_f1: 0.4821
 epoch: 83, train_loss: 0.9903, test_loss: 0.9394, test_f1: 0.4620
 epoch: 84, train_loss: 0.9856, test_loss: 0.9456, test_f1: 0.4686
 epoch: 85, train_loss: 0.9890, test_loss: 0.9522, test_f1: 0.4810
 epoch: 86, train_loss: 0.9869, test_loss: 0.9303, test_f1: 0.4818
 epoch: 87, train_loss: 0.9813, test_loss: 0.9260, test_f1: 0.4924
 epoch: 88, train_loss: 0.9719, test_loss: 0.9262, test_f1: 0.4935
 epoch: 89, train_loss: 0.9779, test_loss: 0.9273, test_f1: 0.4676
 epoch: 90, train_loss: 0.9910, test_loss: 0.9254, test_f1: 0.4623
 epoch: 91, train_loss: 0.9873, test_loss: 0.9317, test_f1: 0.4832
 epoch: 92, train_loss: 0.9854, test_loss: 0.9380, test_f1: 0.4880
 epoch: 93, train_loss: 0.9817, test_loss: 0.9526, test_f1: 0.4834
 epoch: 94, train_loss: 0.9782, test_loss: 0.9527, test_f1: 0.4749
 epoch: 95, train_loss: 0.9697, test_loss: 0.9300, test_f1: 0.4627
 epoch: 96, train_loss: 0.9793, test_loss: 0.9547, test_f1: 0.4706
 epoch: 97, train_loss: 0.9777, test_loss: 0.9562, test_f1: 0.4730
 epoch: 98, train_loss: 0.9770, test_loss: 0.9384, test_f1: 0.4856
 epoch: 99, train_loss: 0.9790, test_loss: 0.9255, test_f1: 0.4832
##################ITERATION #7 ****************************************
 epoch: 0, train_loss: 1.3161, test_loss: 1.2574, test_f1: 0.2575
 epoch: 1, train_loss: 1.2824, test_loss: 1.2817, test_f1: 0.2624
 epoch: 2, train_loss: 1.2672, test_loss: 1.2362, test_f1: 0.2589
 epoch: 3, train_loss: 1.2673, test_loss: 1.2323, test_f1: 0.2603
 epoch: 4, train_loss: 1.2526, test_loss: 1.2206, test_f1: 0.2891
 epoch: 5, train_loss: 1.2475, test_loss: 1.2199, test_f1: 0.3190
 epoch: 6, train_loss: 1.2416, test_loss: 1.2076, test_f1: 0.2905
 epoch: 7, train_loss: 1.2338, test_loss: 1.1956, test_f1: 0.3461
 epoch: 8, train_loss: 1.2288, test_loss: 1.1919, test_f1: 0.3539
 epoch: 9, train_loss: 1.2214, test_loss: 1.1951, test_f1: 0.3253
 epoch: 10, train_loss: 1.2137, test_loss: 1.1888, test_f1: 0.3339
 epoch: 11, train_loss: 1.2154, test_loss: 1.1716, test_f1: 0.4040
 epoch: 12, train_loss: 1.2069, test_loss: 1.1771, test_f1: 0.3582
 epoch: 13, train_loss: 1.1956, test_loss: 1.1754, test_f1: 0.3932
 epoch: 14, train_loss: 1.1923, test_loss: 1.1543, test_f1: 0.3710
 epoch: 15, train_loss: 1.1940, test_loss: 1.1718, test_f1: 0.3859
 epoch: 16, train_loss: 1.1899, test_loss: 1.1552, test_f1: 0.3885
 epoch: 17, train_loss: 1.1838, test_loss: 1.1483, test_f1: 0.3848
 epoch: 18, train_loss: 1.1778, test_loss: 1.1431, test_f1: 0.3793
 epoch: 19, train_loss: 1.1713, test_loss: 1.1282, test_f1: 0.4151
 epoch: 20, train_loss: 1.1702, test_loss: 1.1385, test_f1: 0.3810
 epoch: 21, train_loss: 1.1657, test_loss: 1.1368, test_f1: 0.3808
 epoch: 22, train_loss: 1.1685, test_loss: 1.1375, test_f1: 0.3974
 epoch: 23, train_loss: 1.1597, test_loss: 1.1298, test_f1: 0.4144
 epoch: 24, train_loss: 1.1589, test_loss: 1.1057, test_f1: 0.4061
 epoch: 25, train_loss: 1.1563, test_loss: 1.1064, test_f1: 0.4307
 epoch: 26, train_loss: 1.1520, test_loss: 1.1030, test_f1: 0.4081
 epoch: 27, train_loss: 1.1419, test_loss: 1.1059, test_f1: 0.3982
 epoch: 28, train_loss: 1.1422, test_loss: 1.0944, test_f1: 0.4219
 epoch: 29, train_loss: 1.1364, test_loss: 1.0869, test_f1: 0.4055
 epoch: 30, train_loss: 1.1431, test_loss: 1.0991, test_f1: 0.4139
 epoch: 31, train_loss: 1.1276, test_loss: 1.0892, test_f1: 0.4310
 epoch: 32, train_loss: 1.1246, test_loss: 1.0928, test_f1: 0.4155
 epoch: 33, train_loss: 1.1245, test_loss: 1.0714, test_f1: 0.4320
 epoch: 34, train_loss: 1.1276, test_loss: 1.0714, test_f1: 0.4198
 epoch: 35, train_loss: 1.1169, test_loss: 1.0703, test_f1: 0.4216
 epoch: 36, train_loss: 1.1167, test_loss: 1.0828, test_f1: 0.4407
 epoch: 37, train_loss: 1.1095, test_loss: 1.0676, test_f1: 0.4270
 epoch: 38, train_loss: 1.1147, test_loss: 1.0708, test_f1: 0.4370
 epoch: 39, train_loss: 1.1192, test_loss: 1.0702, test_f1: 0.4334
 epoch: 40, train_loss: 1.1097, test_loss: 1.0703, test_f1: 0.4206
 epoch: 41, train_loss: 1.0971, test_loss: 1.0545, test_f1: 0.4103
 epoch: 42, train_loss: 1.1016, test_loss: 1.0892, test_f1: 0.4420
 epoch: 43, train_loss: 1.1092, test_loss: 1.0467, test_f1: 0.4487
 epoch: 44, train_loss: 1.0893, test_loss: 1.0481, test_f1: 0.4225
 epoch: 45, train_loss: 1.0816, test_loss: 1.0485, test_f1: 0.4438
 epoch: 46, train_loss: 1.0887, test_loss: 1.0481, test_f1: 0.4594
 epoch: 47, train_loss: 1.0889, test_loss: 1.0517, test_f1: 0.4606
 epoch: 48, train_loss: 1.0891, test_loss: 1.0460, test_f1: 0.4240
 epoch: 49, train_loss: 1.0842, test_loss: 1.0434, test_f1: 0.4295
 epoch: 50, train_loss: 1.0795, test_loss: 1.0511, test_f1: 0.4294
 epoch: 51, train_loss: 1.0778, test_loss: 1.0322, test_f1: 0.4325
 epoch: 52, train_loss: 1.0786, test_loss: 1.0251, test_f1: 0.4429
 epoch: 53, train_loss: 1.0757, test_loss: 1.0298, test_f1: 0.4249
 epoch: 54, train_loss: 1.0769, test_loss: 1.0265, test_f1: 0.4472
 epoch: 55, train_loss: 1.0777, test_loss: 1.0272, test_f1: 0.4352
 epoch: 56, train_loss: 1.0703, test_loss: 1.0266, test_f1: 0.4385
 epoch: 57, train_loss: 1.0702, test_loss: 1.0339, test_f1: 0.4659
 epoch: 58, train_loss: 1.0731, test_loss: 1.0289, test_f1: 0.4447
 epoch: 59, train_loss: 1.0641, test_loss: 1.0253, test_f1: 0.4371
 epoch: 60, train_loss: 1.0696, test_loss: 1.0353, test_f1: 0.4419
 epoch: 61, train_loss: 1.0636, test_loss: 1.0383, test_f1: 0.4524
 epoch: 62, train_loss: 1.0626, test_loss: 1.0272, test_f1: 0.4501
 epoch: 63, train_loss: 1.0609, test_loss: 1.0255, test_f1: 0.4328
 epoch: 64, train_loss: 1.0607, test_loss: 1.0264, test_f1: 0.4610
 epoch: 65, train_loss: 1.0565, test_loss: 1.0172, test_f1: 0.4559
 epoch: 66, train_loss: 1.0528, test_loss: 1.0187, test_f1: 0.4578
 epoch: 67, train_loss: 1.0564, test_loss: 1.0224, test_f1: 0.4484
 epoch: 68, train_loss: 1.0532, test_loss: 1.0319, test_f1: 0.4464
 epoch: 69, train_loss: 1.0466, test_loss: 1.0302, test_f1: 0.4610
 epoch: 70, train_loss: 1.0485, test_loss: 1.0163, test_f1: 0.4522
 epoch: 71, train_loss: 1.0416, test_loss: 1.0137, test_f1: 0.4507
 epoch: 72, train_loss: 1.0449, test_loss: 1.0239, test_f1: 0.4578
 epoch: 73, train_loss: 1.0473, test_loss: 1.0216, test_f1: 0.4619
 epoch: 74, train_loss: 1.0396, test_loss: 1.0114, test_f1: 0.4697
 epoch: 75, train_loss: 1.0486, test_loss: 1.0030, test_f1: 0.4560
 epoch: 76, train_loss: 1.0564, test_loss: 1.0111, test_f1: 0.4494
 epoch: 77, train_loss: 1.0433, test_loss: 1.0173, test_f1: 0.4552
 epoch: 78, train_loss: 1.0341, test_loss: 1.0013, test_f1: 0.4431
 epoch: 79, train_loss: 1.0445, test_loss: 1.0078, test_f1: 0.4672
 epoch: 80, train_loss: 1.0387, test_loss: 1.0108, test_f1: 0.4699
 epoch: 81, train_loss: 1.0403, test_loss: 1.0068, test_f1: 0.4764
 epoch: 82, train_loss: 1.0415, test_loss: 0.9974, test_f1: 0.4597
 epoch: 83, train_loss: 1.0281, test_loss: 1.0021, test_f1: 0.4730
 epoch: 84, train_loss: 1.0302, test_loss: 0.9917, test_f1: 0.4667
 epoch: 85, train_loss: 1.0411, test_loss: 1.0015, test_f1: 0.4571
 epoch: 86, train_loss: 1.0348, test_loss: 1.0218, test_f1: 0.4487
 epoch: 87, train_loss: 1.0268, test_loss: 1.0026, test_f1: 0.4610
 epoch: 88, train_loss: 1.0351, test_loss: 0.9985, test_f1: 0.4537
 epoch: 89, train_loss: 1.0310, test_loss: 1.0129, test_f1: 0.4599
 epoch: 90, train_loss: 1.0226, test_loss: 1.0015, test_f1: 0.4640
 epoch: 91, train_loss: 1.0309, test_loss: 1.0348, test_f1: 0.4643
 epoch: 92, train_loss: 1.0216, test_loss: 1.0300, test_f1: 0.4665
 epoch: 93, train_loss: 1.0295, test_loss: 1.0075, test_f1: 0.4595
 epoch: 94, train_loss: 1.0233, test_loss: 1.0661, test_f1: 0.4528
 epoch: 95, train_loss: 1.0234, test_loss: 1.0232, test_f1: 0.4496
 epoch: 96, train_loss: 1.0339, test_loss: 1.0395, test_f1: 0.4583
 epoch: 97, train_loss: 1.0216, test_loss: 1.0239, test_f1: 0.4591
 epoch: 98, train_loss: 1.0276, test_loss: 0.9923, test_f1: 0.4410
 epoch: 99, train_loss: 1.0089, test_loss: 1.0183, test_f1: 0.4515
##################ITERATION #8 ****************************************
 epoch: 0, train_loss: 1.3250, test_loss: 1.3254, test_f1: 0.2775
 epoch: 1, train_loss: 1.2675, test_loss: 1.2596, test_f1: 0.2892
 epoch: 2, train_loss: 1.2613, test_loss: 1.2632, test_f1: 0.3081
 epoch: 3, train_loss: 1.2530, test_loss: 1.2278, test_f1: 0.3440
 epoch: 4, train_loss: 1.2439, test_loss: 1.2189, test_f1: 0.3453
 epoch: 5, train_loss: 1.2475, test_loss: 1.2143, test_f1: 0.3423
 epoch: 6, train_loss: 1.2374, test_loss: 1.2058, test_f1: 0.3530
 epoch: 7, train_loss: 1.2371, test_loss: 1.1953, test_f1: 0.3590
 epoch: 8, train_loss: 1.2256, test_loss: 1.1940, test_f1: 0.3889
 epoch: 9, train_loss: 1.2233, test_loss: 1.1896, test_f1: 0.3919
 epoch: 10, train_loss: 1.2215, test_loss: 1.1902, test_f1: 0.4032
 epoch: 11, train_loss: 1.2034, test_loss: 1.1859, test_f1: 0.3787
 epoch: 12, train_loss: 1.2113, test_loss: 1.1814, test_f1: 0.3860
 epoch: 13, train_loss: 1.2088, test_loss: 1.1782, test_f1: 0.4064
 epoch: 14, train_loss: 1.2005, test_loss: 1.1701, test_f1: 0.4190
 epoch: 15, train_loss: 1.1923, test_loss: 1.1711, test_f1: 0.4032
 epoch: 16, train_loss: 1.1922, test_loss: 1.1608, test_f1: 0.4390
 epoch: 17, train_loss: 1.1829, test_loss: 1.1571, test_f1: 0.4210
 epoch: 18, train_loss: 1.1869, test_loss: 1.1491, test_f1: 0.3976
 epoch: 19, train_loss: 1.1804, test_loss: 1.1629, test_f1: 0.3963
 epoch: 20, train_loss: 1.1685, test_loss: 1.1501, test_f1: 0.4310
 epoch: 21, train_loss: 1.1722, test_loss: 1.1469, test_f1: 0.4436
 epoch: 22, train_loss: 1.1663, test_loss: 1.1397, test_f1: 0.4494
 epoch: 23, train_loss: 1.1725, test_loss: 1.1367, test_f1: 0.4578
 epoch: 24, train_loss: 1.1775, test_loss: 1.1461, test_f1: 0.4437
 epoch: 25, train_loss: 1.1644, test_loss: 1.1246, test_f1: 0.4601
 epoch: 26, train_loss: 1.1637, test_loss: 1.1334, test_f1: 0.4349
 epoch: 27, train_loss: 1.1504, test_loss: 1.1484, test_f1: 0.4463
 epoch: 28, train_loss: 1.1454, test_loss: 1.1313, test_f1: 0.4551
 epoch: 29, train_loss: 1.1474, test_loss: 1.1270, test_f1: 0.4560
 epoch: 30, train_loss: 1.1488, test_loss: 1.1171, test_f1: 0.4578
 epoch: 31, train_loss: 1.1465, test_loss: 1.1116, test_f1: 0.4350
 epoch: 32, train_loss: 1.1436, test_loss: 1.1148, test_f1: 0.4505
 epoch: 33, train_loss: 1.1326, test_loss: 1.1134, test_f1: 0.4287
 epoch: 34, train_loss: 1.1456, test_loss: 1.1052, test_f1: 0.4410
 epoch: 35, train_loss: 1.1315, test_loss: 1.0988, test_f1: 0.4613
 epoch: 36, train_loss: 1.1323, test_loss: 1.0930, test_f1: 0.4469
 epoch: 37, train_loss: 1.1189, test_loss: 1.1042, test_f1: 0.4449
 epoch: 38, train_loss: 1.1240, test_loss: 1.0937, test_f1: 0.4460
 epoch: 39, train_loss: 1.1153, test_loss: 1.0894, test_f1: 0.4393
 epoch: 40, train_loss: 1.1197, test_loss: 1.0908, test_f1: 0.4579
 epoch: 41, train_loss: 1.1273, test_loss: 1.0903, test_f1: 0.4355
 epoch: 42, train_loss: 1.1244, test_loss: 1.0849, test_f1: 0.4472
 epoch: 43, train_loss: 1.1018, test_loss: 1.0708, test_f1: 0.4715
 epoch: 44, train_loss: 1.1021, test_loss: 1.0813, test_f1: 0.4603
 epoch: 45, train_loss: 1.0997, test_loss: 1.0709, test_f1: 0.4668
 epoch: 46, train_loss: 1.1022, test_loss: 1.0765, test_f1: 0.4606
 epoch: 47, train_loss: 1.0818, test_loss: 1.0806, test_f1: 0.4581
 epoch: 48, train_loss: 1.0944, test_loss: 1.0588, test_f1: 0.4501
 epoch: 49, train_loss: 1.0907, test_loss: 1.0663, test_f1: 0.4588
 epoch: 50, train_loss: 1.0932, test_loss: 1.0793, test_f1: 0.4564
 epoch: 51, train_loss: 1.0905, test_loss: 1.0571, test_f1: 0.4449
 epoch: 52, train_loss: 1.0828, test_loss: 1.0524, test_f1: 0.4342
 epoch: 53, train_loss: 1.0855, test_loss: 1.0470, test_f1: 0.4578
 epoch: 54, train_loss: 1.0784, test_loss: 1.0430, test_f1: 0.4521
 epoch: 55, train_loss: 1.0737, test_loss: 1.0428, test_f1: 0.4480
 epoch: 56, train_loss: 1.0696, test_loss: 1.0533, test_f1: 0.4528
 epoch: 57, train_loss: 1.0727, test_loss: 1.0448, test_f1: 0.4307
 epoch: 58, train_loss: 1.0700, test_loss: 1.0385, test_f1: 0.4367
 epoch: 59, train_loss: 1.0696, test_loss: 1.0413, test_f1: 0.4446
 epoch: 60, train_loss: 1.0703, test_loss: 1.0341, test_f1: 0.4508
 epoch: 61, train_loss: 1.0695, test_loss: 1.0369, test_f1: 0.4331
 epoch: 62, train_loss: 1.0676, test_loss: 1.0408, test_f1: 0.4535
 epoch: 63, train_loss: 1.0707, test_loss: 1.0424, test_f1: 0.4710
 epoch: 64, train_loss: 1.0584, test_loss: 1.0347, test_f1: 0.4349
 epoch: 65, train_loss: 1.0530, test_loss: 1.0464, test_f1: 0.4652
 epoch: 66, train_loss: 1.0687, test_loss: 1.0457, test_f1: 0.4400
 epoch: 67, train_loss: 1.0587, test_loss: 1.0496, test_f1: 0.4543
 epoch: 68, train_loss: 1.0639, test_loss: 1.0322, test_f1: 0.4474
 epoch: 69, train_loss: 1.0479, test_loss: 1.0374, test_f1: 0.4457
 epoch: 70, train_loss: 1.0513, test_loss: 1.0581, test_f1: 0.4583
 epoch: 71, train_loss: 1.0602, test_loss: 1.0433, test_f1: 0.4420
 epoch: 72, train_loss: 1.0500, test_loss: 1.0390, test_f1: 0.4444
 epoch: 73, train_loss: 1.0513, test_loss: 1.0293, test_f1: 0.4779
 epoch: 74, train_loss: 1.0535, test_loss: 1.0269, test_f1: 0.4622
 epoch: 75, train_loss: 1.0583, test_loss: 1.0377, test_f1: 0.4405
 epoch: 76, train_loss: 1.0509, test_loss: 1.0592, test_f1: 0.4421
 epoch: 77, train_loss: 1.0395, test_loss: 1.0466, test_f1: 0.4427
 epoch: 78, train_loss: 1.0478, test_loss: 1.0316, test_f1: 0.4415
 epoch: 79, train_loss: 1.0395, test_loss: 1.0293, test_f1: 0.4489
 epoch: 80, train_loss: 1.0549, test_loss: 1.0188, test_f1: 0.4644
 epoch: 81, train_loss: 1.0505, test_loss: 1.0270, test_f1: 0.4627
 epoch: 82, train_loss: 1.0457, test_loss: 1.0451, test_f1: 0.4630
 epoch: 83, train_loss: 1.0349, test_loss: 1.0542, test_f1: 0.4799
 epoch: 84, train_loss: 1.0508, test_loss: 1.0405, test_f1: 0.4691
 epoch: 85, train_loss: 1.0337, test_loss: 1.0459, test_f1: 0.4542
 epoch: 86, train_loss: 1.0407, test_loss: 1.0363, test_f1: 0.4375
 epoch: 87, train_loss: 1.0329, test_loss: 1.0550, test_f1: 0.4443
 epoch: 88, train_loss: 1.0298, test_loss: 1.0209, test_f1: 0.4561
 epoch: 89, train_loss: 1.0385, test_loss: 1.0283, test_f1: 0.4487
 epoch: 90, train_loss: 1.0326, test_loss: 1.0170, test_f1: 0.4646
 epoch: 91, train_loss: 1.0372, test_loss: 1.0425, test_f1: 0.4655
 epoch: 92, train_loss: 1.0317, test_loss: 1.0156, test_f1: 0.4516
 epoch: 93, train_loss: 1.0265, test_loss: 1.0357, test_f1: 0.4453
 epoch: 94, train_loss: 1.0190, test_loss: 1.0289, test_f1: 0.4565
 epoch: 95, train_loss: 1.0303, test_loss: 1.0486, test_f1: 0.4643
 epoch: 96, train_loss: 1.0228, test_loss: 1.0081, test_f1: 0.4741
 epoch: 97, train_loss: 1.0154, test_loss: 1.0299, test_f1: 0.4660
 epoch: 98, train_loss: 1.0250, test_loss: 1.0370, test_f1: 0.4516
 epoch: 99, train_loss: 1.0237, test_loss: 1.0331, test_f1: 0.4679
##################ITERATION #9 ****************************************
 epoch: 0, train_loss: 1.3123, test_loss: 1.2781, test_f1: 0.2240
 epoch: 1, train_loss: 1.2836, test_loss: 1.2647, test_f1: 0.2345
 epoch: 2, train_loss: 1.2683, test_loss: 1.2603, test_f1: 0.2561
 epoch: 3, train_loss: 1.2626, test_loss: 1.2485, test_f1: 0.2651
 epoch: 4, train_loss: 1.2535, test_loss: 1.2478, test_f1: 0.2820
 epoch: 5, train_loss: 1.2524, test_loss: 1.2391, test_f1: 0.2944
 epoch: 6, train_loss: 1.2493, test_loss: 1.2360, test_f1: 0.2909
 epoch: 7, train_loss: 1.2347, test_loss: 1.2299, test_f1: 0.3117
 epoch: 8, train_loss: 1.2368, test_loss: 1.2227, test_f1: 0.3288
 epoch: 9, train_loss: 1.2291, test_loss: 1.2179, test_f1: 0.3343
 epoch: 10, train_loss: 1.2286, test_loss: 1.2115, test_f1: 0.3516
 epoch: 11, train_loss: 1.2221, test_loss: 1.2123, test_f1: 0.3548
 epoch: 12, train_loss: 1.2237, test_loss: 1.2084, test_f1: 0.3455
 epoch: 13, train_loss: 1.2160, test_loss: 1.1943, test_f1: 0.3890
 epoch: 14, train_loss: 1.2179, test_loss: 1.1970, test_f1: 0.3635
 epoch: 15, train_loss: 1.2096, test_loss: 1.1902, test_f1: 0.3812
 epoch: 16, train_loss: 1.2072, test_loss: 1.1879, test_f1: 0.3806
 epoch: 17, train_loss: 1.1986, test_loss: 1.1834, test_f1: 0.3984
 epoch: 18, train_loss: 1.1967, test_loss: 1.1724, test_f1: 0.4028
 epoch: 19, train_loss: 1.1947, test_loss: 1.1700, test_f1: 0.4141
 epoch: 20, train_loss: 1.1955, test_loss: 1.1505, test_f1: 0.4097
 epoch: 21, train_loss: 1.1814, test_loss: 1.1515, test_f1: 0.4045
 epoch: 22, train_loss: 1.1851, test_loss: 1.1458, test_f1: 0.4095
 epoch: 23, train_loss: 1.1786, test_loss: 1.1508, test_f1: 0.4088
 epoch: 24, train_loss: 1.1775, test_loss: 1.1386, test_f1: 0.4095
 epoch: 25, train_loss: 1.1790, test_loss: 1.1320, test_f1: 0.4027
 epoch: 26, train_loss: 1.1684, test_loss: 1.1338, test_f1: 0.4062
 epoch: 27, train_loss: 1.1683, test_loss: 1.1372, test_f1: 0.4105
 epoch: 28, train_loss: 1.1601, test_loss: 1.1281, test_f1: 0.3949
 epoch: 29, train_loss: 1.1528, test_loss: 1.1258, test_f1: 0.4124
 epoch: 30, train_loss: 1.1565, test_loss: 1.1181, test_f1: 0.4054
 epoch: 31, train_loss: 1.1578, test_loss: 1.1211, test_f1: 0.4134
 epoch: 32, train_loss: 1.1449, test_loss: 1.1177, test_f1: 0.4032
 epoch: 33, train_loss: 1.1454, test_loss: 1.1143, test_f1: 0.4018
 epoch: 34, train_loss: 1.1432, test_loss: 1.1205, test_f1: 0.4104
 epoch: 35, train_loss: 1.1272, test_loss: 1.1048, test_f1: 0.4147
 epoch: 36, train_loss: 1.1354, test_loss: 1.0924, test_f1: 0.4150
 epoch: 37, train_loss: 1.1194, test_loss: 1.0878, test_f1: 0.4192
 epoch: 38, train_loss: 1.1329, test_loss: 1.0957, test_f1: 0.4031
 epoch: 39, train_loss: 1.1313, test_loss: 1.0974, test_f1: 0.4104
 epoch: 40, train_loss: 1.1283, test_loss: 1.0932, test_f1: 0.4250
 epoch: 41, train_loss: 1.1191, test_loss: 1.0807, test_f1: 0.4242
 epoch: 42, train_loss: 1.1131, test_loss: 1.0853, test_f1: 0.4276
 epoch: 43, train_loss: 1.1170, test_loss: 1.0851, test_f1: 0.4180
 epoch: 44, train_loss: 1.1079, test_loss: 1.0835, test_f1: 0.4157
 epoch: 45, train_loss: 1.1125, test_loss: 1.0775, test_f1: 0.4292
 epoch: 46, train_loss: 1.1034, test_loss: 1.0662, test_f1: 0.4324
 epoch: 47, train_loss: 1.1009, test_loss: 1.0646, test_f1: 0.4364
 epoch: 48, train_loss: 1.0978, test_loss: 1.0709, test_f1: 0.4192
 epoch: 49, train_loss: 1.1051, test_loss: 1.0586, test_f1: 0.4287
 epoch: 50, train_loss: 1.0923, test_loss: 1.0547, test_f1: 0.4307
 epoch: 51, train_loss: 1.0865, test_loss: 1.0497, test_f1: 0.4382
 epoch: 52, train_loss: 1.0817, test_loss: 1.0593, test_f1: 0.4214
 epoch: 53, train_loss: 1.0876, test_loss: 1.0526, test_f1: 0.4262
 epoch: 54, train_loss: 1.0911, test_loss: 1.0550, test_f1: 0.4366
 epoch: 55, train_loss: 1.0889, test_loss: 1.0523, test_f1: 0.4286
 epoch: 56, train_loss: 1.0794, test_loss: 1.0430, test_f1: 0.4406
 epoch: 57, train_loss: 1.0774, test_loss: 1.0380, test_f1: 0.4343
 epoch: 58, train_loss: 1.0888, test_loss: 1.0531, test_f1: 0.4280
 epoch: 59, train_loss: 1.0812, test_loss: 1.0602, test_f1: 0.4326
 epoch: 60, train_loss: 1.0691, test_loss: 1.0424, test_f1: 0.4450
 epoch: 61, train_loss: 1.0652, test_loss: 1.0433, test_f1: 0.4386
 epoch: 62, train_loss: 1.0715, test_loss: 1.0355, test_f1: 0.4416
 epoch: 63, train_loss: 1.0707, test_loss: 1.0352, test_f1: 0.4465
 epoch: 64, train_loss: 1.0758, test_loss: 1.0449, test_f1: 0.4338
 epoch: 65, train_loss: 1.0677, test_loss: 1.0385, test_f1: 0.4306
 epoch: 66, train_loss: 1.0582, test_loss: 1.0423, test_f1: 0.4381
 epoch: 67, train_loss: 1.0657, test_loss: 1.0303, test_f1: 0.4352
 epoch: 68, train_loss: 1.0677, test_loss: 1.0465, test_f1: 0.4553
 epoch: 69, train_loss: 1.0565, test_loss: 1.0420, test_f1: 0.4331
 epoch: 70, train_loss: 1.0662, test_loss: 1.0335, test_f1: 0.4378
 epoch: 71, train_loss: 1.0690, test_loss: 1.0558, test_f1: 0.4308
 epoch: 72, train_loss: 1.0564, test_loss: 1.0330, test_f1: 0.4513
 epoch: 73, train_loss: 1.0579, test_loss: 1.0430, test_f1: 0.4289
 epoch: 74, train_loss: 1.0542, test_loss: 1.0478, test_f1: 0.4480
 epoch: 75, train_loss: 1.0539, test_loss: 1.0351, test_f1: 0.4344
 epoch: 76, train_loss: 1.0559, test_loss: 1.0413, test_f1: 0.4278
 epoch: 77, train_loss: 1.0490, test_loss: 1.0316, test_f1: 0.4354
 epoch: 78, train_loss: 1.0466, test_loss: 1.0295, test_f1: 0.4410
 epoch: 79, train_loss: 1.0533, test_loss: 1.0332, test_f1: 0.4584
 epoch: 80, train_loss: 1.0486, test_loss: 1.0429, test_f1: 0.4682
 epoch: 81, train_loss: 1.0581, test_loss: 1.0285, test_f1: 0.4313
 epoch: 82, train_loss: 1.0415, test_loss: 1.0278, test_f1: 0.4350
 epoch: 83, train_loss: 1.0564, test_loss: 1.0329, test_f1: 0.4635
 epoch: 84, train_loss: 1.0449, test_loss: 1.0095, test_f1: 0.4554
 epoch: 85, train_loss: 1.0391, test_loss: 1.0229, test_f1: 0.4438
 epoch: 86, train_loss: 1.0482, test_loss: 1.0342, test_f1: 0.4664
 epoch: 87, train_loss: 1.0407, test_loss: 1.0194, test_f1: 0.4455
 epoch: 88, train_loss: 1.0423, test_loss: 1.0249, test_f1: 0.4419
 epoch: 89, train_loss: 1.0453, test_loss: 1.0274, test_f1: 0.4438
 epoch: 90, train_loss: 1.0436, test_loss: 1.0383, test_f1: 0.4189
 epoch: 91, train_loss: 1.0351, test_loss: 1.0305, test_f1: 0.4551
 epoch: 92, train_loss: 1.0372, test_loss: 1.0101, test_f1: 0.4442
 epoch: 93, train_loss: 1.0424, test_loss: 1.0076, test_f1: 0.4512
 epoch: 94, train_loss: 1.0367, test_loss: 1.0225, test_f1: 0.4619
 epoch: 95, train_loss: 1.0415, test_loss: 1.0263, test_f1: 0.4391
 epoch: 96, train_loss: 1.0362, test_loss: 1.0120, test_f1: 0.4462
 epoch: 97, train_loss: 1.0368, test_loss: 1.0082, test_f1: 0.4490
 epoch: 98, train_loss: 1.0313, test_loss: 0.9993, test_f1: 0.4487
 epoch: 99, train_loss: 1.0249, test_loss: 1.0247, test_f1: 0.4475

Training completed in 1169.86 seconds
Best F1: 0.5229 at epoch 75
Mean F1 across iterations: 0.4871  0.0190
========================FINAL RESULTS================================
FEGIN weighted F1: 0.5229  0.0190
python main.py --data ltspice_examples --representation component_component --model FEGIN --layers 5 --hiddens 32 --batch_size 32 --lr 0.0001 --emb_size 512 --epochs 100 --save_appendix component_component_L5_H32_BS32_LR0.0001_E512 --no_val
-----



STDERR:
  File "main.py", line 370, in <module>
    main()
  File "main.py", line 254, in main
    dataset = dataset_class(
  File "/home/philip/projects/llm_inference_code_repo/Circuit-Completion-Using-GNNs/component_classification_with_link_prediction_head/evaluation/FEGIN/kernel/circuit_datasets.py", line 15, in __init__
    self.data, self.slices = torch.load(self.processed_paths[0])
  File "/home/philip/.local/lib/python3.8/site-packages/torch/serialization.py", line 1040, in load
    warnings.warn(
  File "/usr/lib/python3.8/warnings.py", line 109, in _showwarnmsg
    sw(msg.message, msg.category, msg.filename, msg.lineno,
  File "main.py", line 47, in warn_with_traceback
    traceback.print_stack(file=log)
/home/philip/projects/llm_inference_code_repo/Circuit-Completion-Using-GNNs/component_classification_with_link_prediction_head/evaluation/FEGIN/kernel/circuit_datasets.py:15: FutureWarning: You are using `torch.load` with `weights_only=False` (the current default value), which uses the default pickle module implicitly. It is possible to construct malicious pickle data which will execute arbitrary code during unpickling (See https://github.com/pytorch/pytorch/blob/main/SECURITY.md#untrusted-models for more details). In a future release, the default value for `weights_only` will be flipped to `True`. This limits the functions that could be executed during unpickling. Arbitrary objects will no longer be allowed to be loaded via this mode unless they are explicitly allowlisted by the user via `torch.serialization.add_safe_globals`. We recommend you start setting `weights_only=True` for any use case where you don't have full control of the loaded file. Please open an issue on GitHub for any issues related to this experimental feature.
  self.data, self.slices = torch.load(self.processed_paths[0])
