STDOUT:
Results will be saved in /home/philip/projects/ltspice_examples_code_repo/Circuit-Completion-Using-GNNs/component_classification_with_link_prediction_head/evaluation/FEGIN/results/model_FEGIN_dataset_ltspice_examples
Command line input: python main.py --data ltspice_examples --representation component_component --model FEGIN --layers 5 --hiddens 32 --batch_size 128 --lr 0.0001 --emb_size 512 --epochs 100 --save_appendix component_component_L5_H32_BS128_LR0.0001_E512 --no_val
 is saved.
-----
ltspice_examples - FEGIN
Using 5 layers, 32 hidden units, h = 2
Loading component_component representation dataset
ENTERED
Training FEGIN on component_component representation
Train: 3556, Test: 845
##################ITERATION #0 ****************************************
 epoch: 0, train_loss: 1.3589, test_loss: 1.3622, test_f1: 0.2274
 epoch: 1, train_loss: 1.3520, test_loss: 1.3572, test_f1: 0.2274
 epoch: 2, train_loss: 1.3468, test_loss: 1.3512, test_f1: 0.2274
 epoch: 3, train_loss: 1.3426, test_loss: 1.3465, test_f1: 0.2274
 epoch: 4, train_loss: 1.3388, test_loss: 1.3424, test_f1: 0.2274
 epoch: 5, train_loss: 1.3324, test_loss: 1.3374, test_f1: 0.2274
 epoch: 6, train_loss: 1.3275, test_loss: 1.3323, test_f1: 0.2274
 epoch: 7, train_loss: 1.3214, test_loss: 1.3271, test_f1: 0.2274
 epoch: 8, train_loss: 1.3159, test_loss: 1.3204, test_f1: 0.2274
 epoch: 9, train_loss: 1.3087, test_loss: 1.3167, test_f1: 0.2274
 epoch: 10, train_loss: 1.3035, test_loss: 1.3104, test_f1: 0.2274
 epoch: 11, train_loss: 1.2960, test_loss: 1.3040, test_f1: 0.2274
 epoch: 12, train_loss: 1.2906, test_loss: 1.2980, test_f1: 0.2274
 epoch: 13, train_loss: 1.2861, test_loss: 1.2908, test_f1: 0.2274
 epoch: 14, train_loss: 1.2778, test_loss: 1.2844, test_f1: 0.2274
 epoch: 15, train_loss: 1.2731, test_loss: 1.2784, test_f1: 0.2274
 epoch: 16, train_loss: 1.2681, test_loss: 1.2723, test_f1: 0.2274
 epoch: 17, train_loss: 1.2630, test_loss: 1.2663, test_f1: 0.2274
 epoch: 18, train_loss: 1.2621, test_loss: 1.2598, test_f1: 0.2274
 epoch: 19, train_loss: 1.2542, test_loss: 1.2543, test_f1: 0.2274
 epoch: 20, train_loss: 1.2508, test_loss: 1.2497, test_f1: 0.2274
 epoch: 21, train_loss: 1.2466, test_loss: 1.2445, test_f1: 0.2274
 epoch: 22, train_loss: 1.2403, test_loss: 1.2388, test_f1: 0.2274
 epoch: 23, train_loss: 1.2335, test_loss: 1.2333, test_f1: 0.2274
 epoch: 24, train_loss: 1.2342, test_loss: 1.2287, test_f1: 0.2274
 epoch: 25, train_loss: 1.2295, test_loss: 1.2232, test_f1: 0.2274
 epoch: 26, train_loss: 1.2229, test_loss: 1.2156, test_f1: 0.2285
 epoch: 27, train_loss: 1.2226, test_loss: 1.2122, test_f1: 0.2741
 epoch: 28, train_loss: 1.2181, test_loss: 1.2064, test_f1: 0.2862
 epoch: 29, train_loss: 1.2129, test_loss: 1.2047, test_f1: 0.3196
 epoch: 30, train_loss: 1.2090, test_loss: 1.1992, test_f1: 0.3172
 epoch: 31, train_loss: 1.2079, test_loss: 1.1950, test_f1: 0.3169
 epoch: 32, train_loss: 1.2042, test_loss: 1.1923, test_f1: 0.3208
 epoch: 33, train_loss: 1.2057, test_loss: 1.1916, test_f1: 0.3300
 epoch: 34, train_loss: 1.2026, test_loss: 1.1859, test_f1: 0.3295
 epoch: 35, train_loss: 1.1957, test_loss: 1.1815, test_f1: 0.3395
 epoch: 36, train_loss: 1.1888, test_loss: 1.1804, test_f1: 0.3322
 epoch: 37, train_loss: 1.1885, test_loss: 1.1782, test_f1: 0.3362
 epoch: 38, train_loss: 1.1856, test_loss: 1.1769, test_f1: 0.3436
 epoch: 39, train_loss: 1.1820, test_loss: 1.1750, test_f1: 0.3404
 epoch: 40, train_loss: 1.1763, test_loss: 1.1719, test_f1: 0.3413
 epoch: 41, train_loss: 1.1788, test_loss: 1.1665, test_f1: 0.3439
 epoch: 42, train_loss: 1.1714, test_loss: 1.1664, test_f1: 0.3530
 epoch: 43, train_loss: 1.1715, test_loss: 1.1627, test_f1: 0.3470
 epoch: 44, train_loss: 1.1622, test_loss: 1.1579, test_f1: 0.3467
 epoch: 45, train_loss: 1.1611, test_loss: 1.1554, test_f1: 0.3598
 epoch: 46, train_loss: 1.1606, test_loss: 1.1519, test_f1: 0.3588
 epoch: 47, train_loss: 1.1574, test_loss: 1.1453, test_f1: 0.3599
 epoch: 48, train_loss: 1.1418, test_loss: 1.1466, test_f1: 0.3579
 epoch: 49, train_loss: 1.1469, test_loss: 1.1415, test_f1: 0.3561
 epoch: 50, train_loss: 1.1303, test_loss: 1.1365, test_f1: 0.3619
 epoch: 51, train_loss: 1.1327, test_loss: 1.1352, test_f1: 0.3640
 epoch: 52, train_loss: 1.1305, test_loss: 1.1357, test_f1: 0.3630
 epoch: 53, train_loss: 1.1260, test_loss: 1.1348, test_f1: 0.3594
 epoch: 54, train_loss: 1.1283, test_loss: 1.1322, test_f1: 0.3603
 epoch: 55, train_loss: 1.1276, test_loss: 1.1306, test_f1: 0.3689
 epoch: 56, train_loss: 1.1246, test_loss: 1.1288, test_f1: 0.3670
 epoch: 57, train_loss: 1.1257, test_loss: 1.1292, test_f1: 0.3779
 epoch: 58, train_loss: 1.1200, test_loss: 1.1262, test_f1: 0.3650
 epoch: 59, train_loss: 1.1172, test_loss: 1.1243, test_f1: 0.3660
 epoch: 60, train_loss: 1.1183, test_loss: 1.1251, test_f1: 0.3624
 epoch: 61, train_loss: 1.1179, test_loss: 1.1233, test_f1: 0.3679
 epoch: 62, train_loss: 1.1146, test_loss: 1.1223, test_f1: 0.3678
 epoch: 63, train_loss: 1.1133, test_loss: 1.1205, test_f1: 0.3834
 epoch: 64, train_loss: 1.1074, test_loss: 1.1214, test_f1: 0.3931
 epoch: 65, train_loss: 1.1072, test_loss: 1.1220, test_f1: 0.4024
 epoch: 66, train_loss: 1.1029, test_loss: 1.1189, test_f1: 0.3998
 epoch: 67, train_loss: 1.1041, test_loss: 1.1151, test_f1: 0.4034
 epoch: 68, train_loss: 1.0945, test_loss: 1.1132, test_f1: 0.4061
 epoch: 69, train_loss: 1.1026, test_loss: 1.1159, test_f1: 0.4215
 epoch: 70, train_loss: 1.1026, test_loss: 1.1170, test_f1: 0.4252
 epoch: 71, train_loss: 1.0977, test_loss: 1.1109, test_f1: 0.4223
 epoch: 72, train_loss: 1.0922, test_loss: 1.1127, test_f1: 0.4307
 epoch: 73, train_loss: 1.0875, test_loss: 1.1171, test_f1: 0.4323
 epoch: 74, train_loss: 1.0921, test_loss: 1.1083, test_f1: 0.4330
 epoch: 75, train_loss: 1.0841, test_loss: 1.1084, test_f1: 0.4351
 epoch: 76, train_loss: 1.0948, test_loss: 1.1070, test_f1: 0.4396
 epoch: 77, train_loss: 1.0859, test_loss: 1.1084, test_f1: 0.4408
 epoch: 78, train_loss: 1.0906, test_loss: 1.1017, test_f1: 0.4421
 epoch: 79, train_loss: 1.0801, test_loss: 1.1049, test_f1: 0.4482
 epoch: 80, train_loss: 1.0838, test_loss: 1.1053, test_f1: 0.4532
 epoch: 81, train_loss: 1.0822, test_loss: 1.1019, test_f1: 0.4531
 epoch: 82, train_loss: 1.0733, test_loss: 1.1010, test_f1: 0.4489
 epoch: 83, train_loss: 1.0755, test_loss: 1.1072, test_f1: 0.4582
 epoch: 84, train_loss: 1.0706, test_loss: 1.1012, test_f1: 0.4508
 epoch: 85, train_loss: 1.0638, test_loss: 1.0980, test_f1: 0.4473
 epoch: 86, train_loss: 1.0737, test_loss: 1.0994, test_f1: 0.4484
 epoch: 87, train_loss: 1.0669, test_loss: 1.0930, test_f1: 0.4538
 epoch: 88, train_loss: 1.0761, test_loss: 1.0991, test_f1: 0.4546
 epoch: 89, train_loss: 1.0666, test_loss: 1.0950, test_f1: 0.4512
 epoch: 90, train_loss: 1.0734, test_loss: 1.0989, test_f1: 0.4504
 epoch: 91, train_loss: 1.0671, test_loss: 1.0941, test_f1: 0.4560
 epoch: 92, train_loss: 1.0676, test_loss: 1.0947, test_f1: 0.4579
 epoch: 93, train_loss: 1.0669, test_loss: 1.0951, test_f1: 0.4540
 epoch: 94, train_loss: 1.0602, test_loss: 1.0958, test_f1: 0.4562
 epoch: 95, train_loss: 1.0677, test_loss: 1.0966, test_f1: 0.4511
 epoch: 96, train_loss: 1.0545, test_loss: 1.0957, test_f1: 0.4597
 epoch: 97, train_loss: 1.0586, test_loss: 1.0927, test_f1: 0.4522
 epoch: 98, train_loss: 1.0551, test_loss: 1.0917, test_f1: 0.4547
 epoch: 99, train_loss: 1.0527, test_loss: 1.0911, test_f1: 0.4595
##################ITERATION #1 ****************************************
 epoch: 0, train_loss: 1.3354, test_loss: 1.3422, test_f1: 0.2274
 epoch: 1, train_loss: 1.3265, test_loss: 1.3329, test_f1: 0.2274
 epoch: 2, train_loss: 1.3209, test_loss: 1.3216, test_f1: 0.2274
 epoch: 3, train_loss: 1.3128, test_loss: 1.3132, test_f1: 0.2274
 epoch: 4, train_loss: 1.3074, test_loss: 1.3059, test_f1: 0.2274
 epoch: 5, train_loss: 1.2998, test_loss: 1.2993, test_f1: 0.2274
 epoch: 6, train_loss: 1.2932, test_loss: 1.2931, test_f1: 0.2274
 epoch: 7, train_loss: 1.2870, test_loss: 1.2868, test_f1: 0.2274
 epoch: 8, train_loss: 1.2836, test_loss: 1.2806, test_f1: 0.2274
 epoch: 9, train_loss: 1.2769, test_loss: 1.2749, test_f1: 0.2274
 epoch: 10, train_loss: 1.2726, test_loss: 1.2683, test_f1: 0.2274
 epoch: 11, train_loss: 1.2695, test_loss: 1.2615, test_f1: 0.2274
 epoch: 12, train_loss: 1.2629, test_loss: 1.2567, test_f1: 0.2274
 epoch: 13, train_loss: 1.2587, test_loss: 1.2507, test_f1: 0.2274
 epoch: 14, train_loss: 1.2527, test_loss: 1.2469, test_f1: 0.2274
 epoch: 15, train_loss: 1.2472, test_loss: 1.2422, test_f1: 0.2350
 epoch: 16, train_loss: 1.2447, test_loss: 1.2361, test_f1: 0.2496
 epoch: 17, train_loss: 1.2396, test_loss: 1.2298, test_f1: 0.2556
 epoch: 18, train_loss: 1.2374, test_loss: 1.2245, test_f1: 0.2804
 epoch: 19, train_loss: 1.2294, test_loss: 1.2181, test_f1: 0.2937
 epoch: 20, train_loss: 1.2308, test_loss: 1.2131, test_f1: 0.3015
 epoch: 21, train_loss: 1.2195, test_loss: 1.2073, test_f1: 0.3172
 epoch: 22, train_loss: 1.2120, test_loss: 1.2011, test_f1: 0.3267
 epoch: 23, train_loss: 1.2095, test_loss: 1.1957, test_f1: 0.3281
 epoch: 24, train_loss: 1.2081, test_loss: 1.1893, test_f1: 0.3304
 epoch: 25, train_loss: 1.2040, test_loss: 1.1850, test_f1: 0.3431
 epoch: 26, train_loss: 1.1989, test_loss: 1.1808, test_f1: 0.3483
 epoch: 27, train_loss: 1.1879, test_loss: 1.1734, test_f1: 0.3591
 epoch: 28, train_loss: 1.1869, test_loss: 1.1677, test_f1: 0.3630
 epoch: 29, train_loss: 1.1838, test_loss: 1.1642, test_f1: 0.3730
 epoch: 30, train_loss: 1.1750, test_loss: 1.1592, test_f1: 0.3833
 epoch: 31, train_loss: 1.1803, test_loss: 1.1575, test_f1: 0.3742
 epoch: 32, train_loss: 1.1668, test_loss: 1.1501, test_f1: 0.3892
 epoch: 33, train_loss: 1.1639, test_loss: 1.1435, test_f1: 0.3981
 epoch: 34, train_loss: 1.1608, test_loss: 1.1391, test_f1: 0.4103
 epoch: 35, train_loss: 1.1586, test_loss: 1.1351, test_f1: 0.4086
 epoch: 36, train_loss: 1.1511, test_loss: 1.1310, test_f1: 0.4193
 epoch: 37, train_loss: 1.1498, test_loss: 1.1290, test_f1: 0.4223
 epoch: 38, train_loss: 1.1478, test_loss: 1.1233, test_f1: 0.4193
 epoch: 39, train_loss: 1.1378, test_loss: 1.1180, test_f1: 0.4193
 epoch: 40, train_loss: 1.1429, test_loss: 1.1175, test_f1: 0.4104
 epoch: 41, train_loss: 1.1328, test_loss: 1.1112, test_f1: 0.4269
 epoch: 42, train_loss: 1.1301, test_loss: 1.1064, test_f1: 0.4243
 epoch: 43, train_loss: 1.1273, test_loss: 1.1038, test_f1: 0.4267
 epoch: 44, train_loss: 1.1255, test_loss: 1.1025, test_f1: 0.4349
 epoch: 45, train_loss: 1.1238, test_loss: 1.1001, test_f1: 0.4297
 epoch: 46, train_loss: 1.1156, test_loss: 1.0930, test_f1: 0.4415
 epoch: 47, train_loss: 1.1112, test_loss: 1.0920, test_f1: 0.4446
 epoch: 48, train_loss: 1.1155, test_loss: 1.0909, test_f1: 0.4405
 epoch: 49, train_loss: 1.1177, test_loss: 1.0847, test_f1: 0.4548
 epoch: 50, train_loss: 1.1065, test_loss: 1.0829, test_f1: 0.4539
 epoch: 51, train_loss: 1.0998, test_loss: 1.0806, test_f1: 0.4511
 epoch: 52, train_loss: 1.1012, test_loss: 1.0783, test_f1: 0.4491
 epoch: 53, train_loss: 1.1011, test_loss: 1.0763, test_f1: 0.4476
 epoch: 54, train_loss: 1.1000, test_loss: 1.0754, test_f1: 0.4484
 epoch: 55, train_loss: 1.0982, test_loss: 1.0722, test_f1: 0.4526
 epoch: 56, train_loss: 1.0982, test_loss: 1.0712, test_f1: 0.4539
 epoch: 57, train_loss: 1.0988, test_loss: 1.0721, test_f1: 0.4518
 epoch: 58, train_loss: 1.0914, test_loss: 1.0665, test_f1: 0.4519
 epoch: 59, train_loss: 1.0958, test_loss: 1.0666, test_f1: 0.4455
 epoch: 60, train_loss: 1.0950, test_loss: 1.0661, test_f1: 0.4532
 epoch: 61, train_loss: 1.0897, test_loss: 1.0668, test_f1: 0.4493
 epoch: 62, train_loss: 1.0864, test_loss: 1.0677, test_f1: 0.4499
 epoch: 63, train_loss: 1.0811, test_loss: 1.0643, test_f1: 0.4552
 epoch: 64, train_loss: 1.0814, test_loss: 1.0672, test_f1: 0.4545
 epoch: 65, train_loss: 1.0819, test_loss: 1.0620, test_f1: 0.4652
 epoch: 66, train_loss: 1.0800, test_loss: 1.0582, test_f1: 0.4595
 epoch: 67, train_loss: 1.0801, test_loss: 1.0543, test_f1: 0.4698
 epoch: 68, train_loss: 1.0766, test_loss: 1.0566, test_f1: 0.4601
 epoch: 69, train_loss: 1.0720, test_loss: 1.0571, test_f1: 0.4565
 epoch: 70, train_loss: 1.0743, test_loss: 1.0558, test_f1: 0.4540
 epoch: 71, train_loss: 1.0843, test_loss: 1.0568, test_f1: 0.4624
 epoch: 72, train_loss: 1.0733, test_loss: 1.0534, test_f1: 0.4641
 epoch: 73, train_loss: 1.0754, test_loss: 1.0517, test_f1: 0.4646
 epoch: 74, train_loss: 1.0692, test_loss: 1.0526, test_f1: 0.4580
 epoch: 75, train_loss: 1.0626, test_loss: 1.0511, test_f1: 0.4629
 epoch: 76, train_loss: 1.0641, test_loss: 1.0470, test_f1: 0.4612
 epoch: 77, train_loss: 1.0634, test_loss: 1.0471, test_f1: 0.4649
 epoch: 78, train_loss: 1.0642, test_loss: 1.0463, test_f1: 0.4660
 epoch: 79, train_loss: 1.0665, test_loss: 1.0453, test_f1: 0.4596
 epoch: 80, train_loss: 1.0653, test_loss: 1.0456, test_f1: 0.4682
 epoch: 81, train_loss: 1.0672, test_loss: 1.0422, test_f1: 0.4719
 epoch: 82, train_loss: 1.0647, test_loss: 1.0415, test_f1: 0.4677
 epoch: 83, train_loss: 1.0633, test_loss: 1.0422, test_f1: 0.4664
 epoch: 84, train_loss: 1.0529, test_loss: 1.0373, test_f1: 0.4602
 epoch: 85, train_loss: 1.0662, test_loss: 1.0425, test_f1: 0.4620
 epoch: 86, train_loss: 1.0601, test_loss: 1.0368, test_f1: 0.4628
 epoch: 87, train_loss: 1.0526, test_loss: 1.0341, test_f1: 0.4686
 epoch: 88, train_loss: 1.0476, test_loss: 1.0352, test_f1: 0.4760
 epoch: 89, train_loss: 1.0545, test_loss: 1.0352, test_f1: 0.4677
 epoch: 90, train_loss: 1.0508, test_loss: 1.0326, test_f1: 0.4644
 epoch: 91, train_loss: 1.0401, test_loss: 1.0334, test_f1: 0.4704
 epoch: 92, train_loss: 1.0447, test_loss: 1.0283, test_f1: 0.4727
 epoch: 93, train_loss: 1.0562, test_loss: 1.0327, test_f1: 0.4652
 epoch: 94, train_loss: 1.0421, test_loss: 1.0326, test_f1: 0.4667
 epoch: 95, train_loss: 1.0531, test_loss: 1.0379, test_f1: 0.4710
 epoch: 96, train_loss: 1.0470, test_loss: 1.0312, test_f1: 0.4681
 epoch: 97, train_loss: 1.0390, test_loss: 1.0287, test_f1: 0.4674
 epoch: 98, train_loss: 1.0472, test_loss: 1.0313, test_f1: 0.4739
 epoch: 99, train_loss: 1.0452, test_loss: 1.0309, test_f1: 0.4689
##################ITERATION #2 ****************************************
 epoch: 0, train_loss: 1.3221, test_loss: 1.3233, test_f1: 0.2274
 epoch: 1, train_loss: 1.3072, test_loss: 1.3119, test_f1: 0.2274
 epoch: 2, train_loss: 1.2955, test_loss: 1.2947, test_f1: 0.2274
 epoch: 3, train_loss: 1.2854, test_loss: 1.2774, test_f1: 0.2274
 epoch: 4, train_loss: 1.2759, test_loss: 1.2682, test_f1: 0.2274
 epoch: 5, train_loss: 1.2734, test_loss: 1.2602, test_f1: 0.2266
 epoch: 6, train_loss: 1.2678, test_loss: 1.2529, test_f1: 0.2665
 epoch: 7, train_loss: 1.2597, test_loss: 1.2444, test_f1: 0.2834
 epoch: 8, train_loss: 1.2541, test_loss: 1.2379, test_f1: 0.2950
 epoch: 9, train_loss: 1.2493, test_loss: 1.2312, test_f1: 0.3103
 epoch: 10, train_loss: 1.2472, test_loss: 1.2261, test_f1: 0.3181
 epoch: 11, train_loss: 1.2400, test_loss: 1.2221, test_f1: 0.3221
 epoch: 12, train_loss: 1.2325, test_loss: 1.2191, test_f1: 0.3330
 epoch: 13, train_loss: 1.2299, test_loss: 1.2129, test_f1: 0.3349
 epoch: 14, train_loss: 1.2229, test_loss: 1.2089, test_f1: 0.3423
 epoch: 15, train_loss: 1.2168, test_loss: 1.2049, test_f1: 0.3471
 epoch: 16, train_loss: 1.2176, test_loss: 1.2027, test_f1: 0.3647
 epoch: 17, train_loss: 1.2099, test_loss: 1.1974, test_f1: 0.3789
 epoch: 18, train_loss: 1.2125, test_loss: 1.1927, test_f1: 0.3785
 epoch: 19, train_loss: 1.2093, test_loss: 1.1899, test_f1: 0.3826
 epoch: 20, train_loss: 1.2018, test_loss: 1.1840, test_f1: 0.3932
 epoch: 21, train_loss: 1.1991, test_loss: 1.1793, test_f1: 0.3909
 epoch: 22, train_loss: 1.1938, test_loss: 1.1733, test_f1: 0.3947
 epoch: 23, train_loss: 1.1926, test_loss: 1.1702, test_f1: 0.3934
 epoch: 24, train_loss: 1.1885, test_loss: 1.1666, test_f1: 0.3979
 epoch: 25, train_loss: 1.1811, test_loss: 1.1621, test_f1: 0.4038
 epoch: 26, train_loss: 1.1796, test_loss: 1.1587, test_f1: 0.3990
 epoch: 27, train_loss: 1.1742, test_loss: 1.1578, test_f1: 0.4014
 epoch: 28, train_loss: 1.1675, test_loss: 1.1508, test_f1: 0.4064
 epoch: 29, train_loss: 1.1685, test_loss: 1.1505, test_f1: 0.4046
 epoch: 30, train_loss: 1.1610, test_loss: 1.1429, test_f1: 0.4073
 epoch: 31, train_loss: 1.1574, test_loss: 1.1394, test_f1: 0.4157
 epoch: 32, train_loss: 1.1573, test_loss: 1.1328, test_f1: 0.4097
 epoch: 33, train_loss: 1.1525, test_loss: 1.1313, test_f1: 0.4105
 epoch: 34, train_loss: 1.1465, test_loss: 1.1313, test_f1: 0.4092
 epoch: 35, train_loss: 1.1503, test_loss: 1.1263, test_f1: 0.4136
 epoch: 36, train_loss: 1.1407, test_loss: 1.1184, test_f1: 0.4228
 epoch: 37, train_loss: 1.1411, test_loss: 1.1151, test_f1: 0.4258
 epoch: 38, train_loss: 1.1280, test_loss: 1.1192, test_f1: 0.4245
 epoch: 39, train_loss: 1.1370, test_loss: 1.1040, test_f1: 0.4377
 epoch: 40, train_loss: 1.1218, test_loss: 1.1112, test_f1: 0.4282
 epoch: 41, train_loss: 1.1273, test_loss: 1.1066, test_f1: 0.4236
 epoch: 42, train_loss: 1.1248, test_loss: 1.1029, test_f1: 0.4281
 epoch: 43, train_loss: 1.1205, test_loss: 1.0958, test_f1: 0.4395
 epoch: 44, train_loss: 1.1212, test_loss: 1.0956, test_f1: 0.4370
 epoch: 45, train_loss: 1.1154, test_loss: 1.1026, test_f1: 0.4190
 epoch: 46, train_loss: 1.1108, test_loss: 1.0922, test_f1: 0.4342
 epoch: 47, train_loss: 1.1086, test_loss: 1.0813, test_f1: 0.4467
 epoch: 48, train_loss: 1.1118, test_loss: 1.0897, test_f1: 0.4260
 epoch: 49, train_loss: 1.1116, test_loss: 1.0909, test_f1: 0.4502
 epoch: 50, train_loss: 1.1139, test_loss: 1.0830, test_f1: 0.4435
 epoch: 51, train_loss: 1.0922, test_loss: 1.0773, test_f1: 0.4469
 epoch: 52, train_loss: 1.0965, test_loss: 1.0777, test_f1: 0.4507
 epoch: 53, train_loss: 1.0972, test_loss: 1.0790, test_f1: 0.4515
 epoch: 54, train_loss: 1.0877, test_loss: 1.0788, test_f1: 0.4603
 epoch: 55, train_loss: 1.0912, test_loss: 1.0796, test_f1: 0.4501
 epoch: 56, train_loss: 1.0864, test_loss: 1.0756, test_f1: 0.4659
 epoch: 57, train_loss: 1.0873, test_loss: 1.0739, test_f1: 0.4690
 epoch: 58, train_loss: 1.0962, test_loss: 1.0712, test_f1: 0.4764
 epoch: 59, train_loss: 1.0816, test_loss: 1.0692, test_f1: 0.4698
 epoch: 60, train_loss: 1.0848, test_loss: 1.0676, test_f1: 0.4606
 epoch: 61, train_loss: 1.0851, test_loss: 1.0729, test_f1: 0.4628
 epoch: 62, train_loss: 1.0771, test_loss: 1.0725, test_f1: 0.4633
 epoch: 63, train_loss: 1.0777, test_loss: 1.0705, test_f1: 0.4714
 epoch: 64, train_loss: 1.0759, test_loss: 1.0708, test_f1: 0.4670
 epoch: 65, train_loss: 1.0729, test_loss: 1.0693, test_f1: 0.4749
 epoch: 66, train_loss: 1.0830, test_loss: 1.0679, test_f1: 0.4755
 epoch: 67, train_loss: 1.0786, test_loss: 1.0689, test_f1: 0.4705
 epoch: 68, train_loss: 1.0729, test_loss: 1.0728, test_f1: 0.4587
 epoch: 69, train_loss: 1.0732, test_loss: 1.0648, test_f1: 0.4571
 epoch: 70, train_loss: 1.0722, test_loss: 1.0654, test_f1: 0.4590
 epoch: 71, train_loss: 1.0712, test_loss: 1.0656, test_f1: 0.4705
 epoch: 72, train_loss: 1.0646, test_loss: 1.0647, test_f1: 0.4618
 epoch: 73, train_loss: 1.0746, test_loss: 1.0669, test_f1: 0.4766
 epoch: 74, train_loss: 1.0721, test_loss: 1.0658, test_f1: 0.4628
 epoch: 75, train_loss: 1.0649, test_loss: 1.0680, test_f1: 0.4595
 epoch: 76, train_loss: 1.0667, test_loss: 1.0706, test_f1: 0.4682
 epoch: 77, train_loss: 1.0717, test_loss: 1.0657, test_f1: 0.4663
 epoch: 78, train_loss: 1.0687, test_loss: 1.0594, test_f1: 0.4731
 epoch: 79, train_loss: 1.0673, test_loss: 1.0631, test_f1: 0.4744
 epoch: 80, train_loss: 1.0668, test_loss: 1.0619, test_f1: 0.4773
 epoch: 81, train_loss: 1.0619, test_loss: 1.0650, test_f1: 0.4652
 epoch: 82, train_loss: 1.0649, test_loss: 1.0640, test_f1: 0.4676
 epoch: 83, train_loss: 1.0640, test_loss: 1.0645, test_f1: 0.4608
 epoch: 84, train_loss: 1.0555, test_loss: 1.0584, test_f1: 0.4751
 epoch: 85, train_loss: 1.0638, test_loss: 1.0558, test_f1: 0.4783
 epoch: 86, train_loss: 1.0650, test_loss: 1.0581, test_f1: 0.4729
 epoch: 87, train_loss: 1.0669, test_loss: 1.0614, test_f1: 0.4674
 epoch: 88, train_loss: 1.0565, test_loss: 1.0647, test_f1: 0.4619
 epoch: 89, train_loss: 1.0564, test_loss: 1.0603, test_f1: 0.4728
 epoch: 90, train_loss: 1.0536, test_loss: 1.0563, test_f1: 0.4758
 epoch: 91, train_loss: 1.0480, test_loss: 1.0562, test_f1: 0.4765
 epoch: 92, train_loss: 1.0515, test_loss: 1.0619, test_f1: 0.4639
 epoch: 93, train_loss: 1.0461, test_loss: 1.0596, test_f1: 0.4705
 epoch: 94, train_loss: 1.0423, test_loss: 1.0577, test_f1: 0.4719
 epoch: 95, train_loss: 1.0478, test_loss: 1.0632, test_f1: 0.4666
 epoch: 96, train_loss: 1.0554, test_loss: 1.0597, test_f1: 0.4687
 epoch: 97, train_loss: 1.0440, test_loss: 1.0604, test_f1: 0.4626
 epoch: 98, train_loss: 1.0479, test_loss: 1.0574, test_f1: 0.4705
 epoch: 99, train_loss: 1.0573, test_loss: 1.0549, test_f1: 0.4613
##################ITERATION #3 ****************************************
 epoch: 0, train_loss: 1.3011, test_loss: 1.3043, test_f1: 0.2274
 epoch: 1, train_loss: 1.2836, test_loss: 1.2831, test_f1: 0.2274
 epoch: 2, train_loss: 1.2780, test_loss: 1.2702, test_f1: 0.2325
 epoch: 3, train_loss: 1.2661, test_loss: 1.2630, test_f1: 0.2315
 epoch: 4, train_loss: 1.2600, test_loss: 1.2561, test_f1: 0.2454
 epoch: 5, train_loss: 1.2565, test_loss: 1.2477, test_f1: 0.2489
 epoch: 6, train_loss: 1.2469, test_loss: 1.2396, test_f1: 0.2575
 epoch: 7, train_loss: 1.2434, test_loss: 1.2354, test_f1: 0.2869
 epoch: 8, train_loss: 1.2392, test_loss: 1.2312, test_f1: 0.3116
 epoch: 9, train_loss: 1.2346, test_loss: 1.2249, test_f1: 0.3011
 epoch: 10, train_loss: 1.2350, test_loss: 1.2235, test_f1: 0.3146
 epoch: 11, train_loss: 1.2269, test_loss: 1.2174, test_f1: 0.3021
 epoch: 12, train_loss: 1.2194, test_loss: 1.2140, test_f1: 0.3068
 epoch: 13, train_loss: 1.2215, test_loss: 1.2090, test_f1: 0.3195
 epoch: 14, train_loss: 1.2154, test_loss: 1.2048, test_f1: 0.3179
 epoch: 15, train_loss: 1.2149, test_loss: 1.2030, test_f1: 0.3232
 epoch: 16, train_loss: 1.2149, test_loss: 1.1979, test_f1: 0.3271
 epoch: 17, train_loss: 1.2033, test_loss: 1.1958, test_f1: 0.3250
 epoch: 18, train_loss: 1.2016, test_loss: 1.1927, test_f1: 0.3313
 epoch: 19, train_loss: 1.2017, test_loss: 1.1881, test_f1: 0.3363
 epoch: 20, train_loss: 1.2042, test_loss: 1.1865, test_f1: 0.3531
 epoch: 21, train_loss: 1.1959, test_loss: 1.1844, test_f1: 0.3602
 epoch: 22, train_loss: 1.1888, test_loss: 1.1806, test_f1: 0.3700
 epoch: 23, train_loss: 1.1929, test_loss: 1.1792, test_f1: 0.3695
 epoch: 24, train_loss: 1.1875, test_loss: 1.1747, test_f1: 0.3762
 epoch: 25, train_loss: 1.1872, test_loss: 1.1747, test_f1: 0.3797
 epoch: 26, train_loss: 1.1830, test_loss: 1.1732, test_f1: 0.3771
 epoch: 27, train_loss: 1.1795, test_loss: 1.1725, test_f1: 0.3807
 epoch: 28, train_loss: 1.1831, test_loss: 1.1714, test_f1: 0.3935
 epoch: 29, train_loss: 1.1743, test_loss: 1.1652, test_f1: 0.3857
 epoch: 30, train_loss: 1.1744, test_loss: 1.1635, test_f1: 0.3819
 epoch: 31, train_loss: 1.1712, test_loss: 1.1619, test_f1: 0.3945
 epoch: 32, train_loss: 1.1697, test_loss: 1.1608, test_f1: 0.3875
 epoch: 33, train_loss: 1.1632, test_loss: 1.1592, test_f1: 0.4053
 epoch: 34, train_loss: 1.1665, test_loss: 1.1591, test_f1: 0.4111
 epoch: 35, train_loss: 1.1614, test_loss: 1.1552, test_f1: 0.4088
 epoch: 36, train_loss: 1.1601, test_loss: 1.1501, test_f1: 0.4032
 epoch: 37, train_loss: 1.1588, test_loss: 1.1511, test_f1: 0.4010
 epoch: 38, train_loss: 1.1585, test_loss: 1.1517, test_f1: 0.4021
 epoch: 39, train_loss: 1.1466, test_loss: 1.1497, test_f1: 0.4044
 epoch: 40, train_loss: 1.1476, test_loss: 1.1468, test_f1: 0.4121
 epoch: 41, train_loss: 1.1468, test_loss: 1.1460, test_f1: 0.4152
 epoch: 42, train_loss: 1.1477, test_loss: 1.1411, test_f1: 0.4135
 epoch: 43, train_loss: 1.1490, test_loss: 1.1366, test_f1: 0.4116
 epoch: 44, train_loss: 1.1387, test_loss: 1.1344, test_f1: 0.4158
 epoch: 45, train_loss: 1.1444, test_loss: 1.1304, test_f1: 0.4144
 epoch: 46, train_loss: 1.1380, test_loss: 1.1319, test_f1: 0.4161
 epoch: 47, train_loss: 1.1355, test_loss: 1.1316, test_f1: 0.4180
 epoch: 48, train_loss: 1.1277, test_loss: 1.1331, test_f1: 0.4191
 epoch: 49, train_loss: 1.1319, test_loss: 1.1232, test_f1: 0.4170
 epoch: 50, train_loss: 1.1295, test_loss: 1.1205, test_f1: 0.4183
 epoch: 51, train_loss: 1.1263, test_loss: 1.1248, test_f1: 0.4146
 epoch: 52, train_loss: 1.1180, test_loss: 1.1239, test_f1: 0.4141
 epoch: 53, train_loss: 1.1214, test_loss: 1.1237, test_f1: 0.4199
 epoch: 54, train_loss: 1.1207, test_loss: 1.1280, test_f1: 0.4225
 epoch: 55, train_loss: 1.1163, test_loss: 1.1236, test_f1: 0.4203
 epoch: 56, train_loss: 1.1160, test_loss: 1.1250, test_f1: 0.4179
 epoch: 57, train_loss: 1.1137, test_loss: 1.1206, test_f1: 0.4315
 epoch: 58, train_loss: 1.1178, test_loss: 1.1220, test_f1: 0.4143
 epoch: 59, train_loss: 1.1055, test_loss: 1.1232, test_f1: 0.4372
 epoch: 60, train_loss: 1.1173, test_loss: 1.1214, test_f1: 0.4175
 epoch: 61, train_loss: 1.1141, test_loss: 1.1182, test_f1: 0.4197
 epoch: 62, train_loss: 1.1155, test_loss: 1.1240, test_f1: 0.4349
 epoch: 63, train_loss: 1.1084, test_loss: 1.1187, test_f1: 0.4197
 epoch: 64, train_loss: 1.1094, test_loss: 1.1185, test_f1: 0.4184
 epoch: 65, train_loss: 1.1045, test_loss: 1.1245, test_f1: 0.4228
 epoch: 66, train_loss: 1.1066, test_loss: 1.1222, test_f1: 0.4272
 epoch: 67, train_loss: 1.1074, test_loss: 1.1155, test_f1: 0.4347
 epoch: 68, train_loss: 1.0990, test_loss: 1.1165, test_f1: 0.4170
 epoch: 69, train_loss: 1.1001, test_loss: 1.1194, test_f1: 0.4236
 epoch: 70, train_loss: 1.0934, test_loss: 1.1172, test_f1: 0.4248
 epoch: 71, train_loss: 1.1030, test_loss: 1.1173, test_f1: 0.4188
 epoch: 72, train_loss: 1.1021, test_loss: 1.1167, test_f1: 0.4235
 epoch: 73, train_loss: 1.1003, test_loss: 1.1143, test_f1: 0.4229
 epoch: 74, train_loss: 1.1033, test_loss: 1.1157, test_f1: 0.4244
 epoch: 75, train_loss: 1.0954, test_loss: 1.1147, test_f1: 0.4440
 epoch: 76, train_loss: 1.1002, test_loss: 1.1160, test_f1: 0.4345
 epoch: 77, train_loss: 1.0941, test_loss: 1.1140, test_f1: 0.4364
 epoch: 78, train_loss: 1.1042, test_loss: 1.1147, test_f1: 0.4368
 epoch: 79, train_loss: 1.0977, test_loss: 1.1160, test_f1: 0.4269
 epoch: 80, train_loss: 1.0999, test_loss: 1.1113, test_f1: 0.4419
 epoch: 81, train_loss: 1.0864, test_loss: 1.1099, test_f1: 0.4383
 epoch: 82, train_loss: 1.0909, test_loss: 1.1106, test_f1: 0.4384
 epoch: 83, train_loss: 1.0889, test_loss: 1.1100, test_f1: 0.4411
 epoch: 84, train_loss: 1.0831, test_loss: 1.1089, test_f1: 0.4251
 epoch: 85, train_loss: 1.0857, test_loss: 1.1127, test_f1: 0.4334
 epoch: 86, train_loss: 1.0950, test_loss: 1.1108, test_f1: 0.4381
 epoch: 87, train_loss: 1.0888, test_loss: 1.1071, test_f1: 0.4284
 epoch: 88, train_loss: 1.0831, test_loss: 1.1092, test_f1: 0.4388
 epoch: 89, train_loss: 1.0734, test_loss: 1.1162, test_f1: 0.4441
 epoch: 90, train_loss: 1.0791, test_loss: 1.1094, test_f1: 0.4288
 epoch: 91, train_loss: 1.0785, test_loss: 1.1069, test_f1: 0.4329
 epoch: 92, train_loss: 1.0743, test_loss: 1.1111, test_f1: 0.4151
 epoch: 93, train_loss: 1.0821, test_loss: 1.1075, test_f1: 0.4454
 epoch: 94, train_loss: 1.0819, test_loss: 1.1123, test_f1: 0.4393
 epoch: 95, train_loss: 1.0786, test_loss: 1.1089, test_f1: 0.4252
 epoch: 96, train_loss: 1.0776, test_loss: 1.1085, test_f1: 0.4170
 epoch: 97, train_loss: 1.0663, test_loss: 1.1022, test_f1: 0.4226
 epoch: 98, train_loss: 1.0751, test_loss: 1.1090, test_f1: 0.4236
 epoch: 99, train_loss: 1.0775, test_loss: 1.1077, test_f1: 0.4227
##################ITERATION #4 ****************************************
 epoch: 0, train_loss: 1.3105, test_loss: 1.3194, test_f1: 0.2257
 epoch: 1, train_loss: 1.2874, test_loss: 1.2946, test_f1: 0.2562
 epoch: 2, train_loss: 1.2787, test_loss: 1.2723, test_f1: 0.2652
 epoch: 3, train_loss: 1.2638, test_loss: 1.2567, test_f1: 0.2798
 epoch: 4, train_loss: 1.2570, test_loss: 1.2480, test_f1: 0.2866
 epoch: 5, train_loss: 1.2529, test_loss: 1.2396, test_f1: 0.2983
 epoch: 6, train_loss: 1.2452, test_loss: 1.2359, test_f1: 0.3154
 epoch: 7, train_loss: 1.2423, test_loss: 1.2271, test_f1: 0.3337
 epoch: 8, train_loss: 1.2329, test_loss: 1.2231, test_f1: 0.3450
 epoch: 9, train_loss: 1.2306, test_loss: 1.2170, test_f1: 0.3400
 epoch: 10, train_loss: 1.2244, test_loss: 1.2106, test_f1: 0.3550
 epoch: 11, train_loss: 1.2208, test_loss: 1.2048, test_f1: 0.3599
 epoch: 12, train_loss: 1.2126, test_loss: 1.2004, test_f1: 0.3584
 epoch: 13, train_loss: 1.2092, test_loss: 1.1945, test_f1: 0.3686
 epoch: 14, train_loss: 1.2094, test_loss: 1.1890, test_f1: 0.3789
 epoch: 15, train_loss: 1.2037, test_loss: 1.1866, test_f1: 0.3856
 epoch: 16, train_loss: 1.1995, test_loss: 1.1805, test_f1: 0.3796
 epoch: 17, train_loss: 1.1947, test_loss: 1.1772, test_f1: 0.3834
 epoch: 18, train_loss: 1.1863, test_loss: 1.1705, test_f1: 0.3904
 epoch: 19, train_loss: 1.1827, test_loss: 1.1689, test_f1: 0.3941
 epoch: 20, train_loss: 1.1844, test_loss: 1.1618, test_f1: 0.4075
 epoch: 21, train_loss: 1.1804, test_loss: 1.1605, test_f1: 0.4008
 epoch: 22, train_loss: 1.1764, test_loss: 1.1555, test_f1: 0.4113
 epoch: 23, train_loss: 1.1744, test_loss: 1.1491, test_f1: 0.4137
 epoch: 24, train_loss: 1.1656, test_loss: 1.1428, test_f1: 0.4191
 epoch: 25, train_loss: 1.1630, test_loss: 1.1403, test_f1: 0.4229
 epoch: 26, train_loss: 1.1568, test_loss: 1.1334, test_f1: 0.4512
 epoch: 27, train_loss: 1.1542, test_loss: 1.1308, test_f1: 0.4305
 epoch: 28, train_loss: 1.1551, test_loss: 1.1299, test_f1: 0.4494
 epoch: 29, train_loss: 1.1426, test_loss: 1.1240, test_f1: 0.4570
 epoch: 30, train_loss: 1.1443, test_loss: 1.1192, test_f1: 0.4565
 epoch: 31, train_loss: 1.1501, test_loss: 1.1162, test_f1: 0.4581
 epoch: 32, train_loss: 1.1268, test_loss: 1.1150, test_f1: 0.4588
 epoch: 33, train_loss: 1.1346, test_loss: 1.1102, test_f1: 0.4463
 epoch: 34, train_loss: 1.1285, test_loss: 1.1095, test_f1: 0.4536
 epoch: 35, train_loss: 1.1229, test_loss: 1.1020, test_f1: 0.4488
 epoch: 36, train_loss: 1.1216, test_loss: 1.1047, test_f1: 0.4529
 epoch: 37, train_loss: 1.1174, test_loss: 1.1004, test_f1: 0.4540
 epoch: 38, train_loss: 1.1135, test_loss: 1.0959, test_f1: 0.4498
 epoch: 39, train_loss: 1.1106, test_loss: 1.0964, test_f1: 0.4566
 epoch: 40, train_loss: 1.1094, test_loss: 1.0897, test_f1: 0.4538
 epoch: 41, train_loss: 1.1014, test_loss: 1.0878, test_f1: 0.4636
 epoch: 42, train_loss: 1.1084, test_loss: 1.0884, test_f1: 0.4567
 epoch: 43, train_loss: 1.1021, test_loss: 1.0828, test_f1: 0.4639
 epoch: 44, train_loss: 1.0970, test_loss: 1.0800, test_f1: 0.4672
 epoch: 45, train_loss: 1.0931, test_loss: 1.0788, test_f1: 0.4675
 epoch: 46, train_loss: 1.0971, test_loss: 1.0734, test_f1: 0.4674
 epoch: 47, train_loss: 1.0864, test_loss: 1.0736, test_f1: 0.4707
 epoch: 48, train_loss: 1.0771, test_loss: 1.0737, test_f1: 0.4689
 epoch: 49, train_loss: 1.0819, test_loss: 1.0665, test_f1: 0.4836
 epoch: 50, train_loss: 1.0710, test_loss: 1.0698, test_f1: 0.4785
 epoch: 51, train_loss: 1.0742, test_loss: 1.0643, test_f1: 0.4780
 epoch: 52, train_loss: 1.0761, test_loss: 1.0631, test_f1: 0.4847
 epoch: 53, train_loss: 1.0692, test_loss: 1.0659, test_f1: 0.4830
 epoch: 54, train_loss: 1.0676, test_loss: 1.0634, test_f1: 0.4850
 epoch: 55, train_loss: 1.0664, test_loss: 1.0610, test_f1: 0.4796
 epoch: 56, train_loss: 1.0646, test_loss: 1.0617, test_f1: 0.4798
 epoch: 57, train_loss: 1.0822, test_loss: 1.0604, test_f1: 0.4792
 epoch: 58, train_loss: 1.0576, test_loss: 1.0613, test_f1: 0.4800
 epoch: 59, train_loss: 1.0677, test_loss: 1.0575, test_f1: 0.4746
 epoch: 60, train_loss: 1.0618, test_loss: 1.0565, test_f1: 0.4799
 epoch: 61, train_loss: 1.0667, test_loss: 1.0570, test_f1: 0.4780
 epoch: 62, train_loss: 1.0786, test_loss: 1.0582, test_f1: 0.4689
 epoch: 63, train_loss: 1.0556, test_loss: 1.0587, test_f1: 0.4713
 epoch: 64, train_loss: 1.0629, test_loss: 1.0624, test_f1: 0.4757
 epoch: 65, train_loss: 1.0610, test_loss: 1.0579, test_f1: 0.4733
 epoch: 66, train_loss: 1.0570, test_loss: 1.0617, test_f1: 0.4629
 epoch: 67, train_loss: 1.0466, test_loss: 1.0568, test_f1: 0.4765
 epoch: 68, train_loss: 1.0527, test_loss: 1.0575, test_f1: 0.4735
 epoch: 69, train_loss: 1.0620, test_loss: 1.0572, test_f1: 0.4677
 epoch: 70, train_loss: 1.0494, test_loss: 1.0563, test_f1: 0.4652
 epoch: 71, train_loss: 1.0424, test_loss: 1.0566, test_f1: 0.4752
 epoch: 72, train_loss: 1.0425, test_loss: 1.0543, test_f1: 0.4740
 epoch: 73, train_loss: 1.0488, test_loss: 1.0555, test_f1: 0.4611
 epoch: 74, train_loss: 1.0459, test_loss: 1.0533, test_f1: 0.4715
 epoch: 75, train_loss: 1.0520, test_loss: 1.0523, test_f1: 0.4719
 epoch: 76, train_loss: 1.0527, test_loss: 1.0495, test_f1: 0.4799
 epoch: 77, train_loss: 1.0462, test_loss: 1.0477, test_f1: 0.4766
 epoch: 78, train_loss: 1.0378, test_loss: 1.0519, test_f1: 0.4763
 epoch: 79, train_loss: 1.0417, test_loss: 1.0549, test_f1: 0.4681
 epoch: 80, train_loss: 1.0340, test_loss: 1.0567, test_f1: 0.4709
 epoch: 81, train_loss: 1.0339, test_loss: 1.0478, test_f1: 0.4801
 epoch: 82, train_loss: 1.0421, test_loss: 1.0539, test_f1: 0.4787
 epoch: 83, train_loss: 1.0338, test_loss: 1.0509, test_f1: 0.4658
 epoch: 84, train_loss: 1.0287, test_loss: 1.0546, test_f1: 0.4758
 epoch: 85, train_loss: 1.0399, test_loss: 1.0536, test_f1: 0.4718
 epoch: 86, train_loss: 1.0347, test_loss: 1.0554, test_f1: 0.4662
 epoch: 87, train_loss: 1.0359, test_loss: 1.0519, test_f1: 0.4674
 epoch: 88, train_loss: 1.0289, test_loss: 1.0527, test_f1: 0.4708
 epoch: 89, train_loss: 1.0356, test_loss: 1.0513, test_f1: 0.4795
 epoch: 90, train_loss: 1.0364, test_loss: 1.0421, test_f1: 0.4774
 epoch: 91, train_loss: 1.0271, test_loss: 1.0525, test_f1: 0.4688
 epoch: 92, train_loss: 1.0174, test_loss: 1.0482, test_f1: 0.4797
 epoch: 93, train_loss: 1.0191, test_loss: 1.0477, test_f1: 0.4748
 epoch: 94, train_loss: 1.0237, test_loss: 1.0518, test_f1: 0.4772
 epoch: 95, train_loss: 1.0272, test_loss: 1.0504, test_f1: 0.4779
 epoch: 96, train_loss: 1.0151, test_loss: 1.0559, test_f1: 0.4711
 epoch: 97, train_loss: 1.0262, test_loss: 1.0488, test_f1: 0.4672
 epoch: 98, train_loss: 1.0241, test_loss: 1.0530, test_f1: 0.4625
 epoch: 99, train_loss: 1.0104, test_loss: 1.0498, test_f1: 0.4748
##################ITERATION #5 ****************************************
 epoch: 0, train_loss: 1.3107, test_loss: 1.3084, test_f1: 0.2274
 epoch: 1, train_loss: 1.2876, test_loss: 1.2855, test_f1: 0.2274
 epoch: 2, train_loss: 1.2806, test_loss: 1.2755, test_f1: 0.2399
 epoch: 3, train_loss: 1.2713, test_loss: 1.2548, test_f1: 0.2389
 epoch: 4, train_loss: 1.2643, test_loss: 1.2460, test_f1: 0.2375
 epoch: 5, train_loss: 1.2597, test_loss: 1.2411, test_f1: 0.2585
 epoch: 6, train_loss: 1.2584, test_loss: 1.2328, test_f1: 0.2762
 epoch: 7, train_loss: 1.2432, test_loss: 1.2269, test_f1: 0.2820
 epoch: 8, train_loss: 1.2391, test_loss: 1.2211, test_f1: 0.2966
 epoch: 9, train_loss: 1.2303, test_loss: 1.2147, test_f1: 0.3138
 epoch: 10, train_loss: 1.2290, test_loss: 1.2098, test_f1: 0.3143
 epoch: 11, train_loss: 1.2240, test_loss: 1.2029, test_f1: 0.3147
 epoch: 12, train_loss: 1.2242, test_loss: 1.2005, test_f1: 0.3328
 epoch: 13, train_loss: 1.2171, test_loss: 1.1969, test_f1: 0.3289
 epoch: 14, train_loss: 1.2194, test_loss: 1.1919, test_f1: 0.3322
 epoch: 15, train_loss: 1.2068, test_loss: 1.1854, test_f1: 0.3396
 epoch: 16, train_loss: 1.2011, test_loss: 1.1804, test_f1: 0.3485
 epoch: 17, train_loss: 1.1956, test_loss: 1.1765, test_f1: 0.3715
 epoch: 18, train_loss: 1.1927, test_loss: 1.1745, test_f1: 0.3717
 epoch: 19, train_loss: 1.1864, test_loss: 1.1717, test_f1: 0.3834
 epoch: 20, train_loss: 1.1886, test_loss: 1.1663, test_f1: 0.3904
 epoch: 21, train_loss: 1.1852, test_loss: 1.1620, test_f1: 0.3993
 epoch: 22, train_loss: 1.1793, test_loss: 1.1595, test_f1: 0.4048
 epoch: 23, train_loss: 1.1740, test_loss: 1.1568, test_f1: 0.4071
 epoch: 24, train_loss: 1.1668, test_loss: 1.1562, test_f1: 0.3980
 epoch: 25, train_loss: 1.1625, test_loss: 1.1518, test_f1: 0.4086
 epoch: 26, train_loss: 1.1584, test_loss: 1.1497, test_f1: 0.4026
 epoch: 27, train_loss: 1.1617, test_loss: 1.1458, test_f1: 0.3964
 epoch: 28, train_loss: 1.1540, test_loss: 1.1429, test_f1: 0.4065
 epoch: 29, train_loss: 1.1535, test_loss: 1.1414, test_f1: 0.4014
 epoch: 30, train_loss: 1.1484, test_loss: 1.1351, test_f1: 0.4014
 epoch: 31, train_loss: 1.1461, test_loss: 1.1314, test_f1: 0.4148
 epoch: 32, train_loss: 1.1408, test_loss: 1.1359, test_f1: 0.4169
 epoch: 33, train_loss: 1.1420, test_loss: 1.1311, test_f1: 0.4133
 epoch: 34, train_loss: 1.1325, test_loss: 1.1275, test_f1: 0.4133
 epoch: 35, train_loss: 1.1304, test_loss: 1.1310, test_f1: 0.4145
 epoch: 36, train_loss: 1.1308, test_loss: 1.1255, test_f1: 0.4156
 epoch: 37, train_loss: 1.1266, test_loss: 1.1296, test_f1: 0.4086
 epoch: 38, train_loss: 1.1167, test_loss: 1.1212, test_f1: 0.4265
 epoch: 39, train_loss: 1.1186, test_loss: 1.1244, test_f1: 0.4164
 epoch: 40, train_loss: 1.1228, test_loss: 1.1216, test_f1: 0.4181
 epoch: 41, train_loss: 1.1236, test_loss: 1.1162, test_f1: 0.4164
 epoch: 42, train_loss: 1.1047, test_loss: 1.1206, test_f1: 0.4226
 epoch: 43, train_loss: 1.1090, test_loss: 1.1126, test_f1: 0.4140
 epoch: 44, train_loss: 1.1086, test_loss: 1.1209, test_f1: 0.4043
 epoch: 45, train_loss: 1.1022, test_loss: 1.1100, test_f1: 0.4120
 epoch: 46, train_loss: 1.0999, test_loss: 1.1095, test_f1: 0.4170
 epoch: 47, train_loss: 1.0917, test_loss: 1.1089, test_f1: 0.4111
 epoch: 48, train_loss: 1.0959, test_loss: 1.1014, test_f1: 0.4190
 epoch: 49, train_loss: 1.0821, test_loss: 1.1093, test_f1: 0.4202
 epoch: 50, train_loss: 1.0880, test_loss: 1.1051, test_f1: 0.4161
 epoch: 51, train_loss: 1.0908, test_loss: 1.0980, test_f1: 0.4169
 epoch: 52, train_loss: 1.0910, test_loss: 1.1027, test_f1: 0.4166
 epoch: 53, train_loss: 1.0923, test_loss: 1.1008, test_f1: 0.4170
 epoch: 54, train_loss: 1.0892, test_loss: 1.1024, test_f1: 0.4139
 epoch: 55, train_loss: 1.0753, test_loss: 1.1018, test_f1: 0.4190
 epoch: 56, train_loss: 1.0757, test_loss: 1.1093, test_f1: 0.4139
 epoch: 57, train_loss: 1.0859, test_loss: 1.0998, test_f1: 0.4144
 epoch: 58, train_loss: 1.0731, test_loss: 1.0932, test_f1: 0.4268
 epoch: 59, train_loss: 1.0818, test_loss: 1.0990, test_f1: 0.4252
 epoch: 60, train_loss: 1.0790, test_loss: 1.1005, test_f1: 0.4192
 epoch: 61, train_loss: 1.0777, test_loss: 1.0990, test_f1: 0.4189
 epoch: 62, train_loss: 1.0764, test_loss: 1.0960, test_f1: 0.4199
 epoch: 63, train_loss: 1.0661, test_loss: 1.0928, test_f1: 0.4164
 epoch: 64, train_loss: 1.0704, test_loss: 1.0913, test_f1: 0.4170
 epoch: 65, train_loss: 1.0651, test_loss: 1.0963, test_f1: 0.4193
 epoch: 66, train_loss: 1.0716, test_loss: 1.0957, test_f1: 0.4216
 epoch: 67, train_loss: 1.0665, test_loss: 1.0899, test_f1: 0.4206
 epoch: 68, train_loss: 1.0701, test_loss: 1.0932, test_f1: 0.4223
 epoch: 69, train_loss: 1.0689, test_loss: 1.0917, test_f1: 0.4256
 epoch: 70, train_loss: 1.0590, test_loss: 1.0942, test_f1: 0.4198
 epoch: 71, train_loss: 1.0627, test_loss: 1.0928, test_f1: 0.4167
 epoch: 72, train_loss: 1.0629, test_loss: 1.0931, test_f1: 0.4180
 epoch: 73, train_loss: 1.0596, test_loss: 1.0923, test_f1: 0.4189
 epoch: 74, train_loss: 1.0634, test_loss: 1.0960, test_f1: 0.4224
 epoch: 75, train_loss: 1.0603, test_loss: 1.0897, test_f1: 0.4224
 epoch: 76, train_loss: 1.0550, test_loss: 1.0867, test_f1: 0.4263
 epoch: 77, train_loss: 1.0499, test_loss: 1.0861, test_f1: 0.4316
 epoch: 78, train_loss: 1.0591, test_loss: 1.0917, test_f1: 0.4180
 epoch: 79, train_loss: 1.0590, test_loss: 1.0982, test_f1: 0.4235
 epoch: 80, train_loss: 1.0595, test_loss: 1.0866, test_f1: 0.4268
 epoch: 81, train_loss: 1.0546, test_loss: 1.0808, test_f1: 0.4235
 epoch: 82, train_loss: 1.0467, test_loss: 1.0849, test_f1: 0.4308
 epoch: 83, train_loss: 1.0463, test_loss: 1.0901, test_f1: 0.4241
 epoch: 84, train_loss: 1.0496, test_loss: 1.0907, test_f1: 0.4175
 epoch: 85, train_loss: 1.0501, test_loss: 1.0881, test_f1: 0.4196
 epoch: 86, train_loss: 1.0451, test_loss: 1.0852, test_f1: 0.4188
 epoch: 87, train_loss: 1.0443, test_loss: 1.0866, test_f1: 0.4225
 epoch: 88, train_loss: 1.0370, test_loss: 1.0899, test_f1: 0.4232
 epoch: 89, train_loss: 1.0386, test_loss: 1.0831, test_f1: 0.4199
 epoch: 90, train_loss: 1.0485, test_loss: 1.0814, test_f1: 0.4284
 epoch: 91, train_loss: 1.0505, test_loss: 1.0801, test_f1: 0.4232
 epoch: 92, train_loss: 1.0464, test_loss: 1.0817, test_f1: 0.4361
 epoch: 93, train_loss: 1.0371, test_loss: 1.0880, test_f1: 0.4188
 epoch: 94, train_loss: 1.0486, test_loss: 1.0825, test_f1: 0.4376
 epoch: 95, train_loss: 1.0364, test_loss: 1.0757, test_f1: 0.4349
 epoch: 96, train_loss: 1.0314, test_loss: 1.0813, test_f1: 0.4305
 epoch: 97, train_loss: 1.0427, test_loss: 1.0844, test_f1: 0.4241
 epoch: 98, train_loss: 1.0442, test_loss: 1.0778, test_f1: 0.4396
 epoch: 99, train_loss: 1.0363, test_loss: 1.0784, test_f1: 0.4365
##################ITERATION #6 ****************************************
 epoch: 0, train_loss: 1.3128, test_loss: 1.3196, test_f1: 0.2274
 epoch: 1, train_loss: 1.2959, test_loss: 1.2980, test_f1: 0.2555
 epoch: 2, train_loss: 1.2820, test_loss: 1.2854, test_f1: 0.2569
 epoch: 3, train_loss: 1.2794, test_loss: 1.2659, test_f1: 0.2709
 epoch: 4, train_loss: 1.2635, test_loss: 1.2540, test_f1: 0.2833
 epoch: 5, train_loss: 1.2603, test_loss: 1.2489, test_f1: 0.2771
 epoch: 6, train_loss: 1.2605, test_loss: 1.2402, test_f1: 0.2980
 epoch: 7, train_loss: 1.2508, test_loss: 1.2325, test_f1: 0.3233
 epoch: 8, train_loss: 1.2421, test_loss: 1.2282, test_f1: 0.3194
 epoch: 9, train_loss: 1.2339, test_loss: 1.2187, test_f1: 0.3244
 epoch: 10, train_loss: 1.2392, test_loss: 1.2148, test_f1: 0.3241
 epoch: 11, train_loss: 1.2270, test_loss: 1.2133, test_f1: 0.3265
 epoch: 12, train_loss: 1.2237, test_loss: 1.2067, test_f1: 0.3470
 epoch: 13, train_loss: 1.2189, test_loss: 1.2002, test_f1: 0.3507
 epoch: 14, train_loss: 1.2141, test_loss: 1.1976, test_f1: 0.3640
 epoch: 15, train_loss: 1.2140, test_loss: 1.1934, test_f1: 0.3782
 epoch: 16, train_loss: 1.2109, test_loss: 1.1934, test_f1: 0.3721
 epoch: 17, train_loss: 1.2113, test_loss: 1.1910, test_f1: 0.3800
 epoch: 18, train_loss: 1.2113, test_loss: 1.1888, test_f1: 0.3829
 epoch: 19, train_loss: 1.1999, test_loss: 1.1819, test_f1: 0.3825
 epoch: 20, train_loss: 1.1944, test_loss: 1.1838, test_f1: 0.3897
 epoch: 21, train_loss: 1.2025, test_loss: 1.1799, test_f1: 0.3821
 epoch: 22, train_loss: 1.1950, test_loss: 1.1810, test_f1: 0.3872
 epoch: 23, train_loss: 1.1890, test_loss: 1.1727, test_f1: 0.3880
 epoch: 24, train_loss: 1.1875, test_loss: 1.1710, test_f1: 0.3923
 epoch: 25, train_loss: 1.1834, test_loss: 1.1667, test_f1: 0.4064
 epoch: 26, train_loss: 1.1801, test_loss: 1.1660, test_f1: 0.4100
 epoch: 27, train_loss: 1.1782, test_loss: 1.1638, test_f1: 0.4144
 epoch: 28, train_loss: 1.1776, test_loss: 1.1628, test_f1: 0.4087
 epoch: 29, train_loss: 1.1785, test_loss: 1.1589, test_f1: 0.4115
 epoch: 30, train_loss: 1.1748, test_loss: 1.1634, test_f1: 0.4064
 epoch: 31, train_loss: 1.1671, test_loss: 1.1599, test_f1: 0.4110
 epoch: 32, train_loss: 1.1757, test_loss: 1.1541, test_f1: 0.4208
 epoch: 33, train_loss: 1.1560, test_loss: 1.1526, test_f1: 0.4254
 epoch: 34, train_loss: 1.1580, test_loss: 1.1484, test_f1: 0.4214
 epoch: 35, train_loss: 1.1523, test_loss: 1.1496, test_f1: 0.4206
 epoch: 36, train_loss: 1.1556, test_loss: 1.1434, test_f1: 0.4208
 epoch: 37, train_loss: 1.1522, test_loss: 1.1418, test_f1: 0.4182
 epoch: 38, train_loss: 1.1527, test_loss: 1.1467, test_f1: 0.4236
 epoch: 39, train_loss: 1.1387, test_loss: 1.1401, test_f1: 0.4242
 epoch: 40, train_loss: 1.1470, test_loss: 1.1374, test_f1: 0.4200
 epoch: 41, train_loss: 1.1446, test_loss: 1.1379, test_f1: 0.4236
 epoch: 42, train_loss: 1.1433, test_loss: 1.1364, test_f1: 0.4258
 epoch: 43, train_loss: 1.1393, test_loss: 1.1387, test_f1: 0.4287
 epoch: 44, train_loss: 1.1343, test_loss: 1.1392, test_f1: 0.4163
 epoch: 45, train_loss: 1.1333, test_loss: 1.1312, test_f1: 0.4303
 epoch: 46, train_loss: 1.1307, test_loss: 1.1293, test_f1: 0.4185
 epoch: 47, train_loss: 1.1240, test_loss: 1.1283, test_f1: 0.4179
 epoch: 48, train_loss: 1.1324, test_loss: 1.1291, test_f1: 0.4176
 epoch: 49, train_loss: 1.1207, test_loss: 1.1294, test_f1: 0.4291
 epoch: 50, train_loss: 1.1292, test_loss: 1.1223, test_f1: 0.4238
 epoch: 51, train_loss: 1.1143, test_loss: 1.1272, test_f1: 0.4245
 epoch: 52, train_loss: 1.1199, test_loss: 1.1233, test_f1: 0.4251
 epoch: 53, train_loss: 1.1210, test_loss: 1.1229, test_f1: 0.4295
 epoch: 54, train_loss: 1.1171, test_loss: 1.1192, test_f1: 0.4188
 epoch: 55, train_loss: 1.1177, test_loss: 1.1236, test_f1: 0.4282
 epoch: 56, train_loss: 1.1097, test_loss: 1.1224, test_f1: 0.4347
 epoch: 57, train_loss: 1.1141, test_loss: 1.1211, test_f1: 0.4280
 epoch: 58, train_loss: 1.1089, test_loss: 1.1231, test_f1: 0.4236
 epoch: 59, train_loss: 1.1101, test_loss: 1.1163, test_f1: 0.4213
 epoch: 60, train_loss: 1.1154, test_loss: 1.1216, test_f1: 0.4236
 epoch: 61, train_loss: 1.1084, test_loss: 1.1167, test_f1: 0.4265
 epoch: 62, train_loss: 1.1069, test_loss: 1.1154, test_f1: 0.4233
 epoch: 63, train_loss: 1.0986, test_loss: 1.1174, test_f1: 0.4320
 epoch: 64, train_loss: 1.1063, test_loss: 1.1181, test_f1: 0.4377
 epoch: 65, train_loss: 1.1074, test_loss: 1.1145, test_f1: 0.4292
 epoch: 66, train_loss: 1.1091, test_loss: 1.1127, test_f1: 0.4392
 epoch: 67, train_loss: 1.1023, test_loss: 1.1140, test_f1: 0.4307
 epoch: 68, train_loss: 1.0992, test_loss: 1.1126, test_f1: 0.4336
 epoch: 69, train_loss: 1.1007, test_loss: 1.1118, test_f1: 0.4348
 epoch: 70, train_loss: 1.0973, test_loss: 1.1134, test_f1: 0.4401
 epoch: 71, train_loss: 1.1035, test_loss: 1.1082, test_f1: 0.4431
 epoch: 72, train_loss: 1.0947, test_loss: 1.1070, test_f1: 0.4257
 epoch: 73, train_loss: 1.0931, test_loss: 1.1109, test_f1: 0.4390
 epoch: 74, train_loss: 1.0837, test_loss: 1.1068, test_f1: 0.4392
 epoch: 75, train_loss: 1.0966, test_loss: 1.1090, test_f1: 0.4409
 epoch: 76, train_loss: 1.0940, test_loss: 1.1056, test_f1: 0.4415
 epoch: 77, train_loss: 1.0873, test_loss: 1.1097, test_f1: 0.4375
 epoch: 78, train_loss: 1.0936, test_loss: 1.1079, test_f1: 0.4354
 epoch: 79, train_loss: 1.0909, test_loss: 1.1030, test_f1: 0.4340
 epoch: 80, train_loss: 1.0964, test_loss: 1.1016, test_f1: 0.4405
 epoch: 81, train_loss: 1.0902, test_loss: 1.0961, test_f1: 0.4441
 epoch: 82, train_loss: 1.0844, test_loss: 1.1009, test_f1: 0.4373
 epoch: 83, train_loss: 1.0956, test_loss: 1.1020, test_f1: 0.4348
 epoch: 84, train_loss: 1.0900, test_loss: 1.1037, test_f1: 0.4387
 epoch: 85, train_loss: 1.0851, test_loss: 1.1024, test_f1: 0.4399
 epoch: 86, train_loss: 1.0956, test_loss: 1.1020, test_f1: 0.4401
 epoch: 87, train_loss: 1.0874, test_loss: 1.1058, test_f1: 0.4289
 epoch: 88, train_loss: 1.0833, test_loss: 1.0980, test_f1: 0.4395
 epoch: 89, train_loss: 1.0827, test_loss: 1.0974, test_f1: 0.4390
 epoch: 90, train_loss: 1.0749, test_loss: 1.0977, test_f1: 0.4376
 epoch: 91, train_loss: 1.0795, test_loss: 1.0984, test_f1: 0.4399
 epoch: 92, train_loss: 1.0769, test_loss: 1.0964, test_f1: 0.4397
 epoch: 93, train_loss: 1.0794, test_loss: 1.1011, test_f1: 0.4401
 epoch: 94, train_loss: 1.0753, test_loss: 1.0964, test_f1: 0.4428
 epoch: 95, train_loss: 1.0652, test_loss: 1.0996, test_f1: 0.4332
 epoch: 96, train_loss: 1.0671, test_loss: 1.0994, test_f1: 0.4375
 epoch: 97, train_loss: 1.0790, test_loss: 1.0989, test_f1: 0.4392
 epoch: 98, train_loss: 1.0741, test_loss: 1.0996, test_f1: 0.4319
 epoch: 99, train_loss: 1.0794, test_loss: 1.0982, test_f1: 0.4408
##################ITERATION #7 ****************************************
 epoch: 0, train_loss: 1.3221, test_loss: 1.3059, test_f1: 0.2274
 epoch: 1, train_loss: 1.2871, test_loss: 1.2731, test_f1: 0.2555
 epoch: 2, train_loss: 1.2721, test_loss: 1.2539, test_f1: 0.2555
 epoch: 3, train_loss: 1.2615, test_loss: 1.2440, test_f1: 0.2665
 epoch: 4, train_loss: 1.2524, test_loss: 1.2323, test_f1: 0.2743
 epoch: 5, train_loss: 1.2451, test_loss: 1.2203, test_f1: 0.3038
 epoch: 6, train_loss: 1.2414, test_loss: 1.2161, test_f1: 0.3183
 epoch: 7, train_loss: 1.2346, test_loss: 1.2113, test_f1: 0.3257
 epoch: 8, train_loss: 1.2311, test_loss: 1.2053, test_f1: 0.3423
 epoch: 9, train_loss: 1.2237, test_loss: 1.1989, test_f1: 0.3594
 epoch: 10, train_loss: 1.2179, test_loss: 1.1943, test_f1: 0.3656
 epoch: 11, train_loss: 1.2148, test_loss: 1.1882, test_f1: 0.3611
 epoch: 12, train_loss: 1.2095, test_loss: 1.1846, test_f1: 0.3646
 epoch: 13, train_loss: 1.2054, test_loss: 1.1792, test_f1: 0.3744
 epoch: 14, train_loss: 1.2041, test_loss: 1.1738, test_f1: 0.3864
 epoch: 15, train_loss: 1.2000, test_loss: 1.1692, test_f1: 0.3868
 epoch: 16, train_loss: 1.1962, test_loss: 1.1661, test_f1: 0.3921
 epoch: 17, train_loss: 1.1960, test_loss: 1.1626, test_f1: 0.3938
 epoch: 18, train_loss: 1.1849, test_loss: 1.1599, test_f1: 0.3902
 epoch: 19, train_loss: 1.1899, test_loss: 1.1570, test_f1: 0.4050
 epoch: 20, train_loss: 1.1815, test_loss: 1.1525, test_f1: 0.4120
 epoch: 21, train_loss: 1.1722, test_loss: 1.1482, test_f1: 0.4074
 epoch: 22, train_loss: 1.1744, test_loss: 1.1440, test_f1: 0.4148
 epoch: 23, train_loss: 1.1734, test_loss: 1.1396, test_f1: 0.4274
 epoch: 24, train_loss: 1.1717, test_loss: 1.1366, test_f1: 0.4216
 epoch: 25, train_loss: 1.1641, test_loss: 1.1289, test_f1: 0.4239
 epoch: 26, train_loss: 1.1616, test_loss: 1.1282, test_f1: 0.4352
 epoch: 27, train_loss: 1.1500, test_loss: 1.1241, test_f1: 0.4371
 epoch: 28, train_loss: 1.1463, test_loss: 1.1170, test_f1: 0.4404
 epoch: 29, train_loss: 1.1528, test_loss: 1.1119, test_f1: 0.4263
 epoch: 30, train_loss: 1.1521, test_loss: 1.1101, test_f1: 0.4374
 epoch: 31, train_loss: 1.1434, test_loss: 1.1061, test_f1: 0.4296
 epoch: 32, train_loss: 1.1440, test_loss: 1.1040, test_f1: 0.4294
 epoch: 33, train_loss: 1.1386, test_loss: 1.1024, test_f1: 0.4218
 epoch: 34, train_loss: 1.1257, test_loss: 1.0956, test_f1: 0.4221
 epoch: 35, train_loss: 1.1305, test_loss: 1.0917, test_f1: 0.4149
 epoch: 36, train_loss: 1.1233, test_loss: 1.0871, test_f1: 0.4139
 epoch: 37, train_loss: 1.1213, test_loss: 1.0832, test_f1: 0.4258
 epoch: 38, train_loss: 1.1181, test_loss: 1.0798, test_f1: 0.4181
 epoch: 39, train_loss: 1.1201, test_loss: 1.0767, test_f1: 0.4093
 epoch: 40, train_loss: 1.1111, test_loss: 1.0770, test_f1: 0.4368
 epoch: 41, train_loss: 1.1168, test_loss: 1.0682, test_f1: 0.4270
 epoch: 42, train_loss: 1.1025, test_loss: 1.0721, test_f1: 0.4279
 epoch: 43, train_loss: 1.1084, test_loss: 1.0682, test_f1: 0.4158
 epoch: 44, train_loss: 1.1019, test_loss: 1.0625, test_f1: 0.4230
 epoch: 45, train_loss: 1.1043, test_loss: 1.0587, test_f1: 0.4339
 epoch: 46, train_loss: 1.0983, test_loss: 1.0608, test_f1: 0.4268
 epoch: 47, train_loss: 1.0892, test_loss: 1.0569, test_f1: 0.4284
 epoch: 48, train_loss: 1.0965, test_loss: 1.0572, test_f1: 0.4192
 epoch: 49, train_loss: 1.0901, test_loss: 1.0471, test_f1: 0.4250
 epoch: 50, train_loss: 1.0849, test_loss: 1.0510, test_f1: 0.4321
 epoch: 51, train_loss: 1.0763, test_loss: 1.0524, test_f1: 0.4403
 epoch: 52, train_loss: 1.0808, test_loss: 1.0479, test_f1: 0.4325
 epoch: 53, train_loss: 1.0794, test_loss: 1.0468, test_f1: 0.4264
 epoch: 54, train_loss: 1.0753, test_loss: 1.0436, test_f1: 0.4416
 epoch: 55, train_loss: 1.0708, test_loss: 1.0480, test_f1: 0.4324
 epoch: 56, train_loss: 1.0649, test_loss: 1.0464, test_f1: 0.4394
 epoch: 57, train_loss: 1.0688, test_loss: 1.0434, test_f1: 0.4374
 epoch: 58, train_loss: 1.0740, test_loss: 1.0411, test_f1: 0.4415
 epoch: 59, train_loss: 1.0719, test_loss: 1.0426, test_f1: 0.4387
 epoch: 60, train_loss: 1.0693, test_loss: 1.0419, test_f1: 0.4460
 epoch: 61, train_loss: 1.0638, test_loss: 1.0412, test_f1: 0.4451
 epoch: 62, train_loss: 1.0639, test_loss: 1.0401, test_f1: 0.4423
 epoch: 63, train_loss: 1.0638, test_loss: 1.0405, test_f1: 0.4413
 epoch: 64, train_loss: 1.0665, test_loss: 1.0361, test_f1: 0.4400
 epoch: 65, train_loss: 1.0635, test_loss: 1.0358, test_f1: 0.4479
 epoch: 66, train_loss: 1.0709, test_loss: 1.0325, test_f1: 0.4483
 epoch: 67, train_loss: 1.0526, test_loss: 1.0366, test_f1: 0.4432
 epoch: 68, train_loss: 1.0689, test_loss: 1.0305, test_f1: 0.4540
 epoch: 69, train_loss: 1.0579, test_loss: 1.0332, test_f1: 0.4450
 epoch: 70, train_loss: 1.0530, test_loss: 1.0301, test_f1: 0.4641
 epoch: 71, train_loss: 1.0540, test_loss: 1.0310, test_f1: 0.4647
 epoch: 72, train_loss: 1.0565, test_loss: 1.0316, test_f1: 0.4514
 epoch: 73, train_loss: 1.0534, test_loss: 1.0264, test_f1: 0.4627
 epoch: 74, train_loss: 1.0498, test_loss: 1.0283, test_f1: 0.4578
 epoch: 75, train_loss: 1.0535, test_loss: 1.0281, test_f1: 0.4517
 epoch: 76, train_loss: 1.0448, test_loss: 1.0285, test_f1: 0.4663
 epoch: 77, train_loss: 1.0444, test_loss: 1.0248, test_f1: 0.4580
 epoch: 78, train_loss: 1.0472, test_loss: 1.0265, test_f1: 0.4636
 epoch: 79, train_loss: 1.0379, test_loss: 1.0250, test_f1: 0.4542
 epoch: 80, train_loss: 1.0473, test_loss: 1.0242, test_f1: 0.4611
 epoch: 81, train_loss: 1.0489, test_loss: 1.0254, test_f1: 0.4778
 epoch: 82, train_loss: 1.0442, test_loss: 1.0226, test_f1: 0.4656
 epoch: 83, train_loss: 1.0448, test_loss: 1.0194, test_f1: 0.4647
 epoch: 84, train_loss: 1.0414, test_loss: 1.0167, test_f1: 0.4832
 epoch: 85, train_loss: 1.0335, test_loss: 1.0190, test_f1: 0.4595
 epoch: 86, train_loss: 1.0356, test_loss: 1.0168, test_f1: 0.4782
 epoch: 87, train_loss: 1.0403, test_loss: 1.0171, test_f1: 0.4809
 epoch: 88, train_loss: 1.0338, test_loss: 1.0194, test_f1: 0.4804
 epoch: 89, train_loss: 1.0326, test_loss: 1.0187, test_f1: 0.4729
 epoch: 90, train_loss: 1.0317, test_loss: 1.0186, test_f1: 0.4655
 epoch: 91, train_loss: 1.0272, test_loss: 1.0181, test_f1: 0.4707
 epoch: 92, train_loss: 1.0361, test_loss: 1.0164, test_f1: 0.4836
 epoch: 93, train_loss: 1.0283, test_loss: 1.0164, test_f1: 0.4706
 epoch: 94, train_loss: 1.0263, test_loss: 1.0150, test_f1: 0.4766
 epoch: 95, train_loss: 1.0357, test_loss: 1.0154, test_f1: 0.4846
 epoch: 96, train_loss: 1.0377, test_loss: 1.0222, test_f1: 0.4794
 epoch: 97, train_loss: 1.0258, test_loss: 1.0151, test_f1: 0.4770
 epoch: 98, train_loss: 1.0081, test_loss: 1.0059, test_f1: 0.4847
 epoch: 99, train_loss: 1.0149, test_loss: 1.0087, test_f1: 0.4770
##################ITERATION #8 ****************************************
 epoch: 0, train_loss: 1.3423, test_loss: 1.3474, test_f1: 0.2274
 epoch: 1, train_loss: 1.3061, test_loss: 1.3416, test_f1: 0.2274
 epoch: 2, train_loss: 1.2790, test_loss: 1.2988, test_f1: 0.2274
 epoch: 3, train_loss: 1.2705, test_loss: 1.2762, test_f1: 0.2329
 epoch: 4, train_loss: 1.2660, test_loss: 1.2607, test_f1: 0.2653
 epoch: 5, train_loss: 1.2578, test_loss: 1.2530, test_f1: 0.2695
 epoch: 6, train_loss: 1.2556, test_loss: 1.2433, test_f1: 0.2832
 epoch: 7, train_loss: 1.2428, test_loss: 1.2366, test_f1: 0.2999
 epoch: 8, train_loss: 1.2413, test_loss: 1.2295, test_f1: 0.3124
 epoch: 9, train_loss: 1.2360, test_loss: 1.2219, test_f1: 0.3423
 epoch: 10, train_loss: 1.2322, test_loss: 1.2191, test_f1: 0.3491
 epoch: 11, train_loss: 1.2284, test_loss: 1.2096, test_f1: 0.3544
 epoch: 12, train_loss: 1.2204, test_loss: 1.2072, test_f1: 0.3770
 epoch: 13, train_loss: 1.2152, test_loss: 1.2004, test_f1: 0.3791
 epoch: 14, train_loss: 1.2057, test_loss: 1.1958, test_f1: 0.3789
 epoch: 15, train_loss: 1.2063, test_loss: 1.1898, test_f1: 0.3951
 epoch: 16, train_loss: 1.2033, test_loss: 1.1829, test_f1: 0.4078
 epoch: 17, train_loss: 1.2029, test_loss: 1.1765, test_f1: 0.4093
 epoch: 18, train_loss: 1.2058, test_loss: 1.1735, test_f1: 0.4172
 epoch: 19, train_loss: 1.1958, test_loss: 1.1676, test_f1: 0.4054
 epoch: 20, train_loss: 1.1885, test_loss: 1.1625, test_f1: 0.4060
 epoch: 21, train_loss: 1.1836, test_loss: 1.1616, test_f1: 0.4056
 epoch: 22, train_loss: 1.1907, test_loss: 1.1591, test_f1: 0.4047
 epoch: 23, train_loss: 1.1826, test_loss: 1.1568, test_f1: 0.3986
 epoch: 24, train_loss: 1.1782, test_loss: 1.1538, test_f1: 0.4097
 epoch: 25, train_loss: 1.1862, test_loss: 1.1503, test_f1: 0.4086
 epoch: 26, train_loss: 1.1786, test_loss: 1.1502, test_f1: 0.4016
 epoch: 27, train_loss: 1.1782, test_loss: 1.1458, test_f1: 0.4013
 epoch: 28, train_loss: 1.1800, test_loss: 1.1440, test_f1: 0.4042
 epoch: 29, train_loss: 1.1726, test_loss: 1.1426, test_f1: 0.4044
 epoch: 30, train_loss: 1.1672, test_loss: 1.1410, test_f1: 0.4074
 epoch: 31, train_loss: 1.1755, test_loss: 1.1311, test_f1: 0.4138
 epoch: 32, train_loss: 1.1648, test_loss: 1.1250, test_f1: 0.4187
 epoch: 33, train_loss: 1.1623, test_loss: 1.1283, test_f1: 0.4193
 epoch: 34, train_loss: 1.1538, test_loss: 1.1262, test_f1: 0.4151
 epoch: 35, train_loss: 1.1630, test_loss: 1.1279, test_f1: 0.4160
 epoch: 36, train_loss: 1.1613, test_loss: 1.1288, test_f1: 0.4171
 epoch: 37, train_loss: 1.1530, test_loss: 1.1226, test_f1: 0.4243
 epoch: 38, train_loss: 1.1508, test_loss: 1.1189, test_f1: 0.4233
 epoch: 39, train_loss: 1.1498, test_loss: 1.1153, test_f1: 0.4204
 epoch: 40, train_loss: 1.1405, test_loss: 1.1171, test_f1: 0.4217
 epoch: 41, train_loss: 1.1454, test_loss: 1.1171, test_f1: 0.4224
 epoch: 42, train_loss: 1.1356, test_loss: 1.1159, test_f1: 0.4194
 epoch: 43, train_loss: 1.1331, test_loss: 1.1119, test_f1: 0.4264
 epoch: 44, train_loss: 1.1347, test_loss: 1.1001, test_f1: 0.4325
 epoch: 45, train_loss: 1.1338, test_loss: 1.1008, test_f1: 0.4369
 epoch: 46, train_loss: 1.1357, test_loss: 1.1016, test_f1: 0.4471
 epoch: 47, train_loss: 1.1268, test_loss: 1.0991, test_f1: 0.4349
 epoch: 48, train_loss: 1.1302, test_loss: 1.0961, test_f1: 0.4318
 epoch: 49, train_loss: 1.1278, test_loss: 1.1006, test_f1: 0.4305
 epoch: 50, train_loss: 1.1251, test_loss: 1.1009, test_f1: 0.4344
 epoch: 51, train_loss: 1.1283, test_loss: 1.0998, test_f1: 0.4314
 epoch: 52, train_loss: 1.1182, test_loss: 1.0943, test_f1: 0.4320
 epoch: 53, train_loss: 1.1316, test_loss: 1.0963, test_f1: 0.4297
 epoch: 54, train_loss: 1.1237, test_loss: 1.0905, test_f1: 0.4322
 epoch: 55, train_loss: 1.1181, test_loss: 1.0962, test_f1: 0.4374
 epoch: 56, train_loss: 1.1113, test_loss: 1.0923, test_f1: 0.4351
 epoch: 57, train_loss: 1.1202, test_loss: 1.0953, test_f1: 0.4302
 epoch: 58, train_loss: 1.1119, test_loss: 1.0913, test_f1: 0.4299
 epoch: 59, train_loss: 1.1222, test_loss: 1.0938, test_f1: 0.4285
 epoch: 60, train_loss: 1.1161, test_loss: 1.0940, test_f1: 0.4280
 epoch: 61, train_loss: 1.1080, test_loss: 1.0953, test_f1: 0.4322
 epoch: 62, train_loss: 1.1154, test_loss: 1.0877, test_f1: 0.4295
 epoch: 63, train_loss: 1.1164, test_loss: 1.0861, test_f1: 0.4208
 epoch: 64, train_loss: 1.1130, test_loss: 1.0895, test_f1: 0.4267
 epoch: 65, train_loss: 1.0992, test_loss: 1.0867, test_f1: 0.4294
 epoch: 66, train_loss: 1.1155, test_loss: 1.0838, test_f1: 0.4363
 epoch: 67, train_loss: 1.1157, test_loss: 1.0857, test_f1: 0.4383
 epoch: 68, train_loss: 1.1117, test_loss: 1.0881, test_f1: 0.4356
 epoch: 69, train_loss: 1.0967, test_loss: 1.0877, test_f1: 0.4281
 epoch: 70, train_loss: 1.1011, test_loss: 1.0851, test_f1: 0.4319
 epoch: 71, train_loss: 1.1068, test_loss: 1.0878, test_f1: 0.4289
 epoch: 72, train_loss: 1.1112, test_loss: 1.0866, test_f1: 0.4398
 epoch: 73, train_loss: 1.1060, test_loss: 1.0815, test_f1: 0.4301
 epoch: 74, train_loss: 1.1025, test_loss: 1.0880, test_f1: 0.4306
 epoch: 75, train_loss: 1.1027, test_loss: 1.0838, test_f1: 0.4313
 epoch: 76, train_loss: 1.0995, test_loss: 1.0853, test_f1: 0.4359
 epoch: 77, train_loss: 1.0960, test_loss: 1.0861, test_f1: 0.4317
 epoch: 78, train_loss: 1.0907, test_loss: 1.0907, test_f1: 0.4307
 epoch: 79, train_loss: 1.0881, test_loss: 1.0882, test_f1: 0.4308
 epoch: 80, train_loss: 1.1002, test_loss: 1.0900, test_f1: 0.4336
 epoch: 81, train_loss: 1.0921, test_loss: 1.0834, test_f1: 0.4317
 epoch: 82, train_loss: 1.0953, test_loss: 1.0823, test_f1: 0.4367
 epoch: 83, train_loss: 1.0998, test_loss: 1.0810, test_f1: 0.4267
 epoch: 84, train_loss: 1.0915, test_loss: 1.0836, test_f1: 0.4356
 epoch: 85, train_loss: 1.0893, test_loss: 1.0797, test_f1: 0.4374
 epoch: 86, train_loss: 1.0916, test_loss: 1.0859, test_f1: 0.4333
 epoch: 87, train_loss: 1.0912, test_loss: 1.0853, test_f1: 0.4311
 epoch: 88, train_loss: 1.0933, test_loss: 1.0787, test_f1: 0.4375
 epoch: 89, train_loss: 1.0918, test_loss: 1.0823, test_f1: 0.4361
 epoch: 90, train_loss: 1.0920, test_loss: 1.0840, test_f1: 0.4375
 epoch: 91, train_loss: 1.0894, test_loss: 1.0837, test_f1: 0.4339
 epoch: 92, train_loss: 1.0877, test_loss: 1.0813, test_f1: 0.4377
 epoch: 93, train_loss: 1.0874, test_loss: 1.0776, test_f1: 0.4293
 epoch: 94, train_loss: 1.0969, test_loss: 1.0781, test_f1: 0.4267
 epoch: 95, train_loss: 1.0825, test_loss: 1.0759, test_f1: 0.4332
 epoch: 96, train_loss: 1.0885, test_loss: 1.0750, test_f1: 0.4421
 epoch: 97, train_loss: 1.0782, test_loss: 1.0776, test_f1: 0.4358
 epoch: 98, train_loss: 1.0888, test_loss: 1.0759, test_f1: 0.4324
 epoch: 99, train_loss: 1.0900, test_loss: 1.0730, test_f1: 0.4353
##################ITERATION #9 ****************************************
 epoch: 0, train_loss: 1.3326, test_loss: 1.3131, test_f1: 0.2274
 epoch: 1, train_loss: 1.2973, test_loss: 1.2974, test_f1: 0.2300
 epoch: 2, train_loss: 1.2876, test_loss: 1.2762, test_f1: 0.2379
 epoch: 3, train_loss: 1.2762, test_loss: 1.2628, test_f1: 0.2531
 epoch: 4, train_loss: 1.2624, test_loss: 1.2523, test_f1: 0.2571
 epoch: 5, train_loss: 1.2616, test_loss: 1.2421, test_f1: 0.2651
 epoch: 6, train_loss: 1.2591, test_loss: 1.2337, test_f1: 0.2903
 epoch: 7, train_loss: 1.2448, test_loss: 1.2276, test_f1: 0.3284
 epoch: 8, train_loss: 1.2438, test_loss: 1.2186, test_f1: 0.3404
 epoch: 9, train_loss: 1.2351, test_loss: 1.2111, test_f1: 0.3500
 epoch: 10, train_loss: 1.2342, test_loss: 1.2062, test_f1: 0.3515
 epoch: 11, train_loss: 1.2303, test_loss: 1.2037, test_f1: 0.3672
 epoch: 12, train_loss: 1.2165, test_loss: 1.1957, test_f1: 0.3697
 epoch: 13, train_loss: 1.2142, test_loss: 1.1898, test_f1: 0.3765
 epoch: 14, train_loss: 1.2106, test_loss: 1.1867, test_f1: 0.3863
 epoch: 15, train_loss: 1.2116, test_loss: 1.1794, test_f1: 0.3931
 epoch: 16, train_loss: 1.2067, test_loss: 1.1741, test_f1: 0.3868
 epoch: 17, train_loss: 1.1932, test_loss: 1.1685, test_f1: 0.3916
 epoch: 18, train_loss: 1.1976, test_loss: 1.1624, test_f1: 0.4002
 epoch: 19, train_loss: 1.2064, test_loss: 1.1616, test_f1: 0.4017
 epoch: 20, train_loss: 1.1873, test_loss: 1.1552, test_f1: 0.4090
 epoch: 21, train_loss: 1.1813, test_loss: 1.1505, test_f1: 0.4163
 epoch: 22, train_loss: 1.1878, test_loss: 1.1460, test_f1: 0.4191
 epoch: 23, train_loss: 1.1812, test_loss: 1.1463, test_f1: 0.4201
 epoch: 24, train_loss: 1.1674, test_loss: 1.1387, test_f1: 0.4174
 epoch: 25, train_loss: 1.1651, test_loss: 1.1392, test_f1: 0.4223
 epoch: 26, train_loss: 1.1661, test_loss: 1.1366, test_f1: 0.4190
 epoch: 27, train_loss: 1.1636, test_loss: 1.1310, test_f1: 0.4314
 epoch: 28, train_loss: 1.1613, test_loss: 1.1257, test_f1: 0.4160
 epoch: 29, train_loss: 1.1656, test_loss: 1.1272, test_f1: 0.4145
 epoch: 30, train_loss: 1.1507, test_loss: 1.1263, test_f1: 0.4197
 epoch: 31, train_loss: 1.1554, test_loss: 1.1208, test_f1: 0.4248
 epoch: 32, train_loss: 1.1520, test_loss: 1.1194, test_f1: 0.4292
 epoch: 33, train_loss: 1.1468, test_loss: 1.1181, test_f1: 0.4198
 epoch: 34, train_loss: 1.1437, test_loss: 1.1131, test_f1: 0.4171
 epoch: 35, train_loss: 1.1463, test_loss: 1.1132, test_f1: 0.4178
 epoch: 36, train_loss: 1.1349, test_loss: 1.1089, test_f1: 0.4251
 epoch: 37, train_loss: 1.1303, test_loss: 1.1008, test_f1: 0.4261
 epoch: 38, train_loss: 1.1301, test_loss: 1.1034, test_f1: 0.4244
 epoch: 39, train_loss: 1.1305, test_loss: 1.0997, test_f1: 0.4228
 epoch: 40, train_loss: 1.1239, test_loss: 1.0920, test_f1: 0.4305
 epoch: 41, train_loss: 1.1300, test_loss: 1.0880, test_f1: 0.4340
 epoch: 42, train_loss: 1.1191, test_loss: 1.0921, test_f1: 0.4315
 epoch: 43, train_loss: 1.1224, test_loss: 1.0916, test_f1: 0.4332
 epoch: 44, train_loss: 1.1199, test_loss: 1.0858, test_f1: 0.4368
 epoch: 45, train_loss: 1.1075, test_loss: 1.0853, test_f1: 0.4394
 epoch: 46, train_loss: 1.1072, test_loss: 1.0817, test_f1: 0.4404
 epoch: 47, train_loss: 1.0975, test_loss: 1.0767, test_f1: 0.4416
 epoch: 48, train_loss: 1.0997, test_loss: 1.0771, test_f1: 0.4355
 epoch: 49, train_loss: 1.1023, test_loss: 1.0698, test_f1: 0.4383
 epoch: 50, train_loss: 1.1016, test_loss: 1.0799, test_f1: 0.4348
 epoch: 51, train_loss: 1.0923, test_loss: 1.0756, test_f1: 0.4442
 epoch: 52, train_loss: 1.0941, test_loss: 1.0734, test_f1: 0.4478
 epoch: 53, train_loss: 1.0915, test_loss: 1.0703, test_f1: 0.4307
 epoch: 54, train_loss: 1.0918, test_loss: 1.0686, test_f1: 0.4349
 epoch: 55, train_loss: 1.0801, test_loss: 1.0698, test_f1: 0.4400
 epoch: 56, train_loss: 1.0828, test_loss: 1.0682, test_f1: 0.4424
 epoch: 57, train_loss: 1.0789, test_loss: 1.0733, test_f1: 0.4432
 epoch: 58, train_loss: 1.0861, test_loss: 1.0670, test_f1: 0.4413
 epoch: 59, train_loss: 1.0882, test_loss: 1.0692, test_f1: 0.4351
 epoch: 60, train_loss: 1.0794, test_loss: 1.0693, test_f1: 0.4459
 epoch: 61, train_loss: 1.0816, test_loss: 1.0633, test_f1: 0.4463
 epoch: 62, train_loss: 1.0895, test_loss: 1.0642, test_f1: 0.4353
 epoch: 63, train_loss: 1.0811, test_loss: 1.0650, test_f1: 0.4410
 epoch: 64, train_loss: 1.0813, test_loss: 1.0610, test_f1: 0.4390
 epoch: 65, train_loss: 1.0784, test_loss: 1.0675, test_f1: 0.4417
 epoch: 66, train_loss: 1.0785, test_loss: 1.0657, test_f1: 0.4443
 epoch: 67, train_loss: 1.0711, test_loss: 1.0673, test_f1: 0.4352
 epoch: 68, train_loss: 1.0669, test_loss: 1.0603, test_f1: 0.4361
 epoch: 69, train_loss: 1.0700, test_loss: 1.0588, test_f1: 0.4344
 epoch: 70, train_loss: 1.0770, test_loss: 1.0558, test_f1: 0.4376
 epoch: 71, train_loss: 1.0680, test_loss: 1.0608, test_f1: 0.4313
 epoch: 72, train_loss: 1.0635, test_loss: 1.0577, test_f1: 0.4356
 epoch: 73, train_loss: 1.0608, test_loss: 1.0599, test_f1: 0.4369
 epoch: 74, train_loss: 1.0664, test_loss: 1.0634, test_f1: 0.4411
 epoch: 75, train_loss: 1.0612, test_loss: 1.0616, test_f1: 0.4352
 epoch: 76, train_loss: 1.0616, test_loss: 1.0562, test_f1: 0.4429
 epoch: 77, train_loss: 1.0574, test_loss: 1.0503, test_f1: 0.4394
 epoch: 78, train_loss: 1.0552, test_loss: 1.0558, test_f1: 0.4481
 epoch: 79, train_loss: 1.0589, test_loss: 1.0626, test_f1: 0.4433
 epoch: 80, train_loss: 1.0478, test_loss: 1.0626, test_f1: 0.4363
 epoch: 81, train_loss: 1.0587, test_loss: 1.0614, test_f1: 0.4343
 epoch: 82, train_loss: 1.0505, test_loss: 1.0599, test_f1: 0.4442
 epoch: 83, train_loss: 1.0531, test_loss: 1.0618, test_f1: 0.4477
 epoch: 84, train_loss: 1.0468, test_loss: 1.0587, test_f1: 0.4398
 epoch: 85, train_loss: 1.0485, test_loss: 1.0548, test_f1: 0.4389
 epoch: 86, train_loss: 1.0566, test_loss: 1.0529, test_f1: 0.4376
 epoch: 87, train_loss: 1.0426, test_loss: 1.0556, test_f1: 0.4398
 epoch: 88, train_loss: 1.0382, test_loss: 1.0579, test_f1: 0.4389
 epoch: 89, train_loss: 1.0345, test_loss: 1.0571, test_f1: 0.4375
 epoch: 90, train_loss: 1.0475, test_loss: 1.0570, test_f1: 0.4426
 epoch: 91, train_loss: 1.0322, test_loss: 1.0540, test_f1: 0.4397
 epoch: 92, train_loss: 1.0354, test_loss: 1.0524, test_f1: 0.4369
 epoch: 93, train_loss: 1.0443, test_loss: 1.0542, test_f1: 0.4316
 epoch: 94, train_loss: 1.0336, test_loss: 1.0539, test_f1: 0.4428
 epoch: 95, train_loss: 1.0356, test_loss: 1.0550, test_f1: 0.4449
 epoch: 96, train_loss: 1.0392, test_loss: 1.0539, test_f1: 0.4407
 epoch: 97, train_loss: 1.0306, test_loss: 1.0570, test_f1: 0.4332
 epoch: 98, train_loss: 1.0300, test_loss: 1.0548, test_f1: 0.4391
 epoch: 99, train_loss: 1.0293, test_loss: 1.0544, test_f1: 0.4360

Training completed in 509.70 seconds
Best F1: 0.4850 at epoch 54
Mean F1 across iterations: 0.4608  0.0173
========================FINAL RESULTS================================
FEGIN weighted F1: 0.4850  0.0173
python main.py --data ltspice_examples --representation component_component --model FEGIN --layers 5 --hiddens 32 --batch_size 128 --lr 0.0001 --emb_size 512 --epochs 100 --save_appendix component_component_L5_H32_BS128_LR0.0001_E512 --no_val
-----



STDERR:
  File "main.py", line 370, in <module>
    main()
  File "main.py", line 254, in main
    dataset = dataset_class(
  File "/home/philip/projects/ltspice_examples_code_repo/Circuit-Completion-Using-GNNs/component_classification_with_link_prediction_head/evaluation/FEGIN/kernel/circuit_datasets.py", line 15, in __init__
    self.data, self.slices = torch.load(self.processed_paths[0])
  File "/home/philip/.local/lib/python3.8/site-packages/torch/serialization.py", line 1040, in load
    warnings.warn(
  File "/usr/lib/python3.8/warnings.py", line 109, in _showwarnmsg
    sw(msg.message, msg.category, msg.filename, msg.lineno,
  File "main.py", line 47, in warn_with_traceback
    traceback.print_stack(file=log)
/home/philip/projects/ltspice_examples_code_repo/Circuit-Completion-Using-GNNs/component_classification_with_link_prediction_head/evaluation/FEGIN/kernel/circuit_datasets.py:15: FutureWarning: You are using `torch.load` with `weights_only=False` (the current default value), which uses the default pickle module implicitly. It is possible to construct malicious pickle data which will execute arbitrary code during unpickling (See https://github.com/pytorch/pytorch/blob/main/SECURITY.md#untrusted-models for more details). In a future release, the default value for `weights_only` will be flipped to `True`. This limits the functions that could be executed during unpickling. Arbitrary objects will no longer be allowed to be loaded via this mode unless they are explicitly allowlisted by the user via `torch.serialization.add_safe_globals`. We recommend you start setting `weights_only=True` for any use case where you don't have full control of the loaded file. Please open an issue on GitHub for any issues related to this experimental feature.
  self.data, self.slices = torch.load(self.processed_paths[0])
