STDOUT:
Results will be saved in /home/philip/projects/ltspice_examples_code_repo/Circuit-Completion-Using-GNNs/component_classification_with_link_prediction_head/evaluation/FEGIN/results/model_FEGIN_dataset_ltspice_demos
Command line input: python main.py --data ltspice_demos --representation component_pin_net --model FEGIN --layers 4 --hiddens 16 --batch_size 32 --lr 0.01 --emb_size 250 --epochs 100 --save_appendix component_pin_net_L4_H16_BS32_LR0.01_E250 --no_val
 is saved.
-----
ltspice_demos - FEGIN
Using 4 layers, 16 hidden units, h = 2
Loading component_pin_net representation dataset
ENTERED
Training FEGIN on component_pin_net representation
Train: 1565, Test: 383
##################ITERATION #0 ****************************************
 epoch: 0, train_loss: 1.2275, test_loss: 1.2124, test_f1: 0.3947
 epoch: 1, train_loss: 1.0998, test_loss: 1.1595, test_f1: 0.3406
 epoch: 2, train_loss: 1.0407, test_loss: 1.2078, test_f1: 0.3317
 epoch: 3, train_loss: 1.0303, test_loss: 1.2250, test_f1: 0.4287
 epoch: 4, train_loss: 1.0247, test_loss: 1.0946, test_f1: 0.3179
 epoch: 5, train_loss: 1.0250, test_loss: 1.0792, test_f1: 0.3283
 epoch: 6, train_loss: 0.9908, test_loss: 1.0965, test_f1: 0.4773
 epoch: 7, train_loss: 1.0018, test_loss: 1.0367, test_f1: 0.5345
 epoch: 8, train_loss: 0.9867, test_loss: 1.0685, test_f1: 0.3829
 epoch: 9, train_loss: 0.9745, test_loss: 1.0582, test_f1: 0.5061
 epoch: 10, train_loss: 0.9758, test_loss: 1.0428, test_f1: 0.5212
 epoch: 11, train_loss: 0.9537, test_loss: 1.0413, test_f1: 0.5183
 epoch: 12, train_loss: 0.9633, test_loss: 1.1006, test_f1: 0.4791
 epoch: 13, train_loss: 0.9635, test_loss: 1.1137, test_f1: 0.5407
 epoch: 14, train_loss: 0.9475, test_loss: 1.0505, test_f1: 0.4183
 epoch: 15, train_loss: 0.9311, test_loss: 1.0605, test_f1: 0.4376
 epoch: 16, train_loss: 0.9141, test_loss: 1.1202, test_f1: 0.5434
 epoch: 17, train_loss: 0.9393, test_loss: 1.0713, test_f1: 0.5283
 epoch: 18, train_loss: 0.9167, test_loss: 1.0314, test_f1: 0.5572
 epoch: 19, train_loss: 0.9098, test_loss: 0.9776, test_f1: 0.4221
 epoch: 20, train_loss: 0.9062, test_loss: 0.9580, test_f1: 0.5348
 epoch: 21, train_loss: 0.9073, test_loss: 1.0001, test_f1: 0.4772
 epoch: 22, train_loss: 0.8841, test_loss: 0.9934, test_f1: 0.4793
 epoch: 23, train_loss: 0.8872, test_loss: 0.9640, test_f1: 0.4896
 epoch: 24, train_loss: 0.8814, test_loss: 0.9291, test_f1: 0.5844
 epoch: 25, train_loss: 0.8482, test_loss: 1.0303, test_f1: 0.5701
 epoch: 26, train_loss: 0.8570, test_loss: 1.2089, test_f1: 0.3839
 epoch: 27, train_loss: 0.8413, test_loss: 1.0237, test_f1: 0.5568
 epoch: 28, train_loss: 0.8556, test_loss: 0.9604, test_f1: 0.5312
 epoch: 29, train_loss: 0.8596, test_loss: 1.5590, test_f1: 0.3847
 epoch: 30, train_loss: 0.8739, test_loss: 1.0031, test_f1: 0.5672
 epoch: 31, train_loss: 0.8339, test_loss: 0.9780, test_f1: 0.5451
 epoch: 32, train_loss: 0.8638, test_loss: 0.9774, test_f1: 0.5294
 epoch: 33, train_loss: 0.8324, test_loss: 0.9678, test_f1: 0.5546
 epoch: 34, train_loss: 0.8207, test_loss: 0.9266, test_f1: 0.5665
 epoch: 35, train_loss: 0.8345, test_loss: 0.9852, test_f1: 0.5236
 epoch: 36, train_loss: 0.8313, test_loss: 0.9801, test_f1: 0.5399
 epoch: 37, train_loss: 0.8127, test_loss: 1.0968, test_f1: 0.5151
 epoch: 38, train_loss: 0.8063, test_loss: 0.9454, test_f1: 0.5302
 epoch: 39, train_loss: 0.8173, test_loss: 0.8945, test_f1: 0.6119
 epoch: 40, train_loss: 0.8084, test_loss: 0.9815, test_f1: 0.4668
 epoch: 41, train_loss: 0.8161, test_loss: 1.5266, test_f1: 0.4365
 epoch: 42, train_loss: 0.8182, test_loss: 0.9170, test_f1: 0.6160
 epoch: 43, train_loss: 0.8025, test_loss: 1.0457, test_f1: 0.5476
 epoch: 44, train_loss: 0.8098, test_loss: 0.9336, test_f1: 0.6080
 epoch: 45, train_loss: 0.7889, test_loss: 0.9187, test_f1: 0.5661
 epoch: 46, train_loss: 0.8004, test_loss: 0.9540, test_f1: 0.5738
 epoch: 47, train_loss: 0.8043, test_loss: 1.0410, test_f1: 0.5208
 epoch: 48, train_loss: 0.8080, test_loss: 0.9891, test_f1: 0.5438
 epoch: 49, train_loss: 0.7791, test_loss: 0.9989, test_f1: 0.5077
 epoch: 50, train_loss: 0.7760, test_loss: 0.9964, test_f1: 0.5845
 epoch: 51, train_loss: 0.7767, test_loss: 0.9240, test_f1: 0.5953
 epoch: 52, train_loss: 0.7381, test_loss: 0.8960, test_f1: 0.6098
 epoch: 53, train_loss: 0.7372, test_loss: 0.9499, test_f1: 0.6006
 epoch: 54, train_loss: 0.7340, test_loss: 0.9587, test_f1: 0.5856
 epoch: 55, train_loss: 0.7279, test_loss: 1.0225, test_f1: 0.5495
 epoch: 56, train_loss: 0.7203, test_loss: 0.9831, test_f1: 0.5619
 epoch: 57, train_loss: 0.7309, test_loss: 0.9669, test_f1: 0.6088
 epoch: 58, train_loss: 0.7196, test_loss: 0.9995, test_f1: 0.6047
 epoch: 59, train_loss: 0.7143, test_loss: 0.9846, test_f1: 0.6139
 epoch: 60, train_loss: 0.7439, test_loss: 0.9088, test_f1: 0.6127
 epoch: 61, train_loss: 0.7242, test_loss: 0.9479, test_f1: 0.6374
 epoch: 62, train_loss: 0.7176, test_loss: 0.9185, test_f1: 0.5800
 epoch: 63, train_loss: 0.7272, test_loss: 0.9162, test_f1: 0.5697
 epoch: 64, train_loss: 0.7103, test_loss: 0.9349, test_f1: 0.6238
 epoch: 65, train_loss: 0.7250, test_loss: 1.0072, test_f1: 0.5714
 epoch: 66, train_loss: 0.7289, test_loss: 0.9058, test_f1: 0.6452
 epoch: 67, train_loss: 0.7014, test_loss: 0.8956, test_f1: 0.6337
 epoch: 68, train_loss: 0.7011, test_loss: 0.9289, test_f1: 0.6095
 epoch: 69, train_loss: 0.7145, test_loss: 0.9968, test_f1: 0.5818
 epoch: 70, train_loss: 0.6982, test_loss: 0.9690, test_f1: 0.6084
 epoch: 71, train_loss: 0.7156, test_loss: 1.0907, test_f1: 0.5594
 epoch: 72, train_loss: 0.7183, test_loss: 0.9367, test_f1: 0.5988
 epoch: 73, train_loss: 0.7070, test_loss: 1.1141, test_f1: 0.5888
 epoch: 74, train_loss: 0.7047, test_loss: 1.0364, test_f1: 0.5619
 epoch: 75, train_loss: 0.6933, test_loss: 1.0070, test_f1: 0.6409
 epoch: 76, train_loss: 0.6855, test_loss: 1.0241, test_f1: 0.5871
 epoch: 77, train_loss: 0.6950, test_loss: 0.9879, test_f1: 0.6369
 epoch: 78, train_loss: 0.6909, test_loss: 0.9701, test_f1: 0.6393
 epoch: 79, train_loss: 0.6898, test_loss: 0.9749, test_f1: 0.5863
 epoch: 80, train_loss: 0.6893, test_loss: 0.9965, test_f1: 0.6276
 epoch: 81, train_loss: 0.7105, test_loss: 0.9923, test_f1: 0.6053
 epoch: 82, train_loss: 0.6770, test_loss: 1.0224, test_f1: 0.6472
 epoch: 83, train_loss: 0.6957, test_loss: 1.0043, test_f1: 0.6388
 epoch: 84, train_loss: 0.6826, test_loss: 1.0801, test_f1: 0.5798
 epoch: 85, train_loss: 0.6848, test_loss: 1.1637, test_f1: 0.5596
 epoch: 86, train_loss: 0.7011, test_loss: 1.0909, test_f1: 0.5590
 epoch: 87, train_loss: 0.6734, test_loss: 0.9849, test_f1: 0.6276
 epoch: 88, train_loss: 0.6889, test_loss: 0.9255, test_f1: 0.6536
 epoch: 89, train_loss: 0.6710, test_loss: 1.0069, test_f1: 0.6323
 epoch: 90, train_loss: 0.6621, test_loss: 1.0879, test_f1: 0.6138
 epoch: 91, train_loss: 0.6777, test_loss: 1.0619, test_f1: 0.5778
 epoch: 92, train_loss: 0.6788, test_loss: 1.1194, test_f1: 0.5938
 epoch: 93, train_loss: 0.6799, test_loss: 0.9671, test_f1: 0.6234
 epoch: 94, train_loss: 0.6701, test_loss: 0.9892, test_f1: 0.6105
 epoch: 95, train_loss: 0.6815, test_loss: 0.9633, test_f1: 0.6211
 epoch: 96, train_loss: 0.6520, test_loss: 1.0185, test_f1: 0.6039
 epoch: 97, train_loss: 0.6564, test_loss: 1.0546, test_f1: 0.6272
 epoch: 98, train_loss: 0.6546, test_loss: 1.1699, test_f1: 0.5684
 epoch: 99, train_loss: 0.6626, test_loss: 1.0547, test_f1: 0.6149
##################ITERATION #1 ****************************************
 epoch: 0, train_loss: 1.0931, test_loss: 1.1269, test_f1: 0.3644
 epoch: 1, train_loss: 0.9998, test_loss: 1.0922, test_f1: 0.5003
 epoch: 2, train_loss: 0.9742, test_loss: 1.0434, test_f1: 0.4328
 epoch: 3, train_loss: 0.9432, test_loss: 0.9908, test_f1: 0.5484
 epoch: 4, train_loss: 0.9305, test_loss: 1.0506, test_f1: 0.5277
 epoch: 5, train_loss: 0.9106, test_loss: 1.0591, test_f1: 0.4896
 epoch: 6, train_loss: 0.9018, test_loss: 0.9991, test_f1: 0.4897
 epoch: 7, train_loss: 0.9198, test_loss: 0.9879, test_f1: 0.4264
 epoch: 8, train_loss: 0.9103, test_loss: 1.2905, test_f1: 0.3684
 epoch: 9, train_loss: 0.9025, test_loss: 1.0221, test_f1: 0.5511
 epoch: 10, train_loss: 0.8737, test_loss: 1.0207, test_f1: 0.4400
 epoch: 11, train_loss: 0.8690, test_loss: 0.9912, test_f1: 0.5145
 epoch: 12, train_loss: 0.8914, test_loss: 1.0846, test_f1: 0.5192
 epoch: 13, train_loss: 0.8655, test_loss: 1.0125, test_f1: 0.5781
 epoch: 14, train_loss: 0.8596, test_loss: 1.0110, test_f1: 0.5171
 epoch: 15, train_loss: 0.8486, test_loss: 0.9519, test_f1: 0.4322
 epoch: 16, train_loss: 0.8479, test_loss: 1.0471, test_f1: 0.5327
 epoch: 17, train_loss: 0.8605, test_loss: 1.4219, test_f1: 0.4437
 epoch: 18, train_loss: 0.8514, test_loss: 1.0530, test_f1: 0.5255
 epoch: 19, train_loss: 0.8529, test_loss: 0.9589, test_f1: 0.5813
 epoch: 20, train_loss: 0.8616, test_loss: 0.9935, test_f1: 0.5137
 epoch: 21, train_loss: 0.8338, test_loss: 0.9674, test_f1: 0.5914
 epoch: 22, train_loss: 0.8324, test_loss: 0.9428, test_f1: 0.5441
 epoch: 23, train_loss: 0.8260, test_loss: 0.9527, test_f1: 0.5794
 epoch: 24, train_loss: 0.8335, test_loss: 0.9942, test_f1: 0.5653
 epoch: 25, train_loss: 0.8310, test_loss: 0.9695, test_f1: 0.5645
 epoch: 26, train_loss: 0.8231, test_loss: 0.9734, test_f1: 0.5632
 epoch: 27, train_loss: 0.8138, test_loss: 1.1990, test_f1: 0.5076
 epoch: 28, train_loss: 0.8070, test_loss: 2.1829, test_f1: 0.3611
 epoch: 29, train_loss: 0.8312, test_loss: 1.0396, test_f1: 0.5727
 epoch: 30, train_loss: 0.7988, test_loss: 0.9795, test_f1: 0.4961
 epoch: 31, train_loss: 0.8149, test_loss: 0.9347, test_f1: 0.5881
 epoch: 32, train_loss: 0.8006, test_loss: 1.3572, test_f1: 0.4941
 epoch: 33, train_loss: 0.8152, test_loss: 0.9773, test_f1: 0.6111
 epoch: 34, train_loss: 0.8112, test_loss: 0.9245, test_f1: 0.6078
 epoch: 35, train_loss: 0.7919, test_loss: 1.0053, test_f1: 0.6028
 epoch: 36, train_loss: 0.7898, test_loss: 1.0309, test_f1: 0.5362
 epoch: 37, train_loss: 0.7809, test_loss: 0.9624, test_f1: 0.5631
 epoch: 38, train_loss: 0.8212, test_loss: 1.1198, test_f1: 0.4326
 epoch: 39, train_loss: 0.8514, test_loss: 1.0090, test_f1: 0.5116
 epoch: 40, train_loss: 0.8039, test_loss: 0.9468, test_f1: 0.5922
 epoch: 41, train_loss: 0.7741, test_loss: 1.1747, test_f1: 0.4990
 epoch: 42, train_loss: 0.8090, test_loss: 1.1965, test_f1: 0.4079
 epoch: 43, train_loss: 0.7782, test_loss: 1.0947, test_f1: 0.5205
 epoch: 44, train_loss: 0.7991, test_loss: 1.1933, test_f1: 0.5389
 epoch: 45, train_loss: 0.7740, test_loss: 1.0485, test_f1: 0.5083
 epoch: 46, train_loss: 0.7612, test_loss: 1.2200, test_f1: 0.5133
 epoch: 47, train_loss: 0.7817, test_loss: 1.0633, test_f1: 0.5178
 epoch: 48, train_loss: 0.7768, test_loss: 0.9462, test_f1: 0.6135
 epoch: 49, train_loss: 0.7422, test_loss: 1.0047, test_f1: 0.5366
 epoch: 50, train_loss: 0.7906, test_loss: 1.0765, test_f1: 0.5717
 epoch: 51, train_loss: 0.7332, test_loss: 1.0214, test_f1: 0.6132
 epoch: 52, train_loss: 0.7133, test_loss: 0.9559, test_f1: 0.5909
 epoch: 53, train_loss: 0.7195, test_loss: 0.9954, test_f1: 0.6296
 epoch: 54, train_loss: 0.7033, test_loss: 0.9962, test_f1: 0.6159
 epoch: 55, train_loss: 0.7032, test_loss: 1.0268, test_f1: 0.6065
 epoch: 56, train_loss: 0.7106, test_loss: 0.9875, test_f1: 0.6265
 epoch: 57, train_loss: 0.6948, test_loss: 0.9717, test_f1: 0.6015
 epoch: 58, train_loss: 0.6963, test_loss: 1.0616, test_f1: 0.5648
 epoch: 59, train_loss: 0.6888, test_loss: 1.0994, test_f1: 0.5794
 epoch: 60, train_loss: 0.6973, test_loss: 1.0733, test_f1: 0.5868
 epoch: 61, train_loss: 0.6966, test_loss: 1.1125, test_f1: 0.5684
 epoch: 62, train_loss: 0.6957, test_loss: 0.9816, test_f1: 0.6067
 epoch: 63, train_loss: 0.6865, test_loss: 1.0326, test_f1: 0.6227
 epoch: 64, train_loss: 0.6795, test_loss: 1.1185, test_f1: 0.5805
 epoch: 65, train_loss: 0.6928, test_loss: 0.9643, test_f1: 0.5940
 epoch: 66, train_loss: 0.6796, test_loss: 1.0793, test_f1: 0.6240
 epoch: 67, train_loss: 0.6925, test_loss: 1.0618, test_f1: 0.6162
 epoch: 68, train_loss: 0.6947, test_loss: 1.0662, test_f1: 0.5452
 epoch: 69, train_loss: 0.6888, test_loss: 0.9610, test_f1: 0.6162
 epoch: 70, train_loss: 0.6883, test_loss: 1.0250, test_f1: 0.6223
 epoch: 71, train_loss: 0.6749, test_loss: 1.0848, test_f1: 0.5970
 epoch: 72, train_loss: 0.6703, test_loss: 0.9966, test_f1: 0.6143
 epoch: 73, train_loss: 0.6592, test_loss: 1.0260, test_f1: 0.6017
 epoch: 74, train_loss: 0.6637, test_loss: 1.0189, test_f1: 0.6161
 epoch: 75, train_loss: 0.6562, test_loss: 1.1785, test_f1: 0.5743
 epoch: 76, train_loss: 0.6775, test_loss: 1.1010, test_f1: 0.5795
 epoch: 77, train_loss: 0.6692, test_loss: 1.1360, test_f1: 0.5672
 epoch: 78, train_loss: 0.6709, test_loss: 1.0435, test_f1: 0.6026
 epoch: 79, train_loss: 0.6662, test_loss: 1.1037, test_f1: 0.6216
 epoch: 80, train_loss: 0.6833, test_loss: 1.0209, test_f1: 0.6110
 epoch: 81, train_loss: 0.6683, test_loss: 0.9918, test_f1: 0.5916
 epoch: 82, train_loss: 0.6657, test_loss: 1.0404, test_f1: 0.5942
 epoch: 83, train_loss: 0.6443, test_loss: 1.0413, test_f1: 0.6081
 epoch: 84, train_loss: 0.6500, test_loss: 1.0085, test_f1: 0.6362
 epoch: 85, train_loss: 0.6687, test_loss: 0.9852, test_f1: 0.6074
 epoch: 86, train_loss: 0.6557, test_loss: 1.0440, test_f1: 0.6079
 epoch: 87, train_loss: 0.6445, test_loss: 1.0204, test_f1: 0.5956
 epoch: 88, train_loss: 0.6514, test_loss: 1.0438, test_f1: 0.6050
 epoch: 89, train_loss: 0.6457, test_loss: 1.0964, test_f1: 0.5873
 epoch: 90, train_loss: 0.6618, test_loss: 1.0133, test_f1: 0.6349
 epoch: 91, train_loss: 0.6281, test_loss: 1.0303, test_f1: 0.6219
 epoch: 92, train_loss: 0.6632, test_loss: 1.0403, test_f1: 0.5902
 epoch: 93, train_loss: 0.6512, test_loss: 1.0255, test_f1: 0.6328
 epoch: 94, train_loss: 0.6387, test_loss: 1.0326, test_f1: 0.6381
 epoch: 95, train_loss: 0.6666, test_loss: 1.0816, test_f1: 0.5859
 epoch: 96, train_loss: 0.6552, test_loss: 1.0209, test_f1: 0.6186
 epoch: 97, train_loss: 0.6378, test_loss: 1.0998, test_f1: 0.5776
 epoch: 98, train_loss: 0.6478, test_loss: 1.0789, test_f1: 0.6236
 epoch: 99, train_loss: 0.6621, test_loss: 1.0277, test_f1: 0.6057
##################ITERATION #2 ****************************************
 epoch: 0, train_loss: 1.1921, test_loss: 1.2349, test_f1: 0.3937
 epoch: 1, train_loss: 1.0489, test_loss: 1.1643, test_f1: 0.4079
 epoch: 2, train_loss: 1.0192, test_loss: 1.1070, test_f1: 0.4010
 epoch: 3, train_loss: 0.9921, test_loss: 1.3526, test_f1: 0.4052
 epoch: 4, train_loss: 0.9584, test_loss: 1.1517, test_f1: 0.5045
 epoch: 5, train_loss: 0.9473, test_loss: 1.1247, test_f1: 0.4541
 epoch: 6, train_loss: 0.9351, test_loss: 0.9965, test_f1: 0.5235
 epoch: 7, train_loss: 0.9255, test_loss: 1.0095, test_f1: 0.4206
 epoch: 8, train_loss: 0.9152, test_loss: 0.9856, test_f1: 0.5270
 epoch: 9, train_loss: 0.8936, test_loss: 1.0216, test_f1: 0.4706
 epoch: 10, train_loss: 0.9193, test_loss: 1.0833, test_f1: 0.4417
 epoch: 11, train_loss: 0.9127, test_loss: 1.2483, test_f1: 0.4143
 epoch: 12, train_loss: 0.9006, test_loss: 0.9830, test_f1: 0.5498
 epoch: 13, train_loss: 0.8886, test_loss: 1.0048, test_f1: 0.5461
 epoch: 14, train_loss: 0.8814, test_loss: 1.0304, test_f1: 0.5420
 epoch: 15, train_loss: 0.8731, test_loss: 0.9762, test_f1: 0.5322
 epoch: 16, train_loss: 0.8791, test_loss: 0.9762, test_f1: 0.5191
 epoch: 17, train_loss: 0.8665, test_loss: 0.9715, test_f1: 0.5369
 epoch: 18, train_loss: 0.8784, test_loss: 0.9837, test_f1: 0.4213
 epoch: 19, train_loss: 0.8889, test_loss: 1.0004, test_f1: 0.4709
 epoch: 20, train_loss: 0.8577, test_loss: 0.9675, test_f1: 0.5444
 epoch: 21, train_loss: 0.8663, test_loss: 3.2273, test_f1: 0.2949
 epoch: 22, train_loss: 0.8737, test_loss: 1.0352, test_f1: 0.5188
 epoch: 23, train_loss: 0.8657, test_loss: 1.3960, test_f1: 0.4261
 epoch: 24, train_loss: 0.8778, test_loss: 1.0805, test_f1: 0.4611
 epoch: 25, train_loss: 0.8955, test_loss: 0.9833, test_f1: 0.4735
 epoch: 26, train_loss: 0.8665, test_loss: 0.9930, test_f1: 0.5343
 epoch: 27, train_loss: 0.8738, test_loss: 0.9768, test_f1: 0.5285
 epoch: 28, train_loss: 0.8654, test_loss: 1.1385, test_f1: 0.4812
 epoch: 29, train_loss: 0.8631, test_loss: 1.0423, test_f1: 0.4880
 epoch: 30, train_loss: 0.8528, test_loss: 0.9836, test_f1: 0.5282
 epoch: 31, train_loss: 0.8530, test_loss: 1.0159, test_f1: 0.4283
 epoch: 32, train_loss: 0.8421, test_loss: 0.9854, test_f1: 0.5432
 epoch: 33, train_loss: 0.8600, test_loss: 1.0107, test_f1: 0.5607
 epoch: 34, train_loss: 0.8482, test_loss: 0.9794, test_f1: 0.5758
 epoch: 35, train_loss: 0.8537, test_loss: 1.0132, test_f1: 0.5426
 epoch: 36, train_loss: 0.8432, test_loss: 0.9521, test_f1: 0.5561
 epoch: 37, train_loss: 0.8297, test_loss: 0.9771, test_f1: 0.5873
 epoch: 38, train_loss: 0.8473, test_loss: 1.0751, test_f1: 0.5227
 epoch: 39, train_loss: 0.8371, test_loss: 1.0568, test_f1: 0.5027
 epoch: 40, train_loss: 0.8315, test_loss: 0.9569, test_f1: 0.4806
 epoch: 41, train_loss: 0.8152, test_loss: 1.0601, test_f1: 0.5191
 epoch: 42, train_loss: 0.8222, test_loss: 1.0265, test_f1: 0.4834
 epoch: 43, train_loss: 0.8287, test_loss: 1.0092, test_f1: 0.5515
 epoch: 44, train_loss: 0.8387, test_loss: 0.9917, test_f1: 0.5416
 epoch: 45, train_loss: 0.8174, test_loss: 1.0545, test_f1: 0.5331
 epoch: 46, train_loss: 0.8245, test_loss: 1.0072, test_f1: 0.5740
 epoch: 47, train_loss: 0.8400, test_loss: 0.9611, test_f1: 0.4508
 epoch: 48, train_loss: 0.8189, test_loss: 0.9531, test_f1: 0.5531
 epoch: 49, train_loss: 0.8288, test_loss: 0.9993, test_f1: 0.5795
 epoch: 50, train_loss: 0.8107, test_loss: 1.0958, test_f1: 0.5206
 epoch: 51, train_loss: 0.7876, test_loss: 0.9950, test_f1: 0.5671
 epoch: 52, train_loss: 0.7932, test_loss: 0.9654, test_f1: 0.5680
 epoch: 53, train_loss: 0.7873, test_loss: 1.0860, test_f1: 0.5478
 epoch: 54, train_loss: 0.7900, test_loss: 0.9966, test_f1: 0.5853
 epoch: 55, train_loss: 0.7970, test_loss: 1.0181, test_f1: 0.5623
 epoch: 56, train_loss: 0.7723, test_loss: 1.0495, test_f1: 0.5337
 epoch: 57, train_loss: 0.7765, test_loss: 0.9883, test_f1: 0.5809
 epoch: 58, train_loss: 0.7596, test_loss: 1.0357, test_f1: 0.5686
 epoch: 59, train_loss: 0.7693, test_loss: 1.1296, test_f1: 0.5128
 epoch: 60, train_loss: 0.7551, test_loss: 1.0387, test_f1: 0.5410
 epoch: 61, train_loss: 0.7492, test_loss: 1.0288, test_f1: 0.5782
 epoch: 62, train_loss: 0.7488, test_loss: 1.0788, test_f1: 0.5482
 epoch: 63, train_loss: 0.7793, test_loss: 1.0357, test_f1: 0.5807
 epoch: 64, train_loss: 0.7432, test_loss: 1.0157, test_f1: 0.5455
 epoch: 65, train_loss: 0.7643, test_loss: 1.0476, test_f1: 0.5610
 epoch: 66, train_loss: 0.7331, test_loss: 1.0813, test_f1: 0.5420
 epoch: 67, train_loss: 0.7536, test_loss: 1.0176, test_f1: 0.5832
 epoch: 68, train_loss: 0.7337, test_loss: 1.0468, test_f1: 0.5865
 epoch: 69, train_loss: 0.7335, test_loss: 1.1035, test_f1: 0.5354
 epoch: 70, train_loss: 0.7280, test_loss: 1.0857, test_f1: 0.5563
 epoch: 71, train_loss: 0.7513, test_loss: 1.0796, test_f1: 0.5722
 epoch: 72, train_loss: 0.7570, test_loss: 1.0345, test_f1: 0.5868
 epoch: 73, train_loss: 0.7423, test_loss: 1.1687, test_f1: 0.5706
 epoch: 74, train_loss: 0.7298, test_loss: 1.1842, test_f1: 0.5572
 epoch: 75, train_loss: 0.7376, test_loss: 1.0278, test_f1: 0.5941
 epoch: 76, train_loss: 0.7227, test_loss: 1.0721, test_f1: 0.5643
 epoch: 77, train_loss: 0.7546, test_loss: 1.0296, test_f1: 0.5757
 epoch: 78, train_loss: 0.7229, test_loss: 1.2069, test_f1: 0.5435
 epoch: 79, train_loss: 0.7408, test_loss: 1.0771, test_f1: 0.5656
 epoch: 80, train_loss: 0.7444, test_loss: 1.1178, test_f1: 0.5656
 epoch: 81, train_loss: 0.7205, test_loss: 1.1739, test_f1: 0.5425
 epoch: 82, train_loss: 0.7306, test_loss: 1.1452, test_f1: 0.5411
 epoch: 83, train_loss: 0.7261, test_loss: 1.0614, test_f1: 0.6169
 epoch: 84, train_loss: 0.7087, test_loss: 1.1286, test_f1: 0.5648
 epoch: 85, train_loss: 0.7169, test_loss: 1.0486, test_f1: 0.5578
 epoch: 86, train_loss: 0.7282, test_loss: 1.1353, test_f1: 0.5854
 epoch: 87, train_loss: 0.7151, test_loss: 1.0417, test_f1: 0.6163
 epoch: 88, train_loss: 0.7131, test_loss: 1.0626, test_f1: 0.5683
 epoch: 89, train_loss: 0.7162, test_loss: 1.1268, test_f1: 0.5724
 epoch: 90, train_loss: 0.6795, test_loss: 1.0348, test_f1: 0.5773
 epoch: 91, train_loss: 0.7261, test_loss: 1.0667, test_f1: 0.6098
 epoch: 92, train_loss: 0.7313, test_loss: 1.1231, test_f1: 0.5618
 epoch: 93, train_loss: 0.7023, test_loss: 1.1115, test_f1: 0.5494
 epoch: 94, train_loss: 0.7211, test_loss: 1.0527, test_f1: 0.6063
 epoch: 95, train_loss: 0.7046, test_loss: 1.1404, test_f1: 0.5616
 epoch: 96, train_loss: 0.7052, test_loss: 1.0714, test_f1: 0.5987
 epoch: 97, train_loss: 0.6996, test_loss: 1.0129, test_f1: 0.6267
 epoch: 98, train_loss: 0.6951, test_loss: 1.2068, test_f1: 0.5816
 epoch: 99, train_loss: 0.6962, test_loss: 1.4736, test_f1: 0.5045
##################ITERATION #3 ****************************************
 epoch: 0, train_loss: 1.1317, test_loss: 1.3045, test_f1: 0.3208
 epoch: 1, train_loss: 1.0072, test_loss: 1.0935, test_f1: 0.4784
 epoch: 2, train_loss: 0.9819, test_loss: 1.1031, test_f1: 0.5295
 epoch: 3, train_loss: 0.9594, test_loss: 1.0162, test_f1: 0.4882
 epoch: 4, train_loss: 0.9435, test_loss: 0.9781, test_f1: 0.4552
 epoch: 5, train_loss: 0.9130, test_loss: 1.0072, test_f1: 0.5332
 epoch: 6, train_loss: 0.9061, test_loss: 1.1025, test_f1: 0.5407
 epoch: 7, train_loss: 0.8914, test_loss: 0.9920, test_f1: 0.5464
 epoch: 8, train_loss: 0.8913, test_loss: 1.0283, test_f1: 0.5391
 epoch: 9, train_loss: 0.9030, test_loss: 1.1830, test_f1: 0.3868
 epoch: 10, train_loss: 0.8848, test_loss: 1.0030, test_f1: 0.5213
 epoch: 11, train_loss: 0.8722, test_loss: 1.0514, test_f1: 0.5482
 epoch: 12, train_loss: 0.8908, test_loss: 1.0058, test_f1: 0.5215
 epoch: 13, train_loss: 0.8743, test_loss: 0.9575, test_f1: 0.5263
 epoch: 14, train_loss: 0.8622, test_loss: 1.0782, test_f1: 0.4711
 epoch: 15, train_loss: 0.8684, test_loss: 0.9621, test_f1: 0.5329
 epoch: 16, train_loss: 0.8522, test_loss: 1.0023, test_f1: 0.5480
 epoch: 17, train_loss: 0.8414, test_loss: 1.0274, test_f1: 0.5205
 epoch: 18, train_loss: 0.8429, test_loss: 0.9720, test_f1: 0.5209
 epoch: 19, train_loss: 0.8610, test_loss: 0.9616, test_f1: 0.5332
 epoch: 20, train_loss: 0.8400, test_loss: 0.9705, test_f1: 0.5345
 epoch: 21, train_loss: 0.8614, test_loss: 1.0829, test_f1: 0.4331
 epoch: 22, train_loss: 0.8418, test_loss: 0.9734, test_f1: 0.5554
 epoch: 23, train_loss: 0.8474, test_loss: 0.9665, test_f1: 0.5220
 epoch: 24, train_loss: 0.8441, test_loss: 0.9730, test_f1: 0.5245
 epoch: 25, train_loss: 0.8615, test_loss: 1.0059, test_f1: 0.5473
 epoch: 26, train_loss: 0.8347, test_loss: 0.9797, test_f1: 0.5570
 epoch: 27, train_loss: 0.8408, test_loss: 0.9831, test_f1: 0.5349
 epoch: 28, train_loss: 0.8156, test_loss: 1.0142, test_f1: 0.5494
 epoch: 29, train_loss: 0.8236, test_loss: 0.9487, test_f1: 0.5632
 epoch: 30, train_loss: 0.8338, test_loss: 0.9775, test_f1: 0.5760
 epoch: 31, train_loss: 0.8267, test_loss: 0.9832, test_f1: 0.5743
 epoch: 32, train_loss: 0.8158, test_loss: 1.0115, test_f1: 0.5653
 epoch: 33, train_loss: 0.8213, test_loss: 0.9648, test_f1: 0.5603
 epoch: 34, train_loss: 0.8146, test_loss: 1.1622, test_f1: 0.5321
 epoch: 35, train_loss: 0.8298, test_loss: 0.9640, test_f1: 0.5881
 epoch: 36, train_loss: 0.8091, test_loss: 1.1064, test_f1: 0.5271
 epoch: 37, train_loss: 0.8069, test_loss: 0.9807, test_f1: 0.5421
 epoch: 38, train_loss: 0.7889, test_loss: 1.0346, test_f1: 0.5616
 epoch: 39, train_loss: 0.7759, test_loss: 1.0387, test_f1: 0.5203
 epoch: 40, train_loss: 0.7937, test_loss: 1.0063, test_f1: 0.5657
 epoch: 41, train_loss: 0.7881, test_loss: 1.8431, test_f1: 0.4197
 epoch: 42, train_loss: 0.8070, test_loss: 1.0296, test_f1: 0.5577
 epoch: 43, train_loss: 0.7994, test_loss: 1.0270, test_f1: 0.5461
 epoch: 44, train_loss: 0.7980, test_loss: 1.0134, test_f1: 0.5523
 epoch: 45, train_loss: 0.7886, test_loss: 1.0482, test_f1: 0.5674
 epoch: 46, train_loss: 0.7724, test_loss: 1.0492, test_f1: 0.5509
 epoch: 47, train_loss: 0.7966, test_loss: 1.4930, test_f1: 0.3845
 epoch: 48, train_loss: 0.7872, test_loss: 1.0981, test_f1: 0.5416
 epoch: 49, train_loss: 0.7579, test_loss: 1.2528, test_f1: 0.5318
 epoch: 50, train_loss: 0.7839, test_loss: 1.0438, test_f1: 0.5697
 epoch: 51, train_loss: 0.7767, test_loss: 0.9879, test_f1: 0.5819
 epoch: 52, train_loss: 0.7363, test_loss: 1.0052, test_f1: 0.5894
 epoch: 53, train_loss: 0.7285, test_loss: 1.0945, test_f1: 0.5494
 epoch: 54, train_loss: 0.7420, test_loss: 1.0816, test_f1: 0.5567
 epoch: 55, train_loss: 0.7229, test_loss: 1.1228, test_f1: 0.5457
 epoch: 56, train_loss: 0.7217, test_loss: 1.0637, test_f1: 0.5670
 epoch: 57, train_loss: 0.7187, test_loss: 1.1673, test_f1: 0.5119
 epoch: 58, train_loss: 0.7335, test_loss: 1.1507, test_f1: 0.5724
 epoch: 59, train_loss: 0.7418, test_loss: 1.0579, test_f1: 0.5847
 epoch: 60, train_loss: 0.7110, test_loss: 1.0439, test_f1: 0.5900
 epoch: 61, train_loss: 0.7053, test_loss: 1.0222, test_f1: 0.6130
 epoch: 62, train_loss: 0.7062, test_loss: 1.0763, test_f1: 0.5888
 epoch: 63, train_loss: 0.7100, test_loss: 1.1190, test_f1: 0.5412
 epoch: 64, train_loss: 0.7326, test_loss: 1.0407, test_f1: 0.5941
 epoch: 65, train_loss: 0.7257, test_loss: 1.0505, test_f1: 0.5890
 epoch: 66, train_loss: 0.7134, test_loss: 1.0977, test_f1: 0.5733
 epoch: 67, train_loss: 0.7114, test_loss: 1.0504, test_f1: 0.5896
 epoch: 68, train_loss: 0.6913, test_loss: 1.0791, test_f1: 0.6016
 epoch: 69, train_loss: 0.7023, test_loss: 1.0258, test_f1: 0.6130
 epoch: 70, train_loss: 0.6945, test_loss: 0.9937, test_f1: 0.5959
 epoch: 71, train_loss: 0.7121, test_loss: 1.0939, test_f1: 0.5685
 epoch: 72, train_loss: 0.6945, test_loss: 0.9873, test_f1: 0.6129
 epoch: 73, train_loss: 0.6920, test_loss: 1.1114, test_f1: 0.5972
 epoch: 74, train_loss: 0.6881, test_loss: 1.0161, test_f1: 0.6280
 epoch: 75, train_loss: 0.6781, test_loss: 1.0251, test_f1: 0.6067
 epoch: 76, train_loss: 0.6874, test_loss: 1.0526, test_f1: 0.5986
 epoch: 77, train_loss: 0.6906, test_loss: 1.0712, test_f1: 0.6040
 epoch: 78, train_loss: 0.7052, test_loss: 1.0145, test_f1: 0.6221
 epoch: 79, train_loss: 0.6952, test_loss: 1.0476, test_f1: 0.6211
 epoch: 80, train_loss: 0.6805, test_loss: 1.0380, test_f1: 0.6046
 epoch: 81, train_loss: 0.6882, test_loss: 1.0810, test_f1: 0.6226
 epoch: 82, train_loss: 0.6857, test_loss: 1.0394, test_f1: 0.6117
 epoch: 83, train_loss: 0.6933, test_loss: 1.0187, test_f1: 0.6084
 epoch: 84, train_loss: 0.6931, test_loss: 1.0063, test_f1: 0.6612
 epoch: 85, train_loss: 0.6718, test_loss: 1.0702, test_f1: 0.5926
 epoch: 86, train_loss: 0.6822, test_loss: 1.0282, test_f1: 0.6324
 epoch: 87, train_loss: 0.6773, test_loss: 1.1651, test_f1: 0.5851
 epoch: 88, train_loss: 0.6732, test_loss: 1.0021, test_f1: 0.6324
 epoch: 89, train_loss: 0.6856, test_loss: 1.0524, test_f1: 0.5998
 epoch: 90, train_loss: 0.6728, test_loss: 1.1210, test_f1: 0.5778
 epoch: 91, train_loss: 0.6976, test_loss: 1.1036, test_f1: 0.6096
 epoch: 92, train_loss: 0.6548, test_loss: 1.0378, test_f1: 0.5864
 epoch: 93, train_loss: 0.6774, test_loss: 1.0407, test_f1: 0.5748
 epoch: 94, train_loss: 0.6880, test_loss: 1.0903, test_f1: 0.5707
 epoch: 95, train_loss: 0.6721, test_loss: 1.0624, test_f1: 0.5557
 epoch: 96, train_loss: 0.6914, test_loss: 1.0810, test_f1: 0.5964
 epoch: 97, train_loss: 0.6704, test_loss: 1.0308, test_f1: 0.6428
 epoch: 98, train_loss: 0.6626, test_loss: 1.1514, test_f1: 0.5756
 epoch: 99, train_loss: 0.6779, test_loss: 1.0498, test_f1: 0.6148
##################ITERATION #4 ****************************************
 epoch: 0, train_loss: 1.1705, test_loss: 1.2142, test_f1: 0.4192
 epoch: 1, train_loss: 1.0146, test_loss: 1.0545, test_f1: 0.5246
 epoch: 2, train_loss: 0.9800, test_loss: 1.0585, test_f1: 0.4284
 epoch: 3, train_loss: 0.9661, test_loss: 1.0957, test_f1: 0.4765
 epoch: 4, train_loss: 0.9628, test_loss: 1.0597, test_f1: 0.5408
 epoch: 5, train_loss: 0.9181, test_loss: 0.9709, test_f1: 0.5551
 epoch: 6, train_loss: 0.9091, test_loss: 0.9703, test_f1: 0.5477
 epoch: 7, train_loss: 0.9271, test_loss: 0.9957, test_f1: 0.5186
 epoch: 8, train_loss: 0.9082, test_loss: 1.0228, test_f1: 0.5442
 epoch: 9, train_loss: 0.9112, test_loss: 1.0105, test_f1: 0.4382
 epoch: 10, train_loss: 0.8922, test_loss: 1.1723, test_f1: 0.4965
 epoch: 11, train_loss: 0.9001, test_loss: 1.0030, test_f1: 0.5777
 epoch: 12, train_loss: 0.8894, test_loss: 1.0551, test_f1: 0.5162
 epoch: 13, train_loss: 0.8841, test_loss: 1.0124, test_f1: 0.4327
 epoch: 14, train_loss: 0.8676, test_loss: 0.9988, test_f1: 0.5454
 epoch: 15, train_loss: 0.8655, test_loss: 0.9728, test_f1: 0.4251
 epoch: 16, train_loss: 0.8654, test_loss: 0.9714, test_f1: 0.5612
 epoch: 17, train_loss: 0.8442, test_loss: 0.9896, test_f1: 0.5382
 epoch: 18, train_loss: 0.8569, test_loss: 1.0234, test_f1: 0.5337
 epoch: 19, train_loss: 0.8923, test_loss: 0.9807, test_f1: 0.5429
 epoch: 20, train_loss: 0.8514, test_loss: 0.9627, test_f1: 0.5206
 epoch: 21, train_loss: 0.8500, test_loss: 0.9315, test_f1: 0.5564
 epoch: 22, train_loss: 0.8565, test_loss: 1.0529, test_f1: 0.5333
 epoch: 23, train_loss: 0.8371, test_loss: 0.9889, test_f1: 0.6071
 epoch: 24, train_loss: 0.8209, test_loss: 1.0271, test_f1: 0.4809
 epoch: 25, train_loss: 0.8480, test_loss: 1.0066, test_f1: 0.5558
 epoch: 26, train_loss: 0.8372, test_loss: 0.9567, test_f1: 0.5863
 epoch: 27, train_loss: 0.8269, test_loss: 0.9678, test_f1: 0.6017
 epoch: 28, train_loss: 0.8172, test_loss: 0.9456, test_f1: 0.6052
 epoch: 29, train_loss: 0.8201, test_loss: 1.0173, test_f1: 0.5443
 epoch: 30, train_loss: 0.8335, test_loss: 0.9543, test_f1: 0.5822
 epoch: 31, train_loss: 0.8189, test_loss: 0.9412, test_f1: 0.5891
 epoch: 32, train_loss: 0.8101, test_loss: 0.9447, test_f1: 0.6190
 epoch: 33, train_loss: 0.8163, test_loss: 1.0435, test_f1: 0.5488
 epoch: 34, train_loss: 0.7981, test_loss: 0.9401, test_f1: 0.5934
 epoch: 35, train_loss: 0.8250, test_loss: 0.9593, test_f1: 0.6000
 epoch: 36, train_loss: 0.8205, test_loss: 0.9626, test_f1: 0.5891
 epoch: 37, train_loss: 0.8028, test_loss: 1.0354, test_f1: 0.5561
 epoch: 38, train_loss: 0.8180, test_loss: 0.9456, test_f1: 0.6278
 epoch: 39, train_loss: 0.8065, test_loss: 1.1162, test_f1: 0.5847
 epoch: 40, train_loss: 0.8585, test_loss: 1.4005, test_f1: 0.4755
 epoch: 41, train_loss: 0.8289, test_loss: 0.9537, test_f1: 0.5892
 epoch: 42, train_loss: 0.8121, test_loss: 1.0070, test_f1: 0.5617
 epoch: 43, train_loss: 0.8072, test_loss: 0.9555, test_f1: 0.6110
 epoch: 44, train_loss: 0.7982, test_loss: 0.9870, test_f1: 0.5875
 epoch: 45, train_loss: 0.8283, test_loss: 1.1410, test_f1: 0.5086
 epoch: 46, train_loss: 0.8166, test_loss: 1.0005, test_f1: 0.5938
 epoch: 47, train_loss: 0.7896, test_loss: 0.9633, test_f1: 0.5963
 epoch: 48, train_loss: 0.7880, test_loss: 0.9569, test_f1: 0.6052
 epoch: 49, train_loss: 0.7977, test_loss: 0.9773, test_f1: 0.5835
 epoch: 50, train_loss: 0.7775, test_loss: 0.9582, test_f1: 0.5787
 epoch: 51, train_loss: 0.7842, test_loss: 0.9529, test_f1: 0.6210
 epoch: 52, train_loss: 0.7612, test_loss: 0.9338, test_f1: 0.6055
 epoch: 53, train_loss: 0.7546, test_loss: 0.9470, test_f1: 0.5984
 epoch: 54, train_loss: 0.7505, test_loss: 0.9480, test_f1: 0.5895
 epoch: 55, train_loss: 0.7761, test_loss: 0.9319, test_f1: 0.5866
 epoch: 56, train_loss: 0.7582, test_loss: 0.9262, test_f1: 0.5884
 epoch: 57, train_loss: 0.7478, test_loss: 0.9437, test_f1: 0.6110
 epoch: 58, train_loss: 0.7515, test_loss: 0.9403, test_f1: 0.5820
 epoch: 59, train_loss: 0.7511, test_loss: 0.9695, test_f1: 0.6040
 epoch: 60, train_loss: 0.7455, test_loss: 0.9169, test_f1: 0.5919
 epoch: 61, train_loss: 0.7594, test_loss: 0.9952, test_f1: 0.5861
 epoch: 62, train_loss: 0.7467, test_loss: 0.9201, test_f1: 0.6226
 epoch: 63, train_loss: 0.7388, test_loss: 0.9784, test_f1: 0.5950
 epoch: 64, train_loss: 0.7669, test_loss: 0.9373, test_f1: 0.5621
 epoch: 65, train_loss: 0.7265, test_loss: 0.9633, test_f1: 0.5963
 epoch: 66, train_loss: 0.7507, test_loss: 0.9783, test_f1: 0.5760
 epoch: 67, train_loss: 0.7355, test_loss: 0.9002, test_f1: 0.6229
 epoch: 68, train_loss: 0.7102, test_loss: 0.9555, test_f1: 0.5783
 epoch: 69, train_loss: 0.7175, test_loss: 1.0409, test_f1: 0.5788
 epoch: 70, train_loss: 0.7394, test_loss: 1.0147, test_f1: 0.6076
 epoch: 71, train_loss: 0.7411, test_loss: 0.9775, test_f1: 0.5745
 epoch: 72, train_loss: 0.7466, test_loss: 0.9786, test_f1: 0.6025
 epoch: 73, train_loss: 0.7250, test_loss: 0.9940, test_f1: 0.6183
 epoch: 74, train_loss: 0.7322, test_loss: 0.9604, test_f1: 0.5679
 epoch: 75, train_loss: 0.7070, test_loss: 0.9859, test_f1: 0.6169
 epoch: 76, train_loss: 0.7094, test_loss: 0.9837, test_f1: 0.5964
 epoch: 77, train_loss: 0.7155, test_loss: 1.1160, test_f1: 0.5556
 epoch: 78, train_loss: 0.6992, test_loss: 1.0831, test_f1: 0.5892
 epoch: 79, train_loss: 0.7197, test_loss: 0.9813, test_f1: 0.5994
 epoch: 80, train_loss: 0.7166, test_loss: 1.1117, test_f1: 0.5451
 epoch: 81, train_loss: 0.6912, test_loss: 1.0874, test_f1: 0.5839
 epoch: 82, train_loss: 0.7122, test_loss: 1.0823, test_f1: 0.5640
 epoch: 83, train_loss: 0.6917, test_loss: 1.0695, test_f1: 0.5984
 epoch: 84, train_loss: 0.6979, test_loss: 1.0570, test_f1: 0.6079
 epoch: 85, train_loss: 0.7074, test_loss: 1.0330, test_f1: 0.5963
 epoch: 86, train_loss: 0.6897, test_loss: 1.0693, test_f1: 0.5824
 epoch: 87, train_loss: 0.7019, test_loss: 1.0956, test_f1: 0.5505
 epoch: 88, train_loss: 0.7174, test_loss: 1.0764, test_f1: 0.5757
 epoch: 89, train_loss: 0.6848, test_loss: 0.9991, test_f1: 0.5945
 epoch: 90, train_loss: 0.6979, test_loss: 1.1514, test_f1: 0.5686
 epoch: 91, train_loss: 0.6675, test_loss: 1.1740, test_f1: 0.5854
 epoch: 92, train_loss: 0.6812, test_loss: 1.0341, test_f1: 0.6040
 epoch: 93, train_loss: 0.6932, test_loss: 1.0382, test_f1: 0.5968
 epoch: 94, train_loss: 0.6582, test_loss: 1.0845, test_f1: 0.5853
 epoch: 95, train_loss: 0.6654, test_loss: 1.1896, test_f1: 0.5292
 epoch: 96, train_loss: 0.6812, test_loss: 1.0586, test_f1: 0.6125
 epoch: 97, train_loss: 0.6546, test_loss: 1.1048, test_f1: 0.6047
 epoch: 98, train_loss: 0.6802, test_loss: 1.1150, test_f1: 0.6155
 epoch: 99, train_loss: 0.6807, test_loss: 1.1613, test_f1: 0.6113
##################ITERATION #5 ****************************************
 epoch: 0, train_loss: 1.1550, test_loss: 1.2351, test_f1: 0.3714
 epoch: 1, train_loss: 1.0296, test_loss: 1.2179, test_f1: 0.3332
 epoch: 2, train_loss: 0.9986, test_loss: 1.1668, test_f1: 0.4216
 epoch: 3, train_loss: 0.9898, test_loss: 1.1328, test_f1: 0.4555
 epoch: 4, train_loss: 0.9849, test_loss: 1.0428, test_f1: 0.5113
 epoch: 5, train_loss: 0.9584, test_loss: 0.9785, test_f1: 0.5289
 epoch: 6, train_loss: 0.9153, test_loss: 1.0206, test_f1: 0.4878
 epoch: 7, train_loss: 0.9033, test_loss: 1.0125, test_f1: 0.4754
 epoch: 8, train_loss: 0.9090, test_loss: 1.2105, test_f1: 0.4688
 epoch: 9, train_loss: 0.8792, test_loss: 0.9943, test_f1: 0.5582
 epoch: 10, train_loss: 0.8724, test_loss: 0.9788, test_f1: 0.5234
 epoch: 11, train_loss: 0.8684, test_loss: 1.5144, test_f1: 0.4429
 epoch: 12, train_loss: 0.8613, test_loss: 1.0573, test_f1: 0.5320
 epoch: 13, train_loss: 0.8603, test_loss: 1.0203, test_f1: 0.4766
 epoch: 14, train_loss: 0.8754, test_loss: 0.9928, test_f1: 0.4733
 epoch: 15, train_loss: 0.8621, test_loss: 0.9887, test_f1: 0.5733
 epoch: 16, train_loss: 0.8553, test_loss: 1.6109, test_f1: 0.3603
 epoch: 17, train_loss: 0.8313, test_loss: 1.0192, test_f1: 0.5593
 epoch: 18, train_loss: 0.8235, test_loss: 1.3851, test_f1: 0.5050
 epoch: 19, train_loss: 0.8320, test_loss: 0.9916, test_f1: 0.5523
 epoch: 20, train_loss: 0.8362, test_loss: 1.1993, test_f1: 0.4738
 epoch: 21, train_loss: 0.8258, test_loss: 0.9599, test_f1: 0.6553
 epoch: 22, train_loss: 0.8270, test_loss: 0.9983, test_f1: 0.5795
 epoch: 23, train_loss: 0.8205, test_loss: 1.0270, test_f1: 0.5486
 epoch: 24, train_loss: 0.8150, test_loss: 1.0127, test_f1: 0.5627
 epoch: 25, train_loss: 0.7958, test_loss: 1.0354, test_f1: 0.5463
 epoch: 26, train_loss: 0.8183, test_loss: 1.2250, test_f1: 0.4980
 epoch: 27, train_loss: 0.7916, test_loss: 1.0163, test_f1: 0.5051
 epoch: 28, train_loss: 0.8034, test_loss: 1.3787, test_f1: 0.4675
 epoch: 29, train_loss: 0.8026, test_loss: 1.2290, test_f1: 0.4627
 epoch: 30, train_loss: 0.7801, test_loss: 1.0929, test_f1: 0.4696
 epoch: 31, train_loss: 0.8107, test_loss: 0.9742, test_f1: 0.6287
 epoch: 32, train_loss: 0.8028, test_loss: 1.3015, test_f1: 0.4764
 epoch: 33, train_loss: 0.8011, test_loss: 1.0809, test_f1: 0.4916
 epoch: 34, train_loss: 0.7900, test_loss: 2.3347, test_f1: 0.3847
 epoch: 35, train_loss: 0.8084, test_loss: 1.0740, test_f1: 0.5342
 epoch: 36, train_loss: 0.7933, test_loss: 0.9874, test_f1: 0.5491
 epoch: 37, train_loss: 0.7818, test_loss: 1.2026, test_f1: 0.5524
 epoch: 38, train_loss: 0.7746, test_loss: 1.1045, test_f1: 0.5509
 epoch: 39, train_loss: 0.8238, test_loss: 1.0952, test_f1: 0.5575
 epoch: 40, train_loss: 0.7992, test_loss: 0.9749, test_f1: 0.5676
 epoch: 41, train_loss: 0.8072, test_loss: 1.0009, test_f1: 0.5637
 epoch: 42, train_loss: 0.7926, test_loss: 1.0053, test_f1: 0.6198
 epoch: 43, train_loss: 0.7703, test_loss: 1.0877, test_f1: 0.5453
 epoch: 44, train_loss: 0.7936, test_loss: 1.1342, test_f1: 0.5419
 epoch: 45, train_loss: 0.7841, test_loss: 1.0055, test_f1: 0.5438
 epoch: 46, train_loss: 0.7507, test_loss: 1.0074, test_f1: 0.5984
 epoch: 47, train_loss: 0.7706, test_loss: 1.0561, test_f1: 0.5571
 epoch: 48, train_loss: 0.7613, test_loss: 1.0104, test_f1: 0.5265
 epoch: 49, train_loss: 0.7918, test_loss: 1.0441, test_f1: 0.5941
 epoch: 50, train_loss: 0.7907, test_loss: 0.9771, test_f1: 0.5215
 epoch: 51, train_loss: 0.7532, test_loss: 0.9868, test_f1: 0.6176
 epoch: 52, train_loss: 0.7570, test_loss: 1.0533, test_f1: 0.5746
 epoch: 53, train_loss: 0.7257, test_loss: 1.0321, test_f1: 0.6193
 epoch: 54, train_loss: 0.7424, test_loss: 0.9889, test_f1: 0.6040
 epoch: 55, train_loss: 0.7460, test_loss: 1.0185, test_f1: 0.5909
 epoch: 56, train_loss: 0.7552, test_loss: 1.0348, test_f1: 0.5917
 epoch: 57, train_loss: 0.7437, test_loss: 1.0368, test_f1: 0.5776
 epoch: 58, train_loss: 0.7366, test_loss: 0.9915, test_f1: 0.6092
 epoch: 59, train_loss: 0.7385, test_loss: 1.0104, test_f1: 0.6170
 epoch: 60, train_loss: 0.7320, test_loss: 1.1259, test_f1: 0.5403
 epoch: 61, train_loss: 0.7205, test_loss: 1.0652, test_f1: 0.5905
 epoch: 62, train_loss: 0.7185, test_loss: 0.9795, test_f1: 0.5947
 epoch: 63, train_loss: 0.7245, test_loss: 1.2513, test_f1: 0.5471
 epoch: 64, train_loss: 0.7252, test_loss: 1.0785, test_f1: 0.5617
 epoch: 65, train_loss: 0.7260, test_loss: 1.0397, test_f1: 0.5343
 epoch: 66, train_loss: 0.7257, test_loss: 1.1024, test_f1: 0.5742
 epoch: 67, train_loss: 0.7353, test_loss: 1.0261, test_f1: 0.5423
 epoch: 68, train_loss: 0.6908, test_loss: 1.0441, test_f1: 0.5505
 epoch: 69, train_loss: 0.7048, test_loss: 0.9967, test_f1: 0.5991
 epoch: 70, train_loss: 0.7313, test_loss: 1.0274, test_f1: 0.5491
 epoch: 71, train_loss: 0.7317, test_loss: 1.1847, test_f1: 0.5611
 epoch: 72, train_loss: 0.7164, test_loss: 0.9924, test_f1: 0.6043
 epoch: 73, train_loss: 0.7258, test_loss: 1.0406, test_f1: 0.5557
 epoch: 74, train_loss: 0.7058, test_loss: 1.1303, test_f1: 0.5591
 epoch: 75, train_loss: 0.7096, test_loss: 1.0482, test_f1: 0.5635
 epoch: 76, train_loss: 0.7091, test_loss: 1.0540, test_f1: 0.5567
 epoch: 77, train_loss: 0.6978, test_loss: 0.9826, test_f1: 0.6320
 epoch: 78, train_loss: 0.6899, test_loss: 1.1225, test_f1: 0.5657
 epoch: 79, train_loss: 0.6871, test_loss: 1.0587, test_f1: 0.5572
 epoch: 80, train_loss: 0.6720, test_loss: 1.1149, test_f1: 0.5571
 epoch: 81, train_loss: 0.6967, test_loss: 1.1330, test_f1: 0.5688
 epoch: 82, train_loss: 0.7140, test_loss: 1.1739, test_f1: 0.5763
 epoch: 83, train_loss: 0.7303, test_loss: 1.2067, test_f1: 0.5650
 epoch: 84, train_loss: 0.6855, test_loss: 1.1574, test_f1: 0.5890
 epoch: 85, train_loss: 0.6759, test_loss: 1.0348, test_f1: 0.5217
 epoch: 86, train_loss: 0.6912, test_loss: 1.3780, test_f1: 0.5664
 epoch: 87, train_loss: 0.7057, test_loss: 1.0924, test_f1: 0.5456
 epoch: 88, train_loss: 0.6616, test_loss: 1.0726, test_f1: 0.5321
 epoch: 89, train_loss: 0.6969, test_loss: 1.2691, test_f1: 0.5673
 epoch: 90, train_loss: 0.7054, test_loss: 1.0394, test_f1: 0.5723
 epoch: 91, train_loss: 0.6754, test_loss: 1.1375, test_f1: 0.5749
 epoch: 92, train_loss: 0.7016, test_loss: 1.2873, test_f1: 0.6130
 epoch: 93, train_loss: 0.6755, test_loss: 1.2843, test_f1: 0.5963
 epoch: 94, train_loss: 0.7039, test_loss: 1.2195, test_f1: 0.5907
 epoch: 95, train_loss: 0.6873, test_loss: 1.0756, test_f1: 0.5738
 epoch: 96, train_loss: 0.6564, test_loss: 0.9952, test_f1: 0.6077
 epoch: 97, train_loss: 0.6824, test_loss: 1.2978, test_f1: 0.5837
 epoch: 98, train_loss: 0.6672, test_loss: 1.2093, test_f1: 0.6109
 epoch: 99, train_loss: 0.6683, test_loss: 1.1626, test_f1: 0.6126
##################ITERATION #6 ****************************************
 epoch: 0, train_loss: 1.1334, test_loss: 1.2094, test_f1: 0.3966
 epoch: 1, train_loss: 1.0324, test_loss: 1.0764, test_f1: 0.4535
 epoch: 2, train_loss: 0.9828, test_loss: 1.0322, test_f1: 0.4293
 epoch: 3, train_loss: 1.0122, test_loss: 1.0725, test_f1: 0.4040
 epoch: 4, train_loss: 0.9758, test_loss: 1.0770, test_f1: 0.5217
 epoch: 5, train_loss: 0.9719, test_loss: 1.0443, test_f1: 0.5297
 epoch: 6, train_loss: 0.9497, test_loss: 1.0984, test_f1: 0.5200
 epoch: 7, train_loss: 0.9353, test_loss: 1.1352, test_f1: 0.3799
 epoch: 8, train_loss: 0.9347, test_loss: 1.0052, test_f1: 0.5550
 epoch: 9, train_loss: 0.9031, test_loss: 1.1037, test_f1: 0.5403
 epoch: 10, train_loss: 0.9085, test_loss: 1.0104, test_f1: 0.5262
 epoch: 11, train_loss: 0.8877, test_loss: 1.6940, test_f1: 0.3870
 epoch: 12, train_loss: 0.9120, test_loss: 1.0386, test_f1: 0.5195
 epoch: 13, train_loss: 0.8955, test_loss: 1.0323, test_f1: 0.5103
 epoch: 14, train_loss: 0.8713, test_loss: 0.9736, test_f1: 0.5334
 epoch: 15, train_loss: 0.8538, test_loss: 1.0540, test_f1: 0.5201
 epoch: 16, train_loss: 0.8643, test_loss: 1.1169, test_f1: 0.5537
 epoch: 17, train_loss: 0.8793, test_loss: 1.0212, test_f1: 0.4735
 epoch: 18, train_loss: 0.8408, test_loss: 1.0409, test_f1: 0.5405
 epoch: 19, train_loss: 0.8527, test_loss: 1.0141, test_f1: 0.5680
 epoch: 20, train_loss: 0.8497, test_loss: 0.9694, test_f1: 0.5720
 epoch: 21, train_loss: 0.8638, test_loss: 1.0521, test_f1: 0.5803
 epoch: 22, train_loss: 0.8368, test_loss: 0.9692, test_f1: 0.5682
 epoch: 23, train_loss: 0.8099, test_loss: 0.9703, test_f1: 0.5882
 epoch: 24, train_loss: 0.8287, test_loss: 0.9787, test_f1: 0.5866
 epoch: 25, train_loss: 0.8064, test_loss: 1.0656, test_f1: 0.5425
 epoch: 26, train_loss: 0.8325, test_loss: 0.9790, test_f1: 0.5760
 epoch: 27, train_loss: 0.8055, test_loss: 1.1210, test_f1: 0.5579
 epoch: 28, train_loss: 0.8164, test_loss: 1.0351, test_f1: 0.5365
 epoch: 29, train_loss: 0.8449, test_loss: 0.9943, test_f1: 0.5442
 epoch: 30, train_loss: 0.8154, test_loss: 1.0342, test_f1: 0.5405
 epoch: 31, train_loss: 0.8516, test_loss: 0.9977, test_f1: 0.5853
 epoch: 32, train_loss: 0.7853, test_loss: 0.9873, test_f1: 0.5666
 epoch: 33, train_loss: 0.7806, test_loss: 0.9949, test_f1: 0.5347
 epoch: 34, train_loss: 0.7805, test_loss: 1.0744, test_f1: 0.5510
 epoch: 35, train_loss: 0.7865, test_loss: 1.0369, test_f1: 0.5513
 epoch: 36, train_loss: 0.7740, test_loss: 1.5446, test_f1: 0.4754
 epoch: 37, train_loss: 0.7954, test_loss: 1.0457, test_f1: 0.5550
 epoch: 38, train_loss: 0.7863, test_loss: 1.2198, test_f1: 0.5164
 epoch: 39, train_loss: 0.7987, test_loss: 0.9659, test_f1: 0.5782
 epoch: 40, train_loss: 0.7833, test_loss: 0.9772, test_f1: 0.5344
 epoch: 41, train_loss: 0.7681, test_loss: 0.9254, test_f1: 0.6327
 epoch: 42, train_loss: 0.7883, test_loss: 0.9465, test_f1: 0.5772
 epoch: 43, train_loss: 0.7738, test_loss: 0.9236, test_f1: 0.6088
 epoch: 44, train_loss: 0.7804, test_loss: 1.0507, test_f1: 0.5344
 epoch: 45, train_loss: 0.7867, test_loss: 1.0324, test_f1: 0.5121
 epoch: 46, train_loss: 0.8002, test_loss: 1.1552, test_f1: 0.5384
 epoch: 47, train_loss: 0.7598, test_loss: 1.0229, test_f1: 0.5245
 epoch: 48, train_loss: 0.7794, test_loss: 1.0250, test_f1: 0.5712
 epoch: 49, train_loss: 0.7562, test_loss: 1.0939, test_f1: 0.5496
 epoch: 50, train_loss: 0.7544, test_loss: 0.9413, test_f1: 0.6236
 epoch: 51, train_loss: 0.7323, test_loss: 1.0633, test_f1: 0.6090
 epoch: 52, train_loss: 0.7203, test_loss: 0.9162, test_f1: 0.6458
 epoch: 53, train_loss: 0.7155, test_loss: 0.9957, test_f1: 0.6143
 epoch: 54, train_loss: 0.6995, test_loss: 1.0265, test_f1: 0.5704
 epoch: 55, train_loss: 0.6911, test_loss: 1.0227, test_f1: 0.5717
 epoch: 56, train_loss: 0.6850, test_loss: 0.9355, test_f1: 0.6433
 epoch: 57, train_loss: 0.6918, test_loss: 0.9480, test_f1: 0.6095
 epoch: 58, train_loss: 0.6971, test_loss: 0.9933, test_f1: 0.5896
 epoch: 59, train_loss: 0.7017, test_loss: 1.1011, test_f1: 0.5789
 epoch: 60, train_loss: 0.7093, test_loss: 1.0298, test_f1: 0.5925
 epoch: 61, train_loss: 0.7047, test_loss: 1.1432, test_f1: 0.6002
 epoch: 62, train_loss: 0.6938, test_loss: 1.1578, test_f1: 0.5234
 epoch: 63, train_loss: 0.6946, test_loss: 0.9765, test_f1: 0.5867
 epoch: 64, train_loss: 0.6820, test_loss: 1.0232, test_f1: 0.6276
 epoch: 65, train_loss: 0.6860, test_loss: 1.3508, test_f1: 0.5632
 epoch: 66, train_loss: 0.6883, test_loss: 1.0414, test_f1: 0.5941
 epoch: 67, train_loss: 0.6997, test_loss: 1.0069, test_f1: 0.6113
 epoch: 68, train_loss: 0.6594, test_loss: 0.9580, test_f1: 0.6208
 epoch: 69, train_loss: 0.6682, test_loss: 1.1533, test_f1: 0.5925
 epoch: 70, train_loss: 0.6691, test_loss: 1.1297, test_f1: 0.5650
 epoch: 71, train_loss: 0.6822, test_loss: 1.2744, test_f1: 0.5592
 epoch: 72, train_loss: 0.6586, test_loss: 1.1375, test_f1: 0.5880
 epoch: 73, train_loss: 0.6603, test_loss: 1.0729, test_f1: 0.6248
 epoch: 74, train_loss: 0.6379, test_loss: 1.1439, test_f1: 0.4856
 epoch: 75, train_loss: 0.6516, test_loss: 1.1025, test_f1: 0.5944
 epoch: 76, train_loss: 0.6559, test_loss: 1.0558, test_f1: 0.6099
 epoch: 77, train_loss: 0.6441, test_loss: 1.1305, test_f1: 0.5412
 epoch: 78, train_loss: 0.6499, test_loss: 0.9232, test_f1: 0.6318
 epoch: 79, train_loss: 0.6703, test_loss: 0.9697, test_f1: 0.6086
 epoch: 80, train_loss: 0.6717, test_loss: 1.2042, test_f1: 0.5899
 epoch: 81, train_loss: 0.6519, test_loss: 0.9653, test_f1: 0.6096
 epoch: 82, train_loss: 0.6413, test_loss: 1.0042, test_f1: 0.6024
 epoch: 83, train_loss: 0.6332, test_loss: 1.1831, test_f1: 0.5878
 epoch: 84, train_loss: 0.6435, test_loss: 0.9958, test_f1: 0.5978
 epoch: 85, train_loss: 0.6297, test_loss: 1.0288, test_f1: 0.6253
 epoch: 86, train_loss: 0.6171, test_loss: 1.2076, test_f1: 0.5837
 epoch: 87, train_loss: 0.6142, test_loss: 0.9392, test_f1: 0.6519
 epoch: 88, train_loss: 0.6196, test_loss: 0.9244, test_f1: 0.6613
 epoch: 89, train_loss: 0.6173, test_loss: 1.0269, test_f1: 0.5952
 epoch: 90, train_loss: 0.6193, test_loss: 1.0217, test_f1: 0.6210
 epoch: 91, train_loss: 0.6129, test_loss: 1.3835, test_f1: 0.5613
 epoch: 92, train_loss: 0.6260, test_loss: 1.0321, test_f1: 0.6127
 epoch: 93, train_loss: 0.6279, test_loss: 1.3673, test_f1: 0.6184
 epoch: 94, train_loss: 0.6273, test_loss: 1.2782, test_f1: 0.5871
 epoch: 95, train_loss: 0.6386, test_loss: 1.1921, test_f1: 0.5656
 epoch: 96, train_loss: 0.6293, test_loss: 0.9933, test_f1: 0.6130
 epoch: 97, train_loss: 0.6194, test_loss: 1.2130, test_f1: 0.5823
 epoch: 98, train_loss: 0.6406, test_loss: 0.9171, test_f1: 0.6197
 epoch: 99, train_loss: 0.6266, test_loss: 0.9135, test_f1: 0.6600
##################ITERATION #7 ****************************************
 epoch: 0, train_loss: 1.1411, test_loss: 1.4879, test_f1: 0.2786
 epoch: 1, train_loss: 1.0660, test_loss: 1.1047, test_f1: 0.4110
 epoch: 2, train_loss: 1.0228, test_loss: 1.0911, test_f1: 0.4564
 epoch: 3, train_loss: 1.0227, test_loss: 1.0387, test_f1: 0.5139
 epoch: 4, train_loss: 0.9909, test_loss: 1.0376, test_f1: 0.5304
 epoch: 5, train_loss: 0.9707, test_loss: 1.0589, test_f1: 0.5235
 epoch: 6, train_loss: 0.9622, test_loss: 0.9891, test_f1: 0.5065
 epoch: 7, train_loss: 0.9355, test_loss: 1.0095, test_f1: 0.5373
 epoch: 8, train_loss: 0.9054, test_loss: 1.0112, test_f1: 0.5908
 epoch: 9, train_loss: 0.9088, test_loss: 1.0925, test_f1: 0.5001
 epoch: 10, train_loss: 0.9264, test_loss: 0.9946, test_f1: 0.5384
 epoch: 11, train_loss: 0.9283, test_loss: 1.0896, test_f1: 0.5297
 epoch: 12, train_loss: 0.9049, test_loss: 1.5264, test_f1: 0.3735
 epoch: 13, train_loss: 0.8980, test_loss: 0.9888, test_f1: 0.5594
 epoch: 14, train_loss: 0.8831, test_loss: 1.1655, test_f1: 0.5072
 epoch: 15, train_loss: 0.8618, test_loss: 1.0263, test_f1: 0.5322
 epoch: 16, train_loss: 0.8587, test_loss: 1.3252, test_f1: 0.4059
 epoch: 17, train_loss: 0.8462, test_loss: 0.9864, test_f1: 0.5729
 epoch: 18, train_loss: 0.8550, test_loss: 1.0687, test_f1: 0.5191
 epoch: 19, train_loss: 0.8517, test_loss: 0.9971, test_f1: 0.5534
 epoch: 20, train_loss: 0.8549, test_loss: 0.9887, test_f1: 0.5775
 epoch: 21, train_loss: 0.8299, test_loss: 1.0906, test_f1: 0.5057
 epoch: 22, train_loss: 0.8493, test_loss: 1.1003, test_f1: 0.4880
 epoch: 23, train_loss: 0.8570, test_loss: 1.0030, test_f1: 0.5645
 epoch: 24, train_loss: 0.8108, test_loss: 1.1471, test_f1: 0.4622
 epoch: 25, train_loss: 0.8274, test_loss: 1.0078, test_f1: 0.5887
 epoch: 26, train_loss: 0.8273, test_loss: 1.1025, test_f1: 0.5219
 epoch: 27, train_loss: 0.8188, test_loss: 1.0560, test_f1: 0.5639
 epoch: 28, train_loss: 0.8402, test_loss: 1.1172, test_f1: 0.5331
 epoch: 29, train_loss: 0.8154, test_loss: 0.9666, test_f1: 0.5903
 epoch: 30, train_loss: 0.8255, test_loss: 1.0412, test_f1: 0.5416
 epoch: 31, train_loss: 0.8110, test_loss: 0.9662, test_f1: 0.5972
 epoch: 32, train_loss: 0.7971, test_loss: 1.1518, test_f1: 0.5263
 epoch: 33, train_loss: 0.8250, test_loss: 1.0252, test_f1: 0.5195
 epoch: 34, train_loss: 0.8203, test_loss: 1.1167, test_f1: 0.5365
 epoch: 35, train_loss: 0.8004, test_loss: 1.1147, test_f1: 0.5195
 epoch: 36, train_loss: 0.8145, test_loss: 1.0330, test_f1: 0.5319
 epoch: 37, train_loss: 0.8166, test_loss: 1.0118, test_f1: 0.5623
 epoch: 38, train_loss: 0.8114, test_loss: 1.0093, test_f1: 0.5836
 epoch: 39, train_loss: 0.7820, test_loss: 1.1022, test_f1: 0.5530
 epoch: 40, train_loss: 0.8121, test_loss: 1.1332, test_f1: 0.5220
 epoch: 41, train_loss: 0.7930, test_loss: 0.9965, test_f1: 0.5679
 epoch: 42, train_loss: 0.7716, test_loss: 0.9788, test_f1: 0.5979
 epoch: 43, train_loss: 0.7836, test_loss: 0.9720, test_f1: 0.5771
 epoch: 44, train_loss: 0.7851, test_loss: 1.0335, test_f1: 0.5754
 epoch: 45, train_loss: 0.7744, test_loss: 1.0482, test_f1: 0.5445
 epoch: 46, train_loss: 0.7570, test_loss: 1.0609, test_f1: 0.5674
 epoch: 47, train_loss: 0.7757, test_loss: 1.0261, test_f1: 0.5714
 epoch: 48, train_loss: 0.7735, test_loss: 1.0419, test_f1: 0.5088
 epoch: 49, train_loss: 0.7962, test_loss: 1.0705, test_f1: 0.5939
 epoch: 50, train_loss: 0.7827, test_loss: 0.9684, test_f1: 0.5524
 epoch: 51, train_loss: 0.7399, test_loss: 0.9312, test_f1: 0.6426
 epoch: 52, train_loss: 0.7322, test_loss: 0.9831, test_f1: 0.5958
 epoch: 53, train_loss: 0.7299, test_loss: 1.0037, test_f1: 0.5640
 epoch: 54, train_loss: 0.7309, test_loss: 0.9676, test_f1: 0.6272
 epoch: 55, train_loss: 0.7238, test_loss: 0.9319, test_f1: 0.6052
 epoch: 56, train_loss: 0.7315, test_loss: 1.0117, test_f1: 0.5988
 epoch: 57, train_loss: 0.7241, test_loss: 1.0373, test_f1: 0.5955
 epoch: 58, train_loss: 0.7164, test_loss: 0.9664, test_f1: 0.6160
 epoch: 59, train_loss: 0.7195, test_loss: 0.9513, test_f1: 0.6031
 epoch: 60, train_loss: 0.7212, test_loss: 0.9951, test_f1: 0.5879
 epoch: 61, train_loss: 0.7083, test_loss: 0.9266, test_f1: 0.6237
 epoch: 62, train_loss: 0.7108, test_loss: 1.0349, test_f1: 0.5948
 epoch: 63, train_loss: 0.7148, test_loss: 1.0024, test_f1: 0.6162
 epoch: 64, train_loss: 0.7203, test_loss: 1.0838, test_f1: 0.5333
 epoch: 65, train_loss: 0.7126, test_loss: 0.9245, test_f1: 0.6038
 epoch: 66, train_loss: 0.6987, test_loss: 0.9850, test_f1: 0.6142
 epoch: 67, train_loss: 0.6916, test_loss: 1.0764, test_f1: 0.6091
 epoch: 68, train_loss: 0.7014, test_loss: 0.9720, test_f1: 0.6302
 epoch: 69, train_loss: 0.7166, test_loss: 0.9920, test_f1: 0.6062
 epoch: 70, train_loss: 0.7134, test_loss: 1.0095, test_f1: 0.6131
 epoch: 71, train_loss: 0.7130, test_loss: 0.9516, test_f1: 0.6567
 epoch: 72, train_loss: 0.7168, test_loss: 0.9979, test_f1: 0.5529
 epoch: 73, train_loss: 0.6994, test_loss: 0.9733, test_f1: 0.6171
 epoch: 74, train_loss: 0.6832, test_loss: 1.0366, test_f1: 0.5758
 epoch: 75, train_loss: 0.6939, test_loss: 1.0124, test_f1: 0.6335
 epoch: 76, train_loss: 0.6784, test_loss: 1.0348, test_f1: 0.6385
 epoch: 77, train_loss: 0.6937, test_loss: 0.9935, test_f1: 0.6077
 epoch: 78, train_loss: 0.6746, test_loss: 1.0926, test_f1: 0.6102
 epoch: 79, train_loss: 0.6757, test_loss: 1.0008, test_f1: 0.6238
 epoch: 80, train_loss: 0.6821, test_loss: 1.0399, test_f1: 0.6058
 epoch: 81, train_loss: 0.6635, test_loss: 1.0816, test_f1: 0.5455
 epoch: 82, train_loss: 0.6714, test_loss: 1.0672, test_f1: 0.5529
 epoch: 83, train_loss: 0.6894, test_loss: 1.0515, test_f1: 0.6088
 epoch: 84, train_loss: 0.6793, test_loss: 1.1846, test_f1: 0.5183
 epoch: 85, train_loss: 0.6753, test_loss: 1.1194, test_f1: 0.6106
 epoch: 86, train_loss: 0.6551, test_loss: 0.9588, test_f1: 0.5954
 epoch: 87, train_loss: 0.6615, test_loss: 1.0581, test_f1: 0.5766
 epoch: 88, train_loss: 0.6588, test_loss: 1.0199, test_f1: 0.6322
 epoch: 89, train_loss: 0.6572, test_loss: 0.9711, test_f1: 0.6446
 epoch: 90, train_loss: 0.6612, test_loss: 1.0275, test_f1: 0.6013
 epoch: 91, train_loss: 0.6457, test_loss: 1.0968, test_f1: 0.5887
 epoch: 92, train_loss: 0.6551, test_loss: 1.0524, test_f1: 0.5892
 epoch: 93, train_loss: 0.6810, test_loss: 1.2495, test_f1: 0.4730
 epoch: 94, train_loss: 0.6696, test_loss: 1.0951, test_f1: 0.5791
 epoch: 95, train_loss: 0.6386, test_loss: 1.0462, test_f1: 0.5807
 epoch: 96, train_loss: 0.6704, test_loss: 1.1029, test_f1: 0.5993
 epoch: 97, train_loss: 0.6656, test_loss: 1.0379, test_f1: 0.6137
 epoch: 98, train_loss: 0.6639, test_loss: 1.0545, test_f1: 0.5813
 epoch: 99, train_loss: 0.6765, test_loss: 1.1275, test_f1: 0.5733
##################ITERATION #8 ****************************************
 epoch: 0, train_loss: 1.1557, test_loss: 1.1734, test_f1: 0.3018
 epoch: 1, train_loss: 1.0136, test_loss: 1.1537, test_f1: 0.4152
 epoch: 2, train_loss: 0.9859, test_loss: 1.0353, test_f1: 0.5139
 epoch: 3, train_loss: 0.9609, test_loss: 1.0111, test_f1: 0.4411
 epoch: 4, train_loss: 0.9606, test_loss: 1.0207, test_f1: 0.4023
 epoch: 5, train_loss: 0.9538, test_loss: 1.0304, test_f1: 0.5429
 epoch: 6, train_loss: 0.8972, test_loss: 1.0950, test_f1: 0.5053
 epoch: 7, train_loss: 0.8955, test_loss: 1.0286, test_f1: 0.5406
 epoch: 8, train_loss: 0.8811, test_loss: 0.9828, test_f1: 0.5166
 epoch: 9, train_loss: 0.8987, test_loss: 0.9651, test_f1: 0.5250
 epoch: 10, train_loss: 0.8693, test_loss: 0.9585, test_f1: 0.4923
 epoch: 11, train_loss: 0.8737, test_loss: 1.0322, test_f1: 0.5452
 epoch: 12, train_loss: 0.8720, test_loss: 0.9902, test_f1: 0.5606
 epoch: 13, train_loss: 0.8603, test_loss: 1.0808, test_f1: 0.5569
 epoch: 14, train_loss: 0.8422, test_loss: 0.9364, test_f1: 0.4451
 epoch: 15, train_loss: 0.8557, test_loss: 0.9839, test_f1: 0.5533
 epoch: 16, train_loss: 0.8448, test_loss: 0.9970, test_f1: 0.5518
 epoch: 17, train_loss: 0.8549, test_loss: 0.9853, test_f1: 0.5746
 epoch: 18, train_loss: 0.8451, test_loss: 0.9902, test_f1: 0.4989
 epoch: 19, train_loss: 0.8367, test_loss: 1.0651, test_f1: 0.5561
 epoch: 20, train_loss: 0.8096, test_loss: 1.3308, test_f1: 0.4891
 epoch: 21, train_loss: 0.8318, test_loss: 0.9640, test_f1: 0.5669
 epoch: 22, train_loss: 0.8275, test_loss: 0.9908, test_f1: 0.5493
 epoch: 23, train_loss: 0.8307, test_loss: 1.0342, test_f1: 0.5533
 epoch: 24, train_loss: 0.8373, test_loss: 1.0309, test_f1: 0.5396
 epoch: 25, train_loss: 0.8173, test_loss: 0.9919, test_f1: 0.5721
 epoch: 26, train_loss: 0.8123, test_loss: 0.9693, test_f1: 0.5839
 epoch: 27, train_loss: 0.7982, test_loss: 1.0111, test_f1: 0.6139
 epoch: 28, train_loss: 0.8055, test_loss: 1.1230, test_f1: 0.5117
 epoch: 29, train_loss: 0.7895, test_loss: 1.0069, test_f1: 0.5974
 epoch: 30, train_loss: 0.8145, test_loss: 1.1985, test_f1: 0.5262
 epoch: 31, train_loss: 0.8290, test_loss: 0.9643, test_f1: 0.6061
 epoch: 32, train_loss: 0.7804, test_loss: 0.9983, test_f1: 0.5346
 epoch: 33, train_loss: 0.7670, test_loss: 1.0440, test_f1: 0.5811
 epoch: 34, train_loss: 0.7620, test_loss: 1.0335, test_f1: 0.5888
 epoch: 35, train_loss: 0.7807, test_loss: 1.1236, test_f1: 0.5571
 epoch: 36, train_loss: 0.7829, test_loss: 1.0683, test_f1: 0.5276
 epoch: 37, train_loss: 0.7525, test_loss: 0.9825, test_f1: 0.6186
 epoch: 38, train_loss: 0.7866, test_loss: 0.9736, test_f1: 0.6010
 epoch: 39, train_loss: 0.8051, test_loss: 1.0846, test_f1: 0.5161
 epoch: 40, train_loss: 0.7892, test_loss: 1.0085, test_f1: 0.5877
 epoch: 41, train_loss: 0.7808, test_loss: 1.0388, test_f1: 0.5817
 epoch: 42, train_loss: 0.7611, test_loss: 1.0022, test_f1: 0.5594
 epoch: 43, train_loss: 0.7822, test_loss: 1.1077, test_f1: 0.5010
 epoch: 44, train_loss: 0.7532, test_loss: 1.0357, test_f1: 0.6334
 epoch: 45, train_loss: 0.7498, test_loss: 1.0634, test_f1: 0.5216
 epoch: 46, train_loss: 0.7645, test_loss: 1.2175, test_f1: 0.4238
 epoch: 47, train_loss: 0.7468, test_loss: 1.1032, test_f1: 0.5777
 epoch: 48, train_loss: 0.7933, test_loss: 1.1736, test_f1: 0.5357
 epoch: 49, train_loss: 0.7925, test_loss: 0.9788, test_f1: 0.6232
 epoch: 50, train_loss: 0.7415, test_loss: 1.0845, test_f1: 0.5463
 epoch: 51, train_loss: 0.7342, test_loss: 1.0495, test_f1: 0.5811
 epoch: 52, train_loss: 0.6996, test_loss: 1.0161, test_f1: 0.5813
 epoch: 53, train_loss: 0.7098, test_loss: 1.0261, test_f1: 0.5936
 epoch: 54, train_loss: 0.7072, test_loss: 1.1226, test_f1: 0.5605
 epoch: 55, train_loss: 0.7100, test_loss: 1.0792, test_f1: 0.5925
 epoch: 56, train_loss: 0.6974, test_loss: 1.0616, test_f1: 0.5635
 epoch: 57, train_loss: 0.6869, test_loss: 1.0858, test_f1: 0.5792
 epoch: 58, train_loss: 0.6874, test_loss: 1.0641, test_f1: 0.6267
 epoch: 59, train_loss: 0.6762, test_loss: 1.1406, test_f1: 0.5772
 epoch: 60, train_loss: 0.6758, test_loss: 1.0756, test_f1: 0.6260
 epoch: 61, train_loss: 0.6778, test_loss: 1.0683, test_f1: 0.6224
 epoch: 62, train_loss: 0.6670, test_loss: 1.1211, test_f1: 0.6065
 epoch: 63, train_loss: 0.6888, test_loss: 1.2098, test_f1: 0.5855
 epoch: 64, train_loss: 0.6769, test_loss: 1.0267, test_f1: 0.6020
 epoch: 65, train_loss: 0.6543, test_loss: 1.0668, test_f1: 0.6167
 epoch: 66, train_loss: 0.6570, test_loss: 1.0495, test_f1: 0.6299
 epoch: 67, train_loss: 0.6469, test_loss: 1.0352, test_f1: 0.6119
 epoch: 68, train_loss: 0.6465, test_loss: 1.1125, test_f1: 0.5733
 epoch: 69, train_loss: 0.6735, test_loss: 1.0551, test_f1: 0.6294
 epoch: 70, train_loss: 0.6721, test_loss: 1.0916, test_f1: 0.6094
 epoch: 71, train_loss: 0.6438, test_loss: 1.0153, test_f1: 0.6323
 epoch: 72, train_loss: 0.6397, test_loss: 1.1506, test_f1: 0.6143
 epoch: 73, train_loss: 0.6445, test_loss: 1.0112, test_f1: 0.6404
 epoch: 74, train_loss: 0.6427, test_loss: 1.0786, test_f1: 0.5753
 epoch: 75, train_loss: 0.6483, test_loss: 1.0305, test_f1: 0.6208
 epoch: 76, train_loss: 0.6358, test_loss: 0.9919, test_f1: 0.6484
 epoch: 77, train_loss: 0.6280, test_loss: 1.0903, test_f1: 0.6042
 epoch: 78, train_loss: 0.6384, test_loss: 1.1008, test_f1: 0.5838
 epoch: 79, train_loss: 0.6202, test_loss: 1.0642, test_f1: 0.6304
 epoch: 80, train_loss: 0.6444, test_loss: 1.0200, test_f1: 0.6374
 epoch: 81, train_loss: 0.6266, test_loss: 1.0397, test_f1: 0.6232
 epoch: 82, train_loss: 0.6215, test_loss: 1.1151, test_f1: 0.6057
 epoch: 83, train_loss: 0.6049, test_loss: 1.1390, test_f1: 0.5725
 epoch: 84, train_loss: 0.6421, test_loss: 1.1113, test_f1: 0.6091
 epoch: 85, train_loss: 0.6284, test_loss: 1.2227, test_f1: 0.5547
 epoch: 86, train_loss: 0.6220, test_loss: 1.0815, test_f1: 0.6137
 epoch: 87, train_loss: 0.6196, test_loss: 0.9847, test_f1: 0.6416
 epoch: 88, train_loss: 0.6009, test_loss: 1.0820, test_f1: 0.6139
 epoch: 89, train_loss: 0.6420, test_loss: 1.0636, test_f1: 0.6343
 epoch: 90, train_loss: 0.5990, test_loss: 1.0296, test_f1: 0.6224
 epoch: 91, train_loss: 0.6016, test_loss: 1.0755, test_f1: 0.6292
 epoch: 92, train_loss: 0.6126, test_loss: 1.1915, test_f1: 0.6119
 epoch: 93, train_loss: 0.6124, test_loss: 1.0019, test_f1: 0.6557
 epoch: 94, train_loss: 0.6027, test_loss: 1.2000, test_f1: 0.5895
 epoch: 95, train_loss: 0.6390, test_loss: 1.0189, test_f1: 0.6096
 epoch: 96, train_loss: 0.5968, test_loss: 1.0629, test_f1: 0.6437
 epoch: 97, train_loss: 0.5934, test_loss: 1.0980, test_f1: 0.6124
 epoch: 98, train_loss: 0.6308, test_loss: 1.3722, test_f1: 0.5436
 epoch: 99, train_loss: 0.5832, test_loss: 1.1616, test_f1: 0.5995
##################ITERATION #9 ****************************************
 epoch: 0, train_loss: 1.1326, test_loss: 1.1618, test_f1: 0.4861
 epoch: 1, train_loss: 0.9731, test_loss: 1.0237, test_f1: 0.4709
 epoch: 2, train_loss: 0.9310, test_loss: 1.1032, test_f1: 0.5136
 epoch: 3, train_loss: 0.9166, test_loss: 1.0412, test_f1: 0.5272
 epoch: 4, train_loss: 0.9035, test_loss: 1.0162, test_f1: 0.5109
 epoch: 5, train_loss: 0.9102, test_loss: 1.0524, test_f1: 0.5398
 epoch: 6, train_loss: 0.8832, test_loss: 0.9804, test_f1: 0.5299
 epoch: 7, train_loss: 0.9071, test_loss: 1.0191, test_f1: 0.5451
 epoch: 8, train_loss: 0.8844, test_loss: 1.0331, test_f1: 0.5124
 epoch: 9, train_loss: 0.8728, test_loss: 1.0236, test_f1: 0.5082
 epoch: 10, train_loss: 0.8986, test_loss: 0.9801, test_f1: 0.5774
 epoch: 11, train_loss: 0.8685, test_loss: 1.3372, test_f1: 0.4480
 epoch: 12, train_loss: 0.8621, test_loss: 0.9720, test_f1: 0.5523
 epoch: 13, train_loss: 0.8995, test_loss: 0.9821, test_f1: 0.5524
 epoch: 14, train_loss: 0.8866, test_loss: 0.9637, test_f1: 0.5575
 epoch: 15, train_loss: 0.8713, test_loss: 1.0003, test_f1: 0.5254
 epoch: 16, train_loss: 0.8703, test_loss: 0.9971, test_f1: 0.5720
 epoch: 17, train_loss: 0.8572, test_loss: 0.9860, test_f1: 0.5601
 epoch: 18, train_loss: 0.8568, test_loss: 1.0043, test_f1: 0.5696
 epoch: 19, train_loss: 0.8830, test_loss: 1.1000, test_f1: 0.5132
 epoch: 20, train_loss: 0.8503, test_loss: 1.0209, test_f1: 0.5156
 epoch: 21, train_loss: 0.8541, test_loss: 1.0322, test_f1: 0.5566
 epoch: 22, train_loss: 0.8701, test_loss: 0.9822, test_f1: 0.5498
 epoch: 23, train_loss: 0.8481, test_loss: 1.0925, test_f1: 0.5364
 epoch: 24, train_loss: 0.8514, test_loss: 1.0076, test_f1: 0.5775
 epoch: 25, train_loss: 0.8327, test_loss: 1.0051, test_f1: 0.5406
 epoch: 26, train_loss: 0.8277, test_loss: 1.0666, test_f1: 0.5301
 epoch: 27, train_loss: 0.8370, test_loss: 1.2976, test_f1: 0.4784
 epoch: 28, train_loss: 0.8454, test_loss: 1.1298, test_f1: 0.5392
 epoch: 29, train_loss: 0.8407, test_loss: 1.0858, test_f1: 0.5495
 epoch: 30, train_loss: 0.8262, test_loss: 1.0585, test_f1: 0.5290
 epoch: 31, train_loss: 0.8261, test_loss: 1.2890, test_f1: 0.5129
 epoch: 32, train_loss: 0.8483, test_loss: 1.0419, test_f1: 0.5284
 epoch: 33, train_loss: 0.8531, test_loss: 1.0289, test_f1: 0.5763
 epoch: 34, train_loss: 0.8306, test_loss: 1.0374, test_f1: 0.5842
 epoch: 35, train_loss: 0.8262, test_loss: 1.0840, test_f1: 0.5366
 epoch: 36, train_loss: 0.8148, test_loss: 1.2815, test_f1: 0.5293
 epoch: 37, train_loss: 0.8370, test_loss: 1.4641, test_f1: 0.4976
 epoch: 38, train_loss: 0.8367, test_loss: 1.0520, test_f1: 0.5665
 epoch: 39, train_loss: 0.8370, test_loss: 1.1719, test_f1: 0.5133
 epoch: 40, train_loss: 0.8195, test_loss: 1.0587, test_f1: 0.5221
 epoch: 41, train_loss: 0.8268, test_loss: 1.1980, test_f1: 0.5038
 epoch: 42, train_loss: 0.8044, test_loss: 1.0864, test_f1: 0.5351
 epoch: 43, train_loss: 0.8108, test_loss: 1.3012, test_f1: 0.5169
 epoch: 44, train_loss: 0.8520, test_loss: 1.0723, test_f1: 0.5613
 epoch: 45, train_loss: 0.8248, test_loss: 1.0192, test_f1: 0.5808
 epoch: 46, train_loss: 0.8379, test_loss: 1.0525, test_f1: 0.5467
 epoch: 47, train_loss: 0.8115, test_loss: 1.0085, test_f1: 0.5488
 epoch: 48, train_loss: 0.8291, test_loss: 1.0389, test_f1: 0.5632
 epoch: 49, train_loss: 0.8214, test_loss: 0.9977, test_f1: 0.5794
 epoch: 50, train_loss: 0.8113, test_loss: 0.9950, test_f1: 0.5881
 epoch: 51, train_loss: 0.7847, test_loss: 1.0171, test_f1: 0.5745
 epoch: 52, train_loss: 0.7910, test_loss: 1.0423, test_f1: 0.5017
 epoch: 53, train_loss: 0.7736, test_loss: 0.9952, test_f1: 0.5908
 epoch: 54, train_loss: 0.7816, test_loss: 1.0701, test_f1: 0.5794
 epoch: 55, train_loss: 0.7879, test_loss: 1.0323, test_f1: 0.5996
 epoch: 56, train_loss: 0.7968, test_loss: 1.0093, test_f1: 0.5541
 epoch: 57, train_loss: 0.7631, test_loss: 1.0415, test_f1: 0.5828
 epoch: 58, train_loss: 0.7697, test_loss: 1.0219, test_f1: 0.5870
 epoch: 59, train_loss: 0.7671, test_loss: 1.0254, test_f1: 0.5855
 epoch: 60, train_loss: 0.7669, test_loss: 1.0226, test_f1: 0.4612
 epoch: 61, train_loss: 0.7611, test_loss: 1.0184, test_f1: 0.6063
 epoch: 62, train_loss: 0.7646, test_loss: 1.0358, test_f1: 0.5535
 epoch: 63, train_loss: 0.7635, test_loss: 1.0208, test_f1: 0.5808
 epoch: 64, train_loss: 0.7523, test_loss: 1.0241, test_f1: 0.5841
 epoch: 65, train_loss: 0.7680, test_loss: 1.0585, test_f1: 0.5339
 epoch: 66, train_loss: 0.7673, test_loss: 1.0754, test_f1: 0.5484
 epoch: 67, train_loss: 0.7682, test_loss: 1.1009, test_f1: 0.5381
 epoch: 68, train_loss: 0.7537, test_loss: 1.0433, test_f1: 0.5994
 epoch: 69, train_loss: 0.7551, test_loss: 1.0171, test_f1: 0.5789
 epoch: 70, train_loss: 0.7447, test_loss: 1.1384, test_f1: 0.5555
 epoch: 71, train_loss: 0.7463, test_loss: 1.0468, test_f1: 0.5916
 epoch: 72, train_loss: 0.7655, test_loss: 1.2005, test_f1: 0.5689
 epoch: 73, train_loss: 0.7517, test_loss: 1.0432, test_f1: 0.5527
 epoch: 74, train_loss: 0.7494, test_loss: 1.0683, test_f1: 0.6149
 epoch: 75, train_loss: 0.7605, test_loss: 1.0758, test_f1: 0.5683
 epoch: 76, train_loss: 0.7505, test_loss: 1.0789, test_f1: 0.5880
 epoch: 77, train_loss: 0.7362, test_loss: 1.1622, test_f1: 0.5594
 epoch: 78, train_loss: 0.7365, test_loss: 1.1987, test_f1: 0.5682
 epoch: 79, train_loss: 0.7557, test_loss: 1.0306, test_f1: 0.5760
 epoch: 80, train_loss: 0.7411, test_loss: 0.9764, test_f1: 0.5428
 epoch: 81, train_loss: 0.7808, test_loss: 0.9990, test_f1: 0.6344
 epoch: 82, train_loss: 0.7439, test_loss: 0.9779, test_f1: 0.6113
 epoch: 83, train_loss: 0.7409, test_loss: 1.0120, test_f1: 0.5747
 epoch: 84, train_loss: 0.7375, test_loss: 1.0933, test_f1: 0.5732
 epoch: 85, train_loss: 0.7286, test_loss: 1.0964, test_f1: 0.5629
 epoch: 86, train_loss: 0.7309, test_loss: 1.0212, test_f1: 0.5940
 epoch: 87, train_loss: 0.7547, test_loss: 0.9808, test_f1: 0.6052
 epoch: 88, train_loss: 0.7391, test_loss: 1.0317, test_f1: 0.5926
 epoch: 89, train_loss: 0.7284, test_loss: 1.0481, test_f1: 0.5610
 epoch: 90, train_loss: 0.7208, test_loss: 1.0218, test_f1: 0.5885
 epoch: 91, train_loss: 0.7564, test_loss: 1.0971, test_f1: 0.5795
 epoch: 92, train_loss: 0.7195, test_loss: 1.0596, test_f1: 0.5216
 epoch: 93, train_loss: 0.7194, test_loss: 1.0652, test_f1: 0.5598
 epoch: 94, train_loss: 0.7062, test_loss: 1.0803, test_f1: 0.5528
 epoch: 95, train_loss: 0.7102, test_loss: 1.0751, test_f1: 0.6065
 epoch: 96, train_loss: 0.7073, test_loss: 1.0172, test_f1: 0.6368
 epoch: 97, train_loss: 0.7004, test_loss: 0.9923, test_f1: 0.6300
 epoch: 98, train_loss: 0.6905, test_loss: 1.0588, test_f1: 0.6167
 epoch: 99, train_loss: 0.7217, test_loss: 1.1893, test_f1: 0.4614

Training completed in 659.11 seconds
Best F1: 0.6613 at epoch 88
Mean F1 across iterations: 0.6473  0.0128
========================FINAL RESULTS================================
FEGIN weighted F1: 0.6613  0.0128
python main.py --data ltspice_demos --representation component_pin_net --model FEGIN --layers 4 --hiddens 16 --batch_size 32 --lr 0.01 --emb_size 250 --epochs 100 --save_appendix component_pin_net_L4_H16_BS32_LR0.01_E250 --no_val
-----



STDERR:
  File "main.py", line 370, in <module>
    main()
  File "main.py", line 254, in main
    dataset = dataset_class(
  File "/home/philip/projects/ltspice_examples_code_repo/Circuit-Completion-Using-GNNs/component_classification_with_link_prediction_head/evaluation/FEGIN/kernel/circuit_datasets.py", line 15, in __init__
    self.data, self.slices = torch.load(self.processed_paths[0])
  File "/home/philip/.local/lib/python3.8/site-packages/torch/serialization.py", line 1040, in load
    warnings.warn(
  File "/usr/lib/python3.8/warnings.py", line 109, in _showwarnmsg
    sw(msg.message, msg.category, msg.filename, msg.lineno,
  File "main.py", line 47, in warn_with_traceback
    traceback.print_stack(file=log)
/home/philip/projects/ltspice_examples_code_repo/Circuit-Completion-Using-GNNs/component_classification_with_link_prediction_head/evaluation/FEGIN/kernel/circuit_datasets.py:15: FutureWarning: You are using `torch.load` with `weights_only=False` (the current default value), which uses the default pickle module implicitly. It is possible to construct malicious pickle data which will execute arbitrary code during unpickling (See https://github.com/pytorch/pytorch/blob/main/SECURITY.md#untrusted-models for more details). In a future release, the default value for `weights_only` will be flipped to `True`. This limits the functions that could be executed during unpickling. Arbitrary objects will no longer be allowed to be loaded via this mode unless they are explicitly allowlisted by the user via `torch.serialization.add_safe_globals`. We recommend you start setting `weights_only=True` for any use case where you don't have full control of the loaded file. Please open an issue on GitHub for any issues related to this experimental feature.
  self.data, self.slices = torch.load(self.processed_paths[0])
