STDOUT:
Results will be saved in /home/philip/projects/ltspice_examples_code_repo/Circuit-Completion-Using-GNNs/component_classification_with_link_prediction_head/evaluation/FEGIN/results/model_FEGIN_dataset_ltspice_demos
Command line input: python main.py --data ltspice_demos --representation component_pin_net --model FEGIN --layers 5 --hiddens 128 --batch_size 256 --lr 0.01 --emb_size 512 --epochs 100 --save_appendix component_pin_net_L5_H128_BS256_LR0.01_E512 --no_val
 is saved.
-----
ltspice_demos - FEGIN
Using 5 layers, 128 hidden units, h = 2
Loading component_pin_net representation dataset
Loading component_pin_net representation data...
Loaded 1948 examples (component_pin_net)
saving path: data/processed/ltspice_demos_component_pin_net_processed.pt
ENTERED
Training FEGIN on component_pin_net representation
Train: 1565, Test: 383
##################ITERATION #0 ****************************************
 epoch: 0, train_loss: 1.3165, test_loss: 1.3600, test_f1: 0.2281
 epoch: 1, train_loss: 1.1946, test_loss: 1.3195, test_f1: 0.1365
 epoch: 2, train_loss: 1.0680, test_loss: 1.4622, test_f1: 0.2281
 epoch: 3, train_loss: 1.0159, test_loss: 1.2034, test_f1: 0.2350
 epoch: 4, train_loss: 0.9810, test_loss: 1.2428, test_f1: 0.3176
 epoch: 5, train_loss: 0.9506, test_loss: 1.0802, test_f1: 0.4020
 epoch: 6, train_loss: 0.9449, test_loss: 1.0282, test_f1: 0.4677
 epoch: 7, train_loss: 0.9386, test_loss: 1.1878, test_f1: 0.4730
 epoch: 8, train_loss: 0.8926, test_loss: 1.2661, test_f1: 0.4276
 epoch: 9, train_loss: 0.9050, test_loss: 1.0613, test_f1: 0.4520
 epoch: 10, train_loss: 0.8913, test_loss: 1.1808, test_f1: 0.5118
 epoch: 11, train_loss: 0.8828, test_loss: 1.0391, test_f1: 0.5405
 epoch: 12, train_loss: 0.8713, test_loss: 1.2282, test_f1: 0.4905
 epoch: 13, train_loss: 0.8624, test_loss: 1.0248, test_f1: 0.5607
 epoch: 14, train_loss: 0.8653, test_loss: 1.0928, test_f1: 0.4252
 epoch: 15, train_loss: 0.8273, test_loss: 1.0006, test_f1: 0.5827
 epoch: 16, train_loss: 0.8063, test_loss: 1.9674, test_f1: 0.4314
 epoch: 17, train_loss: 0.8509, test_loss: 0.9840, test_f1: 0.4688
 epoch: 18, train_loss: 0.8019, test_loss: 1.5252, test_f1: 0.5025
 epoch: 19, train_loss: 0.7996, test_loss: 1.1860, test_f1: 0.5083
 epoch: 20, train_loss: 0.8023, test_loss: 1.1481, test_f1: 0.5373
 epoch: 21, train_loss: 0.8580, test_loss: 1.0984, test_f1: 0.5305
 epoch: 22, train_loss: 0.7846, test_loss: 1.1518, test_f1: 0.4500
 epoch: 23, train_loss: 0.7683, test_loss: 1.5462, test_f1: 0.3657
 epoch: 24, train_loss: 0.7822, test_loss: 1.0586, test_f1: 0.5370
 epoch: 25, train_loss: 0.7703, test_loss: 1.0765, test_f1: 0.5395
 epoch: 26, train_loss: 0.7652, test_loss: 1.2330, test_f1: 0.5194
 epoch: 27, train_loss: 0.7718, test_loss: 1.6221, test_f1: 0.4453
 epoch: 28, train_loss: 0.7383, test_loss: 1.1351, test_f1: 0.5105
 epoch: 29, train_loss: 0.7296, test_loss: 1.1470, test_f1: 0.5745
 epoch: 30, train_loss: 0.7016, test_loss: 1.1098, test_f1: 0.5566
 epoch: 31, train_loss: 0.6859, test_loss: 1.0612, test_f1: 0.5961
 epoch: 32, train_loss: 0.8124, test_loss: 1.0930, test_f1: 0.4484
 epoch: 33, train_loss: 0.7655, test_loss: 1.5124, test_f1: 0.4396
 epoch: 34, train_loss: 0.7007, test_loss: 1.2503, test_f1: 0.5569
 epoch: 35, train_loss: 0.6542, test_loss: 1.5588, test_f1: 0.4107
 epoch: 36, train_loss: 0.6479, test_loss: 2.3500, test_f1: 0.3244
 epoch: 37, train_loss: 0.7039, test_loss: 1.2793, test_f1: 0.4595
 epoch: 38, train_loss: 0.7515, test_loss: 1.0274, test_f1: 0.5875
 epoch: 39, train_loss: 0.6714, test_loss: 1.3159, test_f1: 0.5244
 epoch: 40, train_loss: 0.7430, test_loss: 1.2757, test_f1: 0.4969
 epoch: 41, train_loss: 0.7001, test_loss: 1.2253, test_f1: 0.5524
 epoch: 42, train_loss: 0.6530, test_loss: 1.2525, test_f1: 0.5569
 epoch: 43, train_loss: 0.6477, test_loss: 1.4666, test_f1: 0.5162
 epoch: 44, train_loss: 0.6342, test_loss: 1.2093, test_f1: 0.5456
 epoch: 45, train_loss: 0.5952, test_loss: 1.3225, test_f1: 0.5175
 epoch: 46, train_loss: 0.5917, test_loss: 1.2724, test_f1: 0.5513
 epoch: 47, train_loss: 0.5863, test_loss: 1.1282, test_f1: 0.6325
 epoch: 48, train_loss: 0.5755, test_loss: 1.3862, test_f1: 0.5303
 epoch: 49, train_loss: 0.6098, test_loss: 1.3297, test_f1: 0.6055
 epoch: 50, train_loss: 0.6205, test_loss: 1.5095, test_f1: 0.5188
 epoch: 51, train_loss: 0.6032, test_loss: 1.3008, test_f1: 0.5469
 epoch: 52, train_loss: 0.6033, test_loss: 1.2036, test_f1: 0.5397
 epoch: 53, train_loss: 0.5687, test_loss: 1.4908, test_f1: 0.5153
 epoch: 54, train_loss: 0.5485, test_loss: 1.2853, test_f1: 0.5651
 epoch: 55, train_loss: 0.5387, test_loss: 1.2641, test_f1: 0.5694
 epoch: 56, train_loss: 0.4967, test_loss: 1.4689, test_f1: 0.4980
 epoch: 57, train_loss: 0.4939, test_loss: 1.3948, test_f1: 0.5667
 epoch: 58, train_loss: 0.4606, test_loss: 1.3921, test_f1: 0.5929
 epoch: 59, train_loss: 0.4787, test_loss: 1.3066, test_f1: 0.6177
 epoch: 60, train_loss: 0.4720, test_loss: 1.5311, test_f1: 0.5596
 epoch: 61, train_loss: 0.5017, test_loss: 1.4818, test_f1: 0.5501
 epoch: 62, train_loss: 0.4575, test_loss: 1.5378, test_f1: 0.5682
 epoch: 63, train_loss: 0.4564, test_loss: 1.5720, test_f1: 0.6052
 epoch: 64, train_loss: 0.4285, test_loss: 1.5253, test_f1: 0.5691
 epoch: 65, train_loss: 0.4412, test_loss: 1.4388, test_f1: 0.5630
 epoch: 66, train_loss: 0.4228, test_loss: 1.5183, test_f1: 0.5433
 epoch: 67, train_loss: 0.4184, test_loss: 1.7833, test_f1: 0.5469
 epoch: 68, train_loss: 0.4402, test_loss: 1.6143, test_f1: 0.6120
 epoch: 69, train_loss: 0.4015, test_loss: 1.4731, test_f1: 0.5549
 epoch: 70, train_loss: 0.4153, test_loss: 1.6624, test_f1: 0.5872
 epoch: 71, train_loss: 0.4136, test_loss: 1.5015, test_f1: 0.5497
 epoch: 72, train_loss: 0.3979, test_loss: 1.5789, test_f1: 0.5540
 epoch: 73, train_loss: 0.4463, test_loss: 1.7286, test_f1: 0.5629
 epoch: 74, train_loss: 0.4260, test_loss: 1.8794, test_f1: 0.5251
 epoch: 75, train_loss: 0.3856, test_loss: 1.8286, test_f1: 0.5964
 epoch: 76, train_loss: 0.3600, test_loss: 1.9846, test_f1: 0.6014
 epoch: 77, train_loss: 0.3617, test_loss: 1.6874, test_f1: 0.5780
 epoch: 78, train_loss: 0.3376, test_loss: 1.8598, test_f1: 0.5762
 epoch: 79, train_loss: 0.3408, test_loss: 1.9771, test_f1: 0.5453
 epoch: 80, train_loss: 0.3396, test_loss: 1.8852, test_f1: 0.5698
 epoch: 81, train_loss: 0.3407, test_loss: 2.1854, test_f1: 0.5865
 epoch: 82, train_loss: 0.3508, test_loss: 2.2486, test_f1: 0.5665
 epoch: 83, train_loss: 0.3655, test_loss: 2.2790, test_f1: 0.5438
 epoch: 84, train_loss: 0.3508, test_loss: 2.4564, test_f1: 0.5377
 epoch: 85, train_loss: 0.3323, test_loss: 1.8970, test_f1: 0.5785
 epoch: 86, train_loss: 0.4856, test_loss: 1.5247, test_f1: 0.5521
 epoch: 87, train_loss: 0.4576, test_loss: 1.9885, test_f1: 0.4902
 epoch: 88, train_loss: 0.4005, test_loss: 1.9760, test_f1: 0.5316
 epoch: 89, train_loss: 0.3954, test_loss: 1.8423, test_f1: 0.5948
 epoch: 90, train_loss: 0.3836, test_loss: 1.9663, test_f1: 0.5296
 epoch: 91, train_loss: 0.3956, test_loss: 1.6946, test_f1: 0.6251
 epoch: 92, train_loss: 0.3572, test_loss: 1.9435, test_f1: 0.5746
 epoch: 93, train_loss: 0.3088, test_loss: 1.9768, test_f1: 0.6048
 epoch: 94, train_loss: 0.3430, test_loss: 2.0790, test_f1: 0.5655
 epoch: 95, train_loss: 0.3454, test_loss: 2.0427, test_f1: 0.5612
 epoch: 96, train_loss: 0.3077, test_loss: 1.9375, test_f1: 0.5542
 epoch: 97, train_loss: 0.3177, test_loss: 2.2306, test_f1: 0.5823
 epoch: 98, train_loss: 0.3252, test_loss: 2.3198, test_f1: 0.5557
 epoch: 99, train_loss: 0.2793, test_loss: 2.1350, test_f1: 0.5983
##################ITERATION #1 ****************************************
 epoch: 0, train_loss: 1.3142, test_loss: 1.3133, test_f1: 0.2281
 epoch: 1, train_loss: 1.1007, test_loss: 1.3204, test_f1: 0.2281
 epoch: 2, train_loss: 1.0310, test_loss: 1.2407, test_f1: 0.4090
 epoch: 3, train_loss: 0.9752, test_loss: 1.4297, test_f1: 0.2815
 epoch: 4, train_loss: 0.9799, test_loss: 1.2903, test_f1: 0.4588
 epoch: 5, train_loss: 0.9520, test_loss: 1.1736, test_f1: 0.4858
 epoch: 6, train_loss: 0.9217, test_loss: 1.1382, test_f1: 0.4703
 epoch: 7, train_loss: 0.8967, test_loss: 1.2036, test_f1: 0.4486
 epoch: 8, train_loss: 0.9221, test_loss: 1.5162, test_f1: 0.4390
 epoch: 9, train_loss: 0.8899, test_loss: 1.0375, test_f1: 0.5228
 epoch: 10, train_loss: 0.8806, test_loss: 1.0509, test_f1: 0.5844
 epoch: 11, train_loss: 0.8786, test_loss: 1.0750, test_f1: 0.5043
 epoch: 12, train_loss: 0.9020, test_loss: 0.9961, test_f1: 0.5061
 epoch: 13, train_loss: 0.8749, test_loss: 1.0703, test_f1: 0.5553
 epoch: 14, train_loss: 0.8577, test_loss: 1.2464, test_f1: 0.4683
 epoch: 15, train_loss: 0.8631, test_loss: 1.0794, test_f1: 0.5470
 epoch: 16, train_loss: 0.8200, test_loss: 1.1159, test_f1: 0.5571
 epoch: 17, train_loss: 0.8124, test_loss: 0.9876, test_f1: 0.4878
 epoch: 18, train_loss: 0.7910, test_loss: 1.1580, test_f1: 0.4434
 epoch: 19, train_loss: 0.8112, test_loss: 1.1133, test_f1: 0.4899
 epoch: 20, train_loss: 0.9848, test_loss: 1.2917, test_f1: 0.4329
 epoch: 21, train_loss: 0.8748, test_loss: 1.0054, test_f1: 0.4541
 epoch: 22, train_loss: 0.8579, test_loss: 1.0615, test_f1: 0.4979
 epoch: 23, train_loss: 0.8063, test_loss: 1.3555, test_f1: 0.5203
 epoch: 24, train_loss: 0.7765, test_loss: 1.2932, test_f1: 0.3768
 epoch: 25, train_loss: 0.7411, test_loss: 0.9966, test_f1: 0.5419
 epoch: 26, train_loss: 0.7453, test_loss: 1.1876, test_f1: 0.5327
 epoch: 27, train_loss: 0.7816, test_loss: 1.1504, test_f1: 0.4960
 epoch: 28, train_loss: 0.7188, test_loss: 1.0789, test_f1: 0.6075
 epoch: 29, train_loss: 0.7140, test_loss: 1.1590, test_f1: 0.5886
 epoch: 30, train_loss: 0.7028, test_loss: 1.1501, test_f1: 0.6195
 epoch: 31, train_loss: 0.7482, test_loss: 1.0850, test_f1: 0.6175
 epoch: 32, train_loss: 0.7358, test_loss: 1.0897, test_f1: 0.5226
 epoch: 33, train_loss: 0.6962, test_loss: 1.1581, test_f1: 0.5512
 epoch: 34, train_loss: 0.6706, test_loss: 1.3721, test_f1: 0.4661
 epoch: 35, train_loss: 0.6724, test_loss: 1.2792, test_f1: 0.5265
 epoch: 36, train_loss: 0.6436, test_loss: 1.2018, test_f1: 0.5875
 epoch: 37, train_loss: 0.6619, test_loss: 1.2636, test_f1: 0.5078
 epoch: 38, train_loss: 0.6532, test_loss: 1.4799, test_f1: 0.4469
 epoch: 39, train_loss: 0.6466, test_loss: 1.4020, test_f1: 0.5372
 epoch: 40, train_loss: 0.6402, test_loss: 1.3676, test_f1: 0.5178
 epoch: 41, train_loss: 0.6553, test_loss: 1.2849, test_f1: 0.4962
 epoch: 42, train_loss: 0.7233, test_loss: 1.2967, test_f1: 0.4979
 epoch: 43, train_loss: 0.7003, test_loss: 1.2720, test_f1: 0.5700
 epoch: 44, train_loss: 0.6914, test_loss: 1.4468, test_f1: 0.5606
 epoch: 45, train_loss: 0.6887, test_loss: 1.3541, test_f1: 0.4989
 epoch: 46, train_loss: 0.6786, test_loss: 1.4642, test_f1: 0.5171
 epoch: 47, train_loss: 0.7282, test_loss: 1.1881, test_f1: 0.5426
 epoch: 48, train_loss: 0.7222, test_loss: 1.1192, test_f1: 0.5521
 epoch: 49, train_loss: 0.6726, test_loss: 1.2881, test_f1: 0.5302
 epoch: 50, train_loss: 0.6414, test_loss: 1.1298, test_f1: 0.5654
 epoch: 51, train_loss: 0.6154, test_loss: 1.1750, test_f1: 0.5868
 epoch: 52, train_loss: 0.5804, test_loss: 1.1776, test_f1: 0.5873
 epoch: 53, train_loss: 0.5615, test_loss: 1.2341, test_f1: 0.6261
 epoch: 54, train_loss: 0.5463, test_loss: 1.2055, test_f1: 0.6205
 epoch: 55, train_loss: 0.5425, test_loss: 1.3695, test_f1: 0.5733
 epoch: 56, train_loss: 0.5446, test_loss: 1.3819, test_f1: 0.6046
 epoch: 57, train_loss: 0.5230, test_loss: 1.2950, test_f1: 0.6136
 epoch: 58, train_loss: 0.5401, test_loss: 1.3423, test_f1: 0.6038
 epoch: 59, train_loss: 0.5349, test_loss: 1.2803, test_f1: 0.5731
 epoch: 60, train_loss: 0.5559, test_loss: 1.2280, test_f1: 0.6041
 epoch: 61, train_loss: 0.5540, test_loss: 1.2745, test_f1: 0.5998
 epoch: 62, train_loss: 0.5063, test_loss: 1.3738, test_f1: 0.5943
 epoch: 63, train_loss: 0.5198, test_loss: 1.3792, test_f1: 0.5703
 epoch: 64, train_loss: 0.4684, test_loss: 1.3452, test_f1: 0.6417
 epoch: 65, train_loss: 0.4532, test_loss: 1.4758, test_f1: 0.6341
 epoch: 66, train_loss: 0.4255, test_loss: 1.6743, test_f1: 0.6027
 epoch: 67, train_loss: 0.4438, test_loss: 1.7774, test_f1: 0.6196
 epoch: 68, train_loss: 0.4482, test_loss: 1.6959, test_f1: 0.5777
 epoch: 69, train_loss: 0.4561, test_loss: 1.6775, test_f1: 0.6080
 epoch: 70, train_loss: 0.4934, test_loss: 1.9398, test_f1: 0.5423
 epoch: 71, train_loss: 0.4938, test_loss: 1.6780, test_f1: 0.5571
 epoch: 72, train_loss: 0.4610, test_loss: 1.6531, test_f1: 0.5433
 epoch: 73, train_loss: 0.4451, test_loss: 1.6681, test_f1: 0.5894
 epoch: 74, train_loss: 0.4270, test_loss: 1.7285, test_f1: 0.5853
 epoch: 75, train_loss: 0.4101, test_loss: 1.8656, test_f1: 0.5712
 epoch: 76, train_loss: 0.4048, test_loss: 1.6184, test_f1: 0.6349
 epoch: 77, train_loss: 0.4332, test_loss: 1.7399, test_f1: 0.6138
 epoch: 78, train_loss: 0.4582, test_loss: 1.6182, test_f1: 0.5879
 epoch: 79, train_loss: 0.4469, test_loss: 1.7541, test_f1: 0.4791
 epoch: 80, train_loss: 0.4386, test_loss: 1.7850, test_f1: 0.5389
 epoch: 81, train_loss: 0.4009, test_loss: 1.7508, test_f1: 0.5750
 epoch: 82, train_loss: 0.4201, test_loss: 1.8776, test_f1: 0.5750
 epoch: 83, train_loss: 0.4198, test_loss: 1.7088, test_f1: 0.5825
 epoch: 84, train_loss: 0.4389, test_loss: 1.6885, test_f1: 0.5865
 epoch: 85, train_loss: 0.3920, test_loss: 1.7742, test_f1: 0.5852
 epoch: 86, train_loss: 0.3964, test_loss: 1.8818, test_f1: 0.5546
 epoch: 87, train_loss: 0.4066, test_loss: 2.2033, test_f1: 0.5668
 epoch: 88, train_loss: 0.5307, test_loss: 1.8126, test_f1: 0.5499
 epoch: 89, train_loss: 0.4533, test_loss: 2.4036, test_f1: 0.4406
 epoch: 90, train_loss: 0.4498, test_loss: 1.5142, test_f1: 0.6061
 epoch: 91, train_loss: 0.3865, test_loss: 1.7133, test_f1: 0.5970
 epoch: 92, train_loss: 0.3526, test_loss: 1.9298, test_f1: 0.6251
 epoch: 93, train_loss: 0.3609, test_loss: 1.9556, test_f1: 0.5870
 epoch: 94, train_loss: 0.3282, test_loss: 1.9081, test_f1: 0.5989
 epoch: 95, train_loss: 0.3412, test_loss: 2.0266, test_f1: 0.5619
 epoch: 96, train_loss: 0.3249, test_loss: 2.2251, test_f1: 0.5883
 epoch: 97, train_loss: 0.3437, test_loss: 2.0956, test_f1: 0.5652
 epoch: 98, train_loss: 0.3288, test_loss: 2.1195, test_f1: 0.6200
 epoch: 99, train_loss: 0.3805, test_loss: 2.3635, test_f1: 0.5739
##################ITERATION #2 ****************************************
 epoch: 0, train_loss: 1.2961, test_loss: 1.3768, test_f1: 0.2281
 epoch: 1, train_loss: 1.0461, test_loss: 1.5100, test_f1: 0.1365
 epoch: 2, train_loss: 0.9955, test_loss: 1.1725, test_f1: 0.3610
 epoch: 3, train_loss: 0.9647, test_loss: 1.2211, test_f1: 0.4670
 epoch: 4, train_loss: 0.9326, test_loss: 1.2558, test_f1: 0.4450
 epoch: 5, train_loss: 0.9152, test_loss: 1.1673, test_f1: 0.4287
 epoch: 6, train_loss: 0.9408, test_loss: 1.2284, test_f1: 0.4755
 epoch: 7, train_loss: 0.9225, test_loss: 1.1368, test_f1: 0.4129
 epoch: 8, train_loss: 0.8823, test_loss: 1.0604, test_f1: 0.4434
 epoch: 9, train_loss: 0.8673, test_loss: 1.1101, test_f1: 0.4916
 epoch: 10, train_loss: 0.8682, test_loss: 1.4704, test_f1: 0.4629
 epoch: 11, train_loss: 0.9121, test_loss: 1.0730, test_f1: 0.5002
 epoch: 12, train_loss: 0.8640, test_loss: 1.0523, test_f1: 0.5504
 epoch: 13, train_loss: 0.8332, test_loss: 1.1405, test_f1: 0.4951
 epoch: 14, train_loss: 0.8229, test_loss: 1.1654, test_f1: 0.5082
 epoch: 15, train_loss: 0.8100, test_loss: 1.2698, test_f1: 0.5227
 epoch: 16, train_loss: 0.7914, test_loss: 1.0625, test_f1: 0.5561
 epoch: 17, train_loss: 0.7787, test_loss: 1.1499, test_f1: 0.5114
 epoch: 18, train_loss: 0.8146, test_loss: 1.2377, test_f1: 0.4895
 epoch: 19, train_loss: 0.7668, test_loss: 1.1237, test_f1: 0.5125
 epoch: 20, train_loss: 0.8061, test_loss: 1.6344, test_f1: 0.4372
 epoch: 21, train_loss: 0.8164, test_loss: 1.1107, test_f1: 0.4855
 epoch: 22, train_loss: 0.7516, test_loss: 1.1087, test_f1: 0.4775
 epoch: 23, train_loss: 0.7252, test_loss: 1.3305, test_f1: 0.4642
 epoch: 24, train_loss: 0.7298, test_loss: 1.1725, test_f1: 0.5694
 epoch: 25, train_loss: 0.7311, test_loss: 1.0967, test_f1: 0.5042
 epoch: 26, train_loss: 0.7139, test_loss: 1.3340, test_f1: 0.5617
 epoch: 27, train_loss: 0.7288, test_loss: 0.9802, test_f1: 0.5911
 epoch: 28, train_loss: 0.6788, test_loss: 1.0865, test_f1: 0.6121
 epoch: 29, train_loss: 0.6569, test_loss: 1.2807, test_f1: 0.5028
 epoch: 30, train_loss: 0.6603, test_loss: 1.2311, test_f1: 0.5380
 epoch: 31, train_loss: 0.6763, test_loss: 1.2517, test_f1: 0.5520
 epoch: 32, train_loss: 0.6482, test_loss: 1.2471, test_f1: 0.5288
 epoch: 33, train_loss: 0.6279, test_loss: 1.3233, test_f1: 0.5943
 epoch: 34, train_loss: 0.6524, test_loss: 1.1853, test_f1: 0.5814
 epoch: 35, train_loss: 0.6719, test_loss: 1.3499, test_f1: 0.5195
 epoch: 36, train_loss: 0.6912, test_loss: 1.3324, test_f1: 0.5484
 epoch: 37, train_loss: 0.6611, test_loss: 1.0830, test_f1: 0.5572
 epoch: 38, train_loss: 0.6127, test_loss: 1.3428, test_f1: 0.5677
 epoch: 39, train_loss: 0.6614, test_loss: 1.2562, test_f1: 0.5440
 epoch: 40, train_loss: 0.5994, test_loss: 1.2563, test_f1: 0.5858
 epoch: 41, train_loss: 0.6171, test_loss: 1.2895, test_f1: 0.5451
 epoch: 42, train_loss: 0.6180, test_loss: 1.2255, test_f1: 0.5641
 epoch: 43, train_loss: 0.6098, test_loss: 1.8011, test_f1: 0.4899
 epoch: 44, train_loss: 0.6597, test_loss: 1.2265, test_f1: 0.5890
 epoch: 45, train_loss: 0.6412, test_loss: 1.5751, test_f1: 0.4557
 epoch: 46, train_loss: 0.6147, test_loss: 1.5495, test_f1: 0.5002
 epoch: 47, train_loss: 0.5793, test_loss: 1.5654, test_f1: 0.4839
 epoch: 48, train_loss: 0.5618, test_loss: 1.3157, test_f1: 0.6021
 epoch: 49, train_loss: 0.5638, test_loss: 1.4609, test_f1: 0.5701
 epoch: 50, train_loss: 0.5583, test_loss: 1.3556, test_f1: 0.5765
 epoch: 51, train_loss: 0.5169, test_loss: 1.2999, test_f1: 0.5710
 epoch: 52, train_loss: 0.5114, test_loss: 1.3241, test_f1: 0.5975
 epoch: 53, train_loss: 0.5227, test_loss: 1.4610, test_f1: 0.6140
 epoch: 54, train_loss: 0.4995, test_loss: 1.4354, test_f1: 0.5823
 epoch: 55, train_loss: 0.5207, test_loss: 1.3046, test_f1: 0.5679
 epoch: 56, train_loss: 0.5005, test_loss: 1.5860, test_f1: 0.5043
 epoch: 57, train_loss: 0.4933, test_loss: 1.4793, test_f1: 0.4974
 epoch: 58, train_loss: 0.4643, test_loss: 1.3403, test_f1: 0.5564
 epoch: 59, train_loss: 0.4475, test_loss: 1.4559, test_f1: 0.5655
 epoch: 60, train_loss: 0.4215, test_loss: 1.7474, test_f1: 0.5838
 epoch: 61, train_loss: 0.4414, test_loss: 1.5456, test_f1: 0.6039
 epoch: 62, train_loss: 0.4338, test_loss: 1.9030, test_f1: 0.5674
 epoch: 63, train_loss: 0.4361, test_loss: 1.6728, test_f1: 0.6229
 epoch: 64, train_loss: 0.4281, test_loss: 1.7990, test_f1: 0.6013
 epoch: 65, train_loss: 0.3949, test_loss: 1.8525, test_f1: 0.6013
 epoch: 66, train_loss: 0.3902, test_loss: 1.6866, test_f1: 0.6110
 epoch: 67, train_loss: 0.5237, test_loss: 2.0725, test_f1: 0.5885
 epoch: 68, train_loss: 0.4989, test_loss: 2.3888, test_f1: 0.4929
 epoch: 69, train_loss: 0.4764, test_loss: 1.7292, test_f1: 0.5608
 epoch: 70, train_loss: 0.4197, test_loss: 1.6847, test_f1: 0.5940
 epoch: 71, train_loss: 0.4764, test_loss: 1.6132, test_f1: 0.5854
 epoch: 72, train_loss: 0.4390, test_loss: 1.6201, test_f1: 0.5538
 epoch: 73, train_loss: 0.5141, test_loss: 1.5253, test_f1: 0.6363
 epoch: 74, train_loss: 0.4995, test_loss: 1.5656, test_f1: 0.6036
 epoch: 75, train_loss: 0.4497, test_loss: 1.6968, test_f1: 0.5561
 epoch: 76, train_loss: 0.4258, test_loss: 1.6265, test_f1: 0.6127
 epoch: 77, train_loss: 0.4267, test_loss: 1.7759, test_f1: 0.6457
 epoch: 78, train_loss: 0.4141, test_loss: 1.8197, test_f1: 0.6004
 epoch: 79, train_loss: 0.4198, test_loss: 1.7325, test_f1: 0.5276
 epoch: 80, train_loss: 0.4174, test_loss: 1.8301, test_f1: 0.5713
 epoch: 81, train_loss: 0.4242, test_loss: 1.8524, test_f1: 0.6211
 epoch: 82, train_loss: 0.4235, test_loss: 1.7979, test_f1: 0.6424
 epoch: 83, train_loss: 0.3741, test_loss: 1.8583, test_f1: 0.6187
 epoch: 84, train_loss: 0.3936, test_loss: 1.7812, test_f1: 0.5731
 epoch: 85, train_loss: 0.3683, test_loss: 1.9230, test_f1: 0.5835
 epoch: 86, train_loss: 0.3862, test_loss: 1.7025, test_f1: 0.5725
 epoch: 87, train_loss: 0.3488, test_loss: 1.8599, test_f1: 0.6367
 epoch: 88, train_loss: 0.3225, test_loss: 1.9968, test_f1: 0.6132
 epoch: 89, train_loss: 0.3443, test_loss: 2.0170, test_f1: 0.5607
 epoch: 90, train_loss: 0.3384, test_loss: 1.8564, test_f1: 0.6041
 epoch: 91, train_loss: 0.3363, test_loss: 1.9190, test_f1: 0.6145
 epoch: 92, train_loss: 0.3307, test_loss: 1.9476, test_f1: 0.5882
 epoch: 93, train_loss: 0.3290, test_loss: 1.6896, test_f1: 0.6178
 epoch: 94, train_loss: 0.3521, test_loss: 1.9617, test_f1: 0.6185
 epoch: 95, train_loss: 0.3087, test_loss: 1.9735, test_f1: 0.6084
 epoch: 96, train_loss: 0.3194, test_loss: 1.9335, test_f1: 0.5514
 epoch: 97, train_loss: 0.3420, test_loss: 1.7747, test_f1: 0.5936
 epoch: 98, train_loss: 0.3442, test_loss: 1.7698, test_f1: 0.5894
 epoch: 99, train_loss: 0.3058, test_loss: 1.9537, test_f1: 0.6232
##################ITERATION #3 ****************************************
 epoch: 0, train_loss: 1.3582, test_loss: 1.6063, test_f1: 0.1735
 epoch: 1, train_loss: 1.0597, test_loss: 1.4512, test_f1: 0.3162
 epoch: 2, train_loss: 1.0068, test_loss: 1.3750, test_f1: 0.3321
 epoch: 3, train_loss: 0.9565, test_loss: 1.1781, test_f1: 0.3634
 epoch: 4, train_loss: 0.9515, test_loss: 1.0576, test_f1: 0.5026
 epoch: 5, train_loss: 0.9228, test_loss: 1.2443, test_f1: 0.4932
 epoch: 6, train_loss: 0.8933, test_loss: 1.0589, test_f1: 0.5372
 epoch: 7, train_loss: 0.8862, test_loss: 1.0583, test_f1: 0.4817
 epoch: 8, train_loss: 0.8710, test_loss: 1.1818, test_f1: 0.4870
 epoch: 9, train_loss: 0.8740, test_loss: 1.2331, test_f1: 0.5436
 epoch: 10, train_loss: 0.8290, test_loss: 1.0806, test_f1: 0.5641
 epoch: 11, train_loss: 0.7784, test_loss: 1.2008, test_f1: 0.5423
 epoch: 12, train_loss: 0.7908, test_loss: 1.0924, test_f1: 0.5178
 epoch: 13, train_loss: 0.8022, test_loss: 1.1013, test_f1: 0.5519
 epoch: 14, train_loss: 0.7790, test_loss: 1.2546, test_f1: 0.4339
 epoch: 15, train_loss: 0.7454, test_loss: 1.2100, test_f1: 0.4625
 epoch: 16, train_loss: 0.7521, test_loss: 1.2181, test_f1: 0.5061
 epoch: 17, train_loss: 0.7594, test_loss: 1.2049, test_f1: 0.5537
 epoch: 18, train_loss: 0.7409, test_loss: 1.2452, test_f1: 0.4753
 epoch: 19, train_loss: 0.7741, test_loss: 1.1813, test_f1: 0.5584
 epoch: 20, train_loss: 0.7726, test_loss: 1.3545, test_f1: 0.5080
 epoch: 21, train_loss: 0.7182, test_loss: 1.0743, test_f1: 0.5856
 epoch: 22, train_loss: 0.7337, test_loss: 1.1415, test_f1: 0.5161
 epoch: 23, train_loss: 0.7163, test_loss: 1.5567, test_f1: 0.4697
 epoch: 24, train_loss: 0.7349, test_loss: 1.3454, test_f1: 0.4887
 epoch: 25, train_loss: 0.6904, test_loss: 1.6184, test_f1: 0.5362
 epoch: 26, train_loss: 0.7285, test_loss: 1.1728, test_f1: 0.5289
 epoch: 27, train_loss: 0.7641, test_loss: 1.0423, test_f1: 0.6106
 epoch: 28, train_loss: 0.7204, test_loss: 1.2958, test_f1: 0.5870
 epoch: 29, train_loss: 0.6705, test_loss: 1.8988, test_f1: 0.3763
 epoch: 30, train_loss: 0.6858, test_loss: 1.7514, test_f1: 0.5464
 epoch: 31, train_loss: 0.6404, test_loss: 1.8183, test_f1: 0.4350
 epoch: 32, train_loss: 0.6833, test_loss: 1.3226, test_f1: 0.5429
 epoch: 33, train_loss: 0.6386, test_loss: 1.5731, test_f1: 0.5372
 epoch: 34, train_loss: 0.6147, test_loss: 1.6830, test_f1: 0.5705
 epoch: 35, train_loss: 0.6702, test_loss: 1.1681, test_f1: 0.5218
 epoch: 36, train_loss: 0.6368, test_loss: 1.2576, test_f1: 0.5663
 epoch: 37, train_loss: 0.6283, test_loss: 1.2798, test_f1: 0.5284
 epoch: 38, train_loss: 0.6077, test_loss: 2.2295, test_f1: 0.5305
 epoch: 39, train_loss: 0.6430, test_loss: 2.0388, test_f1: 0.4429
 epoch: 40, train_loss: 0.6523, test_loss: 3.1939, test_f1: 0.4013
 epoch: 41, train_loss: 0.6035, test_loss: 2.1752, test_f1: 0.5141
 epoch: 42, train_loss: 0.5951, test_loss: 2.0596, test_f1: 0.5584
 epoch: 43, train_loss: 0.5861, test_loss: 1.4195, test_f1: 0.6169
 epoch: 44, train_loss: 0.5472, test_loss: 1.5599, test_f1: 0.5454
 epoch: 45, train_loss: 0.5725, test_loss: 2.3796, test_f1: 0.5054
 epoch: 46, train_loss: 0.5819, test_loss: 1.3268, test_f1: 0.5190
 epoch: 47, train_loss: 0.6148, test_loss: 1.5798, test_f1: 0.5505
 epoch: 48, train_loss: 0.5875, test_loss: 1.4148, test_f1: 0.5569
 epoch: 49, train_loss: 0.5434, test_loss: 2.1696, test_f1: 0.5469
 epoch: 50, train_loss: 0.5247, test_loss: 2.0939, test_f1: 0.5751
 epoch: 51, train_loss: 0.5265, test_loss: 1.7663, test_f1: 0.5835
 epoch: 52, train_loss: 0.5223, test_loss: 1.3121, test_f1: 0.5719
 epoch: 53, train_loss: 0.5057, test_loss: 1.9195, test_f1: 0.4704
 epoch: 54, train_loss: 0.4704, test_loss: 1.4373, test_f1: 0.5989
 epoch: 55, train_loss: 0.5185, test_loss: 1.5278, test_f1: 0.5866
 epoch: 56, train_loss: 0.4687, test_loss: 2.0212, test_f1: 0.5729
 epoch: 57, train_loss: 0.4310, test_loss: 2.1297, test_f1: 0.5720
 epoch: 58, train_loss: 0.4447, test_loss: 1.5672, test_f1: 0.5815
 epoch: 59, train_loss: 0.4452, test_loss: 1.9476, test_f1: 0.5809
 epoch: 60, train_loss: 0.4409, test_loss: 2.0459, test_f1: 0.5747
 epoch: 61, train_loss: 0.4351, test_loss: 1.6857, test_f1: 0.6093
 epoch: 62, train_loss: 0.4207, test_loss: 1.8375, test_f1: 0.5708
 epoch: 63, train_loss: 0.4548, test_loss: 1.6952, test_f1: 0.6002
 epoch: 64, train_loss: 0.4459, test_loss: 2.0267, test_f1: 0.5784
 epoch: 65, train_loss: 0.4100, test_loss: 2.2563, test_f1: 0.5332
 epoch: 66, train_loss: 0.4332, test_loss: 2.4281, test_f1: 0.5160
 epoch: 67, train_loss: 0.4895, test_loss: 2.4042, test_f1: 0.5693
 epoch: 68, train_loss: 0.5475, test_loss: 1.3956, test_f1: 0.5499
 epoch: 69, train_loss: 0.5177, test_loss: 1.2497, test_f1: 0.6014
 epoch: 70, train_loss: 0.4433, test_loss: 1.4275, test_f1: 0.6156
 epoch: 71, train_loss: 0.4358, test_loss: 1.6071, test_f1: 0.5971
 epoch: 72, train_loss: 0.4202, test_loss: 1.9800, test_f1: 0.5397
 epoch: 73, train_loss: 0.4565, test_loss: 1.9378, test_f1: 0.5036
 epoch: 74, train_loss: 0.4315, test_loss: 3.1745, test_f1: 0.5109
 epoch: 75, train_loss: 0.4151, test_loss: 1.9110, test_f1: 0.5796
 epoch: 76, train_loss: 0.3757, test_loss: 1.7762, test_f1: 0.5492
 epoch: 77, train_loss: 0.3929, test_loss: 1.5573, test_f1: 0.6166
 epoch: 78, train_loss: 0.3481, test_loss: 2.0087, test_f1: 0.5807
 epoch: 79, train_loss: 0.3602, test_loss: 2.0208, test_f1: 0.6417
 epoch: 80, train_loss: 0.3593, test_loss: 2.2301, test_f1: 0.5610
 epoch: 81, train_loss: 0.4262, test_loss: 3.1574, test_f1: 0.5549
 epoch: 82, train_loss: 0.3785, test_loss: 2.5163, test_f1: 0.5662
 epoch: 83, train_loss: 0.3638, test_loss: 2.0238, test_f1: 0.6165
 epoch: 84, train_loss: 0.4011, test_loss: 1.9285, test_f1: 0.6101
 epoch: 85, train_loss: 0.3486, test_loss: 2.0414, test_f1: 0.5399
 epoch: 86, train_loss: 0.3382, test_loss: 1.6830, test_f1: 0.6087
 epoch: 87, train_loss: 0.3381, test_loss: 2.1998, test_f1: 0.5444
 epoch: 88, train_loss: 0.3610, test_loss: 1.9916, test_f1: 0.6368
 epoch: 89, train_loss: 0.3609, test_loss: 2.3542, test_f1: 0.5789
 epoch: 90, train_loss: 0.3366, test_loss: 2.1465, test_f1: 0.5962
 epoch: 91, train_loss: 0.3641, test_loss: 2.2695, test_f1: 0.5911
 epoch: 92, train_loss: 0.4123, test_loss: 1.9196, test_f1: 0.5530
 epoch: 93, train_loss: 0.4010, test_loss: 1.5929, test_f1: 0.6218
 epoch: 94, train_loss: 0.3712, test_loss: 1.8842, test_f1: 0.6062
 epoch: 95, train_loss: 0.3738, test_loss: 1.9021, test_f1: 0.5567
 epoch: 96, train_loss: 0.3618, test_loss: 1.7448, test_f1: 0.5822
 epoch: 97, train_loss: 0.3880, test_loss: 2.2593, test_f1: 0.5747
 epoch: 98, train_loss: 0.3649, test_loss: 1.9478, test_f1: 0.5828
 epoch: 99, train_loss: 0.3483, test_loss: 1.7369, test_f1: 0.5865
##################ITERATION #4 ****************************************
 epoch: 0, train_loss: 1.3635, test_loss: 1.3336, test_f1: 0.2281
 epoch: 1, train_loss: 1.0897, test_loss: 1.4816, test_f1: 0.2772
 epoch: 2, train_loss: 1.0322, test_loss: 1.4497, test_f1: 0.3235
 epoch: 3, train_loss: 0.9909, test_loss: 1.2863, test_f1: 0.3550
 epoch: 4, train_loss: 0.9733, test_loss: 1.1117, test_f1: 0.3690
 epoch: 5, train_loss: 0.9409, test_loss: 1.1096, test_f1: 0.4656
 epoch: 6, train_loss: 0.9178, test_loss: 1.1923, test_f1: 0.4477
 epoch: 7, train_loss: 0.9183, test_loss: 1.1234, test_f1: 0.4863
 epoch: 8, train_loss: 0.9448, test_loss: 1.2687, test_f1: 0.4442
 epoch: 9, train_loss: 0.9223, test_loss: 1.1635, test_f1: 0.4980
 epoch: 10, train_loss: 0.8918, test_loss: 1.0865, test_f1: 0.4957
 epoch: 11, train_loss: 0.8585, test_loss: 1.1153, test_f1: 0.5266
 epoch: 12, train_loss: 0.8370, test_loss: 1.1951, test_f1: 0.3791
 epoch: 13, train_loss: 0.8971, test_loss: 1.2103, test_f1: 0.4354
 epoch: 14, train_loss: 0.8922, test_loss: 1.3313, test_f1: 0.4276
 epoch: 15, train_loss: 0.8530, test_loss: 1.3278, test_f1: 0.4288
 epoch: 16, train_loss: 0.8420, test_loss: 1.4164, test_f1: 0.3942
 epoch: 17, train_loss: 0.8445, test_loss: 1.5337, test_f1: 0.4213
 epoch: 18, train_loss: 0.8429, test_loss: 1.1498, test_f1: 0.5137
 epoch: 19, train_loss: 0.8063, test_loss: 1.0929, test_f1: 0.5037
 epoch: 20, train_loss: 0.7817, test_loss: 1.2667, test_f1: 0.4611
 epoch: 21, train_loss: 0.8005, test_loss: 1.0457, test_f1: 0.5966
 epoch: 22, train_loss: 0.8006, test_loss: 1.1108, test_f1: 0.5709
 epoch: 23, train_loss: 0.7850, test_loss: 1.2144, test_f1: 0.5614
 epoch: 24, train_loss: 0.7491, test_loss: 1.1957, test_f1: 0.5557
 epoch: 25, train_loss: 0.7405, test_loss: 1.2985, test_f1: 0.4981
 epoch: 26, train_loss: 0.7281, test_loss: 1.2454, test_f1: 0.5174
 epoch: 27, train_loss: 0.7142, test_loss: 1.1979, test_f1: 0.5398
 epoch: 28, train_loss: 0.6905, test_loss: 1.3330, test_f1: 0.5085
 epoch: 29, train_loss: 0.7500, test_loss: 1.7029, test_f1: 0.4592
 epoch: 30, train_loss: 0.7511, test_loss: 1.0511, test_f1: 0.5600
 epoch: 31, train_loss: 0.7558, test_loss: 1.1594, test_f1: 0.5481
 epoch: 32, train_loss: 0.7230, test_loss: 1.3108, test_f1: 0.5174
 epoch: 33, train_loss: 0.6930, test_loss: 1.2917, test_f1: 0.5188
 epoch: 34, train_loss: 0.8096, test_loss: 1.2070, test_f1: 0.4412
 epoch: 35, train_loss: 0.7684, test_loss: 1.4070, test_f1: 0.4575
 epoch: 36, train_loss: 0.7416, test_loss: 1.1037, test_f1: 0.5438
 epoch: 37, train_loss: 0.7084, test_loss: 1.1357, test_f1: 0.5166
 epoch: 38, train_loss: 0.7188, test_loss: 1.0726, test_f1: 0.5544
 epoch: 39, train_loss: 0.6974, test_loss: 1.1085, test_f1: 0.5260
 epoch: 40, train_loss: 0.6512, test_loss: 1.0018, test_f1: 0.5860
 epoch: 41, train_loss: 0.6299, test_loss: 1.0647, test_f1: 0.5683
 epoch: 42, train_loss: 0.6599, test_loss: 1.3055, test_f1: 0.5055
 epoch: 43, train_loss: 0.6230, test_loss: 1.0859, test_f1: 0.6292
 epoch: 44, train_loss: 0.6186, test_loss: 1.1659, test_f1: 0.5391
 epoch: 45, train_loss: 0.6175, test_loss: 1.1109, test_f1: 0.6014
 epoch: 46, train_loss: 0.5970, test_loss: 1.1477, test_f1: 0.6022
 epoch: 47, train_loss: 0.6080, test_loss: 1.1010, test_f1: 0.5857
 epoch: 48, train_loss: 0.6253, test_loss: 1.0953, test_f1: 0.5983
 epoch: 49, train_loss: 0.6032, test_loss: 1.4736, test_f1: 0.4827
 epoch: 50, train_loss: 0.6287, test_loss: 1.1345, test_f1: 0.5843
 epoch: 51, train_loss: 0.5736, test_loss: 1.1068, test_f1: 0.6555
 epoch: 52, train_loss: 0.5277, test_loss: 1.1645, test_f1: 0.6188
 epoch: 53, train_loss: 0.5436, test_loss: 1.3148, test_f1: 0.5497
 epoch: 54, train_loss: 0.5167, test_loss: 1.5192, test_f1: 0.5598
 epoch: 55, train_loss: 0.5424, test_loss: 1.4048, test_f1: 0.5382
 epoch: 56, train_loss: 0.5228, test_loss: 1.6264, test_f1: 0.5374
 epoch: 57, train_loss: 0.5023, test_loss: 1.3585, test_f1: 0.5725
 epoch: 58, train_loss: 0.4746, test_loss: 1.4589, test_f1: 0.5743
 epoch: 59, train_loss: 0.4843, test_loss: 1.4678, test_f1: 0.5617
 epoch: 60, train_loss: 0.4813, test_loss: 1.4860, test_f1: 0.5681
 epoch: 61, train_loss: 0.4693, test_loss: 1.3595, test_f1: 0.5315
 epoch: 62, train_loss: 0.4541, test_loss: 1.5194, test_f1: 0.5810
 epoch: 63, train_loss: 0.4786, test_loss: 1.7867, test_f1: 0.5753
 epoch: 64, train_loss: 0.4973, test_loss: 1.6696, test_f1: 0.5978
 epoch: 65, train_loss: 0.4491, test_loss: 1.4305, test_f1: 0.5361
 epoch: 66, train_loss: 0.4454, test_loss: 1.5735, test_f1: 0.5994
 epoch: 67, train_loss: 0.4522, test_loss: 1.7529, test_f1: 0.6121
 epoch: 68, train_loss: 0.4638, test_loss: 1.4916, test_f1: 0.6299
 epoch: 69, train_loss: 0.4940, test_loss: 1.7355, test_f1: 0.5090
 epoch: 70, train_loss: 0.5064, test_loss: 1.3116, test_f1: 0.5884
 epoch: 71, train_loss: 0.4690, test_loss: 1.2100, test_f1: 0.6104
 epoch: 72, train_loss: 0.4536, test_loss: 1.2788, test_f1: 0.6168
 epoch: 73, train_loss: 0.4417, test_loss: 1.5675, test_f1: 0.5845
 epoch: 74, train_loss: 0.4360, test_loss: 1.5703, test_f1: 0.5635
 epoch: 75, train_loss: 0.4439, test_loss: 1.2954, test_f1: 0.5641
 epoch: 76, train_loss: 0.4621, test_loss: 1.6679, test_f1: 0.5617
 epoch: 77, train_loss: 0.4370, test_loss: 1.4138, test_f1: 0.5670
 epoch: 78, train_loss: 0.3969, test_loss: 1.5188, test_f1: 0.6018
 epoch: 79, train_loss: 0.3795, test_loss: 1.5394, test_f1: 0.5531
 epoch: 80, train_loss: 0.4213, test_loss: 1.4795, test_f1: 0.5154
 epoch: 81, train_loss: 0.4134, test_loss: 1.4105, test_f1: 0.6082
 epoch: 82, train_loss: 0.3803, test_loss: 1.6891, test_f1: 0.5641
 epoch: 83, train_loss: 0.3851, test_loss: 1.7175, test_f1: 0.5629
 epoch: 84, train_loss: 0.3481, test_loss: 1.7720, test_f1: 0.5734
 epoch: 85, train_loss: 0.3604, test_loss: 1.7239, test_f1: 0.5538
 epoch: 86, train_loss: 0.3543, test_loss: 1.7296, test_f1: 0.5418
 epoch: 87, train_loss: 0.3597, test_loss: 1.7325, test_f1: 0.5690
 epoch: 88, train_loss: 0.3600, test_loss: 1.8130, test_f1: 0.5847
 epoch: 89, train_loss: 0.3591, test_loss: 1.7926, test_f1: 0.5569
 epoch: 90, train_loss: 0.3689, test_loss: 1.8692, test_f1: 0.5629
 epoch: 91, train_loss: 0.4833, test_loss: 1.7796, test_f1: 0.5439
 epoch: 92, train_loss: 0.6630, test_loss: 1.7349, test_f1: 0.4529
 epoch: 93, train_loss: 0.6429, test_loss: 1.4817, test_f1: 0.5262
 epoch: 94, train_loss: 0.5612, test_loss: 1.6465, test_f1: 0.5364
 epoch: 95, train_loss: 0.4979, test_loss: 1.1755, test_f1: 0.5718
 epoch: 96, train_loss: 0.4845, test_loss: 1.3700, test_f1: 0.5512
 epoch: 97, train_loss: 0.4047, test_loss: 1.6314, test_f1: 0.5868
 epoch: 98, train_loss: 0.3865, test_loss: 1.4972, test_f1: 0.5743
 epoch: 99, train_loss: 0.3598, test_loss: 1.7926, test_f1: 0.5269
##################ITERATION #5 ****************************************
 epoch: 0, train_loss: 1.4108, test_loss: 1.3905, test_f1: 0.2281
 epoch: 1, train_loss: 1.0292, test_loss: 1.3630, test_f1: 0.2560
 epoch: 2, train_loss: 0.9856, test_loss: 1.2323, test_f1: 0.3455
 epoch: 3, train_loss: 0.9640, test_loss: 1.2919, test_f1: 0.3817
 epoch: 4, train_loss: 0.9237, test_loss: 1.2451, test_f1: 0.4361
 epoch: 5, train_loss: 0.9134, test_loss: 1.1070, test_f1: 0.4800
 epoch: 6, train_loss: 0.8832, test_loss: 1.0431, test_f1: 0.5545
 epoch: 7, train_loss: 0.8646, test_loss: 1.0655, test_f1: 0.5102
 epoch: 8, train_loss: 0.8612, test_loss: 1.0618, test_f1: 0.5211
 epoch: 9, train_loss: 0.8394, test_loss: 1.1115, test_f1: 0.5479
 epoch: 10, train_loss: 0.8387, test_loss: 1.0810, test_f1: 0.5157
 epoch: 11, train_loss: 0.8154, test_loss: 1.1053, test_f1: 0.5720
 epoch: 12, train_loss: 0.7950, test_loss: 1.0637, test_f1: 0.4991
 epoch: 13, train_loss: 0.7976, test_loss: 1.0267, test_f1: 0.5678
 epoch: 14, train_loss: 0.7896, test_loss: 1.0753, test_f1: 0.4722
 epoch: 15, train_loss: 0.7524, test_loss: 1.0659, test_f1: 0.4711
 epoch: 16, train_loss: 0.7377, test_loss: 0.9777, test_f1: 0.5820
 epoch: 17, train_loss: 0.7302, test_loss: 1.1317, test_f1: 0.5203
 epoch: 18, train_loss: 0.7229, test_loss: 0.9894, test_f1: 0.5857
 epoch: 19, train_loss: 0.7028, test_loss: 1.6326, test_f1: 0.4921
 epoch: 20, train_loss: 0.7505, test_loss: 1.0348, test_f1: 0.5955
 epoch: 21, train_loss: 0.7119, test_loss: 1.4680, test_f1: 0.4777
 epoch: 22, train_loss: 0.7009, test_loss: 1.0694, test_f1: 0.5949
 epoch: 23, train_loss: 0.6919, test_loss: 1.1000, test_f1: 0.5440
 epoch: 24, train_loss: 0.6848, test_loss: 1.2301, test_f1: 0.5173
 epoch: 25, train_loss: 0.7092, test_loss: 1.1029, test_f1: 0.5881
 epoch: 26, train_loss: 0.7553, test_loss: 1.5973, test_f1: 0.4294
 epoch: 27, train_loss: 0.7103, test_loss: 1.2007, test_f1: 0.4804
 epoch: 28, train_loss: 0.6995, test_loss: 1.1020, test_f1: 0.5585
 epoch: 29, train_loss: 0.6648, test_loss: 1.1519, test_f1: 0.5218
 epoch: 30, train_loss: 0.6473, test_loss: 1.3368, test_f1: 0.5633
 epoch: 31, train_loss: 0.6351, test_loss: 1.1660, test_f1: 0.5609
 epoch: 32, train_loss: 0.6329, test_loss: 2.2620, test_f1: 0.4146
 epoch: 33, train_loss: 0.6614, test_loss: 1.2319, test_f1: 0.5472
 epoch: 34, train_loss: 0.6784, test_loss: 1.5098, test_f1: 0.5160
 epoch: 35, train_loss: 0.6329, test_loss: 1.1158, test_f1: 0.6258
 epoch: 36, train_loss: 0.6455, test_loss: 1.2952, test_f1: 0.5083
 epoch: 37, train_loss: 0.5946, test_loss: 1.3662, test_f1: 0.5592
 epoch: 38, train_loss: 0.6231, test_loss: 1.1975, test_f1: 0.5849
 epoch: 39, train_loss: 0.6146, test_loss: 1.5575, test_f1: 0.4561
 epoch: 40, train_loss: 0.5646, test_loss: 1.3858, test_f1: 0.5215
 epoch: 41, train_loss: 0.5729, test_loss: 1.2639, test_f1: 0.6094
 epoch: 42, train_loss: 0.5671, test_loss: 1.3171, test_f1: 0.5631
 epoch: 43, train_loss: 0.6065, test_loss: 1.5395, test_f1: 0.5296
 epoch: 44, train_loss: 0.5613, test_loss: 1.3468, test_f1: 0.5083
 epoch: 45, train_loss: 0.5991, test_loss: 1.4066, test_f1: 0.5833
 epoch: 46, train_loss: 0.6234, test_loss: 2.1325, test_f1: 0.4365
 epoch: 47, train_loss: 0.6001, test_loss: 1.1923, test_f1: 0.5968
 epoch: 48, train_loss: 0.5836, test_loss: 1.2448, test_f1: 0.5751
 epoch: 49, train_loss: 0.5415, test_loss: 1.4192, test_f1: 0.5555
 epoch: 50, train_loss: 0.5643, test_loss: 2.0113, test_f1: 0.5441
 epoch: 51, train_loss: 0.5529, test_loss: 1.4220, test_f1: 0.5507
 epoch: 52, train_loss: 0.5268, test_loss: 1.4098, test_f1: 0.5938
 epoch: 53, train_loss: 0.4843, test_loss: 1.4508, test_f1: 0.6168
 epoch: 54, train_loss: 0.4724, test_loss: 1.6169, test_f1: 0.6134
 epoch: 55, train_loss: 0.4494, test_loss: 1.5831, test_f1: 0.6012
 epoch: 56, train_loss: 0.4509, test_loss: 1.4514, test_f1: 0.6344
 epoch: 57, train_loss: 0.4632, test_loss: 1.4559, test_f1: 0.6307
 epoch: 58, train_loss: 0.4766, test_loss: 1.2639, test_f1: 0.5866
 epoch: 59, train_loss: 0.4660, test_loss: 1.5809, test_f1: 0.6103
 epoch: 60, train_loss: 0.4440, test_loss: 1.3076, test_f1: 0.6299
 epoch: 61, train_loss: 0.4644, test_loss: 1.5099, test_f1: 0.5940
 epoch: 62, train_loss: 0.4501, test_loss: 1.8581, test_f1: 0.5484
 epoch: 63, train_loss: 0.4786, test_loss: 1.3547, test_f1: 0.6352
 epoch: 64, train_loss: 0.4285, test_loss: 1.3662, test_f1: 0.5972
 epoch: 65, train_loss: 0.4220, test_loss: 1.4092, test_f1: 0.5931
 epoch: 66, train_loss: 0.4220, test_loss: 1.5414, test_f1: 0.6030
 epoch: 67, train_loss: 0.3981, test_loss: 1.4071, test_f1: 0.6003
 epoch: 68, train_loss: 0.4049, test_loss: 1.5618, test_f1: 0.6457
 epoch: 69, train_loss: 0.3921, test_loss: 1.5622, test_f1: 0.5917
 epoch: 70, train_loss: 0.4478, test_loss: 1.4540, test_f1: 0.6052
 epoch: 71, train_loss: 0.4967, test_loss: 1.6297, test_f1: 0.5823
 epoch: 72, train_loss: 0.4429, test_loss: 1.7505, test_f1: 0.5952
 epoch: 73, train_loss: 0.3973, test_loss: 1.6844, test_f1: 0.6069
 epoch: 74, train_loss: 0.4417, test_loss: 1.6752, test_f1: 0.5266
 epoch: 75, train_loss: 0.3854, test_loss: 1.5380, test_f1: 0.5759
 epoch: 76, train_loss: 0.3719, test_loss: 1.6250, test_f1: 0.5952
 epoch: 77, train_loss: 0.3679, test_loss: 1.9529, test_f1: 0.5993
 epoch: 78, train_loss: 0.3751, test_loss: 2.2921, test_f1: 0.6190
 epoch: 79, train_loss: 0.3759, test_loss: 1.3775, test_f1: 0.6449
 epoch: 80, train_loss: 0.3589, test_loss: 1.6230, test_f1: 0.6292
 epoch: 81, train_loss: 0.3563, test_loss: 1.5832, test_f1: 0.6391
 epoch: 82, train_loss: 0.3418, test_loss: 1.6649, test_f1: 0.6328
 epoch: 83, train_loss: 0.3481, test_loss: 1.6871, test_f1: 0.5964
 epoch: 84, train_loss: 0.3348, test_loss: 1.7654, test_f1: 0.5601
 epoch: 85, train_loss: 0.3991, test_loss: 2.7886, test_f1: 0.5642
 epoch: 86, train_loss: 0.4085, test_loss: 1.7084, test_f1: 0.5635
 epoch: 87, train_loss: 0.3533, test_loss: 1.8885, test_f1: 0.6098
 epoch: 88, train_loss: 0.3356, test_loss: 1.5800, test_f1: 0.6144
 epoch: 89, train_loss: 0.3468, test_loss: 1.7791, test_f1: 0.5688
 epoch: 90, train_loss: 0.4089, test_loss: 2.9138, test_f1: 0.5503
 epoch: 91, train_loss: 0.4467, test_loss: 2.7664, test_f1: 0.4754
 epoch: 92, train_loss: 0.4179, test_loss: 1.9392, test_f1: 0.5589
 epoch: 93, train_loss: 0.4050, test_loss: 1.9067, test_f1: 0.5864
 epoch: 94, train_loss: 0.3710, test_loss: 1.8797, test_f1: 0.6231
 epoch: 95, train_loss: 0.3667, test_loss: 1.9844, test_f1: 0.5816
 epoch: 96, train_loss: 0.3513, test_loss: 2.1960, test_f1: 0.5925
 epoch: 97, train_loss: 0.3614, test_loss: 2.0843, test_f1: 0.5922
 epoch: 98, train_loss: 0.3457, test_loss: 2.1045, test_f1: 0.6261
 epoch: 99, train_loss: 0.3866, test_loss: 2.2185, test_f1: 0.5961
##################ITERATION #6 ****************************************
 epoch: 0, train_loss: 1.6004, test_loss: 1.4784, test_f1: 0.3198
 epoch: 1, train_loss: 1.1286, test_loss: 1.5484, test_f1: 0.1511
 epoch: 2, train_loss: 1.0242, test_loss: 1.5053, test_f1: 0.1379
 epoch: 3, train_loss: 0.9721, test_loss: 1.3787, test_f1: 0.1681
 epoch: 4, train_loss: 0.9617, test_loss: 1.2060, test_f1: 0.2703
 epoch: 5, train_loss: 0.9306, test_loss: 1.1741, test_f1: 0.4656
 epoch: 6, train_loss: 0.9117, test_loss: 1.0956, test_f1: 0.4780
 epoch: 7, train_loss: 0.8993, test_loss: 1.0216, test_f1: 0.4873
 epoch: 8, train_loss: 0.8796, test_loss: 1.0958, test_f1: 0.4881
 epoch: 9, train_loss: 0.8725, test_loss: 1.0159, test_f1: 0.5388
 epoch: 10, train_loss: 0.8515, test_loss: 1.4537, test_f1: 0.4229
 epoch: 11, train_loss: 0.8533, test_loss: 1.0136, test_f1: 0.5428
 epoch: 12, train_loss: 0.8623, test_loss: 1.0222, test_f1: 0.5470
 epoch: 13, train_loss: 0.8437, test_loss: 1.0498, test_f1: 0.5395
 epoch: 14, train_loss: 0.8279, test_loss: 1.1879, test_f1: 0.5253
 epoch: 15, train_loss: 0.7913, test_loss: 1.0911, test_f1: 0.5366
 epoch: 16, train_loss: 0.7973, test_loss: 1.0905, test_f1: 0.5620
 epoch: 17, train_loss: 0.7643, test_loss: 1.1501, test_f1: 0.5439
 epoch: 18, train_loss: 0.7682, test_loss: 1.1277, test_f1: 0.5403
 epoch: 19, train_loss: 0.7036, test_loss: 1.1105, test_f1: 0.5583
 epoch: 20, train_loss: 0.6912, test_loss: 1.5832, test_f1: 0.4701
 epoch: 21, train_loss: 0.7153, test_loss: 1.1775, test_f1: 0.5713
 epoch: 22, train_loss: 0.7154, test_loss: 1.2014, test_f1: 0.4990
 epoch: 23, train_loss: 0.6786, test_loss: 1.8542, test_f1: 0.4590
 epoch: 24, train_loss: 0.6733, test_loss: 1.1814, test_f1: 0.5926
 epoch: 25, train_loss: 0.6549, test_loss: 1.7030, test_f1: 0.4889
 epoch: 26, train_loss: 0.6485, test_loss: 1.3725, test_f1: 0.5508
 epoch: 27, train_loss: 0.6388, test_loss: 1.3607, test_f1: 0.5681
 epoch: 28, train_loss: 0.6694, test_loss: 1.2917, test_f1: 0.5205
 epoch: 29, train_loss: 0.6793, test_loss: 1.2389, test_f1: 0.4996
 epoch: 30, train_loss: 0.6426, test_loss: 1.1369, test_f1: 0.6185
 epoch: 31, train_loss: 0.6198, test_loss: 1.5963, test_f1: 0.5846
 epoch: 32, train_loss: 0.6432, test_loss: 1.1792, test_f1: 0.5598
 epoch: 33, train_loss: 0.6633, test_loss: 1.2421, test_f1: 0.5589
 epoch: 34, train_loss: 0.6353, test_loss: 1.4732, test_f1: 0.4967
 epoch: 35, train_loss: 0.6329, test_loss: 1.1853, test_f1: 0.5603
 epoch: 36, train_loss: 0.6834, test_loss: 1.0531, test_f1: 0.5315
 epoch: 37, train_loss: 0.6810, test_loss: 1.1411, test_f1: 0.5516
 epoch: 38, train_loss: 0.6485, test_loss: 1.2720, test_f1: 0.4532
 epoch: 39, train_loss: 0.6390, test_loss: 1.1297, test_f1: 0.5364
 epoch: 40, train_loss: 0.5957, test_loss: 1.7849, test_f1: 0.5184
 epoch: 41, train_loss: 0.6144, test_loss: 1.3494, test_f1: 0.4971
 epoch: 42, train_loss: 0.6148, test_loss: 1.4605, test_f1: 0.6040
 epoch: 43, train_loss: 0.6268, test_loss: 1.7500, test_f1: 0.5238
 epoch: 44, train_loss: 0.6451, test_loss: 1.1933, test_f1: 0.5771
 epoch: 45, train_loss: 0.5881, test_loss: 1.2552, test_f1: 0.5580
 epoch: 46, train_loss: 0.5933, test_loss: 1.5311, test_f1: 0.5537
 epoch: 47, train_loss: 0.6313, test_loss: 1.4487, test_f1: 0.5441
 epoch: 48, train_loss: 0.6165, test_loss: 1.5140, test_f1: 0.5503
 epoch: 49, train_loss: 0.5731, test_loss: 1.3796, test_f1: 0.5971
 epoch: 50, train_loss: 0.5806, test_loss: 1.3019, test_f1: 0.5806
 epoch: 51, train_loss: 0.5466, test_loss: 1.2599, test_f1: 0.6022
 epoch: 52, train_loss: 0.5202, test_loss: 1.3628, test_f1: 0.5809
 epoch: 53, train_loss: 0.4954, test_loss: 1.4943, test_f1: 0.5856
 epoch: 54, train_loss: 0.4845, test_loss: 1.5566, test_f1: 0.6069
 epoch: 55, train_loss: 0.4650, test_loss: 1.3743, test_f1: 0.6399
 epoch: 56, train_loss: 0.4739, test_loss: 1.3443, test_f1: 0.6200
 epoch: 57, train_loss: 0.4782, test_loss: 1.4390, test_f1: 0.6239
 epoch: 58, train_loss: 0.4576, test_loss: 1.5497, test_f1: 0.6137
 epoch: 59, train_loss: 0.4540, test_loss: 1.7630, test_f1: 0.5915
 epoch: 60, train_loss: 0.4398, test_loss: 1.4767, test_f1: 0.6013
 epoch: 61, train_loss: 0.4619, test_loss: 1.6395, test_f1: 0.6198
 epoch: 62, train_loss: 0.4396, test_loss: 2.1306, test_f1: 0.5576
 epoch: 63, train_loss: 0.4565, test_loss: 1.8063, test_f1: 0.5661
 epoch: 64, train_loss: 0.4460, test_loss: 1.8046, test_f1: 0.5401
 epoch: 65, train_loss: 0.4291, test_loss: 1.4813, test_f1: 0.6049
 epoch: 66, train_loss: 0.4206, test_loss: 1.6198, test_f1: 0.6202
 epoch: 67, train_loss: 0.4358, test_loss: 2.3114, test_f1: 0.5801
 epoch: 68, train_loss: 0.4138, test_loss: 1.7346, test_f1: 0.5785
 epoch: 69, train_loss: 0.4444, test_loss: 1.5197, test_f1: 0.5946
 epoch: 70, train_loss: 0.4350, test_loss: 1.4504, test_f1: 0.5995
 epoch: 71, train_loss: 0.4660, test_loss: 1.6754, test_f1: 0.5852
 epoch: 72, train_loss: 0.4479, test_loss: 1.7093, test_f1: 0.5990
 epoch: 73, train_loss: 0.4354, test_loss: 1.6496, test_f1: 0.5249
 epoch: 74, train_loss: 0.4608, test_loss: 1.7109, test_f1: 0.5881
 epoch: 75, train_loss: 0.4479, test_loss: 1.5501, test_f1: 0.5721
 epoch: 76, train_loss: 0.4210, test_loss: 1.4401, test_f1: 0.5801
 epoch: 77, train_loss: 0.3789, test_loss: 1.5836, test_f1: 0.6168
 epoch: 78, train_loss: 0.3593, test_loss: 1.5615, test_f1: 0.6145
 epoch: 79, train_loss: 0.3904, test_loss: 1.4939, test_f1: 0.5965
 epoch: 80, train_loss: 0.4285, test_loss: 1.4430, test_f1: 0.6458
 epoch: 81, train_loss: 0.3822, test_loss: 1.3437, test_f1: 0.6367
 epoch: 82, train_loss: 0.3696, test_loss: 1.5191, test_f1: 0.6039
 epoch: 83, train_loss: 0.3456, test_loss: 1.5617, test_f1: 0.6344
 epoch: 84, train_loss: 0.3346, test_loss: 1.6355, test_f1: 0.6530
 epoch: 85, train_loss: 0.3422, test_loss: 1.6406, test_f1: 0.6041
 epoch: 86, train_loss: 0.3727, test_loss: 1.8498, test_f1: 0.5327
 epoch: 87, train_loss: 0.4100, test_loss: 1.5904, test_f1: 0.5615
 epoch: 88, train_loss: 0.3953, test_loss: 1.3902, test_f1: 0.6188
 epoch: 89, train_loss: 0.3703, test_loss: 2.2493, test_f1: 0.5603
 epoch: 90, train_loss: 0.4027, test_loss: 1.7796, test_f1: 0.6048
 epoch: 91, train_loss: 0.4320, test_loss: 1.7770, test_f1: 0.5726
 epoch: 92, train_loss: 0.4336, test_loss: 1.6980, test_f1: 0.6155
 epoch: 93, train_loss: 0.3662, test_loss: 1.7098, test_f1: 0.6510
 epoch: 94, train_loss: 0.3390, test_loss: 1.4817, test_f1: 0.6526
 epoch: 95, train_loss: 0.3556, test_loss: 1.6477, test_f1: 0.6045
 epoch: 96, train_loss: 0.3433, test_loss: 1.9515, test_f1: 0.5652
 epoch: 97, train_loss: 0.3142, test_loss: 2.1524, test_f1: 0.5727
 epoch: 98, train_loss: 0.3440, test_loss: 2.1456, test_f1: 0.5961
 epoch: 99, train_loss: 0.3757, test_loss: 2.0522, test_f1: 0.5653
##################ITERATION #7 ****************************************
 epoch: 0, train_loss: 1.3840, test_loss: 1.5364, test_f1: 0.1388
 epoch: 1, train_loss: 1.0697, test_loss: 1.1785, test_f1: 0.2562
 epoch: 2, train_loss: 1.0230, test_loss: 1.3576, test_f1: 0.3043
 epoch: 3, train_loss: 0.9743, test_loss: 1.1890, test_f1: 0.4081
 epoch: 4, train_loss: 0.9616, test_loss: 1.0652, test_f1: 0.4479
 epoch: 5, train_loss: 0.9349, test_loss: 1.1339, test_f1: 0.4594
 epoch: 6, train_loss: 0.9107, test_loss: 1.0151, test_f1: 0.5388
 epoch: 7, train_loss: 0.9002, test_loss: 1.3108, test_f1: 0.4576
 epoch: 8, train_loss: 0.9137, test_loss: 1.1455, test_f1: 0.5192
 epoch: 9, train_loss: 0.8870, test_loss: 1.0224, test_f1: 0.5569
 epoch: 10, train_loss: 0.9054, test_loss: 1.0284, test_f1: 0.5469
 epoch: 11, train_loss: 0.8563, test_loss: 1.0068, test_f1: 0.5565
 epoch: 12, train_loss: 0.8266, test_loss: 0.9524, test_f1: 0.6075
 epoch: 13, train_loss: 0.8131, test_loss: 1.5021, test_f1: 0.4615
 epoch: 14, train_loss: 0.8069, test_loss: 1.9276, test_f1: 0.3706
 epoch: 15, train_loss: 0.8006, test_loss: 1.9030, test_f1: 0.3204
 epoch: 16, train_loss: 0.7914, test_loss: 1.1210, test_f1: 0.4955
 epoch: 17, train_loss: 0.7738, test_loss: 1.2985, test_f1: 0.4538
 epoch: 18, train_loss: 0.7626, test_loss: 1.1970, test_f1: 0.5181
 epoch: 19, train_loss: 0.7698, test_loss: 1.0580, test_f1: 0.5317
 epoch: 20, train_loss: 0.7569, test_loss: 1.1355, test_f1: 0.5395
 epoch: 21, train_loss: 0.7362, test_loss: 1.0614, test_f1: 0.5544
 epoch: 22, train_loss: 0.7471, test_loss: 1.0379, test_f1: 0.5864
 epoch: 23, train_loss: 0.7396, test_loss: 1.4443, test_f1: 0.3932
 epoch: 24, train_loss: 0.7152, test_loss: 1.0643, test_f1: 0.5663
 epoch: 25, train_loss: 0.7406, test_loss: 1.0757, test_f1: 0.5465
 epoch: 26, train_loss: 0.7267, test_loss: 1.1985, test_f1: 0.5219
 epoch: 27, train_loss: 0.7147, test_loss: 1.2774, test_f1: 0.5009
 epoch: 28, train_loss: 0.7221, test_loss: 1.1166, test_f1: 0.5442
 epoch: 29, train_loss: 0.7111, test_loss: 1.1481, test_f1: 0.5867
 epoch: 30, train_loss: 0.6936, test_loss: 1.3652, test_f1: 0.5148
 epoch: 31, train_loss: 0.6830, test_loss: 1.2850, test_f1: 0.5660
 epoch: 32, train_loss: 0.7101, test_loss: 1.1061, test_f1: 0.5363
 epoch: 33, train_loss: 0.6932, test_loss: 1.1451, test_f1: 0.5980
 epoch: 34, train_loss: 0.6740, test_loss: 1.2613, test_f1: 0.5635
 epoch: 35, train_loss: 0.7226, test_loss: 1.0948, test_f1: 0.5816
 epoch: 36, train_loss: 0.7130, test_loss: 1.4591, test_f1: 0.4872
 epoch: 37, train_loss: 0.6789, test_loss: 1.2536, test_f1: 0.5699
 epoch: 38, train_loss: 0.6739, test_loss: 1.1786, test_f1: 0.6060
 epoch: 39, train_loss: 0.6203, test_loss: 1.3300, test_f1: 0.5304
 epoch: 40, train_loss: 0.6454, test_loss: 1.1408, test_f1: 0.6164
 epoch: 41, train_loss: 0.6932, test_loss: 1.4559, test_f1: 0.4276
 epoch: 42, train_loss: 0.7154, test_loss: 1.1903, test_f1: 0.5677
 epoch: 43, train_loss: 0.7157, test_loss: 2.6067, test_f1: 0.4357
 epoch: 44, train_loss: 0.6815, test_loss: 2.0020, test_f1: 0.4887
 epoch: 45, train_loss: 0.7165, test_loss: 1.2274, test_f1: 0.5413
 epoch: 46, train_loss: 0.6923, test_loss: 1.0247, test_f1: 0.6463
 epoch: 47, train_loss: 0.7493, test_loss: 1.0367, test_f1: 0.6428
 epoch: 48, train_loss: 0.6679, test_loss: 1.1054, test_f1: 0.5691
 epoch: 49, train_loss: 0.6573, test_loss: 1.1127, test_f1: 0.5795
 epoch: 50, train_loss: 0.6154, test_loss: 1.1201, test_f1: 0.5810
 epoch: 51, train_loss: 0.6266, test_loss: 1.2017, test_f1: 0.5805
 epoch: 52, train_loss: 0.5884, test_loss: 0.9995, test_f1: 0.6431
 epoch: 53, train_loss: 0.5575, test_loss: 1.0293, test_f1: 0.6253
 epoch: 54, train_loss: 0.5360, test_loss: 1.1434, test_f1: 0.5910
 epoch: 55, train_loss: 0.5192, test_loss: 1.1619, test_f1: 0.6189
 epoch: 56, train_loss: 0.4937, test_loss: 1.0718, test_f1: 0.6473
 epoch: 57, train_loss: 0.5021, test_loss: 1.5449, test_f1: 0.5919
 epoch: 58, train_loss: 0.5179, test_loss: 1.3013, test_f1: 0.5662
 epoch: 59, train_loss: 0.5053, test_loss: 1.1309, test_f1: 0.6505
 epoch: 60, train_loss: 0.4728, test_loss: 1.1801, test_f1: 0.6492
 epoch: 61, train_loss: 0.4660, test_loss: 1.1806, test_f1: 0.6335
 epoch: 62, train_loss: 0.4535, test_loss: 1.2883, test_f1: 0.6090
 epoch: 63, train_loss: 0.4516, test_loss: 1.4859, test_f1: 0.5895
 epoch: 64, train_loss: 0.4963, test_loss: 1.5641, test_f1: 0.5937
 epoch: 65, train_loss: 0.5019, test_loss: 1.3824, test_f1: 0.5652
 epoch: 66, train_loss: 0.5126, test_loss: 1.5080, test_f1: 0.5558
 epoch: 67, train_loss: 0.5030, test_loss: 1.3696, test_f1: 0.5845
 epoch: 68, train_loss: 0.5231, test_loss: 1.4364, test_f1: 0.5440
 epoch: 69, train_loss: 0.5088, test_loss: 1.4413, test_f1: 0.5401
 epoch: 70, train_loss: 0.4891, test_loss: 1.4275, test_f1: 0.5825
 epoch: 71, train_loss: 0.4689, test_loss: 1.2001, test_f1: 0.6050
 epoch: 72, train_loss: 0.4914, test_loss: 1.0816, test_f1: 0.6183
 epoch: 73, train_loss: 0.5183, test_loss: 1.2654, test_f1: 0.6143
 epoch: 74, train_loss: 0.4916, test_loss: 1.1093, test_f1: 0.6503
 epoch: 75, train_loss: 0.4620, test_loss: 1.1304, test_f1: 0.6221
 epoch: 76, train_loss: 0.4589, test_loss: 1.2867, test_f1: 0.6081
 epoch: 77, train_loss: 0.4270, test_loss: 1.3645, test_f1: 0.5900
 epoch: 78, train_loss: 0.4345, test_loss: 1.4632, test_f1: 0.6036
 epoch: 79, train_loss: 0.4154, test_loss: 1.4915, test_f1: 0.5805
 epoch: 80, train_loss: 0.4123, test_loss: 1.3108, test_f1: 0.6189
 epoch: 81, train_loss: 0.3947, test_loss: 1.3866, test_f1: 0.6310
 epoch: 82, train_loss: 0.3988, test_loss: 1.3551, test_f1: 0.5922
 epoch: 83, train_loss: 0.3793, test_loss: 1.4941, test_f1: 0.5478
 epoch: 84, train_loss: 0.4059, test_loss: 1.7100, test_f1: 0.5420
 epoch: 85, train_loss: 0.4023, test_loss: 1.6587, test_f1: 0.5925
 epoch: 86, train_loss: 0.4829, test_loss: 1.4800, test_f1: 0.5716
 epoch: 87, train_loss: 0.4632, test_loss: 1.7282, test_f1: 0.5620
 epoch: 88, train_loss: 0.4403, test_loss: 1.7832, test_f1: 0.5625
 epoch: 89, train_loss: 0.3939, test_loss: 1.9377, test_f1: 0.5253
 epoch: 90, train_loss: 0.3991, test_loss: 1.4274, test_f1: 0.6196
 epoch: 91, train_loss: 0.4082, test_loss: 1.5678, test_f1: 0.5834
 epoch: 92, train_loss: 0.3814, test_loss: 1.4477, test_f1: 0.6318
 epoch: 93, train_loss: 0.3804, test_loss: 1.4518, test_f1: 0.5745
 epoch: 94, train_loss: 0.3911, test_loss: 1.4758, test_f1: 0.6436
 epoch: 95, train_loss: 0.4278, test_loss: 1.6351, test_f1: 0.5987
 epoch: 96, train_loss: 0.3959, test_loss: 1.6222, test_f1: 0.5554
 epoch: 97, train_loss: 0.3879, test_loss: 1.5952, test_f1: 0.5526
 epoch: 98, train_loss: 0.3889, test_loss: 1.7394, test_f1: 0.5851
 epoch: 99, train_loss: 0.4087, test_loss: 1.6463, test_f1: 0.5858
##################ITERATION #8 ****************************************
 epoch: 0, train_loss: 1.5182, test_loss: 1.3268, test_f1: 0.2771
 epoch: 1, train_loss: 1.0863, test_loss: 1.4263, test_f1: 0.3176
 epoch: 2, train_loss: 0.9698, test_loss: 1.1171, test_f1: 0.5134
 epoch: 3, train_loss: 0.9632, test_loss: 1.2230, test_f1: 0.4407
 epoch: 4, train_loss: 0.9202, test_loss: 1.0587, test_f1: 0.5165
 epoch: 5, train_loss: 0.9020, test_loss: 1.0023, test_f1: 0.5113
 epoch: 6, train_loss: 0.8848, test_loss: 1.0807, test_f1: 0.4827
 epoch: 7, train_loss: 0.8765, test_loss: 1.2246, test_f1: 0.4420
 epoch: 8, train_loss: 0.8567, test_loss: 1.1208, test_f1: 0.5449
 epoch: 9, train_loss: 0.8289, test_loss: 1.1088, test_f1: 0.4884
 epoch: 10, train_loss: 0.8391, test_loss: 1.1327, test_f1: 0.4368
 epoch: 11, train_loss: 0.8987, test_loss: 1.1592, test_f1: 0.4418
 epoch: 12, train_loss: 0.8445, test_loss: 1.2268, test_f1: 0.4452
 epoch: 13, train_loss: 0.8270, test_loss: 1.0702, test_f1: 0.4847
 epoch: 14, train_loss: 0.8146, test_loss: 1.2040, test_f1: 0.5138
 epoch: 15, train_loss: 0.7794, test_loss: 1.0884, test_f1: 0.5079
 epoch: 16, train_loss: 0.7565, test_loss: 1.2583, test_f1: 0.4855
 epoch: 17, train_loss: 0.7575, test_loss: 1.0638, test_f1: 0.5269
 epoch: 18, train_loss: 0.7447, test_loss: 1.2614, test_f1: 0.4593
 epoch: 19, train_loss: 0.7314, test_loss: 1.3560, test_f1: 0.4640
 epoch: 20, train_loss: 0.7527, test_loss: 0.9959, test_f1: 0.5465
 epoch: 21, train_loss: 0.7352, test_loss: 1.0192, test_f1: 0.5898
 epoch: 22, train_loss: 0.7467, test_loss: 1.5090, test_f1: 0.3627
 epoch: 23, train_loss: 0.7888, test_loss: 1.2659, test_f1: 0.4206
 epoch: 24, train_loss: 0.7241, test_loss: 1.0304, test_f1: 0.5920
 epoch: 25, train_loss: 0.7230, test_loss: 1.1195, test_f1: 0.5821
 epoch: 26, train_loss: 0.7024, test_loss: 1.1542, test_f1: 0.5375
 epoch: 27, train_loss: 0.7177, test_loss: 0.9842, test_f1: 0.5962
 epoch: 28, train_loss: 0.6928, test_loss: 1.1548, test_f1: 0.5202
 epoch: 29, train_loss: 0.6566, test_loss: 1.1778, test_f1: 0.5539
 epoch: 30, train_loss: 0.6676, test_loss: 1.1297, test_f1: 0.5677
 epoch: 31, train_loss: 0.6421, test_loss: 1.0339, test_f1: 0.5738
 epoch: 32, train_loss: 0.6288, test_loss: 1.1854, test_f1: 0.5594
 epoch: 33, train_loss: 0.6333, test_loss: 1.1535, test_f1: 0.5412
 epoch: 34, train_loss: 0.6394, test_loss: 1.1288, test_f1: 0.5941
 epoch: 35, train_loss: 0.6333, test_loss: 1.0813, test_f1: 0.5885
 epoch: 36, train_loss: 0.6091, test_loss: 1.1394, test_f1: 0.5814
 epoch: 37, train_loss: 0.5917, test_loss: 1.1809, test_f1: 0.5952
 epoch: 38, train_loss: 0.6239, test_loss: 1.2864, test_f1: 0.5827
 epoch: 39, train_loss: 0.6863, test_loss: 1.8258, test_f1: 0.4978
 epoch: 40, train_loss: 0.6646, test_loss: 1.2121, test_f1: 0.5030
 epoch: 41, train_loss: 0.6454, test_loss: 1.0781, test_f1: 0.6008
 epoch: 42, train_loss: 0.6033, test_loss: 1.7348, test_f1: 0.5179
 epoch: 43, train_loss: 0.6434, test_loss: 1.1302, test_f1: 0.5388
 epoch: 44, train_loss: 0.5976, test_loss: 1.2678, test_f1: 0.5729
 epoch: 45, train_loss: 0.6313, test_loss: 1.1946, test_f1: 0.5910
 epoch: 46, train_loss: 0.6614, test_loss: 1.1631, test_f1: 0.5325
 epoch: 47, train_loss: 0.6372, test_loss: 1.1433, test_f1: 0.5642
 epoch: 48, train_loss: 0.6044, test_loss: 1.2308, test_f1: 0.6270
 epoch: 49, train_loss: 0.5848, test_loss: 1.6259, test_f1: 0.4191
 epoch: 50, train_loss: 0.5873, test_loss: 2.1074, test_f1: 0.4683
 epoch: 51, train_loss: 0.5731, test_loss: 1.2984, test_f1: 0.6055
 epoch: 52, train_loss: 0.5385, test_loss: 1.3764, test_f1: 0.5793
 epoch: 53, train_loss: 0.5330, test_loss: 1.4509, test_f1: 0.6122
 epoch: 54, train_loss: 0.5220, test_loss: 1.2981, test_f1: 0.6459
 epoch: 55, train_loss: 0.5085, test_loss: 1.2661, test_f1: 0.6174
 epoch: 56, train_loss: 0.4932, test_loss: 1.3641, test_f1: 0.5802
 epoch: 57, train_loss: 0.4861, test_loss: 1.3033, test_f1: 0.6309
 epoch: 58, train_loss: 0.4960, test_loss: 1.2692, test_f1: 0.6124
 epoch: 59, train_loss: 0.4737, test_loss: 1.4466, test_f1: 0.5838
 epoch: 60, train_loss: 0.4743, test_loss: 1.5713, test_f1: 0.5975
 epoch: 61, train_loss: 0.4956, test_loss: 1.4734, test_f1: 0.6095
 epoch: 62, train_loss: 0.4929, test_loss: 1.2725, test_f1: 0.6536
 epoch: 63, train_loss: 0.4820, test_loss: 2.4916, test_f1: 0.4310
 epoch: 64, train_loss: 0.5734, test_loss: 1.6297, test_f1: 0.5547
 epoch: 65, train_loss: 0.5706, test_loss: 1.5880, test_f1: 0.5234
 epoch: 66, train_loss: 0.4894, test_loss: 1.2980, test_f1: 0.5301
 epoch: 67, train_loss: 0.4813, test_loss: 1.5974, test_f1: 0.5245
 epoch: 68, train_loss: 0.4400, test_loss: 1.4851, test_f1: 0.6039
 epoch: 69, train_loss: 0.4559, test_loss: 1.5043, test_f1: 0.6260
 epoch: 70, train_loss: 0.4235, test_loss: 1.5911, test_f1: 0.6264
 epoch: 71, train_loss: 0.4776, test_loss: 1.6411, test_f1: 0.6099
 epoch: 72, train_loss: 0.4521, test_loss: 1.4168, test_f1: 0.6305
 epoch: 73, train_loss: 0.4597, test_loss: 1.6019, test_f1: 0.6098
 epoch: 74, train_loss: 0.4353, test_loss: 1.7246, test_f1: 0.5794
 epoch: 75, train_loss: 0.4197, test_loss: 1.6036, test_f1: 0.6699
 epoch: 76, train_loss: 0.4229, test_loss: 2.0037, test_f1: 0.5698
 epoch: 77, train_loss: 0.3928, test_loss: 1.6698, test_f1: 0.6267
 epoch: 78, train_loss: 0.3690, test_loss: 1.5825, test_f1: 0.6268
 epoch: 79, train_loss: 0.3487, test_loss: 1.7036, test_f1: 0.6320
 epoch: 80, train_loss: 0.3812, test_loss: 1.7509, test_f1: 0.6349
 epoch: 81, train_loss: 0.3885, test_loss: 1.8076, test_f1: 0.5934
 epoch: 82, train_loss: 0.4035, test_loss: 1.5232, test_f1: 0.6348
 epoch: 83, train_loss: 0.4074, test_loss: 1.9056, test_f1: 0.6040
 epoch: 84, train_loss: 0.4248, test_loss: 1.6451, test_f1: 0.5611
 epoch: 85, train_loss: 0.4091, test_loss: 1.6109, test_f1: 0.6244
 epoch: 86, train_loss: 0.3616, test_loss: 1.7882, test_f1: 0.6473
 epoch: 87, train_loss: 0.3345, test_loss: 1.9109, test_f1: 0.5958
 epoch: 88, train_loss: 0.3321, test_loss: 1.9486, test_f1: 0.5882
 epoch: 89, train_loss: 0.3560, test_loss: 1.7146, test_f1: 0.6400
 epoch: 90, train_loss: 0.3461, test_loss: 1.9326, test_f1: 0.6095
 epoch: 91, train_loss: 0.3374, test_loss: 1.5741, test_f1: 0.6169
 epoch: 92, train_loss: 0.3779, test_loss: 1.6287, test_f1: 0.6405
 epoch: 93, train_loss: 0.3424, test_loss: 1.7364, test_f1: 0.6017
 epoch: 94, train_loss: 0.3427, test_loss: 1.8837, test_f1: 0.6335
 epoch: 95, train_loss: 0.3169, test_loss: 1.8863, test_f1: 0.6285
 epoch: 96, train_loss: 0.3566, test_loss: 1.8790, test_f1: 0.6370
 epoch: 97, train_loss: 0.3193, test_loss: 2.1130, test_f1: 0.5771
 epoch: 98, train_loss: 0.3434, test_loss: 1.9544, test_f1: 0.5912
 epoch: 99, train_loss: 0.3088, test_loss: 1.7279, test_f1: 0.6191
##################ITERATION #9 ****************************************
 epoch: 0, train_loss: 1.4798, test_loss: 1.6505, test_f1: 0.1365
 epoch: 1, train_loss: 1.0964, test_loss: 1.3915, test_f1: 0.1371
 epoch: 2, train_loss: 1.0040, test_loss: 1.4604, test_f1: 0.1730
 epoch: 3, train_loss: 0.9586, test_loss: 1.3199, test_f1: 0.3400
 epoch: 4, train_loss: 0.9408, test_loss: 1.2955, test_f1: 0.2905
 epoch: 5, train_loss: 0.9170, test_loss: 1.0516, test_f1: 0.4771
 epoch: 6, train_loss: 0.9012, test_loss: 1.0282, test_f1: 0.5192
 epoch: 7, train_loss: 0.8785, test_loss: 1.1024, test_f1: 0.4720
 epoch: 8, train_loss: 0.8815, test_loss: 1.2867, test_f1: 0.4738
 epoch: 9, train_loss: 0.8321, test_loss: 1.2186, test_f1: 0.5035
 epoch: 10, train_loss: 0.8246, test_loss: 1.1876, test_f1: 0.4844
 epoch: 11, train_loss: 0.8219, test_loss: 1.1227, test_f1: 0.4775
 epoch: 12, train_loss: 0.7887, test_loss: 1.5912, test_f1: 0.4150
 epoch: 13, train_loss: 0.8272, test_loss: 1.1905, test_f1: 0.4143
 epoch: 14, train_loss: 0.8336, test_loss: 1.5625, test_f1: 0.4020
 epoch: 15, train_loss: 0.7864, test_loss: 1.0141, test_f1: 0.5458
 epoch: 16, train_loss: 0.8371, test_loss: 1.1735, test_f1: 0.4762
 epoch: 17, train_loss: 0.9237, test_loss: 1.1041, test_f1: 0.4622
 epoch: 18, train_loss: 0.8209, test_loss: 1.0007, test_f1: 0.5023
 epoch: 19, train_loss: 0.7970, test_loss: 1.0336, test_f1: 0.4653
 epoch: 20, train_loss: 0.7776, test_loss: 1.4279, test_f1: 0.5096
 epoch: 21, train_loss: 0.7444, test_loss: 1.2102, test_f1: 0.4957
 epoch: 22, train_loss: 0.7307, test_loss: 1.1482, test_f1: 0.5138
 epoch: 23, train_loss: 0.7565, test_loss: 1.1634, test_f1: 0.4718
 epoch: 24, train_loss: 0.7300, test_loss: 1.0299, test_f1: 0.4680
 epoch: 25, train_loss: 0.7638, test_loss: 1.5627, test_f1: 0.3804
 epoch: 26, train_loss: 0.7528, test_loss: 0.9465, test_f1: 0.5739
 epoch: 27, train_loss: 0.7483, test_loss: 0.9401, test_f1: 0.5945
 epoch: 28, train_loss: 0.6927, test_loss: 0.9525, test_f1: 0.5659
 epoch: 29, train_loss: 0.6975, test_loss: 0.9680, test_f1: 0.6115
 epoch: 30, train_loss: 0.6766, test_loss: 0.9540, test_f1: 0.6363
 epoch: 31, train_loss: 0.6958, test_loss: 1.0932, test_f1: 0.5467
 epoch: 32, train_loss: 0.6776, test_loss: 1.4006, test_f1: 0.5162
 epoch: 33, train_loss: 0.6702, test_loss: 1.2125, test_f1: 0.5730
 epoch: 34, train_loss: 0.6593, test_loss: 0.9618, test_f1: 0.5970
 epoch: 35, train_loss: 0.6452, test_loss: 1.0823, test_f1: 0.5725
 epoch: 36, train_loss: 0.6257, test_loss: 1.2037, test_f1: 0.5810
 epoch: 37, train_loss: 0.6117, test_loss: 1.4154, test_f1: 0.5367
 epoch: 38, train_loss: 0.6564, test_loss: 1.3740, test_f1: 0.3932
 epoch: 39, train_loss: 0.6405, test_loss: 0.9131, test_f1: 0.6414
 epoch: 40, train_loss: 0.6286, test_loss: 1.4234, test_f1: 0.4573
 epoch: 41, train_loss: 0.6422, test_loss: 1.4379, test_f1: 0.5367
 epoch: 42, train_loss: 0.5944, test_loss: 1.2646, test_f1: 0.5710
 epoch: 43, train_loss: 0.5739, test_loss: 1.1811, test_f1: 0.6031
 epoch: 44, train_loss: 0.5616, test_loss: 1.2851, test_f1: 0.5485
 epoch: 45, train_loss: 0.5758, test_loss: 1.4069, test_f1: 0.5620
 epoch: 46, train_loss: 0.6000, test_loss: 1.4203, test_f1: 0.5909
 epoch: 47, train_loss: 0.5900, test_loss: 1.3137, test_f1: 0.5766
 epoch: 48, train_loss: 0.5828, test_loss: 1.4787, test_f1: 0.5302
 epoch: 49, train_loss: 0.5887, test_loss: 1.4139, test_f1: 0.5845
 epoch: 50, train_loss: 0.5606, test_loss: 1.5074, test_f1: 0.5545
 epoch: 51, train_loss: 0.5406, test_loss: 1.3719, test_f1: 0.5961
 epoch: 52, train_loss: 0.5175, test_loss: 1.4920, test_f1: 0.6015
 epoch: 53, train_loss: 0.5207, test_loss: 1.2976, test_f1: 0.6487
 epoch: 54, train_loss: 0.5162, test_loss: 1.3309, test_f1: 0.6600
 epoch: 55, train_loss: 0.4812, test_loss: 1.4037, test_f1: 0.6237
 epoch: 56, train_loss: 0.5054, test_loss: 1.3149, test_f1: 0.6320
 epoch: 57, train_loss: 0.4911, test_loss: 1.5663, test_f1: 0.6177
 epoch: 58, train_loss: 0.5120, test_loss: 1.2261, test_f1: 0.6208
 epoch: 59, train_loss: 0.4810, test_loss: 1.3225, test_f1: 0.6155
 epoch: 60, train_loss: 0.5015, test_loss: 1.2445, test_f1: 0.6345
 epoch: 61, train_loss: 0.5026, test_loss: 1.3684, test_f1: 0.6594
 epoch: 62, train_loss: 0.5090, test_loss: 1.2973, test_f1: 0.6045
 epoch: 63, train_loss: 0.4688, test_loss: 2.0554, test_f1: 0.4956
 epoch: 64, train_loss: 0.4697, test_loss: 1.4475, test_f1: 0.5810
 epoch: 65, train_loss: 0.4218, test_loss: 1.3676, test_f1: 0.6574
 epoch: 66, train_loss: 0.4579, test_loss: 1.4501, test_f1: 0.6150
 epoch: 67, train_loss: 0.4422, test_loss: 1.2306, test_f1: 0.6317
 epoch: 68, train_loss: 0.4279, test_loss: 1.3856, test_f1: 0.6435
 epoch: 69, train_loss: 0.4727, test_loss: 1.3433, test_f1: 0.6527
 epoch: 70, train_loss: 0.4500, test_loss: 1.3530, test_f1: 0.6453
 epoch: 71, train_loss: 0.4582, test_loss: 1.3508, test_f1: 0.6534
 epoch: 72, train_loss: 0.4433, test_loss: 1.4891, test_f1: 0.5972
 epoch: 73, train_loss: 0.4099, test_loss: 1.4581, test_f1: 0.6354
 epoch: 74, train_loss: 0.4211, test_loss: 1.8420, test_f1: 0.6286
 epoch: 75, train_loss: 0.4132, test_loss: 1.5689, test_f1: 0.6499
 epoch: 76, train_loss: 0.4160, test_loss: 1.6746, test_f1: 0.6126
 epoch: 77, train_loss: 0.4240, test_loss: 1.3892, test_f1: 0.6468
 epoch: 78, train_loss: 0.4054, test_loss: 1.3202, test_f1: 0.6479
 epoch: 79, train_loss: 0.4195, test_loss: 1.6073, test_f1: 0.5629
 epoch: 80, train_loss: 0.4083, test_loss: 1.8194, test_f1: 0.5866
 epoch: 81, train_loss: 0.4120, test_loss: 1.7112, test_f1: 0.6443
 epoch: 82, train_loss: 0.4367, test_loss: 1.6611, test_f1: 0.5725
 epoch: 83, train_loss: 0.4030, test_loss: 1.5425, test_f1: 0.6471
 epoch: 84, train_loss: 0.3816, test_loss: 1.6461, test_f1: 0.5862
 epoch: 85, train_loss: 0.3870, test_loss: 1.5236, test_f1: 0.6353
 epoch: 86, train_loss: 0.3714, test_loss: 1.6335, test_f1: 0.6386
 epoch: 87, train_loss: 0.3895, test_loss: 1.5549, test_f1: 0.6187
 epoch: 88, train_loss: 0.4103, test_loss: 1.8321, test_f1: 0.5990
 epoch: 89, train_loss: 0.4086, test_loss: 1.7525, test_f1: 0.6143
 epoch: 90, train_loss: 0.3746, test_loss: 1.4481, test_f1: 0.6738
 epoch: 91, train_loss: 0.3337, test_loss: 1.6354, test_f1: 0.6410
 epoch: 92, train_loss: 0.3326, test_loss: 1.6079, test_f1: 0.6569
 epoch: 93, train_loss: 0.3995, test_loss: 1.7566, test_f1: 0.6436
 epoch: 94, train_loss: 0.3933, test_loss: 1.7500, test_f1: 0.4974
 epoch: 95, train_loss: 0.3557, test_loss: 1.7385, test_f1: 0.5801
 epoch: 96, train_loss: 0.3472, test_loss: 1.6216, test_f1: 0.6577
 epoch: 97, train_loss: 0.3298, test_loss: 1.6949, test_f1: 0.6488
 epoch: 98, train_loss: 0.3345, test_loss: 1.6248, test_f1: 0.6559
 epoch: 99, train_loss: 0.2817, test_loss: 1.6199, test_f1: 0.6763

Training completed in 357.26 seconds
Best F1: 0.6763 at epoch 99
Mean F1 across iterations: 0.6512  0.0126
========================FINAL RESULTS================================
FEGIN weighted F1: 0.6763  0.0126
python main.py --data ltspice_demos --representation component_pin_net --model FEGIN --layers 5 --hiddens 128 --batch_size 256 --lr 0.01 --emb_size 512 --epochs 100 --save_appendix component_pin_net_L5_H128_BS256_LR0.01_E512 --no_val
-----



STDERR:
Processing...
Done!
  File "main.py", line 370, in <module>
    main()
  File "main.py", line 254, in main
    dataset = dataset_class(
  File "/home/philip/projects/ltspice_examples_code_repo/Circuit-Completion-Using-GNNs/component_classification_with_link_prediction_head/evaluation/FEGIN/kernel/circuit_datasets.py", line 15, in __init__
    self.data, self.slices = torch.load(self.processed_paths[0])
  File "/home/philip/.local/lib/python3.8/site-packages/torch/serialization.py", line 1040, in load
    warnings.warn(
  File "/usr/lib/python3.8/warnings.py", line 109, in _showwarnmsg
    sw(msg.message, msg.category, msg.filename, msg.lineno,
  File "main.py", line 47, in warn_with_traceback
    traceback.print_stack(file=log)
/home/philip/projects/ltspice_examples_code_repo/Circuit-Completion-Using-GNNs/component_classification_with_link_prediction_head/evaluation/FEGIN/kernel/circuit_datasets.py:15: FutureWarning: You are using `torch.load` with `weights_only=False` (the current default value), which uses the default pickle module implicitly. It is possible to construct malicious pickle data which will execute arbitrary code during unpickling (See https://github.com/pytorch/pytorch/blob/main/SECURITY.md#untrusted-models for more details). In a future release, the default value for `weights_only` will be flipped to `True`. This limits the functions that could be executed during unpickling. Arbitrary objects will no longer be allowed to be loaded via this mode unless they are explicitly allowlisted by the user via `torch.serialization.add_safe_globals`. We recommend you start setting `weights_only=True` for any use case where you don't have full control of the loaded file. Please open an issue on GitHub for any issues related to this experimental feature.
  self.data, self.slices = torch.load(self.processed_paths[0])
