STDOUT:
Results will be saved in /home/philip/projects/ltspice_examples_code_repo/Circuit-Completion-Using-GNNs/component_classification_with_link_prediction_head/evaluation/FEGIN/results/model_FEGIN_dataset_ltspice_examples
Command line input: python main.py --data ltspice_examples --representation component_component --model FEGIN --layers 5 --hiddens 32 --batch_size 64 --lr 0.01 --emb_size 250 --epochs 100 --save_appendix component_component_L5_H32_BS64_LR0.01_E250 --no_val
 is saved.
-----
ltspice_examples - FEGIN
Using 5 layers, 32 hidden units, h = 2
Loading component_component representation dataset
ENTERED
Training FEGIN on component_component representation
Train: 3556, Test: 845
##################ITERATION #0 ****************************************
 epoch: 0, train_loss: 1.2695, test_loss: 1.3165, test_f1: 0.2909
 epoch: 1, train_loss: 1.1943, test_loss: 1.1182, test_f1: 0.3965
 epoch: 2, train_loss: 1.1278, test_loss: 1.0857, test_f1: 0.4335
 epoch: 3, train_loss: 1.0809, test_loss: 0.9945, test_f1: 0.4603
 epoch: 4, train_loss: 1.0655, test_loss: 1.0557, test_f1: 0.4448
 epoch: 5, train_loss: 1.0575, test_loss: 1.0671, test_f1: 0.4631
 epoch: 6, train_loss: 1.0292, test_loss: 1.0458, test_f1: 0.4901
 epoch: 7, train_loss: 1.0256, test_loss: 1.0784, test_f1: 0.4923
 epoch: 8, train_loss: 0.9924, test_loss: 1.0972, test_f1: 0.5131
 epoch: 9, train_loss: 0.9878, test_loss: 1.0716, test_f1: 0.4812
 epoch: 10, train_loss: 0.9749, test_loss: 1.0219, test_f1: 0.5046
 epoch: 11, train_loss: 0.9805, test_loss: 1.0288, test_f1: 0.4626
 epoch: 12, train_loss: 0.9525, test_loss: 1.0525, test_f1: 0.5483
 epoch: 13, train_loss: 0.9518, test_loss: 1.0153, test_f1: 0.4603
 epoch: 14, train_loss: 0.9410, test_loss: 0.9921, test_f1: 0.4552
 epoch: 15, train_loss: 0.9151, test_loss: 1.0479, test_f1: 0.5083
 epoch: 16, train_loss: 0.9148, test_loss: 1.1306, test_f1: 0.4818
 epoch: 17, train_loss: 0.9180, test_loss: 1.1486, test_f1: 0.5013
 epoch: 18, train_loss: 0.9235, test_loss: 0.9609, test_f1: 0.4793
 epoch: 19, train_loss: 0.9199, test_loss: 1.0628, test_f1: 0.4974
 epoch: 20, train_loss: 0.9084, test_loss: 1.0639, test_f1: 0.5167
 epoch: 21, train_loss: 0.8892, test_loss: 1.4658, test_f1: 0.4724
 epoch: 22, train_loss: 0.9016, test_loss: 1.1485, test_f1: 0.4913
 epoch: 23, train_loss: 0.8803, test_loss: 1.1091, test_f1: 0.4988
 epoch: 24, train_loss: 0.8874, test_loss: 1.1056, test_f1: 0.4981
 epoch: 25, train_loss: 0.8792, test_loss: 1.1502, test_f1: 0.5105
 epoch: 26, train_loss: 0.8781, test_loss: 1.1055, test_f1: 0.4912
 epoch: 27, train_loss: 0.9017, test_loss: 1.2290, test_f1: 0.4576
 epoch: 28, train_loss: 0.8724, test_loss: 1.0753, test_f1: 0.5280
 epoch: 29, train_loss: 0.8788, test_loss: 1.0674, test_f1: 0.5096
 epoch: 30, train_loss: 0.8724, test_loss: 1.1531, test_f1: 0.5004
 epoch: 31, train_loss: 0.8548, test_loss: 1.1449, test_f1: 0.5106
 epoch: 32, train_loss: 0.8438, test_loss: 1.1330, test_f1: 0.5416
 epoch: 33, train_loss: 0.8710, test_loss: 1.0654, test_f1: 0.4988
 epoch: 34, train_loss: 0.8385, test_loss: 1.1656, test_f1: 0.5218
 epoch: 35, train_loss: 0.8633, test_loss: 1.5052, test_f1: 0.4937
 epoch: 36, train_loss: 0.8263, test_loss: 1.1986, test_f1: 0.4929
 epoch: 37, train_loss: 0.8290, test_loss: 1.0165, test_f1: 0.5341
 epoch: 38, train_loss: 0.8542, test_loss: 1.2040, test_f1: 0.4814
 epoch: 39, train_loss: 0.8306, test_loss: 0.9906, test_f1: 0.5198
 epoch: 40, train_loss: 0.8360, test_loss: 1.2791, test_f1: 0.5081
 epoch: 41, train_loss: 0.8229, test_loss: 1.2463, test_f1: 0.5237
 epoch: 42, train_loss: 0.8152, test_loss: 1.1390, test_f1: 0.5244
 epoch: 43, train_loss: 0.8163, test_loss: 1.0900, test_f1: 0.5664
 epoch: 44, train_loss: 0.8262, test_loss: 1.0564, test_f1: 0.5595
 epoch: 45, train_loss: 0.8138, test_loss: 1.1203, test_f1: 0.5261
 epoch: 46, train_loss: 0.8103, test_loss: 1.0070, test_f1: 0.5358
 epoch: 47, train_loss: 0.8260, test_loss: 1.1558, test_f1: 0.5080
 epoch: 48, train_loss: 0.8180, test_loss: 1.0746, test_f1: 0.5461
 epoch: 49, train_loss: 0.8025, test_loss: 1.1861, test_f1: 0.5349
 epoch: 50, train_loss: 0.8055, test_loss: 1.1596, test_f1: 0.5224
 epoch: 51, train_loss: 0.7752, test_loss: 1.1435, test_f1: 0.5473
 epoch: 52, train_loss: 0.7581, test_loss: 1.1590, test_f1: 0.5527
 epoch: 53, train_loss: 0.7590, test_loss: 1.0430, test_f1: 0.5535
 epoch: 54, train_loss: 0.7454, test_loss: 1.1168, test_f1: 0.5636
 epoch: 55, train_loss: 0.7283, test_loss: 1.1721, test_f1: 0.5487
 epoch: 56, train_loss: 0.7354, test_loss: 1.0842, test_f1: 0.5799
 epoch: 57, train_loss: 0.7612, test_loss: 1.0371, test_f1: 0.5661
 epoch: 58, train_loss: 0.7403, test_loss: 1.1204, test_f1: 0.5710
 epoch: 59, train_loss: 0.7401, test_loss: 1.1739, test_f1: 0.5538
 epoch: 60, train_loss: 0.7407, test_loss: 1.1680, test_f1: 0.5375
 epoch: 61, train_loss: 0.7183, test_loss: 1.2587, test_f1: 0.5502
 epoch: 62, train_loss: 0.7264, test_loss: 1.1213, test_f1: 0.5665
 epoch: 63, train_loss: 0.7212, test_loss: 1.1321, test_f1: 0.5541
 epoch: 64, train_loss: 0.7173, test_loss: 1.0614, test_f1: 0.5687
 epoch: 65, train_loss: 0.7256, test_loss: 1.2107, test_f1: 0.5488
 epoch: 66, train_loss: 0.7013, test_loss: 1.2519, test_f1: 0.5409
 epoch: 67, train_loss: 0.7188, test_loss: 1.1673, test_f1: 0.5460
 epoch: 68, train_loss: 0.6925, test_loss: 1.1941, test_f1: 0.5648
 epoch: 69, train_loss: 0.6978, test_loss: 1.1418, test_f1: 0.5701
 epoch: 70, train_loss: 0.6996, test_loss: 1.2373, test_f1: 0.5675
 epoch: 71, train_loss: 0.6973, test_loss: 1.1727, test_f1: 0.5574
 epoch: 72, train_loss: 0.6884, test_loss: 1.2312, test_f1: 0.5620
 epoch: 73, train_loss: 0.6938, test_loss: 1.2372, test_f1: 0.5379
 epoch: 74, train_loss: 0.7122, test_loss: 1.1685, test_f1: 0.5442
 epoch: 75, train_loss: 0.6843, test_loss: 1.1814, test_f1: 0.5415
 epoch: 76, train_loss: 0.6869, test_loss: 1.1590, test_f1: 0.5631
 epoch: 77, train_loss: 0.6861, test_loss: 1.1237, test_f1: 0.5617
 epoch: 78, train_loss: 0.6813, test_loss: 1.2205, test_f1: 0.5451
 epoch: 79, train_loss: 0.6951, test_loss: 1.3346, test_f1: 0.5450
 epoch: 80, train_loss: 0.6723, test_loss: 1.2023, test_f1: 0.5444
 epoch: 81, train_loss: 0.7035, test_loss: 1.2015, test_f1: 0.5754
 epoch: 82, train_loss: 0.6922, test_loss: 1.2349, test_f1: 0.5395
 epoch: 83, train_loss: 0.6753, test_loss: 1.2072, test_f1: 0.5510
 epoch: 84, train_loss: 0.6816, test_loss: 1.1736, test_f1: 0.5526
 epoch: 85, train_loss: 0.6642, test_loss: 1.1701, test_f1: 0.5814
 epoch: 86, train_loss: 0.6782, test_loss: 1.1809, test_f1: 0.5847
 epoch: 87, train_loss: 0.6787, test_loss: 1.1488, test_f1: 0.5608
 epoch: 88, train_loss: 0.6630, test_loss: 1.2479, test_f1: 0.5480
 epoch: 89, train_loss: 0.6751, test_loss: 1.1956, test_f1: 0.5680
 epoch: 90, train_loss: 0.6630, test_loss: 1.1399, test_f1: 0.5630
 epoch: 91, train_loss: 0.6691, test_loss: 1.1908, test_f1: 0.5464
 epoch: 92, train_loss: 0.6700, test_loss: 1.2031, test_f1: 0.5494
 epoch: 93, train_loss: 0.6626, test_loss: 1.1304, test_f1: 0.5616
 epoch: 94, train_loss: 0.6495, test_loss: 1.2076, test_f1: 0.5593
 epoch: 95, train_loss: 0.6685, test_loss: 1.3206, test_f1: 0.5647
 epoch: 96, train_loss: 0.6463, test_loss: 1.1974, test_f1: 0.5657
 epoch: 97, train_loss: 0.6634, test_loss: 1.2386, test_f1: 0.5451
 epoch: 98, train_loss: 0.6439, test_loss: 1.2652, test_f1: 0.5567
 epoch: 99, train_loss: 0.6492, test_loss: 1.2518, test_f1: 0.5524
##################ITERATION #1 ****************************************
 epoch: 0, train_loss: 1.2534, test_loss: 1.1840, test_f1: 0.4046
 epoch: 1, train_loss: 1.1588, test_loss: 1.0424, test_f1: 0.4427
 epoch: 2, train_loss: 1.0974, test_loss: 0.9831, test_f1: 0.4582
 epoch: 3, train_loss: 1.0669, test_loss: 1.0378, test_f1: 0.4565
 epoch: 4, train_loss: 1.0369, test_loss: 1.0751, test_f1: 0.3886
 epoch: 5, train_loss: 1.0381, test_loss: 0.9837, test_f1: 0.4701
 epoch: 6, train_loss: 1.0162, test_loss: 0.9963, test_f1: 0.4295
 epoch: 7, train_loss: 0.9942, test_loss: 0.9268, test_f1: 0.4932
 epoch: 8, train_loss: 0.9892, test_loss: 1.0023, test_f1: 0.5101
 epoch: 9, train_loss: 0.9870, test_loss: 0.9334, test_f1: 0.5035
 epoch: 10, train_loss: 0.9924, test_loss: 0.9915, test_f1: 0.4773
 epoch: 11, train_loss: 0.9746, test_loss: 0.9828, test_f1: 0.4861
 epoch: 12, train_loss: 0.9514, test_loss: 1.0063, test_f1: 0.4983
 epoch: 13, train_loss: 0.9614, test_loss: 1.0001, test_f1: 0.4836
 epoch: 14, train_loss: 0.9613, test_loss: 1.0304, test_f1: 0.4713
 epoch: 15, train_loss: 0.9357, test_loss: 0.9797, test_f1: 0.5011
 epoch: 16, train_loss: 0.9306, test_loss: 1.0072, test_f1: 0.5042
 epoch: 17, train_loss: 0.9265, test_loss: 0.9820, test_f1: 0.5193
 epoch: 18, train_loss: 0.9169, test_loss: 1.0482, test_f1: 0.4945
 epoch: 19, train_loss: 0.9209, test_loss: 1.0336, test_f1: 0.5093
 epoch: 20, train_loss: 0.9114, test_loss: 1.0679, test_f1: 0.4989
 epoch: 21, train_loss: 0.9144, test_loss: 0.9653, test_f1: 0.4991
 epoch: 22, train_loss: 0.9020, test_loss: 1.0034, test_f1: 0.5067
 epoch: 23, train_loss: 0.9006, test_loss: 0.9748, test_f1: 0.5045
 epoch: 24, train_loss: 0.8820, test_loss: 1.0063, test_f1: 0.4892
 epoch: 25, train_loss: 0.8917, test_loss: 0.9580, test_f1: 0.5092
 epoch: 26, train_loss: 0.8846, test_loss: 0.9726, test_f1: 0.4952
 epoch: 27, train_loss: 0.8698, test_loss: 1.0328, test_f1: 0.5072
 epoch: 28, train_loss: 0.8732, test_loss: 0.9924, test_f1: 0.5361
 epoch: 29, train_loss: 0.8623, test_loss: 1.0519, test_f1: 0.4738
 epoch: 30, train_loss: 0.8878, test_loss: 0.9813, test_f1: 0.4969
 epoch: 31, train_loss: 0.8602, test_loss: 0.9950, test_f1: 0.5286
 epoch: 32, train_loss: 0.8852, test_loss: 1.1504, test_f1: 0.5214
 epoch: 33, train_loss: 0.8557, test_loss: 1.1265, test_f1: 0.4986
 epoch: 34, train_loss: 0.8623, test_loss: 1.0251, test_f1: 0.4904
 epoch: 35, train_loss: 0.8528, test_loss: 0.9740, test_f1: 0.4842
 epoch: 36, train_loss: 0.8606, test_loss: 1.0201, test_f1: 0.4958
 epoch: 37, train_loss: 0.8679, test_loss: 0.9830, test_f1: 0.4747
 epoch: 38, train_loss: 0.8633, test_loss: 1.0524, test_f1: 0.5400
 epoch: 39, train_loss: 0.8405, test_loss: 1.0532, test_f1: 0.4846
 epoch: 40, train_loss: 0.8499, test_loss: 1.1116, test_f1: 0.4909
 epoch: 41, train_loss: 0.8618, test_loss: 1.0225, test_f1: 0.5091
 epoch: 42, train_loss: 0.8516, test_loss: 1.0671, test_f1: 0.4853
 epoch: 43, train_loss: 0.8396, test_loss: 1.0482, test_f1: 0.5167
 epoch: 44, train_loss: 0.8421, test_loss: 1.0831, test_f1: 0.4887
 epoch: 45, train_loss: 0.8404, test_loss: 1.1339, test_f1: 0.4745
 epoch: 46, train_loss: 0.8231, test_loss: 1.0319, test_f1: 0.5042
 epoch: 47, train_loss: 0.8341, test_loss: 1.0840, test_f1: 0.5045
 epoch: 48, train_loss: 0.8448, test_loss: 0.9660, test_f1: 0.5036
 epoch: 49, train_loss: 0.8272, test_loss: 1.0571, test_f1: 0.5095
 epoch: 50, train_loss: 0.8265, test_loss: 1.0618, test_f1: 0.5169
 epoch: 51, train_loss: 0.8089, test_loss: 0.9845, test_f1: 0.5326
 epoch: 52, train_loss: 0.7937, test_loss: 1.2794, test_f1: 0.4960
 epoch: 53, train_loss: 0.7846, test_loss: 1.1833, test_f1: 0.5084
 epoch: 54, train_loss: 0.7792, test_loss: 1.0261, test_f1: 0.5054
 epoch: 55, train_loss: 0.7764, test_loss: 1.0204, test_f1: 0.5149
 epoch: 56, train_loss: 0.7656, test_loss: 0.9924, test_f1: 0.5211
 epoch: 57, train_loss: 0.7674, test_loss: 0.9942, test_f1: 0.5147
 epoch: 58, train_loss: 0.7758, test_loss: 1.0223, test_f1: 0.5219
 epoch: 59, train_loss: 0.7738, test_loss: 1.0865, test_f1: 0.4989
 epoch: 60, train_loss: 0.7673, test_loss: 1.2426, test_f1: 0.5025
 epoch: 61, train_loss: 0.7702, test_loss: 1.0370, test_f1: 0.5423
 epoch: 62, train_loss: 0.7725, test_loss: 1.0814, test_f1: 0.5048
 epoch: 63, train_loss: 0.7784, test_loss: 1.0925, test_f1: 0.5085
 epoch: 64, train_loss: 0.7853, test_loss: 1.0226, test_f1: 0.5285
 epoch: 65, train_loss: 0.7656, test_loss: 1.2171, test_f1: 0.4816
 epoch: 66, train_loss: 0.7758, test_loss: 1.0619, test_f1: 0.5364
 epoch: 67, train_loss: 0.7615, test_loss: 1.1616, test_f1: 0.5218
 epoch: 68, train_loss: 0.7413, test_loss: 1.1609, test_f1: 0.5478
 epoch: 69, train_loss: 0.7516, test_loss: 1.2657, test_f1: 0.5128
 epoch: 70, train_loss: 0.7508, test_loss: 1.1209, test_f1: 0.5439
 epoch: 71, train_loss: 0.7459, test_loss: 1.1242, test_f1: 0.5453
 epoch: 72, train_loss: 0.7544, test_loss: 1.1110, test_f1: 0.5001
 epoch: 73, train_loss: 0.7482, test_loss: 1.1122, test_f1: 0.5403
 epoch: 74, train_loss: 0.7336, test_loss: 1.1595, test_f1: 0.5409
 epoch: 75, train_loss: 0.7423, test_loss: 1.1175, test_f1: 0.5376
 epoch: 76, train_loss: 0.7425, test_loss: 1.1191, test_f1: 0.5427
 epoch: 77, train_loss: 0.7378, test_loss: 1.1632, test_f1: 0.5330
 epoch: 78, train_loss: 0.7380, test_loss: 1.1055, test_f1: 0.5665
 epoch: 79, train_loss: 0.7433, test_loss: 1.0934, test_f1: 0.5389
 epoch: 80, train_loss: 0.7135, test_loss: 1.1639, test_f1: 0.5498
 epoch: 81, train_loss: 0.7184, test_loss: 1.1526, test_f1: 0.5373
 epoch: 82, train_loss: 0.7230, test_loss: 1.1582, test_f1: 0.5785
 epoch: 83, train_loss: 0.7405, test_loss: 1.1282, test_f1: 0.5473
 epoch: 84, train_loss: 0.7204, test_loss: 1.1460, test_f1: 0.5212
 epoch: 85, train_loss: 0.7156, test_loss: 1.1422, test_f1: 0.5429
 epoch: 86, train_loss: 0.7256, test_loss: 1.1389, test_f1: 0.5575
 epoch: 87, train_loss: 0.7466, test_loss: 1.0689, test_f1: 0.5239
 epoch: 88, train_loss: 0.7268, test_loss: 1.0383, test_f1: 0.5586
 epoch: 89, train_loss: 0.7174, test_loss: 1.1021, test_f1: 0.5564
 epoch: 90, train_loss: 0.7240, test_loss: 1.0724, test_f1: 0.5670
 epoch: 91, train_loss: 0.7315, test_loss: 1.0989, test_f1: 0.5393
 epoch: 92, train_loss: 0.7198, test_loss: 1.0822, test_f1: 0.5541
 epoch: 93, train_loss: 0.7109, test_loss: 1.1506, test_f1: 0.5361
 epoch: 94, train_loss: 0.7187, test_loss: 1.1209, test_f1: 0.5737
 epoch: 95, train_loss: 0.7012, test_loss: 1.1687, test_f1: 0.5481
 epoch: 96, train_loss: 0.6999, test_loss: 1.1374, test_f1: 0.5418
 epoch: 97, train_loss: 0.7120, test_loss: 1.2052, test_f1: 0.5734
 epoch: 98, train_loss: 0.6977, test_loss: 1.1327, test_f1: 0.5700
 epoch: 99, train_loss: 0.6957, test_loss: 1.1126, test_f1: 0.5494
##################ITERATION #2 ****************************************
 epoch: 0, train_loss: 1.2942, test_loss: 1.1986, test_f1: 0.2860
 epoch: 1, train_loss: 1.2109, test_loss: 1.1476, test_f1: 0.4192
 epoch: 2, train_loss: 1.1640, test_loss: 1.0781, test_f1: 0.4715
 epoch: 3, train_loss: 1.1237, test_loss: 1.0728, test_f1: 0.4665
 epoch: 4, train_loss: 1.0893, test_loss: 1.0191, test_f1: 0.4768
 epoch: 5, train_loss: 1.0476, test_loss: 1.0355, test_f1: 0.4516
 epoch: 6, train_loss: 1.0244, test_loss: 0.9265, test_f1: 0.5182
 epoch: 7, train_loss: 1.0080, test_loss: 0.9739, test_f1: 0.4572
 epoch: 8, train_loss: 0.9929, test_loss: 0.9843, test_f1: 0.5217
 epoch: 9, train_loss: 1.0132, test_loss: 0.9497, test_f1: 0.4681
 epoch: 10, train_loss: 0.9712, test_loss: 0.9851, test_f1: 0.4798
 epoch: 11, train_loss: 0.9558, test_loss: 1.0004, test_f1: 0.5098
 epoch: 12, train_loss: 0.9352, test_loss: 1.0350, test_f1: 0.4870
 epoch: 13, train_loss: 0.9275, test_loss: 1.2403, test_f1: 0.4883
 epoch: 14, train_loss: 0.9332, test_loss: 1.2434, test_f1: 0.5024
 epoch: 15, train_loss: 0.9510, test_loss: 1.0820, test_f1: 0.5174
 epoch: 16, train_loss: 0.9179, test_loss: 1.0060, test_f1: 0.5157
 epoch: 17, train_loss: 0.9191, test_loss: 1.0294, test_f1: 0.5045
 epoch: 18, train_loss: 0.9097, test_loss: 1.1225, test_f1: 0.4802
 epoch: 19, train_loss: 0.8894, test_loss: 1.0388, test_f1: 0.4994
 epoch: 20, train_loss: 0.9121, test_loss: 1.0599, test_f1: 0.5026
 epoch: 21, train_loss: 0.9025, test_loss: 0.9546, test_f1: 0.5074
 epoch: 22, train_loss: 0.9107, test_loss: 0.9995, test_f1: 0.4964
 epoch: 23, train_loss: 0.8855, test_loss: 1.0435, test_f1: 0.4950
 epoch: 24, train_loss: 0.9016, test_loss: 1.7668, test_f1: 0.5151
 epoch: 25, train_loss: 0.8926, test_loss: 1.0192, test_f1: 0.4944
 epoch: 26, train_loss: 0.8733, test_loss: 1.0863, test_f1: 0.5707
 epoch: 27, train_loss: 0.8497, test_loss: 1.0280, test_f1: 0.5078
 epoch: 28, train_loss: 0.8701, test_loss: 1.1744, test_f1: 0.5204
 epoch: 29, train_loss: 0.8667, test_loss: 1.1514, test_f1: 0.5171
 epoch: 30, train_loss: 0.8515, test_loss: 0.9512, test_f1: 0.5595
 epoch: 31, train_loss: 0.8570, test_loss: 1.0885, test_f1: 0.5190
 epoch: 32, train_loss: 0.8440, test_loss: 1.0340, test_f1: 0.5221
 epoch: 33, train_loss: 0.8451, test_loss: 1.0368, test_f1: 0.5587
 epoch: 34, train_loss: 0.8814, test_loss: 1.0591, test_f1: 0.5250
 epoch: 35, train_loss: 0.8734, test_loss: 1.0453, test_f1: 0.5638
 epoch: 36, train_loss: 0.8452, test_loss: 1.0685, test_f1: 0.5288
 epoch: 37, train_loss: 0.8320, test_loss: 0.9961, test_f1: 0.5233
 epoch: 38, train_loss: 0.8290, test_loss: 1.0712, test_f1: 0.5565
 epoch: 39, train_loss: 0.8281, test_loss: 1.0653, test_f1: 0.5393
 epoch: 40, train_loss: 0.8210, test_loss: 1.1345, test_f1: 0.5417
 epoch: 41, train_loss: 0.8225, test_loss: 1.0082, test_f1: 0.5665
 epoch: 42, train_loss: 0.8289, test_loss: 1.0677, test_f1: 0.5364
 epoch: 43, train_loss: 0.8338, test_loss: 1.0210, test_f1: 0.5785
 epoch: 44, train_loss: 0.8171, test_loss: 1.1174, test_f1: 0.5510
 epoch: 45, train_loss: 0.8032, test_loss: 1.0512, test_f1: 0.5541
 epoch: 46, train_loss: 0.8046, test_loss: 1.1925, test_f1: 0.5152
 epoch: 47, train_loss: 0.8092, test_loss: 1.3383, test_f1: 0.5336
 epoch: 48, train_loss: 0.8168, test_loss: 1.0495, test_f1: 0.5362
 epoch: 49, train_loss: 0.8107, test_loss: 1.1794, test_f1: 0.5316
 epoch: 50, train_loss: 0.7952, test_loss: 1.2529, test_f1: 0.5354
 epoch: 51, train_loss: 0.7727, test_loss: 1.1340, test_f1: 0.5443
 epoch: 52, train_loss: 0.7609, test_loss: 1.1025, test_f1: 0.5695
 epoch: 53, train_loss: 0.7447, test_loss: 1.1008, test_f1: 0.5798
 epoch: 54, train_loss: 0.7552, test_loss: 1.3339, test_f1: 0.5196
 epoch: 55, train_loss: 0.7364, test_loss: 1.2430, test_f1: 0.5319
 epoch: 56, train_loss: 0.7319, test_loss: 1.0519, test_f1: 0.5404
 epoch: 57, train_loss: 0.7370, test_loss: 1.3139, test_f1: 0.5289
 epoch: 58, train_loss: 0.7297, test_loss: 1.1792, test_f1: 0.5399
 epoch: 59, train_loss: 0.7260, test_loss: 1.1904, test_f1: 0.5230
 epoch: 60, train_loss: 0.7213, test_loss: 1.1879, test_f1: 0.5607
 epoch: 61, train_loss: 0.7308, test_loss: 1.0977, test_f1: 0.5637
 epoch: 62, train_loss: 0.7311, test_loss: 1.5123, test_f1: 0.5221
 epoch: 63, train_loss: 0.7201, test_loss: 1.2413, test_f1: 0.5320
 epoch: 64, train_loss: 0.7302, test_loss: 1.2170, test_f1: 0.5436
 epoch: 65, train_loss: 0.7079, test_loss: 1.2861, test_f1: 0.5462
 epoch: 66, train_loss: 0.7082, test_loss: 1.2340, test_f1: 0.5506
 epoch: 67, train_loss: 0.7289, test_loss: 1.2853, test_f1: 0.5477
 epoch: 68, train_loss: 0.7146, test_loss: 1.3260, test_f1: 0.5502
 epoch: 69, train_loss: 0.7126, test_loss: 1.1270, test_f1: 0.5536
 epoch: 70, train_loss: 0.7036, test_loss: 1.3305, test_f1: 0.5527
 epoch: 71, train_loss: 0.7025, test_loss: 1.1676, test_f1: 0.5626
 epoch: 72, train_loss: 0.7135, test_loss: 1.1387, test_f1: 0.5571
 epoch: 73, train_loss: 0.7007, test_loss: 1.1691, test_f1: 0.5955
 epoch: 74, train_loss: 0.6824, test_loss: 1.4977, test_f1: 0.5460
 epoch: 75, train_loss: 0.6923, test_loss: 1.3571, test_f1: 0.5296
 epoch: 76, train_loss: 0.6885, test_loss: 1.2318, test_f1: 0.5296
 epoch: 77, train_loss: 0.6718, test_loss: 1.3038, test_f1: 0.5660
 epoch: 78, train_loss: 0.6789, test_loss: 1.3286, test_f1: 0.5495
 epoch: 79, train_loss: 0.7004, test_loss: 1.0943, test_f1: 0.5505
 epoch: 80, train_loss: 0.6925, test_loss: 1.3269, test_f1: 0.5505
 epoch: 81, train_loss: 0.6799, test_loss: 1.0709, test_f1: 0.5661
 epoch: 82, train_loss: 0.6750, test_loss: 1.2455, test_f1: 0.5539
 epoch: 83, train_loss: 0.6733, test_loss: 1.1747, test_f1: 0.5569
 epoch: 84, train_loss: 0.6828, test_loss: 1.1821, test_f1: 0.5712
 epoch: 85, train_loss: 0.6598, test_loss: 1.1491, test_f1: 0.5682
 epoch: 86, train_loss: 0.6596, test_loss: 1.2100, test_f1: 0.5632
 epoch: 87, train_loss: 0.6754, test_loss: 1.2649, test_f1: 0.5364
 epoch: 88, train_loss: 0.6626, test_loss: 1.1212, test_f1: 0.5549
 epoch: 89, train_loss: 0.6489, test_loss: 1.1012, test_f1: 0.5615
 epoch: 90, train_loss: 0.6496, test_loss: 1.0665, test_f1: 0.5552
 epoch: 91, train_loss: 0.6838, test_loss: 1.1538, test_f1: 0.5635
 epoch: 92, train_loss: 0.6738, test_loss: 1.3463, test_f1: 0.5590
 epoch: 93, train_loss: 0.6549, test_loss: 1.6575, test_f1: 0.5378
 epoch: 94, train_loss: 0.6650, test_loss: 1.3254, test_f1: 0.5442
 epoch: 95, train_loss: 0.6589, test_loss: 1.1166, test_f1: 0.5747
 epoch: 96, train_loss: 0.6705, test_loss: 1.3460, test_f1: 0.5480
 epoch: 97, train_loss: 0.6489, test_loss: 1.4111, test_f1: 0.5578
 epoch: 98, train_loss: 0.6590, test_loss: 1.3160, test_f1: 0.5391
 epoch: 99, train_loss: 0.6525, test_loss: 1.1030, test_f1: 0.5539
##################ITERATION #3 ****************************************
 epoch: 0, train_loss: 1.2728, test_loss: 1.2527, test_f1: 0.3476
 epoch: 1, train_loss: 1.1526, test_loss: 1.0436, test_f1: 0.5218
 epoch: 2, train_loss: 1.0962, test_loss: 1.0615, test_f1: 0.4525
 epoch: 3, train_loss: 1.0629, test_loss: 0.9925, test_f1: 0.4796
 epoch: 4, train_loss: 1.0403, test_loss: 0.9899, test_f1: 0.5000
 epoch: 5, train_loss: 1.0184, test_loss: 0.9737, test_f1: 0.4793
 epoch: 6, train_loss: 1.0169, test_loss: 0.9775, test_f1: 0.4708
 epoch: 7, train_loss: 0.9935, test_loss: 0.9765, test_f1: 0.4720
 epoch: 8, train_loss: 0.9713, test_loss: 1.0294, test_f1: 0.4538
 epoch: 9, train_loss: 0.9814, test_loss: 1.0283, test_f1: 0.4731
 epoch: 10, train_loss: 0.9755, test_loss: 1.1221, test_f1: 0.4701
 epoch: 11, train_loss: 0.9674, test_loss: 1.0245, test_f1: 0.4905
 epoch: 12, train_loss: 0.9556, test_loss: 0.9570, test_f1: 0.5340
 epoch: 13, train_loss: 0.9440, test_loss: 1.0055, test_f1: 0.4737
 epoch: 14, train_loss: 0.9474, test_loss: 0.9359, test_f1: 0.4847
 epoch: 15, train_loss: 0.9430, test_loss: 1.0217, test_f1: 0.4977
 epoch: 16, train_loss: 0.9294, test_loss: 0.9885, test_f1: 0.5302
 epoch: 17, train_loss: 0.9244, test_loss: 0.9617, test_f1: 0.5367
 epoch: 18, train_loss: 0.9058, test_loss: 1.0129, test_f1: 0.5132
 epoch: 19, train_loss: 0.8939, test_loss: 0.9986, test_f1: 0.4588
 epoch: 20, train_loss: 0.9046, test_loss: 0.9677, test_f1: 0.5563
 epoch: 21, train_loss: 0.8806, test_loss: 1.0048, test_f1: 0.5105
 epoch: 22, train_loss: 0.8758, test_loss: 1.0486, test_f1: 0.5215
 epoch: 23, train_loss: 0.8759, test_loss: 0.9866, test_f1: 0.5212
 epoch: 24, train_loss: 0.8759, test_loss: 0.9961, test_f1: 0.5521
 epoch: 25, train_loss: 0.8606, test_loss: 1.0073, test_f1: 0.5397
 epoch: 26, train_loss: 0.8758, test_loss: 0.9948, test_f1: 0.5367
 epoch: 27, train_loss: 0.8616, test_loss: 1.0615, test_f1: 0.5143
 epoch: 28, train_loss: 0.8625, test_loss: 1.0119, test_f1: 0.5243
 epoch: 29, train_loss: 0.8616, test_loss: 1.0275, test_f1: 0.5303
 epoch: 30, train_loss: 0.8554, test_loss: 1.1852, test_f1: 0.5117
 epoch: 31, train_loss: 0.8416, test_loss: 1.0092, test_f1: 0.5532
 epoch: 32, train_loss: 0.8422, test_loss: 1.0125, test_f1: 0.5197
 epoch: 33, train_loss: 0.8449, test_loss: 0.9883, test_f1: 0.5608
 epoch: 34, train_loss: 0.8469, test_loss: 1.0509, test_f1: 0.4999
 epoch: 35, train_loss: 0.8487, test_loss: 1.0217, test_f1: 0.5190
 epoch: 36, train_loss: 0.8237, test_loss: 1.0008, test_f1: 0.5269
 epoch: 37, train_loss: 0.8275, test_loss: 1.0747, test_f1: 0.4995
 epoch: 38, train_loss: 0.8349, test_loss: 1.0455, test_f1: 0.5250
 epoch: 39, train_loss: 0.8435, test_loss: 1.0529, test_f1: 0.5589
 epoch: 40, train_loss: 0.8219, test_loss: 1.0055, test_f1: 0.5592
 epoch: 41, train_loss: 0.8148, test_loss: 1.0912, test_f1: 0.5106
 epoch: 42, train_loss: 0.8078, test_loss: 1.0481, test_f1: 0.5225
 epoch: 43, train_loss: 0.7981, test_loss: 1.0277, test_f1: 0.5530
 epoch: 44, train_loss: 0.8168, test_loss: 1.0425, test_f1: 0.5530
 epoch: 45, train_loss: 0.8132, test_loss: 1.0467, test_f1: 0.5020
 epoch: 46, train_loss: 0.8080, test_loss: 1.0443, test_f1: 0.5488
 epoch: 47, train_loss: 0.7932, test_loss: 1.1709, test_f1: 0.5004
 epoch: 48, train_loss: 0.7961, test_loss: 1.0138, test_f1: 0.5450
 epoch: 49, train_loss: 0.8139, test_loss: 1.0120, test_f1: 0.5452
 epoch: 50, train_loss: 0.7979, test_loss: 1.0409, test_f1: 0.5394
 epoch: 51, train_loss: 0.7576, test_loss: 1.0958, test_f1: 0.5106
 epoch: 52, train_loss: 0.7350, test_loss: 1.0086, test_f1: 0.5770
 epoch: 53, train_loss: 0.7342, test_loss: 1.0419, test_f1: 0.5425
 epoch: 54, train_loss: 0.7258, test_loss: 1.0427, test_f1: 0.5714
 epoch: 55, train_loss: 0.7353, test_loss: 1.0640, test_f1: 0.5602
 epoch: 56, train_loss: 0.7352, test_loss: 1.0051, test_f1: 0.5732
 epoch: 57, train_loss: 0.7167, test_loss: 1.0635, test_f1: 0.5467
 epoch: 58, train_loss: 0.7215, test_loss: 1.1440, test_f1: 0.5317
 epoch: 59, train_loss: 0.7220, test_loss: 1.0571, test_f1: 0.5271
 epoch: 60, train_loss: 0.7281, test_loss: 1.0066, test_f1: 0.5848
 epoch: 61, train_loss: 0.7029, test_loss: 1.0756, test_f1: 0.5700
 epoch: 62, train_loss: 0.7218, test_loss: 1.0445, test_f1: 0.5554
 epoch: 63, train_loss: 0.7082, test_loss: 1.1728, test_f1: 0.5519
 epoch: 64, train_loss: 0.7077, test_loss: 1.0781, test_f1: 0.5766
 epoch: 65, train_loss: 0.6971, test_loss: 1.1032, test_f1: 0.5253
 epoch: 66, train_loss: 0.7068, test_loss: 1.0448, test_f1: 0.5599
 epoch: 67, train_loss: 0.6934, test_loss: 1.0871, test_f1: 0.5879
 epoch: 68, train_loss: 0.6999, test_loss: 1.2508, test_f1: 0.5280
 epoch: 69, train_loss: 0.6788, test_loss: 1.1894, test_f1: 0.5404
 epoch: 70, train_loss: 0.6805, test_loss: 1.1337, test_f1: 0.5893
 epoch: 71, train_loss: 0.6876, test_loss: 1.1007, test_f1: 0.5648
 epoch: 72, train_loss: 0.6729, test_loss: 1.3017, test_f1: 0.5469
 epoch: 73, train_loss: 0.6833, test_loss: 1.2713, test_f1: 0.5521
 epoch: 74, train_loss: 0.6824, test_loss: 1.1336, test_f1: 0.5599
 epoch: 75, train_loss: 0.6632, test_loss: 1.1679, test_f1: 0.5769
 epoch: 76, train_loss: 0.6788, test_loss: 1.1746, test_f1: 0.5774
 epoch: 77, train_loss: 0.6764, test_loss: 1.2653, test_f1: 0.5637
 epoch: 78, train_loss: 0.6805, test_loss: 1.3142, test_f1: 0.5559
 epoch: 79, train_loss: 0.6919, test_loss: 1.1305, test_f1: 0.5973
 epoch: 80, train_loss: 0.6803, test_loss: 1.1526, test_f1: 0.5777
 epoch: 81, train_loss: 0.6695, test_loss: 1.1668, test_f1: 0.5680
 epoch: 82, train_loss: 0.6804, test_loss: 1.1269, test_f1: 0.5739
 epoch: 83, train_loss: 0.6532, test_loss: 1.2775, test_f1: 0.5340
 epoch: 84, train_loss: 0.6741, test_loss: 1.1067, test_f1: 0.5880
 epoch: 85, train_loss: 0.6460, test_loss: 1.1807, test_f1: 0.5678
 epoch: 86, train_loss: 0.6610, test_loss: 1.1188, test_f1: 0.5895
 epoch: 87, train_loss: 0.6444, test_loss: 1.2162, test_f1: 0.5861
 epoch: 88, train_loss: 0.6694, test_loss: 1.1990, test_f1: 0.5784
 epoch: 89, train_loss: 0.6630, test_loss: 1.1173, test_f1: 0.5712
 epoch: 90, train_loss: 0.6622, test_loss: 1.2167, test_f1: 0.5634
 epoch: 91, train_loss: 0.6559, test_loss: 1.1654, test_f1: 0.5608
 epoch: 92, train_loss: 0.6435, test_loss: 1.3204, test_f1: 0.5470
 epoch: 93, train_loss: 0.6534, test_loss: 1.4244, test_f1: 0.5610
 epoch: 94, train_loss: 0.6442, test_loss: 1.1204, test_f1: 0.5726
 epoch: 95, train_loss: 0.6276, test_loss: 1.1842, test_f1: 0.5802
 epoch: 96, train_loss: 0.6332, test_loss: 1.5274, test_f1: 0.5590
 epoch: 97, train_loss: 0.6391, test_loss: 1.3107, test_f1: 0.5411
 epoch: 98, train_loss: 0.6429, test_loss: 1.1901, test_f1: 0.6009
 epoch: 99, train_loss: 0.6312, test_loss: 1.2061, test_f1: 0.5707
##################ITERATION #4 ****************************************
 epoch: 0, train_loss: 1.2985, test_loss: 1.2166, test_f1: 0.3921
 epoch: 1, train_loss: 1.2120, test_loss: 1.1605, test_f1: 0.3950
 epoch: 2, train_loss: 1.1456, test_loss: 1.0176, test_f1: 0.4988
 epoch: 3, train_loss: 1.0914, test_loss: 0.9914, test_f1: 0.4316
 epoch: 4, train_loss: 1.0531, test_loss: 0.9795, test_f1: 0.4608
 epoch: 5, train_loss: 1.0426, test_loss: 1.0776, test_f1: 0.4320
 epoch: 6, train_loss: 1.0301, test_loss: 0.9855, test_f1: 0.4207
 epoch: 7, train_loss: 1.0087, test_loss: 0.9562, test_f1: 0.4583
 epoch: 8, train_loss: 1.0043, test_loss: 1.0001, test_f1: 0.4651
 epoch: 9, train_loss: 0.9862, test_loss: 0.9915, test_f1: 0.4891
 epoch: 10, train_loss: 0.9596, test_loss: 0.9011, test_f1: 0.4701
 epoch: 11, train_loss: 0.9433, test_loss: 1.0010, test_f1: 0.5148
 epoch: 12, train_loss: 0.9344, test_loss: 1.0374, test_f1: 0.4947
 epoch: 13, train_loss: 0.9374, test_loss: 0.9264, test_f1: 0.4958
 epoch: 14, train_loss: 0.9219, test_loss: 0.9825, test_f1: 0.5204
 epoch: 15, train_loss: 0.9397, test_loss: 1.0302, test_f1: 0.4623
 epoch: 16, train_loss: 0.9161, test_loss: 0.9994, test_f1: 0.4623
 epoch: 17, train_loss: 0.9124, test_loss: 0.9908, test_f1: 0.4951
 epoch: 18, train_loss: 0.8994, test_loss: 0.9338, test_f1: 0.5666
 epoch: 19, train_loss: 0.9002, test_loss: 0.9981, test_f1: 0.5255
 epoch: 20, train_loss: 0.9026, test_loss: 1.0044, test_f1: 0.5213
 epoch: 21, train_loss: 0.8943, test_loss: 1.0304, test_f1: 0.5275
 epoch: 22, train_loss: 0.8743, test_loss: 1.0407, test_f1: 0.4885
 epoch: 23, train_loss: 0.9030, test_loss: 0.9900, test_f1: 0.5313
 epoch: 24, train_loss: 0.8828, test_loss: 0.9976, test_f1: 0.5081
 epoch: 25, train_loss: 0.8662, test_loss: 0.9837, test_f1: 0.5148
 epoch: 26, train_loss: 0.8619, test_loss: 1.0345, test_f1: 0.5191
 epoch: 27, train_loss: 0.8659, test_loss: 0.9859, test_f1: 0.5712
 epoch: 28, train_loss: 0.8611, test_loss: 0.9933, test_f1: 0.5354
 epoch: 29, train_loss: 0.8623, test_loss: 0.9914, test_f1: 0.5387
 epoch: 30, train_loss: 0.8594, test_loss: 0.9726, test_f1: 0.5266
 epoch: 31, train_loss: 0.8447, test_loss: 0.9349, test_f1: 0.5291
 epoch: 32, train_loss: 0.8464, test_loss: 0.9287, test_f1: 0.5429
 epoch: 33, train_loss: 0.8402, test_loss: 0.9574, test_f1: 0.5367
 epoch: 34, train_loss: 0.8578, test_loss: 1.0213, test_f1: 0.5281
 epoch: 35, train_loss: 0.8582, test_loss: 0.9744, test_f1: 0.5422
 epoch: 36, train_loss: 0.8369, test_loss: 0.9791, test_f1: 0.5144
 epoch: 37, train_loss: 0.8542, test_loss: 0.9471, test_f1: 0.5316
 epoch: 38, train_loss: 0.8246, test_loss: 0.9830, test_f1: 0.5424
 epoch: 39, train_loss: 0.8134, test_loss: 0.9758, test_f1: 0.5465
 epoch: 40, train_loss: 0.8274, test_loss: 0.9892, test_f1: 0.5558
 epoch: 41, train_loss: 0.8211, test_loss: 1.2157, test_f1: 0.5053
 epoch: 42, train_loss: 0.8638, test_loss: 0.9869, test_f1: 0.5642
 epoch: 43, train_loss: 0.8276, test_loss: 1.0381, test_f1: 0.5302
 epoch: 44, train_loss: 0.8325, test_loss: 1.0207, test_f1: 0.5423
 epoch: 45, train_loss: 0.8100, test_loss: 1.0154, test_f1: 0.5547
 epoch: 46, train_loss: 0.8215, test_loss: 0.9625, test_f1: 0.5334
 epoch: 47, train_loss: 0.8076, test_loss: 1.0356, test_f1: 0.5502
 epoch: 48, train_loss: 0.7781, test_loss: 1.2076, test_f1: 0.5412
 epoch: 49, train_loss: 0.7866, test_loss: 1.0763, test_f1: 0.5366
 epoch: 50, train_loss: 0.7885, test_loss: 1.0221, test_f1: 0.5647
 epoch: 51, train_loss: 0.7638, test_loss: 0.9681, test_f1: 0.5685
 epoch: 52, train_loss: 0.7403, test_loss: 1.0804, test_f1: 0.5524
 epoch: 53, train_loss: 0.7346, test_loss: 1.0009, test_f1: 0.5667
 epoch: 54, train_loss: 0.7458, test_loss: 0.9385, test_f1: 0.5670
 epoch: 55, train_loss: 0.7356, test_loss: 1.0661, test_f1: 0.5499
 epoch: 56, train_loss: 0.7366, test_loss: 1.0385, test_f1: 0.5452
 epoch: 57, train_loss: 0.7373, test_loss: 1.1446, test_f1: 0.5466
 epoch: 58, train_loss: 0.7195, test_loss: 1.0393, test_f1: 0.5620
 epoch: 59, train_loss: 0.7198, test_loss: 1.1123, test_f1: 0.5416
 epoch: 60, train_loss: 0.7407, test_loss: 1.0439, test_f1: 0.5615
 epoch: 61, train_loss: 0.7138, test_loss: 1.0313, test_f1: 0.5582
 epoch: 62, train_loss: 0.7294, test_loss: 1.1264, test_f1: 0.5553
 epoch: 63, train_loss: 0.7193, test_loss: 1.1430, test_f1: 0.5428
 epoch: 64, train_loss: 0.6982, test_loss: 1.1362, test_f1: 0.5459
 epoch: 65, train_loss: 0.7070, test_loss: 1.2028, test_f1: 0.5291
 epoch: 66, train_loss: 0.7003, test_loss: 1.1661, test_f1: 0.5235
 epoch: 67, train_loss: 0.7025, test_loss: 1.0934, test_f1: 0.5407
 epoch: 68, train_loss: 0.7155, test_loss: 1.1115, test_f1: 0.5730
 epoch: 69, train_loss: 0.6898, test_loss: 1.0717, test_f1: 0.5579
 epoch: 70, train_loss: 0.6998, test_loss: 1.1350, test_f1: 0.5459
 epoch: 71, train_loss: 0.7244, test_loss: 1.0332, test_f1: 0.5715
 epoch: 72, train_loss: 0.7044, test_loss: 1.0707, test_f1: 0.5403
 epoch: 73, train_loss: 0.6944, test_loss: 1.1051, test_f1: 0.5539
 epoch: 74, train_loss: 0.6801, test_loss: 1.1540, test_f1: 0.5535
 epoch: 75, train_loss: 0.7007, test_loss: 1.0571, test_f1: 0.5724
 epoch: 76, train_loss: 0.6958, test_loss: 1.0942, test_f1: 0.5570
 epoch: 77, train_loss: 0.6827, test_loss: 1.1065, test_f1: 0.5598
 epoch: 78, train_loss: 0.6764, test_loss: 1.2781, test_f1: 0.5461
 epoch: 79, train_loss: 0.6728, test_loss: 1.2583, test_f1: 0.5251
 epoch: 80, train_loss: 0.6802, test_loss: 1.2442, test_f1: 0.5595
 epoch: 81, train_loss: 0.6692, test_loss: 1.1941, test_f1: 0.5505
 epoch: 82, train_loss: 0.6729, test_loss: 1.1344, test_f1: 0.5724
 epoch: 83, train_loss: 0.6815, test_loss: 1.0509, test_f1: 0.5679
 epoch: 84, train_loss: 0.6700, test_loss: 1.1076, test_f1: 0.5893
 epoch: 85, train_loss: 0.6592, test_loss: 1.1529, test_f1: 0.5633
 epoch: 86, train_loss: 0.6473, test_loss: 1.2871, test_f1: 0.5556
 epoch: 87, train_loss: 0.6560, test_loss: 1.1992, test_f1: 0.5649
 epoch: 88, train_loss: 0.6554, test_loss: 1.2531, test_f1: 0.5711
 epoch: 89, train_loss: 0.6543, test_loss: 1.1972, test_f1: 0.5609
 epoch: 90, train_loss: 0.6837, test_loss: 1.1800, test_f1: 0.5329
 epoch: 91, train_loss: 0.6517, test_loss: 1.2606, test_f1: 0.5463
 epoch: 92, train_loss: 0.6474, test_loss: 1.2571, test_f1: 0.5557
 epoch: 93, train_loss: 0.6436, test_loss: 1.1848, test_f1: 0.5693
 epoch: 94, train_loss: 0.6511, test_loss: 1.2572, test_f1: 0.5343
 epoch: 95, train_loss: 0.6630, test_loss: 1.1167, test_f1: 0.5775
 epoch: 96, train_loss: 0.6231, test_loss: 1.1065, test_f1: 0.5973
 epoch: 97, train_loss: 0.6420, test_loss: 1.1850, test_f1: 0.5532
 epoch: 98, train_loss: 0.6587, test_loss: 1.0695, test_f1: 0.5996
 epoch: 99, train_loss: 0.6303, test_loss: 1.1920, test_f1: 0.5705
##################ITERATION #5 ****************************************
 epoch: 0, train_loss: 1.2912, test_loss: 1.2009, test_f1: 0.4197
 epoch: 1, train_loss: 1.1560, test_loss: 1.0685, test_f1: 0.4081
 epoch: 2, train_loss: 1.0935, test_loss: 1.0434, test_f1: 0.4434
 epoch: 3, train_loss: 1.0628, test_loss: 0.9560, test_f1: 0.4843
 epoch: 4, train_loss: 1.0608, test_loss: 0.9674, test_f1: 0.4798
 epoch: 5, train_loss: 1.0147, test_loss: 0.9642, test_f1: 0.4994
 epoch: 6, train_loss: 0.9833, test_loss: 0.9684, test_f1: 0.5212
 epoch: 7, train_loss: 0.9757, test_loss: 0.9689, test_f1: 0.5083
 epoch: 8, train_loss: 0.9577, test_loss: 0.9270, test_f1: 0.4968
 epoch: 9, train_loss: 0.9659, test_loss: 0.9660, test_f1: 0.4962
 epoch: 10, train_loss: 0.9709, test_loss: 1.0117, test_f1: 0.5095
 epoch: 11, train_loss: 0.9447, test_loss: 0.9859, test_f1: 0.5002
 epoch: 12, train_loss: 0.9430, test_loss: 0.9613, test_f1: 0.4934
 epoch: 13, train_loss: 0.9154, test_loss: 1.0463, test_f1: 0.4823
 epoch: 14, train_loss: 0.9368, test_loss: 0.9955, test_f1: 0.5226
 epoch: 15, train_loss: 0.9442, test_loss: 1.0094, test_f1: 0.4906
 epoch: 16, train_loss: 0.9105, test_loss: 1.0739, test_f1: 0.4890
 epoch: 17, train_loss: 0.9188, test_loss: 1.0150, test_f1: 0.4730
 epoch: 18, train_loss: 0.8952, test_loss: 0.9162, test_f1: 0.5313
 epoch: 19, train_loss: 0.8901, test_loss: 0.9821, test_f1: 0.4789
 epoch: 20, train_loss: 0.8770, test_loss: 1.1526, test_f1: 0.4957
 epoch: 21, train_loss: 0.8982, test_loss: 1.1054, test_f1: 0.5289
 epoch: 22, train_loss: 0.8599, test_loss: 1.0022, test_f1: 0.5054
 epoch: 23, train_loss: 0.8860, test_loss: 0.9647, test_f1: 0.5011
 epoch: 24, train_loss: 0.8717, test_loss: 0.9834, test_f1: 0.5049
 epoch: 25, train_loss: 0.8614, test_loss: 0.9965, test_f1: 0.5509
 epoch: 26, train_loss: 0.8820, test_loss: 0.9146, test_f1: 0.5398
 epoch: 27, train_loss: 0.8653, test_loss: 0.9634, test_f1: 0.5816
 epoch: 28, train_loss: 0.8758, test_loss: 0.9615, test_f1: 0.5241
 epoch: 29, train_loss: 0.8554, test_loss: 1.0124, test_f1: 0.5664
 epoch: 30, train_loss: 0.8493, test_loss: 1.1753, test_f1: 0.4622
 epoch: 31, train_loss: 0.8421, test_loss: 0.9965, test_f1: 0.5154
 epoch: 32, train_loss: 0.8386, test_loss: 0.9909, test_f1: 0.5174
 epoch: 33, train_loss: 0.8418, test_loss: 1.0452, test_f1: 0.5557
 epoch: 34, train_loss: 0.8384, test_loss: 0.9961, test_f1: 0.5459
 epoch: 35, train_loss: 0.8398, test_loss: 0.9716, test_f1: 0.5615
 epoch: 36, train_loss: 0.8485, test_loss: 0.9533, test_f1: 0.5495
 epoch: 37, train_loss: 0.8309, test_loss: 1.6564, test_f1: 0.4688
 epoch: 38, train_loss: 0.8260, test_loss: 1.0733, test_f1: 0.4862
 epoch: 39, train_loss: 0.8446, test_loss: 0.9909, test_f1: 0.5626
 epoch: 40, train_loss: 0.8232, test_loss: 0.9854, test_f1: 0.5592
 epoch: 41, train_loss: 0.8058, test_loss: 1.0123, test_f1: 0.5219
 epoch: 42, train_loss: 0.8269, test_loss: 1.0237, test_f1: 0.5268
 epoch: 43, train_loss: 0.8245, test_loss: 1.2316, test_f1: 0.5222
 epoch: 44, train_loss: 0.8157, test_loss: 0.9918, test_f1: 0.5488
 epoch: 45, train_loss: 0.8256, test_loss: 1.0598, test_f1: 0.5322
 epoch: 46, train_loss: 0.8292, test_loss: 1.0386, test_f1: 0.5004
 epoch: 47, train_loss: 0.8308, test_loss: 0.9857, test_f1: 0.5524
 epoch: 48, train_loss: 0.8185, test_loss: 1.0002, test_f1: 0.5253
 epoch: 49, train_loss: 0.8390, test_loss: 0.9883, test_f1: 0.5315
 epoch: 50, train_loss: 0.8044, test_loss: 1.0536, test_f1: 0.5744
 epoch: 51, train_loss: 0.7804, test_loss: 1.0085, test_f1: 0.5606
 epoch: 52, train_loss: 0.7829, test_loss: 1.0466, test_f1: 0.5354
 epoch: 53, train_loss: 0.7628, test_loss: 0.9927, test_f1: 0.5749
 epoch: 54, train_loss: 0.7634, test_loss: 1.0954, test_f1: 0.5180
 epoch: 55, train_loss: 0.7676, test_loss: 1.1597, test_f1: 0.5209
 epoch: 56, train_loss: 0.7591, test_loss: 1.1670, test_f1: 0.5257
 epoch: 57, train_loss: 0.7560, test_loss: 1.0092, test_f1: 0.5436
 epoch: 58, train_loss: 0.7638, test_loss: 1.1897, test_f1: 0.5125
 epoch: 59, train_loss: 0.7399, test_loss: 1.1114, test_f1: 0.5238
 epoch: 60, train_loss: 0.7526, test_loss: 1.1015, test_f1: 0.5190
 epoch: 61, train_loss: 0.7609, test_loss: 0.9913, test_f1: 0.5706
 epoch: 62, train_loss: 0.7344, test_loss: 1.0219, test_f1: 0.5585
 epoch: 63, train_loss: 0.7425, test_loss: 1.1239, test_f1: 0.5209
 epoch: 64, train_loss: 0.7354, test_loss: 1.0701, test_f1: 0.5069
 epoch: 65, train_loss: 0.7314, test_loss: 1.0888, test_f1: 0.5567
 epoch: 66, train_loss: 0.7274, test_loss: 1.0735, test_f1: 0.5122
 epoch: 67, train_loss: 0.7335, test_loss: 1.0052, test_f1: 0.5405
 epoch: 68, train_loss: 0.7247, test_loss: 1.0183, test_f1: 0.5627
 epoch: 69, train_loss: 0.7029, test_loss: 1.1383, test_f1: 0.5219
 epoch: 70, train_loss: 0.7324, test_loss: 0.9684, test_f1: 0.5386
 epoch: 71, train_loss: 0.7409, test_loss: 0.9607, test_f1: 0.5426
 epoch: 72, train_loss: 0.7214, test_loss: 1.0203, test_f1: 0.5193
 epoch: 73, train_loss: 0.7333, test_loss: 1.0648, test_f1: 0.5498
 epoch: 74, train_loss: 0.7172, test_loss: 1.0001, test_f1: 0.5578
 epoch: 75, train_loss: 0.7089, test_loss: 1.1885, test_f1: 0.5616
 epoch: 76, train_loss: 0.7134, test_loss: 1.0487, test_f1: 0.5578
 epoch: 77, train_loss: 0.7103, test_loss: 1.1420, test_f1: 0.5624
 epoch: 78, train_loss: 0.7267, test_loss: 1.1355, test_f1: 0.5257
 epoch: 79, train_loss: 0.7301, test_loss: 1.1109, test_f1: 0.4991
 epoch: 80, train_loss: 0.7170, test_loss: 1.0309, test_f1: 0.5287
 epoch: 81, train_loss: 0.7170, test_loss: 1.0823, test_f1: 0.5799
 epoch: 82, train_loss: 0.7224, test_loss: 1.0328, test_f1: 0.5557
 epoch: 83, train_loss: 0.7134, test_loss: 1.0369, test_f1: 0.5663
 epoch: 84, train_loss: 0.6924, test_loss: 1.1101, test_f1: 0.5426
 epoch: 85, train_loss: 0.6943, test_loss: 1.1548, test_f1: 0.5265
 epoch: 86, train_loss: 0.6998, test_loss: 1.1373, test_f1: 0.5382
 epoch: 87, train_loss: 0.6916, test_loss: 1.0513, test_f1: 0.5649
 epoch: 88, train_loss: 0.7066, test_loss: 1.0788, test_f1: 0.5500
 epoch: 89, train_loss: 0.7008, test_loss: 1.0767, test_f1: 0.5574
 epoch: 90, train_loss: 0.6800, test_loss: 1.1046, test_f1: 0.5323
 epoch: 91, train_loss: 0.6944, test_loss: 1.1488, test_f1: 0.5630
 epoch: 92, train_loss: 0.6965, test_loss: 1.0525, test_f1: 0.5722
 epoch: 93, train_loss: 0.6814, test_loss: 1.1040, test_f1: 0.5758
 epoch: 94, train_loss: 0.6842, test_loss: 1.1353, test_f1: 0.5325
 epoch: 95, train_loss: 0.6796, test_loss: 1.1874, test_f1: 0.5603
 epoch: 96, train_loss: 0.7003, test_loss: 1.0474, test_f1: 0.5421
 epoch: 97, train_loss: 0.6831, test_loss: 1.0376, test_f1: 0.5513
 epoch: 98, train_loss: 0.6719, test_loss: 1.0967, test_f1: 0.5385
 epoch: 99, train_loss: 0.6710, test_loss: 1.0498, test_f1: 0.5550
##################ITERATION #6 ****************************************
 epoch: 0, train_loss: 1.3081, test_loss: 1.2508, test_f1: 0.3017
 epoch: 1, train_loss: 1.2316, test_loss: 1.1750, test_f1: 0.4017
 epoch: 2, train_loss: 1.2013, test_loss: 1.1237, test_f1: 0.4297
 epoch: 3, train_loss: 1.1567, test_loss: 1.1054, test_f1: 0.3814
 epoch: 4, train_loss: 1.0968, test_loss: 0.9917, test_f1: 0.5019
 epoch: 5, train_loss: 1.0680, test_loss: 0.9698, test_f1: 0.4837
 epoch: 6, train_loss: 1.0316, test_loss: 0.9456, test_f1: 0.4720
 epoch: 7, train_loss: 1.0286, test_loss: 1.0324, test_f1: 0.4632
 epoch: 8, train_loss: 1.0051, test_loss: 0.9528, test_f1: 0.4813
 epoch: 9, train_loss: 0.9955, test_loss: 0.8910, test_f1: 0.5024
 epoch: 10, train_loss: 0.9764, test_loss: 0.9211, test_f1: 0.4728
 epoch: 11, train_loss: 0.9620, test_loss: 0.9488, test_f1: 0.5056
 epoch: 12, train_loss: 0.9594, test_loss: 0.9249, test_f1: 0.5099
 epoch: 13, train_loss: 0.9600, test_loss: 0.9213, test_f1: 0.4921
 epoch: 14, train_loss: 0.9438, test_loss: 0.9311, test_f1: 0.5291
 epoch: 15, train_loss: 0.9306, test_loss: 0.9043, test_f1: 0.5027
 epoch: 16, train_loss: 0.9285, test_loss: 0.9245, test_f1: 0.5413
 epoch: 17, train_loss: 0.9201, test_loss: 0.9913, test_f1: 0.4987
 epoch: 18, train_loss: 0.9292, test_loss: 1.0150, test_f1: 0.4823
 epoch: 19, train_loss: 0.9214, test_loss: 1.0573, test_f1: 0.4666
 epoch: 20, train_loss: 0.9142, test_loss: 0.9630, test_f1: 0.5352
 epoch: 21, train_loss: 0.9170, test_loss: 0.9052, test_f1: 0.5430
 epoch: 22, train_loss: 0.9014, test_loss: 0.9010, test_f1: 0.4971
 epoch: 23, train_loss: 0.8968, test_loss: 0.9842, test_f1: 0.4879
 epoch: 24, train_loss: 0.8858, test_loss: 0.8915, test_f1: 0.5155
 epoch: 25, train_loss: 0.8840, test_loss: 0.9886, test_f1: 0.5556
 epoch: 26, train_loss: 0.8773, test_loss: 1.0652, test_f1: 0.5164
 epoch: 27, train_loss: 0.8633, test_loss: 0.9113, test_f1: 0.5361
 epoch: 28, train_loss: 0.8815, test_loss: 0.9774, test_f1: 0.5567
 epoch: 29, train_loss: 0.8770, test_loss: 0.9060, test_f1: 0.5570
 epoch: 30, train_loss: 0.8627, test_loss: 0.9163, test_f1: 0.5330
 epoch: 31, train_loss: 0.8632, test_loss: 0.9583, test_f1: 0.5570
 epoch: 32, train_loss: 0.8684, test_loss: 1.0239, test_f1: 0.5273
 epoch: 33, train_loss: 0.8418, test_loss: 0.9336, test_f1: 0.5508
 epoch: 34, train_loss: 0.8406, test_loss: 0.9549, test_f1: 0.5533
 epoch: 35, train_loss: 0.8461, test_loss: 0.9274, test_f1: 0.5521
 epoch: 36, train_loss: 0.8350, test_loss: 0.9670, test_f1: 0.5485
 epoch: 37, train_loss: 0.8453, test_loss: 0.9480, test_f1: 0.5427
 epoch: 38, train_loss: 0.8254, test_loss: 1.0633, test_f1: 0.5067
 epoch: 39, train_loss: 0.8431, test_loss: 0.9923, test_f1: 0.5092
 epoch: 40, train_loss: 0.8458, test_loss: 0.9552, test_f1: 0.5409
 epoch: 41, train_loss: 0.8255, test_loss: 1.0168, test_f1: 0.5245
 epoch: 42, train_loss: 0.8516, test_loss: 1.1019, test_f1: 0.5125
 epoch: 43, train_loss: 0.8356, test_loss: 0.9116, test_f1: 0.5466
 epoch: 44, train_loss: 0.8173, test_loss: 0.9468, test_f1: 0.5670
 epoch: 45, train_loss: 0.8229, test_loss: 0.9726, test_f1: 0.5345
 epoch: 46, train_loss: 0.8313, test_loss: 1.0180, test_f1: 0.5146
 epoch: 47, train_loss: 0.8176, test_loss: 0.9366, test_f1: 0.5613
 epoch: 48, train_loss: 0.8252, test_loss: 0.8846, test_f1: 0.5498
 epoch: 49, train_loss: 0.8172, test_loss: 0.9450, test_f1: 0.5577
 epoch: 50, train_loss: 0.8110, test_loss: 0.9116, test_f1: 0.5696
 epoch: 51, train_loss: 0.7971, test_loss: 0.9599, test_f1: 0.5252
 epoch: 52, train_loss: 0.7652, test_loss: 0.9921, test_f1: 0.5585
 epoch: 53, train_loss: 0.7691, test_loss: 1.0686, test_f1: 0.5360
 epoch: 54, train_loss: 0.7582, test_loss: 0.9721, test_f1: 0.5469
 epoch: 55, train_loss: 0.7446, test_loss: 0.9821, test_f1: 0.5704
 epoch: 56, train_loss: 0.7563, test_loss: 1.0744, test_f1: 0.5398
 epoch: 57, train_loss: 0.7388, test_loss: 0.9377, test_f1: 0.5744
 epoch: 58, train_loss: 0.7650, test_loss: 1.0074, test_f1: 0.5782
 epoch: 59, train_loss: 0.7409, test_loss: 0.9992, test_f1: 0.5792
 epoch: 60, train_loss: 0.7507, test_loss: 1.1825, test_f1: 0.5377
 epoch: 61, train_loss: 0.7417, test_loss: 1.1809, test_f1: 0.5200
 epoch: 62, train_loss: 0.7344, test_loss: 1.0058, test_f1: 0.5696
 epoch: 63, train_loss: 0.7183, test_loss: 1.1192, test_f1: 0.5549
 epoch: 64, train_loss: 0.7424, test_loss: 1.0685, test_f1: 0.5601
 epoch: 65, train_loss: 0.7422, test_loss: 1.0515, test_f1: 0.5535
 epoch: 66, train_loss: 0.7278, test_loss: 0.9905, test_f1: 0.5507
 epoch: 67, train_loss: 0.7227, test_loss: 0.9891, test_f1: 0.5508
 epoch: 68, train_loss: 0.7228, test_loss: 1.0610, test_f1: 0.5751
 epoch: 69, train_loss: 0.7224, test_loss: 1.0540, test_f1: 0.5758
 epoch: 70, train_loss: 0.7128, test_loss: 1.0441, test_f1: 0.5579
 epoch: 71, train_loss: 0.7161, test_loss: 1.1524, test_f1: 0.5163
 epoch: 72, train_loss: 0.7130, test_loss: 1.0066, test_f1: 0.5788
 epoch: 73, train_loss: 0.7219, test_loss: 1.0178, test_f1: 0.5580
 epoch: 74, train_loss: 0.7216, test_loss: 1.1034, test_f1: 0.5324
 epoch: 75, train_loss: 0.7140, test_loss: 0.9481, test_f1: 0.5984
 epoch: 76, train_loss: 0.7102, test_loss: 1.0430, test_f1: 0.5636
 epoch: 77, train_loss: 0.7130, test_loss: 1.1370, test_f1: 0.5780
 epoch: 78, train_loss: 0.7061, test_loss: 1.0411, test_f1: 0.5631
 epoch: 79, train_loss: 0.6985, test_loss: 1.0039, test_f1: 0.5561
 epoch: 80, train_loss: 0.7181, test_loss: 1.1324, test_f1: 0.5206
 epoch: 81, train_loss: 0.7053, test_loss: 1.0399, test_f1: 0.5582
 epoch: 82, train_loss: 0.6975, test_loss: 1.1171, test_f1: 0.5702
 epoch: 83, train_loss: 0.6902, test_loss: 0.9538, test_f1: 0.5528
 epoch: 84, train_loss: 0.6990, test_loss: 1.1233, test_f1: 0.5635
 epoch: 85, train_loss: 0.6897, test_loss: 1.0716, test_f1: 0.5577
 epoch: 86, train_loss: 0.6983, test_loss: 0.9890, test_f1: 0.5603
 epoch: 87, train_loss: 0.6946, test_loss: 0.9988, test_f1: 0.5950
 epoch: 88, train_loss: 0.6908, test_loss: 0.9946, test_f1: 0.5627
 epoch: 89, train_loss: 0.6911, test_loss: 1.1297, test_f1: 0.5645
 epoch: 90, train_loss: 0.6907, test_loss: 1.0220, test_f1: 0.5723
 epoch: 91, train_loss: 0.6578, test_loss: 1.0130, test_f1: 0.5767
 epoch: 92, train_loss: 0.6658, test_loss: 1.0888, test_f1: 0.5741
 epoch: 93, train_loss: 0.6817, test_loss: 1.2375, test_f1: 0.5643
 epoch: 94, train_loss: 0.6780, test_loss: 1.2571, test_f1: 0.5538
 epoch: 95, train_loss: 0.6565, test_loss: 1.0504, test_f1: 0.5576
 epoch: 96, train_loss: 0.6733, test_loss: 0.9677, test_f1: 0.5867
 epoch: 97, train_loss: 0.7011, test_loss: 1.0272, test_f1: 0.5521
 epoch: 98, train_loss: 0.6673, test_loss: 1.1210, test_f1: 0.5498
 epoch: 99, train_loss: 0.6477, test_loss: 1.1731, test_f1: 0.5576
##################ITERATION #7 ****************************************
 epoch: 0, train_loss: 1.3054, test_loss: 1.2494, test_f1: 0.2589
 epoch: 1, train_loss: 1.2308, test_loss: 1.1689, test_f1: 0.4129
 epoch: 2, train_loss: 1.1835, test_loss: 1.1434, test_f1: 0.4350
 epoch: 3, train_loss: 1.1451, test_loss: 1.0919, test_f1: 0.4553
 epoch: 4, train_loss: 1.1183, test_loss: 1.0382, test_f1: 0.4678
 epoch: 5, train_loss: 1.0927, test_loss: 1.0423, test_f1: 0.4833
 epoch: 6, train_loss: 1.0707, test_loss: 1.0066, test_f1: 0.4906
 epoch: 7, train_loss: 1.0359, test_loss: 0.9799, test_f1: 0.4684
 epoch: 8, train_loss: 1.0209, test_loss: 0.9782, test_f1: 0.4930
 epoch: 9, train_loss: 0.9926, test_loss: 1.0597, test_f1: 0.4272
 epoch: 10, train_loss: 0.9774, test_loss: 0.9468, test_f1: 0.4997
 epoch: 11, train_loss: 0.9845, test_loss: 1.0082, test_f1: 0.4949
 epoch: 12, train_loss: 0.9558, test_loss: 0.9732, test_f1: 0.4870
 epoch: 13, train_loss: 0.9447, test_loss: 0.9892, test_f1: 0.5044
 epoch: 14, train_loss: 0.9351, test_loss: 1.0529, test_f1: 0.4845
 epoch: 15, train_loss: 0.9511, test_loss: 1.0135, test_f1: 0.4833
 epoch: 16, train_loss: 0.9392, test_loss: 1.0335, test_f1: 0.4764
 epoch: 17, train_loss: 0.9259, test_loss: 1.0628, test_f1: 0.4860
 epoch: 18, train_loss: 0.9131, test_loss: 1.0312, test_f1: 0.4955
 epoch: 19, train_loss: 0.9045, test_loss: 1.0501, test_f1: 0.4824
 epoch: 20, train_loss: 0.9483, test_loss: 1.0351, test_f1: 0.5157
 epoch: 21, train_loss: 0.9062, test_loss: 0.9964, test_f1: 0.5008
 epoch: 22, train_loss: 0.8883, test_loss: 1.0197, test_f1: 0.4806
 epoch: 23, train_loss: 0.8980, test_loss: 0.9957, test_f1: 0.4979
 epoch: 24, train_loss: 0.8846, test_loss: 0.9686, test_f1: 0.5141
 epoch: 25, train_loss: 0.8814, test_loss: 1.0230, test_f1: 0.4955
 epoch: 26, train_loss: 0.8743, test_loss: 1.0264, test_f1: 0.5017
 epoch: 27, train_loss: 0.8688, test_loss: 1.0249, test_f1: 0.5088
 epoch: 28, train_loss: 0.8665, test_loss: 1.0444, test_f1: 0.5120
 epoch: 29, train_loss: 0.8721, test_loss: 1.0168, test_f1: 0.5091
 epoch: 30, train_loss: 0.8519, test_loss: 1.0502, test_f1: 0.5049
 epoch: 31, train_loss: 0.8569, test_loss: 1.1047, test_f1: 0.5080
 epoch: 32, train_loss: 0.8756, test_loss: 1.0286, test_f1: 0.5230
 epoch: 33, train_loss: 0.8506, test_loss: 1.0262, test_f1: 0.5990
 epoch: 34, train_loss: 0.8481, test_loss: 1.0403, test_f1: 0.5082
 epoch: 35, train_loss: 0.8533, test_loss: 1.0302, test_f1: 0.4913
 epoch: 36, train_loss: 0.8441, test_loss: 1.0573, test_f1: 0.5248
 epoch: 37, train_loss: 0.8327, test_loss: 1.1487, test_f1: 0.4470
 epoch: 38, train_loss: 0.8247, test_loss: 1.1464, test_f1: 0.4941
 epoch: 39, train_loss: 0.8437, test_loss: 1.0593, test_f1: 0.5417
 epoch: 40, train_loss: 0.8212, test_loss: 1.1136, test_f1: 0.5479
 epoch: 41, train_loss: 0.8240, test_loss: 1.0509, test_f1: 0.5312
 epoch: 42, train_loss: 0.8123, test_loss: 1.1288, test_f1: 0.5029
 epoch: 43, train_loss: 0.8135, test_loss: 1.2394, test_f1: 0.4912
 epoch: 44, train_loss: 0.8381, test_loss: 1.0686, test_f1: 0.5205
 epoch: 45, train_loss: 0.8131, test_loss: 1.0758, test_f1: 0.5231
 epoch: 46, train_loss: 0.8163, test_loss: 1.2440, test_f1: 0.4916
 epoch: 47, train_loss: 0.8022, test_loss: 1.0808, test_f1: 0.5641
 epoch: 48, train_loss: 0.7991, test_loss: 1.1471, test_f1: 0.5170
 epoch: 49, train_loss: 0.8145, test_loss: 1.1197, test_f1: 0.5506
 epoch: 50, train_loss: 0.8147, test_loss: 1.0747, test_f1: 0.5315
 epoch: 51, train_loss: 0.7926, test_loss: 1.1461, test_f1: 0.5122
 epoch: 52, train_loss: 0.7641, test_loss: 1.0934, test_f1: 0.5403
 epoch: 53, train_loss: 0.7617, test_loss: 1.1504, test_f1: 0.5468
 epoch: 54, train_loss: 0.7636, test_loss: 1.1053, test_f1: 0.5286
 epoch: 55, train_loss: 0.7668, test_loss: 1.0628, test_f1: 0.5388
 epoch: 56, train_loss: 0.7529, test_loss: 1.1055, test_f1: 0.5369
 epoch: 57, train_loss: 0.7390, test_loss: 1.0954, test_f1: 0.5639
 epoch: 58, train_loss: 0.7350, test_loss: 1.1704, test_f1: 0.5312
 epoch: 59, train_loss: 0.7330, test_loss: 1.1446, test_f1: 0.5724
 epoch: 60, train_loss: 0.7538, test_loss: 1.1296, test_f1: 0.5469
 epoch: 61, train_loss: 0.7438, test_loss: 1.1642, test_f1: 0.5402
 epoch: 62, train_loss: 0.7495, test_loss: 1.1377, test_f1: 0.5668
 epoch: 63, train_loss: 0.7381, test_loss: 1.1104, test_f1: 0.5686
 epoch: 64, train_loss: 0.7308, test_loss: 1.2799, test_f1: 0.5295
 epoch: 65, train_loss: 0.7436, test_loss: 1.1773, test_f1: 0.5697
 epoch: 66, train_loss: 0.7218, test_loss: 1.1947, test_f1: 0.5739
 epoch: 67, train_loss: 0.7288, test_loss: 1.2235, test_f1: 0.5558
 epoch: 68, train_loss: 0.7436, test_loss: 1.1666, test_f1: 0.5439
 epoch: 69, train_loss: 0.7259, test_loss: 1.1647, test_f1: 0.5533
 epoch: 70, train_loss: 0.7181, test_loss: 1.2260, test_f1: 0.5809
 epoch: 71, train_loss: 0.7166, test_loss: 1.1605, test_f1: 0.5469
 epoch: 72, train_loss: 0.7237, test_loss: 1.1606, test_f1: 0.5470
 epoch: 73, train_loss: 0.7283, test_loss: 1.1309, test_f1: 0.5642
 epoch: 74, train_loss: 0.7268, test_loss: 1.4063, test_f1: 0.5192
 epoch: 75, train_loss: 0.7156, test_loss: 1.2593, test_f1: 0.5438
 epoch: 76, train_loss: 0.7018, test_loss: 1.2272, test_f1: 0.5775
 epoch: 77, train_loss: 0.7065, test_loss: 1.2097, test_f1: 0.5786
 epoch: 78, train_loss: 0.7069, test_loss: 1.3062, test_f1: 0.5433
 epoch: 79, train_loss: 0.7188, test_loss: 1.2477, test_f1: 0.5816
 epoch: 80, train_loss: 0.7150, test_loss: 1.3959, test_f1: 0.5364
 epoch: 81, train_loss: 0.7071, test_loss: 1.3147, test_f1: 0.5484
 epoch: 82, train_loss: 0.6991, test_loss: 1.2454, test_f1: 0.5653
 epoch: 83, train_loss: 0.6920, test_loss: 1.3347, test_f1: 0.5465
 epoch: 84, train_loss: 0.6958, test_loss: 1.2923, test_f1: 0.5538
 epoch: 85, train_loss: 0.6915, test_loss: 1.2963, test_f1: 0.5587
 epoch: 86, train_loss: 0.7072, test_loss: 1.3209, test_f1: 0.5292
 epoch: 87, train_loss: 0.7175, test_loss: 1.3116, test_f1: 0.5573
 epoch: 88, train_loss: 0.6877, test_loss: 1.4579, test_f1: 0.5302
 epoch: 89, train_loss: 0.6964, test_loss: 1.3408, test_f1: 0.5486
 epoch: 90, train_loss: 0.6912, test_loss: 1.3459, test_f1: 0.5372
 epoch: 91, train_loss: 0.6864, test_loss: 1.3361, test_f1: 0.5504
 epoch: 92, train_loss: 0.6956, test_loss: 1.2537, test_f1: 0.5549
 epoch: 93, train_loss: 0.7017, test_loss: 1.2265, test_f1: 0.5775
 epoch: 94, train_loss: 0.6909, test_loss: 1.2488, test_f1: 0.5772
 epoch: 95, train_loss: 0.6713, test_loss: 1.2429, test_f1: 0.5720
 epoch: 96, train_loss: 0.6963, test_loss: 1.3117, test_f1: 0.5314
 epoch: 97, train_loss: 0.6775, test_loss: 1.2791, test_f1: 0.5458
 epoch: 98, train_loss: 0.6742, test_loss: 1.3320, test_f1: 0.5526
 epoch: 99, train_loss: 0.6743, test_loss: 1.2387, test_f1: 0.5566
##################ITERATION #8 ****************************************
 epoch: 0, train_loss: 1.3073, test_loss: 1.2540, test_f1: 0.3094
 epoch: 1, train_loss: 1.2076, test_loss: 1.1172, test_f1: 0.4840
 epoch: 2, train_loss: 1.1725, test_loss: 1.1344, test_f1: 0.3912
 epoch: 3, train_loss: 1.1143, test_loss: 1.0384, test_f1: 0.4890
 epoch: 4, train_loss: 1.1016, test_loss: 1.0317, test_f1: 0.4812
 epoch: 5, train_loss: 1.0976, test_loss: 1.0272, test_f1: 0.4612
 epoch: 6, train_loss: 1.0642, test_loss: 0.9898, test_f1: 0.4374
 epoch: 7, train_loss: 1.0400, test_loss: 0.9500, test_f1: 0.4749
 epoch: 8, train_loss: 1.0320, test_loss: 1.0528, test_f1: 0.4700
 epoch: 9, train_loss: 1.0225, test_loss: 1.0129, test_f1: 0.4729
 epoch: 10, train_loss: 1.0213, test_loss: 1.0905, test_f1: 0.4380
 epoch: 11, train_loss: 1.0044, test_loss: 1.0326, test_f1: 0.4779
 epoch: 12, train_loss: 0.9856, test_loss: 0.9363, test_f1: 0.4875
 epoch: 13, train_loss: 0.9706, test_loss: 0.9663, test_f1: 0.4879
 epoch: 14, train_loss: 0.9459, test_loss: 1.0304, test_f1: 0.4744
 epoch: 15, train_loss: 0.9440, test_loss: 0.9645, test_f1: 0.5171
 epoch: 16, train_loss: 0.9404, test_loss: 0.9950, test_f1: 0.4763
 epoch: 17, train_loss: 0.9357, test_loss: 1.0035, test_f1: 0.5025
 epoch: 18, train_loss: 0.9200, test_loss: 1.0005, test_f1: 0.5020
 epoch: 19, train_loss: 0.9124, test_loss: 0.9462, test_f1: 0.5058
 epoch: 20, train_loss: 0.9230, test_loss: 1.0391, test_f1: 0.5077
 epoch: 21, train_loss: 0.9208, test_loss: 1.0346, test_f1: 0.5342
 epoch: 22, train_loss: 0.9224, test_loss: 1.0253, test_f1: 0.4728
 epoch: 23, train_loss: 0.8951, test_loss: 0.9724, test_f1: 0.5215
 epoch: 24, train_loss: 0.8941, test_loss: 0.9594, test_f1: 0.5345
 epoch: 25, train_loss: 0.8857, test_loss: 0.9989, test_f1: 0.5129
 epoch: 26, train_loss: 0.8723, test_loss: 1.0228, test_f1: 0.5463
 epoch: 27, train_loss: 0.8940, test_loss: 1.0060, test_f1: 0.4889
 epoch: 28, train_loss: 0.8662, test_loss: 1.0428, test_f1: 0.5310
 epoch: 29, train_loss: 0.8824, test_loss: 0.9747, test_f1: 0.5378
 epoch: 30, train_loss: 0.8669, test_loss: 0.9854, test_f1: 0.5370
 epoch: 31, train_loss: 0.8497, test_loss: 1.0169, test_f1: 0.5074
 epoch: 32, train_loss: 0.8585, test_loss: 1.0397, test_f1: 0.5133
 epoch: 33, train_loss: 0.8975, test_loss: 1.0235, test_f1: 0.5042
 epoch: 34, train_loss: 0.8821, test_loss: 1.0136, test_f1: 0.5306
 epoch: 35, train_loss: 0.8675, test_loss: 1.0244, test_f1: 0.4860
 epoch: 36, train_loss: 0.8557, test_loss: 0.9770, test_f1: 0.5441
 epoch: 37, train_loss: 0.8560, test_loss: 0.9948, test_f1: 0.5474
 epoch: 38, train_loss: 0.8412, test_loss: 1.0069, test_f1: 0.5693
 epoch: 39, train_loss: 0.8304, test_loss: 0.9702, test_f1: 0.5406
 epoch: 40, train_loss: 0.8288, test_loss: 1.1058, test_f1: 0.5038
 epoch: 41, train_loss: 0.8883, test_loss: 1.0018, test_f1: 0.5282
 epoch: 42, train_loss: 0.8567, test_loss: 0.9864, test_f1: 0.5105
 epoch: 43, train_loss: 0.8607, test_loss: 1.0262, test_f1: 0.5243
 epoch: 44, train_loss: 0.8497, test_loss: 1.0949, test_f1: 0.5361
 epoch: 45, train_loss: 0.8335, test_loss: 1.0180, test_f1: 0.5305
 epoch: 46, train_loss: 0.8265, test_loss: 1.0004, test_f1: 0.5406
 epoch: 47, train_loss: 0.8378, test_loss: 0.9503, test_f1: 0.5405
 epoch: 48, train_loss: 0.8170, test_loss: 0.9714, test_f1: 0.5289
 epoch: 49, train_loss: 0.8274, test_loss: 0.9905, test_f1: 0.5376
 epoch: 50, train_loss: 0.8347, test_loss: 1.0580, test_f1: 0.5295
 epoch: 51, train_loss: 0.7983, test_loss: 0.9307, test_f1: 0.5612
 epoch: 52, train_loss: 0.7864, test_loss: 0.9112, test_f1: 0.5657
 epoch: 53, train_loss: 0.7933, test_loss: 1.0524, test_f1: 0.5520
 epoch: 54, train_loss: 0.7847, test_loss: 1.0560, test_f1: 0.5377
 epoch: 55, train_loss: 0.7791, test_loss: 0.9751, test_f1: 0.5409
 epoch: 56, train_loss: 0.7783, test_loss: 0.9216, test_f1: 0.5545
 epoch: 57, train_loss: 0.7574, test_loss: 0.9589, test_f1: 0.5657
 epoch: 58, train_loss: 0.7716, test_loss: 0.9820, test_f1: 0.5353
 epoch: 59, train_loss: 0.7692, test_loss: 0.9234, test_f1: 0.5515
 epoch: 60, train_loss: 0.7505, test_loss: 0.9232, test_f1: 0.5738
 epoch: 61, train_loss: 0.7520, test_loss: 0.9205, test_f1: 0.5565
 epoch: 62, train_loss: 0.7656, test_loss: 0.9525, test_f1: 0.5594
 epoch: 63, train_loss: 0.7709, test_loss: 0.9531, test_f1: 0.5546
 epoch: 64, train_loss: 0.7532, test_loss: 0.9683, test_f1: 0.5250
 epoch: 65, train_loss: 0.7410, test_loss: 0.9544, test_f1: 0.5679
 epoch: 66, train_loss: 0.7561, test_loss: 0.9376, test_f1: 0.5687
 epoch: 67, train_loss: 0.7467, test_loss: 0.9542, test_f1: 0.5417
 epoch: 68, train_loss: 0.7376, test_loss: 1.0027, test_f1: 0.5156
 epoch: 69, train_loss: 0.7405, test_loss: 0.9619, test_f1: 0.5781
 epoch: 70, train_loss: 0.7362, test_loss: 0.9469, test_f1: 0.5629
 epoch: 71, train_loss: 0.7410, test_loss: 1.0397, test_f1: 0.5434
 epoch: 72, train_loss: 0.7273, test_loss: 0.9566, test_f1: 0.5837
 epoch: 73, train_loss: 0.7333, test_loss: 0.9861, test_f1: 0.5665
 epoch: 74, train_loss: 0.7373, test_loss: 0.9736, test_f1: 0.5797
 epoch: 75, train_loss: 0.7154, test_loss: 1.1522, test_f1: 0.5275
 epoch: 76, train_loss: 0.7439, test_loss: 1.3055, test_f1: 0.5186
 epoch: 77, train_loss: 0.7475, test_loss: 0.9977, test_f1: 0.5593
 epoch: 78, train_loss: 0.7323, test_loss: 0.9950, test_f1: 0.5689
 epoch: 79, train_loss: 0.7209, test_loss: 0.9946, test_f1: 0.5338
 epoch: 80, train_loss: 0.7590, test_loss: 1.0389, test_f1: 0.5180
 epoch: 81, train_loss: 0.7276, test_loss: 0.9421, test_f1: 0.5483
 epoch: 82, train_loss: 0.7258, test_loss: 0.9862, test_f1: 0.5525
 epoch: 83, train_loss: 0.7213, test_loss: 1.0098, test_f1: 0.5635
 epoch: 84, train_loss: 0.7070, test_loss: 0.9785, test_f1: 0.5669
 epoch: 85, train_loss: 0.7162, test_loss: 0.9943, test_f1: 0.5597
 epoch: 86, train_loss: 0.7117, test_loss: 0.9773, test_f1: 0.5607
 epoch: 87, train_loss: 0.6935, test_loss: 1.0215, test_f1: 0.5583
 epoch: 88, train_loss: 0.7328, test_loss: 1.0067, test_f1: 0.5410
 epoch: 89, train_loss: 0.7249, test_loss: 1.0244, test_f1: 0.5483
 epoch: 90, train_loss: 0.7196, test_loss: 1.0008, test_f1: 0.5737
 epoch: 91, train_loss: 0.6972, test_loss: 1.0140, test_f1: 0.5564
 epoch: 92, train_loss: 0.7116, test_loss: 0.9531, test_f1: 0.5853
 epoch: 93, train_loss: 0.7030, test_loss: 0.9219, test_f1: 0.5641
 epoch: 94, train_loss: 0.7223, test_loss: 1.0151, test_f1: 0.5239
 epoch: 95, train_loss: 0.7078, test_loss: 1.0053, test_f1: 0.5589
 epoch: 96, train_loss: 0.6990, test_loss: 1.1164, test_f1: 0.5360
 epoch: 97, train_loss: 0.6946, test_loss: 1.0167, test_f1: 0.5793
 epoch: 98, train_loss: 0.6981, test_loss: 0.9409, test_f1: 0.5671
 epoch: 99, train_loss: 0.7003, test_loss: 0.9824, test_f1: 0.5584
##################ITERATION #9 ****************************************
 epoch: 0, train_loss: 1.3060, test_loss: 1.2400, test_f1: 0.3077
 epoch: 1, train_loss: 1.2231, test_loss: 1.1733, test_f1: 0.4352
 epoch: 2, train_loss: 1.1710, test_loss: 1.1063, test_f1: 0.4534
 epoch: 3, train_loss: 1.1388, test_loss: 1.0675, test_f1: 0.4887
 epoch: 4, train_loss: 1.1229, test_loss: 1.0420, test_f1: 0.4664
 epoch: 5, train_loss: 1.0949, test_loss: 1.0949, test_f1: 0.4512
 epoch: 6, train_loss: 1.0710, test_loss: 0.9994, test_f1: 0.4679
 epoch: 7, train_loss: 1.0444, test_loss: 1.0248, test_f1: 0.4467
 epoch: 8, train_loss: 1.0353, test_loss: 0.9952, test_f1: 0.4571
 epoch: 9, train_loss: 1.0206, test_loss: 0.9464, test_f1: 0.4777
 epoch: 10, train_loss: 1.0262, test_loss: 0.9485, test_f1: 0.5101
 epoch: 11, train_loss: 1.0118, test_loss: 1.0822, test_f1: 0.3877
 epoch: 12, train_loss: 0.9829, test_loss: 0.9901, test_f1: 0.5117
 epoch: 13, train_loss: 0.9913, test_loss: 1.1209, test_f1: 0.4590
 epoch: 14, train_loss: 0.9686, test_loss: 1.0273, test_f1: 0.4874
 epoch: 15, train_loss: 0.9700, test_loss: 1.0448, test_f1: 0.4878
 epoch: 16, train_loss: 0.9548, test_loss: 1.0194, test_f1: 0.4976
 epoch: 17, train_loss: 0.9607, test_loss: 1.0326, test_f1: 0.4927
 epoch: 18, train_loss: 0.9605, test_loss: 0.9831, test_f1: 0.4926
 epoch: 19, train_loss: 0.9456, test_loss: 0.9827, test_f1: 0.4978
 epoch: 20, train_loss: 0.9461, test_loss: 1.0328, test_f1: 0.5071
 epoch: 21, train_loss: 0.9300, test_loss: 1.0174, test_f1: 0.5123
 epoch: 22, train_loss: 0.9292, test_loss: 0.9716, test_f1: 0.5173
 epoch: 23, train_loss: 0.9187, test_loss: 0.9774, test_f1: 0.4948
 epoch: 24, train_loss: 0.9103, test_loss: 1.0258, test_f1: 0.5183
 epoch: 25, train_loss: 0.9066, test_loss: 1.0201, test_f1: 0.4968
 epoch: 26, train_loss: 0.9046, test_loss: 0.9583, test_f1: 0.5129
 epoch: 27, train_loss: 0.9076, test_loss: 1.0070, test_f1: 0.5016
 epoch: 28, train_loss: 0.8966, test_loss: 0.9961, test_f1: 0.4856
 epoch: 29, train_loss: 0.9190, test_loss: 1.0007, test_f1: 0.5178
 epoch: 30, train_loss: 0.8856, test_loss: 1.0389, test_f1: 0.5136
 epoch: 31, train_loss: 0.9027, test_loss: 1.0774, test_f1: 0.4766
 epoch: 32, train_loss: 0.8789, test_loss: 0.9812, test_f1: 0.5432
 epoch: 33, train_loss: 0.8788, test_loss: 0.9882, test_f1: 0.5106
 epoch: 34, train_loss: 0.8685, test_loss: 0.9894, test_f1: 0.5286
 epoch: 35, train_loss: 0.8906, test_loss: 0.9610, test_f1: 0.5279
 epoch: 36, train_loss: 0.8761, test_loss: 1.0287, test_f1: 0.5259
 epoch: 37, train_loss: 0.8696, test_loss: 0.9852, test_f1: 0.5469
 epoch: 38, train_loss: 0.8430, test_loss: 0.9797, test_f1: 0.5403
 epoch: 39, train_loss: 0.8538, test_loss: 0.9850, test_f1: 0.5133
 epoch: 40, train_loss: 0.8505, test_loss: 0.9600, test_f1: 0.5288
 epoch: 41, train_loss: 0.8427, test_loss: 1.0390, test_f1: 0.4872
 epoch: 42, train_loss: 0.8515, test_loss: 0.9832, test_f1: 0.5491
 epoch: 43, train_loss: 0.8472, test_loss: 0.9862, test_f1: 0.5324
 epoch: 44, train_loss: 0.8305, test_loss: 1.1703, test_f1: 0.4856
 epoch: 45, train_loss: 0.8541, test_loss: 0.9695, test_f1: 0.5412
 epoch: 46, train_loss: 0.8413, test_loss: 1.0021, test_f1: 0.5349
 epoch: 47, train_loss: 0.8373, test_loss: 1.0530, test_f1: 0.5188
 epoch: 48, train_loss: 0.8244, test_loss: 0.9725, test_f1: 0.5575
 epoch: 49, train_loss: 0.8130, test_loss: 1.0658, test_f1: 0.5109
 epoch: 50, train_loss: 0.8316, test_loss: 1.0022, test_f1: 0.5304
 epoch: 51, train_loss: 0.7987, test_loss: 0.9829, test_f1: 0.5535
 epoch: 52, train_loss: 0.7834, test_loss: 0.9854, test_f1: 0.5614
 epoch: 53, train_loss: 0.7723, test_loss: 0.9887, test_f1: 0.5493
 epoch: 54, train_loss: 0.7752, test_loss: 0.9587, test_f1: 0.5513
 epoch: 55, train_loss: 0.7668, test_loss: 0.9982, test_f1: 0.5365
 epoch: 56, train_loss: 0.7734, test_loss: 0.9961, test_f1: 0.5240
 epoch: 57, train_loss: 0.7736, test_loss: 1.0005, test_f1: 0.5502
 epoch: 58, train_loss: 0.7656, test_loss: 1.0659, test_f1: 0.5497
 epoch: 59, train_loss: 0.7639, test_loss: 1.0435, test_f1: 0.5280
 epoch: 60, train_loss: 0.7762, test_loss: 1.0140, test_f1: 0.5416
 epoch: 61, train_loss: 0.7631, test_loss: 1.0501, test_f1: 0.5384
 epoch: 62, train_loss: 0.7577, test_loss: 1.1863, test_f1: 0.5280
 epoch: 63, train_loss: 0.7619, test_loss: 1.1478, test_f1: 0.5390
 epoch: 64, train_loss: 0.7608, test_loss: 1.0792, test_f1: 0.5338
 epoch: 65, train_loss: 0.7542, test_loss: 0.9776, test_f1: 0.5615
 epoch: 66, train_loss: 0.7560, test_loss: 1.0450, test_f1: 0.5400
 epoch: 67, train_loss: 0.7437, test_loss: 1.0935, test_f1: 0.5347
 epoch: 68, train_loss: 0.7382, test_loss: 1.1198, test_f1: 0.5339
 epoch: 69, train_loss: 0.7317, test_loss: 1.0493, test_f1: 0.5463
 epoch: 70, train_loss: 0.7455, test_loss: 0.9781, test_f1: 0.5726
 epoch: 71, train_loss: 0.7466, test_loss: 1.0203, test_f1: 0.5763
 epoch: 72, train_loss: 0.7164, test_loss: 1.1268, test_f1: 0.5251
 epoch: 73, train_loss: 0.7422, test_loss: 0.9795, test_f1: 0.5480
 epoch: 74, train_loss: 0.7275, test_loss: 1.0427, test_f1: 0.5496
 epoch: 75, train_loss: 0.7122, test_loss: 1.0732, test_f1: 0.5348
 epoch: 76, train_loss: 0.7396, test_loss: 1.0185, test_f1: 0.5639
 epoch: 77, train_loss: 0.7414, test_loss: 1.0799, test_f1: 0.5460
 epoch: 78, train_loss: 0.7312, test_loss: 1.0204, test_f1: 0.5620
 epoch: 79, train_loss: 0.7211, test_loss: 1.0925, test_f1: 0.5407
 epoch: 80, train_loss: 0.7056, test_loss: 1.1076, test_f1: 0.5279
 epoch: 81, train_loss: 0.7215, test_loss: 1.1219, test_f1: 0.5315
 epoch: 82, train_loss: 0.7241, test_loss: 1.1042, test_f1: 0.5443
 epoch: 83, train_loss: 0.7181, test_loss: 1.0275, test_f1: 0.5635
 epoch: 84, train_loss: 0.7020, test_loss: 1.0662, test_f1: 0.5497
 epoch: 85, train_loss: 0.7231, test_loss: 1.0231, test_f1: 0.5789
 epoch: 86, train_loss: 0.6975, test_loss: 1.0364, test_f1: 0.5675
 epoch: 87, train_loss: 0.7020, test_loss: 1.0469, test_f1: 0.5520
 epoch: 88, train_loss: 0.7022, test_loss: 1.0284, test_f1: 0.5778
 epoch: 89, train_loss: 0.7083, test_loss: 1.0436, test_f1: 0.5487
 epoch: 90, train_loss: 0.7017, test_loss: 1.1241, test_f1: 0.5404
 epoch: 91, train_loss: 0.6895, test_loss: 1.0572, test_f1: 0.5585
 epoch: 92, train_loss: 0.6882, test_loss: 1.0528, test_f1: 0.5694
 epoch: 93, train_loss: 0.7111, test_loss: 1.0712, test_f1: 0.5583
 epoch: 94, train_loss: 0.7041, test_loss: 1.0735, test_f1: 0.5601
 epoch: 95, train_loss: 0.6895, test_loss: 1.0067, test_f1: 0.5801
 epoch: 96, train_loss: 0.6833, test_loss: 1.1111, test_f1: 0.5381
 epoch: 97, train_loss: 0.6813, test_loss: 1.1251, test_f1: 0.5301
 epoch: 98, train_loss: 0.6966, test_loss: 1.1086, test_f1: 0.5395
 epoch: 99, train_loss: 0.6810, test_loss: 1.1227, test_f1: 0.5380

Training completed in 736.43 seconds
Best F1: 0.6009 at epoch 98
Mean F1 across iterations: 0.5904  0.0086
========================FINAL RESULTS================================
FEGIN weighted F1: 0.6009  0.0086
python main.py --data ltspice_examples --representation component_component --model FEGIN --layers 5 --hiddens 32 --batch_size 64 --lr 0.01 --emb_size 250 --epochs 100 --save_appendix component_component_L5_H32_BS64_LR0.01_E250 --no_val
-----



STDERR:
  File "main.py", line 370, in <module>
    main()
  File "main.py", line 254, in main
    dataset = dataset_class(
  File "/home/philip/projects/ltspice_examples_code_repo/Circuit-Completion-Using-GNNs/component_classification_with_link_prediction_head/evaluation/FEGIN/kernel/circuit_datasets.py", line 15, in __init__
    self.data, self.slices = torch.load(self.processed_paths[0])
  File "/home/philip/.local/lib/python3.8/site-packages/torch/serialization.py", line 1040, in load
    warnings.warn(
  File "/usr/lib/python3.8/warnings.py", line 109, in _showwarnmsg
    sw(msg.message, msg.category, msg.filename, msg.lineno,
  File "main.py", line 47, in warn_with_traceback
    traceback.print_stack(file=log)
/home/philip/projects/ltspice_examples_code_repo/Circuit-Completion-Using-GNNs/component_classification_with_link_prediction_head/evaluation/FEGIN/kernel/circuit_datasets.py:15: FutureWarning: You are using `torch.load` with `weights_only=False` (the current default value), which uses the default pickle module implicitly. It is possible to construct malicious pickle data which will execute arbitrary code during unpickling (See https://github.com/pytorch/pytorch/blob/main/SECURITY.md#untrusted-models for more details). In a future release, the default value for `weights_only` will be flipped to `True`. This limits the functions that could be executed during unpickling. Arbitrary objects will no longer be allowed to be loaded via this mode unless they are explicitly allowlisted by the user via `torch.serialization.add_safe_globals`. We recommend you start setting `weights_only=True` for any use case where you don't have full control of the loaded file. Please open an issue on GitHub for any issues related to this experimental feature.
  self.data, self.slices = torch.load(self.processed_paths[0])
