STDOUT:
Results will be saved in /home/philip/projects/ltspice_examples_code_repo/Circuit-Completion-Using-GNNs/component_classification_with_link_prediction_head/evaluation/FEGIN/results/model_FEGIN_dataset_ltspice_examples
Command line input: python main.py --data ltspice_examples --representation component_pin_net --model FEGIN --layers 4 --hiddens 32 --batch_size 64 --lr 0.001 --emb_size 512 --epochs 100 --save_appendix component_pin_net_L4_H32_BS64_LR0.001_E512 --no_val
 is saved.
-----
ltspice_examples - FEGIN
Using 4 layers, 32 hidden units, h = 2
Loading component_pin_net representation dataset
ENTERED
Training FEGIN on component_pin_net representation
Train: 3558, Test: 846
##################ITERATION #0 ****************************************
 epoch: 0, train_loss: 1.2587, test_loss: 1.0930, test_f1: 0.3629
 epoch: 1, train_loss: 1.0636, test_loss: 1.0429, test_f1: 0.3556
 epoch: 2, train_loss: 1.0348, test_loss: 1.0366, test_f1: 0.4013
 epoch: 3, train_loss: 1.0194, test_loss: 1.0339, test_f1: 0.4151
 epoch: 4, train_loss: 0.9925, test_loss: 1.0142, test_f1: 0.4046
 epoch: 5, train_loss: 0.9738, test_loss: 1.0087, test_f1: 0.4782
 epoch: 6, train_loss: 0.9576, test_loss: 0.9477, test_f1: 0.4863
 epoch: 7, train_loss: 0.9436, test_loss: 0.9340, test_f1: 0.5144
 epoch: 8, train_loss: 0.9383, test_loss: 0.9399, test_f1: 0.5093
 epoch: 9, train_loss: 0.9193, test_loss: 0.9596, test_f1: 0.5062
 epoch: 10, train_loss: 0.9151, test_loss: 0.9149, test_f1: 0.4931
 epoch: 11, train_loss: 0.9031, test_loss: 0.9064, test_f1: 0.5195
 epoch: 12, train_loss: 0.9006, test_loss: 0.8867, test_f1: 0.5052
 epoch: 13, train_loss: 0.8922, test_loss: 0.9159, test_f1: 0.5055
 epoch: 14, train_loss: 0.8750, test_loss: 0.8770, test_f1: 0.5427
 epoch: 15, train_loss: 0.8736, test_loss: 0.9431, test_f1: 0.5154
 epoch: 16, train_loss: 0.8585, test_loss: 0.9028, test_f1: 0.5405
 epoch: 17, train_loss: 0.8540, test_loss: 0.8940, test_f1: 0.5189
 epoch: 18, train_loss: 0.8413, test_loss: 0.9319, test_f1: 0.5244
 epoch: 19, train_loss: 0.8361, test_loss: 0.8854, test_f1: 0.5350
 epoch: 20, train_loss: 0.8265, test_loss: 1.0083, test_f1: 0.4934
 epoch: 21, train_loss: 0.8305, test_loss: 0.9152, test_f1: 0.5073
 epoch: 22, train_loss: 0.8332, test_loss: 0.9706, test_f1: 0.4749
 epoch: 23, train_loss: 0.8114, test_loss: 0.8767, test_f1: 0.5257
 epoch: 24, train_loss: 0.8184, test_loss: 0.8290, test_f1: 0.5581
 epoch: 25, train_loss: 0.7945, test_loss: 0.9441, test_f1: 0.5326
 epoch: 26, train_loss: 0.8076, test_loss: 0.8789, test_f1: 0.5534
 epoch: 27, train_loss: 0.7999, test_loss: 0.8657, test_f1: 0.5513
 epoch: 28, train_loss: 0.7909, test_loss: 0.8651, test_f1: 0.5402
 epoch: 29, train_loss: 0.7790, test_loss: 0.8325, test_f1: 0.5526
 epoch: 30, train_loss: 0.7748, test_loss: 0.7963, test_f1: 0.5617
 epoch: 31, train_loss: 0.7771, test_loss: 0.9061, test_f1: 0.5122
 epoch: 32, train_loss: 0.7590, test_loss: 0.8647, test_f1: 0.6164
 epoch: 33, train_loss: 0.7517, test_loss: 0.9037, test_f1: 0.5328
 epoch: 34, train_loss: 0.7623, test_loss: 0.9483, test_f1: 0.5345
 epoch: 35, train_loss: 0.7737, test_loss: 0.8852, test_f1: 0.5680
 epoch: 36, train_loss: 0.7488, test_loss: 0.8348, test_f1: 0.5769
 epoch: 37, train_loss: 0.7365, test_loss: 0.8011, test_f1: 0.5818
 epoch: 38, train_loss: 0.7247, test_loss: 0.8006, test_f1: 0.5777
 epoch: 39, train_loss: 0.7302, test_loss: 0.8524, test_f1: 0.5964
 epoch: 40, train_loss: 0.7313, test_loss: 0.7972, test_f1: 0.5966
 epoch: 41, train_loss: 0.7194, test_loss: 0.8216, test_f1: 0.5887
 epoch: 42, train_loss: 0.7056, test_loss: 0.8344, test_f1: 0.5559
 epoch: 43, train_loss: 0.7180, test_loss: 0.8271, test_f1: 0.5939
 epoch: 44, train_loss: 0.7098, test_loss: 0.7889, test_f1: 0.6055
 epoch: 45, train_loss: 0.7151, test_loss: 0.7930, test_f1: 0.5816
 epoch: 46, train_loss: 0.7014, test_loss: 0.8501, test_f1: 0.5713
 epoch: 47, train_loss: 0.6983, test_loss: 0.8893, test_f1: 0.5708
 epoch: 48, train_loss: 0.6914, test_loss: 0.8782, test_f1: 0.5607
 epoch: 49, train_loss: 0.6941, test_loss: 0.8455, test_f1: 0.6087
 epoch: 50, train_loss: 0.6773, test_loss: 0.8450, test_f1: 0.6137
 epoch: 51, train_loss: 0.6650, test_loss: 0.8221, test_f1: 0.6004
 epoch: 52, train_loss: 0.6433, test_loss: 0.8211, test_f1: 0.5874
 epoch: 53, train_loss: 0.6558, test_loss: 0.8140, test_f1: 0.6044
 epoch: 54, train_loss: 0.6361, test_loss: 0.8216, test_f1: 0.6078
 epoch: 55, train_loss: 0.6422, test_loss: 0.8608, test_f1: 0.6104
 epoch: 56, train_loss: 0.6417, test_loss: 0.8221, test_f1: 0.6245
 epoch: 57, train_loss: 0.6396, test_loss: 0.8691, test_f1: 0.6100
 epoch: 58, train_loss: 0.6296, test_loss: 0.8067, test_f1: 0.6119
 epoch: 59, train_loss: 0.6229, test_loss: 0.8196, test_f1: 0.6285
 epoch: 60, train_loss: 0.6255, test_loss: 0.8557, test_f1: 0.6362
 epoch: 61, train_loss: 0.6224, test_loss: 0.8760, test_f1: 0.6248
 epoch: 62, train_loss: 0.6081, test_loss: 0.8616, test_f1: 0.6121
 epoch: 63, train_loss: 0.6124, test_loss: 0.8986, test_f1: 0.6339
 epoch: 64, train_loss: 0.6190, test_loss: 0.8589, test_f1: 0.6154
 epoch: 65, train_loss: 0.6185, test_loss: 0.9354, test_f1: 0.6169
 epoch: 66, train_loss: 0.6070, test_loss: 0.9190, test_f1: 0.6163
 epoch: 67, train_loss: 0.6078, test_loss: 0.8943, test_f1: 0.6260
 epoch: 68, train_loss: 0.5937, test_loss: 0.9028, test_f1: 0.6265
 epoch: 69, train_loss: 0.5958, test_loss: 0.8748, test_f1: 0.6498
 epoch: 70, train_loss: 0.5941, test_loss: 0.9343, test_f1: 0.6136
 epoch: 71, train_loss: 0.5910, test_loss: 0.9355, test_f1: 0.6428
 epoch: 72, train_loss: 0.5909, test_loss: 0.9077, test_f1: 0.6440
 epoch: 73, train_loss: 0.5903, test_loss: 0.9084, test_f1: 0.6419
 epoch: 74, train_loss: 0.5915, test_loss: 0.9357, test_f1: 0.6562
 epoch: 75, train_loss: 0.5867, test_loss: 0.9173, test_f1: 0.6499
 epoch: 76, train_loss: 0.5777, test_loss: 0.8570, test_f1: 0.6237
 epoch: 77, train_loss: 0.5689, test_loss: 0.9137, test_f1: 0.6306
 epoch: 78, train_loss: 0.5842, test_loss: 0.9611, test_f1: 0.6587
 epoch: 79, train_loss: 0.5649, test_loss: 0.9751, test_f1: 0.6315
 epoch: 80, train_loss: 0.5591, test_loss: 0.9335, test_f1: 0.6182
 epoch: 81, train_loss: 0.5752, test_loss: 1.0286, test_f1: 0.6282
 epoch: 82, train_loss: 0.5544, test_loss: 0.9349, test_f1: 0.6323
 epoch: 83, train_loss: 0.5511, test_loss: 0.9272, test_f1: 0.6332
 epoch: 84, train_loss: 0.5538, test_loss: 0.9161, test_f1: 0.6608
 epoch: 85, train_loss: 0.5455, test_loss: 0.9467, test_f1: 0.6591
 epoch: 86, train_loss: 0.5467, test_loss: 0.9664, test_f1: 0.6137
 epoch: 87, train_loss: 0.5527, test_loss: 0.9896, test_f1: 0.6406
 epoch: 88, train_loss: 0.5486, test_loss: 1.0243, test_f1: 0.6524
 epoch: 89, train_loss: 0.5475, test_loss: 0.9323, test_f1: 0.6427
 epoch: 90, train_loss: 0.5566, test_loss: 1.0062, test_f1: 0.6348
 epoch: 91, train_loss: 0.5531, test_loss: 0.9406, test_f1: 0.6393
 epoch: 92, train_loss: 0.5468, test_loss: 0.9130, test_f1: 0.6618
 epoch: 93, train_loss: 0.5324, test_loss: 0.9463, test_f1: 0.6616
 epoch: 94, train_loss: 0.5300, test_loss: 0.9634, test_f1: 0.6591
 epoch: 95, train_loss: 0.5298, test_loss: 0.9566, test_f1: 0.6749
 epoch: 96, train_loss: 0.5302, test_loss: 0.9398, test_f1: 0.6502
 epoch: 97, train_loss: 0.5316, test_loss: 0.9603, test_f1: 0.6376
 epoch: 98, train_loss: 0.5131, test_loss: 0.9714, test_f1: 0.6606
 epoch: 99, train_loss: 0.5117, test_loss: 0.9212, test_f1: 0.6582
##################ITERATION #1 ****************************************
 epoch: 0, train_loss: 1.1257, test_loss: 1.0692, test_f1: 0.4543
 epoch: 1, train_loss: 0.9952, test_loss: 0.9762, test_f1: 0.4822
 epoch: 2, train_loss: 0.9720, test_loss: 0.9225, test_f1: 0.5082
 epoch: 3, train_loss: 0.9457, test_loss: 0.9041, test_f1: 0.5113
 epoch: 4, train_loss: 0.9216, test_loss: 0.9165, test_f1: 0.5142
 epoch: 5, train_loss: 0.9175, test_loss: 0.9055, test_f1: 0.5288
 epoch: 6, train_loss: 0.9040, test_loss: 0.8751, test_f1: 0.5446
 epoch: 7, train_loss: 0.8823, test_loss: 0.8525, test_f1: 0.5411
 epoch: 8, train_loss: 0.8772, test_loss: 0.8369, test_f1: 0.5516
 epoch: 9, train_loss: 0.8583, test_loss: 0.8389, test_f1: 0.5529
 epoch: 10, train_loss: 0.8422, test_loss: 0.8724, test_f1: 0.5589
 epoch: 11, train_loss: 0.8413, test_loss: 0.8669, test_f1: 0.5281
 epoch: 12, train_loss: 0.8186, test_loss: 0.8393, test_f1: 0.5849
 epoch: 13, train_loss: 0.8222, test_loss: 0.8717, test_f1: 0.5361
 epoch: 14, train_loss: 0.8023, test_loss: 0.7935, test_f1: 0.5934
 epoch: 15, train_loss: 0.7975, test_loss: 0.7819, test_f1: 0.5888
 epoch: 16, train_loss: 0.8007, test_loss: 0.8121, test_f1: 0.5752
 epoch: 17, train_loss: 0.7819, test_loss: 0.7557, test_f1: 0.6096
 epoch: 18, train_loss: 0.7718, test_loss: 0.8430, test_f1: 0.5382
 epoch: 19, train_loss: 0.7730, test_loss: 0.7558, test_f1: 0.5887
 epoch: 20, train_loss: 0.7679, test_loss: 0.7432, test_f1: 0.6176
 epoch: 21, train_loss: 0.7630, test_loss: 0.7936, test_f1: 0.5622
 epoch: 22, train_loss: 0.7525, test_loss: 0.7671, test_f1: 0.6105
 epoch: 23, train_loss: 0.7440, test_loss: 0.7225, test_f1: 0.6398
 epoch: 24, train_loss: 0.7449, test_loss: 0.7887, test_f1: 0.5897
 epoch: 25, train_loss: 0.7499, test_loss: 0.7265, test_f1: 0.6045
 epoch: 26, train_loss: 0.7319, test_loss: 0.8099, test_f1: 0.6078
 epoch: 27, train_loss: 0.7142, test_loss: 0.7526, test_f1: 0.6086
 epoch: 28, train_loss: 0.7108, test_loss: 0.7424, test_f1: 0.6371
 epoch: 29, train_loss: 0.7060, test_loss: 0.8090, test_f1: 0.5910
 epoch: 30, train_loss: 0.6952, test_loss: 0.7435, test_f1: 0.6120
 epoch: 31, train_loss: 0.7175, test_loss: 0.8686, test_f1: 0.5897
 epoch: 32, train_loss: 0.6989, test_loss: 0.7678, test_f1: 0.6077
 epoch: 33, train_loss: 0.6751, test_loss: 0.7667, test_f1: 0.6294
 epoch: 34, train_loss: 0.6774, test_loss: 0.7553, test_f1: 0.6332
 epoch: 35, train_loss: 0.6843, test_loss: 0.8071, test_f1: 0.6314
 epoch: 36, train_loss: 0.6785, test_loss: 0.7419, test_f1: 0.6162
 epoch: 37, train_loss: 0.6716, test_loss: 0.7388, test_f1: 0.6432
 epoch: 38, train_loss: 0.6517, test_loss: 0.8482, test_f1: 0.6059
 epoch: 39, train_loss: 0.6703, test_loss: 0.8786, test_f1: 0.6141
 epoch: 40, train_loss: 0.6551, test_loss: 0.7185, test_f1: 0.6352
 epoch: 41, train_loss: 0.6554, test_loss: 0.7553, test_f1: 0.6310
 epoch: 42, train_loss: 0.6437, test_loss: 0.8039, test_f1: 0.6484
 epoch: 43, train_loss: 0.6463, test_loss: 0.7403, test_f1: 0.6476
 epoch: 44, train_loss: 0.6419, test_loss: 0.6992, test_f1: 0.6597
 epoch: 45, train_loss: 0.6321, test_loss: 0.8092, test_f1: 0.6156
 epoch: 46, train_loss: 0.6174, test_loss: 0.8221, test_f1: 0.6385
 epoch: 47, train_loss: 0.6214, test_loss: 0.8602, test_f1: 0.6636
 epoch: 48, train_loss: 0.6264, test_loss: 0.7892, test_f1: 0.6580
 epoch: 49, train_loss: 0.6313, test_loss: 0.8125, test_f1: 0.6362
 epoch: 50, train_loss: 0.6100, test_loss: 0.7838, test_f1: 0.6670
 epoch: 51, train_loss: 0.5962, test_loss: 0.7100, test_f1: 0.6702
 epoch: 52, train_loss: 0.5809, test_loss: 0.8428, test_f1: 0.6488
 epoch: 53, train_loss: 0.5633, test_loss: 0.7209, test_f1: 0.6604
 epoch: 54, train_loss: 0.5573, test_loss: 0.8109, test_f1: 0.6493
 epoch: 55, train_loss: 0.5684, test_loss: 0.7292, test_f1: 0.6373
 epoch: 56, train_loss: 0.5711, test_loss: 0.7745, test_f1: 0.6515
 epoch: 57, train_loss: 0.5633, test_loss: 0.7157, test_f1: 0.6686
 epoch: 58, train_loss: 0.5496, test_loss: 0.7703, test_f1: 0.6482
 epoch: 59, train_loss: 0.5649, test_loss: 0.7618, test_f1: 0.6447
 epoch: 60, train_loss: 0.5531, test_loss: 0.8530, test_f1: 0.6554
 epoch: 61, train_loss: 0.5468, test_loss: 0.8299, test_f1: 0.6419
 epoch: 62, train_loss: 0.5326, test_loss: 0.8747, test_f1: 0.6646
 epoch: 63, train_loss: 0.5496, test_loss: 0.8504, test_f1: 0.6414
 epoch: 64, train_loss: 0.5236, test_loss: 0.8724, test_f1: 0.6533
 epoch: 65, train_loss: 0.5507, test_loss: 0.7808, test_f1: 0.6422
 epoch: 66, train_loss: 0.5238, test_loss: 0.8670, test_f1: 0.6545
 epoch: 67, train_loss: 0.5133, test_loss: 0.9068, test_f1: 0.6367
 epoch: 68, train_loss: 0.5261, test_loss: 0.9884, test_f1: 0.6480
 epoch: 69, train_loss: 0.5210, test_loss: 0.9308, test_f1: 0.6467
 epoch: 70, train_loss: 0.5264, test_loss: 0.9817, test_f1: 0.6604
 epoch: 71, train_loss: 0.5140, test_loss: 0.8507, test_f1: 0.6488
 epoch: 72, train_loss: 0.5057, test_loss: 1.0057, test_f1: 0.6566
 epoch: 73, train_loss: 0.5139, test_loss: 0.8997, test_f1: 0.6474
 epoch: 74, train_loss: 0.5240, test_loss: 0.9366, test_f1: 0.6526
 epoch: 75, train_loss: 0.5185, test_loss: 0.9323, test_f1: 0.6118
 epoch: 76, train_loss: 0.5097, test_loss: 0.9761, test_f1: 0.6361
 epoch: 77, train_loss: 0.5183, test_loss: 1.0232, test_f1: 0.6506
 epoch: 78, train_loss: 0.4939, test_loss: 0.9040, test_f1: 0.6698
 epoch: 79, train_loss: 0.4967, test_loss: 0.9124, test_f1: 0.6482
 epoch: 80, train_loss: 0.4995, test_loss: 0.9510, test_f1: 0.6627
 epoch: 81, train_loss: 0.4989, test_loss: 1.0750, test_f1: 0.6368
 epoch: 82, train_loss: 0.4872, test_loss: 1.1549, test_f1: 0.6298
 epoch: 83, train_loss: 0.4896, test_loss: 0.9434, test_f1: 0.6462
 epoch: 84, train_loss: 0.4920, test_loss: 0.8336, test_f1: 0.6545
 epoch: 85, train_loss: 0.4936, test_loss: 1.0469, test_f1: 0.6558
 epoch: 86, train_loss: 0.4758, test_loss: 0.9104, test_f1: 0.6609
 epoch: 87, train_loss: 0.4898, test_loss: 1.0992, test_f1: 0.6012
 epoch: 88, train_loss: 0.4847, test_loss: 1.0983, test_f1: 0.6510
 epoch: 89, train_loss: 0.4828, test_loss: 1.0605, test_f1: 0.6564
 epoch: 90, train_loss: 0.4829, test_loss: 1.1117, test_f1: 0.6486
 epoch: 91, train_loss: 0.4775, test_loss: 0.9932, test_f1: 0.6504
 epoch: 92, train_loss: 0.4827, test_loss: 0.9206, test_f1: 0.6404
 epoch: 93, train_loss: 0.4815, test_loss: 0.9608, test_f1: 0.6528
 epoch: 94, train_loss: 0.4674, test_loss: 1.1097, test_f1: 0.6446
 epoch: 95, train_loss: 0.4743, test_loss: 1.1452, test_f1: 0.6569
 epoch: 96, train_loss: 0.4679, test_loss: 0.9921, test_f1: 0.6706
 epoch: 97, train_loss: 0.4733, test_loss: 1.0560, test_f1: 0.6525
 epoch: 98, train_loss: 0.4783, test_loss: 0.9513, test_f1: 0.6475
 epoch: 99, train_loss: 0.4761, test_loss: 1.1723, test_f1: 0.6474
##################ITERATION #2 ****************************************
 epoch: 0, train_loss: 1.1204, test_loss: 1.0654, test_f1: 0.3650
 epoch: 1, train_loss: 0.9991, test_loss: 0.9745, test_f1: 0.4808
 epoch: 2, train_loss: 0.9766, test_loss: 0.9505, test_f1: 0.4985
 epoch: 3, train_loss: 0.9455, test_loss: 0.9199, test_f1: 0.5011
 epoch: 4, train_loss: 0.9342, test_loss: 0.9239, test_f1: 0.5147
 epoch: 5, train_loss: 0.9174, test_loss: 0.8853, test_f1: 0.5105
 epoch: 6, train_loss: 0.9136, test_loss: 0.8822, test_f1: 0.5263
 epoch: 7, train_loss: 0.8975, test_loss: 0.8849, test_f1: 0.5029
 epoch: 8, train_loss: 0.8840, test_loss: 0.8846, test_f1: 0.5229
 epoch: 9, train_loss: 0.8787, test_loss: 0.8550, test_f1: 0.5119
 epoch: 10, train_loss: 0.8633, test_loss: 0.8222, test_f1: 0.5530
 epoch: 11, train_loss: 0.8429, test_loss: 0.8469, test_f1: 0.5077
 epoch: 12, train_loss: 0.8577, test_loss: 0.8363, test_f1: 0.5503
 epoch: 13, train_loss: 0.8359, test_loss: 0.8056, test_f1: 0.5554
 epoch: 14, train_loss: 0.8309, test_loss: 0.8988, test_f1: 0.5086
 epoch: 15, train_loss: 0.8197, test_loss: 0.8211, test_f1: 0.5438
 epoch: 16, train_loss: 0.8029, test_loss: 0.8198, test_f1: 0.5746
 epoch: 17, train_loss: 0.8047, test_loss: 0.8997, test_f1: 0.5511
 epoch: 18, train_loss: 0.7809, test_loss: 0.8507, test_f1: 0.5886
 epoch: 19, train_loss: 0.7683, test_loss: 0.8412, test_f1: 0.5813
 epoch: 20, train_loss: 0.7703, test_loss: 0.7964, test_f1: 0.5756
 epoch: 21, train_loss: 0.7604, test_loss: 0.7560, test_f1: 0.6095
 epoch: 22, train_loss: 0.7657, test_loss: 0.8565, test_f1: 0.5911
 epoch: 23, train_loss: 0.7417, test_loss: 0.9334, test_f1: 0.5633
 epoch: 24, train_loss: 0.7370, test_loss: 0.8609, test_f1: 0.6147
 epoch: 25, train_loss: 0.7289, test_loss: 0.7466, test_f1: 0.6358
 epoch: 26, train_loss: 0.7376, test_loss: 0.8984, test_f1: 0.5809
 epoch: 27, train_loss: 0.7333, test_loss: 0.7773, test_f1: 0.6061
 epoch: 28, train_loss: 0.7131, test_loss: 0.8932, test_f1: 0.5621
 epoch: 29, train_loss: 0.7015, test_loss: 0.7934, test_f1: 0.5908
 epoch: 30, train_loss: 0.6930, test_loss: 0.7994, test_f1: 0.6106
 epoch: 31, train_loss: 0.7039, test_loss: 0.7683, test_f1: 0.6280
 epoch: 32, train_loss: 0.7016, test_loss: 0.8273, test_f1: 0.6036
 epoch: 33, train_loss: 0.6968, test_loss: 0.8351, test_f1: 0.6204
 epoch: 34, train_loss: 0.6929, test_loss: 0.8733, test_f1: 0.6282
 epoch: 35, train_loss: 0.6719, test_loss: 0.8242, test_f1: 0.6140
 epoch: 36, train_loss: 0.6672, test_loss: 0.9112, test_f1: 0.5975
 epoch: 37, train_loss: 0.6641, test_loss: 0.7286, test_f1: 0.6260
 epoch: 38, train_loss: 0.6635, test_loss: 0.8584, test_f1: 0.6112
 epoch: 39, train_loss: 0.6545, test_loss: 0.7760, test_f1: 0.6146
 epoch: 40, train_loss: 0.6254, test_loss: 0.8815, test_f1: 0.6320
 epoch: 41, train_loss: 0.6389, test_loss: 0.8732, test_f1: 0.6379
 epoch: 42, train_loss: 0.6356, test_loss: 0.7001, test_f1: 0.6720
 epoch: 43, train_loss: 0.6424, test_loss: 0.7343, test_f1: 0.6596
 epoch: 44, train_loss: 0.6409, test_loss: 0.8992, test_f1: 0.6394
 epoch: 45, train_loss: 0.6209, test_loss: 0.7043, test_f1: 0.6601
 epoch: 46, train_loss: 0.6040, test_loss: 0.7713, test_f1: 0.6663
 epoch: 47, train_loss: 0.6128, test_loss: 0.7478, test_f1: 0.6558
 epoch: 48, train_loss: 0.6077, test_loss: 0.8508, test_f1: 0.6364
 epoch: 49, train_loss: 0.6092, test_loss: 0.9052, test_f1: 0.6158
 epoch: 50, train_loss: 0.5979, test_loss: 0.7638, test_f1: 0.6550
 epoch: 51, train_loss: 0.5600, test_loss: 0.8658, test_f1: 0.6346
 epoch: 52, train_loss: 0.5625, test_loss: 0.7862, test_f1: 0.6438
 epoch: 53, train_loss: 0.5505, test_loss: 0.8361, test_f1: 0.6405
 epoch: 54, train_loss: 0.5555, test_loss: 0.8564, test_f1: 0.6532
 epoch: 55, train_loss: 0.5496, test_loss: 0.8135, test_f1: 0.6659
 epoch: 56, train_loss: 0.5383, test_loss: 0.8282, test_f1: 0.6570
 epoch: 57, train_loss: 0.5346, test_loss: 0.7940, test_f1: 0.6619
 epoch: 58, train_loss: 0.5517, test_loss: 0.8063, test_f1: 0.6395
 epoch: 59, train_loss: 0.5397, test_loss: 0.8148, test_f1: 0.6367
 epoch: 60, train_loss: 0.5330, test_loss: 0.8504, test_f1: 0.6449
 epoch: 61, train_loss: 0.5351, test_loss: 0.8790, test_f1: 0.6374
 epoch: 62, train_loss: 0.5388, test_loss: 0.8402, test_f1: 0.6234
 epoch: 63, train_loss: 0.5231, test_loss: 0.9314, test_f1: 0.6371
 epoch: 64, train_loss: 0.5242, test_loss: 0.8896, test_f1: 0.6391
 epoch: 65, train_loss: 0.5189, test_loss: 0.9230, test_f1: 0.6479
 epoch: 66, train_loss: 0.5265, test_loss: 0.9558, test_f1: 0.6419
 epoch: 67, train_loss: 0.5156, test_loss: 0.8442, test_f1: 0.6499
 epoch: 68, train_loss: 0.5099, test_loss: 0.8780, test_f1: 0.6435
 epoch: 69, train_loss: 0.5276, test_loss: 0.8395, test_f1: 0.6441
 epoch: 70, train_loss: 0.5279, test_loss: 0.7827, test_f1: 0.6652
 epoch: 71, train_loss: 0.5050, test_loss: 0.8580, test_f1: 0.6497
 epoch: 72, train_loss: 0.5018, test_loss: 0.9263, test_f1: 0.6575
 epoch: 73, train_loss: 0.5140, test_loss: 0.9975, test_f1: 0.6496
 epoch: 74, train_loss: 0.4992, test_loss: 0.8035, test_f1: 0.6666
 epoch: 75, train_loss: 0.4939, test_loss: 0.8687, test_f1: 0.6389
 epoch: 76, train_loss: 0.5050, test_loss: 0.9311, test_f1: 0.6485
 epoch: 77, train_loss: 0.4980, test_loss: 0.8644, test_f1: 0.6510
 epoch: 78, train_loss: 0.5024, test_loss: 0.9777, test_f1: 0.6572
 epoch: 79, train_loss: 0.4941, test_loss: 0.9606, test_f1: 0.6440
 epoch: 80, train_loss: 0.4835, test_loss: 0.8981, test_f1: 0.6527
 epoch: 81, train_loss: 0.4831, test_loss: 0.9882, test_f1: 0.6404
 epoch: 82, train_loss: 0.4767, test_loss: 0.9594, test_f1: 0.6436
 epoch: 83, train_loss: 0.4827, test_loss: 0.9591, test_f1: 0.6444
 epoch: 84, train_loss: 0.4756, test_loss: 0.9398, test_f1: 0.6461
 epoch: 85, train_loss: 0.4839, test_loss: 1.0329, test_f1: 0.6374
 epoch: 86, train_loss: 0.4928, test_loss: 1.0089, test_f1: 0.6251
 epoch: 87, train_loss: 0.4694, test_loss: 0.9511, test_f1: 0.6547
 epoch: 88, train_loss: 0.4770, test_loss: 0.9856, test_f1: 0.6480
 epoch: 89, train_loss: 0.4744, test_loss: 1.0038, test_f1: 0.6257
 epoch: 90, train_loss: 0.4795, test_loss: 1.0147, test_f1: 0.6281
 epoch: 91, train_loss: 0.4724, test_loss: 1.0390, test_f1: 0.6465
 epoch: 92, train_loss: 0.4672, test_loss: 0.9147, test_f1: 0.6589
 epoch: 93, train_loss: 0.4805, test_loss: 0.9543, test_f1: 0.6540
 epoch: 94, train_loss: 0.4665, test_loss: 0.9275, test_f1: 0.6626
 epoch: 95, train_loss: 0.4588, test_loss: 0.9477, test_f1: 0.6346
 epoch: 96, train_loss: 0.4673, test_loss: 1.0067, test_f1: 0.6449
 epoch: 97, train_loss: 0.4678, test_loss: 0.9378, test_f1: 0.6401
 epoch: 98, train_loss: 0.4535, test_loss: 0.9657, test_f1: 0.6708
 epoch: 99, train_loss: 0.4454, test_loss: 0.9916, test_f1: 0.6287
##################ITERATION #3 ****************************************
 epoch: 0, train_loss: 1.1624, test_loss: 1.1834, test_f1: 0.2844
 epoch: 1, train_loss: 1.0055, test_loss: 0.9439, test_f1: 0.4734
 epoch: 2, train_loss: 0.9656, test_loss: 0.9026, test_f1: 0.5119
 epoch: 3, train_loss: 0.9503, test_loss: 0.9556, test_f1: 0.5067
 epoch: 4, train_loss: 0.9276, test_loss: 0.9796, test_f1: 0.5190
 epoch: 5, train_loss: 0.9168, test_loss: 0.8684, test_f1: 0.5141
 epoch: 6, train_loss: 0.8963, test_loss: 0.9177, test_f1: 0.4992
 epoch: 7, train_loss: 0.8756, test_loss: 0.8840, test_f1: 0.5242
 epoch: 8, train_loss: 0.8734, test_loss: 0.8394, test_f1: 0.5419
 epoch: 9, train_loss: 0.8565, test_loss: 0.8338, test_f1: 0.5157
 epoch: 10, train_loss: 0.8428, test_loss: 0.8080, test_f1: 0.5812
 epoch: 11, train_loss: 0.8351, test_loss: 0.8771, test_f1: 0.5557
 epoch: 12, train_loss: 0.8195, test_loss: 0.8164, test_f1: 0.5406
 epoch: 13, train_loss: 0.8190, test_loss: 0.8095, test_f1: 0.5631
 epoch: 14, train_loss: 0.8084, test_loss: 0.7979, test_f1: 0.5688
 epoch: 15, train_loss: 0.7887, test_loss: 0.7611, test_f1: 0.5858
 epoch: 16, train_loss: 0.7884, test_loss: 0.8313, test_f1: 0.5737
 epoch: 17, train_loss: 0.7787, test_loss: 0.7942, test_f1: 0.5608
 epoch: 18, train_loss: 0.7622, test_loss: 0.7702, test_f1: 0.6208
 epoch: 19, train_loss: 0.7549, test_loss: 0.7688, test_f1: 0.5869
 epoch: 20, train_loss: 0.7563, test_loss: 0.7807, test_f1: 0.5899
 epoch: 21, train_loss: 0.7579, test_loss: 0.7991, test_f1: 0.5942
 epoch: 22, train_loss: 0.7459, test_loss: 0.7603, test_f1: 0.6214
 epoch: 23, train_loss: 0.7378, test_loss: 0.7702, test_f1: 0.6051
 epoch: 24, train_loss: 0.7175, test_loss: 0.7837, test_f1: 0.6150
 epoch: 25, train_loss: 0.7122, test_loss: 0.7764, test_f1: 0.6045
 epoch: 26, train_loss: 0.7340, test_loss: 0.7445, test_f1: 0.6602
 epoch: 27, train_loss: 0.6947, test_loss: 0.7661, test_f1: 0.5963
 epoch: 28, train_loss: 0.6863, test_loss: 0.7565, test_f1: 0.6095
 epoch: 29, train_loss: 0.6889, test_loss: 0.7261, test_f1: 0.6035
 epoch: 30, train_loss: 0.6827, test_loss: 0.7356, test_f1: 0.6216
 epoch: 31, train_loss: 0.6992, test_loss: 0.7356, test_f1: 0.6189
 epoch: 32, train_loss: 0.6673, test_loss: 0.7653, test_f1: 0.6202
 epoch: 33, train_loss: 0.6568, test_loss: 0.8448, test_f1: 0.6224
 epoch: 34, train_loss: 0.6621, test_loss: 0.8178, test_f1: 0.6185
 epoch: 35, train_loss: 0.6510, test_loss: 0.8401, test_f1: 0.6142
 epoch: 36, train_loss: 0.6564, test_loss: 0.7112, test_f1: 0.6715
 epoch: 37, train_loss: 0.6438, test_loss: 0.7501, test_f1: 0.6123
 epoch: 38, train_loss: 0.6369, test_loss: 0.8628, test_f1: 0.5742
 epoch: 39, train_loss: 0.6313, test_loss: 0.7610, test_f1: 0.6428
 epoch: 40, train_loss: 0.6128, test_loss: 0.7622, test_f1: 0.6490
 epoch: 41, train_loss: 0.6120, test_loss: 0.8551, test_f1: 0.6195
 epoch: 42, train_loss: 0.6099, test_loss: 0.8916, test_f1: 0.6253
 epoch: 43, train_loss: 0.6191, test_loss: 0.8258, test_f1: 0.6272
 epoch: 44, train_loss: 0.6126, test_loss: 0.8352, test_f1: 0.6214
 epoch: 45, train_loss: 0.6058, test_loss: 0.9314, test_f1: 0.6466
 epoch: 46, train_loss: 0.6102, test_loss: 0.8301, test_f1: 0.6463
 epoch: 47, train_loss: 0.5907, test_loss: 0.8106, test_f1: 0.6657
 epoch: 48, train_loss: 0.5950, test_loss: 0.7882, test_f1: 0.6560
 epoch: 49, train_loss: 0.5922, test_loss: 0.8736, test_f1: 0.6214
 epoch: 50, train_loss: 0.5765, test_loss: 0.8669, test_f1: 0.6443
 epoch: 51, train_loss: 0.5609, test_loss: 0.8235, test_f1: 0.6436
 epoch: 52, train_loss: 0.5522, test_loss: 0.8222, test_f1: 0.6463
 epoch: 53, train_loss: 0.5450, test_loss: 0.8562, test_f1: 0.6743
 epoch: 54, train_loss: 0.5397, test_loss: 0.8824, test_f1: 0.6518
 epoch: 55, train_loss: 0.5263, test_loss: 0.8555, test_f1: 0.6576
 epoch: 56, train_loss: 0.5230, test_loss: 0.9203, test_f1: 0.6501
 epoch: 57, train_loss: 0.5369, test_loss: 0.9240, test_f1: 0.6699
 epoch: 58, train_loss: 0.5220, test_loss: 0.9490, test_f1: 0.6619
 epoch: 59, train_loss: 0.5155, test_loss: 0.9284, test_f1: 0.6694
 epoch: 60, train_loss: 0.5191, test_loss: 0.9494, test_f1: 0.6619
 epoch: 61, train_loss: 0.5149, test_loss: 0.9681, test_f1: 0.6777
 epoch: 62, train_loss: 0.5222, test_loss: 0.9529, test_f1: 0.6417
 epoch: 63, train_loss: 0.5077, test_loss: 0.9701, test_f1: 0.6607
 epoch: 64, train_loss: 0.4961, test_loss: 0.8773, test_f1: 0.6618
 epoch: 65, train_loss: 0.5033, test_loss: 0.9485, test_f1: 0.6708
 epoch: 66, train_loss: 0.5023, test_loss: 0.9542, test_f1: 0.6606
 epoch: 67, train_loss: 0.4987, test_loss: 0.9371, test_f1: 0.6481
 epoch: 68, train_loss: 0.4925, test_loss: 0.9857, test_f1: 0.6708
 epoch: 69, train_loss: 0.5004, test_loss: 0.9669, test_f1: 0.6500
 epoch: 70, train_loss: 0.5075, test_loss: 1.0249, test_f1: 0.6461
 epoch: 71, train_loss: 0.4964, test_loss: 1.0028, test_f1: 0.6513
 epoch: 72, train_loss: 0.5033, test_loss: 0.9909, test_f1: 0.6602
 epoch: 73, train_loss: 0.4773, test_loss: 1.0404, test_f1: 0.6556
 epoch: 74, train_loss: 0.4912, test_loss: 0.9453, test_f1: 0.6769
 epoch: 75, train_loss: 0.4789, test_loss: 0.9553, test_f1: 0.6521
 epoch: 76, train_loss: 0.4643, test_loss: 1.0600, test_f1: 0.6583
 epoch: 77, train_loss: 0.4634, test_loss: 1.0132, test_f1: 0.6537
 epoch: 78, train_loss: 0.4715, test_loss: 1.0536, test_f1: 0.6412
 epoch: 79, train_loss: 0.4680, test_loss: 1.0104, test_f1: 0.6568
 epoch: 80, train_loss: 0.4779, test_loss: 1.0117, test_f1: 0.6477
 epoch: 81, train_loss: 0.4719, test_loss: 1.0413, test_f1: 0.6570
 epoch: 82, train_loss: 0.4783, test_loss: 1.0549, test_f1: 0.6655
 epoch: 83, train_loss: 0.4737, test_loss: 1.0310, test_f1: 0.6793
 epoch: 84, train_loss: 0.4570, test_loss: 1.0659, test_f1: 0.6650
 epoch: 85, train_loss: 0.4657, test_loss: 1.0669, test_f1: 0.6650
 epoch: 86, train_loss: 0.4410, test_loss: 1.0689, test_f1: 0.6608
 epoch: 87, train_loss: 0.4496, test_loss: 1.0727, test_f1: 0.6614
 epoch: 88, train_loss: 0.4521, test_loss: 1.1164, test_f1: 0.6582
 epoch: 89, train_loss: 0.4455, test_loss: 1.1290, test_f1: 0.6668
 epoch: 90, train_loss: 0.4307, test_loss: 1.0820, test_f1: 0.6602
 epoch: 91, train_loss: 0.4397, test_loss: 1.1155, test_f1: 0.6877
 epoch: 92, train_loss: 0.4354, test_loss: 1.1192, test_f1: 0.6552
 epoch: 93, train_loss: 0.4511, test_loss: 1.1299, test_f1: 0.6504
 epoch: 94, train_loss: 0.4289, test_loss: 1.0803, test_f1: 0.6536
 epoch: 95, train_loss: 0.4578, test_loss: 1.0951, test_f1: 0.6622
 epoch: 96, train_loss: 0.4331, test_loss: 1.0860, test_f1: 0.6613
 epoch: 97, train_loss: 0.4416, test_loss: 1.1339, test_f1: 0.6771
 epoch: 98, train_loss: 0.4198, test_loss: 1.1226, test_f1: 0.6596
 epoch: 99, train_loss: 0.4426, test_loss: 1.1181, test_f1: 0.6708
##################ITERATION #4 ****************************************
 epoch: 0, train_loss: 1.2052, test_loss: 1.1004, test_f1: 0.4454
 epoch: 1, train_loss: 1.0040, test_loss: 0.9866, test_f1: 0.4597
 epoch: 2, train_loss: 0.9778, test_loss: 0.9450, test_f1: 0.5185
 epoch: 3, train_loss: 0.9447, test_loss: 0.9439, test_f1: 0.5137
 epoch: 4, train_loss: 0.9393, test_loss: 0.9574, test_f1: 0.4810
 epoch: 5, train_loss: 0.9245, test_loss: 0.9067, test_f1: 0.5020
 epoch: 6, train_loss: 0.9058, test_loss: 0.8740, test_f1: 0.5121
 epoch: 7, train_loss: 0.8924, test_loss: 0.8915, test_f1: 0.5244
 epoch: 8, train_loss: 0.8788, test_loss: 0.8768, test_f1: 0.5413
 epoch: 9, train_loss: 0.8707, test_loss: 0.8667, test_f1: 0.5298
 epoch: 10, train_loss: 0.8594, test_loss: 0.8384, test_f1: 0.5577
 epoch: 11, train_loss: 0.8531, test_loss: 0.8473, test_f1: 0.5550
 epoch: 12, train_loss: 0.8411, test_loss: 0.8115, test_f1: 0.5787
 epoch: 13, train_loss: 0.8298, test_loss: 0.7991, test_f1: 0.5931
 epoch: 14, train_loss: 0.8283, test_loss: 0.8233, test_f1: 0.5743
 epoch: 15, train_loss: 0.8111, test_loss: 0.7902, test_f1: 0.5941
 epoch: 16, train_loss: 0.8018, test_loss: 0.8423, test_f1: 0.5708
 epoch: 17, train_loss: 0.7977, test_loss: 0.8651, test_f1: 0.5665
 epoch: 18, train_loss: 0.7831, test_loss: 0.7543, test_f1: 0.5746
 epoch: 19, train_loss: 0.7741, test_loss: 0.7557, test_f1: 0.6280
 epoch: 20, train_loss: 0.7696, test_loss: 0.7928, test_f1: 0.6085
 epoch: 21, train_loss: 0.7628, test_loss: 0.7786, test_f1: 0.6343
 epoch: 22, train_loss: 0.7397, test_loss: 0.7561, test_f1: 0.6158
 epoch: 23, train_loss: 0.7426, test_loss: 0.7663, test_f1: 0.6195
 epoch: 24, train_loss: 0.7346, test_loss: 0.7869, test_f1: 0.6290
 epoch: 25, train_loss: 0.7283, test_loss: 0.7636, test_f1: 0.6112
 epoch: 26, train_loss: 0.7382, test_loss: 0.7073, test_f1: 0.6558
 epoch: 27, train_loss: 0.7118, test_loss: 0.7409, test_f1: 0.6268
 epoch: 28, train_loss: 0.7201, test_loss: 0.8031, test_f1: 0.6141
 epoch: 29, train_loss: 0.6941, test_loss: 0.7543, test_f1: 0.6645
 epoch: 30, train_loss: 0.6866, test_loss: 0.7040, test_f1: 0.6561
 epoch: 31, train_loss: 0.6892, test_loss: 0.7562, test_f1: 0.6359
 epoch: 32, train_loss: 0.6923, test_loss: 0.7418, test_f1: 0.6451
 epoch: 33, train_loss: 0.6786, test_loss: 0.7018, test_f1: 0.6664
 epoch: 34, train_loss: 0.6649, test_loss: 0.7995, test_f1: 0.6243
 epoch: 35, train_loss: 0.6688, test_loss: 0.7446, test_f1: 0.6771
 epoch: 36, train_loss: 0.6915, test_loss: 0.7619, test_f1: 0.6267
 epoch: 37, train_loss: 0.6566, test_loss: 0.7825, test_f1: 0.6626
 epoch: 38, train_loss: 0.6543, test_loss: 0.7017, test_f1: 0.6601
 epoch: 39, train_loss: 0.6460, test_loss: 0.7401, test_f1: 0.6655
 epoch: 40, train_loss: 0.6362, test_loss: 0.7576, test_f1: 0.6433
 epoch: 41, train_loss: 0.6526, test_loss: 0.7532, test_f1: 0.6638
 epoch: 42, train_loss: 0.6232, test_loss: 0.7023, test_f1: 0.6736
 epoch: 43, train_loss: 0.6305, test_loss: 0.7150, test_f1: 0.6523
 epoch: 44, train_loss: 0.6343, test_loss: 0.7621, test_f1: 0.6617
 epoch: 45, train_loss: 0.6376, test_loss: 0.8034, test_f1: 0.6287
 epoch: 46, train_loss: 0.6171, test_loss: 0.7896, test_f1: 0.6444
 epoch: 47, train_loss: 0.6046, test_loss: 0.7360, test_f1: 0.6782
 epoch: 48, train_loss: 0.5991, test_loss: 0.7132, test_f1: 0.6725
 epoch: 49, train_loss: 0.6001, test_loss: 0.7096, test_f1: 0.6677
 epoch: 50, train_loss: 0.6025, test_loss: 0.7417, test_f1: 0.6461
 epoch: 51, train_loss: 0.5615, test_loss: 0.7289, test_f1: 0.6745
 epoch: 52, train_loss: 0.5610, test_loss: 0.7125, test_f1: 0.6548
 epoch: 53, train_loss: 0.5601, test_loss: 0.7293, test_f1: 0.6702
 epoch: 54, train_loss: 0.5409, test_loss: 0.7567, test_f1: 0.6752
 epoch: 55, train_loss: 0.5339, test_loss: 0.8012, test_f1: 0.6549
 epoch: 56, train_loss: 0.5448, test_loss: 0.7403, test_f1: 0.6618
 epoch: 57, train_loss: 0.5299, test_loss: 0.7687, test_f1: 0.6784
 epoch: 58, train_loss: 0.5344, test_loss: 0.7606, test_f1: 0.6610
 epoch: 59, train_loss: 0.5357, test_loss: 0.8099, test_f1: 0.6557
 epoch: 60, train_loss: 0.5246, test_loss: 0.7880, test_f1: 0.6513
 epoch: 61, train_loss: 0.5190, test_loss: 0.7380, test_f1: 0.6826
 epoch: 62, train_loss: 0.5218, test_loss: 0.7569, test_f1: 0.6764
 epoch: 63, train_loss: 0.5164, test_loss: 0.7602, test_f1: 0.6732
 epoch: 64, train_loss: 0.5230, test_loss: 0.7871, test_f1: 0.6692
 epoch: 65, train_loss: 0.5136, test_loss: 0.8139, test_f1: 0.6507
 epoch: 66, train_loss: 0.5113, test_loss: 0.8027, test_f1: 0.6513
 epoch: 67, train_loss: 0.5204, test_loss: 0.8182, test_f1: 0.6636
 epoch: 68, train_loss: 0.4975, test_loss: 0.7715, test_f1: 0.6498
 epoch: 69, train_loss: 0.5005, test_loss: 0.7613, test_f1: 0.6742
 epoch: 70, train_loss: 0.4973, test_loss: 0.8718, test_f1: 0.6374
 epoch: 71, train_loss: 0.5017, test_loss: 0.8619, test_f1: 0.6513
 epoch: 72, train_loss: 0.4917, test_loss: 0.8460, test_f1: 0.6627
 epoch: 73, train_loss: 0.4888, test_loss: 0.8262, test_f1: 0.6758
 epoch: 74, train_loss: 0.4991, test_loss: 0.8750, test_f1: 0.6499
 epoch: 75, train_loss: 0.4883, test_loss: 0.8611, test_f1: 0.6653
 epoch: 76, train_loss: 0.4861, test_loss: 0.8940, test_f1: 0.6544
 epoch: 77, train_loss: 0.4829, test_loss: 0.8292, test_f1: 0.6623
 epoch: 78, train_loss: 0.4755, test_loss: 0.7802, test_f1: 0.6670
 epoch: 79, train_loss: 0.4873, test_loss: 0.8777, test_f1: 0.6668
 epoch: 80, train_loss: 0.4584, test_loss: 0.8233, test_f1: 0.6707
 epoch: 81, train_loss: 0.4783, test_loss: 0.8666, test_f1: 0.6512
 epoch: 82, train_loss: 0.4672, test_loss: 0.8500, test_f1: 0.6575
 epoch: 83, train_loss: 0.4618, test_loss: 0.8986, test_f1: 0.6628
 epoch: 84, train_loss: 0.4641, test_loss: 0.8963, test_f1: 0.6579
 epoch: 85, train_loss: 0.4561, test_loss: 0.8676, test_f1: 0.6778
 epoch: 86, train_loss: 0.4702, test_loss: 0.8697, test_f1: 0.6741
 epoch: 87, train_loss: 0.4616, test_loss: 0.8645, test_f1: 0.6630
 epoch: 88, train_loss: 0.4633, test_loss: 0.8841, test_f1: 0.6745
 epoch: 89, train_loss: 0.4547, test_loss: 0.9157, test_f1: 0.6655
 epoch: 90, train_loss: 0.4476, test_loss: 0.8677, test_f1: 0.6809
 epoch: 91, train_loss: 0.4381, test_loss: 0.9772, test_f1: 0.6564
 epoch: 92, train_loss: 0.4500, test_loss: 0.9276, test_f1: 0.6540
 epoch: 93, train_loss: 0.4541, test_loss: 1.0402, test_f1: 0.6585
 epoch: 94, train_loss: 0.4469, test_loss: 0.9260, test_f1: 0.6682
 epoch: 95, train_loss: 0.4349, test_loss: 0.9198, test_f1: 0.6616
 epoch: 96, train_loss: 0.4279, test_loss: 0.9707, test_f1: 0.6689
 epoch: 97, train_loss: 0.4323, test_loss: 0.8942, test_f1: 0.6668
 epoch: 98, train_loss: 0.4337, test_loss: 0.9745, test_f1: 0.6518
 epoch: 99, train_loss: 0.4295, test_loss: 0.9019, test_f1: 0.6796
##################ITERATION #5 ****************************************
 epoch: 0, train_loss: 1.3233, test_loss: 1.1832, test_f1: 0.4539
 epoch: 1, train_loss: 1.0633, test_loss: 1.0085, test_f1: 0.4636
 epoch: 2, train_loss: 1.0082, test_loss: 0.9210, test_f1: 0.4707
 epoch: 3, train_loss: 0.9749, test_loss: 0.9169, test_f1: 0.4954
 epoch: 4, train_loss: 0.9549, test_loss: 0.8868, test_f1: 0.5336
 epoch: 5, train_loss: 0.9368, test_loss: 0.8800, test_f1: 0.5235
 epoch: 6, train_loss: 0.9207, test_loss: 0.8526, test_f1: 0.5235
 epoch: 7, train_loss: 0.9038, test_loss: 0.8503, test_f1: 0.5436
 epoch: 8, train_loss: 0.8844, test_loss: 0.8592, test_f1: 0.5528
 epoch: 9, train_loss: 0.8741, test_loss: 0.8050, test_f1: 0.5810
 epoch: 10, train_loss: 0.8743, test_loss: 0.8191, test_f1: 0.5363
 epoch: 11, train_loss: 0.8564, test_loss: 0.8075, test_f1: 0.5603
 epoch: 12, train_loss: 0.8265, test_loss: 0.7989, test_f1: 0.5480
 epoch: 13, train_loss: 0.8314, test_loss: 0.7859, test_f1: 0.5892
 epoch: 14, train_loss: 0.8116, test_loss: 0.7825, test_f1: 0.5804
 epoch: 15, train_loss: 0.8099, test_loss: 0.7760, test_f1: 0.5793
 epoch: 16, train_loss: 0.7934, test_loss: 0.7339, test_f1: 0.6581
 epoch: 17, train_loss: 0.7811, test_loss: 0.7598, test_f1: 0.6364
 epoch: 18, train_loss: 0.7695, test_loss: 0.7544, test_f1: 0.6166
 epoch: 19, train_loss: 0.7682, test_loss: 0.7618, test_f1: 0.6345
 epoch: 20, train_loss: 0.7665, test_loss: 0.8052, test_f1: 0.6103
 epoch: 21, train_loss: 0.7591, test_loss: 0.7254, test_f1: 0.6550
 epoch: 22, train_loss: 0.7511, test_loss: 0.7390, test_f1: 0.6179
 epoch: 23, train_loss: 0.7379, test_loss: 0.7255, test_f1: 0.6357
 epoch: 24, train_loss: 0.7330, test_loss: 0.7173, test_f1: 0.6663
 epoch: 25, train_loss: 0.7256, test_loss: 0.7325, test_f1: 0.6173
 epoch: 26, train_loss: 0.7323, test_loss: 0.7512, test_f1: 0.6387
 epoch: 27, train_loss: 0.7148, test_loss: 0.7247, test_f1: 0.6487
 epoch: 28, train_loss: 0.7023, test_loss: 0.7867, test_f1: 0.6281
 epoch: 29, train_loss: 0.7155, test_loss: 0.7248, test_f1: 0.6618
 epoch: 30, train_loss: 0.7148, test_loss: 0.7087, test_f1: 0.6607
 epoch: 31, train_loss: 0.6962, test_loss: 0.7660, test_f1: 0.6267
 epoch: 32, train_loss: 0.6943, test_loss: 0.7400, test_f1: 0.6454
 epoch: 33, train_loss: 0.6750, test_loss: 0.7584, test_f1: 0.6274
 epoch: 34, train_loss: 0.6704, test_loss: 0.7167, test_f1: 0.6615
 epoch: 35, train_loss: 0.6740, test_loss: 0.7523, test_f1: 0.6385
 epoch: 36, train_loss: 0.6581, test_loss: 0.7061, test_f1: 0.6384
 epoch: 37, train_loss: 0.6448, test_loss: 0.7316, test_f1: 0.6584
 epoch: 38, train_loss: 0.6537, test_loss: 0.7205, test_f1: 0.6584
 epoch: 39, train_loss: 0.6435, test_loss: 0.7295, test_f1: 0.6909
 epoch: 40, train_loss: 0.6427, test_loss: 0.7032, test_f1: 0.6588
 epoch: 41, train_loss: 0.6459, test_loss: 0.7298, test_f1: 0.6843
 epoch: 42, train_loss: 0.6217, test_loss: 0.8484, test_f1: 0.6246
 epoch: 43, train_loss: 0.6330, test_loss: 0.7161, test_f1: 0.6816
 epoch: 44, train_loss: 0.6213, test_loss: 0.7408, test_f1: 0.6623
 epoch: 45, train_loss: 0.6139, test_loss: 0.7331, test_f1: 0.6651
 epoch: 46, train_loss: 0.6103, test_loss: 0.7322, test_f1: 0.6724
 epoch: 47, train_loss: 0.6290, test_loss: 0.6843, test_f1: 0.6863
 epoch: 48, train_loss: 0.6189, test_loss: 0.7085, test_f1: 0.6515
 epoch: 49, train_loss: 0.6047, test_loss: 0.7490, test_f1: 0.6732
 epoch: 50, train_loss: 0.5813, test_loss: 0.7136, test_f1: 0.6613
 epoch: 51, train_loss: 0.5778, test_loss: 0.7267, test_f1: 0.6522
 epoch: 52, train_loss: 0.5517, test_loss: 0.6823, test_f1: 0.6822
 epoch: 53, train_loss: 0.5457, test_loss: 0.7400, test_f1: 0.6721
 epoch: 54, train_loss: 0.5609, test_loss: 0.7593, test_f1: 0.6555
 epoch: 55, train_loss: 0.5564, test_loss: 0.7160, test_f1: 0.6695
 epoch: 56, train_loss: 0.5445, test_loss: 0.7127, test_f1: 0.6533
 epoch: 57, train_loss: 0.5521, test_loss: 0.8023, test_f1: 0.6171
 epoch: 58, train_loss: 0.5378, test_loss: 0.7357, test_f1: 0.6543
 epoch: 59, train_loss: 0.5380, test_loss: 0.7461, test_f1: 0.6657
 epoch: 60, train_loss: 0.5315, test_loss: 0.7631, test_f1: 0.6715
 epoch: 61, train_loss: 0.5393, test_loss: 0.7712, test_f1: 0.6490
 epoch: 62, train_loss: 0.5380, test_loss: 0.7584, test_f1: 0.6895
 epoch: 63, train_loss: 0.5329, test_loss: 0.7621, test_f1: 0.6475
 epoch: 64, train_loss: 0.5212, test_loss: 0.7484, test_f1: 0.6796
 epoch: 65, train_loss: 0.5169, test_loss: 0.7621, test_f1: 0.7008
 epoch: 66, train_loss: 0.5123, test_loss: 0.7567, test_f1: 0.6820
 epoch: 67, train_loss: 0.5199, test_loss: 0.7547, test_f1: 0.6566
 epoch: 68, train_loss: 0.5106, test_loss: 0.7382, test_f1: 0.6582
 epoch: 69, train_loss: 0.5194, test_loss: 0.7354, test_f1: 0.6774
 epoch: 70, train_loss: 0.5191, test_loss: 0.7383, test_f1: 0.6651
 epoch: 71, train_loss: 0.5165, test_loss: 0.8007, test_f1: 0.6403
 epoch: 72, train_loss: 0.5069, test_loss: 0.7363, test_f1: 0.6752
 epoch: 73, train_loss: 0.5073, test_loss: 0.7621, test_f1: 0.6740
 epoch: 74, train_loss: 0.5013, test_loss: 0.7662, test_f1: 0.6688
 epoch: 75, train_loss: 0.5039, test_loss: 0.7539, test_f1: 0.6681
 epoch: 76, train_loss: 0.4840, test_loss: 0.7857, test_f1: 0.6825
 epoch: 77, train_loss: 0.4955, test_loss: 0.7651, test_f1: 0.6623
 epoch: 78, train_loss: 0.4776, test_loss: 0.7836, test_f1: 0.6664
 epoch: 79, train_loss: 0.5026, test_loss: 0.7715, test_f1: 0.6911
 epoch: 80, train_loss: 0.4951, test_loss: 0.7623, test_f1: 0.6849
 epoch: 81, train_loss: 0.4820, test_loss: 0.7703, test_f1: 0.6898
 epoch: 82, train_loss: 0.4775, test_loss: 0.8125, test_f1: 0.6668
 epoch: 83, train_loss: 0.4623, test_loss: 0.7951, test_f1: 0.6682
 epoch: 84, train_loss: 0.4904, test_loss: 0.8174, test_f1: 0.6780
 epoch: 85, train_loss: 0.4556, test_loss: 0.7831, test_f1: 0.6707
 epoch: 86, train_loss: 0.4852, test_loss: 0.7982, test_f1: 0.6824
 epoch: 87, train_loss: 0.4752, test_loss: 0.8329, test_f1: 0.6914
 epoch: 88, train_loss: 0.4673, test_loss: 0.8275, test_f1: 0.6588
 epoch: 89, train_loss: 0.4627, test_loss: 0.8464, test_f1: 0.6619
 epoch: 90, train_loss: 0.4736, test_loss: 0.7992, test_f1: 0.6769
 epoch: 91, train_loss: 0.4586, test_loss: 0.8324, test_f1: 0.6773
 epoch: 92, train_loss: 0.4677, test_loss: 0.7755, test_f1: 0.6811
 epoch: 93, train_loss: 0.4625, test_loss: 0.7974, test_f1: 0.6960
 epoch: 94, train_loss: 0.4663, test_loss: 0.8372, test_f1: 0.6548
 epoch: 95, train_loss: 0.4549, test_loss: 0.8340, test_f1: 0.6783
 epoch: 96, train_loss: 0.4572, test_loss: 0.8210, test_f1: 0.6938
 epoch: 97, train_loss: 0.4564, test_loss: 0.8000, test_f1: 0.7023
 epoch: 98, train_loss: 0.4532, test_loss: 0.7954, test_f1: 0.7195
 epoch: 99, train_loss: 0.4390, test_loss: 0.8351, test_f1: 0.7040
##################ITERATION #6 ****************************************
 epoch: 0, train_loss: 1.3492, test_loss: 1.0912, test_f1: 0.4331
 epoch: 1, train_loss: 1.0541, test_loss: 0.9996, test_f1: 0.4967
 epoch: 2, train_loss: 1.0028, test_loss: 0.9791, test_f1: 0.5121
 epoch: 3, train_loss: 0.9735, test_loss: 0.9654, test_f1: 0.4814
 epoch: 4, train_loss: 0.9443, test_loss: 0.9421, test_f1: 0.4828
 epoch: 5, train_loss: 0.9226, test_loss: 0.9356, test_f1: 0.4982
 epoch: 6, train_loss: 0.9144, test_loss: 0.9471, test_f1: 0.5416
 epoch: 7, train_loss: 0.9064, test_loss: 0.9290, test_f1: 0.4959
 epoch: 8, train_loss: 0.8877, test_loss: 0.9412, test_f1: 0.5357
 epoch: 9, train_loss: 0.8783, test_loss: 0.9067, test_f1: 0.5306
 epoch: 10, train_loss: 0.8605, test_loss: 0.8498, test_f1: 0.6027
 epoch: 11, train_loss: 0.8306, test_loss: 0.8020, test_f1: 0.6045
 epoch: 12, train_loss: 0.8296, test_loss: 0.7892, test_f1: 0.6129
 epoch: 13, train_loss: 0.8302, test_loss: 0.8367, test_f1: 0.5944
 epoch: 14, train_loss: 0.8212, test_loss: 0.8453, test_f1: 0.5589
 epoch: 15, train_loss: 0.7922, test_loss: 0.8162, test_f1: 0.5978
 epoch: 16, train_loss: 0.7947, test_loss: 0.8105, test_f1: 0.5846
 epoch: 17, train_loss: 0.7798, test_loss: 0.7665, test_f1: 0.6331
 epoch: 18, train_loss: 0.7777, test_loss: 0.7837, test_f1: 0.6327
 epoch: 19, train_loss: 0.7801, test_loss: 0.8437, test_f1: 0.6233
 epoch: 20, train_loss: 0.7723, test_loss: 0.7705, test_f1: 0.6117
 epoch: 21, train_loss: 0.7585, test_loss: 0.8292, test_f1: 0.5947
 epoch: 22, train_loss: 0.7485, test_loss: 0.8784, test_f1: 0.5891
 epoch: 23, train_loss: 0.7542, test_loss: 0.8042, test_f1: 0.6020
 epoch: 24, train_loss: 0.7304, test_loss: 0.8139, test_f1: 0.6159
 epoch: 25, train_loss: 0.7260, test_loss: 0.8083, test_f1: 0.6281
 epoch: 26, train_loss: 0.7397, test_loss: 0.7145, test_f1: 0.6632
 epoch: 27, train_loss: 0.7165, test_loss: 0.7709, test_f1: 0.6348
 epoch: 28, train_loss: 0.7055, test_loss: 0.7726, test_f1: 0.6549
 epoch: 29, train_loss: 0.7117, test_loss: 0.7706, test_f1: 0.6785
 epoch: 30, train_loss: 0.7028, test_loss: 0.7513, test_f1: 0.6388
 epoch: 31, train_loss: 0.6932, test_loss: 0.8185, test_f1: 0.6404
 epoch: 32, train_loss: 0.6933, test_loss: 0.8502, test_f1: 0.6522
 epoch: 33, train_loss: 0.6905, test_loss: 0.7750, test_f1: 0.6576
 epoch: 34, train_loss: 0.6836, test_loss: 0.8029, test_f1: 0.6235
 epoch: 35, train_loss: 0.6769, test_loss: 0.7584, test_f1: 0.6473
 epoch: 36, train_loss: 0.6894, test_loss: 0.8241, test_f1: 0.6504
 epoch: 37, train_loss: 0.6779, test_loss: 0.7916, test_f1: 0.6284
 epoch: 38, train_loss: 0.6565, test_loss: 0.7797, test_f1: 0.6283
 epoch: 39, train_loss: 0.6520, test_loss: 0.8171, test_f1: 0.6489
 epoch: 40, train_loss: 0.6720, test_loss: 0.7777, test_f1: 0.6324
 epoch: 41, train_loss: 0.6556, test_loss: 0.8316, test_f1: 0.6502
 epoch: 42, train_loss: 0.6394, test_loss: 0.8303, test_f1: 0.6277
 epoch: 43, train_loss: 0.6599, test_loss: 0.8096, test_f1: 0.6395
 epoch: 44, train_loss: 0.6468, test_loss: 0.8109, test_f1: 0.6406
 epoch: 45, train_loss: 0.6474, test_loss: 0.7732, test_f1: 0.6484
 epoch: 46, train_loss: 0.6367, test_loss: 0.8006, test_f1: 0.6366
 epoch: 47, train_loss: 0.6235, test_loss: 0.7974, test_f1: 0.6497
 epoch: 48, train_loss: 0.6388, test_loss: 0.8310, test_f1: 0.6536
 epoch: 49, train_loss: 0.6116, test_loss: 0.7793, test_f1: 0.6381
 epoch: 50, train_loss: 0.6173, test_loss: 0.8112, test_f1: 0.6472
 epoch: 51, train_loss: 0.5943, test_loss: 0.8010, test_f1: 0.6397
 epoch: 52, train_loss: 0.5798, test_loss: 0.7907, test_f1: 0.6448
 epoch: 53, train_loss: 0.5713, test_loss: 0.8020, test_f1: 0.6523
 epoch: 54, train_loss: 0.5632, test_loss: 0.8603, test_f1: 0.6359
 epoch: 55, train_loss: 0.5657, test_loss: 0.8261, test_f1: 0.6379
 epoch: 56, train_loss: 0.5656, test_loss: 0.8224, test_f1: 0.6196
 epoch: 57, train_loss: 0.5745, test_loss: 0.8009, test_f1: 0.6392
 epoch: 58, train_loss: 0.5678, test_loss: 0.7931, test_f1: 0.6349
 epoch: 59, train_loss: 0.5729, test_loss: 0.8239, test_f1: 0.6464
 epoch: 60, train_loss: 0.5672, test_loss: 0.7828, test_f1: 0.6497
 epoch: 61, train_loss: 0.5747, test_loss: 0.8294, test_f1: 0.6365
 epoch: 62, train_loss: 0.5626, test_loss: 0.8228, test_f1: 0.6458
 epoch: 63, train_loss: 0.5504, test_loss: 0.8653, test_f1: 0.6446
 epoch: 64, train_loss: 0.5478, test_loss: 0.8276, test_f1: 0.6375
 epoch: 65, train_loss: 0.5578, test_loss: 0.8367, test_f1: 0.6602
 epoch: 66, train_loss: 0.5345, test_loss: 0.8463, test_f1: 0.6442
 epoch: 67, train_loss: 0.5673, test_loss: 0.9072, test_f1: 0.6367
 epoch: 68, train_loss: 0.5499, test_loss: 0.9136, test_f1: 0.6221
 epoch: 69, train_loss: 0.5401, test_loss: 0.9067, test_f1: 0.6483
 epoch: 70, train_loss: 0.5290, test_loss: 0.8876, test_f1: 0.6469
 epoch: 71, train_loss: 0.5354, test_loss: 0.8699, test_f1: 0.6524
 epoch: 72, train_loss: 0.5222, test_loss: 0.8932, test_f1: 0.6449
 epoch: 73, train_loss: 0.5275, test_loss: 0.9180, test_f1: 0.6301
 epoch: 74, train_loss: 0.5281, test_loss: 0.9264, test_f1: 0.6524
 epoch: 75, train_loss: 0.5156, test_loss: 0.9194, test_f1: 0.6475
 epoch: 76, train_loss: 0.5252, test_loss: 0.9159, test_f1: 0.6519
 epoch: 77, train_loss: 0.5282, test_loss: 0.8825, test_f1: 0.6630
 epoch: 78, train_loss: 0.5173, test_loss: 0.8402, test_f1: 0.6575
 epoch: 79, train_loss: 0.5190, test_loss: 0.9327, test_f1: 0.6620
 epoch: 80, train_loss: 0.5095, test_loss: 0.8860, test_f1: 0.6463
 epoch: 81, train_loss: 0.5169, test_loss: 0.9699, test_f1: 0.6440
 epoch: 82, train_loss: 0.5117, test_loss: 0.9292, test_f1: 0.6553
 epoch: 83, train_loss: 0.5181, test_loss: 0.9290, test_f1: 0.6468
 epoch: 84, train_loss: 0.5003, test_loss: 1.0512, test_f1: 0.6568
 epoch: 85, train_loss: 0.5121, test_loss: 0.9418, test_f1: 0.6677
 epoch: 86, train_loss: 0.5043, test_loss: 0.9779, test_f1: 0.6360
 epoch: 87, train_loss: 0.5153, test_loss: 0.9335, test_f1: 0.6427
 epoch: 88, train_loss: 0.4944, test_loss: 0.9760, test_f1: 0.6582
 epoch: 89, train_loss: 0.4840, test_loss: 0.9358, test_f1: 0.6574
 epoch: 90, train_loss: 0.5035, test_loss: 0.9819, test_f1: 0.6425
 epoch: 91, train_loss: 0.4883, test_loss: 0.9350, test_f1: 0.6614
 epoch: 92, train_loss: 0.4996, test_loss: 0.9534, test_f1: 0.6502
 epoch: 93, train_loss: 0.4950, test_loss: 0.9154, test_f1: 0.6536
 epoch: 94, train_loss: 0.5058, test_loss: 0.9448, test_f1: 0.6620
 epoch: 95, train_loss: 0.4898, test_loss: 0.9939, test_f1: 0.6587
 epoch: 96, train_loss: 0.4870, test_loss: 0.9878, test_f1: 0.6554
 epoch: 97, train_loss: 0.4968, test_loss: 1.0301, test_f1: 0.6437
 epoch: 98, train_loss: 0.4773, test_loss: 0.9641, test_f1: 0.6563
 epoch: 99, train_loss: 0.4850, test_loss: 0.9690, test_f1: 0.6676
##################ITERATION #7 ****************************************
 epoch: 0, train_loss: 1.2215, test_loss: 1.1898, test_f1: 0.3891
 epoch: 1, train_loss: 1.0139, test_loss: 0.9566, test_f1: 0.4947
 epoch: 2, train_loss: 0.9723, test_loss: 0.9697, test_f1: 0.4904
 epoch: 3, train_loss: 0.9524, test_loss: 0.9448, test_f1: 0.5119
 epoch: 4, train_loss: 0.9294, test_loss: 0.9336, test_f1: 0.4961
 epoch: 5, train_loss: 0.9216, test_loss: 0.9173, test_f1: 0.5296
 epoch: 6, train_loss: 0.9054, test_loss: 0.8867, test_f1: 0.5431
 epoch: 7, train_loss: 0.8841, test_loss: 0.9189, test_f1: 0.5451
 epoch: 8, train_loss: 0.8915, test_loss: 0.9004, test_f1: 0.5310
 epoch: 9, train_loss: 0.8652, test_loss: 0.9024, test_f1: 0.5798
 epoch: 10, train_loss: 0.8548, test_loss: 0.8876, test_f1: 0.5541
 epoch: 11, train_loss: 0.8429, test_loss: 0.8729, test_f1: 0.5526
 epoch: 12, train_loss: 0.8351, test_loss: 0.8955, test_f1: 0.5423
 epoch: 13, train_loss: 0.8315, test_loss: 0.8896, test_f1: 0.5171
 epoch: 14, train_loss: 0.8373, test_loss: 0.8800, test_f1: 0.5755
 epoch: 15, train_loss: 0.8131, test_loss: 0.8808, test_f1: 0.5747
 epoch: 16, train_loss: 0.8046, test_loss: 0.8569, test_f1: 0.5727
 epoch: 17, train_loss: 0.7838, test_loss: 0.8394, test_f1: 0.5692
 epoch: 18, train_loss: 0.7900, test_loss: 0.8843, test_f1: 0.5654
 epoch: 19, train_loss: 0.7723, test_loss: 0.8862, test_f1: 0.5581
 epoch: 20, train_loss: 0.7786, test_loss: 0.8555, test_f1: 0.6266
 epoch: 21, train_loss: 0.7561, test_loss: 0.8734, test_f1: 0.5898
 epoch: 22, train_loss: 0.7626, test_loss: 0.8510, test_f1: 0.5863
 epoch: 23, train_loss: 0.7400, test_loss: 0.8979, test_f1: 0.5761
 epoch: 24, train_loss: 0.7602, test_loss: 0.8667, test_f1: 0.5907
 epoch: 25, train_loss: 0.7357, test_loss: 0.8620, test_f1: 0.6113
 epoch: 26, train_loss: 0.7200, test_loss: 0.8313, test_f1: 0.6159
 epoch: 27, train_loss: 0.7180, test_loss: 0.8655, test_f1: 0.6115
 epoch: 28, train_loss: 0.7216, test_loss: 0.7851, test_f1: 0.6084
 epoch: 29, train_loss: 0.7011, test_loss: 0.7677, test_f1: 0.5970
 epoch: 30, train_loss: 0.7066, test_loss: 0.7840, test_f1: 0.6313
 epoch: 31, train_loss: 0.7122, test_loss: 0.8519, test_f1: 0.6074
 epoch: 32, train_loss: 0.6934, test_loss: 0.8123, test_f1: 0.5968
 epoch: 33, train_loss: 0.6841, test_loss: 0.8410, test_f1: 0.6224
 epoch: 34, train_loss: 0.6889, test_loss: 0.8516, test_f1: 0.6018
 epoch: 35, train_loss: 0.6810, test_loss: 0.8608, test_f1: 0.6081
 epoch: 36, train_loss: 0.6814, test_loss: 0.8508, test_f1: 0.6278
 epoch: 37, train_loss: 0.6764, test_loss: 0.8451, test_f1: 0.6148
 epoch: 38, train_loss: 0.6607, test_loss: 0.8370, test_f1: 0.6401
 epoch: 39, train_loss: 0.6555, test_loss: 0.8553, test_f1: 0.6277
 epoch: 40, train_loss: 0.6788, test_loss: 0.8406, test_f1: 0.6298
 epoch: 41, train_loss: 0.6606, test_loss: 0.8010, test_f1: 0.6413
 epoch: 42, train_loss: 0.6536, test_loss: 0.9112, test_f1: 0.6066
 epoch: 43, train_loss: 0.6424, test_loss: 0.8013, test_f1: 0.6435
 epoch: 44, train_loss: 0.6384, test_loss: 0.8269, test_f1: 0.6566
 epoch: 45, train_loss: 0.6434, test_loss: 0.8125, test_f1: 0.6215
 epoch: 46, train_loss: 0.6446, test_loss: 0.8383, test_f1: 0.6573
 epoch: 47, train_loss: 0.6339, test_loss: 0.8455, test_f1: 0.6567
 epoch: 48, train_loss: 0.6129, test_loss: 0.9005, test_f1: 0.6239
 epoch: 49, train_loss: 0.6404, test_loss: 0.9124, test_f1: 0.6312
 epoch: 50, train_loss: 0.6252, test_loss: 0.9363, test_f1: 0.6099
 epoch: 51, train_loss: 0.5877, test_loss: 0.8440, test_f1: 0.6383
 epoch: 52, train_loss: 0.5896, test_loss: 0.8729, test_f1: 0.6355
 epoch: 53, train_loss: 0.5829, test_loss: 0.8467, test_f1: 0.6523
 epoch: 54, train_loss: 0.5815, test_loss: 0.9211, test_f1: 0.6478
 epoch: 55, train_loss: 0.5689, test_loss: 0.8461, test_f1: 0.6490
 epoch: 56, train_loss: 0.5844, test_loss: 0.8644, test_f1: 0.6539
 epoch: 57, train_loss: 0.5667, test_loss: 0.8896, test_f1: 0.6476
 epoch: 58, train_loss: 0.5601, test_loss: 0.9009, test_f1: 0.6661
 epoch: 59, train_loss: 0.5614, test_loss: 0.8984, test_f1: 0.6400
 epoch: 60, train_loss: 0.5606, test_loss: 0.8716, test_f1: 0.6327
 epoch: 61, train_loss: 0.5742, test_loss: 0.9326, test_f1: 0.6514
 epoch: 62, train_loss: 0.5529, test_loss: 0.8306, test_f1: 0.6509
 epoch: 63, train_loss: 0.5535, test_loss: 0.8532, test_f1: 0.6525
 epoch: 64, train_loss: 0.5544, test_loss: 0.8498, test_f1: 0.6575
 epoch: 65, train_loss: 0.5485, test_loss: 0.8453, test_f1: 0.6442
 epoch: 66, train_loss: 0.5414, test_loss: 0.9304, test_f1: 0.6600
 epoch: 67, train_loss: 0.5455, test_loss: 0.8854, test_f1: 0.6464
 epoch: 68, train_loss: 0.5437, test_loss: 0.9260, test_f1: 0.6541
 epoch: 69, train_loss: 0.5355, test_loss: 0.9450, test_f1: 0.6447
 epoch: 70, train_loss: 0.5526, test_loss: 0.9151, test_f1: 0.6489
 epoch: 71, train_loss: 0.5336, test_loss: 0.9612, test_f1: 0.6299
 epoch: 72, train_loss: 0.5423, test_loss: 0.9486, test_f1: 0.6460
 epoch: 73, train_loss: 0.5214, test_loss: 0.9782, test_f1: 0.6453
 epoch: 74, train_loss: 0.5333, test_loss: 0.9480, test_f1: 0.6580
 epoch: 75, train_loss: 0.5263, test_loss: 0.9273, test_f1: 0.6645
 epoch: 76, train_loss: 0.5213, test_loss: 1.0576, test_f1: 0.6305
 epoch: 77, train_loss: 0.5265, test_loss: 0.9597, test_f1: 0.6651
 epoch: 78, train_loss: 0.5101, test_loss: 0.9378, test_f1: 0.6432
 epoch: 79, train_loss: 0.5236, test_loss: 0.9575, test_f1: 0.6644
 epoch: 80, train_loss: 0.5290, test_loss: 0.9410, test_f1: 0.6792
 epoch: 81, train_loss: 0.5201, test_loss: 0.9093, test_f1: 0.6598
 epoch: 82, train_loss: 0.5119, test_loss: 1.0387, test_f1: 0.6617
 epoch: 83, train_loss: 0.5083, test_loss: 0.9684, test_f1: 0.6350
 epoch: 84, train_loss: 0.5089, test_loss: 1.0378, test_f1: 0.6478
 epoch: 85, train_loss: 0.4999, test_loss: 1.0203, test_f1: 0.6473
 epoch: 86, train_loss: 0.5098, test_loss: 0.9944, test_f1: 0.6523
 epoch: 87, train_loss: 0.5006, test_loss: 0.9930, test_f1: 0.6630
 epoch: 88, train_loss: 0.4874, test_loss: 0.9803, test_f1: 0.6491
 epoch: 89, train_loss: 0.4845, test_loss: 1.0552, test_f1: 0.6367
 epoch: 90, train_loss: 0.4926, test_loss: 1.0352, test_f1: 0.6493
 epoch: 91, train_loss: 0.5114, test_loss: 0.9525, test_f1: 0.6474
 epoch: 92, train_loss: 0.4888, test_loss: 1.0079, test_f1: 0.6476
 epoch: 93, train_loss: 0.5022, test_loss: 0.9438, test_f1: 0.6655
 epoch: 94, train_loss: 0.4904, test_loss: 0.9974, test_f1: 0.6628
 epoch: 95, train_loss: 0.4864, test_loss: 0.9411, test_f1: 0.6532
 epoch: 96, train_loss: 0.4945, test_loss: 1.0855, test_f1: 0.6727
 epoch: 97, train_loss: 0.4802, test_loss: 0.9734, test_f1: 0.6355
 epoch: 98, train_loss: 0.4654, test_loss: 1.0801, test_f1: 0.6649
 epoch: 99, train_loss: 0.4866, test_loss: 1.0618, test_f1: 0.6617
##################ITERATION #8 ****************************************
 epoch: 0, train_loss: 1.3645, test_loss: 1.4619, test_f1: 0.3243
 epoch: 1, train_loss: 1.0568, test_loss: 1.0515, test_f1: 0.4739
 epoch: 2, train_loss: 1.0298, test_loss: 1.0349, test_f1: 0.4936
 epoch: 3, train_loss: 0.9847, test_loss: 1.0243, test_f1: 0.5061
 epoch: 4, train_loss: 0.9756, test_loss: 1.0100, test_f1: 0.5319
 epoch: 5, train_loss: 0.9524, test_loss: 1.0180, test_f1: 0.4907
 epoch: 6, train_loss: 0.9392, test_loss: 1.0029, test_f1: 0.5121
 epoch: 7, train_loss: 0.9284, test_loss: 0.9913, test_f1: 0.4871
 epoch: 8, train_loss: 0.9107, test_loss: 0.9779, test_f1: 0.5166
 epoch: 9, train_loss: 0.9038, test_loss: 1.0013, test_f1: 0.5082
 epoch: 10, train_loss: 0.8983, test_loss: 0.9843, test_f1: 0.5268
 epoch: 11, train_loss: 0.8893, test_loss: 0.9399, test_f1: 0.5098
 epoch: 12, train_loss: 0.8756, test_loss: 0.9202, test_f1: 0.5277
 epoch: 13, train_loss: 0.8693, test_loss: 0.9156, test_f1: 0.5541
 epoch: 14, train_loss: 0.8557, test_loss: 0.9098, test_f1: 0.5490
 epoch: 15, train_loss: 0.8582, test_loss: 0.9312, test_f1: 0.5604
 epoch: 16, train_loss: 0.8577, test_loss: 0.9389, test_f1: 0.5447
 epoch: 17, train_loss: 0.8378, test_loss: 0.8919, test_f1: 0.5323
 epoch: 18, train_loss: 0.8316, test_loss: 0.8979, test_f1: 0.5562
 epoch: 19, train_loss: 0.8357, test_loss: 0.9354, test_f1: 0.5401
 epoch: 20, train_loss: 0.8169, test_loss: 0.9076, test_f1: 0.5729
 epoch: 21, train_loss: 0.7979, test_loss: 0.9031, test_f1: 0.5939
 epoch: 22, train_loss: 0.8133, test_loss: 0.9261, test_f1: 0.5552
 epoch: 23, train_loss: 0.8031, test_loss: 0.9274, test_f1: 0.5836
 epoch: 24, train_loss: 0.7856, test_loss: 0.8849, test_f1: 0.6165
 epoch: 25, train_loss: 0.7824, test_loss: 0.8842, test_f1: 0.5995
 epoch: 26, train_loss: 0.7931, test_loss: 0.8639, test_f1: 0.6414
 epoch: 27, train_loss: 0.7750, test_loss: 0.8877, test_f1: 0.5857
 epoch: 28, train_loss: 0.7761, test_loss: 0.9122, test_f1: 0.5883
 epoch: 29, train_loss: 0.7683, test_loss: 0.8919, test_f1: 0.5901
 epoch: 30, train_loss: 0.7491, test_loss: 0.8754, test_f1: 0.6220
 epoch: 31, train_loss: 0.7506, test_loss: 0.9085, test_f1: 0.5807
 epoch: 32, train_loss: 0.7587, test_loss: 0.8402, test_f1: 0.6073
 epoch: 33, train_loss: 0.7458, test_loss: 0.9758, test_f1: 0.5712
 epoch: 34, train_loss: 0.7398, test_loss: 0.9104, test_f1: 0.6082
 epoch: 35, train_loss: 0.7337, test_loss: 0.9038, test_f1: 0.6238
 epoch: 36, train_loss: 0.7356, test_loss: 0.9723, test_f1: 0.5697
 epoch: 37, train_loss: 0.7312, test_loss: 0.9179, test_f1: 0.5854
 epoch: 38, train_loss: 0.7173, test_loss: 0.8811, test_f1: 0.6266
 epoch: 39, train_loss: 0.7248, test_loss: 0.9542, test_f1: 0.5927
 epoch: 40, train_loss: 0.7234, test_loss: 0.8629, test_f1: 0.6098
 epoch: 41, train_loss: 0.7235, test_loss: 0.8562, test_f1: 0.6246
 epoch: 42, train_loss: 0.7050, test_loss: 0.8698, test_f1: 0.6250
 epoch: 43, train_loss: 0.6853, test_loss: 0.8382, test_f1: 0.6017
 epoch: 44, train_loss: 0.7087, test_loss: 0.8766, test_f1: 0.6455
 epoch: 45, train_loss: 0.6991, test_loss: 0.7962, test_f1: 0.6173
 epoch: 46, train_loss: 0.7067, test_loss: 0.8148, test_f1: 0.6385
 epoch: 47, train_loss: 0.6983, test_loss: 0.8390, test_f1: 0.6085
 epoch: 48, train_loss: 0.6785, test_loss: 0.8548, test_f1: 0.6591
 epoch: 49, train_loss: 0.6740, test_loss: 0.9900, test_f1: 0.5908
 epoch: 50, train_loss: 0.6688, test_loss: 0.8975, test_f1: 0.6285
 epoch: 51, train_loss: 0.6458, test_loss: 0.8683, test_f1: 0.6366
 epoch: 52, train_loss: 0.6432, test_loss: 0.8726, test_f1: 0.6516
 epoch: 53, train_loss: 0.6288, test_loss: 0.8417, test_f1: 0.6555
 epoch: 54, train_loss: 0.6345, test_loss: 0.8708, test_f1: 0.6353
 epoch: 55, train_loss: 0.6248, test_loss: 0.8963, test_f1: 0.6471
 epoch: 56, train_loss: 0.6168, test_loss: 0.8574, test_f1: 0.6575
 epoch: 57, train_loss: 0.6182, test_loss: 0.8411, test_f1: 0.6475
 epoch: 58, train_loss: 0.6165, test_loss: 0.8195, test_f1: 0.6397
 epoch: 59, train_loss: 0.6230, test_loss: 0.8631, test_f1: 0.6542
 epoch: 60, train_loss: 0.6124, test_loss: 0.8342, test_f1: 0.6462
 epoch: 61, train_loss: 0.6034, test_loss: 0.8609, test_f1: 0.6574
 epoch: 62, train_loss: 0.6175, test_loss: 0.8302, test_f1: 0.6472
 epoch: 63, train_loss: 0.6140, test_loss: 0.8634, test_f1: 0.6514
 epoch: 64, train_loss: 0.6070, test_loss: 0.9217, test_f1: 0.6432
 epoch: 65, train_loss: 0.6105, test_loss: 0.9062, test_f1: 0.6495
 epoch: 66, train_loss: 0.6088, test_loss: 0.8472, test_f1: 0.6606
 epoch: 67, train_loss: 0.5933, test_loss: 0.9142, test_f1: 0.6496
 epoch: 68, train_loss: 0.5958, test_loss: 0.8819, test_f1: 0.6604
 epoch: 69, train_loss: 0.5879, test_loss: 0.8144, test_f1: 0.6712
 epoch: 70, train_loss: 0.5913, test_loss: 0.8351, test_f1: 0.6779
 epoch: 71, train_loss: 0.5924, test_loss: 0.9080, test_f1: 0.6495
 epoch: 72, train_loss: 0.5880, test_loss: 0.8972, test_f1: 0.6397
 epoch: 73, train_loss: 0.5908, test_loss: 0.9183, test_f1: 0.6296
 epoch: 74, train_loss: 0.5965, test_loss: 0.9008, test_f1: 0.6417
 epoch: 75, train_loss: 0.5796, test_loss: 0.9042, test_f1: 0.6712
 epoch: 76, train_loss: 0.5774, test_loss: 0.9099, test_f1: 0.6445
 epoch: 77, train_loss: 0.5652, test_loss: 0.9323, test_f1: 0.6555
 epoch: 78, train_loss: 0.5786, test_loss: 1.0112, test_f1: 0.6260
 epoch: 79, train_loss: 0.5804, test_loss: 0.8690, test_f1: 0.6686
 epoch: 80, train_loss: 0.5617, test_loss: 0.8711, test_f1: 0.6696
 epoch: 81, train_loss: 0.5804, test_loss: 0.8983, test_f1: 0.6660
 epoch: 82, train_loss: 0.5691, test_loss: 0.8781, test_f1: 0.6691
 epoch: 83, train_loss: 0.5783, test_loss: 0.8460, test_f1: 0.6458
 epoch: 84, train_loss: 0.5674, test_loss: 0.9528, test_f1: 0.6731
 epoch: 85, train_loss: 0.5666, test_loss: 0.8861, test_f1: 0.6586
 epoch: 86, train_loss: 0.5687, test_loss: 0.9301, test_f1: 0.6492
 epoch: 87, train_loss: 0.5582, test_loss: 0.9130, test_f1: 0.6460
 epoch: 88, train_loss: 0.5498, test_loss: 0.8728, test_f1: 0.6538
 epoch: 89, train_loss: 0.5635, test_loss: 0.9313, test_f1: 0.6518
 epoch: 90, train_loss: 0.5639, test_loss: 0.9458, test_f1: 0.6655
 epoch: 91, train_loss: 0.5503, test_loss: 0.8670, test_f1: 0.6708
 epoch: 92, train_loss: 0.5518, test_loss: 0.9544, test_f1: 0.6482
 epoch: 93, train_loss: 0.5350, test_loss: 0.9061, test_f1: 0.6779
 epoch: 94, train_loss: 0.5325, test_loss: 0.9471, test_f1: 0.6501
 epoch: 95, train_loss: 0.5394, test_loss: 0.9267, test_f1: 0.6464
 epoch: 96, train_loss: 0.5428, test_loss: 0.8945, test_f1: 0.6761
 epoch: 97, train_loss: 0.5416, test_loss: 0.9046, test_f1: 0.6637
 epoch: 98, train_loss: 0.5530, test_loss: 0.9812, test_f1: 0.6504
 epoch: 99, train_loss: 0.5378, test_loss: 0.9261, test_f1: 0.6770
##################ITERATION #9 ****************************************
 epoch: 0, train_loss: 1.3587, test_loss: 1.0830, test_f1: 0.3848
 epoch: 1, train_loss: 1.0414, test_loss: 0.9531, test_f1: 0.5074
 epoch: 2, train_loss: 0.9830, test_loss: 0.9261, test_f1: 0.5059
 epoch: 3, train_loss: 0.9560, test_loss: 0.9058, test_f1: 0.4927
 epoch: 4, train_loss: 0.9356, test_loss: 0.8907, test_f1: 0.5306
 epoch: 5, train_loss: 0.9116, test_loss: 0.8750, test_f1: 0.5280
 epoch: 6, train_loss: 0.8911, test_loss: 0.8550, test_f1: 0.5211
 epoch: 7, train_loss: 0.8989, test_loss: 0.8639, test_f1: 0.5265
 epoch: 8, train_loss: 0.8779, test_loss: 0.8293, test_f1: 0.5491
 epoch: 9, train_loss: 0.8642, test_loss: 0.8293, test_f1: 0.5573
 epoch: 10, train_loss: 0.8540, test_loss: 0.8386, test_f1: 0.5447
 epoch: 11, train_loss: 0.8378, test_loss: 0.8176, test_f1: 0.5612
 epoch: 12, train_loss: 0.8376, test_loss: 0.8857, test_f1: 0.5475
 epoch: 13, train_loss: 0.8251, test_loss: 0.8954, test_f1: 0.5325
 epoch: 14, train_loss: 0.8155, test_loss: 0.8158, test_f1: 0.5627
 epoch: 15, train_loss: 0.8025, test_loss: 0.7949, test_f1: 0.6023
 epoch: 16, train_loss: 0.8025, test_loss: 0.8152, test_f1: 0.5935
 epoch: 17, train_loss: 0.7929, test_loss: 0.7910, test_f1: 0.5711
 epoch: 18, train_loss: 0.7780, test_loss: 0.7856, test_f1: 0.5889
 epoch: 19, train_loss: 0.7773, test_loss: 0.7628, test_f1: 0.6178
 epoch: 20, train_loss: 0.7716, test_loss: 0.8017, test_f1: 0.5797
 epoch: 21, train_loss: 0.7690, test_loss: 0.8254, test_f1: 0.6051
 epoch: 22, train_loss: 0.7484, test_loss: 0.8523, test_f1: 0.5914
 epoch: 23, train_loss: 0.7418, test_loss: 0.7693, test_f1: 0.6196
 epoch: 24, train_loss: 0.7451, test_loss: 0.8225, test_f1: 0.6034
 epoch: 25, train_loss: 0.7336, test_loss: 0.7912, test_f1: 0.6230
 epoch: 26, train_loss: 0.7295, test_loss: 0.7898, test_f1: 0.5940
 epoch: 27, train_loss: 0.7282, test_loss: 0.7943, test_f1: 0.6141
 epoch: 28, train_loss: 0.7194, test_loss: 0.7850, test_f1: 0.6289
 epoch: 29, train_loss: 0.7267, test_loss: 0.7898, test_f1: 0.6144
 epoch: 30, train_loss: 0.6847, test_loss: 0.7572, test_f1: 0.6380
 epoch: 31, train_loss: 0.7095, test_loss: 0.7633, test_f1: 0.6391
 epoch: 32, train_loss: 0.7058, test_loss: 0.8122, test_f1: 0.6165
 epoch: 33, train_loss: 0.6852, test_loss: 0.8865, test_f1: 0.5777
 epoch: 34, train_loss: 0.6885, test_loss: 0.7878, test_f1: 0.6034
 epoch: 35, train_loss: 0.6849, test_loss: 0.7741, test_f1: 0.6445
 epoch: 36, train_loss: 0.6806, test_loss: 0.8003, test_f1: 0.6326
 epoch: 37, train_loss: 0.6596, test_loss: 0.7904, test_f1: 0.6290
 epoch: 38, train_loss: 0.6681, test_loss: 0.8069, test_f1: 0.6369
 epoch: 39, train_loss: 0.6654, test_loss: 0.8074, test_f1: 0.6259
 epoch: 40, train_loss: 0.6547, test_loss: 0.7732, test_f1: 0.6263
 epoch: 41, train_loss: 0.6431, test_loss: 0.8579, test_f1: 0.6298
 epoch: 42, train_loss: 0.6530, test_loss: 0.7883, test_f1: 0.6413
 epoch: 43, train_loss: 0.6322, test_loss: 0.7742, test_f1: 0.6439
 epoch: 44, train_loss: 0.6355, test_loss: 0.7633, test_f1: 0.6452
 epoch: 45, train_loss: 0.6262, test_loss: 0.7757, test_f1: 0.6325
 epoch: 46, train_loss: 0.6211, test_loss: 0.8056, test_f1: 0.6128
 epoch: 47, train_loss: 0.6161, test_loss: 0.7506, test_f1: 0.6540
 epoch: 48, train_loss: 0.6178, test_loss: 0.8314, test_f1: 0.6082
 epoch: 49, train_loss: 0.6064, test_loss: 0.7904, test_f1: 0.6417
 epoch: 50, train_loss: 0.6046, test_loss: 0.7639, test_f1: 0.6440
 epoch: 51, train_loss: 0.5920, test_loss: 0.7766, test_f1: 0.6354
 epoch: 52, train_loss: 0.5732, test_loss: 0.7908, test_f1: 0.6469
 epoch: 53, train_loss: 0.5631, test_loss: 0.7899, test_f1: 0.6301
 epoch: 54, train_loss: 0.5673, test_loss: 0.7628, test_f1: 0.6704
 epoch: 55, train_loss: 0.5752, test_loss: 0.7827, test_f1: 0.6724
 epoch: 56, train_loss: 0.5539, test_loss: 0.7806, test_f1: 0.6596
 epoch: 57, train_loss: 0.5612, test_loss: 0.7635, test_f1: 0.6846
 epoch: 58, train_loss: 0.5473, test_loss: 0.7654, test_f1: 0.6539
 epoch: 59, train_loss: 0.5357, test_loss: 0.7829, test_f1: 0.6729
 epoch: 60, train_loss: 0.5451, test_loss: 0.8258, test_f1: 0.6418
 epoch: 61, train_loss: 0.5591, test_loss: 0.8200, test_f1: 0.6316
 epoch: 62, train_loss: 0.5365, test_loss: 0.8115, test_f1: 0.6617
 epoch: 63, train_loss: 0.5295, test_loss: 0.8066, test_f1: 0.6475
 epoch: 64, train_loss: 0.5352, test_loss: 0.7602, test_f1: 0.6799
 epoch: 65, train_loss: 0.5349, test_loss: 0.8039, test_f1: 0.6590
 epoch: 66, train_loss: 0.5295, test_loss: 0.7845, test_f1: 0.6603
 epoch: 67, train_loss: 0.5313, test_loss: 0.8287, test_f1: 0.6364
 epoch: 68, train_loss: 0.5302, test_loss: 0.8560, test_f1: 0.6566
 epoch: 69, train_loss: 0.5239, test_loss: 0.7595, test_f1: 0.6857
 epoch: 70, train_loss: 0.5136, test_loss: 0.8181, test_f1: 0.6652
 epoch: 71, train_loss: 0.5266, test_loss: 0.8532, test_f1: 0.6525
 epoch: 72, train_loss: 0.5187, test_loss: 0.8642, test_f1: 0.6426
 epoch: 73, train_loss: 0.5199, test_loss: 0.8041, test_f1: 0.6672
 epoch: 74, train_loss: 0.5118, test_loss: 0.8451, test_f1: 0.6612
 epoch: 75, train_loss: 0.5097, test_loss: 0.8404, test_f1: 0.6522
 epoch: 76, train_loss: 0.5089, test_loss: 0.9175, test_f1: 0.6484
 epoch: 77, train_loss: 0.5098, test_loss: 0.8033, test_f1: 0.6386
 epoch: 78, train_loss: 0.4902, test_loss: 0.9184, test_f1: 0.6353
 epoch: 79, train_loss: 0.5083, test_loss: 0.8026, test_f1: 0.6903
 epoch: 80, train_loss: 0.4937, test_loss: 0.9549, test_f1: 0.6472
 epoch: 81, train_loss: 0.4960, test_loss: 0.9180, test_f1: 0.6559
 epoch: 82, train_loss: 0.4976, test_loss: 0.8422, test_f1: 0.6507
 epoch: 83, train_loss: 0.4969, test_loss: 0.8549, test_f1: 0.6570
 epoch: 84, train_loss: 0.4904, test_loss: 0.8042, test_f1: 0.6627
 epoch: 85, train_loss: 0.4912, test_loss: 0.8377, test_f1: 0.6601
 epoch: 86, train_loss: 0.4810, test_loss: 0.8268, test_f1: 0.6578
 epoch: 87, train_loss: 0.4652, test_loss: 0.8289, test_f1: 0.6572
 epoch: 88, train_loss: 0.4849, test_loss: 0.8417, test_f1: 0.6731
 epoch: 89, train_loss: 0.4740, test_loss: 0.8557, test_f1: 0.6631
 epoch: 90, train_loss: 0.4853, test_loss: 0.9124, test_f1: 0.6316
 epoch: 91, train_loss: 0.4647, test_loss: 0.8925, test_f1: 0.6762
 epoch: 92, train_loss: 0.4832, test_loss: 0.9002, test_f1: 0.6383
 epoch: 93, train_loss: 0.4759, test_loss: 0.8237, test_f1: 0.6781
 epoch: 94, train_loss: 0.4582, test_loss: 0.8813, test_f1: 0.6493
 epoch: 95, train_loss: 0.4701, test_loss: 0.8342, test_f1: 0.6623
 epoch: 96, train_loss: 0.4613, test_loss: 0.8660, test_f1: 0.6529
 epoch: 97, train_loss: 0.4834, test_loss: 0.8619, test_f1: 0.6644
 epoch: 98, train_loss: 0.4709, test_loss: 0.8776, test_f1: 0.6455
 epoch: 99, train_loss: 0.4610, test_loss: 0.8510, test_f1: 0.6622

Training completed in 693.38 seconds
Best F1: 0.7195 at epoch 98
Mean F1 across iterations: 0.6833  0.0135
========================FINAL RESULTS================================
FEGIN weighted F1: 0.7195  0.0135
python main.py --data ltspice_examples --representation component_pin_net --model FEGIN --layers 4 --hiddens 32 --batch_size 64 --lr 0.001 --emb_size 512 --epochs 100 --save_appendix component_pin_net_L4_H32_BS64_LR0.001_E512 --no_val
-----



STDERR:
  File "main.py", line 370, in <module>
    main()
  File "main.py", line 254, in main
    dataset = dataset_class(
  File "/home/philip/projects/ltspice_examples_code_repo/Circuit-Completion-Using-GNNs/component_classification_with_link_prediction_head/evaluation/FEGIN/kernel/circuit_datasets.py", line 15, in __init__
    self.data, self.slices = torch.load(self.processed_paths[0])
  File "/home/philip/.local/lib/python3.8/site-packages/torch/serialization.py", line 1040, in load
    warnings.warn(
  File "/usr/lib/python3.8/warnings.py", line 109, in _showwarnmsg
    sw(msg.message, msg.category, msg.filename, msg.lineno,
  File "main.py", line 47, in warn_with_traceback
    traceback.print_stack(file=log)
/home/philip/projects/ltspice_examples_code_repo/Circuit-Completion-Using-GNNs/component_classification_with_link_prediction_head/evaluation/FEGIN/kernel/circuit_datasets.py:15: FutureWarning: You are using `torch.load` with `weights_only=False` (the current default value), which uses the default pickle module implicitly. It is possible to construct malicious pickle data which will execute arbitrary code during unpickling (See https://github.com/pytorch/pytorch/blob/main/SECURITY.md#untrusted-models for more details). In a future release, the default value for `weights_only` will be flipped to `True`. This limits the functions that could be executed during unpickling. Arbitrary objects will no longer be allowed to be loaded via this mode unless they are explicitly allowlisted by the user via `torch.serialization.add_safe_globals`. We recommend you start setting `weights_only=True` for any use case where you don't have full control of the loaded file. Please open an issue on GitHub for any issues related to this experimental feature.
  self.data, self.slices = torch.load(self.processed_paths[0])
