STDOUT:
Results will be saved in /home/philip/projects/ltspice_examples_code_repo/Circuit-Completion-Using-GNNs/component_classification_with_link_prediction_head/evaluation/FEGIN/results/model_FEGIN_dataset_ltspice_examples
Command line input: python main.py --data ltspice_examples --representation component_component --model FEGIN --layers 3 --hiddens 128 --batch_size 32 --lr 0.001 --emb_size 512 --epochs 100 --save_appendix component_component_L3_H128_BS32_LR0.001_E512 --no_val
 is saved.
-----
ltspice_examples - FEGIN
Using 3 layers, 128 hidden units, h = 2
Loading component_component representation dataset
ENTERED
Training FEGIN on component_component representation
Train: 3556, Test: 845
##################ITERATION #0 ****************************************
 epoch: 0, train_loss: 1.2328, test_loss: 1.1490, test_f1: 0.4164
 epoch: 1, train_loss: 1.1204, test_loss: 1.0643, test_f1: 0.4566
 epoch: 2, train_loss: 1.0441, test_loss: 0.9779, test_f1: 0.4572
 epoch: 3, train_loss: 1.0064, test_loss: 0.9275, test_f1: 0.4999
 epoch: 4, train_loss: 0.9896, test_loss: 0.9398, test_f1: 0.4835
 epoch: 5, train_loss: 0.9708, test_loss: 0.9404, test_f1: 0.4906
 epoch: 6, train_loss: 0.9404, test_loss: 0.9888, test_f1: 0.5264
 epoch: 7, train_loss: 0.9307, test_loss: 0.9529, test_f1: 0.5238
 epoch: 8, train_loss: 0.9162, test_loss: 0.9301, test_f1: 0.5194
 epoch: 9, train_loss: 0.8884, test_loss: 0.9523, test_f1: 0.5275
 epoch: 10, train_loss: 0.8914, test_loss: 0.9994, test_f1: 0.5267
 epoch: 11, train_loss: 0.8784, test_loss: 1.0527, test_f1: 0.4926
 epoch: 12, train_loss: 0.8771, test_loss: 1.0018, test_f1: 0.5436
 epoch: 13, train_loss: 0.8447, test_loss: 0.9976, test_f1: 0.5529
 epoch: 14, train_loss: 0.8423, test_loss: 0.9935, test_f1: 0.5587
 epoch: 15, train_loss: 0.8396, test_loss: 1.1019, test_f1: 0.5269
 epoch: 16, train_loss: 0.8256, test_loss: 0.9570, test_f1: 0.5191
 epoch: 17, train_loss: 0.8229, test_loss: 1.0481, test_f1: 0.5558
 epoch: 18, train_loss: 0.7896, test_loss: 1.0838, test_f1: 0.5300
 epoch: 19, train_loss: 0.8026, test_loss: 1.1665, test_f1: 0.5315
 epoch: 20, train_loss: 0.7616, test_loss: 1.0949, test_f1: 0.5614
 epoch: 21, train_loss: 0.7820, test_loss: 1.0236, test_f1: 0.5303
 epoch: 22, train_loss: 0.7580, test_loss: 1.0399, test_f1: 0.5541
 epoch: 23, train_loss: 0.7960, test_loss: 1.0626, test_f1: 0.5349
 epoch: 24, train_loss: 0.8153, test_loss: 1.0731, test_f1: 0.5503
 epoch: 25, train_loss: 0.7677, test_loss: 1.0392, test_f1: 0.5700
 epoch: 26, train_loss: 0.7405, test_loss: 1.0270, test_f1: 0.5291
 epoch: 27, train_loss: 0.7368, test_loss: 1.1386, test_f1: 0.5387
 epoch: 28, train_loss: 0.7154, test_loss: 1.1158, test_f1: 0.5609
 epoch: 29, train_loss: 0.7404, test_loss: 0.9813, test_f1: 0.6159
 epoch: 30, train_loss: 0.7081, test_loss: 0.9519, test_f1: 0.5931
 epoch: 31, train_loss: 0.6949, test_loss: 1.1432, test_f1: 0.5713
 epoch: 32, train_loss: 0.6911, test_loss: 1.0754, test_f1: 0.5647
 epoch: 33, train_loss: 0.7029, test_loss: 0.9924, test_f1: 0.5904
 epoch: 34, train_loss: 0.6885, test_loss: 1.1540, test_f1: 0.5353
 epoch: 35, train_loss: 0.7309, test_loss: 1.1066, test_f1: 0.5347
 epoch: 36, train_loss: 0.7067, test_loss: 1.0062, test_f1: 0.5808
 epoch: 37, train_loss: 0.6797, test_loss: 1.0788, test_f1: 0.5307
 epoch: 38, train_loss: 0.6447, test_loss: 1.1209, test_f1: 0.5670
 epoch: 39, train_loss: 0.6595, test_loss: 1.2252, test_f1: 0.5217
 epoch: 40, train_loss: 0.7018, test_loss: 1.1447, test_f1: 0.5585
 epoch: 41, train_loss: 0.6637, test_loss: 1.3036, test_f1: 0.5173
 epoch: 42, train_loss: 0.6961, test_loss: 1.1115, test_f1: 0.5693
 epoch: 43, train_loss: 0.6422, test_loss: 1.2763, test_f1: 0.5481
 epoch: 44, train_loss: 0.6122, test_loss: 1.3458, test_f1: 0.5322
 epoch: 45, train_loss: 0.6771, test_loss: 1.1643, test_f1: 0.5539
 epoch: 46, train_loss: 0.6484, test_loss: 1.1988, test_f1: 0.5558
 epoch: 47, train_loss: 0.6338, test_loss: 1.2799, test_f1: 0.5405
 epoch: 48, train_loss: 0.6025, test_loss: 1.2572, test_f1: 0.5701
 epoch: 49, train_loss: 0.6139, test_loss: 1.0983, test_f1: 0.5730
 epoch: 50, train_loss: 0.7072, test_loss: 1.2339, test_f1: 0.5786
 epoch: 51, train_loss: 0.5878, test_loss: 1.3075, test_f1: 0.5319
 epoch: 52, train_loss: 0.5882, test_loss: 1.2410, test_f1: 0.5805
 epoch: 53, train_loss: 0.5576, test_loss: 1.2866, test_f1: 0.5676
 epoch: 54, train_loss: 0.5658, test_loss: 1.2402, test_f1: 0.5731
 epoch: 55, train_loss: 0.5389, test_loss: 1.2472, test_f1: 0.5368
 epoch: 56, train_loss: 0.5378, test_loss: 1.3332, test_f1: 0.5700
 epoch: 57, train_loss: 0.5276, test_loss: 1.2089, test_f1: 0.5925
 epoch: 58, train_loss: 0.5121, test_loss: 1.3367, test_f1: 0.5627
 epoch: 59, train_loss: 0.5224, test_loss: 1.3435, test_f1: 0.5697
 epoch: 60, train_loss: 0.5231, test_loss: 1.2628, test_f1: 0.5513
 epoch: 61, train_loss: 0.5018, test_loss: 1.3660, test_f1: 0.5558
 epoch: 62, train_loss: 0.4796, test_loss: 1.4533, test_f1: 0.5562
 epoch: 63, train_loss: 0.4893, test_loss: 1.2887, test_f1: 0.5531
 epoch: 64, train_loss: 0.4960, test_loss: 1.4793, test_f1: 0.5597
 epoch: 65, train_loss: 0.5073, test_loss: 1.3623, test_f1: 0.5535
 epoch: 66, train_loss: 0.4849, test_loss: 1.5173, test_f1: 0.5588
 epoch: 67, train_loss: 0.4856, test_loss: 1.5151, test_f1: 0.5399
 epoch: 68, train_loss: 0.4947, test_loss: 1.3813, test_f1: 0.5446
 epoch: 69, train_loss: 0.4761, test_loss: 1.4281, test_f1: 0.5527
 epoch: 70, train_loss: 0.4656, test_loss: 1.4127, test_f1: 0.5552
 epoch: 71, train_loss: 0.4903, test_loss: 1.3823, test_f1: 0.5625
 epoch: 72, train_loss: 0.5085, test_loss: 1.4426, test_f1: 0.5608
 epoch: 73, train_loss: 0.4641, test_loss: 1.4687, test_f1: 0.5357
 epoch: 74, train_loss: 0.4504, test_loss: 1.6913, test_f1: 0.5389
 epoch: 75, train_loss: 0.4327, test_loss: 1.6283, test_f1: 0.5440
 epoch: 76, train_loss: 0.4478, test_loss: 1.5118, test_f1: 0.5356
 epoch: 77, train_loss: 0.4437, test_loss: 1.4564, test_f1: 0.5404
 epoch: 78, train_loss: 0.4461, test_loss: 1.3621, test_f1: 0.5817
 epoch: 79, train_loss: 0.4238, test_loss: 1.4984, test_f1: 0.5371
 epoch: 80, train_loss: 0.4221, test_loss: 1.5231, test_f1: 0.5757
 epoch: 81, train_loss: 0.4458, test_loss: 1.4295, test_f1: 0.5549
 epoch: 82, train_loss: 0.4093, test_loss: 1.5477, test_f1: 0.5400
 epoch: 83, train_loss: 0.4174, test_loss: 1.5011, test_f1: 0.5547
 epoch: 84, train_loss: 0.4086, test_loss: 1.5205, test_f1: 0.5469
 epoch: 85, train_loss: 0.4718, test_loss: 1.4133, test_f1: 0.5886
 epoch: 86, train_loss: 0.4096, test_loss: 1.6970, test_f1: 0.5132
 epoch: 87, train_loss: 0.4121, test_loss: 1.5806, test_f1: 0.5425
 epoch: 88, train_loss: 0.4125, test_loss: 1.4406, test_f1: 0.5687
 epoch: 89, train_loss: 0.3923, test_loss: 1.4610, test_f1: 0.5911
 epoch: 90, train_loss: 0.3676, test_loss: 1.6215, test_f1: 0.5389
 epoch: 91, train_loss: 0.3701, test_loss: 1.5172, test_f1: 0.5896
 epoch: 92, train_loss: 0.3909, test_loss: 1.4745, test_f1: 0.5650
 epoch: 93, train_loss: 0.4025, test_loss: 1.7921, test_f1: 0.5409
 epoch: 94, train_loss: 0.4081, test_loss: 1.5249, test_f1: 0.5770
 epoch: 95, train_loss: 0.3664, test_loss: 1.5378, test_f1: 0.5669
 epoch: 96, train_loss: 0.3689, test_loss: 1.6173, test_f1: 0.5419
 epoch: 97, train_loss: 0.3824, test_loss: 1.6122, test_f1: 0.5618
 epoch: 98, train_loss: 0.3687, test_loss: 1.5557, test_f1: 0.5713
 epoch: 99, train_loss: 0.3839, test_loss: 1.5466, test_f1: 0.5738
##################ITERATION #1 ****************************************
 epoch: 0, train_loss: 1.2008, test_loss: 1.0549, test_f1: 0.5124
 epoch: 1, train_loss: 1.0951, test_loss: 1.0379, test_f1: 0.4848
 epoch: 2, train_loss: 1.0654, test_loss: 0.9783, test_f1: 0.4720
 epoch: 3, train_loss: 1.0354, test_loss: 0.9597, test_f1: 0.4765
 epoch: 4, train_loss: 1.0062, test_loss: 1.0554, test_f1: 0.4226
 epoch: 5, train_loss: 0.9757, test_loss: 1.0348, test_f1: 0.4460
 epoch: 6, train_loss: 0.9620, test_loss: 0.9321, test_f1: 0.5213
 epoch: 7, train_loss: 0.9397, test_loss: 0.9388, test_f1: 0.5237
 epoch: 8, train_loss: 0.9397, test_loss: 0.9021, test_f1: 0.5071
 epoch: 9, train_loss: 0.9318, test_loss: 0.9508, test_f1: 0.5206
 epoch: 10, train_loss: 0.9069, test_loss: 0.9668, test_f1: 0.5236
 epoch: 11, train_loss: 0.8884, test_loss: 0.9559, test_f1: 0.5281
 epoch: 12, train_loss: 0.8859, test_loss: 0.9570, test_f1: 0.5413
 epoch: 13, train_loss: 0.8626, test_loss: 1.1001, test_f1: 0.5317
 epoch: 14, train_loss: 0.8699, test_loss: 0.9947, test_f1: 0.5264
 epoch: 15, train_loss: 0.8421, test_loss: 1.0804, test_f1: 0.4977
 epoch: 16, train_loss: 0.8580, test_loss: 0.9958, test_f1: 0.5429
 epoch: 17, train_loss: 0.8318, test_loss: 1.0027, test_f1: 0.5065
 epoch: 18, train_loss: 0.8193, test_loss: 0.9572, test_f1: 0.5335
 epoch: 19, train_loss: 0.8360, test_loss: 1.0193, test_f1: 0.5483
 epoch: 20, train_loss: 0.8135, test_loss: 0.9894, test_f1: 0.5354
 epoch: 21, train_loss: 0.7793, test_loss: 1.0250, test_f1: 0.5353
 epoch: 22, train_loss: 0.7931, test_loss: 1.0572, test_f1: 0.5647
 epoch: 23, train_loss: 0.7854, test_loss: 0.9793, test_f1: 0.5479
 epoch: 24, train_loss: 0.7585, test_loss: 1.1090, test_f1: 0.5429
 epoch: 25, train_loss: 0.7677, test_loss: 1.0403, test_f1: 0.5479
 epoch: 26, train_loss: 0.7642, test_loss: 1.0469, test_f1: 0.5457
 epoch: 27, train_loss: 0.7464, test_loss: 0.9896, test_f1: 0.5565
 epoch: 28, train_loss: 0.7516, test_loss: 1.0289, test_f1: 0.5759
 epoch: 29, train_loss: 0.7298, test_loss: 1.0137, test_f1: 0.5566
 epoch: 30, train_loss: 0.7307, test_loss: 1.0154, test_f1: 0.5414
 epoch: 31, train_loss: 0.7547, test_loss: 0.9498, test_f1: 0.5565
 epoch: 32, train_loss: 0.7205, test_loss: 1.0485, test_f1: 0.5305
 epoch: 33, train_loss: 0.7147, test_loss: 0.9738, test_f1: 0.5501
 epoch: 34, train_loss: 0.7167, test_loss: 1.1211, test_f1: 0.5513
 epoch: 35, train_loss: 0.6933, test_loss: 1.0482, test_f1: 0.5322
 epoch: 36, train_loss: 0.6913, test_loss: 1.0820, test_f1: 0.5376
 epoch: 37, train_loss: 0.6958, test_loss: 0.9758, test_f1: 0.5462
 epoch: 38, train_loss: 0.6934, test_loss: 1.0590, test_f1: 0.5448
 epoch: 39, train_loss: 0.6828, test_loss: 1.1057, test_f1: 0.5267
 epoch: 40, train_loss: 0.6733, test_loss: 0.9981, test_f1: 0.5544
 epoch: 41, train_loss: 0.6685, test_loss: 1.0362, test_f1: 0.5608
 epoch: 42, train_loss: 0.6715, test_loss: 1.0975, test_f1: 0.5229
 epoch: 43, train_loss: 0.6387, test_loss: 1.1259, test_f1: 0.5413
 epoch: 44, train_loss: 0.6684, test_loss: 1.0179, test_f1: 0.5574
 epoch: 45, train_loss: 0.6662, test_loss: 1.1031, test_f1: 0.5334
 epoch: 46, train_loss: 0.6561, test_loss: 1.1701, test_f1: 0.5196
 epoch: 47, train_loss: 0.6344, test_loss: 1.0390, test_f1: 0.5761
 epoch: 48, train_loss: 0.6355, test_loss: 1.1391, test_f1: 0.5223
 epoch: 49, train_loss: 0.6222, test_loss: 1.2963, test_f1: 0.5200
 epoch: 50, train_loss: 0.6037, test_loss: 1.2232, test_f1: 0.5660
 epoch: 51, train_loss: 0.5739, test_loss: 1.0843, test_f1: 0.5546
 epoch: 52, train_loss: 0.5525, test_loss: 1.2116, test_f1: 0.5600
 epoch: 53, train_loss: 0.5551, test_loss: 1.2043, test_f1: 0.5676
 epoch: 54, train_loss: 0.5470, test_loss: 1.1664, test_f1: 0.5352
 epoch: 55, train_loss: 0.5471, test_loss: 1.1972, test_f1: 0.5610
 epoch: 56, train_loss: 0.5315, test_loss: 1.2134, test_f1: 0.5452
 epoch: 57, train_loss: 0.5298, test_loss: 1.1335, test_f1: 0.5838
 epoch: 58, train_loss: 0.5200, test_loss: 1.1536, test_f1: 0.5568
 epoch: 59, train_loss: 0.5150, test_loss: 1.2275, test_f1: 0.5474
 epoch: 60, train_loss: 0.5338, test_loss: 1.1121, test_f1: 0.5758
 epoch: 61, train_loss: 0.5007, test_loss: 1.2737, test_f1: 0.5503
 epoch: 62, train_loss: 0.5019, test_loss: 1.1370, test_f1: 0.5706
 epoch: 63, train_loss: 0.5011, test_loss: 1.2502, test_f1: 0.5557
 epoch: 64, train_loss: 0.5087, test_loss: 1.0789, test_f1: 0.5887
 epoch: 65, train_loss: 0.4938, test_loss: 1.1796, test_f1: 0.5618
 epoch: 66, train_loss: 0.4943, test_loss: 1.1245, test_f1: 0.5823
 epoch: 67, train_loss: 0.4861, test_loss: 1.1416, test_f1: 0.5879
 epoch: 68, train_loss: 0.4763, test_loss: 1.2243, test_f1: 0.5610
 epoch: 69, train_loss: 0.4930, test_loss: 1.1192, test_f1: 0.5923
 epoch: 70, train_loss: 0.4836, test_loss: 1.1214, test_f1: 0.5987
 epoch: 71, train_loss: 0.4917, test_loss: 1.2161, test_f1: 0.5783
 epoch: 72, train_loss: 0.4510, test_loss: 1.2503, test_f1: 0.5863
 epoch: 73, train_loss: 0.4442, test_loss: 1.1794, test_f1: 0.5906
 epoch: 74, train_loss: 0.4630, test_loss: 1.3129, test_f1: 0.5790
 epoch: 75, train_loss: 0.4641, test_loss: 1.2342, test_f1: 0.5741
 epoch: 76, train_loss: 0.4540, test_loss: 1.2069, test_f1: 0.5704
 epoch: 77, train_loss: 0.4542, test_loss: 1.3979, test_f1: 0.5509
 epoch: 78, train_loss: 0.4390, test_loss: 1.2583, test_f1: 0.5834
 epoch: 79, train_loss: 0.4502, test_loss: 1.3019, test_f1: 0.5975
 epoch: 80, train_loss: 0.4289, test_loss: 1.3488, test_f1: 0.5638
 epoch: 81, train_loss: 0.4525, test_loss: 1.2047, test_f1: 0.5909
 epoch: 82, train_loss: 0.4213, test_loss: 1.2597, test_f1: 0.5797
 epoch: 83, train_loss: 0.4136, test_loss: 1.1944, test_f1: 0.5927
 epoch: 84, train_loss: 0.4336, test_loss: 1.2717, test_f1: 0.5507
 epoch: 85, train_loss: 0.4155, test_loss: 1.3039, test_f1: 0.5749
 epoch: 86, train_loss: 0.4292, test_loss: 1.2440, test_f1: 0.5690
 epoch: 87, train_loss: 0.4668, test_loss: 1.2332, test_f1: 0.5957
 epoch: 88, train_loss: 0.4248, test_loss: 1.2977, test_f1: 0.5738
 epoch: 89, train_loss: 0.4197, test_loss: 1.2809, test_f1: 0.5613
 epoch: 90, train_loss: 0.3948, test_loss: 1.3201, test_f1: 0.5755
 epoch: 91, train_loss: 0.4177, test_loss: 1.2047, test_f1: 0.6036
 epoch: 92, train_loss: 0.4006, test_loss: 1.2339, test_f1: 0.6128
 epoch: 93, train_loss: 0.3887, test_loss: 1.2377, test_f1: 0.5902
 epoch: 94, train_loss: 0.3848, test_loss: 1.2920, test_f1: 0.5751
 epoch: 95, train_loss: 0.3810, test_loss: 1.3892, test_f1: 0.5630
 epoch: 96, train_loss: 0.4049, test_loss: 1.3219, test_f1: 0.5723
 epoch: 97, train_loss: 0.3885, test_loss: 1.3003, test_f1: 0.5975
 epoch: 98, train_loss: 0.3905, test_loss: 1.3822, test_f1: 0.5819
 epoch: 99, train_loss: 0.3826, test_loss: 1.3969, test_f1: 0.5738
##################ITERATION #2 ****************************************
 epoch: 0, train_loss: 1.2575, test_loss: 1.1528, test_f1: 0.4476
 epoch: 1, train_loss: 1.1238, test_loss: 1.0110, test_f1: 0.4685
 epoch: 2, train_loss: 1.0600, test_loss: 1.0227, test_f1: 0.4728
 epoch: 3, train_loss: 1.0325, test_loss: 0.9454, test_f1: 0.5052
 epoch: 4, train_loss: 1.0054, test_loss: 0.9432, test_f1: 0.5041
 epoch: 5, train_loss: 0.9821, test_loss: 1.0946, test_f1: 0.4435
 epoch: 6, train_loss: 0.9718, test_loss: 0.9618, test_f1: 0.4939
 epoch: 7, train_loss: 0.9544, test_loss: 0.9527, test_f1: 0.4879
 epoch: 8, train_loss: 0.9343, test_loss: 0.9603, test_f1: 0.5465
 epoch: 9, train_loss: 0.9169, test_loss: 1.0161, test_f1: 0.4985
 epoch: 10, train_loss: 0.9115, test_loss: 1.0172, test_f1: 0.5290
 epoch: 11, train_loss: 0.9030, test_loss: 1.0064, test_f1: 0.5458
 epoch: 12, train_loss: 0.8910, test_loss: 0.9143, test_f1: 0.5173
 epoch: 13, train_loss: 0.8853, test_loss: 0.9962, test_f1: 0.5158
 epoch: 14, train_loss: 0.8698, test_loss: 0.9615, test_f1: 0.5320
 epoch: 15, train_loss: 0.8464, test_loss: 1.0613, test_f1: 0.5107
 epoch: 16, train_loss: 0.8702, test_loss: 0.9653, test_f1: 0.4957
 epoch: 17, train_loss: 0.8544, test_loss: 0.9657, test_f1: 0.5553
 epoch: 18, train_loss: 0.8251, test_loss: 1.0554, test_f1: 0.5081
 epoch: 19, train_loss: 0.8344, test_loss: 0.9813, test_f1: 0.5179
 epoch: 20, train_loss: 0.8359, test_loss: 0.8570, test_f1: 0.5673
 epoch: 21, train_loss: 0.8133, test_loss: 0.9366, test_f1: 0.5316
 epoch: 22, train_loss: 0.8094, test_loss: 1.0643, test_f1: 0.5350
 epoch: 23, train_loss: 0.8142, test_loss: 1.0746, test_f1: 0.4976
 epoch: 24, train_loss: 0.7796, test_loss: 0.9809, test_f1: 0.5267
 epoch: 25, train_loss: 0.7680, test_loss: 0.9391, test_f1: 0.5501
 epoch: 26, train_loss: 0.7758, test_loss: 0.9667, test_f1: 0.5242
 epoch: 27, train_loss: 0.7655, test_loss: 1.0059, test_f1: 0.5379
 epoch: 28, train_loss: 0.7509, test_loss: 0.9491, test_f1: 0.5392
 epoch: 29, train_loss: 0.7391, test_loss: 1.1399, test_f1: 0.5155
 epoch: 30, train_loss: 0.7383, test_loss: 1.0454, test_f1: 0.5668
 epoch: 31, train_loss: 0.7280, test_loss: 1.0604, test_f1: 0.5383
 epoch: 32, train_loss: 0.7378, test_loss: 1.1198, test_f1: 0.5319
 epoch: 33, train_loss: 0.7557, test_loss: 0.9722, test_f1: 0.5662
 epoch: 34, train_loss: 0.7058, test_loss: 1.1142, test_f1: 0.5225
 epoch: 35, train_loss: 0.7078, test_loss: 1.0032, test_f1: 0.5665
 epoch: 36, train_loss: 0.7038, test_loss: 1.0861, test_f1: 0.5423
 epoch: 37, train_loss: 0.7241, test_loss: 1.0008, test_f1: 0.5923
 epoch: 38, train_loss: 0.6976, test_loss: 1.0996, test_f1: 0.5663
 epoch: 39, train_loss: 0.6713, test_loss: 1.0684, test_f1: 0.5815
 epoch: 40, train_loss: 0.6801, test_loss: 1.1597, test_f1: 0.5451
 epoch: 41, train_loss: 0.6803, test_loss: 1.1809, test_f1: 0.5485
 epoch: 42, train_loss: 0.6534, test_loss: 1.1561, test_f1: 0.5351
 epoch: 43, train_loss: 0.6594, test_loss: 1.1266, test_f1: 0.5558
 epoch: 44, train_loss: 0.6434, test_loss: 1.0578, test_f1: 0.5649
 epoch: 45, train_loss: 0.6767, test_loss: 1.0067, test_f1: 0.5540
 epoch: 46, train_loss: 0.6740, test_loss: 0.9473, test_f1: 0.5585
 epoch: 47, train_loss: 0.6443, test_loss: 1.1879, test_f1: 0.5562
 epoch: 48, train_loss: 0.7362, test_loss: 1.0416, test_f1: 0.5612
 epoch: 49, train_loss: 0.6679, test_loss: 1.0779, test_f1: 0.5695
 epoch: 50, train_loss: 0.6427, test_loss: 1.2773, test_f1: 0.5402
 epoch: 51, train_loss: 0.5971, test_loss: 1.0968, test_f1: 0.5493
 epoch: 52, train_loss: 0.5825, test_loss: 1.1222, test_f1: 0.5472
 epoch: 53, train_loss: 0.5740, test_loss: 1.1389, test_f1: 0.5505
 epoch: 54, train_loss: 0.5765, test_loss: 1.0833, test_f1: 0.5759
 epoch: 55, train_loss: 0.5584, test_loss: 1.1414, test_f1: 0.5483
 epoch: 56, train_loss: 0.5556, test_loss: 1.1736, test_f1: 0.5595
 epoch: 57, train_loss: 0.5582, test_loss: 1.2392, test_f1: 0.5550
 epoch: 58, train_loss: 0.5344, test_loss: 1.1351, test_f1: 0.5786
 epoch: 59, train_loss: 0.5296, test_loss: 1.1666, test_f1: 0.5630
 epoch: 60, train_loss: 0.5316, test_loss: 1.1313, test_f1: 0.5774
 epoch: 61, train_loss: 0.5363, test_loss: 1.1877, test_f1: 0.5813
 epoch: 62, train_loss: 0.5153, test_loss: 1.1611, test_f1: 0.6006
 epoch: 63, train_loss: 0.5184, test_loss: 1.2378, test_f1: 0.5607
 epoch: 64, train_loss: 0.5110, test_loss: 1.2191, test_f1: 0.5666
 epoch: 65, train_loss: 0.4974, test_loss: 1.4681, test_f1: 0.5500
 epoch: 66, train_loss: 0.5099, test_loss: 1.2334, test_f1: 0.5679
 epoch: 67, train_loss: 0.4824, test_loss: 1.3355, test_f1: 0.5719
 epoch: 68, train_loss: 0.5089, test_loss: 1.2872, test_f1: 0.5574
 epoch: 69, train_loss: 0.4755, test_loss: 1.6262, test_f1: 0.5361
 epoch: 70, train_loss: 0.5020, test_loss: 1.2308, test_f1: 0.5885
 epoch: 71, train_loss: 0.4736, test_loss: 1.2366, test_f1: 0.5741
 epoch: 72, train_loss: 0.4987, test_loss: 1.2992, test_f1: 0.5537
 epoch: 73, train_loss: 0.4757, test_loss: 1.2766, test_f1: 0.5773
 epoch: 74, train_loss: 0.4557, test_loss: 1.2585, test_f1: 0.5889
 epoch: 75, train_loss: 0.4614, test_loss: 1.3879, test_f1: 0.5590
 epoch: 76, train_loss: 0.4548, test_loss: 1.2937, test_f1: 0.5496
 epoch: 77, train_loss: 0.4646, test_loss: 1.2053, test_f1: 0.5953
 epoch: 78, train_loss: 0.4578, test_loss: 1.2536, test_f1: 0.5732
 epoch: 79, train_loss: 0.4359, test_loss: 1.2899, test_f1: 0.5713
 epoch: 80, train_loss: 0.4362, test_loss: 1.3744, test_f1: 0.5798
 epoch: 81, train_loss: 0.4287, test_loss: 1.3176, test_f1: 0.5869
 epoch: 82, train_loss: 0.4412, test_loss: 1.4250, test_f1: 0.5746
 epoch: 83, train_loss: 0.5833, test_loss: 1.3263, test_f1: 0.5667
 epoch: 84, train_loss: 0.4959, test_loss: 1.2466, test_f1: 0.5595
 epoch: 85, train_loss: 0.4530, test_loss: 1.4344, test_f1: 0.5295
 epoch: 86, train_loss: 0.4791, test_loss: 1.3506, test_f1: 0.5360
 epoch: 87, train_loss: 0.4251, test_loss: 1.2933, test_f1: 0.5647
 epoch: 88, train_loss: 0.4159, test_loss: 1.3147, test_f1: 0.5727
 epoch: 89, train_loss: 0.4179, test_loss: 1.3468, test_f1: 0.5799
 epoch: 90, train_loss: 0.4155, test_loss: 1.3775, test_f1: 0.5618
 epoch: 91, train_loss: 0.4063, test_loss: 1.3928, test_f1: 0.5739
 epoch: 92, train_loss: 0.4213, test_loss: 1.3255, test_f1: 0.5918
 epoch: 93, train_loss: 0.3984, test_loss: 1.3278, test_f1: 0.5717
 epoch: 94, train_loss: 0.3985, test_loss: 1.2458, test_f1: 0.5980
 epoch: 95, train_loss: 0.4037, test_loss: 1.4092, test_f1: 0.5739
 epoch: 96, train_loss: 0.3899, test_loss: 1.4353, test_f1: 0.5642
 epoch: 97, train_loss: 0.4122, test_loss: 1.3149, test_f1: 0.5523
 epoch: 98, train_loss: 0.3892, test_loss: 1.2988, test_f1: 0.5594
 epoch: 99, train_loss: 0.3731, test_loss: 1.3887, test_f1: 0.5707
##################ITERATION #3 ****************************************
 epoch: 0, train_loss: 1.2529, test_loss: 1.0988, test_f1: 0.4242
 epoch: 1, train_loss: 1.1139, test_loss: 1.0713, test_f1: 0.4132
 epoch: 2, train_loss: 1.0671, test_loss: 1.0165, test_f1: 0.4610
 epoch: 3, train_loss: 1.0491, test_loss: 1.0027, test_f1: 0.4990
 epoch: 4, train_loss: 1.0243, test_loss: 0.9388, test_f1: 0.5521
 epoch: 5, train_loss: 1.0099, test_loss: 0.9944, test_f1: 0.5080
 epoch: 6, train_loss: 0.9822, test_loss: 1.0024, test_f1: 0.5309
 epoch: 7, train_loss: 0.9537, test_loss: 0.9833, test_f1: 0.5097
 epoch: 8, train_loss: 0.9385, test_loss: 1.0578, test_f1: 0.5017
 epoch: 9, train_loss: 0.9099, test_loss: 0.9976, test_f1: 0.5205
 epoch: 10, train_loss: 0.9370, test_loss: 0.9580, test_f1: 0.5322
 epoch: 11, train_loss: 0.9083, test_loss: 0.9812, test_f1: 0.4970
 epoch: 12, train_loss: 0.8822, test_loss: 0.9901, test_f1: 0.5332
 epoch: 13, train_loss: 0.8721, test_loss: 0.9953, test_f1: 0.5182
 epoch: 14, train_loss: 0.8686, test_loss: 1.0140, test_f1: 0.5445
 epoch: 15, train_loss: 0.8526, test_loss: 1.0434, test_f1: 0.5422
 epoch: 16, train_loss: 0.8628, test_loss: 1.0286, test_f1: 0.5400
 epoch: 17, train_loss: 0.8322, test_loss: 1.0339, test_f1: 0.5571
 epoch: 18, train_loss: 0.8377, test_loss: 0.9929, test_f1: 0.5657
 epoch: 19, train_loss: 0.8177, test_loss: 1.0478, test_f1: 0.5363
 epoch: 20, train_loss: 0.8065, test_loss: 1.0088, test_f1: 0.5437
 epoch: 21, train_loss: 0.8200, test_loss: 1.0516, test_f1: 0.5354
 epoch: 22, train_loss: 0.7796, test_loss: 1.0615, test_f1: 0.5640
 epoch: 23, train_loss: 0.7949, test_loss: 1.0973, test_f1: 0.5146
 epoch: 24, train_loss: 0.7865, test_loss: 1.0660, test_f1: 0.5531
 epoch: 25, train_loss: 0.8035, test_loss: 1.0254, test_f1: 0.5452
 epoch: 26, train_loss: 0.7587, test_loss: 1.0663, test_f1: 0.5424
 epoch: 27, train_loss: 0.7562, test_loss: 1.1052, test_f1: 0.5689
 epoch: 28, train_loss: 0.7526, test_loss: 1.2708, test_f1: 0.5241
 epoch: 29, train_loss: 0.7802, test_loss: 1.0642, test_f1: 0.5498
 epoch: 30, train_loss: 0.7331, test_loss: 1.0827, test_f1: 0.5581
 epoch: 31, train_loss: 0.7378, test_loss: 1.1002, test_f1: 0.5361
 epoch: 32, train_loss: 0.7304, test_loss: 1.1343, test_f1: 0.5432
 epoch: 33, train_loss: 0.7205, test_loss: 1.0492, test_f1: 0.5273
 epoch: 34, train_loss: 0.7338, test_loss: 1.0563, test_f1: 0.5325
 epoch: 35, train_loss: 0.7187, test_loss: 1.0421, test_f1: 0.5814
 epoch: 36, train_loss: 0.7098, test_loss: 1.0164, test_f1: 0.5462
 epoch: 37, train_loss: 0.6878, test_loss: 1.1932, test_f1: 0.5363
 epoch: 38, train_loss: 0.6770, test_loss: 1.2629, test_f1: 0.5231
 epoch: 39, train_loss: 0.7069, test_loss: 1.0321, test_f1: 0.5400
 epoch: 40, train_loss: 0.6939, test_loss: 1.1179, test_f1: 0.5709
 epoch: 41, train_loss: 0.6796, test_loss: 1.0379, test_f1: 0.5704
 epoch: 42, train_loss: 0.6748, test_loss: 1.0428, test_f1: 0.5551
 epoch: 43, train_loss: 0.6528, test_loss: 1.0472, test_f1: 0.5551
 epoch: 44, train_loss: 0.6619, test_loss: 1.0885, test_f1: 0.5420
 epoch: 45, train_loss: 0.6363, test_loss: 1.1615, test_f1: 0.5320
 epoch: 46, train_loss: 0.6350, test_loss: 1.1677, test_f1: 0.5537
 epoch: 47, train_loss: 0.6422, test_loss: 1.0308, test_f1: 0.5630
 epoch: 48, train_loss: 0.6304, test_loss: 1.1295, test_f1: 0.5500
 epoch: 49, train_loss: 0.6084, test_loss: 1.0171, test_f1: 0.5716
 epoch: 50, train_loss: 0.6150, test_loss: 1.1598, test_f1: 0.5393
 epoch: 51, train_loss: 0.5680, test_loss: 1.1752, test_f1: 0.5462
 epoch: 52, train_loss: 0.5518, test_loss: 1.2639, test_f1: 0.5323
 epoch: 53, train_loss: 0.5611, test_loss: 1.1211, test_f1: 0.5799
 epoch: 54, train_loss: 0.5278, test_loss: 1.1182, test_f1: 0.5843
 epoch: 55, train_loss: 0.5349, test_loss: 1.2599, test_f1: 0.5402
 epoch: 56, train_loss: 0.5471, test_loss: 1.0857, test_f1: 0.5840
 epoch: 57, train_loss: 0.5292, test_loss: 1.1922, test_f1: 0.5667
 epoch: 58, train_loss: 0.5248, test_loss: 1.3637, test_f1: 0.5274
 epoch: 59, train_loss: 0.5366, test_loss: 1.2035, test_f1: 0.5528
 epoch: 60, train_loss: 0.5231, test_loss: 1.2070, test_f1: 0.5622
 epoch: 61, train_loss: 0.5191, test_loss: 1.1499, test_f1: 0.5697
 epoch: 62, train_loss: 0.5010, test_loss: 1.1515, test_f1: 0.5717
 epoch: 63, train_loss: 0.4962, test_loss: 1.2250, test_f1: 0.5718
 epoch: 64, train_loss: 0.5105, test_loss: 1.1803, test_f1: 0.5466
 epoch: 65, train_loss: 0.5030, test_loss: 1.2178, test_f1: 0.5871
 epoch: 66, train_loss: 0.4776, test_loss: 1.2836, test_f1: 0.5677
 epoch: 67, train_loss: 0.4620, test_loss: 1.2478, test_f1: 0.5613
 epoch: 68, train_loss: 0.4658, test_loss: 1.2880, test_f1: 0.5647
 epoch: 69, train_loss: 0.4732, test_loss: 1.2405, test_f1: 0.5816
 epoch: 70, train_loss: 0.4593, test_loss: 1.2696, test_f1: 0.5749
 epoch: 71, train_loss: 0.4727, test_loss: 1.2669, test_f1: 0.6026
 epoch: 72, train_loss: 0.4865, test_loss: 1.3459, test_f1: 0.5624
 epoch: 73, train_loss: 0.4723, test_loss: 1.2271, test_f1: 0.5669
 epoch: 74, train_loss: 0.4640, test_loss: 1.2539, test_f1: 0.5938
 epoch: 75, train_loss: 0.4559, test_loss: 1.2746, test_f1: 0.5759
 epoch: 76, train_loss: 0.4683, test_loss: 1.4266, test_f1: 0.5526
 epoch: 77, train_loss: 0.4778, test_loss: 1.2990, test_f1: 0.5728
 epoch: 78, train_loss: 0.4462, test_loss: 1.2854, test_f1: 0.5513
 epoch: 79, train_loss: 0.4414, test_loss: 1.2543, test_f1: 0.5846
 epoch: 80, train_loss: 0.4220, test_loss: 1.2582, test_f1: 0.6120
 epoch: 81, train_loss: 0.4113, test_loss: 1.3343, test_f1: 0.5837
 epoch: 82, train_loss: 0.4252, test_loss: 1.3879, test_f1: 0.5678
 epoch: 83, train_loss: 0.4115, test_loss: 1.4092, test_f1: 0.5910
 epoch: 84, train_loss: 0.4887, test_loss: 1.2937, test_f1: 0.5862
 epoch: 85, train_loss: 0.4479, test_loss: 1.3040, test_f1: 0.5973
 epoch: 86, train_loss: 0.4162, test_loss: 1.2889, test_f1: 0.6084
 epoch: 87, train_loss: 0.4094, test_loss: 1.3454, test_f1: 0.5869
 epoch: 88, train_loss: 0.4448, test_loss: 1.3194, test_f1: 0.5827
 epoch: 89, train_loss: 0.4106, test_loss: 1.2750, test_f1: 0.6037
 epoch: 90, train_loss: 0.4158, test_loss: 1.3623, test_f1: 0.5759
 epoch: 91, train_loss: 0.4091, test_loss: 1.3581, test_f1: 0.5602
 epoch: 92, train_loss: 0.4190, test_loss: 1.4596, test_f1: 0.5544
 epoch: 93, train_loss: 0.4101, test_loss: 1.4134, test_f1: 0.5482
 epoch: 94, train_loss: 0.4037, test_loss: 1.5151, test_f1: 0.5584
 epoch: 95, train_loss: 0.4028, test_loss: 1.5075, test_f1: 0.5593
 epoch: 96, train_loss: 0.4109, test_loss: 1.3682, test_f1: 0.5757
 epoch: 97, train_loss: 0.3986, test_loss: 1.3961, test_f1: 0.5689
 epoch: 98, train_loss: 0.4027, test_loss: 1.4242, test_f1: 0.5609
 epoch: 99, train_loss: 0.3830, test_loss: 1.4376, test_f1: 0.5795
##################ITERATION #4 ****************************************
 epoch: 0, train_loss: 1.2923, test_loss: 1.1270, test_f1: 0.4071
 epoch: 1, train_loss: 1.1151, test_loss: 1.0428, test_f1: 0.4518
 epoch: 2, train_loss: 1.0693, test_loss: 0.9687, test_f1: 0.4801
 epoch: 3, train_loss: 1.0473, test_loss: 0.9962, test_f1: 0.4640
 epoch: 4, train_loss: 1.0245, test_loss: 1.0426, test_f1: 0.4871
 epoch: 5, train_loss: 1.0021, test_loss: 1.0492, test_f1: 0.4542
 epoch: 6, train_loss: 0.9631, test_loss: 0.9651, test_f1: 0.4495
 epoch: 7, train_loss: 0.9591, test_loss: 1.0476, test_f1: 0.4629
 epoch: 8, train_loss: 0.9597, test_loss: 0.9758, test_f1: 0.4832
 epoch: 9, train_loss: 0.9432, test_loss: 1.0465, test_f1: 0.4862
 epoch: 10, train_loss: 0.9283, test_loss: 1.0140, test_f1: 0.4745
 epoch: 11, train_loss: 0.9122, test_loss: 0.9656, test_f1: 0.4600
 epoch: 12, train_loss: 0.9069, test_loss: 0.9415, test_f1: 0.4969
 epoch: 13, train_loss: 0.8915, test_loss: 0.9745, test_f1: 0.4715
 epoch: 14, train_loss: 0.8860, test_loss: 1.0928, test_f1: 0.4988
 epoch: 15, train_loss: 0.8613, test_loss: 1.0537, test_f1: 0.5116
 epoch: 16, train_loss: 0.8674, test_loss: 1.1211, test_f1: 0.5048
 epoch: 17, train_loss: 0.8365, test_loss: 1.0937, test_f1: 0.4910
 epoch: 18, train_loss: 0.8177, test_loss: 1.0206, test_f1: 0.4921
 epoch: 19, train_loss: 0.8404, test_loss: 1.0115, test_f1: 0.5299
 epoch: 20, train_loss: 0.8001, test_loss: 1.0543, test_f1: 0.5077
 epoch: 21, train_loss: 0.8110, test_loss: 1.0380, test_f1: 0.5411
 epoch: 22, train_loss: 0.7857, test_loss: 1.0237, test_f1: 0.5476
 epoch: 23, train_loss: 0.7807, test_loss: 0.9949, test_f1: 0.5531
 epoch: 24, train_loss: 0.8078, test_loss: 1.1156, test_f1: 0.5309
 epoch: 25, train_loss: 0.7804, test_loss: 0.9942, test_f1: 0.5311
 epoch: 26, train_loss: 0.7941, test_loss: 1.0696, test_f1: 0.5658
 epoch: 27, train_loss: 0.7734, test_loss: 1.0350, test_f1: 0.5450
 epoch: 28, train_loss: 0.7705, test_loss: 1.0335, test_f1: 0.5410
 epoch: 29, train_loss: 0.7561, test_loss: 1.0698, test_f1: 0.5546
 epoch: 30, train_loss: 0.7444, test_loss: 1.1177, test_f1: 0.5310
 epoch: 31, train_loss: 0.7262, test_loss: 1.0620, test_f1: 0.5601
 epoch: 32, train_loss: 0.7360, test_loss: 1.0809, test_f1: 0.5581
 epoch: 33, train_loss: 0.7116, test_loss: 1.1084, test_f1: 0.5338
 epoch: 34, train_loss: 0.7324, test_loss: 1.0392, test_f1: 0.5258
 epoch: 35, train_loss: 0.7352, test_loss: 1.0133, test_f1: 0.5405
 epoch: 36, train_loss: 0.7106, test_loss: 1.1168, test_f1: 0.5426
 epoch: 37, train_loss: 0.7044, test_loss: 1.0360, test_f1: 0.5646
 epoch: 38, train_loss: 0.7249, test_loss: 1.1467, test_f1: 0.5435
 epoch: 39, train_loss: 0.7047, test_loss: 1.0934, test_f1: 0.5368
 epoch: 40, train_loss: 0.6945, test_loss: 1.1101, test_f1: 0.5400
 epoch: 41, train_loss: 0.6815, test_loss: 1.3965, test_f1: 0.5340
 epoch: 42, train_loss: 0.6671, test_loss: 1.2107, test_f1: 0.5501
 epoch: 43, train_loss: 0.6825, test_loss: 1.1404, test_f1: 0.5273
 epoch: 44, train_loss: 0.6458, test_loss: 1.2059, test_f1: 0.5275
 epoch: 45, train_loss: 0.6526, test_loss: 1.2144, test_f1: 0.5343
 epoch: 46, train_loss: 0.6368, test_loss: 1.2210, test_f1: 0.5509
 epoch: 47, train_loss: 0.6235, test_loss: 1.2516, test_f1: 0.5463
 epoch: 48, train_loss: 0.6419, test_loss: 1.1635, test_f1: 0.5459
 epoch: 49, train_loss: 0.6106, test_loss: 1.0635, test_f1: 0.5366
 epoch: 50, train_loss: 0.6162, test_loss: 1.1383, test_f1: 0.5336
 epoch: 51, train_loss: 0.5862, test_loss: 1.2223, test_f1: 0.5349
 epoch: 52, train_loss: 0.5520, test_loss: 1.1829, test_f1: 0.5755
 epoch: 53, train_loss: 0.5454, test_loss: 1.1560, test_f1: 0.5871
 epoch: 54, train_loss: 0.5430, test_loss: 1.1408, test_f1: 0.5801
 epoch: 55, train_loss: 0.5279, test_loss: 1.2551, test_f1: 0.5596
 epoch: 56, train_loss: 0.5294, test_loss: 1.2766, test_f1: 0.5732
 epoch: 57, train_loss: 0.5160, test_loss: 1.3416, test_f1: 0.5677
 epoch: 58, train_loss: 0.5122, test_loss: 1.3579, test_f1: 0.5779
 epoch: 59, train_loss: 0.5142, test_loss: 1.3632, test_f1: 0.5691
 epoch: 60, train_loss: 0.5168, test_loss: 1.2957, test_f1: 0.5768
 epoch: 61, train_loss: 0.5288, test_loss: 1.2648, test_f1: 0.5892
 epoch: 62, train_loss: 0.4948, test_loss: 1.3528, test_f1: 0.5515
 epoch: 63, train_loss: 0.4800, test_loss: 1.3623, test_f1: 0.5901
 epoch: 64, train_loss: 0.5539, test_loss: 1.2204, test_f1: 0.5586
 epoch: 65, train_loss: 0.4904, test_loss: 1.2866, test_f1: 0.5518
 epoch: 66, train_loss: 0.4882, test_loss: 1.3129, test_f1: 0.5490
 epoch: 67, train_loss: 0.4880, test_loss: 1.3260, test_f1: 0.5683
 epoch: 68, train_loss: 0.4724, test_loss: 1.3282, test_f1: 0.5655
 epoch: 69, train_loss: 0.4731, test_loss: 1.3301, test_f1: 0.5825
 epoch: 70, train_loss: 0.4600, test_loss: 1.3450, test_f1: 0.5928
 epoch: 71, train_loss: 0.4641, test_loss: 1.4024, test_f1: 0.5789
 epoch: 72, train_loss: 0.4606, test_loss: 1.4123, test_f1: 0.5664
 epoch: 73, train_loss: 0.4551, test_loss: 1.2200, test_f1: 0.5808
 epoch: 74, train_loss: 0.4451, test_loss: 1.2757, test_f1: 0.5568
 epoch: 75, train_loss: 0.4735, test_loss: 1.2295, test_f1: 0.5746
 epoch: 76, train_loss: 0.4592, test_loss: 1.2974, test_f1: 0.5672
 epoch: 77, train_loss: 0.4354, test_loss: 1.2817, test_f1: 0.5814
 epoch: 78, train_loss: 0.4269, test_loss: 1.2410, test_f1: 0.5733
 epoch: 79, train_loss: 0.4287, test_loss: 1.4206, test_f1: 0.5816
 epoch: 80, train_loss: 0.4227, test_loss: 1.3538, test_f1: 0.5801
 epoch: 81, train_loss: 0.4264, test_loss: 1.4048, test_f1: 0.5905
 epoch: 82, train_loss: 0.4191, test_loss: 1.4000, test_f1: 0.5826
 epoch: 83, train_loss: 0.4014, test_loss: 1.4209, test_f1: 0.5671
 epoch: 84, train_loss: 0.4189, test_loss: 1.4403, test_f1: 0.5831
 epoch: 85, train_loss: 0.4029, test_loss: 1.3774, test_f1: 0.5793
 epoch: 86, train_loss: 0.4273, test_loss: 1.3678, test_f1: 0.5701
 epoch: 87, train_loss: 0.4060, test_loss: 1.3448, test_f1: 0.5794
 epoch: 88, train_loss: 0.3997, test_loss: 1.3483, test_f1: 0.5471
 epoch: 89, train_loss: 0.4025, test_loss: 1.3816, test_f1: 0.5599
 epoch: 90, train_loss: 0.3925, test_loss: 1.4119, test_f1: 0.5769
 epoch: 91, train_loss: 0.4014, test_loss: 1.4722, test_f1: 0.5484
 epoch: 92, train_loss: 0.3713, test_loss: 1.5360, test_f1: 0.5712
 epoch: 93, train_loss: 0.3826, test_loss: 1.4509, test_f1: 0.6006
 epoch: 94, train_loss: 0.3818, test_loss: 1.4195, test_f1: 0.5786
 epoch: 95, train_loss: 0.3873, test_loss: 1.4526, test_f1: 0.5714
 epoch: 96, train_loss: 0.3960, test_loss: 1.4929, test_f1: 0.5819
 epoch: 97, train_loss: 0.3781, test_loss: 1.5565, test_f1: 0.5772
 epoch: 98, train_loss: 0.3711, test_loss: 1.6316, test_f1: 0.5841
 epoch: 99, train_loss: 0.3795, test_loss: 1.4944, test_f1: 0.5815
##################ITERATION #5 ****************************************
 epoch: 0, train_loss: 1.2927, test_loss: 1.1258, test_f1: 0.4125
 epoch: 1, train_loss: 1.1127, test_loss: 1.0697, test_f1: 0.4321
 epoch: 2, train_loss: 1.0660, test_loss: 1.1354, test_f1: 0.4176
 epoch: 3, train_loss: 1.0558, test_loss: 0.9748, test_f1: 0.4797
 epoch: 4, train_loss: 1.0134, test_loss: 1.0217, test_f1: 0.4525
 epoch: 5, train_loss: 1.0054, test_loss: 0.9793, test_f1: 0.5052
 epoch: 6, train_loss: 0.9828, test_loss: 0.9655, test_f1: 0.4917
 epoch: 7, train_loss: 0.9743, test_loss: 0.9928, test_f1: 0.4666
 epoch: 8, train_loss: 0.9586, test_loss: 0.9718, test_f1: 0.4735
 epoch: 9, train_loss: 0.9356, test_loss: 0.9528, test_f1: 0.5269
 epoch: 10, train_loss: 0.9177, test_loss: 0.9755, test_f1: 0.4994
 epoch: 11, train_loss: 0.9166, test_loss: 1.0676, test_f1: 0.4758
 epoch: 12, train_loss: 0.8859, test_loss: 0.9729, test_f1: 0.5147
 epoch: 13, train_loss: 0.8461, test_loss: 0.9447, test_f1: 0.5056
 epoch: 14, train_loss: 0.8582, test_loss: 1.0101, test_f1: 0.5231
 epoch: 15, train_loss: 0.8482, test_loss: 0.9724, test_f1: 0.5266
 epoch: 16, train_loss: 0.8510, test_loss: 1.0310, test_f1: 0.5038
 epoch: 17, train_loss: 0.8541, test_loss: 1.0198, test_f1: 0.5435
 epoch: 18, train_loss: 0.8328, test_loss: 1.0114, test_f1: 0.5384
 epoch: 19, train_loss: 0.8350, test_loss: 0.9587, test_f1: 0.5432
 epoch: 20, train_loss: 0.8246, test_loss: 0.9948, test_f1: 0.5402
 epoch: 21, train_loss: 0.7949, test_loss: 1.1689, test_f1: 0.5417
 epoch: 22, train_loss: 0.7811, test_loss: 1.1058, test_f1: 0.5275
 epoch: 23, train_loss: 0.8346, test_loss: 1.0299, test_f1: 0.5411
 epoch: 24, train_loss: 0.8039, test_loss: 1.0362, test_f1: 0.5442
 epoch: 25, train_loss: 0.7737, test_loss: 1.0562, test_f1: 0.5451
 epoch: 26, train_loss: 0.7545, test_loss: 1.0093, test_f1: 0.5423
 epoch: 27, train_loss: 0.7713, test_loss: 1.1250, test_f1: 0.5295
 epoch: 28, train_loss: 0.7473, test_loss: 0.9849, test_f1: 0.5528
 epoch: 29, train_loss: 0.7628, test_loss: 1.0100, test_f1: 0.5410
 epoch: 30, train_loss: 0.7150, test_loss: 1.0763, test_f1: 0.5730
 epoch: 31, train_loss: 0.7353, test_loss: 1.0548, test_f1: 0.5475
 epoch: 32, train_loss: 0.7195, test_loss: 1.0341, test_f1: 0.5619
 epoch: 33, train_loss: 0.7079, test_loss: 1.1162, test_f1: 0.5480
 epoch: 34, train_loss: 0.7198, test_loss: 1.0505, test_f1: 0.5461
 epoch: 35, train_loss: 0.7042, test_loss: 1.0884, test_f1: 0.5570
 epoch: 36, train_loss: 0.6937, test_loss: 1.1076, test_f1: 0.5453
 epoch: 37, train_loss: 0.6852, test_loss: 1.0730, test_f1: 0.5341
 epoch: 38, train_loss: 0.6815, test_loss: 1.0689, test_f1: 0.5413
 epoch: 39, train_loss: 0.6928, test_loss: 1.1360, test_f1: 0.5095
 epoch: 40, train_loss: 0.7042, test_loss: 1.0131, test_f1: 0.5758
 epoch: 41, train_loss: 0.6568, test_loss: 1.0561, test_f1: 0.5674
 epoch: 42, train_loss: 0.6801, test_loss: 1.1293, test_f1: 0.5498
 epoch: 43, train_loss: 0.6689, test_loss: 1.0538, test_f1: 0.5611
 epoch: 44, train_loss: 0.6537, test_loss: 1.0404, test_f1: 0.5556
 epoch: 45, train_loss: 0.7028, test_loss: 1.0800, test_f1: 0.5624
 epoch: 46, train_loss: 0.6686, test_loss: 1.0210, test_f1: 0.5566
 epoch: 47, train_loss: 0.6300, test_loss: 1.1099, test_f1: 0.5864
 epoch: 48, train_loss: 0.6220, test_loss: 1.0882, test_f1: 0.5545
 epoch: 49, train_loss: 0.6430, test_loss: 1.0796, test_f1: 0.5605
 epoch: 50, train_loss: 0.6220, test_loss: 1.0439, test_f1: 0.5634
 epoch: 51, train_loss: 0.5811, test_loss: 1.0440, test_f1: 0.5672
 epoch: 52, train_loss: 0.5522, test_loss: 1.0885, test_f1: 0.5678
 epoch: 53, train_loss: 0.5422, test_loss: 1.1978, test_f1: 0.5696
 epoch: 54, train_loss: 0.5457, test_loss: 1.1364, test_f1: 0.5720
 epoch: 55, train_loss: 0.5222, test_loss: 1.1878, test_f1: 0.5795
 epoch: 56, train_loss: 0.5207, test_loss: 1.2708, test_f1: 0.5588
 epoch: 57, train_loss: 0.5367, test_loss: 1.1786, test_f1: 0.5845
 epoch: 58, train_loss: 0.5236, test_loss: 1.1760, test_f1: 0.5592
 epoch: 59, train_loss: 0.5247, test_loss: 1.1684, test_f1: 0.5776
 epoch: 60, train_loss: 0.5138, test_loss: 1.1111, test_f1: 0.5546
 epoch: 61, train_loss: 0.4982, test_loss: 1.1837, test_f1: 0.5540
 epoch: 62, train_loss: 0.4909, test_loss: 1.2294, test_f1: 0.5696
 epoch: 63, train_loss: 0.5027, test_loss: 1.2182, test_f1: 0.5609
 epoch: 64, train_loss: 0.4777, test_loss: 1.1951, test_f1: 0.5792
 epoch: 65, train_loss: 0.4928, test_loss: 1.2493, test_f1: 0.5486
 epoch: 66, train_loss: 0.4856, test_loss: 1.2760, test_f1: 0.5803
 epoch: 67, train_loss: 0.4752, test_loss: 1.2357, test_f1: 0.5432
 epoch: 68, train_loss: 0.4891, test_loss: 1.2115, test_f1: 0.5475
 epoch: 69, train_loss: 0.4858, test_loss: 1.2005, test_f1: 0.5698
 epoch: 70, train_loss: 0.5668, test_loss: 1.1949, test_f1: 0.5672
 epoch: 71, train_loss: 0.5250, test_loss: 1.1579, test_f1: 0.5556
 epoch: 72, train_loss: 0.4942, test_loss: 1.1783, test_f1: 0.5685
 epoch: 73, train_loss: 0.4772, test_loss: 1.2029, test_f1: 0.5733
 epoch: 74, train_loss: 0.4885, test_loss: 1.1703, test_f1: 0.5775
 epoch: 75, train_loss: 0.4625, test_loss: 1.1748, test_f1: 0.5972
 epoch: 76, train_loss: 0.4410, test_loss: 1.1956, test_f1: 0.5762
 epoch: 77, train_loss: 0.4486, test_loss: 1.2498, test_f1: 0.5653
 epoch: 78, train_loss: 0.4425, test_loss: 1.2731, test_f1: 0.5734
 epoch: 79, train_loss: 0.4426, test_loss: 1.2367, test_f1: 0.5923
 epoch: 80, train_loss: 0.4476, test_loss: 1.2085, test_f1: 0.6002
 epoch: 81, train_loss: 0.4446, test_loss: 1.1901, test_f1: 0.5766
 epoch: 82, train_loss: 0.4459, test_loss: 1.2904, test_f1: 0.5819
 epoch: 83, train_loss: 0.4553, test_loss: 1.2881, test_f1: 0.5973
 epoch: 84, train_loss: 0.4335, test_loss: 1.3212, test_f1: 0.5872
 epoch: 85, train_loss: 0.4260, test_loss: 1.2154, test_f1: 0.5869
 epoch: 86, train_loss: 0.4101, test_loss: 1.4626, test_f1: 0.5685
 epoch: 87, train_loss: 0.4029, test_loss: 1.3986, test_f1: 0.5843
 epoch: 88, train_loss: 0.4122, test_loss: 1.2910, test_f1: 0.5838
 epoch: 89, train_loss: 0.4057, test_loss: 1.3467, test_f1: 0.5761
 epoch: 90, train_loss: 0.4227, test_loss: 1.3221, test_f1: 0.5910
 epoch: 91, train_loss: 0.4175, test_loss: 1.3764, test_f1: 0.6103
 epoch: 92, train_loss: 0.3971, test_loss: 1.3426, test_f1: 0.5666
 epoch: 93, train_loss: 0.4111, test_loss: 1.3071, test_f1: 0.5838
 epoch: 94, train_loss: 0.4061, test_loss: 1.4650, test_f1: 0.5838
 epoch: 95, train_loss: 0.3977, test_loss: 1.4015, test_f1: 0.5808
 epoch: 96, train_loss: 0.3936, test_loss: 1.4182, test_f1: 0.5688
 epoch: 97, train_loss: 0.3962, test_loss: 1.2771, test_f1: 0.5874
 epoch: 98, train_loss: 0.3879, test_loss: 1.4381, test_f1: 0.5509
 epoch: 99, train_loss: 0.4017, test_loss: 1.4265, test_f1: 0.5534
##################ITERATION #6 ****************************************
 epoch: 0, train_loss: 1.2957, test_loss: 1.1200, test_f1: 0.4344
 epoch: 1, train_loss: 1.1324, test_loss: 1.0755, test_f1: 0.4283
 epoch: 2, train_loss: 1.0884, test_loss: 1.0104, test_f1: 0.4589
 epoch: 3, train_loss: 1.0569, test_loss: 0.9935, test_f1: 0.4350
 epoch: 4, train_loss: 1.0247, test_loss: 1.0230, test_f1: 0.4557
 epoch: 5, train_loss: 1.0076, test_loss: 1.0429, test_f1: 0.4850
 epoch: 6, train_loss: 0.9959, test_loss: 1.0045, test_f1: 0.4922
 epoch: 7, train_loss: 0.9714, test_loss: 0.9390, test_f1: 0.5365
 epoch: 8, train_loss: 0.9438, test_loss: 1.0442, test_f1: 0.4964
 epoch: 9, train_loss: 0.9355, test_loss: 1.0346, test_f1: 0.4588
 epoch: 10, train_loss: 0.9378, test_loss: 1.0139, test_f1: 0.4963
 epoch: 11, train_loss: 0.9114, test_loss: 0.9789, test_f1: 0.5026
 epoch: 12, train_loss: 0.8924, test_loss: 0.9692, test_f1: 0.4970
 epoch: 13, train_loss: 0.8801, test_loss: 0.9533, test_f1: 0.5177
 epoch: 14, train_loss: 0.8834, test_loss: 0.9734, test_f1: 0.5560
 epoch: 15, train_loss: 0.8682, test_loss: 0.8956, test_f1: 0.5391
 epoch: 16, train_loss: 0.8377, test_loss: 0.9882, test_f1: 0.5349
 epoch: 17, train_loss: 0.8324, test_loss: 1.0344, test_f1: 0.5391
 epoch: 18, train_loss: 0.8205, test_loss: 0.9774, test_f1: 0.5379
 epoch: 19, train_loss: 0.8299, test_loss: 1.0458, test_f1: 0.5223
 epoch: 20, train_loss: 0.8202, test_loss: 1.0063, test_f1: 0.5350
 epoch: 21, train_loss: 0.8151, test_loss: 0.9390, test_f1: 0.5318
 epoch: 22, train_loss: 0.7919, test_loss: 0.9610, test_f1: 0.5487
 epoch: 23, train_loss: 0.7942, test_loss: 1.0277, test_f1: 0.5318
 epoch: 24, train_loss: 0.8016, test_loss: 0.9748, test_f1: 0.5180
 epoch: 25, train_loss: 0.7759, test_loss: 1.0177, test_f1: 0.5136
 epoch: 26, train_loss: 0.7836, test_loss: 1.0172, test_f1: 0.5429
 epoch: 27, train_loss: 0.7666, test_loss: 1.0270, test_f1: 0.5456
 epoch: 28, train_loss: 0.7522, test_loss: 1.0843, test_f1: 0.5234
 epoch: 29, train_loss: 0.7623, test_loss: 0.9717, test_f1: 0.5510
 epoch: 30, train_loss: 0.7405, test_loss: 1.0874, test_f1: 0.5470
 epoch: 31, train_loss: 0.7405, test_loss: 1.0398, test_f1: 0.5373
 epoch: 32, train_loss: 0.7184, test_loss: 1.0460, test_f1: 0.5379
 epoch: 33, train_loss: 0.7022, test_loss: 1.0255, test_f1: 0.5473
 epoch: 34, train_loss: 0.7208, test_loss: 1.0479, test_f1: 0.5691
 epoch: 35, train_loss: 0.7415, test_loss: 0.9576, test_f1: 0.5945
 epoch: 36, train_loss: 0.7021, test_loss: 1.0057, test_f1: 0.5499
 epoch: 37, train_loss: 0.6986, test_loss: 1.0136, test_f1: 0.5627
 epoch: 38, train_loss: 0.6850, test_loss: 1.0867, test_f1: 0.5428
 epoch: 39, train_loss: 0.7068, test_loss: 0.9874, test_f1: 0.5666
 epoch: 40, train_loss: 0.6714, test_loss: 0.9968, test_f1: 0.5607
 epoch: 41, train_loss: 0.6667, test_loss: 1.1476, test_f1: 0.5442
 epoch: 42, train_loss: 0.6816, test_loss: 1.0452, test_f1: 0.5404
 epoch: 43, train_loss: 0.6494, test_loss: 1.0458, test_f1: 0.5617
 epoch: 44, train_loss: 0.6617, test_loss: 1.0501, test_f1: 0.5311
 epoch: 45, train_loss: 0.6548, test_loss: 1.0713, test_f1: 0.5430
 epoch: 46, train_loss: 0.6514, test_loss: 1.0749, test_f1: 0.5506
 epoch: 47, train_loss: 0.6147, test_loss: 1.0719, test_f1: 0.5598
 epoch: 48, train_loss: 0.5987, test_loss: 1.0910, test_f1: 0.5362
 epoch: 49, train_loss: 0.6857, test_loss: 1.0197, test_f1: 0.5690
 epoch: 50, train_loss: 0.6602, test_loss: 1.0643, test_f1: 0.5634
 epoch: 51, train_loss: 0.5856, test_loss: 1.1061, test_f1: 0.5546
 epoch: 52, train_loss: 0.5707, test_loss: 1.1975, test_f1: 0.5627
 epoch: 53, train_loss: 0.5561, test_loss: 1.1231, test_f1: 0.5704
 epoch: 54, train_loss: 0.5613, test_loss: 1.1111, test_f1: 0.5862
 epoch: 55, train_loss: 0.5431, test_loss: 1.1244, test_f1: 0.5617
 epoch: 56, train_loss: 0.5433, test_loss: 1.1102, test_f1: 0.5643
 epoch: 57, train_loss: 0.5356, test_loss: 1.1577, test_f1: 0.5595
 epoch: 58, train_loss: 0.5189, test_loss: 1.2029, test_f1: 0.5593
 epoch: 59, train_loss: 0.5016, test_loss: 1.2120, test_f1: 0.5812
 epoch: 60, train_loss: 0.5108, test_loss: 1.3216, test_f1: 0.5414
 epoch: 61, train_loss: 0.5060, test_loss: 1.1693, test_f1: 0.5872
 epoch: 62, train_loss: 0.5040, test_loss: 1.1621, test_f1: 0.5656
 epoch: 63, train_loss: 0.5099, test_loss: 1.2722, test_f1: 0.5621
 epoch: 64, train_loss: 0.4927, test_loss: 1.3089, test_f1: 0.5691
 epoch: 65, train_loss: 0.5362, test_loss: 1.2426, test_f1: 0.5357
 epoch: 66, train_loss: 0.4866, test_loss: 1.2751, test_f1: 0.5622
 epoch: 67, train_loss: 0.4726, test_loss: 1.3701, test_f1: 0.5550
 epoch: 68, train_loss: 0.4866, test_loss: 1.2107, test_f1: 0.5632
 epoch: 69, train_loss: 0.5039, test_loss: 1.2165, test_f1: 0.5489
 epoch: 70, train_loss: 0.4688, test_loss: 1.3156, test_f1: 0.5637
 epoch: 71, train_loss: 0.4820, test_loss: 1.3062, test_f1: 0.5860
 epoch: 72, train_loss: 0.4680, test_loss: 1.3177, test_f1: 0.5365
 epoch: 73, train_loss: 0.4527, test_loss: 1.3092, test_f1: 0.5695
 epoch: 74, train_loss: 0.4581, test_loss: 1.5457, test_f1: 0.5296
 epoch: 75, train_loss: 0.4612, test_loss: 1.2831, test_f1: 0.5640
 epoch: 76, train_loss: 0.4488, test_loss: 1.2864, test_f1: 0.5739
 epoch: 77, train_loss: 0.4529, test_loss: 1.2913, test_f1: 0.5526
 epoch: 78, train_loss: 0.4489, test_loss: 1.2771, test_f1: 0.5493
 epoch: 79, train_loss: 0.4409, test_loss: 1.3665, test_f1: 0.5398
 epoch: 80, train_loss: 0.4281, test_loss: 1.2860, test_f1: 0.5421
 epoch: 81, train_loss: 0.4239, test_loss: 1.3740, test_f1: 0.5584
 epoch: 82, train_loss: 0.4279, test_loss: 1.5590, test_f1: 0.5419
 epoch: 83, train_loss: 0.4346, test_loss: 1.3167, test_f1: 0.5632
 epoch: 84, train_loss: 0.4317, test_loss: 1.3745, test_f1: 0.5705
 epoch: 85, train_loss: 0.4251, test_loss: 1.4847, test_f1: 0.5715
 epoch: 86, train_loss: 0.4183, test_loss: 1.3338, test_f1: 0.5666
 epoch: 87, train_loss: 0.4284, test_loss: 1.3191, test_f1: 0.5776
 epoch: 88, train_loss: 0.4235, test_loss: 1.4861, test_f1: 0.5308
 epoch: 89, train_loss: 0.4736, test_loss: 1.3268, test_f1: 0.5812
 epoch: 90, train_loss: 0.4123, test_loss: 1.3960, test_f1: 0.5486
 epoch: 91, train_loss: 0.4079, test_loss: 1.4415, test_f1: 0.5596
 epoch: 92, train_loss: 0.3918, test_loss: 1.4303, test_f1: 0.5482
 epoch: 93, train_loss: 0.3785, test_loss: 1.4737, test_f1: 0.5589
 epoch: 94, train_loss: 0.4313, test_loss: 1.4128, test_f1: 0.5633
 epoch: 95, train_loss: 0.4176, test_loss: 1.4287, test_f1: 0.5551
 epoch: 96, train_loss: 0.3976, test_loss: 1.4117, test_f1: 0.5563
 epoch: 97, train_loss: 0.4160, test_loss: 1.4993, test_f1: 0.5240
 epoch: 98, train_loss: 0.4173, test_loss: 1.4485, test_f1: 0.5489
 epoch: 99, train_loss: 0.3796, test_loss: 1.4270, test_f1: 0.5374
##################ITERATION #7 ****************************************
 epoch: 0, train_loss: 1.2954, test_loss: 1.1286, test_f1: 0.3803
 epoch: 1, train_loss: 1.1359, test_loss: 1.0437, test_f1: 0.4461
 epoch: 2, train_loss: 1.0875, test_loss: 1.0424, test_f1: 0.4332
 epoch: 3, train_loss: 1.0526, test_loss: 0.9716, test_f1: 0.4802
 epoch: 4, train_loss: 1.0329, test_loss: 1.0149, test_f1: 0.4506
 epoch: 5, train_loss: 1.0110, test_loss: 1.0073, test_f1: 0.4589
 epoch: 6, train_loss: 0.9850, test_loss: 1.0127, test_f1: 0.4582
 epoch: 7, train_loss: 0.9670, test_loss: 0.9752, test_f1: 0.4941
 epoch: 8, train_loss: 0.9566, test_loss: 0.9739, test_f1: 0.4635
 epoch: 9, train_loss: 0.9427, test_loss: 1.0737, test_f1: 0.4590
 epoch: 10, train_loss: 0.9116, test_loss: 0.9555, test_f1: 0.5601
 epoch: 11, train_loss: 0.9003, test_loss: 0.9579, test_f1: 0.4834
 epoch: 12, train_loss: 0.8913, test_loss: 0.9985, test_f1: 0.4990
 epoch: 13, train_loss: 0.8666, test_loss: 0.9775, test_f1: 0.5244
 epoch: 14, train_loss: 0.8717, test_loss: 1.0538, test_f1: 0.4838
 epoch: 15, train_loss: 0.8459, test_loss: 0.9584, test_f1: 0.5284
 epoch: 16, train_loss: 0.8427, test_loss: 0.9611, test_f1: 0.5413
 epoch: 17, train_loss: 0.8351, test_loss: 0.9818, test_f1: 0.5001
 epoch: 18, train_loss: 0.8531, test_loss: 1.0931, test_f1: 0.5402
 epoch: 19, train_loss: 0.8208, test_loss: 1.0477, test_f1: 0.5255
 epoch: 20, train_loss: 0.8053, test_loss: 1.0472, test_f1: 0.5370
 epoch: 21, train_loss: 0.8046, test_loss: 1.1374, test_f1: 0.5421
 epoch: 22, train_loss: 0.7949, test_loss: 1.0360, test_f1: 0.5206
 epoch: 23, train_loss: 0.7922, test_loss: 0.9579, test_f1: 0.5447
 epoch: 24, train_loss: 0.8055, test_loss: 1.0206, test_f1: 0.5349
 epoch: 25, train_loss: 0.7807, test_loss: 1.0223, test_f1: 0.5356
 epoch: 26, train_loss: 0.7656, test_loss: 1.0769, test_f1: 0.5540
 epoch: 27, train_loss: 0.7426, test_loss: 1.0034, test_f1: 0.5507
 epoch: 28, train_loss: 0.7406, test_loss: 1.0574, test_f1: 0.5541
 epoch: 29, train_loss: 0.7218, test_loss: 1.1641, test_f1: 0.5423
 epoch: 30, train_loss: 0.7154, test_loss: 1.0012, test_f1: 0.5436
 epoch: 31, train_loss: 0.7178, test_loss: 1.0808, test_f1: 0.5525
 epoch: 32, train_loss: 0.6982, test_loss: 1.1719, test_f1: 0.5170
 epoch: 33, train_loss: 0.7295, test_loss: 1.1643, test_f1: 0.5389
 epoch: 34, train_loss: 0.7022, test_loss: 1.0834, test_f1: 0.5402
 epoch: 35, train_loss: 0.7048, test_loss: 0.9627, test_f1: 0.5556
 epoch: 36, train_loss: 0.7027, test_loss: 1.1674, test_f1: 0.5105
 epoch: 37, train_loss: 0.6864, test_loss: 1.1197, test_f1: 0.5653
 epoch: 38, train_loss: 0.6847, test_loss: 1.0609, test_f1: 0.5200
 epoch: 39, train_loss: 0.6655, test_loss: 1.1751, test_f1: 0.5306
 epoch: 40, train_loss: 0.6915, test_loss: 1.1224, test_f1: 0.5583
 epoch: 41, train_loss: 0.6843, test_loss: 1.0368, test_f1: 0.5386
 epoch: 42, train_loss: 0.6404, test_loss: 1.1351, test_f1: 0.5455
 epoch: 43, train_loss: 0.6447, test_loss: 1.1383, test_f1: 0.5455
 epoch: 44, train_loss: 0.6309, test_loss: 1.0876, test_f1: 0.5375
 epoch: 45, train_loss: 0.6447, test_loss: 1.0406, test_f1: 0.5340
 epoch: 46, train_loss: 0.6420, test_loss: 1.0975, test_f1: 0.5498
 epoch: 47, train_loss: 0.6345, test_loss: 1.1999, test_f1: 0.5487
 epoch: 48, train_loss: 0.6319, test_loss: 1.1361, test_f1: 0.5579
 epoch: 49, train_loss: 0.6613, test_loss: 1.1594, test_f1: 0.5655
 epoch: 50, train_loss: 0.6433, test_loss: 1.1116, test_f1: 0.5233
 epoch: 51, train_loss: 0.5870, test_loss: 1.1310, test_f1: 0.5414
 epoch: 52, train_loss: 0.5558, test_loss: 1.2693, test_f1: 0.5178
 epoch: 53, train_loss: 0.5681, test_loss: 1.1710, test_f1: 0.5702
 epoch: 54, train_loss: 0.5506, test_loss: 1.1836, test_f1: 0.5613
 epoch: 55, train_loss: 0.5642, test_loss: 1.1742, test_f1: 0.5847
 epoch: 56, train_loss: 0.5544, test_loss: 1.1678, test_f1: 0.5721
 epoch: 57, train_loss: 0.5389, test_loss: 1.2521, test_f1: 0.5300
 epoch: 58, train_loss: 0.5624, test_loss: 1.3604, test_f1: 0.5400
 epoch: 59, train_loss: 0.5208, test_loss: 1.3151, test_f1: 0.5715
 epoch: 60, train_loss: 0.5162, test_loss: 1.3791, test_f1: 0.5429
 epoch: 61, train_loss: 0.5353, test_loss: 1.2560, test_f1: 0.5661
 epoch: 62, train_loss: 0.5298, test_loss: 1.3092, test_f1: 0.5588
 epoch: 63, train_loss: 0.4980, test_loss: 1.3184, test_f1: 0.5488
 epoch: 64, train_loss: 0.5073, test_loss: 1.3287, test_f1: 0.5488
 epoch: 65, train_loss: 0.5102, test_loss: 1.3182, test_f1: 0.5357
 epoch: 66, train_loss: 0.4918, test_loss: 1.3761, test_f1: 0.5677
 epoch: 67, train_loss: 0.4884, test_loss: 1.3537, test_f1: 0.5519
 epoch: 68, train_loss: 0.4591, test_loss: 1.3342, test_f1: 0.5557
 epoch: 69, train_loss: 0.4775, test_loss: 1.3737, test_f1: 0.5311
 epoch: 70, train_loss: 0.4502, test_loss: 1.3932, test_f1: 0.5399
 epoch: 71, train_loss: 0.4537, test_loss: 1.3143, test_f1: 0.5705
 epoch: 72, train_loss: 0.4810, test_loss: 1.2866, test_f1: 0.5541
 epoch: 73, train_loss: 0.4605, test_loss: 1.3884, test_f1: 0.5465
 epoch: 74, train_loss: 0.4428, test_loss: 1.3429, test_f1: 0.5709
 epoch: 75, train_loss: 0.4491, test_loss: 1.4311, test_f1: 0.5584
 epoch: 76, train_loss: 0.4723, test_loss: 1.3979, test_f1: 0.5656
 epoch: 77, train_loss: 0.4458, test_loss: 1.3846, test_f1: 0.5606
 epoch: 78, train_loss: 0.4346, test_loss: 1.3902, test_f1: 0.5452
 epoch: 79, train_loss: 0.4393, test_loss: 1.3396, test_f1: 0.5923
 epoch: 80, train_loss: 0.4398, test_loss: 1.4443, test_f1: 0.5556
 epoch: 81, train_loss: 0.4263, test_loss: 1.3380, test_f1: 0.5889
 epoch: 82, train_loss: 0.4239, test_loss: 1.4511, test_f1: 0.5458
 epoch: 83, train_loss: 0.4152, test_loss: 1.5450, test_f1: 0.5268
 epoch: 84, train_loss: 0.4132, test_loss: 1.4170, test_f1: 0.5620
 epoch: 85, train_loss: 0.4051, test_loss: 1.3880, test_f1: 0.5945
 epoch: 86, train_loss: 0.4106, test_loss: 1.4385, test_f1: 0.5548
 epoch: 87, train_loss: 0.4410, test_loss: 1.4744, test_f1: 0.5527
 epoch: 88, train_loss: 0.3931, test_loss: 1.4426, test_f1: 0.5751
 epoch: 89, train_loss: 0.4157, test_loss: 1.4161, test_f1: 0.5719
 epoch: 90, train_loss: 0.4133, test_loss: 1.5546, test_f1: 0.5225
 epoch: 91, train_loss: 0.4264, test_loss: 1.4877, test_f1: 0.5394
 epoch: 92, train_loss: 0.3923, test_loss: 1.4999, test_f1: 0.5561
 epoch: 93, train_loss: 0.3882, test_loss: 1.4874, test_f1: 0.5339
 epoch: 94, train_loss: 0.3788, test_loss: 1.4937, test_f1: 0.5498
 epoch: 95, train_loss: 0.3886, test_loss: 1.5985, test_f1: 0.5457
 epoch: 96, train_loss: 0.3818, test_loss: 1.6324, test_f1: 0.5332
 epoch: 97, train_loss: 0.4596, test_loss: 1.4604, test_f1: 0.5657
 epoch: 98, train_loss: 0.4420, test_loss: 1.4177, test_f1: 0.5563
 epoch: 99, train_loss: 0.3981, test_loss: 1.4550, test_f1: 0.5681
##################ITERATION #8 ****************************************
 epoch: 0, train_loss: 1.3107, test_loss: 1.1246, test_f1: 0.4533
 epoch: 1, train_loss: 1.1242, test_loss: 1.0432, test_f1: 0.4715
 epoch: 2, train_loss: 1.0782, test_loss: 1.0257, test_f1: 0.4782
 epoch: 3, train_loss: 1.0399, test_loss: 1.0079, test_f1: 0.4686
 epoch: 4, train_loss: 1.0166, test_loss: 1.0005, test_f1: 0.5101
 epoch: 5, train_loss: 0.9923, test_loss: 0.9828, test_f1: 0.4617
 epoch: 6, train_loss: 0.9790, test_loss: 1.0386, test_f1: 0.4693
 epoch: 7, train_loss: 0.9673, test_loss: 0.9768, test_f1: 0.5061
 epoch: 8, train_loss: 0.9397, test_loss: 0.9842, test_f1: 0.4953
 epoch: 9, train_loss: 0.9320, test_loss: 0.9643, test_f1: 0.4762
 epoch: 10, train_loss: 0.9180, test_loss: 0.9366, test_f1: 0.5133
 epoch: 11, train_loss: 0.9230, test_loss: 0.9713, test_f1: 0.4967
 epoch: 12, train_loss: 0.9159, test_loss: 0.9258, test_f1: 0.5213
 epoch: 13, train_loss: 0.8904, test_loss: 0.9869, test_f1: 0.5570
 epoch: 14, train_loss: 0.8849, test_loss: 0.9577, test_f1: 0.5209
 epoch: 15, train_loss: 0.8620, test_loss: 1.0904, test_f1: 0.5318
 epoch: 16, train_loss: 0.8677, test_loss: 1.0929, test_f1: 0.5150
 epoch: 17, train_loss: 0.8433, test_loss: 1.0296, test_f1: 0.5322
 epoch: 18, train_loss: 0.8285, test_loss: 1.0200, test_f1: 0.5407
 epoch: 19, train_loss: 0.8397, test_loss: 1.0835, test_f1: 0.5306
 epoch: 20, train_loss: 0.8217, test_loss: 1.2035, test_f1: 0.5274
 epoch: 21, train_loss: 0.7894, test_loss: 1.0840, test_f1: 0.5356
 epoch: 22, train_loss: 0.7977, test_loss: 1.1168, test_f1: 0.5346
 epoch: 23, train_loss: 0.7986, test_loss: 1.1245, test_f1: 0.5267
 epoch: 24, train_loss: 0.7658, test_loss: 1.0772, test_f1: 0.5396
 epoch: 25, train_loss: 0.7665, test_loss: 1.1736, test_f1: 0.5366
 epoch: 26, train_loss: 0.7534, test_loss: 1.0787, test_f1: 0.5513
 epoch: 27, train_loss: 0.7677, test_loss: 1.0109, test_f1: 0.5669
 epoch: 28, train_loss: 0.8383, test_loss: 1.0653, test_f1: 0.5380
 epoch: 29, train_loss: 0.7684, test_loss: 1.0940, test_f1: 0.5266
 epoch: 30, train_loss: 0.7872, test_loss: 1.0516, test_f1: 0.5559
 epoch: 31, train_loss: 0.7406, test_loss: 1.0387, test_f1: 0.5435
 epoch: 32, train_loss: 0.7298, test_loss: 1.0889, test_f1: 0.5372
 epoch: 33, train_loss: 0.7262, test_loss: 1.1656, test_f1: 0.5363
 epoch: 34, train_loss: 0.7100, test_loss: 1.0875, test_f1: 0.5225
 epoch: 35, train_loss: 0.7534, test_loss: 1.0156, test_f1: 0.5539
 epoch: 36, train_loss: 0.6989, test_loss: 1.1037, test_f1: 0.5548
 epoch: 37, train_loss: 0.7140, test_loss: 1.0795, test_f1: 0.5345
 epoch: 38, train_loss: 0.6968, test_loss: 1.0806, test_f1: 0.5474
 epoch: 39, train_loss: 0.7297, test_loss: 1.0903, test_f1: 0.5577
 epoch: 40, train_loss: 0.6902, test_loss: 1.1711, test_f1: 0.5107
 epoch: 41, train_loss: 0.6846, test_loss: 1.1955, test_f1: 0.5507
 epoch: 42, train_loss: 0.6707, test_loss: 1.1387, test_f1: 0.5269
 epoch: 43, train_loss: 0.6796, test_loss: 1.0537, test_f1: 0.5557
 epoch: 44, train_loss: 0.6637, test_loss: 1.1982, test_f1: 0.5244
 epoch: 45, train_loss: 0.6552, test_loss: 1.0509, test_f1: 0.5609
 epoch: 46, train_loss: 0.6404, test_loss: 1.1094, test_f1: 0.5672
 epoch: 47, train_loss: 0.6646, test_loss: 1.0889, test_f1: 0.5178
 epoch: 48, train_loss: 0.6489, test_loss: 1.1619, test_f1: 0.5091
 epoch: 49, train_loss: 0.6397, test_loss: 1.1671, test_f1: 0.5308
 epoch: 50, train_loss: 0.6083, test_loss: 1.3581, test_f1: 0.5359
 epoch: 51, train_loss: 0.5903, test_loss: 1.1315, test_f1: 0.5676
 epoch: 52, train_loss: 0.5531, test_loss: 1.2518, test_f1: 0.5149
 epoch: 53, train_loss: 0.5479, test_loss: 1.1932, test_f1: 0.5614
 epoch: 54, train_loss: 0.5434, test_loss: 1.1817, test_f1: 0.5437
 epoch: 55, train_loss: 0.5488, test_loss: 1.2846, test_f1: 0.5309
 epoch: 56, train_loss: 0.5537, test_loss: 1.2273, test_f1: 0.5411
 epoch: 57, train_loss: 0.5365, test_loss: 1.2953, test_f1: 0.5147
 epoch: 58, train_loss: 0.5261, test_loss: 1.4236, test_f1: 0.5087
 epoch: 59, train_loss: 0.5193, test_loss: 1.2933, test_f1: 0.5371
 epoch: 60, train_loss: 0.5274, test_loss: 1.3421, test_f1: 0.5290
 epoch: 61, train_loss: 0.5352, test_loss: 1.3231, test_f1: 0.5407
 epoch: 62, train_loss: 0.5150, test_loss: 1.3105, test_f1: 0.5285
 epoch: 63, train_loss: 0.5182, test_loss: 1.3347, test_f1: 0.5302
 epoch: 64, train_loss: 0.5062, test_loss: 1.2855, test_f1: 0.5376
 epoch: 65, train_loss: 0.5022, test_loss: 1.4037, test_f1: 0.5227
 epoch: 66, train_loss: 0.5264, test_loss: 1.2356, test_f1: 0.5330
 epoch: 67, train_loss: 0.4910, test_loss: 1.3591, test_f1: 0.5128
 epoch: 68, train_loss: 0.4837, test_loss: 1.2913, test_f1: 0.5734
 epoch: 69, train_loss: 0.5004, test_loss: 1.4285, test_f1: 0.5449
 epoch: 70, train_loss: 0.5135, test_loss: 1.3826, test_f1: 0.5215
 epoch: 71, train_loss: 0.4908, test_loss: 1.4522, test_f1: 0.5252
 epoch: 72, train_loss: 0.4938, test_loss: 1.3752, test_f1: 0.5665
 epoch: 73, train_loss: 0.4809, test_loss: 1.2665, test_f1: 0.5508
 epoch: 74, train_loss: 0.5119, test_loss: 1.2799, test_f1: 0.5859
 epoch: 75, train_loss: 0.4819, test_loss: 1.3110, test_f1: 0.5543
 epoch: 76, train_loss: 0.4614, test_loss: 1.3208, test_f1: 0.5672
 epoch: 77, train_loss: 0.4564, test_loss: 1.3246, test_f1: 0.5723
 epoch: 78, train_loss: 0.4626, test_loss: 1.2982, test_f1: 0.5350
 epoch: 79, train_loss: 0.4794, test_loss: 1.3348, test_f1: 0.5549
 epoch: 80, train_loss: 0.4575, test_loss: 1.2902, test_f1: 0.5376
 epoch: 81, train_loss: 0.4531, test_loss: 1.3477, test_f1: 0.5318
 epoch: 82, train_loss: 0.4373, test_loss: 1.3216, test_f1: 0.5662
 epoch: 83, train_loss: 0.4571, test_loss: 1.3602, test_f1: 0.5498
 epoch: 84, train_loss: 0.5062, test_loss: 1.3628, test_f1: 0.5411
 epoch: 85, train_loss: 0.4589, test_loss: 1.3815, test_f1: 0.5542
 epoch: 86, train_loss: 0.4512, test_loss: 1.4111, test_f1: 0.5476
 epoch: 87, train_loss: 0.5134, test_loss: 1.2545, test_f1: 0.5664
 epoch: 88, train_loss: 0.4544, test_loss: 1.2410, test_f1: 0.5715
 epoch: 89, train_loss: 0.4516, test_loss: 1.3640, test_f1: 0.5334
 epoch: 90, train_loss: 0.4346, test_loss: 1.2943, test_f1: 0.5674
 epoch: 91, train_loss: 0.4251, test_loss: 1.4600, test_f1: 0.5297
 epoch: 92, train_loss: 0.4361, test_loss: 1.3899, test_f1: 0.5582
 epoch: 93, train_loss: 0.4198, test_loss: 1.3077, test_f1: 0.5414
 epoch: 94, train_loss: 0.4008, test_loss: 1.4305, test_f1: 0.5397
 epoch: 95, train_loss: 0.4220, test_loss: 1.4579, test_f1: 0.5455
 epoch: 96, train_loss: 0.4119, test_loss: 1.3727, test_f1: 0.5274
 epoch: 97, train_loss: 0.4141, test_loss: 1.4554, test_f1: 0.5186
 epoch: 98, train_loss: 0.4609, test_loss: 1.3568, test_f1: 0.5721
 epoch: 99, train_loss: 0.4237, test_loss: 1.3509, test_f1: 0.5459
##################ITERATION #9 ****************************************
 epoch: 0, train_loss: 1.2724, test_loss: 1.0979, test_f1: 0.4452
 epoch: 1, train_loss: 1.0998, test_loss: 0.9996, test_f1: 0.4726
 epoch: 2, train_loss: 1.0484, test_loss: 0.9906, test_f1: 0.4811
 epoch: 3, train_loss: 1.0113, test_loss: 0.9874, test_f1: 0.4724
 epoch: 4, train_loss: 0.9897, test_loss: 1.0743, test_f1: 0.4074
 epoch: 5, train_loss: 0.9844, test_loss: 0.9686, test_f1: 0.5068
 epoch: 6, train_loss: 0.9656, test_loss: 0.9939, test_f1: 0.4781
 epoch: 7, train_loss: 0.9507, test_loss: 1.0305, test_f1: 0.4939
 epoch: 8, train_loss: 0.9278, test_loss: 0.9711, test_f1: 0.4953
 epoch: 9, train_loss: 0.8999, test_loss: 0.9798, test_f1: 0.5348
 epoch: 10, train_loss: 0.9011, test_loss: 1.0544, test_f1: 0.4812
 epoch: 11, train_loss: 0.8953, test_loss: 1.0321, test_f1: 0.4826
 epoch: 12, train_loss: 0.8942, test_loss: 1.0737, test_f1: 0.5265
 epoch: 13, train_loss: 0.8792, test_loss: 0.9696, test_f1: 0.5168
 epoch: 14, train_loss: 0.8635, test_loss: 1.0748, test_f1: 0.5189
 epoch: 15, train_loss: 0.8326, test_loss: 0.9951, test_f1: 0.5035
 epoch: 16, train_loss: 0.8287, test_loss: 1.0344, test_f1: 0.5105
 epoch: 17, train_loss: 0.8289, test_loss: 1.0814, test_f1: 0.5151
 epoch: 18, train_loss: 0.8343, test_loss: 1.1092, test_f1: 0.5120
 epoch: 19, train_loss: 0.8072, test_loss: 1.1038, test_f1: 0.5410
 epoch: 20, train_loss: 0.8113, test_loss: 1.0498, test_f1: 0.5129
 epoch: 21, train_loss: 0.8192, test_loss: 1.1452, test_f1: 0.5146
 epoch: 22, train_loss: 0.7878, test_loss: 1.0637, test_f1: 0.5230
 epoch: 23, train_loss: 0.7889, test_loss: 0.9932, test_f1: 0.5628
 epoch: 24, train_loss: 0.7620, test_loss: 1.0676, test_f1: 0.5396
 epoch: 25, train_loss: 0.7729, test_loss: 1.0007, test_f1: 0.5653
 epoch: 26, train_loss: 0.7503, test_loss: 1.2001, test_f1: 0.4977
 epoch: 27, train_loss: 0.7450, test_loss: 1.1798, test_f1: 0.5307
 epoch: 28, train_loss: 0.7441, test_loss: 1.0761, test_f1: 0.5474
 epoch: 29, train_loss: 0.7352, test_loss: 1.0331, test_f1: 0.5472
 epoch: 30, train_loss: 0.7200, test_loss: 1.1104, test_f1: 0.5585
 epoch: 31, train_loss: 0.7158, test_loss: 0.9829, test_f1: 0.5668
 epoch: 32, train_loss: 0.7077, test_loss: 1.1143, test_f1: 0.5687
 epoch: 33, train_loss: 0.6904, test_loss: 1.0578, test_f1: 0.5407
 epoch: 34, train_loss: 0.6859, test_loss: 0.9811, test_f1: 0.5835
 epoch: 35, train_loss: 0.6960, test_loss: 1.0725, test_f1: 0.5811
 epoch: 36, train_loss: 0.6697, test_loss: 1.0636, test_f1: 0.5633
 epoch: 37, train_loss: 0.6857, test_loss: 1.0498, test_f1: 0.5545
 epoch: 38, train_loss: 0.6842, test_loss: 0.9840, test_f1: 0.5985
 epoch: 39, train_loss: 0.6547, test_loss: 1.0436, test_f1: 0.5363
 epoch: 40, train_loss: 0.6549, test_loss: 1.0423, test_f1: 0.5712
 epoch: 41, train_loss: 0.6715, test_loss: 1.0542, test_f1: 0.5787
 epoch: 42, train_loss: 0.6431, test_loss: 1.1924, test_f1: 0.5586
 epoch: 43, train_loss: 0.6547, test_loss: 1.0401, test_f1: 0.5611
 epoch: 44, train_loss: 0.6610, test_loss: 1.1897, test_f1: 0.5301
 epoch: 45, train_loss: 0.6395, test_loss: 1.0754, test_f1: 0.5672
 epoch: 46, train_loss: 0.6071, test_loss: 1.1541, test_f1: 0.5601
 epoch: 47, train_loss: 0.6164, test_loss: 1.0479, test_f1: 0.5983
 epoch: 48, train_loss: 0.6192, test_loss: 1.1213, test_f1: 0.5376
 epoch: 49, train_loss: 0.6222, test_loss: 1.0219, test_f1: 0.5996
 epoch: 50, train_loss: 0.5631, test_loss: 1.2378, test_f1: 0.5513
 epoch: 51, train_loss: 0.5486, test_loss: 1.1705, test_f1: 0.5873
 epoch: 52, train_loss: 0.5528, test_loss: 1.1310, test_f1: 0.5840
 epoch: 53, train_loss: 0.5107, test_loss: 1.1881, test_f1: 0.5719
 epoch: 54, train_loss: 0.5178, test_loss: 1.1412, test_f1: 0.5817
 epoch: 55, train_loss: 0.5352, test_loss: 1.1427, test_f1: 0.5639
 epoch: 56, train_loss: 0.5034, test_loss: 1.1869, test_f1: 0.5521
 epoch: 57, train_loss: 0.4957, test_loss: 1.1429, test_f1: 0.6030
 epoch: 58, train_loss: 0.4957, test_loss: 1.2386, test_f1: 0.5762
 epoch: 59, train_loss: 0.5170, test_loss: 1.1602, test_f1: 0.5868
 epoch: 60, train_loss: 0.5013, test_loss: 1.1834, test_f1: 0.5909
 epoch: 61, train_loss: 0.4727, test_loss: 1.1830, test_f1: 0.5878
 epoch: 62, train_loss: 0.4673, test_loss: 1.1139, test_f1: 0.5959
 epoch: 63, train_loss: 0.4595, test_loss: 1.3738, test_f1: 0.5485
 epoch: 64, train_loss: 0.4592, test_loss: 1.2220, test_f1: 0.5845
 epoch: 65, train_loss: 0.4817, test_loss: 1.1745, test_f1: 0.5820
 epoch: 66, train_loss: 0.4746, test_loss: 1.1931, test_f1: 0.5554
 epoch: 67, train_loss: 0.4510, test_loss: 1.2207, test_f1: 0.5802
 epoch: 68, train_loss: 0.4461, test_loss: 1.3554, test_f1: 0.5491
 epoch: 69, train_loss: 0.4518, test_loss: 1.1932, test_f1: 0.5607
 epoch: 70, train_loss: 0.4455, test_loss: 1.2641, test_f1: 0.5747
 epoch: 71, train_loss: 0.4271, test_loss: 1.2201, test_f1: 0.6047
 epoch: 72, train_loss: 0.4356, test_loss: 1.3086, test_f1: 0.5768
 epoch: 73, train_loss: 0.4144, test_loss: 1.3424, test_f1: 0.5673
 epoch: 74, train_loss: 0.4325, test_loss: 1.2415, test_f1: 0.5941
 epoch: 75, train_loss: 0.4389, test_loss: 1.3751, test_f1: 0.5502
 epoch: 76, train_loss: 0.4194, test_loss: 1.4735, test_f1: 0.5501
 epoch: 77, train_loss: 0.4176, test_loss: 1.4040, test_f1: 0.5470
 epoch: 78, train_loss: 0.4055, test_loss: 1.4326, test_f1: 0.5607
 epoch: 79, train_loss: 0.4157, test_loss: 1.3343, test_f1: 0.5531
 epoch: 80, train_loss: 0.4394, test_loss: 1.2682, test_f1: 0.5924
 epoch: 81, train_loss: 0.4137, test_loss: 1.3065, test_f1: 0.5814
 epoch: 82, train_loss: 0.4174, test_loss: 1.3178, test_f1: 0.5783
 epoch: 83, train_loss: 0.3909, test_loss: 1.3288, test_f1: 0.5842
 epoch: 84, train_loss: 0.4051, test_loss: 1.3904, test_f1: 0.5613
 epoch: 85, train_loss: 0.3666, test_loss: 1.4331, test_f1: 0.5557
 epoch: 86, train_loss: 0.4155, test_loss: 1.3868, test_f1: 0.5547
 epoch: 87, train_loss: 0.3909, test_loss: 1.4627, test_f1: 0.5608
 epoch: 88, train_loss: 0.4217, test_loss: 1.2743, test_f1: 0.5726
 epoch: 89, train_loss: 0.3820, test_loss: 1.3046, test_f1: 0.5788
 epoch: 90, train_loss: 0.3756, test_loss: 1.3948, test_f1: 0.5661
 epoch: 91, train_loss: 0.3710, test_loss: 1.4789, test_f1: 0.5450
 epoch: 92, train_loss: 0.3882, test_loss: 1.3776, test_f1: 0.5599
 epoch: 93, train_loss: 0.3840, test_loss: 1.4766, test_f1: 0.5401
 epoch: 94, train_loss: 0.3785, test_loss: 1.4685, test_f1: 0.5477
 epoch: 95, train_loss: 0.3635, test_loss: 1.3863, test_f1: 0.5698
 epoch: 96, train_loss: 0.3564, test_loss: 1.5308, test_f1: 0.5651
 epoch: 97, train_loss: 0.3485, test_loss: 1.5642, test_f1: 0.5481
 epoch: 98, train_loss: 0.3545, test_loss: 1.4977, test_f1: 0.5728
 epoch: 99, train_loss: 0.3524, test_loss: 1.4752, test_f1: 0.5435

Training completed in 955.28 seconds
Best F1: 0.6159 at epoch 29
Mean F1 across iterations: 0.6032  0.0092
========================FINAL RESULTS================================
FEGIN weighted F1: 0.6159  0.0092
python main.py --data ltspice_examples --representation component_component --model FEGIN --layers 3 --hiddens 128 --batch_size 32 --lr 0.001 --emb_size 512 --epochs 100 --save_appendix component_component_L3_H128_BS32_LR0.001_E512 --no_val
-----



STDERR:
  File "main.py", line 370, in <module>
    main()
  File "main.py", line 254, in main
    dataset = dataset_class(
  File "/home/philip/projects/ltspice_examples_code_repo/Circuit-Completion-Using-GNNs/component_classification_with_link_prediction_head/evaluation/FEGIN/kernel/circuit_datasets.py", line 15, in __init__
    self.data, self.slices = torch.load(self.processed_paths[0])
  File "/home/philip/.local/lib/python3.8/site-packages/torch/serialization.py", line 1040, in load
    warnings.warn(
  File "/usr/lib/python3.8/warnings.py", line 109, in _showwarnmsg
    sw(msg.message, msg.category, msg.filename, msg.lineno,
  File "main.py", line 47, in warn_with_traceback
    traceback.print_stack(file=log)
/home/philip/projects/ltspice_examples_code_repo/Circuit-Completion-Using-GNNs/component_classification_with_link_prediction_head/evaluation/FEGIN/kernel/circuit_datasets.py:15: FutureWarning: You are using `torch.load` with `weights_only=False` (the current default value), which uses the default pickle module implicitly. It is possible to construct malicious pickle data which will execute arbitrary code during unpickling (See https://github.com/pytorch/pytorch/blob/main/SECURITY.md#untrusted-models for more details). In a future release, the default value for `weights_only` will be flipped to `True`. This limits the functions that could be executed during unpickling. Arbitrary objects will no longer be allowed to be loaded via this mode unless they are explicitly allowlisted by the user via `torch.serialization.add_safe_globals`. We recommend you start setting `weights_only=True` for any use case where you don't have full control of the loaded file. Please open an issue on GitHub for any issues related to this experimental feature.
  self.data, self.slices = torch.load(self.processed_paths[0])
