STDOUT:
Results will be saved in /home/philip/projects/ltspice_examples_code_repo/Circuit-Completion-Using-GNNs/component_classification_with_link_prediction_head/evaluation/FEGIN/results/model_FEGIN_dataset_ltspice_examples
Command line input: python main.py --data ltspice_examples --representation component_pin_net --model FEGIN --layers 2 --hiddens 64 --batch_size 32 --lr 0.001 --emb_size 128 --epochs 100 --save_appendix component_pin_net_L2_H64_BS32_LR0.001_E128 --no_val
 is saved.
-----
ltspice_examples - FEGIN
Using 2 layers, 64 hidden units, h = 2
Loading component_pin_net representation dataset
ENTERED
Training FEGIN on component_pin_net representation
Train: 3558, Test: 846
##################ITERATION #0 ****************************************
 epoch: 0, train_loss: 1.1704, test_loss: 0.9962, test_f1: 0.4727
 epoch: 1, train_loss: 0.9937, test_loss: 0.9989, test_f1: 0.4762
 epoch: 2, train_loss: 0.9688, test_loss: 0.9262, test_f1: 0.4765
 epoch: 3, train_loss: 0.9468, test_loss: 0.9087, test_f1: 0.5022
 epoch: 4, train_loss: 0.9231, test_loss: 0.8998, test_f1: 0.5395
 epoch: 5, train_loss: 0.9151, test_loss: 0.8784, test_f1: 0.5174
 epoch: 6, train_loss: 0.9023, test_loss: 0.8665, test_f1: 0.5145
 epoch: 7, train_loss: 0.8927, test_loss: 0.8523, test_f1: 0.5423
 epoch: 8, train_loss: 0.8656, test_loss: 0.8388, test_f1: 0.5438
 epoch: 9, train_loss: 0.8475, test_loss: 0.8544, test_f1: 0.5211
 epoch: 10, train_loss: 0.8278, test_loss: 0.8131, test_f1: 0.5545
 epoch: 11, train_loss: 0.8179, test_loss: 0.8529, test_f1: 0.5667
 epoch: 12, train_loss: 0.8160, test_loss: 0.9458, test_f1: 0.5196
 epoch: 13, train_loss: 0.8090, test_loss: 0.8608, test_f1: 0.5760
 epoch: 14, train_loss: 0.7814, test_loss: 0.7993, test_f1: 0.5915
 epoch: 15, train_loss: 0.7633, test_loss: 0.7834, test_f1: 0.6145
 epoch: 16, train_loss: 0.7625, test_loss: 0.7856, test_f1: 0.5741
 epoch: 17, train_loss: 0.7539, test_loss: 0.7821, test_f1: 0.6351
 epoch: 18, train_loss: 0.7475, test_loss: 0.8094, test_f1: 0.5978
 epoch: 19, train_loss: 0.7314, test_loss: 0.8574, test_f1: 0.5695
 epoch: 20, train_loss: 0.7283, test_loss: 0.7323, test_f1: 0.6391
 epoch: 21, train_loss: 0.7080, test_loss: 0.8137, test_f1: 0.5940
 epoch: 22, train_loss: 0.7021, test_loss: 0.8212, test_f1: 0.6249
 epoch: 23, train_loss: 0.6984, test_loss: 0.8023, test_f1: 0.6461
 epoch: 24, train_loss: 0.6849, test_loss: 0.8662, test_f1: 0.6476
 epoch: 25, train_loss: 0.6824, test_loss: 0.8447, test_f1: 0.6214
 epoch: 26, train_loss: 0.6778, test_loss: 0.9051, test_f1: 0.5980
 epoch: 27, train_loss: 0.6580, test_loss: 0.8133, test_f1: 0.5983
 epoch: 28, train_loss: 0.6692, test_loss: 0.8238, test_f1: 0.6155
 epoch: 29, train_loss: 0.6511, test_loss: 0.8048, test_f1: 0.6202
 epoch: 30, train_loss: 0.6565, test_loss: 0.8017, test_f1: 0.6427
 epoch: 31, train_loss: 0.6357, test_loss: 0.8140, test_f1: 0.6471
 epoch: 32, train_loss: 0.6269, test_loss: 0.8399, test_f1: 0.6404
 epoch: 33, train_loss: 0.6354, test_loss: 0.8056, test_f1: 0.6361
 epoch: 34, train_loss: 0.6136, test_loss: 0.8398, test_f1: 0.6616
 epoch: 35, train_loss: 0.6130, test_loss: 0.7852, test_f1: 0.6539
 epoch: 36, train_loss: 0.6026, test_loss: 0.7962, test_f1: 0.6526
 epoch: 37, train_loss: 0.6067, test_loss: 0.8411, test_f1: 0.6671
 epoch: 38, train_loss: 0.5863, test_loss: 0.8772, test_f1: 0.6706
 epoch: 39, train_loss: 0.5859, test_loss: 0.8810, test_f1: 0.6574
 epoch: 40, train_loss: 0.5829, test_loss: 0.8433, test_f1: 0.6480
 epoch: 41, train_loss: 0.5979, test_loss: 0.7879, test_f1: 0.6404
 epoch: 42, train_loss: 0.5759, test_loss: 0.8654, test_f1: 0.6761
 epoch: 43, train_loss: 0.5529, test_loss: 0.8902, test_f1: 0.6566
 epoch: 44, train_loss: 0.5742, test_loss: 0.8273, test_f1: 0.6570
 epoch: 45, train_loss: 0.5608, test_loss: 0.7975, test_f1: 0.6606
 epoch: 46, train_loss: 0.5488, test_loss: 0.8207, test_f1: 0.6639
 epoch: 47, train_loss: 0.5604, test_loss: 0.8783, test_f1: 0.6555
 epoch: 48, train_loss: 0.5469, test_loss: 0.8703, test_f1: 0.6792
 epoch: 49, train_loss: 0.5521, test_loss: 0.8542, test_f1: 0.6944
 epoch: 50, train_loss: 0.5380, test_loss: 0.8705, test_f1: 0.6732
 epoch: 51, train_loss: 0.5072, test_loss: 0.8390, test_f1: 0.6807
 epoch: 52, train_loss: 0.5038, test_loss: 0.8625, test_f1: 0.6887
 epoch: 53, train_loss: 0.4936, test_loss: 0.8976, test_f1: 0.6615
 epoch: 54, train_loss: 0.4796, test_loss: 0.8782, test_f1: 0.6925
 epoch: 55, train_loss: 0.4847, test_loss: 0.9264, test_f1: 0.6680
 epoch: 56, train_loss: 0.4813, test_loss: 0.8814, test_f1: 0.6981
 epoch: 57, train_loss: 0.4790, test_loss: 0.8751, test_f1: 0.7090
 epoch: 58, train_loss: 0.4860, test_loss: 0.8994, test_f1: 0.6990
 epoch: 59, train_loss: 0.4687, test_loss: 0.9384, test_f1: 0.6878
 epoch: 60, train_loss: 0.5089, test_loss: 0.9879, test_f1: 0.6521
 epoch: 61, train_loss: 0.4808, test_loss: 0.9321, test_f1: 0.6619
 epoch: 62, train_loss: 0.4649, test_loss: 0.9654, test_f1: 0.6958
 epoch: 63, train_loss: 0.4661, test_loss: 0.9727, test_f1: 0.6545
 epoch: 64, train_loss: 0.4597, test_loss: 0.9956, test_f1: 0.6791
 epoch: 65, train_loss: 0.4445, test_loss: 0.9857, test_f1: 0.6833
 epoch: 66, train_loss: 0.4564, test_loss: 0.9811, test_f1: 0.6788
 epoch: 67, train_loss: 0.4422, test_loss: 0.9977, test_f1: 0.6941
 epoch: 68, train_loss: 0.4470, test_loss: 0.9766, test_f1: 0.6821
 epoch: 69, train_loss: 0.4547, test_loss: 0.9787, test_f1: 0.6985
 epoch: 70, train_loss: 0.4179, test_loss: 0.9951, test_f1: 0.7060
 epoch: 71, train_loss: 0.4496, test_loss: 1.0535, test_f1: 0.6873
 epoch: 72, train_loss: 0.4452, test_loss: 0.9652, test_f1: 0.6812
 epoch: 73, train_loss: 0.4446, test_loss: 1.0012, test_f1: 0.6835
 epoch: 74, train_loss: 0.4249, test_loss: 0.9967, test_f1: 0.6788
 epoch: 75, train_loss: 0.4324, test_loss: 1.0323, test_f1: 0.7006
 epoch: 76, train_loss: 0.4307, test_loss: 1.0129, test_f1: 0.6735
 epoch: 77, train_loss: 0.4225, test_loss: 1.0009, test_f1: 0.6717
 epoch: 78, train_loss: 0.4215, test_loss: 1.1111, test_f1: 0.6602
 epoch: 79, train_loss: 0.4382, test_loss: 1.0388, test_f1: 0.6615
 epoch: 80, train_loss: 0.4377, test_loss: 1.0449, test_f1: 0.6849
 epoch: 81, train_loss: 0.4187, test_loss: 1.0241, test_f1: 0.6765
 epoch: 82, train_loss: 0.4220, test_loss: 1.0259, test_f1: 0.6833
 epoch: 83, train_loss: 0.4064, test_loss: 1.0932, test_f1: 0.6722
 epoch: 84, train_loss: 0.4061, test_loss: 1.0674, test_f1: 0.6896
 epoch: 85, train_loss: 0.3998, test_loss: 1.1406, test_f1: 0.6654
 epoch: 86, train_loss: 0.4073, test_loss: 1.1428, test_f1: 0.6691
 epoch: 87, train_loss: 0.3999, test_loss: 1.1311, test_f1: 0.6803
 epoch: 88, train_loss: 0.4042, test_loss: 1.2150, test_f1: 0.6599
 epoch: 89, train_loss: 0.3999, test_loss: 1.1272, test_f1: 0.6920
 epoch: 90, train_loss: 0.4070, test_loss: 1.2010, test_f1: 0.6810
 epoch: 91, train_loss: 0.4001, test_loss: 1.2135, test_f1: 0.6620
 epoch: 92, train_loss: 0.3911, test_loss: 1.1917, test_f1: 0.6717
 epoch: 93, train_loss: 0.3856, test_loss: 1.2531, test_f1: 0.6265
 epoch: 94, train_loss: 0.3984, test_loss: 1.1893, test_f1: 0.6801
 epoch: 95, train_loss: 0.3875, test_loss: 1.2393, test_f1: 0.6448
 epoch: 96, train_loss: 0.3959, test_loss: 1.1696, test_f1: 0.6779
 epoch: 97, train_loss: 0.3675, test_loss: 1.1964, test_f1: 0.6750
 epoch: 98, train_loss: 0.3990, test_loss: 1.2005, test_f1: 0.6557
 epoch: 99, train_loss: 0.3918, test_loss: 1.2417, test_f1: 0.6743
##################ITERATION #1 ****************************************
 epoch: 0, train_loss: 1.0781, test_loss: 1.0348, test_f1: 0.4858
 epoch: 1, train_loss: 0.9699, test_loss: 0.9456, test_f1: 0.5226
 epoch: 2, train_loss: 0.9390, test_loss: 0.9552, test_f1: 0.5289
 epoch: 3, train_loss: 0.9208, test_loss: 0.9415, test_f1: 0.5398
 epoch: 4, train_loss: 0.8892, test_loss: 0.8830, test_f1: 0.5486
 epoch: 5, train_loss: 0.8823, test_loss: 0.8614, test_f1: 0.5193
 epoch: 6, train_loss: 0.8598, test_loss: 0.8455, test_f1: 0.5334
 epoch: 7, train_loss: 0.8575, test_loss: 0.8052, test_f1: 0.5699
 epoch: 8, train_loss: 0.8245, test_loss: 0.7973, test_f1: 0.5522
 epoch: 9, train_loss: 0.8182, test_loss: 0.8167, test_f1: 0.5747
 epoch: 10, train_loss: 0.8132, test_loss: 0.7915, test_f1: 0.5788
 epoch: 11, train_loss: 0.7754, test_loss: 0.8467, test_f1: 0.5910
 epoch: 12, train_loss: 0.7750, test_loss: 0.7945, test_f1: 0.6458
 epoch: 13, train_loss: 0.7671, test_loss: 0.7674, test_f1: 0.6404
 epoch: 14, train_loss: 0.7578, test_loss: 0.8178, test_f1: 0.6287
 epoch: 15, train_loss: 0.7505, test_loss: 0.8387, test_f1: 0.6137
 epoch: 16, train_loss: 0.7336, test_loss: 0.7793, test_f1: 0.6125
 epoch: 17, train_loss: 0.7207, test_loss: 0.8528, test_f1: 0.6404
 epoch: 18, train_loss: 0.7145, test_loss: 0.8015, test_f1: 0.6474
 epoch: 19, train_loss: 0.7172, test_loss: 0.8170, test_f1: 0.6504
 epoch: 20, train_loss: 0.7055, test_loss: 0.7951, test_f1: 0.6628
 epoch: 21, train_loss: 0.6969, test_loss: 0.7724, test_f1: 0.6614
 epoch: 22, train_loss: 0.6843, test_loss: 0.7764, test_f1: 0.6349
 epoch: 23, train_loss: 0.6931, test_loss: 0.7699, test_f1: 0.6588
 epoch: 24, train_loss: 0.6811, test_loss: 0.7268, test_f1: 0.6556
 epoch: 25, train_loss: 0.6792, test_loss: 0.8035, test_f1: 0.6575
 epoch: 26, train_loss: 0.6817, test_loss: 0.7422, test_f1: 0.6569
 epoch: 27, train_loss: 0.6504, test_loss: 0.8385, test_f1: 0.6361
 epoch: 28, train_loss: 0.6479, test_loss: 0.8237, test_f1: 0.6703
 epoch: 29, train_loss: 0.6600, test_loss: 0.7847, test_f1: 0.6533
 epoch: 30, train_loss: 0.6417, test_loss: 0.8023, test_f1: 0.6641
 epoch: 31, train_loss: 0.6441, test_loss: 0.7599, test_f1: 0.6692
 epoch: 32, train_loss: 0.6452, test_loss: 0.8372, test_f1: 0.6586
 epoch: 33, train_loss: 0.6400, test_loss: 0.8242, test_f1: 0.6665
 epoch: 34, train_loss: 0.6286, test_loss: 0.8506, test_f1: 0.6524
 epoch: 35, train_loss: 0.6262, test_loss: 0.7774, test_f1: 0.6735
 epoch: 36, train_loss: 0.6053, test_loss: 0.7194, test_f1: 0.6871
 epoch: 37, train_loss: 0.6170, test_loss: 0.7599, test_f1: 0.6746
 epoch: 38, train_loss: 0.6136, test_loss: 0.7343, test_f1: 0.6558
 epoch: 39, train_loss: 0.6003, test_loss: 0.7983, test_f1: 0.6590
 epoch: 40, train_loss: 0.5946, test_loss: 0.8127, test_f1: 0.6640
 epoch: 41, train_loss: 0.5750, test_loss: 0.8231, test_f1: 0.6583
 epoch: 42, train_loss: 0.5932, test_loss: 0.8210, test_f1: 0.6572
 epoch: 43, train_loss: 0.5869, test_loss: 0.7281, test_f1: 0.6565
 epoch: 44, train_loss: 0.5874, test_loss: 0.7530, test_f1: 0.6896
 epoch: 45, train_loss: 0.5698, test_loss: 0.7713, test_f1: 0.6742
 epoch: 46, train_loss: 0.5582, test_loss: 0.7529, test_f1: 0.6667
 epoch: 47, train_loss: 0.5629, test_loss: 0.8070, test_f1: 0.6465
 epoch: 48, train_loss: 0.5633, test_loss: 0.7487, test_f1: 0.7045
 epoch: 49, train_loss: 0.5529, test_loss: 0.7790, test_f1: 0.6615
 epoch: 50, train_loss: 0.5495, test_loss: 0.7764, test_f1: 0.6707
 epoch: 51, train_loss: 0.5206, test_loss: 0.7377, test_f1: 0.6609
 epoch: 52, train_loss: 0.5118, test_loss: 0.7486, test_f1: 0.6726
 epoch: 53, train_loss: 0.5018, test_loss: 0.7455, test_f1: 0.6770
 epoch: 54, train_loss: 0.4995, test_loss: 0.7669, test_f1: 0.6505
 epoch: 55, train_loss: 0.5054, test_loss: 0.8592, test_f1: 0.6696
 epoch: 56, train_loss: 0.4974, test_loss: 0.8047, test_f1: 0.6680
 epoch: 57, train_loss: 0.4709, test_loss: 0.8152, test_f1: 0.6613
 epoch: 58, train_loss: 0.4726, test_loss: 0.7963, test_f1: 0.6728
 epoch: 59, train_loss: 0.5024, test_loss: 0.8283, test_f1: 0.6734
 epoch: 60, train_loss: 0.4776, test_loss: 0.7754, test_f1: 0.6816
 epoch: 61, train_loss: 0.4769, test_loss: 0.8252, test_f1: 0.6808
 epoch: 62, train_loss: 0.4891, test_loss: 0.7563, test_f1: 0.6679
 epoch: 63, train_loss: 0.4792, test_loss: 0.7813, test_f1: 0.6933
 epoch: 64, train_loss: 0.4786, test_loss: 0.7788, test_f1: 0.6753
 epoch: 65, train_loss: 0.4692, test_loss: 0.8277, test_f1: 0.6668
 epoch: 66, train_loss: 0.4595, test_loss: 0.8216, test_f1: 0.6681
 epoch: 67, train_loss: 0.4577, test_loss: 0.8073, test_f1: 0.6558
 epoch: 68, train_loss: 0.4669, test_loss: 0.8516, test_f1: 0.6613
 epoch: 69, train_loss: 0.4676, test_loss: 0.8631, test_f1: 0.6551
 epoch: 70, train_loss: 0.4435, test_loss: 0.8144, test_f1: 0.6886
 epoch: 71, train_loss: 0.4504, test_loss: 0.9241, test_f1: 0.6719
 epoch: 72, train_loss: 0.4622, test_loss: 0.8569, test_f1: 0.6794
 epoch: 73, train_loss: 0.4481, test_loss: 0.8742, test_f1: 0.6777
 epoch: 74, train_loss: 0.4529, test_loss: 0.8567, test_f1: 0.6903
 epoch: 75, train_loss: 0.4445, test_loss: 0.8740, test_f1: 0.6948
 epoch: 76, train_loss: 0.4300, test_loss: 0.8681, test_f1: 0.6899
 epoch: 77, train_loss: 0.4456, test_loss: 0.9433, test_f1: 0.6740
 epoch: 78, train_loss: 0.4248, test_loss: 0.8943, test_f1: 0.6831
 epoch: 79, train_loss: 0.4426, test_loss: 0.9498, test_f1: 0.6744
 epoch: 80, train_loss: 0.4189, test_loss: 1.0273, test_f1: 0.6753
 epoch: 81, train_loss: 0.4183, test_loss: 0.8732, test_f1: 0.6688
 epoch: 82, train_loss: 0.4194, test_loss: 0.8826, test_f1: 0.6794
 epoch: 83, train_loss: 0.4302, test_loss: 0.9354, test_f1: 0.6544
 epoch: 84, train_loss: 0.4267, test_loss: 0.9818, test_f1: 0.6897
 epoch: 85, train_loss: 0.4327, test_loss: 0.9066, test_f1: 0.6775
 epoch: 86, train_loss: 0.4196, test_loss: 0.8752, test_f1: 0.6873
 epoch: 87, train_loss: 0.4258, test_loss: 0.8830, test_f1: 0.6864
 epoch: 88, train_loss: 0.4102, test_loss: 0.8810, test_f1: 0.6932
 epoch: 89, train_loss: 0.4285, test_loss: 0.9633, test_f1: 0.6704
 epoch: 90, train_loss: 0.4040, test_loss: 0.9675, test_f1: 0.6736
 epoch: 91, train_loss: 0.4203, test_loss: 0.9516, test_f1: 0.6733
 epoch: 92, train_loss: 0.4139, test_loss: 0.9355, test_f1: 0.6705
 epoch: 93, train_loss: 0.4077, test_loss: 0.9106, test_f1: 0.6817
 epoch: 94, train_loss: 0.4097, test_loss: 0.9525, test_f1: 0.6721
 epoch: 95, train_loss: 0.3987, test_loss: 0.9208, test_f1: 0.6875
 epoch: 96, train_loss: 0.3881, test_loss: 1.0073, test_f1: 0.6827
 epoch: 97, train_loss: 0.3957, test_loss: 0.9680, test_f1: 0.6645
 epoch: 98, train_loss: 0.3947, test_loss: 1.0374, test_f1: 0.6689
 epoch: 99, train_loss: 0.4020, test_loss: 0.9853, test_f1: 0.6659
##################ITERATION #2 ****************************************
 epoch: 0, train_loss: 1.0924, test_loss: 0.9538, test_f1: 0.4917
 epoch: 1, train_loss: 0.9774, test_loss: 0.9606, test_f1: 0.4766
 epoch: 2, train_loss: 0.9364, test_loss: 0.9120, test_f1: 0.5291
 epoch: 3, train_loss: 0.9248, test_loss: 0.8948, test_f1: 0.5518
 epoch: 4, train_loss: 0.8963, test_loss: 0.8742, test_f1: 0.5215
 epoch: 5, train_loss: 0.8860, test_loss: 0.8636, test_f1: 0.5690
 epoch: 6, train_loss: 0.8693, test_loss: 0.8225, test_f1: 0.5465
 epoch: 7, train_loss: 0.8472, test_loss: 0.8367, test_f1: 0.5762
 epoch: 8, train_loss: 0.8286, test_loss: 0.8336, test_f1: 0.5804
 epoch: 9, train_loss: 0.8104, test_loss: 0.8691, test_f1: 0.6084
 epoch: 10, train_loss: 0.8091, test_loss: 0.7969, test_f1: 0.6284
 epoch: 11, train_loss: 0.7973, test_loss: 0.7605, test_f1: 0.6209
 epoch: 12, train_loss: 0.7791, test_loss: 0.7877, test_f1: 0.6181
 epoch: 13, train_loss: 0.7637, test_loss: 0.8356, test_f1: 0.6037
 epoch: 14, train_loss: 0.7571, test_loss: 0.7912, test_f1: 0.6427
 epoch: 15, train_loss: 0.7418, test_loss: 0.8127, test_f1: 0.6434
 epoch: 16, train_loss: 0.7322, test_loss: 0.8406, test_f1: 0.6468
 epoch: 17, train_loss: 0.7171, test_loss: 0.8212, test_f1: 0.6326
 epoch: 18, train_loss: 0.7465, test_loss: 0.7840, test_f1: 0.6525
 epoch: 19, train_loss: 0.7150, test_loss: 0.8244, test_f1: 0.6303
 epoch: 20, train_loss: 0.6983, test_loss: 0.8095, test_f1: 0.6384
 epoch: 21, train_loss: 0.6980, test_loss: 0.7912, test_f1: 0.6548
 epoch: 22, train_loss: 0.6872, test_loss: 0.7708, test_f1: 0.6547
 epoch: 23, train_loss: 0.6949, test_loss: 0.7613, test_f1: 0.6665
 epoch: 24, train_loss: 0.6772, test_loss: 0.7797, test_f1: 0.6523
 epoch: 25, train_loss: 0.6605, test_loss: 0.7496, test_f1: 0.6520
 epoch: 26, train_loss: 0.6721, test_loss: 0.8003, test_f1: 0.6572
 epoch: 27, train_loss: 0.6477, test_loss: 0.7660, test_f1: 0.6428
 epoch: 28, train_loss: 0.6460, test_loss: 0.7909, test_f1: 0.6555
 epoch: 29, train_loss: 0.6443, test_loss: 0.8057, test_f1: 0.6345
 epoch: 30, train_loss: 0.6386, test_loss: 0.7753, test_f1: 0.6472
 epoch: 31, train_loss: 0.6585, test_loss: 0.7730, test_f1: 0.6587
 epoch: 32, train_loss: 0.6264, test_loss: 0.8287, test_f1: 0.6510
 epoch: 33, train_loss: 0.6392, test_loss: 0.8599, test_f1: 0.6252
 epoch: 34, train_loss: 0.6536, test_loss: 0.8524, test_f1: 0.6319
 epoch: 35, train_loss: 0.6251, test_loss: 0.8113, test_f1: 0.6451
 epoch: 36, train_loss: 0.6047, test_loss: 0.8366, test_f1: 0.6667
 epoch: 37, train_loss: 0.6084, test_loss: 0.7787, test_f1: 0.6430
 epoch: 38, train_loss: 0.6027, test_loss: 0.8639, test_f1: 0.6628
 epoch: 39, train_loss: 0.5992, test_loss: 0.8118, test_f1: 0.6702
 epoch: 40, train_loss: 0.5919, test_loss: 0.7881, test_f1: 0.6707
 epoch: 41, train_loss: 0.5944, test_loss: 0.8140, test_f1: 0.6773
 epoch: 42, train_loss: 0.5759, test_loss: 0.8035, test_f1: 0.6538
 epoch: 43, train_loss: 0.5700, test_loss: 0.8614, test_f1: 0.6693
 epoch: 44, train_loss: 0.5752, test_loss: 0.9508, test_f1: 0.6350
 epoch: 45, train_loss: 0.5888, test_loss: 0.8747, test_f1: 0.6619
 epoch: 46, train_loss: 0.5632, test_loss: 0.8311, test_f1: 0.6788
 epoch: 47, train_loss: 0.5831, test_loss: 0.9056, test_f1: 0.6418
 epoch: 48, train_loss: 0.5613, test_loss: 0.8507, test_f1: 0.6781
 epoch: 49, train_loss: 0.5483, test_loss: 0.8672, test_f1: 0.6705
 epoch: 50, train_loss: 0.5563, test_loss: 0.8217, test_f1: 0.6607
 epoch: 51, train_loss: 0.5333, test_loss: 0.8326, test_f1: 0.6908
 epoch: 52, train_loss: 0.5064, test_loss: 0.8637, test_f1: 0.6520
 epoch: 53, train_loss: 0.5059, test_loss: 0.8850, test_f1: 0.6695
 epoch: 54, train_loss: 0.4907, test_loss: 0.9015, test_f1: 0.6752
 epoch: 55, train_loss: 0.4984, test_loss: 0.8663, test_f1: 0.6958
 epoch: 56, train_loss: 0.4923, test_loss: 0.9005, test_f1: 0.6678
 epoch: 57, train_loss: 0.4844, test_loss: 0.9366, test_f1: 0.6694
 epoch: 58, train_loss: 0.5005, test_loss: 0.8512, test_f1: 0.6977
 epoch: 59, train_loss: 0.4852, test_loss: 0.8438, test_f1: 0.6827
 epoch: 60, train_loss: 0.4752, test_loss: 0.8886, test_f1: 0.6870
 epoch: 61, train_loss: 0.4782, test_loss: 0.9258, test_f1: 0.6821
 epoch: 62, train_loss: 0.4652, test_loss: 0.9322, test_f1: 0.6675
 epoch: 63, train_loss: 0.4491, test_loss: 0.9397, test_f1: 0.6900
 epoch: 64, train_loss: 0.4687, test_loss: 0.9390, test_f1: 0.6869
 epoch: 65, train_loss: 0.4529, test_loss: 0.9841, test_f1: 0.6631
 epoch: 66, train_loss: 0.4492, test_loss: 0.9070, test_f1: 0.6793
 epoch: 67, train_loss: 0.4498, test_loss: 0.9077, test_f1: 0.6776
 epoch: 68, train_loss: 0.4579, test_loss: 0.9070, test_f1: 0.6725
 epoch: 69, train_loss: 0.4437, test_loss: 1.0163, test_f1: 0.6608
 epoch: 70, train_loss: 0.4529, test_loss: 0.9977, test_f1: 0.6749
 epoch: 71, train_loss: 0.4389, test_loss: 0.9214, test_f1: 0.7003
 epoch: 72, train_loss: 0.4558, test_loss: 1.0376, test_f1: 0.6656
 epoch: 73, train_loss: 0.4318, test_loss: 0.9437, test_f1: 0.6708
 epoch: 74, train_loss: 0.4365, test_loss: 0.9582, test_f1: 0.6876
 epoch: 75, train_loss: 0.4228, test_loss: 0.9921, test_f1: 0.6758
 epoch: 76, train_loss: 0.4305, test_loss: 0.9800, test_f1: 0.6872
 epoch: 77, train_loss: 0.4367, test_loss: 0.9658, test_f1: 0.6748
 epoch: 78, train_loss: 0.4328, test_loss: 0.9992, test_f1: 0.6759
 epoch: 79, train_loss: 0.4165, test_loss: 0.9818, test_f1: 0.6750
 epoch: 80, train_loss: 0.4437, test_loss: 1.0152, test_f1: 0.6687
 epoch: 81, train_loss: 0.4207, test_loss: 0.9551, test_f1: 0.6908
 epoch: 82, train_loss: 0.4111, test_loss: 0.9904, test_f1: 0.6904
 epoch: 83, train_loss: 0.4073, test_loss: 0.9748, test_f1: 0.6894
 epoch: 84, train_loss: 0.4244, test_loss: 1.0022, test_f1: 0.6731
 epoch: 85, train_loss: 0.4280, test_loss: 1.0857, test_f1: 0.6775
 epoch: 86, train_loss: 0.4150, test_loss: 1.0639, test_f1: 0.6747
 epoch: 87, train_loss: 0.4026, test_loss: 1.0988, test_f1: 0.6665
 epoch: 88, train_loss: 0.4098, test_loss: 1.0861, test_f1: 0.6920
 epoch: 89, train_loss: 0.4012, test_loss: 1.0535, test_f1: 0.6867
 epoch: 90, train_loss: 0.4007, test_loss: 1.0369, test_f1: 0.6851
 epoch: 91, train_loss: 0.4046, test_loss: 1.0890, test_f1: 0.6697
 epoch: 92, train_loss: 0.4066, test_loss: 1.0461, test_f1: 0.6812
 epoch: 93, train_loss: 0.4051, test_loss: 1.0649, test_f1: 0.6677
 epoch: 94, train_loss: 0.4000, test_loss: 1.0072, test_f1: 0.6841
 epoch: 95, train_loss: 0.4022, test_loss: 1.0965, test_f1: 0.6742
 epoch: 96, train_loss: 0.3850, test_loss: 1.1501, test_f1: 0.6625
 epoch: 97, train_loss: 0.3875, test_loss: 1.0690, test_f1: 0.6798
 epoch: 98, train_loss: 0.3751, test_loss: 1.1575, test_f1: 0.6873
 epoch: 99, train_loss: 0.3674, test_loss: 1.1352, test_f1: 0.6800
##################ITERATION #3 ****************************************
 epoch: 0, train_loss: 1.1391, test_loss: 0.9861, test_f1: 0.5109
 epoch: 1, train_loss: 0.9759, test_loss: 0.9856, test_f1: 0.5402
 epoch: 2, train_loss: 0.9351, test_loss: 0.9056, test_f1: 0.5662
 epoch: 3, train_loss: 0.9091, test_loss: 0.8500, test_f1: 0.5436
 epoch: 4, train_loss: 0.8878, test_loss: 0.8968, test_f1: 0.5362
 epoch: 5, train_loss: 0.8704, test_loss: 0.8564, test_f1: 0.6127
 epoch: 6, train_loss: 0.8485, test_loss: 0.8551, test_f1: 0.5674
 epoch: 7, train_loss: 0.8242, test_loss: 0.8237, test_f1: 0.6171
 epoch: 8, train_loss: 0.8184, test_loss: 0.7870, test_f1: 0.6284
 epoch: 9, train_loss: 0.8152, test_loss: 0.8418, test_f1: 0.6126
 epoch: 10, train_loss: 0.7940, test_loss: 0.7748, test_f1: 0.6274
 epoch: 11, train_loss: 0.7872, test_loss: 0.7846, test_f1: 0.6116
 epoch: 12, train_loss: 0.7716, test_loss: 0.7892, test_f1: 0.6548
 epoch: 13, train_loss: 0.7593, test_loss: 0.8781, test_f1: 0.5970
 epoch: 14, train_loss: 0.7782, test_loss: 0.8082, test_f1: 0.6141
 epoch: 15, train_loss: 0.7313, test_loss: 0.8226, test_f1: 0.6266
 epoch: 16, train_loss: 0.7398, test_loss: 0.7816, test_f1: 0.6529
 epoch: 17, train_loss: 0.7233, test_loss: 0.8551, test_f1: 0.6176
 epoch: 18, train_loss: 0.7278, test_loss: 0.7676, test_f1: 0.6311
 epoch: 19, train_loss: 0.7012, test_loss: 0.7604, test_f1: 0.6661
 epoch: 20, train_loss: 0.6972, test_loss: 0.7985, test_f1: 0.6466
 epoch: 21, train_loss: 0.7002, test_loss: 0.7943, test_f1: 0.6504
 epoch: 22, train_loss: 0.6832, test_loss: 0.7610, test_f1: 0.6541
 epoch: 23, train_loss: 0.6791, test_loss: 0.7895, test_f1: 0.6706
 epoch: 24, train_loss: 0.6723, test_loss: 0.8375, test_f1: 0.6371
 epoch: 25, train_loss: 0.6625, test_loss: 0.7282, test_f1: 0.6708
 epoch: 26, train_loss: 0.6600, test_loss: 0.8054, test_f1: 0.6524
 epoch: 27, train_loss: 0.6612, test_loss: 0.8217, test_f1: 0.6465
 epoch: 28, train_loss: 0.6518, test_loss: 0.8883, test_f1: 0.6715
 epoch: 29, train_loss: 0.6478, test_loss: 0.8153, test_f1: 0.6564
 epoch: 30, train_loss: 0.6436, test_loss: 0.7518, test_f1: 0.6588
 epoch: 31, train_loss: 0.6259, test_loss: 0.7855, test_f1: 0.6581
 epoch: 32, train_loss: 0.6325, test_loss: 0.8026, test_f1: 0.6713
 epoch: 33, train_loss: 0.6372, test_loss: 0.7921, test_f1: 0.6471
 epoch: 34, train_loss: 0.5992, test_loss: 0.8496, test_f1: 0.6575
 epoch: 35, train_loss: 0.6043, test_loss: 0.8632, test_f1: 0.6563
 epoch: 36, train_loss: 0.6196, test_loss: 0.7632, test_f1: 0.6694
 epoch: 37, train_loss: 0.5882, test_loss: 0.8045, test_f1: 0.6584
 epoch: 38, train_loss: 0.5898, test_loss: 0.8266, test_f1: 0.6445
 epoch: 39, train_loss: 0.5895, test_loss: 0.8166, test_f1: 0.6246
 epoch: 40, train_loss: 0.5751, test_loss: 0.8619, test_f1: 0.6603
 epoch: 41, train_loss: 0.5687, test_loss: 0.9196, test_f1: 0.6647
 epoch: 42, train_loss: 0.5731, test_loss: 0.8182, test_f1: 0.6865
 epoch: 43, train_loss: 0.5482, test_loss: 0.9091, test_f1: 0.6519
 epoch: 44, train_loss: 0.5582, test_loss: 0.8532, test_f1: 0.6708
 epoch: 45, train_loss: 0.5527, test_loss: 0.8211, test_f1: 0.6519
 epoch: 46, train_loss: 0.5436, test_loss: 0.8029, test_f1: 0.6708
 epoch: 47, train_loss: 0.5463, test_loss: 0.8394, test_f1: 0.6949
 epoch: 48, train_loss: 0.5306, test_loss: 0.8662, test_f1: 0.6700
 epoch: 49, train_loss: 0.5212, test_loss: 0.8464, test_f1: 0.6668
 epoch: 50, train_loss: 0.5328, test_loss: 0.9399, test_f1: 0.6475
 epoch: 51, train_loss: 0.4943, test_loss: 0.8481, test_f1: 0.6831
 epoch: 52, train_loss: 0.4933, test_loss: 0.8572, test_f1: 0.6732
 epoch: 53, train_loss: 0.4918, test_loss: 0.8416, test_f1: 0.7018
 epoch: 54, train_loss: 0.4556, test_loss: 0.8287, test_f1: 0.7002
 epoch: 55, train_loss: 0.4799, test_loss: 0.9190, test_f1: 0.6719
 epoch: 56, train_loss: 0.4763, test_loss: 0.9332, test_f1: 0.6757
 epoch: 57, train_loss: 0.4827, test_loss: 0.9592, test_f1: 0.6653
 epoch: 58, train_loss: 0.4636, test_loss: 0.8957, test_f1: 0.6675
 epoch: 59, train_loss: 0.4645, test_loss: 0.9087, test_f1: 0.6949
 epoch: 60, train_loss: 0.4598, test_loss: 0.9415, test_f1: 0.6715
 epoch: 61, train_loss: 0.4667, test_loss: 0.9848, test_f1: 0.6712
 epoch: 62, train_loss: 0.4539, test_loss: 0.9296, test_f1: 0.6903
 epoch: 63, train_loss: 0.4529, test_loss: 0.9363, test_f1: 0.7045
 epoch: 64, train_loss: 0.4388, test_loss: 0.9814, test_f1: 0.6646
 epoch: 65, train_loss: 0.4420, test_loss: 0.9663, test_f1: 0.6953
 epoch: 66, train_loss: 0.4481, test_loss: 0.9375, test_f1: 0.6808
 epoch: 67, train_loss: 0.4355, test_loss: 0.9275, test_f1: 0.6859
 epoch: 68, train_loss: 0.4281, test_loss: 0.9864, test_f1: 0.6797
 epoch: 69, train_loss: 0.4302, test_loss: 0.9968, test_f1: 0.6773
 epoch: 70, train_loss: 0.4552, test_loss: 0.9772, test_f1: 0.6731
 epoch: 71, train_loss: 0.4499, test_loss: 0.9344, test_f1: 0.6967
 epoch: 72, train_loss: 0.4232, test_loss: 0.9129, test_f1: 0.6925
 epoch: 73, train_loss: 0.4141, test_loss: 0.9266, test_f1: 0.7105
 epoch: 74, train_loss: 0.4241, test_loss: 0.9583, test_f1: 0.6882
 epoch: 75, train_loss: 0.4174, test_loss: 0.9693, test_f1: 0.6919
 epoch: 76, train_loss: 0.4140, test_loss: 1.0405, test_f1: 0.6931
 epoch: 77, train_loss: 0.4138, test_loss: 1.0069, test_f1: 0.6769
 epoch: 78, train_loss: 0.4047, test_loss: 1.0330, test_f1: 0.6897
 epoch: 79, train_loss: 0.4137, test_loss: 1.0071, test_f1: 0.6734
 epoch: 80, train_loss: 0.4022, test_loss: 1.0437, test_f1: 0.6738
 epoch: 81, train_loss: 0.4128, test_loss: 1.0054, test_f1: 0.6711
 epoch: 82, train_loss: 0.4110, test_loss: 1.0183, test_f1: 0.6807
 epoch: 83, train_loss: 0.4175, test_loss: 0.9485, test_f1: 0.6876
 epoch: 84, train_loss: 0.4048, test_loss: 0.9675, test_f1: 0.6946
 epoch: 85, train_loss: 0.4108, test_loss: 1.0394, test_f1: 0.6795
 epoch: 86, train_loss: 0.4020, test_loss: 1.0585, test_f1: 0.6781
 epoch: 87, train_loss: 0.3995, test_loss: 1.0361, test_f1: 0.6993
 epoch: 88, train_loss: 0.3928, test_loss: 1.0386, test_f1: 0.6763
 epoch: 89, train_loss: 0.3863, test_loss: 1.0016, test_f1: 0.6776
 epoch: 90, train_loss: 0.3852, test_loss: 0.9966, test_f1: 0.6874
 epoch: 91, train_loss: 0.3998, test_loss: 1.0326, test_f1: 0.6864
 epoch: 92, train_loss: 0.3854, test_loss: 1.0374, test_f1: 0.7051
 epoch: 93, train_loss: 0.3909, test_loss: 1.1013, test_f1: 0.6759
 epoch: 94, train_loss: 0.4016, test_loss: 1.0006, test_f1: 0.6823
 epoch: 95, train_loss: 0.3870, test_loss: 1.0771, test_f1: 0.6792
 epoch: 96, train_loss: 0.3835, test_loss: 1.0185, test_f1: 0.6862
 epoch: 97, train_loss: 0.4045, test_loss: 1.0391, test_f1: 0.6935
 epoch: 98, train_loss: 0.3803, test_loss: 1.0146, test_f1: 0.6750
 epoch: 99, train_loss: 0.3711, test_loss: 1.0317, test_f1: 0.6691
##################ITERATION #4 ****************************************
 epoch: 0, train_loss: 1.1878, test_loss: 1.0173, test_f1: 0.4918
 epoch: 1, train_loss: 0.9905, test_loss: 0.9859, test_f1: 0.5095
 epoch: 2, train_loss: 0.9577, test_loss: 0.9281, test_f1: 0.5197
 epoch: 3, train_loss: 0.9303, test_loss: 0.9152, test_f1: 0.4933
 epoch: 4, train_loss: 0.9116, test_loss: 0.9239, test_f1: 0.5361
 epoch: 5, train_loss: 0.8906, test_loss: 0.8533, test_f1: 0.5494
 epoch: 6, train_loss: 0.8844, test_loss: 0.8818, test_f1: 0.5879
 epoch: 7, train_loss: 0.8664, test_loss: 0.8603, test_f1: 0.5863
 epoch: 8, train_loss: 0.8473, test_loss: 0.8359, test_f1: 0.5575
 epoch: 9, train_loss: 0.8373, test_loss: 0.7820, test_f1: 0.6018
 epoch: 10, train_loss: 0.8184, test_loss: 0.8316, test_f1: 0.5944
 epoch: 11, train_loss: 0.7948, test_loss: 0.8390, test_f1: 0.6165
 epoch: 12, train_loss: 0.7960, test_loss: 0.8009, test_f1: 0.5834
 epoch: 13, train_loss: 0.7798, test_loss: 0.7974, test_f1: 0.6175
 epoch: 14, train_loss: 0.7870, test_loss: 0.8364, test_f1: 0.6106
 epoch: 15, train_loss: 0.7709, test_loss: 0.8022, test_f1: 0.5933
 epoch: 16, train_loss: 0.7687, test_loss: 0.8325, test_f1: 0.6588
 epoch: 17, train_loss: 0.7469, test_loss: 0.8056, test_f1: 0.6340
 epoch: 18, train_loss: 0.7352, test_loss: 0.7941, test_f1: 0.6313
 epoch: 19, train_loss: 0.7389, test_loss: 0.8019, test_f1: 0.6368
 epoch: 20, train_loss: 0.7296, test_loss: 0.8084, test_f1: 0.6252
 epoch: 21, train_loss: 0.7018, test_loss: 0.8756, test_f1: 0.6430
 epoch: 22, train_loss: 0.6988, test_loss: 0.8129, test_f1: 0.6470
 epoch: 23, train_loss: 0.7174, test_loss: 0.7755, test_f1: 0.6393
 epoch: 24, train_loss: 0.7065, test_loss: 0.8599, test_f1: 0.6236
 epoch: 25, train_loss: 0.6834, test_loss: 0.8179, test_f1: 0.6485
 epoch: 26, train_loss: 0.6728, test_loss: 0.7827, test_f1: 0.6620
 epoch: 27, train_loss: 0.6785, test_loss: 0.7992, test_f1: 0.6697
 epoch: 28, train_loss: 0.6725, test_loss: 0.8110, test_f1: 0.6548
 epoch: 29, train_loss: 0.6676, test_loss: 0.8204, test_f1: 0.6660
 epoch: 30, train_loss: 0.6632, test_loss: 0.7906, test_f1: 0.6324
 epoch: 31, train_loss: 0.6378, test_loss: 0.7967, test_f1: 0.6497
 epoch: 32, train_loss: 0.6453, test_loss: 0.8117, test_f1: 0.6337
 epoch: 33, train_loss: 0.6555, test_loss: 0.8428, test_f1: 0.6794
 epoch: 34, train_loss: 0.6397, test_loss: 0.8657, test_f1: 0.6402
 epoch: 35, train_loss: 0.6292, test_loss: 0.8192, test_f1: 0.6637
 epoch: 36, train_loss: 0.6313, test_loss: 0.8110, test_f1: 0.6632
 epoch: 37, train_loss: 0.6015, test_loss: 0.8029, test_f1: 0.6445
 epoch: 38, train_loss: 0.6188, test_loss: 0.8607, test_f1: 0.6714
 epoch: 39, train_loss: 0.6133, test_loss: 0.8556, test_f1: 0.6436
 epoch: 40, train_loss: 0.6029, test_loss: 0.8089, test_f1: 0.6471
 epoch: 41, train_loss: 0.6040, test_loss: 0.8123, test_f1: 0.6579
 epoch: 42, train_loss: 0.5914, test_loss: 0.8117, test_f1: 0.6643
 epoch: 43, train_loss: 0.6020, test_loss: 0.7925, test_f1: 0.6867
 epoch: 44, train_loss: 0.5593, test_loss: 0.8499, test_f1: 0.6756
 epoch: 45, train_loss: 0.5891, test_loss: 0.8617, test_f1: 0.6481
 epoch: 46, train_loss: 0.5732, test_loss: 0.9773, test_f1: 0.6105
 epoch: 47, train_loss: 0.6003, test_loss: 0.8151, test_f1: 0.6644
 epoch: 48, train_loss: 0.5613, test_loss: 0.8343, test_f1: 0.6553
 epoch: 49, train_loss: 0.5546, test_loss: 0.8342, test_f1: 0.6645
 epoch: 50, train_loss: 0.5550, test_loss: 0.8705, test_f1: 0.6734
 epoch: 51, train_loss: 0.5239, test_loss: 0.8765, test_f1: 0.6690
 epoch: 52, train_loss: 0.5254, test_loss: 0.8626, test_f1: 0.6573
 epoch: 53, train_loss: 0.5232, test_loss: 0.8495, test_f1: 0.6588
 epoch: 54, train_loss: 0.5066, test_loss: 0.8087, test_f1: 0.6769
 epoch: 55, train_loss: 0.5010, test_loss: 0.8618, test_f1: 0.6745
 epoch: 56, train_loss: 0.4998, test_loss: 0.8690, test_f1: 0.6604
 epoch: 57, train_loss: 0.4790, test_loss: 0.8884, test_f1: 0.6767
 epoch: 58, train_loss: 0.4984, test_loss: 0.9039, test_f1: 0.6585
 epoch: 59, train_loss: 0.4812, test_loss: 0.8962, test_f1: 0.6670
 epoch: 60, train_loss: 0.4691, test_loss: 0.9058, test_f1: 0.6601
 epoch: 61, train_loss: 0.4716, test_loss: 0.9534, test_f1: 0.6774
 epoch: 62, train_loss: 0.4850, test_loss: 0.9739, test_f1: 0.6559
 epoch: 63, train_loss: 0.4793, test_loss: 0.9113, test_f1: 0.6579
 epoch: 64, train_loss: 0.4782, test_loss: 0.9005, test_f1: 0.6567
 epoch: 65, train_loss: 0.4822, test_loss: 0.9137, test_f1: 0.6715
 epoch: 66, train_loss: 0.4897, test_loss: 0.9362, test_f1: 0.6595
 epoch: 67, train_loss: 0.4576, test_loss: 0.9251, test_f1: 0.6496
 epoch: 68, train_loss: 0.4645, test_loss: 0.9526, test_f1: 0.6588
 epoch: 69, train_loss: 0.4544, test_loss: 0.9729, test_f1: 0.6616
 epoch: 70, train_loss: 0.4529, test_loss: 0.9560, test_f1: 0.6616
 epoch: 71, train_loss: 0.4618, test_loss: 0.9581, test_f1: 0.6609
 epoch: 72, train_loss: 0.4645, test_loss: 0.9202, test_f1: 0.6569
 epoch: 73, train_loss: 0.4541, test_loss: 0.9428, test_f1: 0.6537
 epoch: 74, train_loss: 0.4381, test_loss: 0.9689, test_f1: 0.6656
 epoch: 75, train_loss: 0.4351, test_loss: 0.9799, test_f1: 0.6695
 epoch: 76, train_loss: 0.4390, test_loss: 1.0158, test_f1: 0.6408
 epoch: 77, train_loss: 0.4558, test_loss: 0.9552, test_f1: 0.6512
 epoch: 78, train_loss: 0.4346, test_loss: 0.9755, test_f1: 0.6521
 epoch: 79, train_loss: 0.4444, test_loss: 1.0933, test_f1: 0.6467
 epoch: 80, train_loss: 0.4374, test_loss: 0.9810, test_f1: 0.6657
 epoch: 81, train_loss: 0.4378, test_loss: 0.9496, test_f1: 0.6660
 epoch: 82, train_loss: 0.4262, test_loss: 1.0047, test_f1: 0.6620
 epoch: 83, train_loss: 0.4288, test_loss: 1.0382, test_f1: 0.6691
 epoch: 84, train_loss: 0.4259, test_loss: 0.9870, test_f1: 0.6432
 epoch: 85, train_loss: 0.4239, test_loss: 1.0133, test_f1: 0.6358
 epoch: 86, train_loss: 0.4220, test_loss: 0.9955, test_f1: 0.6683
 epoch: 87, train_loss: 0.4253, test_loss: 1.0131, test_f1: 0.6755
 epoch: 88, train_loss: 0.4274, test_loss: 0.9694, test_f1: 0.6738
 epoch: 89, train_loss: 0.4069, test_loss: 1.0719, test_f1: 0.6481
 epoch: 90, train_loss: 0.4157, test_loss: 1.0483, test_f1: 0.6637
 epoch: 91, train_loss: 0.4096, test_loss: 1.0623, test_f1: 0.6653
 epoch: 92, train_loss: 0.4132, test_loss: 1.0920, test_f1: 0.6664
 epoch: 93, train_loss: 0.4292, test_loss: 1.0388, test_f1: 0.6672
 epoch: 94, train_loss: 0.3920, test_loss: 1.0383, test_f1: 0.6608
 epoch: 95, train_loss: 0.4059, test_loss: 1.0692, test_f1: 0.6610
 epoch: 96, train_loss: 0.4054, test_loss: 1.0621, test_f1: 0.6644
 epoch: 97, train_loss: 0.3990, test_loss: 1.0228, test_f1: 0.6682
 epoch: 98, train_loss: 0.3972, test_loss: 1.0984, test_f1: 0.6633
 epoch: 99, train_loss: 0.4153, test_loss: 1.0757, test_f1: 0.6603
##################ITERATION #5 ****************************************
 epoch: 0, train_loss: 1.1553, test_loss: 0.9783, test_f1: 0.5033
 epoch: 1, train_loss: 0.9848, test_loss: 0.9575, test_f1: 0.5483
 epoch: 2, train_loss: 0.9544, test_loss: 0.9406, test_f1: 0.5358
 epoch: 3, train_loss: 0.9275, test_loss: 0.9049, test_f1: 0.5354
 epoch: 4, train_loss: 0.9178, test_loss: 0.8881, test_f1: 0.5393
 epoch: 5, train_loss: 0.9045, test_loss: 0.8602, test_f1: 0.5508
 epoch: 6, train_loss: 0.8746, test_loss: 0.8471, test_f1: 0.5716
 epoch: 7, train_loss: 0.8640, test_loss: 0.8222, test_f1: 0.5859
 epoch: 8, train_loss: 0.8530, test_loss: 0.9379, test_f1: 0.5180
 epoch: 9, train_loss: 0.8578, test_loss: 0.8355, test_f1: 0.5773
 epoch: 10, train_loss: 0.8310, test_loss: 0.9126, test_f1: 0.5678
 epoch: 11, train_loss: 0.8212, test_loss: 0.7990, test_f1: 0.5884
 epoch: 12, train_loss: 0.8222, test_loss: 0.8505, test_f1: 0.6204
 epoch: 13, train_loss: 0.7932, test_loss: 0.8138, test_f1: 0.6148
 epoch: 14, train_loss: 0.7748, test_loss: 0.7979, test_f1: 0.6455
 epoch: 15, train_loss: 0.7836, test_loss: 0.7776, test_f1: 0.6476
 epoch: 16, train_loss: 0.7771, test_loss: 0.7969, test_f1: 0.6280
 epoch: 17, train_loss: 0.7535, test_loss: 0.7499, test_f1: 0.6272
 epoch: 18, train_loss: 0.7503, test_loss: 0.8342, test_f1: 0.6106
 epoch: 19, train_loss: 0.7727, test_loss: 0.8269, test_f1: 0.6008
 epoch: 20, train_loss: 0.7426, test_loss: 0.8203, test_f1: 0.6101
 epoch: 21, train_loss: 0.7337, test_loss: 0.7686, test_f1: 0.6270
 epoch: 22, train_loss: 0.7347, test_loss: 0.7696, test_f1: 0.6210
 epoch: 23, train_loss: 0.7097, test_loss: 0.8030, test_f1: 0.6451
 epoch: 24, train_loss: 0.7132, test_loss: 0.8199, test_f1: 0.6266
 epoch: 25, train_loss: 0.6906, test_loss: 0.7721, test_f1: 0.6300
 epoch: 26, train_loss: 0.6976, test_loss: 0.8292, test_f1: 0.6177
 epoch: 27, train_loss: 0.6953, test_loss: 0.7538, test_f1: 0.6771
 epoch: 28, train_loss: 0.6768, test_loss: 0.7722, test_f1: 0.6576
 epoch: 29, train_loss: 0.6639, test_loss: 0.7904, test_f1: 0.6699
 epoch: 30, train_loss: 0.6753, test_loss: 0.7916, test_f1: 0.6615
 epoch: 31, train_loss: 0.6595, test_loss: 0.7802, test_f1: 0.6359
 epoch: 32, train_loss: 0.6661, test_loss: 0.7982, test_f1: 0.6340
 epoch: 33, train_loss: 0.6586, test_loss: 0.7870, test_f1: 0.6377
 epoch: 34, train_loss: 0.6425, test_loss: 0.8133, test_f1: 0.6629
 epoch: 35, train_loss: 0.6621, test_loss: 0.7760, test_f1: 0.6617
 epoch: 36, train_loss: 0.6118, test_loss: 0.8485, test_f1: 0.6572
 epoch: 37, train_loss: 0.6158, test_loss: 0.7924, test_f1: 0.6641
 epoch: 38, train_loss: 0.6146, test_loss: 0.8750, test_f1: 0.6496
 epoch: 39, train_loss: 0.6171, test_loss: 0.7566, test_f1: 0.6399
 epoch: 40, train_loss: 0.6125, test_loss: 0.7688, test_f1: 0.6600
 epoch: 41, train_loss: 0.6008, test_loss: 0.7674, test_f1: 0.6486
 epoch: 42, train_loss: 0.6107, test_loss: 0.8439, test_f1: 0.6542
 epoch: 43, train_loss: 0.6072, test_loss: 0.8299, test_f1: 0.6325
 epoch: 44, train_loss: 0.5982, test_loss: 0.8296, test_f1: 0.6437
 epoch: 45, train_loss: 0.5893, test_loss: 0.8344, test_f1: 0.6597
 epoch: 46, train_loss: 0.5825, test_loss: 0.8050, test_f1: 0.6560
 epoch: 47, train_loss: 0.5818, test_loss: 0.7702, test_f1: 0.6807
 epoch: 48, train_loss: 0.5503, test_loss: 0.8930, test_f1: 0.6655
 epoch: 49, train_loss: 0.5765, test_loss: 0.8224, test_f1: 0.6649
 epoch: 50, train_loss: 0.5515, test_loss: 0.8217, test_f1: 0.6335
 epoch: 51, train_loss: 0.5250, test_loss: 0.7786, test_f1: 0.6699
 epoch: 52, train_loss: 0.5217, test_loss: 0.8290, test_f1: 0.6739
 epoch: 53, train_loss: 0.5062, test_loss: 0.8503, test_f1: 0.6636
 epoch: 54, train_loss: 0.4950, test_loss: 0.9206, test_f1: 0.6676
 epoch: 55, train_loss: 0.4908, test_loss: 0.8997, test_f1: 0.6831
 epoch: 56, train_loss: 0.4987, test_loss: 0.8794, test_f1: 0.6676
 epoch: 57, train_loss: 0.4750, test_loss: 0.8142, test_f1: 0.6905
 epoch: 58, train_loss: 0.4866, test_loss: 0.9089, test_f1: 0.6550
 epoch: 59, train_loss: 0.4872, test_loss: 0.8499, test_f1: 0.6696
 epoch: 60, train_loss: 0.4979, test_loss: 0.8652, test_f1: 0.6903
 epoch: 61, train_loss: 0.4686, test_loss: 0.8879, test_f1: 0.6861
 epoch: 62, train_loss: 0.4617, test_loss: 0.8647, test_f1: 0.6684
 epoch: 63, train_loss: 0.4616, test_loss: 0.8720, test_f1: 0.6873
 epoch: 64, train_loss: 0.4811, test_loss: 0.9509, test_f1: 0.6586
 epoch: 65, train_loss: 0.4846, test_loss: 0.9025, test_f1: 0.6801
 epoch: 66, train_loss: 0.4591, test_loss: 0.9496, test_f1: 0.6709
 epoch: 67, train_loss: 0.4478, test_loss: 0.9258, test_f1: 0.6931
 epoch: 68, train_loss: 0.4756, test_loss: 0.9715, test_f1: 0.6735
 epoch: 69, train_loss: 0.4558, test_loss: 0.9372, test_f1: 0.6866
 epoch: 70, train_loss: 0.4575, test_loss: 0.9346, test_f1: 0.6851
 epoch: 71, train_loss: 0.4529, test_loss: 0.9325, test_f1: 0.6881
 epoch: 72, train_loss: 0.4427, test_loss: 0.9084, test_f1: 0.6925
 epoch: 73, train_loss: 0.4419, test_loss: 0.9779, test_f1: 0.6722
 epoch: 74, train_loss: 0.4297, test_loss: 0.9647, test_f1: 0.6705
 epoch: 75, train_loss: 0.4408, test_loss: 0.9464, test_f1: 0.6786
 epoch: 76, train_loss: 0.4243, test_loss: 0.9585, test_f1: 0.6895
 epoch: 77, train_loss: 0.4366, test_loss: 0.9636, test_f1: 0.6785
 epoch: 78, train_loss: 0.4358, test_loss: 0.9619, test_f1: 0.6671
 epoch: 79, train_loss: 0.4242, test_loss: 0.9936, test_f1: 0.6731
 epoch: 80, train_loss: 0.4377, test_loss: 0.9259, test_f1: 0.6841
 epoch: 81, train_loss: 0.4302, test_loss: 1.0059, test_f1: 0.6756
 epoch: 82, train_loss: 0.4309, test_loss: 0.9336, test_f1: 0.6796
 epoch: 83, train_loss: 0.4040, test_loss: 0.9769, test_f1: 0.6757
 epoch: 84, train_loss: 0.4104, test_loss: 0.9842, test_f1: 0.6866
 epoch: 85, train_loss: 0.4262, test_loss: 0.9514, test_f1: 0.6818
 epoch: 86, train_loss: 0.4148, test_loss: 1.0016, test_f1: 0.6847
 epoch: 87, train_loss: 0.3971, test_loss: 0.9853, test_f1: 0.6804
 epoch: 88, train_loss: 0.4290, test_loss: 0.9860, test_f1: 0.6735
 epoch: 89, train_loss: 0.3982, test_loss: 1.0855, test_f1: 0.6772
 epoch: 90, train_loss: 0.3940, test_loss: 1.0586, test_f1: 0.6581
 epoch: 91, train_loss: 0.4092, test_loss: 1.0675, test_f1: 0.6872
 epoch: 92, train_loss: 0.4122, test_loss: 1.0913, test_f1: 0.6889
 epoch: 93, train_loss: 0.3892, test_loss: 1.0725, test_f1: 0.6676
 epoch: 94, train_loss: 0.4052, test_loss: 0.9734, test_f1: 0.6818
 epoch: 95, train_loss: 0.3983, test_loss: 0.9587, test_f1: 0.6829
 epoch: 96, train_loss: 0.3894, test_loss: 1.0842, test_f1: 0.6808
 epoch: 97, train_loss: 0.3987, test_loss: 1.0074, test_f1: 0.6703
 epoch: 98, train_loss: 0.3771, test_loss: 0.9830, test_f1: 0.6937
 epoch: 99, train_loss: 0.3840, test_loss: 1.0685, test_f1: 0.6689
##################ITERATION #6 ****************************************
 epoch: 0, train_loss: 1.2706, test_loss: 0.9825, test_f1: 0.5317
 epoch: 1, train_loss: 1.0050, test_loss: 0.9869, test_f1: 0.5440
 epoch: 2, train_loss: 0.9584, test_loss: 0.9111, test_f1: 0.5484
 epoch: 3, train_loss: 0.9372, test_loss: 0.9401, test_f1: 0.5624
 epoch: 4, train_loss: 0.9086, test_loss: 0.9135, test_f1: 0.5762
 epoch: 5, train_loss: 0.9064, test_loss: 0.9210, test_f1: 0.5325
 epoch: 6, train_loss: 0.8919, test_loss: 0.8857, test_f1: 0.5805
 epoch: 7, train_loss: 0.8627, test_loss: 0.8616, test_f1: 0.5559
 epoch: 8, train_loss: 0.8766, test_loss: 0.8628, test_f1: 0.6119
 epoch: 9, train_loss: 0.8459, test_loss: 0.8632, test_f1: 0.5901
 epoch: 10, train_loss: 0.8502, test_loss: 0.8585, test_f1: 0.6008
 epoch: 11, train_loss: 0.8224, test_loss: 0.8009, test_f1: 0.6161
 epoch: 12, train_loss: 0.8071, test_loss: 0.8566, test_f1: 0.5941
 epoch: 13, train_loss: 0.8102, test_loss: 0.8106, test_f1: 0.6022
 epoch: 14, train_loss: 0.7807, test_loss: 0.7880, test_f1: 0.6249
 epoch: 15, train_loss: 0.7668, test_loss: 0.8135, test_f1: 0.6190
 epoch: 16, train_loss: 0.7670, test_loss: 0.8002, test_f1: 0.6163
 epoch: 17, train_loss: 0.7538, test_loss: 0.7609, test_f1: 0.6180
 epoch: 18, train_loss: 0.7368, test_loss: 0.8629, test_f1: 0.6343
 epoch: 19, train_loss: 0.7274, test_loss: 0.7261, test_f1: 0.6359
 epoch: 20, train_loss: 0.7272, test_loss: 0.7610, test_f1: 0.6425
 epoch: 21, train_loss: 0.7163, test_loss: 0.7457, test_f1: 0.6242
 epoch: 22, train_loss: 0.6943, test_loss: 0.7907, test_f1: 0.6563
 epoch: 23, train_loss: 0.6839, test_loss: 0.8262, test_f1: 0.6086
 epoch: 24, train_loss: 0.6736, test_loss: 0.8086, test_f1: 0.6812
 epoch: 25, train_loss: 0.6871, test_loss: 0.8235, test_f1: 0.6320
 epoch: 26, train_loss: 0.6811, test_loss: 0.8241, test_f1: 0.6531
 epoch: 27, train_loss: 0.6524, test_loss: 0.8188, test_f1: 0.6488
 epoch: 28, train_loss: 0.6799, test_loss: 0.8166, test_f1: 0.6479
 epoch: 29, train_loss: 0.6491, test_loss: 0.8020, test_f1: 0.6538
 epoch: 30, train_loss: 0.6570, test_loss: 0.7865, test_f1: 0.6706
 epoch: 31, train_loss: 0.6467, test_loss: 0.7766, test_f1: 0.6683
 epoch: 32, train_loss: 0.6613, test_loss: 0.7986, test_f1: 0.6593
 epoch: 33, train_loss: 0.6330, test_loss: 0.8021, test_f1: 0.6485
 epoch: 34, train_loss: 0.6131, test_loss: 0.8609, test_f1: 0.6397
 epoch: 35, train_loss: 0.6164, test_loss: 0.7849, test_f1: 0.6485
 epoch: 36, train_loss: 0.6172, test_loss: 0.8095, test_f1: 0.6387
 epoch: 37, train_loss: 0.6279, test_loss: 0.7385, test_f1: 0.6816
 epoch: 38, train_loss: 0.6004, test_loss: 0.7470, test_f1: 0.6773
 epoch: 39, train_loss: 0.5978, test_loss: 0.8580, test_f1: 0.6514
 epoch: 40, train_loss: 0.6026, test_loss: 0.7982, test_f1: 0.6705
 epoch: 41, train_loss: 0.5862, test_loss: 0.8493, test_f1: 0.6506
 epoch: 42, train_loss: 0.5956, test_loss: 0.8461, test_f1: 0.6684
 epoch: 43, train_loss: 0.5703, test_loss: 0.9034, test_f1: 0.6692
 epoch: 44, train_loss: 0.5844, test_loss: 0.8249, test_f1: 0.6777
 epoch: 45, train_loss: 0.5773, test_loss: 0.8540, test_f1: 0.6613
 epoch: 46, train_loss: 0.5744, test_loss: 0.8559, test_f1: 0.6935
 epoch: 47, train_loss: 0.5715, test_loss: 0.8504, test_f1: 0.6489
 epoch: 48, train_loss: 0.5486, test_loss: 0.8162, test_f1: 0.6664
 epoch: 49, train_loss: 0.5465, test_loss: 0.8330, test_f1: 0.6845
 epoch: 50, train_loss: 0.5479, test_loss: 0.8852, test_f1: 0.6587
 epoch: 51, train_loss: 0.5121, test_loss: 0.8449, test_f1: 0.6808
 epoch: 52, train_loss: 0.5019, test_loss: 0.8534, test_f1: 0.6589
 epoch: 53, train_loss: 0.4910, test_loss: 0.8929, test_f1: 0.6705
 epoch: 54, train_loss: 0.4882, test_loss: 0.8778, test_f1: 0.6794
 epoch: 55, train_loss: 0.4849, test_loss: 0.8513, test_f1: 0.6792
 epoch: 56, train_loss: 0.4690, test_loss: 0.8826, test_f1: 0.6913
 epoch: 57, train_loss: 0.4805, test_loss: 0.8368, test_f1: 0.6569
 epoch: 58, train_loss: 0.4750, test_loss: 0.8592, test_f1: 0.6965
 epoch: 59, train_loss: 0.4777, test_loss: 0.9096, test_f1: 0.6799
 epoch: 60, train_loss: 0.4592, test_loss: 0.9413, test_f1: 0.6708
 epoch: 61, train_loss: 0.4876, test_loss: 0.9654, test_f1: 0.6678
 epoch: 62, train_loss: 0.4575, test_loss: 0.8878, test_f1: 0.6964
 epoch: 63, train_loss: 0.4575, test_loss: 0.8904, test_f1: 0.6941
 epoch: 64, train_loss: 0.4608, test_loss: 0.9138, test_f1: 0.6752
 epoch: 65, train_loss: 0.4623, test_loss: 0.9020, test_f1: 0.6823
 epoch: 66, train_loss: 0.4654, test_loss: 0.9238, test_f1: 0.7053
 epoch: 67, train_loss: 0.4520, test_loss: 0.9409, test_f1: 0.6645
 epoch: 68, train_loss: 0.4540, test_loss: 0.9973, test_f1: 0.6645
 epoch: 69, train_loss: 0.4502, test_loss: 1.0039, test_f1: 0.6601
 epoch: 70, train_loss: 0.4522, test_loss: 0.9464, test_f1: 0.6786
 epoch: 71, train_loss: 0.4507, test_loss: 0.9061, test_f1: 0.7115
 epoch: 72, train_loss: 0.4511, test_loss: 0.9739, test_f1: 0.6966
 epoch: 73, train_loss: 0.4570, test_loss: 1.0366, test_f1: 0.6858
 epoch: 74, train_loss: 0.4429, test_loss: 0.9837, test_f1: 0.6947
 epoch: 75, train_loss: 0.4343, test_loss: 0.9247, test_f1: 0.6887
 epoch: 76, train_loss: 0.4416, test_loss: 0.9317, test_f1: 0.6869
 epoch: 77, train_loss: 0.4416, test_loss: 0.9430, test_f1: 0.6777
 epoch: 78, train_loss: 0.4243, test_loss: 0.9523, test_f1: 0.6866
 epoch: 79, train_loss: 0.4243, test_loss: 0.9780, test_f1: 0.6787
 epoch: 80, train_loss: 0.4259, test_loss: 1.0421, test_f1: 0.6706
 epoch: 81, train_loss: 0.4136, test_loss: 1.0069, test_f1: 0.7044
 epoch: 82, train_loss: 0.4288, test_loss: 1.0457, test_f1: 0.6931
 epoch: 83, train_loss: 0.4157, test_loss: 1.0312, test_f1: 0.6989
 epoch: 84, train_loss: 0.4093, test_loss: 0.9744, test_f1: 0.7220
 epoch: 85, train_loss: 0.4122, test_loss: 0.9707, test_f1: 0.7038
 epoch: 86, train_loss: 0.3954, test_loss: 1.0423, test_f1: 0.6881
 epoch: 87, train_loss: 0.4173, test_loss: 0.9448, test_f1: 0.6896
 epoch: 88, train_loss: 0.4173, test_loss: 1.0331, test_f1: 0.6945
 epoch: 89, train_loss: 0.4054, test_loss: 1.0091, test_f1: 0.6805
 epoch: 90, train_loss: 0.4064, test_loss: 1.0309, test_f1: 0.7033
 epoch: 91, train_loss: 0.4124, test_loss: 1.1131, test_f1: 0.6943
 epoch: 92, train_loss: 0.4205, test_loss: 1.0331, test_f1: 0.6841
 epoch: 93, train_loss: 0.4112, test_loss: 1.0334, test_f1: 0.6796
 epoch: 94, train_loss: 0.4077, test_loss: 1.0063, test_f1: 0.6879
 epoch: 95, train_loss: 0.4165, test_loss: 1.0464, test_f1: 0.6859
 epoch: 96, train_loss: 0.3899, test_loss: 1.0966, test_f1: 0.6768
 epoch: 97, train_loss: 0.3996, test_loss: 1.0543, test_f1: 0.7145
 epoch: 98, train_loss: 0.4257, test_loss: 1.0614, test_f1: 0.6830
 epoch: 99, train_loss: 0.4205, test_loss: 1.0954, test_f1: 0.6782
##################ITERATION #7 ****************************************
 epoch: 0, train_loss: 1.1774, test_loss: 1.0063, test_f1: 0.5276
 epoch: 1, train_loss: 0.9872, test_loss: 0.9647, test_f1: 0.5118
 epoch: 2, train_loss: 0.9520, test_loss: 0.9365, test_f1: 0.5340
 epoch: 3, train_loss: 0.9391, test_loss: 0.8946, test_f1: 0.5147
 epoch: 4, train_loss: 0.9053, test_loss: 0.8967, test_f1: 0.5545
 epoch: 5, train_loss: 0.8959, test_loss: 0.9039, test_f1: 0.5884
 epoch: 6, train_loss: 0.8644, test_loss: 0.8664, test_f1: 0.5626
 epoch: 7, train_loss: 0.8579, test_loss: 0.8515, test_f1: 0.5732
 epoch: 8, train_loss: 0.8527, test_loss: 0.8365, test_f1: 0.5733
 epoch: 9, train_loss: 0.8279, test_loss: 0.8955, test_f1: 0.5795
 epoch: 10, train_loss: 0.8119, test_loss: 0.8136, test_f1: 0.6008
 epoch: 11, train_loss: 0.8003, test_loss: 0.7669, test_f1: 0.6447
 epoch: 12, train_loss: 0.7826, test_loss: 0.8703, test_f1: 0.6049
 epoch: 13, train_loss: 0.7837, test_loss: 0.8668, test_f1: 0.5991
 epoch: 14, train_loss: 0.7628, test_loss: 0.7736, test_f1: 0.6363
 epoch: 15, train_loss: 0.7645, test_loss: 0.8749, test_f1: 0.6467
 epoch: 16, train_loss: 0.7338, test_loss: 0.7986, test_f1: 0.6501
 epoch: 17, train_loss: 0.7360, test_loss: 0.7834, test_f1: 0.6612
 epoch: 18, train_loss: 0.7282, test_loss: 0.8428, test_f1: 0.6219
 epoch: 19, train_loss: 0.7099, test_loss: 0.8539, test_f1: 0.6453
 epoch: 20, train_loss: 0.7098, test_loss: 0.8455, test_f1: 0.6398
 epoch: 21, train_loss: 0.7013, test_loss: 0.8451, test_f1: 0.6503
 epoch: 22, train_loss: 0.7089, test_loss: 0.8731, test_f1: 0.6391
 epoch: 23, train_loss: 0.6747, test_loss: 0.8706, test_f1: 0.6262
 epoch: 24, train_loss: 0.6589, test_loss: 0.8630, test_f1: 0.6248
 epoch: 25, train_loss: 0.6693, test_loss: 0.8071, test_f1: 0.6648
 epoch: 26, train_loss: 0.6590, test_loss: 0.8467, test_f1: 0.6608
 epoch: 27, train_loss: 0.6528, test_loss: 0.8257, test_f1: 0.6491
 epoch: 28, train_loss: 0.6506, test_loss: 0.8219, test_f1: 0.6604
 epoch: 29, train_loss: 0.6625, test_loss: 0.8144, test_f1: 0.6508
 epoch: 30, train_loss: 0.6281, test_loss: 0.8945, test_f1: 0.6701
 epoch: 31, train_loss: 0.6266, test_loss: 0.8704, test_f1: 0.6502
 epoch: 32, train_loss: 0.6339, test_loss: 0.8778, test_f1: 0.6345
 epoch: 33, train_loss: 0.6363, test_loss: 0.8781, test_f1: 0.6783
 epoch: 34, train_loss: 0.6129, test_loss: 0.8474, test_f1: 0.6571
 epoch: 35, train_loss: 0.6114, test_loss: 0.9637, test_f1: 0.6615
 epoch: 36, train_loss: 0.6025, test_loss: 0.8819, test_f1: 0.6749
 epoch: 37, train_loss: 0.6073, test_loss: 0.8903, test_f1: 0.6815
 epoch: 38, train_loss: 0.5727, test_loss: 0.8987, test_f1: 0.6834
 epoch: 39, train_loss: 0.5938, test_loss: 0.9424, test_f1: 0.6696
 epoch: 40, train_loss: 0.5910, test_loss: 0.8775, test_f1: 0.6839
 epoch: 41, train_loss: 0.5967, test_loss: 0.9209, test_f1: 0.6402
 epoch: 42, train_loss: 0.5802, test_loss: 0.9710, test_f1: 0.6602
 epoch: 43, train_loss: 0.5732, test_loss: 0.9086, test_f1: 0.6779
 epoch: 44, train_loss: 0.5894, test_loss: 0.9685, test_f1: 0.6646
 epoch: 45, train_loss: 0.5747, test_loss: 0.9795, test_f1: 0.6840
 epoch: 46, train_loss: 0.5849, test_loss: 0.9330, test_f1: 0.6652
 epoch: 47, train_loss: 0.5612, test_loss: 0.9611, test_f1: 0.6787
 epoch: 48, train_loss: 0.5393, test_loss: 0.9660, test_f1: 0.6717
 epoch: 49, train_loss: 0.5281, test_loss: 0.9967, test_f1: 0.6806
 epoch: 50, train_loss: 0.5586, test_loss: 0.9101, test_f1: 0.6890
 epoch: 51, train_loss: 0.5088, test_loss: 0.9452, test_f1: 0.6850
 epoch: 52, train_loss: 0.4919, test_loss: 0.9612, test_f1: 0.6818
 epoch: 53, train_loss: 0.5052, test_loss: 0.8967, test_f1: 0.6959
 epoch: 54, train_loss: 0.4970, test_loss: 1.0005, test_f1: 0.6985
 epoch: 55, train_loss: 0.4853, test_loss: 0.9753, test_f1: 0.6733
 epoch: 56, train_loss: 0.4930, test_loss: 0.9896, test_f1: 0.6710
 epoch: 57, train_loss: 0.4816, test_loss: 1.0210, test_f1: 0.7083
 epoch: 58, train_loss: 0.4808, test_loss: 0.9979, test_f1: 0.6885
 epoch: 59, train_loss: 0.4767, test_loss: 1.0035, test_f1: 0.6913
 epoch: 60, train_loss: 0.4526, test_loss: 1.0065, test_f1: 0.7060
 epoch: 61, train_loss: 0.4941, test_loss: 0.9910, test_f1: 0.7076
 epoch: 62, train_loss: 0.4581, test_loss: 1.0074, test_f1: 0.6667
 epoch: 63, train_loss: 0.4655, test_loss: 0.9742, test_f1: 0.6945
 epoch: 64, train_loss: 0.4648, test_loss: 0.9711, test_f1: 0.7122
 epoch: 65, train_loss: 0.4369, test_loss: 0.9794, test_f1: 0.7022
 epoch: 66, train_loss: 0.4634, test_loss: 1.0013, test_f1: 0.7032
 epoch: 67, train_loss: 0.4603, test_loss: 1.0351, test_f1: 0.6931
 epoch: 68, train_loss: 0.4459, test_loss: 1.0193, test_f1: 0.7016
 epoch: 69, train_loss: 0.4535, test_loss: 0.9948, test_f1: 0.7109
 epoch: 70, train_loss: 0.4357, test_loss: 1.0240, test_f1: 0.6801
 epoch: 71, train_loss: 0.4517, test_loss: 1.0243, test_f1: 0.7048
 epoch: 72, train_loss: 0.4301, test_loss: 1.0744, test_f1: 0.6736
 epoch: 73, train_loss: 0.4344, test_loss: 1.0421, test_f1: 0.7199
 epoch: 74, train_loss: 0.4410, test_loss: 1.0651, test_f1: 0.7088
 epoch: 75, train_loss: 0.4209, test_loss: 1.1180, test_f1: 0.6838
 epoch: 76, train_loss: 0.4255, test_loss: 1.0755, test_f1: 0.7111
 epoch: 77, train_loss: 0.4316, test_loss: 1.0551, test_f1: 0.7089
 epoch: 78, train_loss: 0.4118, test_loss: 1.0761, test_f1: 0.7006
 epoch: 79, train_loss: 0.4225, test_loss: 1.0534, test_f1: 0.7126
 epoch: 80, train_loss: 0.4194, test_loss: 1.0995, test_f1: 0.6993
 epoch: 81, train_loss: 0.4131, test_loss: 1.0753, test_f1: 0.6848
 epoch: 82, train_loss: 0.4085, test_loss: 1.1024, test_f1: 0.6973
 epoch: 83, train_loss: 0.4293, test_loss: 1.1346, test_f1: 0.6962
 epoch: 84, train_loss: 0.4075, test_loss: 1.0691, test_f1: 0.7135
 epoch: 85, train_loss: 0.4088, test_loss: 1.0590, test_f1: 0.6977
 epoch: 86, train_loss: 0.3933, test_loss: 1.0362, test_f1: 0.6997
 epoch: 87, train_loss: 0.4211, test_loss: 1.0957, test_f1: 0.6966
 epoch: 88, train_loss: 0.4045, test_loss: 1.1110, test_f1: 0.6862
 epoch: 89, train_loss: 0.3998, test_loss: 1.1794, test_f1: 0.6714
 epoch: 90, train_loss: 0.4261, test_loss: 1.1356, test_f1: 0.6744
 epoch: 91, train_loss: 0.3873, test_loss: 1.0724, test_f1: 0.7009
 epoch: 92, train_loss: 0.4107, test_loss: 1.0850, test_f1: 0.7036
 epoch: 93, train_loss: 0.3938, test_loss: 1.1474, test_f1: 0.6757
 epoch: 94, train_loss: 0.3889, test_loss: 1.1095, test_f1: 0.6964
 epoch: 95, train_loss: 0.3746, test_loss: 1.1205, test_f1: 0.6654
 epoch: 96, train_loss: 0.3826, test_loss: 1.1545, test_f1: 0.6881
 epoch: 97, train_loss: 0.3822, test_loss: 1.1385, test_f1: 0.7025
 epoch: 98, train_loss: 0.3902, test_loss: 1.1938, test_f1: 0.6793
 epoch: 99, train_loss: 0.3782, test_loss: 1.2289, test_f1: 0.6787
##################ITERATION #8 ****************************************
 epoch: 0, train_loss: 1.1733, test_loss: 0.9761, test_f1: 0.4483
 epoch: 1, train_loss: 0.9912, test_loss: 0.9400, test_f1: 0.4967
 epoch: 2, train_loss: 0.9600, test_loss: 0.9472, test_f1: 0.5141
 epoch: 3, train_loss: 0.9306, test_loss: 0.9168, test_f1: 0.5119
 epoch: 4, train_loss: 0.9136, test_loss: 0.9186, test_f1: 0.5128
 epoch: 5, train_loss: 0.8935, test_loss: 0.8656, test_f1: 0.5354
 epoch: 6, train_loss: 0.8716, test_loss: 0.9070, test_f1: 0.5500
 epoch: 7, train_loss: 0.8589, test_loss: 0.8915, test_f1: 0.5426
 epoch: 8, train_loss: 0.8532, test_loss: 0.8325, test_f1: 0.5906
 epoch: 9, train_loss: 0.8325, test_loss: 0.8231, test_f1: 0.6043
 epoch: 10, train_loss: 0.8247, test_loss: 0.8459, test_f1: 0.5934
 epoch: 11, train_loss: 0.8166, test_loss: 0.7826, test_f1: 0.6103
 epoch: 12, train_loss: 0.7968, test_loss: 0.7546, test_f1: 0.6241
 epoch: 13, train_loss: 0.7955, test_loss: 0.7297, test_f1: 0.6541
 epoch: 14, train_loss: 0.7791, test_loss: 0.9162, test_f1: 0.5879
 epoch: 15, train_loss: 0.7634, test_loss: 0.8821, test_f1: 0.6592
 epoch: 16, train_loss: 0.7553, test_loss: 0.8012, test_f1: 0.6206
 epoch: 17, train_loss: 0.7550, test_loss: 0.8496, test_f1: 0.6420
 epoch: 18, train_loss: 0.7406, test_loss: 0.7766, test_f1: 0.6213
 epoch: 19, train_loss: 0.7256, test_loss: 0.7886, test_f1: 0.6723
 epoch: 20, train_loss: 0.7311, test_loss: 0.7653, test_f1: 0.6529
 epoch: 21, train_loss: 0.7066, test_loss: 0.7619, test_f1: 0.6098
 epoch: 22, train_loss: 0.7131, test_loss: 0.7101, test_f1: 0.6486
 epoch: 23, train_loss: 0.6997, test_loss: 0.7113, test_f1: 0.6672
 epoch: 24, train_loss: 0.6808, test_loss: 0.7289, test_f1: 0.6711
 epoch: 25, train_loss: 0.6579, test_loss: 0.7297, test_f1: 0.6484
 epoch: 26, train_loss: 0.6826, test_loss: 0.7873, test_f1: 0.6399
 epoch: 27, train_loss: 0.6585, test_loss: 0.7969, test_f1: 0.6587
 epoch: 28, train_loss: 0.6556, test_loss: 0.8171, test_f1: 0.6383
 epoch: 29, train_loss: 0.6502, test_loss: 0.8240, test_f1: 0.6409
 epoch: 30, train_loss: 0.6303, test_loss: 0.7873, test_f1: 0.6356
 epoch: 31, train_loss: 0.6489, test_loss: 0.8132, test_f1: 0.6523
 epoch: 32, train_loss: 0.6368, test_loss: 0.7915, test_f1: 0.6498
 epoch: 33, train_loss: 0.6220, test_loss: 0.8271, test_f1: 0.6731
 epoch: 34, train_loss: 0.6165, test_loss: 0.8668, test_f1: 0.6381
 epoch: 35, train_loss: 0.6077, test_loss: 0.8009, test_f1: 0.6616
 epoch: 36, train_loss: 0.6203, test_loss: 0.8390, test_f1: 0.6508
 epoch: 37, train_loss: 0.5974, test_loss: 0.8335, test_f1: 0.6487
 epoch: 38, train_loss: 0.5990, test_loss: 0.8510, test_f1: 0.6666
 epoch: 39, train_loss: 0.5859, test_loss: 0.8770, test_f1: 0.6730
 epoch: 40, train_loss: 0.5848, test_loss: 0.8488, test_f1: 0.6279
 epoch: 41, train_loss: 0.5881, test_loss: 0.8106, test_f1: 0.6763
 epoch: 42, train_loss: 0.6014, test_loss: 0.8198, test_f1: 0.6509
 epoch: 43, train_loss: 0.5564, test_loss: 0.8007, test_f1: 0.6761
 epoch: 44, train_loss: 0.5663, test_loss: 0.7844, test_f1: 0.6715
 epoch: 45, train_loss: 0.5688, test_loss: 0.8115, test_f1: 0.6695
 epoch: 46, train_loss: 0.5569, test_loss: 0.7370, test_f1: 0.6587
 epoch: 47, train_loss: 0.5537, test_loss: 0.7895, test_f1: 0.6730
 epoch: 48, train_loss: 0.5567, test_loss: 0.8832, test_f1: 0.6307
 epoch: 49, train_loss: 0.5426, test_loss: 0.8152, test_f1: 0.6662
 epoch: 50, train_loss: 0.5497, test_loss: 0.8180, test_f1: 0.6636
 epoch: 51, train_loss: 0.5125, test_loss: 0.8140, test_f1: 0.6546
 epoch: 52, train_loss: 0.4927, test_loss: 0.8040, test_f1: 0.6870
 epoch: 53, train_loss: 0.4719, test_loss: 0.8475, test_f1: 0.6729
 epoch: 54, train_loss: 0.4872, test_loss: 0.8876, test_f1: 0.6718
 epoch: 55, train_loss: 0.4713, test_loss: 0.9269, test_f1: 0.6827
 epoch: 56, train_loss: 0.4770, test_loss: 0.8657, test_f1: 0.6617
 epoch: 57, train_loss: 0.4716, test_loss: 0.9574, test_f1: 0.6681
 epoch: 58, train_loss: 0.4769, test_loss: 0.8881, test_f1: 0.6686
 epoch: 59, train_loss: 0.4652, test_loss: 0.8772, test_f1: 0.6631
 epoch: 60, train_loss: 0.4585, test_loss: 0.8894, test_f1: 0.6785
 epoch: 61, train_loss: 0.4678, test_loss: 0.8955, test_f1: 0.6664
 epoch: 62, train_loss: 0.4493, test_loss: 0.9176, test_f1: 0.6793
 epoch: 63, train_loss: 0.4678, test_loss: 0.9239, test_f1: 0.6968
 epoch: 64, train_loss: 0.4431, test_loss: 0.8956, test_f1: 0.6774
 epoch: 65, train_loss: 0.4302, test_loss: 0.8604, test_f1: 0.6805
 epoch: 66, train_loss: 0.4679, test_loss: 0.9304, test_f1: 0.6787
 epoch: 67, train_loss: 0.4365, test_loss: 0.9340, test_f1: 0.6790
 epoch: 68, train_loss: 0.4401, test_loss: 0.9811, test_f1: 0.6817
 epoch: 69, train_loss: 0.4291, test_loss: 0.9252, test_f1: 0.6874
 epoch: 70, train_loss: 0.4246, test_loss: 0.9551, test_f1: 0.6680
 epoch: 71, train_loss: 0.4386, test_loss: 0.9500, test_f1: 0.6779
 epoch: 72, train_loss: 0.4320, test_loss: 0.9142, test_f1: 0.6726
 epoch: 73, train_loss: 0.4496, test_loss: 0.9700, test_f1: 0.6830
 epoch: 74, train_loss: 0.4293, test_loss: 0.9477, test_f1: 0.6783
 epoch: 75, train_loss: 0.4107, test_loss: 0.9102, test_f1: 0.6757
 epoch: 76, train_loss: 0.4387, test_loss: 0.9078, test_f1: 0.7013
 epoch: 77, train_loss: 0.4128, test_loss: 0.8778, test_f1: 0.6685
 epoch: 78, train_loss: 0.4244, test_loss: 0.8602, test_f1: 0.6787
 epoch: 79, train_loss: 0.4130, test_loss: 0.9517, test_f1: 0.6795
 epoch: 80, train_loss: 0.4177, test_loss: 0.9420, test_f1: 0.6825
 epoch: 81, train_loss: 0.3904, test_loss: 0.9564, test_f1: 0.6901
 epoch: 82, train_loss: 0.4123, test_loss: 0.9394, test_f1: 0.6924
 epoch: 83, train_loss: 0.4127, test_loss: 0.9906, test_f1: 0.6826
 epoch: 84, train_loss: 0.4159, test_loss: 1.0305, test_f1: 0.6713
 epoch: 85, train_loss: 0.4017, test_loss: 0.9295, test_f1: 0.6792
 epoch: 86, train_loss: 0.4137, test_loss: 0.8775, test_f1: 0.6922
 epoch: 87, train_loss: 0.4241, test_loss: 0.9838, test_f1: 0.7006
 epoch: 88, train_loss: 0.3921, test_loss: 0.9935, test_f1: 0.6798
 epoch: 89, train_loss: 0.3878, test_loss: 1.0319, test_f1: 0.6708
 epoch: 90, train_loss: 0.3928, test_loss: 0.9122, test_f1: 0.6884
 epoch: 91, train_loss: 0.4018, test_loss: 1.0181, test_f1: 0.6822
 epoch: 92, train_loss: 0.3817, test_loss: 1.0635, test_f1: 0.6579
 epoch: 93, train_loss: 0.3898, test_loss: 0.9917, test_f1: 0.6839
 epoch: 94, train_loss: 0.3916, test_loss: 0.9586, test_f1: 0.6855
 epoch: 95, train_loss: 0.3997, test_loss: 1.0063, test_f1: 0.6749
 epoch: 96, train_loss: 0.3718, test_loss: 1.0386, test_f1: 0.6741
 epoch: 97, train_loss: 0.3974, test_loss: 0.9114, test_f1: 0.6499
 epoch: 98, train_loss: 0.3565, test_loss: 0.9216, test_f1: 0.6839
 epoch: 99, train_loss: 0.3800, test_loss: 1.0496, test_f1: 0.6802
##################ITERATION #9 ****************************************
 epoch: 0, train_loss: 1.2114, test_loss: 0.9403, test_f1: 0.4839
 epoch: 1, train_loss: 0.9808, test_loss: 0.9603, test_f1: 0.5374
 epoch: 2, train_loss: 0.9571, test_loss: 0.8768, test_f1: 0.5470
 epoch: 3, train_loss: 0.9393, test_loss: 0.8995, test_f1: 0.5262
 epoch: 4, train_loss: 0.8965, test_loss: 0.8391, test_f1: 0.5358
 epoch: 5, train_loss: 0.8851, test_loss: 0.8537, test_f1: 0.5460
 epoch: 6, train_loss: 0.8851, test_loss: 0.8494, test_f1: 0.5562
 epoch: 7, train_loss: 0.8702, test_loss: 0.8105, test_f1: 0.5829
 epoch: 8, train_loss: 0.8511, test_loss: 0.8060, test_f1: 0.6096
 epoch: 9, train_loss: 0.8275, test_loss: 0.8621, test_f1: 0.5726
 epoch: 10, train_loss: 0.8142, test_loss: 0.7873, test_f1: 0.5921
 epoch: 11, train_loss: 0.8016, test_loss: 0.7633, test_f1: 0.6062
 epoch: 12, train_loss: 0.7801, test_loss: 0.7451, test_f1: 0.6479
 epoch: 13, train_loss: 0.7919, test_loss: 0.7407, test_f1: 0.6469
 epoch: 14, train_loss: 0.7663, test_loss: 0.7582, test_f1: 0.6188
 epoch: 15, train_loss: 0.7660, test_loss: 0.7281, test_f1: 0.6546
 epoch: 16, train_loss: 0.7658, test_loss: 0.7317, test_f1: 0.6520
 epoch: 17, train_loss: 0.7424, test_loss: 0.7726, test_f1: 0.6226
 epoch: 18, train_loss: 0.7569, test_loss: 0.7129, test_f1: 0.6582
 epoch: 19, train_loss: 0.7303, test_loss: 0.7004, test_f1: 0.6255
 epoch: 20, train_loss: 0.7132, test_loss: 0.7057, test_f1: 0.6858
 epoch: 21, train_loss: 0.7056, test_loss: 0.7160, test_f1: 0.6444
 epoch: 22, train_loss: 0.6922, test_loss: 0.7238, test_f1: 0.6400
 epoch: 23, train_loss: 0.6962, test_loss: 0.7176, test_f1: 0.6432
 epoch: 24, train_loss: 0.6855, test_loss: 0.7224, test_f1: 0.6468
 epoch: 25, train_loss: 0.6881, test_loss: 0.6805, test_f1: 0.6941
 epoch: 26, train_loss: 0.6824, test_loss: 0.6916, test_f1: 0.6535
 epoch: 27, train_loss: 0.6719, test_loss: 0.6803, test_f1: 0.6980
 epoch: 28, train_loss: 0.6674, test_loss: 0.7641, test_f1: 0.6625
 epoch: 29, train_loss: 0.6661, test_loss: 0.6954, test_f1: 0.6701
 epoch: 30, train_loss: 0.6458, test_loss: 0.7356, test_f1: 0.6571
 epoch: 31, train_loss: 0.6523, test_loss: 0.6978, test_f1: 0.6716
 epoch: 32, train_loss: 0.6416, test_loss: 0.7288, test_f1: 0.6682
 epoch: 33, train_loss: 0.6226, test_loss: 0.6729, test_f1: 0.6736
 epoch: 34, train_loss: 0.6157, test_loss: 0.6968, test_f1: 0.6997
 epoch: 35, train_loss: 0.6310, test_loss: 0.7629, test_f1: 0.6203
 epoch: 36, train_loss: 0.6256, test_loss: 0.7420, test_f1: 0.6611
 epoch: 37, train_loss: 0.6002, test_loss: 0.7256, test_f1: 0.6610
 epoch: 38, train_loss: 0.5996, test_loss: 0.6663, test_f1: 0.6846
 epoch: 39, train_loss: 0.6125, test_loss: 0.7504, test_f1: 0.6614
 epoch: 40, train_loss: 0.6124, test_loss: 0.6965, test_f1: 0.6774
 epoch: 41, train_loss: 0.6042, test_loss: 0.7406, test_f1: 0.6455
 epoch: 42, train_loss: 0.6033, test_loss: 0.7338, test_f1: 0.6904
 epoch: 43, train_loss: 0.5801, test_loss: 0.7432, test_f1: 0.6762
 epoch: 44, train_loss: 0.5818, test_loss: 0.7269, test_f1: 0.6631
 epoch: 45, train_loss: 0.5856, test_loss: 0.7667, test_f1: 0.6723
 epoch: 46, train_loss: 0.5818, test_loss: 0.7159, test_f1: 0.6906
 epoch: 47, train_loss: 0.5568, test_loss: 0.7354, test_f1: 0.6867
 epoch: 48, train_loss: 0.5562, test_loss: 0.7617, test_f1: 0.6675
 epoch: 49, train_loss: 0.5590, test_loss: 0.7153, test_f1: 0.6885
 epoch: 50, train_loss: 0.5450, test_loss: 0.7503, test_f1: 0.6682
 epoch: 51, train_loss: 0.5251, test_loss: 0.6928, test_f1: 0.6944
 epoch: 52, train_loss: 0.5022, test_loss: 0.7210, test_f1: 0.6763
 epoch: 53, train_loss: 0.5058, test_loss: 0.7616, test_f1: 0.6699
 epoch: 54, train_loss: 0.5170, test_loss: 0.7056, test_f1: 0.6723
 epoch: 55, train_loss: 0.5047, test_loss: 0.7643, test_f1: 0.6685
 epoch: 56, train_loss: 0.4987, test_loss: 0.7372, test_f1: 0.6965
 epoch: 57, train_loss: 0.4784, test_loss: 0.8121, test_f1: 0.6711
 epoch: 58, train_loss: 0.4894, test_loss: 0.7442, test_f1: 0.6708
 epoch: 59, train_loss: 0.5006, test_loss: 0.7399, test_f1: 0.6810
 epoch: 60, train_loss: 0.4828, test_loss: 0.7729, test_f1: 0.6753
 epoch: 61, train_loss: 0.4718, test_loss: 0.7632, test_f1: 0.6862
 epoch: 62, train_loss: 0.4780, test_loss: 0.7428, test_f1: 0.6646
 epoch: 63, train_loss: 0.4674, test_loss: 0.7563, test_f1: 0.6703
 epoch: 64, train_loss: 0.4697, test_loss: 0.8347, test_f1: 0.6749
 epoch: 65, train_loss: 0.4706, test_loss: 0.7972, test_f1: 0.6622
 epoch: 66, train_loss: 0.4717, test_loss: 0.7886, test_f1: 0.6800
 epoch: 67, train_loss: 0.4527, test_loss: 0.8120, test_f1: 0.6798
 epoch: 68, train_loss: 0.4636, test_loss: 0.7577, test_f1: 0.6790
 epoch: 69, train_loss: 0.4463, test_loss: 0.8546, test_f1: 0.6635
 epoch: 70, train_loss: 0.4640, test_loss: 0.8647, test_f1: 0.6597
 epoch: 71, train_loss: 0.4531, test_loss: 0.8610, test_f1: 0.6660
 epoch: 72, train_loss: 0.4563, test_loss: 0.8091, test_f1: 0.6700
 epoch: 73, train_loss: 0.4454, test_loss: 0.8472, test_f1: 0.6626
 epoch: 74, train_loss: 0.4649, test_loss: 0.8843, test_f1: 0.6715
 epoch: 75, train_loss: 0.4408, test_loss: 0.8762, test_f1: 0.6638
 epoch: 76, train_loss: 0.4489, test_loss: 0.8602, test_f1: 0.6842
 epoch: 77, train_loss: 0.4457, test_loss: 0.8850, test_f1: 0.6690
 epoch: 78, train_loss: 0.4487, test_loss: 0.8326, test_f1: 0.6668
 epoch: 79, train_loss: 0.4370, test_loss: 0.8988, test_f1: 0.6716
 epoch: 80, train_loss: 0.4277, test_loss: 0.8843, test_f1: 0.6661
 epoch: 81, train_loss: 0.4388, test_loss: 0.8068, test_f1: 0.6615
 epoch: 82, train_loss: 0.4235, test_loss: 0.9125, test_f1: 0.6511
 epoch: 83, train_loss: 0.4301, test_loss: 0.9108, test_f1: 0.6775
 epoch: 84, train_loss: 0.4268, test_loss: 0.9645, test_f1: 0.6540
 epoch: 85, train_loss: 0.4191, test_loss: 0.9749, test_f1: 0.6686
 epoch: 86, train_loss: 0.4261, test_loss: 0.9855, test_f1: 0.6562
 epoch: 87, train_loss: 0.4179, test_loss: 0.9312, test_f1: 0.6697
 epoch: 88, train_loss: 0.4187, test_loss: 0.8839, test_f1: 0.6686
 epoch: 89, train_loss: 0.4073, test_loss: 0.9551, test_f1: 0.6738
 epoch: 90, train_loss: 0.4135, test_loss: 0.8949, test_f1: 0.6897
 epoch: 91, train_loss: 0.4189, test_loss: 0.9285, test_f1: 0.6694
 epoch: 92, train_loss: 0.4209, test_loss: 0.9238, test_f1: 0.6707
 epoch: 93, train_loss: 0.4089, test_loss: 0.9042, test_f1: 0.6702
 epoch: 94, train_loss: 0.4124, test_loss: 0.9148, test_f1: 0.6847
 epoch: 95, train_loss: 0.4066, test_loss: 0.9453, test_f1: 0.6667
 epoch: 96, train_loss: 0.4119, test_loss: 0.9994, test_f1: 0.6679
 epoch: 97, train_loss: 0.3939, test_loss: 0.9297, test_f1: 0.6835
 epoch: 98, train_loss: 0.4088, test_loss: 0.9499, test_f1: 0.6737
 epoch: 99, train_loss: 0.3898, test_loss: 0.9973, test_f1: 0.6660

Training completed in 1589.53 seconds
Best F1: 0.7220 at epoch 84
Mean F1 across iterations: 0.7048  0.0104
========================FINAL RESULTS================================
FEGIN weighted F1: 0.7220  0.0104
python main.py --data ltspice_examples --representation component_pin_net --model FEGIN --layers 2 --hiddens 64 --batch_size 32 --lr 0.001 --emb_size 128 --epochs 100 --save_appendix component_pin_net_L2_H64_BS32_LR0.001_E128 --no_val
-----



STDERR:
  File "main.py", line 370, in <module>
    main()
  File "main.py", line 254, in main
    dataset = dataset_class(
  File "/home/philip/projects/ltspice_examples_code_repo/Circuit-Completion-Using-GNNs/component_classification_with_link_prediction_head/evaluation/FEGIN/kernel/circuit_datasets.py", line 15, in __init__
    self.data, self.slices = torch.load(self.processed_paths[0])
  File "/home/philip/.local/lib/python3.8/site-packages/torch/serialization.py", line 1040, in load
    warnings.warn(
  File "/usr/lib/python3.8/warnings.py", line 109, in _showwarnmsg
    sw(msg.message, msg.category, msg.filename, msg.lineno,
  File "main.py", line 47, in warn_with_traceback
    traceback.print_stack(file=log)
/home/philip/projects/ltspice_examples_code_repo/Circuit-Completion-Using-GNNs/component_classification_with_link_prediction_head/evaluation/FEGIN/kernel/circuit_datasets.py:15: FutureWarning: You are using `torch.load` with `weights_only=False` (the current default value), which uses the default pickle module implicitly. It is possible to construct malicious pickle data which will execute arbitrary code during unpickling (See https://github.com/pytorch/pytorch/blob/main/SECURITY.md#untrusted-models for more details). In a future release, the default value for `weights_only` will be flipped to `True`. This limits the functions that could be executed during unpickling. Arbitrary objects will no longer be allowed to be loaded via this mode unless they are explicitly allowlisted by the user via `torch.serialization.add_safe_globals`. We recommend you start setting `weights_only=True` for any use case where you don't have full control of the loaded file. Please open an issue on GitHub for any issues related to this experimental feature.
  self.data, self.slices = torch.load(self.processed_paths[0])
