STDOUT:
Results will be saved in /home/philip/projects/llm_inference_code_repo/Circuit-Completion-Using-GNNs/component_classification_with_link_prediction_head/evaluation/FEGIN/results/model_FEGIN_dataset_ltspice_examples
Command line input: python main.py --data ltspice_examples --representation component_pin_net --model FEGIN --layers 5 --hiddens 32 --batch_size 32 --lr 0.001 --emb_size 128 --epochs 100 --save_appendix component_pin_net_L5_H32_BS32_LR0.001_E128 --no_val
 is saved.
-----
ltspice_examples - FEGIN
Using 5 layers, 32 hidden units, h = 2
Loading component_pin_net representation dataset
ENTERED
Training FEGIN on component_pin_net representation
Train: 3558, Test: 846
##################ITERATION #0 ****************************************
 epoch: 0, train_loss: 1.2400, test_loss: 1.1089, test_f1: 0.3629
 epoch: 1, train_loss: 1.0832, test_loss: 1.0472, test_f1: 0.4696
 epoch: 2, train_loss: 1.0469, test_loss: 1.0185, test_f1: 0.4126
 epoch: 3, train_loss: 1.0163, test_loss: 0.9859, test_f1: 0.4593
 epoch: 4, train_loss: 1.0004, test_loss: 0.9784, test_f1: 0.4704
 epoch: 5, train_loss: 0.9777, test_loss: 0.9459, test_f1: 0.4969
 epoch: 6, train_loss: 0.9646, test_loss: 0.9520, test_f1: 0.5124
 epoch: 7, train_loss: 0.9344, test_loss: 0.9132, test_f1: 0.5212
 epoch: 8, train_loss: 0.9358, test_loss: 0.8897, test_f1: 0.5461
 epoch: 9, train_loss: 0.9185, test_loss: 0.8928, test_f1: 0.5240
 epoch: 10, train_loss: 0.9083, test_loss: 0.8618, test_f1: 0.5462
 epoch: 11, train_loss: 0.9159, test_loss: 0.8663, test_f1: 0.5224
 epoch: 12, train_loss: 0.8829, test_loss: 0.8474, test_f1: 0.5439
 epoch: 13, train_loss: 0.8763, test_loss: 0.8376, test_f1: 0.5400
 epoch: 14, train_loss: 0.8837, test_loss: 0.9033, test_f1: 0.5191
 epoch: 15, train_loss: 0.8642, test_loss: 0.9038, test_f1: 0.5412
 epoch: 16, train_loss: 0.8598, test_loss: 0.8504, test_f1: 0.5335
 epoch: 17, train_loss: 0.8496, test_loss: 0.8673, test_f1: 0.5445
 epoch: 18, train_loss: 0.8540, test_loss: 0.8122, test_f1: 0.5697
 epoch: 19, train_loss: 0.8494, test_loss: 0.9611, test_f1: 0.5099
 epoch: 20, train_loss: 0.8454, test_loss: 0.8154, test_f1: 0.5902
 epoch: 21, train_loss: 0.8345, test_loss: 0.8723, test_f1: 0.5338
 epoch: 22, train_loss: 0.8232, test_loss: 0.8161, test_f1: 0.5619
 epoch: 23, train_loss: 0.8162, test_loss: 0.8307, test_f1: 0.5578
 epoch: 24, train_loss: 0.8249, test_loss: 0.8110, test_f1: 0.5814
 epoch: 25, train_loss: 0.8061, test_loss: 0.8691, test_f1: 0.5475
 epoch: 26, train_loss: 0.7894, test_loss: 0.8451, test_f1: 0.5492
 epoch: 27, train_loss: 0.7982, test_loss: 0.8170, test_f1: 0.5781
 epoch: 28, train_loss: 0.7742, test_loss: 0.8045, test_f1: 0.5792
 epoch: 29, train_loss: 0.7794, test_loss: 0.7928, test_f1: 0.5968
 epoch: 30, train_loss: 0.8065, test_loss: 0.8420, test_f1: 0.5407
 epoch: 31, train_loss: 0.7607, test_loss: 0.8410, test_f1: 0.6025
 epoch: 32, train_loss: 0.7522, test_loss: 0.8995, test_f1: 0.5929
 epoch: 33, train_loss: 0.7450, test_loss: 1.0003, test_f1: 0.5501
 epoch: 34, train_loss: 0.7474, test_loss: 0.8914, test_f1: 0.5942
 epoch: 35, train_loss: 0.7520, test_loss: 0.9151, test_f1: 0.5545
 epoch: 36, train_loss: 0.7267, test_loss: 0.8412, test_f1: 0.5742
 epoch: 37, train_loss: 0.7254, test_loss: 0.9428, test_f1: 0.5717
 epoch: 38, train_loss: 0.7191, test_loss: 0.9128, test_f1: 0.5854
 epoch: 39, train_loss: 0.7358, test_loss: 1.0143, test_f1: 0.5578
 epoch: 40, train_loss: 0.7241, test_loss: 0.9658, test_f1: 0.5946
 epoch: 41, train_loss: 0.7246, test_loss: 0.9510, test_f1: 0.5618
 epoch: 42, train_loss: 0.6976, test_loss: 0.9624, test_f1: 0.5882
 epoch: 43, train_loss: 0.7058, test_loss: 0.9038, test_f1: 0.6070
 epoch: 44, train_loss: 0.6897, test_loss: 0.9522, test_f1: 0.6322
 epoch: 45, train_loss: 0.7026, test_loss: 0.9495, test_f1: 0.5945
 epoch: 46, train_loss: 0.6777, test_loss: 1.0546, test_f1: 0.5708
 epoch: 47, train_loss: 0.6938, test_loss: 0.9406, test_f1: 0.6083
 epoch: 48, train_loss: 0.6788, test_loss: 0.9815, test_f1: 0.5711
 epoch: 49, train_loss: 0.6870, test_loss: 0.9419, test_f1: 0.6091
 epoch: 50, train_loss: 0.6631, test_loss: 0.8881, test_f1: 0.6128
 epoch: 51, train_loss: 0.6421, test_loss: 0.9537, test_f1: 0.6333
 epoch: 52, train_loss: 0.6329, test_loss: 0.8816, test_f1: 0.6386
 epoch: 53, train_loss: 0.6219, test_loss: 0.8837, test_f1: 0.6052
 epoch: 54, train_loss: 0.6232, test_loss: 0.9991, test_f1: 0.6356
 epoch: 55, train_loss: 0.6202, test_loss: 0.9651, test_f1: 0.6299
 epoch: 56, train_loss: 0.6315, test_loss: 0.9179, test_f1: 0.6356
 epoch: 57, train_loss: 0.6134, test_loss: 0.9454, test_f1: 0.6241
 epoch: 58, train_loss: 0.6174, test_loss: 0.9356, test_f1: 0.6280
 epoch: 59, train_loss: 0.5979, test_loss: 0.9389, test_f1: 0.6108
 epoch: 60, train_loss: 0.6163, test_loss: 0.9082, test_f1: 0.6471
 epoch: 61, train_loss: 0.6089, test_loss: 0.9463, test_f1: 0.6165
 epoch: 62, train_loss: 0.6052, test_loss: 0.9585, test_f1: 0.6231
 epoch: 63, train_loss: 0.6009, test_loss: 0.9481, test_f1: 0.6345
 epoch: 64, train_loss: 0.5906, test_loss: 0.9360, test_f1: 0.6512
 epoch: 65, train_loss: 0.6092, test_loss: 0.9309, test_f1: 0.6196
 epoch: 66, train_loss: 0.5846, test_loss: 0.9860, test_f1: 0.6153
 epoch: 67, train_loss: 0.5809, test_loss: 0.9145, test_f1: 0.6391
 epoch: 68, train_loss: 0.5830, test_loss: 0.9855, test_f1: 0.6367
 epoch: 69, train_loss: 0.5755, test_loss: 0.9625, test_f1: 0.6321
 epoch: 70, train_loss: 0.5872, test_loss: 0.9683, test_f1: 0.6262
 epoch: 71, train_loss: 0.5562, test_loss: 1.0104, test_f1: 0.6350
 epoch: 72, train_loss: 0.5805, test_loss: 1.0272, test_f1: 0.6375
 epoch: 73, train_loss: 0.5674, test_loss: 1.0073, test_f1: 0.6321
 epoch: 74, train_loss: 0.5742, test_loss: 0.9637, test_f1: 0.6539
 epoch: 75, train_loss: 0.5704, test_loss: 0.9686, test_f1: 0.6640
 epoch: 76, train_loss: 0.5592, test_loss: 1.0429, test_f1: 0.6361
 epoch: 77, train_loss: 0.5698, test_loss: 1.0241, test_f1: 0.6295
 epoch: 78, train_loss: 0.5557, test_loss: 1.0868, test_f1: 0.6117
 epoch: 79, train_loss: 0.5682, test_loss: 1.0204, test_f1: 0.6317
 epoch: 80, train_loss: 0.5588, test_loss: 1.0054, test_f1: 0.6408
 epoch: 81, train_loss: 0.5353, test_loss: 1.0752, test_f1: 0.6308
 epoch: 82, train_loss: 0.5581, test_loss: 1.0640, test_f1: 0.6263
 epoch: 83, train_loss: 0.5639, test_loss: 0.8913, test_f1: 0.6436
 epoch: 84, train_loss: 0.5563, test_loss: 1.0273, test_f1: 0.6354
 epoch: 85, train_loss: 0.5515, test_loss: 1.0934, test_f1: 0.6273
 epoch: 86, train_loss: 0.5359, test_loss: 1.0358, test_f1: 0.6373
 epoch: 87, train_loss: 0.5438, test_loss: 1.0917, test_f1: 0.6254
 epoch: 88, train_loss: 0.5366, test_loss: 1.0847, test_f1: 0.6346
 epoch: 89, train_loss: 0.5428, test_loss: 1.0267, test_f1: 0.6374
 epoch: 90, train_loss: 0.5394, test_loss: 1.0490, test_f1: 0.6284
 epoch: 91, train_loss: 0.5289, test_loss: 1.0366, test_f1: 0.6360
 epoch: 92, train_loss: 0.5281, test_loss: 1.1758, test_f1: 0.6053
 epoch: 93, train_loss: 0.5231, test_loss: 1.0627, test_f1: 0.6449
 epoch: 94, train_loss: 0.5445, test_loss: 1.0475, test_f1: 0.6278
 epoch: 95, train_loss: 0.5214, test_loss: 1.0975, test_f1: 0.6214
 epoch: 96, train_loss: 0.5083, test_loss: 1.0853, test_f1: 0.6267
 epoch: 97, train_loss: 0.5263, test_loss: 1.1301, test_f1: 0.6053
 epoch: 98, train_loss: 0.5242, test_loss: 1.1210, test_f1: 0.6299
 epoch: 99, train_loss: 0.5163, test_loss: 1.1190, test_f1: 0.6221
##################ITERATION #1 ****************************************
 epoch: 0, train_loss: 1.1273, test_loss: 1.0342, test_f1: 0.4728
 epoch: 1, train_loss: 1.0130, test_loss: 0.9691, test_f1: 0.4878
 epoch: 2, train_loss: 0.9778, test_loss: 0.9596, test_f1: 0.4923
 epoch: 3, train_loss: 0.9597, test_loss: 0.9414, test_f1: 0.5176
 epoch: 4, train_loss: 0.9373, test_loss: 0.9068, test_f1: 0.5121
 epoch: 5, train_loss: 0.9346, test_loss: 0.9089, test_f1: 0.5012
 epoch: 6, train_loss: 0.9206, test_loss: 0.8764, test_f1: 0.5118
 epoch: 7, train_loss: 0.9043, test_loss: 0.8811, test_f1: 0.5509
 epoch: 8, train_loss: 0.8952, test_loss: 0.8734, test_f1: 0.5232
 epoch: 9, train_loss: 0.8693, test_loss: 0.8793, test_f1: 0.5123
 epoch: 10, train_loss: 0.8729, test_loss: 0.8922, test_f1: 0.5550
 epoch: 11, train_loss: 0.8569, test_loss: 0.8060, test_f1: 0.5778
 epoch: 12, train_loss: 0.8532, test_loss: 0.8443, test_f1: 0.6056
 epoch: 13, train_loss: 0.8373, test_loss: 0.8378, test_f1: 0.5770
 epoch: 14, train_loss: 0.8243, test_loss: 0.8623, test_f1: 0.5910
 epoch: 15, train_loss: 0.8195, test_loss: 0.8400, test_f1: 0.6123
 epoch: 16, train_loss: 0.8172, test_loss: 0.8716, test_f1: 0.5859
 epoch: 17, train_loss: 0.8107, test_loss: 0.8383, test_f1: 0.6177
 epoch: 18, train_loss: 0.7812, test_loss: 0.8609, test_f1: 0.5865
 epoch: 19, train_loss: 0.7960, test_loss: 0.8351, test_f1: 0.6138
 epoch: 20, train_loss: 0.7705, test_loss: 0.8355, test_f1: 0.6214
 epoch: 21, train_loss: 0.7618, test_loss: 0.8026, test_f1: 0.6320
 epoch: 22, train_loss: 0.7651, test_loss: 0.7913, test_f1: 0.6313
 epoch: 23, train_loss: 0.7368, test_loss: 0.8242, test_f1: 0.6257
 epoch: 24, train_loss: 0.7796, test_loss: 0.8541, test_f1: 0.6223
 epoch: 25, train_loss: 0.7521, test_loss: 0.8012, test_f1: 0.6293
 epoch: 26, train_loss: 0.7392, test_loss: 0.8799, test_f1: 0.6433
 epoch: 27, train_loss: 0.7235, test_loss: 0.8765, test_f1: 0.6081
 epoch: 28, train_loss: 0.7260, test_loss: 0.8012, test_f1: 0.6238
 epoch: 29, train_loss: 0.7243, test_loss: 0.8364, test_f1: 0.6224
 epoch: 30, train_loss: 0.7234, test_loss: 0.8478, test_f1: 0.6236
 epoch: 31, train_loss: 0.7230, test_loss: 0.8731, test_f1: 0.6368
 epoch: 32, train_loss: 0.7005, test_loss: 0.9091, test_f1: 0.6080
 epoch: 33, train_loss: 0.7048, test_loss: 0.8727, test_f1: 0.6436
 epoch: 34, train_loss: 0.6915, test_loss: 0.8766, test_f1: 0.6538
 epoch: 35, train_loss: 0.7186, test_loss: 0.7938, test_f1: 0.6425
 epoch: 36, train_loss: 0.6964, test_loss: 0.8071, test_f1: 0.6221
 epoch: 37, train_loss: 0.6761, test_loss: 0.9024, test_f1: 0.6150
 epoch: 38, train_loss: 0.6910, test_loss: 0.8346, test_f1: 0.6254
 epoch: 39, train_loss: 0.6849, test_loss: 0.8014, test_f1: 0.6511
 epoch: 40, train_loss: 0.6877, test_loss: 0.8540, test_f1: 0.6363
 epoch: 41, train_loss: 0.6731, test_loss: 0.9061, test_f1: 0.6087
 epoch: 42, train_loss: 0.6647, test_loss: 0.8884, test_f1: 0.6523
 epoch: 43, train_loss: 0.6654, test_loss: 0.8462, test_f1: 0.6283
 epoch: 44, train_loss: 0.6650, test_loss: 0.8133, test_f1: 0.6505
 epoch: 45, train_loss: 0.6595, test_loss: 0.8358, test_f1: 0.6481
 epoch: 46, train_loss: 0.6667, test_loss: 0.8277, test_f1: 0.6480
 epoch: 47, train_loss: 0.6391, test_loss: 0.8315, test_f1: 0.6489
 epoch: 48, train_loss: 0.6495, test_loss: 0.8391, test_f1: 0.6577
 epoch: 49, train_loss: 0.6713, test_loss: 0.8505, test_f1: 0.6113
 epoch: 50, train_loss: 0.6366, test_loss: 0.7967, test_f1: 0.6354
 epoch: 51, train_loss: 0.6067, test_loss: 0.8236, test_f1: 0.6453
 epoch: 52, train_loss: 0.5938, test_loss: 0.8553, test_f1: 0.6244
 epoch: 53, train_loss: 0.5980, test_loss: 0.8321, test_f1: 0.6374
 epoch: 54, train_loss: 0.5927, test_loss: 0.8324, test_f1: 0.6325
 epoch: 55, train_loss: 0.5714, test_loss: 0.8565, test_f1: 0.6272
 epoch: 56, train_loss: 0.5826, test_loss: 0.8547, test_f1: 0.6375
 epoch: 57, train_loss: 0.5802, test_loss: 0.8185, test_f1: 0.6598
 epoch: 58, train_loss: 0.5722, test_loss: 0.8425, test_f1: 0.6457
 epoch: 59, train_loss: 0.5714, test_loss: 0.8329, test_f1: 0.6417
 epoch: 60, train_loss: 0.5838, test_loss: 0.8281, test_f1: 0.6701
 epoch: 61, train_loss: 0.5593, test_loss: 0.9015, test_f1: 0.6512
 epoch: 62, train_loss: 0.5690, test_loss: 0.8707, test_f1: 0.6516
 epoch: 63, train_loss: 0.5732, test_loss: 0.9337, test_f1: 0.6274
 epoch: 64, train_loss: 0.5710, test_loss: 0.8802, test_f1: 0.6565
 epoch: 65, train_loss: 0.5621, test_loss: 0.9294, test_f1: 0.6541
 epoch: 66, train_loss: 0.5723, test_loss: 0.8936, test_f1: 0.6597
 epoch: 67, train_loss: 0.5656, test_loss: 0.8936, test_f1: 0.6540
 epoch: 68, train_loss: 0.5643, test_loss: 0.8982, test_f1: 0.6426
 epoch: 69, train_loss: 0.5574, test_loss: 0.8996, test_f1: 0.6205
 epoch: 70, train_loss: 0.5523, test_loss: 0.8844, test_f1: 0.6563
 epoch: 71, train_loss: 0.5518, test_loss: 0.9603, test_f1: 0.6393
 epoch: 72, train_loss: 0.5539, test_loss: 0.9118, test_f1: 0.6661
 epoch: 73, train_loss: 0.5452, test_loss: 0.9398, test_f1: 0.6450
 epoch: 74, train_loss: 0.5378, test_loss: 0.9074, test_f1: 0.6530
 epoch: 75, train_loss: 0.5367, test_loss: 0.9321, test_f1: 0.6548
 epoch: 76, train_loss: 0.5287, test_loss: 0.9349, test_f1: 0.6438
 epoch: 77, train_loss: 0.5380, test_loss: 1.0263, test_f1: 0.6098
 epoch: 78, train_loss: 0.5209, test_loss: 0.9241, test_f1: 0.6703
 epoch: 79, train_loss: 0.5222, test_loss: 0.9608, test_f1: 0.6463
 epoch: 80, train_loss: 0.5427, test_loss: 0.9204, test_f1: 0.6419
 epoch: 81, train_loss: 0.5215, test_loss: 0.8932, test_f1: 0.6316
 epoch: 82, train_loss: 0.5089, test_loss: 0.9284, test_f1: 0.6485
 epoch: 83, train_loss: 0.5439, test_loss: 0.9537, test_f1: 0.6261
 epoch: 84, train_loss: 0.5447, test_loss: 0.9217, test_f1: 0.6361
 epoch: 85, train_loss: 0.5189, test_loss: 0.9376, test_f1: 0.6426
 epoch: 86, train_loss: 0.5293, test_loss: 0.9272, test_f1: 0.6357
 epoch: 87, train_loss: 0.5271, test_loss: 0.9682, test_f1: 0.6333
 epoch: 88, train_loss: 0.5162, test_loss: 0.9681, test_f1: 0.6343
 epoch: 89, train_loss: 0.4996, test_loss: 0.9751, test_f1: 0.6558
 epoch: 90, train_loss: 0.5127, test_loss: 0.9746, test_f1: 0.6485
 epoch: 91, train_loss: 0.5061, test_loss: 0.9703, test_f1: 0.6514
 epoch: 92, train_loss: 0.5131, test_loss: 0.9744, test_f1: 0.6537
 epoch: 93, train_loss: 0.5056, test_loss: 0.9178, test_f1: 0.6670
 epoch: 94, train_loss: 0.5080, test_loss: 0.9266, test_f1: 0.6497
 epoch: 95, train_loss: 0.5056, test_loss: 0.9774, test_f1: 0.6651
 epoch: 96, train_loss: 0.4878, test_loss: 1.0275, test_f1: 0.6412
 epoch: 97, train_loss: 0.5174, test_loss: 0.9336, test_f1: 0.6572
 epoch: 98, train_loss: 0.4962, test_loss: 0.9948, test_f1: 0.6415
 epoch: 99, train_loss: 0.5161, test_loss: 1.0031, test_f1: 0.6482
##################ITERATION #2 ****************************************
 epoch: 0, train_loss: 1.1476, test_loss: 1.1229, test_f1: 0.4080
 epoch: 1, train_loss: 1.0218, test_loss: 1.0169, test_f1: 0.4738
 epoch: 2, train_loss: 0.9881, test_loss: 1.0279, test_f1: 0.4712
 epoch: 3, train_loss: 0.9704, test_loss: 0.9863, test_f1: 0.5180
 epoch: 4, train_loss: 0.9550, test_loss: 0.9900, test_f1: 0.4912
 epoch: 5, train_loss: 0.9325, test_loss: 0.9610, test_f1: 0.5124
 epoch: 6, train_loss: 0.9338, test_loss: 0.9908, test_f1: 0.4870
 epoch: 7, train_loss: 0.9115, test_loss: 0.9492, test_f1: 0.5205
 epoch: 8, train_loss: 0.8935, test_loss: 0.9284, test_f1: 0.5386
 epoch: 9, train_loss: 0.8786, test_loss: 0.9172, test_f1: 0.5652
 epoch: 10, train_loss: 0.8691, test_loss: 0.9031, test_f1: 0.5684
 epoch: 11, train_loss: 0.8579, test_loss: 0.8909, test_f1: 0.5843
 epoch: 12, train_loss: 0.8459, test_loss: 0.9164, test_f1: 0.5492
 epoch: 13, train_loss: 0.8431, test_loss: 0.8787, test_f1: 0.5470
 epoch: 14, train_loss: 0.8344, test_loss: 0.8766, test_f1: 0.5587
 epoch: 15, train_loss: 0.8157, test_loss: 0.8772, test_f1: 0.5700
 epoch: 16, train_loss: 0.8025, test_loss: 0.9046, test_f1: 0.5654
 epoch: 17, train_loss: 0.8039, test_loss: 0.8710, test_f1: 0.5838
 epoch: 18, train_loss: 0.7938, test_loss: 0.8554, test_f1: 0.5884
 epoch: 19, train_loss: 0.7944, test_loss: 0.9059, test_f1: 0.5635
 epoch: 20, train_loss: 0.7922, test_loss: 0.8591, test_f1: 0.6125
 epoch: 21, train_loss: 0.7644, test_loss: 0.8781, test_f1: 0.5672
 epoch: 22, train_loss: 0.7758, test_loss: 0.8682, test_f1: 0.6502
 epoch: 23, train_loss: 0.7582, test_loss: 0.8547, test_f1: 0.5736
 epoch: 24, train_loss: 0.7376, test_loss: 0.8433, test_f1: 0.6243
 epoch: 25, train_loss: 0.7424, test_loss: 0.9006, test_f1: 0.5919
 epoch: 26, train_loss: 0.7346, test_loss: 0.8159, test_f1: 0.6120
 epoch: 27, train_loss: 0.7361, test_loss: 0.8022, test_f1: 0.6402
 epoch: 28, train_loss: 0.7305, test_loss: 0.8207, test_f1: 0.6247
 epoch: 29, train_loss: 0.7259, test_loss: 0.8446, test_f1: 0.6397
 epoch: 30, train_loss: 0.7126, test_loss: 0.8313, test_f1: 0.6657
 epoch: 31, train_loss: 0.7159, test_loss: 0.8382, test_f1: 0.5697
 epoch: 32, train_loss: 0.7053, test_loss: 0.8016, test_f1: 0.6324
 epoch: 33, train_loss: 0.7000, test_loss: 0.8115, test_f1: 0.6411
 epoch: 34, train_loss: 0.7089, test_loss: 0.8005, test_f1: 0.6490
 epoch: 35, train_loss: 0.7126, test_loss: 0.8506, test_f1: 0.6061
 epoch: 36, train_loss: 0.6964, test_loss: 0.8544, test_f1: 0.6088
 epoch: 37, train_loss: 0.6698, test_loss: 0.8206, test_f1: 0.6329
 epoch: 38, train_loss: 0.6759, test_loss: 0.8028, test_f1: 0.6357
 epoch: 39, train_loss: 0.6769, test_loss: 0.8384, test_f1: 0.6282
 epoch: 40, train_loss: 0.6837, test_loss: 0.8291, test_f1: 0.6212
 epoch: 41, train_loss: 0.6831, test_loss: 0.8344, test_f1: 0.5818
 epoch: 42, train_loss: 0.6646, test_loss: 0.8153, test_f1: 0.6184
 epoch: 43, train_loss: 0.6662, test_loss: 0.7837, test_f1: 0.6123
 epoch: 44, train_loss: 0.6681, test_loss: 0.8192, test_f1: 0.6417
 epoch: 45, train_loss: 0.6591, test_loss: 0.8237, test_f1: 0.6363
 epoch: 46, train_loss: 0.6535, test_loss: 0.7918, test_f1: 0.6424
 epoch: 47, train_loss: 0.6384, test_loss: 0.8253, test_f1: 0.6107
 epoch: 48, train_loss: 0.6524, test_loss: 0.8091, test_f1: 0.6691
 epoch: 49, train_loss: 0.6425, test_loss: 3.0558, test_f1: 0.4694
 epoch: 50, train_loss: 0.6654, test_loss: 0.9318, test_f1: 0.5988
 epoch: 51, train_loss: 0.6207, test_loss: 0.7703, test_f1: 0.6544
 epoch: 52, train_loss: 0.6218, test_loss: 0.8123, test_f1: 0.6433
 epoch: 53, train_loss: 0.6167, test_loss: 0.8059, test_f1: 0.6465
 epoch: 54, train_loss: 0.6033, test_loss: 0.7680, test_f1: 0.6486
 epoch: 55, train_loss: 0.5962, test_loss: 0.7713, test_f1: 0.6723
 epoch: 56, train_loss: 0.5953, test_loss: 0.7592, test_f1: 0.6626
 epoch: 57, train_loss: 0.5839, test_loss: 0.7900, test_f1: 0.6732
 epoch: 58, train_loss: 0.5915, test_loss: 0.8113, test_f1: 0.6625
 epoch: 59, train_loss: 0.5834, test_loss: 0.7825, test_f1: 0.6531
 epoch: 60, train_loss: 0.5783, test_loss: 0.8100, test_f1: 0.6471
 epoch: 61, train_loss: 0.5733, test_loss: 0.7998, test_f1: 0.6674
 epoch: 62, train_loss: 0.5732, test_loss: 0.7760, test_f1: 0.6448
 epoch: 63, train_loss: 0.5770, test_loss: 0.7951, test_f1: 0.6507
 epoch: 64, train_loss: 0.5715, test_loss: 0.8342, test_f1: 0.6538
 epoch: 65, train_loss: 0.5775, test_loss: 0.7882, test_f1: 0.6726
 epoch: 66, train_loss: 0.5679, test_loss: 0.8582, test_f1: 0.6139
 epoch: 67, train_loss: 0.5633, test_loss: 0.8374, test_f1: 0.6480
 epoch: 68, train_loss: 0.5741, test_loss: 0.8131, test_f1: 0.6610
 epoch: 69, train_loss: 0.5509, test_loss: 0.8003, test_f1: 0.6842
 epoch: 70, train_loss: 0.5502, test_loss: 0.8230, test_f1: 0.6464
 epoch: 71, train_loss: 0.5625, test_loss: 0.8321, test_f1: 0.6649
 epoch: 72, train_loss: 0.5544, test_loss: 0.8155, test_f1: 0.6483
 epoch: 73, train_loss: 0.5633, test_loss: 0.7694, test_f1: 0.6883
 epoch: 74, train_loss: 0.5457, test_loss: 0.7854, test_f1: 0.6787
 epoch: 75, train_loss: 0.5591, test_loss: 0.8195, test_f1: 0.6527
 epoch: 76, train_loss: 0.5467, test_loss: 0.8361, test_f1: 0.6385
 epoch: 77, train_loss: 0.5413, test_loss: 0.8309, test_f1: 0.6707
 epoch: 78, train_loss: 0.5286, test_loss: 0.8154, test_f1: 0.6317
 epoch: 79, train_loss: 0.5285, test_loss: 0.8367, test_f1: 0.6531
 epoch: 80, train_loss: 0.5507, test_loss: 0.8233, test_f1: 0.6308
 epoch: 81, train_loss: 0.5382, test_loss: 0.8189, test_f1: 0.6515
 epoch: 82, train_loss: 0.5435, test_loss: 0.8579, test_f1: 0.6620
 epoch: 83, train_loss: 0.5400, test_loss: 0.8282, test_f1: 0.6475
 epoch: 84, train_loss: 0.5312, test_loss: 0.8632, test_f1: 0.6716
 epoch: 85, train_loss: 0.5098, test_loss: 0.8498, test_f1: 0.6420
 epoch: 86, train_loss: 0.5314, test_loss: 0.8114, test_f1: 0.6680
 epoch: 87, train_loss: 0.5318, test_loss: 0.8243, test_f1: 0.6598
 epoch: 88, train_loss: 0.5446, test_loss: 0.8409, test_f1: 0.6348
 epoch: 89, train_loss: 0.5280, test_loss: 0.8289, test_f1: 0.6641
 epoch: 90, train_loss: 0.5235, test_loss: 0.8746, test_f1: 0.6259
 epoch: 91, train_loss: 0.5217, test_loss: 0.8523, test_f1: 0.6445
 epoch: 92, train_loss: 0.5153, test_loss: 0.8286, test_f1: 0.6402
 epoch: 93, train_loss: 0.5066, test_loss: 0.8581, test_f1: 0.6571
 epoch: 94, train_loss: 0.4935, test_loss: 0.8222, test_f1: 0.6687
 epoch: 95, train_loss: 0.5061, test_loss: 0.8478, test_f1: 0.6631
 epoch: 96, train_loss: 0.4994, test_loss: 0.9370, test_f1: 0.6592
 epoch: 97, train_loss: 0.5197, test_loss: 0.8398, test_f1: 0.6514
 epoch: 98, train_loss: 0.4918, test_loss: 0.9614, test_f1: 0.6281
 epoch: 99, train_loss: 0.4991, test_loss: 0.8877, test_f1: 0.6437
##################ITERATION #3 ****************************************
 epoch: 0, train_loss: 1.1445, test_loss: 0.9737, test_f1: 0.5236
 epoch: 1, train_loss: 0.9952, test_loss: 0.9884, test_f1: 0.4649
 epoch: 2, train_loss: 0.9734, test_loss: 0.9637, test_f1: 0.4871
 epoch: 3, train_loss: 0.9456, test_loss: 0.9433, test_f1: 0.5071
 epoch: 4, train_loss: 0.9398, test_loss: 0.9069, test_f1: 0.5130
 epoch: 5, train_loss: 0.9171, test_loss: 0.9138, test_f1: 0.5285
 epoch: 6, train_loss: 0.9135, test_loss: 0.8392, test_f1: 0.5441
 epoch: 7, train_loss: 0.8888, test_loss: 0.8432, test_f1: 0.5625
 epoch: 8, train_loss: 0.8848, test_loss: 0.8743, test_f1: 0.5513
 epoch: 9, train_loss: 0.8691, test_loss: 0.9360, test_f1: 0.5371
 epoch: 10, train_loss: 0.8566, test_loss: 0.8517, test_f1: 0.5642
 epoch: 11, train_loss: 0.8449, test_loss: 0.8962, test_f1: 0.5547
 epoch: 12, train_loss: 0.8351, test_loss: 0.8476, test_f1: 0.5808
 epoch: 13, train_loss: 0.8173, test_loss: 0.7969, test_f1: 0.5744
 epoch: 14, train_loss: 0.8097, test_loss: 0.8064, test_f1: 0.5558
 epoch: 15, train_loss: 0.7960, test_loss: 0.8238, test_f1: 0.6094
 epoch: 16, train_loss: 0.8059, test_loss: 0.7991, test_f1: 0.5739
 epoch: 17, train_loss: 0.7933, test_loss: 0.8016, test_f1: 0.6088
 epoch: 18, train_loss: 0.8009, test_loss: 0.8001, test_f1: 0.6042
 epoch: 19, train_loss: 0.7864, test_loss: 0.8279, test_f1: 0.5873
 epoch: 20, train_loss: 0.7893, test_loss: 0.8596, test_f1: 0.6098
 epoch: 21, train_loss: 0.7797, test_loss: 0.8000, test_f1: 0.5802
 epoch: 22, train_loss: 0.7880, test_loss: 0.8210, test_f1: 0.5705
 epoch: 23, train_loss: 0.7667, test_loss: 0.8130, test_f1: 0.6023
 epoch: 24, train_loss: 0.7580, test_loss: 0.7734, test_f1: 0.5971
 epoch: 25, train_loss: 0.7458, test_loss: 0.8194, test_f1: 0.5749
 epoch: 26, train_loss: 0.7557, test_loss: 0.8051, test_f1: 0.6166
 epoch: 27, train_loss: 0.7480, test_loss: 0.7874, test_f1: 0.6188
 epoch: 28, train_loss: 0.7330, test_loss: 0.7660, test_f1: 0.6342
 epoch: 29, train_loss: 0.7264, test_loss: 0.8454, test_f1: 0.6302
 epoch: 30, train_loss: 0.7200, test_loss: 0.9074, test_f1: 0.6360
 epoch: 31, train_loss: 0.7146, test_loss: 0.7821, test_f1: 0.6530
 epoch: 32, train_loss: 0.7180, test_loss: 0.7866, test_f1: 0.5897
 epoch: 33, train_loss: 0.7066, test_loss: 0.7712, test_f1: 0.6540
 epoch: 34, train_loss: 0.7186, test_loss: 0.7977, test_f1: 0.6512
 epoch: 35, train_loss: 0.7012, test_loss: 0.8806, test_f1: 0.5998
 epoch: 36, train_loss: 0.7017, test_loss: 0.7786, test_f1: 0.6425
 epoch: 37, train_loss: 0.7057, test_loss: 0.8164, test_f1: 0.6496
 epoch: 38, train_loss: 0.6972, test_loss: 0.8033, test_f1: 0.6421
 epoch: 39, train_loss: 0.6911, test_loss: 0.8165, test_f1: 0.6429
 epoch: 40, train_loss: 0.6890, test_loss: 0.7908, test_f1: 0.6615
 epoch: 41, train_loss: 0.6708, test_loss: 0.8262, test_f1: 0.6610
 epoch: 42, train_loss: 0.6799, test_loss: 0.8658, test_f1: 0.6722
 epoch: 43, train_loss: 0.6833, test_loss: 0.8430, test_f1: 0.6379
 epoch: 44, train_loss: 0.6786, test_loss: 0.8223, test_f1: 0.6185
 epoch: 45, train_loss: 0.6641, test_loss: 0.8174, test_f1: 0.6569
 epoch: 46, train_loss: 0.6479, test_loss: 0.8723, test_f1: 0.6384
 epoch: 47, train_loss: 0.6700, test_loss: 0.8788, test_f1: 0.6428
 epoch: 48, train_loss: 0.6487, test_loss: 0.8453, test_f1: 0.6498
 epoch: 49, train_loss: 0.6503, test_loss: 0.8678, test_f1: 0.6685
 epoch: 50, train_loss: 0.6623, test_loss: 0.8256, test_f1: 0.6491
 epoch: 51, train_loss: 0.6330, test_loss: 0.8659, test_f1: 0.6718
 epoch: 52, train_loss: 0.6150, test_loss: 0.8657, test_f1: 0.6626
 epoch: 53, train_loss: 0.6008, test_loss: 0.8799, test_f1: 0.6836
 epoch: 54, train_loss: 0.6118, test_loss: 0.8751, test_f1: 0.6780
 epoch: 55, train_loss: 0.6011, test_loss: 0.8868, test_f1: 0.6591
 epoch: 56, train_loss: 0.6146, test_loss: 0.8926, test_f1: 0.6738
 epoch: 57, train_loss: 0.5899, test_loss: 0.8996, test_f1: 0.6767
 epoch: 58, train_loss: 0.5868, test_loss: 0.9396, test_f1: 0.6720
 epoch: 59, train_loss: 0.5799, test_loss: 0.9607, test_f1: 0.6397
 epoch: 60, train_loss: 0.6019, test_loss: 0.9418, test_f1: 0.6616
 epoch: 61, train_loss: 0.5907, test_loss: 0.8957, test_f1: 0.6521
 epoch: 62, train_loss: 0.5882, test_loss: 0.9894, test_f1: 0.6658
 epoch: 63, train_loss: 0.5818, test_loss: 0.9310, test_f1: 0.6647
 epoch: 64, train_loss: 0.5899, test_loss: 0.9610, test_f1: 0.6761
 epoch: 65, train_loss: 0.5801, test_loss: 0.9784, test_f1: 0.6583
 epoch: 66, train_loss: 0.5731, test_loss: 0.9700, test_f1: 0.6505
 epoch: 67, train_loss: 0.5793, test_loss: 0.9612, test_f1: 0.6578
 epoch: 68, train_loss: 0.5812, test_loss: 0.9458, test_f1: 0.6639
 epoch: 69, train_loss: 0.5857, test_loss: 0.9731, test_f1: 0.6412
 epoch: 70, train_loss: 0.5770, test_loss: 0.9883, test_f1: 0.6387
 epoch: 71, train_loss: 0.5622, test_loss: 0.9667, test_f1: 0.6636
 epoch: 72, train_loss: 0.5720, test_loss: 1.0148, test_f1: 0.6712
 epoch: 73, train_loss: 0.5630, test_loss: 1.0114, test_f1: 0.6704
 epoch: 74, train_loss: 0.5514, test_loss: 1.0033, test_f1: 0.6660
 epoch: 75, train_loss: 0.5712, test_loss: 1.0356, test_f1: 0.6705
 epoch: 76, train_loss: 0.5648, test_loss: 0.9913, test_f1: 0.6556
 epoch: 77, train_loss: 0.5634, test_loss: 1.0564, test_f1: 0.6373
 epoch: 78, train_loss: 0.5563, test_loss: 1.1372, test_f1: 0.6348
 epoch: 79, train_loss: 0.5504, test_loss: 1.0233, test_f1: 0.6449
 epoch: 80, train_loss: 0.5494, test_loss: 1.0618, test_f1: 0.6552
 epoch: 81, train_loss: 0.5328, test_loss: 1.0861, test_f1: 0.6511
 epoch: 82, train_loss: 0.5478, test_loss: 1.0865, test_f1: 0.6568
 epoch: 83, train_loss: 0.5481, test_loss: 1.0690, test_f1: 0.6526
 epoch: 84, train_loss: 0.5389, test_loss: 1.0809, test_f1: 0.6597
 epoch: 85, train_loss: 0.5251, test_loss: 1.0337, test_f1: 0.6532
 epoch: 86, train_loss: 0.5314, test_loss: 1.0499, test_f1: 0.6710
 epoch: 87, train_loss: 0.5370, test_loss: 1.1229, test_f1: 0.6375
 epoch: 88, train_loss: 0.5340, test_loss: 1.0594, test_f1: 0.6725
 epoch: 89, train_loss: 0.5350, test_loss: 1.0547, test_f1: 0.6622
 epoch: 90, train_loss: 0.5283, test_loss: 1.1465, test_f1: 0.6453
 epoch: 91, train_loss: 0.5248, test_loss: 1.0713, test_f1: 0.6822
 epoch: 92, train_loss: 0.5315, test_loss: 1.0774, test_f1: 0.6717
 epoch: 93, train_loss: 0.5235, test_loss: 1.1850, test_f1: 0.6373
 epoch: 94, train_loss: 0.5139, test_loss: 1.1046, test_f1: 0.6504
 epoch: 95, train_loss: 0.5247, test_loss: 1.1682, test_f1: 0.6808
 epoch: 96, train_loss: 0.5081, test_loss: 1.0978, test_f1: 0.6754
 epoch: 97, train_loss: 0.5170, test_loss: 1.1041, test_f1: 0.6465
 epoch: 98, train_loss: 0.5242, test_loss: 1.1404, test_f1: 0.6693
 epoch: 99, train_loss: 0.5039, test_loss: 1.1281, test_f1: 0.6447
##################ITERATION #4 ****************************************
 epoch: 0, train_loss: 1.2115, test_loss: 1.0193, test_f1: 0.4537
 epoch: 1, train_loss: 1.0444, test_loss: 1.0454, test_f1: 0.4906
 epoch: 2, train_loss: 1.0131, test_loss: 0.9902, test_f1: 0.4975
 epoch: 3, train_loss: 0.9723, test_loss: 0.9088, test_f1: 0.5047
 epoch: 4, train_loss: 0.9558, test_loss: 0.9029, test_f1: 0.4924
 epoch: 5, train_loss: 0.9514, test_loss: 0.8728, test_f1: 0.5183
 epoch: 6, train_loss: 0.9185, test_loss: 0.8718, test_f1: 0.5269
 epoch: 7, train_loss: 0.9150, test_loss: 0.8623, test_f1: 0.5199
 epoch: 8, train_loss: 0.8945, test_loss: 0.8773, test_f1: 0.5396
 epoch: 9, train_loss: 0.8866, test_loss: 0.8547, test_f1: 0.5537
 epoch: 10, train_loss: 0.8742, test_loss: 0.8585, test_f1: 0.5304
 epoch: 11, train_loss: 0.8587, test_loss: 0.8217, test_f1: 0.5431
 epoch: 12, train_loss: 0.8410, test_loss: 0.8159, test_f1: 0.5616
 epoch: 13, train_loss: 0.8334, test_loss: 0.8024, test_f1: 0.5640
 epoch: 14, train_loss: 0.8248, test_loss: 0.8221, test_f1: 0.5599
 epoch: 15, train_loss: 0.8256, test_loss: 0.7787, test_f1: 0.6156
 epoch: 16, train_loss: 0.8166, test_loss: 0.7622, test_f1: 0.5866
 epoch: 17, train_loss: 0.7972, test_loss: 0.7821, test_f1: 0.6013
 epoch: 18, train_loss: 0.7859, test_loss: 0.7845, test_f1: 0.5937
 epoch: 19, train_loss: 0.7797, test_loss: 0.8064, test_f1: 0.5865
 epoch: 20, train_loss: 0.7704, test_loss: 0.7715, test_f1: 0.5957
 epoch: 21, train_loss: 0.7561, test_loss: 0.7911, test_f1: 0.6042
 epoch: 22, train_loss: 0.7525, test_loss: 0.8346, test_f1: 0.6019
 epoch: 23, train_loss: 0.7515, test_loss: 0.7792, test_f1: 0.6196
 epoch: 24, train_loss: 0.7408, test_loss: 0.7503, test_f1: 0.6266
 epoch: 25, train_loss: 0.7226, test_loss: 0.7383, test_f1: 0.6363
 epoch: 26, train_loss: 0.7242, test_loss: 0.7663, test_f1: 0.6146
 epoch: 27, train_loss: 0.7307, test_loss: 0.7595, test_f1: 0.6364
 epoch: 28, train_loss: 0.7152, test_loss: 0.7607, test_f1: 0.6127
 epoch: 29, train_loss: 0.7151, test_loss: 0.7798, test_f1: 0.6187
 epoch: 30, train_loss: 0.6942, test_loss: 0.7533, test_f1: 0.6260
 epoch: 31, train_loss: 0.6922, test_loss: 0.7755, test_f1: 0.6156
 epoch: 32, train_loss: 0.7006, test_loss: 0.8431, test_f1: 0.6307
 epoch: 33, train_loss: 0.6892, test_loss: 0.7736, test_f1: 0.6264
 epoch: 34, train_loss: 0.6931, test_loss: 0.8060, test_f1: 0.6330
 epoch: 35, train_loss: 0.6961, test_loss: 0.7551, test_f1: 0.6495
 epoch: 36, train_loss: 0.6793, test_loss: 0.7769, test_f1: 0.6269
 epoch: 37, train_loss: 0.6649, test_loss: 0.8095, test_f1: 0.6251
 epoch: 38, train_loss: 0.6557, test_loss: 0.8734, test_f1: 0.6290
 epoch: 39, train_loss: 0.6684, test_loss: 0.8120, test_f1: 0.6127
 epoch: 40, train_loss: 0.6654, test_loss: 0.8248, test_f1: 0.6485
 epoch: 41, train_loss: 0.6633, test_loss: 0.8243, test_f1: 0.6461
 epoch: 42, train_loss: 0.6657, test_loss: 0.7907, test_f1: 0.6619
 epoch: 43, train_loss: 0.6343, test_loss: 0.7954, test_f1: 0.6643
 epoch: 44, train_loss: 0.6442, test_loss: 0.9130, test_f1: 0.6490
 epoch: 45, train_loss: 0.6399, test_loss: 0.8508, test_f1: 0.6547
 epoch: 46, train_loss: 0.6303, test_loss: 0.8759, test_f1: 0.6155
 epoch: 47, train_loss: 0.6327, test_loss: 0.9173, test_f1: 0.6502
 epoch: 48, train_loss: 0.6328, test_loss: 0.8427, test_f1: 0.6489
 epoch: 49, train_loss: 0.6343, test_loss: 0.9785, test_f1: 0.5954
 epoch: 50, train_loss: 0.6194, test_loss: 0.8078, test_f1: 0.6632
 epoch: 51, train_loss: 0.5896, test_loss: 0.8764, test_f1: 0.6374
 epoch: 52, train_loss: 0.5844, test_loss: 0.8520, test_f1: 0.6654
 epoch: 53, train_loss: 0.5597, test_loss: 0.8631, test_f1: 0.6619
 epoch: 54, train_loss: 0.5705, test_loss: 0.8633, test_f1: 0.6550
 epoch: 55, train_loss: 0.5652, test_loss: 0.8356, test_f1: 0.6517
 epoch: 56, train_loss: 0.5755, test_loss: 0.8114, test_f1: 0.6394
 epoch: 57, train_loss: 0.5851, test_loss: 0.8289, test_f1: 0.6800
 epoch: 58, train_loss: 0.5585, test_loss: 0.8105, test_f1: 0.6643
 epoch: 59, train_loss: 0.5445, test_loss: 0.8092, test_f1: 0.6635
 epoch: 60, train_loss: 0.5564, test_loss: 0.8287, test_f1: 0.6833
 epoch: 61, train_loss: 0.5480, test_loss: 0.8923, test_f1: 0.6509
 epoch: 62, train_loss: 0.5587, test_loss: 0.8413, test_f1: 0.6580
 epoch: 63, train_loss: 0.5481, test_loss: 0.8195, test_f1: 0.6643
 epoch: 64, train_loss: 0.5422, test_loss: 0.8650, test_f1: 0.6556
 epoch: 65, train_loss: 0.5261, test_loss: 0.8548, test_f1: 0.6681
 epoch: 66, train_loss: 0.5280, test_loss: 0.8820, test_f1: 0.6754
 epoch: 67, train_loss: 0.5387, test_loss: 0.8896, test_f1: 0.6862
 epoch: 68, train_loss: 0.5280, test_loss: 0.8952, test_f1: 0.6474
 epoch: 69, train_loss: 0.5187, test_loss: 0.9353, test_f1: 0.6562
 epoch: 70, train_loss: 0.5231, test_loss: 0.9415, test_f1: 0.6542
 epoch: 71, train_loss: 0.5363, test_loss: 0.8794, test_f1: 0.6765
 epoch: 72, train_loss: 0.5265, test_loss: 0.8866, test_f1: 0.6478
 epoch: 73, train_loss: 0.5236, test_loss: 0.8628, test_f1: 0.6698
 epoch: 74, train_loss: 0.5135, test_loss: 0.9207, test_f1: 0.6575
 epoch: 75, train_loss: 0.5237, test_loss: 0.8864, test_f1: 0.6892
 epoch: 76, train_loss: 0.5094, test_loss: 0.8990, test_f1: 0.6833
 epoch: 77, train_loss: 0.5124, test_loss: 0.9585, test_f1: 0.6669
 epoch: 78, train_loss: 0.5154, test_loss: 0.9402, test_f1: 0.6441
 epoch: 79, train_loss: 0.5087, test_loss: 0.9233, test_f1: 0.6683
 epoch: 80, train_loss: 0.5025, test_loss: 0.9858, test_f1: 0.6600
 epoch: 81, train_loss: 0.5154, test_loss: 1.0043, test_f1: 0.6473
 epoch: 82, train_loss: 0.5019, test_loss: 0.9569, test_f1: 0.6576
 epoch: 83, train_loss: 0.5095, test_loss: 0.9215, test_f1: 0.6839
 epoch: 84, train_loss: 0.4911, test_loss: 0.9751, test_f1: 0.6812
 epoch: 85, train_loss: 0.5056, test_loss: 0.9474, test_f1: 0.6776
 epoch: 86, train_loss: 0.5085, test_loss: 0.9619, test_f1: 0.6544
 epoch: 87, train_loss: 0.5034, test_loss: 0.9936, test_f1: 0.6579
 epoch: 88, train_loss: 0.4847, test_loss: 1.0298, test_f1: 0.6351
 epoch: 89, train_loss: 0.5012, test_loss: 0.9270, test_f1: 0.6692
 epoch: 90, train_loss: 0.4863, test_loss: 0.9375, test_f1: 0.6688
 epoch: 91, train_loss: 0.4932, test_loss: 0.9182, test_f1: 0.6813
 epoch: 92, train_loss: 0.4925, test_loss: 0.8604, test_f1: 0.6689
 epoch: 93, train_loss: 0.4875, test_loss: 0.9473, test_f1: 0.6603
 epoch: 94, train_loss: 0.4772, test_loss: 0.9532, test_f1: 0.6644
 epoch: 95, train_loss: 0.4889, test_loss: 0.9569, test_f1: 0.6608
 epoch: 96, train_loss: 0.4706, test_loss: 0.9816, test_f1: 0.6739
 epoch: 97, train_loss: 0.4877, test_loss: 0.9492, test_f1: 0.6542
 epoch: 98, train_loss: 0.4902, test_loss: 0.9480, test_f1: 0.6650
 epoch: 99, train_loss: 0.4816, test_loss: 0.9424, test_f1: 0.6627
##################ITERATION #5 ****************************************
 epoch: 0, train_loss: 1.2065, test_loss: 1.0981, test_f1: 0.4329
 epoch: 1, train_loss: 1.0248, test_loss: 1.0621, test_f1: 0.4446
 epoch: 2, train_loss: 0.9920, test_loss: 1.0088, test_f1: 0.4711
 epoch: 3, train_loss: 0.9717, test_loss: 0.9917, test_f1: 0.4930
 epoch: 4, train_loss: 0.9535, test_loss: 0.9663, test_f1: 0.5338
 epoch: 5, train_loss: 0.9496, test_loss: 0.9387, test_f1: 0.5071
 epoch: 6, train_loss: 0.9250, test_loss: 0.9409, test_f1: 0.5047
 epoch: 7, train_loss: 0.9258, test_loss: 0.9111, test_f1: 0.5091
 epoch: 8, train_loss: 0.8926, test_loss: 0.9371, test_f1: 0.5281
 epoch: 9, train_loss: 0.8905, test_loss: 0.8774, test_f1: 0.5104
 epoch: 10, train_loss: 0.8725, test_loss: 0.9061, test_f1: 0.5558
 epoch: 11, train_loss: 0.8746, test_loss: 0.8684, test_f1: 0.5627
 epoch: 12, train_loss: 0.8664, test_loss: 0.9067, test_f1: 0.5533
 epoch: 13, train_loss: 0.8578, test_loss: 0.8845, test_f1: 0.5611
 epoch: 14, train_loss: 0.8326, test_loss: 0.8633, test_f1: 0.5426
 epoch: 15, train_loss: 0.8294, test_loss: 0.8019, test_f1: 0.6036
 epoch: 16, train_loss: 0.8312, test_loss: 0.8085, test_f1: 0.5854
 epoch: 17, train_loss: 0.8338, test_loss: 0.7953, test_f1: 0.5807
 epoch: 18, train_loss: 0.8142, test_loss: 0.8191, test_f1: 0.6082
 epoch: 19, train_loss: 0.7961, test_loss: 0.8634, test_f1: 0.5559
 epoch: 20, train_loss: 0.8038, test_loss: 0.8382, test_f1: 0.6028
 epoch: 21, train_loss: 0.7859, test_loss: 0.7988, test_f1: 0.5742
 epoch: 22, train_loss: 0.7779, test_loss: 0.7921, test_f1: 0.6061
 epoch: 23, train_loss: 0.7752, test_loss: 0.8279, test_f1: 0.5786
 epoch: 24, train_loss: 0.7664, test_loss: 0.7826, test_f1: 0.6105
 epoch: 25, train_loss: 0.7675, test_loss: 0.7990, test_f1: 0.6228
 epoch: 26, train_loss: 0.7567, test_loss: 0.7962, test_f1: 0.6513
 epoch: 27, train_loss: 0.7411, test_loss: 0.7500, test_f1: 0.6161
 epoch: 28, train_loss: 0.7365, test_loss: 0.7394, test_f1: 0.6585
 epoch: 29, train_loss: 0.7343, test_loss: 0.8139, test_f1: 0.6263
 epoch: 30, train_loss: 0.7051, test_loss: 0.7723, test_f1: 0.6347
 epoch: 31, train_loss: 0.7250, test_loss: 0.7391, test_f1: 0.6007
 epoch: 32, train_loss: 0.7114, test_loss: 0.7787, test_f1: 0.6519
 epoch: 33, train_loss: 0.7188, test_loss: 0.7324, test_f1: 0.6416
 epoch: 34, train_loss: 0.7087, test_loss: 0.7184, test_f1: 0.6468
 epoch: 35, train_loss: 0.7137, test_loss: 0.7307, test_f1: 0.6456
 epoch: 36, train_loss: 0.7016, test_loss: 0.7311, test_f1: 0.6157
 epoch: 37, train_loss: 0.7047, test_loss: 0.7711, test_f1: 0.6239
 epoch: 38, train_loss: 0.6813, test_loss: 0.7497, test_f1: 0.6277
 epoch: 39, train_loss: 0.6573, test_loss: 0.7390, test_f1: 0.6668
 epoch: 40, train_loss: 0.6900, test_loss: 0.7118, test_f1: 0.6627
 epoch: 41, train_loss: 0.6692, test_loss: 0.7798, test_f1: 0.6562
 epoch: 42, train_loss: 0.6819, test_loss: 0.7130, test_f1: 0.6573
 epoch: 43, train_loss: 0.6738, test_loss: 0.7837, test_f1: 0.6132
 epoch: 44, train_loss: 0.6668, test_loss: 0.7790, test_f1: 0.6452
 epoch: 45, train_loss: 0.6676, test_loss: 0.8318, test_f1: 0.6276
 epoch: 46, train_loss: 0.6476, test_loss: 0.7705, test_f1: 0.6427
 epoch: 47, train_loss: 0.6370, test_loss: 0.7868, test_f1: 0.6589
 epoch: 48, train_loss: 0.6616, test_loss: 0.7998, test_f1: 0.6501
 epoch: 49, train_loss: 0.6539, test_loss: 0.7885, test_f1: 0.6353
 epoch: 50, train_loss: 0.6431, test_loss: 0.6642, test_f1: 0.7149
 epoch: 51, train_loss: 0.6176, test_loss: 0.7968, test_f1: 0.6803
 epoch: 52, train_loss: 0.6158, test_loss: 0.7629, test_f1: 0.6764
 epoch: 53, train_loss: 0.5952, test_loss: 0.8021, test_f1: 0.6541
 epoch: 54, train_loss: 0.5965, test_loss: 0.7947, test_f1: 0.6505
 epoch: 55, train_loss: 0.5986, test_loss: 0.7830, test_f1: 0.6685
 epoch: 56, train_loss: 0.5954, test_loss: 0.7815, test_f1: 0.6968
 epoch: 57, train_loss: 0.5904, test_loss: 0.7677, test_f1: 0.6753
 epoch: 58, train_loss: 0.5825, test_loss: 0.8382, test_f1: 0.6599
 epoch: 59, train_loss: 0.5732, test_loss: 0.8021, test_f1: 0.6852
 epoch: 60, train_loss: 0.5920, test_loss: 0.7969, test_f1: 0.6657
 epoch: 61, train_loss: 0.5855, test_loss: 0.7992, test_f1: 0.6594
 epoch: 62, train_loss: 0.5761, test_loss: 0.8020, test_f1: 0.6507
 epoch: 63, train_loss: 0.5574, test_loss: 0.8016, test_f1: 0.6724
 epoch: 64, train_loss: 0.5631, test_loss: 0.8109, test_f1: 0.6653
 epoch: 65, train_loss: 0.5771, test_loss: 0.8360, test_f1: 0.6836
 epoch: 66, train_loss: 0.5657, test_loss: 0.7916, test_f1: 0.6792
 epoch: 67, train_loss: 0.5612, test_loss: 0.8164, test_f1: 0.6715
 epoch: 68, train_loss: 0.5682, test_loss: 0.7877, test_f1: 0.7055
 epoch: 69, train_loss: 0.5552, test_loss: 0.7954, test_f1: 0.6672
 epoch: 70, train_loss: 0.5480, test_loss: 0.7990, test_f1: 0.6710
 epoch: 71, train_loss: 0.5526, test_loss: 0.8178, test_f1: 0.6747
 epoch: 72, train_loss: 0.5538, test_loss: 0.8088, test_f1: 0.6563
 epoch: 73, train_loss: 0.5639, test_loss: 0.8818, test_f1: 0.6567
 epoch: 74, train_loss: 0.5531, test_loss: 0.8173, test_f1: 0.6820
 epoch: 75, train_loss: 0.5496, test_loss: 0.8348, test_f1: 0.6662
 epoch: 76, train_loss: 0.5349, test_loss: 0.8144, test_f1: 0.6776
 epoch: 77, train_loss: 0.5458, test_loss: 0.8236, test_f1: 0.6797
 epoch: 78, train_loss: 0.5645, test_loss: 0.8879, test_f1: 0.6492
 epoch: 79, train_loss: 0.5622, test_loss: 0.9041, test_f1: 0.6551
 epoch: 80, train_loss: 0.5353, test_loss: 0.8673, test_f1: 0.6550
 epoch: 81, train_loss: 0.5302, test_loss: 0.8746, test_f1: 0.6508
 epoch: 82, train_loss: 0.5260, test_loss: 0.8235, test_f1: 0.6761
 epoch: 83, train_loss: 0.5483, test_loss: 0.8662, test_f1: 0.6827
 epoch: 84, train_loss: 0.5227, test_loss: 0.9041, test_f1: 0.6523
 epoch: 85, train_loss: 0.5266, test_loss: 0.8750, test_f1: 0.6665
 epoch: 86, train_loss: 0.5357, test_loss: 0.8598, test_f1: 0.6787
 epoch: 87, train_loss: 0.5210, test_loss: 0.9220, test_f1: 0.6592
 epoch: 88, train_loss: 0.5220, test_loss: 0.8685, test_f1: 0.6661
 epoch: 89, train_loss: 0.5308, test_loss: 0.8463, test_f1: 0.6687
 epoch: 90, train_loss: 0.5255, test_loss: 0.8944, test_f1: 0.6661
 epoch: 91, train_loss: 0.5350, test_loss: 0.8750, test_f1: 0.6690
 epoch: 92, train_loss: 0.5240, test_loss: 0.8346, test_f1: 0.6886
 epoch: 93, train_loss: 0.5119, test_loss: 0.8539, test_f1: 0.6822
 epoch: 94, train_loss: 0.5179, test_loss: 0.8465, test_f1: 0.6789
 epoch: 95, train_loss: 0.5055, test_loss: 0.9121, test_f1: 0.6629
 epoch: 96, train_loss: 0.5099, test_loss: 0.9588, test_f1: 0.6792
 epoch: 97, train_loss: 0.5090, test_loss: 0.9318, test_f1: 0.6662
 epoch: 98, train_loss: 0.5199, test_loss: 0.9672, test_f1: 0.6783
 epoch: 99, train_loss: 0.4945, test_loss: 1.0002, test_f1: 0.6481
##################ITERATION #6 ****************************************
 epoch: 0, train_loss: 1.1690, test_loss: 1.0531, test_f1: 0.4678
 epoch: 1, train_loss: 1.0226, test_loss: 0.9918, test_f1: 0.4969
 epoch: 2, train_loss: 0.9881, test_loss: 1.0108, test_f1: 0.5091
 epoch: 3, train_loss: 0.9741, test_loss: 0.9538, test_f1: 0.5373
 epoch: 4, train_loss: 0.9466, test_loss: 0.9758, test_f1: 0.5285
 epoch: 5, train_loss: 0.9451, test_loss: 0.9751, test_f1: 0.5086
 epoch: 6, train_loss: 0.9216, test_loss: 0.9563, test_f1: 0.5133
 epoch: 7, train_loss: 0.9212, test_loss: 0.9197, test_f1: 0.5152
 epoch: 8, train_loss: 0.9089, test_loss: 0.8870, test_f1: 0.5546
 epoch: 9, train_loss: 0.8952, test_loss: 0.9343, test_f1: 0.5557
 epoch: 10, train_loss: 0.8811, test_loss: 0.8958, test_f1: 0.5395
 epoch: 11, train_loss: 0.8690, test_loss: 0.8814, test_f1: 0.5543
 epoch: 12, train_loss: 0.8663, test_loss: 0.9134, test_f1: 0.5654
 epoch: 13, train_loss: 0.8565, test_loss: 0.8967, test_f1: 0.5802
 epoch: 14, train_loss: 0.8374, test_loss: 0.8641, test_f1: 0.5676
 epoch: 15, train_loss: 0.8365, test_loss: 0.8853, test_f1: 0.5779
 epoch: 16, train_loss: 0.8160, test_loss: 0.8664, test_f1: 0.5741
 epoch: 17, train_loss: 0.8157, test_loss: 0.8516, test_f1: 0.5985
 epoch: 18, train_loss: 0.7969, test_loss: 0.8598, test_f1: 0.5953
 epoch: 19, train_loss: 0.7919, test_loss: 0.8451, test_f1: 0.6119
 epoch: 20, train_loss: 0.7781, test_loss: 0.8600, test_f1: 0.5993
 epoch: 21, train_loss: 0.7739, test_loss: 0.8567, test_f1: 0.5781
 epoch: 22, train_loss: 0.7734, test_loss: 0.8306, test_f1: 0.6157
 epoch: 23, train_loss: 0.7678, test_loss: 0.8594, test_f1: 0.6063
 epoch: 24, train_loss: 0.7626, test_loss: 0.8494, test_f1: 0.6092
 epoch: 25, train_loss: 0.7562, test_loss: 0.8284, test_f1: 0.6135
 epoch: 26, train_loss: 0.7461, test_loss: 0.8362, test_f1: 0.6033
 epoch: 27, train_loss: 0.7546, test_loss: 0.8471, test_f1: 0.5929
 epoch: 28, train_loss: 0.7510, test_loss: 0.8197, test_f1: 0.6368
 epoch: 29, train_loss: 0.7368, test_loss: 0.8243, test_f1: 0.6175
 epoch: 30, train_loss: 0.7295, test_loss: 0.7789, test_f1: 0.6161
 epoch: 31, train_loss: 0.7252, test_loss: 0.8327, test_f1: 0.6123
 epoch: 32, train_loss: 0.7226, test_loss: 0.8115, test_f1: 0.6121
 epoch: 33, train_loss: 0.7113, test_loss: 0.8301, test_f1: 0.6116
 epoch: 34, train_loss: 0.7126, test_loss: 0.8094, test_f1: 0.6418
 epoch: 35, train_loss: 0.7158, test_loss: 0.7942, test_f1: 0.6356
 epoch: 36, train_loss: 0.7124, test_loss: 0.7597, test_f1: 0.6230
 epoch: 37, train_loss: 0.6879, test_loss: 0.8079, test_f1: 0.6632
 epoch: 38, train_loss: 0.6863, test_loss: 0.8060, test_f1: 0.6288
 epoch: 39, train_loss: 0.6868, test_loss: 0.8145, test_f1: 0.6406
 epoch: 40, train_loss: 0.6788, test_loss: 0.8345, test_f1: 0.6298
 epoch: 41, train_loss: 0.6740, test_loss: 0.8680, test_f1: 0.6385
 epoch: 42, train_loss: 0.6864, test_loss: 0.8045, test_f1: 0.6519
 epoch: 43, train_loss: 0.6880, test_loss: 0.8974, test_f1: 0.6094
 epoch: 44, train_loss: 0.7007, test_loss: 0.7994, test_f1: 0.6339
 epoch: 45, train_loss: 0.6592, test_loss: 0.7964, test_f1: 0.6297
 epoch: 46, train_loss: 0.6655, test_loss: 0.8140, test_f1: 0.6389
 epoch: 47, train_loss: 0.6638, test_loss: 0.8358, test_f1: 0.6747
 epoch: 48, train_loss: 0.6678, test_loss: 0.8294, test_f1: 0.6259
 epoch: 49, train_loss: 0.6596, test_loss: 0.8363, test_f1: 0.6429
 epoch: 50, train_loss: 0.6525, test_loss: 0.7796, test_f1: 0.6497
 epoch: 51, train_loss: 0.6307, test_loss: 0.8057, test_f1: 0.6511
 epoch: 52, train_loss: 0.6173, test_loss: 0.7858, test_f1: 0.6596
 epoch: 53, train_loss: 0.6041, test_loss: 0.7867, test_f1: 0.6497
 epoch: 54, train_loss: 0.6067, test_loss: 0.8295, test_f1: 0.6256
 epoch: 55, train_loss: 0.5976, test_loss: 0.8214, test_f1: 0.6455
 epoch: 56, train_loss: 0.6064, test_loss: 0.8194, test_f1: 0.6642
 epoch: 57, train_loss: 0.5870, test_loss: 0.8506, test_f1: 0.6814
 epoch: 58, train_loss: 0.5819, test_loss: 0.8481, test_f1: 0.6463
 epoch: 59, train_loss: 0.5803, test_loss: 0.8624, test_f1: 0.6810
 epoch: 60, train_loss: 0.5911, test_loss: 0.8345, test_f1: 0.6578
 epoch: 61, train_loss: 0.5859, test_loss: 0.8553, test_f1: 0.6590
 epoch: 62, train_loss: 0.5822, test_loss: 0.8614, test_f1: 0.6592
 epoch: 63, train_loss: 0.5932, test_loss: 0.8341, test_f1: 0.6568
 epoch: 64, train_loss: 0.5752, test_loss: 0.8564, test_f1: 0.6391
 epoch: 65, train_loss: 0.5787, test_loss: 0.8415, test_f1: 0.6449
 epoch: 66, train_loss: 0.5810, test_loss: 0.8596, test_f1: 0.6433
 epoch: 67, train_loss: 0.5558, test_loss: 0.8170, test_f1: 0.6666
 epoch: 68, train_loss: 0.5726, test_loss: 0.8613, test_f1: 0.6538
 epoch: 69, train_loss: 0.5687, test_loss: 0.8540, test_f1: 0.6581
 epoch: 70, train_loss: 0.5676, test_loss: 0.8523, test_f1: 0.6593
 epoch: 71, train_loss: 0.5627, test_loss: 0.8555, test_f1: 0.6611
 epoch: 72, train_loss: 0.5682, test_loss: 0.8290, test_f1: 0.6523
 epoch: 73, train_loss: 0.5643, test_loss: 0.8724, test_f1: 0.6510
 epoch: 74, train_loss: 0.5526, test_loss: 0.8510, test_f1: 0.6558
 epoch: 75, train_loss: 0.5549, test_loss: 0.8669, test_f1: 0.6629
 epoch: 76, train_loss: 0.5691, test_loss: 0.8631, test_f1: 0.6430
 epoch: 77, train_loss: 0.5508, test_loss: 0.8747, test_f1: 0.6410
 epoch: 78, train_loss: 0.5493, test_loss: 0.8874, test_f1: 0.6400
 epoch: 79, train_loss: 0.5345, test_loss: 0.8799, test_f1: 0.6597
 epoch: 80, train_loss: 0.5364, test_loss: 0.8665, test_f1: 0.6525
 epoch: 81, train_loss: 0.5426, test_loss: 0.8851, test_f1: 0.6392
 epoch: 82, train_loss: 0.5474, test_loss: 0.8673, test_f1: 0.6488
 epoch: 83, train_loss: 0.5283, test_loss: 0.8886, test_f1: 0.6564
 epoch: 84, train_loss: 0.5529, test_loss: 0.9531, test_f1: 0.6466
 epoch: 85, train_loss: 0.5578, test_loss: 0.8775, test_f1: 0.6558
 epoch: 86, train_loss: 0.5455, test_loss: 0.8672, test_f1: 0.6696
 epoch: 87, train_loss: 0.5384, test_loss: 0.8832, test_f1: 0.6522
 epoch: 88, train_loss: 0.5163, test_loss: 0.8830, test_f1: 0.6638
 epoch: 89, train_loss: 0.5459, test_loss: 0.9134, test_f1: 0.6458
 epoch: 90, train_loss: 0.5292, test_loss: 0.9096, test_f1: 0.6561
 epoch: 91, train_loss: 0.5154, test_loss: 0.8877, test_f1: 0.6568
 epoch: 92, train_loss: 0.5211, test_loss: 0.8824, test_f1: 0.6646
 epoch: 93, train_loss: 0.5108, test_loss: 0.9448, test_f1: 0.6413
 epoch: 94, train_loss: 0.5056, test_loss: 0.9521, test_f1: 0.6507
 epoch: 95, train_loss: 0.5292, test_loss: 0.9276, test_f1: 0.6601
 epoch: 96, train_loss: 0.5106, test_loss: 0.9215, test_f1: 0.6721
 epoch: 97, train_loss: 0.5232, test_loss: 0.8969, test_f1: 0.6617
 epoch: 98, train_loss: 0.5197, test_loss: 0.9423, test_f1: 0.6504
 epoch: 99, train_loss: 0.5118, test_loss: 0.8739, test_f1: 0.6596
##################ITERATION #7 ****************************************
 epoch: 0, train_loss: 1.1850, test_loss: 0.9853, test_f1: 0.4843
 epoch: 1, train_loss: 1.0133, test_loss: 0.9254, test_f1: 0.5330
 epoch: 2, train_loss: 0.9688, test_loss: 0.9230, test_f1: 0.5290
 epoch: 3, train_loss: 0.9442, test_loss: 0.9532, test_f1: 0.5213
 epoch: 4, train_loss: 0.9322, test_loss: 0.8673, test_f1: 0.5597
 epoch: 5, train_loss: 0.9147, test_loss: 0.8869, test_f1: 0.5315
 epoch: 6, train_loss: 0.9181, test_loss: 0.8708, test_f1: 0.5516
 epoch: 7, train_loss: 0.8991, test_loss: 0.8463, test_f1: 0.5452
 epoch: 8, train_loss: 0.8899, test_loss: 0.8804, test_f1: 0.5414
 epoch: 9, train_loss: 0.8763, test_loss: 0.8638, test_f1: 0.5760
 epoch: 10, train_loss: 0.8628, test_loss: 0.8933, test_f1: 0.5811
 epoch: 11, train_loss: 0.8499, test_loss: 0.8257, test_f1: 0.5894
 epoch: 12, train_loss: 0.8371, test_loss: 0.7971, test_f1: 0.5724
 epoch: 13, train_loss: 0.8320, test_loss: 0.8364, test_f1: 0.5567
 epoch: 14, train_loss: 0.8320, test_loss: 0.8920, test_f1: 0.6040
 epoch: 15, train_loss: 0.8118, test_loss: 0.8301, test_f1: 0.5736
 epoch: 16, train_loss: 0.8044, test_loss: 0.8756, test_f1: 0.5972
 epoch: 17, train_loss: 0.8105, test_loss: 0.8074, test_f1: 0.6167
 epoch: 18, train_loss: 0.7911, test_loss: 0.8142, test_f1: 0.6118
 epoch: 19, train_loss: 0.7754, test_loss: 0.7749, test_f1: 0.5513
 epoch: 20, train_loss: 0.7673, test_loss: 0.7561, test_f1: 0.6128
 epoch: 21, train_loss: 0.7746, test_loss: 0.8153, test_f1: 0.5798
 epoch: 22, train_loss: 0.7580, test_loss: 0.8151, test_f1: 0.6147
 epoch: 23, train_loss: 0.7635, test_loss: 0.7674, test_f1: 0.5935
 epoch: 24, train_loss: 0.7470, test_loss: 0.7773, test_f1: 0.5943
 epoch: 25, train_loss: 0.7430, test_loss: 0.8278, test_f1: 0.6086
 epoch: 26, train_loss: 0.7360, test_loss: 0.7913, test_f1: 0.5904
 epoch: 27, train_loss: 0.7296, test_loss: 0.8081, test_f1: 0.6198
 epoch: 28, train_loss: 0.7314, test_loss: 0.7653, test_f1: 0.6274
 epoch: 29, train_loss: 0.7118, test_loss: 0.7349, test_f1: 0.6423
 epoch: 30, train_loss: 0.7068, test_loss: 0.7652, test_f1: 0.6051
 epoch: 31, train_loss: 0.7245, test_loss: 0.7220, test_f1: 0.6038
 epoch: 32, train_loss: 0.7076, test_loss: 0.7041, test_f1: 0.6630
 epoch: 33, train_loss: 0.7148, test_loss: 0.7040, test_f1: 0.6947
 epoch: 34, train_loss: 0.6960, test_loss: 0.8174, test_f1: 0.6515
 epoch: 35, train_loss: 0.6997, test_loss: 0.7852, test_f1: 0.6248
 epoch: 36, train_loss: 0.6814, test_loss: 0.6967, test_f1: 0.6702
 epoch: 37, train_loss: 0.6846, test_loss: 0.7548, test_f1: 0.6389
 epoch: 38, train_loss: 0.6901, test_loss: 0.7314, test_f1: 0.6712
 epoch: 39, train_loss: 0.6763, test_loss: 0.8251, test_f1: 0.6594
 epoch: 40, train_loss: 0.6963, test_loss: 0.7778, test_f1: 0.6612
 epoch: 41, train_loss: 0.6698, test_loss: 0.8019, test_f1: 0.6598
 epoch: 42, train_loss: 0.6732, test_loss: 0.7685, test_f1: 0.6362
 epoch: 43, train_loss: 0.6570, test_loss: 0.7566, test_f1: 0.6659
 epoch: 44, train_loss: 0.6645, test_loss: 0.7254, test_f1: 0.6623
 epoch: 45, train_loss: 0.6709, test_loss: 0.7237, test_f1: 0.6624
 epoch: 46, train_loss: 0.6615, test_loss: 0.7833, test_f1: 0.6504
 epoch: 47, train_loss: 0.6655, test_loss: 0.8059, test_f1: 0.6567
 epoch: 48, train_loss: 0.6489, test_loss: 0.7325, test_f1: 0.6509
 epoch: 49, train_loss: 0.6648, test_loss: 0.7283, test_f1: 0.6736
 epoch: 50, train_loss: 0.6496, test_loss: 0.7401, test_f1: 0.6544
 epoch: 51, train_loss: 0.6256, test_loss: 0.7512, test_f1: 0.6600
 epoch: 52, train_loss: 0.6177, test_loss: 0.7334, test_f1: 0.6665
 epoch: 53, train_loss: 0.6053, test_loss: 0.7805, test_f1: 0.6624
 epoch: 54, train_loss: 0.6173, test_loss: 0.7995, test_f1: 0.6581
 epoch: 55, train_loss: 0.6012, test_loss: 0.7863, test_f1: 0.6640
 epoch: 56, train_loss: 0.5940, test_loss: 0.7694, test_f1: 0.6765
 epoch: 57, train_loss: 0.5943, test_loss: 0.8116, test_f1: 0.6664
 epoch: 58, train_loss: 0.5904, test_loss: 0.8078, test_f1: 0.6887
 epoch: 59, train_loss: 0.5857, test_loss: 0.7378, test_f1: 0.6699
 epoch: 60, train_loss: 0.5857, test_loss: 0.7592, test_f1: 0.6609
 epoch: 61, train_loss: 0.5927, test_loss: 0.7464, test_f1: 0.6616
 epoch: 62, train_loss: 0.5789, test_loss: 0.7549, test_f1: 0.6741
 epoch: 63, train_loss: 0.5939, test_loss: 0.7870, test_f1: 0.6711
 epoch: 64, train_loss: 0.5819, test_loss: 0.8175, test_f1: 0.6506
 epoch: 65, train_loss: 0.5834, test_loss: 0.7814, test_f1: 0.6692
 epoch: 66, train_loss: 0.5738, test_loss: 0.8191, test_f1: 0.6470
 epoch: 67, train_loss: 0.5715, test_loss: 0.7673, test_f1: 0.6938
 epoch: 68, train_loss: 0.5672, test_loss: 0.8305, test_f1: 0.7019
 epoch: 69, train_loss: 0.5840, test_loss: 0.8542, test_f1: 0.6738
 epoch: 70, train_loss: 0.5696, test_loss: 0.8056, test_f1: 0.6479
 epoch: 71, train_loss: 0.5578, test_loss: 0.7441, test_f1: 0.6998
 epoch: 72, train_loss: 0.5566, test_loss: 0.7940, test_f1: 0.6490
 epoch: 73, train_loss: 0.5507, test_loss: 0.8197, test_f1: 0.6746
 epoch: 74, train_loss: 0.5448, test_loss: 0.7835, test_f1: 0.6629
 epoch: 75, train_loss: 0.5519, test_loss: 0.8426, test_f1: 0.6678
 epoch: 76, train_loss: 0.5589, test_loss: 0.8502, test_f1: 0.6761
 epoch: 77, train_loss: 0.5431, test_loss: 0.8655, test_f1: 0.6917
 epoch: 78, train_loss: 0.5471, test_loss: 0.8437, test_f1: 0.6680
 epoch: 79, train_loss: 0.5571, test_loss: 0.8292, test_f1: 0.6662
 epoch: 80, train_loss: 0.5423, test_loss: 0.8942, test_f1: 0.6552
 epoch: 81, train_loss: 0.5511, test_loss: 0.8350, test_f1: 0.6951
 epoch: 82, train_loss: 0.5530, test_loss: 0.8620, test_f1: 0.6814
 epoch: 83, train_loss: 0.5491, test_loss: 0.9072, test_f1: 0.6755
 epoch: 84, train_loss: 0.5517, test_loss: 0.8645, test_f1: 0.6393
 epoch: 85, train_loss: 0.5487, test_loss: 0.9213, test_f1: 0.6592
 epoch: 86, train_loss: 0.5388, test_loss: 0.9182, test_f1: 0.6666
 epoch: 87, train_loss: 0.5429, test_loss: 0.9098, test_f1: 0.6656
 epoch: 88, train_loss: 0.5268, test_loss: 0.8436, test_f1: 0.6553
 epoch: 89, train_loss: 0.5145, test_loss: 0.8571, test_f1: 0.6741
 epoch: 90, train_loss: 0.5289, test_loss: 0.9255, test_f1: 0.6817
 epoch: 91, train_loss: 0.5239, test_loss: 0.9247, test_f1: 0.6678
 epoch: 92, train_loss: 0.5165, test_loss: 0.9386, test_f1: 0.6525
 epoch: 93, train_loss: 0.5520, test_loss: 0.9011, test_f1: 0.6688
 epoch: 94, train_loss: 0.5191, test_loss: 0.8507, test_f1: 0.6381
 epoch: 95, train_loss: 0.5291, test_loss: 0.8973, test_f1: 0.6752
 epoch: 96, train_loss: 0.5173, test_loss: 0.9650, test_f1: 0.6526
 epoch: 97, train_loss: 0.5184, test_loss: 0.9694, test_f1: 0.6493
 epoch: 98, train_loss: 0.5374, test_loss: 0.9045, test_f1: 0.6699
 epoch: 99, train_loss: 0.5044, test_loss: 0.8410, test_f1: 0.6598
##################ITERATION #8 ****************************************
 epoch: 0, train_loss: 1.2552, test_loss: 1.0033, test_f1: 0.4597
 epoch: 1, train_loss: 1.0430, test_loss: 1.0064, test_f1: 0.4834
 epoch: 2, train_loss: 0.9844, test_loss: 1.0201, test_f1: 0.4863
 epoch: 3, train_loss: 0.9705, test_loss: 1.0003, test_f1: 0.5205
 epoch: 4, train_loss: 0.9481, test_loss: 0.9968, test_f1: 0.5254
 epoch: 5, train_loss: 0.9418, test_loss: 0.9625, test_f1: 0.5266
 epoch: 6, train_loss: 0.9260, test_loss: 0.9504, test_f1: 0.5570
 epoch: 7, train_loss: 0.9226, test_loss: 0.9460, test_f1: 0.5257
 epoch: 8, train_loss: 0.8979, test_loss: 0.9693, test_f1: 0.5216
 epoch: 9, train_loss: 0.8987, test_loss: 0.9418, test_f1: 0.5521
 epoch: 10, train_loss: 0.8681, test_loss: 0.9435, test_f1: 0.5198
 epoch: 11, train_loss: 0.8610, test_loss: 0.9096, test_f1: 0.5768
 epoch: 12, train_loss: 0.8506, test_loss: 0.9023, test_f1: 0.5801
 epoch: 13, train_loss: 0.8557, test_loss: 0.8871, test_f1: 0.5681
 epoch: 14, train_loss: 0.8445, test_loss: 0.9171, test_f1: 0.5590
 epoch: 15, train_loss: 0.8391, test_loss: 0.8731, test_f1: 0.5717
 epoch: 16, train_loss: 0.8163, test_loss: 0.8492, test_f1: 0.5729
 epoch: 17, train_loss: 0.8119, test_loss: 0.8450, test_f1: 0.6024
 epoch: 18, train_loss: 0.8039, test_loss: 0.8103, test_f1: 0.6220
 epoch: 19, train_loss: 0.7804, test_loss: 0.9137, test_f1: 0.5521
 epoch: 20, train_loss: 0.7871, test_loss: 0.8606, test_f1: 0.5945
 epoch: 21, train_loss: 0.7786, test_loss: 0.8387, test_f1: 0.6039
 epoch: 22, train_loss: 0.7665, test_loss: 0.8171, test_f1: 0.6205
 epoch: 23, train_loss: 0.7747, test_loss: 0.8572, test_f1: 0.5693
 epoch: 24, train_loss: 0.7562, test_loss: 0.8037, test_f1: 0.6157
 epoch: 25, train_loss: 0.7451, test_loss: 0.7763, test_f1: 0.6371
 epoch: 26, train_loss: 0.7468, test_loss: 0.8142, test_f1: 0.6076
 epoch: 27, train_loss: 0.7346, test_loss: 0.8659, test_f1: 0.6106
 epoch: 28, train_loss: 0.7276, test_loss: 0.7525, test_f1: 0.6168
 epoch: 29, train_loss: 0.7360, test_loss: 0.7777, test_f1: 0.6151
 epoch: 30, train_loss: 0.7515, test_loss: 0.7435, test_f1: 0.6603
 epoch: 31, train_loss: 0.7300, test_loss: 0.7469, test_f1: 0.6552
 epoch: 32, train_loss: 0.7111, test_loss: 0.7458, test_f1: 0.6075
 epoch: 33, train_loss: 0.7103, test_loss: 0.7021, test_f1: 0.6594
 epoch: 34, train_loss: 0.7120, test_loss: 0.7322, test_f1: 0.6512
 epoch: 35, train_loss: 0.6997, test_loss: 0.7332, test_f1: 0.6292
 epoch: 36, train_loss: 0.7004, test_loss: 0.7756, test_f1: 0.6296
 epoch: 37, train_loss: 0.6955, test_loss: 0.7586, test_f1: 0.6543
 epoch: 38, train_loss: 0.6856, test_loss: 0.7267, test_f1: 0.6564
 epoch: 39, train_loss: 0.6992, test_loss: 0.7538, test_f1: 0.6303
 epoch: 40, train_loss: 0.6978, test_loss: 0.7211, test_f1: 0.6550
 epoch: 41, train_loss: 0.6672, test_loss: 0.7672, test_f1: 0.6396
 epoch: 42, train_loss: 0.6599, test_loss: 0.7712, test_f1: 0.6168
 epoch: 43, train_loss: 0.6831, test_loss: 0.7517, test_f1: 0.6396
 epoch: 44, train_loss: 0.6738, test_loss: 0.7740, test_f1: 0.6203
 epoch: 45, train_loss: 0.6607, test_loss: 0.7512, test_f1: 0.6652
 epoch: 46, train_loss: 0.6736, test_loss: 0.7247, test_f1: 0.6758
 epoch: 47, train_loss: 0.6551, test_loss: 0.7056, test_f1: 0.6704
 epoch: 48, train_loss: 0.6414, test_loss: 0.6894, test_f1: 0.6748
 epoch: 49, train_loss: 0.6439, test_loss: 0.6794, test_f1: 0.6834
 epoch: 50, train_loss: 0.6719, test_loss: 0.7209, test_f1: 0.6562
 epoch: 51, train_loss: 0.6211, test_loss: 0.6987, test_f1: 0.6561
 epoch: 52, train_loss: 0.6075, test_loss: 0.6873, test_f1: 0.6839
 epoch: 53, train_loss: 0.6042, test_loss: 0.7345, test_f1: 0.6636
 epoch: 54, train_loss: 0.6032, test_loss: 0.7431, test_f1: 0.6451
 epoch: 55, train_loss: 0.5848, test_loss: 0.8064, test_f1: 0.6586
 epoch: 56, train_loss: 0.5911, test_loss: 0.7704, test_f1: 0.6497
 epoch: 57, train_loss: 0.5966, test_loss: 0.7352, test_f1: 0.6698
 epoch: 58, train_loss: 0.6005, test_loss: 0.8008, test_f1: 0.6690
 epoch: 59, train_loss: 0.5740, test_loss: 0.7449, test_f1: 0.6720
 epoch: 60, train_loss: 0.5860, test_loss: 0.7237, test_f1: 0.6748
 epoch: 61, train_loss: 0.5864, test_loss: 0.7413, test_f1: 0.6607
 epoch: 62, train_loss: 0.5743, test_loss: 0.7303, test_f1: 0.6529
 epoch: 63, train_loss: 0.5835, test_loss: 0.7018, test_f1: 0.6843
 epoch: 64, train_loss: 0.5855, test_loss: 0.7777, test_f1: 0.6739
 epoch: 65, train_loss: 0.5762, test_loss: 0.7885, test_f1: 0.6699
 epoch: 66, train_loss: 0.5576, test_loss: 0.7036, test_f1: 0.6752
 epoch: 67, train_loss: 0.5654, test_loss: 0.7016, test_f1: 0.6746
 epoch: 68, train_loss: 0.5637, test_loss: 0.7599, test_f1: 0.6667
 epoch: 69, train_loss: 0.5730, test_loss: 0.7270, test_f1: 0.6685
 epoch: 70, train_loss: 0.5674, test_loss: 0.7782, test_f1: 0.6642
 epoch: 71, train_loss: 0.5708, test_loss: 0.7862, test_f1: 0.6577
 epoch: 72, train_loss: 0.5583, test_loss: 0.7527, test_f1: 0.6806
 epoch: 73, train_loss: 0.5461, test_loss: 0.8293, test_f1: 0.6612
 epoch: 74, train_loss: 0.5590, test_loss: 0.7387, test_f1: 0.6795
 epoch: 75, train_loss: 0.5528, test_loss: 0.7778, test_f1: 0.6549
 epoch: 76, train_loss: 0.5418, test_loss: 0.7528, test_f1: 0.6952
 epoch: 77, train_loss: 0.5494, test_loss: 0.7202, test_f1: 0.6941
 epoch: 78, train_loss: 0.5592, test_loss: 0.7488, test_f1: 0.6871
 epoch: 79, train_loss: 0.5514, test_loss: 0.7667, test_f1: 0.6584
 epoch: 80, train_loss: 0.5363, test_loss: 0.7042, test_f1: 0.6905
 epoch: 81, train_loss: 0.5465, test_loss: 0.7436, test_f1: 0.6679
 epoch: 82, train_loss: 0.5335, test_loss: 0.7326, test_f1: 0.6715
 epoch: 83, train_loss: 0.5473, test_loss: 0.7418, test_f1: 0.6956
 epoch: 84, train_loss: 0.5519, test_loss: 0.7459, test_f1: 0.6902
 epoch: 85, train_loss: 0.5475, test_loss: 0.7484, test_f1: 0.6401
 epoch: 86, train_loss: 0.5234, test_loss: 0.8203, test_f1: 0.6722
 epoch: 87, train_loss: 0.5196, test_loss: 0.8466, test_f1: 0.6472
 epoch: 88, train_loss: 0.5356, test_loss: 0.8343, test_f1: 0.6521
 epoch: 89, train_loss: 0.5315, test_loss: 0.7829, test_f1: 0.6720
 epoch: 90, train_loss: 0.5355, test_loss: 0.7616, test_f1: 0.6710
 epoch: 91, train_loss: 0.5038, test_loss: 0.8474, test_f1: 0.6635
 epoch: 92, train_loss: 0.5216, test_loss: 0.8060, test_f1: 0.6675
 epoch: 93, train_loss: 0.5198, test_loss: 0.8080, test_f1: 0.6660
 epoch: 94, train_loss: 0.5290, test_loss: 0.8821, test_f1: 0.6619
 epoch: 95, train_loss: 0.5172, test_loss: 0.7413, test_f1: 0.6883
 epoch: 96, train_loss: 0.5149, test_loss: 0.8422, test_f1: 0.6544
 epoch: 97, train_loss: 0.5132, test_loss: 0.8028, test_f1: 0.6628
 epoch: 98, train_loss: 0.5052, test_loss: 0.8793, test_f1: 0.6490
 epoch: 99, train_loss: 0.5160, test_loss: 0.8111, test_f1: 0.7012
##################ITERATION #9 ****************************************
 epoch: 0, train_loss: 1.2624, test_loss: 1.0248, test_f1: 0.4573
 epoch: 1, train_loss: 1.0411, test_loss: 1.0115, test_f1: 0.4942
 epoch: 2, train_loss: 1.0053, test_loss: 0.9897, test_f1: 0.5026
 epoch: 3, train_loss: 0.9779, test_loss: 0.9687, test_f1: 0.5046
 epoch: 4, train_loss: 0.9613, test_loss: 0.9547, test_f1: 0.5211
 epoch: 5, train_loss: 0.9488, test_loss: 0.9923, test_f1: 0.5113
 epoch: 6, train_loss: 0.9301, test_loss: 0.9550, test_f1: 0.5041
 epoch: 7, train_loss: 0.9376, test_loss: 0.9691, test_f1: 0.5301
 epoch: 8, train_loss: 0.9253, test_loss: 0.9553, test_f1: 0.5245
 epoch: 9, train_loss: 0.9069, test_loss: 0.9746, test_f1: 0.5359
 epoch: 10, train_loss: 0.9089, test_loss: 0.9383, test_f1: 0.4990
 epoch: 11, train_loss: 0.8929, test_loss: 0.9221, test_f1: 0.5222
 epoch: 12, train_loss: 0.8854, test_loss: 0.8905, test_f1: 0.4983
 epoch: 13, train_loss: 0.8902, test_loss: 0.9281, test_f1: 0.5326
 epoch: 14, train_loss: 0.8694, test_loss: 0.8867, test_f1: 0.5343
 epoch: 15, train_loss: 0.8732, test_loss: 0.9090, test_f1: 0.5485
 epoch: 16, train_loss: 0.8442, test_loss: 0.8404, test_f1: 0.5556
 epoch: 17, train_loss: 0.8378, test_loss: 0.8722, test_f1: 0.5954
 epoch: 18, train_loss: 0.8350, test_loss: 0.8618, test_f1: 0.5819
 epoch: 19, train_loss: 0.8171, test_loss: 0.8852, test_f1: 0.5632
 epoch: 20, train_loss: 0.8196, test_loss: 0.8855, test_f1: 0.5845
 epoch: 21, train_loss: 0.8004, test_loss: 0.8554, test_f1: 0.5828
 epoch: 22, train_loss: 0.8058, test_loss: 0.8846, test_f1: 0.5984
 epoch: 23, train_loss: 0.7921, test_loss: 0.8713, test_f1: 0.5818
 epoch: 24, train_loss: 0.7837, test_loss: 0.8272, test_f1: 0.5957
 epoch: 25, train_loss: 0.7837, test_loss: 0.8414, test_f1: 0.5830
 epoch: 26, train_loss: 0.7637, test_loss: 0.7534, test_f1: 0.6239
 epoch: 27, train_loss: 0.7680, test_loss: 0.7523, test_f1: 0.6390
 epoch: 28, train_loss: 0.7693, test_loss: 0.8642, test_f1: 0.6044
 epoch: 29, train_loss: 0.7654, test_loss: 0.7509, test_f1: 0.6226
 epoch: 30, train_loss: 0.7603, test_loss: 0.8200, test_f1: 0.6037
 epoch: 31, train_loss: 0.7501, test_loss: 0.8619, test_f1: 0.6112
 epoch: 32, train_loss: 0.7353, test_loss: 0.8420, test_f1: 0.6087
 epoch: 33, train_loss: 0.7291, test_loss: 0.7866, test_f1: 0.6282
 epoch: 34, train_loss: 0.7293, test_loss: 0.8326, test_f1: 0.6136
 epoch: 35, train_loss: 0.7199, test_loss: 0.8764, test_f1: 0.6100
 epoch: 36, train_loss: 0.7184, test_loss: 0.8387, test_f1: 0.6149
 epoch: 37, train_loss: 0.7172, test_loss: 0.7716, test_f1: 0.6069
 epoch: 38, train_loss: 0.7185, test_loss: 0.7878, test_f1: 0.6224
 epoch: 39, train_loss: 0.7180, test_loss: 0.8219, test_f1: 0.6034
 epoch: 40, train_loss: 0.7180, test_loss: 0.8549, test_f1: 0.6301
 epoch: 41, train_loss: 0.6840, test_loss: 0.8483, test_f1: 0.6103
 epoch: 42, train_loss: 0.6923, test_loss: 0.8610, test_f1: 0.6124
 epoch: 43, train_loss: 0.6888, test_loss: 0.7340, test_f1: 0.6651
 epoch: 44, train_loss: 0.6857, test_loss: 0.7714, test_f1: 0.6465
 epoch: 45, train_loss: 0.6950, test_loss: 0.8294, test_f1: 0.5878
 epoch: 46, train_loss: 0.6987, test_loss: 0.8352, test_f1: 0.6471
 epoch: 47, train_loss: 0.6890, test_loss: 0.8072, test_f1: 0.6353
 epoch: 48, train_loss: 0.6680, test_loss: 0.7810, test_f1: 0.6297
 epoch: 49, train_loss: 0.6744, test_loss: 0.7516, test_f1: 0.6565
 epoch: 50, train_loss: 0.6685, test_loss: 0.7285, test_f1: 0.6498
 epoch: 51, train_loss: 0.6429, test_loss: 0.6841, test_f1: 0.6712
 epoch: 52, train_loss: 0.6356, test_loss: 0.7434, test_f1: 0.6215
 epoch: 53, train_loss: 0.6319, test_loss: 0.8115, test_f1: 0.6294
 epoch: 54, train_loss: 0.6406, test_loss: 0.7949, test_f1: 0.6434
 epoch: 55, train_loss: 0.6105, test_loss: 0.8108, test_f1: 0.6224
 epoch: 56, train_loss: 0.6319, test_loss: 0.8231, test_f1: 0.6302
 epoch: 57, train_loss: 0.6183, test_loss: 0.7455, test_f1: 0.6510
 epoch: 58, train_loss: 0.6131, test_loss: 0.7884, test_f1: 0.6522
 epoch: 59, train_loss: 0.6056, test_loss: 0.7164, test_f1: 0.6345
 epoch: 60, train_loss: 0.6082, test_loss: 0.8030, test_f1: 0.6543
 epoch: 61, train_loss: 0.5927, test_loss: 0.8165, test_f1: 0.6449
 epoch: 62, train_loss: 0.5998, test_loss: 0.8135, test_f1: 0.6296
 epoch: 63, train_loss: 0.5947, test_loss: 0.8298, test_f1: 0.6445
 epoch: 64, train_loss: 0.5934, test_loss: 0.8062, test_f1: 0.6455
 epoch: 65, train_loss: 0.6018, test_loss: 0.8104, test_f1: 0.6632
 epoch: 66, train_loss: 0.5984, test_loss: 0.8022, test_f1: 0.6558
 epoch: 67, train_loss: 0.5878, test_loss: 0.8189, test_f1: 0.6518
 epoch: 68, train_loss: 0.5827, test_loss: 0.7998, test_f1: 0.6480
 epoch: 69, train_loss: 0.5942, test_loss: 0.8456, test_f1: 0.6635
 epoch: 70, train_loss: 0.6001, test_loss: 0.8155, test_f1: 0.6553
 epoch: 71, train_loss: 0.5932, test_loss: 0.7862, test_f1: 0.6553
 epoch: 72, train_loss: 0.5904, test_loss: 0.7991, test_f1: 0.6392
 epoch: 73, train_loss: 0.5878, test_loss: 0.8178, test_f1: 0.6446
 epoch: 74, train_loss: 0.5616, test_loss: 0.8251, test_f1: 0.6248
 epoch: 75, train_loss: 0.5716, test_loss: 0.8383, test_f1: 0.6564
 epoch: 76, train_loss: 0.5630, test_loss: 0.8286, test_f1: 0.6516
 epoch: 77, train_loss: 0.5734, test_loss: 0.8106, test_f1: 0.6564
 epoch: 78, train_loss: 0.5682, test_loss: 0.8372, test_f1: 0.6424
 epoch: 79, train_loss: 0.5742, test_loss: 0.7989, test_f1: 0.6654
 epoch: 80, train_loss: 0.5728, test_loss: 0.8248, test_f1: 0.6413
 epoch: 81, train_loss: 0.5649, test_loss: 0.8395, test_f1: 0.6624
 epoch: 82, train_loss: 0.5658, test_loss: 0.8435, test_f1: 0.6407
 epoch: 83, train_loss: 0.5505, test_loss: 0.7967, test_f1: 0.6537
 epoch: 84, train_loss: 0.5644, test_loss: 0.8011, test_f1: 0.6614
 epoch: 85, train_loss: 0.5638, test_loss: 0.8415, test_f1: 0.6664
 epoch: 86, train_loss: 0.5558, test_loss: 0.8831, test_f1: 0.6396
 epoch: 87, train_loss: 0.5582, test_loss: 0.7958, test_f1: 0.6771
 epoch: 88, train_loss: 0.5596, test_loss: 0.8049, test_f1: 0.6698
 epoch: 89, train_loss: 0.5498, test_loss: 0.8219, test_f1: 0.6577
 epoch: 90, train_loss: 0.5628, test_loss: 0.8122, test_f1: 0.6521
 epoch: 91, train_loss: 0.5566, test_loss: 0.8130, test_f1: 0.6521
 epoch: 92, train_loss: 0.5640, test_loss: 0.8590, test_f1: 0.6547
 epoch: 93, train_loss: 0.5580, test_loss: 0.8413, test_f1: 0.6362
 epoch: 94, train_loss: 0.5538, test_loss: 0.8149, test_f1: 0.6765
 epoch: 95, train_loss: 0.5489, test_loss: 0.7903, test_f1: 0.6718
 epoch: 96, train_loss: 0.5518, test_loss: 0.8645, test_f1: 0.6551
 epoch: 97, train_loss: 0.5397, test_loss: 0.8008, test_f1: 0.6503
 epoch: 98, train_loss: 0.5428, test_loss: 0.8325, test_f1: 0.6583
 epoch: 99, train_loss: 0.5445, test_loss: 0.8693, test_f1: 0.6617

Training completed in 1516.40 seconds
Best F1: 0.7149 at epoch 50
Mean F1 across iterations: 0.6872  0.0147
========================FINAL RESULTS================================
FEGIN weighted F1: 0.7149  0.0147
python main.py --data ltspice_examples --representation component_pin_net --model FEGIN --layers 5 --hiddens 32 --batch_size 32 --lr 0.001 --emb_size 128 --epochs 100 --save_appendix component_pin_net_L5_H32_BS32_LR0.001_E128 --no_val
-----



STDERR:
  File "main.py", line 370, in <module>
    main()
  File "main.py", line 254, in main
    dataset = dataset_class(
  File "/home/philip/projects/llm_inference_code_repo/Circuit-Completion-Using-GNNs/component_classification_with_link_prediction_head/evaluation/FEGIN/kernel/circuit_datasets.py", line 15, in __init__
    self.data, self.slices = torch.load(self.processed_paths[0])
  File "/home/philip/.local/lib/python3.8/site-packages/torch/serialization.py", line 1040, in load
    warnings.warn(
  File "/usr/lib/python3.8/warnings.py", line 109, in _showwarnmsg
    sw(msg.message, msg.category, msg.filename, msg.lineno,
  File "main.py", line 47, in warn_with_traceback
    traceback.print_stack(file=log)
/home/philip/projects/llm_inference_code_repo/Circuit-Completion-Using-GNNs/component_classification_with_link_prediction_head/evaluation/FEGIN/kernel/circuit_datasets.py:15: FutureWarning: You are using `torch.load` with `weights_only=False` (the current default value), which uses the default pickle module implicitly. It is possible to construct malicious pickle data which will execute arbitrary code during unpickling (See https://github.com/pytorch/pytorch/blob/main/SECURITY.md#untrusted-models for more details). In a future release, the default value for `weights_only` will be flipped to `True`. This limits the functions that could be executed during unpickling. Arbitrary objects will no longer be allowed to be loaded via this mode unless they are explicitly allowlisted by the user via `torch.serialization.add_safe_globals`. We recommend you start setting `weights_only=True` for any use case where you don't have full control of the loaded file. Please open an issue on GitHub for any issues related to this experimental feature.
  self.data, self.slices = torch.load(self.processed_paths[0])
