STDOUT:
Results will be saved in /home/philip/projects/ltspice_examples_code_repo/Circuit-Completion-Using-GNNs/component_classification_with_link_prediction_head/evaluation/FEGIN/results/model_FEGIN_dataset_ltspice_demos
Command line input: python main.py --data ltspice_demos --representation component_component --model FEGIN --layers 2 --hiddens 64 --batch_size 64 --lr 0.0001 --emb_size 128 --epochs 100 --save_appendix component_component_L2_H64_BS64_LR0.0001_E128 --no_val
 is saved.
-----
ltspice_demos - FEGIN
Using 2 layers, 64 hidden units, h = 2
Loading component_component representation dataset
ENTERED
Training FEGIN on component_component representation
Train: 1565, Test: 383
##################ITERATION #0 ****************************************
 epoch: 0, train_loss: 1.4045, test_loss: 1.3969, test_f1: 0.0457
 epoch: 1, train_loss: 1.3904, test_loss: 1.3866, test_f1: 0.1077
 epoch: 2, train_loss: 1.3808, test_loss: 1.3766, test_f1: 0.2686
 epoch: 3, train_loss: 1.3696, test_loss: 1.3659, test_f1: 0.2331
 epoch: 4, train_loss: 1.3538, test_loss: 1.3545, test_f1: 0.2281
 epoch: 5, train_loss: 1.3373, test_loss: 1.3416, test_f1: 0.2614
 epoch: 6, train_loss: 1.3159, test_loss: 1.3276, test_f1: 0.2587
 epoch: 7, train_loss: 1.2920, test_loss: 1.3127, test_f1: 0.2596
 epoch: 8, train_loss: 1.2685, test_loss: 1.3008, test_f1: 0.2634
 epoch: 9, train_loss: 1.2460, test_loss: 1.2914, test_f1: 0.2600
 epoch: 10, train_loss: 1.2250, test_loss: 1.2853, test_f1: 0.2618
 epoch: 11, train_loss: 1.2078, test_loss: 1.2795, test_f1: 0.2571
 epoch: 12, train_loss: 1.1961, test_loss: 1.2789, test_f1: 0.2613
 epoch: 13, train_loss: 1.1859, test_loss: 1.2799, test_f1: 0.2599
 epoch: 14, train_loss: 1.1735, test_loss: 1.2724, test_f1: 0.2687
 epoch: 15, train_loss: 1.1627, test_loss: 1.2746, test_f1: 0.2747
 epoch: 16, train_loss: 1.1569, test_loss: 1.2741, test_f1: 0.3386
 epoch: 17, train_loss: 1.1498, test_loss: 1.2770, test_f1: 0.3263
 epoch: 18, train_loss: 1.1467, test_loss: 1.2675, test_f1: 0.3772
 epoch: 19, train_loss: 1.1422, test_loss: 1.2671, test_f1: 0.4003
 epoch: 20, train_loss: 1.1254, test_loss: 1.2693, test_f1: 0.4092
 epoch: 21, train_loss: 1.1254, test_loss: 1.2658, test_f1: 0.3977
 epoch: 22, train_loss: 1.1146, test_loss: 1.2633, test_f1: 0.3948
 epoch: 23, train_loss: 1.1070, test_loss: 1.2456, test_f1: 0.3909
 epoch: 24, train_loss: 1.1023, test_loss: 1.2423, test_f1: 0.3885
 epoch: 25, train_loss: 1.0884, test_loss: 1.2385, test_f1: 0.3843
 epoch: 26, train_loss: 1.0768, test_loss: 1.2326, test_f1: 0.3917
 epoch: 27, train_loss: 1.0742, test_loss: 1.2324, test_f1: 0.3984
 epoch: 28, train_loss: 1.0625, test_loss: 1.2247, test_f1: 0.3952
 epoch: 29, train_loss: 1.0559, test_loss: 1.2337, test_f1: 0.4132
 epoch: 30, train_loss: 1.0513, test_loss: 1.2267, test_f1: 0.4060
 epoch: 31, train_loss: 1.0356, test_loss: 1.2281, test_f1: 0.4265
 epoch: 32, train_loss: 1.0255, test_loss: 1.2288, test_f1: 0.4237
 epoch: 33, train_loss: 1.0243, test_loss: 1.2227, test_f1: 0.4238
 epoch: 34, train_loss: 1.0087, test_loss: 1.2352, test_f1: 0.4219
 epoch: 35, train_loss: 1.0062, test_loss: 1.2224, test_f1: 0.4254
 epoch: 36, train_loss: 0.9973, test_loss: 1.2203, test_f1: 0.4340
 epoch: 37, train_loss: 0.9992, test_loss: 1.2323, test_f1: 0.4345
 epoch: 38, train_loss: 1.0006, test_loss: 1.2303, test_f1: 0.4359
 epoch: 39, train_loss: 0.9890, test_loss: 1.2329, test_f1: 0.4334
 epoch: 40, train_loss: 0.9804, test_loss: 1.2395, test_f1: 0.4349
 epoch: 41, train_loss: 0.9673, test_loss: 1.2492, test_f1: 0.4303
 epoch: 42, train_loss: 0.9797, test_loss: 1.2515, test_f1: 0.4329
 epoch: 43, train_loss: 0.9740, test_loss: 1.2612, test_f1: 0.4465
 epoch: 44, train_loss: 0.9640, test_loss: 1.2648, test_f1: 0.4600
 epoch: 45, train_loss: 0.9626, test_loss: 1.2605, test_f1: 0.4465
 epoch: 46, train_loss: 0.9605, test_loss: 1.2648, test_f1: 0.4572
 epoch: 47, train_loss: 0.9465, test_loss: 1.2726, test_f1: 0.4688
 epoch: 48, train_loss: 0.9454, test_loss: 1.2985, test_f1: 0.4370
 epoch: 49, train_loss: 0.9552, test_loss: 1.2984, test_f1: 0.4744
 epoch: 50, train_loss: 0.9361, test_loss: 1.2801, test_f1: 0.4406
 epoch: 51, train_loss: 0.9194, test_loss: 1.3067, test_f1: 0.4663
 epoch: 52, train_loss: 0.9272, test_loss: 1.3186, test_f1: 0.4668
 epoch: 53, train_loss: 0.9201, test_loss: 1.3204, test_f1: 0.4717
 epoch: 54, train_loss: 0.9183, test_loss: 1.3123, test_f1: 0.4601
 epoch: 55, train_loss: 0.9233, test_loss: 1.3213, test_f1: 0.4734
 epoch: 56, train_loss: 0.9184, test_loss: 1.3140, test_f1: 0.4727
 epoch: 57, train_loss: 0.9111, test_loss: 1.3143, test_f1: 0.4800
 epoch: 58, train_loss: 0.9179, test_loss: 1.3218, test_f1: 0.4870
 epoch: 59, train_loss: 0.9185, test_loss: 1.3238, test_f1: 0.4758
 epoch: 60, train_loss: 0.9103, test_loss: 1.3312, test_f1: 0.4839
 epoch: 61, train_loss: 0.9018, test_loss: 1.3365, test_f1: 0.4996
 epoch: 62, train_loss: 0.9079, test_loss: 1.3299, test_f1: 0.4987
 epoch: 63, train_loss: 0.9057, test_loss: 1.3382, test_f1: 0.5021
 epoch: 64, train_loss: 0.9014, test_loss: 1.3460, test_f1: 0.4752
 epoch: 65, train_loss: 0.9064, test_loss: 1.3560, test_f1: 0.5004
 epoch: 66, train_loss: 0.8946, test_loss: 1.3493, test_f1: 0.5000
 epoch: 67, train_loss: 0.8976, test_loss: 1.3560, test_f1: 0.5042
 epoch: 68, train_loss: 0.8999, test_loss: 1.3653, test_f1: 0.5122
 epoch: 69, train_loss: 0.8918, test_loss: 1.3557, test_f1: 0.5197
 epoch: 70, train_loss: 0.8945, test_loss: 1.3646, test_f1: 0.5274
 epoch: 71, train_loss: 0.8905, test_loss: 1.3606, test_f1: 0.5269
 epoch: 72, train_loss: 0.8794, test_loss: 1.3818, test_f1: 0.5207
 epoch: 73, train_loss: 0.8935, test_loss: 1.4097, test_f1: 0.5332
 epoch: 74, train_loss: 0.8924, test_loss: 1.4086, test_f1: 0.5118
 epoch: 75, train_loss: 0.8839, test_loss: 1.4094, test_f1: 0.5206
 epoch: 76, train_loss: 0.8828, test_loss: 1.4053, test_f1: 0.5095
 epoch: 77, train_loss: 0.8850, test_loss: 1.3883, test_f1: 0.5110
 epoch: 78, train_loss: 0.8828, test_loss: 1.4195, test_f1: 0.5264
 epoch: 79, train_loss: 0.8719, test_loss: 1.4408, test_f1: 0.5322
 epoch: 80, train_loss: 0.8740, test_loss: 1.4145, test_f1: 0.5378
 epoch: 81, train_loss: 0.8622, test_loss: 1.4062, test_f1: 0.5348
 epoch: 82, train_loss: 0.8642, test_loss: 1.4078, test_f1: 0.5432
 epoch: 83, train_loss: 0.8726, test_loss: 1.4221, test_f1: 0.5201
 epoch: 84, train_loss: 0.8593, test_loss: 1.4498, test_f1: 0.5432
 epoch: 85, train_loss: 0.8638, test_loss: 1.4680, test_f1: 0.5385
 epoch: 86, train_loss: 0.8554, test_loss: 1.4448, test_f1: 0.5380
 epoch: 87, train_loss: 0.8592, test_loss: 1.4568, test_f1: 0.5244
 epoch: 88, train_loss: 0.8572, test_loss: 1.4592, test_f1: 0.5256
 epoch: 89, train_loss: 0.8580, test_loss: 1.4246, test_f1: 0.5399
 epoch: 90, train_loss: 0.8635, test_loss: 1.4325, test_f1: 0.5461
 epoch: 91, train_loss: 0.8588, test_loss: 1.4509, test_f1: 0.5485
 epoch: 92, train_loss: 0.8457, test_loss: 1.4496, test_f1: 0.5511
 epoch: 93, train_loss: 0.8465, test_loss: 1.4816, test_f1: 0.5535
 epoch: 94, train_loss: 0.8436, test_loss: 1.4675, test_f1: 0.5481
 epoch: 95, train_loss: 0.8516, test_loss: 1.4710, test_f1: 0.5612
 epoch: 96, train_loss: 0.8449, test_loss: 1.4585, test_f1: 0.5416
 epoch: 97, train_loss: 0.8273, test_loss: 1.4882, test_f1: 0.5562
 epoch: 98, train_loss: 0.8351, test_loss: 1.5077, test_f1: 0.5562
 epoch: 99, train_loss: 0.8416, test_loss: 1.5200, test_f1: 0.5475
##################ITERATION #1 ****************************************
 epoch: 0, train_loss: 1.3772, test_loss: 1.3753, test_f1: 0.2111
 epoch: 1, train_loss: 1.3333, test_loss: 1.3531, test_f1: 0.2336
 epoch: 2, train_loss: 1.3026, test_loss: 1.3334, test_f1: 0.2281
 epoch: 3, train_loss: 1.2793, test_loss: 1.3144, test_f1: 0.2289
 epoch: 4, train_loss: 1.2551, test_loss: 1.3039, test_f1: 0.2281
 epoch: 5, train_loss: 1.2352, test_loss: 1.2913, test_f1: 0.2281
 epoch: 6, train_loss: 1.2196, test_loss: 1.2856, test_f1: 0.2289
 epoch: 7, train_loss: 1.2026, test_loss: 1.2777, test_f1: 0.2597
 epoch: 8, train_loss: 1.1965, test_loss: 1.2674, test_f1: 0.2974
 epoch: 9, train_loss: 1.1761, test_loss: 1.2584, test_f1: 0.3057
 epoch: 10, train_loss: 1.1710, test_loss: 1.2477, test_f1: 0.3655
 epoch: 11, train_loss: 1.1509, test_loss: 1.2459, test_f1: 0.3638
 epoch: 12, train_loss: 1.1461, test_loss: 1.2437, test_f1: 0.3932
 epoch: 13, train_loss: 1.1294, test_loss: 1.2356, test_f1: 0.4022
 epoch: 14, train_loss: 1.1210, test_loss: 1.2213, test_f1: 0.4037
 epoch: 15, train_loss: 1.1103, test_loss: 1.2139, test_f1: 0.4030
 epoch: 16, train_loss: 1.1079, test_loss: 1.2180, test_f1: 0.4522
 epoch: 17, train_loss: 1.0922, test_loss: 1.1977, test_f1: 0.4383
 epoch: 18, train_loss: 1.0824, test_loss: 1.2006, test_f1: 0.4388
 epoch: 19, train_loss: 1.0747, test_loss: 1.1922, test_f1: 0.4344
 epoch: 20, train_loss: 1.0615, test_loss: 1.1757, test_f1: 0.4443
 epoch: 21, train_loss: 1.0436, test_loss: 1.1759, test_f1: 0.4504
 epoch: 22, train_loss: 1.0397, test_loss: 1.1700, test_f1: 0.4497
 epoch: 23, train_loss: 1.0273, test_loss: 1.1639, test_f1: 0.4450
 epoch: 24, train_loss: 1.0283, test_loss: 1.1664, test_f1: 0.4444
 epoch: 25, train_loss: 1.0137, test_loss: 1.1528, test_f1: 0.4350
 epoch: 26, train_loss: 1.0094, test_loss: 1.1535, test_f1: 0.4468
 epoch: 27, train_loss: 1.0048, test_loss: 1.1496, test_f1: 0.4734
 epoch: 28, train_loss: 0.9950, test_loss: 1.1507, test_f1: 0.4824
 epoch: 29, train_loss: 0.9749, test_loss: 1.1503, test_f1: 0.5024
 epoch: 30, train_loss: 0.9715, test_loss: 1.1515, test_f1: 0.4994
 epoch: 31, train_loss: 0.9644, test_loss: 1.1454, test_f1: 0.5062
 epoch: 32, train_loss: 0.9644, test_loss: 1.1638, test_f1: 0.4998
 epoch: 33, train_loss: 0.9573, test_loss: 1.1600, test_f1: 0.5346
 epoch: 34, train_loss: 0.9521, test_loss: 1.1466, test_f1: 0.5204
 epoch: 35, train_loss: 0.9522, test_loss: 1.1578, test_f1: 0.5312
 epoch: 36, train_loss: 0.9369, test_loss: 1.1606, test_f1: 0.5240
 epoch: 37, train_loss: 0.9270, test_loss: 1.1795, test_f1: 0.5429
 epoch: 38, train_loss: 0.9233, test_loss: 1.1612, test_f1: 0.5373
 epoch: 39, train_loss: 0.9190, test_loss: 1.1489, test_f1: 0.5558
 epoch: 40, train_loss: 0.9058, test_loss: 1.1341, test_f1: 0.5624
 epoch: 41, train_loss: 0.9039, test_loss: 1.1689, test_f1: 0.5612
 epoch: 42, train_loss: 0.8945, test_loss: 1.1676, test_f1: 0.5649
 epoch: 43, train_loss: 0.8910, test_loss: 1.1960, test_f1: 0.5243
 epoch: 44, train_loss: 0.9037, test_loss: 1.1775, test_f1: 0.5529
 epoch: 45, train_loss: 0.8812, test_loss: 1.2138, test_f1: 0.5178
 epoch: 46, train_loss: 0.8919, test_loss: 1.2148, test_f1: 0.5331
 epoch: 47, train_loss: 0.8794, test_loss: 1.1817, test_f1: 0.5506
 epoch: 48, train_loss: 0.8814, test_loss: 1.1875, test_f1: 0.5570
 epoch: 49, train_loss: 0.8665, test_loss: 1.1715, test_f1: 0.5706
 epoch: 50, train_loss: 0.8498, test_loss: 1.1599, test_f1: 0.5559
 epoch: 51, train_loss: 0.8564, test_loss: 1.1778, test_f1: 0.5658
 epoch: 52, train_loss: 0.8484, test_loss: 1.1920, test_f1: 0.5683
 epoch: 53, train_loss: 0.8581, test_loss: 1.1944, test_f1: 0.5491
 epoch: 54, train_loss: 0.8445, test_loss: 1.1850, test_f1: 0.5606
 epoch: 55, train_loss: 0.8576, test_loss: 1.1956, test_f1: 0.5665
 epoch: 56, train_loss: 0.8471, test_loss: 1.1992, test_f1: 0.5729
 epoch: 57, train_loss: 0.8377, test_loss: 1.2128, test_f1: 0.5581
 epoch: 58, train_loss: 0.8341, test_loss: 1.2233, test_f1: 0.5683
 epoch: 59, train_loss: 0.8451, test_loss: 1.2390, test_f1: 0.5543
 epoch: 60, train_loss: 0.8386, test_loss: 1.2260, test_f1: 0.5683
 epoch: 61, train_loss: 0.8307, test_loss: 1.1987, test_f1: 0.5482
 epoch: 62, train_loss: 0.8262, test_loss: 1.2191, test_f1: 0.5460
 epoch: 63, train_loss: 0.8207, test_loss: 1.2245, test_f1: 0.5674
 epoch: 64, train_loss: 0.8335, test_loss: 1.2181, test_f1: 0.5780
 epoch: 65, train_loss: 0.8155, test_loss: 1.2227, test_f1: 0.5534
 epoch: 66, train_loss: 0.8249, test_loss: 1.2267, test_f1: 0.5435
 epoch: 67, train_loss: 0.8240, test_loss: 1.2418, test_f1: 0.5651
 epoch: 68, train_loss: 0.8266, test_loss: 1.2454, test_f1: 0.5856
 epoch: 69, train_loss: 0.8093, test_loss: 1.2598, test_f1: 0.5522
 epoch: 70, train_loss: 0.8196, test_loss: 1.2588, test_f1: 0.5431
 epoch: 71, train_loss: 0.8175, test_loss: 1.2612, test_f1: 0.5736
 epoch: 72, train_loss: 0.7995, test_loss: 1.2522, test_f1: 0.5793
 epoch: 73, train_loss: 0.8180, test_loss: 1.2599, test_f1: 0.5345
 epoch: 74, train_loss: 0.8121, test_loss: 1.2609, test_f1: 0.5510
 epoch: 75, train_loss: 0.8034, test_loss: 1.2613, test_f1: 0.5558
 epoch: 76, train_loss: 0.7998, test_loss: 1.2448, test_f1: 0.5491
 epoch: 77, train_loss: 0.7990, test_loss: 1.2599, test_f1: 0.5573
 epoch: 78, train_loss: 0.8130, test_loss: 1.2495, test_f1: 0.5371
 epoch: 79, train_loss: 0.7955, test_loss: 1.2585, test_f1: 0.5456
 epoch: 80, train_loss: 0.8062, test_loss: 1.2609, test_f1: 0.5506
 epoch: 81, train_loss: 0.7957, test_loss: 1.2852, test_f1: 0.5591
 epoch: 82, train_loss: 0.7802, test_loss: 1.2835, test_f1: 0.5605
 epoch: 83, train_loss: 0.7828, test_loss: 1.2939, test_f1: 0.5513
 epoch: 84, train_loss: 0.7889, test_loss: 1.2976, test_f1: 0.5672
 epoch: 85, train_loss: 0.7895, test_loss: 1.3074, test_f1: 0.5627
 epoch: 86, train_loss: 0.7958, test_loss: 1.3040, test_f1: 0.5513
 epoch: 87, train_loss: 0.7752, test_loss: 1.3254, test_f1: 0.5543
 epoch: 88, train_loss: 0.7990, test_loss: 1.3055, test_f1: 0.5486
 epoch: 89, train_loss: 0.7857, test_loss: 1.2952, test_f1: 0.5783
 epoch: 90, train_loss: 0.7704, test_loss: 1.2919, test_f1: 0.5647
 epoch: 91, train_loss: 0.7802, test_loss: 1.2974, test_f1: 0.5641
 epoch: 92, train_loss: 0.7832, test_loss: 1.2898, test_f1: 0.5603
 epoch: 93, train_loss: 0.7872, test_loss: 1.2939, test_f1: 0.5552
 epoch: 94, train_loss: 0.7710, test_loss: 1.3112, test_f1: 0.5627
 epoch: 95, train_loss: 0.7572, test_loss: 1.3117, test_f1: 0.5575
 epoch: 96, train_loss: 0.7958, test_loss: 1.3115, test_f1: 0.5492
 epoch: 97, train_loss: 0.7669, test_loss: 1.3104, test_f1: 0.5559
 epoch: 98, train_loss: 0.7607, test_loss: 1.3333, test_f1: 0.5528
 epoch: 99, train_loss: 0.7648, test_loss: 1.3289, test_f1: 0.5630
##################ITERATION #2 ****************************************
 epoch: 0, train_loss: 1.3161, test_loss: 1.3604, test_f1: 0.2389
 epoch: 1, train_loss: 1.2783, test_loss: 1.3405, test_f1: 0.2867
 epoch: 2, train_loss: 1.2587, test_loss: 1.3255, test_f1: 0.3028
 epoch: 3, train_loss: 1.2410, test_loss: 1.3213, test_f1: 0.3172
 epoch: 4, train_loss: 1.2219, test_loss: 1.3171, test_f1: 0.3188
 epoch: 5, train_loss: 1.2097, test_loss: 1.2969, test_f1: 0.3305
 epoch: 6, train_loss: 1.1951, test_loss: 1.2867, test_f1: 0.3386
 epoch: 7, train_loss: 1.1804, test_loss: 1.2805, test_f1: 0.3592
 epoch: 8, train_loss: 1.1648, test_loss: 1.2721, test_f1: 0.3896
 epoch: 9, train_loss: 1.1559, test_loss: 1.2584, test_f1: 0.4323
 epoch: 10, train_loss: 1.1403, test_loss: 1.2487, test_f1: 0.4383
 epoch: 11, train_loss: 1.1304, test_loss: 1.2401, test_f1: 0.4492
 epoch: 12, train_loss: 1.1148, test_loss: 1.2323, test_f1: 0.4425
 epoch: 13, train_loss: 1.1062, test_loss: 1.2297, test_f1: 0.4495
 epoch: 14, train_loss: 1.0841, test_loss: 1.2227, test_f1: 0.4387
 epoch: 15, train_loss: 1.0738, test_loss: 1.2155, test_f1: 0.4470
 epoch: 16, train_loss: 1.0662, test_loss: 1.2046, test_f1: 0.4579
 epoch: 17, train_loss: 1.0588, test_loss: 1.2011, test_f1: 0.4484
 epoch: 18, train_loss: 1.0471, test_loss: 1.2083, test_f1: 0.4498
 epoch: 19, train_loss: 1.0480, test_loss: 1.1974, test_f1: 0.4749
 epoch: 20, train_loss: 1.0294, test_loss: 1.1931, test_f1: 0.4556
 epoch: 21, train_loss: 1.0236, test_loss: 1.1787, test_f1: 0.4680
 epoch: 22, train_loss: 1.0161, test_loss: 1.1879, test_f1: 0.4681
 epoch: 23, train_loss: 1.0116, test_loss: 1.1964, test_f1: 0.4766
 epoch: 24, train_loss: 1.0072, test_loss: 1.2035, test_f1: 0.4778
 epoch: 25, train_loss: 1.0063, test_loss: 1.2017, test_f1: 0.4887
 epoch: 26, train_loss: 1.0023, test_loss: 1.1977, test_f1: 0.4727
 epoch: 27, train_loss: 0.9858, test_loss: 1.1952, test_f1: 0.4813
 epoch: 28, train_loss: 0.9879, test_loss: 1.1890, test_f1: 0.4810
 epoch: 29, train_loss: 0.9776, test_loss: 1.1933, test_f1: 0.4860
 epoch: 30, train_loss: 0.9692, test_loss: 1.1898, test_f1: 0.4811
 epoch: 31, train_loss: 0.9851, test_loss: 1.1825, test_f1: 0.4849
 epoch: 32, train_loss: 0.9730, test_loss: 1.1969, test_f1: 0.4974
 epoch: 33, train_loss: 0.9595, test_loss: 1.1862, test_f1: 0.4933
 epoch: 34, train_loss: 0.9635, test_loss: 1.1937, test_f1: 0.4933
 epoch: 35, train_loss: 0.9542, test_loss: 1.1971, test_f1: 0.4871
 epoch: 36, train_loss: 0.9421, test_loss: 1.1976, test_f1: 0.5020
 epoch: 37, train_loss: 0.9470, test_loss: 1.1932, test_f1: 0.4969
 epoch: 38, train_loss: 0.9477, test_loss: 1.2006, test_f1: 0.5019
 epoch: 39, train_loss: 0.9268, test_loss: 1.1948, test_f1: 0.4968
 epoch: 40, train_loss: 0.9338, test_loss: 1.1935, test_f1: 0.4947
 epoch: 41, train_loss: 0.9321, test_loss: 1.1926, test_f1: 0.4979
 epoch: 42, train_loss: 0.9287, test_loss: 1.2018, test_f1: 0.5070
 epoch: 43, train_loss: 0.9235, test_loss: 1.2176, test_f1: 0.5080
 epoch: 44, train_loss: 0.9131, test_loss: 1.1940, test_f1: 0.5091
 epoch: 45, train_loss: 0.9114, test_loss: 1.2107, test_f1: 0.5096
 epoch: 46, train_loss: 0.9008, test_loss: 1.2073, test_f1: 0.5038
 epoch: 47, train_loss: 0.9125, test_loss: 1.2148, test_f1: 0.5018
 epoch: 48, train_loss: 0.9145, test_loss: 1.2063, test_f1: 0.4897
 epoch: 49, train_loss: 0.9011, test_loss: 1.2154, test_f1: 0.5229
 epoch: 50, train_loss: 0.8910, test_loss: 1.2146, test_f1: 0.5099
 epoch: 51, train_loss: 0.8862, test_loss: 1.2233, test_f1: 0.5208
 epoch: 52, train_loss: 0.8870, test_loss: 1.2288, test_f1: 0.5039
 epoch: 53, train_loss: 0.8904, test_loss: 1.2262, test_f1: 0.5012
 epoch: 54, train_loss: 0.8889, test_loss: 1.2122, test_f1: 0.5178
 epoch: 55, train_loss: 0.8823, test_loss: 1.2179, test_f1: 0.5123
 epoch: 56, train_loss: 0.8730, test_loss: 1.2178, test_f1: 0.5071
 epoch: 57, train_loss: 0.8706, test_loss: 1.2223, test_f1: 0.5048
 epoch: 58, train_loss: 0.8818, test_loss: 1.2287, test_f1: 0.5127
 epoch: 59, train_loss: 0.8752, test_loss: 1.2178, test_f1: 0.5148
 epoch: 60, train_loss: 0.8683, test_loss: 1.2375, test_f1: 0.5072
 epoch: 61, train_loss: 0.8737, test_loss: 1.2209, test_f1: 0.5151
 epoch: 62, train_loss: 0.8674, test_loss: 1.2274, test_f1: 0.5124
 epoch: 63, train_loss: 0.8809, test_loss: 1.2243, test_f1: 0.5155
 epoch: 64, train_loss: 0.8667, test_loss: 1.2236, test_f1: 0.5231
 epoch: 65, train_loss: 0.8650, test_loss: 1.2314, test_f1: 0.5129
 epoch: 66, train_loss: 0.8634, test_loss: 1.2371, test_f1: 0.5360
 epoch: 67, train_loss: 0.8561, test_loss: 1.2164, test_f1: 0.5258
 epoch: 68, train_loss: 0.8578, test_loss: 1.2309, test_f1: 0.5315
 epoch: 69, train_loss: 0.8628, test_loss: 1.2314, test_f1: 0.5285
 epoch: 70, train_loss: 0.8449, test_loss: 1.2232, test_f1: 0.5201
 epoch: 71, train_loss: 0.8611, test_loss: 1.2323, test_f1: 0.5101
 epoch: 72, train_loss: 0.8491, test_loss: 1.2345, test_f1: 0.5364
 epoch: 73, train_loss: 0.8615, test_loss: 1.2234, test_f1: 0.5468
 epoch: 74, train_loss: 0.8543, test_loss: 1.2378, test_f1: 0.5253
 epoch: 75, train_loss: 0.8506, test_loss: 1.2410, test_f1: 0.5209
 epoch: 76, train_loss: 0.8583, test_loss: 1.2428, test_f1: 0.5283
 epoch: 77, train_loss: 0.8410, test_loss: 1.2335, test_f1: 0.5491
 epoch: 78, train_loss: 0.8484, test_loss: 1.2503, test_f1: 0.5389
 epoch: 79, train_loss: 0.8471, test_loss: 1.2462, test_f1: 0.5312
 epoch: 80, train_loss: 0.8452, test_loss: 1.2344, test_f1: 0.5308
 epoch: 81, train_loss: 0.8280, test_loss: 1.2479, test_f1: 0.5361
 epoch: 82, train_loss: 0.8339, test_loss: 1.2381, test_f1: 0.5309
 epoch: 83, train_loss: 0.8403, test_loss: 1.2528, test_f1: 0.5258
 epoch: 84, train_loss: 0.8322, test_loss: 1.2551, test_f1: 0.5281
 epoch: 85, train_loss: 0.8339, test_loss: 1.2550, test_f1: 0.5303
 epoch: 86, train_loss: 0.8345, test_loss: 1.2519, test_f1: 0.5357
 epoch: 87, train_loss: 0.8382, test_loss: 1.2761, test_f1: 0.5283
 epoch: 88, train_loss: 0.8314, test_loss: 1.2652, test_f1: 0.5254
 epoch: 89, train_loss: 0.8567, test_loss: 1.2537, test_f1: 0.5253
 epoch: 90, train_loss: 0.8313, test_loss: 1.2452, test_f1: 0.5415
 epoch: 91, train_loss: 0.8276, test_loss: 1.2459, test_f1: 0.5305
 epoch: 92, train_loss: 0.8231, test_loss: 1.2389, test_f1: 0.5407
 epoch: 93, train_loss: 0.8313, test_loss: 1.2516, test_f1: 0.5439
 epoch: 94, train_loss: 0.8181, test_loss: 1.2526, test_f1: 0.5281
 epoch: 95, train_loss: 0.8133, test_loss: 1.2562, test_f1: 0.5284
 epoch: 96, train_loss: 0.8226, test_loss: 1.2480, test_f1: 0.5307
 epoch: 97, train_loss: 0.8121, test_loss: 1.2422, test_f1: 0.5481
 epoch: 98, train_loss: 0.8255, test_loss: 1.2721, test_f1: 0.5355
 epoch: 99, train_loss: 0.8154, test_loss: 1.2505, test_f1: 0.5440
##################ITERATION #3 ****************************************
 epoch: 0, train_loss: 1.2911, test_loss: 1.3337, test_f1: 0.2281
 epoch: 1, train_loss: 1.2360, test_loss: 1.3067, test_f1: 0.2630
 epoch: 2, train_loss: 1.2265, test_loss: 1.2863, test_f1: 0.3278
 epoch: 3, train_loss: 1.1965, test_loss: 1.2696, test_f1: 0.3782
 epoch: 4, train_loss: 1.1767, test_loss: 1.2504, test_f1: 0.3718
 epoch: 5, train_loss: 1.1652, test_loss: 1.2377, test_f1: 0.4068
 epoch: 6, train_loss: 1.1473, test_loss: 1.2245, test_f1: 0.4345
 epoch: 7, train_loss: 1.1372, test_loss: 1.2133, test_f1: 0.4276
 epoch: 8, train_loss: 1.1225, test_loss: 1.2083, test_f1: 0.4638
 epoch: 9, train_loss: 1.1026, test_loss: 1.2012, test_f1: 0.4630
 epoch: 10, train_loss: 1.1016, test_loss: 1.1901, test_f1: 0.4734
 epoch: 11, train_loss: 1.0892, test_loss: 1.1887, test_f1: 0.4695
 epoch: 12, train_loss: 1.0708, test_loss: 1.1835, test_f1: 0.4804
 epoch: 13, train_loss: 1.0646, test_loss: 1.1820, test_f1: 0.4749
 epoch: 14, train_loss: 1.0573, test_loss: 1.1802, test_f1: 0.4853
 epoch: 15, train_loss: 1.0517, test_loss: 1.1802, test_f1: 0.4778
 epoch: 16, train_loss: 1.0403, test_loss: 1.1806, test_f1: 0.5083
 epoch: 17, train_loss: 1.0320, test_loss: 1.1772, test_f1: 0.5153
 epoch: 18, train_loss: 1.0313, test_loss: 1.1726, test_f1: 0.5171
 epoch: 19, train_loss: 1.0206, test_loss: 1.1729, test_f1: 0.5371
 epoch: 20, train_loss: 1.0136, test_loss: 1.1666, test_f1: 0.5466
 epoch: 21, train_loss: 1.0070, test_loss: 1.1664, test_f1: 0.5467
 epoch: 22, train_loss: 1.0097, test_loss: 1.1635, test_f1: 0.5489
 epoch: 23, train_loss: 0.9975, test_loss: 1.1615, test_f1: 0.5417
 epoch: 24, train_loss: 0.9831, test_loss: 1.1600, test_f1: 0.5578
 epoch: 25, train_loss: 0.9773, test_loss: 1.1666, test_f1: 0.5556
 epoch: 26, train_loss: 0.9710, test_loss: 1.1584, test_f1: 0.5614
 epoch: 27, train_loss: 0.9656, test_loss: 1.1569, test_f1: 0.5660
 epoch: 28, train_loss: 0.9586, test_loss: 1.1605, test_f1: 0.5702
 epoch: 29, train_loss: 0.9689, test_loss: 1.1631, test_f1: 0.5717
 epoch: 30, train_loss: 0.9479, test_loss: 1.1733, test_f1: 0.5469
 epoch: 31, train_loss: 0.9463, test_loss: 1.1781, test_f1: 0.5474
 epoch: 32, train_loss: 0.9459, test_loss: 1.1661, test_f1: 0.5463
 epoch: 33, train_loss: 0.9273, test_loss: 1.1666, test_f1: 0.5559
 epoch: 34, train_loss: 0.9164, test_loss: 1.1510, test_f1: 0.5637
 epoch: 35, train_loss: 0.9141, test_loss: 1.1526, test_f1: 0.5693
 epoch: 36, train_loss: 0.9224, test_loss: 1.1559, test_f1: 0.5672
 epoch: 37, train_loss: 0.9107, test_loss: 1.1592, test_f1: 0.5597
 epoch: 38, train_loss: 0.9078, test_loss: 1.1457, test_f1: 0.5596
 epoch: 39, train_loss: 0.8968, test_loss: 1.1562, test_f1: 0.5675
 epoch: 40, train_loss: 0.8998, test_loss: 1.1588, test_f1: 0.5415
 epoch: 41, train_loss: 0.8939, test_loss: 1.1502, test_f1: 0.5268
 epoch: 42, train_loss: 0.8919, test_loss: 1.1807, test_f1: 0.5394
 epoch: 43, train_loss: 0.8870, test_loss: 1.1680, test_f1: 0.5340
 epoch: 44, train_loss: 0.8823, test_loss: 1.1698, test_f1: 0.5444
 epoch: 45, train_loss: 0.8721, test_loss: 1.1614, test_f1: 0.5371
 epoch: 46, train_loss: 0.8635, test_loss: 1.1823, test_f1: 0.5396
 epoch: 47, train_loss: 0.8632, test_loss: 1.1773, test_f1: 0.5356
 epoch: 48, train_loss: 0.8615, test_loss: 1.1885, test_f1: 0.5170
 epoch: 49, train_loss: 0.8571, test_loss: 1.1895, test_f1: 0.5287
 epoch: 50, train_loss: 0.8548, test_loss: 1.1759, test_f1: 0.5476
 epoch: 51, train_loss: 0.8527, test_loss: 1.1709, test_f1: 0.5218
 epoch: 52, train_loss: 0.8269, test_loss: 1.1721, test_f1: 0.5385
 epoch: 53, train_loss: 0.8380, test_loss: 1.1875, test_f1: 0.5418
 epoch: 54, train_loss: 0.8485, test_loss: 1.1926, test_f1: 0.5441
 epoch: 55, train_loss: 0.8365, test_loss: 1.1727, test_f1: 0.5317
 epoch: 56, train_loss: 0.8387, test_loss: 1.1850, test_f1: 0.5418
 epoch: 57, train_loss: 0.8313, test_loss: 1.1748, test_f1: 0.5515
 epoch: 58, train_loss: 0.8394, test_loss: 1.1928, test_f1: 0.5445
 epoch: 59, train_loss: 0.8424, test_loss: 1.1942, test_f1: 0.5271
 epoch: 60, train_loss: 0.8175, test_loss: 1.2015, test_f1: 0.5235
 epoch: 61, train_loss: 0.8265, test_loss: 1.2007, test_f1: 0.5314
 epoch: 62, train_loss: 0.8209, test_loss: 1.1881, test_f1: 0.5329
 epoch: 63, train_loss: 0.8146, test_loss: 1.1930, test_f1: 0.5379
 epoch: 64, train_loss: 0.8171, test_loss: 1.2003, test_f1: 0.5247
 epoch: 65, train_loss: 0.8203, test_loss: 1.2004, test_f1: 0.5367
 epoch: 66, train_loss: 0.8170, test_loss: 1.2089, test_f1: 0.5339
 epoch: 67, train_loss: 0.8035, test_loss: 1.1999, test_f1: 0.5298
 epoch: 68, train_loss: 0.8076, test_loss: 1.1956, test_f1: 0.5270
 epoch: 69, train_loss: 0.8277, test_loss: 1.2060, test_f1: 0.5222
 epoch: 70, train_loss: 0.8035, test_loss: 1.2071, test_f1: 0.5239
 epoch: 71, train_loss: 0.7850, test_loss: 1.2183, test_f1: 0.5292
 epoch: 72, train_loss: 0.7965, test_loss: 1.2175, test_f1: 0.5286
 epoch: 73, train_loss: 0.8013, test_loss: 1.2046, test_f1: 0.5294
 epoch: 74, train_loss: 0.8013, test_loss: 1.2203, test_f1: 0.5163
 epoch: 75, train_loss: 0.7961, test_loss: 1.2085, test_f1: 0.5382
 epoch: 76, train_loss: 0.8074, test_loss: 1.2223, test_f1: 0.5267
 epoch: 77, train_loss: 0.7902, test_loss: 1.2307, test_f1: 0.5398
 epoch: 78, train_loss: 0.7921, test_loss: 1.2168, test_f1: 0.5196
 epoch: 79, train_loss: 0.7771, test_loss: 1.2182, test_f1: 0.5216
 epoch: 80, train_loss: 0.7786, test_loss: 1.2186, test_f1: 0.5304
 epoch: 81, train_loss: 0.7830, test_loss: 1.2475, test_f1: 0.5036
 epoch: 82, train_loss: 0.7820, test_loss: 1.2370, test_f1: 0.5315
 epoch: 83, train_loss: 0.7807, test_loss: 1.2306, test_f1: 0.5381
 epoch: 84, train_loss: 0.7843, test_loss: 1.2259, test_f1: 0.5435
 epoch: 85, train_loss: 0.7774, test_loss: 1.2384, test_f1: 0.5290
 epoch: 86, train_loss: 0.7655, test_loss: 1.2262, test_f1: 0.5312
 epoch: 87, train_loss: 0.7636, test_loss: 1.2137, test_f1: 0.5311
 epoch: 88, train_loss: 0.7627, test_loss: 1.2367, test_f1: 0.5242
 epoch: 89, train_loss: 0.7762, test_loss: 1.2605, test_f1: 0.5405
 epoch: 90, train_loss: 0.7709, test_loss: 1.2345, test_f1: 0.5265
 epoch: 91, train_loss: 0.7656, test_loss: 1.2517, test_f1: 0.5260
 epoch: 92, train_loss: 0.7599, test_loss: 1.2537, test_f1: 0.5415
 epoch: 93, train_loss: 0.7565, test_loss: 1.2605, test_f1: 0.5349
 epoch: 94, train_loss: 0.7525, test_loss: 1.2663, test_f1: 0.5380
 epoch: 95, train_loss: 0.7672, test_loss: 1.2857, test_f1: 0.5457
 epoch: 96, train_loss: 0.7558, test_loss: 1.2652, test_f1: 0.5483
 epoch: 97, train_loss: 0.7669, test_loss: 1.2576, test_f1: 0.5590
 epoch: 98, train_loss: 0.7519, test_loss: 1.2745, test_f1: 0.5395
 epoch: 99, train_loss: 0.7532, test_loss: 1.2919, test_f1: 0.5540
##################ITERATION #4 ****************************************
 epoch: 0, train_loss: 1.3008, test_loss: 1.3481, test_f1: 0.3084
 epoch: 1, train_loss: 1.2478, test_loss: 1.3241, test_f1: 0.3256
 epoch: 2, train_loss: 1.2210, test_loss: 1.3022, test_f1: 0.3537
 epoch: 3, train_loss: 1.1884, test_loss: 1.2950, test_f1: 0.3776
 epoch: 4, train_loss: 1.1774, test_loss: 1.2757, test_f1: 0.4215
 epoch: 5, train_loss: 1.1500, test_loss: 1.2710, test_f1: 0.4304
 epoch: 6, train_loss: 1.1360, test_loss: 1.2547, test_f1: 0.4337
 epoch: 7, train_loss: 1.1237, test_loss: 1.2369, test_f1: 0.4673
 epoch: 8, train_loss: 1.1081, test_loss: 1.2368, test_f1: 0.4574
 epoch: 9, train_loss: 1.0941, test_loss: 1.2022, test_f1: 0.4866
 epoch: 10, train_loss: 1.0717, test_loss: 1.1986, test_f1: 0.4911
 epoch: 11, train_loss: 1.0736, test_loss: 1.1929, test_f1: 0.5049
 epoch: 12, train_loss: 1.0637, test_loss: 1.1849, test_f1: 0.5173
 epoch: 13, train_loss: 1.0520, test_loss: 1.1874, test_f1: 0.5345
 epoch: 14, train_loss: 1.0359, test_loss: 1.1893, test_f1: 0.5448
 epoch: 15, train_loss: 1.0296, test_loss: 1.1879, test_f1: 0.5175
 epoch: 16, train_loss: 1.0197, test_loss: 1.1848, test_f1: 0.5455
 epoch: 17, train_loss: 1.0195, test_loss: 1.1850, test_f1: 0.5095
 epoch: 18, train_loss: 1.0068, test_loss: 1.1826, test_f1: 0.5043
 epoch: 19, train_loss: 1.0087, test_loss: 1.1803, test_f1: 0.5395
 epoch: 20, train_loss: 0.9952, test_loss: 1.1677, test_f1: 0.5524
 epoch: 21, train_loss: 0.9844, test_loss: 1.1732, test_f1: 0.5613
 epoch: 22, train_loss: 0.9745, test_loss: 1.1716, test_f1: 0.5456
 epoch: 23, train_loss: 0.9767, test_loss: 1.1710, test_f1: 0.5568
 epoch: 24, train_loss: 0.9748, test_loss: 1.1737, test_f1: 0.5203
 epoch: 25, train_loss: 0.9547, test_loss: 1.1736, test_f1: 0.5464
 epoch: 26, train_loss: 0.9675, test_loss: 1.1640, test_f1: 0.5515
 epoch: 27, train_loss: 0.9509, test_loss: 1.1518, test_f1: 0.5433
 epoch: 28, train_loss: 0.9468, test_loss: 1.1412, test_f1: 0.5799
 epoch: 29, train_loss: 0.9540, test_loss: 1.1487, test_f1: 0.5720
 epoch: 30, train_loss: 0.9472, test_loss: 1.1775, test_f1: 0.5382
 epoch: 31, train_loss: 0.9338, test_loss: 1.1643, test_f1: 0.5566
 epoch: 32, train_loss: 0.9286, test_loss: 1.1628, test_f1: 0.5436
 epoch: 33, train_loss: 0.9378, test_loss: 1.1612, test_f1: 0.5515
 epoch: 34, train_loss: 0.9255, test_loss: 1.1640, test_f1: 0.5731
 epoch: 35, train_loss: 0.9115, test_loss: 1.1500, test_f1: 0.5745
 epoch: 36, train_loss: 0.9170, test_loss: 1.1470, test_f1: 0.5897
 epoch: 37, train_loss: 0.9195, test_loss: 1.1698, test_f1: 0.5309
 epoch: 38, train_loss: 0.9039, test_loss: 1.1573, test_f1: 0.5981
 epoch: 39, train_loss: 0.8985, test_loss: 1.1492, test_f1: 0.5951
 epoch: 40, train_loss: 0.8956, test_loss: 1.1554, test_f1: 0.5775
 epoch: 41, train_loss: 0.9000, test_loss: 1.1735, test_f1: 0.5857
 epoch: 42, train_loss: 0.9094, test_loss: 1.1627, test_f1: 0.5666
 epoch: 43, train_loss: 0.8957, test_loss: 1.1748, test_f1: 0.5792
 epoch: 44, train_loss: 0.8868, test_loss: 1.2002, test_f1: 0.5729
 epoch: 45, train_loss: 0.8880, test_loss: 1.1745, test_f1: 0.5928
 epoch: 46, train_loss: 0.8763, test_loss: 1.1904, test_f1: 0.5599
 epoch: 47, train_loss: 0.8695, test_loss: 1.1880, test_f1: 0.5921
 epoch: 48, train_loss: 0.8757, test_loss: 1.2200, test_f1: 0.5670
 epoch: 49, train_loss: 0.8632, test_loss: 1.1940, test_f1: 0.5722
 epoch: 50, train_loss: 0.8562, test_loss: 1.1898, test_f1: 0.5927
 epoch: 51, train_loss: 0.8499, test_loss: 1.1988, test_f1: 0.5720
 epoch: 52, train_loss: 0.8560, test_loss: 1.1949, test_f1: 0.5908
 epoch: 53, train_loss: 0.8462, test_loss: 1.1792, test_f1: 0.5844
 epoch: 54, train_loss: 0.8589, test_loss: 1.2021, test_f1: 0.5717
 epoch: 55, train_loss: 0.8439, test_loss: 1.1903, test_f1: 0.5803
 epoch: 56, train_loss: 0.8429, test_loss: 1.1864, test_f1: 0.5589
 epoch: 57, train_loss: 0.8317, test_loss: 1.1781, test_f1: 0.5897
 epoch: 58, train_loss: 0.8418, test_loss: 1.1808, test_f1: 0.5608
 epoch: 59, train_loss: 0.8490, test_loss: 1.1804, test_f1: 0.5749
 epoch: 60, train_loss: 0.8411, test_loss: 1.2013, test_f1: 0.5716
 epoch: 61, train_loss: 0.8429, test_loss: 1.1961, test_f1: 0.5564
 epoch: 62, train_loss: 0.8389, test_loss: 1.1969, test_f1: 0.5724
 epoch: 63, train_loss: 0.8429, test_loss: 1.1898, test_f1: 0.5740
 epoch: 64, train_loss: 0.8268, test_loss: 1.1893, test_f1: 0.5659
 epoch: 65, train_loss: 0.8340, test_loss: 1.1942, test_f1: 0.5742
 epoch: 66, train_loss: 0.8232, test_loss: 1.1822, test_f1: 0.5935
 epoch: 67, train_loss: 0.8366, test_loss: 1.1926, test_f1: 0.5854
 epoch: 68, train_loss: 0.8282, test_loss: 1.2189, test_f1: 0.5774
 epoch: 69, train_loss: 0.8102, test_loss: 1.2168, test_f1: 0.5767
 epoch: 70, train_loss: 0.8075, test_loss: 1.2014, test_f1: 0.5830
 epoch: 71, train_loss: 0.8200, test_loss: 1.2263, test_f1: 0.5620
 epoch: 72, train_loss: 0.8149, test_loss: 1.2251, test_f1: 0.5559
 epoch: 73, train_loss: 0.8192, test_loss: 1.2023, test_f1: 0.5777
 epoch: 74, train_loss: 0.8184, test_loss: 1.2187, test_f1: 0.5831
 epoch: 75, train_loss: 0.8197, test_loss: 1.2158, test_f1: 0.5648
 epoch: 76, train_loss: 0.8067, test_loss: 1.2196, test_f1: 0.5724
 epoch: 77, train_loss: 0.8114, test_loss: 1.2069, test_f1: 0.5561
 epoch: 78, train_loss: 0.8076, test_loss: 1.2095, test_f1: 0.5788
 epoch: 79, train_loss: 0.8094, test_loss: 1.2150, test_f1: 0.5724
 epoch: 80, train_loss: 0.7906, test_loss: 1.2246, test_f1: 0.5858
 epoch: 81, train_loss: 0.8046, test_loss: 1.2151, test_f1: 0.5726
 epoch: 82, train_loss: 0.7924, test_loss: 1.1963, test_f1: 0.5963
 epoch: 83, train_loss: 0.8028, test_loss: 1.2104, test_f1: 0.5826
 epoch: 84, train_loss: 0.8009, test_loss: 1.1991, test_f1: 0.5798
 epoch: 85, train_loss: 0.7863, test_loss: 1.2180, test_f1: 0.5909
 epoch: 86, train_loss: 0.7787, test_loss: 1.2135, test_f1: 0.5778
 epoch: 87, train_loss: 0.7844, test_loss: 1.2197, test_f1: 0.6025
 epoch: 88, train_loss: 0.7973, test_loss: 1.2085, test_f1: 0.5773
 epoch: 89, train_loss: 0.7759, test_loss: 1.2169, test_f1: 0.5807
 epoch: 90, train_loss: 0.7903, test_loss: 1.2197, test_f1: 0.5696
 epoch: 91, train_loss: 0.7962, test_loss: 1.2058, test_f1: 0.5857
 epoch: 92, train_loss: 0.7818, test_loss: 1.2269, test_f1: 0.5675
 epoch: 93, train_loss: 0.7783, test_loss: 1.2371, test_f1: 0.5732
 epoch: 94, train_loss: 0.7862, test_loss: 1.2214, test_f1: 0.5837
 epoch: 95, train_loss: 0.7767, test_loss: 1.2344, test_f1: 0.5732
 epoch: 96, train_loss: 0.7724, test_loss: 1.2331, test_f1: 0.5858
 epoch: 97, train_loss: 0.7814, test_loss: 1.2242, test_f1: 0.5641
 epoch: 98, train_loss: 0.7810, test_loss: 1.2455, test_f1: 0.5912
 epoch: 99, train_loss: 0.7795, test_loss: 1.2483, test_f1: 0.5752
##################ITERATION #5 ****************************************
 epoch: 0, train_loss: 1.3139, test_loss: 1.3480, test_f1: 0.2437
 epoch: 1, train_loss: 1.2446, test_loss: 1.3260, test_f1: 0.2896
 epoch: 2, train_loss: 1.2203, test_loss: 1.2832, test_f1: 0.3781
 epoch: 3, train_loss: 1.1869, test_loss: 1.2684, test_f1: 0.4034
 epoch: 4, train_loss: 1.1835, test_loss: 1.2474, test_f1: 0.4304
 epoch: 5, train_loss: 1.1517, test_loss: 1.2297, test_f1: 0.4324
 epoch: 6, train_loss: 1.1416, test_loss: 1.2184, test_f1: 0.4353
 epoch: 7, train_loss: 1.1267, test_loss: 1.2083, test_f1: 0.4533
 epoch: 8, train_loss: 1.1108, test_loss: 1.1924, test_f1: 0.4199
 epoch: 9, train_loss: 1.1084, test_loss: 1.1849, test_f1: 0.4266
 epoch: 10, train_loss: 1.0800, test_loss: 1.1741, test_f1: 0.4205
 epoch: 11, train_loss: 1.0671, test_loss: 1.1702, test_f1: 0.4737
 epoch: 12, train_loss: 1.0573, test_loss: 1.1648, test_f1: 0.4618
 epoch: 13, train_loss: 1.0488, test_loss: 1.1734, test_f1: 0.4813
 epoch: 14, train_loss: 1.0352, test_loss: 1.1639, test_f1: 0.4969
 epoch: 15, train_loss: 1.0375, test_loss: 1.1665, test_f1: 0.4582
 epoch: 16, train_loss: 1.0227, test_loss: 1.1645, test_f1: 0.5104
 epoch: 17, train_loss: 1.0140, test_loss: 1.1688, test_f1: 0.4752
 epoch: 18, train_loss: 1.0059, test_loss: 1.1533, test_f1: 0.4880
 epoch: 19, train_loss: 1.0128, test_loss: 1.1530, test_f1: 0.5250
 epoch: 20, train_loss: 0.9978, test_loss: 1.1483, test_f1: 0.5435
 epoch: 21, train_loss: 0.9885, test_loss: 1.1622, test_f1: 0.5083
 epoch: 22, train_loss: 0.9860, test_loss: 1.1557, test_f1: 0.5380
 epoch: 23, train_loss: 0.9733, test_loss: 1.1778, test_f1: 0.4940
 epoch: 24, train_loss: 0.9531, test_loss: 1.1552, test_f1: 0.5281
 epoch: 25, train_loss: 0.9752, test_loss: 1.1493, test_f1: 0.5408
 epoch: 26, train_loss: 0.9591, test_loss: 1.1562, test_f1: 0.4931
 epoch: 27, train_loss: 0.9810, test_loss: 1.1444, test_f1: 0.5123
 epoch: 28, train_loss: 0.9579, test_loss: 1.1476, test_f1: 0.5122
 epoch: 29, train_loss: 0.9406, test_loss: 1.1542, test_f1: 0.5094
 epoch: 30, train_loss: 0.9350, test_loss: 1.1500, test_f1: 0.5200
 epoch: 31, train_loss: 0.9360, test_loss: 1.1625, test_f1: 0.5003
 epoch: 32, train_loss: 0.9236, test_loss: 1.1747, test_f1: 0.5014
 epoch: 33, train_loss: 0.9264, test_loss: 1.1425, test_f1: 0.5203
 epoch: 34, train_loss: 0.9235, test_loss: 1.1356, test_f1: 0.5293
 epoch: 35, train_loss: 0.9234, test_loss: 1.1401, test_f1: 0.5257
 epoch: 36, train_loss: 0.9169, test_loss: 1.1614, test_f1: 0.5256
 epoch: 37, train_loss: 0.9030, test_loss: 1.1268, test_f1: 0.5630
 epoch: 38, train_loss: 0.9021, test_loss: 1.1528, test_f1: 0.5064
 epoch: 39, train_loss: 0.9039, test_loss: 1.1189, test_f1: 0.5384
 epoch: 40, train_loss: 0.9062, test_loss: 1.1541, test_f1: 0.5263
 epoch: 41, train_loss: 0.8833, test_loss: 1.1422, test_f1: 0.5009
 epoch: 42, train_loss: 0.8801, test_loss: 1.1442, test_f1: 0.5098
 epoch: 43, train_loss: 0.8898, test_loss: 1.1311, test_f1: 0.4955
 epoch: 44, train_loss: 0.8746, test_loss: 1.1256, test_f1: 0.5187
 epoch: 45, train_loss: 0.8794, test_loss: 1.1288, test_f1: 0.5154
 epoch: 46, train_loss: 0.8760, test_loss: 1.1316, test_f1: 0.5468
 epoch: 47, train_loss: 0.8584, test_loss: 1.1451, test_f1: 0.5191
 epoch: 48, train_loss: 0.8585, test_loss: 1.1167, test_f1: 0.5520
 epoch: 49, train_loss: 0.8556, test_loss: 1.1557, test_f1: 0.5246
 epoch: 50, train_loss: 0.8541, test_loss: 1.1260, test_f1: 0.5398
 epoch: 51, train_loss: 0.8535, test_loss: 1.1185, test_f1: 0.5555
 epoch: 52, train_loss: 0.8480, test_loss: 1.1218, test_f1: 0.5320
 epoch: 53, train_loss: 0.8448, test_loss: 1.1199, test_f1: 0.5372
 epoch: 54, train_loss: 0.8368, test_loss: 1.1267, test_f1: 0.5438
 epoch: 55, train_loss: 0.8476, test_loss: 1.1291, test_f1: 0.5418
 epoch: 56, train_loss: 0.8222, test_loss: 1.1508, test_f1: 0.5331
 epoch: 57, train_loss: 0.8409, test_loss: 1.1218, test_f1: 0.5465
 epoch: 58, train_loss: 0.8245, test_loss: 1.1144, test_f1: 0.5576
 epoch: 59, train_loss: 0.8426, test_loss: 1.1141, test_f1: 0.5500
 epoch: 60, train_loss: 0.8329, test_loss: 1.1404, test_f1: 0.5438
 epoch: 61, train_loss: 0.8249, test_loss: 1.1243, test_f1: 0.5423
 epoch: 62, train_loss: 0.8146, test_loss: 1.1301, test_f1: 0.5319
 epoch: 63, train_loss: 0.8274, test_loss: 1.1522, test_f1: 0.5366
 epoch: 64, train_loss: 0.8133, test_loss: 1.1574, test_f1: 0.5234
 epoch: 65, train_loss: 0.8181, test_loss: 1.1394, test_f1: 0.5369
 epoch: 66, train_loss: 0.8323, test_loss: 1.1504, test_f1: 0.5425
 epoch: 67, train_loss: 0.8208, test_loss: 1.1312, test_f1: 0.5567
 epoch: 68, train_loss: 0.8104, test_loss: 1.1280, test_f1: 0.5426
 epoch: 69, train_loss: 0.8046, test_loss: 1.1465, test_f1: 0.5392
 epoch: 70, train_loss: 0.8045, test_loss: 1.1290, test_f1: 0.5401
 epoch: 71, train_loss: 0.8167, test_loss: 1.1436, test_f1: 0.5453
 epoch: 72, train_loss: 0.8207, test_loss: 1.1383, test_f1: 0.5526
 epoch: 73, train_loss: 0.8064, test_loss: 1.1317, test_f1: 0.5372
 epoch: 74, train_loss: 0.8114, test_loss: 1.1542, test_f1: 0.5398
 epoch: 75, train_loss: 0.7972, test_loss: 1.1240, test_f1: 0.5668
 epoch: 76, train_loss: 0.7974, test_loss: 1.1186, test_f1: 0.5534
 epoch: 77, train_loss: 0.7831, test_loss: 1.1483, test_f1: 0.5556
 epoch: 78, train_loss: 0.7958, test_loss: 1.1420, test_f1: 0.5419
 epoch: 79, train_loss: 0.8022, test_loss: 1.1526, test_f1: 0.5318
 epoch: 80, train_loss: 0.7883, test_loss: 1.1428, test_f1: 0.5611
 epoch: 81, train_loss: 0.7872, test_loss: 1.1727, test_f1: 0.5497
 epoch: 82, train_loss: 0.7893, test_loss: 1.1581, test_f1: 0.5387
 epoch: 83, train_loss: 0.7850, test_loss: 1.1533, test_f1: 0.5440
 epoch: 84, train_loss: 0.7925, test_loss: 1.1471, test_f1: 0.5481
 epoch: 85, train_loss: 0.7902, test_loss: 1.1903, test_f1: 0.5316
 epoch: 86, train_loss: 0.7841, test_loss: 1.1363, test_f1: 0.5591
 epoch: 87, train_loss: 0.7763, test_loss: 1.1999, test_f1: 0.5447
 epoch: 88, train_loss: 0.7752, test_loss: 1.1884, test_f1: 0.5395
 epoch: 89, train_loss: 0.7740, test_loss: 1.2178, test_f1: 0.5311
 epoch: 90, train_loss: 0.7621, test_loss: 1.1538, test_f1: 0.5584
 epoch: 91, train_loss: 0.7651, test_loss: 1.1842, test_f1: 0.5484
 epoch: 92, train_loss: 0.7760, test_loss: 1.2311, test_f1: 0.5486
 epoch: 93, train_loss: 0.7710, test_loss: 1.1455, test_f1: 0.5618
 epoch: 94, train_loss: 0.7781, test_loss: 1.2007, test_f1: 0.5553
 epoch: 95, train_loss: 0.7690, test_loss: 1.1610, test_f1: 0.5451
 epoch: 96, train_loss: 0.7746, test_loss: 1.1217, test_f1: 0.5725
 epoch: 97, train_loss: 0.7686, test_loss: 1.1571, test_f1: 0.5611
 epoch: 98, train_loss: 0.7792, test_loss: 1.1612, test_f1: 0.5540
 epoch: 99, train_loss: 0.7727, test_loss: 1.1825, test_f1: 0.5479
##################ITERATION #6 ****************************************
 epoch: 0, train_loss: 1.2952, test_loss: 1.3347, test_f1: 0.2556
 epoch: 1, train_loss: 1.2362, test_loss: 1.3019, test_f1: 0.2925
 epoch: 2, train_loss: 1.2015, test_loss: 1.2896, test_f1: 0.3440
 epoch: 3, train_loss: 1.1890, test_loss: 1.2728, test_f1: 0.3601
 epoch: 4, train_loss: 1.1741, test_loss: 1.2596, test_f1: 0.3835
 epoch: 5, train_loss: 1.1626, test_loss: 1.2480, test_f1: 0.3986
 epoch: 6, train_loss: 1.1465, test_loss: 1.2384, test_f1: 0.4071
 epoch: 7, train_loss: 1.1444, test_loss: 1.2177, test_f1: 0.4061
 epoch: 8, train_loss: 1.1169, test_loss: 1.2064, test_f1: 0.4226
 epoch: 9, train_loss: 1.1179, test_loss: 1.2007, test_f1: 0.4491
 epoch: 10, train_loss: 1.1025, test_loss: 1.1905, test_f1: 0.4627
 epoch: 11, train_loss: 1.0951, test_loss: 1.1874, test_f1: 0.4769
 epoch: 12, train_loss: 1.0639, test_loss: 1.1819, test_f1: 0.4966
 epoch: 13, train_loss: 1.0774, test_loss: 1.1622, test_f1: 0.4951
 epoch: 14, train_loss: 1.0525, test_loss: 1.1616, test_f1: 0.4962
 epoch: 15, train_loss: 1.0448, test_loss: 1.1507, test_f1: 0.5130
 epoch: 16, train_loss: 1.0329, test_loss: 1.1465, test_f1: 0.5167
 epoch: 17, train_loss: 1.0355, test_loss: 1.1451, test_f1: 0.5125
 epoch: 18, train_loss: 1.0231, test_loss: 1.1340, test_f1: 0.5114
 epoch: 19, train_loss: 1.0209, test_loss: 1.1315, test_f1: 0.5050
 epoch: 20, train_loss: 1.0107, test_loss: 1.1354, test_f1: 0.4979
 epoch: 21, train_loss: 0.9885, test_loss: 1.1336, test_f1: 0.5077
 epoch: 22, train_loss: 0.9937, test_loss: 1.1288, test_f1: 0.5079
 epoch: 23, train_loss: 0.9992, test_loss: 1.1306, test_f1: 0.4927
 epoch: 24, train_loss: 0.9828, test_loss: 1.1290, test_f1: 0.4856
 epoch: 25, train_loss: 0.9784, test_loss: 1.1227, test_f1: 0.4928
 epoch: 26, train_loss: 0.9643, test_loss: 1.1175, test_f1: 0.5272
 epoch: 27, train_loss: 0.9558, test_loss: 1.1102, test_f1: 0.5198
 epoch: 28, train_loss: 0.9476, test_loss: 1.1189, test_f1: 0.5124
 epoch: 29, train_loss: 0.9434, test_loss: 1.1226, test_f1: 0.4829
 epoch: 30, train_loss: 0.9417, test_loss: 1.1295, test_f1: 0.5076
 epoch: 31, train_loss: 0.9341, test_loss: 1.1045, test_f1: 0.5033
 epoch: 32, train_loss: 0.9307, test_loss: 1.1179, test_f1: 0.4939
 epoch: 33, train_loss: 0.9396, test_loss: 1.1238, test_f1: 0.5094
 epoch: 34, train_loss: 0.9375, test_loss: 1.1325, test_f1: 0.5234
 epoch: 35, train_loss: 0.9293, test_loss: 1.1233, test_f1: 0.5254
 epoch: 36, train_loss: 0.9271, test_loss: 1.1388, test_f1: 0.5336
 epoch: 37, train_loss: 0.9065, test_loss: 1.1506, test_f1: 0.5031
 epoch: 38, train_loss: 0.9172, test_loss: 1.1402, test_f1: 0.5066
 epoch: 39, train_loss: 0.9089, test_loss: 1.1630, test_f1: 0.5009
 epoch: 40, train_loss: 0.8977, test_loss: 1.1549, test_f1: 0.5253
 epoch: 41, train_loss: 0.8883, test_loss: 1.1444, test_f1: 0.5258
 epoch: 42, train_loss: 0.9036, test_loss: 1.1416, test_f1: 0.5214
 epoch: 43, train_loss: 0.8870, test_loss: 1.1465, test_f1: 0.5421
 epoch: 44, train_loss: 0.8834, test_loss: 1.1545, test_f1: 0.5422
 epoch: 45, train_loss: 0.8810, test_loss: 1.1523, test_f1: 0.5237
 epoch: 46, train_loss: 0.8745, test_loss: 1.1407, test_f1: 0.5395
 epoch: 47, train_loss: 0.8783, test_loss: 1.1613, test_f1: 0.5422
 epoch: 48, train_loss: 0.8665, test_loss: 1.1583, test_f1: 0.5650
 epoch: 49, train_loss: 0.8661, test_loss: 1.1618, test_f1: 0.5335
 epoch: 50, train_loss: 0.8728, test_loss: 1.1696, test_f1: 0.5446
 epoch: 51, train_loss: 0.8509, test_loss: 1.1719, test_f1: 0.5423
 epoch: 52, train_loss: 0.8443, test_loss: 1.1690, test_f1: 0.5543
 epoch: 53, train_loss: 0.8367, test_loss: 1.1708, test_f1: 0.5532
 epoch: 54, train_loss: 0.8636, test_loss: 1.1624, test_f1: 0.5499
 epoch: 55, train_loss: 0.8418, test_loss: 1.1545, test_f1: 0.5398
 epoch: 56, train_loss: 0.8336, test_loss: 1.1580, test_f1: 0.5404
 epoch: 57, train_loss: 0.8466, test_loss: 1.1649, test_f1: 0.5575
 epoch: 58, train_loss: 0.8364, test_loss: 1.1886, test_f1: 0.5253
 epoch: 59, train_loss: 0.8387, test_loss: 1.1536, test_f1: 0.5496
 epoch: 60, train_loss: 0.8339, test_loss: 1.1829, test_f1: 0.5380
 epoch: 61, train_loss: 0.8399, test_loss: 1.1725, test_f1: 0.5695
 epoch: 62, train_loss: 0.8470, test_loss: 1.2152, test_f1: 0.5410
 epoch: 63, train_loss: 0.8302, test_loss: 1.1804, test_f1: 0.5522
 epoch: 64, train_loss: 0.8385, test_loss: 1.2005, test_f1: 0.5491
 epoch: 65, train_loss: 0.8223, test_loss: 1.1840, test_f1: 0.5563
 epoch: 66, train_loss: 0.8323, test_loss: 1.2287, test_f1: 0.5345
 epoch: 67, train_loss: 0.8404, test_loss: 1.2120, test_f1: 0.5500
 epoch: 68, train_loss: 0.8170, test_loss: 1.1896, test_f1: 0.5498
 epoch: 69, train_loss: 0.8238, test_loss: 1.1830, test_f1: 0.5548
 epoch: 70, train_loss: 0.8283, test_loss: 1.1727, test_f1: 0.5594
 epoch: 71, train_loss: 0.8242, test_loss: 1.1665, test_f1: 0.5517
 epoch: 72, train_loss: 0.8285, test_loss: 1.1941, test_f1: 0.5340
 epoch: 73, train_loss: 0.8162, test_loss: 1.2113, test_f1: 0.5318
 epoch: 74, train_loss: 0.8115, test_loss: 1.2055, test_f1: 0.5567
 epoch: 75, train_loss: 0.8313, test_loss: 1.1695, test_f1: 0.5616
 epoch: 76, train_loss: 0.8127, test_loss: 1.2216, test_f1: 0.5344
 epoch: 77, train_loss: 0.8148, test_loss: 1.1579, test_f1: 0.5522
 epoch: 78, train_loss: 0.8264, test_loss: 1.1879, test_f1: 0.5463
 epoch: 79, train_loss: 0.8096, test_loss: 1.2055, test_f1: 0.5613
 epoch: 80, train_loss: 0.8106, test_loss: 1.2073, test_f1: 0.5585
 epoch: 81, train_loss: 0.8085, test_loss: 1.2077, test_f1: 0.5387
 epoch: 82, train_loss: 0.8017, test_loss: 1.2311, test_f1: 0.5255
 epoch: 83, train_loss: 0.8024, test_loss: 1.1715, test_f1: 0.5519
 epoch: 84, train_loss: 0.8034, test_loss: 1.1830, test_f1: 0.5678
 epoch: 85, train_loss: 0.7998, test_loss: 1.2221, test_f1: 0.5331
 epoch: 86, train_loss: 0.7841, test_loss: 1.1763, test_f1: 0.5769
 epoch: 87, train_loss: 0.8053, test_loss: 1.1854, test_f1: 0.5608
 epoch: 88, train_loss: 0.7919, test_loss: 1.1948, test_f1: 0.5440
 epoch: 89, train_loss: 0.7951, test_loss: 1.2182, test_f1: 0.5510
 epoch: 90, train_loss: 0.7893, test_loss: 1.2203, test_f1: 0.5486
 epoch: 91, train_loss: 0.7986, test_loss: 1.2647, test_f1: 0.5345
 epoch: 92, train_loss: 0.7954, test_loss: 1.2354, test_f1: 0.5546
 epoch: 93, train_loss: 0.7833, test_loss: 1.2305, test_f1: 0.5540
 epoch: 94, train_loss: 0.7783, test_loss: 1.2375, test_f1: 0.5674
 epoch: 95, train_loss: 0.7836, test_loss: 1.2318, test_f1: 0.5567
 epoch: 96, train_loss: 0.7714, test_loss: 1.2273, test_f1: 0.5525
 epoch: 97, train_loss: 0.7811, test_loss: 1.1992, test_f1: 0.5345
 epoch: 98, train_loss: 0.7809, test_loss: 1.2243, test_f1: 0.5566
 epoch: 99, train_loss: 0.7820, test_loss: 1.2087, test_f1: 0.5601
##################ITERATION #7 ****************************************
 epoch: 0, train_loss: 1.3038, test_loss: 1.3698, test_f1: 0.2868
 epoch: 1, train_loss: 1.2417, test_loss: 1.3152, test_f1: 0.3264
 epoch: 2, train_loss: 1.1998, test_loss: 1.2881, test_f1: 0.3525
 epoch: 3, train_loss: 1.1976, test_loss: 1.2635, test_f1: 0.3806
 epoch: 4, train_loss: 1.1782, test_loss: 1.2403, test_f1: 0.3804
 epoch: 5, train_loss: 1.1632, test_loss: 1.2341, test_f1: 0.3778
 epoch: 6, train_loss: 1.1472, test_loss: 1.2171, test_f1: 0.4008
 epoch: 7, train_loss: 1.1266, test_loss: 1.2131, test_f1: 0.3935
 epoch: 8, train_loss: 1.1345, test_loss: 1.1980, test_f1: 0.3999
 epoch: 9, train_loss: 1.1227, test_loss: 1.1941, test_f1: 0.4025
 epoch: 10, train_loss: 1.1088, test_loss: 1.1931, test_f1: 0.4285
 epoch: 11, train_loss: 1.0936, test_loss: 1.1785, test_f1: 0.4251
 epoch: 12, train_loss: 1.0864, test_loss: 1.1685, test_f1: 0.4209
 epoch: 13, train_loss: 1.0854, test_loss: 1.1638, test_f1: 0.4341
 epoch: 14, train_loss: 1.0625, test_loss: 1.1581, test_f1: 0.4351
 epoch: 15, train_loss: 1.0635, test_loss: 1.1526, test_f1: 0.4535
 epoch: 16, train_loss: 1.0534, test_loss: 1.1549, test_f1: 0.4615
 epoch: 17, train_loss: 1.0485, test_loss: 1.1446, test_f1: 0.4817
 epoch: 18, train_loss: 1.0407, test_loss: 1.1429, test_f1: 0.4718
 epoch: 19, train_loss: 1.0095, test_loss: 1.1423, test_f1: 0.4801
 epoch: 20, train_loss: 1.0084, test_loss: 1.1460, test_f1: 0.4937
 epoch: 21, train_loss: 1.0003, test_loss: 1.1324, test_f1: 0.4865
 epoch: 22, train_loss: 1.0220, test_loss: 1.1321, test_f1: 0.4836
 epoch: 23, train_loss: 0.9937, test_loss: 1.1360, test_f1: 0.4941
 epoch: 24, train_loss: 1.0048, test_loss: 1.1321, test_f1: 0.4969
 epoch: 25, train_loss: 0.9928, test_loss: 1.1101, test_f1: 0.4891
 epoch: 26, train_loss: 0.9633, test_loss: 1.1271, test_f1: 0.5029
 epoch: 27, train_loss: 0.9727, test_loss: 1.1158, test_f1: 0.5003
 epoch: 28, train_loss: 0.9632, test_loss: 1.1250, test_f1: 0.5026
 epoch: 29, train_loss: 0.9608, test_loss: 1.1188, test_f1: 0.5110
 epoch: 30, train_loss: 0.9460, test_loss: 1.1121, test_f1: 0.5169
 epoch: 31, train_loss: 0.9604, test_loss: 1.1160, test_f1: 0.5133
 epoch: 32, train_loss: 0.9488, test_loss: 1.1088, test_f1: 0.4963
 epoch: 33, train_loss: 0.9239, test_loss: 1.1195, test_f1: 0.4859
 epoch: 34, train_loss: 0.9262, test_loss: 1.1273, test_f1: 0.4901
 epoch: 35, train_loss: 0.9040, test_loss: 1.1172, test_f1: 0.5104
 epoch: 36, train_loss: 0.9350, test_loss: 1.1145, test_f1: 0.4881
 epoch: 37, train_loss: 0.9193, test_loss: 1.1226, test_f1: 0.5120
 epoch: 38, train_loss: 0.9231, test_loss: 1.1083, test_f1: 0.5073
 epoch: 39, train_loss: 0.8988, test_loss: 1.1229, test_f1: 0.4842
 epoch: 40, train_loss: 0.9190, test_loss: 1.1000, test_f1: 0.5343
 epoch: 41, train_loss: 0.9054, test_loss: 1.1320, test_f1: 0.5144
 epoch: 42, train_loss: 0.8926, test_loss: 1.1033, test_f1: 0.5281
 epoch: 43, train_loss: 0.8835, test_loss: 1.1192, test_f1: 0.5150
 epoch: 44, train_loss: 0.8928, test_loss: 1.1122, test_f1: 0.5331
 epoch: 45, train_loss: 0.8784, test_loss: 1.1289, test_f1: 0.5347
 epoch: 46, train_loss: 0.8843, test_loss: 1.1069, test_f1: 0.5377
 epoch: 47, train_loss: 0.8725, test_loss: 1.1150, test_f1: 0.5385
 epoch: 48, train_loss: 0.8676, test_loss: 1.1113, test_f1: 0.5337
 epoch: 49, train_loss: 0.8611, test_loss: 1.1108, test_f1: 0.5319
 epoch: 50, train_loss: 0.8751, test_loss: 1.1440, test_f1: 0.5352
 epoch: 51, train_loss: 0.8611, test_loss: 1.1140, test_f1: 0.5324
 epoch: 52, train_loss: 0.8573, test_loss: 1.1217, test_f1: 0.5299
 epoch: 53, train_loss: 0.8521, test_loss: 1.1165, test_f1: 0.5286
 epoch: 54, train_loss: 0.8550, test_loss: 1.1251, test_f1: 0.5271
 epoch: 55, train_loss: 0.8476, test_loss: 1.1143, test_f1: 0.5450
 epoch: 56, train_loss: 0.8601, test_loss: 1.1313, test_f1: 0.5177
 epoch: 57, train_loss: 0.8505, test_loss: 1.1220, test_f1: 0.5517
 epoch: 58, train_loss: 0.8552, test_loss: 1.1226, test_f1: 0.5541
 epoch: 59, train_loss: 0.8451, test_loss: 1.1182, test_f1: 0.5460
 epoch: 60, train_loss: 0.8500, test_loss: 1.1347, test_f1: 0.5503
 epoch: 61, train_loss: 0.8360, test_loss: 1.1479, test_f1: 0.5371
 epoch: 62, train_loss: 0.8397, test_loss: 1.1304, test_f1: 0.5566
 epoch: 63, train_loss: 0.8431, test_loss: 1.1213, test_f1: 0.5512
 epoch: 64, train_loss: 0.8474, test_loss: 1.1192, test_f1: 0.5614
 epoch: 65, train_loss: 0.8467, test_loss: 1.1275, test_f1: 0.5646
 epoch: 66, train_loss: 0.8374, test_loss: 1.1317, test_f1: 0.5589
 epoch: 67, train_loss: 0.8271, test_loss: 1.1291, test_f1: 0.5555
 epoch: 68, train_loss: 0.8224, test_loss: 1.1300, test_f1: 0.5640
 epoch: 69, train_loss: 0.8289, test_loss: 1.1462, test_f1: 0.5729
 epoch: 70, train_loss: 0.8256, test_loss: 1.1418, test_f1: 0.5784
 epoch: 71, train_loss: 0.8222, test_loss: 1.1380, test_f1: 0.5759
 epoch: 72, train_loss: 0.8378, test_loss: 1.1408, test_f1: 0.5911
 epoch: 73, train_loss: 0.8172, test_loss: 1.1234, test_f1: 0.5838
 epoch: 74, train_loss: 0.8193, test_loss: 1.1412, test_f1: 0.5855
 epoch: 75, train_loss: 0.8250, test_loss: 1.1406, test_f1: 0.5783
 epoch: 76, train_loss: 0.8229, test_loss: 1.1324, test_f1: 0.5914
 epoch: 77, train_loss: 0.8156, test_loss: 1.1304, test_f1: 0.5919
 epoch: 78, train_loss: 0.8243, test_loss: 1.1296, test_f1: 0.5637
 epoch: 79, train_loss: 0.8198, test_loss: 1.1439, test_f1: 0.5865
 epoch: 80, train_loss: 0.8103, test_loss: 1.1407, test_f1: 0.5837
 epoch: 81, train_loss: 0.8138, test_loss: 1.1503, test_f1: 0.5715
 epoch: 82, train_loss: 0.8064, test_loss: 1.1462, test_f1: 0.5908
 epoch: 83, train_loss: 0.8162, test_loss: 1.1462, test_f1: 0.5888
 epoch: 84, train_loss: 0.8153, test_loss: 1.1217, test_f1: 0.6155
 epoch: 85, train_loss: 0.8161, test_loss: 1.1451, test_f1: 0.5862
 epoch: 86, train_loss: 0.7984, test_loss: 1.1387, test_f1: 0.6046
 epoch: 87, train_loss: 0.8116, test_loss: 1.1531, test_f1: 0.5754
 epoch: 88, train_loss: 0.7885, test_loss: 1.1541, test_f1: 0.5831
 epoch: 89, train_loss: 0.8016, test_loss: 1.1629, test_f1: 0.5913
 epoch: 90, train_loss: 0.7800, test_loss: 1.1508, test_f1: 0.5809
 epoch: 91, train_loss: 0.7960, test_loss: 1.1462, test_f1: 0.5943
 epoch: 92, train_loss: 0.7906, test_loss: 1.1569, test_f1: 0.6020
 epoch: 93, train_loss: 0.7904, test_loss: 1.1563, test_f1: 0.5961
 epoch: 94, train_loss: 0.7891, test_loss: 1.1575, test_f1: 0.5816
 epoch: 95, train_loss: 0.7998, test_loss: 1.1479, test_f1: 0.6072
 epoch: 96, train_loss: 0.7962, test_loss: 1.1523, test_f1: 0.5994
 epoch: 97, train_loss: 0.7786, test_loss: 1.1636, test_f1: 0.5987
 epoch: 98, train_loss: 0.7671, test_loss: 1.1582, test_f1: 0.5917
 epoch: 99, train_loss: 0.8012, test_loss: 1.1744, test_f1: 0.5784
##################ITERATION #8 ****************************************
 epoch: 0, train_loss: 1.3070, test_loss: 1.3303, test_f1: 0.2648
 epoch: 1, train_loss: 1.2531, test_loss: 1.2925, test_f1: 0.2852
 epoch: 2, train_loss: 1.2288, test_loss: 1.2800, test_f1: 0.3373
 epoch: 3, train_loss: 1.2106, test_loss: 1.2617, test_f1: 0.3326
 epoch: 4, train_loss: 1.1816, test_loss: 1.2586, test_f1: 0.3700
 epoch: 5, train_loss: 1.1847, test_loss: 1.2506, test_f1: 0.3795
 epoch: 6, train_loss: 1.1725, test_loss: 1.2636, test_f1: 0.3853
 epoch: 7, train_loss: 1.1528, test_loss: 1.2430, test_f1: 0.3975
 epoch: 8, train_loss: 1.1411, test_loss: 1.2320, test_f1: 0.4076
 epoch: 9, train_loss: 1.1345, test_loss: 1.2255, test_f1: 0.4413
 epoch: 10, train_loss: 1.1251, test_loss: 1.2386, test_f1: 0.4593
 epoch: 11, train_loss: 1.1156, test_loss: 1.2007, test_f1: 0.4575
 epoch: 12, train_loss: 1.0965, test_loss: 1.2018, test_f1: 0.4748
 epoch: 13, train_loss: 1.0833, test_loss: 1.1953, test_f1: 0.4993
 epoch: 14, train_loss: 1.0753, test_loss: 1.1924, test_f1: 0.4899
 epoch: 15, train_loss: 1.0662, test_loss: 1.1925, test_f1: 0.4960
 epoch: 16, train_loss: 1.0566, test_loss: 1.1874, test_f1: 0.4837
 epoch: 17, train_loss: 1.0523, test_loss: 1.1879, test_f1: 0.4811
 epoch: 18, train_loss: 1.0453, test_loss: 1.2060, test_f1: 0.4790
 epoch: 19, train_loss: 1.0263, test_loss: 1.2214, test_f1: 0.4858
 epoch: 20, train_loss: 1.0211, test_loss: 1.2209, test_f1: 0.5022
 epoch: 21, train_loss: 1.0128, test_loss: 1.1935, test_f1: 0.4762
 epoch: 22, train_loss: 1.0086, test_loss: 1.1972, test_f1: 0.4957
 epoch: 23, train_loss: 0.9995, test_loss: 1.1942, test_f1: 0.4902
 epoch: 24, train_loss: 0.9968, test_loss: 1.1902, test_f1: 0.5078
 epoch: 25, train_loss: 0.9821, test_loss: 1.2054, test_f1: 0.5152
 epoch: 26, train_loss: 0.9815, test_loss: 1.2094, test_f1: 0.5152
 epoch: 27, train_loss: 0.9625, test_loss: 1.2218, test_f1: 0.5244
 epoch: 28, train_loss: 0.9589, test_loss: 1.2189, test_f1: 0.5420
 epoch: 29, train_loss: 0.9506, test_loss: 1.2517, test_f1: 0.5337
 epoch: 30, train_loss: 0.9562, test_loss: 1.2431, test_f1: 0.5243
 epoch: 31, train_loss: 0.9519, test_loss: 1.2262, test_f1: 0.5354
 epoch: 32, train_loss: 0.9597, test_loss: 1.2350, test_f1: 0.5446
 epoch: 33, train_loss: 0.9433, test_loss: 1.2515, test_f1: 0.5371
 epoch: 34, train_loss: 0.9189, test_loss: 1.2757, test_f1: 0.5319
 epoch: 35, train_loss: 0.9262, test_loss: 1.2569, test_f1: 0.5219
 epoch: 36, train_loss: 0.9095, test_loss: 1.2449, test_f1: 0.5300
 epoch: 37, train_loss: 0.9082, test_loss: 1.2515, test_f1: 0.5292
 epoch: 38, train_loss: 0.9078, test_loss: 1.2601, test_f1: 0.5267
 epoch: 39, train_loss: 0.8931, test_loss: 1.2852, test_f1: 0.5248
 epoch: 40, train_loss: 0.8895, test_loss: 1.2665, test_f1: 0.5331
 epoch: 41, train_loss: 0.9006, test_loss: 1.2756, test_f1: 0.5381
 epoch: 42, train_loss: 0.8862, test_loss: 1.2770, test_f1: 0.5382
 epoch: 43, train_loss: 0.8946, test_loss: 1.2785, test_f1: 0.5114
 epoch: 44, train_loss: 0.8720, test_loss: 1.2642, test_f1: 0.5095
 epoch: 45, train_loss: 0.8814, test_loss: 1.2745, test_f1: 0.5385
 epoch: 46, train_loss: 0.8761, test_loss: 1.2567, test_f1: 0.5328
 epoch: 47, train_loss: 0.8711, test_loss: 1.2769, test_f1: 0.5223
 epoch: 48, train_loss: 0.8697, test_loss: 1.3021, test_f1: 0.5256
 epoch: 49, train_loss: 0.8652, test_loss: 1.2784, test_f1: 0.5276
 epoch: 50, train_loss: 0.8507, test_loss: 1.2693, test_f1: 0.5459
 epoch: 51, train_loss: 0.8512, test_loss: 1.2917, test_f1: 0.5436
 epoch: 52, train_loss: 0.8451, test_loss: 1.2958, test_f1: 0.5255
 epoch: 53, train_loss: 0.8467, test_loss: 1.2921, test_f1: 0.5565
 epoch: 54, train_loss: 0.8344, test_loss: 1.3258, test_f1: 0.5257
 epoch: 55, train_loss: 0.8324, test_loss: 1.3206, test_f1: 0.5414
 epoch: 56, train_loss: 0.8346, test_loss: 1.3224, test_f1: 0.5309
 epoch: 57, train_loss: 0.8460, test_loss: 1.3247, test_f1: 0.5333
 epoch: 58, train_loss: 0.8395, test_loss: 1.3062, test_f1: 0.5465
 epoch: 59, train_loss: 0.8302, test_loss: 1.3291, test_f1: 0.5359
 epoch: 60, train_loss: 0.8321, test_loss: 1.3261, test_f1: 0.5467
 epoch: 61, train_loss: 0.8268, test_loss: 1.3426, test_f1: 0.5440
 epoch: 62, train_loss: 0.8339, test_loss: 1.3144, test_f1: 0.5388
 epoch: 63, train_loss: 0.8296, test_loss: 1.3251, test_f1: 0.5497
 epoch: 64, train_loss: 0.8391, test_loss: 1.3433, test_f1: 0.5390
 epoch: 65, train_loss: 0.8170, test_loss: 1.3487, test_f1: 0.5311
 epoch: 66, train_loss: 0.8091, test_loss: 1.3463, test_f1: 0.5421
 epoch: 67, train_loss: 0.8207, test_loss: 1.3738, test_f1: 0.5370
 epoch: 68, train_loss: 0.8236, test_loss: 1.3377, test_f1: 0.5530
 epoch: 69, train_loss: 0.8082, test_loss: 1.3447, test_f1: 0.5503
 epoch: 70, train_loss: 0.8159, test_loss: 1.3606, test_f1: 0.5508
 epoch: 71, train_loss: 0.8177, test_loss: 1.3823, test_f1: 0.5474
 epoch: 72, train_loss: 0.8127, test_loss: 1.3797, test_f1: 0.5284
 epoch: 73, train_loss: 0.7994, test_loss: 1.4014, test_f1: 0.5444
 epoch: 74, train_loss: 0.7967, test_loss: 1.3715, test_f1: 0.5472
 epoch: 75, train_loss: 0.7989, test_loss: 1.3731, test_f1: 0.5603
 epoch: 76, train_loss: 0.7947, test_loss: 1.3726, test_f1: 0.5602
 epoch: 77, train_loss: 0.7926, test_loss: 1.4026, test_f1: 0.5393
 epoch: 78, train_loss: 0.8078, test_loss: 1.4166, test_f1: 0.5375
 epoch: 79, train_loss: 0.7953, test_loss: 1.3907, test_f1: 0.5651
 epoch: 80, train_loss: 0.7995, test_loss: 1.3914, test_f1: 0.5519
 epoch: 81, train_loss: 0.7976, test_loss: 1.4216, test_f1: 0.5739
 epoch: 82, train_loss: 0.7946, test_loss: 1.4592, test_f1: 0.5531
 epoch: 83, train_loss: 0.7904, test_loss: 1.4147, test_f1: 0.5708
 epoch: 84, train_loss: 0.8007, test_loss: 1.4321, test_f1: 0.5807
 epoch: 85, train_loss: 0.7839, test_loss: 1.4000, test_f1: 0.5495
 epoch: 86, train_loss: 0.7927, test_loss: 1.4277, test_f1: 0.5584
 epoch: 87, train_loss: 0.7996, test_loss: 1.4595, test_f1: 0.5494
 epoch: 88, train_loss: 0.7736, test_loss: 1.4047, test_f1: 0.5623
 epoch: 89, train_loss: 0.7872, test_loss: 1.4679, test_f1: 0.5470
 epoch: 90, train_loss: 0.7883, test_loss: 1.4970, test_f1: 0.5449
 epoch: 91, train_loss: 0.7706, test_loss: 1.4622, test_f1: 0.5684
 epoch: 92, train_loss: 0.7927, test_loss: 1.4627, test_f1: 0.5686
 epoch: 93, train_loss: 0.7705, test_loss: 1.4614, test_f1: 0.5445
 epoch: 94, train_loss: 0.7877, test_loss: 1.4429, test_f1: 0.5476
 epoch: 95, train_loss: 0.7729, test_loss: 1.4711, test_f1: 0.5423
 epoch: 96, train_loss: 0.7731, test_loss: 1.4761, test_f1: 0.5486
 epoch: 97, train_loss: 0.7717, test_loss: 1.4235, test_f1: 0.5495
 epoch: 98, train_loss: 0.7871, test_loss: 1.4489, test_f1: 0.5520
 epoch: 99, train_loss: 0.7669, test_loss: 1.4285, test_f1: 0.5469
##################ITERATION #9 ****************************************
 epoch: 0, train_loss: 1.3566, test_loss: 1.3583, test_f1: 0.2800
 epoch: 1, train_loss: 1.2704, test_loss: 1.3234, test_f1: 0.3459
 epoch: 2, train_loss: 1.2302, test_loss: 1.3102, test_f1: 0.3601
 epoch: 3, train_loss: 1.2088, test_loss: 1.3072, test_f1: 0.4194
 epoch: 4, train_loss: 1.2095, test_loss: 1.2881, test_f1: 0.3971
 epoch: 5, train_loss: 1.1746, test_loss: 1.2816, test_f1: 0.4255
 epoch: 6, train_loss: 1.1644, test_loss: 1.2616, test_f1: 0.4656
 epoch: 7, train_loss: 1.1435, test_loss: 1.2393, test_f1: 0.4772
 epoch: 8, train_loss: 1.1500, test_loss: 1.2422, test_f1: 0.4662
 epoch: 9, train_loss: 1.1000, test_loss: 1.2456, test_f1: 0.4587
 epoch: 10, train_loss: 1.0987, test_loss: 1.2301, test_f1: 0.4743
 epoch: 11, train_loss: 1.0998, test_loss: 1.2240, test_f1: 0.4685
 epoch: 12, train_loss: 1.0921, test_loss: 1.2158, test_f1: 0.4763
 epoch: 13, train_loss: 1.0535, test_loss: 1.2072, test_f1: 0.4844
 epoch: 14, train_loss: 1.0585, test_loss: 1.1964, test_f1: 0.4868
 epoch: 15, train_loss: 1.0562, test_loss: 1.1999, test_f1: 0.4890
 epoch: 16, train_loss: 1.0462, test_loss: 1.2035, test_f1: 0.5056
 epoch: 17, train_loss: 1.0278, test_loss: 1.1972, test_f1: 0.5011
 epoch: 18, train_loss: 1.0087, test_loss: 1.1918, test_f1: 0.5017
 epoch: 19, train_loss: 1.0007, test_loss: 1.1991, test_f1: 0.4811
 epoch: 20, train_loss: 0.9971, test_loss: 1.1883, test_f1: 0.5007
 epoch: 21, train_loss: 1.0020, test_loss: 1.2029, test_f1: 0.4734
 epoch: 22, train_loss: 0.9887, test_loss: 1.1680, test_f1: 0.5008
 epoch: 23, train_loss: 0.9786, test_loss: 1.1729, test_f1: 0.5006
 epoch: 24, train_loss: 0.9848, test_loss: 1.1710, test_f1: 0.5221
 epoch: 25, train_loss: 0.9475, test_loss: 1.1644, test_f1: 0.5067
 epoch: 26, train_loss: 0.9536, test_loss: 1.1609, test_f1: 0.5060
 epoch: 27, train_loss: 0.9631, test_loss: 1.1570, test_f1: 0.4884
 epoch: 28, train_loss: 0.9559, test_loss: 1.1686, test_f1: 0.4835
 epoch: 29, train_loss: 0.9409, test_loss: 1.1611, test_f1: 0.4910
 epoch: 30, train_loss: 0.9454, test_loss: 1.1625, test_f1: 0.4774
 epoch: 31, train_loss: 0.9406, test_loss: 1.1876, test_f1: 0.4550
 epoch: 32, train_loss: 0.9262, test_loss: 1.1778, test_f1: 0.4958
 epoch: 33, train_loss: 0.9307, test_loss: 1.1706, test_f1: 0.4929
 epoch: 34, train_loss: 0.9204, test_loss: 1.1864, test_f1: 0.4833
 epoch: 35, train_loss: 0.9061, test_loss: 1.1576, test_f1: 0.4649
 epoch: 36, train_loss: 0.9197, test_loss: 1.1590, test_f1: 0.4899
 epoch: 37, train_loss: 0.9171, test_loss: 1.1458, test_f1: 0.4959
 epoch: 38, train_loss: 0.9148, test_loss: 1.1424, test_f1: 0.4773
 epoch: 39, train_loss: 0.8930, test_loss: 1.1427, test_f1: 0.4749
 epoch: 40, train_loss: 0.8936, test_loss: 1.1645, test_f1: 0.4702
 epoch: 41, train_loss: 0.8923, test_loss: 1.1445, test_f1: 0.4956
 epoch: 42, train_loss: 0.8900, test_loss: 1.2087, test_f1: 0.4477
 epoch: 43, train_loss: 0.8973, test_loss: 1.1486, test_f1: 0.4821
 epoch: 44, train_loss: 0.8715, test_loss: 1.1705, test_f1: 0.4658
 epoch: 45, train_loss: 0.8624, test_loss: 1.1791, test_f1: 0.5024
 epoch: 46, train_loss: 0.8710, test_loss: 1.1668, test_f1: 0.4722
 epoch: 47, train_loss: 0.8783, test_loss: 1.1869, test_f1: 0.4578
 epoch: 48, train_loss: 0.8588, test_loss: 1.1652, test_f1: 0.4795
 epoch: 49, train_loss: 0.8545, test_loss: 1.2089, test_f1: 0.4486
 epoch: 50, train_loss: 0.8537, test_loss: 1.1745, test_f1: 0.4603
 epoch: 51, train_loss: 0.8478, test_loss: 1.1661, test_f1: 0.4917
 epoch: 52, train_loss: 0.8537, test_loss: 1.2066, test_f1: 0.4655
 epoch: 53, train_loss: 0.8394, test_loss: 1.2218, test_f1: 0.4805
 epoch: 54, train_loss: 0.8431, test_loss: 1.2042, test_f1: 0.4738
 epoch: 55, train_loss: 0.8433, test_loss: 1.2194, test_f1: 0.4825
 epoch: 56, train_loss: 0.8463, test_loss: 1.2027, test_f1: 0.4649
 epoch: 57, train_loss: 0.8392, test_loss: 1.2105, test_f1: 0.4746
 epoch: 58, train_loss: 0.8410, test_loss: 1.2433, test_f1: 0.4554
 epoch: 59, train_loss: 0.8438, test_loss: 1.2375, test_f1: 0.4624
 epoch: 60, train_loss: 0.8326, test_loss: 1.2433, test_f1: 0.4767
 epoch: 61, train_loss: 0.8331, test_loss: 1.2497, test_f1: 0.4831
 epoch: 62, train_loss: 0.8242, test_loss: 1.2453, test_f1: 0.4854
 epoch: 63, train_loss: 0.8331, test_loss: 1.2373, test_f1: 0.4768
 epoch: 64, train_loss: 0.8250, test_loss: 1.2728, test_f1: 0.4651
 epoch: 65, train_loss: 0.8355, test_loss: 1.2159, test_f1: 0.4835
 epoch: 66, train_loss: 0.8285, test_loss: 1.2162, test_f1: 0.4940
 epoch: 67, train_loss: 0.8278, test_loss: 1.2653, test_f1: 0.4624
 epoch: 68, train_loss: 0.8225, test_loss: 1.2569, test_f1: 0.4674
 epoch: 69, train_loss: 0.8284, test_loss: 1.2545, test_f1: 0.4702
 epoch: 70, train_loss: 0.8267, test_loss: 1.3166, test_f1: 0.4801
 epoch: 71, train_loss: 0.8242, test_loss: 1.2598, test_f1: 0.4783
 epoch: 72, train_loss: 0.8194, test_loss: 1.2782, test_f1: 0.4841
 epoch: 73, train_loss: 0.8295, test_loss: 1.2611, test_f1: 0.4717
 epoch: 74, train_loss: 0.8174, test_loss: 1.3132, test_f1: 0.4644
 epoch: 75, train_loss: 0.7985, test_loss: 1.2925, test_f1: 0.4792
 epoch: 76, train_loss: 0.8108, test_loss: 1.3405, test_f1: 0.4747
 epoch: 77, train_loss: 0.8217, test_loss: 1.3409, test_f1: 0.4537
 epoch: 78, train_loss: 0.8127, test_loss: 1.2588, test_f1: 0.4897
 epoch: 79, train_loss: 0.8098, test_loss: 1.3330, test_f1: 0.4726
 epoch: 80, train_loss: 0.8172, test_loss: 1.3535, test_f1: 0.4646
 epoch: 81, train_loss: 0.8064, test_loss: 1.3222, test_f1: 0.4608
 epoch: 82, train_loss: 0.8000, test_loss: 1.2987, test_f1: 0.4641
 epoch: 83, train_loss: 0.8069, test_loss: 1.3506, test_f1: 0.4695
 epoch: 84, train_loss: 0.8024, test_loss: 1.3433, test_f1: 0.4676
 epoch: 85, train_loss: 0.7846, test_loss: 1.3291, test_f1: 0.4719
 epoch: 86, train_loss: 0.7961, test_loss: 1.3565, test_f1: 0.4680
 epoch: 87, train_loss: 0.7867, test_loss: 1.3145, test_f1: 0.4817
 epoch: 88, train_loss: 0.8056, test_loss: 1.3366, test_f1: 0.4796
 epoch: 89, train_loss: 0.7877, test_loss: 1.3179, test_f1: 0.4777
 epoch: 90, train_loss: 0.7913, test_loss: 1.3412, test_f1: 0.4781
 epoch: 91, train_loss: 0.7729, test_loss: 1.3721, test_f1: 0.4618
 epoch: 92, train_loss: 0.7819, test_loss: 1.3615, test_f1: 0.4759
 epoch: 93, train_loss: 0.7903, test_loss: 1.3308, test_f1: 0.4861
 epoch: 94, train_loss: 0.7851, test_loss: 1.3577, test_f1: 0.4900
 epoch: 95, train_loss: 0.7814, test_loss: 1.3884, test_f1: 0.4818
 epoch: 96, train_loss: 0.8041, test_loss: 1.3160, test_f1: 0.4686
 epoch: 97, train_loss: 0.7715, test_loss: 1.3822, test_f1: 0.4882
 epoch: 98, train_loss: 0.7744, test_loss: 1.4127, test_f1: 0.4846
 epoch: 99, train_loss: 0.7780, test_loss: 1.3550, test_f1: 0.4887

Training completed in 375.18 seconds
Best F1: 0.6155 at epoch 84
Mean F1 across iterations: 0.5738  0.0249
========================FINAL RESULTS================================
FEGIN weighted F1: 0.6155  0.0249
python main.py --data ltspice_demos --representation component_component --model FEGIN --layers 2 --hiddens 64 --batch_size 64 --lr 0.0001 --emb_size 128 --epochs 100 --save_appendix component_component_L2_H64_BS64_LR0.0001_E128 --no_val
-----



STDERR:
  File "main.py", line 370, in <module>
    main()
  File "main.py", line 254, in main
    dataset = dataset_class(
  File "/home/philip/projects/ltspice_examples_code_repo/Circuit-Completion-Using-GNNs/component_classification_with_link_prediction_head/evaluation/FEGIN/kernel/circuit_datasets.py", line 15, in __init__
    self.data, self.slices = torch.load(self.processed_paths[0])
  File "/home/philip/.local/lib/python3.8/site-packages/torch/serialization.py", line 1040, in load
    warnings.warn(
  File "/usr/lib/python3.8/warnings.py", line 109, in _showwarnmsg
    sw(msg.message, msg.category, msg.filename, msg.lineno,
  File "main.py", line 47, in warn_with_traceback
    traceback.print_stack(file=log)
/home/philip/projects/ltspice_examples_code_repo/Circuit-Completion-Using-GNNs/component_classification_with_link_prediction_head/evaluation/FEGIN/kernel/circuit_datasets.py:15: FutureWarning: You are using `torch.load` with `weights_only=False` (the current default value), which uses the default pickle module implicitly. It is possible to construct malicious pickle data which will execute arbitrary code during unpickling (See https://github.com/pytorch/pytorch/blob/main/SECURITY.md#untrusted-models for more details). In a future release, the default value for `weights_only` will be flipped to `True`. This limits the functions that could be executed during unpickling. Arbitrary objects will no longer be allowed to be loaded via this mode unless they are explicitly allowlisted by the user via `torch.serialization.add_safe_globals`. We recommend you start setting `weights_only=True` for any use case where you don't have full control of the loaded file. Please open an issue on GitHub for any issues related to this experimental feature.
  self.data, self.slices = torch.load(self.processed_paths[0])
