STDOUT:
Results will be saved in /home/philip/projects/ltspice_examples_code_repo/Circuit-Completion-Using-GNNs/component_classification_with_link_prediction_head/evaluation/FEGIN/results/model_FEGIN_dataset_ltspice_demos
Command line input: python main.py --data ltspice_demos --representation component_pin --model FEGIN --layers 2 --hiddens 128 --batch_size 32 --lr 0.0001 --emb_size 128 --epochs 100 --save_appendix component_pin_L2_H128_BS32_LR0.0001_E128 --no_val
 is saved.
-----
ltspice_demos - FEGIN
Using 2 layers, 128 hidden units, h = 2
Loading component_pin representation dataset
ENTERED
Training FEGIN on component_pin representation
Train: 1565, Test: 383
##################ITERATION #0 ****************************************
 epoch: 0, train_loss: 1.3518, test_loss: 1.3472, test_f1: 0.3381
 epoch: 1, train_loss: 1.3004, test_loss: 1.3039, test_f1: 0.2850
 epoch: 2, train_loss: 1.2428, test_loss: 1.2570, test_f1: 0.2872
 epoch: 3, train_loss: 1.1858, test_loss: 1.2237, test_f1: 0.4237
 epoch: 4, train_loss: 1.1398, test_loss: 1.1911, test_f1: 0.4522
 epoch: 5, train_loss: 1.1031, test_loss: 1.1470, test_f1: 0.4553
 epoch: 6, train_loss: 1.0565, test_loss: 1.1173, test_f1: 0.4548
 epoch: 7, train_loss: 1.0252, test_loss: 1.0892, test_f1: 0.4567
 epoch: 8, train_loss: 1.0029, test_loss: 1.0652, test_f1: 0.4561
 epoch: 9, train_loss: 0.9809, test_loss: 1.0517, test_f1: 0.4489
 epoch: 10, train_loss: 0.9645, test_loss: 1.0441, test_f1: 0.4610
 epoch: 11, train_loss: 0.9477, test_loss: 1.0132, test_f1: 0.4538
 epoch: 12, train_loss: 0.9277, test_loss: 1.0201, test_f1: 0.4934
 epoch: 13, train_loss: 0.9074, test_loss: 0.9973, test_f1: 0.5305
 epoch: 14, train_loss: 0.8904, test_loss: 0.9895, test_f1: 0.5421
 epoch: 15, train_loss: 0.8775, test_loss: 0.9792, test_f1: 0.5777
 epoch: 16, train_loss: 0.8590, test_loss: 0.9636, test_f1: 0.5777
 epoch: 17, train_loss: 0.8438, test_loss: 0.9675, test_f1: 0.6093
 epoch: 18, train_loss: 0.8264, test_loss: 0.9678, test_f1: 0.6148
 epoch: 19, train_loss: 0.8003, test_loss: 0.9638, test_f1: 0.6079
 epoch: 20, train_loss: 0.7925, test_loss: 0.9657, test_f1: 0.6017
 epoch: 21, train_loss: 0.7745, test_loss: 0.9481, test_f1: 0.6339
 epoch: 22, train_loss: 0.7603, test_loss: 0.9610, test_f1: 0.6195
 epoch: 23, train_loss: 0.7493, test_loss: 0.9685, test_f1: 0.6018
 epoch: 24, train_loss: 0.7320, test_loss: 0.9450, test_f1: 0.6357
 epoch: 25, train_loss: 0.7131, test_loss: 0.9539, test_f1: 0.5978
 epoch: 26, train_loss: 0.7138, test_loss: 0.9457, test_f1: 0.6011
 epoch: 27, train_loss: 0.6985, test_loss: 0.9591, test_f1: 0.6178
 epoch: 28, train_loss: 0.6855, test_loss: 0.9677, test_f1: 0.6049
 epoch: 29, train_loss: 0.6849, test_loss: 0.9909, test_f1: 0.5924
 epoch: 30, train_loss: 0.6735, test_loss: 0.9787, test_f1: 0.6268
 epoch: 31, train_loss: 0.6631, test_loss: 0.9952, test_f1: 0.6132
 epoch: 32, train_loss: 0.6588, test_loss: 0.9962, test_f1: 0.6135
 epoch: 33, train_loss: 0.6618, test_loss: 0.9956, test_f1: 0.5993
 epoch: 34, train_loss: 0.6428, test_loss: 0.9878, test_f1: 0.6099
 epoch: 35, train_loss: 0.6246, test_loss: 1.0394, test_f1: 0.5979
 epoch: 36, train_loss: 0.6337, test_loss: 0.9880, test_f1: 0.6515
 epoch: 37, train_loss: 0.6247, test_loss: 0.9447, test_f1: 0.6250
 epoch: 38, train_loss: 0.6378, test_loss: 1.0345, test_f1: 0.5940
 epoch: 39, train_loss: 0.6130, test_loss: 1.0250, test_f1: 0.6142
 epoch: 40, train_loss: 0.5996, test_loss: 1.0363, test_f1: 0.6022
 epoch: 41, train_loss: 0.6045, test_loss: 1.0293, test_f1: 0.6032
 epoch: 42, train_loss: 0.5846, test_loss: 1.0284, test_f1: 0.6149
 epoch: 43, train_loss: 0.5706, test_loss: 0.9982, test_f1: 0.5761
 epoch: 44, train_loss: 0.5792, test_loss: 1.0654, test_f1: 0.6262
 epoch: 45, train_loss: 0.5865, test_loss: 1.0506, test_f1: 0.6049
 epoch: 46, train_loss: 0.5645, test_loss: 1.0147, test_f1: 0.6127
 epoch: 47, train_loss: 0.5781, test_loss: 1.0178, test_f1: 0.6337
 epoch: 48, train_loss: 0.5619, test_loss: 0.9980, test_f1: 0.6232
 epoch: 49, train_loss: 0.5477, test_loss: 0.9785, test_f1: 0.6491
 epoch: 50, train_loss: 0.5514, test_loss: 1.1117, test_f1: 0.6010
 epoch: 51, train_loss: 0.5177, test_loss: 1.0379, test_f1: 0.6328
 epoch: 52, train_loss: 0.5231, test_loss: 1.0763, test_f1: 0.6019
 epoch: 53, train_loss: 0.5216, test_loss: 1.0475, test_f1: 0.5903
 epoch: 54, train_loss: 0.5036, test_loss: 1.0386, test_f1: 0.6194
 epoch: 55, train_loss: 0.5159, test_loss: 1.0890, test_f1: 0.6261
 epoch: 56, train_loss: 0.5176, test_loss: 1.0169, test_f1: 0.6201
 epoch: 57, train_loss: 0.4991, test_loss: 1.0351, test_f1: 0.6164
 epoch: 58, train_loss: 0.5026, test_loss: 1.0640, test_f1: 0.6107
 epoch: 59, train_loss: 0.5019, test_loss: 1.0758, test_f1: 0.5982
 epoch: 60, train_loss: 0.4876, test_loss: 1.0695, test_f1: 0.6117
 epoch: 61, train_loss: 0.4748, test_loss: 1.1926, test_f1: 0.5948
 epoch: 62, train_loss: 0.4876, test_loss: 1.1741, test_f1: 0.6043
 epoch: 63, train_loss: 0.4806, test_loss: 1.2578, test_f1: 0.5782
 epoch: 64, train_loss: 0.4879, test_loss: 1.1471, test_f1: 0.5767
 epoch: 65, train_loss: 0.4866, test_loss: 1.1369, test_f1: 0.6371
 epoch: 66, train_loss: 0.4604, test_loss: 1.1735, test_f1: 0.6209
 epoch: 67, train_loss: 0.4751, test_loss: 1.1025, test_f1: 0.6195
 epoch: 68, train_loss: 0.4603, test_loss: 1.1214, test_f1: 0.6215
 epoch: 69, train_loss: 0.4610, test_loss: 1.1831, test_f1: 0.6065
 epoch: 70, train_loss: 0.4566, test_loss: 1.2529, test_f1: 0.6068
 epoch: 71, train_loss: 0.4564, test_loss: 1.2630, test_f1: 0.6042
 epoch: 72, train_loss: 0.4540, test_loss: 1.1184, test_f1: 0.6262
 epoch: 73, train_loss: 0.4444, test_loss: 1.1506, test_f1: 0.6185
 epoch: 74, train_loss: 0.4484, test_loss: 1.3161, test_f1: 0.5845
 epoch: 75, train_loss: 0.4414, test_loss: 1.2794, test_f1: 0.5735
 epoch: 76, train_loss: 0.4272, test_loss: 1.3231, test_f1: 0.5826
 epoch: 77, train_loss: 0.4411, test_loss: 1.2424, test_f1: 0.6255
 epoch: 78, train_loss: 0.4389, test_loss: 1.2771, test_f1: 0.6012
 epoch: 79, train_loss: 0.4185, test_loss: 1.2196, test_f1: 0.6372
 epoch: 80, train_loss: 0.4297, test_loss: 1.2521, test_f1: 0.6072
 epoch: 81, train_loss: 0.4281, test_loss: 1.4292, test_f1: 0.6041
 epoch: 82, train_loss: 0.4142, test_loss: 1.2492, test_f1: 0.6059
 epoch: 83, train_loss: 0.4190, test_loss: 1.2686, test_f1: 0.6200
 epoch: 84, train_loss: 0.4219, test_loss: 1.2549, test_f1: 0.6338
 epoch: 85, train_loss: 0.4318, test_loss: 1.3553, test_f1: 0.6224
 epoch: 86, train_loss: 0.4134, test_loss: 1.3694, test_f1: 0.5901
 epoch: 87, train_loss: 0.3966, test_loss: 1.3050, test_f1: 0.6318
 epoch: 88, train_loss: 0.4226, test_loss: 1.2729, test_f1: 0.6366
 epoch: 89, train_loss: 0.4220, test_loss: 1.2701, test_f1: 0.6306
 epoch: 90, train_loss: 0.4091, test_loss: 1.2472, test_f1: 0.6261
 epoch: 91, train_loss: 0.3951, test_loss: 1.2544, test_f1: 0.6316
 epoch: 92, train_loss: 0.3864, test_loss: 1.2480, test_f1: 0.6161
 epoch: 93, train_loss: 0.3850, test_loss: 1.2521, test_f1: 0.6379
 epoch: 94, train_loss: 0.3753, test_loss: 1.3715, test_f1: 0.6170
 epoch: 95, train_loss: 0.3841, test_loss: 1.2932, test_f1: 0.6213
 epoch: 96, train_loss: 0.3934, test_loss: 1.3501, test_f1: 0.6071
 epoch: 97, train_loss: 0.3834, test_loss: 1.3585, test_f1: 0.6285
 epoch: 98, train_loss: 0.3735, test_loss: 1.2823, test_f1: 0.6163
 epoch: 99, train_loss: 0.3863, test_loss: 1.4003, test_f1: 0.6145
##################ITERATION #1 ****************************************
 epoch: 0, train_loss: 1.2555, test_loss: 1.2935, test_f1: 0.2636
 epoch: 1, train_loss: 1.1788, test_loss: 1.2277, test_f1: 0.4041
 epoch: 2, train_loss: 1.1323, test_loss: 1.1857, test_f1: 0.4315
 epoch: 3, train_loss: 1.0725, test_loss: 1.1353, test_f1: 0.4282
 epoch: 4, train_loss: 1.0280, test_loss: 1.0974, test_f1: 0.4971
 epoch: 5, train_loss: 0.9858, test_loss: 1.0528, test_f1: 0.5204
 epoch: 6, train_loss: 0.9513, test_loss: 1.0341, test_f1: 0.5523
 epoch: 7, train_loss: 0.9185, test_loss: 1.0113, test_f1: 0.5493
 epoch: 8, train_loss: 0.9067, test_loss: 1.0125, test_f1: 0.5815
 epoch: 9, train_loss: 0.8759, test_loss: 0.9963, test_f1: 0.5931
 epoch: 10, train_loss: 0.8587, test_loss: 0.9905, test_f1: 0.5980
 epoch: 11, train_loss: 0.8418, test_loss: 0.9775, test_f1: 0.5994
 epoch: 12, train_loss: 0.8313, test_loss: 0.9833, test_f1: 0.5827
 epoch: 13, train_loss: 0.7991, test_loss: 0.9817, test_f1: 0.5836
 epoch: 14, train_loss: 0.7812, test_loss: 0.9899, test_f1: 0.5712
 epoch: 15, train_loss: 0.7746, test_loss: 0.9778, test_f1: 0.5675
 epoch: 16, train_loss: 0.7548, test_loss: 0.9984, test_f1: 0.5721
 epoch: 17, train_loss: 0.7406, test_loss: 1.0350, test_f1: 0.5864
 epoch: 18, train_loss: 0.7440, test_loss: 1.0224, test_f1: 0.5755
 epoch: 19, train_loss: 0.7226, test_loss: 1.0260, test_f1: 0.5646
 epoch: 20, train_loss: 0.7086, test_loss: 1.0038, test_f1: 0.5915
 epoch: 21, train_loss: 0.7093, test_loss: 0.9793, test_f1: 0.5902
 epoch: 22, train_loss: 0.6740, test_loss: 1.0053, test_f1: 0.6022
 epoch: 23, train_loss: 0.6783, test_loss: 1.0596, test_f1: 0.5898
 epoch: 24, train_loss: 0.6635, test_loss: 1.0367, test_f1: 0.6050
 epoch: 25, train_loss: 0.6629, test_loss: 1.0663, test_f1: 0.5610
 epoch: 26, train_loss: 0.6393, test_loss: 1.0422, test_f1: 0.5960
 epoch: 27, train_loss: 0.6503, test_loss: 1.0503, test_f1: 0.5810
 epoch: 28, train_loss: 0.6331, test_loss: 1.0404, test_f1: 0.6055
 epoch: 29, train_loss: 0.6162, test_loss: 1.0778, test_f1: 0.6321
 epoch: 30, train_loss: 0.6097, test_loss: 1.0213, test_f1: 0.5920
 epoch: 31, train_loss: 0.5956, test_loss: 1.0895, test_f1: 0.6014
 epoch: 32, train_loss: 0.5952, test_loss: 1.0950, test_f1: 0.5896
 epoch: 33, train_loss: 0.5874, test_loss: 1.0794, test_f1: 0.5833
 epoch: 34, train_loss: 0.5742, test_loss: 1.0770, test_f1: 0.5844
 epoch: 35, train_loss: 0.5864, test_loss: 1.1313, test_f1: 0.5950
 epoch: 36, train_loss: 0.5726, test_loss: 1.1236, test_f1: 0.5996
 epoch: 37, train_loss: 0.5631, test_loss: 1.2108, test_f1: 0.5799
 epoch: 38, train_loss: 0.5421, test_loss: 1.1412, test_f1: 0.5998
 epoch: 39, train_loss: 0.5478, test_loss: 1.1102, test_f1: 0.5797
 epoch: 40, train_loss: 0.5464, test_loss: 1.2072, test_f1: 0.5916
 epoch: 41, train_loss: 0.5187, test_loss: 1.2037, test_f1: 0.5933
 epoch: 42, train_loss: 0.5041, test_loss: 1.1928, test_f1: 0.5953
 epoch: 43, train_loss: 0.5034, test_loss: 1.2202, test_f1: 0.5957
 epoch: 44, train_loss: 0.5246, test_loss: 1.1823, test_f1: 0.6073
 epoch: 45, train_loss: 0.5135, test_loss: 1.2517, test_f1: 0.5947
 epoch: 46, train_loss: 0.5068, test_loss: 1.3027, test_f1: 0.5877
 epoch: 47, train_loss: 0.4775, test_loss: 1.2944, test_f1: 0.5938
 epoch: 48, train_loss: 0.4786, test_loss: 1.3611, test_f1: 0.5786
 epoch: 49, train_loss: 0.4767, test_loss: 1.3418, test_f1: 0.5670
 epoch: 50, train_loss: 0.4673, test_loss: 1.3604, test_f1: 0.5917
 epoch: 51, train_loss: 0.4500, test_loss: 1.3487, test_f1: 0.5969
 epoch: 52, train_loss: 0.4475, test_loss: 1.3836, test_f1: 0.5935
 epoch: 53, train_loss: 0.4393, test_loss: 1.3931, test_f1: 0.5739
 epoch: 54, train_loss: 0.4414, test_loss: 1.3460, test_f1: 0.6006
 epoch: 55, train_loss: 0.4448, test_loss: 1.3356, test_f1: 0.5842
 epoch: 56, train_loss: 0.4341, test_loss: 1.3774, test_f1: 0.6133
 epoch: 57, train_loss: 0.4452, test_loss: 1.3814, test_f1: 0.6242
 epoch: 58, train_loss: 0.4186, test_loss: 1.4262, test_f1: 0.5828
 epoch: 59, train_loss: 0.4132, test_loss: 1.3471, test_f1: 0.6108
 epoch: 60, train_loss: 0.4216, test_loss: 1.3823, test_f1: 0.5935
 epoch: 61, train_loss: 0.4082, test_loss: 1.3667, test_f1: 0.6051
 epoch: 62, train_loss: 0.4009, test_loss: 1.4066, test_f1: 0.5836
 epoch: 63, train_loss: 0.3938, test_loss: 1.3844, test_f1: 0.5747
 epoch: 64, train_loss: 0.4046, test_loss: 1.4497, test_f1: 0.5863
 epoch: 65, train_loss: 0.4032, test_loss: 1.4759, test_f1: 0.5947
 epoch: 66, train_loss: 0.3904, test_loss: 1.4779, test_f1: 0.5938
 epoch: 67, train_loss: 0.3836, test_loss: 1.4365, test_f1: 0.6072
 epoch: 68, train_loss: 0.3820, test_loss: 1.4348, test_f1: 0.6243
 epoch: 69, train_loss: 0.3927, test_loss: 1.4697, test_f1: 0.6108
 epoch: 70, train_loss: 0.3813, test_loss: 1.5284, test_f1: 0.6186
 epoch: 71, train_loss: 0.3818, test_loss: 1.5086, test_f1: 0.6184
 epoch: 72, train_loss: 0.3749, test_loss: 1.5327, test_f1: 0.6136
 epoch: 73, train_loss: 0.3697, test_loss: 1.5595, test_f1: 0.5851
 epoch: 74, train_loss: 0.3680, test_loss: 1.5806, test_f1: 0.5895
 epoch: 75, train_loss: 0.3589, test_loss: 1.5493, test_f1: 0.6157
 epoch: 76, train_loss: 0.3571, test_loss: 1.5827, test_f1: 0.6182
 epoch: 77, train_loss: 0.3486, test_loss: 1.6353, test_f1: 0.5846
 epoch: 78, train_loss: 0.3402, test_loss: 1.6784, test_f1: 0.5975
 epoch: 79, train_loss: 0.3417, test_loss: 1.5761, test_f1: 0.6192
 epoch: 80, train_loss: 0.3382, test_loss: 1.5799, test_f1: 0.5979
 epoch: 81, train_loss: 0.3362, test_loss: 1.6108, test_f1: 0.6021
 epoch: 82, train_loss: 0.3431, test_loss: 1.6959, test_f1: 0.6126
 epoch: 83, train_loss: 0.3587, test_loss: 1.6611, test_f1: 0.5836
 epoch: 84, train_loss: 0.3273, test_loss: 1.6747, test_f1: 0.5917
 epoch: 85, train_loss: 0.3324, test_loss: 1.6969, test_f1: 0.6004
 epoch: 86, train_loss: 0.3337, test_loss: 1.6701, test_f1: 0.6109
 epoch: 87, train_loss: 0.3320, test_loss: 1.7017, test_f1: 0.5970
 epoch: 88, train_loss: 0.3317, test_loss: 1.5522, test_f1: 0.6283
 epoch: 89, train_loss: 0.3341, test_loss: 1.8953, test_f1: 0.5783
 epoch: 90, train_loss: 0.3091, test_loss: 1.7376, test_f1: 0.5827
 epoch: 91, train_loss: 0.3082, test_loss: 1.7200, test_f1: 0.5974
 epoch: 92, train_loss: 0.3023, test_loss: 1.7478, test_f1: 0.6021
 epoch: 93, train_loss: 0.3104, test_loss: 1.6478, test_f1: 0.6047
 epoch: 94, train_loss: 0.3039, test_loss: 1.8296, test_f1: 0.5903
 epoch: 95, train_loss: 0.2927, test_loss: 1.7268, test_f1: 0.6139
 epoch: 96, train_loss: 0.3070, test_loss: 1.7510, test_f1: 0.6130
 epoch: 97, train_loss: 0.3037, test_loss: 1.6533, test_f1: 0.6066
 epoch: 98, train_loss: 0.3239, test_loss: 1.7053, test_f1: 0.6056
 epoch: 99, train_loss: 0.3107, test_loss: 1.9624, test_f1: 0.5887
##################ITERATION #2 ****************************************
 epoch: 0, train_loss: 1.2182, test_loss: 1.2572, test_f1: 0.3597
 epoch: 1, train_loss: 1.1223, test_loss: 1.1679, test_f1: 0.4419
 epoch: 2, train_loss: 1.0767, test_loss: 1.1310, test_f1: 0.4422
 epoch: 3, train_loss: 1.0341, test_loss: 1.0932, test_f1: 0.5179
 epoch: 4, train_loss: 0.9965, test_loss: 1.0604, test_f1: 0.5244
 epoch: 5, train_loss: 0.9658, test_loss: 1.0249, test_f1: 0.5558
 epoch: 6, train_loss: 0.9283, test_loss: 0.9998, test_f1: 0.5734
 epoch: 7, train_loss: 0.9135, test_loss: 0.9827, test_f1: 0.5848
 epoch: 8, train_loss: 0.8875, test_loss: 0.9721, test_f1: 0.5917
 epoch: 9, train_loss: 0.8684, test_loss: 0.9533, test_f1: 0.5838
 epoch: 10, train_loss: 0.8432, test_loss: 0.9517, test_f1: 0.6113
 epoch: 11, train_loss: 0.8264, test_loss: 0.9463, test_f1: 0.6116
 epoch: 12, train_loss: 0.8072, test_loss: 0.9506, test_f1: 0.6019
 epoch: 13, train_loss: 0.7948, test_loss: 0.9460, test_f1: 0.6353
 epoch: 14, train_loss: 0.7782, test_loss: 0.9484, test_f1: 0.6210
 epoch: 15, train_loss: 0.7412, test_loss: 0.9540, test_f1: 0.6065
 epoch: 16, train_loss: 0.7430, test_loss: 0.9438, test_f1: 0.6461
 epoch: 17, train_loss: 0.7259, test_loss: 0.9568, test_f1: 0.6106
 epoch: 18, train_loss: 0.7148, test_loss: 1.0063, test_f1: 0.5869
 epoch: 19, train_loss: 0.7044, test_loss: 0.9956, test_f1: 0.5910
 epoch: 20, train_loss: 0.6899, test_loss: 1.0022, test_f1: 0.6026
 epoch: 21, train_loss: 0.6980, test_loss: 0.9882, test_f1: 0.5982
 epoch: 22, train_loss: 0.6787, test_loss: 1.0438, test_f1: 0.6053
 epoch: 23, train_loss: 0.6677, test_loss: 0.9953, test_f1: 0.6119
 epoch: 24, train_loss: 0.6574, test_loss: 1.0552, test_f1: 0.6306
 epoch: 25, train_loss: 0.6466, test_loss: 1.0342, test_f1: 0.6134
 epoch: 26, train_loss: 0.6480, test_loss: 1.0375, test_f1: 0.6271
 epoch: 27, train_loss: 0.6211, test_loss: 1.0848, test_f1: 0.6199
 epoch: 28, train_loss: 0.6285, test_loss: 1.0560, test_f1: 0.6581
 epoch: 29, train_loss: 0.6245, test_loss: 1.0651, test_f1: 0.6457
 epoch: 30, train_loss: 0.6036, test_loss: 1.0912, test_f1: 0.5948
 epoch: 31, train_loss: 0.5944, test_loss: 1.1027, test_f1: 0.6092
 epoch: 32, train_loss: 0.5849, test_loss: 1.0997, test_f1: 0.5856
 epoch: 33, train_loss: 0.5737, test_loss: 1.0814, test_f1: 0.6305
 epoch: 34, train_loss: 0.5712, test_loss: 1.1318, test_f1: 0.6254
 epoch: 35, train_loss: 0.5660, test_loss: 1.1565, test_f1: 0.6276
 epoch: 36, train_loss: 0.5602, test_loss: 1.1550, test_f1: 0.6251
 epoch: 37, train_loss: 0.5606, test_loss: 1.1651, test_f1: 0.6206
 epoch: 38, train_loss: 0.5418, test_loss: 1.2179, test_f1: 0.5829
 epoch: 39, train_loss: 0.5302, test_loss: 1.1964, test_f1: 0.5756
 epoch: 40, train_loss: 0.5424, test_loss: 1.1702, test_f1: 0.6108
 epoch: 41, train_loss: 0.5264, test_loss: 1.2105, test_f1: 0.6192
 epoch: 42, train_loss: 0.5202, test_loss: 1.1592, test_f1: 0.5997
 epoch: 43, train_loss: 0.5137, test_loss: 1.2437, test_f1: 0.5962
 epoch: 44, train_loss: 0.5123, test_loss: 1.2515, test_f1: 0.6076
 epoch: 45, train_loss: 0.5085, test_loss: 1.2746, test_f1: 0.6170
 epoch: 46, train_loss: 0.4999, test_loss: 1.2345, test_f1: 0.5799
 epoch: 47, train_loss: 0.4721, test_loss: 1.3163, test_f1: 0.5752
 epoch: 48, train_loss: 0.4779, test_loss: 1.2436, test_f1: 0.6020
 epoch: 49, train_loss: 0.4762, test_loss: 1.2523, test_f1: 0.6094
 epoch: 50, train_loss: 0.4674, test_loss: 1.1962, test_f1: 0.6178
 epoch: 51, train_loss: 0.4586, test_loss: 1.2307, test_f1: 0.6066
 epoch: 52, train_loss: 0.4293, test_loss: 1.2997, test_f1: 0.6116
 epoch: 53, train_loss: 0.4285, test_loss: 1.3107, test_f1: 0.6163
 epoch: 54, train_loss: 0.4353, test_loss: 1.3178, test_f1: 0.6190
 epoch: 55, train_loss: 0.4323, test_loss: 1.3811, test_f1: 0.6085
 epoch: 56, train_loss: 0.4310, test_loss: 1.2762, test_f1: 0.5975
 epoch: 57, train_loss: 0.4171, test_loss: 1.2777, test_f1: 0.6025
 epoch: 58, train_loss: 0.4051, test_loss: 1.3027, test_f1: 0.5972
 epoch: 59, train_loss: 0.4192, test_loss: 1.4222, test_f1: 0.6370
 epoch: 60, train_loss: 0.4007, test_loss: 1.3576, test_f1: 0.6071
 epoch: 61, train_loss: 0.4025, test_loss: 1.4303, test_f1: 0.6303
 epoch: 62, train_loss: 0.4012, test_loss: 1.3810, test_f1: 0.6063
 epoch: 63, train_loss: 0.3904, test_loss: 1.3831, test_f1: 0.6425
 epoch: 64, train_loss: 0.4049, test_loss: 1.3783, test_f1: 0.6244
 epoch: 65, train_loss: 0.3880, test_loss: 1.3917, test_f1: 0.6167
 epoch: 66, train_loss: 0.3791, test_loss: 1.3502, test_f1: 0.6196
 epoch: 67, train_loss: 0.3871, test_loss: 1.3831, test_f1: 0.5982
 epoch: 68, train_loss: 0.3782, test_loss: 1.4928, test_f1: 0.6064
 epoch: 69, train_loss: 0.3814, test_loss: 1.3832, test_f1: 0.6260
 epoch: 70, train_loss: 0.3881, test_loss: 1.4628, test_f1: 0.6215
 epoch: 71, train_loss: 0.3809, test_loss: 1.4287, test_f1: 0.6111
 epoch: 72, train_loss: 0.3540, test_loss: 1.5446, test_f1: 0.5933
 epoch: 73, train_loss: 0.3668, test_loss: 1.4892, test_f1: 0.6307
 epoch: 74, train_loss: 0.3506, test_loss: 1.4522, test_f1: 0.6126
 epoch: 75, train_loss: 0.3490, test_loss: 1.4928, test_f1: 0.6203
 epoch: 76, train_loss: 0.3317, test_loss: 1.4627, test_f1: 0.6005
 epoch: 77, train_loss: 0.3356, test_loss: 1.5337, test_f1: 0.6154
 epoch: 78, train_loss: 0.3541, test_loss: 1.4578, test_f1: 0.6268
 epoch: 79, train_loss: 0.3574, test_loss: 1.5202, test_f1: 0.6120
 epoch: 80, train_loss: 0.3495, test_loss: 1.5900, test_f1: 0.6207
 epoch: 81, train_loss: 0.3205, test_loss: 1.5654, test_f1: 0.6267
 epoch: 82, train_loss: 0.3360, test_loss: 1.5705, test_f1: 0.6469
 epoch: 83, train_loss: 0.3369, test_loss: 1.6854, test_f1: 0.6286
 epoch: 84, train_loss: 0.3341, test_loss: 1.5740, test_f1: 0.6031
 epoch: 85, train_loss: 0.3408, test_loss: 1.5533, test_f1: 0.6327
 epoch: 86, train_loss: 0.3275, test_loss: 1.6715, test_f1: 0.6061
 epoch: 87, train_loss: 0.3318, test_loss: 1.6185, test_f1: 0.6164
 epoch: 88, train_loss: 0.3198, test_loss: 1.6148, test_f1: 0.6299
 epoch: 89, train_loss: 0.2921, test_loss: 1.6425, test_f1: 0.6101
 epoch: 90, train_loss: 0.3053, test_loss: 1.6765, test_f1: 0.6227
 epoch: 91, train_loss: 0.3030, test_loss: 1.5977, test_f1: 0.6166
 epoch: 92, train_loss: 0.3397, test_loss: 1.6645, test_f1: 0.6419
 epoch: 93, train_loss: 0.3060, test_loss: 1.6191, test_f1: 0.6412
 epoch: 94, train_loss: 0.2886, test_loss: 1.6244, test_f1: 0.6481
 epoch: 95, train_loss: 0.2884, test_loss: 1.7593, test_f1: 0.5924
 epoch: 96, train_loss: 0.3086, test_loss: 1.7045, test_f1: 0.6073
 epoch: 97, train_loss: 0.2964, test_loss: 1.7775, test_f1: 0.5970
 epoch: 98, train_loss: 0.2944, test_loss: 1.7152, test_f1: 0.5964
 epoch: 99, train_loss: 0.3000, test_loss: 1.7391, test_f1: 0.6048
##################ITERATION #3 ****************************************
 epoch: 0, train_loss: 1.2041, test_loss: 1.2347, test_f1: 0.3206
 epoch: 1, train_loss: 1.0924, test_loss: 1.1191, test_f1: 0.4877
 epoch: 2, train_loss: 1.0384, test_loss: 1.0829, test_f1: 0.5013
 epoch: 3, train_loss: 0.9928, test_loss: 1.0511, test_f1: 0.5364
 epoch: 4, train_loss: 0.9500, test_loss: 1.0242, test_f1: 0.5389
 epoch: 5, train_loss: 0.9058, test_loss: 1.0097, test_f1: 0.5763
 epoch: 6, train_loss: 0.8741, test_loss: 0.9840, test_f1: 0.5966
 epoch: 7, train_loss: 0.8428, test_loss: 0.9997, test_f1: 0.5720
 epoch: 8, train_loss: 0.8363, test_loss: 0.9402, test_f1: 0.6028
 epoch: 9, train_loss: 0.7986, test_loss: 0.9767, test_f1: 0.6104
 epoch: 10, train_loss: 0.7838, test_loss: 0.9765, test_f1: 0.5967
 epoch: 11, train_loss: 0.7752, test_loss: 0.9725, test_f1: 0.5853
 epoch: 12, train_loss: 0.7463, test_loss: 0.9668, test_f1: 0.5644
 epoch: 13, train_loss: 0.7481, test_loss: 0.9587, test_f1: 0.5943
 epoch: 14, train_loss: 0.7265, test_loss: 0.9637, test_f1: 0.5914
 epoch: 15, train_loss: 0.7113, test_loss: 0.9475, test_f1: 0.6138
 epoch: 16, train_loss: 0.7209, test_loss: 0.9812, test_f1: 0.5435
 epoch: 17, train_loss: 0.6896, test_loss: 1.0023, test_f1: 0.5899
 epoch: 18, train_loss: 0.6706, test_loss: 1.0063, test_f1: 0.5839
 epoch: 19, train_loss: 0.6802, test_loss: 1.0852, test_f1: 0.5528
 epoch: 20, train_loss: 0.6738, test_loss: 0.9729, test_f1: 0.5961
 epoch: 21, train_loss: 0.6763, test_loss: 0.9610, test_f1: 0.6037
 epoch: 22, train_loss: 0.6501, test_loss: 1.0098, test_f1: 0.5764
 epoch: 23, train_loss: 0.6562, test_loss: 1.0215, test_f1: 0.5671
 epoch: 24, train_loss: 0.6387, test_loss: 1.0548, test_f1: 0.5804
 epoch: 25, train_loss: 0.6260, test_loss: 0.9675, test_f1: 0.5994
 epoch: 26, train_loss: 0.6269, test_loss: 1.0275, test_f1: 0.5857
 epoch: 27, train_loss: 0.6154, test_loss: 1.0607, test_f1: 0.5934
 epoch: 28, train_loss: 0.5903, test_loss: 1.0321, test_f1: 0.5976
 epoch: 29, train_loss: 0.5972, test_loss: 1.0899, test_f1: 0.5811
 epoch: 30, train_loss: 0.5823, test_loss: 1.1461, test_f1: 0.5747
 epoch: 31, train_loss: 0.5899, test_loss: 1.1125, test_f1: 0.5644
 epoch: 32, train_loss: 0.5599, test_loss: 1.1589, test_f1: 0.5712
 epoch: 33, train_loss: 0.5697, test_loss: 1.0571, test_f1: 0.5764
 epoch: 34, train_loss: 0.5606, test_loss: 1.1516, test_f1: 0.5725
 epoch: 35, train_loss: 0.5533, test_loss: 1.0860, test_f1: 0.6103
 epoch: 36, train_loss: 0.5587, test_loss: 1.1705, test_f1: 0.5892
 epoch: 37, train_loss: 0.5505, test_loss: 1.0918, test_f1: 0.6197
 epoch: 38, train_loss: 0.5404, test_loss: 1.1282, test_f1: 0.5783
 epoch: 39, train_loss: 0.5489, test_loss: 1.1560, test_f1: 0.5739
 epoch: 40, train_loss: 0.5147, test_loss: 1.2071, test_f1: 0.5874
 epoch: 41, train_loss: 0.5242, test_loss: 1.3115, test_f1: 0.5862
 epoch: 42, train_loss: 0.4988, test_loss: 1.2320, test_f1: 0.5939
 epoch: 43, train_loss: 0.5127, test_loss: 1.1803, test_f1: 0.5705
 epoch: 44, train_loss: 0.5052, test_loss: 1.2114, test_f1: 0.5833
 epoch: 45, train_loss: 0.4767, test_loss: 1.3133, test_f1: 0.5753
 epoch: 46, train_loss: 0.4729, test_loss: 1.2520, test_f1: 0.6020
 epoch: 47, train_loss: 0.4787, test_loss: 1.3162, test_f1: 0.5942
 epoch: 48, train_loss: 0.4697, test_loss: 1.2011, test_f1: 0.6500
 epoch: 49, train_loss: 0.4755, test_loss: 1.2674, test_f1: 0.6084
 epoch: 50, train_loss: 0.4679, test_loss: 1.3742, test_f1: 0.5980
 epoch: 51, train_loss: 0.4423, test_loss: 1.2982, test_f1: 0.6184
 epoch: 52, train_loss: 0.4374, test_loss: 1.3194, test_f1: 0.6285
 epoch: 53, train_loss: 0.4469, test_loss: 1.3004, test_f1: 0.5964
 epoch: 54, train_loss: 0.4216, test_loss: 1.3651, test_f1: 0.6125
 epoch: 55, train_loss: 0.4257, test_loss: 1.3069, test_f1: 0.6087
 epoch: 56, train_loss: 0.4155, test_loss: 1.3225, test_f1: 0.6032
 epoch: 57, train_loss: 0.4052, test_loss: 1.4192, test_f1: 0.6055
 epoch: 58, train_loss: 0.4055, test_loss: 1.4133, test_f1: 0.6105
 epoch: 59, train_loss: 0.4056, test_loss: 1.3759, test_f1: 0.6003
 epoch: 60, train_loss: 0.4084, test_loss: 1.4517, test_f1: 0.6171
 epoch: 61, train_loss: 0.3883, test_loss: 1.4768, test_f1: 0.6129
 epoch: 62, train_loss: 0.3988, test_loss: 1.4347, test_f1: 0.5983
 epoch: 63, train_loss: 0.4151, test_loss: 1.5071, test_f1: 0.5987
 epoch: 64, train_loss: 0.3914, test_loss: 1.5064, test_f1: 0.6110
 epoch: 65, train_loss: 0.3962, test_loss: 1.5039, test_f1: 0.5957
 epoch: 66, train_loss: 0.3901, test_loss: 1.7136, test_f1: 0.6049
 epoch: 67, train_loss: 0.3639, test_loss: 1.6058, test_f1: 0.5994
 epoch: 68, train_loss: 0.3559, test_loss: 1.5621, test_f1: 0.5930
 epoch: 69, train_loss: 0.3640, test_loss: 1.7030, test_f1: 0.6119
 epoch: 70, train_loss: 0.3548, test_loss: 1.7409, test_f1: 0.5987
 epoch: 71, train_loss: 0.3731, test_loss: 1.6672, test_f1: 0.6055
 epoch: 72, train_loss: 0.3515, test_loss: 1.6667, test_f1: 0.5979
 epoch: 73, train_loss: 0.3609, test_loss: 1.7571, test_f1: 0.5989
 epoch: 74, train_loss: 0.3636, test_loss: 1.7918, test_f1: 0.5923
 epoch: 75, train_loss: 0.3463, test_loss: 1.7957, test_f1: 0.6063
 epoch: 76, train_loss: 0.3567, test_loss: 1.8318, test_f1: 0.6047
 epoch: 77, train_loss: 0.3536, test_loss: 1.7848, test_f1: 0.5965
 epoch: 78, train_loss: 0.3454, test_loss: 1.7704, test_f1: 0.5943
 epoch: 79, train_loss: 0.3513, test_loss: 1.9499, test_f1: 0.6061
 epoch: 80, train_loss: 0.3639, test_loss: 1.9849, test_f1: 0.6036
 epoch: 81, train_loss: 0.3288, test_loss: 1.9548, test_f1: 0.6046
 epoch: 82, train_loss: 0.3251, test_loss: 1.8451, test_f1: 0.6046
 epoch: 83, train_loss: 0.3328, test_loss: 2.1135, test_f1: 0.5974
 epoch: 84, train_loss: 0.3255, test_loss: 1.8455, test_f1: 0.5933
 epoch: 85, train_loss: 0.3054, test_loss: 1.9953, test_f1: 0.6028
 epoch: 86, train_loss: 0.3133, test_loss: 1.8853, test_f1: 0.5985
 epoch: 87, train_loss: 0.3252, test_loss: 1.9701, test_f1: 0.5904
 epoch: 88, train_loss: 0.3250, test_loss: 1.9813, test_f1: 0.6033
 epoch: 89, train_loss: 0.3166, test_loss: 2.1086, test_f1: 0.5794
 epoch: 90, train_loss: 0.3198, test_loss: 2.0836, test_f1: 0.5982
 epoch: 91, train_loss: 0.2982, test_loss: 2.1482, test_f1: 0.5882
 epoch: 92, train_loss: 0.3217, test_loss: 2.1567, test_f1: 0.5915
 epoch: 93, train_loss: 0.3041, test_loss: 2.1669, test_f1: 0.5977
 epoch: 94, train_loss: 0.3043, test_loss: 2.1515, test_f1: 0.5919
 epoch: 95, train_loss: 0.3011, test_loss: 2.1159, test_f1: 0.5842
 epoch: 96, train_loss: 0.2948, test_loss: 2.2226, test_f1: 0.5988
 epoch: 97, train_loss: 0.3037, test_loss: 2.3342, test_f1: 0.5709
 epoch: 98, train_loss: 0.2974, test_loss: 2.1136, test_f1: 0.5904
 epoch: 99, train_loss: 0.2756, test_loss: 2.1539, test_f1: 0.6174
##################ITERATION #4 ****************************************
 epoch: 0, train_loss: 1.1899, test_loss: 1.2088, test_f1: 0.3762
 epoch: 1, train_loss: 1.0743, test_loss: 1.1036, test_f1: 0.5246
 epoch: 2, train_loss: 1.0030, test_loss: 1.0537, test_f1: 0.5221
 epoch: 3, train_loss: 0.9789, test_loss: 1.0306, test_f1: 0.5317
 epoch: 4, train_loss: 0.9451, test_loss: 0.9971, test_f1: 0.5724
 epoch: 5, train_loss: 0.9146, test_loss: 1.0050, test_f1: 0.5141
 epoch: 6, train_loss: 0.8922, test_loss: 0.9796, test_f1: 0.5615
 epoch: 7, train_loss: 0.8747, test_loss: 0.9544, test_f1: 0.5600
 epoch: 8, train_loss: 0.8404, test_loss: 0.9833, test_f1: 0.5383
 epoch: 9, train_loss: 0.8194, test_loss: 0.9958, test_f1: 0.5475
 epoch: 10, train_loss: 0.8069, test_loss: 0.9837, test_f1: 0.5508
 epoch: 11, train_loss: 0.7925, test_loss: 0.9873, test_f1: 0.5757
 epoch: 12, train_loss: 0.7661, test_loss: 0.9604, test_f1: 0.5619
 epoch: 13, train_loss: 0.7529, test_loss: 0.9983, test_f1: 0.5503
 epoch: 14, train_loss: 0.7422, test_loss: 1.0533, test_f1: 0.5400
 epoch: 15, train_loss: 0.7378, test_loss: 0.9524, test_f1: 0.5781
 epoch: 16, train_loss: 0.7197, test_loss: 0.9596, test_f1: 0.5631
 epoch: 17, train_loss: 0.6969, test_loss: 1.0471, test_f1: 0.5583
 epoch: 18, train_loss: 0.7010, test_loss: 1.0583, test_f1: 0.5710
 epoch: 19, train_loss: 0.6928, test_loss: 1.0046, test_f1: 0.5565
 epoch: 20, train_loss: 0.6708, test_loss: 1.0988, test_f1: 0.5594
 epoch: 21, train_loss: 0.6667, test_loss: 1.0480, test_f1: 0.5386
 epoch: 22, train_loss: 0.6521, test_loss: 1.1277, test_f1: 0.5431
 epoch: 23, train_loss: 0.6494, test_loss: 1.0430, test_f1: 0.5380
 epoch: 24, train_loss: 0.6278, test_loss: 1.0879, test_f1: 0.5461
 epoch: 25, train_loss: 0.6218, test_loss: 1.1772, test_f1: 0.5498
 epoch: 26, train_loss: 0.6235, test_loss: 1.0410, test_f1: 0.5663
 epoch: 27, train_loss: 0.5985, test_loss: 1.1032, test_f1: 0.5799
 epoch: 28, train_loss: 0.6072, test_loss: 1.1519, test_f1: 0.5865
 epoch: 29, train_loss: 0.5995, test_loss: 1.1084, test_f1: 0.5591
 epoch: 30, train_loss: 0.5784, test_loss: 1.2693, test_f1: 0.5370
 epoch: 31, train_loss: 0.5776, test_loss: 1.1154, test_f1: 0.5751
 epoch: 32, train_loss: 0.5642, test_loss: 1.2235, test_f1: 0.5553
 epoch: 33, train_loss: 0.5539, test_loss: 1.2192, test_f1: 0.5644
 epoch: 34, train_loss: 0.5527, test_loss: 1.2273, test_f1: 0.5607
 epoch: 35, train_loss: 0.5418, test_loss: 1.3398, test_f1: 0.5669
 epoch: 36, train_loss: 0.5457, test_loss: 1.1972, test_f1: 0.5757
 epoch: 37, train_loss: 0.5504, test_loss: 1.3907, test_f1: 0.5886
 epoch: 38, train_loss: 0.5504, test_loss: 1.2004, test_f1: 0.5982
 epoch: 39, train_loss: 0.5286, test_loss: 1.3207, test_f1: 0.5914
 epoch: 40, train_loss: 0.5262, test_loss: 1.2733, test_f1: 0.5577
 epoch: 41, train_loss: 0.5366, test_loss: 1.3737, test_f1: 0.5892
 epoch: 42, train_loss: 0.4785, test_loss: 1.3354, test_f1: 0.5601
 epoch: 43, train_loss: 0.4987, test_loss: 1.3164, test_f1: 0.5891
 epoch: 44, train_loss: 0.4812, test_loss: 1.3021, test_f1: 0.6012
 epoch: 45, train_loss: 0.4849, test_loss: 1.4201, test_f1: 0.5736
 epoch: 46, train_loss: 0.4928, test_loss: 1.2811, test_f1: 0.5695
 epoch: 47, train_loss: 0.4780, test_loss: 1.3968, test_f1: 0.5991
 epoch: 48, train_loss: 0.4736, test_loss: 1.6930, test_f1: 0.5697
 epoch: 49, train_loss: 0.4397, test_loss: 1.4107, test_f1: 0.6124
 epoch: 50, train_loss: 0.4616, test_loss: 1.4837, test_f1: 0.5918
 epoch: 51, train_loss: 0.4400, test_loss: 1.3390, test_f1: 0.5994
 epoch: 52, train_loss: 0.4237, test_loss: 1.5770, test_f1: 0.5656
 epoch: 53, train_loss: 0.4097, test_loss: 1.5379, test_f1: 0.5917
 epoch: 54, train_loss: 0.4141, test_loss: 1.4710, test_f1: 0.5957
 epoch: 55, train_loss: 0.4089, test_loss: 1.5726, test_f1: 0.5725
 epoch: 56, train_loss: 0.4063, test_loss: 1.5397, test_f1: 0.5736
 epoch: 57, train_loss: 0.3963, test_loss: 1.5333, test_f1: 0.5603
 epoch: 58, train_loss: 0.4166, test_loss: 1.6072, test_f1: 0.5868
 epoch: 59, train_loss: 0.3988, test_loss: 1.7233, test_f1: 0.5833
 epoch: 60, train_loss: 0.3906, test_loss: 1.6452, test_f1: 0.5865
 epoch: 61, train_loss: 0.3802, test_loss: 1.6798, test_f1: 0.5950
 epoch: 62, train_loss: 0.3700, test_loss: 1.6787, test_f1: 0.5620
 epoch: 63, train_loss: 0.3823, test_loss: 1.6971, test_f1: 0.5586
 epoch: 64, train_loss: 0.3918, test_loss: 1.6547, test_f1: 0.5852
 epoch: 65, train_loss: 0.3693, test_loss: 1.5743, test_f1: 0.5778
 epoch: 66, train_loss: 0.3880, test_loss: 1.7249, test_f1: 0.5603
 epoch: 67, train_loss: 0.3657, test_loss: 1.7081, test_f1: 0.5683
 epoch: 68, train_loss: 0.3745, test_loss: 1.8089, test_f1: 0.5677
 epoch: 69, train_loss: 0.3639, test_loss: 1.8162, test_f1: 0.5822
 epoch: 70, train_loss: 0.3505, test_loss: 1.7476, test_f1: 0.5791
 epoch: 71, train_loss: 0.3532, test_loss: 1.7750, test_f1: 0.5808
 epoch: 72, train_loss: 0.3768, test_loss: 1.7923, test_f1: 0.5691
 epoch: 73, train_loss: 0.3463, test_loss: 1.7201, test_f1: 0.5833
 epoch: 74, train_loss: 0.3490, test_loss: 1.8153, test_f1: 0.5879
 epoch: 75, train_loss: 0.3565, test_loss: 1.8846, test_f1: 0.5576
 epoch: 76, train_loss: 0.3429, test_loss: 1.8131, test_f1: 0.5718
 epoch: 77, train_loss: 0.3262, test_loss: 1.8120, test_f1: 0.5785
 epoch: 78, train_loss: 0.3223, test_loss: 1.8050, test_f1: 0.5777
 epoch: 79, train_loss: 0.3215, test_loss: 2.0711, test_f1: 0.5672
 epoch: 80, train_loss: 0.3231, test_loss: 1.9164, test_f1: 0.5679
 epoch: 81, train_loss: 0.3341, test_loss: 2.0812, test_f1: 0.5583
 epoch: 82, train_loss: 0.3220, test_loss: 1.8728, test_f1: 0.5712
 epoch: 83, train_loss: 0.3272, test_loss: 1.9379, test_f1: 0.5783
 epoch: 84, train_loss: 0.3226, test_loss: 2.0362, test_f1: 0.5809
 epoch: 85, train_loss: 0.3129, test_loss: 2.0550, test_f1: 0.5769
 epoch: 86, train_loss: 0.3187, test_loss: 2.1581, test_f1: 0.5667
 epoch: 87, train_loss: 0.3019, test_loss: 1.9722, test_f1: 0.5721
 epoch: 88, train_loss: 0.3069, test_loss: 2.0039, test_f1: 0.5831
 epoch: 89, train_loss: 0.3012, test_loss: 2.0666, test_f1: 0.5648
 epoch: 90, train_loss: 0.3025, test_loss: 1.8920, test_f1: 0.5735
 epoch: 91, train_loss: 0.2916, test_loss: 2.0011, test_f1: 0.5715
 epoch: 92, train_loss: 0.2983, test_loss: 2.1737, test_f1: 0.5775
 epoch: 93, train_loss: 0.2859, test_loss: 2.1905, test_f1: 0.5729
 epoch: 94, train_loss: 0.2957, test_loss: 2.0241, test_f1: 0.5825
 epoch: 95, train_loss: 0.2927, test_loss: 2.1329, test_f1: 0.5630
 epoch: 96, train_loss: 0.2869, test_loss: 1.9604, test_f1: 0.5687
 epoch: 97, train_loss: 0.2792, test_loss: 2.1628, test_f1: 0.5682
 epoch: 98, train_loss: 0.2665, test_loss: 2.0758, test_f1: 0.5714
 epoch: 99, train_loss: 0.2705, test_loss: 2.0092, test_f1: 0.5836
##################ITERATION #5 ****************************************
 epoch: 0, train_loss: 1.1839, test_loss: 1.2621, test_f1: 0.2748
 epoch: 1, train_loss: 1.0680, test_loss: 1.0990, test_f1: 0.5049
 epoch: 2, train_loss: 1.0149, test_loss: 1.0740, test_f1: 0.5212
 epoch: 3, train_loss: 0.9949, test_loss: 1.0377, test_f1: 0.5648
 epoch: 4, train_loss: 0.9439, test_loss: 1.0317, test_f1: 0.5731
 epoch: 5, train_loss: 0.9196, test_loss: 1.0466, test_f1: 0.5592
 epoch: 6, train_loss: 0.8935, test_loss: 1.0362, test_f1: 0.5781
 epoch: 7, train_loss: 0.8666, test_loss: 1.0249, test_f1: 0.5937
 epoch: 8, train_loss: 0.8486, test_loss: 1.0184, test_f1: 0.6033
 epoch: 9, train_loss: 0.8246, test_loss: 1.0190, test_f1: 0.5950
 epoch: 10, train_loss: 0.8320, test_loss: 1.0249, test_f1: 0.5968
 epoch: 11, train_loss: 0.8001, test_loss: 1.0306, test_f1: 0.5744
 epoch: 12, train_loss: 0.8016, test_loss: 1.0358, test_f1: 0.5862
 epoch: 13, train_loss: 0.7761, test_loss: 0.9910, test_f1: 0.6424
 epoch: 14, train_loss: 0.7692, test_loss: 1.0192, test_f1: 0.6138
 epoch: 15, train_loss: 0.7494, test_loss: 1.0537, test_f1: 0.5399
 epoch: 16, train_loss: 0.7326, test_loss: 0.9983, test_f1: 0.6333
 epoch: 17, train_loss: 0.7278, test_loss: 1.0073, test_f1: 0.6380
 epoch: 18, train_loss: 0.7225, test_loss: 1.0409, test_f1: 0.5970
 epoch: 19, train_loss: 0.7060, test_loss: 1.0296, test_f1: 0.6239
 epoch: 20, train_loss: 0.7033, test_loss: 1.0300, test_f1: 0.6400
 epoch: 21, train_loss: 0.6884, test_loss: 1.0897, test_f1: 0.6193
 epoch: 22, train_loss: 0.6852, test_loss: 1.0430, test_f1: 0.6230
 epoch: 23, train_loss: 0.6797, test_loss: 1.0320, test_f1: 0.6190
 epoch: 24, train_loss: 0.6640, test_loss: 1.0088, test_f1: 0.6149
 epoch: 25, train_loss: 0.6669, test_loss: 1.1286, test_f1: 0.5811
 epoch: 26, train_loss: 0.6605, test_loss: 1.0031, test_f1: 0.6546
 epoch: 27, train_loss: 0.6410, test_loss: 1.0648, test_f1: 0.5900
 epoch: 28, train_loss: 0.6293, test_loss: 1.0978, test_f1: 0.5984
 epoch: 29, train_loss: 0.6111, test_loss: 1.0350, test_f1: 0.6260
 epoch: 30, train_loss: 0.6400, test_loss: 1.0351, test_f1: 0.6372
 epoch: 31, train_loss: 0.6095, test_loss: 1.0656, test_f1: 0.6432
 epoch: 32, train_loss: 0.5896, test_loss: 1.0597, test_f1: 0.6557
 epoch: 33, train_loss: 0.5886, test_loss: 1.0584, test_f1: 0.6185
 epoch: 34, train_loss: 0.5831, test_loss: 1.0734, test_f1: 0.5978
 epoch: 35, train_loss: 0.5591, test_loss: 1.0962, test_f1: 0.6098
 epoch: 36, train_loss: 0.5834, test_loss: 1.0596, test_f1: 0.6295
 epoch: 37, train_loss: 0.5670, test_loss: 1.0727, test_f1: 0.6477
 epoch: 38, train_loss: 0.5567, test_loss: 1.1185, test_f1: 0.6123
 epoch: 39, train_loss: 0.5611, test_loss: 1.0829, test_f1: 0.6331
 epoch: 40, train_loss: 0.5296, test_loss: 1.1113, test_f1: 0.6468
 epoch: 41, train_loss: 0.5555, test_loss: 1.1250, test_f1: 0.6269
 epoch: 42, train_loss: 0.5363, test_loss: 1.0929, test_f1: 0.6410
 epoch: 43, train_loss: 0.5494, test_loss: 1.1373, test_f1: 0.6380
 epoch: 44, train_loss: 0.5241, test_loss: 1.1070, test_f1: 0.6617
 epoch: 45, train_loss: 0.5247, test_loss: 1.1669, test_f1: 0.6361
 epoch: 46, train_loss: 0.5247, test_loss: 1.0710, test_f1: 0.6438
 epoch: 47, train_loss: 0.4861, test_loss: 1.1619, test_f1: 0.6138
 epoch: 48, train_loss: 0.4981, test_loss: 1.1284, test_f1: 0.6381
 epoch: 49, train_loss: 0.4987, test_loss: 1.1332, test_f1: 0.6407
 epoch: 50, train_loss: 0.4934, test_loss: 1.1916, test_f1: 0.6269
 epoch: 51, train_loss: 0.4448, test_loss: 1.2040, test_f1: 0.6332
 epoch: 52, train_loss: 0.4578, test_loss: 1.2508, test_f1: 0.6408
 epoch: 53, train_loss: 0.4563, test_loss: 1.2077, test_f1: 0.6372
 epoch: 54, train_loss: 0.4324, test_loss: 1.1890, test_f1: 0.6446
 epoch: 55, train_loss: 0.4600, test_loss: 1.2350, test_f1: 0.6343
 epoch: 56, train_loss: 0.4389, test_loss: 1.1829, test_f1: 0.6489
 epoch: 57, train_loss: 0.4174, test_loss: 1.2048, test_f1: 0.6447
 epoch: 58, train_loss: 0.4611, test_loss: 1.2038, test_f1: 0.6447
 epoch: 59, train_loss: 0.4288, test_loss: 1.2407, test_f1: 0.6443
 epoch: 60, train_loss: 0.4103, test_loss: 1.2828, test_f1: 0.6427
 epoch: 61, train_loss: 0.4227, test_loss: 1.2449, test_f1: 0.6387
 epoch: 62, train_loss: 0.4022, test_loss: 1.2843, test_f1: 0.6513
 epoch: 63, train_loss: 0.4325, test_loss: 1.2808, test_f1: 0.6410
 epoch: 64, train_loss: 0.4122, test_loss: 1.2734, test_f1: 0.6375
 epoch: 65, train_loss: 0.4002, test_loss: 1.3306, test_f1: 0.6389
 epoch: 66, train_loss: 0.4220, test_loss: 1.3674, test_f1: 0.6287
 epoch: 67, train_loss: 0.4171, test_loss: 1.3865, test_f1: 0.6253
 epoch: 68, train_loss: 0.3905, test_loss: 1.2842, test_f1: 0.6361
 epoch: 69, train_loss: 0.4065, test_loss: 1.3337, test_f1: 0.6602
 epoch: 70, train_loss: 0.3918, test_loss: 1.3150, test_f1: 0.6174
 epoch: 71, train_loss: 0.3849, test_loss: 1.2652, test_f1: 0.6733
 epoch: 72, train_loss: 0.4004, test_loss: 1.3127, test_f1: 0.6472
 epoch: 73, train_loss: 0.3769, test_loss: 1.3848, test_f1: 0.6276
 epoch: 74, train_loss: 0.3846, test_loss: 1.3512, test_f1: 0.6415
 epoch: 75, train_loss: 0.3864, test_loss: 1.3649, test_f1: 0.6496
 epoch: 76, train_loss: 0.3996, test_loss: 1.3902, test_f1: 0.6399
 epoch: 77, train_loss: 0.3837, test_loss: 1.4103, test_f1: 0.6354
 epoch: 78, train_loss: 0.3978, test_loss: 1.4096, test_f1: 0.6470
 epoch: 79, train_loss: 0.3766, test_loss: 1.3813, test_f1: 0.6271
 epoch: 80, train_loss: 0.3800, test_loss: 1.4698, test_f1: 0.6411
 epoch: 81, train_loss: 0.3602, test_loss: 1.4149, test_f1: 0.6286
 epoch: 82, train_loss: 0.3733, test_loss: 1.4140, test_f1: 0.6506
 epoch: 83, train_loss: 0.3476, test_loss: 1.4354, test_f1: 0.6464
 epoch: 84, train_loss: 0.3419, test_loss: 1.4894, test_f1: 0.6237
 epoch: 85, train_loss: 0.3295, test_loss: 1.4461, test_f1: 0.6434
 epoch: 86, train_loss: 0.3354, test_loss: 1.4539, test_f1: 0.6439
 epoch: 87, train_loss: 0.3336, test_loss: 1.4999, test_f1: 0.6397
 epoch: 88, train_loss: 0.3384, test_loss: 1.4521, test_f1: 0.6407
 epoch: 89, train_loss: 0.3449, test_loss: 1.4224, test_f1: 0.6490
 epoch: 90, train_loss: 0.3573, test_loss: 1.4743, test_f1: 0.6320
 epoch: 91, train_loss: 0.3415, test_loss: 1.5207, test_f1: 0.6639
 epoch: 92, train_loss: 0.3375, test_loss: 1.4189, test_f1: 0.6335
 epoch: 93, train_loss: 0.3482, test_loss: 1.4578, test_f1: 0.6489
 epoch: 94, train_loss: 0.3182, test_loss: 1.4651, test_f1: 0.6338
 epoch: 95, train_loss: 0.3282, test_loss: 1.4422, test_f1: 0.6619
 epoch: 96, train_loss: 0.3080, test_loss: 1.5461, test_f1: 0.6334
 epoch: 97, train_loss: 0.3260, test_loss: 1.5271, test_f1: 0.6595
 epoch: 98, train_loss: 0.3146, test_loss: 1.5383, test_f1: 0.6511
 epoch: 99, train_loss: 0.3050, test_loss: 1.4941, test_f1: 0.6653
##################ITERATION #6 ****************************************
 epoch: 0, train_loss: 1.2246, test_loss: 1.2339, test_f1: 0.4411
 epoch: 1, train_loss: 1.0719, test_loss: 1.1350, test_f1: 0.5040
 epoch: 2, train_loss: 1.0377, test_loss: 1.0987, test_f1: 0.5331
 epoch: 3, train_loss: 0.9822, test_loss: 1.0591, test_f1: 0.5449
 epoch: 4, train_loss: 0.9650, test_loss: 1.0294, test_f1: 0.5411
 epoch: 5, train_loss: 0.9267, test_loss: 1.0185, test_f1: 0.5595
 epoch: 6, train_loss: 0.9005, test_loss: 0.9845, test_f1: 0.5814
 epoch: 7, train_loss: 0.8884, test_loss: 0.9784, test_f1: 0.5724
 epoch: 8, train_loss: 0.8763, test_loss: 0.9884, test_f1: 0.5636
 epoch: 9, train_loss: 0.8311, test_loss: 0.9694, test_f1: 0.5772
 epoch: 10, train_loss: 0.8139, test_loss: 0.9857, test_f1: 0.5669
 epoch: 11, train_loss: 0.8186, test_loss: 0.9569, test_f1: 0.5891
 epoch: 12, train_loss: 0.8078, test_loss: 0.9604, test_f1: 0.6078
 epoch: 13, train_loss: 0.7900, test_loss: 0.9422, test_f1: 0.6121
 epoch: 14, train_loss: 0.7717, test_loss: 0.9512, test_f1: 0.6115
 epoch: 15, train_loss: 0.7609, test_loss: 0.9599, test_f1: 0.5981
 epoch: 16, train_loss: 0.7413, test_loss: 0.9639, test_f1: 0.6281
 epoch: 17, train_loss: 0.7163, test_loss: 0.9470, test_f1: 0.6099
 epoch: 18, train_loss: 0.7213, test_loss: 0.9606, test_f1: 0.5984
 epoch: 19, train_loss: 0.6986, test_loss: 0.9488, test_f1: 0.6507
 epoch: 20, train_loss: 0.7030, test_loss: 0.9607, test_f1: 0.6138
 epoch: 21, train_loss: 0.6939, test_loss: 1.0118, test_f1: 0.6329
 epoch: 22, train_loss: 0.6839, test_loss: 0.9846, test_f1: 0.6155
 epoch: 23, train_loss: 0.6836, test_loss: 0.9489, test_f1: 0.6114
 epoch: 24, train_loss: 0.6550, test_loss: 0.9560, test_f1: 0.6380
 epoch: 25, train_loss: 0.6626, test_loss: 0.9471, test_f1: 0.6235
 epoch: 26, train_loss: 0.6520, test_loss: 0.9278, test_f1: 0.6049
 epoch: 27, train_loss: 0.6484, test_loss: 1.0206, test_f1: 0.6168
 epoch: 28, train_loss: 0.6145, test_loss: 0.9646, test_f1: 0.5963
 epoch: 29, train_loss: 0.6361, test_loss: 1.0306, test_f1: 0.6353
 epoch: 30, train_loss: 0.6043, test_loss: 0.9828, test_f1: 0.6548
 epoch: 31, train_loss: 0.6010, test_loss: 1.0433, test_f1: 0.6137
 epoch: 32, train_loss: 0.5968, test_loss: 0.9661, test_f1: 0.6239
 epoch: 33, train_loss: 0.5907, test_loss: 1.0344, test_f1: 0.6331
 epoch: 34, train_loss: 0.5697, test_loss: 1.0185, test_f1: 0.6224
 epoch: 35, train_loss: 0.5594, test_loss: 1.1153, test_f1: 0.6236
 epoch: 36, train_loss: 0.5753, test_loss: 1.0703, test_f1: 0.6433
 epoch: 37, train_loss: 0.5704, test_loss: 1.0753, test_f1: 0.6433
 epoch: 38, train_loss: 0.5487, test_loss: 1.0434, test_f1: 0.6438
 epoch: 39, train_loss: 0.5523, test_loss: 1.1546, test_f1: 0.6502
 epoch: 40, train_loss: 0.5532, test_loss: 1.0806, test_f1: 0.6535
 epoch: 41, train_loss: 0.5481, test_loss: 1.1820, test_f1: 0.6103
 epoch: 42, train_loss: 0.5319, test_loss: 1.1176, test_f1: 0.6636
 epoch: 43, train_loss: 0.5326, test_loss: 1.0958, test_f1: 0.6347
 epoch: 44, train_loss: 0.5258, test_loss: 1.1331, test_f1: 0.6383
 epoch: 45, train_loss: 0.4992, test_loss: 1.1295, test_f1: 0.6542
 epoch: 46, train_loss: 0.4982, test_loss: 1.0196, test_f1: 0.6625
 epoch: 47, train_loss: 0.5032, test_loss: 1.1264, test_f1: 0.6373
 epoch: 48, train_loss: 0.5070, test_loss: 1.2167, test_f1: 0.6170
 epoch: 49, train_loss: 0.4900, test_loss: 1.3130, test_f1: 0.6025
 epoch: 50, train_loss: 0.4814, test_loss: 1.1823, test_f1: 0.6109
 epoch: 51, train_loss: 0.4662, test_loss: 1.1612, test_f1: 0.6201
 epoch: 52, train_loss: 0.4491, test_loss: 1.1780, test_f1: 0.6366
 epoch: 53, train_loss: 0.4533, test_loss: 1.1312, test_f1: 0.6611
 epoch: 54, train_loss: 0.4476, test_loss: 1.1581, test_f1: 0.6671
 epoch: 55, train_loss: 0.4723, test_loss: 1.1257, test_f1: 0.6490
 epoch: 56, train_loss: 0.4355, test_loss: 1.1283, test_f1: 0.6579
 epoch: 57, train_loss: 0.4344, test_loss: 1.1842, test_f1: 0.6721
 epoch: 58, train_loss: 0.4292, test_loss: 1.2245, test_f1: 0.6378
 epoch: 59, train_loss: 0.4323, test_loss: 1.1801, test_f1: 0.6542
 epoch: 60, train_loss: 0.4062, test_loss: 1.2039, test_f1: 0.6477
 epoch: 61, train_loss: 0.4101, test_loss: 1.2113, test_f1: 0.6818
 epoch: 62, train_loss: 0.4128, test_loss: 1.2163, test_f1: 0.6282
 epoch: 63, train_loss: 0.4244, test_loss: 1.2383, test_f1: 0.6447
 epoch: 64, train_loss: 0.4103, test_loss: 1.2439, test_f1: 0.6399
 epoch: 65, train_loss: 0.3903, test_loss: 1.1909, test_f1: 0.6661
 epoch: 66, train_loss: 0.4094, test_loss: 1.2335, test_f1: 0.6641
 epoch: 67, train_loss: 0.3888, test_loss: 1.2680, test_f1: 0.6331
 epoch: 68, train_loss: 0.3764, test_loss: 1.2610, test_f1: 0.6732
 epoch: 69, train_loss: 0.3691, test_loss: 1.2442, test_f1: 0.6466
 epoch: 70, train_loss: 0.3913, test_loss: 1.2711, test_f1: 0.6415
 epoch: 71, train_loss: 0.3748, test_loss: 1.3380, test_f1: 0.6248
 epoch: 72, train_loss: 0.4139, test_loss: 1.3951, test_f1: 0.6022
 epoch: 73, train_loss: 0.3918, test_loss: 1.3815, test_f1: 0.6227
 epoch: 74, train_loss: 0.3774, test_loss: 1.2878, test_f1: 0.6584
 epoch: 75, train_loss: 0.3846, test_loss: 1.2531, test_f1: 0.6626
 epoch: 76, train_loss: 0.3788, test_loss: 1.2991, test_f1: 0.6547
 epoch: 77, train_loss: 0.3809, test_loss: 1.2616, test_f1: 0.6518
 epoch: 78, train_loss: 0.3715, test_loss: 1.3154, test_f1: 0.6674
 epoch: 79, train_loss: 0.3670, test_loss: 1.3245, test_f1: 0.6439
 epoch: 80, train_loss: 0.3703, test_loss: 1.4500, test_f1: 0.6195
 epoch: 81, train_loss: 0.3610, test_loss: 1.5014, test_f1: 0.6159
 epoch: 82, train_loss: 0.3918, test_loss: 1.3555, test_f1: 0.6409
 epoch: 83, train_loss: 0.3598, test_loss: 1.4087, test_f1: 0.6227
 epoch: 84, train_loss: 0.3629, test_loss: 1.3657, test_f1: 0.6418
 epoch: 85, train_loss: 0.3528, test_loss: 1.3516, test_f1: 0.6191
 epoch: 86, train_loss: 0.3540, test_loss: 1.4259, test_f1: 0.6271
 epoch: 87, train_loss: 0.3514, test_loss: 1.4881, test_f1: 0.6536
 epoch: 88, train_loss: 0.3438, test_loss: 1.4259, test_f1: 0.6416
 epoch: 89, train_loss: 0.3435, test_loss: 1.4327, test_f1: 0.6332
 epoch: 90, train_loss: 0.3538, test_loss: 1.4185, test_f1: 0.6520
 epoch: 91, train_loss: 0.3278, test_loss: 1.4729, test_f1: 0.6423
 epoch: 92, train_loss: 0.3290, test_loss: 1.5067, test_f1: 0.6356
 epoch: 93, train_loss: 0.3258, test_loss: 1.4846, test_f1: 0.6335
 epoch: 94, train_loss: 0.3263, test_loss: 1.4107, test_f1: 0.6471
 epoch: 95, train_loss: 0.3258, test_loss: 1.4621, test_f1: 0.6382
 epoch: 96, train_loss: 0.3478, test_loss: 1.4839, test_f1: 0.6424
 epoch: 97, train_loss: 0.3231, test_loss: 1.5695, test_f1: 0.6577
 epoch: 98, train_loss: 0.3268, test_loss: 1.5144, test_f1: 0.6075
 epoch: 99, train_loss: 0.3199, test_loss: 1.5779, test_f1: 0.6161
##################ITERATION #7 ****************************************
 epoch: 0, train_loss: 1.2289, test_loss: 1.2737, test_f1: 0.2169
 epoch: 1, train_loss: 1.0632, test_loss: 1.1469, test_f1: 0.5434
 epoch: 2, train_loss: 1.0023, test_loss: 1.1293, test_f1: 0.5289
 epoch: 3, train_loss: 0.9860, test_loss: 1.0710, test_f1: 0.5356
 epoch: 4, train_loss: 0.9587, test_loss: 1.0862, test_f1: 0.5269
 epoch: 5, train_loss: 0.9388, test_loss: 1.0632, test_f1: 0.5453
 epoch: 6, train_loss: 0.9086, test_loss: 1.0881, test_f1: 0.5419
 epoch: 7, train_loss: 0.8722, test_loss: 1.0509, test_f1: 0.5255
 epoch: 8, train_loss: 0.8518, test_loss: 1.0808, test_f1: 0.5537
 epoch: 9, train_loss: 0.8524, test_loss: 1.0752, test_f1: 0.5649
 epoch: 10, train_loss: 0.8230, test_loss: 1.0594, test_f1: 0.5283
 epoch: 11, train_loss: 0.8012, test_loss: 1.0355, test_f1: 0.5734
 epoch: 12, train_loss: 0.7716, test_loss: 1.0070, test_f1: 0.5695
 epoch: 13, train_loss: 0.7619, test_loss: 1.0471, test_f1: 0.5311
 epoch: 14, train_loss: 0.7513, test_loss: 1.0407, test_f1: 0.5627
 epoch: 15, train_loss: 0.7463, test_loss: 1.0296, test_f1: 0.5700
 epoch: 16, train_loss: 0.7324, test_loss: 1.0872, test_f1: 0.5589
 epoch: 17, train_loss: 0.7253, test_loss: 1.1347, test_f1: 0.5716
 epoch: 18, train_loss: 0.7175, test_loss: 1.0969, test_f1: 0.5485
 epoch: 19, train_loss: 0.7047, test_loss: 1.1132, test_f1: 0.5613
 epoch: 20, train_loss: 0.6822, test_loss: 1.1524, test_f1: 0.5788
 epoch: 21, train_loss: 0.6804, test_loss: 1.1121, test_f1: 0.5960
 epoch: 22, train_loss: 0.6737, test_loss: 1.1418, test_f1: 0.5788
 epoch: 23, train_loss: 0.6722, test_loss: 1.2039, test_f1: 0.5585
 epoch: 24, train_loss: 0.6604, test_loss: 1.1144, test_f1: 0.6168
 epoch: 25, train_loss: 0.6600, test_loss: 1.1571, test_f1: 0.5595
 epoch: 26, train_loss: 0.6310, test_loss: 1.2028, test_f1: 0.5700
 epoch: 27, train_loss: 0.6301, test_loss: 1.1217, test_f1: 0.5830
 epoch: 28, train_loss: 0.6281, test_loss: 1.2263, test_f1: 0.5882
 epoch: 29, train_loss: 0.6060, test_loss: 1.2003, test_f1: 0.5841
 epoch: 30, train_loss: 0.6183, test_loss: 1.2096, test_f1: 0.6047
 epoch: 31, train_loss: 0.5976, test_loss: 1.2613, test_f1: 0.5911
 epoch: 32, train_loss: 0.6168, test_loss: 1.2331, test_f1: 0.6016
 epoch: 33, train_loss: 0.5820, test_loss: 1.2001, test_f1: 0.6019
 epoch: 34, train_loss: 0.5753, test_loss: 1.2908, test_f1: 0.6247
 epoch: 35, train_loss: 0.5640, test_loss: 1.1948, test_f1: 0.6207
 epoch: 36, train_loss: 0.5685, test_loss: 1.2851, test_f1: 0.5953
 epoch: 37, train_loss: 0.5449, test_loss: 1.2135, test_f1: 0.6367
 epoch: 38, train_loss: 0.5485, test_loss: 1.2679, test_f1: 0.6213
 epoch: 39, train_loss: 0.5343, test_loss: 1.2486, test_f1: 0.6411
 epoch: 40, train_loss: 0.5454, test_loss: 1.3028, test_f1: 0.6074
 epoch: 41, train_loss: 0.5254, test_loss: 1.2803, test_f1: 0.6160
 epoch: 42, train_loss: 0.5290, test_loss: 1.3045, test_f1: 0.6013
 epoch: 43, train_loss: 0.5086, test_loss: 1.2659, test_f1: 0.6151
 epoch: 44, train_loss: 0.5113, test_loss: 1.2694, test_f1: 0.6502
 epoch: 45, train_loss: 0.5079, test_loss: 1.2763, test_f1: 0.6270
 epoch: 46, train_loss: 0.4917, test_loss: 1.4473, test_f1: 0.6021
 epoch: 47, train_loss: 0.5050, test_loss: 1.4050, test_f1: 0.5868
 epoch: 48, train_loss: 0.4896, test_loss: 1.4319, test_f1: 0.6075
 epoch: 49, train_loss: 0.4652, test_loss: 1.4242, test_f1: 0.6216
 epoch: 50, train_loss: 0.4841, test_loss: 1.3890, test_f1: 0.6438
 epoch: 51, train_loss: 0.4595, test_loss: 1.4287, test_f1: 0.6262
 epoch: 52, train_loss: 0.4663, test_loss: 1.4310, test_f1: 0.6291
 epoch: 53, train_loss: 0.4372, test_loss: 1.4687, test_f1: 0.5911
 epoch: 54, train_loss: 0.4401, test_loss: 1.4300, test_f1: 0.6243
 epoch: 55, train_loss: 0.4416, test_loss: 1.5514, test_f1: 0.6057
 epoch: 56, train_loss: 0.4324, test_loss: 1.4964, test_f1: 0.6099
 epoch: 57, train_loss: 0.4172, test_loss: 1.5019, test_f1: 0.6210
 epoch: 58, train_loss: 0.4295, test_loss: 1.5022, test_f1: 0.6015
 epoch: 59, train_loss: 0.4380, test_loss: 1.5289, test_f1: 0.5906
 epoch: 60, train_loss: 0.4043, test_loss: 1.5578, test_f1: 0.6017
 epoch: 61, train_loss: 0.3996, test_loss: 1.4901, test_f1: 0.6372
 epoch: 62, train_loss: 0.4024, test_loss: 1.5679, test_f1: 0.6219
 epoch: 63, train_loss: 0.4074, test_loss: 1.5132, test_f1: 0.6286
 epoch: 64, train_loss: 0.4121, test_loss: 1.5602, test_f1: 0.6335
 epoch: 65, train_loss: 0.3862, test_loss: 1.4999, test_f1: 0.6423
 epoch: 66, train_loss: 0.3788, test_loss: 1.5928, test_f1: 0.6093
 epoch: 67, train_loss: 0.4041, test_loss: 1.6717, test_f1: 0.5987
 epoch: 68, train_loss: 0.3804, test_loss: 1.5639, test_f1: 0.6287
 epoch: 69, train_loss: 0.3831, test_loss: 1.6388, test_f1: 0.6214
 epoch: 70, train_loss: 0.3842, test_loss: 1.6641, test_f1: 0.6050
 epoch: 71, train_loss: 0.3708, test_loss: 1.6839, test_f1: 0.5880
 epoch: 72, train_loss: 0.3858, test_loss: 1.6236, test_f1: 0.6296
 epoch: 73, train_loss: 0.3841, test_loss: 1.5603, test_f1: 0.6434
 epoch: 74, train_loss: 0.3791, test_loss: 1.6373, test_f1: 0.6090
 epoch: 75, train_loss: 0.3660, test_loss: 1.6668, test_f1: 0.6213
 epoch: 76, train_loss: 0.3626, test_loss: 1.6268, test_f1: 0.6349
 epoch: 77, train_loss: 0.3577, test_loss: 1.6068, test_f1: 0.6083
 epoch: 78, train_loss: 0.3699, test_loss: 1.7156, test_f1: 0.6100
 epoch: 79, train_loss: 0.3465, test_loss: 1.6389, test_f1: 0.6282
 epoch: 80, train_loss: 0.3595, test_loss: 1.7333, test_f1: 0.6289
 epoch: 81, train_loss: 0.3357, test_loss: 1.7095, test_f1: 0.6075
 epoch: 82, train_loss: 0.3456, test_loss: 1.6911, test_f1: 0.5962
 epoch: 83, train_loss: 0.3441, test_loss: 1.7519, test_f1: 0.6355
 epoch: 84, train_loss: 0.3516, test_loss: 1.7756, test_f1: 0.6332
 epoch: 85, train_loss: 0.3232, test_loss: 1.7091, test_f1: 0.6366
 epoch: 86, train_loss: 0.3557, test_loss: 1.7904, test_f1: 0.5913
 epoch: 87, train_loss: 0.3368, test_loss: 1.7820, test_f1: 0.6209
 epoch: 88, train_loss: 0.3300, test_loss: 1.7750, test_f1: 0.6235
 epoch: 89, train_loss: 0.3294, test_loss: 1.8201, test_f1: 0.6308
 epoch: 90, train_loss: 0.3347, test_loss: 1.8415, test_f1: 0.6190
 epoch: 91, train_loss: 0.3233, test_loss: 1.8731, test_f1: 0.6027
 epoch: 92, train_loss: 0.3376, test_loss: 1.8385, test_f1: 0.6363
 epoch: 93, train_loss: 0.3332, test_loss: 1.8768, test_f1: 0.6463
 epoch: 94, train_loss: 0.3194, test_loss: 1.8684, test_f1: 0.6150
 epoch: 95, train_loss: 0.3161, test_loss: 1.9377, test_f1: 0.6142
 epoch: 96, train_loss: 0.3420, test_loss: 1.9564, test_f1: 0.6048
 epoch: 97, train_loss: 0.3078, test_loss: 1.8718, test_f1: 0.6378
 epoch: 98, train_loss: 0.3077, test_loss: 1.8724, test_f1: 0.6656
 epoch: 99, train_loss: 0.3261, test_loss: 1.9526, test_f1: 0.6264
##################ITERATION #8 ****************************************
 epoch: 0, train_loss: 1.2959, test_loss: 1.2478, test_f1: 0.3161
 epoch: 1, train_loss: 1.1045, test_loss: 1.0882, test_f1: 0.4751
 epoch: 2, train_loss: 1.0211, test_loss: 1.0731, test_f1: 0.5298
 epoch: 3, train_loss: 1.0118, test_loss: 1.0713, test_f1: 0.5582
 epoch: 4, train_loss: 0.9619, test_loss: 1.0397, test_f1: 0.5511
 epoch: 5, train_loss: 0.9285, test_loss: 1.0599, test_f1: 0.5446
 epoch: 6, train_loss: 0.9052, test_loss: 1.0179, test_f1: 0.5946
 epoch: 7, train_loss: 0.8832, test_loss: 1.0280, test_f1: 0.5641
 epoch: 8, train_loss: 0.8630, test_loss: 1.0284, test_f1: 0.5818
 epoch: 9, train_loss: 0.8295, test_loss: 1.0163, test_f1: 0.5767
 epoch: 10, train_loss: 0.8254, test_loss: 1.0160, test_f1: 0.5938
 epoch: 11, train_loss: 0.8040, test_loss: 1.0206, test_f1: 0.5763
 epoch: 12, train_loss: 0.8157, test_loss: 1.0343, test_f1: 0.5947
 epoch: 13, train_loss: 0.7846, test_loss: 1.0071, test_f1: 0.5911
 epoch: 14, train_loss: 0.7909, test_loss: 1.0213, test_f1: 0.5870
 epoch: 15, train_loss: 0.7708, test_loss: 0.9885, test_f1: 0.5855
 epoch: 16, train_loss: 0.7393, test_loss: 1.0087, test_f1: 0.6026
 epoch: 17, train_loss: 0.7447, test_loss: 1.0561, test_f1: 0.5976
 epoch: 18, train_loss: 0.7146, test_loss: 1.0589, test_f1: 0.5964
 epoch: 19, train_loss: 0.7273, test_loss: 1.0263, test_f1: 0.6230
 epoch: 20, train_loss: 0.7370, test_loss: 1.0406, test_f1: 0.5925
 epoch: 21, train_loss: 0.6926, test_loss: 1.0540, test_f1: 0.5859
 epoch: 22, train_loss: 0.6956, test_loss: 1.0458, test_f1: 0.5957
 epoch: 23, train_loss: 0.6868, test_loss: 1.0348, test_f1: 0.5726
 epoch: 24, train_loss: 0.6830, test_loss: 1.0606, test_f1: 0.6012
 epoch: 25, train_loss: 0.6737, test_loss: 1.0912, test_f1: 0.5714
 epoch: 26, train_loss: 0.6512, test_loss: 1.0568, test_f1: 0.5911
 epoch: 27, train_loss: 0.6593, test_loss: 1.1409, test_f1: 0.5843
 epoch: 28, train_loss: 0.6414, test_loss: 1.0591, test_f1: 0.6118
 epoch: 29, train_loss: 0.6304, test_loss: 1.0754, test_f1: 0.6188
 epoch: 30, train_loss: 0.6156, test_loss: 1.0818, test_f1: 0.6188
 epoch: 31, train_loss: 0.6173, test_loss: 1.1172, test_f1: 0.6236
 epoch: 32, train_loss: 0.6158, test_loss: 1.1278, test_f1: 0.6223
 epoch: 33, train_loss: 0.5851, test_loss: 1.1403, test_f1: 0.6140
 epoch: 34, train_loss: 0.5985, test_loss: 1.1609, test_f1: 0.6112
 epoch: 35, train_loss: 0.5817, test_loss: 1.1516, test_f1: 0.6118
 epoch: 36, train_loss: 0.5852, test_loss: 1.1866, test_f1: 0.6061
 epoch: 37, train_loss: 0.5719, test_loss: 1.1810, test_f1: 0.6135
 epoch: 38, train_loss: 0.5567, test_loss: 1.1637, test_f1: 0.5665
 epoch: 39, train_loss: 0.5561, test_loss: 1.2377, test_f1: 0.5940
 epoch: 40, train_loss: 0.5551, test_loss: 1.2386, test_f1: 0.5785
 epoch: 41, train_loss: 0.5575, test_loss: 1.1144, test_f1: 0.6338
 epoch: 42, train_loss: 0.5632, test_loss: 1.1561, test_f1: 0.6206
 epoch: 43, train_loss: 0.5069, test_loss: 1.1969, test_f1: 0.6117
 epoch: 44, train_loss: 0.5219, test_loss: 1.2547, test_f1: 0.6013
 epoch: 45, train_loss: 0.5226, test_loss: 1.2136, test_f1: 0.6456
 epoch: 46, train_loss: 0.5061, test_loss: 1.2129, test_f1: 0.6129
 epoch: 47, train_loss: 0.5039, test_loss: 1.2874, test_f1: 0.6032
 epoch: 48, train_loss: 0.4973, test_loss: 1.3207, test_f1: 0.5868
 epoch: 49, train_loss: 0.4896, test_loss: 1.3481, test_f1: 0.5808
 epoch: 50, train_loss: 0.4992, test_loss: 1.3962, test_f1: 0.6100
 epoch: 51, train_loss: 0.4603, test_loss: 1.3292, test_f1: 0.6080
 epoch: 52, train_loss: 0.4537, test_loss: 1.3221, test_f1: 0.6005
 epoch: 53, train_loss: 0.4388, test_loss: 1.3226, test_f1: 0.6080
 epoch: 54, train_loss: 0.4467, test_loss: 1.3998, test_f1: 0.6124
 epoch: 55, train_loss: 0.4431, test_loss: 1.3763, test_f1: 0.6013
 epoch: 56, train_loss: 0.4464, test_loss: 1.3713, test_f1: 0.6009
 epoch: 57, train_loss: 0.4279, test_loss: 1.4115, test_f1: 0.5882
 epoch: 58, train_loss: 0.4255, test_loss: 1.3881, test_f1: 0.6197
 epoch: 59, train_loss: 0.4334, test_loss: 1.3952, test_f1: 0.5997
 epoch: 60, train_loss: 0.4378, test_loss: 1.5163, test_f1: 0.5683
 epoch: 61, train_loss: 0.4372, test_loss: 1.3761, test_f1: 0.5981
 epoch: 62, train_loss: 0.4244, test_loss: 1.4404, test_f1: 0.5936
 epoch: 63, train_loss: 0.4086, test_loss: 1.4315, test_f1: 0.6092
 epoch: 64, train_loss: 0.4158, test_loss: 1.4611, test_f1: 0.6178
 epoch: 65, train_loss: 0.4030, test_loss: 1.4215, test_f1: 0.6199
 epoch: 66, train_loss: 0.3962, test_loss: 1.4457, test_f1: 0.6187
 epoch: 67, train_loss: 0.4163, test_loss: 1.4863, test_f1: 0.6019
 epoch: 68, train_loss: 0.3996, test_loss: 1.4625, test_f1: 0.6246
 epoch: 69, train_loss: 0.3912, test_loss: 1.4672, test_f1: 0.5981
 epoch: 70, train_loss: 0.3984, test_loss: 1.4649, test_f1: 0.6247
 epoch: 71, train_loss: 0.3686, test_loss: 1.4837, test_f1: 0.5957
 epoch: 72, train_loss: 0.3911, test_loss: 1.5231, test_f1: 0.6022
 epoch: 73, train_loss: 0.3761, test_loss: 1.5257, test_f1: 0.6277
 epoch: 74, train_loss: 0.3829, test_loss: 1.5324, test_f1: 0.6164
 epoch: 75, train_loss: 0.4019, test_loss: 1.5418, test_f1: 0.5841
 epoch: 76, train_loss: 0.3732, test_loss: 1.6222, test_f1: 0.5922
 epoch: 77, train_loss: 0.3635, test_loss: 1.5151, test_f1: 0.6158
 epoch: 78, train_loss: 0.3950, test_loss: 1.5070, test_f1: 0.6105
 epoch: 79, train_loss: 0.3655, test_loss: 1.6111, test_f1: 0.5988
 epoch: 80, train_loss: 0.3497, test_loss: 1.5395, test_f1: 0.6381
 epoch: 81, train_loss: 0.3468, test_loss: 1.6210, test_f1: 0.6175
 epoch: 82, train_loss: 0.3686, test_loss: 1.5695, test_f1: 0.5857
 epoch: 83, train_loss: 0.3438, test_loss: 1.5929, test_f1: 0.5996
 epoch: 84, train_loss: 0.3782, test_loss: 1.5774, test_f1: 0.6152
 epoch: 85, train_loss: 0.3507, test_loss: 1.5792, test_f1: 0.6403
 epoch: 86, train_loss: 0.3376, test_loss: 1.6594, test_f1: 0.6179
 epoch: 87, train_loss: 0.3462, test_loss: 1.5536, test_f1: 0.6402
 epoch: 88, train_loss: 0.3530, test_loss: 1.6762, test_f1: 0.5942
 epoch: 89, train_loss: 0.3554, test_loss: 1.5952, test_f1: 0.6399
 epoch: 90, train_loss: 0.3499, test_loss: 1.6744, test_f1: 0.6213
 epoch: 91, train_loss: 0.3443, test_loss: 1.6563, test_f1: 0.6223
 epoch: 92, train_loss: 0.3536, test_loss: 1.7758, test_f1: 0.5763
 epoch: 93, train_loss: 0.3343, test_loss: 1.7224, test_f1: 0.5920
 epoch: 94, train_loss: 0.3360, test_loss: 1.7836, test_f1: 0.5918
 epoch: 95, train_loss: 0.3305, test_loss: 1.6979, test_f1: 0.6038
 epoch: 96, train_loss: 0.2945, test_loss: 1.7440, test_f1: 0.5924
 epoch: 97, train_loss: 0.3427, test_loss: 1.7245, test_f1: 0.6269
 epoch: 98, train_loss: 0.3109, test_loss: 1.7397, test_f1: 0.6013
 epoch: 99, train_loss: 0.3171, test_loss: 1.7376, test_f1: 0.6262
##################ITERATION #9 ****************************************
 epoch: 0, train_loss: 1.2494, test_loss: 1.2543, test_f1: 0.3317
 epoch: 1, train_loss: 1.0412, test_loss: 1.1061, test_f1: 0.5407
 epoch: 2, train_loss: 0.9854, test_loss: 1.0389, test_f1: 0.5750
 epoch: 3, train_loss: 0.9456, test_loss: 1.0090, test_f1: 0.5853
 epoch: 4, train_loss: 0.9261, test_loss: 1.0070, test_f1: 0.5579
 epoch: 5, train_loss: 0.8977, test_loss: 0.9877, test_f1: 0.5801
 epoch: 6, train_loss: 0.8856, test_loss: 0.9846, test_f1: 0.5659
 epoch: 7, train_loss: 0.8547, test_loss: 1.0203, test_f1: 0.5407
 epoch: 8, train_loss: 0.8381, test_loss: 0.9649, test_f1: 0.5869
 epoch: 9, train_loss: 0.8276, test_loss: 0.9726, test_f1: 0.5837
 epoch: 10, train_loss: 0.7956, test_loss: 0.9588, test_f1: 0.5625
 epoch: 11, train_loss: 0.7959, test_loss: 0.9435, test_f1: 0.5944
 epoch: 12, train_loss: 0.7580, test_loss: 0.9460, test_f1: 0.6061
 epoch: 13, train_loss: 0.7579, test_loss: 0.9797, test_f1: 0.5856
 epoch: 14, train_loss: 0.7589, test_loss: 0.9717, test_f1: 0.5972
 epoch: 15, train_loss: 0.7304, test_loss: 0.9609, test_f1: 0.5920
 epoch: 16, train_loss: 0.7218, test_loss: 0.9704, test_f1: 0.5807
 epoch: 17, train_loss: 0.7261, test_loss: 0.9936, test_f1: 0.6086
 epoch: 18, train_loss: 0.6801, test_loss: 0.9437, test_f1: 0.6151
 epoch: 19, train_loss: 0.6861, test_loss: 0.9803, test_f1: 0.6053
 epoch: 20, train_loss: 0.6638, test_loss: 0.9901, test_f1: 0.6094
 epoch: 21, train_loss: 0.6267, test_loss: 1.0031, test_f1: 0.5931
 epoch: 22, train_loss: 0.6388, test_loss: 0.9578, test_f1: 0.6231
 epoch: 23, train_loss: 0.6237, test_loss: 0.9840, test_f1: 0.6137
 epoch: 24, train_loss: 0.6247, test_loss: 1.0324, test_f1: 0.6127
 epoch: 25, train_loss: 0.6239, test_loss: 1.0163, test_f1: 0.5762
 epoch: 26, train_loss: 0.6010, test_loss: 0.9873, test_f1: 0.6187
 epoch: 27, train_loss: 0.6048, test_loss: 1.0231, test_f1: 0.6217
 epoch: 28, train_loss: 0.5882, test_loss: 1.0259, test_f1: 0.6377
 epoch: 29, train_loss: 0.5870, test_loss: 1.0178, test_f1: 0.6389
 epoch: 30, train_loss: 0.5635, test_loss: 1.0481, test_f1: 0.6012
 epoch: 31, train_loss: 0.5746, test_loss: 1.0322, test_f1: 0.6273
 epoch: 32, train_loss: 0.5558, test_loss: 1.1049, test_f1: 0.6086
 epoch: 33, train_loss: 0.5584, test_loss: 1.0539, test_f1: 0.6248
 epoch: 34, train_loss: 0.5510, test_loss: 1.1566, test_f1: 0.6147
 epoch: 35, train_loss: 0.5542, test_loss: 1.0287, test_f1: 0.6147
 epoch: 36, train_loss: 0.5380, test_loss: 1.0712, test_f1: 0.6108
 epoch: 37, train_loss: 0.5230, test_loss: 1.1024, test_f1: 0.6078
 epoch: 38, train_loss: 0.4978, test_loss: 1.1594, test_f1: 0.5946
 epoch: 39, train_loss: 0.5177, test_loss: 1.1597, test_f1: 0.6261
 epoch: 40, train_loss: 0.5103, test_loss: 1.0842, test_f1: 0.6347
 epoch: 41, train_loss: 0.5016, test_loss: 1.1644, test_f1: 0.6058
 epoch: 42, train_loss: 0.4946, test_loss: 1.2089, test_f1: 0.6013
 epoch: 43, train_loss: 0.4904, test_loss: 1.1508, test_f1: 0.6230
 epoch: 44, train_loss: 0.4871, test_loss: 1.1742, test_f1: 0.6023
 epoch: 45, train_loss: 0.4731, test_loss: 1.1784, test_f1: 0.5880
 epoch: 46, train_loss: 0.4561, test_loss: 1.1234, test_f1: 0.6154
 epoch: 47, train_loss: 0.4723, test_loss: 1.1467, test_f1: 0.6005
 epoch: 48, train_loss: 0.4530, test_loss: 1.0783, test_f1: 0.6562
 epoch: 49, train_loss: 0.4465, test_loss: 1.1303, test_f1: 0.6566
 epoch: 50, train_loss: 0.4292, test_loss: 1.1738, test_f1: 0.6331
 epoch: 51, train_loss: 0.4163, test_loss: 1.1093, test_f1: 0.6560
 epoch: 52, train_loss: 0.4452, test_loss: 1.1402, test_f1: 0.6406
 epoch: 53, train_loss: 0.3969, test_loss: 1.1488, test_f1: 0.6284
 epoch: 54, train_loss: 0.4169, test_loss: 1.1548, test_f1: 0.6315
 epoch: 55, train_loss: 0.3897, test_loss: 1.1593, test_f1: 0.6344
 epoch: 56, train_loss: 0.3975, test_loss: 1.1780, test_f1: 0.6584
 epoch: 57, train_loss: 0.4047, test_loss: 1.2429, test_f1: 0.6284
 epoch: 58, train_loss: 0.3890, test_loss: 1.2020, test_f1: 0.6631
 epoch: 59, train_loss: 0.3924, test_loss: 1.2642, test_f1: 0.6391
 epoch: 60, train_loss: 0.3836, test_loss: 1.2351, test_f1: 0.6331
 epoch: 61, train_loss: 0.3823, test_loss: 1.2842, test_f1: 0.6309
 epoch: 62, train_loss: 0.3670, test_loss: 1.2416, test_f1: 0.6339
 epoch: 63, train_loss: 0.3659, test_loss: 1.2487, test_f1: 0.6365
 epoch: 64, train_loss: 0.3607, test_loss: 1.2044, test_f1: 0.6250
 epoch: 65, train_loss: 0.3717, test_loss: 1.3298, test_f1: 0.5948
 epoch: 66, train_loss: 0.3600, test_loss: 1.2865, test_f1: 0.6413
 epoch: 67, train_loss: 0.3593, test_loss: 1.3266, test_f1: 0.6202
 epoch: 68, train_loss: 0.3656, test_loss: 1.2048, test_f1: 0.6492
 epoch: 69, train_loss: 0.3347, test_loss: 1.3532, test_f1: 0.6308
 epoch: 70, train_loss: 0.3707, test_loss: 1.2792, test_f1: 0.6324
 epoch: 71, train_loss: 0.3409, test_loss: 1.3417, test_f1: 0.6384
 epoch: 72, train_loss: 0.3556, test_loss: 1.3209, test_f1: 0.6389
 epoch: 73, train_loss: 0.3417, test_loss: 1.2823, test_f1: 0.6438
 epoch: 74, train_loss: 0.3321, test_loss: 1.3756, test_f1: 0.6081
 epoch: 75, train_loss: 0.3455, test_loss: 1.3448, test_f1: 0.6433
 epoch: 76, train_loss: 0.3356, test_loss: 1.3795, test_f1: 0.6148
 epoch: 77, train_loss: 0.3227, test_loss: 1.3516, test_f1: 0.5942
 epoch: 78, train_loss: 0.3221, test_loss: 1.3887, test_f1: 0.6179
 epoch: 79, train_loss: 0.3317, test_loss: 1.3603, test_f1: 0.6453
 epoch: 80, train_loss: 0.3116, test_loss: 1.4195, test_f1: 0.6322
 epoch: 81, train_loss: 0.3088, test_loss: 1.5625, test_f1: 0.6014
 epoch: 82, train_loss: 0.3128, test_loss: 1.3376, test_f1: 0.6670
 epoch: 83, train_loss: 0.3182, test_loss: 1.4454, test_f1: 0.6349
 epoch: 84, train_loss: 0.3172, test_loss: 1.4849, test_f1: 0.6331
 epoch: 85, train_loss: 0.3197, test_loss: 1.5589, test_f1: 0.5901
 epoch: 86, train_loss: 0.3200, test_loss: 1.3920, test_f1: 0.6246
 epoch: 87, train_loss: 0.3107, test_loss: 1.5547, test_f1: 0.5974
 epoch: 88, train_loss: 0.2940, test_loss: 1.5455, test_f1: 0.6262
 epoch: 89, train_loss: 0.3057, test_loss: 1.3805, test_f1: 0.6503
 epoch: 90, train_loss: 0.3122, test_loss: 1.4828, test_f1: 0.6332
 epoch: 91, train_loss: 0.2923, test_loss: 1.3949, test_f1: 0.6663
 epoch: 92, train_loss: 0.2784, test_loss: 1.4093, test_f1: 0.6489
 epoch: 93, train_loss: 0.2968, test_loss: 1.5003, test_f1: 0.6479
 epoch: 94, train_loss: 0.2776, test_loss: 1.5324, test_f1: 0.6220
 epoch: 95, train_loss: 0.2807, test_loss: 1.4813, test_f1: 0.6486
 epoch: 96, train_loss: 0.2841, test_loss: 1.4685, test_f1: 0.6431
 epoch: 97, train_loss: 0.2962, test_loss: 1.5712, test_f1: 0.6074
 epoch: 98, train_loss: 0.2838, test_loss: 1.3885, test_f1: 0.6314
 epoch: 99, train_loss: 0.2792, test_loss: 1.5450, test_f1: 0.6153

Training completed in 820.56 seconds
Best F1: 0.6818 at epoch 61
Mean F1 across iterations: 0.6537  0.0194
========================FINAL RESULTS================================
FEGIN weighted F1: 0.6818  0.0194
python main.py --data ltspice_demos --representation component_pin --model FEGIN --layers 2 --hiddens 128 --batch_size 32 --lr 0.0001 --emb_size 128 --epochs 100 --save_appendix component_pin_L2_H128_BS32_LR0.0001_E128 --no_val
-----



STDERR:
  File "main.py", line 370, in <module>
    main()
  File "main.py", line 254, in main
    dataset = dataset_class(
  File "/home/philip/projects/ltspice_examples_code_repo/Circuit-Completion-Using-GNNs/component_classification_with_link_prediction_head/evaluation/FEGIN/kernel/circuit_datasets.py", line 15, in __init__
    self.data, self.slices = torch.load(self.processed_paths[0])
  File "/home/philip/.local/lib/python3.8/site-packages/torch/serialization.py", line 1040, in load
    warnings.warn(
  File "/usr/lib/python3.8/warnings.py", line 109, in _showwarnmsg
    sw(msg.message, msg.category, msg.filename, msg.lineno,
  File "main.py", line 47, in warn_with_traceback
    traceback.print_stack(file=log)
/home/philip/projects/ltspice_examples_code_repo/Circuit-Completion-Using-GNNs/component_classification_with_link_prediction_head/evaluation/FEGIN/kernel/circuit_datasets.py:15: FutureWarning: You are using `torch.load` with `weights_only=False` (the current default value), which uses the default pickle module implicitly. It is possible to construct malicious pickle data which will execute arbitrary code during unpickling (See https://github.com/pytorch/pytorch/blob/main/SECURITY.md#untrusted-models for more details). In a future release, the default value for `weights_only` will be flipped to `True`. This limits the functions that could be executed during unpickling. Arbitrary objects will no longer be allowed to be loaded via this mode unless they are explicitly allowlisted by the user via `torch.serialization.add_safe_globals`. We recommend you start setting `weights_only=True` for any use case where you don't have full control of the loaded file. Please open an issue on GitHub for any issues related to this experimental feature.
  self.data, self.slices = torch.load(self.processed_paths[0])
