STDOUT:
Results will be saved in /home/philip/projects/ltspice_examples_code_repo/Circuit-Completion-Using-GNNs/component_classification_with_link_prediction_head/evaluation/FEGIN/results/model_FEGIN_dataset_ltspice_demos
Command line input: python main.py --data ltspice_demos --representation component_pin_net --model FEGIN --layers 2 --hiddens 64 --batch_size 32 --lr 0.01 --emb_size 128 --epochs 100 --save_appendix component_pin_net_L2_H64_BS32_LR0.01_E128 --no_val
 is saved.
-----
ltspice_demos - FEGIN
Using 2 layers, 64 hidden units, h = 2
Loading component_pin_net representation dataset
ENTERED
Training FEGIN on component_pin_net representation
Train: 1565, Test: 383
##################ITERATION #0 ****************************************
 epoch: 0, train_loss: 1.1227, test_loss: 1.1119, test_f1: 0.3270
 epoch: 1, train_loss: 0.9943, test_loss: 1.0454, test_f1: 0.4930
 epoch: 2, train_loss: 0.9731, test_loss: 1.0767, test_f1: 0.4074
 epoch: 3, train_loss: 0.9435, test_loss: 1.0856, test_f1: 0.5172
 epoch: 4, train_loss: 0.9191, test_loss: 1.0078, test_f1: 0.5263
 epoch: 5, train_loss: 0.9132, test_loss: 1.0203, test_f1: 0.4304
 epoch: 6, train_loss: 0.8721, test_loss: 1.0072, test_f1: 0.5475
 epoch: 7, train_loss: 0.8915, test_loss: 0.9946, test_f1: 0.5648
 epoch: 8, train_loss: 0.8635, test_loss: 1.0441, test_f1: 0.5384
 epoch: 9, train_loss: 0.8295, test_loss: 0.9575, test_f1: 0.5346
 epoch: 10, train_loss: 0.8267, test_loss: 0.9477, test_f1: 0.5426
 epoch: 11, train_loss: 0.8179, test_loss: 1.4844, test_f1: 0.3890
 epoch: 12, train_loss: 0.8594, test_loss: 0.9479, test_f1: 0.5828
 epoch: 13, train_loss: 0.8274, test_loss: 0.9504, test_f1: 0.5551
 epoch: 14, train_loss: 0.8094, test_loss: 0.9292, test_f1: 0.6002
 epoch: 15, train_loss: 0.8066, test_loss: 0.9146, test_f1: 0.6014
 epoch: 16, train_loss: 0.7797, test_loss: 1.0147, test_f1: 0.5450
 epoch: 17, train_loss: 0.7744, test_loss: 0.9281, test_f1: 0.5808
 epoch: 18, train_loss: 0.7700, test_loss: 1.0263, test_f1: 0.5450
 epoch: 19, train_loss: 0.7605, test_loss: 0.9499, test_f1: 0.5744
 epoch: 20, train_loss: 0.7372, test_loss: 1.0773, test_f1: 0.5058
 epoch: 21, train_loss: 0.7739, test_loss: 0.9160, test_f1: 0.6155
 epoch: 22, train_loss: 0.7520, test_loss: 1.0642, test_f1: 0.5732
 epoch: 23, train_loss: 0.7398, test_loss: 0.9883, test_f1: 0.5860
 epoch: 24, train_loss: 0.7332, test_loss: 0.9677, test_f1: 0.6274
 epoch: 25, train_loss: 0.7010, test_loss: 1.0334, test_f1: 0.5861
 epoch: 26, train_loss: 0.7320, test_loss: 0.9645, test_f1: 0.5584
 epoch: 27, train_loss: 0.7108, test_loss: 0.9790, test_f1: 0.6204
 epoch: 28, train_loss: 0.6703, test_loss: 1.0249, test_f1: 0.5830
 epoch: 29, train_loss: 0.6769, test_loss: 1.1662, test_f1: 0.5137
 epoch: 30, train_loss: 0.6681, test_loss: 1.0078, test_f1: 0.6433
 epoch: 31, train_loss: 0.6861, test_loss: 0.9372, test_f1: 0.6187
 epoch: 32, train_loss: 0.6650, test_loss: 1.4787, test_f1: 0.5438
 epoch: 33, train_loss: 0.6732, test_loss: 1.2374, test_f1: 0.6285
 epoch: 34, train_loss: 0.6725, test_loss: 1.4678, test_f1: 0.5885
 epoch: 35, train_loss: 0.6652, test_loss: 1.1502, test_f1: 0.5939
 epoch: 36, train_loss: 0.6469, test_loss: 1.1160, test_f1: 0.5675
 epoch: 37, train_loss: 0.6581, test_loss: 1.0794, test_f1: 0.6040
 epoch: 38, train_loss: 0.6593, test_loss: 1.1238, test_f1: 0.6201
 epoch: 39, train_loss: 0.6418, test_loss: 1.1314, test_f1: 0.5853
 epoch: 40, train_loss: 0.6191, test_loss: 1.1507, test_f1: 0.5706
 epoch: 41, train_loss: 0.6338, test_loss: 1.1702, test_f1: 0.5764
 epoch: 42, train_loss: 0.6286, test_loss: 1.0877, test_f1: 0.5590
 epoch: 43, train_loss: 0.5998, test_loss: 1.1115, test_f1: 0.5667
 epoch: 44, train_loss: 0.6194, test_loss: 1.2869, test_f1: 0.5497
 epoch: 45, train_loss: 0.6625, test_loss: 1.1469, test_f1: 0.5456
 epoch: 46, train_loss: 0.6108, test_loss: 1.0593, test_f1: 0.5912
 epoch: 47, train_loss: 0.5959, test_loss: 1.2233, test_f1: 0.5398
 epoch: 48, train_loss: 0.5679, test_loss: 1.2276, test_f1: 0.6341
 epoch: 49, train_loss: 0.5958, test_loss: 1.1285, test_f1: 0.6239
 epoch: 50, train_loss: 0.5718, test_loss: 1.3270, test_f1: 0.5943
 epoch: 51, train_loss: 0.5232, test_loss: 1.2574, test_f1: 0.6328
 epoch: 52, train_loss: 0.5291, test_loss: 1.2652, test_f1: 0.5656
 epoch: 53, train_loss: 0.5340, test_loss: 1.2115, test_f1: 0.6027
 epoch: 54, train_loss: 0.5158, test_loss: 1.3403, test_f1: 0.5839
 epoch: 55, train_loss: 0.5149, test_loss: 1.1429, test_f1: 0.6063
 epoch: 56, train_loss: 0.4797, test_loss: 1.2899, test_f1: 0.6136
 epoch: 57, train_loss: 0.4662, test_loss: 1.2807, test_f1: 0.6196
 epoch: 58, train_loss: 0.5075, test_loss: 1.3317, test_f1: 0.6012
 epoch: 59, train_loss: 0.5081, test_loss: 1.2003, test_f1: 0.6188
 epoch: 60, train_loss: 0.5190, test_loss: 1.5596, test_f1: 0.5869
 epoch: 61, train_loss: 0.4871, test_loss: 1.3761, test_f1: 0.6039
 epoch: 62, train_loss: 0.4484, test_loss: 1.3988, test_f1: 0.6266
 epoch: 63, train_loss: 0.4577, test_loss: 1.4725, test_f1: 0.6168
 epoch: 64, train_loss: 0.4777, test_loss: 1.3818, test_f1: 0.5959
 epoch: 65, train_loss: 0.4783, test_loss: 1.3337, test_f1: 0.6440
 epoch: 66, train_loss: 0.4475, test_loss: 1.3904, test_f1: 0.6269
 epoch: 67, train_loss: 0.4453, test_loss: 1.5096, test_f1: 0.6258
 epoch: 68, train_loss: 0.4354, test_loss: 1.5034, test_f1: 0.6115
 epoch: 69, train_loss: 0.4420, test_loss: 1.3935, test_f1: 0.6237
 epoch: 70, train_loss: 0.4376, test_loss: 1.6825, test_f1: 0.5909
 epoch: 71, train_loss: 0.4373, test_loss: 1.4128, test_f1: 0.6134
 epoch: 72, train_loss: 0.4454, test_loss: 1.3577, test_f1: 0.6480
 epoch: 73, train_loss: 0.4634, test_loss: 1.4392, test_f1: 0.6233
 epoch: 74, train_loss: 0.4450, test_loss: 1.4264, test_f1: 0.6069
 epoch: 75, train_loss: 0.4561, test_loss: 1.6044, test_f1: 0.5884
 epoch: 76, train_loss: 0.4088, test_loss: 1.3960, test_f1: 0.6490
 epoch: 77, train_loss: 0.4259, test_loss: 1.5738, test_f1: 0.5932
 epoch: 78, train_loss: 0.4203, test_loss: 1.6276, test_f1: 0.5980
 epoch: 79, train_loss: 0.4413, test_loss: 1.6504, test_f1: 0.5928
 epoch: 80, train_loss: 0.4243, test_loss: 1.5184, test_f1: 0.6035
 epoch: 81, train_loss: 0.3997, test_loss: 1.4933, test_f1: 0.5759
 epoch: 82, train_loss: 0.4282, test_loss: 1.6823, test_f1: 0.6059
 epoch: 83, train_loss: 0.3985, test_loss: 1.6432, test_f1: 0.5830
 epoch: 84, train_loss: 0.4243, test_loss: 1.4583, test_f1: 0.6340
 epoch: 85, train_loss: 0.4338, test_loss: 1.3786, test_f1: 0.6426
 epoch: 86, train_loss: 0.3746, test_loss: 1.3901, test_f1: 0.6051
 epoch: 87, train_loss: 0.4063, test_loss: 1.5533, test_f1: 0.5972
 epoch: 88, train_loss: 0.3775, test_loss: 1.5106, test_f1: 0.6217
 epoch: 89, train_loss: 0.4146, test_loss: 1.8833, test_f1: 0.5754
 epoch: 90, train_loss: 0.4057, test_loss: 1.4885, test_f1: 0.6133
 epoch: 91, train_loss: 0.3860, test_loss: 1.3994, test_f1: 0.6544
 epoch: 92, train_loss: 0.3545, test_loss: 1.6942, test_f1: 0.5948
 epoch: 93, train_loss: 0.4033, test_loss: 1.6692, test_f1: 0.6370
 epoch: 94, train_loss: 0.4165, test_loss: 1.5172, test_f1: 0.6306
 epoch: 95, train_loss: 0.3967, test_loss: 1.7251, test_f1: 0.6110
 epoch: 96, train_loss: 0.3946, test_loss: 1.5354, test_f1: 0.6335
 epoch: 97, train_loss: 0.3829, test_loss: 1.4546, test_f1: 0.5982
 epoch: 98, train_loss: 0.4074, test_loss: 1.4539, test_f1: 0.6218
 epoch: 99, train_loss: 0.3335, test_loss: 1.7113, test_f1: 0.5838
##################ITERATION #1 ****************************************
 epoch: 0, train_loss: 1.0639, test_loss: 1.0707, test_f1: 0.4885
 epoch: 1, train_loss: 0.9543, test_loss: 1.0187, test_f1: 0.5374
 epoch: 2, train_loss: 0.9236, test_loss: 1.0083, test_f1: 0.5249
 epoch: 3, train_loss: 0.8832, test_loss: 1.0357, test_f1: 0.4797
 epoch: 4, train_loss: 0.8802, test_loss: 1.0139, test_f1: 0.5288
 epoch: 5, train_loss: 0.8697, test_loss: 0.9721, test_f1: 0.4699
 epoch: 6, train_loss: 0.8495, test_loss: 1.0105, test_f1: 0.5071
 epoch: 7, train_loss: 0.8282, test_loss: 1.0824, test_f1: 0.4383
 epoch: 8, train_loss: 0.8390, test_loss: 0.9699, test_f1: 0.5414
 epoch: 9, train_loss: 0.8360, test_loss: 1.0258, test_f1: 0.4762
 epoch: 10, train_loss: 0.8144, test_loss: 1.0140, test_f1: 0.5289
 epoch: 11, train_loss: 0.7925, test_loss: 1.0775, test_f1: 0.4071
 epoch: 12, train_loss: 0.7923, test_loss: 1.0526, test_f1: 0.6113
 epoch: 13, train_loss: 0.8341, test_loss: 0.9831, test_f1: 0.4847
 epoch: 14, train_loss: 0.7974, test_loss: 1.0987, test_f1: 0.5320
 epoch: 15, train_loss: 0.7681, test_loss: 1.0994, test_f1: 0.4823
 epoch: 16, train_loss: 0.7629, test_loss: 1.1047, test_f1: 0.5137
 epoch: 17, train_loss: 0.7532, test_loss: 1.0281, test_f1: 0.5536
 epoch: 18, train_loss: 0.7352, test_loss: 1.1969, test_f1: 0.5500
 epoch: 19, train_loss: 0.7510, test_loss: 1.1265, test_f1: 0.5127
 epoch: 20, train_loss: 0.7686, test_loss: 1.0073, test_f1: 0.4642
 epoch: 21, train_loss: 0.7444, test_loss: 1.0544, test_f1: 0.5345
 epoch: 22, train_loss: 0.7225, test_loss: 1.1641, test_f1: 0.5862
 epoch: 23, train_loss: 0.7606, test_loss: 1.0111, test_f1: 0.5338
 epoch: 24, train_loss: 0.7184, test_loss: 1.1749, test_f1: 0.5163
 epoch: 25, train_loss: 0.7360, test_loss: 1.1721, test_f1: 0.5757
 epoch: 26, train_loss: 0.7304, test_loss: 1.8057, test_f1: 0.4768
 epoch: 27, train_loss: 0.7357, test_loss: 1.1417, test_f1: 0.5193
 epoch: 28, train_loss: 0.6969, test_loss: 1.4582, test_f1: 0.4672
 epoch: 29, train_loss: 0.7013, test_loss: 1.1959, test_f1: 0.4973
 epoch: 30, train_loss: 0.6949, test_loss: 0.9984, test_f1: 0.5655
 epoch: 31, train_loss: 0.7124, test_loss: 1.2321, test_f1: 0.4887
 epoch: 32, train_loss: 0.7073, test_loss: 1.0944, test_f1: 0.5190
 epoch: 33, train_loss: 0.6874, test_loss: 1.0449, test_f1: 0.5932
 epoch: 34, train_loss: 0.6600, test_loss: 1.1241, test_f1: 0.5728
 epoch: 35, train_loss: 0.6691, test_loss: 1.1987, test_f1: 0.5235
 epoch: 36, train_loss: 0.6564, test_loss: 1.3801, test_f1: 0.6213
 epoch: 37, train_loss: 0.6675, test_loss: 1.1411, test_f1: 0.5971
 epoch: 38, train_loss: 0.6940, test_loss: 1.4559, test_f1: 0.4464
 epoch: 39, train_loss: 0.6653, test_loss: 1.1689, test_f1: 0.5759
 epoch: 40, train_loss: 0.6466, test_loss: 1.5141, test_f1: 0.5750
 epoch: 41, train_loss: 0.6215, test_loss: 1.2225, test_f1: 0.5949
 epoch: 42, train_loss: 0.6618, test_loss: 1.0282, test_f1: 0.6584
 epoch: 43, train_loss: 0.6449, test_loss: 1.1788, test_f1: 0.5307
 epoch: 44, train_loss: 0.6236, test_loss: 1.2887, test_f1: 0.6053
 epoch: 45, train_loss: 0.6091, test_loss: 1.3606, test_f1: 0.5951
 epoch: 46, train_loss: 0.6256, test_loss: 1.4526, test_f1: 0.5937
 epoch: 47, train_loss: 0.6087, test_loss: 1.2469, test_f1: 0.5495
 epoch: 48, train_loss: 0.6248, test_loss: 1.3878, test_f1: 0.5681
 epoch: 49, train_loss: 0.5976, test_loss: 1.3305, test_f1: 0.6348
 epoch: 50, train_loss: 0.6111, test_loss: 1.2634, test_f1: 0.6671
 epoch: 51, train_loss: 0.5633, test_loss: 1.2184, test_f1: 0.6301
 epoch: 52, train_loss: 0.5595, test_loss: 1.6894, test_f1: 0.6329
 epoch: 53, train_loss: 0.5433, test_loss: 1.5005, test_f1: 0.6397
 epoch: 54, train_loss: 0.5221, test_loss: 1.5041, test_f1: 0.6443
 epoch: 55, train_loss: 0.5103, test_loss: 1.3937, test_f1: 0.6289
 epoch: 56, train_loss: 0.5082, test_loss: 1.7442, test_f1: 0.5981
 epoch: 57, train_loss: 0.5030, test_loss: 1.3709, test_f1: 0.6262
 epoch: 58, train_loss: 0.5176, test_loss: 1.3751, test_f1: 0.6249
 epoch: 59, train_loss: 0.4977, test_loss: 1.5098, test_f1: 0.6662
 epoch: 60, train_loss: 0.4925, test_loss: 1.8719, test_f1: 0.6275
 epoch: 61, train_loss: 0.4806, test_loss: 1.2813, test_f1: 0.6629
 epoch: 62, train_loss: 0.5046, test_loss: 1.5189, test_f1: 0.6232
 epoch: 63, train_loss: 0.4875, test_loss: 1.6653, test_f1: 0.6827
 epoch: 64, train_loss: 0.5183, test_loss: 1.4465, test_f1: 0.6472
 epoch: 65, train_loss: 0.4858, test_loss: 1.6795, test_f1: 0.6264
 epoch: 66, train_loss: 0.4875, test_loss: 1.5533, test_f1: 0.6443
 epoch: 67, train_loss: 0.4727, test_loss: 1.4921, test_f1: 0.6584
 epoch: 68, train_loss: 0.4850, test_loss: 1.7102, test_f1: 0.6410
 epoch: 69, train_loss: 0.4673, test_loss: 1.6950, test_f1: 0.6112
 epoch: 70, train_loss: 0.4480, test_loss: 1.5563, test_f1: 0.6533
 epoch: 71, train_loss: 0.4260, test_loss: 1.6300, test_f1: 0.6303
 epoch: 72, train_loss: 0.4589, test_loss: 1.7714, test_f1: 0.6387
 epoch: 73, train_loss: 0.4568, test_loss: 1.5121, test_f1: 0.6051
 epoch: 74, train_loss: 0.4806, test_loss: 1.5791, test_f1: 0.6469
 epoch: 75, train_loss: 0.4827, test_loss: 1.6566, test_f1: 0.5893
 epoch: 76, train_loss: 0.4694, test_loss: 1.7469, test_f1: 0.6179
 epoch: 77, train_loss: 0.4522, test_loss: 1.3807, test_f1: 0.6303
 epoch: 78, train_loss: 0.4681, test_loss: 1.7967, test_f1: 0.6107
 epoch: 79, train_loss: 0.4747, test_loss: 1.6944, test_f1: 0.6197
 epoch: 80, train_loss: 0.4207, test_loss: 1.6328, test_f1: 0.6264
 epoch: 81, train_loss: 0.4480, test_loss: 1.9871, test_f1: 0.6271
 epoch: 82, train_loss: 0.4610, test_loss: 1.4127, test_f1: 0.6527
 epoch: 83, train_loss: 0.4334, test_loss: 1.5902, test_f1: 0.6232
 epoch: 84, train_loss: 0.4476, test_loss: 1.7441, test_f1: 0.6192
 epoch: 85, train_loss: 0.4359, test_loss: 1.7344, test_f1: 0.6028
 epoch: 86, train_loss: 0.4245, test_loss: 1.6809, test_f1: 0.6176
 epoch: 87, train_loss: 0.4457, test_loss: 1.5118, test_f1: 0.6452
 epoch: 88, train_loss: 0.4435, test_loss: 1.5698, test_f1: 0.6551
 epoch: 89, train_loss: 0.4073, test_loss: 1.5136, test_f1: 0.6710
 epoch: 90, train_loss: 0.4204, test_loss: 1.7328, test_f1: 0.6365
 epoch: 91, train_loss: 0.4208, test_loss: 1.5953, test_f1: 0.6194
 epoch: 92, train_loss: 0.4337, test_loss: 1.6160, test_f1: 0.6541
 epoch: 93, train_loss: 0.4279, test_loss: 1.5317, test_f1: 0.6553
 epoch: 94, train_loss: 0.4057, test_loss: 1.5319, test_f1: 0.6370
 epoch: 95, train_loss: 0.3923, test_loss: 1.5243, test_f1: 0.6498
 epoch: 96, train_loss: 0.4240, test_loss: 1.6481, test_f1: 0.6299
 epoch: 97, train_loss: 0.4373, test_loss: 1.6090, test_f1: 0.6074
 epoch: 98, train_loss: 0.4087, test_loss: 1.6046, test_f1: 0.6531
 epoch: 99, train_loss: 0.4023, test_loss: 1.9474, test_f1: 0.6768
##################ITERATION #2 ****************************************
 epoch: 0, train_loss: 1.1241, test_loss: 1.4578, test_f1: 0.2311
 epoch: 1, train_loss: 0.9624, test_loss: 1.0662, test_f1: 0.5292
 epoch: 2, train_loss: 0.9213, test_loss: 1.0667, test_f1: 0.4326
 epoch: 3, train_loss: 0.8968, test_loss: 0.9916, test_f1: 0.5511
 epoch: 4, train_loss: 0.8676, test_loss: 1.0281, test_f1: 0.5638
 epoch: 5, train_loss: 0.9058, test_loss: 1.0759, test_f1: 0.5057
 epoch: 6, train_loss: 0.8513, test_loss: 1.0514, test_f1: 0.5430
 epoch: 7, train_loss: 0.8513, test_loss: 0.9681, test_f1: 0.5553
 epoch: 8, train_loss: 0.8413, test_loss: 1.1102, test_f1: 0.4830
 epoch: 9, train_loss: 0.8166, test_loss: 1.1001, test_f1: 0.5158
 epoch: 10, train_loss: 0.8066, test_loss: 1.0272, test_f1: 0.6263
 epoch: 11, train_loss: 0.8131, test_loss: 1.0382, test_f1: 0.6075
 epoch: 12, train_loss: 0.7973, test_loss: 1.0608, test_f1: 0.5490
 epoch: 13, train_loss: 0.7712, test_loss: 1.2732, test_f1: 0.5370
 epoch: 14, train_loss: 0.7669, test_loss: 1.3057, test_f1: 0.4967
 epoch: 15, train_loss: 0.7728, test_loss: 1.1354, test_f1: 0.5000
 epoch: 16, train_loss: 0.7622, test_loss: 1.2178, test_f1: 0.5867
 epoch: 17, train_loss: 0.7458, test_loss: 1.0871, test_f1: 0.5917
 epoch: 18, train_loss: 0.7510, test_loss: 1.3094, test_f1: 0.6018
 epoch: 19, train_loss: 0.7369, test_loss: 1.3209, test_f1: 0.5892
 epoch: 20, train_loss: 0.7582, test_loss: 1.1964, test_f1: 0.5440
 epoch: 21, train_loss: 0.7325, test_loss: 1.4368, test_f1: 0.4478
 epoch: 22, train_loss: 0.7214, test_loss: 1.4319, test_f1: 0.5422
 epoch: 23, train_loss: 0.7564, test_loss: 1.0164, test_f1: 0.6115
 epoch: 24, train_loss: 0.6992, test_loss: 1.4059, test_f1: 0.5212
 epoch: 25, train_loss: 0.6999, test_loss: 1.8741, test_f1: 0.4983
 epoch: 26, train_loss: 0.7261, test_loss: 1.0592, test_f1: 0.6597
 epoch: 27, train_loss: 0.6924, test_loss: 1.2598, test_f1: 0.5776
 epoch: 28, train_loss: 0.6902, test_loss: 1.1459, test_f1: 0.6007
 epoch: 29, train_loss: 0.6644, test_loss: 1.0395, test_f1: 0.6283
 epoch: 30, train_loss: 0.6397, test_loss: 1.1620, test_f1: 0.5925
 epoch: 31, train_loss: 0.6937, test_loss: 1.1247, test_f1: 0.5657
 epoch: 32, train_loss: 0.6686, test_loss: 1.4293, test_f1: 0.6164
 epoch: 33, train_loss: 0.6526, test_loss: 1.2916, test_f1: 0.5620
 epoch: 34, train_loss: 0.6636, test_loss: 1.0886, test_f1: 0.5977
 epoch: 35, train_loss: 0.6310, test_loss: 1.3671, test_f1: 0.5392
 epoch: 36, train_loss: 0.6207, test_loss: 1.0004, test_f1: 0.6341
 epoch: 37, train_loss: 0.6202, test_loss: 1.4494, test_f1: 0.5777
 epoch: 38, train_loss: 0.6240, test_loss: 1.3214, test_f1: 0.6314
 epoch: 39, train_loss: 0.6017, test_loss: 1.2280, test_f1: 0.6000
 epoch: 40, train_loss: 0.6264, test_loss: 1.1214, test_f1: 0.6218
 epoch: 41, train_loss: 0.6264, test_loss: 1.0929, test_f1: 0.6842
 epoch: 42, train_loss: 0.6050, test_loss: 1.2862, test_f1: 0.6058
 epoch: 43, train_loss: 0.6057, test_loss: 1.3235, test_f1: 0.6180
 epoch: 44, train_loss: 0.6111, test_loss: 1.1686, test_f1: 0.5921
 epoch: 45, train_loss: 0.5895, test_loss: 1.0754, test_f1: 0.6144
 epoch: 46, train_loss: 0.5842, test_loss: 1.5387, test_f1: 0.6109
 epoch: 47, train_loss: 0.5868, test_loss: 1.1943, test_f1: 0.5761
 epoch: 48, train_loss: 0.5818, test_loss: 1.4495, test_f1: 0.5671
 epoch: 49, train_loss: 0.5447, test_loss: 1.3110, test_f1: 0.6210
 epoch: 50, train_loss: 0.6067, test_loss: 1.3110, test_f1: 0.6040
 epoch: 51, train_loss: 0.5490, test_loss: 1.1704, test_f1: 0.6319
 epoch: 52, train_loss: 0.5176, test_loss: 1.2713, test_f1: 0.6501
 epoch: 53, train_loss: 0.5049, test_loss: 1.3698, test_f1: 0.6509
 epoch: 54, train_loss: 0.4876, test_loss: 1.3784, test_f1: 0.6314
 epoch: 55, train_loss: 0.5089, test_loss: 1.2429, test_f1: 0.6088
 epoch: 56, train_loss: 0.4689, test_loss: 1.3560, test_f1: 0.6196
 epoch: 57, train_loss: 0.5117, test_loss: 1.2764, test_f1: 0.6331
 epoch: 58, train_loss: 0.4876, test_loss: 1.1891, test_f1: 0.6486
 epoch: 59, train_loss: 0.4836, test_loss: 1.4446, test_f1: 0.6179
 epoch: 60, train_loss: 0.4667, test_loss: 1.3920, test_f1: 0.6340
 epoch: 61, train_loss: 0.4391, test_loss: 1.3328, test_f1: 0.6249
 epoch: 62, train_loss: 0.4679, test_loss: 1.3525, test_f1: 0.6351
 epoch: 63, train_loss: 0.4395, test_loss: 1.2155, test_f1: 0.6498
 epoch: 64, train_loss: 0.4432, test_loss: 1.3639, test_f1: 0.6309
 epoch: 65, train_loss: 0.4824, test_loss: 1.4821, test_f1: 0.6088
 epoch: 66, train_loss: 0.4688, test_loss: 1.4188, test_f1: 0.6588
 epoch: 67, train_loss: 0.4628, test_loss: 1.5000, test_f1: 0.6195
 epoch: 68, train_loss: 0.4610, test_loss: 1.2036, test_f1: 0.6432
 epoch: 69, train_loss: 0.4546, test_loss: 1.3435, test_f1: 0.6455
 epoch: 70, train_loss: 0.4497, test_loss: 1.2896, test_f1: 0.6582
 epoch: 71, train_loss: 0.4348, test_loss: 1.4165, test_f1: 0.6612
 epoch: 72, train_loss: 0.4402, test_loss: 1.2260, test_f1: 0.6438
 epoch: 73, train_loss: 0.4724, test_loss: 1.5660, test_f1: 0.6380
 epoch: 74, train_loss: 0.4273, test_loss: 1.2961, test_f1: 0.6193
 epoch: 75, train_loss: 0.3975, test_loss: 1.6378, test_f1: 0.6507
 epoch: 76, train_loss: 0.4193, test_loss: 1.4309, test_f1: 0.6415
 epoch: 77, train_loss: 0.4511, test_loss: 1.4898, test_f1: 0.6014
 epoch: 78, train_loss: 0.4155, test_loss: 1.4527, test_f1: 0.6499
 epoch: 79, train_loss: 0.4591, test_loss: 1.6414, test_f1: 0.6246
 epoch: 80, train_loss: 0.4334, test_loss: 1.4324, test_f1: 0.5722
 epoch: 81, train_loss: 0.4145, test_loss: 1.5599, test_f1: 0.6400
 epoch: 82, train_loss: 0.4081, test_loss: 1.5295, test_f1: 0.6180
 epoch: 83, train_loss: 0.4273, test_loss: 1.3961, test_f1: 0.6010
 epoch: 84, train_loss: 0.4064, test_loss: 1.3896, test_f1: 0.6089
 epoch: 85, train_loss: 0.4012, test_loss: 1.4791, test_f1: 0.6697
 epoch: 86, train_loss: 0.3991, test_loss: 1.7052, test_f1: 0.6437
 epoch: 87, train_loss: 0.4045, test_loss: 1.4227, test_f1: 0.6369
 epoch: 88, train_loss: 0.3608, test_loss: 1.7146, test_f1: 0.6155
 epoch: 89, train_loss: 0.4008, test_loss: 1.4914, test_f1: 0.5858
 epoch: 90, train_loss: 0.3947, test_loss: 1.4757, test_f1: 0.6341
 epoch: 91, train_loss: 0.3881, test_loss: 1.5495, test_f1: 0.6105
 epoch: 92, train_loss: 0.3667, test_loss: 1.6791, test_f1: 0.6289
 epoch: 93, train_loss: 0.3778, test_loss: 1.7140, test_f1: 0.5980
 epoch: 94, train_loss: 0.3943, test_loss: 1.6577, test_f1: 0.5996
 epoch: 95, train_loss: 0.3500, test_loss: 1.6020, test_f1: 0.6183
 epoch: 96, train_loss: 0.3690, test_loss: 1.7641, test_f1: 0.6352
 epoch: 97, train_loss: 0.3821, test_loss: 1.5879, test_f1: 0.6431
 epoch: 98, train_loss: 0.3582, test_loss: 1.9058, test_f1: 0.6235
 epoch: 99, train_loss: 0.3717, test_loss: 1.7647, test_f1: 0.6049
##################ITERATION #3 ****************************************
 epoch: 0, train_loss: 1.1052, test_loss: 1.1636, test_f1: 0.5016
 epoch: 1, train_loss: 0.9607, test_loss: 1.0290, test_f1: 0.4677
 epoch: 2, train_loss: 0.9080, test_loss: 1.2655, test_f1: 0.3924
 epoch: 3, train_loss: 0.8888, test_loss: 1.0149, test_f1: 0.4938
 epoch: 4, train_loss: 0.8650, test_loss: 1.0148, test_f1: 0.5716
 epoch: 5, train_loss: 0.8450, test_loss: 1.0352, test_f1: 0.5322
 epoch: 6, train_loss: 0.8394, test_loss: 1.0342, test_f1: 0.4930
 epoch: 7, train_loss: 0.8467, test_loss: 1.0464, test_f1: 0.5270
 epoch: 8, train_loss: 0.8132, test_loss: 1.1488, test_f1: 0.4963
 epoch: 9, train_loss: 0.8259, test_loss: 1.1259, test_f1: 0.5040
 epoch: 10, train_loss: 0.8047, test_loss: 1.1967, test_f1: 0.5079
 epoch: 11, train_loss: 0.7877, test_loss: 1.1483, test_f1: 0.4956
 epoch: 12, train_loss: 0.7853, test_loss: 1.0938, test_f1: 0.5046
 epoch: 13, train_loss: 0.7655, test_loss: 1.0555, test_f1: 0.4938
 epoch: 14, train_loss: 0.7439, test_loss: 1.0868, test_f1: 0.4728
 epoch: 15, train_loss: 0.7678, test_loss: 1.1474, test_f1: 0.5346
 epoch: 16, train_loss: 0.7245, test_loss: 1.1961, test_f1: 0.4664
 epoch: 17, train_loss: 0.7047, test_loss: 1.3126, test_f1: 0.5368
 epoch: 18, train_loss: 0.7282, test_loss: 1.3940, test_f1: 0.4770
 epoch: 19, train_loss: 0.7258, test_loss: 1.1198, test_f1: 0.5641
 epoch: 20, train_loss: 0.6951, test_loss: 1.1066, test_f1: 0.5977
 epoch: 21, train_loss: 0.6936, test_loss: 1.1742, test_f1: 0.5186
 epoch: 22, train_loss: 0.7278, test_loss: 1.1169, test_f1: 0.5534
 epoch: 23, train_loss: 0.7075, test_loss: 1.0751, test_f1: 0.6147
 epoch: 24, train_loss: 0.7209, test_loss: 1.0133, test_f1: 0.5892
 epoch: 25, train_loss: 0.6759, test_loss: 1.3263, test_f1: 0.5303
 epoch: 26, train_loss: 0.6862, test_loss: 1.4018, test_f1: 0.5008
 epoch: 27, train_loss: 0.6593, test_loss: 1.2530, test_f1: 0.5118
 epoch: 28, train_loss: 0.6734, test_loss: 1.0875, test_f1: 0.5930
 epoch: 29, train_loss: 0.7093, test_loss: 1.0760, test_f1: 0.6008
 epoch: 30, train_loss: 0.6834, test_loss: 1.2361, test_f1: 0.5428
 epoch: 31, train_loss: 0.6550, test_loss: 1.2030, test_f1: 0.5352
 epoch: 32, train_loss: 0.6488, test_loss: 0.9916, test_f1: 0.6336
 epoch: 33, train_loss: 0.6264, test_loss: 1.2978, test_f1: 0.5271
 epoch: 34, train_loss: 0.6143, test_loss: 1.2001, test_f1: 0.5688
 epoch: 35, train_loss: 0.6266, test_loss: 1.3875, test_f1: 0.5672
 epoch: 36, train_loss: 0.5988, test_loss: 1.2895, test_f1: 0.5923
 epoch: 37, train_loss: 0.6081, test_loss: 1.2747, test_f1: 0.5132
 epoch: 38, train_loss: 0.6340, test_loss: 1.0870, test_f1: 0.6275
 epoch: 39, train_loss: 0.6219, test_loss: 1.2382, test_f1: 0.6211
 epoch: 40, train_loss: 0.5936, test_loss: 2.0041, test_f1: 0.5448
 epoch: 41, train_loss: 0.6308, test_loss: 1.1306, test_f1: 0.6249
 epoch: 42, train_loss: 0.5959, test_loss: 1.1552, test_f1: 0.5636
 epoch: 43, train_loss: 0.5922, test_loss: 1.2578, test_f1: 0.5978
 epoch: 44, train_loss: 0.6190, test_loss: 1.2865, test_f1: 0.5023
 epoch: 45, train_loss: 0.5805, test_loss: 1.1121, test_f1: 0.5849
 epoch: 46, train_loss: 0.5980, test_loss: 1.2669, test_f1: 0.6129
 epoch: 47, train_loss: 0.5827, test_loss: 1.1722, test_f1: 0.6035
 epoch: 48, train_loss: 0.5690, test_loss: 1.3838, test_f1: 0.5876
 epoch: 49, train_loss: 0.5593, test_loss: 1.6835, test_f1: 0.5641
 epoch: 50, train_loss: 0.5692, test_loss: 1.3393, test_f1: 0.5708
 epoch: 51, train_loss: 0.5324, test_loss: 1.3642, test_f1: 0.5545
 epoch: 52, train_loss: 0.5233, test_loss: 1.2466, test_f1: 0.6105
 epoch: 53, train_loss: 0.4894, test_loss: 1.3569, test_f1: 0.6148
 epoch: 54, train_loss: 0.5209, test_loss: 1.1892, test_f1: 0.6338
 epoch: 55, train_loss: 0.4725, test_loss: 1.5474, test_f1: 0.5253
 epoch: 56, train_loss: 0.4770, test_loss: 1.2834, test_f1: 0.5951
 epoch: 57, train_loss: 0.5112, test_loss: 1.2550, test_f1: 0.5850
 epoch: 58, train_loss: 0.4851, test_loss: 1.3850, test_f1: 0.6037
 epoch: 59, train_loss: 0.4834, test_loss: 1.4180, test_f1: 0.6123
 epoch: 60, train_loss: 0.4630, test_loss: 1.5607, test_f1: 0.5543
 epoch: 61, train_loss: 0.4464, test_loss: 1.3555, test_f1: 0.6183
 epoch: 62, train_loss: 0.4626, test_loss: 1.5606, test_f1: 0.5971
 epoch: 63, train_loss: 0.4453, test_loss: 1.4873, test_f1: 0.5897
 epoch: 64, train_loss: 0.4406, test_loss: 1.4582, test_f1: 0.5641
 epoch: 65, train_loss: 0.4220, test_loss: 1.5007, test_f1: 0.5839
 epoch: 66, train_loss: 0.4441, test_loss: 1.4606, test_f1: 0.5619
 epoch: 67, train_loss: 0.4373, test_loss: 1.3950, test_f1: 0.6074
 epoch: 68, train_loss: 0.4290, test_loss: 1.5071, test_f1: 0.5556
 epoch: 69, train_loss: 0.4066, test_loss: 1.4551, test_f1: 0.6055
 epoch: 70, train_loss: 0.4247, test_loss: 1.4237, test_f1: 0.5756
 epoch: 71, train_loss: 0.4133, test_loss: 1.4757, test_f1: 0.6193
 epoch: 72, train_loss: 0.4063, test_loss: 1.4503, test_f1: 0.6603
 epoch: 73, train_loss: 0.3999, test_loss: 1.6193, test_f1: 0.5829
 epoch: 74, train_loss: 0.3962, test_loss: 1.6548, test_f1: 0.6012
 epoch: 75, train_loss: 0.4105, test_loss: 1.5345, test_f1: 0.6010
 epoch: 76, train_loss: 0.4048, test_loss: 1.4424, test_f1: 0.6333
 epoch: 77, train_loss: 0.4284, test_loss: 1.4046, test_f1: 0.5588
 epoch: 78, train_loss: 0.4251, test_loss: 1.4389, test_f1: 0.6056
 epoch: 79, train_loss: 0.3921, test_loss: 1.5441, test_f1: 0.6032
 epoch: 80, train_loss: 0.3608, test_loss: 1.6197, test_f1: 0.5840
 epoch: 81, train_loss: 0.4272, test_loss: 1.7871, test_f1: 0.5759
 epoch: 82, train_loss: 0.3985, test_loss: 1.7415, test_f1: 0.5943
 epoch: 83, train_loss: 0.3618, test_loss: 1.8601, test_f1: 0.5889
 epoch: 84, train_loss: 0.3935, test_loss: 1.6306, test_f1: 0.5986
 epoch: 85, train_loss: 0.4127, test_loss: 1.5397, test_f1: 0.6150
 epoch: 86, train_loss: 0.4391, test_loss: 1.5598, test_f1: 0.6005
 epoch: 87, train_loss: 0.3921, test_loss: 1.4265, test_f1: 0.5950
 epoch: 88, train_loss: 0.4109, test_loss: 1.3772, test_f1: 0.6289
 epoch: 89, train_loss: 0.3643, test_loss: 1.5322, test_f1: 0.6073
 epoch: 90, train_loss: 0.3527, test_loss: 1.7097, test_f1: 0.6045
 epoch: 91, train_loss: 0.3450, test_loss: 2.2408, test_f1: 0.5661
 epoch: 92, train_loss: 0.3691, test_loss: 1.8045, test_f1: 0.5713
 epoch: 93, train_loss: 0.3494, test_loss: 2.1106, test_f1: 0.5538
 epoch: 94, train_loss: 0.3523, test_loss: 1.9364, test_f1: 0.5751
 epoch: 95, train_loss: 0.3584, test_loss: 2.0570, test_f1: 0.6392
 epoch: 96, train_loss: 0.3599, test_loss: 2.0392, test_f1: 0.5908
 epoch: 97, train_loss: 0.3289, test_loss: 2.4984, test_f1: 0.5518
 epoch: 98, train_loss: 0.3645, test_loss: 2.0261, test_f1: 0.5687
 epoch: 99, train_loss: 0.3435, test_loss: 2.2172, test_f1: 0.5970
##################ITERATION #4 ****************************************
 epoch: 0, train_loss: 1.1228, test_loss: 1.1126, test_f1: 0.4204
 epoch: 1, train_loss: 0.9696, test_loss: 1.0563, test_f1: 0.5108
 epoch: 2, train_loss: 0.9423, test_loss: 0.9823, test_f1: 0.4995
 epoch: 3, train_loss: 0.9174, test_loss: 1.0712, test_f1: 0.5134
 epoch: 4, train_loss: 0.9010, test_loss: 1.2844, test_f1: 0.4484
 epoch: 5, train_loss: 0.8495, test_loss: 1.1125, test_f1: 0.4754
 epoch: 6, train_loss: 0.8888, test_loss: 1.0418, test_f1: 0.4214
 epoch: 7, train_loss: 0.8391, test_loss: 1.0275, test_f1: 0.5392
 epoch: 8, train_loss: 0.8617, test_loss: 1.0487, test_f1: 0.4945
 epoch: 9, train_loss: 0.8600, test_loss: 0.9931, test_f1: 0.4948
 epoch: 10, train_loss: 0.8338, test_loss: 1.1704, test_f1: 0.4425
 epoch: 11, train_loss: 0.8119, test_loss: 1.0320, test_f1: 0.5187
 epoch: 12, train_loss: 0.8029, test_loss: 1.1368, test_f1: 0.4537
 epoch: 13, train_loss: 0.8218, test_loss: 1.0765, test_f1: 0.5135
 epoch: 14, train_loss: 0.8060, test_loss: 1.0536, test_f1: 0.5304
 epoch: 15, train_loss: 0.8000, test_loss: 0.9784, test_f1: 0.5625
 epoch: 16, train_loss: 0.7725, test_loss: 1.0831, test_f1: 0.4988
 epoch: 17, train_loss: 0.7622, test_loss: 1.9399, test_f1: 0.4158
 epoch: 18, train_loss: 0.7952, test_loss: 1.0902, test_f1: 0.5026
 epoch: 19, train_loss: 0.7869, test_loss: 1.2164, test_f1: 0.5556
 epoch: 20, train_loss: 0.7341, test_loss: 1.0007, test_f1: 0.5381
 epoch: 21, train_loss: 0.7393, test_loss: 0.9399, test_f1: 0.6393
 epoch: 22, train_loss: 0.7356, test_loss: 1.0231, test_f1: 0.5526
 epoch: 23, train_loss: 0.7356, test_loss: 1.1746, test_f1: 0.5328
 epoch: 24, train_loss: 0.7089, test_loss: 1.1205, test_f1: 0.5629
 epoch: 25, train_loss: 0.7237, test_loss: 1.0894, test_f1: 0.4996
 epoch: 26, train_loss: 0.7185, test_loss: 1.0440, test_f1: 0.5868
 epoch: 27, train_loss: 0.7127, test_loss: 1.3426, test_f1: 0.5334
 epoch: 28, train_loss: 0.6907, test_loss: 1.0193, test_f1: 0.5952
 epoch: 29, train_loss: 0.6858, test_loss: 1.0483, test_f1: 0.5865
 epoch: 30, train_loss: 0.7106, test_loss: 1.0047, test_f1: 0.6169
 epoch: 31, train_loss: 0.6727, test_loss: 1.0970, test_f1: 0.5794
 epoch: 32, train_loss: 0.6897, test_loss: 1.0475, test_f1: 0.6121
 epoch: 33, train_loss: 0.6735, test_loss: 1.0306, test_f1: 0.5280
 epoch: 34, train_loss: 0.6584, test_loss: 1.1607, test_f1: 0.4963
 epoch: 35, train_loss: 0.6712, test_loss: 1.0490, test_f1: 0.5942
 epoch: 36, train_loss: 0.6326, test_loss: 1.0715, test_f1: 0.6319
 epoch: 37, train_loss: 0.6502, test_loss: 1.1679, test_f1: 0.5404
 epoch: 38, train_loss: 0.6717, test_loss: 0.9648, test_f1: 0.6460
 epoch: 39, train_loss: 0.6501, test_loss: 1.3203, test_f1: 0.4861
 epoch: 40, train_loss: 0.6328, test_loss: 1.2408, test_f1: 0.5680
 epoch: 41, train_loss: 0.6385, test_loss: 0.9863, test_f1: 0.6308
 epoch: 42, train_loss: 0.6200, test_loss: 1.3193, test_f1: 0.5171
 epoch: 43, train_loss: 0.6343, test_loss: 1.0998, test_f1: 0.5612
 epoch: 44, train_loss: 0.6079, test_loss: 1.2417, test_f1: 0.5977
 epoch: 45, train_loss: 0.6072, test_loss: 1.1069, test_f1: 0.6497
 epoch: 46, train_loss: 0.6168, test_loss: 1.3699, test_f1: 0.4809
 epoch: 47, train_loss: 0.6235, test_loss: 1.0425, test_f1: 0.6072
 epoch: 48, train_loss: 0.6285, test_loss: 1.2512, test_f1: 0.5296
 epoch: 49, train_loss: 0.6264, test_loss: 1.1327, test_f1: 0.5306
 epoch: 50, train_loss: 0.5862, test_loss: 1.0461, test_f1: 0.6255
 epoch: 51, train_loss: 0.5582, test_loss: 1.0981, test_f1: 0.6477
 epoch: 52, train_loss: 0.5503, test_loss: 1.1197, test_f1: 0.6274
 epoch: 53, train_loss: 0.5328, test_loss: 1.1148, test_f1: 0.6203
 epoch: 54, train_loss: 0.5143, test_loss: 1.2610, test_f1: 0.6103
 epoch: 55, train_loss: 0.5295, test_loss: 1.0454, test_f1: 0.6413
 epoch: 56, train_loss: 0.4941, test_loss: 1.3579, test_f1: 0.6071
 epoch: 57, train_loss: 0.5140, test_loss: 1.1685, test_f1: 0.6463
 epoch: 58, train_loss: 0.5058, test_loss: 1.4352, test_f1: 0.5859
 epoch: 59, train_loss: 0.4911, test_loss: 1.2782, test_f1: 0.6020
 epoch: 60, train_loss: 0.5199, test_loss: 1.1850, test_f1: 0.6251
 epoch: 61, train_loss: 0.4941, test_loss: 1.3948, test_f1: 0.5832
 epoch: 62, train_loss: 0.5186, test_loss: 1.3482, test_f1: 0.6077
 epoch: 63, train_loss: 0.5138, test_loss: 1.3054, test_f1: 0.6320
 epoch: 64, train_loss: 0.4713, test_loss: 1.2207, test_f1: 0.6433
 epoch: 65, train_loss: 0.5008, test_loss: 1.3102, test_f1: 0.6363
 epoch: 66, train_loss: 0.4578, test_loss: 1.2184, test_f1: 0.6461
 epoch: 67, train_loss: 0.5247, test_loss: 1.3287, test_f1: 0.5940
 epoch: 68, train_loss: 0.4596, test_loss: 1.2578, test_f1: 0.6505
 epoch: 69, train_loss: 0.4807, test_loss: 1.2549, test_f1: 0.6567
 epoch: 70, train_loss: 0.4565, test_loss: 1.3110, test_f1: 0.6173
 epoch: 71, train_loss: 0.4718, test_loss: 1.2032, test_f1: 0.6357
 epoch: 72, train_loss: 0.4609, test_loss: 1.2398, test_f1: 0.6355
 epoch: 73, train_loss: 0.4378, test_loss: 1.7488, test_f1: 0.5866
 epoch: 74, train_loss: 0.4686, test_loss: 1.4233, test_f1: 0.5920
 epoch: 75, train_loss: 0.4390, test_loss: 1.4718, test_f1: 0.6145
 epoch: 76, train_loss: 0.4605, test_loss: 1.2149, test_f1: 0.6343
 epoch: 77, train_loss: 0.4670, test_loss: 1.6668, test_f1: 0.5913
 epoch: 78, train_loss: 0.4460, test_loss: 1.5070, test_f1: 0.5885
 epoch: 79, train_loss: 0.4590, test_loss: 1.2719, test_f1: 0.6246
 epoch: 80, train_loss: 0.4602, test_loss: 1.8503, test_f1: 0.5742
 epoch: 81, train_loss: 0.4580, test_loss: 1.3681, test_f1: 0.6254
 epoch: 82, train_loss: 0.4311, test_loss: 1.4162, test_f1: 0.6716
 epoch: 83, train_loss: 0.4369, test_loss: 1.5173, test_f1: 0.5969
 epoch: 84, train_loss: 0.4759, test_loss: 1.3783, test_f1: 0.6481
 epoch: 85, train_loss: 0.4576, test_loss: 1.4753, test_f1: 0.6491
 epoch: 86, train_loss: 0.4181, test_loss: 1.3150, test_f1: 0.6554
 epoch: 87, train_loss: 0.4362, test_loss: 1.5416, test_f1: 0.6045
 epoch: 88, train_loss: 0.4388, test_loss: 1.3783, test_f1: 0.6229
 epoch: 89, train_loss: 0.3981, test_loss: 1.5373, test_f1: 0.6340
 epoch: 90, train_loss: 0.4398, test_loss: 1.6427, test_f1: 0.5801
 epoch: 91, train_loss: 0.4427, test_loss: 1.6850, test_f1: 0.5963
 epoch: 92, train_loss: 0.4438, test_loss: 1.7663, test_f1: 0.6141
 epoch: 93, train_loss: 0.4351, test_loss: 1.6611, test_f1: 0.6298
 epoch: 94, train_loss: 0.4295, test_loss: 1.5790, test_f1: 0.6174
 epoch: 95, train_loss: 0.4457, test_loss: 1.5027, test_f1: 0.6024
 epoch: 96, train_loss: 0.4573, test_loss: 1.9570, test_f1: 0.5958
 epoch: 97, train_loss: 0.4038, test_loss: 1.4690, test_f1: 0.6054
 epoch: 98, train_loss: 0.4206, test_loss: 1.5774, test_f1: 0.5755
 epoch: 99, train_loss: 0.4087, test_loss: 1.4863, test_f1: 0.6437
##################ITERATION #5 ****************************************
 epoch: 0, train_loss: 1.1224, test_loss: 1.1117, test_f1: 0.5164
 epoch: 1, train_loss: 0.9083, test_loss: 1.0545, test_f1: 0.4181
 epoch: 2, train_loss: 0.8982, test_loss: 1.1141, test_f1: 0.5030
 epoch: 3, train_loss: 0.8883, test_loss: 1.0427, test_f1: 0.4862
 epoch: 4, train_loss: 0.8855, test_loss: 0.9880, test_f1: 0.5016
 epoch: 5, train_loss: 0.8714, test_loss: 1.0147, test_f1: 0.5339
 epoch: 6, train_loss: 0.8483, test_loss: 0.9845, test_f1: 0.5694
 epoch: 7, train_loss: 0.8570, test_loss: 1.8714, test_f1: 0.3991
 epoch: 8, train_loss: 0.8263, test_loss: 1.1141, test_f1: 0.5183
 epoch: 9, train_loss: 0.8542, test_loss: 1.0465, test_f1: 0.5270
 epoch: 10, train_loss: 0.8461, test_loss: 0.9923, test_f1: 0.5223
 epoch: 11, train_loss: 0.8142, test_loss: 1.1412, test_f1: 0.5146
 epoch: 12, train_loss: 0.8180, test_loss: 1.0632, test_f1: 0.5765
 epoch: 13, train_loss: 0.7913, test_loss: 1.1950, test_f1: 0.5079
 epoch: 14, train_loss: 0.7848, test_loss: 1.1494, test_f1: 0.4796
 epoch: 15, train_loss: 0.8040, test_loss: 1.0945, test_f1: 0.5286
 epoch: 16, train_loss: 0.7895, test_loss: 1.0534, test_f1: 0.5559
 epoch: 17, train_loss: 0.7797, test_loss: 1.0992, test_f1: 0.4788
 epoch: 18, train_loss: 0.7593, test_loss: 1.0722, test_f1: 0.5388
 epoch: 19, train_loss: 0.7418, test_loss: 1.0607, test_f1: 0.5280
 epoch: 20, train_loss: 0.7379, test_loss: 1.1215, test_f1: 0.5639
 epoch: 21, train_loss: 0.7295, test_loss: 1.6276, test_f1: 0.5184
 epoch: 22, train_loss: 0.7434, test_loss: 1.0874, test_f1: 0.5319
 epoch: 23, train_loss: 0.7327, test_loss: 1.0535, test_f1: 0.5535
 epoch: 24, train_loss: 0.6954, test_loss: 1.2657, test_f1: 0.5108
 epoch: 25, train_loss: 0.7129, test_loss: 1.0131, test_f1: 0.5721
 epoch: 26, train_loss: 0.7013, test_loss: 1.0585, test_f1: 0.5702
 epoch: 27, train_loss: 0.7152, test_loss: 1.0929, test_f1: 0.5325
 epoch: 28, train_loss: 0.7399, test_loss: 1.1172, test_f1: 0.5535
 epoch: 29, train_loss: 0.6908, test_loss: 1.1036, test_f1: 0.5888
 epoch: 30, train_loss: 0.6764, test_loss: 1.8350, test_f1: 0.3885
 epoch: 31, train_loss: 0.7085, test_loss: 1.0624, test_f1: 0.5898
 epoch: 32, train_loss: 0.7349, test_loss: 1.2054, test_f1: 0.5480
 epoch: 33, train_loss: 0.7080, test_loss: 1.7587, test_f1: 0.4807
 epoch: 34, train_loss: 0.7078, test_loss: 1.2506, test_f1: 0.4947
 epoch: 35, train_loss: 0.7459, test_loss: 1.3056, test_f1: 0.5273
 epoch: 36, train_loss: 0.7025, test_loss: 1.3594, test_f1: 0.5278
 epoch: 37, train_loss: 0.6738, test_loss: 1.5710, test_f1: 0.5009
 epoch: 38, train_loss: 0.6827, test_loss: 1.0433, test_f1: 0.6093
 epoch: 39, train_loss: 0.6985, test_loss: 1.1403, test_f1: 0.5256
 epoch: 40, train_loss: 0.6600, test_loss: 1.1068, test_f1: 0.5573
 epoch: 41, train_loss: 0.6444, test_loss: 1.7569, test_f1: 0.4638
 epoch: 42, train_loss: 0.6561, test_loss: 1.0979, test_f1: 0.5523
 epoch: 43, train_loss: 0.6460, test_loss: 1.0716, test_f1: 0.5656
 epoch: 44, train_loss: 0.6559, test_loss: 1.0634, test_f1: 0.5575
 epoch: 45, train_loss: 0.6114, test_loss: 1.2202, test_f1: 0.5362
 epoch: 46, train_loss: 0.6587, test_loss: 1.1296, test_f1: 0.6128
 epoch: 47, train_loss: 0.6034, test_loss: 1.1765, test_f1: 0.5716
 epoch: 48, train_loss: 0.6138, test_loss: 1.2734, test_f1: 0.5538
 epoch: 49, train_loss: 0.5939, test_loss: 1.4954, test_f1: 0.6135
 epoch: 50, train_loss: 0.5957, test_loss: 1.3873, test_f1: 0.5251
 epoch: 51, train_loss: 0.5595, test_loss: 1.5341, test_f1: 0.5797
 epoch: 52, train_loss: 0.5462, test_loss: 1.4558, test_f1: 0.6060
 epoch: 53, train_loss: 0.5099, test_loss: 1.6058, test_f1: 0.5855
 epoch: 54, train_loss: 0.5050, test_loss: 1.2674, test_f1: 0.6371
 epoch: 55, train_loss: 0.5304, test_loss: 1.4156, test_f1: 0.5309
 epoch: 56, train_loss: 0.5250, test_loss: 1.3524, test_f1: 0.6160
 epoch: 57, train_loss: 0.4994, test_loss: 1.3152, test_f1: 0.6404
 epoch: 58, train_loss: 0.5134, test_loss: 1.3024, test_f1: 0.5367
 epoch: 59, train_loss: 0.4963, test_loss: 1.3763, test_f1: 0.6176
 epoch: 60, train_loss: 0.5055, test_loss: 1.4458, test_f1: 0.6139
 epoch: 61, train_loss: 0.4969, test_loss: 1.3666, test_f1: 0.5714
 epoch: 62, train_loss: 0.5053, test_loss: 1.6811, test_f1: 0.5672
 epoch: 63, train_loss: 0.5127, test_loss: 1.4134, test_f1: 0.5909
 epoch: 64, train_loss: 0.4793, test_loss: 2.0172, test_f1: 0.5669
 epoch: 65, train_loss: 0.4985, test_loss: 1.2665, test_f1: 0.5762
 epoch: 66, train_loss: 0.4909, test_loss: 1.3556, test_f1: 0.6106
 epoch: 67, train_loss: 0.4674, test_loss: 1.4871, test_f1: 0.6347
 epoch: 68, train_loss: 0.4788, test_loss: 1.9825, test_f1: 0.6291
 epoch: 69, train_loss: 0.4566, test_loss: 1.5038, test_f1: 0.6051
 epoch: 70, train_loss: 0.4798, test_loss: 1.6209, test_f1: 0.6237
 epoch: 71, train_loss: 0.4694, test_loss: 1.7017, test_f1: 0.6136
 epoch: 72, train_loss: 0.4676, test_loss: 1.4567, test_f1: 0.6317
 epoch: 73, train_loss: 0.4581, test_loss: 1.7379, test_f1: 0.6158
 epoch: 74, train_loss: 0.4502, test_loss: 1.7669, test_f1: 0.5940
 epoch: 75, train_loss: 0.4802, test_loss: 1.5230, test_f1: 0.6181
 epoch: 76, train_loss: 0.4674, test_loss: 1.5131, test_f1: 0.6132
 epoch: 77, train_loss: 0.4194, test_loss: 1.9368, test_f1: 0.6197
 epoch: 78, train_loss: 0.4394, test_loss: 1.8749, test_f1: 0.6221
 epoch: 79, train_loss: 0.4459, test_loss: 1.6620, test_f1: 0.6370
 epoch: 80, train_loss: 0.4496, test_loss: 1.8566, test_f1: 0.5741
 epoch: 81, train_loss: 0.4459, test_loss: 1.8717, test_f1: 0.6211
 epoch: 82, train_loss: 0.4209, test_loss: 1.6213, test_f1: 0.6475
 epoch: 83, train_loss: 0.4213, test_loss: 1.8450, test_f1: 0.6094
 epoch: 84, train_loss: 0.4164, test_loss: 2.0137, test_f1: 0.5990
 epoch: 85, train_loss: 0.4321, test_loss: 1.9636, test_f1: 0.6227
 epoch: 86, train_loss: 0.4381, test_loss: 1.4858, test_f1: 0.6127
 epoch: 87, train_loss: 0.4521, test_loss: 1.8557, test_f1: 0.6506
 epoch: 88, train_loss: 0.3984, test_loss: 1.8988, test_f1: 0.5705
 epoch: 89, train_loss: 0.4125, test_loss: 2.1843, test_f1: 0.6457
 epoch: 90, train_loss: 0.4223, test_loss: 2.2332, test_f1: 0.6320
 epoch: 91, train_loss: 0.4124, test_loss: 2.5452, test_f1: 0.6349
 epoch: 92, train_loss: 0.4265, test_loss: 1.5913, test_f1: 0.5942
 epoch: 93, train_loss: 0.4163, test_loss: 2.4019, test_f1: 0.6044
 epoch: 94, train_loss: 0.4295, test_loss: 1.6572, test_f1: 0.6228
 epoch: 95, train_loss: 0.3900, test_loss: 1.7389, test_f1: 0.5891
 epoch: 96, train_loss: 0.4066, test_loss: 1.6825, test_f1: 0.6170
 epoch: 97, train_loss: 0.4178, test_loss: 1.6647, test_f1: 0.6315
 epoch: 98, train_loss: 0.4113, test_loss: 1.7532, test_f1: 0.6066
 epoch: 99, train_loss: 0.3848, test_loss: 1.9360, test_f1: 0.6217
##################ITERATION #6 ****************************************
 epoch: 0, train_loss: 1.1476, test_loss: 1.4162, test_f1: 0.3791
 epoch: 1, train_loss: 0.9836, test_loss: 1.1128, test_f1: 0.4592
 epoch: 2, train_loss: 0.9210, test_loss: 1.0008, test_f1: 0.5412
 epoch: 3, train_loss: 0.8929, test_loss: 1.0233, test_f1: 0.5308
 epoch: 4, train_loss: 0.8706, test_loss: 1.1478, test_f1: 0.4527
 epoch: 5, train_loss: 0.8626, test_loss: 1.0827, test_f1: 0.4986
 epoch: 6, train_loss: 0.8850, test_loss: 1.1541, test_f1: 0.4453
 epoch: 7, train_loss: 0.8428, test_loss: 1.2500, test_f1: 0.4920
 epoch: 8, train_loss: 0.8120, test_loss: 0.9998, test_f1: 0.5074
 epoch: 9, train_loss: 0.8342, test_loss: 1.0124, test_f1: 0.5512
 epoch: 10, train_loss: 0.8141, test_loss: 1.0332, test_f1: 0.5530
 epoch: 11, train_loss: 0.8152, test_loss: 1.0282, test_f1: 0.5078
 epoch: 12, train_loss: 0.8195, test_loss: 1.1289, test_f1: 0.4914
 epoch: 13, train_loss: 0.7939, test_loss: 0.9770, test_f1: 0.6198
 epoch: 14, train_loss: 0.7711, test_loss: 1.0408, test_f1: 0.5278
 epoch: 15, train_loss: 0.7773, test_loss: 1.1889, test_f1: 0.5512
 epoch: 16, train_loss: 0.7770, test_loss: 1.1995, test_f1: 0.5289
 epoch: 17, train_loss: 0.7568, test_loss: 1.1919, test_f1: 0.5366
 epoch: 18, train_loss: 0.7597, test_loss: 1.1739, test_f1: 0.5171
 epoch: 19, train_loss: 0.7581, test_loss: 1.0917, test_f1: 0.5345
 epoch: 20, train_loss: 0.7356, test_loss: 1.2901, test_f1: 0.4800
 epoch: 21, train_loss: 0.7685, test_loss: 1.0976, test_f1: 0.5857
 epoch: 22, train_loss: 0.7096, test_loss: 1.2883, test_f1: 0.4740
 epoch: 23, train_loss: 0.7192, test_loss: 1.0189, test_f1: 0.5848
 epoch: 24, train_loss: 0.7291, test_loss: 1.3254, test_f1: 0.4491
 epoch: 25, train_loss: 0.7635, test_loss: 1.1426, test_f1: 0.5358
 epoch: 26, train_loss: 0.7570, test_loss: 1.1214, test_f1: 0.5665
 epoch: 27, train_loss: 0.7381, test_loss: 1.3572, test_f1: 0.4779
 epoch: 28, train_loss: 0.7023, test_loss: 1.0606, test_f1: 0.5941
 epoch: 29, train_loss: 0.7135, test_loss: 1.1532, test_f1: 0.5085
 epoch: 30, train_loss: 0.7014, test_loss: 1.1069, test_f1: 0.4819
 epoch: 31, train_loss: 0.6943, test_loss: 1.3615, test_f1: 0.5855
 epoch: 32, train_loss: 0.6855, test_loss: 1.3094, test_f1: 0.5454
 epoch: 33, train_loss: 0.6869, test_loss: 1.6358, test_f1: 0.4870
 epoch: 34, train_loss: 0.6704, test_loss: 1.1372, test_f1: 0.5700
 epoch: 35, train_loss: 0.6718, test_loss: 1.0713, test_f1: 0.6014
 epoch: 36, train_loss: 0.6925, test_loss: 1.0199, test_f1: 0.5535
 epoch: 37, train_loss: 0.6437, test_loss: 1.3766, test_f1: 0.5424
 epoch: 38, train_loss: 0.6373, test_loss: 1.1903, test_f1: 0.5581
 epoch: 39, train_loss: 0.6650, test_loss: 1.4652, test_f1: 0.5123
 epoch: 40, train_loss: 0.6458, test_loss: 1.1782, test_f1: 0.6293
 epoch: 41, train_loss: 0.6216, test_loss: 1.4550, test_f1: 0.5907
 epoch: 42, train_loss: 0.6421, test_loss: 1.3116, test_f1: 0.5283
 epoch: 43, train_loss: 0.6248, test_loss: 1.3500, test_f1: 0.5316
 epoch: 44, train_loss: 0.6274, test_loss: 1.3380, test_f1: 0.5622
 epoch: 45, train_loss: 0.6266, test_loss: 1.1618, test_f1: 0.5853
 epoch: 46, train_loss: 0.5959, test_loss: 1.2441, test_f1: 0.5640
 epoch: 47, train_loss: 0.6024, test_loss: 1.5161, test_f1: 0.5608
 epoch: 48, train_loss: 0.5883, test_loss: 1.3397, test_f1: 0.5720
 epoch: 49, train_loss: 0.6352, test_loss: 1.2556, test_f1: 0.5530
 epoch: 50, train_loss: 0.6113, test_loss: 1.5692, test_f1: 0.5798
 epoch: 51, train_loss: 0.5568, test_loss: 1.3858, test_f1: 0.6041
 epoch: 52, train_loss: 0.5538, test_loss: 1.4441, test_f1: 0.5489
 epoch: 53, train_loss: 0.5538, test_loss: 1.3604, test_f1: 0.5612
 epoch: 54, train_loss: 0.5092, test_loss: 1.4153, test_f1: 0.5664
 epoch: 55, train_loss: 0.5048, test_loss: 1.5835, test_f1: 0.5867
 epoch: 56, train_loss: 0.5192, test_loss: 1.5424, test_f1: 0.5741
 epoch: 57, train_loss: 0.5010, test_loss: 1.4521, test_f1: 0.5806
 epoch: 58, train_loss: 0.4870, test_loss: 1.7662, test_f1: 0.5828
 epoch: 59, train_loss: 0.5184, test_loss: 1.5345, test_f1: 0.6058
 epoch: 60, train_loss: 0.5156, test_loss: 1.6828, test_f1: 0.5958
 epoch: 61, train_loss: 0.4810, test_loss: 1.5360, test_f1: 0.5848
 epoch: 62, train_loss: 0.4702, test_loss: 1.8058, test_f1: 0.5873
 epoch: 63, train_loss: 0.4878, test_loss: 1.9366, test_f1: 0.5941
 epoch: 64, train_loss: 0.4747, test_loss: 1.7075, test_f1: 0.5580
 epoch: 65, train_loss: 0.4610, test_loss: 1.5020, test_f1: 0.5600
 epoch: 66, train_loss: 0.4531, test_loss: 1.9393, test_f1: 0.5649
 epoch: 67, train_loss: 0.5164, test_loss: 1.4338, test_f1: 0.5882
 epoch: 68, train_loss: 0.4908, test_loss: 1.4509, test_f1: 0.5836
 epoch: 69, train_loss: 0.4702, test_loss: 1.6486, test_f1: 0.5628
 epoch: 70, train_loss: 0.4552, test_loss: 1.5614, test_f1: 0.5628
 epoch: 71, train_loss: 0.4429, test_loss: 1.8752, test_f1: 0.5434
 epoch: 72, train_loss: 0.4687, test_loss: 1.5565, test_f1: 0.5840
 epoch: 73, train_loss: 0.4445, test_loss: 1.8206, test_f1: 0.5437
 epoch: 74, train_loss: 0.4482, test_loss: 1.4640, test_f1: 0.5813
 epoch: 75, train_loss: 0.4582, test_loss: 1.7159, test_f1: 0.5770
 epoch: 76, train_loss: 0.4331, test_loss: 1.6299, test_f1: 0.5885
 epoch: 77, train_loss: 0.4171, test_loss: 1.6601, test_f1: 0.5893
 epoch: 78, train_loss: 0.4316, test_loss: 1.6787, test_f1: 0.5750
 epoch: 79, train_loss: 0.4074, test_loss: 2.0335, test_f1: 0.5691
 epoch: 80, train_loss: 0.4743, test_loss: 1.6480, test_f1: 0.5814
 epoch: 81, train_loss: 0.4212, test_loss: 1.8860, test_f1: 0.6001
 epoch: 82, train_loss: 0.4573, test_loss: 1.7080, test_f1: 0.6039
 epoch: 83, train_loss: 0.4015, test_loss: 1.6289, test_f1: 0.5810
 epoch: 84, train_loss: 0.4380, test_loss: 1.6271, test_f1: 0.5913
 epoch: 85, train_loss: 0.4199, test_loss: 1.7720, test_f1: 0.6040
 epoch: 86, train_loss: 0.3860, test_loss: 2.0115, test_f1: 0.5982
 epoch: 87, train_loss: 0.4136, test_loss: 1.7298, test_f1: 0.6040
 epoch: 88, train_loss: 0.3927, test_loss: 1.7845, test_f1: 0.5955
 epoch: 89, train_loss: 0.3947, test_loss: 1.6809, test_f1: 0.5620
 epoch: 90, train_loss: 0.4089, test_loss: 1.8488, test_f1: 0.5764
 epoch: 91, train_loss: 0.3917, test_loss: 1.7628, test_f1: 0.5631
 epoch: 92, train_loss: 0.3784, test_loss: 1.7228, test_f1: 0.5917
 epoch: 93, train_loss: 0.4414, test_loss: 1.5488, test_f1: 0.6048
 epoch: 94, train_loss: 0.3624, test_loss: 1.8286, test_f1: 0.5556
 epoch: 95, train_loss: 0.4164, test_loss: 1.7060, test_f1: 0.5539
 epoch: 96, train_loss: 0.3738, test_loss: 1.6767, test_f1: 0.5753
 epoch: 97, train_loss: 0.3947, test_loss: 1.6969, test_f1: 0.5834
 epoch: 98, train_loss: 0.3691, test_loss: 1.6733, test_f1: 0.5643
 epoch: 99, train_loss: 0.3809, test_loss: 2.0117, test_f1: 0.5613
##################ITERATION #7 ****************************************
 epoch: 0, train_loss: 1.1452, test_loss: 1.3025, test_f1: 0.3856
 epoch: 1, train_loss: 0.9461, test_loss: 1.0162, test_f1: 0.5263
 epoch: 2, train_loss: 0.9287, test_loss: 1.0346, test_f1: 0.5398
 epoch: 3, train_loss: 0.8658, test_loss: 1.0473, test_f1: 0.5087
 epoch: 4, train_loss: 0.8821, test_loss: 1.0496, test_f1: 0.5090
 epoch: 5, train_loss: 0.8605, test_loss: 1.0537, test_f1: 0.5802
 epoch: 6, train_loss: 0.8432, test_loss: 1.0640, test_f1: 0.4811
 epoch: 7, train_loss: 0.8375, test_loss: 1.0763, test_f1: 0.5246
 epoch: 8, train_loss: 0.8475, test_loss: 1.0334, test_f1: 0.5408
 epoch: 9, train_loss: 0.8013, test_loss: 1.2252, test_f1: 0.4288
 epoch: 10, train_loss: 0.8051, test_loss: 1.0594, test_f1: 0.6162
 epoch: 11, train_loss: 0.8072, test_loss: 1.0189, test_f1: 0.5627
 epoch: 12, train_loss: 0.7729, test_loss: 1.1895, test_f1: 0.4725
 epoch: 13, train_loss: 0.7763, test_loss: 1.7464, test_f1: 0.4591
 epoch: 14, train_loss: 0.7612, test_loss: 1.5135, test_f1: 0.5018
 epoch: 15, train_loss: 0.7615, test_loss: 1.1300, test_f1: 0.5328
 epoch: 16, train_loss: 0.7937, test_loss: 1.0129, test_f1: 0.6063
 epoch: 17, train_loss: 0.7380, test_loss: 1.2491, test_f1: 0.5535
 epoch: 18, train_loss: 0.7575, test_loss: 1.0018, test_f1: 0.6178
 epoch: 19, train_loss: 0.7352, test_loss: 1.2214, test_f1: 0.5521
 epoch: 20, train_loss: 0.7356, test_loss: 1.5654, test_f1: 0.4637
 epoch: 21, train_loss: 0.7342, test_loss: 1.0669, test_f1: 0.5158
 epoch: 22, train_loss: 0.7283, test_loss: 1.0848, test_f1: 0.5673
 epoch: 23, train_loss: 0.6883, test_loss: 1.1835, test_f1: 0.5575
 epoch: 24, train_loss: 0.7212, test_loss: 1.0585, test_f1: 0.4900
 epoch: 25, train_loss: 0.7188, test_loss: 1.1620, test_f1: 0.4672
 epoch: 26, train_loss: 0.7116, test_loss: 1.0907, test_f1: 0.5232
 epoch: 27, train_loss: 0.7390, test_loss: 1.2191, test_f1: 0.5847
 epoch: 28, train_loss: 0.7180, test_loss: 1.0460, test_f1: 0.5836
 epoch: 29, train_loss: 0.7131, test_loss: 1.5687, test_f1: 0.5388
 epoch: 30, train_loss: 0.6913, test_loss: 1.3429, test_f1: 0.5241
 epoch: 31, train_loss: 0.6879, test_loss: 1.1622, test_f1: 0.5183
 epoch: 32, train_loss: 0.6862, test_loss: 1.2449, test_f1: 0.5511
 epoch: 33, train_loss: 0.6768, test_loss: 1.1546, test_f1: 0.5617
 epoch: 34, train_loss: 0.6748, test_loss: 1.2350, test_f1: 0.5457
 epoch: 35, train_loss: 0.6820, test_loss: 1.1313, test_f1: 0.6040
 epoch: 36, train_loss: 0.6722, test_loss: 0.9888, test_f1: 0.6283
 epoch: 37, train_loss: 0.6393, test_loss: 2.2169, test_f1: 0.5084
 epoch: 38, train_loss: 0.6901, test_loss: 1.1697, test_f1: 0.5474
 epoch: 39, train_loss: 0.6226, test_loss: 5.1005, test_f1: 0.3537
 epoch: 40, train_loss: 0.6878, test_loss: 2.0333, test_f1: 0.4908
 epoch: 41, train_loss: 0.6487, test_loss: 1.3069, test_f1: 0.5775
 epoch: 42, train_loss: 0.6325, test_loss: 1.5260, test_f1: 0.4801
 epoch: 43, train_loss: 0.6255, test_loss: 1.3371, test_f1: 0.5454
 epoch: 44, train_loss: 0.6370, test_loss: 1.1838, test_f1: 0.5750
 epoch: 45, train_loss: 0.6015, test_loss: 1.5387, test_f1: 0.5184
 epoch: 46, train_loss: 0.6226, test_loss: 1.2850, test_f1: 0.5121
 epoch: 47, train_loss: 0.6404, test_loss: 1.3200, test_f1: 0.5709
 epoch: 48, train_loss: 0.6278, test_loss: 1.2471, test_f1: 0.5485
 epoch: 49, train_loss: 0.6030, test_loss: 1.2859, test_f1: 0.5668
 epoch: 50, train_loss: 0.5930, test_loss: 1.3041, test_f1: 0.5341
 epoch: 51, train_loss: 0.5682, test_loss: 1.2510, test_f1: 0.5658
 epoch: 52, train_loss: 0.5348, test_loss: 1.9337, test_f1: 0.5959
 epoch: 53, train_loss: 0.5287, test_loss: 1.6770, test_f1: 0.5848
 epoch: 54, train_loss: 0.5463, test_loss: 1.5300, test_f1: 0.6093
 epoch: 55, train_loss: 0.5226, test_loss: 1.7381, test_f1: 0.5813
 epoch: 56, train_loss: 0.5264, test_loss: 1.5400, test_f1: 0.6292
 epoch: 57, train_loss: 0.5087, test_loss: 1.6371, test_f1: 0.6130
 epoch: 58, train_loss: 0.5257, test_loss: 1.5993, test_f1: 0.6149
 epoch: 59, train_loss: 0.4949, test_loss: 1.6676, test_f1: 0.6082
 epoch: 60, train_loss: 0.5160, test_loss: 1.6303, test_f1: 0.5522
 epoch: 61, train_loss: 0.5024, test_loss: 1.5868, test_f1: 0.6590
 epoch: 62, train_loss: 0.4868, test_loss: 1.5116, test_f1: 0.5638
 epoch: 63, train_loss: 0.4709, test_loss: 1.4376, test_f1: 0.6308
 epoch: 64, train_loss: 0.4638, test_loss: 1.9057, test_f1: 0.5810
 epoch: 65, train_loss: 0.5058, test_loss: 1.5446, test_f1: 0.6157
 epoch: 66, train_loss: 0.4599, test_loss: 1.7993, test_f1: 0.5978
 epoch: 67, train_loss: 0.4782, test_loss: 1.5513, test_f1: 0.5661
 epoch: 68, train_loss: 0.4619, test_loss: 2.1944, test_f1: 0.5494
 epoch: 69, train_loss: 0.4667, test_loss: 1.4441, test_f1: 0.5927
 epoch: 70, train_loss: 0.4709, test_loss: 1.5700, test_f1: 0.5785
 epoch: 71, train_loss: 0.4807, test_loss: 1.6113, test_f1: 0.5594
 epoch: 72, train_loss: 0.4542, test_loss: 1.4158, test_f1: 0.6193
 epoch: 73, train_loss: 0.4607, test_loss: 1.6914, test_f1: 0.6084
 epoch: 74, train_loss: 0.4611, test_loss: 1.9275, test_f1: 0.6087
 epoch: 75, train_loss: 0.4290, test_loss: 1.7500, test_f1: 0.5660
 epoch: 76, train_loss: 0.4049, test_loss: 1.6167, test_f1: 0.6162
 epoch: 77, train_loss: 0.4378, test_loss: 2.2556, test_f1: 0.5724
 epoch: 78, train_loss: 0.4493, test_loss: 1.7606, test_f1: 0.5696
 epoch: 79, train_loss: 0.4244, test_loss: 2.6629, test_f1: 0.5274
 epoch: 80, train_loss: 0.4274, test_loss: 1.8075, test_f1: 0.5826
 epoch: 81, train_loss: 0.4137, test_loss: 1.8108, test_f1: 0.6214
 epoch: 82, train_loss: 0.4186, test_loss: 1.5615, test_f1: 0.5934
 epoch: 83, train_loss: 0.4668, test_loss: 1.7280, test_f1: 0.6036
 epoch: 84, train_loss: 0.4170, test_loss: 1.6135, test_f1: 0.5651
 epoch: 85, train_loss: 0.3946, test_loss: 1.7703, test_f1: 0.6147
 epoch: 86, train_loss: 0.4023, test_loss: 1.9592, test_f1: 0.5902
 epoch: 87, train_loss: 0.4245, test_loss: 1.8386, test_f1: 0.5760
 epoch: 88, train_loss: 0.4327, test_loss: 1.6855, test_f1: 0.5949
 epoch: 89, train_loss: 0.4394, test_loss: 1.9426, test_f1: 0.6011
 epoch: 90, train_loss: 0.4508, test_loss: 1.6767, test_f1: 0.5390
 epoch: 91, train_loss: 0.4314, test_loss: 1.8164, test_f1: 0.6124
 epoch: 92, train_loss: 0.4050, test_loss: 1.6566, test_f1: 0.6175
 epoch: 93, train_loss: 0.4015, test_loss: 1.6682, test_f1: 0.5831
 epoch: 94, train_loss: 0.4490, test_loss: 1.7623, test_f1: 0.5735
 epoch: 95, train_loss: 0.4223, test_loss: 1.3724, test_f1: 0.6625
 epoch: 96, train_loss: 0.4304, test_loss: 1.9471, test_f1: 0.5691
 epoch: 97, train_loss: 0.3910, test_loss: 1.9628, test_f1: 0.5478
 epoch: 98, train_loss: 0.3988, test_loss: 2.1223, test_f1: 0.5851
 epoch: 99, train_loss: 0.3782, test_loss: 1.8457, test_f1: 0.5980
##################ITERATION #8 ****************************************
 epoch: 0, train_loss: 1.1426, test_loss: 1.1275, test_f1: 0.5428
 epoch: 1, train_loss: 0.9107, test_loss: 1.1404, test_f1: 0.4898
 epoch: 2, train_loss: 0.8988, test_loss: 1.1373, test_f1: 0.4715
 epoch: 3, train_loss: 0.8654, test_loss: 0.9865, test_f1: 0.5234
 epoch: 4, train_loss: 0.8612, test_loss: 1.0187, test_f1: 0.5260
 epoch: 5, train_loss: 0.8416, test_loss: 1.0966, test_f1: 0.4710
 epoch: 6, train_loss: 0.8279, test_loss: 1.0083, test_f1: 0.5754
 epoch: 7, train_loss: 0.8262, test_loss: 1.0295, test_f1: 0.5289
 epoch: 8, train_loss: 0.8328, test_loss: 1.0391, test_f1: 0.5450
 epoch: 9, train_loss: 0.8099, test_loss: 1.0838, test_f1: 0.4802
 epoch: 10, train_loss: 0.8276, test_loss: 2.1422, test_f1: 0.3615
 epoch: 11, train_loss: 0.8368, test_loss: 1.0112, test_f1: 0.5073
 epoch: 12, train_loss: 0.7986, test_loss: 1.0560, test_f1: 0.5479
 epoch: 13, train_loss: 0.7933, test_loss: 1.0741, test_f1: 0.5142
 epoch: 14, train_loss: 0.7932, test_loss: 1.0190, test_f1: 0.5360
 epoch: 15, train_loss: 0.7485, test_loss: 1.0460, test_f1: 0.6215
 epoch: 16, train_loss: 0.7583, test_loss: 1.1995, test_f1: 0.5125
 epoch: 17, train_loss: 0.7769, test_loss: 1.0931, test_f1: 0.4703
 epoch: 18, train_loss: 0.7572, test_loss: 1.0918, test_f1: 0.5314
 epoch: 19, train_loss: 0.7791, test_loss: 0.9858, test_f1: 0.5628
 epoch: 20, train_loss: 0.7613, test_loss: 1.0751, test_f1: 0.5006
 epoch: 21, train_loss: 0.7239, test_loss: 1.0801, test_f1: 0.5478
 epoch: 22, train_loss: 0.7011, test_loss: 1.1121, test_f1: 0.5311
 epoch: 23, train_loss: 0.7181, test_loss: 1.0446, test_f1: 0.5506
 epoch: 24, train_loss: 0.7091, test_loss: 1.1990, test_f1: 0.4809
 epoch: 25, train_loss: 0.7086, test_loss: 1.1320, test_f1: 0.5737
 epoch: 26, train_loss: 0.6958, test_loss: 1.1123, test_f1: 0.5071
 epoch: 27, train_loss: 0.6899, test_loss: 1.1172, test_f1: 0.5486
 epoch: 28, train_loss: 0.7064, test_loss: 0.9946, test_f1: 0.6140
 epoch: 29, train_loss: 0.6722, test_loss: 1.2929, test_f1: 0.5040
 epoch: 30, train_loss: 0.6739, test_loss: 1.1570, test_f1: 0.5102
 epoch: 31, train_loss: 0.6661, test_loss: 1.3241, test_f1: 0.5445
 epoch: 32, train_loss: 0.7097, test_loss: 1.2049, test_f1: 0.5348
 epoch: 33, train_loss: 0.6889, test_loss: 1.1439, test_f1: 0.5141
 epoch: 34, train_loss: 0.6585, test_loss: 1.2016, test_f1: 0.5616
 epoch: 35, train_loss: 0.6730, test_loss: 1.0588, test_f1: 0.5032
 epoch: 36, train_loss: 0.6518, test_loss: 1.0825, test_f1: 0.5291
 epoch: 37, train_loss: 0.6588, test_loss: 1.0935, test_f1: 0.5630
 epoch: 38, train_loss: 0.6374, test_loss: 1.0257, test_f1: 0.6370
 epoch: 39, train_loss: 0.6389, test_loss: 0.9958, test_f1: 0.6502
 epoch: 40, train_loss: 0.6617, test_loss: 1.0637, test_f1: 0.5469
 epoch: 41, train_loss: 0.6192, test_loss: 1.1389, test_f1: 0.5678
 epoch: 42, train_loss: 0.6418, test_loss: 1.0772, test_f1: 0.5721
 epoch: 43, train_loss: 0.6424, test_loss: 1.8908, test_f1: 0.4887
 epoch: 44, train_loss: 0.6362, test_loss: 1.0423, test_f1: 0.5975
 epoch: 45, train_loss: 0.6359, test_loss: 1.0272, test_f1: 0.6091
 epoch: 46, train_loss: 0.6310, test_loss: 1.2465, test_f1: 0.5252
 epoch: 47, train_loss: 0.6041, test_loss: 1.1756, test_f1: 0.5653
 epoch: 48, train_loss: 0.6209, test_loss: 1.1584, test_f1: 0.6123
 epoch: 49, train_loss: 0.6254, test_loss: 1.0269, test_f1: 0.6274
 epoch: 50, train_loss: 0.6228, test_loss: 1.4427, test_f1: 0.5570
 epoch: 51, train_loss: 0.5713, test_loss: 1.1492, test_f1: 0.5725
 epoch: 52, train_loss: 0.5497, test_loss: 1.2740, test_f1: 0.5780
 epoch: 53, train_loss: 0.5182, test_loss: 1.1781, test_f1: 0.5891
 epoch: 54, train_loss: 0.5068, test_loss: 1.1544, test_f1: 0.5845
 epoch: 55, train_loss: 0.5170, test_loss: 1.1541, test_f1: 0.6403
 epoch: 56, train_loss: 0.4851, test_loss: 1.3216, test_f1: 0.6255
 epoch: 57, train_loss: 0.5296, test_loss: 1.3883, test_f1: 0.5190
 epoch: 58, train_loss: 0.5486, test_loss: 1.1958, test_f1: 0.6326
 epoch: 59, train_loss: 0.4992, test_loss: 1.1736, test_f1: 0.6382
 epoch: 60, train_loss: 0.4890, test_loss: 1.2333, test_f1: 0.6402
 epoch: 61, train_loss: 0.4854, test_loss: 1.3060, test_f1: 0.6253
 epoch: 62, train_loss: 0.5072, test_loss: 1.1745, test_f1: 0.5849
 epoch: 63, train_loss: 0.4977, test_loss: 1.2452, test_f1: 0.6368
 epoch: 64, train_loss: 0.4710, test_loss: 1.1507, test_f1: 0.6171
 epoch: 65, train_loss: 0.4587, test_loss: 1.1790, test_f1: 0.5693
 epoch: 66, train_loss: 0.4634, test_loss: 1.1908, test_f1: 0.6143
 epoch: 67, train_loss: 0.4794, test_loss: 1.2776, test_f1: 0.5857
 epoch: 68, train_loss: 0.4770, test_loss: 1.2475, test_f1: 0.6176
 epoch: 69, train_loss: 0.4557, test_loss: 1.3346, test_f1: 0.6156
 epoch: 70, train_loss: 0.4779, test_loss: 1.2142, test_f1: 0.6110
 epoch: 71, train_loss: 0.4454, test_loss: 1.3982, test_f1: 0.6305
 epoch: 72, train_loss: 0.4671, test_loss: 1.1872, test_f1: 0.6332
 epoch: 73, train_loss: 0.4565, test_loss: 1.3891, test_f1: 0.6534
 epoch: 74, train_loss: 0.4428, test_loss: 1.5776, test_f1: 0.6446
 epoch: 75, train_loss: 0.4335, test_loss: 1.5830, test_f1: 0.5829
 epoch: 76, train_loss: 0.4314, test_loss: 1.2607, test_f1: 0.6028
 epoch: 77, train_loss: 0.4155, test_loss: 1.4676, test_f1: 0.6572
 epoch: 78, train_loss: 0.4080, test_loss: 1.3532, test_f1: 0.5735
 epoch: 79, train_loss: 0.4349, test_loss: 1.2369, test_f1: 0.6632
 epoch: 80, train_loss: 0.4480, test_loss: 1.2685, test_f1: 0.6551
 epoch: 81, train_loss: 0.4636, test_loss: 1.1990, test_f1: 0.6268
 epoch: 82, train_loss: 0.4670, test_loss: 1.6428, test_f1: 0.5861
 epoch: 83, train_loss: 0.4255, test_loss: 1.3711, test_f1: 0.6002
 epoch: 84, train_loss: 0.4578, test_loss: 1.3465, test_f1: 0.5947
 epoch: 85, train_loss: 0.4097, test_loss: 1.4175, test_f1: 0.6198
 epoch: 86, train_loss: 0.4037, test_loss: 1.5533, test_f1: 0.6425
 epoch: 87, train_loss: 0.4377, test_loss: 1.3493, test_f1: 0.6090
 epoch: 88, train_loss: 0.3936, test_loss: 1.2877, test_f1: 0.6310
 epoch: 89, train_loss: 0.4184, test_loss: 1.3153, test_f1: 0.5802
 epoch: 90, train_loss: 0.3889, test_loss: 1.4014, test_f1: 0.6454
 epoch: 91, train_loss: 0.4131, test_loss: 1.4423, test_f1: 0.6142
 epoch: 92, train_loss: 0.4058, test_loss: 1.4006, test_f1: 0.6110
 epoch: 93, train_loss: 0.3760, test_loss: 1.3980, test_f1: 0.6172
 epoch: 94, train_loss: 0.4009, test_loss: 1.2514, test_f1: 0.6286
 epoch: 95, train_loss: 0.4399, test_loss: 1.7523, test_f1: 0.5255
 epoch: 96, train_loss: 0.4230, test_loss: 1.4838, test_f1: 0.6111
 epoch: 97, train_loss: 0.4164, test_loss: 1.2660, test_f1: 0.6286
 epoch: 98, train_loss: 0.3994, test_loss: 1.3828, test_f1: 0.6021
 epoch: 99, train_loss: 0.4150, test_loss: 1.6212, test_f1: 0.6088
##################ITERATION #9 ****************************************
 epoch: 0, train_loss: 1.1594, test_loss: 1.3440, test_f1: 0.3084
 epoch: 1, train_loss: 1.0410, test_loss: 1.0924, test_f1: 0.5042
 epoch: 2, train_loss: 0.9985, test_loss: 1.0330, test_f1: 0.5366
 epoch: 3, train_loss: 0.9496, test_loss: 1.4437, test_f1: 0.2954
 epoch: 4, train_loss: 0.9300, test_loss: 1.0396, test_f1: 0.5499
 epoch: 5, train_loss: 0.9222, test_loss: 0.9805, test_f1: 0.5221
 epoch: 6, train_loss: 0.8725, test_loss: 1.0126, test_f1: 0.4963
 epoch: 7, train_loss: 0.8859, test_loss: 1.0107, test_f1: 0.5395
 epoch: 8, train_loss: 0.8783, test_loss: 1.1268, test_f1: 0.5021
 epoch: 9, train_loss: 0.8609, test_loss: 0.9527, test_f1: 0.5465
 epoch: 10, train_loss: 0.8787, test_loss: 1.0272, test_f1: 0.5333
 epoch: 11, train_loss: 0.8813, test_loss: 0.9709, test_f1: 0.5972
 epoch: 12, train_loss: 0.8659, test_loss: 0.9994, test_f1: 0.5639
 epoch: 13, train_loss: 0.8471, test_loss: 1.1015, test_f1: 0.4528
 epoch: 14, train_loss: 0.8452, test_loss: 1.0039, test_f1: 0.5581
 epoch: 15, train_loss: 0.8388, test_loss: 1.0169, test_f1: 0.5257
 epoch: 16, train_loss: 0.8459, test_loss: 0.9624, test_f1: 0.5714
 epoch: 17, train_loss: 0.8511, test_loss: 1.0234, test_f1: 0.4452
 epoch: 18, train_loss: 0.8443, test_loss: 0.9840, test_f1: 0.4719
 epoch: 19, train_loss: 0.8248, test_loss: 1.0052, test_f1: 0.5353
 epoch: 20, train_loss: 0.8216, test_loss: 1.0596, test_f1: 0.5443
 epoch: 21, train_loss: 0.8364, test_loss: 0.9528, test_f1: 0.5851
 epoch: 22, train_loss: 0.8453, test_loss: 0.9575, test_f1: 0.5349
 epoch: 23, train_loss: 0.8463, test_loss: 1.2004, test_f1: 0.5258
 epoch: 24, train_loss: 0.8221, test_loss: 1.0047, test_f1: 0.5632
 epoch: 25, train_loss: 0.8359, test_loss: 1.0682, test_f1: 0.5782
 epoch: 26, train_loss: 0.8345, test_loss: 1.0390, test_f1: 0.5128
 epoch: 27, train_loss: 0.8336, test_loss: 0.9764, test_f1: 0.5671
 epoch: 28, train_loss: 0.8091, test_loss: 0.9757, test_f1: 0.5474
 epoch: 29, train_loss: 0.7975, test_loss: 0.9490, test_f1: 0.5442
 epoch: 30, train_loss: 0.8055, test_loss: 0.9695, test_f1: 0.5902
 epoch: 31, train_loss: 0.8060, test_loss: 1.0285, test_f1: 0.5308
 epoch: 32, train_loss: 0.8186, test_loss: 1.0213, test_f1: 0.4402
 epoch: 33, train_loss: 0.8177, test_loss: 1.0057, test_f1: 0.5407
 epoch: 34, train_loss: 0.8124, test_loss: 1.1617, test_f1: 0.4824
 epoch: 35, train_loss: 0.8149, test_loss: 0.9485, test_f1: 0.5535
 epoch: 36, train_loss: 0.8069, test_loss: 1.1123, test_f1: 0.5077
 epoch: 37, train_loss: 0.7889, test_loss: 0.9844, test_f1: 0.5124
 epoch: 38, train_loss: 0.7876, test_loss: 1.1872, test_f1: 0.4643
 epoch: 39, train_loss: 0.7990, test_loss: 1.0210, test_f1: 0.5130
 epoch: 40, train_loss: 0.8024, test_loss: 1.3183, test_f1: 0.4652
 epoch: 41, train_loss: 0.7646, test_loss: 1.0166, test_f1: 0.5515
 epoch: 42, train_loss: 0.8093, test_loss: 1.0042, test_f1: 0.5206
 epoch: 43, train_loss: 0.7831, test_loss: 1.1200, test_f1: 0.5633
 epoch: 44, train_loss: 0.7804, test_loss: 1.0612, test_f1: 0.5047
 epoch: 45, train_loss: 0.7539, test_loss: 1.0991, test_f1: 0.5941
 epoch: 46, train_loss: 0.7513, test_loss: 1.1883, test_f1: 0.4895
 epoch: 47, train_loss: 0.7582, test_loss: 1.1590, test_f1: 0.5150
 epoch: 48, train_loss: 0.7401, test_loss: 1.1531, test_f1: 0.4200
 epoch: 49, train_loss: 0.7457, test_loss: 1.6325, test_f1: 0.5078
 epoch: 50, train_loss: 0.7296, test_loss: 1.1508, test_f1: 0.4489
 epoch: 51, train_loss: 0.6833, test_loss: 1.3306, test_f1: 0.5395
 epoch: 52, train_loss: 0.6793, test_loss: 1.0584, test_f1: 0.5973
 epoch: 53, train_loss: 0.6815, test_loss: 1.0651, test_f1: 0.6367
 epoch: 54, train_loss: 0.6513, test_loss: 1.1824, test_f1: 0.5656
 epoch: 55, train_loss: 0.6592, test_loss: 1.3806, test_f1: 0.5634
 epoch: 56, train_loss: 0.6270, test_loss: 1.2377, test_f1: 0.5682
 epoch: 57, train_loss: 0.6337, test_loss: 1.3686, test_f1: 0.5785
 epoch: 58, train_loss: 0.6615, test_loss: 1.4489, test_f1: 0.5468
 epoch: 59, train_loss: 0.6473, test_loss: 1.1605, test_f1: 0.5755
 epoch: 60, train_loss: 0.6065, test_loss: 1.3717, test_f1: 0.5930
 epoch: 61, train_loss: 0.6197, test_loss: 1.2940, test_f1: 0.6009
 epoch: 62, train_loss: 0.6247, test_loss: 1.2137, test_f1: 0.5933
 epoch: 63, train_loss: 0.6116, test_loss: 1.3939, test_f1: 0.6024
 epoch: 64, train_loss: 0.6289, test_loss: 1.4075, test_f1: 0.6051
 epoch: 65, train_loss: 0.6283, test_loss: 1.2668, test_f1: 0.6019
 epoch: 66, train_loss: 0.6197, test_loss: 1.5335, test_f1: 0.5804
 epoch: 67, train_loss: 0.6065, test_loss: 1.2310, test_f1: 0.6251
 epoch: 68, train_loss: 0.6018, test_loss: 1.3314, test_f1: 0.5998
 epoch: 69, train_loss: 0.6204, test_loss: 1.0730, test_f1: 0.6322
 epoch: 70, train_loss: 0.5764, test_loss: 1.3048, test_f1: 0.6111
 epoch: 71, train_loss: 0.5968, test_loss: 1.4747, test_f1: 0.5865
 epoch: 72, train_loss: 0.5885, test_loss: 1.2347, test_f1: 0.6290
 epoch: 73, train_loss: 0.5936, test_loss: 1.4107, test_f1: 0.5783
 epoch: 74, train_loss: 0.6388, test_loss: 1.4530, test_f1: 0.4663
 epoch: 75, train_loss: 0.5977, test_loss: 1.6559, test_f1: 0.5699
 epoch: 76, train_loss: 0.5857, test_loss: 1.4176, test_f1: 0.5836
 epoch: 77, train_loss: 0.5867, test_loss: 1.6746, test_f1: 0.6052
 epoch: 78, train_loss: 0.5912, test_loss: 1.2714, test_f1: 0.6344
 epoch: 79, train_loss: 0.5642, test_loss: 1.3041, test_f1: 0.6267
 epoch: 80, train_loss: 0.5540, test_loss: 1.3593, test_f1: 0.5728
 epoch: 81, train_loss: 0.5336, test_loss: 1.3380, test_f1: 0.6186
 epoch: 82, train_loss: 0.5595, test_loss: 1.3698, test_f1: 0.6341
 epoch: 83, train_loss: 0.5304, test_loss: 1.2633, test_f1: 0.6234
 epoch: 84, train_loss: 0.5642, test_loss: 1.4412, test_f1: 0.6119
 epoch: 85, train_loss: 0.5283, test_loss: 1.7132, test_f1: 0.6325
 epoch: 86, train_loss: 0.5682, test_loss: 1.4923, test_f1: 0.6078
 epoch: 87, train_loss: 0.5461, test_loss: 1.4087, test_f1: 0.5786
 epoch: 88, train_loss: 0.5267, test_loss: 1.7298, test_f1: 0.6057
 epoch: 89, train_loss: 0.5284, test_loss: 1.5548, test_f1: 0.5865
 epoch: 90, train_loss: 0.5851, test_loss: 1.2429, test_f1: 0.6389
 epoch: 91, train_loss: 0.5739, test_loss: 1.6345, test_f1: 0.5473
 epoch: 92, train_loss: 0.5446, test_loss: 1.5505, test_f1: 0.5948
 epoch: 93, train_loss: 0.5662, test_loss: 1.3320, test_f1: 0.6161
 epoch: 94, train_loss: 0.5376, test_loss: 1.4121, test_f1: 0.6061
 epoch: 95, train_loss: 0.5377, test_loss: 1.4269, test_f1: 0.6085
 epoch: 96, train_loss: 0.5391, test_loss: 1.3832, test_f1: 0.6119
 epoch: 97, train_loss: 0.5127, test_loss: 1.3704, test_f1: 0.6609
 epoch: 98, train_loss: 0.5198, test_loss: 1.5225, test_f1: 0.5990
 epoch: 99, train_loss: 0.5277, test_loss: 1.3198, test_f1: 0.6430

Training completed in 791.80 seconds
Best F1: 0.6842 at epoch 41
Mean F1 across iterations: 0.6620  0.0151
========================FINAL RESULTS================================
FEGIN weighted F1: 0.6842  0.0151
python main.py --data ltspice_demos --representation component_pin_net --model FEGIN --layers 2 --hiddens 64 --batch_size 32 --lr 0.01 --emb_size 128 --epochs 100 --save_appendix component_pin_net_L2_H64_BS32_LR0.01_E128 --no_val
-----



STDERR:
  File "main.py", line 370, in <module>
    main()
  File "main.py", line 254, in main
    dataset = dataset_class(
  File "/home/philip/projects/ltspice_examples_code_repo/Circuit-Completion-Using-GNNs/component_classification_with_link_prediction_head/evaluation/FEGIN/kernel/circuit_datasets.py", line 15, in __init__
    self.data, self.slices = torch.load(self.processed_paths[0])
  File "/home/philip/.local/lib/python3.8/site-packages/torch/serialization.py", line 1040, in load
    warnings.warn(
  File "/usr/lib/python3.8/warnings.py", line 109, in _showwarnmsg
    sw(msg.message, msg.category, msg.filename, msg.lineno,
  File "main.py", line 47, in warn_with_traceback
    traceback.print_stack(file=log)
/home/philip/projects/ltspice_examples_code_repo/Circuit-Completion-Using-GNNs/component_classification_with_link_prediction_head/evaluation/FEGIN/kernel/circuit_datasets.py:15: FutureWarning: You are using `torch.load` with `weights_only=False` (the current default value), which uses the default pickle module implicitly. It is possible to construct malicious pickle data which will execute arbitrary code during unpickling (See https://github.com/pytorch/pytorch/blob/main/SECURITY.md#untrusted-models for more details). In a future release, the default value for `weights_only` will be flipped to `True`. This limits the functions that could be executed during unpickling. Arbitrary objects will no longer be allowed to be loaded via this mode unless they are explicitly allowlisted by the user via `torch.serialization.add_safe_globals`. We recommend you start setting `weights_only=True` for any use case where you don't have full control of the loaded file. Please open an issue on GitHub for any issues related to this experimental feature.
  self.data, self.slices = torch.load(self.processed_paths[0])
