STDOUT:
Results will be saved in /home/philip/projects/ltspice_examples_code_repo/Circuit-Completion-Using-GNNs/component_classification_with_link_prediction_head/evaluation/FEGIN/results/model_FEGIN_dataset_ltspice_examples
Command line input: python main.py --data ltspice_examples --representation component_component --model FEGIN --layers 5 --hiddens 32 --batch_size 128 --lr 0.0001 --emb_size 512 --epochs 100 --save_appendix component_component_L5_H32_BS128_LR0.0001_E512 --no_val
 is saved.
-----
ltspice_examples - FEGIN
Using 5 layers, 32 hidden units, h = 2
Loading component_component representation dataset
ENTERED
Training FEGIN on component_component representation
Train: 3556, Test: 845
##################ITERATION #0 ****************************************
 epoch: 0, train_loss: 1.3589, test_loss: 1.3622, test_f1: 0.2274
 epoch: 1, train_loss: 1.3520, test_loss: 1.3572, test_f1: 0.2274
 epoch: 2, train_loss: 1.3468, test_loss: 1.3512, test_f1: 0.2274
 epoch: 3, train_loss: 1.3425, test_loss: 1.3463, test_f1: 0.2274
 epoch: 4, train_loss: 1.3387, test_loss: 1.3421, test_f1: 0.2274
 epoch: 5, train_loss: 1.3324, test_loss: 1.3370, test_f1: 0.2274
 epoch: 6, train_loss: 1.3275, test_loss: 1.3322, test_f1: 0.2274
 epoch: 7, train_loss: 1.3214, test_loss: 1.3276, test_f1: 0.2274
 epoch: 8, train_loss: 1.3157, test_loss: 1.3210, test_f1: 0.2274
 epoch: 9, train_loss: 1.3089, test_loss: 1.3167, test_f1: 0.2274
 epoch: 10, train_loss: 1.3036, test_loss: 1.3115, test_f1: 0.2274
 epoch: 11, train_loss: 1.2961, test_loss: 1.3042, test_f1: 0.2274
 epoch: 12, train_loss: 1.2910, test_loss: 1.2984, test_f1: 0.2274
 epoch: 13, train_loss: 1.2864, test_loss: 1.2918, test_f1: 0.2274
 epoch: 14, train_loss: 1.2788, test_loss: 1.2859, test_f1: 0.2274
 epoch: 15, train_loss: 1.2739, test_loss: 1.2794, test_f1: 0.2274
 epoch: 16, train_loss: 1.2686, test_loss: 1.2732, test_f1: 0.2274
 epoch: 17, train_loss: 1.2638, test_loss: 1.2658, test_f1: 0.2274
 epoch: 18, train_loss: 1.2632, test_loss: 1.2597, test_f1: 0.2274
 epoch: 19, train_loss: 1.2546, test_loss: 1.2548, test_f1: 0.2274
 epoch: 20, train_loss: 1.2515, test_loss: 1.2497, test_f1: 0.2274
 epoch: 21, train_loss: 1.2472, test_loss: 1.2449, test_f1: 0.2274
 epoch: 22, train_loss: 1.2404, test_loss: 1.2390, test_f1: 0.2274
 epoch: 23, train_loss: 1.2341, test_loss: 1.2339, test_f1: 0.2274
 epoch: 24, train_loss: 1.2346, test_loss: 1.2289, test_f1: 0.2274
 epoch: 25, train_loss: 1.2303, test_loss: 1.2245, test_f1: 0.2274
 epoch: 26, train_loss: 1.2235, test_loss: 1.2171, test_f1: 0.2269
 epoch: 27, train_loss: 1.2232, test_loss: 1.2130, test_f1: 0.2613
 epoch: 28, train_loss: 1.2191, test_loss: 1.2068, test_f1: 0.2785
 epoch: 29, train_loss: 1.2129, test_loss: 1.2050, test_f1: 0.3063
 epoch: 30, train_loss: 1.2087, test_loss: 1.2004, test_f1: 0.3143
 epoch: 31, train_loss: 1.2082, test_loss: 1.1954, test_f1: 0.3154
 epoch: 32, train_loss: 1.2040, test_loss: 1.1940, test_f1: 0.3180
 epoch: 33, train_loss: 1.2050, test_loss: 1.1927, test_f1: 0.3253
 epoch: 34, train_loss: 1.2025, test_loss: 1.1892, test_f1: 0.3272
 epoch: 35, train_loss: 1.1956, test_loss: 1.1836, test_f1: 0.3310
 epoch: 36, train_loss: 1.1884, test_loss: 1.1807, test_f1: 0.3365
 epoch: 37, train_loss: 1.1884, test_loss: 1.1801, test_f1: 0.3360
 epoch: 38, train_loss: 1.1846, test_loss: 1.1763, test_f1: 0.3382
 epoch: 39, train_loss: 1.1797, test_loss: 1.1759, test_f1: 0.3405
 epoch: 40, train_loss: 1.1755, test_loss: 1.1710, test_f1: 0.3328
 epoch: 41, train_loss: 1.1770, test_loss: 1.1696, test_f1: 0.3381
 epoch: 42, train_loss: 1.1686, test_loss: 1.1681, test_f1: 0.3379
 epoch: 43, train_loss: 1.1700, test_loss: 1.1632, test_f1: 0.3411
 epoch: 44, train_loss: 1.1610, test_loss: 1.1606, test_f1: 0.3426
 epoch: 45, train_loss: 1.1589, test_loss: 1.1580, test_f1: 0.3459
 epoch: 46, train_loss: 1.1587, test_loss: 1.1516, test_f1: 0.3451
 epoch: 47, train_loss: 1.1574, test_loss: 1.1511, test_f1: 0.3453
 epoch: 48, train_loss: 1.1411, test_loss: 1.1473, test_f1: 0.3438
 epoch: 49, train_loss: 1.1450, test_loss: 1.1430, test_f1: 0.3473
 epoch: 50, train_loss: 1.1293, test_loss: 1.1371, test_f1: 0.3567
 epoch: 51, train_loss: 1.1313, test_loss: 1.1366, test_f1: 0.3529
 epoch: 52, train_loss: 1.1288, test_loss: 1.1374, test_f1: 0.3518
 epoch: 53, train_loss: 1.1241, test_loss: 1.1338, test_f1: 0.3536
 epoch: 54, train_loss: 1.1255, test_loss: 1.1314, test_f1: 0.3518
 epoch: 55, train_loss: 1.1254, test_loss: 1.1307, test_f1: 0.3518
 epoch: 56, train_loss: 1.1192, test_loss: 1.1276, test_f1: 0.3552
 epoch: 57, train_loss: 1.1217, test_loss: 1.1292, test_f1: 0.3513
 epoch: 58, train_loss: 1.1157, test_loss: 1.1277, test_f1: 0.3516
 epoch: 59, train_loss: 1.1139, test_loss: 1.1262, test_f1: 0.3526
 epoch: 60, train_loss: 1.1139, test_loss: 1.1250, test_f1: 0.3701
 epoch: 61, train_loss: 1.1146, test_loss: 1.1248, test_f1: 0.3814
 epoch: 62, train_loss: 1.1103, test_loss: 1.1220, test_f1: 0.3815
 epoch: 63, train_loss: 1.1099, test_loss: 1.1222, test_f1: 0.3802
 epoch: 64, train_loss: 1.1040, test_loss: 1.1209, test_f1: 0.3863
 epoch: 65, train_loss: 1.1065, test_loss: 1.1210, test_f1: 0.3974
 epoch: 66, train_loss: 1.1011, test_loss: 1.1184, test_f1: 0.3987
 epoch: 67, train_loss: 1.0999, test_loss: 1.1162, test_f1: 0.3975
 epoch: 68, train_loss: 1.0931, test_loss: 1.1159, test_f1: 0.3949
 epoch: 69, train_loss: 1.0981, test_loss: 1.1172, test_f1: 0.4042
 epoch: 70, train_loss: 1.0958, test_loss: 1.1171, test_f1: 0.4140
 epoch: 71, train_loss: 1.0931, test_loss: 1.1127, test_f1: 0.4088
 epoch: 72, train_loss: 1.0916, test_loss: 1.1126, test_f1: 0.4076
 epoch: 73, train_loss: 1.0863, test_loss: 1.1154, test_f1: 0.4124
 epoch: 74, train_loss: 1.0916, test_loss: 1.1107, test_f1: 0.4235
 epoch: 75, train_loss: 1.0816, test_loss: 1.1111, test_f1: 0.4108
 epoch: 76, train_loss: 1.0914, test_loss: 1.1077, test_f1: 0.4374
 epoch: 77, train_loss: 1.0795, test_loss: 1.1111, test_f1: 0.4199
 epoch: 78, train_loss: 1.0866, test_loss: 1.1035, test_f1: 0.4406
 epoch: 79, train_loss: 1.0788, test_loss: 1.1091, test_f1: 0.4261
 epoch: 80, train_loss: 1.0834, test_loss: 1.1075, test_f1: 0.4349
 epoch: 81, train_loss: 1.0772, test_loss: 1.1065, test_f1: 0.4373
 epoch: 82, train_loss: 1.0699, test_loss: 1.1046, test_f1: 0.4358
 epoch: 83, train_loss: 1.0727, test_loss: 1.1049, test_f1: 0.4261
 epoch: 84, train_loss: 1.0693, test_loss: 1.1050, test_f1: 0.4369
 epoch: 85, train_loss: 1.0645, test_loss: 1.1014, test_f1: 0.4297
 epoch: 86, train_loss: 1.0715, test_loss: 1.1059, test_f1: 0.4446
 epoch: 87, train_loss: 1.0689, test_loss: 1.1010, test_f1: 0.4477
 epoch: 88, train_loss: 1.0736, test_loss: 1.1030, test_f1: 0.4353
 epoch: 89, train_loss: 1.0646, test_loss: 1.1013, test_f1: 0.4423
 epoch: 90, train_loss: 1.0713, test_loss: 1.1017, test_f1: 0.4347
 epoch: 91, train_loss: 1.0682, test_loss: 1.0983, test_f1: 0.4321
 epoch: 92, train_loss: 1.0658, test_loss: 1.0974, test_f1: 0.4452
 epoch: 93, train_loss: 1.0667, test_loss: 1.0988, test_f1: 0.4422
 epoch: 94, train_loss: 1.0617, test_loss: 1.0997, test_f1: 0.4434
 epoch: 95, train_loss: 1.0678, test_loss: 1.0982, test_f1: 0.4402
 epoch: 96, train_loss: 1.0585, test_loss: 1.0980, test_f1: 0.4300
 epoch: 97, train_loss: 1.0632, test_loss: 1.0999, test_f1: 0.4492
 epoch: 98, train_loss: 1.0602, test_loss: 1.0994, test_f1: 0.4493
 epoch: 99, train_loss: 1.0494, test_loss: 1.1001, test_f1: 0.4345
##################ITERATION #1 ****************************************
 epoch: 0, train_loss: 1.3352, test_loss: 1.3417, test_f1: 0.2274
 epoch: 1, train_loss: 1.3261, test_loss: 1.3330, test_f1: 0.2274
 epoch: 2, train_loss: 1.3201, test_loss: 1.3210, test_f1: 0.2274
 epoch: 3, train_loss: 1.3115, test_loss: 1.3109, test_f1: 0.2274
 epoch: 4, train_loss: 1.3061, test_loss: 1.3026, test_f1: 0.2274
 epoch: 5, train_loss: 1.2993, test_loss: 1.2975, test_f1: 0.2274
 epoch: 6, train_loss: 1.2925, test_loss: 1.2914, test_f1: 0.2274
 epoch: 7, train_loss: 1.2868, test_loss: 1.2858, test_f1: 0.2274
 epoch: 8, train_loss: 1.2833, test_loss: 1.2798, test_f1: 0.2274
 epoch: 9, train_loss: 1.2775, test_loss: 1.2738, test_f1: 0.2274
 epoch: 10, train_loss: 1.2729, test_loss: 1.2674, test_f1: 0.2274
 epoch: 11, train_loss: 1.2694, test_loss: 1.2626, test_f1: 0.2274
 epoch: 12, train_loss: 1.2630, test_loss: 1.2564, test_f1: 0.2274
 epoch: 13, train_loss: 1.2580, test_loss: 1.2527, test_f1: 0.2274
 epoch: 14, train_loss: 1.2528, test_loss: 1.2483, test_f1: 0.2274
 epoch: 15, train_loss: 1.2483, test_loss: 1.2428, test_f1: 0.2448
 epoch: 16, train_loss: 1.2455, test_loss: 1.2367, test_f1: 0.2520
 epoch: 17, train_loss: 1.2399, test_loss: 1.2309, test_f1: 0.2561
 epoch: 18, train_loss: 1.2381, test_loss: 1.2256, test_f1: 0.2661
 epoch: 19, train_loss: 1.2315, test_loss: 1.2176, test_f1: 0.2965
 epoch: 20, train_loss: 1.2312, test_loss: 1.2138, test_f1: 0.3072
 epoch: 21, train_loss: 1.2208, test_loss: 1.2081, test_f1: 0.3121
 epoch: 22, train_loss: 1.2124, test_loss: 1.2005, test_f1: 0.3245
 epoch: 23, train_loss: 1.2103, test_loss: 1.1958, test_f1: 0.3308
 epoch: 24, train_loss: 1.2095, test_loss: 1.1924, test_f1: 0.3277
 epoch: 25, train_loss: 1.2056, test_loss: 1.1873, test_f1: 0.3400
 epoch: 26, train_loss: 1.2005, test_loss: 1.1834, test_f1: 0.3455
 epoch: 27, train_loss: 1.1882, test_loss: 1.1770, test_f1: 0.3543
 epoch: 28, train_loss: 1.1880, test_loss: 1.1726, test_f1: 0.3593
 epoch: 29, train_loss: 1.1862, test_loss: 1.1689, test_f1: 0.3724
 epoch: 30, train_loss: 1.1784, test_loss: 1.1642, test_f1: 0.3807
 epoch: 31, train_loss: 1.1798, test_loss: 1.1592, test_f1: 0.3785
 epoch: 32, train_loss: 1.1692, test_loss: 1.1536, test_f1: 0.3906
 epoch: 33, train_loss: 1.1670, test_loss: 1.1499, test_f1: 0.4042
 epoch: 34, train_loss: 1.1632, test_loss: 1.1491, test_f1: 0.4058
 epoch: 35, train_loss: 1.1613, test_loss: 1.1423, test_f1: 0.4148
 epoch: 36, train_loss: 1.1555, test_loss: 1.1389, test_f1: 0.4130
 epoch: 37, train_loss: 1.1542, test_loss: 1.1348, test_f1: 0.4169
 epoch: 38, train_loss: 1.1519, test_loss: 1.1319, test_f1: 0.4113
 epoch: 39, train_loss: 1.1402, test_loss: 1.1248, test_f1: 0.4182
 epoch: 40, train_loss: 1.1460, test_loss: 1.1232, test_f1: 0.4175
 epoch: 41, train_loss: 1.1357, test_loss: 1.1219, test_f1: 0.4165
 epoch: 42, train_loss: 1.1347, test_loss: 1.1165, test_f1: 0.4231
 epoch: 43, train_loss: 1.1307, test_loss: 1.1136, test_f1: 0.4227
 epoch: 44, train_loss: 1.1304, test_loss: 1.1120, test_f1: 0.4244
 epoch: 45, train_loss: 1.1266, test_loss: 1.1048, test_f1: 0.4185
 epoch: 46, train_loss: 1.1206, test_loss: 1.1039, test_f1: 0.4325
 epoch: 47, train_loss: 1.1163, test_loss: 1.1044, test_f1: 0.4409
 epoch: 48, train_loss: 1.1175, test_loss: 1.0985, test_f1: 0.4421
 epoch: 49, train_loss: 1.1208, test_loss: 1.0931, test_f1: 0.4462
 epoch: 50, train_loss: 1.1090, test_loss: 1.0950, test_f1: 0.4409
 epoch: 51, train_loss: 1.1042, test_loss: 1.0922, test_f1: 0.4460
 epoch: 52, train_loss: 1.1078, test_loss: 1.0886, test_f1: 0.4449
 epoch: 53, train_loss: 1.1052, test_loss: 1.0880, test_f1: 0.4421
 epoch: 54, train_loss: 1.1065, test_loss: 1.0877, test_f1: 0.4487
 epoch: 55, train_loss: 1.1039, test_loss: 1.0848, test_f1: 0.4539
 epoch: 56, train_loss: 1.1032, test_loss: 1.0866, test_f1: 0.4485
 epoch: 57, train_loss: 1.1025, test_loss: 1.0861, test_f1: 0.4556
 epoch: 58, train_loss: 1.0978, test_loss: 1.0821, test_f1: 0.4565
 epoch: 59, train_loss: 1.0972, test_loss: 1.0790, test_f1: 0.4573
 epoch: 60, train_loss: 1.0996, test_loss: 1.0774, test_f1: 0.4663
 epoch: 61, train_loss: 1.0940, test_loss: 1.0816, test_f1: 0.4591
 epoch: 62, train_loss: 1.0913, test_loss: 1.0796, test_f1: 0.4596
 epoch: 63, train_loss: 1.0843, test_loss: 1.0755, test_f1: 0.4653
 epoch: 64, train_loss: 1.0838, test_loss: 1.0763, test_f1: 0.4617
 epoch: 65, train_loss: 1.0852, test_loss: 1.0718, test_f1: 0.4620
 epoch: 66, train_loss: 1.0826, test_loss: 1.0736, test_f1: 0.4765
 epoch: 67, train_loss: 1.0828, test_loss: 1.0676, test_f1: 0.4769
 epoch: 68, train_loss: 1.0778, test_loss: 1.0703, test_f1: 0.4763
 epoch: 69, train_loss: 1.0754, test_loss: 1.0719, test_f1: 0.4736
 epoch: 70, train_loss: 1.0755, test_loss: 1.0704, test_f1: 0.4717
 epoch: 71, train_loss: 1.0879, test_loss: 1.0697, test_f1: 0.4696
 epoch: 72, train_loss: 1.0736, test_loss: 1.0670, test_f1: 0.4780
 epoch: 73, train_loss: 1.0757, test_loss: 1.0649, test_f1: 0.4869
 epoch: 74, train_loss: 1.0768, test_loss: 1.0650, test_f1: 0.4651
 epoch: 75, train_loss: 1.0687, test_loss: 1.0618, test_f1: 0.4803
 epoch: 76, train_loss: 1.0655, test_loss: 1.0601, test_f1: 0.4764
 epoch: 77, train_loss: 1.0684, test_loss: 1.0586, test_f1: 0.4790
 epoch: 78, train_loss: 1.0670, test_loss: 1.0589, test_f1: 0.4694
 epoch: 79, train_loss: 1.0729, test_loss: 1.0572, test_f1: 0.4846
 epoch: 80, train_loss: 1.0658, test_loss: 1.0552, test_f1: 0.4762
 epoch: 81, train_loss: 1.0692, test_loss: 1.0540, test_f1: 0.4853
 epoch: 82, train_loss: 1.0618, test_loss: 1.0566, test_f1: 0.4812
 epoch: 83, train_loss: 1.0659, test_loss: 1.0591, test_f1: 0.4771
 epoch: 84, train_loss: 1.0595, test_loss: 1.0529, test_f1: 0.4800
 epoch: 85, train_loss: 1.0696, test_loss: 1.0567, test_f1: 0.4766
 epoch: 86, train_loss: 1.0594, test_loss: 1.0508, test_f1: 0.4810
 epoch: 87, train_loss: 1.0546, test_loss: 1.0504, test_f1: 0.4801
 epoch: 88, train_loss: 1.0531, test_loss: 1.0493, test_f1: 0.4823
 epoch: 89, train_loss: 1.0564, test_loss: 1.0481, test_f1: 0.4841
 epoch: 90, train_loss: 1.0530, test_loss: 1.0455, test_f1: 0.4903
 epoch: 91, train_loss: 1.0453, test_loss: 1.0460, test_f1: 0.4875
 epoch: 92, train_loss: 1.0475, test_loss: 1.0455, test_f1: 0.4855
 epoch: 93, train_loss: 1.0571, test_loss: 1.0470, test_f1: 0.4838
 epoch: 94, train_loss: 1.0448, test_loss: 1.0448, test_f1: 0.4847
 epoch: 95, train_loss: 1.0541, test_loss: 1.0511, test_f1: 0.4830
 epoch: 96, train_loss: 1.0447, test_loss: 1.0434, test_f1: 0.4916
 epoch: 97, train_loss: 1.0405, test_loss: 1.0395, test_f1: 0.4911
 epoch: 98, train_loss: 1.0468, test_loss: 1.0420, test_f1: 0.4904
 epoch: 99, train_loss: 1.0480, test_loss: 1.0410, test_f1: 0.4865
##################ITERATION #2 ****************************************
 epoch: 0, train_loss: 1.3210, test_loss: 1.3223, test_f1: 0.2274
 epoch: 1, train_loss: 1.3057, test_loss: 1.3095, test_f1: 0.2274
 epoch: 2, train_loss: 1.2937, test_loss: 1.2915, test_f1: 0.2274
 epoch: 3, train_loss: 1.2836, test_loss: 1.2758, test_f1: 0.2274
 epoch: 4, train_loss: 1.2753, test_loss: 1.2666, test_f1: 0.2448
 epoch: 5, train_loss: 1.2715, test_loss: 1.2587, test_f1: 0.2561
 epoch: 6, train_loss: 1.2671, test_loss: 1.2538, test_f1: 0.2643
 epoch: 7, train_loss: 1.2590, test_loss: 1.2455, test_f1: 0.2814
 epoch: 8, train_loss: 1.2537, test_loss: 1.2402, test_f1: 0.2962
 epoch: 9, train_loss: 1.2495, test_loss: 1.2337, test_f1: 0.3044
 epoch: 10, train_loss: 1.2462, test_loss: 1.2270, test_f1: 0.3173
 epoch: 11, train_loss: 1.2396, test_loss: 1.2228, test_f1: 0.3205
 epoch: 12, train_loss: 1.2320, test_loss: 1.2221, test_f1: 0.3308
 epoch: 13, train_loss: 1.2292, test_loss: 1.2167, test_f1: 0.3366
 epoch: 14, train_loss: 1.2219, test_loss: 1.2112, test_f1: 0.3462
 epoch: 15, train_loss: 1.2152, test_loss: 1.2067, test_f1: 0.3559
 epoch: 16, train_loss: 1.2171, test_loss: 1.2041, test_f1: 0.3688
 epoch: 17, train_loss: 1.2083, test_loss: 1.1985, test_f1: 0.3803
 epoch: 18, train_loss: 1.2108, test_loss: 1.1942, test_f1: 0.3795
 epoch: 19, train_loss: 1.2082, test_loss: 1.1921, test_f1: 0.3880
 epoch: 20, train_loss: 1.1990, test_loss: 1.1867, test_f1: 0.3924
 epoch: 21, train_loss: 1.1991, test_loss: 1.1823, test_f1: 0.3930
 epoch: 22, train_loss: 1.1919, test_loss: 1.1752, test_f1: 0.3962
 epoch: 23, train_loss: 1.1910, test_loss: 1.1727, test_f1: 0.3883
 epoch: 24, train_loss: 1.1871, test_loss: 1.1690, test_f1: 0.3947
 epoch: 25, train_loss: 1.1795, test_loss: 1.1648, test_f1: 0.3974
 epoch: 26, train_loss: 1.1788, test_loss: 1.1597, test_f1: 0.3985
 epoch: 27, train_loss: 1.1733, test_loss: 1.1596, test_f1: 0.3992
 epoch: 28, train_loss: 1.1667, test_loss: 1.1524, test_f1: 0.4042
 epoch: 29, train_loss: 1.1660, test_loss: 1.1517, test_f1: 0.4089
 epoch: 30, train_loss: 1.1594, test_loss: 1.1477, test_f1: 0.4087
 epoch: 31, train_loss: 1.1566, test_loss: 1.1434, test_f1: 0.4101
 epoch: 32, train_loss: 1.1559, test_loss: 1.1359, test_f1: 0.4136
 epoch: 33, train_loss: 1.1518, test_loss: 1.1338, test_f1: 0.4203
 epoch: 34, train_loss: 1.1453, test_loss: 1.1333, test_f1: 0.4162
 epoch: 35, train_loss: 1.1483, test_loss: 1.1312, test_f1: 0.4189
 epoch: 36, train_loss: 1.1401, test_loss: 1.1217, test_f1: 0.4277
 epoch: 37, train_loss: 1.1393, test_loss: 1.1134, test_f1: 0.4300
 epoch: 38, train_loss: 1.1281, test_loss: 1.1203, test_f1: 0.4251
 epoch: 39, train_loss: 1.1360, test_loss: 1.1066, test_f1: 0.4319
 epoch: 40, train_loss: 1.1220, test_loss: 1.1137, test_f1: 0.4255
 epoch: 41, train_loss: 1.1263, test_loss: 1.1077, test_f1: 0.4239
 epoch: 42, train_loss: 1.1255, test_loss: 1.1077, test_f1: 0.4359
 epoch: 43, train_loss: 1.1190, test_loss: 1.0971, test_f1: 0.4445
 epoch: 44, train_loss: 1.1191, test_loss: 1.0955, test_f1: 0.4534
 epoch: 45, train_loss: 1.1143, test_loss: 1.1031, test_f1: 0.4356
 epoch: 46, train_loss: 1.1110, test_loss: 1.0935, test_f1: 0.4445
 epoch: 47, train_loss: 1.1085, test_loss: 1.0856, test_f1: 0.4524
 epoch: 48, train_loss: 1.1107, test_loss: 1.0874, test_f1: 0.4660
 epoch: 49, train_loss: 1.1123, test_loss: 1.0932, test_f1: 0.4388
 epoch: 50, train_loss: 1.1133, test_loss: 1.0822, test_f1: 0.4633
 epoch: 51, train_loss: 1.0917, test_loss: 1.0788, test_f1: 0.4739
 epoch: 52, train_loss: 1.0961, test_loss: 1.0812, test_f1: 0.4598
 epoch: 53, train_loss: 1.0984, test_loss: 1.0810, test_f1: 0.4579
 epoch: 54, train_loss: 1.0886, test_loss: 1.0795, test_f1: 0.4447
 epoch: 55, train_loss: 1.0913, test_loss: 1.0813, test_f1: 0.4467
 epoch: 56, train_loss: 1.0865, test_loss: 1.0771, test_f1: 0.4478
 epoch: 57, train_loss: 1.0880, test_loss: 1.0736, test_f1: 0.4648
 epoch: 58, train_loss: 1.0954, test_loss: 1.0724, test_f1: 0.4722
 epoch: 59, train_loss: 1.0810, test_loss: 1.0699, test_f1: 0.4769
 epoch: 60, train_loss: 1.0856, test_loss: 1.0679, test_f1: 0.4551
 epoch: 61, train_loss: 1.0842, test_loss: 1.0684, test_f1: 0.4752
 epoch: 62, train_loss: 1.0772, test_loss: 1.0687, test_f1: 0.4710
 epoch: 63, train_loss: 1.0810, test_loss: 1.0703, test_f1: 0.4791
 epoch: 64, train_loss: 1.0747, test_loss: 1.0656, test_f1: 0.4765
 epoch: 65, train_loss: 1.0728, test_loss: 1.0692, test_f1: 0.4854
 epoch: 66, train_loss: 1.0841, test_loss: 1.0673, test_f1: 0.4798
 epoch: 67, train_loss: 1.0790, test_loss: 1.0669, test_f1: 0.4753
 epoch: 68, train_loss: 1.0767, test_loss: 1.0702, test_f1: 0.4683
 epoch: 69, train_loss: 1.0749, test_loss: 1.0626, test_f1: 0.4757
 epoch: 70, train_loss: 1.0726, test_loss: 1.0665, test_f1: 0.4823
 epoch: 71, train_loss: 1.0715, test_loss: 1.0630, test_f1: 0.4750
 epoch: 72, train_loss: 1.0619, test_loss: 1.0665, test_f1: 0.4683
 epoch: 73, train_loss: 1.0786, test_loss: 1.0617, test_f1: 0.4789
 epoch: 74, train_loss: 1.0736, test_loss: 1.0662, test_f1: 0.4733
 epoch: 75, train_loss: 1.0654, test_loss: 1.0655, test_f1: 0.4831
 epoch: 76, train_loss: 1.0685, test_loss: 1.0683, test_f1: 0.4756
 epoch: 77, train_loss: 1.0710, test_loss: 1.0642, test_f1: 0.4813
 epoch: 78, train_loss: 1.0694, test_loss: 1.0611, test_f1: 0.4737
 epoch: 79, train_loss: 1.0663, test_loss: 1.0646, test_f1: 0.4780
 epoch: 80, train_loss: 1.0651, test_loss: 1.0624, test_f1: 0.4757
 epoch: 81, train_loss: 1.0617, test_loss: 1.0664, test_f1: 0.4780
 epoch: 82, train_loss: 1.0641, test_loss: 1.0682, test_f1: 0.4712
 epoch: 83, train_loss: 1.0633, test_loss: 1.0688, test_f1: 0.4617
 epoch: 84, train_loss: 1.0546, test_loss: 1.0609, test_f1: 0.4766
 epoch: 85, train_loss: 1.0655, test_loss: 1.0588, test_f1: 0.4889
 epoch: 86, train_loss: 1.0675, test_loss: 1.0592, test_f1: 0.4774
 epoch: 87, train_loss: 1.0648, test_loss: 1.0571, test_f1: 0.4744
 epoch: 88, train_loss: 1.0584, test_loss: 1.0652, test_f1: 0.4806
 epoch: 89, train_loss: 1.0576, test_loss: 1.0609, test_f1: 0.4900
 epoch: 90, train_loss: 1.0556, test_loss: 1.0619, test_f1: 0.4841
 epoch: 91, train_loss: 1.0500, test_loss: 1.0610, test_f1: 0.4806
 epoch: 92, train_loss: 1.0529, test_loss: 1.0622, test_f1: 0.4743
 epoch: 93, train_loss: 1.0464, test_loss: 1.0604, test_f1: 0.4695
 epoch: 94, train_loss: 1.0434, test_loss: 1.0563, test_f1: 0.4781
 epoch: 95, train_loss: 1.0495, test_loss: 1.0621, test_f1: 0.4656
 epoch: 96, train_loss: 1.0560, test_loss: 1.0579, test_f1: 0.4857
 epoch: 97, train_loss: 1.0482, test_loss: 1.0568, test_f1: 0.4739
 epoch: 98, train_loss: 1.0468, test_loss: 1.0553, test_f1: 0.4835
 epoch: 99, train_loss: 1.0592, test_loss: 1.0523, test_f1: 0.4774
##################ITERATION #3 ****************************************
 epoch: 0, train_loss: 1.3012, test_loss: 1.3042, test_f1: 0.2274
 epoch: 1, train_loss: 1.2842, test_loss: 1.2821, test_f1: 0.2274
 epoch: 2, train_loss: 1.2776, test_loss: 1.2686, test_f1: 0.2325
 epoch: 3, train_loss: 1.2666, test_loss: 1.2631, test_f1: 0.2315
 epoch: 4, train_loss: 1.2622, test_loss: 1.2549, test_f1: 0.2494
 epoch: 5, train_loss: 1.2587, test_loss: 1.2476, test_f1: 0.2539
 epoch: 6, train_loss: 1.2485, test_loss: 1.2404, test_f1: 0.2611
 epoch: 7, train_loss: 1.2459, test_loss: 1.2363, test_f1: 0.2806
 epoch: 8, train_loss: 1.2400, test_loss: 1.2326, test_f1: 0.3093
 epoch: 9, train_loss: 1.2350, test_loss: 1.2250, test_f1: 0.2967
 epoch: 10, train_loss: 1.2360, test_loss: 1.2227, test_f1: 0.3151
 epoch: 11, train_loss: 1.2283, test_loss: 1.2169, test_f1: 0.3037
 epoch: 12, train_loss: 1.2204, test_loss: 1.2132, test_f1: 0.3080
 epoch: 13, train_loss: 1.2217, test_loss: 1.2073, test_f1: 0.3231
 epoch: 14, train_loss: 1.2154, test_loss: 1.2035, test_f1: 0.3203
 epoch: 15, train_loss: 1.2148, test_loss: 1.2013, test_f1: 0.3175
 epoch: 16, train_loss: 1.2144, test_loss: 1.1962, test_f1: 0.3143
 epoch: 17, train_loss: 1.2045, test_loss: 1.1935, test_f1: 0.3244
 epoch: 18, train_loss: 1.2022, test_loss: 1.1907, test_f1: 0.3239
 epoch: 19, train_loss: 1.2033, test_loss: 1.1869, test_f1: 0.3296
 epoch: 20, train_loss: 1.2034, test_loss: 1.1850, test_f1: 0.3406
 epoch: 21, train_loss: 1.1962, test_loss: 1.1806, test_f1: 0.3515
 epoch: 22, train_loss: 1.1900, test_loss: 1.1796, test_f1: 0.3626
 epoch: 23, train_loss: 1.1946, test_loss: 1.1764, test_f1: 0.3644
 epoch: 24, train_loss: 1.1861, test_loss: 1.1737, test_f1: 0.3705
 epoch: 25, train_loss: 1.1873, test_loss: 1.1717, test_f1: 0.3784
 epoch: 26, train_loss: 1.1840, test_loss: 1.1700, test_f1: 0.3869
 epoch: 27, train_loss: 1.1801, test_loss: 1.1671, test_f1: 0.3832
 epoch: 28, train_loss: 1.1808, test_loss: 1.1649, test_f1: 0.3838
 epoch: 29, train_loss: 1.1712, test_loss: 1.1609, test_f1: 0.3936
 epoch: 30, train_loss: 1.1736, test_loss: 1.1586, test_f1: 0.3914
 epoch: 31, train_loss: 1.1715, test_loss: 1.1553, test_f1: 0.4035
 epoch: 32, train_loss: 1.1691, test_loss: 1.1499, test_f1: 0.3918
 epoch: 33, train_loss: 1.1614, test_loss: 1.1516, test_f1: 0.4098
 epoch: 34, train_loss: 1.1659, test_loss: 1.1492, test_f1: 0.4104
 epoch: 35, train_loss: 1.1607, test_loss: 1.1448, test_f1: 0.4109
 epoch: 36, train_loss: 1.1581, test_loss: 1.1441, test_f1: 0.4051
 epoch: 37, train_loss: 1.1533, test_loss: 1.1454, test_f1: 0.4011
 epoch: 38, train_loss: 1.1580, test_loss: 1.1422, test_f1: 0.4111
 epoch: 39, train_loss: 1.1460, test_loss: 1.1384, test_f1: 0.4114
 epoch: 40, train_loss: 1.1440, test_loss: 1.1378, test_f1: 0.4008
 epoch: 41, train_loss: 1.1445, test_loss: 1.1393, test_f1: 0.4184
 epoch: 42, train_loss: 1.1456, test_loss: 1.1356, test_f1: 0.4072
 epoch: 43, train_loss: 1.1468, test_loss: 1.1319, test_f1: 0.4149
 epoch: 44, train_loss: 1.1337, test_loss: 1.1311, test_f1: 0.4222
 epoch: 45, train_loss: 1.1392, test_loss: 1.1308, test_f1: 0.4174
 epoch: 46, train_loss: 1.1354, test_loss: 1.1278, test_f1: 0.4128
 epoch: 47, train_loss: 1.1347, test_loss: 1.1285, test_f1: 0.4263
 epoch: 48, train_loss: 1.1242, test_loss: 1.1227, test_f1: 0.4151
 epoch: 49, train_loss: 1.1275, test_loss: 1.1201, test_f1: 0.4191
 epoch: 50, train_loss: 1.1233, test_loss: 1.1120, test_f1: 0.4142
 epoch: 51, train_loss: 1.1234, test_loss: 1.1156, test_f1: 0.4159
 epoch: 52, train_loss: 1.1143, test_loss: 1.1169, test_f1: 0.4125
 epoch: 53, train_loss: 1.1181, test_loss: 1.1193, test_f1: 0.4085
 epoch: 54, train_loss: 1.1170, test_loss: 1.1177, test_f1: 0.4064
 epoch: 55, train_loss: 1.1135, test_loss: 1.1127, test_f1: 0.4158
 epoch: 56, train_loss: 1.1080, test_loss: 1.1134, test_f1: 0.4157
 epoch: 57, train_loss: 1.1135, test_loss: 1.1110, test_f1: 0.4224
 epoch: 58, train_loss: 1.1104, test_loss: 1.1113, test_f1: 0.4128
 epoch: 59, train_loss: 1.1051, test_loss: 1.1106, test_f1: 0.4205
 epoch: 60, train_loss: 1.1097, test_loss: 1.1069, test_f1: 0.4226
 epoch: 61, train_loss: 1.1107, test_loss: 1.1038, test_f1: 0.4177
 epoch: 62, train_loss: 1.1134, test_loss: 1.1069, test_f1: 0.4309
 epoch: 63, train_loss: 1.1047, test_loss: 1.1041, test_f1: 0.4187
 epoch: 64, train_loss: 1.0994, test_loss: 1.1026, test_f1: 0.4252
 epoch: 65, train_loss: 1.0979, test_loss: 1.1036, test_f1: 0.4236
 epoch: 66, train_loss: 1.1027, test_loss: 1.1014, test_f1: 0.4205
 epoch: 67, train_loss: 1.1017, test_loss: 1.0965, test_f1: 0.4267
 epoch: 68, train_loss: 1.0968, test_loss: 1.0982, test_f1: 0.4206
 epoch: 69, train_loss: 1.0953, test_loss: 1.1048, test_f1: 0.4307
 epoch: 70, train_loss: 1.0907, test_loss: 1.1021, test_f1: 0.4262
 epoch: 71, train_loss: 1.0962, test_loss: 1.0989, test_f1: 0.4239
 epoch: 72, train_loss: 1.0973, test_loss: 1.0993, test_f1: 0.4204
 epoch: 73, train_loss: 1.0959, test_loss: 1.0949, test_f1: 0.4310
 epoch: 74, train_loss: 1.0959, test_loss: 1.0972, test_f1: 0.4251
 epoch: 75, train_loss: 1.0942, test_loss: 1.0973, test_f1: 0.4274
 epoch: 76, train_loss: 1.0925, test_loss: 1.0983, test_f1: 0.4229
 epoch: 77, train_loss: 1.0859, test_loss: 1.0971, test_f1: 0.4288
 epoch: 78, train_loss: 1.1007, test_loss: 1.0997, test_f1: 0.4256
 epoch: 79, train_loss: 1.0936, test_loss: 1.0988, test_f1: 0.4332
 epoch: 80, train_loss: 1.0945, test_loss: 1.0955, test_f1: 0.4365
 epoch: 81, train_loss: 1.0841, test_loss: 1.0946, test_f1: 0.4231
 epoch: 82, train_loss: 1.0874, test_loss: 1.0944, test_f1: 0.4264
 epoch: 83, train_loss: 1.0839, test_loss: 1.0954, test_f1: 0.4326
 epoch: 84, train_loss: 1.0800, test_loss: 1.0940, test_f1: 0.4307
 epoch: 85, train_loss: 1.0802, test_loss: 1.0938, test_f1: 0.4282
 epoch: 86, train_loss: 1.0924, test_loss: 1.0950, test_f1: 0.4311
 epoch: 87, train_loss: 1.0853, test_loss: 1.0957, test_f1: 0.4254
 epoch: 88, train_loss: 1.0809, test_loss: 1.0931, test_f1: 0.4301
 epoch: 89, train_loss: 1.0696, test_loss: 1.1011, test_f1: 0.4258
 epoch: 90, train_loss: 1.0780, test_loss: 1.0953, test_f1: 0.4272
 epoch: 91, train_loss: 1.0753, test_loss: 1.0928, test_f1: 0.4261
 epoch: 92, train_loss: 1.0768, test_loss: 1.0963, test_f1: 0.4348
 epoch: 93, train_loss: 1.0768, test_loss: 1.0959, test_f1: 0.4406
 epoch: 94, train_loss: 1.0748, test_loss: 1.0960, test_f1: 0.4220
 epoch: 95, train_loss: 1.0745, test_loss: 1.0914, test_f1: 0.4295
 epoch: 96, train_loss: 1.0705, test_loss: 1.0926, test_f1: 0.4213
 epoch: 97, train_loss: 1.0678, test_loss: 1.0887, test_f1: 0.4345
 epoch: 98, train_loss: 1.0756, test_loss: 1.0934, test_f1: 0.4233
 epoch: 99, train_loss: 1.0753, test_loss: 1.0930, test_f1: 0.4220
##################ITERATION #4 ****************************************
 epoch: 0, train_loss: 1.3105, test_loss: 1.3194, test_f1: 0.2257
 epoch: 1, train_loss: 1.2877, test_loss: 1.2949, test_f1: 0.2562
 epoch: 2, train_loss: 1.2795, test_loss: 1.2726, test_f1: 0.2578
 epoch: 3, train_loss: 1.2641, test_loss: 1.2573, test_f1: 0.2732
 epoch: 4, train_loss: 1.2572, test_loss: 1.2489, test_f1: 0.2889
 epoch: 5, train_loss: 1.2530, test_loss: 1.2401, test_f1: 0.2904
 epoch: 6, train_loss: 1.2452, test_loss: 1.2359, test_f1: 0.3210
 epoch: 7, train_loss: 1.2424, test_loss: 1.2272, test_f1: 0.3357
 epoch: 8, train_loss: 1.2332, test_loss: 1.2227, test_f1: 0.3482
 epoch: 9, train_loss: 1.2300, test_loss: 1.2159, test_f1: 0.3490
 epoch: 10, train_loss: 1.2237, test_loss: 1.2088, test_f1: 0.3571
 epoch: 11, train_loss: 1.2206, test_loss: 1.2036, test_f1: 0.3672
 epoch: 12, train_loss: 1.2124, test_loss: 1.1983, test_f1: 0.3636
 epoch: 13, train_loss: 1.2085, test_loss: 1.1940, test_f1: 0.3730
 epoch: 14, train_loss: 1.2091, test_loss: 1.1868, test_f1: 0.3859
 epoch: 15, train_loss: 1.2035, test_loss: 1.1844, test_f1: 0.3832
 epoch: 16, train_loss: 1.1996, test_loss: 1.1781, test_f1: 0.3867
 epoch: 17, train_loss: 1.1933, test_loss: 1.1740, test_f1: 0.3922
 epoch: 18, train_loss: 1.1847, test_loss: 1.1658, test_f1: 0.4041
 epoch: 19, train_loss: 1.1822, test_loss: 1.1649, test_f1: 0.4036
 epoch: 20, train_loss: 1.1826, test_loss: 1.1575, test_f1: 0.4191
 epoch: 21, train_loss: 1.1779, test_loss: 1.1576, test_f1: 0.4125
 epoch: 22, train_loss: 1.1741, test_loss: 1.1523, test_f1: 0.4227
 epoch: 23, train_loss: 1.1731, test_loss: 1.1456, test_f1: 0.4197
 epoch: 24, train_loss: 1.1638, test_loss: 1.1403, test_f1: 0.4206
 epoch: 25, train_loss: 1.1629, test_loss: 1.1375, test_f1: 0.4287
 epoch: 26, train_loss: 1.1550, test_loss: 1.1312, test_f1: 0.4481
 epoch: 27, train_loss: 1.1535, test_loss: 1.1288, test_f1: 0.4395
 epoch: 28, train_loss: 1.1545, test_loss: 1.1272, test_f1: 0.4381
 epoch: 29, train_loss: 1.1417, test_loss: 1.1209, test_f1: 0.4493
 epoch: 30, train_loss: 1.1416, test_loss: 1.1177, test_f1: 0.4472
 epoch: 31, train_loss: 1.1467, test_loss: 1.1142, test_f1: 0.4547
 epoch: 32, train_loss: 1.1259, test_loss: 1.1147, test_f1: 0.4469
 epoch: 33, train_loss: 1.1328, test_loss: 1.1096, test_f1: 0.4420
 epoch: 34, train_loss: 1.1260, test_loss: 1.1072, test_f1: 0.4561
 epoch: 35, train_loss: 1.1207, test_loss: 1.1020, test_f1: 0.4350
 epoch: 36, train_loss: 1.1200, test_loss: 1.1046, test_f1: 0.4569
 epoch: 37, train_loss: 1.1168, test_loss: 1.0997, test_f1: 0.4470
 epoch: 38, train_loss: 1.1125, test_loss: 1.0937, test_f1: 0.4482
 epoch: 39, train_loss: 1.1094, test_loss: 1.0940, test_f1: 0.4566
 epoch: 40, train_loss: 1.1084, test_loss: 1.0885, test_f1: 0.4626
 epoch: 41, train_loss: 1.1006, test_loss: 1.0854, test_f1: 0.4611
 epoch: 42, train_loss: 1.1075, test_loss: 1.0882, test_f1: 0.4515
 epoch: 43, train_loss: 1.1018, test_loss: 1.0813, test_f1: 0.4631
 epoch: 44, train_loss: 1.0953, test_loss: 1.0786, test_f1: 0.4759
 epoch: 45, train_loss: 1.0924, test_loss: 1.0781, test_f1: 0.4665
 epoch: 46, train_loss: 1.0962, test_loss: 1.0709, test_f1: 0.4681
 epoch: 47, train_loss: 1.0853, test_loss: 1.0700, test_f1: 0.4555
 epoch: 48, train_loss: 1.0768, test_loss: 1.0725, test_f1: 0.4680
 epoch: 49, train_loss: 1.0801, test_loss: 1.0647, test_f1: 0.4774
 epoch: 50, train_loss: 1.0707, test_loss: 1.0672, test_f1: 0.4686
 epoch: 51, train_loss: 1.0730, test_loss: 1.0637, test_f1: 0.4769
 epoch: 52, train_loss: 1.0739, test_loss: 1.0626, test_f1: 0.4773
 epoch: 53, train_loss: 1.0678, test_loss: 1.0649, test_f1: 0.4798
 epoch: 54, train_loss: 1.0667, test_loss: 1.0634, test_f1: 0.4741
 epoch: 55, train_loss: 1.0656, test_loss: 1.0599, test_f1: 0.4762
 epoch: 56, train_loss: 1.0632, test_loss: 1.0606, test_f1: 0.4777
 epoch: 57, train_loss: 1.0799, test_loss: 1.0604, test_f1: 0.4778
 epoch: 58, train_loss: 1.0569, test_loss: 1.0608, test_f1: 0.4735
 epoch: 59, train_loss: 1.0650, test_loss: 1.0569, test_f1: 0.4735
 epoch: 60, train_loss: 1.0603, test_loss: 1.0545, test_f1: 0.4825
 epoch: 61, train_loss: 1.0654, test_loss: 1.0569, test_f1: 0.4777
 epoch: 62, train_loss: 1.0774, test_loss: 1.0566, test_f1: 0.4721
 epoch: 63, train_loss: 1.0546, test_loss: 1.0562, test_f1: 0.4705
 epoch: 64, train_loss: 1.0615, test_loss: 1.0606, test_f1: 0.4688
 epoch: 65, train_loss: 1.0588, test_loss: 1.0584, test_f1: 0.4735
 epoch: 66, train_loss: 1.0562, test_loss: 1.0595, test_f1: 0.4625
 epoch: 67, train_loss: 1.0454, test_loss: 1.0552, test_f1: 0.4727
 epoch: 68, train_loss: 1.0505, test_loss: 1.0586, test_f1: 0.4685
 epoch: 69, train_loss: 1.0619, test_loss: 1.0574, test_f1: 0.4661
 epoch: 70, train_loss: 1.0482, test_loss: 1.0573, test_f1: 0.4653
 epoch: 71, train_loss: 1.0394, test_loss: 1.0554, test_f1: 0.4675
 epoch: 72, train_loss: 1.0394, test_loss: 1.0542, test_f1: 0.4758
 epoch: 73, train_loss: 1.0475, test_loss: 1.0515, test_f1: 0.4689
 epoch: 74, train_loss: 1.0433, test_loss: 1.0520, test_f1: 0.4684
 epoch: 75, train_loss: 1.0510, test_loss: 1.0532, test_f1: 0.4644
 epoch: 76, train_loss: 1.0511, test_loss: 1.0502, test_f1: 0.4592
 epoch: 77, train_loss: 1.0448, test_loss: 1.0495, test_f1: 0.4672
 epoch: 78, train_loss: 1.0346, test_loss: 1.0536, test_f1: 0.4640
 epoch: 79, train_loss: 1.0403, test_loss: 1.0536, test_f1: 0.4663
 epoch: 80, train_loss: 1.0336, test_loss: 1.0559, test_f1: 0.4638
 epoch: 81, train_loss: 1.0329, test_loss: 1.0481, test_f1: 0.4701
 epoch: 82, train_loss: 1.0403, test_loss: 1.0544, test_f1: 0.4743
 epoch: 83, train_loss: 1.0348, test_loss: 1.0487, test_f1: 0.4700
 epoch: 84, train_loss: 1.0264, test_loss: 1.0510, test_f1: 0.4621
 epoch: 85, train_loss: 1.0387, test_loss: 1.0510, test_f1: 0.4637
 epoch: 86, train_loss: 1.0339, test_loss: 1.0542, test_f1: 0.4686
 epoch: 87, train_loss: 1.0360, test_loss: 1.0494, test_f1: 0.4598
 epoch: 88, train_loss: 1.0259, test_loss: 1.0485, test_f1: 0.4698
 epoch: 89, train_loss: 1.0335, test_loss: 1.0490, test_f1: 0.4752
 epoch: 90, train_loss: 1.0346, test_loss: 1.0418, test_f1: 0.4813
 epoch: 91, train_loss: 1.0248, test_loss: 1.0475, test_f1: 0.4619
 epoch: 92, train_loss: 1.0169, test_loss: 1.0487, test_f1: 0.4725
 epoch: 93, train_loss: 1.0191, test_loss: 1.0469, test_f1: 0.4721
 epoch: 94, train_loss: 1.0248, test_loss: 1.0458, test_f1: 0.4715
 epoch: 95, train_loss: 1.0247, test_loss: 1.0442, test_f1: 0.4725
 epoch: 96, train_loss: 1.0145, test_loss: 1.0495, test_f1: 0.4687
 epoch: 97, train_loss: 1.0260, test_loss: 1.0485, test_f1: 0.4683
 epoch: 98, train_loss: 1.0209, test_loss: 1.0484, test_f1: 0.4621
 epoch: 99, train_loss: 1.0107, test_loss: 1.0495, test_f1: 0.4666
##################ITERATION #5 ****************************************
 epoch: 0, train_loss: 1.3101, test_loss: 1.3071, test_f1: 0.2274
 epoch: 1, train_loss: 1.2877, test_loss: 1.2856, test_f1: 0.2274
 epoch: 2, train_loss: 1.2807, test_loss: 1.2760, test_f1: 0.2399
 epoch: 3, train_loss: 1.2719, test_loss: 1.2554, test_f1: 0.2274
 epoch: 4, train_loss: 1.2642, test_loss: 1.2454, test_f1: 0.2537
 epoch: 5, train_loss: 1.2593, test_loss: 1.2406, test_f1: 0.2592
 epoch: 6, train_loss: 1.2585, test_loss: 1.2342, test_f1: 0.2783
 epoch: 7, train_loss: 1.2435, test_loss: 1.2281, test_f1: 0.2841
 epoch: 8, train_loss: 1.2406, test_loss: 1.2248, test_f1: 0.2836
 epoch: 9, train_loss: 1.2312, test_loss: 1.2154, test_f1: 0.3133
 epoch: 10, train_loss: 1.2306, test_loss: 1.2096, test_f1: 0.3180
 epoch: 11, train_loss: 1.2244, test_loss: 1.2042, test_f1: 0.3230
 epoch: 12, train_loss: 1.2254, test_loss: 1.2020, test_f1: 0.3236
 epoch: 13, train_loss: 1.2185, test_loss: 1.1956, test_f1: 0.3310
 epoch: 14, train_loss: 1.2194, test_loss: 1.1916, test_f1: 0.3299
 epoch: 15, train_loss: 1.2073, test_loss: 1.1864, test_f1: 0.3376
 epoch: 16, train_loss: 1.2026, test_loss: 1.1824, test_f1: 0.3452
 epoch: 17, train_loss: 1.1969, test_loss: 1.1777, test_f1: 0.3710
 epoch: 18, train_loss: 1.1948, test_loss: 1.1752, test_f1: 0.3762
 epoch: 19, train_loss: 1.1887, test_loss: 1.1699, test_f1: 0.3917
 epoch: 20, train_loss: 1.1898, test_loss: 1.1658, test_f1: 0.3915
 epoch: 21, train_loss: 1.1879, test_loss: 1.1612, test_f1: 0.3986
 epoch: 22, train_loss: 1.1812, test_loss: 1.1587, test_f1: 0.3949
 epoch: 23, train_loss: 1.1759, test_loss: 1.1535, test_f1: 0.4024
 epoch: 24, train_loss: 1.1695, test_loss: 1.1516, test_f1: 0.3953
 epoch: 25, train_loss: 1.1639, test_loss: 1.1503, test_f1: 0.4030
 epoch: 26, train_loss: 1.1591, test_loss: 1.1481, test_f1: 0.4036
 epoch: 27, train_loss: 1.1637, test_loss: 1.1458, test_f1: 0.3940
 epoch: 28, train_loss: 1.1566, test_loss: 1.1407, test_f1: 0.4055
 epoch: 29, train_loss: 1.1545, test_loss: 1.1398, test_f1: 0.3989
 epoch: 30, train_loss: 1.1492, test_loss: 1.1333, test_f1: 0.3958
 epoch: 31, train_loss: 1.1472, test_loss: 1.1287, test_f1: 0.4057
 epoch: 32, train_loss: 1.1423, test_loss: 1.1294, test_f1: 0.4071
 epoch: 33, train_loss: 1.1412, test_loss: 1.1284, test_f1: 0.4061
 epoch: 34, train_loss: 1.1334, test_loss: 1.1258, test_f1: 0.4128
 epoch: 35, train_loss: 1.1327, test_loss: 1.1284, test_f1: 0.4110
 epoch: 36, train_loss: 1.1309, test_loss: 1.1230, test_f1: 0.4105
 epoch: 37, train_loss: 1.1275, test_loss: 1.1261, test_f1: 0.4101
 epoch: 38, train_loss: 1.1173, test_loss: 1.1184, test_f1: 0.4104
 epoch: 39, train_loss: 1.1193, test_loss: 1.1202, test_f1: 0.4144
 epoch: 40, train_loss: 1.1236, test_loss: 1.1174, test_f1: 0.4106
 epoch: 41, train_loss: 1.1253, test_loss: 1.1122, test_f1: 0.4183
 epoch: 42, train_loss: 1.1068, test_loss: 1.1191, test_f1: 0.4162
 epoch: 43, train_loss: 1.1094, test_loss: 1.1118, test_f1: 0.4133
 epoch: 44, train_loss: 1.1107, test_loss: 1.1145, test_f1: 0.4047
 epoch: 45, train_loss: 1.1027, test_loss: 1.1057, test_f1: 0.4138
 epoch: 46, train_loss: 1.1016, test_loss: 1.1066, test_f1: 0.4125
 epoch: 47, train_loss: 1.0956, test_loss: 1.1064, test_f1: 0.4115
 epoch: 48, train_loss: 1.0976, test_loss: 1.0981, test_f1: 0.4219
 epoch: 49, train_loss: 1.0871, test_loss: 1.1067, test_f1: 0.4114
 epoch: 50, train_loss: 1.0917, test_loss: 1.1032, test_f1: 0.4256
 epoch: 51, train_loss: 1.0949, test_loss: 1.0955, test_f1: 0.4285
 epoch: 52, train_loss: 1.0955, test_loss: 1.1007, test_f1: 0.4206
 epoch: 53, train_loss: 1.0954, test_loss: 1.0961, test_f1: 0.4251
 epoch: 54, train_loss: 1.0919, test_loss: 1.0987, test_f1: 0.4265
 epoch: 55, train_loss: 1.0819, test_loss: 1.0988, test_f1: 0.4215
 epoch: 56, train_loss: 1.0812, test_loss: 1.1069, test_f1: 0.4080
 epoch: 57, train_loss: 1.0888, test_loss: 1.0948, test_f1: 0.4151
 epoch: 58, train_loss: 1.0771, test_loss: 1.0903, test_f1: 0.4290
 epoch: 59, train_loss: 1.0817, test_loss: 1.0938, test_f1: 0.4265
 epoch: 60, train_loss: 1.0803, test_loss: 1.0941, test_f1: 0.4157
 epoch: 61, train_loss: 1.0795, test_loss: 1.0923, test_f1: 0.4207
 epoch: 62, train_loss: 1.0807, test_loss: 1.0881, test_f1: 0.4274
 epoch: 63, train_loss: 1.0650, test_loss: 1.0873, test_f1: 0.4150
 epoch: 64, train_loss: 1.0738, test_loss: 1.0892, test_f1: 0.4140
 epoch: 65, train_loss: 1.0670, test_loss: 1.0939, test_f1: 0.4096
 epoch: 66, train_loss: 1.0726, test_loss: 1.0922, test_f1: 0.4139
 epoch: 67, train_loss: 1.0705, test_loss: 1.0867, test_f1: 0.4215
 epoch: 68, train_loss: 1.0722, test_loss: 1.0932, test_f1: 0.4168
 epoch: 69, train_loss: 1.0679, test_loss: 1.0912, test_f1: 0.4198
 epoch: 70, train_loss: 1.0606, test_loss: 1.0900, test_f1: 0.4162
 epoch: 71, train_loss: 1.0660, test_loss: 1.0897, test_f1: 0.4120
 epoch: 72, train_loss: 1.0653, test_loss: 1.0929, test_f1: 0.4085
 epoch: 73, train_loss: 1.0637, test_loss: 1.0922, test_f1: 0.4092
 epoch: 74, train_loss: 1.0647, test_loss: 1.0941, test_f1: 0.4105
 epoch: 75, train_loss: 1.0608, test_loss: 1.0912, test_f1: 0.4179
 epoch: 76, train_loss: 1.0556, test_loss: 1.0896, test_f1: 0.4202
 epoch: 77, train_loss: 1.0496, test_loss: 1.0870, test_f1: 0.4134
 epoch: 78, train_loss: 1.0604, test_loss: 1.0935, test_f1: 0.4097
 epoch: 79, train_loss: 1.0617, test_loss: 1.0936, test_f1: 0.4151
 epoch: 80, train_loss: 1.0597, test_loss: 1.0847, test_f1: 0.4194
 epoch: 81, train_loss: 1.0577, test_loss: 1.0813, test_f1: 0.4247
 epoch: 82, train_loss: 1.0491, test_loss: 1.0887, test_f1: 0.4204
 epoch: 83, train_loss: 1.0488, test_loss: 1.0940, test_f1: 0.4173
 epoch: 84, train_loss: 1.0491, test_loss: 1.0952, test_f1: 0.4211
 epoch: 85, train_loss: 1.0527, test_loss: 1.0932, test_f1: 0.4088
 epoch: 86, train_loss: 1.0488, test_loss: 1.0920, test_f1: 0.4167
 epoch: 87, train_loss: 1.0451, test_loss: 1.0913, test_f1: 0.4171
 epoch: 88, train_loss: 1.0381, test_loss: 1.0903, test_f1: 0.4191
 epoch: 89, train_loss: 1.0383, test_loss: 1.0850, test_f1: 0.4208
 epoch: 90, train_loss: 1.0504, test_loss: 1.0837, test_f1: 0.4243
 epoch: 91, train_loss: 1.0501, test_loss: 1.0807, test_f1: 0.4218
 epoch: 92, train_loss: 1.0463, test_loss: 1.0793, test_f1: 0.4247
 epoch: 93, train_loss: 1.0376, test_loss: 1.0837, test_f1: 0.4164
 epoch: 94, train_loss: 1.0484, test_loss: 1.0828, test_f1: 0.4411
 epoch: 95, train_loss: 1.0394, test_loss: 1.0791, test_f1: 0.4352
 epoch: 96, train_loss: 1.0345, test_loss: 1.0799, test_f1: 0.4304
 epoch: 97, train_loss: 1.0405, test_loss: 1.0887, test_f1: 0.4279
 epoch: 98, train_loss: 1.0434, test_loss: 1.0814, test_f1: 0.4364
 epoch: 99, train_loss: 1.0354, test_loss: 1.0821, test_f1: 0.4326
##################ITERATION #6 ****************************************
 epoch: 0, train_loss: 1.3118, test_loss: 1.3190, test_f1: 0.2274
 epoch: 1, train_loss: 1.2961, test_loss: 1.2983, test_f1: 0.2555
 epoch: 2, train_loss: 1.2814, test_loss: 1.2839, test_f1: 0.2548
 epoch: 3, train_loss: 1.2803, test_loss: 1.2647, test_f1: 0.2665
 epoch: 4, train_loss: 1.2638, test_loss: 1.2536, test_f1: 0.2788
 epoch: 5, train_loss: 1.2604, test_loss: 1.2489, test_f1: 0.2795
 epoch: 6, train_loss: 1.2592, test_loss: 1.2418, test_f1: 0.2949
 epoch: 7, train_loss: 1.2515, test_loss: 1.2314, test_f1: 0.3055
 epoch: 8, train_loss: 1.2431, test_loss: 1.2285, test_f1: 0.3107
 epoch: 9, train_loss: 1.2365, test_loss: 1.2206, test_f1: 0.3229
 epoch: 10, train_loss: 1.2394, test_loss: 1.2142, test_f1: 0.3282
 epoch: 11, train_loss: 1.2300, test_loss: 1.2119, test_f1: 0.3254
 epoch: 12, train_loss: 1.2248, test_loss: 1.2047, test_f1: 0.3513
 epoch: 13, train_loss: 1.2198, test_loss: 1.2003, test_f1: 0.3479
 epoch: 14, train_loss: 1.2146, test_loss: 1.2014, test_f1: 0.3568
 epoch: 15, train_loss: 1.2149, test_loss: 1.1961, test_f1: 0.3707
 epoch: 16, train_loss: 1.2124, test_loss: 1.1946, test_f1: 0.3837
 epoch: 17, train_loss: 1.2132, test_loss: 1.1921, test_f1: 0.3888
 epoch: 18, train_loss: 1.2111, test_loss: 1.1901, test_f1: 0.3803
 epoch: 19, train_loss: 1.2005, test_loss: 1.1864, test_f1: 0.3904
 epoch: 20, train_loss: 1.1940, test_loss: 1.1843, test_f1: 0.3969
 epoch: 21, train_loss: 1.2043, test_loss: 1.1778, test_f1: 0.3972
 epoch: 22, train_loss: 1.1967, test_loss: 1.1768, test_f1: 0.3946
 epoch: 23, train_loss: 1.1930, test_loss: 1.1764, test_f1: 0.3967
 epoch: 24, train_loss: 1.1885, test_loss: 1.1737, test_f1: 0.3998
 epoch: 25, train_loss: 1.1825, test_loss: 1.1731, test_f1: 0.3961
 epoch: 26, train_loss: 1.1843, test_loss: 1.1685, test_f1: 0.3957
 epoch: 27, train_loss: 1.1789, test_loss: 1.1668, test_f1: 0.4105
 epoch: 28, train_loss: 1.1778, test_loss: 1.1655, test_f1: 0.4093
 epoch: 29, train_loss: 1.1769, test_loss: 1.1613, test_f1: 0.4034
 epoch: 30, train_loss: 1.1748, test_loss: 1.1644, test_f1: 0.4076
 epoch: 31, train_loss: 1.1718, test_loss: 1.1628, test_f1: 0.4048
 epoch: 32, train_loss: 1.1744, test_loss: 1.1616, test_f1: 0.4072
 epoch: 33, train_loss: 1.1592, test_loss: 1.1561, test_f1: 0.4142
 epoch: 34, train_loss: 1.1604, test_loss: 1.1532, test_f1: 0.4153
 epoch: 35, train_loss: 1.1547, test_loss: 1.1539, test_f1: 0.4227
 epoch: 36, train_loss: 1.1545, test_loss: 1.1478, test_f1: 0.4200
 epoch: 37, train_loss: 1.1532, test_loss: 1.1474, test_f1: 0.4187
 epoch: 38, train_loss: 1.1542, test_loss: 1.1481, test_f1: 0.4211
 epoch: 39, train_loss: 1.1410, test_loss: 1.1423, test_f1: 0.4233
 epoch: 40, train_loss: 1.1495, test_loss: 1.1395, test_f1: 0.4189
 epoch: 41, train_loss: 1.1449, test_loss: 1.1388, test_f1: 0.4224
 epoch: 42, train_loss: 1.1458, test_loss: 1.1386, test_f1: 0.4219
 epoch: 43, train_loss: 1.1411, test_loss: 1.1424, test_f1: 0.4192
 epoch: 44, train_loss: 1.1363, test_loss: 1.1341, test_f1: 0.4167
 epoch: 45, train_loss: 1.1385, test_loss: 1.1326, test_f1: 0.4212
 epoch: 46, train_loss: 1.1319, test_loss: 1.1305, test_f1: 0.4234
 epoch: 47, train_loss: 1.1283, test_loss: 1.1285, test_f1: 0.4182
 epoch: 48, train_loss: 1.1349, test_loss: 1.1241, test_f1: 0.4225
 epoch: 49, train_loss: 1.1230, test_loss: 1.1264, test_f1: 0.4236
 epoch: 50, train_loss: 1.1293, test_loss: 1.1195, test_f1: 0.4255
 epoch: 51, train_loss: 1.1224, test_loss: 1.1251, test_f1: 0.4303
 epoch: 52, train_loss: 1.1205, test_loss: 1.1218, test_f1: 0.4250
 epoch: 53, train_loss: 1.1212, test_loss: 1.1192, test_f1: 0.4259
 epoch: 54, train_loss: 1.1206, test_loss: 1.1171, test_f1: 0.4256
 epoch: 55, train_loss: 1.1213, test_loss: 1.1208, test_f1: 0.4255
 epoch: 56, train_loss: 1.1152, test_loss: 1.1182, test_f1: 0.4294
 epoch: 57, train_loss: 1.1189, test_loss: 1.1194, test_f1: 0.4239
 epoch: 58, train_loss: 1.1110, test_loss: 1.1176, test_f1: 0.4259
 epoch: 59, train_loss: 1.1102, test_loss: 1.1134, test_f1: 0.4220
 epoch: 60, train_loss: 1.1193, test_loss: 1.1197, test_f1: 0.4242
 epoch: 61, train_loss: 1.1103, test_loss: 1.1165, test_f1: 0.4184
 epoch: 62, train_loss: 1.1077, test_loss: 1.1142, test_f1: 0.4215
 epoch: 63, train_loss: 1.1047, test_loss: 1.1166, test_f1: 0.4267
 epoch: 64, train_loss: 1.1124, test_loss: 1.1131, test_f1: 0.4374
 epoch: 65, train_loss: 1.1081, test_loss: 1.1165, test_f1: 0.4234
 epoch: 66, train_loss: 1.1073, test_loss: 1.1135, test_f1: 0.4309
 epoch: 67, train_loss: 1.1089, test_loss: 1.1175, test_f1: 0.4282
 epoch: 68, train_loss: 1.1013, test_loss: 1.1188, test_f1: 0.4162
 epoch: 69, train_loss: 1.1005, test_loss: 1.1114, test_f1: 0.4227
 epoch: 70, train_loss: 1.0999, test_loss: 1.1151, test_f1: 0.4227
 epoch: 71, train_loss: 1.1068, test_loss: 1.1088, test_f1: 0.4313
 epoch: 72, train_loss: 1.0960, test_loss: 1.1068, test_f1: 0.4303
 epoch: 73, train_loss: 1.0992, test_loss: 1.1090, test_f1: 0.4255
 epoch: 74, train_loss: 1.0842, test_loss: 1.1035, test_f1: 0.4329
 epoch: 75, train_loss: 1.0933, test_loss: 1.1054, test_f1: 0.4268
 epoch: 76, train_loss: 1.0984, test_loss: 1.1033, test_f1: 0.4245
 epoch: 77, train_loss: 1.0933, test_loss: 1.1018, test_f1: 0.4249
 epoch: 78, train_loss: 1.0944, test_loss: 1.1039, test_f1: 0.4258
 epoch: 79, train_loss: 1.0917, test_loss: 1.1032, test_f1: 0.4233
 epoch: 80, train_loss: 1.0974, test_loss: 1.1016, test_f1: 0.4269
 epoch: 81, train_loss: 1.0908, test_loss: 1.0986, test_f1: 0.4256
 epoch: 82, train_loss: 1.0899, test_loss: 1.1013, test_f1: 0.4239
 epoch: 83, train_loss: 1.0962, test_loss: 1.1017, test_f1: 0.4229
 epoch: 84, train_loss: 1.0930, test_loss: 1.1014, test_f1: 0.4284
 epoch: 85, train_loss: 1.0898, test_loss: 1.1010, test_f1: 0.4214
 epoch: 86, train_loss: 1.0964, test_loss: 1.0979, test_f1: 0.4298
 epoch: 87, train_loss: 1.0931, test_loss: 1.1052, test_f1: 0.4225
 epoch: 88, train_loss: 1.0854, test_loss: 1.0988, test_f1: 0.4244
 epoch: 89, train_loss: 1.0915, test_loss: 1.1004, test_f1: 0.4202
 epoch: 90, train_loss: 1.0782, test_loss: 1.0948, test_f1: 0.4404
 epoch: 91, train_loss: 1.0836, test_loss: 1.0966, test_f1: 0.4225
 epoch: 92, train_loss: 1.0862, test_loss: 1.0962, test_f1: 0.4215
 epoch: 93, train_loss: 1.0853, test_loss: 1.0995, test_f1: 0.4229
 epoch: 94, train_loss: 1.0801, test_loss: 1.0975, test_f1: 0.4277
 epoch: 95, train_loss: 1.0702, test_loss: 1.0962, test_f1: 0.4309
 epoch: 96, train_loss: 1.0699, test_loss: 1.0958, test_f1: 0.4257
 epoch: 97, train_loss: 1.0824, test_loss: 1.0967, test_f1: 0.4199
 epoch: 98, train_loss: 1.0758, test_loss: 1.0941, test_f1: 0.4300
 epoch: 99, train_loss: 1.0828, test_loss: 1.0947, test_f1: 0.4325
##################ITERATION #7 ****************************************
 epoch: 0, train_loss: 1.3225, test_loss: 1.3056, test_f1: 0.2274
 epoch: 1, train_loss: 1.2868, test_loss: 1.2715, test_f1: 0.2555
 epoch: 2, train_loss: 1.2727, test_loss: 1.2533, test_f1: 0.2555
 epoch: 3, train_loss: 1.2610, test_loss: 1.2436, test_f1: 0.2671
 epoch: 4, train_loss: 1.2516, test_loss: 1.2322, test_f1: 0.2743
 epoch: 5, train_loss: 1.2442, test_loss: 1.2200, test_f1: 0.3050
 epoch: 6, train_loss: 1.2415, test_loss: 1.2164, test_f1: 0.3083
 epoch: 7, train_loss: 1.2342, test_loss: 1.2110, test_f1: 0.3360
 epoch: 8, train_loss: 1.2316, test_loss: 1.2043, test_f1: 0.3618
 epoch: 9, train_loss: 1.2233, test_loss: 1.1978, test_f1: 0.3703
 epoch: 10, train_loss: 1.2193, test_loss: 1.1933, test_f1: 0.3822
 epoch: 11, train_loss: 1.2153, test_loss: 1.1896, test_f1: 0.3757
 epoch: 12, train_loss: 1.2116, test_loss: 1.1857, test_f1: 0.3688
 epoch: 13, train_loss: 1.2054, test_loss: 1.1803, test_f1: 0.3730
 epoch: 14, train_loss: 1.2056, test_loss: 1.1752, test_f1: 0.3857
 epoch: 15, train_loss: 1.2009, test_loss: 1.1714, test_f1: 0.3838
 epoch: 16, train_loss: 1.1967, test_loss: 1.1672, test_f1: 0.3844
 epoch: 17, train_loss: 1.1989, test_loss: 1.1637, test_f1: 0.3863
 epoch: 18, train_loss: 1.1882, test_loss: 1.1601, test_f1: 0.3859
 epoch: 19, train_loss: 1.1911, test_loss: 1.1556, test_f1: 0.4008
 epoch: 20, train_loss: 1.1828, test_loss: 1.1524, test_f1: 0.4045
 epoch: 21, train_loss: 1.1754, test_loss: 1.1471, test_f1: 0.3987
 epoch: 22, train_loss: 1.1767, test_loss: 1.1438, test_f1: 0.4053
 epoch: 23, train_loss: 1.1737, test_loss: 1.1403, test_f1: 0.4054
 epoch: 24, train_loss: 1.1748, test_loss: 1.1374, test_f1: 0.4278
 epoch: 25, train_loss: 1.1678, test_loss: 1.1315, test_f1: 0.4309
 epoch: 26, train_loss: 1.1635, test_loss: 1.1301, test_f1: 0.4318
 epoch: 27, train_loss: 1.1556, test_loss: 1.1268, test_f1: 0.4325
 epoch: 28, train_loss: 1.1538, test_loss: 1.1228, test_f1: 0.4338
 epoch: 29, train_loss: 1.1563, test_loss: 1.1170, test_f1: 0.4330
 epoch: 30, train_loss: 1.1546, test_loss: 1.1124, test_f1: 0.4324
 epoch: 31, train_loss: 1.1472, test_loss: 1.1086, test_f1: 0.4429
 epoch: 32, train_loss: 1.1525, test_loss: 1.1024, test_f1: 0.4459
 epoch: 33, train_loss: 1.1459, test_loss: 1.1023, test_f1: 0.4333
 epoch: 34, train_loss: 1.1333, test_loss: 1.0966, test_f1: 0.4392
 epoch: 35, train_loss: 1.1357, test_loss: 1.0949, test_f1: 0.4407
 epoch: 36, train_loss: 1.1301, test_loss: 1.0915, test_f1: 0.4396
 epoch: 37, train_loss: 1.1292, test_loss: 1.0874, test_f1: 0.4354
 epoch: 38, train_loss: 1.1237, test_loss: 1.0830, test_f1: 0.4499
 epoch: 39, train_loss: 1.1283, test_loss: 1.0776, test_f1: 0.4437
 epoch: 40, train_loss: 1.1188, test_loss: 1.0753, test_f1: 0.4496
 epoch: 41, train_loss: 1.1235, test_loss: 1.0729, test_f1: 0.4564
 epoch: 42, train_loss: 1.1099, test_loss: 1.0737, test_f1: 0.4552
 epoch: 43, train_loss: 1.1169, test_loss: 1.0667, test_f1: 0.4397
 epoch: 44, train_loss: 1.1107, test_loss: 1.0613, test_f1: 0.4387
 epoch: 45, train_loss: 1.1096, test_loss: 1.0640, test_f1: 0.4405
 epoch: 46, train_loss: 1.1057, test_loss: 1.0630, test_f1: 0.4454
 epoch: 47, train_loss: 1.0993, test_loss: 1.0535, test_f1: 0.4380
 epoch: 48, train_loss: 1.1055, test_loss: 1.0544, test_f1: 0.4316
 epoch: 49, train_loss: 1.0983, test_loss: 1.0489, test_f1: 0.4654
 epoch: 50, train_loss: 1.0955, test_loss: 1.0550, test_f1: 0.4498
 epoch: 51, train_loss: 1.0870, test_loss: 1.0562, test_f1: 0.4596
 epoch: 52, train_loss: 1.0893, test_loss: 1.0533, test_f1: 0.4410
 epoch: 53, train_loss: 1.0896, test_loss: 1.0526, test_f1: 0.4304
 epoch: 54, train_loss: 1.0799, test_loss: 1.0496, test_f1: 0.4513
 epoch: 55, train_loss: 1.0831, test_loss: 1.0506, test_f1: 0.4402
 epoch: 56, train_loss: 1.0721, test_loss: 1.0487, test_f1: 0.4491
 epoch: 57, train_loss: 1.0755, test_loss: 1.0436, test_f1: 0.4430
 epoch: 58, train_loss: 1.0824, test_loss: 1.0448, test_f1: 0.4549
 epoch: 59, train_loss: 1.0818, test_loss: 1.0440, test_f1: 0.4434
 epoch: 60, train_loss: 1.0764, test_loss: 1.0446, test_f1: 0.4559
 epoch: 61, train_loss: 1.0721, test_loss: 1.0413, test_f1: 0.4590
 epoch: 62, train_loss: 1.0694, test_loss: 1.0399, test_f1: 0.4458
 epoch: 63, train_loss: 1.0721, test_loss: 1.0405, test_f1: 0.4474
 epoch: 64, train_loss: 1.0739, test_loss: 1.0370, test_f1: 0.4649
 epoch: 65, train_loss: 1.0747, test_loss: 1.0375, test_f1: 0.4446
 epoch: 66, train_loss: 1.0761, test_loss: 1.0334, test_f1: 0.4526
 epoch: 67, train_loss: 1.0591, test_loss: 1.0314, test_f1: 0.4448
 epoch: 68, train_loss: 1.0746, test_loss: 1.0337, test_f1: 0.4523
 epoch: 69, train_loss: 1.0634, test_loss: 1.0361, test_f1: 0.4379
 epoch: 70, train_loss: 1.0585, test_loss: 1.0331, test_f1: 0.4630
 epoch: 71, train_loss: 1.0588, test_loss: 1.0313, test_f1: 0.4411
 epoch: 72, train_loss: 1.0574, test_loss: 1.0320, test_f1: 0.4512
 epoch: 73, train_loss: 1.0594, test_loss: 1.0269, test_f1: 0.4661
 epoch: 74, train_loss: 1.0592, test_loss: 1.0275, test_f1: 0.4472
 epoch: 75, train_loss: 1.0613, test_loss: 1.0278, test_f1: 0.4537
 epoch: 76, train_loss: 1.0530, test_loss: 1.0313, test_f1: 0.4566
 epoch: 77, train_loss: 1.0537, test_loss: 1.0241, test_f1: 0.4545
 epoch: 78, train_loss: 1.0545, test_loss: 1.0253, test_f1: 0.4464
 epoch: 79, train_loss: 1.0435, test_loss: 1.0245, test_f1: 0.4426
 epoch: 80, train_loss: 1.0516, test_loss: 1.0226, test_f1: 0.4504
 epoch: 81, train_loss: 1.0567, test_loss: 1.0229, test_f1: 0.4552
 epoch: 82, train_loss: 1.0558, test_loss: 1.0227, test_f1: 0.4489
 epoch: 83, train_loss: 1.0522, test_loss: 1.0207, test_f1: 0.4488
 epoch: 84, train_loss: 1.0495, test_loss: 1.0209, test_f1: 0.4463
 epoch: 85, train_loss: 1.0422, test_loss: 1.0196, test_f1: 0.4524
 epoch: 86, train_loss: 1.0419, test_loss: 1.0212, test_f1: 0.4496
 epoch: 87, train_loss: 1.0482, test_loss: 1.0214, test_f1: 0.4479
 epoch: 88, train_loss: 1.0440, test_loss: 1.0233, test_f1: 0.4537
 epoch: 89, train_loss: 1.0376, test_loss: 1.0188, test_f1: 0.4535
 epoch: 90, train_loss: 1.0386, test_loss: 1.0189, test_f1: 0.4626
 epoch: 91, train_loss: 1.0349, test_loss: 1.0197, test_f1: 0.4474
 epoch: 92, train_loss: 1.0402, test_loss: 1.0174, test_f1: 0.4590
 epoch: 93, train_loss: 1.0349, test_loss: 1.0216, test_f1: 0.4551
 epoch: 94, train_loss: 1.0328, test_loss: 1.0210, test_f1: 0.4649
 epoch: 95, train_loss: 1.0436, test_loss: 1.0179, test_f1: 0.4740
 epoch: 96, train_loss: 1.0459, test_loss: 1.0230, test_f1: 0.4574
 epoch: 97, train_loss: 1.0341, test_loss: 1.0133, test_f1: 0.4694
 epoch: 98, train_loss: 1.0202, test_loss: 1.0081, test_f1: 0.4731
 epoch: 99, train_loss: 1.0255, test_loss: 1.0116, test_f1: 0.4478
##################ITERATION #8 ****************************************
 epoch: 0, train_loss: 1.3406, test_loss: 1.3460, test_f1: 0.2274
 epoch: 1, train_loss: 1.3057, test_loss: 1.3409, test_f1: 0.2274
 epoch: 2, train_loss: 1.2787, test_loss: 1.2984, test_f1: 0.2274
 epoch: 3, train_loss: 1.2713, test_loss: 1.2770, test_f1: 0.2303
 epoch: 4, train_loss: 1.2664, test_loss: 1.2612, test_f1: 0.2554
 epoch: 5, train_loss: 1.2596, test_loss: 1.2523, test_f1: 0.2681
 epoch: 6, train_loss: 1.2545, test_loss: 1.2444, test_f1: 0.2781
 epoch: 7, train_loss: 1.2433, test_loss: 1.2366, test_f1: 0.3003
 epoch: 8, train_loss: 1.2425, test_loss: 1.2295, test_f1: 0.3148
 epoch: 9, train_loss: 1.2368, test_loss: 1.2247, test_f1: 0.3323
 epoch: 10, train_loss: 1.2323, test_loss: 1.2176, test_f1: 0.3422
 epoch: 11, train_loss: 1.2294, test_loss: 1.2093, test_f1: 0.3527
 epoch: 12, train_loss: 1.2191, test_loss: 1.2026, test_f1: 0.3682
 epoch: 13, train_loss: 1.2140, test_loss: 1.1963, test_f1: 0.3730
 epoch: 14, train_loss: 1.2069, test_loss: 1.1909, test_f1: 0.3795
 epoch: 15, train_loss: 1.2084, test_loss: 1.1876, test_f1: 0.3859
 epoch: 16, train_loss: 1.2026, test_loss: 1.1840, test_f1: 0.3961
 epoch: 17, train_loss: 1.2040, test_loss: 1.1787, test_f1: 0.4061
 epoch: 18, train_loss: 1.2040, test_loss: 1.1738, test_f1: 0.4005
 epoch: 19, train_loss: 1.1960, test_loss: 1.1694, test_f1: 0.4103
 epoch: 20, train_loss: 1.1887, test_loss: 1.1660, test_f1: 0.4014
 epoch: 21, train_loss: 1.1820, test_loss: 1.1630, test_f1: 0.4080
 epoch: 22, train_loss: 1.1902, test_loss: 1.1619, test_f1: 0.4119
 epoch: 23, train_loss: 1.1821, test_loss: 1.1606, test_f1: 0.4008
 epoch: 24, train_loss: 1.1790, test_loss: 1.1579, test_f1: 0.4082
 epoch: 25, train_loss: 1.1845, test_loss: 1.1520, test_f1: 0.4166
 epoch: 26, train_loss: 1.1778, test_loss: 1.1511, test_f1: 0.4161
 epoch: 27, train_loss: 1.1776, test_loss: 1.1436, test_f1: 0.4115
 epoch: 28, train_loss: 1.1773, test_loss: 1.1423, test_f1: 0.4161
 epoch: 29, train_loss: 1.1718, test_loss: 1.1424, test_f1: 0.4043
 epoch: 30, train_loss: 1.1642, test_loss: 1.1410, test_f1: 0.4157
 epoch: 31, train_loss: 1.1769, test_loss: 1.1305, test_f1: 0.4222
 epoch: 32, train_loss: 1.1634, test_loss: 1.1261, test_f1: 0.4275
 epoch: 33, train_loss: 1.1602, test_loss: 1.1263, test_f1: 0.4216
 epoch: 34, train_loss: 1.1527, test_loss: 1.1254, test_f1: 0.4163
 epoch: 35, train_loss: 1.1611, test_loss: 1.1277, test_f1: 0.4216
 epoch: 36, train_loss: 1.1588, test_loss: 1.1287, test_f1: 0.4186
 epoch: 37, train_loss: 1.1509, test_loss: 1.1263, test_f1: 0.4199
 epoch: 38, train_loss: 1.1492, test_loss: 1.1221, test_f1: 0.4216
 epoch: 39, train_loss: 1.1501, test_loss: 1.1168, test_f1: 0.4200
 epoch: 40, train_loss: 1.1420, test_loss: 1.1173, test_f1: 0.4175
 epoch: 41, train_loss: 1.1453, test_loss: 1.1192, test_f1: 0.4250
 epoch: 42, train_loss: 1.1376, test_loss: 1.1179, test_f1: 0.4193
 epoch: 43, train_loss: 1.1315, test_loss: 1.1124, test_f1: 0.4150
 epoch: 44, train_loss: 1.1365, test_loss: 1.1085, test_f1: 0.4291
 epoch: 45, train_loss: 1.1362, test_loss: 1.1068, test_f1: 0.4263
 epoch: 46, train_loss: 1.1363, test_loss: 1.1054, test_f1: 0.4326
 epoch: 47, train_loss: 1.1294, test_loss: 1.1001, test_f1: 0.4366
 epoch: 48, train_loss: 1.1290, test_loss: 1.1002, test_f1: 0.4328
 epoch: 49, train_loss: 1.1298, test_loss: 1.1070, test_f1: 0.4224
 epoch: 50, train_loss: 1.1277, test_loss: 1.0994, test_f1: 0.4350
 epoch: 51, train_loss: 1.1265, test_loss: 1.1012, test_f1: 0.4253
 epoch: 52, train_loss: 1.1204, test_loss: 1.0976, test_f1: 0.4265
 epoch: 53, train_loss: 1.1323, test_loss: 1.0985, test_f1: 0.4352
 epoch: 54, train_loss: 1.1265, test_loss: 1.0936, test_f1: 0.4306
 epoch: 55, train_loss: 1.1205, test_loss: 1.1009, test_f1: 0.4314
 epoch: 56, train_loss: 1.1136, test_loss: 1.0976, test_f1: 0.4322
 epoch: 57, train_loss: 1.1256, test_loss: 1.0997, test_f1: 0.4316
 epoch: 58, train_loss: 1.1127, test_loss: 1.0952, test_f1: 0.4244
 epoch: 59, train_loss: 1.1210, test_loss: 1.0979, test_f1: 0.4257
 epoch: 60, train_loss: 1.1135, test_loss: 1.0959, test_f1: 0.4315
 epoch: 61, train_loss: 1.1084, test_loss: 1.0984, test_f1: 0.4339
 epoch: 62, train_loss: 1.1186, test_loss: 1.0910, test_f1: 0.4351
 epoch: 63, train_loss: 1.1203, test_loss: 1.0880, test_f1: 0.4287
 epoch: 64, train_loss: 1.1146, test_loss: 1.0937, test_f1: 0.4199
 epoch: 65, train_loss: 1.0978, test_loss: 1.0924, test_f1: 0.4300
 epoch: 66, train_loss: 1.1161, test_loss: 1.0902, test_f1: 0.4338
 epoch: 67, train_loss: 1.1139, test_loss: 1.0899, test_f1: 0.4372
 epoch: 68, train_loss: 1.1145, test_loss: 1.0927, test_f1: 0.4365
 epoch: 69, train_loss: 1.0983, test_loss: 1.0926, test_f1: 0.4273
 epoch: 70, train_loss: 1.1007, test_loss: 1.0892, test_f1: 0.4369
 epoch: 71, train_loss: 1.1054, test_loss: 1.0899, test_f1: 0.4352
 epoch: 72, train_loss: 1.1139, test_loss: 1.0881, test_f1: 0.4373
 epoch: 73, train_loss: 1.1061, test_loss: 1.0870, test_f1: 0.4421
 epoch: 74, train_loss: 1.1055, test_loss: 1.0924, test_f1: 0.4301
 epoch: 75, train_loss: 1.1074, test_loss: 1.0891, test_f1: 0.4352
 epoch: 76, train_loss: 1.1016, test_loss: 1.0911, test_f1: 0.4344
 epoch: 77, train_loss: 1.0969, test_loss: 1.0885, test_f1: 0.4400
 epoch: 78, train_loss: 1.0917, test_loss: 1.0918, test_f1: 0.4361
 epoch: 79, train_loss: 1.0918, test_loss: 1.0900, test_f1: 0.4304
 epoch: 80, train_loss: 1.1009, test_loss: 1.0901, test_f1: 0.4378
 epoch: 81, train_loss: 1.0945, test_loss: 1.0852, test_f1: 0.4409
 epoch: 82, train_loss: 1.0973, test_loss: 1.0867, test_f1: 0.4414
 epoch: 83, train_loss: 1.1014, test_loss: 1.0868, test_f1: 0.4293
 epoch: 84, train_loss: 1.0906, test_loss: 1.0898, test_f1: 0.4328
 epoch: 85, train_loss: 1.0903, test_loss: 1.0850, test_f1: 0.4286
 epoch: 86, train_loss: 1.0904, test_loss: 1.0836, test_f1: 0.4392
 epoch: 87, train_loss: 1.0927, test_loss: 1.0851, test_f1: 0.4347
 epoch: 88, train_loss: 1.0953, test_loss: 1.0852, test_f1: 0.4372
 epoch: 89, train_loss: 1.0930, test_loss: 1.0841, test_f1: 0.4361
 epoch: 90, train_loss: 1.0915, test_loss: 1.0849, test_f1: 0.4337
 epoch: 91, train_loss: 1.0913, test_loss: 1.0849, test_f1: 0.4375
 epoch: 92, train_loss: 1.0888, test_loss: 1.0846, test_f1: 0.4253
 epoch: 93, train_loss: 1.0905, test_loss: 1.0804, test_f1: 0.4284
 epoch: 94, train_loss: 1.0966, test_loss: 1.0803, test_f1: 0.4293
 epoch: 95, train_loss: 1.0812, test_loss: 1.0802, test_f1: 0.4355
 epoch: 96, train_loss: 1.0906, test_loss: 1.0786, test_f1: 0.4337
 epoch: 97, train_loss: 1.0785, test_loss: 1.0869, test_f1: 0.4212
 epoch: 98, train_loss: 1.0900, test_loss: 1.0827, test_f1: 0.4362
 epoch: 99, train_loss: 1.0938, test_loss: 1.0791, test_f1: 0.4309
##################ITERATION #9 ****************************************
 epoch: 0, train_loss: 1.3307, test_loss: 1.3106, test_f1: 0.2274
 epoch: 1, train_loss: 1.2965, test_loss: 1.2938, test_f1: 0.2300
 epoch: 2, train_loss: 1.2847, test_loss: 1.2744, test_f1: 0.2363
 epoch: 3, train_loss: 1.2752, test_loss: 1.2618, test_f1: 0.2542
 epoch: 4, train_loss: 1.2604, test_loss: 1.2512, test_f1: 0.2534
 epoch: 5, train_loss: 1.2605, test_loss: 1.2408, test_f1: 0.2776
 epoch: 6, train_loss: 1.2584, test_loss: 1.2320, test_f1: 0.3103
 epoch: 7, train_loss: 1.2438, test_loss: 1.2253, test_f1: 0.3341
 epoch: 8, train_loss: 1.2427, test_loss: 1.2194, test_f1: 0.3476
 epoch: 9, train_loss: 1.2345, test_loss: 1.2112, test_f1: 0.3586
 epoch: 10, train_loss: 1.2332, test_loss: 1.2071, test_f1: 0.3485
 epoch: 11, train_loss: 1.2340, test_loss: 1.2043, test_f1: 0.3676
 epoch: 12, train_loss: 1.2171, test_loss: 1.1975, test_f1: 0.3688
 epoch: 13, train_loss: 1.2142, test_loss: 1.1926, test_f1: 0.3708
 epoch: 14, train_loss: 1.2133, test_loss: 1.1905, test_f1: 0.3766
 epoch: 15, train_loss: 1.2131, test_loss: 1.1824, test_f1: 0.3753
 epoch: 16, train_loss: 1.2077, test_loss: 1.1791, test_f1: 0.3772
 epoch: 17, train_loss: 1.1966, test_loss: 1.1731, test_f1: 0.3823
 epoch: 18, train_loss: 1.1965, test_loss: 1.1700, test_f1: 0.3922
 epoch: 19, train_loss: 1.2043, test_loss: 1.1665, test_f1: 0.3956
 epoch: 20, train_loss: 1.1896, test_loss: 1.1608, test_f1: 0.4067
 epoch: 21, train_loss: 1.1829, test_loss: 1.1578, test_f1: 0.4086
 epoch: 22, train_loss: 1.1898, test_loss: 1.1527, test_f1: 0.4055
 epoch: 23, train_loss: 1.1803, test_loss: 1.1521, test_f1: 0.4080
 epoch: 24, train_loss: 1.1666, test_loss: 1.1462, test_f1: 0.4068
 epoch: 25, train_loss: 1.1634, test_loss: 1.1436, test_f1: 0.4086
 epoch: 26, train_loss: 1.1688, test_loss: 1.1424, test_f1: 0.4046
 epoch: 27, train_loss: 1.1621, test_loss: 1.1330, test_f1: 0.4160
 epoch: 28, train_loss: 1.1608, test_loss: 1.1283, test_f1: 0.4205
 epoch: 29, train_loss: 1.1679, test_loss: 1.1284, test_f1: 0.4209
 epoch: 30, train_loss: 1.1533, test_loss: 1.1275, test_f1: 0.4120
 epoch: 31, train_loss: 1.1567, test_loss: 1.1251, test_f1: 0.4152
 epoch: 32, train_loss: 1.1521, test_loss: 1.1194, test_f1: 0.4284
 epoch: 33, train_loss: 1.1454, test_loss: 1.1170, test_f1: 0.4208
 epoch: 34, train_loss: 1.1404, test_loss: 1.1152, test_f1: 0.4186
 epoch: 35, train_loss: 1.1482, test_loss: 1.1144, test_f1: 0.4014
 epoch: 36, train_loss: 1.1360, test_loss: 1.1090, test_f1: 0.4200
 epoch: 37, train_loss: 1.1253, test_loss: 1.1050, test_f1: 0.4211
 epoch: 38, train_loss: 1.1303, test_loss: 1.1055, test_f1: 0.4178
 epoch: 39, train_loss: 1.1295, test_loss: 1.1003, test_f1: 0.4221
 epoch: 40, train_loss: 1.1203, test_loss: 1.0960, test_f1: 0.4225
 epoch: 41, train_loss: 1.1281, test_loss: 1.0962, test_f1: 0.4219
 epoch: 42, train_loss: 1.1179, test_loss: 1.0939, test_f1: 0.4236
 epoch: 43, train_loss: 1.1225, test_loss: 1.0940, test_f1: 0.4338
 epoch: 44, train_loss: 1.1208, test_loss: 1.0921, test_f1: 0.4256
 epoch: 45, train_loss: 1.1127, test_loss: 1.0900, test_f1: 0.4258
 epoch: 46, train_loss: 1.1091, test_loss: 1.0857, test_f1: 0.4320
 epoch: 47, train_loss: 1.0998, test_loss: 1.0816, test_f1: 0.4333
 epoch: 48, train_loss: 1.0993, test_loss: 1.0836, test_f1: 0.4272
 epoch: 49, train_loss: 1.1052, test_loss: 1.0785, test_f1: 0.4390
 epoch: 50, train_loss: 1.1013, test_loss: 1.0781, test_f1: 0.4366
 epoch: 51, train_loss: 1.0930, test_loss: 1.0776, test_f1: 0.4450
 epoch: 52, train_loss: 1.0987, test_loss: 1.0789, test_f1: 0.4482
 epoch: 53, train_loss: 1.0944, test_loss: 1.0751, test_f1: 0.4338
 epoch: 54, train_loss: 1.0913, test_loss: 1.0710, test_f1: 0.4440
 epoch: 55, train_loss: 1.0816, test_loss: 1.0714, test_f1: 0.4450
 epoch: 56, train_loss: 1.0836, test_loss: 1.0693, test_f1: 0.4457
 epoch: 57, train_loss: 1.0796, test_loss: 1.0752, test_f1: 0.4354
 epoch: 58, train_loss: 1.0881, test_loss: 1.0687, test_f1: 0.4378
 epoch: 59, train_loss: 1.0917, test_loss: 1.0726, test_f1: 0.4364
 epoch: 60, train_loss: 1.0818, test_loss: 1.0717, test_f1: 0.4303
 epoch: 61, train_loss: 1.0827, test_loss: 1.0708, test_f1: 0.4409
 epoch: 62, train_loss: 1.0892, test_loss: 1.0721, test_f1: 0.4323
 epoch: 63, train_loss: 1.0812, test_loss: 1.0685, test_f1: 0.4333
 epoch: 64, train_loss: 1.0821, test_loss: 1.0663, test_f1: 0.4414
 epoch: 65, train_loss: 1.0797, test_loss: 1.0679, test_f1: 0.4424
 epoch: 66, train_loss: 1.0767, test_loss: 1.0667, test_f1: 0.4468
 epoch: 67, train_loss: 1.0714, test_loss: 1.0655, test_f1: 0.4408
 epoch: 68, train_loss: 1.0671, test_loss: 1.0656, test_f1: 0.4302
 epoch: 69, train_loss: 1.0717, test_loss: 1.0646, test_f1: 0.4408
 epoch: 70, train_loss: 1.0769, test_loss: 1.0647, test_f1: 0.4348
 epoch: 71, train_loss: 1.0719, test_loss: 1.0648, test_f1: 0.4425
 epoch: 72, train_loss: 1.0648, test_loss: 1.0636, test_f1: 0.4414
 epoch: 73, train_loss: 1.0642, test_loss: 1.0611, test_f1: 0.4398
 epoch: 74, train_loss: 1.0692, test_loss: 1.0647, test_f1: 0.4387
 epoch: 75, train_loss: 1.0653, test_loss: 1.0668, test_f1: 0.4381
 epoch: 76, train_loss: 1.0632, test_loss: 1.0592, test_f1: 0.4427
 epoch: 77, train_loss: 1.0553, test_loss: 1.0550, test_f1: 0.4451
 epoch: 78, train_loss: 1.0590, test_loss: 1.0576, test_f1: 0.4502
 epoch: 79, train_loss: 1.0642, test_loss: 1.0607, test_f1: 0.4446
 epoch: 80, train_loss: 1.0522, test_loss: 1.0612, test_f1: 0.4345
 epoch: 81, train_loss: 1.0649, test_loss: 1.0608, test_f1: 0.4302
 epoch: 82, train_loss: 1.0547, test_loss: 1.0589, test_f1: 0.4438
 epoch: 83, train_loss: 1.0620, test_loss: 1.0589, test_f1: 0.4413
 epoch: 84, train_loss: 1.0506, test_loss: 1.0582, test_f1: 0.4364
 epoch: 85, train_loss: 1.0499, test_loss: 1.0529, test_f1: 0.4415
 epoch: 86, train_loss: 1.0594, test_loss: 1.0547, test_f1: 0.4408
 epoch: 87, train_loss: 1.0506, test_loss: 1.0537, test_f1: 0.4407
 epoch: 88, train_loss: 1.0476, test_loss: 1.0540, test_f1: 0.4404
 epoch: 89, train_loss: 1.0396, test_loss: 1.0565, test_f1: 0.4310
 epoch: 90, train_loss: 1.0505, test_loss: 1.0566, test_f1: 0.4422
 epoch: 91, train_loss: 1.0347, test_loss: 1.0563, test_f1: 0.4379
 epoch: 92, train_loss: 1.0378, test_loss: 1.0518, test_f1: 0.4434
 epoch: 93, train_loss: 1.0488, test_loss: 1.0580, test_f1: 0.4345
 epoch: 94, train_loss: 1.0448, test_loss: 1.0530, test_f1: 0.4436
 epoch: 95, train_loss: 1.0412, test_loss: 1.0540, test_f1: 0.4363
 epoch: 96, train_loss: 1.0471, test_loss: 1.0541, test_f1: 0.4252
 epoch: 97, train_loss: 1.0377, test_loss: 1.0556, test_f1: 0.4272
 epoch: 98, train_loss: 1.0372, test_loss: 1.0544, test_f1: 0.4332
 epoch: 99, train_loss: 1.0356, test_loss: 1.0541, test_f1: 0.4333

Training completed in 513.92 seconds
Best F1: 0.4916 at epoch 96
Mean F1 across iterations: 0.4602  0.0206
========================FINAL RESULTS================================
FEGIN weighted F1: 0.4916  0.0206
python main.py --data ltspice_examples --representation component_component --model FEGIN --layers 5 --hiddens 32 --batch_size 128 --lr 0.0001 --emb_size 512 --epochs 100 --save_appendix component_component_L5_H32_BS128_LR0.0001_E512 --no_val
-----



STDERR:
  File "main.py", line 370, in <module>
    main()
  File "main.py", line 254, in main
    dataset = dataset_class(
  File "/home/philip/projects/ltspice_examples_code_repo/Circuit-Completion-Using-GNNs/component_classification_with_link_prediction_head/evaluation/FEGIN/kernel/circuit_datasets.py", line 15, in __init__
    self.data, self.slices = torch.load(self.processed_paths[0])
  File "/home/philip/.local/lib/python3.8/site-packages/torch/serialization.py", line 1040, in load
    warnings.warn(
  File "/usr/lib/python3.8/warnings.py", line 109, in _showwarnmsg
    sw(msg.message, msg.category, msg.filename, msg.lineno,
  File "main.py", line 47, in warn_with_traceback
    traceback.print_stack(file=log)
/home/philip/projects/ltspice_examples_code_repo/Circuit-Completion-Using-GNNs/component_classification_with_link_prediction_head/evaluation/FEGIN/kernel/circuit_datasets.py:15: FutureWarning: You are using `torch.load` with `weights_only=False` (the current default value), which uses the default pickle module implicitly. It is possible to construct malicious pickle data which will execute arbitrary code during unpickling (See https://github.com/pytorch/pytorch/blob/main/SECURITY.md#untrusted-models for more details). In a future release, the default value for `weights_only` will be flipped to `True`. This limits the functions that could be executed during unpickling. Arbitrary objects will no longer be allowed to be loaded via this mode unless they are explicitly allowlisted by the user via `torch.serialization.add_safe_globals`. We recommend you start setting `weights_only=True` for any use case where you don't have full control of the loaded file. Please open an issue on GitHub for any issues related to this experimental feature.
  self.data, self.slices = torch.load(self.processed_paths[0])
