STDOUT:
Results will be saved in /home/philip/projects/ltspice_examples_code_repo/Circuit-Completion-Using-GNNs/component_classification_with_link_prediction_head/evaluation/FEGIN/results/model_FEGIN_dataset_ltspice_examples
Command line input: python main.py --data ltspice_examples --representation component_component --model FEGIN --layers 5 --hiddens 32 --batch_size 32 --lr 0.0001 --emb_size 512 --epochs 100 --save_appendix component_component_L5_H32_BS32_LR0.0001_E512 --no_val
 is saved.
-----
ltspice_examples - FEGIN
Using 5 layers, 32 hidden units, h = 2
Loading component_component representation dataset
ENTERED
Training FEGIN on component_component representation
Train: 3556, Test: 845
##################ITERATION #0 ****************************************
 epoch: 0, train_loss: 1.3513, test_loss: 1.3466, test_f1: 0.2274
 epoch: 1, train_loss: 1.3345, test_loss: 1.3332, test_f1: 0.2274
 epoch: 2, train_loss: 1.3215, test_loss: 1.3230, test_f1: 0.2274
 epoch: 3, train_loss: 1.3095, test_loss: 1.3083, test_f1: 0.2274
 epoch: 4, train_loss: 1.2967, test_loss: 1.2990, test_f1: 0.2274
 epoch: 5, train_loss: 1.2871, test_loss: 1.2840, test_f1: 0.2274
 epoch: 6, train_loss: 1.2817, test_loss: 1.2773, test_f1: 0.2274
 epoch: 7, train_loss: 1.2688, test_loss: 1.2673, test_f1: 0.2274
 epoch: 8, train_loss: 1.2660, test_loss: 1.2555, test_f1: 0.2274
 epoch: 9, train_loss: 1.2557, test_loss: 1.2477, test_f1: 0.2274
 epoch: 10, train_loss: 1.2480, test_loss: 1.2420, test_f1: 0.2274
 epoch: 11, train_loss: 1.2437, test_loss: 1.2260, test_f1: 0.2274
 epoch: 12, train_loss: 1.2349, test_loss: 1.2231, test_f1: 0.2274
 epoch: 13, train_loss: 1.2286, test_loss: 1.2148, test_f1: 0.2749
 epoch: 14, train_loss: 1.2226, test_loss: 1.2035, test_f1: 0.2849
 epoch: 15, train_loss: 1.2232, test_loss: 1.1972, test_f1: 0.3098
 epoch: 16, train_loss: 1.2172, test_loss: 1.1972, test_f1: 0.3129
 epoch: 17, train_loss: 1.2082, test_loss: 1.1890, test_f1: 0.3174
 epoch: 18, train_loss: 1.2117, test_loss: 1.1835, test_f1: 0.3235
 epoch: 19, train_loss: 1.2036, test_loss: 1.1794, test_f1: 0.3245
 epoch: 20, train_loss: 1.2079, test_loss: 1.1830, test_f1: 0.3239
 epoch: 21, train_loss: 1.1936, test_loss: 1.1719, test_f1: 0.3347
 epoch: 22, train_loss: 1.1919, test_loss: 1.1637, test_f1: 0.3390
 epoch: 23, train_loss: 1.1894, test_loss: 1.1564, test_f1: 0.3461
 epoch: 24, train_loss: 1.1835, test_loss: 1.1553, test_f1: 0.3428
 epoch: 25, train_loss: 1.1805, test_loss: 1.1535, test_f1: 0.3547
 epoch: 26, train_loss: 1.1707, test_loss: 1.1411, test_f1: 0.3440
 epoch: 27, train_loss: 1.1690, test_loss: 1.1341, test_f1: 0.3406
 epoch: 28, train_loss: 1.1639, test_loss: 1.1356, test_f1: 0.3538
 epoch: 29, train_loss: 1.1546, test_loss: 1.1246, test_f1: 0.3473
 epoch: 30, train_loss: 1.1485, test_loss: 1.1234, test_f1: 0.3526
 epoch: 31, train_loss: 1.1458, test_loss: 1.1050, test_f1: 0.3748
 epoch: 32, train_loss: 1.1404, test_loss: 1.0999, test_f1: 0.4046
 epoch: 33, train_loss: 1.1403, test_loss: 1.0996, test_f1: 0.4247
 epoch: 34, train_loss: 1.1321, test_loss: 1.0947, test_f1: 0.4185
 epoch: 35, train_loss: 1.1308, test_loss: 1.0956, test_f1: 0.4443
 epoch: 36, train_loss: 1.1229, test_loss: 1.0858, test_f1: 0.4457
 epoch: 37, train_loss: 1.1148, test_loss: 1.0865, test_f1: 0.4390
 epoch: 38, train_loss: 1.1109, test_loss: 1.0954, test_f1: 0.4386
 epoch: 39, train_loss: 1.1099, test_loss: 1.0798, test_f1: 0.4363
 epoch: 40, train_loss: 1.1067, test_loss: 1.0795, test_f1: 0.4346
 epoch: 41, train_loss: 1.1055, test_loss: 1.0752, test_f1: 0.4652
 epoch: 42, train_loss: 1.1078, test_loss: 1.0800, test_f1: 0.4632
 epoch: 43, train_loss: 1.0978, test_loss: 1.0614, test_f1: 0.4659
 epoch: 44, train_loss: 1.0903, test_loss: 1.0760, test_f1: 0.4651
 epoch: 45, train_loss: 1.0869, test_loss: 1.0648, test_f1: 0.4538
 epoch: 46, train_loss: 1.0905, test_loss: 1.0648, test_f1: 0.4591
 epoch: 47, train_loss: 1.0978, test_loss: 1.0694, test_f1: 0.4691
 epoch: 48, train_loss: 1.0842, test_loss: 1.0632, test_f1: 0.4598
 epoch: 49, train_loss: 1.0760, test_loss: 1.0556, test_f1: 0.4793
 epoch: 50, train_loss: 1.0755, test_loss: 1.0601, test_f1: 0.4590
 epoch: 51, train_loss: 1.0766, test_loss: 1.0562, test_f1: 0.4654
 epoch: 52, train_loss: 1.0717, test_loss: 1.0516, test_f1: 0.4548
 epoch: 53, train_loss: 1.0714, test_loss: 1.0542, test_f1: 0.4738
 epoch: 54, train_loss: 1.0577, test_loss: 1.0478, test_f1: 0.4741
 epoch: 55, train_loss: 1.0589, test_loss: 1.0524, test_f1: 0.4795
 epoch: 56, train_loss: 1.0763, test_loss: 1.0492, test_f1: 0.4746
 epoch: 57, train_loss: 1.0676, test_loss: 1.0518, test_f1: 0.4616
 epoch: 58, train_loss: 1.0608, test_loss: 1.0497, test_f1: 0.4795
 epoch: 59, train_loss: 1.0559, test_loss: 1.0493, test_f1: 0.4713
 epoch: 60, train_loss: 1.0732, test_loss: 1.0445, test_f1: 0.4706
 epoch: 61, train_loss: 1.0609, test_loss: 1.0493, test_f1: 0.4673
 epoch: 62, train_loss: 1.0584, test_loss: 1.0441, test_f1: 0.4637
 epoch: 63, train_loss: 1.0605, test_loss: 1.0433, test_f1: 0.4777
 epoch: 64, train_loss: 1.0560, test_loss: 1.0597, test_f1: 0.4636
 epoch: 65, train_loss: 1.0557, test_loss: 1.0455, test_f1: 0.4698
 epoch: 66, train_loss: 1.0531, test_loss: 1.0433, test_f1: 0.4807
 epoch: 67, train_loss: 1.0486, test_loss: 1.0459, test_f1: 0.4863
 epoch: 68, train_loss: 1.0459, test_loss: 1.0373, test_f1: 0.4704
 epoch: 69, train_loss: 1.0490, test_loss: 1.0396, test_f1: 0.4836
 epoch: 70, train_loss: 1.0452, test_loss: 1.0479, test_f1: 0.4573
 epoch: 71, train_loss: 1.0403, test_loss: 1.0405, test_f1: 0.4921
 epoch: 72, train_loss: 1.0388, test_loss: 1.0437, test_f1: 0.4848
 epoch: 73, train_loss: 1.0464, test_loss: 1.0387, test_f1: 0.4777
 epoch: 74, train_loss: 1.0395, test_loss: 1.0430, test_f1: 0.4653
 epoch: 75, train_loss: 1.0438, test_loss: 1.0355, test_f1: 0.4762
 epoch: 76, train_loss: 1.0428, test_loss: 1.0354, test_f1: 0.4731
 epoch: 77, train_loss: 1.0386, test_loss: 1.0187, test_f1: 0.4780
 epoch: 78, train_loss: 1.0366, test_loss: 1.0324, test_f1: 0.4727
 epoch: 79, train_loss: 1.0297, test_loss: 1.0423, test_f1: 0.4600
 epoch: 80, train_loss: 1.0319, test_loss: 1.0511, test_f1: 0.4593
 epoch: 81, train_loss: 1.0215, test_loss: 1.0250, test_f1: 0.4780
 epoch: 82, train_loss: 1.0322, test_loss: 1.0218, test_f1: 0.4740
 epoch: 83, train_loss: 1.0288, test_loss: 1.0176, test_f1: 0.4851
 epoch: 84, train_loss: 1.0432, test_loss: 1.0283, test_f1: 0.4664
 epoch: 85, train_loss: 1.0244, test_loss: 1.0191, test_f1: 0.4784
 epoch: 86, train_loss: 1.0270, test_loss: 1.0358, test_f1: 0.4651
 epoch: 87, train_loss: 1.0327, test_loss: 1.0188, test_f1: 0.4768
 epoch: 88, train_loss: 1.0283, test_loss: 1.0247, test_f1: 0.4720
 epoch: 89, train_loss: 1.0163, test_loss: 1.0171, test_f1: 0.4664
 epoch: 90, train_loss: 1.0175, test_loss: 1.0318, test_f1: 0.4827
 epoch: 91, train_loss: 1.0222, test_loss: 1.0179, test_f1: 0.4647
 epoch: 92, train_loss: 1.0295, test_loss: 1.0277, test_f1: 0.4696
 epoch: 93, train_loss: 1.0188, test_loss: 1.0202, test_f1: 0.4782
 epoch: 94, train_loss: 1.0118, test_loss: 1.0162, test_f1: 0.4764
 epoch: 95, train_loss: 1.0245, test_loss: 1.0118, test_f1: 0.4903
 epoch: 96, train_loss: 1.0122, test_loss: 1.0092, test_f1: 0.4802
 epoch: 97, train_loss: 1.0240, test_loss: 1.0114, test_f1: 0.4820
 epoch: 98, train_loss: 1.0128, test_loss: 1.0116, test_f1: 0.4548
 epoch: 99, train_loss: 1.0175, test_loss: 1.0121, test_f1: 0.4723
##################ITERATION #1 ****************************************
 epoch: 0, train_loss: 1.3286, test_loss: 1.3160, test_f1: 0.2274
 epoch: 1, train_loss: 1.2914, test_loss: 1.2852, test_f1: 0.2274
 epoch: 2, train_loss: 1.2728, test_loss: 1.2719, test_f1: 0.2274
 epoch: 3, train_loss: 1.2642, test_loss: 1.2579, test_f1: 0.2274
 epoch: 4, train_loss: 1.2514, test_loss: 1.2480, test_f1: 0.2274
 epoch: 5, train_loss: 1.2460, test_loss: 1.2408, test_f1: 0.2274
 epoch: 6, train_loss: 1.2411, test_loss: 1.2525, test_f1: 0.2274
 epoch: 7, train_loss: 1.2358, test_loss: 1.2736, test_f1: 0.2456
 epoch: 8, train_loss: 1.2313, test_loss: 1.2600, test_f1: 0.2668
 epoch: 9, train_loss: 1.2211, test_loss: 1.2135, test_f1: 0.2929
 epoch: 10, train_loss: 1.2183, test_loss: 1.2017, test_f1: 0.3358
 epoch: 11, train_loss: 1.2111, test_loss: 1.2031, test_f1: 0.3603
 epoch: 12, train_loss: 1.2104, test_loss: 1.1917, test_f1: 0.3799
 epoch: 13, train_loss: 1.2038, test_loss: 1.1888, test_f1: 0.3854
 epoch: 14, train_loss: 1.1979, test_loss: 1.1840, test_f1: 0.3849
 epoch: 15, train_loss: 1.1915, test_loss: 1.1759, test_f1: 0.3879
 epoch: 16, train_loss: 1.1881, test_loss: 1.1615, test_f1: 0.4269
 epoch: 17, train_loss: 1.1825, test_loss: 1.1618, test_f1: 0.4201
 epoch: 18, train_loss: 1.1810, test_loss: 1.1499, test_f1: 0.4244
 epoch: 19, train_loss: 1.1635, test_loss: 1.1466, test_f1: 0.4377
 epoch: 20, train_loss: 1.1640, test_loss: 1.1455, test_f1: 0.4374
 epoch: 21, train_loss: 1.1595, test_loss: 1.1297, test_f1: 0.4451
 epoch: 22, train_loss: 1.1573, test_loss: 1.1242, test_f1: 0.4341
 epoch: 23, train_loss: 1.1536, test_loss: 1.1242, test_f1: 0.4333
 epoch: 24, train_loss: 1.1554, test_loss: 1.1163, test_f1: 0.4351
 epoch: 25, train_loss: 1.1524, test_loss: 1.1137, test_f1: 0.4484
 epoch: 26, train_loss: 1.1428, test_loss: 1.1164, test_f1: 0.4380
 epoch: 27, train_loss: 1.1393, test_loss: 1.1059, test_f1: 0.4488
 epoch: 28, train_loss: 1.1403, test_loss: 1.1061, test_f1: 0.4482
 epoch: 29, train_loss: 1.1387, test_loss: 1.0989, test_f1: 0.4477
 epoch: 30, train_loss: 1.1370, test_loss: 1.1062, test_f1: 0.4476
 epoch: 31, train_loss: 1.1306, test_loss: 1.1123, test_f1: 0.4546
 epoch: 32, train_loss: 1.1150, test_loss: 1.0987, test_f1: 0.4509
 epoch: 33, train_loss: 1.1236, test_loss: 1.0987, test_f1: 0.4447
 epoch: 34, train_loss: 1.1228, test_loss: 1.0896, test_f1: 0.4548
 epoch: 35, train_loss: 1.1226, test_loss: 1.0978, test_f1: 0.4464
 epoch: 36, train_loss: 1.1251, test_loss: 1.0840, test_f1: 0.4538
 epoch: 37, train_loss: 1.1169, test_loss: 1.0915, test_f1: 0.4469
 epoch: 38, train_loss: 1.1129, test_loss: 1.0862, test_f1: 0.4426
 epoch: 39, train_loss: 1.1057, test_loss: 1.0804, test_f1: 0.4457
 epoch: 40, train_loss: 1.0953, test_loss: 1.0704, test_f1: 0.4556
 epoch: 41, train_loss: 1.1018, test_loss: 1.0802, test_f1: 0.4518
 epoch: 42, train_loss: 1.0971, test_loss: 1.0647, test_f1: 0.4648
 epoch: 43, train_loss: 1.0959, test_loss: 1.0685, test_f1: 0.4480
 epoch: 44, train_loss: 1.0980, test_loss: 1.0756, test_f1: 0.4471
 epoch: 45, train_loss: 1.0898, test_loss: 1.0845, test_f1: 0.4502
 epoch: 46, train_loss: 1.0851, test_loss: 1.0685, test_f1: 0.4506
 epoch: 47, train_loss: 1.0924, test_loss: 1.0600, test_f1: 0.4585
 epoch: 48, train_loss: 1.0743, test_loss: 1.0702, test_f1: 0.4396
 epoch: 49, train_loss: 1.0817, test_loss: 1.0538, test_f1: 0.4531
 epoch: 50, train_loss: 1.0773, test_loss: 1.0484, test_f1: 0.4625
 epoch: 51, train_loss: 1.0718, test_loss: 1.0533, test_f1: 0.4463
 epoch: 52, train_loss: 1.0730, test_loss: 1.0584, test_f1: 0.4581
 epoch: 53, train_loss: 1.0785, test_loss: 1.0554, test_f1: 0.4537
 epoch: 54, train_loss: 1.0699, test_loss: 1.0570, test_f1: 0.4536
 epoch: 55, train_loss: 1.0713, test_loss: 1.0540, test_f1: 0.4552
 epoch: 56, train_loss: 1.0716, test_loss: 1.0503, test_f1: 0.4558
 epoch: 57, train_loss: 1.0647, test_loss: 1.0764, test_f1: 0.4476
 epoch: 58, train_loss: 1.0639, test_loss: 1.0443, test_f1: 0.4577
 epoch: 59, train_loss: 1.0701, test_loss: 1.0415, test_f1: 0.4736
 epoch: 60, train_loss: 1.0673, test_loss: 1.0483, test_f1: 0.4622
 epoch: 61, train_loss: 1.0665, test_loss: 1.0474, test_f1: 0.4664
 epoch: 62, train_loss: 1.0609, test_loss: 1.0367, test_f1: 0.4622
 epoch: 63, train_loss: 1.0576, test_loss: 1.0524, test_f1: 0.4515
 epoch: 64, train_loss: 1.0544, test_loss: 1.0586, test_f1: 0.4520
 epoch: 65, train_loss: 1.0635, test_loss: 1.0447, test_f1: 0.4569
 epoch: 66, train_loss: 1.0524, test_loss: 1.0484, test_f1: 0.4642
 epoch: 67, train_loss: 1.0612, test_loss: 1.0470, test_f1: 0.4581
 epoch: 68, train_loss: 1.0591, test_loss: 1.0367, test_f1: 0.4662
 epoch: 69, train_loss: 1.0579, test_loss: 1.0482, test_f1: 0.4510
 epoch: 70, train_loss: 1.0445, test_loss: 1.0448, test_f1: 0.4787
 epoch: 71, train_loss: 1.0506, test_loss: 1.0572, test_f1: 0.4620
 epoch: 72, train_loss: 1.0489, test_loss: 1.0479, test_f1: 0.4719
 epoch: 73, train_loss: 1.0526, test_loss: 1.0536, test_f1: 0.4553
 epoch: 74, train_loss: 1.0357, test_loss: 1.0498, test_f1: 0.4721
 epoch: 75, train_loss: 1.0510, test_loss: 1.0478, test_f1: 0.4701
 epoch: 76, train_loss: 1.0451, test_loss: 1.0397, test_f1: 0.4895
 epoch: 77, train_loss: 1.0360, test_loss: 1.0490, test_f1: 0.4690
 epoch: 78, train_loss: 1.0371, test_loss: 1.0429, test_f1: 0.4819
 epoch: 79, train_loss: 1.0539, test_loss: 1.0373, test_f1: 0.4710
 epoch: 80, train_loss: 1.0501, test_loss: 1.0528, test_f1: 0.4573
 epoch: 81, train_loss: 1.0435, test_loss: 1.0490, test_f1: 0.4688
 epoch: 82, train_loss: 1.0416, test_loss: 1.0538, test_f1: 0.4556
 epoch: 83, train_loss: 1.0417, test_loss: 1.0735, test_f1: 0.4603
 epoch: 84, train_loss: 1.0332, test_loss: 1.0376, test_f1: 0.4786
 epoch: 85, train_loss: 1.0432, test_loss: 1.0418, test_f1: 0.4570
 epoch: 86, train_loss: 1.0442, test_loss: 1.0370, test_f1: 0.4703
 epoch: 87, train_loss: 1.0414, test_loss: 1.0629, test_f1: 0.4586
 epoch: 88, train_loss: 1.0451, test_loss: 1.0433, test_f1: 0.4700
 epoch: 89, train_loss: 1.0396, test_loss: 1.0527, test_f1: 0.4658
 epoch: 90, train_loss: 1.0339, test_loss: 1.0411, test_f1: 0.4765
 epoch: 91, train_loss: 1.0348, test_loss: 1.0531, test_f1: 0.4757
 epoch: 92, train_loss: 1.0322, test_loss: 1.0610, test_f1: 0.4645
 epoch: 93, train_loss: 1.0368, test_loss: 1.0430, test_f1: 0.4764
 epoch: 94, train_loss: 1.0405, test_loss: 1.0436, test_f1: 0.4668
 epoch: 95, train_loss: 1.0333, test_loss: 1.0531, test_f1: 0.4713
 epoch: 96, train_loss: 1.0405, test_loss: 1.0533, test_f1: 0.4656
 epoch: 97, train_loss: 1.0298, test_loss: 1.0448, test_f1: 0.4776
 epoch: 98, train_loss: 1.0345, test_loss: 1.0175, test_f1: 0.4797
 epoch: 99, train_loss: 1.0304, test_loss: 1.0298, test_f1: 0.4892
##################ITERATION #2 ****************************************
 epoch: 0, train_loss: 1.3161, test_loss: 1.2812, test_f1: 0.2274
 epoch: 1, train_loss: 1.2849, test_loss: 1.2672, test_f1: 0.2274
 epoch: 2, train_loss: 1.2730, test_loss: 1.2524, test_f1: 0.2274
 epoch: 3, train_loss: 1.2578, test_loss: 1.2436, test_f1: 0.2466
 epoch: 4, train_loss: 1.2539, test_loss: 1.2355, test_f1: 0.2682
 epoch: 5, train_loss: 1.2431, test_loss: 1.2312, test_f1: 0.3177
 epoch: 6, train_loss: 1.2384, test_loss: 1.2208, test_f1: 0.3214
 epoch: 7, train_loss: 1.2301, test_loss: 1.2135, test_f1: 0.3387
 epoch: 8, train_loss: 1.2230, test_loss: 1.2058, test_f1: 0.3601
 epoch: 9, train_loss: 1.2199, test_loss: 1.1981, test_f1: 0.3653
 epoch: 10, train_loss: 1.2151, test_loss: 1.1891, test_f1: 0.3776
 epoch: 11, train_loss: 1.2094, test_loss: 1.1828, test_f1: 0.3766
 epoch: 12, train_loss: 1.2053, test_loss: 1.1746, test_f1: 0.3822
 epoch: 13, train_loss: 1.1991, test_loss: 1.1687, test_f1: 0.3866
 epoch: 14, train_loss: 1.1890, test_loss: 1.1609, test_f1: 0.3889
 epoch: 15, train_loss: 1.1917, test_loss: 1.1544, test_f1: 0.4013
 epoch: 16, train_loss: 1.1854, test_loss: 1.1508, test_f1: 0.4257
 epoch: 17, train_loss: 1.1813, test_loss: 1.1407, test_f1: 0.3963
 epoch: 18, train_loss: 1.1766, test_loss: 1.1445, test_f1: 0.4225
 epoch: 19, train_loss: 1.1703, test_loss: 1.1364, test_f1: 0.4034
 epoch: 20, train_loss: 1.1630, test_loss: 1.1281, test_f1: 0.4037
 epoch: 21, train_loss: 1.1573, test_loss: 1.1216, test_f1: 0.4528
 epoch: 22, train_loss: 1.1529, test_loss: 1.1287, test_f1: 0.4054
 epoch: 23, train_loss: 1.1568, test_loss: 1.1290, test_f1: 0.4248
 epoch: 24, train_loss: 1.1460, test_loss: 1.1060, test_f1: 0.4413
 epoch: 25, train_loss: 1.1467, test_loss: 1.1080, test_f1: 0.4474
 epoch: 26, train_loss: 1.1356, test_loss: 1.0996, test_f1: 0.4568
 epoch: 27, train_loss: 1.1346, test_loss: 1.0933, test_f1: 0.4513
 epoch: 28, train_loss: 1.1279, test_loss: 1.0907, test_f1: 0.4602
 epoch: 29, train_loss: 1.1276, test_loss: 1.0904, test_f1: 0.4506
 epoch: 30, train_loss: 1.1194, test_loss: 1.0879, test_f1: 0.4584
 epoch: 31, train_loss: 1.1117, test_loss: 1.0775, test_f1: 0.4650
 epoch: 32, train_loss: 1.1098, test_loss: 1.0825, test_f1: 0.4637
 epoch: 33, train_loss: 1.1098, test_loss: 1.0713, test_f1: 0.4579
 epoch: 34, train_loss: 1.1055, test_loss: 1.0706, test_f1: 0.4743
 epoch: 35, train_loss: 1.1057, test_loss: 1.0700, test_f1: 0.4571
 epoch: 36, train_loss: 1.1017, test_loss: 1.0735, test_f1: 0.4501
 epoch: 37, train_loss: 1.0885, test_loss: 1.0671, test_f1: 0.4592
 epoch: 38, train_loss: 1.0903, test_loss: 1.0624, test_f1: 0.4517
 epoch: 39, train_loss: 1.0843, test_loss: 1.0553, test_f1: 0.4503
 epoch: 40, train_loss: 1.0879, test_loss: 1.0624, test_f1: 0.4465
 epoch: 41, train_loss: 1.0723, test_loss: 1.0636, test_f1: 0.4546
 epoch: 42, train_loss: 1.0734, test_loss: 1.0574, test_f1: 0.4611
 epoch: 43, train_loss: 1.0748, test_loss: 1.0583, test_f1: 0.4646
 epoch: 44, train_loss: 1.0751, test_loss: 1.0487, test_f1: 0.4493
 epoch: 45, train_loss: 1.0680, test_loss: 1.0396, test_f1: 0.4605
 epoch: 46, train_loss: 1.0684, test_loss: 1.0524, test_f1: 0.4450
 epoch: 47, train_loss: 1.0602, test_loss: 1.0465, test_f1: 0.4590
 epoch: 48, train_loss: 1.0563, test_loss: 1.0398, test_f1: 0.4508
 epoch: 49, train_loss: 1.0611, test_loss: 1.0323, test_f1: 0.4619
 epoch: 50, train_loss: 1.0514, test_loss: 1.0363, test_f1: 0.4596
 epoch: 51, train_loss: 1.0537, test_loss: 1.0339, test_f1: 0.4588
 epoch: 52, train_loss: 1.0495, test_loss: 1.0280, test_f1: 0.4534
 epoch: 53, train_loss: 1.0472, test_loss: 1.0300, test_f1: 0.4695
 epoch: 54, train_loss: 1.0354, test_loss: 1.0356, test_f1: 0.4617
 epoch: 55, train_loss: 1.0480, test_loss: 1.0257, test_f1: 0.4575
 epoch: 56, train_loss: 1.0440, test_loss: 1.0457, test_f1: 0.4622
 epoch: 57, train_loss: 1.0319, test_loss: 1.0181, test_f1: 0.4547
 epoch: 58, train_loss: 1.0335, test_loss: 1.0235, test_f1: 0.4697
 epoch: 59, train_loss: 1.0345, test_loss: 1.0274, test_f1: 0.4537
 epoch: 60, train_loss: 1.0344, test_loss: 1.0387, test_f1: 0.4455
 epoch: 61, train_loss: 1.0302, test_loss: 1.0456, test_f1: 0.4403
 epoch: 62, train_loss: 1.0301, test_loss: 1.0115, test_f1: 0.4686
 epoch: 63, train_loss: 1.0325, test_loss: 1.0207, test_f1: 0.4665
 epoch: 64, train_loss: 1.0320, test_loss: 1.0194, test_f1: 0.4582
 epoch: 65, train_loss: 1.0192, test_loss: 1.0228, test_f1: 0.4618
 epoch: 66, train_loss: 1.0272, test_loss: 1.0248, test_f1: 0.4584
 epoch: 67, train_loss: 1.0356, test_loss: 1.0132, test_f1: 0.4675
 epoch: 68, train_loss: 1.0224, test_loss: 1.0442, test_f1: 0.4495
 epoch: 69, train_loss: 1.0203, test_loss: 1.0143, test_f1: 0.4773
 epoch: 70, train_loss: 1.0259, test_loss: 1.0027, test_f1: 0.4802
 epoch: 71, train_loss: 1.0200, test_loss: 1.0133, test_f1: 0.4734
 epoch: 72, train_loss: 1.0160, test_loss: 1.0162, test_f1: 0.4745
 epoch: 73, train_loss: 1.0236, test_loss: 1.0140, test_f1: 0.4706
 epoch: 74, train_loss: 1.0233, test_loss: 1.0102, test_f1: 0.4826
 epoch: 75, train_loss: 1.0134, test_loss: 1.0191, test_f1: 0.4660
 epoch: 76, train_loss: 1.0167, test_loss: 1.0150, test_f1: 0.4648
 epoch: 77, train_loss: 1.0203, test_loss: 1.0292, test_f1: 0.4673
 epoch: 78, train_loss: 1.0104, test_loss: 1.0201, test_f1: 0.4569
 epoch: 79, train_loss: 1.0172, test_loss: 1.0128, test_f1: 0.4731
 epoch: 80, train_loss: 1.0124, test_loss: 1.0532, test_f1: 0.4356
 epoch: 81, train_loss: 1.0181, test_loss: 1.0244, test_f1: 0.4555
 epoch: 82, train_loss: 1.0037, test_loss: 1.0067, test_f1: 0.4706
 epoch: 83, train_loss: 1.0022, test_loss: 1.0141, test_f1: 0.4618
 epoch: 84, train_loss: 1.0103, test_loss: 1.0201, test_f1: 0.4709
 epoch: 85, train_loss: 1.0127, test_loss: 1.0115, test_f1: 0.4621
 epoch: 86, train_loss: 1.0019, test_loss: 1.0177, test_f1: 0.4522
 epoch: 87, train_loss: 1.0023, test_loss: 1.0227, test_f1: 0.4637
 epoch: 88, train_loss: 1.0085, test_loss: 1.0115, test_f1: 0.4737
 epoch: 89, train_loss: 1.0018, test_loss: 0.9952, test_f1: 0.4795
 epoch: 90, train_loss: 0.9890, test_loss: 1.0264, test_f1: 0.4555
 epoch: 91, train_loss: 1.0014, test_loss: 0.9905, test_f1: 0.4935
 epoch: 92, train_loss: 0.9897, test_loss: 1.0407, test_f1: 0.4584
 epoch: 93, train_loss: 0.9918, test_loss: 1.0132, test_f1: 0.4563
 epoch: 94, train_loss: 0.9978, test_loss: 0.9877, test_f1: 0.5015
 epoch: 95, train_loss: 0.9955, test_loss: 1.0396, test_f1: 0.4550
 epoch: 96, train_loss: 1.0038, test_loss: 1.0004, test_f1: 0.4755
 epoch: 97, train_loss: 0.9906, test_loss: 1.0031, test_f1: 0.4598
 epoch: 98, train_loss: 0.9914, test_loss: 1.0190, test_f1: 0.4632
 epoch: 99, train_loss: 0.9949, test_loss: 1.0197, test_f1: 0.4540
##################ITERATION #3 ****************************************
 epoch: 0, train_loss: 1.3141, test_loss: 1.2705, test_f1: 0.2274
 epoch: 1, train_loss: 1.2755, test_loss: 1.2544, test_f1: 0.2352
 epoch: 2, train_loss: 1.2634, test_loss: 1.2412, test_f1: 0.2402
 epoch: 3, train_loss: 1.2527, test_loss: 1.2260, test_f1: 0.2660
 epoch: 4, train_loss: 1.2436, test_loss: 1.2162, test_f1: 0.2812
 epoch: 5, train_loss: 1.2369, test_loss: 1.2081, test_f1: 0.3188
 epoch: 6, train_loss: 1.2216, test_loss: 1.1977, test_f1: 0.3533
 epoch: 7, train_loss: 1.2233, test_loss: 1.1876, test_f1: 0.3693
 epoch: 8, train_loss: 1.2229, test_loss: 1.1850, test_f1: 0.3728
 epoch: 9, train_loss: 1.2114, test_loss: 1.1785, test_f1: 0.3746
 epoch: 10, train_loss: 1.2036, test_loss: 1.1660, test_f1: 0.3857
 epoch: 11, train_loss: 1.2043, test_loss: 1.1648, test_f1: 0.3855
 epoch: 12, train_loss: 1.2031, test_loss: 1.1583, test_f1: 0.3824
 epoch: 13, train_loss: 1.1966, test_loss: 1.1538, test_f1: 0.3945
 epoch: 14, train_loss: 1.1917, test_loss: 1.1479, test_f1: 0.4100
 epoch: 15, train_loss: 1.1845, test_loss: 1.1410, test_f1: 0.4041
 epoch: 16, train_loss: 1.1798, test_loss: 1.1505, test_f1: 0.4057
 epoch: 17, train_loss: 1.1831, test_loss: 1.1348, test_f1: 0.4088
 epoch: 18, train_loss: 1.1722, test_loss: 1.1350, test_f1: 0.4171
 epoch: 19, train_loss: 1.1768, test_loss: 1.1322, test_f1: 0.4170
 epoch: 20, train_loss: 1.1738, test_loss: 1.1220, test_f1: 0.4075
 epoch: 21, train_loss: 1.1693, test_loss: 1.1201, test_f1: 0.4385
 epoch: 22, train_loss: 1.1579, test_loss: 1.1119, test_f1: 0.4436
 epoch: 23, train_loss: 1.1658, test_loss: 1.1048, test_f1: 0.4341
 epoch: 24, train_loss: 1.1585, test_loss: 1.0980, test_f1: 0.4275
 epoch: 25, train_loss: 1.1499, test_loss: 1.1082, test_f1: 0.4127
 epoch: 26, train_loss: 1.1397, test_loss: 1.0973, test_f1: 0.4371
 epoch: 27, train_loss: 1.1452, test_loss: 1.1099, test_f1: 0.4043
 epoch: 28, train_loss: 1.1420, test_loss: 1.0935, test_f1: 0.4250
 epoch: 29, train_loss: 1.1352, test_loss: 1.0933, test_f1: 0.4427
 epoch: 30, train_loss: 1.1336, test_loss: 1.0877, test_f1: 0.4243
 epoch: 31, train_loss: 1.1354, test_loss: 1.0746, test_f1: 0.4489
 epoch: 32, train_loss: 1.1260, test_loss: 1.0914, test_f1: 0.4330
 epoch: 33, train_loss: 1.1201, test_loss: 1.0819, test_f1: 0.4317
 epoch: 34, train_loss: 1.1242, test_loss: 1.0988, test_f1: 0.4446
 epoch: 35, train_loss: 1.1168, test_loss: 1.0860, test_f1: 0.4313
 epoch: 36, train_loss: 1.1173, test_loss: 1.0693, test_f1: 0.4408
 epoch: 37, train_loss: 1.1132, test_loss: 1.1022, test_f1: 0.4220
 epoch: 38, train_loss: 1.1099, test_loss: 1.0982, test_f1: 0.4234
 epoch: 39, train_loss: 1.1123, test_loss: 1.1280, test_f1: 0.4449
 epoch: 40, train_loss: 1.1101, test_loss: 1.0805, test_f1: 0.4355
 epoch: 41, train_loss: 1.1027, test_loss: 1.0730, test_f1: 0.4352
 epoch: 42, train_loss: 1.1026, test_loss: 1.0924, test_f1: 0.4349
 epoch: 43, train_loss: 1.0957, test_loss: 1.0523, test_f1: 0.4535
 epoch: 44, train_loss: 1.0947, test_loss: 1.0470, test_f1: 0.4714
 epoch: 45, train_loss: 1.0994, test_loss: 1.0701, test_f1: 0.4298
 epoch: 46, train_loss: 1.0946, test_loss: 1.0600, test_f1: 0.4489
 epoch: 47, train_loss: 1.0916, test_loss: 1.0468, test_f1: 0.4514
 epoch: 48, train_loss: 1.0976, test_loss: 1.0511, test_f1: 0.4259
 epoch: 49, train_loss: 1.0838, test_loss: 1.0609, test_f1: 0.4449
 epoch: 50, train_loss: 1.0876, test_loss: 1.0574, test_f1: 0.4387
 epoch: 51, train_loss: 1.0754, test_loss: 1.0432, test_f1: 0.4521
 epoch: 52, train_loss: 1.0717, test_loss: 1.0763, test_f1: 0.4503
 epoch: 53, train_loss: 1.0775, test_loss: 1.0453, test_f1: 0.4448
 epoch: 54, train_loss: 1.0818, test_loss: 1.0814, test_f1: 0.4481
 epoch: 55, train_loss: 1.0782, test_loss: 1.0971, test_f1: 0.4551
 epoch: 56, train_loss: 1.0794, test_loss: 1.0665, test_f1: 0.4426
 epoch: 57, train_loss: 1.0674, test_loss: 1.0496, test_f1: 0.4514
 epoch: 58, train_loss: 1.0751, test_loss: 1.0669, test_f1: 0.4285
 epoch: 59, train_loss: 1.0694, test_loss: 1.0293, test_f1: 0.4638
 epoch: 60, train_loss: 1.0663, test_loss: 1.0511, test_f1: 0.4323
 epoch: 61, train_loss: 1.0761, test_loss: 1.0415, test_f1: 0.4459
 epoch: 62, train_loss: 1.0639, test_loss: 1.0193, test_f1: 0.4711
 epoch: 63, train_loss: 1.0632, test_loss: 1.0645, test_f1: 0.4576
 epoch: 64, train_loss: 1.0574, test_loss: 1.0455, test_f1: 0.4427
 epoch: 65, train_loss: 1.0781, test_loss: 1.0391, test_f1: 0.4623
 epoch: 66, train_loss: 1.0688, test_loss: 1.0303, test_f1: 0.4603
 epoch: 67, train_loss: 1.0564, test_loss: 1.0440, test_f1: 0.4578
 epoch: 68, train_loss: 1.0622, test_loss: 1.0790, test_f1: 0.4518
 epoch: 69, train_loss: 1.0671, test_loss: 1.0245, test_f1: 0.4459
 epoch: 70, train_loss: 1.0642, test_loss: 1.0106, test_f1: 0.4523
 epoch: 71, train_loss: 1.0683, test_loss: 1.0451, test_f1: 0.4384
 epoch: 72, train_loss: 1.0581, test_loss: 1.0898, test_f1: 0.4304
 epoch: 73, train_loss: 1.0557, test_loss: 1.0706, test_f1: 0.4469
 epoch: 74, train_loss: 1.0602, test_loss: 1.0637, test_f1: 0.4324
 epoch: 75, train_loss: 1.0614, test_loss: 1.0196, test_f1: 0.4534
 epoch: 76, train_loss: 1.0501, test_loss: 1.0254, test_f1: 0.4543
 epoch: 77, train_loss: 1.0557, test_loss: 1.0530, test_f1: 0.4298
 epoch: 78, train_loss: 1.0482, test_loss: 1.0357, test_f1: 0.4463
 epoch: 79, train_loss: 1.0515, test_loss: 1.0153, test_f1: 0.4606
 epoch: 80, train_loss: 1.0472, test_loss: 1.0093, test_f1: 0.4507
 epoch: 81, train_loss: 1.0493, test_loss: 1.0854, test_f1: 0.4211
 epoch: 82, train_loss: 1.0565, test_loss: 1.0530, test_f1: 0.4262
 epoch: 83, train_loss: 1.0502, test_loss: 1.0719, test_f1: 0.4373
 epoch: 84, train_loss: 1.0468, test_loss: 1.0926, test_f1: 0.4278
 epoch: 85, train_loss: 1.0412, test_loss: 1.0904, test_f1: 0.4237
 epoch: 86, train_loss: 1.0409, test_loss: 1.0253, test_f1: 0.4649
 epoch: 87, train_loss: 1.0522, test_loss: 1.0187, test_f1: 0.4513
 epoch: 88, train_loss: 1.0477, test_loss: 1.0588, test_f1: 0.4400
 epoch: 89, train_loss: 1.0476, test_loss: 1.0026, test_f1: 0.4408
 epoch: 90, train_loss: 1.0438, test_loss: 1.0181, test_f1: 0.4513
 epoch: 91, train_loss: 1.0451, test_loss: 1.0842, test_f1: 0.4422
 epoch: 92, train_loss: 1.0379, test_loss: 1.0116, test_f1: 0.4377
 epoch: 93, train_loss: 1.0572, test_loss: 1.0177, test_f1: 0.4424
 epoch: 94, train_loss: 1.0383, test_loss: 1.0254, test_f1: 0.4404
 epoch: 95, train_loss: 1.0510, test_loss: 1.0842, test_f1: 0.4317
 epoch: 96, train_loss: 1.0361, test_loss: 1.0348, test_f1: 0.4291
 epoch: 97, train_loss: 1.0433, test_loss: 1.0521, test_f1: 0.4249
 epoch: 98, train_loss: 1.0344, test_loss: 1.1615, test_f1: 0.4185
 epoch: 99, train_loss: 1.0291, test_loss: 1.0146, test_f1: 0.4449
##################ITERATION #4 ****************************************
 epoch: 0, train_loss: 1.3477, test_loss: 1.2830, test_f1: 0.2768
 epoch: 1, train_loss: 1.2710, test_loss: 1.2545, test_f1: 0.2789
 epoch: 2, train_loss: 1.2573, test_loss: 1.2412, test_f1: 0.2547
 epoch: 3, train_loss: 1.2437, test_loss: 1.2288, test_f1: 0.2566
 epoch: 4, train_loss: 1.2387, test_loss: 1.2214, test_f1: 0.2874
 epoch: 5, train_loss: 1.2310, test_loss: 1.2075, test_f1: 0.2811
 epoch: 6, train_loss: 1.2283, test_loss: 1.2007, test_f1: 0.3469
 epoch: 7, train_loss: 1.2215, test_loss: 1.1877, test_f1: 0.3598
 epoch: 8, train_loss: 1.2104, test_loss: 1.1809, test_f1: 0.3969
 epoch: 9, train_loss: 1.2097, test_loss: 1.1706, test_f1: 0.4073
 epoch: 10, train_loss: 1.1975, test_loss: 1.1596, test_f1: 0.4117
 epoch: 11, train_loss: 1.1987, test_loss: 1.1483, test_f1: 0.4029
 epoch: 12, train_loss: 1.1846, test_loss: 1.1408, test_f1: 0.4143
 epoch: 13, train_loss: 1.1853, test_loss: 1.1372, test_f1: 0.4087
 epoch: 14, train_loss: 1.1730, test_loss: 1.1366, test_f1: 0.4116
 epoch: 15, train_loss: 1.1671, test_loss: 1.1231, test_f1: 0.4273
 epoch: 16, train_loss: 1.1544, test_loss: 1.1207, test_f1: 0.4108
 epoch: 17, train_loss: 1.1557, test_loss: 1.1145, test_f1: 0.4156
 epoch: 18, train_loss: 1.1497, test_loss: 1.1070, test_f1: 0.4148
 epoch: 19, train_loss: 1.1448, test_loss: 1.0869, test_f1: 0.4376
 epoch: 20, train_loss: 1.1367, test_loss: 1.0934, test_f1: 0.4122
 epoch: 21, train_loss: 1.1396, test_loss: 1.0821, test_f1: 0.4429
 epoch: 22, train_loss: 1.1220, test_loss: 1.0873, test_f1: 0.4132
 epoch: 23, train_loss: 1.1141, test_loss: 1.0760, test_f1: 0.4316
 epoch: 24, train_loss: 1.1128, test_loss: 1.0601, test_f1: 0.4358
 epoch: 25, train_loss: 1.1106, test_loss: 1.0628, test_f1: 0.4324
 epoch: 26, train_loss: 1.1102, test_loss: 1.0643, test_f1: 0.4335
 epoch: 27, train_loss: 1.1077, test_loss: 1.0525, test_f1: 0.4365
 epoch: 28, train_loss: 1.1027, test_loss: 1.0457, test_f1: 0.4278
 epoch: 29, train_loss: 1.0908, test_loss: 1.0566, test_f1: 0.4414
 epoch: 30, train_loss: 1.0789, test_loss: 1.0404, test_f1: 0.4466
 epoch: 31, train_loss: 1.0839, test_loss: 1.0434, test_f1: 0.4245
 epoch: 32, train_loss: 1.0808, test_loss: 1.0485, test_f1: 0.4383
 epoch: 33, train_loss: 1.0892, test_loss: 1.0419, test_f1: 0.4554
 epoch: 34, train_loss: 1.0799, test_loss: 1.0524, test_f1: 0.4327
 epoch: 35, train_loss: 1.0805, test_loss: 1.0440, test_f1: 0.4373
 epoch: 36, train_loss: 1.0757, test_loss: 1.0418, test_f1: 0.4647
 epoch: 37, train_loss: 1.0659, test_loss: 1.0408, test_f1: 0.4570
 epoch: 38, train_loss: 1.0607, test_loss: 1.0249, test_f1: 0.4405
 epoch: 39, train_loss: 1.0600, test_loss: 1.0376, test_f1: 0.4495
 epoch: 40, train_loss: 1.0589, test_loss: 1.0240, test_f1: 0.4701
 epoch: 41, train_loss: 1.0567, test_loss: 1.0345, test_f1: 0.4480
 epoch: 42, train_loss: 1.0565, test_loss: 1.0176, test_f1: 0.4391
 epoch: 43, train_loss: 1.0501, test_loss: 1.0223, test_f1: 0.4646
 epoch: 44, train_loss: 1.0370, test_loss: 1.0305, test_f1: 0.4386
 epoch: 45, train_loss: 1.0436, test_loss: 1.0316, test_f1: 0.4603
 epoch: 46, train_loss: 1.0430, test_loss: 1.0157, test_f1: 0.4342
 epoch: 47, train_loss: 1.0263, test_loss: 1.0113, test_f1: 0.4638
 epoch: 48, train_loss: 1.0304, test_loss: 1.0087, test_f1: 0.4642
 epoch: 49, train_loss: 1.0325, test_loss: 1.0352, test_f1: 0.4666
 epoch: 50, train_loss: 1.0282, test_loss: 1.0165, test_f1: 0.4639
 epoch: 51, train_loss: 1.0259, test_loss: 0.9991, test_f1: 0.4586
 epoch: 52, train_loss: 1.0288, test_loss: 1.0196, test_f1: 0.4654
 epoch: 53, train_loss: 1.0296, test_loss: 1.0045, test_f1: 0.4525
 epoch: 54, train_loss: 1.0244, test_loss: 1.0141, test_f1: 0.4825
 epoch: 55, train_loss: 1.0058, test_loss: 1.0243, test_f1: 0.4462
 epoch: 56, train_loss: 1.0102, test_loss: 1.0253, test_f1: 0.4819
 epoch: 57, train_loss: 1.0112, test_loss: 1.0080, test_f1: 0.4632
 epoch: 58, train_loss: 1.0082, test_loss: 1.0171, test_f1: 0.4515
 epoch: 59, train_loss: 1.0076, test_loss: 1.0047, test_f1: 0.4789
 epoch: 60, train_loss: 1.0089, test_loss: 1.0182, test_f1: 0.4590
 epoch: 61, train_loss: 1.0105, test_loss: 1.0205, test_f1: 0.4475
 epoch: 62, train_loss: 1.0119, test_loss: 1.0138, test_f1: 0.4583
 epoch: 63, train_loss: 1.0148, test_loss: 1.0009, test_f1: 0.4646
 epoch: 64, train_loss: 1.0029, test_loss: 1.0248, test_f1: 0.4872
 epoch: 65, train_loss: 0.9923, test_loss: 1.0049, test_f1: 0.4687
 epoch: 66, train_loss: 1.0013, test_loss: 1.0112, test_f1: 0.4642
 epoch: 67, train_loss: 1.0061, test_loss: 1.0114, test_f1: 0.4649
 epoch: 68, train_loss: 1.0049, test_loss: 1.0182, test_f1: 0.4738
 epoch: 69, train_loss: 0.9944, test_loss: 0.9946, test_f1: 0.4828
 epoch: 70, train_loss: 0.9949, test_loss: 0.9951, test_f1: 0.4867
 epoch: 71, train_loss: 1.0000, test_loss: 0.9989, test_f1: 0.4729
 epoch: 72, train_loss: 1.0004, test_loss: 1.0380, test_f1: 0.4719
 epoch: 73, train_loss: 1.0081, test_loss: 1.0328, test_f1: 0.4778
 epoch: 74, train_loss: 1.0008, test_loss: 1.0171, test_f1: 0.4699
 epoch: 75, train_loss: 1.0000, test_loss: 1.0063, test_f1: 0.4755
 epoch: 76, train_loss: 1.0027, test_loss: 1.0287, test_f1: 0.4659
 epoch: 77, train_loss: 0.9967, test_loss: 1.0277, test_f1: 0.4713
 epoch: 78, train_loss: 0.9922, test_loss: 1.0103, test_f1: 0.4811
 epoch: 79, train_loss: 0.9971, test_loss: 1.0230, test_f1: 0.4636
 epoch: 80, train_loss: 0.9915, test_loss: 1.0454, test_f1: 0.4689
 epoch: 81, train_loss: 0.9830, test_loss: 1.0166, test_f1: 0.4772
 epoch: 82, train_loss: 0.9933, test_loss: 1.0150, test_f1: 0.4801
 epoch: 83, train_loss: 0.9880, test_loss: 1.0141, test_f1: 0.4754
 epoch: 84, train_loss: 0.9967, test_loss: 1.0155, test_f1: 0.4696
 epoch: 85, train_loss: 0.9847, test_loss: 1.0141, test_f1: 0.4733
 epoch: 86, train_loss: 0.9930, test_loss: 1.0105, test_f1: 0.4845
 epoch: 87, train_loss: 0.9955, test_loss: 0.9954, test_f1: 0.4705
 epoch: 88, train_loss: 0.9826, test_loss: 1.0101, test_f1: 0.4754
 epoch: 89, train_loss: 0.9924, test_loss: 0.9964, test_f1: 0.4697
 epoch: 90, train_loss: 0.9813, test_loss: 1.0097, test_f1: 0.4612
 epoch: 91, train_loss: 0.9898, test_loss: 1.0069, test_f1: 0.4765
 epoch: 92, train_loss: 0.9778, test_loss: 0.9950, test_f1: 0.4904
 epoch: 93, train_loss: 0.9819, test_loss: 1.0070, test_f1: 0.4728
 epoch: 94, train_loss: 0.9779, test_loss: 1.0117, test_f1: 0.4685
 epoch: 95, train_loss: 0.9867, test_loss: 1.0041, test_f1: 0.4620
 epoch: 96, train_loss: 0.9785, test_loss: 1.0176, test_f1: 0.4859
 epoch: 97, train_loss: 0.9721, test_loss: 1.0044, test_f1: 0.4580
 epoch: 98, train_loss: 0.9738, test_loss: 1.0048, test_f1: 0.4832
 epoch: 99, train_loss: 0.9724, test_loss: 1.0157, test_f1: 0.4908
##################ITERATION #5 ****************************************
 epoch: 0, train_loss: 1.3014, test_loss: 1.2219, test_f1: 0.2455
 epoch: 1, train_loss: 1.2521, test_loss: 1.2080, test_f1: 0.3041
 epoch: 2, train_loss: 1.2289, test_loss: 1.1982, test_f1: 0.3621
 epoch: 3, train_loss: 1.2298, test_loss: 1.1843, test_f1: 0.3652
 epoch: 4, train_loss: 1.2261, test_loss: 1.1825, test_f1: 0.3678
 epoch: 5, train_loss: 1.2128, test_loss: 1.1760, test_f1: 0.3736
 epoch: 6, train_loss: 1.1942, test_loss: 1.1697, test_f1: 0.3945
 epoch: 7, train_loss: 1.1944, test_loss: 1.1559, test_f1: 0.4006
 epoch: 8, train_loss: 1.1849, test_loss: 1.1531, test_f1: 0.3974
 epoch: 9, train_loss: 1.1772, test_loss: 1.1475, test_f1: 0.3985
 epoch: 10, train_loss: 1.1696, test_loss: 1.1366, test_f1: 0.4251
 epoch: 11, train_loss: 1.1760, test_loss: 1.1357, test_f1: 0.4205
 epoch: 12, train_loss: 1.1626, test_loss: 1.1323, test_f1: 0.4379
 epoch: 13, train_loss: 1.1633, test_loss: 1.1251, test_f1: 0.4273
 epoch: 14, train_loss: 1.1509, test_loss: 1.1227, test_f1: 0.4411
 epoch: 15, train_loss: 1.1482, test_loss: 1.1133, test_f1: 0.4119
 epoch: 16, train_loss: 1.1421, test_loss: 1.1047, test_f1: 0.4326
 epoch: 17, train_loss: 1.1401, test_loss: 1.0972, test_f1: 0.4472
 epoch: 18, train_loss: 1.1364, test_loss: 1.0994, test_f1: 0.4432
 epoch: 19, train_loss: 1.1325, test_loss: 1.0868, test_f1: 0.4233
 epoch: 20, train_loss: 1.1229, test_loss: 1.0913, test_f1: 0.4481
 epoch: 21, train_loss: 1.1167, test_loss: 1.0815, test_f1: 0.4551
 epoch: 22, train_loss: 1.1167, test_loss: 1.0868, test_f1: 0.4554
 epoch: 23, train_loss: 1.1146, test_loss: 1.0788, test_f1: 0.4574
 epoch: 24, train_loss: 1.1091, test_loss: 1.0739, test_f1: 0.4451
 epoch: 25, train_loss: 1.1009, test_loss: 1.0671, test_f1: 0.4607
 epoch: 26, train_loss: 1.1128, test_loss: 1.0630, test_f1: 0.4630
 epoch: 27, train_loss: 1.0927, test_loss: 1.0486, test_f1: 0.4351
 epoch: 28, train_loss: 1.0916, test_loss: 1.0560, test_f1: 0.4580
 epoch: 29, train_loss: 1.0946, test_loss: 1.0497, test_f1: 0.4583
 epoch: 30, train_loss: 1.0818, test_loss: 1.0483, test_f1: 0.4502
 epoch: 31, train_loss: 1.0912, test_loss: 1.0349, test_f1: 0.4679
 epoch: 32, train_loss: 1.0907, test_loss: 1.0388, test_f1: 0.4685
 epoch: 33, train_loss: 1.0838, test_loss: 1.0420, test_f1: 0.4563
 epoch: 34, train_loss: 1.0764, test_loss: 1.0440, test_f1: 0.4257
 epoch: 35, train_loss: 1.0773, test_loss: 1.0174, test_f1: 0.4743
 epoch: 36, train_loss: 1.0721, test_loss: 1.0403, test_f1: 0.4777
 epoch: 37, train_loss: 1.0791, test_loss: 1.0270, test_f1: 0.4701
 epoch: 38, train_loss: 1.0773, test_loss: 1.0287, test_f1: 0.4878
 epoch: 39, train_loss: 1.0560, test_loss: 1.0228, test_f1: 0.4670
 epoch: 40, train_loss: 1.0524, test_loss: 1.0027, test_f1: 0.4857
 epoch: 41, train_loss: 1.0583, test_loss: 1.0308, test_f1: 0.4953
 epoch: 42, train_loss: 1.0510, test_loss: 1.0170, test_f1: 0.4635
 epoch: 43, train_loss: 1.0589, test_loss: 1.0211, test_f1: 0.4409
 epoch: 44, train_loss: 1.0524, test_loss: 1.0047, test_f1: 0.4615
 epoch: 45, train_loss: 1.0516, test_loss: 1.0089, test_f1: 0.4598
 epoch: 46, train_loss: 1.0461, test_loss: 1.0237, test_f1: 0.4563
 epoch: 47, train_loss: 1.0443, test_loss: 0.9998, test_f1: 0.4659
 epoch: 48, train_loss: 1.0323, test_loss: 1.0079, test_f1: 0.4804
 epoch: 49, train_loss: 1.0311, test_loss: 0.9919, test_f1: 0.4627
 epoch: 50, train_loss: 1.0566, test_loss: 0.9784, test_f1: 0.4703
 epoch: 51, train_loss: 1.0320, test_loss: 0.9833, test_f1: 0.4663
 epoch: 52, train_loss: 1.0367, test_loss: 0.9873, test_f1: 0.4818
 epoch: 53, train_loss: 1.0346, test_loss: 0.9843, test_f1: 0.4750
 epoch: 54, train_loss: 1.0284, test_loss: 0.9792, test_f1: 0.4629
 epoch: 55, train_loss: 1.0339, test_loss: 0.9809, test_f1: 0.4798
 epoch: 56, train_loss: 1.0322, test_loss: 0.9696, test_f1: 0.4729
 epoch: 57, train_loss: 1.0340, test_loss: 0.9782, test_f1: 0.4709
 epoch: 58, train_loss: 1.0228, test_loss: 0.9885, test_f1: 0.4970
 epoch: 59, train_loss: 1.0212, test_loss: 0.9886, test_f1: 0.4901
 epoch: 60, train_loss: 1.0285, test_loss: 0.9846, test_f1: 0.4808
 epoch: 61, train_loss: 1.0237, test_loss: 0.9718, test_f1: 0.4865
 epoch: 62, train_loss: 1.0146, test_loss: 0.9972, test_f1: 0.4546
 epoch: 63, train_loss: 1.0300, test_loss: 0.9789, test_f1: 0.4742
 epoch: 64, train_loss: 1.0127, test_loss: 0.9845, test_f1: 0.4948
 epoch: 65, train_loss: 1.0200, test_loss: 0.9910, test_f1: 0.4644
 epoch: 66, train_loss: 1.0071, test_loss: 0.9734, test_f1: 0.4807
 epoch: 67, train_loss: 1.0147, test_loss: 0.9751, test_f1: 0.4864
 epoch: 68, train_loss: 1.0136, test_loss: 0.9781, test_f1: 0.4926
 epoch: 69, train_loss: 1.0203, test_loss: 0.9793, test_f1: 0.4969
 epoch: 70, train_loss: 1.0147, test_loss: 0.9719, test_f1: 0.4687
 epoch: 71, train_loss: 1.0078, test_loss: 0.9659, test_f1: 0.4977
 epoch: 72, train_loss: 1.0092, test_loss: 0.9640, test_f1: 0.4717
 epoch: 73, train_loss: 1.0156, test_loss: 0.9664, test_f1: 0.5016
 epoch: 74, train_loss: 1.0144, test_loss: 0.9728, test_f1: 0.4943
 epoch: 75, train_loss: 1.0109, test_loss: 0.9697, test_f1: 0.4618
 epoch: 76, train_loss: 1.0086, test_loss: 0.9750, test_f1: 0.4763
 epoch: 77, train_loss: 1.0148, test_loss: 0.9672, test_f1: 0.4755
 epoch: 78, train_loss: 1.0036, test_loss: 0.9762, test_f1: 0.4692
 epoch: 79, train_loss: 1.0163, test_loss: 0.9679, test_f1: 0.4738
 epoch: 80, train_loss: 1.0093, test_loss: 0.9816, test_f1: 0.4584
 epoch: 81, train_loss: 0.9976, test_loss: 0.9725, test_f1: 0.4679
 epoch: 82, train_loss: 1.0040, test_loss: 0.9856, test_f1: 0.4870
 epoch: 83, train_loss: 0.9949, test_loss: 0.9680, test_f1: 0.4739
 epoch: 84, train_loss: 1.0031, test_loss: 0.9791, test_f1: 0.4572
 epoch: 85, train_loss: 1.0056, test_loss: 0.9609, test_f1: 0.4711
 epoch: 86, train_loss: 0.9890, test_loss: 0.9748, test_f1: 0.4630
 epoch: 87, train_loss: 1.0082, test_loss: 0.9675, test_f1: 0.4701
 epoch: 88, train_loss: 1.0023, test_loss: 0.9666, test_f1: 0.5150
 epoch: 89, train_loss: 0.9919, test_loss: 0.9646, test_f1: 0.4894
 epoch: 90, train_loss: 0.9982, test_loss: 0.9674, test_f1: 0.4602
 epoch: 91, train_loss: 0.9990, test_loss: 0.9609, test_f1: 0.4728
 epoch: 92, train_loss: 0.9908, test_loss: 0.9937, test_f1: 0.4662
 epoch: 93, train_loss: 0.9980, test_loss: 0.9610, test_f1: 0.4874
 epoch: 94, train_loss: 0.9819, test_loss: 0.9630, test_f1: 0.5023
 epoch: 95, train_loss: 0.9937, test_loss: 0.9572, test_f1: 0.4934
 epoch: 96, train_loss: 0.9970, test_loss: 0.9683, test_f1: 0.4687
 epoch: 97, train_loss: 0.9922, test_loss: 0.9702, test_f1: 0.4575
 epoch: 98, train_loss: 0.9838, test_loss: 0.9777, test_f1: 0.4599
 epoch: 99, train_loss: 0.9934, test_loss: 0.9651, test_f1: 0.4696
##################ITERATION #6 ****************************************
 epoch: 0, train_loss: 1.3317, test_loss: 1.2635, test_f1: 0.2265
 epoch: 1, train_loss: 1.2703, test_loss: 1.2348, test_f1: 0.2814
 epoch: 2, train_loss: 1.2676, test_loss: 1.2390, test_f1: 0.2718
 epoch: 3, train_loss: 1.2441, test_loss: 1.2071, test_f1: 0.3052
 epoch: 4, train_loss: 1.2355, test_loss: 1.2049, test_f1: 0.3225
 epoch: 5, train_loss: 1.2299, test_loss: 1.1973, test_f1: 0.3178
 epoch: 6, train_loss: 1.2280, test_loss: 1.1895, test_f1: 0.3423
 epoch: 7, train_loss: 1.2105, test_loss: 1.1850, test_f1: 0.3594
 epoch: 8, train_loss: 1.2097, test_loss: 1.1799, test_f1: 0.3704
 epoch: 9, train_loss: 1.2011, test_loss: 1.1680, test_f1: 0.3681
 epoch: 10, train_loss: 1.1929, test_loss: 1.1504, test_f1: 0.3988
 epoch: 11, train_loss: 1.1857, test_loss: 1.1555, test_f1: 0.3969
 epoch: 12, train_loss: 1.1868, test_loss: 1.1511, test_f1: 0.3969
 epoch: 13, train_loss: 1.1776, test_loss: 1.1494, test_f1: 0.3865
 epoch: 14, train_loss: 1.1783, test_loss: 1.1407, test_f1: 0.4014
 epoch: 15, train_loss: 1.1735, test_loss: 1.1426, test_f1: 0.4001
 epoch: 16, train_loss: 1.1710, test_loss: 1.1310, test_f1: 0.4080
 epoch: 17, train_loss: 1.1616, test_loss: 1.1294, test_f1: 0.4088
 epoch: 18, train_loss: 1.1717, test_loss: 1.1293, test_f1: 0.3900
 epoch: 19, train_loss: 1.1560, test_loss: 1.1250, test_f1: 0.3929
 epoch: 20, train_loss: 1.1501, test_loss: 1.1109, test_f1: 0.4092
 epoch: 21, train_loss: 1.1600, test_loss: 1.1204, test_f1: 0.4173
 epoch: 22, train_loss: 1.1465, test_loss: 1.1064, test_f1: 0.4124
 epoch: 23, train_loss: 1.1380, test_loss: 1.1019, test_f1: 0.4114
 epoch: 24, train_loss: 1.1246, test_loss: 1.0966, test_f1: 0.4202
 epoch: 25, train_loss: 1.1277, test_loss: 1.0981, test_f1: 0.4263
 epoch: 26, train_loss: 1.1302, test_loss: 1.0896, test_f1: 0.3981
 epoch: 27, train_loss: 1.1322, test_loss: 1.0845, test_f1: 0.3933
 epoch: 28, train_loss: 1.1120, test_loss: 1.0842, test_f1: 0.4032
 epoch: 29, train_loss: 1.1152, test_loss: 1.0844, test_f1: 0.4064
 epoch: 30, train_loss: 1.1117, test_loss: 1.0780, test_f1: 0.4065
 epoch: 31, train_loss: 1.1131, test_loss: 1.0758, test_f1: 0.4046
 epoch: 32, train_loss: 1.1032, test_loss: 1.0697, test_f1: 0.4097
 epoch: 33, train_loss: 1.1139, test_loss: 1.0641, test_f1: 0.4204
 epoch: 34, train_loss: 1.0996, test_loss: 1.0645, test_f1: 0.4036
 epoch: 35, train_loss: 1.1018, test_loss: 1.0616, test_f1: 0.4143
 epoch: 36, train_loss: 1.1005, test_loss: 1.0680, test_f1: 0.4126
 epoch: 37, train_loss: 1.0983, test_loss: 1.0643, test_f1: 0.4248
 epoch: 38, train_loss: 1.0888, test_loss: 1.0485, test_f1: 0.4244
 epoch: 39, train_loss: 1.0876, test_loss: 1.0430, test_f1: 0.4322
 epoch: 40, train_loss: 1.0924, test_loss: 1.0480, test_f1: 0.4308
 epoch: 41, train_loss: 1.0872, test_loss: 1.0512, test_f1: 0.4271
 epoch: 42, train_loss: 1.0746, test_loss: 1.0520, test_f1: 0.4347
 epoch: 43, train_loss: 1.0802, test_loss: 1.0488, test_f1: 0.4313
 epoch: 44, train_loss: 1.0685, test_loss: 1.0477, test_f1: 0.4224
 epoch: 45, train_loss: 1.0687, test_loss: 1.0399, test_f1: 0.4448
 epoch: 46, train_loss: 1.0702, test_loss: 1.0429, test_f1: 0.4229
 epoch: 47, train_loss: 1.0636, test_loss: 1.0504, test_f1: 0.4471
 epoch: 48, train_loss: 1.0638, test_loss: 1.0374, test_f1: 0.4465
 epoch: 49, train_loss: 1.0596, test_loss: 1.0317, test_f1: 0.4467
 epoch: 50, train_loss: 1.0537, test_loss: 1.0304, test_f1: 0.4480
 epoch: 51, train_loss: 1.0540, test_loss: 1.0257, test_f1: 0.4420
 epoch: 52, train_loss: 1.0443, test_loss: 1.0480, test_f1: 0.4239
 epoch: 53, train_loss: 1.0521, test_loss: 1.0303, test_f1: 0.4488
 epoch: 54, train_loss: 1.0605, test_loss: 1.0321, test_f1: 0.4463
 epoch: 55, train_loss: 1.0408, test_loss: 1.0329, test_f1: 0.4415
 epoch: 56, train_loss: 1.0480, test_loss: 1.0382, test_f1: 0.4427
 epoch: 57, train_loss: 1.0396, test_loss: 1.0241, test_f1: 0.4431
 epoch: 58, train_loss: 1.0476, test_loss: 1.0199, test_f1: 0.4486
 epoch: 59, train_loss: 1.0503, test_loss: 1.0355, test_f1: 0.4434
 epoch: 60, train_loss: 1.0363, test_loss: 1.0256, test_f1: 0.4476
 epoch: 61, train_loss: 1.0492, test_loss: 1.0268, test_f1: 0.4459
 epoch: 62, train_loss: 1.0350, test_loss: 1.0160, test_f1: 0.4412
 epoch: 63, train_loss: 1.0358, test_loss: 1.0321, test_f1: 0.4478
 epoch: 64, train_loss: 1.0377, test_loss: 1.0143, test_f1: 0.4508
 epoch: 65, train_loss: 1.0410, test_loss: 1.0309, test_f1: 0.4360
 epoch: 66, train_loss: 1.0334, test_loss: 1.0197, test_f1: 0.4462
 epoch: 67, train_loss: 1.0357, test_loss: 1.0153, test_f1: 0.4541
 epoch: 68, train_loss: 1.0205, test_loss: 1.0250, test_f1: 0.4446
 epoch: 69, train_loss: 1.0313, test_loss: 1.0074, test_f1: 0.4661
 epoch: 70, train_loss: 1.0395, test_loss: 1.0277, test_f1: 0.4326
 epoch: 71, train_loss: 1.0280, test_loss: 1.0273, test_f1: 0.4407
 epoch: 72, train_loss: 1.0295, test_loss: 1.0208, test_f1: 0.4568
 epoch: 73, train_loss: 1.0220, test_loss: 1.0217, test_f1: 0.4469
 epoch: 74, train_loss: 1.0235, test_loss: 1.0220, test_f1: 0.4414
 epoch: 75, train_loss: 1.0233, test_loss: 1.0396, test_f1: 0.4414
 epoch: 76, train_loss: 1.0232, test_loss: 1.0119, test_f1: 0.4596
 epoch: 77, train_loss: 1.0165, test_loss: 1.0188, test_f1: 0.4469
 epoch: 78, train_loss: 1.0264, test_loss: 1.0163, test_f1: 0.4578
 epoch: 79, train_loss: 1.0265, test_loss: 1.0205, test_f1: 0.4437
 epoch: 80, train_loss: 1.0149, test_loss: 1.0207, test_f1: 0.4730
 epoch: 81, train_loss: 1.0172, test_loss: 1.0120, test_f1: 0.4531
 epoch: 82, train_loss: 1.0172, test_loss: 1.0191, test_f1: 0.4557
 epoch: 83, train_loss: 1.0109, test_loss: 1.0080, test_f1: 0.4441
 epoch: 84, train_loss: 1.0172, test_loss: 1.0117, test_f1: 0.4602
 epoch: 85, train_loss: 1.0113, test_loss: 1.0152, test_f1: 0.4693
 epoch: 86, train_loss: 1.0113, test_loss: 0.9965, test_f1: 0.4531
 epoch: 87, train_loss: 1.0077, test_loss: 1.0114, test_f1: 0.4342
 epoch: 88, train_loss: 1.0022, test_loss: 1.0129, test_f1: 0.4585
 epoch: 89, train_loss: 1.0025, test_loss: 0.9939, test_f1: 0.4626
 epoch: 90, train_loss: 1.0025, test_loss: 1.0300, test_f1: 0.4442
 epoch: 91, train_loss: 0.9956, test_loss: 1.0068, test_f1: 0.4507
 epoch: 92, train_loss: 0.9889, test_loss: 0.9911, test_f1: 0.4722
 epoch: 93, train_loss: 0.9986, test_loss: 0.9905, test_f1: 0.4743
 epoch: 94, train_loss: 0.9954, test_loss: 0.9930, test_f1: 0.4780
 epoch: 95, train_loss: 1.0031, test_loss: 1.0094, test_f1: 0.4578
 epoch: 96, train_loss: 0.9938, test_loss: 1.0363, test_f1: 0.4424
 epoch: 97, train_loss: 0.9945, test_loss: 1.0245, test_f1: 0.4460
 epoch: 98, train_loss: 0.9967, test_loss: 0.9943, test_f1: 0.4585
 epoch: 99, train_loss: 1.0009, test_loss: 1.0062, test_f1: 0.4711
##################ITERATION #7 ****************************************
 epoch: 0, train_loss: 1.3245, test_loss: 1.2663, test_f1: 0.2575
 epoch: 1, train_loss: 1.2760, test_loss: 1.2459, test_f1: 0.2903
 epoch: 2, train_loss: 1.2673, test_loss: 1.2610, test_f1: 0.3142
 epoch: 3, train_loss: 1.2466, test_loss: 1.2234, test_f1: 0.2920
 epoch: 4, train_loss: 1.2414, test_loss: 1.2286, test_f1: 0.3288
 epoch: 5, train_loss: 1.2433, test_loss: 1.2463, test_f1: 0.3774
 epoch: 6, train_loss: 1.2282, test_loss: 1.2041, test_f1: 0.3946
 epoch: 7, train_loss: 1.2233, test_loss: 1.2010, test_f1: 0.3783
 epoch: 8, train_loss: 1.2232, test_loss: 1.1819, test_f1: 0.3904
 epoch: 9, train_loss: 1.2148, test_loss: 1.1797, test_f1: 0.4166
 epoch: 10, train_loss: 1.2092, test_loss: 1.1723, test_f1: 0.4170
 epoch: 11, train_loss: 1.2066, test_loss: 1.1761, test_f1: 0.4443
 epoch: 12, train_loss: 1.1979, test_loss: 1.1812, test_f1: 0.4063
 epoch: 13, train_loss: 1.1981, test_loss: 1.2134, test_f1: 0.4287
 epoch: 14, train_loss: 1.1949, test_loss: 1.1833, test_f1: 0.4235
 epoch: 15, train_loss: 1.1858, test_loss: 1.2154, test_f1: 0.4529
 epoch: 16, train_loss: 1.1798, test_loss: 1.1533, test_f1: 0.4533
 epoch: 17, train_loss: 1.1752, test_loss: 1.1293, test_f1: 0.4531
 epoch: 18, train_loss: 1.1804, test_loss: 1.1489, test_f1: 0.4607
 epoch: 19, train_loss: 1.1687, test_loss: 1.1247, test_f1: 0.4729
 epoch: 20, train_loss: 1.1659, test_loss: 1.1434, test_f1: 0.4503
 epoch: 21, train_loss: 1.1613, test_loss: 1.1345, test_f1: 0.4455
 epoch: 22, train_loss: 1.1602, test_loss: 1.1178, test_f1: 0.4376
 epoch: 23, train_loss: 1.1634, test_loss: 1.1182, test_f1: 0.4481
 epoch: 24, train_loss: 1.1500, test_loss: 1.1321, test_f1: 0.4542
 epoch: 25, train_loss: 1.1471, test_loss: 1.1196, test_f1: 0.4616
 epoch: 26, train_loss: 1.1471, test_loss: 1.1291, test_f1: 0.4488
 epoch: 27, train_loss: 1.1518, test_loss: 1.0993, test_f1: 0.4684
 epoch: 28, train_loss: 1.1479, test_loss: 1.1032, test_f1: 0.4735
 epoch: 29, train_loss: 1.1409, test_loss: 1.0765, test_f1: 0.4600
 epoch: 30, train_loss: 1.1377, test_loss: 1.0870, test_f1: 0.4778
 epoch: 31, train_loss: 1.1283, test_loss: 1.0801, test_f1: 0.4523
 epoch: 32, train_loss: 1.1313, test_loss: 1.0680, test_f1: 0.4690
 epoch: 33, train_loss: 1.1281, test_loss: 1.0677, test_f1: 0.4667
 epoch: 34, train_loss: 1.1286, test_loss: 1.0631, test_f1: 0.4737
 epoch: 35, train_loss: 1.1245, test_loss: 1.0606, test_f1: 0.4839
 epoch: 36, train_loss: 1.1189, test_loss: 1.0552, test_f1: 0.4657
 epoch: 37, train_loss: 1.1104, test_loss: 1.0650, test_f1: 0.4676
 epoch: 38, train_loss: 1.1007, test_loss: 1.0580, test_f1: 0.4699
 epoch: 39, train_loss: 1.1145, test_loss: 1.0549, test_f1: 0.4792
 epoch: 40, train_loss: 1.0945, test_loss: 1.0455, test_f1: 0.4683
 epoch: 41, train_loss: 1.1075, test_loss: 1.0528, test_f1: 0.4809
 epoch: 42, train_loss: 1.1027, test_loss: 1.0470, test_f1: 0.4572
 epoch: 43, train_loss: 1.1007, test_loss: 1.0405, test_f1: 0.4912
 epoch: 44, train_loss: 1.1014, test_loss: 1.0419, test_f1: 0.4804
 epoch: 45, train_loss: 1.1007, test_loss: 1.0536, test_f1: 0.4611
 epoch: 46, train_loss: 1.1000, test_loss: 1.0464, test_f1: 0.4717
 epoch: 47, train_loss: 1.0955, test_loss: 1.0381, test_f1: 0.4721
 epoch: 48, train_loss: 1.0823, test_loss: 1.0246, test_f1: 0.4719
 epoch: 49, train_loss: 1.0784, test_loss: 1.0326, test_f1: 0.4737
 epoch: 50, train_loss: 1.0824, test_loss: 1.0421, test_f1: 0.4713
 epoch: 51, train_loss: 1.0786, test_loss: 1.0455, test_f1: 0.4630
 epoch: 52, train_loss: 1.0846, test_loss: 1.0402, test_f1: 0.4704
 epoch: 53, train_loss: 1.0699, test_loss: 1.0238, test_f1: 0.4682
 epoch: 54, train_loss: 1.0795, test_loss: 1.0237, test_f1: 0.4690
 epoch: 55, train_loss: 1.0742, test_loss: 1.0277, test_f1: 0.4625
 epoch: 56, train_loss: 1.0706, test_loss: 1.0258, test_f1: 0.4692
 epoch: 57, train_loss: 1.0720, test_loss: 1.0295, test_f1: 0.4789
 epoch: 58, train_loss: 1.0695, test_loss: 1.0210, test_f1: 0.4841
 epoch: 59, train_loss: 1.0738, test_loss: 1.0256, test_f1: 0.4801
 epoch: 60, train_loss: 1.0643, test_loss: 1.0191, test_f1: 0.4709
 epoch: 61, train_loss: 1.0569, test_loss: 1.0120, test_f1: 0.4836
 epoch: 62, train_loss: 1.0676, test_loss: 1.0271, test_f1: 0.4747
 epoch: 63, train_loss: 1.0632, test_loss: 1.0363, test_f1: 0.4505
 epoch: 64, train_loss: 1.0616, test_loss: 1.0167, test_f1: 0.4744
 epoch: 65, train_loss: 1.0544, test_loss: 1.0249, test_f1: 0.4815
 epoch: 66, train_loss: 1.0541, test_loss: 1.0082, test_f1: 0.4653
 epoch: 67, train_loss: 1.0577, test_loss: 1.0065, test_f1: 0.4859
 epoch: 68, train_loss: 1.0508, test_loss: 1.0229, test_f1: 0.4591
 epoch: 69, train_loss: 1.0524, test_loss: 1.0231, test_f1: 0.4565
 epoch: 70, train_loss: 1.0591, test_loss: 1.0106, test_f1: 0.4672
 epoch: 71, train_loss: 1.0594, test_loss: 1.0004, test_f1: 0.4923
 epoch: 72, train_loss: 1.0465, test_loss: 1.0302, test_f1: 0.4805
 epoch: 73, train_loss: 1.0405, test_loss: 1.0038, test_f1: 0.4829
 epoch: 74, train_loss: 1.0413, test_loss: 1.0072, test_f1: 0.4966
 epoch: 75, train_loss: 1.0481, test_loss: 1.0164, test_f1: 0.4839
 epoch: 76, train_loss: 1.0429, test_loss: 1.0143, test_f1: 0.4778
 epoch: 77, train_loss: 1.0469, test_loss: 1.0000, test_f1: 0.4903
 epoch: 78, train_loss: 1.0364, test_loss: 1.0202, test_f1: 0.4807
 epoch: 79, train_loss: 1.0377, test_loss: 1.0052, test_f1: 0.4775
 epoch: 80, train_loss: 1.0432, test_loss: 0.9981, test_f1: 0.4849
 epoch: 81, train_loss: 1.0456, test_loss: 1.0071, test_f1: 0.4867
 epoch: 82, train_loss: 1.0393, test_loss: 1.0076, test_f1: 0.4571
 epoch: 83, train_loss: 1.0305, test_loss: 1.0013, test_f1: 0.4913
 epoch: 84, train_loss: 1.0320, test_loss: 0.9980, test_f1: 0.4752
 epoch: 85, train_loss: 1.0392, test_loss: 0.9979, test_f1: 0.4700
 epoch: 86, train_loss: 1.0336, test_loss: 1.0091, test_f1: 0.4827
 epoch: 87, train_loss: 1.0360, test_loss: 1.0088, test_f1: 0.4747
 epoch: 88, train_loss: 1.0335, test_loss: 0.9978, test_f1: 0.4641
 epoch: 89, train_loss: 1.0336, test_loss: 0.9846, test_f1: 0.4911
 epoch: 90, train_loss: 1.0235, test_loss: 0.9926, test_f1: 0.4582
 epoch: 91, train_loss: 1.0276, test_loss: 0.9978, test_f1: 0.4989
 epoch: 92, train_loss: 1.0293, test_loss: 0.9968, test_f1: 0.4973
 epoch: 93, train_loss: 1.0287, test_loss: 0.9889, test_f1: 0.5013
 epoch: 94, train_loss: 1.0238, test_loss: 0.9924, test_f1: 0.4839
 epoch: 95, train_loss: 1.0263, test_loss: 0.9856, test_f1: 0.4992
 epoch: 96, train_loss: 1.0253, test_loss: 0.9969, test_f1: 0.4909
 epoch: 97, train_loss: 1.0211, test_loss: 0.9872, test_f1: 0.4928
 epoch: 98, train_loss: 1.0160, test_loss: 0.9920, test_f1: 0.4837
 epoch: 99, train_loss: 1.0263, test_loss: 0.9899, test_f1: 0.4868
##################ITERATION #8 ****************************************
 epoch: 0, train_loss: 1.3129, test_loss: 1.2816, test_f1: 0.2838
 epoch: 1, train_loss: 1.2725, test_loss: 1.2563, test_f1: 0.2972
 epoch: 2, train_loss: 1.2598, test_loss: 1.2703, test_f1: 0.2824
 epoch: 3, train_loss: 1.2506, test_loss: 1.2279, test_f1: 0.3109
 epoch: 4, train_loss: 1.2401, test_loss: 1.2188, test_f1: 0.3312
 epoch: 5, train_loss: 1.2303, test_loss: 1.2081, test_f1: 0.3597
 epoch: 6, train_loss: 1.2283, test_loss: 1.2009, test_f1: 0.3703
 epoch: 7, train_loss: 1.2194, test_loss: 1.1842, test_f1: 0.4000
 epoch: 8, train_loss: 1.2054, test_loss: 1.1897, test_f1: 0.3851
 epoch: 9, train_loss: 1.2059, test_loss: 1.1767, test_f1: 0.3835
 epoch: 10, train_loss: 1.2034, test_loss: 1.1664, test_f1: 0.3854
 epoch: 11, train_loss: 1.1926, test_loss: 1.1583, test_f1: 0.4024
 epoch: 12, train_loss: 1.2009, test_loss: 1.1525, test_f1: 0.3960
 epoch: 13, train_loss: 1.1890, test_loss: 1.1459, test_f1: 0.4072
 epoch: 14, train_loss: 1.1811, test_loss: 1.1378, test_f1: 0.3984
 epoch: 15, train_loss: 1.1792, test_loss: 1.1325, test_f1: 0.4370
 epoch: 16, train_loss: 1.1740, test_loss: 1.1335, test_f1: 0.4044
 epoch: 17, train_loss: 1.1625, test_loss: 1.1203, test_f1: 0.4065
 epoch: 18, train_loss: 1.1633, test_loss: 1.1266, test_f1: 0.4281
 epoch: 19, train_loss: 1.1601, test_loss: 1.1197, test_f1: 0.3987
 epoch: 20, train_loss: 1.1505, test_loss: 1.1193, test_f1: 0.4137
 epoch: 21, train_loss: 1.1395, test_loss: 1.1164, test_f1: 0.4028
 epoch: 22, train_loss: 1.1373, test_loss: 1.1073, test_f1: 0.4065
 epoch: 23, train_loss: 1.1345, test_loss: 1.0974, test_f1: 0.4347
 epoch: 24, train_loss: 1.1364, test_loss: 1.0987, test_f1: 0.4100
 epoch: 25, train_loss: 1.1340, test_loss: 1.1136, test_f1: 0.4165
 epoch: 26, train_loss: 1.1291, test_loss: 1.0897, test_f1: 0.4295
 epoch: 27, train_loss: 1.1239, test_loss: 1.0967, test_f1: 0.4400
 epoch: 28, train_loss: 1.1140, test_loss: 1.0752, test_f1: 0.4342
 epoch: 29, train_loss: 1.1193, test_loss: 1.0765, test_f1: 0.4179
 epoch: 30, train_loss: 1.1169, test_loss: 1.0776, test_f1: 0.4421
 epoch: 31, train_loss: 1.1052, test_loss: 1.0662, test_f1: 0.4399
 epoch: 32, train_loss: 1.1043, test_loss: 1.0737, test_f1: 0.4437
 epoch: 33, train_loss: 1.1037, test_loss: 1.0791, test_f1: 0.4581
 epoch: 34, train_loss: 1.1037, test_loss: 1.0516, test_f1: 0.4542
 epoch: 35, train_loss: 1.1008, test_loss: 1.0550, test_f1: 0.4275
 epoch: 36, train_loss: 1.0937, test_loss: 1.0609, test_f1: 0.4310
 epoch: 37, train_loss: 1.0985, test_loss: 1.0654, test_f1: 0.4228
 epoch: 38, train_loss: 1.0864, test_loss: 1.0398, test_f1: 0.4363
 epoch: 39, train_loss: 1.0902, test_loss: 1.0424, test_f1: 0.4412
 epoch: 40, train_loss: 1.0758, test_loss: 1.0334, test_f1: 0.4471
 epoch: 41, train_loss: 1.0782, test_loss: 1.0404, test_f1: 0.4372
 epoch: 42, train_loss: 1.0759, test_loss: 1.0393, test_f1: 0.4602
 epoch: 43, train_loss: 1.0694, test_loss: 1.0367, test_f1: 0.4362
 epoch: 44, train_loss: 1.0762, test_loss: 1.0361, test_f1: 0.4365
 epoch: 45, train_loss: 1.0656, test_loss: 1.0288, test_f1: 0.4476
 epoch: 46, train_loss: 1.0632, test_loss: 1.0283, test_f1: 0.4422
 epoch: 47, train_loss: 1.0683, test_loss: 1.0186, test_f1: 0.4621
 epoch: 48, train_loss: 1.0643, test_loss: 1.0298, test_f1: 0.4435
 epoch: 49, train_loss: 1.0637, test_loss: 1.0321, test_f1: 0.4439
 epoch: 50, train_loss: 1.0610, test_loss: 1.0230, test_f1: 0.4528
 epoch: 51, train_loss: 1.0546, test_loss: 1.0187, test_f1: 0.4652
 epoch: 52, train_loss: 1.0576, test_loss: 1.0103, test_f1: 0.4515
 epoch: 53, train_loss: 1.0516, test_loss: 1.0186, test_f1: 0.4747
 epoch: 54, train_loss: 1.0478, test_loss: 1.0130, test_f1: 0.4395
 epoch: 55, train_loss: 1.0509, test_loss: 1.0377, test_f1: 0.4520
 epoch: 56, train_loss: 1.0532, test_loss: 1.0051, test_f1: 0.4488
 epoch: 57, train_loss: 1.0500, test_loss: 1.0051, test_f1: 0.4474
 epoch: 58, train_loss: 1.0519, test_loss: 1.0144, test_f1: 0.4425
 epoch: 59, train_loss: 1.0461, test_loss: 1.0139, test_f1: 0.4538
 epoch: 60, train_loss: 1.0377, test_loss: 1.0045, test_f1: 0.4654
 epoch: 61, train_loss: 1.0420, test_loss: 0.9909, test_f1: 0.4537
 epoch: 62, train_loss: 1.0427, test_loss: 1.0047, test_f1: 0.4395
 epoch: 63, train_loss: 1.0434, test_loss: 1.0099, test_f1: 0.4397
 epoch: 64, train_loss: 1.0386, test_loss: 0.9959, test_f1: 0.4533
 epoch: 65, train_loss: 1.0339, test_loss: 1.0063, test_f1: 0.4451
 epoch: 66, train_loss: 1.0419, test_loss: 1.0017, test_f1: 0.4597
 epoch: 67, train_loss: 1.0429, test_loss: 0.9931, test_f1: 0.4639
 epoch: 68, train_loss: 1.0382, test_loss: 1.0046, test_f1: 0.4405
 epoch: 69, train_loss: 1.0337, test_loss: 1.0048, test_f1: 0.4358
 epoch: 70, train_loss: 1.0382, test_loss: 1.0004, test_f1: 0.4622
 epoch: 71, train_loss: 1.0333, test_loss: 1.0079, test_f1: 0.4357
 epoch: 72, train_loss: 1.0310, test_loss: 1.0023, test_f1: 0.4394
 epoch: 73, train_loss: 1.0256, test_loss: 1.0076, test_f1: 0.4433
 epoch: 74, train_loss: 1.0376, test_loss: 1.0067, test_f1: 0.4404
 epoch: 75, train_loss: 1.0353, test_loss: 0.9944, test_f1: 0.4390
 epoch: 76, train_loss: 1.0206, test_loss: 0.9959, test_f1: 0.4478
 epoch: 77, train_loss: 1.0164, test_loss: 0.9920, test_f1: 0.4393
 epoch: 78, train_loss: 1.0327, test_loss: 1.0280, test_f1: 0.4380
 epoch: 79, train_loss: 1.0190, test_loss: 1.0110, test_f1: 0.4445
 epoch: 80, train_loss: 1.0246, test_loss: 1.0060, test_f1: 0.4394
 epoch: 81, train_loss: 1.0197, test_loss: 1.0082, test_f1: 0.4529
 epoch: 82, train_loss: 1.0169, test_loss: 1.0022, test_f1: 0.4385
 epoch: 83, train_loss: 1.0162, test_loss: 1.0043, test_f1: 0.4430
 epoch: 84, train_loss: 1.0141, test_loss: 1.0163, test_f1: 0.4346
 epoch: 85, train_loss: 1.0116, test_loss: 1.0143, test_f1: 0.4610
 epoch: 86, train_loss: 1.0200, test_loss: 1.0003, test_f1: 0.4386
 epoch: 87, train_loss: 1.0025, test_loss: 0.9948, test_f1: 0.4450
 epoch: 88, train_loss: 1.0042, test_loss: 0.9904, test_f1: 0.4494
 epoch: 89, train_loss: 1.0074, test_loss: 0.9785, test_f1: 0.4507
 epoch: 90, train_loss: 1.0085, test_loss: 1.0103, test_f1: 0.4500
 epoch: 91, train_loss: 1.0091, test_loss: 0.9996, test_f1: 0.4462
 epoch: 92, train_loss: 1.0057, test_loss: 1.0006, test_f1: 0.4377
 epoch: 93, train_loss: 1.0134, test_loss: 0.9901, test_f1: 0.4530
 epoch: 94, train_loss: 1.0060, test_loss: 0.9996, test_f1: 0.4503
 epoch: 95, train_loss: 1.0043, test_loss: 0.9936, test_f1: 0.4473
 epoch: 96, train_loss: 1.0010, test_loss: 0.9990, test_f1: 0.4422
 epoch: 97, train_loss: 1.0037, test_loss: 0.9862, test_f1: 0.4545
 epoch: 98, train_loss: 1.0043, test_loss: 0.9911, test_f1: 0.4670
 epoch: 99, train_loss: 0.9995, test_loss: 0.9893, test_f1: 0.4580
##################ITERATION #9 ****************************************
 epoch: 0, train_loss: 1.3729, test_loss: 1.2830, test_f1: 0.2280
 epoch: 1, train_loss: 1.2888, test_loss: 1.2652, test_f1: 0.2286
 epoch: 2, train_loss: 1.2663, test_loss: 1.2336, test_f1: 0.2393
 epoch: 3, train_loss: 1.2435, test_loss: 1.2224, test_f1: 0.2513
 epoch: 4, train_loss: 1.2404, test_loss: 1.1960, test_f1: 0.2928
 epoch: 5, train_loss: 1.2196, test_loss: 1.1791, test_f1: 0.3488
 epoch: 6, train_loss: 1.2219, test_loss: 1.1753, test_f1: 0.3394
 epoch: 7, train_loss: 1.2107, test_loss: 1.1617, test_f1: 0.3594
 epoch: 8, train_loss: 1.1946, test_loss: 1.1536, test_f1: 0.3650
 epoch: 9, train_loss: 1.1938, test_loss: 1.1468, test_f1: 0.3614
 epoch: 10, train_loss: 1.1971, test_loss: 1.1411, test_f1: 0.3713
 epoch: 11, train_loss: 1.1828, test_loss: 1.1411, test_f1: 0.3780
 epoch: 12, train_loss: 1.1802, test_loss: 1.1322, test_f1: 0.3800
 epoch: 13, train_loss: 1.1685, test_loss: 1.1249, test_f1: 0.3940
 epoch: 14, train_loss: 1.1615, test_loss: 1.1144, test_f1: 0.3901
 epoch: 15, train_loss: 1.1534, test_loss: 1.1111, test_f1: 0.4033
 epoch: 16, train_loss: 1.1557, test_loss: 1.1108, test_f1: 0.4060
 epoch: 17, train_loss: 1.1528, test_loss: 1.0957, test_f1: 0.4068
 epoch: 18, train_loss: 1.1383, test_loss: 1.0946, test_f1: 0.4019
 epoch: 19, train_loss: 1.1415, test_loss: 1.0925, test_f1: 0.4140
 epoch: 20, train_loss: 1.1413, test_loss: 1.0921, test_f1: 0.4114
 epoch: 21, train_loss: 1.1423, test_loss: 1.0806, test_f1: 0.4282
 epoch: 22, train_loss: 1.1285, test_loss: 1.0755, test_f1: 0.4107
 epoch: 23, train_loss: 1.1329, test_loss: 1.0674, test_f1: 0.4058
 epoch: 24, train_loss: 1.1194, test_loss: 1.0760, test_f1: 0.4127
 epoch: 25, train_loss: 1.1206, test_loss: 1.0713, test_f1: 0.4078
 epoch: 26, train_loss: 1.1222, test_loss: 1.0664, test_f1: 0.4192
 epoch: 27, train_loss: 1.1149, test_loss: 1.0642, test_f1: 0.4104
 epoch: 28, train_loss: 1.1039, test_loss: 1.0526, test_f1: 0.4208
 epoch: 29, train_loss: 1.1089, test_loss: 1.0514, test_f1: 0.4158
 epoch: 30, train_loss: 1.0941, test_loss: 1.0478, test_f1: 0.4171
 epoch: 31, train_loss: 1.1023, test_loss: 1.0474, test_f1: 0.4186
 epoch: 32, train_loss: 1.0937, test_loss: 1.0485, test_f1: 0.4226
 epoch: 33, train_loss: 1.0963, test_loss: 1.0425, test_f1: 0.4441
 epoch: 34, train_loss: 1.0983, test_loss: 1.0386, test_f1: 0.4245
 epoch: 35, train_loss: 1.0926, test_loss: 1.0361, test_f1: 0.4250
 epoch: 36, train_loss: 1.0846, test_loss: 1.0301, test_f1: 0.4281
 epoch: 37, train_loss: 1.0911, test_loss: 1.0269, test_f1: 0.4318
 epoch: 38, train_loss: 1.0853, test_loss: 1.0352, test_f1: 0.4263
 epoch: 39, train_loss: 1.0832, test_loss: 1.0329, test_f1: 0.4290
 epoch: 40, train_loss: 1.0756, test_loss: 1.0357, test_f1: 0.4257
 epoch: 41, train_loss: 1.0684, test_loss: 1.0275, test_f1: 0.4341
 epoch: 42, train_loss: 1.0697, test_loss: 1.0252, test_f1: 0.4227
 epoch: 43, train_loss: 1.0680, test_loss: 1.0271, test_f1: 0.4310
 epoch: 44, train_loss: 1.0509, test_loss: 1.0271, test_f1: 0.4282
 epoch: 45, train_loss: 1.0523, test_loss: 1.0108, test_f1: 0.4469
 epoch: 46, train_loss: 1.0544, test_loss: 1.0328, test_f1: 0.4175
 epoch: 47, train_loss: 1.0571, test_loss: 1.0224, test_f1: 0.4328
 epoch: 48, train_loss: 1.0608, test_loss: 1.0199, test_f1: 0.4412
 epoch: 49, train_loss: 1.0507, test_loss: 1.0239, test_f1: 0.4298
 epoch: 50, train_loss: 1.0358, test_loss: 1.0251, test_f1: 0.4292
 epoch: 51, train_loss: 1.0469, test_loss: 1.0236, test_f1: 0.4342
 epoch: 52, train_loss: 1.0495, test_loss: 1.0055, test_f1: 0.4444
 epoch: 53, train_loss: 1.0344, test_loss: 1.0160, test_f1: 0.4323
 epoch: 54, train_loss: 1.0488, test_loss: 1.0035, test_f1: 0.4481
 epoch: 55, train_loss: 1.0381, test_loss: 1.0109, test_f1: 0.4371
 epoch: 56, train_loss: 1.0419, test_loss: 1.0114, test_f1: 0.4340
 epoch: 57, train_loss: 1.0364, test_loss: 1.0164, test_f1: 0.4293
 epoch: 58, train_loss: 1.0381, test_loss: 1.0286, test_f1: 0.4219
 epoch: 59, train_loss: 1.0425, test_loss: 1.0151, test_f1: 0.4494
 epoch: 60, train_loss: 1.0366, test_loss: 1.0207, test_f1: 0.4228
 epoch: 61, train_loss: 1.0306, test_loss: 1.0078, test_f1: 0.4444
 epoch: 62, train_loss: 1.0326, test_loss: 1.0103, test_f1: 0.4354
 epoch: 63, train_loss: 1.0364, test_loss: 1.0131, test_f1: 0.4505
 epoch: 64, train_loss: 1.0331, test_loss: 1.0021, test_f1: 0.4383
 epoch: 65, train_loss: 1.0331, test_loss: 1.0065, test_f1: 0.4397
 epoch: 66, train_loss: 1.0337, test_loss: 1.0064, test_f1: 0.4461
 epoch: 67, train_loss: 1.0369, test_loss: 1.0171, test_f1: 0.4169
 epoch: 68, train_loss: 1.0272, test_loss: 1.0021, test_f1: 0.4425
 epoch: 69, train_loss: 1.0279, test_loss: 0.9944, test_f1: 0.4597
 epoch: 70, train_loss: 1.0346, test_loss: 1.0036, test_f1: 0.4459
 epoch: 71, train_loss: 1.0342, test_loss: 1.0193, test_f1: 0.4349
 epoch: 72, train_loss: 1.0241, test_loss: 1.0166, test_f1: 0.4459
 epoch: 73, train_loss: 1.0156, test_loss: 1.0020, test_f1: 0.4414
 epoch: 74, train_loss: 1.0119, test_loss: 1.0000, test_f1: 0.4464
 epoch: 75, train_loss: 1.0182, test_loss: 1.0053, test_f1: 0.4440
 epoch: 76, train_loss: 1.0237, test_loss: 0.9975, test_f1: 0.4420
 epoch: 77, train_loss: 1.0285, test_loss: 0.9994, test_f1: 0.4462
 epoch: 78, train_loss: 1.0288, test_loss: 1.0024, test_f1: 0.4500
 epoch: 79, train_loss: 1.0113, test_loss: 1.0049, test_f1: 0.4342
 epoch: 80, train_loss: 1.0246, test_loss: 1.0004, test_f1: 0.4436
 epoch: 81, train_loss: 1.0146, test_loss: 1.0068, test_f1: 0.4452
 epoch: 82, train_loss: 1.0043, test_loss: 1.0018, test_f1: 0.4488
 epoch: 83, train_loss: 1.0061, test_loss: 0.9920, test_f1: 0.4622
 epoch: 84, train_loss: 1.0102, test_loss: 0.9907, test_f1: 0.4501
 epoch: 85, train_loss: 1.0119, test_loss: 0.9876, test_f1: 0.4572
 epoch: 86, train_loss: 1.0096, test_loss: 0.9882, test_f1: 0.4541
 epoch: 87, train_loss: 1.0146, test_loss: 0.9977, test_f1: 0.4331
 epoch: 88, train_loss: 1.0065, test_loss: 0.9915, test_f1: 0.4393
 epoch: 89, train_loss: 1.0128, test_loss: 0.9903, test_f1: 0.4565
 epoch: 90, train_loss: 1.0203, test_loss: 0.9836, test_f1: 0.4457
 epoch: 91, train_loss: 1.0026, test_loss: 0.9935, test_f1: 0.4540
 epoch: 92, train_loss: 0.9955, test_loss: 0.9911, test_f1: 0.4508
 epoch: 93, train_loss: 1.0124, test_loss: 0.9978, test_f1: 0.4462
 epoch: 94, train_loss: 1.0033, test_loss: 0.9899, test_f1: 0.4481
 epoch: 95, train_loss: 1.0065, test_loss: 0.9916, test_f1: 0.4475
 epoch: 96, train_loss: 1.0056, test_loss: 0.9966, test_f1: 0.4415
 epoch: 97, train_loss: 0.9884, test_loss: 1.0073, test_f1: 0.4341
 epoch: 98, train_loss: 1.0102, test_loss: 0.9925, test_f1: 0.4515
 epoch: 99, train_loss: 0.9986, test_loss: 0.9997, test_f1: 0.4368

Training completed in 1269.78 seconds
Best F1: 0.5150 at epoch 88
Mean F1 across iterations: 0.4876  0.0153
========================FINAL RESULTS================================
FEGIN weighted F1: 0.5150  0.0153
python main.py --data ltspice_examples --representation component_component --model FEGIN --layers 5 --hiddens 32 --batch_size 32 --lr 0.0001 --emb_size 512 --epochs 100 --save_appendix component_component_L5_H32_BS32_LR0.0001_E512 --no_val
-----



STDERR:
  File "main.py", line 370, in <module>
    main()
  File "main.py", line 254, in main
    dataset = dataset_class(
  File "/home/philip/projects/ltspice_examples_code_repo/Circuit-Completion-Using-GNNs/component_classification_with_link_prediction_head/evaluation/FEGIN/kernel/circuit_datasets.py", line 15, in __init__
    self.data, self.slices = torch.load(self.processed_paths[0])
  File "/home/philip/.local/lib/python3.8/site-packages/torch/serialization.py", line 1040, in load
    warnings.warn(
  File "/usr/lib/python3.8/warnings.py", line 109, in _showwarnmsg
    sw(msg.message, msg.category, msg.filename, msg.lineno,
  File "main.py", line 47, in warn_with_traceback
    traceback.print_stack(file=log)
/home/philip/projects/ltspice_examples_code_repo/Circuit-Completion-Using-GNNs/component_classification_with_link_prediction_head/evaluation/FEGIN/kernel/circuit_datasets.py:15: FutureWarning: You are using `torch.load` with `weights_only=False` (the current default value), which uses the default pickle module implicitly. It is possible to construct malicious pickle data which will execute arbitrary code during unpickling (See https://github.com/pytorch/pytorch/blob/main/SECURITY.md#untrusted-models for more details). In a future release, the default value for `weights_only` will be flipped to `True`. This limits the functions that could be executed during unpickling. Arbitrary objects will no longer be allowed to be loaded via this mode unless they are explicitly allowlisted by the user via `torch.serialization.add_safe_globals`. We recommend you start setting `weights_only=True` for any use case where you don't have full control of the loaded file. Please open an issue on GitHub for any issues related to this experimental feature.
  self.data, self.slices = torch.load(self.processed_paths[0])
