STDOUT:
Results will be saved in /home/philip/projects/ltspice_examples_code_repo/Circuit-Completion-Using-GNNs/component_classification_with_link_prediction_head/evaluation/FEGIN/results/model_FEGIN_dataset_ltspice_examples
Command line input: python main.py --data ltspice_examples --representation component_pin_net --model FEGIN --layers 6 --hiddens 16 --batch_size 64 --lr 0.01 --emb_size 512 --epochs 100 --save_appendix component_pin_net_L6_H16_BS64_LR0.01_E512 --no_val
 is saved.
-----
ltspice_examples - FEGIN
Using 6 layers, 16 hidden units, h = 2
Loading component_pin_net representation dataset
ENTERED
Training FEGIN on component_pin_net representation
Train: 3558, Test: 846
##################ITERATION #0 ****************************************
 epoch: 0, train_loss: 1.2003, test_loss: 1.0873, test_f1: 0.3403
 epoch: 1, train_loss: 1.0527, test_loss: 1.0193, test_f1: 0.3634
 epoch: 2, train_loss: 1.0303, test_loss: 1.0626, test_f1: 0.4442
 epoch: 3, train_loss: 0.9926, test_loss: 1.1620, test_f1: 0.4380
 epoch: 4, train_loss: 0.9910, test_loss: 0.9954, test_f1: 0.4546
 epoch: 5, train_loss: 0.9691, test_loss: 1.0477, test_f1: 0.4656
 epoch: 6, train_loss: 0.9615, test_loss: 0.9810, test_f1: 0.4712
 epoch: 7, train_loss: 0.9697, test_loss: 0.9293, test_f1: 0.4888
 epoch: 8, train_loss: 0.9398, test_loss: 0.9336, test_f1: 0.5002
 epoch: 9, train_loss: 0.9400, test_loss: 0.9789, test_f1: 0.4759
 epoch: 10, train_loss: 0.9268, test_loss: 0.9620, test_f1: 0.5142
 epoch: 11, train_loss: 0.9354, test_loss: 0.9641, test_f1: 0.4660
 epoch: 12, train_loss: 0.9212, test_loss: 0.9531, test_f1: 0.5013
 epoch: 13, train_loss: 0.9160, test_loss: 0.8859, test_f1: 0.5189
 epoch: 14, train_loss: 0.9081, test_loss: 0.9048, test_f1: 0.5125
 epoch: 15, train_loss: 0.8987, test_loss: 0.9479, test_f1: 0.5141
 epoch: 16, train_loss: 0.8969, test_loss: 0.9212, test_f1: 0.5208
 epoch: 17, train_loss: 0.8881, test_loss: 0.9703, test_f1: 0.5329
 epoch: 18, train_loss: 0.8841, test_loss: 0.9096, test_f1: 0.5156
 epoch: 19, train_loss: 0.8831, test_loss: 1.0203, test_f1: 0.5094
 epoch: 20, train_loss: 0.8767, test_loss: 1.0226, test_f1: 0.4978
 epoch: 21, train_loss: 0.8839, test_loss: 0.9449, test_f1: 0.5018
 epoch: 22, train_loss: 0.8679, test_loss: 0.9451, test_f1: 0.5456
 epoch: 23, train_loss: 0.8744, test_loss: 0.8967, test_f1: 0.5078
 epoch: 24, train_loss: 0.8766, test_loss: 0.8257, test_f1: 0.5571
 epoch: 25, train_loss: 0.8690, test_loss: 0.9205, test_f1: 0.5080
 epoch: 26, train_loss: 0.8709, test_loss: 0.9316, test_f1: 0.4877
 epoch: 27, train_loss: 0.8847, test_loss: 0.9159, test_f1: 0.5026
 epoch: 28, train_loss: 0.8796, test_loss: 0.8748, test_f1: 0.5170
 epoch: 29, train_loss: 0.8830, test_loss: 0.9432, test_f1: 0.5211
 epoch: 30, train_loss: 0.8661, test_loss: 0.8752, test_f1: 0.5374
 epoch: 31, train_loss: 0.8490, test_loss: 0.8411, test_f1: 0.5727
 epoch: 32, train_loss: 0.8614, test_loss: 1.1462, test_f1: 0.4201
 epoch: 33, train_loss: 0.8362, test_loss: 0.8829, test_f1: 0.4919
 epoch: 34, train_loss: 0.8432, test_loss: 0.8815, test_f1: 0.5705
 epoch: 35, train_loss: 0.8394, test_loss: 0.8579, test_f1: 0.5488
 epoch: 36, train_loss: 0.8264, test_loss: 0.9181, test_f1: 0.5339
 epoch: 37, train_loss: 0.8506, test_loss: 0.9134, test_f1: 0.5130
 epoch: 38, train_loss: 0.8193, test_loss: 0.8575, test_f1: 0.5330
 epoch: 39, train_loss: 0.8261, test_loss: 0.9301, test_f1: 0.5252
 epoch: 40, train_loss: 0.8140, test_loss: 0.8804, test_f1: 0.5580
 epoch: 41, train_loss: 0.7970, test_loss: 0.8803, test_f1: 0.5309
 epoch: 42, train_loss: 0.8167, test_loss: 0.8021, test_f1: 0.5683
 epoch: 43, train_loss: 0.8334, test_loss: 0.9852, test_f1: 0.5131
 epoch: 44, train_loss: 0.8060, test_loss: 0.8725, test_f1: 0.5294
 epoch: 45, train_loss: 0.8282, test_loss: 0.8881, test_f1: 0.5545
 epoch: 46, train_loss: 0.8083, test_loss: 0.8716, test_f1: 0.5200
 epoch: 47, train_loss: 0.8153, test_loss: 0.8115, test_f1: 0.5559
 epoch: 48, train_loss: 0.8207, test_loss: 0.8709, test_f1: 0.5383
 epoch: 49, train_loss: 0.8001, test_loss: 0.8080, test_f1: 0.5498
 epoch: 50, train_loss: 0.7892, test_loss: 0.9246, test_f1: 0.5296
 epoch: 51, train_loss: 0.7860, test_loss: 0.7870, test_f1: 0.5989
 epoch: 52, train_loss: 0.7731, test_loss: 0.8178, test_f1: 0.6088
 epoch: 53, train_loss: 0.7568, test_loss: 0.8359, test_f1: 0.5874
 epoch: 54, train_loss: 0.7531, test_loss: 0.8568, test_f1: 0.5825
 epoch: 55, train_loss: 0.7498, test_loss: 0.7856, test_f1: 0.5720
 epoch: 56, train_loss: 0.7481, test_loss: 0.7938, test_f1: 0.5718
 epoch: 57, train_loss: 0.7379, test_loss: 0.7792, test_f1: 0.6057
 epoch: 58, train_loss: 0.7522, test_loss: 0.8340, test_f1: 0.5830
 epoch: 59, train_loss: 0.7409, test_loss: 0.8413, test_f1: 0.6350
 epoch: 60, train_loss: 0.7448, test_loss: 0.7957, test_f1: 0.6224
 epoch: 61, train_loss: 0.7540, test_loss: 0.7803, test_f1: 0.6020
 epoch: 62, train_loss: 0.7445, test_loss: 0.8068, test_f1: 0.6342
 epoch: 63, train_loss: 0.7465, test_loss: 0.8200, test_f1: 0.6163
 epoch: 64, train_loss: 0.7261, test_loss: 0.8056, test_f1: 0.6010
 epoch: 65, train_loss: 0.7312, test_loss: 0.8188, test_f1: 0.6051
 epoch: 66, train_loss: 0.7302, test_loss: 0.8250, test_f1: 0.5586
 epoch: 67, train_loss: 0.7288, test_loss: 0.8241, test_f1: 0.5810
 epoch: 68, train_loss: 0.7307, test_loss: 0.7998, test_f1: 0.6272
 epoch: 69, train_loss: 0.7264, test_loss: 0.8263, test_f1: 0.5932
 epoch: 70, train_loss: 0.7514, test_loss: 0.7384, test_f1: 0.5893
 epoch: 71, train_loss: 0.7257, test_loss: 0.8308, test_f1: 0.5899
 epoch: 72, train_loss: 0.7209, test_loss: 0.8007, test_f1: 0.6047
 epoch: 73, train_loss: 0.7313, test_loss: 0.8139, test_f1: 0.5964
 epoch: 74, train_loss: 0.7208, test_loss: 0.8130, test_f1: 0.6365
 epoch: 75, train_loss: 0.7197, test_loss: 0.8038, test_f1: 0.5902
 epoch: 76, train_loss: 0.7095, test_loss: 0.8001, test_f1: 0.6150
 epoch: 77, train_loss: 0.7153, test_loss: 0.8657, test_f1: 0.6015
 epoch: 78, train_loss: 0.7205, test_loss: 0.8372, test_f1: 0.6174
 epoch: 79, train_loss: 0.7142, test_loss: 0.7923, test_f1: 0.6088
 epoch: 80, train_loss: 0.7061, test_loss: 0.7682, test_f1: 0.6216
 epoch: 81, train_loss: 0.7283, test_loss: 0.7766, test_f1: 0.6078
 epoch: 82, train_loss: 0.7162, test_loss: 0.8254, test_f1: 0.6063
 epoch: 83, train_loss: 0.7148, test_loss: 0.7678, test_f1: 0.6295
 epoch: 84, train_loss: 0.7214, test_loss: 0.7968, test_f1: 0.6483
 epoch: 85, train_loss: 0.7142, test_loss: 0.8004, test_f1: 0.6243
 epoch: 86, train_loss: 0.6971, test_loss: 0.7957, test_f1: 0.6510
 epoch: 87, train_loss: 0.7053, test_loss: 0.7689, test_f1: 0.6498
 epoch: 88, train_loss: 0.6930, test_loss: 0.8540, test_f1: 0.6116
 epoch: 89, train_loss: 0.6803, test_loss: 0.8939, test_f1: 0.6112
 epoch: 90, train_loss: 0.7012, test_loss: 0.8136, test_f1: 0.6452
 epoch: 91, train_loss: 0.7078, test_loss: 0.7691, test_f1: 0.6368
 epoch: 92, train_loss: 0.7066, test_loss: 0.7623, test_f1: 0.6393
 epoch: 93, train_loss: 0.6978, test_loss: 0.7442, test_f1: 0.6544
 epoch: 94, train_loss: 0.6972, test_loss: 0.8677, test_f1: 0.6237
 epoch: 95, train_loss: 0.7076, test_loss: 0.8431, test_f1: 0.6090
 epoch: 96, train_loss: 0.7081, test_loss: 0.7646, test_f1: 0.6659
 epoch: 97, train_loss: 0.6897, test_loss: 0.8214, test_f1: 0.6495
 epoch: 98, train_loss: 0.6842, test_loss: 0.8330, test_f1: 0.6638
 epoch: 99, train_loss: 0.6894, test_loss: 0.9492, test_f1: 0.5759
##################ITERATION #1 ****************************************
 epoch: 0, train_loss: 1.1146, test_loss: 1.0520, test_f1: 0.3410
 epoch: 1, train_loss: 1.0236, test_loss: 1.0381, test_f1: 0.4663
 epoch: 2, train_loss: 0.9941, test_loss: 1.0929, test_f1: 0.3983
 epoch: 3, train_loss: 0.9819, test_loss: 0.9837, test_f1: 0.4859
 epoch: 4, train_loss: 0.9683, test_loss: 1.0352, test_f1: 0.4450
 epoch: 5, train_loss: 0.9589, test_loss: 0.9515, test_f1: 0.4824
 epoch: 6, train_loss: 0.9554, test_loss: 1.0945, test_f1: 0.4063
 epoch: 7, train_loss: 0.9435, test_loss: 1.0324, test_f1: 0.4694
 epoch: 8, train_loss: 0.9486, test_loss: 0.9699, test_f1: 0.5123
 epoch: 9, train_loss: 0.9399, test_loss: 0.9532, test_f1: 0.4771
 epoch: 10, train_loss: 0.9481, test_loss: 1.0127, test_f1: 0.4707
 epoch: 11, train_loss: 0.9323, test_loss: 1.0002, test_f1: 0.4849
 epoch: 12, train_loss: 0.9408, test_loss: 0.9733, test_f1: 0.5659
 epoch: 13, train_loss: 0.9042, test_loss: 1.0047, test_f1: 0.5134
 epoch: 14, train_loss: 0.9053, test_loss: 0.9618, test_f1: 0.4944
 epoch: 15, train_loss: 0.9239, test_loss: 0.9372, test_f1: 0.5532
 epoch: 16, train_loss: 0.8930, test_loss: 1.0724, test_f1: 0.4964
 epoch: 17, train_loss: 0.8942, test_loss: 1.0612, test_f1: 0.4814
 epoch: 18, train_loss: 0.9012, test_loss: 1.1752, test_f1: 0.5387
 epoch: 19, train_loss: 0.8849, test_loss: 0.8844, test_f1: 0.5200
 epoch: 20, train_loss: 0.8844, test_loss: 0.8972, test_f1: 0.5581
 epoch: 21, train_loss: 0.8646, test_loss: 1.0103, test_f1: 0.5009
 epoch: 22, train_loss: 0.8741, test_loss: 1.0100, test_f1: 0.5602
 epoch: 23, train_loss: 0.8654, test_loss: 0.8515, test_f1: 0.5321
 epoch: 24, train_loss: 0.8612, test_loss: 0.9372, test_f1: 0.5305
 epoch: 25, train_loss: 0.8578, test_loss: 0.8369, test_f1: 0.5730
 epoch: 26, train_loss: 0.8582, test_loss: 1.0264, test_f1: 0.5109
 epoch: 27, train_loss: 0.8640, test_loss: 0.9048, test_f1: 0.5448
 epoch: 28, train_loss: 0.8448, test_loss: 0.9149, test_f1: 0.5249
 epoch: 29, train_loss: 0.8535, test_loss: 0.9831, test_f1: 0.5464
 epoch: 30, train_loss: 0.8496, test_loss: 0.9953, test_f1: 0.5295
 epoch: 31, train_loss: 0.8468, test_loss: 0.8496, test_f1: 0.5683
 epoch: 32, train_loss: 0.8321, test_loss: 0.8788, test_f1: 0.5666
 epoch: 33, train_loss: 0.8331, test_loss: 0.9533, test_f1: 0.5069
 epoch: 34, train_loss: 0.8390, test_loss: 0.8833, test_f1: 0.5288
 epoch: 35, train_loss: 0.8297, test_loss: 0.9556, test_f1: 0.5407
 epoch: 36, train_loss: 0.8447, test_loss: 0.9105, test_f1: 0.5471
 epoch: 37, train_loss: 0.8371, test_loss: 1.0312, test_f1: 0.5266
 epoch: 38, train_loss: 0.8396, test_loss: 0.9420, test_f1: 0.5747
 epoch: 39, train_loss: 0.8442, test_loss: 0.9098, test_f1: 0.5466
 epoch: 40, train_loss: 0.8338, test_loss: 0.9412, test_f1: 0.5333
 epoch: 41, train_loss: 0.8432, test_loss: 0.8704, test_f1: 0.5220
 epoch: 42, train_loss: 0.8330, test_loss: 0.8924, test_f1: 0.5669
 epoch: 43, train_loss: 0.8249, test_loss: 0.9315, test_f1: 0.5031
 epoch: 44, train_loss: 0.8157, test_loss: 0.8893, test_f1: 0.5241
 epoch: 45, train_loss: 0.8361, test_loss: 0.8835, test_f1: 0.5445
 epoch: 46, train_loss: 0.8234, test_loss: 0.9822, test_f1: 0.5109
 epoch: 47, train_loss: 0.8007, test_loss: 0.7884, test_f1: 0.5811
 epoch: 48, train_loss: 0.8115, test_loss: 0.9562, test_f1: 0.6017
 epoch: 49, train_loss: 0.8182, test_loss: 0.9668, test_f1: 0.5836
 epoch: 50, train_loss: 0.7978, test_loss: 0.8358, test_f1: 0.5820
 epoch: 51, train_loss: 0.7830, test_loss: 0.9261, test_f1: 0.5721
 epoch: 52, train_loss: 0.7980, test_loss: 0.8854, test_f1: 0.5887
 epoch: 53, train_loss: 0.7658, test_loss: 0.9080, test_f1: 0.5930
 epoch: 54, train_loss: 0.7863, test_loss: 0.8632, test_f1: 0.5890
 epoch: 55, train_loss: 0.7742, test_loss: 0.8377, test_f1: 0.5717
 epoch: 56, train_loss: 0.7681, test_loss: 0.8944, test_f1: 0.5764
 epoch: 57, train_loss: 0.7733, test_loss: 0.9946, test_f1: 0.5597
 epoch: 58, train_loss: 0.7672, test_loss: 0.9381, test_f1: 0.5623
 epoch: 59, train_loss: 0.7628, test_loss: 0.9490, test_f1: 0.5574
 epoch: 60, train_loss: 0.7695, test_loss: 0.8799, test_f1: 0.5776
 epoch: 61, train_loss: 0.7665, test_loss: 0.8574, test_f1: 0.5820
 epoch: 62, train_loss: 0.7528, test_loss: 0.8184, test_f1: 0.5702
 epoch: 63, train_loss: 0.7674, test_loss: 0.8818, test_f1: 0.5692
 epoch: 64, train_loss: 0.7416, test_loss: 0.8705, test_f1: 0.5875
 epoch: 65, train_loss: 0.7368, test_loss: 0.8855, test_f1: 0.5657
 epoch: 66, train_loss: 0.7580, test_loss: 0.8925, test_f1: 0.5619
 epoch: 67, train_loss: 0.7498, test_loss: 0.9391, test_f1: 0.5526
 epoch: 68, train_loss: 0.7504, test_loss: 0.8308, test_f1: 0.5885
 epoch: 69, train_loss: 0.7551, test_loss: 0.7891, test_f1: 0.5917
 epoch: 70, train_loss: 0.7528, test_loss: 0.8842, test_f1: 0.5877
 epoch: 71, train_loss: 0.7645, test_loss: 0.9162, test_f1: 0.5828
 epoch: 72, train_loss: 0.7615, test_loss: 0.8701, test_f1: 0.6032
 epoch: 73, train_loss: 0.7492, test_loss: 0.7454, test_f1: 0.6094
 epoch: 74, train_loss: 0.7397, test_loss: 0.7949, test_f1: 0.6100
 epoch: 75, train_loss: 0.7345, test_loss: 0.9025, test_f1: 0.5723
 epoch: 76, train_loss: 0.7409, test_loss: 0.7921, test_f1: 0.5982
 epoch: 77, train_loss: 0.7506, test_loss: 0.9099, test_f1: 0.5763
 epoch: 78, train_loss: 0.7358, test_loss: 0.8615, test_f1: 0.5895
 epoch: 79, train_loss: 0.7305, test_loss: 0.7863, test_f1: 0.5933
 epoch: 80, train_loss: 0.7373, test_loss: 0.8686, test_f1: 0.5892
 epoch: 81, train_loss: 0.7386, test_loss: 0.8350, test_f1: 0.5937
 epoch: 82, train_loss: 0.7297, test_loss: 0.8809, test_f1: 0.5758
 epoch: 83, train_loss: 0.7369, test_loss: 0.8199, test_f1: 0.6077
 epoch: 84, train_loss: 0.7375, test_loss: 0.9350, test_f1: 0.5829
 epoch: 85, train_loss: 0.7408, test_loss: 0.8535, test_f1: 0.5869
 epoch: 86, train_loss: 0.7235, test_loss: 0.8453, test_f1: 0.5867
 epoch: 87, train_loss: 0.7266, test_loss: 0.8147, test_f1: 0.5956
 epoch: 88, train_loss: 0.7249, test_loss: 0.7676, test_f1: 0.6118
 epoch: 89, train_loss: 0.7296, test_loss: 0.8250, test_f1: 0.6003
 epoch: 90, train_loss: 0.7156, test_loss: 0.9123, test_f1: 0.5963
 epoch: 91, train_loss: 0.7133, test_loss: 0.8732, test_f1: 0.5930
 epoch: 92, train_loss: 0.7445, test_loss: 0.8681, test_f1: 0.6117
 epoch: 93, train_loss: 0.7312, test_loss: 0.7650, test_f1: 0.5884
 epoch: 94, train_loss: 0.7233, test_loss: 0.9262, test_f1: 0.5860
 epoch: 95, train_loss: 0.7166, test_loss: 0.8884, test_f1: 0.6030
 epoch: 96, train_loss: 0.7163, test_loss: 0.9366, test_f1: 0.5876
 epoch: 97, train_loss: 0.7314, test_loss: 0.8177, test_f1: 0.5941
 epoch: 98, train_loss: 0.7150, test_loss: 0.8775, test_f1: 0.6049
 epoch: 99, train_loss: 0.7203, test_loss: 0.9348, test_f1: 0.6015
##################ITERATION #2 ****************************************
 epoch: 0, train_loss: 1.1369, test_loss: 1.0605, test_f1: 0.3450
 epoch: 1, train_loss: 1.0442, test_loss: 1.0917, test_f1: 0.4254
 epoch: 2, train_loss: 1.0176, test_loss: 1.0694, test_f1: 0.4462
 epoch: 3, train_loss: 0.9911, test_loss: 0.9878, test_f1: 0.4326
 epoch: 4, train_loss: 0.9841, test_loss: 1.0411, test_f1: 0.4602
 epoch: 5, train_loss: 0.9750, test_loss: 1.0336, test_f1: 0.4744
 epoch: 6, train_loss: 0.9677, test_loss: 0.9743, test_f1: 0.4761
 epoch: 7, train_loss: 0.9642, test_loss: 1.0149, test_f1: 0.4912
 epoch: 8, train_loss: 0.9533, test_loss: 0.9317, test_f1: 0.4882
 epoch: 9, train_loss: 0.9334, test_loss: 1.0537, test_f1: 0.4642
 epoch: 10, train_loss: 0.9372, test_loss: 0.9475, test_f1: 0.4699
 epoch: 11, train_loss: 0.9288, test_loss: 1.0075, test_f1: 0.4614
 epoch: 12, train_loss: 0.9046, test_loss: 0.9168, test_f1: 0.4964
 epoch: 13, train_loss: 0.9010, test_loss: 1.0142, test_f1: 0.4858
 epoch: 14, train_loss: 0.9058, test_loss: 0.8862, test_f1: 0.5147
 epoch: 15, train_loss: 0.9015, test_loss: 0.8921, test_f1: 0.5480
 epoch: 16, train_loss: 0.8892, test_loss: 0.8984, test_f1: 0.5360
 epoch: 17, train_loss: 0.8857, test_loss: 0.9371, test_f1: 0.5481
 epoch: 18, train_loss: 0.8874, test_loss: 0.8594, test_f1: 0.5150
 epoch: 19, train_loss: 0.8788, test_loss: 0.9294, test_f1: 0.5039
 epoch: 20, train_loss: 0.8795, test_loss: 1.0071, test_f1: 0.4945
 epoch: 21, train_loss: 0.8688, test_loss: 0.8510, test_f1: 0.5119
 epoch: 22, train_loss: 0.8614, test_loss: 0.9713, test_f1: 0.5112
 epoch: 23, train_loss: 0.8722, test_loss: 0.9493, test_f1: 0.5182
 epoch: 24, train_loss: 0.8652, test_loss: 0.9108, test_f1: 0.5204
 epoch: 25, train_loss: 0.8534, test_loss: 0.9047, test_f1: 0.5272
 epoch: 26, train_loss: 0.8404, test_loss: 0.8555, test_f1: 0.5390
 epoch: 27, train_loss: 0.8501, test_loss: 0.9175, test_f1: 0.5011
 epoch: 28, train_loss: 0.8543, test_loss: 0.9537, test_f1: 0.5431
 epoch: 29, train_loss: 0.8586, test_loss: 0.9592, test_f1: 0.5243
 epoch: 30, train_loss: 0.8515, test_loss: 0.8884, test_f1: 0.5107
 epoch: 31, train_loss: 0.8480, test_loss: 0.9261, test_f1: 0.6081
 epoch: 32, train_loss: 0.8376, test_loss: 0.8500, test_f1: 0.5475
 epoch: 33, train_loss: 0.8500, test_loss: 0.8649, test_f1: 0.5347
 epoch: 34, train_loss: 0.8438, test_loss: 0.8667, test_f1: 0.5778
 epoch: 35, train_loss: 0.8346, test_loss: 0.9158, test_f1: 0.5658
 epoch: 36, train_loss: 0.8472, test_loss: 0.8458, test_f1: 0.5504
 epoch: 37, train_loss: 0.8308, test_loss: 0.8297, test_f1: 0.5984
 epoch: 38, train_loss: 0.8493, test_loss: 0.8789, test_f1: 0.5476
 epoch: 39, train_loss: 0.8387, test_loss: 0.8814, test_f1: 0.5701
 epoch: 40, train_loss: 0.8284, test_loss: 0.8011, test_f1: 0.5547
 epoch: 41, train_loss: 0.8269, test_loss: 0.8788, test_f1: 0.5466
 epoch: 42, train_loss: 0.8362, test_loss: 0.8567, test_f1: 0.5576
 epoch: 43, train_loss: 0.8288, test_loss: 0.8513, test_f1: 0.5780
 epoch: 44, train_loss: 0.8277, test_loss: 0.8458, test_f1: 0.5367
 epoch: 45, train_loss: 0.8209, test_loss: 0.8655, test_f1: 0.5480
 epoch: 46, train_loss: 0.8195, test_loss: 0.8546, test_f1: 0.5374
 epoch: 47, train_loss: 0.8140, test_loss: 0.9442, test_f1: 0.5151
 epoch: 48, train_loss: 0.8187, test_loss: 0.8642, test_f1: 0.5536
 epoch: 49, train_loss: 0.8043, test_loss: 0.8678, test_f1: 0.5917
 epoch: 50, train_loss: 0.8349, test_loss: 0.8608, test_f1: 0.6057
 epoch: 51, train_loss: 0.8059, test_loss: 0.8132, test_f1: 0.5697
 epoch: 52, train_loss: 0.7889, test_loss: 0.8210, test_f1: 0.5810
 epoch: 53, train_loss: 0.7965, test_loss: 0.7943, test_f1: 0.5985
 epoch: 54, train_loss: 0.7930, test_loss: 0.7945, test_f1: 0.5784
 epoch: 55, train_loss: 0.7863, test_loss: 0.8158, test_f1: 0.5862
 epoch: 56, train_loss: 0.7830, test_loss: 0.8623, test_f1: 0.5715
 epoch: 57, train_loss: 0.7765, test_loss: 0.8331, test_f1: 0.5759
 epoch: 58, train_loss: 0.7874, test_loss: 0.8303, test_f1: 0.5913
 epoch: 59, train_loss: 0.7765, test_loss: 0.8245, test_f1: 0.5807
 epoch: 60, train_loss: 0.7822, test_loss: 0.7774, test_f1: 0.5823
 epoch: 61, train_loss: 0.7799, test_loss: 0.8119, test_f1: 0.5915
 epoch: 62, train_loss: 0.7737, test_loss: 0.7970, test_f1: 0.5943
 epoch: 63, train_loss: 0.7663, test_loss: 0.8127, test_f1: 0.5897
 epoch: 64, train_loss: 0.7465, test_loss: 0.8137, test_f1: 0.5843
 epoch: 65, train_loss: 0.7652, test_loss: 0.8366, test_f1: 0.5832
 epoch: 66, train_loss: 0.7718, test_loss: 0.8176, test_f1: 0.6061
 epoch: 67, train_loss: 0.7646, test_loss: 0.7880, test_f1: 0.5715
 epoch: 68, train_loss: 0.7680, test_loss: 0.8243, test_f1: 0.5826
 epoch: 69, train_loss: 0.7510, test_loss: 0.8048, test_f1: 0.6050
 epoch: 70, train_loss: 0.7557, test_loss: 0.7848, test_f1: 0.5751
 epoch: 71, train_loss: 0.7735, test_loss: 0.8120, test_f1: 0.5953
 epoch: 72, train_loss: 0.7709, test_loss: 0.7945, test_f1: 0.6229
 epoch: 73, train_loss: 0.7459, test_loss: 0.8300, test_f1: 0.5947
 epoch: 74, train_loss: 0.7567, test_loss: 0.8209, test_f1: 0.6032
 epoch: 75, train_loss: 0.7328, test_loss: 0.8161, test_f1: 0.5885
 epoch: 76, train_loss: 0.7548, test_loss: 0.7780, test_f1: 0.6054
 epoch: 77, train_loss: 0.7398, test_loss: 0.8253, test_f1: 0.5755
 epoch: 78, train_loss: 0.7619, test_loss: 0.8228, test_f1: 0.6096
 epoch: 79, train_loss: 0.7520, test_loss: 0.8394, test_f1: 0.5836
 epoch: 80, train_loss: 0.7410, test_loss: 0.8320, test_f1: 0.5985
 epoch: 81, train_loss: 0.7589, test_loss: 0.8281, test_f1: 0.6529
 epoch: 82, train_loss: 0.7443, test_loss: 0.8511, test_f1: 0.5993
 epoch: 83, train_loss: 0.7645, test_loss: 0.8111, test_f1: 0.5792
 epoch: 84, train_loss: 0.7450, test_loss: 0.8590, test_f1: 0.6099
 epoch: 85, train_loss: 0.7385, test_loss: 0.8284, test_f1: 0.6063
 epoch: 86, train_loss: 0.7284, test_loss: 0.8696, test_f1: 0.5808
 epoch: 87, train_loss: 0.7546, test_loss: 0.8176, test_f1: 0.5895
 epoch: 88, train_loss: 0.7418, test_loss: 0.7814, test_f1: 0.5969
 epoch: 89, train_loss: 0.7504, test_loss: 0.8248, test_f1: 0.5981
 epoch: 90, train_loss: 0.7468, test_loss: 0.7903, test_f1: 0.5896
 epoch: 91, train_loss: 0.7354, test_loss: 0.8183, test_f1: 0.6027
 epoch: 92, train_loss: 0.7386, test_loss: 0.8496, test_f1: 0.6201
 epoch: 93, train_loss: 0.7412, test_loss: 0.8985, test_f1: 0.5867
 epoch: 94, train_loss: 0.7482, test_loss: 0.8611, test_f1: 0.6200
 epoch: 95, train_loss: 0.7486, test_loss: 0.8260, test_f1: 0.5899
 epoch: 96, train_loss: 0.7425, test_loss: 0.8425, test_f1: 0.6187
 epoch: 97, train_loss: 0.7406, test_loss: 0.8303, test_f1: 0.6382
 epoch: 98, train_loss: 0.7325, test_loss: 0.8670, test_f1: 0.6036
 epoch: 99, train_loss: 0.7401, test_loss: 0.7863, test_f1: 0.6520
##################ITERATION #3 ****************************************
 epoch: 0, train_loss: 1.1960, test_loss: 1.1231, test_f1: 0.4409
 epoch: 1, train_loss: 1.0315, test_loss: 0.9861, test_f1: 0.4997
 epoch: 2, train_loss: 1.0073, test_loss: 1.1131, test_f1: 0.4102
 epoch: 3, train_loss: 1.0125, test_loss: 1.0924, test_f1: 0.4625
 epoch: 4, train_loss: 0.9759, test_loss: 0.9656, test_f1: 0.5029
 epoch: 5, train_loss: 0.9751, test_loss: 1.0111, test_f1: 0.4737
 epoch: 6, train_loss: 0.9586, test_loss: 0.9772, test_f1: 0.5111
 epoch: 7, train_loss: 0.9532, test_loss: 1.0038, test_f1: 0.4824
 epoch: 8, train_loss: 0.9412, test_loss: 1.0287, test_f1: 0.5163
 epoch: 9, train_loss: 0.9714, test_loss: 0.9385, test_f1: 0.4941
 epoch: 10, train_loss: 0.9516, test_loss: 1.0787, test_f1: 0.3942
 epoch: 11, train_loss: 0.9521, test_loss: 1.0283, test_f1: 0.4817
 epoch: 12, train_loss: 0.9480, test_loss: 0.9418, test_f1: 0.5145
 epoch: 13, train_loss: 0.9332, test_loss: 0.9522, test_f1: 0.4978
 epoch: 14, train_loss: 0.9282, test_loss: 0.9671, test_f1: 0.4858
 epoch: 15, train_loss: 0.9149, test_loss: 0.9898, test_f1: 0.5166
 epoch: 16, train_loss: 0.9169, test_loss: 0.9283, test_f1: 0.5420
 epoch: 17, train_loss: 0.9136, test_loss: 0.9402, test_f1: 0.5463
 epoch: 18, train_loss: 0.9173, test_loss: 0.9828, test_f1: 0.4820
 epoch: 19, train_loss: 0.9154, test_loss: 0.9541, test_f1: 0.5569
 epoch: 20, train_loss: 0.9217, test_loss: 0.9679, test_f1: 0.4960
 epoch: 21, train_loss: 0.9085, test_loss: 0.9409, test_f1: 0.5130
 epoch: 22, train_loss: 0.9056, test_loss: 0.9170, test_f1: 0.5240
 epoch: 23, train_loss: 0.9134, test_loss: 0.9323, test_f1: 0.5380
 epoch: 24, train_loss: 0.8944, test_loss: 0.9457, test_f1: 0.5243
 epoch: 25, train_loss: 0.8876, test_loss: 0.9452, test_f1: 0.5368
 epoch: 26, train_loss: 0.8717, test_loss: 1.0586, test_f1: 0.5104
 epoch: 27, train_loss: 0.8935, test_loss: 0.9376, test_f1: 0.4794
 epoch: 28, train_loss: 0.8955, test_loss: 0.9824, test_f1: 0.4978
 epoch: 29, train_loss: 0.8959, test_loss: 0.9079, test_f1: 0.5312
 epoch: 30, train_loss: 0.8870, test_loss: 1.0615, test_f1: 0.3684
 epoch: 31, train_loss: 0.9542, test_loss: 0.9499, test_f1: 0.5369
 epoch: 32, train_loss: 0.8988, test_loss: 0.9270, test_f1: 0.5080
 epoch: 33, train_loss: 0.8823, test_loss: 0.8798, test_f1: 0.5159
 epoch: 34, train_loss: 0.8773, test_loss: 1.0237, test_f1: 0.4442
 epoch: 35, train_loss: 0.8792, test_loss: 0.9545, test_f1: 0.5158
 epoch: 36, train_loss: 0.8892, test_loss: 1.0287, test_f1: 0.4796
 epoch: 37, train_loss: 1.0064, test_loss: 1.0363, test_f1: 0.4577
 epoch: 38, train_loss: 0.9435, test_loss: 0.9280, test_f1: 0.5314
 epoch: 39, train_loss: 0.9087, test_loss: 0.9606, test_f1: 0.5599
 epoch: 40, train_loss: 0.9373, test_loss: 0.8755, test_f1: 0.5195
 epoch: 41, train_loss: 0.8816, test_loss: 0.8844, test_f1: 0.5955
 epoch: 42, train_loss: 0.8695, test_loss: 0.9398, test_f1: 0.5469
 epoch: 43, train_loss: 0.8913, test_loss: 1.0255, test_f1: 0.4930
 epoch: 44, train_loss: 0.8884, test_loss: 0.8780, test_f1: 0.5888
 epoch: 45, train_loss: 0.8606, test_loss: 0.9259, test_f1: 0.5342
 epoch: 46, train_loss: 0.8672, test_loss: 0.9082, test_f1: 0.5763
 epoch: 47, train_loss: 0.8716, test_loss: 0.9174, test_f1: 0.5695
 epoch: 48, train_loss: 0.8481, test_loss: 0.8797, test_f1: 0.5635
 epoch: 49, train_loss: 0.8518, test_loss: 0.9215, test_f1: 0.5480
 epoch: 50, train_loss: 0.8532, test_loss: 0.9573, test_f1: 0.5555
 epoch: 51, train_loss: 0.8369, test_loss: 0.9312, test_f1: 0.6087
 epoch: 52, train_loss: 0.8220, test_loss: 0.8792, test_f1: 0.6170
 epoch: 53, train_loss: 0.8242, test_loss: 0.8461, test_f1: 0.6084
 epoch: 54, train_loss: 0.8279, test_loss: 0.8462, test_f1: 0.5895
 epoch: 55, train_loss: 0.8147, test_loss: 0.8578, test_f1: 0.5975
 epoch: 56, train_loss: 0.8255, test_loss: 0.8621, test_f1: 0.5987
 epoch: 57, train_loss: 0.8123, test_loss: 0.8634, test_f1: 0.6068
 epoch: 58, train_loss: 0.8025, test_loss: 0.8714, test_f1: 0.5913
 epoch: 59, train_loss: 0.8220, test_loss: 0.8333, test_f1: 0.6362
 epoch: 60, train_loss: 0.8028, test_loss: 0.8804, test_f1: 0.5970
 epoch: 61, train_loss: 0.8020, test_loss: 0.8547, test_f1: 0.5808
 epoch: 62, train_loss: 0.7970, test_loss: 0.8554, test_f1: 0.6038
 epoch: 63, train_loss: 0.8041, test_loss: 0.8533, test_f1: 0.5935
 epoch: 64, train_loss: 0.7998, test_loss: 0.8555, test_f1: 0.5921
 epoch: 65, train_loss: 0.7958, test_loss: 0.8425, test_f1: 0.6136
 epoch: 66, train_loss: 0.7943, test_loss: 0.8542, test_f1: 0.5974
 epoch: 67, train_loss: 0.7908, test_loss: 0.8217, test_f1: 0.6215
 epoch: 68, train_loss: 0.7952, test_loss: 0.8373, test_f1: 0.6263
 epoch: 69, train_loss: 0.7982, test_loss: 0.8393, test_f1: 0.5857
 epoch: 70, train_loss: 0.7897, test_loss: 0.8088, test_f1: 0.6098
 epoch: 71, train_loss: 0.7805, test_loss: 0.8821, test_f1: 0.5773
 epoch: 72, train_loss: 0.7975, test_loss: 0.8396, test_f1: 0.6075
 epoch: 73, train_loss: 0.7789, test_loss: 0.8676, test_f1: 0.5980
 epoch: 74, train_loss: 0.7832, test_loss: 0.8495, test_f1: 0.6348
 epoch: 75, train_loss: 0.7724, test_loss: 0.8837, test_f1: 0.5952
 epoch: 76, train_loss: 0.7965, test_loss: 0.8699, test_f1: 0.6003
 epoch: 77, train_loss: 0.7757, test_loss: 0.8490, test_f1: 0.5800
 epoch: 78, train_loss: 0.7941, test_loss: 0.8720, test_f1: 0.5879
 epoch: 79, train_loss: 0.7965, test_loss: 0.8279, test_f1: 0.6439
 epoch: 80, train_loss: 0.8040, test_loss: 0.8537, test_f1: 0.5987
 epoch: 81, train_loss: 0.7969, test_loss: 0.8764, test_f1: 0.5684
 epoch: 82, train_loss: 0.7915, test_loss: 0.8427, test_f1: 0.6223
 epoch: 83, train_loss: 0.7854, test_loss: 0.8034, test_f1: 0.6415
 epoch: 84, train_loss: 0.7810, test_loss: 0.8890, test_f1: 0.5730
 epoch: 85, train_loss: 0.7847, test_loss: 0.8255, test_f1: 0.6252
 epoch: 86, train_loss: 0.7787, test_loss: 0.8657, test_f1: 0.6155
 epoch: 87, train_loss: 0.7925, test_loss: 0.8512, test_f1: 0.6483
 epoch: 88, train_loss: 0.7875, test_loss: 0.8612, test_f1: 0.5838
 epoch: 89, train_loss: 0.7753, test_loss: 0.8267, test_f1: 0.6040
 epoch: 90, train_loss: 0.7823, test_loss: 0.8115, test_f1: 0.6375
 epoch: 91, train_loss: 0.7716, test_loss: 0.8377, test_f1: 0.6329
 epoch: 92, train_loss: 0.7721, test_loss: 0.8320, test_f1: 0.5977
 epoch: 93, train_loss: 0.7643, test_loss: 0.8639, test_f1: 0.6103
 epoch: 94, train_loss: 0.7631, test_loss: 0.9238, test_f1: 0.6110
 epoch: 95, train_loss: 0.7643, test_loss: 0.8218, test_f1: 0.6165
 epoch: 96, train_loss: 0.7758, test_loss: 0.8229, test_f1: 0.5924
 epoch: 97, train_loss: 0.8055, test_loss: 1.6454, test_f1: 0.4403
 epoch: 98, train_loss: 0.8504, test_loss: 0.8628, test_f1: 0.5743
 epoch: 99, train_loss: 0.8153, test_loss: 0.8101, test_f1: 0.6295
##################ITERATION #4 ****************************************
 epoch: 0, train_loss: 1.1465, test_loss: 1.0816, test_f1: 0.4571
 epoch: 1, train_loss: 1.0268, test_loss: 0.9875, test_f1: 0.4755
 epoch: 2, train_loss: 0.9930, test_loss: 0.9772, test_f1: 0.4859
 epoch: 3, train_loss: 0.9768, test_loss: 0.9641, test_f1: 0.5012
 epoch: 4, train_loss: 0.9730, test_loss: 0.9666, test_f1: 0.4899
 epoch: 5, train_loss: 0.9747, test_loss: 0.9635, test_f1: 0.4380
 epoch: 6, train_loss: 0.9494, test_loss: 0.9760, test_f1: 0.5450
 epoch: 7, train_loss: 0.9497, test_loss: 0.8965, test_f1: 0.5301
 epoch: 8, train_loss: 0.9418, test_loss: 0.8827, test_f1: 0.5293
 epoch: 9, train_loss: 0.9307, test_loss: 0.8552, test_f1: 0.5081
 epoch: 10, train_loss: 0.9187, test_loss: 0.9002, test_f1: 0.4940
 epoch: 11, train_loss: 0.9336, test_loss: 0.9482, test_f1: 0.4614
 epoch: 12, train_loss: 0.9211, test_loss: 0.9748, test_f1: 0.4618
 epoch: 13, train_loss: 0.9092, test_loss: 1.3772, test_f1: 0.3823
 epoch: 14, train_loss: 0.9126, test_loss: 0.8665, test_f1: 0.5683
 epoch: 15, train_loss: 0.9314, test_loss: 1.3886, test_f1: 0.3412
 epoch: 16, train_loss: 0.9039, test_loss: 0.9609, test_f1: 0.4807
 epoch: 17, train_loss: 0.8920, test_loss: 1.0068, test_f1: 0.4931
 epoch: 18, train_loss: 0.8849, test_loss: 1.0214, test_f1: 0.4828
 epoch: 19, train_loss: 0.8754, test_loss: 0.9005, test_f1: 0.4988
 epoch: 20, train_loss: 0.8706, test_loss: 0.9025, test_f1: 0.5366
 epoch: 21, train_loss: 0.8738, test_loss: 0.9430, test_f1: 0.5178
 epoch: 22, train_loss: 0.8681, test_loss: 0.8587, test_f1: 0.5140
 epoch: 23, train_loss: 0.8439, test_loss: 0.8216, test_f1: 0.5297
 epoch: 24, train_loss: 0.8492, test_loss: 0.8509, test_f1: 0.5544
 epoch: 25, train_loss: 0.8321, test_loss: 0.8701, test_f1: 0.5477
 epoch: 26, train_loss: 0.8550, test_loss: 0.8993, test_f1: 0.5281
 epoch: 27, train_loss: 0.8395, test_loss: 1.1221, test_f1: 0.4791
 epoch: 28, train_loss: 0.8737, test_loss: 0.9140, test_f1: 0.5144
 epoch: 29, train_loss: 0.8475, test_loss: 0.9433, test_f1: 0.5331
 epoch: 30, train_loss: 0.8305, test_loss: 0.8882, test_f1: 0.5246
 epoch: 31, train_loss: 0.8262, test_loss: 0.9331, test_f1: 0.5151
 epoch: 32, train_loss: 0.8427, test_loss: 0.9387, test_f1: 0.5756
 epoch: 33, train_loss: 0.8362, test_loss: 0.8555, test_f1: 0.5857
 epoch: 34, train_loss: 0.8285, test_loss: 0.9373, test_f1: 0.5575
 epoch: 35, train_loss: 0.8202, test_loss: 0.9357, test_f1: 0.5400
 epoch: 36, train_loss: 0.8252, test_loss: 0.9485, test_f1: 0.5236
 epoch: 37, train_loss: 0.8173, test_loss: 0.9018, test_f1: 0.5446
 epoch: 38, train_loss: 0.8201, test_loss: 0.9162, test_f1: 0.5221
 epoch: 39, train_loss: 0.8255, test_loss: 0.8639, test_f1: 0.5675
 epoch: 40, train_loss: 0.8266, test_loss: 0.8517, test_f1: 0.5649
 epoch: 41, train_loss: 0.8265, test_loss: 0.8909, test_f1: 0.5089
 epoch: 42, train_loss: 0.8048, test_loss: 0.8430, test_f1: 0.5398
 epoch: 43, train_loss: 0.8289, test_loss: 0.8933, test_f1: 0.5076
 epoch: 44, train_loss: 0.8071, test_loss: 0.8724, test_f1: 0.5371
 epoch: 45, train_loss: 0.8028, test_loss: 0.8735, test_f1: 0.5211
 epoch: 46, train_loss: 0.7925, test_loss: 0.9244, test_f1: 0.5202
 epoch: 47, train_loss: 0.8130, test_loss: 1.1663, test_f1: 0.4618
 epoch: 48, train_loss: 0.7906, test_loss: 0.8572, test_f1: 0.5492
 epoch: 49, train_loss: 0.7987, test_loss: 0.9994, test_f1: 0.5072
 epoch: 50, train_loss: 0.8029, test_loss: 1.1624, test_f1: 0.5236
 epoch: 51, train_loss: 0.7747, test_loss: 0.8700, test_f1: 0.5729
 epoch: 52, train_loss: 0.7664, test_loss: 0.8755, test_f1: 0.5614
 epoch: 53, train_loss: 0.7523, test_loss: 0.9240, test_f1: 0.5344
 epoch: 54, train_loss: 0.7516, test_loss: 0.8996, test_f1: 0.5415
 epoch: 55, train_loss: 0.7419, test_loss: 0.8778, test_f1: 0.5561
 epoch: 56, train_loss: 0.7495, test_loss: 0.8791, test_f1: 0.5764
 epoch: 57, train_loss: 0.7520, test_loss: 0.9543, test_f1: 0.5363
 epoch: 58, train_loss: 0.7399, test_loss: 0.8742, test_f1: 0.5554
 epoch: 59, train_loss: 0.7426, test_loss: 0.8692, test_f1: 0.5561
 epoch: 60, train_loss: 0.7315, test_loss: 0.8780, test_f1: 0.5754
 epoch: 61, train_loss: 0.7358, test_loss: 0.8891, test_f1: 0.5734
 epoch: 62, train_loss: 0.7364, test_loss: 0.9148, test_f1: 0.5899
 epoch: 63, train_loss: 0.7379, test_loss: 0.9495, test_f1: 0.5424
 epoch: 64, train_loss: 0.7320, test_loss: 0.8502, test_f1: 0.5972
 epoch: 65, train_loss: 0.7209, test_loss: 0.8909, test_f1: 0.5631
 epoch: 66, train_loss: 0.7230, test_loss: 0.8492, test_f1: 0.5929
 epoch: 67, train_loss: 0.7229, test_loss: 0.8577, test_f1: 0.6022
 epoch: 68, train_loss: 0.7394, test_loss: 0.8881, test_f1: 0.5636
 epoch: 69, train_loss: 0.7309, test_loss: 0.8392, test_f1: 0.5778
 epoch: 70, train_loss: 0.7289, test_loss: 0.8741, test_f1: 0.5587
 epoch: 71, train_loss: 0.7113, test_loss: 0.8483, test_f1: 0.6314
 epoch: 72, train_loss: 0.7258, test_loss: 1.0226, test_f1: 0.5602
 epoch: 73, train_loss: 0.7070, test_loss: 0.8416, test_f1: 0.5949
 epoch: 74, train_loss: 0.7447, test_loss: 0.8216, test_f1: 0.6231
 epoch: 75, train_loss: 0.7333, test_loss: 0.9183, test_f1: 0.5791
 epoch: 76, train_loss: 0.7056, test_loss: 0.8339, test_f1: 0.6277
 epoch: 77, train_loss: 0.7079, test_loss: 0.8793, test_f1: 0.5752
 epoch: 78, train_loss: 0.7240, test_loss: 0.9213, test_f1: 0.5750
 epoch: 79, train_loss: 0.7149, test_loss: 0.8515, test_f1: 0.6041
 epoch: 80, train_loss: 0.7060, test_loss: 0.8302, test_f1: 0.6162
 epoch: 81, train_loss: 0.7206, test_loss: 0.8644, test_f1: 0.6020
 epoch: 82, train_loss: 0.7162, test_loss: 0.8274, test_f1: 0.5966
 epoch: 83, train_loss: 0.7181, test_loss: 0.9580, test_f1: 0.5826
 epoch: 84, train_loss: 0.7068, test_loss: 0.8778, test_f1: 0.6224
 epoch: 85, train_loss: 0.6964, test_loss: 0.8507, test_f1: 0.6063
 epoch: 86, train_loss: 0.7102, test_loss: 0.9307, test_f1: 0.5700
 epoch: 87, train_loss: 0.7195, test_loss: 0.8575, test_f1: 0.6304
 epoch: 88, train_loss: 0.6935, test_loss: 0.9597, test_f1: 0.5684
 epoch: 89, train_loss: 0.7056, test_loss: 0.8826, test_f1: 0.6206
 epoch: 90, train_loss: 0.7031, test_loss: 0.8607, test_f1: 0.5968
 epoch: 91, train_loss: 0.7037, test_loss: 0.8669, test_f1: 0.6225
 epoch: 92, train_loss: 0.6898, test_loss: 0.9373, test_f1: 0.5946
 epoch: 93, train_loss: 0.7130, test_loss: 0.8600, test_f1: 0.6074
 epoch: 94, train_loss: 0.7037, test_loss: 0.8389, test_f1: 0.6328
 epoch: 95, train_loss: 0.6875, test_loss: 0.9104, test_f1: 0.6044
 epoch: 96, train_loss: 0.6984, test_loss: 0.9000, test_f1: 0.6093
 epoch: 97, train_loss: 0.6994, test_loss: 0.9178, test_f1: 0.5978
 epoch: 98, train_loss: 0.6957, test_loss: 0.8448, test_f1: 0.6368
 epoch: 99, train_loss: 0.6947, test_loss: 0.8673, test_f1: 0.6427
##################ITERATION #5 ****************************************
 epoch: 0, train_loss: 1.1298, test_loss: 1.2443, test_f1: 0.3127
 epoch: 1, train_loss: 1.0168, test_loss: 1.0193, test_f1: 0.4904
 epoch: 2, train_loss: 0.9954, test_loss: 0.9896, test_f1: 0.4576
 epoch: 3, train_loss: 0.9869, test_loss: 1.0823, test_f1: 0.4968
 epoch: 4, train_loss: 1.0099, test_loss: 1.0545, test_f1: 0.4359
 epoch: 5, train_loss: 1.0067, test_loss: 0.9959, test_f1: 0.4093
 epoch: 6, train_loss: 0.9807, test_loss: 1.0198, test_f1: 0.4633
 epoch: 7, train_loss: 0.9569, test_loss: 1.0011, test_f1: 0.4927
 epoch: 8, train_loss: 0.9570, test_loss: 0.9633, test_f1: 0.4809
 epoch: 9, train_loss: 0.9399, test_loss: 0.8901, test_f1: 0.5008
 epoch: 10, train_loss: 0.9381, test_loss: 0.9737, test_f1: 0.4997
 epoch: 11, train_loss: 0.9130, test_loss: 1.0785, test_f1: 0.4254
 epoch: 12, train_loss: 0.9207, test_loss: 0.9860, test_f1: 0.4932
 epoch: 13, train_loss: 0.9081, test_loss: 0.9878, test_f1: 0.4895
 epoch: 14, train_loss: 0.8977, test_loss: 0.8426, test_f1: 0.5102
 epoch: 15, train_loss: 0.8801, test_loss: 0.9354, test_f1: 0.4977
 epoch: 16, train_loss: 0.8900, test_loss: 0.8945, test_f1: 0.5376
 epoch: 17, train_loss: 0.8727, test_loss: 0.8706, test_f1: 0.5680
 epoch: 18, train_loss: 0.8974, test_loss: 0.9681, test_f1: 0.5294
 epoch: 19, train_loss: 0.8829, test_loss: 0.9342, test_f1: 0.5037
 epoch: 20, train_loss: 0.8655, test_loss: 0.9286, test_f1: 0.4885
 epoch: 21, train_loss: 0.8519, test_loss: 1.0118, test_f1: 0.5153
 epoch: 22, train_loss: 0.8726, test_loss: 0.9079, test_f1: 0.5289
 epoch: 23, train_loss: 0.8885, test_loss: 0.9003, test_f1: 0.5136
 epoch: 24, train_loss: 0.8717, test_loss: 0.8974, test_f1: 0.5173
 epoch: 25, train_loss: 0.8764, test_loss: 0.8720, test_f1: 0.5293
 epoch: 26, train_loss: 0.8630, test_loss: 0.8623, test_f1: 0.5267
 epoch: 27, train_loss: 0.8471, test_loss: 0.9035, test_f1: 0.5183
 epoch: 28, train_loss: 0.8442, test_loss: 0.9337, test_f1: 0.4962
 epoch: 29, train_loss: 0.8430, test_loss: 0.8191, test_f1: 0.5341
 epoch: 30, train_loss: 0.8468, test_loss: 0.8437, test_f1: 0.5598
 epoch: 31, train_loss: 0.8382, test_loss: 0.8786, test_f1: 0.5638
 epoch: 32, train_loss: 0.8462, test_loss: 0.8078, test_f1: 0.5559
 epoch: 33, train_loss: 0.8445, test_loss: 0.8631, test_f1: 0.5233
 epoch: 34, train_loss: 0.8290, test_loss: 0.9319, test_f1: 0.5595
 epoch: 35, train_loss: 0.8444, test_loss: 0.8584, test_f1: 0.5456
 epoch: 36, train_loss: 0.8235, test_loss: 0.9138, test_f1: 0.5377
 epoch: 37, train_loss: 0.8302, test_loss: 0.8306, test_f1: 0.5184
 epoch: 38, train_loss: 0.8303, test_loss: 0.8641, test_f1: 0.5477
 epoch: 39, train_loss: 0.8062, test_loss: 0.8392, test_f1: 0.5595
 epoch: 40, train_loss: 0.8218, test_loss: 2.0100, test_f1: 0.3691
 epoch: 41, train_loss: 0.8368, test_loss: 0.8430, test_f1: 0.5600
 epoch: 42, train_loss: 0.8226, test_loss: 1.0056, test_f1: 0.5035
 epoch: 43, train_loss: 0.8065, test_loss: 0.8613, test_f1: 0.5413
 epoch: 44, train_loss: 0.8136, test_loss: 0.9307, test_f1: 0.5092
 epoch: 45, train_loss: 0.8086, test_loss: 0.8347, test_f1: 0.5321
 epoch: 46, train_loss: 0.8019, test_loss: 0.8820, test_f1: 0.5398
 epoch: 47, train_loss: 0.7895, test_loss: 0.8767, test_f1: 0.5657
 epoch: 48, train_loss: 0.8015, test_loss: 0.8277, test_f1: 0.5575
 epoch: 49, train_loss: 0.7985, test_loss: 0.8212, test_f1: 0.5629
 epoch: 50, train_loss: 0.7979, test_loss: 0.8599, test_f1: 0.5572
 epoch: 51, train_loss: 0.7770, test_loss: 0.8248, test_f1: 0.5649
 epoch: 52, train_loss: 0.7759, test_loss: 0.8107, test_f1: 0.5635
 epoch: 53, train_loss: 0.7513, test_loss: 0.8392, test_f1: 0.5501
 epoch: 54, train_loss: 0.7689, test_loss: 0.8509, test_f1: 0.5845
 epoch: 55, train_loss: 0.7616, test_loss: 0.8454, test_f1: 0.5857
 epoch: 56, train_loss: 0.7641, test_loss: 0.8280, test_f1: 0.5553
 epoch: 57, train_loss: 0.7563, test_loss: 0.8492, test_f1: 0.5578
 epoch: 58, train_loss: 0.7537, test_loss: 0.8335, test_f1: 0.5902
 epoch: 59, train_loss: 0.7550, test_loss: 0.8214, test_f1: 0.5720
 epoch: 60, train_loss: 0.7577, test_loss: 0.8116, test_f1: 0.5588
 epoch: 61, train_loss: 0.7611, test_loss: 0.8563, test_f1: 0.5653
 epoch: 62, train_loss: 0.7604, test_loss: 0.8588, test_f1: 0.5849
 epoch: 63, train_loss: 0.7410, test_loss: 0.9309, test_f1: 0.5326
 epoch: 64, train_loss: 0.7523, test_loss: 0.8360, test_f1: 0.6160
 epoch: 65, train_loss: 0.7444, test_loss: 0.8620, test_f1: 0.5756
 epoch: 66, train_loss: 0.7426, test_loss: 0.8271, test_f1: 0.5732
 epoch: 67, train_loss: 0.7443, test_loss: 0.8444, test_f1: 0.5860
 epoch: 68, train_loss: 0.7432, test_loss: 0.8176, test_f1: 0.5845
 epoch: 69, train_loss: 0.7422, test_loss: 0.8325, test_f1: 0.5648
 epoch: 70, train_loss: 0.7496, test_loss: 0.8024, test_f1: 0.5887
 epoch: 71, train_loss: 0.7480, test_loss: 0.8085, test_f1: 0.5798
 epoch: 72, train_loss: 0.7490, test_loss: 0.8038, test_f1: 0.5821
 epoch: 73, train_loss: 0.7236, test_loss: 0.8475, test_f1: 0.5566
 epoch: 74, train_loss: 0.7359, test_loss: 0.8713, test_f1: 0.5805
 epoch: 75, train_loss: 0.7485, test_loss: 0.8774, test_f1: 0.5644
 epoch: 76, train_loss: 0.7368, test_loss: 0.8089, test_f1: 0.6102
 epoch: 77, train_loss: 0.7349, test_loss: 0.8290, test_f1: 0.5984
 epoch: 78, train_loss: 0.7142, test_loss: 0.8573, test_f1: 0.5940
 epoch: 79, train_loss: 0.7288, test_loss: 0.8488, test_f1: 0.6307
 epoch: 80, train_loss: 0.7326, test_loss: 0.8430, test_f1: 0.5950
 epoch: 81, train_loss: 0.7304, test_loss: 0.8187, test_f1: 0.5967
 epoch: 82, train_loss: 0.7375, test_loss: 0.8338, test_f1: 0.6428
 epoch: 83, train_loss: 0.7314, test_loss: 0.8715, test_f1: 0.5950
 epoch: 84, train_loss: 0.7249, test_loss: 0.8016, test_f1: 0.6298
 epoch: 85, train_loss: 0.7340, test_loss: 0.8627, test_f1: 0.5863
 epoch: 86, train_loss: 0.7128, test_loss: 0.8334, test_f1: 0.6253
 epoch: 87, train_loss: 0.7105, test_loss: 0.9935, test_f1: 0.5764
 epoch: 88, train_loss: 0.7326, test_loss: 0.8314, test_f1: 0.6413
 epoch: 89, train_loss: 0.7301, test_loss: 0.9244, test_f1: 0.5795
 epoch: 90, train_loss: 0.7111, test_loss: 0.8717, test_f1: 0.6352
 epoch: 91, train_loss: 0.7146, test_loss: 0.8541, test_f1: 0.6250
 epoch: 92, train_loss: 0.7206, test_loss: 0.9167, test_f1: 0.5979
 epoch: 93, train_loss: 0.7072, test_loss: 0.8676, test_f1: 0.5896
 epoch: 94, train_loss: 0.7227, test_loss: 0.9026, test_f1: 0.6124
 epoch: 95, train_loss: 0.7091, test_loss: 0.8633, test_f1: 0.6143
 epoch: 96, train_loss: 0.7085, test_loss: 0.9266, test_f1: 0.6310
 epoch: 97, train_loss: 0.7305, test_loss: 0.8530, test_f1: 0.6009
 epoch: 98, train_loss: 0.7127, test_loss: 0.9486, test_f1: 0.5493
 epoch: 99, train_loss: 0.7236, test_loss: 0.8279, test_f1: 0.6293
##################ITERATION #6 ****************************************
 epoch: 0, train_loss: 1.1489, test_loss: 1.1063, test_f1: 0.4464
 epoch: 1, train_loss: 1.0225, test_loss: 1.0293, test_f1: 0.4839
 epoch: 2, train_loss: 0.9871, test_loss: 0.9919, test_f1: 0.4796
 epoch: 3, train_loss: 1.0092, test_loss: 1.0626, test_f1: 0.4840
 epoch: 4, train_loss: 0.9820, test_loss: 0.9981, test_f1: 0.4610
 epoch: 5, train_loss: 0.9839, test_loss: 1.0137, test_f1: 0.4546
 epoch: 6, train_loss: 0.9626, test_loss: 0.9942, test_f1: 0.4885
 epoch: 7, train_loss: 0.9494, test_loss: 1.0319, test_f1: 0.5116
 epoch: 8, train_loss: 0.9558, test_loss: 0.9473, test_f1: 0.4861
 epoch: 9, train_loss: 0.9315, test_loss: 1.0124, test_f1: 0.4593
 epoch: 10, train_loss: 0.9271, test_loss: 0.8855, test_f1: 0.5335
 epoch: 11, train_loss: 0.9703, test_loss: 0.9365, test_f1: 0.4460
 epoch: 12, train_loss: 0.9363, test_loss: 0.8694, test_f1: 0.4918
 epoch: 13, train_loss: 0.9134, test_loss: 0.9716, test_f1: 0.4914
 epoch: 14, train_loss: 0.9150, test_loss: 0.9517, test_f1: 0.4727
 epoch: 15, train_loss: 0.9187, test_loss: 0.9476, test_f1: 0.5246
 epoch: 16, train_loss: 0.9039, test_loss: 0.9201, test_f1: 0.5426
 epoch: 17, train_loss: 0.9079, test_loss: 0.9617, test_f1: 0.4965
 epoch: 18, train_loss: 0.8911, test_loss: 1.0117, test_f1: 0.4646
 epoch: 19, train_loss: 0.9075, test_loss: 0.8988, test_f1: 0.4954
 epoch: 20, train_loss: 0.8780, test_loss: 0.9216, test_f1: 0.5148
 epoch: 21, train_loss: 0.8712, test_loss: 0.8838, test_f1: 0.5006
 epoch: 22, train_loss: 0.8915, test_loss: 0.8942, test_f1: 0.5148
 epoch: 23, train_loss: 0.8889, test_loss: 0.9378, test_f1: 0.5069
 epoch: 24, train_loss: 0.8543, test_loss: 1.0225, test_f1: 0.5078
 epoch: 25, train_loss: 0.8672, test_loss: 0.9006, test_f1: 0.5259
 epoch: 26, train_loss: 0.8483, test_loss: 0.9230, test_f1: 0.5029
 epoch: 27, train_loss: 0.8726, test_loss: 0.8802, test_f1: 0.5437
 epoch: 28, train_loss: 0.8745, test_loss: 0.9376, test_f1: 0.4881
 epoch: 29, train_loss: 0.8749, test_loss: 0.9289, test_f1: 0.4957
 epoch: 30, train_loss: 0.8710, test_loss: 0.8655, test_f1: 0.5277
 epoch: 31, train_loss: 0.8484, test_loss: 0.9577, test_f1: 0.4987
 epoch: 32, train_loss: 0.8611, test_loss: 0.8622, test_f1: 0.5627
 epoch: 33, train_loss: 0.8514, test_loss: 0.8831, test_f1: 0.5209
 epoch: 34, train_loss: 0.8529, test_loss: 0.9070, test_f1: 0.5114
 epoch: 35, train_loss: 0.8475, test_loss: 0.9145, test_f1: 0.5134
 epoch: 36, train_loss: 0.8393, test_loss: 0.8744, test_f1: 0.5096
 epoch: 37, train_loss: 0.8456, test_loss: 0.9282, test_f1: 0.5402
 epoch: 38, train_loss: 0.9103, test_loss: 1.2212, test_f1: 0.4110
 epoch: 39, train_loss: 0.9472, test_loss: 1.0417, test_f1: 0.4554
 epoch: 40, train_loss: 0.9411, test_loss: 1.0996, test_f1: 0.4992
 epoch: 41, train_loss: 0.9498, test_loss: 1.0198, test_f1: 0.4445
 epoch: 42, train_loss: 0.9163, test_loss: 0.8960, test_f1: 0.5485
 epoch: 43, train_loss: 0.8794, test_loss: 0.9126, test_f1: 0.5631
 epoch: 44, train_loss: 0.8644, test_loss: 0.9091, test_f1: 0.5551
 epoch: 45, train_loss: 0.8591, test_loss: 0.9111, test_f1: 0.5469
 epoch: 46, train_loss: 0.8731, test_loss: 0.9261, test_f1: 0.5052
 epoch: 47, train_loss: 0.8421, test_loss: 0.8841, test_f1: 0.5437
 epoch: 48, train_loss: 0.8400, test_loss: 0.8569, test_f1: 0.5547
 epoch: 49, train_loss: 0.8470, test_loss: 0.8705, test_f1: 0.5797
 epoch: 50, train_loss: 0.9684, test_loss: 1.0410, test_f1: 0.4464
 epoch: 51, train_loss: 0.9133, test_loss: 0.8870, test_f1: 0.5650
 epoch: 52, train_loss: 0.8684, test_loss: 0.8675, test_f1: 0.5792
 epoch: 53, train_loss: 0.8478, test_loss: 0.8648, test_f1: 0.5612
 epoch: 54, train_loss: 0.8382, test_loss: 0.8490, test_f1: 0.5883
 epoch: 55, train_loss: 0.8264, test_loss: 0.8610, test_f1: 0.5784
 epoch: 56, train_loss: 0.8183, test_loss: 0.8482, test_f1: 0.6150
 epoch: 57, train_loss: 0.8128, test_loss: 0.8531, test_f1: 0.5995
 epoch: 58, train_loss: 0.8045, test_loss: 0.8585, test_f1: 0.5881
 epoch: 59, train_loss: 0.8076, test_loss: 0.8226, test_f1: 0.6196
 epoch: 60, train_loss: 0.8195, test_loss: 0.8680, test_f1: 0.5989
 epoch: 61, train_loss: 0.7988, test_loss: 0.8320, test_f1: 0.5832
 epoch: 62, train_loss: 0.7872, test_loss: 0.8584, test_f1: 0.5972
 epoch: 63, train_loss: 0.7849, test_loss: 0.8229, test_f1: 0.6366
 epoch: 64, train_loss: 0.7940, test_loss: 0.8484, test_f1: 0.5975
 epoch: 65, train_loss: 0.7956, test_loss: 0.8417, test_f1: 0.6195
 epoch: 66, train_loss: 0.7965, test_loss: 0.9201, test_f1: 0.5498
 epoch: 67, train_loss: 0.7979, test_loss: 0.8231, test_f1: 0.6538
 epoch: 68, train_loss: 0.7783, test_loss: 0.8239, test_f1: 0.6193
 epoch: 69, train_loss: 0.7898, test_loss: 0.7775, test_f1: 0.6290
 epoch: 70, train_loss: 0.7911, test_loss: 0.8075, test_f1: 0.6096
 epoch: 71, train_loss: 0.7693, test_loss: 0.8232, test_f1: 0.6085
 epoch: 72, train_loss: 0.7767, test_loss: 0.8077, test_f1: 0.6369
 epoch: 73, train_loss: 0.7710, test_loss: 0.8107, test_f1: 0.6295
 epoch: 74, train_loss: 0.7748, test_loss: 0.8550, test_f1: 0.5967
 epoch: 75, train_loss: 0.7948, test_loss: 0.8150, test_f1: 0.5970
 epoch: 76, train_loss: 0.7781, test_loss: 0.8168, test_f1: 0.6173
 epoch: 77, train_loss: 0.7674, test_loss: 0.8276, test_f1: 0.6056
 epoch: 78, train_loss: 0.7618, test_loss: 0.8339, test_f1: 0.5697
 epoch: 79, train_loss: 0.7764, test_loss: 0.8196, test_f1: 0.6081
 epoch: 80, train_loss: 0.7663, test_loss: 0.8062, test_f1: 0.6459
 epoch: 81, train_loss: 0.7579, test_loss: 0.8073, test_f1: 0.6436
 epoch: 82, train_loss: 0.7537, test_loss: 0.8157, test_f1: 0.6197
 epoch: 83, train_loss: 0.7672, test_loss: 0.8400, test_f1: 0.6213
 epoch: 84, train_loss: 0.7558, test_loss: 0.8776, test_f1: 0.6103
 epoch: 85, train_loss: 0.7606, test_loss: 0.7939, test_f1: 0.6285
 epoch: 86, train_loss: 0.7778, test_loss: 0.8436, test_f1: 0.6097
 epoch: 87, train_loss: 0.7700, test_loss: 0.8153, test_f1: 0.6026
 epoch: 88, train_loss: 0.7561, test_loss: 0.8244, test_f1: 0.6028
 epoch: 89, train_loss: 0.7521, test_loss: 0.8157, test_f1: 0.6373
 epoch: 90, train_loss: 0.7861, test_loss: 0.8194, test_f1: 0.5941
 epoch: 91, train_loss: 0.7474, test_loss: 0.8447, test_f1: 0.6290
 epoch: 92, train_loss: 0.7582, test_loss: 0.8375, test_f1: 0.5787
 epoch: 93, train_loss: 0.7496, test_loss: 0.8106, test_f1: 0.6127
 epoch: 94, train_loss: 0.7605, test_loss: 0.8180, test_f1: 0.6259
 epoch: 95, train_loss: 0.7469, test_loss: 0.8315, test_f1: 0.5990
 epoch: 96, train_loss: 0.7597, test_loss: 0.8573, test_f1: 0.6094
 epoch: 97, train_loss: 0.7499, test_loss: 0.7991, test_f1: 0.6171
 epoch: 98, train_loss: 0.7472, test_loss: 0.8280, test_f1: 0.6377
 epoch: 99, train_loss: 0.7569, test_loss: 0.8082, test_f1: 0.6362
##################ITERATION #7 ****************************************
 epoch: 0, train_loss: 1.1173, test_loss: 1.1072, test_f1: 0.3971
 epoch: 1, train_loss: 1.0245, test_loss: 1.0649, test_f1: 0.4424
 epoch: 2, train_loss: 0.9968, test_loss: 1.0522, test_f1: 0.4606
 epoch: 3, train_loss: 0.9892, test_loss: 1.0044, test_f1: 0.4475
 epoch: 4, train_loss: 0.9848, test_loss: 1.0220, test_f1: 0.4536
 epoch: 5, train_loss: 0.9847, test_loss: 1.0488, test_f1: 0.4621
 epoch: 6, train_loss: 0.9859, test_loss: 1.1370, test_f1: 0.4630
 epoch: 7, train_loss: 0.9628, test_loss: 0.9854, test_f1: 0.4683
 epoch: 8, train_loss: 0.9736, test_loss: 1.0546, test_f1: 0.4367
 epoch: 9, train_loss: 0.9558, test_loss: 0.9645, test_f1: 0.5397
 epoch: 10, train_loss: 0.9504, test_loss: 0.9797, test_f1: 0.5318
 epoch: 11, train_loss: 0.9325, test_loss: 0.9513, test_f1: 0.4824
 epoch: 12, train_loss: 0.9386, test_loss: 0.9822, test_f1: 0.5367
 epoch: 13, train_loss: 0.9382, test_loss: 0.9843, test_f1: 0.4997
 epoch: 14, train_loss: 0.9242, test_loss: 0.9800, test_f1: 0.5243
 epoch: 15, train_loss: 0.9365, test_loss: 0.9511, test_f1: 0.4825
 epoch: 16, train_loss: 0.9081, test_loss: 0.9343, test_f1: 0.5100
 epoch: 17, train_loss: 0.9225, test_loss: 1.0282, test_f1: 0.4994
 epoch: 18, train_loss: 0.9193, test_loss: 1.0235, test_f1: 0.4589
 epoch: 19, train_loss: 0.9003, test_loss: 0.9147, test_f1: 0.5087
 epoch: 20, train_loss: 0.8806, test_loss: 0.9282, test_f1: 0.4980
 epoch: 21, train_loss: 0.8900, test_loss: 0.9295, test_f1: 0.5488
 epoch: 22, train_loss: 0.8872, test_loss: 0.9288, test_f1: 0.5449
 epoch: 23, train_loss: 0.8792, test_loss: 0.9223, test_f1: 0.5366
 epoch: 24, train_loss: 0.8850, test_loss: 0.9285, test_f1: 0.4939
 epoch: 25, train_loss: 0.8699, test_loss: 0.9431, test_f1: 0.4840
 epoch: 26, train_loss: 0.8925, test_loss: 0.9194, test_f1: 0.5285
 epoch: 27, train_loss: 0.8640, test_loss: 0.9049, test_f1: 0.5342
 epoch: 28, train_loss: 0.8706, test_loss: 0.8751, test_f1: 0.5592
 epoch: 29, train_loss: 0.8620, test_loss: 0.9346, test_f1: 0.4999
 epoch: 30, train_loss: 0.8712, test_loss: 0.8477, test_f1: 0.6055
 epoch: 31, train_loss: 0.8552, test_loss: 0.8866, test_f1: 0.5153
 epoch: 32, train_loss: 0.8499, test_loss: 0.8076, test_f1: 0.5557
 epoch: 33, train_loss: 0.8383, test_loss: 0.8378, test_f1: 0.6160
 epoch: 34, train_loss: 0.8299, test_loss: 0.8329, test_f1: 0.5813
 epoch: 35, train_loss: 0.8250, test_loss: 0.8841, test_f1: 0.5996
 epoch: 36, train_loss: 0.8411, test_loss: 0.8575, test_f1: 0.5882
 epoch: 37, train_loss: 0.8439, test_loss: 0.8690, test_f1: 0.5448
 epoch: 38, train_loss: 0.8172, test_loss: 0.8261, test_f1: 0.5443
 epoch: 39, train_loss: 0.8312, test_loss: 0.8250, test_f1: 0.5886
 epoch: 40, train_loss: 0.8169, test_loss: 0.8994, test_f1: 0.5415
 epoch: 41, train_loss: 0.8245, test_loss: 0.8536, test_f1: 0.5313
 epoch: 42, train_loss: 0.8194, test_loss: 0.8063, test_f1: 0.6206
 epoch: 43, train_loss: 0.8094, test_loss: 0.8465, test_f1: 0.5596
 epoch: 44, train_loss: 0.7894, test_loss: 0.8907, test_f1: 0.5903
 epoch: 45, train_loss: 0.8076, test_loss: 0.8672, test_f1: 0.6071
 epoch: 46, train_loss: 0.8140, test_loss: 0.8372, test_f1: 0.6189
 epoch: 47, train_loss: 0.8028, test_loss: 0.8531, test_f1: 0.5572
 epoch: 48, train_loss: 0.8073, test_loss: 0.8061, test_f1: 0.6198
 epoch: 49, train_loss: 0.8139, test_loss: 0.8105, test_f1: 0.5809
 epoch: 50, train_loss: 0.8048, test_loss: 0.8125, test_f1: 0.6093
 epoch: 51, train_loss: 0.7729, test_loss: 0.7662, test_f1: 0.6485
 epoch: 52, train_loss: 0.7732, test_loss: 0.7766, test_f1: 0.6528
 epoch: 53, train_loss: 0.7561, test_loss: 0.7750, test_f1: 0.6478
 epoch: 54, train_loss: 0.7466, test_loss: 0.7549, test_f1: 0.6624
 epoch: 55, train_loss: 0.7536, test_loss: 0.7756, test_f1: 0.6518
 epoch: 56, train_loss: 0.7657, test_loss: 0.7702, test_f1: 0.6251
 epoch: 57, train_loss: 0.7524, test_loss: 0.7643, test_f1: 0.6424
 epoch: 58, train_loss: 0.7575, test_loss: 0.8023, test_f1: 0.5884
 epoch: 59, train_loss: 0.7395, test_loss: 0.7774, test_f1: 0.6381
 epoch: 60, train_loss: 0.7472, test_loss: 0.8078, test_f1: 0.6116
 epoch: 61, train_loss: 0.7601, test_loss: 0.8022, test_f1: 0.6142
 epoch: 62, train_loss: 0.7476, test_loss: 0.8147, test_f1: 0.6136
 epoch: 63, train_loss: 0.7512, test_loss: 0.7910, test_f1: 0.6110
 epoch: 64, train_loss: 0.7393, test_loss: 0.8062, test_f1: 0.6213
 epoch: 65, train_loss: 0.7459, test_loss: 0.7765, test_f1: 0.6502
 epoch: 66, train_loss: 0.7360, test_loss: 0.8008, test_f1: 0.6567
 epoch: 67, train_loss: 0.7424, test_loss: 0.8071, test_f1: 0.6223
 epoch: 68, train_loss: 0.7306, test_loss: 0.7729, test_f1: 0.6416
 epoch: 69, train_loss: 0.7255, test_loss: 0.7699, test_f1: 0.6395
 epoch: 70, train_loss: 0.7257, test_loss: 0.8005, test_f1: 0.6000
 epoch: 71, train_loss: 0.7257, test_loss: 0.7933, test_f1: 0.6535
 epoch: 72, train_loss: 0.7205, test_loss: 0.8043, test_f1: 0.6476
 epoch: 73, train_loss: 0.7325, test_loss: 0.8277, test_f1: 0.6176
 epoch: 74, train_loss: 0.7035, test_loss: 0.8761, test_f1: 0.6423
 epoch: 75, train_loss: 0.7141, test_loss: 0.8371, test_f1: 0.6436
 epoch: 76, train_loss: 0.7144, test_loss: 0.8047, test_f1: 0.6228
 epoch: 77, train_loss: 0.7177, test_loss: 0.8496, test_f1: 0.6142
 epoch: 78, train_loss: 0.7123, test_loss: 0.8618, test_f1: 0.6432
 epoch: 79, train_loss: 0.7221, test_loss: 0.8355, test_f1: 0.6332
 epoch: 80, train_loss: 0.7026, test_loss: 0.8200, test_f1: 0.6353
 epoch: 81, train_loss: 0.7203, test_loss: 0.8059, test_f1: 0.6615
 epoch: 82, train_loss: 0.7068, test_loss: 0.7876, test_f1: 0.6622
 epoch: 83, train_loss: 0.7136, test_loss: 0.7909, test_f1: 0.6318
 epoch: 84, train_loss: 0.7376, test_loss: 0.8071, test_f1: 0.6522
 epoch: 85, train_loss: 0.7170, test_loss: 0.8276, test_f1: 0.6313
 epoch: 86, train_loss: 0.7013, test_loss: 0.7978, test_f1: 0.6109
 epoch: 87, train_loss: 0.7107, test_loss: 0.8160, test_f1: 0.6718
 epoch: 88, train_loss: 0.6982, test_loss: 0.8267, test_f1: 0.6600
 epoch: 89, train_loss: 0.6984, test_loss: 0.8734, test_f1: 0.5769
 epoch: 90, train_loss: 0.6941, test_loss: 0.8007, test_f1: 0.6682
 epoch: 91, train_loss: 0.7003, test_loss: 0.8178, test_f1: 0.6503
 epoch: 92, train_loss: 0.6973, test_loss: 0.8013, test_f1: 0.6603
 epoch: 93, train_loss: 0.6877, test_loss: 0.8131, test_f1: 0.6573
 epoch: 94, train_loss: 0.6930, test_loss: 0.8194, test_f1: 0.6480
 epoch: 95, train_loss: 0.6890, test_loss: 0.8430, test_f1: 0.6446
 epoch: 96, train_loss: 0.7019, test_loss: 0.7920, test_f1: 0.6528
 epoch: 97, train_loss: 0.6905, test_loss: 0.8049, test_f1: 0.6568
 epoch: 98, train_loss: 0.7036, test_loss: 0.8029, test_f1: 0.6691
 epoch: 99, train_loss: 0.7042, test_loss: 0.8635, test_f1: 0.6359
##################ITERATION #8 ****************************************
 epoch: 0, train_loss: 1.1488, test_loss: 1.0092, test_f1: 0.4381
 epoch: 1, train_loss: 1.0283, test_loss: 1.0053, test_f1: 0.4366
 epoch: 2, train_loss: 1.0045, test_loss: 0.9992, test_f1: 0.4147
 epoch: 3, train_loss: 0.9783, test_loss: 0.9717, test_f1: 0.4713
 epoch: 4, train_loss: 0.9614, test_loss: 1.0151, test_f1: 0.4552
 epoch: 5, train_loss: 0.9722, test_loss: 0.9656, test_f1: 0.5312
 epoch: 6, train_loss: 0.9542, test_loss: 1.0239, test_f1: 0.4605
 epoch: 7, train_loss: 0.9463, test_loss: 0.9237, test_f1: 0.5055
 epoch: 8, train_loss: 0.9528, test_loss: 0.9926, test_f1: 0.4869
 epoch: 9, train_loss: 0.9436, test_loss: 0.9568, test_f1: 0.4917
 epoch: 10, train_loss: 0.9323, test_loss: 0.8851, test_f1: 0.5134
 epoch: 11, train_loss: 0.9511, test_loss: 0.9551, test_f1: 0.4604
 epoch: 12, train_loss: 0.9427, test_loss: 1.0850, test_f1: 0.4405
 epoch: 13, train_loss: 0.9566, test_loss: 0.9811, test_f1: 0.4684
 epoch: 14, train_loss: 0.9175, test_loss: 0.9090, test_f1: 0.4898
 epoch: 15, train_loss: 0.9256, test_loss: 0.9197, test_f1: 0.4862
 epoch: 16, train_loss: 0.9133, test_loss: 0.9263, test_f1: 0.5083
 epoch: 17, train_loss: 0.9229, test_loss: 0.9143, test_f1: 0.5492
 epoch: 18, train_loss: 0.9066, test_loss: 0.9371, test_f1: 0.4995
 epoch: 19, train_loss: 0.9003, test_loss: 0.8708, test_f1: 0.5110
 epoch: 20, train_loss: 0.8964, test_loss: 0.9027, test_f1: 0.5127
 epoch: 21, train_loss: 0.8715, test_loss: 1.0079, test_f1: 0.5097
 epoch: 22, train_loss: 0.8937, test_loss: 0.9048, test_f1: 0.5089
 epoch: 23, train_loss: 0.8784, test_loss: 0.9239, test_f1: 0.5124
 epoch: 24, train_loss: 0.8785, test_loss: 0.8943, test_f1: 0.5165
 epoch: 25, train_loss: 0.8713, test_loss: 0.8797, test_f1: 0.5222
 epoch: 26, train_loss: 0.8772, test_loss: 0.8458, test_f1: 0.5281
 epoch: 27, train_loss: 0.8606, test_loss: 0.9235, test_f1: 0.5447
 epoch: 28, train_loss: 0.8653, test_loss: 0.9323, test_f1: 0.4595
 epoch: 29, train_loss: 0.8573, test_loss: 0.9163, test_f1: 0.5122
 epoch: 30, train_loss: 0.8806, test_loss: 0.9488, test_f1: 0.4793
 epoch: 31, train_loss: 0.8425, test_loss: 0.9877, test_f1: 0.4923
 epoch: 32, train_loss: 0.8553, test_loss: 0.9965, test_f1: 0.5216
 epoch: 33, train_loss: 0.8572, test_loss: 0.8492, test_f1: 0.5419
 epoch: 34, train_loss: 0.8341, test_loss: 0.8549, test_f1: 0.5399
 epoch: 35, train_loss: 0.8409, test_loss: 0.8584, test_f1: 0.5634
 epoch: 36, train_loss: 0.8331, test_loss: 1.0101, test_f1: 0.4875
 epoch: 37, train_loss: 0.8274, test_loss: 0.8610, test_f1: 0.5300
 epoch: 38, train_loss: 0.8452, test_loss: 0.8695, test_f1: 0.5415
 epoch: 39, train_loss: 0.8276, test_loss: 0.8910, test_f1: 0.5472
 epoch: 40, train_loss: 0.8371, test_loss: 0.8767, test_f1: 0.5429
 epoch: 41, train_loss: 0.8168, test_loss: 0.8408, test_f1: 0.5866
 epoch: 42, train_loss: 0.8114, test_loss: 0.8363, test_f1: 0.5264
 epoch: 43, train_loss: 0.8106, test_loss: 0.8511, test_f1: 0.5581
 epoch: 44, train_loss: 0.8247, test_loss: 0.8351, test_f1: 0.5642
 epoch: 45, train_loss: 0.8150, test_loss: 0.8271, test_f1: 0.6188
 epoch: 46, train_loss: 0.8203, test_loss: 0.8594, test_f1: 0.5682
 epoch: 47, train_loss: 0.8274, test_loss: 0.8528, test_f1: 0.5545
 epoch: 48, train_loss: 0.8222, test_loss: 0.9523, test_f1: 0.5398
 epoch: 49, train_loss: 0.8068, test_loss: 0.8184, test_f1: 0.5604
 epoch: 50, train_loss: 0.8031, test_loss: 0.8681, test_f1: 0.5875
 epoch: 51, train_loss: 0.7712, test_loss: 0.8082, test_f1: 0.5946
 epoch: 52, train_loss: 0.7666, test_loss: 0.7946, test_f1: 0.5958
 epoch: 53, train_loss: 0.7659, test_loss: 0.8199, test_f1: 0.5959
 epoch: 54, train_loss: 0.7652, test_loss: 0.7860, test_f1: 0.6050
 epoch: 55, train_loss: 0.7725, test_loss: 0.8254, test_f1: 0.6020
 epoch: 56, train_loss: 0.7486, test_loss: 0.8137, test_f1: 0.6009
 epoch: 57, train_loss: 0.7532, test_loss: 0.8094, test_f1: 0.5804
 epoch: 58, train_loss: 0.7675, test_loss: 0.8016, test_f1: 0.5794
 epoch: 59, train_loss: 0.7625, test_loss: 0.7933, test_f1: 0.6108
 epoch: 60, train_loss: 0.7485, test_loss: 0.8455, test_f1: 0.5545
 epoch: 61, train_loss: 0.7425, test_loss: 0.7934, test_f1: 0.5813
 epoch: 62, train_loss: 0.7494, test_loss: 0.8042, test_f1: 0.6013
 epoch: 63, train_loss: 0.7398, test_loss: 0.7985, test_f1: 0.6187
 epoch: 64, train_loss: 0.7474, test_loss: 0.9313, test_f1: 0.5514
 epoch: 65, train_loss: 0.7483, test_loss: 0.8222, test_f1: 0.6131
 epoch: 66, train_loss: 0.7526, test_loss: 0.8033, test_f1: 0.6035
 epoch: 67, train_loss: 0.7536, test_loss: 0.7625, test_f1: 0.6100
 epoch: 68, train_loss: 0.7433, test_loss: 0.8077, test_f1: 0.6170
 epoch: 69, train_loss: 0.7299, test_loss: 0.8164, test_f1: 0.5987
 epoch: 70, train_loss: 0.7405, test_loss: 0.8469, test_f1: 0.6034
 epoch: 71, train_loss: 0.7336, test_loss: 0.8227, test_f1: 0.6029
 epoch: 72, train_loss: 0.7389, test_loss: 0.8106, test_f1: 0.6112
 epoch: 73, train_loss: 0.7248, test_loss: 0.8013, test_f1: 0.6127
 epoch: 74, train_loss: 0.7263, test_loss: 0.7496, test_f1: 0.6176
 epoch: 75, train_loss: 0.7447, test_loss: 0.7876, test_f1: 0.6071
 epoch: 76, train_loss: 0.7190, test_loss: 0.8552, test_f1: 0.6046
 epoch: 77, train_loss: 0.7128, test_loss: 0.8302, test_f1: 0.6007
 epoch: 78, train_loss: 0.7275, test_loss: 0.7876, test_f1: 0.6258
 epoch: 79, train_loss: 0.7151, test_loss: 0.8031, test_f1: 0.6095
 epoch: 80, train_loss: 0.7249, test_loss: 0.8179, test_f1: 0.6088
 epoch: 81, train_loss: 0.7283, test_loss: 0.8194, test_f1: 0.6112
 epoch: 82, train_loss: 0.7145, test_loss: 0.8140, test_f1: 0.6351
 epoch: 83, train_loss: 0.7345, test_loss: 0.8147, test_f1: 0.6450
 epoch: 84, train_loss: 0.7189, test_loss: 0.9034, test_f1: 0.5671
 epoch: 85, train_loss: 0.6945, test_loss: 0.7956, test_f1: 0.6426
 epoch: 86, train_loss: 0.7279, test_loss: 0.7963, test_f1: 0.6039
 epoch: 87, train_loss: 0.7153, test_loss: 0.8098, test_f1: 0.6212
 epoch: 88, train_loss: 0.6926, test_loss: 0.8309, test_f1: 0.6032
 epoch: 89, train_loss: 0.7097, test_loss: 0.8213, test_f1: 0.6297
 epoch: 90, train_loss: 0.7076, test_loss: 0.8371, test_f1: 0.6090
 epoch: 91, train_loss: 0.7019, test_loss: 0.8155, test_f1: 0.6287
 epoch: 92, train_loss: 0.7207, test_loss: 0.8283, test_f1: 0.6249
 epoch: 93, train_loss: 0.6996, test_loss: 0.8037, test_f1: 0.6166
 epoch: 94, train_loss: 0.7131, test_loss: 0.8313, test_f1: 0.6151
 epoch: 95, train_loss: 0.7175, test_loss: 0.8132, test_f1: 0.6196
 epoch: 96, train_loss: 0.6990, test_loss: 0.8364, test_f1: 0.6216
 epoch: 97, train_loss: 0.6892, test_loss: 0.8135, test_f1: 0.6174
 epoch: 98, train_loss: 0.6918, test_loss: 0.8044, test_f1: 0.6458
 epoch: 99, train_loss: 0.6902, test_loss: 0.7899, test_f1: 0.6516
##################ITERATION #9 ****************************************
 epoch: 0, train_loss: 1.1595, test_loss: 1.5979, test_f1: 0.2435
 epoch: 1, train_loss: 1.0212, test_loss: 1.0273, test_f1: 0.4461
 epoch: 2, train_loss: 1.0060, test_loss: 1.0164, test_f1: 0.4769
 epoch: 3, train_loss: 0.9936, test_loss: 0.9811, test_f1: 0.5193
 epoch: 4, train_loss: 0.9911, test_loss: 1.0459, test_f1: 0.4739
 epoch: 5, train_loss: 0.9793, test_loss: 0.9930, test_f1: 0.4673
 epoch: 6, train_loss: 0.9667, test_loss: 0.9961, test_f1: 0.4542
 epoch: 7, train_loss: 0.9541, test_loss: 0.9967, test_f1: 0.5237
 epoch: 8, train_loss: 0.9523, test_loss: 1.0173, test_f1: 0.5212
 epoch: 9, train_loss: 0.9514, test_loss: 1.0224, test_f1: 0.4918
 epoch: 10, train_loss: 0.9289, test_loss: 1.0796, test_f1: 0.4685
 epoch: 11, train_loss: 0.9291, test_loss: 1.0038, test_f1: 0.5193
 epoch: 12, train_loss: 0.9336, test_loss: 0.9668, test_f1: 0.5058
 epoch: 13, train_loss: 0.9041, test_loss: 0.9277, test_f1: 0.5207
 epoch: 14, train_loss: 0.9302, test_loss: 0.9487, test_f1: 0.4557
 epoch: 15, train_loss: 0.8921, test_loss: 0.9046, test_f1: 0.5369
 epoch: 16, train_loss: 0.8880, test_loss: 0.8780, test_f1: 0.5681
 epoch: 17, train_loss: 0.8941, test_loss: 0.9637, test_f1: 0.5276
 epoch: 18, train_loss: 0.8938, test_loss: 0.9396, test_f1: 0.4846
 epoch: 19, train_loss: 0.9048, test_loss: 0.8682, test_f1: 0.5584
 epoch: 20, train_loss: 0.8887, test_loss: 0.8770, test_f1: 0.5174
 epoch: 21, train_loss: 0.8705, test_loss: 0.8929, test_f1: 0.5583
 epoch: 22, train_loss: 0.8587, test_loss: 0.9413, test_f1: 0.4952
 epoch: 23, train_loss: 0.8448, test_loss: 0.9488, test_f1: 0.5154
 epoch: 24, train_loss: 0.8437, test_loss: 0.8593, test_f1: 0.5095
 epoch: 25, train_loss: 0.8432, test_loss: 0.9210, test_f1: 0.5031
 epoch: 26, train_loss: 0.8496, test_loss: 0.8644, test_f1: 0.5502
 epoch: 27, train_loss: 0.8561, test_loss: 0.8605, test_f1: 0.5436
 epoch: 28, train_loss: 0.8447, test_loss: 0.8041, test_f1: 0.5714
 epoch: 29, train_loss: 0.8417, test_loss: 0.9577, test_f1: 0.5480
 epoch: 30, train_loss: 0.8342, test_loss: 0.8547, test_f1: 0.5372
 epoch: 31, train_loss: 0.8406, test_loss: 0.8771, test_f1: 0.5622
 epoch: 32, train_loss: 0.8495, test_loss: 1.5169, test_f1: 0.4729
 epoch: 33, train_loss: 0.8318, test_loss: 0.8278, test_f1: 0.5429
 epoch: 34, train_loss: 0.8319, test_loss: 1.2321, test_f1: 0.5004
 epoch: 35, train_loss: 0.8393, test_loss: 1.0297, test_f1: 0.4922
 epoch: 36, train_loss: 0.8411, test_loss: 0.8784, test_f1: 0.5640
 epoch: 37, train_loss: 0.8195, test_loss: 0.8745, test_f1: 0.5329
 epoch: 38, train_loss: 0.8250, test_loss: 0.8138, test_f1: 0.5683
 epoch: 39, train_loss: 0.8275, test_loss: 0.8348, test_f1: 0.5606
 epoch: 40, train_loss: 0.8099, test_loss: 1.0069, test_f1: 0.5092
 epoch: 41, train_loss: 0.8306, test_loss: 0.8194, test_f1: 0.5585
 epoch: 42, train_loss: 0.8098, test_loss: 0.8398, test_f1: 0.5285
 epoch: 43, train_loss: 0.8166, test_loss: 0.8806, test_f1: 0.5533
 epoch: 44, train_loss: 0.8031, test_loss: 0.8489, test_f1: 0.5890
 epoch: 45, train_loss: 0.8097, test_loss: 0.8362, test_f1: 0.6064
 epoch: 46, train_loss: 0.7985, test_loss: 0.7911, test_f1: 0.6021
 epoch: 47, train_loss: 0.7920, test_loss: 0.9086, test_f1: 0.5456
 epoch: 48, train_loss: 0.8108, test_loss: 0.8936, test_f1: 0.5425
 epoch: 49, train_loss: 0.8116, test_loss: 0.8111, test_f1: 0.5682
 epoch: 50, train_loss: 0.8008, test_loss: 0.9436, test_f1: 0.5399
 epoch: 51, train_loss: 0.7898, test_loss: 0.8368, test_f1: 0.5626
 epoch: 52, train_loss: 0.7844, test_loss: 0.9523, test_f1: 0.5436
 epoch: 53, train_loss: 0.7656, test_loss: 0.7747, test_f1: 0.6205
 epoch: 54, train_loss: 0.7526, test_loss: 0.8056, test_f1: 0.6193
 epoch: 55, train_loss: 0.7579, test_loss: 0.8519, test_f1: 0.6097
 epoch: 56, train_loss: 0.7619, test_loss: 0.8160, test_f1: 0.6113
 epoch: 57, train_loss: 0.7601, test_loss: 0.7926, test_f1: 0.6149
 epoch: 58, train_loss: 0.7491, test_loss: 0.8390, test_f1: 0.5574
 epoch: 59, train_loss: 0.7619, test_loss: 0.8382, test_f1: 0.5842
 epoch: 60, train_loss: 0.7579, test_loss: 0.7819, test_f1: 0.6026
 epoch: 61, train_loss: 0.7464, test_loss: 0.7970, test_f1: 0.5831
 epoch: 62, train_loss: 0.7443, test_loss: 0.7937, test_f1: 0.5761
 epoch: 63, train_loss: 0.7719, test_loss: 0.7760, test_f1: 0.6273
 epoch: 64, train_loss: 0.7559, test_loss: 0.8134, test_f1: 0.6037
 epoch: 65, train_loss: 0.7430, test_loss: 0.7686, test_f1: 0.6084
 epoch: 66, train_loss: 0.7367, test_loss: 0.7596, test_f1: 0.6251
 epoch: 67, train_loss: 0.7475, test_loss: 0.8405, test_f1: 0.5926
 epoch: 68, train_loss: 0.7327, test_loss: 0.8125, test_f1: 0.6045
 epoch: 69, train_loss: 0.7556, test_loss: 0.7861, test_f1: 0.6112
 epoch: 70, train_loss: 0.7509, test_loss: 0.8553, test_f1: 0.5675
 epoch: 71, train_loss: 0.7361, test_loss: 0.8100, test_f1: 0.6219
 epoch: 72, train_loss: 0.7397, test_loss: 0.8485, test_f1: 0.5715
 epoch: 73, train_loss: 0.7350, test_loss: 0.8346, test_f1: 0.6042
 epoch: 74, train_loss: 0.7381, test_loss: 0.8023, test_f1: 0.6022
 epoch: 75, train_loss: 0.7475, test_loss: 0.7691, test_f1: 0.6176
 epoch: 76, train_loss: 0.7561, test_loss: 0.8314, test_f1: 0.6120
 epoch: 77, train_loss: 0.7498, test_loss: 0.8295, test_f1: 0.6178
 epoch: 78, train_loss: 0.7344, test_loss: 0.8438, test_f1: 0.5981
 epoch: 79, train_loss: 0.7212, test_loss: 0.8330, test_f1: 0.5999
 epoch: 80, train_loss: 0.7282, test_loss: 0.8000, test_f1: 0.5907
 epoch: 81, train_loss: 0.7335, test_loss: 0.7699, test_f1: 0.6024
 epoch: 82, train_loss: 0.7313, test_loss: 0.8364, test_f1: 0.6012
 epoch: 83, train_loss: 0.7504, test_loss: 0.7531, test_f1: 0.6016
 epoch: 84, train_loss: 0.7352, test_loss: 0.8430, test_f1: 0.5792
 epoch: 85, train_loss: 0.7306, test_loss: 0.7777, test_f1: 0.5840
 epoch: 86, train_loss: 0.7329, test_loss: 0.7811, test_f1: 0.6278
 epoch: 87, train_loss: 0.7263, test_loss: 0.7638, test_f1: 0.6081
 epoch: 88, train_loss: 0.7233, test_loss: 0.7944, test_f1: 0.6407
 epoch: 89, train_loss: 0.7316, test_loss: 0.8072, test_f1: 0.6290
 epoch: 90, train_loss: 0.7234, test_loss: 0.7977, test_f1: 0.6326
 epoch: 91, train_loss: 0.7144, test_loss: 0.7792, test_f1: 0.6371
 epoch: 92, train_loss: 0.7171, test_loss: 0.7270, test_f1: 0.6472
 epoch: 93, train_loss: 0.7196, test_loss: 0.8557, test_f1: 0.5897
 epoch: 94, train_loss: 0.7123, test_loss: 0.7323, test_f1: 0.6271
 epoch: 95, train_loss: 0.6998, test_loss: 0.7602, test_f1: 0.6331
 epoch: 96, train_loss: 0.7146, test_loss: 0.8351, test_f1: 0.6554
 epoch: 97, train_loss: 0.7093, test_loss: 0.8316, test_f1: 0.6571
 epoch: 98, train_loss: 0.7093, test_loss: 0.7463, test_f1: 0.6422
 epoch: 99, train_loss: 0.7121, test_loss: 0.8069, test_f1: 0.6180

Training completed in 817.35 seconds
Best F1: 0.6718 at epoch 87
Mean F1 across iterations: 0.6499  0.0154
========================FINAL RESULTS================================
FEGIN weighted F1: 0.6718  0.0154
python main.py --data ltspice_examples --representation component_pin_net --model FEGIN --layers 6 --hiddens 16 --batch_size 64 --lr 0.01 --emb_size 512 --epochs 100 --save_appendix component_pin_net_L6_H16_BS64_LR0.01_E512 --no_val
-----



STDERR:
  File "main.py", line 370, in <module>
    main()
  File "main.py", line 254, in main
    dataset = dataset_class(
  File "/home/philip/projects/ltspice_examples_code_repo/Circuit-Completion-Using-GNNs/component_classification_with_link_prediction_head/evaluation/FEGIN/kernel/circuit_datasets.py", line 15, in __init__
    self.data, self.slices = torch.load(self.processed_paths[0])
  File "/home/philip/.local/lib/python3.8/site-packages/torch/serialization.py", line 1040, in load
    warnings.warn(
  File "/usr/lib/python3.8/warnings.py", line 109, in _showwarnmsg
    sw(msg.message, msg.category, msg.filename, msg.lineno,
  File "main.py", line 47, in warn_with_traceback
    traceback.print_stack(file=log)
/home/philip/projects/ltspice_examples_code_repo/Circuit-Completion-Using-GNNs/component_classification_with_link_prediction_head/evaluation/FEGIN/kernel/circuit_datasets.py:15: FutureWarning: You are using `torch.load` with `weights_only=False` (the current default value), which uses the default pickle module implicitly. It is possible to construct malicious pickle data which will execute arbitrary code during unpickling (See https://github.com/pytorch/pytorch/blob/main/SECURITY.md#untrusted-models for more details). In a future release, the default value for `weights_only` will be flipped to `True`. This limits the functions that could be executed during unpickling. Arbitrary objects will no longer be allowed to be loaded via this mode unless they are explicitly allowlisted by the user via `torch.serialization.add_safe_globals`. We recommend you start setting `weights_only=True` for any use case where you don't have full control of the loaded file. Please open an issue on GitHub for any issues related to this experimental feature.
  self.data, self.slices = torch.load(self.processed_paths[0])
