STDOUT:
Results will be saved in /home/philip/projects/ltspice_examples_code_repo/Circuit-Completion-Using-GNNs/component_classification_with_link_prediction_head/evaluation/FEGIN/results/model_FEGIN_dataset_ltspice_demos
Command line input: python main.py --data ltspice_demos --representation component_net --model FEGIN --layers 3 --hiddens 32 --batch_size 64 --lr 0.001 --emb_size 128 --epochs 100 --save_appendix component_net_L3_H32_BS64_LR0.001_E128 --no_val
 is saved.
-----
ltspice_demos - FEGIN
Using 3 layers, 32 hidden units, h = 2
Loading component_net representation dataset
ENTERED
Training FEGIN on component_net representation
Train: 1565, Test: 383
##################ITERATION #0 ****************************************
 epoch: 0, train_loss: 1.3523, test_loss: 1.3470, test_f1: 0.1368
 epoch: 1, train_loss: 1.2347, test_loss: 1.2733, test_f1: 0.3512
 epoch: 2, train_loss: 1.1516, test_loss: 1.1966, test_f1: 0.3256
 epoch: 3, train_loss: 1.1183, test_loss: 1.1725, test_f1: 0.4102
 epoch: 4, train_loss: 1.0858, test_loss: 1.1494, test_f1: 0.4203
 epoch: 5, train_loss: 1.0574, test_loss: 1.1416, test_f1: 0.4343
 epoch: 6, train_loss: 1.0417, test_loss: 1.1238, test_f1: 0.4289
 epoch: 7, train_loss: 1.0078, test_loss: 1.1538, test_f1: 0.4405
 epoch: 8, train_loss: 0.9888, test_loss: 1.1041, test_f1: 0.4627
 epoch: 9, train_loss: 0.9782, test_loss: 1.0986, test_f1: 0.4563
 epoch: 10, train_loss: 0.9680, test_loss: 1.0975, test_f1: 0.4594
 epoch: 11, train_loss: 0.9572, test_loss: 1.1568, test_f1: 0.4692
 epoch: 12, train_loss: 0.9410, test_loss: 1.1076, test_f1: 0.4710
 epoch: 13, train_loss: 0.9192, test_loss: 1.1203, test_f1: 0.5023
 epoch: 14, train_loss: 0.9225, test_loss: 1.1050, test_f1: 0.5129
 epoch: 15, train_loss: 0.8998, test_loss: 1.1235, test_f1: 0.5124
 epoch: 16, train_loss: 0.9088, test_loss: 1.1024, test_f1: 0.5132
 epoch: 17, train_loss: 0.8837, test_loss: 1.1562, test_f1: 0.5368
 epoch: 18, train_loss: 0.8779, test_loss: 1.1010, test_f1: 0.5260
 epoch: 19, train_loss: 0.8739, test_loss: 1.1472, test_f1: 0.5441
 epoch: 20, train_loss: 0.8770, test_loss: 1.1530, test_f1: 0.5194
 epoch: 21, train_loss: 0.8577, test_loss: 1.2039, test_f1: 0.5559
 epoch: 22, train_loss: 0.8753, test_loss: 1.1448, test_f1: 0.5304
 epoch: 23, train_loss: 0.8644, test_loss: 1.1105, test_f1: 0.5746
 epoch: 24, train_loss: 0.8430, test_loss: 1.1425, test_f1: 0.5500
 epoch: 25, train_loss: 0.8323, test_loss: 1.1154, test_f1: 0.5312
 epoch: 26, train_loss: 0.8200, test_loss: 1.1571, test_f1: 0.5744
 epoch: 27, train_loss: 0.8330, test_loss: 1.1256, test_f1: 0.5647
 epoch: 28, train_loss: 0.8392, test_loss: 1.1417, test_f1: 0.5843
 epoch: 29, train_loss: 0.8138, test_loss: 1.1902, test_f1: 0.5588
 epoch: 30, train_loss: 0.8164, test_loss: 1.1671, test_f1: 0.5219
 epoch: 31, train_loss: 0.8076, test_loss: 1.1815, test_f1: 0.5529
 epoch: 32, train_loss: 0.7980, test_loss: 1.1491, test_f1: 0.5656
 epoch: 33, train_loss: 0.8100, test_loss: 1.1885, test_f1: 0.5660
 epoch: 34, train_loss: 0.8005, test_loss: 1.1681, test_f1: 0.6156
 epoch: 35, train_loss: 0.7880, test_loss: 1.1727, test_f1: 0.5631
 epoch: 36, train_loss: 0.7821, test_loss: 1.2136, test_f1: 0.5441
 epoch: 37, train_loss: 0.7945, test_loss: 1.2005, test_f1: 0.5884
 epoch: 38, train_loss: 0.7654, test_loss: 1.1575, test_f1: 0.5836
 epoch: 39, train_loss: 0.7552, test_loss: 1.1511, test_f1: 0.5409
 epoch: 40, train_loss: 0.7708, test_loss: 1.2244, test_f1: 0.5913
 epoch: 41, train_loss: 0.7714, test_loss: 1.2056, test_f1: 0.5889
 epoch: 42, train_loss: 0.7651, test_loss: 1.1818, test_f1: 0.5771
 epoch: 43, train_loss: 0.7508, test_loss: 1.1370, test_f1: 0.5963
 epoch: 44, train_loss: 0.7368, test_loss: 1.2834, test_f1: 0.5133
 epoch: 45, train_loss: 0.7556, test_loss: 1.1297, test_f1: 0.6258
 epoch: 46, train_loss: 0.7369, test_loss: 1.1817, test_f1: 0.5765
 epoch: 47, train_loss: 0.7494, test_loss: 1.2100, test_f1: 0.6110
 epoch: 48, train_loss: 0.7382, test_loss: 1.2242, test_f1: 0.5745
 epoch: 49, train_loss: 0.7263, test_loss: 1.1857, test_f1: 0.5954
 epoch: 50, train_loss: 0.7467, test_loss: 1.1586, test_f1: 0.6247
 epoch: 51, train_loss: 0.7006, test_loss: 1.2717, test_f1: 0.5978
 epoch: 52, train_loss: 0.6884, test_loss: 1.1971, test_f1: 0.6213
 epoch: 53, train_loss: 0.6811, test_loss: 1.2226, test_f1: 0.6222
 epoch: 54, train_loss: 0.6843, test_loss: 1.1877, test_f1: 0.5766
 epoch: 55, train_loss: 0.6752, test_loss: 1.2888, test_f1: 0.6120
 epoch: 56, train_loss: 0.6709, test_loss: 1.2445, test_f1: 0.5967
 epoch: 57, train_loss: 0.6718, test_loss: 1.2432, test_f1: 0.6242
 epoch: 58, train_loss: 0.6638, test_loss: 1.2444, test_f1: 0.6036
 epoch: 59, train_loss: 0.6606, test_loss: 1.2564, test_f1: 0.5817
 epoch: 60, train_loss: 0.6636, test_loss: 1.2653, test_f1: 0.5891
 epoch: 61, train_loss: 0.6603, test_loss: 1.3144, test_f1: 0.6027
 epoch: 62, train_loss: 0.6528, test_loss: 1.2089, test_f1: 0.6220
 epoch: 63, train_loss: 0.6521, test_loss: 1.2797, test_f1: 0.6174
 epoch: 64, train_loss: 0.6597, test_loss: 1.2352, test_f1: 0.6116
 epoch: 65, train_loss: 0.6596, test_loss: 1.2295, test_f1: 0.5967
 epoch: 66, train_loss: 0.6502, test_loss: 1.2862, test_f1: 0.6253
 epoch: 67, train_loss: 0.6768, test_loss: 1.3249, test_f1: 0.6091
 epoch: 68, train_loss: 0.6245, test_loss: 1.2728, test_f1: 0.6096
 epoch: 69, train_loss: 0.6174, test_loss: 1.3835, test_f1: 0.6004
 epoch: 70, train_loss: 0.6286, test_loss: 1.3605, test_f1: 0.6258
 epoch: 71, train_loss: 0.6255, test_loss: 1.3947, test_f1: 0.6241
 epoch: 72, train_loss: 0.6385, test_loss: 1.2922, test_f1: 0.6215
 epoch: 73, train_loss: 0.6200, test_loss: 1.3150, test_f1: 0.5948
 epoch: 74, train_loss: 0.6173, test_loss: 1.4131, test_f1: 0.5800
 epoch: 75, train_loss: 0.6206, test_loss: 1.2589, test_f1: 0.6112
 epoch: 76, train_loss: 0.5950, test_loss: 1.3906, test_f1: 0.6070
 epoch: 77, train_loss: 0.6038, test_loss: 1.3823, test_f1: 0.6187
 epoch: 78, train_loss: 0.5881, test_loss: 1.4149, test_f1: 0.5949
 epoch: 79, train_loss: 0.5913, test_loss: 1.3254, test_f1: 0.5612
 epoch: 80, train_loss: 0.5884, test_loss: 1.4287, test_f1: 0.5999
 epoch: 81, train_loss: 0.5872, test_loss: 1.4302, test_f1: 0.5855
 epoch: 82, train_loss: 0.5826, test_loss: 1.4495, test_f1: 0.6254
 epoch: 83, train_loss: 0.5893, test_loss: 1.5722, test_f1: 0.5843
 epoch: 84, train_loss: 0.5725, test_loss: 1.3814, test_f1: 0.5735
 epoch: 85, train_loss: 0.5903, test_loss: 1.3832, test_f1: 0.5944
 epoch: 86, train_loss: 0.5838, test_loss: 1.4322, test_f1: 0.6040
 epoch: 87, train_loss: 0.5915, test_loss: 1.5346, test_f1: 0.6116
 epoch: 88, train_loss: 0.5903, test_loss: 1.2814, test_f1: 0.5973
 epoch: 89, train_loss: 0.5686, test_loss: 1.4623, test_f1: 0.5926
 epoch: 90, train_loss: 0.5646, test_loss: 1.3046, test_f1: 0.6179
 epoch: 91, train_loss: 0.5859, test_loss: 1.5391, test_f1: 0.5374
 epoch: 92, train_loss: 0.6029, test_loss: 1.3270, test_f1: 0.5709
 epoch: 93, train_loss: 0.5645, test_loss: 1.3587, test_f1: 0.6205
 epoch: 94, train_loss: 0.5620, test_loss: 1.3839, test_f1: 0.6069
 epoch: 95, train_loss: 0.5520, test_loss: 1.5162, test_f1: 0.6051
 epoch: 96, train_loss: 0.5436, test_loss: 1.3416, test_f1: 0.6271
 epoch: 97, train_loss: 0.5407, test_loss: 1.4536, test_f1: 0.5480
 epoch: 98, train_loss: 0.5518, test_loss: 1.3430, test_f1: 0.6140
 epoch: 99, train_loss: 0.5308, test_loss: 1.4515, test_f1: 0.6003
##################ITERATION #1 ****************************************
 epoch: 0, train_loss: 1.2365, test_loss: 1.2948, test_f1: 0.2281
 epoch: 1, train_loss: 1.1316, test_loss: 1.2234, test_f1: 0.3133
 epoch: 2, train_loss: 1.0884, test_loss: 1.1615, test_f1: 0.4206
 epoch: 3, train_loss: 1.0469, test_loss: 1.1427, test_f1: 0.4398
 epoch: 4, train_loss: 1.0248, test_loss: 1.1076, test_f1: 0.4439
 epoch: 5, train_loss: 1.0113, test_loss: 1.1217, test_f1: 0.4668
 epoch: 6, train_loss: 0.9881, test_loss: 1.0588, test_f1: 0.4906
 epoch: 7, train_loss: 0.9762, test_loss: 1.0665, test_f1: 0.5145
 epoch: 8, train_loss: 0.9538, test_loss: 1.0557, test_f1: 0.5283
 epoch: 9, train_loss: 0.9481, test_loss: 1.0564, test_f1: 0.5364
 epoch: 10, train_loss: 0.9328, test_loss: 1.0550, test_f1: 0.5354
 epoch: 11, train_loss: 0.9248, test_loss: 1.0632, test_f1: 0.5336
 epoch: 12, train_loss: 0.8978, test_loss: 1.0056, test_f1: 0.5397
 epoch: 13, train_loss: 0.8851, test_loss: 1.0276, test_f1: 0.5586
 epoch: 14, train_loss: 0.8854, test_loss: 1.0933, test_f1: 0.5270
 epoch: 15, train_loss: 0.8830, test_loss: 1.0438, test_f1: 0.5411
 epoch: 16, train_loss: 0.8569, test_loss: 0.9921, test_f1: 0.5587
 epoch: 17, train_loss: 0.8589, test_loss: 1.0704, test_f1: 0.5695
 epoch: 18, train_loss: 0.8528, test_loss: 1.0728, test_f1: 0.5533
 epoch: 19, train_loss: 0.8346, test_loss: 1.0440, test_f1: 0.5859
 epoch: 20, train_loss: 0.8385, test_loss: 1.0227, test_f1: 0.5628
 epoch: 21, train_loss: 0.8124, test_loss: 1.0063, test_f1: 0.5735
 epoch: 22, train_loss: 0.8125, test_loss: 1.0920, test_f1: 0.5820
 epoch: 23, train_loss: 0.7962, test_loss: 1.1315, test_f1: 0.5457
 epoch: 24, train_loss: 0.7936, test_loss: 1.1539, test_f1: 0.5644
 epoch: 25, train_loss: 0.7733, test_loss: 1.0868, test_f1: 0.5608
 epoch: 26, train_loss: 0.7838, test_loss: 1.2082, test_f1: 0.5312
 epoch: 27, train_loss: 0.7918, test_loss: 1.2064, test_f1: 0.5559
 epoch: 28, train_loss: 0.7763, test_loss: 1.0350, test_f1: 0.5645
 epoch: 29, train_loss: 0.7462, test_loss: 1.1017, test_f1: 0.5699
 epoch: 30, train_loss: 0.7336, test_loss: 1.0761, test_f1: 0.5693
 epoch: 31, train_loss: 0.7442, test_loss: 1.0408, test_f1: 0.5402
 epoch: 32, train_loss: 0.7216, test_loss: 1.1707, test_f1: 0.5865
 epoch: 33, train_loss: 0.7133, test_loss: 1.2244, test_f1: 0.5810
 epoch: 34, train_loss: 0.7213, test_loss: 1.1508, test_f1: 0.5840
 epoch: 35, train_loss: 0.7288, test_loss: 1.1967, test_f1: 0.5424
 epoch: 36, train_loss: 0.7204, test_loss: 1.1563, test_f1: 0.5782
 epoch: 37, train_loss: 0.6988, test_loss: 1.1941, test_f1: 0.5932
 epoch: 38, train_loss: 0.6827, test_loss: 1.1196, test_f1: 0.5290
 epoch: 39, train_loss: 0.6777, test_loss: 1.2058, test_f1: 0.5363
 epoch: 40, train_loss: 0.6860, test_loss: 1.2921, test_f1: 0.5442
 epoch: 41, train_loss: 0.7062, test_loss: 1.1609, test_f1: 0.5400
 epoch: 42, train_loss: 0.6709, test_loss: 1.1830, test_f1: 0.5093
 epoch: 43, train_loss: 0.6944, test_loss: 1.0571, test_f1: 0.6233
 epoch: 44, train_loss: 0.6471, test_loss: 1.1278, test_f1: 0.5846
 epoch: 45, train_loss: 0.6639, test_loss: 1.2105, test_f1: 0.6244
 epoch: 46, train_loss: 0.6686, test_loss: 1.2585, test_f1: 0.5061
 epoch: 47, train_loss: 0.6287, test_loss: 1.1611, test_f1: 0.5643
 epoch: 48, train_loss: 0.6556, test_loss: 1.2092, test_f1: 0.6135
 epoch: 49, train_loss: 0.6104, test_loss: 1.2307, test_f1: 0.5553
 epoch: 50, train_loss: 0.6239, test_loss: 1.3955, test_f1: 0.5674
 epoch: 51, train_loss: 0.6091, test_loss: 1.1563, test_f1: 0.5844
 epoch: 52, train_loss: 0.5793, test_loss: 1.1816, test_f1: 0.5782
 epoch: 53, train_loss: 0.6087, test_loss: 1.1579, test_f1: 0.5953
 epoch: 54, train_loss: 0.5838, test_loss: 1.1491, test_f1: 0.6039
 epoch: 55, train_loss: 0.5690, test_loss: 1.2649, test_f1: 0.5419
 epoch: 56, train_loss: 0.5710, test_loss: 1.1662, test_f1: 0.6102
 epoch: 57, train_loss: 0.5887, test_loss: 1.2039, test_f1: 0.5425
 epoch: 58, train_loss: 0.5545, test_loss: 1.2147, test_f1: 0.5804
 epoch: 59, train_loss: 0.5654, test_loss: 1.2467, test_f1: 0.5667
 epoch: 60, train_loss: 0.5636, test_loss: 1.3152, test_f1: 0.6110
 epoch: 61, train_loss: 0.5727, test_loss: 1.2473, test_f1: 0.5879
 epoch: 62, train_loss: 0.5564, test_loss: 1.3268, test_f1: 0.6042
 epoch: 63, train_loss: 0.5615, test_loss: 1.3138, test_f1: 0.5999
 epoch: 64, train_loss: 0.5577, test_loss: 1.2672, test_f1: 0.6188
 epoch: 65, train_loss: 0.5607, test_loss: 1.3000, test_f1: 0.5756
 epoch: 66, train_loss: 0.5385, test_loss: 1.3196, test_f1: 0.5704
 epoch: 67, train_loss: 0.5504, test_loss: 1.2891, test_f1: 0.6006
 epoch: 68, train_loss: 0.5235, test_loss: 1.3096, test_f1: 0.5825
 epoch: 69, train_loss: 0.5388, test_loss: 1.4940, test_f1: 0.5705
 epoch: 70, train_loss: 0.5326, test_loss: 1.3239, test_f1: 0.5671
 epoch: 71, train_loss: 0.5180, test_loss: 1.3621, test_f1: 0.5962
 epoch: 72, train_loss: 0.5300, test_loss: 1.3467, test_f1: 0.5884
 epoch: 73, train_loss: 0.5211, test_loss: 1.2909, test_f1: 0.5801
 epoch: 74, train_loss: 0.5063, test_loss: 1.5029, test_f1: 0.5898
 epoch: 75, train_loss: 0.5208, test_loss: 1.4054, test_f1: 0.5960
 epoch: 76, train_loss: 0.5214, test_loss: 1.4941, test_f1: 0.6037
 epoch: 77, train_loss: 0.5174, test_loss: 1.5285, test_f1: 0.5889
 epoch: 78, train_loss: 0.5098, test_loss: 1.4852, test_f1: 0.5966
 epoch: 79, train_loss: 0.4987, test_loss: 1.4388, test_f1: 0.5964
 epoch: 80, train_loss: 0.4972, test_loss: 1.4308, test_f1: 0.5838
 epoch: 81, train_loss: 0.4950, test_loss: 1.4851, test_f1: 0.5869
 epoch: 82, train_loss: 0.4985, test_loss: 1.4846, test_f1: 0.5784
 epoch: 83, train_loss: 0.4983, test_loss: 1.5671, test_f1: 0.5888
 epoch: 84, train_loss: 0.5064, test_loss: 1.4881, test_f1: 0.5615
 epoch: 85, train_loss: 0.5016, test_loss: 1.5578, test_f1: 0.6020
 epoch: 86, train_loss: 0.5119, test_loss: 1.4712, test_f1: 0.5839
 epoch: 87, train_loss: 0.5216, test_loss: 1.5684, test_f1: 0.6044
 epoch: 88, train_loss: 0.4890, test_loss: 1.5046, test_f1: 0.5893
 epoch: 89, train_loss: 0.4850, test_loss: 1.5510, test_f1: 0.6171
 epoch: 90, train_loss: 0.4900, test_loss: 1.6247, test_f1: 0.5813
 epoch: 91, train_loss: 0.4966, test_loss: 1.5243, test_f1: 0.6008
 epoch: 92, train_loss: 0.4669, test_loss: 1.5651, test_f1: 0.6097
 epoch: 93, train_loss: 0.4763, test_loss: 1.5563, test_f1: 0.6055
 epoch: 94, train_loss: 0.4674, test_loss: 1.6763, test_f1: 0.6130
 epoch: 95, train_loss: 0.4745, test_loss: 1.6741, test_f1: 0.5999
 epoch: 96, train_loss: 0.4682, test_loss: 1.6676, test_f1: 0.6003
 epoch: 97, train_loss: 0.4729, test_loss: 1.6278, test_f1: 0.5734
 epoch: 98, train_loss: 0.4789, test_loss: 1.6725, test_f1: 0.6038
 epoch: 99, train_loss: 0.4636, test_loss: 1.6342, test_f1: 0.5985
##################ITERATION #2 ****************************************
 epoch: 0, train_loss: 1.2027, test_loss: 1.2998, test_f1: 0.3329
 epoch: 1, train_loss: 1.0944, test_loss: 1.2604, test_f1: 0.3283
 epoch: 2, train_loss: 1.0631, test_loss: 1.1987, test_f1: 0.3970
 epoch: 3, train_loss: 1.0413, test_loss: 1.1092, test_f1: 0.5091
 epoch: 4, train_loss: 1.0227, test_loss: 1.1174, test_f1: 0.5090
 epoch: 5, train_loss: 0.9998, test_loss: 1.1046, test_f1: 0.4964
 epoch: 6, train_loss: 0.9741, test_loss: 1.1100, test_f1: 0.5258
 epoch: 7, train_loss: 0.9564, test_loss: 1.1414, test_f1: 0.5051
 epoch: 8, train_loss: 0.9567, test_loss: 1.1203, test_f1: 0.5354
 epoch: 9, train_loss: 0.9408, test_loss: 1.0569, test_f1: 0.5538
 epoch: 10, train_loss: 0.9219, test_loss: 1.0740, test_f1: 0.5277
 epoch: 11, train_loss: 0.9154, test_loss: 1.1131, test_f1: 0.5320
 epoch: 12, train_loss: 0.9108, test_loss: 1.0649, test_f1: 0.5416
 epoch: 13, train_loss: 0.8796, test_loss: 1.0815, test_f1: 0.5471
 epoch: 14, train_loss: 0.8995, test_loss: 1.1927, test_f1: 0.5412
 epoch: 15, train_loss: 0.8869, test_loss: 1.0501, test_f1: 0.5546
 epoch: 16, train_loss: 0.8789, test_loss: 1.0979, test_f1: 0.5705
 epoch: 17, train_loss: 0.8828, test_loss: 1.0455, test_f1: 0.5673
 epoch: 18, train_loss: 0.8589, test_loss: 1.0711, test_f1: 0.5484
 epoch: 19, train_loss: 0.8398, test_loss: 1.0275, test_f1: 0.5939
 epoch: 20, train_loss: 0.8502, test_loss: 1.0766, test_f1: 0.5597
 epoch: 21, train_loss: 0.8307, test_loss: 1.0360, test_f1: 0.5912
 epoch: 22, train_loss: 0.8106, test_loss: 1.0580, test_f1: 0.5770
 epoch: 23, train_loss: 0.8286, test_loss: 1.0940, test_f1: 0.5494
 epoch: 24, train_loss: 0.8388, test_loss: 1.0305, test_f1: 0.5813
 epoch: 25, train_loss: 0.8192, test_loss: 0.9929, test_f1: 0.5813
 epoch: 26, train_loss: 0.8236, test_loss: 1.0563, test_f1: 0.5540
 epoch: 27, train_loss: 0.8104, test_loss: 1.1014, test_f1: 0.5620
 epoch: 28, train_loss: 0.8032, test_loss: 0.9735, test_f1: 0.5797
 epoch: 29, train_loss: 0.7915, test_loss: 1.0448, test_f1: 0.5774
 epoch: 30, train_loss: 0.7748, test_loss: 1.0569, test_f1: 0.5698
 epoch: 31, train_loss: 0.7722, test_loss: 1.0839, test_f1: 0.5464
 epoch: 32, train_loss: 0.7814, test_loss: 1.0056, test_f1: 0.6198
 epoch: 33, train_loss: 0.7647, test_loss: 1.0659, test_f1: 0.5735
 epoch: 34, train_loss: 0.7710, test_loss: 1.0205, test_f1: 0.5942
 epoch: 35, train_loss: 0.7568, test_loss: 1.0493, test_f1: 0.5751
 epoch: 36, train_loss: 0.7530, test_loss: 1.0109, test_f1: 0.6090
 epoch: 37, train_loss: 0.7387, test_loss: 1.0330, test_f1: 0.5619
 epoch: 38, train_loss: 0.7365, test_loss: 0.9923, test_f1: 0.5970
 epoch: 39, train_loss: 0.7201, test_loss: 1.0377, test_f1: 0.5797
 epoch: 40, train_loss: 0.7028, test_loss: 1.0817, test_f1: 0.5962
 epoch: 41, train_loss: 0.7120, test_loss: 0.9656, test_f1: 0.6218
 epoch: 42, train_loss: 0.7014, test_loss: 1.0587, test_f1: 0.6041
 epoch: 43, train_loss: 0.6893, test_loss: 0.9975, test_f1: 0.5808
 epoch: 44, train_loss: 0.6725, test_loss: 0.9717, test_f1: 0.6169
 epoch: 45, train_loss: 0.6694, test_loss: 0.9620, test_f1: 0.6440
 epoch: 46, train_loss: 0.6923, test_loss: 1.0342, test_f1: 0.6251
 epoch: 47, train_loss: 0.6841, test_loss: 1.0402, test_f1: 0.5971
 epoch: 48, train_loss: 0.6577, test_loss: 0.9488, test_f1: 0.6376
 epoch: 49, train_loss: 0.6401, test_loss: 1.1242, test_f1: 0.6135
 epoch: 50, train_loss: 0.6652, test_loss: 1.0215, test_f1: 0.6487
 epoch: 51, train_loss: 0.6337, test_loss: 0.9784, test_f1: 0.6132
 epoch: 52, train_loss: 0.6225, test_loss: 0.9823, test_f1: 0.6290
 epoch: 53, train_loss: 0.5990, test_loss: 1.0088, test_f1: 0.6214
 epoch: 54, train_loss: 0.6041, test_loss: 0.9933, test_f1: 0.6333
 epoch: 55, train_loss: 0.5950, test_loss: 1.0924, test_f1: 0.6130
 epoch: 56, train_loss: 0.5983, test_loss: 1.0198, test_f1: 0.6178
 epoch: 57, train_loss: 0.5852, test_loss: 1.0209, test_f1: 0.6180
 epoch: 58, train_loss: 0.5888, test_loss: 1.0290, test_f1: 0.6088
 epoch: 59, train_loss: 0.5779, test_loss: 1.0355, test_f1: 0.6120
 epoch: 60, train_loss: 0.5656, test_loss: 1.0743, test_f1: 0.6333
 epoch: 61, train_loss: 0.5666, test_loss: 1.0400, test_f1: 0.6265
 epoch: 62, train_loss: 0.5444, test_loss: 1.0828, test_f1: 0.6368
 epoch: 63, train_loss: 0.5795, test_loss: 1.0403, test_f1: 0.6186
 epoch: 64, train_loss: 0.5371, test_loss: 1.0369, test_f1: 0.6222
 epoch: 65, train_loss: 0.5536, test_loss: 1.0472, test_f1: 0.6071
 epoch: 66, train_loss: 0.5710, test_loss: 1.0605, test_f1: 0.6342
 epoch: 67, train_loss: 0.5421, test_loss: 1.0728, test_f1: 0.6118
 epoch: 68, train_loss: 0.5378, test_loss: 1.0304, test_f1: 0.6223
 epoch: 69, train_loss: 0.5346, test_loss: 1.0472, test_f1: 0.6086
 epoch: 70, train_loss: 0.5484, test_loss: 1.0769, test_f1: 0.6120
 epoch: 71, train_loss: 0.5261, test_loss: 1.0838, test_f1: 0.6181
 epoch: 72, train_loss: 0.5341, test_loss: 1.1021, test_f1: 0.6078
 epoch: 73, train_loss: 0.5386, test_loss: 1.1684, test_f1: 0.6269
 epoch: 74, train_loss: 0.5099, test_loss: 1.1127, test_f1: 0.6368
 epoch: 75, train_loss: 0.5157, test_loss: 1.0939, test_f1: 0.6241
 epoch: 76, train_loss: 0.5325, test_loss: 1.0842, test_f1: 0.6452
 epoch: 77, train_loss: 0.5241, test_loss: 1.1353, test_f1: 0.6396
 epoch: 78, train_loss: 0.4991, test_loss: 1.2019, test_f1: 0.6108
 epoch: 79, train_loss: 0.5115, test_loss: 1.1306, test_f1: 0.6246
 epoch: 80, train_loss: 0.5035, test_loss: 1.3047, test_f1: 0.6321
 epoch: 81, train_loss: 0.4875, test_loss: 1.2741, test_f1: 0.6450
 epoch: 82, train_loss: 0.5044, test_loss: 1.1453, test_f1: 0.6351
 epoch: 83, train_loss: 0.4855, test_loss: 1.1524, test_f1: 0.6343
 epoch: 84, train_loss: 0.5076, test_loss: 1.2267, test_f1: 0.6387
 epoch: 85, train_loss: 0.4780, test_loss: 1.1427, test_f1: 0.6535
 epoch: 86, train_loss: 0.4891, test_loss: 1.2573, test_f1: 0.6038
 epoch: 87, train_loss: 0.4849, test_loss: 1.2110, test_f1: 0.6507
 epoch: 88, train_loss: 0.4859, test_loss: 1.2549, test_f1: 0.6297
 epoch: 89, train_loss: 0.4777, test_loss: 1.2143, test_f1: 0.6417
 epoch: 90, train_loss: 0.4364, test_loss: 1.2155, test_f1: 0.6503
 epoch: 91, train_loss: 0.4888, test_loss: 1.2872, test_f1: 0.6161
 epoch: 92, train_loss: 0.4717, test_loss: 1.3060, test_f1: 0.6324
 epoch: 93, train_loss: 0.4686, test_loss: 1.2157, test_f1: 0.6375
 epoch: 94, train_loss: 0.4746, test_loss: 1.2303, test_f1: 0.6017
 epoch: 95, train_loss: 0.4598, test_loss: 1.2658, test_f1: 0.6225
 epoch: 96, train_loss: 0.4535, test_loss: 1.2430, test_f1: 0.6413
 epoch: 97, train_loss: 0.4297, test_loss: 1.2099, test_f1: 0.6293
 epoch: 98, train_loss: 0.4383, test_loss: 1.3768, test_f1: 0.5960
 epoch: 99, train_loss: 0.4414, test_loss: 1.4182, test_f1: 0.6102
##################ITERATION #3 ****************************************
 epoch: 0, train_loss: 1.3182, test_loss: 1.2928, test_f1: 0.3093
 epoch: 1, train_loss: 1.0955, test_loss: 1.1726, test_f1: 0.4941
 epoch: 2, train_loss: 1.0564, test_loss: 1.1011, test_f1: 0.4785
 epoch: 3, train_loss: 1.0304, test_loss: 1.1282, test_f1: 0.4997
 epoch: 4, train_loss: 1.0059, test_loss: 1.1122, test_f1: 0.5085
 epoch: 5, train_loss: 0.9813, test_loss: 1.0976, test_f1: 0.5127
 epoch: 6, train_loss: 0.9371, test_loss: 1.0891, test_f1: 0.5290
 epoch: 7, train_loss: 0.9531, test_loss: 1.0707, test_f1: 0.5486
 epoch: 8, train_loss: 0.9455, test_loss: 1.0650, test_f1: 0.5698
 epoch: 9, train_loss: 0.9223, test_loss: 1.0849, test_f1: 0.5343
 epoch: 10, train_loss: 0.9196, test_loss: 1.1003, test_f1: 0.5657
 epoch: 11, train_loss: 0.9068, test_loss: 1.1421, test_f1: 0.5636
 epoch: 12, train_loss: 0.8959, test_loss: 1.1388, test_f1: 0.5541
 epoch: 13, train_loss: 0.9062, test_loss: 1.1137, test_f1: 0.5469
 epoch: 14, train_loss: 0.8802, test_loss: 1.0625, test_f1: 0.5837
 epoch: 15, train_loss: 0.8683, test_loss: 1.0670, test_f1: 0.5850
 epoch: 16, train_loss: 0.8570, test_loss: 1.0050, test_f1: 0.5807
 epoch: 17, train_loss: 0.8514, test_loss: 1.0317, test_f1: 0.5715
 epoch: 18, train_loss: 0.8524, test_loss: 1.0958, test_f1: 0.5676
 epoch: 19, train_loss: 0.8369, test_loss: 1.0316, test_f1: 0.5769
 epoch: 20, train_loss: 0.8229, test_loss: 1.0461, test_f1: 0.6121
 epoch: 21, train_loss: 0.8213, test_loss: 1.0220, test_f1: 0.5933
 epoch: 22, train_loss: 0.8153, test_loss: 1.0522, test_f1: 0.6007
 epoch: 23, train_loss: 0.8113, test_loss: 1.0016, test_f1: 0.5992
 epoch: 24, train_loss: 0.8067, test_loss: 1.0434, test_f1: 0.5974
 epoch: 25, train_loss: 0.8175, test_loss: 1.0235, test_f1: 0.6037
 epoch: 26, train_loss: 0.7914, test_loss: 1.0223, test_f1: 0.6085
 epoch: 27, train_loss: 0.7818, test_loss: 0.9781, test_f1: 0.5955
 epoch: 28, train_loss: 0.7665, test_loss: 1.0401, test_f1: 0.6202
 epoch: 29, train_loss: 0.7717, test_loss: 0.9661, test_f1: 0.6357
 epoch: 30, train_loss: 0.7847, test_loss: 1.0159, test_f1: 0.6149
 epoch: 31, train_loss: 0.7549, test_loss: 1.0264, test_f1: 0.6371
 epoch: 32, train_loss: 0.7401, test_loss: 0.9524, test_f1: 0.6187
 epoch: 33, train_loss: 0.7412, test_loss: 1.0325, test_f1: 0.5914
 epoch: 34, train_loss: 0.7368, test_loss: 1.0157, test_f1: 0.6007
 epoch: 35, train_loss: 0.7078, test_loss: 1.0669, test_f1: 0.5985
 epoch: 36, train_loss: 0.7208, test_loss: 0.9949, test_f1: 0.6393
 epoch: 37, train_loss: 0.7125, test_loss: 1.0480, test_f1: 0.5976
 epoch: 38, train_loss: 0.6838, test_loss: 1.1015, test_f1: 0.6141
 epoch: 39, train_loss: 0.7385, test_loss: 1.0610, test_f1: 0.6021
 epoch: 40, train_loss: 0.7144, test_loss: 1.0463, test_f1: 0.6195
 epoch: 41, train_loss: 0.6739, test_loss: 1.0661, test_f1: 0.6074
 epoch: 42, train_loss: 0.6763, test_loss: 1.0881, test_f1: 0.6090
 epoch: 43, train_loss: 0.6761, test_loss: 1.0528, test_f1: 0.5885
 epoch: 44, train_loss: 0.6797, test_loss: 1.1595, test_f1: 0.6042
 epoch: 45, train_loss: 0.6878, test_loss: 1.1390, test_f1: 0.6172
 epoch: 46, train_loss: 0.6468, test_loss: 1.0196, test_f1: 0.6460
 epoch: 47, train_loss: 0.6511, test_loss: 1.0692, test_f1: 0.6120
 epoch: 48, train_loss: 0.6558, test_loss: 1.0875, test_f1: 0.6301
 epoch: 49, train_loss: 0.6286, test_loss: 1.0969, test_f1: 0.6216
 epoch: 50, train_loss: 0.6313, test_loss: 1.0464, test_f1: 0.6126
 epoch: 51, train_loss: 0.5932, test_loss: 1.0314, test_f1: 0.6355
 epoch: 52, train_loss: 0.5843, test_loss: 0.9922, test_f1: 0.6332
 epoch: 53, train_loss: 0.6085, test_loss: 1.1178, test_f1: 0.6148
 epoch: 54, train_loss: 0.5731, test_loss: 1.0587, test_f1: 0.6346
 epoch: 55, train_loss: 0.5892, test_loss: 1.1129, test_f1: 0.6073
 epoch: 56, train_loss: 0.5698, test_loss: 1.1159, test_f1: 0.6214
 epoch: 57, train_loss: 0.5491, test_loss: 1.1129, test_f1: 0.6304
 epoch: 58, train_loss: 0.5585, test_loss: 1.0700, test_f1: 0.6409
 epoch: 59, train_loss: 0.5409, test_loss: 1.0676, test_f1: 0.6344
 epoch: 60, train_loss: 0.5699, test_loss: 1.0634, test_f1: 0.6581
 epoch: 61, train_loss: 0.5353, test_loss: 1.1177, test_f1: 0.6542
 epoch: 62, train_loss: 0.5372, test_loss: 1.1129, test_f1: 0.6169
 epoch: 63, train_loss: 0.5591, test_loss: 1.0825, test_f1: 0.6767
 epoch: 64, train_loss: 0.5468, test_loss: 1.1177, test_f1: 0.6057
 epoch: 65, train_loss: 0.5290, test_loss: 1.1187, test_f1: 0.6328
 epoch: 66, train_loss: 0.5182, test_loss: 1.1408, test_f1: 0.6147
 epoch: 67, train_loss: 0.5316, test_loss: 1.1853, test_f1: 0.6397
 epoch: 68, train_loss: 0.5230, test_loss: 1.1494, test_f1: 0.6291
 epoch: 69, train_loss: 0.5337, test_loss: 1.1358, test_f1: 0.6628
 epoch: 70, train_loss: 0.5154, test_loss: 1.1420, test_f1: 0.6397
 epoch: 71, train_loss: 0.5155, test_loss: 1.1605, test_f1: 0.6372
 epoch: 72, train_loss: 0.5175, test_loss: 1.2251, test_f1: 0.6091
 epoch: 73, train_loss: 0.5091, test_loss: 1.1327, test_f1: 0.6400
 epoch: 74, train_loss: 0.5005, test_loss: 1.1551, test_f1: 0.6395
 epoch: 75, train_loss: 0.5067, test_loss: 1.2356, test_f1: 0.6123
 epoch: 76, train_loss: 0.4957, test_loss: 1.1144, test_f1: 0.6372
 epoch: 77, train_loss: 0.4709, test_loss: 1.1651, test_f1: 0.6626
 epoch: 78, train_loss: 0.4784, test_loss: 1.1811, test_f1: 0.6706
 epoch: 79, train_loss: 0.4899, test_loss: 1.1752, test_f1: 0.6360
 epoch: 80, train_loss: 0.4993, test_loss: 1.2580, test_f1: 0.6654
 epoch: 81, train_loss: 0.4687, test_loss: 1.2255, test_f1: 0.6441
 epoch: 82, train_loss: 0.4926, test_loss: 1.1905, test_f1: 0.6295
 epoch: 83, train_loss: 0.4856, test_loss: 1.2015, test_f1: 0.6445
 epoch: 84, train_loss: 0.4670, test_loss: 1.1986, test_f1: 0.6624
 epoch: 85, train_loss: 0.4730, test_loss: 1.1956, test_f1: 0.6440
 epoch: 86, train_loss: 0.4787, test_loss: 1.2294, test_f1: 0.6631
 epoch: 87, train_loss: 0.4565, test_loss: 1.1944, test_f1: 0.6525
 epoch: 88, train_loss: 0.4549, test_loss: 1.2126, test_f1: 0.6433
 epoch: 89, train_loss: 0.4721, test_loss: 1.2523, test_f1: 0.6542
 epoch: 90, train_loss: 0.4563, test_loss: 1.2090, test_f1: 0.6414
 epoch: 91, train_loss: 0.4655, test_loss: 1.3038, test_f1: 0.6455
 epoch: 92, train_loss: 0.4444, test_loss: 1.2380, test_f1: 0.6155
 epoch: 93, train_loss: 0.4484, test_loss: 1.3021, test_f1: 0.6170
 epoch: 94, train_loss: 0.4409, test_loss: 1.2770, test_f1: 0.6439
 epoch: 95, train_loss: 0.4514, test_loss: 1.2891, test_f1: 0.6545
 epoch: 96, train_loss: 0.4377, test_loss: 1.1911, test_f1: 0.6789
 epoch: 97, train_loss: 0.4420, test_loss: 1.2781, test_f1: 0.6332
 epoch: 98, train_loss: 0.4274, test_loss: 1.3370, test_f1: 0.6366
 epoch: 99, train_loss: 0.4176, test_loss: 1.2628, test_f1: 0.6282
##################ITERATION #4 ****************************************
 epoch: 0, train_loss: 1.2138, test_loss: 1.2780, test_f1: 0.1388
 epoch: 1, train_loss: 1.1158, test_loss: 1.1814, test_f1: 0.3816
 epoch: 2, train_loss: 1.0565, test_loss: 1.0977, test_f1: 0.4815
 epoch: 3, train_loss: 1.0226, test_loss: 1.0823, test_f1: 0.5171
 epoch: 4, train_loss: 0.9989, test_loss: 1.0608, test_f1: 0.4701
 epoch: 5, train_loss: 0.9809, test_loss: 1.0329, test_f1: 0.5436
 epoch: 6, train_loss: 0.9656, test_loss: 1.0664, test_f1: 0.5508
 epoch: 7, train_loss: 0.9546, test_loss: 1.0479, test_f1: 0.5127
 epoch: 8, train_loss: 0.9510, test_loss: 1.0408, test_f1: 0.5486
 epoch: 9, train_loss: 0.9330, test_loss: 1.0253, test_f1: 0.5229
 epoch: 10, train_loss: 0.9104, test_loss: 1.0512, test_f1: 0.5461
 epoch: 11, train_loss: 0.9333, test_loss: 1.0474, test_f1: 0.5566
 epoch: 12, train_loss: 0.9093, test_loss: 1.0205, test_f1: 0.5556
 epoch: 13, train_loss: 0.8959, test_loss: 1.0175, test_f1: 0.5704
 epoch: 14, train_loss: 0.8764, test_loss: 1.0183, test_f1: 0.5652
 epoch: 15, train_loss: 0.8684, test_loss: 1.0204, test_f1: 0.5616
 epoch: 16, train_loss: 0.8760, test_loss: 1.0185, test_f1: 0.5993
 epoch: 17, train_loss: 0.8762, test_loss: 0.9923, test_f1: 0.5623
 epoch: 18, train_loss: 0.8777, test_loss: 1.0089, test_f1: 0.5314
 epoch: 19, train_loss: 0.8542, test_loss: 1.0333, test_f1: 0.5863
 epoch: 20, train_loss: 0.8464, test_loss: 1.0201, test_f1: 0.6061
 epoch: 21, train_loss: 0.8357, test_loss: 1.0121, test_f1: 0.5725
 epoch: 22, train_loss: 0.8471, test_loss: 0.9967, test_f1: 0.5617
 epoch: 23, train_loss: 0.8257, test_loss: 0.9714, test_f1: 0.6029
 epoch: 24, train_loss: 0.8195, test_loss: 0.9973, test_f1: 0.6108
 epoch: 25, train_loss: 0.8243, test_loss: 1.0828, test_f1: 0.5684
 epoch: 26, train_loss: 0.8150, test_loss: 0.9498, test_f1: 0.6125
 epoch: 27, train_loss: 0.7969, test_loss: 0.9778, test_f1: 0.5880
 epoch: 28, train_loss: 0.7946, test_loss: 0.9929, test_f1: 0.6037
 epoch: 29, train_loss: 0.8038, test_loss: 1.0796, test_f1: 0.5773
 epoch: 30, train_loss: 0.7886, test_loss: 0.9735, test_f1: 0.6163
 epoch: 31, train_loss: 0.7773, test_loss: 1.0104, test_f1: 0.6188
 epoch: 32, train_loss: 0.7781, test_loss: 0.9892, test_f1: 0.6222
 epoch: 33, train_loss: 0.7673, test_loss: 0.9671, test_f1: 0.6000
 epoch: 34, train_loss: 0.7582, test_loss: 0.9887, test_f1: 0.6071
 epoch: 35, train_loss: 0.7699, test_loss: 1.1148, test_f1: 0.5818
 epoch: 36, train_loss: 0.7508, test_loss: 1.0463, test_f1: 0.6105
 epoch: 37, train_loss: 0.7251, test_loss: 1.0764, test_f1: 0.6022
 epoch: 38, train_loss: 0.7318, test_loss: 1.0810, test_f1: 0.6026
 epoch: 39, train_loss: 0.7226, test_loss: 0.9678, test_f1: 0.6077
 epoch: 40, train_loss: 0.6980, test_loss: 1.1196, test_f1: 0.6110
 epoch: 41, train_loss: 0.7156, test_loss: 1.2345, test_f1: 0.5362
 epoch: 42, train_loss: 0.7385, test_loss: 1.0145, test_f1: 0.5951
 epoch: 43, train_loss: 0.7170, test_loss: 1.0083, test_f1: 0.6303
 epoch: 44, train_loss: 0.6973, test_loss: 1.0381, test_f1: 0.6096
 epoch: 45, train_loss: 0.6677, test_loss: 1.1093, test_f1: 0.5921
 epoch: 46, train_loss: 0.6912, test_loss: 1.0080, test_f1: 0.6342
 epoch: 47, train_loss: 0.6629, test_loss: 1.1601, test_f1: 0.5302
 epoch: 48, train_loss: 0.6744, test_loss: 1.2374, test_f1: 0.5765
 epoch: 49, train_loss: 0.6626, test_loss: 1.0068, test_f1: 0.6316
 epoch: 50, train_loss: 0.6641, test_loss: 1.1048, test_f1: 0.5762
 epoch: 51, train_loss: 0.6397, test_loss: 1.0294, test_f1: 0.6323
 epoch: 52, train_loss: 0.6196, test_loss: 1.0697, test_f1: 0.6427
 epoch: 53, train_loss: 0.6350, test_loss: 1.0553, test_f1: 0.5957
 epoch: 54, train_loss: 0.6058, test_loss: 1.0774, test_f1: 0.6296
 epoch: 55, train_loss: 0.6132, test_loss: 1.0548, test_f1: 0.6347
 epoch: 56, train_loss: 0.5970, test_loss: 1.0131, test_f1: 0.6522
 epoch: 57, train_loss: 0.5977, test_loss: 1.1566, test_f1: 0.5650
 epoch: 58, train_loss: 0.5836, test_loss: 1.1585, test_f1: 0.5589
 epoch: 59, train_loss: 0.6221, test_loss: 1.1091, test_f1: 0.6022
 epoch: 60, train_loss: 0.5900, test_loss: 1.0685, test_f1: 0.6462
 epoch: 61, train_loss: 0.5963, test_loss: 1.0887, test_f1: 0.6378
 epoch: 62, train_loss: 0.5711, test_loss: 1.1062, test_f1: 0.6261
 epoch: 63, train_loss: 0.5629, test_loss: 1.1436, test_f1: 0.5837
 epoch: 64, train_loss: 0.5674, test_loss: 1.1102, test_f1: 0.6545
 epoch: 65, train_loss: 0.5746, test_loss: 1.1758, test_f1: 0.6148
 epoch: 66, train_loss: 0.5601, test_loss: 1.1899, test_f1: 0.5829
 epoch: 67, train_loss: 0.5536, test_loss: 1.2401, test_f1: 0.5937
 epoch: 68, train_loss: 0.5587, test_loss: 1.1870, test_f1: 0.5986
 epoch: 69, train_loss: 0.5572, test_loss: 1.1257, test_f1: 0.6321
 epoch: 70, train_loss: 0.5535, test_loss: 1.1271, test_f1: 0.6283
 epoch: 71, train_loss: 0.5588, test_loss: 1.1979, test_f1: 0.6366
 epoch: 72, train_loss: 0.5289, test_loss: 1.1973, test_f1: 0.6254
 epoch: 73, train_loss: 0.5558, test_loss: 1.2292, test_f1: 0.5877
 epoch: 74, train_loss: 0.5280, test_loss: 1.1813, test_f1: 0.6633
 epoch: 75, train_loss: 0.5355, test_loss: 1.2681, test_f1: 0.6176
 epoch: 76, train_loss: 0.5305, test_loss: 1.2160, test_f1: 0.6438
 epoch: 77, train_loss: 0.5132, test_loss: 1.3553, test_f1: 0.5653
 epoch: 78, train_loss: 0.5124, test_loss: 1.2354, test_f1: 0.6327
 epoch: 79, train_loss: 0.5186, test_loss: 1.2281, test_f1: 0.6573
 epoch: 80, train_loss: 0.5060, test_loss: 1.2943, test_f1: 0.6486
 epoch: 81, train_loss: 0.5135, test_loss: 1.3752, test_f1: 0.5860
 epoch: 82, train_loss: 0.5278, test_loss: 1.3203, test_f1: 0.6035
 epoch: 83, train_loss: 0.5122, test_loss: 1.2700, test_f1: 0.6458
 epoch: 84, train_loss: 0.5017, test_loss: 1.3299, test_f1: 0.5972
 epoch: 85, train_loss: 0.5015, test_loss: 1.2554, test_f1: 0.6610
 epoch: 86, train_loss: 0.4922, test_loss: 1.3494, test_f1: 0.5960
 epoch: 87, train_loss: 0.4849, test_loss: 1.2935, test_f1: 0.6492
 epoch: 88, train_loss: 0.4611, test_loss: 1.2872, test_f1: 0.6373
 epoch: 89, train_loss: 0.4763, test_loss: 1.2842, test_f1: 0.6444
 epoch: 90, train_loss: 0.5021, test_loss: 1.3279, test_f1: 0.6241
 epoch: 91, train_loss: 0.4859, test_loss: 1.3682, test_f1: 0.6209
 epoch: 92, train_loss: 0.4661, test_loss: 1.3323, test_f1: 0.6517
 epoch: 93, train_loss: 0.4714, test_loss: 1.3628, test_f1: 0.6116
 epoch: 94, train_loss: 0.4706, test_loss: 1.3229, test_f1: 0.6511
 epoch: 95, train_loss: 0.4583, test_loss: 1.3153, test_f1: 0.6343
 epoch: 96, train_loss: 0.4652, test_loss: 1.2681, test_f1: 0.6623
 epoch: 97, train_loss: 0.4578, test_loss: 1.3059, test_f1: 0.6398
 epoch: 98, train_loss: 0.4594, test_loss: 1.3311, test_f1: 0.6433
 epoch: 99, train_loss: 0.4700, test_loss: 1.3417, test_f1: 0.6519
##################ITERATION #5 ****************************************
 epoch: 0, train_loss: 1.3074, test_loss: 1.2698, test_f1: 0.3100
 epoch: 1, train_loss: 1.1237, test_loss: 1.2325, test_f1: 0.4174
 epoch: 2, train_loss: 1.0924, test_loss: 1.1657, test_f1: 0.4393
 epoch: 3, train_loss: 1.0527, test_loss: 1.1695, test_f1: 0.4154
 epoch: 4, train_loss: 1.0246, test_loss: 1.1445, test_f1: 0.4836
 epoch: 5, train_loss: 1.0234, test_loss: 1.0840, test_f1: 0.5039
 epoch: 6, train_loss: 0.9986, test_loss: 1.0855, test_f1: 0.5095
 epoch: 7, train_loss: 0.9662, test_loss: 1.0685, test_f1: 0.4765
 epoch: 8, train_loss: 0.9606, test_loss: 1.0838, test_f1: 0.5271
 epoch: 9, train_loss: 0.9505, test_loss: 1.1069, test_f1: 0.4573
 epoch: 10, train_loss: 0.9438, test_loss: 1.0563, test_f1: 0.5219
 epoch: 11, train_loss: 0.9152, test_loss: 1.0852, test_f1: 0.4543
 epoch: 12, train_loss: 0.9070, test_loss: 1.0147, test_f1: 0.5596
 epoch: 13, train_loss: 0.8995, test_loss: 1.0777, test_f1: 0.5519
 epoch: 14, train_loss: 0.8807, test_loss: 1.0613, test_f1: 0.5419
 epoch: 15, train_loss: 0.8650, test_loss: 1.0344, test_f1: 0.5926
 epoch: 16, train_loss: 0.8806, test_loss: 1.0879, test_f1: 0.5082
 epoch: 17, train_loss: 0.8760, test_loss: 1.0395, test_f1: 0.5546
 epoch: 18, train_loss: 0.8434, test_loss: 1.0065, test_f1: 0.5902
 epoch: 19, train_loss: 0.8317, test_loss: 1.0699, test_f1: 0.5672
 epoch: 20, train_loss: 0.8491, test_loss: 1.0816, test_f1: 0.5091
 epoch: 21, train_loss: 0.8339, test_loss: 1.0759, test_f1: 0.5653
 epoch: 22, train_loss: 0.8287, test_loss: 1.0823, test_f1: 0.5387
 epoch: 23, train_loss: 0.8053, test_loss: 1.0982, test_f1: 0.5578
 epoch: 24, train_loss: 0.8001, test_loss: 1.1179, test_f1: 0.5360
 epoch: 25, train_loss: 0.8061, test_loss: 1.0117, test_f1: 0.5851
 epoch: 26, train_loss: 0.7997, test_loss: 1.1030, test_f1: 0.5306
 epoch: 27, train_loss: 0.7924, test_loss: 1.1105, test_f1: 0.5707
 epoch: 28, train_loss: 0.7769, test_loss: 1.1302, test_f1: 0.6043
 epoch: 29, train_loss: 0.7851, test_loss: 1.1864, test_f1: 0.5599
 epoch: 30, train_loss: 0.7614, test_loss: 1.1254, test_f1: 0.6102
 epoch: 31, train_loss: 0.7573, test_loss: 1.0884, test_f1: 0.6124
 epoch: 32, train_loss: 0.7537, test_loss: 1.1169, test_f1: 0.5765
 epoch: 33, train_loss: 0.7416, test_loss: 1.1419, test_f1: 0.5812
 epoch: 34, train_loss: 0.7488, test_loss: 1.0730, test_f1: 0.6170
 epoch: 35, train_loss: 0.7207, test_loss: 1.1861, test_f1: 0.5394
 epoch: 36, train_loss: 0.7220, test_loss: 1.1804, test_f1: 0.6037
 epoch: 37, train_loss: 0.7070, test_loss: 1.1301, test_f1: 0.6010
 epoch: 38, train_loss: 0.7266, test_loss: 1.0774, test_f1: 0.6317
 epoch: 39, train_loss: 0.7038, test_loss: 1.2153, test_f1: 0.5885
 epoch: 40, train_loss: 0.7232, test_loss: 1.1622, test_f1: 0.5484
 epoch: 41, train_loss: 0.7139, test_loss: 1.1642, test_f1: 0.5944
 epoch: 42, train_loss: 0.6888, test_loss: 1.1743, test_f1: 0.6105
 epoch: 43, train_loss: 0.6699, test_loss: 1.1617, test_f1: 0.5969
 epoch: 44, train_loss: 0.6678, test_loss: 1.1629, test_f1: 0.5968
 epoch: 45, train_loss: 0.6578, test_loss: 1.2202, test_f1: 0.5678
 epoch: 46, train_loss: 0.6523, test_loss: 1.2185, test_f1: 0.5963
 epoch: 47, train_loss: 0.6502, test_loss: 1.3190, test_f1: 0.5810
 epoch: 48, train_loss: 0.6649, test_loss: 1.3037, test_f1: 0.5877
 epoch: 49, train_loss: 0.6374, test_loss: 1.2046, test_f1: 0.5992
 epoch: 50, train_loss: 0.6263, test_loss: 1.2600, test_f1: 0.5951
 epoch: 51, train_loss: 0.5934, test_loss: 1.2628, test_f1: 0.6185
 epoch: 52, train_loss: 0.6186, test_loss: 1.2410, test_f1: 0.5895
 epoch: 53, train_loss: 0.5987, test_loss: 1.2148, test_f1: 0.5940
 epoch: 54, train_loss: 0.5837, test_loss: 1.2846, test_f1: 0.6011
 epoch: 55, train_loss: 0.5683, test_loss: 1.2700, test_f1: 0.5959
 epoch: 56, train_loss: 0.5553, test_loss: 1.3248, test_f1: 0.6145
 epoch: 57, train_loss: 0.5615, test_loss: 1.2643, test_f1: 0.6050
 epoch: 58, train_loss: 0.5551, test_loss: 1.3950, test_f1: 0.5749
 epoch: 59, train_loss: 0.5619, test_loss: 1.3731, test_f1: 0.5935
 epoch: 60, train_loss: 0.5466, test_loss: 1.3356, test_f1: 0.5901
 epoch: 61, train_loss: 0.5574, test_loss: 1.3987, test_f1: 0.5779
 epoch: 62, train_loss: 0.5680, test_loss: 1.3325, test_f1: 0.5854
 epoch: 63, train_loss: 0.5299, test_loss: 1.4240, test_f1: 0.6029
 epoch: 64, train_loss: 0.5446, test_loss: 1.2974, test_f1: 0.6165
 epoch: 65, train_loss: 0.5543, test_loss: 1.3323, test_f1: 0.5994
 epoch: 66, train_loss: 0.5669, test_loss: 1.3760, test_f1: 0.5947
 epoch: 67, train_loss: 0.5326, test_loss: 1.2830, test_f1: 0.6054
 epoch: 68, train_loss: 0.5183, test_loss: 1.3816, test_f1: 0.5655
 epoch: 69, train_loss: 0.5176, test_loss: 1.3249, test_f1: 0.5957
 epoch: 70, train_loss: 0.5184, test_loss: 1.3609, test_f1: 0.5930
 epoch: 71, train_loss: 0.5119, test_loss: 1.3206, test_f1: 0.6128
 epoch: 72, train_loss: 0.5072, test_loss: 1.4417, test_f1: 0.6022
 epoch: 73, train_loss: 0.5077, test_loss: 1.4356, test_f1: 0.5838
 epoch: 74, train_loss: 0.5121, test_loss: 1.4128, test_f1: 0.5680
 epoch: 75, train_loss: 0.4923, test_loss: 1.4189, test_f1: 0.5917
 epoch: 76, train_loss: 0.4775, test_loss: 1.4085, test_f1: 0.5858
 epoch: 77, train_loss: 0.5181, test_loss: 1.4550, test_f1: 0.5928
 epoch: 78, train_loss: 0.5069, test_loss: 1.4797, test_f1: 0.5872
 epoch: 79, train_loss: 0.4835, test_loss: 1.3851, test_f1: 0.5936
 epoch: 80, train_loss: 0.4625, test_loss: 1.4534, test_f1: 0.5833
 epoch: 81, train_loss: 0.4683, test_loss: 1.4334, test_f1: 0.5789
 epoch: 82, train_loss: 0.4772, test_loss: 1.4529, test_f1: 0.5914
 epoch: 83, train_loss: 0.4720, test_loss: 1.5342, test_f1: 0.5929
 epoch: 84, train_loss: 0.4831, test_loss: 1.4417, test_f1: 0.5888
 epoch: 85, train_loss: 0.4798, test_loss: 1.4344, test_f1: 0.6068
 epoch: 86, train_loss: 0.4670, test_loss: 1.6022, test_f1: 0.5851
 epoch: 87, train_loss: 0.4604, test_loss: 1.5621, test_f1: 0.5666
 epoch: 88, train_loss: 0.4634, test_loss: 1.5882, test_f1: 0.5823
 epoch: 89, train_loss: 0.4460, test_loss: 1.6622, test_f1: 0.5887
 epoch: 90, train_loss: 0.4769, test_loss: 1.6113, test_f1: 0.5948
 epoch: 91, train_loss: 0.4757, test_loss: 1.4679, test_f1: 0.6072
 epoch: 92, train_loss: 0.4944, test_loss: 1.5566, test_f1: 0.6157
 epoch: 93, train_loss: 0.4463, test_loss: 1.5387, test_f1: 0.5819
 epoch: 94, train_loss: 0.4305, test_loss: 1.6330, test_f1: 0.5844
 epoch: 95, train_loss: 0.4233, test_loss: 1.5602, test_f1: 0.5971
 epoch: 96, train_loss: 0.4492, test_loss: 1.5378, test_f1: 0.5987
 epoch: 97, train_loss: 0.4141, test_loss: 1.6084, test_f1: 0.5847
 epoch: 98, train_loss: 0.4322, test_loss: 1.6322, test_f1: 0.5966
 epoch: 99, train_loss: 0.4421, test_loss: 1.6241, test_f1: 0.6011
##################ITERATION #6 ****************************************
 epoch: 0, train_loss: 1.4543, test_loss: 1.3378, test_f1: 0.2489
 epoch: 1, train_loss: 1.1743, test_loss: 1.2614, test_f1: 0.3157
 epoch: 2, train_loss: 1.1054, test_loss: 1.2188, test_f1: 0.4268
 epoch: 3, train_loss: 1.0771, test_loss: 1.1431, test_f1: 0.4725
 epoch: 4, train_loss: 1.0599, test_loss: 1.1146, test_f1: 0.5251
 epoch: 5, train_loss: 1.0178, test_loss: 1.0981, test_f1: 0.4981
 epoch: 6, train_loss: 1.0073, test_loss: 1.0859, test_f1: 0.4993
 epoch: 7, train_loss: 1.0026, test_loss: 1.0499, test_f1: 0.5175
 epoch: 8, train_loss: 0.9818, test_loss: 1.0706, test_f1: 0.5354
 epoch: 9, train_loss: 0.9595, test_loss: 1.0253, test_f1: 0.5575
 epoch: 10, train_loss: 0.9540, test_loss: 1.0041, test_f1: 0.5557
 epoch: 11, train_loss: 0.9445, test_loss: 0.9931, test_f1: 0.5617
 epoch: 12, train_loss: 0.9354, test_loss: 1.0141, test_f1: 0.5608
 epoch: 13, train_loss: 0.9168, test_loss: 0.9914, test_f1: 0.5808
 epoch: 14, train_loss: 0.8990, test_loss: 1.0050, test_f1: 0.5857
 epoch: 15, train_loss: 0.8751, test_loss: 0.9776, test_f1: 0.6051
 epoch: 16, train_loss: 0.8763, test_loss: 0.9944, test_f1: 0.5694
 epoch: 17, train_loss: 0.8780, test_loss: 0.9697, test_f1: 0.5821
 epoch: 18, train_loss: 0.8688, test_loss: 0.9643, test_f1: 0.5932
 epoch: 19, train_loss: 0.8473, test_loss: 0.9506, test_f1: 0.6341
 epoch: 20, train_loss: 0.8555, test_loss: 1.0042, test_f1: 0.5970
 epoch: 21, train_loss: 0.8280, test_loss: 0.9661, test_f1: 0.6081
 epoch: 22, train_loss: 0.8311, test_loss: 0.9208, test_f1: 0.6331
 epoch: 23, train_loss: 0.8285, test_loss: 0.9898, test_f1: 0.6291
 epoch: 24, train_loss: 0.8230, test_loss: 0.9636, test_f1: 0.6064
 epoch: 25, train_loss: 0.8197, test_loss: 0.9896, test_f1: 0.6059
 epoch: 26, train_loss: 0.8075, test_loss: 0.9814, test_f1: 0.6358
 epoch: 27, train_loss: 0.7917, test_loss: 0.9850, test_f1: 0.6104
 epoch: 28, train_loss: 0.7859, test_loss: 1.0018, test_f1: 0.5990
 epoch: 29, train_loss: 0.7836, test_loss: 1.0006, test_f1: 0.6102
 epoch: 30, train_loss: 0.7865, test_loss: 1.0192, test_f1: 0.6298
 epoch: 31, train_loss: 0.7596, test_loss: 1.0335, test_f1: 0.6022
 epoch: 32, train_loss: 0.7664, test_loss: 1.1163, test_f1: 0.5614
 epoch: 33, train_loss: 0.7394, test_loss: 1.0470, test_f1: 0.6117
 epoch: 34, train_loss: 0.7518, test_loss: 1.1618, test_f1: 0.5968
 epoch: 35, train_loss: 0.7621, test_loss: 1.1485, test_f1: 0.6005
 epoch: 36, train_loss: 0.7372, test_loss: 0.9974, test_f1: 0.6332
 epoch: 37, train_loss: 0.7606, test_loss: 1.0506, test_f1: 0.5907
 epoch: 38, train_loss: 0.7223, test_loss: 0.9989, test_f1: 0.6229
 epoch: 39, train_loss: 0.7046, test_loss: 1.0467, test_f1: 0.6302
 epoch: 40, train_loss: 0.6948, test_loss: 1.1348, test_f1: 0.5862
 epoch: 41, train_loss: 0.7132, test_loss: 0.9924, test_f1: 0.6253
 epoch: 42, train_loss: 0.6979, test_loss: 1.1318, test_f1: 0.6138
 epoch: 43, train_loss: 0.7030, test_loss: 1.0345, test_f1: 0.6019
 epoch: 44, train_loss: 0.6856, test_loss: 1.0553, test_f1: 0.6293
 epoch: 45, train_loss: 0.6999, test_loss: 1.0373, test_f1: 0.5686
 epoch: 46, train_loss: 0.6781, test_loss: 1.2764, test_f1: 0.6012
 epoch: 47, train_loss: 0.6784, test_loss: 1.1386, test_f1: 0.5700
 epoch: 48, train_loss: 0.6785, test_loss: 1.0921, test_f1: 0.5881
 epoch: 49, train_loss: 0.6650, test_loss: 1.0639, test_f1: 0.6340
 epoch: 50, train_loss: 0.6592, test_loss: 1.0932, test_f1: 0.6512
 epoch: 51, train_loss: 0.6363, test_loss: 1.1179, test_f1: 0.6191
 epoch: 52, train_loss: 0.6104, test_loss: 1.1298, test_f1: 0.5947
 epoch: 53, train_loss: 0.6378, test_loss: 1.2339, test_f1: 0.6135
 epoch: 54, train_loss: 0.6199, test_loss: 1.1185, test_f1: 0.5777
 epoch: 55, train_loss: 0.6273, test_loss: 1.1392, test_f1: 0.6490
 epoch: 56, train_loss: 0.6182, test_loss: 1.1559, test_f1: 0.5964
 epoch: 57, train_loss: 0.6053, test_loss: 1.1772, test_f1: 0.6429
 epoch: 58, train_loss: 0.6064, test_loss: 1.0795, test_f1: 0.6090
 epoch: 59, train_loss: 0.6112, test_loss: 1.1379, test_f1: 0.6384
 epoch: 60, train_loss: 0.5901, test_loss: 1.1273, test_f1: 0.6262
 epoch: 61, train_loss: 0.5867, test_loss: 1.1076, test_f1: 0.6133
 epoch: 62, train_loss: 0.5860, test_loss: 1.1769, test_f1: 0.5766
 epoch: 63, train_loss: 0.5812, test_loss: 1.1908, test_f1: 0.6132
 epoch: 64, train_loss: 0.5674, test_loss: 1.2030, test_f1: 0.6295
 epoch: 65, train_loss: 0.5820, test_loss: 1.1549, test_f1: 0.6046
 epoch: 66, train_loss: 0.5604, test_loss: 1.1908, test_f1: 0.6055
 epoch: 67, train_loss: 0.5594, test_loss: 1.2042, test_f1: 0.5806
 epoch: 68, train_loss: 0.5661, test_loss: 1.2470, test_f1: 0.6191
 epoch: 69, train_loss: 0.5910, test_loss: 1.2078, test_f1: 0.6125
 epoch: 70, train_loss: 0.5776, test_loss: 1.2861, test_f1: 0.5953
 epoch: 71, train_loss: 0.5504, test_loss: 1.1731, test_f1: 0.6162
 epoch: 72, train_loss: 0.5578, test_loss: 1.2242, test_f1: 0.5895
 epoch: 73, train_loss: 0.5372, test_loss: 1.2182, test_f1: 0.6409
 epoch: 74, train_loss: 0.5590, test_loss: 1.2264, test_f1: 0.6261
 epoch: 75, train_loss: 0.5545, test_loss: 1.1810, test_f1: 0.5933
 epoch: 76, train_loss: 0.5474, test_loss: 1.2438, test_f1: 0.6211
 epoch: 77, train_loss: 0.5452, test_loss: 1.3001, test_f1: 0.5801
 epoch: 78, train_loss: 0.5412, test_loss: 1.3079, test_f1: 0.5983
 epoch: 79, train_loss: 0.5389, test_loss: 1.2989, test_f1: 0.6291
 epoch: 80, train_loss: 0.5206, test_loss: 1.3021, test_f1: 0.5880
 epoch: 81, train_loss: 0.5374, test_loss: 1.3798, test_f1: 0.5952
 epoch: 82, train_loss: 0.5302, test_loss: 1.2562, test_f1: 0.5987
 epoch: 83, train_loss: 0.5314, test_loss: 1.3419, test_f1: 0.5974
 epoch: 84, train_loss: 0.5337, test_loss: 1.3140, test_f1: 0.5904
 epoch: 85, train_loss: 0.5184, test_loss: 1.2901, test_f1: 0.5880
 epoch: 86, train_loss: 0.5320, test_loss: 1.3261, test_f1: 0.5984
 epoch: 87, train_loss: 0.5224, test_loss: 1.4337, test_f1: 0.6115
 epoch: 88, train_loss: 0.5239, test_loss: 1.3585, test_f1: 0.6165
 epoch: 89, train_loss: 0.5149, test_loss: 1.3908, test_f1: 0.6272
 epoch: 90, train_loss: 0.5086, test_loss: 1.3662, test_f1: 0.6057
 epoch: 91, train_loss: 0.5125, test_loss: 1.3309, test_f1: 0.6260
 epoch: 92, train_loss: 0.4984, test_loss: 1.3785, test_f1: 0.5773
 epoch: 93, train_loss: 0.5021, test_loss: 1.3743, test_f1: 0.5895
 epoch: 94, train_loss: 0.4946, test_loss: 1.5074, test_f1: 0.6548
 epoch: 95, train_loss: 0.5084, test_loss: 1.3428, test_f1: 0.5805
 epoch: 96, train_loss: 0.4969, test_loss: 1.4483, test_f1: 0.5926
 epoch: 97, train_loss: 0.5081, test_loss: 1.4910, test_f1: 0.6425
 epoch: 98, train_loss: 0.4937, test_loss: 1.4600, test_f1: 0.6282
 epoch: 99, train_loss: 0.4836, test_loss: 1.4104, test_f1: 0.6199
##################ITERATION #7 ****************************************
 epoch: 0, train_loss: 1.4860, test_loss: 1.2554, test_f1: 0.3253
 epoch: 1, train_loss: 1.1942, test_loss: 1.1989, test_f1: 0.4162
 epoch: 2, train_loss: 1.0976, test_loss: 1.1278, test_f1: 0.4825
 epoch: 3, train_loss: 1.0710, test_loss: 1.1091, test_f1: 0.4941
 epoch: 4, train_loss: 1.0311, test_loss: 1.1052, test_f1: 0.5091
 epoch: 5, train_loss: 1.0100, test_loss: 1.1000, test_f1: 0.5193
 epoch: 6, train_loss: 0.9704, test_loss: 1.0991, test_f1: 0.5288
 epoch: 7, train_loss: 0.9555, test_loss: 1.1035, test_f1: 0.5166
 epoch: 8, train_loss: 0.9378, test_loss: 1.0805, test_f1: 0.5651
 epoch: 9, train_loss: 0.9278, test_loss: 1.0820, test_f1: 0.5215
 epoch: 10, train_loss: 0.9214, test_loss: 1.0992, test_f1: 0.5702
 epoch: 11, train_loss: 0.9221, test_loss: 1.0413, test_f1: 0.5639
 epoch: 12, train_loss: 0.8853, test_loss: 1.1041, test_f1: 0.5435
 epoch: 13, train_loss: 0.8694, test_loss: 1.0776, test_f1: 0.5750
 epoch: 14, train_loss: 0.8498, test_loss: 1.0983, test_f1: 0.5635
 epoch: 15, train_loss: 0.8708, test_loss: 1.1056, test_f1: 0.5524
 epoch: 16, train_loss: 0.8553, test_loss: 1.0394, test_f1: 0.5724
 epoch: 17, train_loss: 0.8407, test_loss: 1.0659, test_f1: 0.5721
 epoch: 18, train_loss: 0.8169, test_loss: 1.1270, test_f1: 0.5382
 epoch: 19, train_loss: 0.7940, test_loss: 1.1247, test_f1: 0.5759
 epoch: 20, train_loss: 0.8031, test_loss: 1.0890, test_f1: 0.5969
 epoch: 21, train_loss: 0.7773, test_loss: 1.0905, test_f1: 0.5616
 epoch: 22, train_loss: 0.8088, test_loss: 1.1055, test_f1: 0.5681
 epoch: 23, train_loss: 0.7914, test_loss: 1.1812, test_f1: 0.5172
 epoch: 24, train_loss: 0.7777, test_loss: 1.1220, test_f1: 0.5670
 epoch: 25, train_loss: 0.7562, test_loss: 1.1546, test_f1: 0.6076
 epoch: 26, train_loss: 0.7473, test_loss: 1.2096, test_f1: 0.5806
 epoch: 27, train_loss: 0.7538, test_loss: 1.1667, test_f1: 0.5612
 epoch: 28, train_loss: 0.7496, test_loss: 1.2043, test_f1: 0.5867
 epoch: 29, train_loss: 0.7346, test_loss: 1.1748, test_f1: 0.5960
 epoch: 30, train_loss: 0.7339, test_loss: 1.1259, test_f1: 0.5647
 epoch: 31, train_loss: 0.7383, test_loss: 1.1648, test_f1: 0.5921
 epoch: 32, train_loss: 0.7098, test_loss: 1.2239, test_f1: 0.5940
 epoch: 33, train_loss: 0.6939, test_loss: 1.2097, test_f1: 0.5804
 epoch: 34, train_loss: 0.7103, test_loss: 1.1364, test_f1: 0.5937
 epoch: 35, train_loss: 0.7174, test_loss: 1.2507, test_f1: 0.5677
 epoch: 36, train_loss: 0.7130, test_loss: 1.1849, test_f1: 0.6278
 epoch: 37, train_loss: 0.6895, test_loss: 1.2920, test_f1: 0.5561
 epoch: 38, train_loss: 0.6730, test_loss: 1.1846, test_f1: 0.5957
 epoch: 39, train_loss: 0.6765, test_loss: 1.1876, test_f1: 0.6237
 epoch: 40, train_loss: 0.6808, test_loss: 1.1996, test_f1: 0.6133
 epoch: 41, train_loss: 0.6526, test_loss: 1.2733, test_f1: 0.6008
 epoch: 42, train_loss: 0.6641, test_loss: 1.2183, test_f1: 0.6056
 epoch: 43, train_loss: 0.6792, test_loss: 1.1906, test_f1: 0.5920
 epoch: 44, train_loss: 0.6621, test_loss: 1.4020, test_f1: 0.5835
 epoch: 45, train_loss: 0.6609, test_loss: 1.2203, test_f1: 0.6081
 epoch: 46, train_loss: 0.6297, test_loss: 1.2371, test_f1: 0.5765
 epoch: 47, train_loss: 0.6452, test_loss: 1.3768, test_f1: 0.5705
 epoch: 48, train_loss: 0.6178, test_loss: 1.2516, test_f1: 0.5777
 epoch: 49, train_loss: 0.6071, test_loss: 1.3668, test_f1: 0.5934
 epoch: 50, train_loss: 0.6224, test_loss: 1.3958, test_f1: 0.5798
 epoch: 51, train_loss: 0.5955, test_loss: 1.2871, test_f1: 0.5825
 epoch: 52, train_loss: 0.5786, test_loss: 1.3105, test_f1: 0.6234
 epoch: 53, train_loss: 0.5833, test_loss: 1.3644, test_f1: 0.5979
 epoch: 54, train_loss: 0.5682, test_loss: 1.3844, test_f1: 0.6133
 epoch: 55, train_loss: 0.5702, test_loss: 1.3689, test_f1: 0.6157
 epoch: 56, train_loss: 0.5662, test_loss: 1.3846, test_f1: 0.5961
 epoch: 57, train_loss: 0.5787, test_loss: 1.4169, test_f1: 0.5857
 epoch: 58, train_loss: 0.5852, test_loss: 1.4277, test_f1: 0.5858
 epoch: 59, train_loss: 0.5666, test_loss: 1.3781, test_f1: 0.5967
 epoch: 60, train_loss: 0.5450, test_loss: 1.4489, test_f1: 0.5884
 epoch: 61, train_loss: 0.5567, test_loss: 1.4299, test_f1: 0.6021
 epoch: 62, train_loss: 0.5362, test_loss: 1.4612, test_f1: 0.6265
 epoch: 63, train_loss: 0.5560, test_loss: 1.4509, test_f1: 0.6024
 epoch: 64, train_loss: 0.5530, test_loss: 1.5444, test_f1: 0.5724
 epoch: 65, train_loss: 0.5317, test_loss: 1.4411, test_f1: 0.5625
 epoch: 66, train_loss: 0.5454, test_loss: 1.4653, test_f1: 0.5982
 epoch: 67, train_loss: 0.5390, test_loss: 1.4658, test_f1: 0.6004
 epoch: 68, train_loss: 0.5355, test_loss: 1.4629, test_f1: 0.5824
 epoch: 69, train_loss: 0.5129, test_loss: 1.6532, test_f1: 0.5625
 epoch: 70, train_loss: 0.5159, test_loss: 1.5237, test_f1: 0.6196
 epoch: 71, train_loss: 0.5088, test_loss: 1.5593, test_f1: 0.5668
 epoch: 72, train_loss: 0.5192, test_loss: 1.5533, test_f1: 0.5758
 epoch: 73, train_loss: 0.5286, test_loss: 1.5149, test_f1: 0.5790
 epoch: 74, train_loss: 0.5142, test_loss: 1.4896, test_f1: 0.5981
 epoch: 75, train_loss: 0.5247, test_loss: 1.4963, test_f1: 0.5921
 epoch: 76, train_loss: 0.5019, test_loss: 1.5907, test_f1: 0.5562
 epoch: 77, train_loss: 0.4887, test_loss: 1.6113, test_f1: 0.5790
 epoch: 78, train_loss: 0.5186, test_loss: 1.6038, test_f1: 0.5553
 epoch: 79, train_loss: 0.4838, test_loss: 1.6138, test_f1: 0.5915
 epoch: 80, train_loss: 0.4989, test_loss: 1.6107, test_f1: 0.5802
 epoch: 81, train_loss: 0.5120, test_loss: 1.6812, test_f1: 0.5587
 epoch: 82, train_loss: 0.5114, test_loss: 1.6377, test_f1: 0.5703
 epoch: 83, train_loss: 0.4750, test_loss: 1.5753, test_f1: 0.5773
 epoch: 84, train_loss: 0.5022, test_loss: 1.6436, test_f1: 0.6089
 epoch: 85, train_loss: 0.4638, test_loss: 1.7114, test_f1: 0.5930
 epoch: 86, train_loss: 0.4592, test_loss: 1.6243, test_f1: 0.5847
 epoch: 87, train_loss: 0.4613, test_loss: 1.6691, test_f1: 0.5715
 epoch: 88, train_loss: 0.5052, test_loss: 1.7294, test_f1: 0.5523
 epoch: 89, train_loss: 0.4960, test_loss: 1.7260, test_f1: 0.5668
 epoch: 90, train_loss: 0.4891, test_loss: 1.7440, test_f1: 0.5840
 epoch: 91, train_loss: 0.4774, test_loss: 1.6198, test_f1: 0.5965
 epoch: 92, train_loss: 0.4756, test_loss: 1.7467, test_f1: 0.5704
 epoch: 93, train_loss: 0.4580, test_loss: 1.7170, test_f1: 0.5639
 epoch: 94, train_loss: 0.4794, test_loss: 1.8202, test_f1: 0.5698
 epoch: 95, train_loss: 0.4769, test_loss: 1.8044, test_f1: 0.5425
 epoch: 96, train_loss: 0.4498, test_loss: 1.8066, test_f1: 0.5548
 epoch: 97, train_loss: 0.4385, test_loss: 1.7025, test_f1: 0.5977
 epoch: 98, train_loss: 0.4395, test_loss: 1.8493, test_f1: 0.5656
 epoch: 99, train_loss: 0.4535, test_loss: 1.7568, test_f1: 0.5929
##################ITERATION #8 ****************************************
 epoch: 0, train_loss: 1.5513, test_loss: 1.4249, test_f1: 0.1422
 epoch: 1, train_loss: 1.1963, test_loss: 1.1887, test_f1: 0.4206
 epoch: 2, train_loss: 1.1119, test_loss: 1.1206, test_f1: 0.4900
 epoch: 3, train_loss: 1.0860, test_loss: 1.1021, test_f1: 0.5175
 epoch: 4, train_loss: 1.0276, test_loss: 1.0841, test_f1: 0.5144
 epoch: 5, train_loss: 1.0270, test_loss: 1.0742, test_f1: 0.5306
 epoch: 6, train_loss: 1.0193, test_loss: 1.0968, test_f1: 0.5214
 epoch: 7, train_loss: 0.9754, test_loss: 1.0811, test_f1: 0.5364
 epoch: 8, train_loss: 0.9563, test_loss: 1.0514, test_f1: 0.5143
 epoch: 9, train_loss: 0.9524, test_loss: 1.0685, test_f1: 0.4831
 epoch: 10, train_loss: 0.9450, test_loss: 1.0364, test_f1: 0.5543
 epoch: 11, train_loss: 0.9259, test_loss: 1.0453, test_f1: 0.5340
 epoch: 12, train_loss: 0.9077, test_loss: 1.0451, test_f1: 0.5344
 epoch: 13, train_loss: 0.8980, test_loss: 0.9991, test_f1: 0.5550
 epoch: 14, train_loss: 0.8835, test_loss: 1.0647, test_f1: 0.5208
 epoch: 15, train_loss: 0.8690, test_loss: 1.0795, test_f1: 0.5614
 epoch: 16, train_loss: 0.8606, test_loss: 1.0477, test_f1: 0.5655
 epoch: 17, train_loss: 0.8578, test_loss: 1.0322, test_f1: 0.5710
 epoch: 18, train_loss: 0.8514, test_loss: 1.0909, test_f1: 0.5540
 epoch: 19, train_loss: 0.8397, test_loss: 1.0499, test_f1: 0.5760
 epoch: 20, train_loss: 0.8380, test_loss: 1.0722, test_f1: 0.6046
 epoch: 21, train_loss: 0.8432, test_loss: 1.0327, test_f1: 0.5991
 epoch: 22, train_loss: 0.8295, test_loss: 1.0338, test_f1: 0.5839
 epoch: 23, train_loss: 0.8172, test_loss: 1.0841, test_f1: 0.5702
 epoch: 24, train_loss: 0.8055, test_loss: 1.0897, test_f1: 0.5263
 epoch: 25, train_loss: 0.8117, test_loss: 1.0817, test_f1: 0.5761
 epoch: 26, train_loss: 0.8001, test_loss: 1.1258, test_f1: 0.5321
 epoch: 27, train_loss: 0.8032, test_loss: 1.1498, test_f1: 0.5690
 epoch: 28, train_loss: 0.7833, test_loss: 1.0200, test_f1: 0.5687
 epoch: 29, train_loss: 0.7724, test_loss: 1.1282, test_f1: 0.5811
 epoch: 30, train_loss: 0.7739, test_loss: 1.0565, test_f1: 0.5932
 epoch: 31, train_loss: 0.7635, test_loss: 1.0325, test_f1: 0.6237
 epoch: 32, train_loss: 0.7498, test_loss: 1.0812, test_f1: 0.5677
 epoch: 33, train_loss: 0.7377, test_loss: 1.2043, test_f1: 0.5488
 epoch: 34, train_loss: 0.7240, test_loss: 1.0985, test_f1: 0.6155
 epoch: 35, train_loss: 0.7211, test_loss: 1.1757, test_f1: 0.5659
 epoch: 36, train_loss: 0.7087, test_loss: 1.0444, test_f1: 0.6108
 epoch: 37, train_loss: 0.7168, test_loss: 1.2276, test_f1: 0.5975
 epoch: 38, train_loss: 0.7238, test_loss: 1.2017, test_f1: 0.6014
 epoch: 39, train_loss: 0.7327, test_loss: 1.0650, test_f1: 0.5685
 epoch: 40, train_loss: 0.7207, test_loss: 1.0553, test_f1: 0.6175
 epoch: 41, train_loss: 0.6922, test_loss: 1.1188, test_f1: 0.6017
 epoch: 42, train_loss: 0.7010, test_loss: 1.1032, test_f1: 0.6094
 epoch: 43, train_loss: 0.6631, test_loss: 1.1193, test_f1: 0.5939
 epoch: 44, train_loss: 0.6671, test_loss: 1.2899, test_f1: 0.5429
 epoch: 45, train_loss: 0.6812, test_loss: 1.2172, test_f1: 0.5419
 epoch: 46, train_loss: 0.6730, test_loss: 1.1822, test_f1: 0.5794
 epoch: 47, train_loss: 0.6634, test_loss: 1.2644, test_f1: 0.5302
 epoch: 48, train_loss: 0.6601, test_loss: 1.1490, test_f1: 0.6318
 epoch: 49, train_loss: 0.6492, test_loss: 1.1746, test_f1: 0.6036
 epoch: 50, train_loss: 0.6497, test_loss: 1.1278, test_f1: 0.5773
 epoch: 51, train_loss: 0.6333, test_loss: 1.1397, test_f1: 0.6057
 epoch: 52, train_loss: 0.6066, test_loss: 1.0779, test_f1: 0.6374
 epoch: 53, train_loss: 0.6120, test_loss: 1.1401, test_f1: 0.6371
 epoch: 54, train_loss: 0.5906, test_loss: 1.1599, test_f1: 0.6088
 epoch: 55, train_loss: 0.5988, test_loss: 1.2091, test_f1: 0.5838
 epoch: 56, train_loss: 0.5801, test_loss: 1.1987, test_f1: 0.6009
 epoch: 57, train_loss: 0.5780, test_loss: 1.1712, test_f1: 0.6063
 epoch: 58, train_loss: 0.6000, test_loss: 1.2445, test_f1: 0.6001
 epoch: 59, train_loss: 0.5674, test_loss: 1.2590, test_f1: 0.5739
 epoch: 60, train_loss: 0.5666, test_loss: 1.2223, test_f1: 0.5993
 epoch: 61, train_loss: 0.5789, test_loss: 1.2090, test_f1: 0.6269
 epoch: 62, train_loss: 0.5631, test_loss: 1.2355, test_f1: 0.6189
 epoch: 63, train_loss: 0.5382, test_loss: 1.2604, test_f1: 0.5886
 epoch: 64, train_loss: 0.5337, test_loss: 1.2153, test_f1: 0.5874
 epoch: 65, train_loss: 0.5664, test_loss: 1.3089, test_f1: 0.6162
 epoch: 66, train_loss: 0.5472, test_loss: 1.3175, test_f1: 0.6159
 epoch: 67, train_loss: 0.5430, test_loss: 1.3094, test_f1: 0.6401
 epoch: 68, train_loss: 0.5348, test_loss: 1.2425, test_f1: 0.5979
 epoch: 69, train_loss: 0.5188, test_loss: 1.3207, test_f1: 0.6163
 epoch: 70, train_loss: 0.5296, test_loss: 1.2860, test_f1: 0.6037
 epoch: 71, train_loss: 0.5208, test_loss: 1.3160, test_f1: 0.6310
 epoch: 72, train_loss: 0.5489, test_loss: 1.2259, test_f1: 0.6041
 epoch: 73, train_loss: 0.5357, test_loss: 1.3498, test_f1: 0.5672
 epoch: 74, train_loss: 0.5463, test_loss: 1.2895, test_f1: 0.6226
 epoch: 75, train_loss: 0.5056, test_loss: 1.3561, test_f1: 0.6086
 epoch: 76, train_loss: 0.5413, test_loss: 1.2694, test_f1: 0.5935
 epoch: 77, train_loss: 0.5008, test_loss: 1.3107, test_f1: 0.6217
 epoch: 78, train_loss: 0.5022, test_loss: 1.3573, test_f1: 0.6195
 epoch: 79, train_loss: 0.5056, test_loss: 1.2929, test_f1: 0.6183
 epoch: 80, train_loss: 0.5084, test_loss: 1.3296, test_f1: 0.5994
 epoch: 81, train_loss: 0.5120, test_loss: 1.3528, test_f1: 0.6357
 epoch: 82, train_loss: 0.4979, test_loss: 1.3035, test_f1: 0.5869
 epoch: 83, train_loss: 0.4862, test_loss: 1.3397, test_f1: 0.6214
 epoch: 84, train_loss: 0.4946, test_loss: 1.3017, test_f1: 0.6256
 epoch: 85, train_loss: 0.4812, test_loss: 1.3566, test_f1: 0.6091
 epoch: 86, train_loss: 0.4665, test_loss: 1.3791, test_f1: 0.6231
 epoch: 87, train_loss: 0.4865, test_loss: 1.3993, test_f1: 0.6172
 epoch: 88, train_loss: 0.4686, test_loss: 1.4812, test_f1: 0.6032
 epoch: 89, train_loss: 0.4520, test_loss: 1.5082, test_f1: 0.5985
 epoch: 90, train_loss: 0.4605, test_loss: 1.3707, test_f1: 0.6061
 epoch: 91, train_loss: 0.4843, test_loss: 1.4685, test_f1: 0.6027
 epoch: 92, train_loss: 0.4494, test_loss: 1.4346, test_f1: 0.6174
 epoch: 93, train_loss: 0.5101, test_loss: 1.4459, test_f1: 0.5747
 epoch: 94, train_loss: 0.4679, test_loss: 1.4592, test_f1: 0.6094
 epoch: 95, train_loss: 0.4578, test_loss: 1.4792, test_f1: 0.6180
 epoch: 96, train_loss: 0.4446, test_loss: 1.4571, test_f1: 0.6068
 epoch: 97, train_loss: 0.4551, test_loss: 1.5203, test_f1: 0.6326
 epoch: 98, train_loss: 0.4376, test_loss: 1.5134, test_f1: 0.5930
 epoch: 99, train_loss: 0.4530, test_loss: 1.4729, test_f1: 0.6043
##################ITERATION #9 ****************************************
 epoch: 0, train_loss: 1.4723, test_loss: 1.3952, test_f1: 0.1478
 epoch: 1, train_loss: 1.1496, test_loss: 1.2457, test_f1: 0.2852
 epoch: 2, train_loss: 1.1291, test_loss: 1.1190, test_f1: 0.4789
 epoch: 3, train_loss: 1.0834, test_loss: 1.0700, test_f1: 0.5235
 epoch: 4, train_loss: 1.0606, test_loss: 1.1017, test_f1: 0.5394
 epoch: 5, train_loss: 1.0316, test_loss: 1.0528, test_f1: 0.5663
 epoch: 6, train_loss: 1.0297, test_loss: 1.0377, test_f1: 0.5778
 epoch: 7, train_loss: 1.0067, test_loss: 1.0453, test_f1: 0.5486
 epoch: 8, train_loss: 0.9730, test_loss: 1.0262, test_f1: 0.5685
 epoch: 9, train_loss: 0.9524, test_loss: 1.0077, test_f1: 0.5807
 epoch: 10, train_loss: 0.9582, test_loss: 1.0022, test_f1: 0.5790
 epoch: 11, train_loss: 0.9438, test_loss: 1.0175, test_f1: 0.5852
 epoch: 12, train_loss: 0.9361, test_loss: 1.0096, test_f1: 0.5790
 epoch: 13, train_loss: 0.9083, test_loss: 1.0086, test_f1: 0.5984
 epoch: 14, train_loss: 0.8941, test_loss: 1.0276, test_f1: 0.5839
 epoch: 15, train_loss: 0.9060, test_loss: 1.0638, test_f1: 0.5294
 epoch: 16, train_loss: 0.9025, test_loss: 1.0162, test_f1: 0.5754
 epoch: 17, train_loss: 0.8851, test_loss: 1.0098, test_f1: 0.5880
 epoch: 18, train_loss: 0.8617, test_loss: 0.9871, test_f1: 0.5950
 epoch: 19, train_loss: 0.8697, test_loss: 1.0194, test_f1: 0.5778
 epoch: 20, train_loss: 0.8540, test_loss: 1.0229, test_f1: 0.5780
 epoch: 21, train_loss: 0.8459, test_loss: 1.0619, test_f1: 0.5997
 epoch: 22, train_loss: 0.8401, test_loss: 1.0513, test_f1: 0.5572
 epoch: 23, train_loss: 0.8499, test_loss: 1.0647, test_f1: 0.5516
 epoch: 24, train_loss: 0.8477, test_loss: 0.9879, test_f1: 0.5818
 epoch: 25, train_loss: 0.8439, test_loss: 1.0494, test_f1: 0.5980
 epoch: 26, train_loss: 0.8289, test_loss: 0.9744, test_f1: 0.6151
 epoch: 27, train_loss: 0.8263, test_loss: 0.9871, test_f1: 0.5855
 epoch: 28, train_loss: 0.8219, test_loss: 1.0631, test_f1: 0.5894
 epoch: 29, train_loss: 0.8349, test_loss: 1.0180, test_f1: 0.5944
 epoch: 30, train_loss: 0.8110, test_loss: 1.0276, test_f1: 0.6042
 epoch: 31, train_loss: 0.7953, test_loss: 1.0271, test_f1: 0.5812
 epoch: 32, train_loss: 0.8081, test_loss: 0.9782, test_f1: 0.6227
 epoch: 33, train_loss: 0.7951, test_loss: 1.0086, test_f1: 0.5878
 epoch: 34, train_loss: 0.7920, test_loss: 1.0396, test_f1: 0.6017
 epoch: 35, train_loss: 0.7663, test_loss: 1.0699, test_f1: 0.5906
 epoch: 36, train_loss: 0.7721, test_loss: 0.9815, test_f1: 0.6266
 epoch: 37, train_loss: 0.7650, test_loss: 1.1715, test_f1: 0.5155
 epoch: 38, train_loss: 0.7815, test_loss: 1.0507, test_f1: 0.5865
 epoch: 39, train_loss: 0.7733, test_loss: 1.0577, test_f1: 0.5989
 epoch: 40, train_loss: 0.7396, test_loss: 1.0604, test_f1: 0.6218
 epoch: 41, train_loss: 0.7605, test_loss: 1.0799, test_f1: 0.5691
 epoch: 42, train_loss: 0.7820, test_loss: 1.0810, test_f1: 0.5739
 epoch: 43, train_loss: 0.7616, test_loss: 1.0262, test_f1: 0.5863
 epoch: 44, train_loss: 0.7273, test_loss: 1.0245, test_f1: 0.5984
 epoch: 45, train_loss: 0.7195, test_loss: 1.1248, test_f1: 0.5581
 epoch: 46, train_loss: 0.7127, test_loss: 1.0123, test_f1: 0.6066
 epoch: 47, train_loss: 0.7145, test_loss: 1.1475, test_f1: 0.5625
 epoch: 48, train_loss: 0.7214, test_loss: 1.0768, test_f1: 0.5789
 epoch: 49, train_loss: 0.7061, test_loss: 1.0797, test_f1: 0.5613
 epoch: 50, train_loss: 0.6987, test_loss: 1.0796, test_f1: 0.6020
 epoch: 51, train_loss: 0.6743, test_loss: 1.0689, test_f1: 0.5896
 epoch: 52, train_loss: 0.6877, test_loss: 1.0757, test_f1: 0.5799
 epoch: 53, train_loss: 0.6749, test_loss: 1.0390, test_f1: 0.6221
 epoch: 54, train_loss: 0.6532, test_loss: 1.0867, test_f1: 0.5973
 epoch: 55, train_loss: 0.6661, test_loss: 1.0634, test_f1: 0.6178
 epoch: 56, train_loss: 0.6395, test_loss: 1.0931, test_f1: 0.5855
 epoch: 57, train_loss: 0.6481, test_loss: 1.0520, test_f1: 0.6169
 epoch: 58, train_loss: 0.6445, test_loss: 1.0582, test_f1: 0.6076
 epoch: 59, train_loss: 0.6355, test_loss: 1.0213, test_f1: 0.5959
 epoch: 60, train_loss: 0.6304, test_loss: 1.0246, test_f1: 0.6043
 epoch: 61, train_loss: 0.6332, test_loss: 1.0252, test_f1: 0.6095
 epoch: 62, train_loss: 0.6355, test_loss: 1.0933, test_f1: 0.6093
 epoch: 63, train_loss: 0.6382, test_loss: 1.1028, test_f1: 0.6247
 epoch: 64, train_loss: 0.6253, test_loss: 1.0561, test_f1: 0.6380
 epoch: 65, train_loss: 0.6137, test_loss: 1.0855, test_f1: 0.6023
 epoch: 66, train_loss: 0.6124, test_loss: 1.0872, test_f1: 0.6130
 epoch: 67, train_loss: 0.6114, test_loss: 1.0752, test_f1: 0.5992
 epoch: 68, train_loss: 0.6278, test_loss: 1.0445, test_f1: 0.6046
 epoch: 69, train_loss: 0.6157, test_loss: 1.2251, test_f1: 0.6017
 epoch: 70, train_loss: 0.6038, test_loss: 1.2117, test_f1: 0.6020
 epoch: 71, train_loss: 0.6176, test_loss: 1.1272, test_f1: 0.5858
 epoch: 72, train_loss: 0.5987, test_loss: 1.1537, test_f1: 0.6025
 epoch: 73, train_loss: 0.5971, test_loss: 1.0420, test_f1: 0.6206
 epoch: 74, train_loss: 0.5849, test_loss: 1.0484, test_f1: 0.6232
 epoch: 75, train_loss: 0.5952, test_loss: 1.1861, test_f1: 0.5673
 epoch: 76, train_loss: 0.5948, test_loss: 1.1192, test_f1: 0.6074
 epoch: 77, train_loss: 0.5990, test_loss: 1.0862, test_f1: 0.6175
 epoch: 78, train_loss: 0.5831, test_loss: 1.1786, test_f1: 0.5986
 epoch: 79, train_loss: 0.5607, test_loss: 1.2066, test_f1: 0.6056
 epoch: 80, train_loss: 0.5705, test_loss: 1.1769, test_f1: 0.6026
 epoch: 81, train_loss: 0.5777, test_loss: 1.2565, test_f1: 0.5843
 epoch: 82, train_loss: 0.5764, test_loss: 1.1572, test_f1: 0.6078
 epoch: 83, train_loss: 0.5657, test_loss: 1.1465, test_f1: 0.5954
 epoch: 84, train_loss: 0.5512, test_loss: 1.1829, test_f1: 0.6125
 epoch: 85, train_loss: 0.5542, test_loss: 1.4189, test_f1: 0.5663
 epoch: 86, train_loss: 0.5671, test_loss: 1.1728, test_f1: 0.6294
 epoch: 87, train_loss: 0.5460, test_loss: 1.2572, test_f1: 0.6006
 epoch: 88, train_loss: 0.5436, test_loss: 1.3041, test_f1: 0.6052
 epoch: 89, train_loss: 0.5472, test_loss: 1.1286, test_f1: 0.6135
 epoch: 90, train_loss: 0.5248, test_loss: 1.2227, test_f1: 0.5876
 epoch: 91, train_loss: 0.5244, test_loss: 1.2198, test_f1: 0.6077
 epoch: 92, train_loss: 0.5412, test_loss: 1.2697, test_f1: 0.6070
 epoch: 93, train_loss: 0.5427, test_loss: 1.1651, test_f1: 0.6212
 epoch: 94, train_loss: 0.5452, test_loss: 1.1773, test_f1: 0.6277
 epoch: 95, train_loss: 0.5226, test_loss: 1.3679, test_f1: 0.6232
 epoch: 96, train_loss: 0.5305, test_loss: 1.3541, test_f1: 0.6219
 epoch: 97, train_loss: 0.5316, test_loss: 1.3107, test_f1: 0.6114
 epoch: 98, train_loss: 0.5144, test_loss: 1.2335, test_f1: 0.6187
 epoch: 99, train_loss: 0.5222, test_loss: 1.2571, test_f1: 0.5984

Training completed in 407.91 seconds
Best F1: 0.6789 at epoch 96
Mean F1 across iterations: 0.6439  0.0171
========================FINAL RESULTS================================
FEGIN weighted F1: 0.6789  0.0171
python main.py --data ltspice_demos --representation component_net --model FEGIN --layers 3 --hiddens 32 --batch_size 64 --lr 0.001 --emb_size 128 --epochs 100 --save_appendix component_net_L3_H32_BS64_LR0.001_E128 --no_val
-----



STDERR:
  File "main.py", line 370, in <module>
    main()
  File "main.py", line 254, in main
    dataset = dataset_class(
  File "/home/philip/projects/ltspice_examples_code_repo/Circuit-Completion-Using-GNNs/component_classification_with_link_prediction_head/evaluation/FEGIN/kernel/circuit_datasets.py", line 15, in __init__
    self.data, self.slices = torch.load(self.processed_paths[0])
  File "/home/philip/.local/lib/python3.8/site-packages/torch/serialization.py", line 1040, in load
    warnings.warn(
  File "/usr/lib/python3.8/warnings.py", line 109, in _showwarnmsg
    sw(msg.message, msg.category, msg.filename, msg.lineno,
  File "main.py", line 47, in warn_with_traceback
    traceback.print_stack(file=log)
/home/philip/projects/ltspice_examples_code_repo/Circuit-Completion-Using-GNNs/component_classification_with_link_prediction_head/evaluation/FEGIN/kernel/circuit_datasets.py:15: FutureWarning: You are using `torch.load` with `weights_only=False` (the current default value), which uses the default pickle module implicitly. It is possible to construct malicious pickle data which will execute arbitrary code during unpickling (See https://github.com/pytorch/pytorch/blob/main/SECURITY.md#untrusted-models for more details). In a future release, the default value for `weights_only` will be flipped to `True`. This limits the functions that could be executed during unpickling. Arbitrary objects will no longer be allowed to be loaded via this mode unless they are explicitly allowlisted by the user via `torch.serialization.add_safe_globals`. We recommend you start setting `weights_only=True` for any use case where you don't have full control of the loaded file. Please open an issue on GitHub for any issues related to this experimental feature.
  self.data, self.slices = torch.load(self.processed_paths[0])
