STDOUT:
Results will be saved in /home/philip/projects/ltspice_examples_code_repo/Circuit-Completion-Using-GNNs/component_classification_with_link_prediction_head/evaluation/FEGIN/results/model_FEGIN_dataset_ltspice_demos
Command line input: python main.py --data ltspice_demos --representation component_pin_net --model FEGIN --layers 2 --hiddens 64 --batch_size 32 --lr 0.01 --emb_size 128 --epochs 100 --save_appendix component_pin_net_L2_H64_BS32_LR0.01_E128 --no_val
 is saved.
-----
ltspice_demos - FEGIN
Using 2 layers, 64 hidden units, h = 2
Loading component_pin_net representation dataset
ENTERED
Training FEGIN on component_pin_net representation
Train: 1565, Test: 383
##################ITERATION #0 ****************************************
 epoch: 0, train_loss: 1.1192, test_loss: 1.1544, test_f1: 0.3395
 epoch: 1, train_loss: 1.0038, test_loss: 1.0871, test_f1: 0.4922
 epoch: 2, train_loss: 0.9841, test_loss: 1.0607, test_f1: 0.4787
 epoch: 3, train_loss: 0.9457, test_loss: 1.1151, test_f1: 0.5149
 epoch: 4, train_loss: 0.9387, test_loss: 1.1087, test_f1: 0.4769
 epoch: 5, train_loss: 0.9383, test_loss: 1.0131, test_f1: 0.4586
 epoch: 6, train_loss: 0.9050, test_loss: 1.0134, test_f1: 0.5404
 epoch: 7, train_loss: 0.8766, test_loss: 0.9438, test_f1: 0.5646
 epoch: 8, train_loss: 0.8673, test_loss: 1.0155, test_f1: 0.4275
 epoch: 9, train_loss: 0.8559, test_loss: 0.9960, test_f1: 0.5103
 epoch: 10, train_loss: 0.8432, test_loss: 1.0354, test_f1: 0.5474
 epoch: 11, train_loss: 0.8062, test_loss: 1.2817, test_f1: 0.4875
 epoch: 12, train_loss: 0.8837, test_loss: 0.9976, test_f1: 0.5331
 epoch: 13, train_loss: 0.8447, test_loss: 1.0267, test_f1: 0.5075
 epoch: 14, train_loss: 0.8289, test_loss: 1.1868, test_f1: 0.4882
 epoch: 15, train_loss: 0.8157, test_loss: 0.9573, test_f1: 0.5709
 epoch: 16, train_loss: 0.8180, test_loss: 0.9355, test_f1: 0.5896
 epoch: 17, train_loss: 0.7936, test_loss: 1.1163, test_f1: 0.4612
 epoch: 18, train_loss: 0.7851, test_loss: 0.9778, test_f1: 0.5567
 epoch: 19, train_loss: 0.7760, test_loss: 0.9547, test_f1: 0.5542
 epoch: 20, train_loss: 0.7698, test_loss: 1.1244, test_f1: 0.5347
 epoch: 21, train_loss: 0.8099, test_loss: 0.9456, test_f1: 0.5831
 epoch: 22, train_loss: 0.7563, test_loss: 1.2936, test_f1: 0.5042
 epoch: 23, train_loss: 0.7516, test_loss: 0.9892, test_f1: 0.5340
 epoch: 24, train_loss: 0.7532, test_loss: 1.6146, test_f1: 0.4953
 epoch: 25, train_loss: 0.7362, test_loss: 1.0337, test_f1: 0.5463
 epoch: 26, train_loss: 0.7203, test_loss: 1.0454, test_f1: 0.6024
 epoch: 27, train_loss: 0.7411, test_loss: 1.0296, test_f1: 0.5958
 epoch: 28, train_loss: 0.6948, test_loss: 1.0825, test_f1: 0.5227
 epoch: 29, train_loss: 0.7023, test_loss: 1.0701, test_f1: 0.5875
 epoch: 30, train_loss: 0.7074, test_loss: 0.9714, test_f1: 0.5881
 epoch: 31, train_loss: 0.7029, test_loss: 1.0018, test_f1: 0.6101
 epoch: 32, train_loss: 0.6753, test_loss: 1.1788, test_f1: 0.5073
 epoch: 33, train_loss: 0.6879, test_loss: 1.0198, test_f1: 0.6073
 epoch: 34, train_loss: 0.6859, test_loss: 1.2724, test_f1: 0.5112
 epoch: 35, train_loss: 0.6841, test_loss: 1.2655, test_f1: 0.5635
 epoch: 36, train_loss: 0.6583, test_loss: 1.1126, test_f1: 0.6006
 epoch: 37, train_loss: 0.6547, test_loss: 1.1169, test_f1: 0.5819
 epoch: 38, train_loss: 0.6421, test_loss: 0.9822, test_f1: 0.6663
 epoch: 39, train_loss: 0.6417, test_loss: 1.1908, test_f1: 0.5994
 epoch: 40, train_loss: 0.6315, test_loss: 1.1539, test_f1: 0.5281
 epoch: 41, train_loss: 0.6298, test_loss: 1.2392, test_f1: 0.5908
 epoch: 42, train_loss: 0.6462, test_loss: 1.2487, test_f1: 0.5787
 epoch: 43, train_loss: 0.6460, test_loss: 1.0902, test_f1: 0.5901
 epoch: 44, train_loss: 0.6173, test_loss: 1.1675, test_f1: 0.5768
 epoch: 45, train_loss: 0.6321, test_loss: 1.1872, test_f1: 0.5804
 epoch: 46, train_loss: 0.6071, test_loss: 1.1698, test_f1: 0.6035
 epoch: 47, train_loss: 0.6199, test_loss: 1.1110, test_f1: 0.6251
 epoch: 48, train_loss: 0.6246, test_loss: 0.9997, test_f1: 0.6565
 epoch: 49, train_loss: 0.5922, test_loss: 1.4974, test_f1: 0.5006
 epoch: 50, train_loss: 0.6064, test_loss: 1.0889, test_f1: 0.5709
 epoch: 51, train_loss: 0.5702, test_loss: 1.2524, test_f1: 0.5964
 epoch: 52, train_loss: 0.5305, test_loss: 1.1024, test_f1: 0.6372
 epoch: 53, train_loss: 0.5642, test_loss: 1.0410, test_f1: 0.6166
 epoch: 54, train_loss: 0.5444, test_loss: 1.1655, test_f1: 0.6604
 epoch: 55, train_loss: 0.5347, test_loss: 1.1691, test_f1: 0.6408
 epoch: 56, train_loss: 0.5238, test_loss: 1.2593, test_f1: 0.6173
 epoch: 57, train_loss: 0.4948, test_loss: 1.1708, test_f1: 0.5976
 epoch: 58, train_loss: 0.4880, test_loss: 1.1780, test_f1: 0.6292
 epoch: 59, train_loss: 0.5117, test_loss: 1.0910, test_f1: 0.6717
 epoch: 60, train_loss: 0.5047, test_loss: 1.1847, test_f1: 0.6134
 epoch: 61, train_loss: 0.5281, test_loss: 1.1804, test_f1: 0.6417
 epoch: 62, train_loss: 0.5133, test_loss: 1.3728, test_f1: 0.6124
 epoch: 63, train_loss: 0.4930, test_loss: 1.3367, test_f1: 0.6269
 epoch: 64, train_loss: 0.4930, test_loss: 1.7419, test_f1: 0.5297
 epoch: 65, train_loss: 0.4920, test_loss: 1.1707, test_f1: 0.5788
 epoch: 66, train_loss: 0.4722, test_loss: 1.5141, test_f1: 0.6215
 epoch: 67, train_loss: 0.4690, test_loss: 1.2865, test_f1: 0.6630
 epoch: 68, train_loss: 0.4254, test_loss: 1.3637, test_f1: 0.6133
 epoch: 69, train_loss: 0.4620, test_loss: 1.2226, test_f1: 0.6304
 epoch: 70, train_loss: 0.4618, test_loss: 1.5586, test_f1: 0.5722
 epoch: 71, train_loss: 0.4564, test_loss: 1.5324, test_f1: 0.6271
 epoch: 72, train_loss: 0.4635, test_loss: 1.5291, test_f1: 0.6179
 epoch: 73, train_loss: 0.4820, test_loss: 1.5795, test_f1: 0.5639
 epoch: 74, train_loss: 0.4872, test_loss: 1.5578, test_f1: 0.5708
 epoch: 75, train_loss: 0.4494, test_loss: 1.4950, test_f1: 0.5918
 epoch: 76, train_loss: 0.4539, test_loss: 1.4170, test_f1: 0.6237
 epoch: 77, train_loss: 0.4565, test_loss: 1.4858, test_f1: 0.5717
 epoch: 78, train_loss: 0.4444, test_loss: 1.3936, test_f1: 0.6242
 epoch: 79, train_loss: 0.4356, test_loss: 1.4934, test_f1: 0.6100
 epoch: 80, train_loss: 0.4329, test_loss: 1.4155, test_f1: 0.6264
 epoch: 81, train_loss: 0.4228, test_loss: 1.5633, test_f1: 0.5693
 epoch: 82, train_loss: 0.4358, test_loss: 1.3614, test_f1: 0.6356
 epoch: 83, train_loss: 0.4171, test_loss: 1.3402, test_f1: 0.6117
 epoch: 84, train_loss: 0.4479, test_loss: 1.3227, test_f1: 0.6074
 epoch: 85, train_loss: 0.4343, test_loss: 1.2594, test_f1: 0.6442
 epoch: 86, train_loss: 0.4161, test_loss: 1.3962, test_f1: 0.5972
 epoch: 87, train_loss: 0.4307, test_loss: 1.3111, test_f1: 0.6368
 epoch: 88, train_loss: 0.3900, test_loss: 1.3910, test_f1: 0.6362
 epoch: 89, train_loss: 0.4454, test_loss: 1.6116, test_f1: 0.6026
 epoch: 90, train_loss: 0.4200, test_loss: 1.6622, test_f1: 0.6081
 epoch: 91, train_loss: 0.3781, test_loss: 1.6830, test_f1: 0.5811
 epoch: 92, train_loss: 0.4208, test_loss: 1.4932, test_f1: 0.6588
 epoch: 93, train_loss: 0.3852, test_loss: 1.5373, test_f1: 0.6290
 epoch: 94, train_loss: 0.4333, test_loss: 1.6750, test_f1: 0.6114
 epoch: 95, train_loss: 0.4148, test_loss: 1.4149, test_f1: 0.6200
 epoch: 96, train_loss: 0.4029, test_loss: 1.4576, test_f1: 0.6368
 epoch: 97, train_loss: 0.3904, test_loss: 1.4057, test_f1: 0.5974
 epoch: 98, train_loss: 0.4021, test_loss: 1.5932, test_f1: 0.6221
 epoch: 99, train_loss: 0.3885, test_loss: 1.6672, test_f1: 0.5814
##################ITERATION #1 ****************************************
 epoch: 0, train_loss: 1.0792, test_loss: 1.2336, test_f1: 0.4590
 epoch: 1, train_loss: 0.9580, test_loss: 1.0534, test_f1: 0.5617
 epoch: 2, train_loss: 0.9052, test_loss: 1.0011, test_f1: 0.5232
 epoch: 3, train_loss: 0.8737, test_loss: 1.0054, test_f1: 0.5043
 epoch: 4, train_loss: 0.8856, test_loss: 1.0556, test_f1: 0.5614
 epoch: 5, train_loss: 0.8661, test_loss: 1.0403, test_f1: 0.5717
 epoch: 6, train_loss: 0.8367, test_loss: 0.9999, test_f1: 0.5568
 epoch: 7, train_loss: 0.8339, test_loss: 1.0442, test_f1: 0.5149
 epoch: 8, train_loss: 0.8802, test_loss: 1.0130, test_f1: 0.5412
 epoch: 9, train_loss: 0.8580, test_loss: 1.2331, test_f1: 0.4319
 epoch: 10, train_loss: 0.8133, test_loss: 0.9760, test_f1: 0.5717
 epoch: 11, train_loss: 0.7963, test_loss: 1.0577, test_f1: 0.4244
 epoch: 12, train_loss: 0.7939, test_loss: 0.9387, test_f1: 0.5483
 epoch: 13, train_loss: 0.8107, test_loss: 0.9894, test_f1: 0.5660
 epoch: 14, train_loss: 0.7899, test_loss: 1.0115, test_f1: 0.5618
 epoch: 15, train_loss: 0.7685, test_loss: 0.9978, test_f1: 0.4539
 epoch: 16, train_loss: 0.7770, test_loss: 1.0941, test_f1: 0.5358
 epoch: 17, train_loss: 0.7952, test_loss: 1.1168, test_f1: 0.4659
 epoch: 18, train_loss: 0.7662, test_loss: 1.0609, test_f1: 0.4657
 epoch: 19, train_loss: 0.7298, test_loss: 1.2137, test_f1: 0.5297
 epoch: 20, train_loss: 0.7399, test_loss: 1.1438, test_f1: 0.5383
 epoch: 21, train_loss: 0.7359, test_loss: 2.1616, test_f1: 0.4784
 epoch: 22, train_loss: 0.7209, test_loss: 1.1306, test_f1: 0.5735
 epoch: 23, train_loss: 0.7283, test_loss: 1.0685, test_f1: 0.5492
 epoch: 24, train_loss: 0.6960, test_loss: 1.4976, test_f1: 0.5693
 epoch: 25, train_loss: 0.6876, test_loss: 1.4105, test_f1: 0.4755
 epoch: 26, train_loss: 0.7114, test_loss: 1.1737, test_f1: 0.5889
 epoch: 27, train_loss: 0.6963, test_loss: 1.4036, test_f1: 0.4755
 epoch: 28, train_loss: 0.7057, test_loss: 1.3170, test_f1: 0.5548
 epoch: 29, train_loss: 0.6619, test_loss: 1.1691, test_f1: 0.5704
 epoch: 30, train_loss: 0.6676, test_loss: 1.2754, test_f1: 0.5833
 epoch: 31, train_loss: 0.6810, test_loss: 1.0849, test_f1: 0.5480
 epoch: 32, train_loss: 0.6808, test_loss: 1.3195, test_f1: 0.5189
 epoch: 33, train_loss: 0.6769, test_loss: 1.5853, test_f1: 0.5690
 epoch: 34, train_loss: 0.6711, test_loss: 1.2214, test_f1: 0.6051
 epoch: 35, train_loss: 0.6381, test_loss: 1.0758, test_f1: 0.5640
 epoch: 36, train_loss: 0.6199, test_loss: 1.1488, test_f1: 0.6049
 epoch: 37, train_loss: 0.6371, test_loss: 1.0659, test_f1: 0.5996
 epoch: 38, train_loss: 0.6695, test_loss: 1.3071, test_f1: 0.5474
 epoch: 39, train_loss: 0.6264, test_loss: 1.0969, test_f1: 0.5964
 epoch: 40, train_loss: 0.6235, test_loss: 1.0762, test_f1: 0.5878
 epoch: 41, train_loss: 0.6156, test_loss: 1.2442, test_f1: 0.6046
 epoch: 42, train_loss: 0.6087, test_loss: 1.4776, test_f1: 0.6023
 epoch: 43, train_loss: 0.6079, test_loss: 4.3286, test_f1: 0.3283
 epoch: 44, train_loss: 0.5944, test_loss: 1.2270, test_f1: 0.6302
 epoch: 45, train_loss: 0.5768, test_loss: 1.2581, test_f1: 0.5976
 epoch: 46, train_loss: 0.6172, test_loss: 1.1551, test_f1: 0.5922
 epoch: 47, train_loss: 0.6132, test_loss: 1.3479, test_f1: 0.5796
 epoch: 48, train_loss: 0.5990, test_loss: 1.1224, test_f1: 0.5553
 epoch: 49, train_loss: 0.5776, test_loss: 1.8217, test_f1: 0.5676
 epoch: 50, train_loss: 0.6000, test_loss: 1.1132, test_f1: 0.6051
 epoch: 51, train_loss: 0.5261, test_loss: 1.1192, test_f1: 0.6469
 epoch: 52, train_loss: 0.5042, test_loss: 1.1901, test_f1: 0.6523
 epoch: 53, train_loss: 0.4929, test_loss: 1.2272, test_f1: 0.6544
 epoch: 54, train_loss: 0.4966, test_loss: 1.3220, test_f1: 0.6034
 epoch: 55, train_loss: 0.4978, test_loss: 1.4877, test_f1: 0.6486
 epoch: 56, train_loss: 0.4837, test_loss: 1.4672, test_f1: 0.6362
 epoch: 57, train_loss: 0.4841, test_loss: 1.3615, test_f1: 0.5875
 epoch: 58, train_loss: 0.5080, test_loss: 1.4617, test_f1: 0.6064
 epoch: 59, train_loss: 0.4835, test_loss: 1.7227, test_f1: 0.6320
 epoch: 60, train_loss: 0.5037, test_loss: 1.3716, test_f1: 0.6393
 epoch: 61, train_loss: 0.4771, test_loss: 1.3187, test_f1: 0.6163
 epoch: 62, train_loss: 0.4921, test_loss: 1.3770, test_f1: 0.6159
 epoch: 63, train_loss: 0.4550, test_loss: 1.4933, test_f1: 0.6617
 epoch: 64, train_loss: 0.4674, test_loss: 1.3456, test_f1: 0.6354
 epoch: 65, train_loss: 0.4621, test_loss: 1.5613, test_f1: 0.6379
 epoch: 66, train_loss: 0.4474, test_loss: 1.4391, test_f1: 0.6528
 epoch: 67, train_loss: 0.4599, test_loss: 1.4077, test_f1: 0.6435
 epoch: 68, train_loss: 0.4692, test_loss: 1.5722, test_f1: 0.6413
 epoch: 69, train_loss: 0.4625, test_loss: 1.6128, test_f1: 0.6417
 epoch: 70, train_loss: 0.4354, test_loss: 1.4782, test_f1: 0.6297
 epoch: 71, train_loss: 0.4175, test_loss: 1.8524, test_f1: 0.6377
 epoch: 72, train_loss: 0.4706, test_loss: 1.3913, test_f1: 0.6262
 epoch: 73, train_loss: 0.4208, test_loss: 1.5461, test_f1: 0.6391
 epoch: 74, train_loss: 0.4524, test_loss: 1.7113, test_f1: 0.6503
 epoch: 75, train_loss: 0.4376, test_loss: 1.3450, test_f1: 0.6308
 epoch: 76, train_loss: 0.4253, test_loss: 1.6042, test_f1: 0.5988
 epoch: 77, train_loss: 0.4264, test_loss: 1.4138, test_f1: 0.6312
 epoch: 78, train_loss: 0.4637, test_loss: 1.6100, test_f1: 0.6090
 epoch: 79, train_loss: 0.4312, test_loss: 1.8545, test_f1: 0.6295
 epoch: 80, train_loss: 0.4103, test_loss: 1.7198, test_f1: 0.6127
 epoch: 81, train_loss: 0.4187, test_loss: 1.5258, test_f1: 0.6301
 epoch: 82, train_loss: 0.4498, test_loss: 1.4143, test_f1: 0.6178
 epoch: 83, train_loss: 0.3905, test_loss: 1.5181, test_f1: 0.6219
 epoch: 84, train_loss: 0.4229, test_loss: 1.9204, test_f1: 0.6074
 epoch: 85, train_loss: 0.4319, test_loss: 1.6342, test_f1: 0.5690
 epoch: 86, train_loss: 0.4094, test_loss: 1.7455, test_f1: 0.6627
 epoch: 87, train_loss: 0.4247, test_loss: 1.4216, test_f1: 0.6515
 epoch: 88, train_loss: 0.4134, test_loss: 1.7099, test_f1: 0.6705
 epoch: 89, train_loss: 0.4003, test_loss: 1.6330, test_f1: 0.6332
 epoch: 90, train_loss: 0.4013, test_loss: 1.5792, test_f1: 0.6337
 epoch: 91, train_loss: 0.4243, test_loss: 1.8236, test_f1: 0.6420
 epoch: 92, train_loss: 0.4506, test_loss: 1.3578, test_f1: 0.6316
 epoch: 93, train_loss: 0.4241, test_loss: 1.4913, test_f1: 0.6269
 epoch: 94, train_loss: 0.3817, test_loss: 1.4911, test_f1: 0.6346
 epoch: 95, train_loss: 0.3832, test_loss: 1.5212, test_f1: 0.6412
 epoch: 96, train_loss: 0.3833, test_loss: 1.6314, test_f1: 0.6377
 epoch: 97, train_loss: 0.4195, test_loss: 1.8818, test_f1: 0.6386
 epoch: 98, train_loss: 0.3685, test_loss: 1.6673, test_f1: 0.6360
 epoch: 99, train_loss: 0.4011, test_loss: 1.8810, test_f1: 0.6314
##################ITERATION #2 ****************************************
 epoch: 0, train_loss: 1.0843, test_loss: 1.1649, test_f1: 0.4792
 epoch: 1, train_loss: 0.9419, test_loss: 1.0008, test_f1: 0.5412
 epoch: 2, train_loss: 0.8895, test_loss: 1.0863, test_f1: 0.4181
 epoch: 3, train_loss: 0.8955, test_loss: 0.9763, test_f1: 0.5416
 epoch: 4, train_loss: 0.8693, test_loss: 1.0322, test_f1: 0.5235
 epoch: 5, train_loss: 0.9264, test_loss: 1.0338, test_f1: 0.5381
 epoch: 6, train_loss: 0.8657, test_loss: 1.0800, test_f1: 0.4206
 epoch: 7, train_loss: 0.8573, test_loss: 0.9979, test_f1: 0.5650
 epoch: 8, train_loss: 0.8581, test_loss: 1.0223, test_f1: 0.5520
 epoch: 9, train_loss: 0.8441, test_loss: 1.1203, test_f1: 0.4762
 epoch: 10, train_loss: 0.8411, test_loss: 1.0177, test_f1: 0.5992
 epoch: 11, train_loss: 0.8337, test_loss: 0.9732, test_f1: 0.5160
 epoch: 12, train_loss: 0.8375, test_loss: 0.9236, test_f1: 0.5424
 epoch: 13, train_loss: 0.7982, test_loss: 1.4086, test_f1: 0.4568
 epoch: 14, train_loss: 0.8182, test_loss: 1.1255, test_f1: 0.4230
 epoch: 15, train_loss: 0.8331, test_loss: 0.9949, test_f1: 0.5762
 epoch: 16, train_loss: 0.7958, test_loss: 2.4745, test_f1: 0.4240
 epoch: 17, train_loss: 0.8015, test_loss: 1.1151, test_f1: 0.5496
 epoch: 18, train_loss: 0.7924, test_loss: 0.9712, test_f1: 0.6273
 epoch: 19, train_loss: 0.7765, test_loss: 1.0393, test_f1: 0.5666
 epoch: 20, train_loss: 0.7664, test_loss: 1.0089, test_f1: 0.6235
 epoch: 21, train_loss: 0.7429, test_loss: 1.2205, test_f1: 0.5469
 epoch: 22, train_loss: 0.7507, test_loss: 1.0682, test_f1: 0.5426
 epoch: 23, train_loss: 0.7602, test_loss: 1.0418, test_f1: 0.5976
 epoch: 24, train_loss: 0.7724, test_loss: 0.9946, test_f1: 0.5543
 epoch: 25, train_loss: 0.7293, test_loss: 1.1886, test_f1: 0.5621
 epoch: 26, train_loss: 0.7361, test_loss: 1.2705, test_f1: 0.5713
 epoch: 27, train_loss: 0.7368, test_loss: 1.1827, test_f1: 0.5628
 epoch: 28, train_loss: 0.7297, test_loss: 1.0563, test_f1: 0.5399
 epoch: 29, train_loss: 0.7169, test_loss: 0.9774, test_f1: 0.6161
 epoch: 30, train_loss: 0.6961, test_loss: 1.2226, test_f1: 0.5156
 epoch: 31, train_loss: 0.6965, test_loss: 1.0083, test_f1: 0.6552
 epoch: 32, train_loss: 0.7055, test_loss: 1.1250, test_f1: 0.5275
 epoch: 33, train_loss: 0.7108, test_loss: 1.0220, test_f1: 0.5913
 epoch: 34, train_loss: 0.7086, test_loss: 1.0434, test_f1: 0.5851
 epoch: 35, train_loss: 0.6654, test_loss: 1.8021, test_f1: 0.5113
 epoch: 36, train_loss: 0.6603, test_loss: 0.9788, test_f1: 0.6100
 epoch: 37, train_loss: 0.6749, test_loss: 1.0897, test_f1: 0.6090
 epoch: 38, train_loss: 0.6492, test_loss: 1.0475, test_f1: 0.6287
 epoch: 39, train_loss: 0.6284, test_loss: 1.4717, test_f1: 0.5242
 epoch: 40, train_loss: 0.6726, test_loss: 1.0707, test_f1: 0.5609
 epoch: 41, train_loss: 0.6513, test_loss: 0.9980, test_f1: 0.6395
 epoch: 42, train_loss: 0.6628, test_loss: 0.9797, test_f1: 0.6147
 epoch: 43, train_loss: 0.6382, test_loss: 1.3963, test_f1: 0.5361
 epoch: 44, train_loss: 0.6412, test_loss: 1.3625, test_f1: 0.5937
 epoch: 45, train_loss: 0.6220, test_loss: 1.0835, test_f1: 0.6427
 epoch: 46, train_loss: 0.6331, test_loss: 1.4419, test_f1: 0.5603
 epoch: 47, train_loss: 0.6393, test_loss: 1.1671, test_f1: 0.6054
 epoch: 48, train_loss: 0.6467, test_loss: 1.1637, test_f1: 0.5621
 epoch: 49, train_loss: 0.6189, test_loss: 1.1526, test_f1: 0.6032
 epoch: 50, train_loss: 0.6137, test_loss: 1.0343, test_f1: 0.6373
 epoch: 51, train_loss: 0.5767, test_loss: 1.1157, test_f1: 0.6380
 epoch: 52, train_loss: 0.5462, test_loss: 1.2706, test_f1: 0.6196
 epoch: 53, train_loss: 0.5459, test_loss: 1.1622, test_f1: 0.6247
 epoch: 54, train_loss: 0.5257, test_loss: 1.3020, test_f1: 0.6270
 epoch: 55, train_loss: 0.5649, test_loss: 1.1869, test_f1: 0.6089
 epoch: 56, train_loss: 0.5335, test_loss: 1.2460, test_f1: 0.6286
 epoch: 57, train_loss: 0.5608, test_loss: 1.2150, test_f1: 0.6244
 epoch: 58, train_loss: 0.5223, test_loss: 1.3112, test_f1: 0.6341
 epoch: 59, train_loss: 0.5236, test_loss: 1.2027, test_f1: 0.6077
 epoch: 60, train_loss: 0.5160, test_loss: 1.2504, test_f1: 0.6069
 epoch: 61, train_loss: 0.5090, test_loss: 1.4223, test_f1: 0.6315
 epoch: 62, train_loss: 0.5147, test_loss: 1.2130, test_f1: 0.6320
 epoch: 63, train_loss: 0.5131, test_loss: 1.2877, test_f1: 0.6412
 epoch: 64, train_loss: 0.4915, test_loss: 1.2994, test_f1: 0.6160
 epoch: 65, train_loss: 0.5179, test_loss: 1.4619, test_f1: 0.6023
 epoch: 66, train_loss: 0.4849, test_loss: 1.2195, test_f1: 0.6203
 epoch: 67, train_loss: 0.4753, test_loss: 1.5367, test_f1: 0.6536
 epoch: 68, train_loss: 0.4873, test_loss: 1.3574, test_f1: 0.6412
 epoch: 69, train_loss: 0.4810, test_loss: 1.3323, test_f1: 0.6591
 epoch: 70, train_loss: 0.4917, test_loss: 1.3387, test_f1: 0.6080
 epoch: 71, train_loss: 0.4898, test_loss: 1.4934, test_f1: 0.6015
 epoch: 72, train_loss: 0.5034, test_loss: 1.2717, test_f1: 0.6503
 epoch: 73, train_loss: 0.4822, test_loss: 1.3260, test_f1: 0.5968
 epoch: 74, train_loss: 0.4695, test_loss: 1.3101, test_f1: 0.6296
 epoch: 75, train_loss: 0.4678, test_loss: 1.5728, test_f1: 0.6005
 epoch: 76, train_loss: 0.4657, test_loss: 1.4672, test_f1: 0.6524
 epoch: 77, train_loss: 0.4602, test_loss: 1.5897, test_f1: 0.5881
 epoch: 78, train_loss: 0.4379, test_loss: 1.4743, test_f1: 0.6365
 epoch: 79, train_loss: 0.4860, test_loss: 1.6255, test_f1: 0.6223
 epoch: 80, train_loss: 0.4894, test_loss: 1.6767, test_f1: 0.6258
 epoch: 81, train_loss: 0.4452, test_loss: 1.7627, test_f1: 0.6098
 epoch: 82, train_loss: 0.4806, test_loss: 1.4214, test_f1: 0.6017
 epoch: 83, train_loss: 0.4495, test_loss: 1.5259, test_f1: 0.5927
 epoch: 84, train_loss: 0.4470, test_loss: 1.3918, test_f1: 0.6445
 epoch: 85, train_loss: 0.4353, test_loss: 1.5062, test_f1: 0.6267
 epoch: 86, train_loss: 0.4297, test_loss: 1.4227, test_f1: 0.6240
 epoch: 87, train_loss: 0.4511, test_loss: 1.4033, test_f1: 0.6208
 epoch: 88, train_loss: 0.4375, test_loss: 1.5547, test_f1: 0.5948
 epoch: 89, train_loss: 0.4136, test_loss: 1.7005, test_f1: 0.6022
 epoch: 90, train_loss: 0.4302, test_loss: 1.5461, test_f1: 0.5752
 epoch: 91, train_loss: 0.3866, test_loss: 1.7601, test_f1: 0.6018
 epoch: 92, train_loss: 0.4286, test_loss: 1.7353, test_f1: 0.6311
 epoch: 93, train_loss: 0.4312, test_loss: 1.5287, test_f1: 0.6194
 epoch: 94, train_loss: 0.4208, test_loss: 1.4502, test_f1: 0.6406
 epoch: 95, train_loss: 0.4036, test_loss: 1.6944, test_f1: 0.5879
 epoch: 96, train_loss: 0.4179, test_loss: 1.7031, test_f1: 0.6239
 epoch: 97, train_loss: 0.4031, test_loss: 1.6782, test_f1: 0.5790
 epoch: 98, train_loss: 0.3937, test_loss: 1.6848, test_f1: 0.5893
 epoch: 99, train_loss: 0.4028, test_loss: 1.7922, test_f1: 0.6104
##################ITERATION #3 ****************************************
 epoch: 0, train_loss: 1.1260, test_loss: 1.1098, test_f1: 0.3328
 epoch: 1, train_loss: 0.9558, test_loss: 1.0626, test_f1: 0.4159
 epoch: 2, train_loss: 0.8905, test_loss: 1.0971, test_f1: 0.4356
 epoch: 3, train_loss: 0.9062, test_loss: 1.0523, test_f1: 0.4244
 epoch: 4, train_loss: 0.8714, test_loss: 1.0038, test_f1: 0.5623
 epoch: 5, train_loss: 0.8655, test_loss: 0.9817, test_f1: 0.5853
 epoch: 6, train_loss: 0.8440, test_loss: 0.9918, test_f1: 0.5357
 epoch: 7, train_loss: 0.8697, test_loss: 0.9736, test_f1: 0.5676
 epoch: 8, train_loss: 0.8651, test_loss: 0.9788, test_f1: 0.5489
 epoch: 9, train_loss: 0.8452, test_loss: 1.0380, test_f1: 0.5440
 epoch: 10, train_loss: 0.8124, test_loss: 1.0165, test_f1: 0.5160
 epoch: 11, train_loss: 0.8407, test_loss: 0.9910, test_f1: 0.5171
 epoch: 12, train_loss: 0.8268, test_loss: 1.0183, test_f1: 0.5567
 epoch: 13, train_loss: 0.8154, test_loss: 1.0849, test_f1: 0.5971
 epoch: 14, train_loss: 0.8108, test_loss: 0.9665, test_f1: 0.5307
 epoch: 15, train_loss: 0.7996, test_loss: 1.3091, test_f1: 0.4696
 epoch: 16, train_loss: 0.7943, test_loss: 1.0020, test_f1: 0.5566
 epoch: 17, train_loss: 0.7736, test_loss: 1.1137, test_f1: 0.5002
 epoch: 18, train_loss: 0.7728, test_loss: 1.2263, test_f1: 0.5156
 epoch: 19, train_loss: 0.7661, test_loss: 1.2403, test_f1: 0.4964
 epoch: 20, train_loss: 0.8131, test_loss: 0.9756, test_f1: 0.6100
 epoch: 21, train_loss: 0.7809, test_loss: 1.1046, test_f1: 0.5091
 epoch: 22, train_loss: 0.7685, test_loss: 1.1147, test_f1: 0.5529
 epoch: 23, train_loss: 0.7500, test_loss: 1.2585, test_f1: 0.5625
 epoch: 24, train_loss: 0.7630, test_loss: 1.0533, test_f1: 0.5520
 epoch: 25, train_loss: 0.7284, test_loss: 1.2619, test_f1: 0.4095
 epoch: 26, train_loss: 0.7388, test_loss: 0.9938, test_f1: 0.6035
 epoch: 27, train_loss: 0.7195, test_loss: 1.0677, test_f1: 0.5682
 epoch: 28, train_loss: 0.7689, test_loss: 1.3490, test_f1: 0.4400
 epoch: 29, train_loss: 0.7601, test_loss: 1.0648, test_f1: 0.5376
 epoch: 30, train_loss: 0.6971, test_loss: 1.0725, test_f1: 0.6188
 epoch: 31, train_loss: 0.6959, test_loss: 1.0969, test_f1: 0.5508
 epoch: 32, train_loss: 0.6774, test_loss: 1.1409, test_f1: 0.5502
 epoch: 33, train_loss: 0.6924, test_loss: 1.1745, test_f1: 0.5326
 epoch: 34, train_loss: 0.6930, test_loss: 1.3995, test_f1: 0.4848
 epoch: 35, train_loss: 0.6881, test_loss: 1.1070, test_f1: 0.5995
 epoch: 36, train_loss: 0.6984, test_loss: 1.0732, test_f1: 0.5999
 epoch: 37, train_loss: 0.6517, test_loss: 1.1048, test_f1: 0.5907
 epoch: 38, train_loss: 0.6704, test_loss: 1.0484, test_f1: 0.5517
 epoch: 39, train_loss: 0.6620, test_loss: 1.0725, test_f1: 0.6038
 epoch: 40, train_loss: 0.6457, test_loss: 1.4965, test_f1: 0.5049
 epoch: 41, train_loss: 0.6606, test_loss: 1.1539, test_f1: 0.5920
 epoch: 42, train_loss: 0.6202, test_loss: 1.0208, test_f1: 0.6593
 epoch: 43, train_loss: 0.6651, test_loss: 0.9966, test_f1: 0.6340
 epoch: 44, train_loss: 0.6071, test_loss: 1.1975, test_f1: 0.5516
 epoch: 45, train_loss: 0.6213, test_loss: 0.9872, test_f1: 0.6641
 epoch: 46, train_loss: 0.6109, test_loss: 1.2486, test_f1: 0.5123
 epoch: 47, train_loss: 0.6469, test_loss: 0.9976, test_f1: 0.6589
 epoch: 48, train_loss: 0.6172, test_loss: 1.0951, test_f1: 0.6048
 epoch: 49, train_loss: 0.5735, test_loss: 1.2196, test_f1: 0.5763
 epoch: 50, train_loss: 0.5954, test_loss: 1.4356, test_f1: 0.5452
 epoch: 51, train_loss: 0.5822, test_loss: 1.3105, test_f1: 0.6160
 epoch: 52, train_loss: 0.5612, test_loss: 1.1246, test_f1: 0.6299
 epoch: 53, train_loss: 0.5392, test_loss: 1.2069, test_f1: 0.6374
 epoch: 54, train_loss: 0.5236, test_loss: 1.1319, test_f1: 0.6236
 epoch: 55, train_loss: 0.4924, test_loss: 1.2052, test_f1: 0.6357
 epoch: 56, train_loss: 0.5254, test_loss: 1.2127, test_f1: 0.5668
 epoch: 57, train_loss: 0.5295, test_loss: 1.2452, test_f1: 0.5460
 epoch: 58, train_loss: 0.4936, test_loss: 1.3829, test_f1: 0.5764
 epoch: 59, train_loss: 0.5122, test_loss: 1.2122, test_f1: 0.6112
 epoch: 60, train_loss: 0.4703, test_loss: 1.2640, test_f1: 0.6120
 epoch: 61, train_loss: 0.4776, test_loss: 1.4174, test_f1: 0.6187
 epoch: 62, train_loss: 0.4953, test_loss: 1.2390, test_f1: 0.6064
 epoch: 63, train_loss: 0.4930, test_loss: 1.5531, test_f1: 0.5790
 epoch: 64, train_loss: 0.4781, test_loss: 1.5726, test_f1: 0.5965
 epoch: 65, train_loss: 0.4950, test_loss: 1.3248, test_f1: 0.6029
 epoch: 66, train_loss: 0.4668, test_loss: 1.3797, test_f1: 0.5459
 epoch: 67, train_loss: 0.4496, test_loss: 1.3069, test_f1: 0.6047
 epoch: 68, train_loss: 0.4431, test_loss: 1.3893, test_f1: 0.5941
 epoch: 69, train_loss: 0.4357, test_loss: 1.3094, test_f1: 0.6239
 epoch: 70, train_loss: 0.4434, test_loss: 1.4089, test_f1: 0.6015
 epoch: 71, train_loss: 0.4330, test_loss: 1.3208, test_f1: 0.5576
 epoch: 72, train_loss: 0.4418, test_loss: 1.4368, test_f1: 0.5356
 epoch: 73, train_loss: 0.4562, test_loss: 1.4576, test_f1: 0.5637
 epoch: 74, train_loss: 0.4211, test_loss: 1.4521, test_f1: 0.5534
 epoch: 75, train_loss: 0.4656, test_loss: 1.2774, test_f1: 0.6111
 epoch: 76, train_loss: 0.4424, test_loss: 1.4104, test_f1: 0.5982
 epoch: 77, train_loss: 0.4207, test_loss: 1.3599, test_f1: 0.5996
 epoch: 78, train_loss: 0.4562, test_loss: 1.3111, test_f1: 0.5983
 epoch: 79, train_loss: 0.4872, test_loss: 1.3510, test_f1: 0.5868
 epoch: 80, train_loss: 0.4332, test_loss: 1.5984, test_f1: 0.5947
 epoch: 81, train_loss: 0.4442, test_loss: 1.5256, test_f1: 0.5620
 epoch: 82, train_loss: 0.4036, test_loss: 1.4152, test_f1: 0.6097
 epoch: 83, train_loss: 0.4046, test_loss: 1.6755, test_f1: 0.5626
 epoch: 84, train_loss: 0.4246, test_loss: 1.3467, test_f1: 0.6147
 epoch: 85, train_loss: 0.4173, test_loss: 1.3543, test_f1: 0.6211
 epoch: 86, train_loss: 0.4090, test_loss: 1.4074, test_f1: 0.5917
 epoch: 87, train_loss: 0.4015, test_loss: 1.4560, test_f1: 0.5658
 epoch: 88, train_loss: 0.4118, test_loss: 1.3811, test_f1: 0.5816
 epoch: 89, train_loss: 0.3807, test_loss: 1.4461, test_f1: 0.5867
 epoch: 90, train_loss: 0.3866, test_loss: 1.5222, test_f1: 0.5889
 epoch: 91, train_loss: 0.3967, test_loss: 1.6778, test_f1: 0.5959
 epoch: 92, train_loss: 0.3897, test_loss: 1.4833, test_f1: 0.6075
 epoch: 93, train_loss: 0.3586, test_loss: 1.4964, test_f1: 0.6199
 epoch: 94, train_loss: 0.4215, test_loss: 1.5833, test_f1: 0.6137
 epoch: 95, train_loss: 0.3746, test_loss: 1.4809, test_f1: 0.6020
 epoch: 96, train_loss: 0.4161, test_loss: 1.4835, test_f1: 0.5947
 epoch: 97, train_loss: 0.3270, test_loss: 1.7921, test_f1: 0.5708
 epoch: 98, train_loss: 0.4198, test_loss: 1.6463, test_f1: 0.6091
 epoch: 99, train_loss: 0.3694, test_loss: 1.7388, test_f1: 0.6083
##################ITERATION #4 ****************************************
 epoch: 0, train_loss: 1.1423, test_loss: 1.3503, test_f1: 0.2442
 epoch: 1, train_loss: 0.9656, test_loss: 1.0772, test_f1: 0.4886
 epoch: 2, train_loss: 0.9185, test_loss: 0.9774, test_f1: 0.5467
 epoch: 3, train_loss: 0.9197, test_loss: 1.1011, test_f1: 0.4906
 epoch: 4, train_loss: 0.9060, test_loss: 1.0245, test_f1: 0.5172
 epoch: 5, train_loss: 0.8577, test_loss: 1.0672, test_f1: 0.4919
 epoch: 6, train_loss: 0.8700, test_loss: 1.0314, test_f1: 0.5112
 epoch: 7, train_loss: 0.8633, test_loss: 1.1479, test_f1: 0.4752
 epoch: 8, train_loss: 0.8184, test_loss: 1.0817, test_f1: 0.5025
 epoch: 9, train_loss: 0.8266, test_loss: 1.0230, test_f1: 0.4768
 epoch: 10, train_loss: 0.8240, test_loss: 0.9963, test_f1: 0.4654
 epoch: 11, train_loss: 0.8332, test_loss: 1.0464, test_f1: 0.4410
 epoch: 12, train_loss: 0.8411, test_loss: 1.0437, test_f1: 0.4590
 epoch: 13, train_loss: 0.8110, test_loss: 1.1841, test_f1: 0.4284
 epoch: 14, train_loss: 0.7943, test_loss: 0.9759, test_f1: 0.5942
 epoch: 15, train_loss: 0.8099, test_loss: 0.9668, test_f1: 0.5811
 epoch: 16, train_loss: 0.8043, test_loss: 0.9762, test_f1: 0.5518
 epoch: 17, train_loss: 0.7857, test_loss: 0.9853, test_f1: 0.5955
 epoch: 18, train_loss: 0.7770, test_loss: 0.9112, test_f1: 0.5857
 epoch: 19, train_loss: 0.7968, test_loss: 0.9810, test_f1: 0.5203
 epoch: 20, train_loss: 0.7800, test_loss: 1.2077, test_f1: 0.5141
 epoch: 21, train_loss: 0.7811, test_loss: 0.9391, test_f1: 0.5603
 epoch: 22, train_loss: 0.7608, test_loss: 0.9419, test_f1: 0.5654
 epoch: 23, train_loss: 0.7591, test_loss: 0.9424, test_f1: 0.5239
 epoch: 24, train_loss: 0.7390, test_loss: 0.9437, test_f1: 0.6354
 epoch: 25, train_loss: 0.7347, test_loss: 1.0511, test_f1: 0.4425
 epoch: 26, train_loss: 0.7364, test_loss: 0.9956, test_f1: 0.5781
 epoch: 27, train_loss: 0.7057, test_loss: 0.9240, test_f1: 0.5982
 epoch: 28, train_loss: 0.7166, test_loss: 1.0440, test_f1: 0.5265
 epoch: 29, train_loss: 0.7143, test_loss: 1.0909, test_f1: 0.5743
 epoch: 30, train_loss: 0.7064, test_loss: 1.3109, test_f1: 0.4552
 epoch: 31, train_loss: 0.7225, test_loss: 1.1505, test_f1: 0.4588
 epoch: 32, train_loss: 0.7106, test_loss: 0.9780, test_f1: 0.5969
 epoch: 33, train_loss: 0.7036, test_loss: 1.2254, test_f1: 0.5275
 epoch: 34, train_loss: 0.6819, test_loss: 1.2000, test_f1: 0.5557
 epoch: 35, train_loss: 0.6896, test_loss: 1.4746, test_f1: 0.5503
 epoch: 36, train_loss: 0.6624, test_loss: 1.1678, test_f1: 0.5698
 epoch: 37, train_loss: 0.6368, test_loss: 1.0245, test_f1: 0.5849
 epoch: 38, train_loss: 0.6664, test_loss: 0.9907, test_f1: 0.6371
 epoch: 39, train_loss: 0.6592, test_loss: 1.6773, test_f1: 0.5215
 epoch: 40, train_loss: 0.6340, test_loss: 1.1714, test_f1: 0.5915
 epoch: 41, train_loss: 0.6489, test_loss: 1.2881, test_f1: 0.5509
 epoch: 42, train_loss: 0.6583, test_loss: 1.0137, test_f1: 0.6173
 epoch: 43, train_loss: 0.6430, test_loss: 1.2725, test_f1: 0.5293
 epoch: 44, train_loss: 0.6255, test_loss: 1.1694, test_f1: 0.5654
 epoch: 45, train_loss: 0.6013, test_loss: 1.0646, test_f1: 0.5594
 epoch: 46, train_loss: 0.6326, test_loss: 1.0510, test_f1: 0.6049
 epoch: 47, train_loss: 0.6099, test_loss: 1.8356, test_f1: 0.5949
 epoch: 48, train_loss: 0.6253, test_loss: 1.2630, test_f1: 0.5871
 epoch: 49, train_loss: 0.6250, test_loss: 1.2320, test_f1: 0.6085
 epoch: 50, train_loss: 0.6166, test_loss: 1.2630, test_f1: 0.6291
 epoch: 51, train_loss: 0.5793, test_loss: 1.2967, test_f1: 0.6321
 epoch: 52, train_loss: 0.5332, test_loss: 1.4202, test_f1: 0.6300
 epoch: 53, train_loss: 0.5429, test_loss: 1.7136, test_f1: 0.5933
 epoch: 54, train_loss: 0.5341, test_loss: 1.4688, test_f1: 0.5868
 epoch: 55, train_loss: 0.5438, test_loss: 1.1969, test_f1: 0.6281
 epoch: 56, train_loss: 0.5467, test_loss: 1.2780, test_f1: 0.5643
 epoch: 57, train_loss: 0.5099, test_loss: 1.5550, test_f1: 0.5803
 epoch: 58, train_loss: 0.5289, test_loss: 1.2858, test_f1: 0.5775
 epoch: 59, train_loss: 0.5173, test_loss: 1.3358, test_f1: 0.6277
 epoch: 60, train_loss: 0.5068, test_loss: 1.6073, test_f1: 0.6184
 epoch: 61, train_loss: 0.5026, test_loss: 2.0802, test_f1: 0.6096
 epoch: 62, train_loss: 0.5016, test_loss: 1.5939, test_f1: 0.6009
 epoch: 63, train_loss: 0.5013, test_loss: 1.2972, test_f1: 0.6170
 epoch: 64, train_loss: 0.4771, test_loss: 1.3618, test_f1: 0.6023
 epoch: 65, train_loss: 0.4919, test_loss: 1.3358, test_f1: 0.5784
 epoch: 66, train_loss: 0.4577, test_loss: 1.4324, test_f1: 0.5885
 epoch: 67, train_loss: 0.5035, test_loss: 1.4475, test_f1: 0.6023
 epoch: 68, train_loss: 0.4774, test_loss: 1.3798, test_f1: 0.6295
 epoch: 69, train_loss: 0.4735, test_loss: 2.2546, test_f1: 0.5499
 epoch: 70, train_loss: 0.4772, test_loss: 1.3762, test_f1: 0.6309
 epoch: 71, train_loss: 0.4620, test_loss: 1.5277, test_f1: 0.6204
 epoch: 72, train_loss: 0.4536, test_loss: 1.4482, test_f1: 0.6373
 epoch: 73, train_loss: 0.4659, test_loss: 1.6195, test_f1: 0.6314
 epoch: 74, train_loss: 0.4584, test_loss: 1.4846, test_f1: 0.6191
 epoch: 75, train_loss: 0.4373, test_loss: 2.1233, test_f1: 0.6005
 epoch: 76, train_loss: 0.4582, test_loss: 1.6811, test_f1: 0.5984
 epoch: 77, train_loss: 0.4237, test_loss: 1.6330, test_f1: 0.5678
 epoch: 78, train_loss: 0.4590, test_loss: 1.5227, test_f1: 0.5753
 epoch: 79, train_loss: 0.4332, test_loss: 1.8738, test_f1: 0.5878
 epoch: 80, train_loss: 0.4511, test_loss: 1.6491, test_f1: 0.6072
 epoch: 81, train_loss: 0.4505, test_loss: 1.3892, test_f1: 0.5957
 epoch: 82, train_loss: 0.4354, test_loss: 2.0405, test_f1: 0.5860
 epoch: 83, train_loss: 0.4298, test_loss: 1.5942, test_f1: 0.5566
 epoch: 84, train_loss: 0.4291, test_loss: 1.4553, test_f1: 0.5824
 epoch: 85, train_loss: 0.4297, test_loss: 1.4155, test_f1: 0.5866
 epoch: 86, train_loss: 0.4146, test_loss: 1.9261, test_f1: 0.6050
 epoch: 87, train_loss: 0.4116, test_loss: 1.3660, test_f1: 0.6009
 epoch: 88, train_loss: 0.4309, test_loss: 2.8558, test_f1: 0.5328
 epoch: 89, train_loss: 0.4170, test_loss: 1.7940, test_f1: 0.6109
 epoch: 90, train_loss: 0.4432, test_loss: 1.6718, test_f1: 0.5994
 epoch: 91, train_loss: 0.4142, test_loss: 1.5739, test_f1: 0.5909
 epoch: 92, train_loss: 0.3962, test_loss: 1.6595, test_f1: 0.6224
 epoch: 93, train_loss: 0.4034, test_loss: 1.3426, test_f1: 0.6002
 epoch: 94, train_loss: 0.3628, test_loss: 1.8745, test_f1: 0.5820
 epoch: 95, train_loss: 0.4017, test_loss: 1.5979, test_f1: 0.6372
 epoch: 96, train_loss: 0.4267, test_loss: 1.8847, test_f1: 0.5257
 epoch: 97, train_loss: 0.4003, test_loss: 1.7685, test_f1: 0.5979
 epoch: 98, train_loss: 0.3874, test_loss: 1.9618, test_f1: 0.5715
 epoch: 99, train_loss: 0.3917, test_loss: 2.2755, test_f1: 0.5391
##################ITERATION #5 ****************************************
 epoch: 0, train_loss: 1.0607, test_loss: 1.1613, test_f1: 0.4348
 epoch: 1, train_loss: 0.9306, test_loss: 1.1063, test_f1: 0.4218
 epoch: 2, train_loss: 0.8885, test_loss: 0.9977, test_f1: 0.5313
 epoch: 3, train_loss: 0.8590, test_loss: 0.9867, test_f1: 0.5054
 epoch: 4, train_loss: 0.8742, test_loss: 0.9724, test_f1: 0.5713
 epoch: 5, train_loss: 0.8443, test_loss: 0.9654, test_f1: 0.5541
 epoch: 6, train_loss: 0.8319, test_loss: 0.9810, test_f1: 0.5942
 epoch: 7, train_loss: 0.8459, test_loss: 1.0229, test_f1: 0.4696
 epoch: 8, train_loss: 0.8464, test_loss: 0.9744, test_f1: 0.5322
 epoch: 9, train_loss: 0.8396, test_loss: 0.9634, test_f1: 0.5768
 epoch: 10, train_loss: 0.8072, test_loss: 0.9938, test_f1: 0.5470
 epoch: 11, train_loss: 0.7958, test_loss: 1.0179, test_f1: 0.4554
 epoch: 12, train_loss: 0.8637, test_loss: 0.9339, test_f1: 0.5804
 epoch: 13, train_loss: 0.8001, test_loss: 1.8883, test_f1: 0.4185
 epoch: 14, train_loss: 0.7776, test_loss: 0.9861, test_f1: 0.5549
 epoch: 15, train_loss: 0.8011, test_loss: 0.9796, test_f1: 0.5904
 epoch: 16, train_loss: 0.7712, test_loss: 1.0430, test_f1: 0.5079
 epoch: 17, train_loss: 0.7719, test_loss: 1.2757, test_f1: 0.4570
 epoch: 18, train_loss: 0.7577, test_loss: 1.2772, test_f1: 0.4547
 epoch: 19, train_loss: 0.7609, test_loss: 1.0498, test_f1: 0.5657
 epoch: 20, train_loss: 0.7237, test_loss: 1.1640, test_f1: 0.5558
 epoch: 21, train_loss: 0.7352, test_loss: 1.0734, test_f1: 0.5305
 epoch: 22, train_loss: 0.7402, test_loss: 1.3644, test_f1: 0.5038
 epoch: 23, train_loss: 0.7215, test_loss: 1.1562, test_f1: 0.5422
 epoch: 24, train_loss: 0.7050, test_loss: 1.0171, test_f1: 0.5800
 epoch: 25, train_loss: 0.7243, test_loss: 1.0732, test_f1: 0.5729
 epoch: 26, train_loss: 0.7177, test_loss: 0.9616, test_f1: 0.6146
 epoch: 27, train_loss: 0.6865, test_loss: 1.0987, test_f1: 0.5832
 epoch: 28, train_loss: 0.7054, test_loss: 1.1012, test_f1: 0.5410
 epoch: 29, train_loss: 0.6996, test_loss: 1.0319, test_f1: 0.6345
 epoch: 30, train_loss: 0.6797, test_loss: 1.1841, test_f1: 0.5610
 epoch: 31, train_loss: 0.6645, test_loss: 1.4676, test_f1: 0.4949
 epoch: 32, train_loss: 0.6940, test_loss: 1.1339, test_f1: 0.6109
 epoch: 33, train_loss: 0.6696, test_loss: 1.0749, test_f1: 0.5604
 epoch: 34, train_loss: 0.6670, test_loss: 1.2884, test_f1: 0.5647
 epoch: 35, train_loss: 0.7028, test_loss: 1.0506, test_f1: 0.5813
 epoch: 36, train_loss: 0.6534, test_loss: 1.0391, test_f1: 0.6083
 epoch: 37, train_loss: 0.6518, test_loss: 1.0928, test_f1: 0.5384
 epoch: 38, train_loss: 0.6620, test_loss: 1.1083, test_f1: 0.5851
 epoch: 39, train_loss: 0.6322, test_loss: 1.3635, test_f1: 0.5297
 epoch: 40, train_loss: 0.6681, test_loss: 1.2624, test_f1: 0.5641
 epoch: 41, train_loss: 0.6055, test_loss: 1.1878, test_f1: 0.5601
 epoch: 42, train_loss: 0.6115, test_loss: 1.0575, test_f1: 0.5754
 epoch: 43, train_loss: 0.6523, test_loss: 1.3877, test_f1: 0.5026
 epoch: 44, train_loss: 0.6230, test_loss: 1.3440, test_f1: 0.5334
 epoch: 45, train_loss: 0.5869, test_loss: 1.1103, test_f1: 0.5801
 epoch: 46, train_loss: 0.6469, test_loss: 1.4222, test_f1: 0.5357
 epoch: 47, train_loss: 0.6046, test_loss: 1.7797, test_f1: 0.4793
 epoch: 48, train_loss: 0.6056, test_loss: 1.3115, test_f1: 0.5835
 epoch: 49, train_loss: 0.5682, test_loss: 1.2170, test_f1: 0.5742
 epoch: 50, train_loss: 0.5963, test_loss: 1.2835, test_f1: 0.5563
 epoch: 51, train_loss: 0.5459, test_loss: 1.3805, test_f1: 0.5783
 epoch: 52, train_loss: 0.5301, test_loss: 1.2616, test_f1: 0.5686
 epoch: 53, train_loss: 0.5026, test_loss: 1.3495, test_f1: 0.5698
 epoch: 54, train_loss: 0.4935, test_loss: 1.3580, test_f1: 0.5734
 epoch: 55, train_loss: 0.5099, test_loss: 1.3535, test_f1: 0.5804
 epoch: 56, train_loss: 0.5397, test_loss: 1.4151, test_f1: 0.5611
 epoch: 57, train_loss: 0.4785, test_loss: 1.3553, test_f1: 0.6232
 epoch: 58, train_loss: 0.4958, test_loss: 1.2974, test_f1: 0.5922
 epoch: 59, train_loss: 0.4723, test_loss: 1.3176, test_f1: 0.6446
 epoch: 60, train_loss: 0.5152, test_loss: 1.3778, test_f1: 0.5803
 epoch: 61, train_loss: 0.4932, test_loss: 1.2855, test_f1: 0.6240
 epoch: 62, train_loss: 0.4691, test_loss: 1.4405, test_f1: 0.5980
 epoch: 63, train_loss: 0.4703, test_loss: 1.5870, test_f1: 0.5584
 epoch: 64, train_loss: 0.4412, test_loss: 1.4553, test_f1: 0.5737
 epoch: 65, train_loss: 0.4552, test_loss: 1.4027, test_f1: 0.5882
 epoch: 66, train_loss: 0.4633, test_loss: 1.4041, test_f1: 0.6586
 epoch: 67, train_loss: 0.4659, test_loss: 1.7978, test_f1: 0.5611
 epoch: 68, train_loss: 0.4644, test_loss: 1.6128, test_f1: 0.6089
 epoch: 69, train_loss: 0.4777, test_loss: 1.4083, test_f1: 0.5952
 epoch: 70, train_loss: 0.4754, test_loss: 1.5035, test_f1: 0.5884
 epoch: 71, train_loss: 0.4931, test_loss: 1.6333, test_f1: 0.5675
 epoch: 72, train_loss: 0.4435, test_loss: 1.4479, test_f1: 0.5981
 epoch: 73, train_loss: 0.4561, test_loss: 1.3920, test_f1: 0.5778
 epoch: 74, train_loss: 0.4234, test_loss: 1.5533, test_f1: 0.6331
 epoch: 75, train_loss: 0.4784, test_loss: 1.6033, test_f1: 0.5572
 epoch: 76, train_loss: 0.4695, test_loss: 1.4532, test_f1: 0.6112
 epoch: 77, train_loss: 0.4380, test_loss: 1.5331, test_f1: 0.5533
 epoch: 78, train_loss: 0.4395, test_loss: 1.5318, test_f1: 0.6080
 epoch: 79, train_loss: 0.3825, test_loss: 1.4269, test_f1: 0.6135
 epoch: 80, train_loss: 0.4239, test_loss: 1.4546, test_f1: 0.6108
 epoch: 81, train_loss: 0.4076, test_loss: 1.5953, test_f1: 0.6575
 epoch: 82, train_loss: 0.4176, test_loss: 1.5379, test_f1: 0.5940
 epoch: 83, train_loss: 0.4286, test_loss: 1.8079, test_f1: 0.6070
 epoch: 84, train_loss: 0.4092, test_loss: 1.6893, test_f1: 0.6389
 epoch: 85, train_loss: 0.4246, test_loss: 1.7300, test_f1: 0.5814
 epoch: 86, train_loss: 0.4220, test_loss: 1.7263, test_f1: 0.5770
 epoch: 87, train_loss: 0.4185, test_loss: 1.4709, test_f1: 0.6188
 epoch: 88, train_loss: 0.4010, test_loss: 1.5029, test_f1: 0.5933
 epoch: 89, train_loss: 0.4146, test_loss: 1.6636, test_f1: 0.5965
 epoch: 90, train_loss: 0.4129, test_loss: 1.4269, test_f1: 0.6304
 epoch: 91, train_loss: 0.4056, test_loss: 1.6616, test_f1: 0.5885
 epoch: 92, train_loss: 0.4448, test_loss: 1.3793, test_f1: 0.6098
 epoch: 93, train_loss: 0.4010, test_loss: 1.5867, test_f1: 0.6272
 epoch: 94, train_loss: 0.3879, test_loss: 1.4702, test_f1: 0.6687
 epoch: 95, train_loss: 0.3858, test_loss: 1.7128, test_f1: 0.6142
 epoch: 96, train_loss: 0.4160, test_loss: 1.5025, test_f1: 0.6532
 epoch: 97, train_loss: 0.3900, test_loss: 1.5435, test_f1: 0.5674
 epoch: 98, train_loss: 0.4126, test_loss: 1.5401, test_f1: 0.5878
 epoch: 99, train_loss: 0.3828, test_loss: 1.6842, test_f1: 0.6061
##################ITERATION #6 ****************************************
 epoch: 0, train_loss: 1.1244, test_loss: 1.0596, test_f1: 0.3932
 epoch: 1, train_loss: 0.9059, test_loss: 0.9722, test_f1: 0.5406
 epoch: 2, train_loss: 0.8782, test_loss: 1.0174, test_f1: 0.5416
 epoch: 3, train_loss: 0.8605, test_loss: 1.0357, test_f1: 0.5795
 epoch: 4, train_loss: 0.8606, test_loss: 1.1059, test_f1: 0.5031
 epoch: 5, train_loss: 0.8542, test_loss: 1.0877, test_f1: 0.5278
 epoch: 6, train_loss: 0.8252, test_loss: 1.1226, test_f1: 0.5396
 epoch: 7, train_loss: 0.7957, test_loss: 1.0056, test_f1: 0.5142
 epoch: 8, train_loss: 0.8367, test_loss: 1.0916, test_f1: 0.5106
 epoch: 9, train_loss: 0.8162, test_loss: 1.1010, test_f1: 0.4950
 epoch: 10, train_loss: 0.8018, test_loss: 0.9806, test_f1: 0.5780
 epoch: 11, train_loss: 0.8027, test_loss: 1.2516, test_f1: 0.3603
 epoch: 12, train_loss: 0.7969, test_loss: 1.3643, test_f1: 0.3837
 epoch: 13, train_loss: 0.8272, test_loss: 1.0017, test_f1: 0.5525
 epoch: 14, train_loss: 0.7912, test_loss: 1.0370, test_f1: 0.5022
 epoch: 15, train_loss: 0.7693, test_loss: 1.0924, test_f1: 0.5297
 epoch: 16, train_loss: 0.7580, test_loss: 1.4998, test_f1: 0.4693
 epoch: 17, train_loss: 0.7781, test_loss: 0.9829, test_f1: 0.5198
 epoch: 18, train_loss: 0.7615, test_loss: 1.2409, test_f1: 0.5046
 epoch: 19, train_loss: 0.7440, test_loss: 1.0537, test_f1: 0.4860
 epoch: 20, train_loss: 0.7508, test_loss: 1.0895, test_f1: 0.5064
 epoch: 21, train_loss: 0.7390, test_loss: 0.9889, test_f1: 0.6043
 epoch: 22, train_loss: 0.7188, test_loss: 1.1029, test_f1: 0.5026
 epoch: 23, train_loss: 0.7311, test_loss: 1.0814, test_f1: 0.4992
 epoch: 24, train_loss: 0.7142, test_loss: 1.1957, test_f1: 0.5013
 epoch: 25, train_loss: 0.7273, test_loss: 1.0983, test_f1: 0.5046
 epoch: 26, train_loss: 0.7496, test_loss: 1.1108, test_f1: 0.5800
 epoch: 27, train_loss: 0.7045, test_loss: 1.3262, test_f1: 0.5177
 epoch: 28, train_loss: 0.6943, test_loss: 0.9852, test_f1: 0.6074
 epoch: 29, train_loss: 0.7069, test_loss: 1.1712, test_f1: 0.4834
 epoch: 30, train_loss: 0.6719, test_loss: 1.0334, test_f1: 0.6008
 epoch: 31, train_loss: 0.6678, test_loss: 1.1810, test_f1: 0.5474
 epoch: 32, train_loss: 0.6793, test_loss: 1.1601, test_f1: 0.5108
 epoch: 33, train_loss: 0.6709, test_loss: 0.9752, test_f1: 0.5477
 epoch: 34, train_loss: 0.6559, test_loss: 2.6085, test_f1: 0.3337
 epoch: 35, train_loss: 0.6845, test_loss: 1.1667, test_f1: 0.5105
 epoch: 36, train_loss: 0.6720, test_loss: 1.0954, test_f1: 0.5740
 epoch: 37, train_loss: 0.6858, test_loss: 1.0753, test_f1: 0.5646
 epoch: 38, train_loss: 0.6511, test_loss: 0.9940, test_f1: 0.5974
 epoch: 39, train_loss: 0.6995, test_loss: 1.3194, test_f1: 0.5297
 epoch: 40, train_loss: 0.6328, test_loss: 1.3494, test_f1: 0.5402
 epoch: 41, train_loss: 0.6197, test_loss: 2.1146, test_f1: 0.4503
 epoch: 42, train_loss: 0.6156, test_loss: 1.1302, test_f1: 0.5181
 epoch: 43, train_loss: 0.6611, test_loss: 1.0485, test_f1: 0.5902
 epoch: 44, train_loss: 0.6256, test_loss: 1.4106, test_f1: 0.5248
 epoch: 45, train_loss: 0.6472, test_loss: 1.4167, test_f1: 0.4973
 epoch: 46, train_loss: 0.6091, test_loss: 1.2960, test_f1: 0.4990
 epoch: 47, train_loss: 0.6200, test_loss: 1.7381, test_f1: 0.5165
 epoch: 48, train_loss: 0.5938, test_loss: 1.1698, test_f1: 0.6031
 epoch: 49, train_loss: 0.6138, test_loss: 1.1639, test_f1: 0.5724
 epoch: 50, train_loss: 0.5943, test_loss: 1.1904, test_f1: 0.5598
 epoch: 51, train_loss: 0.5589, test_loss: 1.1640, test_f1: 0.5485
 epoch: 52, train_loss: 0.5232, test_loss: 1.1668, test_f1: 0.6125
 epoch: 53, train_loss: 0.5216, test_loss: 1.4836, test_f1: 0.5143
 epoch: 54, train_loss: 0.5022, test_loss: 1.1750, test_f1: 0.6095
 epoch: 55, train_loss: 0.5081, test_loss: 1.0994, test_f1: 0.6351
 epoch: 56, train_loss: 0.5016, test_loss: 1.1565, test_f1: 0.6715
 epoch: 57, train_loss: 0.5053, test_loss: 1.6171, test_f1: 0.5277
 epoch: 58, train_loss: 0.4723, test_loss: 1.3793, test_f1: 0.5691
 epoch: 59, train_loss: 0.5025, test_loss: 1.2388, test_f1: 0.6295
 epoch: 60, train_loss: 0.4922, test_loss: 1.5593, test_f1: 0.5235
 epoch: 61, train_loss: 0.5033, test_loss: 1.1743, test_f1: 0.6169
 epoch: 62, train_loss: 0.4871, test_loss: 1.2424, test_f1: 0.6158
 epoch: 63, train_loss: 0.4854, test_loss: 1.7728, test_f1: 0.5218
 epoch: 64, train_loss: 0.4578, test_loss: 1.2915, test_f1: 0.5937
 epoch: 65, train_loss: 0.4652, test_loss: 1.4014, test_f1: 0.5849
 epoch: 66, train_loss: 0.4763, test_loss: 1.0994, test_f1: 0.6310
 epoch: 67, train_loss: 0.4701, test_loss: 1.5562, test_f1: 0.5423
 epoch: 68, train_loss: 0.4697, test_loss: 1.4817, test_f1: 0.5816
 epoch: 69, train_loss: 0.4788, test_loss: 1.2312, test_f1: 0.5947
 epoch: 70, train_loss: 0.4613, test_loss: 1.3046, test_f1: 0.5854
 epoch: 71, train_loss: 0.4340, test_loss: 1.7239, test_f1: 0.6036
 epoch: 72, train_loss: 0.4667, test_loss: 1.3030, test_f1: 0.6214
 epoch: 73, train_loss: 0.4735, test_loss: 1.3813, test_f1: 0.5846
 epoch: 74, train_loss: 0.4709, test_loss: 1.3721, test_f1: 0.6214
 epoch: 75, train_loss: 0.4624, test_loss: 1.1873, test_f1: 0.6026
 epoch: 76, train_loss: 0.4129, test_loss: 1.2347, test_f1: 0.6362
 epoch: 77, train_loss: 0.4091, test_loss: 1.2705, test_f1: 0.6549
 epoch: 78, train_loss: 0.4565, test_loss: 1.2221, test_f1: 0.6797
 epoch: 79, train_loss: 0.4349, test_loss: 1.3521, test_f1: 0.6475
 epoch: 80, train_loss: 0.4278, test_loss: 1.3856, test_f1: 0.6164
 epoch: 81, train_loss: 0.4253, test_loss: 1.6881, test_f1: 0.5437
 epoch: 82, train_loss: 0.4546, test_loss: 1.2438, test_f1: 0.6323
 epoch: 83, train_loss: 0.4287, test_loss: 1.1480, test_f1: 0.6658
 epoch: 84, train_loss: 0.4590, test_loss: 1.3581, test_f1: 0.6085
 epoch: 85, train_loss: 0.4167, test_loss: 1.4672, test_f1: 0.6078
 epoch: 86, train_loss: 0.3925, test_loss: 1.3394, test_f1: 0.6260
 epoch: 87, train_loss: 0.4227, test_loss: 1.3717, test_f1: 0.6471
 epoch: 88, train_loss: 0.4052, test_loss: 1.7320, test_f1: 0.5779
 epoch: 89, train_loss: 0.3971, test_loss: 1.2583, test_f1: 0.5897
 epoch: 90, train_loss: 0.3985, test_loss: 1.2035, test_f1: 0.6314
 epoch: 91, train_loss: 0.4415, test_loss: 1.2758, test_f1: 0.6344
 epoch: 92, train_loss: 0.3855, test_loss: 1.3642, test_f1: 0.6096
 epoch: 93, train_loss: 0.3613, test_loss: 1.3695, test_f1: 0.6434
 epoch: 94, train_loss: 0.3902, test_loss: 1.4575, test_f1: 0.6051
 epoch: 95, train_loss: 0.3637, test_loss: 1.5935, test_f1: 0.6043
 epoch: 96, train_loss: 0.4034, test_loss: 1.3355, test_f1: 0.6200
 epoch: 97, train_loss: 0.4036, test_loss: 1.7319, test_f1: 0.5635
 epoch: 98, train_loss: 0.3813, test_loss: 1.2901, test_f1: 0.6536
 epoch: 99, train_loss: 0.3919, test_loss: 1.8685, test_f1: 0.5905
##################ITERATION #7 ****************************************
 epoch: 0, train_loss: 1.1607, test_loss: 1.1265, test_f1: 0.3907
 epoch: 1, train_loss: 0.9787, test_loss: 1.0270, test_f1: 0.4402
 epoch: 2, train_loss: 0.9571, test_loss: 1.0092, test_f1: 0.5241
 epoch: 3, train_loss: 0.8963, test_loss: 0.9834, test_f1: 0.4721
 epoch: 4, train_loss: 0.8830, test_loss: 1.0990, test_f1: 0.4953
 epoch: 5, train_loss: 0.8822, test_loss: 1.0794, test_f1: 0.4993
 epoch: 6, train_loss: 0.8646, test_loss: 0.9656, test_f1: 0.5047
 epoch: 7, train_loss: 0.8215, test_loss: 1.0955, test_f1: 0.4863
 epoch: 8, train_loss: 0.8389, test_loss: 1.0734, test_f1: 0.5553
 epoch: 9, train_loss: 0.8214, test_loss: 1.1073, test_f1: 0.4233
 epoch: 10, train_loss: 0.8131, test_loss: 1.0524, test_f1: 0.5602
 epoch: 11, train_loss: 0.8442, test_loss: 1.2021, test_f1: 0.5469
 epoch: 12, train_loss: 0.7988, test_loss: 1.1114, test_f1: 0.4453
 epoch: 13, train_loss: 0.7878, test_loss: 1.3429, test_f1: 0.4872
 epoch: 14, train_loss: 0.7754, test_loss: 1.3819, test_f1: 0.5241
 epoch: 15, train_loss: 0.7824, test_loss: 1.6356, test_f1: 0.4614
 epoch: 16, train_loss: 0.8654, test_loss: 1.0173, test_f1: 0.4723
 epoch: 17, train_loss: 0.7891, test_loss: 1.1505, test_f1: 0.5466
 epoch: 18, train_loss: 0.7770, test_loss: 0.9689, test_f1: 0.5543
 epoch: 19, train_loss: 0.7600, test_loss: 1.0372, test_f1: 0.6160
 epoch: 20, train_loss: 0.7631, test_loss: 1.1492, test_f1: 0.5381
 epoch: 21, train_loss: 0.7492, test_loss: 0.9756, test_f1: 0.6191
 epoch: 22, train_loss: 0.8013, test_loss: 1.0555, test_f1: 0.5766
 epoch: 23, train_loss: 0.7505, test_loss: 0.9937, test_f1: 0.5364
 epoch: 24, train_loss: 0.7408, test_loss: 1.1778, test_f1: 0.5127
 epoch: 25, train_loss: 0.7222, test_loss: 1.1371, test_f1: 0.4913
 epoch: 26, train_loss: 0.7344, test_loss: 1.0891, test_f1: 0.5809
 epoch: 27, train_loss: 0.7116, test_loss: 1.0754, test_f1: 0.5874
 epoch: 28, train_loss: 0.7127, test_loss: 1.2442, test_f1: 0.5751
 epoch: 29, train_loss: 0.7115, test_loss: 1.5292, test_f1: 0.5360
 epoch: 30, train_loss: 0.7257, test_loss: 1.1423, test_f1: 0.5502
 epoch: 31, train_loss: 0.7019, test_loss: 1.3803, test_f1: 0.5671
 epoch: 32, train_loss: 0.7084, test_loss: 1.5513, test_f1: 0.5595
 epoch: 33, train_loss: 0.6907, test_loss: 1.2094, test_f1: 0.5408
 epoch: 34, train_loss: 0.6971, test_loss: 1.0601, test_f1: 0.5491
 epoch: 35, train_loss: 0.6761, test_loss: 1.1408, test_f1: 0.5993
 epoch: 36, train_loss: 0.6975, test_loss: 1.3847, test_f1: 0.5837
 epoch: 37, train_loss: 0.6610, test_loss: 1.1483, test_f1: 0.5622
 epoch: 38, train_loss: 0.6940, test_loss: 1.2053, test_f1: 0.6071
 epoch: 39, train_loss: 0.6509, test_loss: 1.0619, test_f1: 0.5945
 epoch: 40, train_loss: 0.6724, test_loss: 1.1612, test_f1: 0.6247
 epoch: 41, train_loss: 0.6588, test_loss: 1.1613, test_f1: 0.5468
 epoch: 42, train_loss: 0.6794, test_loss: 2.8849, test_f1: 0.4838
 epoch: 43, train_loss: 0.6918, test_loss: 1.2539, test_f1: 0.5881
 epoch: 44, train_loss: 0.6436, test_loss: 1.6515, test_f1: 0.5622
 epoch: 45, train_loss: 0.6574, test_loss: 2.0148, test_f1: 0.5155
 epoch: 46, train_loss: 0.6604, test_loss: 1.1112, test_f1: 0.5546
 epoch: 47, train_loss: 0.6594, test_loss: 1.3867, test_f1: 0.6288
 epoch: 48, train_loss: 0.6531, test_loss: 1.1872, test_f1: 0.5004
 epoch: 49, train_loss: 0.6178, test_loss: 1.5191, test_f1: 0.5864
 epoch: 50, train_loss: 0.6148, test_loss: 1.0704, test_f1: 0.5351
 epoch: 51, train_loss: 0.5806, test_loss: 1.4088, test_f1: 0.5890
 epoch: 52, train_loss: 0.5515, test_loss: 1.5625, test_f1: 0.5926
 epoch: 53, train_loss: 0.5359, test_loss: 1.5822, test_f1: 0.6090
 epoch: 54, train_loss: 0.5616, test_loss: 1.2868, test_f1: 0.6202
 epoch: 55, train_loss: 0.5470, test_loss: 1.3724, test_f1: 0.6068
 epoch: 56, train_loss: 0.5502, test_loss: 1.4412, test_f1: 0.6144
 epoch: 57, train_loss: 0.5317, test_loss: 1.4683, test_f1: 0.6038
 epoch: 58, train_loss: 0.5184, test_loss: 1.3614, test_f1: 0.6074
 epoch: 59, train_loss: 0.5131, test_loss: 1.6520, test_f1: 0.5985
 epoch: 60, train_loss: 0.5430, test_loss: 1.3049, test_f1: 0.5817
 epoch: 61, train_loss: 0.5413, test_loss: 1.5669, test_f1: 0.6042
 epoch: 62, train_loss: 0.5140, test_loss: 1.5183, test_f1: 0.5954
 epoch: 63, train_loss: 0.5104, test_loss: 1.2904, test_f1: 0.5873
 epoch: 64, train_loss: 0.5084, test_loss: 1.4275, test_f1: 0.5868
 epoch: 65, train_loss: 0.5251, test_loss: 1.6626, test_f1: 0.5720
 epoch: 66, train_loss: 0.4803, test_loss: 1.3606, test_f1: 0.6173
 epoch: 67, train_loss: 0.4960, test_loss: 1.1508, test_f1: 0.5985
 epoch: 68, train_loss: 0.5137, test_loss: 1.2788, test_f1: 0.6145
 epoch: 69, train_loss: 0.4860, test_loss: 1.3133, test_f1: 0.5971
 epoch: 70, train_loss: 0.5117, test_loss: 1.4078, test_f1: 0.5887
 epoch: 71, train_loss: 0.4937, test_loss: 1.8772, test_f1: 0.5825
 epoch: 72, train_loss: 0.4956, test_loss: 1.3337, test_f1: 0.6059
 epoch: 73, train_loss: 0.4690, test_loss: 1.1279, test_f1: 0.6181
 epoch: 74, train_loss: 0.4852, test_loss: 1.5620, test_f1: 0.5942
 epoch: 75, train_loss: 0.4690, test_loss: 1.5272, test_f1: 0.6008
 epoch: 76, train_loss: 0.4773, test_loss: 1.7532, test_f1: 0.5574
 epoch: 77, train_loss: 0.4646, test_loss: 1.8114, test_f1: 0.5867
 epoch: 78, train_loss: 0.4700, test_loss: 1.4789, test_f1: 0.5853
 epoch: 79, train_loss: 0.4687, test_loss: 1.4008, test_f1: 0.6060
 epoch: 80, train_loss: 0.4760, test_loss: 1.3046, test_f1: 0.6005
 epoch: 81, train_loss: 0.4820, test_loss: 1.3194, test_f1: 0.6203
 epoch: 82, train_loss: 0.4616, test_loss: 1.4223, test_f1: 0.6061
 epoch: 83, train_loss: 0.4716, test_loss: 1.2886, test_f1: 0.6246
 epoch: 84, train_loss: 0.4516, test_loss: 1.5674, test_f1: 0.5919
 epoch: 85, train_loss: 0.4603, test_loss: 1.7255, test_f1: 0.6016
 epoch: 86, train_loss: 0.4877, test_loss: 1.7039, test_f1: 0.5707
 epoch: 87, train_loss: 0.4515, test_loss: 1.4705, test_f1: 0.6188
 epoch: 88, train_loss: 0.4509, test_loss: 1.6559, test_f1: 0.5769
 epoch: 89, train_loss: 0.4537, test_loss: 1.3627, test_f1: 0.6156
 epoch: 90, train_loss: 0.4331, test_loss: 1.7253, test_f1: 0.5936
 epoch: 91, train_loss: 0.4255, test_loss: 1.7661, test_f1: 0.6039
 epoch: 92, train_loss: 0.4232, test_loss: 1.6306, test_f1: 0.6239
 epoch: 93, train_loss: 0.4351, test_loss: 2.0252, test_f1: 0.5967
 epoch: 94, train_loss: 0.4344, test_loss: 1.5787, test_f1: 0.6079
 epoch: 95, train_loss: 0.4700, test_loss: 1.3396, test_f1: 0.6032
 epoch: 96, train_loss: 0.4723, test_loss: 1.5394, test_f1: 0.6073
 epoch: 97, train_loss: 0.4300, test_loss: 1.9807, test_f1: 0.5346
 epoch: 98, train_loss: 0.4359, test_loss: 1.2855, test_f1: 0.6384
 epoch: 99, train_loss: 0.3993, test_loss: 1.3627, test_f1: 0.6401
##################ITERATION #8 ****************************************
 epoch: 0, train_loss: 1.0891, test_loss: 1.0934, test_f1: 0.4766
 epoch: 1, train_loss: 0.9060, test_loss: 1.0609, test_f1: 0.5540
 epoch: 2, train_loss: 0.9038, test_loss: 1.0644, test_f1: 0.4150
 epoch: 3, train_loss: 0.8784, test_loss: 1.2516, test_f1: 0.4621
 epoch: 4, train_loss: 0.8975, test_loss: 0.9835, test_f1: 0.5247
 epoch: 5, train_loss: 0.8491, test_loss: 1.0858, test_f1: 0.5266
 epoch: 6, train_loss: 0.8324, test_loss: 1.0496, test_f1: 0.5148
 epoch: 7, train_loss: 0.8441, test_loss: 1.0114, test_f1: 0.5223
 epoch: 8, train_loss: 0.8330, test_loss: 1.2516, test_f1: 0.5226
 epoch: 9, train_loss: 0.8555, test_loss: 0.9974, test_f1: 0.5758
 epoch: 10, train_loss: 0.8599, test_loss: 0.9862, test_f1: 0.5256
 epoch: 11, train_loss: 0.8123, test_loss: 1.0403, test_f1: 0.5392
 epoch: 12, train_loss: 0.7833, test_loss: 0.9749, test_f1: 0.5923
 epoch: 13, train_loss: 0.8034, test_loss: 1.0881, test_f1: 0.5146
 epoch: 14, train_loss: 0.7856, test_loss: 1.0364, test_f1: 0.5613
 epoch: 15, train_loss: 0.7665, test_loss: 1.1342, test_f1: 0.5522
 epoch: 16, train_loss: 0.7976, test_loss: 1.1344, test_f1: 0.4281
 epoch: 17, train_loss: 0.8043, test_loss: 1.0461, test_f1: 0.4988
 epoch: 18, train_loss: 0.7762, test_loss: 1.4869, test_f1: 0.4159
 epoch: 19, train_loss: 0.7618, test_loss: 1.0561, test_f1: 0.5261
 epoch: 20, train_loss: 0.7421, test_loss: 1.0582, test_f1: 0.5883
 epoch: 21, train_loss: 0.7378, test_loss: 1.2951, test_f1: 0.5408
 epoch: 22, train_loss: 0.7431, test_loss: 1.0289, test_f1: 0.5756
 epoch: 23, train_loss: 0.7337, test_loss: 0.9845, test_f1: 0.6087
 epoch: 24, train_loss: 0.7362, test_loss: 1.0778, test_f1: 0.5078
 epoch: 25, train_loss: 0.7301, test_loss: 0.9892, test_f1: 0.5646
 epoch: 26, train_loss: 0.7136, test_loss: 1.1298, test_f1: 0.5506
 epoch: 27, train_loss: 0.7241, test_loss: 1.2501, test_f1: 0.5749
 epoch: 28, train_loss: 0.6989, test_loss: 1.0642, test_f1: 0.5355
 epoch: 29, train_loss: 0.6927, test_loss: 1.2012, test_f1: 0.6231
 epoch: 30, train_loss: 0.6815, test_loss: 1.4739, test_f1: 0.5466
 epoch: 31, train_loss: 0.6903, test_loss: 1.1246, test_f1: 0.5393
 epoch: 32, train_loss: 0.6727, test_loss: 1.1732, test_f1: 0.5331
 epoch: 33, train_loss: 0.6745, test_loss: 1.1451, test_f1: 0.5006
 epoch: 34, train_loss: 0.6677, test_loss: 1.0635, test_f1: 0.5926
 epoch: 35, train_loss: 0.6933, test_loss: 1.1142, test_f1: 0.4939
 epoch: 36, train_loss: 0.6778, test_loss: 0.9783, test_f1: 0.6265
 epoch: 37, train_loss: 0.6529, test_loss: 1.1422, test_f1: 0.5378
 epoch: 38, train_loss: 0.6697, test_loss: 1.1304, test_f1: 0.5710
 epoch: 39, train_loss: 0.6483, test_loss: 0.9747, test_f1: 0.6401
 epoch: 40, train_loss: 0.6532, test_loss: 1.1541, test_f1: 0.5417
 epoch: 41, train_loss: 0.6567, test_loss: 1.0543, test_f1: 0.6030
 epoch: 42, train_loss: 0.6647, test_loss: 0.9516, test_f1: 0.5927
 epoch: 43, train_loss: 0.6334, test_loss: 1.0756, test_f1: 0.5865
 epoch: 44, train_loss: 0.6170, test_loss: 1.0354, test_f1: 0.5363
 epoch: 45, train_loss: 0.6433, test_loss: 1.4192, test_f1: 0.5095
 epoch: 46, train_loss: 0.6057, test_loss: 1.0465, test_f1: 0.5437
 epoch: 47, train_loss: 0.6263, test_loss: 1.1165, test_f1: 0.5889
 epoch: 48, train_loss: 0.5939, test_loss: 1.0966, test_f1: 0.5885
 epoch: 49, train_loss: 0.6246, test_loss: 1.0299, test_f1: 0.6492
 epoch: 50, train_loss: 0.5785, test_loss: 1.2056, test_f1: 0.5854
 epoch: 51, train_loss: 0.5726, test_loss: 1.1462, test_f1: 0.5735
 epoch: 52, train_loss: 0.5489, test_loss: 1.0988, test_f1: 0.5964
 epoch: 53, train_loss: 0.5315, test_loss: 1.1189, test_f1: 0.5805
 epoch: 54, train_loss: 0.5317, test_loss: 1.2355, test_f1: 0.5663
 epoch: 55, train_loss: 0.4903, test_loss: 1.1886, test_f1: 0.5835
 epoch: 56, train_loss: 0.4869, test_loss: 1.2183, test_f1: 0.6145
 epoch: 57, train_loss: 0.5189, test_loss: 1.1594, test_f1: 0.5702
 epoch: 58, train_loss: 0.4994, test_loss: 1.3586, test_f1: 0.5851
 epoch: 59, train_loss: 0.4869, test_loss: 1.2083, test_f1: 0.6253
 epoch: 60, train_loss: 0.5177, test_loss: 1.2016, test_f1: 0.6198
 epoch: 61, train_loss: 0.4738, test_loss: 1.3408, test_f1: 0.5720
 epoch: 62, train_loss: 0.4900, test_loss: 1.2680, test_f1: 0.6003
 epoch: 63, train_loss: 0.4669, test_loss: 1.1850, test_f1: 0.6223
 epoch: 64, train_loss: 0.4824, test_loss: 1.5536, test_f1: 0.5569
 epoch: 65, train_loss: 0.4805, test_loss: 1.1362, test_f1: 0.6209
 epoch: 66, train_loss: 0.4429, test_loss: 1.2178, test_f1: 0.6472
 epoch: 67, train_loss: 0.4540, test_loss: 1.0826, test_f1: 0.6307
 epoch: 68, train_loss: 0.4608, test_loss: 1.4112, test_f1: 0.6252
 epoch: 69, train_loss: 0.4626, test_loss: 1.2205, test_f1: 0.6342
 epoch: 70, train_loss: 0.4793, test_loss: 1.1007, test_f1: 0.6060
 epoch: 71, train_loss: 0.4406, test_loss: 1.5786, test_f1: 0.5386
 epoch: 72, train_loss: 0.4168, test_loss: 1.2993, test_f1: 0.6068
 epoch: 73, train_loss: 0.4299, test_loss: 1.2325, test_f1: 0.6274
 epoch: 74, train_loss: 0.4594, test_loss: 1.5238, test_f1: 0.5881
 epoch: 75, train_loss: 0.4290, test_loss: 1.4789, test_f1: 0.6057
 epoch: 76, train_loss: 0.4398, test_loss: 1.2198, test_f1: 0.6130
 epoch: 77, train_loss: 0.4296, test_loss: 1.7365, test_f1: 0.5540
 epoch: 78, train_loss: 0.4085, test_loss: 1.3999, test_f1: 0.6319
 epoch: 79, train_loss: 0.4751, test_loss: 1.3336, test_f1: 0.6083
 epoch: 80, train_loss: 0.4621, test_loss: 1.4318, test_f1: 0.6338
 epoch: 81, train_loss: 0.3973, test_loss: 1.4728, test_f1: 0.6029
 epoch: 82, train_loss: 0.4427, test_loss: 1.7419, test_f1: 0.5497
 epoch: 83, train_loss: 0.4051, test_loss: 1.5860, test_f1: 0.5906
 epoch: 84, train_loss: 0.4812, test_loss: 1.3806, test_f1: 0.5878
 epoch: 85, train_loss: 0.3977, test_loss: 1.2545, test_f1: 0.6275
 epoch: 86, train_loss: 0.3934, test_loss: 1.5665, test_f1: 0.5901
 epoch: 87, train_loss: 0.3934, test_loss: 1.2585, test_f1: 0.6124
 epoch: 88, train_loss: 0.4062, test_loss: 1.4486, test_f1: 0.6200
 epoch: 89, train_loss: 0.4233, test_loss: 1.3362, test_f1: 0.6003
 epoch: 90, train_loss: 0.3833, test_loss: 1.4636, test_f1: 0.6028
 epoch: 91, train_loss: 0.4055, test_loss: 1.6191, test_f1: 0.5952
 epoch: 92, train_loss: 0.4118, test_loss: 1.4161, test_f1: 0.6348
 epoch: 93, train_loss: 0.3369, test_loss: 1.4084, test_f1: 0.6648
 epoch: 94, train_loss: 0.3904, test_loss: 1.3055, test_f1: 0.6265
 epoch: 95, train_loss: 0.4155, test_loss: 1.2809, test_f1: 0.6309
 epoch: 96, train_loss: 0.4346, test_loss: 1.3436, test_f1: 0.6151
 epoch: 97, train_loss: 0.3991, test_loss: 1.4497, test_f1: 0.5840
 epoch: 98, train_loss: 0.3894, test_loss: 1.3389, test_f1: 0.6418
 epoch: 99, train_loss: 0.3967, test_loss: 1.3535, test_f1: 0.6042
##################ITERATION #9 ****************************************
 epoch: 0, train_loss: 1.1207, test_loss: 1.1124, test_f1: 0.3790
 epoch: 1, train_loss: 0.9733, test_loss: 1.0039, test_f1: 0.5564
 epoch: 2, train_loss: 0.9367, test_loss: 1.0879, test_f1: 0.4303
 epoch: 3, train_loss: 0.8913, test_loss: 1.0270, test_f1: 0.5368
 epoch: 4, train_loss: 0.8744, test_loss: 1.0216, test_f1: 0.4996
 epoch: 5, train_loss: 0.9079, test_loss: 0.9581, test_f1: 0.5469
 epoch: 6, train_loss: 0.8352, test_loss: 0.9910, test_f1: 0.5860
 epoch: 7, train_loss: 0.8247, test_loss: 0.9408, test_f1: 0.5928
 epoch: 8, train_loss: 0.8764, test_loss: 1.0951, test_f1: 0.4171
 epoch: 9, train_loss: 0.8781, test_loss: 0.9728, test_f1: 0.5186
 epoch: 10, train_loss: 0.8452, test_loss: 0.9709, test_f1: 0.4728
 epoch: 11, train_loss: 0.8196, test_loss: 1.0547, test_f1: 0.5265
 epoch: 12, train_loss: 0.8048, test_loss: 1.1792, test_f1: 0.5038
 epoch: 13, train_loss: 0.7697, test_loss: 1.0261, test_f1: 0.5930
 epoch: 14, train_loss: 0.7834, test_loss: 1.2296, test_f1: 0.3925
 epoch: 15, train_loss: 0.7739, test_loss: 1.0541, test_f1: 0.5619
 epoch: 16, train_loss: 0.7948, test_loss: 1.4343, test_f1: 0.4742
 epoch: 17, train_loss: 0.7815, test_loss: 1.0929, test_f1: 0.5480
 epoch: 18, train_loss: 0.7781, test_loss: 1.3902, test_f1: 0.5169
 epoch: 19, train_loss: 0.7563, test_loss: 1.2898, test_f1: 0.5432
 epoch: 20, train_loss: 0.7639, test_loss: 1.4004, test_f1: 0.5995
 epoch: 21, train_loss: 0.7540, test_loss: 1.5163, test_f1: 0.4578
 epoch: 22, train_loss: 0.7659, test_loss: 1.2019, test_f1: 0.5559
 epoch: 23, train_loss: 0.7571, test_loss: 1.1090, test_f1: 0.4881
 epoch: 24, train_loss: 0.7459, test_loss: 1.0940, test_f1: 0.5821
 epoch: 25, train_loss: 0.7031, test_loss: 1.2283, test_f1: 0.6028
 epoch: 26, train_loss: 0.6954, test_loss: 1.8058, test_f1: 0.5428
 epoch: 27, train_loss: 0.6908, test_loss: 1.6375, test_f1: 0.5718
 epoch: 28, train_loss: 0.6947, test_loss: 1.3386, test_f1: 0.5829
 epoch: 29, train_loss: 0.7285, test_loss: 1.1830, test_f1: 0.4560
 epoch: 30, train_loss: 0.7331, test_loss: 3.2919, test_f1: 0.4202
 epoch: 31, train_loss: 0.6872, test_loss: 1.4406, test_f1: 0.5476
 epoch: 32, train_loss: 0.7167, test_loss: 1.2626, test_f1: 0.4395
 epoch: 33, train_loss: 0.7016, test_loss: 4.7135, test_f1: 0.3377
 epoch: 34, train_loss: 0.7189, test_loss: 1.2463, test_f1: 0.4312
 epoch: 35, train_loss: 0.6795, test_loss: 1.0389, test_f1: 0.5510
 epoch: 36, train_loss: 0.6763, test_loss: 1.1874, test_f1: 0.5288
 epoch: 37, train_loss: 0.6558, test_loss: 1.2025, test_f1: 0.5275
 epoch: 38, train_loss: 0.6804, test_loss: 1.1822, test_f1: 0.5750
 epoch: 39, train_loss: 0.6557, test_loss: 1.1931, test_f1: 0.5161
 epoch: 40, train_loss: 0.6601, test_loss: 1.1206, test_f1: 0.5404
 epoch: 41, train_loss: 0.6552, test_loss: 1.2122, test_f1: 0.5009
 epoch: 42, train_loss: 0.6579, test_loss: 1.1374, test_f1: 0.5389
 epoch: 43, train_loss: 0.6718, test_loss: 1.2999, test_f1: 0.5703
 epoch: 44, train_loss: 0.6219, test_loss: 1.5309, test_f1: 0.5554
 epoch: 45, train_loss: 0.6481, test_loss: 1.0625, test_f1: 0.5648
 epoch: 46, train_loss: 0.6083, test_loss: 1.5700, test_f1: 0.5832
 epoch: 47, train_loss: 0.6338, test_loss: 1.1605, test_f1: 0.5404
 epoch: 48, train_loss: 0.6367, test_loss: 1.2569, test_f1: 0.5316
 epoch: 49, train_loss: 0.6090, test_loss: 1.2239, test_f1: 0.6167
 epoch: 50, train_loss: 0.5989, test_loss: 1.4868, test_f1: 0.5374
 epoch: 51, train_loss: 0.6108, test_loss: 1.2633, test_f1: 0.5734
 epoch: 52, train_loss: 0.5874, test_loss: 1.2650, test_f1: 0.5956
 epoch: 53, train_loss: 0.5751, test_loss: 1.2846, test_f1: 0.5994
 epoch: 54, train_loss: 0.5629, test_loss: 1.2414, test_f1: 0.5630
 epoch: 55, train_loss: 0.5235, test_loss: 1.3358, test_f1: 0.5778
 epoch: 56, train_loss: 0.5220, test_loss: 1.7868, test_f1: 0.5139
 epoch: 57, train_loss: 0.5553, test_loss: 1.3981, test_f1: 0.5961
 epoch: 58, train_loss: 0.5226, test_loss: 1.2026, test_f1: 0.5920
 epoch: 59, train_loss: 0.5182, test_loss: 2.1443, test_f1: 0.5496
 epoch: 60, train_loss: 0.5207, test_loss: 1.4675, test_f1: 0.5537
 epoch: 61, train_loss: 0.5013, test_loss: 1.3226, test_f1: 0.5614
 epoch: 62, train_loss: 0.5134, test_loss: 1.4338, test_f1: 0.5697
 epoch: 63, train_loss: 0.5218, test_loss: 1.3427, test_f1: 0.5489
 epoch: 64, train_loss: 0.5031, test_loss: 1.3674, test_f1: 0.5635
 epoch: 65, train_loss: 0.5034, test_loss: 1.2705, test_f1: 0.5874
 epoch: 66, train_loss: 0.5071, test_loss: 1.2886, test_f1: 0.5574
 epoch: 67, train_loss: 0.5079, test_loss: 1.7237, test_f1: 0.5592
 epoch: 68, train_loss: 0.4800, test_loss: 1.2055, test_f1: 0.6043
 epoch: 69, train_loss: 0.4903, test_loss: 1.3109, test_f1: 0.5907
 epoch: 70, train_loss: 0.4804, test_loss: 1.2867, test_f1: 0.5878
 epoch: 71, train_loss: 0.4738, test_loss: 1.2910, test_f1: 0.5674
 epoch: 72, train_loss: 0.4780, test_loss: 1.5909, test_f1: 0.5482
 epoch: 73, train_loss: 0.4753, test_loss: 1.5902, test_f1: 0.5954
 epoch: 74, train_loss: 0.5030, test_loss: 1.4876, test_f1: 0.6479
 epoch: 75, train_loss: 0.5065, test_loss: 1.4329, test_f1: 0.6292
 epoch: 76, train_loss: 0.5101, test_loss: 1.3027, test_f1: 0.5767
 epoch: 77, train_loss: 0.4636, test_loss: 1.3596, test_f1: 0.5587
 epoch: 78, train_loss: 0.4539, test_loss: 1.3895, test_f1: 0.6034
 epoch: 79, train_loss: 0.4365, test_loss: 1.3322, test_f1: 0.5641
 epoch: 80, train_loss: 0.4576, test_loss: 1.4680, test_f1: 0.6176
 epoch: 81, train_loss: 0.4622, test_loss: 1.4641, test_f1: 0.5801
 epoch: 82, train_loss: 0.4573, test_loss: 1.2801, test_f1: 0.5959
 epoch: 83, train_loss: 0.4351, test_loss: 1.5344, test_f1: 0.6023
 epoch: 84, train_loss: 0.4582, test_loss: 1.3410, test_f1: 0.5830
 epoch: 85, train_loss: 0.4305, test_loss: 1.4319, test_f1: 0.5823
 epoch: 86, train_loss: 0.4383, test_loss: 1.5197, test_f1: 0.6018
 epoch: 87, train_loss: 0.4325, test_loss: 1.3147, test_f1: 0.6380
 epoch: 88, train_loss: 0.4083, test_loss: 1.4144, test_f1: 0.5937
 epoch: 89, train_loss: 0.4749, test_loss: 1.3592, test_f1: 0.6097
 epoch: 90, train_loss: 0.4415, test_loss: 1.5552, test_f1: 0.6170
 epoch: 91, train_loss: 0.4281, test_loss: 1.6977, test_f1: 0.6112
 epoch: 92, train_loss: 0.4296, test_loss: 1.4406, test_f1: 0.6114
 epoch: 93, train_loss: 0.4441, test_loss: 1.3768, test_f1: 0.6294
 epoch: 94, train_loss: 0.4346, test_loss: 1.5627, test_f1: 0.6193
 epoch: 95, train_loss: 0.4181, test_loss: 1.2819, test_f1: 0.6065
 epoch: 96, train_loss: 0.4164, test_loss: 1.3559, test_f1: 0.6496
 epoch: 97, train_loss: 0.4064, test_loss: 1.5312, test_f1: 0.5965
 epoch: 98, train_loss: 0.3973, test_loss: 1.4876, test_f1: 0.6134
 epoch: 99, train_loss: 0.3916, test_loss: 1.5041, test_f1: 0.5679

Training completed in 507.42 seconds
Best F1: 0.6797 at epoch 78
Mean F1 across iterations: 0.6606  0.0133
========================FINAL RESULTS================================
FEGIN weighted F1: 0.6797  0.0133
python main.py --data ltspice_demos --representation component_pin_net --model FEGIN --layers 2 --hiddens 64 --batch_size 32 --lr 0.01 --emb_size 128 --epochs 100 --save_appendix component_pin_net_L2_H64_BS32_LR0.01_E128 --no_val
-----



STDERR:
  File "main.py", line 370, in <module>
    main()
  File "main.py", line 254, in main
    dataset = dataset_class(
  File "/home/philip/projects/ltspice_examples_code_repo/Circuit-Completion-Using-GNNs/component_classification_with_link_prediction_head/evaluation/FEGIN/kernel/circuit_datasets.py", line 15, in __init__
    self.data, self.slices = torch.load(self.processed_paths[0])
  File "/home/philip/.local/lib/python3.8/site-packages/torch/serialization.py", line 1040, in load
    warnings.warn(
  File "/usr/lib/python3.8/warnings.py", line 109, in _showwarnmsg
    sw(msg.message, msg.category, msg.filename, msg.lineno,
  File "main.py", line 47, in warn_with_traceback
    traceback.print_stack(file=log)
/home/philip/projects/ltspice_examples_code_repo/Circuit-Completion-Using-GNNs/component_classification_with_link_prediction_head/evaluation/FEGIN/kernel/circuit_datasets.py:15: FutureWarning: You are using `torch.load` with `weights_only=False` (the current default value), which uses the default pickle module implicitly. It is possible to construct malicious pickle data which will execute arbitrary code during unpickling (See https://github.com/pytorch/pytorch/blob/main/SECURITY.md#untrusted-models for more details). In a future release, the default value for `weights_only` will be flipped to `True`. This limits the functions that could be executed during unpickling. Arbitrary objects will no longer be allowed to be loaded via this mode unless they are explicitly allowlisted by the user via `torch.serialization.add_safe_globals`. We recommend you start setting `weights_only=True` for any use case where you don't have full control of the loaded file. Please open an issue on GitHub for any issues related to this experimental feature.
  self.data, self.slices = torch.load(self.processed_paths[0])
