STDOUT:
Results will be saved in /home/philip/projects/ltspice_examples_code_repo/Circuit-Completion-Using-GNNs/component_classification_with_link_prediction_head/evaluation/FEGIN/results/model_FEGIN_dataset_ltspice_examples
Command line input: python main.py --data ltspice_examples --representation component_pin_net --model FEGIN --layers 3 --hiddens 16 --batch_size 128 --lr 0.001 --emb_size 128 --epochs 100 --save_appendix component_pin_net_L3_H16_BS128_LR0.001_E128 --no_val
 is saved.
-----
ltspice_examples - FEGIN
Using 3 layers, 16 hidden units, h = 2
Loading component_pin_net representation dataset
ENTERED
Training FEGIN on component_pin_net representation
Train: 3558, Test: 846
##################ITERATION #0 ****************************************
 epoch: 0, train_loss: 1.3434, test_loss: 1.3425, test_f1: 0.2270
 epoch: 1, train_loss: 1.3179, test_loss: 1.3256, test_f1: 0.2270
 epoch: 2, train_loss: 1.2818, test_loss: 1.2477, test_f1: 0.3366
 epoch: 3, train_loss: 1.2125, test_loss: 1.1652, test_f1: 0.3422
 epoch: 4, train_loss: 1.1494, test_loss: 1.1163, test_f1: 0.3422
 epoch: 5, train_loss: 1.1002, test_loss: 1.1231, test_f1: 0.3413
 epoch: 6, train_loss: 1.0776, test_loss: 1.0718, test_f1: 0.3681
 epoch: 7, train_loss: 1.0609, test_loss: 1.0613, test_f1: 0.3440
 epoch: 8, train_loss: 1.0564, test_loss: 1.0414, test_f1: 0.3606
 epoch: 9, train_loss: 1.0462, test_loss: 1.0553, test_f1: 0.3551
 epoch: 10, train_loss: 1.0389, test_loss: 1.0358, test_f1: 0.3602
 epoch: 11, train_loss: 1.0337, test_loss: 1.0320, test_f1: 0.3447
 epoch: 12, train_loss: 1.0337, test_loss: 1.0751, test_f1: 0.3360
 epoch: 13, train_loss: 1.0249, test_loss: 1.0284, test_f1: 0.3421
 epoch: 14, train_loss: 1.0144, test_loss: 1.0016, test_f1: 0.3482
 epoch: 15, train_loss: 1.0088, test_loss: 1.0023, test_f1: 0.3832
 epoch: 16, train_loss: 0.9902, test_loss: 1.0152, test_f1: 0.4285
 epoch: 17, train_loss: 0.9825, test_loss: 0.9745, test_f1: 0.4820
 epoch: 18, train_loss: 0.9741, test_loss: 0.9889, test_f1: 0.4693
 epoch: 19, train_loss: 0.9629, test_loss: 0.9626, test_f1: 0.4733
 epoch: 20, train_loss: 0.9463, test_loss: 0.9290, test_f1: 0.4851
 epoch: 21, train_loss: 0.9520, test_loss: 0.9830, test_f1: 0.4840
 epoch: 22, train_loss: 0.9456, test_loss: 0.9455, test_f1: 0.4903
 epoch: 23, train_loss: 0.9276, test_loss: 0.9073, test_f1: 0.4914
 epoch: 24, train_loss: 0.9379, test_loss: 0.9116, test_f1: 0.4857
 epoch: 25, train_loss: 0.9222, test_loss: 0.9598, test_f1: 0.4631
 epoch: 26, train_loss: 0.9140, test_loss: 0.9231, test_f1: 0.4957
 epoch: 27, train_loss: 0.9150, test_loss: 0.9512, test_f1: 0.4750
 epoch: 28, train_loss: 0.9186, test_loss: 0.8923, test_f1: 0.5103
 epoch: 29, train_loss: 0.9167, test_loss: 0.8924, test_f1: 0.5061
 epoch: 30, train_loss: 0.9103, test_loss: 0.9075, test_f1: 0.5009
 epoch: 31, train_loss: 0.9042, test_loss: 0.8807, test_f1: 0.5211
 epoch: 32, train_loss: 0.8896, test_loss: 0.9188, test_f1: 0.4908
 epoch: 33, train_loss: 0.8945, test_loss: 0.9542, test_f1: 0.4939
 epoch: 34, train_loss: 0.8882, test_loss: 0.8795, test_f1: 0.5088
 epoch: 35, train_loss: 0.8889, test_loss: 0.8764, test_f1: 0.5125
 epoch: 36, train_loss: 0.8902, test_loss: 0.9149, test_f1: 0.5026
 epoch: 37, train_loss: 0.8894, test_loss: 0.8550, test_f1: 0.5228
 epoch: 38, train_loss: 0.8867, test_loss: 0.8756, test_f1: 0.5502
 epoch: 39, train_loss: 0.8761, test_loss: 0.8662, test_f1: 0.5249
 epoch: 40, train_loss: 0.8647, test_loss: 0.8726, test_f1: 0.5221
 epoch: 41, train_loss: 0.8710, test_loss: 0.8685, test_f1: 0.4988
 epoch: 42, train_loss: 0.8636, test_loss: 0.8588, test_f1: 0.5421
 epoch: 43, train_loss: 0.8601, test_loss: 0.8888, test_f1: 0.5093
 epoch: 44, train_loss: 0.8592, test_loss: 0.8531, test_f1: 0.5512
 epoch: 45, train_loss: 0.8591, test_loss: 0.8621, test_f1: 0.5594
 epoch: 46, train_loss: 0.8548, test_loss: 0.9806, test_f1: 0.4885
 epoch: 47, train_loss: 0.8588, test_loss: 0.8662, test_f1: 0.5276
 epoch: 48, train_loss: 0.8508, test_loss: 0.8613, test_f1: 0.5483
 epoch: 49, train_loss: 0.8618, test_loss: 0.8467, test_f1: 0.5637
 epoch: 50, train_loss: 0.8504, test_loss: 0.9135, test_f1: 0.5198
 epoch: 51, train_loss: 0.8358, test_loss: 0.8578, test_f1: 0.5276
 epoch: 52, train_loss: 0.8285, test_loss: 0.8269, test_f1: 0.5401
 epoch: 53, train_loss: 0.8321, test_loss: 0.8602, test_f1: 0.5313
 epoch: 54, train_loss: 0.8290, test_loss: 0.8653, test_f1: 0.5136
 epoch: 55, train_loss: 0.8198, test_loss: 0.8817, test_f1: 0.5140
 epoch: 56, train_loss: 0.8247, test_loss: 0.8368, test_f1: 0.5317
 epoch: 57, train_loss: 0.8196, test_loss: 0.8446, test_f1: 0.5339
 epoch: 58, train_loss: 0.8284, test_loss: 0.8743, test_f1: 0.5295
 epoch: 59, train_loss: 0.8198, test_loss: 0.8920, test_f1: 0.5291
 epoch: 60, train_loss: 0.8146, test_loss: 0.8636, test_f1: 0.5233
 epoch: 61, train_loss: 0.8200, test_loss: 0.8391, test_f1: 0.5383
 epoch: 62, train_loss: 0.8114, test_loss: 0.8659, test_f1: 0.5329
 epoch: 63, train_loss: 0.8221, test_loss: 0.8419, test_f1: 0.5345
 epoch: 64, train_loss: 0.8230, test_loss: 0.8734, test_f1: 0.5696
 epoch: 65, train_loss: 0.8215, test_loss: 0.8390, test_f1: 0.5471
 epoch: 66, train_loss: 0.8112, test_loss: 0.9454, test_f1: 0.5115
 epoch: 67, train_loss: 0.8083, test_loss: 0.8632, test_f1: 0.5277
 epoch: 68, train_loss: 0.8075, test_loss: 0.8622, test_f1: 0.5276
 epoch: 69, train_loss: 0.8090, test_loss: 0.8536, test_f1: 0.5253
 epoch: 70, train_loss: 0.8116, test_loss: 0.8992, test_f1: 0.5325
 epoch: 71, train_loss: 0.8096, test_loss: 0.8726, test_f1: 0.5336
 epoch: 72, train_loss: 0.8030, test_loss: 0.9009, test_f1: 0.5248
 epoch: 73, train_loss: 0.8019, test_loss: 0.9309, test_f1: 0.5075
 epoch: 74, train_loss: 0.8090, test_loss: 0.9077, test_f1: 0.5355
 epoch: 75, train_loss: 0.7945, test_loss: 0.8745, test_f1: 0.5254
 epoch: 76, train_loss: 0.8008, test_loss: 0.9077, test_f1: 0.5293
 epoch: 77, train_loss: 0.8002, test_loss: 0.8789, test_f1: 0.5359
 epoch: 78, train_loss: 0.7950, test_loss: 0.8996, test_f1: 0.5324
 epoch: 79, train_loss: 0.8043, test_loss: 0.8946, test_f1: 0.5102
 epoch: 80, train_loss: 0.7990, test_loss: 0.8842, test_f1: 0.5266
 epoch: 81, train_loss: 0.7918, test_loss: 0.8890, test_f1: 0.5266
 epoch: 82, train_loss: 0.7950, test_loss: 0.8919, test_f1: 0.5304
 epoch: 83, train_loss: 0.7937, test_loss: 0.8670, test_f1: 0.5334
 epoch: 84, train_loss: 0.7950, test_loss: 0.9607, test_f1: 0.5226
 epoch: 85, train_loss: 0.7952, test_loss: 0.8877, test_f1: 0.5298
 epoch: 86, train_loss: 0.8024, test_loss: 0.9008, test_f1: 0.5394
 epoch: 87, train_loss: 0.7859, test_loss: 0.9485, test_f1: 0.5161
 epoch: 88, train_loss: 0.7978, test_loss: 0.9165, test_f1: 0.5097
 epoch: 89, train_loss: 0.7884, test_loss: 0.8924, test_f1: 0.5413
 epoch: 90, train_loss: 0.7892, test_loss: 0.8904, test_f1: 0.5350
 epoch: 91, train_loss: 0.7812, test_loss: 0.8975, test_f1: 0.5303
 epoch: 92, train_loss: 0.7713, test_loss: 0.9008, test_f1: 0.5479
 epoch: 93, train_loss: 0.7958, test_loss: 0.8784, test_f1: 0.5569
 epoch: 94, train_loss: 0.7822, test_loss: 0.9721, test_f1: 0.5083
 epoch: 95, train_loss: 0.7786, test_loss: 0.9323, test_f1: 0.5494
 epoch: 96, train_loss: 0.7855, test_loss: 0.9035, test_f1: 0.5279
 epoch: 97, train_loss: 0.7758, test_loss: 0.9121, test_f1: 0.5192
 epoch: 98, train_loss: 0.7796, test_loss: 0.9120, test_f1: 0.5206
 epoch: 99, train_loss: 0.7779, test_loss: 0.8911, test_f1: 0.5664
##################ITERATION #1 ****************************************
 epoch: 0, train_loss: 1.2925, test_loss: 1.3104, test_f1: 0.2270
 epoch: 1, train_loss: 1.2143, test_loss: 1.2353, test_f1: 0.2270
 epoch: 2, train_loss: 1.1633, test_loss: 1.1272, test_f1: 0.3515
 epoch: 3, train_loss: 1.1199, test_loss: 1.0780, test_f1: 0.4128
 epoch: 4, train_loss: 1.0856, test_loss: 1.0525, test_f1: 0.4147
 epoch: 5, train_loss: 1.0591, test_loss: 1.0429, test_f1: 0.4392
 epoch: 6, train_loss: 1.0405, test_loss: 1.0214, test_f1: 0.4724
 epoch: 7, train_loss: 1.0332, test_loss: 0.9892, test_f1: 0.4613
 epoch: 8, train_loss: 1.0213, test_loss: 0.9942, test_f1: 0.4734
 epoch: 9, train_loss: 1.0175, test_loss: 0.9901, test_f1: 0.4719
 epoch: 10, train_loss: 0.9982, test_loss: 0.9650, test_f1: 0.4923
 epoch: 11, train_loss: 0.9913, test_loss: 0.9544, test_f1: 0.4841
 epoch: 12, train_loss: 0.9903, test_loss: 0.9478, test_f1: 0.5067
 epoch: 13, train_loss: 0.9845, test_loss: 0.9517, test_f1: 0.4889
 epoch: 14, train_loss: 0.9701, test_loss: 0.9459, test_f1: 0.5014
 epoch: 15, train_loss: 0.9659, test_loss: 0.9325, test_f1: 0.5192
 epoch: 16, train_loss: 0.9624, test_loss: 0.9152, test_f1: 0.5176
 epoch: 17, train_loss: 0.9467, test_loss: 0.9144, test_f1: 0.5085
 epoch: 18, train_loss: 0.9455, test_loss: 0.9048, test_f1: 0.5390
 epoch: 19, train_loss: 0.9453, test_loss: 0.9274, test_f1: 0.5216
 epoch: 20, train_loss: 0.9345, test_loss: 0.8945, test_f1: 0.5396
 epoch: 21, train_loss: 0.9336, test_loss: 0.8820, test_f1: 0.5299
 epoch: 22, train_loss: 0.9215, test_loss: 0.8828, test_f1: 0.5319
 epoch: 23, train_loss: 0.9186, test_loss: 0.8800, test_f1: 0.5349
 epoch: 24, train_loss: 0.9100, test_loss: 0.9303, test_f1: 0.5249
 epoch: 25, train_loss: 0.9065, test_loss: 0.9038, test_f1: 0.5305
 epoch: 26, train_loss: 0.9089, test_loss: 0.8767, test_f1: 0.5237
 epoch: 27, train_loss: 0.9010, test_loss: 1.0080, test_f1: 0.4965
 epoch: 28, train_loss: 0.8913, test_loss: 0.8538, test_f1: 0.5516
 epoch: 29, train_loss: 0.8858, test_loss: 0.8737, test_f1: 0.5578
 epoch: 30, train_loss: 0.8962, test_loss: 0.8846, test_f1: 0.5276
 epoch: 31, train_loss: 0.8803, test_loss: 0.8939, test_f1: 0.5157
 epoch: 32, train_loss: 0.8854, test_loss: 0.8489, test_f1: 0.5383
 epoch: 33, train_loss: 0.8784, test_loss: 0.9154, test_f1: 0.5316
 epoch: 34, train_loss: 0.8783, test_loss: 0.9155, test_f1: 0.5053
 epoch: 35, train_loss: 0.8707, test_loss: 0.8722, test_f1: 0.5400
 epoch: 36, train_loss: 0.8672, test_loss: 0.8987, test_f1: 0.5224
 epoch: 37, train_loss: 0.8598, test_loss: 0.8627, test_f1: 0.5380
 epoch: 38, train_loss: 0.8671, test_loss: 0.8472, test_f1: 0.5567
 epoch: 39, train_loss: 0.8619, test_loss: 0.8437, test_f1: 0.5594
 epoch: 40, train_loss: 0.8532, test_loss: 0.8441, test_f1: 0.5309
 epoch: 41, train_loss: 0.8686, test_loss: 0.8780, test_f1: 0.5296
 epoch: 42, train_loss: 0.8501, test_loss: 0.9450, test_f1: 0.5102
 epoch: 43, train_loss: 0.8527, test_loss: 0.8572, test_f1: 0.5314
 epoch: 44, train_loss: 0.8408, test_loss: 0.9200, test_f1: 0.5133
 epoch: 45, train_loss: 0.8435, test_loss: 0.8682, test_f1: 0.5438
 epoch: 46, train_loss: 0.8473, test_loss: 0.8522, test_f1: 0.5454
 epoch: 47, train_loss: 0.8460, test_loss: 0.8855, test_f1: 0.5064
 epoch: 48, train_loss: 0.8199, test_loss: 0.9268, test_f1: 0.4922
 epoch: 49, train_loss: 0.8397, test_loss: 0.8540, test_f1: 0.5165
 epoch: 50, train_loss: 0.8358, test_loss: 0.8600, test_f1: 0.5559
 epoch: 51, train_loss: 0.8389, test_loss: 0.8521, test_f1: 0.5409
 epoch: 52, train_loss: 0.8251, test_loss: 0.8744, test_f1: 0.5163
 epoch: 53, train_loss: 0.8158, test_loss: 0.8730, test_f1: 0.5212
 epoch: 54, train_loss: 0.8185, test_loss: 0.8923, test_f1: 0.5172
 epoch: 55, train_loss: 0.8150, test_loss: 0.8760, test_f1: 0.5236
 epoch: 56, train_loss: 0.8208, test_loss: 0.8606, test_f1: 0.5211
 epoch: 57, train_loss: 0.8165, test_loss: 0.8484, test_f1: 0.5220
 epoch: 58, train_loss: 0.8232, test_loss: 0.9051, test_f1: 0.5373
 epoch: 59, train_loss: 0.7989, test_loss: 0.8766, test_f1: 0.5243
 epoch: 60, train_loss: 0.8076, test_loss: 0.9333, test_f1: 0.5160
 epoch: 61, train_loss: 0.8065, test_loss: 0.8954, test_f1: 0.5169
 epoch: 62, train_loss: 0.8042, test_loss: 0.9112, test_f1: 0.5146
 epoch: 63, train_loss: 0.8053, test_loss: 0.8965, test_f1: 0.5253
 epoch: 64, train_loss: 0.8101, test_loss: 0.9162, test_f1: 0.5389
 epoch: 65, train_loss: 0.8134, test_loss: 0.9266, test_f1: 0.5146
 epoch: 66, train_loss: 0.7905, test_loss: 0.9235, test_f1: 0.5255
 epoch: 67, train_loss: 0.7957, test_loss: 0.9153, test_f1: 0.5224
 epoch: 68, train_loss: 0.7986, test_loss: 0.8945, test_f1: 0.5367
 epoch: 69, train_loss: 0.7934, test_loss: 0.9404, test_f1: 0.5448
 epoch: 70, train_loss: 0.8040, test_loss: 0.8857, test_f1: 0.5384
 epoch: 71, train_loss: 0.7982, test_loss: 0.8755, test_f1: 0.5500
 epoch: 72, train_loss: 0.7948, test_loss: 0.9489, test_f1: 0.5083
 epoch: 73, train_loss: 0.8008, test_loss: 0.9262, test_f1: 0.5238
 epoch: 74, train_loss: 0.7956, test_loss: 0.9402, test_f1: 0.5234
 epoch: 75, train_loss: 0.7946, test_loss: 0.9405, test_f1: 0.5298
 epoch: 76, train_loss: 0.7987, test_loss: 0.9725, test_f1: 0.5197
 epoch: 77, train_loss: 0.7821, test_loss: 0.9253, test_f1: 0.5276
 epoch: 78, train_loss: 0.7829, test_loss: 0.9235, test_f1: 0.5223
 epoch: 79, train_loss: 0.7864, test_loss: 0.9562, test_f1: 0.5111
 epoch: 80, train_loss: 0.7863, test_loss: 0.9625, test_f1: 0.5033
 epoch: 81, train_loss: 0.7915, test_loss: 0.9593, test_f1: 0.5207
 epoch: 82, train_loss: 0.7855, test_loss: 0.9564, test_f1: 0.5141
 epoch: 83, train_loss: 0.7841, test_loss: 0.9359, test_f1: 0.5279
 epoch: 84, train_loss: 0.7806, test_loss: 0.9281, test_f1: 0.5264
 epoch: 85, train_loss: 0.7843, test_loss: 0.9676, test_f1: 0.5334
 epoch: 86, train_loss: 0.7780, test_loss: 0.9560, test_f1: 0.5207
 epoch: 87, train_loss: 0.7845, test_loss: 0.9246, test_f1: 0.5233
 epoch: 88, train_loss: 0.7727, test_loss: 0.9510, test_f1: 0.5116
 epoch: 89, train_loss: 0.7881, test_loss: 0.9629, test_f1: 0.5307
 epoch: 90, train_loss: 0.7717, test_loss: 0.9531, test_f1: 0.5274
 epoch: 91, train_loss: 0.7897, test_loss: 0.9532, test_f1: 0.5220
 epoch: 92, train_loss: 0.7733, test_loss: 0.9555, test_f1: 0.5235
 epoch: 93, train_loss: 0.7686, test_loss: 0.9408, test_f1: 0.5278
 epoch: 94, train_loss: 0.7777, test_loss: 0.9488, test_f1: 0.5329
 epoch: 95, train_loss: 0.7752, test_loss: 0.9467, test_f1: 0.5334
 epoch: 96, train_loss: 0.7711, test_loss: 0.9504, test_f1: 0.5330
 epoch: 97, train_loss: 0.7739, test_loss: 0.9348, test_f1: 0.5364
 epoch: 98, train_loss: 0.7716, test_loss: 0.9512, test_f1: 0.5211
 epoch: 99, train_loss: 0.7755, test_loss: 0.8965, test_f1: 0.5360
##################ITERATION #2 ****************************************
 epoch: 0, train_loss: 1.2774, test_loss: 1.2845, test_f1: 0.2270
 epoch: 1, train_loss: 1.1382, test_loss: 1.1339, test_f1: 0.3351
 epoch: 2, train_loss: 1.0973, test_loss: 1.0693, test_f1: 0.3485
 epoch: 3, train_loss: 1.0738, test_loss: 1.0505, test_f1: 0.3560
 epoch: 4, train_loss: 1.0598, test_loss: 1.0461, test_f1: 0.3600
 epoch: 5, train_loss: 1.0489, test_loss: 1.0422, test_f1: 0.3927
 epoch: 6, train_loss: 1.0376, test_loss: 1.0409, test_f1: 0.3836
 epoch: 7, train_loss: 1.0294, test_loss: 1.0388, test_f1: 0.3758
 epoch: 8, train_loss: 1.0278, test_loss: 1.0342, test_f1: 0.3903
 epoch: 9, train_loss: 1.0163, test_loss: 1.0235, test_f1: 0.4188
 epoch: 10, train_loss: 1.0048, test_loss: 1.0142, test_f1: 0.4320
 epoch: 11, train_loss: 0.9939, test_loss: 1.0405, test_f1: 0.4082
 epoch: 12, train_loss: 0.9800, test_loss: 0.9534, test_f1: 0.4779
 epoch: 13, train_loss: 0.9728, test_loss: 0.9870, test_f1: 0.4719
 epoch: 14, train_loss: 0.9623, test_loss: 1.0132, test_f1: 0.4703
 epoch: 15, train_loss: 0.9624, test_loss: 0.9469, test_f1: 0.5052
 epoch: 16, train_loss: 0.9557, test_loss: 0.9682, test_f1: 0.4960
 epoch: 17, train_loss: 0.9575, test_loss: 0.9848, test_f1: 0.4749
 epoch: 18, train_loss: 0.9546, test_loss: 0.9717, test_f1: 0.5068
 epoch: 19, train_loss: 0.9452, test_loss: 0.9333, test_f1: 0.4992
 epoch: 20, train_loss: 0.9362, test_loss: 0.9657, test_f1: 0.4791
 epoch: 21, train_loss: 0.9344, test_loss: 0.9593, test_f1: 0.4924
 epoch: 22, train_loss: 0.9339, test_loss: 0.9438, test_f1: 0.4983
 epoch: 23, train_loss: 0.9289, test_loss: 0.9194, test_f1: 0.4998
 epoch: 24, train_loss: 0.9181, test_loss: 0.9951, test_f1: 0.4906
 epoch: 25, train_loss: 0.9172, test_loss: 0.9564, test_f1: 0.4979
 epoch: 26, train_loss: 0.9132, test_loss: 0.9246, test_f1: 0.5199
 epoch: 27, train_loss: 0.9052, test_loss: 0.9561, test_f1: 0.5052
 epoch: 28, train_loss: 0.9181, test_loss: 1.0755, test_f1: 0.4468
 epoch: 29, train_loss: 0.9101, test_loss: 0.9306, test_f1: 0.5020
 epoch: 30, train_loss: 0.8987, test_loss: 0.9454, test_f1: 0.5024
 epoch: 31, train_loss: 0.8920, test_loss: 0.9276, test_f1: 0.5112
 epoch: 32, train_loss: 0.8905, test_loss: 1.0179, test_f1: 0.4665
 epoch: 33, train_loss: 0.8928, test_loss: 0.9894, test_f1: 0.5012
 epoch: 34, train_loss: 0.8864, test_loss: 0.9424, test_f1: 0.4952
 epoch: 35, train_loss: 0.8900, test_loss: 0.9599, test_f1: 0.5168
 epoch: 36, train_loss: 0.8859, test_loss: 0.9646, test_f1: 0.5008
 epoch: 37, train_loss: 0.8857, test_loss: 0.9627, test_f1: 0.5180
 epoch: 38, train_loss: 0.8758, test_loss: 0.9447, test_f1: 0.5057
 epoch: 39, train_loss: 0.8671, test_loss: 0.9467, test_f1: 0.5176
 epoch: 40, train_loss: 0.8620, test_loss: 0.9341, test_f1: 0.5163
 epoch: 41, train_loss: 0.8617, test_loss: 0.9530, test_f1: 0.5459
 epoch: 42, train_loss: 0.8564, test_loss: 0.9418, test_f1: 0.5258
 epoch: 43, train_loss: 0.8632, test_loss: 0.9448, test_f1: 0.5265
 epoch: 44, train_loss: 0.8649, test_loss: 0.9271, test_f1: 0.5254
 epoch: 45, train_loss: 0.8570, test_loss: 0.9294, test_f1: 0.5128
 epoch: 46, train_loss: 0.8582, test_loss: 0.9691, test_f1: 0.5167
 epoch: 47, train_loss: 0.8601, test_loss: 0.9348, test_f1: 0.5247
 epoch: 48, train_loss: 0.8516, test_loss: 0.9547, test_f1: 0.5243
 epoch: 49, train_loss: 0.8467, test_loss: 0.9473, test_f1: 0.5194
 epoch: 50, train_loss: 0.8427, test_loss: 0.9435, test_f1: 0.5201
 epoch: 51, train_loss: 0.8396, test_loss: 0.9494, test_f1: 0.5206
 epoch: 52, train_loss: 0.8272, test_loss: 0.9362, test_f1: 0.5192
 epoch: 53, train_loss: 0.8299, test_loss: 0.9154, test_f1: 0.5317
 epoch: 54, train_loss: 0.8352, test_loss: 0.9453, test_f1: 0.5259
 epoch: 55, train_loss: 0.8322, test_loss: 0.9304, test_f1: 0.5237
 epoch: 56, train_loss: 0.8213, test_loss: 0.9379, test_f1: 0.5306
 epoch: 57, train_loss: 0.8217, test_loss: 0.9352, test_f1: 0.5336
 epoch: 58, train_loss: 0.8246, test_loss: 0.9234, test_f1: 0.5319
 epoch: 59, train_loss: 0.8265, test_loss: 0.9430, test_f1: 0.5117
 epoch: 60, train_loss: 0.8321, test_loss: 0.9295, test_f1: 0.5200
 epoch: 61, train_loss: 0.8160, test_loss: 0.9289, test_f1: 0.5277
 epoch: 62, train_loss: 0.8165, test_loss: 0.9428, test_f1: 0.5243
 epoch: 63, train_loss: 0.8147, test_loss: 0.9320, test_f1: 0.5373
 epoch: 64, train_loss: 0.8159, test_loss: 0.9360, test_f1: 0.5295
 epoch: 65, train_loss: 0.8167, test_loss: 0.9282, test_f1: 0.5230
 epoch: 66, train_loss: 0.8045, test_loss: 0.9453, test_f1: 0.5390
 epoch: 67, train_loss: 0.8098, test_loss: 0.9473, test_f1: 0.5356
 epoch: 68, train_loss: 0.8128, test_loss: 0.9371, test_f1: 0.5306
 epoch: 69, train_loss: 0.8094, test_loss: 0.9356, test_f1: 0.5235
 epoch: 70, train_loss: 0.8077, test_loss: 0.9301, test_f1: 0.5350
 epoch: 71, train_loss: 0.8046, test_loss: 0.9511, test_f1: 0.5267
 epoch: 72, train_loss: 0.8036, test_loss: 0.9427, test_f1: 0.5247
 epoch: 73, train_loss: 0.8041, test_loss: 0.9433, test_f1: 0.5277
 epoch: 74, train_loss: 0.8068, test_loss: 0.9515, test_f1: 0.5259
 epoch: 75, train_loss: 0.8087, test_loss: 0.9424, test_f1: 0.5378
 epoch: 76, train_loss: 0.8021, test_loss: 0.9514, test_f1: 0.5276
 epoch: 77, train_loss: 0.8050, test_loss: 0.9383, test_f1: 0.5418
 epoch: 78, train_loss: 0.8115, test_loss: 0.9448, test_f1: 0.5188
 epoch: 79, train_loss: 0.7964, test_loss: 0.9487, test_f1: 0.5181
 epoch: 80, train_loss: 0.8005, test_loss: 0.9463, test_f1: 0.5167
 epoch: 81, train_loss: 0.7943, test_loss: 0.9404, test_f1: 0.5295
 epoch: 82, train_loss: 0.8012, test_loss: 0.9600, test_f1: 0.5431
 epoch: 83, train_loss: 0.8004, test_loss: 0.9161, test_f1: 0.5505
 epoch: 84, train_loss: 0.7910, test_loss: 0.9782, test_f1: 0.5415
 epoch: 85, train_loss: 0.8008, test_loss: 0.9383, test_f1: 0.5340
 epoch: 86, train_loss: 0.7819, test_loss: 0.9195, test_f1: 0.5470
 epoch: 87, train_loss: 0.7899, test_loss: 0.9609, test_f1: 0.5300
 epoch: 88, train_loss: 0.7846, test_loss: 0.9529, test_f1: 0.5246
 epoch: 89, train_loss: 0.7800, test_loss: 0.9360, test_f1: 0.5383
 epoch: 90, train_loss: 0.7884, test_loss: 0.9324, test_f1: 0.5365
 epoch: 91, train_loss: 0.7973, test_loss: 0.9465, test_f1: 0.5274
 epoch: 92, train_loss: 0.7919, test_loss: 0.9394, test_f1: 0.5351
 epoch: 93, train_loss: 0.7993, test_loss: 0.9334, test_f1: 0.5545
 epoch: 94, train_loss: 0.7857, test_loss: 0.9367, test_f1: 0.5547
 epoch: 95, train_loss: 0.7864, test_loss: 0.9371, test_f1: 0.5331
 epoch: 96, train_loss: 0.7970, test_loss: 0.9299, test_f1: 0.5280
 epoch: 97, train_loss: 0.7909, test_loss: 0.9535, test_f1: 0.5402
 epoch: 98, train_loss: 0.7758, test_loss: 0.9370, test_f1: 0.5508
 epoch: 99, train_loss: 0.7846, test_loss: 0.9338, test_f1: 0.5502
##################ITERATION #3 ****************************************
 epoch: 0, train_loss: 1.2165, test_loss: 1.2790, test_f1: 0.2270
 epoch: 1, train_loss: 1.1082, test_loss: 1.1166, test_f1: 0.3441
 epoch: 2, train_loss: 1.0659, test_loss: 1.0462, test_f1: 0.3581
 epoch: 3, train_loss: 1.0397, test_loss: 1.0291, test_f1: 0.3914
 epoch: 4, train_loss: 1.0241, test_loss: 1.0314, test_f1: 0.3981
 epoch: 5, train_loss: 1.0167, test_loss: 1.0119, test_f1: 0.4380
 epoch: 6, train_loss: 1.0009, test_loss: 1.0086, test_f1: 0.4170
 epoch: 7, train_loss: 0.9887, test_loss: 1.0095, test_f1: 0.4270
 epoch: 8, train_loss: 0.9897, test_loss: 1.0175, test_f1: 0.4088
 epoch: 9, train_loss: 0.9784, test_loss: 1.0168, test_f1: 0.4043
 epoch: 10, train_loss: 0.9697, test_loss: 0.9976, test_f1: 0.4839
 epoch: 11, train_loss: 0.9600, test_loss: 0.9974, test_f1: 0.4878
 epoch: 12, train_loss: 0.9505, test_loss: 0.9744, test_f1: 0.4757
 epoch: 13, train_loss: 0.9432, test_loss: 0.9657, test_f1: 0.4797
 epoch: 14, train_loss: 0.9388, test_loss: 0.9868, test_f1: 0.4751
 epoch: 15, train_loss: 0.9272, test_loss: 0.9598, test_f1: 0.4893
 epoch: 16, train_loss: 0.9337, test_loss: 1.0083, test_f1: 0.4868
 epoch: 17, train_loss: 0.9145, test_loss: 0.9576, test_f1: 0.4495
 epoch: 18, train_loss: 0.9435, test_loss: 1.0218, test_f1: 0.4467
 epoch: 19, train_loss: 0.9204, test_loss: 0.9654, test_f1: 0.4957
 epoch: 20, train_loss: 0.9116, test_loss: 0.9418, test_f1: 0.4854
 epoch: 21, train_loss: 0.9076, test_loss: 0.9263, test_f1: 0.4826
 epoch: 22, train_loss: 0.9025, test_loss: 0.9277, test_f1: 0.4971
 epoch: 23, train_loss: 0.8934, test_loss: 0.9168, test_f1: 0.4854
 epoch: 24, train_loss: 0.9075, test_loss: 0.9577, test_f1: 0.4946
 epoch: 25, train_loss: 0.8957, test_loss: 0.9239, test_f1: 0.4969
 epoch: 26, train_loss: 0.8914, test_loss: 0.9481, test_f1: 0.4975
 epoch: 27, train_loss: 0.8912, test_loss: 0.8883, test_f1: 0.4929
 epoch: 28, train_loss: 0.8860, test_loss: 0.9241, test_f1: 0.5118
 epoch: 29, train_loss: 0.8893, test_loss: 0.9063, test_f1: 0.5007
 epoch: 30, train_loss: 0.8762, test_loss: 0.9035, test_f1: 0.4980
 epoch: 31, train_loss: 0.8788, test_loss: 0.9858, test_f1: 0.4969
 epoch: 32, train_loss: 0.8810, test_loss: 0.9217, test_f1: 0.4750
 epoch: 33, train_loss: 0.8709, test_loss: 0.9090, test_f1: 0.4607
 epoch: 34, train_loss: 0.8754, test_loss: 0.9052, test_f1: 0.4820
 epoch: 35, train_loss: 0.8689, test_loss: 0.9012, test_f1: 0.5004
 epoch: 36, train_loss: 0.8657, test_loss: 0.8875, test_f1: 0.5061
 epoch: 37, train_loss: 0.8599, test_loss: 0.9276, test_f1: 0.5179
 epoch: 38, train_loss: 0.8646, test_loss: 0.9059, test_f1: 0.5007
 epoch: 39, train_loss: 0.8556, test_loss: 0.9378, test_f1: 0.4963
 epoch: 40, train_loss: 0.8537, test_loss: 0.9267, test_f1: 0.4945
 epoch: 41, train_loss: 0.8535, test_loss: 0.8696, test_f1: 0.5134
 epoch: 42, train_loss: 0.8540, test_loss: 1.0016, test_f1: 0.4993
 epoch: 43, train_loss: 0.8494, test_loss: 0.9207, test_f1: 0.4891
 epoch: 44, train_loss: 0.8515, test_loss: 0.8636, test_f1: 0.5282
 epoch: 45, train_loss: 0.8463, test_loss: 0.8758, test_f1: 0.5194
 epoch: 46, train_loss: 0.8470, test_loss: 0.9667, test_f1: 0.4947
 epoch: 47, train_loss: 0.8387, test_loss: 0.8918, test_f1: 0.5215
 epoch: 48, train_loss: 0.8380, test_loss: 0.8798, test_f1: 0.5103
 epoch: 49, train_loss: 0.8505, test_loss: 0.9712, test_f1: 0.5041
 epoch: 50, train_loss: 0.8318, test_loss: 0.9891, test_f1: 0.5109
 epoch: 51, train_loss: 0.8284, test_loss: 0.8801, test_f1: 0.5223
 epoch: 52, train_loss: 0.8263, test_loss: 0.8826, test_f1: 0.5063
 epoch: 53, train_loss: 0.8311, test_loss: 0.9047, test_f1: 0.5262
 epoch: 54, train_loss: 0.8182, test_loss: 0.8945, test_f1: 0.5206
 epoch: 55, train_loss: 0.8222, test_loss: 0.8462, test_f1: 0.5373
 epoch: 56, train_loss: 0.8165, test_loss: 0.8638, test_f1: 0.5348
 epoch: 57, train_loss: 0.8068, test_loss: 0.8429, test_f1: 0.5488
 epoch: 58, train_loss: 0.8126, test_loss: 0.9182, test_f1: 0.5306
 epoch: 59, train_loss: 0.8262, test_loss: 0.8417, test_f1: 0.5326
 epoch: 60, train_loss: 0.8137, test_loss: 0.8607, test_f1: 0.5236
 epoch: 61, train_loss: 0.8028, test_loss: 0.8574, test_f1: 0.5190
 epoch: 62, train_loss: 0.8027, test_loss: 0.8646, test_f1: 0.5293
 epoch: 63, train_loss: 0.8057, test_loss: 0.8745, test_f1: 0.5301
 epoch: 64, train_loss: 0.7996, test_loss: 0.8273, test_f1: 0.5375
 epoch: 65, train_loss: 0.8024, test_loss: 0.8936, test_f1: 0.5288
 epoch: 66, train_loss: 0.8149, test_loss: 0.9267, test_f1: 0.5138
 epoch: 67, train_loss: 0.8000, test_loss: 0.8555, test_f1: 0.5277
 epoch: 68, train_loss: 0.7938, test_loss: 0.8619, test_f1: 0.5328
 epoch: 69, train_loss: 0.7921, test_loss: 0.8590, test_f1: 0.5361
 epoch: 70, train_loss: 0.7933, test_loss: 0.8718, test_f1: 0.5251
 epoch: 71, train_loss: 0.7942, test_loss: 0.8577, test_f1: 0.5307
 epoch: 72, train_loss: 0.8010, test_loss: 0.8391, test_f1: 0.5480
 epoch: 73, train_loss: 0.7988, test_loss: 0.8746, test_f1: 0.5146
 epoch: 74, train_loss: 0.7968, test_loss: 0.8302, test_f1: 0.5374
 epoch: 75, train_loss: 0.7970, test_loss: 0.8532, test_f1: 0.5348
 epoch: 76, train_loss: 0.7974, test_loss: 0.8460, test_f1: 0.5468
 epoch: 77, train_loss: 0.7834, test_loss: 0.8461, test_f1: 0.5446
 epoch: 78, train_loss: 0.7920, test_loss: 0.8392, test_f1: 0.5558
 epoch: 79, train_loss: 0.7975, test_loss: 0.8740, test_f1: 0.5382
 epoch: 80, train_loss: 0.7880, test_loss: 0.8253, test_f1: 0.5549
 epoch: 81, train_loss: 0.7885, test_loss: 0.8348, test_f1: 0.5349
 epoch: 82, train_loss: 0.7856, test_loss: 0.8646, test_f1: 0.5243
 epoch: 83, train_loss: 0.7865, test_loss: 0.8469, test_f1: 0.5516
 epoch: 84, train_loss: 0.7933, test_loss: 0.8460, test_f1: 0.5545
 epoch: 85, train_loss: 0.7874, test_loss: 0.8307, test_f1: 0.5588
 epoch: 86, train_loss: 0.7812, test_loss: 0.8450, test_f1: 0.5400
 epoch: 87, train_loss: 0.7816, test_loss: 0.8725, test_f1: 0.5270
 epoch: 88, train_loss: 0.7681, test_loss: 0.8858, test_f1: 0.5292
 epoch: 89, train_loss: 0.7854, test_loss: 0.8699, test_f1: 0.5338
 epoch: 90, train_loss: 0.7772, test_loss: 0.8851, test_f1: 0.5371
 epoch: 91, train_loss: 0.7772, test_loss: 0.8516, test_f1: 0.5426
 epoch: 92, train_loss: 0.7785, test_loss: 0.8252, test_f1: 0.5603
 epoch: 93, train_loss: 0.7732, test_loss: 0.9241, test_f1: 0.5387
 epoch: 94, train_loss: 0.7784, test_loss: 0.8683, test_f1: 0.5255
 epoch: 95, train_loss: 0.7743, test_loss: 0.8759, test_f1: 0.5529
 epoch: 96, train_loss: 0.7716, test_loss: 0.8594, test_f1: 0.5299
 epoch: 97, train_loss: 0.7697, test_loss: 0.8492, test_f1: 0.5447
 epoch: 98, train_loss: 0.7728, test_loss: 0.8258, test_f1: 0.5432
 epoch: 99, train_loss: 0.7756, test_loss: 0.9071, test_f1: 0.5458
##################ITERATION #4 ****************************************
 epoch: 0, train_loss: 1.2242, test_loss: 1.4221, test_f1: 0.2372
 epoch: 1, train_loss: 1.0976, test_loss: 1.0751, test_f1: 0.4134
 epoch: 2, train_loss: 1.0674, test_loss: 1.0145, test_f1: 0.4288
 epoch: 3, train_loss: 1.0313, test_loss: 0.9882, test_f1: 0.4556
 epoch: 4, train_loss: 1.0149, test_loss: 0.9711, test_f1: 0.4512
 epoch: 5, train_loss: 1.0002, test_loss: 0.9617, test_f1: 0.4745
 epoch: 6, train_loss: 0.9922, test_loss: 0.9328, test_f1: 0.4959
 epoch: 7, train_loss: 0.9607, test_loss: 0.9476, test_f1: 0.4984
 epoch: 8, train_loss: 0.9649, test_loss: 0.9730, test_f1: 0.5037
 epoch: 9, train_loss: 0.9545, test_loss: 0.9429, test_f1: 0.5072
 epoch: 10, train_loss: 0.9356, test_loss: 0.8879, test_f1: 0.4897
 epoch: 11, train_loss: 0.9351, test_loss: 0.8682, test_f1: 0.5087
 epoch: 12, train_loss: 0.9176, test_loss: 0.8795, test_f1: 0.5150
 epoch: 13, train_loss: 0.9224, test_loss: 0.8719, test_f1: 0.4957
 epoch: 14, train_loss: 0.9154, test_loss: 0.8684, test_f1: 0.5074
 epoch: 15, train_loss: 0.9061, test_loss: 0.8574, test_f1: 0.5047
 epoch: 16, train_loss: 0.8972, test_loss: 0.8769, test_f1: 0.5328
 epoch: 17, train_loss: 0.8830, test_loss: 0.8487, test_f1: 0.5257
 epoch: 18, train_loss: 0.8872, test_loss: 0.8598, test_f1: 0.5370
 epoch: 19, train_loss: 0.8955, test_loss: 0.8749, test_f1: 0.5225
 epoch: 20, train_loss: 0.8910, test_loss: 0.8353, test_f1: 0.5308
 epoch: 21, train_loss: 0.8749, test_loss: 0.8824, test_f1: 0.5226
 epoch: 22, train_loss: 0.8549, test_loss: 0.9260, test_f1: 0.5368
 epoch: 23, train_loss: 0.8578, test_loss: 0.8439, test_f1: 0.5300
 epoch: 24, train_loss: 0.8573, test_loss: 0.8384, test_f1: 0.5353
 epoch: 25, train_loss: 0.8583, test_loss: 0.8182, test_f1: 0.5340
 epoch: 26, train_loss: 0.8604, test_loss: 0.8730, test_f1: 0.5344
 epoch: 27, train_loss: 0.8572, test_loss: 0.8376, test_f1: 0.5441
 epoch: 28, train_loss: 0.8539, test_loss: 0.8164, test_f1: 0.5456
 epoch: 29, train_loss: 0.8488, test_loss: 0.8314, test_f1: 0.5422
 epoch: 30, train_loss: 0.8462, test_loss: 0.8602, test_f1: 0.5334
 epoch: 31, train_loss: 0.8479, test_loss: 0.8109, test_f1: 0.5469
 epoch: 32, train_loss: 0.8221, test_loss: 0.8777, test_f1: 0.5502
 epoch: 33, train_loss: 0.8313, test_loss: 0.8165, test_f1: 0.5332
 epoch: 34, train_loss: 0.8278, test_loss: 0.8077, test_f1: 0.5447
 epoch: 35, train_loss: 0.8171, test_loss: 0.8401, test_f1: 0.5648
 epoch: 36, train_loss: 0.8197, test_loss: 0.8202, test_f1: 0.5543
 epoch: 37, train_loss: 0.8226, test_loss: 0.7949, test_f1: 0.5459
 epoch: 38, train_loss: 0.8249, test_loss: 0.8165, test_f1: 0.5529
 epoch: 39, train_loss: 0.8133, test_loss: 0.8244, test_f1: 0.5485
 epoch: 40, train_loss: 0.8102, test_loss: 0.8640, test_f1: 0.5387
 epoch: 41, train_loss: 0.8124, test_loss: 0.8063, test_f1: 0.5588
 epoch: 42, train_loss: 0.7985, test_loss: 0.7825, test_f1: 0.5843
 epoch: 43, train_loss: 0.8153, test_loss: 0.8429, test_f1: 0.5496
 epoch: 44, train_loss: 0.7993, test_loss: 0.7797, test_f1: 0.5542
 epoch: 45, train_loss: 0.8026, test_loss: 0.7886, test_f1: 0.5726
 epoch: 46, train_loss: 0.7959, test_loss: 0.8454, test_f1: 0.5591
 epoch: 47, train_loss: 0.7791, test_loss: 0.8059, test_f1: 0.5419
 epoch: 48, train_loss: 0.7920, test_loss: 0.7836, test_f1: 0.5604
 epoch: 49, train_loss: 0.7776, test_loss: 0.7688, test_f1: 0.5717
 epoch: 50, train_loss: 0.7928, test_loss: 0.7805, test_f1: 0.5710
 epoch: 51, train_loss: 0.7871, test_loss: 0.7625, test_f1: 0.5891
 epoch: 52, train_loss: 0.7752, test_loss: 0.7404, test_f1: 0.5941
 epoch: 53, train_loss: 0.7739, test_loss: 0.7471, test_f1: 0.5969
 epoch: 54, train_loss: 0.7704, test_loss: 0.7677, test_f1: 0.5809
 epoch: 55, train_loss: 0.7728, test_loss: 0.7335, test_f1: 0.6075
 epoch: 56, train_loss: 0.7677, test_loss: 0.7612, test_f1: 0.5831
 epoch: 57, train_loss: 0.7634, test_loss: 0.7449, test_f1: 0.5863
 epoch: 58, train_loss: 0.7608, test_loss: 0.7330, test_f1: 0.5944
 epoch: 59, train_loss: 0.7638, test_loss: 0.7414, test_f1: 0.5930
 epoch: 60, train_loss: 0.7628, test_loss: 0.7452, test_f1: 0.6043
 epoch: 61, train_loss: 0.7565, test_loss: 0.7436, test_f1: 0.5918
 epoch: 62, train_loss: 0.7562, test_loss: 0.7860, test_f1: 0.5747
 epoch: 63, train_loss: 0.7600, test_loss: 0.7331, test_f1: 0.5989
 epoch: 64, train_loss: 0.7720, test_loss: 0.7443, test_f1: 0.5878
 epoch: 65, train_loss: 0.7606, test_loss: 0.7426, test_f1: 0.6077
 epoch: 66, train_loss: 0.7539, test_loss: 0.7285, test_f1: 0.6028
 epoch: 67, train_loss: 0.7568, test_loss: 0.7445, test_f1: 0.5969
 epoch: 68, train_loss: 0.7536, test_loss: 0.7300, test_f1: 0.6164
 epoch: 69, train_loss: 0.7528, test_loss: 0.7350, test_f1: 0.6067
 epoch: 70, train_loss: 0.7442, test_loss: 0.7333, test_f1: 0.5978
 epoch: 71, train_loss: 0.7528, test_loss: 0.7440, test_f1: 0.6012
 epoch: 72, train_loss: 0.7460, test_loss: 0.7228, test_f1: 0.6047
 epoch: 73, train_loss: 0.7496, test_loss: 0.7216, test_f1: 0.6003
 epoch: 74, train_loss: 0.7453, test_loss: 0.7231, test_f1: 0.6144
 epoch: 75, train_loss: 0.7485, test_loss: 0.7294, test_f1: 0.6210
 epoch: 76, train_loss: 0.7366, test_loss: 0.7346, test_f1: 0.6149
 epoch: 77, train_loss: 0.7469, test_loss: 0.7289, test_f1: 0.6172
 epoch: 78, train_loss: 0.7409, test_loss: 0.7227, test_f1: 0.6182
 epoch: 79, train_loss: 0.7426, test_loss: 0.7344, test_f1: 0.6103
 epoch: 80, train_loss: 0.7301, test_loss: 0.7314, test_f1: 0.6104
 epoch: 81, train_loss: 0.7353, test_loss: 0.7142, test_f1: 0.6139
 epoch: 82, train_loss: 0.7396, test_loss: 0.7363, test_f1: 0.5990
 epoch: 83, train_loss: 0.7362, test_loss: 0.7222, test_f1: 0.6157
 epoch: 84, train_loss: 0.7398, test_loss: 0.7153, test_f1: 0.6245
 epoch: 85, train_loss: 0.7269, test_loss: 0.7384, test_f1: 0.6063
 epoch: 86, train_loss: 0.7287, test_loss: 0.7191, test_f1: 0.6212
 epoch: 87, train_loss: 0.7360, test_loss: 0.7111, test_f1: 0.6309
 epoch: 88, train_loss: 0.7293, test_loss: 0.7298, test_f1: 0.6194
 epoch: 89, train_loss: 0.7334, test_loss: 0.7393, test_f1: 0.6124
 epoch: 90, train_loss: 0.7208, test_loss: 0.7215, test_f1: 0.6366
 epoch: 91, train_loss: 0.7384, test_loss: 0.7231, test_f1: 0.6148
 epoch: 92, train_loss: 0.7250, test_loss: 0.7287, test_f1: 0.6020
 epoch: 93, train_loss: 0.7208, test_loss: 0.7494, test_f1: 0.6185
 epoch: 94, train_loss: 0.7292, test_loss: 0.7328, test_f1: 0.6118
 epoch: 95, train_loss: 0.7228, test_loss: 0.7123, test_f1: 0.6274
 epoch: 96, train_loss: 0.7306, test_loss: 0.7172, test_f1: 0.6275
 epoch: 97, train_loss: 0.7196, test_loss: 0.7127, test_f1: 0.6341
 epoch: 98, train_loss: 0.7325, test_loss: 0.7249, test_f1: 0.6171
 epoch: 99, train_loss: 0.7129, test_loss: 0.7340, test_f1: 0.6136
##################ITERATION #5 ****************************************
 epoch: 0, train_loss: 1.3767, test_loss: 1.3871, test_f1: 0.2270
 epoch: 1, train_loss: 1.1495, test_loss: 1.2454, test_f1: 0.2590
 epoch: 2, train_loss: 1.0948, test_loss: 1.0706, test_f1: 0.4511
 epoch: 3, train_loss: 1.0696, test_loss: 1.0141, test_f1: 0.4809
 epoch: 4, train_loss: 1.0436, test_loss: 0.9975, test_f1: 0.4946
 epoch: 5, train_loss: 1.0334, test_loss: 1.0085, test_f1: 0.5027
 epoch: 6, train_loss: 1.0147, test_loss: 0.9921, test_f1: 0.4870
 epoch: 7, train_loss: 0.9947, test_loss: 1.0028, test_f1: 0.4848
 epoch: 8, train_loss: 0.9864, test_loss: 0.9652, test_f1: 0.4993
 epoch: 9, train_loss: 0.9800, test_loss: 0.9800, test_f1: 0.4974
 epoch: 10, train_loss: 0.9688, test_loss: 0.9634, test_f1: 0.4893
 epoch: 11, train_loss: 0.9606, test_loss: 0.9303, test_f1: 0.4990
 epoch: 12, train_loss: 0.9479, test_loss: 0.9368, test_f1: 0.5005
 epoch: 13, train_loss: 0.9266, test_loss: 0.9054, test_f1: 0.5105
 epoch: 14, train_loss: 0.9327, test_loss: 0.9320, test_f1: 0.5099
 epoch: 15, train_loss: 0.9236, test_loss: 0.9053, test_f1: 0.5111
 epoch: 16, train_loss: 0.9257, test_loss: 0.9145, test_f1: 0.5193
 epoch: 17, train_loss: 0.9123, test_loss: 0.9129, test_f1: 0.5272
 epoch: 18, train_loss: 0.9062, test_loss: 0.9211, test_f1: 0.4962
 epoch: 19, train_loss: 0.8956, test_loss: 0.9075, test_f1: 0.5154
 epoch: 20, train_loss: 0.8942, test_loss: 0.9216, test_f1: 0.5154
 epoch: 21, train_loss: 0.8863, test_loss: 0.8929, test_f1: 0.5357
 epoch: 22, train_loss: 0.8766, test_loss: 0.9067, test_f1: 0.5187
 epoch: 23, train_loss: 0.8911, test_loss: 0.9116, test_f1: 0.5165
 epoch: 24, train_loss: 0.8781, test_loss: 0.9357, test_f1: 0.5097
 epoch: 25, train_loss: 0.8653, test_loss: 0.8680, test_f1: 0.5365
 epoch: 26, train_loss: 0.8691, test_loss: 0.9006, test_f1: 0.5154
 epoch: 27, train_loss: 0.8677, test_loss: 0.9083, test_f1: 0.5316
 epoch: 28, train_loss: 0.8666, test_loss: 0.9197, test_f1: 0.5351
 epoch: 29, train_loss: 0.8732, test_loss: 0.8740, test_f1: 0.5463
 epoch: 30, train_loss: 0.8585, test_loss: 0.8600, test_f1: 0.5403
 epoch: 31, train_loss: 0.8559, test_loss: 0.8416, test_f1: 0.5518
 epoch: 32, train_loss: 0.8484, test_loss: 0.8447, test_f1: 0.5407
 epoch: 33, train_loss: 0.8456, test_loss: 0.8597, test_f1: 0.5752
 epoch: 34, train_loss: 0.8465, test_loss: 0.8669, test_f1: 0.5549
 epoch: 35, train_loss: 0.8430, test_loss: 0.9151, test_f1: 0.5408
 epoch: 36, train_loss: 0.8378, test_loss: 0.8414, test_f1: 0.5514
 epoch: 37, train_loss: 0.8312, test_loss: 0.8776, test_f1: 0.5553
 epoch: 38, train_loss: 0.8216, test_loss: 0.8722, test_f1: 0.5490
 epoch: 39, train_loss: 0.8262, test_loss: 0.8562, test_f1: 0.5555
 epoch: 40, train_loss: 0.8138, test_loss: 0.8439, test_f1: 0.5780
 epoch: 41, train_loss: 0.8203, test_loss: 0.8868, test_f1: 0.5542
 epoch: 42, train_loss: 0.8166, test_loss: 0.8544, test_f1: 0.5184
 epoch: 43, train_loss: 0.8184, test_loss: 0.8225, test_f1: 0.5465
 epoch: 44, train_loss: 0.8226, test_loss: 0.8929, test_f1: 0.5650
 epoch: 45, train_loss: 0.8173, test_loss: 1.0832, test_f1: 0.4929
 epoch: 46, train_loss: 0.8050, test_loss: 0.8767, test_f1: 0.5373
 epoch: 47, train_loss: 0.8005, test_loss: 0.8774, test_f1: 0.5493
 epoch: 48, train_loss: 0.8083, test_loss: 0.8674, test_f1: 0.5379
 epoch: 49, train_loss: 0.8146, test_loss: 0.8604, test_f1: 0.5561
 epoch: 50, train_loss: 0.7975, test_loss: 0.8147, test_f1: 0.5749
 epoch: 51, train_loss: 0.8005, test_loss: 0.8560, test_f1: 0.5667
 epoch: 52, train_loss: 0.7834, test_loss: 0.8438, test_f1: 0.5575
 epoch: 53, train_loss: 0.7924, test_loss: 0.8292, test_f1: 0.5686
 epoch: 54, train_loss: 0.7830, test_loss: 0.8571, test_f1: 0.5592
 epoch: 55, train_loss: 0.7830, test_loss: 0.8373, test_f1: 0.5560
 epoch: 56, train_loss: 0.7802, test_loss: 0.8465, test_f1: 0.5473
 epoch: 57, train_loss: 0.7785, test_loss: 0.8475, test_f1: 0.5661
 epoch: 58, train_loss: 0.7779, test_loss: 0.8419, test_f1: 0.5570
 epoch: 59, train_loss: 0.7710, test_loss: 0.8329, test_f1: 0.5610
 epoch: 60, train_loss: 0.7775, test_loss: 0.8481, test_f1: 0.5798
 epoch: 61, train_loss: 0.7755, test_loss: 0.8869, test_f1: 0.5558
 epoch: 62, train_loss: 0.7840, test_loss: 0.8614, test_f1: 0.5635
 epoch: 63, train_loss: 0.7677, test_loss: 0.8526, test_f1: 0.5625
 epoch: 64, train_loss: 0.7687, test_loss: 0.8738, test_f1: 0.5545
 epoch: 65, train_loss: 0.7785, test_loss: 0.8496, test_f1: 0.5615
 epoch: 66, train_loss: 0.7765, test_loss: 0.8441, test_f1: 0.5804
 epoch: 67, train_loss: 0.7614, test_loss: 0.8405, test_f1: 0.5612
 epoch: 68, train_loss: 0.7546, test_loss: 0.8500, test_f1: 0.5661
 epoch: 69, train_loss: 0.7625, test_loss: 0.8513, test_f1: 0.5728
 epoch: 70, train_loss: 0.7552, test_loss: 0.8676, test_f1: 0.5601
 epoch: 71, train_loss: 0.7612, test_loss: 0.8686, test_f1: 0.5602
 epoch: 72, train_loss: 0.7648, test_loss: 0.8673, test_f1: 0.5659
 epoch: 73, train_loss: 0.7784, test_loss: 0.8630, test_f1: 0.5531
 epoch: 74, train_loss: 0.7602, test_loss: 0.8716, test_f1: 0.5664
 epoch: 75, train_loss: 0.7414, test_loss: 0.8509, test_f1: 0.5835
 epoch: 76, train_loss: 0.7567, test_loss: 0.8850, test_f1: 0.5758
 epoch: 77, train_loss: 0.7548, test_loss: 0.8556, test_f1: 0.5863
 epoch: 78, train_loss: 0.7462, test_loss: 0.8492, test_f1: 0.5840
 epoch: 79, train_loss: 0.7454, test_loss: 0.8874, test_f1: 0.5758
 epoch: 80, train_loss: 0.7496, test_loss: 0.8326, test_f1: 0.5767
 epoch: 81, train_loss: 0.7479, test_loss: 0.8661, test_f1: 0.5684
 epoch: 82, train_loss: 0.7594, test_loss: 0.8561, test_f1: 0.5913
 epoch: 83, train_loss: 0.7549, test_loss: 0.8330, test_f1: 0.5793
 epoch: 84, train_loss: 0.7430, test_loss: 0.8698, test_f1: 0.5934
 epoch: 85, train_loss: 0.7450, test_loss: 0.8542, test_f1: 0.5620
 epoch: 86, train_loss: 0.7424, test_loss: 0.8902, test_f1: 0.5802
 epoch: 87, train_loss: 0.7374, test_loss: 0.8492, test_f1: 0.5851
 epoch: 88, train_loss: 0.7516, test_loss: 0.8950, test_f1: 0.5869
 epoch: 89, train_loss: 0.7468, test_loss: 0.8685, test_f1: 0.5808
 epoch: 90, train_loss: 0.7464, test_loss: 0.8494, test_f1: 0.5730
 epoch: 91, train_loss: 0.7489, test_loss: 0.8861, test_f1: 0.5644
 epoch: 92, train_loss: 0.7467, test_loss: 0.8463, test_f1: 0.5777
 epoch: 93, train_loss: 0.7394, test_loss: 0.8621, test_f1: 0.5916
 epoch: 94, train_loss: 0.7565, test_loss: 0.8881, test_f1: 0.5976
 epoch: 95, train_loss: 0.7519, test_loss: 0.8940, test_f1: 0.5688
 epoch: 96, train_loss: 0.7354, test_loss: 0.8373, test_f1: 0.5955
 epoch: 97, train_loss: 0.7387, test_loss: 0.8637, test_f1: 0.5939
 epoch: 98, train_loss: 0.7276, test_loss: 0.8589, test_f1: 0.5865
 epoch: 99, train_loss: 0.7309, test_loss: 0.8790, test_f1: 0.5809
##################ITERATION #6 ****************************************
 epoch: 0, train_loss: 1.2854, test_loss: 1.3917, test_f1: 0.2270
 epoch: 1, train_loss: 1.1031, test_loss: 1.1111, test_f1: 0.3315
 epoch: 2, train_loss: 1.0755, test_loss: 1.0561, test_f1: 0.3932
 epoch: 3, train_loss: 1.0576, test_loss: 1.0346, test_f1: 0.4036
 epoch: 4, train_loss: 1.0466, test_loss: 1.0275, test_f1: 0.4543
 epoch: 5, train_loss: 1.0365, test_loss: 1.0364, test_f1: 0.4257
 epoch: 6, train_loss: 1.0292, test_loss: 1.0127, test_f1: 0.4582
 epoch: 7, train_loss: 1.0088, test_loss: 0.9969, test_f1: 0.4812
 epoch: 8, train_loss: 1.0068, test_loss: 1.0115, test_f1: 0.4828
 epoch: 9, train_loss: 1.0019, test_loss: 0.9961, test_f1: 0.4727
 epoch: 10, train_loss: 0.9930, test_loss: 0.9988, test_f1: 0.4679
 epoch: 11, train_loss: 0.9911, test_loss: 0.9872, test_f1: 0.4922
 epoch: 12, train_loss: 0.9825, test_loss: 0.9973, test_f1: 0.4575
 epoch: 13, train_loss: 0.9729, test_loss: 0.9643, test_f1: 0.5143
 epoch: 14, train_loss: 0.9638, test_loss: 0.9654, test_f1: 0.4865
 epoch: 15, train_loss: 0.9636, test_loss: 0.9653, test_f1: 0.5148
 epoch: 16, train_loss: 0.9547, test_loss: 0.9439, test_f1: 0.5128
 epoch: 17, train_loss: 0.9534, test_loss: 0.9544, test_f1: 0.4909
 epoch: 18, train_loss: 0.9341, test_loss: 0.9374, test_f1: 0.4962
 epoch: 19, train_loss: 0.9393, test_loss: 0.9311, test_f1: 0.5139
 epoch: 20, train_loss: 0.9410, test_loss: 0.9519, test_f1: 0.5012
 epoch: 21, train_loss: 0.9367, test_loss: 0.9142, test_f1: 0.4946
 epoch: 22, train_loss: 0.9278, test_loss: 0.9458, test_f1: 0.5086
 epoch: 23, train_loss: 0.9233, test_loss: 0.8923, test_f1: 0.5228
 epoch: 24, train_loss: 0.9183, test_loss: 0.9368, test_f1: 0.4964
 epoch: 25, train_loss: 0.9218, test_loss: 0.9402, test_f1: 0.4996
 epoch: 26, train_loss: 0.9194, test_loss: 0.9863, test_f1: 0.4812
 epoch: 27, train_loss: 0.9158, test_loss: 0.9123, test_f1: 0.5201
 epoch: 28, train_loss: 0.9084, test_loss: 0.8868, test_f1: 0.5282
 epoch: 29, train_loss: 0.9031, test_loss: 0.8924, test_f1: 0.5152
 epoch: 30, train_loss: 0.9039, test_loss: 0.9540, test_f1: 0.4882
 epoch: 31, train_loss: 0.9048, test_loss: 0.8792, test_f1: 0.5486
 epoch: 32, train_loss: 0.8907, test_loss: 0.8988, test_f1: 0.5142
 epoch: 33, train_loss: 0.8853, test_loss: 0.8617, test_f1: 0.5342
 epoch: 34, train_loss: 0.8830, test_loss: 0.8816, test_f1: 0.5233
 epoch: 35, train_loss: 0.8737, test_loss: 0.9147, test_f1: 0.5122
 epoch: 36, train_loss: 0.8752, test_loss: 0.8973, test_f1: 0.4999
 epoch: 37, train_loss: 0.8662, test_loss: 0.8559, test_f1: 0.5448
 epoch: 38, train_loss: 0.8901, test_loss: 0.9147, test_f1: 0.5120
 epoch: 39, train_loss: 0.8636, test_loss: 0.8550, test_f1: 0.5332
 epoch: 40, train_loss: 0.8632, test_loss: 0.8983, test_f1: 0.5185
 epoch: 41, train_loss: 0.8596, test_loss: 0.8905, test_f1: 0.5332
 epoch: 42, train_loss: 0.8479, test_loss: 0.8481, test_f1: 0.5430
 epoch: 43, train_loss: 0.8505, test_loss: 0.9019, test_f1: 0.5268
 epoch: 44, train_loss: 0.8415, test_loss: 0.8629, test_f1: 0.5285
 epoch: 45, train_loss: 0.8391, test_loss: 0.9138, test_f1: 0.5199
 epoch: 46, train_loss: 0.8449, test_loss: 0.8252, test_f1: 0.5484
 epoch: 47, train_loss: 0.8267, test_loss: 0.8640, test_f1: 0.5203
 epoch: 48, train_loss: 0.8260, test_loss: 0.8263, test_f1: 0.5483
 epoch: 49, train_loss: 0.8283, test_loss: 0.8813, test_f1: 0.5257
 epoch: 50, train_loss: 0.8241, test_loss: 0.8162, test_f1: 0.5655
 epoch: 51, train_loss: 0.8266, test_loss: 0.8235, test_f1: 0.5607
 epoch: 52, train_loss: 0.8246, test_loss: 0.8276, test_f1: 0.5503
 epoch: 53, train_loss: 0.8082, test_loss: 0.8416, test_f1: 0.5475
 epoch: 54, train_loss: 0.8180, test_loss: 0.8468, test_f1: 0.5465
 epoch: 55, train_loss: 0.7996, test_loss: 0.8245, test_f1: 0.5652
 epoch: 56, train_loss: 0.8253, test_loss: 0.8547, test_f1: 0.5382
 epoch: 57, train_loss: 0.8009, test_loss: 0.8245, test_f1: 0.5540
 epoch: 58, train_loss: 0.7966, test_loss: 0.8378, test_f1: 0.5555
 epoch: 59, train_loss: 0.7971, test_loss: 0.8518, test_f1: 0.5484
 epoch: 60, train_loss: 0.7951, test_loss: 0.8469, test_f1: 0.5278
 epoch: 61, train_loss: 0.7941, test_loss: 0.8291, test_f1: 0.5514
 epoch: 62, train_loss: 0.7858, test_loss: 0.8483, test_f1: 0.5502
 epoch: 63, train_loss: 0.7945, test_loss: 0.8598, test_f1: 0.5553
 epoch: 64, train_loss: 0.8006, test_loss: 0.8384, test_f1: 0.5545
 epoch: 65, train_loss: 0.7947, test_loss: 0.8612, test_f1: 0.5508
 epoch: 66, train_loss: 0.7906, test_loss: 0.8525, test_f1: 0.5641
 epoch: 67, train_loss: 0.7891, test_loss: 0.8203, test_f1: 0.5450
 epoch: 68, train_loss: 0.7810, test_loss: 0.8288, test_f1: 0.5494
 epoch: 69, train_loss: 0.7914, test_loss: 0.8320, test_f1: 0.5538
 epoch: 70, train_loss: 0.7834, test_loss: 0.8096, test_f1: 0.5648
 epoch: 71, train_loss: 0.7828, test_loss: 0.8165, test_f1: 0.5760
 epoch: 72, train_loss: 0.7672, test_loss: 0.8573, test_f1: 0.5556
 epoch: 73, train_loss: 0.7770, test_loss: 0.8205, test_f1: 0.5639
 epoch: 74, train_loss: 0.7831, test_loss: 0.8341, test_f1: 0.5532
 epoch: 75, train_loss: 0.7670, test_loss: 0.8449, test_f1: 0.5590
 epoch: 76, train_loss: 0.7701, test_loss: 0.7964, test_f1: 0.5756
 epoch: 77, train_loss: 0.7730, test_loss: 0.8284, test_f1: 0.5710
 epoch: 78, train_loss: 0.7684, test_loss: 0.8763, test_f1: 0.5657
 epoch: 79, train_loss: 0.7703, test_loss: 0.8347, test_f1: 0.5725
 epoch: 80, train_loss: 0.7610, test_loss: 0.8106, test_f1: 0.5697
 epoch: 81, train_loss: 0.7663, test_loss: 0.8784, test_f1: 0.5271
 epoch: 82, train_loss: 0.7813, test_loss: 0.8814, test_f1: 0.5654
 epoch: 83, train_loss: 0.7627, test_loss: 0.8436, test_f1: 0.5591
 epoch: 84, train_loss: 0.7629, test_loss: 0.8202, test_f1: 0.5796
 epoch: 85, train_loss: 0.7734, test_loss: 0.8329, test_f1: 0.5589
 epoch: 86, train_loss: 0.7564, test_loss: 0.8752, test_f1: 0.5486
 epoch: 87, train_loss: 0.7581, test_loss: 0.8053, test_f1: 0.5751
 epoch: 88, train_loss: 0.7416, test_loss: 0.9170, test_f1: 0.5409
 epoch: 89, train_loss: 0.7565, test_loss: 0.8477, test_f1: 0.5496
 epoch: 90, train_loss: 0.7574, test_loss: 0.8461, test_f1: 0.5745
 epoch: 91, train_loss: 0.7647, test_loss: 0.8976, test_f1: 0.5425
 epoch: 92, train_loss: 0.7495, test_loss: 0.8308, test_f1: 0.5689
 epoch: 93, train_loss: 0.7446, test_loss: 0.8510, test_f1: 0.5649
 epoch: 94, train_loss: 0.7567, test_loss: 0.8241, test_f1: 0.5650
 epoch: 95, train_loss: 0.7632, test_loss: 0.8364, test_f1: 0.5629
 epoch: 96, train_loss: 0.7468, test_loss: 0.8361, test_f1: 0.5579
 epoch: 97, train_loss: 0.7595, test_loss: 0.8640, test_f1: 0.5617
 epoch: 98, train_loss: 0.7686, test_loss: 0.8981, test_f1: 0.5608
 epoch: 99, train_loss: 0.7508, test_loss: 0.8703, test_f1: 0.5433
##################ITERATION #7 ****************************************
 epoch: 0, train_loss: 1.4171, test_loss: 1.3935, test_f1: 0.1803
 epoch: 1, train_loss: 1.1565, test_loss: 1.1459, test_f1: 0.4436
 epoch: 2, train_loss: 1.1167, test_loss: 1.0751, test_f1: 0.4291
 epoch: 3, train_loss: 1.0869, test_loss: 1.0583, test_f1: 0.3930
 epoch: 4, train_loss: 1.0684, test_loss: 1.0413, test_f1: 0.4292
 epoch: 5, train_loss: 1.0539, test_loss: 1.0142, test_f1: 0.4533
 epoch: 6, train_loss: 1.0387, test_loss: 1.0305, test_f1: 0.4447
 epoch: 7, train_loss: 1.0309, test_loss: 1.0239, test_f1: 0.4376
 epoch: 8, train_loss: 1.0204, test_loss: 1.0028, test_f1: 0.4557
 epoch: 9, train_loss: 1.0081, test_loss: 1.0096, test_f1: 0.4377
 epoch: 10, train_loss: 1.0014, test_loss: 1.0099, test_f1: 0.4276
 epoch: 11, train_loss: 0.9964, test_loss: 0.9984, test_f1: 0.4767
 epoch: 12, train_loss: 0.9789, test_loss: 0.9687, test_f1: 0.4643
 epoch: 13, train_loss: 0.9742, test_loss: 0.9713, test_f1: 0.4867
 epoch: 14, train_loss: 0.9606, test_loss: 0.9719, test_f1: 0.4619
 epoch: 15, train_loss: 0.9507, test_loss: 0.9889, test_f1: 0.4871
 epoch: 16, train_loss: 0.9518, test_loss: 0.9990, test_f1: 0.4689
 epoch: 17, train_loss: 0.9465, test_loss: 0.9983, test_f1: 0.4747
 epoch: 18, train_loss: 0.9398, test_loss: 0.9793, test_f1: 0.4963
 epoch: 19, train_loss: 0.9295, test_loss: 0.9775, test_f1: 0.4945
 epoch: 20, train_loss: 0.9284, test_loss: 0.9821, test_f1: 0.5014
 epoch: 21, train_loss: 0.9081, test_loss: 0.9628, test_f1: 0.5087
 epoch: 22, train_loss: 0.9232, test_loss: 0.9663, test_f1: 0.4988
 epoch: 23, train_loss: 0.9139, test_loss: 1.0328, test_f1: 0.4689
 epoch: 24, train_loss: 0.9206, test_loss: 1.0246, test_f1: 0.4798
 epoch: 25, train_loss: 0.9042, test_loss: 0.9702, test_f1: 0.5058
 epoch: 26, train_loss: 0.9080, test_loss: 0.9706, test_f1: 0.5100
 epoch: 27, train_loss: 0.9014, test_loss: 0.9868, test_f1: 0.5057
 epoch: 28, train_loss: 0.8983, test_loss: 0.9982, test_f1: 0.5070
 epoch: 29, train_loss: 0.9038, test_loss: 0.9766, test_f1: 0.5012
 epoch: 30, train_loss: 0.8846, test_loss: 0.9786, test_f1: 0.5250
 epoch: 31, train_loss: 0.8728, test_loss: 0.9636, test_f1: 0.4874
 epoch: 32, train_loss: 0.8869, test_loss: 0.9643, test_f1: 0.5139
 epoch: 33, train_loss: 0.8727, test_loss: 0.9897, test_f1: 0.5066
 epoch: 34, train_loss: 0.8816, test_loss: 0.9724, test_f1: 0.5055
 epoch: 35, train_loss: 0.8835, test_loss: 0.9327, test_f1: 0.5310
 epoch: 36, train_loss: 0.8611, test_loss: 0.9827, test_f1: 0.5147
 epoch: 37, train_loss: 0.8589, test_loss: 0.9536, test_f1: 0.5330
 epoch: 38, train_loss: 0.8649, test_loss: 0.9550, test_f1: 0.5194
 epoch: 39, train_loss: 0.8612, test_loss: 0.9793, test_f1: 0.5273
 epoch: 40, train_loss: 0.8571, test_loss: 0.9312, test_f1: 0.5334
 epoch: 41, train_loss: 0.8690, test_loss: 0.9423, test_f1: 0.5134
 epoch: 42, train_loss: 0.8542, test_loss: 0.9571, test_f1: 0.5246
 epoch: 43, train_loss: 0.8496, test_loss: 0.9362, test_f1: 0.5164
 epoch: 44, train_loss: 0.8462, test_loss: 0.9522, test_f1: 0.5285
 epoch: 45, train_loss: 0.8474, test_loss: 0.9760, test_f1: 0.4938
 epoch: 46, train_loss: 0.8425, test_loss: 0.9090, test_f1: 0.5215
 epoch: 47, train_loss: 0.8534, test_loss: 0.9492, test_f1: 0.5106
 epoch: 48, train_loss: 0.8606, test_loss: 0.9307, test_f1: 0.5286
 epoch: 49, train_loss: 0.8444, test_loss: 0.9505, test_f1: 0.5340
 epoch: 50, train_loss: 0.8287, test_loss: 0.9495, test_f1: 0.5269
 epoch: 51, train_loss: 0.8273, test_loss: 0.9390, test_f1: 0.5351
 epoch: 52, train_loss: 0.8233, test_loss: 0.9249, test_f1: 0.5278
 epoch: 53, train_loss: 0.8182, test_loss: 0.9232, test_f1: 0.5207
 epoch: 54, train_loss: 0.8165, test_loss: 0.9517, test_f1: 0.5048
 epoch: 55, train_loss: 0.8154, test_loss: 0.9213, test_f1: 0.5219
 epoch: 56, train_loss: 0.8124, test_loss: 0.9307, test_f1: 0.5188
 epoch: 57, train_loss: 0.8102, test_loss: 0.9113, test_f1: 0.5340
 epoch: 58, train_loss: 0.8146, test_loss: 0.9864, test_f1: 0.5098
 epoch: 59, train_loss: 0.8181, test_loss: 0.9259, test_f1: 0.5311
 epoch: 60, train_loss: 0.8077, test_loss: 0.9534, test_f1: 0.5245
 epoch: 61, train_loss: 0.8120, test_loss: 0.9069, test_f1: 0.5329
 epoch: 62, train_loss: 0.8127, test_loss: 0.9219, test_f1: 0.5322
 epoch: 63, train_loss: 0.8030, test_loss: 0.9232, test_f1: 0.5199
 epoch: 64, train_loss: 0.8047, test_loss: 0.9130, test_f1: 0.5346
 epoch: 65, train_loss: 0.8060, test_loss: 0.9169, test_f1: 0.5387
 epoch: 66, train_loss: 0.8050, test_loss: 0.9559, test_f1: 0.5339
 epoch: 67, train_loss: 0.8080, test_loss: 0.9266, test_f1: 0.5433
 epoch: 68, train_loss: 0.7976, test_loss: 0.9467, test_f1: 0.5371
 epoch: 69, train_loss: 0.7905, test_loss: 0.9420, test_f1: 0.5259
 epoch: 70, train_loss: 0.7942, test_loss: 0.9231, test_f1: 0.5317
 epoch: 71, train_loss: 0.7885, test_loss: 0.9360, test_f1: 0.5321
 epoch: 72, train_loss: 0.7977, test_loss: 0.9218, test_f1: 0.5472
 epoch: 73, train_loss: 0.7925, test_loss: 0.9467, test_f1: 0.5449
 epoch: 74, train_loss: 0.7971, test_loss: 0.9807, test_f1: 0.5227
 epoch: 75, train_loss: 0.7887, test_loss: 0.9572, test_f1: 0.5417
 epoch: 76, train_loss: 0.7946, test_loss: 0.9510, test_f1: 0.5369
 epoch: 77, train_loss: 0.7871, test_loss: 0.9582, test_f1: 0.5501
 epoch: 78, train_loss: 0.7788, test_loss: 0.9529, test_f1: 0.5430
 epoch: 79, train_loss: 0.7902, test_loss: 0.9524, test_f1: 0.5424
 epoch: 80, train_loss: 0.7843, test_loss: 0.9593, test_f1: 0.5407
 epoch: 81, train_loss: 0.7899, test_loss: 0.9499, test_f1: 0.5385
 epoch: 82, train_loss: 0.7879, test_loss: 0.9626, test_f1: 0.5411
 epoch: 83, train_loss: 0.7862, test_loss: 0.9490, test_f1: 0.5388
 epoch: 84, train_loss: 0.7823, test_loss: 0.9519, test_f1: 0.5438
 epoch: 85, train_loss: 0.7787, test_loss: 0.9415, test_f1: 0.5406
 epoch: 86, train_loss: 0.7731, test_loss: 0.9499, test_f1: 0.5558
 epoch: 87, train_loss: 0.7818, test_loss: 0.9701, test_f1: 0.5360
 epoch: 88, train_loss: 0.7834, test_loss: 0.9477, test_f1: 0.5565
 epoch: 89, train_loss: 0.7704, test_loss: 0.9686, test_f1: 0.5503
 epoch: 90, train_loss: 0.7739, test_loss: 0.9744, test_f1: 0.5554
 epoch: 91, train_loss: 0.7814, test_loss: 0.9877, test_f1: 0.5430
 epoch: 92, train_loss: 0.7782, test_loss: 0.9804, test_f1: 0.5315
 epoch: 93, train_loss: 0.7708, test_loss: 0.9628, test_f1: 0.5446
 epoch: 94, train_loss: 0.7808, test_loss: 0.9541, test_f1: 0.5588
 epoch: 95, train_loss: 0.7770, test_loss: 0.9360, test_f1: 0.5382
 epoch: 96, train_loss: 0.7638, test_loss: 0.9452, test_f1: 0.5491
 epoch: 97, train_loss: 0.7727, test_loss: 0.9674, test_f1: 0.5509
 epoch: 98, train_loss: 0.7553, test_loss: 0.9894, test_f1: 0.5432
 epoch: 99, train_loss: 0.7631, test_loss: 0.9686, test_f1: 0.5524
##################ITERATION #8 ****************************************
 epoch: 0, train_loss: 1.3890, test_loss: 1.5303, test_f1: 0.2270
 epoch: 1, train_loss: 1.1367, test_loss: 1.1894, test_f1: 0.2819
 epoch: 2, train_loss: 1.0957, test_loss: 1.0260, test_f1: 0.4313
 epoch: 3, train_loss: 1.0601, test_loss: 0.9817, test_f1: 0.4644
 epoch: 4, train_loss: 1.0246, test_loss: 0.9684, test_f1: 0.4761
 epoch: 5, train_loss: 1.0146, test_loss: 0.9616, test_f1: 0.4806
 epoch: 6, train_loss: 1.0012, test_loss: 0.9476, test_f1: 0.5062
 epoch: 7, train_loss: 0.9919, test_loss: 0.9437, test_f1: 0.4947
 epoch: 8, train_loss: 0.9811, test_loss: 0.9219, test_f1: 0.4912
 epoch: 9, train_loss: 0.9682, test_loss: 0.9357, test_f1: 0.4983
 epoch: 10, train_loss: 0.9555, test_loss: 0.9183, test_f1: 0.5003
 epoch: 11, train_loss: 0.9458, test_loss: 0.9061, test_f1: 0.4965
 epoch: 12, train_loss: 0.9518, test_loss: 0.9115, test_f1: 0.5071
 epoch: 13, train_loss: 0.9356, test_loss: 0.9100, test_f1: 0.5079
 epoch: 14, train_loss: 0.9350, test_loss: 0.9051, test_f1: 0.5305
 epoch: 15, train_loss: 0.9171, test_loss: 0.8963, test_f1: 0.5163
 epoch: 16, train_loss: 0.9150, test_loss: 0.8913, test_f1: 0.5357
 epoch: 17, train_loss: 0.9131, test_loss: 0.8858, test_f1: 0.5204
 epoch: 18, train_loss: 0.9004, test_loss: 0.9187, test_f1: 0.5407
 epoch: 19, train_loss: 0.8953, test_loss: 0.8889, test_f1: 0.5333
 epoch: 20, train_loss: 0.8961, test_loss: 0.8931, test_f1: 0.5401
 epoch: 21, train_loss: 0.8815, test_loss: 0.8777, test_f1: 0.5420
 epoch: 22, train_loss: 0.8950, test_loss: 0.8735, test_f1: 0.5501
 epoch: 23, train_loss: 0.8915, test_loss: 0.8879, test_f1: 0.5522
 epoch: 24, train_loss: 0.8863, test_loss: 0.8678, test_f1: 0.5568
 epoch: 25, train_loss: 0.8790, test_loss: 0.8551, test_f1: 0.5391
 epoch: 26, train_loss: 0.8705, test_loss: 0.8597, test_f1: 0.5477
 epoch: 27, train_loss: 0.8629, test_loss: 0.8851, test_f1: 0.5310
 epoch: 28, train_loss: 0.8665, test_loss: 0.8680, test_f1: 0.5260
 epoch: 29, train_loss: 0.8708, test_loss: 0.8461, test_f1: 0.5486
 epoch: 30, train_loss: 0.8553, test_loss: 0.8450, test_f1: 0.5488
 epoch: 31, train_loss: 0.8547, test_loss: 0.8403, test_f1: 0.5553
 epoch: 32, train_loss: 0.8530, test_loss: 0.8691, test_f1: 0.5522
 epoch: 33, train_loss: 0.8528, test_loss: 0.8489, test_f1: 0.5512
 epoch: 34, train_loss: 0.8403, test_loss: 0.8366, test_f1: 0.5600
 epoch: 35, train_loss: 0.8489, test_loss: 0.8465, test_f1: 0.5655
 epoch: 36, train_loss: 0.8386, test_loss: 0.8815, test_f1: 0.5591
 epoch: 37, train_loss: 0.8447, test_loss: 0.8443, test_f1: 0.5628
 epoch: 38, train_loss: 0.8452, test_loss: 0.8798, test_f1: 0.5470
 epoch: 39, train_loss: 0.8266, test_loss: 0.9038, test_f1: 0.5526
 epoch: 40, train_loss: 0.8341, test_loss: 0.8918, test_f1: 0.5584
 epoch: 41, train_loss: 0.8228, test_loss: 0.8770, test_f1: 0.5563
 epoch: 42, train_loss: 0.8299, test_loss: 0.8393, test_f1: 0.5626
 epoch: 43, train_loss: 0.8294, test_loss: 0.8562, test_f1: 0.5581
 epoch: 44, train_loss: 0.8055, test_loss: 0.8507, test_f1: 0.5693
 epoch: 45, train_loss: 0.8069, test_loss: 0.8500, test_f1: 0.5523
 epoch: 46, train_loss: 0.8203, test_loss: 0.8615, test_f1: 0.5506
 epoch: 47, train_loss: 0.8051, test_loss: 0.8464, test_f1: 0.5613
 epoch: 48, train_loss: 0.8120, test_loss: 0.8435, test_f1: 0.5666
 epoch: 49, train_loss: 0.7955, test_loss: 0.8496, test_f1: 0.5571
 epoch: 50, train_loss: 0.8009, test_loss: 0.8447, test_f1: 0.5601
 epoch: 51, train_loss: 0.8024, test_loss: 0.8542, test_f1: 0.5704
 epoch: 52, train_loss: 0.7942, test_loss: 0.8334, test_f1: 0.5711
 epoch: 53, train_loss: 0.7931, test_loss: 0.8424, test_f1: 0.5817
 epoch: 54, train_loss: 0.7775, test_loss: 0.8429, test_f1: 0.5832
 epoch: 55, train_loss: 0.7827, test_loss: 0.8292, test_f1: 0.5785
 epoch: 56, train_loss: 0.7879, test_loss: 0.8722, test_f1: 0.5729
 epoch: 57, train_loss: 0.7875, test_loss: 0.8749, test_f1: 0.5686
 epoch: 58, train_loss: 0.7978, test_loss: 0.8792, test_f1: 0.5647
 epoch: 59, train_loss: 0.7934, test_loss: 0.8544, test_f1: 0.5721
 epoch: 60, train_loss: 0.7713, test_loss: 0.8408, test_f1: 0.5897
 epoch: 61, train_loss: 0.7738, test_loss: 0.8589, test_f1: 0.5825
 epoch: 62, train_loss: 0.7701, test_loss: 0.8505, test_f1: 0.5628
 epoch: 63, train_loss: 0.7693, test_loss: 0.8733, test_f1: 0.5689
 epoch: 64, train_loss: 0.7644, test_loss: 0.8224, test_f1: 0.5854
 epoch: 65, train_loss: 0.7635, test_loss: 0.8451, test_f1: 0.5639
 epoch: 66, train_loss: 0.7785, test_loss: 0.8581, test_f1: 0.5443
 epoch: 67, train_loss: 0.7813, test_loss: 0.8644, test_f1: 0.5802
 epoch: 68, train_loss: 0.7863, test_loss: 0.8692, test_f1: 0.5517
 epoch: 69, train_loss: 0.7541, test_loss: 0.8419, test_f1: 0.5845
 epoch: 70, train_loss: 0.7712, test_loss: 0.8570, test_f1: 0.5815
 epoch: 71, train_loss: 0.7671, test_loss: 0.8392, test_f1: 0.5753
 epoch: 72, train_loss: 0.7613, test_loss: 0.8722, test_f1: 0.5824
 epoch: 73, train_loss: 0.7568, test_loss: 0.8588, test_f1: 0.5809
 epoch: 74, train_loss: 0.7667, test_loss: 0.8473, test_f1: 0.5790
 epoch: 75, train_loss: 0.7740, test_loss: 0.8217, test_f1: 0.5743
 epoch: 76, train_loss: 0.7522, test_loss: 0.8491, test_f1: 0.5907
 epoch: 77, train_loss: 0.7547, test_loss: 0.8386, test_f1: 0.5877
 epoch: 78, train_loss: 0.7632, test_loss: 0.8413, test_f1: 0.5770
 epoch: 79, train_loss: 0.7576, test_loss: 0.8369, test_f1: 0.5828
 epoch: 80, train_loss: 0.7564, test_loss: 0.8396, test_f1: 0.5772
 epoch: 81, train_loss: 0.7499, test_loss: 0.8609, test_f1: 0.5829
 epoch: 82, train_loss: 0.7615, test_loss: 0.8590, test_f1: 0.5781
 epoch: 83, train_loss: 0.7538, test_loss: 0.8235, test_f1: 0.5657
 epoch: 84, train_loss: 0.7452, test_loss: 0.8574, test_f1: 0.5817
 epoch: 85, train_loss: 0.7493, test_loss: 0.8348, test_f1: 0.5972
 epoch: 86, train_loss: 0.7417, test_loss: 0.8569, test_f1: 0.5811
 epoch: 87, train_loss: 0.7472, test_loss: 0.8441, test_f1: 0.5872
 epoch: 88, train_loss: 0.7381, test_loss: 0.8843, test_f1: 0.5721
 epoch: 89, train_loss: 0.7396, test_loss: 0.8353, test_f1: 0.5884
 epoch: 90, train_loss: 0.7447, test_loss: 0.8748, test_f1: 0.5708
 epoch: 91, train_loss: 0.7435, test_loss: 0.8509, test_f1: 0.5829
 epoch: 92, train_loss: 0.7462, test_loss: 0.8478, test_f1: 0.5886
 epoch: 93, train_loss: 0.7468, test_loss: 0.8497, test_f1: 0.5717
 epoch: 94, train_loss: 0.7376, test_loss: 0.8712, test_f1: 0.5833
 epoch: 95, train_loss: 0.7387, test_loss: 0.8439, test_f1: 0.5811
 epoch: 96, train_loss: 0.7342, test_loss: 0.8499, test_f1: 0.6130
 epoch: 97, train_loss: 0.7333, test_loss: 0.8766, test_f1: 0.5823
 epoch: 98, train_loss: 0.7337, test_loss: 0.8036, test_f1: 0.5736
 epoch: 99, train_loss: 0.7407, test_loss: 0.8444, test_f1: 0.5850
##################ITERATION #9 ****************************************
 epoch: 0, train_loss: 1.4102, test_loss: 1.3538, test_f1: 0.2270
 epoch: 1, train_loss: 1.1509, test_loss: 1.0962, test_f1: 0.4370
 epoch: 2, train_loss: 1.0901, test_loss: 1.0305, test_f1: 0.4489
 epoch: 3, train_loss: 1.0679, test_loss: 1.0065, test_f1: 0.4572
 epoch: 4, train_loss: 1.0569, test_loss: 0.9985, test_f1: 0.4788
 epoch: 5, train_loss: 1.0379, test_loss: 0.9979, test_f1: 0.4589
 epoch: 6, train_loss: 1.0084, test_loss: 0.9875, test_f1: 0.4791
 epoch: 7, train_loss: 1.0083, test_loss: 0.9714, test_f1: 0.4697
 epoch: 8, train_loss: 0.9971, test_loss: 0.9833, test_f1: 0.4727
 epoch: 9, train_loss: 0.9834, test_loss: 0.9663, test_f1: 0.4608
 epoch: 10, train_loss: 0.9843, test_loss: 0.9801, test_f1: 0.4785
 epoch: 11, train_loss: 0.9746, test_loss: 0.9382, test_f1: 0.4929
 epoch: 12, train_loss: 0.9715, test_loss: 0.9817, test_f1: 0.4626
 epoch: 13, train_loss: 0.9633, test_loss: 0.9250, test_f1: 0.5022
 epoch: 14, train_loss: 0.9489, test_loss: 0.9524, test_f1: 0.4962
 epoch: 15, train_loss: 0.9493, test_loss: 0.9422, test_f1: 0.4985
 epoch: 16, train_loss: 0.9406, test_loss: 0.9365, test_f1: 0.5115
 epoch: 17, train_loss: 0.9388, test_loss: 0.9099, test_f1: 0.4939
 epoch: 18, train_loss: 0.9358, test_loss: 0.8946, test_f1: 0.5058
 epoch: 19, train_loss: 0.9310, test_loss: 0.9061, test_f1: 0.5108
 epoch: 20, train_loss: 0.9193, test_loss: 0.9301, test_f1: 0.4950
 epoch: 21, train_loss: 0.9253, test_loss: 0.9069, test_f1: 0.4887
 epoch: 22, train_loss: 0.9246, test_loss: 0.9146, test_f1: 0.5143
 epoch: 23, train_loss: 0.9126, test_loss: 0.8946, test_f1: 0.5060
 epoch: 24, train_loss: 0.9145, test_loss: 0.8828, test_f1: 0.5337
 epoch: 25, train_loss: 0.9132, test_loss: 0.8742, test_f1: 0.5258
 epoch: 26, train_loss: 0.8993, test_loss: 0.8959, test_f1: 0.5166
 epoch: 27, train_loss: 0.9050, test_loss: 0.8927, test_f1: 0.5134
 epoch: 28, train_loss: 0.8986, test_loss: 0.8767, test_f1: 0.5120
 epoch: 29, train_loss: 0.9132, test_loss: 0.8805, test_f1: 0.5117
 epoch: 30, train_loss: 0.8914, test_loss: 0.8749, test_f1: 0.5201
 epoch: 31, train_loss: 0.8790, test_loss: 0.8530, test_f1: 0.5367
 epoch: 32, train_loss: 0.8938, test_loss: 0.8860, test_f1: 0.5178
 epoch: 33, train_loss: 0.8837, test_loss: 0.8547, test_f1: 0.5280
 epoch: 34, train_loss: 0.8767, test_loss: 0.8872, test_f1: 0.5056
 epoch: 35, train_loss: 0.8760, test_loss: 0.8795, test_f1: 0.5222
 epoch: 36, train_loss: 0.8835, test_loss: 0.8854, test_f1: 0.5268
 epoch: 37, train_loss: 0.8679, test_loss: 0.8487, test_f1: 0.5302
 epoch: 38, train_loss: 0.8667, test_loss: 0.8475, test_f1: 0.5435
 epoch: 39, train_loss: 0.8717, test_loss: 0.8522, test_f1: 0.5193
 epoch: 40, train_loss: 0.8616, test_loss: 0.9137, test_f1: 0.4992
 epoch: 41, train_loss: 0.8569, test_loss: 0.8294, test_f1: 0.5394
 epoch: 42, train_loss: 0.8508, test_loss: 0.8359, test_f1: 0.5275
 epoch: 43, train_loss: 0.8372, test_loss: 0.8409, test_f1: 0.5544
 epoch: 44, train_loss: 0.8507, test_loss: 0.9013, test_f1: 0.5089
 epoch: 45, train_loss: 0.8518, test_loss: 0.8875, test_f1: 0.5224
 epoch: 46, train_loss: 0.8397, test_loss: 0.8670, test_f1: 0.5252
 epoch: 47, train_loss: 0.8412, test_loss: 0.8332, test_f1: 0.5370
 epoch: 48, train_loss: 0.8414, test_loss: 0.8792, test_f1: 0.5611
 epoch: 49, train_loss: 0.8262, test_loss: 0.8155, test_f1: 0.5585
 epoch: 50, train_loss: 0.8187, test_loss: 0.8694, test_f1: 0.5461
 epoch: 51, train_loss: 0.8160, test_loss: 0.8415, test_f1: 0.5569
 epoch: 52, train_loss: 0.8120, test_loss: 0.8517, test_f1: 0.5658
 epoch: 53, train_loss: 0.8119, test_loss: 0.8445, test_f1: 0.5454
 epoch: 54, train_loss: 0.8144, test_loss: 0.8457, test_f1: 0.5655
 epoch: 55, train_loss: 0.8115, test_loss: 0.8389, test_f1: 0.5418
 epoch: 56, train_loss: 0.8192, test_loss: 0.8863, test_f1: 0.5387
 epoch: 57, train_loss: 0.8074, test_loss: 0.8427, test_f1: 0.5451
 epoch: 58, train_loss: 0.8134, test_loss: 0.8621, test_f1: 0.5464
 epoch: 59, train_loss: 0.8103, test_loss: 0.8644, test_f1: 0.5333
 epoch: 60, train_loss: 0.8146, test_loss: 0.8700, test_f1: 0.5550
 epoch: 61, train_loss: 0.7969, test_loss: 0.8557, test_f1: 0.5394
 epoch: 62, train_loss: 0.7892, test_loss: 0.8480, test_f1: 0.5359
 epoch: 63, train_loss: 0.7994, test_loss: 0.8237, test_f1: 0.5618
 epoch: 64, train_loss: 0.8040, test_loss: 0.8494, test_f1: 0.5432
 epoch: 65, train_loss: 0.7971, test_loss: 0.8586, test_f1: 0.5614
 epoch: 66, train_loss: 0.7897, test_loss: 0.8338, test_f1: 0.5374
 epoch: 67, train_loss: 0.7978, test_loss: 0.8478, test_f1: 0.5555
 epoch: 68, train_loss: 0.7942, test_loss: 0.8413, test_f1: 0.5685
 epoch: 69, train_loss: 0.7813, test_loss: 0.8408, test_f1: 0.5503
 epoch: 70, train_loss: 0.7862, test_loss: 0.8146, test_f1: 0.5470
 epoch: 71, train_loss: 0.7923, test_loss: 0.8485, test_f1: 0.5457
 epoch: 72, train_loss: 0.7891, test_loss: 0.8452, test_f1: 0.5441
 epoch: 73, train_loss: 0.7876, test_loss: 0.8663, test_f1: 0.5603
 epoch: 74, train_loss: 0.7916, test_loss: 0.8858, test_f1: 0.5522
 epoch: 75, train_loss: 0.7719, test_loss: 0.8729, test_f1: 0.5480
 epoch: 76, train_loss: 0.7792, test_loss: 0.8476, test_f1: 0.5417
 epoch: 77, train_loss: 0.7739, test_loss: 0.8377, test_f1: 0.5570
 epoch: 78, train_loss: 0.7746, test_loss: 0.8474, test_f1: 0.5453
 epoch: 79, train_loss: 0.7733, test_loss: 0.8388, test_f1: 0.5514
 epoch: 80, train_loss: 0.7767, test_loss: 0.8175, test_f1: 0.5586
 epoch: 81, train_loss: 0.7753, test_loss: 0.8640, test_f1: 0.5363
 epoch: 82, train_loss: 0.7781, test_loss: 0.9027, test_f1: 0.5458
 epoch: 83, train_loss: 0.7660, test_loss: 0.8401, test_f1: 0.5565
 epoch: 84, train_loss: 0.7754, test_loss: 0.8518, test_f1: 0.5656
 epoch: 85, train_loss: 0.7739, test_loss: 0.8292, test_f1: 0.5548
 epoch: 86, train_loss: 0.7749, test_loss: 0.8079, test_f1: 0.5581
 epoch: 87, train_loss: 0.7678, test_loss: 0.8094, test_f1: 0.5633
 epoch: 88, train_loss: 0.7754, test_loss: 0.8432, test_f1: 0.5678
 epoch: 89, train_loss: 0.7619, test_loss: 0.8375, test_f1: 0.5786
 epoch: 90, train_loss: 0.7646, test_loss: 0.8931, test_f1: 0.5399
 epoch: 91, train_loss: 0.7590, test_loss: 0.8764, test_f1: 0.5447
 epoch: 92, train_loss: 0.7630, test_loss: 0.8586, test_f1: 0.5667
 epoch: 93, train_loss: 0.7616, test_loss: 0.8762, test_f1: 0.5535
 epoch: 94, train_loss: 0.7602, test_loss: 0.8486, test_f1: 0.5614
 epoch: 95, train_loss: 0.7710, test_loss: 0.8563, test_f1: 0.5592
 epoch: 96, train_loss: 0.7583, test_loss: 0.8486, test_f1: 0.5583
 epoch: 97, train_loss: 0.7585, test_loss: 0.8302, test_f1: 0.5816
 epoch: 98, train_loss: 0.7632, test_loss: 0.8517, test_f1: 0.5726
 epoch: 99, train_loss: 0.7649, test_loss: 0.8424, test_f1: 0.5574

Training completed in 504.42 seconds
Best F1: 0.6366 at epoch 90
Mean F1 across iterations: 0.5811  0.0257
========================FINAL RESULTS================================
FEGIN weighted F1: 0.6366  0.0257
python main.py --data ltspice_examples --representation component_pin_net --model FEGIN --layers 3 --hiddens 16 --batch_size 128 --lr 0.001 --emb_size 128 --epochs 100 --save_appendix component_pin_net_L3_H16_BS128_LR0.001_E128 --no_val
-----



STDERR:
  File "main.py", line 370, in <module>
    main()
  File "main.py", line 254, in main
    dataset = dataset_class(
  File "/home/philip/projects/ltspice_examples_code_repo/Circuit-Completion-Using-GNNs/component_classification_with_link_prediction_head/evaluation/FEGIN/kernel/circuit_datasets.py", line 15, in __init__
    self.data, self.slices = torch.load(self.processed_paths[0])
  File "/home/philip/.local/lib/python3.8/site-packages/torch/serialization.py", line 1040, in load
    warnings.warn(
  File "/usr/lib/python3.8/warnings.py", line 109, in _showwarnmsg
    sw(msg.message, msg.category, msg.filename, msg.lineno,
  File "main.py", line 47, in warn_with_traceback
    traceback.print_stack(file=log)
/home/philip/projects/ltspice_examples_code_repo/Circuit-Completion-Using-GNNs/component_classification_with_link_prediction_head/evaluation/FEGIN/kernel/circuit_datasets.py:15: FutureWarning: You are using `torch.load` with `weights_only=False` (the current default value), which uses the default pickle module implicitly. It is possible to construct malicious pickle data which will execute arbitrary code during unpickling (See https://github.com/pytorch/pytorch/blob/main/SECURITY.md#untrusted-models for more details). In a future release, the default value for `weights_only` will be flipped to `True`. This limits the functions that could be executed during unpickling. Arbitrary objects will no longer be allowed to be loaded via this mode unless they are explicitly allowlisted by the user via `torch.serialization.add_safe_globals`. We recommend you start setting `weights_only=True` for any use case where you don't have full control of the loaded file. Please open an issue on GitHub for any issues related to this experimental feature.
  self.data, self.slices = torch.load(self.processed_paths[0])
