STDOUT:
Results will be saved in /home/philip/projects/ltspice_examples_code_repo/Circuit-Completion-Using-GNNs/component_classification_with_link_prediction_head/evaluation/FEGIN/results/model_FEGIN_dataset_ltspice_demos
Command line input: python main.py --data ltspice_demos --representation component_net --model FEGIN --layers 5 --hiddens 32 --batch_size 128 --lr 0.0001 --emb_size 250 --epochs 100 --save_appendix component_net_L5_H32_BS128_LR0.0001_E250 --no_val
 is saved.
-----
ltspice_demos - FEGIN
Using 5 layers, 32 hidden units, h = 2
Loading component_net representation dataset
ENTERED
Training FEGIN on component_net representation
Train: 1565, Test: 383
##################ITERATION #0 ****************************************
 epoch: 0, train_loss: 1.4424, test_loss: 1.4341, test_f1: 0.0507
 epoch: 1, train_loss: 1.4358, test_loss: 1.4334, test_f1: 0.0507
 epoch: 2, train_loss: 1.4314, test_loss: 1.4294, test_f1: 0.0507
 epoch: 3, train_loss: 1.4279, test_loss: 1.4247, test_f1: 0.0559
 epoch: 4, train_loss: 1.4244, test_loss: 1.4228, test_f1: 0.0784
 epoch: 5, train_loss: 1.4211, test_loss: 1.4154, test_f1: 0.0924
 epoch: 6, train_loss: 1.4166, test_loss: 1.4102, test_f1: 0.1445
 epoch: 7, train_loss: 1.4119, test_loss: 1.4076, test_f1: 0.1434
 epoch: 8, train_loss: 1.4066, test_loss: 1.4009, test_f1: 0.1702
 epoch: 9, train_loss: 1.4019, test_loss: 1.3963, test_f1: 0.1808
 epoch: 10, train_loss: 1.3981, test_loss: 1.3926, test_f1: 0.2103
 epoch: 11, train_loss: 1.3901, test_loss: 1.3884, test_f1: 0.2103
 epoch: 12, train_loss: 1.3838, test_loss: 1.3824, test_f1: 0.2315
 epoch: 13, train_loss: 1.3766, test_loss: 1.3759, test_f1: 0.2633
 epoch: 14, train_loss: 1.3711, test_loss: 1.3692, test_f1: 0.3232
 epoch: 15, train_loss: 1.3624, test_loss: 1.3661, test_f1: 0.3635
 epoch: 16, train_loss: 1.3547, test_loss: 1.3599, test_f1: 0.4112
 epoch: 17, train_loss: 1.3457, test_loss: 1.3528, test_f1: 0.4104
 epoch: 18, train_loss: 1.3363, test_loss: 1.3424, test_f1: 0.4109
 epoch: 19, train_loss: 1.3290, test_loss: 1.3328, test_f1: 0.3980
 epoch: 20, train_loss: 1.3143, test_loss: 1.3298, test_f1: 0.3924
 epoch: 21, train_loss: 1.3049, test_loss: 1.3426, test_f1: 0.3874
 epoch: 22, train_loss: 1.2880, test_loss: 1.3585, test_f1: 0.3778
 epoch: 23, train_loss: 1.2772, test_loss: 1.2997, test_f1: 0.3859
 epoch: 24, train_loss: 1.2659, test_loss: 1.3031, test_f1: 0.3869
 epoch: 25, train_loss: 1.2567, test_loss: 1.3150, test_f1: 0.3857
 epoch: 26, train_loss: 1.2465, test_loss: 1.3417, test_f1: 0.3878
 epoch: 27, train_loss: 1.2333, test_loss: 1.2711, test_f1: 0.3968
 epoch: 28, train_loss: 1.2275, test_loss: 1.2780, test_f1: 0.3893
 epoch: 29, train_loss: 1.2209, test_loss: 1.2894, test_f1: 0.3873
 epoch: 30, train_loss: 1.2078, test_loss: 1.2951, test_f1: 0.3791
 epoch: 31, train_loss: 1.2071, test_loss: 1.3089, test_f1: 0.3747
 epoch: 32, train_loss: 1.1962, test_loss: 1.2823, test_f1: 0.3643
 epoch: 33, train_loss: 1.1893, test_loss: 1.2886, test_f1: 0.3687
 epoch: 34, train_loss: 1.1839, test_loss: 1.2501, test_f1: 0.3670
 epoch: 35, train_loss: 1.1778, test_loss: 1.2215, test_f1: 0.3515
 epoch: 36, train_loss: 1.1752, test_loss: 1.2233, test_f1: 0.3258
 epoch: 37, train_loss: 1.1704, test_loss: 1.2282, test_f1: 0.3301
 epoch: 38, train_loss: 1.1682, test_loss: 1.2188, test_f1: 0.3295
 epoch: 39, train_loss: 1.1554, test_loss: 1.2150, test_f1: 0.3422
 epoch: 40, train_loss: 1.1561, test_loss: 1.2133, test_f1: 0.3368
 epoch: 41, train_loss: 1.1516, test_loss: 1.2142, test_f1: 0.3227
 epoch: 42, train_loss: 1.1491, test_loss: 1.2135, test_f1: 0.3385
 epoch: 43, train_loss: 1.1454, test_loss: 1.2102, test_f1: 0.3179
 epoch: 44, train_loss: 1.1420, test_loss: 1.2129, test_f1: 0.3180
 epoch: 45, train_loss: 1.1408, test_loss: 1.2104, test_f1: 0.3235
 epoch: 46, train_loss: 1.1359, test_loss: 1.2243, test_f1: 0.3217
 epoch: 47, train_loss: 1.1335, test_loss: 1.2154, test_f1: 0.3217
 epoch: 48, train_loss: 1.1342, test_loss: 1.2098, test_f1: 0.3217
 epoch: 49, train_loss: 1.1268, test_loss: 1.2087, test_f1: 0.3233
 epoch: 50, train_loss: 1.1223, test_loss: 1.2044, test_f1: 0.3260
 epoch: 51, train_loss: 1.1260, test_loss: 1.2087, test_f1: 0.3524
 epoch: 52, train_loss: 1.1187, test_loss: 1.2042, test_f1: 0.3449
 epoch: 53, train_loss: 1.1187, test_loss: 1.2028, test_f1: 0.3448
 epoch: 54, train_loss: 1.1175, test_loss: 1.2022, test_f1: 0.3501
 epoch: 55, train_loss: 1.1208, test_loss: 1.1981, test_f1: 0.3323
 epoch: 56, train_loss: 1.1132, test_loss: 1.1996, test_f1: 0.3535
 epoch: 57, train_loss: 1.1146, test_loss: 1.2013, test_f1: 0.3594
 epoch: 58, train_loss: 1.1184, test_loss: 1.1992, test_f1: 0.3462
 epoch: 59, train_loss: 1.1076, test_loss: 1.1986, test_f1: 0.3501
 epoch: 60, train_loss: 1.1146, test_loss: 1.2027, test_f1: 0.3473
 epoch: 61, train_loss: 1.1190, test_loss: 1.2006, test_f1: 0.3567
 epoch: 62, train_loss: 1.1063, test_loss: 1.1984, test_f1: 0.3733
 epoch: 63, train_loss: 1.1157, test_loss: 1.2007, test_f1: 0.3752
 epoch: 64, train_loss: 1.1103, test_loss: 1.2028, test_f1: 0.3698
 epoch: 65, train_loss: 1.0993, test_loss: 1.2025, test_f1: 0.3733
 epoch: 66, train_loss: 1.1108, test_loss: 1.2001, test_f1: 0.3733
 epoch: 67, train_loss: 1.1055, test_loss: 1.1969, test_f1: 0.3768
 epoch: 68, train_loss: 1.1033, test_loss: 1.2000, test_f1: 0.3635
 epoch: 69, train_loss: 1.1008, test_loss: 1.2014, test_f1: 0.3623
 epoch: 70, train_loss: 1.0960, test_loss: 1.1974, test_f1: 0.3751
 epoch: 71, train_loss: 1.0997, test_loss: 1.2032, test_f1: 0.3821
 epoch: 72, train_loss: 1.0986, test_loss: 1.1957, test_f1: 0.3783
 epoch: 73, train_loss: 1.0976, test_loss: 1.2048, test_f1: 0.3752
 epoch: 74, train_loss: 1.0992, test_loss: 1.1986, test_f1: 0.3887
 epoch: 75, train_loss: 1.1018, test_loss: 1.2044, test_f1: 0.3905
 epoch: 76, train_loss: 1.0920, test_loss: 1.2047, test_f1: 0.3834
 epoch: 77, train_loss: 1.0907, test_loss: 1.2024, test_f1: 0.4078
 epoch: 78, train_loss: 1.0953, test_loss: 1.2001, test_f1: 0.3869
 epoch: 79, train_loss: 1.0915, test_loss: 1.1966, test_f1: 0.4042
 epoch: 80, train_loss: 1.0903, test_loss: 1.2014, test_f1: 0.3906
 epoch: 81, train_loss: 1.0851, test_loss: 1.2085, test_f1: 0.3990
 epoch: 82, train_loss: 1.0904, test_loss: 1.2025, test_f1: 0.3987
 epoch: 83, train_loss: 1.0813, test_loss: 1.1961, test_f1: 0.3958
 epoch: 84, train_loss: 1.0874, test_loss: 1.1940, test_f1: 0.3959
 epoch: 85, train_loss: 1.0893, test_loss: 1.2042, test_f1: 0.3923
 epoch: 86, train_loss: 1.0786, test_loss: 1.2023, test_f1: 0.4000
 epoch: 87, train_loss: 1.0793, test_loss: 1.2026, test_f1: 0.4128
 epoch: 88, train_loss: 1.0819, test_loss: 1.2094, test_f1: 0.3918
 epoch: 89, train_loss: 1.0791, test_loss: 1.2092, test_f1: 0.4119
 epoch: 90, train_loss: 1.0848, test_loss: 1.2019, test_f1: 0.4336
 epoch: 91, train_loss: 1.0799, test_loss: 1.1986, test_f1: 0.4296
 epoch: 92, train_loss: 1.0783, test_loss: 1.2056, test_f1: 0.4265
 epoch: 93, train_loss: 1.0730, test_loss: 1.2015, test_f1: 0.4189
 epoch: 94, train_loss: 1.0719, test_loss: 1.1988, test_f1: 0.4241
 epoch: 95, train_loss: 1.0693, test_loss: 1.1977, test_f1: 0.4315
 epoch: 96, train_loss: 1.0765, test_loss: 1.1982, test_f1: 0.4315
 epoch: 97, train_loss: 1.0723, test_loss: 1.2019, test_f1: 0.4094
 epoch: 98, train_loss: 1.0681, test_loss: 1.1973, test_f1: 0.4128
 epoch: 99, train_loss: 1.0752, test_loss: 1.1967, test_f1: 0.4346
##################ITERATION #1 ****************************************
 epoch: 0, train_loss: 1.3644, test_loss: 1.3800, test_f1: 0.2281
 epoch: 1, train_loss: 1.3490, test_loss: 1.3699, test_f1: 0.2281
 epoch: 2, train_loss: 1.3396, test_loss: 1.3615, test_f1: 0.2281
 epoch: 3, train_loss: 1.3272, test_loss: 1.3570, test_f1: 0.2270
 epoch: 4, train_loss: 1.3190, test_loss: 1.3493, test_f1: 0.2270
 epoch: 5, train_loss: 1.3074, test_loss: 1.3424, test_f1: 0.2274
 epoch: 6, train_loss: 1.2967, test_loss: 1.3346, test_f1: 0.2274
 epoch: 7, train_loss: 1.2852, test_loss: 1.3277, test_f1: 0.2253
 epoch: 8, train_loss: 1.2786, test_loss: 1.3202, test_f1: 0.2548
 epoch: 9, train_loss: 1.2660, test_loss: 1.3130, test_f1: 0.2582
 epoch: 10, train_loss: 1.2602, test_loss: 1.3051, test_f1: 0.2582
 epoch: 11, train_loss: 1.2463, test_loss: 1.2970, test_f1: 0.2835
 epoch: 12, train_loss: 1.2354, test_loss: 1.2880, test_f1: 0.2904
 epoch: 13, train_loss: 1.2304, test_loss: 1.2789, test_f1: 0.2929
 epoch: 14, train_loss: 1.2195, test_loss: 1.2739, test_f1: 0.2920
 epoch: 15, train_loss: 1.2080, test_loss: 1.2654, test_f1: 0.3133
 epoch: 16, train_loss: 1.2021, test_loss: 1.2584, test_f1: 0.3224
 epoch: 17, train_loss: 1.1964, test_loss: 1.2524, test_f1: 0.2986
 epoch: 18, train_loss: 1.1898, test_loss: 1.2465, test_f1: 0.3221
 epoch: 19, train_loss: 1.1855, test_loss: 1.2400, test_f1: 0.3214
 epoch: 20, train_loss: 1.1726, test_loss: 1.2344, test_f1: 0.3199
 epoch: 21, train_loss: 1.1753, test_loss: 1.2296, test_f1: 0.3098
 epoch: 22, train_loss: 1.1649, test_loss: 1.2243, test_f1: 0.3429
 epoch: 23, train_loss: 1.1688, test_loss: 1.2217, test_f1: 0.3394
 epoch: 24, train_loss: 1.1592, test_loss: 1.2160, test_f1: 0.3363
 epoch: 25, train_loss: 1.1534, test_loss: 1.2141, test_f1: 0.3426
 epoch: 26, train_loss: 1.1443, test_loss: 1.2092, test_f1: 0.3499
 epoch: 27, train_loss: 1.1495, test_loss: 1.2041, test_f1: 0.3529
 epoch: 28, train_loss: 1.1467, test_loss: 1.2008, test_f1: 0.3488
 epoch: 29, train_loss: 1.1401, test_loss: 1.1963, test_f1: 0.3519
 epoch: 30, train_loss: 1.1408, test_loss: 1.1930, test_f1: 0.3529
 epoch: 31, train_loss: 1.1359, test_loss: 1.1914, test_f1: 0.3509
 epoch: 32, train_loss: 1.1387, test_loss: 1.1861, test_f1: 0.3535
 epoch: 33, train_loss: 1.1325, test_loss: 1.1858, test_f1: 0.3453
 epoch: 34, train_loss: 1.1277, test_loss: 1.1826, test_f1: 0.3538
 epoch: 35, train_loss: 1.1247, test_loss: 1.1786, test_f1: 0.3585
 epoch: 36, train_loss: 1.1218, test_loss: 1.1755, test_f1: 0.3565
 epoch: 37, train_loss: 1.1259, test_loss: 1.1750, test_f1: 0.3604
 epoch: 38, train_loss: 1.1232, test_loss: 1.1726, test_f1: 0.3681
 epoch: 39, train_loss: 1.1190, test_loss: 1.1714, test_f1: 0.3611
 epoch: 40, train_loss: 1.1135, test_loss: 1.1721, test_f1: 0.3637
 epoch: 41, train_loss: 1.1163, test_loss: 1.1672, test_f1: 0.3744
 epoch: 42, train_loss: 1.1069, test_loss: 1.1661, test_f1: 0.3690
 epoch: 43, train_loss: 1.1132, test_loss: 1.1636, test_f1: 0.3806
 epoch: 44, train_loss: 1.1015, test_loss: 1.1625, test_f1: 0.3786
 epoch: 45, train_loss: 1.1080, test_loss: 1.1607, test_f1: 0.3806
 epoch: 46, train_loss: 1.1022, test_loss: 1.1564, test_f1: 0.3781
 epoch: 47, train_loss: 1.0969, test_loss: 1.1534, test_f1: 0.3824
 epoch: 48, train_loss: 1.0949, test_loss: 1.1503, test_f1: 0.3779
 epoch: 49, train_loss: 1.0985, test_loss: 1.1494, test_f1: 0.3839
 epoch: 50, train_loss: 1.0967, test_loss: 1.1483, test_f1: 0.3764
 epoch: 51, train_loss: 1.0900, test_loss: 1.1486, test_f1: 0.3866
 epoch: 52, train_loss: 1.0947, test_loss: 1.1464, test_f1: 0.3906
 epoch: 53, train_loss: 1.0951, test_loss: 1.1456, test_f1: 0.3897
 epoch: 54, train_loss: 1.0944, test_loss: 1.1457, test_f1: 0.3942
 epoch: 55, train_loss: 1.0924, test_loss: 1.1453, test_f1: 0.3962
 epoch: 56, train_loss: 1.0845, test_loss: 1.1443, test_f1: 0.3902
 epoch: 57, train_loss: 1.0872, test_loss: 1.1418, test_f1: 0.3914
 epoch: 58, train_loss: 1.0840, test_loss: 1.1402, test_f1: 0.3905
 epoch: 59, train_loss: 1.0856, test_loss: 1.1382, test_f1: 0.3921
 epoch: 60, train_loss: 1.0822, test_loss: 1.1386, test_f1: 0.3928
 epoch: 61, train_loss: 1.0840, test_loss: 1.1377, test_f1: 0.4011
 epoch: 62, train_loss: 1.0847, test_loss: 1.1365, test_f1: 0.3846
 epoch: 63, train_loss: 1.0812, test_loss: 1.1371, test_f1: 0.3857
 epoch: 64, train_loss: 1.0770, test_loss: 1.1394, test_f1: 0.3875
 epoch: 65, train_loss: 1.0726, test_loss: 1.1371, test_f1: 0.3943
 epoch: 66, train_loss: 1.0816, test_loss: 1.1385, test_f1: 0.3927
 epoch: 67, train_loss: 1.0831, test_loss: 1.1373, test_f1: 0.4021
 epoch: 68, train_loss: 1.0778, test_loss: 1.1323, test_f1: 0.3937
 epoch: 69, train_loss: 1.0774, test_loss: 1.1336, test_f1: 0.3923
 epoch: 70, train_loss: 1.0800, test_loss: 1.1327, test_f1: 0.3971
 epoch: 71, train_loss: 1.0748, test_loss: 1.1310, test_f1: 0.4017
 epoch: 72, train_loss: 1.0749, test_loss: 1.1336, test_f1: 0.3930
 epoch: 73, train_loss: 1.0793, test_loss: 1.1330, test_f1: 0.4030
 epoch: 74, train_loss: 1.0731, test_loss: 1.1296, test_f1: 0.3953
 epoch: 75, train_loss: 1.0765, test_loss: 1.1285, test_f1: 0.4051
 epoch: 76, train_loss: 1.0730, test_loss: 1.1288, test_f1: 0.4177
 epoch: 77, train_loss: 1.0648, test_loss: 1.1278, test_f1: 0.4043
 epoch: 78, train_loss: 1.0701, test_loss: 1.1268, test_f1: 0.4290
 epoch: 79, train_loss: 1.0707, test_loss: 1.1241, test_f1: 0.4055
 epoch: 80, train_loss: 1.0675, test_loss: 1.1223, test_f1: 0.4248
 epoch: 81, train_loss: 1.0631, test_loss: 1.1268, test_f1: 0.4188
 epoch: 82, train_loss: 1.0652, test_loss: 1.1243, test_f1: 0.4212
 epoch: 83, train_loss: 1.0632, test_loss: 1.1225, test_f1: 0.4263
 epoch: 84, train_loss: 1.0643, test_loss: 1.1209, test_f1: 0.4214
 epoch: 85, train_loss: 1.0638, test_loss: 1.1215, test_f1: 0.4249
 epoch: 86, train_loss: 1.0707, test_loss: 1.1215, test_f1: 0.4345
 epoch: 87, train_loss: 1.0700, test_loss: 1.1237, test_f1: 0.4419
 epoch: 88, train_loss: 1.0604, test_loss: 1.1228, test_f1: 0.4424
 epoch: 89, train_loss: 1.0655, test_loss: 1.1209, test_f1: 0.4350
 epoch: 90, train_loss: 1.0651, test_loss: 1.1230, test_f1: 0.4361
 epoch: 91, train_loss: 1.0597, test_loss: 1.1228, test_f1: 0.4241
 epoch: 92, train_loss: 1.0612, test_loss: 1.1224, test_f1: 0.4301
 epoch: 93, train_loss: 1.0561, test_loss: 1.1205, test_f1: 0.4367
 epoch: 94, train_loss: 1.0536, test_loss: 1.1198, test_f1: 0.4417
 epoch: 95, train_loss: 1.0609, test_loss: 1.1225, test_f1: 0.4431
 epoch: 96, train_loss: 1.0554, test_loss: 1.1216, test_f1: 0.4330
 epoch: 97, train_loss: 1.0563, test_loss: 1.1232, test_f1: 0.4399
 epoch: 98, train_loss: 1.0595, test_loss: 1.1212, test_f1: 0.4466
 epoch: 99, train_loss: 1.0518, test_loss: 1.1210, test_f1: 0.4427
##################ITERATION #2 ****************************************
 epoch: 0, train_loss: 1.3357, test_loss: 1.3684, test_f1: 0.2281
 epoch: 1, train_loss: 1.3173, test_loss: 1.3642, test_f1: 0.2281
 epoch: 2, train_loss: 1.3024, test_loss: 1.3612, test_f1: 0.2281
 epoch: 3, train_loss: 1.2950, test_loss: 1.3511, test_f1: 0.2281
 epoch: 4, train_loss: 1.2838, test_loss: 1.3370, test_f1: 0.2281
 epoch: 5, train_loss: 1.2692, test_loss: 1.3228, test_f1: 0.2281
 epoch: 6, train_loss: 1.2634, test_loss: 1.3097, test_f1: 0.2281
 epoch: 7, train_loss: 1.2541, test_loss: 1.2970, test_f1: 0.2281
 epoch: 8, train_loss: 1.2473, test_loss: 1.2926, test_f1: 0.2281
 epoch: 9, train_loss: 1.2343, test_loss: 1.2816, test_f1: 0.2281
 epoch: 10, train_loss: 1.2278, test_loss: 1.2738, test_f1: 0.2281
 epoch: 11, train_loss: 1.2179, test_loss: 1.2684, test_f1: 0.2281
 epoch: 12, train_loss: 1.2142, test_loss: 1.2612, test_f1: 0.2281
 epoch: 13, train_loss: 1.2066, test_loss: 1.2562, test_f1: 0.2281
 epoch: 14, train_loss: 1.1996, test_loss: 1.2512, test_f1: 0.2281
 epoch: 15, train_loss: 1.1903, test_loss: 1.2455, test_f1: 0.2281
 epoch: 16, train_loss: 1.1844, test_loss: 1.2411, test_f1: 0.2281
 epoch: 17, train_loss: 1.1790, test_loss: 1.2367, test_f1: 0.2281
 epoch: 18, train_loss: 1.1726, test_loss: 1.2322, test_f1: 0.2281
 epoch: 19, train_loss: 1.1699, test_loss: 1.2283, test_f1: 0.2281
 epoch: 20, train_loss: 1.1703, test_loss: 1.2231, test_f1: 0.2281
 epoch: 21, train_loss: 1.1661, test_loss: 1.2199, test_f1: 0.2281
 epoch: 22, train_loss: 1.1611, test_loss: 1.2171, test_f1: 0.2281
 epoch: 23, train_loss: 1.1559, test_loss: 1.2144, test_f1: 0.2281
 epoch: 24, train_loss: 1.1576, test_loss: 1.2114, test_f1: 0.2281
 epoch: 25, train_loss: 1.1464, test_loss: 1.2095, test_f1: 0.2281
 epoch: 26, train_loss: 1.1410, test_loss: 1.2071, test_f1: 0.2281
 epoch: 27, train_loss: 1.1427, test_loss: 1.2020, test_f1: 0.2446
 epoch: 28, train_loss: 1.1368, test_loss: 1.2010, test_f1: 0.2604
 epoch: 29, train_loss: 1.1408, test_loss: 1.1974, test_f1: 0.2504
 epoch: 30, train_loss: 1.1361, test_loss: 1.1964, test_f1: 0.2595
 epoch: 31, train_loss: 1.1318, test_loss: 1.1946, test_f1: 0.2656
 epoch: 32, train_loss: 1.1278, test_loss: 1.1919, test_f1: 0.2894
 epoch: 33, train_loss: 1.1276, test_loss: 1.1911, test_f1: 0.3078
 epoch: 34, train_loss: 1.1265, test_loss: 1.1870, test_f1: 0.2927
 epoch: 35, train_loss: 1.1196, test_loss: 1.1839, test_f1: 0.2949
 epoch: 36, train_loss: 1.1275, test_loss: 1.1848, test_f1: 0.3147
 epoch: 37, train_loss: 1.1208, test_loss: 1.1827, test_f1: 0.3117
 epoch: 38, train_loss: 1.1213, test_loss: 1.1787, test_f1: 0.3407
 epoch: 39, train_loss: 1.1086, test_loss: 1.1788, test_f1: 0.3344
 epoch: 40, train_loss: 1.1148, test_loss: 1.1780, test_f1: 0.3386
 epoch: 41, train_loss: 1.1126, test_loss: 1.1761, test_f1: 0.3321
 epoch: 42, train_loss: 1.1109, test_loss: 1.1720, test_f1: 0.3155
 epoch: 43, train_loss: 1.1095, test_loss: 1.1706, test_f1: 0.3186
 epoch: 44, train_loss: 1.1060, test_loss: 1.1702, test_f1: 0.3528
 epoch: 45, train_loss: 1.1077, test_loss: 1.1681, test_f1: 0.3846
 epoch: 46, train_loss: 1.1019, test_loss: 1.1655, test_f1: 0.4188
 epoch: 47, train_loss: 1.0964, test_loss: 1.1662, test_f1: 0.4571
 epoch: 48, train_loss: 1.0919, test_loss: 1.1667, test_f1: 0.4620
 epoch: 49, train_loss: 1.0985, test_loss: 1.1623, test_f1: 0.4588
 epoch: 50, train_loss: 1.0929, test_loss: 1.1609, test_f1: 0.4651
 epoch: 51, train_loss: 1.0860, test_loss: 1.1617, test_f1: 0.4549
 epoch: 52, train_loss: 1.0981, test_loss: 1.1603, test_f1: 0.4514
 epoch: 53, train_loss: 1.0861, test_loss: 1.1600, test_f1: 0.4669
 epoch: 54, train_loss: 1.0881, test_loss: 1.1623, test_f1: 0.4650
 epoch: 55, train_loss: 1.0845, test_loss: 1.1599, test_f1: 0.4562
 epoch: 56, train_loss: 1.0865, test_loss: 1.1581, test_f1: 0.4522
 epoch: 57, train_loss: 1.0875, test_loss: 1.1563, test_f1: 0.4545
 epoch: 58, train_loss: 1.0854, test_loss: 1.1620, test_f1: 0.4469
 epoch: 59, train_loss: 1.0916, test_loss: 1.1578, test_f1: 0.4697
 epoch: 60, train_loss: 1.0859, test_loss: 1.1550, test_f1: 0.4735
 epoch: 61, train_loss: 1.0788, test_loss: 1.1545, test_f1: 0.4832
 epoch: 62, train_loss: 1.0869, test_loss: 1.1569, test_f1: 0.4659
 epoch: 63, train_loss: 1.0820, test_loss: 1.1561, test_f1: 0.4709
 epoch: 64, train_loss: 1.0752, test_loss: 1.1544, test_f1: 0.4676
 epoch: 65, train_loss: 1.0807, test_loss: 1.1545, test_f1: 0.4714
 epoch: 66, train_loss: 1.0769, test_loss: 1.1539, test_f1: 0.4735
 epoch: 67, train_loss: 1.0816, test_loss: 1.1514, test_f1: 0.4692
 epoch: 68, train_loss: 1.0797, test_loss: 1.1544, test_f1: 0.4739
 epoch: 69, train_loss: 1.0703, test_loss: 1.1537, test_f1: 0.4733
 epoch: 70, train_loss: 1.0729, test_loss: 1.1550, test_f1: 0.4674
 epoch: 71, train_loss: 1.0781, test_loss: 1.1510, test_f1: 0.4830
 epoch: 72, train_loss: 1.0784, test_loss: 1.1496, test_f1: 0.4693
 epoch: 73, train_loss: 1.0708, test_loss: 1.1470, test_f1: 0.4729
 epoch: 74, train_loss: 1.0743, test_loss: 1.1451, test_f1: 0.4729
 epoch: 75, train_loss: 1.0733, test_loss: 1.1442, test_f1: 0.4643
 epoch: 76, train_loss: 1.0633, test_loss: 1.1447, test_f1: 0.4561
 epoch: 77, train_loss: 1.0673, test_loss: 1.1453, test_f1: 0.4700
 epoch: 78, train_loss: 1.0677, test_loss: 1.1435, test_f1: 0.4675
 epoch: 79, train_loss: 1.0708, test_loss: 1.1428, test_f1: 0.4579
 epoch: 80, train_loss: 1.0672, test_loss: 1.1420, test_f1: 0.4741
 epoch: 81, train_loss: 1.0596, test_loss: 1.1426, test_f1: 0.4639
 epoch: 82, train_loss: 1.0666, test_loss: 1.1445, test_f1: 0.4624
 epoch: 83, train_loss: 1.0663, test_loss: 1.1454, test_f1: 0.4637
 epoch: 84, train_loss: 1.0596, test_loss: 1.1468, test_f1: 0.4617
 epoch: 85, train_loss: 1.0652, test_loss: 1.1459, test_f1: 0.4620
 epoch: 86, train_loss: 1.0642, test_loss: 1.1469, test_f1: 0.4653
 epoch: 87, train_loss: 1.0647, test_loss: 1.1444, test_f1: 0.4622
 epoch: 88, train_loss: 1.0577, test_loss: 1.1415, test_f1: 0.4610
 epoch: 89, train_loss: 1.0626, test_loss: 1.1433, test_f1: 0.4502
 epoch: 90, train_loss: 1.0566, test_loss: 1.1395, test_f1: 0.4694
 epoch: 91, train_loss: 1.0638, test_loss: 1.1414, test_f1: 0.4521
 epoch: 92, train_loss: 1.0543, test_loss: 1.1376, test_f1: 0.4486
 epoch: 93, train_loss: 1.0584, test_loss: 1.1444, test_f1: 0.4362
 epoch: 94, train_loss: 1.0586, test_loss: 1.1428, test_f1: 0.4444
 epoch: 95, train_loss: 1.0488, test_loss: 1.1393, test_f1: 0.4411
 epoch: 96, train_loss: 1.0568, test_loss: 1.1376, test_f1: 0.4370
 epoch: 97, train_loss: 1.0510, test_loss: 1.1405, test_f1: 0.4509
 epoch: 98, train_loss: 1.0535, test_loss: 1.1452, test_f1: 0.4469
 epoch: 99, train_loss: 1.0527, test_loss: 1.1374, test_f1: 0.4540
##################ITERATION #3 ****************************************
 epoch: 0, train_loss: 1.3158, test_loss: 1.3541, test_f1: 0.2281
 epoch: 1, train_loss: 1.2941, test_loss: 1.3381, test_f1: 0.2281
 epoch: 2, train_loss: 1.2812, test_loss: 1.3273, test_f1: 0.2281
 epoch: 3, train_loss: 1.2665, test_loss: 1.3228, test_f1: 0.2281
 epoch: 4, train_loss: 1.2621, test_loss: 1.3175, test_f1: 0.2281
 epoch: 5, train_loss: 1.2526, test_loss: 1.3093, test_f1: 0.2281
 epoch: 6, train_loss: 1.2441, test_loss: 1.3000, test_f1: 0.2274
 epoch: 7, train_loss: 1.2323, test_loss: 1.2895, test_f1: 0.2337
 epoch: 8, train_loss: 1.2222, test_loss: 1.2809, test_f1: 0.2642
 epoch: 9, train_loss: 1.2229, test_loss: 1.2755, test_f1: 0.2536
 epoch: 10, train_loss: 1.2111, test_loss: 1.2698, test_f1: 0.2716
 epoch: 11, train_loss: 1.2037, test_loss: 1.2628, test_f1: 0.2687
 epoch: 12, train_loss: 1.1988, test_loss: 1.2586, test_f1: 0.2470
 epoch: 13, train_loss: 1.2015, test_loss: 1.2536, test_f1: 0.2708
 epoch: 14, train_loss: 1.1906, test_loss: 1.2491, test_f1: 0.2913
 epoch: 15, train_loss: 1.1857, test_loss: 1.2451, test_f1: 0.2666
 epoch: 16, train_loss: 1.1825, test_loss: 1.2401, test_f1: 0.2564
 epoch: 17, train_loss: 1.1741, test_loss: 1.2358, test_f1: 0.2664
 epoch: 18, train_loss: 1.1757, test_loss: 1.2289, test_f1: 0.2884
 epoch: 19, train_loss: 1.1716, test_loss: 1.2277, test_f1: 0.2914
 epoch: 20, train_loss: 1.1609, test_loss: 1.2248, test_f1: 0.2969
 epoch: 21, train_loss: 1.1638, test_loss: 1.2201, test_f1: 0.2954
 epoch: 22, train_loss: 1.1573, test_loss: 1.2155, test_f1: 0.2970
 epoch: 23, train_loss: 1.1582, test_loss: 1.2108, test_f1: 0.2913
 epoch: 24, train_loss: 1.1449, test_loss: 1.2076, test_f1: 0.2913
 epoch: 25, train_loss: 1.1520, test_loss: 1.2061, test_f1: 0.2913
 epoch: 26, train_loss: 1.1528, test_loss: 1.2019, test_f1: 0.3011
 epoch: 27, train_loss: 1.1437, test_loss: 1.1984, test_f1: 0.3017
 epoch: 28, train_loss: 1.1462, test_loss: 1.1964, test_f1: 0.2989
 epoch: 29, train_loss: 1.1382, test_loss: 1.1936, test_f1: 0.2996
 epoch: 30, train_loss: 1.1347, test_loss: 1.1910, test_f1: 0.3086
 epoch: 31, train_loss: 1.1321, test_loss: 1.1886, test_f1: 0.3321
 epoch: 32, train_loss: 1.1294, test_loss: 1.1855, test_f1: 0.3405
 epoch: 33, train_loss: 1.1303, test_loss: 1.1832, test_f1: 0.3489
 epoch: 34, train_loss: 1.1228, test_loss: 1.1841, test_f1: 0.3544
 epoch: 35, train_loss: 1.1283, test_loss: 1.1793, test_f1: 0.3609
 epoch: 36, train_loss: 1.1251, test_loss: 1.1769, test_f1: 0.3472
 epoch: 37, train_loss: 1.1189, test_loss: 1.1782, test_f1: 0.3572
 epoch: 38, train_loss: 1.1155, test_loss: 1.1750, test_f1: 0.3609
 epoch: 39, train_loss: 1.1202, test_loss: 1.1727, test_f1: 0.3534
 epoch: 40, train_loss: 1.1164, test_loss: 1.1732, test_f1: 0.3573
 epoch: 41, train_loss: 1.1096, test_loss: 1.1706, test_f1: 0.3555
 epoch: 42, train_loss: 1.1123, test_loss: 1.1671, test_f1: 0.3542
 epoch: 43, train_loss: 1.1058, test_loss: 1.1664, test_f1: 0.3511
 epoch: 44, train_loss: 1.1104, test_loss: 1.1670, test_f1: 0.3484
 epoch: 45, train_loss: 1.1132, test_loss: 1.1581, test_f1: 0.3649
 epoch: 46, train_loss: 1.1080, test_loss: 1.1632, test_f1: 0.3726
 epoch: 47, train_loss: 1.1031, test_loss: 1.1605, test_f1: 0.3739
 epoch: 48, train_loss: 1.0961, test_loss: 1.1607, test_f1: 0.3631
 epoch: 49, train_loss: 1.0992, test_loss: 1.1592, test_f1: 0.3744
 epoch: 50, train_loss: 1.0962, test_loss: 1.1577, test_f1: 0.3784
 epoch: 51, train_loss: 1.0948, test_loss: 1.1586, test_f1: 0.3808
 epoch: 52, train_loss: 1.0856, test_loss: 1.1665, test_f1: 0.3877
 epoch: 53, train_loss: 1.0879, test_loss: 1.1588, test_f1: 0.3996
 epoch: 54, train_loss: 1.0873, test_loss: 1.1583, test_f1: 0.3954
 epoch: 55, train_loss: 1.0935, test_loss: 1.1563, test_f1: 0.4047
 epoch: 56, train_loss: 1.0973, test_loss: 1.1557, test_f1: 0.4010
 epoch: 57, train_loss: 1.0854, test_loss: 1.1548, test_f1: 0.4030
 epoch: 58, train_loss: 1.0881, test_loss: 1.1586, test_f1: 0.3914
 epoch: 59, train_loss: 1.0848, test_loss: 1.1563, test_f1: 0.3936
 epoch: 60, train_loss: 1.0885, test_loss: 1.1572, test_f1: 0.3944
 epoch: 61, train_loss: 1.0863, test_loss: 1.1573, test_f1: 0.3932
 epoch: 62, train_loss: 1.0824, test_loss: 1.1552, test_f1: 0.3943
 epoch: 63, train_loss: 1.0813, test_loss: 1.1578, test_f1: 0.4096
 epoch: 64, train_loss: 1.0779, test_loss: 1.1536, test_f1: 0.4079
 epoch: 65, train_loss: 1.0807, test_loss: 1.1556, test_f1: 0.4042
 epoch: 66, train_loss: 1.0885, test_loss: 1.1513, test_f1: 0.3979
 epoch: 67, train_loss: 1.0822, test_loss: 1.1505, test_f1: 0.3954
 epoch: 68, train_loss: 1.0872, test_loss: 1.1530, test_f1: 0.4020
 epoch: 69, train_loss: 1.0695, test_loss: 1.1520, test_f1: 0.3993
 epoch: 70, train_loss: 1.0752, test_loss: 1.1507, test_f1: 0.4013
 epoch: 71, train_loss: 1.0784, test_loss: 1.1558, test_f1: 0.4060
 epoch: 72, train_loss: 1.0739, test_loss: 1.1529, test_f1: 0.3955
 epoch: 73, train_loss: 1.0747, test_loss: 1.1512, test_f1: 0.4041
 epoch: 74, train_loss: 1.0780, test_loss: 1.1473, test_f1: 0.3966
 epoch: 75, train_loss: 1.0699, test_loss: 1.1449, test_f1: 0.3957
 epoch: 76, train_loss: 1.0801, test_loss: 1.1355, test_f1: 0.4031
 epoch: 77, train_loss: 1.0730, test_loss: 1.1385, test_f1: 0.4076
 epoch: 78, train_loss: 1.0694, test_loss: 1.1374, test_f1: 0.4047
 epoch: 79, train_loss: 1.0710, test_loss: 1.1371, test_f1: 0.4053
 epoch: 80, train_loss: 1.0651, test_loss: 1.1377, test_f1: 0.4116
 epoch: 81, train_loss: 1.0706, test_loss: 1.1445, test_f1: 0.4068
 epoch: 82, train_loss: 1.0686, test_loss: 1.1467, test_f1: 0.4002
 epoch: 83, train_loss: 1.0611, test_loss: 1.1325, test_f1: 0.4231
 epoch: 84, train_loss: 1.0634, test_loss: 1.1424, test_f1: 0.4137
 epoch: 85, train_loss: 1.0661, test_loss: 1.1322, test_f1: 0.4164
 epoch: 86, train_loss: 1.0643, test_loss: 1.1314, test_f1: 0.4072
 epoch: 87, train_loss: 1.0607, test_loss: 1.1396, test_f1: 0.4168
 epoch: 88, train_loss: 1.0595, test_loss: 1.1341, test_f1: 0.4149
 epoch: 89, train_loss: 1.0654, test_loss: 1.1286, test_f1: 0.4215
 epoch: 90, train_loss: 1.0630, test_loss: 1.1401, test_f1: 0.4124
 epoch: 91, train_loss: 1.0607, test_loss: 1.1263, test_f1: 0.4158
 epoch: 92, train_loss: 1.0597, test_loss: 1.1198, test_f1: 0.4083
 epoch: 93, train_loss: 1.0668, test_loss: 1.1411, test_f1: 0.4142
 epoch: 94, train_loss: 1.0553, test_loss: 1.1281, test_f1: 0.4240
 epoch: 95, train_loss: 1.0581, test_loss: 1.1324, test_f1: 0.4190
 epoch: 96, train_loss: 1.0662, test_loss: 1.1396, test_f1: 0.4263
 epoch: 97, train_loss: 1.0543, test_loss: 1.1341, test_f1: 0.4139
 epoch: 98, train_loss: 1.0539, test_loss: 1.1250, test_f1: 0.4227
 epoch: 99, train_loss: 1.0597, test_loss: 1.1249, test_f1: 0.4312
##################ITERATION #4 ****************************************
 epoch: 0, train_loss: 1.3104, test_loss: 1.3616, test_f1: 0.2281
 epoch: 1, train_loss: 1.2852, test_loss: 1.3613, test_f1: 0.2281
 epoch: 2, train_loss: 1.2709, test_loss: 1.3454, test_f1: 0.2281
 epoch: 3, train_loss: 1.2570, test_loss: 1.3161, test_f1: 0.2281
 epoch: 4, train_loss: 1.2429, test_loss: 1.2924, test_f1: 0.2281
 epoch: 5, train_loss: 1.2321, test_loss: 1.2814, test_f1: 0.2281
 epoch: 6, train_loss: 1.2241, test_loss: 1.2685, test_f1: 0.2281
 epoch: 7, train_loss: 1.2151, test_loss: 1.2601, test_f1: 0.2281
 epoch: 8, train_loss: 1.2106, test_loss: 1.2498, test_f1: 0.2281
 epoch: 9, train_loss: 1.1996, test_loss: 1.2469, test_f1: 0.2281
 epoch: 10, train_loss: 1.1887, test_loss: 1.2418, test_f1: 0.2281
 epoch: 11, train_loss: 1.1868, test_loss: 1.2349, test_f1: 0.2539
 epoch: 12, train_loss: 1.1796, test_loss: 1.2295, test_f1: 0.2628
 epoch: 13, train_loss: 1.1798, test_loss: 1.2264, test_f1: 0.2898
 epoch: 14, train_loss: 1.1634, test_loss: 1.2242, test_f1: 0.2794
 epoch: 15, train_loss: 1.1555, test_loss: 1.2173, test_f1: 0.2823
 epoch: 16, train_loss: 1.1598, test_loss: 1.2115, test_f1: 0.3123
 epoch: 17, train_loss: 1.1560, test_loss: 1.2080, test_f1: 0.3083
 epoch: 18, train_loss: 1.1526, test_loss: 1.2032, test_f1: 0.3148
 epoch: 19, train_loss: 1.1549, test_loss: 1.1977, test_f1: 0.3397
 epoch: 20, train_loss: 1.1434, test_loss: 1.1958, test_f1: 0.3376
 epoch: 21, train_loss: 1.1419, test_loss: 1.1946, test_f1: 0.3430
 epoch: 22, train_loss: 1.1330, test_loss: 1.1911, test_f1: 0.3398
 epoch: 23, train_loss: 1.1332, test_loss: 1.1882, test_f1: 0.3434
 epoch: 24, train_loss: 1.1264, test_loss: 1.1860, test_f1: 0.3534
 epoch: 25, train_loss: 1.1291, test_loss: 1.1822, test_f1: 0.3521
 epoch: 26, train_loss: 1.1321, test_loss: 1.1775, test_f1: 0.3550
 epoch: 27, train_loss: 1.1265, test_loss: 1.1751, test_f1: 0.3573
 epoch: 28, train_loss: 1.1176, test_loss: 1.1726, test_f1: 0.3671
 epoch: 29, train_loss: 1.1215, test_loss: 1.1671, test_f1: 0.3749
 epoch: 30, train_loss: 1.1240, test_loss: 1.1613, test_f1: 0.3741
 epoch: 31, train_loss: 1.1062, test_loss: 1.1598, test_f1: 0.3841
 epoch: 32, train_loss: 1.1035, test_loss: 1.1570, test_f1: 0.3786
 epoch: 33, train_loss: 1.1091, test_loss: 1.1568, test_f1: 0.3889
 epoch: 34, train_loss: 1.1046, test_loss: 1.1557, test_f1: 0.3840
 epoch: 35, train_loss: 1.1082, test_loss: 1.1529, test_f1: 0.3870
 epoch: 36, train_loss: 1.1067, test_loss: 1.1506, test_f1: 0.3918
 epoch: 37, train_loss: 1.1026, test_loss: 1.1482, test_f1: 0.4001
 epoch: 38, train_loss: 1.0984, test_loss: 1.1490, test_f1: 0.3982
 epoch: 39, train_loss: 1.0937, test_loss: 1.1474, test_f1: 0.3957
 epoch: 40, train_loss: 1.0906, test_loss: 1.1411, test_f1: 0.4023
 epoch: 41, train_loss: 1.0930, test_loss: 1.1383, test_f1: 0.4027
 epoch: 42, train_loss: 1.0803, test_loss: 1.1382, test_f1: 0.3984
 epoch: 43, train_loss: 1.0859, test_loss: 1.1343, test_f1: 0.4089
 epoch: 44, train_loss: 1.0938, test_loss: 1.1384, test_f1: 0.4114
 epoch: 45, train_loss: 1.0782, test_loss: 1.1409, test_f1: 0.4081
 epoch: 46, train_loss: 1.0864, test_loss: 1.1351, test_f1: 0.4205
 epoch: 47, train_loss: 1.0927, test_loss: 1.1348, test_f1: 0.4157
 epoch: 48, train_loss: 1.0739, test_loss: 1.1345, test_f1: 0.4238
 epoch: 49, train_loss: 1.0742, test_loss: 1.1321, test_f1: 0.4169
 epoch: 50, train_loss: 1.0770, test_loss: 1.1268, test_f1: 0.4231
 epoch: 51, train_loss: 1.0729, test_loss: 1.1260, test_f1: 0.4382
 epoch: 52, train_loss: 1.0788, test_loss: 1.1218, test_f1: 0.4357
 epoch: 53, train_loss: 1.0782, test_loss: 1.1210, test_f1: 0.4414
 epoch: 54, train_loss: 1.0698, test_loss: 1.1209, test_f1: 0.4324
 epoch: 55, train_loss: 1.0724, test_loss: 1.1206, test_f1: 0.4469
 epoch: 56, train_loss: 1.0712, test_loss: 1.1205, test_f1: 0.4407
 epoch: 57, train_loss: 1.0734, test_loss: 1.1191, test_f1: 0.4484
 epoch: 58, train_loss: 1.0737, test_loss: 1.1191, test_f1: 0.4471
 epoch: 59, train_loss: 1.0738, test_loss: 1.1173, test_f1: 0.4423
 epoch: 60, train_loss: 1.0683, test_loss: 1.1208, test_f1: 0.4473
 epoch: 61, train_loss: 1.0632, test_loss: 1.1185, test_f1: 0.4405
 epoch: 62, train_loss: 1.0662, test_loss: 1.1202, test_f1: 0.4452
 epoch: 63, train_loss: 1.0574, test_loss: 1.1186, test_f1: 0.4423
 epoch: 64, train_loss: 1.0591, test_loss: 1.1181, test_f1: 0.4406
 epoch: 65, train_loss: 1.0601, test_loss: 1.1165, test_f1: 0.4422
 epoch: 66, train_loss: 1.0608, test_loss: 1.1177, test_f1: 0.4331
 epoch: 67, train_loss: 1.0629, test_loss: 1.1175, test_f1: 0.4367
 epoch: 68, train_loss: 1.0595, test_loss: 1.1151, test_f1: 0.4380
 epoch: 69, train_loss: 1.0655, test_loss: 1.1135, test_f1: 0.4356
 epoch: 70, train_loss: 1.0580, test_loss: 1.1130, test_f1: 0.4419
 epoch: 71, train_loss: 1.0566, test_loss: 1.1131, test_f1: 0.4428
 epoch: 72, train_loss: 1.0583, test_loss: 1.1100, test_f1: 0.4306
 epoch: 73, train_loss: 1.0580, test_loss: 1.1133, test_f1: 0.4433
 epoch: 74, train_loss: 1.0541, test_loss: 1.1145, test_f1: 0.4461
 epoch: 75, train_loss: 1.0635, test_loss: 1.1113, test_f1: 0.4433
 epoch: 76, train_loss: 1.0570, test_loss: 1.1121, test_f1: 0.4336
 epoch: 77, train_loss: 1.0546, test_loss: 1.1105, test_f1: 0.4335
 epoch: 78, train_loss: 1.0505, test_loss: 1.1101, test_f1: 0.4420
 epoch: 79, train_loss: 1.0412, test_loss: 1.1107, test_f1: 0.4456
 epoch: 80, train_loss: 1.0503, test_loss: 1.1092, test_f1: 0.4465
 epoch: 81, train_loss: 1.0525, test_loss: 1.1072, test_f1: 0.4464
 epoch: 82, train_loss: 1.0430, test_loss: 1.1089, test_f1: 0.4518
 epoch: 83, train_loss: 1.0481, test_loss: 1.1060, test_f1: 0.4422
 epoch: 84, train_loss: 1.0506, test_loss: 1.1074, test_f1: 0.4451
 epoch: 85, train_loss: 1.0509, test_loss: 1.1101, test_f1: 0.4434
 epoch: 86, train_loss: 1.0465, test_loss: 1.1108, test_f1: 0.4499
 epoch: 87, train_loss: 1.0557, test_loss: 1.1116, test_f1: 0.4433
 epoch: 88, train_loss: 1.0414, test_loss: 1.1105, test_f1: 0.4502
 epoch: 89, train_loss: 1.0470, test_loss: 1.1093, test_f1: 0.4350
 epoch: 90, train_loss: 1.0401, test_loss: 1.1106, test_f1: 0.4432
 epoch: 91, train_loss: 1.0380, test_loss: 1.1067, test_f1: 0.4431
 epoch: 92, train_loss: 1.0390, test_loss: 1.1076, test_f1: 0.4450
 epoch: 93, train_loss: 1.0414, test_loss: 1.1093, test_f1: 0.4405
 epoch: 94, train_loss: 1.0430, test_loss: 1.1069, test_f1: 0.4454
 epoch: 95, train_loss: 1.0389, test_loss: 1.1032, test_f1: 0.4434
 epoch: 96, train_loss: 1.0374, test_loss: 1.1069, test_f1: 0.4485
 epoch: 97, train_loss: 1.0376, test_loss: 1.1056, test_f1: 0.4432
 epoch: 98, train_loss: 1.0369, test_loss: 1.1045, test_f1: 0.4361
 epoch: 99, train_loss: 1.0387, test_loss: 1.1062, test_f1: 0.4494
##################ITERATION #5 ****************************************
 epoch: 0, train_loss: 1.2509, test_loss: 1.3421, test_f1: 0.2281
 epoch: 1, train_loss: 1.2297, test_loss: 1.3443, test_f1: 0.2281
 epoch: 2, train_loss: 1.2298, test_loss: 1.3166, test_f1: 0.2281
 epoch: 3, train_loss: 1.2146, test_loss: 1.2904, test_f1: 0.2281
 epoch: 4, train_loss: 1.2015, test_loss: 1.2753, test_f1: 0.2281
 epoch: 5, train_loss: 1.1954, test_loss: 1.2680, test_f1: 0.2281
 epoch: 6, train_loss: 1.1915, test_loss: 1.2476, test_f1: 0.2281
 epoch: 7, train_loss: 1.1930, test_loss: 1.2380, test_f1: 0.2614
 epoch: 8, train_loss: 1.1792, test_loss: 1.2315, test_f1: 0.2589
 epoch: 9, train_loss: 1.1687, test_loss: 1.2244, test_f1: 0.2888
 epoch: 10, train_loss: 1.1695, test_loss: 1.2161, test_f1: 0.3104
 epoch: 11, train_loss: 1.1685, test_loss: 1.2106, test_f1: 0.3037
 epoch: 12, train_loss: 1.1619, test_loss: 1.2051, test_f1: 0.3057
 epoch: 13, train_loss: 1.1592, test_loss: 1.1999, test_f1: 0.3024
 epoch: 14, train_loss: 1.1578, test_loss: 1.2011, test_f1: 0.3045
 epoch: 15, train_loss: 1.1497, test_loss: 1.1922, test_f1: 0.3023
 epoch: 16, train_loss: 1.1540, test_loss: 1.1910, test_f1: 0.3011
 epoch: 17, train_loss: 1.1423, test_loss: 1.1867, test_f1: 0.3031
 epoch: 18, train_loss: 1.1473, test_loss: 1.1821, test_f1: 0.2997
 epoch: 19, train_loss: 1.1365, test_loss: 1.1826, test_f1: 0.3069
 epoch: 20, train_loss: 1.1410, test_loss: 1.1793, test_f1: 0.3180
 epoch: 21, train_loss: 1.1339, test_loss: 1.1750, test_f1: 0.3189
 epoch: 22, train_loss: 1.1292, test_loss: 1.1740, test_f1: 0.3217
 epoch: 23, train_loss: 1.1276, test_loss: 1.1714, test_f1: 0.3331
 epoch: 24, train_loss: 1.1266, test_loss: 1.1664, test_f1: 0.3351
 epoch: 25, train_loss: 1.1188, test_loss: 1.1637, test_f1: 0.3424
 epoch: 26, train_loss: 1.1208, test_loss: 1.1604, test_f1: 0.3563
 epoch: 27, train_loss: 1.1131, test_loss: 1.1581, test_f1: 0.3545
 epoch: 28, train_loss: 1.1165, test_loss: 1.1564, test_f1: 0.3648
 epoch: 29, train_loss: 1.1111, test_loss: 1.1578, test_f1: 0.3651
 epoch: 30, train_loss: 1.0967, test_loss: 1.1552, test_f1: 0.3618
 epoch: 31, train_loss: 1.1142, test_loss: 1.1531, test_f1: 0.3718
 epoch: 32, train_loss: 1.1048, test_loss: 1.1502, test_f1: 0.3675
 epoch: 33, train_loss: 1.1071, test_loss: 1.1491, test_f1: 0.3640
 epoch: 34, train_loss: 1.0959, test_loss: 1.1477, test_f1: 0.3717
 epoch: 35, train_loss: 1.0974, test_loss: 1.1454, test_f1: 0.3950
 epoch: 36, train_loss: 1.0997, test_loss: 1.1467, test_f1: 0.4064
 epoch: 37, train_loss: 1.0945, test_loss: 1.1414, test_f1: 0.4114
 epoch: 38, train_loss: 1.0900, test_loss: 1.1406, test_f1: 0.4059
 epoch: 39, train_loss: 1.0833, test_loss: 1.1401, test_f1: 0.4117
 epoch: 40, train_loss: 1.0922, test_loss: 1.1368, test_f1: 0.4126
 epoch: 41, train_loss: 1.0885, test_loss: 1.1328, test_f1: 0.4043
 epoch: 42, train_loss: 1.0837, test_loss: 1.1313, test_f1: 0.4065
 epoch: 43, train_loss: 1.0921, test_loss: 1.1276, test_f1: 0.4062
 epoch: 44, train_loss: 1.0790, test_loss: 1.1271, test_f1: 0.4134
 epoch: 45, train_loss: 1.0850, test_loss: 1.1250, test_f1: 0.4118
 epoch: 46, train_loss: 1.0653, test_loss: 1.1239, test_f1: 0.4111
 epoch: 47, train_loss: 1.0767, test_loss: 1.1243, test_f1: 0.4147
 epoch: 48, train_loss: 1.0680, test_loss: 1.1227, test_f1: 0.4190
 epoch: 49, train_loss: 1.0788, test_loss: 1.1197, test_f1: 0.4314
 epoch: 50, train_loss: 1.0672, test_loss: 1.1190, test_f1: 0.4272
 epoch: 51, train_loss: 1.0712, test_loss: 1.1186, test_f1: 0.4286
 epoch: 52, train_loss: 1.0701, test_loss: 1.1191, test_f1: 0.4142
 epoch: 53, train_loss: 1.0707, test_loss: 1.1192, test_f1: 0.4179
 epoch: 54, train_loss: 1.0623, test_loss: 1.1174, test_f1: 0.4215
 epoch: 55, train_loss: 1.0587, test_loss: 1.1172, test_f1: 0.4434
 epoch: 56, train_loss: 1.0698, test_loss: 1.1184, test_f1: 0.4215
 epoch: 57, train_loss: 1.0731, test_loss: 1.1162, test_f1: 0.4242
 epoch: 58, train_loss: 1.0606, test_loss: 1.1138, test_f1: 0.4063
 epoch: 59, train_loss: 1.0545, test_loss: 1.1160, test_f1: 0.4137
 epoch: 60, train_loss: 1.0562, test_loss: 1.1160, test_f1: 0.4244
 epoch: 61, train_loss: 1.0520, test_loss: 1.1125, test_f1: 0.4259
 epoch: 62, train_loss: 1.0499, test_loss: 1.1132, test_f1: 0.4321
 epoch: 63, train_loss: 1.0554, test_loss: 1.1084, test_f1: 0.4226
 epoch: 64, train_loss: 1.0597, test_loss: 1.1135, test_f1: 0.4238
 epoch: 65, train_loss: 1.0508, test_loss: 1.1138, test_f1: 0.4283
 epoch: 66, train_loss: 1.0549, test_loss: 1.1098, test_f1: 0.4054
 epoch: 67, train_loss: 1.0606, test_loss: 1.1102, test_f1: 0.4196
 epoch: 68, train_loss: 1.0449, test_loss: 1.1070, test_f1: 0.4221
 epoch: 69, train_loss: 1.0476, test_loss: 1.1079, test_f1: 0.4159
 epoch: 70, train_loss: 1.0507, test_loss: 1.1071, test_f1: 0.4473
 epoch: 71, train_loss: 1.0495, test_loss: 1.1044, test_f1: 0.4424
 epoch: 72, train_loss: 1.0480, test_loss: 1.1038, test_f1: 0.4205
 epoch: 73, train_loss: 1.0479, test_loss: 1.1061, test_f1: 0.4355
 epoch: 74, train_loss: 1.0447, test_loss: 1.1063, test_f1: 0.4337
 epoch: 75, train_loss: 1.0462, test_loss: 1.1050, test_f1: 0.4506
 epoch: 76, train_loss: 1.0389, test_loss: 1.1060, test_f1: 0.4423
 epoch: 77, train_loss: 1.0451, test_loss: 1.1022, test_f1: 0.4457
 epoch: 78, train_loss: 1.0414, test_loss: 1.1013, test_f1: 0.4514
 epoch: 79, train_loss: 1.0454, test_loss: 1.1005, test_f1: 0.4438
 epoch: 80, train_loss: 1.0435, test_loss: 1.0994, test_f1: 0.4428
 epoch: 81, train_loss: 1.0403, test_loss: 1.0996, test_f1: 0.4372
 epoch: 82, train_loss: 1.0442, test_loss: 1.0989, test_f1: 0.4276
 epoch: 83, train_loss: 1.0362, test_loss: 1.0998, test_f1: 0.4214
 epoch: 84, train_loss: 1.0311, test_loss: 1.1067, test_f1: 0.4182
 epoch: 85, train_loss: 1.0410, test_loss: 1.1013, test_f1: 0.4435
 epoch: 86, train_loss: 1.0443, test_loss: 1.0928, test_f1: 0.4443
 epoch: 87, train_loss: 1.0344, test_loss: 1.0979, test_f1: 0.4365
 epoch: 88, train_loss: 1.0314, test_loss: 1.0970, test_f1: 0.4512
 epoch: 89, train_loss: 1.0431, test_loss: 1.1013, test_f1: 0.4352
 epoch: 90, train_loss: 1.0277, test_loss: 1.0974, test_f1: 0.4378
 epoch: 91, train_loss: 1.0346, test_loss: 1.0960, test_f1: 0.4248
 epoch: 92, train_loss: 1.0330, test_loss: 1.1015, test_f1: 0.4438
 epoch: 93, train_loss: 1.0271, test_loss: 1.1006, test_f1: 0.4402
 epoch: 94, train_loss: 1.0286, test_loss: 1.0988, test_f1: 0.4431
 epoch: 95, train_loss: 1.0301, test_loss: 1.0938, test_f1: 0.4481
 epoch: 96, train_loss: 1.0224, test_loss: 1.0941, test_f1: 0.4645
 epoch: 97, train_loss: 1.0233, test_loss: 1.0916, test_f1: 0.4384
 epoch: 98, train_loss: 1.0275, test_loss: 1.0947, test_f1: 0.4383
 epoch: 99, train_loss: 1.0357, test_loss: 1.0933, test_f1: 0.4314
##################ITERATION #6 ****************************************
 epoch: 0, train_loss: 1.2756, test_loss: 1.3317, test_f1: 0.2281
 epoch: 1, train_loss: 1.2545, test_loss: 1.3101, test_f1: 0.2281
 epoch: 2, train_loss: 1.2452, test_loss: 1.3091, test_f1: 0.2281
 epoch: 3, train_loss: 1.2303, test_loss: 1.3060, test_f1: 0.2281
 epoch: 4, train_loss: 1.2124, test_loss: 1.2840, test_f1: 0.2281
 epoch: 5, train_loss: 1.2068, test_loss: 1.2715, test_f1: 0.2281
 epoch: 6, train_loss: 1.2010, test_loss: 1.2609, test_f1: 0.2281
 epoch: 7, train_loss: 1.1923, test_loss: 1.2554, test_f1: 0.2281
 epoch: 8, train_loss: 1.1903, test_loss: 1.2489, test_f1: 0.2285
 epoch: 9, train_loss: 1.1872, test_loss: 1.2404, test_f1: 0.2281
 epoch: 10, train_loss: 1.1777, test_loss: 1.2449, test_f1: 0.2285
 epoch: 11, train_loss: 1.1697, test_loss: 1.2453, test_f1: 0.2285
 epoch: 12, train_loss: 1.1693, test_loss: 1.2363, test_f1: 0.2340
 epoch: 13, train_loss: 1.1595, test_loss: 1.2365, test_f1: 0.2340
 epoch: 14, train_loss: 1.1539, test_loss: 1.2329, test_f1: 0.2394
 epoch: 15, train_loss: 1.1508, test_loss: 1.2268, test_f1: 0.2394
 epoch: 16, train_loss: 1.1459, test_loss: 1.2207, test_f1: 0.2449
 epoch: 17, train_loss: 1.1403, test_loss: 1.2198, test_f1: 0.2506
 epoch: 18, train_loss: 1.1330, test_loss: 1.2199, test_f1: 0.2484
 epoch: 19, train_loss: 1.1349, test_loss: 1.2159, test_f1: 0.2468
 epoch: 20, train_loss: 1.1329, test_loss: 1.2100, test_f1: 0.2553
 epoch: 21, train_loss: 1.1213, test_loss: 1.2034, test_f1: 0.3209
 epoch: 22, train_loss: 1.1245, test_loss: 1.2008, test_f1: 0.3327
 epoch: 23, train_loss: 1.1252, test_loss: 1.2040, test_f1: 0.3419
 epoch: 24, train_loss: 1.1191, test_loss: 1.1915, test_f1: 0.3453
 epoch: 25, train_loss: 1.1104, test_loss: 1.1829, test_f1: 0.3436
 epoch: 26, train_loss: 1.1110, test_loss: 1.1853, test_f1: 0.3530
 epoch: 27, train_loss: 1.1112, test_loss: 1.1828, test_f1: 0.3668
 epoch: 28, train_loss: 1.1066, test_loss: 1.1681, test_f1: 0.3733
 epoch: 29, train_loss: 1.1033, test_loss: 1.1788, test_f1: 0.3752
 epoch: 30, train_loss: 1.0953, test_loss: 1.1724, test_f1: 0.3848
 epoch: 31, train_loss: 1.0996, test_loss: 1.1693, test_f1: 0.4039
 epoch: 32, train_loss: 1.0976, test_loss: 1.1709, test_f1: 0.4077
 epoch: 33, train_loss: 1.0934, test_loss: 1.1584, test_f1: 0.3834
 epoch: 34, train_loss: 1.0960, test_loss: 1.1544, test_f1: 0.3952
 epoch: 35, train_loss: 1.0924, test_loss: 1.1615, test_f1: 0.4043
 epoch: 36, train_loss: 1.0877, test_loss: 1.1635, test_f1: 0.3848
 epoch: 37, train_loss: 1.0757, test_loss: 1.1572, test_f1: 0.3858
 epoch: 38, train_loss: 1.0836, test_loss: 1.1521, test_f1: 0.3962
 epoch: 39, train_loss: 1.0797, test_loss: 1.1560, test_f1: 0.4228
 epoch: 40, train_loss: 1.0779, test_loss: 1.1518, test_f1: 0.3962
 epoch: 41, train_loss: 1.0731, test_loss: 1.1563, test_f1: 0.4161
 epoch: 42, train_loss: 1.0728, test_loss: 1.1575, test_f1: 0.4177
 epoch: 43, train_loss: 1.0656, test_loss: 1.1470, test_f1: 0.4097
 epoch: 44, train_loss: 1.0717, test_loss: 1.1422, test_f1: 0.4345
 epoch: 45, train_loss: 1.0667, test_loss: 1.1467, test_f1: 0.4427
 epoch: 46, train_loss: 1.0668, test_loss: 1.1476, test_f1: 0.4167
 epoch: 47, train_loss: 1.0780, test_loss: 1.1571, test_f1: 0.4245
 epoch: 48, train_loss: 1.0686, test_loss: 1.1545, test_f1: 0.3982
 epoch: 49, train_loss: 1.0650, test_loss: 1.1483, test_f1: 0.3964
 epoch: 50, train_loss: 1.0540, test_loss: 1.1441, test_f1: 0.3927
 epoch: 51, train_loss: 1.0605, test_loss: 1.1409, test_f1: 0.4020
 epoch: 52, train_loss: 1.0560, test_loss: 1.1508, test_f1: 0.4020
 epoch: 53, train_loss: 1.0434, test_loss: 1.1459, test_f1: 0.4185
 epoch: 54, train_loss: 1.0459, test_loss: 1.1446, test_f1: 0.3969
 epoch: 55, train_loss: 1.0532, test_loss: 1.1434, test_f1: 0.4083
 epoch: 56, train_loss: 1.0519, test_loss: 1.1428, test_f1: 0.4310
 epoch: 57, train_loss: 1.0478, test_loss: 1.1509, test_f1: 0.4481
 epoch: 58, train_loss: 1.0497, test_loss: 1.1458, test_f1: 0.4170
 epoch: 59, train_loss: 1.0494, test_loss: 1.1351, test_f1: 0.4137
 epoch: 60, train_loss: 1.0553, test_loss: 1.1351, test_f1: 0.4315
 epoch: 61, train_loss: 1.0546, test_loss: 1.1379, test_f1: 0.4342
 epoch: 62, train_loss: 1.0446, test_loss: 1.1376, test_f1: 0.4285
 epoch: 63, train_loss: 1.0517, test_loss: 1.1480, test_f1: 0.4219
 epoch: 64, train_loss: 1.0368, test_loss: 1.1500, test_f1: 0.4217
 epoch: 65, train_loss: 1.0382, test_loss: 1.1411, test_f1: 0.4433
 epoch: 66, train_loss: 1.0438, test_loss: 1.1479, test_f1: 0.4433
 epoch: 67, train_loss: 1.0453, test_loss: 1.1383, test_f1: 0.4349
 epoch: 68, train_loss: 1.0506, test_loss: 1.1286, test_f1: 0.4090
 epoch: 69, train_loss: 1.0450, test_loss: 1.1338, test_f1: 0.4136
 epoch: 70, train_loss: 1.0321, test_loss: 1.1355, test_f1: 0.4427
 epoch: 71, train_loss: 1.0363, test_loss: 1.1355, test_f1: 0.4375
 epoch: 72, train_loss: 1.0314, test_loss: 1.1286, test_f1: 0.4433
 epoch: 73, train_loss: 1.0354, test_loss: 1.1249, test_f1: 0.4506
 epoch: 74, train_loss: 1.0406, test_loss: 1.1432, test_f1: 0.4463
 epoch: 75, train_loss: 1.0333, test_loss: 1.1291, test_f1: 0.4286
 epoch: 76, train_loss: 1.0408, test_loss: 1.1450, test_f1: 0.4238
 epoch: 77, train_loss: 1.0440, test_loss: 1.1318, test_f1: 0.4316
 epoch: 78, train_loss: 1.0382, test_loss: 1.1395, test_f1: 0.4337
 epoch: 79, train_loss: 1.0404, test_loss: 1.1360, test_f1: 0.4319
 epoch: 80, train_loss: 1.0231, test_loss: 1.1335, test_f1: 0.4337
 epoch: 81, train_loss: 1.0287, test_loss: 1.1267, test_f1: 0.4275
 epoch: 82, train_loss: 1.0337, test_loss: 1.1261, test_f1: 0.4273
 epoch: 83, train_loss: 1.0235, test_loss: 1.1184, test_f1: 0.4225
 epoch: 84, train_loss: 1.0228, test_loss: 1.1315, test_f1: 0.4319
 epoch: 85, train_loss: 1.0314, test_loss: 1.1366, test_f1: 0.4386
 epoch: 86, train_loss: 1.0198, test_loss: 1.1415, test_f1: 0.4384
 epoch: 87, train_loss: 1.0307, test_loss: 1.1408, test_f1: 0.4460
 epoch: 88, train_loss: 1.0189, test_loss: 1.1373, test_f1: 0.4523
 epoch: 89, train_loss: 1.0253, test_loss: 1.1403, test_f1: 0.4510
 epoch: 90, train_loss: 1.0256, test_loss: 1.1444, test_f1: 0.4527
 epoch: 91, train_loss: 1.0177, test_loss: 1.1363, test_f1: 0.4510
 epoch: 92, train_loss: 1.0224, test_loss: 1.1310, test_f1: 0.4569
 epoch: 93, train_loss: 1.0175, test_loss: 1.1269, test_f1: 0.4585
 epoch: 94, train_loss: 1.0271, test_loss: 1.1249, test_f1: 0.4568
 epoch: 95, train_loss: 1.0109, test_loss: 1.1142, test_f1: 0.4591
 epoch: 96, train_loss: 1.0187, test_loss: 1.1330, test_f1: 0.4386
 epoch: 97, train_loss: 1.0122, test_loss: 1.1399, test_f1: 0.4496
 epoch: 98, train_loss: 1.0205, test_loss: 1.1369, test_f1: 0.4616
 epoch: 99, train_loss: 1.0111, test_loss: 1.1466, test_f1: 0.4579
##################ITERATION #7 ****************************************
 epoch: 0, train_loss: 1.2918, test_loss: 1.3894, test_f1: 0.2281
 epoch: 1, train_loss: 1.2477, test_loss: 1.3948, test_f1: 0.2136
 epoch: 2, train_loss: 1.2240, test_loss: 1.3988, test_f1: 0.1743
 epoch: 3, train_loss: 1.2114, test_loss: 1.3795, test_f1: 0.2279
 epoch: 4, train_loss: 1.1966, test_loss: 1.3579, test_f1: 0.2705
 epoch: 5, train_loss: 1.1877, test_loss: 1.3307, test_f1: 0.2777
 epoch: 6, train_loss: 1.1792, test_loss: 1.2731, test_f1: 0.2696
 epoch: 7, train_loss: 1.1751, test_loss: 1.2226, test_f1: 0.2582
 epoch: 8, train_loss: 1.1563, test_loss: 1.2059, test_f1: 0.2879
 epoch: 9, train_loss: 1.1542, test_loss: 1.1992, test_f1: 0.3197
 epoch: 10, train_loss: 1.1486, test_loss: 1.1961, test_f1: 0.3267
 epoch: 11, train_loss: 1.1353, test_loss: 1.1911, test_f1: 0.3299
 epoch: 12, train_loss: 1.1308, test_loss: 1.1832, test_f1: 0.3583
 epoch: 13, train_loss: 1.1233, test_loss: 1.1838, test_f1: 0.3544
 epoch: 14, train_loss: 1.1319, test_loss: 1.1744, test_f1: 0.3744
 epoch: 15, train_loss: 1.1261, test_loss: 1.1665, test_f1: 0.3833
 epoch: 16, train_loss: 1.1252, test_loss: 1.1689, test_f1: 0.3839
 epoch: 17, train_loss: 1.1148, test_loss: 1.1653, test_f1: 0.3988
 epoch: 18, train_loss: 1.1057, test_loss: 1.1630, test_f1: 0.4054
 epoch: 19, train_loss: 1.1151, test_loss: 1.1547, test_f1: 0.4053
 epoch: 20, train_loss: 1.1023, test_loss: 1.1510, test_f1: 0.4035
 epoch: 21, train_loss: 1.1012, test_loss: 1.1540, test_f1: 0.4114
 epoch: 22, train_loss: 1.1019, test_loss: 1.1489, test_f1: 0.4281
 epoch: 23, train_loss: 1.0934, test_loss: 1.1456, test_f1: 0.4121
 epoch: 24, train_loss: 1.0827, test_loss: 1.1459, test_f1: 0.4107
 epoch: 25, train_loss: 1.0868, test_loss: 1.1407, test_f1: 0.4402
 epoch: 26, train_loss: 1.0861, test_loss: 1.1426, test_f1: 0.4407
 epoch: 27, train_loss: 1.0864, test_loss: 1.1360, test_f1: 0.4443
 epoch: 28, train_loss: 1.0843, test_loss: 1.1378, test_f1: 0.4397
 epoch: 29, train_loss: 1.0790, test_loss: 1.1371, test_f1: 0.4446
 epoch: 30, train_loss: 1.0660, test_loss: 1.1320, test_f1: 0.4431
 epoch: 31, train_loss: 1.0707, test_loss: 1.1295, test_f1: 0.4429
 epoch: 32, train_loss: 1.0732, test_loss: 1.1382, test_f1: 0.4496
 epoch: 33, train_loss: 1.0723, test_loss: 1.1402, test_f1: 0.4428
 epoch: 34, train_loss: 1.0654, test_loss: 1.1371, test_f1: 0.4437
 epoch: 35, train_loss: 1.0651, test_loss: 1.1327, test_f1: 0.4398
 epoch: 36, train_loss: 1.0649, test_loss: 1.1419, test_f1: 0.4427
 epoch: 37, train_loss: 1.0668, test_loss: 1.1352, test_f1: 0.4457
 epoch: 38, train_loss: 1.0511, test_loss: 1.1243, test_f1: 0.4443
 epoch: 39, train_loss: 1.0525, test_loss: 1.1311, test_f1: 0.4448
 epoch: 40, train_loss: 1.0640, test_loss: 1.1348, test_f1: 0.4332
 epoch: 41, train_loss: 1.0488, test_loss: 1.1239, test_f1: 0.4518
 epoch: 42, train_loss: 1.0442, test_loss: 1.1244, test_f1: 0.4342
 epoch: 43, train_loss: 1.0468, test_loss: 1.1234, test_f1: 0.4310
 epoch: 44, train_loss: 1.0405, test_loss: 1.1232, test_f1: 0.4586
 epoch: 45, train_loss: 1.0396, test_loss: 1.1316, test_f1: 0.4524
 epoch: 46, train_loss: 1.0388, test_loss: 1.1294, test_f1: 0.4480
 epoch: 47, train_loss: 1.0517, test_loss: 1.1321, test_f1: 0.4534
 epoch: 48, train_loss: 1.0503, test_loss: 1.1283, test_f1: 0.4500
 epoch: 49, train_loss: 1.0364, test_loss: 1.1360, test_f1: 0.4475
 epoch: 50, train_loss: 1.0336, test_loss: 1.1294, test_f1: 0.4480
 epoch: 51, train_loss: 1.0298, test_loss: 1.1250, test_f1: 0.4417
 epoch: 52, train_loss: 1.0306, test_loss: 1.1291, test_f1: 0.4454
 epoch: 53, train_loss: 1.0384, test_loss: 1.1297, test_f1: 0.4486
 epoch: 54, train_loss: 1.0379, test_loss: 1.1274, test_f1: 0.4523
 epoch: 55, train_loss: 1.0308, test_loss: 1.1265, test_f1: 0.4480
 epoch: 56, train_loss: 1.0343, test_loss: 1.1246, test_f1: 0.4480
 epoch: 57, train_loss: 1.0244, test_loss: 1.1307, test_f1: 0.4435
 epoch: 58, train_loss: 1.0296, test_loss: 1.1280, test_f1: 0.4373
 epoch: 59, train_loss: 1.0301, test_loss: 1.1353, test_f1: 0.4492
 epoch: 60, train_loss: 1.0317, test_loss: 1.1323, test_f1: 0.4424
 epoch: 61, train_loss: 1.0298, test_loss: 1.1375, test_f1: 0.4425
 epoch: 62, train_loss: 1.0261, test_loss: 1.1293, test_f1: 0.4514
 epoch: 63, train_loss: 1.0300, test_loss: 1.1308, test_f1: 0.4505
 epoch: 64, train_loss: 1.0348, test_loss: 1.1317, test_f1: 0.4484
 epoch: 65, train_loss: 1.0232, test_loss: 1.1238, test_f1: 0.4441
 epoch: 66, train_loss: 1.0267, test_loss: 1.1248, test_f1: 0.4442
 epoch: 67, train_loss: 1.0261, test_loss: 1.1318, test_f1: 0.4462
 epoch: 68, train_loss: 1.0279, test_loss: 1.1318, test_f1: 0.4506
 epoch: 69, train_loss: 1.0279, test_loss: 1.1276, test_f1: 0.4532
 epoch: 70, train_loss: 1.0183, test_loss: 1.1344, test_f1: 0.4528
 epoch: 71, train_loss: 1.0153, test_loss: 1.1337, test_f1: 0.4512
 epoch: 72, train_loss: 1.0243, test_loss: 1.1342, test_f1: 0.4575
 epoch: 73, train_loss: 1.0255, test_loss: 1.1298, test_f1: 0.4509
 epoch: 74, train_loss: 1.0145, test_loss: 1.1348, test_f1: 0.4473
 epoch: 75, train_loss: 1.0137, test_loss: 1.1364, test_f1: 0.4458
 epoch: 76, train_loss: 1.0151, test_loss: 1.1362, test_f1: 0.4459
 epoch: 77, train_loss: 1.0203, test_loss: 1.1243, test_f1: 0.4581
 epoch: 78, train_loss: 1.0168, test_loss: 1.1248, test_f1: 0.4508
 epoch: 79, train_loss: 1.0138, test_loss: 1.1236, test_f1: 0.4516
 epoch: 80, train_loss: 1.0239, test_loss: 1.1323, test_f1: 0.4486
 epoch: 81, train_loss: 1.0245, test_loss: 1.1287, test_f1: 0.4506
 epoch: 82, train_loss: 1.0123, test_loss: 1.1271, test_f1: 0.4573
 epoch: 83, train_loss: 1.0121, test_loss: 1.1281, test_f1: 0.4607
 epoch: 84, train_loss: 1.0211, test_loss: 1.1302, test_f1: 0.4549
 epoch: 85, train_loss: 1.0157, test_loss: 1.1293, test_f1: 0.4528
 epoch: 86, train_loss: 1.0060, test_loss: 1.1246, test_f1: 0.4583
 epoch: 87, train_loss: 1.0100, test_loss: 1.1284, test_f1: 0.4596
 epoch: 88, train_loss: 1.0055, test_loss: 1.1234, test_f1: 0.4529
 epoch: 89, train_loss: 1.0153, test_loss: 1.1215, test_f1: 0.4554
 epoch: 90, train_loss: 1.0033, test_loss: 1.1290, test_f1: 0.4436
 epoch: 91, train_loss: 1.0082, test_loss: 1.1302, test_f1: 0.4529
 epoch: 92, train_loss: 1.0005, test_loss: 1.1282, test_f1: 0.4574
 epoch: 93, train_loss: 1.0022, test_loss: 1.1215, test_f1: 0.4574
 epoch: 94, train_loss: 1.0119, test_loss: 1.1256, test_f1: 0.4639
 epoch: 95, train_loss: 1.0039, test_loss: 1.1272, test_f1: 0.4599
 epoch: 96, train_loss: 1.0011, test_loss: 1.1294, test_f1: 0.4585
 epoch: 97, train_loss: 0.9973, test_loss: 1.1182, test_f1: 0.4628
 epoch: 98, train_loss: 0.9962, test_loss: 1.1290, test_f1: 0.4492
 epoch: 99, train_loss: 1.0084, test_loss: 1.1286, test_f1: 0.4596
##################ITERATION #8 ****************************************
 epoch: 0, train_loss: 1.2675, test_loss: 1.3559, test_f1: 0.2281
 epoch: 1, train_loss: 1.2461, test_loss: 1.3365, test_f1: 0.2281
 epoch: 2, train_loss: 1.2188, test_loss: 1.3294, test_f1: 0.2281
 epoch: 3, train_loss: 1.2093, test_loss: 1.3142, test_f1: 0.2281
 epoch: 4, train_loss: 1.2046, test_loss: 1.2952, test_f1: 0.2283
 epoch: 5, train_loss: 1.1902, test_loss: 1.2745, test_f1: 0.2397
 epoch: 6, train_loss: 1.1853, test_loss: 1.2473, test_f1: 0.2332
 epoch: 7, train_loss: 1.1754, test_loss: 1.2314, test_f1: 0.2447
 epoch: 8, train_loss: 1.1699, test_loss: 1.2264, test_f1: 0.2482
 epoch: 9, train_loss: 1.1625, test_loss: 1.2204, test_f1: 0.2640
 epoch: 10, train_loss: 1.1532, test_loss: 1.2132, test_f1: 0.2755
 epoch: 11, train_loss: 1.1557, test_loss: 1.2082, test_f1: 0.2787
 epoch: 12, train_loss: 1.1462, test_loss: 1.1995, test_f1: 0.2817
 epoch: 13, train_loss: 1.1406, test_loss: 1.1948, test_f1: 0.2973
 epoch: 14, train_loss: 1.1312, test_loss: 1.1884, test_f1: 0.2977
 epoch: 15, train_loss: 1.1281, test_loss: 1.1872, test_f1: 0.3058
 epoch: 16, train_loss: 1.1218, test_loss: 1.1840, test_f1: 0.3259
 epoch: 17, train_loss: 1.1130, test_loss: 1.1810, test_f1: 0.3343
 epoch: 18, train_loss: 1.1173, test_loss: 1.1737, test_f1: 0.3489
 epoch: 19, train_loss: 1.1042, test_loss: 1.1694, test_f1: 0.3654
 epoch: 20, train_loss: 1.1019, test_loss: 1.1688, test_f1: 0.3639
 epoch: 21, train_loss: 1.0984, test_loss: 1.1645, test_f1: 0.3643
 epoch: 22, train_loss: 1.1042, test_loss: 1.1615, test_f1: 0.4012
 epoch: 23, train_loss: 1.0952, test_loss: 1.1559, test_f1: 0.4030
 epoch: 24, train_loss: 1.0899, test_loss: 1.1573, test_f1: 0.4054
 epoch: 25, train_loss: 1.0949, test_loss: 1.1494, test_f1: 0.4026
 epoch: 26, train_loss: 1.0878, test_loss: 1.1487, test_f1: 0.4130
 epoch: 27, train_loss: 1.0911, test_loss: 1.1461, test_f1: 0.4107
 epoch: 28, train_loss: 1.0809, test_loss: 1.1430, test_f1: 0.4320
 epoch: 29, train_loss: 1.0861, test_loss: 1.1451, test_f1: 0.4084
 epoch: 30, train_loss: 1.0711, test_loss: 1.1428, test_f1: 0.4255
 epoch: 31, train_loss: 1.0650, test_loss: 1.1431, test_f1: 0.4351
 epoch: 32, train_loss: 1.0761, test_loss: 1.1345, test_f1: 0.4400
 epoch: 33, train_loss: 1.0727, test_loss: 1.1394, test_f1: 0.4358
 epoch: 34, train_loss: 1.0641, test_loss: 1.1458, test_f1: 0.4392
 epoch: 35, train_loss: 1.0667, test_loss: 1.1463, test_f1: 0.4300
 epoch: 36, train_loss: 1.0633, test_loss: 1.1413, test_f1: 0.4283
 epoch: 37, train_loss: 1.0647, test_loss: 1.1388, test_f1: 0.4393
 epoch: 38, train_loss: 1.0620, test_loss: 1.1348, test_f1: 0.4337
 epoch: 39, train_loss: 1.0632, test_loss: 1.1341, test_f1: 0.4438
 epoch: 40, train_loss: 1.0524, test_loss: 1.1317, test_f1: 0.4454
 epoch: 41, train_loss: 1.0543, test_loss: 1.1308, test_f1: 0.4436
 epoch: 42, train_loss: 1.0548, test_loss: 1.1283, test_f1: 0.4339
 epoch: 43, train_loss: 1.0502, test_loss: 1.1297, test_f1: 0.4421
 epoch: 44, train_loss: 1.0432, test_loss: 1.1388, test_f1: 0.4473
 epoch: 45, train_loss: 1.0464, test_loss: 1.1411, test_f1: 0.4411
 epoch: 46, train_loss: 1.0405, test_loss: 1.1315, test_f1: 0.4387
 epoch: 47, train_loss: 1.0461, test_loss: 1.1279, test_f1: 0.4441
 epoch: 48, train_loss: 1.0420, test_loss: 1.1248, test_f1: 0.4493
 epoch: 49, train_loss: 1.0494, test_loss: 1.1237, test_f1: 0.4543
 epoch: 50, train_loss: 1.0342, test_loss: 1.1137, test_f1: 0.4465
 epoch: 51, train_loss: 1.0259, test_loss: 1.1122, test_f1: 0.4389
 epoch: 52, train_loss: 1.0275, test_loss: 1.1166, test_f1: 0.4396
 epoch: 53, train_loss: 1.0314, test_loss: 1.1163, test_f1: 0.4437
 epoch: 54, train_loss: 1.0309, test_loss: 1.1137, test_f1: 0.4475
 epoch: 55, train_loss: 1.0275, test_loss: 1.1162, test_f1: 0.4535
 epoch: 56, train_loss: 1.0264, test_loss: 1.1108, test_f1: 0.4481
 epoch: 57, train_loss: 1.0166, test_loss: 1.1110, test_f1: 0.4503
 epoch: 58, train_loss: 1.0299, test_loss: 1.1019, test_f1: 0.4537
 epoch: 59, train_loss: 1.0319, test_loss: 1.1045, test_f1: 0.4459
 epoch: 60, train_loss: 1.0295, test_loss: 1.1107, test_f1: 0.4481
 epoch: 61, train_loss: 1.0257, test_loss: 1.0968, test_f1: 0.4384
 epoch: 62, train_loss: 1.0203, test_loss: 1.1050, test_f1: 0.4411
 epoch: 63, train_loss: 1.0229, test_loss: 1.1065, test_f1: 0.4501
 epoch: 64, train_loss: 1.0202, test_loss: 1.1124, test_f1: 0.4569
 epoch: 65, train_loss: 1.0239, test_loss: 1.1105, test_f1: 0.4465
 epoch: 66, train_loss: 1.0196, test_loss: 1.1041, test_f1: 0.4450
 epoch: 67, train_loss: 1.0253, test_loss: 1.0983, test_f1: 0.4475
 epoch: 68, train_loss: 1.0157, test_loss: 1.1020, test_f1: 0.4461
 epoch: 69, train_loss: 1.0194, test_loss: 1.1036, test_f1: 0.4457
 epoch: 70, train_loss: 1.0171, test_loss: 1.0997, test_f1: 0.4468
 epoch: 71, train_loss: 1.0160, test_loss: 1.0989, test_f1: 0.4601
 epoch: 72, train_loss: 1.0076, test_loss: 1.1016, test_f1: 0.4429
 epoch: 73, train_loss: 1.0138, test_loss: 1.0989, test_f1: 0.4453
 epoch: 74, train_loss: 1.0168, test_loss: 1.1028, test_f1: 0.4433
 epoch: 75, train_loss: 1.0081, test_loss: 1.0967, test_f1: 0.4483
 epoch: 76, train_loss: 1.0109, test_loss: 1.0995, test_f1: 0.4520
 epoch: 77, train_loss: 1.0143, test_loss: 1.0972, test_f1: 0.4531
 epoch: 78, train_loss: 1.0061, test_loss: 1.0878, test_f1: 0.4491
 epoch: 79, train_loss: 1.0097, test_loss: 1.0936, test_f1: 0.4520
 epoch: 80, train_loss: 1.0115, test_loss: 1.0936, test_f1: 0.4412
 epoch: 81, train_loss: 1.0107, test_loss: 1.0917, test_f1: 0.4607
 epoch: 82, train_loss: 0.9986, test_loss: 1.0942, test_f1: 0.4500
 epoch: 83, train_loss: 0.9997, test_loss: 1.1036, test_f1: 0.4410
 epoch: 84, train_loss: 1.0118, test_loss: 1.1011, test_f1: 0.4453
 epoch: 85, train_loss: 0.9964, test_loss: 1.1033, test_f1: 0.4421
 epoch: 86, train_loss: 1.0038, test_loss: 1.1034, test_f1: 0.4510
 epoch: 87, train_loss: 0.9995, test_loss: 1.0954, test_f1: 0.4577
 epoch: 88, train_loss: 1.0070, test_loss: 1.0949, test_f1: 0.4431
 epoch: 89, train_loss: 1.0025, test_loss: 1.0967, test_f1: 0.4610
 epoch: 90, train_loss: 1.0002, test_loss: 1.0912, test_f1: 0.4556
 epoch: 91, train_loss: 1.0039, test_loss: 1.0881, test_f1: 0.4556
 epoch: 92, train_loss: 0.9933, test_loss: 1.0859, test_f1: 0.4559
 epoch: 93, train_loss: 0.9898, test_loss: 1.0926, test_f1: 0.4448
 epoch: 94, train_loss: 1.0000, test_loss: 1.0925, test_f1: 0.4586
 epoch: 95, train_loss: 1.0011, test_loss: 1.0914, test_f1: 0.4403
 epoch: 96, train_loss: 0.9864, test_loss: 1.0908, test_f1: 0.4476
 epoch: 97, train_loss: 0.9879, test_loss: 1.0899, test_f1: 0.4381
 epoch: 98, train_loss: 0.9970, test_loss: 1.0956, test_f1: 0.4608
 epoch: 99, train_loss: 0.9852, test_loss: 1.0896, test_f1: 0.4607
##################ITERATION #9 ****************************************
 epoch: 0, train_loss: 1.2982, test_loss: 1.4217, test_f1: 0.0867
 epoch: 1, train_loss: 1.2307, test_loss: 1.3665, test_f1: 0.2281
 epoch: 2, train_loss: 1.2197, test_loss: 1.3413, test_f1: 0.2268
 epoch: 3, train_loss: 1.1991, test_loss: 1.3154, test_f1: 0.2396
 epoch: 4, train_loss: 1.1907, test_loss: 1.2815, test_f1: 0.3043
 epoch: 5, train_loss: 1.1816, test_loss: 1.2776, test_f1: 0.2946
 epoch: 6, train_loss: 1.1793, test_loss: 1.2567, test_f1: 0.2988
 epoch: 7, train_loss: 1.1701, test_loss: 1.2448, test_f1: 0.3027
 epoch: 8, train_loss: 1.1590, test_loss: 1.2287, test_f1: 0.3062
 epoch: 9, train_loss: 1.1499, test_loss: 1.2166, test_f1: 0.3110
 epoch: 10, train_loss: 1.1452, test_loss: 1.2128, test_f1: 0.3234
 epoch: 11, train_loss: 1.1438, test_loss: 1.2042, test_f1: 0.3236
 epoch: 12, train_loss: 1.1424, test_loss: 1.2003, test_f1: 0.3147
 epoch: 13, train_loss: 1.1356, test_loss: 1.1975, test_f1: 0.3215
 epoch: 14, train_loss: 1.1308, test_loss: 1.1961, test_f1: 0.3265
 epoch: 15, train_loss: 1.1286, test_loss: 1.1888, test_f1: 0.3235
 epoch: 16, train_loss: 1.1245, test_loss: 1.1918, test_f1: 0.3322
 epoch: 17, train_loss: 1.1184, test_loss: 1.1905, test_f1: 0.3341
 epoch: 18, train_loss: 1.1100, test_loss: 1.1788, test_f1: 0.3275
 epoch: 19, train_loss: 1.1093, test_loss: 1.1789, test_f1: 0.3399
 epoch: 20, train_loss: 1.1153, test_loss: 1.1825, test_f1: 0.3315
 epoch: 21, train_loss: 1.0995, test_loss: 1.1818, test_f1: 0.3466
 epoch: 22, train_loss: 1.1110, test_loss: 1.1773, test_f1: 0.3609
 epoch: 23, train_loss: 1.1052, test_loss: 1.1752, test_f1: 0.3602
 epoch: 24, train_loss: 1.0982, test_loss: 1.1677, test_f1: 0.3532
 epoch: 25, train_loss: 1.0882, test_loss: 1.1649, test_f1: 0.3677
 epoch: 26, train_loss: 1.0928, test_loss: 1.1671, test_f1: 0.3619
 epoch: 27, train_loss: 1.0949, test_loss: 1.1653, test_f1: 0.3558
 epoch: 28, train_loss: 1.0839, test_loss: 1.1628, test_f1: 0.3696
 epoch: 29, train_loss: 1.0834, test_loss: 1.1637, test_f1: 0.3602
 epoch: 30, train_loss: 1.0831, test_loss: 1.1663, test_f1: 0.3613
 epoch: 31, train_loss: 1.0774, test_loss: 1.1664, test_f1: 0.3666
 epoch: 32, train_loss: 1.0845, test_loss: 1.1660, test_f1: 0.3576
 epoch: 33, train_loss: 1.0770, test_loss: 1.1671, test_f1: 0.3681
 epoch: 34, train_loss: 1.0796, test_loss: 1.1616, test_f1: 0.3570
 epoch: 35, train_loss: 1.0824, test_loss: 1.1612, test_f1: 0.3659
 epoch: 36, train_loss: 1.0683, test_loss: 1.1613, test_f1: 0.3725
 epoch: 37, train_loss: 1.0655, test_loss: 1.1645, test_f1: 0.3942
 epoch: 38, train_loss: 1.0643, test_loss: 1.1661, test_f1: 0.4078
 epoch: 39, train_loss: 1.0678, test_loss: 1.1593, test_f1: 0.4215
 epoch: 40, train_loss: 1.0648, test_loss: 1.1616, test_f1: 0.4103
 epoch: 41, train_loss: 1.0586, test_loss: 1.1604, test_f1: 0.3918
 epoch: 42, train_loss: 1.0608, test_loss: 1.1599, test_f1: 0.4137
 epoch: 43, train_loss: 1.0608, test_loss: 1.1552, test_f1: 0.4163
 epoch: 44, train_loss: 1.0561, test_loss: 1.1467, test_f1: 0.4081
 epoch: 45, train_loss: 1.0661, test_loss: 1.1511, test_f1: 0.4183
 epoch: 46, train_loss: 1.0475, test_loss: 1.1496, test_f1: 0.4170
 epoch: 47, train_loss: 1.0575, test_loss: 1.1493, test_f1: 0.4145
 epoch: 48, train_loss: 1.0522, test_loss: 1.1473, test_f1: 0.4252
 epoch: 49, train_loss: 1.0542, test_loss: 1.1427, test_f1: 0.4292
 epoch: 50, train_loss: 1.0507, test_loss: 1.1481, test_f1: 0.4179
 epoch: 51, train_loss: 1.0451, test_loss: 1.1489, test_f1: 0.4290
 epoch: 52, train_loss: 1.0379, test_loss: 1.1478, test_f1: 0.4298
 epoch: 53, train_loss: 1.0466, test_loss: 1.1485, test_f1: 0.4284
 epoch: 54, train_loss: 1.0502, test_loss: 1.1432, test_f1: 0.4321
 epoch: 55, train_loss: 1.0475, test_loss: 1.1439, test_f1: 0.4326
 epoch: 56, train_loss: 1.0344, test_loss: 1.1451, test_f1: 0.4318
 epoch: 57, train_loss: 1.0516, test_loss: 1.1438, test_f1: 0.4342
 epoch: 58, train_loss: 1.0467, test_loss: 1.1453, test_f1: 0.4345
 epoch: 59, train_loss: 1.0377, test_loss: 1.1412, test_f1: 0.4356
 epoch: 60, train_loss: 1.0356, test_loss: 1.1424, test_f1: 0.4265
 epoch: 61, train_loss: 1.0378, test_loss: 1.1411, test_f1: 0.4346
 epoch: 62, train_loss: 1.0297, test_loss: 1.1404, test_f1: 0.4232
 epoch: 63, train_loss: 1.0316, test_loss: 1.1463, test_f1: 0.4330
 epoch: 64, train_loss: 1.0434, test_loss: 1.1400, test_f1: 0.4313
 epoch: 65, train_loss: 1.0293, test_loss: 1.1408, test_f1: 0.4305
 epoch: 66, train_loss: 1.0338, test_loss: 1.1425, test_f1: 0.4321
 epoch: 67, train_loss: 1.0296, test_loss: 1.1439, test_f1: 0.4271
 epoch: 68, train_loss: 1.0238, test_loss: 1.1388, test_f1: 0.4291
 epoch: 69, train_loss: 1.0371, test_loss: 1.1402, test_f1: 0.4332
 epoch: 70, train_loss: 1.0266, test_loss: 1.1441, test_f1: 0.4348
 epoch: 71, train_loss: 1.0324, test_loss: 1.1447, test_f1: 0.4334
 epoch: 72, train_loss: 1.0364, test_loss: 1.1451, test_f1: 0.4310
 epoch: 73, train_loss: 1.0309, test_loss: 1.1443, test_f1: 0.4310
 epoch: 74, train_loss: 1.0209, test_loss: 1.1401, test_f1: 0.4290
 epoch: 75, train_loss: 1.0207, test_loss: 1.1391, test_f1: 0.4324
 epoch: 76, train_loss: 1.0330, test_loss: 1.1410, test_f1: 0.4259
 epoch: 77, train_loss: 1.0298, test_loss: 1.1457, test_f1: 0.4360
 epoch: 78, train_loss: 1.0269, test_loss: 1.1425, test_f1: 0.4342
 epoch: 79, train_loss: 1.0306, test_loss: 1.1440, test_f1: 0.4346
 epoch: 80, train_loss: 1.0265, test_loss: 1.1516, test_f1: 0.4545
 epoch: 81, train_loss: 1.0336, test_loss: 1.1441, test_f1: 0.4379
 epoch: 82, train_loss: 1.0248, test_loss: 1.1345, test_f1: 0.4293
 epoch: 83, train_loss: 1.0199, test_loss: 1.1355, test_f1: 0.4248
 epoch: 84, train_loss: 1.0261, test_loss: 1.1402, test_f1: 0.4327
 epoch: 85, train_loss: 1.0145, test_loss: 1.1353, test_f1: 0.4290
 epoch: 86, train_loss: 1.0223, test_loss: 1.1356, test_f1: 0.4288
 epoch: 87, train_loss: 1.0130, test_loss: 1.1332, test_f1: 0.4379
 epoch: 88, train_loss: 1.0226, test_loss: 1.1426, test_f1: 0.4380
 epoch: 89, train_loss: 1.0221, test_loss: 1.1454, test_f1: 0.4336
 epoch: 90, train_loss: 1.0171, test_loss: 1.1294, test_f1: 0.4253
 epoch: 91, train_loss: 1.0160, test_loss: 1.1357, test_f1: 0.4273
 epoch: 92, train_loss: 1.0199, test_loss: 1.1372, test_f1: 0.4301
 epoch: 93, train_loss: 1.0266, test_loss: 1.1414, test_f1: 0.4537
 epoch: 94, train_loss: 1.0045, test_loss: 1.1462, test_f1: 0.4537
 epoch: 95, train_loss: 1.0120, test_loss: 1.1437, test_f1: 0.4585
 epoch: 96, train_loss: 1.0157, test_loss: 1.1489, test_f1: 0.4483
 epoch: 97, train_loss: 1.0093, test_loss: 1.1473, test_f1: 0.4597
 epoch: 98, train_loss: 1.0193, test_loss: 1.1389, test_f1: 0.4516
 epoch: 99, train_loss: 1.0119, test_loss: 1.1356, test_f1: 0.4457

Training completed in 478.37 seconds
Best F1: 0.4832 at epoch 61
Mean F1 across iterations: 0.4558  0.0146
========================FINAL RESULTS================================
FEGIN weighted F1: 0.4832  0.0146
python main.py --data ltspice_demos --representation component_net --model FEGIN --layers 5 --hiddens 32 --batch_size 128 --lr 0.0001 --emb_size 250 --epochs 100 --save_appendix component_net_L5_H32_BS128_LR0.0001_E250 --no_val
-----



STDERR:
  File "main.py", line 370, in <module>
    main()
  File "main.py", line 254, in main
    dataset = dataset_class(
  File "/home/philip/projects/ltspice_examples_code_repo/Circuit-Completion-Using-GNNs/component_classification_with_link_prediction_head/evaluation/FEGIN/kernel/circuit_datasets.py", line 15, in __init__
    self.data, self.slices = torch.load(self.processed_paths[0])
  File "/home/philip/.local/lib/python3.8/site-packages/torch/serialization.py", line 1040, in load
    warnings.warn(
  File "/usr/lib/python3.8/warnings.py", line 109, in _showwarnmsg
    sw(msg.message, msg.category, msg.filename, msg.lineno,
  File "main.py", line 47, in warn_with_traceback
    traceback.print_stack(file=log)
/home/philip/projects/ltspice_examples_code_repo/Circuit-Completion-Using-GNNs/component_classification_with_link_prediction_head/evaluation/FEGIN/kernel/circuit_datasets.py:15: FutureWarning: You are using `torch.load` with `weights_only=False` (the current default value), which uses the default pickle module implicitly. It is possible to construct malicious pickle data which will execute arbitrary code during unpickling (See https://github.com/pytorch/pytorch/blob/main/SECURITY.md#untrusted-models for more details). In a future release, the default value for `weights_only` will be flipped to `True`. This limits the functions that could be executed during unpickling. Arbitrary objects will no longer be allowed to be loaded via this mode unless they are explicitly allowlisted by the user via `torch.serialization.add_safe_globals`. We recommend you start setting `weights_only=True` for any use case where you don't have full control of the loaded file. Please open an issue on GitHub for any issues related to this experimental feature.
  self.data, self.slices = torch.load(self.processed_paths[0])
