STDOUT:
Results will be saved in /home/philip/projects/ltspice_examples_code_repo/Circuit-Completion-Using-GNNs/component_classification_with_link_prediction_head/evaluation/FEGIN/results/model_FEGIN_dataset_ltspice_examples
Command line input: python main.py --data ltspice_examples --representation component_pin_net --model FEGIN --layers 6 --hiddens 16 --batch_size 32 --lr 0.0001 --emb_size 250 --epochs 100 --save_appendix component_pin_net_L6_H16_BS32_LR0.0001_E250 --no_val
 is saved.
-----
ltspice_examples - FEGIN
Using 6 layers, 16 hidden units, h = 2
Loading component_pin_net representation dataset
ENTERED
Training FEGIN on component_pin_net representation
Train: 3558, Test: 846
##################ITERATION #0 ****************************************
 epoch: 0, train_loss: 1.4580, test_loss: 1.4367, test_f1: 0.0793
 epoch: 1, train_loss: 1.4420, test_loss: 1.4283, test_f1: 0.0793
 epoch: 2, train_loss: 1.4331, test_loss: 1.4192, test_f1: 0.0794
 epoch: 3, train_loss: 1.4230, test_loss: 1.4081, test_f1: 0.1457
 epoch: 4, train_loss: 1.4116, test_loss: 1.3953, test_f1: 0.1925
 epoch: 5, train_loss: 1.3970, test_loss: 1.3820, test_f1: 0.2179
 epoch: 6, train_loss: 1.3787, test_loss: 1.3595, test_f1: 0.2936
 epoch: 7, train_loss: 1.3566, test_loss: 1.3292, test_f1: 0.3118
 epoch: 8, train_loss: 1.3268, test_loss: 1.3078, test_f1: 0.3329
 epoch: 9, train_loss: 1.3061, test_loss: 1.2804, test_f1: 0.2972
 epoch: 10, train_loss: 1.2853, test_loss: 1.2622, test_f1: 0.2721
 epoch: 11, train_loss: 1.2704, test_loss: 1.2464, test_f1: 0.2646
 epoch: 12, train_loss: 1.2569, test_loss: 1.2278, test_f1: 0.2497
 epoch: 13, train_loss: 1.2444, test_loss: 1.2142, test_f1: 0.3242
 epoch: 14, train_loss: 1.2323, test_loss: 1.1982, test_f1: 0.3545
 epoch: 15, train_loss: 1.2181, test_loss: 1.1850, test_f1: 0.3430
 epoch: 16, train_loss: 1.2043, test_loss: 1.1704, test_f1: 0.3415
 epoch: 17, train_loss: 1.2005, test_loss: 1.1572, test_f1: 0.3458
 epoch: 18, train_loss: 1.1808, test_loss: 1.1427, test_f1: 0.3490
 epoch: 19, train_loss: 1.1672, test_loss: 1.1246, test_f1: 0.3422
 epoch: 20, train_loss: 1.1594, test_loss: 1.1116, test_f1: 0.3460
 epoch: 21, train_loss: 1.1454, test_loss: 1.1073, test_f1: 0.3418
 epoch: 22, train_loss: 1.1421, test_loss: 1.0902, test_f1: 0.3473
 epoch: 23, train_loss: 1.1198, test_loss: 1.0842, test_f1: 0.3460
 epoch: 24, train_loss: 1.1195, test_loss: 1.0772, test_f1: 0.3460
 epoch: 25, train_loss: 1.1157, test_loss: 1.0764, test_f1: 0.3536
 epoch: 26, train_loss: 1.1039, test_loss: 1.0696, test_f1: 0.3469
 epoch: 27, train_loss: 1.0948, test_loss: 1.0690, test_f1: 0.3616
 epoch: 28, train_loss: 1.0843, test_loss: 1.0692, test_f1: 0.3636
 epoch: 29, train_loss: 1.0894, test_loss: 1.0629, test_f1: 0.3440
 epoch: 30, train_loss: 1.0790, test_loss: 1.0613, test_f1: 0.3469
 epoch: 31, train_loss: 1.0902, test_loss: 1.0523, test_f1: 0.3469
 epoch: 32, train_loss: 1.0800, test_loss: 1.0554, test_f1: 0.3459
 epoch: 33, train_loss: 1.0715, test_loss: 1.0541, test_f1: 0.3460
 epoch: 34, train_loss: 1.0717, test_loss: 1.0571, test_f1: 0.3467
 epoch: 35, train_loss: 1.0735, test_loss: 1.0606, test_f1: 0.3457
 epoch: 36, train_loss: 1.0722, test_loss: 1.0578, test_f1: 0.3460
 epoch: 37, train_loss: 1.0627, test_loss: 1.0564, test_f1: 0.3503
 epoch: 38, train_loss: 1.0654, test_loss: 1.0616, test_f1: 0.3503
 epoch: 39, train_loss: 1.0496, test_loss: 1.0565, test_f1: 0.3520
 epoch: 40, train_loss: 1.0599, test_loss: 1.0512, test_f1: 0.3517
 epoch: 41, train_loss: 1.0491, test_loss: 1.0553, test_f1: 0.3505
 epoch: 42, train_loss: 1.0502, test_loss: 1.0528, test_f1: 0.3542
 epoch: 43, train_loss: 1.0540, test_loss: 1.0564, test_f1: 0.3564
 epoch: 44, train_loss: 1.0447, test_loss: 1.0701, test_f1: 0.3643
 epoch: 45, train_loss: 1.0409, test_loss: 1.0432, test_f1: 0.3838
 epoch: 46, train_loss: 1.0423, test_loss: 1.0587, test_f1: 0.3639
 epoch: 47, train_loss: 1.0414, test_loss: 1.0470, test_f1: 0.3700
 epoch: 48, train_loss: 1.0413, test_loss: 1.0571, test_f1: 0.3877
 epoch: 49, train_loss: 1.0371, test_loss: 1.0270, test_f1: 0.3767
 epoch: 50, train_loss: 1.0305, test_loss: 1.0349, test_f1: 0.4024
 epoch: 51, train_loss: 1.0248, test_loss: 1.0442, test_f1: 0.4023
 epoch: 52, train_loss: 1.0279, test_loss: 1.0409, test_f1: 0.3929
 epoch: 53, train_loss: 1.0286, test_loss: 1.0438, test_f1: 0.3990
 epoch: 54, train_loss: 1.0269, test_loss: 1.0285, test_f1: 0.4027
 epoch: 55, train_loss: 1.0223, test_loss: 1.0363, test_f1: 0.4174
 epoch: 56, train_loss: 1.0222, test_loss: 1.0236, test_f1: 0.4176
 epoch: 57, train_loss: 1.0280, test_loss: 1.0378, test_f1: 0.4136
 epoch: 58, train_loss: 1.0249, test_loss: 1.0219, test_f1: 0.4191
 epoch: 59, train_loss: 1.0224, test_loss: 1.0255, test_f1: 0.4182
 epoch: 60, train_loss: 1.0272, test_loss: 1.0300, test_f1: 0.4284
 epoch: 61, train_loss: 1.0243, test_loss: 1.0146, test_f1: 0.4295
 epoch: 62, train_loss: 1.0216, test_loss: 1.0261, test_f1: 0.4182
 epoch: 63, train_loss: 1.0182, test_loss: 1.0599, test_f1: 0.4307
 epoch: 64, train_loss: 1.0212, test_loss: 1.0403, test_f1: 0.4414
 epoch: 65, train_loss: 1.0134, test_loss: 1.0283, test_f1: 0.4329
 epoch: 66, train_loss: 1.0151, test_loss: 1.0579, test_f1: 0.4390
 epoch: 67, train_loss: 1.0202, test_loss: 1.0209, test_f1: 0.4368
 epoch: 68, train_loss: 1.0151, test_loss: 1.0227, test_f1: 0.4257
 epoch: 69, train_loss: 1.0184, test_loss: 1.0347, test_f1: 0.4478
 epoch: 70, train_loss: 1.0189, test_loss: 1.0398, test_f1: 0.4483
 epoch: 71, train_loss: 1.0073, test_loss: 1.0120, test_f1: 0.4223
 epoch: 72, train_loss: 1.0132, test_loss: 1.0060, test_f1: 0.4366
 epoch: 73, train_loss: 1.0130, test_loss: 1.0185, test_f1: 0.4364
 epoch: 74, train_loss: 1.0121, test_loss: 1.0351, test_f1: 0.4366
 epoch: 75, train_loss: 1.0127, test_loss: 1.0225, test_f1: 0.4531
 epoch: 76, train_loss: 1.0123, test_loss: 1.0453, test_f1: 0.4504
 epoch: 77, train_loss: 1.0068, test_loss: 1.0284, test_f1: 0.4434
 epoch: 78, train_loss: 1.0077, test_loss: 1.0222, test_f1: 0.4594
 epoch: 79, train_loss: 1.0041, test_loss: 1.0361, test_f1: 0.4576
 epoch: 80, train_loss: 1.0111, test_loss: 1.0343, test_f1: 0.4538
 epoch: 81, train_loss: 1.0054, test_loss: 1.0289, test_f1: 0.4547
 epoch: 82, train_loss: 1.0079, test_loss: 1.0289, test_f1: 0.4588
 epoch: 83, train_loss: 1.0066, test_loss: 1.0313, test_f1: 0.4597
 epoch: 84, train_loss: 1.0042, test_loss: 1.0600, test_f1: 0.4557
 epoch: 85, train_loss: 1.0040, test_loss: 1.0141, test_f1: 0.4601
 epoch: 86, train_loss: 1.0013, test_loss: 1.0221, test_f1: 0.4581
 epoch: 87, train_loss: 1.0001, test_loss: 1.0194, test_f1: 0.4603
 epoch: 88, train_loss: 0.9954, test_loss: 1.0117, test_f1: 0.4613
 epoch: 89, train_loss: 0.9999, test_loss: 1.0111, test_f1: 0.4654
 epoch: 90, train_loss: 0.9996, test_loss: 1.0221, test_f1: 0.4642
 epoch: 91, train_loss: 0.9960, test_loss: 1.0440, test_f1: 0.4578
 epoch: 92, train_loss: 0.9934, test_loss: 1.0611, test_f1: 0.4574
 epoch: 93, train_loss: 0.9846, test_loss: 1.0208, test_f1: 0.4677
 epoch: 94, train_loss: 0.9937, test_loss: 1.0272, test_f1: 0.4629
 epoch: 95, train_loss: 0.9924, test_loss: 1.0105, test_f1: 0.4641
 epoch: 96, train_loss: 0.9963, test_loss: 1.0086, test_f1: 0.4627
 epoch: 97, train_loss: 0.9889, test_loss: 1.0042, test_f1: 0.4559
 epoch: 98, train_loss: 0.9980, test_loss: 1.0106, test_f1: 0.4611
 epoch: 99, train_loss: 0.9925, test_loss: 1.0116, test_f1: 0.4621
##################ITERATION #1 ****************************************
 epoch: 0, train_loss: 1.3602, test_loss: 1.3508, test_f1: 0.2689
 epoch: 1, train_loss: 1.3455, test_loss: 1.3397, test_f1: 0.2279
 epoch: 2, train_loss: 1.3324, test_loss: 1.3255, test_f1: 0.2270
 epoch: 3, train_loss: 1.3144, test_loss: 1.3041, test_f1: 0.2270
 epoch: 4, train_loss: 1.2937, test_loss: 1.2760, test_f1: 0.2270
 epoch: 5, train_loss: 1.2717, test_loss: 1.2453, test_f1: 0.2368
 epoch: 6, train_loss: 1.2431, test_loss: 1.2117, test_f1: 0.3413
 epoch: 7, train_loss: 1.2140, test_loss: 1.1704, test_f1: 0.3422
 epoch: 8, train_loss: 1.1942, test_loss: 1.1557, test_f1: 0.3429
 epoch: 9, train_loss: 1.1690, test_loss: 1.1249, test_f1: 0.3429
 epoch: 10, train_loss: 1.1552, test_loss: 1.1187, test_f1: 0.3371
 epoch: 11, train_loss: 1.1260, test_loss: 1.0996, test_f1: 0.3417
 epoch: 12, train_loss: 1.1216, test_loss: 1.0929, test_f1: 0.3393
 epoch: 13, train_loss: 1.1082, test_loss: 1.0843, test_f1: 0.3414
 epoch: 14, train_loss: 1.0952, test_loss: 1.0804, test_f1: 0.3350
 epoch: 15, train_loss: 1.0925, test_loss: 1.0767, test_f1: 0.3374
 epoch: 16, train_loss: 1.0898, test_loss: 1.0682, test_f1: 0.3419
 epoch: 17, train_loss: 1.0789, test_loss: 1.0670, test_f1: 0.3411
 epoch: 18, train_loss: 1.0711, test_loss: 1.0614, test_f1: 0.3378
 epoch: 19, train_loss: 1.0735, test_loss: 1.0551, test_f1: 0.3388
 epoch: 20, train_loss: 1.0678, test_loss: 1.0445, test_f1: 0.3440
 epoch: 21, train_loss: 1.0576, test_loss: 1.0485, test_f1: 0.3440
 epoch: 22, train_loss: 1.0574, test_loss: 1.0418, test_f1: 0.3475
 epoch: 23, train_loss: 1.0450, test_loss: 1.0371, test_f1: 0.3620
 epoch: 24, train_loss: 1.0468, test_loss: 1.0280, test_f1: 0.3861
 epoch: 25, train_loss: 1.0477, test_loss: 1.0310, test_f1: 0.3893
 epoch: 26, train_loss: 1.0359, test_loss: 1.0229, test_f1: 0.4166
 epoch: 27, train_loss: 1.0284, test_loss: 1.0235, test_f1: 0.4060
 epoch: 28, train_loss: 1.0285, test_loss: 1.0101, test_f1: 0.4212
 epoch: 29, train_loss: 1.0268, test_loss: 1.0133, test_f1: 0.4416
 epoch: 30, train_loss: 1.0244, test_loss: 1.0199, test_f1: 0.4565
 epoch: 31, train_loss: 1.0194, test_loss: 1.0059, test_f1: 0.4275
 epoch: 32, train_loss: 1.0183, test_loss: 1.0037, test_f1: 0.4667
 epoch: 33, train_loss: 1.0226, test_loss: 1.0004, test_f1: 0.4741
 epoch: 34, train_loss: 1.0019, test_loss: 0.9980, test_f1: 0.4629
 epoch: 35, train_loss: 1.0139, test_loss: 1.0093, test_f1: 0.4627
 epoch: 36, train_loss: 1.0130, test_loss: 0.9970, test_f1: 0.4709
 epoch: 37, train_loss: 1.0092, test_loss: 0.9818, test_f1: 0.4867
 epoch: 38, train_loss: 0.9948, test_loss: 0.9877, test_f1: 0.4785
 epoch: 39, train_loss: 1.0060, test_loss: 0.9884, test_f1: 0.4767
 epoch: 40, train_loss: 0.9971, test_loss: 0.9721, test_f1: 0.4766
 epoch: 41, train_loss: 0.9935, test_loss: 0.9810, test_f1: 0.4778
 epoch: 42, train_loss: 0.9973, test_loss: 0.9762, test_f1: 0.4897
 epoch: 43, train_loss: 0.9781, test_loss: 0.9772, test_f1: 0.4930
 epoch: 44, train_loss: 0.9882, test_loss: 0.9671, test_f1: 0.4897
 epoch: 45, train_loss: 0.9834, test_loss: 0.9749, test_f1: 0.4679
 epoch: 46, train_loss: 0.9835, test_loss: 0.9746, test_f1: 0.4728
 epoch: 47, train_loss: 0.9868, test_loss: 0.9651, test_f1: 0.4753
 epoch: 48, train_loss: 0.9872, test_loss: 0.9794, test_f1: 0.4877
 epoch: 49, train_loss: 0.9746, test_loss: 0.9581, test_f1: 0.4989
 epoch: 50, train_loss: 0.9776, test_loss: 0.9675, test_f1: 0.4824
 epoch: 51, train_loss: 0.9657, test_loss: 0.9597, test_f1: 0.4846
 epoch: 52, train_loss: 0.9730, test_loss: 0.9678, test_f1: 0.4857
 epoch: 53, train_loss: 0.9798, test_loss: 0.9671, test_f1: 0.4913
 epoch: 54, train_loss: 0.9607, test_loss: 0.9755, test_f1: 0.4812
 epoch: 55, train_loss: 0.9671, test_loss: 0.9625, test_f1: 0.4842
 epoch: 56, train_loss: 0.9649, test_loss: 0.9602, test_f1: 0.4829
 epoch: 57, train_loss: 0.9630, test_loss: 0.9568, test_f1: 0.4954
 epoch: 58, train_loss: 0.9717, test_loss: 0.9615, test_f1: 0.4755
 epoch: 59, train_loss: 0.9720, test_loss: 0.9616, test_f1: 0.4964
 epoch: 60, train_loss: 0.9693, test_loss: 0.9556, test_f1: 0.4949
 epoch: 61, train_loss: 0.9594, test_loss: 0.9520, test_f1: 0.4891
 epoch: 62, train_loss: 0.9591, test_loss: 0.9494, test_f1: 0.4927
 epoch: 63, train_loss: 0.9703, test_loss: 0.9468, test_f1: 0.4859
 epoch: 64, train_loss: 0.9610, test_loss: 0.9515, test_f1: 0.4865
 epoch: 65, train_loss: 0.9589, test_loss: 0.9423, test_f1: 0.4873
 epoch: 66, train_loss: 0.9635, test_loss: 0.9423, test_f1: 0.4855
 epoch: 67, train_loss: 0.9515, test_loss: 0.9430, test_f1: 0.4759
 epoch: 68, train_loss: 0.9577, test_loss: 0.9370, test_f1: 0.4968
 epoch: 69, train_loss: 0.9562, test_loss: 0.9373, test_f1: 0.4962
 epoch: 70, train_loss: 0.9557, test_loss: 0.9446, test_f1: 0.4915
 epoch: 71, train_loss: 0.9640, test_loss: 0.9456, test_f1: 0.4969
 epoch: 72, train_loss: 0.9560, test_loss: 0.9568, test_f1: 0.4862
 epoch: 73, train_loss: 0.9572, test_loss: 0.9494, test_f1: 0.4895
 epoch: 74, train_loss: 0.9524, test_loss: 0.9436, test_f1: 0.4887
 epoch: 75, train_loss: 0.9515, test_loss: 0.9543, test_f1: 0.5017
 epoch: 76, train_loss: 0.9586, test_loss: 0.9317, test_f1: 0.4932
 epoch: 77, train_loss: 0.9449, test_loss: 0.9448, test_f1: 0.4919
 epoch: 78, train_loss: 0.9495, test_loss: 0.9400, test_f1: 0.4948
 epoch: 79, train_loss: 0.9494, test_loss: 0.9364, test_f1: 0.4957
 epoch: 80, train_loss: 0.9471, test_loss: 0.9477, test_f1: 0.4800
 epoch: 81, train_loss: 0.9546, test_loss: 0.9281, test_f1: 0.5121
 epoch: 82, train_loss: 0.9428, test_loss: 0.9358, test_f1: 0.4968
 epoch: 83, train_loss: 0.9560, test_loss: 0.9364, test_f1: 0.4837
 epoch: 84, train_loss: 0.9518, test_loss: 0.9369, test_f1: 0.4929
 epoch: 85, train_loss: 0.9552, test_loss: 0.9190, test_f1: 0.4996
 epoch: 86, train_loss: 0.9527, test_loss: 0.9354, test_f1: 0.4873
 epoch: 87, train_loss: 0.9673, test_loss: 0.9219, test_f1: 0.5082
 epoch: 88, train_loss: 0.9566, test_loss: 0.9295, test_f1: 0.4954
 epoch: 89, train_loss: 0.9355, test_loss: 0.9194, test_f1: 0.5083
 epoch: 90, train_loss: 0.9560, test_loss: 0.9242, test_f1: 0.5093
 epoch: 91, train_loss: 0.9480, test_loss: 0.9215, test_f1: 0.5135
 epoch: 92, train_loss: 0.9530, test_loss: 0.9175, test_f1: 0.5108
 epoch: 93, train_loss: 0.9463, test_loss: 0.9323, test_f1: 0.5033
 epoch: 94, train_loss: 0.9430, test_loss: 0.9145, test_f1: 0.5135
 epoch: 95, train_loss: 0.9440, test_loss: 0.9330, test_f1: 0.5035
 epoch: 96, train_loss: 0.9417, test_loss: 0.9357, test_f1: 0.4933
 epoch: 97, train_loss: 0.9404, test_loss: 0.9203, test_f1: 0.4998
 epoch: 98, train_loss: 0.9400, test_loss: 0.9179, test_f1: 0.5110
 epoch: 99, train_loss: 0.9399, test_loss: 0.9147, test_f1: 0.5088
##################ITERATION #2 ****************************************
 epoch: 0, train_loss: 1.2956, test_loss: 1.2829, test_f1: 0.2270
 epoch: 1, train_loss: 1.2770, test_loss: 1.2678, test_f1: 0.2270
 epoch: 2, train_loss: 1.2651, test_loss: 1.2566, test_f1: 0.2270
 epoch: 3, train_loss: 1.2540, test_loss: 1.2428, test_f1: 0.2270
 epoch: 4, train_loss: 1.2420, test_loss: 1.2290, test_f1: 0.2270
 epoch: 5, train_loss: 1.2264, test_loss: 1.2107, test_f1: 0.2270
 epoch: 6, train_loss: 1.2131, test_loss: 1.1908, test_f1: 0.2270
 epoch: 7, train_loss: 1.1927, test_loss: 1.1708, test_f1: 0.3014
 epoch: 8, train_loss: 1.1771, test_loss: 1.1506, test_f1: 0.3446
 epoch: 9, train_loss: 1.1588, test_loss: 1.1251, test_f1: 0.3422
 epoch: 10, train_loss: 1.1458, test_loss: 1.1074, test_f1: 0.3451
 epoch: 11, train_loss: 1.1291, test_loss: 1.0956, test_f1: 0.3350
 epoch: 12, train_loss: 1.1186, test_loss: 1.0855, test_f1: 0.3438
 epoch: 13, train_loss: 1.1144, test_loss: 1.0834, test_f1: 0.3357
 epoch: 14, train_loss: 1.0976, test_loss: 1.0695, test_f1: 0.3428
 epoch: 15, train_loss: 1.0851, test_loss: 1.0605, test_f1: 0.3441
 epoch: 16, train_loss: 1.0904, test_loss: 1.0683, test_f1: 0.3329
 epoch: 17, train_loss: 1.0840, test_loss: 1.0608, test_f1: 0.3395
 epoch: 18, train_loss: 1.0694, test_loss: 1.0609, test_f1: 0.3527
 epoch: 19, train_loss: 1.0767, test_loss: 1.0586, test_f1: 0.3484
 epoch: 20, train_loss: 1.0773, test_loss: 1.0566, test_f1: 0.3664
 epoch: 21, train_loss: 1.0651, test_loss: 1.0527, test_f1: 0.3792
 epoch: 22, train_loss: 1.0625, test_loss: 1.0657, test_f1: 0.3525
 epoch: 23, train_loss: 1.0585, test_loss: 1.0560, test_f1: 0.3799
 epoch: 24, train_loss: 1.0492, test_loss: 1.0645, test_f1: 0.3691
 epoch: 25, train_loss: 1.0498, test_loss: 1.0583, test_f1: 0.3793
 epoch: 26, train_loss: 1.0460, test_loss: 1.0582, test_f1: 0.3945
 epoch: 27, train_loss: 1.0447, test_loss: 1.0549, test_f1: 0.4036
 epoch: 28, train_loss: 1.0436, test_loss: 1.0637, test_f1: 0.4144
 epoch: 29, train_loss: 1.0428, test_loss: 1.0509, test_f1: 0.4002
 epoch: 30, train_loss: 1.0443, test_loss: 1.0550, test_f1: 0.3985
 epoch: 31, train_loss: 1.0417, test_loss: 1.0335, test_f1: 0.4271
 epoch: 32, train_loss: 1.0346, test_loss: 1.0498, test_f1: 0.4248
 epoch: 33, train_loss: 1.0332, test_loss: 1.0402, test_f1: 0.4350
 epoch: 34, train_loss: 1.0315, test_loss: 1.0423, test_f1: 0.4320
 epoch: 35, train_loss: 1.0255, test_loss: 1.0496, test_f1: 0.4258
 epoch: 36, train_loss: 1.0277, test_loss: 1.0537, test_f1: 0.4293
 epoch: 37, train_loss: 1.0206, test_loss: 1.0387, test_f1: 0.4491
 epoch: 38, train_loss: 1.0215, test_loss: 1.0403, test_f1: 0.4366
 epoch: 39, train_loss: 1.0124, test_loss: 1.0428, test_f1: 0.4558
 epoch: 40, train_loss: 1.0242, test_loss: 1.0495, test_f1: 0.4447
 epoch: 41, train_loss: 1.0145, test_loss: 1.0462, test_f1: 0.4614
 epoch: 42, train_loss: 1.0145, test_loss: 1.0388, test_f1: 0.4631
 epoch: 43, train_loss: 1.0043, test_loss: 1.0333, test_f1: 0.4753
 epoch: 44, train_loss: 1.0039, test_loss: 1.0467, test_f1: 0.4691
 epoch: 45, train_loss: 1.0092, test_loss: 1.0362, test_f1: 0.4687
 epoch: 46, train_loss: 1.0037, test_loss: 1.0148, test_f1: 0.4754
 epoch: 47, train_loss: 1.0029, test_loss: 1.0505, test_f1: 0.4645
 epoch: 48, train_loss: 0.9923, test_loss: 1.0418, test_f1: 0.4670
 epoch: 49, train_loss: 0.9964, test_loss: 1.0145, test_f1: 0.4911
 epoch: 50, train_loss: 0.9885, test_loss: 1.0550, test_f1: 0.4591
 epoch: 51, train_loss: 0.9961, test_loss: 1.0281, test_f1: 0.4699
 epoch: 52, train_loss: 0.9894, test_loss: 1.0119, test_f1: 0.4913
 epoch: 53, train_loss: 0.9798, test_loss: 1.0245, test_f1: 0.4749
 epoch: 54, train_loss: 0.9943, test_loss: 1.0191, test_f1: 0.4890
 epoch: 55, train_loss: 0.9722, test_loss: 1.0224, test_f1: 0.4871
 epoch: 56, train_loss: 0.9859, test_loss: 1.0257, test_f1: 0.4750
 epoch: 57, train_loss: 0.9917, test_loss: 1.0188, test_f1: 0.4925
 epoch: 58, train_loss: 0.9815, test_loss: 1.0560, test_f1: 0.4582
 epoch: 59, train_loss: 0.9786, test_loss: 1.0184, test_f1: 0.4846
 epoch: 60, train_loss: 0.9825, test_loss: 1.0660, test_f1: 0.4677
 epoch: 61, train_loss: 0.9740, test_loss: 1.0428, test_f1: 0.4792
 epoch: 62, train_loss: 0.9762, test_loss: 1.0525, test_f1: 0.4720
 epoch: 63, train_loss: 0.9810, test_loss: 1.0495, test_f1: 0.4695
 epoch: 64, train_loss: 0.9729, test_loss: 1.0243, test_f1: 0.4758
 epoch: 65, train_loss: 0.9809, test_loss: 1.0258, test_f1: 0.4701
 epoch: 66, train_loss: 0.9837, test_loss: 1.0104, test_f1: 0.4913
 epoch: 67, train_loss: 0.9750, test_loss: 1.0280, test_f1: 0.4827
 epoch: 68, train_loss: 0.9712, test_loss: 1.0286, test_f1: 0.4800
 epoch: 69, train_loss: 0.9760, test_loss: 1.0174, test_f1: 0.4913
 epoch: 70, train_loss: 0.9739, test_loss: 1.0199, test_f1: 0.4813
 epoch: 71, train_loss: 0.9698, test_loss: 1.0365, test_f1: 0.4648
 epoch: 72, train_loss: 0.9719, test_loss: 1.0154, test_f1: 0.4945
 epoch: 73, train_loss: 0.9777, test_loss: 0.9976, test_f1: 0.4947
 epoch: 74, train_loss: 0.9819, test_loss: 1.0138, test_f1: 0.4877
 epoch: 75, train_loss: 0.9691, test_loss: 1.0193, test_f1: 0.4928
 epoch: 76, train_loss: 0.9686, test_loss: 1.0586, test_f1: 0.4667
 epoch: 77, train_loss: 0.9676, test_loss: 1.0295, test_f1: 0.4816
 epoch: 78, train_loss: 0.9648, test_loss: 1.0205, test_f1: 0.4856
 epoch: 79, train_loss: 0.9818, test_loss: 1.0212, test_f1: 0.4929
 epoch: 80, train_loss: 0.9843, test_loss: 1.0223, test_f1: 0.4824
 epoch: 81, train_loss: 0.9759, test_loss: 1.0373, test_f1: 0.4749
 epoch: 82, train_loss: 0.9731, test_loss: 1.0145, test_f1: 0.4922
 epoch: 83, train_loss: 0.9629, test_loss: 1.0121, test_f1: 0.4927
 epoch: 84, train_loss: 0.9632, test_loss: 0.9928, test_f1: 0.5041
 epoch: 85, train_loss: 0.9681, test_loss: 1.0074, test_f1: 0.4944
 epoch: 86, train_loss: 0.9630, test_loss: 1.0016, test_f1: 0.4968
 epoch: 87, train_loss: 0.9692, test_loss: 1.0091, test_f1: 0.4952
 epoch: 88, train_loss: 0.9620, test_loss: 1.0248, test_f1: 0.4822
 epoch: 89, train_loss: 0.9602, test_loss: 1.0258, test_f1: 0.4774
 epoch: 90, train_loss: 0.9560, test_loss: 0.9926, test_f1: 0.4937
 epoch: 91, train_loss: 0.9654, test_loss: 1.0240, test_f1: 0.4923
 epoch: 92, train_loss: 0.9607, test_loss: 1.0190, test_f1: 0.4831
 epoch: 93, train_loss: 0.9601, test_loss: 1.0023, test_f1: 0.4967
 epoch: 94, train_loss: 0.9611, test_loss: 1.0019, test_f1: 0.4791
 epoch: 95, train_loss: 0.9602, test_loss: 1.0197, test_f1: 0.4790
 epoch: 96, train_loss: 0.9612, test_loss: 1.0468, test_f1: 0.4701
 epoch: 97, train_loss: 0.9576, test_loss: 1.0089, test_f1: 0.4896
 epoch: 98, train_loss: 0.9588, test_loss: 0.9955, test_f1: 0.4971
 epoch: 99, train_loss: 0.9576, test_loss: 1.0120, test_f1: 0.4792
##################ITERATION #3 ****************************************
 epoch: 0, train_loss: 1.2875, test_loss: 1.2583, test_f1: 0.2270
 epoch: 1, train_loss: 1.2489, test_loss: 1.2204, test_f1: 0.2858
 epoch: 2, train_loss: 1.2143, test_loss: 1.1850, test_f1: 0.3313
 epoch: 3, train_loss: 1.1886, test_loss: 1.1540, test_f1: 0.3422
 epoch: 4, train_loss: 1.1707, test_loss: 1.1346, test_f1: 0.3450
 epoch: 5, train_loss: 1.1440, test_loss: 1.1208, test_f1: 0.3460
 epoch: 6, train_loss: 1.1317, test_loss: 1.1162, test_f1: 0.3450
 epoch: 7, train_loss: 1.1170, test_loss: 1.1101, test_f1: 0.3451
 epoch: 8, train_loss: 1.1120, test_loss: 1.1024, test_f1: 0.3450
 epoch: 9, train_loss: 1.1040, test_loss: 1.1093, test_f1: 0.3392
 epoch: 10, train_loss: 1.0987, test_loss: 1.0987, test_f1: 0.3440
 epoch: 11, train_loss: 1.0875, test_loss: 1.0921, test_f1: 0.3553
 epoch: 12, train_loss: 1.0807, test_loss: 1.1006, test_f1: 0.3391
 epoch: 13, train_loss: 1.0750, test_loss: 1.1020, test_f1: 0.3354
 epoch: 14, train_loss: 1.0732, test_loss: 1.0948, test_f1: 0.3506
 epoch: 15, train_loss: 1.0689, test_loss: 1.0939, test_f1: 0.3531
 epoch: 16, train_loss: 1.0590, test_loss: 1.0914, test_f1: 0.3517
 epoch: 17, train_loss: 1.0586, test_loss: 1.0859, test_f1: 0.3514
 epoch: 18, train_loss: 1.0591, test_loss: 1.0902, test_f1: 0.3438
 epoch: 19, train_loss: 1.0517, test_loss: 1.0785, test_f1: 0.3536
 epoch: 20, train_loss: 1.0414, test_loss: 1.0715, test_f1: 0.3623
 epoch: 21, train_loss: 1.0474, test_loss: 1.0739, test_f1: 0.3687
 epoch: 22, train_loss: 1.0426, test_loss: 1.0576, test_f1: 0.3825
 epoch: 23, train_loss: 1.0407, test_loss: 1.0613, test_f1: 0.3880
 epoch: 24, train_loss: 1.0390, test_loss: 1.0680, test_f1: 0.3841
 epoch: 25, train_loss: 1.0303, test_loss: 1.0599, test_f1: 0.4074
 epoch: 26, train_loss: 1.0206, test_loss: 1.0584, test_f1: 0.4033
 epoch: 27, train_loss: 1.0239, test_loss: 1.0521, test_f1: 0.4044
 epoch: 28, train_loss: 1.0214, test_loss: 1.0558, test_f1: 0.4088
 epoch: 29, train_loss: 1.0252, test_loss: 1.0570, test_f1: 0.4075
 epoch: 30, train_loss: 1.0199, test_loss: 1.0446, test_f1: 0.4395
 epoch: 31, train_loss: 1.0156, test_loss: 1.0317, test_f1: 0.4381
 epoch: 32, train_loss: 1.0112, test_loss: 1.0516, test_f1: 0.4518
 epoch: 33, train_loss: 1.0077, test_loss: 1.0569, test_f1: 0.4279
 epoch: 34, train_loss: 1.0105, test_loss: 1.0420, test_f1: 0.4399
 epoch: 35, train_loss: 0.9999, test_loss: 1.0357, test_f1: 0.4409
 epoch: 36, train_loss: 1.0037, test_loss: 1.0281, test_f1: 0.4515
 epoch: 37, train_loss: 1.0019, test_loss: 1.0232, test_f1: 0.4658
 epoch: 38, train_loss: 0.9952, test_loss: 1.0151, test_f1: 0.4740
 epoch: 39, train_loss: 0.9979, test_loss: 1.0364, test_f1: 0.4592
 epoch: 40, train_loss: 0.9984, test_loss: 1.0272, test_f1: 0.4664
 epoch: 41, train_loss: 0.9843, test_loss: 1.0368, test_f1: 0.4582
 epoch: 42, train_loss: 0.9875, test_loss: 1.0307, test_f1: 0.4763
 epoch: 43, train_loss: 0.9851, test_loss: 1.0131, test_f1: 0.4939
 epoch: 44, train_loss: 0.9838, test_loss: 1.0367, test_f1: 0.4627
 epoch: 45, train_loss: 0.9807, test_loss: 1.0098, test_f1: 0.4764
 epoch: 46, train_loss: 0.9829, test_loss: 1.0035, test_f1: 0.4890
 epoch: 47, train_loss: 0.9853, test_loss: 0.9966, test_f1: 0.4944
 epoch: 48, train_loss: 0.9721, test_loss: 0.9988, test_f1: 0.4925
 epoch: 49, train_loss: 0.9744, test_loss: 1.0171, test_f1: 0.4819
 epoch: 50, train_loss: 0.9798, test_loss: 1.0123, test_f1: 0.4785
 epoch: 51, train_loss: 0.9649, test_loss: 0.9774, test_f1: 0.4922
 epoch: 52, train_loss: 0.9745, test_loss: 0.9810, test_f1: 0.4897
 epoch: 53, train_loss: 0.9664, test_loss: 0.9937, test_f1: 0.4912
 epoch: 54, train_loss: 0.9723, test_loss: 0.9945, test_f1: 0.4809
 epoch: 55, train_loss: 0.9652, test_loss: 0.9727, test_f1: 0.4968
 epoch: 56, train_loss: 0.9586, test_loss: 0.9876, test_f1: 0.4835
 epoch: 57, train_loss: 0.9594, test_loss: 0.9791, test_f1: 0.4976
 epoch: 58, train_loss: 0.9653, test_loss: 1.0032, test_f1: 0.4848
 epoch: 59, train_loss: 0.9625, test_loss: 0.9767, test_f1: 0.4958
 epoch: 60, train_loss: 0.9672, test_loss: 0.9670, test_f1: 0.5098
 epoch: 61, train_loss: 0.9617, test_loss: 0.9687, test_f1: 0.5007
 epoch: 62, train_loss: 0.9558, test_loss: 0.9688, test_f1: 0.5001
 epoch: 63, train_loss: 0.9652, test_loss: 0.9601, test_f1: 0.4953
 epoch: 64, train_loss: 0.9525, test_loss: 0.9677, test_f1: 0.5167
 epoch: 65, train_loss: 0.9617, test_loss: 0.9739, test_f1: 0.5014
 epoch: 66, train_loss: 0.9573, test_loss: 0.9686, test_f1: 0.5044
 epoch: 67, train_loss: 0.9508, test_loss: 0.9702, test_f1: 0.5048
 epoch: 68, train_loss: 0.9523, test_loss: 0.9823, test_f1: 0.5062
 epoch: 69, train_loss: 0.9481, test_loss: 0.9461, test_f1: 0.5094
 epoch: 70, train_loss: 0.9522, test_loss: 0.9575, test_f1: 0.5017
 epoch: 71, train_loss: 0.9514, test_loss: 0.9876, test_f1: 0.4881
 epoch: 72, train_loss: 0.9553, test_loss: 0.9649, test_f1: 0.5040
 epoch: 73, train_loss: 0.9637, test_loss: 0.9690, test_f1: 0.5094
 epoch: 74, train_loss: 0.9491, test_loss: 0.9817, test_f1: 0.4923
 epoch: 75, train_loss: 0.9456, test_loss: 0.9706, test_f1: 0.5006
 epoch: 76, train_loss: 0.9490, test_loss: 0.9518, test_f1: 0.5068
 epoch: 77, train_loss: 0.9542, test_loss: 0.9528, test_f1: 0.5091
 epoch: 78, train_loss: 0.9414, test_loss: 0.9793, test_f1: 0.4971
 epoch: 79, train_loss: 0.9552, test_loss: 0.9589, test_f1: 0.5166
 epoch: 80, train_loss: 0.9516, test_loss: 0.9483, test_f1: 0.5172
 epoch: 81, train_loss: 0.9473, test_loss: 0.9940, test_f1: 0.4944
 epoch: 82, train_loss: 0.9480, test_loss: 0.9429, test_f1: 0.5138
 epoch: 83, train_loss: 0.9425, test_loss: 0.9627, test_f1: 0.5036
 epoch: 84, train_loss: 0.9483, test_loss: 0.9708, test_f1: 0.4939
 epoch: 85, train_loss: 0.9385, test_loss: 0.9526, test_f1: 0.5179
 epoch: 86, train_loss: 0.9478, test_loss: 0.9581, test_f1: 0.5179
 epoch: 87, train_loss: 0.9427, test_loss: 0.9611, test_f1: 0.4892
 epoch: 88, train_loss: 0.9360, test_loss: 0.9380, test_f1: 0.5193
 epoch: 89, train_loss: 0.9377, test_loss: 0.9446, test_f1: 0.5113
 epoch: 90, train_loss: 0.9311, test_loss: 0.9606, test_f1: 0.5114
 epoch: 91, train_loss: 0.9424, test_loss: 0.9667, test_f1: 0.5132
 epoch: 92, train_loss: 0.9380, test_loss: 0.9442, test_f1: 0.5102
 epoch: 93, train_loss: 0.9432, test_loss: 0.9232, test_f1: 0.5129
 epoch: 94, train_loss: 0.9446, test_loss: 0.9265, test_f1: 0.5179
 epoch: 95, train_loss: 0.9286, test_loss: 0.9530, test_f1: 0.5208
 epoch: 96, train_loss: 0.9254, test_loss: 0.9254, test_f1: 0.5220
 epoch: 97, train_loss: 0.9323, test_loss: 0.9259, test_f1: 0.5146
 epoch: 98, train_loss: 0.9283, test_loss: 0.9430, test_f1: 0.5179
 epoch: 99, train_loss: 0.9402, test_loss: 0.9208, test_f1: 0.5189
##################ITERATION #4 ****************************************
 epoch: 0, train_loss: 1.2806, test_loss: 1.2368, test_f1: 0.2631
 epoch: 1, train_loss: 1.2337, test_loss: 1.2084, test_f1: 0.3116
 epoch: 2, train_loss: 1.2061, test_loss: 1.1796, test_f1: 0.3407
 epoch: 3, train_loss: 1.1851, test_loss: 1.1526, test_f1: 0.3419
 epoch: 4, train_loss: 1.1623, test_loss: 1.1358, test_f1: 0.3527
 epoch: 5, train_loss: 1.1492, test_loss: 1.1181, test_f1: 0.3573
 epoch: 6, train_loss: 1.1203, test_loss: 1.1167, test_f1: 0.3526
 epoch: 7, train_loss: 1.1143, test_loss: 1.0974, test_f1: 0.3722
 epoch: 8, train_loss: 1.0982, test_loss: 1.0886, test_f1: 0.3825
 epoch: 9, train_loss: 1.0935, test_loss: 1.0821, test_f1: 0.3793
 epoch: 10, train_loss: 1.0803, test_loss: 1.0828, test_f1: 0.3883
 epoch: 11, train_loss: 1.0679, test_loss: 1.0670, test_f1: 0.4169
 epoch: 12, train_loss: 1.0685, test_loss: 1.0613, test_f1: 0.4341
 epoch: 13, train_loss: 1.0551, test_loss: 1.0627, test_f1: 0.4183
 epoch: 14, train_loss: 1.0537, test_loss: 1.0809, test_f1: 0.4027
 epoch: 15, train_loss: 1.0477, test_loss: 1.0547, test_f1: 0.4286
 epoch: 16, train_loss: 1.0333, test_loss: 1.0505, test_f1: 0.4449
 epoch: 17, train_loss: 1.0347, test_loss: 1.0340, test_f1: 0.4344
 epoch: 18, train_loss: 1.0341, test_loss: 1.0268, test_f1: 0.4534
 epoch: 19, train_loss: 1.0213, test_loss: 1.0205, test_f1: 0.4528
 epoch: 20, train_loss: 1.0152, test_loss: 1.0139, test_f1: 0.4510
 epoch: 21, train_loss: 1.0139, test_loss: 1.0107, test_f1: 0.4608
 epoch: 22, train_loss: 1.0098, test_loss: 0.9958, test_f1: 0.4617
 epoch: 23, train_loss: 1.0030, test_loss: 0.9931, test_f1: 0.4603
 epoch: 24, train_loss: 0.9999, test_loss: 1.0061, test_f1: 0.4611
 epoch: 25, train_loss: 0.9975, test_loss: 0.9974, test_f1: 0.4660
 epoch: 26, train_loss: 0.9959, test_loss: 0.9832, test_f1: 0.4657
 epoch: 27, train_loss: 1.0011, test_loss: 0.9924, test_f1: 0.4612
 epoch: 28, train_loss: 0.9942, test_loss: 0.9721, test_f1: 0.4620
 epoch: 29, train_loss: 0.9796, test_loss: 0.9658, test_f1: 0.4714
 epoch: 30, train_loss: 0.9842, test_loss: 0.9762, test_f1: 0.4760
 epoch: 31, train_loss: 0.9780, test_loss: 0.9666, test_f1: 0.4853
 epoch: 32, train_loss: 0.9785, test_loss: 0.9696, test_f1: 0.4833
 epoch: 33, train_loss: 0.9780, test_loss: 0.9573, test_f1: 0.4839
 epoch: 34, train_loss: 0.9671, test_loss: 0.9793, test_f1: 0.4856
 epoch: 35, train_loss: 0.9674, test_loss: 0.9647, test_f1: 0.4918
 epoch: 36, train_loss: 0.9683, test_loss: 0.9681, test_f1: 0.4952
 epoch: 37, train_loss: 0.9686, test_loss: 0.9765, test_f1: 0.4942
 epoch: 38, train_loss: 0.9601, test_loss: 0.9615, test_f1: 0.4965
 epoch: 39, train_loss: 0.9637, test_loss: 0.9550, test_f1: 0.4904
 epoch: 40, train_loss: 0.9591, test_loss: 0.9768, test_f1: 0.4866
 epoch: 41, train_loss: 0.9608, test_loss: 0.9495, test_f1: 0.4806
 epoch: 42, train_loss: 0.9545, test_loss: 0.9587, test_f1: 0.4993
 epoch: 43, train_loss: 0.9627, test_loss: 0.9515, test_f1: 0.5019
 epoch: 44, train_loss: 0.9559, test_loss: 0.9596, test_f1: 0.5070
 epoch: 45, train_loss: 0.9567, test_loss: 0.9551, test_f1: 0.5077
 epoch: 46, train_loss: 0.9582, test_loss: 0.9412, test_f1: 0.4890
 epoch: 47, train_loss: 0.9494, test_loss: 0.9457, test_f1: 0.5091
 epoch: 48, train_loss: 0.9525, test_loss: 0.9560, test_f1: 0.5013
 epoch: 49, train_loss: 0.9440, test_loss: 0.9430, test_f1: 0.4988
 epoch: 50, train_loss: 0.9488, test_loss: 0.9387, test_f1: 0.5072
 epoch: 51, train_loss: 0.9355, test_loss: 0.9273, test_f1: 0.5114
 epoch: 52, train_loss: 0.9411, test_loss: 0.9325, test_f1: 0.5005
 epoch: 53, train_loss: 0.9401, test_loss: 0.9318, test_f1: 0.5028
 epoch: 54, train_loss: 0.9336, test_loss: 0.9456, test_f1: 0.5011
 epoch: 55, train_loss: 0.9370, test_loss: 0.9571, test_f1: 0.5049
 epoch: 56, train_loss: 0.9494, test_loss: 0.9438, test_f1: 0.5127
 epoch: 57, train_loss: 0.9372, test_loss: 0.9478, test_f1: 0.5049
 epoch: 58, train_loss: 0.9344, test_loss: 0.9275, test_f1: 0.5150
 epoch: 59, train_loss: 0.9402, test_loss: 0.9489, test_f1: 0.4863
 epoch: 60, train_loss: 0.9476, test_loss: 0.9558, test_f1: 0.5000
 epoch: 61, train_loss: 0.9429, test_loss: 0.9254, test_f1: 0.5141
 epoch: 62, train_loss: 0.9332, test_loss: 0.9480, test_f1: 0.5038
 epoch: 63, train_loss: 0.9339, test_loss: 0.9300, test_f1: 0.5000
 epoch: 64, train_loss: 0.9445, test_loss: 0.9500, test_f1: 0.5062
 epoch: 65, train_loss: 0.9294, test_loss: 0.9457, test_f1: 0.5126
 epoch: 66, train_loss: 0.9293, test_loss: 0.9372, test_f1: 0.5029
 epoch: 67, train_loss: 0.9316, test_loss: 0.9400, test_f1: 0.4961
 epoch: 68, train_loss: 0.9337, test_loss: 0.9434, test_f1: 0.5071
 epoch: 69, train_loss: 0.9322, test_loss: 0.9224, test_f1: 0.5186
 epoch: 70, train_loss: 0.9285, test_loss: 0.9313, test_f1: 0.5140
 epoch: 71, train_loss: 0.9212, test_loss: 0.9508, test_f1: 0.5041
 epoch: 72, train_loss: 0.9325, test_loss: 0.9149, test_f1: 0.5143
 epoch: 73, train_loss: 0.9227, test_loss: 0.9241, test_f1: 0.5070
 epoch: 74, train_loss: 0.9294, test_loss: 0.9106, test_f1: 0.5103
 epoch: 75, train_loss: 0.9295, test_loss: 0.9374, test_f1: 0.5201
 epoch: 76, train_loss: 0.9226, test_loss: 0.9226, test_f1: 0.5196
 epoch: 77, train_loss: 0.9320, test_loss: 0.9267, test_f1: 0.5109
 epoch: 78, train_loss: 0.9245, test_loss: 0.9164, test_f1: 0.5192
 epoch: 79, train_loss: 0.9266, test_loss: 0.9247, test_f1: 0.5007
 epoch: 80, train_loss: 0.9337, test_loss: 0.9198, test_f1: 0.5042
 epoch: 81, train_loss: 0.9282, test_loss: 0.9193, test_f1: 0.5165
 epoch: 82, train_loss: 0.9321, test_loss: 0.9139, test_f1: 0.5025
 epoch: 83, train_loss: 0.9208, test_loss: 0.9224, test_f1: 0.5071
 epoch: 84, train_loss: 0.9255, test_loss: 0.9248, test_f1: 0.5112
 epoch: 85, train_loss: 0.9105, test_loss: 0.9187, test_f1: 0.5103
 epoch: 86, train_loss: 0.9213, test_loss: 0.9370, test_f1: 0.5167
 epoch: 87, train_loss: 0.9276, test_loss: 0.9032, test_f1: 0.5245
 epoch: 88, train_loss: 0.9195, test_loss: 0.9176, test_f1: 0.5195
 epoch: 89, train_loss: 0.9212, test_loss: 0.9289, test_f1: 0.5190
 epoch: 90, train_loss: 0.9236, test_loss: 0.9100, test_f1: 0.5286
 epoch: 91, train_loss: 0.9229, test_loss: 0.9085, test_f1: 0.5204
 epoch: 92, train_loss: 0.9232, test_loss: 0.9183, test_f1: 0.5186
 epoch: 93, train_loss: 0.9233, test_loss: 0.9374, test_f1: 0.5048
 epoch: 94, train_loss: 0.9140, test_loss: 0.9010, test_f1: 0.5093
 epoch: 95, train_loss: 0.9140, test_loss: 0.9159, test_f1: 0.5085
 epoch: 96, train_loss: 0.9149, test_loss: 0.9127, test_f1: 0.5251
 epoch: 97, train_loss: 0.9173, test_loss: 0.9152, test_f1: 0.5188
 epoch: 98, train_loss: 0.9153, test_loss: 0.9123, test_f1: 0.5300
 epoch: 99, train_loss: 0.9242, test_loss: 0.9125, test_f1: 0.5212
##################ITERATION #5 ****************************************
 epoch: 0, train_loss: 1.2616, test_loss: 1.1512, test_f1: 0.3359
 epoch: 1, train_loss: 1.1910, test_loss: 1.1226, test_f1: 0.3422
 epoch: 2, train_loss: 1.1654, test_loss: 1.1068, test_f1: 0.3460
 epoch: 3, train_loss: 1.1411, test_loss: 1.0965, test_f1: 0.3458
 epoch: 4, train_loss: 1.1265, test_loss: 1.0888, test_f1: 0.3460
 epoch: 5, train_loss: 1.1122, test_loss: 1.0838, test_f1: 0.3537
 epoch: 6, train_loss: 1.1041, test_loss: 1.0765, test_f1: 0.3537
 epoch: 7, train_loss: 1.0915, test_loss: 1.0667, test_f1: 0.3537
 epoch: 8, train_loss: 1.0884, test_loss: 1.0676, test_f1: 0.3537
 epoch: 9, train_loss: 1.0799, test_loss: 1.0667, test_f1: 0.3517
 epoch: 10, train_loss: 1.0781, test_loss: 1.0574, test_f1: 0.3536
 epoch: 11, train_loss: 1.0694, test_loss: 1.0591, test_f1: 0.3554
 epoch: 12, train_loss: 1.0714, test_loss: 1.0548, test_f1: 0.3545
 epoch: 13, train_loss: 1.0608, test_loss: 1.0557, test_f1: 0.3566
 epoch: 14, train_loss: 1.0607, test_loss: 1.0545, test_f1: 0.3548
 epoch: 15, train_loss: 1.0583, test_loss: 1.0489, test_f1: 0.3545
 epoch: 16, train_loss: 1.0532, test_loss: 1.0548, test_f1: 0.3545
 epoch: 17, train_loss: 1.0581, test_loss: 1.0449, test_f1: 0.3564
 epoch: 18, train_loss: 1.0485, test_loss: 1.0443, test_f1: 0.3546
 epoch: 19, train_loss: 1.0515, test_loss: 1.0458, test_f1: 0.3581
 epoch: 20, train_loss: 1.0415, test_loss: 1.0483, test_f1: 0.3578
 epoch: 21, train_loss: 1.0409, test_loss: 1.0438, test_f1: 0.3587
 epoch: 22, train_loss: 1.0408, test_loss: 1.0339, test_f1: 0.3598
 epoch: 23, train_loss: 1.0365, test_loss: 1.0445, test_f1: 0.3601
 epoch: 24, train_loss: 1.0328, test_loss: 1.0324, test_f1: 0.3566
 epoch: 25, train_loss: 1.0370, test_loss: 1.0334, test_f1: 0.3649
 epoch: 26, train_loss: 1.0318, test_loss: 1.0289, test_f1: 0.3602
 epoch: 27, train_loss: 1.0298, test_loss: 1.0353, test_f1: 0.3541
 epoch: 28, train_loss: 1.0203, test_loss: 1.0329, test_f1: 0.3604
 epoch: 29, train_loss: 1.0217, test_loss: 1.0270, test_f1: 0.3867
 epoch: 30, train_loss: 1.0215, test_loss: 1.0355, test_f1: 0.3737
 epoch: 31, train_loss: 1.0213, test_loss: 1.0284, test_f1: 0.3755
 epoch: 32, train_loss: 1.0216, test_loss: 1.0252, test_f1: 0.3805
 epoch: 33, train_loss: 1.0202, test_loss: 1.0314, test_f1: 0.3785
 epoch: 34, train_loss: 1.0167, test_loss: 1.0228, test_f1: 0.3954
 epoch: 35, train_loss: 1.0184, test_loss: 1.0128, test_f1: 0.4091
 epoch: 36, train_loss: 1.0146, test_loss: 1.0139, test_f1: 0.4012
 epoch: 37, train_loss: 1.0161, test_loss: 1.0056, test_f1: 0.4097
 epoch: 38, train_loss: 1.0093, test_loss: 1.0170, test_f1: 0.4267
 epoch: 39, train_loss: 1.0025, test_loss: 1.0130, test_f1: 0.4232
 epoch: 40, train_loss: 1.0094, test_loss: 0.9857, test_f1: 0.4042
 epoch: 41, train_loss: 0.9995, test_loss: 0.9941, test_f1: 0.4134
 epoch: 42, train_loss: 1.0025, test_loss: 1.0030, test_f1: 0.4316
 epoch: 43, train_loss: 0.9980, test_loss: 0.9968, test_f1: 0.4305
 epoch: 44, train_loss: 0.9901, test_loss: 1.0021, test_f1: 0.4489
 epoch: 45, train_loss: 0.9963, test_loss: 0.9796, test_f1: 0.4266
 epoch: 46, train_loss: 0.9983, test_loss: 0.9970, test_f1: 0.4540
 epoch: 47, train_loss: 0.9912, test_loss: 0.9838, test_f1: 0.4570
 epoch: 48, train_loss: 0.9865, test_loss: 0.9957, test_f1: 0.4610
 epoch: 49, train_loss: 0.9810, test_loss: 0.9812, test_f1: 0.4442
 epoch: 50, train_loss: 0.9812, test_loss: 0.9670, test_f1: 0.4710
 epoch: 51, train_loss: 0.9809, test_loss: 0.9687, test_f1: 0.4786
 epoch: 52, train_loss: 0.9779, test_loss: 0.9698, test_f1: 0.4828
 epoch: 53, train_loss: 0.9739, test_loss: 0.9800, test_f1: 0.4562
 epoch: 54, train_loss: 0.9700, test_loss: 0.9723, test_f1: 0.4755
 epoch: 55, train_loss: 0.9734, test_loss: 0.9662, test_f1: 0.4585
 epoch: 56, train_loss: 0.9690, test_loss: 0.9757, test_f1: 0.4926
 epoch: 57, train_loss: 0.9694, test_loss: 0.9532, test_f1: 0.4735
 epoch: 58, train_loss: 0.9726, test_loss: 0.9608, test_f1: 0.4964
 epoch: 59, train_loss: 0.9712, test_loss: 0.9651, test_f1: 0.4800
 epoch: 60, train_loss: 0.9691, test_loss: 0.9603, test_f1: 0.4828
 epoch: 61, train_loss: 0.9719, test_loss: 0.9529, test_f1: 0.4829
 epoch: 62, train_loss: 0.9702, test_loss: 0.9600, test_f1: 0.4813
 epoch: 63, train_loss: 0.9646, test_loss: 0.9494, test_f1: 0.4989
 epoch: 64, train_loss: 0.9707, test_loss: 0.9534, test_f1: 0.4867
 epoch: 65, train_loss: 0.9708, test_loss: 0.9502, test_f1: 0.4852
 epoch: 66, train_loss: 0.9591, test_loss: 0.9523, test_f1: 0.4960
 epoch: 67, train_loss: 0.9633, test_loss: 0.9604, test_f1: 0.4965
 epoch: 68, train_loss: 0.9597, test_loss: 0.9530, test_f1: 0.4832
 epoch: 69, train_loss: 0.9559, test_loss: 0.9578, test_f1: 0.4866
 epoch: 70, train_loss: 0.9608, test_loss: 0.9411, test_f1: 0.4887
 epoch: 71, train_loss: 0.9599, test_loss: 0.9357, test_f1: 0.4852
 epoch: 72, train_loss: 0.9573, test_loss: 0.9338, test_f1: 0.4828
 epoch: 73, train_loss: 0.9459, test_loss: 0.9302, test_f1: 0.4922
 epoch: 74, train_loss: 0.9573, test_loss: 0.9398, test_f1: 0.4957
 epoch: 75, train_loss: 0.9543, test_loss: 0.9404, test_f1: 0.4906
 epoch: 76, train_loss: 0.9529, test_loss: 0.9349, test_f1: 0.4988
 epoch: 77, train_loss: 0.9537, test_loss: 0.9445, test_f1: 0.4973
 epoch: 78, train_loss: 0.9481, test_loss: 0.9414, test_f1: 0.4978
 epoch: 79, train_loss: 0.9525, test_loss: 0.9358, test_f1: 0.4914
 epoch: 80, train_loss: 0.9467, test_loss: 0.9368, test_f1: 0.4991
 epoch: 81, train_loss: 0.9472, test_loss: 0.9399, test_f1: 0.4992
 epoch: 82, train_loss: 0.9482, test_loss: 0.9359, test_f1: 0.4880
 epoch: 83, train_loss: 0.9421, test_loss: 0.9429, test_f1: 0.4860
 epoch: 84, train_loss: 0.9416, test_loss: 0.9373, test_f1: 0.5035
 epoch: 85, train_loss: 0.9432, test_loss: 0.9354, test_f1: 0.5013
 epoch: 86, train_loss: 0.9421, test_loss: 0.9350, test_f1: 0.4969
 epoch: 87, train_loss: 0.9379, test_loss: 0.9290, test_f1: 0.4989
 epoch: 88, train_loss: 0.9442, test_loss: 0.9337, test_f1: 0.5019
 epoch: 89, train_loss: 0.9430, test_loss: 0.9307, test_f1: 0.4903
 epoch: 90, train_loss: 0.9377, test_loss: 0.9303, test_f1: 0.4997
 epoch: 91, train_loss: 0.9367, test_loss: 0.9317, test_f1: 0.4972
 epoch: 92, train_loss: 0.9405, test_loss: 0.9397, test_f1: 0.4967
 epoch: 93, train_loss: 0.9431, test_loss: 0.9404, test_f1: 0.4998
 epoch: 94, train_loss: 0.9337, test_loss: 0.9309, test_f1: 0.5049
 epoch: 95, train_loss: 0.9358, test_loss: 0.9417, test_f1: 0.4998
 epoch: 96, train_loss: 0.9337, test_loss: 0.9439, test_f1: 0.4964
 epoch: 97, train_loss: 0.9362, test_loss: 0.9315, test_f1: 0.4948
 epoch: 98, train_loss: 0.9374, test_loss: 0.9292, test_f1: 0.4874
 epoch: 99, train_loss: 0.9374, test_loss: 0.9306, test_f1: 0.5054
##################ITERATION #6 ****************************************
 epoch: 0, train_loss: 1.3072, test_loss: 1.1963, test_f1: 0.2352
 epoch: 1, train_loss: 1.2198, test_loss: 1.1526, test_f1: 0.3416
 epoch: 2, train_loss: 1.1846, test_loss: 1.1215, test_f1: 0.3509
 epoch: 3, train_loss: 1.1648, test_loss: 1.1004, test_f1: 0.3694
 epoch: 4, train_loss: 1.1457, test_loss: 1.0908, test_f1: 0.3671
 epoch: 5, train_loss: 1.1296, test_loss: 1.0784, test_f1: 0.3625
 epoch: 6, train_loss: 1.1085, test_loss: 1.0662, test_f1: 0.3691
 epoch: 7, train_loss: 1.1013, test_loss: 1.0512, test_f1: 0.3831
 epoch: 8, train_loss: 1.0919, test_loss: 1.0443, test_f1: 0.3930
 epoch: 9, train_loss: 1.0833, test_loss: 1.0542, test_f1: 0.4128
 epoch: 10, train_loss: 1.0707, test_loss: 1.0362, test_f1: 0.4143
 epoch: 11, train_loss: 1.0682, test_loss: 1.0249, test_f1: 0.4100
 epoch: 12, train_loss: 1.0521, test_loss: 1.0184, test_f1: 0.4173
 epoch: 13, train_loss: 1.0481, test_loss: 1.0107, test_f1: 0.4239
 epoch: 14, train_loss: 1.0436, test_loss: 1.0122, test_f1: 0.4290
 epoch: 15, train_loss: 1.0376, test_loss: 1.0064, test_f1: 0.4201
 epoch: 16, train_loss: 1.0315, test_loss: 1.0005, test_f1: 0.4366
 epoch: 17, train_loss: 1.0329, test_loss: 0.9888, test_f1: 0.4645
 epoch: 18, train_loss: 1.0219, test_loss: 0.9878, test_f1: 0.4483
 epoch: 19, train_loss: 1.0253, test_loss: 0.9876, test_f1: 0.4659
 epoch: 20, train_loss: 1.0161, test_loss: 0.9903, test_f1: 0.4518
 epoch: 21, train_loss: 1.0160, test_loss: 0.9774, test_f1: 0.4818
 epoch: 22, train_loss: 1.0113, test_loss: 0.9744, test_f1: 0.4772
 epoch: 23, train_loss: 1.0135, test_loss: 0.9849, test_f1: 0.4720
 epoch: 24, train_loss: 1.0031, test_loss: 0.9733, test_f1: 0.4675
 epoch: 25, train_loss: 1.0054, test_loss: 0.9689, test_f1: 0.4697
 epoch: 26, train_loss: 1.0039, test_loss: 0.9722, test_f1: 0.4767
 epoch: 27, train_loss: 1.0051, test_loss: 0.9653, test_f1: 0.4728
 epoch: 28, train_loss: 1.0003, test_loss: 0.9450, test_f1: 0.4865
 epoch: 29, train_loss: 0.9896, test_loss: 0.9542, test_f1: 0.4721
 epoch: 30, train_loss: 0.9865, test_loss: 0.9528, test_f1: 0.4803
 epoch: 31, train_loss: 0.9975, test_loss: 0.9449, test_f1: 0.4796
 epoch: 32, train_loss: 0.9888, test_loss: 0.9480, test_f1: 0.4747
 epoch: 33, train_loss: 0.9865, test_loss: 0.9354, test_f1: 0.5012
 epoch: 34, train_loss: 0.9784, test_loss: 0.9339, test_f1: 0.4956
 epoch: 35, train_loss: 0.9808, test_loss: 0.9313, test_f1: 0.4977
 epoch: 36, train_loss: 0.9726, test_loss: 0.9230, test_f1: 0.4946
 epoch: 37, train_loss: 0.9660, test_loss: 0.9291, test_f1: 0.4947
 epoch: 38, train_loss: 0.9696, test_loss: 0.9239, test_f1: 0.4901
 epoch: 39, train_loss: 0.9711, test_loss: 0.9136, test_f1: 0.4989
 epoch: 40, train_loss: 0.9652, test_loss: 0.9143, test_f1: 0.4985
 epoch: 41, train_loss: 0.9659, test_loss: 0.9144, test_f1: 0.4995
 epoch: 42, train_loss: 0.9626, test_loss: 0.9130, test_f1: 0.5150
 epoch: 43, train_loss: 0.9612, test_loss: 0.9056, test_f1: 0.5053
 epoch: 44, train_loss: 0.9624, test_loss: 0.9067, test_f1: 0.5035
 epoch: 45, train_loss: 0.9514, test_loss: 0.9023, test_f1: 0.5109
 epoch: 46, train_loss: 0.9545, test_loss: 0.9021, test_f1: 0.5047
 epoch: 47, train_loss: 0.9508, test_loss: 0.8962, test_f1: 0.5121
 epoch: 48, train_loss: 0.9578, test_loss: 0.8915, test_f1: 0.5171
 epoch: 49, train_loss: 0.9553, test_loss: 0.8920, test_f1: 0.5102
 epoch: 50, train_loss: 0.9404, test_loss: 0.8936, test_f1: 0.5022
 epoch: 51, train_loss: 0.9393, test_loss: 0.8863, test_f1: 0.5135
 epoch: 52, train_loss: 0.9452, test_loss: 0.8876, test_f1: 0.5154
 epoch: 53, train_loss: 0.9476, test_loss: 0.8960, test_f1: 0.5164
 epoch: 54, train_loss: 0.9401, test_loss: 0.8898, test_f1: 0.5163
 epoch: 55, train_loss: 0.9455, test_loss: 0.8879, test_f1: 0.5278
 epoch: 56, train_loss: 0.9501, test_loss: 0.8936, test_f1: 0.5184
 epoch: 57, train_loss: 0.9306, test_loss: 0.8830, test_f1: 0.5174
 epoch: 58, train_loss: 0.9411, test_loss: 0.8841, test_f1: 0.5212
 epoch: 59, train_loss: 0.9423, test_loss: 0.8821, test_f1: 0.5125
 epoch: 60, train_loss: 0.9342, test_loss: 0.8824, test_f1: 0.5215
 epoch: 61, train_loss: 0.9368, test_loss: 0.8748, test_f1: 0.5193
 epoch: 62, train_loss: 0.9339, test_loss: 0.8716, test_f1: 0.5191
 epoch: 63, train_loss: 0.9409, test_loss: 0.8716, test_f1: 0.5305
 epoch: 64, train_loss: 0.9315, test_loss: 0.8762, test_f1: 0.5197
 epoch: 65, train_loss: 0.9327, test_loss: 0.8843, test_f1: 0.5186
 epoch: 66, train_loss: 0.9363, test_loss: 0.8783, test_f1: 0.5191
 epoch: 67, train_loss: 0.9353, test_loss: 0.8711, test_f1: 0.5256
 epoch: 68, train_loss: 0.9282, test_loss: 0.8742, test_f1: 0.5202
 epoch: 69, train_loss: 0.9288, test_loss: 0.8747, test_f1: 0.5251
 epoch: 70, train_loss: 0.9221, test_loss: 0.8686, test_f1: 0.5246
 epoch: 71, train_loss: 0.9260, test_loss: 0.8712, test_f1: 0.5209
 epoch: 72, train_loss: 0.9242, test_loss: 0.8729, test_f1: 0.5218
 epoch: 73, train_loss: 0.9321, test_loss: 0.8658, test_f1: 0.5249
 epoch: 74, train_loss: 0.9173, test_loss: 0.8715, test_f1: 0.5225
 epoch: 75, train_loss: 0.9275, test_loss: 0.8689, test_f1: 0.5271
 epoch: 76, train_loss: 0.9253, test_loss: 0.8679, test_f1: 0.5292
 epoch: 77, train_loss: 0.9270, test_loss: 0.8563, test_f1: 0.5408
 epoch: 78, train_loss: 0.9306, test_loss: 0.8633, test_f1: 0.5330
 epoch: 79, train_loss: 0.9312, test_loss: 0.8671, test_f1: 0.5313
 epoch: 80, train_loss: 0.9256, test_loss: 0.8652, test_f1: 0.5291
 epoch: 81, train_loss: 0.9245, test_loss: 0.8653, test_f1: 0.5306
 epoch: 82, train_loss: 0.9206, test_loss: 0.8565, test_f1: 0.5338
 epoch: 83, train_loss: 0.9182, test_loss: 0.8628, test_f1: 0.5352
 epoch: 84, train_loss: 0.9242, test_loss: 0.8592, test_f1: 0.5450
 epoch: 85, train_loss: 0.9239, test_loss: 0.8569, test_f1: 0.5391
 epoch: 86, train_loss: 0.9206, test_loss: 0.8538, test_f1: 0.5351
 epoch: 87, train_loss: 0.9163, test_loss: 0.8618, test_f1: 0.5304
 epoch: 88, train_loss: 0.9184, test_loss: 0.8491, test_f1: 0.5372
 epoch: 89, train_loss: 0.9159, test_loss: 0.8542, test_f1: 0.5286
 epoch: 90, train_loss: 0.9067, test_loss: 0.8572, test_f1: 0.5258
 epoch: 91, train_loss: 0.9096, test_loss: 0.8576, test_f1: 0.5408
 epoch: 92, train_loss: 0.9113, test_loss: 0.8535, test_f1: 0.5340
 epoch: 93, train_loss: 0.9033, test_loss: 0.8550, test_f1: 0.5336
 epoch: 94, train_loss: 0.9160, test_loss: 0.8549, test_f1: 0.5395
 epoch: 95, train_loss: 0.9061, test_loss: 0.8480, test_f1: 0.5364
 epoch: 96, train_loss: 0.9065, test_loss: 0.8558, test_f1: 0.5341
 epoch: 97, train_loss: 0.9160, test_loss: 0.8456, test_f1: 0.5358
 epoch: 98, train_loss: 0.9073, test_loss: 0.8553, test_f1: 0.5394
 epoch: 99, train_loss: 0.9007, test_loss: 0.8499, test_f1: 0.5438
##################ITERATION #7 ****************************************
 epoch: 0, train_loss: 1.3376, test_loss: 1.2517, test_f1: 0.2591
 epoch: 1, train_loss: 1.2311, test_loss: 1.1856, test_f1: 0.3014
 epoch: 2, train_loss: 1.2005, test_loss: 1.1437, test_f1: 0.3195
 epoch: 3, train_loss: 1.1696, test_loss: 1.1187, test_f1: 0.3416
 epoch: 4, train_loss: 1.1452, test_loss: 1.0983, test_f1: 0.3490
 epoch: 5, train_loss: 1.1190, test_loss: 1.0822, test_f1: 0.3616
 epoch: 6, train_loss: 1.1073, test_loss: 1.0718, test_f1: 0.3590
 epoch: 7, train_loss: 1.0923, test_loss: 1.0622, test_f1: 0.3725
 epoch: 8, train_loss: 1.0815, test_loss: 1.0551, test_f1: 0.3816
 epoch: 9, train_loss: 1.0735, test_loss: 1.0493, test_f1: 0.3809
 epoch: 10, train_loss: 1.0637, test_loss: 1.0438, test_f1: 0.4044
 epoch: 11, train_loss: 1.0611, test_loss: 1.0361, test_f1: 0.4178
 epoch: 12, train_loss: 1.0542, test_loss: 1.0355, test_f1: 0.4303
 epoch: 13, train_loss: 1.0462, test_loss: 1.0308, test_f1: 0.4248
 epoch: 14, train_loss: 1.0388, test_loss: 1.0238, test_f1: 0.4529
 epoch: 15, train_loss: 1.0347, test_loss: 1.0316, test_f1: 0.4287
 epoch: 16, train_loss: 1.0363, test_loss: 1.0222, test_f1: 0.4618
 epoch: 17, train_loss: 1.0253, test_loss: 1.0123, test_f1: 0.4590
 epoch: 18, train_loss: 1.0142, test_loss: 1.0043, test_f1: 0.4738
 epoch: 19, train_loss: 1.0102, test_loss: 0.9984, test_f1: 0.4787
 epoch: 20, train_loss: 1.0167, test_loss: 1.0016, test_f1: 0.4940
 epoch: 21, train_loss: 1.0052, test_loss: 0.9961, test_f1: 0.4832
 epoch: 22, train_loss: 0.9993, test_loss: 0.9964, test_f1: 0.4832
 epoch: 23, train_loss: 1.0030, test_loss: 0.9846, test_f1: 0.4886
 epoch: 24, train_loss: 0.9946, test_loss: 0.9880, test_f1: 0.4946
 epoch: 25, train_loss: 0.9907, test_loss: 0.9842, test_f1: 0.4856
 epoch: 26, train_loss: 0.9894, test_loss: 0.9774, test_f1: 0.4916
 epoch: 27, train_loss: 0.9882, test_loss: 0.9756, test_f1: 0.4831
 epoch: 28, train_loss: 0.9855, test_loss: 0.9768, test_f1: 0.4962
 epoch: 29, train_loss: 0.9809, test_loss: 0.9624, test_f1: 0.5068
 epoch: 30, train_loss: 0.9766, test_loss: 0.9585, test_f1: 0.4866
 epoch: 31, train_loss: 0.9740, test_loss: 0.9630, test_f1: 0.4971
 epoch: 32, train_loss: 0.9740, test_loss: 0.9560, test_f1: 0.4889
 epoch: 33, train_loss: 0.9756, test_loss: 0.9510, test_f1: 0.5022
 epoch: 34, train_loss: 0.9810, test_loss: 0.9436, test_f1: 0.5001
 epoch: 35, train_loss: 0.9753, test_loss: 0.9515, test_f1: 0.4950
 epoch: 36, train_loss: 0.9726, test_loss: 0.9578, test_f1: 0.4897
 epoch: 37, train_loss: 0.9733, test_loss: 0.9572, test_f1: 0.4935
 epoch: 38, train_loss: 0.9652, test_loss: 0.9515, test_f1: 0.4926
 epoch: 39, train_loss: 0.9705, test_loss: 0.9386, test_f1: 0.4992
 epoch: 40, train_loss: 0.9625, test_loss: 0.9452, test_f1: 0.4986
 epoch: 41, train_loss: 0.9677, test_loss: 0.9405, test_f1: 0.4955
 epoch: 42, train_loss: 0.9599, test_loss: 0.9286, test_f1: 0.5094
 epoch: 43, train_loss: 0.9594, test_loss: 0.9282, test_f1: 0.5121
 epoch: 44, train_loss: 0.9569, test_loss: 0.9391, test_f1: 0.4849
 epoch: 45, train_loss: 0.9554, test_loss: 0.9474, test_f1: 0.4992
 epoch: 46, train_loss: 0.9560, test_loss: 0.9324, test_f1: 0.4982
 epoch: 47, train_loss: 0.9569, test_loss: 0.9324, test_f1: 0.5027
 epoch: 48, train_loss: 0.9527, test_loss: 0.9500, test_f1: 0.4859
 epoch: 49, train_loss: 0.9414, test_loss: 0.9283, test_f1: 0.4969
 epoch: 50, train_loss: 0.9494, test_loss: 0.9396, test_f1: 0.5138
 epoch: 51, train_loss: 0.9504, test_loss: 0.9387, test_f1: 0.4889
 epoch: 52, train_loss: 0.9366, test_loss: 0.9325, test_f1: 0.5069
 epoch: 53, train_loss: 0.9392, test_loss: 0.9359, test_f1: 0.5056
 epoch: 54, train_loss: 0.9451, test_loss: 0.9271, test_f1: 0.5027
 epoch: 55, train_loss: 0.9420, test_loss: 0.9191, test_f1: 0.5093
 epoch: 56, train_loss: 0.9418, test_loss: 0.9352, test_f1: 0.4857
 epoch: 57, train_loss: 0.9356, test_loss: 0.9284, test_f1: 0.4915
 epoch: 58, train_loss: 0.9382, test_loss: 0.9181, test_f1: 0.5149
 epoch: 59, train_loss: 0.9353, test_loss: 0.9226, test_f1: 0.4931
 epoch: 60, train_loss: 0.9482, test_loss: 0.9058, test_f1: 0.5074
 epoch: 61, train_loss: 0.9414, test_loss: 0.9058, test_f1: 0.5145
 epoch: 62, train_loss: 0.9330, test_loss: 0.9072, test_f1: 0.5098
 epoch: 63, train_loss: 0.9351, test_loss: 0.9121, test_f1: 0.5249
 epoch: 64, train_loss: 0.9376, test_loss: 0.9066, test_f1: 0.5257
 epoch: 65, train_loss: 0.9348, test_loss: 0.9047, test_f1: 0.5128
 epoch: 66, train_loss: 0.9223, test_loss: 0.9048, test_f1: 0.5123
 epoch: 67, train_loss: 0.9419, test_loss: 0.9086, test_f1: 0.5059
 epoch: 68, train_loss: 0.9283, test_loss: 0.9050, test_f1: 0.5194
 epoch: 69, train_loss: 0.9374, test_loss: 0.8962, test_f1: 0.5109
 epoch: 70, train_loss: 0.9364, test_loss: 0.9220, test_f1: 0.4963
 epoch: 71, train_loss: 0.9281, test_loss: 0.9082, test_f1: 0.5137
 epoch: 72, train_loss: 0.9273, test_loss: 0.9045, test_f1: 0.5249
 epoch: 73, train_loss: 0.9199, test_loss: 0.8990, test_f1: 0.5373
 epoch: 74, train_loss: 0.9222, test_loss: 0.8975, test_f1: 0.5231
 epoch: 75, train_loss: 0.9293, test_loss: 0.8896, test_f1: 0.5233
 epoch: 76, train_loss: 0.9174, test_loss: 0.9039, test_f1: 0.5116
 epoch: 77, train_loss: 0.9257, test_loss: 0.9020, test_f1: 0.5269
 epoch: 78, train_loss: 0.9153, test_loss: 0.9105, test_f1: 0.5139
 epoch: 79, train_loss: 0.9215, test_loss: 0.8935, test_f1: 0.5186
 epoch: 80, train_loss: 0.9155, test_loss: 0.8940, test_f1: 0.5241
 epoch: 81, train_loss: 0.9235, test_loss: 0.9012, test_f1: 0.5120
 epoch: 82, train_loss: 0.9169, test_loss: 0.8931, test_f1: 0.5212
 epoch: 83, train_loss: 0.9197, test_loss: 0.9066, test_f1: 0.5100
 epoch: 84, train_loss: 0.9208, test_loss: 0.8848, test_f1: 0.5123
 epoch: 85, train_loss: 0.9152, test_loss: 0.8986, test_f1: 0.5167
 epoch: 86, train_loss: 0.9214, test_loss: 0.8984, test_f1: 0.5120
 epoch: 87, train_loss: 0.9182, test_loss: 0.8911, test_f1: 0.5090
 epoch: 88, train_loss: 0.9203, test_loss: 0.8977, test_f1: 0.5138
 epoch: 89, train_loss: 0.9100, test_loss: 0.8895, test_f1: 0.5243
 epoch: 90, train_loss: 0.9091, test_loss: 0.8799, test_f1: 0.5226
 epoch: 91, train_loss: 0.9064, test_loss: 0.8960, test_f1: 0.5243
 epoch: 92, train_loss: 0.9226, test_loss: 0.8859, test_f1: 0.5112
 epoch: 93, train_loss: 0.9194, test_loss: 0.8889, test_f1: 0.5318
 epoch: 94, train_loss: 0.9049, test_loss: 0.8995, test_f1: 0.5243
 epoch: 95, train_loss: 0.9154, test_loss: 0.8825, test_f1: 0.5143
 epoch: 96, train_loss: 0.9019, test_loss: 0.9087, test_f1: 0.5286
 epoch: 97, train_loss: 0.9154, test_loss: 0.8873, test_f1: 0.5302
 epoch: 98, train_loss: 0.9116, test_loss: 0.8852, test_f1: 0.5350
 epoch: 99, train_loss: 0.9124, test_loss: 0.8818, test_f1: 0.5359
##################ITERATION #8 ****************************************
 epoch: 0, train_loss: 1.3463, test_loss: 1.2245, test_f1: 0.2868
 epoch: 1, train_loss: 1.2358, test_loss: 1.1826, test_f1: 0.3078
 epoch: 2, train_loss: 1.2199, test_loss: 1.1663, test_f1: 0.3134
 epoch: 3, train_loss: 1.1859, test_loss: 1.1387, test_f1: 0.3304
 epoch: 4, train_loss: 1.1724, test_loss: 1.1207, test_f1: 0.3308
 epoch: 5, train_loss: 1.1518, test_loss: 1.1123, test_f1: 0.3230
 epoch: 6, train_loss: 1.1405, test_loss: 1.1111, test_f1: 0.3264
 epoch: 7, train_loss: 1.1381, test_loss: 1.0769, test_f1: 0.3356
 epoch: 8, train_loss: 1.1240, test_loss: 1.0724, test_f1: 0.3489
 epoch: 9, train_loss: 1.1065, test_loss: 1.0786, test_f1: 0.3571
 epoch: 10, train_loss: 1.0919, test_loss: 1.0561, test_f1: 0.3632
 epoch: 11, train_loss: 1.0997, test_loss: 1.0478, test_f1: 0.3791
 epoch: 12, train_loss: 1.0792, test_loss: 1.0664, test_f1: 0.3786
 epoch: 13, train_loss: 1.0765, test_loss: 1.0387, test_f1: 0.3936
 epoch: 14, train_loss: 1.0727, test_loss: 1.0345, test_f1: 0.3913
 epoch: 15, train_loss: 1.0712, test_loss: 1.0190, test_f1: 0.4105
 epoch: 16, train_loss: 1.0587, test_loss: 1.0378, test_f1: 0.4174
 epoch: 17, train_loss: 1.0467, test_loss: 1.0196, test_f1: 0.4153
 epoch: 18, train_loss: 1.0484, test_loss: 1.0165, test_f1: 0.4427
 epoch: 19, train_loss: 1.0436, test_loss: 1.0233, test_f1: 0.4524
 epoch: 20, train_loss: 1.0468, test_loss: 1.0032, test_f1: 0.4446
 epoch: 21, train_loss: 1.0386, test_loss: 1.0124, test_f1: 0.4445
 epoch: 22, train_loss: 1.0255, test_loss: 1.0105, test_f1: 0.4602
 epoch: 23, train_loss: 1.0324, test_loss: 0.9969, test_f1: 0.4609
 epoch: 24, train_loss: 1.0246, test_loss: 0.9991, test_f1: 0.4681
 epoch: 25, train_loss: 1.0236, test_loss: 0.9916, test_f1: 0.4639
 epoch: 26, train_loss: 1.0100, test_loss: 0.9919, test_f1: 0.4656
 epoch: 27, train_loss: 1.0114, test_loss: 0.9905, test_f1: 0.4718
 epoch: 28, train_loss: 1.0115, test_loss: 0.9777, test_f1: 0.4678
 epoch: 29, train_loss: 1.0110, test_loss: 0.9829, test_f1: 0.4745
 epoch: 30, train_loss: 1.0008, test_loss: 0.9803, test_f1: 0.4534
 epoch: 31, train_loss: 1.0007, test_loss: 0.9680, test_f1: 0.4773
 epoch: 32, train_loss: 0.9964, test_loss: 0.9644, test_f1: 0.4727
 epoch: 33, train_loss: 1.0096, test_loss: 0.9778, test_f1: 0.4706
 epoch: 34, train_loss: 0.9979, test_loss: 0.9718, test_f1: 0.4753
 epoch: 35, train_loss: 0.9928, test_loss: 0.9675, test_f1: 0.4804
 epoch: 36, train_loss: 1.0002, test_loss: 0.9706, test_f1: 0.4739
 epoch: 37, train_loss: 0.9966, test_loss: 0.9638, test_f1: 0.4748
 epoch: 38, train_loss: 0.9858, test_loss: 0.9640, test_f1: 0.4809
 epoch: 39, train_loss: 0.9926, test_loss: 0.9675, test_f1: 0.4789
 epoch: 40, train_loss: 0.9788, test_loss: 0.9696, test_f1: 0.4905
 epoch: 41, train_loss: 0.9891, test_loss: 0.9551, test_f1: 0.4830
 epoch: 42, train_loss: 0.9780, test_loss: 0.9548, test_f1: 0.4854
 epoch: 43, train_loss: 0.9802, test_loss: 0.9511, test_f1: 0.4863
 epoch: 44, train_loss: 0.9772, test_loss: 0.9729, test_f1: 0.4817
 epoch: 45, train_loss: 0.9812, test_loss: 0.9757, test_f1: 0.4819
 epoch: 46, train_loss: 0.9737, test_loss: 0.9777, test_f1: 0.4664
 epoch: 47, train_loss: 0.9667, test_loss: 0.9593, test_f1: 0.4807
 epoch: 48, train_loss: 0.9655, test_loss: 0.9523, test_f1: 0.4842
 epoch: 49, train_loss: 0.9690, test_loss: 0.9425, test_f1: 0.5007
 epoch: 50, train_loss: 0.9753, test_loss: 0.9462, test_f1: 0.4743
 epoch: 51, train_loss: 0.9672, test_loss: 0.9551, test_f1: 0.4887
 epoch: 52, train_loss: 0.9675, test_loss: 0.9502, test_f1: 0.4875
 epoch: 53, train_loss: 0.9700, test_loss: 0.9634, test_f1: 0.4932
 epoch: 54, train_loss: 0.9686, test_loss: 0.9564, test_f1: 0.4944
 epoch: 55, train_loss: 0.9700, test_loss: 0.9712, test_f1: 0.4898
 epoch: 56, train_loss: 0.9685, test_loss: 0.9665, test_f1: 0.4846
 epoch: 57, train_loss: 0.9625, test_loss: 0.9561, test_f1: 0.4913
 epoch: 58, train_loss: 0.9560, test_loss: 0.9447, test_f1: 0.4912
 epoch: 59, train_loss: 0.9606, test_loss: 0.9582, test_f1: 0.4884
 epoch: 60, train_loss: 0.9534, test_loss: 0.9644, test_f1: 0.4888
 epoch: 61, train_loss: 0.9619, test_loss: 0.9371, test_f1: 0.4941
 epoch: 62, train_loss: 0.9581, test_loss: 0.9685, test_f1: 0.4951
 epoch: 63, train_loss: 0.9576, test_loss: 0.9606, test_f1: 0.4958
 epoch: 64, train_loss: 0.9574, test_loss: 0.9569, test_f1: 0.4931
 epoch: 65, train_loss: 0.9537, test_loss: 0.9645, test_f1: 0.4967
 epoch: 66, train_loss: 0.9572, test_loss: 0.9539, test_f1: 0.4972
 epoch: 67, train_loss: 0.9473, test_loss: 0.9735, test_f1: 0.4916
 epoch: 68, train_loss: 0.9690, test_loss: 0.9538, test_f1: 0.4959
 epoch: 69, train_loss: 0.9480, test_loss: 0.9472, test_f1: 0.4952
 epoch: 70, train_loss: 0.9468, test_loss: 0.9572, test_f1: 0.4990
 epoch: 71, train_loss: 0.9412, test_loss: 0.9506, test_f1: 0.4961
 epoch: 72, train_loss: 0.9568, test_loss: 0.9430, test_f1: 0.4976
 epoch: 73, train_loss: 0.9533, test_loss: 0.9174, test_f1: 0.5066
 epoch: 74, train_loss: 0.9473, test_loss: 0.9632, test_f1: 0.4996
 epoch: 75, train_loss: 0.9513, test_loss: 0.9262, test_f1: 0.4951
 epoch: 76, train_loss: 0.9544, test_loss: 0.9511, test_f1: 0.4992
 epoch: 77, train_loss: 0.9489, test_loss: 0.9348, test_f1: 0.5031
 epoch: 78, train_loss: 0.9456, test_loss: 0.9273, test_f1: 0.5013
 epoch: 79, train_loss: 0.9426, test_loss: 0.9219, test_f1: 0.5007
 epoch: 80, train_loss: 0.9576, test_loss: 0.9404, test_f1: 0.4974
 epoch: 81, train_loss: 0.9432, test_loss: 0.9295, test_f1: 0.5001
 epoch: 82, train_loss: 0.9504, test_loss: 0.9310, test_f1: 0.4955
 epoch: 83, train_loss: 0.9443, test_loss: 0.9217, test_f1: 0.5002
 epoch: 84, train_loss: 0.9517, test_loss: 0.9036, test_f1: 0.5177
 epoch: 85, train_loss: 0.9472, test_loss: 0.9136, test_f1: 0.5083
 epoch: 86, train_loss: 0.9448, test_loss: 0.9084, test_f1: 0.5122
 epoch: 87, train_loss: 0.9437, test_loss: 0.9204, test_f1: 0.5022
 epoch: 88, train_loss: 0.9515, test_loss: 0.9423, test_f1: 0.5003
 epoch: 89, train_loss: 0.9495, test_loss: 0.9376, test_f1: 0.5028
 epoch: 90, train_loss: 0.9371, test_loss: 0.9102, test_f1: 0.5081
 epoch: 91, train_loss: 0.9441, test_loss: 0.9244, test_f1: 0.4877
 epoch: 92, train_loss: 0.9494, test_loss: 0.9369, test_f1: 0.5025
 epoch: 93, train_loss: 0.9534, test_loss: 0.9059, test_f1: 0.5121
 epoch: 94, train_loss: 0.9372, test_loss: 0.9191, test_f1: 0.5075
 epoch: 95, train_loss: 0.9440, test_loss: 0.8962, test_f1: 0.5156
 epoch: 96, train_loss: 0.9406, test_loss: 0.9060, test_f1: 0.5002
 epoch: 97, train_loss: 0.9463, test_loss: 0.9138, test_f1: 0.5100
 epoch: 98, train_loss: 0.9386, test_loss: 0.9062, test_f1: 0.5126
 epoch: 99, train_loss: 0.9375, test_loss: 0.8960, test_f1: 0.5150
##################ITERATION #9 ****************************************
 epoch: 0, train_loss: 1.3285, test_loss: 1.1831, test_f1: 0.2859
 epoch: 1, train_loss: 1.2224, test_loss: 1.1449, test_f1: 0.3322
 epoch: 2, train_loss: 1.1934, test_loss: 1.1283, test_f1: 0.3672
 epoch: 3, train_loss: 1.1581, test_loss: 1.1003, test_f1: 0.3942
 epoch: 4, train_loss: 1.1490, test_loss: 1.0906, test_f1: 0.3982
 epoch: 5, train_loss: 1.1349, test_loss: 1.0679, test_f1: 0.4023
 epoch: 6, train_loss: 1.1192, test_loss: 1.0517, test_f1: 0.4286
 epoch: 7, train_loss: 1.1077, test_loss: 1.0445, test_f1: 0.4332
 epoch: 8, train_loss: 1.1026, test_loss: 1.0398, test_f1: 0.4255
 epoch: 9, train_loss: 1.0924, test_loss: 1.0361, test_f1: 0.4318
 epoch: 10, train_loss: 1.0821, test_loss: 1.0222, test_f1: 0.4393
 epoch: 11, train_loss: 1.0693, test_loss: 1.0170, test_f1: 0.4359
 epoch: 12, train_loss: 1.0610, test_loss: 1.0194, test_f1: 0.4405
 epoch: 13, train_loss: 1.0571, test_loss: 1.0131, test_f1: 0.4468
 epoch: 14, train_loss: 1.0412, test_loss: 1.0020, test_f1: 0.4675
 epoch: 15, train_loss: 1.0459, test_loss: 0.9977, test_f1: 0.4372
 epoch: 16, train_loss: 1.0352, test_loss: 0.9951, test_f1: 0.4590
 epoch: 17, train_loss: 1.0399, test_loss: 0.9855, test_f1: 0.4547
 epoch: 18, train_loss: 1.0321, test_loss: 0.9862, test_f1: 0.4688
 epoch: 19, train_loss: 1.0295, test_loss: 0.9781, test_f1: 0.4665
 epoch: 20, train_loss: 1.0184, test_loss: 0.9778, test_f1: 0.4614
 epoch: 21, train_loss: 1.0193, test_loss: 0.9790, test_f1: 0.4610
 epoch: 22, train_loss: 1.0167, test_loss: 0.9740, test_f1: 0.4776
 epoch: 23, train_loss: 1.0061, test_loss: 0.9687, test_f1: 0.4674
 epoch: 24, train_loss: 1.0020, test_loss: 0.9661, test_f1: 0.4678
 epoch: 25, train_loss: 1.0084, test_loss: 0.9685, test_f1: 0.4814
 epoch: 26, train_loss: 0.9912, test_loss: 0.9584, test_f1: 0.4804
 epoch: 27, train_loss: 0.9943, test_loss: 0.9615, test_f1: 0.4962
 epoch: 28, train_loss: 0.9982, test_loss: 0.9596, test_f1: 0.4766
 epoch: 29, train_loss: 0.9821, test_loss: 0.9571, test_f1: 0.4776
 epoch: 30, train_loss: 0.9822, test_loss: 0.9522, test_f1: 0.4871
 epoch: 31, train_loss: 0.9973, test_loss: 0.9487, test_f1: 0.4858
 epoch: 32, train_loss: 0.9839, test_loss: 0.9519, test_f1: 0.4728
 epoch: 33, train_loss: 0.9764, test_loss: 0.9517, test_f1: 0.4831
 epoch: 34, train_loss: 0.9766, test_loss: 0.9445, test_f1: 0.4875
 epoch: 35, train_loss: 0.9782, test_loss: 0.9387, test_f1: 0.4923
 epoch: 36, train_loss: 0.9790, test_loss: 0.9377, test_f1: 0.4933
 epoch: 37, train_loss: 0.9681, test_loss: 0.9482, test_f1: 0.4921
 epoch: 38, train_loss: 0.9716, test_loss: 0.9432, test_f1: 0.4974
 epoch: 39, train_loss: 0.9678, test_loss: 0.9461, test_f1: 0.4956
 epoch: 40, train_loss: 0.9800, test_loss: 0.9443, test_f1: 0.5030
 epoch: 41, train_loss: 0.9725, test_loss: 0.9381, test_f1: 0.4937
 epoch: 42, train_loss: 0.9635, test_loss: 0.9447, test_f1: 0.4972
 epoch: 43, train_loss: 0.9602, test_loss: 0.9314, test_f1: 0.4912
 epoch: 44, train_loss: 0.9701, test_loss: 0.9417, test_f1: 0.4888
 epoch: 45, train_loss: 0.9641, test_loss: 0.9393, test_f1: 0.5030
 epoch: 46, train_loss: 0.9566, test_loss: 0.9281, test_f1: 0.5022
 epoch: 47, train_loss: 0.9650, test_loss: 0.9204, test_f1: 0.4973
 epoch: 48, train_loss: 0.9594, test_loss: 0.9336, test_f1: 0.4937
 epoch: 49, train_loss: 0.9600, test_loss: 0.9309, test_f1: 0.4993
 epoch: 50, train_loss: 0.9600, test_loss: 0.9303, test_f1: 0.4956
 epoch: 51, train_loss: 0.9509, test_loss: 0.9171, test_f1: 0.4995
 epoch: 52, train_loss: 0.9559, test_loss: 0.9264, test_f1: 0.4982
 epoch: 53, train_loss: 0.9482, test_loss: 0.9265, test_f1: 0.5011
 epoch: 54, train_loss: 0.9447, test_loss: 0.9288, test_f1: 0.4926
 epoch: 55, train_loss: 0.9560, test_loss: 0.9291, test_f1: 0.4991
 epoch: 56, train_loss: 0.9533, test_loss: 0.9381, test_f1: 0.5024
 epoch: 57, train_loss: 0.9463, test_loss: 0.9301, test_f1: 0.5001
 epoch: 58, train_loss: 0.9537, test_loss: 0.9311, test_f1: 0.5044
 epoch: 59, train_loss: 0.9489, test_loss: 0.9215, test_f1: 0.5049
 epoch: 60, train_loss: 0.9488, test_loss: 0.9271, test_f1: 0.5118
 epoch: 61, train_loss: 0.9482, test_loss: 0.9299, test_f1: 0.5091
 epoch: 62, train_loss: 0.9436, test_loss: 0.9167, test_f1: 0.5005
 epoch: 63, train_loss: 0.9522, test_loss: 0.9104, test_f1: 0.5076
 epoch: 64, train_loss: 0.9482, test_loss: 0.9126, test_f1: 0.4992
 epoch: 65, train_loss: 0.9396, test_loss: 0.9110, test_f1: 0.5037
 epoch: 66, train_loss: 0.9374, test_loss: 0.9105, test_f1: 0.5026
 epoch: 67, train_loss: 0.9356, test_loss: 0.9221, test_f1: 0.5045
 epoch: 68, train_loss: 0.9448, test_loss: 0.9185, test_f1: 0.4954
 epoch: 69, train_loss: 0.9415, test_loss: 0.9351, test_f1: 0.4982
 epoch: 70, train_loss: 0.9504, test_loss: 0.9213, test_f1: 0.5020
 epoch: 71, train_loss: 0.9518, test_loss: 0.9200, test_f1: 0.5194
 epoch: 72, train_loss: 0.9543, test_loss: 0.9212, test_f1: 0.5112
 epoch: 73, train_loss: 0.9355, test_loss: 0.9130, test_f1: 0.5061
 epoch: 74, train_loss: 0.9392, test_loss: 0.9205, test_f1: 0.5070
 epoch: 75, train_loss: 0.9420, test_loss: 0.9088, test_f1: 0.5059
 epoch: 76, train_loss: 0.9423, test_loss: 0.9107, test_f1: 0.5135
 epoch: 77, train_loss: 0.9322, test_loss: 0.9137, test_f1: 0.5101
 epoch: 78, train_loss: 0.9429, test_loss: 0.9049, test_f1: 0.5234
 epoch: 79, train_loss: 0.9349, test_loss: 0.9112, test_f1: 0.5277
 epoch: 80, train_loss: 0.9368, test_loss: 0.9151, test_f1: 0.5046
 epoch: 81, train_loss: 0.9465, test_loss: 0.9081, test_f1: 0.4987
 epoch: 82, train_loss: 0.9345, test_loss: 0.8966, test_f1: 0.5285
 epoch: 83, train_loss: 0.9344, test_loss: 0.9025, test_f1: 0.5128
 epoch: 84, train_loss: 0.9411, test_loss: 0.8984, test_f1: 0.5155
 epoch: 85, train_loss: 0.9320, test_loss: 0.9121, test_f1: 0.5145
 epoch: 86, train_loss: 0.9405, test_loss: 0.9060, test_f1: 0.5114
 epoch: 87, train_loss: 0.9354, test_loss: 0.9153, test_f1: 0.5182
 epoch: 88, train_loss: 0.9486, test_loss: 0.9106, test_f1: 0.5072
 epoch: 89, train_loss: 0.9352, test_loss: 0.9072, test_f1: 0.5301
 epoch: 90, train_loss: 0.9286, test_loss: 0.9057, test_f1: 0.5142
 epoch: 91, train_loss: 0.9315, test_loss: 0.9151, test_f1: 0.5214
 epoch: 92, train_loss: 0.9450, test_loss: 0.9058, test_f1: 0.5090
 epoch: 93, train_loss: 0.9291, test_loss: 0.9060, test_f1: 0.5092
 epoch: 94, train_loss: 0.9329, test_loss: 0.9019, test_f1: 0.5083
 epoch: 95, train_loss: 0.9245, test_loss: 0.9079, test_f1: 0.5284
 epoch: 96, train_loss: 0.9285, test_loss: 0.9191, test_f1: 0.5147
 epoch: 97, train_loss: 0.9260, test_loss: 0.9078, test_f1: 0.5220
 epoch: 98, train_loss: 0.9342, test_loss: 0.9106, test_f1: 0.5297
 epoch: 99, train_loss: 0.9358, test_loss: 0.9133, test_f1: 0.5080

Training completed in 1415.10 seconds
Best F1: 0.5450 at epoch 84
Mean F1 across iterations: 0.5173  0.0208
========================FINAL RESULTS================================
FEGIN weighted F1: 0.5450  0.0208
python main.py --data ltspice_examples --representation component_pin_net --model FEGIN --layers 6 --hiddens 16 --batch_size 32 --lr 0.0001 --emb_size 250 --epochs 100 --save_appendix component_pin_net_L6_H16_BS32_LR0.0001_E250 --no_val
-----



STDERR:
  File "main.py", line 370, in <module>
    main()
  File "main.py", line 254, in main
    dataset = dataset_class(
  File "/home/philip/projects/ltspice_examples_code_repo/Circuit-Completion-Using-GNNs/component_classification_with_link_prediction_head/evaluation/FEGIN/kernel/circuit_datasets.py", line 15, in __init__
    self.data, self.slices = torch.load(self.processed_paths[0])
  File "/home/philip/.local/lib/python3.8/site-packages/torch/serialization.py", line 1040, in load
    warnings.warn(
  File "/usr/lib/python3.8/warnings.py", line 109, in _showwarnmsg
    sw(msg.message, msg.category, msg.filename, msg.lineno,
  File "main.py", line 47, in warn_with_traceback
    traceback.print_stack(file=log)
/home/philip/projects/ltspice_examples_code_repo/Circuit-Completion-Using-GNNs/component_classification_with_link_prediction_head/evaluation/FEGIN/kernel/circuit_datasets.py:15: FutureWarning: You are using `torch.load` with `weights_only=False` (the current default value), which uses the default pickle module implicitly. It is possible to construct malicious pickle data which will execute arbitrary code during unpickling (See https://github.com/pytorch/pytorch/blob/main/SECURITY.md#untrusted-models for more details). In a future release, the default value for `weights_only` will be flipped to `True`. This limits the functions that could be executed during unpickling. Arbitrary objects will no longer be allowed to be loaded via this mode unless they are explicitly allowlisted by the user via `torch.serialization.add_safe_globals`. We recommend you start setting `weights_only=True` for any use case where you don't have full control of the loaded file. Please open an issue on GitHub for any issues related to this experimental feature.
  self.data, self.slices = torch.load(self.processed_paths[0])
