STDOUT:
Results will be saved in /home/philip/projects/ltspice_examples_code_repo/Circuit-Completion-Using-GNNs/component_classification_with_link_prediction_head/evaluation/FEGIN/results/model_FEGIN_dataset_ltspice_examples
Command line input: python main.py --data ltspice_examples --representation component_pin_net --model FEGIN --layers 6 --hiddens 32 --batch_size 128 --lr 0.0001 --emb_size 128 --epochs 100 --save_appendix component_pin_net_L6_H32_BS128_LR0.0001_E128 --no_val
 is saved.
-----
ltspice_examples - FEGIN
Using 6 layers, 32 hidden units, h = 2
Loading component_pin_net representation dataset
ENTERED
Training FEGIN on component_pin_net representation
Train: 3558, Test: 846
##################ITERATION #0 ****************************************
 epoch: 0, train_loss: 1.3891, test_loss: 1.3903, test_f1: 0.0304
 epoch: 1, train_loss: 1.3819, test_loss: 1.3850, test_f1: 0.1354
 epoch: 2, train_loss: 1.3771, test_loss: 1.3768, test_f1: 0.2425
 epoch: 3, train_loss: 1.3724, test_loss: 1.3695, test_f1: 0.3849
 epoch: 4, train_loss: 1.3659, test_loss: 1.3614, test_f1: 0.4262
 epoch: 5, train_loss: 1.3586, test_loss: 1.3525, test_f1: 0.4076
 epoch: 6, train_loss: 1.3474, test_loss: 1.3408, test_f1: 0.3949
 epoch: 7, train_loss: 1.3353, test_loss: 1.3276, test_f1: 0.3242
 epoch: 8, train_loss: 1.3214, test_loss: 1.3107, test_f1: 0.3238
 epoch: 9, train_loss: 1.3038, test_loss: 1.2932, test_f1: 0.3103
 epoch: 10, train_loss: 1.2900, test_loss: 1.2774, test_f1: 0.3250
 epoch: 11, train_loss: 1.2715, test_loss: 1.2603, test_f1: 0.3324
 epoch: 12, train_loss: 1.2604, test_loss: 1.2433, test_f1: 0.3393
 epoch: 13, train_loss: 1.2445, test_loss: 1.2269, test_f1: 0.3403
 epoch: 14, train_loss: 1.2288, test_loss: 1.2097, test_f1: 0.3413
 epoch: 15, train_loss: 1.2183, test_loss: 1.1948, test_f1: 0.3422
 epoch: 16, train_loss: 1.2021, test_loss: 1.1769, test_f1: 0.3422
 epoch: 17, train_loss: 1.1860, test_loss: 1.1598, test_f1: 0.3422
 epoch: 18, train_loss: 1.1642, test_loss: 1.1411, test_f1: 0.3432
 epoch: 19, train_loss: 1.1554, test_loss: 1.1262, test_f1: 0.3460
 epoch: 20, train_loss: 1.1354, test_loss: 1.1116, test_f1: 0.3460
 epoch: 21, train_loss: 1.1241, test_loss: 1.1014, test_f1: 0.3449
 epoch: 22, train_loss: 1.1079, test_loss: 1.0893, test_f1: 0.3479
 epoch: 23, train_loss: 1.0946, test_loss: 1.0821, test_f1: 0.3479
 epoch: 24, train_loss: 1.0834, test_loss: 1.0768, test_f1: 0.3459
 epoch: 25, train_loss: 1.0707, test_loss: 1.0714, test_f1: 0.3449
 epoch: 26, train_loss: 1.0639, test_loss: 1.0691, test_f1: 0.3459
 epoch: 27, train_loss: 1.0563, test_loss: 1.0642, test_f1: 0.3479
 epoch: 28, train_loss: 1.0464, test_loss: 1.0692, test_f1: 0.3365
 epoch: 29, train_loss: 1.0404, test_loss: 1.0581, test_f1: 0.3479
 epoch: 30, train_loss: 1.0369, test_loss: 1.0544, test_f1: 0.3596
 epoch: 31, train_loss: 1.0387, test_loss: 1.0518, test_f1: 0.3705
 epoch: 32, train_loss: 1.0279, test_loss: 1.0512, test_f1: 0.3873
 epoch: 33, train_loss: 1.0207, test_loss: 1.0481, test_f1: 0.3953
 epoch: 34, train_loss: 1.0194, test_loss: 1.0511, test_f1: 0.4164
 epoch: 35, train_loss: 1.0106, test_loss: 1.0409, test_f1: 0.4213
 epoch: 36, train_loss: 1.0082, test_loss: 1.0390, test_f1: 0.4258
 epoch: 37, train_loss: 1.0087, test_loss: 1.0344, test_f1: 0.4360
 epoch: 38, train_loss: 0.9997, test_loss: 1.0332, test_f1: 0.4471
 epoch: 39, train_loss: 0.9949, test_loss: 1.0243, test_f1: 0.4612
 epoch: 40, train_loss: 0.9905, test_loss: 1.0197, test_f1: 0.4798
 epoch: 41, train_loss: 0.9843, test_loss: 1.0207, test_f1: 0.4677
 epoch: 42, train_loss: 0.9794, test_loss: 1.0191, test_f1: 0.4731
 epoch: 43, train_loss: 0.9749, test_loss: 1.0340, test_f1: 0.4830
 epoch: 44, train_loss: 0.9695, test_loss: 1.0151, test_f1: 0.4788
 epoch: 45, train_loss: 0.9673, test_loss: 1.0076, test_f1: 0.4881
 epoch: 46, train_loss: 0.9626, test_loss: 1.0086, test_f1: 0.4933
 epoch: 47, train_loss: 0.9629, test_loss: 1.0289, test_f1: 0.4794
 epoch: 48, train_loss: 0.9530, test_loss: 0.9968, test_f1: 0.4902
 epoch: 49, train_loss: 0.9529, test_loss: 0.9985, test_f1: 0.4944
 epoch: 50, train_loss: 0.9423, test_loss: 1.0262, test_f1: 0.4614
 epoch: 51, train_loss: 0.9532, test_loss: 0.9967, test_f1: 0.4928
 epoch: 52, train_loss: 0.9417, test_loss: 0.9938, test_f1: 0.4910
 epoch: 53, train_loss: 0.9343, test_loss: 0.9926, test_f1: 0.4881
 epoch: 54, train_loss: 0.9380, test_loss: 0.9917, test_f1: 0.5027
 epoch: 55, train_loss: 0.9434, test_loss: 0.9901, test_f1: 0.4950
 epoch: 56, train_loss: 0.9341, test_loss: 0.9872, test_f1: 0.4983
 epoch: 57, train_loss: 0.9292, test_loss: 0.9771, test_f1: 0.4956
 epoch: 58, train_loss: 0.9364, test_loss: 0.9818, test_f1: 0.4984
 epoch: 59, train_loss: 0.9369, test_loss: 0.9864, test_f1: 0.4941
 epoch: 60, train_loss: 0.9239, test_loss: 0.9874, test_f1: 0.4869
 epoch: 61, train_loss: 0.9288, test_loss: 0.9785, test_f1: 0.5021
 epoch: 62, train_loss: 0.9259, test_loss: 0.9743, test_f1: 0.4977
 epoch: 63, train_loss: 0.9344, test_loss: 0.9735, test_f1: 0.4975
 epoch: 64, train_loss: 0.9232, test_loss: 0.9737, test_f1: 0.5010
 epoch: 65, train_loss: 0.9184, test_loss: 0.9678, test_f1: 0.4986
 epoch: 66, train_loss: 0.9222, test_loss: 0.9680, test_f1: 0.4988
 epoch: 67, train_loss: 0.9255, test_loss: 0.9731, test_f1: 0.4929
 epoch: 68, train_loss: 0.9224, test_loss: 0.9729, test_f1: 0.4989
 epoch: 69, train_loss: 0.9280, test_loss: 0.9664, test_f1: 0.4998
 epoch: 70, train_loss: 0.9201, test_loss: 0.9664, test_f1: 0.5007
 epoch: 71, train_loss: 0.9152, test_loss: 0.9671, test_f1: 0.4998
 epoch: 72, train_loss: 0.9048, test_loss: 0.9580, test_f1: 0.4994
 epoch: 73, train_loss: 0.9199, test_loss: 0.9698, test_f1: 0.4968
 epoch: 74, train_loss: 0.9079, test_loss: 0.9622, test_f1: 0.5023
 epoch: 75, train_loss: 0.9090, test_loss: 0.9672, test_f1: 0.5016
 epoch: 76, train_loss: 0.9142, test_loss: 0.9630, test_f1: 0.5026
 epoch: 77, train_loss: 0.9109, test_loss: 0.9641, test_f1: 0.5028
 epoch: 78, train_loss: 0.9054, test_loss: 0.9635, test_f1: 0.4976
 epoch: 79, train_loss: 0.9084, test_loss: 0.9629, test_f1: 0.4978
 epoch: 80, train_loss: 0.9116, test_loss: 0.9613, test_f1: 0.4956
 epoch: 81, train_loss: 0.9107, test_loss: 0.9601, test_f1: 0.5047
 epoch: 82, train_loss: 0.9037, test_loss: 0.9666, test_f1: 0.4987
 epoch: 83, train_loss: 0.9056, test_loss: 0.9652, test_f1: 0.4979
 epoch: 84, train_loss: 0.8987, test_loss: 0.9485, test_f1: 0.5025
 epoch: 85, train_loss: 0.9015, test_loss: 0.9596, test_f1: 0.4981
 epoch: 86, train_loss: 0.8891, test_loss: 0.9585, test_f1: 0.4972
 epoch: 87, train_loss: 0.8958, test_loss: 0.9564, test_f1: 0.4964
 epoch: 88, train_loss: 0.8924, test_loss: 0.9562, test_f1: 0.4976
 epoch: 89, train_loss: 0.9034, test_loss: 0.9559, test_f1: 0.5026
 epoch: 90, train_loss: 0.8998, test_loss: 0.9578, test_f1: 0.4981
 epoch: 91, train_loss: 0.8977, test_loss: 0.9610, test_f1: 0.4983
 epoch: 92, train_loss: 0.8937, test_loss: 0.9595, test_f1: 0.4957
 epoch: 93, train_loss: 0.8902, test_loss: 0.9600, test_f1: 0.4964
 epoch: 94, train_loss: 0.8910, test_loss: 0.9529, test_f1: 0.4924
 epoch: 95, train_loss: 0.8837, test_loss: 0.9529, test_f1: 0.4935
 epoch: 96, train_loss: 0.8848, test_loss: 0.9563, test_f1: 0.4976
 epoch: 97, train_loss: 0.8930, test_loss: 0.9488, test_f1: 0.4975
 epoch: 98, train_loss: 0.8936, test_loss: 0.9530, test_f1: 0.5000
 epoch: 99, train_loss: 0.8863, test_loss: 0.9488, test_f1: 0.4986
##################ITERATION #1 ****************************************
 epoch: 0, train_loss: 1.3569, test_loss: 1.3749, test_f1: 0.2270
 epoch: 1, train_loss: 1.3342, test_loss: 1.3543, test_f1: 0.2819
 epoch: 2, train_loss: 1.3171, test_loss: 1.3074, test_f1: 0.3967
 epoch: 3, train_loss: 1.2981, test_loss: 1.2776, test_f1: 0.4118
 epoch: 4, train_loss: 1.2770, test_loss: 1.2527, test_f1: 0.4042
 epoch: 5, train_loss: 1.2547, test_loss: 1.2266, test_f1: 0.4022
 epoch: 6, train_loss: 1.2242, test_loss: 1.1992, test_f1: 0.3867
 epoch: 7, train_loss: 1.2042, test_loss: 1.1762, test_f1: 0.3790
 epoch: 8, train_loss: 1.1765, test_loss: 1.1561, test_f1: 0.3593
 epoch: 9, train_loss: 1.1557, test_loss: 1.1405, test_f1: 0.3628
 epoch: 10, train_loss: 1.1375, test_loss: 1.1251, test_f1: 0.3643
 epoch: 11, train_loss: 1.1186, test_loss: 1.1109, test_f1: 0.3655
 epoch: 12, train_loss: 1.1072, test_loss: 1.1028, test_f1: 0.3538
 epoch: 13, train_loss: 1.0933, test_loss: 1.0938, test_f1: 0.3560
 epoch: 14, train_loss: 1.0870, test_loss: 1.0884, test_f1: 0.3594
 epoch: 15, train_loss: 1.0779, test_loss: 1.0838, test_f1: 0.3764
 epoch: 16, train_loss: 1.0660, test_loss: 1.0830, test_f1: 0.3614
 epoch: 17, train_loss: 1.0622, test_loss: 1.0690, test_f1: 0.4084
 epoch: 18, train_loss: 1.0528, test_loss: 1.0746, test_f1: 0.3967
 epoch: 19, train_loss: 1.0471, test_loss: 1.0608, test_f1: 0.4221
 epoch: 20, train_loss: 1.0432, test_loss: 1.0612, test_f1: 0.4235
 epoch: 21, train_loss: 1.0327, test_loss: 1.0525, test_f1: 0.4304
 epoch: 22, train_loss: 1.0314, test_loss: 1.0514, test_f1: 0.4426
 epoch: 23, train_loss: 1.0201, test_loss: 1.0436, test_f1: 0.4480
 epoch: 24, train_loss: 1.0191, test_loss: 1.0372, test_f1: 0.4505
 epoch: 25, train_loss: 1.0144, test_loss: 1.0353, test_f1: 0.4502
 epoch: 26, train_loss: 1.0145, test_loss: 1.0289, test_f1: 0.4569
 epoch: 27, train_loss: 1.0052, test_loss: 1.0288, test_f1: 0.4666
 epoch: 28, train_loss: 1.0123, test_loss: 1.0366, test_f1: 0.4601
 epoch: 29, train_loss: 1.0028, test_loss: 1.0241, test_f1: 0.4656
 epoch: 30, train_loss: 0.9953, test_loss: 1.0122, test_f1: 0.4666
 epoch: 31, train_loss: 0.9922, test_loss: 1.0068, test_f1: 0.4662
 epoch: 32, train_loss: 0.9824, test_loss: 1.0095, test_f1: 0.4686
 epoch: 33, train_loss: 0.9942, test_loss: 1.0022, test_f1: 0.4654
 epoch: 34, train_loss: 0.9778, test_loss: 0.9965, test_f1: 0.4660
 epoch: 35, train_loss: 0.9775, test_loss: 0.9956, test_f1: 0.4763
 epoch: 36, train_loss: 0.9730, test_loss: 0.9939, test_f1: 0.4738
 epoch: 37, train_loss: 0.9809, test_loss: 0.9843, test_f1: 0.4727
 epoch: 38, train_loss: 0.9725, test_loss: 0.9895, test_f1: 0.4722
 epoch: 39, train_loss: 0.9722, test_loss: 0.9703, test_f1: 0.4796
 epoch: 40, train_loss: 0.9612, test_loss: 0.9734, test_f1: 0.4915
 epoch: 41, train_loss: 0.9613, test_loss: 0.9773, test_f1: 0.5066
 epoch: 42, train_loss: 0.9589, test_loss: 0.9682, test_f1: 0.5047
 epoch: 43, train_loss: 0.9453, test_loss: 0.9717, test_f1: 0.5056
 epoch: 44, train_loss: 0.9514, test_loss: 0.9808, test_f1: 0.4992
 epoch: 45, train_loss: 0.9609, test_loss: 0.9699, test_f1: 0.5021
 epoch: 46, train_loss: 0.9478, test_loss: 0.9719, test_f1: 0.5111
 epoch: 47, train_loss: 0.9471, test_loss: 0.9688, test_f1: 0.5049
 epoch: 48, train_loss: 0.9435, test_loss: 0.9527, test_f1: 0.5176
 epoch: 49, train_loss: 0.9461, test_loss: 0.9576, test_f1: 0.4928
 epoch: 50, train_loss: 0.9387, test_loss: 0.9582, test_f1: 0.4989
 epoch: 51, train_loss: 0.9306, test_loss: 0.9525, test_f1: 0.5087
 epoch: 52, train_loss: 0.9318, test_loss: 0.9545, test_f1: 0.5034
 epoch: 53, train_loss: 0.9330, test_loss: 0.9510, test_f1: 0.5119
 epoch: 54, train_loss: 0.9352, test_loss: 0.9388, test_f1: 0.5200
 epoch: 55, train_loss: 0.9357, test_loss: 0.9501, test_f1: 0.5119
 epoch: 56, train_loss: 0.9212, test_loss: 0.9487, test_f1: 0.5132
 epoch: 57, train_loss: 0.9262, test_loss: 0.9613, test_f1: 0.5146
 epoch: 58, train_loss: 0.9315, test_loss: 0.9471, test_f1: 0.5112
 epoch: 59, train_loss: 0.9276, test_loss: 0.9572, test_f1: 0.5104
 epoch: 60, train_loss: 0.9242, test_loss: 0.9439, test_f1: 0.5195
 epoch: 61, train_loss: 0.9247, test_loss: 0.9469, test_f1: 0.5181
 epoch: 62, train_loss: 0.9177, test_loss: 0.9449, test_f1: 0.5162
 epoch: 63, train_loss: 0.9249, test_loss: 0.9497, test_f1: 0.5221
 epoch: 64, train_loss: 0.9196, test_loss: 0.9498, test_f1: 0.5182
 epoch: 65, train_loss: 0.9216, test_loss: 0.9545, test_f1: 0.5067
 epoch: 66, train_loss: 0.9204, test_loss: 0.9434, test_f1: 0.5227
 epoch: 67, train_loss: 0.9190, test_loss: 0.9382, test_f1: 0.5202
 epoch: 68, train_loss: 0.9109, test_loss: 0.9361, test_f1: 0.5198
 epoch: 69, train_loss: 0.9151, test_loss: 0.9501, test_f1: 0.5198
 epoch: 70, train_loss: 0.9189, test_loss: 0.9442, test_f1: 0.5174
 epoch: 71, train_loss: 0.9076, test_loss: 0.9372, test_f1: 0.5232
 epoch: 72, train_loss: 0.9096, test_loss: 0.9450, test_f1: 0.5175
 epoch: 73, train_loss: 0.9077, test_loss: 0.9428, test_f1: 0.5169
 epoch: 74, train_loss: 0.9097, test_loss: 0.9441, test_f1: 0.5149
 epoch: 75, train_loss: 0.9118, test_loss: 0.9293, test_f1: 0.5219
 epoch: 76, train_loss: 0.9088, test_loss: 0.9416, test_f1: 0.5179
 epoch: 77, train_loss: 0.9075, test_loss: 0.9454, test_f1: 0.5237
 epoch: 78, train_loss: 0.9035, test_loss: 0.9473, test_f1: 0.5167
 epoch: 79, train_loss: 0.9125, test_loss: 0.9363, test_f1: 0.5192
 epoch: 80, train_loss: 0.9044, test_loss: 0.9348, test_f1: 0.5232
 epoch: 81, train_loss: 0.9048, test_loss: 0.9249, test_f1: 0.5307
 epoch: 82, train_loss: 0.9007, test_loss: 0.9299, test_f1: 0.5231
 epoch: 83, train_loss: 0.9072, test_loss: 0.9323, test_f1: 0.5200
 epoch: 84, train_loss: 0.9013, test_loss: 0.9185, test_f1: 0.5269
 epoch: 85, train_loss: 0.9001, test_loss: 0.9411, test_f1: 0.5274
 epoch: 86, train_loss: 0.9076, test_loss: 0.9404, test_f1: 0.5195
 epoch: 87, train_loss: 0.8962, test_loss: 0.9376, test_f1: 0.5171
 epoch: 88, train_loss: 0.8996, test_loss: 0.9331, test_f1: 0.5240
 epoch: 89, train_loss: 0.9005, test_loss: 0.9358, test_f1: 0.5222
 epoch: 90, train_loss: 0.8921, test_loss: 0.9397, test_f1: 0.5280
 epoch: 91, train_loss: 0.9005, test_loss: 0.9303, test_f1: 0.5188
 epoch: 92, train_loss: 0.8978, test_loss: 0.9406, test_f1: 0.5251
 epoch: 93, train_loss: 0.8960, test_loss: 0.9316, test_f1: 0.5213
 epoch: 94, train_loss: 0.8925, test_loss: 0.9234, test_f1: 0.5316
 epoch: 95, train_loss: 0.9011, test_loss: 0.9360, test_f1: 0.5270
 epoch: 96, train_loss: 0.8972, test_loss: 0.9277, test_f1: 0.5304
 epoch: 97, train_loss: 0.8944, test_loss: 0.9324, test_f1: 0.5233
 epoch: 98, train_loss: 0.8967, test_loss: 0.9301, test_f1: 0.5263
 epoch: 99, train_loss: 0.8997, test_loss: 0.9226, test_f1: 0.5259
##################ITERATION #2 ****************************************
 epoch: 0, train_loss: 1.3210, test_loss: 1.3351, test_f1: 0.2270
 epoch: 1, train_loss: 1.2979, test_loss: 1.3090, test_f1: 0.2270
 epoch: 2, train_loss: 1.2876, test_loss: 1.2830, test_f1: 0.2270
 epoch: 3, train_loss: 1.2737, test_loss: 1.2640, test_f1: 0.2270
 epoch: 4, train_loss: 1.2621, test_loss: 1.2484, test_f1: 0.2270
 epoch: 5, train_loss: 1.2454, test_loss: 1.2311, test_f1: 0.2270
 epoch: 6, train_loss: 1.2340, test_loss: 1.2166, test_f1: 0.2389
 epoch: 7, train_loss: 1.2219, test_loss: 1.2031, test_f1: 0.2499
 epoch: 8, train_loss: 1.2110, test_loss: 1.1851, test_f1: 0.2500
 epoch: 9, train_loss: 1.1939, test_loss: 1.1733, test_f1: 0.2660
 epoch: 10, train_loss: 1.1832, test_loss: 1.1520, test_f1: 0.3390
 epoch: 11, train_loss: 1.1675, test_loss: 1.1340, test_f1: 0.3824
 epoch: 12, train_loss: 1.1499, test_loss: 1.1144, test_f1: 0.4100
 epoch: 13, train_loss: 1.1343, test_loss: 1.0975, test_f1: 0.4001
 epoch: 14, train_loss: 1.1148, test_loss: 1.0778, test_f1: 0.4146
 epoch: 15, train_loss: 1.1028, test_loss: 1.0617, test_f1: 0.4170
 epoch: 16, train_loss: 1.0885, test_loss: 1.0468, test_f1: 0.4286
 epoch: 17, train_loss: 1.0748, test_loss: 1.0329, test_f1: 0.4281
 epoch: 18, train_loss: 1.0611, test_loss: 1.0232, test_f1: 0.4459
 epoch: 19, train_loss: 1.0471, test_loss: 1.0171, test_f1: 0.4374
 epoch: 20, train_loss: 1.0325, test_loss: 1.0093, test_f1: 0.4717
 epoch: 21, train_loss: 1.0313, test_loss: 1.0010, test_f1: 0.4833
 epoch: 22, train_loss: 1.0214, test_loss: 0.9950, test_f1: 0.4760
 epoch: 23, train_loss: 1.0153, test_loss: 0.9937, test_f1: 0.4876
 epoch: 24, train_loss: 1.0085, test_loss: 0.9937, test_f1: 0.4870
 epoch: 25, train_loss: 0.9952, test_loss: 0.9833, test_f1: 0.4960
 epoch: 26, train_loss: 0.9971, test_loss: 0.9813, test_f1: 0.4958
 epoch: 27, train_loss: 0.9851, test_loss: 0.9759, test_f1: 0.4937
 epoch: 28, train_loss: 0.9859, test_loss: 0.9750, test_f1: 0.4977
 epoch: 29, train_loss: 0.9831, test_loss: 0.9774, test_f1: 0.4769
 epoch: 30, train_loss: 0.9765, test_loss: 0.9717, test_f1: 0.5009
 epoch: 31, train_loss: 0.9675, test_loss: 0.9671, test_f1: 0.5039
 epoch: 32, train_loss: 0.9645, test_loss: 0.9629, test_f1: 0.4978
 epoch: 33, train_loss: 0.9595, test_loss: 0.9719, test_f1: 0.4989
 epoch: 34, train_loss: 0.9601, test_loss: 0.9551, test_f1: 0.5071
 epoch: 35, train_loss: 0.9535, test_loss: 0.9573, test_f1: 0.4927
 epoch: 36, train_loss: 0.9657, test_loss: 0.9568, test_f1: 0.5031
 epoch: 37, train_loss: 0.9511, test_loss: 0.9662, test_f1: 0.5066
 epoch: 38, train_loss: 0.9435, test_loss: 0.9517, test_f1: 0.4967
 epoch: 39, train_loss: 0.9414, test_loss: 0.9498, test_f1: 0.4988
 epoch: 40, train_loss: 0.9377, test_loss: 0.9480, test_f1: 0.5009
 epoch: 41, train_loss: 0.9393, test_loss: 0.9501, test_f1: 0.5086
 epoch: 42, train_loss: 0.9286, test_loss: 0.9458, test_f1: 0.5164
 epoch: 43, train_loss: 0.9386, test_loss: 0.9526, test_f1: 0.5037
 epoch: 44, train_loss: 0.9412, test_loss: 0.9384, test_f1: 0.5181
 epoch: 45, train_loss: 0.9249, test_loss: 0.9473, test_f1: 0.5150
 epoch: 46, train_loss: 0.9321, test_loss: 0.9457, test_f1: 0.5040
 epoch: 47, train_loss: 0.9198, test_loss: 0.9380, test_f1: 0.5126
 epoch: 48, train_loss: 0.9310, test_loss: 0.9330, test_f1: 0.5200
 epoch: 49, train_loss: 0.9149, test_loss: 0.9310, test_f1: 0.5089
 epoch: 50, train_loss: 0.9295, test_loss: 0.9474, test_f1: 0.4996
 epoch: 51, train_loss: 0.9142, test_loss: 0.9280, test_f1: 0.5202
 epoch: 52, train_loss: 0.9130, test_loss: 0.9354, test_f1: 0.5167
 epoch: 53, train_loss: 0.9092, test_loss: 0.9355, test_f1: 0.5182
 epoch: 54, train_loss: 0.9126, test_loss: 0.9348, test_f1: 0.5288
 epoch: 55, train_loss: 0.9036, test_loss: 0.9325, test_f1: 0.5247
 epoch: 56, train_loss: 0.9004, test_loss: 0.9276, test_f1: 0.5259
 epoch: 57, train_loss: 0.8997, test_loss: 0.9261, test_f1: 0.5247
 epoch: 58, train_loss: 0.9018, test_loss: 0.9256, test_f1: 0.5268
 epoch: 59, train_loss: 0.8951, test_loss: 0.9328, test_f1: 0.5230
 epoch: 60, train_loss: 0.9026, test_loss: 0.9314, test_f1: 0.5228
 epoch: 61, train_loss: 0.8994, test_loss: 0.9308, test_f1: 0.5118
 epoch: 62, train_loss: 0.9034, test_loss: 0.9287, test_f1: 0.5261
 epoch: 63, train_loss: 0.8963, test_loss: 0.9300, test_f1: 0.5264
 epoch: 64, train_loss: 0.8986, test_loss: 0.9322, test_f1: 0.5209
 epoch: 65, train_loss: 0.9078, test_loss: 0.9303, test_f1: 0.5241
 epoch: 66, train_loss: 0.8953, test_loss: 0.9246, test_f1: 0.5261
 epoch: 67, train_loss: 0.8958, test_loss: 0.9321, test_f1: 0.5216
 epoch: 68, train_loss: 0.8958, test_loss: 0.9278, test_f1: 0.5250
 epoch: 69, train_loss: 0.8952, test_loss: 0.9351, test_f1: 0.5119
 epoch: 70, train_loss: 0.8933, test_loss: 0.9338, test_f1: 0.5186
 epoch: 71, train_loss: 0.8906, test_loss: 0.9328, test_f1: 0.5181
 epoch: 72, train_loss: 0.8890, test_loss: 0.9287, test_f1: 0.5189
 epoch: 73, train_loss: 0.8855, test_loss: 0.9277, test_f1: 0.5215
 epoch: 74, train_loss: 0.8874, test_loss: 0.9292, test_f1: 0.5195
 epoch: 75, train_loss: 0.8895, test_loss: 0.9226, test_f1: 0.5195
 epoch: 76, train_loss: 0.8871, test_loss: 0.9255, test_f1: 0.5261
 epoch: 77, train_loss: 0.8902, test_loss: 0.9260, test_f1: 0.5196
 epoch: 78, train_loss: 0.8881, test_loss: 0.9225, test_f1: 0.5283
 epoch: 79, train_loss: 0.8874, test_loss: 0.9261, test_f1: 0.5172
 epoch: 80, train_loss: 0.8869, test_loss: 0.9270, test_f1: 0.5156
 epoch: 81, train_loss: 0.8845, test_loss: 0.9275, test_f1: 0.5236
 epoch: 82, train_loss: 0.8835, test_loss: 0.9241, test_f1: 0.5323
 epoch: 83, train_loss: 0.8844, test_loss: 0.9226, test_f1: 0.5140
 epoch: 84, train_loss: 0.8791, test_loss: 0.9290, test_f1: 0.5203
 epoch: 85, train_loss: 0.8761, test_loss: 0.9242, test_f1: 0.5193
 epoch: 86, train_loss: 0.8779, test_loss: 0.9239, test_f1: 0.5205
 epoch: 87, train_loss: 0.8726, test_loss: 0.9236, test_f1: 0.5256
 epoch: 88, train_loss: 0.8773, test_loss: 0.9256, test_f1: 0.5216
 epoch: 89, train_loss: 0.8701, test_loss: 0.9199, test_f1: 0.5279
 epoch: 90, train_loss: 0.8821, test_loss: 0.9171, test_f1: 0.5278
 epoch: 91, train_loss: 0.8819, test_loss: 0.9207, test_f1: 0.5208
 epoch: 92, train_loss: 0.8710, test_loss: 0.9243, test_f1: 0.5294
 epoch: 93, train_loss: 0.8800, test_loss: 0.9261, test_f1: 0.5327
 epoch: 94, train_loss: 0.8739, test_loss: 0.9228, test_f1: 0.5333
 epoch: 95, train_loss: 0.8698, test_loss: 0.9228, test_f1: 0.5323
 epoch: 96, train_loss: 0.8727, test_loss: 0.9162, test_f1: 0.5403
 epoch: 97, train_loss: 0.8694, test_loss: 0.9192, test_f1: 0.5348
 epoch: 98, train_loss: 0.8659, test_loss: 0.9264, test_f1: 0.5354
 epoch: 99, train_loss: 0.8690, test_loss: 0.9262, test_f1: 0.5377
##################ITERATION #3 ****************************************
 epoch: 0, train_loss: 1.3045, test_loss: 1.3371, test_f1: 0.2270
 epoch: 1, train_loss: 1.2665, test_loss: 1.3090, test_f1: 0.2270
 epoch: 2, train_loss: 1.2388, test_loss: 1.2499, test_f1: 0.3044
 epoch: 3, train_loss: 1.2172, test_loss: 1.1956, test_f1: 0.3324
 epoch: 4, train_loss: 1.1944, test_loss: 1.1719, test_f1: 0.3486
 epoch: 5, train_loss: 1.1720, test_loss: 1.1503, test_f1: 0.3456
 epoch: 6, train_loss: 1.1489, test_loss: 1.1383, test_f1: 0.3495
 epoch: 7, train_loss: 1.1286, test_loss: 1.1204, test_f1: 0.3555
 epoch: 8, train_loss: 1.1160, test_loss: 1.1104, test_f1: 0.3560
 epoch: 9, train_loss: 1.1016, test_loss: 1.1022, test_f1: 0.3736
 epoch: 10, train_loss: 1.0863, test_loss: 1.0858, test_f1: 0.3892
 epoch: 11, train_loss: 1.0741, test_loss: 1.0796, test_f1: 0.3795
 epoch: 12, train_loss: 1.0623, test_loss: 1.0877, test_f1: 0.3997
 epoch: 13, train_loss: 1.0538, test_loss: 1.0632, test_f1: 0.4102
 epoch: 14, train_loss: 1.0409, test_loss: 1.0572, test_f1: 0.4343
 epoch: 15, train_loss: 1.0316, test_loss: 1.0428, test_f1: 0.4411
 epoch: 16, train_loss: 1.0237, test_loss: 1.0464, test_f1: 0.4501
 epoch: 17, train_loss: 1.0126, test_loss: 1.0409, test_f1: 0.4455
 epoch: 18, train_loss: 1.0083, test_loss: 1.0242, test_f1: 0.4551
 epoch: 19, train_loss: 1.0035, test_loss: 1.0299, test_f1: 0.4671
 epoch: 20, train_loss: 0.9909, test_loss: 1.0079, test_f1: 0.4736
 epoch: 21, train_loss: 0.9883, test_loss: 1.0105, test_f1: 0.4816
 epoch: 22, train_loss: 0.9817, test_loss: 0.9991, test_f1: 0.5061
 epoch: 23, train_loss: 0.9758, test_loss: 1.0135, test_f1: 0.4938
 epoch: 24, train_loss: 0.9709, test_loss: 1.0243, test_f1: 0.4795
 epoch: 25, train_loss: 0.9608, test_loss: 0.9780, test_f1: 0.4961
 epoch: 26, train_loss: 0.9611, test_loss: 0.9814, test_f1: 0.5053
 epoch: 27, train_loss: 0.9506, test_loss: 0.9772, test_f1: 0.5047
 epoch: 28, train_loss: 0.9530, test_loss: 0.9644, test_f1: 0.5026
 epoch: 29, train_loss: 0.9412, test_loss: 0.9823, test_f1: 0.4991
 epoch: 30, train_loss: 0.9427, test_loss: 0.9508, test_f1: 0.5100
 epoch: 31, train_loss: 0.9356, test_loss: 0.9364, test_f1: 0.5045
 epoch: 32, train_loss: 0.9339, test_loss: 0.9823, test_f1: 0.4975
 epoch: 33, train_loss: 0.9330, test_loss: 0.9254, test_f1: 0.5140
 epoch: 34, train_loss: 0.9246, test_loss: 0.9554, test_f1: 0.5059
 epoch: 35, train_loss: 0.9217, test_loss: 0.9423, test_f1: 0.5041
 epoch: 36, train_loss: 0.9103, test_loss: 0.9709, test_f1: 0.5025
 epoch: 37, train_loss: 0.9148, test_loss: 0.9318, test_f1: 0.5121
 epoch: 38, train_loss: 0.9160, test_loss: 0.9040, test_f1: 0.5156
 epoch: 39, train_loss: 0.9138, test_loss: 0.9168, test_f1: 0.5052
 epoch: 40, train_loss: 0.9016, test_loss: 0.9238, test_f1: 0.5129
 epoch: 41, train_loss: 0.9025, test_loss: 0.9262, test_f1: 0.5047
 epoch: 42, train_loss: 0.9067, test_loss: 0.9179, test_f1: 0.5100
 epoch: 43, train_loss: 0.8981, test_loss: 0.9149, test_f1: 0.5034
 epoch: 44, train_loss: 0.8946, test_loss: 0.9116, test_f1: 0.4984
 epoch: 45, train_loss: 0.8975, test_loss: 0.9132, test_f1: 0.5105
 epoch: 46, train_loss: 0.8946, test_loss: 0.9093, test_f1: 0.5124
 epoch: 47, train_loss: 0.8852, test_loss: 0.9139, test_f1: 0.4996
 epoch: 48, train_loss: 0.8825, test_loss: 0.9223, test_f1: 0.5186
 epoch: 49, train_loss: 0.8878, test_loss: 0.8999, test_f1: 0.5193
 epoch: 50, train_loss: 0.8866, test_loss: 0.9317, test_f1: 0.5189
 epoch: 51, train_loss: 0.8817, test_loss: 0.9381, test_f1: 0.5127
 epoch: 52, train_loss: 0.8803, test_loss: 0.9125, test_f1: 0.5114
 epoch: 53, train_loss: 0.8728, test_loss: 0.8973, test_f1: 0.5381
 epoch: 54, train_loss: 0.8723, test_loss: 0.9197, test_f1: 0.5253
 epoch: 55, train_loss: 0.8698, test_loss: 0.9196, test_f1: 0.5201
 epoch: 56, train_loss: 0.8613, test_loss: 0.8944, test_f1: 0.5365
 epoch: 57, train_loss: 0.8669, test_loss: 0.9150, test_f1: 0.5230
 epoch: 58, train_loss: 0.8738, test_loss: 0.9082, test_f1: 0.5141
 epoch: 59, train_loss: 0.8750, test_loss: 0.8911, test_f1: 0.5256
 epoch: 60, train_loss: 0.8610, test_loss: 0.9052, test_f1: 0.5228
 epoch: 61, train_loss: 0.8654, test_loss: 0.9188, test_f1: 0.5136
 epoch: 62, train_loss: 0.8688, test_loss: 0.9142, test_f1: 0.5173
 epoch: 63, train_loss: 0.8641, test_loss: 0.8979, test_f1: 0.5338
 epoch: 64, train_loss: 0.8598, test_loss: 0.8942, test_f1: 0.5289
 epoch: 65, train_loss: 0.8605, test_loss: 0.9272, test_f1: 0.5222
 epoch: 66, train_loss: 0.8658, test_loss: 0.9393, test_f1: 0.5230
 epoch: 67, train_loss: 0.8696, test_loss: 0.8980, test_f1: 0.5250
 epoch: 68, train_loss: 0.8582, test_loss: 0.9188, test_f1: 0.5217
 epoch: 69, train_loss: 0.8564, test_loss: 0.8953, test_f1: 0.5399
 epoch: 70, train_loss: 0.8647, test_loss: 0.9000, test_f1: 0.5293
 epoch: 71, train_loss: 0.8625, test_loss: 0.8913, test_f1: 0.5294
 epoch: 72, train_loss: 0.8505, test_loss: 0.9010, test_f1: 0.5215
 epoch: 73, train_loss: 0.8562, test_loss: 0.8979, test_f1: 0.5376
 epoch: 74, train_loss: 0.8477, test_loss: 0.9147, test_f1: 0.5176
 epoch: 75, train_loss: 0.8488, test_loss: 0.9082, test_f1: 0.5264
 epoch: 76, train_loss: 0.8479, test_loss: 0.9045, test_f1: 0.5188
 epoch: 77, train_loss: 0.8515, test_loss: 0.9104, test_f1: 0.5253
 epoch: 78, train_loss: 0.8497, test_loss: 0.8906, test_f1: 0.5373
 epoch: 79, train_loss: 0.8536, test_loss: 0.9144, test_f1: 0.5194
 epoch: 80, train_loss: 0.8465, test_loss: 0.8775, test_f1: 0.5335
 epoch: 81, train_loss: 0.8477, test_loss: 0.8905, test_f1: 0.5361
 epoch: 82, train_loss: 0.8489, test_loss: 0.8831, test_f1: 0.5375
 epoch: 83, train_loss: 0.8482, test_loss: 0.8862, test_f1: 0.5373
 epoch: 84, train_loss: 0.8454, test_loss: 0.8999, test_f1: 0.5316
 epoch: 85, train_loss: 0.8454, test_loss: 0.9027, test_f1: 0.5322
 epoch: 86, train_loss: 0.8537, test_loss: 0.8915, test_f1: 0.5381
 epoch: 87, train_loss: 0.8444, test_loss: 0.8874, test_f1: 0.5339
 epoch: 88, train_loss: 0.8459, test_loss: 0.9029, test_f1: 0.5314
 epoch: 89, train_loss: 0.8398, test_loss: 0.8907, test_f1: 0.5337
 epoch: 90, train_loss: 0.8446, test_loss: 0.8971, test_f1: 0.5402
 epoch: 91, train_loss: 0.8400, test_loss: 0.8941, test_f1: 0.5332
 epoch: 92, train_loss: 0.8363, test_loss: 0.8930, test_f1: 0.5321
 epoch: 93, train_loss: 0.8316, test_loss: 0.9023, test_f1: 0.5303
 epoch: 94, train_loss: 0.8393, test_loss: 0.8994, test_f1: 0.5327
 epoch: 95, train_loss: 0.8335, test_loss: 0.8898, test_f1: 0.5379
 epoch: 96, train_loss: 0.8279, test_loss: 0.8855, test_f1: 0.5392
 epoch: 97, train_loss: 0.8337, test_loss: 0.8936, test_f1: 0.5348
 epoch: 98, train_loss: 0.8321, test_loss: 0.9011, test_f1: 0.5403
 epoch: 99, train_loss: 0.8335, test_loss: 0.9026, test_f1: 0.5322
##################ITERATION #4 ****************************************
 epoch: 0, train_loss: 1.2845, test_loss: 1.3131, test_f1: 0.2270
 epoch: 1, train_loss: 1.2322, test_loss: 1.2460, test_f1: 0.2295
 epoch: 2, train_loss: 1.2051, test_loss: 1.1941, test_f1: 0.3157
 epoch: 3, train_loss: 1.1785, test_loss: 1.1567, test_f1: 0.3858
 epoch: 4, train_loss: 1.1545, test_loss: 1.1345, test_f1: 0.4006
 epoch: 5, train_loss: 1.1417, test_loss: 1.1191, test_f1: 0.4346
 epoch: 6, train_loss: 1.1242, test_loss: 1.1004, test_f1: 0.4243
 epoch: 7, train_loss: 1.1083, test_loss: 1.0908, test_f1: 0.4260
 epoch: 8, train_loss: 1.0897, test_loss: 1.0809, test_f1: 0.4364
 epoch: 9, train_loss: 1.0835, test_loss: 1.0734, test_f1: 0.4270
 epoch: 10, train_loss: 1.0651, test_loss: 1.0645, test_f1: 0.4226
 epoch: 11, train_loss: 1.0602, test_loss: 1.0587, test_f1: 0.4390
 epoch: 12, train_loss: 1.0492, test_loss: 1.0540, test_f1: 0.4324
 epoch: 13, train_loss: 1.0506, test_loss: 1.0475, test_f1: 0.4442
 epoch: 14, train_loss: 1.0367, test_loss: 1.0468, test_f1: 0.4433
 epoch: 15, train_loss: 1.0328, test_loss: 1.0471, test_f1: 0.4574
 epoch: 16, train_loss: 1.0267, test_loss: 1.0307, test_f1: 0.4486
 epoch: 17, train_loss: 1.0179, test_loss: 1.0272, test_f1: 0.4571
 epoch: 18, train_loss: 1.0131, test_loss: 1.0266, test_f1: 0.4579
 epoch: 19, train_loss: 1.0125, test_loss: 1.0161, test_f1: 0.4695
 epoch: 20, train_loss: 1.0054, test_loss: 1.0101, test_f1: 0.4846
 epoch: 21, train_loss: 1.0014, test_loss: 1.0073, test_f1: 0.4826
 epoch: 22, train_loss: 0.9976, test_loss: 1.0050, test_f1: 0.4846
 epoch: 23, train_loss: 0.9894, test_loss: 0.9961, test_f1: 0.4823
 epoch: 24, train_loss: 0.9894, test_loss: 0.9975, test_f1: 0.4790
 epoch: 25, train_loss: 0.9789, test_loss: 0.9951, test_f1: 0.4727
 epoch: 26, train_loss: 0.9869, test_loss: 0.9834, test_f1: 0.4833
 epoch: 27, train_loss: 0.9755, test_loss: 0.9832, test_f1: 0.4890
 epoch: 28, train_loss: 0.9665, test_loss: 0.9913, test_f1: 0.4815
 epoch: 29, train_loss: 0.9631, test_loss: 0.9829, test_f1: 0.4879
 epoch: 30, train_loss: 0.9589, test_loss: 0.9785, test_f1: 0.4905
 epoch: 31, train_loss: 0.9579, test_loss: 0.9874, test_f1: 0.4795
 epoch: 32, train_loss: 0.9516, test_loss: 0.9663, test_f1: 0.4857
 epoch: 33, train_loss: 0.9487, test_loss: 0.9568, test_f1: 0.4923
 epoch: 34, train_loss: 0.9504, test_loss: 0.9523, test_f1: 0.4930
 epoch: 35, train_loss: 0.9434, test_loss: 0.9651, test_f1: 0.4965
 epoch: 36, train_loss: 0.9463, test_loss: 0.9582, test_f1: 0.5063
 epoch: 37, train_loss: 0.9324, test_loss: 0.9511, test_f1: 0.5013
 epoch: 38, train_loss: 0.9323, test_loss: 0.9491, test_f1: 0.5133
 epoch: 39, train_loss: 0.9291, test_loss: 0.9406, test_f1: 0.4969
 epoch: 40, train_loss: 0.9252, test_loss: 0.9316, test_f1: 0.5098
 epoch: 41, train_loss: 0.9245, test_loss: 0.9447, test_f1: 0.5142
 epoch: 42, train_loss: 0.9225, test_loss: 0.9478, test_f1: 0.5176
 epoch: 43, train_loss: 0.9129, test_loss: 0.9419, test_f1: 0.5186
 epoch: 44, train_loss: 0.9096, test_loss: 0.9395, test_f1: 0.5211
 epoch: 45, train_loss: 0.9025, test_loss: 0.9388, test_f1: 0.5196
 epoch: 46, train_loss: 0.9145, test_loss: 0.9450, test_f1: 0.5210
 epoch: 47, train_loss: 0.9087, test_loss: 0.9181, test_f1: 0.5159
 epoch: 48, train_loss: 0.8956, test_loss: 0.9188, test_f1: 0.5216
 epoch: 49, train_loss: 0.9035, test_loss: 0.9173, test_f1: 0.5231
 epoch: 50, train_loss: 0.9007, test_loss: 0.9289, test_f1: 0.5180
 epoch: 51, train_loss: 0.8914, test_loss: 0.9223, test_f1: 0.5215
 epoch: 52, train_loss: 0.8928, test_loss: 0.9183, test_f1: 0.5273
 epoch: 53, train_loss: 0.8873, test_loss: 0.9133, test_f1: 0.5244
 epoch: 54, train_loss: 0.8846, test_loss: 0.9119, test_f1: 0.5182
 epoch: 55, train_loss: 0.8888, test_loss: 0.9148, test_f1: 0.5257
 epoch: 56, train_loss: 0.8833, test_loss: 0.9134, test_f1: 0.5236
 epoch: 57, train_loss: 0.8887, test_loss: 0.9014, test_f1: 0.5286
 epoch: 58, train_loss: 0.8855, test_loss: 0.9052, test_f1: 0.5301
 epoch: 59, train_loss: 0.8844, test_loss: 0.9030, test_f1: 0.5238
 epoch: 60, train_loss: 0.8868, test_loss: 0.9113, test_f1: 0.5228
 epoch: 61, train_loss: 0.8814, test_loss: 0.9018, test_f1: 0.5118
 epoch: 62, train_loss: 0.8762, test_loss: 0.9023, test_f1: 0.5228
 epoch: 63, train_loss: 0.8767, test_loss: 0.8976, test_f1: 0.5278
 epoch: 64, train_loss: 0.8833, test_loss: 0.9099, test_f1: 0.5279
 epoch: 65, train_loss: 0.8786, test_loss: 0.9051, test_f1: 0.5291
 epoch: 66, train_loss: 0.8730, test_loss: 0.8946, test_f1: 0.5265
 epoch: 67, train_loss: 0.8725, test_loss: 0.8966, test_f1: 0.5210
 epoch: 68, train_loss: 0.8755, test_loss: 0.9045, test_f1: 0.5309
 epoch: 69, train_loss: 0.8628, test_loss: 0.8946, test_f1: 0.5265
 epoch: 70, train_loss: 0.8792, test_loss: 0.8999, test_f1: 0.5188
 epoch: 71, train_loss: 0.8637, test_loss: 0.9015, test_f1: 0.5344
 epoch: 72, train_loss: 0.8722, test_loss: 0.9009, test_f1: 0.5300
 epoch: 73, train_loss: 0.8703, test_loss: 0.8985, test_f1: 0.5210
 epoch: 74, train_loss: 0.8658, test_loss: 0.9104, test_f1: 0.5289
 epoch: 75, train_loss: 0.8700, test_loss: 0.8953, test_f1: 0.5240
 epoch: 76, train_loss: 0.8581, test_loss: 0.9001, test_f1: 0.5246
 epoch: 77, train_loss: 0.8664, test_loss: 0.8888, test_f1: 0.5225
 epoch: 78, train_loss: 0.8638, test_loss: 0.8882, test_f1: 0.5225
 epoch: 79, train_loss: 0.8561, test_loss: 0.8971, test_f1: 0.5231
 epoch: 80, train_loss: 0.8684, test_loss: 0.8859, test_f1: 0.5233
 epoch: 81, train_loss: 0.8622, test_loss: 0.9021, test_f1: 0.5298
 epoch: 82, train_loss: 0.8639, test_loss: 0.8943, test_f1: 0.5290
 epoch: 83, train_loss: 0.8590, test_loss: 0.8922, test_f1: 0.5339
 epoch: 84, train_loss: 0.8572, test_loss: 0.8968, test_f1: 0.5245
 epoch: 85, train_loss: 0.8606, test_loss: 0.8945, test_f1: 0.5227
 epoch: 86, train_loss: 0.8522, test_loss: 0.8903, test_f1: 0.5309
 epoch: 87, train_loss: 0.8537, test_loss: 0.8948, test_f1: 0.5181
 epoch: 88, train_loss: 0.8565, test_loss: 0.8936, test_f1: 0.5216
 epoch: 89, train_loss: 0.8569, test_loss: 0.8964, test_f1: 0.5269
 epoch: 90, train_loss: 0.8469, test_loss: 0.8911, test_f1: 0.5223
 epoch: 91, train_loss: 0.8511, test_loss: 0.9024, test_f1: 0.5283
 epoch: 92, train_loss: 0.8542, test_loss: 0.8842, test_f1: 0.5296
 epoch: 93, train_loss: 0.8521, test_loss: 0.8858, test_f1: 0.5265
 epoch: 94, train_loss: 0.8507, test_loss: 0.8895, test_f1: 0.5385
 epoch: 95, train_loss: 0.8474, test_loss: 0.8898, test_f1: 0.5201
 epoch: 96, train_loss: 0.8508, test_loss: 0.8883, test_f1: 0.5222
 epoch: 97, train_loss: 0.8456, test_loss: 0.8806, test_f1: 0.5247
 epoch: 98, train_loss: 0.8429, test_loss: 0.8959, test_f1: 0.5317
 epoch: 99, train_loss: 0.8437, test_loss: 0.8856, test_f1: 0.5257
##################ITERATION #5 ****************************************
 epoch: 0, train_loss: 1.2478, test_loss: 1.3680, test_f1: 0.2270
 epoch: 1, train_loss: 1.1800, test_loss: 1.2652, test_f1: 0.3154
 epoch: 2, train_loss: 1.1514, test_loss: 1.1308, test_f1: 0.3407
 epoch: 3, train_loss: 1.1287, test_loss: 1.0898, test_f1: 0.3445
 epoch: 4, train_loss: 1.1165, test_loss: 1.0752, test_f1: 0.3468
 epoch: 5, train_loss: 1.0937, test_loss: 1.0631, test_f1: 0.3594
 epoch: 6, train_loss: 1.0797, test_loss: 1.0563, test_f1: 0.3649
 epoch: 7, train_loss: 1.0690, test_loss: 1.0456, test_f1: 0.3709
 epoch: 8, train_loss: 1.0598, test_loss: 1.0457, test_f1: 0.3858
 epoch: 9, train_loss: 1.0517, test_loss: 1.0412, test_f1: 0.4004
 epoch: 10, train_loss: 1.0387, test_loss: 1.0322, test_f1: 0.4216
 epoch: 11, train_loss: 1.0270, test_loss: 1.0178, test_f1: 0.4372
 epoch: 12, train_loss: 1.0293, test_loss: 1.0170, test_f1: 0.4432
 epoch: 13, train_loss: 1.0142, test_loss: 1.0225, test_f1: 0.4559
 epoch: 14, train_loss: 1.0111, test_loss: 1.0087, test_f1: 0.4682
 epoch: 15, train_loss: 0.9966, test_loss: 0.9932, test_f1: 0.4808
 epoch: 16, train_loss: 0.9962, test_loss: 0.9983, test_f1: 0.4827
 epoch: 17, train_loss: 0.9868, test_loss: 0.9919, test_f1: 0.4786
 epoch: 18, train_loss: 0.9821, test_loss: 0.9921, test_f1: 0.4848
 epoch: 19, train_loss: 0.9777, test_loss: 0.9814, test_f1: 0.4854
 epoch: 20, train_loss: 0.9666, test_loss: 0.9742, test_f1: 0.4932
 epoch: 21, train_loss: 0.9581, test_loss: 0.9719, test_f1: 0.5023
 epoch: 22, train_loss: 0.9553, test_loss: 0.9722, test_f1: 0.5021
 epoch: 23, train_loss: 0.9509, test_loss: 0.9624, test_f1: 0.5049
 epoch: 24, train_loss: 0.9562, test_loss: 0.9622, test_f1: 0.5013
 epoch: 25, train_loss: 0.9376, test_loss: 0.9660, test_f1: 0.5128
 epoch: 26, train_loss: 0.9395, test_loss: 0.9450, test_f1: 0.5061
 epoch: 27, train_loss: 0.9314, test_loss: 0.9498, test_f1: 0.5116
 epoch: 28, train_loss: 0.9166, test_loss: 0.9514, test_f1: 0.5067
 epoch: 29, train_loss: 0.9263, test_loss: 0.9476, test_f1: 0.5049
 epoch: 30, train_loss: 0.9165, test_loss: 0.9470, test_f1: 0.5066
 epoch: 31, train_loss: 0.9111, test_loss: 0.9461, test_f1: 0.5086
 epoch: 32, train_loss: 0.9007, test_loss: 0.9554, test_f1: 0.5043
 epoch: 33, train_loss: 0.9000, test_loss: 0.9496, test_f1: 0.5136
 epoch: 34, train_loss: 0.9054, test_loss: 0.9417, test_f1: 0.5214
 epoch: 35, train_loss: 0.9028, test_loss: 0.9448, test_f1: 0.5230
 epoch: 36, train_loss: 0.8939, test_loss: 0.9494, test_f1: 0.5213
 epoch: 37, train_loss: 0.8924, test_loss: 0.9427, test_f1: 0.5247
 epoch: 38, train_loss: 0.8917, test_loss: 0.9278, test_f1: 0.5261
 epoch: 39, train_loss: 0.8852, test_loss: 0.9418, test_f1: 0.5307
 epoch: 40, train_loss: 0.8811, test_loss: 0.9257, test_f1: 0.5310
 epoch: 41, train_loss: 0.8843, test_loss: 0.9308, test_f1: 0.5282
 epoch: 42, train_loss: 0.8759, test_loss: 0.9176, test_f1: 0.5217
 epoch: 43, train_loss: 0.8761, test_loss: 0.9365, test_f1: 0.5305
 epoch: 44, train_loss: 0.8719, test_loss: 0.9233, test_f1: 0.5285
 epoch: 45, train_loss: 0.8734, test_loss: 0.9188, test_f1: 0.5324
 epoch: 46, train_loss: 0.8773, test_loss: 0.9094, test_f1: 0.5306
 epoch: 47, train_loss: 0.8717, test_loss: 0.9234, test_f1: 0.5387
 epoch: 48, train_loss: 0.8637, test_loss: 0.9062, test_f1: 0.5427
 epoch: 49, train_loss: 0.8628, test_loss: 0.9430, test_f1: 0.5315
 epoch: 50, train_loss: 0.8652, test_loss: 0.9160, test_f1: 0.5406
 epoch: 51, train_loss: 0.8538, test_loss: 0.9258, test_f1: 0.5378
 epoch: 52, train_loss: 0.8505, test_loss: 0.9087, test_f1: 0.5459
 epoch: 53, train_loss: 0.8491, test_loss: 0.9335, test_f1: 0.5377
 epoch: 54, train_loss: 0.8571, test_loss: 0.9153, test_f1: 0.5424
 epoch: 55, train_loss: 0.8487, test_loss: 0.9122, test_f1: 0.5445
 epoch: 56, train_loss: 0.8453, test_loss: 0.9032, test_f1: 0.5473
 epoch: 57, train_loss: 0.8504, test_loss: 0.9167, test_f1: 0.5477
 epoch: 58, train_loss: 0.8440, test_loss: 0.9259, test_f1: 0.5411
 epoch: 59, train_loss: 0.8495, test_loss: 0.9090, test_f1: 0.5436
 epoch: 60, train_loss: 0.8518, test_loss: 0.9045, test_f1: 0.5447
 epoch: 61, train_loss: 0.8413, test_loss: 0.9279, test_f1: 0.5392
 epoch: 62, train_loss: 0.8385, test_loss: 0.8952, test_f1: 0.5455
 epoch: 63, train_loss: 0.8400, test_loss: 0.9098, test_f1: 0.5394
 epoch: 64, train_loss: 0.8427, test_loss: 0.9092, test_f1: 0.5434
 epoch: 65, train_loss: 0.8385, test_loss: 0.9254, test_f1: 0.5441
 epoch: 66, train_loss: 0.8371, test_loss: 0.9305, test_f1: 0.5477
 epoch: 67, train_loss: 0.8324, test_loss: 0.9126, test_f1: 0.5516
 epoch: 68, train_loss: 0.8371, test_loss: 0.9209, test_f1: 0.5524
 epoch: 69, train_loss: 0.8340, test_loss: 0.9148, test_f1: 0.5499
 epoch: 70, train_loss: 0.8342, test_loss: 0.9164, test_f1: 0.5484
 epoch: 71, train_loss: 0.8290, test_loss: 0.9177, test_f1: 0.5452
 epoch: 72, train_loss: 0.8262, test_loss: 0.9221, test_f1: 0.5512
 epoch: 73, train_loss: 0.8307, test_loss: 0.8991, test_f1: 0.5464
 epoch: 74, train_loss: 0.8361, test_loss: 0.9111, test_f1: 0.5466
 epoch: 75, train_loss: 0.8292, test_loss: 0.9246, test_f1: 0.5468
 epoch: 76, train_loss: 0.8298, test_loss: 0.9061, test_f1: 0.5469
 epoch: 77, train_loss: 0.8297, test_loss: 0.9024, test_f1: 0.5431
 epoch: 78, train_loss: 0.8149, test_loss: 0.9000, test_f1: 0.5457
 epoch: 79, train_loss: 0.8283, test_loss: 0.9069, test_f1: 0.5472
 epoch: 80, train_loss: 0.8260, test_loss: 0.9156, test_f1: 0.5524
 epoch: 81, train_loss: 0.8148, test_loss: 0.9065, test_f1: 0.5498
 epoch: 82, train_loss: 0.8241, test_loss: 0.9238, test_f1: 0.5487
 epoch: 83, train_loss: 0.8230, test_loss: 0.9099, test_f1: 0.5570
 epoch: 84, train_loss: 0.8284, test_loss: 0.9126, test_f1: 0.5445
 epoch: 85, train_loss: 0.8231, test_loss: 0.9138, test_f1: 0.5486
 epoch: 86, train_loss: 0.8131, test_loss: 0.9071, test_f1: 0.5468
 epoch: 87, train_loss: 0.8160, test_loss: 0.9094, test_f1: 0.5484
 epoch: 88, train_loss: 0.8165, test_loss: 0.9235, test_f1: 0.5510
 epoch: 89, train_loss: 0.8153, test_loss: 0.8977, test_f1: 0.5499
 epoch: 90, train_loss: 0.8130, test_loss: 0.9111, test_f1: 0.5496
 epoch: 91, train_loss: 0.8239, test_loss: 0.8928, test_f1: 0.5456
 epoch: 92, train_loss: 0.8079, test_loss: 0.9123, test_f1: 0.5541
 epoch: 93, train_loss: 0.8054, test_loss: 0.8978, test_f1: 0.5542
 epoch: 94, train_loss: 0.8071, test_loss: 0.8991, test_f1: 0.5487
 epoch: 95, train_loss: 0.8020, test_loss: 0.9197, test_f1: 0.5449
 epoch: 96, train_loss: 0.8056, test_loss: 0.8939, test_f1: 0.5514
 epoch: 97, train_loss: 0.8036, test_loss: 0.9044, test_f1: 0.5464
 epoch: 98, train_loss: 0.8010, test_loss: 0.9114, test_f1: 0.5519
 epoch: 99, train_loss: 0.8104, test_loss: 0.9055, test_f1: 0.5520
##################ITERATION #6 ****************************************
 epoch: 0, train_loss: 1.3086, test_loss: 1.3664, test_f1: 0.2270
 epoch: 1, train_loss: 1.2351, test_loss: 1.2402, test_f1: 0.3207
 epoch: 2, train_loss: 1.1951, test_loss: 1.1647, test_f1: 0.3477
 epoch: 3, train_loss: 1.1729, test_loss: 1.1269, test_f1: 0.3564
 epoch: 4, train_loss: 1.1394, test_loss: 1.1050, test_f1: 0.3708
 epoch: 5, train_loss: 1.1203, test_loss: 1.0905, test_f1: 0.3996
 epoch: 6, train_loss: 1.1048, test_loss: 1.0736, test_f1: 0.4252
 epoch: 7, train_loss: 1.0913, test_loss: 1.0618, test_f1: 0.4337
 epoch: 8, train_loss: 1.0708, test_loss: 1.0502, test_f1: 0.4435
 epoch: 9, train_loss: 1.0578, test_loss: 1.0517, test_f1: 0.4514
 epoch: 10, train_loss: 1.0539, test_loss: 1.0405, test_f1: 0.4616
 epoch: 11, train_loss: 1.0410, test_loss: 1.0377, test_f1: 0.4644
 epoch: 12, train_loss: 1.0328, test_loss: 1.0334, test_f1: 0.4670
 epoch: 13, train_loss: 1.0314, test_loss: 1.0344, test_f1: 0.4687
 epoch: 14, train_loss: 1.0156, test_loss: 1.0170, test_f1: 0.4742
 epoch: 15, train_loss: 1.0092, test_loss: 1.0217, test_f1: 0.4719
 epoch: 16, train_loss: 1.0106, test_loss: 1.0071, test_f1: 0.4787
 epoch: 17, train_loss: 1.0044, test_loss: 1.0153, test_f1: 0.4772
 epoch: 18, train_loss: 0.9825, test_loss: 0.9991, test_f1: 0.4759
 epoch: 19, train_loss: 0.9909, test_loss: 1.0074, test_f1: 0.4783
 epoch: 20, train_loss: 0.9885, test_loss: 1.0004, test_f1: 0.4748
 epoch: 21, train_loss: 0.9740, test_loss: 0.9854, test_f1: 0.4871
 epoch: 22, train_loss: 0.9739, test_loss: 0.9830, test_f1: 0.4878
 epoch: 23, train_loss: 0.9783, test_loss: 0.9730, test_f1: 0.4901
 epoch: 24, train_loss: 0.9684, test_loss: 0.9896, test_f1: 0.4842
 epoch: 25, train_loss: 0.9584, test_loss: 0.9741, test_f1: 0.4984
 epoch: 26, train_loss: 0.9563, test_loss: 0.9815, test_f1: 0.5012
 epoch: 27, train_loss: 0.9561, test_loss: 0.9792, test_f1: 0.5059
 epoch: 28, train_loss: 0.9417, test_loss: 0.9840, test_f1: 0.4997
 epoch: 29, train_loss: 0.9528, test_loss: 0.9721, test_f1: 0.4901
 epoch: 30, train_loss: 0.9466, test_loss: 0.9770, test_f1: 0.5016
 epoch: 31, train_loss: 0.9391, test_loss: 0.9865, test_f1: 0.4882
 epoch: 32, train_loss: 0.9468, test_loss: 0.9710, test_f1: 0.5067
 epoch: 33, train_loss: 0.9358, test_loss: 0.9702, test_f1: 0.5049
 epoch: 34, train_loss: 0.9404, test_loss: 0.9724, test_f1: 0.5067
 epoch: 35, train_loss: 0.9292, test_loss: 0.9701, test_f1: 0.5070
 epoch: 36, train_loss: 0.9365, test_loss: 0.9789, test_f1: 0.5107
 epoch: 37, train_loss: 0.9153, test_loss: 0.9607, test_f1: 0.5074
 epoch: 38, train_loss: 0.9261, test_loss: 0.9590, test_f1: 0.5101
 epoch: 39, train_loss: 0.9202, test_loss: 0.9729, test_f1: 0.5165
 epoch: 40, train_loss: 0.9100, test_loss: 0.9679, test_f1: 0.5191
 epoch: 41, train_loss: 0.9138, test_loss: 0.9561, test_f1: 0.5167
 epoch: 42, train_loss: 0.9019, test_loss: 0.9517, test_f1: 0.5168
 epoch: 43, train_loss: 0.9047, test_loss: 0.9407, test_f1: 0.5243
 epoch: 44, train_loss: 0.8988, test_loss: 0.9582, test_f1: 0.5180
 epoch: 45, train_loss: 0.8986, test_loss: 0.9546, test_f1: 0.5203
 epoch: 46, train_loss: 0.8970, test_loss: 0.9581, test_f1: 0.5175
 epoch: 47, train_loss: 0.9015, test_loss: 0.9588, test_f1: 0.5219
 epoch: 48, train_loss: 0.8929, test_loss: 0.9483, test_f1: 0.5341
 epoch: 49, train_loss: 0.8978, test_loss: 0.9831, test_f1: 0.5022
 epoch: 50, train_loss: 0.8965, test_loss: 0.9456, test_f1: 0.5247
 epoch: 51, train_loss: 0.8758, test_loss: 0.9373, test_f1: 0.5316
 epoch: 52, train_loss: 0.8851, test_loss: 0.9472, test_f1: 0.5340
 epoch: 53, train_loss: 0.8763, test_loss: 0.9464, test_f1: 0.5293
 epoch: 54, train_loss: 0.8720, test_loss: 0.9419, test_f1: 0.5294
 epoch: 55, train_loss: 0.8807, test_loss: 0.9447, test_f1: 0.5283
 epoch: 56, train_loss: 0.8717, test_loss: 0.9439, test_f1: 0.5283
 epoch: 57, train_loss: 0.8712, test_loss: 0.9431, test_f1: 0.5303
 epoch: 58, train_loss: 0.8688, test_loss: 0.9444, test_f1: 0.5338
 epoch: 59, train_loss: 0.8783, test_loss: 0.9494, test_f1: 0.5366
 epoch: 60, train_loss: 0.8685, test_loss: 0.9297, test_f1: 0.5396
 epoch: 61, train_loss: 0.8681, test_loss: 0.9268, test_f1: 0.5280
 epoch: 62, train_loss: 0.8706, test_loss: 0.9364, test_f1: 0.5374
 epoch: 63, train_loss: 0.8693, test_loss: 0.9270, test_f1: 0.5252
 epoch: 64, train_loss: 0.8692, test_loss: 0.9361, test_f1: 0.5323
 epoch: 65, train_loss: 0.8701, test_loss: 0.9413, test_f1: 0.5386
 epoch: 66, train_loss: 0.8632, test_loss: 0.9389, test_f1: 0.5324
 epoch: 67, train_loss: 0.8691, test_loss: 0.9335, test_f1: 0.5387
 epoch: 68, train_loss: 0.8650, test_loss: 0.9373, test_f1: 0.5339
 epoch: 69, train_loss: 0.8650, test_loss: 0.9366, test_f1: 0.5351
 epoch: 70, train_loss: 0.8575, test_loss: 0.9325, test_f1: 0.5389
 epoch: 71, train_loss: 0.8628, test_loss: 0.9272, test_f1: 0.5313
 epoch: 72, train_loss: 0.8542, test_loss: 0.9343, test_f1: 0.5205
 epoch: 73, train_loss: 0.8506, test_loss: 0.9389, test_f1: 0.5377
 epoch: 74, train_loss: 0.8556, test_loss: 0.9462, test_f1: 0.5314
 epoch: 75, train_loss: 0.8516, test_loss: 0.9472, test_f1: 0.5378
 epoch: 76, train_loss: 0.8558, test_loss: 0.9440, test_f1: 0.5311
 epoch: 77, train_loss: 0.8524, test_loss: 0.9288, test_f1: 0.5368
 epoch: 78, train_loss: 0.8577, test_loss: 0.9358, test_f1: 0.5430
 epoch: 79, train_loss: 0.8451, test_loss: 0.9346, test_f1: 0.5354
 epoch: 80, train_loss: 0.8484, test_loss: 0.9191, test_f1: 0.5247
 epoch: 81, train_loss: 0.8432, test_loss: 0.9336, test_f1: 0.5408
 epoch: 82, train_loss: 0.8509, test_loss: 0.9135, test_f1: 0.5399
 epoch: 83, train_loss: 0.8394, test_loss: 0.9373, test_f1: 0.5387
 epoch: 84, train_loss: 0.8477, test_loss: 0.9422, test_f1: 0.5394
 epoch: 85, train_loss: 0.8497, test_loss: 0.9327, test_f1: 0.5413
 epoch: 86, train_loss: 0.8395, test_loss: 0.9404, test_f1: 0.5412
 epoch: 87, train_loss: 0.8398, test_loss: 0.9396, test_f1: 0.5380
 epoch: 88, train_loss: 0.8376, test_loss: 0.9295, test_f1: 0.5400
 epoch: 89, train_loss: 0.8404, test_loss: 0.9240, test_f1: 0.5418
 epoch: 90, train_loss: 0.8475, test_loss: 0.9452, test_f1: 0.5467
 epoch: 91, train_loss: 0.8318, test_loss: 0.9203, test_f1: 0.5388
 epoch: 92, train_loss: 0.8343, test_loss: 0.9234, test_f1: 0.5325
 epoch: 93, train_loss: 0.8293, test_loss: 0.9253, test_f1: 0.5267
 epoch: 94, train_loss: 0.8448, test_loss: 0.9280, test_f1: 0.5380
 epoch: 95, train_loss: 0.8337, test_loss: 0.9271, test_f1: 0.5418
 epoch: 96, train_loss: 0.8180, test_loss: 0.9283, test_f1: 0.5473
 epoch: 97, train_loss: 0.8346, test_loss: 0.9253, test_f1: 0.5466
 epoch: 98, train_loss: 0.8291, test_loss: 0.9257, test_f1: 0.5391
 epoch: 99, train_loss: 0.8288, test_loss: 0.9337, test_f1: 0.5352
##################ITERATION #7 ****************************************
 epoch: 0, train_loss: 1.2828, test_loss: 1.3211, test_f1: 0.2270
 epoch: 1, train_loss: 1.1939, test_loss: 1.2624, test_f1: 0.2320
 epoch: 2, train_loss: 1.1640, test_loss: 1.1346, test_f1: 0.3492
 epoch: 3, train_loss: 1.1417, test_loss: 1.0937, test_f1: 0.3573
 epoch: 4, train_loss: 1.1165, test_loss: 1.0785, test_f1: 0.3779
 epoch: 5, train_loss: 1.1019, test_loss: 1.0631, test_f1: 0.3860
 epoch: 6, train_loss: 1.0754, test_loss: 1.0500, test_f1: 0.4154
 epoch: 7, train_loss: 1.0692, test_loss: 1.0454, test_f1: 0.4244
 epoch: 8, train_loss: 1.0491, test_loss: 1.0405, test_f1: 0.4324
 epoch: 9, train_loss: 1.0428, test_loss: 1.0314, test_f1: 0.4363
 epoch: 10, train_loss: 1.0356, test_loss: 1.0310, test_f1: 0.4378
 epoch: 11, train_loss: 1.0265, test_loss: 1.0290, test_f1: 0.4232
 epoch: 12, train_loss: 1.0171, test_loss: 1.0241, test_f1: 0.4483
 epoch: 13, train_loss: 1.0066, test_loss: 1.0200, test_f1: 0.4637
 epoch: 14, train_loss: 0.9985, test_loss: 1.0152, test_f1: 0.4619
 epoch: 15, train_loss: 0.9996, test_loss: 1.0101, test_f1: 0.4627
 epoch: 16, train_loss: 0.9933, test_loss: 1.0072, test_f1: 0.4641
 epoch: 17, train_loss: 0.9883, test_loss: 0.9978, test_f1: 0.4667
 epoch: 18, train_loss: 0.9865, test_loss: 1.0009, test_f1: 0.4652
 epoch: 19, train_loss: 0.9758, test_loss: 0.9969, test_f1: 0.4755
 epoch: 20, train_loss: 0.9768, test_loss: 0.9990, test_f1: 0.4734
 epoch: 21, train_loss: 0.9739, test_loss: 0.9933, test_f1: 0.4852
 epoch: 22, train_loss: 0.9654, test_loss: 0.9936, test_f1: 0.4797
 epoch: 23, train_loss: 0.9675, test_loss: 0.9821, test_f1: 0.4998
 epoch: 24, train_loss: 0.9554, test_loss: 0.9787, test_f1: 0.4853
 epoch: 25, train_loss: 0.9480, test_loss: 0.9740, test_f1: 0.4996
 epoch: 26, train_loss: 0.9488, test_loss: 0.9811, test_f1: 0.5025
 epoch: 27, train_loss: 0.9412, test_loss: 0.9821, test_f1: 0.4960
 epoch: 28, train_loss: 0.9386, test_loss: 0.9723, test_f1: 0.4998
 epoch: 29, train_loss: 0.9284, test_loss: 0.9717, test_f1: 0.4992
 epoch: 30, train_loss: 0.9315, test_loss: 0.9690, test_f1: 0.5009
 epoch: 31, train_loss: 0.9260, test_loss: 0.9711, test_f1: 0.5084
 epoch: 32, train_loss: 0.9274, test_loss: 0.9737, test_f1: 0.4957
 epoch: 33, train_loss: 0.9272, test_loss: 0.9610, test_f1: 0.5047
 epoch: 34, train_loss: 0.9205, test_loss: 0.9588, test_f1: 0.5068
 epoch: 35, train_loss: 0.9143, test_loss: 0.9636, test_f1: 0.5120
 epoch: 36, train_loss: 0.9116, test_loss: 0.9587, test_f1: 0.5053
 epoch: 37, train_loss: 0.9138, test_loss: 0.9663, test_f1: 0.5120
 epoch: 38, train_loss: 0.9134, test_loss: 0.9362, test_f1: 0.5090
 epoch: 39, train_loss: 0.9017, test_loss: 0.9359, test_f1: 0.5145
 epoch: 40, train_loss: 0.9075, test_loss: 0.9374, test_f1: 0.5157
 epoch: 41, train_loss: 0.8985, test_loss: 0.9381, test_f1: 0.5130
 epoch: 42, train_loss: 0.8968, test_loss: 0.9130, test_f1: 0.5175
 epoch: 43, train_loss: 0.8928, test_loss: 0.9098, test_f1: 0.5167
 epoch: 44, train_loss: 0.8966, test_loss: 0.8864, test_f1: 0.5277
 epoch: 45, train_loss: 0.8875, test_loss: 0.8752, test_f1: 0.5334
 epoch: 46, train_loss: 0.8827, test_loss: 0.8844, test_f1: 0.5274
 epoch: 47, train_loss: 0.8822, test_loss: 0.8892, test_f1: 0.5290
 epoch: 48, train_loss: 0.8803, test_loss: 0.8731, test_f1: 0.5285
 epoch: 49, train_loss: 0.8645, test_loss: 0.8934, test_f1: 0.5136
 epoch: 50, train_loss: 0.8701, test_loss: 0.8656, test_f1: 0.5347
 epoch: 51, train_loss: 0.8670, test_loss: 0.8622, test_f1: 0.5416
 epoch: 52, train_loss: 0.8749, test_loss: 0.8614, test_f1: 0.5317
 epoch: 53, train_loss: 0.8646, test_loss: 0.8784, test_f1: 0.5280
 epoch: 54, train_loss: 0.8635, test_loss: 0.8780, test_f1: 0.5290
 epoch: 55, train_loss: 0.8645, test_loss: 0.8737, test_f1: 0.5258
 epoch: 56, train_loss: 0.8649, test_loss: 0.8722, test_f1: 0.5381
 epoch: 57, train_loss: 0.8585, test_loss: 0.8653, test_f1: 0.5340
 epoch: 58, train_loss: 0.8723, test_loss: 0.8689, test_f1: 0.5310
 epoch: 59, train_loss: 0.8584, test_loss: 0.8701, test_f1: 0.5344
 epoch: 60, train_loss: 0.8696, test_loss: 0.8736, test_f1: 0.5416
 epoch: 61, train_loss: 0.8621, test_loss: 0.8669, test_f1: 0.5375
 epoch: 62, train_loss: 0.8476, test_loss: 0.8580, test_f1: 0.5375
 epoch: 63, train_loss: 0.8574, test_loss: 0.8630, test_f1: 0.5392
 epoch: 64, train_loss: 0.8555, test_loss: 0.8656, test_f1: 0.5374
 epoch: 65, train_loss: 0.8545, test_loss: 0.8659, test_f1: 0.5364
 epoch: 66, train_loss: 0.8509, test_loss: 0.8694, test_f1: 0.5364
 epoch: 67, train_loss: 0.8461, test_loss: 0.8784, test_f1: 0.5324
 epoch: 68, train_loss: 0.8512, test_loss: 0.8641, test_f1: 0.5344
 epoch: 69, train_loss: 0.8501, test_loss: 0.8662, test_f1: 0.5391
 epoch: 70, train_loss: 0.8451, test_loss: 0.8599, test_f1: 0.5365
 epoch: 71, train_loss: 0.8435, test_loss: 0.8618, test_f1: 0.5382
 epoch: 72, train_loss: 0.8452, test_loss: 0.8617, test_f1: 0.5410
 epoch: 73, train_loss: 0.8498, test_loss: 0.8517, test_f1: 0.5412
 epoch: 74, train_loss: 0.8505, test_loss: 0.8521, test_f1: 0.5356
 epoch: 75, train_loss: 0.8441, test_loss: 0.8670, test_f1: 0.5430
 epoch: 76, train_loss: 0.8431, test_loss: 0.8613, test_f1: 0.5417
 epoch: 77, train_loss: 0.8407, test_loss: 0.8579, test_f1: 0.5371
 epoch: 78, train_loss: 0.8385, test_loss: 0.8593, test_f1: 0.5328
 epoch: 79, train_loss: 0.8320, test_loss: 0.8543, test_f1: 0.5386
 epoch: 80, train_loss: 0.8310, test_loss: 0.8463, test_f1: 0.5412
 epoch: 81, train_loss: 0.8405, test_loss: 0.8542, test_f1: 0.5359
 epoch: 82, train_loss: 0.8361, test_loss: 0.8688, test_f1: 0.5298
 epoch: 83, train_loss: 0.8362, test_loss: 0.8568, test_f1: 0.5471
 epoch: 84, train_loss: 0.8441, test_loss: 0.8525, test_f1: 0.5446
 epoch: 85, train_loss: 0.8397, test_loss: 0.8495, test_f1: 0.5392
 epoch: 86, train_loss: 0.8383, test_loss: 0.8478, test_f1: 0.5383
 epoch: 87, train_loss: 0.8247, test_loss: 0.8484, test_f1: 0.5456
 epoch: 88, train_loss: 0.8316, test_loss: 0.8509, test_f1: 0.5583
 epoch: 89, train_loss: 0.8353, test_loss: 0.8578, test_f1: 0.5424
 epoch: 90, train_loss: 0.8369, test_loss: 0.8506, test_f1: 0.5428
 epoch: 91, train_loss: 0.8344, test_loss: 0.8597, test_f1: 0.5470
 epoch: 92, train_loss: 0.8312, test_loss: 0.8648, test_f1: 0.5473
 epoch: 93, train_loss: 0.8314, test_loss: 0.8471, test_f1: 0.5361
 epoch: 94, train_loss: 0.8280, test_loss: 0.8500, test_f1: 0.5413
 epoch: 95, train_loss: 0.8310, test_loss: 0.8522, test_f1: 0.5422
 epoch: 96, train_loss: 0.8229, test_loss: 0.8560, test_f1: 0.5434
 epoch: 97, train_loss: 0.8196, test_loss: 0.8620, test_f1: 0.5554
 epoch: 98, train_loss: 0.8171, test_loss: 0.8547, test_f1: 0.5428
 epoch: 99, train_loss: 0.8200, test_loss: 0.8542, test_f1: 0.5534
##################ITERATION #8 ****************************************
 epoch: 0, train_loss: 1.3701, test_loss: 1.3593, test_f1: 0.2270
 epoch: 1, train_loss: 1.2532, test_loss: 1.2641, test_f1: 0.2270
 epoch: 2, train_loss: 1.2131, test_loss: 1.1684, test_f1: 0.3587
 epoch: 3, train_loss: 1.1755, test_loss: 1.1231, test_f1: 0.3787
 epoch: 4, train_loss: 1.1506, test_loss: 1.0987, test_f1: 0.3836
 epoch: 5, train_loss: 1.1308, test_loss: 1.0808, test_f1: 0.3958
 epoch: 6, train_loss: 1.1122, test_loss: 1.0650, test_f1: 0.3978
 epoch: 7, train_loss: 1.0915, test_loss: 1.0523, test_f1: 0.4293
 epoch: 8, train_loss: 1.0804, test_loss: 1.0417, test_f1: 0.4386
 epoch: 9, train_loss: 1.0596, test_loss: 1.0367, test_f1: 0.4476
 epoch: 10, train_loss: 1.0481, test_loss: 1.0289, test_f1: 0.4625
 epoch: 11, train_loss: 1.0442, test_loss: 1.0196, test_f1: 0.4629
 epoch: 12, train_loss: 1.0323, test_loss: 1.0162, test_f1: 0.4686
 epoch: 13, train_loss: 1.0180, test_loss: 1.0150, test_f1: 0.4695
 epoch: 14, train_loss: 1.0159, test_loss: 1.0048, test_f1: 0.4666
 epoch: 15, train_loss: 1.0042, test_loss: 1.0036, test_f1: 0.4723
 epoch: 16, train_loss: 1.0047, test_loss: 1.0016, test_f1: 0.4793
 epoch: 17, train_loss: 1.0003, test_loss: 0.9996, test_f1: 0.4906
 epoch: 18, train_loss: 0.9984, test_loss: 0.9873, test_f1: 0.4864
 epoch: 19, train_loss: 0.9774, test_loss: 0.9876, test_f1: 0.4908
 epoch: 20, train_loss: 0.9868, test_loss: 0.9776, test_f1: 0.4954
 epoch: 21, train_loss: 0.9733, test_loss: 0.9760, test_f1: 0.5008
 epoch: 22, train_loss: 0.9814, test_loss: 0.9771, test_f1: 0.5104
 epoch: 23, train_loss: 0.9647, test_loss: 0.9723, test_f1: 0.5033
 epoch: 24, train_loss: 0.9611, test_loss: 0.9654, test_f1: 0.5081
 epoch: 25, train_loss: 0.9583, test_loss: 0.9689, test_f1: 0.5008
 epoch: 26, train_loss: 0.9541, test_loss: 0.9760, test_f1: 0.4977
 epoch: 27, train_loss: 0.9551, test_loss: 0.9731, test_f1: 0.4983
 epoch: 28, train_loss: 0.9424, test_loss: 0.9607, test_f1: 0.5051
 epoch: 29, train_loss: 0.9505, test_loss: 0.9547, test_f1: 0.5016
 epoch: 30, train_loss: 0.9459, test_loss: 0.9682, test_f1: 0.5051
 epoch: 31, train_loss: 0.9412, test_loss: 0.9694, test_f1: 0.5016
 epoch: 32, train_loss: 0.9362, test_loss: 0.9593, test_f1: 0.5056
 epoch: 33, train_loss: 0.9253, test_loss: 0.9488, test_f1: 0.5083
 epoch: 34, train_loss: 0.9366, test_loss: 0.9578, test_f1: 0.5094
 epoch: 35, train_loss: 0.9206, test_loss: 0.9650, test_f1: 0.5103
 epoch: 36, train_loss: 0.9264, test_loss: 0.9135, test_f1: 0.5217
 epoch: 37, train_loss: 0.9231, test_loss: 0.9096, test_f1: 0.5276
 epoch: 38, train_loss: 0.9157, test_loss: 0.9180, test_f1: 0.5202
 epoch: 39, train_loss: 0.9176, test_loss: 0.9163, test_f1: 0.5123
 epoch: 40, train_loss: 0.9158, test_loss: 0.9433, test_f1: 0.5225
 epoch: 41, train_loss: 0.9055, test_loss: 0.9279, test_f1: 0.5262
 epoch: 42, train_loss: 0.9095, test_loss: 0.9236, test_f1: 0.5152
 epoch: 43, train_loss: 0.9000, test_loss: 0.9052, test_f1: 0.5261
 epoch: 44, train_loss: 0.9004, test_loss: 0.8915, test_f1: 0.5311
 epoch: 45, train_loss: 0.8978, test_loss: 0.9296, test_f1: 0.5180
 epoch: 46, train_loss: 0.8950, test_loss: 0.9086, test_f1: 0.5141
 epoch: 47, train_loss: 0.8961, test_loss: 0.9171, test_f1: 0.5184
 epoch: 48, train_loss: 0.8925, test_loss: 0.9125, test_f1: 0.5257
 epoch: 49, train_loss: 0.8877, test_loss: 0.9156, test_f1: 0.5285
 epoch: 50, train_loss: 0.8910, test_loss: 0.9474, test_f1: 0.5226
 epoch: 51, train_loss: 0.8888, test_loss: 0.9111, test_f1: 0.5154
 epoch: 52, train_loss: 0.8922, test_loss: 0.9058, test_f1: 0.5189
 epoch: 53, train_loss: 0.8748, test_loss: 0.9169, test_f1: 0.5253
 epoch: 54, train_loss: 0.8838, test_loss: 0.9023, test_f1: 0.5280
 epoch: 55, train_loss: 0.8763, test_loss: 0.8914, test_f1: 0.5279
 epoch: 56, train_loss: 0.8793, test_loss: 0.9323, test_f1: 0.5246
 epoch: 57, train_loss: 0.8784, test_loss: 0.8866, test_f1: 0.5398
 epoch: 58, train_loss: 0.8820, test_loss: 0.9050, test_f1: 0.5372
 epoch: 59, train_loss: 0.8746, test_loss: 0.9199, test_f1: 0.5324
 epoch: 60, train_loss: 0.8790, test_loss: 0.9184, test_f1: 0.5259
 epoch: 61, train_loss: 0.8735, test_loss: 0.9059, test_f1: 0.5226
 epoch: 62, train_loss: 0.8784, test_loss: 0.9231, test_f1: 0.5328
 epoch: 63, train_loss: 0.8716, test_loss: 0.9258, test_f1: 0.5296
 epoch: 64, train_loss: 0.8630, test_loss: 0.9107, test_f1: 0.5285
 epoch: 65, train_loss: 0.8709, test_loss: 0.9041, test_f1: 0.5215
 epoch: 66, train_loss: 0.8703, test_loss: 0.9207, test_f1: 0.5296
 epoch: 67, train_loss: 0.8775, test_loss: 0.9198, test_f1: 0.5246
 epoch: 68, train_loss: 0.8629, test_loss: 0.9161, test_f1: 0.5359
 epoch: 69, train_loss: 0.8668, test_loss: 0.9455, test_f1: 0.5293
 epoch: 70, train_loss: 0.8689, test_loss: 0.9288, test_f1: 0.5297
 epoch: 71, train_loss: 0.8685, test_loss: 0.9162, test_f1: 0.5335
 epoch: 72, train_loss: 0.8618, test_loss: 0.8725, test_f1: 0.5469
 epoch: 73, train_loss: 0.8569, test_loss: 0.8871, test_f1: 0.5314
 epoch: 74, train_loss: 0.8662, test_loss: 0.9115, test_f1: 0.5297
 epoch: 75, train_loss: 0.8599, test_loss: 0.9035, test_f1: 0.5308
 epoch: 76, train_loss: 0.8572, test_loss: 0.8981, test_f1: 0.5332
 epoch: 77, train_loss: 0.8562, test_loss: 0.8951, test_f1: 0.5328
 epoch: 78, train_loss: 0.8601, test_loss: 0.8949, test_f1: 0.5354
 epoch: 79, train_loss: 0.8551, test_loss: 0.8744, test_f1: 0.5445
 epoch: 80, train_loss: 0.8592, test_loss: 0.9171, test_f1: 0.5394
 epoch: 81, train_loss: 0.8550, test_loss: 0.9328, test_f1: 0.5419
 epoch: 82, train_loss: 0.8543, test_loss: 0.8912, test_f1: 0.5331
 epoch: 83, train_loss: 0.8605, test_loss: 0.8724, test_f1: 0.5452
 epoch: 84, train_loss: 0.8431, test_loss: 0.8900, test_f1: 0.5338
 epoch: 85, train_loss: 0.8512, test_loss: 0.8653, test_f1: 0.5437
 epoch: 86, train_loss: 0.8507, test_loss: 0.8865, test_f1: 0.5411
 epoch: 87, train_loss: 0.8547, test_loss: 0.8826, test_f1: 0.5343
 epoch: 88, train_loss: 0.8525, test_loss: 0.8802, test_f1: 0.5374
 epoch: 89, train_loss: 0.8483, test_loss: 0.8632, test_f1: 0.5511
 epoch: 90, train_loss: 0.8561, test_loss: 0.8624, test_f1: 0.5588
 epoch: 91, train_loss: 0.8471, test_loss: 0.8749, test_f1: 0.5423
 epoch: 92, train_loss: 0.8498, test_loss: 0.8835, test_f1: 0.5371
 epoch: 93, train_loss: 0.8515, test_loss: 0.8792, test_f1: 0.5275
 epoch: 94, train_loss: 0.8399, test_loss: 0.8848, test_f1: 0.5344
 epoch: 95, train_loss: 0.8485, test_loss: 0.8699, test_f1: 0.5464
 epoch: 96, train_loss: 0.8353, test_loss: 0.8830, test_f1: 0.5442
 epoch: 97, train_loss: 0.8423, test_loss: 0.8572, test_f1: 0.5577
 epoch: 98, train_loss: 0.8399, test_loss: 0.8566, test_f1: 0.5553
 epoch: 99, train_loss: 0.8360, test_loss: 0.8609, test_f1: 0.5527
##################ITERATION #9 ****************************************
 epoch: 0, train_loss: 1.3246, test_loss: 1.3932, test_f1: 0.2270
 epoch: 1, train_loss: 1.1977, test_loss: 1.2226, test_f1: 0.2289
 epoch: 2, train_loss: 1.1532, test_loss: 1.0916, test_f1: 0.3735
 epoch: 3, train_loss: 1.1266, test_loss: 1.0515, test_f1: 0.3999
 epoch: 4, train_loss: 1.1061, test_loss: 1.0376, test_f1: 0.4128
 epoch: 5, train_loss: 1.0843, test_loss: 1.0222, test_f1: 0.4145
 epoch: 6, train_loss: 1.0752, test_loss: 1.0082, test_f1: 0.4445
 epoch: 7, train_loss: 1.0555, test_loss: 0.9985, test_f1: 0.4461
 epoch: 8, train_loss: 1.0478, test_loss: 0.9910, test_f1: 0.4563
 epoch: 9, train_loss: 1.0385, test_loss: 0.9826, test_f1: 0.4688
 epoch: 10, train_loss: 1.0277, test_loss: 0.9759, test_f1: 0.4510
 epoch: 11, train_loss: 1.0178, test_loss: 0.9682, test_f1: 0.4800
 epoch: 12, train_loss: 1.0076, test_loss: 0.9633, test_f1: 0.4797
 epoch: 13, train_loss: 1.0002, test_loss: 0.9561, test_f1: 0.4839
 epoch: 14, train_loss: 0.9954, test_loss: 0.9493, test_f1: 0.4819
 epoch: 15, train_loss: 0.9839, test_loss: 0.9477, test_f1: 0.4789
 epoch: 16, train_loss: 0.9842, test_loss: 0.9454, test_f1: 0.4832
 epoch: 17, train_loss: 0.9848, test_loss: 0.9387, test_f1: 0.4858
 epoch: 18, train_loss: 0.9751, test_loss: 0.9370, test_f1: 0.4963
 epoch: 19, train_loss: 0.9696, test_loss: 0.9367, test_f1: 0.4941
 epoch: 20, train_loss: 0.9690, test_loss: 0.9386, test_f1: 0.4865
 epoch: 21, train_loss: 0.9618, test_loss: 0.9345, test_f1: 0.5057
 epoch: 22, train_loss: 0.9633, test_loss: 0.9249, test_f1: 0.5071
 epoch: 23, train_loss: 0.9491, test_loss: 0.9241, test_f1: 0.5015
 epoch: 24, train_loss: 0.9518, test_loss: 0.9225, test_f1: 0.5149
 epoch: 25, train_loss: 0.9473, test_loss: 0.9223, test_f1: 0.5152
 epoch: 26, train_loss: 0.9440, test_loss: 0.9284, test_f1: 0.5031
 epoch: 27, train_loss: 0.9487, test_loss: 0.9278, test_f1: 0.4856
 epoch: 28, train_loss: 0.9374, test_loss: 0.9220, test_f1: 0.5206
 epoch: 29, train_loss: 0.9352, test_loss: 0.9140, test_f1: 0.5259
 epoch: 30, train_loss: 0.9372, test_loss: 0.9261, test_f1: 0.5106
 epoch: 31, train_loss: 0.9223, test_loss: 0.9225, test_f1: 0.5120
 epoch: 32, train_loss: 0.9263, test_loss: 0.9154, test_f1: 0.5187
 epoch: 33, train_loss: 0.9236, test_loss: 0.9190, test_f1: 0.5014
 epoch: 34, train_loss: 0.9210, test_loss: 0.9068, test_f1: 0.5039
 epoch: 35, train_loss: 0.9166, test_loss: 0.9161, test_f1: 0.5223
 epoch: 36, train_loss: 0.9081, test_loss: 0.8977, test_f1: 0.5301
 epoch: 37, train_loss: 0.9111, test_loss: 0.9071, test_f1: 0.5091
 epoch: 38, train_loss: 0.9150, test_loss: 0.9001, test_f1: 0.5214
 epoch: 39, train_loss: 0.9019, test_loss: 0.8965, test_f1: 0.5164
 epoch: 40, train_loss: 0.9015, test_loss: 0.9023, test_f1: 0.5230
 epoch: 41, train_loss: 0.8921, test_loss: 0.9041, test_f1: 0.5217
 epoch: 42, train_loss: 0.8985, test_loss: 0.9042, test_f1: 0.5254
 epoch: 43, train_loss: 0.8983, test_loss: 0.9202, test_f1: 0.5258
 epoch: 44, train_loss: 0.8984, test_loss: 0.9073, test_f1: 0.5255
 epoch: 45, train_loss: 0.8911, test_loss: 0.9065, test_f1: 0.5202
 epoch: 46, train_loss: 0.8926, test_loss: 0.8857, test_f1: 0.5269
 epoch: 47, train_loss: 0.8838, test_loss: 0.8796, test_f1: 0.5270
 epoch: 48, train_loss: 0.8814, test_loss: 0.8981, test_f1: 0.5267
 epoch: 49, train_loss: 0.8795, test_loss: 0.8907, test_f1: 0.5299
 epoch: 50, train_loss: 0.8752, test_loss: 0.8869, test_f1: 0.5152
 epoch: 51, train_loss: 0.8733, test_loss: 0.8902, test_f1: 0.5263
 epoch: 52, train_loss: 0.8789, test_loss: 0.8887, test_f1: 0.5275
 epoch: 53, train_loss: 0.8707, test_loss: 0.8967, test_f1: 0.5362
 epoch: 54, train_loss: 0.8666, test_loss: 0.8882, test_f1: 0.5299
 epoch: 55, train_loss: 0.8723, test_loss: 0.8855, test_f1: 0.5281
 epoch: 56, train_loss: 0.8726, test_loss: 0.9009, test_f1: 0.5281
 epoch: 57, train_loss: 0.8671, test_loss: 0.8861, test_f1: 0.5375
 epoch: 58, train_loss: 0.8610, test_loss: 0.8891, test_f1: 0.5274
 epoch: 59, train_loss: 0.8595, test_loss: 0.8846, test_f1: 0.5274
 epoch: 60, train_loss: 0.8569, test_loss: 0.8929, test_f1: 0.5279
 epoch: 61, train_loss: 0.8670, test_loss: 0.8927, test_f1: 0.5292
 epoch: 62, train_loss: 0.8598, test_loss: 0.8940, test_f1: 0.5306
 epoch: 63, train_loss: 0.8554, test_loss: 0.8962, test_f1: 0.5300
 epoch: 64, train_loss: 0.8662, test_loss: 0.8859, test_f1: 0.5361
 epoch: 65, train_loss: 0.8525, test_loss: 0.8810, test_f1: 0.5324
 epoch: 66, train_loss: 0.8443, test_loss: 0.8949, test_f1: 0.5357
 epoch: 67, train_loss: 0.8546, test_loss: 0.8831, test_f1: 0.5349
 epoch: 68, train_loss: 0.8390, test_loss: 0.8896, test_f1: 0.5392
 epoch: 69, train_loss: 0.8595, test_loss: 0.8971, test_f1: 0.5346
 epoch: 70, train_loss: 0.8447, test_loss: 0.8918, test_f1: 0.5359
 epoch: 71, train_loss: 0.8464, test_loss: 0.8926, test_f1: 0.5345
 epoch: 72, train_loss: 0.8453, test_loss: 0.9036, test_f1: 0.5285
 epoch: 73, train_loss: 0.8538, test_loss: 0.8987, test_f1: 0.5401
 epoch: 74, train_loss: 0.8451, test_loss: 0.8978, test_f1: 0.5398
 epoch: 75, train_loss: 0.8383, test_loss: 0.8909, test_f1: 0.5330
 epoch: 76, train_loss: 0.8487, test_loss: 0.8831, test_f1: 0.5352
 epoch: 77, train_loss: 0.8505, test_loss: 0.8977, test_f1: 0.5332
 epoch: 78, train_loss: 0.8481, test_loss: 0.9016, test_f1: 0.5355
 epoch: 79, train_loss: 0.8474, test_loss: 0.8818, test_f1: 0.5379
 epoch: 80, train_loss: 0.8420, test_loss: 0.8907, test_f1: 0.5343
 epoch: 81, train_loss: 0.8373, test_loss: 0.8889, test_f1: 0.5337
 epoch: 82, train_loss: 0.8379, test_loss: 0.8786, test_f1: 0.5391
 epoch: 83, train_loss: 0.8344, test_loss: 0.8840, test_f1: 0.5320
 epoch: 84, train_loss: 0.8400, test_loss: 0.8887, test_f1: 0.5422
 epoch: 85, train_loss: 0.8526, test_loss: 0.8827, test_f1: 0.5445
 epoch: 86, train_loss: 0.8316, test_loss: 0.8989, test_f1: 0.5400
 epoch: 87, train_loss: 0.8286, test_loss: 0.8861, test_f1: 0.5345
 epoch: 88, train_loss: 0.8325, test_loss: 0.8916, test_f1: 0.5345
 epoch: 89, train_loss: 0.8307, test_loss: 0.8928, test_f1: 0.5404
 epoch: 90, train_loss: 0.8324, test_loss: 0.9150, test_f1: 0.5364
 epoch: 91, train_loss: 0.8299, test_loss: 0.9051, test_f1: 0.5391
 epoch: 92, train_loss: 0.8218, test_loss: 0.8907, test_f1: 0.5408
 epoch: 93, train_loss: 0.8281, test_loss: 0.8962, test_f1: 0.5390
 epoch: 94, train_loss: 0.8342, test_loss: 0.8921, test_f1: 0.5361
 epoch: 95, train_loss: 0.8180, test_loss: 0.8995, test_f1: 0.5341
 epoch: 96, train_loss: 0.8298, test_loss: 0.8849, test_f1: 0.5443
 epoch: 97, train_loss: 0.8249, test_loss: 0.9102, test_f1: 0.5359
 epoch: 98, train_loss: 0.8219, test_loss: 0.8929, test_f1: 0.5379
 epoch: 99, train_loss: 0.8181, test_loss: 0.8915, test_f1: 0.5339

Training completed in 584.82 seconds
Best F1: 0.5588 at epoch 90
Mean F1 across iterations: 0.5421  0.0152
========================FINAL RESULTS================================
FEGIN weighted F1: 0.5588  0.0152
python main.py --data ltspice_examples --representation component_pin_net --model FEGIN --layers 6 --hiddens 32 --batch_size 128 --lr 0.0001 --emb_size 128 --epochs 100 --save_appendix component_pin_net_L6_H32_BS128_LR0.0001_E128 --no_val
-----



STDERR:
  File "main.py", line 370, in <module>
    main()
  File "main.py", line 254, in main
    dataset = dataset_class(
  File "/home/philip/projects/ltspice_examples_code_repo/Circuit-Completion-Using-GNNs/component_classification_with_link_prediction_head/evaluation/FEGIN/kernel/circuit_datasets.py", line 15, in __init__
    self.data, self.slices = torch.load(self.processed_paths[0])
  File "/home/philip/.local/lib/python3.8/site-packages/torch/serialization.py", line 1040, in load
    warnings.warn(
  File "/usr/lib/python3.8/warnings.py", line 109, in _showwarnmsg
    sw(msg.message, msg.category, msg.filename, msg.lineno,
  File "main.py", line 47, in warn_with_traceback
    traceback.print_stack(file=log)
/home/philip/projects/ltspice_examples_code_repo/Circuit-Completion-Using-GNNs/component_classification_with_link_prediction_head/evaluation/FEGIN/kernel/circuit_datasets.py:15: FutureWarning: You are using `torch.load` with `weights_only=False` (the current default value), which uses the default pickle module implicitly. It is possible to construct malicious pickle data which will execute arbitrary code during unpickling (See https://github.com/pytorch/pytorch/blob/main/SECURITY.md#untrusted-models for more details). In a future release, the default value for `weights_only` will be flipped to `True`. This limits the functions that could be executed during unpickling. Arbitrary objects will no longer be allowed to be loaded via this mode unless they are explicitly allowlisted by the user via `torch.serialization.add_safe_globals`. We recommend you start setting `weights_only=True` for any use case where you don't have full control of the loaded file. Please open an issue on GitHub for any issues related to this experimental feature.
  self.data, self.slices = torch.load(self.processed_paths[0])
