STDOUT:
Results will be saved in /home/philip/projects/llm_inference_code_repo/Circuit-Completion-Using-GNNs/component_classification_with_link_prediction_head/evaluation/FEGIN/results/model_FEGIN_dataset_ltspice_examples
Command line input: python main.py --data ltspice_examples --representation component_pin --model FEGIN --layers 3 --hiddens 64 --batch_size 128 --lr 0.01 --emb_size 250 --epochs 100 --save_appendix component_pin_L3_H64_BS128_LR0.01_E250 --no_val
 is saved.
-----
ltspice_examples - FEGIN
Using 3 layers, 64 hidden units, h = 2
Loading component_pin representation dataset
ENTERED
Training FEGIN on component_pin representation
Train: 3560, Test: 848
##################ITERATION #0 ****************************************
 epoch: 0, train_loss: 1.1809, test_loss: 1.0879, test_f1: 0.3386
 epoch: 1, train_loss: 1.0300, test_loss: 1.0321, test_f1: 0.4228
 epoch: 2, train_loss: 0.9816, test_loss: 0.9726, test_f1: 0.5155
 epoch: 3, train_loss: 0.9420, test_loss: 0.9688, test_f1: 0.4684
 epoch: 4, train_loss: 0.9187, test_loss: 0.8995, test_f1: 0.5062
 epoch: 5, train_loss: 0.8699, test_loss: 0.8985, test_f1: 0.5418
 epoch: 6, train_loss: 0.8439, test_loss: 0.8291, test_f1: 0.5782
 epoch: 7, train_loss: 0.8372, test_loss: 0.8507, test_f1: 0.4834
 epoch: 8, train_loss: 0.8059, test_loss: 0.8548, test_f1: 0.5433
 epoch: 9, train_loss: 0.8025, test_loss: 0.9868, test_f1: 0.5075
 epoch: 10, train_loss: 0.7922, test_loss: 0.8205, test_f1: 0.5611
 epoch: 11, train_loss: 0.7724, test_loss: 1.2226, test_f1: 0.4430
 epoch: 12, train_loss: 0.7515, test_loss: 0.8575, test_f1: 0.5630
 epoch: 13, train_loss: 0.7530, test_loss: 1.3991, test_f1: 0.4301
 epoch: 14, train_loss: 0.7627, test_loss: 0.8843, test_f1: 0.5799
 epoch: 15, train_loss: 0.7483, test_loss: 0.8952, test_f1: 0.5491
 epoch: 16, train_loss: 0.7323, test_loss: 0.8801, test_f1: 0.5655
 epoch: 17, train_loss: 0.7217, test_loss: 1.0562, test_f1: 0.5285
 epoch: 18, train_loss: 0.7204, test_loss: 0.9000, test_f1: 0.5953
 epoch: 19, train_loss: 0.7068, test_loss: 0.9121, test_f1: 0.5646
 epoch: 20, train_loss: 0.6986, test_loss: 0.8568, test_f1: 0.6129
 epoch: 21, train_loss: 0.6928, test_loss: 0.9537, test_f1: 0.6037
 epoch: 22, train_loss: 0.6820, test_loss: 1.1454, test_f1: 0.4953
 epoch: 23, train_loss: 0.6826, test_loss: 0.9399, test_f1: 0.5127
 epoch: 24, train_loss: 0.6832, test_loss: 0.7987, test_f1: 0.5394
 epoch: 25, train_loss: 0.6551, test_loss: 1.0069, test_f1: 0.5440
 epoch: 26, train_loss: 0.6577, test_loss: 0.7649, test_f1: 0.6517
 epoch: 27, train_loss: 0.6727, test_loss: 0.7941, test_f1: 0.6638
 epoch: 28, train_loss: 0.6400, test_loss: 0.8329, test_f1: 0.6389
 epoch: 29, train_loss: 0.6472, test_loss: 0.7898, test_f1: 0.6230
 epoch: 30, train_loss: 0.6327, test_loss: 0.7979, test_f1: 0.5874
 epoch: 31, train_loss: 0.6117, test_loss: 0.8293, test_f1: 0.6202
 epoch: 32, train_loss: 0.6291, test_loss: 0.9799, test_f1: 0.5610
 epoch: 33, train_loss: 0.6080, test_loss: 0.9374, test_f1: 0.6000
 epoch: 34, train_loss: 0.5972, test_loss: 0.8848, test_f1: 0.5928
 epoch: 35, train_loss: 0.5932, test_loss: 0.9419, test_f1: 0.6467
 epoch: 36, train_loss: 0.5920, test_loss: 0.8689, test_f1: 0.6365
 epoch: 37, train_loss: 0.5676, test_loss: 1.0868, test_f1: 0.5589
 epoch: 38, train_loss: 0.5865, test_loss: 0.8156, test_f1: 0.6158
 epoch: 39, train_loss: 0.5814, test_loss: 0.7776, test_f1: 0.6834
 epoch: 40, train_loss: 0.5737, test_loss: 0.9601, test_f1: 0.6644
 epoch: 41, train_loss: 0.5674, test_loss: 1.0577, test_f1: 0.5856
 epoch: 42, train_loss: 0.5410, test_loss: 1.1293, test_f1: 0.5828
 epoch: 43, train_loss: 0.5675, test_loss: 0.9133, test_f1: 0.5954
 epoch: 44, train_loss: 0.5563, test_loss: 1.1807, test_f1: 0.5259
 epoch: 45, train_loss: 0.5552, test_loss: 0.7832, test_f1: 0.6461
 epoch: 46, train_loss: 0.5360, test_loss: 1.0319, test_f1: 0.6136
 epoch: 47, train_loss: 0.5506, test_loss: 0.9026, test_f1: 0.6748
 epoch: 48, train_loss: 0.5518, test_loss: 0.8917, test_f1: 0.5799
 epoch: 49, train_loss: 0.5468, test_loss: 0.8861, test_f1: 0.6416
 epoch: 50, train_loss: 0.5407, test_loss: 0.8852, test_f1: 0.6350
 epoch: 51, train_loss: 0.4993, test_loss: 1.0465, test_f1: 0.6462
 epoch: 52, train_loss: 0.4552, test_loss: 0.9371, test_f1: 0.6492
 epoch: 53, train_loss: 0.4744, test_loss: 0.9159, test_f1: 0.6749
 epoch: 54, train_loss: 0.4403, test_loss: 0.9254, test_f1: 0.6703
 epoch: 55, train_loss: 0.4571, test_loss: 0.9721, test_f1: 0.6597
 epoch: 56, train_loss: 0.4201, test_loss: 0.9378, test_f1: 0.6663
 epoch: 57, train_loss: 0.4311, test_loss: 1.1071, test_f1: 0.6772
 epoch: 58, train_loss: 0.4489, test_loss: 1.1678, test_f1: 0.6389
 epoch: 59, train_loss: 0.4313, test_loss: 1.0097, test_f1: 0.6372
 epoch: 60, train_loss: 0.4049, test_loss: 1.0347, test_f1: 0.6421
 epoch: 61, train_loss: 0.4061, test_loss: 1.0203, test_f1: 0.6495
 epoch: 62, train_loss: 0.4002, test_loss: 0.9013, test_f1: 0.6687
 epoch: 63, train_loss: 0.4145, test_loss: 1.1316, test_f1: 0.6984
 epoch: 64, train_loss: 0.4224, test_loss: 1.0550, test_f1: 0.6439
 epoch: 65, train_loss: 0.4207, test_loss: 1.0667, test_f1: 0.6525
 epoch: 66, train_loss: 0.4109, test_loss: 1.0327, test_f1: 0.6681
 epoch: 67, train_loss: 0.4002, test_loss: 1.1258, test_f1: 0.6566
 epoch: 68, train_loss: 0.3877, test_loss: 1.1217, test_f1: 0.6604
 epoch: 69, train_loss: 0.3861, test_loss: 1.0195, test_f1: 0.6718
 epoch: 70, train_loss: 0.4166, test_loss: 0.9793, test_f1: 0.6728
 epoch: 71, train_loss: 0.4084, test_loss: 1.2239, test_f1: 0.6583
 epoch: 72, train_loss: 0.3892, test_loss: 1.0764, test_f1: 0.6544
 epoch: 73, train_loss: 0.3908, test_loss: 0.9403, test_f1: 0.6771
 epoch: 74, train_loss: 0.3701, test_loss: 1.1335, test_f1: 0.6837
 epoch: 75, train_loss: 0.3687, test_loss: 1.1801, test_f1: 0.6744
 epoch: 76, train_loss: 0.3702, test_loss: 1.0250, test_f1: 0.6799
 epoch: 77, train_loss: 0.3631, test_loss: 1.1132, test_f1: 0.7021
 epoch: 78, train_loss: 0.3591, test_loss: 1.1079, test_f1: 0.6734
 epoch: 79, train_loss: 0.3810, test_loss: 1.0599, test_f1: 0.6801
 epoch: 80, train_loss: 0.3657, test_loss: 1.0861, test_f1: 0.6511
 epoch: 81, train_loss: 0.3517, test_loss: 1.1177, test_f1: 0.6615
 epoch: 82, train_loss: 0.3745, test_loss: 1.0185, test_f1: 0.6899
 epoch: 83, train_loss: 0.3733, test_loss: 1.0952, test_f1: 0.6837
 epoch: 84, train_loss: 0.3556, test_loss: 1.1453, test_f1: 0.6998
 epoch: 85, train_loss: 0.3789, test_loss: 1.1185, test_f1: 0.6950
 epoch: 86, train_loss: 0.3688, test_loss: 1.3319, test_f1: 0.6203
 epoch: 87, train_loss: 0.3627, test_loss: 1.0676, test_f1: 0.6582
 epoch: 88, train_loss: 0.3512, test_loss: 1.3156, test_f1: 0.6620
 epoch: 89, train_loss: 0.3399, test_loss: 1.2025, test_f1: 0.6850
 epoch: 90, train_loss: 0.3621, test_loss: 1.0760, test_f1: 0.6875
 epoch: 91, train_loss: 0.3466, test_loss: 1.1956, test_f1: 0.6831
 epoch: 92, train_loss: 0.3396, test_loss: 1.2102, test_f1: 0.6844
 epoch: 93, train_loss: 0.3332, test_loss: 1.2548, test_f1: 0.6473
 epoch: 94, train_loss: 0.3354, test_loss: 0.9997, test_f1: 0.6865
 epoch: 95, train_loss: 0.3314, test_loss: 1.2159, test_f1: 0.6697
 epoch: 96, train_loss: 0.3237, test_loss: 1.1707, test_f1: 0.6886
 epoch: 97, train_loss: 0.3374, test_loss: 1.2105, test_f1: 0.6991
 epoch: 98, train_loss: 0.3467, test_loss: 1.2558, test_f1: 0.6379
 epoch: 99, train_loss: 0.3579, test_loss: 1.2249, test_f1: 0.6729
##################ITERATION #1 ****************************************
 epoch: 0, train_loss: 1.1363, test_loss: 1.2116, test_f1: 0.3285
 epoch: 1, train_loss: 1.0039, test_loss: 0.9857, test_f1: 0.4461
 epoch: 2, train_loss: 0.9459, test_loss: 1.0501, test_f1: 0.4607
 epoch: 3, train_loss: 0.8972, test_loss: 0.9070, test_f1: 0.5163
 epoch: 4, train_loss: 0.8833, test_loss: 1.1771, test_f1: 0.3988
 epoch: 5, train_loss: 0.8682, test_loss: 0.8896, test_f1: 0.4920
 epoch: 6, train_loss: 0.8325, test_loss: 0.8988, test_f1: 0.5490
 epoch: 7, train_loss: 0.8077, test_loss: 0.8145, test_f1: 0.5536
 epoch: 8, train_loss: 0.8133, test_loss: 0.8627, test_f1: 0.5562
 epoch: 9, train_loss: 0.7920, test_loss: 0.9838, test_f1: 0.5474
 epoch: 10, train_loss: 0.7934, test_loss: 0.9044, test_f1: 0.5419
 epoch: 11, train_loss: 0.7826, test_loss: 0.9309, test_f1: 0.4958
 epoch: 12, train_loss: 0.7630, test_loss: 0.7370, test_f1: 0.6283
 epoch: 13, train_loss: 0.7631, test_loss: 0.8556, test_f1: 0.5346
 epoch: 14, train_loss: 0.7349, test_loss: 0.9088, test_f1: 0.5575
 epoch: 15, train_loss: 0.7147, test_loss: 0.8798, test_f1: 0.5988
 epoch: 16, train_loss: 0.7277, test_loss: 0.8311, test_f1: 0.5957
 epoch: 17, train_loss: 0.7003, test_loss: 0.8163, test_f1: 0.5974
 epoch: 18, train_loss: 0.7008, test_loss: 1.1975, test_f1: 0.4847
 epoch: 19, train_loss: 0.7090, test_loss: 0.8554, test_f1: 0.5513
 epoch: 20, train_loss: 0.6857, test_loss: 1.1204, test_f1: 0.5919
 epoch: 21, train_loss: 0.6691, test_loss: 1.9766, test_f1: 0.3090
 epoch: 22, train_loss: 0.6695, test_loss: 1.2381, test_f1: 0.5267
 epoch: 23, train_loss: 0.6783, test_loss: 0.9087, test_f1: 0.5461
 epoch: 24, train_loss: 0.6576, test_loss: 0.9257, test_f1: 0.5380
 epoch: 25, train_loss: 0.6475, test_loss: 0.8493, test_f1: 0.6190
 epoch: 26, train_loss: 0.6397, test_loss: 1.0792, test_f1: 0.5731
 epoch: 27, train_loss: 0.6337, test_loss: 0.8116, test_f1: 0.6342
 epoch: 28, train_loss: 0.6283, test_loss: 0.7860, test_f1: 0.6298
 epoch: 29, train_loss: 0.6042, test_loss: 1.1070, test_f1: 0.5135
 epoch: 30, train_loss: 0.6108, test_loss: 0.7530, test_f1: 0.6332
 epoch: 31, train_loss: 0.6071, test_loss: 1.3900, test_f1: 0.5289
 epoch: 32, train_loss: 0.6305, test_loss: 0.7033, test_f1: 0.6747
 epoch: 33, train_loss: 0.5802, test_loss: 0.9166, test_f1: 0.5759
 epoch: 34, train_loss: 0.5966, test_loss: 1.0373, test_f1: 0.5590
 epoch: 35, train_loss: 0.5765, test_loss: 0.8332, test_f1: 0.6300
 epoch: 36, train_loss: 0.5531, test_loss: 1.1549, test_f1: 0.5854
 epoch: 37, train_loss: 0.5726, test_loss: 0.8961, test_f1: 0.5871
 epoch: 38, train_loss: 0.5666, test_loss: 0.7920, test_f1: 0.6286
 epoch: 39, train_loss: 0.5433, test_loss: 0.7638, test_f1: 0.6687
 epoch: 40, train_loss: 0.5568, test_loss: 0.8091, test_f1: 0.6174
 epoch: 41, train_loss: 0.5603, test_loss: 0.8167, test_f1: 0.6355
 epoch: 42, train_loss: 0.5621, test_loss: 0.9940, test_f1: 0.5753
 epoch: 43, train_loss: 0.5317, test_loss: 0.7849, test_f1: 0.6403
 epoch: 44, train_loss: 0.5155, test_loss: 0.9555, test_f1: 0.6127
 epoch: 45, train_loss: 0.5311, test_loss: 0.7844, test_f1: 0.6645
 epoch: 46, train_loss: 0.5043, test_loss: 0.8754, test_f1: 0.6334
 epoch: 47, train_loss: 0.5366, test_loss: 0.7889, test_f1: 0.6460
 epoch: 48, train_loss: 0.5308, test_loss: 1.4998, test_f1: 0.5804
 epoch: 49, train_loss: 0.5239, test_loss: 0.7983, test_f1: 0.6881
 epoch: 50, train_loss: 0.5084, test_loss: 0.7537, test_f1: 0.6653
 epoch: 51, train_loss: 0.4912, test_loss: 0.8879, test_f1: 0.6280
 epoch: 52, train_loss: 0.4542, test_loss: 0.8720, test_f1: 0.6556
 epoch: 53, train_loss: 0.4344, test_loss: 0.9278, test_f1: 0.6583
 epoch: 54, train_loss: 0.4299, test_loss: 1.0522, test_f1: 0.6309
 epoch: 55, train_loss: 0.4214, test_loss: 0.9065, test_f1: 0.6371
 epoch: 56, train_loss: 0.4114, test_loss: 0.8609, test_f1: 0.6572
 epoch: 57, train_loss: 0.4268, test_loss: 0.9860, test_f1: 0.6452
 epoch: 58, train_loss: 0.4282, test_loss: 0.8911, test_f1: 0.6466
 epoch: 59, train_loss: 0.4079, test_loss: 0.8693, test_f1: 0.6532
 epoch: 60, train_loss: 0.4068, test_loss: 1.0177, test_f1: 0.6454
 epoch: 61, train_loss: 0.4188, test_loss: 1.1444, test_f1: 0.6552
 epoch: 62, train_loss: 0.3944, test_loss: 0.8935, test_f1: 0.6528
 epoch: 63, train_loss: 0.3798, test_loss: 0.9445, test_f1: 0.6566
 epoch: 64, train_loss: 0.4011, test_loss: 0.9273, test_f1: 0.6715
 epoch: 65, train_loss: 0.4019, test_loss: 1.0580, test_f1: 0.6492
 epoch: 66, train_loss: 0.4140, test_loss: 1.1242, test_f1: 0.6468
 epoch: 67, train_loss: 0.3776, test_loss: 0.9565, test_f1: 0.6562
 epoch: 68, train_loss: 0.3895, test_loss: 1.2367, test_f1: 0.6279
 epoch: 69, train_loss: 0.3943, test_loss: 1.0110, test_f1: 0.6650
 epoch: 70, train_loss: 0.3656, test_loss: 1.3088, test_f1: 0.6080
 epoch: 71, train_loss: 0.3837, test_loss: 1.1924, test_f1: 0.6402
 epoch: 72, train_loss: 0.3936, test_loss: 1.1964, test_f1: 0.6190
 epoch: 73, train_loss: 0.3642, test_loss: 1.1698, test_f1: 0.6058
 epoch: 74, train_loss: 0.3582, test_loss: 1.0697, test_f1: 0.6700
 epoch: 75, train_loss: 0.3615, test_loss: 1.2134, test_f1: 0.6522
 epoch: 76, train_loss: 0.3634, test_loss: 1.1412, test_f1: 0.6485
 epoch: 77, train_loss: 0.3484, test_loss: 1.0686, test_f1: 0.6491
 epoch: 78, train_loss: 0.3359, test_loss: 1.0684, test_f1: 0.6603
 epoch: 79, train_loss: 0.3547, test_loss: 1.1663, test_f1: 0.6447
 epoch: 80, train_loss: 0.3751, test_loss: 1.0618, test_f1: 0.6398
 epoch: 81, train_loss: 0.3623, test_loss: 1.1091, test_f1: 0.6456
 epoch: 82, train_loss: 0.3717, test_loss: 1.0464, test_f1: 0.6578
 epoch: 83, train_loss: 0.3470, test_loss: 1.1810, test_f1: 0.6457
 epoch: 84, train_loss: 0.3429, test_loss: 1.3058, test_f1: 0.6111
 epoch: 85, train_loss: 0.3426, test_loss: 1.2612, test_f1: 0.6255
 epoch: 86, train_loss: 0.3392, test_loss: 1.2590, test_f1: 0.6520
 epoch: 87, train_loss: 0.3450, test_loss: 1.0745, test_f1: 0.6671
 epoch: 88, train_loss: 0.3536, test_loss: 1.1333, test_f1: 0.6241
 epoch: 89, train_loss: 0.3569, test_loss: 1.2310, test_f1: 0.6441
 epoch: 90, train_loss: 0.3828, test_loss: 1.1055, test_f1: 0.6315
 epoch: 91, train_loss: 0.3512, test_loss: 0.9759, test_f1: 0.6737
 epoch: 92, train_loss: 0.3409, test_loss: 1.1387, test_f1: 0.6269
 epoch: 93, train_loss: 0.3394, test_loss: 1.1811, test_f1: 0.6448
 epoch: 94, train_loss: 0.3154, test_loss: 1.0145, test_f1: 0.6850
 epoch: 95, train_loss: 0.3246, test_loss: 1.1568, test_f1: 0.6239
 epoch: 96, train_loss: 0.3333, test_loss: 1.0330, test_f1: 0.6656
 epoch: 97, train_loss: 0.3293, test_loss: 1.1506, test_f1: 0.6494
 epoch: 98, train_loss: 0.3565, test_loss: 1.0011, test_f1: 0.6408
 epoch: 99, train_loss: 0.3256, test_loss: 1.1786, test_f1: 0.6437
##################ITERATION #2 ****************************************
 epoch: 0, train_loss: 1.1932, test_loss: 1.1101, test_f1: 0.4349
 epoch: 1, train_loss: 0.9752, test_loss: 1.0136, test_f1: 0.5036
 epoch: 2, train_loss: 0.9525, test_loss: 1.0032, test_f1: 0.4832
 epoch: 3, train_loss: 0.9109, test_loss: 0.9989, test_f1: 0.5316
 epoch: 4, train_loss: 0.9048, test_loss: 1.0434, test_f1: 0.4792
 epoch: 5, train_loss: 0.8797, test_loss: 0.9398, test_f1: 0.5156
 epoch: 6, train_loss: 0.8816, test_loss: 0.9838, test_f1: 0.4919
 epoch: 7, train_loss: 0.8649, test_loss: 1.0026, test_f1: 0.5311
 epoch: 8, train_loss: 0.8632, test_loss: 1.0036, test_f1: 0.5113
 epoch: 9, train_loss: 0.8273, test_loss: 0.9290, test_f1: 0.5784
 epoch: 10, train_loss: 0.8096, test_loss: 1.1143, test_f1: 0.4883
 epoch: 11, train_loss: 0.8109, test_loss: 0.8901, test_f1: 0.5387
 epoch: 12, train_loss: 0.8109, test_loss: 0.9274, test_f1: 0.5850
 epoch: 13, train_loss: 0.7581, test_loss: 0.8833, test_f1: 0.6092
 epoch: 14, train_loss: 0.7614, test_loss: 0.9033, test_f1: 0.5211
 epoch: 15, train_loss: 0.7430, test_loss: 1.1134, test_f1: 0.5152
 epoch: 16, train_loss: 0.7505, test_loss: 0.8772, test_f1: 0.5944
 epoch: 17, train_loss: 0.7450, test_loss: 0.8627, test_f1: 0.5960
 epoch: 18, train_loss: 0.7169, test_loss: 0.8137, test_f1: 0.6077
 epoch: 19, train_loss: 0.7184, test_loss: 0.7623, test_f1: 0.6251
 epoch: 20, train_loss: 0.7254, test_loss: 0.8338, test_f1: 0.5391
 epoch: 21, train_loss: 0.7084, test_loss: 0.7854, test_f1: 0.6212
 epoch: 22, train_loss: 0.7049, test_loss: 1.2255, test_f1: 0.5167
 epoch: 23, train_loss: 0.7008, test_loss: 0.7813, test_f1: 0.6338
 epoch: 24, train_loss: 0.6901, test_loss: 0.8768, test_f1: 0.5599
 epoch: 25, train_loss: 0.6750, test_loss: 0.9375, test_f1: 0.5937
 epoch: 26, train_loss: 0.6768, test_loss: 0.7894, test_f1: 0.6290
 epoch: 27, train_loss: 0.6516, test_loss: 0.8129, test_f1: 0.6385
 epoch: 28, train_loss: 0.6711, test_loss: 1.0344, test_f1: 0.5243
 epoch: 29, train_loss: 0.6567, test_loss: 0.8530, test_f1: 0.5833
 epoch: 30, train_loss: 0.6622, test_loss: 0.8638, test_f1: 0.5785
 epoch: 31, train_loss: 0.6698, test_loss: 0.8560, test_f1: 0.6137
 epoch: 32, train_loss: 0.6498, test_loss: 0.9945, test_f1: 0.6095
 epoch: 33, train_loss: 0.6483, test_loss: 0.8846, test_f1: 0.5857
 epoch: 34, train_loss: 0.6440, test_loss: 0.9723, test_f1: 0.5777
 epoch: 35, train_loss: 0.6088, test_loss: 0.8651, test_f1: 0.6191
 epoch: 36, train_loss: 0.6040, test_loss: 0.8153, test_f1: 0.6646
 epoch: 37, train_loss: 0.6014, test_loss: 0.9134, test_f1: 0.6089
 epoch: 38, train_loss: 0.5904, test_loss: 0.8086, test_f1: 0.6550
 epoch: 39, train_loss: 0.5804, test_loss: 0.8978, test_f1: 0.6338
 epoch: 40, train_loss: 0.5924, test_loss: 1.1065, test_f1: 0.5527
 epoch: 41, train_loss: 0.5975, test_loss: 0.8771, test_f1: 0.5850
 epoch: 42, train_loss: 0.5778, test_loss: 0.8388, test_f1: 0.6373
 epoch: 43, train_loss: 0.5930, test_loss: 1.0015, test_f1: 0.5959
 epoch: 44, train_loss: 0.5744, test_loss: 0.8548, test_f1: 0.6407
 epoch: 45, train_loss: 0.5682, test_loss: 1.0009, test_f1: 0.5625
 epoch: 46, train_loss: 0.5681, test_loss: 0.9570, test_f1: 0.5926
 epoch: 47, train_loss: 0.5400, test_loss: 1.2009, test_f1: 0.5492
 epoch: 48, train_loss: 0.5534, test_loss: 1.5670, test_f1: 0.5150
 epoch: 49, train_loss: 0.5326, test_loss: 0.8591, test_f1: 0.6318
 epoch: 50, train_loss: 0.5489, test_loss: 0.8422, test_f1: 0.6570
 epoch: 51, train_loss: 0.5028, test_loss: 1.1489, test_f1: 0.5581
 epoch: 52, train_loss: 0.4801, test_loss: 0.9216, test_f1: 0.6464
 epoch: 53, train_loss: 0.4744, test_loss: 0.8791, test_f1: 0.6472
 epoch: 54, train_loss: 0.4556, test_loss: 0.8925, test_f1: 0.6426
 epoch: 55, train_loss: 0.4578, test_loss: 0.8956, test_f1: 0.6261
 epoch: 56, train_loss: 0.4413, test_loss: 0.9383, test_f1: 0.6325
 epoch: 57, train_loss: 0.4491, test_loss: 0.8865, test_f1: 0.6299
 epoch: 58, train_loss: 0.4513, test_loss: 1.0443, test_f1: 0.6126
 epoch: 59, train_loss: 0.4552, test_loss: 0.8651, test_f1: 0.6558
 epoch: 60, train_loss: 0.4493, test_loss: 1.0742, test_f1: 0.6336
 epoch: 61, train_loss: 0.4428, test_loss: 0.9485, test_f1: 0.6342
 epoch: 62, train_loss: 0.4491, test_loss: 1.0112, test_f1: 0.6348
 epoch: 63, train_loss: 0.4414, test_loss: 0.8887, test_f1: 0.6410
 epoch: 64, train_loss: 0.4328, test_loss: 0.9229, test_f1: 0.6512
 epoch: 65, train_loss: 0.4150, test_loss: 0.9443, test_f1: 0.6612
 epoch: 66, train_loss: 0.4026, test_loss: 0.8926, test_f1: 0.6947
 epoch: 67, train_loss: 0.4079, test_loss: 1.0052, test_f1: 0.6610
 epoch: 68, train_loss: 0.4226, test_loss: 0.9154, test_f1: 0.6464
 epoch: 69, train_loss: 0.4076, test_loss: 0.8909, test_f1: 0.6637
 epoch: 70, train_loss: 0.4126, test_loss: 0.8904, test_f1: 0.6647
 epoch: 71, train_loss: 0.4214, test_loss: 0.9657, test_f1: 0.6691
 epoch: 72, train_loss: 0.4088, test_loss: 0.9018, test_f1: 0.6644
 epoch: 73, train_loss: 0.4041, test_loss: 0.9380, test_f1: 0.6671
 epoch: 74, train_loss: 0.3964, test_loss: 0.9327, test_f1: 0.6402
 epoch: 75, train_loss: 0.4019, test_loss: 1.1015, test_f1: 0.6225
 epoch: 76, train_loss: 0.3933, test_loss: 0.9226, test_f1: 0.6858
 epoch: 77, train_loss: 0.3859, test_loss: 1.0323, test_f1: 0.6469
 epoch: 78, train_loss: 0.3947, test_loss: 1.0070, test_f1: 0.6690
 epoch: 79, train_loss: 0.4104, test_loss: 0.9685, test_f1: 0.6590
 epoch: 80, train_loss: 0.3924, test_loss: 1.0793, test_f1: 0.6292
 epoch: 81, train_loss: 0.3825, test_loss: 1.0228, test_f1: 0.6685
 epoch: 82, train_loss: 0.3846, test_loss: 1.0373, test_f1: 0.6731
 epoch: 83, train_loss: 0.4019, test_loss: 0.9453, test_f1: 0.6974
 epoch: 84, train_loss: 0.3736, test_loss: 0.9660, test_f1: 0.6587
 epoch: 85, train_loss: 0.3685, test_loss: 0.9963, test_f1: 0.6687
 epoch: 86, train_loss: 0.3592, test_loss: 0.9657, test_f1: 0.6716
 epoch: 87, train_loss: 0.3576, test_loss: 0.9431, test_f1: 0.6733
 epoch: 88, train_loss: 0.3700, test_loss: 0.9646, test_f1: 0.6799
 epoch: 89, train_loss: 0.3602, test_loss: 1.0235, test_f1: 0.6606
 epoch: 90, train_loss: 0.3579, test_loss: 0.9560, test_f1: 0.6570
 epoch: 91, train_loss: 0.3451, test_loss: 1.0277, test_f1: 0.6686
 epoch: 92, train_loss: 0.3683, test_loss: 0.9129, test_f1: 0.6672
 epoch: 93, train_loss: 0.3519, test_loss: 1.1068, test_f1: 0.6351
 epoch: 94, train_loss: 0.3469, test_loss: 1.0048, test_f1: 0.6497
 epoch: 95, train_loss: 0.3690, test_loss: 1.0251, test_f1: 0.6482
 epoch: 96, train_loss: 0.3482, test_loss: 0.9460, test_f1: 0.6991
 epoch: 97, train_loss: 0.3601, test_loss: 0.9755, test_f1: 0.6779
 epoch: 98, train_loss: 0.3508, test_loss: 1.0936, test_f1: 0.6293
 epoch: 99, train_loss: 0.3579, test_loss: 0.9874, test_f1: 0.6627
##################ITERATION #3 ****************************************
 epoch: 0, train_loss: 1.2483, test_loss: 1.2001, test_f1: 0.3432
 epoch: 1, train_loss: 1.0197, test_loss: 1.0459, test_f1: 0.4488
 epoch: 2, train_loss: 0.9697, test_loss: 1.0321, test_f1: 0.5038
 epoch: 3, train_loss: 0.9283, test_loss: 0.9396, test_f1: 0.5153
 epoch: 4, train_loss: 0.9087, test_loss: 0.9569, test_f1: 0.5133
 epoch: 5, train_loss: 0.8903, test_loss: 1.0250, test_f1: 0.4648
 epoch: 6, train_loss: 0.8581, test_loss: 1.0593, test_f1: 0.4454
 epoch: 7, train_loss: 0.8314, test_loss: 1.4311, test_f1: 0.4267
 epoch: 8, train_loss: 0.8375, test_loss: 0.7993, test_f1: 0.5636
 epoch: 9, train_loss: 0.8386, test_loss: 0.8900, test_f1: 0.5097
 epoch: 10, train_loss: 0.7860, test_loss: 1.2291, test_f1: 0.4435
 epoch: 11, train_loss: 0.7777, test_loss: 0.8789, test_f1: 0.5820
 epoch: 12, train_loss: 0.7725, test_loss: 0.8311, test_f1: 0.5822
 epoch: 13, train_loss: 0.7582, test_loss: 1.3305, test_f1: 0.5300
 epoch: 14, train_loss: 0.7608, test_loss: 0.8612, test_f1: 0.5519
 epoch: 15, train_loss: 0.7574, test_loss: 0.8248, test_f1: 0.5535
 epoch: 16, train_loss: 0.7385, test_loss: 1.0373, test_f1: 0.5351
 epoch: 17, train_loss: 0.7384, test_loss: 0.9205, test_f1: 0.5388
 epoch: 18, train_loss: 0.7086, test_loss: 0.9462, test_f1: 0.5249
 epoch: 19, train_loss: 0.7022, test_loss: 0.8059, test_f1: 0.5587
 epoch: 20, train_loss: 0.7119, test_loss: 0.9107, test_f1: 0.6269
 epoch: 21, train_loss: 0.7015, test_loss: 1.0428, test_f1: 0.5526
 epoch: 22, train_loss: 0.6819, test_loss: 0.8416, test_f1: 0.5867
 epoch: 23, train_loss: 0.6941, test_loss: 1.0058, test_f1: 0.5571
 epoch: 24, train_loss: 0.6920, test_loss: 0.9035, test_f1: 0.5367
 epoch: 25, train_loss: 0.6787, test_loss: 0.9049, test_f1: 0.5610
 epoch: 26, train_loss: 0.6489, test_loss: 0.8024, test_f1: 0.5961
 epoch: 27, train_loss: 0.6555, test_loss: 0.8764, test_f1: 0.6111
 epoch: 28, train_loss: 0.6507, test_loss: 0.9377, test_f1: 0.5806
 epoch: 29, train_loss: 0.6484, test_loss: 0.8249, test_f1: 0.6122
 epoch: 30, train_loss: 0.6520, test_loss: 1.0776, test_f1: 0.6024
 epoch: 31, train_loss: 0.6237, test_loss: 0.8666, test_f1: 0.5769
 epoch: 32, train_loss: 0.6458, test_loss: 0.9345, test_f1: 0.5784
 epoch: 33, train_loss: 0.6209, test_loss: 0.9351, test_f1: 0.5676
 epoch: 34, train_loss: 0.6348, test_loss: 0.8276, test_f1: 0.6143
 epoch: 35, train_loss: 0.5984, test_loss: 1.0152, test_f1: 0.6056
 epoch: 36, train_loss: 0.6090, test_loss: 0.8487, test_f1: 0.6288
 epoch: 37, train_loss: 0.5729, test_loss: 0.8534, test_f1: 0.6150
 epoch: 38, train_loss: 0.5886, test_loss: 0.9680, test_f1: 0.6135
 epoch: 39, train_loss: 0.5814, test_loss: 0.9282, test_f1: 0.6082
 epoch: 40, train_loss: 0.6251, test_loss: 0.9119, test_f1: 0.5747
 epoch: 41, train_loss: 0.6224, test_loss: 0.8388, test_f1: 0.6047
 epoch: 42, train_loss: 0.5936, test_loss: 0.7980, test_f1: 0.6455
 epoch: 43, train_loss: 0.5664, test_loss: 0.8878, test_f1: 0.6079
 epoch: 44, train_loss: 0.5749, test_loss: 1.0917, test_f1: 0.5812
 epoch: 45, train_loss: 0.5740, test_loss: 0.8342, test_f1: 0.6142
 epoch: 46, train_loss: 0.5837, test_loss: 0.8909, test_f1: 0.6412
 epoch: 47, train_loss: 0.5923, test_loss: 1.0162, test_f1: 0.6061
 epoch: 48, train_loss: 0.6074, test_loss: 0.9204, test_f1: 0.5921
 epoch: 49, train_loss: 0.5772, test_loss: 0.8642, test_f1: 0.6310
 epoch: 50, train_loss: 0.5710, test_loss: 0.9504, test_f1: 0.5946
 epoch: 51, train_loss: 0.5055, test_loss: 0.8011, test_f1: 0.6545
 epoch: 52, train_loss: 0.4850, test_loss: 0.8816, test_f1: 0.6299
 epoch: 53, train_loss: 0.4877, test_loss: 0.7704, test_f1: 0.6630
 epoch: 54, train_loss: 0.4672, test_loss: 0.8199, test_f1: 0.6558
 epoch: 55, train_loss: 0.4729, test_loss: 0.8795, test_f1: 0.6211
 epoch: 56, train_loss: 0.4692, test_loss: 0.9107, test_f1: 0.6241
 epoch: 57, train_loss: 0.4408, test_loss: 0.9792, test_f1: 0.6382
 epoch: 58, train_loss: 0.4551, test_loss: 0.9693, test_f1: 0.6336
 epoch: 59, train_loss: 0.4516, test_loss: 0.8506, test_f1: 0.6346
 epoch: 60, train_loss: 0.4362, test_loss: 1.0537, test_f1: 0.6237
 epoch: 61, train_loss: 0.4399, test_loss: 0.9104, test_f1: 0.6558
 epoch: 62, train_loss: 0.4257, test_loss: 0.9080, test_f1: 0.6378
 epoch: 63, train_loss: 0.4097, test_loss: 1.0342, test_f1: 0.6613
 epoch: 64, train_loss: 0.4216, test_loss: 1.1012, test_f1: 0.6493
 epoch: 65, train_loss: 0.4308, test_loss: 0.8917, test_f1: 0.6519
 epoch: 66, train_loss: 0.4087, test_loss: 0.9965, test_f1: 0.6490
 epoch: 67, train_loss: 0.4144, test_loss: 0.9794, test_f1: 0.6800
 epoch: 68, train_loss: 0.4137, test_loss: 0.9342, test_f1: 0.6504
 epoch: 69, train_loss: 0.4176, test_loss: 1.0530, test_f1: 0.6484
 epoch: 70, train_loss: 0.4048, test_loss: 1.0456, test_f1: 0.6436
 epoch: 71, train_loss: 0.3969, test_loss: 1.0119, test_f1: 0.6463
 epoch: 72, train_loss: 0.4207, test_loss: 1.2212, test_f1: 0.6122
 epoch: 73, train_loss: 0.4172, test_loss: 0.9380, test_f1: 0.6701
 epoch: 74, train_loss: 0.4094, test_loss: 1.1686, test_f1: 0.6245
 epoch: 75, train_loss: 0.4244, test_loss: 0.9802, test_f1: 0.6683
 epoch: 76, train_loss: 0.3994, test_loss: 1.2363, test_f1: 0.6141
 epoch: 77, train_loss: 0.4085, test_loss: 1.0129, test_f1: 0.6324
 epoch: 78, train_loss: 0.3926, test_loss: 0.9843, test_f1: 0.6454
 epoch: 79, train_loss: 0.3930, test_loss: 0.9946, test_f1: 0.6576
 epoch: 80, train_loss: 0.3801, test_loss: 1.0866, test_f1: 0.6726
 epoch: 81, train_loss: 0.3853, test_loss: 1.1346, test_f1: 0.6326
 epoch: 82, train_loss: 0.3530, test_loss: 1.0563, test_f1: 0.6354
 epoch: 83, train_loss: 0.3833, test_loss: 0.9910, test_f1: 0.6815
 epoch: 84, train_loss: 0.3817, test_loss: 1.0295, test_f1: 0.6528
 epoch: 85, train_loss: 0.3823, test_loss: 1.0270, test_f1: 0.6605
 epoch: 86, train_loss: 0.3976, test_loss: 1.1048, test_f1: 0.6348
 epoch: 87, train_loss: 0.3690, test_loss: 1.1093, test_f1: 0.6241
 epoch: 88, train_loss: 0.3822, test_loss: 0.9802, test_f1: 0.6512
 epoch: 89, train_loss: 0.3698, test_loss: 1.1274, test_f1: 0.6742
 epoch: 90, train_loss: 0.3626, test_loss: 1.1092, test_f1: 0.6524
 epoch: 91, train_loss: 0.3569, test_loss: 1.1422, test_f1: 0.6309
 epoch: 92, train_loss: 0.3565, test_loss: 1.1348, test_f1: 0.6489
 epoch: 93, train_loss: 0.3999, test_loss: 1.0041, test_f1: 0.6462
 epoch: 94, train_loss: 0.3645, test_loss: 1.1994, test_f1: 0.6264
 epoch: 95, train_loss: 0.3542, test_loss: 1.1094, test_f1: 0.6430
 epoch: 96, train_loss: 0.3547, test_loss: 1.2775, test_f1: 0.6114
 epoch: 97, train_loss: 0.3344, test_loss: 1.1322, test_f1: 0.6342
 epoch: 98, train_loss: 0.3410, test_loss: 1.2047, test_f1: 0.6158
 epoch: 99, train_loss: 0.3427, test_loss: 1.1139, test_f1: 0.6845
##################ITERATION #4 ****************************************
 epoch: 0, train_loss: 1.2860, test_loss: 1.3972, test_f1: 0.2899
 epoch: 1, train_loss: 1.0110, test_loss: 1.2564, test_f1: 0.3849
 epoch: 2, train_loss: 0.9649, test_loss: 1.0706, test_f1: 0.4659
 epoch: 3, train_loss: 0.9391, test_loss: 1.1866, test_f1: 0.4688
 epoch: 4, train_loss: 0.9242, test_loss: 0.9924, test_f1: 0.5155
 epoch: 5, train_loss: 0.9150, test_loss: 0.9363, test_f1: 0.5207
 epoch: 6, train_loss: 0.8851, test_loss: 1.1529, test_f1: 0.4375
 epoch: 7, train_loss: 0.8779, test_loss: 0.8804, test_f1: 0.5077
 epoch: 8, train_loss: 0.8846, test_loss: 1.1460, test_f1: 0.4470
 epoch: 9, train_loss: 0.8613, test_loss: 0.9346, test_f1: 0.5282
 epoch: 10, train_loss: 0.8559, test_loss: 1.0024, test_f1: 0.5230
 epoch: 11, train_loss: 0.8408, test_loss: 0.9828, test_f1: 0.4870
 epoch: 12, train_loss: 0.8296, test_loss: 1.2850, test_f1: 0.4686
 epoch: 13, train_loss: 0.8260, test_loss: 0.9728, test_f1: 0.5221
 epoch: 14, train_loss: 0.8030, test_loss: 0.8825, test_f1: 0.5590
 epoch: 15, train_loss: 0.7904, test_loss: 0.9471, test_f1: 0.6177
 epoch: 16, train_loss: 0.7826, test_loss: 0.9931, test_f1: 0.5062
 epoch: 17, train_loss: 0.7707, test_loss: 0.9439, test_f1: 0.6068
 epoch: 18, train_loss: 0.7499, test_loss: 1.0982, test_f1: 0.5294
 epoch: 19, train_loss: 0.7479, test_loss: 0.8788, test_f1: 0.6078
 epoch: 20, train_loss: 0.7697, test_loss: 0.9061, test_f1: 0.5373
 epoch: 21, train_loss: 0.7414, test_loss: 0.8427, test_f1: 0.5717
 epoch: 22, train_loss: 0.7265, test_loss: 0.8544, test_f1: 0.6147
 epoch: 23, train_loss: 0.7278, test_loss: 0.8081, test_f1: 0.6339
 epoch: 24, train_loss: 0.7115, test_loss: 0.8818, test_f1: 0.6211
 epoch: 25, train_loss: 0.7085, test_loss: 0.8291, test_f1: 0.5951
 epoch: 26, train_loss: 0.6866, test_loss: 0.8216, test_f1: 0.6349
 epoch: 27, train_loss: 0.6965, test_loss: 0.8343, test_f1: 0.6285
 epoch: 28, train_loss: 0.6918, test_loss: 0.9598, test_f1: 0.5515
 epoch: 29, train_loss: 0.6829, test_loss: 0.8700, test_f1: 0.5963
 epoch: 30, train_loss: 0.6933, test_loss: 0.8529, test_f1: 0.6150
 epoch: 31, train_loss: 0.6765, test_loss: 0.9079, test_f1: 0.6003
 epoch: 32, train_loss: 0.6577, test_loss: 0.7480, test_f1: 0.6418
 epoch: 33, train_loss: 0.6449, test_loss: 0.7923, test_f1: 0.6260
 epoch: 34, train_loss: 0.6635, test_loss: 0.8280, test_f1: 0.6001
 epoch: 35, train_loss: 0.6633, test_loss: 0.9248, test_f1: 0.5915
 epoch: 36, train_loss: 0.6370, test_loss: 0.7780, test_f1: 0.6319
 epoch: 37, train_loss: 0.6174, test_loss: 0.8692, test_f1: 0.6229
 epoch: 38, train_loss: 0.6397, test_loss: 0.9771, test_f1: 0.5855
 epoch: 39, train_loss: 0.6032, test_loss: 0.9813, test_f1: 0.6195
 epoch: 40, train_loss: 0.6219, test_loss: 1.0664, test_f1: 0.5335
 epoch: 41, train_loss: 0.6341, test_loss: 1.0342, test_f1: 0.5682
 epoch: 42, train_loss: 0.5877, test_loss: 0.6819, test_f1: 0.6926
 epoch: 43, train_loss: 0.5787, test_loss: 0.8717, test_f1: 0.6174
 epoch: 44, train_loss: 0.5738, test_loss: 0.8296, test_f1: 0.6488
 epoch: 45, train_loss: 0.5594, test_loss: 0.9975, test_f1: 0.6056
 epoch: 46, train_loss: 0.5814, test_loss: 0.6839, test_f1: 0.6929
 epoch: 47, train_loss: 0.5882, test_loss: 0.9067, test_f1: 0.5861
 epoch: 48, train_loss: 0.5888, test_loss: 1.0330, test_f1: 0.5983
 epoch: 49, train_loss: 0.5850, test_loss: 0.8262, test_f1: 0.6699
 epoch: 50, train_loss: 0.5656, test_loss: 0.9077, test_f1: 0.6488
 epoch: 51, train_loss: 0.5224, test_loss: 0.9386, test_f1: 0.6220
 epoch: 52, train_loss: 0.5122, test_loss: 0.8607, test_f1: 0.6524
 epoch: 53, train_loss: 0.4837, test_loss: 0.8904, test_f1: 0.6422
 epoch: 54, train_loss: 0.5063, test_loss: 0.9591, test_f1: 0.6686
 epoch: 55, train_loss: 0.4770, test_loss: 0.9141, test_f1: 0.6774
 epoch: 56, train_loss: 0.4693, test_loss: 0.9312, test_f1: 0.6872
 epoch: 57, train_loss: 0.4605, test_loss: 0.9137, test_f1: 0.6651
 epoch: 58, train_loss: 0.4528, test_loss: 0.9504, test_f1: 0.6740
 epoch: 59, train_loss: 0.4255, test_loss: 0.9197, test_f1: 0.6558
 epoch: 60, train_loss: 0.4240, test_loss: 1.1053, test_f1: 0.6211
 epoch: 61, train_loss: 0.4508, test_loss: 0.9656, test_f1: 0.6696
 epoch: 62, train_loss: 0.4688, test_loss: 0.9395, test_f1: 0.6837
 epoch: 63, train_loss: 0.4408, test_loss: 0.9746, test_f1: 0.6496
 epoch: 64, train_loss: 0.4263, test_loss: 0.9899, test_f1: 0.6349
 epoch: 65, train_loss: 0.4311, test_loss: 0.9828, test_f1: 0.6500
 epoch: 66, train_loss: 0.4429, test_loss: 0.9109, test_f1: 0.6785
 epoch: 67, train_loss: 0.4177, test_loss: 0.9778, test_f1: 0.6563
 epoch: 68, train_loss: 0.4379, test_loss: 0.9100, test_f1: 0.6605
 epoch: 69, train_loss: 0.4202, test_loss: 0.8869, test_f1: 0.6711
 epoch: 70, train_loss: 0.4414, test_loss: 0.9788, test_f1: 0.6553
 epoch: 71, train_loss: 0.4245, test_loss: 0.9538, test_f1: 0.6712
 epoch: 72, train_loss: 0.4206, test_loss: 0.9716, test_f1: 0.6498
 epoch: 73, train_loss: 0.4164, test_loss: 1.1259, test_f1: 0.6101
 epoch: 74, train_loss: 0.4265, test_loss: 0.9331, test_f1: 0.6506
 epoch: 75, train_loss: 0.4094, test_loss: 0.9498, test_f1: 0.6597
 epoch: 76, train_loss: 0.4102, test_loss: 0.9964, test_f1: 0.6453
 epoch: 77, train_loss: 0.3879, test_loss: 1.0003, test_f1: 0.6833
 epoch: 78, train_loss: 0.3981, test_loss: 0.9529, test_f1: 0.6548
 epoch: 79, train_loss: 0.3978, test_loss: 0.9885, test_f1: 0.6502
 epoch: 80, train_loss: 0.4081, test_loss: 1.0808, test_f1: 0.6695
 epoch: 81, train_loss: 0.4023, test_loss: 0.9742, test_f1: 0.6641
 epoch: 82, train_loss: 0.4006, test_loss: 0.9613, test_f1: 0.6860
 epoch: 83, train_loss: 0.3846, test_loss: 1.1631, test_f1: 0.6472
 epoch: 84, train_loss: 0.3730, test_loss: 1.1058, test_f1: 0.6699
 epoch: 85, train_loss: 0.3669, test_loss: 1.1729, test_f1: 0.6437
 epoch: 86, train_loss: 0.3821, test_loss: 1.1163, test_f1: 0.6628
 epoch: 87, train_loss: 0.3909, test_loss: 1.1163, test_f1: 0.6575
 epoch: 88, train_loss: 0.3693, test_loss: 1.1734, test_f1: 0.6687
 epoch: 89, train_loss: 0.3929, test_loss: 1.1049, test_f1: 0.6534
 epoch: 90, train_loss: 0.3531, test_loss: 1.0935, test_f1: 0.6713
 epoch: 91, train_loss: 0.3467, test_loss: 1.0561, test_f1: 0.6531
 epoch: 92, train_loss: 0.3845, test_loss: 1.6052, test_f1: 0.6035
 epoch: 93, train_loss: 0.3777, test_loss: 1.1376, test_f1: 0.6711
 epoch: 94, train_loss: 0.3404, test_loss: 1.1493, test_f1: 0.6484
 epoch: 95, train_loss: 0.3358, test_loss: 1.1062, test_f1: 0.6659
 epoch: 96, train_loss: 0.3245, test_loss: 1.1444, test_f1: 0.6561
 epoch: 97, train_loss: 0.3373, test_loss: 1.2169, test_f1: 0.6648
 epoch: 98, train_loss: 0.3417, test_loss: 1.3864, test_f1: 0.6192
 epoch: 99, train_loss: 0.3357, test_loss: 1.1071, test_f1: 0.6831
##################ITERATION #5 ****************************************
 epoch: 0, train_loss: 1.2221, test_loss: 1.1761, test_f1: 0.4357
 epoch: 1, train_loss: 0.9950, test_loss: 1.0018, test_f1: 0.4782
 epoch: 2, train_loss: 0.9314, test_loss: 1.3093, test_f1: 0.4365
 epoch: 3, train_loss: 0.9216, test_loss: 1.2487, test_f1: 0.4656
 epoch: 4, train_loss: 0.8891, test_loss: 0.9227, test_f1: 0.4954
 epoch: 5, train_loss: 0.8411, test_loss: 0.9404, test_f1: 0.5562
 epoch: 6, train_loss: 0.8578, test_loss: 0.9162, test_f1: 0.5938
 epoch: 7, train_loss: 0.8214, test_loss: 0.9508, test_f1: 0.5146
 epoch: 8, train_loss: 0.8096, test_loss: 0.9070, test_f1: 0.5430
 epoch: 9, train_loss: 0.8012, test_loss: 0.9165, test_f1: 0.5998
 epoch: 10, train_loss: 0.7691, test_loss: 1.0451, test_f1: 0.5103
 epoch: 11, train_loss: 0.7846, test_loss: 0.9340, test_f1: 0.6341
 epoch: 12, train_loss: 0.7665, test_loss: 1.2153, test_f1: 0.4907
 epoch: 13, train_loss: 0.7613, test_loss: 1.2310, test_f1: 0.4416
 epoch: 14, train_loss: 0.7438, test_loss: 1.2728, test_f1: 0.5274
 epoch: 15, train_loss: 0.7321, test_loss: 1.1448, test_f1: 0.5598
 epoch: 16, train_loss: 0.7035, test_loss: 0.8642, test_f1: 0.6011
 epoch: 17, train_loss: 0.6882, test_loss: 0.8745, test_f1: 0.6346
 epoch: 18, train_loss: 0.7277, test_loss: 0.9047, test_f1: 0.6171
 epoch: 19, train_loss: 0.7006, test_loss: 1.0641, test_f1: 0.5724
 epoch: 20, train_loss: 0.7080, test_loss: 0.9967, test_f1: 0.5841
 epoch: 21, train_loss: 0.6699, test_loss: 0.8870, test_f1: 0.6448
 epoch: 22, train_loss: 0.6738, test_loss: 0.8562, test_f1: 0.6153
 epoch: 23, train_loss: 0.6632, test_loss: 0.8320, test_f1: 0.6560
 epoch: 24, train_loss: 0.6710, test_loss: 0.9282, test_f1: 0.5769
 epoch: 25, train_loss: 0.6847, test_loss: 0.9790, test_f1: 0.6072
 epoch: 26, train_loss: 0.6339, test_loss: 0.9442, test_f1: 0.6228
 epoch: 27, train_loss: 0.6609, test_loss: 0.9746, test_f1: 0.6050
 epoch: 28, train_loss: 0.6557, test_loss: 1.0402, test_f1: 0.6413
 epoch: 29, train_loss: 0.6285, test_loss: 1.1844, test_f1: 0.5645
 epoch: 30, train_loss: 0.6436, test_loss: 0.9651, test_f1: 0.6262
 epoch: 31, train_loss: 0.6326, test_loss: 1.0164, test_f1: 0.6317
 epoch: 32, train_loss: 0.6121, test_loss: 0.8671, test_f1: 0.6590
 epoch: 33, train_loss: 0.6041, test_loss: 1.0047, test_f1: 0.6485
 epoch: 34, train_loss: 0.6084, test_loss: 0.9515, test_f1: 0.6610
 epoch: 35, train_loss: 0.6041, test_loss: 1.3857, test_f1: 0.5445
 epoch: 36, train_loss: 0.5727, test_loss: 0.8072, test_f1: 0.6034
 epoch: 37, train_loss: 0.5940, test_loss: 0.9485, test_f1: 0.6108
 epoch: 38, train_loss: 0.6046, test_loss: 0.9813, test_f1: 0.6081
 epoch: 39, train_loss: 0.5751, test_loss: 0.9794, test_f1: 0.6525
 epoch: 40, train_loss: 0.5572, test_loss: 0.9175, test_f1: 0.6307
 epoch: 41, train_loss: 0.5838, test_loss: 0.9095, test_f1: 0.6436
 epoch: 42, train_loss: 0.5835, test_loss: 1.0420, test_f1: 0.6273
 epoch: 43, train_loss: 0.5698, test_loss: 1.0670, test_f1: 0.6389
 epoch: 44, train_loss: 0.5546, test_loss: 0.8357, test_f1: 0.6693
 epoch: 45, train_loss: 0.5926, test_loss: 0.9673, test_f1: 0.6003
 epoch: 46, train_loss: 0.5721, test_loss: 1.0023, test_f1: 0.6608
 epoch: 47, train_loss: 0.5481, test_loss: 0.9833, test_f1: 0.6761
 epoch: 48, train_loss: 0.5424, test_loss: 0.9416, test_f1: 0.6405
 epoch: 49, train_loss: 0.5301, test_loss: 0.9090, test_f1: 0.6700
 epoch: 50, train_loss: 0.5238, test_loss: 0.9700, test_f1: 0.6395
 epoch: 51, train_loss: 0.4978, test_loss: 0.9925, test_f1: 0.6924
 epoch: 52, train_loss: 0.4609, test_loss: 1.1438, test_f1: 0.6717
 epoch: 53, train_loss: 0.4525, test_loss: 1.0360, test_f1: 0.6832
 epoch: 54, train_loss: 0.4499, test_loss: 1.0692, test_f1: 0.6788
 epoch: 55, train_loss: 0.4315, test_loss: 1.1438, test_f1: 0.6612
 epoch: 56, train_loss: 0.4426, test_loss: 0.9557, test_f1: 0.6580
 epoch: 57, train_loss: 0.4143, test_loss: 1.0690, test_f1: 0.6954
 epoch: 58, train_loss: 0.4201, test_loss: 1.1200, test_f1: 0.6841
 epoch: 59, train_loss: 0.4275, test_loss: 1.0659, test_f1: 0.6598
 epoch: 60, train_loss: 0.4066, test_loss: 1.0452, test_f1: 0.6538
 epoch: 61, train_loss: 0.4197, test_loss: 0.9239, test_f1: 0.7044
 epoch: 62, train_loss: 0.4239, test_loss: 1.1803, test_f1: 0.6638
 epoch: 63, train_loss: 0.4018, test_loss: 0.9314, test_f1: 0.6848
 epoch: 64, train_loss: 0.4041, test_loss: 1.2244, test_f1: 0.6694
 epoch: 65, train_loss: 0.3906, test_loss: 1.1750, test_f1: 0.6703
 epoch: 66, train_loss: 0.3892, test_loss: 1.0277, test_f1: 0.6526
 epoch: 67, train_loss: 0.3935, test_loss: 1.0387, test_f1: 0.6758
 epoch: 68, train_loss: 0.3999, test_loss: 1.0306, test_f1: 0.6597
 epoch: 69, train_loss: 0.3931, test_loss: 0.9498, test_f1: 0.6733
 epoch: 70, train_loss: 0.3870, test_loss: 1.0705, test_f1: 0.6703
 epoch: 71, train_loss: 0.3926, test_loss: 1.2582, test_f1: 0.6424
 epoch: 72, train_loss: 0.3766, test_loss: 1.0244, test_f1: 0.6740
 epoch: 73, train_loss: 0.3932, test_loss: 1.1647, test_f1: 0.6767
 epoch: 74, train_loss: 0.3791, test_loss: 1.0543, test_f1: 0.6733
 epoch: 75, train_loss: 0.3924, test_loss: 1.2058, test_f1: 0.6536
 epoch: 76, train_loss: 0.3780, test_loss: 1.1143, test_f1: 0.6697
 epoch: 77, train_loss: 0.3774, test_loss: 1.0892, test_f1: 0.6967
 epoch: 78, train_loss: 0.3598, test_loss: 1.1168, test_f1: 0.6732
 epoch: 79, train_loss: 0.3558, test_loss: 1.0764, test_f1: 0.6614
 epoch: 80, train_loss: 0.3541, test_loss: 1.2767, test_f1: 0.6501
 epoch: 81, train_loss: 0.3564, test_loss: 1.1217, test_f1: 0.6322
 epoch: 82, train_loss: 0.3611, test_loss: 1.0739, test_f1: 0.6702
 epoch: 83, train_loss: 0.3426, test_loss: 1.2368, test_f1: 0.6708
 epoch: 84, train_loss: 0.3357, test_loss: 1.1957, test_f1: 0.6564
 epoch: 85, train_loss: 0.3397, test_loss: 1.1720, test_f1: 0.6505
 epoch: 86, train_loss: 0.3500, test_loss: 1.4471, test_f1: 0.6332
 epoch: 87, train_loss: 0.3633, test_loss: 1.1880, test_f1: 0.6808
 epoch: 88, train_loss: 0.3580, test_loss: 1.2501, test_f1: 0.6594
 epoch: 89, train_loss: 0.3509, test_loss: 1.3059, test_f1: 0.6759
 epoch: 90, train_loss: 0.3078, test_loss: 1.4403, test_f1: 0.6394
 epoch: 91, train_loss: 0.3234, test_loss: 1.1330, test_f1: 0.6745
 epoch: 92, train_loss: 0.3322, test_loss: 1.2484, test_f1: 0.6769
 epoch: 93, train_loss: 0.3191, test_loss: 1.2884, test_f1: 0.6845
 epoch: 94, train_loss: 0.3005, test_loss: 1.2373, test_f1: 0.6832
 epoch: 95, train_loss: 0.3207, test_loss: 1.2720, test_f1: 0.6826
 epoch: 96, train_loss: 0.3157, test_loss: 1.9944, test_f1: 0.5606
 epoch: 97, train_loss: 0.3129, test_loss: 1.3041, test_f1: 0.6702
 epoch: 98, train_loss: 0.2973, test_loss: 1.4312, test_f1: 0.6468
 epoch: 99, train_loss: 0.3081, test_loss: 1.3992, test_f1: 0.6564
##################ITERATION #6 ****************************************
 epoch: 0, train_loss: 1.2834, test_loss: 1.1072, test_f1: 0.4127
 epoch: 1, train_loss: 1.0287, test_loss: 1.1535, test_f1: 0.3676
 epoch: 2, train_loss: 1.0035, test_loss: 1.2504, test_f1: 0.4250
 epoch: 3, train_loss: 0.9598, test_loss: 1.1292, test_f1: 0.4283
 epoch: 4, train_loss: 0.9483, test_loss: 1.0247, test_f1: 0.4694
 epoch: 5, train_loss: 0.9270, test_loss: 1.0015, test_f1: 0.5008
 epoch: 6, train_loss: 0.8943, test_loss: 1.4125, test_f1: 0.4274
 epoch: 7, train_loss: 0.8979, test_loss: 0.9384, test_f1: 0.5282
 epoch: 8, train_loss: 0.8658, test_loss: 0.9900, test_f1: 0.4490
 epoch: 9, train_loss: 0.8587, test_loss: 0.8755, test_f1: 0.5483
 epoch: 10, train_loss: 0.8347, test_loss: 0.8866, test_f1: 0.5373
 epoch: 11, train_loss: 0.8090, test_loss: 0.9100, test_f1: 0.5345
 epoch: 12, train_loss: 0.7975, test_loss: 0.8485, test_f1: 0.6164
 epoch: 13, train_loss: 0.8010, test_loss: 0.9446, test_f1: 0.4926
 epoch: 14, train_loss: 0.7830, test_loss: 0.9266, test_f1: 0.5251
 epoch: 15, train_loss: 0.7801, test_loss: 0.8149, test_f1: 0.5653
 epoch: 16, train_loss: 0.7592, test_loss: 0.9041, test_f1: 0.5701
 epoch: 17, train_loss: 0.7653, test_loss: 0.9485, test_f1: 0.5170
 epoch: 18, train_loss: 0.7505, test_loss: 0.8902, test_f1: 0.6352
 epoch: 19, train_loss: 0.7317, test_loss: 0.9251, test_f1: 0.5354
 epoch: 20, train_loss: 0.7412, test_loss: 0.8547, test_f1: 0.6464
 epoch: 21, train_loss: 0.7223, test_loss: 0.8413, test_f1: 0.6205
 epoch: 22, train_loss: 0.7356, test_loss: 0.8679, test_f1: 0.5849
 epoch: 23, train_loss: 0.7279, test_loss: 0.8792, test_f1: 0.5789
 epoch: 24, train_loss: 0.7271, test_loss: 0.9470, test_f1: 0.5343
 epoch: 25, train_loss: 0.6992, test_loss: 0.9427, test_f1: 0.6039
 epoch: 26, train_loss: 0.7040, test_loss: 0.9206, test_f1: 0.5697
 epoch: 27, train_loss: 0.6942, test_loss: 0.8713, test_f1: 0.5894
 epoch: 28, train_loss: 0.6737, test_loss: 0.7790, test_f1: 0.6305
 epoch: 29, train_loss: 0.6524, test_loss: 0.9955, test_f1: 0.5899
 epoch: 30, train_loss: 0.6609, test_loss: 0.9558, test_f1: 0.5979
 epoch: 31, train_loss: 0.6545, test_loss: 0.8368, test_f1: 0.6480
 epoch: 32, train_loss: 0.6513, test_loss: 0.9708, test_f1: 0.5914
 epoch: 33, train_loss: 0.6458, test_loss: 1.3496, test_f1: 0.5485
 epoch: 34, train_loss: 0.6429, test_loss: 0.9904, test_f1: 0.5834
 epoch: 35, train_loss: 0.6404, test_loss: 1.0325, test_f1: 0.6254
 epoch: 36, train_loss: 0.6179, test_loss: 0.9075, test_f1: 0.6071
 epoch: 37, train_loss: 0.6183, test_loss: 1.0400, test_f1: 0.5934
 epoch: 38, train_loss: 0.6174, test_loss: 1.0935, test_f1: 0.6194
 epoch: 39, train_loss: 0.6096, test_loss: 0.9676, test_f1: 0.6369
 epoch: 40, train_loss: 0.5873, test_loss: 1.0156, test_f1: 0.6332
 epoch: 41, train_loss: 0.5860, test_loss: 1.0646, test_f1: 0.5798
 epoch: 42, train_loss: 0.5980, test_loss: 0.7708, test_f1: 0.6141
 epoch: 43, train_loss: 0.5980, test_loss: 1.0434, test_f1: 0.5903
 epoch: 44, train_loss: 0.5829, test_loss: 0.9641, test_f1: 0.6540
 epoch: 45, train_loss: 0.5731, test_loss: 0.9470, test_f1: 0.6483
 epoch: 46, train_loss: 0.5862, test_loss: 0.9876, test_f1: 0.5138
 epoch: 47, train_loss: 0.5654, test_loss: 1.1458, test_f1: 0.6076
 epoch: 48, train_loss: 0.5730, test_loss: 1.2269, test_f1: 0.5411
 epoch: 49, train_loss: 0.5389, test_loss: 1.0165, test_f1: 0.6279
 epoch: 50, train_loss: 0.5449, test_loss: 1.0382, test_f1: 0.6585
 epoch: 51, train_loss: 0.5245, test_loss: 1.1006, test_f1: 0.6204
 epoch: 52, train_loss: 0.4904, test_loss: 1.0524, test_f1: 0.6725
 epoch: 53, train_loss: 0.4892, test_loss: 1.1259, test_f1: 0.6157
 epoch: 54, train_loss: 0.4798, test_loss: 1.0947, test_f1: 0.6245
 epoch: 55, train_loss: 0.4809, test_loss: 1.1167, test_f1: 0.6499
 epoch: 56, train_loss: 0.4561, test_loss: 1.1107, test_f1: 0.6183
 epoch: 57, train_loss: 0.4682, test_loss: 1.1513, test_f1: 0.6267
 epoch: 58, train_loss: 0.4529, test_loss: 1.0129, test_f1: 0.6356
 epoch: 59, train_loss: 0.4398, test_loss: 1.2116, test_f1: 0.6209
 epoch: 60, train_loss: 0.4442, test_loss: 1.0729, test_f1: 0.6294
 epoch: 61, train_loss: 0.4310, test_loss: 1.0341, test_f1: 0.6499
 epoch: 62, train_loss: 0.4607, test_loss: 0.9965, test_f1: 0.6320
 epoch: 63, train_loss: 0.4412, test_loss: 1.1028, test_f1: 0.6285
 epoch: 64, train_loss: 0.4298, test_loss: 1.0752, test_f1: 0.6499
 epoch: 65, train_loss: 0.4320, test_loss: 1.3379, test_f1: 0.5799
 epoch: 66, train_loss: 0.4127, test_loss: 1.5835, test_f1: 0.6161
 epoch: 67, train_loss: 0.4169, test_loss: 1.1423, test_f1: 0.6616
 epoch: 68, train_loss: 0.4068, test_loss: 1.3319, test_f1: 0.6146
 epoch: 69, train_loss: 0.4015, test_loss: 1.4578, test_f1: 0.5853
 epoch: 70, train_loss: 0.3968, test_loss: 1.4059, test_f1: 0.6129
 epoch: 71, train_loss: 0.4268, test_loss: 1.1415, test_f1: 0.6699
 epoch: 72, train_loss: 0.3965, test_loss: 1.2700, test_f1: 0.6262
 epoch: 73, train_loss: 0.4208, test_loss: 1.2794, test_f1: 0.6443
 epoch: 74, train_loss: 0.4185, test_loss: 1.3856, test_f1: 0.6061
 epoch: 75, train_loss: 0.4221, test_loss: 1.2206, test_f1: 0.6408
 epoch: 76, train_loss: 0.4005, test_loss: 1.3073, test_f1: 0.6655
 epoch: 77, train_loss: 0.3758, test_loss: 1.1580, test_f1: 0.6540
 epoch: 78, train_loss: 0.3843, test_loss: 1.2440, test_f1: 0.6678
 epoch: 79, train_loss: 0.3732, test_loss: 1.2677, test_f1: 0.6343
 epoch: 80, train_loss: 0.4027, test_loss: 1.1778, test_f1: 0.6438
 epoch: 81, train_loss: 0.3872, test_loss: 1.2546, test_f1: 0.6390
 epoch: 82, train_loss: 0.3981, test_loss: 1.6227, test_f1: 0.5917
 epoch: 83, train_loss: 0.3984, test_loss: 1.2567, test_f1: 0.6243
 epoch: 84, train_loss: 0.3642, test_loss: 1.4590, test_f1: 0.5925
 epoch: 85, train_loss: 0.3620, test_loss: 1.5207, test_f1: 0.6149
 epoch: 86, train_loss: 0.3815, test_loss: 1.4347, test_f1: 0.6432
 epoch: 87, train_loss: 0.3868, test_loss: 1.2331, test_f1: 0.6377
 epoch: 88, train_loss: 0.3764, test_loss: 1.4813, test_f1: 0.6181
 epoch: 89, train_loss: 0.3585, test_loss: 1.5396, test_f1: 0.6188
 epoch: 90, train_loss: 0.3690, test_loss: 1.2804, test_f1: 0.6552
 epoch: 91, train_loss: 0.3784, test_loss: 1.2561, test_f1: 0.6303
 epoch: 92, train_loss: 0.3656, test_loss: 1.4251, test_f1: 0.6330
 epoch: 93, train_loss: 0.3487, test_loss: 1.2301, test_f1: 0.6424
 epoch: 94, train_loss: 0.3713, test_loss: 1.6491, test_f1: 0.6104
 epoch: 95, train_loss: 0.3559, test_loss: 1.2437, test_f1: 0.6262
 epoch: 96, train_loss: 0.3358, test_loss: 1.4345, test_f1: 0.6193
 epoch: 97, train_loss: 0.3408, test_loss: 1.4440, test_f1: 0.6151
 epoch: 98, train_loss: 0.3391, test_loss: 1.4158, test_f1: 0.6458
 epoch: 99, train_loss: 0.3497, test_loss: 1.3747, test_f1: 0.6511
##################ITERATION #7 ****************************************
 epoch: 0, train_loss: 1.2218, test_loss: 1.1768, test_f1: 0.3369
 epoch: 1, train_loss: 1.0094, test_loss: 1.0573, test_f1: 0.4413
 epoch: 2, train_loss: 0.9565, test_loss: 1.0065, test_f1: 0.4938
 epoch: 3, train_loss: 0.9342, test_loss: 1.0370, test_f1: 0.4485
 epoch: 4, train_loss: 0.9289, test_loss: 0.9412, test_f1: 0.4795
 epoch: 5, train_loss: 0.9216, test_loss: 0.9615, test_f1: 0.5140
 epoch: 6, train_loss: 0.8961, test_loss: 1.1312, test_f1: 0.4776
 epoch: 7, train_loss: 0.9141, test_loss: 1.0723, test_f1: 0.4519
 epoch: 8, train_loss: 0.8780, test_loss: 1.0684, test_f1: 0.4499
 epoch: 9, train_loss: 0.8572, test_loss: 1.1943, test_f1: 0.4818
 epoch: 10, train_loss: 0.8456, test_loss: 0.9112, test_f1: 0.5495
 epoch: 11, train_loss: 0.8332, test_loss: 0.9647, test_f1: 0.5333
 epoch: 12, train_loss: 0.7989, test_loss: 0.9447, test_f1: 0.5145
 epoch: 13, train_loss: 0.8086, test_loss: 0.9530, test_f1: 0.5594
 epoch: 14, train_loss: 0.8051, test_loss: 0.9437, test_f1: 0.5351
 epoch: 15, train_loss: 0.7946, test_loss: 1.0553, test_f1: 0.4666
 epoch: 16, train_loss: 0.8064, test_loss: 0.9994, test_f1: 0.5376
 epoch: 17, train_loss: 0.7804, test_loss: 0.9469, test_f1: 0.5621
 epoch: 18, train_loss: 0.7618, test_loss: 0.8567, test_f1: 0.5778
 epoch: 19, train_loss: 0.7596, test_loss: 0.9306, test_f1: 0.5861
 epoch: 20, train_loss: 0.7552, test_loss: 0.8632, test_f1: 0.5749
 epoch: 21, train_loss: 0.7578, test_loss: 1.4104, test_f1: 0.4862
 epoch: 22, train_loss: 0.7383, test_loss: 0.9592, test_f1: 0.5398
 epoch: 23, train_loss: 0.7400, test_loss: 0.9044, test_f1: 0.5374
 epoch: 24, train_loss: 0.7260, test_loss: 0.8487, test_f1: 0.5814
 epoch: 25, train_loss: 0.7228, test_loss: 1.0666, test_f1: 0.5697
 epoch: 26, train_loss: 0.7045, test_loss: 0.8584, test_f1: 0.5547
 epoch: 27, train_loss: 0.7090, test_loss: 0.8903, test_f1: 0.6012
 epoch: 28, train_loss: 0.7127, test_loss: 0.9900, test_f1: 0.5157
 epoch: 29, train_loss: 0.7022, test_loss: 1.0595, test_f1: 0.5750
 epoch: 30, train_loss: 0.7075, test_loss: 1.0766, test_f1: 0.5367
 epoch: 31, train_loss: 0.6918, test_loss: 0.8968, test_f1: 0.5916
 epoch: 32, train_loss: 0.6772, test_loss: 0.9804, test_f1: 0.6050
 epoch: 33, train_loss: 0.6892, test_loss: 1.0799, test_f1: 0.5946
 epoch: 34, train_loss: 0.6752, test_loss: 1.2956, test_f1: 0.4898
 epoch: 35, train_loss: 0.6910, test_loss: 1.0518, test_f1: 0.5855
 epoch: 36, train_loss: 0.6796, test_loss: 0.9935, test_f1: 0.5774
 epoch: 37, train_loss: 0.6563, test_loss: 0.9724, test_f1: 0.5908
 epoch: 38, train_loss: 0.6532, test_loss: 0.9312, test_f1: 0.5511
 epoch: 39, train_loss: 0.6586, test_loss: 1.3427, test_f1: 0.5251
 epoch: 40, train_loss: 0.6710, test_loss: 1.1092, test_f1: 0.5386
 epoch: 41, train_loss: 0.6523, test_loss: 0.9768, test_f1: 0.6086
 epoch: 42, train_loss: 0.6631, test_loss: 0.9188, test_f1: 0.5988
 epoch: 43, train_loss: 0.6431, test_loss: 0.9144, test_f1: 0.6321
 epoch: 44, train_loss: 0.6335, test_loss: 0.9015, test_f1: 0.6170
 epoch: 45, train_loss: 0.6367, test_loss: 1.1231, test_f1: 0.5863
 epoch: 46, train_loss: 0.6337, test_loss: 0.8805, test_f1: 0.6054
 epoch: 47, train_loss: 0.6041, test_loss: 0.8346, test_f1: 0.6238
 epoch: 48, train_loss: 0.6121, test_loss: 0.8709, test_f1: 0.6377
 epoch: 49, train_loss: 0.6018, test_loss: 1.0131, test_f1: 0.6030
 epoch: 50, train_loss: 0.5849, test_loss: 0.9162, test_f1: 0.6805
 epoch: 51, train_loss: 0.5682, test_loss: 0.9124, test_f1: 0.6622
 epoch: 52, train_loss: 0.5466, test_loss: 1.0603, test_f1: 0.6320
 epoch: 53, train_loss: 0.5456, test_loss: 0.9491, test_f1: 0.6178
 epoch: 54, train_loss: 0.5392, test_loss: 0.8007, test_f1: 0.6673
 epoch: 55, train_loss: 0.5356, test_loss: 0.8597, test_f1: 0.6620
 epoch: 56, train_loss: 0.5291, test_loss: 0.8175, test_f1: 0.6597
 epoch: 57, train_loss: 0.5262, test_loss: 0.9199, test_f1: 0.6591
 epoch: 58, train_loss: 0.5240, test_loss: 1.0320, test_f1: 0.6239
 epoch: 59, train_loss: 0.5129, test_loss: 0.9858, test_f1: 0.6552
 epoch: 60, train_loss: 0.5169, test_loss: 0.8622, test_f1: 0.6236
 epoch: 61, train_loss: 0.5014, test_loss: 1.0083, test_f1: 0.6567
 epoch: 62, train_loss: 0.4927, test_loss: 0.9378, test_f1: 0.6751
 epoch: 63, train_loss: 0.5219, test_loss: 1.0009, test_f1: 0.6222
 epoch: 64, train_loss: 0.4973, test_loss: 1.1844, test_f1: 0.6328
 epoch: 65, train_loss: 0.4999, test_loss: 0.9264, test_f1: 0.6553
 epoch: 66, train_loss: 0.4873, test_loss: 0.9147, test_f1: 0.6822
 epoch: 67, train_loss: 0.4809, test_loss: 0.9258, test_f1: 0.6516
 epoch: 68, train_loss: 0.4962, test_loss: 0.9662, test_f1: 0.6426
 epoch: 69, train_loss: 0.4805, test_loss: 1.1096, test_f1: 0.6407
 epoch: 70, train_loss: 0.4900, test_loss: 0.9936, test_f1: 0.6387
 epoch: 71, train_loss: 0.4897, test_loss: 1.1708, test_f1: 0.6501
 epoch: 72, train_loss: 0.4692, test_loss: 1.1912, test_f1: 0.6594
 epoch: 73, train_loss: 0.4787, test_loss: 1.1528, test_f1: 0.6387
 epoch: 74, train_loss: 0.4684, test_loss: 1.2143, test_f1: 0.6026
 epoch: 75, train_loss: 0.4644, test_loss: 1.0587, test_f1: 0.6269
 epoch: 76, train_loss: 0.4532, test_loss: 1.0156, test_f1: 0.6450
 epoch: 77, train_loss: 0.4611, test_loss: 1.0817, test_f1: 0.6556
 epoch: 78, train_loss: 0.4705, test_loss: 1.1428, test_f1: 0.6301
 epoch: 79, train_loss: 0.4556, test_loss: 1.0941, test_f1: 0.6779
 epoch: 80, train_loss: 0.4499, test_loss: 1.1049, test_f1: 0.6543
 epoch: 81, train_loss: 0.4505, test_loss: 1.0881, test_f1: 0.6456
 epoch: 82, train_loss: 0.4658, test_loss: 1.2639, test_f1: 0.6488
 epoch: 83, train_loss: 0.4464, test_loss: 1.1371, test_f1: 0.6303
 epoch: 84, train_loss: 0.4557, test_loss: 0.9933, test_f1: 0.6675
 epoch: 85, train_loss: 0.4542, test_loss: 0.9509, test_f1: 0.6677
 epoch: 86, train_loss: 0.4207, test_loss: 1.1564, test_f1: 0.6496
 epoch: 87, train_loss: 0.4308, test_loss: 1.0660, test_f1: 0.6581
 epoch: 88, train_loss: 0.4439, test_loss: 1.0808, test_f1: 0.6422
 epoch: 89, train_loss: 0.4528, test_loss: 1.0609, test_f1: 0.6413
 epoch: 90, train_loss: 0.4324, test_loss: 1.0571, test_f1: 0.6622
 epoch: 91, train_loss: 0.4322, test_loss: 1.0466, test_f1: 0.6501
 epoch: 92, train_loss: 0.4288, test_loss: 1.0699, test_f1: 0.6575
 epoch: 93, train_loss: 0.4237, test_loss: 1.1948, test_f1: 0.6473
 epoch: 94, train_loss: 0.4246, test_loss: 1.1175, test_f1: 0.6697
 epoch: 95, train_loss: 0.4106, test_loss: 1.0677, test_f1: 0.6756
 epoch: 96, train_loss: 0.4152, test_loss: 1.2358, test_f1: 0.6469
 epoch: 97, train_loss: 0.4016, test_loss: 1.2813, test_f1: 0.6562
 epoch: 98, train_loss: 0.4228, test_loss: 1.0193, test_f1: 0.6757
 epoch: 99, train_loss: 0.4071, test_loss: 1.0212, test_f1: 0.6625
##################ITERATION #8 ****************************************
 epoch: 0, train_loss: 1.2754, test_loss: 1.0402, test_f1: 0.3716
 epoch: 1, train_loss: 0.9879, test_loss: 1.0978, test_f1: 0.3934
 epoch: 2, train_loss: 0.9441, test_loss: 1.0871, test_f1: 0.4932
 epoch: 3, train_loss: 0.9267, test_loss: 0.9513, test_f1: 0.4596
 epoch: 4, train_loss: 0.9301, test_loss: 0.9793, test_f1: 0.4977
 epoch: 5, train_loss: 0.9000, test_loss: 0.8967, test_f1: 0.5336
 epoch: 6, train_loss: 0.8694, test_loss: 1.2295, test_f1: 0.4631
 epoch: 7, train_loss: 0.8728, test_loss: 0.8739, test_f1: 0.5762
 epoch: 8, train_loss: 0.8234, test_loss: 1.4398, test_f1: 0.3920
 epoch: 9, train_loss: 0.8132, test_loss: 1.2131, test_f1: 0.4739
 epoch: 10, train_loss: 0.8080, test_loss: 0.8108, test_f1: 0.5971
 epoch: 11, train_loss: 0.7897, test_loss: 1.0168, test_f1: 0.5443
 epoch: 12, train_loss: 0.7912, test_loss: 1.1391, test_f1: 0.4622
 epoch: 13, train_loss: 0.7625, test_loss: 0.7893, test_f1: 0.5817
 epoch: 14, train_loss: 0.7528, test_loss: 0.9160, test_f1: 0.5378
 epoch: 15, train_loss: 0.7145, test_loss: 0.7600, test_f1: 0.5989
 epoch: 16, train_loss: 0.7325, test_loss: 0.9367, test_f1: 0.5671
 epoch: 17, train_loss: 0.7418, test_loss: 1.0400, test_f1: 0.5488
 epoch: 18, train_loss: 0.7536, test_loss: 1.0306, test_f1: 0.4659
 epoch: 19, train_loss: 0.7243, test_loss: 0.7531, test_f1: 0.5997
 epoch: 20, train_loss: 0.7177, test_loss: 0.8221, test_f1: 0.5973
 epoch: 21, train_loss: 0.7087, test_loss: 0.7932, test_f1: 0.5583
 epoch: 22, train_loss: 0.7152, test_loss: 0.7483, test_f1: 0.5980
 epoch: 23, train_loss: 0.7003, test_loss: 0.7348, test_f1: 0.6310
 epoch: 24, train_loss: 0.6930, test_loss: 0.9315, test_f1: 0.6374
 epoch: 25, train_loss: 0.6574, test_loss: 0.8474, test_f1: 0.5997
 epoch: 26, train_loss: 0.6637, test_loss: 0.8006, test_f1: 0.5896
 epoch: 27, train_loss: 0.6498, test_loss: 0.8958, test_f1: 0.5730
 epoch: 28, train_loss: 0.7248, test_loss: 0.9580, test_f1: 0.5552
 epoch: 29, train_loss: 0.6749, test_loss: 0.9615, test_f1: 0.6237
 epoch: 30, train_loss: 0.6551, test_loss: 0.8057, test_f1: 0.6043
 epoch: 31, train_loss: 0.6549, test_loss: 0.9010, test_f1: 0.5863
 epoch: 32, train_loss: 0.6416, test_loss: 0.8875, test_f1: 0.5837
 epoch: 33, train_loss: 0.6153, test_loss: 0.9293, test_f1: 0.5807
 epoch: 34, train_loss: 0.6412, test_loss: 0.8910, test_f1: 0.6047
 epoch: 35, train_loss: 0.6170, test_loss: 0.8391, test_f1: 0.6467
 epoch: 36, train_loss: 0.6112, test_loss: 0.8298, test_f1: 0.6033
 epoch: 37, train_loss: 0.6122, test_loss: 0.9003, test_f1: 0.6043
 epoch: 38, train_loss: 0.6247, test_loss: 0.8002, test_f1: 0.5913
 epoch: 39, train_loss: 0.6012, test_loss: 0.9351, test_f1: 0.5787
 epoch: 40, train_loss: 0.5797, test_loss: 0.8684, test_f1: 0.6376
 epoch: 41, train_loss: 0.5818, test_loss: 0.9145, test_f1: 0.5965
 epoch: 42, train_loss: 0.5699, test_loss: 1.0575, test_f1: 0.5564
 epoch: 43, train_loss: 0.5724, test_loss: 1.0677, test_f1: 0.5683
 epoch: 44, train_loss: 0.5939, test_loss: 1.0267, test_f1: 0.6185
 epoch: 45, train_loss: 0.5810, test_loss: 0.8880, test_f1: 0.6356
 epoch: 46, train_loss: 0.5527, test_loss: 0.9163, test_f1: 0.5867
 epoch: 47, train_loss: 0.5652, test_loss: 0.8688, test_f1: 0.6343
 epoch: 48, train_loss: 0.5949, test_loss: 1.0184, test_f1: 0.6135
 epoch: 49, train_loss: 0.5517, test_loss: 0.9239, test_f1: 0.6318
 epoch: 50, train_loss: 0.5347, test_loss: 0.8767, test_f1: 0.6405
 epoch: 51, train_loss: 0.5032, test_loss: 1.1794, test_f1: 0.6379
 epoch: 52, train_loss: 0.4799, test_loss: 1.0379, test_f1: 0.6222
 epoch: 53, train_loss: 0.4665, test_loss: 0.9582, test_f1: 0.6768
 epoch: 54, train_loss: 0.4566, test_loss: 0.8977, test_f1: 0.6632
 epoch: 55, train_loss: 0.4602, test_loss: 0.9519, test_f1: 0.6343
 epoch: 56, train_loss: 0.4699, test_loss: 0.8781, test_f1: 0.6758
 epoch: 57, train_loss: 0.4646, test_loss: 1.0054, test_f1: 0.6689
 epoch: 58, train_loss: 0.4656, test_loss: 1.0224, test_f1: 0.6606
 epoch: 59, train_loss: 0.4424, test_loss: 1.0601, test_f1: 0.6357
 epoch: 60, train_loss: 0.4328, test_loss: 1.1123, test_f1: 0.6493
 epoch: 61, train_loss: 0.4481, test_loss: 0.9678, test_f1: 0.6457
 epoch: 62, train_loss: 0.4450, test_loss: 0.9549, test_f1: 0.6464
 epoch: 63, train_loss: 0.4388, test_loss: 1.0540, test_f1: 0.6407
 epoch: 64, train_loss: 0.4414, test_loss: 1.0580, test_f1: 0.6390
 epoch: 65, train_loss: 0.4394, test_loss: 0.9233, test_f1: 0.6540
 epoch: 66, train_loss: 0.4227, test_loss: 1.0721, test_f1: 0.6330
 epoch: 67, train_loss: 0.4441, test_loss: 0.8677, test_f1: 0.6623
 epoch: 68, train_loss: 0.4281, test_loss: 1.1361, test_f1: 0.6315
 epoch: 69, train_loss: 0.4415, test_loss: 1.0106, test_f1: 0.6319
 epoch: 70, train_loss: 0.4254, test_loss: 0.9194, test_f1: 0.6759
 epoch: 71, train_loss: 0.4116, test_loss: 1.0499, test_f1: 0.6491
 epoch: 72, train_loss: 0.4092, test_loss: 0.9966, test_f1: 0.6809
 epoch: 73, train_loss: 0.4187, test_loss: 1.0817, test_f1: 0.6363
 epoch: 74, train_loss: 0.4156, test_loss: 1.1600, test_f1: 0.6378
 epoch: 75, train_loss: 0.4111, test_loss: 0.9220, test_f1: 0.6449
 epoch: 76, train_loss: 0.3984, test_loss: 1.0798, test_f1: 0.6661
 epoch: 77, train_loss: 0.3931, test_loss: 1.1041, test_f1: 0.6519
 epoch: 78, train_loss: 0.4079, test_loss: 1.1908, test_f1: 0.6506
 epoch: 79, train_loss: 0.4142, test_loss: 1.1131, test_f1: 0.6351
 epoch: 80, train_loss: 0.4127, test_loss: 1.1049, test_f1: 0.6276
 epoch: 81, train_loss: 0.4035, test_loss: 1.2218, test_f1: 0.6425
 epoch: 82, train_loss: 0.3821, test_loss: 1.1766, test_f1: 0.6633
 epoch: 83, train_loss: 0.3895, test_loss: 1.0979, test_f1: 0.6393
 epoch: 84, train_loss: 0.3766, test_loss: 1.0009, test_f1: 0.6433
 epoch: 85, train_loss: 0.4183, test_loss: 1.0773, test_f1: 0.6333
 epoch: 86, train_loss: 0.3831, test_loss: 1.1398, test_f1: 0.6588
 epoch: 87, train_loss: 0.3645, test_loss: 1.0318, test_f1: 0.6525
 epoch: 88, train_loss: 0.3979, test_loss: 1.1305, test_f1: 0.6609
 epoch: 89, train_loss: 0.3862, test_loss: 1.0777, test_f1: 0.6602
 epoch: 90, train_loss: 0.3687, test_loss: 1.1540, test_f1: 0.6485
 epoch: 91, train_loss: 0.3694, test_loss: 1.2540, test_f1: 0.6348
 epoch: 92, train_loss: 0.3761, test_loss: 1.1326, test_f1: 0.6527
 epoch: 93, train_loss: 0.3821, test_loss: 1.0895, test_f1: 0.6454
 epoch: 94, train_loss: 0.3772, test_loss: 1.2618, test_f1: 0.6524
 epoch: 95, train_loss: 0.3521, test_loss: 1.0790, test_f1: 0.6507
 epoch: 96, train_loss: 0.3582, test_loss: 0.9783, test_f1: 0.6660
 epoch: 97, train_loss: 0.3508, test_loss: 1.1910, test_f1: 0.6509
 epoch: 98, train_loss: 0.3382, test_loss: 1.1961, test_f1: 0.6672
 epoch: 99, train_loss: 0.3613, test_loss: 0.9625, test_f1: 0.6638
##################ITERATION #9 ****************************************
 epoch: 0, train_loss: 1.2589, test_loss: 1.1615, test_f1: 0.4190
 epoch: 1, train_loss: 1.0197, test_loss: 1.0047, test_f1: 0.4532
 epoch: 2, train_loss: 0.9814, test_loss: 1.0287, test_f1: 0.4686
 epoch: 3, train_loss: 0.9572, test_loss: 1.0591, test_f1: 0.4961
 epoch: 4, train_loss: 0.9322, test_loss: 0.9909, test_f1: 0.4597
 epoch: 5, train_loss: 0.9191, test_loss: 0.9640, test_f1: 0.5703
 epoch: 6, train_loss: 0.8953, test_loss: 1.0119, test_f1: 0.4783
 epoch: 7, train_loss: 0.8838, test_loss: 0.9036, test_f1: 0.5163
 epoch: 8, train_loss: 0.8776, test_loss: 0.9078, test_f1: 0.4927
 epoch: 9, train_loss: 0.8379, test_loss: 0.9942, test_f1: 0.5041
 epoch: 10, train_loss: 0.8197, test_loss: 0.9175, test_f1: 0.5504
 epoch: 11, train_loss: 0.8228, test_loss: 1.0005, test_f1: 0.5273
 epoch: 12, train_loss: 0.8260, test_loss: 0.9415, test_f1: 0.5747
 epoch: 13, train_loss: 0.7971, test_loss: 1.0047, test_f1: 0.5247
 epoch: 14, train_loss: 0.8012, test_loss: 0.8970, test_f1: 0.5606
 epoch: 15, train_loss: 0.7774, test_loss: 1.0277, test_f1: 0.5267
 epoch: 16, train_loss: 0.7723, test_loss: 0.8427, test_f1: 0.5827
 epoch: 17, train_loss: 0.7685, test_loss: 0.9869, test_f1: 0.5492
 epoch: 18, train_loss: 0.7532, test_loss: 1.0411, test_f1: 0.5591
 epoch: 19, train_loss: 0.7593, test_loss: 0.8938, test_f1: 0.5487
 epoch: 20, train_loss: 0.7224, test_loss: 0.9173, test_f1: 0.5923
 epoch: 21, train_loss: 0.7171, test_loss: 0.8412, test_f1: 0.5847
 epoch: 22, train_loss: 0.7152, test_loss: 0.8538, test_f1: 0.5610
 epoch: 23, train_loss: 0.7154, test_loss: 0.8832, test_f1: 0.5902
 epoch: 24, train_loss: 0.6927, test_loss: 0.9098, test_f1: 0.6140
 epoch: 25, train_loss: 0.6838, test_loss: 0.8738, test_f1: 0.6171
 epoch: 26, train_loss: 0.6929, test_loss: 0.8787, test_f1: 0.5926
 epoch: 27, train_loss: 0.6979, test_loss: 0.8080, test_f1: 0.6347
 epoch: 28, train_loss: 0.6954, test_loss: 0.8688, test_f1: 0.6048
 epoch: 29, train_loss: 0.6685, test_loss: 0.8396, test_f1: 0.6227
 epoch: 30, train_loss: 0.6466, test_loss: 0.8651, test_f1: 0.6365
 epoch: 31, train_loss: 0.6922, test_loss: 0.9449, test_f1: 0.5357
 epoch: 32, train_loss: 0.6606, test_loss: 1.0022, test_f1: 0.5758
 epoch: 33, train_loss: 0.6608, test_loss: 0.9355, test_f1: 0.5977
 epoch: 34, train_loss: 0.6541, test_loss: 0.8800, test_f1: 0.6190
 epoch: 35, train_loss: 0.6394, test_loss: 0.8411, test_f1: 0.6353
 epoch: 36, train_loss: 0.6412, test_loss: 1.0338, test_f1: 0.5907
 epoch: 37, train_loss: 0.6192, test_loss: 0.8619, test_f1: 0.6052
 epoch: 38, train_loss: 0.6437, test_loss: 1.0306, test_f1: 0.6265
 epoch: 39, train_loss: 0.6574, test_loss: 1.0971, test_f1: 0.5810
 epoch: 40, train_loss: 0.6199, test_loss: 0.9490, test_f1: 0.6674
 epoch: 41, train_loss: 0.6153, test_loss: 1.0400, test_f1: 0.5728
 epoch: 42, train_loss: 0.5833, test_loss: 0.8227, test_f1: 0.6449
 epoch: 43, train_loss: 0.6218, test_loss: 0.9150, test_f1: 0.5789
 epoch: 44, train_loss: 0.5955, test_loss: 0.9006, test_f1: 0.6168
 epoch: 45, train_loss: 0.6042, test_loss: 0.9476, test_f1: 0.6439
 epoch: 46, train_loss: 0.5811, test_loss: 0.8824, test_f1: 0.5898
 epoch: 47, train_loss: 0.5779, test_loss: 1.0949, test_f1: 0.5793
 epoch: 48, train_loss: 0.5719, test_loss: 0.9394, test_f1: 0.6206
 epoch: 49, train_loss: 0.5719, test_loss: 1.0505, test_f1: 0.6002
 epoch: 50, train_loss: 0.5689, test_loss: 0.9486, test_f1: 0.6364
 epoch: 51, train_loss: 0.5374, test_loss: 0.8977, test_f1: 0.6386
 epoch: 52, train_loss: 0.5030, test_loss: 0.8870, test_f1: 0.6355
 epoch: 53, train_loss: 0.4942, test_loss: 0.8903, test_f1: 0.6556
 epoch: 54, train_loss: 0.5029, test_loss: 0.9317, test_f1: 0.6302
 epoch: 55, train_loss: 0.4967, test_loss: 0.8392, test_f1: 0.6371
 epoch: 56, train_loss: 0.4790, test_loss: 0.9848, test_f1: 0.6343
 epoch: 57, train_loss: 0.4718, test_loss: 0.8790, test_f1: 0.6370
 epoch: 58, train_loss: 0.4606, test_loss: 0.9557, test_f1: 0.6504
 epoch: 59, train_loss: 0.4569, test_loss: 0.9180, test_f1: 0.6398
 epoch: 60, train_loss: 0.4700, test_loss: 0.9325, test_f1: 0.6204
 epoch: 61, train_loss: 0.4663, test_loss: 0.8780, test_f1: 0.6482
 epoch: 62, train_loss: 0.4542, test_loss: 0.9342, test_f1: 0.6705
 epoch: 63, train_loss: 0.4492, test_loss: 1.0014, test_f1: 0.6421
 epoch: 64, train_loss: 0.4432, test_loss: 1.0266, test_f1: 0.6489
 epoch: 65, train_loss: 0.4601, test_loss: 0.9708, test_f1: 0.6384
 epoch: 66, train_loss: 0.4423, test_loss: 0.9620, test_f1: 0.6217
 epoch: 67, train_loss: 0.4460, test_loss: 1.2332, test_f1: 0.6185
 epoch: 68, train_loss: 0.4318, test_loss: 1.1772, test_f1: 0.6245
 epoch: 69, train_loss: 0.4465, test_loss: 0.9454, test_f1: 0.6492
 epoch: 70, train_loss: 0.4202, test_loss: 1.0564, test_f1: 0.6486
 epoch: 71, train_loss: 0.4432, test_loss: 0.9056, test_f1: 0.6457
 epoch: 72, train_loss: 0.4151, test_loss: 1.1767, test_f1: 0.6335
 epoch: 73, train_loss: 0.4273, test_loss: 0.9790, test_f1: 0.6483
 epoch: 74, train_loss: 0.4078, test_loss: 1.1119, test_f1: 0.6307
 epoch: 75, train_loss: 0.4117, test_loss: 1.1396, test_f1: 0.6216
 epoch: 76, train_loss: 0.4141, test_loss: 0.9561, test_f1: 0.6476
 epoch: 77, train_loss: 0.4169, test_loss: 1.0485, test_f1: 0.6458
 epoch: 78, train_loss: 0.4337, test_loss: 1.2484, test_f1: 0.5822
 epoch: 79, train_loss: 0.4378, test_loss: 1.2033, test_f1: 0.6314
 epoch: 80, train_loss: 0.4246, test_loss: 1.0660, test_f1: 0.6421
 epoch: 81, train_loss: 0.4169, test_loss: 0.9564, test_f1: 0.6404
 epoch: 82, train_loss: 0.4104, test_loss: 1.2696, test_f1: 0.6099
 epoch: 83, train_loss: 0.4179, test_loss: 0.9227, test_f1: 0.6643
 epoch: 84, train_loss: 0.4082, test_loss: 1.3090, test_f1: 0.6168
 epoch: 85, train_loss: 0.3804, test_loss: 1.0706, test_f1: 0.6592
 epoch: 86, train_loss: 0.3918, test_loss: 1.0969, test_f1: 0.6494
 epoch: 87, train_loss: 0.3954, test_loss: 1.3199, test_f1: 0.5990
 epoch: 88, train_loss: 0.3886, test_loss: 1.0842, test_f1: 0.6354
 epoch: 89, train_loss: 0.4098, test_loss: 0.9845, test_f1: 0.6315
 epoch: 90, train_loss: 0.3690, test_loss: 1.1773, test_f1: 0.6479
 epoch: 91, train_loss: 0.4086, test_loss: 1.1300, test_f1: 0.6424
 epoch: 92, train_loss: 0.3888, test_loss: 1.1795, test_f1: 0.6419
 epoch: 93, train_loss: 0.3856, test_loss: 1.1185, test_f1: 0.6462
 epoch: 94, train_loss: 0.3958, test_loss: 1.1160, test_f1: 0.6614
 epoch: 95, train_loss: 0.3800, test_loss: 1.1184, test_f1: 0.6449
 epoch: 96, train_loss: 0.3421, test_loss: 1.2281, test_f1: 0.6388
 epoch: 97, train_loss: 0.3844, test_loss: 1.2814, test_f1: 0.6344
 epoch: 98, train_loss: 0.4054, test_loss: 1.4595, test_f1: 0.5852
 epoch: 99, train_loss: 0.3507, test_loss: 1.2948, test_f1: 0.6329

Training completed in 797.76 seconds
Best F1: 0.7044 at epoch 61
Mean F1 across iterations: 0.6877  0.0112
========================FINAL RESULTS================================
FEGIN weighted F1: 0.7044  0.0112
python main.py --data ltspice_examples --representation component_pin --model FEGIN --layers 3 --hiddens 64 --batch_size 128 --lr 0.01 --emb_size 250 --epochs 100 --save_appendix component_pin_L3_H64_BS128_LR0.01_E250 --no_val
-----



STDERR:
  File "main.py", line 370, in <module>
    main()
  File "main.py", line 254, in main
    dataset = dataset_class(
  File "/home/philip/projects/llm_inference_code_repo/Circuit-Completion-Using-GNNs/component_classification_with_link_prediction_head/evaluation/FEGIN/kernel/circuit_datasets.py", line 15, in __init__
    self.data, self.slices = torch.load(self.processed_paths[0])
  File "/home/philip/.local/lib/python3.8/site-packages/torch/serialization.py", line 1040, in load
    warnings.warn(
  File "/usr/lib/python3.8/warnings.py", line 109, in _showwarnmsg
    sw(msg.message, msg.category, msg.filename, msg.lineno,
  File "main.py", line 47, in warn_with_traceback
    traceback.print_stack(file=log)
/home/philip/projects/llm_inference_code_repo/Circuit-Completion-Using-GNNs/component_classification_with_link_prediction_head/evaluation/FEGIN/kernel/circuit_datasets.py:15: FutureWarning: You are using `torch.load` with `weights_only=False` (the current default value), which uses the default pickle module implicitly. It is possible to construct malicious pickle data which will execute arbitrary code during unpickling (See https://github.com/pytorch/pytorch/blob/main/SECURITY.md#untrusted-models for more details). In a future release, the default value for `weights_only` will be flipped to `True`. This limits the functions that could be executed during unpickling. Arbitrary objects will no longer be allowed to be loaded via this mode unless they are explicitly allowlisted by the user via `torch.serialization.add_safe_globals`. We recommend you start setting `weights_only=True` for any use case where you don't have full control of the loaded file. Please open an issue on GitHub for any issues related to this experimental feature.
  self.data, self.slices = torch.load(self.processed_paths[0])
