STDOUT:
Results will be saved in /home/philip/projects/ltspice_examples_code_repo/Circuit-Completion-Using-GNNs/component_classification_with_link_prediction_head/evaluation/FEGIN/results/model_FEGIN_dataset_ltspice_demos
Command line input: python main.py --data ltspice_demos --representation component_component --model FEGIN --layers 3 --hiddens 32 --batch_size 256 --lr 0.01 --emb_size 250 --epochs 100 --save_appendix component_component_L3_H32_BS256_LR0.01_E250 --no_val
 is saved.
-----
ltspice_demos - FEGIN
Using 3 layers, 32 hidden units, h = 2
Loading component_component representation dataset
ENTERED
Training FEGIN on component_component representation
Train: 1565, Test: 383
##################ITERATION #0 ****************************************
 epoch: 0, train_loss: 1.3008, test_loss: 1.3151, test_f1: 0.1932
 epoch: 1, train_loss: 1.2110, test_loss: 1.2831, test_f1: 0.3003
 epoch: 2, train_loss: 1.1902, test_loss: 1.3313, test_f1: 0.2721
 epoch: 3, train_loss: 1.1760, test_loss: 1.2857, test_f1: 0.2391
 epoch: 4, train_loss: 1.1613, test_loss: 1.2595, test_f1: 0.2979
 epoch: 5, train_loss: 1.1574, test_loss: 1.2987, test_f1: 0.2984
 epoch: 6, train_loss: 1.1555, test_loss: 1.3514, test_f1: 0.2281
 epoch: 7, train_loss: 1.1554, test_loss: 1.2773, test_f1: 0.3252
 epoch: 8, train_loss: 1.1252, test_loss: 1.1913, test_f1: 0.4216
 epoch: 9, train_loss: 1.1048, test_loss: 1.1672, test_f1: 0.3086
 epoch: 10, train_loss: 1.0724, test_loss: 1.2431, test_f1: 0.4213
 epoch: 11, train_loss: 1.0608, test_loss: 1.2819, test_f1: 0.5070
 epoch: 12, train_loss: 1.0344, test_loss: 1.2807, test_f1: 0.3828
 epoch: 13, train_loss: 1.0313, test_loss: 1.2149, test_f1: 0.4605
 epoch: 14, train_loss: 0.9852, test_loss: 1.3118, test_f1: 0.3997
 epoch: 15, train_loss: 0.9738, test_loss: 1.2538, test_f1: 0.5446
 epoch: 16, train_loss: 0.9376, test_loss: 1.1901, test_f1: 0.5216
 epoch: 17, train_loss: 0.9306, test_loss: 1.2134, test_f1: 0.4337
 epoch: 18, train_loss: 0.9207, test_loss: 1.2561, test_f1: 0.4873
 epoch: 19, train_loss: 0.9343, test_loss: 1.4449, test_f1: 0.4131
 epoch: 20, train_loss: 0.8967, test_loss: 1.4266, test_f1: 0.5284
 epoch: 21, train_loss: 0.8798, test_loss: 1.2355, test_f1: 0.5265
 epoch: 22, train_loss: 0.8695, test_loss: 1.1757, test_f1: 0.4865
 epoch: 23, train_loss: 0.8493, test_loss: 1.1180, test_f1: 0.4448
 epoch: 24, train_loss: 0.8180, test_loss: 1.0688, test_f1: 0.5281
 epoch: 25, train_loss: 0.8322, test_loss: 1.1683, test_f1: 0.5455
 epoch: 26, train_loss: 0.8339, test_loss: 1.1814, test_f1: 0.5953
 epoch: 27, train_loss: 0.8156, test_loss: 1.1634, test_f1: 0.5962
 epoch: 28, train_loss: 0.8082, test_loss: 1.1860, test_f1: 0.5077
 epoch: 29, train_loss: 0.8314, test_loss: 1.6209, test_f1: 0.4882
 epoch: 30, train_loss: 0.8366, test_loss: 1.0318, test_f1: 0.5401
 epoch: 31, train_loss: 0.8224, test_loss: 1.1196, test_f1: 0.5644
 epoch: 32, train_loss: 0.8000, test_loss: 1.1259, test_f1: 0.5113
 epoch: 33, train_loss: 0.7820, test_loss: 1.2040, test_f1: 0.5656
 epoch: 34, train_loss: 0.7829, test_loss: 1.1958, test_f1: 0.5223
 epoch: 35, train_loss: 0.7642, test_loss: 1.1874, test_f1: 0.5217
 epoch: 36, train_loss: 0.7481, test_loss: 1.2684, test_f1: 0.6239
 epoch: 37, train_loss: 0.7475, test_loss: 1.3435, test_f1: 0.5349
 epoch: 38, train_loss: 0.7242, test_loss: 1.2313, test_f1: 0.6100
 epoch: 39, train_loss: 0.7251, test_loss: 1.5481, test_f1: 0.4914
 epoch: 40, train_loss: 0.7220, test_loss: 1.1543, test_f1: 0.5780
 epoch: 41, train_loss: 0.7644, test_loss: 1.4329, test_f1: 0.5301
 epoch: 42, train_loss: 0.7794, test_loss: 1.3810, test_f1: 0.5825
 epoch: 43, train_loss: 0.7417, test_loss: 1.1868, test_f1: 0.5741
 epoch: 44, train_loss: 0.7856, test_loss: 1.2969, test_f1: 0.5497
 epoch: 45, train_loss: 0.7590, test_loss: 1.5900, test_f1: 0.5314
 epoch: 46, train_loss: 0.7688, test_loss: 1.1837, test_f1: 0.5929
 epoch: 47, train_loss: 0.7305, test_loss: 1.1403, test_f1: 0.5671
 epoch: 48, train_loss: 0.7242, test_loss: 1.2549, test_f1: 0.5805
 epoch: 49, train_loss: 0.7045, test_loss: 1.4279, test_f1: 0.5944
 epoch: 50, train_loss: 0.7080, test_loss: 1.5281, test_f1: 0.5773
 epoch: 51, train_loss: 0.7168, test_loss: 1.2895, test_f1: 0.5904
 epoch: 52, train_loss: 0.7033, test_loss: 1.2845, test_f1: 0.5320
 epoch: 53, train_loss: 0.6822, test_loss: 1.3864, test_f1: 0.5254
 epoch: 54, train_loss: 0.6730, test_loss: 1.2444, test_f1: 0.5909
 epoch: 55, train_loss: 0.6460, test_loss: 1.3064, test_f1: 0.5740
 epoch: 56, train_loss: 0.6502, test_loss: 1.3246, test_f1: 0.5449
 epoch: 57, train_loss: 0.6257, test_loss: 1.2477, test_f1: 0.5922
 epoch: 58, train_loss: 0.6512, test_loss: 1.2261, test_f1: 0.5721
 epoch: 59, train_loss: 0.6379, test_loss: 1.3364, test_f1: 0.5794
 epoch: 60, train_loss: 0.6402, test_loss: 1.1993, test_f1: 0.5883
 epoch: 61, train_loss: 0.6165, test_loss: 1.4430, test_f1: 0.6051
 epoch: 62, train_loss: 0.6173, test_loss: 1.6772, test_f1: 0.5899
 epoch: 63, train_loss: 0.6518, test_loss: 1.7399, test_f1: 0.5835
 epoch: 64, train_loss: 0.6317, test_loss: 1.6952, test_f1: 0.5835
 epoch: 65, train_loss: 0.6109, test_loss: 1.3066, test_f1: 0.6175
 epoch: 66, train_loss: 0.6231, test_loss: 1.5835, test_f1: 0.5994
 epoch: 67, train_loss: 0.6079, test_loss: 1.3250, test_f1: 0.6137
 epoch: 68, train_loss: 0.5953, test_loss: 1.4171, test_f1: 0.6268
 epoch: 69, train_loss: 0.5895, test_loss: 1.3938, test_f1: 0.6141
 epoch: 70, train_loss: 0.5869, test_loss: 1.4302, test_f1: 0.6007
 epoch: 71, train_loss: 0.5879, test_loss: 1.3007, test_f1: 0.6271
 epoch: 72, train_loss: 0.5808, test_loss: 1.3518, test_f1: 0.5914
 epoch: 73, train_loss: 0.5798, test_loss: 1.6750, test_f1: 0.5182
 epoch: 74, train_loss: 0.5842, test_loss: 1.4706, test_f1: 0.5845
 epoch: 75, train_loss: 0.5802, test_loss: 1.5307, test_f1: 0.6084
 epoch: 76, train_loss: 0.6100, test_loss: 1.7347, test_f1: 0.6122
 epoch: 77, train_loss: 0.5758, test_loss: 1.7565, test_f1: 0.6208
 epoch: 78, train_loss: 0.5803, test_loss: 1.7703, test_f1: 0.6042
 epoch: 79, train_loss: 0.5810, test_loss: 1.6526, test_f1: 0.5925
 epoch: 80, train_loss: 0.5685, test_loss: 1.7757, test_f1: 0.5586
 epoch: 81, train_loss: 0.5743, test_loss: 1.6771, test_f1: 0.5900
 epoch: 82, train_loss: 0.5675, test_loss: 2.0653, test_f1: 0.5482
 epoch: 83, train_loss: 0.5591, test_loss: 1.6410, test_f1: 0.6176
 epoch: 84, train_loss: 0.5469, test_loss: 2.0304, test_f1: 0.5737
 epoch: 85, train_loss: 0.5314, test_loss: 2.0122, test_f1: 0.6189
 epoch: 86, train_loss: 0.5864, test_loss: 1.7714, test_f1: 0.6088
 epoch: 87, train_loss: 0.5754, test_loss: 1.5210, test_f1: 0.6166
 epoch: 88, train_loss: 0.5508, test_loss: 1.7452, test_f1: 0.5796
 epoch: 89, train_loss: 0.5264, test_loss: 1.6629, test_f1: 0.6389
 epoch: 90, train_loss: 0.5239, test_loss: 1.8946, test_f1: 0.6144
 epoch: 91, train_loss: 0.6250, test_loss: 2.1259, test_f1: 0.5718
 epoch: 92, train_loss: 0.6338, test_loss: 1.8570, test_f1: 0.6181
 epoch: 93, train_loss: 0.6272, test_loss: 1.7359, test_f1: 0.6053
 epoch: 94, train_loss: 0.6093, test_loss: 1.6788, test_f1: 0.5917
 epoch: 95, train_loss: 0.5900, test_loss: 1.5593, test_f1: 0.6187
 epoch: 96, train_loss: 0.5820, test_loss: 1.5669, test_f1: 0.6237
 epoch: 97, train_loss: 0.6068, test_loss: 1.7797, test_f1: 0.5605
 epoch: 98, train_loss: 0.6111, test_loss: 1.7708, test_f1: 0.5737
 epoch: 99, train_loss: 0.6214, test_loss: 1.7561, test_f1: 0.6180
##################ITERATION #1 ****************************************
 epoch: 0, train_loss: 1.2854, test_loss: 1.3584, test_f1: 0.2772
 epoch: 1, train_loss: 1.2020, test_loss: 1.2647, test_f1: 0.2986
 epoch: 2, train_loss: 1.1759, test_loss: 1.2478, test_f1: 0.2281
 epoch: 3, train_loss: 1.1473, test_loss: 1.3240, test_f1: 0.3051
 epoch: 4, train_loss: 1.1213, test_loss: 1.2342, test_f1: 0.3383
 epoch: 5, train_loss: 1.0880, test_loss: 1.3331, test_f1: 0.2809
 epoch: 6, train_loss: 1.0666, test_loss: 1.3203, test_f1: 0.2701
 epoch: 7, train_loss: 1.0601, test_loss: 1.2270, test_f1: 0.3563
 epoch: 8, train_loss: 1.0568, test_loss: 1.2813, test_f1: 0.4209
 epoch: 9, train_loss: 1.0430, test_loss: 1.2264, test_f1: 0.3473
 epoch: 10, train_loss: 1.0163, test_loss: 1.2306, test_f1: 0.3528
 epoch: 11, train_loss: 0.9948, test_loss: 1.3265, test_f1: 0.4210
 epoch: 12, train_loss: 0.9821, test_loss: 1.1826, test_f1: 0.4505
 epoch: 13, train_loss: 0.9962, test_loss: 1.2516, test_f1: 0.4279
 epoch: 14, train_loss: 0.9736, test_loss: 1.3429, test_f1: 0.4074
 epoch: 15, train_loss: 1.0216, test_loss: 1.7787, test_f1: 0.3463
 epoch: 16, train_loss: 1.0041, test_loss: 1.3649, test_f1: 0.4910
 epoch: 17, train_loss: 0.9794, test_loss: 1.2853, test_f1: 0.4435
 epoch: 18, train_loss: 0.9756, test_loss: 1.4228, test_f1: 0.4533
 epoch: 19, train_loss: 0.9442, test_loss: 1.5832, test_f1: 0.4494
 epoch: 20, train_loss: 0.9508, test_loss: 1.4099, test_f1: 0.4435
 epoch: 21, train_loss: 0.9038, test_loss: 1.2365, test_f1: 0.5419
 epoch: 22, train_loss: 0.8920, test_loss: 1.1325, test_f1: 0.5210
 epoch: 23, train_loss: 0.9036, test_loss: 1.3062, test_f1: 0.4401
 epoch: 24, train_loss: 0.8942, test_loss: 1.1467, test_f1: 0.4689
 epoch: 25, train_loss: 0.8879, test_loss: 1.1931, test_f1: 0.5314
 epoch: 26, train_loss: 0.8763, test_loss: 1.2033, test_f1: 0.5596
 epoch: 27, train_loss: 0.8815, test_loss: 1.9019, test_f1: 0.4292
 epoch: 28, train_loss: 0.9148, test_loss: 1.0709, test_f1: 0.5498
 epoch: 29, train_loss: 0.8902, test_loss: 1.2892, test_f1: 0.4753
 epoch: 30, train_loss: 0.8503, test_loss: 1.2209, test_f1: 0.5695
 epoch: 31, train_loss: 0.8237, test_loss: 1.1758, test_f1: 0.5565
 epoch: 32, train_loss: 0.8272, test_loss: 1.1616, test_f1: 0.6039
 epoch: 33, train_loss: 0.7994, test_loss: 1.2507, test_f1: 0.5727
 epoch: 34, train_loss: 0.7962, test_loss: 1.5550, test_f1: 0.5010
 epoch: 35, train_loss: 0.8074, test_loss: 1.3850, test_f1: 0.5256
 epoch: 36, train_loss: 0.7923, test_loss: 1.2694, test_f1: 0.5742
 epoch: 37, train_loss: 0.7747, test_loss: 1.2023, test_f1: 0.5233
 epoch: 38, train_loss: 0.7853, test_loss: 1.2767, test_f1: 0.5384
 epoch: 39, train_loss: 0.7656, test_loss: 1.1411, test_f1: 0.5824
 epoch: 40, train_loss: 0.7550, test_loss: 1.2770, test_f1: 0.5791
 epoch: 41, train_loss: 0.7485, test_loss: 1.4406, test_f1: 0.5314
 epoch: 42, train_loss: 0.7900, test_loss: 1.4471, test_f1: 0.6188
 epoch: 43, train_loss: 0.7978, test_loss: 1.4747, test_f1: 0.5232
 epoch: 44, train_loss: 0.7715, test_loss: 1.3654, test_f1: 0.5406
 epoch: 45, train_loss: 0.7591, test_loss: 1.6953, test_f1: 0.5597
 epoch: 46, train_loss: 0.7729, test_loss: 1.5477, test_f1: 0.5559
 epoch: 47, train_loss: 0.7452, test_loss: 1.8954, test_f1: 0.5450
 epoch: 48, train_loss: 0.7796, test_loss: 1.7168, test_f1: 0.5744
 epoch: 49, train_loss: 0.7408, test_loss: 1.4743, test_f1: 0.6082
 epoch: 50, train_loss: 0.7597, test_loss: 1.4438, test_f1: 0.5797
 epoch: 51, train_loss: 0.7174, test_loss: 1.4078, test_f1: 0.5572
 epoch: 52, train_loss: 0.7521, test_loss: 1.2825, test_f1: 0.5279
 epoch: 53, train_loss: 0.7045, test_loss: 1.2307, test_f1: 0.5981
 epoch: 54, train_loss: 0.7173, test_loss: 1.2653, test_f1: 0.5880
 epoch: 55, train_loss: 0.6998, test_loss: 1.3337, test_f1: 0.5916
 epoch: 56, train_loss: 0.6949, test_loss: 1.3405, test_f1: 0.6015
 epoch: 57, train_loss: 0.6930, test_loss: 1.4927, test_f1: 0.5859
 epoch: 58, train_loss: 0.6817, test_loss: 1.5877, test_f1: 0.5607
 epoch: 59, train_loss: 0.6766, test_loss: 1.4654, test_f1: 0.6104
 epoch: 60, train_loss: 0.6800, test_loss: 1.5240, test_f1: 0.6014
 epoch: 61, train_loss: 0.6594, test_loss: 1.7049, test_f1: 0.5637
 epoch: 62, train_loss: 0.6668, test_loss: 1.4875, test_f1: 0.5941
 epoch: 63, train_loss: 0.6753, test_loss: 1.4645, test_f1: 0.6284
 epoch: 64, train_loss: 0.6579, test_loss: 1.4871, test_f1: 0.5513
 epoch: 65, train_loss: 0.6394, test_loss: 1.3930, test_f1: 0.6351
 epoch: 66, train_loss: 0.6304, test_loss: 1.3721, test_f1: 0.6150
 epoch: 67, train_loss: 0.6852, test_loss: 1.5144, test_f1: 0.5658
 epoch: 68, train_loss: 0.6653, test_loss: 1.5620, test_f1: 0.5191
 epoch: 69, train_loss: 0.6590, test_loss: 1.4605, test_f1: 0.5763
 epoch: 70, train_loss: 0.6689, test_loss: 1.4219, test_f1: 0.6064
 epoch: 71, train_loss: 0.6803, test_loss: 1.9492, test_f1: 0.5114
 epoch: 72, train_loss: 0.6565, test_loss: 1.9366, test_f1: 0.5184
 epoch: 73, train_loss: 0.6570, test_loss: 1.4473, test_f1: 0.5481
 epoch: 74, train_loss: 0.6384, test_loss: 1.3915, test_f1: 0.6220
 epoch: 75, train_loss: 0.6310, test_loss: 1.5420, test_f1: 0.6087
 epoch: 76, train_loss: 0.6950, test_loss: 2.1254, test_f1: 0.5184
 epoch: 77, train_loss: 0.7103, test_loss: 1.7327, test_f1: 0.5242
 epoch: 78, train_loss: 0.7102, test_loss: 1.4291, test_f1: 0.6073
 epoch: 79, train_loss: 0.6681, test_loss: 1.3605, test_f1: 0.6433
 epoch: 80, train_loss: 0.6451, test_loss: 1.4552, test_f1: 0.5712
 epoch: 81, train_loss: 0.6345, test_loss: 1.4525, test_f1: 0.5723
 epoch: 82, train_loss: 0.6181, test_loss: 1.3835, test_f1: 0.5769
 epoch: 83, train_loss: 0.6485, test_loss: 1.4879, test_f1: 0.5747
 epoch: 84, train_loss: 0.6498, test_loss: 1.5972, test_f1: 0.5656
 epoch: 85, train_loss: 0.6266, test_loss: 1.6185, test_f1: 0.5773
 epoch: 86, train_loss: 0.6102, test_loss: 1.8146, test_f1: 0.5785
 epoch: 87, train_loss: 0.6200, test_loss: 1.5759, test_f1: 0.6135
 epoch: 88, train_loss: 0.6030, test_loss: 1.6152, test_f1: 0.6008
 epoch: 89, train_loss: 0.6267, test_loss: 1.8973, test_f1: 0.5489
 epoch: 90, train_loss: 0.6342, test_loss: 1.9008, test_f1: 0.5370
 epoch: 91, train_loss: 0.6414, test_loss: 1.6910, test_f1: 0.5755
 epoch: 92, train_loss: 0.6245, test_loss: 1.8153, test_f1: 0.5808
 epoch: 93, train_loss: 0.6081, test_loss: 1.7687, test_f1: 0.5657
 epoch: 94, train_loss: 0.5856, test_loss: 1.7903, test_f1: 0.5627
 epoch: 95, train_loss: 0.5664, test_loss: 1.5776, test_f1: 0.5748
 epoch: 96, train_loss: 0.5934, test_loss: 1.6231, test_f1: 0.6072
 epoch: 97, train_loss: 0.6031, test_loss: 2.0490, test_f1: 0.5047
 epoch: 98, train_loss: 0.6101, test_loss: 1.7253, test_f1: 0.5763
 epoch: 99, train_loss: 0.6046, test_loss: 1.5218, test_f1: 0.5618
##################ITERATION #2 ****************************************
 epoch: 0, train_loss: 1.3361, test_loss: 1.3845, test_f1: 0.3045
 epoch: 1, train_loss: 1.2002, test_loss: 1.3059, test_f1: 0.3529
 epoch: 2, train_loss: 1.1304, test_loss: 1.2484, test_f1: 0.4188
 epoch: 3, train_loss: 1.1054, test_loss: 1.1872, test_f1: 0.3652
 epoch: 4, train_loss: 1.0675, test_loss: 1.1899, test_f1: 0.4531
 epoch: 5, train_loss: 1.0320, test_loss: 1.1680, test_f1: 0.4259
 epoch: 6, train_loss: 1.0208, test_loss: 1.1404, test_f1: 0.4255
 epoch: 7, train_loss: 0.9943, test_loss: 1.1616, test_f1: 0.4011
 epoch: 8, train_loss: 0.9585, test_loss: 1.1263, test_f1: 0.3911
 epoch: 9, train_loss: 0.9452, test_loss: 1.2511, test_f1: 0.3905
 epoch: 10, train_loss: 0.9368, test_loss: 1.1123, test_f1: 0.4819
 epoch: 11, train_loss: 0.9116, test_loss: 1.6608, test_f1: 0.4448
 epoch: 12, train_loss: 0.9826, test_loss: 1.3879, test_f1: 0.3561
 epoch: 13, train_loss: 0.9559, test_loss: 1.1513, test_f1: 0.4778
 epoch: 14, train_loss: 0.9429, test_loss: 1.1489, test_f1: 0.4723
 epoch: 15, train_loss: 0.9240, test_loss: 1.2841, test_f1: 0.4418
 epoch: 16, train_loss: 0.9249, test_loss: 1.1589, test_f1: 0.5038
 epoch: 17, train_loss: 0.8964, test_loss: 1.2820, test_f1: 0.4351
 epoch: 18, train_loss: 0.9075, test_loss: 1.3575, test_f1: 0.4486
 epoch: 19, train_loss: 0.8742, test_loss: 1.5086, test_f1: 0.4509
 epoch: 20, train_loss: 0.8522, test_loss: 1.0487, test_f1: 0.5482
 epoch: 21, train_loss: 0.8453, test_loss: 1.0970, test_f1: 0.5421
 epoch: 22, train_loss: 0.8640, test_loss: 1.0516, test_f1: 0.5178
 epoch: 23, train_loss: 0.8427, test_loss: 1.1648, test_f1: 0.4612
 epoch: 24, train_loss: 0.8663, test_loss: 1.1405, test_f1: 0.5287
 epoch: 25, train_loss: 0.8628, test_loss: 1.1113, test_f1: 0.4958
 epoch: 26, train_loss: 0.8382, test_loss: 1.3372, test_f1: 0.4567
 epoch: 27, train_loss: 0.8697, test_loss: 1.0829, test_f1: 0.5121
 epoch: 28, train_loss: 0.8323, test_loss: 1.4164, test_f1: 0.4421
 epoch: 29, train_loss: 0.8247, test_loss: 1.3096, test_f1: 0.4537
 epoch: 30, train_loss: 0.8362, test_loss: 1.1017, test_f1: 0.5178
 epoch: 31, train_loss: 0.8342, test_loss: 1.2238, test_f1: 0.4531
 epoch: 32, train_loss: 0.8087, test_loss: 1.3745, test_f1: 0.4591
 epoch: 33, train_loss: 0.8019, test_loss: 1.4693, test_f1: 0.4743
 epoch: 34, train_loss: 0.8093, test_loss: 1.1100, test_f1: 0.5338
 epoch: 35, train_loss: 0.7940, test_loss: 1.0710, test_f1: 0.5570
 epoch: 36, train_loss: 0.8040, test_loss: 1.3090, test_f1: 0.5012
 epoch: 37, train_loss: 0.8020, test_loss: 1.1035, test_f1: 0.5510
 epoch: 38, train_loss: 0.7908, test_loss: 1.1717, test_f1: 0.5164
 epoch: 39, train_loss: 0.7775, test_loss: 1.0479, test_f1: 0.5855
 epoch: 40, train_loss: 0.8048, test_loss: 1.5797, test_f1: 0.4526
 epoch: 41, train_loss: 0.8189, test_loss: 1.0815, test_f1: 0.5484
 epoch: 42, train_loss: 0.7898, test_loss: 1.2254, test_f1: 0.5035
 epoch: 43, train_loss: 0.7682, test_loss: 1.1279, test_f1: 0.5228
 epoch: 44, train_loss: 0.7628, test_loss: 1.1013, test_f1: 0.5111
 epoch: 45, train_loss: 0.7445, test_loss: 1.2966, test_f1: 0.4974
 epoch: 46, train_loss: 0.7501, test_loss: 1.2778, test_f1: 0.5361
 epoch: 47, train_loss: 0.8004, test_loss: 1.1056, test_f1: 0.5530
 epoch: 48, train_loss: 0.7827, test_loss: 1.1811, test_f1: 0.5138
 epoch: 49, train_loss: 0.7780, test_loss: 1.1028, test_f1: 0.5593
 epoch: 50, train_loss: 0.7752, test_loss: 1.2884, test_f1: 0.4475
 epoch: 51, train_loss: 0.7696, test_loss: 1.1470, test_f1: 0.5368
 epoch: 52, train_loss: 0.7321, test_loss: 1.1908, test_f1: 0.5297
 epoch: 53, train_loss: 0.7081, test_loss: 1.2552, test_f1: 0.5165
 epoch: 54, train_loss: 0.7178, test_loss: 1.1264, test_f1: 0.5571
 epoch: 55, train_loss: 0.7046, test_loss: 1.3371, test_f1: 0.5051
 epoch: 56, train_loss: 0.7113, test_loss: 1.3132, test_f1: 0.5021
 epoch: 57, train_loss: 0.7120, test_loss: 1.1913, test_f1: 0.5719
 epoch: 58, train_loss: 0.6899, test_loss: 1.2205, test_f1: 0.5609
 epoch: 59, train_loss: 0.7213, test_loss: 1.2594, test_f1: 0.5096
 epoch: 60, train_loss: 0.7166, test_loss: 1.5650, test_f1: 0.5411
 epoch: 61, train_loss: 0.6919, test_loss: 1.7737, test_f1: 0.4905
 epoch: 62, train_loss: 0.6749, test_loss: 2.0753, test_f1: 0.4291
 epoch: 63, train_loss: 0.6701, test_loss: 1.5365, test_f1: 0.5062
 epoch: 64, train_loss: 0.6650, test_loss: 1.4772, test_f1: 0.5137
 epoch: 65, train_loss: 0.6537, test_loss: 1.3502, test_f1: 0.5241
 epoch: 66, train_loss: 0.6735, test_loss: 1.5710, test_f1: 0.5038
 epoch: 67, train_loss: 0.6658, test_loss: 1.7530, test_f1: 0.4683
 epoch: 68, train_loss: 0.6801, test_loss: 1.5438, test_f1: 0.4946
 epoch: 69, train_loss: 0.6527, test_loss: 1.3028, test_f1: 0.5252
 epoch: 70, train_loss: 0.6988, test_loss: 3.0051, test_f1: 0.3584
 epoch: 71, train_loss: 0.6979, test_loss: 4.0635, test_f1: 0.3522
 epoch: 72, train_loss: 0.6929, test_loss: 1.5823, test_f1: 0.5477
 epoch: 73, train_loss: 0.7426, test_loss: 1.7892, test_f1: 0.4980
 epoch: 74, train_loss: 0.7356, test_loss: 1.6877, test_f1: 0.4878
 epoch: 75, train_loss: 0.6708, test_loss: 1.6783, test_f1: 0.4903
 epoch: 76, train_loss: 0.6816, test_loss: 1.3331, test_f1: 0.5317
 epoch: 77, train_loss: 0.6727, test_loss: 1.3913, test_f1: 0.4973
 epoch: 78, train_loss: 0.6647, test_loss: 1.5398, test_f1: 0.5151
 epoch: 79, train_loss: 0.6525, test_loss: 1.5210, test_f1: 0.4932
 epoch: 80, train_loss: 0.6448, test_loss: 1.5272, test_f1: 0.5284
 epoch: 81, train_loss: 0.6443, test_loss: 1.5951, test_f1: 0.5280
 epoch: 82, train_loss: 0.6504, test_loss: 2.1364, test_f1: 0.4790
 epoch: 83, train_loss: 0.6338, test_loss: 1.9993, test_f1: 0.4961
 epoch: 84, train_loss: 0.6237, test_loss: 2.0541, test_f1: 0.4703
 epoch: 85, train_loss: 0.6320, test_loss: 2.1535, test_f1: 0.5368
 epoch: 86, train_loss: 0.6360, test_loss: 1.3882, test_f1: 0.5476
 epoch: 87, train_loss: 0.6487, test_loss: 1.5868, test_f1: 0.4719
 epoch: 88, train_loss: 0.6449, test_loss: 1.3864, test_f1: 0.5276
 epoch: 89, train_loss: 0.6316, test_loss: 1.4714, test_f1: 0.5707
 epoch: 90, train_loss: 0.6257, test_loss: 1.9048, test_f1: 0.5052
 epoch: 91, train_loss: 0.6343, test_loss: 1.8588, test_f1: 0.4863
 epoch: 92, train_loss: 0.6053, test_loss: 1.9763, test_f1: 0.5183
 epoch: 93, train_loss: 0.6059, test_loss: 1.7002, test_f1: 0.5283
 epoch: 94, train_loss: 0.6098, test_loss: 1.5393, test_f1: 0.5065
 epoch: 95, train_loss: 0.5818, test_loss: 1.4705, test_f1: 0.5236
 epoch: 96, train_loss: 0.5909, test_loss: 1.4554, test_f1: 0.5446
 epoch: 97, train_loss: 0.5967, test_loss: 1.6997, test_f1: 0.5352
 epoch: 98, train_loss: 0.5873, test_loss: 1.8991, test_f1: 0.5170
 epoch: 99, train_loss: 0.6163, test_loss: 1.5727, test_f1: 0.4972
##################ITERATION #3 ****************************************
 epoch: 0, train_loss: 1.4168, test_loss: 1.3914, test_f1: 0.2644
 epoch: 1, train_loss: 1.1895, test_loss: 1.3108, test_f1: 0.3170
 epoch: 2, train_loss: 1.1506, test_loss: 1.2649, test_f1: 0.3356
 epoch: 3, train_loss: 1.1303, test_loss: 1.2703, test_f1: 0.3714
 epoch: 4, train_loss: 1.0882, test_loss: 1.2040, test_f1: 0.4162
 epoch: 5, train_loss: 1.0605, test_loss: 1.2098, test_f1: 0.4911
 epoch: 6, train_loss: 1.0363, test_loss: 1.2368, test_f1: 0.4172
 epoch: 7, train_loss: 0.9980, test_loss: 1.2670, test_f1: 0.4228
 epoch: 8, train_loss: 0.9691, test_loss: 1.2452, test_f1: 0.3960
 epoch: 9, train_loss: 0.9828, test_loss: 1.1617, test_f1: 0.4952
 epoch: 10, train_loss: 0.9485, test_loss: 1.1477, test_f1: 0.5051
 epoch: 11, train_loss: 0.9179, test_loss: 1.4132, test_f1: 0.4824
 epoch: 12, train_loss: 0.9314, test_loss: 1.8719, test_f1: 0.2863
 epoch: 13, train_loss: 0.9195, test_loss: 1.2764, test_f1: 0.4673
 epoch: 14, train_loss: 0.8937, test_loss: 1.2326, test_f1: 0.5035
 epoch: 15, train_loss: 0.8750, test_loss: 1.0729, test_f1: 0.5493
 epoch: 16, train_loss: 0.8881, test_loss: 1.1772, test_f1: 0.5258
 epoch: 17, train_loss: 0.8888, test_loss: 1.4889, test_f1: 0.5144
 epoch: 18, train_loss: 0.9003, test_loss: 1.7663, test_f1: 0.4035
 epoch: 19, train_loss: 0.9041, test_loss: 1.4206, test_f1: 0.4206
 epoch: 20, train_loss: 0.9323, test_loss: 1.1400, test_f1: 0.5838
 epoch: 21, train_loss: 0.9108, test_loss: 1.0801, test_f1: 0.5773
 epoch: 22, train_loss: 0.8499, test_loss: 1.1143, test_f1: 0.5760
 epoch: 23, train_loss: 0.8498, test_loss: 1.0839, test_f1: 0.5430
 epoch: 24, train_loss: 0.8599, test_loss: 1.0848, test_f1: 0.5429
 epoch: 25, train_loss: 0.8314, test_loss: 1.1102, test_f1: 0.5374
 epoch: 26, train_loss: 0.8079, test_loss: 1.0874, test_f1: 0.5621
 epoch: 27, train_loss: 0.7986, test_loss: 1.0588, test_f1: 0.5561
 epoch: 28, train_loss: 0.7762, test_loss: 1.1099, test_f1: 0.5884
 epoch: 29, train_loss: 0.7835, test_loss: 1.1117, test_f1: 0.6064
 epoch: 30, train_loss: 0.7523, test_loss: 1.0835, test_f1: 0.6162
 epoch: 31, train_loss: 0.7837, test_loss: 1.1065, test_f1: 0.5634
 epoch: 32, train_loss: 0.7769, test_loss: 1.1395, test_f1: 0.5581
 epoch: 33, train_loss: 0.8069, test_loss: 1.1554, test_f1: 0.5475
 epoch: 34, train_loss: 0.8226, test_loss: 1.1245, test_f1: 0.5856
 epoch: 35, train_loss: 0.8038, test_loss: 1.1948, test_f1: 0.5599
 epoch: 36, train_loss: 0.8247, test_loss: 1.2231, test_f1: 0.5656
 epoch: 37, train_loss: 0.8100, test_loss: 1.4111, test_f1: 0.4140
 epoch: 38, train_loss: 0.8014, test_loss: 1.3735, test_f1: 0.5531
 epoch: 39, train_loss: 0.7763, test_loss: 1.0362, test_f1: 0.6359
 epoch: 40, train_loss: 0.7912, test_loss: 1.2007, test_f1: 0.5871
 epoch: 41, train_loss: 0.7695, test_loss: 0.9590, test_f1: 0.5795
 epoch: 42, train_loss: 0.8005, test_loss: 1.0557, test_f1: 0.5773
 epoch: 43, train_loss: 0.7641, test_loss: 1.0765, test_f1: 0.5890
 epoch: 44, train_loss: 0.7686, test_loss: 1.0184, test_f1: 0.6040
 epoch: 45, train_loss: 0.7617, test_loss: 1.0247, test_f1: 0.6008
 epoch: 46, train_loss: 0.7511, test_loss: 1.0227, test_f1: 0.5941
 epoch: 47, train_loss: 0.7350, test_loss: 1.0092, test_f1: 0.6248
 epoch: 48, train_loss: 0.7494, test_loss: 1.1273, test_f1: 0.5521
 epoch: 49, train_loss: 0.7470, test_loss: 1.2258, test_f1: 0.5837
 epoch: 50, train_loss: 0.7557, test_loss: 1.1657, test_f1: 0.5888
 epoch: 51, train_loss: 0.7250, test_loss: 1.2074, test_f1: 0.5318
 epoch: 52, train_loss: 0.7185, test_loss: 1.1560, test_f1: 0.5771
 epoch: 53, train_loss: 0.7213, test_loss: 1.1099, test_f1: 0.6204
 epoch: 54, train_loss: 0.7116, test_loss: 1.1175, test_f1: 0.6157
 epoch: 55, train_loss: 0.7087, test_loss: 1.1061, test_f1: 0.5643
 epoch: 56, train_loss: 0.7036, test_loss: 1.1001, test_f1: 0.6129
 epoch: 57, train_loss: 0.7105, test_loss: 1.0753, test_f1: 0.6200
 epoch: 58, train_loss: 0.7093, test_loss: 1.0273, test_f1: 0.6250
 epoch: 59, train_loss: 0.6956, test_loss: 0.9788, test_f1: 0.6318
 epoch: 60, train_loss: 0.6988, test_loss: 1.0522, test_f1: 0.5882
 epoch: 61, train_loss: 0.6789, test_loss: 1.0352, test_f1: 0.6402
 epoch: 62, train_loss: 0.6444, test_loss: 1.0960, test_f1: 0.6287
 epoch: 63, train_loss: 0.6571, test_loss: 1.2605, test_f1: 0.5824
 epoch: 64, train_loss: 0.6484, test_loss: 1.1092, test_f1: 0.6344
 epoch: 65, train_loss: 0.6424, test_loss: 1.0484, test_f1: 0.6429
 epoch: 66, train_loss: 0.6607, test_loss: 1.1754, test_f1: 0.5996
 epoch: 67, train_loss: 0.6450, test_loss: 1.1401, test_f1: 0.5988
 epoch: 68, train_loss: 0.6716, test_loss: 1.0979, test_f1: 0.5942
 epoch: 69, train_loss: 0.6635, test_loss: 1.1365, test_f1: 0.6173
 epoch: 70, train_loss: 0.6481, test_loss: 0.9988, test_f1: 0.6641
 epoch: 71, train_loss: 0.6987, test_loss: 1.0552, test_f1: 0.6136
 epoch: 72, train_loss: 0.6567, test_loss: 1.1436, test_f1: 0.6117
 epoch: 73, train_loss: 0.6647, test_loss: 1.0990, test_f1: 0.6456
 epoch: 74, train_loss: 0.6742, test_loss: 1.1740, test_f1: 0.5812
 epoch: 75, train_loss: 0.6451, test_loss: 1.2777, test_f1: 0.5807
 epoch: 76, train_loss: 0.6501, test_loss: 1.0086, test_f1: 0.6401
 epoch: 77, train_loss: 0.6142, test_loss: 0.9568, test_f1: 0.6744
 epoch: 78, train_loss: 0.6175, test_loss: 0.9974, test_f1: 0.6423
 epoch: 79, train_loss: 0.6359, test_loss: 1.1140, test_f1: 0.5903
 epoch: 80, train_loss: 0.6261, test_loss: 1.0647, test_f1: 0.6314
 epoch: 81, train_loss: 0.6143, test_loss: 1.1080, test_f1: 0.6002
 epoch: 82, train_loss: 0.5905, test_loss: 1.0563, test_f1: 0.6361
 epoch: 83, train_loss: 0.6076, test_loss: 1.0199, test_f1: 0.6540
 epoch: 84, train_loss: 0.6124, test_loss: 1.1159, test_f1: 0.6150
 epoch: 85, train_loss: 0.6150, test_loss: 1.4632, test_f1: 0.5329
 epoch: 86, train_loss: 0.6175, test_loss: 1.3028, test_f1: 0.6097
 epoch: 87, train_loss: 0.6095, test_loss: 1.1559, test_f1: 0.6507
 epoch: 88, train_loss: 0.6061, test_loss: 1.1757, test_f1: 0.6562
 epoch: 89, train_loss: 0.6070, test_loss: 1.3329, test_f1: 0.5534
 epoch: 90, train_loss: 0.6090, test_loss: 1.0661, test_f1: 0.6488
 epoch: 91, train_loss: 0.6057, test_loss: 1.1633, test_f1: 0.6343
 epoch: 92, train_loss: 0.5908, test_loss: 1.1780, test_f1: 0.6378
 epoch: 93, train_loss: 0.6165, test_loss: 1.4823, test_f1: 0.5724
 epoch: 94, train_loss: 0.6003, test_loss: 1.2194, test_f1: 0.6081
 epoch: 95, train_loss: 0.5820, test_loss: 1.2020, test_f1: 0.6298
 epoch: 96, train_loss: 0.5731, test_loss: 1.1531, test_f1: 0.6688
 epoch: 97, train_loss: 0.5747, test_loss: 1.2202, test_f1: 0.6856
 epoch: 98, train_loss: 0.5530, test_loss: 1.3277, test_f1: 0.6540
 epoch: 99, train_loss: 0.5777, test_loss: 1.3940, test_f1: 0.6290
##################ITERATION #4 ****************************************
 epoch: 0, train_loss: 1.3026, test_loss: 1.3771, test_f1: 0.2606
 epoch: 1, train_loss: 1.1591, test_loss: 1.3874, test_f1: 0.3282
 epoch: 2, train_loss: 1.0940, test_loss: 1.2871, test_f1: 0.3777
 epoch: 3, train_loss: 1.0713, test_loss: 1.2508, test_f1: 0.4140
 epoch: 4, train_loss: 1.0061, test_loss: 1.2286, test_f1: 0.4466
 epoch: 5, train_loss: 0.9849, test_loss: 1.1693, test_f1: 0.4061
 epoch: 6, train_loss: 0.9547, test_loss: 1.2039, test_f1: 0.4290
 epoch: 7, train_loss: 0.9829, test_loss: 1.6577, test_f1: 0.2519
 epoch: 8, train_loss: 0.9554, test_loss: 1.1366, test_f1: 0.4215
 epoch: 9, train_loss: 0.9764, test_loss: 1.1373, test_f1: 0.4060
 epoch: 10, train_loss: 0.9374, test_loss: 1.0864, test_f1: 0.4436
 epoch: 11, train_loss: 0.9093, test_loss: 1.1329, test_f1: 0.5184
 epoch: 12, train_loss: 0.8924, test_loss: 1.1152, test_f1: 0.5159
 epoch: 13, train_loss: 0.8976, test_loss: 1.1474, test_f1: 0.5078
 epoch: 14, train_loss: 0.8761, test_loss: 1.3557, test_f1: 0.4244
 epoch: 15, train_loss: 0.8688, test_loss: 1.1850, test_f1: 0.5379
 epoch: 16, train_loss: 0.9016, test_loss: 1.1606, test_f1: 0.4985
 epoch: 17, train_loss: 0.9029, test_loss: 1.1299, test_f1: 0.5183
 epoch: 18, train_loss: 0.8877, test_loss: 1.0642, test_f1: 0.4956
 epoch: 19, train_loss: 0.8415, test_loss: 1.1326, test_f1: 0.4971
 epoch: 20, train_loss: 0.8550, test_loss: 1.2035, test_f1: 0.4918
 epoch: 21, train_loss: 0.8884, test_loss: 1.0986, test_f1: 0.5401
 epoch: 22, train_loss: 0.8660, test_loss: 1.0396, test_f1: 0.5163
 epoch: 23, train_loss: 0.8483, test_loss: 1.2685, test_f1: 0.4530
 epoch: 24, train_loss: 0.8294, test_loss: 1.1437, test_f1: 0.4457
 epoch: 25, train_loss: 0.8347, test_loss: 1.1445, test_f1: 0.5229
 epoch: 26, train_loss: 0.8199, test_loss: 1.1872, test_f1: 0.5177
 epoch: 27, train_loss: 0.8639, test_loss: 1.2888, test_f1: 0.4338
 epoch: 28, train_loss: 0.8784, test_loss: 1.0677, test_f1: 0.5208
 epoch: 29, train_loss: 0.8576, test_loss: 1.0348, test_f1: 0.5824
 epoch: 30, train_loss: 0.8326, test_loss: 1.0308, test_f1: 0.5555
 epoch: 31, train_loss: 0.7898, test_loss: 1.0097, test_f1: 0.5735
 epoch: 32, train_loss: 0.8013, test_loss: 1.1218, test_f1: 0.5240
 epoch: 33, train_loss: 0.7967, test_loss: 1.1486, test_f1: 0.5209
 epoch: 34, train_loss: 0.7765, test_loss: 1.0058, test_f1: 0.5737
 epoch: 35, train_loss: 0.7900, test_loss: 1.0722, test_f1: 0.5356
 epoch: 36, train_loss: 0.7846, test_loss: 1.1202, test_f1: 0.5226
 epoch: 37, train_loss: 0.7841, test_loss: 1.0565, test_f1: 0.5661
 epoch: 38, train_loss: 0.7801, test_loss: 1.0329, test_f1: 0.6099
 epoch: 39, train_loss: 0.8009, test_loss: 1.0907, test_f1: 0.5561
 epoch: 40, train_loss: 0.7931, test_loss: 1.0741, test_f1: 0.5685
 epoch: 41, train_loss: 0.7833, test_loss: 1.2568, test_f1: 0.5222
 epoch: 42, train_loss: 0.7959, test_loss: 1.1633, test_f1: 0.5302
 epoch: 43, train_loss: 0.7608, test_loss: 1.1130, test_f1: 0.5680
 epoch: 44, train_loss: 0.7360, test_loss: 1.1425, test_f1: 0.5553
 epoch: 45, train_loss: 0.7293, test_loss: 1.2917, test_f1: 0.5836
 epoch: 46, train_loss: 0.7712, test_loss: 1.2838, test_f1: 0.5500
 epoch: 47, train_loss: 0.8207, test_loss: 1.1284, test_f1: 0.5344
 epoch: 48, train_loss: 0.7850, test_loss: 1.1788, test_f1: 0.4920
 epoch: 49, train_loss: 0.7873, test_loss: 1.1151, test_f1: 0.5331
 epoch: 50, train_loss: 0.7656, test_loss: 1.1971, test_f1: 0.5324
 epoch: 51, train_loss: 0.7499, test_loss: 1.1772, test_f1: 0.5379
 epoch: 52, train_loss: 0.7327, test_loss: 1.1404, test_f1: 0.5468
 epoch: 53, train_loss: 0.7239, test_loss: 1.1261, test_f1: 0.5400
 epoch: 54, train_loss: 0.7153, test_loss: 1.1383, test_f1: 0.5604
 epoch: 55, train_loss: 0.7231, test_loss: 1.1527, test_f1: 0.5828
 epoch: 56, train_loss: 0.7108, test_loss: 1.0935, test_f1: 0.5940
 epoch: 57, train_loss: 0.6914, test_loss: 1.1347, test_f1: 0.5863
 epoch: 58, train_loss: 0.6907, test_loss: 1.1370, test_f1: 0.5863
 epoch: 59, train_loss: 0.6899, test_loss: 1.1350, test_f1: 0.5796
 epoch: 60, train_loss: 0.6882, test_loss: 1.0834, test_f1: 0.5741
 epoch: 61, train_loss: 0.6904, test_loss: 1.1157, test_f1: 0.5843
 epoch: 62, train_loss: 0.6669, test_loss: 1.1331, test_f1: 0.5794
 epoch: 63, train_loss: 0.6662, test_loss: 1.1451, test_f1: 0.5666
 epoch: 64, train_loss: 0.6707, test_loss: 1.1735, test_f1: 0.5689
 epoch: 65, train_loss: 0.6976, test_loss: 1.1808, test_f1: 0.5311
 epoch: 66, train_loss: 0.6562, test_loss: 1.1516, test_f1: 0.5644
 epoch: 67, train_loss: 0.6674, test_loss: 1.1204, test_f1: 0.6124
 epoch: 68, train_loss: 0.6623, test_loss: 1.2095, test_f1: 0.5742
 epoch: 69, train_loss: 0.6460, test_loss: 1.1482, test_f1: 0.5873
 epoch: 70, train_loss: 0.6426, test_loss: 1.1293, test_f1: 0.6131
 epoch: 71, train_loss: 0.6515, test_loss: 1.1269, test_f1: 0.6006
 epoch: 72, train_loss: 0.6467, test_loss: 1.1945, test_f1: 0.6028
 epoch: 73, train_loss: 0.6565, test_loss: 1.1995, test_f1: 0.5740
 epoch: 74, train_loss: 0.6380, test_loss: 1.1938, test_f1: 0.6044
 epoch: 75, train_loss: 0.6304, test_loss: 1.1778, test_f1: 0.5925
 epoch: 76, train_loss: 0.6420, test_loss: 1.1860, test_f1: 0.6117
 epoch: 77, train_loss: 0.6205, test_loss: 1.2231, test_f1: 0.6226
 epoch: 78, train_loss: 0.6245, test_loss: 1.2154, test_f1: 0.5821
 epoch: 79, train_loss: 0.6385, test_loss: 1.2353, test_f1: 0.5852
 epoch: 80, train_loss: 0.6112, test_loss: 1.2766, test_f1: 0.6190
 epoch: 81, train_loss: 0.6076, test_loss: 1.3593, test_f1: 0.6042
 epoch: 82, train_loss: 0.5950, test_loss: 1.2635, test_f1: 0.6135
 epoch: 83, train_loss: 0.6362, test_loss: 1.2677, test_f1: 0.5721
 epoch: 84, train_loss: 0.6175, test_loss: 1.1012, test_f1: 0.6417
 epoch: 85, train_loss: 0.6592, test_loss: 1.2151, test_f1: 0.6144
 epoch: 86, train_loss: 0.6095, test_loss: 1.2326, test_f1: 0.5688
 epoch: 87, train_loss: 0.6017, test_loss: 1.1766, test_f1: 0.6047
 epoch: 88, train_loss: 0.6039, test_loss: 1.1299, test_f1: 0.6280
 epoch: 89, train_loss: 0.6054, test_loss: 1.1205, test_f1: 0.5867
 epoch: 90, train_loss: 0.6061, test_loss: 1.1572, test_f1: 0.6147
 epoch: 91, train_loss: 0.5968, test_loss: 1.2339, test_f1: 0.5806
 epoch: 92, train_loss: 0.5947, test_loss: 1.1384, test_f1: 0.6188
 epoch: 93, train_loss: 0.6133, test_loss: 1.1324, test_f1: 0.6097
 epoch: 94, train_loss: 0.6039, test_loss: 1.2421, test_f1: 0.6114
 epoch: 95, train_loss: 0.5894, test_loss: 1.1913, test_f1: 0.5978
 epoch: 96, train_loss: 0.5932, test_loss: 1.2104, test_f1: 0.5438
 epoch: 97, train_loss: 0.5920, test_loss: 1.1592, test_f1: 0.6250
 epoch: 98, train_loss: 0.6002, test_loss: 1.1767, test_f1: 0.6223
 epoch: 99, train_loss: 0.6027, test_loss: 1.4127, test_f1: 0.5615
##################ITERATION #5 ****************************************
 epoch: 0, train_loss: 1.2692, test_loss: 1.3699, test_f1: 0.3180
 epoch: 1, train_loss: 1.1782, test_loss: 1.3350, test_f1: 0.3108
 epoch: 2, train_loss: 1.1080, test_loss: 1.3166, test_f1: 0.3153
 epoch: 3, train_loss: 1.0529, test_loss: 1.2786, test_f1: 0.3352
 epoch: 4, train_loss: 1.0697, test_loss: 1.2668, test_f1: 0.3612
 epoch: 5, train_loss: 1.0287, test_loss: 1.1612, test_f1: 0.4703
 epoch: 6, train_loss: 0.9787, test_loss: 1.1491, test_f1: 0.5018
 epoch: 7, train_loss: 0.9769, test_loss: 1.1577, test_f1: 0.5010
 epoch: 8, train_loss: 0.9356, test_loss: 1.1279, test_f1: 0.5083
 epoch: 9, train_loss: 0.9078, test_loss: 1.0407, test_f1: 0.5756
 epoch: 10, train_loss: 0.9014, test_loss: 1.1245, test_f1: 0.5220
 epoch: 11, train_loss: 0.8763, test_loss: 1.0843, test_f1: 0.5141
 epoch: 12, train_loss: 0.8749, test_loss: 1.0805, test_f1: 0.5573
 epoch: 13, train_loss: 0.8697, test_loss: 1.1448, test_f1: 0.5087
 epoch: 14, train_loss: 0.8464, test_loss: 1.1550, test_f1: 0.5364
 epoch: 15, train_loss: 0.8499, test_loss: 1.7830, test_f1: 0.4278
 epoch: 16, train_loss: 0.8534, test_loss: 1.1410, test_f1: 0.5374
 epoch: 17, train_loss: 0.8569, test_loss: 1.1477, test_f1: 0.5622
 epoch: 18, train_loss: 0.8283, test_loss: 1.1164, test_f1: 0.5295
 epoch: 19, train_loss: 0.8118, test_loss: 1.0716, test_f1: 0.5631
 epoch: 20, train_loss: 0.8253, test_loss: 1.1143, test_f1: 0.5510
 epoch: 21, train_loss: 0.7963, test_loss: 1.2921, test_f1: 0.5735
 epoch: 22, train_loss: 0.8021, test_loss: 1.3288, test_f1: 0.5639
 epoch: 23, train_loss: 0.8080, test_loss: 1.0691, test_f1: 0.5823
 epoch: 24, train_loss: 0.7854, test_loss: 1.0133, test_f1: 0.5850
 epoch: 25, train_loss: 0.7867, test_loss: 1.0835, test_f1: 0.5593
 epoch: 26, train_loss: 0.8205, test_loss: 1.0681, test_f1: 0.5745
 epoch: 27, train_loss: 0.7905, test_loss: 1.0678, test_f1: 0.5912
 epoch: 28, train_loss: 0.7893, test_loss: 1.1133, test_f1: 0.5567
 epoch: 29, train_loss: 0.8096, test_loss: 1.1298, test_f1: 0.5389
 epoch: 30, train_loss: 0.7865, test_loss: 1.1193, test_f1: 0.5721
 epoch: 31, train_loss: 0.8278, test_loss: 1.1495, test_f1: 0.5432
 epoch: 32, train_loss: 0.8156, test_loss: 1.1965, test_f1: 0.5534
 epoch: 33, train_loss: 0.7894, test_loss: 1.1627, test_f1: 0.5581
 epoch: 34, train_loss: 0.7645, test_loss: 1.7546, test_f1: 0.4780
 epoch: 35, train_loss: 0.7571, test_loss: 1.1858, test_f1: 0.4938
 epoch: 36, train_loss: 0.7414, test_loss: 1.1042, test_f1: 0.5548
 epoch: 37, train_loss: 0.6948, test_loss: 0.9840, test_f1: 0.6246
 epoch: 38, train_loss: 0.7234, test_loss: 1.0470, test_f1: 0.5962
 epoch: 39, train_loss: 0.7103, test_loss: 1.1063, test_f1: 0.6084
 epoch: 40, train_loss: 0.7276, test_loss: 1.1939, test_f1: 0.6059
 epoch: 41, train_loss: 0.6895, test_loss: 1.1531, test_f1: 0.6284
 epoch: 42, train_loss: 0.7328, test_loss: 1.0946, test_f1: 0.6088
 epoch: 43, train_loss: 0.7597, test_loss: 1.2714, test_f1: 0.5172
 epoch: 44, train_loss: 0.7285, test_loss: 1.1006, test_f1: 0.6009
 epoch: 45, train_loss: 0.7266, test_loss: 1.1950, test_f1: 0.5984
 epoch: 46, train_loss: 0.7406, test_loss: 1.1382, test_f1: 0.5686
 epoch: 47, train_loss: 0.7444, test_loss: 1.1208, test_f1: 0.5985
 epoch: 48, train_loss: 0.7531, test_loss: 1.0779, test_f1: 0.6154
 epoch: 49, train_loss: 0.7189, test_loss: 0.9911, test_f1: 0.6276
 epoch: 50, train_loss: 0.6963, test_loss: 1.0354, test_f1: 0.6151
 epoch: 51, train_loss: 0.6892, test_loss: 1.0353, test_f1: 0.5963
 epoch: 52, train_loss: 0.6780, test_loss: 1.0597, test_f1: 0.6119
 epoch: 53, train_loss: 0.6695, test_loss: 1.0238, test_f1: 0.6216
 epoch: 54, train_loss: 0.6535, test_loss: 1.0274, test_f1: 0.6349
 epoch: 55, train_loss: 0.6393, test_loss: 1.0360, test_f1: 0.6163
 epoch: 56, train_loss: 0.6184, test_loss: 1.0951, test_f1: 0.6006
 epoch: 57, train_loss: 0.6310, test_loss: 1.1062, test_f1: 0.5949
 epoch: 58, train_loss: 0.6309, test_loss: 1.1480, test_f1: 0.6021
 epoch: 59, train_loss: 0.6215, test_loss: 1.1073, test_f1: 0.5936
 epoch: 60, train_loss: 0.6102, test_loss: 1.0586, test_f1: 0.6232
 epoch: 61, train_loss: 0.6170, test_loss: 1.0396, test_f1: 0.6372
 epoch: 62, train_loss: 0.6147, test_loss: 1.2303, test_f1: 0.5981
 epoch: 63, train_loss: 0.6256, test_loss: 1.2429, test_f1: 0.5330
 epoch: 64, train_loss: 0.6070, test_loss: 1.0726, test_f1: 0.6267
 epoch: 65, train_loss: 0.6053, test_loss: 1.0469, test_f1: 0.6055
 epoch: 66, train_loss: 0.6030, test_loss: 1.0871, test_f1: 0.6225
 epoch: 67, train_loss: 0.5833, test_loss: 1.1065, test_f1: 0.6149
 epoch: 68, train_loss: 0.6044, test_loss: 1.1805, test_f1: 0.5818
 epoch: 69, train_loss: 0.5859, test_loss: 1.2251, test_f1: 0.5447
 epoch: 70, train_loss: 0.5774, test_loss: 1.1410, test_f1: 0.5750
 epoch: 71, train_loss: 0.5580, test_loss: 1.2288, test_f1: 0.5820
 epoch: 72, train_loss: 0.5856, test_loss: 1.2449, test_f1: 0.6122
 epoch: 73, train_loss: 0.6050, test_loss: 1.1732, test_f1: 0.5653
 epoch: 74, train_loss: 0.6488, test_loss: 1.5675, test_f1: 0.5576
 epoch: 75, train_loss: 0.6801, test_loss: 1.2405, test_f1: 0.5628
 epoch: 76, train_loss: 0.6808, test_loss: 1.0098, test_f1: 0.6187
 epoch: 77, train_loss: 0.6729, test_loss: 1.0302, test_f1: 0.5807
 epoch: 78, train_loss: 0.6554, test_loss: 1.3101, test_f1: 0.5472
 epoch: 79, train_loss: 0.6377, test_loss: 1.2700, test_f1: 0.5821
 epoch: 80, train_loss: 0.6412, test_loss: 1.1901, test_f1: 0.6004
 epoch: 81, train_loss: 0.6193, test_loss: 1.1464, test_f1: 0.5792
 epoch: 82, train_loss: 0.6064, test_loss: 1.1209, test_f1: 0.5743
 epoch: 83, train_loss: 0.5622, test_loss: 1.1201, test_f1: 0.5834
 epoch: 84, train_loss: 0.5582, test_loss: 1.0485, test_f1: 0.6126
 epoch: 85, train_loss: 0.5508, test_loss: 1.0984, test_f1: 0.6150
 epoch: 86, train_loss: 0.5948, test_loss: 1.2132, test_f1: 0.5572
 epoch: 87, train_loss: 0.6005, test_loss: 1.1293, test_f1: 0.5721
 epoch: 88, train_loss: 0.5705, test_loss: 1.0860, test_f1: 0.5877
 epoch: 89, train_loss: 0.5629, test_loss: 1.1127, test_f1: 0.6217
 epoch: 90, train_loss: 0.5523, test_loss: 1.1522, test_f1: 0.6430
 epoch: 91, train_loss: 0.5712, test_loss: 1.2206, test_f1: 0.6154
 epoch: 92, train_loss: 0.5315, test_loss: 1.1918, test_f1: 0.5633
 epoch: 93, train_loss: 0.5756, test_loss: 1.1913, test_f1: 0.6143
 epoch: 94, train_loss: 0.5605, test_loss: 1.2087, test_f1: 0.5945
 epoch: 95, train_loss: 0.5359, test_loss: 1.2480, test_f1: 0.6025
 epoch: 96, train_loss: 0.5229, test_loss: 1.1547, test_f1: 0.5843
 epoch: 97, train_loss: 0.5287, test_loss: 1.1743, test_f1: 0.5517
 epoch: 98, train_loss: 0.5297, test_loss: 1.2560, test_f1: 0.6097
 epoch: 99, train_loss: 0.5122, test_loss: 1.2856, test_f1: 0.5955
##################ITERATION #6 ****************************************
 epoch: 0, train_loss: 1.3559, test_loss: 1.6874, test_f1: 0.1365
 epoch: 1, train_loss: 1.1637, test_loss: 1.4555, test_f1: 0.3202
 epoch: 2, train_loss: 1.0991, test_loss: 1.2551, test_f1: 0.3395
 epoch: 3, train_loss: 1.0720, test_loss: 1.2328, test_f1: 0.3875
 epoch: 4, train_loss: 1.0106, test_loss: 1.2701, test_f1: 0.3700
 epoch: 5, train_loss: 0.9780, test_loss: 1.2649, test_f1: 0.4343
 epoch: 6, train_loss: 0.9563, test_loss: 1.2511, test_f1: 0.3436
 epoch: 7, train_loss: 0.9814, test_loss: 1.2404, test_f1: 0.4295
 epoch: 8, train_loss: 0.9572, test_loss: 1.1724, test_f1: 0.4613
 epoch: 9, train_loss: 0.9372, test_loss: 1.4219, test_f1: 0.4358
 epoch: 10, train_loss: 0.9295, test_loss: 1.1061, test_f1: 0.5581
 epoch: 11, train_loss: 0.9051, test_loss: 1.2440, test_f1: 0.4637
 epoch: 12, train_loss: 0.9140, test_loss: 1.3158, test_f1: 0.4760
 epoch: 13, train_loss: 0.9310, test_loss: 1.2058, test_f1: 0.4960
 epoch: 14, train_loss: 0.9228, test_loss: 1.1509, test_f1: 0.4826
 epoch: 15, train_loss: 0.9229, test_loss: 1.1806, test_f1: 0.5034
 epoch: 16, train_loss: 0.9003, test_loss: 1.2167, test_f1: 0.4880
 epoch: 17, train_loss: 0.9929, test_loss: 1.2124, test_f1: 0.3749
 epoch: 18, train_loss: 0.9208, test_loss: 1.1057, test_f1: 0.5113
 epoch: 19, train_loss: 0.8782, test_loss: 1.1077, test_f1: 0.5239
 epoch: 20, train_loss: 0.8787, test_loss: 1.0818, test_f1: 0.5121
 epoch: 21, train_loss: 0.8631, test_loss: 1.2080, test_f1: 0.4927
 epoch: 22, train_loss: 0.8528, test_loss: 1.2179, test_f1: 0.4767
 epoch: 23, train_loss: 0.8484, test_loss: 1.0967, test_f1: 0.5212
 epoch: 24, train_loss: 0.8536, test_loss: 1.1698, test_f1: 0.5475
 epoch: 25, train_loss: 0.8483, test_loss: 1.0994, test_f1: 0.5961
 epoch: 26, train_loss: 0.8321, test_loss: 1.1514, test_f1: 0.5774
 epoch: 27, train_loss: 0.8185, test_loss: 1.1691, test_f1: 0.5739
 epoch: 28, train_loss: 0.8062, test_loss: 1.2942, test_f1: 0.5014
 epoch: 29, train_loss: 0.7839, test_loss: 1.0522, test_f1: 0.5952
 epoch: 30, train_loss: 0.7930, test_loss: 1.3549, test_f1: 0.4820
 epoch: 31, train_loss: 0.7880, test_loss: 1.1806, test_f1: 0.5649
 epoch: 32, train_loss: 0.7781, test_loss: 1.2048, test_f1: 0.5841
 epoch: 33, train_loss: 0.7673, test_loss: 1.1269, test_f1: 0.5828
 epoch: 34, train_loss: 0.7780, test_loss: 1.1705, test_f1: 0.5582
 epoch: 35, train_loss: 0.8321, test_loss: 1.4680, test_f1: 0.5724
 epoch: 36, train_loss: 0.8264, test_loss: 1.7006, test_f1: 0.3474
 epoch: 37, train_loss: 0.8204, test_loss: 1.2671, test_f1: 0.4781
 epoch: 38, train_loss: 0.7939, test_loss: 1.2789, test_f1: 0.5256
 epoch: 39, train_loss: 0.7962, test_loss: 1.2401, test_f1: 0.5186
 epoch: 40, train_loss: 0.7828, test_loss: 1.1820, test_f1: 0.5276
 epoch: 41, train_loss: 0.7713, test_loss: 1.2367, test_f1: 0.5230
 epoch: 42, train_loss: 0.7459, test_loss: 1.3896, test_f1: 0.5097
 epoch: 43, train_loss: 0.7487, test_loss: 1.2816, test_f1: 0.5743
 epoch: 44, train_loss: 0.7700, test_loss: 1.2896, test_f1: 0.5648
 epoch: 45, train_loss: 0.7722, test_loss: 1.1411, test_f1: 0.5778
 epoch: 46, train_loss: 0.7574, test_loss: 1.1671, test_f1: 0.5407
 epoch: 47, train_loss: 0.7633, test_loss: 1.2942, test_f1: 0.5318
 epoch: 48, train_loss: 0.7738, test_loss: 1.1315, test_f1: 0.5154
 epoch: 49, train_loss: 0.7671, test_loss: 1.0154, test_f1: 0.6085
 epoch: 50, train_loss: 0.7429, test_loss: 1.1124, test_f1: 0.5155
 epoch: 51, train_loss: 0.7205, test_loss: 1.0655, test_f1: 0.5854
 epoch: 52, train_loss: 0.6916, test_loss: 1.0872, test_f1: 0.6202
 epoch: 53, train_loss: 0.7084, test_loss: 1.1084, test_f1: 0.6216
 epoch: 54, train_loss: 0.6948, test_loss: 1.0751, test_f1: 0.6225
 epoch: 55, train_loss: 0.6553, test_loss: 1.0922, test_f1: 0.6116
 epoch: 56, train_loss: 0.6607, test_loss: 1.0780, test_f1: 0.6143
 epoch: 57, train_loss: 0.6523, test_loss: 1.0373, test_f1: 0.6247
 epoch: 58, train_loss: 0.6606, test_loss: 1.1092, test_f1: 0.6325
 epoch: 59, train_loss: 0.6732, test_loss: 1.1535, test_f1: 0.5919
 epoch: 60, train_loss: 0.6591, test_loss: 1.3185, test_f1: 0.5787
 epoch: 61, train_loss: 0.6580, test_loss: 1.2285, test_f1: 0.6216
 epoch: 62, train_loss: 0.6438, test_loss: 1.3175, test_f1: 0.5724
 epoch: 63, train_loss: 0.7157, test_loss: 1.2653, test_f1: 0.5908
 epoch: 64, train_loss: 0.7132, test_loss: 1.1782, test_f1: 0.5994
 epoch: 65, train_loss: 0.7018, test_loss: 1.2078, test_f1: 0.5551
 epoch: 66, train_loss: 0.6696, test_loss: 1.1029, test_f1: 0.5955
 epoch: 67, train_loss: 0.6548, test_loss: 1.0905, test_f1: 0.6182
 epoch: 68, train_loss: 0.6607, test_loss: 1.1746, test_f1: 0.5882
 epoch: 69, train_loss: 0.6538, test_loss: 1.0716, test_f1: 0.6316
 epoch: 70, train_loss: 0.6290, test_loss: 1.0465, test_f1: 0.6215
 epoch: 71, train_loss: 0.6372, test_loss: 1.1092, test_f1: 0.5900
 epoch: 72, train_loss: 0.6071, test_loss: 1.0897, test_f1: 0.6252
 epoch: 73, train_loss: 0.6181, test_loss: 1.1575, test_f1: 0.5954
 epoch: 74, train_loss: 0.6134, test_loss: 1.1749, test_f1: 0.6057
 epoch: 75, train_loss: 0.5880, test_loss: 1.1909, test_f1: 0.6217
 epoch: 76, train_loss: 0.5857, test_loss: 1.5878, test_f1: 0.5732
 epoch: 77, train_loss: 0.5911, test_loss: 1.3878, test_f1: 0.6346
 epoch: 78, train_loss: 0.5975, test_loss: 1.6187, test_f1: 0.5594
 epoch: 79, train_loss: 0.6101, test_loss: 1.2662, test_f1: 0.6389
 epoch: 80, train_loss: 0.6069, test_loss: 1.1554, test_f1: 0.6130
 epoch: 81, train_loss: 0.6268, test_loss: 1.2767, test_f1: 0.5837
 epoch: 82, train_loss: 0.6227, test_loss: 1.3902, test_f1: 0.5970
 epoch: 83, train_loss: 0.5966, test_loss: 1.3681, test_f1: 0.5905
 epoch: 84, train_loss: 0.6071, test_loss: 1.2813, test_f1: 0.6138
 epoch: 85, train_loss: 0.5942, test_loss: 1.3921, test_f1: 0.6057
 epoch: 86, train_loss: 0.6099, test_loss: 1.4830, test_f1: 0.5819
 epoch: 87, train_loss: 0.6008, test_loss: 1.7326, test_f1: 0.5675
 epoch: 88, train_loss: 0.5760, test_loss: 1.4325, test_f1: 0.5876
 epoch: 89, train_loss: 0.5820, test_loss: 1.3033, test_f1: 0.5658
 epoch: 90, train_loss: 0.5800, test_loss: 1.2529, test_f1: 0.6181
 epoch: 91, train_loss: 0.5592, test_loss: 1.2931, test_f1: 0.5906
 epoch: 92, train_loss: 0.5747, test_loss: 1.3821, test_f1: 0.6303
 epoch: 93, train_loss: 0.5608, test_loss: 1.3310, test_f1: 0.6280
 epoch: 94, train_loss: 0.6051, test_loss: 1.3044, test_f1: 0.6272
 epoch: 95, train_loss: 0.6169, test_loss: 1.3672, test_f1: 0.6270
 epoch: 96, train_loss: 0.5657, test_loss: 1.5764, test_f1: 0.5247
 epoch: 97, train_loss: 0.5784, test_loss: 1.4442, test_f1: 0.6037
 epoch: 98, train_loss: 0.5622, test_loss: 1.6284, test_f1: 0.5870
 epoch: 99, train_loss: 0.5579, test_loss: 1.5614, test_f1: 0.6088
##################ITERATION #7 ****************************************
 epoch: 0, train_loss: 1.4138, test_loss: 1.5233, test_f1: 0.1365
 epoch: 1, train_loss: 1.2196, test_loss: 1.3776, test_f1: 0.2942
 epoch: 2, train_loss: 1.1853, test_loss: 1.3219, test_f1: 0.3402
 epoch: 3, train_loss: 1.1649, test_loss: 1.2660, test_f1: 0.3446
 epoch: 4, train_loss: 1.1266, test_loss: 1.2118, test_f1: 0.3511
 epoch: 5, train_loss: 1.1085, test_loss: 1.1774, test_f1: 0.4132
 epoch: 6, train_loss: 1.0568, test_loss: 1.1690, test_f1: 0.4224
 epoch: 7, train_loss: 1.0207, test_loss: 1.1636, test_f1: 0.4011
 epoch: 8, train_loss: 1.0095, test_loss: 1.1998, test_f1: 0.4588
 epoch: 9, train_loss: 0.9724, test_loss: 1.1848, test_f1: 0.4417
 epoch: 10, train_loss: 0.9692, test_loss: 1.1625, test_f1: 0.4213
 epoch: 11, train_loss: 0.9294, test_loss: 1.1234, test_f1: 0.4778
 epoch: 12, train_loss: 0.9282, test_loss: 1.2057, test_f1: 0.4428
 epoch: 13, train_loss: 0.9009, test_loss: 1.6874, test_f1: 0.3816
 epoch: 14, train_loss: 0.9463, test_loss: 1.5318, test_f1: 0.3078
 epoch: 15, train_loss: 0.9794, test_loss: 1.1362, test_f1: 0.4283
 epoch: 16, train_loss: 0.9305, test_loss: 1.1478, test_f1: 0.3969
 epoch: 17, train_loss: 0.9320, test_loss: 1.2453, test_f1: 0.4210
 epoch: 18, train_loss: 0.8776, test_loss: 1.0458, test_f1: 0.5439
 epoch: 19, train_loss: 0.8885, test_loss: 1.0404, test_f1: 0.5475
 epoch: 20, train_loss: 0.8530, test_loss: 1.0173, test_f1: 0.5697
 epoch: 21, train_loss: 0.8814, test_loss: 1.0700, test_f1: 0.5638
 epoch: 22, train_loss: 0.8559, test_loss: 1.0621, test_f1: 0.5486
 epoch: 23, train_loss: 0.8152, test_loss: 1.1008, test_f1: 0.5177
 epoch: 24, train_loss: 0.8099, test_loss: 1.1237, test_f1: 0.5267
 epoch: 25, train_loss: 0.7803, test_loss: 1.2035, test_f1: 0.5398
 epoch: 26, train_loss: 0.7841, test_loss: 1.1234, test_f1: 0.5630
 epoch: 27, train_loss: 0.8020, test_loss: 1.0492, test_f1: 0.5881
 epoch: 28, train_loss: 0.7947, test_loss: 1.0974, test_f1: 0.5681
 epoch: 29, train_loss: 0.7726, test_loss: 1.0769, test_f1: 0.5874
 epoch: 30, train_loss: 0.7598, test_loss: 1.2164, test_f1: 0.5731
 epoch: 31, train_loss: 0.7712, test_loss: 1.1934, test_f1: 0.5163
 epoch: 32, train_loss: 0.7675, test_loss: 1.4529, test_f1: 0.4887
 epoch: 33, train_loss: 0.7683, test_loss: 1.2219, test_f1: 0.5941
 epoch: 34, train_loss: 0.7593, test_loss: 1.1443, test_f1: 0.5130
 epoch: 35, train_loss: 0.7510, test_loss: 1.8408, test_f1: 0.4370
 epoch: 36, train_loss: 0.7560, test_loss: 1.0932, test_f1: 0.5765
 epoch: 37, train_loss: 0.7494, test_loss: 1.1661, test_f1: 0.5750
 epoch: 38, train_loss: 0.7463, test_loss: 1.1579, test_f1: 0.5704
 epoch: 39, train_loss: 0.7392, test_loss: 1.1608, test_f1: 0.5491
 epoch: 40, train_loss: 0.7305, test_loss: 1.1925, test_f1: 0.5699
 epoch: 41, train_loss: 0.7290, test_loss: 1.2201, test_f1: 0.5688
 epoch: 42, train_loss: 0.7365, test_loss: 1.1727, test_f1: 0.4982
 epoch: 43, train_loss: 0.7154, test_loss: 1.1079, test_f1: 0.5421
 epoch: 44, train_loss: 0.7351, test_loss: 1.1844, test_f1: 0.5251
 epoch: 45, train_loss: 0.7699, test_loss: 1.2082, test_f1: 0.4800
 epoch: 46, train_loss: 0.7565, test_loss: 1.2907, test_f1: 0.4269
 epoch: 47, train_loss: 0.7840, test_loss: 1.1864, test_f1: 0.5098
 epoch: 48, train_loss: 0.7428, test_loss: 1.0087, test_f1: 0.5244
 epoch: 49, train_loss: 0.7207, test_loss: 1.1930, test_f1: 0.5539
 epoch: 50, train_loss: 0.7042, test_loss: 1.1449, test_f1: 0.5527
 epoch: 51, train_loss: 0.7051, test_loss: 1.2906, test_f1: 0.5496
 epoch: 52, train_loss: 0.6962, test_loss: 1.2766, test_f1: 0.5260
 epoch: 53, train_loss: 0.6829, test_loss: 1.2273, test_f1: 0.5415
 epoch: 54, train_loss: 0.6883, test_loss: 1.2415, test_f1: 0.5272
 epoch: 55, train_loss: 0.6812, test_loss: 1.1338, test_f1: 0.5674
 epoch: 56, train_loss: 0.6650, test_loss: 1.2204, test_f1: 0.5309
 epoch: 57, train_loss: 0.6658, test_loss: 1.1699, test_f1: 0.5480
 epoch: 58, train_loss: 0.6553, test_loss: 1.1750, test_f1: 0.5963
 epoch: 59, train_loss: 0.6260, test_loss: 1.2978, test_f1: 0.5106
 epoch: 60, train_loss: 0.6405, test_loss: 1.2247, test_f1: 0.5270
 epoch: 61, train_loss: 0.6753, test_loss: 1.1896, test_f1: 0.5507
 epoch: 62, train_loss: 0.6670, test_loss: 1.1469, test_f1: 0.5743
 epoch: 63, train_loss: 0.6577, test_loss: 1.0519, test_f1: 0.5668
 epoch: 64, train_loss: 0.6633, test_loss: 1.0581, test_f1: 0.6133
 epoch: 65, train_loss: 0.6335, test_loss: 1.2879, test_f1: 0.5662
 epoch: 66, train_loss: 0.6313, test_loss: 1.2608, test_f1: 0.5374
 epoch: 67, train_loss: 0.6500, test_loss: 1.2845, test_f1: 0.5674
 epoch: 68, train_loss: 0.6577, test_loss: 1.2670, test_f1: 0.5555
 epoch: 69, train_loss: 0.6189, test_loss: 1.2086, test_f1: 0.5937
 epoch: 70, train_loss: 0.6333, test_loss: 1.1986, test_f1: 0.5850
 epoch: 71, train_loss: 0.6381, test_loss: 1.3629, test_f1: 0.5184
 epoch: 72, train_loss: 0.6280, test_loss: 1.2489, test_f1: 0.5625
 epoch: 73, train_loss: 0.6095, test_loss: 1.1699, test_f1: 0.5777
 epoch: 74, train_loss: 0.6002, test_loss: 1.1690, test_f1: 0.5764
 epoch: 75, train_loss: 0.6150, test_loss: 1.3415, test_f1: 0.5285
 epoch: 76, train_loss: 0.6115, test_loss: 1.2516, test_f1: 0.5174
 epoch: 77, train_loss: 0.6122, test_loss: 1.2281, test_f1: 0.5673
 epoch: 78, train_loss: 0.5921, test_loss: 1.5931, test_f1: 0.4981
 epoch: 79, train_loss: 0.5780, test_loss: 1.3420, test_f1: 0.5498
 epoch: 80, train_loss: 0.6045, test_loss: 1.2490, test_f1: 0.5767
 epoch: 81, train_loss: 0.5959, test_loss: 1.2928, test_f1: 0.5560
 epoch: 82, train_loss: 0.5603, test_loss: 1.3605, test_f1: 0.5656
 epoch: 83, train_loss: 0.5558, test_loss: 1.2405, test_f1: 0.6220
 epoch: 84, train_loss: 0.5618, test_loss: 1.2371, test_f1: 0.6190
 epoch: 85, train_loss: 0.5745, test_loss: 1.3857, test_f1: 0.5474
 epoch: 86, train_loss: 0.5953, test_loss: 1.3751, test_f1: 0.5628
 epoch: 87, train_loss: 0.5602, test_loss: 1.2170, test_f1: 0.6181
 epoch: 88, train_loss: 0.5771, test_loss: 1.2384, test_f1: 0.5699
 epoch: 89, train_loss: 0.5533, test_loss: 1.2630, test_f1: 0.5571
 epoch: 90, train_loss: 0.5544, test_loss: 1.4656, test_f1: 0.5411
 epoch: 91, train_loss: 0.5655, test_loss: 1.3653, test_f1: 0.5319
 epoch: 92, train_loss: 0.5570, test_loss: 1.3659, test_f1: 0.5643
 epoch: 93, train_loss: 0.5675, test_loss: 1.5799, test_f1: 0.6042
 epoch: 94, train_loss: 0.5911, test_loss: 1.2108, test_f1: 0.6202
 epoch: 95, train_loss: 0.6074, test_loss: 1.1911, test_f1: 0.6191
 epoch: 96, train_loss: 0.5922, test_loss: 1.1923, test_f1: 0.5837
 epoch: 97, train_loss: 0.5847, test_loss: 1.3788, test_f1: 0.5386
 epoch: 98, train_loss: 0.5881, test_loss: 1.3794, test_f1: 0.5169
 epoch: 99, train_loss: 0.5651, test_loss: 1.5879, test_f1: 0.5361
##################ITERATION #8 ****************************************
 epoch: 0, train_loss: 1.3304, test_loss: 1.4485, test_f1: 0.2354
 epoch: 1, train_loss: 1.1899, test_loss: 1.3675, test_f1: 0.3163
 epoch: 2, train_loss: 1.1654, test_loss: 1.3443, test_f1: 0.3215
 epoch: 3, train_loss: 1.1216, test_loss: 1.2263, test_f1: 0.3971
 epoch: 4, train_loss: 1.0697, test_loss: 1.1936, test_f1: 0.4461
 epoch: 5, train_loss: 1.0532, test_loss: 1.1837, test_f1: 0.4941
 epoch: 6, train_loss: 1.0425, test_loss: 1.1249, test_f1: 0.4367
 epoch: 7, train_loss: 1.0118, test_loss: 1.1402, test_f1: 0.4995
 epoch: 8, train_loss: 0.9851, test_loss: 1.1723, test_f1: 0.3955
 epoch: 9, train_loss: 0.9344, test_loss: 1.2661, test_f1: 0.3814
 epoch: 10, train_loss: 0.9414, test_loss: 1.6377, test_f1: 0.3170
 epoch: 11, train_loss: 0.9212, test_loss: 1.0890, test_f1: 0.5555
 epoch: 12, train_loss: 0.9017, test_loss: 1.3205, test_f1: 0.5620
 epoch: 13, train_loss: 0.9145, test_loss: 1.1064, test_f1: 0.5267
 epoch: 14, train_loss: 0.8775, test_loss: 1.0735, test_f1: 0.4567
 epoch: 15, train_loss: 0.8675, test_loss: 1.8023, test_f1: 0.3649
 epoch: 16, train_loss: 0.8612, test_loss: 1.2317, test_f1: 0.4337
 epoch: 17, train_loss: 0.8777, test_loss: 1.0359, test_f1: 0.5210
 epoch: 18, train_loss: 0.8531, test_loss: 1.0611, test_f1: 0.4810
 epoch: 19, train_loss: 0.8562, test_loss: 1.0776, test_f1: 0.4961
 epoch: 20, train_loss: 0.8395, test_loss: 1.0247, test_f1: 0.5320
 epoch: 21, train_loss: 0.8201, test_loss: 1.0812, test_f1: 0.5351
 epoch: 22, train_loss: 0.8162, test_loss: 1.0502, test_f1: 0.5064
 epoch: 23, train_loss: 0.7995, test_loss: 1.2855, test_f1: 0.5675
 epoch: 24, train_loss: 0.8107, test_loss: 1.0671, test_f1: 0.5486
 epoch: 25, train_loss: 0.7932, test_loss: 1.1322, test_f1: 0.5453
 epoch: 26, train_loss: 0.7768, test_loss: 1.0578, test_f1: 0.5583
 epoch: 27, train_loss: 0.7754, test_loss: 1.1983, test_f1: 0.4712
 epoch: 28, train_loss: 0.8102, test_loss: 1.2466, test_f1: 0.4294
 epoch: 29, train_loss: 0.7797, test_loss: 1.1807, test_f1: 0.5142
 epoch: 30, train_loss: 0.7552, test_loss: 1.1172, test_f1: 0.4923
 epoch: 31, train_loss: 0.7509, test_loss: 1.1800, test_f1: 0.5401
 epoch: 32, train_loss: 0.7640, test_loss: 1.1205, test_f1: 0.5339
 epoch: 33, train_loss: 0.7420, test_loss: 1.0656, test_f1: 0.5238
 epoch: 34, train_loss: 0.7257, test_loss: 1.0752, test_f1: 0.5235
 epoch: 35, train_loss: 0.7463, test_loss: 1.2932, test_f1: 0.5888
 epoch: 36, train_loss: 0.7452, test_loss: 1.2744, test_f1: 0.5618
 epoch: 37, train_loss: 0.7337, test_loss: 1.0729, test_f1: 0.5967
 epoch: 38, train_loss: 0.7325, test_loss: 1.0595, test_f1: 0.5565
 epoch: 39, train_loss: 0.7432, test_loss: 1.0925, test_f1: 0.5050
 epoch: 40, train_loss: 0.7163, test_loss: 1.1931, test_f1: 0.5151
 epoch: 41, train_loss: 0.7352, test_loss: 1.1748, test_f1: 0.5279
 epoch: 42, train_loss: 0.7746, test_loss: 1.3294, test_f1: 0.5406
 epoch: 43, train_loss: 0.7581, test_loss: 1.0957, test_f1: 0.5162
 epoch: 44, train_loss: 0.7693, test_loss: 1.3501, test_f1: 0.4680
 epoch: 45, train_loss: 0.8948, test_loss: 4.3851, test_f1: 0.1947
 epoch: 46, train_loss: 0.9133, test_loss: 1.8314, test_f1: 0.4254
 epoch: 47, train_loss: 0.8563, test_loss: 1.2362, test_f1: 0.5050
 epoch: 48, train_loss: 0.8287, test_loss: 1.2103, test_f1: 0.4750
 epoch: 49, train_loss: 0.7963, test_loss: 1.1454, test_f1: 0.5508
 epoch: 50, train_loss: 0.8336, test_loss: 1.2631, test_f1: 0.5533
 epoch: 51, train_loss: 0.8228, test_loss: 1.1531, test_f1: 0.5445
 epoch: 52, train_loss: 0.8105, test_loss: 1.1080, test_f1: 0.5463
 epoch: 53, train_loss: 0.7819, test_loss: 1.1192, test_f1: 0.5115
 epoch: 54, train_loss: 0.7706, test_loss: 1.1350, test_f1: 0.5447
 epoch: 55, train_loss: 0.7437, test_loss: 1.1788, test_f1: 0.5270
 epoch: 56, train_loss: 0.7410, test_loss: 1.1962, test_f1: 0.5112
 epoch: 57, train_loss: 0.7496, test_loss: 1.1948, test_f1: 0.5108
 epoch: 58, train_loss: 0.7073, test_loss: 1.2340, test_f1: 0.5320
 epoch: 59, train_loss: 0.7152, test_loss: 1.2098, test_f1: 0.5372
 epoch: 60, train_loss: 0.6978, test_loss: 1.1817, test_f1: 0.5792
 epoch: 61, train_loss: 0.6939, test_loss: 1.1806, test_f1: 0.5910
 epoch: 62, train_loss: 0.6941, test_loss: 1.1922, test_f1: 0.5686
 epoch: 63, train_loss: 0.6890, test_loss: 1.2643, test_f1: 0.5131
 epoch: 64, train_loss: 0.6853, test_loss: 1.2836, test_f1: 0.5223
 epoch: 65, train_loss: 0.6834, test_loss: 1.1946, test_f1: 0.5789
 epoch: 66, train_loss: 0.6830, test_loss: 1.0722, test_f1: 0.5776
 epoch: 67, train_loss: 0.6815, test_loss: 1.0378, test_f1: 0.5752
 epoch: 68, train_loss: 0.6613, test_loss: 1.0218, test_f1: 0.5951
 epoch: 69, train_loss: 0.6492, test_loss: 1.0795, test_f1: 0.5863
 epoch: 70, train_loss: 0.6393, test_loss: 1.0899, test_f1: 0.5453
 epoch: 71, train_loss: 0.6460, test_loss: 1.1502, test_f1: 0.5725
 epoch: 72, train_loss: 0.6447, test_loss: 1.1864, test_f1: 0.5559
 epoch: 73, train_loss: 0.6584, test_loss: 1.2021, test_f1: 0.5686
 epoch: 74, train_loss: 0.6446, test_loss: 1.0363, test_f1: 0.5961
 epoch: 75, train_loss: 0.6750, test_loss: 1.0161, test_f1: 0.6079
 epoch: 76, train_loss: 0.6495, test_loss: 1.0513, test_f1: 0.5315
 epoch: 77, train_loss: 0.6166, test_loss: 1.0242, test_f1: 0.5475
 epoch: 78, train_loss: 0.6364, test_loss: 1.0392, test_f1: 0.5539
 epoch: 79, train_loss: 0.6179, test_loss: 1.0631, test_f1: 0.5931
 epoch: 80, train_loss: 0.6063, test_loss: 1.3506, test_f1: 0.5711
 epoch: 81, train_loss: 0.6126, test_loss: 1.1763, test_f1: 0.5915
 epoch: 82, train_loss: 0.6117, test_loss: 1.1803, test_f1: 0.5942
 epoch: 83, train_loss: 0.6003, test_loss: 1.3128, test_f1: 0.5375
 epoch: 84, train_loss: 0.5894, test_loss: 1.2862, test_f1: 0.5083
 epoch: 85, train_loss: 0.5557, test_loss: 1.2831, test_f1: 0.5540
 epoch: 86, train_loss: 0.5802, test_loss: 1.3370, test_f1: 0.5429
 epoch: 87, train_loss: 0.5840, test_loss: 1.3098, test_f1: 0.5727
 epoch: 88, train_loss: 0.6172, test_loss: 1.2524, test_f1: 0.5667
 epoch: 89, train_loss: 0.6260, test_loss: 1.2832, test_f1: 0.5342
 epoch: 90, train_loss: 0.6075, test_loss: 1.3200, test_f1: 0.5427
 epoch: 91, train_loss: 0.6302, test_loss: 1.4678, test_f1: 0.4986
 epoch: 92, train_loss: 0.6598, test_loss: 1.1658, test_f1: 0.5426
 epoch: 93, train_loss: 0.6345, test_loss: 1.1175, test_f1: 0.5534
 epoch: 94, train_loss: 0.6344, test_loss: 1.2660, test_f1: 0.5431
 epoch: 95, train_loss: 0.5986, test_loss: 1.3511, test_f1: 0.5201
 epoch: 96, train_loss: 0.5853, test_loss: 1.2805, test_f1: 0.5314
 epoch: 97, train_loss: 0.5788, test_loss: 1.2318, test_f1: 0.5121
 epoch: 98, train_loss: 0.5455, test_loss: 1.2214, test_f1: 0.5438
 epoch: 99, train_loss: 0.5482, test_loss: 1.3307, test_f1: 0.5546
##################ITERATION #9 ****************************************
 epoch: 0, train_loss: 1.2777, test_loss: 1.5881, test_f1: 0.1365
 epoch: 1, train_loss: 1.1409, test_loss: 1.3941, test_f1: 0.3427
 epoch: 2, train_loss: 1.0871, test_loss: 1.4013, test_f1: 0.3303
 epoch: 3, train_loss: 1.0477, test_loss: 1.3094, test_f1: 0.3799
 epoch: 4, train_loss: 1.0206, test_loss: 1.2549, test_f1: 0.3978
 epoch: 5, train_loss: 0.9859, test_loss: 1.2631, test_f1: 0.3771
 epoch: 6, train_loss: 1.0085, test_loss: 1.2506, test_f1: 0.3528
 epoch: 7, train_loss: 0.9580, test_loss: 1.3795, test_f1: 0.3587
 epoch: 8, train_loss: 0.9711, test_loss: 1.1798, test_f1: 0.4431
 epoch: 9, train_loss: 0.9328, test_loss: 1.1250, test_f1: 0.4930
 epoch: 10, train_loss: 0.9110, test_loss: 1.2156, test_f1: 0.4331
 epoch: 11, train_loss: 0.9146, test_loss: 1.4248, test_f1: 0.4015
 epoch: 12, train_loss: 0.9209, test_loss: 1.1871, test_f1: 0.4787
 epoch: 13, train_loss: 0.9007, test_loss: 1.1535, test_f1: 0.5541
 epoch: 14, train_loss: 0.8904, test_loss: 1.3705, test_f1: 0.4126
 epoch: 15, train_loss: 0.8565, test_loss: 1.1314, test_f1: 0.4892
 epoch: 16, train_loss: 0.8459, test_loss: 1.2523, test_f1: 0.4517
 epoch: 17, train_loss: 0.8147, test_loss: 1.4005, test_f1: 0.3946
 epoch: 18, train_loss: 0.8215, test_loss: 0.9734, test_f1: 0.5752
 epoch: 19, train_loss: 0.8484, test_loss: 1.1484, test_f1: 0.4945
 epoch: 20, train_loss: 0.7952, test_loss: 1.2061, test_f1: 0.4986
 epoch: 21, train_loss: 0.7956, test_loss: 1.1699, test_f1: 0.5009
 epoch: 22, train_loss: 0.7873, test_loss: 1.3106, test_f1: 0.4441
 epoch: 23, train_loss: 0.8060, test_loss: 1.5352, test_f1: 0.3694
 epoch: 24, train_loss: 0.8007, test_loss: 1.0204, test_f1: 0.5277
 epoch: 25, train_loss: 0.8161, test_loss: 1.0874, test_f1: 0.5422
 epoch: 26, train_loss: 0.7956, test_loss: 1.1817, test_f1: 0.5256
 epoch: 27, train_loss: 0.7732, test_loss: 1.1931, test_f1: 0.5037
 epoch: 28, train_loss: 0.7565, test_loss: 1.1597, test_f1: 0.5672
 epoch: 29, train_loss: 0.7305, test_loss: 1.2418, test_f1: 0.5136
 epoch: 30, train_loss: 0.7026, test_loss: 1.4715, test_f1: 0.4789
 epoch: 31, train_loss: 0.7183, test_loss: 1.2578, test_f1: 0.5449
 epoch: 32, train_loss: 0.6952, test_loss: 1.2449, test_f1: 0.5533
 epoch: 33, train_loss: 0.6944, test_loss: 1.0959, test_f1: 0.5970
 epoch: 34, train_loss: 0.6737, test_loss: 1.1040, test_f1: 0.5973
 epoch: 35, train_loss: 0.6747, test_loss: 1.3378, test_f1: 0.5645
 epoch: 36, train_loss: 0.6877, test_loss: 1.7065, test_f1: 0.5714
 epoch: 37, train_loss: 0.7173, test_loss: 2.0215, test_f1: 0.3595
 epoch: 38, train_loss: 0.8824, test_loss: 1.5789, test_f1: 0.3738
 epoch: 39, train_loss: 0.9002, test_loss: 1.6736, test_f1: 0.4641
 epoch: 40, train_loss: 0.9271, test_loss: 1.2899, test_f1: 0.4961
 epoch: 41, train_loss: 0.9114, test_loss: 1.2926, test_f1: 0.4931
 epoch: 42, train_loss: 0.8776, test_loss: 1.4514, test_f1: 0.4137
 epoch: 43, train_loss: 0.9058, test_loss: 1.1248, test_f1: 0.5198
 epoch: 44, train_loss: 0.8627, test_loss: 1.0942, test_f1: 0.5130
 epoch: 45, train_loss: 0.8666, test_loss: 1.2345, test_f1: 0.5102
 epoch: 46, train_loss: 0.8374, test_loss: 1.1702, test_f1: 0.5409
 epoch: 47, train_loss: 0.8044, test_loss: 1.5203, test_f1: 0.4384
 epoch: 48, train_loss: 0.7845, test_loss: 1.6543, test_f1: 0.3815
 epoch: 49, train_loss: 0.8008, test_loss: 1.5244, test_f1: 0.4663
 epoch: 50, train_loss: 0.7813, test_loss: 1.3899, test_f1: 0.4995
 epoch: 51, train_loss: 0.7519, test_loss: 1.1833, test_f1: 0.5704
 epoch: 52, train_loss: 0.7493, test_loss: 1.1576, test_f1: 0.5694
 epoch: 53, train_loss: 0.7262, test_loss: 1.1055, test_f1: 0.5513
 epoch: 54, train_loss: 0.7254, test_loss: 1.0766, test_f1: 0.5598
 epoch: 55, train_loss: 0.7133, test_loss: 1.1704, test_f1: 0.5271
 epoch: 56, train_loss: 0.7145, test_loss: 1.1936, test_f1: 0.5694
 epoch: 57, train_loss: 0.6985, test_loss: 1.2617, test_f1: 0.5698
 epoch: 58, train_loss: 0.6771, test_loss: 1.1799, test_f1: 0.5196
 epoch: 59, train_loss: 0.7051, test_loss: 1.1974, test_f1: 0.5874
 epoch: 60, train_loss: 0.6977, test_loss: 1.2536, test_f1: 0.5562
 epoch: 61, train_loss: 0.7018, test_loss: 1.1965, test_f1: 0.5926
 epoch: 62, train_loss: 0.7018, test_loss: 1.3042, test_f1: 0.5218
 epoch: 63, train_loss: 0.6943, test_loss: 1.2135, test_f1: 0.5404
 epoch: 64, train_loss: 0.6755, test_loss: 1.2164, test_f1: 0.5494
 epoch: 65, train_loss: 0.6757, test_loss: 1.3168, test_f1: 0.5208
 epoch: 66, train_loss: 0.6659, test_loss: 1.1927, test_f1: 0.5806
 epoch: 67, train_loss: 0.6547, test_loss: 1.2105, test_f1: 0.5526
 epoch: 68, train_loss: 0.6449, test_loss: 1.2283, test_f1: 0.5692
 epoch: 69, train_loss: 0.6459, test_loss: 1.2348, test_f1: 0.5646
 epoch: 70, train_loss: 0.6398, test_loss: 1.2692, test_f1: 0.5674
 epoch: 71, train_loss: 0.6510, test_loss: 1.2258, test_f1: 0.5879
 epoch: 72, train_loss: 0.6201, test_loss: 1.1813, test_f1: 0.5985
 epoch: 73, train_loss: 0.6537, test_loss: 1.2106, test_f1: 0.5759
 epoch: 74, train_loss: 0.6262, test_loss: 1.2312, test_f1: 0.5746
 epoch: 75, train_loss: 0.6497, test_loss: 1.2535, test_f1: 0.5596
 epoch: 76, train_loss: 0.6828, test_loss: 1.4126, test_f1: 0.5301
 epoch: 77, train_loss: 0.6422, test_loss: 1.1498, test_f1: 0.5819
 epoch: 78, train_loss: 0.6325, test_loss: 1.1130, test_f1: 0.6288
 epoch: 79, train_loss: 0.6495, test_loss: 1.1526, test_f1: 0.6084
 epoch: 80, train_loss: 0.6474, test_loss: 1.1372, test_f1: 0.5424
 epoch: 81, train_loss: 0.6290, test_loss: 1.3153, test_f1: 0.5471
 epoch: 82, train_loss: 0.6009, test_loss: 1.3408, test_f1: 0.5514
 epoch: 83, train_loss: 0.6047, test_loss: 1.5772, test_f1: 0.5093
 epoch: 84, train_loss: 0.5962, test_loss: 1.3832, test_f1: 0.5673
 epoch: 85, train_loss: 0.6177, test_loss: 1.2954, test_f1: 0.5518
 epoch: 86, train_loss: 0.6298, test_loss: 1.3723, test_f1: 0.5410
 epoch: 87, train_loss: 0.6440, test_loss: 1.3498, test_f1: 0.4958
 epoch: 88, train_loss: 0.6597, test_loss: 1.3096, test_f1: 0.5209
 epoch: 89, train_loss: 0.6433, test_loss: 1.2569, test_f1: 0.5581
 epoch: 90, train_loss: 0.6393, test_loss: 1.1789, test_f1: 0.5519
 epoch: 91, train_loss: 0.6153, test_loss: 1.1224, test_f1: 0.6045
 epoch: 92, train_loss: 0.6149, test_loss: 1.1820, test_f1: 0.6065
 epoch: 93, train_loss: 0.5915, test_loss: 1.2986, test_f1: 0.5913
 epoch: 94, train_loss: 0.5691, test_loss: 1.4143, test_f1: 0.4944
 epoch: 95, train_loss: 0.5711, test_loss: 1.4657, test_f1: 0.5099
 epoch: 96, train_loss: 0.5724, test_loss: 1.3927, test_f1: 0.5595
 epoch: 97, train_loss: 0.5647, test_loss: 1.4046, test_f1: 0.5745
 epoch: 98, train_loss: 0.6551, test_loss: 1.3981, test_f1: 0.5234
 epoch: 99, train_loss: 0.6060, test_loss: 1.3522, test_f1: 0.4962

Training completed in 286.71 seconds
Best F1: 0.6856 at epoch 97
Mean F1 across iterations: 0.6336  0.0248
========================FINAL RESULTS================================
FEGIN weighted F1: 0.6856  0.0248
python main.py --data ltspice_demos --representation component_component --model FEGIN --layers 3 --hiddens 32 --batch_size 256 --lr 0.01 --emb_size 250 --epochs 100 --save_appendix component_component_L3_H32_BS256_LR0.01_E250 --no_val
-----



STDERR:
  File "main.py", line 370, in <module>
    main()
  File "main.py", line 254, in main
    dataset = dataset_class(
  File "/home/philip/projects/ltspice_examples_code_repo/Circuit-Completion-Using-GNNs/component_classification_with_link_prediction_head/evaluation/FEGIN/kernel/circuit_datasets.py", line 15, in __init__
    self.data, self.slices = torch.load(self.processed_paths[0])
  File "/home/philip/.local/lib/python3.8/site-packages/torch/serialization.py", line 1040, in load
    warnings.warn(
  File "/usr/lib/python3.8/warnings.py", line 109, in _showwarnmsg
    sw(msg.message, msg.category, msg.filename, msg.lineno,
  File "main.py", line 47, in warn_with_traceback
    traceback.print_stack(file=log)
/home/philip/projects/ltspice_examples_code_repo/Circuit-Completion-Using-GNNs/component_classification_with_link_prediction_head/evaluation/FEGIN/kernel/circuit_datasets.py:15: FutureWarning: You are using `torch.load` with `weights_only=False` (the current default value), which uses the default pickle module implicitly. It is possible to construct malicious pickle data which will execute arbitrary code during unpickling (See https://github.com/pytorch/pytorch/blob/main/SECURITY.md#untrusted-models for more details). In a future release, the default value for `weights_only` will be flipped to `True`. This limits the functions that could be executed during unpickling. Arbitrary objects will no longer be allowed to be loaded via this mode unless they are explicitly allowlisted by the user via `torch.serialization.add_safe_globals`. We recommend you start setting `weights_only=True` for any use case where you don't have full control of the loaded file. Please open an issue on GitHub for any issues related to this experimental feature.
  self.data, self.slices = torch.load(self.processed_paths[0])
