STDOUT:
Results will be saved in /home/philip/projects/ltspice_examples_code_repo/Circuit-Completion-Using-GNNs/component_classification_with_link_prediction_head/evaluation/FEGIN/results/model_FEGIN_dataset_ltspice_demos
Command line input: python main.py --data ltspice_demos --representation component_pin --model FEGIN --layers 2 --hiddens 128 --batch_size 32 --lr 0.0001 --emb_size 250 --epochs 100 --save_appendix component_pin_L2_H128_BS32_LR0.0001_E250 --no_val
 is saved.
-----
ltspice_demos - FEGIN
Using 2 layers, 128 hidden units, h = 2
Loading component_pin representation dataset
ENTERED
Training FEGIN on component_pin representation
Train: 1565, Test: 383
##################ITERATION #0 ****************************************
 epoch: 0, train_loss: 1.3518, test_loss: 1.3472, test_f1: 0.3381
 epoch: 1, train_loss: 1.3004, test_loss: 1.3039, test_f1: 0.2850
 epoch: 2, train_loss: 1.2428, test_loss: 1.2570, test_f1: 0.2872
 epoch: 3, train_loss: 1.1858, test_loss: 1.2237, test_f1: 0.4206
 epoch: 4, train_loss: 1.1398, test_loss: 1.1909, test_f1: 0.4522
 epoch: 5, train_loss: 1.1031, test_loss: 1.1471, test_f1: 0.4488
 epoch: 6, train_loss: 1.0565, test_loss: 1.1169, test_f1: 0.4542
 epoch: 7, train_loss: 1.0255, test_loss: 1.0900, test_f1: 0.4567
 epoch: 8, train_loss: 1.0034, test_loss: 1.0678, test_f1: 0.4561
 epoch: 9, train_loss: 0.9809, test_loss: 1.0531, test_f1: 0.4571
 epoch: 10, train_loss: 0.9646, test_loss: 1.0432, test_f1: 0.4611
 epoch: 11, train_loss: 0.9475, test_loss: 1.0150, test_f1: 0.4515
 epoch: 12, train_loss: 0.9276, test_loss: 1.0206, test_f1: 0.4896
 epoch: 13, train_loss: 0.9066, test_loss: 1.0010, test_f1: 0.5302
 epoch: 14, train_loss: 0.8903, test_loss: 0.9886, test_f1: 0.5410
 epoch: 15, train_loss: 0.8755, test_loss: 0.9715, test_f1: 0.5645
 epoch: 16, train_loss: 0.8566, test_loss: 0.9628, test_f1: 0.5797
 epoch: 17, train_loss: 0.8429, test_loss: 0.9734, test_f1: 0.6012
 epoch: 18, train_loss: 0.8254, test_loss: 0.9736, test_f1: 0.6039
 epoch: 19, train_loss: 0.7983, test_loss: 0.9605, test_f1: 0.6030
 epoch: 20, train_loss: 0.7915, test_loss: 0.9649, test_f1: 0.6117
 epoch: 21, train_loss: 0.7719, test_loss: 0.9504, test_f1: 0.6294
 epoch: 22, train_loss: 0.7576, test_loss: 0.9525, test_f1: 0.6218
 epoch: 23, train_loss: 0.7484, test_loss: 0.9603, test_f1: 0.6133
 epoch: 24, train_loss: 0.7316, test_loss: 0.9530, test_f1: 0.6254
 epoch: 25, train_loss: 0.7131, test_loss: 0.9600, test_f1: 0.6030
 epoch: 26, train_loss: 0.7121, test_loss: 0.9534, test_f1: 0.6018
 epoch: 27, train_loss: 0.6997, test_loss: 0.9539, test_f1: 0.6094
 epoch: 28, train_loss: 0.6839, test_loss: 0.9654, test_f1: 0.6097
 epoch: 29, train_loss: 0.6853, test_loss: 0.9959, test_f1: 0.6187
 epoch: 30, train_loss: 0.6703, test_loss: 0.9689, test_f1: 0.6087
 epoch: 31, train_loss: 0.6633, test_loss: 0.9873, test_f1: 0.6008
 epoch: 32, train_loss: 0.6579, test_loss: 1.0011, test_f1: 0.6123
 epoch: 33, train_loss: 0.6581, test_loss: 0.9863, test_f1: 0.6034
 epoch: 34, train_loss: 0.6422, test_loss: 0.9837, test_f1: 0.6208
 epoch: 35, train_loss: 0.6263, test_loss: 1.0276, test_f1: 0.6021
 epoch: 36, train_loss: 0.6349, test_loss: 0.9971, test_f1: 0.6175
 epoch: 37, train_loss: 0.6249, test_loss: 0.9476, test_f1: 0.6356
 epoch: 38, train_loss: 0.6339, test_loss: 0.9855, test_f1: 0.6181
 epoch: 39, train_loss: 0.6086, test_loss: 1.0261, test_f1: 0.6187
 epoch: 40, train_loss: 0.5997, test_loss: 1.0369, test_f1: 0.5985
 epoch: 41, train_loss: 0.6040, test_loss: 1.0362, test_f1: 0.6001
 epoch: 42, train_loss: 0.5848, test_loss: 1.0064, test_f1: 0.6007
 epoch: 43, train_loss: 0.5692, test_loss: 0.9809, test_f1: 0.5918
 epoch: 44, train_loss: 0.5787, test_loss: 1.0719, test_f1: 0.6071
 epoch: 45, train_loss: 0.5803, test_loss: 1.0107, test_f1: 0.6118
 epoch: 46, train_loss: 0.5625, test_loss: 1.0116, test_f1: 0.6174
 epoch: 47, train_loss: 0.5795, test_loss: 1.0116, test_f1: 0.6272
 epoch: 48, train_loss: 0.5544, test_loss: 1.0065, test_f1: 0.6237
 epoch: 49, train_loss: 0.5440, test_loss: 0.9758, test_f1: 0.6442
 epoch: 50, train_loss: 0.5512, test_loss: 1.1042, test_f1: 0.5684
 epoch: 51, train_loss: 0.5169, test_loss: 1.0495, test_f1: 0.6182
 epoch: 52, train_loss: 0.5186, test_loss: 1.1018, test_f1: 0.5730
 epoch: 53, train_loss: 0.5146, test_loss: 1.0723, test_f1: 0.5715
 epoch: 54, train_loss: 0.5000, test_loss: 1.0287, test_f1: 0.6029
 epoch: 55, train_loss: 0.5130, test_loss: 1.0718, test_f1: 0.6111
 epoch: 56, train_loss: 0.5159, test_loss: 1.0111, test_f1: 0.6186
 epoch: 57, train_loss: 0.4983, test_loss: 1.0631, test_f1: 0.5809
 epoch: 58, train_loss: 0.4981, test_loss: 1.0727, test_f1: 0.6045
 epoch: 59, train_loss: 0.5004, test_loss: 1.0852, test_f1: 0.5971
 epoch: 60, train_loss: 0.4855, test_loss: 1.0941, test_f1: 0.6126
 epoch: 61, train_loss: 0.4741, test_loss: 1.1885, test_f1: 0.6205
 epoch: 62, train_loss: 0.4829, test_loss: 1.1626, test_f1: 0.5800
 epoch: 63, train_loss: 0.4792, test_loss: 1.1387, test_f1: 0.6266
 epoch: 64, train_loss: 0.4828, test_loss: 1.1189, test_f1: 0.6091
 epoch: 65, train_loss: 0.4830, test_loss: 1.1322, test_f1: 0.6155
 epoch: 66, train_loss: 0.4543, test_loss: 1.1495, test_f1: 0.6053
 epoch: 67, train_loss: 0.4755, test_loss: 1.1095, test_f1: 0.6208
 epoch: 68, train_loss: 0.4560, test_loss: 1.1371, test_f1: 0.6237
 epoch: 69, train_loss: 0.4572, test_loss: 1.1580, test_f1: 0.6151
 epoch: 70, train_loss: 0.4601, test_loss: 1.1213, test_f1: 0.6341
 epoch: 71, train_loss: 0.4495, test_loss: 1.1931, test_f1: 0.6098
 epoch: 72, train_loss: 0.4543, test_loss: 1.0912, test_f1: 0.6265
 epoch: 73, train_loss: 0.4477, test_loss: 1.1325, test_f1: 0.6212
 epoch: 74, train_loss: 0.4458, test_loss: 1.2060, test_f1: 0.5923
 epoch: 75, train_loss: 0.4370, test_loss: 1.2370, test_f1: 0.5593
 epoch: 76, train_loss: 0.4278, test_loss: 1.2436, test_f1: 0.5873
 epoch: 77, train_loss: 0.4379, test_loss: 1.2340, test_f1: 0.5987
 epoch: 78, train_loss: 0.4359, test_loss: 1.2290, test_f1: 0.5844
 epoch: 79, train_loss: 0.4160, test_loss: 1.1741, test_f1: 0.6415
 epoch: 80, train_loss: 0.4288, test_loss: 1.2567, test_f1: 0.5835
 epoch: 81, train_loss: 0.4261, test_loss: 1.2393, test_f1: 0.6219
 epoch: 82, train_loss: 0.4089, test_loss: 1.2164, test_f1: 0.6128
 epoch: 83, train_loss: 0.4159, test_loss: 1.3032, test_f1: 0.6013
 epoch: 84, train_loss: 0.4187, test_loss: 1.2555, test_f1: 0.6236
 epoch: 85, train_loss: 0.4268, test_loss: 1.2627, test_f1: 0.6195
 epoch: 86, train_loss: 0.4102, test_loss: 1.2430, test_f1: 0.6108
 epoch: 87, train_loss: 0.3936, test_loss: 1.2516, test_f1: 0.5917
 epoch: 88, train_loss: 0.4247, test_loss: 1.1996, test_f1: 0.6410
 epoch: 89, train_loss: 0.4215, test_loss: 1.2636, test_f1: 0.6214
 epoch: 90, train_loss: 0.4158, test_loss: 1.1589, test_f1: 0.6610
 epoch: 91, train_loss: 0.3902, test_loss: 1.2114, test_f1: 0.6238
 epoch: 92, train_loss: 0.3884, test_loss: 1.2155, test_f1: 0.6390
 epoch: 93, train_loss: 0.3830, test_loss: 1.2399, test_f1: 0.6195
 epoch: 94, train_loss: 0.3778, test_loss: 1.3081, test_f1: 0.6113
 epoch: 95, train_loss: 0.3827, test_loss: 1.2659, test_f1: 0.6335
 epoch: 96, train_loss: 0.3976, test_loss: 1.2962, test_f1: 0.6201
 epoch: 97, train_loss: 0.3854, test_loss: 1.3319, test_f1: 0.6162
 epoch: 98, train_loss: 0.3734, test_loss: 1.2406, test_f1: 0.6386
 epoch: 99, train_loss: 0.3810, test_loss: 1.4291, test_f1: 0.5536
##################ITERATION #1 ****************************************
 epoch: 0, train_loss: 1.2562, test_loss: 1.2930, test_f1: 0.2576
 epoch: 1, train_loss: 1.1785, test_loss: 1.2275, test_f1: 0.4033
 epoch: 2, train_loss: 1.1322, test_loss: 1.1860, test_f1: 0.4329
 epoch: 3, train_loss: 1.0721, test_loss: 1.1381, test_f1: 0.4268
 epoch: 4, train_loss: 1.0282, test_loss: 1.0978, test_f1: 0.4943
 epoch: 5, train_loss: 0.9865, test_loss: 1.0491, test_f1: 0.5269
 epoch: 6, train_loss: 0.9524, test_loss: 1.0345, test_f1: 0.5468
 epoch: 7, train_loss: 0.9197, test_loss: 1.0118, test_f1: 0.5458
 epoch: 8, train_loss: 0.9076, test_loss: 1.0100, test_f1: 0.5700
 epoch: 9, train_loss: 0.8761, test_loss: 0.9935, test_f1: 0.5952
 epoch: 10, train_loss: 0.8599, test_loss: 0.9864, test_f1: 0.6005
 epoch: 11, train_loss: 0.8431, test_loss: 0.9747, test_f1: 0.5970
 epoch: 12, train_loss: 0.8316, test_loss: 0.9798, test_f1: 0.5880
 epoch: 13, train_loss: 0.7992, test_loss: 0.9818, test_f1: 0.5853
 epoch: 14, train_loss: 0.7823, test_loss: 0.9852, test_f1: 0.5782
 epoch: 15, train_loss: 0.7772, test_loss: 0.9786, test_f1: 0.5774
 epoch: 16, train_loss: 0.7534, test_loss: 1.0028, test_f1: 0.5718
 epoch: 17, train_loss: 0.7426, test_loss: 1.0370, test_f1: 0.5714
 epoch: 18, train_loss: 0.7450, test_loss: 1.0006, test_f1: 0.5681
 epoch: 19, train_loss: 0.7225, test_loss: 1.0095, test_f1: 0.5777
 epoch: 20, train_loss: 0.7085, test_loss: 1.0060, test_f1: 0.5842
 epoch: 21, train_loss: 0.7103, test_loss: 0.9847, test_f1: 0.5953
 epoch: 22, train_loss: 0.6752, test_loss: 1.0013, test_f1: 0.5961
 epoch: 23, train_loss: 0.6795, test_loss: 1.0515, test_f1: 0.5800
 epoch: 24, train_loss: 0.6658, test_loss: 1.0400, test_f1: 0.5984
 epoch: 25, train_loss: 0.6637, test_loss: 1.0701, test_f1: 0.5664
 epoch: 26, train_loss: 0.6381, test_loss: 1.0185, test_f1: 0.6103
 epoch: 27, train_loss: 0.6503, test_loss: 1.0445, test_f1: 0.5751
 epoch: 28, train_loss: 0.6375, test_loss: 1.0397, test_f1: 0.5896
 epoch: 29, train_loss: 0.6146, test_loss: 1.0678, test_f1: 0.6147
 epoch: 30, train_loss: 0.6097, test_loss: 1.0038, test_f1: 0.6154
 epoch: 31, train_loss: 0.5953, test_loss: 1.0838, test_f1: 0.6109
 epoch: 32, train_loss: 0.5950, test_loss: 1.0774, test_f1: 0.5686
 epoch: 33, train_loss: 0.5865, test_loss: 1.0469, test_f1: 0.6061
 epoch: 34, train_loss: 0.5754, test_loss: 1.0493, test_f1: 0.5899
 epoch: 35, train_loss: 0.5874, test_loss: 1.0748, test_f1: 0.6192
 epoch: 36, train_loss: 0.5771, test_loss: 1.1111, test_f1: 0.5966
 epoch: 37, train_loss: 0.5646, test_loss: 1.1729, test_f1: 0.5955
 epoch: 38, train_loss: 0.5421, test_loss: 1.1079, test_f1: 0.5910
 epoch: 39, train_loss: 0.5494, test_loss: 1.0822, test_f1: 0.5904
 epoch: 40, train_loss: 0.5462, test_loss: 1.1546, test_f1: 0.5941
 epoch: 41, train_loss: 0.5210, test_loss: 1.1614, test_f1: 0.5818
 epoch: 42, train_loss: 0.5058, test_loss: 1.1702, test_f1: 0.5878
 epoch: 43, train_loss: 0.5022, test_loss: 1.1721, test_f1: 0.5907
 epoch: 44, train_loss: 0.5175, test_loss: 1.1562, test_f1: 0.6144
 epoch: 45, train_loss: 0.5071, test_loss: 1.2044, test_f1: 0.5981
 epoch: 46, train_loss: 0.5100, test_loss: 1.2056, test_f1: 0.6042
 epoch: 47, train_loss: 0.4786, test_loss: 1.2361, test_f1: 0.6106
 epoch: 48, train_loss: 0.4787, test_loss: 1.3027, test_f1: 0.6189
 epoch: 49, train_loss: 0.4767, test_loss: 1.2963, test_f1: 0.6216
 epoch: 50, train_loss: 0.4595, test_loss: 1.3578, test_f1: 0.6024
 epoch: 51, train_loss: 0.4502, test_loss: 1.3416, test_f1: 0.6035
 epoch: 52, train_loss: 0.4485, test_loss: 1.3378, test_f1: 0.6169
 epoch: 53, train_loss: 0.4352, test_loss: 1.3735, test_f1: 0.6039
 epoch: 54, train_loss: 0.4416, test_loss: 1.3453, test_f1: 0.6120
 epoch: 55, train_loss: 0.4457, test_loss: 1.3188, test_f1: 0.6032
 epoch: 56, train_loss: 0.4294, test_loss: 1.3840, test_f1: 0.6023
 epoch: 57, train_loss: 0.4443, test_loss: 1.3797, test_f1: 0.6036
 epoch: 58, train_loss: 0.4177, test_loss: 1.3557, test_f1: 0.5977
 epoch: 59, train_loss: 0.4079, test_loss: 1.3643, test_f1: 0.6026
 epoch: 60, train_loss: 0.4196, test_loss: 1.3230, test_f1: 0.6130
 epoch: 61, train_loss: 0.4051, test_loss: 1.3119, test_f1: 0.6102
 epoch: 62, train_loss: 0.3977, test_loss: 1.3953, test_f1: 0.5937
 epoch: 63, train_loss: 0.3926, test_loss: 1.3542, test_f1: 0.6163
 epoch: 64, train_loss: 0.4100, test_loss: 1.3907, test_f1: 0.6167
 epoch: 65, train_loss: 0.4061, test_loss: 1.4202, test_f1: 0.6005
 epoch: 66, train_loss: 0.3881, test_loss: 1.4501, test_f1: 0.5845
 epoch: 67, train_loss: 0.3838, test_loss: 1.4126, test_f1: 0.6009
 epoch: 68, train_loss: 0.3850, test_loss: 1.4367, test_f1: 0.6046
 epoch: 69, train_loss: 0.3930, test_loss: 1.4202, test_f1: 0.6214
 epoch: 70, train_loss: 0.3866, test_loss: 1.4881, test_f1: 0.5947
 epoch: 71, train_loss: 0.3805, test_loss: 1.5109, test_f1: 0.5962
 epoch: 72, train_loss: 0.3790, test_loss: 1.4876, test_f1: 0.6038
 epoch: 73, train_loss: 0.3737, test_loss: 1.5290, test_f1: 0.5980
 epoch: 74, train_loss: 0.3713, test_loss: 1.5793, test_f1: 0.5834
 epoch: 75, train_loss: 0.3617, test_loss: 1.5671, test_f1: 0.5906
 epoch: 76, train_loss: 0.3601, test_loss: 1.5796, test_f1: 0.6028
 epoch: 77, train_loss: 0.3608, test_loss: 1.5278, test_f1: 0.6289
 epoch: 78, train_loss: 0.3386, test_loss: 1.6408, test_f1: 0.5773
 epoch: 79, train_loss: 0.3424, test_loss: 1.5503, test_f1: 0.6001
 epoch: 80, train_loss: 0.3365, test_loss: 1.5674, test_f1: 0.6275
 epoch: 81, train_loss: 0.3430, test_loss: 1.5546, test_f1: 0.6075
 epoch: 82, train_loss: 0.3527, test_loss: 1.6250, test_f1: 0.5923
 epoch: 83, train_loss: 0.3580, test_loss: 1.5514, test_f1: 0.5953
 epoch: 84, train_loss: 0.3282, test_loss: 1.6225, test_f1: 0.5878
 epoch: 85, train_loss: 0.3316, test_loss: 1.6453, test_f1: 0.5968
 epoch: 86, train_loss: 0.3379, test_loss: 1.6843, test_f1: 0.5859
 epoch: 87, train_loss: 0.3293, test_loss: 1.6596, test_f1: 0.6081
 epoch: 88, train_loss: 0.3323, test_loss: 1.5688, test_f1: 0.6061
 epoch: 89, train_loss: 0.3405, test_loss: 1.6341, test_f1: 0.5976
 epoch: 90, train_loss: 0.3116, test_loss: 1.6629, test_f1: 0.6157
 epoch: 91, train_loss: 0.3139, test_loss: 1.6773, test_f1: 0.5950
 epoch: 92, train_loss: 0.3069, test_loss: 1.6771, test_f1: 0.6136
 epoch: 93, train_loss: 0.3127, test_loss: 1.6114, test_f1: 0.6168
 epoch: 94, train_loss: 0.3029, test_loss: 1.7379, test_f1: 0.6089
 epoch: 95, train_loss: 0.2993, test_loss: 1.7384, test_f1: 0.6073
 epoch: 96, train_loss: 0.3111, test_loss: 1.7321, test_f1: 0.6100
 epoch: 97, train_loss: 0.3026, test_loss: 1.7187, test_f1: 0.6184
 epoch: 98, train_loss: 0.3215, test_loss: 1.6557, test_f1: 0.6132
 epoch: 99, train_loss: 0.3080, test_loss: 1.6974, test_f1: 0.6071
##################ITERATION #2 ****************************************
 epoch: 0, train_loss: 1.2200, test_loss: 1.2571, test_f1: 0.3627
 epoch: 1, train_loss: 1.1233, test_loss: 1.1710, test_f1: 0.4449
 epoch: 2, train_loss: 1.0778, test_loss: 1.1353, test_f1: 0.4386
 epoch: 3, train_loss: 1.0342, test_loss: 1.0967, test_f1: 0.5164
 epoch: 4, train_loss: 0.9968, test_loss: 1.0591, test_f1: 0.5178
 epoch: 5, train_loss: 0.9639, test_loss: 1.0313, test_f1: 0.5438
 epoch: 6, train_loss: 0.9284, test_loss: 0.9987, test_f1: 0.5588
 epoch: 7, train_loss: 0.9145, test_loss: 0.9803, test_f1: 0.5736
 epoch: 8, train_loss: 0.8828, test_loss: 0.9729, test_f1: 0.5814
 epoch: 9, train_loss: 0.8653, test_loss: 0.9534, test_f1: 0.5850
 epoch: 10, train_loss: 0.8392, test_loss: 0.9535, test_f1: 0.6146
 epoch: 11, train_loss: 0.8234, test_loss: 0.9439, test_f1: 0.6068
 epoch: 12, train_loss: 0.8049, test_loss: 0.9389, test_f1: 0.6202
 epoch: 13, train_loss: 0.7963, test_loss: 0.9403, test_f1: 0.6277
 epoch: 14, train_loss: 0.7772, test_loss: 0.9366, test_f1: 0.6402
 epoch: 15, train_loss: 0.7435, test_loss: 0.9652, test_f1: 0.6266
 epoch: 16, train_loss: 0.7457, test_loss: 0.9400, test_f1: 0.6584
 epoch: 17, train_loss: 0.7255, test_loss: 0.9650, test_f1: 0.5980
 epoch: 18, train_loss: 0.7135, test_loss: 0.9886, test_f1: 0.6061
 epoch: 19, train_loss: 0.7076, test_loss: 1.0132, test_f1: 0.5816
 epoch: 20, train_loss: 0.6901, test_loss: 1.0231, test_f1: 0.6183
 epoch: 21, train_loss: 0.6998, test_loss: 0.9957, test_f1: 0.6029
 epoch: 22, train_loss: 0.6726, test_loss: 1.0533, test_f1: 0.6276
 epoch: 23, train_loss: 0.6668, test_loss: 1.0043, test_f1: 0.6380
 epoch: 24, train_loss: 0.6534, test_loss: 1.0185, test_f1: 0.6428
 epoch: 25, train_loss: 0.6501, test_loss: 1.0404, test_f1: 0.6241
 epoch: 26, train_loss: 0.6454, test_loss: 1.0628, test_f1: 0.5996
 epoch: 27, train_loss: 0.6210, test_loss: 1.1181, test_f1: 0.6049
 epoch: 28, train_loss: 0.6262, test_loss: 1.0699, test_f1: 0.6238
 epoch: 29, train_loss: 0.6252, test_loss: 1.0793, test_f1: 0.6204
 epoch: 30, train_loss: 0.5999, test_loss: 1.0785, test_f1: 0.5924
 epoch: 31, train_loss: 0.5931, test_loss: 1.0919, test_f1: 0.6437
 epoch: 32, train_loss: 0.5915, test_loss: 1.1155, test_f1: 0.5844
 epoch: 33, train_loss: 0.5706, test_loss: 1.0813, test_f1: 0.6125
 epoch: 34, train_loss: 0.5737, test_loss: 1.1351, test_f1: 0.6150
 epoch: 35, train_loss: 0.5665, test_loss: 1.1744, test_f1: 0.6039
 epoch: 36, train_loss: 0.5632, test_loss: 1.1399, test_f1: 0.6167
 epoch: 37, train_loss: 0.5580, test_loss: 1.2140, test_f1: 0.5857
 epoch: 38, train_loss: 0.5372, test_loss: 1.2140, test_f1: 0.5846
 epoch: 39, train_loss: 0.5253, test_loss: 1.2202, test_f1: 0.5622
 epoch: 40, train_loss: 0.5517, test_loss: 1.1825, test_f1: 0.6344
 epoch: 41, train_loss: 0.5243, test_loss: 1.2815, test_f1: 0.5838
 epoch: 42, train_loss: 0.5190, test_loss: 1.1628, test_f1: 0.6020
 epoch: 43, train_loss: 0.5075, test_loss: 1.3018, test_f1: 0.6001
 epoch: 44, train_loss: 0.5134, test_loss: 1.3360, test_f1: 0.5929
 epoch: 45, train_loss: 0.5059, test_loss: 1.2775, test_f1: 0.6017
 epoch: 46, train_loss: 0.4978, test_loss: 1.2382, test_f1: 0.6045
 epoch: 47, train_loss: 0.4724, test_loss: 1.3165, test_f1: 0.6088
 epoch: 48, train_loss: 0.4798, test_loss: 1.2660, test_f1: 0.6006
 epoch: 49, train_loss: 0.4816, test_loss: 1.2694, test_f1: 0.5953
 epoch: 50, train_loss: 0.4733, test_loss: 1.1952, test_f1: 0.6172
 epoch: 51, train_loss: 0.4608, test_loss: 1.2368, test_f1: 0.6133
 epoch: 52, train_loss: 0.4322, test_loss: 1.3449, test_f1: 0.5913
 epoch: 53, train_loss: 0.4331, test_loss: 1.2851, test_f1: 0.6157
 epoch: 54, train_loss: 0.4360, test_loss: 1.3195, test_f1: 0.6002
 epoch: 55, train_loss: 0.4344, test_loss: 1.3979, test_f1: 0.6065
 epoch: 56, train_loss: 0.4321, test_loss: 1.2902, test_f1: 0.6123
 epoch: 57, train_loss: 0.4133, test_loss: 1.2745, test_f1: 0.6091
 epoch: 58, train_loss: 0.4031, test_loss: 1.3408, test_f1: 0.6138
 epoch: 59, train_loss: 0.4220, test_loss: 1.4430, test_f1: 0.6050
 epoch: 60, train_loss: 0.4022, test_loss: 1.3526, test_f1: 0.6138
 epoch: 61, train_loss: 0.4065, test_loss: 1.4597, test_f1: 0.6053
 epoch: 62, train_loss: 0.4001, test_loss: 1.4066, test_f1: 0.6093
 epoch: 63, train_loss: 0.3929, test_loss: 1.4118, test_f1: 0.6126
 epoch: 64, train_loss: 0.4036, test_loss: 1.4158, test_f1: 0.6065
 epoch: 65, train_loss: 0.3897, test_loss: 1.3955, test_f1: 0.5949
 epoch: 66, train_loss: 0.3819, test_loss: 1.3753, test_f1: 0.5992
 epoch: 67, train_loss: 0.3853, test_loss: 1.4370, test_f1: 0.5985
 epoch: 68, train_loss: 0.3862, test_loss: 1.4720, test_f1: 0.6033
 epoch: 69, train_loss: 0.3761, test_loss: 1.4419, test_f1: 0.6042
 epoch: 70, train_loss: 0.3917, test_loss: 1.4595, test_f1: 0.6004
 epoch: 71, train_loss: 0.3782, test_loss: 1.4601, test_f1: 0.5908
 epoch: 72, train_loss: 0.3557, test_loss: 1.5466, test_f1: 0.5906
 epoch: 73, train_loss: 0.3710, test_loss: 1.4740, test_f1: 0.6070
 epoch: 74, train_loss: 0.3532, test_loss: 1.4563, test_f1: 0.6235
 epoch: 75, train_loss: 0.3519, test_loss: 1.4770, test_f1: 0.6071
 epoch: 76, train_loss: 0.3430, test_loss: 1.4169, test_f1: 0.6215
 epoch: 77, train_loss: 0.3438, test_loss: 1.5067, test_f1: 0.6187
 epoch: 78, train_loss: 0.3573, test_loss: 1.4985, test_f1: 0.6191
 epoch: 79, train_loss: 0.3597, test_loss: 1.5144, test_f1: 0.6188
 epoch: 80, train_loss: 0.3528, test_loss: 1.5821, test_f1: 0.6059
 epoch: 81, train_loss: 0.3343, test_loss: 1.5719, test_f1: 0.6117
 epoch: 82, train_loss: 0.3462, test_loss: 1.5325, test_f1: 0.6242
 epoch: 83, train_loss: 0.3461, test_loss: 1.6573, test_f1: 0.6057
 epoch: 84, train_loss: 0.3378, test_loss: 1.5765, test_f1: 0.5953
 epoch: 85, train_loss: 0.3491, test_loss: 1.5864, test_f1: 0.6156
 epoch: 86, train_loss: 0.3336, test_loss: 1.7420, test_f1: 0.6083
 epoch: 87, train_loss: 0.3310, test_loss: 1.5924, test_f1: 0.6141
 epoch: 88, train_loss: 0.3242, test_loss: 1.5426, test_f1: 0.6250
 epoch: 89, train_loss: 0.2980, test_loss: 1.5825, test_f1: 0.6210
 epoch: 90, train_loss: 0.3076, test_loss: 1.6850, test_f1: 0.5929
 epoch: 91, train_loss: 0.3152, test_loss: 1.5859, test_f1: 0.6102
 epoch: 92, train_loss: 0.3394, test_loss: 1.7235, test_f1: 0.6110
 epoch: 93, train_loss: 0.3168, test_loss: 1.6338, test_f1: 0.6024
 epoch: 94, train_loss: 0.2926, test_loss: 1.6368, test_f1: 0.6088
 epoch: 95, train_loss: 0.2992, test_loss: 1.7839, test_f1: 0.5956
 epoch: 96, train_loss: 0.3097, test_loss: 1.6751, test_f1: 0.6008
 epoch: 97, train_loss: 0.3032, test_loss: 1.7086, test_f1: 0.6159
 epoch: 98, train_loss: 0.2941, test_loss: 1.7275, test_f1: 0.6011
 epoch: 99, train_loss: 0.3031, test_loss: 1.7490, test_f1: 0.6093
##################ITERATION #3 ****************************************
 epoch: 0, train_loss: 1.2057, test_loss: 1.2391, test_f1: 0.3203
 epoch: 1, train_loss: 1.0944, test_loss: 1.1193, test_f1: 0.4832
 epoch: 2, train_loss: 1.0404, test_loss: 1.0874, test_f1: 0.5110
 epoch: 3, train_loss: 0.9959, test_loss: 1.0451, test_f1: 0.5470
 epoch: 4, train_loss: 0.9536, test_loss: 1.0163, test_f1: 0.5533
 epoch: 5, train_loss: 0.9092, test_loss: 0.9949, test_f1: 0.5954
 epoch: 6, train_loss: 0.8808, test_loss: 0.9815, test_f1: 0.5900
 epoch: 7, train_loss: 0.8456, test_loss: 0.9798, test_f1: 0.6092
 epoch: 8, train_loss: 0.8344, test_loss: 0.9349, test_f1: 0.6122
 epoch: 9, train_loss: 0.8010, test_loss: 0.9632, test_f1: 0.5957
 epoch: 10, train_loss: 0.7858, test_loss: 0.9852, test_f1: 0.5868
 epoch: 11, train_loss: 0.7754, test_loss: 0.9654, test_f1: 0.5887
 epoch: 12, train_loss: 0.7499, test_loss: 0.9612, test_f1: 0.6210
 epoch: 13, train_loss: 0.7457, test_loss: 0.9404, test_f1: 0.6273
 epoch: 14, train_loss: 0.7204, test_loss: 0.9498, test_f1: 0.6224
 epoch: 15, train_loss: 0.7118, test_loss: 0.9693, test_f1: 0.5973
 epoch: 16, train_loss: 0.7238, test_loss: 0.9501, test_f1: 0.6087
 epoch: 17, train_loss: 0.6897, test_loss: 0.9927, test_f1: 0.5731
 epoch: 18, train_loss: 0.6758, test_loss: 0.9911, test_f1: 0.5946
 epoch: 19, train_loss: 0.6776, test_loss: 1.0592, test_f1: 0.5648
 epoch: 20, train_loss: 0.6737, test_loss: 0.9662, test_f1: 0.6259
 epoch: 21, train_loss: 0.6706, test_loss: 0.9481, test_f1: 0.6125
 epoch: 22, train_loss: 0.6533, test_loss: 0.9829, test_f1: 0.6390
 epoch: 23, train_loss: 0.6547, test_loss: 0.9899, test_f1: 0.6039
 epoch: 24, train_loss: 0.6366, test_loss: 0.9808, test_f1: 0.6220
 epoch: 25, train_loss: 0.6232, test_loss: 0.9639, test_f1: 0.5958
 epoch: 26, train_loss: 0.6242, test_loss: 1.0086, test_f1: 0.5912
 epoch: 27, train_loss: 0.6096, test_loss: 1.0306, test_f1: 0.5866
 epoch: 28, train_loss: 0.5930, test_loss: 1.0229, test_f1: 0.6167
 epoch: 29, train_loss: 0.5919, test_loss: 0.9994, test_f1: 0.6183
 epoch: 30, train_loss: 0.5810, test_loss: 1.0968, test_f1: 0.6000
 epoch: 31, train_loss: 0.5868, test_loss: 1.0677, test_f1: 0.5834
 epoch: 32, train_loss: 0.5556, test_loss: 1.0773, test_f1: 0.5754
 epoch: 33, train_loss: 0.5670, test_loss: 1.0250, test_f1: 0.5812
 epoch: 34, train_loss: 0.5533, test_loss: 1.0591, test_f1: 0.5974
 epoch: 35, train_loss: 0.5530, test_loss: 1.0642, test_f1: 0.5853
 epoch: 36, train_loss: 0.5584, test_loss: 1.1052, test_f1: 0.5942
 epoch: 37, train_loss: 0.5457, test_loss: 1.0762, test_f1: 0.6244
 epoch: 38, train_loss: 0.5400, test_loss: 1.1065, test_f1: 0.5720
 epoch: 39, train_loss: 0.5530, test_loss: 1.1123, test_f1: 0.5994
 epoch: 40, train_loss: 0.5088, test_loss: 1.1218, test_f1: 0.6065
 epoch: 41, train_loss: 0.5186, test_loss: 1.1128, test_f1: 0.5940
 epoch: 42, train_loss: 0.4992, test_loss: 1.0987, test_f1: 0.6074
 epoch: 43, train_loss: 0.5075, test_loss: 1.0859, test_f1: 0.5930
 epoch: 44, train_loss: 0.4987, test_loss: 1.1710, test_f1: 0.6088
 epoch: 45, train_loss: 0.4738, test_loss: 1.1839, test_f1: 0.5982
 epoch: 46, train_loss: 0.4772, test_loss: 1.1898, test_f1: 0.5762
 epoch: 47, train_loss: 0.4739, test_loss: 1.2166, test_f1: 0.5824
 epoch: 48, train_loss: 0.4677, test_loss: 1.1858, test_f1: 0.5764
 epoch: 49, train_loss: 0.4730, test_loss: 1.2298, test_f1: 0.5753
 epoch: 50, train_loss: 0.4542, test_loss: 1.4255, test_f1: 0.5800
 epoch: 51, train_loss: 0.4436, test_loss: 1.3280, test_f1: 0.5915
 epoch: 52, train_loss: 0.4425, test_loss: 1.3287, test_f1: 0.6139
 epoch: 53, train_loss: 0.4374, test_loss: 1.2352, test_f1: 0.5916
 epoch: 54, train_loss: 0.4245, test_loss: 1.2733, test_f1: 0.6139
 epoch: 55, train_loss: 0.4189, test_loss: 1.1833, test_f1: 0.6107
 epoch: 56, train_loss: 0.4171, test_loss: 1.2763, test_f1: 0.5922
 epoch: 57, train_loss: 0.4110, test_loss: 1.2949, test_f1: 0.6078
 epoch: 58, train_loss: 0.4103, test_loss: 1.2639, test_f1: 0.6014
 epoch: 59, train_loss: 0.4102, test_loss: 1.2727, test_f1: 0.5874
 epoch: 60, train_loss: 0.4109, test_loss: 1.3936, test_f1: 0.6165
 epoch: 61, train_loss: 0.3903, test_loss: 1.3615, test_f1: 0.6293
 epoch: 62, train_loss: 0.3974, test_loss: 1.3201, test_f1: 0.6091
 epoch: 63, train_loss: 0.4137, test_loss: 1.3706, test_f1: 0.6144
 epoch: 64, train_loss: 0.3872, test_loss: 1.3398, test_f1: 0.6047
 epoch: 65, train_loss: 0.3979, test_loss: 1.3720, test_f1: 0.6216
 epoch: 66, train_loss: 0.3834, test_loss: 1.4579, test_f1: 0.6110
 epoch: 67, train_loss: 0.3687, test_loss: 1.4226, test_f1: 0.5963
 epoch: 68, train_loss: 0.3607, test_loss: 1.3755, test_f1: 0.5950
 epoch: 69, train_loss: 0.3623, test_loss: 1.3897, test_f1: 0.6167
 epoch: 70, train_loss: 0.3710, test_loss: 1.5034, test_f1: 0.6184
 epoch: 71, train_loss: 0.3756, test_loss: 1.3814, test_f1: 0.6085
 epoch: 72, train_loss: 0.3547, test_loss: 1.3941, test_f1: 0.6086
 epoch: 73, train_loss: 0.3714, test_loss: 1.3888, test_f1: 0.6162
 epoch: 74, train_loss: 0.3724, test_loss: 1.5369, test_f1: 0.5900
 epoch: 75, train_loss: 0.3490, test_loss: 1.4839, test_f1: 0.6234
 epoch: 76, train_loss: 0.3597, test_loss: 1.5489, test_f1: 0.6044
 epoch: 77, train_loss: 0.3616, test_loss: 1.4159, test_f1: 0.6166
 epoch: 78, train_loss: 0.3458, test_loss: 1.3989, test_f1: 0.6165
 epoch: 79, train_loss: 0.3532, test_loss: 1.5804, test_f1: 0.6280
 epoch: 80, train_loss: 0.3559, test_loss: 1.5593, test_f1: 0.6165
 epoch: 81, train_loss: 0.3317, test_loss: 1.5407, test_f1: 0.6237
 epoch: 82, train_loss: 0.3194, test_loss: 1.6011, test_f1: 0.6236
 epoch: 83, train_loss: 0.3469, test_loss: 1.6164, test_f1: 0.6248
 epoch: 84, train_loss: 0.3305, test_loss: 1.5402, test_f1: 0.6239
 epoch: 85, train_loss: 0.3114, test_loss: 1.5659, test_f1: 0.6129
 epoch: 86, train_loss: 0.3215, test_loss: 1.5944, test_f1: 0.5924
 epoch: 87, train_loss: 0.3350, test_loss: 1.5879, test_f1: 0.6057
 epoch: 88, train_loss: 0.3288, test_loss: 1.6417, test_f1: 0.6228
 epoch: 89, train_loss: 0.3230, test_loss: 1.7415, test_f1: 0.6055
 epoch: 90, train_loss: 0.3204, test_loss: 1.6451, test_f1: 0.6101
 epoch: 91, train_loss: 0.3046, test_loss: 1.7299, test_f1: 0.6116
 epoch: 92, train_loss: 0.3301, test_loss: 1.7825, test_f1: 0.5980
 epoch: 93, train_loss: 0.3106, test_loss: 1.7613, test_f1: 0.6227
 epoch: 94, train_loss: 0.3133, test_loss: 1.6662, test_f1: 0.6257
 epoch: 95, train_loss: 0.3029, test_loss: 1.7259, test_f1: 0.5992
 epoch: 96, train_loss: 0.3026, test_loss: 1.7254, test_f1: 0.6266
 epoch: 97, train_loss: 0.3077, test_loss: 1.8299, test_f1: 0.6014
 epoch: 98, train_loss: 0.2952, test_loss: 1.8304, test_f1: 0.5946
 epoch: 99, train_loss: 0.2774, test_loss: 1.6928, test_f1: 0.6123
##################ITERATION #4 ****************************************
 epoch: 0, train_loss: 1.1914, test_loss: 1.2065, test_f1: 0.3673
 epoch: 1, train_loss: 1.0782, test_loss: 1.1012, test_f1: 0.5031
 epoch: 2, train_loss: 1.0043, test_loss: 1.0621, test_f1: 0.5062
 epoch: 3, train_loss: 0.9785, test_loss: 1.0361, test_f1: 0.5321
 epoch: 4, train_loss: 0.9424, test_loss: 0.9949, test_f1: 0.5687
 epoch: 5, train_loss: 0.9186, test_loss: 1.0102, test_f1: 0.5248
 epoch: 6, train_loss: 0.8936, test_loss: 0.9769, test_f1: 0.5798
 epoch: 7, train_loss: 0.8783, test_loss: 0.9514, test_f1: 0.5479
 epoch: 8, train_loss: 0.8439, test_loss: 0.9683, test_f1: 0.5498
 epoch: 9, train_loss: 0.8180, test_loss: 0.9736, test_f1: 0.5503
 epoch: 10, train_loss: 0.8133, test_loss: 0.9499, test_f1: 0.5688
 epoch: 11, train_loss: 0.7939, test_loss: 0.9837, test_f1: 0.5485
 epoch: 12, train_loss: 0.7796, test_loss: 0.9685, test_f1: 0.5515
 epoch: 13, train_loss: 0.7589, test_loss: 0.9847, test_f1: 0.5543
 epoch: 14, train_loss: 0.7472, test_loss: 1.0226, test_f1: 0.5418
 epoch: 15, train_loss: 0.7436, test_loss: 0.9573, test_f1: 0.5686
 epoch: 16, train_loss: 0.7257, test_loss: 0.9552, test_f1: 0.5884
 epoch: 17, train_loss: 0.6975, test_loss: 1.0310, test_f1: 0.5926
 epoch: 18, train_loss: 0.7061, test_loss: 1.0125, test_f1: 0.5893
 epoch: 19, train_loss: 0.6940, test_loss: 1.0474, test_f1: 0.5465
 epoch: 20, train_loss: 0.6769, test_loss: 1.0592, test_f1: 0.6132
 epoch: 21, train_loss: 0.6638, test_loss: 1.0606, test_f1: 0.5690
 epoch: 22, train_loss: 0.6554, test_loss: 1.0772, test_f1: 0.6020
 epoch: 23, train_loss: 0.6507, test_loss: 1.0222, test_f1: 0.5581
 epoch: 24, train_loss: 0.6351, test_loss: 1.0837, test_f1: 0.5931
 epoch: 25, train_loss: 0.6256, test_loss: 1.1717, test_f1: 0.5484
 epoch: 26, train_loss: 0.6243, test_loss: 1.0549, test_f1: 0.5792
 epoch: 27, train_loss: 0.6031, test_loss: 1.1555, test_f1: 0.5781
 epoch: 28, train_loss: 0.6064, test_loss: 1.1752, test_f1: 0.5963
 epoch: 29, train_loss: 0.5918, test_loss: 1.1220, test_f1: 0.5833
 epoch: 30, train_loss: 0.5788, test_loss: 1.1678, test_f1: 0.5638
 epoch: 31, train_loss: 0.5874, test_loss: 1.1520, test_f1: 0.5613
 epoch: 32, train_loss: 0.5606, test_loss: 1.2146, test_f1: 0.5849
 epoch: 33, train_loss: 0.5495, test_loss: 1.1772, test_f1: 0.5980
 epoch: 34, train_loss: 0.5499, test_loss: 1.1760, test_f1: 0.5823
 epoch: 35, train_loss: 0.5431, test_loss: 1.3380, test_f1: 0.5786
 epoch: 36, train_loss: 0.5448, test_loss: 1.2289, test_f1: 0.5811
 epoch: 37, train_loss: 0.5461, test_loss: 1.3278, test_f1: 0.6036
 epoch: 38, train_loss: 0.5380, test_loss: 1.2941, test_f1: 0.5907
 epoch: 39, train_loss: 0.5320, test_loss: 1.3400, test_f1: 0.5829
 epoch: 40, train_loss: 0.5235, test_loss: 1.2604, test_f1: 0.6010
 epoch: 41, train_loss: 0.5241, test_loss: 1.3440, test_f1: 0.5980
 epoch: 42, train_loss: 0.4825, test_loss: 1.3523, test_f1: 0.6119
 epoch: 43, train_loss: 0.4929, test_loss: 1.3131, test_f1: 0.6107
 epoch: 44, train_loss: 0.4673, test_loss: 1.3252, test_f1: 0.5887
 epoch: 45, train_loss: 0.4913, test_loss: 1.4004, test_f1: 0.5813
 epoch: 46, train_loss: 0.4853, test_loss: 1.3572, test_f1: 0.5945
 epoch: 47, train_loss: 0.4695, test_loss: 1.3918, test_f1: 0.6092
 epoch: 48, train_loss: 0.4684, test_loss: 1.4618, test_f1: 0.5890
 epoch: 49, train_loss: 0.4320, test_loss: 1.4024, test_f1: 0.5936
 epoch: 50, train_loss: 0.4622, test_loss: 1.4178, test_f1: 0.6065
 epoch: 51, train_loss: 0.4295, test_loss: 1.3972, test_f1: 0.6117
 epoch: 52, train_loss: 0.4153, test_loss: 1.4951, test_f1: 0.5871
 epoch: 53, train_loss: 0.4066, test_loss: 1.5040, test_f1: 0.5930
 epoch: 54, train_loss: 0.4061, test_loss: 1.5251, test_f1: 0.5911
 epoch: 55, train_loss: 0.4027, test_loss: 1.5206, test_f1: 0.5876
 epoch: 56, train_loss: 0.3958, test_loss: 1.5653, test_f1: 0.5987
 epoch: 57, train_loss: 0.3972, test_loss: 1.5338, test_f1: 0.5758
 epoch: 58, train_loss: 0.4275, test_loss: 1.5577, test_f1: 0.6065
 epoch: 59, train_loss: 0.3887, test_loss: 1.5809, test_f1: 0.6112
 epoch: 60, train_loss: 0.3761, test_loss: 1.5906, test_f1: 0.6061
 epoch: 61, train_loss: 0.3654, test_loss: 1.6408, test_f1: 0.5984
 epoch: 62, train_loss: 0.3686, test_loss: 1.5779, test_f1: 0.5828
 epoch: 63, train_loss: 0.3748, test_loss: 1.6177, test_f1: 0.5840
 epoch: 64, train_loss: 0.3852, test_loss: 1.6418, test_f1: 0.6058
 epoch: 65, train_loss: 0.3656, test_loss: 1.5564, test_f1: 0.6010
 epoch: 66, train_loss: 0.3798, test_loss: 1.5918, test_f1: 0.6049
 epoch: 67, train_loss: 0.3487, test_loss: 1.6326, test_f1: 0.5984
 epoch: 68, train_loss: 0.3664, test_loss: 1.6465, test_f1: 0.5907
 epoch: 69, train_loss: 0.3467, test_loss: 1.6491, test_f1: 0.5932
 epoch: 70, train_loss: 0.3467, test_loss: 1.7138, test_f1: 0.5904
 epoch: 71, train_loss: 0.3490, test_loss: 1.7175, test_f1: 0.5900
 epoch: 72, train_loss: 0.3608, test_loss: 1.6779, test_f1: 0.5890
 epoch: 73, train_loss: 0.3375, test_loss: 1.7150, test_f1: 0.5847
 epoch: 74, train_loss: 0.3383, test_loss: 1.7196, test_f1: 0.5885
 epoch: 75, train_loss: 0.3481, test_loss: 1.7347, test_f1: 0.6003
 epoch: 76, train_loss: 0.3357, test_loss: 1.7380, test_f1: 0.5909
 epoch: 77, train_loss: 0.3280, test_loss: 1.8017, test_f1: 0.5856
 epoch: 78, train_loss: 0.3186, test_loss: 1.7716, test_f1: 0.5655
 epoch: 79, train_loss: 0.3182, test_loss: 1.8877, test_f1: 0.5609
 epoch: 80, train_loss: 0.3121, test_loss: 1.7870, test_f1: 0.5734
 epoch: 81, train_loss: 0.3270, test_loss: 1.8126, test_f1: 0.5917
 epoch: 82, train_loss: 0.3273, test_loss: 1.8046, test_f1: 0.5731
 epoch: 83, train_loss: 0.3248, test_loss: 1.7827, test_f1: 0.5980
 epoch: 84, train_loss: 0.3118, test_loss: 1.8402, test_f1: 0.6046
 epoch: 85, train_loss: 0.3034, test_loss: 1.8448, test_f1: 0.5990
 epoch: 86, train_loss: 0.3064, test_loss: 1.8863, test_f1: 0.6003
 epoch: 87, train_loss: 0.2984, test_loss: 1.8220, test_f1: 0.5873
 epoch: 88, train_loss: 0.2932, test_loss: 1.8395, test_f1: 0.5923
 epoch: 89, train_loss: 0.2866, test_loss: 1.8561, test_f1: 0.5854
 epoch: 90, train_loss: 0.2880, test_loss: 1.7888, test_f1: 0.5999
 epoch: 91, train_loss: 0.2930, test_loss: 1.9700, test_f1: 0.5755
 epoch: 92, train_loss: 0.2896, test_loss: 1.9140, test_f1: 0.6112
 epoch: 93, train_loss: 0.2806, test_loss: 1.9345, test_f1: 0.5902
 epoch: 94, train_loss: 0.2941, test_loss: 1.9617, test_f1: 0.5917
 epoch: 95, train_loss: 0.2767, test_loss: 2.0131, test_f1: 0.5855
 epoch: 96, train_loss: 0.2763, test_loss: 1.9682, test_f1: 0.5904
 epoch: 97, train_loss: 0.2810, test_loss: 1.9101, test_f1: 0.5771
 epoch: 98, train_loss: 0.2617, test_loss: 1.9889, test_f1: 0.5869
 epoch: 99, train_loss: 0.2579, test_loss: 1.9574, test_f1: 0.5898
##################ITERATION #5 ****************************************
 epoch: 0, train_loss: 1.1860, test_loss: 1.2502, test_f1: 0.2615
 epoch: 1, train_loss: 1.0656, test_loss: 1.0973, test_f1: 0.4986
 epoch: 2, train_loss: 1.0116, test_loss: 1.0757, test_f1: 0.5124
 epoch: 3, train_loss: 0.9926, test_loss: 1.0417, test_f1: 0.5513
 epoch: 4, train_loss: 0.9391, test_loss: 1.0240, test_f1: 0.5576
 epoch: 5, train_loss: 0.9164, test_loss: 1.0235, test_f1: 0.5815
 epoch: 6, train_loss: 0.8887, test_loss: 1.0102, test_f1: 0.5814
 epoch: 7, train_loss: 0.8607, test_loss: 1.0134, test_f1: 0.5947
 epoch: 8, train_loss: 0.8435, test_loss: 1.0006, test_f1: 0.5962
 epoch: 9, train_loss: 0.8208, test_loss: 1.0516, test_f1: 0.5537
 epoch: 10, train_loss: 0.8268, test_loss: 0.9776, test_f1: 0.6359
 epoch: 11, train_loss: 0.7948, test_loss: 0.9974, test_f1: 0.5785
 epoch: 12, train_loss: 0.7941, test_loss: 1.0202, test_f1: 0.5979
 epoch: 13, train_loss: 0.7589, test_loss: 0.9941, test_f1: 0.6446
 epoch: 14, train_loss: 0.7581, test_loss: 0.9880, test_f1: 0.6191
 epoch: 15, train_loss: 0.7439, test_loss: 1.0510, test_f1: 0.5748
 epoch: 16, train_loss: 0.7303, test_loss: 0.9859, test_f1: 0.6370
 epoch: 17, train_loss: 0.7194, test_loss: 1.0128, test_f1: 0.6512
 epoch: 18, train_loss: 0.7194, test_loss: 0.9913, test_f1: 0.6326
 epoch: 19, train_loss: 0.7063, test_loss: 1.0069, test_f1: 0.6160
 epoch: 20, train_loss: 0.6952, test_loss: 1.0459, test_f1: 0.6351
 epoch: 21, train_loss: 0.6827, test_loss: 1.0708, test_f1: 0.5986
 epoch: 22, train_loss: 0.6781, test_loss: 1.0279, test_f1: 0.6227
 epoch: 23, train_loss: 0.6758, test_loss: 1.0719, test_f1: 0.5595
 epoch: 24, train_loss: 0.6592, test_loss: 1.0350, test_f1: 0.6115
 epoch: 25, train_loss: 0.6613, test_loss: 1.1137, test_f1: 0.5572
 epoch: 26, train_loss: 0.6499, test_loss: 1.0410, test_f1: 0.5990
 epoch: 27, train_loss: 0.6377, test_loss: 1.0670, test_f1: 0.6259
 epoch: 28, train_loss: 0.6290, test_loss: 1.1624, test_f1: 0.6038
 epoch: 29, train_loss: 0.6113, test_loss: 1.0599, test_f1: 0.6251
 epoch: 30, train_loss: 0.6215, test_loss: 1.0755, test_f1: 0.6254
 epoch: 31, train_loss: 0.6014, test_loss: 1.1075, test_f1: 0.5631
 epoch: 32, train_loss: 0.5912, test_loss: 1.0560, test_f1: 0.6465
 epoch: 33, train_loss: 0.6057, test_loss: 1.0998, test_f1: 0.5835
 epoch: 34, train_loss: 0.5896, test_loss: 1.1192, test_f1: 0.5924
 epoch: 35, train_loss: 0.5603, test_loss: 1.1024, test_f1: 0.5976
 epoch: 36, train_loss: 0.5897, test_loss: 1.1487, test_f1: 0.5980
 epoch: 37, train_loss: 0.5600, test_loss: 1.1381, test_f1: 0.5858
 epoch: 38, train_loss: 0.5628, test_loss: 1.1653, test_f1: 0.5616
 epoch: 39, train_loss: 0.5655, test_loss: 1.1193, test_f1: 0.6560
 epoch: 40, train_loss: 0.5371, test_loss: 1.2717, test_f1: 0.5729
 epoch: 41, train_loss: 0.5601, test_loss: 1.2157, test_f1: 0.5791
 epoch: 42, train_loss: 0.5356, test_loss: 1.2130, test_f1: 0.6381
 epoch: 43, train_loss: 0.5374, test_loss: 1.2660, test_f1: 0.6112
 epoch: 44, train_loss: 0.5252, test_loss: 1.2361, test_f1: 0.6356
 epoch: 45, train_loss: 0.5205, test_loss: 1.2264, test_f1: 0.6181
 epoch: 46, train_loss: 0.5186, test_loss: 1.2696, test_f1: 0.5735
 epoch: 47, train_loss: 0.4932, test_loss: 1.3008, test_f1: 0.5971
 epoch: 48, train_loss: 0.4952, test_loss: 1.2729, test_f1: 0.5996
 epoch: 49, train_loss: 0.5016, test_loss: 1.1729, test_f1: 0.6412
 epoch: 50, train_loss: 0.4982, test_loss: 1.3115, test_f1: 0.5921
 epoch: 51, train_loss: 0.4475, test_loss: 1.3231, test_f1: 0.5858
 epoch: 52, train_loss: 0.4593, test_loss: 1.3463, test_f1: 0.5972
 epoch: 53, train_loss: 0.4481, test_loss: 1.3119, test_f1: 0.6122
 epoch: 54, train_loss: 0.4360, test_loss: 1.3570, test_f1: 0.6016
 epoch: 55, train_loss: 0.4636, test_loss: 1.3896, test_f1: 0.5984
 epoch: 56, train_loss: 0.4397, test_loss: 1.2961, test_f1: 0.6150
 epoch: 57, train_loss: 0.4230, test_loss: 1.3574, test_f1: 0.6231
 epoch: 58, train_loss: 0.4634, test_loss: 1.3656, test_f1: 0.6202
 epoch: 59, train_loss: 0.4323, test_loss: 1.3443, test_f1: 0.6274
 epoch: 60, train_loss: 0.4181, test_loss: 1.3910, test_f1: 0.6149
 epoch: 61, train_loss: 0.4182, test_loss: 1.3754, test_f1: 0.6260
 epoch: 62, train_loss: 0.4056, test_loss: 1.3819, test_f1: 0.6331
 epoch: 63, train_loss: 0.4377, test_loss: 1.3815, test_f1: 0.6466
 epoch: 64, train_loss: 0.4187, test_loss: 1.3486, test_f1: 0.6241
 epoch: 65, train_loss: 0.4042, test_loss: 1.4147, test_f1: 0.6283
 epoch: 66, train_loss: 0.4220, test_loss: 1.4304, test_f1: 0.6139
 epoch: 67, train_loss: 0.4119, test_loss: 1.4380, test_f1: 0.6035
 epoch: 68, train_loss: 0.3977, test_loss: 1.3752, test_f1: 0.6307
 epoch: 69, train_loss: 0.4136, test_loss: 1.4317, test_f1: 0.6083
 epoch: 70, train_loss: 0.3989, test_loss: 1.4213, test_f1: 0.6046
 epoch: 71, train_loss: 0.3840, test_loss: 1.4335, test_f1: 0.6434
 epoch: 72, train_loss: 0.3890, test_loss: 1.4426, test_f1: 0.6169
 epoch: 73, train_loss: 0.3734, test_loss: 1.4971, test_f1: 0.6034
 epoch: 74, train_loss: 0.3896, test_loss: 1.4954, test_f1: 0.5972
 epoch: 75, train_loss: 0.3812, test_loss: 1.5916, test_f1: 0.5933
 epoch: 76, train_loss: 0.4003, test_loss: 1.5164, test_f1: 0.6156
 epoch: 77, train_loss: 0.3966, test_loss: 1.6308, test_f1: 0.5733
 epoch: 78, train_loss: 0.3980, test_loss: 1.5609, test_f1: 0.6000
 epoch: 79, train_loss: 0.3706, test_loss: 1.4996, test_f1: 0.6248
 epoch: 80, train_loss: 0.3855, test_loss: 1.5770, test_f1: 0.5915
 epoch: 81, train_loss: 0.3534, test_loss: 1.6177, test_f1: 0.6031
 epoch: 82, train_loss: 0.3846, test_loss: 1.4976, test_f1: 0.6420
 epoch: 83, train_loss: 0.3530, test_loss: 1.5735, test_f1: 0.6030
 epoch: 84, train_loss: 0.3438, test_loss: 1.5593, test_f1: 0.6101
 epoch: 85, train_loss: 0.3359, test_loss: 1.5297, test_f1: 0.6227
 epoch: 86, train_loss: 0.3340, test_loss: 1.5578, test_f1: 0.6476
 epoch: 87, train_loss: 0.3438, test_loss: 1.6553, test_f1: 0.6181
 epoch: 88, train_loss: 0.3355, test_loss: 1.5662, test_f1: 0.6149
 epoch: 89, train_loss: 0.3603, test_loss: 1.5728, test_f1: 0.6160
 epoch: 90, train_loss: 0.3613, test_loss: 1.6687, test_f1: 0.6133
 epoch: 91, train_loss: 0.3388, test_loss: 1.5981, test_f1: 0.6344
 epoch: 92, train_loss: 0.3359, test_loss: 1.6038, test_f1: 0.6097
 epoch: 93, train_loss: 0.3526, test_loss: 1.5682, test_f1: 0.6212
 epoch: 94, train_loss: 0.3244, test_loss: 1.6539, test_f1: 0.6317
 epoch: 95, train_loss: 0.3305, test_loss: 1.6075, test_f1: 0.6249
 epoch: 96, train_loss: 0.3152, test_loss: 1.6597, test_f1: 0.6086
 epoch: 97, train_loss: 0.3242, test_loss: 1.5678, test_f1: 0.6322
 epoch: 98, train_loss: 0.3199, test_loss: 1.7106, test_f1: 0.6055
 epoch: 99, train_loss: 0.3138, test_loss: 1.5843, test_f1: 0.6391
##################ITERATION #6 ****************************************
 epoch: 0, train_loss: 1.2240, test_loss: 1.2312, test_f1: 0.4258
 epoch: 1, train_loss: 1.0757, test_loss: 1.1268, test_f1: 0.5181
 epoch: 2, train_loss: 1.0390, test_loss: 1.0979, test_f1: 0.5586
 epoch: 3, train_loss: 0.9822, test_loss: 1.0604, test_f1: 0.5446
 epoch: 4, train_loss: 0.9668, test_loss: 1.0364, test_f1: 0.5591
 epoch: 5, train_loss: 0.9314, test_loss: 1.0328, test_f1: 0.5310
 epoch: 6, train_loss: 0.8989, test_loss: 0.9871, test_f1: 0.5747
 epoch: 7, train_loss: 0.8902, test_loss: 0.9919, test_f1: 0.5506
 epoch: 8, train_loss: 0.8728, test_loss: 0.9864, test_f1: 0.5557
 epoch: 9, train_loss: 0.8320, test_loss: 0.9759, test_f1: 0.5915
 epoch: 10, train_loss: 0.8172, test_loss: 0.9966, test_f1: 0.5807
 epoch: 11, train_loss: 0.8151, test_loss: 0.9590, test_f1: 0.5737
 epoch: 12, train_loss: 0.8042, test_loss: 0.9648, test_f1: 0.6159
 epoch: 13, train_loss: 0.7971, test_loss: 0.9676, test_f1: 0.6061
 epoch: 14, train_loss: 0.7755, test_loss: 0.9679, test_f1: 0.6169
 epoch: 15, train_loss: 0.7605, test_loss: 0.9709, test_f1: 0.5955
 epoch: 16, train_loss: 0.7402, test_loss: 0.9672, test_f1: 0.6104
 epoch: 17, train_loss: 0.7233, test_loss: 0.9834, test_f1: 0.6122
 epoch: 18, train_loss: 0.7256, test_loss: 0.9797, test_f1: 0.5904
 epoch: 19, train_loss: 0.7031, test_loss: 0.9428, test_f1: 0.6496
 epoch: 20, train_loss: 0.7096, test_loss: 1.0084, test_f1: 0.6324
 epoch: 21, train_loss: 0.6988, test_loss: 1.0323, test_f1: 0.6339
 epoch: 22, train_loss: 0.6906, test_loss: 1.0351, test_f1: 0.6291
 epoch: 23, train_loss: 0.6935, test_loss: 0.9627, test_f1: 0.6275
 epoch: 24, train_loss: 0.6553, test_loss: 0.9477, test_f1: 0.6450
 epoch: 25, train_loss: 0.6661, test_loss: 0.9639, test_f1: 0.6273
 epoch: 26, train_loss: 0.6551, test_loss: 0.9060, test_f1: 0.6459
 epoch: 27, train_loss: 0.6510, test_loss: 1.0399, test_f1: 0.6152
 epoch: 28, train_loss: 0.6182, test_loss: 0.9653, test_f1: 0.6214
 epoch: 29, train_loss: 0.6430, test_loss: 1.0709, test_f1: 0.6386
 epoch: 30, train_loss: 0.6109, test_loss: 1.0329, test_f1: 0.6479
 epoch: 31, train_loss: 0.6009, test_loss: 1.0509, test_f1: 0.6145
 epoch: 32, train_loss: 0.5987, test_loss: 1.0203, test_f1: 0.6333
 epoch: 33, train_loss: 0.6059, test_loss: 1.0388, test_f1: 0.6309
 epoch: 34, train_loss: 0.5782, test_loss: 1.0692, test_f1: 0.6072
 epoch: 35, train_loss: 0.5677, test_loss: 1.0945, test_f1: 0.6111
 epoch: 36, train_loss: 0.5906, test_loss: 1.0684, test_f1: 0.6419
 epoch: 37, train_loss: 0.5726, test_loss: 1.0191, test_f1: 0.6567
 epoch: 38, train_loss: 0.5504, test_loss: 1.0762, test_f1: 0.6178
 epoch: 39, train_loss: 0.5545, test_loss: 1.1456, test_f1: 0.6381
 epoch: 40, train_loss: 0.5540, test_loss: 1.1397, test_f1: 0.6410
 epoch: 41, train_loss: 0.5554, test_loss: 1.2995, test_f1: 0.5876
 epoch: 42, train_loss: 0.5387, test_loss: 1.1551, test_f1: 0.6485
 epoch: 43, train_loss: 0.5420, test_loss: 1.2088, test_f1: 0.6416
 epoch: 44, train_loss: 0.5296, test_loss: 1.1589, test_f1: 0.6031
 epoch: 45, train_loss: 0.5138, test_loss: 1.1707, test_f1: 0.6499
 epoch: 46, train_loss: 0.5081, test_loss: 1.1130, test_f1: 0.6783
 epoch: 47, train_loss: 0.5105, test_loss: 1.1664, test_f1: 0.6393
 epoch: 48, train_loss: 0.5275, test_loss: 1.2069, test_f1: 0.6174
 epoch: 49, train_loss: 0.4984, test_loss: 1.2927, test_f1: 0.6105
 epoch: 50, train_loss: 0.4875, test_loss: 1.2034, test_f1: 0.6221
 epoch: 51, train_loss: 0.4747, test_loss: 1.2405, test_f1: 0.6065
 epoch: 52, train_loss: 0.4610, test_loss: 1.2081, test_f1: 0.6257
 epoch: 53, train_loss: 0.4656, test_loss: 1.2321, test_f1: 0.6242
 epoch: 54, train_loss: 0.4530, test_loss: 1.2127, test_f1: 0.6367
 epoch: 55, train_loss: 0.4885, test_loss: 1.1790, test_f1: 0.6435
 epoch: 56, train_loss: 0.4400, test_loss: 1.2202, test_f1: 0.6507
 epoch: 57, train_loss: 0.4462, test_loss: 1.2581, test_f1: 0.6408
 epoch: 58, train_loss: 0.4456, test_loss: 1.2982, test_f1: 0.6183
 epoch: 59, train_loss: 0.4479, test_loss: 1.2465, test_f1: 0.6318
 epoch: 60, train_loss: 0.4244, test_loss: 1.2395, test_f1: 0.6595
 epoch: 61, train_loss: 0.4248, test_loss: 1.2959, test_f1: 0.6528
 epoch: 62, train_loss: 0.4275, test_loss: 1.2860, test_f1: 0.6434
 epoch: 63, train_loss: 0.4330, test_loss: 1.2723, test_f1: 0.6415
 epoch: 64, train_loss: 0.4200, test_loss: 1.2941, test_f1: 0.6253
 epoch: 65, train_loss: 0.4055, test_loss: 1.2648, test_f1: 0.6332
 epoch: 66, train_loss: 0.4292, test_loss: 1.3114, test_f1: 0.6401
 epoch: 67, train_loss: 0.3972, test_loss: 1.3271, test_f1: 0.6524
 epoch: 68, train_loss: 0.3977, test_loss: 1.3617, test_f1: 0.6366
 epoch: 69, train_loss: 0.3905, test_loss: 1.3587, test_f1: 0.6512
 epoch: 70, train_loss: 0.4062, test_loss: 1.3444, test_f1: 0.6444
 epoch: 71, train_loss: 0.3854, test_loss: 1.3986, test_f1: 0.6304
 epoch: 72, train_loss: 0.4193, test_loss: 1.4607, test_f1: 0.6185
 epoch: 73, train_loss: 0.4092, test_loss: 1.4429, test_f1: 0.6397
 epoch: 74, train_loss: 0.3926, test_loss: 1.4075, test_f1: 0.6470
 epoch: 75, train_loss: 0.4116, test_loss: 1.3489, test_f1: 0.6621
 epoch: 76, train_loss: 0.3875, test_loss: 1.4333, test_f1: 0.6412
 epoch: 77, train_loss: 0.3894, test_loss: 1.3603, test_f1: 0.6547
 epoch: 78, train_loss: 0.3876, test_loss: 1.4341, test_f1: 0.6697
 epoch: 79, train_loss: 0.3770, test_loss: 1.4197, test_f1: 0.6518
 epoch: 80, train_loss: 0.3806, test_loss: 1.5168, test_f1: 0.6570
 epoch: 81, train_loss: 0.3746, test_loss: 1.5190, test_f1: 0.6381
 epoch: 82, train_loss: 0.3927, test_loss: 1.4343, test_f1: 0.6481
 epoch: 83, train_loss: 0.3739, test_loss: 1.4379, test_f1: 0.6378
 epoch: 84, train_loss: 0.3613, test_loss: 1.5002, test_f1: 0.6381
 epoch: 85, train_loss: 0.3696, test_loss: 1.4859, test_f1: 0.6358
 epoch: 86, train_loss: 0.3665, test_loss: 1.5011, test_f1: 0.6613
 epoch: 87, train_loss: 0.3603, test_loss: 1.5788, test_f1: 0.6585
 epoch: 88, train_loss: 0.3511, test_loss: 1.6148, test_f1: 0.6298
 epoch: 89, train_loss: 0.3470, test_loss: 1.5976, test_f1: 0.6414
 epoch: 90, train_loss: 0.3586, test_loss: 1.5024, test_f1: 0.6494
 epoch: 91, train_loss: 0.3410, test_loss: 1.6509, test_f1: 0.6299
 epoch: 92, train_loss: 0.3507, test_loss: 1.5680, test_f1: 0.6482
 epoch: 93, train_loss: 0.3422, test_loss: 1.6083, test_f1: 0.6372
 epoch: 94, train_loss: 0.3254, test_loss: 1.5931, test_f1: 0.6566
 epoch: 95, train_loss: 0.3394, test_loss: 1.5961, test_f1: 0.6415
 epoch: 96, train_loss: 0.3458, test_loss: 1.5921, test_f1: 0.6527
 epoch: 97, train_loss: 0.3275, test_loss: 1.6844, test_f1: 0.6488
 epoch: 98, train_loss: 0.3424, test_loss: 1.6196, test_f1: 0.6363
 epoch: 99, train_loss: 0.3207, test_loss: 1.5996, test_f1: 0.6538
##################ITERATION #7 ****************************************
 epoch: 0, train_loss: 1.2307, test_loss: 1.2912, test_f1: 0.2155
 epoch: 1, train_loss: 1.0616, test_loss: 1.1545, test_f1: 0.5359
 epoch: 2, train_loss: 1.0062, test_loss: 1.1507, test_f1: 0.5582
 epoch: 3, train_loss: 0.9786, test_loss: 1.0683, test_f1: 0.5401
 epoch: 4, train_loss: 0.9608, test_loss: 1.0517, test_f1: 0.5450
 epoch: 5, train_loss: 0.9455, test_loss: 1.0552, test_f1: 0.5466
 epoch: 6, train_loss: 0.9098, test_loss: 1.0664, test_f1: 0.5438
 epoch: 7, train_loss: 0.8746, test_loss: 1.0606, test_f1: 0.5462
 epoch: 8, train_loss: 0.8490, test_loss: 1.0777, test_f1: 0.5574
 epoch: 9, train_loss: 0.8489, test_loss: 1.0290, test_f1: 0.5605
 epoch: 10, train_loss: 0.8188, test_loss: 1.0406, test_f1: 0.5480
 epoch: 11, train_loss: 0.8018, test_loss: 1.0298, test_f1: 0.5628
 epoch: 12, train_loss: 0.7742, test_loss: 1.0093, test_f1: 0.5639
 epoch: 13, train_loss: 0.7670, test_loss: 1.0736, test_f1: 0.5578
 epoch: 14, train_loss: 0.7558, test_loss: 1.0378, test_f1: 0.6180
 epoch: 15, train_loss: 0.7471, test_loss: 1.0283, test_f1: 0.6113
 epoch: 16, train_loss: 0.7293, test_loss: 1.0421, test_f1: 0.6356
 epoch: 17, train_loss: 0.7291, test_loss: 1.1241, test_f1: 0.6171
 epoch: 18, train_loss: 0.7173, test_loss: 1.0337, test_f1: 0.6059
 epoch: 19, train_loss: 0.7125, test_loss: 1.0445, test_f1: 0.5961
 epoch: 20, train_loss: 0.6834, test_loss: 1.1283, test_f1: 0.6042
 epoch: 21, train_loss: 0.6810, test_loss: 1.0785, test_f1: 0.6225
 epoch: 22, train_loss: 0.6806, test_loss: 1.1166, test_f1: 0.6207
 epoch: 23, train_loss: 0.6768, test_loss: 1.1251, test_f1: 0.6017
 epoch: 24, train_loss: 0.6589, test_loss: 1.0938, test_f1: 0.6183
 epoch: 25, train_loss: 0.6719, test_loss: 1.1134, test_f1: 0.6189
 epoch: 26, train_loss: 0.6315, test_loss: 1.1338, test_f1: 0.6167
 epoch: 27, train_loss: 0.6393, test_loss: 1.1277, test_f1: 0.6158
 epoch: 28, train_loss: 0.6294, test_loss: 1.1864, test_f1: 0.6089
 epoch: 29, train_loss: 0.6154, test_loss: 1.1400, test_f1: 0.6052
 epoch: 30, train_loss: 0.6197, test_loss: 1.1401, test_f1: 0.6356
 epoch: 31, train_loss: 0.6101, test_loss: 1.2070, test_f1: 0.6131
 epoch: 32, train_loss: 0.6172, test_loss: 1.1794, test_f1: 0.6160
 epoch: 33, train_loss: 0.5864, test_loss: 1.2249, test_f1: 0.6188
 epoch: 34, train_loss: 0.5842, test_loss: 1.2494, test_f1: 0.6112
 epoch: 35, train_loss: 0.5724, test_loss: 1.1820, test_f1: 0.6225
 epoch: 36, train_loss: 0.5771, test_loss: 1.2514, test_f1: 0.6208
 epoch: 37, train_loss: 0.5546, test_loss: 1.1606, test_f1: 0.6068
 epoch: 38, train_loss: 0.5570, test_loss: 1.1862, test_f1: 0.6370
 epoch: 39, train_loss: 0.5457, test_loss: 1.2078, test_f1: 0.6228
 epoch: 40, train_loss: 0.5530, test_loss: 1.2761, test_f1: 0.6247
 epoch: 41, train_loss: 0.5368, test_loss: 1.2433, test_f1: 0.6273
 epoch: 42, train_loss: 0.5234, test_loss: 1.2597, test_f1: 0.6185
 epoch: 43, train_loss: 0.5163, test_loss: 1.2043, test_f1: 0.6512
 epoch: 44, train_loss: 0.5232, test_loss: 1.2300, test_f1: 0.6390
 epoch: 45, train_loss: 0.5081, test_loss: 1.2416, test_f1: 0.6071
 epoch: 46, train_loss: 0.5096, test_loss: 1.2947, test_f1: 0.5969
 epoch: 47, train_loss: 0.5076, test_loss: 1.2789, test_f1: 0.6251
 epoch: 48, train_loss: 0.5101, test_loss: 1.2839, test_f1: 0.6294
 epoch: 49, train_loss: 0.4782, test_loss: 1.3487, test_f1: 0.6245
 epoch: 50, train_loss: 0.4894, test_loss: 1.2994, test_f1: 0.6333
 epoch: 51, train_loss: 0.4699, test_loss: 1.3283, test_f1: 0.6499
 epoch: 52, train_loss: 0.4794, test_loss: 1.3251, test_f1: 0.6351
 epoch: 53, train_loss: 0.4466, test_loss: 1.3571, test_f1: 0.6527
 epoch: 54, train_loss: 0.4389, test_loss: 1.3008, test_f1: 0.6616
 epoch: 55, train_loss: 0.4537, test_loss: 1.3829, test_f1: 0.6331
 epoch: 56, train_loss: 0.4459, test_loss: 1.3829, test_f1: 0.6356
 epoch: 57, train_loss: 0.4344, test_loss: 1.3817, test_f1: 0.6367
 epoch: 58, train_loss: 0.4308, test_loss: 1.4037, test_f1: 0.6576
 epoch: 59, train_loss: 0.4469, test_loss: 1.4402, test_f1: 0.6156
 epoch: 60, train_loss: 0.4220, test_loss: 1.4605, test_f1: 0.6224
 epoch: 61, train_loss: 0.4155, test_loss: 1.3980, test_f1: 0.6250
 epoch: 62, train_loss: 0.4182, test_loss: 1.4310, test_f1: 0.6476
 epoch: 63, train_loss: 0.4209, test_loss: 1.4644, test_f1: 0.6245
 epoch: 64, train_loss: 0.4142, test_loss: 1.4516, test_f1: 0.6477
 epoch: 65, train_loss: 0.3970, test_loss: 1.3742, test_f1: 0.6516
 epoch: 66, train_loss: 0.3924, test_loss: 1.4382, test_f1: 0.6361
 epoch: 67, train_loss: 0.4278, test_loss: 1.5256, test_f1: 0.6420
 epoch: 68, train_loss: 0.3843, test_loss: 1.4430, test_f1: 0.6477
 epoch: 69, train_loss: 0.3993, test_loss: 1.5514, test_f1: 0.6174
 epoch: 70, train_loss: 0.3929, test_loss: 1.4592, test_f1: 0.6512
 epoch: 71, train_loss: 0.3704, test_loss: 1.4686, test_f1: 0.6371
 epoch: 72, train_loss: 0.3947, test_loss: 1.5191, test_f1: 0.6301
 epoch: 73, train_loss: 0.3932, test_loss: 1.4129, test_f1: 0.6631
 epoch: 74, train_loss: 0.3925, test_loss: 1.4594, test_f1: 0.6440
 epoch: 75, train_loss: 0.3681, test_loss: 1.5648, test_f1: 0.6539
 epoch: 76, train_loss: 0.3801, test_loss: 1.5535, test_f1: 0.6296
 epoch: 77, train_loss: 0.3575, test_loss: 1.5319, test_f1: 0.6227
 epoch: 78, train_loss: 0.3598, test_loss: 1.5851, test_f1: 0.6317
 epoch: 79, train_loss: 0.3556, test_loss: 1.5148, test_f1: 0.6521
 epoch: 80, train_loss: 0.3702, test_loss: 1.6059, test_f1: 0.6393
 epoch: 81, train_loss: 0.3530, test_loss: 1.5993, test_f1: 0.6444
 epoch: 82, train_loss: 0.3636, test_loss: 1.5276, test_f1: 0.6341
 epoch: 83, train_loss: 0.3582, test_loss: 1.6807, test_f1: 0.6347
 epoch: 84, train_loss: 0.3564, test_loss: 1.6981, test_f1: 0.6390
 epoch: 85, train_loss: 0.3353, test_loss: 1.6322, test_f1: 0.6440
 epoch: 86, train_loss: 0.3680, test_loss: 1.6737, test_f1: 0.6182
 epoch: 87, train_loss: 0.3426, test_loss: 1.6367, test_f1: 0.6561
 epoch: 88, train_loss: 0.3333, test_loss: 1.7002, test_f1: 0.6213
 epoch: 89, train_loss: 0.3338, test_loss: 1.7340, test_f1: 0.6338
 epoch: 90, train_loss: 0.3460, test_loss: 1.7670, test_f1: 0.6146
 epoch: 91, train_loss: 0.3341, test_loss: 1.8046, test_f1: 0.6422
 epoch: 92, train_loss: 0.3432, test_loss: 1.7155, test_f1: 0.6401
 epoch: 93, train_loss: 0.3411, test_loss: 1.7464, test_f1: 0.6434
 epoch: 94, train_loss: 0.3115, test_loss: 1.8277, test_f1: 0.6209
 epoch: 95, train_loss: 0.3223, test_loss: 1.7964, test_f1: 0.6387
 epoch: 96, train_loss: 0.3517, test_loss: 1.8505, test_f1: 0.6221
 epoch: 97, train_loss: 0.3124, test_loss: 1.7350, test_f1: 0.6298
 epoch: 98, train_loss: 0.3163, test_loss: 1.7618, test_f1: 0.6302
 epoch: 99, train_loss: 0.3239, test_loss: 1.7469, test_f1: 0.6475
##################ITERATION #8 ****************************************
 epoch: 0, train_loss: 1.2970, test_loss: 1.2411, test_f1: 0.2979
 epoch: 1, train_loss: 1.0953, test_loss: 1.0895, test_f1: 0.4862
 epoch: 2, train_loss: 1.0204, test_loss: 1.0497, test_f1: 0.5309
 epoch: 3, train_loss: 1.0168, test_loss: 1.0311, test_f1: 0.5609
 epoch: 4, train_loss: 0.9625, test_loss: 1.0062, test_f1: 0.5532
 epoch: 5, train_loss: 0.9406, test_loss: 1.0407, test_f1: 0.5647
 epoch: 6, train_loss: 0.9059, test_loss: 1.0214, test_f1: 0.5580
 epoch: 7, train_loss: 0.8862, test_loss: 1.0234, test_f1: 0.5421
 epoch: 8, train_loss: 0.8818, test_loss: 1.0249, test_f1: 0.5563
 epoch: 9, train_loss: 0.8399, test_loss: 1.0181, test_f1: 0.5237
 epoch: 10, train_loss: 0.8317, test_loss: 0.9843, test_f1: 0.5608
 epoch: 11, train_loss: 0.8072, test_loss: 1.0213, test_f1: 0.5748
 epoch: 12, train_loss: 0.8127, test_loss: 1.0243, test_f1: 0.5680
 epoch: 13, train_loss: 0.7883, test_loss: 0.9832, test_f1: 0.5567
 epoch: 14, train_loss: 0.7890, test_loss: 1.0065, test_f1: 0.5873
 epoch: 15, train_loss: 0.7724, test_loss: 1.0036, test_f1: 0.6121
 epoch: 16, train_loss: 0.7406, test_loss: 1.0365, test_f1: 0.5930
 epoch: 17, train_loss: 0.7430, test_loss: 1.0515, test_f1: 0.5933
 epoch: 18, train_loss: 0.7111, test_loss: 1.0310, test_f1: 0.5831
 epoch: 19, train_loss: 0.7336, test_loss: 1.0589, test_f1: 0.6041
 epoch: 20, train_loss: 0.7392, test_loss: 1.0288, test_f1: 0.6249
 epoch: 21, train_loss: 0.7055, test_loss: 1.0660, test_f1: 0.5863
 epoch: 22, train_loss: 0.6993, test_loss: 1.0728, test_f1: 0.5639
 epoch: 23, train_loss: 0.6782, test_loss: 1.0851, test_f1: 0.5772
 epoch: 24, train_loss: 0.6835, test_loss: 1.0370, test_f1: 0.6194
 epoch: 25, train_loss: 0.6736, test_loss: 1.0822, test_f1: 0.6111
 epoch: 26, train_loss: 0.6594, test_loss: 1.0705, test_f1: 0.5893
 epoch: 27, train_loss: 0.6536, test_loss: 1.0628, test_f1: 0.5791
 epoch: 28, train_loss: 0.6450, test_loss: 1.0090, test_f1: 0.5943
 epoch: 29, train_loss: 0.6229, test_loss: 1.0651, test_f1: 0.6145
 epoch: 30, train_loss: 0.6099, test_loss: 1.0435, test_f1: 0.5961
 epoch: 31, train_loss: 0.6104, test_loss: 1.0842, test_f1: 0.6135
 epoch: 32, train_loss: 0.6091, test_loss: 1.0861, test_f1: 0.6122
 epoch: 33, train_loss: 0.5851, test_loss: 1.1353, test_f1: 0.5882
 epoch: 34, train_loss: 0.6055, test_loss: 1.0995, test_f1: 0.6006
 epoch: 35, train_loss: 0.5793, test_loss: 1.1452, test_f1: 0.6029
 epoch: 36, train_loss: 0.5789, test_loss: 1.1830, test_f1: 0.5944
 epoch: 37, train_loss: 0.5668, test_loss: 1.2566, test_f1: 0.5659
 epoch: 38, train_loss: 0.5526, test_loss: 1.1459, test_f1: 0.5957
 epoch: 39, train_loss: 0.5555, test_loss: 1.2139, test_f1: 0.5817
 epoch: 40, train_loss: 0.5416, test_loss: 1.1479, test_f1: 0.5947
 epoch: 41, train_loss: 0.5472, test_loss: 1.2457, test_f1: 0.6191
 epoch: 42, train_loss: 0.5565, test_loss: 1.1687, test_f1: 0.6090
 epoch: 43, train_loss: 0.5041, test_loss: 1.1657, test_f1: 0.6015
 epoch: 44, train_loss: 0.5129, test_loss: 1.2752, test_f1: 0.5705
 epoch: 45, train_loss: 0.5244, test_loss: 1.2016, test_f1: 0.6251
 epoch: 46, train_loss: 0.5047, test_loss: 1.1772, test_f1: 0.6045
 epoch: 47, train_loss: 0.5102, test_loss: 1.2461, test_f1: 0.5901
 epoch: 48, train_loss: 0.4989, test_loss: 1.2540, test_f1: 0.5713
 epoch: 49, train_loss: 0.4894, test_loss: 1.3294, test_f1: 0.5729
 epoch: 50, train_loss: 0.4913, test_loss: 1.3129, test_f1: 0.5877
 epoch: 51, train_loss: 0.4584, test_loss: 1.2938, test_f1: 0.5955
 epoch: 52, train_loss: 0.4554, test_loss: 1.2803, test_f1: 0.6148
 epoch: 53, train_loss: 0.4416, test_loss: 1.3481, test_f1: 0.5897
 epoch: 54, train_loss: 0.4361, test_loss: 1.3372, test_f1: 0.6132
 epoch: 55, train_loss: 0.4373, test_loss: 1.3376, test_f1: 0.5905
 epoch: 56, train_loss: 0.4388, test_loss: 1.3072, test_f1: 0.6139
 epoch: 57, train_loss: 0.4245, test_loss: 1.3269, test_f1: 0.6094
 epoch: 58, train_loss: 0.4257, test_loss: 1.3575, test_f1: 0.6045
 epoch: 59, train_loss: 0.4284, test_loss: 1.3531, test_f1: 0.6064
 epoch: 60, train_loss: 0.4432, test_loss: 1.4067, test_f1: 0.6099
 epoch: 61, train_loss: 0.4292, test_loss: 1.3765, test_f1: 0.6001
 epoch: 62, train_loss: 0.4161, test_loss: 1.4364, test_f1: 0.6084
 epoch: 63, train_loss: 0.4114, test_loss: 1.4466, test_f1: 0.6033
 epoch: 64, train_loss: 0.4093, test_loss: 1.4370, test_f1: 0.6170
 epoch: 65, train_loss: 0.4004, test_loss: 1.4608, test_f1: 0.6182
 epoch: 66, train_loss: 0.3844, test_loss: 1.4372, test_f1: 0.6336
 epoch: 67, train_loss: 0.4060, test_loss: 1.4424, test_f1: 0.6080
 epoch: 68, train_loss: 0.3970, test_loss: 1.4445, test_f1: 0.6092
 epoch: 69, train_loss: 0.3818, test_loss: 1.4670, test_f1: 0.6361
 epoch: 70, train_loss: 0.3873, test_loss: 1.4678, test_f1: 0.6142
 epoch: 71, train_loss: 0.3616, test_loss: 1.4641, test_f1: 0.6153
 epoch: 72, train_loss: 0.3974, test_loss: 1.5028, test_f1: 0.6308
 epoch: 73, train_loss: 0.3580, test_loss: 1.4718, test_f1: 0.6208
 epoch: 74, train_loss: 0.3854, test_loss: 1.4977, test_f1: 0.6083
 epoch: 75, train_loss: 0.3933, test_loss: 1.5479, test_f1: 0.5857
 epoch: 76, train_loss: 0.3606, test_loss: 1.5114, test_f1: 0.6156
 epoch: 77, train_loss: 0.3641, test_loss: 1.5380, test_f1: 0.6202
 epoch: 78, train_loss: 0.3971, test_loss: 1.5719, test_f1: 0.6255
 epoch: 79, train_loss: 0.3672, test_loss: 1.5441, test_f1: 0.6089
 epoch: 80, train_loss: 0.3445, test_loss: 1.5176, test_f1: 0.6008
 epoch: 81, train_loss: 0.3440, test_loss: 1.6058, test_f1: 0.6153
 epoch: 82, train_loss: 0.3617, test_loss: 1.5725, test_f1: 0.6187
 epoch: 83, train_loss: 0.3517, test_loss: 1.5853, test_f1: 0.6234
 epoch: 84, train_loss: 0.3642, test_loss: 1.5889, test_f1: 0.6071
 epoch: 85, train_loss: 0.3431, test_loss: 1.5112, test_f1: 0.6430
 epoch: 86, train_loss: 0.3310, test_loss: 1.6229, test_f1: 0.6135
 epoch: 87, train_loss: 0.3394, test_loss: 1.6146, test_f1: 0.6003
 epoch: 88, train_loss: 0.3456, test_loss: 1.6621, test_f1: 0.6166
 epoch: 89, train_loss: 0.3584, test_loss: 1.5891, test_f1: 0.6308
 epoch: 90, train_loss: 0.3351, test_loss: 1.6098, test_f1: 0.6040
 epoch: 91, train_loss: 0.3421, test_loss: 1.6796, test_f1: 0.6138
 epoch: 92, train_loss: 0.3570, test_loss: 1.7392, test_f1: 0.6263
 epoch: 93, train_loss: 0.3292, test_loss: 1.6901, test_f1: 0.6018
 epoch: 94, train_loss: 0.3363, test_loss: 1.7387, test_f1: 0.6123
 epoch: 95, train_loss: 0.3401, test_loss: 1.6550, test_f1: 0.6094
 epoch: 96, train_loss: 0.2932, test_loss: 1.6906, test_f1: 0.6371
 epoch: 97, train_loss: 0.3408, test_loss: 1.6594, test_f1: 0.6268
 epoch: 98, train_loss: 0.3108, test_loss: 1.6218, test_f1: 0.6307
 epoch: 99, train_loss: 0.3170, test_loss: 1.7542, test_f1: 0.6289
##################ITERATION #9 ****************************************
 epoch: 0, train_loss: 1.2522, test_loss: 1.2603, test_f1: 0.3484
 epoch: 1, train_loss: 1.0405, test_loss: 1.1007, test_f1: 0.5584
 epoch: 2, train_loss: 0.9820, test_loss: 1.0333, test_f1: 0.5660
 epoch: 3, train_loss: 0.9445, test_loss: 1.0147, test_f1: 0.5787
 epoch: 4, train_loss: 0.9268, test_loss: 1.0133, test_f1: 0.5608
 epoch: 5, train_loss: 0.8986, test_loss: 0.9987, test_f1: 0.5753
 epoch: 6, train_loss: 0.8935, test_loss: 0.9987, test_f1: 0.5714
 epoch: 7, train_loss: 0.8501, test_loss: 1.0247, test_f1: 0.5557
 epoch: 8, train_loss: 0.8396, test_loss: 0.9676, test_f1: 0.5965
 epoch: 9, train_loss: 0.8349, test_loss: 0.9880, test_f1: 0.5807
 epoch: 10, train_loss: 0.8042, test_loss: 0.9668, test_f1: 0.5617
 epoch: 11, train_loss: 0.7948, test_loss: 0.9485, test_f1: 0.5846
 epoch: 12, train_loss: 0.7600, test_loss: 0.9553, test_f1: 0.5884
 epoch: 13, train_loss: 0.7619, test_loss: 0.9662, test_f1: 0.6048
 epoch: 14, train_loss: 0.7592, test_loss: 0.9491, test_f1: 0.5712
 epoch: 15, train_loss: 0.7322, test_loss: 0.9630, test_f1: 0.5955
 epoch: 16, train_loss: 0.7242, test_loss: 0.9610, test_f1: 0.6087
 epoch: 17, train_loss: 0.7312, test_loss: 0.9779, test_f1: 0.6042
 epoch: 18, train_loss: 0.6883, test_loss: 0.9447, test_f1: 0.6202
 epoch: 19, train_loss: 0.6854, test_loss: 0.9683, test_f1: 0.6067
 epoch: 20, train_loss: 0.6739, test_loss: 0.9938, test_f1: 0.6013
 epoch: 21, train_loss: 0.6374, test_loss: 0.9957, test_f1: 0.5999
 epoch: 22, train_loss: 0.6419, test_loss: 0.9751, test_f1: 0.6146
 epoch: 23, train_loss: 0.6355, test_loss: 0.9799, test_f1: 0.6372
 epoch: 24, train_loss: 0.6315, test_loss: 1.0358, test_f1: 0.6189
 epoch: 25, train_loss: 0.6305, test_loss: 0.9973, test_f1: 0.6066
 epoch: 26, train_loss: 0.6130, test_loss: 0.9811, test_f1: 0.6234
 epoch: 27, train_loss: 0.6188, test_loss: 1.0273, test_f1: 0.6110
 epoch: 28, train_loss: 0.6005, test_loss: 1.0096, test_f1: 0.6356
 epoch: 29, train_loss: 0.5924, test_loss: 0.9894, test_f1: 0.6338
 epoch: 30, train_loss: 0.5740, test_loss: 1.0402, test_f1: 0.6124
 epoch: 31, train_loss: 0.5808, test_loss: 1.0139, test_f1: 0.6215
 epoch: 32, train_loss: 0.5657, test_loss: 1.0960, test_f1: 0.5763
 epoch: 33, train_loss: 0.5777, test_loss: 1.0559, test_f1: 0.6238
 epoch: 34, train_loss: 0.5559, test_loss: 1.1362, test_f1: 0.6061
 epoch: 35, train_loss: 0.5650, test_loss: 1.0685, test_f1: 0.6274
 epoch: 36, train_loss: 0.5485, test_loss: 1.0684, test_f1: 0.6310
 epoch: 37, train_loss: 0.5281, test_loss: 1.0698, test_f1: 0.6015
 epoch: 38, train_loss: 0.5091, test_loss: 1.0758, test_f1: 0.6418
 epoch: 39, train_loss: 0.5222, test_loss: 1.1560, test_f1: 0.6103
 epoch: 40, train_loss: 0.5130, test_loss: 1.1220, test_f1: 0.6289
 epoch: 41, train_loss: 0.5144, test_loss: 1.1984, test_f1: 0.6136
 epoch: 42, train_loss: 0.4967, test_loss: 1.1532, test_f1: 0.6248
 epoch: 43, train_loss: 0.4883, test_loss: 1.1280, test_f1: 0.6249
 epoch: 44, train_loss: 0.4998, test_loss: 1.1801, test_f1: 0.6312
 epoch: 45, train_loss: 0.4704, test_loss: 1.1173, test_f1: 0.6330
 epoch: 46, train_loss: 0.4565, test_loss: 1.1359, test_f1: 0.6162
 epoch: 47, train_loss: 0.4761, test_loss: 1.1469, test_f1: 0.5928
 epoch: 48, train_loss: 0.4611, test_loss: 1.1302, test_f1: 0.6210
 epoch: 49, train_loss: 0.4551, test_loss: 1.1835, test_f1: 0.5968
 epoch: 50, train_loss: 0.4358, test_loss: 1.2038, test_f1: 0.6565
 epoch: 51, train_loss: 0.4123, test_loss: 1.1542, test_f1: 0.6285
 epoch: 52, train_loss: 0.4547, test_loss: 1.2131, test_f1: 0.6390
 epoch: 53, train_loss: 0.4081, test_loss: 1.1942, test_f1: 0.6330
 epoch: 54, train_loss: 0.4165, test_loss: 1.1965, test_f1: 0.6319
 epoch: 55, train_loss: 0.4045, test_loss: 1.1941, test_f1: 0.6472
 epoch: 56, train_loss: 0.4034, test_loss: 1.2458, test_f1: 0.6295
 epoch: 57, train_loss: 0.4096, test_loss: 1.2709, test_f1: 0.6321
 epoch: 58, train_loss: 0.3919, test_loss: 1.3094, test_f1: 0.6224
 epoch: 59, train_loss: 0.3971, test_loss: 1.3091, test_f1: 0.6055
 epoch: 60, train_loss: 0.3919, test_loss: 1.2531, test_f1: 0.6413
 epoch: 61, train_loss: 0.3844, test_loss: 1.2674, test_f1: 0.6287
 epoch: 62, train_loss: 0.3832, test_loss: 1.3006, test_f1: 0.6356
 epoch: 63, train_loss: 0.3781, test_loss: 1.2774, test_f1: 0.6292
 epoch: 64, train_loss: 0.3738, test_loss: 1.3087, test_f1: 0.6240
 epoch: 65, train_loss: 0.3858, test_loss: 1.3762, test_f1: 0.6077
 epoch: 66, train_loss: 0.3703, test_loss: 1.3134, test_f1: 0.6268
 epoch: 67, train_loss: 0.3608, test_loss: 1.3604, test_f1: 0.6360
 epoch: 68, train_loss: 0.3668, test_loss: 1.2574, test_f1: 0.6369
 epoch: 69, train_loss: 0.3313, test_loss: 1.3735, test_f1: 0.6187
 epoch: 70, train_loss: 0.3740, test_loss: 1.2684, test_f1: 0.6193
 epoch: 71, train_loss: 0.3514, test_loss: 1.3847, test_f1: 0.6176
 epoch: 72, train_loss: 0.3529, test_loss: 1.3557, test_f1: 0.6238
 epoch: 73, train_loss: 0.3510, test_loss: 1.3542, test_f1: 0.6225
 epoch: 74, train_loss: 0.3363, test_loss: 1.3105, test_f1: 0.6332
 epoch: 75, train_loss: 0.3414, test_loss: 1.3471, test_f1: 0.6405
 epoch: 76, train_loss: 0.3459, test_loss: 1.4201, test_f1: 0.6150
 epoch: 77, train_loss: 0.3287, test_loss: 1.3772, test_f1: 0.6130
 epoch: 78, train_loss: 0.3320, test_loss: 1.4061, test_f1: 0.6280
 epoch: 79, train_loss: 0.3247, test_loss: 1.4214, test_f1: 0.6386
 epoch: 80, train_loss: 0.3183, test_loss: 1.4919, test_f1: 0.6204
 epoch: 81, train_loss: 0.3169, test_loss: 1.4386, test_f1: 0.6448
 epoch: 82, train_loss: 0.3260, test_loss: 1.4039, test_f1: 0.6250
 epoch: 83, train_loss: 0.3255, test_loss: 1.4275, test_f1: 0.6298
 epoch: 84, train_loss: 0.3197, test_loss: 1.4503, test_f1: 0.6192
 epoch: 85, train_loss: 0.3101, test_loss: 1.5157, test_f1: 0.6253
 epoch: 86, train_loss: 0.3175, test_loss: 1.5033, test_f1: 0.6340
 epoch: 87, train_loss: 0.3218, test_loss: 1.5066, test_f1: 0.6137
 epoch: 88, train_loss: 0.3003, test_loss: 1.5603, test_f1: 0.6310
 epoch: 89, train_loss: 0.3223, test_loss: 1.5161, test_f1: 0.6336
 epoch: 90, train_loss: 0.3137, test_loss: 1.4597, test_f1: 0.6346
 epoch: 91, train_loss: 0.2915, test_loss: 1.4115, test_f1: 0.6388
 epoch: 92, train_loss: 0.2877, test_loss: 1.4716, test_f1: 0.6389
 epoch: 93, train_loss: 0.3002, test_loss: 1.4707, test_f1: 0.6497
 epoch: 94, train_loss: 0.2910, test_loss: 1.5138, test_f1: 0.6213
 epoch: 95, train_loss: 0.2867, test_loss: 1.5088, test_f1: 0.6397
 epoch: 96, train_loss: 0.2965, test_loss: 1.4112, test_f1: 0.6351
 epoch: 97, train_loss: 0.3061, test_loss: 1.5193, test_f1: 0.6202
 epoch: 98, train_loss: 0.3041, test_loss: 1.4175, test_f1: 0.6388
 epoch: 99, train_loss: 0.2859, test_loss: 1.4795, test_f1: 0.6281

Training completed in 512.62 seconds
Best F1: 0.6783 at epoch 46
Mean F1 across iterations: 0.6497  0.0179
========================FINAL RESULTS================================
FEGIN weighted F1: 0.6783  0.0179
python main.py --data ltspice_demos --representation component_pin --model FEGIN --layers 2 --hiddens 128 --batch_size 32 --lr 0.0001 --emb_size 250 --epochs 100 --save_appendix component_pin_L2_H128_BS32_LR0.0001_E250 --no_val
-----



STDERR:
  File "main.py", line 370, in <module>
    main()
  File "main.py", line 254, in main
    dataset = dataset_class(
  File "/home/philip/projects/ltspice_examples_code_repo/Circuit-Completion-Using-GNNs/component_classification_with_link_prediction_head/evaluation/FEGIN/kernel/circuit_datasets.py", line 15, in __init__
    self.data, self.slices = torch.load(self.processed_paths[0])
  File "/home/philip/.local/lib/python3.8/site-packages/torch/serialization.py", line 1040, in load
    warnings.warn(
  File "/usr/lib/python3.8/warnings.py", line 109, in _showwarnmsg
    sw(msg.message, msg.category, msg.filename, msg.lineno,
  File "main.py", line 47, in warn_with_traceback
    traceback.print_stack(file=log)
/home/philip/projects/ltspice_examples_code_repo/Circuit-Completion-Using-GNNs/component_classification_with_link_prediction_head/evaluation/FEGIN/kernel/circuit_datasets.py:15: FutureWarning: You are using `torch.load` with `weights_only=False` (the current default value), which uses the default pickle module implicitly. It is possible to construct malicious pickle data which will execute arbitrary code during unpickling (See https://github.com/pytorch/pytorch/blob/main/SECURITY.md#untrusted-models for more details). In a future release, the default value for `weights_only` will be flipped to `True`. This limits the functions that could be executed during unpickling. Arbitrary objects will no longer be allowed to be loaded via this mode unless they are explicitly allowlisted by the user via `torch.serialization.add_safe_globals`. We recommend you start setting `weights_only=True` for any use case where you don't have full control of the loaded file. Please open an issue on GitHub for any issues related to this experimental feature.
  self.data, self.slices = torch.load(self.processed_paths[0])
