STDOUT:
Results will be saved in /home/philip/projects/ltspice_examples_code_repo/Circuit-Completion-Using-GNNs/component_classification_with_link_prediction_head/evaluation/FEGIN/results/model_FEGIN_dataset_ltspice_demos
Command line input: python main.py --data ltspice_demos --representation component_component --model FEGIN --layers 3 --hiddens 32 --batch_size 256 --lr 0.01 --emb_size 250 --epochs 100 --save_appendix component_component_L3_H32_BS256_LR0.01_E250 --no_val
 is saved.
-----
ltspice_demos - FEGIN
Using 3 layers, 32 hidden units, h = 2
Loading component_component representation dataset
ENTERED
Training FEGIN on component_component representation
Train: 1565, Test: 383
##################ITERATION #0 ****************************************
 epoch: 0, train_loss: 1.3010, test_loss: 1.3178, test_f1: 0.1763
 epoch: 1, train_loss: 1.2093, test_loss: 1.2854, test_f1: 0.3001
 epoch: 2, train_loss: 1.1888, test_loss: 1.3632, test_f1: 0.2259
 epoch: 3, train_loss: 1.1729, test_loss: 1.3007, test_f1: 0.2281
 epoch: 4, train_loss: 1.1627, test_loss: 1.3405, test_f1: 0.3310
 epoch: 5, train_loss: 1.1558, test_loss: 1.4613, test_f1: 0.3290
 epoch: 6, train_loss: 1.1552, test_loss: 1.4156, test_f1: 0.2281
 epoch: 7, train_loss: 1.1375, test_loss: 1.2632, test_f1: 0.3696
 epoch: 8, train_loss: 1.1228, test_loss: 1.3837, test_f1: 0.3980
 epoch: 9, train_loss: 1.1131, test_loss: 1.2231, test_f1: 0.3317
 epoch: 10, train_loss: 1.0991, test_loss: 1.3528, test_f1: 0.3125
 epoch: 11, train_loss: 1.0857, test_loss: 1.5157, test_f1: 0.4489
 epoch: 12, train_loss: 1.0548, test_loss: 1.4632, test_f1: 0.4629
 epoch: 13, train_loss: 1.0290, test_loss: 1.3397, test_f1: 0.5015
 epoch: 14, train_loss: 0.9816, test_loss: 1.2344, test_f1: 0.4226
 epoch: 15, train_loss: 0.9609, test_loss: 1.2421, test_f1: 0.4188
 epoch: 16, train_loss: 0.9272, test_loss: 1.2886, test_f1: 0.4825
 epoch: 17, train_loss: 0.9004, test_loss: 1.4570, test_f1: 0.3625
 epoch: 18, train_loss: 0.8811, test_loss: 1.2918, test_f1: 0.5397
 epoch: 19, train_loss: 0.8964, test_loss: 1.5393, test_f1: 0.4698
 epoch: 20, train_loss: 0.8861, test_loss: 1.2512, test_f1: 0.5463
 epoch: 21, train_loss: 0.8620, test_loss: 1.4267, test_f1: 0.4053
 epoch: 22, train_loss: 0.8643, test_loss: 1.1726, test_f1: 0.5036
 epoch: 23, train_loss: 0.8561, test_loss: 1.5313, test_f1: 0.4516
 epoch: 24, train_loss: 0.8288, test_loss: 1.4380, test_f1: 0.4933
 epoch: 25, train_loss: 0.8121, test_loss: 1.4610, test_f1: 0.4364
 epoch: 26, train_loss: 0.8299, test_loss: 1.2221, test_f1: 0.5884
 epoch: 27, train_loss: 0.8271, test_loss: 1.7754, test_f1: 0.4856
 epoch: 28, train_loss: 0.8579, test_loss: 1.5547, test_f1: 0.4639
 epoch: 29, train_loss: 0.8639, test_loss: 1.8032, test_f1: 0.4150
 epoch: 30, train_loss: 0.8183, test_loss: 1.4880, test_f1: 0.4626
 epoch: 31, train_loss: 0.8498, test_loss: 1.0528, test_f1: 0.4573
 epoch: 32, train_loss: 0.8407, test_loss: 1.1960, test_f1: 0.5204
 epoch: 33, train_loss: 0.8527, test_loss: 1.3078, test_f1: 0.6033
 epoch: 34, train_loss: 0.8432, test_loss: 1.2786, test_f1: 0.5463
 epoch: 35, train_loss: 0.8055, test_loss: 1.6160, test_f1: 0.4612
 epoch: 36, train_loss: 0.7951, test_loss: 1.3481, test_f1: 0.5343
 epoch: 37, train_loss: 0.8190, test_loss: 1.1735, test_f1: 0.6012
 epoch: 38, train_loss: 0.7822, test_loss: 1.3370, test_f1: 0.5003
 epoch: 39, train_loss: 0.7941, test_loss: 1.2989, test_f1: 0.5092
 epoch: 40, train_loss: 0.7634, test_loss: 1.4671, test_f1: 0.5042
 epoch: 41, train_loss: 0.7497, test_loss: 1.2955, test_f1: 0.5344
 epoch: 42, train_loss: 0.7583, test_loss: 1.1686, test_f1: 0.5530
 epoch: 43, train_loss: 0.7474, test_loss: 1.3345, test_f1: 0.5347
 epoch: 44, train_loss: 0.7519, test_loss: 1.4730, test_f1: 0.5578
 epoch: 45, train_loss: 0.7364, test_loss: 1.3806, test_f1: 0.5665
 epoch: 46, train_loss: 0.7375, test_loss: 1.4366, test_f1: 0.5379
 epoch: 47, train_loss: 0.7401, test_loss: 1.4129, test_f1: 0.5687
 epoch: 48, train_loss: 0.7284, test_loss: 1.3158, test_f1: 0.5880
 epoch: 49, train_loss: 0.7280, test_loss: 1.5351, test_f1: 0.5669
 epoch: 50, train_loss: 0.7869, test_loss: 1.9573, test_f1: 0.5216
 epoch: 51, train_loss: 0.7797, test_loss: 1.7535, test_f1: 0.5571
 epoch: 52, train_loss: 0.7448, test_loss: 1.4927, test_f1: 0.5455
 epoch: 53, train_loss: 0.7133, test_loss: 1.3724, test_f1: 0.6081
 epoch: 54, train_loss: 0.7059, test_loss: 1.4136, test_f1: 0.5737
 epoch: 55, train_loss: 0.7123, test_loss: 1.4583, test_f1: 0.5802
 epoch: 56, train_loss: 0.6925, test_loss: 1.5708, test_f1: 0.6048
 epoch: 57, train_loss: 0.6805, test_loss: 1.3493, test_f1: 0.6088
 epoch: 58, train_loss: 0.6729, test_loss: 1.4076, test_f1: 0.5930
 epoch: 59, train_loss: 0.6624, test_loss: 1.5889, test_f1: 0.5908
 epoch: 60, train_loss: 0.6873, test_loss: 1.6571, test_f1: 0.5794
 epoch: 61, train_loss: 0.6610, test_loss: 1.6009, test_f1: 0.5664
 epoch: 62, train_loss: 0.6517, test_loss: 1.4533, test_f1: 0.6192
 epoch: 63, train_loss: 0.6658, test_loss: 1.3813, test_f1: 0.6014
 epoch: 64, train_loss: 0.6894, test_loss: 1.2892, test_f1: 0.5969
 epoch: 65, train_loss: 0.6896, test_loss: 1.3154, test_f1: 0.5452
 epoch: 66, train_loss: 0.6657, test_loss: 1.6604, test_f1: 0.5770
 epoch: 67, train_loss: 0.6523, test_loss: 1.7639, test_f1: 0.5982
 epoch: 68, train_loss: 0.6332, test_loss: 1.9209, test_f1: 0.4665
 epoch: 69, train_loss: 0.6528, test_loss: 2.2428, test_f1: 0.5079
 epoch: 70, train_loss: 0.6687, test_loss: 1.9486, test_f1: 0.5389
 epoch: 71, train_loss: 0.6421, test_loss: 1.7189, test_f1: 0.5902
 epoch: 72, train_loss: 0.6345, test_loss: 1.8101, test_f1: 0.5854
 epoch: 73, train_loss: 0.6190, test_loss: 1.8779, test_f1: 0.6135
 epoch: 74, train_loss: 0.6644, test_loss: 1.9341, test_f1: 0.5383
 epoch: 75, train_loss: 0.6198, test_loss: 1.9779, test_f1: 0.5703
 epoch: 76, train_loss: 0.6120, test_loss: 1.8656, test_f1: 0.6139
 epoch: 77, train_loss: 0.5863, test_loss: 1.9116, test_f1: 0.6074
 epoch: 78, train_loss: 0.5874, test_loss: 1.8423, test_f1: 0.5662
 epoch: 79, train_loss: 0.5996, test_loss: 1.8535, test_f1: 0.5491
 epoch: 80, train_loss: 0.5864, test_loss: 2.1426, test_f1: 0.5908
 epoch: 81, train_loss: 0.5730, test_loss: 1.9082, test_f1: 0.6118
 epoch: 82, train_loss: 0.5581, test_loss: 2.0843, test_f1: 0.5854
 epoch: 83, train_loss: 0.5923, test_loss: 2.1473, test_f1: 0.6105
 epoch: 84, train_loss: 0.5593, test_loss: 2.1745, test_f1: 0.5887
 epoch: 85, train_loss: 0.5850, test_loss: 2.2397, test_f1: 0.5845
 epoch: 86, train_loss: 0.5701, test_loss: 2.2728, test_f1: 0.5393
 epoch: 87, train_loss: 0.5625, test_loss: 2.2286, test_f1: 0.6025
 epoch: 88, train_loss: 0.5776, test_loss: 2.3470, test_f1: 0.6028
 epoch: 89, train_loss: 0.5561, test_loss: 2.5128, test_f1: 0.5863
 epoch: 90, train_loss: 0.5495, test_loss: 2.4473, test_f1: 0.5344
 epoch: 91, train_loss: 0.5635, test_loss: 2.5086, test_f1: 0.5399
 epoch: 92, train_loss: 0.5498, test_loss: 2.4788, test_f1: 0.6126
 epoch: 93, train_loss: 0.5567, test_loss: 2.2978, test_f1: 0.5922
 epoch: 94, train_loss: 0.5588, test_loss: 1.8337, test_f1: 0.6032
 epoch: 95, train_loss: 0.5613, test_loss: 1.8269, test_f1: 0.6262
 epoch: 96, train_loss: 0.5385, test_loss: 2.4799, test_f1: 0.5995
 epoch: 97, train_loss: 0.5776, test_loss: 2.2942, test_f1: 0.6216
 epoch: 98, train_loss: 0.5645, test_loss: 2.0555, test_f1: 0.6259
 epoch: 99, train_loss: 0.5375, test_loss: 1.8882, test_f1: 0.6151
##################ITERATION #1 ****************************************
 epoch: 0, train_loss: 1.2961, test_loss: 1.3855, test_f1: 0.2248
 epoch: 1, train_loss: 1.1758, test_loss: 1.3422, test_f1: 0.2281
 epoch: 2, train_loss: 1.1423, test_loss: 1.2948, test_f1: 0.2662
 epoch: 3, train_loss: 1.1152, test_loss: 1.2990, test_f1: 0.3586
 epoch: 4, train_loss: 1.0944, test_loss: 1.2422, test_f1: 0.2982
 epoch: 5, train_loss: 1.0770, test_loss: 1.2462, test_f1: 0.4229
 epoch: 6, train_loss: 1.0551, test_loss: 1.3471, test_f1: 0.3226
 epoch: 7, train_loss: 1.0538, test_loss: 1.2144, test_f1: 0.3353
 epoch: 8, train_loss: 1.0148, test_loss: 1.2068, test_f1: 0.5125
 epoch: 9, train_loss: 1.0110, test_loss: 1.2044, test_f1: 0.3626
 epoch: 10, train_loss: 0.9834, test_loss: 1.3091, test_f1: 0.4486
 epoch: 11, train_loss: 0.9587, test_loss: 1.4351, test_f1: 0.5177
 epoch: 12, train_loss: 0.9527, test_loss: 1.3466, test_f1: 0.4252
 epoch: 13, train_loss: 0.9551, test_loss: 1.2725, test_f1: 0.4733
 epoch: 14, train_loss: 0.9373, test_loss: 1.1343, test_f1: 0.5307
 epoch: 15, train_loss: 0.9312, test_loss: 1.1336, test_f1: 0.5354
 epoch: 16, train_loss: 0.9044, test_loss: 1.1356, test_f1: 0.5517
 epoch: 17, train_loss: 0.8723, test_loss: 1.1968, test_f1: 0.5441
 epoch: 18, train_loss: 0.8908, test_loss: 1.1481, test_f1: 0.5566
 epoch: 19, train_loss: 0.8873, test_loss: 1.3296, test_f1: 0.5222
 epoch: 20, train_loss: 0.8639, test_loss: 1.5195, test_f1: 0.4466
 epoch: 21, train_loss: 0.8320, test_loss: 1.2044, test_f1: 0.5849
 epoch: 22, train_loss: 0.8152, test_loss: 1.2812, test_f1: 0.5038
 epoch: 23, train_loss: 0.8146, test_loss: 1.1180, test_f1: 0.4694
 epoch: 24, train_loss: 0.8158, test_loss: 1.0388, test_f1: 0.5049
 epoch: 25, train_loss: 0.8574, test_loss: 1.0915, test_f1: 0.5359
 epoch: 26, train_loss: 0.8618, test_loss: 1.0925, test_f1: 0.5068
 epoch: 27, train_loss: 0.8369, test_loss: 1.2655, test_f1: 0.4734
 epoch: 28, train_loss: 0.8725, test_loss: 1.1117, test_f1: 0.5233
 epoch: 29, train_loss: 0.8402, test_loss: 1.1004, test_f1: 0.4806
 epoch: 30, train_loss: 0.8437, test_loss: 1.1867, test_f1: 0.4787
 epoch: 31, train_loss: 0.8582, test_loss: 1.1490, test_f1: 0.4771
 epoch: 32, train_loss: 0.8364, test_loss: 1.2139, test_f1: 0.4570
 epoch: 33, train_loss: 0.8205, test_loss: 1.3209, test_f1: 0.5256
 epoch: 34, train_loss: 0.8261, test_loss: 1.2673, test_f1: 0.5765
 epoch: 35, train_loss: 0.8420, test_loss: 1.7654, test_f1: 0.5349
 epoch: 36, train_loss: 0.8118, test_loss: 1.5293, test_f1: 0.5811
 epoch: 37, train_loss: 0.7979, test_loss: 1.4403, test_f1: 0.5014
 epoch: 38, train_loss: 0.7817, test_loss: 1.4424, test_f1: 0.4721
 epoch: 39, train_loss: 0.7686, test_loss: 1.2959, test_f1: 0.5650
 epoch: 40, train_loss: 0.7907, test_loss: 1.0934, test_f1: 0.5760
 epoch: 41, train_loss: 0.7699, test_loss: 1.0374, test_f1: 0.5510
 epoch: 42, train_loss: 0.7769, test_loss: 1.0631, test_f1: 0.5735
 epoch: 43, train_loss: 0.7816, test_loss: 1.0886, test_f1: 0.5529
 epoch: 44, train_loss: 0.8017, test_loss: 1.0622, test_f1: 0.5818
 epoch: 45, train_loss: 0.7795, test_loss: 1.1174, test_f1: 0.5834
 epoch: 46, train_loss: 0.7974, test_loss: 1.3162, test_f1: 0.5226
 epoch: 47, train_loss: 0.7830, test_loss: 1.2321, test_f1: 0.5462
 epoch: 48, train_loss: 0.7560, test_loss: 1.1424, test_f1: 0.5911
 epoch: 49, train_loss: 0.7247, test_loss: 1.2808, test_f1: 0.5721
 epoch: 50, train_loss: 0.7394, test_loss: 1.2222, test_f1: 0.5409
 epoch: 51, train_loss: 0.7161, test_loss: 1.1513, test_f1: 0.5648
 epoch: 52, train_loss: 0.7085, test_loss: 1.1646, test_f1: 0.5748
 epoch: 53, train_loss: 0.6877, test_loss: 1.2911, test_f1: 0.5576
 epoch: 54, train_loss: 0.6840, test_loss: 1.2610, test_f1: 0.5964
 epoch: 55, train_loss: 0.6837, test_loss: 1.3040, test_f1: 0.5770
 epoch: 56, train_loss: 0.7039, test_loss: 1.2759, test_f1: 0.5718
 epoch: 57, train_loss: 0.6753, test_loss: 1.3924, test_f1: 0.5627
 epoch: 58, train_loss: 0.6661, test_loss: 1.2779, test_f1: 0.5695
 epoch: 59, train_loss: 0.6572, test_loss: 1.2387, test_f1: 0.6188
 epoch: 60, train_loss: 0.6380, test_loss: 1.2572, test_f1: 0.5669
 epoch: 61, train_loss: 0.6259, test_loss: 1.3508, test_f1: 0.5689
 epoch: 62, train_loss: 0.6151, test_loss: 1.4043, test_f1: 0.5728
 epoch: 63, train_loss: 0.6051, test_loss: 1.4390, test_f1: 0.5706
 epoch: 64, train_loss: 0.6212, test_loss: 1.4284, test_f1: 0.5879
 epoch: 65, train_loss: 0.6454, test_loss: 1.4376, test_f1: 0.5589
 epoch: 66, train_loss: 0.6344, test_loss: 1.3080, test_f1: 0.5920
 epoch: 67, train_loss: 0.6157, test_loss: 1.3404, test_f1: 0.5850
 epoch: 68, train_loss: 0.6264, test_loss: 1.4190, test_f1: 0.5743
 epoch: 69, train_loss: 0.6229, test_loss: 1.2666, test_f1: 0.5860
 epoch: 70, train_loss: 0.6136, test_loss: 1.3305, test_f1: 0.5887
 epoch: 71, train_loss: 0.6140, test_loss: 1.5594, test_f1: 0.5406
 epoch: 72, train_loss: 0.6199, test_loss: 1.2877, test_f1: 0.6039
 epoch: 73, train_loss: 0.6139, test_loss: 1.3508, test_f1: 0.5453
 epoch: 74, train_loss: 0.6144, test_loss: 1.5333, test_f1: 0.5327
 epoch: 75, train_loss: 0.6392, test_loss: 1.4884, test_f1: 0.5801
 epoch: 76, train_loss: 0.6507, test_loss: 1.8245, test_f1: 0.5976
 epoch: 77, train_loss: 0.6685, test_loss: 1.9107, test_f1: 0.5593
 epoch: 78, train_loss: 0.6544, test_loss: 1.7415, test_f1: 0.5461
 epoch: 79, train_loss: 0.6394, test_loss: 2.0634, test_f1: 0.5731
 epoch: 80, train_loss: 0.6023, test_loss: 2.0473, test_f1: 0.5464
 epoch: 81, train_loss: 0.6165, test_loss: 1.8406, test_f1: 0.5828
 epoch: 82, train_loss: 0.5782, test_loss: 1.9806, test_f1: 0.5549
 epoch: 83, train_loss: 0.5734, test_loss: 2.2215, test_f1: 0.5918
 epoch: 84, train_loss: 0.5679, test_loss: 2.1021, test_f1: 0.5810
 epoch: 85, train_loss: 0.5696, test_loss: 2.6182, test_f1: 0.5921
 epoch: 86, train_loss: 0.5806, test_loss: 2.4626, test_f1: 0.5578
 epoch: 87, train_loss: 0.5685, test_loss: 2.5300, test_f1: 0.6080
 epoch: 88, train_loss: 0.5598, test_loss: 2.2563, test_f1: 0.5958
 epoch: 89, train_loss: 0.5737, test_loss: 1.7968, test_f1: 0.6049
 epoch: 90, train_loss: 0.5641, test_loss: 1.8626, test_f1: 0.5199
 epoch: 91, train_loss: 0.5631, test_loss: 1.7985, test_f1: 0.5791
 epoch: 92, train_loss: 0.5704, test_loss: 1.6745, test_f1: 0.5776
 epoch: 93, train_loss: 0.5807, test_loss: 1.7481, test_f1: 0.5747
 epoch: 94, train_loss: 0.5567, test_loss: 1.7903, test_f1: 0.5609
 epoch: 95, train_loss: 0.5568, test_loss: 1.7027, test_f1: 0.6193
 epoch: 96, train_loss: 0.5680, test_loss: 1.6496, test_f1: 0.6422
 epoch: 97, train_loss: 0.5467, test_loss: 1.7564, test_f1: 0.5913
 epoch: 98, train_loss: 0.5732, test_loss: 1.8474, test_f1: 0.5688
 epoch: 99, train_loss: 0.5431, test_loss: 1.7051, test_f1: 0.5857
##################ITERATION #2 ****************************************
 epoch: 0, train_loss: 1.2753, test_loss: 1.3269, test_f1: 0.3066
 epoch: 1, train_loss: 1.1468, test_loss: 1.2888, test_f1: 0.2713
 epoch: 2, train_loss: 1.1236, test_loss: 1.2592, test_f1: 0.3910
 epoch: 3, train_loss: 1.0812, test_loss: 1.2458, test_f1: 0.2988
 epoch: 4, train_loss: 1.0728, test_loss: 1.2282, test_f1: 0.4121
 epoch: 5, train_loss: 1.0571, test_loss: 1.2354, test_f1: 0.4438
 epoch: 6, train_loss: 1.0353, test_loss: 1.2685, test_f1: 0.4300
 epoch: 7, train_loss: 1.0015, test_loss: 1.2084, test_f1: 0.4131
 epoch: 8, train_loss: 0.9646, test_loss: 1.1875, test_f1: 0.4593
 epoch: 9, train_loss: 0.9713, test_loss: 1.2610, test_f1: 0.4309
 epoch: 10, train_loss: 0.9431, test_loss: 1.1192, test_f1: 0.5524
 epoch: 11, train_loss: 0.9501, test_loss: 1.2074, test_f1: 0.4454
 epoch: 12, train_loss: 0.9507, test_loss: 1.2784, test_f1: 0.5001
 epoch: 13, train_loss: 0.9441, test_loss: 1.2560, test_f1: 0.4628
 epoch: 14, train_loss: 0.9162, test_loss: 1.2368, test_f1: 0.4825
 epoch: 15, train_loss: 0.9380, test_loss: 1.2541, test_f1: 0.4484
 epoch: 16, train_loss: 0.9002, test_loss: 1.2149, test_f1: 0.4953
 epoch: 17, train_loss: 0.8878, test_loss: 1.1713, test_f1: 0.5231
 epoch: 18, train_loss: 0.8829, test_loss: 1.0902, test_f1: 0.5526
 epoch: 19, train_loss: 0.8905, test_loss: 1.3552, test_f1: 0.4735
 epoch: 20, train_loss: 0.8910, test_loss: 1.1305, test_f1: 0.5101
 epoch: 21, train_loss: 0.9114, test_loss: 1.3222, test_f1: 0.4665
 epoch: 22, train_loss: 0.9524, test_loss: 1.2800, test_f1: 0.4395
 epoch: 23, train_loss: 0.9203, test_loss: 1.3655, test_f1: 0.4716
 epoch: 24, train_loss: 0.8934, test_loss: 1.1075, test_f1: 0.5006
 epoch: 25, train_loss: 0.8844, test_loss: 1.1167, test_f1: 0.5498
 epoch: 26, train_loss: 0.8618, test_loss: 1.3117, test_f1: 0.4716
 epoch: 27, train_loss: 0.8753, test_loss: 1.3120, test_f1: 0.4799
 epoch: 28, train_loss: 0.8523, test_loss: 1.0761, test_f1: 0.5570
 epoch: 29, train_loss: 0.8602, test_loss: 1.1315, test_f1: 0.4796
 epoch: 30, train_loss: 0.8716, test_loss: 1.1562, test_f1: 0.5531
 epoch: 31, train_loss: 0.8645, test_loss: 1.1155, test_f1: 0.5183
 epoch: 32, train_loss: 0.8412, test_loss: 1.5864, test_f1: 0.4560
 epoch: 33, train_loss: 0.8468, test_loss: 1.2204, test_f1: 0.4388
 epoch: 34, train_loss: 0.8760, test_loss: 1.1470, test_f1: 0.4281
 epoch: 35, train_loss: 0.8627, test_loss: 1.1366, test_f1: 0.4592
 epoch: 36, train_loss: 0.8380, test_loss: 1.2121, test_f1: 0.4318
 epoch: 37, train_loss: 0.8351, test_loss: 1.0920, test_f1: 0.4733
 epoch: 38, train_loss: 0.8462, test_loss: 1.0792, test_f1: 0.5421
 epoch: 39, train_loss: 0.8094, test_loss: 1.0572, test_f1: 0.5641
 epoch: 40, train_loss: 0.7895, test_loss: 1.0738, test_f1: 0.5543
 epoch: 41, train_loss: 0.8226, test_loss: 1.1618, test_f1: 0.4794
 epoch: 42, train_loss: 0.7920, test_loss: 1.1395, test_f1: 0.5163
 epoch: 43, train_loss: 0.8015, test_loss: 1.1021, test_f1: 0.5383
 epoch: 44, train_loss: 0.7756, test_loss: 1.1970, test_f1: 0.5123
 epoch: 45, train_loss: 0.7926, test_loss: 1.2631, test_f1: 0.5502
 epoch: 46, train_loss: 0.7817, test_loss: 1.1494, test_f1: 0.5238
 epoch: 47, train_loss: 0.7604, test_loss: 1.2346, test_f1: 0.5428
 epoch: 48, train_loss: 0.7605, test_loss: 1.3359, test_f1: 0.5314
 epoch: 49, train_loss: 0.7663, test_loss: 1.1412, test_f1: 0.5386
 epoch: 50, train_loss: 0.8065, test_loss: 1.0334, test_f1: 0.5594
 epoch: 51, train_loss: 0.7836, test_loss: 1.0297, test_f1: 0.5482
 epoch: 52, train_loss: 0.7546, test_loss: 1.1183, test_f1: 0.5464
 epoch: 53, train_loss: 0.7570, test_loss: 1.1558, test_f1: 0.5529
 epoch: 54, train_loss: 0.7402, test_loss: 1.1606, test_f1: 0.5502
 epoch: 55, train_loss: 0.7577, test_loss: 1.1110, test_f1: 0.5662
 epoch: 56, train_loss: 0.7454, test_loss: 1.2360, test_f1: 0.5357
 epoch: 57, train_loss: 0.7405, test_loss: 1.3356, test_f1: 0.5315
 epoch: 58, train_loss: 0.7356, test_loss: 1.1078, test_f1: 0.5455
 epoch: 59, train_loss: 0.7301, test_loss: 1.1432, test_f1: 0.5396
 epoch: 60, train_loss: 0.7185, test_loss: 1.1770, test_f1: 0.5460
 epoch: 61, train_loss: 0.7147, test_loss: 1.2225, test_f1: 0.5193
 epoch: 62, train_loss: 0.7259, test_loss: 1.2445, test_f1: 0.5478
 epoch: 63, train_loss: 0.7181, test_loss: 1.2338, test_f1: 0.5535
 epoch: 64, train_loss: 0.7014, test_loss: 1.2071, test_f1: 0.5583
 epoch: 65, train_loss: 0.7178, test_loss: 1.2238, test_f1: 0.5729
 epoch: 66, train_loss: 0.7235, test_loss: 1.3287, test_f1: 0.5190
 epoch: 67, train_loss: 0.7342, test_loss: 1.3331, test_f1: 0.5453
 epoch: 68, train_loss: 0.7276, test_loss: 1.2468, test_f1: 0.5348
 epoch: 69, train_loss: 0.7142, test_loss: 1.2047, test_f1: 0.5401
 epoch: 70, train_loss: 0.7143, test_loss: 1.2374, test_f1: 0.5096
 epoch: 71, train_loss: 0.7177, test_loss: 1.1707, test_f1: 0.4960
 epoch: 72, train_loss: 0.7129, test_loss: 1.3003, test_f1: 0.5019
 epoch: 73, train_loss: 0.7079, test_loss: 1.3554, test_f1: 0.5456
 epoch: 74, train_loss: 0.6974, test_loss: 1.3733, test_f1: 0.5521
 epoch: 75, train_loss: 0.6883, test_loss: 1.3452, test_f1: 0.5275
 epoch: 76, train_loss: 0.7979, test_loss: 1.4086, test_f1: 0.5276
 epoch: 77, train_loss: 0.7539, test_loss: 1.1911, test_f1: 0.5825
 epoch: 78, train_loss: 0.7412, test_loss: 1.2114, test_f1: 0.5504
 epoch: 79, train_loss: 0.7241, test_loss: 1.2612, test_f1: 0.5638
 epoch: 80, train_loss: 0.7013, test_loss: 1.4884, test_f1: 0.5392
 epoch: 81, train_loss: 0.7116, test_loss: 1.3472, test_f1: 0.5496
 epoch: 82, train_loss: 0.6913, test_loss: 1.4643, test_f1: 0.5647
 epoch: 83, train_loss: 0.6741, test_loss: 1.6014, test_f1: 0.5491
 epoch: 84, train_loss: 0.6857, test_loss: 1.7732, test_f1: 0.5379
 epoch: 85, train_loss: 0.7351, test_loss: 1.8161, test_f1: 0.5234
 epoch: 86, train_loss: 0.7191, test_loss: 1.3122, test_f1: 0.5603
 epoch: 87, train_loss: 0.7092, test_loss: 1.2430, test_f1: 0.5345
 epoch: 88, train_loss: 0.7171, test_loss: 1.2932, test_f1: 0.5312
 epoch: 89, train_loss: 0.7062, test_loss: 1.4153, test_f1: 0.5287
 epoch: 90, train_loss: 0.6965, test_loss: 1.3556, test_f1: 0.5407
 epoch: 91, train_loss: 0.6928, test_loss: 1.2061, test_f1: 0.5327
 epoch: 92, train_loss: 0.6789, test_loss: 1.2002, test_f1: 0.5603
 epoch: 93, train_loss: 0.6669, test_loss: 1.2456, test_f1: 0.5609
 epoch: 94, train_loss: 0.6845, test_loss: 1.4347, test_f1: 0.5567
 epoch: 95, train_loss: 0.6720, test_loss: 1.3388, test_f1: 0.5627
 epoch: 96, train_loss: 0.6650, test_loss: 1.3289, test_f1: 0.5619
 epoch: 97, train_loss: 0.6719, test_loss: 1.2935, test_f1: 0.5518
 epoch: 98, train_loss: 0.6644, test_loss: 1.3280, test_f1: 0.5624
 epoch: 99, train_loss: 0.6454, test_loss: 1.3238, test_f1: 0.5451
##################ITERATION #3 ****************************************
 epoch: 0, train_loss: 1.3232, test_loss: 1.4600, test_f1: 0.1520
 epoch: 1, train_loss: 1.1734, test_loss: 1.3154, test_f1: 0.3582
 epoch: 2, train_loss: 1.1245, test_loss: 1.3079, test_f1: 0.3322
 epoch: 3, train_loss: 1.0847, test_loss: 1.2970, test_f1: 0.3531
 epoch: 4, train_loss: 1.0531, test_loss: 1.3374, test_f1: 0.2568
 epoch: 5, train_loss: 1.0728, test_loss: 1.1743, test_f1: 0.4479
 epoch: 6, train_loss: 1.0232, test_loss: 1.1506, test_f1: 0.5458
 epoch: 7, train_loss: 0.9912, test_loss: 1.2072, test_f1: 0.4577
 epoch: 8, train_loss: 0.9547, test_loss: 1.1895, test_f1: 0.4168
 epoch: 9, train_loss: 0.9513, test_loss: 1.1940, test_f1: 0.4244
 epoch: 10, train_loss: 0.9685, test_loss: 1.2171, test_f1: 0.4741
 epoch: 11, train_loss: 0.9199, test_loss: 1.0986, test_f1: 0.5213
 epoch: 12, train_loss: 0.8985, test_loss: 1.2865, test_f1: 0.4452
 epoch: 13, train_loss: 0.8732, test_loss: 1.2203, test_f1: 0.4724
 epoch: 14, train_loss: 0.8488, test_loss: 1.2930, test_f1: 0.4685
 epoch: 15, train_loss: 0.8470, test_loss: 1.0810, test_f1: 0.5470
 epoch: 16, train_loss: 0.8241, test_loss: 1.1122, test_f1: 0.5195
 epoch: 17, train_loss: 0.8588, test_loss: 1.1223, test_f1: 0.5788
 epoch: 18, train_loss: 0.8451, test_loss: 1.2507, test_f1: 0.5350
 epoch: 19, train_loss: 0.8729, test_loss: 1.0568, test_f1: 0.4931
 epoch: 20, train_loss: 0.8612, test_loss: 1.4269, test_f1: 0.4550
 epoch: 21, train_loss: 0.8655, test_loss: 1.2658, test_f1: 0.4154
 epoch: 22, train_loss: 0.8236, test_loss: 1.1163, test_f1: 0.5759
 epoch: 23, train_loss: 0.8320, test_loss: 1.1412, test_f1: 0.5446
 epoch: 24, train_loss: 0.8144, test_loss: 1.0669, test_f1: 0.5863
 epoch: 25, train_loss: 0.7842, test_loss: 1.1664, test_f1: 0.5692
 epoch: 26, train_loss: 0.7571, test_loss: 1.1522, test_f1: 0.5286
 epoch: 27, train_loss: 0.7410, test_loss: 1.1377, test_f1: 0.6437
 epoch: 28, train_loss: 0.7531, test_loss: 1.3216, test_f1: 0.5994
 epoch: 29, train_loss: 0.7795, test_loss: 1.2679, test_f1: 0.5263
 epoch: 30, train_loss: 0.7524, test_loss: 1.1593, test_f1: 0.5477
 epoch: 31, train_loss: 0.7793, test_loss: 1.2287, test_f1: 0.5115
 epoch: 32, train_loss: 0.7722, test_loss: 1.1771, test_f1: 0.5680
 epoch: 33, train_loss: 0.7973, test_loss: 1.1054, test_f1: 0.5917
 epoch: 34, train_loss: 0.8249, test_loss: 1.4693, test_f1: 0.3819
 epoch: 35, train_loss: 0.8247, test_loss: 1.1643, test_f1: 0.5002
 epoch: 36, train_loss: 0.7773, test_loss: 1.1343, test_f1: 0.5166
 epoch: 37, train_loss: 0.8132, test_loss: 1.0775, test_f1: 0.5433
 epoch: 38, train_loss: 0.8225, test_loss: 1.1316, test_f1: 0.5241
 epoch: 39, train_loss: 0.7530, test_loss: 1.3426, test_f1: 0.4537
 epoch: 40, train_loss: 0.7481, test_loss: 1.1257, test_f1: 0.5749
 epoch: 41, train_loss: 0.7224, test_loss: 1.1595, test_f1: 0.4936
 epoch: 42, train_loss: 0.7272, test_loss: 1.0473, test_f1: 0.5621
 epoch: 43, train_loss: 0.7191, test_loss: 1.0658, test_f1: 0.5306
 epoch: 44, train_loss: 0.7175, test_loss: 1.2373, test_f1: 0.5009
 epoch: 45, train_loss: 0.7326, test_loss: 1.2546, test_f1: 0.5829
 epoch: 46, train_loss: 0.7347, test_loss: 1.4569, test_f1: 0.5568
 epoch: 47, train_loss: 0.7651, test_loss: 1.2577, test_f1: 0.5958
 epoch: 48, train_loss: 0.7438, test_loss: 1.2814, test_f1: 0.5264
 epoch: 49, train_loss: 0.7559, test_loss: 1.1232, test_f1: 0.5777
 epoch: 50, train_loss: 0.7226, test_loss: 0.9740, test_f1: 0.6102
 epoch: 51, train_loss: 0.6963, test_loss: 0.9810, test_f1: 0.6131
 epoch: 52, train_loss: 0.6681, test_loss: 0.9924, test_f1: 0.6020
 epoch: 53, train_loss: 0.6403, test_loss: 1.0821, test_f1: 0.5802
 epoch: 54, train_loss: 0.6594, test_loss: 1.2221, test_f1: 0.5119
 epoch: 55, train_loss: 0.6670, test_loss: 1.2410, test_f1: 0.5034
 epoch: 56, train_loss: 0.6713, test_loss: 1.1920, test_f1: 0.6156
 epoch: 57, train_loss: 0.6354, test_loss: 1.2310, test_f1: 0.5765
 epoch: 58, train_loss: 0.6551, test_loss: 1.1898, test_f1: 0.5657
 epoch: 59, train_loss: 0.6414, test_loss: 1.1372, test_f1: 0.5371
 epoch: 60, train_loss: 0.6367, test_loss: 1.6701, test_f1: 0.4414
 epoch: 61, train_loss: 0.6427, test_loss: 1.3114, test_f1: 0.4597
 epoch: 62, train_loss: 0.6187, test_loss: 1.1818, test_f1: 0.6178
 epoch: 63, train_loss: 0.6370, test_loss: 1.2313, test_f1: 0.5916
 epoch: 64, train_loss: 0.6113, test_loss: 1.2180, test_f1: 0.6068
 epoch: 65, train_loss: 0.6057, test_loss: 1.2327, test_f1: 0.5650
 epoch: 66, train_loss: 0.6109, test_loss: 1.2217, test_f1: 0.5810
 epoch: 67, train_loss: 0.5820, test_loss: 1.2139, test_f1: 0.6011
 epoch: 68, train_loss: 0.5809, test_loss: 1.2370, test_f1: 0.5935
 epoch: 69, train_loss: 0.5893, test_loss: 1.3152, test_f1: 0.5787
 epoch: 70, train_loss: 0.6122, test_loss: 1.4807, test_f1: 0.5878
 epoch: 71, train_loss: 0.6540, test_loss: 1.6509, test_f1: 0.5150
 epoch: 72, train_loss: 0.6566, test_loss: 1.3759, test_f1: 0.5439
 epoch: 73, train_loss: 0.6486, test_loss: 1.2265, test_f1: 0.5481
 epoch: 74, train_loss: 0.6413, test_loss: 1.3404, test_f1: 0.5786
 epoch: 75, train_loss: 0.5964, test_loss: 1.1942, test_f1: 0.6032
 epoch: 76, train_loss: 0.5856, test_loss: 1.1882, test_f1: 0.6110
 epoch: 77, train_loss: 0.5912, test_loss: 1.1924, test_f1: 0.6210
 epoch: 78, train_loss: 0.5920, test_loss: 1.5448, test_f1: 0.5387
 epoch: 79, train_loss: 0.5982, test_loss: 1.5180, test_f1: 0.5735
 epoch: 80, train_loss: 0.5508, test_loss: 1.2443, test_f1: 0.6024
 epoch: 81, train_loss: 0.5846, test_loss: 1.4323, test_f1: 0.5606
 epoch: 82, train_loss: 0.5884, test_loss: 1.3602, test_f1: 0.5741
 epoch: 83, train_loss: 0.5702, test_loss: 1.1971, test_f1: 0.5852
 epoch: 84, train_loss: 0.5589, test_loss: 1.3504, test_f1: 0.5605
 epoch: 85, train_loss: 0.5481, test_loss: 1.3789, test_f1: 0.5903
 epoch: 86, train_loss: 0.5477, test_loss: 1.1573, test_f1: 0.6236
 epoch: 87, train_loss: 0.5516, test_loss: 1.1442, test_f1: 0.6461
 epoch: 88, train_loss: 0.5427, test_loss: 1.2422, test_f1: 0.6149
 epoch: 89, train_loss: 0.5604, test_loss: 1.3396, test_f1: 0.5716
 epoch: 90, train_loss: 0.5876, test_loss: 1.3386, test_f1: 0.5866
 epoch: 91, train_loss: 0.5522, test_loss: 1.2864, test_f1: 0.6310
 epoch: 92, train_loss: 0.5421, test_loss: 1.2914, test_f1: 0.5953
 epoch: 93, train_loss: 0.5528, test_loss: 1.2795, test_f1: 0.5671
 epoch: 94, train_loss: 0.5575, test_loss: 1.3017, test_f1: 0.5669
 epoch: 95, train_loss: 0.5641, test_loss: 1.3849, test_f1: 0.5827
 epoch: 96, train_loss: 0.5520, test_loss: 1.4297, test_f1: 0.5078
 epoch: 97, train_loss: 0.5243, test_loss: 1.1842, test_f1: 0.5834
 epoch: 98, train_loss: 0.5288, test_loss: 1.2084, test_f1: 0.5671
 epoch: 99, train_loss: 0.5135, test_loss: 1.2816, test_f1: 0.5445
##################ITERATION #4 ****************************************
 epoch: 0, train_loss: 1.2855, test_loss: 1.6183, test_f1: 0.2420
 epoch: 1, train_loss: 1.2010, test_loss: 1.4021, test_f1: 0.1411
 epoch: 2, train_loss: 1.1144, test_loss: 1.2712, test_f1: 0.3553
 epoch: 3, train_loss: 1.0713, test_loss: 1.2810, test_f1: 0.3340
 epoch: 4, train_loss: 1.0136, test_loss: 1.2806, test_f1: 0.4539
 epoch: 5, train_loss: 0.9708, test_loss: 1.2510, test_f1: 0.3766
 epoch: 6, train_loss: 0.9360, test_loss: 1.1685, test_f1: 0.4788
 epoch: 7, train_loss: 0.9315, test_loss: 1.1887, test_f1: 0.4937
 epoch: 8, train_loss: 0.8913, test_loss: 1.1386, test_f1: 0.4773
 epoch: 9, train_loss: 0.9236, test_loss: 1.1438, test_f1: 0.4990
 epoch: 10, train_loss: 0.9053, test_loss: 1.1815, test_f1: 0.4773
 epoch: 11, train_loss: 0.9039, test_loss: 1.1852, test_f1: 0.4734
 epoch: 12, train_loss: 0.8705, test_loss: 1.3511, test_f1: 0.4582
 epoch: 13, train_loss: 0.8689, test_loss: 1.1717, test_f1: 0.5386
 epoch: 14, train_loss: 0.8523, test_loss: 1.2247, test_f1: 0.5426
 epoch: 15, train_loss: 0.8390, test_loss: 1.1726, test_f1: 0.5664
 epoch: 16, train_loss: 0.8270, test_loss: 1.3311, test_f1: 0.4922
 epoch: 17, train_loss: 0.8549, test_loss: 1.2045, test_f1: 0.4749
 epoch: 18, train_loss: 0.8307, test_loss: 1.2101, test_f1: 0.5188
 epoch: 19, train_loss: 0.8055, test_loss: 1.3507, test_f1: 0.5140
 epoch: 20, train_loss: 0.7926, test_loss: 1.4847, test_f1: 0.4341
 epoch: 21, train_loss: 0.8104, test_loss: 1.1772, test_f1: 0.5090
 epoch: 22, train_loss: 0.8088, test_loss: 1.2554, test_f1: 0.5070
 epoch: 23, train_loss: 0.8012, test_loss: 1.1272, test_f1: 0.5060
 epoch: 24, train_loss: 0.8314, test_loss: 1.1747, test_f1: 0.5246
 epoch: 25, train_loss: 0.7983, test_loss: 1.3907, test_f1: 0.4818
 epoch: 26, train_loss: 0.7619, test_loss: 1.2046, test_f1: 0.5176
 epoch: 27, train_loss: 0.7992, test_loss: 1.1923, test_f1: 0.5327
 epoch: 28, train_loss: 0.7877, test_loss: 1.0343, test_f1: 0.5595
 epoch: 29, train_loss: 0.7987, test_loss: 1.0863, test_f1: 0.5237
 epoch: 30, train_loss: 0.8086, test_loss: 1.2184, test_f1: 0.4949
 epoch: 31, train_loss: 0.8082, test_loss: 2.8503, test_f1: 0.3653
 epoch: 32, train_loss: 0.8180, test_loss: 2.0301, test_f1: 0.4371
 epoch: 33, train_loss: 0.8039, test_loss: 1.2641, test_f1: 0.5563
 epoch: 34, train_loss: 0.8197, test_loss: 1.1456, test_f1: 0.5691
 epoch: 35, train_loss: 0.7914, test_loss: 1.0957, test_f1: 0.5616
 epoch: 36, train_loss: 0.7723, test_loss: 1.1883, test_f1: 0.4479
 epoch: 37, train_loss: 0.7530, test_loss: 1.0936, test_f1: 0.5953
 epoch: 38, train_loss: 0.7272, test_loss: 1.1132, test_f1: 0.5778
 epoch: 39, train_loss: 0.7398, test_loss: 1.1132, test_f1: 0.6025
 epoch: 40, train_loss: 0.7174, test_loss: 1.1034, test_f1: 0.5730
 epoch: 41, train_loss: 0.7117, test_loss: 1.1823, test_f1: 0.5587
 epoch: 42, train_loss: 0.7184, test_loss: 1.3987, test_f1: 0.4793
 epoch: 43, train_loss: 0.6978, test_loss: 1.3425, test_f1: 0.5718
 epoch: 44, train_loss: 0.7015, test_loss: 2.1421, test_f1: 0.5787
 epoch: 45, train_loss: 0.6981, test_loss: 1.8812, test_f1: 0.6057
 epoch: 46, train_loss: 0.7051, test_loss: 1.3924, test_f1: 0.5881
 epoch: 47, train_loss: 0.7453, test_loss: 1.1996, test_f1: 0.5599
 epoch: 48, train_loss: 0.7193, test_loss: 2.7580, test_f1: 0.5537
 epoch: 49, train_loss: 0.7268, test_loss: 2.7845, test_f1: 0.5598
 epoch: 50, train_loss: 0.7020, test_loss: 3.0304, test_f1: 0.5044
 epoch: 51, train_loss: 0.6915, test_loss: 1.6969, test_f1: 0.5921
 epoch: 52, train_loss: 0.6566, test_loss: 1.4895, test_f1: 0.6199
 epoch: 53, train_loss: 0.6599, test_loss: 1.3893, test_f1: 0.6085
 epoch: 54, train_loss: 0.6599, test_loss: 1.3519, test_f1: 0.5785
 epoch: 55, train_loss: 0.7187, test_loss: 1.5724, test_f1: 0.4856
 epoch: 56, train_loss: 0.7043, test_loss: 1.2378, test_f1: 0.5636
 epoch: 57, train_loss: 0.6682, test_loss: 1.1645, test_f1: 0.5867
 epoch: 58, train_loss: 0.6260, test_loss: 1.1193, test_f1: 0.5767
 epoch: 59, train_loss: 0.6320, test_loss: 1.1138, test_f1: 0.6000
 epoch: 60, train_loss: 0.6405, test_loss: 1.1391, test_f1: 0.5958
 epoch: 61, train_loss: 0.6553, test_loss: 1.1868, test_f1: 0.6186
 epoch: 62, train_loss: 0.6438, test_loss: 1.3613, test_f1: 0.5545
 epoch: 63, train_loss: 0.6133, test_loss: 1.2739, test_f1: 0.5784
 epoch: 64, train_loss: 0.6264, test_loss: 1.2312, test_f1: 0.6259
 epoch: 65, train_loss: 0.6472, test_loss: 1.1845, test_f1: 0.5987
 epoch: 66, train_loss: 0.5934, test_loss: 1.8261, test_f1: 0.5761
 epoch: 67, train_loss: 0.6108, test_loss: 1.4873, test_f1: 0.5938
 epoch: 68, train_loss: 0.6023, test_loss: 1.2134, test_f1: 0.6126
 epoch: 69, train_loss: 0.5954, test_loss: 1.3819, test_f1: 0.5620
 epoch: 70, train_loss: 0.5731, test_loss: 1.5190, test_f1: 0.5546
 epoch: 71, train_loss: 0.5668, test_loss: 1.5134, test_f1: 0.5362
 epoch: 72, train_loss: 0.6067, test_loss: 1.4803, test_f1: 0.6596
 epoch: 73, train_loss: 0.6219, test_loss: 1.4855, test_f1: 0.5790
 epoch: 74, train_loss: 0.6048, test_loss: 1.2989, test_f1: 0.5986
 epoch: 75, train_loss: 0.6168, test_loss: 1.1739, test_f1: 0.5799
 epoch: 76, train_loss: 0.6281, test_loss: 1.1207, test_f1: 0.6137
 epoch: 77, train_loss: 0.6068, test_loss: 1.3520, test_f1: 0.6147
 epoch: 78, train_loss: 0.6182, test_loss: 1.6669, test_f1: 0.5758
 epoch: 79, train_loss: 0.5962, test_loss: 1.3733, test_f1: 0.6147
 epoch: 80, train_loss: 0.5837, test_loss: 1.2718, test_f1: 0.6139
 epoch: 81, train_loss: 0.5657, test_loss: 1.5579, test_f1: 0.5589
 epoch: 82, train_loss: 0.5385, test_loss: 1.4385, test_f1: 0.5694
 epoch: 83, train_loss: 0.5508, test_loss: 1.3505, test_f1: 0.6282
 epoch: 84, train_loss: 0.5756, test_loss: 1.3457, test_f1: 0.6041
 epoch: 85, train_loss: 0.5607, test_loss: 1.4119, test_f1: 0.5614
 epoch: 86, train_loss: 0.5539, test_loss: 1.3871, test_f1: 0.5566
 epoch: 87, train_loss: 0.5506, test_loss: 1.3276, test_f1: 0.6039
 epoch: 88, train_loss: 0.5391, test_loss: 1.2678, test_f1: 0.6405
 epoch: 89, train_loss: 0.5338, test_loss: 1.3951, test_f1: 0.6240
 epoch: 90, train_loss: 0.5290, test_loss: 1.4882, test_f1: 0.6045
 epoch: 91, train_loss: 0.5294, test_loss: 1.3723, test_f1: 0.5711
 epoch: 92, train_loss: 0.5578, test_loss: 1.3734, test_f1: 0.5804
 epoch: 93, train_loss: 0.5361, test_loss: 1.5164, test_f1: 0.5592
 epoch: 94, train_loss: 0.5162, test_loss: 1.7261, test_f1: 0.6210
 epoch: 95, train_loss: 0.5322, test_loss: 1.6718, test_f1: 0.5927
 epoch: 96, train_loss: 0.5354, test_loss: 1.6148, test_f1: 0.5900
 epoch: 97, train_loss: 0.5175, test_loss: 1.6098, test_f1: 0.5944
 epoch: 98, train_loss: 0.5088, test_loss: 1.5900, test_f1: 0.5960
 epoch: 99, train_loss: 0.5363, test_loss: 1.6394, test_f1: 0.5715
##################ITERATION #5 ****************************************
 epoch: 0, train_loss: 1.3321, test_loss: 1.6631, test_f1: 0.2992
 epoch: 1, train_loss: 1.1942, test_loss: 1.3252, test_f1: 0.2991
 epoch: 2, train_loss: 1.1247, test_loss: 1.2662, test_f1: 0.3249
 epoch: 3, train_loss: 1.0963, test_loss: 1.2616, test_f1: 0.3971
 epoch: 4, train_loss: 1.0560, test_loss: 1.2568, test_f1: 0.4188
 epoch: 5, train_loss: 1.0553, test_loss: 1.2058, test_f1: 0.4237
 epoch: 6, train_loss: 1.0044, test_loss: 1.2178, test_f1: 0.4798
 epoch: 7, train_loss: 0.9906, test_loss: 1.2044, test_f1: 0.4374
 epoch: 8, train_loss: 0.9522, test_loss: 1.3922, test_f1: 0.4836
 epoch: 9, train_loss: 0.9306, test_loss: 1.1021, test_f1: 0.5820
 epoch: 10, train_loss: 0.9518, test_loss: 1.0534, test_f1: 0.5478
 epoch: 11, train_loss: 0.9247, test_loss: 1.1493, test_f1: 0.5307
 epoch: 12, train_loss: 0.9101, test_loss: 1.1649, test_f1: 0.5512
 epoch: 13, train_loss: 0.8754, test_loss: 1.1393, test_f1: 0.5634
 epoch: 14, train_loss: 0.8625, test_loss: 1.1745, test_f1: 0.5388
 epoch: 15, train_loss: 0.8394, test_loss: 1.1778, test_f1: 0.5168
 epoch: 16, train_loss: 0.8191, test_loss: 1.2966, test_f1: 0.5499
 epoch: 17, train_loss: 0.8422, test_loss: 1.3151, test_f1: 0.5640
 epoch: 18, train_loss: 0.8543, test_loss: 1.4118, test_f1: 0.4848
 epoch: 19, train_loss: 0.8740, test_loss: 1.1858, test_f1: 0.4914
 epoch: 20, train_loss: 0.8824, test_loss: 1.1431, test_f1: 0.5661
 epoch: 21, train_loss: 0.8278, test_loss: 1.3531, test_f1: 0.4920
 epoch: 22, train_loss: 0.8195, test_loss: 1.1419, test_f1: 0.5383
 epoch: 23, train_loss: 0.8174, test_loss: 1.1241, test_f1: 0.5847
 epoch: 24, train_loss: 0.8453, test_loss: 1.1280, test_f1: 0.5466
 epoch: 25, train_loss: 0.8404, test_loss: 1.1231, test_f1: 0.5435
 epoch: 26, train_loss: 0.7969, test_loss: 1.2054, test_f1: 0.5188
 epoch: 27, train_loss: 0.7862, test_loss: 1.1616, test_f1: 0.5492
 epoch: 28, train_loss: 0.7898, test_loss: 1.0396, test_f1: 0.5548
 epoch: 29, train_loss: 0.8300, test_loss: 1.0777, test_f1: 0.5886
 epoch: 30, train_loss: 0.8011, test_loss: 1.4731, test_f1: 0.5090
 epoch: 31, train_loss: 0.7816, test_loss: 1.1276, test_f1: 0.5829
 epoch: 32, train_loss: 0.7546, test_loss: 1.0900, test_f1: 0.5925
 epoch: 33, train_loss: 0.7404, test_loss: 1.1520, test_f1: 0.5260
 epoch: 34, train_loss: 0.7506, test_loss: 1.1547, test_f1: 0.5575
 epoch: 35, train_loss: 0.7463, test_loss: 1.2126, test_f1: 0.5853
 epoch: 36, train_loss: 0.7069, test_loss: 1.2450, test_f1: 0.5810
 epoch: 37, train_loss: 0.7039, test_loss: 1.1300, test_f1: 0.5918
 epoch: 38, train_loss: 0.6998, test_loss: 1.1895, test_f1: 0.5784
 epoch: 39, train_loss: 0.6990, test_loss: 1.3099, test_f1: 0.5355
 epoch: 40, train_loss: 0.7337, test_loss: 1.3325, test_f1: 0.5518
 epoch: 41, train_loss: 0.7396, test_loss: 1.1475, test_f1: 0.6093
 epoch: 42, train_loss: 0.7257, test_loss: 1.7056, test_f1: 0.5467
 epoch: 43, train_loss: 0.7137, test_loss: 1.5970, test_f1: 0.5393
 epoch: 44, train_loss: 0.7161, test_loss: 1.2886, test_f1: 0.5885
 epoch: 45, train_loss: 0.7008, test_loss: 1.3507, test_f1: 0.5511
 epoch: 46, train_loss: 0.6997, test_loss: 1.5492, test_f1: 0.5504
 epoch: 47, train_loss: 0.6966, test_loss: 1.4447, test_f1: 0.5632
 epoch: 48, train_loss: 0.7095, test_loss: 1.3760, test_f1: 0.6134
 epoch: 49, train_loss: 0.7026, test_loss: 1.2654, test_f1: 0.5792
 epoch: 50, train_loss: 0.7336, test_loss: 1.1378, test_f1: 0.6463
 epoch: 51, train_loss: 0.7080, test_loss: 1.1503, test_f1: 0.6195
 epoch: 52, train_loss: 0.6779, test_loss: 1.1092, test_f1: 0.5794
 epoch: 53, train_loss: 0.6572, test_loss: 1.0735, test_f1: 0.5935
 epoch: 54, train_loss: 0.6512, test_loss: 1.1508, test_f1: 0.6065
 epoch: 55, train_loss: 0.6239, test_loss: 1.2041, test_f1: 0.6072
 epoch: 56, train_loss: 0.6196, test_loss: 1.1890, test_f1: 0.6148
 epoch: 57, train_loss: 0.6171, test_loss: 1.2740, test_f1: 0.5830
 epoch: 58, train_loss: 0.6176, test_loss: 1.2293, test_f1: 0.6023
 epoch: 59, train_loss: 0.6072, test_loss: 1.2368, test_f1: 0.6090
 epoch: 60, train_loss: 0.5964, test_loss: 1.2328, test_f1: 0.5693
 epoch: 61, train_loss: 0.6042, test_loss: 1.1867, test_f1: 0.6615
 epoch: 62, train_loss: 0.5884, test_loss: 1.3258, test_f1: 0.6365
 epoch: 63, train_loss: 0.5725, test_loss: 1.2461, test_f1: 0.6496
 epoch: 64, train_loss: 0.5910, test_loss: 1.1792, test_f1: 0.6045
 epoch: 65, train_loss: 0.5764, test_loss: 1.2994, test_f1: 0.5859
 epoch: 66, train_loss: 0.5722, test_loss: 1.3421, test_f1: 0.5853
 epoch: 67, train_loss: 0.5632, test_loss: 1.2704, test_f1: 0.6054
 epoch: 68, train_loss: 0.5517, test_loss: 1.2451, test_f1: 0.6174
 epoch: 69, train_loss: 0.5494, test_loss: 1.3541, test_f1: 0.5997
 epoch: 70, train_loss: 0.5422, test_loss: 1.4085, test_f1: 0.5763
 epoch: 71, train_loss: 0.5434, test_loss: 1.4927, test_f1: 0.6103
 epoch: 72, train_loss: 0.5396, test_loss: 1.4152, test_f1: 0.6015
 epoch: 73, train_loss: 0.5931, test_loss: 1.4841, test_f1: 0.5652
 epoch: 74, train_loss: 0.6384, test_loss: 1.6207, test_f1: 0.6240
 epoch: 75, train_loss: 0.6425, test_loss: 1.5564, test_f1: 0.6176
 epoch: 76, train_loss: 0.6331, test_loss: 1.4637, test_f1: 0.5863
 epoch: 77, train_loss: 0.5985, test_loss: 1.4547, test_f1: 0.6217
 epoch: 78, train_loss: 0.5843, test_loss: 1.7557, test_f1: 0.5497
 epoch: 79, train_loss: 0.5791, test_loss: 1.7505, test_f1: 0.5726
 epoch: 80, train_loss: 0.5918, test_loss: 1.6213, test_f1: 0.5963
 epoch: 81, train_loss: 0.5656, test_loss: 1.6368, test_f1: 0.6125
 epoch: 82, train_loss: 0.5746, test_loss: 1.5135, test_f1: 0.5753
 epoch: 83, train_loss: 0.5549, test_loss: 1.4483, test_f1: 0.5608
 epoch: 84, train_loss: 0.5546, test_loss: 1.3412, test_f1: 0.6156
 epoch: 85, train_loss: 0.5626, test_loss: 1.4211, test_f1: 0.6053
 epoch: 86, train_loss: 0.5744, test_loss: 1.5199, test_f1: 0.5359
 epoch: 87, train_loss: 0.5474, test_loss: 1.5530, test_f1: 0.5556
 epoch: 88, train_loss: 0.5377, test_loss: 1.5319, test_f1: 0.5815
 epoch: 89, train_loss: 0.5246, test_loss: 1.4811, test_f1: 0.6116
 epoch: 90, train_loss: 0.5343, test_loss: 1.6998, test_f1: 0.6238
 epoch: 91, train_loss: 0.5182, test_loss: 1.8246, test_f1: 0.5749
 epoch: 92, train_loss: 0.5041, test_loss: 1.6640, test_f1: 0.5699
 epoch: 93, train_loss: 0.5320, test_loss: 1.6940, test_f1: 0.5703
 epoch: 94, train_loss: 0.5394, test_loss: 1.5160, test_f1: 0.6302
 epoch: 95, train_loss: 0.5381, test_loss: 1.7634, test_f1: 0.5786
 epoch: 96, train_loss: 0.5461, test_loss: 1.7897, test_f1: 0.6198
 epoch: 97, train_loss: 0.5279, test_loss: 1.7879, test_f1: 0.6139
 epoch: 98, train_loss: 0.5341, test_loss: 1.7538, test_f1: 0.5680
 epoch: 99, train_loss: 0.5118, test_loss: 1.6745, test_f1: 0.5780
##################ITERATION #6 ****************************************
 epoch: 0, train_loss: 1.3597, test_loss: 1.6506, test_f1: 0.2757
 epoch: 1, train_loss: 1.1802, test_loss: 1.4888, test_f1: 0.2864
 epoch: 2, train_loss: 1.1385, test_loss: 1.3055, test_f1: 0.3752
 epoch: 3, train_loss: 1.0848, test_loss: 1.3305, test_f1: 0.3875
 epoch: 4, train_loss: 1.0326, test_loss: 1.3636, test_f1: 0.4159
 epoch: 5, train_loss: 0.9776, test_loss: 1.4337, test_f1: 0.3632
 epoch: 6, train_loss: 0.9421, test_loss: 1.2384, test_f1: 0.3844
 epoch: 7, train_loss: 0.9452, test_loss: 1.3657, test_f1: 0.4083
 epoch: 8, train_loss: 0.8959, test_loss: 1.1517, test_f1: 0.5237
 epoch: 9, train_loss: 0.9034, test_loss: 1.1555, test_f1: 0.5047
 epoch: 10, train_loss: 0.9321, test_loss: 1.1694, test_f1: 0.4884
 epoch: 11, train_loss: 0.9212, test_loss: 1.2094, test_f1: 0.4924
 epoch: 12, train_loss: 0.8895, test_loss: 1.7359, test_f1: 0.4677
 epoch: 13, train_loss: 0.8943, test_loss: 1.2265, test_f1: 0.4900
 epoch: 14, train_loss: 0.8984, test_loss: 1.4135, test_f1: 0.4647
 epoch: 15, train_loss: 0.8624, test_loss: 1.0836, test_f1: 0.5806
 epoch: 16, train_loss: 0.8630, test_loss: 1.0854, test_f1: 0.5325
 epoch: 17, train_loss: 0.8316, test_loss: 1.1237, test_f1: 0.4915
 epoch: 18, train_loss: 0.8384, test_loss: 1.4191, test_f1: 0.5526
 epoch: 19, train_loss: 0.8382, test_loss: 1.1204, test_f1: 0.5473
 epoch: 20, train_loss: 0.8038, test_loss: 1.1741, test_f1: 0.5674
 epoch: 21, train_loss: 0.8248, test_loss: 1.3618, test_f1: 0.5671
 epoch: 22, train_loss: 0.8134, test_loss: 1.1819, test_f1: 0.5832
 epoch: 23, train_loss: 0.8039, test_loss: 1.6890, test_f1: 0.4850
 epoch: 24, train_loss: 0.8199, test_loss: 1.1313, test_f1: 0.5712
 epoch: 25, train_loss: 0.8044, test_loss: 1.1052, test_f1: 0.5373
 epoch: 26, train_loss: 0.8235, test_loss: 1.2179, test_f1: 0.5384
 epoch: 27, train_loss: 0.7821, test_loss: 1.1844, test_f1: 0.5375
 epoch: 28, train_loss: 0.7883, test_loss: 1.2407, test_f1: 0.5132
 epoch: 29, train_loss: 0.7759, test_loss: 1.2832, test_f1: 0.4969
 epoch: 30, train_loss: 0.7652, test_loss: 1.4226, test_f1: 0.5691
 epoch: 31, train_loss: 0.7409, test_loss: 1.2941, test_f1: 0.5371
 epoch: 32, train_loss: 0.7337, test_loss: 1.2341, test_f1: 0.5799
 epoch: 33, train_loss: 0.7339, test_loss: 1.2533, test_f1: 0.5810
 epoch: 34, train_loss: 0.7247, test_loss: 1.5242, test_f1: 0.4773
 epoch: 35, train_loss: 0.7194, test_loss: 1.3839, test_f1: 0.5669
 epoch: 36, train_loss: 0.7443, test_loss: 2.1713, test_f1: 0.4060
 epoch: 37, train_loss: 0.8185, test_loss: 1.4787, test_f1: 0.5136
 epoch: 38, train_loss: 0.7831, test_loss: 1.2150, test_f1: 0.5393
 epoch: 39, train_loss: 0.8389, test_loss: 1.2147, test_f1: 0.5595
 epoch: 40, train_loss: 0.8084, test_loss: 1.0929, test_f1: 0.5962
 epoch: 41, train_loss: 0.7886, test_loss: 1.3795, test_f1: 0.4952
 epoch: 42, train_loss: 0.7675, test_loss: 1.0948, test_f1: 0.5931
 epoch: 43, train_loss: 0.7412, test_loss: 1.2117, test_f1: 0.5685
 epoch: 44, train_loss: 0.7084, test_loss: 1.2131, test_f1: 0.5572
 epoch: 45, train_loss: 0.7083, test_loss: 1.1660, test_f1: 0.6045
 epoch: 46, train_loss: 0.7265, test_loss: 1.1880, test_f1: 0.5320
 epoch: 47, train_loss: 0.7479, test_loss: 1.0951, test_f1: 0.5940
 epoch: 48, train_loss: 0.7257, test_loss: 1.2196, test_f1: 0.5857
 epoch: 49, train_loss: 0.7118, test_loss: 1.2541, test_f1: 0.5964
 epoch: 50, train_loss: 0.7103, test_loss: 1.1447, test_f1: 0.5741
 epoch: 51, train_loss: 0.6830, test_loss: 1.4131, test_f1: 0.5794
 epoch: 52, train_loss: 0.6666, test_loss: 1.5944, test_f1: 0.6006
 epoch: 53, train_loss: 0.6457, test_loss: 1.5549, test_f1: 0.5975
 epoch: 54, train_loss: 0.6313, test_loss: 1.6553, test_f1: 0.5947
 epoch: 55, train_loss: 0.6330, test_loss: 1.5805, test_f1: 0.5972
 epoch: 56, train_loss: 0.6124, test_loss: 1.6461, test_f1: 0.5551
 epoch: 57, train_loss: 0.6010, test_loss: 1.7005, test_f1: 0.5878
 epoch: 58, train_loss: 0.6421, test_loss: 1.4200, test_f1: 0.5657
 epoch: 59, train_loss: 0.6201, test_loss: 1.6463, test_f1: 0.5697
 epoch: 60, train_loss: 0.6083, test_loss: 1.8087, test_f1: 0.5805
 epoch: 61, train_loss: 0.6151, test_loss: 1.8468, test_f1: 0.5530
 epoch: 62, train_loss: 0.6192, test_loss: 1.9063, test_f1: 0.5590
 epoch: 63, train_loss: 0.6095, test_loss: 1.8399, test_f1: 0.5710
 epoch: 64, train_loss: 0.5935, test_loss: 1.7803, test_f1: 0.5324
 epoch: 65, train_loss: 0.6086, test_loss: 1.5439, test_f1: 0.5752
 epoch: 66, train_loss: 0.6045, test_loss: 1.6420, test_f1: 0.6005
 epoch: 67, train_loss: 0.5846, test_loss: 1.8966, test_f1: 0.5701
 epoch: 68, train_loss: 0.6122, test_loss: 1.8528, test_f1: 0.5601
 epoch: 69, train_loss: 0.5866, test_loss: 1.4624, test_f1: 0.6098
 epoch: 70, train_loss: 0.5707, test_loss: 1.4166, test_f1: 0.5978
 epoch: 71, train_loss: 0.6073, test_loss: 1.8143, test_f1: 0.5585
 epoch: 72, train_loss: 0.6001, test_loss: 1.5688, test_f1: 0.5402
 epoch: 73, train_loss: 0.5894, test_loss: 1.5549, test_f1: 0.5809
 epoch: 74, train_loss: 0.6068, test_loss: 1.5807, test_f1: 0.6227
 epoch: 75, train_loss: 0.5779, test_loss: 1.4983, test_f1: 0.6193
 epoch: 76, train_loss: 0.5499, test_loss: 1.9942, test_f1: 0.5253
 epoch: 77, train_loss: 0.5684, test_loss: 1.7766, test_f1: 0.6012
 epoch: 78, train_loss: 0.5759, test_loss: 2.1486, test_f1: 0.5613
 epoch: 79, train_loss: 0.5617, test_loss: 2.2782, test_f1: 0.5541
 epoch: 80, train_loss: 0.5925, test_loss: 1.8108, test_f1: 0.5261
 epoch: 81, train_loss: 0.5952, test_loss: 1.6988, test_f1: 0.4814
 epoch: 82, train_loss: 0.5761, test_loss: 1.5654, test_f1: 0.5777
 epoch: 83, train_loss: 0.5823, test_loss: 1.8007, test_f1: 0.5829
 epoch: 84, train_loss: 0.5429, test_loss: 1.5599, test_f1: 0.5946
 epoch: 85, train_loss: 0.5785, test_loss: 1.4643, test_f1: 0.6063
 epoch: 86, train_loss: 0.6613, test_loss: 1.7190, test_f1: 0.5612
 epoch: 87, train_loss: 0.6208, test_loss: 1.7113, test_f1: 0.5593
 epoch: 88, train_loss: 0.5923, test_loss: 1.5256, test_f1: 0.6102
 epoch: 89, train_loss: 0.5638, test_loss: 1.5808, test_f1: 0.5593
 epoch: 90, train_loss: 0.5890, test_loss: 1.5109, test_f1: 0.5963
 epoch: 91, train_loss: 0.5407, test_loss: 1.7046, test_f1: 0.5811
 epoch: 92, train_loss: 0.5678, test_loss: 1.8702, test_f1: 0.5677
 epoch: 93, train_loss: 0.5347, test_loss: 1.7891, test_f1: 0.5519
 epoch: 94, train_loss: 0.5397, test_loss: 1.8696, test_f1: 0.5761
 epoch: 95, train_loss: 0.5528, test_loss: 1.7644, test_f1: 0.5761
 epoch: 96, train_loss: 0.5411, test_loss: 1.7273, test_f1: 0.5971
 epoch: 97, train_loss: 0.5859, test_loss: 1.5112, test_f1: 0.5957
 epoch: 98, train_loss: 0.5515, test_loss: 1.5255, test_f1: 0.5566
 epoch: 99, train_loss: 0.5454, test_loss: 1.5749, test_f1: 0.6136
##################ITERATION #7 ****************************************
 epoch: 0, train_loss: 1.4180, test_loss: 1.7115, test_f1: 0.2336
 epoch: 1, train_loss: 1.1986, test_loss: 1.4634, test_f1: 0.2116
 epoch: 2, train_loss: 1.1244, test_loss: 1.3967, test_f1: 0.3161
 epoch: 3, train_loss: 1.0924, test_loss: 1.3743, test_f1: 0.3462
 epoch: 4, train_loss: 1.0349, test_loss: 1.3366, test_f1: 0.3455
 epoch: 5, train_loss: 1.0111, test_loss: 1.3321, test_f1: 0.3906
 epoch: 6, train_loss: 1.0124, test_loss: 1.2346, test_f1: 0.3855
 epoch: 7, train_loss: 0.9601, test_loss: 1.2013, test_f1: 0.4120
 epoch: 8, train_loss: 0.9519, test_loss: 1.1079, test_f1: 0.5480
 epoch: 9, train_loss: 0.9431, test_loss: 1.3290, test_f1: 0.4909
 epoch: 10, train_loss: 0.9175, test_loss: 1.9492, test_f1: 0.3369
 epoch: 11, train_loss: 0.9428, test_loss: 1.2216, test_f1: 0.4128
 epoch: 12, train_loss: 0.9235, test_loss: 1.1708, test_f1: 0.4985
 epoch: 13, train_loss: 0.8929, test_loss: 1.2395, test_f1: 0.5543
 epoch: 14, train_loss: 0.9134, test_loss: 1.2646, test_f1: 0.4501
 epoch: 15, train_loss: 0.9198, test_loss: 1.3506, test_f1: 0.4964
 epoch: 16, train_loss: 0.8729, test_loss: 1.2165, test_f1: 0.4588
 epoch: 17, train_loss: 0.8643, test_loss: 1.4684, test_f1: 0.4852
 epoch: 18, train_loss: 0.8440, test_loss: 1.0896, test_f1: 0.5638
 epoch: 19, train_loss: 0.8455, test_loss: 1.0946, test_f1: 0.5694
 epoch: 20, train_loss: 0.8624, test_loss: 1.1988, test_f1: 0.5083
 epoch: 21, train_loss: 0.8910, test_loss: 1.2708, test_f1: 0.5116
 epoch: 22, train_loss: 0.8816, test_loss: 1.1685, test_f1: 0.5366
 epoch: 23, train_loss: 0.8543, test_loss: 2.0309, test_f1: 0.4124
 epoch: 24, train_loss: 0.8363, test_loss: 1.1813, test_f1: 0.5328
 epoch: 25, train_loss: 0.8097, test_loss: 1.1459, test_f1: 0.5425
 epoch: 26, train_loss: 0.8194, test_loss: 1.1923, test_f1: 0.5230
 epoch: 27, train_loss: 0.8330, test_loss: 1.1080, test_f1: 0.5472
 epoch: 28, train_loss: 0.8305, test_loss: 1.4027, test_f1: 0.5031
 epoch: 29, train_loss: 0.8202, test_loss: 1.2012, test_f1: 0.5362
 epoch: 30, train_loss: 0.8349, test_loss: 1.2192, test_f1: 0.4905
 epoch: 31, train_loss: 0.8205, test_loss: 1.2891, test_f1: 0.4886
 epoch: 32, train_loss: 0.8387, test_loss: 1.3757, test_f1: 0.4890
 epoch: 33, train_loss: 0.8253, test_loss: 1.6594, test_f1: 0.4928
 epoch: 34, train_loss: 0.7998, test_loss: 1.0870, test_f1: 0.5296
 epoch: 35, train_loss: 0.7819, test_loss: 1.1138, test_f1: 0.5385
 epoch: 36, train_loss: 0.7888, test_loss: 1.3305, test_f1: 0.5100
 epoch: 37, train_loss: 0.7373, test_loss: 1.2804, test_f1: 0.5381
 epoch: 38, train_loss: 0.7592, test_loss: 1.2905, test_f1: 0.5313
 epoch: 39, train_loss: 0.7835, test_loss: 1.1937, test_f1: 0.5725
 epoch: 40, train_loss: 0.7510, test_loss: 1.3782, test_f1: 0.5009
 epoch: 41, train_loss: 0.7625, test_loss: 1.3196, test_f1: 0.5719
 epoch: 42, train_loss: 0.7724, test_loss: 1.5762, test_f1: 0.5322
 epoch: 43, train_loss: 0.7495, test_loss: 1.4078, test_f1: 0.5576
 epoch: 44, train_loss: 0.7381, test_loss: 1.3580, test_f1: 0.5328
 epoch: 45, train_loss: 0.7235, test_loss: 1.3973, test_f1: 0.5326
 epoch: 46, train_loss: 0.7321, test_loss: 1.3084, test_f1: 0.5531
 epoch: 47, train_loss: 0.7398, test_loss: 1.3340, test_f1: 0.5332
 epoch: 48, train_loss: 0.7454, test_loss: 1.1520, test_f1: 0.6141
 epoch: 49, train_loss: 0.7401, test_loss: 1.1774, test_f1: 0.5862
 epoch: 50, train_loss: 0.7458, test_loss: 1.8583, test_f1: 0.4567
 epoch: 51, train_loss: 0.7269, test_loss: 1.6929, test_f1: 0.4400
 epoch: 52, train_loss: 0.7090, test_loss: 1.2475, test_f1: 0.5432
 epoch: 53, train_loss: 0.6636, test_loss: 1.2535, test_f1: 0.5807
 epoch: 54, train_loss: 0.6765, test_loss: 1.2556, test_f1: 0.5471
 epoch: 55, train_loss: 0.6616, test_loss: 1.2872, test_f1: 0.5616
 epoch: 56, train_loss: 0.6575, test_loss: 1.3154, test_f1: 0.5782
 epoch: 57, train_loss: 0.6461, test_loss: 1.3499, test_f1: 0.5790
 epoch: 58, train_loss: 0.6345, test_loss: 1.4589, test_f1: 0.5277
 epoch: 59, train_loss: 0.5995, test_loss: 1.3423, test_f1: 0.5703
 epoch: 60, train_loss: 0.6447, test_loss: 1.4853, test_f1: 0.5850
 epoch: 61, train_loss: 0.6165, test_loss: 1.5170, test_f1: 0.6012
 epoch: 62, train_loss: 0.5864, test_loss: 1.5746, test_f1: 0.5372
 epoch: 63, train_loss: 0.5991, test_loss: 1.4637, test_f1: 0.5450
 epoch: 64, train_loss: 0.6147, test_loss: 1.5807, test_f1: 0.5533
 epoch: 65, train_loss: 0.6715, test_loss: 2.2981, test_f1: 0.4842
 epoch: 66, train_loss: 0.7018, test_loss: 1.8879, test_f1: 0.5278
 epoch: 67, train_loss: 0.6816, test_loss: 1.4645, test_f1: 0.5796
 epoch: 68, train_loss: 0.6438, test_loss: 1.8004, test_f1: 0.5588
 epoch: 69, train_loss: 0.6280, test_loss: 1.6751, test_f1: 0.5701
 epoch: 70, train_loss: 0.6383, test_loss: 1.5961, test_f1: 0.5803
 epoch: 71, train_loss: 0.6165, test_loss: 2.4618, test_f1: 0.5429
 epoch: 72, train_loss: 0.6116, test_loss: 2.2079, test_f1: 0.5588
 epoch: 73, train_loss: 0.5960, test_loss: 1.2735, test_f1: 0.5634
 epoch: 74, train_loss: 0.6195, test_loss: 2.0263, test_f1: 0.5511
 epoch: 75, train_loss: 0.6125, test_loss: 3.0016, test_f1: 0.5433
 epoch: 76, train_loss: 0.6138, test_loss: 2.2276, test_f1: 0.5952
 epoch: 77, train_loss: 0.5961, test_loss: 1.8643, test_f1: 0.5937
 epoch: 78, train_loss: 0.6015, test_loss: 1.7239, test_f1: 0.5658
 epoch: 79, train_loss: 0.6321, test_loss: 2.2788, test_f1: 0.5162
 epoch: 80, train_loss: 0.7448, test_loss: 1.6402, test_f1: 0.6010
 epoch: 81, train_loss: 0.6709, test_loss: 1.7608, test_f1: 0.4977
 epoch: 82, train_loss: 0.6738, test_loss: 1.6017, test_f1: 0.5589
 epoch: 83, train_loss: 0.6412, test_loss: 1.5499, test_f1: 0.5564
 epoch: 84, train_loss: 0.6319, test_loss: 1.6030, test_f1: 0.5530
 epoch: 85, train_loss: 0.6053, test_loss: 1.5277, test_f1: 0.5876
 epoch: 86, train_loss: 0.6031, test_loss: 1.6129, test_f1: 0.5566
 epoch: 87, train_loss: 0.6002, test_loss: 1.6258, test_f1: 0.5353
 epoch: 88, train_loss: 0.5732, test_loss: 1.8039, test_f1: 0.5394
 epoch: 89, train_loss: 0.5937, test_loss: 1.8927, test_f1: 0.5591
 epoch: 90, train_loss: 0.5487, test_loss: 1.8946, test_f1: 0.5326
 epoch: 91, train_loss: 0.5553, test_loss: 1.6934, test_f1: 0.5906
 epoch: 92, train_loss: 0.5253, test_loss: 1.6299, test_f1: 0.5488
 epoch: 93, train_loss: 0.5415, test_loss: 1.7624, test_f1: 0.5532
 epoch: 94, train_loss: 0.5574, test_loss: 1.5932, test_f1: 0.5764
 epoch: 95, train_loss: 0.5539, test_loss: 1.4065, test_f1: 0.5848
 epoch: 96, train_loss: 0.5327, test_loss: 1.6297, test_f1: 0.5532
 epoch: 97, train_loss: 0.5229, test_loss: 1.7951, test_f1: 0.5899
 epoch: 98, train_loss: 0.5064, test_loss: 1.6752, test_f1: 0.6036
 epoch: 99, train_loss: 0.5054, test_loss: 1.8097, test_f1: 0.5887
##################ITERATION #8 ****************************************
 epoch: 0, train_loss: 1.3621, test_loss: 1.4491, test_f1: 0.1748
 epoch: 1, train_loss: 1.2228, test_loss: 1.2968, test_f1: 0.2533
 epoch: 2, train_loss: 1.1491, test_loss: 1.2277, test_f1: 0.3888
 epoch: 3, train_loss: 1.0863, test_loss: 1.1852, test_f1: 0.5154
 epoch: 4, train_loss: 1.0295, test_loss: 1.0998, test_f1: 0.5158
 epoch: 5, train_loss: 0.9671, test_loss: 1.1285, test_f1: 0.5072
 epoch: 6, train_loss: 0.9592, test_loss: 1.1397, test_f1: 0.4518
 epoch: 7, train_loss: 0.9376, test_loss: 1.1245, test_f1: 0.5427
 epoch: 8, train_loss: 0.9271, test_loss: 1.0915, test_f1: 0.5395
 epoch: 9, train_loss: 0.8977, test_loss: 1.0824, test_f1: 0.5507
 epoch: 10, train_loss: 0.8749, test_loss: 1.0815, test_f1: 0.5558
 epoch: 11, train_loss: 0.8937, test_loss: 1.1614, test_f1: 0.5037
 epoch: 12, train_loss: 0.8785, test_loss: 1.5410, test_f1: 0.4356
 epoch: 13, train_loss: 0.8862, test_loss: 1.1110, test_f1: 0.5217
 epoch: 14, train_loss: 0.8453, test_loss: 1.2567, test_f1: 0.5447
 epoch: 15, train_loss: 0.8456, test_loss: 1.2043, test_f1: 0.4665
 epoch: 16, train_loss: 0.8441, test_loss: 1.2376, test_f1: 0.5710
 epoch: 17, train_loss: 0.8396, test_loss: 1.1432, test_f1: 0.4134
 epoch: 18, train_loss: 0.7976, test_loss: 1.0001, test_f1: 0.6010
 epoch: 19, train_loss: 0.8213, test_loss: 1.3553, test_f1: 0.4703
 epoch: 20, train_loss: 0.8136, test_loss: 1.0944, test_f1: 0.4905
 epoch: 21, train_loss: 0.7825, test_loss: 1.1381, test_f1: 0.6077
 epoch: 22, train_loss: 0.7797, test_loss: 1.1385, test_f1: 0.4950
 epoch: 23, train_loss: 0.7414, test_loss: 1.1585, test_f1: 0.5083
 epoch: 24, train_loss: 0.7504, test_loss: 1.4526, test_f1: 0.4785
 epoch: 25, train_loss: 0.7656, test_loss: 1.1738, test_f1: 0.5396
 epoch: 26, train_loss: 0.7548, test_loss: 1.3664, test_f1: 0.5098
 epoch: 27, train_loss: 0.7640, test_loss: 1.5358, test_f1: 0.4994
 epoch: 28, train_loss: 0.7337, test_loss: 1.1497, test_f1: 0.5879
 epoch: 29, train_loss: 0.7112, test_loss: 1.2329, test_f1: 0.5047
 epoch: 30, train_loss: 0.7061, test_loss: 1.1707, test_f1: 0.5570
 epoch: 31, train_loss: 0.7205, test_loss: 1.4820, test_f1: 0.4884
 epoch: 32, train_loss: 0.7121, test_loss: 1.0908, test_f1: 0.5566
 epoch: 33, train_loss: 0.6880, test_loss: 1.2030, test_f1: 0.5693
 epoch: 34, train_loss: 0.6801, test_loss: 1.7221, test_f1: 0.4497
 epoch: 35, train_loss: 0.6965, test_loss: 1.3933, test_f1: 0.5670
 epoch: 36, train_loss: 0.7070, test_loss: 1.3466, test_f1: 0.4927
 epoch: 37, train_loss: 0.7014, test_loss: 1.2668, test_f1: 0.5301
 epoch: 38, train_loss: 0.6704, test_loss: 1.1709, test_f1: 0.5510
 epoch: 39, train_loss: 0.6744, test_loss: 1.6311, test_f1: 0.4916
 epoch: 40, train_loss: 0.6849, test_loss: 1.1857, test_f1: 0.6057
 epoch: 41, train_loss: 0.7020, test_loss: 1.0829, test_f1: 0.5545
 epoch: 42, train_loss: 0.6995, test_loss: 1.6986, test_f1: 0.5408
 epoch: 43, train_loss: 0.6974, test_loss: 1.3051, test_f1: 0.6038
 epoch: 44, train_loss: 0.6927, test_loss: 1.2933, test_f1: 0.5126
 epoch: 45, train_loss: 0.7030, test_loss: 1.1600, test_f1: 0.5603
 epoch: 46, train_loss: 0.7175, test_loss: 1.3133, test_f1: 0.5742
 epoch: 47, train_loss: 0.7144, test_loss: 1.1580, test_f1: 0.5980
 epoch: 48, train_loss: 0.6616, test_loss: 1.7326, test_f1: 0.4758
 epoch: 49, train_loss: 0.6752, test_loss: 1.4427, test_f1: 0.5243
 epoch: 50, train_loss: 0.6411, test_loss: 1.3126, test_f1: 0.5310
 epoch: 51, train_loss: 0.6603, test_loss: 1.1844, test_f1: 0.5343
 epoch: 52, train_loss: 0.6240, test_loss: 1.3905, test_f1: 0.5184
 epoch: 53, train_loss: 0.5996, test_loss: 1.3645, test_f1: 0.5399
 epoch: 54, train_loss: 0.5982, test_loss: 1.3062, test_f1: 0.5795
 epoch: 55, train_loss: 0.5812, test_loss: 1.3301, test_f1: 0.5802
 epoch: 56, train_loss: 0.5794, test_loss: 1.2860, test_f1: 0.5859
 epoch: 57, train_loss: 0.5741, test_loss: 1.2984, test_f1: 0.5838
 epoch: 58, train_loss: 0.5531, test_loss: 1.3541, test_f1: 0.5335
 epoch: 59, train_loss: 0.5546, test_loss: 1.3715, test_f1: 0.5442
 epoch: 60, train_loss: 0.5690, test_loss: 1.3681, test_f1: 0.5377
 epoch: 61, train_loss: 0.5646, test_loss: 1.4964, test_f1: 0.5846
 epoch: 62, train_loss: 0.5613, test_loss: 1.2528, test_f1: 0.6189
 epoch: 63, train_loss: 0.5350, test_loss: 1.3730, test_f1: 0.5523
 epoch: 64, train_loss: 0.5320, test_loss: 1.3329, test_f1: 0.5801
 epoch: 65, train_loss: 0.5191, test_loss: 1.4022, test_f1: 0.5684
 epoch: 66, train_loss: 0.5056, test_loss: 1.4772, test_f1: 0.5112
 epoch: 67, train_loss: 0.5091, test_loss: 1.2694, test_f1: 0.5892
 epoch: 68, train_loss: 0.4956, test_loss: 1.3871, test_f1: 0.5407
 epoch: 69, train_loss: 0.5055, test_loss: 1.2630, test_f1: 0.6104
 epoch: 70, train_loss: 0.5362, test_loss: 1.1952, test_f1: 0.5844
 epoch: 71, train_loss: 0.5361, test_loss: 1.5745, test_f1: 0.5612
 epoch: 72, train_loss: 0.5419, test_loss: 1.3380, test_f1: 0.5935
 epoch: 73, train_loss: 0.5321, test_loss: 1.5703, test_f1: 0.4893
 epoch: 74, train_loss: 0.5073, test_loss: 1.5543, test_f1: 0.5480
 epoch: 75, train_loss: 0.4858, test_loss: 1.5700, test_f1: 0.5482
 epoch: 76, train_loss: 0.4855, test_loss: 1.9123, test_f1: 0.5271
 epoch: 77, train_loss: 0.4699, test_loss: 1.5711, test_f1: 0.5618
 epoch: 78, train_loss: 0.4723, test_loss: 1.3677, test_f1: 0.5715
 epoch: 79, train_loss: 0.4740, test_loss: 1.4525, test_f1: 0.5315
 epoch: 80, train_loss: 0.4352, test_loss: 1.5568, test_f1: 0.5396
 epoch: 81, train_loss: 0.4814, test_loss: 1.7828, test_f1: 0.5326
 epoch: 82, train_loss: 0.4697, test_loss: 1.8114, test_f1: 0.5388
 epoch: 83, train_loss: 0.4772, test_loss: 1.7581, test_f1: 0.5564
 epoch: 84, train_loss: 0.4567, test_loss: 1.6468, test_f1: 0.5716
 epoch: 85, train_loss: 0.4566, test_loss: 1.8499, test_f1: 0.5249
 epoch: 86, train_loss: 0.4594, test_loss: 1.6778, test_f1: 0.5497
 epoch: 87, train_loss: 0.5038, test_loss: 1.4220, test_f1: 0.5720
 epoch: 88, train_loss: 0.4972, test_loss: 1.8292, test_f1: 0.5963
 epoch: 89, train_loss: 0.4905, test_loss: 1.7679, test_f1: 0.5866
 epoch: 90, train_loss: 0.5533, test_loss: 1.3832, test_f1: 0.5397
 epoch: 91, train_loss: 0.5857, test_loss: 1.3725, test_f1: 0.5400
 epoch: 92, train_loss: 0.5461, test_loss: 1.6575, test_f1: 0.4967
 epoch: 93, train_loss: 0.5179, test_loss: 1.4726, test_f1: 0.5127
 epoch: 94, train_loss: 0.5200, test_loss: 1.3228, test_f1: 0.5618
 epoch: 95, train_loss: 0.5142, test_loss: 1.3170, test_f1: 0.5514
 epoch: 96, train_loss: 0.4994, test_loss: 1.3226, test_f1: 0.5468
 epoch: 97, train_loss: 0.4898, test_loss: 1.2676, test_f1: 0.5517
 epoch: 98, train_loss: 0.4619, test_loss: 1.2267, test_f1: 0.5739
 epoch: 99, train_loss: 0.4622, test_loss: 1.3535, test_f1: 0.5650
##################ITERATION #9 ****************************************
 epoch: 0, train_loss: 1.4410, test_loss: 1.6240, test_f1: 0.2347
 epoch: 1, train_loss: 1.2219, test_loss: 1.4126, test_f1: 0.1545
 epoch: 2, train_loss: 1.0934, test_loss: 1.3490, test_f1: 0.2936
 epoch: 3, train_loss: 1.0840, test_loss: 1.2821, test_f1: 0.3598
 epoch: 4, train_loss: 1.0592, test_loss: 1.2904, test_f1: 0.3419
 epoch: 5, train_loss: 1.0232, test_loss: 1.1970, test_f1: 0.4221
 epoch: 6, train_loss: 0.9891, test_loss: 1.1786, test_f1: 0.5090
 epoch: 7, train_loss: 0.9450, test_loss: 1.1830, test_f1: 0.4888
 epoch: 8, train_loss: 0.9471, test_loss: 1.1076, test_f1: 0.4984
 epoch: 9, train_loss: 0.9218, test_loss: 1.4499, test_f1: 0.4010
 epoch: 10, train_loss: 0.9163, test_loss: 1.2278, test_f1: 0.5291
 epoch: 11, train_loss: 0.9204, test_loss: 1.1620, test_f1: 0.5032
 epoch: 12, train_loss: 0.9078, test_loss: 1.0826, test_f1: 0.5201
 epoch: 13, train_loss: 0.8867, test_loss: 1.1514, test_f1: 0.4930
 epoch: 14, train_loss: 0.8711, test_loss: 1.1832, test_f1: 0.4406
 epoch: 15, train_loss: 0.8365, test_loss: 1.1789, test_f1: 0.5297
 epoch: 16, train_loss: 0.8367, test_loss: 1.1879, test_f1: 0.5503
 epoch: 17, train_loss: 0.8027, test_loss: 1.1891, test_f1: 0.4751
 epoch: 18, train_loss: 0.8271, test_loss: 1.1260, test_f1: 0.5524
 epoch: 19, train_loss: 0.8438, test_loss: 1.2283, test_f1: 0.5467
 epoch: 20, train_loss: 0.8167, test_loss: 1.1872, test_f1: 0.5414
 epoch: 21, train_loss: 0.7965, test_loss: 1.3313, test_f1: 0.5112
 epoch: 22, train_loss: 0.7905, test_loss: 1.3599, test_f1: 0.4673
 epoch: 23, train_loss: 0.8283, test_loss: 1.2911, test_f1: 0.4892
 epoch: 24, train_loss: 0.8122, test_loss: 1.2692, test_f1: 0.5295
 epoch: 25, train_loss: 0.7907, test_loss: 1.2325, test_f1: 0.5560
 epoch: 26, train_loss: 0.7609, test_loss: 1.4019, test_f1: 0.4770
 epoch: 27, train_loss: 0.7685, test_loss: 1.3675, test_f1: 0.5263
 epoch: 28, train_loss: 0.7805, test_loss: 1.2760, test_f1: 0.4872
 epoch: 29, train_loss: 0.7604, test_loss: 1.1886, test_f1: 0.5616
 epoch: 30, train_loss: 0.7575, test_loss: 1.2841, test_f1: 0.5155
 epoch: 31, train_loss: 0.7375, test_loss: 1.2437, test_f1: 0.5487
 epoch: 32, train_loss: 0.7798, test_loss: 1.4173, test_f1: 0.5505
 epoch: 33, train_loss: 0.8150, test_loss: 1.5852, test_f1: 0.4802
 epoch: 34, train_loss: 0.7602, test_loss: 1.1111, test_f1: 0.5846
 epoch: 35, train_loss: 0.7359, test_loss: 1.2072, test_f1: 0.5807
 epoch: 36, train_loss: 0.7282, test_loss: 1.1798, test_f1: 0.5771
 epoch: 37, train_loss: 0.7929, test_loss: 1.4284, test_f1: 0.5585
 epoch: 38, train_loss: 0.8329, test_loss: 1.3103, test_f1: 0.4441
 epoch: 39, train_loss: 0.8023, test_loss: 1.1847, test_f1: 0.5474
 epoch: 40, train_loss: 0.7802, test_loss: 1.1156, test_f1: 0.5264
 epoch: 41, train_loss: 0.7640, test_loss: 1.2251, test_f1: 0.5513
 epoch: 42, train_loss: 0.7430, test_loss: 1.2287, test_f1: 0.5422
 epoch: 43, train_loss: 0.7333, test_loss: 1.2806, test_f1: 0.5091
 epoch: 44, train_loss: 0.7097, test_loss: 1.2697, test_f1: 0.5299
 epoch: 45, train_loss: 0.7067, test_loss: 1.2599, test_f1: 0.5568
 epoch: 46, train_loss: 0.7155, test_loss: 1.3414, test_f1: 0.5654
 epoch: 47, train_loss: 0.7120, test_loss: 1.3558, test_f1: 0.5347
 epoch: 48, train_loss: 0.7015, test_loss: 1.2963, test_f1: 0.5819
 epoch: 49, train_loss: 0.7041, test_loss: 1.4302, test_f1: 0.5155
 epoch: 50, train_loss: 0.7225, test_loss: 1.3252, test_f1: 0.5661
 epoch: 51, train_loss: 0.6798, test_loss: 1.3401, test_f1: 0.5651
 epoch: 52, train_loss: 0.6671, test_loss: 1.3675, test_f1: 0.5703
 epoch: 53, train_loss: 0.6435, test_loss: 1.2456, test_f1: 0.5781
 epoch: 54, train_loss: 0.6388, test_loss: 1.2180, test_f1: 0.5677
 epoch: 55, train_loss: 0.6303, test_loss: 1.2110, test_f1: 0.5863
 epoch: 56, train_loss: 0.6228, test_loss: 1.2255, test_f1: 0.5467
 epoch: 57, train_loss: 0.6057, test_loss: 1.2810, test_f1: 0.5394
 epoch: 58, train_loss: 0.5968, test_loss: 1.2633, test_f1: 0.5972
 epoch: 59, train_loss: 0.6103, test_loss: 1.4822, test_f1: 0.5253
 epoch: 60, train_loss: 0.6243, test_loss: 1.6303, test_f1: 0.5068
 epoch: 61, train_loss: 0.6123, test_loss: 1.4603, test_f1: 0.5792
 epoch: 62, train_loss: 0.6219, test_loss: 1.4271, test_f1: 0.5750
 epoch: 63, train_loss: 0.6120, test_loss: 1.3614, test_f1: 0.5740
 epoch: 64, train_loss: 0.6060, test_loss: 1.3092, test_f1: 0.5765
 epoch: 65, train_loss: 0.5867, test_loss: 1.4233, test_f1: 0.5485
 epoch: 66, train_loss: 0.5773, test_loss: 1.4826, test_f1: 0.5754
 epoch: 67, train_loss: 0.5967, test_loss: 1.4632, test_f1: 0.5948
 epoch: 68, train_loss: 0.5878, test_loss: 1.5426, test_f1: 0.5772
 epoch: 69, train_loss: 0.5847, test_loss: 1.3903, test_f1: 0.6188
 epoch: 70, train_loss: 0.5730, test_loss: 1.3395, test_f1: 0.5852
 epoch: 71, train_loss: 0.5805, test_loss: 1.3630, test_f1: 0.5997
 epoch: 72, train_loss: 0.5663, test_loss: 1.4005, test_f1: 0.6130
 epoch: 73, train_loss: 0.5601, test_loss: 1.3083, test_f1: 0.5974
 epoch: 74, train_loss: 0.5540, test_loss: 1.3467, test_f1: 0.5790
 epoch: 75, train_loss: 0.5498, test_loss: 1.5211, test_f1: 0.5666
 epoch: 76, train_loss: 0.5690, test_loss: 1.4590, test_f1: 0.5794
 epoch: 77, train_loss: 0.5368, test_loss: 1.3734, test_f1: 0.5943
 epoch: 78, train_loss: 0.5583, test_loss: 1.4212, test_f1: 0.5723
 epoch: 79, train_loss: 0.5698, test_loss: 1.3493, test_f1: 0.5984
 epoch: 80, train_loss: 0.5429, test_loss: 1.4024, test_f1: 0.5848
 epoch: 81, train_loss: 0.5251, test_loss: 1.3517, test_f1: 0.5703
 epoch: 82, train_loss: 0.5373, test_loss: 1.3305, test_f1: 0.5879
 epoch: 83, train_loss: 0.5085, test_loss: 1.4176, test_f1: 0.5686
 epoch: 84, train_loss: 0.5106, test_loss: 1.2511, test_f1: 0.5971
 epoch: 85, train_loss: 0.5022, test_loss: 1.3041, test_f1: 0.5867
 epoch: 86, train_loss: 0.5244, test_loss: 1.4097, test_f1: 0.5792
 epoch: 87, train_loss: 0.5261, test_loss: 1.4682, test_f1: 0.5379
 epoch: 88, train_loss: 0.5620, test_loss: 1.7100, test_f1: 0.5767
 epoch: 89, train_loss: 0.6153, test_loss: 1.7385, test_f1: 0.5953
 epoch: 90, train_loss: 0.6226, test_loss: 1.7292, test_f1: 0.5860
 epoch: 91, train_loss: 0.6193, test_loss: 1.3839, test_f1: 0.5971
 epoch: 92, train_loss: 0.5739, test_loss: 1.2930, test_f1: 0.6137
 epoch: 93, train_loss: 0.5493, test_loss: 1.2985, test_f1: 0.6145
 epoch: 94, train_loss: 0.5351, test_loss: 1.4245, test_f1: 0.6077
 epoch: 95, train_loss: 0.5198, test_loss: 1.4115, test_f1: 0.6445
 epoch: 96, train_loss: 0.5094, test_loss: 1.4344, test_f1: 0.6072
 epoch: 97, train_loss: 0.5174, test_loss: 1.4863, test_f1: 0.5835
 epoch: 98, train_loss: 0.5155, test_loss: 1.5161, test_f1: 0.5864
 epoch: 99, train_loss: 0.4842, test_loss: 1.6439, test_f1: 0.5893

Training completed in 286.14 seconds
Best F1: 0.6615 at epoch 61
Mean F1 across iterations: 0.6318  0.0227
========================FINAL RESULTS================================
FEGIN weighted F1: 0.6615  0.0227
python main.py --data ltspice_demos --representation component_component --model FEGIN --layers 3 --hiddens 32 --batch_size 256 --lr 0.01 --emb_size 250 --epochs 100 --save_appendix component_component_L3_H32_BS256_LR0.01_E250 --no_val
-----



STDERR:
  File "main.py", line 370, in <module>
    main()
  File "main.py", line 254, in main
    dataset = dataset_class(
  File "/home/philip/projects/ltspice_examples_code_repo/Circuit-Completion-Using-GNNs/component_classification_with_link_prediction_head/evaluation/FEGIN/kernel/circuit_datasets.py", line 15, in __init__
    self.data, self.slices = torch.load(self.processed_paths[0])
  File "/home/philip/.local/lib/python3.8/site-packages/torch/serialization.py", line 1040, in load
    warnings.warn(
  File "/usr/lib/python3.8/warnings.py", line 109, in _showwarnmsg
    sw(msg.message, msg.category, msg.filename, msg.lineno,
  File "main.py", line 47, in warn_with_traceback
    traceback.print_stack(file=log)
/home/philip/projects/ltspice_examples_code_repo/Circuit-Completion-Using-GNNs/component_classification_with_link_prediction_head/evaluation/FEGIN/kernel/circuit_datasets.py:15: FutureWarning: You are using `torch.load` with `weights_only=False` (the current default value), which uses the default pickle module implicitly. It is possible to construct malicious pickle data which will execute arbitrary code during unpickling (See https://github.com/pytorch/pytorch/blob/main/SECURITY.md#untrusted-models for more details). In a future release, the default value for `weights_only` will be flipped to `True`. This limits the functions that could be executed during unpickling. Arbitrary objects will no longer be allowed to be loaded via this mode unless they are explicitly allowlisted by the user via `torch.serialization.add_safe_globals`. We recommend you start setting `weights_only=True` for any use case where you don't have full control of the loaded file. Please open an issue on GitHub for any issues related to this experimental feature.
  self.data, self.slices = torch.load(self.processed_paths[0])
