STDOUT:
Results will be saved in /home/philip/projects/ltspice_examples_code_repo/Circuit-Completion-Using-GNNs/component_classification_with_link_prediction_head/evaluation/FEGIN/results/model_FEGIN_dataset_ltspice_examples
Command line input: python main.py --data ltspice_examples --representation component_net --model FEGIN --layers 4 --hiddens 128 --batch_size 256 --lr 0.001 --emb_size 128 --epochs 100 --save_appendix component_net_L4_H128_BS256_LR0.001_E128 --no_val
 is saved.
-----
ltspice_examples - FEGIN
Using 4 layers, 128 hidden units, h = 2
Loading component_net representation dataset
ENTERED
Training FEGIN on component_net representation
Train: 3558, Test: 846
##################ITERATION #0 ****************************************
 epoch: 0, train_loss: 1.2780, test_loss: 1.3301, test_f1: 0.2270
 epoch: 1, train_loss: 1.1488, test_loss: 1.2607, test_f1: 0.2705
 epoch: 2, train_loss: 1.0668, test_loss: 1.1390, test_f1: 0.4548
 epoch: 3, train_loss: 0.9828, test_loss: 1.0307, test_f1: 0.4805
 epoch: 4, train_loss: 0.9349, test_loss: 0.9246, test_f1: 0.5153
 epoch: 5, train_loss: 0.9114, test_loss: 0.9362, test_f1: 0.5090
 epoch: 6, train_loss: 0.8922, test_loss: 0.9615, test_f1: 0.4648
 epoch: 7, train_loss: 0.8545, test_loss: 0.9818, test_f1: 0.5327
 epoch: 8, train_loss: 0.8261, test_loss: 0.9627, test_f1: 0.5493
 epoch: 9, train_loss: 0.8117, test_loss: 0.9021, test_f1: 0.5410
 epoch: 10, train_loss: 0.7925, test_loss: 0.8526, test_f1: 0.5784
 epoch: 11, train_loss: 0.7805, test_loss: 0.9197, test_f1: 0.5625
 epoch: 12, train_loss: 0.7771, test_loss: 0.9023, test_f1: 0.5525
 epoch: 13, train_loss: 0.7544, test_loss: 0.8947, test_f1: 0.5906
 epoch: 14, train_loss: 0.7459, test_loss: 0.8863, test_f1: 0.6009
 epoch: 15, train_loss: 0.7445, test_loss: 0.9042, test_f1: 0.5912
 epoch: 16, train_loss: 0.7275, test_loss: 0.9233, test_f1: 0.5925
 epoch: 17, train_loss: 0.6987, test_loss: 0.9270, test_f1: 0.5893
 epoch: 18, train_loss: 0.6740, test_loss: 0.9088, test_f1: 0.6112
 epoch: 19, train_loss: 0.6626, test_loss: 0.9546, test_f1: 0.6295
 epoch: 20, train_loss: 0.6798, test_loss: 0.9752, test_f1: 0.6137
 epoch: 21, train_loss: 0.6589, test_loss: 0.9107, test_f1: 0.6407
 epoch: 22, train_loss: 0.6642, test_loss: 0.8280, test_f1: 0.6157
 epoch: 23, train_loss: 0.6337, test_loss: 0.9744, test_f1: 0.5939
 epoch: 24, train_loss: 0.6133, test_loss: 0.9318, test_f1: 0.6313
 epoch: 25, train_loss: 0.5900, test_loss: 1.0057, test_f1: 0.6219
 epoch: 26, train_loss: 0.5873, test_loss: 1.0820, test_f1: 0.5613
 epoch: 27, train_loss: 0.5930, test_loss: 0.9955, test_f1: 0.6105
 epoch: 28, train_loss: 0.5543, test_loss: 0.8963, test_f1: 0.6274
 epoch: 29, train_loss: 0.5511, test_loss: 0.8873, test_f1: 0.6505
 epoch: 30, train_loss: 0.5274, test_loss: 0.9597, test_f1: 0.6221
 epoch: 31, train_loss: 0.5211, test_loss: 0.9689, test_f1: 0.6460
 epoch: 32, train_loss: 0.5073, test_loss: 0.9488, test_f1: 0.6721
 epoch: 33, train_loss: 0.4999, test_loss: 0.9904, test_f1: 0.6535
 epoch: 34, train_loss: 0.4884, test_loss: 1.0369, test_f1: 0.6377
 epoch: 35, train_loss: 0.5057, test_loss: 1.0019, test_f1: 0.6404
 epoch: 36, train_loss: 0.4828, test_loss: 1.0306, test_f1: 0.6246
 epoch: 37, train_loss: 0.4410, test_loss: 1.1509, test_f1: 0.6190
 epoch: 38, train_loss: 0.4222, test_loss: 1.1084, test_f1: 0.6429
 epoch: 39, train_loss: 0.4299, test_loss: 1.2030, test_f1: 0.6263
 epoch: 40, train_loss: 0.4204, test_loss: 1.1902, test_f1: 0.6029
 epoch: 41, train_loss: 0.3942, test_loss: 1.2126, test_f1: 0.6406
 epoch: 42, train_loss: 0.3770, test_loss: 1.1338, test_f1: 0.6486
 epoch: 43, train_loss: 0.4035, test_loss: 1.1701, test_f1: 0.6500
 epoch: 44, train_loss: 0.3818, test_loss: 1.1710, test_f1: 0.6353
 epoch: 45, train_loss: 0.3776, test_loss: 1.1497, test_f1: 0.6299
 epoch: 46, train_loss: 0.3876, test_loss: 1.1292, test_f1: 0.6666
 epoch: 47, train_loss: 0.3701, test_loss: 1.3085, test_f1: 0.6297
 epoch: 48, train_loss: 0.3413, test_loss: 1.1697, test_f1: 0.6624
 epoch: 49, train_loss: 0.3335, test_loss: 1.2093, test_f1: 0.6226
 epoch: 50, train_loss: 0.3259, test_loss: 1.3044, test_f1: 0.6361
 epoch: 51, train_loss: 0.2857, test_loss: 1.3217, test_f1: 0.6382
 epoch: 52, train_loss: 0.2730, test_loss: 1.3724, test_f1: 0.6458
 epoch: 53, train_loss: 0.2630, test_loss: 1.3863, test_f1: 0.6576
 epoch: 54, train_loss: 0.2436, test_loss: 1.4281, test_f1: 0.6416
 epoch: 55, train_loss: 0.2365, test_loss: 1.4292, test_f1: 0.6529
 epoch: 56, train_loss: 0.2367, test_loss: 1.5205, test_f1: 0.6404
 epoch: 57, train_loss: 0.2285, test_loss: 1.4806, test_f1: 0.6499
 epoch: 58, train_loss: 0.2168, test_loss: 1.5550, test_f1: 0.6487
 epoch: 59, train_loss: 0.2271, test_loss: 1.6112, test_f1: 0.6254
 epoch: 60, train_loss: 0.2045, test_loss: 1.6599, test_f1: 0.6151
 epoch: 61, train_loss: 0.2004, test_loss: 1.6529, test_f1: 0.6208
 epoch: 62, train_loss: 0.2291, test_loss: 1.8779, test_f1: 0.6385
 epoch: 63, train_loss: 0.2462, test_loss: 1.7639, test_f1: 0.6106
 epoch: 64, train_loss: 0.2443, test_loss: 1.7801, test_f1: 0.6142
 epoch: 65, train_loss: 0.1933, test_loss: 1.7658, test_f1: 0.6262
 epoch: 66, train_loss: 0.2141, test_loss: 1.6919, test_f1: 0.6365
 epoch: 67, train_loss: 0.2236, test_loss: 1.7813, test_f1: 0.6080
 epoch: 68, train_loss: 0.2085, test_loss: 1.6836, test_f1: 0.6139
 epoch: 69, train_loss: 0.1853, test_loss: 1.8047, test_f1: 0.6131
 epoch: 70, train_loss: 0.1922, test_loss: 1.7379, test_f1: 0.6439
 epoch: 71, train_loss: 0.1889, test_loss: 1.8376, test_f1: 0.6255
 epoch: 72, train_loss: 0.1746, test_loss: 1.9175, test_f1: 0.6141
 epoch: 73, train_loss: 0.1793, test_loss: 2.0888, test_f1: 0.6262
 epoch: 74, train_loss: 0.1852, test_loss: 1.8144, test_f1: 0.6213
 epoch: 75, train_loss: 0.1797, test_loss: 1.9342, test_f1: 0.6436
 epoch: 76, train_loss: 0.1782, test_loss: 1.9729, test_f1: 0.6273
 epoch: 77, train_loss: 0.1913, test_loss: 1.9351, test_f1: 0.6235
 epoch: 78, train_loss: 0.1963, test_loss: 1.9499, test_f1: 0.6449
 epoch: 79, train_loss: 0.1728, test_loss: 1.9219, test_f1: 0.6377
 epoch: 80, train_loss: 0.1648, test_loss: 2.0837, test_f1: 0.6417
 epoch: 81, train_loss: 0.1617, test_loss: 2.0151, test_f1: 0.6250
 epoch: 82, train_loss: 0.1442, test_loss: 2.1906, test_f1: 0.6117
 epoch: 83, train_loss: 0.1460, test_loss: 2.1859, test_f1: 0.6138
 epoch: 84, train_loss: 0.1451, test_loss: 2.2631, test_f1: 0.6157
 epoch: 85, train_loss: 0.1590, test_loss: 2.2227, test_f1: 0.6145
 epoch: 86, train_loss: 0.1479, test_loss: 2.4507, test_f1: 0.5925
 epoch: 87, train_loss: 0.1410, test_loss: 2.5233, test_f1: 0.6160
 epoch: 88, train_loss: 0.1477, test_loss: 2.3639, test_f1: 0.6108
 epoch: 89, train_loss: 0.1383, test_loss: 2.2769, test_f1: 0.6253
 epoch: 90, train_loss: 0.1368, test_loss: 2.3995, test_f1: 0.6229
 epoch: 91, train_loss: 0.1486, test_loss: 2.3601, test_f1: 0.6322
 epoch: 92, train_loss: 0.1288, test_loss: 2.3805, test_f1: 0.6006
 epoch: 93, train_loss: 0.1347, test_loss: 2.5091, test_f1: 0.6183
 epoch: 94, train_loss: 0.1362, test_loss: 2.4807, test_f1: 0.6224
 epoch: 95, train_loss: 0.1327, test_loss: 2.4621, test_f1: 0.6029
 epoch: 96, train_loss: 0.1266, test_loss: 2.5996, test_f1: 0.6249
 epoch: 97, train_loss: 0.1448, test_loss: 2.4226, test_f1: 0.6114
 epoch: 98, train_loss: 0.1539, test_loss: 2.6900, test_f1: 0.5919
 epoch: 99, train_loss: 0.1637, test_loss: 2.5300, test_f1: 0.6251
##################ITERATION #1 ****************************************
 epoch: 0, train_loss: 1.1724, test_loss: 1.2416, test_f1: 0.2270
 epoch: 1, train_loss: 1.0139, test_loss: 1.1597, test_f1: 0.3379
 epoch: 2, train_loss: 0.9453, test_loss: 1.0997, test_f1: 0.3611
 epoch: 3, train_loss: 0.9129, test_loss: 1.0511, test_f1: 0.3951
 epoch: 4, train_loss: 0.8751, test_loss: 1.0428, test_f1: 0.5267
 epoch: 5, train_loss: 0.8700, test_loss: 0.9641, test_f1: 0.5258
 epoch: 6, train_loss: 0.8504, test_loss: 0.8772, test_f1: 0.5572
 epoch: 7, train_loss: 0.8201, test_loss: 0.9048, test_f1: 0.5896
 epoch: 8, train_loss: 0.7897, test_loss: 0.8993, test_f1: 0.5858
 epoch: 9, train_loss: 0.7738, test_loss: 0.8767, test_f1: 0.6094
 epoch: 10, train_loss: 0.7625, test_loss: 0.9791, test_f1: 0.5556
 epoch: 11, train_loss: 0.7444, test_loss: 0.9511, test_f1: 0.5555
 epoch: 12, train_loss: 0.7328, test_loss: 0.8590, test_f1: 0.6044
 epoch: 13, train_loss: 0.7281, test_loss: 0.9606, test_f1: 0.5890
 epoch: 14, train_loss: 0.7125, test_loss: 0.8959, test_f1: 0.6082
 epoch: 15, train_loss: 0.6846, test_loss: 0.9274, test_f1: 0.6219
 epoch: 16, train_loss: 0.6792, test_loss: 0.9416, test_f1: 0.6127
 epoch: 17, train_loss: 0.6657, test_loss: 0.9311, test_f1: 0.5875
 epoch: 18, train_loss: 0.6502, test_loss: 0.9417, test_f1: 0.6201
 epoch: 19, train_loss: 0.6426, test_loss: 0.8464, test_f1: 0.6495
 epoch: 20, train_loss: 0.6279, test_loss: 0.9189, test_f1: 0.5945
 epoch: 21, train_loss: 0.6113, test_loss: 0.9683, test_f1: 0.6203
 epoch: 22, train_loss: 0.5849, test_loss: 0.9550, test_f1: 0.6539
 epoch: 23, train_loss: 0.5954, test_loss: 0.9301, test_f1: 0.6115
 epoch: 24, train_loss: 0.5697, test_loss: 0.9962, test_f1: 0.5971
 epoch: 25, train_loss: 0.5568, test_loss: 1.0659, test_f1: 0.6083
 epoch: 26, train_loss: 0.5494, test_loss: 1.0827, test_f1: 0.5770
 epoch: 27, train_loss: 0.5444, test_loss: 1.0062, test_f1: 0.6250
 epoch: 28, train_loss: 0.5364, test_loss: 1.0605, test_f1: 0.6440
 epoch: 29, train_loss: 0.5074, test_loss: 1.0046, test_f1: 0.6390
 epoch: 30, train_loss: 0.4874, test_loss: 0.8671, test_f1: 0.6262
 epoch: 31, train_loss: 0.4876, test_loss: 1.1079, test_f1: 0.6244
 epoch: 32, train_loss: 0.4838, test_loss: 1.1144, test_f1: 0.6344
 epoch: 33, train_loss: 0.4752, test_loss: 1.1764, test_f1: 0.6243
 epoch: 34, train_loss: 0.4722, test_loss: 1.1443, test_f1: 0.6302
 epoch: 35, train_loss: 0.4632, test_loss: 1.1554, test_f1: 0.6184
 epoch: 36, train_loss: 0.4256, test_loss: 1.1423, test_f1: 0.6198
 epoch: 37, train_loss: 0.4077, test_loss: 1.0821, test_f1: 0.6620
 epoch: 38, train_loss: 0.3699, test_loss: 1.1726, test_f1: 0.6444
 epoch: 39, train_loss: 0.3755, test_loss: 1.3215, test_f1: 0.6142
 epoch: 40, train_loss: 0.3918, test_loss: 1.1739, test_f1: 0.6555
 epoch: 41, train_loss: 0.3845, test_loss: 1.1239, test_f1: 0.6768
 epoch: 42, train_loss: 0.3697, test_loss: 1.4496, test_f1: 0.6060
 epoch: 43, train_loss: 0.3654, test_loss: 1.5312, test_f1: 0.6125
 epoch: 44, train_loss: 0.3631, test_loss: 1.3021, test_f1: 0.6355
 epoch: 45, train_loss: 0.3551, test_loss: 1.3501, test_f1: 0.6264
 epoch: 46, train_loss: 0.3522, test_loss: 1.4773, test_f1: 0.6411
 epoch: 47, train_loss: 0.3367, test_loss: 1.4133, test_f1: 0.6312
 epoch: 48, train_loss: 0.3237, test_loss: 1.6157, test_f1: 0.6281
 epoch: 49, train_loss: 0.2934, test_loss: 1.4024, test_f1: 0.6336
 epoch: 50, train_loss: 0.2881, test_loss: 1.4863, test_f1: 0.6329
 epoch: 51, train_loss: 0.2695, test_loss: 1.4219, test_f1: 0.6524
 epoch: 52, train_loss: 0.2343, test_loss: 1.4467, test_f1: 0.6532
 epoch: 53, train_loss: 0.2285, test_loss: 1.5611, test_f1: 0.6581
 epoch: 54, train_loss: 0.2278, test_loss: 1.5912, test_f1: 0.6391
 epoch: 55, train_loss: 0.2153, test_loss: 1.7048, test_f1: 0.6503
 epoch: 56, train_loss: 0.2212, test_loss: 1.6625, test_f1: 0.6350
 epoch: 57, train_loss: 0.2059, test_loss: 1.6633, test_f1: 0.6400
 epoch: 58, train_loss: 0.2083, test_loss: 1.8096, test_f1: 0.6334
 epoch: 59, train_loss: 0.1946, test_loss: 1.8750, test_f1: 0.6421
 epoch: 60, train_loss: 0.1913, test_loss: 1.7575, test_f1: 0.6725
 epoch: 61, train_loss: 0.1911, test_loss: 1.7458, test_f1: 0.6469
 epoch: 62, train_loss: 0.1776, test_loss: 1.7924, test_f1: 0.6378
 epoch: 63, train_loss: 0.1786, test_loss: 1.8560, test_f1: 0.6333
 epoch: 64, train_loss: 0.1902, test_loss: 1.8083, test_f1: 0.6685
 epoch: 65, train_loss: 0.2051, test_loss: 2.0014, test_f1: 0.6079
 epoch: 66, train_loss: 0.1936, test_loss: 1.9322, test_f1: 0.6412
 epoch: 67, train_loss: 0.1768, test_loss: 1.9773, test_f1: 0.6126
 epoch: 68, train_loss: 0.1686, test_loss: 1.9383, test_f1: 0.6431
 epoch: 69, train_loss: 0.1752, test_loss: 2.1904, test_f1: 0.6305
 epoch: 70, train_loss: 0.1985, test_loss: 1.9551, test_f1: 0.6327
 epoch: 71, train_loss: 0.1770, test_loss: 2.0008, test_f1: 0.6338
 epoch: 72, train_loss: 0.1861, test_loss: 2.0642, test_f1: 0.6401
 epoch: 73, train_loss: 0.1748, test_loss: 2.0766, test_f1: 0.6366
 epoch: 74, train_loss: 0.1564, test_loss: 1.9821, test_f1: 0.6504
 epoch: 75, train_loss: 0.1689, test_loss: 2.1240, test_f1: 0.6050
 epoch: 76, train_loss: 0.1646, test_loss: 2.0612, test_f1: 0.6260
 epoch: 77, train_loss: 0.1430, test_loss: 2.1939, test_f1: 0.6454
 epoch: 78, train_loss: 0.1423, test_loss: 2.2218, test_f1: 0.6215
 epoch: 79, train_loss: 0.1436, test_loss: 2.3692, test_f1: 0.6122
 epoch: 80, train_loss: 0.1352, test_loss: 2.2019, test_f1: 0.6396
 epoch: 81, train_loss: 0.1590, test_loss: 2.3769, test_f1: 0.6248
 epoch: 82, train_loss: 0.1553, test_loss: 2.3535, test_f1: 0.6108
 epoch: 83, train_loss: 0.1463, test_loss: 2.3148, test_f1: 0.6308
 epoch: 84, train_loss: 0.1465, test_loss: 2.2175, test_f1: 0.6407
 epoch: 85, train_loss: 0.1351, test_loss: 2.4889, test_f1: 0.6214
 epoch: 86, train_loss: 0.1343, test_loss: 2.4062, test_f1: 0.6246
 epoch: 87, train_loss: 0.1392, test_loss: 2.3323, test_f1: 0.6290
 epoch: 88, train_loss: 0.1474, test_loss: 2.2881, test_f1: 0.6405
 epoch: 89, train_loss: 0.1511, test_loss: 2.3416, test_f1: 0.6339
 epoch: 90, train_loss: 0.1457, test_loss: 2.5140, test_f1: 0.6089
 epoch: 91, train_loss: 0.1375, test_loss: 2.6015, test_f1: 0.6042
 epoch: 92, train_loss: 0.1362, test_loss: 2.4242, test_f1: 0.6527
 epoch: 93, train_loss: 0.1407, test_loss: 2.4560, test_f1: 0.6217
 epoch: 94, train_loss: 0.1265, test_loss: 2.5318, test_f1: 0.6286
 epoch: 95, train_loss: 0.1216, test_loss: 2.5880, test_f1: 0.6244
 epoch: 96, train_loss: 0.1192, test_loss: 2.5405, test_f1: 0.6184
 epoch: 97, train_loss: 0.1157, test_loss: 2.5285, test_f1: 0.6285
 epoch: 98, train_loss: 0.1206, test_loss: 2.4955, test_f1: 0.6423
 epoch: 99, train_loss: 0.1161, test_loss: 2.7013, test_f1: 0.6216
##################ITERATION #2 ****************************************
 epoch: 0, train_loss: 1.2159, test_loss: 1.2520, test_f1: 0.2344
 epoch: 1, train_loss: 1.0311, test_loss: 1.1619, test_f1: 0.3469
 epoch: 2, train_loss: 0.9663, test_loss: 1.0785, test_f1: 0.3692
 epoch: 3, train_loss: 0.9280, test_loss: 1.0207, test_f1: 0.4631
 epoch: 4, train_loss: 0.9044, test_loss: 0.9388, test_f1: 0.5167
 epoch: 5, train_loss: 0.8603, test_loss: 0.9401, test_f1: 0.5142
 epoch: 6, train_loss: 0.8463, test_loss: 0.9562, test_f1: 0.5465
 epoch: 7, train_loss: 0.8259, test_loss: 0.9238, test_f1: 0.5450
 epoch: 8, train_loss: 0.8066, test_loss: 0.9225, test_f1: 0.5310
 epoch: 9, train_loss: 0.7885, test_loss: 0.9614, test_f1: 0.5757
 epoch: 10, train_loss: 0.7864, test_loss: 0.9168, test_f1: 0.5814
 epoch: 11, train_loss: 0.7518, test_loss: 0.9421, test_f1: 0.5941
 epoch: 12, train_loss: 0.7367, test_loss: 0.9964, test_f1: 0.5779
 epoch: 13, train_loss: 0.7534, test_loss: 0.9345, test_f1: 0.5510
 epoch: 14, train_loss: 0.7393, test_loss: 0.9125, test_f1: 0.6084
 epoch: 15, train_loss: 0.6975, test_loss: 0.9133, test_f1: 0.6246
 epoch: 16, train_loss: 0.6867, test_loss: 0.9448, test_f1: 0.6073
 epoch: 17, train_loss: 0.6937, test_loss: 0.9791, test_f1: 0.6200
 epoch: 18, train_loss: 0.6800, test_loss: 0.9305, test_f1: 0.6189
 epoch: 19, train_loss: 0.6642, test_loss: 1.0184, test_f1: 0.5886
 epoch: 20, train_loss: 0.6409, test_loss: 0.9292, test_f1: 0.6439
 epoch: 21, train_loss: 0.6392, test_loss: 1.0243, test_f1: 0.6013
 epoch: 22, train_loss: 0.6377, test_loss: 0.9489, test_f1: 0.6449
 epoch: 23, train_loss: 0.5981, test_loss: 1.0277, test_f1: 0.6156
 epoch: 24, train_loss: 0.6027, test_loss: 1.0211, test_f1: 0.6284
 epoch: 25, train_loss: 0.5768, test_loss: 1.0392, test_f1: 0.6403
 epoch: 26, train_loss: 0.5830, test_loss: 1.0593, test_f1: 0.5955
 epoch: 27, train_loss: 0.5648, test_loss: 1.0078, test_f1: 0.6359
 epoch: 28, train_loss: 0.5642, test_loss: 0.9758, test_f1: 0.6217
 epoch: 29, train_loss: 0.5400, test_loss: 1.0069, test_f1: 0.6180
 epoch: 30, train_loss: 0.5206, test_loss: 1.1060, test_f1: 0.6124
 epoch: 31, train_loss: 0.5091, test_loss: 0.9952, test_f1: 0.6730
 epoch: 32, train_loss: 0.5017, test_loss: 1.0646, test_f1: 0.6383
 epoch: 33, train_loss: 0.4826, test_loss: 1.0953, test_f1: 0.6499
 epoch: 34, train_loss: 0.4937, test_loss: 1.0745, test_f1: 0.6382
 epoch: 35, train_loss: 0.4888, test_loss: 1.1158, test_f1: 0.6481
 epoch: 36, train_loss: 0.4766, test_loss: 1.1446, test_f1: 0.6058
 epoch: 37, train_loss: 0.4612, test_loss: 1.0924, test_f1: 0.6363
 epoch: 38, train_loss: 0.4461, test_loss: 1.1199, test_f1: 0.6195
 epoch: 39, train_loss: 0.4408, test_loss: 1.1946, test_f1: 0.6717
 epoch: 40, train_loss: 0.4328, test_loss: 1.1301, test_f1: 0.6686
 epoch: 41, train_loss: 0.4411, test_loss: 1.1921, test_f1: 0.6502
 epoch: 42, train_loss: 0.4173, test_loss: 1.2029, test_f1: 0.6210
 epoch: 43, train_loss: 0.4037, test_loss: 1.3339, test_f1: 0.6392
 epoch: 44, train_loss: 0.4028, test_loss: 1.0997, test_f1: 0.6821
 epoch: 45, train_loss: 0.3740, test_loss: 1.4263, test_f1: 0.6270
 epoch: 46, train_loss: 0.3842, test_loss: 1.3145, test_f1: 0.6599
 epoch: 47, train_loss: 0.3770, test_loss: 1.1691, test_f1: 0.6691
 epoch: 48, train_loss: 0.3649, test_loss: 1.3699, test_f1: 0.6334
 epoch: 49, train_loss: 0.3453, test_loss: 1.3033, test_f1: 0.6311
 epoch: 50, train_loss: 0.3698, test_loss: 1.5689, test_f1: 0.6346
 epoch: 51, train_loss: 0.3454, test_loss: 1.1870, test_f1: 0.6628
 epoch: 52, train_loss: 0.2975, test_loss: 1.3272, test_f1: 0.6428
 epoch: 53, train_loss: 0.2689, test_loss: 1.3508, test_f1: 0.6603
 epoch: 54, train_loss: 0.2700, test_loss: 1.4312, test_f1: 0.6534
 epoch: 55, train_loss: 0.2534, test_loss: 1.4034, test_f1: 0.6490
 epoch: 56, train_loss: 0.2365, test_loss: 1.5231, test_f1: 0.6523
 epoch: 57, train_loss: 0.2440, test_loss: 1.5196, test_f1: 0.6649
 epoch: 58, train_loss: 0.2428, test_loss: 1.4777, test_f1: 0.6586
 epoch: 59, train_loss: 0.2257, test_loss: 1.5458, test_f1: 0.6548
 epoch: 60, train_loss: 0.2374, test_loss: 1.5719, test_f1: 0.6613
 epoch: 61, train_loss: 0.2287, test_loss: 1.6370, test_f1: 0.6601
 epoch: 62, train_loss: 0.2145, test_loss: 1.5437, test_f1: 0.6550
 epoch: 63, train_loss: 0.2161, test_loss: 1.7411, test_f1: 0.6442
 epoch: 64, train_loss: 0.2284, test_loss: 1.6396, test_f1: 0.6201
 epoch: 65, train_loss: 0.2339, test_loss: 1.5870, test_f1: 0.6466
 epoch: 66, train_loss: 0.2083, test_loss: 1.6532, test_f1: 0.6438
 epoch: 67, train_loss: 0.2046, test_loss: 1.7011, test_f1: 0.6395
 epoch: 68, train_loss: 0.2228, test_loss: 1.5994, test_f1: 0.6469
 epoch: 69, train_loss: 0.2159, test_loss: 1.6817, test_f1: 0.6316
 epoch: 70, train_loss: 0.1968, test_loss: 1.9003, test_f1: 0.6524
 epoch: 71, train_loss: 0.1951, test_loss: 1.7329, test_f1: 0.6484
 epoch: 72, train_loss: 0.1877, test_loss: 1.8772, test_f1: 0.6428
 epoch: 73, train_loss: 0.1851, test_loss: 1.9357, test_f1: 0.6363
 epoch: 74, train_loss: 0.1835, test_loss: 1.6882, test_f1: 0.6596
 epoch: 75, train_loss: 0.1846, test_loss: 1.7678, test_f1: 0.6389
 epoch: 76, train_loss: 0.1891, test_loss: 1.6453, test_f1: 0.6559
 epoch: 77, train_loss: 0.1866, test_loss: 2.0003, test_f1: 0.6356
 epoch: 78, train_loss: 0.1768, test_loss: 1.8770, test_f1: 0.6386
 epoch: 79, train_loss: 0.1797, test_loss: 1.7739, test_f1: 0.6399
 epoch: 80, train_loss: 0.1868, test_loss: 1.9044, test_f1: 0.6459
 epoch: 81, train_loss: 0.1712, test_loss: 2.0225, test_f1: 0.6456
 epoch: 82, train_loss: 0.1639, test_loss: 2.0078, test_f1: 0.6547
 epoch: 83, train_loss: 0.1878, test_loss: 1.9841, test_f1: 0.6487
 epoch: 84, train_loss: 0.1820, test_loss: 1.8714, test_f1: 0.6501
 epoch: 85, train_loss: 0.1904, test_loss: 1.9043, test_f1: 0.6373
 epoch: 86, train_loss: 0.1941, test_loss: 1.9889, test_f1: 0.6350
 epoch: 87, train_loss: 0.1781, test_loss: 2.2598, test_f1: 0.6185
 epoch: 88, train_loss: 0.1775, test_loss: 2.1146, test_f1: 0.6109
 epoch: 89, train_loss: 0.1679, test_loss: 1.9397, test_f1: 0.6415
 epoch: 90, train_loss: 0.1508, test_loss: 2.0489, test_f1: 0.6291
 epoch: 91, train_loss: 0.1506, test_loss: 2.0343, test_f1: 0.6346
 epoch: 92, train_loss: 0.1520, test_loss: 2.2069, test_f1: 0.6320
 epoch: 93, train_loss: 0.1397, test_loss: 2.1513, test_f1: 0.6364
 epoch: 94, train_loss: 0.1373, test_loss: 2.0394, test_f1: 0.6445
 epoch: 95, train_loss: 0.1351, test_loss: 2.1235, test_f1: 0.6414
 epoch: 96, train_loss: 0.1406, test_loss: 2.4362, test_f1: 0.6141
 epoch: 97, train_loss: 0.1574, test_loss: 2.2231, test_f1: 0.6515
 epoch: 98, train_loss: 0.1703, test_loss: 2.2887, test_f1: 0.6269
 epoch: 99, train_loss: 0.1650, test_loss: 2.4027, test_f1: 0.6255
##################ITERATION #3 ****************************************
 epoch: 0, train_loss: 1.2894, test_loss: 1.2691, test_f1: 0.2270
 epoch: 1, train_loss: 1.0387, test_loss: 1.1617, test_f1: 0.3751
 epoch: 2, train_loss: 0.9696, test_loss: 1.0442, test_f1: 0.4782
 epoch: 3, train_loss: 0.9249, test_loss: 0.9850, test_f1: 0.4986
 epoch: 4, train_loss: 0.8917, test_loss: 0.9525, test_f1: 0.5345
 epoch: 5, train_loss: 0.8765, test_loss: 0.9644, test_f1: 0.5061
 epoch: 6, train_loss: 0.8448, test_loss: 0.9366, test_f1: 0.5561
 epoch: 7, train_loss: 0.8378, test_loss: 0.9349, test_f1: 0.5609
 epoch: 8, train_loss: 0.8160, test_loss: 0.9038, test_f1: 0.5607
 epoch: 9, train_loss: 0.7915, test_loss: 0.9584, test_f1: 0.5818
 epoch: 10, train_loss: 0.7775, test_loss: 1.0278, test_f1: 0.5571
 epoch: 11, train_loss: 0.7768, test_loss: 0.9332, test_f1: 0.5923
 epoch: 12, train_loss: 0.7582, test_loss: 0.9738, test_f1: 0.5366
 epoch: 13, train_loss: 0.7477, test_loss: 0.9754, test_f1: 0.6334
 epoch: 14, train_loss: 0.7285, test_loss: 0.9532, test_f1: 0.5909
 epoch: 15, train_loss: 0.7249, test_loss: 0.9589, test_f1: 0.6315
 epoch: 16, train_loss: 0.6945, test_loss: 1.0048, test_f1: 0.5757
 epoch: 17, train_loss: 0.6996, test_loss: 1.0140, test_f1: 0.5905
 epoch: 18, train_loss: 0.6921, test_loss: 1.0201, test_f1: 0.5685
 epoch: 19, train_loss: 0.6695, test_loss: 0.9868, test_f1: 0.6316
 epoch: 20, train_loss: 0.6564, test_loss: 1.0067, test_f1: 0.6030
 epoch: 21, train_loss: 0.6566, test_loss: 1.0449, test_f1: 0.6049
 epoch: 22, train_loss: 0.6420, test_loss: 0.9633, test_f1: 0.6327
 epoch: 23, train_loss: 0.6395, test_loss: 0.9701, test_f1: 0.6351
 epoch: 24, train_loss: 0.6231, test_loss: 0.9585, test_f1: 0.6567
 epoch: 25, train_loss: 0.6056, test_loss: 1.0191, test_f1: 0.6252
 epoch: 26, train_loss: 0.5998, test_loss: 1.1113, test_f1: 0.5916
 epoch: 27, train_loss: 0.5756, test_loss: 1.0263, test_f1: 0.6186
 epoch: 28, train_loss: 0.5766, test_loss: 1.0033, test_f1: 0.6192
 epoch: 29, train_loss: 0.5574, test_loss: 1.0347, test_f1: 0.6328
 epoch: 30, train_loss: 0.5335, test_loss: 1.1195, test_f1: 0.6300
 epoch: 31, train_loss: 0.5251, test_loss: 1.0683, test_f1: 0.6408
 epoch: 32, train_loss: 0.5220, test_loss: 1.0992, test_f1: 0.6353
 epoch: 33, train_loss: 0.5090, test_loss: 1.1264, test_f1: 0.5955
 epoch: 34, train_loss: 0.5117, test_loss: 1.1080, test_f1: 0.6059
 epoch: 35, train_loss: 0.5006, test_loss: 1.1599, test_f1: 0.5953
 epoch: 36, train_loss: 0.4799, test_loss: 1.2101, test_f1: 0.6355
 epoch: 37, train_loss: 0.4880, test_loss: 1.3440, test_f1: 0.6260
 epoch: 38, train_loss: 0.4689, test_loss: 1.1955, test_f1: 0.6549
 epoch: 39, train_loss: 0.4665, test_loss: 1.1685, test_f1: 0.6430
 epoch: 40, train_loss: 0.4347, test_loss: 1.2248, test_f1: 0.6116
 epoch: 41, train_loss: 0.4345, test_loss: 1.2763, test_f1: 0.6498
 epoch: 42, train_loss: 0.4278, test_loss: 1.2519, test_f1: 0.5988
 epoch: 43, train_loss: 0.4231, test_loss: 1.2506, test_f1: 0.6201
 epoch: 44, train_loss: 0.4138, test_loss: 1.2352, test_f1: 0.6273
 epoch: 45, train_loss: 0.3943, test_loss: 1.2917, test_f1: 0.5994
 epoch: 46, train_loss: 0.3838, test_loss: 1.1989, test_f1: 0.6571
 epoch: 47, train_loss: 0.3916, test_loss: 1.4682, test_f1: 0.6291
 epoch: 48, train_loss: 0.3588, test_loss: 1.4692, test_f1: 0.6242
 epoch: 49, train_loss: 0.3635, test_loss: 1.5640, test_f1: 0.6308
 epoch: 50, train_loss: 0.3608, test_loss: 1.4678, test_f1: 0.6302
 epoch: 51, train_loss: 0.3239, test_loss: 1.3226, test_f1: 0.6577
 epoch: 52, train_loss: 0.2930, test_loss: 1.5292, test_f1: 0.6395
 epoch: 53, train_loss: 0.2943, test_loss: 1.5196, test_f1: 0.6343
 epoch: 54, train_loss: 0.2751, test_loss: 1.5751, test_f1: 0.6473
 epoch: 55, train_loss: 0.2713, test_loss: 1.5601, test_f1: 0.6622
 epoch: 56, train_loss: 0.2716, test_loss: 1.5366, test_f1: 0.6573
 epoch: 57, train_loss: 0.2450, test_loss: 1.5339, test_f1: 0.6548
 epoch: 58, train_loss: 0.2493, test_loss: 1.6231, test_f1: 0.6361
 epoch: 59, train_loss: 0.2453, test_loss: 1.6417, test_f1: 0.6446
 epoch: 60, train_loss: 0.2403, test_loss: 1.7134, test_f1: 0.6347
 epoch: 61, train_loss: 0.2337, test_loss: 1.7507, test_f1: 0.6521
 epoch: 62, train_loss: 0.2461, test_loss: 1.6878, test_f1: 0.6153
 epoch: 63, train_loss: 0.2424, test_loss: 1.6994, test_f1: 0.6444
 epoch: 64, train_loss: 0.2390, test_loss: 1.7202, test_f1: 0.6392
 epoch: 65, train_loss: 0.2273, test_loss: 1.8176, test_f1: 0.6267
 epoch: 66, train_loss: 0.2305, test_loss: 1.7391, test_f1: 0.6092
 epoch: 67, train_loss: 0.2289, test_loss: 1.8248, test_f1: 0.6496
 epoch: 68, train_loss: 0.2404, test_loss: 1.7666, test_f1: 0.6359
 epoch: 69, train_loss: 0.2047, test_loss: 1.8206, test_f1: 0.6457
 epoch: 70, train_loss: 0.2308, test_loss: 1.9077, test_f1: 0.6288
 epoch: 71, train_loss: 0.2140, test_loss: 1.8770, test_f1: 0.6417
 epoch: 72, train_loss: 0.2053, test_loss: 1.8175, test_f1: 0.6242
 epoch: 73, train_loss: 0.2110, test_loss: 1.9430, test_f1: 0.6144
 epoch: 74, train_loss: 0.1999, test_loss: 1.8782, test_f1: 0.6316
 epoch: 75, train_loss: 0.1956, test_loss: 1.8938, test_f1: 0.6147
 epoch: 76, train_loss: 0.1913, test_loss: 1.7392, test_f1: 0.6715
 epoch: 77, train_loss: 0.1993, test_loss: 1.9544, test_f1: 0.6231
 epoch: 78, train_loss: 0.2109, test_loss: 1.9007, test_f1: 0.6400
 epoch: 79, train_loss: 0.2000, test_loss: 1.9083, test_f1: 0.6377
 epoch: 80, train_loss: 0.2137, test_loss: 1.9846, test_f1: 0.6195
 epoch: 81, train_loss: 0.1826, test_loss: 1.9842, test_f1: 0.6546
 epoch: 82, train_loss: 0.1842, test_loss: 2.0527, test_f1: 0.6508
 epoch: 83, train_loss: 0.1781, test_loss: 2.0826, test_f1: 0.6472
 epoch: 84, train_loss: 0.1690, test_loss: 2.1257, test_f1: 0.6231
 epoch: 85, train_loss: 0.1755, test_loss: 2.1808, test_f1: 0.6372
 epoch: 86, train_loss: 0.1605, test_loss: 1.9876, test_f1: 0.6541
 epoch: 87, train_loss: 0.1704, test_loss: 2.1783, test_f1: 0.6213
 epoch: 88, train_loss: 0.1900, test_loss: 2.2339, test_f1: 0.6333
 epoch: 89, train_loss: 0.1943, test_loss: 2.0024, test_f1: 0.6446
 epoch: 90, train_loss: 0.1798, test_loss: 2.2312, test_f1: 0.5958
 epoch: 91, train_loss: 0.1798, test_loss: 2.0909, test_f1: 0.6509
 epoch: 92, train_loss: 0.1706, test_loss: 2.1027, test_f1: 0.6448
 epoch: 93, train_loss: 0.1616, test_loss: 2.2346, test_f1: 0.6315
 epoch: 94, train_loss: 0.1643, test_loss: 2.2548, test_f1: 0.6233
 epoch: 95, train_loss: 0.1676, test_loss: 2.1497, test_f1: 0.6344
 epoch: 96, train_loss: 0.1534, test_loss: 2.2320, test_f1: 0.6414
 epoch: 97, train_loss: 0.1452, test_loss: 2.3699, test_f1: 0.6212
 epoch: 98, train_loss: 0.1533, test_loss: 2.1993, test_f1: 0.6546
 epoch: 99, train_loss: 0.1648, test_loss: 2.3723, test_f1: 0.6373
##################ITERATION #4 ****************************************
 epoch: 0, train_loss: 1.3206, test_loss: 1.2784, test_f1: 0.2270
 epoch: 1, train_loss: 1.0598, test_loss: 1.2367, test_f1: 0.2320
 epoch: 2, train_loss: 0.9716, test_loss: 1.0600, test_f1: 0.4462
 epoch: 3, train_loss: 0.9474, test_loss: 0.9545, test_f1: 0.4972
 epoch: 4, train_loss: 0.9064, test_loss: 0.8987, test_f1: 0.4909
 epoch: 5, train_loss: 0.8757, test_loss: 0.9531, test_f1: 0.5066
 epoch: 6, train_loss: 0.8554, test_loss: 0.9403, test_f1: 0.5286
 epoch: 7, train_loss: 0.8391, test_loss: 0.9187, test_f1: 0.5804
 epoch: 8, train_loss: 0.8305, test_loss: 0.9470, test_f1: 0.5244
 epoch: 9, train_loss: 0.8034, test_loss: 0.8881, test_f1: 0.5499
 epoch: 10, train_loss: 0.7722, test_loss: 0.9207, test_f1: 0.5852
 epoch: 11, train_loss: 0.7620, test_loss: 0.9092, test_f1: 0.5771
 epoch: 12, train_loss: 0.7586, test_loss: 0.9260, test_f1: 0.6002
 epoch: 13, train_loss: 0.7242, test_loss: 0.9509, test_f1: 0.5701
 epoch: 14, train_loss: 0.7319, test_loss: 1.0055, test_f1: 0.5894
 epoch: 15, train_loss: 0.7071, test_loss: 0.9376, test_f1: 0.5783
 epoch: 16, train_loss: 0.7040, test_loss: 0.9414, test_f1: 0.5924
 epoch: 17, train_loss: 0.6923, test_loss: 0.9324, test_f1: 0.6054
 epoch: 18, train_loss: 0.6834, test_loss: 0.9254, test_f1: 0.6175
 epoch: 19, train_loss: 0.6666, test_loss: 0.9426, test_f1: 0.6379
 epoch: 20, train_loss: 0.6436, test_loss: 0.9401, test_f1: 0.6272
 epoch: 21, train_loss: 0.6441, test_loss: 1.0029, test_f1: 0.6093
 epoch: 22, train_loss: 0.6170, test_loss: 1.0132, test_f1: 0.6331
 epoch: 23, train_loss: 0.6103, test_loss: 0.9807, test_f1: 0.6078
 epoch: 24, train_loss: 0.5884, test_loss: 0.9658, test_f1: 0.6572
 epoch: 25, train_loss: 0.5904, test_loss: 1.0290, test_f1: 0.6247
 epoch: 26, train_loss: 0.5688, test_loss: 0.9956, test_f1: 0.6052
 epoch: 27, train_loss: 0.5635, test_loss: 0.9853, test_f1: 0.6058
 epoch: 28, train_loss: 0.5554, test_loss: 1.0620, test_f1: 0.6473
 epoch: 29, train_loss: 0.5396, test_loss: 1.1068, test_f1: 0.6455
 epoch: 30, train_loss: 0.5418, test_loss: 1.0914, test_f1: 0.6132
 epoch: 31, train_loss: 0.5311, test_loss: 0.9985, test_f1: 0.6276
 epoch: 32, train_loss: 0.5465, test_loss: 1.1998, test_f1: 0.6082
 epoch: 33, train_loss: 0.5257, test_loss: 1.1044, test_f1: 0.6200
 epoch: 34, train_loss: 0.4971, test_loss: 1.1206, test_f1: 0.6571
 epoch: 35, train_loss: 0.4916, test_loss: 1.1109, test_f1: 0.6488
 epoch: 36, train_loss: 0.4635, test_loss: 1.1761, test_f1: 0.6515
 epoch: 37, train_loss: 0.4877, test_loss: 1.1983, test_f1: 0.6407
 epoch: 38, train_loss: 0.4765, test_loss: 1.1557, test_f1: 0.6364
 epoch: 39, train_loss: 0.4475, test_loss: 1.2339, test_f1: 0.6182
 epoch: 40, train_loss: 0.4398, test_loss: 1.1783, test_f1: 0.6484
 epoch: 41, train_loss: 0.4327, test_loss: 1.1742, test_f1: 0.6554
 epoch: 42, train_loss: 0.4444, test_loss: 1.0989, test_f1: 0.6529
 epoch: 43, train_loss: 0.4253, test_loss: 1.1419, test_f1: 0.6547
 epoch: 44, train_loss: 0.4174, test_loss: 1.4869, test_f1: 0.6094
 epoch: 45, train_loss: 0.3927, test_loss: 1.2408, test_f1: 0.6420
 epoch: 46, train_loss: 0.3840, test_loss: 1.2234, test_f1: 0.6506
 epoch: 47, train_loss: 0.3894, test_loss: 1.2638, test_f1: 0.6583
 epoch: 48, train_loss: 0.4128, test_loss: 1.2844, test_f1: 0.6211
 epoch: 49, train_loss: 0.3628, test_loss: 1.3446, test_f1: 0.6284
 epoch: 50, train_loss: 0.3778, test_loss: 1.3377, test_f1: 0.6365
 epoch: 51, train_loss: 0.3580, test_loss: 1.3155, test_f1: 0.6355
 epoch: 52, train_loss: 0.3117, test_loss: 1.3564, test_f1: 0.6318
 epoch: 53, train_loss: 0.2793, test_loss: 1.4144, test_f1: 0.6484
 epoch: 54, train_loss: 0.2810, test_loss: 1.4808, test_f1: 0.6343
 epoch: 55, train_loss: 0.2784, test_loss: 1.4884, test_f1: 0.6577
 epoch: 56, train_loss: 0.2783, test_loss: 1.4101, test_f1: 0.6569
 epoch: 57, train_loss: 0.2659, test_loss: 1.4766, test_f1: 0.6675
 epoch: 58, train_loss: 0.2491, test_loss: 1.4772, test_f1: 0.6642
 epoch: 59, train_loss: 0.2569, test_loss: 1.5959, test_f1: 0.6889
 epoch: 60, train_loss: 0.2384, test_loss: 1.5204, test_f1: 0.6488
 epoch: 61, train_loss: 0.2454, test_loss: 1.5084, test_f1: 0.6536
 epoch: 62, train_loss: 0.2403, test_loss: 1.5367, test_f1: 0.6568
 epoch: 63, train_loss: 0.2328, test_loss: 1.5876, test_f1: 0.6600
 epoch: 64, train_loss: 0.2405, test_loss: 1.6749, test_f1: 0.6409
 epoch: 65, train_loss: 0.2224, test_loss: 1.6337, test_f1: 0.6693
 epoch: 66, train_loss: 0.2198, test_loss: 1.6514, test_f1: 0.6414
 epoch: 67, train_loss: 0.2161, test_loss: 1.6473, test_f1: 0.6699
 epoch: 68, train_loss: 0.2222, test_loss: 1.7514, test_f1: 0.6195
 epoch: 69, train_loss: 0.2103, test_loss: 1.7682, test_f1: 0.6480
 epoch: 70, train_loss: 0.2152, test_loss: 1.7738, test_f1: 0.6481
 epoch: 71, train_loss: 0.2190, test_loss: 1.7668, test_f1: 0.6561
 epoch: 72, train_loss: 0.2027, test_loss: 1.8547, test_f1: 0.6369
 epoch: 73, train_loss: 0.1933, test_loss: 1.8072, test_f1: 0.6578
 epoch: 74, train_loss: 0.2218, test_loss: 1.7373, test_f1: 0.6703
 epoch: 75, train_loss: 0.2141, test_loss: 1.8307, test_f1: 0.6392
 epoch: 76, train_loss: 0.1892, test_loss: 1.8303, test_f1: 0.6530
 epoch: 77, train_loss: 0.1938, test_loss: 1.8448, test_f1: 0.6441
 epoch: 78, train_loss: 0.1789, test_loss: 1.7615, test_f1: 0.6725
 epoch: 79, train_loss: 0.1930, test_loss: 1.9980, test_f1: 0.6431
 epoch: 80, train_loss: 0.1988, test_loss: 1.8813, test_f1: 0.6451
 epoch: 81, train_loss: 0.1883, test_loss: 1.8786, test_f1: 0.6600
 epoch: 82, train_loss: 0.1847, test_loss: 1.9388, test_f1: 0.6437
 epoch: 83, train_loss: 0.1826, test_loss: 1.8721, test_f1: 0.6665
 epoch: 84, train_loss: 0.1872, test_loss: 2.1241, test_f1: 0.6093
 epoch: 85, train_loss: 0.1807, test_loss: 1.8853, test_f1: 0.6412
 epoch: 86, train_loss: 0.1750, test_loss: 1.8579, test_f1: 0.6542
 epoch: 87, train_loss: 0.2083, test_loss: 2.0016, test_f1: 0.6463
 epoch: 88, train_loss: 0.1916, test_loss: 1.9276, test_f1: 0.6631
 epoch: 89, train_loss: 0.1785, test_loss: 1.8821, test_f1: 0.6389
 epoch: 90, train_loss: 0.1805, test_loss: 2.0142, test_f1: 0.6300
 epoch: 91, train_loss: 0.1941, test_loss: 1.9048, test_f1: 0.6670
 epoch: 92, train_loss: 0.1833, test_loss: 2.0627, test_f1: 0.6119
 epoch: 93, train_loss: 0.1655, test_loss: 2.0034, test_f1: 0.6362
 epoch: 94, train_loss: 0.1619, test_loss: 1.9910, test_f1: 0.6465
 epoch: 95, train_loss: 0.1668, test_loss: 2.0191, test_f1: 0.6342
 epoch: 96, train_loss: 0.1517, test_loss: 2.0265, test_f1: 0.6608
 epoch: 97, train_loss: 0.1521, test_loss: 2.0110, test_f1: 0.6800
 epoch: 98, train_loss: 0.1750, test_loss: 2.1149, test_f1: 0.6349
 epoch: 99, train_loss: 0.1683, test_loss: 2.1326, test_f1: 0.6339
##################ITERATION #5 ****************************************
 epoch: 0, train_loss: 1.4940, test_loss: 1.2860, test_f1: 0.2270
 epoch: 1, train_loss: 1.0972, test_loss: 1.1793, test_f1: 0.3582
 epoch: 2, train_loss: 1.0080, test_loss: 1.0455, test_f1: 0.4355
 epoch: 3, train_loss: 0.9460, test_loss: 0.9816, test_f1: 0.4719
 epoch: 4, train_loss: 0.9155, test_loss: 0.9392, test_f1: 0.5336
 epoch: 5, train_loss: 0.8869, test_loss: 0.9568, test_f1: 0.4764
 epoch: 6, train_loss: 0.8618, test_loss: 0.9565, test_f1: 0.5150
 epoch: 7, train_loss: 0.8479, test_loss: 0.9067, test_f1: 0.5992
 epoch: 8, train_loss: 0.8235, test_loss: 0.8907, test_f1: 0.5485
 epoch: 9, train_loss: 0.8304, test_loss: 0.8982, test_f1: 0.5684
 epoch: 10, train_loss: 0.7898, test_loss: 0.9050, test_f1: 0.6069
 epoch: 11, train_loss: 0.7827, test_loss: 0.9080, test_f1: 0.5653
 epoch: 12, train_loss: 0.7826, test_loss: 0.9558, test_f1: 0.5740
 epoch: 13, train_loss: 0.7612, test_loss: 0.9057, test_f1: 0.5944
 epoch: 14, train_loss: 0.7493, test_loss: 0.9067, test_f1: 0.5819
 epoch: 15, train_loss: 0.7375, test_loss: 0.8925, test_f1: 0.6204
 epoch: 16, train_loss: 0.7208, test_loss: 0.9228, test_f1: 0.5773
 epoch: 17, train_loss: 0.7305, test_loss: 0.9911, test_f1: 0.5638
 epoch: 18, train_loss: 0.7032, test_loss: 1.0765, test_f1: 0.5631
 epoch: 19, train_loss: 0.6976, test_loss: 0.9744, test_f1: 0.6447
 epoch: 20, train_loss: 0.6774, test_loss: 0.9457, test_f1: 0.6057
 epoch: 21, train_loss: 0.6734, test_loss: 0.9485, test_f1: 0.6106
 epoch: 22, train_loss: 0.6686, test_loss: 1.0111, test_f1: 0.6128
 epoch: 23, train_loss: 0.6713, test_loss: 0.9785, test_f1: 0.6297
 epoch: 24, train_loss: 0.6583, test_loss: 0.9806, test_f1: 0.6243
 epoch: 25, train_loss: 0.6316, test_loss: 0.9200, test_f1: 0.6277
 epoch: 26, train_loss: 0.6237, test_loss: 0.9941, test_f1: 0.5746
 epoch: 27, train_loss: 0.6232, test_loss: 1.0250, test_f1: 0.5534
 epoch: 28, train_loss: 0.6008, test_loss: 1.0409, test_f1: 0.6225
 epoch: 29, train_loss: 0.5953, test_loss: 0.9487, test_f1: 0.6075
 epoch: 30, train_loss: 0.5799, test_loss: 1.0169, test_f1: 0.6377
 epoch: 31, train_loss: 0.5887, test_loss: 0.9151, test_f1: 0.5920
 epoch: 32, train_loss: 0.5631, test_loss: 1.0354, test_f1: 0.6209
 epoch: 33, train_loss: 0.5616, test_loss: 0.9915, test_f1: 0.6238
 epoch: 34, train_loss: 0.5440, test_loss: 1.0667, test_f1: 0.6279
 epoch: 35, train_loss: 0.5331, test_loss: 1.0369, test_f1: 0.5936
 epoch: 36, train_loss: 0.5409, test_loss: 1.2472, test_f1: 0.5527
 epoch: 37, train_loss: 0.5196, test_loss: 1.0053, test_f1: 0.6171
 epoch: 38, train_loss: 0.5034, test_loss: 1.1501, test_f1: 0.6072
 epoch: 39, train_loss: 0.5136, test_loss: 1.0447, test_f1: 0.6265
 epoch: 40, train_loss: 0.5294, test_loss: 1.2330, test_f1: 0.5723
 epoch: 41, train_loss: 0.5168, test_loss: 1.0936, test_f1: 0.5952
 epoch: 42, train_loss: 0.4864, test_loss: 1.1212, test_f1: 0.6333
 epoch: 43, train_loss: 0.4523, test_loss: 1.0719, test_f1: 0.6494
 epoch: 44, train_loss: 0.4499, test_loss: 1.1591, test_f1: 0.6141
 epoch: 45, train_loss: 0.4385, test_loss: 1.1824, test_f1: 0.6517
 epoch: 46, train_loss: 0.4425, test_loss: 1.2422, test_f1: 0.6431
 epoch: 47, train_loss: 0.4320, test_loss: 1.1696, test_f1: 0.6098
 epoch: 48, train_loss: 0.4494, test_loss: 1.3699, test_f1: 0.5867
 epoch: 49, train_loss: 0.4248, test_loss: 1.3655, test_f1: 0.6252
 epoch: 50, train_loss: 0.4307, test_loss: 1.2930, test_f1: 0.6132
 epoch: 51, train_loss: 0.3827, test_loss: 1.2494, test_f1: 0.6353
 epoch: 52, train_loss: 0.3534, test_loss: 1.2896, test_f1: 0.6256
 epoch: 53, train_loss: 0.3204, test_loss: 1.2084, test_f1: 0.6270
 epoch: 54, train_loss: 0.3188, test_loss: 1.2597, test_f1: 0.6352
 epoch: 55, train_loss: 0.3172, test_loss: 1.4153, test_f1: 0.6098
 epoch: 56, train_loss: 0.3032, test_loss: 1.4572, test_f1: 0.6339
 epoch: 57, train_loss: 0.3026, test_loss: 1.3465, test_f1: 0.6290
 epoch: 58, train_loss: 0.2886, test_loss: 1.4751, test_f1: 0.6413
 epoch: 59, train_loss: 0.2885, test_loss: 1.3964, test_f1: 0.6304
 epoch: 60, train_loss: 0.3005, test_loss: 1.5199, test_f1: 0.6183
 epoch: 61, train_loss: 0.2755, test_loss: 1.3834, test_f1: 0.6314
 epoch: 62, train_loss: 0.2903, test_loss: 1.3859, test_f1: 0.6326
 epoch: 63, train_loss: 0.2806, test_loss: 1.6070, test_f1: 0.6284
 epoch: 64, train_loss: 0.2702, test_loss: 1.5025, test_f1: 0.6349
 epoch: 65, train_loss: 0.2716, test_loss: 1.4938, test_f1: 0.6317
 epoch: 66, train_loss: 0.2567, test_loss: 1.5150, test_f1: 0.6252
 epoch: 67, train_loss: 0.2612, test_loss: 1.4348, test_f1: 0.6487
 epoch: 68, train_loss: 0.2558, test_loss: 1.6373, test_f1: 0.6048
 epoch: 69, train_loss: 0.2381, test_loss: 1.5849, test_f1: 0.6302
 epoch: 70, train_loss: 0.2541, test_loss: 1.5149, test_f1: 0.6174
 epoch: 71, train_loss: 0.2480, test_loss: 1.6194, test_f1: 0.6152
 epoch: 72, train_loss: 0.2398, test_loss: 1.6027, test_f1: 0.6172
 epoch: 73, train_loss: 0.2727, test_loss: 1.5362, test_f1: 0.6012
 epoch: 74, train_loss: 0.2439, test_loss: 1.6401, test_f1: 0.6020
 epoch: 75, train_loss: 0.2341, test_loss: 1.7989, test_f1: 0.6088
 epoch: 76, train_loss: 0.2501, test_loss: 1.6899, test_f1: 0.6061
 epoch: 77, train_loss: 0.2320, test_loss: 1.8636, test_f1: 0.6026
 epoch: 78, train_loss: 0.2490, test_loss: 1.5227, test_f1: 0.6380
 epoch: 79, train_loss: 0.2287, test_loss: 1.6407, test_f1: 0.6270
 epoch: 80, train_loss: 0.2189, test_loss: 1.6753, test_f1: 0.6297
 epoch: 81, train_loss: 0.2125, test_loss: 1.6084, test_f1: 0.6345
 epoch: 82, train_loss: 0.2038, test_loss: 1.8403, test_f1: 0.6056
 epoch: 83, train_loss: 0.1972, test_loss: 1.7295, test_f1: 0.6144
 epoch: 84, train_loss: 0.2018, test_loss: 1.8856, test_f1: 0.6186
 epoch: 85, train_loss: 0.1982, test_loss: 1.8398, test_f1: 0.6194
 epoch: 86, train_loss: 0.2153, test_loss: 1.8812, test_f1: 0.6216
 epoch: 87, train_loss: 0.1910, test_loss: 1.8357, test_f1: 0.6058
 epoch: 88, train_loss: 0.2127, test_loss: 1.8150, test_f1: 0.6112
 epoch: 89, train_loss: 0.2441, test_loss: 1.8271, test_f1: 0.6316
 epoch: 90, train_loss: 0.2145, test_loss: 1.8905, test_f1: 0.5917
 epoch: 91, train_loss: 0.2180, test_loss: 1.7861, test_f1: 0.6370
 epoch: 92, train_loss: 0.2012, test_loss: 1.6711, test_f1: 0.6185
 epoch: 93, train_loss: 0.1969, test_loss: 1.8926, test_f1: 0.6066
 epoch: 94, train_loss: 0.1966, test_loss: 1.8619, test_f1: 0.6026
 epoch: 95, train_loss: 0.1998, test_loss: 1.8873, test_f1: 0.6220
 epoch: 96, train_loss: 0.1862, test_loss: 1.8833, test_f1: 0.6061
 epoch: 97, train_loss: 0.1862, test_loss: 1.8585, test_f1: 0.6540
 epoch: 98, train_loss: 0.1915, test_loss: 2.0050, test_f1: 0.6423
 epoch: 99, train_loss: 0.1902, test_loss: 1.8051, test_f1: 0.6360
##################ITERATION #6 ****************************************
 epoch: 0, train_loss: 1.5985, test_loss: 1.4118, test_f1: 0.2270
 epoch: 1, train_loss: 1.1093, test_loss: 1.1239, test_f1: 0.3621
 epoch: 2, train_loss: 0.9845, test_loss: 1.0320, test_f1: 0.4299
 epoch: 3, train_loss: 0.9430, test_loss: 0.9794, test_f1: 0.4617
 epoch: 4, train_loss: 0.9068, test_loss: 0.9859, test_f1: 0.4751
 epoch: 5, train_loss: 0.8747, test_loss: 0.9331, test_f1: 0.5045
 epoch: 6, train_loss: 0.8657, test_loss: 0.8992, test_f1: 0.5515
 epoch: 7, train_loss: 0.8489, test_loss: 0.9255, test_f1: 0.5072
 epoch: 8, train_loss: 0.8368, test_loss: 0.9543, test_f1: 0.5596
 epoch: 9, train_loss: 0.8112, test_loss: 0.9059, test_f1: 0.5465
 epoch: 10, train_loss: 0.8082, test_loss: 1.0081, test_f1: 0.5575
 epoch: 11, train_loss: 0.7703, test_loss: 0.9383, test_f1: 0.5663
 epoch: 12, train_loss: 0.7772, test_loss: 0.9318, test_f1: 0.5491
 epoch: 13, train_loss: 0.7667, test_loss: 0.9205, test_f1: 0.5761
 epoch: 14, train_loss: 0.7599, test_loss: 0.9157, test_f1: 0.5807
 epoch: 15, train_loss: 0.7370, test_loss: 1.0092, test_f1: 0.5489
 epoch: 16, train_loss: 0.7256, test_loss: 0.9263, test_f1: 0.5921
 epoch: 17, train_loss: 0.7254, test_loss: 0.9784, test_f1: 0.5549
 epoch: 18, train_loss: 0.7255, test_loss: 0.9363, test_f1: 0.5862
 epoch: 19, train_loss: 0.7150, test_loss: 0.9574, test_f1: 0.5854
 epoch: 20, train_loss: 0.7095, test_loss: 0.9790, test_f1: 0.5729
 epoch: 21, train_loss: 0.6975, test_loss: 1.0537, test_f1: 0.5583
 epoch: 22, train_loss: 0.6771, test_loss: 0.9463, test_f1: 0.5961
 epoch: 23, train_loss: 0.6528, test_loss: 0.9734, test_f1: 0.6076
 epoch: 24, train_loss: 0.6422, test_loss: 0.9478, test_f1: 0.6095
 epoch: 25, train_loss: 0.6387, test_loss: 0.9738, test_f1: 0.6251
 epoch: 26, train_loss: 0.6230, test_loss: 1.0263, test_f1: 0.5727
 epoch: 27, train_loss: 0.6236, test_loss: 1.0526, test_f1: 0.5815
 epoch: 28, train_loss: 0.6043, test_loss: 0.9647, test_f1: 0.6270
 epoch: 29, train_loss: 0.6048, test_loss: 1.0526, test_f1: 0.5871
 epoch: 30, train_loss: 0.6010, test_loss: 1.0255, test_f1: 0.5925
 epoch: 31, train_loss: 0.5854, test_loss: 1.0789, test_f1: 0.6045
 epoch: 32, train_loss: 0.5830, test_loss: 1.1003, test_f1: 0.6091
 epoch: 33, train_loss: 0.5795, test_loss: 1.0524, test_f1: 0.6008
 epoch: 34, train_loss: 0.5528, test_loss: 1.0566, test_f1: 0.6252
 epoch: 35, train_loss: 0.5460, test_loss: 1.0651, test_f1: 0.6364
 epoch: 36, train_loss: 0.5540, test_loss: 1.1958, test_f1: 0.5689
 epoch: 37, train_loss: 0.5438, test_loss: 1.0695, test_f1: 0.6085
 epoch: 38, train_loss: 0.5046, test_loss: 1.0385, test_f1: 0.6186
 epoch: 39, train_loss: 0.4970, test_loss: 1.1422, test_f1: 0.6074
 epoch: 40, train_loss: 0.5036, test_loss: 1.2796, test_f1: 0.5961
 epoch: 41, train_loss: 0.4850, test_loss: 1.1805, test_f1: 0.5824
 epoch: 42, train_loss: 0.4894, test_loss: 1.1087, test_f1: 0.6218
 epoch: 43, train_loss: 0.4866, test_loss: 1.1295, test_f1: 0.5975
 epoch: 44, train_loss: 0.4852, test_loss: 1.1237, test_f1: 0.6227
 epoch: 45, train_loss: 0.4529, test_loss: 1.2372, test_f1: 0.6106
 epoch: 46, train_loss: 0.4421, test_loss: 1.2482, test_f1: 0.6202
 epoch: 47, train_loss: 0.4502, test_loss: 1.2689, test_f1: 0.6183
 epoch: 48, train_loss: 0.4538, test_loss: 1.1972, test_f1: 0.6381
 epoch: 49, train_loss: 0.4355, test_loss: 1.4198, test_f1: 0.5942
 epoch: 50, train_loss: 0.4601, test_loss: 1.3538, test_f1: 0.6319
 epoch: 51, train_loss: 0.4099, test_loss: 1.1585, test_f1: 0.6679
 epoch: 52, train_loss: 0.3772, test_loss: 1.1337, test_f1: 0.6425
 epoch: 53, train_loss: 0.3478, test_loss: 1.2369, test_f1: 0.6370
 epoch: 54, train_loss: 0.3458, test_loss: 1.3554, test_f1: 0.6371
 epoch: 55, train_loss: 0.3317, test_loss: 1.3515, test_f1: 0.6563
 epoch: 56, train_loss: 0.3128, test_loss: 1.4063, test_f1: 0.6359
 epoch: 57, train_loss: 0.3202, test_loss: 1.4804, test_f1: 0.6375
 epoch: 58, train_loss: 0.3164, test_loss: 1.3774, test_f1: 0.6537
 epoch: 59, train_loss: 0.3090, test_loss: 1.3712, test_f1: 0.6499
 epoch: 60, train_loss: 0.3142, test_loss: 1.4635, test_f1: 0.6448
 epoch: 61, train_loss: 0.2907, test_loss: 1.4057, test_f1: 0.6605
 epoch: 62, train_loss: 0.2751, test_loss: 1.5331, test_f1: 0.6320
 epoch: 63, train_loss: 0.2804, test_loss: 1.4510, test_f1: 0.6491
 epoch: 64, train_loss: 0.2804, test_loss: 1.5979, test_f1: 0.6300
 epoch: 65, train_loss: 0.2756, test_loss: 1.3993, test_f1: 0.6241
 epoch: 66, train_loss: 0.2689, test_loss: 1.5110, test_f1: 0.6296
 epoch: 67, train_loss: 0.2679, test_loss: 1.4909, test_f1: 0.6178
 epoch: 68, train_loss: 0.2718, test_loss: 1.5818, test_f1: 0.6033
 epoch: 69, train_loss: 0.2651, test_loss: 1.4382, test_f1: 0.6457
 epoch: 70, train_loss: 0.2636, test_loss: 1.5118, test_f1: 0.6420
 epoch: 71, train_loss: 0.2557, test_loss: 1.6746, test_f1: 0.6233
 epoch: 72, train_loss: 0.2464, test_loss: 1.4577, test_f1: 0.6469
 epoch: 73, train_loss: 0.2421, test_loss: 1.7567, test_f1: 0.6390
 epoch: 74, train_loss: 0.2265, test_loss: 1.6479, test_f1: 0.6355
 epoch: 75, train_loss: 0.2299, test_loss: 1.7572, test_f1: 0.6238
 epoch: 76, train_loss: 0.2319, test_loss: 1.6733, test_f1: 0.6404
 epoch: 77, train_loss: 0.2339, test_loss: 1.7229, test_f1: 0.6148
 epoch: 78, train_loss: 0.2342, test_loss: 1.7970, test_f1: 0.6232
 epoch: 79, train_loss: 0.2264, test_loss: 1.6780, test_f1: 0.6308
 epoch: 80, train_loss: 0.2328, test_loss: 1.6389, test_f1: 0.6672
 epoch: 81, train_loss: 0.2096, test_loss: 1.9352, test_f1: 0.6117
 epoch: 82, train_loss: 0.2236, test_loss: 1.6775, test_f1: 0.6428
 epoch: 83, train_loss: 0.2380, test_loss: 1.7460, test_f1: 0.6426
 epoch: 84, train_loss: 0.2253, test_loss: 1.8760, test_f1: 0.5991
 epoch: 85, train_loss: 0.2338, test_loss: 1.7319, test_f1: 0.6093
 epoch: 86, train_loss: 0.2152, test_loss: 1.7247, test_f1: 0.6230
 epoch: 87, train_loss: 0.2203, test_loss: 1.8681, test_f1: 0.6207
 epoch: 88, train_loss: 0.2075, test_loss: 1.7287, test_f1: 0.6307
 epoch: 89, train_loss: 0.1986, test_loss: 1.9493, test_f1: 0.6158
 epoch: 90, train_loss: 0.1961, test_loss: 1.8229, test_f1: 0.6298
 epoch: 91, train_loss: 0.2011, test_loss: 1.9270, test_f1: 0.6323
 epoch: 92, train_loss: 0.1954, test_loss: 2.0793, test_f1: 0.6036
 epoch: 93, train_loss: 0.1933, test_loss: 2.0421, test_f1: 0.6253
 epoch: 94, train_loss: 0.1855, test_loss: 2.1498, test_f1: 0.6053
 epoch: 95, train_loss: 0.1787, test_loss: 2.1907, test_f1: 0.6116
 epoch: 96, train_loss: 0.1678, test_loss: 2.1783, test_f1: 0.6032
 epoch: 97, train_loss: 0.1587, test_loss: 2.2756, test_f1: 0.6107
 epoch: 98, train_loss: 0.1819, test_loss: 2.0870, test_f1: 0.6316
 epoch: 99, train_loss: 0.1930, test_loss: 2.0450, test_f1: 0.6103
##################ITERATION #7 ****************************************
 epoch: 0, train_loss: 1.5718, test_loss: 1.3043, test_f1: 0.2320
 epoch: 1, train_loss: 1.0755, test_loss: 1.1771, test_f1: 0.3237
 epoch: 2, train_loss: 0.9809, test_loss: 1.0731, test_f1: 0.3825
 epoch: 3, train_loss: 0.9356, test_loss: 0.9553, test_f1: 0.4714
 epoch: 4, train_loss: 0.9150, test_loss: 0.9343, test_f1: 0.5455
 epoch: 5, train_loss: 0.8924, test_loss: 0.9470, test_f1: 0.4940
 epoch: 6, train_loss: 0.8742, test_loss: 0.9342, test_f1: 0.5128
 epoch: 7, train_loss: 0.8582, test_loss: 0.9623, test_f1: 0.5303
 epoch: 8, train_loss: 0.8477, test_loss: 0.9210, test_f1: 0.5216
 epoch: 9, train_loss: 0.8256, test_loss: 0.9326, test_f1: 0.5479
 epoch: 10, train_loss: 0.8043, test_loss: 0.9844, test_f1: 0.5189
 epoch: 11, train_loss: 0.7975, test_loss: 0.9693, test_f1: 0.5647
 epoch: 12, train_loss: 0.7927, test_loss: 0.9159, test_f1: 0.5422
 epoch: 13, train_loss: 0.7741, test_loss: 0.9553, test_f1: 0.5649
 epoch: 14, train_loss: 0.7705, test_loss: 1.0316, test_f1: 0.5168
 epoch: 15, train_loss: 0.7472, test_loss: 0.9658, test_f1: 0.5561
 epoch: 16, train_loss: 0.7385, test_loss: 0.9901, test_f1: 0.5603
 epoch: 17, train_loss: 0.7369, test_loss: 1.0325, test_f1: 0.5354
 epoch: 18, train_loss: 0.7315, test_loss: 0.9801, test_f1: 0.5780
 epoch: 19, train_loss: 0.7202, test_loss: 1.0006, test_f1: 0.5594
 epoch: 20, train_loss: 0.7090, test_loss: 1.0036, test_f1: 0.5850
 epoch: 21, train_loss: 0.6891, test_loss: 0.9997, test_f1: 0.5727
 epoch: 22, train_loss: 0.6932, test_loss: 0.9882, test_f1: 0.6193
 epoch: 23, train_loss: 0.6576, test_loss: 1.0231, test_f1: 0.5552
 epoch: 24, train_loss: 0.6597, test_loss: 0.9736, test_f1: 0.5746
 epoch: 25, train_loss: 0.6427, test_loss: 0.9904, test_f1: 0.5745
 epoch: 26, train_loss: 0.6455, test_loss: 1.0361, test_f1: 0.6110
 epoch: 27, train_loss: 0.6445, test_loss: 1.0375, test_f1: 0.5482
 epoch: 28, train_loss: 0.6491, test_loss: 1.1087, test_f1: 0.5885
 epoch: 29, train_loss: 0.6431, test_loss: 1.0436, test_f1: 0.6002
 epoch: 30, train_loss: 0.6240, test_loss: 1.0285, test_f1: 0.5992
 epoch: 31, train_loss: 0.5975, test_loss: 1.0198, test_f1: 0.6142
 epoch: 32, train_loss: 0.6009, test_loss: 1.2348, test_f1: 0.5565
 epoch: 33, train_loss: 0.5833, test_loss: 1.1206, test_f1: 0.5837
 epoch: 34, train_loss: 0.5560, test_loss: 1.2146, test_f1: 0.5704
 epoch: 35, train_loss: 0.5682, test_loss: 1.1392, test_f1: 0.6151
 epoch: 36, train_loss: 0.5540, test_loss: 1.1707, test_f1: 0.5862
 epoch: 37, train_loss: 0.5412, test_loss: 1.1435, test_f1: 0.6009
 epoch: 38, train_loss: 0.5571, test_loss: 1.1871, test_f1: 0.5900
 epoch: 39, train_loss: 0.5274, test_loss: 1.1327, test_f1: 0.5955
 epoch: 40, train_loss: 0.5241, test_loss: 1.3143, test_f1: 0.5315
 epoch: 41, train_loss: 0.5327, test_loss: 1.1610, test_f1: 0.6049
 epoch: 42, train_loss: 0.4921, test_loss: 1.1725, test_f1: 0.6132
 epoch: 43, train_loss: 0.4935, test_loss: 1.2536, test_f1: 0.6245
 epoch: 44, train_loss: 0.4834, test_loss: 1.3513, test_f1: 0.6096
 epoch: 45, train_loss: 0.4668, test_loss: 1.1931, test_f1: 0.6154
 epoch: 46, train_loss: 0.4605, test_loss: 1.3089, test_f1: 0.6031
 epoch: 47, train_loss: 0.4774, test_loss: 1.4150, test_f1: 0.5790
 epoch: 48, train_loss: 0.4715, test_loss: 1.2422, test_f1: 0.6360
 epoch: 49, train_loss: 0.4611, test_loss: 1.1699, test_f1: 0.6539
 epoch: 50, train_loss: 0.4226, test_loss: 1.2662, test_f1: 0.6459
 epoch: 51, train_loss: 0.3946, test_loss: 1.3305, test_f1: 0.6194
 epoch: 52, train_loss: 0.3743, test_loss: 1.3514, test_f1: 0.6327
 epoch: 53, train_loss: 0.3452, test_loss: 1.3886, test_f1: 0.6226
 epoch: 54, train_loss: 0.3472, test_loss: 1.4056, test_f1: 0.6427
 epoch: 55, train_loss: 0.3325, test_loss: 1.3324, test_f1: 0.6369
 epoch: 56, train_loss: 0.3298, test_loss: 1.5326, test_f1: 0.6187
 epoch: 57, train_loss: 0.3247, test_loss: 1.4071, test_f1: 0.6424
 epoch: 58, train_loss: 0.3155, test_loss: 1.4657, test_f1: 0.6269
 epoch: 59, train_loss: 0.3066, test_loss: 1.4919, test_f1: 0.6303
 epoch: 60, train_loss: 0.2887, test_loss: 1.4061, test_f1: 0.6442
 epoch: 61, train_loss: 0.3127, test_loss: 1.4774, test_f1: 0.6153
 epoch: 62, train_loss: 0.2890, test_loss: 1.6617, test_f1: 0.6052
 epoch: 63, train_loss: 0.2866, test_loss: 1.8139, test_f1: 0.6012
 epoch: 64, train_loss: 0.2841, test_loss: 1.6297, test_f1: 0.6387
 epoch: 65, train_loss: 0.3041, test_loss: 1.5389, test_f1: 0.6165
 epoch: 66, train_loss: 0.2938, test_loss: 1.5750, test_f1: 0.6293
 epoch: 67, train_loss: 0.2923, test_loss: 1.6291, test_f1: 0.6221
 epoch: 68, train_loss: 0.2655, test_loss: 1.5764, test_f1: 0.6071
 epoch: 69, train_loss: 0.2680, test_loss: 1.5752, test_f1: 0.6274
 epoch: 70, train_loss: 0.2741, test_loss: 1.6770, test_f1: 0.6225
 epoch: 71, train_loss: 0.2926, test_loss: 1.6600, test_f1: 0.6134
 epoch: 72, train_loss: 0.2890, test_loss: 1.6206, test_f1: 0.6103
 epoch: 73, train_loss: 0.2819, test_loss: 1.6461, test_f1: 0.6174
 epoch: 74, train_loss: 0.2762, test_loss: 1.7456, test_f1: 0.6181
 epoch: 75, train_loss: 0.2530, test_loss: 1.7215, test_f1: 0.6345
 epoch: 76, train_loss: 0.2562, test_loss: 1.6304, test_f1: 0.6190
 epoch: 77, train_loss: 0.2429, test_loss: 1.8218, test_f1: 0.6306
 epoch: 78, train_loss: 0.2485, test_loss: 1.7764, test_f1: 0.6217
 epoch: 79, train_loss: 0.2523, test_loss: 1.8055, test_f1: 0.5952
 epoch: 80, train_loss: 0.2590, test_loss: 1.5933, test_f1: 0.6408
 epoch: 81, train_loss: 0.2435, test_loss: 1.7821, test_f1: 0.6282
 epoch: 82, train_loss: 0.2424, test_loss: 1.8705, test_f1: 0.5970
 epoch: 83, train_loss: 0.2357, test_loss: 1.8922, test_f1: 0.6260
 epoch: 84, train_loss: 0.2292, test_loss: 1.7846, test_f1: 0.6207
 epoch: 85, train_loss: 0.2270, test_loss: 1.9036, test_f1: 0.6500
 epoch: 86, train_loss: 0.2372, test_loss: 1.7802, test_f1: 0.6283
 epoch: 87, train_loss: 0.2112, test_loss: 1.7615, test_f1: 0.6518
 epoch: 88, train_loss: 0.2161, test_loss: 2.0675, test_f1: 0.5879
 epoch: 89, train_loss: 0.2279, test_loss: 1.7367, test_f1: 0.6161
 epoch: 90, train_loss: 0.2491, test_loss: 1.8156, test_f1: 0.6455
 epoch: 91, train_loss: 0.2272, test_loss: 2.0303, test_f1: 0.6310
 epoch: 92, train_loss: 0.2214, test_loss: 1.7531, test_f1: 0.6356
 epoch: 93, train_loss: 0.2299, test_loss: 1.7275, test_f1: 0.6162
 epoch: 94, train_loss: 0.2187, test_loss: 1.9811, test_f1: 0.6072
 epoch: 95, train_loss: 0.2160, test_loss: 1.8243, test_f1: 0.6143
 epoch: 96, train_loss: 0.2070, test_loss: 1.8276, test_f1: 0.6197
 epoch: 97, train_loss: 0.2036, test_loss: 1.8699, test_f1: 0.6337
 epoch: 98, train_loss: 0.2066, test_loss: 1.8835, test_f1: 0.6368
 epoch: 99, train_loss: 0.2124, test_loss: 1.9068, test_f1: 0.6059
##################ITERATION #8 ****************************************
 epoch: 0, train_loss: 1.7809, test_loss: 1.2634, test_f1: 0.2270
 epoch: 1, train_loss: 1.0974, test_loss: 1.2020, test_f1: 0.2416
 epoch: 2, train_loss: 0.9754, test_loss: 1.1599, test_f1: 0.3946
 epoch: 3, train_loss: 0.9272, test_loss: 1.1577, test_f1: 0.4055
 epoch: 4, train_loss: 0.9078, test_loss: 1.0429, test_f1: 0.4626
 epoch: 5, train_loss: 0.8820, test_loss: 0.9382, test_f1: 0.5288
 epoch: 6, train_loss: 0.8478, test_loss: 0.9046, test_f1: 0.5610
 epoch: 7, train_loss: 0.8393, test_loss: 0.9073, test_f1: 0.5495
 epoch: 8, train_loss: 0.8208, test_loss: 0.9506, test_f1: 0.5423
 epoch: 9, train_loss: 0.7942, test_loss: 0.9783, test_f1: 0.5521
 epoch: 10, train_loss: 0.7923, test_loss: 0.9456, test_f1: 0.5487
 epoch: 11, train_loss: 0.7609, test_loss: 0.9369, test_f1: 0.5570
 epoch: 12, train_loss: 0.7663, test_loss: 0.9195, test_f1: 0.5743
 epoch: 13, train_loss: 0.7499, test_loss: 0.8803, test_f1: 0.5954
 epoch: 14, train_loss: 0.7386, test_loss: 0.9082, test_f1: 0.5611
 epoch: 15, train_loss: 0.7256, test_loss: 0.9450, test_f1: 0.5771
 epoch: 16, train_loss: 0.7246, test_loss: 0.9086, test_f1: 0.6239
 epoch: 17, train_loss: 0.7197, test_loss: 0.9243, test_f1: 0.6059
 epoch: 18, train_loss: 0.6936, test_loss: 1.0104, test_f1: 0.5549
 epoch: 19, train_loss: 0.6932, test_loss: 0.9431, test_f1: 0.5827
 epoch: 20, train_loss: 0.6721, test_loss: 0.9888, test_f1: 0.5814
 epoch: 21, train_loss: 0.6800, test_loss: 0.9378, test_f1: 0.5808
 epoch: 22, train_loss: 0.6486, test_loss: 0.9642, test_f1: 0.5781
 epoch: 23, train_loss: 0.6706, test_loss: 0.9785, test_f1: 0.5743
 epoch: 24, train_loss: 0.6382, test_loss: 1.0310, test_f1: 0.5781
 epoch: 25, train_loss: 0.6439, test_loss: 0.9816, test_f1: 0.6074
 epoch: 26, train_loss: 0.6380, test_loss: 0.9986, test_f1: 0.5520
 epoch: 27, train_loss: 0.6136, test_loss: 0.9506, test_f1: 0.6101
 epoch: 28, train_loss: 0.5978, test_loss: 1.0477, test_f1: 0.6092
 epoch: 29, train_loss: 0.5918, test_loss: 0.9881, test_f1: 0.5958
 epoch: 30, train_loss: 0.6003, test_loss: 1.0112, test_f1: 0.6232
 epoch: 31, train_loss: 0.5845, test_loss: 1.0403, test_f1: 0.6280
 epoch: 32, train_loss: 0.5703, test_loss: 1.0511, test_f1: 0.5896
 epoch: 33, train_loss: 0.5836, test_loss: 1.0093, test_f1: 0.6055
 epoch: 34, train_loss: 0.5468, test_loss: 1.0957, test_f1: 0.6008
 epoch: 35, train_loss: 0.5466, test_loss: 1.0357, test_f1: 0.6094
 epoch: 36, train_loss: 0.5088, test_loss: 1.0973, test_f1: 0.6104
 epoch: 37, train_loss: 0.4869, test_loss: 1.1476, test_f1: 0.6533
 epoch: 38, train_loss: 0.5253, test_loss: 1.0558, test_f1: 0.6220
 epoch: 39, train_loss: 0.4940, test_loss: 1.0879, test_f1: 0.6518
 epoch: 40, train_loss: 0.4901, test_loss: 1.2114, test_f1: 0.6179
 epoch: 41, train_loss: 0.4899, test_loss: 1.1705, test_f1: 0.6095
 epoch: 42, train_loss: 0.4588, test_loss: 1.1651, test_f1: 0.6362
 epoch: 43, train_loss: 0.4735, test_loss: 1.0320, test_f1: 0.6494
 epoch: 44, train_loss: 0.4549, test_loss: 1.2458, test_f1: 0.6389
 epoch: 45, train_loss: 0.4707, test_loss: 1.0957, test_f1: 0.6094
 epoch: 46, train_loss: 0.4824, test_loss: 1.1604, test_f1: 0.6147
 epoch: 47, train_loss: 0.4292, test_loss: 1.1666, test_f1: 0.6340
 epoch: 48, train_loss: 0.4296, test_loss: 1.2375, test_f1: 0.6211
 epoch: 49, train_loss: 0.4289, test_loss: 1.2583, test_f1: 0.6201
 epoch: 50, train_loss: 0.4325, test_loss: 1.1786, test_f1: 0.6451
 epoch: 51, train_loss: 0.3849, test_loss: 1.1783, test_f1: 0.6375
 epoch: 52, train_loss: 0.3599, test_loss: 1.2322, test_f1: 0.6251
 epoch: 53, train_loss: 0.3348, test_loss: 1.2583, test_f1: 0.6243
 epoch: 54, train_loss: 0.3189, test_loss: 1.2553, test_f1: 0.6299
 epoch: 55, train_loss: 0.3137, test_loss: 1.3686, test_f1: 0.6202
 epoch: 56, train_loss: 0.3167, test_loss: 1.3479, test_f1: 0.5899
 epoch: 57, train_loss: 0.3138, test_loss: 1.3894, test_f1: 0.6460
 epoch: 58, train_loss: 0.2967, test_loss: 1.4673, test_f1: 0.6234
 epoch: 59, train_loss: 0.2886, test_loss: 1.3565, test_f1: 0.6440
 epoch: 60, train_loss: 0.3021, test_loss: 1.4085, test_f1: 0.6421
 epoch: 61, train_loss: 0.2922, test_loss: 1.5747, test_f1: 0.6161
 epoch: 62, train_loss: 0.3010, test_loss: 1.4556, test_f1: 0.6286
 epoch: 63, train_loss: 0.2795, test_loss: 1.4879, test_f1: 0.6241
 epoch: 64, train_loss: 0.2769, test_loss: 1.4089, test_f1: 0.6500
 epoch: 65, train_loss: 0.2701, test_loss: 1.6548, test_f1: 0.6349
 epoch: 66, train_loss: 0.2832, test_loss: 1.5228, test_f1: 0.6231
 epoch: 67, train_loss: 0.2676, test_loss: 1.4836, test_f1: 0.6357
 epoch: 68, train_loss: 0.2659, test_loss: 1.4074, test_f1: 0.6539
 epoch: 69, train_loss: 0.2747, test_loss: 1.6281, test_f1: 0.6381
 epoch: 70, train_loss: 0.2731, test_loss: 1.5126, test_f1: 0.6442
 epoch: 71, train_loss: 0.2525, test_loss: 1.5631, test_f1: 0.6285
 epoch: 72, train_loss: 0.2538, test_loss: 1.5061, test_f1: 0.6355
 epoch: 73, train_loss: 0.2524, test_loss: 1.5805, test_f1: 0.6492
 epoch: 74, train_loss: 0.2350, test_loss: 1.6845, test_f1: 0.6090
 epoch: 75, train_loss: 0.2458, test_loss: 1.5730, test_f1: 0.6282
 epoch: 76, train_loss: 0.2385, test_loss: 1.6753, test_f1: 0.6144
 epoch: 77, train_loss: 0.2403, test_loss: 1.6507, test_f1: 0.6215
 epoch: 78, train_loss: 0.2285, test_loss: 1.7637, test_f1: 0.6393
 epoch: 79, train_loss: 0.2295, test_loss: 1.7264, test_f1: 0.6231
 epoch: 80, train_loss: 0.2297, test_loss: 1.7714, test_f1: 0.6359
 epoch: 81, train_loss: 0.2458, test_loss: 1.7208, test_f1: 0.6336
 epoch: 82, train_loss: 0.2412, test_loss: 1.6071, test_f1: 0.6320
 epoch: 83, train_loss: 0.2195, test_loss: 1.7236, test_f1: 0.6269
 epoch: 84, train_loss: 0.2093, test_loss: 1.6444, test_f1: 0.6151
 epoch: 85, train_loss: 0.2093, test_loss: 1.7781, test_f1: 0.6287
 epoch: 86, train_loss: 0.1928, test_loss: 1.6915, test_f1: 0.6221
 epoch: 87, train_loss: 0.2031, test_loss: 1.8517, test_f1: 0.6267
 epoch: 88, train_loss: 0.2133, test_loss: 1.8402, test_f1: 0.6106
 epoch: 89, train_loss: 0.2098, test_loss: 1.8236, test_f1: 0.6126
 epoch: 90, train_loss: 0.2089, test_loss: 1.8667, test_f1: 0.6314
 epoch: 91, train_loss: 0.1935, test_loss: 1.7580, test_f1: 0.6360
 epoch: 92, train_loss: 0.2286, test_loss: 1.7804, test_f1: 0.6271
 epoch: 93, train_loss: 0.2039, test_loss: 1.7837, test_f1: 0.6202
 epoch: 94, train_loss: 0.1837, test_loss: 1.9392, test_f1: 0.6315
 epoch: 95, train_loss: 0.1908, test_loss: 2.0154, test_f1: 0.6072
 epoch: 96, train_loss: 0.1916, test_loss: 2.0075, test_f1: 0.6264
 epoch: 97, train_loss: 0.1778, test_loss: 1.8634, test_f1: 0.6288
 epoch: 98, train_loss: 0.1744, test_loss: 2.1015, test_f1: 0.6044
 epoch: 99, train_loss: 0.1942, test_loss: 1.9473, test_f1: 0.6118
##################ITERATION #9 ****************************************
 epoch: 0, train_loss: 1.7150, test_loss: 1.5751, test_f1: 0.2270
 epoch: 1, train_loss: 1.0836, test_loss: 1.1513, test_f1: 0.3144
 epoch: 2, train_loss: 0.9872, test_loss: 1.0291, test_f1: 0.3959
 epoch: 3, train_loss: 0.9532, test_loss: 0.9636, test_f1: 0.4260
 epoch: 4, train_loss: 0.9236, test_loss: 0.9749, test_f1: 0.4685
 epoch: 5, train_loss: 0.8945, test_loss: 0.9704, test_f1: 0.5053
 epoch: 6, train_loss: 0.8589, test_loss: 0.9227, test_f1: 0.5436
 epoch: 7, train_loss: 0.8448, test_loss: 0.9445, test_f1: 0.5105
 epoch: 8, train_loss: 0.8298, test_loss: 0.9379, test_f1: 0.5073
 epoch: 9, train_loss: 0.8130, test_loss: 0.9487, test_f1: 0.5389
 epoch: 10, train_loss: 0.8084, test_loss: 0.9583, test_f1: 0.4849
 epoch: 11, train_loss: 0.7883, test_loss: 0.9389, test_f1: 0.5532
 epoch: 12, train_loss: 0.7736, test_loss: 0.9534, test_f1: 0.5513
 epoch: 13, train_loss: 0.7813, test_loss: 0.9477, test_f1: 0.5381
 epoch: 14, train_loss: 0.7542, test_loss: 0.9422, test_f1: 0.5487
 epoch: 15, train_loss: 0.7437, test_loss: 1.0257, test_f1: 0.5275
 epoch: 16, train_loss: 0.7290, test_loss: 0.9704, test_f1: 0.5336
 epoch: 17, train_loss: 0.7230, test_loss: 1.0568, test_f1: 0.5502
 epoch: 18, train_loss: 0.7168, test_loss: 0.9725, test_f1: 0.5272
 epoch: 19, train_loss: 0.7072, test_loss: 0.9741, test_f1: 0.5433
 epoch: 20, train_loss: 0.6961, test_loss: 0.9803, test_f1: 0.5523
 epoch: 21, train_loss: 0.6915, test_loss: 1.0456, test_f1: 0.5577
 epoch: 22, train_loss: 0.7047, test_loss: 0.9755, test_f1: 0.5850
 epoch: 23, train_loss: 0.6745, test_loss: 1.0646, test_f1: 0.5563
 epoch: 24, train_loss: 0.6611, test_loss: 1.0344, test_f1: 0.5718
 epoch: 25, train_loss: 0.6537, test_loss: 1.0677, test_f1: 0.5933
 epoch: 26, train_loss: 0.6631, test_loss: 1.0161, test_f1: 0.5471
 epoch: 27, train_loss: 0.6385, test_loss: 1.0101, test_f1: 0.6037
 epoch: 28, train_loss: 0.6167, test_loss: 1.1038, test_f1: 0.5287
 epoch: 29, train_loss: 0.6117, test_loss: 0.9738, test_f1: 0.5946
 epoch: 30, train_loss: 0.6088, test_loss: 1.0010, test_f1: 0.6124
 epoch: 31, train_loss: 0.5921, test_loss: 1.0285, test_f1: 0.5885
 epoch: 32, train_loss: 0.5925, test_loss: 1.0694, test_f1: 0.6049
 epoch: 33, train_loss: 0.5761, test_loss: 1.0003, test_f1: 0.6041
 epoch: 34, train_loss: 0.5698, test_loss: 0.9895, test_f1: 0.6171
 epoch: 35, train_loss: 0.5529, test_loss: 1.0206, test_f1: 0.6125
 epoch: 36, train_loss: 0.5637, test_loss: 1.1535, test_f1: 0.6251
 epoch: 37, train_loss: 0.5635, test_loss: 1.0134, test_f1: 0.6143
 epoch: 38, train_loss: 0.5253, test_loss: 1.0732, test_f1: 0.6178
 epoch: 39, train_loss: 0.5273, test_loss: 1.0289, test_f1: 0.6061
 epoch: 40, train_loss: 0.5285, test_loss: 1.0708, test_f1: 0.6153
 epoch: 41, train_loss: 0.5137, test_loss: 0.9924, test_f1: 0.6639
 epoch: 42, train_loss: 0.5008, test_loss: 1.3412, test_f1: 0.5601
 epoch: 43, train_loss: 0.4871, test_loss: 1.0771, test_f1: 0.6534
 epoch: 44, train_loss: 0.5175, test_loss: 1.0809, test_f1: 0.6134
 epoch: 45, train_loss: 0.4851, test_loss: 1.0933, test_f1: 0.6379
 epoch: 46, train_loss: 0.4703, test_loss: 1.0828, test_f1: 0.6193
 epoch: 47, train_loss: 0.4441, test_loss: 1.0863, test_f1: 0.6386
 epoch: 48, train_loss: 0.4302, test_loss: 1.0669, test_f1: 0.6449
 epoch: 49, train_loss: 0.4259, test_loss: 1.1989, test_f1: 0.6377
 epoch: 50, train_loss: 0.4518, test_loss: 1.1245, test_f1: 0.6211
 epoch: 51, train_loss: 0.4020, test_loss: 1.1471, test_f1: 0.6254
 epoch: 52, train_loss: 0.3681, test_loss: 1.1119, test_f1: 0.6525
 epoch: 53, train_loss: 0.3621, test_loss: 1.2218, test_f1: 0.6263
 epoch: 54, train_loss: 0.3425, test_loss: 1.1689, test_f1: 0.6553
 epoch: 55, train_loss: 0.3296, test_loss: 1.1867, test_f1: 0.6353
 epoch: 56, train_loss: 0.3258, test_loss: 1.2809, test_f1: 0.6219
 epoch: 57, train_loss: 0.3182, test_loss: 1.3013, test_f1: 0.6350
 epoch: 58, train_loss: 0.3185, test_loss: 1.1679, test_f1: 0.6474
 epoch: 59, train_loss: 0.3316, test_loss: 1.2146, test_f1: 0.6423
 epoch: 60, train_loss: 0.3089, test_loss: 1.2675, test_f1: 0.6553
 epoch: 61, train_loss: 0.3091, test_loss: 1.2156, test_f1: 0.6553
 epoch: 62, train_loss: 0.2966, test_loss: 1.2787, test_f1: 0.6483
 epoch: 63, train_loss: 0.2814, test_loss: 1.3565, test_f1: 0.6345
 epoch: 64, train_loss: 0.2699, test_loss: 1.3042, test_f1: 0.6359
 epoch: 65, train_loss: 0.2860, test_loss: 1.3886, test_f1: 0.6395
 epoch: 66, train_loss: 0.2778, test_loss: 1.3320, test_f1: 0.6406
 epoch: 67, train_loss: 0.2855, test_loss: 1.3158, test_f1: 0.6282
 epoch: 68, train_loss: 0.3040, test_loss: 1.3509, test_f1: 0.6304
 epoch: 69, train_loss: 0.2920, test_loss: 1.4620, test_f1: 0.6232
 epoch: 70, train_loss: 0.2690, test_loss: 1.3526, test_f1: 0.6278
 epoch: 71, train_loss: 0.2498, test_loss: 1.3639, test_f1: 0.6144
 epoch: 72, train_loss: 0.2534, test_loss: 1.2459, test_f1: 0.6520
 epoch: 73, train_loss: 0.2640, test_loss: 1.5023, test_f1: 0.6267
 epoch: 74, train_loss: 0.2685, test_loss: 1.4960, test_f1: 0.6167
 epoch: 75, train_loss: 0.2694, test_loss: 1.4197, test_f1: 0.6285
 epoch: 76, train_loss: 0.2665, test_loss: 1.3350, test_f1: 0.6580
 epoch: 77, train_loss: 0.2484, test_loss: 1.5149, test_f1: 0.6317
 epoch: 78, train_loss: 0.2456, test_loss: 1.6099, test_f1: 0.6259
 epoch: 79, train_loss: 0.2304, test_loss: 1.4022, test_f1: 0.6543
 epoch: 80, train_loss: 0.2324, test_loss: 1.4543, test_f1: 0.6653
 epoch: 81, train_loss: 0.2395, test_loss: 1.6193, test_f1: 0.6217
 epoch: 82, train_loss: 0.2373, test_loss: 1.5179, test_f1: 0.6214
 epoch: 83, train_loss: 0.2289, test_loss: 1.5704, test_f1: 0.6194
 epoch: 84, train_loss: 0.2399, test_loss: 1.4784, test_f1: 0.6361
 epoch: 85, train_loss: 0.2343, test_loss: 1.5390, test_f1: 0.6360
 epoch: 86, train_loss: 0.2270, test_loss: 1.6064, test_f1: 0.6271
 epoch: 87, train_loss: 0.2067, test_loss: 1.6193, test_f1: 0.6208
 epoch: 88, train_loss: 0.2145, test_loss: 1.5051, test_f1: 0.6390
 epoch: 89, train_loss: 0.2123, test_loss: 1.7085, test_f1: 0.6124
 epoch: 90, train_loss: 0.2085, test_loss: 1.6303, test_f1: 0.6262
 epoch: 91, train_loss: 0.2184, test_loss: 1.6378, test_f1: 0.6297
 epoch: 92, train_loss: 0.2060, test_loss: 1.5858, test_f1: 0.6513
 epoch: 93, train_loss: 0.2103, test_loss: 1.6918, test_f1: 0.6484
 epoch: 94, train_loss: 0.2124, test_loss: 1.5633, test_f1: 0.6480
 epoch: 95, train_loss: 0.2161, test_loss: 1.8806, test_f1: 0.6197
 epoch: 96, train_loss: 0.2215, test_loss: 1.7322, test_f1: 0.6285
 epoch: 97, train_loss: 0.2032, test_loss: 1.6161, test_f1: 0.6197
 epoch: 98, train_loss: 0.2025, test_loss: 1.6967, test_f1: 0.6149
 epoch: 99, train_loss: 0.1962, test_loss: 1.8327, test_f1: 0.6109

Training completed in 417.84 seconds
Best F1: 0.6889 at epoch 59
Mean F1 across iterations: 0.6686  0.0116
========================FINAL RESULTS================================
FEGIN weighted F1: 0.6889  0.0116
python main.py --data ltspice_examples --representation component_net --model FEGIN --layers 4 --hiddens 128 --batch_size 256 --lr 0.001 --emb_size 128 --epochs 100 --save_appendix component_net_L4_H128_BS256_LR0.001_E128 --no_val
-----



STDERR:
  File "main.py", line 370, in <module>
    main()
  File "main.py", line 254, in main
    dataset = dataset_class(
  File "/home/philip/projects/ltspice_examples_code_repo/Circuit-Completion-Using-GNNs/component_classification_with_link_prediction_head/evaluation/FEGIN/kernel/circuit_datasets.py", line 15, in __init__
    self.data, self.slices = torch.load(self.processed_paths[0])
  File "/home/philip/.local/lib/python3.8/site-packages/torch/serialization.py", line 1040, in load
    warnings.warn(
  File "/usr/lib/python3.8/warnings.py", line 109, in _showwarnmsg
    sw(msg.message, msg.category, msg.filename, msg.lineno,
  File "main.py", line 47, in warn_with_traceback
    traceback.print_stack(file=log)
/home/philip/projects/ltspice_examples_code_repo/Circuit-Completion-Using-GNNs/component_classification_with_link_prediction_head/evaluation/FEGIN/kernel/circuit_datasets.py:15: FutureWarning: You are using `torch.load` with `weights_only=False` (the current default value), which uses the default pickle module implicitly. It is possible to construct malicious pickle data which will execute arbitrary code during unpickling (See https://github.com/pytorch/pytorch/blob/main/SECURITY.md#untrusted-models for more details). In a future release, the default value for `weights_only` will be flipped to `True`. This limits the functions that could be executed during unpickling. Arbitrary objects will no longer be allowed to be loaded via this mode unless they are explicitly allowlisted by the user via `torch.serialization.add_safe_globals`. We recommend you start setting `weights_only=True` for any use case where you don't have full control of the loaded file. Please open an issue on GitHub for any issues related to this experimental feature.
  self.data, self.slices = torch.load(self.processed_paths[0])
