STDOUT:
Results will be saved in /home/philip/projects/ltspice_examples_code_repo/Circuit-Completion-Using-GNNs/component_classification_with_link_prediction_head/evaluation/FEGIN/results/model_FEGIN_dataset_ltspice_examples
Command line input: python main.py --data ltspice_examples --representation component_pin --model FEGIN --layers 2 --hiddens 128 --batch_size 32 --lr 0.0001 --emb_size 250 --epochs 100 --save_appendix component_pin_L2_H128_BS32_LR0.0001_E250 --no_val
 is saved.
-----
ltspice_examples - FEGIN
Using 2 layers, 128 hidden units, h = 2
Loading component_pin representation dataset
ENTERED
Training FEGIN on component_pin representation
Train: 3560, Test: 848
##################ITERATION #0 ****************************************
 epoch: 0, train_loss: 1.3327, test_loss: 1.2085, test_f1: 0.3361
 epoch: 1, train_loss: 1.1550, test_loss: 1.0861, test_f1: 0.3454
 epoch: 2, train_loss: 1.0705, test_loss: 1.0609, test_f1: 0.3418
 epoch: 3, train_loss: 1.0382, test_loss: 1.0411, test_f1: 0.3702
 epoch: 4, train_loss: 1.0177, test_loss: 1.0093, test_f1: 0.4320
 epoch: 5, train_loss: 0.9936, test_loss: 1.0038, test_f1: 0.4436
 epoch: 6, train_loss: 0.9765, test_loss: 1.0061, test_f1: 0.4922
 epoch: 7, train_loss: 0.9618, test_loss: 0.9910, test_f1: 0.4927
 epoch: 8, train_loss: 0.9552, test_loss: 0.9919, test_f1: 0.4763
 epoch: 9, train_loss: 0.9323, test_loss: 0.9775, test_f1: 0.4893
 epoch: 10, train_loss: 0.9227, test_loss: 0.9691, test_f1: 0.5076
 epoch: 11, train_loss: 0.9000, test_loss: 0.9895, test_f1: 0.5153
 epoch: 12, train_loss: 0.8911, test_loss: 0.9293, test_f1: 0.5291
 epoch: 13, train_loss: 0.8773, test_loss: 0.9270, test_f1: 0.5248
 epoch: 14, train_loss: 0.8590, test_loss: 0.9110, test_f1: 0.5332
 epoch: 15, train_loss: 0.8454, test_loss: 0.9048, test_f1: 0.5431
 epoch: 16, train_loss: 0.8368, test_loss: 0.8915, test_f1: 0.5390
 epoch: 17, train_loss: 0.8211, test_loss: 0.8773, test_f1: 0.5452
 epoch: 18, train_loss: 0.8177, test_loss: 0.8790, test_f1: 0.5450
 epoch: 19, train_loss: 0.7946, test_loss: 0.8989, test_f1: 0.5402
 epoch: 20, train_loss: 0.7863, test_loss: 0.8820, test_f1: 0.5475
 epoch: 21, train_loss: 0.7808, test_loss: 0.9077, test_f1: 0.5255
 epoch: 22, train_loss: 0.7761, test_loss: 0.8659, test_f1: 0.5521
 epoch: 23, train_loss: 0.7586, test_loss: 0.8821, test_f1: 0.5404
 epoch: 24, train_loss: 0.7443, test_loss: 0.8847, test_f1: 0.5486
 epoch: 25, train_loss: 0.7467, test_loss: 0.8833, test_f1: 0.5613
 epoch: 26, train_loss: 0.7368, test_loss: 0.8934, test_f1: 0.5691
 epoch: 27, train_loss: 0.7231, test_loss: 0.8937, test_f1: 0.5354
 epoch: 28, train_loss: 0.7233, test_loss: 0.9102, test_f1: 0.5533
 epoch: 29, train_loss: 0.7125, test_loss: 0.8731, test_f1: 0.5904
 epoch: 30, train_loss: 0.7124, test_loss: 0.8627, test_f1: 0.5754
 epoch: 31, train_loss: 0.6995, test_loss: 0.9076, test_f1: 0.5708
 epoch: 32, train_loss: 0.7001, test_loss: 0.9031, test_f1: 0.5683
 epoch: 33, train_loss: 0.6854, test_loss: 0.9095, test_f1: 0.5784
 epoch: 34, train_loss: 0.6828, test_loss: 0.9315, test_f1: 0.5612
 epoch: 35, train_loss: 0.6813, test_loss: 0.9186, test_f1: 0.5794
 epoch: 36, train_loss: 0.6736, test_loss: 0.9006, test_f1: 0.5876
 epoch: 37, train_loss: 0.6752, test_loss: 0.9160, test_f1: 0.6010
 epoch: 38, train_loss: 0.6503, test_loss: 0.9157, test_f1: 0.6004
 epoch: 39, train_loss: 0.6606, test_loss: 0.9292, test_f1: 0.5732
 epoch: 40, train_loss: 0.6433, test_loss: 0.9105, test_f1: 0.5868
 epoch: 41, train_loss: 0.6360, test_loss: 0.9559, test_f1: 0.5868
 epoch: 42, train_loss: 0.6364, test_loss: 0.9369, test_f1: 0.6065
 epoch: 43, train_loss: 0.6511, test_loss: 0.9405, test_f1: 0.5931
 epoch: 44, train_loss: 0.6299, test_loss: 0.9620, test_f1: 0.5959
 epoch: 45, train_loss: 0.6219, test_loss: 0.9542, test_f1: 0.6079
 epoch: 46, train_loss: 0.6311, test_loss: 1.0117, test_f1: 0.5768
 epoch: 47, train_loss: 0.6222, test_loss: 0.9877, test_f1: 0.5824
 epoch: 48, train_loss: 0.6086, test_loss: 0.9759, test_f1: 0.6094
 epoch: 49, train_loss: 0.6013, test_loss: 0.9832, test_f1: 0.5938
 epoch: 50, train_loss: 0.6048, test_loss: 1.0008, test_f1: 0.6044
 epoch: 51, train_loss: 0.6056, test_loss: 0.9766, test_f1: 0.6200
 epoch: 52, train_loss: 0.5935, test_loss: 0.9705, test_f1: 0.6061
 epoch: 53, train_loss: 0.5895, test_loss: 0.9685, test_f1: 0.6033
 epoch: 54, train_loss: 0.5759, test_loss: 1.0066, test_f1: 0.5987
 epoch: 55, train_loss: 0.5820, test_loss: 0.9849, test_f1: 0.6001
 epoch: 56, train_loss: 0.5772, test_loss: 1.0326, test_f1: 0.5920
 epoch: 57, train_loss: 0.5601, test_loss: 1.0037, test_f1: 0.6014
 epoch: 58, train_loss: 0.5763, test_loss: 0.9871, test_f1: 0.6042
 epoch: 59, train_loss: 0.5808, test_loss: 1.0335, test_f1: 0.6210
 epoch: 60, train_loss: 0.5686, test_loss: 1.0040, test_f1: 0.6001
 epoch: 61, train_loss: 0.5636, test_loss: 1.0345, test_f1: 0.6199
 epoch: 62, train_loss: 0.5678, test_loss: 1.0039, test_f1: 0.6013
 epoch: 63, train_loss: 0.5628, test_loss: 1.0208, test_f1: 0.6150
 epoch: 64, train_loss: 0.5686, test_loss: 1.0235, test_f1: 0.6181
 epoch: 65, train_loss: 0.5488, test_loss: 1.0586, test_f1: 0.6062
 epoch: 66, train_loss: 0.5438, test_loss: 1.0507, test_f1: 0.5974
 epoch: 67, train_loss: 0.5479, test_loss: 1.0292, test_f1: 0.6087
 epoch: 68, train_loss: 0.5497, test_loss: 1.0892, test_f1: 0.5943
 epoch: 69, train_loss: 0.5355, test_loss: 1.0711, test_f1: 0.6100
 epoch: 70, train_loss: 0.5527, test_loss: 1.0409, test_f1: 0.6335
 epoch: 71, train_loss: 0.5318, test_loss: 1.0477, test_f1: 0.6235
 epoch: 72, train_loss: 0.5468, test_loss: 1.0477, test_f1: 0.6185
 epoch: 73, train_loss: 0.5425, test_loss: 1.0546, test_f1: 0.6249
 epoch: 74, train_loss: 0.5284, test_loss: 1.1072, test_f1: 0.6029
 epoch: 75, train_loss: 0.5378, test_loss: 1.0377, test_f1: 0.6291
 epoch: 76, train_loss: 0.5358, test_loss: 1.0620, test_f1: 0.6202
 epoch: 77, train_loss: 0.5283, test_loss: 1.0833, test_f1: 0.6131
 epoch: 78, train_loss: 0.5327, test_loss: 1.0909, test_f1: 0.6291
 epoch: 79, train_loss: 0.5173, test_loss: 1.1529, test_f1: 0.6403
 epoch: 80, train_loss: 0.5194, test_loss: 1.1159, test_f1: 0.6316
 epoch: 81, train_loss: 0.5160, test_loss: 1.1856, test_f1: 0.5872
 epoch: 82, train_loss: 0.5180, test_loss: 1.1082, test_f1: 0.6236
 epoch: 83, train_loss: 0.5165, test_loss: 1.1022, test_f1: 0.6309
 epoch: 84, train_loss: 0.5164, test_loss: 1.1329, test_f1: 0.6110
 epoch: 85, train_loss: 0.5200, test_loss: 1.2246, test_f1: 0.5962
 epoch: 86, train_loss: 0.5166, test_loss: 1.0858, test_f1: 0.6389
 epoch: 87, train_loss: 0.5140, test_loss: 1.1135, test_f1: 0.6239
 epoch: 88, train_loss: 0.5094, test_loss: 1.1369, test_f1: 0.6517
 epoch: 89, train_loss: 0.5105, test_loss: 1.1179, test_f1: 0.6370
 epoch: 90, train_loss: 0.5162, test_loss: 1.1537, test_f1: 0.6076
 epoch: 91, train_loss: 0.4982, test_loss: 1.1340, test_f1: 0.6390
 epoch: 92, train_loss: 0.4995, test_loss: 1.1601, test_f1: 0.6232
 epoch: 93, train_loss: 0.5034, test_loss: 1.1144, test_f1: 0.6436
 epoch: 94, train_loss: 0.4966, test_loss: 1.1657, test_f1: 0.6098
 epoch: 95, train_loss: 0.5102, test_loss: 1.1425, test_f1: 0.6099
 epoch: 96, train_loss: 0.5056, test_loss: 1.1381, test_f1: 0.6400
 epoch: 97, train_loss: 0.4965, test_loss: 1.1005, test_f1: 0.6338
 epoch: 98, train_loss: 0.4887, test_loss: 1.1664, test_f1: 0.6272
 epoch: 99, train_loss: 0.4937, test_loss: 1.1444, test_f1: 0.6438
##################ITERATION #1 ****************************************
 epoch: 0, train_loss: 1.2211, test_loss: 1.0783, test_f1: 0.3982
 epoch: 1, train_loss: 1.0570, test_loss: 1.0061, test_f1: 0.4758
 epoch: 2, train_loss: 1.0037, test_loss: 0.9833, test_f1: 0.5176
 epoch: 3, train_loss: 0.9668, test_loss: 0.9509, test_f1: 0.4970
 epoch: 4, train_loss: 0.9413, test_loss: 0.9277, test_f1: 0.5059
 epoch: 5, train_loss: 0.9084, test_loss: 0.9012, test_f1: 0.5379
 epoch: 6, train_loss: 0.8906, test_loss: 0.9342, test_f1: 0.5304
 epoch: 7, train_loss: 0.8691, test_loss: 0.8684, test_f1: 0.5458
 epoch: 8, train_loss: 0.8511, test_loss: 0.8763, test_f1: 0.5478
 epoch: 9, train_loss: 0.8299, test_loss: 0.8477, test_f1: 0.5604
 epoch: 10, train_loss: 0.8280, test_loss: 0.8628, test_f1: 0.5531
 epoch: 11, train_loss: 0.8087, test_loss: 0.8510, test_f1: 0.5665
 epoch: 12, train_loss: 0.7870, test_loss: 0.8732, test_f1: 0.5585
 epoch: 13, train_loss: 0.7870, test_loss: 0.8330, test_f1: 0.5705
 epoch: 14, train_loss: 0.7760, test_loss: 0.8111, test_f1: 0.5556
 epoch: 15, train_loss: 0.7591, test_loss: 0.8571, test_f1: 0.5569
 epoch: 16, train_loss: 0.7647, test_loss: 0.8265, test_f1: 0.5673
 epoch: 17, train_loss: 0.7593, test_loss: 0.8514, test_f1: 0.5540
 epoch: 18, train_loss: 0.7429, test_loss: 0.8828, test_f1: 0.5671
 epoch: 19, train_loss: 0.7324, test_loss: 0.8261, test_f1: 0.5597
 epoch: 20, train_loss: 0.7239, test_loss: 0.8459, test_f1: 0.5846
 epoch: 21, train_loss: 0.7228, test_loss: 0.8818, test_f1: 0.5634
 epoch: 22, train_loss: 0.7120, test_loss: 0.8441, test_f1: 0.5572
 epoch: 23, train_loss: 0.7131, test_loss: 0.8682, test_f1: 0.5544
 epoch: 24, train_loss: 0.7007, test_loss: 0.8795, test_f1: 0.5616
 epoch: 25, train_loss: 0.6969, test_loss: 0.8104, test_f1: 0.5708
 epoch: 26, train_loss: 0.6878, test_loss: 0.8653, test_f1: 0.5730
 epoch: 27, train_loss: 0.6823, test_loss: 0.8247, test_f1: 0.5787
 epoch: 28, train_loss: 0.6820, test_loss: 0.8402, test_f1: 0.5842
 epoch: 29, train_loss: 0.6868, test_loss: 0.8697, test_f1: 0.5931
 epoch: 30, train_loss: 0.6812, test_loss: 0.8144, test_f1: 0.5976
 epoch: 31, train_loss: 0.6687, test_loss: 0.8520, test_f1: 0.5840
 epoch: 32, train_loss: 0.6503, test_loss: 0.8445, test_f1: 0.5939
 epoch: 33, train_loss: 0.6561, test_loss: 0.8514, test_f1: 0.5919
 epoch: 34, train_loss: 0.6594, test_loss: 0.8348, test_f1: 0.5923
 epoch: 35, train_loss: 0.6503, test_loss: 0.8527, test_f1: 0.6307
 epoch: 36, train_loss: 0.6371, test_loss: 0.8371, test_f1: 0.6076
 epoch: 37, train_loss: 0.6314, test_loss: 0.8278, test_f1: 0.5961
 epoch: 38, train_loss: 0.6284, test_loss: 0.8313, test_f1: 0.6078
 epoch: 39, train_loss: 0.6178, test_loss: 0.8428, test_f1: 0.6193
 epoch: 40, train_loss: 0.6310, test_loss: 0.9041, test_f1: 0.5938
 epoch: 41, train_loss: 0.6082, test_loss: 0.8315, test_f1: 0.6354
 epoch: 42, train_loss: 0.6011, test_loss: 0.8404, test_f1: 0.6247
 epoch: 43, train_loss: 0.6046, test_loss: 0.8319, test_f1: 0.6205
 epoch: 44, train_loss: 0.5970, test_loss: 0.8088, test_f1: 0.6171
 epoch: 45, train_loss: 0.6077, test_loss: 0.8374, test_f1: 0.6361
 epoch: 46, train_loss: 0.6022, test_loss: 0.8694, test_f1: 0.6179
 epoch: 47, train_loss: 0.5883, test_loss: 0.8371, test_f1: 0.6350
 epoch: 48, train_loss: 0.5893, test_loss: 0.8770, test_f1: 0.6124
 epoch: 49, train_loss: 0.5871, test_loss: 0.7919, test_f1: 0.6525
 epoch: 50, train_loss: 0.5703, test_loss: 0.8347, test_f1: 0.6415
 epoch: 51, train_loss: 0.5684, test_loss: 0.8338, test_f1: 0.6284
 epoch: 52, train_loss: 0.5529, test_loss: 0.7890, test_f1: 0.6400
 epoch: 53, train_loss: 0.5535, test_loss: 0.8295, test_f1: 0.6329
 epoch: 54, train_loss: 0.5498, test_loss: 0.8128, test_f1: 0.6471
 epoch: 55, train_loss: 0.5452, test_loss: 0.8412, test_f1: 0.6404
 epoch: 56, train_loss: 0.5394, test_loss: 0.8136, test_f1: 0.6345
 epoch: 57, train_loss: 0.5387, test_loss: 0.8531, test_f1: 0.6763
 epoch: 58, train_loss: 0.5473, test_loss: 0.7991, test_f1: 0.6488
 epoch: 59, train_loss: 0.5288, test_loss: 0.8396, test_f1: 0.6400
 epoch: 60, train_loss: 0.5423, test_loss: 0.8770, test_f1: 0.6401
 epoch: 61, train_loss: 0.5411, test_loss: 0.7786, test_f1: 0.6431
 epoch: 62, train_loss: 0.5421, test_loss: 0.8764, test_f1: 0.6449
 epoch: 63, train_loss: 0.5245, test_loss: 0.8616, test_f1: 0.6426
 epoch: 64, train_loss: 0.5208, test_loss: 0.8784, test_f1: 0.6471
 epoch: 65, train_loss: 0.5176, test_loss: 0.8678, test_f1: 0.6474
 epoch: 66, train_loss: 0.5155, test_loss: 0.8680, test_f1: 0.6369
 epoch: 67, train_loss: 0.5258, test_loss: 0.8610, test_f1: 0.6321
 epoch: 68, train_loss: 0.5229, test_loss: 0.7738, test_f1: 0.6630
 epoch: 69, train_loss: 0.5286, test_loss: 0.8389, test_f1: 0.6543
 epoch: 70, train_loss: 0.5152, test_loss: 0.8021, test_f1: 0.6464
 epoch: 71, train_loss: 0.5136, test_loss: 0.8902, test_f1: 0.6589
 epoch: 72, train_loss: 0.5141, test_loss: 0.8740, test_f1: 0.6418
 epoch: 73, train_loss: 0.5189, test_loss: 0.8471, test_f1: 0.6479
 epoch: 74, train_loss: 0.5082, test_loss: 0.8577, test_f1: 0.6492
 epoch: 75, train_loss: 0.5107, test_loss: 0.7793, test_f1: 0.6680
 epoch: 76, train_loss: 0.4897, test_loss: 0.8345, test_f1: 0.6688
 epoch: 77, train_loss: 0.5024, test_loss: 0.8624, test_f1: 0.6600
 epoch: 78, train_loss: 0.4907, test_loss: 0.8710, test_f1: 0.6675
 epoch: 79, train_loss: 0.5002, test_loss: 0.8384, test_f1: 0.6667
 epoch: 80, train_loss: 0.5023, test_loss: 0.8912, test_f1: 0.6458
 epoch: 81, train_loss: 0.4881, test_loss: 0.7841, test_f1: 0.6692
 epoch: 82, train_loss: 0.4965, test_loss: 0.8707, test_f1: 0.6493
 epoch: 83, train_loss: 0.4865, test_loss: 0.8470, test_f1: 0.6561
 epoch: 84, train_loss: 0.4987, test_loss: 0.8700, test_f1: 0.6647
 epoch: 85, train_loss: 0.4749, test_loss: 0.9262, test_f1: 0.6485
 epoch: 86, train_loss: 0.4891, test_loss: 0.8665, test_f1: 0.6538
 epoch: 87, train_loss: 0.4798, test_loss: 0.8449, test_f1: 0.6460
 epoch: 88, train_loss: 0.4697, test_loss: 0.8950, test_f1: 0.6540
 epoch: 89, train_loss: 0.4787, test_loss: 0.8774, test_f1: 0.6753
 epoch: 90, train_loss: 0.4763, test_loss: 0.9014, test_f1: 0.6661
 epoch: 91, train_loss: 0.4652, test_loss: 0.9415, test_f1: 0.6433
 epoch: 92, train_loss: 0.4713, test_loss: 0.8938, test_f1: 0.6692
 epoch: 93, train_loss: 0.4750, test_loss: 0.9200, test_f1: 0.6676
 epoch: 94, train_loss: 0.4778, test_loss: 0.8655, test_f1: 0.6710
 epoch: 95, train_loss: 0.4656, test_loss: 0.8595, test_f1: 0.6633
 epoch: 96, train_loss: 0.4832, test_loss: 0.9304, test_f1: 0.6678
 epoch: 97, train_loss: 0.4718, test_loss: 0.8939, test_f1: 0.6726
 epoch: 98, train_loss: 0.4593, test_loss: 0.9312, test_f1: 0.6645
 epoch: 99, train_loss: 0.4584, test_loss: 0.9607, test_f1: 0.6684
##################ITERATION #2 ****************************************
 epoch: 0, train_loss: 1.1655, test_loss: 1.0152, test_f1: 0.4331
 epoch: 1, train_loss: 1.0280, test_loss: 0.9734, test_f1: 0.4944
 epoch: 2, train_loss: 0.9927, test_loss: 0.9633, test_f1: 0.4945
 epoch: 3, train_loss: 0.9596, test_loss: 0.9606, test_f1: 0.5394
 epoch: 4, train_loss: 0.9349, test_loss: 0.9211, test_f1: 0.5292
 epoch: 5, train_loss: 0.9181, test_loss: 0.9099, test_f1: 0.5399
 epoch: 6, train_loss: 0.9025, test_loss: 0.9222, test_f1: 0.5614
 epoch: 7, train_loss: 0.8794, test_loss: 0.8933, test_f1: 0.5380
 epoch: 8, train_loss: 0.8684, test_loss: 0.8989, test_f1: 0.5692
 epoch: 9, train_loss: 0.8516, test_loss: 0.8691, test_f1: 0.5745
 epoch: 10, train_loss: 0.8322, test_loss: 0.8595, test_f1: 0.5474
 epoch: 11, train_loss: 0.8209, test_loss: 0.8456, test_f1: 0.5797
 epoch: 12, train_loss: 0.8128, test_loss: 0.8551, test_f1: 0.5737
 epoch: 13, train_loss: 0.7984, test_loss: 0.8472, test_f1: 0.5586
 epoch: 14, train_loss: 0.7960, test_loss: 0.8254, test_f1: 0.5756
 epoch: 15, train_loss: 0.7734, test_loss: 0.8433, test_f1: 0.5617
 epoch: 16, train_loss: 0.7756, test_loss: 0.8069, test_f1: 0.5825
 epoch: 17, train_loss: 0.7693, test_loss: 0.8254, test_f1: 0.5514
 epoch: 18, train_loss: 0.7640, test_loss: 0.8433, test_f1: 0.5747
 epoch: 19, train_loss: 0.7429, test_loss: 0.8187, test_f1: 0.5879
 epoch: 20, train_loss: 0.7327, test_loss: 0.8279, test_f1: 0.5793
 epoch: 21, train_loss: 0.7379, test_loss: 0.8310, test_f1: 0.5774
 epoch: 22, train_loss: 0.7228, test_loss: 0.8126, test_f1: 0.5787
 epoch: 23, train_loss: 0.7157, test_loss: 0.8385, test_f1: 0.5900
 epoch: 24, train_loss: 0.7196, test_loss: 0.8180, test_f1: 0.5862
 epoch: 25, train_loss: 0.7098, test_loss: 0.8301, test_f1: 0.5741
 epoch: 26, train_loss: 0.7103, test_loss: 0.8420, test_f1: 0.6071
 epoch: 27, train_loss: 0.6933, test_loss: 0.7851, test_f1: 0.6123
 epoch: 28, train_loss: 0.6900, test_loss: 0.8085, test_f1: 0.6148
 epoch: 29, train_loss: 0.6821, test_loss: 0.8064, test_f1: 0.5950
 epoch: 30, train_loss: 0.6762, test_loss: 0.8074, test_f1: 0.5841
 epoch: 31, train_loss: 0.6772, test_loss: 0.8191, test_f1: 0.6066
 epoch: 32, train_loss: 0.6634, test_loss: 0.7635, test_f1: 0.6162
 epoch: 33, train_loss: 0.6536, test_loss: 0.7955, test_f1: 0.6072
 epoch: 34, train_loss: 0.6444, test_loss: 0.7482, test_f1: 0.6061
 epoch: 35, train_loss: 0.6468, test_loss: 0.7838, test_f1: 0.5944
 epoch: 36, train_loss: 0.6522, test_loss: 0.7848, test_f1: 0.6202
 epoch: 37, train_loss: 0.6342, test_loss: 0.7586, test_f1: 0.6235
 epoch: 38, train_loss: 0.6362, test_loss: 0.7774, test_f1: 0.6124
 epoch: 39, train_loss: 0.6300, test_loss: 0.7480, test_f1: 0.6105
 epoch: 40, train_loss: 0.6355, test_loss: 0.7719, test_f1: 0.6000
 epoch: 41, train_loss: 0.6221, test_loss: 0.7883, test_f1: 0.6147
 epoch: 42, train_loss: 0.6240, test_loss: 0.7493, test_f1: 0.6300
 epoch: 43, train_loss: 0.6088, test_loss: 0.8583, test_f1: 0.6265
 epoch: 44, train_loss: 0.6170, test_loss: 0.7773, test_f1: 0.6260
 epoch: 45, train_loss: 0.6189, test_loss: 0.8632, test_f1: 0.6244
 epoch: 46, train_loss: 0.6065, test_loss: 0.7870, test_f1: 0.6257
 epoch: 47, train_loss: 0.5834, test_loss: 0.8493, test_f1: 0.6310
 epoch: 48, train_loss: 0.5864, test_loss: 0.8602, test_f1: 0.6308
 epoch: 49, train_loss: 0.5829, test_loss: 0.7851, test_f1: 0.6262
 epoch: 50, train_loss: 0.5856, test_loss: 0.8493, test_f1: 0.6439
 epoch: 51, train_loss: 0.5671, test_loss: 0.8848, test_f1: 0.6291
 epoch: 52, train_loss: 0.5602, test_loss: 0.8638, test_f1: 0.6407
 epoch: 53, train_loss: 0.5514, test_loss: 0.8837, test_f1: 0.6322
 epoch: 54, train_loss: 0.5496, test_loss: 0.8610, test_f1: 0.6264
 epoch: 55, train_loss: 0.5563, test_loss: 0.8404, test_f1: 0.6216
 epoch: 56, train_loss: 0.5466, test_loss: 0.8626, test_f1: 0.6249
 epoch: 57, train_loss: 0.5461, test_loss: 0.8957, test_f1: 0.6148
 epoch: 58, train_loss: 0.5397, test_loss: 0.8794, test_f1: 0.6294
 epoch: 59, train_loss: 0.5449, test_loss: 0.8875, test_f1: 0.6381
 epoch: 60, train_loss: 0.5319, test_loss: 0.9285, test_f1: 0.6276
 epoch: 61, train_loss: 0.5513, test_loss: 0.8725, test_f1: 0.6450
 epoch: 62, train_loss: 0.5320, test_loss: 0.9531, test_f1: 0.6257
 epoch: 63, train_loss: 0.5457, test_loss: 0.8949, test_f1: 0.6362
 epoch: 64, train_loss: 0.5385, test_loss: 0.9105, test_f1: 0.6397
 epoch: 65, train_loss: 0.5289, test_loss: 0.8451, test_f1: 0.6426
 epoch: 66, train_loss: 0.5385, test_loss: 0.8383, test_f1: 0.6393
 epoch: 67, train_loss: 0.5242, test_loss: 0.8830, test_f1: 0.6274
 epoch: 68, train_loss: 0.5275, test_loss: 0.8364, test_f1: 0.6391
 epoch: 69, train_loss: 0.5185, test_loss: 0.8544, test_f1: 0.6362
 epoch: 70, train_loss: 0.5250, test_loss: 0.8179, test_f1: 0.6421
 epoch: 71, train_loss: 0.5210, test_loss: 0.8514, test_f1: 0.6460
 epoch: 72, train_loss: 0.5288, test_loss: 0.9821, test_f1: 0.6073
 epoch: 73, train_loss: 0.5169, test_loss: 0.8547, test_f1: 0.6644
 epoch: 74, train_loss: 0.5167, test_loss: 0.9273, test_f1: 0.6249
 epoch: 75, train_loss: 0.5047, test_loss: 0.8860, test_f1: 0.6437
 epoch: 76, train_loss: 0.4954, test_loss: 0.8374, test_f1: 0.6542
 epoch: 77, train_loss: 0.4996, test_loss: 0.8803, test_f1: 0.6588
 epoch: 78, train_loss: 0.5038, test_loss: 0.8820, test_f1: 0.6364
 epoch: 79, train_loss: 0.4956, test_loss: 0.9157, test_f1: 0.6680
 epoch: 80, train_loss: 0.5001, test_loss: 0.9101, test_f1: 0.6332
 epoch: 81, train_loss: 0.4941, test_loss: 0.8977, test_f1: 0.6483
 epoch: 82, train_loss: 0.4919, test_loss: 0.9327, test_f1: 0.6315
 epoch: 83, train_loss: 0.4966, test_loss: 0.9050, test_f1: 0.6368
 epoch: 84, train_loss: 0.4853, test_loss: 0.9672, test_f1: 0.6341
 epoch: 85, train_loss: 0.4819, test_loss: 0.9477, test_f1: 0.6489
 epoch: 86, train_loss: 0.4827, test_loss: 0.9928, test_f1: 0.6031
 epoch: 87, train_loss: 0.4948, test_loss: 0.9846, test_f1: 0.6463
 epoch: 88, train_loss: 0.4922, test_loss: 0.9386, test_f1: 0.6164
 epoch: 89, train_loss: 0.4707, test_loss: 1.0176, test_f1: 0.6367
 epoch: 90, train_loss: 0.4792, test_loss: 0.8832, test_f1: 0.6775
 epoch: 91, train_loss: 0.4738, test_loss: 1.0375, test_f1: 0.6313
 epoch: 92, train_loss: 0.4677, test_loss: 0.9657, test_f1: 0.6440
 epoch: 93, train_loss: 0.4678, test_loss: 0.9451, test_f1: 0.6487
 epoch: 94, train_loss: 0.4688, test_loss: 0.9489, test_f1: 0.6462
 epoch: 95, train_loss: 0.4848, test_loss: 0.8976, test_f1: 0.6374
 epoch: 96, train_loss: 0.4752, test_loss: 0.9777, test_f1: 0.6429
 epoch: 97, train_loss: 0.4701, test_loss: 0.9675, test_f1: 0.6460
 epoch: 98, train_loss: 0.4603, test_loss: 1.0390, test_f1: 0.6304
 epoch: 99, train_loss: 0.4747, test_loss: 1.0281, test_f1: 0.6348
##################ITERATION #3 ****************************************
 epoch: 0, train_loss: 1.1391, test_loss: 0.9712, test_f1: 0.4970
 epoch: 1, train_loss: 1.0212, test_loss: 0.9439, test_f1: 0.5158
 epoch: 2, train_loss: 0.9862, test_loss: 0.9259, test_f1: 0.5171
 epoch: 3, train_loss: 0.9573, test_loss: 0.9194, test_f1: 0.5452
 epoch: 4, train_loss: 0.9301, test_loss: 0.9030, test_f1: 0.5553
 epoch: 5, train_loss: 0.9229, test_loss: 0.8907, test_f1: 0.5521
 epoch: 6, train_loss: 0.9020, test_loss: 0.8819, test_f1: 0.5791
 epoch: 7, train_loss: 0.8828, test_loss: 0.8791, test_f1: 0.5810
 epoch: 8, train_loss: 0.8857, test_loss: 0.8523, test_f1: 0.5716
 epoch: 9, train_loss: 0.8729, test_loss: 0.8601, test_f1: 0.5607
 epoch: 10, train_loss: 0.8597, test_loss: 0.8860, test_f1: 0.5698
 epoch: 11, train_loss: 0.8460, test_loss: 0.8639, test_f1: 0.5841
 epoch: 12, train_loss: 0.8361, test_loss: 0.8618, test_f1: 0.5704
 epoch: 13, train_loss: 0.8146, test_loss: 0.8465, test_f1: 0.6173
 epoch: 14, train_loss: 0.8147, test_loss: 0.8556, test_f1: 0.6095
 epoch: 15, train_loss: 0.8003, test_loss: 0.8651, test_f1: 0.5768
 epoch: 16, train_loss: 0.7898, test_loss: 0.8458, test_f1: 0.6016
 epoch: 17, train_loss: 0.7813, test_loss: 0.8377, test_f1: 0.5859
 epoch: 18, train_loss: 0.7748, test_loss: 0.8281, test_f1: 0.6014
 epoch: 19, train_loss: 0.7624, test_loss: 0.8588, test_f1: 0.5805
 epoch: 20, train_loss: 0.7660, test_loss: 0.8372, test_f1: 0.6161
 epoch: 21, train_loss: 0.7391, test_loss: 0.8400, test_f1: 0.6070
 epoch: 22, train_loss: 0.7424, test_loss: 0.8489, test_f1: 0.6090
 epoch: 23, train_loss: 0.7444, test_loss: 0.8408, test_f1: 0.6238
 epoch: 24, train_loss: 0.7196, test_loss: 0.8682, test_f1: 0.6114
 epoch: 25, train_loss: 0.7254, test_loss: 0.8337, test_f1: 0.6350
 epoch: 26, train_loss: 0.7010, test_loss: 0.8356, test_f1: 0.6183
 epoch: 27, train_loss: 0.6996, test_loss: 0.8271, test_f1: 0.6443
 epoch: 28, train_loss: 0.7025, test_loss: 0.8466, test_f1: 0.6490
 epoch: 29, train_loss: 0.6957, test_loss: 0.8060, test_f1: 0.6447
 epoch: 30, train_loss: 0.6875, test_loss: 0.8361, test_f1: 0.6743
 epoch: 31, train_loss: 0.6912, test_loss: 0.8641, test_f1: 0.6324
 epoch: 32, train_loss: 0.6717, test_loss: 0.8604, test_f1: 0.6493
 epoch: 33, train_loss: 0.6618, test_loss: 0.8124, test_f1: 0.6272
 epoch: 34, train_loss: 0.6644, test_loss: 0.8368, test_f1: 0.6752
 epoch: 35, train_loss: 0.6731, test_loss: 0.8198, test_f1: 0.6435
 epoch: 36, train_loss: 0.6569, test_loss: 0.8119, test_f1: 0.6486
 epoch: 37, train_loss: 0.6585, test_loss: 0.8399, test_f1: 0.6453
 epoch: 38, train_loss: 0.6277, test_loss: 0.8198, test_f1: 0.6529
 epoch: 39, train_loss: 0.6414, test_loss: 0.8076, test_f1: 0.6464
 epoch: 40, train_loss: 0.6488, test_loss: 0.7884, test_f1: 0.6389
 epoch: 41, train_loss: 0.6417, test_loss: 0.7632, test_f1: 0.6438
 epoch: 42, train_loss: 0.6255, test_loss: 0.7325, test_f1: 0.6536
 epoch: 43, train_loss: 0.6163, test_loss: 0.8599, test_f1: 0.6355
 epoch: 44, train_loss: 0.6131, test_loss: 0.7791, test_f1: 0.6423
 epoch: 45, train_loss: 0.6188, test_loss: 0.8401, test_f1: 0.6400
 epoch: 46, train_loss: 0.5994, test_loss: 0.8400, test_f1: 0.6345
 epoch: 47, train_loss: 0.6130, test_loss: 0.7999, test_f1: 0.6441
 epoch: 48, train_loss: 0.6060, test_loss: 0.8454, test_f1: 0.6245
 epoch: 49, train_loss: 0.5928, test_loss: 0.8258, test_f1: 0.6721
 epoch: 50, train_loss: 0.6125, test_loss: 0.8624, test_f1: 0.6338
 epoch: 51, train_loss: 0.5772, test_loss: 0.8500, test_f1: 0.6451
 epoch: 52, train_loss: 0.5683, test_loss: 0.8329, test_f1: 0.6510
 epoch: 53, train_loss: 0.5589, test_loss: 0.7875, test_f1: 0.6275
 epoch: 54, train_loss: 0.5584, test_loss: 0.8263, test_f1: 0.6383
 epoch: 55, train_loss: 0.5636, test_loss: 0.8511, test_f1: 0.6370
 epoch: 56, train_loss: 0.5510, test_loss: 0.8676, test_f1: 0.6318
 epoch: 57, train_loss: 0.5556, test_loss: 0.8166, test_f1: 0.6383
 epoch: 58, train_loss: 0.5651, test_loss: 0.8486, test_f1: 0.6670
 epoch: 59, train_loss: 0.5488, test_loss: 1.0258, test_f1: 0.6186
 epoch: 60, train_loss: 0.5512, test_loss: 0.8596, test_f1: 0.6288
 epoch: 61, train_loss: 0.5604, test_loss: 0.8831, test_f1: 0.6470
 epoch: 62, train_loss: 0.5404, test_loss: 0.8121, test_f1: 0.6335
 epoch: 63, train_loss: 0.5345, test_loss: 0.8644, test_f1: 0.6644
 epoch: 64, train_loss: 0.5352, test_loss: 0.8448, test_f1: 0.6544
 epoch: 65, train_loss: 0.5385, test_loss: 0.9105, test_f1: 0.6255
 epoch: 66, train_loss: 0.5397, test_loss: 0.8551, test_f1: 0.6427
 epoch: 67, train_loss: 0.5350, test_loss: 0.8171, test_f1: 0.6493
 epoch: 68, train_loss: 0.5223, test_loss: 0.8397, test_f1: 0.6258
 epoch: 69, train_loss: 0.5244, test_loss: 0.8230, test_f1: 0.6521
 epoch: 70, train_loss: 0.5265, test_loss: 0.8531, test_f1: 0.6442
 epoch: 71, train_loss: 0.5316, test_loss: 0.8171, test_f1: 0.6539
 epoch: 72, train_loss: 0.5175, test_loss: 0.8365, test_f1: 0.6301
 epoch: 73, train_loss: 0.5135, test_loss: 0.8552, test_f1: 0.6274
 epoch: 74, train_loss: 0.5225, test_loss: 0.8243, test_f1: 0.6433
 epoch: 75, train_loss: 0.5114, test_loss: 0.8488, test_f1: 0.6286
 epoch: 76, train_loss: 0.5232, test_loss: 0.8635, test_f1: 0.6516
 epoch: 77, train_loss: 0.5180, test_loss: 0.8284, test_f1: 0.6470
 epoch: 78, train_loss: 0.5014, test_loss: 0.7891, test_f1: 0.6543
 epoch: 79, train_loss: 0.4928, test_loss: 0.8682, test_f1: 0.6479
 epoch: 80, train_loss: 0.4952, test_loss: 0.8217, test_f1: 0.6515
 epoch: 81, train_loss: 0.4911, test_loss: 0.9798, test_f1: 0.6247
 epoch: 82, train_loss: 0.4985, test_loss: 0.8298, test_f1: 0.6570
 epoch: 83, train_loss: 0.4822, test_loss: 0.8400, test_f1: 0.6332
 epoch: 84, train_loss: 0.4912, test_loss: 0.8951, test_f1: 0.6237
 epoch: 85, train_loss: 0.4915, test_loss: 0.9114, test_f1: 0.6393
 epoch: 86, train_loss: 0.4798, test_loss: 0.8533, test_f1: 0.6433
 epoch: 87, train_loss: 0.4888, test_loss: 0.8337, test_f1: 0.6684
 epoch: 88, train_loss: 0.4808, test_loss: 0.8733, test_f1: 0.6398
 epoch: 89, train_loss: 0.4807, test_loss: 0.8833, test_f1: 0.6501
 epoch: 90, train_loss: 0.4888, test_loss: 0.8345, test_f1: 0.6545
 epoch: 91, train_loss: 0.4827, test_loss: 0.8502, test_f1: 0.6526
 epoch: 92, train_loss: 0.4634, test_loss: 0.9100, test_f1: 0.6547
 epoch: 93, train_loss: 0.4692, test_loss: 0.8543, test_f1: 0.6595
 epoch: 94, train_loss: 0.4778, test_loss: 0.8878, test_f1: 0.6317
 epoch: 95, train_loss: 0.4658, test_loss: 0.8874, test_f1: 0.6477
 epoch: 96, train_loss: 0.4697, test_loss: 0.8767, test_f1: 0.6474
 epoch: 97, train_loss: 0.4666, test_loss: 0.8277, test_f1: 0.6481
 epoch: 98, train_loss: 0.4643, test_loss: 0.9030, test_f1: 0.6469
 epoch: 99, train_loss: 0.4658, test_loss: 0.9085, test_f1: 0.6217
##################ITERATION #4 ****************************************
 epoch: 0, train_loss: 1.1724, test_loss: 0.9877, test_f1: 0.5186
 epoch: 1, train_loss: 1.0388, test_loss: 0.9659, test_f1: 0.5267
 epoch: 2, train_loss: 0.9995, test_loss: 0.9517, test_f1: 0.5274
 epoch: 3, train_loss: 0.9722, test_loss: 0.9377, test_f1: 0.5350
 epoch: 4, train_loss: 0.9396, test_loss: 0.9133, test_f1: 0.5438
 epoch: 5, train_loss: 0.9337, test_loss: 0.9255, test_f1: 0.5540
 epoch: 6, train_loss: 0.9030, test_loss: 0.9244, test_f1: 0.5570
 epoch: 7, train_loss: 0.8840, test_loss: 0.8933, test_f1: 0.5603
 epoch: 8, train_loss: 0.8787, test_loss: 0.9000, test_f1: 0.5663
 epoch: 9, train_loss: 0.8615, test_loss: 0.9069, test_f1: 0.5871
 epoch: 10, train_loss: 0.8372, test_loss: 0.8714, test_f1: 0.5793
 epoch: 11, train_loss: 0.8417, test_loss: 0.8987, test_f1: 0.5603
 epoch: 12, train_loss: 0.8125, test_loss: 0.8935, test_f1: 0.5622
 epoch: 13, train_loss: 0.8043, test_loss: 0.8791, test_f1: 0.5894
 epoch: 14, train_loss: 0.7978, test_loss: 0.8576, test_f1: 0.5984
 epoch: 15, train_loss: 0.7939, test_loss: 0.8588, test_f1: 0.5971
 epoch: 16, train_loss: 0.7710, test_loss: 0.8435, test_f1: 0.6174
 epoch: 17, train_loss: 0.7687, test_loss: 0.8317, test_f1: 0.5959
 epoch: 18, train_loss: 0.7569, test_loss: 0.8407, test_f1: 0.6157
 epoch: 19, train_loss: 0.7529, test_loss: 0.8463, test_f1: 0.6215
 epoch: 20, train_loss: 0.7509, test_loss: 0.8193, test_f1: 0.6296
 epoch: 21, train_loss: 0.7340, test_loss: 0.8230, test_f1: 0.6101
 epoch: 22, train_loss: 0.7329, test_loss: 0.8140, test_f1: 0.6336
 epoch: 23, train_loss: 0.7102, test_loss: 0.8282, test_f1: 0.6512
 epoch: 24, train_loss: 0.7127, test_loss: 0.8339, test_f1: 0.6093
 epoch: 25, train_loss: 0.7026, test_loss: 0.8251, test_f1: 0.6282
 epoch: 26, train_loss: 0.6986, test_loss: 0.8329, test_f1: 0.6220
 epoch: 27, train_loss: 0.6869, test_loss: 0.8657, test_f1: 0.6024
 epoch: 28, train_loss: 0.6824, test_loss: 0.8475, test_f1: 0.6200
 epoch: 29, train_loss: 0.6698, test_loss: 0.8315, test_f1: 0.6157
 epoch: 30, train_loss: 0.6719, test_loss: 0.8549, test_f1: 0.6131
 epoch: 31, train_loss: 0.6649, test_loss: 0.8439, test_f1: 0.6247
 epoch: 32, train_loss: 0.6781, test_loss: 0.7921, test_f1: 0.6400
 epoch: 33, train_loss: 0.6562, test_loss: 0.8340, test_f1: 0.6433
 epoch: 34, train_loss: 0.6519, test_loss: 0.8317, test_f1: 0.6322
 epoch: 35, train_loss: 0.6519, test_loss: 0.8201, test_f1: 0.6524
 epoch: 36, train_loss: 0.6480, test_loss: 0.8266, test_f1: 0.6382
 epoch: 37, train_loss: 0.6367, test_loss: 0.8173, test_f1: 0.6441
 epoch: 38, train_loss: 0.6363, test_loss: 0.8316, test_f1: 0.6306
 epoch: 39, train_loss: 0.6220, test_loss: 0.7869, test_f1: 0.6451
 epoch: 40, train_loss: 0.6165, test_loss: 0.8633, test_f1: 0.6320
 epoch: 41, train_loss: 0.6106, test_loss: 0.8044, test_f1: 0.6332
 epoch: 42, train_loss: 0.6162, test_loss: 0.8155, test_f1: 0.6339
 epoch: 43, train_loss: 0.6120, test_loss: 0.8585, test_f1: 0.6601
 epoch: 44, train_loss: 0.5978, test_loss: 0.8343, test_f1: 0.6450
 epoch: 45, train_loss: 0.5819, test_loss: 0.8135, test_f1: 0.6669
 epoch: 46, train_loss: 0.5838, test_loss: 0.8589, test_f1: 0.6350
 epoch: 47, train_loss: 0.5935, test_loss: 0.7913, test_f1: 0.6494
 epoch: 48, train_loss: 0.5782, test_loss: 0.7947, test_f1: 0.6473
 epoch: 49, train_loss: 0.5810, test_loss: 0.8323, test_f1: 0.6496
 epoch: 50, train_loss: 0.5736, test_loss: 0.8724, test_f1: 0.6483
 epoch: 51, train_loss: 0.5593, test_loss: 0.8231, test_f1: 0.6582
 epoch: 52, train_loss: 0.5433, test_loss: 0.8443, test_f1: 0.6445
 epoch: 53, train_loss: 0.5359, test_loss: 0.8558, test_f1: 0.6394
 epoch: 54, train_loss: 0.5435, test_loss: 0.8586, test_f1: 0.6462
 epoch: 55, train_loss: 0.5382, test_loss: 0.8309, test_f1: 0.6558
 epoch: 56, train_loss: 0.5399, test_loss: 0.8885, test_f1: 0.6548
 epoch: 57, train_loss: 0.5337, test_loss: 0.8770, test_f1: 0.6485
 epoch: 58, train_loss: 0.5280, test_loss: 0.8829, test_f1: 0.6533
 epoch: 59, train_loss: 0.5262, test_loss: 0.8334, test_f1: 0.6603
 epoch: 60, train_loss: 0.5194, test_loss: 0.8690, test_f1: 0.6547
 epoch: 61, train_loss: 0.5301, test_loss: 0.9111, test_f1: 0.6630
 epoch: 62, train_loss: 0.5149, test_loss: 0.8384, test_f1: 0.6651
 epoch: 63, train_loss: 0.5272, test_loss: 0.8395, test_f1: 0.6564
 epoch: 64, train_loss: 0.5106, test_loss: 0.8740, test_f1: 0.6666
 epoch: 65, train_loss: 0.5269, test_loss: 0.8627, test_f1: 0.6673
 epoch: 66, train_loss: 0.5104, test_loss: 0.8148, test_f1: 0.6826
 epoch: 67, train_loss: 0.5098, test_loss: 0.8502, test_f1: 0.6644
 epoch: 68, train_loss: 0.4973, test_loss: 0.8242, test_f1: 0.6519
 epoch: 69, train_loss: 0.4869, test_loss: 0.8989, test_f1: 0.6845
 epoch: 70, train_loss: 0.5152, test_loss: 0.7842, test_f1: 0.6836
 epoch: 71, train_loss: 0.5037, test_loss: 0.8404, test_f1: 0.6779
 epoch: 72, train_loss: 0.5006, test_loss: 0.8247, test_f1: 0.6757
 epoch: 73, train_loss: 0.5068, test_loss: 0.8790, test_f1: 0.6536
 epoch: 74, train_loss: 0.4954, test_loss: 0.8649, test_f1: 0.6454
 epoch: 75, train_loss: 0.4833, test_loss: 0.8992, test_f1: 0.6483
 epoch: 76, train_loss: 0.4779, test_loss: 0.8782, test_f1: 0.6706
 epoch: 77, train_loss: 0.4764, test_loss: 0.9266, test_f1: 0.6657
 epoch: 78, train_loss: 0.4848, test_loss: 0.9314, test_f1: 0.6454
 epoch: 79, train_loss: 0.4686, test_loss: 0.9037, test_f1: 0.6389
 epoch: 80, train_loss: 0.4735, test_loss: 0.8551, test_f1: 0.6545
 epoch: 81, train_loss: 0.4756, test_loss: 0.9078, test_f1: 0.6528
 epoch: 82, train_loss: 0.4751, test_loss: 0.9506, test_f1: 0.6625
 epoch: 83, train_loss: 0.4576, test_loss: 0.9139, test_f1: 0.6616
 epoch: 84, train_loss: 0.4649, test_loss: 0.8900, test_f1: 0.6667
 epoch: 85, train_loss: 0.4662, test_loss: 0.8605, test_f1: 0.6575
 epoch: 86, train_loss: 0.4657, test_loss: 0.9381, test_f1: 0.6784
 epoch: 87, train_loss: 0.4741, test_loss: 0.8688, test_f1: 0.6563
 epoch: 88, train_loss: 0.4624, test_loss: 0.8526, test_f1: 0.6673
 epoch: 89, train_loss: 0.4530, test_loss: 0.8438, test_f1: 0.6725
 epoch: 90, train_loss: 0.4573, test_loss: 0.8900, test_f1: 0.6672
 epoch: 91, train_loss: 0.4679, test_loss: 0.9220, test_f1: 0.6817
 epoch: 92, train_loss: 0.4645, test_loss: 0.8947, test_f1: 0.6652
 epoch: 93, train_loss: 0.4393, test_loss: 0.8851, test_f1: 0.6859
 epoch: 94, train_loss: 0.4660, test_loss: 0.8736, test_f1: 0.6582
 epoch: 95, train_loss: 0.4486, test_loss: 0.8958, test_f1: 0.6812
 epoch: 96, train_loss: 0.4273, test_loss: 0.8962, test_f1: 0.6722
 epoch: 97, train_loss: 0.4487, test_loss: 0.9409, test_f1: 0.6585
 epoch: 98, train_loss: 0.4469, test_loss: 0.9544, test_f1: 0.6596
 epoch: 99, train_loss: 0.4338, test_loss: 0.9426, test_f1: 0.6699
##################ITERATION #5 ****************************************
 epoch: 0, train_loss: 1.1644, test_loss: 0.9786, test_f1: 0.4835
 epoch: 1, train_loss: 1.0266, test_loss: 0.9617, test_f1: 0.4811
 epoch: 2, train_loss: 0.9879, test_loss: 0.9540, test_f1: 0.5519
 epoch: 3, train_loss: 0.9675, test_loss: 0.9633, test_f1: 0.4770
 epoch: 4, train_loss: 0.9318, test_loss: 0.9247, test_f1: 0.5374
 epoch: 5, train_loss: 0.9268, test_loss: 0.9315, test_f1: 0.5490
 epoch: 6, train_loss: 0.8928, test_loss: 0.8984, test_f1: 0.5590
 epoch: 7, train_loss: 0.8774, test_loss: 0.9090, test_f1: 0.5405
 epoch: 8, train_loss: 0.8614, test_loss: 0.9359, test_f1: 0.5408
 epoch: 9, train_loss: 0.8469, test_loss: 0.8884, test_f1: 0.5575
 epoch: 10, train_loss: 0.8301, test_loss: 0.8774, test_f1: 0.5641
 epoch: 11, train_loss: 0.8307, test_loss: 0.8741, test_f1: 0.5825
 epoch: 12, train_loss: 0.7994, test_loss: 0.8680, test_f1: 0.6067
 epoch: 13, train_loss: 0.7896, test_loss: 0.8562, test_f1: 0.6222
 epoch: 14, train_loss: 0.7778, test_loss: 0.8555, test_f1: 0.5884
 epoch: 15, train_loss: 0.7824, test_loss: 0.8430, test_f1: 0.6332
 epoch: 16, train_loss: 0.7701, test_loss: 0.8543, test_f1: 0.6166
 epoch: 17, train_loss: 0.7521, test_loss: 0.8394, test_f1: 0.6155
 epoch: 18, train_loss: 0.7511, test_loss: 0.8583, test_f1: 0.6190
 epoch: 19, train_loss: 0.7386, test_loss: 0.8385, test_f1: 0.6505
 epoch: 20, train_loss: 0.7244, test_loss: 0.8561, test_f1: 0.6503
 epoch: 21, train_loss: 0.7257, test_loss: 0.8380, test_f1: 0.6247
 epoch: 22, train_loss: 0.7134, test_loss: 0.8209, test_f1: 0.6372
 epoch: 23, train_loss: 0.7034, test_loss: 0.8202, test_f1: 0.6277
 epoch: 24, train_loss: 0.6800, test_loss: 0.8330, test_f1: 0.6502
 epoch: 25, train_loss: 0.6918, test_loss: 0.8412, test_f1: 0.6396
 epoch: 26, train_loss: 0.6857, test_loss: 0.8623, test_f1: 0.6176
 epoch: 27, train_loss: 0.6823, test_loss: 0.8418, test_f1: 0.6218
 epoch: 28, train_loss: 0.6636, test_loss: 0.8370, test_f1: 0.6430
 epoch: 29, train_loss: 0.6637, test_loss: 0.8324, test_f1: 0.6770
 epoch: 30, train_loss: 0.6551, test_loss: 0.8532, test_f1: 0.6469
 epoch: 31, train_loss: 0.6442, test_loss: 0.8607, test_f1: 0.6417
 epoch: 32, train_loss: 0.6407, test_loss: 0.8441, test_f1: 0.6651
 epoch: 33, train_loss: 0.6473, test_loss: 0.8766, test_f1: 0.6368
 epoch: 34, train_loss: 0.6430, test_loss: 0.8212, test_f1: 0.6678
 epoch: 35, train_loss: 0.6298, test_loss: 0.8689, test_f1: 0.6601
 epoch: 36, train_loss: 0.6252, test_loss: 0.8311, test_f1: 0.6810
 epoch: 37, train_loss: 0.6303, test_loss: 0.8151, test_f1: 0.6801
 epoch: 38, train_loss: 0.6247, test_loss: 0.8458, test_f1: 0.6475
 epoch: 39, train_loss: 0.6183, test_loss: 0.8792, test_f1: 0.6567
 epoch: 40, train_loss: 0.6065, test_loss: 0.8573, test_f1: 0.6760
 epoch: 41, train_loss: 0.6046, test_loss: 0.8679, test_f1: 0.6518
 epoch: 42, train_loss: 0.6044, test_loss: 0.8320, test_f1: 0.6792
 epoch: 43, train_loss: 0.5979, test_loss: 0.8838, test_f1: 0.6646
 epoch: 44, train_loss: 0.5900, test_loss: 0.8857, test_f1: 0.6566
 epoch: 45, train_loss: 0.5817, test_loss: 0.8542, test_f1: 0.6647
 epoch: 46, train_loss: 0.5712, test_loss: 0.8305, test_f1: 0.6587
 epoch: 47, train_loss: 0.5630, test_loss: 0.8653, test_f1: 0.6676
 epoch: 48, train_loss: 0.5650, test_loss: 0.8587, test_f1: 0.6659
 epoch: 49, train_loss: 0.5681, test_loss: 0.8749, test_f1: 0.6578
 epoch: 50, train_loss: 0.5526, test_loss: 0.8575, test_f1: 0.6720
 epoch: 51, train_loss: 0.5582, test_loss: 0.8867, test_f1: 0.6796
 epoch: 52, train_loss: 0.5476, test_loss: 0.8630, test_f1: 0.6703
 epoch: 53, train_loss: 0.5410, test_loss: 0.8683, test_f1: 0.6697
 epoch: 54, train_loss: 0.5448, test_loss: 0.8695, test_f1: 0.6703
 epoch: 55, train_loss: 0.5277, test_loss: 0.8976, test_f1: 0.6693
 epoch: 56, train_loss: 0.5362, test_loss: 0.9029, test_f1: 0.6563
 epoch: 57, train_loss: 0.5141, test_loss: 0.9187, test_f1: 0.6612
 epoch: 58, train_loss: 0.5174, test_loss: 0.8880, test_f1: 0.6531
 epoch: 59, train_loss: 0.5252, test_loss: 0.9055, test_f1: 0.6768
 epoch: 60, train_loss: 0.5253, test_loss: 0.8913, test_f1: 0.6537
 epoch: 61, train_loss: 0.5181, test_loss: 0.9036, test_f1: 0.6709
 epoch: 62, train_loss: 0.5192, test_loss: 0.9067, test_f1: 0.6729
 epoch: 63, train_loss: 0.5176, test_loss: 0.8846, test_f1: 0.6864
 epoch: 64, train_loss: 0.5184, test_loss: 0.9117, test_f1: 0.6556
 epoch: 65, train_loss: 0.5059, test_loss: 0.9101, test_f1: 0.6763
 epoch: 66, train_loss: 0.5061, test_loss: 0.9212, test_f1: 0.6551
 epoch: 67, train_loss: 0.5065, test_loss: 0.9254, test_f1: 0.6628
 epoch: 68, train_loss: 0.4987, test_loss: 0.9179, test_f1: 0.6634
 epoch: 69, train_loss: 0.4911, test_loss: 0.9027, test_f1: 0.6616
 epoch: 70, train_loss: 0.4958, test_loss: 0.9484, test_f1: 0.6657
 epoch: 71, train_loss: 0.4945, test_loss: 0.9245, test_f1: 0.6646
 epoch: 72, train_loss: 0.4975, test_loss: 0.9248, test_f1: 0.6651
 epoch: 73, train_loss: 0.5060, test_loss: 0.9224, test_f1: 0.6807
 epoch: 74, train_loss: 0.4934, test_loss: 0.9320, test_f1: 0.6582
 epoch: 75, train_loss: 0.5009, test_loss: 0.9739, test_f1: 0.6609
 epoch: 76, train_loss: 0.4911, test_loss: 0.9409, test_f1: 0.6694
 epoch: 77, train_loss: 0.4785, test_loss: 0.9409, test_f1: 0.6587
 epoch: 78, train_loss: 0.4837, test_loss: 0.9250, test_f1: 0.6824
 epoch: 79, train_loss: 0.4689, test_loss: 0.9569, test_f1: 0.6614
 epoch: 80, train_loss: 0.4784, test_loss: 0.9432, test_f1: 0.6675
 epoch: 81, train_loss: 0.4754, test_loss: 0.9659, test_f1: 0.6753
 epoch: 82, train_loss: 0.4713, test_loss: 0.9567, test_f1: 0.6682
 epoch: 83, train_loss: 0.4675, test_loss: 0.9520, test_f1: 0.6775
 epoch: 84, train_loss: 0.4614, test_loss: 0.9811, test_f1: 0.6598
 epoch: 85, train_loss: 0.4544, test_loss: 0.9663, test_f1: 0.6735
 epoch: 86, train_loss: 0.4700, test_loss: 0.9957, test_f1: 0.6734
 epoch: 87, train_loss: 0.4625, test_loss: 0.9768, test_f1: 0.6458
 epoch: 88, train_loss: 0.4575, test_loss: 1.0688, test_f1: 0.6631
 epoch: 89, train_loss: 0.4715, test_loss: 1.0001, test_f1: 0.6600
 epoch: 90, train_loss: 0.4548, test_loss: 0.9994, test_f1: 0.6652
 epoch: 91, train_loss: 0.4586, test_loss: 0.9720, test_f1: 0.6659
 epoch: 92, train_loss: 0.4502, test_loss: 0.9874, test_f1: 0.6652
 epoch: 93, train_loss: 0.4572, test_loss: 1.0027, test_f1: 0.6719
 epoch: 94, train_loss: 0.4493, test_loss: 1.0599, test_f1: 0.6444
 epoch: 95, train_loss: 0.4491, test_loss: 1.0375, test_f1: 0.6656
 epoch: 96, train_loss: 0.4521, test_loss: 1.0116, test_f1: 0.6630
 epoch: 97, train_loss: 0.4530, test_loss: 1.0455, test_f1: 0.6681
 epoch: 98, train_loss: 0.4492, test_loss: 1.0097, test_f1: 0.6645
 epoch: 99, train_loss: 0.4260, test_loss: 1.0099, test_f1: 0.6649
##################ITERATION #6 ****************************************
 epoch: 0, train_loss: 1.2032, test_loss: 1.0081, test_f1: 0.5013
 epoch: 1, train_loss: 1.0662, test_loss: 0.9856, test_f1: 0.5214
 epoch: 2, train_loss: 1.0199, test_loss: 0.9669, test_f1: 0.5335
 epoch: 3, train_loss: 0.9793, test_loss: 0.9612, test_f1: 0.5135
 epoch: 4, train_loss: 0.9570, test_loss: 0.9435, test_f1: 0.5575
 epoch: 5, train_loss: 0.9399, test_loss: 0.9124, test_f1: 0.5427
 epoch: 6, train_loss: 0.9178, test_loss: 0.9021, test_f1: 0.5535
 epoch: 7, train_loss: 0.9015, test_loss: 0.9212, test_f1: 0.5309
 epoch: 8, train_loss: 0.8789, test_loss: 0.8988, test_f1: 0.5478
 epoch: 9, train_loss: 0.8756, test_loss: 0.8663, test_f1: 0.5711
 epoch: 10, train_loss: 0.8486, test_loss: 0.8656, test_f1: 0.6215
 epoch: 11, train_loss: 0.8367, test_loss: 0.8750, test_f1: 0.5902
 epoch: 12, train_loss: 0.8196, test_loss: 1.0748, test_f1: 0.5709
 epoch: 13, train_loss: 0.8207, test_loss: 0.8993, test_f1: 0.5682
 epoch: 14, train_loss: 0.8074, test_loss: 0.8541, test_f1: 0.6101
 epoch: 15, train_loss: 0.7986, test_loss: 0.8600, test_f1: 0.6185
 epoch: 16, train_loss: 0.7722, test_loss: 0.8254, test_f1: 0.6193
 epoch: 17, train_loss: 0.7756, test_loss: 0.8495, test_f1: 0.6112
 epoch: 18, train_loss: 0.7651, test_loss: 0.8140, test_f1: 0.6079
 epoch: 19, train_loss: 0.7593, test_loss: 0.8243, test_f1: 0.6265
 epoch: 20, train_loss: 0.7560, test_loss: 0.8158, test_f1: 0.6271
 epoch: 21, train_loss: 0.7404, test_loss: 0.8485, test_f1: 0.6173
 epoch: 22, train_loss: 0.7361, test_loss: 0.8423, test_f1: 0.5976
 epoch: 23, train_loss: 0.7264, test_loss: 0.8089, test_f1: 0.6318
 epoch: 24, train_loss: 0.7270, test_loss: 0.8202, test_f1: 0.6362
 epoch: 25, train_loss: 0.7179, test_loss: 0.8012, test_f1: 0.6362
 epoch: 26, train_loss: 0.7201, test_loss: 0.7809, test_f1: 0.6156
 epoch: 27, train_loss: 0.6902, test_loss: 0.8203, test_f1: 0.6344
 epoch: 28, train_loss: 0.6963, test_loss: 0.8415, test_f1: 0.6166
 epoch: 29, train_loss: 0.6706, test_loss: 0.8148, test_f1: 0.6268
 epoch: 30, train_loss: 0.6986, test_loss: 0.8044, test_f1: 0.6501
 epoch: 31, train_loss: 0.6855, test_loss: 0.8305, test_f1: 0.6294
 epoch: 32, train_loss: 0.6689, test_loss: 0.8037, test_f1: 0.6329
 epoch: 33, train_loss: 0.6671, test_loss: 0.7772, test_f1: 0.6279
 epoch: 34, train_loss: 0.6553, test_loss: 0.7855, test_f1: 0.6503
 epoch: 35, train_loss: 0.6569, test_loss: 0.8262, test_f1: 0.6446
 epoch: 36, train_loss: 0.6599, test_loss: 0.8393, test_f1: 0.6398
 epoch: 37, train_loss: 0.6465, test_loss: 0.7918, test_f1: 0.6464
 epoch: 38, train_loss: 0.6423, test_loss: 0.7962, test_f1: 0.6347
 epoch: 39, train_loss: 0.6266, test_loss: 0.8172, test_f1: 0.6173
 epoch: 40, train_loss: 0.6310, test_loss: 0.8197, test_f1: 0.6565
 epoch: 41, train_loss: 0.6323, test_loss: 0.7496, test_f1: 0.6440
 epoch: 42, train_loss: 0.6234, test_loss: 0.8790, test_f1: 0.6307
 epoch: 43, train_loss: 0.6083, test_loss: 0.7956, test_f1: 0.6535
 epoch: 44, train_loss: 0.6191, test_loss: 0.8311, test_f1: 0.6449
 epoch: 45, train_loss: 0.6099, test_loss: 0.8284, test_f1: 0.6450
 epoch: 46, train_loss: 0.5987, test_loss: 0.8205, test_f1: 0.6308
 epoch: 47, train_loss: 0.5998, test_loss: 0.8797, test_f1: 0.6401
 epoch: 48, train_loss: 0.5972, test_loss: 0.8081, test_f1: 0.6595
 epoch: 49, train_loss: 0.5933, test_loss: 0.8387, test_f1: 0.6499
 epoch: 50, train_loss: 0.5918, test_loss: 0.8123, test_f1: 0.6532
 epoch: 51, train_loss: 0.5765, test_loss: 0.7987, test_f1: 0.6660
 epoch: 52, train_loss: 0.5617, test_loss: 0.8315, test_f1: 0.6715
 epoch: 53, train_loss: 0.5720, test_loss: 0.7606, test_f1: 0.6529
 epoch: 54, train_loss: 0.5639, test_loss: 0.7920, test_f1: 0.6498
 epoch: 55, train_loss: 0.5564, test_loss: 0.7996, test_f1: 0.6514
 epoch: 56, train_loss: 0.5495, test_loss: 0.7705, test_f1: 0.6600
 epoch: 57, train_loss: 0.5663, test_loss: 0.7943, test_f1: 0.6626
 epoch: 58, train_loss: 0.5535, test_loss: 0.7726, test_f1: 0.6709
 epoch: 59, train_loss: 0.5528, test_loss: 0.7961, test_f1: 0.6449
 epoch: 60, train_loss: 0.5471, test_loss: 0.8420, test_f1: 0.6654
 epoch: 61, train_loss: 0.5420, test_loss: 0.7851, test_f1: 0.6869
 epoch: 62, train_loss: 0.5288, test_loss: 0.7954, test_f1: 0.6635
 epoch: 63, train_loss: 0.5485, test_loss: 0.7971, test_f1: 0.6576
 epoch: 64, train_loss: 0.5353, test_loss: 0.8552, test_f1: 0.6511
 epoch: 65, train_loss: 0.5392, test_loss: 0.8121, test_f1: 0.6471
 epoch: 66, train_loss: 0.5263, test_loss: 0.7631, test_f1: 0.6528
 epoch: 67, train_loss: 0.5416, test_loss: 0.8044, test_f1: 0.6690
 epoch: 68, train_loss: 0.5217, test_loss: 0.8187, test_f1: 0.6523
 epoch: 69, train_loss: 0.5211, test_loss: 0.7657, test_f1: 0.6659
 epoch: 70, train_loss: 0.5221, test_loss: 0.7590, test_f1: 0.6809
 epoch: 71, train_loss: 0.5302, test_loss: 0.7822, test_f1: 0.6515
 epoch: 72, train_loss: 0.5154, test_loss: 0.7770, test_f1: 0.6597
 epoch: 73, train_loss: 0.5155, test_loss: 0.7970, test_f1: 0.6665
 epoch: 74, train_loss: 0.5143, test_loss: 0.7646, test_f1: 0.6778
 epoch: 75, train_loss: 0.5159, test_loss: 0.8095, test_f1: 0.6785
 epoch: 76, train_loss: 0.5180, test_loss: 0.7552, test_f1: 0.6580
 epoch: 77, train_loss: 0.5019, test_loss: 0.7954, test_f1: 0.6595
 epoch: 78, train_loss: 0.5052, test_loss: 0.7852, test_f1: 0.6676
 epoch: 79, train_loss: 0.5214, test_loss: 0.8330, test_f1: 0.6682
 epoch: 80, train_loss: 0.4933, test_loss: 0.8937, test_f1: 0.6871
 epoch: 81, train_loss: 0.4986, test_loss: 0.9446, test_f1: 0.6374
 epoch: 82, train_loss: 0.4826, test_loss: 0.8080, test_f1: 0.6544
 epoch: 83, train_loss: 0.4879, test_loss: 0.8706, test_f1: 0.6690
 epoch: 84, train_loss: 0.4914, test_loss: 0.8464, test_f1: 0.6727
 epoch: 85, train_loss: 0.4957, test_loss: 0.7933, test_f1: 0.6848
 epoch: 86, train_loss: 0.4835, test_loss: 0.8948, test_f1: 0.6643
 epoch: 87, train_loss: 0.4825, test_loss: 0.8461, test_f1: 0.6672
 epoch: 88, train_loss: 0.4913, test_loss: 0.8683, test_f1: 0.6867
 epoch: 89, train_loss: 0.4776, test_loss: 0.8339, test_f1: 0.6849
 epoch: 90, train_loss: 0.4812, test_loss: 0.8614, test_f1: 0.6832
 epoch: 91, train_loss: 0.4802, test_loss: 0.8207, test_f1: 0.6580
 epoch: 92, train_loss: 0.4754, test_loss: 0.8500, test_f1: 0.6564
 epoch: 93, train_loss: 0.4898, test_loss: 0.9463, test_f1: 0.6630
 epoch: 94, train_loss: 0.4746, test_loss: 0.9196, test_f1: 0.6776
 epoch: 95, train_loss: 0.4646, test_loss: 0.9274, test_f1: 0.6459
 epoch: 96, train_loss: 0.4627, test_loss: 0.8604, test_f1: 0.6855
 epoch: 97, train_loss: 0.4623, test_loss: 0.9103, test_f1: 0.6647
 epoch: 98, train_loss: 0.4645, test_loss: 0.8031, test_f1: 0.6844
 epoch: 99, train_loss: 0.4759, test_loss: 0.8355, test_f1: 0.6797
##################ITERATION #7 ****************************************
 epoch: 0, train_loss: 1.1575, test_loss: 0.9719, test_f1: 0.4958
 epoch: 1, train_loss: 1.0391, test_loss: 0.9511, test_f1: 0.4961
 epoch: 2, train_loss: 0.9828, test_loss: 0.9617, test_f1: 0.5083
 epoch: 3, train_loss: 0.9566, test_loss: 0.9593, test_f1: 0.5334
 epoch: 4, train_loss: 0.9280, test_loss: 0.9406, test_f1: 0.5172
 epoch: 5, train_loss: 0.9078, test_loss: 0.9458, test_f1: 0.5669
 epoch: 6, train_loss: 0.8991, test_loss: 0.9451, test_f1: 0.5439
 epoch: 7, train_loss: 0.8712, test_loss: 0.9128, test_f1: 0.5739
 epoch: 8, train_loss: 0.8675, test_loss: 0.9259, test_f1: 0.5650
 epoch: 9, train_loss: 0.8478, test_loss: 0.9097, test_f1: 0.5724
 epoch: 10, train_loss: 0.8351, test_loss: 0.9152, test_f1: 0.6047
 epoch: 11, train_loss: 0.8140, test_loss: 0.9169, test_f1: 0.5628
 epoch: 12, train_loss: 0.8161, test_loss: 0.8887, test_f1: 0.5953
 epoch: 13, train_loss: 0.8051, test_loss: 0.8681, test_f1: 0.5920
 epoch: 14, train_loss: 0.7963, test_loss: 0.8944, test_f1: 0.6025
 epoch: 15, train_loss: 0.7942, test_loss: 0.9058, test_f1: 0.5986
 epoch: 16, train_loss: 0.7732, test_loss: 0.9113, test_f1: 0.5948
 epoch: 17, train_loss: 0.7562, test_loss: 0.8910, test_f1: 0.5926
 epoch: 18, train_loss: 0.7551, test_loss: 0.8699, test_f1: 0.6100
 epoch: 19, train_loss: 0.7456, test_loss: 0.8801, test_f1: 0.6002
 epoch: 20, train_loss: 0.7406, test_loss: 0.8736, test_f1: 0.6141
 epoch: 21, train_loss: 0.7285, test_loss: 0.8743, test_f1: 0.6048
 epoch: 22, train_loss: 0.7171, test_loss: 0.8916, test_f1: 0.6229
 epoch: 23, train_loss: 0.7218, test_loss: 0.8784, test_f1: 0.6290
 epoch: 24, train_loss: 0.7054, test_loss: 0.9187, test_f1: 0.6297
 epoch: 25, train_loss: 0.6978, test_loss: 0.8444, test_f1: 0.6541
 epoch: 26, train_loss: 0.7003, test_loss: 0.8784, test_f1: 0.5814
 epoch: 27, train_loss: 0.6814, test_loss: 0.8356, test_f1: 0.6211
 epoch: 28, train_loss: 0.6688, test_loss: 0.8648, test_f1: 0.6268
 epoch: 29, train_loss: 0.6694, test_loss: 0.8581, test_f1: 0.5986
 epoch: 30, train_loss: 0.6713, test_loss: 0.8927, test_f1: 0.6561
 epoch: 31, train_loss: 0.6599, test_loss: 0.8231, test_f1: 0.6654
 epoch: 32, train_loss: 0.6580, test_loss: 0.8759, test_f1: 0.6502
 epoch: 33, train_loss: 0.6370, test_loss: 0.8631, test_f1: 0.6577
 epoch: 34, train_loss: 0.6451, test_loss: 0.8512, test_f1: 0.6394
 epoch: 35, train_loss: 0.6181, test_loss: 0.8796, test_f1: 0.6759
 epoch: 36, train_loss: 0.6231, test_loss: 0.8582, test_f1: 0.6727
 epoch: 37, train_loss: 0.6217, test_loss: 0.8897, test_f1: 0.6403
 epoch: 38, train_loss: 0.6268, test_loss: 0.8885, test_f1: 0.6471
 epoch: 39, train_loss: 0.6108, test_loss: 0.8462, test_f1: 0.6674
 epoch: 40, train_loss: 0.6178, test_loss: 0.8868, test_f1: 0.6522
 epoch: 41, train_loss: 0.6071, test_loss: 0.8594, test_f1: 0.6699
 epoch: 42, train_loss: 0.6027, test_loss: 0.9070, test_f1: 0.6435
 epoch: 43, train_loss: 0.6057, test_loss: 0.8867, test_f1: 0.6452
 epoch: 44, train_loss: 0.5965, test_loss: 0.8692, test_f1: 0.6651
 epoch: 45, train_loss: 0.5958, test_loss: 0.8771, test_f1: 0.6591
 epoch: 46, train_loss: 0.5792, test_loss: 0.8450, test_f1: 0.6689
 epoch: 47, train_loss: 0.5779, test_loss: 0.9152, test_f1: 0.6568
 epoch: 48, train_loss: 0.5699, test_loss: 0.8458, test_f1: 0.6650
 epoch: 49, train_loss: 0.5817, test_loss: 0.9087, test_f1: 0.6460
 epoch: 50, train_loss: 0.5568, test_loss: 0.8634, test_f1: 0.6405
 epoch: 51, train_loss: 0.5533, test_loss: 0.8791, test_f1: 0.6595
 epoch: 52, train_loss: 0.5467, test_loss: 0.8726, test_f1: 0.6458
 epoch: 53, train_loss: 0.5404, test_loss: 0.9184, test_f1: 0.6672
 epoch: 54, train_loss: 0.5444, test_loss: 0.8982, test_f1: 0.6622
 epoch: 55, train_loss: 0.5212, test_loss: 0.8816, test_f1: 0.6635
 epoch: 56, train_loss: 0.5256, test_loss: 0.9005, test_f1: 0.6621
 epoch: 57, train_loss: 0.5401, test_loss: 0.9033, test_f1: 0.6549
 epoch: 58, train_loss: 0.5348, test_loss: 0.9255, test_f1: 0.6554
 epoch: 59, train_loss: 0.5330, test_loss: 0.8607, test_f1: 0.6807
 epoch: 60, train_loss: 0.5282, test_loss: 0.8978, test_f1: 0.6536
 epoch: 61, train_loss: 0.5221, test_loss: 0.8958, test_f1: 0.6523
 epoch: 62, train_loss: 0.5129, test_loss: 0.9241, test_f1: 0.6356
 epoch: 63, train_loss: 0.5224, test_loss: 0.9011, test_f1: 0.6652
 epoch: 64, train_loss: 0.5122, test_loss: 0.9103, test_f1: 0.6532
 epoch: 65, train_loss: 0.5013, test_loss: 0.9198, test_f1: 0.6651
 epoch: 66, train_loss: 0.5046, test_loss: 0.9517, test_f1: 0.6746
 epoch: 67, train_loss: 0.5075, test_loss: 0.9381, test_f1: 0.6630
 epoch: 68, train_loss: 0.5062, test_loss: 0.9293, test_f1: 0.6464
 epoch: 69, train_loss: 0.4979, test_loss: 0.9244, test_f1: 0.6665
 epoch: 70, train_loss: 0.5035, test_loss: 0.9327, test_f1: 0.6690
 epoch: 71, train_loss: 0.4976, test_loss: 0.9483, test_f1: 0.6654
 epoch: 72, train_loss: 0.4881, test_loss: 0.9701, test_f1: 0.6424
 epoch: 73, train_loss: 0.4830, test_loss: 0.9089, test_f1: 0.6624
 epoch: 74, train_loss: 0.4982, test_loss: 0.9183, test_f1: 0.6614
 epoch: 75, train_loss: 0.4907, test_loss: 0.9612, test_f1: 0.6528
 epoch: 76, train_loss: 0.5023, test_loss: 0.9219, test_f1: 0.6534
 epoch: 77, train_loss: 0.4740, test_loss: 0.9347, test_f1: 0.6713
 epoch: 78, train_loss: 0.4775, test_loss: 0.9753, test_f1: 0.6608
 epoch: 79, train_loss: 0.4859, test_loss: 0.9186, test_f1: 0.6712
 epoch: 80, train_loss: 0.4756, test_loss: 0.9532, test_f1: 0.6656
 epoch: 81, train_loss: 0.4928, test_loss: 0.9255, test_f1: 0.6618
 epoch: 82, train_loss: 0.4708, test_loss: 0.9388, test_f1: 0.6635
 epoch: 83, train_loss: 0.4761, test_loss: 0.9602, test_f1: 0.6574
 epoch: 84, train_loss: 0.4639, test_loss: 0.9038, test_f1: 0.6518
 epoch: 85, train_loss: 0.4722, test_loss: 0.9031, test_f1: 0.6672
 epoch: 86, train_loss: 0.4608, test_loss: 0.9833, test_f1: 0.6597
 epoch: 87, train_loss: 0.4513, test_loss: 0.9172, test_f1: 0.6505
 epoch: 88, train_loss: 0.4638, test_loss: 1.0051, test_f1: 0.6470
 epoch: 89, train_loss: 0.4559, test_loss: 0.9575, test_f1: 0.6734
 epoch: 90, train_loss: 0.4732, test_loss: 0.9903, test_f1: 0.6228
 epoch: 91, train_loss: 0.4538, test_loss: 0.9859, test_f1: 0.6559
 epoch: 92, train_loss: 0.4574, test_loss: 0.9503, test_f1: 0.6600
 epoch: 93, train_loss: 0.4560, test_loss: 0.9097, test_f1: 0.6568
 epoch: 94, train_loss: 0.4502, test_loss: 0.9405, test_f1: 0.6388
 epoch: 95, train_loss: 0.4506, test_loss: 0.9559, test_f1: 0.6525
 epoch: 96, train_loss: 0.4451, test_loss: 0.9491, test_f1: 0.6628
 epoch: 97, train_loss: 0.4525, test_loss: 1.0861, test_f1: 0.6338
 epoch: 98, train_loss: 0.4417, test_loss: 0.9335, test_f1: 0.6447
 epoch: 99, train_loss: 0.4397, test_loss: 0.9902, test_f1: 0.6400
##################ITERATION #8 ****************************************
 epoch: 0, train_loss: 1.2010, test_loss: 1.0186, test_f1: 0.4548
 epoch: 1, train_loss: 1.0594, test_loss: 0.9840, test_f1: 0.4513
 epoch: 2, train_loss: 1.0060, test_loss: 0.9520, test_f1: 0.4913
 epoch: 3, train_loss: 0.9868, test_loss: 0.8934, test_f1: 0.5188
 epoch: 4, train_loss: 0.9478, test_loss: 0.9161, test_f1: 0.4791
 epoch: 5, train_loss: 0.9385, test_loss: 0.8899, test_f1: 0.5452
 epoch: 6, train_loss: 0.9186, test_loss: 0.8768, test_f1: 0.5565
 epoch: 7, train_loss: 0.8889, test_loss: 0.8616, test_f1: 0.5578
 epoch: 8, train_loss: 0.8930, test_loss: 0.8768, test_f1: 0.5377
 epoch: 9, train_loss: 0.8705, test_loss: 0.8715, test_f1: 0.5625
 epoch: 10, train_loss: 0.8578, test_loss: 0.8837, test_f1: 0.5535
 epoch: 11, train_loss: 0.8475, test_loss: 0.8868, test_f1: 0.5376
 epoch: 12, train_loss: 0.8469, test_loss: 0.8912, test_f1: 0.5254
 epoch: 13, train_loss: 0.8223, test_loss: 0.8421, test_f1: 0.5941
 epoch: 14, train_loss: 0.8084, test_loss: 0.8394, test_f1: 0.5996
 epoch: 15, train_loss: 0.8030, test_loss: 0.8827, test_f1: 0.5731
 epoch: 16, train_loss: 0.7984, test_loss: 0.8891, test_f1: 0.5551
 epoch: 17, train_loss: 0.7923, test_loss: 0.8532, test_f1: 0.5733
 epoch: 18, train_loss: 0.7760, test_loss: 0.8581, test_f1: 0.5874
 epoch: 19, train_loss: 0.7697, test_loss: 0.8846, test_f1: 0.5818
 epoch: 20, train_loss: 0.7755, test_loss: 0.8549, test_f1: 0.5983
 epoch: 21, train_loss: 0.7600, test_loss: 0.9003, test_f1: 0.5915
 epoch: 22, train_loss: 0.7532, test_loss: 0.8269, test_f1: 0.6114
 epoch: 23, train_loss: 0.7452, test_loss: 0.8675, test_f1: 0.6017
 epoch: 24, train_loss: 0.7547, test_loss: 0.8805, test_f1: 0.5816
 epoch: 25, train_loss: 0.7335, test_loss: 0.8744, test_f1: 0.5994
 epoch: 26, train_loss: 0.7276, test_loss: 0.8290, test_f1: 0.6335
 epoch: 27, train_loss: 0.7203, test_loss: 0.8580, test_f1: 0.6094
 epoch: 28, train_loss: 0.7192, test_loss: 0.8545, test_f1: 0.6000
 epoch: 29, train_loss: 0.7019, test_loss: 0.8878, test_f1: 0.5921
 epoch: 30, train_loss: 0.7051, test_loss: 0.8064, test_f1: 0.6254
 epoch: 31, train_loss: 0.6936, test_loss: 0.8623, test_f1: 0.6074
 epoch: 32, train_loss: 0.6938, test_loss: 0.8439, test_f1: 0.6107
 epoch: 33, train_loss: 0.6778, test_loss: 0.8536, test_f1: 0.6162
 epoch: 34, train_loss: 0.6882, test_loss: 0.8415, test_f1: 0.6133
 epoch: 35, train_loss: 0.6651, test_loss: 0.8414, test_f1: 0.6070
 epoch: 36, train_loss: 0.6742, test_loss: 0.8285, test_f1: 0.6148
 epoch: 37, train_loss: 0.6742, test_loss: 0.9131, test_f1: 0.6196
 epoch: 38, train_loss: 0.6669, test_loss: 0.8934, test_f1: 0.5914
 epoch: 39, train_loss: 0.6700, test_loss: 0.9195, test_f1: 0.6226
 epoch: 40, train_loss: 0.6461, test_loss: 0.9971, test_f1: 0.6219
 epoch: 41, train_loss: 0.6431, test_loss: 0.8406, test_f1: 0.6218
 epoch: 42, train_loss: 0.6436, test_loss: 0.8425, test_f1: 0.6115
 epoch: 43, train_loss: 0.6253, test_loss: 1.1782, test_f1: 0.5992
 epoch: 44, train_loss: 0.6339, test_loss: 0.8159, test_f1: 0.6306
 epoch: 45, train_loss: 0.6166, test_loss: 0.8400, test_f1: 0.6320
 epoch: 46, train_loss: 0.6177, test_loss: 0.8661, test_f1: 0.6049
 epoch: 47, train_loss: 0.6106, test_loss: 0.9035, test_f1: 0.5970
 epoch: 48, train_loss: 0.6159, test_loss: 0.8300, test_f1: 0.6244
 epoch: 49, train_loss: 0.6196, test_loss: 0.7879, test_f1: 0.6627
 epoch: 50, train_loss: 0.6067, test_loss: 0.9694, test_f1: 0.6191
 epoch: 51, train_loss: 0.5928, test_loss: 0.8029, test_f1: 0.6553
 epoch: 52, train_loss: 0.5764, test_loss: 0.8120, test_f1: 0.6307
 epoch: 53, train_loss: 0.5752, test_loss: 0.8498, test_f1: 0.6209
 epoch: 54, train_loss: 0.5900, test_loss: 0.8209, test_f1: 0.6266
 epoch: 55, train_loss: 0.5757, test_loss: 0.8350, test_f1: 0.6292
 epoch: 56, train_loss: 0.5755, test_loss: 0.8027, test_f1: 0.6470
 epoch: 57, train_loss: 0.5688, test_loss: 0.8756, test_f1: 0.6361
 epoch: 58, train_loss: 0.5721, test_loss: 0.8589, test_f1: 0.6267
 epoch: 59, train_loss: 0.5688, test_loss: 0.8332, test_f1: 0.6362
 epoch: 60, train_loss: 0.5697, test_loss: 0.8432, test_f1: 0.6323
 epoch: 61, train_loss: 0.5627, test_loss: 0.8193, test_f1: 0.6370
 epoch: 62, train_loss: 0.5547, test_loss: 0.8498, test_f1: 0.6388
 epoch: 63, train_loss: 0.5438, test_loss: 0.8339, test_f1: 0.6377
 epoch: 64, train_loss: 0.5564, test_loss: 0.8302, test_f1: 0.6486
 epoch: 65, train_loss: 0.5494, test_loss: 0.8045, test_f1: 0.6378
 epoch: 66, train_loss: 0.5557, test_loss: 0.9059, test_f1: 0.6230
 epoch: 67, train_loss: 0.5310, test_loss: 0.8839, test_f1: 0.6290
 epoch: 68, train_loss: 0.5434, test_loss: 0.8334, test_f1: 0.6365
 epoch: 69, train_loss: 0.5403, test_loss: 0.7929, test_f1: 0.6496
 epoch: 70, train_loss: 0.5340, test_loss: 0.8318, test_f1: 0.6169
 epoch: 71, train_loss: 0.5329, test_loss: 0.8722, test_f1: 0.6351
 epoch: 72, train_loss: 0.5274, test_loss: 0.8589, test_f1: 0.6554
 epoch: 73, train_loss: 0.5294, test_loss: 0.8253, test_f1: 0.6470
 epoch: 74, train_loss: 0.5244, test_loss: 0.8593, test_f1: 0.6483
 epoch: 75, train_loss: 0.5405, test_loss: 0.8544, test_f1: 0.6460
 epoch: 76, train_loss: 0.5310, test_loss: 0.9524, test_f1: 0.6354
 epoch: 77, train_loss: 0.5250, test_loss: 0.8183, test_f1: 0.6495
 epoch: 78, train_loss: 0.5222, test_loss: 0.8651, test_f1: 0.6554
 epoch: 79, train_loss: 0.5193, test_loss: 0.9145, test_f1: 0.6340
 epoch: 80, train_loss: 0.5084, test_loss: 0.8757, test_f1: 0.6530
 epoch: 81, train_loss: 0.5159, test_loss: 0.8672, test_f1: 0.6445
 epoch: 82, train_loss: 0.5090, test_loss: 0.9002, test_f1: 0.6331
 epoch: 83, train_loss: 0.5176, test_loss: 0.8408, test_f1: 0.6362
 epoch: 84, train_loss: 0.5236, test_loss: 0.9130, test_f1: 0.6449
 epoch: 85, train_loss: 0.4952, test_loss: 0.8878, test_f1: 0.6458
 epoch: 86, train_loss: 0.5232, test_loss: 0.8616, test_f1: 0.6490
 epoch: 87, train_loss: 0.5125, test_loss: 0.8488, test_f1: 0.6383
 epoch: 88, train_loss: 0.5049, test_loss: 0.8483, test_f1: 0.6606
 epoch: 89, train_loss: 0.5038, test_loss: 0.8470, test_f1: 0.6506
 epoch: 90, train_loss: 0.4990, test_loss: 0.9082, test_f1: 0.6486
 epoch: 91, train_loss: 0.5030, test_loss: 0.8042, test_f1: 0.6487
 epoch: 92, train_loss: 0.4959, test_loss: 0.8295, test_f1: 0.6521
 epoch: 93, train_loss: 0.4991, test_loss: 0.9742, test_f1: 0.6513
 epoch: 94, train_loss: 0.4872, test_loss: 0.8559, test_f1: 0.6463
 epoch: 95, train_loss: 0.4833, test_loss: 0.8681, test_f1: 0.6397
 epoch: 96, train_loss: 0.4782, test_loss: 0.8759, test_f1: 0.6343
 epoch: 97, train_loss: 0.4997, test_loss: 0.9246, test_f1: 0.6509
 epoch: 98, train_loss: 0.4907, test_loss: 0.8039, test_f1: 0.6675
 epoch: 99, train_loss: 0.4867, test_loss: 0.9047, test_f1: 0.6740
##################ITERATION #9 ****************************************
 epoch: 0, train_loss: 1.2503, test_loss: 1.0062, test_f1: 0.5000
 epoch: 1, train_loss: 1.0761, test_loss: 0.9944, test_f1: 0.4931
 epoch: 2, train_loss: 1.0066, test_loss: 0.9458, test_f1: 0.5145
 epoch: 3, train_loss: 0.9703, test_loss: 0.9317, test_f1: 0.5544
 epoch: 4, train_loss: 0.9576, test_loss: 0.9535, test_f1: 0.5553
 epoch: 5, train_loss: 0.9444, test_loss: 0.9084, test_f1: 0.5590
 epoch: 6, train_loss: 0.9226, test_loss: 0.9020, test_f1: 0.5583
 epoch: 7, train_loss: 0.9045, test_loss: 0.8944, test_f1: 0.5733
 epoch: 8, train_loss: 0.8777, test_loss: 0.9000, test_f1: 0.5610
 epoch: 9, train_loss: 0.8760, test_loss: 0.8657, test_f1: 0.5755
 epoch: 10, train_loss: 0.8574, test_loss: 0.8523, test_f1: 0.5716
 epoch: 11, train_loss: 0.8499, test_loss: 0.8900, test_f1: 0.5461
 epoch: 12, train_loss: 0.8268, test_loss: 0.8476, test_f1: 0.6176
 epoch: 13, train_loss: 0.8194, test_loss: 0.8514, test_f1: 0.6136
 epoch: 14, train_loss: 0.8149, test_loss: 0.8662, test_f1: 0.6098
 epoch: 15, train_loss: 0.7979, test_loss: 0.8364, test_f1: 0.5903
 epoch: 16, train_loss: 0.7960, test_loss: 0.8577, test_f1: 0.6016
 epoch: 17, train_loss: 0.7992, test_loss: 0.8374, test_f1: 0.6065
 epoch: 18, train_loss: 0.7791, test_loss: 0.8286, test_f1: 0.6314
 epoch: 19, train_loss: 0.7653, test_loss: 0.8217, test_f1: 0.5941
 epoch: 20, train_loss: 0.7700, test_loss: 0.8368, test_f1: 0.6482
 epoch: 21, train_loss: 0.7559, test_loss: 0.8054, test_f1: 0.6369
 epoch: 22, train_loss: 0.7421, test_loss: 0.8478, test_f1: 0.6156
 epoch: 23, train_loss: 0.7501, test_loss: 0.8216, test_f1: 0.6446
 epoch: 24, train_loss: 0.7406, test_loss: 0.8201, test_f1: 0.6356
 epoch: 25, train_loss: 0.7350, test_loss: 0.7975, test_f1: 0.6266
 epoch: 26, train_loss: 0.7279, test_loss: 0.8201, test_f1: 0.6448
 epoch: 27, train_loss: 0.7233, test_loss: 0.8089, test_f1: 0.6326
 epoch: 28, train_loss: 0.7127, test_loss: 0.8448, test_f1: 0.6342
 epoch: 29, train_loss: 0.7127, test_loss: 0.8547, test_f1: 0.6259
 epoch: 30, train_loss: 0.7076, test_loss: 0.8124, test_f1: 0.6252
 epoch: 31, train_loss: 0.6952, test_loss: 0.8463, test_f1: 0.6376
 epoch: 32, train_loss: 0.6845, test_loss: 0.8002, test_f1: 0.6346
 epoch: 33, train_loss: 0.6983, test_loss: 0.8110, test_f1: 0.6424
 epoch: 34, train_loss: 0.6826, test_loss: 0.8375, test_f1: 0.6435
 epoch: 35, train_loss: 0.6623, test_loss: 0.8024, test_f1: 0.6555
 epoch: 36, train_loss: 0.6815, test_loss: 0.7801, test_f1: 0.6462
 epoch: 37, train_loss: 0.6719, test_loss: 0.8305, test_f1: 0.6362
 epoch: 38, train_loss: 0.6531, test_loss: 0.8226, test_f1: 0.6304
 epoch: 39, train_loss: 0.6571, test_loss: 0.7838, test_f1: 0.6679
 epoch: 40, train_loss: 0.6488, test_loss: 0.8199, test_f1: 0.6463
 epoch: 41, train_loss: 0.6417, test_loss: 0.7777, test_f1: 0.6467
 epoch: 42, train_loss: 0.6495, test_loss: 0.7754, test_f1: 0.6417
 epoch: 43, train_loss: 0.6440, test_loss: 0.8148, test_f1: 0.6366
 epoch: 44, train_loss: 0.6251, test_loss: 0.7936, test_f1: 0.6480
 epoch: 45, train_loss: 0.6150, test_loss: 0.8151, test_f1: 0.6497
 epoch: 46, train_loss: 0.6225, test_loss: 0.7975, test_f1: 0.6546
 epoch: 47, train_loss: 0.6129, test_loss: 0.7928, test_f1: 0.6545
 epoch: 48, train_loss: 0.6120, test_loss: 0.7904, test_f1: 0.6323
 epoch: 49, train_loss: 0.6052, test_loss: 0.8069, test_f1: 0.6406
 epoch: 50, train_loss: 0.5969, test_loss: 0.8230, test_f1: 0.6398
 epoch: 51, train_loss: 0.5792, test_loss: 0.8383, test_f1: 0.6598
 epoch: 52, train_loss: 0.5859, test_loss: 0.7998, test_f1: 0.6548
 epoch: 53, train_loss: 0.5612, test_loss: 0.8043, test_f1: 0.6406
 epoch: 54, train_loss: 0.5711, test_loss: 0.8324, test_f1: 0.6405
 epoch: 55, train_loss: 0.5784, test_loss: 0.8540, test_f1: 0.6408
 epoch: 56, train_loss: 0.5614, test_loss: 0.8138, test_f1: 0.6374
 epoch: 57, train_loss: 0.5630, test_loss: 0.8235, test_f1: 0.6221
 epoch: 58, train_loss: 0.5761, test_loss: 0.7954, test_f1: 0.6465
 epoch: 59, train_loss: 0.5620, test_loss: 0.8221, test_f1: 0.6303
 epoch: 60, train_loss: 0.5775, test_loss: 0.8058, test_f1: 0.6336
 epoch: 61, train_loss: 0.5578, test_loss: 0.8124, test_f1: 0.6445
 epoch: 62, train_loss: 0.5492, test_loss: 0.8066, test_f1: 0.6448
 epoch: 63, train_loss: 0.5514, test_loss: 0.8085, test_f1: 0.6543
 epoch: 64, train_loss: 0.5594, test_loss: 0.7932, test_f1: 0.6708
 epoch: 65, train_loss: 0.5516, test_loss: 0.8340, test_f1: 0.6466
 epoch: 66, train_loss: 0.5532, test_loss: 0.8162, test_f1: 0.6411
 epoch: 67, train_loss: 0.5505, test_loss: 0.8281, test_f1: 0.6307
 epoch: 68, train_loss: 0.5591, test_loss: 0.8412, test_f1: 0.6550
 epoch: 69, train_loss: 0.5443, test_loss: 0.8014, test_f1: 0.6382
 epoch: 70, train_loss: 0.5393, test_loss: 0.8250, test_f1: 0.6313
 epoch: 71, train_loss: 0.5425, test_loss: 0.8231, test_f1: 0.6392
 epoch: 72, train_loss: 0.5376, test_loss: 0.8085, test_f1: 0.6448
 epoch: 73, train_loss: 0.5324, test_loss: 0.8247, test_f1: 0.6315
 epoch: 74, train_loss: 0.5351, test_loss: 0.8237, test_f1: 0.6428
 epoch: 75, train_loss: 0.5283, test_loss: 0.8210, test_f1: 0.6417
 epoch: 76, train_loss: 0.5287, test_loss: 0.8534, test_f1: 0.6265
 epoch: 77, train_loss: 0.5266, test_loss: 0.8241, test_f1: 0.6358
 epoch: 78, train_loss: 0.5266, test_loss: 0.8654, test_f1: 0.6364
 epoch: 79, train_loss: 0.5237, test_loss: 0.8499, test_f1: 0.6294
 epoch: 80, train_loss: 0.5203, test_loss: 0.7987, test_f1: 0.6413
 epoch: 81, train_loss: 0.5146, test_loss: 0.7945, test_f1: 0.6267
 epoch: 82, train_loss: 0.5080, test_loss: 0.8094, test_f1: 0.6498
 epoch: 83, train_loss: 0.5112, test_loss: 0.8439, test_f1: 0.6339
 epoch: 84, train_loss: 0.5180, test_loss: 0.8644, test_f1: 0.6507
 epoch: 85, train_loss: 0.5129, test_loss: 0.8522, test_f1: 0.6339
 epoch: 86, train_loss: 0.5109, test_loss: 0.8630, test_f1: 0.6643
 epoch: 87, train_loss: 0.5111, test_loss: 0.8853, test_f1: 0.6372
 epoch: 88, train_loss: 0.5049, test_loss: 0.9352, test_f1: 0.6335
 epoch: 89, train_loss: 0.5131, test_loss: 0.8810, test_f1: 0.6415
 epoch: 90, train_loss: 0.4872, test_loss: 0.8466, test_f1: 0.6399
 epoch: 91, train_loss: 0.4997, test_loss: 0.8536, test_f1: 0.6392
 epoch: 92, train_loss: 0.4943, test_loss: 0.8524, test_f1: 0.6466
 epoch: 93, train_loss: 0.4950, test_loss: 0.8679, test_f1: 0.6388
 epoch: 94, train_loss: 0.4920, test_loss: 0.8706, test_f1: 0.6397
 epoch: 95, train_loss: 0.4975, test_loss: 0.8801, test_f1: 0.6485
 epoch: 96, train_loss: 0.4758, test_loss: 0.8549, test_f1: 0.6524
 epoch: 97, train_loss: 0.4790, test_loss: 0.8862, test_f1: 0.6364
 epoch: 98, train_loss: 0.4822, test_loss: 0.8882, test_f1: 0.6471
 epoch: 99, train_loss: 0.4764, test_loss: 0.8975, test_f1: 0.6536

Training completed in 829.71 seconds
Best F1: 0.6871 at epoch 80
Mean F1 across iterations: 0.6766  0.0099
========================FINAL RESULTS================================
FEGIN weighted F1: 0.6871  0.0099
python main.py --data ltspice_examples --representation component_pin --model FEGIN --layers 2 --hiddens 128 --batch_size 32 --lr 0.0001 --emb_size 250 --epochs 100 --save_appendix component_pin_L2_H128_BS32_LR0.0001_E250 --no_val
-----



STDERR:
  File "main.py", line 370, in <module>
    main()
  File "main.py", line 254, in main
    dataset = dataset_class(
  File "/home/philip/projects/ltspice_examples_code_repo/Circuit-Completion-Using-GNNs/component_classification_with_link_prediction_head/evaluation/FEGIN/kernel/circuit_datasets.py", line 15, in __init__
    self.data, self.slices = torch.load(self.processed_paths[0])
  File "/home/philip/.local/lib/python3.8/site-packages/torch/serialization.py", line 1040, in load
    warnings.warn(
  File "/usr/lib/python3.8/warnings.py", line 109, in _showwarnmsg
    sw(msg.message, msg.category, msg.filename, msg.lineno,
  File "main.py", line 47, in warn_with_traceback
    traceback.print_stack(file=log)
/home/philip/projects/ltspice_examples_code_repo/Circuit-Completion-Using-GNNs/component_classification_with_link_prediction_head/evaluation/FEGIN/kernel/circuit_datasets.py:15: FutureWarning: You are using `torch.load` with `weights_only=False` (the current default value), which uses the default pickle module implicitly. It is possible to construct malicious pickle data which will execute arbitrary code during unpickling (See https://github.com/pytorch/pytorch/blob/main/SECURITY.md#untrusted-models for more details). In a future release, the default value for `weights_only` will be flipped to `True`. This limits the functions that could be executed during unpickling. Arbitrary objects will no longer be allowed to be loaded via this mode unless they are explicitly allowlisted by the user via `torch.serialization.add_safe_globals`. We recommend you start setting `weights_only=True` for any use case where you don't have full control of the loaded file. Please open an issue on GitHub for any issues related to this experimental feature.
  self.data, self.slices = torch.load(self.processed_paths[0])
