STDOUT:
Results will be saved in /home/philip/projects/ltspice_examples_code_repo/Circuit-Completion-Using-GNNs/component_classification_with_link_prediction_head/evaluation/FEGIN/results/model_FEGIN_dataset_ltspice_demos
Command line input: python main.py --data ltspice_demos --representation component_pin_net --model FEGIN --layers 3 --hiddens 16 --batch_size 128 --lr 0.1 --emb_size 128 --epochs 100 --save_appendix component_pin_net_L3_H16_BS128_LR0.1_E128 --no_val
 is saved.
-----
ltspice_demos - FEGIN
Using 3 layers, 16 hidden units, h = 2
Loading component_pin_net representation dataset
ENTERED
Training FEGIN on component_pin_net representation
Train: 1565, Test: 383
##################ITERATION #0 ****************************************
 epoch: 0, train_loss: 1.2604, test_loss: 2.1945, test_f1: 0.1365
 epoch: 1, train_loss: 1.0817, test_loss: 1.5771, test_f1: 0.2637
 epoch: 2, train_loss: 1.0513, test_loss: 1.3351, test_f1: 0.2441
 epoch: 3, train_loss: 1.0510, test_loss: 1.2021, test_f1: 0.3676
 epoch: 4, train_loss: 1.0476, test_loss: 1.1369, test_f1: 0.4253
 epoch: 5, train_loss: 1.0315, test_loss: 1.1286, test_f1: 0.4218
 epoch: 6, train_loss: 1.0524, test_loss: 1.2562, test_f1: 0.2718
 epoch: 7, train_loss: 1.0361, test_loss: 1.1353, test_f1: 0.3317
 epoch: 8, train_loss: 1.0237, test_loss: 1.1558, test_f1: 0.4286
 epoch: 9, train_loss: 1.0234, test_loss: 1.1404, test_f1: 0.4430
 epoch: 10, train_loss: 1.0237, test_loss: 1.1441, test_f1: 0.3344
 epoch: 11, train_loss: 1.0297, test_loss: 1.1343, test_f1: 0.3648
 epoch: 12, train_loss: 1.0318, test_loss: 1.3064, test_f1: 0.2979
 epoch: 13, train_loss: 1.0283, test_loss: 1.1651, test_f1: 0.4017
 epoch: 14, train_loss: 1.0313, test_loss: 1.1152, test_f1: 0.3741
 epoch: 15, train_loss: 1.0745, test_loss: 1.1243, test_f1: 0.3468
 epoch: 16, train_loss: 1.0658, test_loss: 1.2641, test_f1: 0.3317
 epoch: 17, train_loss: 1.0741, test_loss: 1.1370, test_f1: 0.3344
 epoch: 18, train_loss: 1.0377, test_loss: 1.0846, test_f1: 0.3492
 epoch: 19, train_loss: 1.0366, test_loss: 1.0821, test_f1: 0.3484
 epoch: 20, train_loss: 1.0262, test_loss: 1.1073, test_f1: 0.3395
 epoch: 21, train_loss: 1.0188, test_loss: 1.1873, test_f1: 0.3262
 epoch: 22, train_loss: 1.0334, test_loss: 1.1795, test_f1: 0.3176
 epoch: 23, train_loss: 1.0220, test_loss: 1.1089, test_f1: 0.3360
 epoch: 24, train_loss: 1.0322, test_loss: 1.1809, test_f1: 0.3234
 epoch: 25, train_loss: 1.0289, test_loss: 1.3089, test_f1: 0.2631
 epoch: 26, train_loss: 1.0216, test_loss: 1.1880, test_f1: 0.4195
 epoch: 27, train_loss: 1.0246, test_loss: 1.1129, test_f1: 0.3415
 epoch: 28, train_loss: 1.0131, test_loss: 1.1825, test_f1: 0.4106
 epoch: 29, train_loss: 1.0032, test_loss: 1.1231, test_f1: 0.3340
 epoch: 30, train_loss: 1.0041, test_loss: 1.3176, test_f1: 0.3116
 epoch: 31, train_loss: 1.0230, test_loss: 1.1036, test_f1: 0.3337
 epoch: 32, train_loss: 1.0082, test_loss: 1.2753, test_f1: 0.2759
 epoch: 33, train_loss: 1.0125, test_loss: 1.1973, test_f1: 0.3571
 epoch: 34, train_loss: 1.0082, test_loss: 1.1456, test_f1: 0.3626
 epoch: 35, train_loss: 1.0111, test_loss: 1.1685, test_f1: 0.2468
 epoch: 36, train_loss: 1.0153, test_loss: 1.1943, test_f1: 0.4401
 epoch: 37, train_loss: 1.0389, test_loss: 1.1781, test_f1: 0.3543
 epoch: 38, train_loss: 1.0413, test_loss: 1.0897, test_f1: 0.3723
 epoch: 39, train_loss: 1.0587, test_loss: 1.1833, test_f1: 0.3545
 epoch: 40, train_loss: 1.0209, test_loss: 1.1352, test_f1: 0.4485
 epoch: 41, train_loss: 1.0151, test_loss: 1.1170, test_f1: 0.3913
 epoch: 42, train_loss: 1.0142, test_loss: 1.1504, test_f1: 0.3686
 epoch: 43, train_loss: 1.0047, test_loss: 1.1383, test_f1: 0.3364
 epoch: 44, train_loss: 1.0253, test_loss: 1.1623, test_f1: 0.4288
 epoch: 45, train_loss: 1.0316, test_loss: 1.4082, test_f1: 0.1467
 epoch: 46, train_loss: 1.0617, test_loss: 1.1885, test_f1: 0.3619
 epoch: 47, train_loss: 1.0184, test_loss: 1.1181, test_f1: 0.4613
 epoch: 48, train_loss: 1.0233, test_loss: 1.1435, test_f1: 0.3789
 epoch: 49, train_loss: 1.0240, test_loss: 1.1609, test_f1: 0.3290
 epoch: 50, train_loss: 1.0054, test_loss: 1.1116, test_f1: 0.4422
 epoch: 51, train_loss: 1.0010, test_loss: 1.0981, test_f1: 0.3444
 epoch: 52, train_loss: 0.9897, test_loss: 1.2002, test_f1: 0.3484
 epoch: 53, train_loss: 1.0003, test_loss: 1.5355, test_f1: 0.3282
 epoch: 54, train_loss: 1.0342, test_loss: 1.1107, test_f1: 0.3332
 epoch: 55, train_loss: 1.0169, test_loss: 1.1152, test_f1: 0.3262
 epoch: 56, train_loss: 1.0036, test_loss: 1.0891, test_f1: 0.3379
 epoch: 57, train_loss: 0.9921, test_loss: 1.3326, test_f1: 0.3279
 epoch: 58, train_loss: 0.9931, test_loss: 2.8017, test_f1: 0.2748
 epoch: 59, train_loss: 0.9921, test_loss: 2.1861, test_f1: 0.3107
 epoch: 60, train_loss: 0.9907, test_loss: 1.0781, test_f1: 0.3549
 epoch: 61, train_loss: 1.0208, test_loss: 1.2557, test_f1: 0.3088
 epoch: 62, train_loss: 1.0146, test_loss: 1.1010, test_f1: 0.3401
 epoch: 63, train_loss: 0.9989, test_loss: 1.1659, test_f1: 0.3917
 epoch: 64, train_loss: 1.0041, test_loss: 1.1043, test_f1: 0.3472
 epoch: 65, train_loss: 0.9926, test_loss: 1.1327, test_f1: 0.3295
 epoch: 66, train_loss: 0.9921, test_loss: 1.1076, test_f1: 0.3432
 epoch: 67, train_loss: 1.0030, test_loss: 1.0915, test_f1: 0.3492
 epoch: 68, train_loss: 1.0189, test_loss: 1.1015, test_f1: 0.3400
 epoch: 69, train_loss: 1.0146, test_loss: 1.1351, test_f1: 0.4657
 epoch: 70, train_loss: 1.0278, test_loss: 1.1237, test_f1: 0.3344
 epoch: 71, train_loss: 1.0066, test_loss: 1.0745, test_f1: 0.3553
 epoch: 72, train_loss: 0.9946, test_loss: 1.1209, test_f1: 0.3353
 epoch: 73, train_loss: 0.9831, test_loss: 1.0715, test_f1: 0.3485
 epoch: 74, train_loss: 0.9934, test_loss: 1.1455, test_f1: 0.3506
 epoch: 75, train_loss: 1.0015, test_loss: 1.3717, test_f1: 0.2759
 epoch: 76, train_loss: 1.0303, test_loss: 1.2403, test_f1: 0.3088
 epoch: 77, train_loss: 1.0073, test_loss: 1.1698, test_f1: 0.3290
 epoch: 78, train_loss: 1.0011, test_loss: 1.1594, test_f1: 0.3344
 epoch: 79, train_loss: 1.0143, test_loss: 1.1595, test_f1: 0.3344
 epoch: 80, train_loss: 1.0141, test_loss: 1.1537, test_f1: 0.3344
 epoch: 81, train_loss: 1.0018, test_loss: 1.1095, test_f1: 0.3420
 epoch: 82, train_loss: 1.0011, test_loss: 1.1609, test_f1: 0.3344
 epoch: 83, train_loss: 1.0036, test_loss: 1.0707, test_f1: 0.3549
 epoch: 84, train_loss: 1.0029, test_loss: 1.0836, test_f1: 0.3492
 epoch: 85, train_loss: 1.0069, test_loss: 1.0881, test_f1: 0.3518
 epoch: 86, train_loss: 1.0021, test_loss: 1.0760, test_f1: 0.3579
 epoch: 87, train_loss: 0.9858, test_loss: 1.0729, test_f1: 0.3471
 epoch: 88, train_loss: 0.9925, test_loss: 1.1280, test_f1: 0.3344
 epoch: 89, train_loss: 0.9870, test_loss: 1.0914, test_f1: 0.3724
 epoch: 90, train_loss: 0.9910, test_loss: 1.1086, test_f1: 0.3358
 epoch: 91, train_loss: 0.9831, test_loss: 1.0860, test_f1: 0.3468
 epoch: 92, train_loss: 0.9772, test_loss: 1.1267, test_f1: 0.4325
 epoch: 93, train_loss: 0.9867, test_loss: 1.1065, test_f1: 0.3768
 epoch: 94, train_loss: 0.9744, test_loss: 1.0568, test_f1: 0.4056
 epoch: 95, train_loss: 0.9825, test_loss: 1.1604, test_f1: 0.3558
 epoch: 96, train_loss: 0.9692, test_loss: 1.3325, test_f1: 0.3507
 epoch: 97, train_loss: 1.0163, test_loss: 1.1604, test_f1: 0.4663
 epoch: 98, train_loss: 0.9903, test_loss: 1.1084, test_f1: 0.3400
 epoch: 99, train_loss: 0.9805, test_loss: 1.0667, test_f1: 0.3620
##################ITERATION #1 ****************************************
 epoch: 0, train_loss: 1.2190, test_loss: 1.4596, test_f1: 0.2281
 epoch: 1, train_loss: 1.0801, test_loss: 1.2635, test_f1: 0.2890
 epoch: 2, train_loss: 1.0577, test_loss: 1.1430, test_f1: 0.3290
 epoch: 3, train_loss: 1.0479, test_loss: 1.1938, test_f1: 0.3176
 epoch: 4, train_loss: 1.0565, test_loss: 1.1354, test_f1: 0.3395
 epoch: 5, train_loss: 1.0419, test_loss: 1.1408, test_f1: 0.3370
 epoch: 6, train_loss: 1.0494, test_loss: 1.1327, test_f1: 0.3395
 epoch: 7, train_loss: 1.0322, test_loss: 1.1280, test_f1: 0.3395
 epoch: 8, train_loss: 1.0329, test_loss: 1.1376, test_f1: 0.3317
 epoch: 9, train_loss: 1.0409, test_loss: 1.1419, test_f1: 0.3317
 epoch: 10, train_loss: 1.0449, test_loss: 1.1332, test_f1: 0.3344
 epoch: 11, train_loss: 1.0269, test_loss: 1.1167, test_f1: 0.3395
 epoch: 12, train_loss: 1.0394, test_loss: 1.1188, test_f1: 0.3388
 epoch: 13, train_loss: 1.0193, test_loss: 1.3073, test_f1: 0.2718
 epoch: 14, train_loss: 1.0226, test_loss: 1.1510, test_f1: 0.3317
 epoch: 15, train_loss: 1.0151, test_loss: 1.2408, test_f1: 0.3022
 epoch: 16, train_loss: 1.0283, test_loss: 1.1821, test_f1: 0.3290
 epoch: 17, train_loss: 1.0250, test_loss: 1.1539, test_f1: 0.3317
 epoch: 18, train_loss: 1.0276, test_loss: 1.1832, test_f1: 0.3290
 epoch: 19, train_loss: 1.0244, test_loss: 1.2902, test_f1: 0.2631
 epoch: 20, train_loss: 1.0086, test_loss: 1.2423, test_f1: 0.3083
 epoch: 21, train_loss: 1.0050, test_loss: 1.2306, test_f1: 0.3330
 epoch: 22, train_loss: 1.0044, test_loss: 1.1501, test_f1: 0.3871
 epoch: 23, train_loss: 1.0048, test_loss: 1.1840, test_f1: 0.3327
 epoch: 24, train_loss: 1.0009, test_loss: 1.1619, test_f1: 0.3470
 epoch: 25, train_loss: 1.0234, test_loss: 1.1695, test_f1: 0.3336
 epoch: 26, train_loss: 1.0177, test_loss: 1.1387, test_f1: 0.3387
 epoch: 27, train_loss: 1.0811, test_loss: 1.1293, test_f1: 0.3395
 epoch: 28, train_loss: 1.0525, test_loss: 1.1713, test_f1: 0.3290
 epoch: 29, train_loss: 1.0436, test_loss: 1.1537, test_f1: 0.3310
 epoch: 30, train_loss: 1.0259, test_loss: 1.1558, test_f1: 0.3621
 epoch: 31, train_loss: 1.0135, test_loss: 1.1557, test_f1: 0.3636
 epoch: 32, train_loss: 1.0092, test_loss: 1.1421, test_f1: 0.3767
 epoch: 33, train_loss: 1.0177, test_loss: 1.1712, test_f1: 0.3327
 epoch: 34, train_loss: 1.1531, test_loss: 1.1289, test_f1: 0.3290
 epoch: 35, train_loss: 1.0264, test_loss: 1.1622, test_f1: 0.3317
 epoch: 36, train_loss: 1.0215, test_loss: 1.1846, test_f1: 0.3244
 epoch: 37, train_loss: 1.0207, test_loss: 1.3631, test_f1: 0.2631
 epoch: 38, train_loss: 1.0240, test_loss: 1.1189, test_f1: 0.3451
 epoch: 39, train_loss: 1.0500, test_loss: 1.1956, test_f1: 0.3290
 epoch: 40, train_loss: 1.0375, test_loss: 1.3398, test_f1: 0.2658
 epoch: 41, train_loss: 1.0359, test_loss: 1.1239, test_f1: 0.3465
 epoch: 42, train_loss: 1.0103, test_loss: 1.1216, test_f1: 0.3506
 epoch: 43, train_loss: 1.0103, test_loss: 1.1371, test_f1: 0.3559
 epoch: 44, train_loss: 1.0071, test_loss: 1.1128, test_f1: 0.3659
 epoch: 45, train_loss: 1.0164, test_loss: 1.1613, test_f1: 0.3295
 epoch: 46, train_loss: 1.0316, test_loss: 1.1436, test_f1: 0.3395
 epoch: 47, train_loss: 1.0466, test_loss: 1.1622, test_f1: 0.3317
 epoch: 48, train_loss: 1.0542, test_loss: 1.1787, test_f1: 0.3262
 epoch: 49, train_loss: 1.0663, test_loss: 1.1569, test_f1: 0.3290
 epoch: 50, train_loss: 1.0550, test_loss: 1.1455, test_f1: 0.3317
 epoch: 51, train_loss: 1.0519, test_loss: 1.1448, test_f1: 0.3317
 epoch: 52, train_loss: 1.0457, test_loss: 1.1448, test_f1: 0.3317
 epoch: 53, train_loss: 1.0442, test_loss: 1.1410, test_f1: 0.3344
 epoch: 54, train_loss: 1.0282, test_loss: 1.1559, test_f1: 0.3295
 epoch: 55, train_loss: 1.0613, test_loss: 1.1597, test_f1: 0.3290
 epoch: 56, train_loss: 1.0219, test_loss: 1.1291, test_f1: 0.3406
 epoch: 57, train_loss: 1.0161, test_loss: 1.1271, test_f1: 0.3516
 epoch: 58, train_loss: 1.0075, test_loss: 1.1402, test_f1: 0.3599
 epoch: 59, train_loss: 1.0119, test_loss: 1.1297, test_f1: 0.3523
 epoch: 60, train_loss: 1.0112, test_loss: 1.1250, test_f1: 0.3672
 epoch: 61, train_loss: 1.0099, test_loss: 1.1278, test_f1: 0.3606
 epoch: 62, train_loss: 1.0074, test_loss: 1.1299, test_f1: 0.3559
 epoch: 63, train_loss: 1.0065, test_loss: 1.1469, test_f1: 0.3377
 epoch: 64, train_loss: 1.0009, test_loss: 1.1378, test_f1: 0.3621
 epoch: 65, train_loss: 0.9983, test_loss: 1.1200, test_f1: 0.3408
 epoch: 66, train_loss: 0.9938, test_loss: 1.1681, test_f1: 0.3588
 epoch: 67, train_loss: 1.0146, test_loss: 1.1068, test_f1: 0.3395
 epoch: 68, train_loss: 1.0154, test_loss: 1.1432, test_f1: 0.3400
 epoch: 69, train_loss: 0.9892, test_loss: 1.1279, test_f1: 0.3665
 epoch: 70, train_loss: 0.9917, test_loss: 1.1430, test_f1: 0.3515
 epoch: 71, train_loss: 1.0037, test_loss: 1.1541, test_f1: 0.3489
 epoch: 72, train_loss: 0.9928, test_loss: 1.1398, test_f1: 0.3683
 epoch: 73, train_loss: 0.9924, test_loss: 1.1275, test_f1: 0.3818
 epoch: 74, train_loss: 1.0036, test_loss: 1.1391, test_f1: 0.3610
 epoch: 75, train_loss: 1.0090, test_loss: 1.1552, test_f1: 0.3431
 epoch: 76, train_loss: 1.0076, test_loss: 1.1412, test_f1: 0.3492
 epoch: 77, train_loss: 0.9946, test_loss: 1.1340, test_f1: 0.3562
 epoch: 78, train_loss: 1.0012, test_loss: 1.1330, test_f1: 0.3663
 epoch: 79, train_loss: 1.0060, test_loss: 1.1293, test_f1: 0.3859
 epoch: 80, train_loss: 0.9928, test_loss: 1.1267, test_f1: 0.3880
 epoch: 81, train_loss: 0.9934, test_loss: 1.1213, test_f1: 0.3468
 epoch: 82, train_loss: 0.9912, test_loss: 1.1343, test_f1: 0.3714
 epoch: 83, train_loss: 0.9881, test_loss: 1.1369, test_f1: 0.3681
 epoch: 84, train_loss: 0.9907, test_loss: 1.1380, test_f1: 0.3684
 epoch: 85, train_loss: 0.9820, test_loss: 1.2422, test_f1: 0.3710
 epoch: 86, train_loss: 1.0183, test_loss: 1.1834, test_f1: 0.3323
 epoch: 87, train_loss: 1.0250, test_loss: 1.2034, test_f1: 0.3454
 epoch: 88, train_loss: 1.0045, test_loss: 1.1534, test_f1: 0.3746
 epoch: 89, train_loss: 1.0118, test_loss: 1.1463, test_f1: 0.3789
 epoch: 90, train_loss: 1.0054, test_loss: 1.1538, test_f1: 0.3832
 epoch: 91, train_loss: 0.9919, test_loss: 1.1320, test_f1: 0.3657
 epoch: 92, train_loss: 0.9988, test_loss: 1.1384, test_f1: 0.3395
 epoch: 93, train_loss: 0.9933, test_loss: 1.1237, test_f1: 0.3737
 epoch: 94, train_loss: 1.0127, test_loss: 1.1268, test_f1: 0.3841
 epoch: 95, train_loss: 0.9955, test_loss: 1.1980, test_f1: 0.3719
 epoch: 96, train_loss: 0.9917, test_loss: 1.1618, test_f1: 0.3872
 epoch: 97, train_loss: 1.0351, test_loss: 1.1686, test_f1: 0.3696
 epoch: 98, train_loss: 1.0482, test_loss: 1.1236, test_f1: 0.3395
 epoch: 99, train_loss: 1.0214, test_loss: 1.1224, test_f1: 0.3395
##################ITERATION #2 ****************************************
 epoch: 0, train_loss: 1.2153, test_loss: 1.4590, test_f1: 0.1365
 epoch: 1, train_loss: 1.1542, test_loss: 1.3844, test_f1: 0.2336
 epoch: 2, train_loss: 1.1250, test_loss: 1.1906, test_f1: 0.3277
 epoch: 3, train_loss: 1.0787, test_loss: 1.3045, test_f1: 0.2956
 epoch: 4, train_loss: 1.0677, test_loss: 1.2186, test_f1: 0.2788
 epoch: 5, train_loss: 1.0558, test_loss: 1.1842, test_f1: 0.3234
 epoch: 6, train_loss: 1.0666, test_loss: 1.1559, test_f1: 0.3138
 epoch: 7, train_loss: 1.0690, test_loss: 1.1413, test_f1: 0.3370
 epoch: 8, train_loss: 1.0523, test_loss: 1.1839, test_f1: 0.3262
 epoch: 9, train_loss: 1.0495, test_loss: 1.1573, test_f1: 0.3290
 epoch: 10, train_loss: 1.0574, test_loss: 1.1553, test_f1: 0.3317
 epoch: 11, train_loss: 1.0542, test_loss: 1.1251, test_f1: 0.3395
 epoch: 12, train_loss: 1.0556, test_loss: 1.1448, test_f1: 0.3317
 epoch: 13, train_loss: 1.0585, test_loss: 1.2118, test_f1: 0.3115
 epoch: 14, train_loss: 1.0611, test_loss: 1.1245, test_f1: 0.3344
 epoch: 15, train_loss: 1.0443, test_loss: 1.1257, test_f1: 0.3395
 epoch: 16, train_loss: 1.0409, test_loss: 1.1212, test_f1: 0.3395
 epoch: 17, train_loss: 1.0360, test_loss: 1.1250, test_f1: 0.3395
 epoch: 18, train_loss: 1.0504, test_loss: 1.1497, test_f1: 0.3317
 epoch: 19, train_loss: 1.0653, test_loss: 1.1719, test_f1: 0.3262
 epoch: 20, train_loss: 1.0368, test_loss: 1.2008, test_f1: 0.3176
 epoch: 21, train_loss: 1.0262, test_loss: 1.3525, test_f1: 0.2586
 epoch: 22, train_loss: 1.0592, test_loss: 1.4013, test_f1: 0.2281
 epoch: 23, train_loss: 1.0345, test_loss: 1.3489, test_f1: 0.2586
 epoch: 24, train_loss: 1.0499, test_loss: 1.1811, test_f1: 0.3205
 epoch: 25, train_loss: 1.0498, test_loss: 1.3146, test_f1: 0.2876
 epoch: 26, train_loss: 1.0223, test_loss: 1.2706, test_f1: 0.3018
 epoch: 27, train_loss: 1.0208, test_loss: 1.1588, test_f1: 0.3336
 epoch: 28, train_loss: 1.0191, test_loss: 1.1117, test_f1: 0.3395
 epoch: 29, train_loss: 1.0200, test_loss: 1.1666, test_f1: 0.3317
 epoch: 30, train_loss: 1.0220, test_loss: 1.1535, test_f1: 0.3344
 epoch: 31, train_loss: 1.0329, test_loss: 1.1265, test_f1: 0.3380
 epoch: 32, train_loss: 1.0197, test_loss: 1.1410, test_f1: 0.3155
 epoch: 33, train_loss: 1.0139, test_loss: 1.1264, test_f1: 0.3320
 epoch: 34, train_loss: 1.0144, test_loss: 1.1184, test_f1: 0.3444
 epoch: 35, train_loss: 1.0109, test_loss: 1.1542, test_f1: 0.3344
 epoch: 36, train_loss: 1.0197, test_loss: 1.1362, test_f1: 0.3461
 epoch: 37, train_loss: 1.0159, test_loss: 1.1691, test_f1: 0.3317
 epoch: 38, train_loss: 1.0168, test_loss: 1.1162, test_f1: 0.3420
 epoch: 39, train_loss: 1.0197, test_loss: 1.1127, test_f1: 0.3444
 epoch: 40, train_loss: 1.0318, test_loss: 1.3405, test_f1: 0.2616
 epoch: 41, train_loss: 1.0398, test_loss: 1.1607, test_f1: 0.3290
 epoch: 42, train_loss: 1.0227, test_loss: 1.1359, test_f1: 0.3336
 epoch: 43, train_loss: 1.0231, test_loss: 1.1442, test_f1: 0.3330
 epoch: 44, train_loss: 1.0285, test_loss: 1.1158, test_f1: 0.3400
 epoch: 45, train_loss: 1.0305, test_loss: 1.1710, test_f1: 0.3179
 epoch: 46, train_loss: 1.0518, test_loss: 1.1689, test_f1: 0.3290
 epoch: 47, train_loss: 1.0261, test_loss: 1.1544, test_f1: 0.3317
 epoch: 48, train_loss: 1.0198, test_loss: 1.1906, test_f1: 0.3205
 epoch: 49, train_loss: 1.0257, test_loss: 1.1355, test_f1: 0.3307
 epoch: 50, train_loss: 1.0202, test_loss: 1.2095, test_f1: 0.3057
 epoch: 51, train_loss: 1.0283, test_loss: 1.1672, test_f1: 0.3262
 epoch: 52, train_loss: 1.0157, test_loss: 1.1247, test_f1: 0.3344
 epoch: 53, train_loss: 1.0073, test_loss: 1.1282, test_f1: 0.3344
 epoch: 54, train_loss: 1.0116, test_loss: 1.1101, test_f1: 0.3344
 epoch: 55, train_loss: 1.0150, test_loss: 1.1092, test_f1: 0.3395
 epoch: 56, train_loss: 1.0087, test_loss: 1.0995, test_f1: 0.3387
 epoch: 57, train_loss: 1.0101, test_loss: 1.1061, test_f1: 0.3444
 epoch: 58, train_loss: 1.0086, test_loss: 1.1411, test_f1: 0.3344
 epoch: 59, train_loss: 1.0093, test_loss: 1.0990, test_f1: 0.3468
 epoch: 60, train_loss: 1.0091, test_loss: 1.1460, test_f1: 0.3344
 epoch: 61, train_loss: 1.0134, test_loss: 1.1510, test_f1: 0.3344
 epoch: 62, train_loss: 1.0118, test_loss: 1.1556, test_f1: 0.3344
 epoch: 63, train_loss: 1.0119, test_loss: 1.1107, test_f1: 0.3346
 epoch: 64, train_loss: 1.0016, test_loss: 1.0999, test_f1: 0.3414
 epoch: 65, train_loss: 1.0097, test_loss: 1.0971, test_f1: 0.3453
 epoch: 66, train_loss: 1.0062, test_loss: 1.1180, test_f1: 0.3292
 epoch: 67, train_loss: 1.0101, test_loss: 1.1017, test_f1: 0.3507
 epoch: 68, train_loss: 1.0157, test_loss: 1.1039, test_f1: 0.3387
 epoch: 69, train_loss: 1.0038, test_loss: 1.1436, test_f1: 0.3370
 epoch: 70, train_loss: 1.0159, test_loss: 1.1389, test_f1: 0.3346
 epoch: 71, train_loss: 1.0108, test_loss: 1.1237, test_f1: 0.3208
 epoch: 72, train_loss: 1.0061, test_loss: 1.1264, test_f1: 0.3370
 epoch: 73, train_loss: 1.0144, test_loss: 1.1155, test_f1: 0.3372
 epoch: 74, train_loss: 1.0052, test_loss: 1.1297, test_f1: 0.3395
 epoch: 75, train_loss: 1.0112, test_loss: 1.1089, test_f1: 0.3266
 epoch: 76, train_loss: 1.0103, test_loss: 1.1211, test_f1: 0.3421
 epoch: 77, train_loss: 1.0134, test_loss: 1.1175, test_f1: 0.3155
 epoch: 78, train_loss: 1.0061, test_loss: 1.1259, test_f1: 0.3421
 epoch: 79, train_loss: 1.0060, test_loss: 1.1002, test_f1: 0.3461
 epoch: 80, train_loss: 1.0039, test_loss: 1.1074, test_f1: 0.3468
 epoch: 81, train_loss: 1.0131, test_loss: 1.1065, test_f1: 0.3461
 epoch: 82, train_loss: 1.0095, test_loss: 1.1209, test_f1: 0.3381
 epoch: 83, train_loss: 1.0077, test_loss: 1.1084, test_f1: 0.3395
 epoch: 84, train_loss: 1.0041, test_loss: 1.1187, test_f1: 0.3421
 epoch: 85, train_loss: 1.0038, test_loss: 1.1158, test_f1: 0.3421
 epoch: 86, train_loss: 1.0026, test_loss: 1.1166, test_f1: 0.3414
 epoch: 87, train_loss: 0.9977, test_loss: 1.1327, test_f1: 0.3261
 epoch: 88, train_loss: 1.0062, test_loss: 1.1093, test_f1: 0.3414
 epoch: 89, train_loss: 1.0158, test_loss: 1.1276, test_f1: 0.3344
 epoch: 90, train_loss: 1.0126, test_loss: 1.1375, test_f1: 0.3344
 epoch: 91, train_loss: 1.0103, test_loss: 1.1647, test_f1: 0.3344
 epoch: 92, train_loss: 1.0100, test_loss: 1.1132, test_f1: 0.3431
 epoch: 93, train_loss: 1.0081, test_loss: 1.1035, test_f1: 0.3425
 epoch: 94, train_loss: 1.0104, test_loss: 1.1238, test_f1: 0.3370
 epoch: 95, train_loss: 1.0069, test_loss: 1.1078, test_f1: 0.3441
 epoch: 96, train_loss: 1.0132, test_loss: 1.1087, test_f1: 0.3464
 epoch: 97, train_loss: 1.0111, test_loss: 1.1218, test_f1: 0.3370
 epoch: 98, train_loss: 1.0029, test_loss: 1.1136, test_f1: 0.3420
 epoch: 99, train_loss: 1.0055, test_loss: 1.1088, test_f1: 0.3492
##################ITERATION #3 ****************************************
 epoch: 0, train_loss: 1.3124, test_loss: 1.3976, test_f1: 0.2281
 epoch: 1, train_loss: 1.1327, test_loss: 1.3062, test_f1: 0.2390
 epoch: 2, train_loss: 1.0756, test_loss: 1.2743, test_f1: 0.2838
 epoch: 3, train_loss: 1.0596, test_loss: 1.1825, test_f1: 0.3205
 epoch: 4, train_loss: 1.0644, test_loss: 1.3713, test_f1: 0.2336
 epoch: 5, train_loss: 1.0744, test_loss: 1.1043, test_f1: 0.3461
 epoch: 6, train_loss: 1.1081, test_loss: 1.1491, test_f1: 0.3290
 epoch: 7, train_loss: 1.0639, test_loss: 1.1690, test_f1: 0.3290
 epoch: 8, train_loss: 1.0776, test_loss: 1.1544, test_f1: 0.3290
 epoch: 9, train_loss: 1.0775, test_loss: 1.1068, test_f1: 0.3444
 epoch: 10, train_loss: 1.0485, test_loss: 1.1209, test_f1: 0.3395
 epoch: 11, train_loss: 1.0562, test_loss: 1.1366, test_f1: 0.3395
 epoch: 12, train_loss: 1.0578, test_loss: 1.1685, test_f1: 0.3290
 epoch: 13, train_loss: 1.0571, test_loss: 1.1144, test_f1: 0.3395
 epoch: 14, train_loss: 1.0368, test_loss: 1.1212, test_f1: 0.3395
 epoch: 15, train_loss: 1.0478, test_loss: 1.1469, test_f1: 0.3317
 epoch: 16, train_loss: 1.0417, test_loss: 1.1296, test_f1: 0.3395
 epoch: 17, train_loss: 1.0368, test_loss: 1.1243, test_f1: 0.3395
 epoch: 18, train_loss: 1.0219, test_loss: 1.0859, test_f1: 0.3515
 epoch: 19, train_loss: 1.0210, test_loss: 1.1044, test_f1: 0.3395
 epoch: 20, train_loss: 1.0344, test_loss: 1.0845, test_f1: 0.3500
 epoch: 21, train_loss: 1.0257, test_loss: 1.1363, test_f1: 0.3344
 epoch: 22, train_loss: 1.0281, test_loss: 1.1140, test_f1: 0.3395
 epoch: 23, train_loss: 1.0190, test_loss: 1.1403, test_f1: 0.3344
 epoch: 24, train_loss: 1.0369, test_loss: 1.1386, test_f1: 0.3344
 epoch: 25, train_loss: 1.0361, test_loss: 1.1366, test_f1: 0.3344
 epoch: 26, train_loss: 1.0424, test_loss: 1.4236, test_f1: 0.2281
 epoch: 27, train_loss: 1.0592, test_loss: 1.1329, test_f1: 0.3395
 epoch: 28, train_loss: 1.0451, test_loss: 1.1119, test_f1: 0.3395
 epoch: 29, train_loss: 1.0356, test_loss: 1.1115, test_f1: 0.3329
 epoch: 30, train_loss: 1.0297, test_loss: 1.0967, test_f1: 0.3419
 epoch: 31, train_loss: 1.0225, test_loss: 1.0920, test_f1: 0.3444
 epoch: 32, train_loss: 1.0171, test_loss: 1.1259, test_f1: 0.3395
 epoch: 33, train_loss: 1.0449, test_loss: 1.1553, test_f1: 0.3317
 epoch: 34, train_loss: 1.0189, test_loss: 1.1405, test_f1: 0.3344
 epoch: 35, train_loss: 1.0208, test_loss: 1.1348, test_f1: 0.3317
 epoch: 36, train_loss: 1.0108, test_loss: 1.1308, test_f1: 0.3290
 epoch: 37, train_loss: 1.0293, test_loss: 1.0878, test_f1: 0.3514
 epoch: 38, train_loss: 1.0185, test_loss: 1.2115, test_f1: 0.3143
 epoch: 39, train_loss: 1.0150, test_loss: 1.0855, test_f1: 0.3488
 epoch: 40, train_loss: 1.0104, test_loss: 1.0870, test_f1: 0.3468
 epoch: 41, train_loss: 1.0632, test_loss: 1.1037, test_f1: 0.3669
 epoch: 42, train_loss: 1.0405, test_loss: 1.1593, test_f1: 0.3290
 epoch: 43, train_loss: 1.0433, test_loss: 1.1431, test_f1: 0.3344
 epoch: 44, train_loss: 1.0303, test_loss: 1.1781, test_f1: 0.3262
 epoch: 45, train_loss: 1.0585, test_loss: 1.1515, test_f1: 0.3317
 epoch: 46, train_loss: 1.0329, test_loss: 1.1288, test_f1: 0.3395
 epoch: 47, train_loss: 1.0299, test_loss: 1.1059, test_f1: 0.3395
 epoch: 48, train_loss: 1.0387, test_loss: 1.0819, test_f1: 0.3492
 epoch: 49, train_loss: 1.0440, test_loss: 1.4049, test_f1: 0.2336
 epoch: 50, train_loss: 1.0596, test_loss: 1.1512, test_f1: 0.3290
 epoch: 51, train_loss: 1.0406, test_loss: 1.0993, test_f1: 0.3449
 epoch: 52, train_loss: 1.0528, test_loss: 1.1028, test_f1: 0.3414
 epoch: 53, train_loss: 1.0276, test_loss: 1.1086, test_f1: 0.3405
 epoch: 54, train_loss: 1.0185, test_loss: 1.1089, test_f1: 0.3395
 epoch: 55, train_loss: 1.0188, test_loss: 1.1114, test_f1: 0.3395
 epoch: 56, train_loss: 1.0116, test_loss: 1.1011, test_f1: 0.3395
 epoch: 57, train_loss: 1.0074, test_loss: 1.0709, test_f1: 0.3560
 epoch: 58, train_loss: 1.0138, test_loss: 1.1792, test_f1: 0.3262
 epoch: 59, train_loss: 1.0283, test_loss: 1.1828, test_f1: 0.3234
 epoch: 60, train_loss: 1.0231, test_loss: 1.0864, test_f1: 0.3395
 epoch: 61, train_loss: 1.0097, test_loss: 1.0788, test_f1: 0.3515
 epoch: 62, train_loss: 1.0227, test_loss: 1.0781, test_f1: 0.3536
 epoch: 63, train_loss: 1.0174, test_loss: 1.4066, test_f1: 0.3205
 epoch: 64, train_loss: 1.0126, test_loss: 1.1005, test_f1: 0.3370
 epoch: 65, train_loss: 1.0187, test_loss: 1.1485, test_f1: 0.3317
 epoch: 66, train_loss: 1.0142, test_loss: 1.1112, test_f1: 0.3370
 epoch: 67, train_loss: 1.0087, test_loss: 1.1100, test_f1: 0.3415
 epoch: 68, train_loss: 1.0105, test_loss: 1.2046, test_f1: 0.3023
 epoch: 69, train_loss: 1.0043, test_loss: 1.2681, test_f1: 0.3025
 epoch: 70, train_loss: 1.0085, test_loss: 1.1441, test_f1: 0.3304
 epoch: 71, train_loss: 1.0127, test_loss: 1.1208, test_f1: 0.3401
 epoch: 72, train_loss: 1.0158, test_loss: 1.2420, test_f1: 0.3051
 epoch: 73, train_loss: 1.0147, test_loss: 1.1358, test_f1: 0.3317
 epoch: 74, train_loss: 1.0091, test_loss: 1.4865, test_f1: 0.2929
 epoch: 75, train_loss: 1.0059, test_loss: 1.2042, test_f1: 0.3079
 epoch: 76, train_loss: 1.0123, test_loss: 1.0931, test_f1: 0.3461
 epoch: 77, train_loss: 1.0119, test_loss: 1.1603, test_f1: 0.3290
 epoch: 78, train_loss: 1.0128, test_loss: 1.1132, test_f1: 0.3344
 epoch: 79, train_loss: 1.0038, test_loss: 1.1002, test_f1: 0.3468
 epoch: 80, train_loss: 1.0020, test_loss: 1.1188, test_f1: 0.3461
 epoch: 81, train_loss: 1.0030, test_loss: 1.1554, test_f1: 0.3294
 epoch: 82, train_loss: 1.0008, test_loss: 1.1445, test_f1: 0.3294
 epoch: 83, train_loss: 0.9937, test_loss: 1.1267, test_f1: 0.3404
 epoch: 84, train_loss: 0.9948, test_loss: 1.1237, test_f1: 0.3399
 epoch: 85, train_loss: 1.0030, test_loss: 1.1406, test_f1: 0.3452
 epoch: 86, train_loss: 0.9979, test_loss: 1.1164, test_f1: 0.3465
 epoch: 87, train_loss: 1.0040, test_loss: 1.1094, test_f1: 0.3501
 epoch: 88, train_loss: 0.9957, test_loss: 1.1546, test_f1: 0.3516
 epoch: 89, train_loss: 1.0027, test_loss: 1.1460, test_f1: 0.3310
 epoch: 90, train_loss: 1.0079, test_loss: 1.1861, test_f1: 0.3062
 epoch: 91, train_loss: 1.0052, test_loss: 1.1841, test_f1: 0.3062
 epoch: 92, train_loss: 1.0042, test_loss: 1.1414, test_f1: 0.3554
 epoch: 93, train_loss: 1.0055, test_loss: 1.1816, test_f1: 0.3111
 epoch: 94, train_loss: 0.9986, test_loss: 1.3326, test_f1: 0.3204
 epoch: 95, train_loss: 1.0009, test_loss: 1.1318, test_f1: 0.3302
 epoch: 96, train_loss: 1.0075, test_loss: 1.1254, test_f1: 0.3375
 epoch: 97, train_loss: 1.0052, test_loss: 1.4084, test_f1: 0.2861
 epoch: 98, train_loss: 1.0019, test_loss: 1.1250, test_f1: 0.3368
 epoch: 99, train_loss: 1.0047, test_loss: 1.2756, test_f1: 0.3141
##################ITERATION #4 ****************************************
 epoch: 0, train_loss: 1.4094, test_loss: 1.4031, test_f1: 0.2281
 epoch: 1, train_loss: 1.3060, test_loss: 1.3430, test_f1: 0.2281
 epoch: 2, train_loss: 1.2672, test_loss: 1.3096, test_f1: 0.2281
 epoch: 3, train_loss: 1.2530, test_loss: 1.3059, test_f1: 0.2281
 epoch: 4, train_loss: 1.2534, test_loss: 1.3015, test_f1: 0.2281
 epoch: 5, train_loss: 1.2541, test_loss: 1.3025, test_f1: 0.2281
 epoch: 6, train_loss: 1.2525, test_loss: 1.3056, test_f1: 0.2281
 epoch: 7, train_loss: 1.2524, test_loss: 1.3044, test_f1: 0.2281
 epoch: 8, train_loss: 1.2528, test_loss: 1.3042, test_f1: 0.2281
 epoch: 9, train_loss: 1.2526, test_loss: 1.3046, test_f1: 0.2281
 epoch: 10, train_loss: 1.2535, test_loss: 1.3025, test_f1: 0.2281
 epoch: 11, train_loss: 1.2536, test_loss: 1.3040, test_f1: 0.2281
 epoch: 12, train_loss: 1.2568, test_loss: 1.3052, test_f1: 0.2281
 epoch: 13, train_loss: 1.2550, test_loss: 1.3063, test_f1: 0.2281
 epoch: 14, train_loss: 1.2539, test_loss: 1.3055, test_f1: 0.2281
 epoch: 15, train_loss: 1.2525, test_loss: 1.3019, test_f1: 0.2281
 epoch: 16, train_loss: 1.2547, test_loss: 1.3075, test_f1: 0.2281
 epoch: 17, train_loss: 1.2527, test_loss: 1.3031, test_f1: 0.2281
 epoch: 18, train_loss: 1.2529, test_loss: 1.3051, test_f1: 0.2281
 epoch: 19, train_loss: 1.2543, test_loss: 1.3074, test_f1: 0.2281
 epoch: 20, train_loss: 1.2549, test_loss: 1.3002, test_f1: 0.2281
 epoch: 21, train_loss: 1.2559, test_loss: 1.3067, test_f1: 0.2281
 epoch: 22, train_loss: 1.2548, test_loss: 1.3065, test_f1: 0.2281
 epoch: 23, train_loss: 1.2534, test_loss: 1.3045, test_f1: 0.2281
 epoch: 24, train_loss: 1.2541, test_loss: 1.3067, test_f1: 0.2281
 epoch: 25, train_loss: 1.2534, test_loss: 1.3022, test_f1: 0.2281
 epoch: 26, train_loss: 1.2532, test_loss: 1.3073, test_f1: 0.2281
 epoch: 27, train_loss: 1.2535, test_loss: 1.3048, test_f1: 0.2281
 epoch: 28, train_loss: 1.2527, test_loss: 1.3087, test_f1: 0.2281
 epoch: 29, train_loss: 1.2538, test_loss: 1.3059, test_f1: 0.2281
 epoch: 30, train_loss: 1.2531, test_loss: 1.3062, test_f1: 0.2281
 epoch: 31, train_loss: 1.2528, test_loss: 1.3044, test_f1: 0.2281
 epoch: 32, train_loss: 1.2525, test_loss: 1.3062, test_f1: 0.2281
 epoch: 33, train_loss: 1.2534, test_loss: 1.3034, test_f1: 0.2281
 epoch: 34, train_loss: 1.2552, test_loss: 1.3010, test_f1: 0.2281
 epoch: 35, train_loss: 1.2541, test_loss: 1.3082, test_f1: 0.2281
 epoch: 36, train_loss: 1.2537, test_loss: 1.3040, test_f1: 0.2281
 epoch: 37, train_loss: 1.2544, test_loss: 1.3040, test_f1: 0.2281
 epoch: 38, train_loss: 1.2542, test_loss: 1.3057, test_f1: 0.2281
 epoch: 39, train_loss: 1.2528, test_loss: 1.3016, test_f1: 0.2281
 epoch: 40, train_loss: 1.2541, test_loss: 1.3117, test_f1: 0.2281
 epoch: 41, train_loss: 1.2541, test_loss: 1.3000, test_f1: 0.2281
 epoch: 42, train_loss: 1.2528, test_loss: 1.3075, test_f1: 0.2281
 epoch: 43, train_loss: 1.2538, test_loss: 1.3034, test_f1: 0.2281
 epoch: 44, train_loss: 1.2529, test_loss: 1.3059, test_f1: 0.2281
 epoch: 45, train_loss: 1.2536, test_loss: 1.3057, test_f1: 0.2281
 epoch: 46, train_loss: 1.2527, test_loss: 1.3085, test_f1: 0.2281
 epoch: 47, train_loss: 1.2536, test_loss: 1.3044, test_f1: 0.2281
 epoch: 48, train_loss: 1.2532, test_loss: 1.3074, test_f1: 0.2281
 epoch: 49, train_loss: 1.2538, test_loss: 1.3040, test_f1: 0.2281
 epoch: 50, train_loss: 1.2538, test_loss: 1.3075, test_f1: 0.2281
 epoch: 51, train_loss: 1.2538, test_loss: 1.3057, test_f1: 0.2281
 epoch: 52, train_loss: 1.2528, test_loss: 1.3074, test_f1: 0.2281
 epoch: 53, train_loss: 1.2522, test_loss: 1.3036, test_f1: 0.2281
 epoch: 54, train_loss: 1.2522, test_loss: 1.3032, test_f1: 0.2281
 epoch: 55, train_loss: 1.2525, test_loss: 1.3047, test_f1: 0.2281
 epoch: 56, train_loss: 1.2523, test_loss: 1.3074, test_f1: 0.2281
 epoch: 57, train_loss: 1.2525, test_loss: 1.3074, test_f1: 0.2281
 epoch: 58, train_loss: 1.2523, test_loss: 1.3035, test_f1: 0.2281
 epoch: 59, train_loss: 1.2523, test_loss: 1.3041, test_f1: 0.2281
 epoch: 60, train_loss: 1.2523, test_loss: 1.3031, test_f1: 0.2281
 epoch: 61, train_loss: 1.2527, test_loss: 1.3019, test_f1: 0.2281
 epoch: 62, train_loss: 1.2523, test_loss: 1.3061, test_f1: 0.2281
 epoch: 63, train_loss: 1.2525, test_loss: 1.3039, test_f1: 0.2281
 epoch: 64, train_loss: 1.2523, test_loss: 1.3027, test_f1: 0.2281
 epoch: 65, train_loss: 1.2522, test_loss: 1.3041, test_f1: 0.2281
 epoch: 66, train_loss: 1.2521, test_loss: 1.3045, test_f1: 0.2281
 epoch: 67, train_loss: 1.2525, test_loss: 1.3027, test_f1: 0.2281
 epoch: 68, train_loss: 1.2525, test_loss: 1.3036, test_f1: 0.2281
 epoch: 69, train_loss: 1.2529, test_loss: 1.3075, test_f1: 0.2281
 epoch: 70, train_loss: 1.2526, test_loss: 1.3034, test_f1: 0.2281
 epoch: 71, train_loss: 1.2532, test_loss: 1.3008, test_f1: 0.2281
 epoch: 72, train_loss: 1.2535, test_loss: 1.3051, test_f1: 0.2281
 epoch: 73, train_loss: 1.2521, test_loss: 1.3076, test_f1: 0.2281
 epoch: 74, train_loss: 1.2528, test_loss: 1.3062, test_f1: 0.2281
 epoch: 75, train_loss: 1.2523, test_loss: 1.3047, test_f1: 0.2281
 epoch: 76, train_loss: 1.2530, test_loss: 1.3033, test_f1: 0.2281
 epoch: 77, train_loss: 1.2528, test_loss: 1.3060, test_f1: 0.2281
 epoch: 78, train_loss: 1.2523, test_loss: 1.3043, test_f1: 0.2281
 epoch: 79, train_loss: 1.2528, test_loss: 1.3032, test_f1: 0.2281
 epoch: 80, train_loss: 1.2523, test_loss: 1.3034, test_f1: 0.2281
 epoch: 81, train_loss: 1.2524, test_loss: 1.3033, test_f1: 0.2281
 epoch: 82, train_loss: 1.2533, test_loss: 1.3007, test_f1: 0.2281
 epoch: 83, train_loss: 1.2527, test_loss: 1.3038, test_f1: 0.2281
 epoch: 84, train_loss: 1.2522, test_loss: 1.3056, test_f1: 0.2281
 epoch: 85, train_loss: 1.2525, test_loss: 1.3054, test_f1: 0.2281
 epoch: 86, train_loss: 1.2526, test_loss: 1.3050, test_f1: 0.2281
 epoch: 87, train_loss: 1.2539, test_loss: 1.3014, test_f1: 0.2281
 epoch: 88, train_loss: 1.2528, test_loss: 1.3045, test_f1: 0.2281
 epoch: 89, train_loss: 1.2528, test_loss: 1.3058, test_f1: 0.2281
 epoch: 90, train_loss: 1.2529, test_loss: 1.3026, test_f1: 0.2281
 epoch: 91, train_loss: 1.2521, test_loss: 1.3055, test_f1: 0.2281
 epoch: 92, train_loss: 1.2528, test_loss: 1.3071, test_f1: 0.2281
 epoch: 93, train_loss: 1.2526, test_loss: 1.3045, test_f1: 0.2281
 epoch: 94, train_loss: 1.2522, test_loss: 1.3036, test_f1: 0.2281
 epoch: 95, train_loss: 1.2522, test_loss: 1.3042, test_f1: 0.2281
 epoch: 96, train_loss: 1.2522, test_loss: 1.3047, test_f1: 0.2281
 epoch: 97, train_loss: 1.2525, test_loss: 1.3052, test_f1: 0.2281
 epoch: 98, train_loss: 1.2527, test_loss: 1.3023, test_f1: 0.2281
 epoch: 99, train_loss: 1.2527, test_loss: 1.3059, test_f1: 0.2281
##################ITERATION #5 ****************************************
 epoch: 0, train_loss: 1.2614, test_loss: 1.2998, test_f1: 0.2281
 epoch: 1, train_loss: 1.2579, test_loss: 1.3020, test_f1: 0.2281
 epoch: 2, train_loss: 1.2546, test_loss: 1.3078, test_f1: 0.2281
 epoch: 3, train_loss: 1.2534, test_loss: 1.3053, test_f1: 0.2281
 epoch: 4, train_loss: 1.2533, test_loss: 1.3047, test_f1: 0.2281
 epoch: 5, train_loss: 1.2543, test_loss: 1.3058, test_f1: 0.2281
 epoch: 6, train_loss: 1.2534, test_loss: 1.3013, test_f1: 0.2281
 epoch: 7, train_loss: 1.2525, test_loss: 1.3047, test_f1: 0.2281
 epoch: 8, train_loss: 1.2535, test_loss: 1.3092, test_f1: 0.2281
 epoch: 9, train_loss: 1.2558, test_loss: 1.3032, test_f1: 0.2281
 epoch: 10, train_loss: 1.2574, test_loss: 1.3028, test_f1: 0.2281
 epoch: 11, train_loss: 1.2531, test_loss: 1.3048, test_f1: 0.2281
 epoch: 12, train_loss: 1.2534, test_loss: 1.3092, test_f1: 0.2281
 epoch: 13, train_loss: 1.2535, test_loss: 1.3005, test_f1: 0.2281
 epoch: 14, train_loss: 1.2529, test_loss: 1.3089, test_f1: 0.2281
 epoch: 15, train_loss: 1.2526, test_loss: 1.3067, test_f1: 0.2281
 epoch: 16, train_loss: 1.2560, test_loss: 1.3102, test_f1: 0.2281
 epoch: 17, train_loss: 1.2528, test_loss: 1.3064, test_f1: 0.2281
 epoch: 18, train_loss: 1.2535, test_loss: 1.3028, test_f1: 0.2281
 epoch: 19, train_loss: 1.2544, test_loss: 1.3026, test_f1: 0.2281
 epoch: 20, train_loss: 1.2525, test_loss: 1.3051, test_f1: 0.2281
 epoch: 21, train_loss: 1.2546, test_loss: 1.3076, test_f1: 0.2281
 epoch: 22, train_loss: 1.2533, test_loss: 1.3063, test_f1: 0.2281
 epoch: 23, train_loss: 1.2525, test_loss: 1.3060, test_f1: 0.2281
 epoch: 24, train_loss: 1.2529, test_loss: 1.3061, test_f1: 0.2281
 epoch: 25, train_loss: 1.2533, test_loss: 1.3068, test_f1: 0.2281
 epoch: 26, train_loss: 1.2535, test_loss: 1.3023, test_f1: 0.2281
 epoch: 27, train_loss: 1.2526, test_loss: 1.3057, test_f1: 0.2281
 epoch: 28, train_loss: 1.2537, test_loss: 1.3076, test_f1: 0.2281
 epoch: 29, train_loss: 1.2543, test_loss: 1.3034, test_f1: 0.2281
 epoch: 30, train_loss: 1.2534, test_loss: 1.3057, test_f1: 0.2281
 epoch: 31, train_loss: 1.2530, test_loss: 1.3061, test_f1: 0.2281
 epoch: 32, train_loss: 1.2525, test_loss: 1.3063, test_f1: 0.2281
 epoch: 33, train_loss: 1.2529, test_loss: 1.3025, test_f1: 0.2281
 epoch: 34, train_loss: 1.2535, test_loss: 1.3068, test_f1: 0.2281
 epoch: 35, train_loss: 1.2533, test_loss: 1.3048, test_f1: 0.2281
 epoch: 36, train_loss: 1.2530, test_loss: 1.3087, test_f1: 0.2281
 epoch: 37, train_loss: 1.2528, test_loss: 1.3038, test_f1: 0.2281
 epoch: 38, train_loss: 1.2540, test_loss: 1.3045, test_f1: 0.2281
 epoch: 39, train_loss: 1.2529, test_loss: 1.3029, test_f1: 0.2281
 epoch: 40, train_loss: 1.2533, test_loss: 1.3097, test_f1: 0.2281
 epoch: 41, train_loss: 1.2536, test_loss: 1.3017, test_f1: 0.2281
 epoch: 42, train_loss: 1.2530, test_loss: 1.3028, test_f1: 0.2281
 epoch: 43, train_loss: 1.2533, test_loss: 1.3062, test_f1: 0.2281
 epoch: 44, train_loss: 1.2530, test_loss: 1.3048, test_f1: 0.2281
 epoch: 45, train_loss: 1.2537, test_loss: 1.2995, test_f1: 0.2281
 epoch: 46, train_loss: 1.2530, test_loss: 1.3074, test_f1: 0.2281
 epoch: 47, train_loss: 1.2549, test_loss: 1.3102, test_f1: 0.2281
 epoch: 48, train_loss: 1.2527, test_loss: 1.3011, test_f1: 0.2281
 epoch: 49, train_loss: 1.2553, test_loss: 1.3047, test_f1: 0.2281
 epoch: 50, train_loss: 1.2533, test_loss: 1.3044, test_f1: 0.2281
 epoch: 51, train_loss: 1.2526, test_loss: 1.3062, test_f1: 0.2281
 epoch: 52, train_loss: 1.2530, test_loss: 1.3073, test_f1: 0.2281
 epoch: 53, train_loss: 1.2526, test_loss: 1.3054, test_f1: 0.2281
 epoch: 54, train_loss: 1.2525, test_loss: 1.3024, test_f1: 0.2281
 epoch: 55, train_loss: 1.2525, test_loss: 1.3057, test_f1: 0.2281
 epoch: 56, train_loss: 1.2524, test_loss: 1.3073, test_f1: 0.2281
 epoch: 57, train_loss: 1.2528, test_loss: 1.3058, test_f1: 0.2281
 epoch: 58, train_loss: 1.2524, test_loss: 1.3064, test_f1: 0.2281
 epoch: 59, train_loss: 1.2531, test_loss: 1.3033, test_f1: 0.2281
 epoch: 60, train_loss: 1.2524, test_loss: 1.3043, test_f1: 0.2281
 epoch: 61, train_loss: 1.2525, test_loss: 1.3066, test_f1: 0.2281
 epoch: 62, train_loss: 1.2526, test_loss: 1.3084, test_f1: 0.2281
 epoch: 63, train_loss: 1.2527, test_loss: 1.3062, test_f1: 0.2281
 epoch: 64, train_loss: 1.2526, test_loss: 1.3027, test_f1: 0.2281
 epoch: 65, train_loss: 1.2522, test_loss: 1.3047, test_f1: 0.2281
 epoch: 66, train_loss: 1.2525, test_loss: 1.3043, test_f1: 0.2281
 epoch: 67, train_loss: 1.2529, test_loss: 1.3050, test_f1: 0.2281
 epoch: 68, train_loss: 1.2523, test_loss: 1.3040, test_f1: 0.2281
 epoch: 69, train_loss: 1.2525, test_loss: 1.3039, test_f1: 0.2281
 epoch: 70, train_loss: 1.2534, test_loss: 1.3066, test_f1: 0.2281
 epoch: 71, train_loss: 1.2529, test_loss: 1.3054, test_f1: 0.2281
 epoch: 72, train_loss: 1.2529, test_loss: 1.3029, test_f1: 0.2281
 epoch: 73, train_loss: 1.2526, test_loss: 1.3047, test_f1: 0.2281
 epoch: 74, train_loss: 1.2526, test_loss: 1.3045, test_f1: 0.2281
 epoch: 75, train_loss: 1.2522, test_loss: 1.3056, test_f1: 0.2281
 epoch: 76, train_loss: 1.2532, test_loss: 1.3065, test_f1: 0.2281
 epoch: 77, train_loss: 1.2522, test_loss: 1.3056, test_f1: 0.2281
 epoch: 78, train_loss: 1.2527, test_loss: 1.3047, test_f1: 0.2281
 epoch: 79, train_loss: 1.2523, test_loss: 1.3040, test_f1: 0.2281
 epoch: 80, train_loss: 1.2523, test_loss: 1.3036, test_f1: 0.2281
 epoch: 81, train_loss: 1.2528, test_loss: 1.3041, test_f1: 0.2281
 epoch: 82, train_loss: 1.2525, test_loss: 1.3058, test_f1: 0.2281
 epoch: 83, train_loss: 1.2524, test_loss: 1.3056, test_f1: 0.2281
 epoch: 84, train_loss: 1.2524, test_loss: 1.3024, test_f1: 0.2281
 epoch: 85, train_loss: 1.2522, test_loss: 1.3036, test_f1: 0.2281
 epoch: 86, train_loss: 1.2535, test_loss: 1.3072, test_f1: 0.2281
 epoch: 87, train_loss: 1.2522, test_loss: 1.3070, test_f1: 0.2281
 epoch: 88, train_loss: 1.2537, test_loss: 1.3049, test_f1: 0.2281
 epoch: 89, train_loss: 1.2547, test_loss: 1.3036, test_f1: 0.2281
 epoch: 90, train_loss: 1.2529, test_loss: 1.3058, test_f1: 0.2281
 epoch: 91, train_loss: 1.2522, test_loss: 1.3060, test_f1: 0.2281
 epoch: 92, train_loss: 1.2525, test_loss: 1.3056, test_f1: 0.2281
 epoch: 93, train_loss: 1.2531, test_loss: 1.3042, test_f1: 0.2281
 epoch: 94, train_loss: 1.2526, test_loss: 1.3057, test_f1: 0.2281
 epoch: 95, train_loss: 1.2527, test_loss: 1.3035, test_f1: 0.2281
 epoch: 96, train_loss: 1.2523, test_loss: 1.3046, test_f1: 0.2281
 epoch: 97, train_loss: 1.2524, test_loss: 1.3031, test_f1: 0.2281
 epoch: 98, train_loss: 1.2528, test_loss: 1.3056, test_f1: 0.2281
 epoch: 99, train_loss: 1.2523, test_loss: 1.3040, test_f1: 0.2281
##################ITERATION #6 ****************************************
 epoch: 0, train_loss: 1.2565, test_loss: 1.3173, test_f1: 0.2281
 epoch: 1, train_loss: 1.2301, test_loss: 1.2939, test_f1: 0.3301
 epoch: 2, train_loss: 1.2332, test_loss: 1.3042, test_f1: 0.2281
 epoch: 3, train_loss: 1.2281, test_loss: 1.4427, test_f1: 0.1368
 epoch: 4, train_loss: 1.2013, test_loss: 1.4448, test_f1: 0.1368
 epoch: 5, train_loss: 1.1958, test_loss: 1.3045, test_f1: 0.2659
 epoch: 6, train_loss: 1.2028, test_loss: 1.3485, test_f1: 0.2661
 epoch: 7, train_loss: 1.1906, test_loss: 1.5729, test_f1: 0.1365
 epoch: 8, train_loss: 1.2047, test_loss: 1.4063, test_f1: 0.1365
 epoch: 9, train_loss: 1.2371, test_loss: 1.3004, test_f1: 0.2281
 epoch: 10, train_loss: 1.1803, test_loss: 1.2801, test_f1: 0.2281
 epoch: 11, train_loss: 1.1862, test_loss: 1.3892, test_f1: 0.0301
 epoch: 12, train_loss: 1.2144, test_loss: 1.3414, test_f1: 0.2809
 epoch: 13, train_loss: 1.1988, test_loss: 1.3081, test_f1: 0.2281
 epoch: 14, train_loss: 1.2152, test_loss: 1.3283, test_f1: 0.2572
 epoch: 15, train_loss: 1.2180, test_loss: 1.3378, test_f1: 0.2918
 epoch: 16, train_loss: 1.2130, test_loss: 1.3031, test_f1: 0.3085
 epoch: 17, train_loss: 1.2064, test_loss: 1.2659, test_f1: 0.3388
 epoch: 18, train_loss: 1.2213, test_loss: 1.2872, test_f1: 0.3164
 epoch: 19, train_loss: 1.2083, test_loss: 1.2880, test_f1: 0.3274
 epoch: 20, train_loss: 1.1975, test_loss: 1.2898, test_f1: 0.3301
 epoch: 21, train_loss: 1.1947, test_loss: 1.2774, test_f1: 0.3346
 epoch: 22, train_loss: 1.1934, test_loss: 1.2982, test_f1: 0.2950
 epoch: 23, train_loss: 1.1903, test_loss: 1.2664, test_f1: 0.3370
 epoch: 24, train_loss: 1.1902, test_loss: 1.2798, test_f1: 0.2281
 epoch: 25, train_loss: 1.1863, test_loss: 1.2890, test_f1: 0.3131
 epoch: 26, train_loss: 1.1755, test_loss: 1.2990, test_f1: 0.2718
 epoch: 27, train_loss: 1.1841, test_loss: 1.4128, test_f1: 0.2281
 epoch: 28, train_loss: 1.1914, test_loss: 1.2519, test_f1: 0.3021
 epoch: 29, train_loss: 1.1924, test_loss: 1.3173, test_f1: 0.2281
 epoch: 30, train_loss: 1.1907, test_loss: 1.3263, test_f1: 0.2281
 epoch: 31, train_loss: 1.1937, test_loss: 1.3261, test_f1: 0.2281
 epoch: 32, train_loss: 1.2452, test_loss: 1.2801, test_f1: 0.2876
 epoch: 33, train_loss: 1.2155, test_loss: 1.4199, test_f1: 0.0301
 epoch: 34, train_loss: 1.2025, test_loss: 1.4367, test_f1: 0.0301
 epoch: 35, train_loss: 1.2134, test_loss: 1.3331, test_f1: 0.2281
 epoch: 36, train_loss: 1.3291, test_loss: 1.3298, test_f1: 0.2281
 epoch: 37, train_loss: 1.2927, test_loss: 1.3149, test_f1: 0.2281
 epoch: 38, train_loss: 1.2575, test_loss: 1.3176, test_f1: 0.2281
 epoch: 39, train_loss: 1.2580, test_loss: 1.3072, test_f1: 0.2281
 epoch: 40, train_loss: 1.2527, test_loss: 1.3013, test_f1: 0.2281
 epoch: 41, train_loss: 1.2551, test_loss: 1.3020, test_f1: 0.2281
 epoch: 42, train_loss: 1.2528, test_loss: 1.3089, test_f1: 0.2281
 epoch: 43, train_loss: 1.2533, test_loss: 1.3056, test_f1: 0.2281
 epoch: 44, train_loss: 1.2529, test_loss: 1.3050, test_f1: 0.2281
 epoch: 45, train_loss: 1.2523, test_loss: 1.3045, test_f1: 0.2281
 epoch: 46, train_loss: 1.2532, test_loss: 1.3026, test_f1: 0.2281
 epoch: 47, train_loss: 1.2531, test_loss: 1.3050, test_f1: 0.2281
 epoch: 48, train_loss: 1.2527, test_loss: 1.3027, test_f1: 0.2281
 epoch: 49, train_loss: 1.2526, test_loss: 1.3020, test_f1: 0.2281
 epoch: 50, train_loss: 1.2527, test_loss: 1.3055, test_f1: 0.2281
 epoch: 51, train_loss: 1.2534, test_loss: 1.3053, test_f1: 0.2281
 epoch: 52, train_loss: 1.2527, test_loss: 1.3059, test_f1: 0.2281
 epoch: 53, train_loss: 1.2527, test_loss: 1.3023, test_f1: 0.2281
 epoch: 54, train_loss: 1.2524, test_loss: 1.3050, test_f1: 0.2281
 epoch: 55, train_loss: 1.2528, test_loss: 1.3052, test_f1: 0.2281
 epoch: 56, train_loss: 1.2530, test_loss: 1.3021, test_f1: 0.2281
 epoch: 57, train_loss: 1.2523, test_loss: 1.3034, test_f1: 0.2281
 epoch: 58, train_loss: 1.2525, test_loss: 1.3052, test_f1: 0.2281
 epoch: 59, train_loss: 1.2525, test_loss: 1.3045, test_f1: 0.2281
 epoch: 60, train_loss: 1.2532, test_loss: 1.3045, test_f1: 0.2281
 epoch: 61, train_loss: 1.2533, test_loss: 1.3055, test_f1: 0.2281
 epoch: 62, train_loss: 1.2521, test_loss: 1.3054, test_f1: 0.2281
 epoch: 63, train_loss: 1.2525, test_loss: 1.3043, test_f1: 0.2281
 epoch: 64, train_loss: 1.2524, test_loss: 1.3039, test_f1: 0.2281
 epoch: 65, train_loss: 1.2519, test_loss: 1.3021, test_f1: 0.2281
 epoch: 66, train_loss: 1.2524, test_loss: 1.3025, test_f1: 0.2281
 epoch: 67, train_loss: 1.2521, test_loss: 1.3060, test_f1: 0.2281
 epoch: 68, train_loss: 1.2522, test_loss: 1.3044, test_f1: 0.2281
 epoch: 69, train_loss: 1.2524, test_loss: 1.3030, test_f1: 0.2281
 epoch: 70, train_loss: 1.2524, test_loss: 1.3040, test_f1: 0.2281
 epoch: 71, train_loss: 1.2529, test_loss: 1.3048, test_f1: 0.2281
 epoch: 72, train_loss: 1.2525, test_loss: 1.3049, test_f1: 0.2281
 epoch: 73, train_loss: 1.2524, test_loss: 1.3048, test_f1: 0.2281
 epoch: 74, train_loss: 1.2524, test_loss: 1.3042, test_f1: 0.2281
 epoch: 75, train_loss: 1.2524, test_loss: 1.3040, test_f1: 0.2281
 epoch: 76, train_loss: 1.2522, test_loss: 1.3036, test_f1: 0.2281
 epoch: 77, train_loss: 1.2527, test_loss: 1.3059, test_f1: 0.2281
 epoch: 78, train_loss: 1.2526, test_loss: 1.3075, test_f1: 0.2281
 epoch: 79, train_loss: 1.2526, test_loss: 1.3039, test_f1: 0.2281
 epoch: 80, train_loss: 1.2533, test_loss: 1.3029, test_f1: 0.2281
 epoch: 81, train_loss: 1.2526, test_loss: 1.3043, test_f1: 0.2281
 epoch: 82, train_loss: 1.2525, test_loss: 1.3043, test_f1: 0.2281
 epoch: 83, train_loss: 1.2525, test_loss: 1.3070, test_f1: 0.2281
 epoch: 84, train_loss: 1.2522, test_loss: 1.3039, test_f1: 0.2281
 epoch: 85, train_loss: 1.2525, test_loss: 1.3027, test_f1: 0.2281
 epoch: 86, train_loss: 1.2530, test_loss: 1.3036, test_f1: 0.2281
 epoch: 87, train_loss: 1.2525, test_loss: 1.3066, test_f1: 0.2281
 epoch: 88, train_loss: 1.2525, test_loss: 1.3057, test_f1: 0.2281
 epoch: 89, train_loss: 1.2520, test_loss: 1.3021, test_f1: 0.2281
 epoch: 90, train_loss: 1.2534, test_loss: 1.3007, test_f1: 0.2281
 epoch: 91, train_loss: 1.2526, test_loss: 1.3069, test_f1: 0.2281
 epoch: 92, train_loss: 1.2532, test_loss: 1.3040, test_f1: 0.2281
 epoch: 93, train_loss: 1.2526, test_loss: 1.3066, test_f1: 0.2281
 epoch: 94, train_loss: 1.2525, test_loss: 1.3064, test_f1: 0.2281
 epoch: 95, train_loss: 1.2521, test_loss: 1.3028, test_f1: 0.2281
 epoch: 96, train_loss: 1.2529, test_loss: 1.3020, test_f1: 0.2281
 epoch: 97, train_loss: 1.2522, test_loss: 1.3057, test_f1: 0.2281
 epoch: 98, train_loss: 1.2527, test_loss: 1.3053, test_f1: 0.2281
 epoch: 99, train_loss: 1.2530, test_loss: 1.3057, test_f1: 0.2281
##################ITERATION #7 ****************************************
 epoch: 0, train_loss: 1.2563, test_loss: 1.3031, test_f1: 0.2281
 epoch: 1, train_loss: 1.2533, test_loss: 1.3049, test_f1: 0.2281
 epoch: 2, train_loss: 1.2528, test_loss: 1.3021, test_f1: 0.2281
 epoch: 3, train_loss: 1.2525, test_loss: 1.3066, test_f1: 0.2281
 epoch: 4, train_loss: 1.2525, test_loss: 1.3039, test_f1: 0.2281
 epoch: 5, train_loss: 1.2536, test_loss: 1.3003, test_f1: 0.2281
 epoch: 6, train_loss: 1.2537, test_loss: 1.3080, test_f1: 0.2281
 epoch: 7, train_loss: 1.2529, test_loss: 1.3039, test_f1: 0.2281
 epoch: 8, train_loss: 1.2540, test_loss: 1.3027, test_f1: 0.2281
 epoch: 9, train_loss: 1.2545, test_loss: 1.3047, test_f1: 0.2281
 epoch: 10, train_loss: 1.2560, test_loss: 1.3040, test_f1: 0.2281
 epoch: 11, train_loss: 1.2548, test_loss: 1.3100, test_f1: 0.2281
 epoch: 12, train_loss: 1.2556, test_loss: 1.3021, test_f1: 0.2281
 epoch: 13, train_loss: 1.2543, test_loss: 1.3059, test_f1: 0.2281
 epoch: 14, train_loss: 1.2539, test_loss: 1.3053, test_f1: 0.2281
 epoch: 15, train_loss: 1.2550, test_loss: 1.3023, test_f1: 0.2281
 epoch: 16, train_loss: 1.2534, test_loss: 1.3043, test_f1: 0.2281
 epoch: 17, train_loss: 1.2536, test_loss: 1.3073, test_f1: 0.2281
 epoch: 18, train_loss: 1.2560, test_loss: 1.3007, test_f1: 0.2281
 epoch: 19, train_loss: 1.2531, test_loss: 1.3097, test_f1: 0.2281
 epoch: 20, train_loss: 1.2527, test_loss: 1.3032, test_f1: 0.2281
 epoch: 21, train_loss: 1.2539, test_loss: 1.3049, test_f1: 0.2281
 epoch: 22, train_loss: 1.2543, test_loss: 1.3023, test_f1: 0.2281
 epoch: 23, train_loss: 1.2532, test_loss: 1.3076, test_f1: 0.2281
 epoch: 24, train_loss: 1.2548, test_loss: 1.3037, test_f1: 0.2281
 epoch: 25, train_loss: 1.2529, test_loss: 1.3087, test_f1: 0.2281
 epoch: 26, train_loss: 1.2548, test_loss: 1.3032, test_f1: 0.2281
 epoch: 27, train_loss: 1.2552, test_loss: 1.3061, test_f1: 0.2281
 epoch: 28, train_loss: 1.2531, test_loss: 1.3058, test_f1: 0.2281
 epoch: 29, train_loss: 1.2536, test_loss: 1.3041, test_f1: 0.2281
 epoch: 30, train_loss: 1.2530, test_loss: 1.3054, test_f1: 0.2281
 epoch: 31, train_loss: 1.2535, test_loss: 1.3053, test_f1: 0.2281
 epoch: 32, train_loss: 1.2535, test_loss: 1.3041, test_f1: 0.2281
 epoch: 33, train_loss: 1.2535, test_loss: 1.3037, test_f1: 0.2281
 epoch: 34, train_loss: 1.2537, test_loss: 1.3031, test_f1: 0.2281
 epoch: 35, train_loss: 1.2535, test_loss: 1.3037, test_f1: 0.2281
 epoch: 36, train_loss: 1.2536, test_loss: 1.3060, test_f1: 0.2281
 epoch: 37, train_loss: 1.2527, test_loss: 1.3043, test_f1: 0.2281
 epoch: 38, train_loss: 1.2530, test_loss: 1.3047, test_f1: 0.2281
 epoch: 39, train_loss: 1.2533, test_loss: 1.3038, test_f1: 0.2281
 epoch: 40, train_loss: 1.2523, test_loss: 1.3057, test_f1: 0.2281
 epoch: 41, train_loss: 1.2532, test_loss: 1.3066, test_f1: 0.2281
 epoch: 42, train_loss: 1.2526, test_loss: 1.3036, test_f1: 0.2281
 epoch: 43, train_loss: 1.2535, test_loss: 1.3032, test_f1: 0.2281
 epoch: 44, train_loss: 1.2529, test_loss: 1.3037, test_f1: 0.2281
 epoch: 45, train_loss: 1.2543, test_loss: 1.3032, test_f1: 0.2281
 epoch: 46, train_loss: 1.2558, test_loss: 1.3089, test_f1: 0.2281
 epoch: 47, train_loss: 1.2558, test_loss: 1.3069, test_f1: 0.2281
 epoch: 48, train_loss: 1.2556, test_loss: 1.3060, test_f1: 0.2281
 epoch: 49, train_loss: 1.2556, test_loss: 1.3055, test_f1: 0.2281
 epoch: 50, train_loss: 1.2532, test_loss: 1.3048, test_f1: 0.2281
 epoch: 51, train_loss: 1.2528, test_loss: 1.3046, test_f1: 0.2281
 epoch: 52, train_loss: 1.2522, test_loss: 1.3054, test_f1: 0.2281
 epoch: 53, train_loss: 1.2524, test_loss: 1.3048, test_f1: 0.2281
 epoch: 54, train_loss: 1.2525, test_loss: 1.3032, test_f1: 0.2281
 epoch: 55, train_loss: 1.2526, test_loss: 1.3030, test_f1: 0.2281
 epoch: 56, train_loss: 1.2522, test_loss: 1.3028, test_f1: 0.2281
 epoch: 57, train_loss: 1.2524, test_loss: 1.3061, test_f1: 0.2281
 epoch: 58, train_loss: 1.2523, test_loss: 1.3055, test_f1: 0.2281
 epoch: 59, train_loss: 1.2524, test_loss: 1.3047, test_f1: 0.2281
 epoch: 60, train_loss: 1.2531, test_loss: 1.3019, test_f1: 0.2281
 epoch: 61, train_loss: 1.2531, test_loss: 1.3044, test_f1: 0.2281
 epoch: 62, train_loss: 1.2523, test_loss: 1.3040, test_f1: 0.2281
 epoch: 63, train_loss: 1.2524, test_loss: 1.3062, test_f1: 0.2281
 epoch: 64, train_loss: 1.2527, test_loss: 1.3058, test_f1: 0.2281
 epoch: 65, train_loss: 1.2527, test_loss: 1.3048, test_f1: 0.2281
 epoch: 66, train_loss: 1.2527, test_loss: 1.3045, test_f1: 0.2281
 epoch: 67, train_loss: 1.2526, test_loss: 1.3042, test_f1: 0.2281
 epoch: 68, train_loss: 1.2527, test_loss: 1.3040, test_f1: 0.2281
 epoch: 69, train_loss: 1.2527, test_loss: 1.3071, test_f1: 0.2281
 epoch: 70, train_loss: 1.2526, test_loss: 1.3052, test_f1: 0.2281
 epoch: 71, train_loss: 1.2524, test_loss: 1.3036, test_f1: 0.2281
 epoch: 72, train_loss: 1.2526, test_loss: 1.3023, test_f1: 0.2281
 epoch: 73, train_loss: 1.2523, test_loss: 1.3033, test_f1: 0.2281
 epoch: 74, train_loss: 1.2526, test_loss: 1.3060, test_f1: 0.2281
 epoch: 75, train_loss: 1.2527, test_loss: 1.3036, test_f1: 0.2281
 epoch: 76, train_loss: 1.2525, test_loss: 1.3035, test_f1: 0.2281
 epoch: 77, train_loss: 1.2525, test_loss: 1.3057, test_f1: 0.2281
 epoch: 78, train_loss: 1.2529, test_loss: 1.3070, test_f1: 0.2281
 epoch: 79, train_loss: 1.2526, test_loss: 1.3039, test_f1: 0.2281
 epoch: 80, train_loss: 1.2528, test_loss: 1.3036, test_f1: 0.2281
 epoch: 81, train_loss: 1.2532, test_loss: 1.3087, test_f1: 0.2281
 epoch: 82, train_loss: 1.2525, test_loss: 1.3054, test_f1: 0.2281
 epoch: 83, train_loss: 1.2543, test_loss: 1.3027, test_f1: 0.2281
 epoch: 84, train_loss: 1.2528, test_loss: 1.3029, test_f1: 0.2281
 epoch: 85, train_loss: 1.2526, test_loss: 1.3040, test_f1: 0.2281
 epoch: 86, train_loss: 1.2522, test_loss: 1.3077, test_f1: 0.2281
 epoch: 87, train_loss: 1.2527, test_loss: 1.3070, test_f1: 0.2281
 epoch: 88, train_loss: 1.2527, test_loss: 1.3061, test_f1: 0.2281
 epoch: 89, train_loss: 1.2523, test_loss: 1.3048, test_f1: 0.2281
 epoch: 90, train_loss: 1.2525, test_loss: 1.3044, test_f1: 0.2281
 epoch: 91, train_loss: 1.2525, test_loss: 1.3047, test_f1: 0.2281
 epoch: 92, train_loss: 1.2537, test_loss: 1.3065, test_f1: 0.2281
 epoch: 93, train_loss: 1.2525, test_loss: 1.3038, test_f1: 0.2281
 epoch: 94, train_loss: 1.2529, test_loss: 1.3069, test_f1: 0.2281
 epoch: 95, train_loss: 1.2526, test_loss: 1.3070, test_f1: 0.2281
 epoch: 96, train_loss: 1.2523, test_loss: 1.3040, test_f1: 0.2281
 epoch: 97, train_loss: 1.2526, test_loss: 1.3030, test_f1: 0.2281
 epoch: 98, train_loss: 1.2529, test_loss: 1.3035, test_f1: 0.2281
 epoch: 99, train_loss: 1.2528, test_loss: 1.3045, test_f1: 0.2281
##################ITERATION #8 ****************************************
 epoch: 0, train_loss: 1.2575, test_loss: 1.3135, test_f1: 0.2281
 epoch: 1, train_loss: 1.2578, test_loss: 1.3117, test_f1: 0.2281
 epoch: 2, train_loss: 1.2533, test_loss: 1.2993, test_f1: 0.2281
 epoch: 3, train_loss: 1.2530, test_loss: 1.3048, test_f1: 0.2281
 epoch: 4, train_loss: 1.2525, test_loss: 1.3060, test_f1: 0.2281
 epoch: 5, train_loss: 1.2529, test_loss: 1.3063, test_f1: 0.2281
 epoch: 6, train_loss: 1.2541, test_loss: 1.3047, test_f1: 0.2281
 epoch: 7, train_loss: 1.2533, test_loss: 1.3056, test_f1: 0.2281
 epoch: 8, train_loss: 1.2530, test_loss: 1.3075, test_f1: 0.2281
 epoch: 9, train_loss: 1.2533, test_loss: 1.3035, test_f1: 0.2281
 epoch: 10, train_loss: 1.2532, test_loss: 1.3041, test_f1: 0.2281
 epoch: 11, train_loss: 1.2532, test_loss: 1.3064, test_f1: 0.2281
 epoch: 12, train_loss: 1.2529, test_loss: 1.3044, test_f1: 0.2281
 epoch: 13, train_loss: 1.2529, test_loss: 1.3057, test_f1: 0.2281
 epoch: 14, train_loss: 1.2527, test_loss: 1.3026, test_f1: 0.2281
 epoch: 15, train_loss: 1.2534, test_loss: 1.3067, test_f1: 0.2281
 epoch: 16, train_loss: 1.2537, test_loss: 1.3085, test_f1: 0.2281
 epoch: 17, train_loss: 1.2536, test_loss: 1.3067, test_f1: 0.2281
 epoch: 18, train_loss: 1.2530, test_loss: 1.3039, test_f1: 0.2281
 epoch: 19, train_loss: 1.2522, test_loss: 1.3014, test_f1: 0.2281
 epoch: 20, train_loss: 1.2538, test_loss: 1.3060, test_f1: 0.2281
 epoch: 21, train_loss: 1.2529, test_loss: 1.3040, test_f1: 0.2281
 epoch: 22, train_loss: 1.2526, test_loss: 1.3059, test_f1: 0.2281
 epoch: 23, train_loss: 1.2532, test_loss: 1.3030, test_f1: 0.2281
 epoch: 24, train_loss: 1.2531, test_loss: 1.3061, test_f1: 0.2281
 epoch: 25, train_loss: 1.2537, test_loss: 1.3042, test_f1: 0.2281
 epoch: 26, train_loss: 1.2553, test_loss: 1.3034, test_f1: 0.2281
 epoch: 27, train_loss: 1.2535, test_loss: 1.3042, test_f1: 0.2281
 epoch: 28, train_loss: 1.2530, test_loss: 1.3044, test_f1: 0.2281
 epoch: 29, train_loss: 1.2527, test_loss: 1.3045, test_f1: 0.2281
 epoch: 30, train_loss: 1.2542, test_loss: 1.3101, test_f1: 0.2281
 epoch: 31, train_loss: 1.2521, test_loss: 1.3018, test_f1: 0.2281
 epoch: 32, train_loss: 1.2530, test_loss: 1.3029, test_f1: 0.2281
 epoch: 33, train_loss: 1.2534, test_loss: 1.3131, test_f1: 0.2281
 epoch: 34, train_loss: 1.2526, test_loss: 1.3033, test_f1: 0.2281
 epoch: 35, train_loss: 1.2534, test_loss: 1.3023, test_f1: 0.2281
 epoch: 36, train_loss: 1.2527, test_loss: 1.3045, test_f1: 0.2281
 epoch: 37, train_loss: 1.2524, test_loss: 1.3072, test_f1: 0.2281
 epoch: 38, train_loss: 1.2526, test_loss: 1.3051, test_f1: 0.2281
 epoch: 39, train_loss: 1.2530, test_loss: 1.3027, test_f1: 0.2281
 epoch: 40, train_loss: 1.2528, test_loss: 1.3039, test_f1: 0.2281
 epoch: 41, train_loss: 1.2531, test_loss: 1.3062, test_f1: 0.2281
 epoch: 42, train_loss: 1.2532, test_loss: 1.3031, test_f1: 0.2281
 epoch: 43, train_loss: 1.2519, test_loss: 1.3083, test_f1: 0.2281
 epoch: 44, train_loss: 1.2531, test_loss: 1.3053, test_f1: 0.2281
 epoch: 45, train_loss: 1.2529, test_loss: 1.3068, test_f1: 0.2281
 epoch: 46, train_loss: 1.2545, test_loss: 1.3059, test_f1: 0.2281
 epoch: 47, train_loss: 1.2521, test_loss: 1.3046, test_f1: 0.2281
 epoch: 48, train_loss: 1.2531, test_loss: 1.3030, test_f1: 0.2281
 epoch: 49, train_loss: 1.2534, test_loss: 1.3019, test_f1: 0.2281
 epoch: 50, train_loss: 1.2532, test_loss: 1.3073, test_f1: 0.2281
 epoch: 51, train_loss: 1.2535, test_loss: 1.3050, test_f1: 0.2281
 epoch: 52, train_loss: 1.2518, test_loss: 1.3044, test_f1: 0.2281
 epoch: 53, train_loss: 1.2532, test_loss: 1.3049, test_f1: 0.2281
 epoch: 54, train_loss: 1.2525, test_loss: 1.3055, test_f1: 0.2281
 epoch: 55, train_loss: 1.2531, test_loss: 1.3030, test_f1: 0.2281
 epoch: 56, train_loss: 1.2527, test_loss: 1.3048, test_f1: 0.2281
 epoch: 57, train_loss: 1.2532, test_loss: 1.3079, test_f1: 0.2281
 epoch: 58, train_loss: 1.2533, test_loss: 1.3056, test_f1: 0.2281
 epoch: 59, train_loss: 1.2521, test_loss: 1.3058, test_f1: 0.2281
 epoch: 60, train_loss: 1.2522, test_loss: 1.3048, test_f1: 0.2281
 epoch: 61, train_loss: 1.2524, test_loss: 1.3042, test_f1: 0.2281
 epoch: 62, train_loss: 1.2529, test_loss: 1.3026, test_f1: 0.2281
 epoch: 63, train_loss: 1.2528, test_loss: 1.3036, test_f1: 0.2281
 epoch: 64, train_loss: 1.2530, test_loss: 1.3028, test_f1: 0.2281
 epoch: 65, train_loss: 1.2532, test_loss: 1.3039, test_f1: 0.2281
 epoch: 66, train_loss: 1.2527, test_loss: 1.3046, test_f1: 0.2281
 epoch: 67, train_loss: 1.2529, test_loss: 1.3063, test_f1: 0.2281
 epoch: 68, train_loss: 1.2522, test_loss: 1.3035, test_f1: 0.2281
 epoch: 69, train_loss: 1.2525, test_loss: 1.3046, test_f1: 0.2281
 epoch: 70, train_loss: 1.2524, test_loss: 1.3038, test_f1: 0.2281
 epoch: 71, train_loss: 1.2525, test_loss: 1.3048, test_f1: 0.2281
 epoch: 72, train_loss: 1.2524, test_loss: 1.3039, test_f1: 0.2281
 epoch: 73, train_loss: 1.2527, test_loss: 1.3071, test_f1: 0.2281
 epoch: 74, train_loss: 1.2539, test_loss: 1.3065, test_f1: 0.2281
 epoch: 75, train_loss: 1.2524, test_loss: 1.3033, test_f1: 0.2281
 epoch: 76, train_loss: 1.2528, test_loss: 1.3040, test_f1: 0.2281
 epoch: 77, train_loss: 1.2537, test_loss: 1.3031, test_f1: 0.2281
 epoch: 78, train_loss: 1.2532, test_loss: 1.3046, test_f1: 0.2281
 epoch: 79, train_loss: 1.2536, test_loss: 1.3065, test_f1: 0.2281
 epoch: 80, train_loss: 1.2518, test_loss: 1.3020, test_f1: 0.2281
 epoch: 81, train_loss: 1.2538, test_loss: 1.3029, test_f1: 0.2281
 epoch: 82, train_loss: 1.2538, test_loss: 1.3050, test_f1: 0.2281
 epoch: 83, train_loss: 1.2520, test_loss: 1.3057, test_f1: 0.2281
 epoch: 84, train_loss: 1.2531, test_loss: 1.3050, test_f1: 0.2281
 epoch: 85, train_loss: 1.2522, test_loss: 1.3035, test_f1: 0.2281
 epoch: 86, train_loss: 1.2523, test_loss: 1.3040, test_f1: 0.2281
 epoch: 87, train_loss: 1.2527, test_loss: 1.3030, test_f1: 0.2281
 epoch: 88, train_loss: 1.2526, test_loss: 1.3037, test_f1: 0.2281
 epoch: 89, train_loss: 1.2523, test_loss: 1.3075, test_f1: 0.2281
 epoch: 90, train_loss: 1.2526, test_loss: 1.3047, test_f1: 0.2281
 epoch: 91, train_loss: 1.2524, test_loss: 1.3035, test_f1: 0.2281
 epoch: 92, train_loss: 1.2528, test_loss: 1.3060, test_f1: 0.2281
 epoch: 93, train_loss: 1.2526, test_loss: 1.3054, test_f1: 0.2281
 epoch: 94, train_loss: 1.2522, test_loss: 1.3026, test_f1: 0.2281
 epoch: 95, train_loss: 1.2523, test_loss: 1.3043, test_f1: 0.2281
 epoch: 96, train_loss: 1.2522, test_loss: 1.3043, test_f1: 0.2281
 epoch: 97, train_loss: 1.2529, test_loss: 1.3022, test_f1: 0.2281
 epoch: 98, train_loss: 1.2527, test_loss: 1.3037, test_f1: 0.2281
 epoch: 99, train_loss: 1.2520, test_loss: 1.3044, test_f1: 0.2281
##################ITERATION #9 ****************************************
 epoch: 0, train_loss: 1.2584, test_loss: 1.3016, test_f1: 0.2281
 epoch: 1, train_loss: 1.2538, test_loss: 1.3023, test_f1: 0.2281
 epoch: 2, train_loss: 1.2535, test_loss: 1.3030, test_f1: 0.2281
 epoch: 3, train_loss: 1.2535, test_loss: 1.3040, test_f1: 0.2281
 epoch: 4, train_loss: 1.2532, test_loss: 1.3045, test_f1: 0.2281
 epoch: 5, train_loss: 1.2535, test_loss: 1.3064, test_f1: 0.2281
 epoch: 6, train_loss: 1.2527, test_loss: 1.3044, test_f1: 0.2281
 epoch: 7, train_loss: 1.2542, test_loss: 1.3018, test_f1: 0.2281
 epoch: 8, train_loss: 1.2541, test_loss: 1.3060, test_f1: 0.2281
 epoch: 9, train_loss: 1.2529, test_loss: 1.3029, test_f1: 0.2281
 epoch: 10, train_loss: 1.2527, test_loss: 1.3064, test_f1: 0.2281
 epoch: 11, train_loss: 1.2526, test_loss: 1.3036, test_f1: 0.2281
 epoch: 12, train_loss: 1.2547, test_loss: 1.3046, test_f1: 0.2281
 epoch: 13, train_loss: 1.2542, test_loss: 1.3080, test_f1: 0.2281
 epoch: 14, train_loss: 1.2532, test_loss: 1.3036, test_f1: 0.2281
 epoch: 15, train_loss: 1.2534, test_loss: 1.3044, test_f1: 0.2281
 epoch: 16, train_loss: 1.2540, test_loss: 1.3016, test_f1: 0.2281
 epoch: 17, train_loss: 1.2554, test_loss: 1.3038, test_f1: 0.2281
 epoch: 18, train_loss: 1.2549, test_loss: 1.3053, test_f1: 0.2281
 epoch: 19, train_loss: 1.2533, test_loss: 1.3016, test_f1: 0.2281
 epoch: 20, train_loss: 1.2534, test_loss: 1.3066, test_f1: 0.2281
 epoch: 21, train_loss: 1.2522, test_loss: 1.3022, test_f1: 0.2281
 epoch: 22, train_loss: 1.2527, test_loss: 1.3075, test_f1: 0.2281
 epoch: 23, train_loss: 1.2532, test_loss: 1.3057, test_f1: 0.2281
 epoch: 24, train_loss: 1.2532, test_loss: 1.3060, test_f1: 0.2281
 epoch: 25, train_loss: 1.2528, test_loss: 1.3013, test_f1: 0.2281
 epoch: 26, train_loss: 1.2528, test_loss: 1.3039, test_f1: 0.2281
 epoch: 27, train_loss: 1.2535, test_loss: 1.3083, test_f1: 0.2281
 epoch: 28, train_loss: 1.2537, test_loss: 1.3012, test_f1: 0.2281
 epoch: 29, train_loss: 1.2539, test_loss: 1.3075, test_f1: 0.2281
 epoch: 30, train_loss: 1.2544, test_loss: 1.3026, test_f1: 0.2281
 epoch: 31, train_loss: 1.2532, test_loss: 1.3073, test_f1: 0.2281
 epoch: 32, train_loss: 1.2529, test_loss: 1.3023, test_f1: 0.2281
 epoch: 33, train_loss: 1.2549, test_loss: 1.3041, test_f1: 0.2281
 epoch: 34, train_loss: 1.2525, test_loss: 1.3039, test_f1: 0.2281
 epoch: 35, train_loss: 1.2532, test_loss: 1.3039, test_f1: 0.2281
 epoch: 36, train_loss: 1.2540, test_loss: 1.3052, test_f1: 0.2281
 epoch: 37, train_loss: 1.2531, test_loss: 1.3042, test_f1: 0.2281
 epoch: 38, train_loss: 1.2535, test_loss: 1.3020, test_f1: 0.2281
 epoch: 39, train_loss: 1.2544, test_loss: 1.3042, test_f1: 0.2281
 epoch: 40, train_loss: 1.2541, test_loss: 1.3108, test_f1: 0.2281
 epoch: 41, train_loss: 1.2535, test_loss: 1.3021, test_f1: 0.2281
 epoch: 42, train_loss: 1.2531, test_loss: 1.3043, test_f1: 0.2281
 epoch: 43, train_loss: 1.2531, test_loss: 1.3034, test_f1: 0.2281
 epoch: 44, train_loss: 1.2532, test_loss: 1.3020, test_f1: 0.2281
 epoch: 45, train_loss: 1.2530, test_loss: 1.3060, test_f1: 0.2281
 epoch: 46, train_loss: 1.2531, test_loss: 1.3025, test_f1: 0.2281
 epoch: 47, train_loss: 1.2533, test_loss: 1.3067, test_f1: 0.2281
 epoch: 48, train_loss: 1.2543, test_loss: 1.3059, test_f1: 0.2281
 epoch: 49, train_loss: 1.2538, test_loss: 1.3036, test_f1: 0.2281
 epoch: 50, train_loss: 1.2529, test_loss: 1.3048, test_f1: 0.2281
 epoch: 51, train_loss: 1.2525, test_loss: 1.3057, test_f1: 0.2281
 epoch: 52, train_loss: 1.2522, test_loss: 1.3035, test_f1: 0.2281
 epoch: 53, train_loss: 1.2526, test_loss: 1.3023, test_f1: 0.2281
 epoch: 54, train_loss: 1.2523, test_loss: 1.3038, test_f1: 0.2281
 epoch: 55, train_loss: 1.2522, test_loss: 1.3068, test_f1: 0.2281
 epoch: 56, train_loss: 1.2529, test_loss: 1.3063, test_f1: 0.2281
 epoch: 57, train_loss: 1.2533, test_loss: 1.3055, test_f1: 0.2281
 epoch: 58, train_loss: 1.2522, test_loss: 1.3056, test_f1: 0.2281
 epoch: 59, train_loss: 1.2527, test_loss: 1.3054, test_f1: 0.2281
 epoch: 60, train_loss: 1.2526, test_loss: 1.3058, test_f1: 0.2281
 epoch: 61, train_loss: 1.2520, test_loss: 1.3035, test_f1: 0.2281
 epoch: 62, train_loss: 1.2528, test_loss: 1.3036, test_f1: 0.2281
 epoch: 63, train_loss: 1.2524, test_loss: 1.3038, test_f1: 0.2281
 epoch: 64, train_loss: 1.2521, test_loss: 1.3049, test_f1: 0.2281
 epoch: 65, train_loss: 1.2526, test_loss: 1.3043, test_f1: 0.2281
 epoch: 66, train_loss: 1.2526, test_loss: 1.3068, test_f1: 0.2281
 epoch: 67, train_loss: 1.2522, test_loss: 1.3018, test_f1: 0.2281
 epoch: 68, train_loss: 1.2527, test_loss: 1.3023, test_f1: 0.2281
 epoch: 69, train_loss: 1.2526, test_loss: 1.3035, test_f1: 0.2281
 epoch: 70, train_loss: 1.2523, test_loss: 1.3045, test_f1: 0.2281
 epoch: 71, train_loss: 1.2525, test_loss: 1.3069, test_f1: 0.2281
 epoch: 72, train_loss: 1.2529, test_loss: 1.3072, test_f1: 0.2281
 epoch: 73, train_loss: 1.2524, test_loss: 1.3065, test_f1: 0.2281
 epoch: 74, train_loss: 1.2523, test_loss: 1.3041, test_f1: 0.2281
 epoch: 75, train_loss: 1.2523, test_loss: 1.3042, test_f1: 0.2281
 epoch: 76, train_loss: 1.2528, test_loss: 1.3023, test_f1: 0.2281
 epoch: 77, train_loss: 1.2522, test_loss: 1.3050, test_f1: 0.2281
 epoch: 78, train_loss: 1.2522, test_loss: 1.3067, test_f1: 0.2281
 epoch: 79, train_loss: 1.2527, test_loss: 1.3072, test_f1: 0.2281
 epoch: 80, train_loss: 1.2525, test_loss: 1.3031, test_f1: 0.2281
 epoch: 81, train_loss: 1.2534, test_loss: 1.3040, test_f1: 0.2281
 epoch: 82, train_loss: 1.2534, test_loss: 1.3076, test_f1: 0.2281
 epoch: 83, train_loss: 1.2523, test_loss: 1.3055, test_f1: 0.2281
 epoch: 84, train_loss: 1.2523, test_loss: 1.3029, test_f1: 0.2281
 epoch: 85, train_loss: 1.2525, test_loss: 1.3040, test_f1: 0.2281
 epoch: 86, train_loss: 1.2527, test_loss: 1.3035, test_f1: 0.2281
 epoch: 87, train_loss: 1.2523, test_loss: 1.3059, test_f1: 0.2281
 epoch: 88, train_loss: 1.2526, test_loss: 1.3056, test_f1: 0.2281
 epoch: 89, train_loss: 1.2524, test_loss: 1.3034, test_f1: 0.2281
 epoch: 90, train_loss: 1.2534, test_loss: 1.3024, test_f1: 0.2281
 epoch: 91, train_loss: 1.2543, test_loss: 1.3090, test_f1: 0.2281
 epoch: 92, train_loss: 1.2528, test_loss: 1.3065, test_f1: 0.2281
 epoch: 93, train_loss: 1.2522, test_loss: 1.3050, test_f1: 0.2281
 epoch: 94, train_loss: 1.2527, test_loss: 1.3061, test_f1: 0.2281
 epoch: 95, train_loss: 1.2530, test_loss: 1.3000, test_f1: 0.2281
 epoch: 96, train_loss: 1.2526, test_loss: 1.3030, test_f1: 0.2281
 epoch: 97, train_loss: 1.2525, test_loss: 1.3039, test_f1: 0.2281
 epoch: 98, train_loss: 1.2527, test_loss: 1.3028, test_f1: 0.2281
 epoch: 99, train_loss: 1.2527, test_loss: 1.3045, test_f1: 0.2281

Training completed in 340.54 seconds
Best F1: 0.4663 at epoch 97
Mean F1 across iterations: 0.3051  0.0834
========================FINAL RESULTS================================
FEGIN weighted F1: 0.4663  0.0834
python main.py --data ltspice_demos --representation component_pin_net --model FEGIN --layers 3 --hiddens 16 --batch_size 128 --lr 0.1 --emb_size 128 --epochs 100 --save_appendix component_pin_net_L3_H16_BS128_LR0.1_E128 --no_val
-----



STDERR:
  File "main.py", line 370, in <module>
    main()
  File "main.py", line 254, in main
    dataset = dataset_class(
  File "/home/philip/projects/ltspice_examples_code_repo/Circuit-Completion-Using-GNNs/component_classification_with_link_prediction_head/evaluation/FEGIN/kernel/circuit_datasets.py", line 15, in __init__
    self.data, self.slices = torch.load(self.processed_paths[0])
  File "/home/philip/.local/lib/python3.8/site-packages/torch/serialization.py", line 1040, in load
    warnings.warn(
  File "/usr/lib/python3.8/warnings.py", line 109, in _showwarnmsg
    sw(msg.message, msg.category, msg.filename, msg.lineno,
  File "main.py", line 47, in warn_with_traceback
    traceback.print_stack(file=log)
/home/philip/projects/ltspice_examples_code_repo/Circuit-Completion-Using-GNNs/component_classification_with_link_prediction_head/evaluation/FEGIN/kernel/circuit_datasets.py:15: FutureWarning: You are using `torch.load` with `weights_only=False` (the current default value), which uses the default pickle module implicitly. It is possible to construct malicious pickle data which will execute arbitrary code during unpickling (See https://github.com/pytorch/pytorch/blob/main/SECURITY.md#untrusted-models for more details). In a future release, the default value for `weights_only` will be flipped to `True`. This limits the functions that could be executed during unpickling. Arbitrary objects will no longer be allowed to be loaded via this mode unless they are explicitly allowlisted by the user via `torch.serialization.add_safe_globals`. We recommend you start setting `weights_only=True` for any use case where you don't have full control of the loaded file. Please open an issue on GitHub for any issues related to this experimental feature.
  self.data, self.slices = torch.load(self.processed_paths[0])
