STDOUT:
Results will be saved in /home/philip/projects/ltspice_examples_code_repo/Circuit-Completion-Using-GNNs/component_classification_with_link_prediction_head/evaluation/FEGIN/results/model_FEGIN_dataset_ltspice_examples
Command line input: python main.py --data ltspice_examples --representation component_pin --model FEGIN --layers 5 --hiddens 64 --batch_size 128 --lr 0.001 --emb_size 250 --epochs 100 --save_appendix component_pin_L5_H64_BS128_LR0.001_E250 --no_val
 is saved.
-----
ltspice_examples - FEGIN
Using 5 layers, 64 hidden units, h = 2
Loading component_pin representation dataset
ENTERED
Training FEGIN on component_pin representation
Train: 3560, Test: 848
##################ITERATION #0 ****************************************
 epoch: 0, train_loss: 1.2984, test_loss: 1.2790, test_f1: 0.2528
 epoch: 1, train_loss: 1.1514, test_loss: 1.2492, test_f1: 0.2721
 epoch: 2, train_loss: 1.0478, test_loss: 1.0864, test_f1: 0.4212
 epoch: 3, train_loss: 0.9944, test_loss: 0.9801, test_f1: 0.5009
 epoch: 4, train_loss: 0.9594, test_loss: 0.9714, test_f1: 0.5024
 epoch: 5, train_loss: 0.9258, test_loss: 0.9859, test_f1: 0.5223
 epoch: 6, train_loss: 0.9000, test_loss: 1.1284, test_f1: 0.4446
 epoch: 7, train_loss: 0.8726, test_loss: 0.9562, test_f1: 0.5067
 epoch: 8, train_loss: 0.8661, test_loss: 0.9327, test_f1: 0.5274
 epoch: 9, train_loss: 0.8392, test_loss: 0.9895, test_f1: 0.5103
 epoch: 10, train_loss: 0.8071, test_loss: 0.8959, test_f1: 0.5362
 epoch: 11, train_loss: 0.8163, test_loss: 0.9000, test_f1: 0.5562
 epoch: 12, train_loss: 0.7841, test_loss: 0.9509, test_f1: 0.5695
 epoch: 13, train_loss: 0.7603, test_loss: 0.9147, test_f1: 0.5293
 epoch: 14, train_loss: 0.7476, test_loss: 0.9461, test_f1: 0.5536
 epoch: 15, train_loss: 0.7458, test_loss: 0.9408, test_f1: 0.5834
 epoch: 16, train_loss: 0.7211, test_loss: 0.9280, test_f1: 0.5225
 epoch: 17, train_loss: 0.7335, test_loss: 0.8897, test_f1: 0.5592
 epoch: 18, train_loss: 0.7139, test_loss: 0.8848, test_f1: 0.5823
 epoch: 19, train_loss: 0.7056, test_loss: 0.9023, test_f1: 0.5952
 epoch: 20, train_loss: 0.6927, test_loss: 0.9503, test_f1: 0.5762
 epoch: 21, train_loss: 0.6733, test_loss: 0.8878, test_f1: 0.5774
 epoch: 22, train_loss: 0.6428, test_loss: 1.0180, test_f1: 0.5610
 epoch: 23, train_loss: 0.6334, test_loss: 1.0216, test_f1: 0.5844
 epoch: 24, train_loss: 0.6487, test_loss: 1.1864, test_f1: 0.4950
 epoch: 25, train_loss: 0.6281, test_loss: 0.9921, test_f1: 0.5323
 epoch: 26, train_loss: 0.6185, test_loss: 0.9674, test_f1: 0.5647
 epoch: 27, train_loss: 0.6253, test_loss: 0.8665, test_f1: 0.6367
 epoch: 28, train_loss: 0.6098, test_loss: 1.0138, test_f1: 0.5925
 epoch: 29, train_loss: 0.6209, test_loss: 0.9181, test_f1: 0.6363
 epoch: 30, train_loss: 0.5901, test_loss: 0.9767, test_f1: 0.6300
 epoch: 31, train_loss: 0.5738, test_loss: 0.8375, test_f1: 0.5865
 epoch: 32, train_loss: 0.5897, test_loss: 1.0370, test_f1: 0.5735
 epoch: 33, train_loss: 0.5702, test_loss: 0.9558, test_f1: 0.6047
 epoch: 34, train_loss: 0.5654, test_loss: 1.2640, test_f1: 0.5747
 epoch: 35, train_loss: 0.5523, test_loss: 1.0098, test_f1: 0.5917
 epoch: 36, train_loss: 0.5837, test_loss: 0.9893, test_f1: 0.6071
 epoch: 37, train_loss: 0.5461, test_loss: 1.0801, test_f1: 0.5562
 epoch: 38, train_loss: 0.5697, test_loss: 1.1350, test_f1: 0.6188
 epoch: 39, train_loss: 0.5693, test_loss: 0.9370, test_f1: 0.6212
 epoch: 40, train_loss: 0.5380, test_loss: 1.0358, test_f1: 0.6019
 epoch: 41, train_loss: 0.5255, test_loss: 1.0424, test_f1: 0.6432
 epoch: 42, train_loss: 0.5100, test_loss: 1.0804, test_f1: 0.6106
 epoch: 43, train_loss: 0.5178, test_loss: 1.0559, test_f1: 0.6286
 epoch: 44, train_loss: 0.4996, test_loss: 1.0273, test_f1: 0.5908
 epoch: 45, train_loss: 0.4961, test_loss: 1.1593, test_f1: 0.6225
 epoch: 46, train_loss: 0.4846, test_loss: 1.1618, test_f1: 0.6116
 epoch: 47, train_loss: 0.4769, test_loss: 1.1299, test_f1: 0.6155
 epoch: 48, train_loss: 0.4978, test_loss: 1.2710, test_f1: 0.5967
 epoch: 49, train_loss: 0.4746, test_loss: 1.0898, test_f1: 0.6288
 epoch: 50, train_loss: 0.4609, test_loss: 1.2573, test_f1: 0.6220
 epoch: 51, train_loss: 0.4366, test_loss: 1.1646, test_f1: 0.6275
 epoch: 52, train_loss: 0.4032, test_loss: 1.2635, test_f1: 0.6398
 epoch: 53, train_loss: 0.3861, test_loss: 1.2604, test_f1: 0.6405
 epoch: 54, train_loss: 0.3988, test_loss: 1.3335, test_f1: 0.6105
 epoch: 55, train_loss: 0.3893, test_loss: 1.2784, test_f1: 0.6196
 epoch: 56, train_loss: 0.3716, test_loss: 1.2897, test_f1: 0.6139
 epoch: 57, train_loss: 0.3638, test_loss: 1.3678, test_f1: 0.6100
 epoch: 58, train_loss: 0.3703, test_loss: 1.3579, test_f1: 0.6387
 epoch: 59, train_loss: 0.3711, test_loss: 1.3839, test_f1: 0.5991
 epoch: 60, train_loss: 0.3560, test_loss: 1.3972, test_f1: 0.6180
 epoch: 61, train_loss: 0.3663, test_loss: 1.2992, test_f1: 0.6310
 epoch: 62, train_loss: 0.3523, test_loss: 1.3234, test_f1: 0.6061
 epoch: 63, train_loss: 0.3421, test_loss: 1.5445, test_f1: 0.6081
 epoch: 64, train_loss: 0.3491, test_loss: 1.3912, test_f1: 0.6401
 epoch: 65, train_loss: 0.3435, test_loss: 1.4420, test_f1: 0.6019
 epoch: 66, train_loss: 0.3437, test_loss: 1.5640, test_f1: 0.6202
 epoch: 67, train_loss: 0.3442, test_loss: 1.3607, test_f1: 0.6153
 epoch: 68, train_loss: 0.3511, test_loss: 1.5085, test_f1: 0.6331
 epoch: 69, train_loss: 0.3368, test_loss: 1.5697, test_f1: 0.6193
 epoch: 70, train_loss: 0.3421, test_loss: 1.4558, test_f1: 0.6072
 epoch: 71, train_loss: 0.3324, test_loss: 1.6145, test_f1: 0.6166
 epoch: 72, train_loss: 0.3117, test_loss: 1.5326, test_f1: 0.6430
 epoch: 73, train_loss: 0.3102, test_loss: 1.5390, test_f1: 0.6560
 epoch: 74, train_loss: 0.3202, test_loss: 1.6374, test_f1: 0.6164
 epoch: 75, train_loss: 0.3070, test_loss: 1.6840, test_f1: 0.5953
 epoch: 76, train_loss: 0.3193, test_loss: 1.4775, test_f1: 0.6070
 epoch: 77, train_loss: 0.3050, test_loss: 1.4812, test_f1: 0.6184
 epoch: 78, train_loss: 0.2814, test_loss: 1.5795, test_f1: 0.6358
 epoch: 79, train_loss: 0.2695, test_loss: 1.6335, test_f1: 0.6176
 epoch: 80, train_loss: 0.2946, test_loss: 1.7998, test_f1: 0.5940
 epoch: 81, train_loss: 0.3147, test_loss: 1.5962, test_f1: 0.6598
 epoch: 82, train_loss: 0.3183, test_loss: 1.6291, test_f1: 0.6064
 epoch: 83, train_loss: 0.2817, test_loss: 1.7203, test_f1: 0.6209
 epoch: 84, train_loss: 0.2823, test_loss: 1.4874, test_f1: 0.6393
 epoch: 85, train_loss: 0.2822, test_loss: 1.8197, test_f1: 0.6248
 epoch: 86, train_loss: 0.3028, test_loss: 1.3791, test_f1: 0.6505
 epoch: 87, train_loss: 0.2918, test_loss: 1.3135, test_f1: 0.6165
 epoch: 88, train_loss: 0.2739, test_loss: 1.6086, test_f1: 0.6454
 epoch: 89, train_loss: 0.2775, test_loss: 1.5228, test_f1: 0.6166
 epoch: 90, train_loss: 0.2622, test_loss: 1.7487, test_f1: 0.6408
 epoch: 91, train_loss: 0.2695, test_loss: 1.5615, test_f1: 0.6443
 epoch: 92, train_loss: 0.2587, test_loss: 1.7117, test_f1: 0.6419
 epoch: 93, train_loss: 0.2739, test_loss: 1.7332, test_f1: 0.6148
 epoch: 94, train_loss: 0.2554, test_loss: 1.7054, test_f1: 0.6360
 epoch: 95, train_loss: 0.2867, test_loss: 1.8237, test_f1: 0.6078
 epoch: 96, train_loss: 0.2538, test_loss: 1.6108, test_f1: 0.6217
 epoch: 97, train_loss: 0.2530, test_loss: 1.8957, test_f1: 0.6149
 epoch: 98, train_loss: 0.2550, test_loss: 1.7564, test_f1: 0.6202
 epoch: 99, train_loss: 0.2339, test_loss: 1.7781, test_f1: 0.6573
##################ITERATION #1 ****************************************
 epoch: 0, train_loss: 1.2002, test_loss: 1.2222, test_f1: 0.2383
 epoch: 1, train_loss: 1.0315, test_loss: 1.0115, test_f1: 0.4285
 epoch: 2, train_loss: 0.9592, test_loss: 0.9518, test_f1: 0.5199
 epoch: 3, train_loss: 0.9160, test_loss: 0.8979, test_f1: 0.5077
 epoch: 4, train_loss: 0.8925, test_loss: 1.0141, test_f1: 0.5012
 epoch: 5, train_loss: 0.8624, test_loss: 0.8911, test_f1: 0.5270
 epoch: 6, train_loss: 0.8515, test_loss: 0.9276, test_f1: 0.5246
 epoch: 7, train_loss: 0.8349, test_loss: 0.8517, test_f1: 0.5436
 epoch: 8, train_loss: 0.8185, test_loss: 0.9135, test_f1: 0.5441
 epoch: 9, train_loss: 0.7979, test_loss: 0.8866, test_f1: 0.5309
 epoch: 10, train_loss: 0.7735, test_loss: 1.0037, test_f1: 0.5321
 epoch: 11, train_loss: 0.7692, test_loss: 0.9788, test_f1: 0.5721
 epoch: 12, train_loss: 0.7729, test_loss: 0.8748, test_f1: 0.5742
 epoch: 13, train_loss: 0.7643, test_loss: 0.9655, test_f1: 0.5447
 epoch: 14, train_loss: 0.7342, test_loss: 0.9955, test_f1: 0.5392
 epoch: 15, train_loss: 0.7306, test_loss: 0.8838, test_f1: 0.5879
 epoch: 16, train_loss: 0.7039, test_loss: 0.8414, test_f1: 0.5866
 epoch: 17, train_loss: 0.7098, test_loss: 1.0754, test_f1: 0.5494
 epoch: 18, train_loss: 0.7136, test_loss: 0.8795, test_f1: 0.5599
 epoch: 19, train_loss: 0.6958, test_loss: 0.8422, test_f1: 0.6227
 epoch: 20, train_loss: 0.6633, test_loss: 0.8894, test_f1: 0.6003
 epoch: 21, train_loss: 0.6677, test_loss: 0.8434, test_f1: 0.5881
 epoch: 22, train_loss: 0.6681, test_loss: 0.9265, test_f1: 0.5699
 epoch: 23, train_loss: 0.6421, test_loss: 0.9873, test_f1: 0.5797
 epoch: 24, train_loss: 0.6517, test_loss: 0.9277, test_f1: 0.6010
 epoch: 25, train_loss: 0.6339, test_loss: 0.7930, test_f1: 0.6155
 epoch: 26, train_loss: 0.6294, test_loss: 0.8664, test_f1: 0.6304
 epoch: 27, train_loss: 0.6335, test_loss: 0.7662, test_f1: 0.6158
 epoch: 28, train_loss: 0.6115, test_loss: 1.0883, test_f1: 0.5881
 epoch: 29, train_loss: 0.5920, test_loss: 0.8935, test_f1: 0.6136
 epoch: 30, train_loss: 0.6289, test_loss: 0.9221, test_f1: 0.5778
 epoch: 31, train_loss: 0.6034, test_loss: 0.9422, test_f1: 0.5880
 epoch: 32, train_loss: 0.6087, test_loss: 0.8734, test_f1: 0.6067
 epoch: 33, train_loss: 0.5805, test_loss: 0.8013, test_f1: 0.6310
 epoch: 34, train_loss: 0.5494, test_loss: 0.8487, test_f1: 0.6475
 epoch: 35, train_loss: 0.5572, test_loss: 0.8849, test_f1: 0.6132
 epoch: 36, train_loss: 0.5379, test_loss: 0.8749, test_f1: 0.6105
 epoch: 37, train_loss: 0.5403, test_loss: 0.9549, test_f1: 0.5979
 epoch: 38, train_loss: 0.5482, test_loss: 0.8881, test_f1: 0.6134
 epoch: 39, train_loss: 0.5157, test_loss: 0.8429, test_f1: 0.6551
 epoch: 40, train_loss: 0.5201, test_loss: 0.8061, test_f1: 0.6609
 epoch: 41, train_loss: 0.5277, test_loss: 1.3309, test_f1: 0.5186
 epoch: 42, train_loss: 0.5216, test_loss: 0.8522, test_f1: 0.6104
 epoch: 43, train_loss: 0.5380, test_loss: 0.9302, test_f1: 0.6212
 epoch: 44, train_loss: 0.5073, test_loss: 1.0635, test_f1: 0.6056
 epoch: 45, train_loss: 0.5026, test_loss: 0.8690, test_f1: 0.6495
 epoch: 46, train_loss: 0.4752, test_loss: 0.9839, test_f1: 0.6120
 epoch: 47, train_loss: 0.4705, test_loss: 0.9056, test_f1: 0.6258
 epoch: 48, train_loss: 0.4685, test_loss: 1.1289, test_f1: 0.6147
 epoch: 49, train_loss: 0.4861, test_loss: 0.8957, test_f1: 0.6720
 epoch: 50, train_loss: 0.4714, test_loss: 0.9615, test_f1: 0.6457
 epoch: 51, train_loss: 0.4352, test_loss: 0.9026, test_f1: 0.6524
 epoch: 52, train_loss: 0.4107, test_loss: 1.0037, test_f1: 0.6602
 epoch: 53, train_loss: 0.3967, test_loss: 0.9667, test_f1: 0.6678
 epoch: 54, train_loss: 0.3856, test_loss: 0.9997, test_f1: 0.6323
 epoch: 55, train_loss: 0.3641, test_loss: 0.9945, test_f1: 0.6382
 epoch: 56, train_loss: 0.3847, test_loss: 0.9361, test_f1: 0.6576
 epoch: 57, train_loss: 0.3687, test_loss: 1.0236, test_f1: 0.6285
 epoch: 58, train_loss: 0.3602, test_loss: 1.0020, test_f1: 0.6294
 epoch: 59, train_loss: 0.3665, test_loss: 1.0323, test_f1: 0.6292
 epoch: 60, train_loss: 0.3799, test_loss: 1.0053, test_f1: 0.6598
 epoch: 61, train_loss: 0.3567, test_loss: 0.9068, test_f1: 0.6968
 epoch: 62, train_loss: 0.3451, test_loss: 1.0235, test_f1: 0.6708
 epoch: 63, train_loss: 0.3280, test_loss: 0.9946, test_f1: 0.6578
 epoch: 64, train_loss: 0.3301, test_loss: 1.0555, test_f1: 0.6464
 epoch: 65, train_loss: 0.3435, test_loss: 1.0650, test_f1: 0.6824
 epoch: 66, train_loss: 0.3512, test_loss: 1.0826, test_f1: 0.6588
 epoch: 67, train_loss: 0.3149, test_loss: 1.1828, test_f1: 0.6571
 epoch: 68, train_loss: 0.3190, test_loss: 1.2967, test_f1: 0.6277
 epoch: 69, train_loss: 0.3221, test_loss: 1.1676, test_f1: 0.6556
 epoch: 70, train_loss: 0.3157, test_loss: 1.2761, test_f1: 0.6525
 epoch: 71, train_loss: 0.3055, test_loss: 1.1717, test_f1: 0.6737
 epoch: 72, train_loss: 0.3039, test_loss: 1.2560, test_f1: 0.6504
 epoch: 73, train_loss: 0.3268, test_loss: 1.3865, test_f1: 0.6236
 epoch: 74, train_loss: 0.3128, test_loss: 1.1319, test_f1: 0.6513
 epoch: 75, train_loss: 0.3180, test_loss: 1.2721, test_f1: 0.6421
 epoch: 76, train_loss: 0.3057, test_loss: 1.1905, test_f1: 0.6547
 epoch: 77, train_loss: 0.2937, test_loss: 1.2748, test_f1: 0.6355
 epoch: 78, train_loss: 0.2870, test_loss: 1.2674, test_f1: 0.6655
 epoch: 79, train_loss: 0.3140, test_loss: 1.2507, test_f1: 0.6779
 epoch: 80, train_loss: 0.3029, test_loss: 1.2634, test_f1: 0.6651
 epoch: 81, train_loss: 0.2809, test_loss: 1.1926, test_f1: 0.6386
 epoch: 82, train_loss: 0.2823, test_loss: 1.2383, test_f1: 0.6739
 epoch: 83, train_loss: 0.2650, test_loss: 1.3277, test_f1: 0.6474
 epoch: 84, train_loss: 0.2734, test_loss: 1.5283, test_f1: 0.6377
 epoch: 85, train_loss: 0.2815, test_loss: 1.3357, test_f1: 0.6327
 epoch: 86, train_loss: 0.2694, test_loss: 1.3589, test_f1: 0.6530
 epoch: 87, train_loss: 0.2544, test_loss: 1.4392, test_f1: 0.6343
 epoch: 88, train_loss: 0.2643, test_loss: 1.3155, test_f1: 0.6375
 epoch: 89, train_loss: 0.2558, test_loss: 1.5351, test_f1: 0.6172
 epoch: 90, train_loss: 0.2722, test_loss: 1.5133, test_f1: 0.6587
 epoch: 91, train_loss: 0.2360, test_loss: 1.4808, test_f1: 0.6827
 epoch: 92, train_loss: 0.2273, test_loss: 1.4869, test_f1: 0.6707
 epoch: 93, train_loss: 0.2407, test_loss: 1.4473, test_f1: 0.6674
 epoch: 94, train_loss: 0.2547, test_loss: 1.7467, test_f1: 0.6098
 epoch: 95, train_loss: 0.2487, test_loss: 1.4967, test_f1: 0.6359
 epoch: 96, train_loss: 0.2616, test_loss: 1.4124, test_f1: 0.6763
 epoch: 97, train_loss: 0.2472, test_loss: 1.6867, test_f1: 0.6233
 epoch: 98, train_loss: 0.2580, test_loss: 1.4601, test_f1: 0.6696
 epoch: 99, train_loss: 0.2443, test_loss: 1.5997, test_f1: 0.5944
##################ITERATION #2 ****************************************
 epoch: 0, train_loss: 1.1749, test_loss: 1.3104, test_f1: 0.2429
 epoch: 1, train_loss: 0.9936, test_loss: 1.0587, test_f1: 0.4370
 epoch: 2, train_loss: 0.9242, test_loss: 1.0291, test_f1: 0.5113
 epoch: 3, train_loss: 0.8844, test_loss: 0.9225, test_f1: 0.5282
 epoch: 4, train_loss: 0.8712, test_loss: 0.8778, test_f1: 0.5279
 epoch: 5, train_loss: 0.8457, test_loss: 0.8893, test_f1: 0.5601
 epoch: 6, train_loss: 0.8221, test_loss: 0.8576, test_f1: 0.5790
 epoch: 7, train_loss: 0.8002, test_loss: 0.9856, test_f1: 0.5409
 epoch: 8, train_loss: 0.7672, test_loss: 0.9581, test_f1: 0.5660
 epoch: 9, train_loss: 0.7531, test_loss: 0.7959, test_f1: 0.5876
 epoch: 10, train_loss: 0.7465, test_loss: 0.8986, test_f1: 0.5601
 epoch: 11, train_loss: 0.7304, test_loss: 0.8837, test_f1: 0.5819
 epoch: 12, train_loss: 0.7165, test_loss: 0.8072, test_f1: 0.6121
 epoch: 13, train_loss: 0.6915, test_loss: 0.8564, test_f1: 0.5594
 epoch: 14, train_loss: 0.6917, test_loss: 0.8729, test_f1: 0.5989
 epoch: 15, train_loss: 0.6722, test_loss: 0.8548, test_f1: 0.5786
 epoch: 16, train_loss: 0.6791, test_loss: 0.9085, test_f1: 0.5870
 epoch: 17, train_loss: 0.6508, test_loss: 0.8961, test_f1: 0.5954
 epoch: 18, train_loss: 0.6459, test_loss: 0.9495, test_f1: 0.5963
 epoch: 19, train_loss: 0.6534, test_loss: 0.9277, test_f1: 0.6008
 epoch: 20, train_loss: 0.6394, test_loss: 0.8404, test_f1: 0.6375
 epoch: 21, train_loss: 0.6139, test_loss: 0.8418, test_f1: 0.5751
 epoch: 22, train_loss: 0.6285, test_loss: 0.8926, test_f1: 0.6031
 epoch: 23, train_loss: 0.6074, test_loss: 0.8379, test_f1: 0.6395
 epoch: 24, train_loss: 0.5946, test_loss: 0.9305, test_f1: 0.5921
 epoch: 25, train_loss: 0.5814, test_loss: 0.9258, test_f1: 0.6214
 epoch: 26, train_loss: 0.5847, test_loss: 0.9265, test_f1: 0.6261
 epoch: 27, train_loss: 0.5818, test_loss: 0.9035, test_f1: 0.6370
 epoch: 28, train_loss: 0.5622, test_loss: 0.8557, test_f1: 0.6427
 epoch: 29, train_loss: 0.5608, test_loss: 0.9483, test_f1: 0.6037
 epoch: 30, train_loss: 0.5571, test_loss: 0.9215, test_f1: 0.6177
 epoch: 31, train_loss: 0.5282, test_loss: 1.1225, test_f1: 0.5688
 epoch: 32, train_loss: 0.5422, test_loss: 0.8873, test_f1: 0.6265
 epoch: 33, train_loss: 0.5204, test_loss: 0.8511, test_f1: 0.6337
 epoch: 34, train_loss: 0.5342, test_loss: 0.8890, test_f1: 0.6432
 epoch: 35, train_loss: 0.5160, test_loss: 0.9581, test_f1: 0.6337
 epoch: 36, train_loss: 0.5089, test_loss: 0.9664, test_f1: 0.6576
 epoch: 37, train_loss: 0.5049, test_loss: 0.9774, test_f1: 0.6417
 epoch: 38, train_loss: 0.4789, test_loss: 0.9887, test_f1: 0.6226
 epoch: 39, train_loss: 0.4839, test_loss: 0.9403, test_f1: 0.6225
 epoch: 40, train_loss: 0.4741, test_loss: 1.0382, test_f1: 0.6041
 epoch: 41, train_loss: 0.4468, test_loss: 1.0578, test_f1: 0.6445
 epoch: 42, train_loss: 0.4474, test_loss: 0.9387, test_f1: 0.6609
 epoch: 43, train_loss: 0.4542, test_loss: 0.9879, test_f1: 0.6454
 epoch: 44, train_loss: 0.4694, test_loss: 0.9846, test_f1: 0.6582
 epoch: 45, train_loss: 0.4502, test_loss: 1.0974, test_f1: 0.6110
 epoch: 46, train_loss: 0.4509, test_loss: 1.0134, test_f1: 0.6717
 epoch: 47, train_loss: 0.4354, test_loss: 1.1697, test_f1: 0.5931
 epoch: 48, train_loss: 0.4120, test_loss: 1.0584, test_f1: 0.6228
 epoch: 49, train_loss: 0.4140, test_loss: 1.0378, test_f1: 0.6430
 epoch: 50, train_loss: 0.4125, test_loss: 1.0593, test_f1: 0.6354
 epoch: 51, train_loss: 0.3705, test_loss: 1.0544, test_f1: 0.6570
 epoch: 52, train_loss: 0.3541, test_loss: 1.0734, test_f1: 0.6452
 epoch: 53, train_loss: 0.3678, test_loss: 1.1416, test_f1: 0.6431
 epoch: 54, train_loss: 0.3166, test_loss: 1.0951, test_f1: 0.6503
 epoch: 55, train_loss: 0.3153, test_loss: 1.2158, test_f1: 0.6521
 epoch: 56, train_loss: 0.3108, test_loss: 1.1449, test_f1: 0.6740
 epoch: 57, train_loss: 0.3094, test_loss: 1.2248, test_f1: 0.6471
 epoch: 58, train_loss: 0.3038, test_loss: 1.1675, test_f1: 0.6782
 epoch: 59, train_loss: 0.3085, test_loss: 1.1886, test_f1: 0.6702
 epoch: 60, train_loss: 0.3005, test_loss: 1.3141, test_f1: 0.6503
 epoch: 61, train_loss: 0.2927, test_loss: 1.2362, test_f1: 0.6511
 epoch: 62, train_loss: 0.3065, test_loss: 1.3687, test_f1: 0.6461
 epoch: 63, train_loss: 0.2806, test_loss: 1.1970, test_f1: 0.6669
 epoch: 64, train_loss: 0.2862, test_loss: 1.3554, test_f1: 0.6615
 epoch: 65, train_loss: 0.2769, test_loss: 1.3116, test_f1: 0.6436
 epoch: 66, train_loss: 0.2701, test_loss: 1.4503, test_f1: 0.6412
 epoch: 67, train_loss: 0.2760, test_loss: 1.2379, test_f1: 0.6565
 epoch: 68, train_loss: 0.2649, test_loss: 1.3861, test_f1: 0.6470
 epoch: 69, train_loss: 0.2620, test_loss: 1.2802, test_f1: 0.6670
 epoch: 70, train_loss: 0.2613, test_loss: 1.5372, test_f1: 0.6553
 epoch: 71, train_loss: 0.2403, test_loss: 1.4287, test_f1: 0.6527
 epoch: 72, train_loss: 0.2470, test_loss: 1.4161, test_f1: 0.6490
 epoch: 73, train_loss: 0.2623, test_loss: 1.3177, test_f1: 0.6488
 epoch: 74, train_loss: 0.2706, test_loss: 1.4667, test_f1: 0.6530
 epoch: 75, train_loss: 0.2395, test_loss: 1.3898, test_f1: 0.6599
 epoch: 76, train_loss: 0.2376, test_loss: 1.3656, test_f1: 0.6588
 epoch: 77, train_loss: 0.2338, test_loss: 1.5029, test_f1: 0.6545
 epoch: 78, train_loss: 0.2450, test_loss: 1.7159, test_f1: 0.6343
 epoch: 79, train_loss: 0.2494, test_loss: 1.4269, test_f1: 0.6610
 epoch: 80, train_loss: 0.2159, test_loss: 1.4493, test_f1: 0.6716
 epoch: 81, train_loss: 0.2435, test_loss: 1.4885, test_f1: 0.6405
 epoch: 82, train_loss: 0.2277, test_loss: 1.3567, test_f1: 0.6707
 epoch: 83, train_loss: 0.2458, test_loss: 1.4074, test_f1: 0.6393
 epoch: 84, train_loss: 0.2295, test_loss: 1.6050, test_f1: 0.6388
 epoch: 85, train_loss: 0.2385, test_loss: 1.4028, test_f1: 0.6801
 epoch: 86, train_loss: 0.2154, test_loss: 1.3989, test_f1: 0.6646
 epoch: 87, train_loss: 0.2040, test_loss: 1.4821, test_f1: 0.6715
 epoch: 88, train_loss: 0.1933, test_loss: 1.5804, test_f1: 0.6492
 epoch: 89, train_loss: 0.2097, test_loss: 1.4285, test_f1: 0.6868
 epoch: 90, train_loss: 0.2145, test_loss: 1.5179, test_f1: 0.6601
 epoch: 91, train_loss: 0.2090, test_loss: 1.7039, test_f1: 0.6385
 epoch: 92, train_loss: 0.2236, test_loss: 1.5381, test_f1: 0.6588
 epoch: 93, train_loss: 0.2054, test_loss: 1.5817, test_f1: 0.6525
 epoch: 94, train_loss: 0.2025, test_loss: 1.7056, test_f1: 0.6518
 epoch: 95, train_loss: 0.1966, test_loss: 1.5686, test_f1: 0.6696
 epoch: 96, train_loss: 0.1953, test_loss: 1.5278, test_f1: 0.6701
 epoch: 97, train_loss: 0.1930, test_loss: 1.6433, test_f1: 0.6575
 epoch: 98, train_loss: 0.1888, test_loss: 1.5438, test_f1: 0.6842
 epoch: 99, train_loss: 0.1979, test_loss: 1.6943, test_f1: 0.6561
##################ITERATION #3 ****************************************
 epoch: 0, train_loss: 1.2117, test_loss: 1.2724, test_f1: 0.3263
 epoch: 1, train_loss: 1.0388, test_loss: 1.0019, test_f1: 0.4962
 epoch: 2, train_loss: 0.9951, test_loss: 1.0014, test_f1: 0.4700
 epoch: 3, train_loss: 0.9544, test_loss: 0.9919, test_f1: 0.5012
 epoch: 4, train_loss: 0.9354, test_loss: 0.9741, test_f1: 0.5162
 epoch: 5, train_loss: 0.9182, test_loss: 0.9111, test_f1: 0.5580
 epoch: 6, train_loss: 0.8889, test_loss: 1.0214, test_f1: 0.5512
 epoch: 7, train_loss: 0.8666, test_loss: 0.9467, test_f1: 0.4897
 epoch: 8, train_loss: 0.8476, test_loss: 0.9270, test_f1: 0.5867
 epoch: 9, train_loss: 0.8323, test_loss: 0.8937, test_f1: 0.5783
 epoch: 10, train_loss: 0.8088, test_loss: 0.9893, test_f1: 0.5115
 epoch: 11, train_loss: 0.7947, test_loss: 0.8928, test_f1: 0.5923
 epoch: 12, train_loss: 0.7765, test_loss: 0.8883, test_f1: 0.6032
 epoch: 13, train_loss: 0.7755, test_loss: 0.8762, test_f1: 0.5682
 epoch: 14, train_loss: 0.7573, test_loss: 0.9797, test_f1: 0.5659
 epoch: 15, train_loss: 0.7316, test_loss: 0.8154, test_f1: 0.6081
 epoch: 16, train_loss: 0.7249, test_loss: 0.8160, test_f1: 0.6012
 epoch: 17, train_loss: 0.7182, test_loss: 0.9131, test_f1: 0.6075
 epoch: 18, train_loss: 0.7130, test_loss: 0.7847, test_f1: 0.6454
 epoch: 19, train_loss: 0.6862, test_loss: 1.0682, test_f1: 0.5911
 epoch: 20, train_loss: 0.6917, test_loss: 0.9044, test_f1: 0.6019
 epoch: 21, train_loss: 0.6865, test_loss: 0.8215, test_f1: 0.6355
 epoch: 22, train_loss: 0.6570, test_loss: 0.7936, test_f1: 0.6475
 epoch: 23, train_loss: 0.6560, test_loss: 0.8492, test_f1: 0.6193
 epoch: 24, train_loss: 0.6417, test_loss: 0.8272, test_f1: 0.6271
 epoch: 25, train_loss: 0.6379, test_loss: 0.8318, test_f1: 0.6264
 epoch: 26, train_loss: 0.6396, test_loss: 0.8230, test_f1: 0.6363
 epoch: 27, train_loss: 0.6124, test_loss: 0.7772, test_f1: 0.6203
 epoch: 28, train_loss: 0.6062, test_loss: 0.8266, test_f1: 0.6557
 epoch: 29, train_loss: 0.6050, test_loss: 0.8707, test_f1: 0.6299
 epoch: 30, train_loss: 0.5996, test_loss: 0.8067, test_f1: 0.6355
 epoch: 31, train_loss: 0.5738, test_loss: 1.0170, test_f1: 0.5967
 epoch: 32, train_loss: 0.5901, test_loss: 0.8980, test_f1: 0.6076
 epoch: 33, train_loss: 0.5766, test_loss: 0.8499, test_f1: 0.6442
 epoch: 34, train_loss: 0.5590, test_loss: 0.7921, test_f1: 0.6477
 epoch: 35, train_loss: 0.5602, test_loss: 0.8040, test_f1: 0.6229
 epoch: 36, train_loss: 0.5566, test_loss: 0.9222, test_f1: 0.6184
 epoch: 37, train_loss: 0.5500, test_loss: 0.8836, test_f1: 0.6334
 epoch: 38, train_loss: 0.5330, test_loss: 0.8147, test_f1: 0.6518
 epoch: 39, train_loss: 0.5237, test_loss: 0.8477, test_f1: 0.6433
 epoch: 40, train_loss: 0.5196, test_loss: 0.8235, test_f1: 0.6495
 epoch: 41, train_loss: 0.5022, test_loss: 0.8287, test_f1: 0.6381
 epoch: 42, train_loss: 0.5125, test_loss: 1.0169, test_f1: 0.6174
 epoch: 43, train_loss: 0.4925, test_loss: 0.8840, test_f1: 0.6258
 epoch: 44, train_loss: 0.4787, test_loss: 0.9658, test_f1: 0.6034
 epoch: 45, train_loss: 0.4873, test_loss: 0.9179, test_f1: 0.6121
 epoch: 46, train_loss: 0.4762, test_loss: 0.8551, test_f1: 0.6612
 epoch: 47, train_loss: 0.4880, test_loss: 0.7990, test_f1: 0.6708
 epoch: 48, train_loss: 0.4633, test_loss: 0.8544, test_f1: 0.6396
 epoch: 49, train_loss: 0.4759, test_loss: 0.9786, test_f1: 0.5995
 epoch: 50, train_loss: 0.4503, test_loss: 0.8664, test_f1: 0.6445
 epoch: 51, train_loss: 0.4254, test_loss: 0.8722, test_f1: 0.6578
 epoch: 52, train_loss: 0.3931, test_loss: 0.8932, test_f1: 0.6579
 epoch: 53, train_loss: 0.3714, test_loss: 0.9682, test_f1: 0.6499
 epoch: 54, train_loss: 0.3672, test_loss: 0.9862, test_f1: 0.6211
 epoch: 55, train_loss: 0.3640, test_loss: 1.0204, test_f1: 0.6451
 epoch: 56, train_loss: 0.3657, test_loss: 0.9835, test_f1: 0.6504
 epoch: 57, train_loss: 0.3558, test_loss: 0.9953, test_f1: 0.6555
 epoch: 58, train_loss: 0.3559, test_loss: 1.1161, test_f1: 0.6214
 epoch: 59, train_loss: 0.3544, test_loss: 0.9612, test_f1: 0.6513
 epoch: 60, train_loss: 0.3429, test_loss: 0.9958, test_f1: 0.6526
 epoch: 61, train_loss: 0.3493, test_loss: 0.9815, test_f1: 0.6675
 epoch: 62, train_loss: 0.3369, test_loss: 1.1147, test_f1: 0.6457
 epoch: 63, train_loss: 0.3399, test_loss: 1.2020, test_f1: 0.6415
 epoch: 64, train_loss: 0.3220, test_loss: 1.0437, test_f1: 0.6597
 epoch: 65, train_loss: 0.3234, test_loss: 1.1051, test_f1: 0.6491
 epoch: 66, train_loss: 0.3276, test_loss: 0.9771, test_f1: 0.6751
 epoch: 67, train_loss: 0.3281, test_loss: 1.0416, test_f1: 0.6301
 epoch: 68, train_loss: 0.3115, test_loss: 1.0978, test_f1: 0.6248
 epoch: 69, train_loss: 0.3180, test_loss: 1.1646, test_f1: 0.6222
 epoch: 70, train_loss: 0.3088, test_loss: 1.0649, test_f1: 0.6673
 epoch: 71, train_loss: 0.3107, test_loss: 1.1159, test_f1: 0.6472
 epoch: 72, train_loss: 0.2972, test_loss: 1.2879, test_f1: 0.6199
 epoch: 73, train_loss: 0.2996, test_loss: 1.1741, test_f1: 0.6441
 epoch: 74, train_loss: 0.2926, test_loss: 1.3641, test_f1: 0.6102
 epoch: 75, train_loss: 0.3067, test_loss: 1.0721, test_f1: 0.6634
 epoch: 76, train_loss: 0.2940, test_loss: 1.1950, test_f1: 0.6391
 epoch: 77, train_loss: 0.2917, test_loss: 1.2484, test_f1: 0.6640
 epoch: 78, train_loss: 0.2926, test_loss: 1.1177, test_f1: 0.6606
 epoch: 79, train_loss: 0.2983, test_loss: 1.1524, test_f1: 0.6414
 epoch: 80, train_loss: 0.2796, test_loss: 1.2593, test_f1: 0.6325
 epoch: 81, train_loss: 0.2877, test_loss: 1.1663, test_f1: 0.6467
 epoch: 82, train_loss: 0.2730, test_loss: 1.1460, test_f1: 0.6513
 epoch: 83, train_loss: 0.2636, test_loss: 1.2482, test_f1: 0.6451
 epoch: 84, train_loss: 0.2664, test_loss: 1.4948, test_f1: 0.6225
 epoch: 85, train_loss: 0.2572, test_loss: 1.2856, test_f1: 0.6511
 epoch: 86, train_loss: 0.2584, test_loss: 1.5277, test_f1: 0.6165
 epoch: 87, train_loss: 0.2432, test_loss: 1.3490, test_f1: 0.6370
 epoch: 88, train_loss: 0.2488, test_loss: 1.3706, test_f1: 0.6398
 epoch: 89, train_loss: 0.2713, test_loss: 1.2775, test_f1: 0.6331
 epoch: 90, train_loss: 0.2626, test_loss: 1.2918, test_f1: 0.6573
 epoch: 91, train_loss: 0.2494, test_loss: 1.2992, test_f1: 0.6629
 epoch: 92, train_loss: 0.2586, test_loss: 1.4159, test_f1: 0.6310
 epoch: 93, train_loss: 0.2684, test_loss: 1.3570, test_f1: 0.6788
 epoch: 94, train_loss: 0.2604, test_loss: 1.2832, test_f1: 0.6542
 epoch: 95, train_loss: 0.2388, test_loss: 1.3355, test_f1: 0.6173
 epoch: 96, train_loss: 0.2262, test_loss: 1.3635, test_f1: 0.6478
 epoch: 97, train_loss: 0.2436, test_loss: 1.4689, test_f1: 0.6567
 epoch: 98, train_loss: 0.2245, test_loss: 1.3894, test_f1: 0.6579
 epoch: 99, train_loss: 0.2161, test_loss: 1.3325, test_f1: 0.6603
##################ITERATION #4 ****************************************
 epoch: 0, train_loss: 1.2390, test_loss: 1.2815, test_f1: 0.2478
 epoch: 1, train_loss: 1.0418, test_loss: 1.0310, test_f1: 0.4092
 epoch: 2, train_loss: 0.9689, test_loss: 0.9474, test_f1: 0.4821
 epoch: 3, train_loss: 0.9325, test_loss: 0.9283, test_f1: 0.4942
 epoch: 4, train_loss: 0.8969, test_loss: 0.9176, test_f1: 0.5290
 epoch: 5, train_loss: 0.8783, test_loss: 0.8993, test_f1: 0.5164
 epoch: 6, train_loss: 0.8605, test_loss: 0.9157, test_f1: 0.5143
 epoch: 7, train_loss: 0.8373, test_loss: 0.8997, test_f1: 0.5591
 epoch: 8, train_loss: 0.8124, test_loss: 0.9010, test_f1: 0.5499
 epoch: 9, train_loss: 0.7976, test_loss: 0.8766, test_f1: 0.5556
 epoch: 10, train_loss: 0.7798, test_loss: 0.8936, test_f1: 0.5463
 epoch: 11, train_loss: 0.7635, test_loss: 0.8771, test_f1: 0.5938
 epoch: 12, train_loss: 0.7516, test_loss: 0.9397, test_f1: 0.5330
 epoch: 13, train_loss: 0.7318, test_loss: 0.8974, test_f1: 0.5928
 epoch: 14, train_loss: 0.7317, test_loss: 0.8440, test_f1: 0.6033
 epoch: 15, train_loss: 0.7298, test_loss: 0.8625, test_f1: 0.5924
 epoch: 16, train_loss: 0.7116, test_loss: 0.8787, test_f1: 0.6084
 epoch: 17, train_loss: 0.6919, test_loss: 0.8730, test_f1: 0.5831
 epoch: 18, train_loss: 0.6864, test_loss: 0.9933, test_f1: 0.5509
 epoch: 19, train_loss: 0.6701, test_loss: 0.9238, test_f1: 0.6074
 epoch: 20, train_loss: 0.6757, test_loss: 0.9757, test_f1: 0.5885
 epoch: 21, train_loss: 0.6514, test_loss: 0.8732, test_f1: 0.5798
 epoch: 22, train_loss: 0.6348, test_loss: 0.8682, test_f1: 0.6123
 epoch: 23, train_loss: 0.6204, test_loss: 0.8258, test_f1: 0.6359
 epoch: 24, train_loss: 0.6082, test_loss: 0.9736, test_f1: 0.5683
 epoch: 25, train_loss: 0.5945, test_loss: 0.9081, test_f1: 0.6194
 epoch: 26, train_loss: 0.5872, test_loss: 0.9303, test_f1: 0.6340
 epoch: 27, train_loss: 0.6019, test_loss: 0.8837, test_f1: 0.6102
 epoch: 28, train_loss: 0.5750, test_loss: 0.8984, test_f1: 0.6344
 epoch: 29, train_loss: 0.5487, test_loss: 0.8838, test_f1: 0.6410
 epoch: 30, train_loss: 0.5499, test_loss: 0.9581, test_f1: 0.6040
 epoch: 31, train_loss: 0.5559, test_loss: 0.8984, test_f1: 0.6304
 epoch: 32, train_loss: 0.5550, test_loss: 0.8725, test_f1: 0.6166
 epoch: 33, train_loss: 0.5306, test_loss: 0.8544, test_f1: 0.6484
 epoch: 34, train_loss: 0.5173, test_loss: 1.0097, test_f1: 0.6062
 epoch: 35, train_loss: 0.5185, test_loss: 0.9165, test_f1: 0.6445
 epoch: 36, train_loss: 0.4921, test_loss: 0.9120, test_f1: 0.6525
 epoch: 37, train_loss: 0.4806, test_loss: 1.0719, test_f1: 0.5969
 epoch: 38, train_loss: 0.4895, test_loss: 0.9295, test_f1: 0.6283
 epoch: 39, train_loss: 0.4956, test_loss: 1.1029, test_f1: 0.6166
 epoch: 40, train_loss: 0.4841, test_loss: 0.9462, test_f1: 0.6364
 epoch: 41, train_loss: 0.4879, test_loss: 0.9488, test_f1: 0.6601
 epoch: 42, train_loss: 0.4686, test_loss: 1.0949, test_f1: 0.6010
 epoch: 43, train_loss: 0.4544, test_loss: 0.9196, test_f1: 0.6380
 epoch: 44, train_loss: 0.4381, test_loss: 1.0040, test_f1: 0.6217
 epoch: 45, train_loss: 0.4249, test_loss: 1.0036, test_f1: 0.6484
 epoch: 46, train_loss: 0.4434, test_loss: 1.0312, test_f1: 0.6137
 epoch: 47, train_loss: 0.4626, test_loss: 0.9067, test_f1: 0.6463
 epoch: 48, train_loss: 0.4449, test_loss: 1.0355, test_f1: 0.6089
 epoch: 49, train_loss: 0.4195, test_loss: 0.9875, test_f1: 0.6378
 epoch: 50, train_loss: 0.4137, test_loss: 1.1398, test_f1: 0.5852
 epoch: 51, train_loss: 0.3712, test_loss: 1.1132, test_f1: 0.6026
 epoch: 52, train_loss: 0.3433, test_loss: 1.0094, test_f1: 0.6343
 epoch: 53, train_loss: 0.3463, test_loss: 1.0692, test_f1: 0.6109
 epoch: 54, train_loss: 0.3285, test_loss: 1.1854, test_f1: 0.6042
 epoch: 55, train_loss: 0.3272, test_loss: 1.1604, test_f1: 0.6076
 epoch: 56, train_loss: 0.3280, test_loss: 1.1199, test_f1: 0.6240
 epoch: 57, train_loss: 0.3146, test_loss: 1.1336, test_f1: 0.6544
 epoch: 58, train_loss: 0.3213, test_loss: 1.2299, test_f1: 0.6259
 epoch: 59, train_loss: 0.3121, test_loss: 1.2368, test_f1: 0.6276
 epoch: 60, train_loss: 0.3062, test_loss: 1.0395, test_f1: 0.6498
 epoch: 61, train_loss: 0.3009, test_loss: 1.1188, test_f1: 0.6311
 epoch: 62, train_loss: 0.2986, test_loss: 1.1514, test_f1: 0.6634
 epoch: 63, train_loss: 0.2947, test_loss: 1.2178, test_f1: 0.6526
 epoch: 64, train_loss: 0.2931, test_loss: 1.3139, test_f1: 0.5963
 epoch: 65, train_loss: 0.2907, test_loss: 1.1458, test_f1: 0.6546
 epoch: 66, train_loss: 0.2960, test_loss: 1.1477, test_f1: 0.6674
 epoch: 67, train_loss: 0.2792, test_loss: 1.1646, test_f1: 0.6322
 epoch: 68, train_loss: 0.2863, test_loss: 1.3193, test_f1: 0.6325
 epoch: 69, train_loss: 0.2683, test_loss: 1.4393, test_f1: 0.6040
 epoch: 70, train_loss: 0.2897, test_loss: 1.2327, test_f1: 0.6253
 epoch: 71, train_loss: 0.2752, test_loss: 1.3580, test_f1: 0.6348
 epoch: 72, train_loss: 0.2740, test_loss: 1.3684, test_f1: 0.6653
 epoch: 73, train_loss: 0.2776, test_loss: 1.1602, test_f1: 0.6407
 epoch: 74, train_loss: 0.2630, test_loss: 1.4156, test_f1: 0.6374
 epoch: 75, train_loss: 0.2514, test_loss: 1.2320, test_f1: 0.6263
 epoch: 76, train_loss: 0.2587, test_loss: 1.2536, test_f1: 0.6302
 epoch: 77, train_loss: 0.2463, test_loss: 1.3302, test_f1: 0.6387
 epoch: 78, train_loss: 0.2597, test_loss: 1.2703, test_f1: 0.6390
 epoch: 79, train_loss: 0.2492, test_loss: 1.4028, test_f1: 0.6081
 epoch: 80, train_loss: 0.2366, test_loss: 1.3812, test_f1: 0.6333
 epoch: 81, train_loss: 0.2367, test_loss: 1.5188, test_f1: 0.6206
 epoch: 82, train_loss: 0.2252, test_loss: 1.5147, test_f1: 0.6502
 epoch: 83, train_loss: 0.2290, test_loss: 1.3193, test_f1: 0.6434
 epoch: 84, train_loss: 0.2229, test_loss: 1.5010, test_f1: 0.6482
 epoch: 85, train_loss: 0.2196, test_loss: 1.5398, test_f1: 0.6310
 epoch: 86, train_loss: 0.2392, test_loss: 1.3768, test_f1: 0.6484
 epoch: 87, train_loss: 0.2179, test_loss: 1.3297, test_f1: 0.6372
 epoch: 88, train_loss: 0.2363, test_loss: 1.5086, test_f1: 0.6361
 epoch: 89, train_loss: 0.2269, test_loss: 1.4314, test_f1: 0.6577
 epoch: 90, train_loss: 0.2269, test_loss: 1.4482, test_f1: 0.6543
 epoch: 91, train_loss: 0.2205, test_loss: 1.4819, test_f1: 0.6510
 epoch: 92, train_loss: 0.2046, test_loss: 1.5380, test_f1: 0.6284
 epoch: 93, train_loss: 0.1972, test_loss: 1.5414, test_f1: 0.6294
 epoch: 94, train_loss: 0.1932, test_loss: 1.4577, test_f1: 0.6340
 epoch: 95, train_loss: 0.2166, test_loss: 1.5641, test_f1: 0.6320
 epoch: 96, train_loss: 0.2216, test_loss: 1.6143, test_f1: 0.6314
 epoch: 97, train_loss: 0.2063, test_loss: 1.6011, test_f1: 0.6345
 epoch: 98, train_loss: 0.2168, test_loss: 1.6961, test_f1: 0.6173
 epoch: 99, train_loss: 0.2094, test_loss: 1.6596, test_f1: 0.6380
##################ITERATION #5 ****************************************
 epoch: 0, train_loss: 1.2827, test_loss: 1.2626, test_f1: 0.2286
 epoch: 1, train_loss: 1.0592, test_loss: 1.0603, test_f1: 0.3969
 epoch: 2, train_loss: 0.9910, test_loss: 0.9507, test_f1: 0.5190
 epoch: 3, train_loss: 0.9358, test_loss: 0.9210, test_f1: 0.5721
 epoch: 4, train_loss: 0.8971, test_loss: 0.9142, test_f1: 0.5453
 epoch: 5, train_loss: 0.8841, test_loss: 0.9544, test_f1: 0.5508
 epoch: 6, train_loss: 0.8615, test_loss: 0.9331, test_f1: 0.5738
 epoch: 7, train_loss: 0.8351, test_loss: 0.8916, test_f1: 0.5787
 epoch: 8, train_loss: 0.8091, test_loss: 0.8796, test_f1: 0.5662
 epoch: 9, train_loss: 0.8110, test_loss: 0.8724, test_f1: 0.6191
 epoch: 10, train_loss: 0.7884, test_loss: 0.9046, test_f1: 0.5490
 epoch: 11, train_loss: 0.7500, test_loss: 0.8592, test_f1: 0.6158
 epoch: 12, train_loss: 0.7385, test_loss: 0.8440, test_f1: 0.6335
 epoch: 13, train_loss: 0.7402, test_loss: 0.8464, test_f1: 0.6263
 epoch: 14, train_loss: 0.6963, test_loss: 0.8499, test_f1: 0.5973
 epoch: 15, train_loss: 0.7106, test_loss: 0.8539, test_f1: 0.6022
 epoch: 16, train_loss: 0.6873, test_loss: 0.8609, test_f1: 0.6081
 epoch: 17, train_loss: 0.7013, test_loss: 0.8408, test_f1: 0.6175
 epoch: 18, train_loss: 0.6723, test_loss: 0.9056, test_f1: 0.5963
 epoch: 19, train_loss: 0.6829, test_loss: 0.9516, test_f1: 0.5692
 epoch: 20, train_loss: 0.6744, test_loss: 0.8382, test_f1: 0.6152
 epoch: 21, train_loss: 0.6376, test_loss: 0.8341, test_f1: 0.6423
 epoch: 22, train_loss: 0.6190, test_loss: 0.8317, test_f1: 0.6178
 epoch: 23, train_loss: 0.6138, test_loss: 0.8309, test_f1: 0.6575
 epoch: 24, train_loss: 0.6116, test_loss: 0.8417, test_f1: 0.6226
 epoch: 25, train_loss: 0.6110, test_loss: 0.8271, test_f1: 0.6493
 epoch: 26, train_loss: 0.5966, test_loss: 0.9169, test_f1: 0.6121
 epoch: 27, train_loss: 0.5994, test_loss: 0.8279, test_f1: 0.6354
 epoch: 28, train_loss: 0.5917, test_loss: 0.8500, test_f1: 0.6402
 epoch: 29, train_loss: 0.5698, test_loss: 0.9565, test_f1: 0.5897
 epoch: 30, train_loss: 0.5534, test_loss: 0.8103, test_f1: 0.6462
 epoch: 31, train_loss: 0.5491, test_loss: 0.8510, test_f1: 0.6520
 epoch: 32, train_loss: 0.5582, test_loss: 0.8692, test_f1: 0.6373
 epoch: 33, train_loss: 0.5516, test_loss: 0.8223, test_f1: 0.6481
 epoch: 34, train_loss: 0.5410, test_loss: 0.7856, test_f1: 0.6523
 epoch: 35, train_loss: 0.5310, test_loss: 0.8352, test_f1: 0.6469
 epoch: 36, train_loss: 0.5228, test_loss: 0.8221, test_f1: 0.6327
 epoch: 37, train_loss: 0.5221, test_loss: 0.8036, test_f1: 0.6627
 epoch: 38, train_loss: 0.5122, test_loss: 0.8190, test_f1: 0.6417
 epoch: 39, train_loss: 0.4937, test_loss: 0.8292, test_f1: 0.6602
 epoch: 40, train_loss: 0.4776, test_loss: 0.7998, test_f1: 0.6617
 epoch: 41, train_loss: 0.4983, test_loss: 0.8805, test_f1: 0.6518
 epoch: 42, train_loss: 0.5031, test_loss: 0.9275, test_f1: 0.6332
 epoch: 43, train_loss: 0.5013, test_loss: 0.7556, test_f1: 0.6877
 epoch: 44, train_loss: 0.4726, test_loss: 0.8639, test_f1: 0.6647
 epoch: 45, train_loss: 0.4757, test_loss: 0.8389, test_f1: 0.6904
 epoch: 46, train_loss: 0.4632, test_loss: 0.8411, test_f1: 0.6846
 epoch: 47, train_loss: 0.4544, test_loss: 0.9692, test_f1: 0.6629
 epoch: 48, train_loss: 0.4404, test_loss: 0.9134, test_f1: 0.6403
 epoch: 49, train_loss: 0.4484, test_loss: 0.8921, test_f1: 0.6508
 epoch: 50, train_loss: 0.4597, test_loss: 0.9140, test_f1: 0.6526
 epoch: 51, train_loss: 0.4071, test_loss: 0.7927, test_f1: 0.6838
 epoch: 52, train_loss: 0.3719, test_loss: 0.8735, test_f1: 0.6688
 epoch: 53, train_loss: 0.3696, test_loss: 0.9418, test_f1: 0.6558
 epoch: 54, train_loss: 0.3415, test_loss: 0.9615, test_f1: 0.6679
 epoch: 55, train_loss: 0.3535, test_loss: 0.9213, test_f1: 0.6525
 epoch: 56, train_loss: 0.3619, test_loss: 0.9843, test_f1: 0.6795
 epoch: 57, train_loss: 0.3414, test_loss: 0.9562, test_f1: 0.6961
 epoch: 58, train_loss: 0.3238, test_loss: 0.9664, test_f1: 0.6507
 epoch: 59, train_loss: 0.3195, test_loss: 0.9767, test_f1: 0.6772
 epoch: 60, train_loss: 0.3264, test_loss: 0.9814, test_f1: 0.6760
 epoch: 61, train_loss: 0.3308, test_loss: 0.9997, test_f1: 0.6723
 epoch: 62, train_loss: 0.3184, test_loss: 1.0234, test_f1: 0.6612
 epoch: 63, train_loss: 0.3140, test_loss: 1.0317, test_f1: 0.6667
 epoch: 64, train_loss: 0.3385, test_loss: 1.0813, test_f1: 0.6759
 epoch: 65, train_loss: 0.3130, test_loss: 1.0583, test_f1: 0.6825
 epoch: 66, train_loss: 0.3031, test_loss: 1.1043, test_f1: 0.6454
 epoch: 67, train_loss: 0.3143, test_loss: 1.0831, test_f1: 0.6637
 epoch: 68, train_loss: 0.2920, test_loss: 1.1631, test_f1: 0.6638
 epoch: 69, train_loss: 0.2976, test_loss: 1.1490, test_f1: 0.6691
 epoch: 70, train_loss: 0.2950, test_loss: 1.1965, test_f1: 0.6756
 epoch: 71, train_loss: 0.2727, test_loss: 1.0764, test_f1: 0.6628
 epoch: 72, train_loss: 0.2706, test_loss: 1.1113, test_f1: 0.6745
 epoch: 73, train_loss: 0.2720, test_loss: 1.0552, test_f1: 0.7120
 epoch: 74, train_loss: 0.2887, test_loss: 1.1835, test_f1: 0.6716
 epoch: 75, train_loss: 0.2763, test_loss: 1.2110, test_f1: 0.6609
 epoch: 76, train_loss: 0.2738, test_loss: 1.1358, test_f1: 0.6506
 epoch: 77, train_loss: 0.2485, test_loss: 1.2124, test_f1: 0.6541
 epoch: 78, train_loss: 0.2768, test_loss: 1.1911, test_f1: 0.6715
 epoch: 79, train_loss: 0.2819, test_loss: 1.2819, test_f1: 0.6901
 epoch: 80, train_loss: 0.2731, test_loss: 1.1708, test_f1: 0.6521
 epoch: 81, train_loss: 0.2893, test_loss: 1.1131, test_f1: 0.6934
 epoch: 82, train_loss: 0.2573, test_loss: 1.2510, test_f1: 0.6623
 epoch: 83, train_loss: 0.2514, test_loss: 1.2487, test_f1: 0.6755
 epoch: 84, train_loss: 0.2626, test_loss: 1.1232, test_f1: 0.6789
 epoch: 85, train_loss: 0.2406, test_loss: 1.2548, test_f1: 0.6938
 epoch: 86, train_loss: 0.2360, test_loss: 1.2476, test_f1: 0.6586
 epoch: 87, train_loss: 0.2650, test_loss: 1.4000, test_f1: 0.6688
 epoch: 88, train_loss: 0.2679, test_loss: 1.1140, test_f1: 0.6899
 epoch: 89, train_loss: 0.2577, test_loss: 1.3581, test_f1: 0.6507
 epoch: 90, train_loss: 0.2413, test_loss: 1.1800, test_f1: 0.6923
 epoch: 91, train_loss: 0.2339, test_loss: 1.2318, test_f1: 0.7124
 epoch: 92, train_loss: 0.2490, test_loss: 1.4635, test_f1: 0.6512
 epoch: 93, train_loss: 0.2332, test_loss: 1.3611, test_f1: 0.6591
 epoch: 94, train_loss: 0.2181, test_loss: 1.3465, test_f1: 0.6734
 epoch: 95, train_loss: 0.2191, test_loss: 1.3683, test_f1: 0.6502
 epoch: 96, train_loss: 0.2218, test_loss: 1.2464, test_f1: 0.6844
 epoch: 97, train_loss: 0.2307, test_loss: 1.2940, test_f1: 0.6719
 epoch: 98, train_loss: 0.2078, test_loss: 1.3107, test_f1: 0.6796
 epoch: 99, train_loss: 0.2051, test_loss: 1.3370, test_f1: 0.6587
##################ITERATION #6 ****************************************
 epoch: 0, train_loss: 1.2981, test_loss: 1.2989, test_f1: 0.2772
 epoch: 1, train_loss: 1.0800, test_loss: 1.0606, test_f1: 0.4471
 epoch: 2, train_loss: 1.0166, test_loss: 1.0565, test_f1: 0.4908
 epoch: 3, train_loss: 0.9582, test_loss: 1.0561, test_f1: 0.5155
 epoch: 4, train_loss: 0.9363, test_loss: 1.0366, test_f1: 0.4930
 epoch: 5, train_loss: 0.9206, test_loss: 1.0292, test_f1: 0.5016
 epoch: 6, train_loss: 0.8989, test_loss: 0.9984, test_f1: 0.5598
 epoch: 7, train_loss: 0.8837, test_loss: 1.0297, test_f1: 0.5521
 epoch: 8, train_loss: 0.8701, test_loss: 0.9833, test_f1: 0.5558
 epoch: 9, train_loss: 0.8475, test_loss: 0.9789, test_f1: 0.5567
 epoch: 10, train_loss: 0.8345, test_loss: 0.9507, test_f1: 0.5697
 epoch: 11, train_loss: 0.8117, test_loss: 0.9598, test_f1: 0.5711
 epoch: 12, train_loss: 0.7902, test_loss: 0.9448, test_f1: 0.6082
 epoch: 13, train_loss: 0.7954, test_loss: 0.9408, test_f1: 0.5974
 epoch: 14, train_loss: 0.7688, test_loss: 0.9264, test_f1: 0.5899
 epoch: 15, train_loss: 0.7457, test_loss: 0.9283, test_f1: 0.6309
 epoch: 16, train_loss: 0.7401, test_loss: 0.9086, test_f1: 0.5733
 epoch: 17, train_loss: 0.7195, test_loss: 0.9380, test_f1: 0.6160
 epoch: 18, train_loss: 0.7383, test_loss: 0.9270, test_f1: 0.6093
 epoch: 19, train_loss: 0.7122, test_loss: 0.9025, test_f1: 0.5955
 epoch: 20, train_loss: 0.7094, test_loss: 0.9093, test_f1: 0.6095
 epoch: 21, train_loss: 0.7169, test_loss: 0.8857, test_f1: 0.6372
 epoch: 22, train_loss: 0.7038, test_loss: 0.9507, test_f1: 0.5974
 epoch: 23, train_loss: 0.6826, test_loss: 0.9151, test_f1: 0.6420
 epoch: 24, train_loss: 0.6587, test_loss: 0.8414, test_f1: 0.6201
 epoch: 25, train_loss: 0.6765, test_loss: 0.8990, test_f1: 0.6060
 epoch: 26, train_loss: 0.6906, test_loss: 0.8303, test_f1: 0.6407
 epoch: 27, train_loss: 0.6377, test_loss: 0.8892, test_f1: 0.6348
 epoch: 28, train_loss: 0.6382, test_loss: 0.8604, test_f1: 0.6229
 epoch: 29, train_loss: 0.6502, test_loss: 0.9112, test_f1: 0.6073
 epoch: 30, train_loss: 0.6385, test_loss: 0.8787, test_f1: 0.6348
 epoch: 31, train_loss: 0.6167, test_loss: 0.9047, test_f1: 0.6643
 epoch: 32, train_loss: 0.6103, test_loss: 0.9999, test_f1: 0.5870
 epoch: 33, train_loss: 0.6163, test_loss: 0.9906, test_f1: 0.6414
 epoch: 34, train_loss: 0.5801, test_loss: 0.7878, test_f1: 0.6437
 epoch: 35, train_loss: 0.5784, test_loss: 0.9022, test_f1: 0.6515
 epoch: 36, train_loss: 0.5586, test_loss: 1.1548, test_f1: 0.6008
 epoch: 37, train_loss: 0.5712, test_loss: 0.8083, test_f1: 0.6554
 epoch: 38, train_loss: 0.5499, test_loss: 0.9153, test_f1: 0.6505
 epoch: 39, train_loss: 0.5571, test_loss: 0.8540, test_f1: 0.6390
 epoch: 40, train_loss: 0.5550, test_loss: 0.8817, test_f1: 0.6432
 epoch: 41, train_loss: 0.5555, test_loss: 0.9240, test_f1: 0.6354
 epoch: 42, train_loss: 0.5411, test_loss: 0.8877, test_f1: 0.6411
 epoch: 43, train_loss: 0.5370, test_loss: 0.8305, test_f1: 0.6630
 epoch: 44, train_loss: 0.5312, test_loss: 0.8714, test_f1: 0.6290
 epoch: 45, train_loss: 0.5189, test_loss: 0.9000, test_f1: 0.6532
 epoch: 46, train_loss: 0.5086, test_loss: 0.9344, test_f1: 0.6298
 epoch: 47, train_loss: 0.5045, test_loss: 0.9015, test_f1: 0.6564
 epoch: 48, train_loss: 0.4786, test_loss: 1.0096, test_f1: 0.6524
 epoch: 49, train_loss: 0.4913, test_loss: 0.9198, test_f1: 0.6557
 epoch: 50, train_loss: 0.4851, test_loss: 0.9619, test_f1: 0.6301
 epoch: 51, train_loss: 0.4514, test_loss: 0.8495, test_f1: 0.6833
 epoch: 52, train_loss: 0.4121, test_loss: 0.9255, test_f1: 0.6597
 epoch: 53, train_loss: 0.4048, test_loss: 0.8988, test_f1: 0.6553
 epoch: 54, train_loss: 0.4062, test_loss: 0.9558, test_f1: 0.6562
 epoch: 55, train_loss: 0.4012, test_loss: 0.9090, test_f1: 0.6532
 epoch: 56, train_loss: 0.4012, test_loss: 0.9549, test_f1: 0.6662
 epoch: 57, train_loss: 0.3710, test_loss: 0.9139, test_f1: 0.6805
 epoch: 58, train_loss: 0.3946, test_loss: 0.9756, test_f1: 0.6615
 epoch: 59, train_loss: 0.3975, test_loss: 0.9109, test_f1: 0.6766
 epoch: 60, train_loss: 0.3812, test_loss: 1.0085, test_f1: 0.6380
 epoch: 61, train_loss: 0.3777, test_loss: 0.9508, test_f1: 0.6585
 epoch: 62, train_loss: 0.3873, test_loss: 0.9626, test_f1: 0.6711
 epoch: 63, train_loss: 0.3730, test_loss: 0.9775, test_f1: 0.6669
 epoch: 64, train_loss: 0.3743, test_loss: 0.9491, test_f1: 0.6523
 epoch: 65, train_loss: 0.3565, test_loss: 1.0516, test_f1: 0.6481
 epoch: 66, train_loss: 0.3515, test_loss: 0.9749, test_f1: 0.6728
 epoch: 67, train_loss: 0.3588, test_loss: 1.0364, test_f1: 0.6345
 epoch: 68, train_loss: 0.3491, test_loss: 0.9937, test_f1: 0.6501
 epoch: 69, train_loss: 0.3412, test_loss: 0.9528, test_f1: 0.6613
 epoch: 70, train_loss: 0.3356, test_loss: 0.9776, test_f1: 0.6513
 epoch: 71, train_loss: 0.3534, test_loss: 1.0028, test_f1: 0.6520
 epoch: 72, train_loss: 0.3455, test_loss: 1.1164, test_f1: 0.6466
 epoch: 73, train_loss: 0.3377, test_loss: 1.0574, test_f1: 0.6814
 epoch: 74, train_loss: 0.3243, test_loss: 1.0384, test_f1: 0.6585
 epoch: 75, train_loss: 0.3352, test_loss: 1.0483, test_f1: 0.6535
 epoch: 76, train_loss: 0.3198, test_loss: 1.0452, test_f1: 0.6706
 epoch: 77, train_loss: 0.3160, test_loss: 1.0819, test_f1: 0.6387
 epoch: 78, train_loss: 0.3107, test_loss: 1.0675, test_f1: 0.6402
 epoch: 79, train_loss: 0.3305, test_loss: 1.0684, test_f1: 0.6576
 epoch: 80, train_loss: 0.3335, test_loss: 1.1417, test_f1: 0.6360
 epoch: 81, train_loss: 0.3107, test_loss: 1.1034, test_f1: 0.6535
 epoch: 82, train_loss: 0.2964, test_loss: 1.0446, test_f1: 0.6682
 epoch: 83, train_loss: 0.3015, test_loss: 1.0330, test_f1: 0.6757
 epoch: 84, train_loss: 0.3057, test_loss: 0.9408, test_f1: 0.6838
 epoch: 85, train_loss: 0.2898, test_loss: 1.0588, test_f1: 0.6693
 epoch: 86, train_loss: 0.3002, test_loss: 1.0003, test_f1: 0.6641
 epoch: 87, train_loss: 0.3118, test_loss: 1.0761, test_f1: 0.6539
 epoch: 88, train_loss: 0.2903, test_loss: 1.1797, test_f1: 0.6683
 epoch: 89, train_loss: 0.2886, test_loss: 1.1406, test_f1: 0.6560
 epoch: 90, train_loss: 0.2802, test_loss: 1.2890, test_f1: 0.6456
 epoch: 91, train_loss: 0.2875, test_loss: 1.0360, test_f1: 0.6783
 epoch: 92, train_loss: 0.2966, test_loss: 1.1850, test_f1: 0.6726
 epoch: 93, train_loss: 0.2760, test_loss: 1.1156, test_f1: 0.6730
 epoch: 94, train_loss: 0.2722, test_loss: 1.1182, test_f1: 0.6627
 epoch: 95, train_loss: 0.2871, test_loss: 1.1936, test_f1: 0.6457
 epoch: 96, train_loss: 0.2694, test_loss: 1.1652, test_f1: 0.6714
 epoch: 97, train_loss: 0.2768, test_loss: 1.1928, test_f1: 0.6602
 epoch: 98, train_loss: 0.2826, test_loss: 1.2590, test_f1: 0.6246
 epoch: 99, train_loss: 0.2553, test_loss: 1.3342, test_f1: 0.6555
##################ITERATION #7 ****************************************
 epoch: 0, train_loss: 1.4359, test_loss: 1.3794, test_f1: 0.3444
 epoch: 1, train_loss: 1.0885, test_loss: 1.0507, test_f1: 0.4815
 epoch: 2, train_loss: 1.0128, test_loss: 0.9535, test_f1: 0.5268
 epoch: 3, train_loss: 0.9629, test_loss: 0.9236, test_f1: 0.5681
 epoch: 4, train_loss: 0.9250, test_loss: 0.9198, test_f1: 0.5632
 epoch: 5, train_loss: 0.9096, test_loss: 0.8939, test_f1: 0.5825
 epoch: 6, train_loss: 0.8918, test_loss: 0.9080, test_f1: 0.5527
 epoch: 7, train_loss: 0.8664, test_loss: 0.8836, test_f1: 0.5854
 epoch: 8, train_loss: 0.8425, test_loss: 0.9257, test_f1: 0.5591
 epoch: 9, train_loss: 0.8324, test_loss: 0.9039, test_f1: 0.5599
 epoch: 10, train_loss: 0.8093, test_loss: 0.8695, test_f1: 0.5884
 epoch: 11, train_loss: 0.7938, test_loss: 0.8585, test_f1: 0.5823
 epoch: 12, train_loss: 0.7857, test_loss: 0.8964, test_f1: 0.5876
 epoch: 13, train_loss: 0.7718, test_loss: 0.9055, test_f1: 0.5842
 epoch: 14, train_loss: 0.7609, test_loss: 0.8590, test_f1: 0.5971
 epoch: 15, train_loss: 0.7468, test_loss: 0.8738, test_f1: 0.5916
 epoch: 16, train_loss: 0.7349, test_loss: 0.8721, test_f1: 0.6046
 epoch: 17, train_loss: 0.7162, test_loss: 0.8657, test_f1: 0.5915
 epoch: 18, train_loss: 0.7120, test_loss: 0.8640, test_f1: 0.5989
 epoch: 19, train_loss: 0.7079, test_loss: 0.8727, test_f1: 0.5907
 epoch: 20, train_loss: 0.6873, test_loss: 1.0897, test_f1: 0.5263
 epoch: 21, train_loss: 0.6959, test_loss: 0.8516, test_f1: 0.6059
 epoch: 22, train_loss: 0.6750, test_loss: 0.9123, test_f1: 0.6127
 epoch: 23, train_loss: 0.6793, test_loss: 0.9473, test_f1: 0.5978
 epoch: 24, train_loss: 0.6480, test_loss: 0.8157, test_f1: 0.6341
 epoch: 25, train_loss: 0.6528, test_loss: 0.8583, test_f1: 0.6215
 epoch: 26, train_loss: 0.6469, test_loss: 0.7895, test_f1: 0.6359
 epoch: 27, train_loss: 0.6168, test_loss: 0.7947, test_f1: 0.6287
 epoch: 28, train_loss: 0.6234, test_loss: 0.9043, test_f1: 0.6074
 epoch: 29, train_loss: 0.6168, test_loss: 0.7675, test_f1: 0.6575
 epoch: 30, train_loss: 0.6331, test_loss: 0.8309, test_f1: 0.6168
 epoch: 31, train_loss: 0.6101, test_loss: 0.7877, test_f1: 0.6300
 epoch: 32, train_loss: 0.5986, test_loss: 0.8709, test_f1: 0.6094
 epoch: 33, train_loss: 0.6141, test_loss: 0.8790, test_f1: 0.6193
 epoch: 34, train_loss: 0.5712, test_loss: 0.8836, test_f1: 0.6341
 epoch: 35, train_loss: 0.5754, test_loss: 0.9507, test_f1: 0.5948
 epoch: 36, train_loss: 0.5804, test_loss: 0.8637, test_f1: 0.6042
 epoch: 37, train_loss: 0.5753, test_loss: 0.7961, test_f1: 0.6627
 epoch: 38, train_loss: 0.5435, test_loss: 0.9695, test_f1: 0.6177
 epoch: 39, train_loss: 0.5357, test_loss: 0.8553, test_f1: 0.6538
 epoch: 40, train_loss: 0.5302, test_loss: 0.8737, test_f1: 0.6349
 epoch: 41, train_loss: 0.5414, test_loss: 0.8936, test_f1: 0.6238
 epoch: 42, train_loss: 0.5432, test_loss: 0.8572, test_f1: 0.6270
 epoch: 43, train_loss: 0.5232, test_loss: 1.0167, test_f1: 0.5996
 epoch: 44, train_loss: 0.5227, test_loss: 0.8640, test_f1: 0.6555
 epoch: 45, train_loss: 0.5127, test_loss: 0.9624, test_f1: 0.6417
 epoch: 46, train_loss: 0.5105, test_loss: 1.0413, test_f1: 0.6162
 epoch: 47, train_loss: 0.5169, test_loss: 0.8986, test_f1: 0.6479
 epoch: 48, train_loss: 0.4987, test_loss: 0.8593, test_f1: 0.6567
 epoch: 49, train_loss: 0.4860, test_loss: 1.0071, test_f1: 0.5994
 epoch: 50, train_loss: 0.4824, test_loss: 0.9372, test_f1: 0.6587
 epoch: 51, train_loss: 0.4754, test_loss: 0.9202, test_f1: 0.6404
 epoch: 52, train_loss: 0.4243, test_loss: 0.8940, test_f1: 0.6602
 epoch: 53, train_loss: 0.4168, test_loss: 0.9235, test_f1: 0.6510
 epoch: 54, train_loss: 0.4131, test_loss: 1.0235, test_f1: 0.5917
 epoch: 55, train_loss: 0.4177, test_loss: 0.9254, test_f1: 0.6587
 epoch: 56, train_loss: 0.3951, test_loss: 0.9403, test_f1: 0.6339
 epoch: 57, train_loss: 0.3875, test_loss: 0.9595, test_f1: 0.6794
 epoch: 58, train_loss: 0.4166, test_loss: 0.9266, test_f1: 0.6370
 epoch: 59, train_loss: 0.3990, test_loss: 0.9089, test_f1: 0.6689
 epoch: 60, train_loss: 0.3932, test_loss: 0.9613, test_f1: 0.6534
 epoch: 61, train_loss: 0.3864, test_loss: 1.0072, test_f1: 0.6397
 epoch: 62, train_loss: 0.3781, test_loss: 0.9978, test_f1: 0.6369
 epoch: 63, train_loss: 0.3742, test_loss: 1.0015, test_f1: 0.6614
 epoch: 64, train_loss: 0.3823, test_loss: 1.0621, test_f1: 0.6238
 epoch: 65, train_loss: 0.3648, test_loss: 1.0254, test_f1: 0.6423
 epoch: 66, train_loss: 0.3612, test_loss: 1.0076, test_f1: 0.6607
 epoch: 67, train_loss: 0.3674, test_loss: 1.1181, test_f1: 0.6219
 epoch: 68, train_loss: 0.3629, test_loss: 1.0626, test_f1: 0.6399
 epoch: 69, train_loss: 0.3706, test_loss: 0.9988, test_f1: 0.6536
 epoch: 70, train_loss: 0.3684, test_loss: 1.0681, test_f1: 0.6643
 epoch: 71, train_loss: 0.3597, test_loss: 0.9998, test_f1: 0.6577
 epoch: 72, train_loss: 0.3656, test_loss: 1.1093, test_f1: 0.6215
 epoch: 73, train_loss: 0.3518, test_loss: 1.0877, test_f1: 0.6478
 epoch: 74, train_loss: 0.3386, test_loss: 1.0285, test_f1: 0.6505
 epoch: 75, train_loss: 0.3494, test_loss: 1.0635, test_f1: 0.6488
 epoch: 76, train_loss: 0.3344, test_loss: 1.0267, test_f1: 0.6774
 epoch: 77, train_loss: 0.3298, test_loss: 1.1301, test_f1: 0.6633
 epoch: 78, train_loss: 0.3137, test_loss: 1.1875, test_f1: 0.6470
 epoch: 79, train_loss: 0.3416, test_loss: 1.0540, test_f1: 0.6823
 epoch: 80, train_loss: 0.3206, test_loss: 1.1760, test_f1: 0.6422
 epoch: 81, train_loss: 0.3256, test_loss: 1.0191, test_f1: 0.6535
 epoch: 82, train_loss: 0.3151, test_loss: 1.1161, test_f1: 0.6526
 epoch: 83, train_loss: 0.3238, test_loss: 1.1348, test_f1: 0.6446
 epoch: 84, train_loss: 0.2956, test_loss: 1.1064, test_f1: 0.6508
 epoch: 85, train_loss: 0.3242, test_loss: 1.1184, test_f1: 0.6631
 epoch: 86, train_loss: 0.3092, test_loss: 1.2867, test_f1: 0.6475
 epoch: 87, train_loss: 0.2883, test_loss: 1.1045, test_f1: 0.6785
 epoch: 88, train_loss: 0.2886, test_loss: 1.1619, test_f1: 0.6472
 epoch: 89, train_loss: 0.3058, test_loss: 1.1539, test_f1: 0.6499
 epoch: 90, train_loss: 0.2941, test_loss: 1.1196, test_f1: 0.6494
 epoch: 91, train_loss: 0.2874, test_loss: 1.2777, test_f1: 0.6495
 epoch: 92, train_loss: 0.2829, test_loss: 1.0713, test_f1: 0.6619
 epoch: 93, train_loss: 0.2872, test_loss: 1.3965, test_f1: 0.6510
 epoch: 94, train_loss: 0.2795, test_loss: 1.1687, test_f1: 0.6611
 epoch: 95, train_loss: 0.2819, test_loss: 1.2482, test_f1: 0.6464
 epoch: 96, train_loss: 0.2858, test_loss: 1.2505, test_f1: 0.6308
 epoch: 97, train_loss: 0.2812, test_loss: 1.2287, test_f1: 0.6495
 epoch: 98, train_loss: 0.3029, test_loss: 1.2179, test_f1: 0.6563
 epoch: 99, train_loss: 0.2936, test_loss: 1.5396, test_f1: 0.6338
##################ITERATION #8 ****************************************
 epoch: 0, train_loss: 1.3300, test_loss: 1.1566, test_f1: 0.3062
 epoch: 1, train_loss: 1.0125, test_loss: 0.9900, test_f1: 0.4457
 epoch: 2, train_loss: 0.9771, test_loss: 1.0104, test_f1: 0.4573
 epoch: 3, train_loss: 0.9461, test_loss: 0.9805, test_f1: 0.4818
 epoch: 4, train_loss: 0.9160, test_loss: 0.9641, test_f1: 0.5061
 epoch: 5, train_loss: 0.9064, test_loss: 1.0173, test_f1: 0.5033
 epoch: 6, train_loss: 0.8931, test_loss: 0.9543, test_f1: 0.4972
 epoch: 7, train_loss: 0.8719, test_loss: 1.0114, test_f1: 0.4892
 epoch: 8, train_loss: 0.8425, test_loss: 1.0412, test_f1: 0.4714
 epoch: 9, train_loss: 0.8507, test_loss: 0.9394, test_f1: 0.5256
 epoch: 10, train_loss: 0.8309, test_loss: 0.9460, test_f1: 0.5186
 epoch: 11, train_loss: 0.8027, test_loss: 0.9393, test_f1: 0.5290
 epoch: 12, train_loss: 0.7884, test_loss: 1.0451, test_f1: 0.5195
 epoch: 13, train_loss: 0.7890, test_loss: 0.9252, test_f1: 0.5422
 epoch: 14, train_loss: 0.7723, test_loss: 0.8734, test_f1: 0.5344
 epoch: 15, train_loss: 0.7431, test_loss: 0.8966, test_f1: 0.5251
 epoch: 16, train_loss: 0.7463, test_loss: 0.9208, test_f1: 0.5306
 epoch: 17, train_loss: 0.7314, test_loss: 0.8377, test_f1: 0.5741
 epoch: 18, train_loss: 0.7310, test_loss: 0.9634, test_f1: 0.5390
 epoch: 19, train_loss: 0.7135, test_loss: 0.9871, test_f1: 0.5535
 epoch: 20, train_loss: 0.7011, test_loss: 0.9457, test_f1: 0.5458
 epoch: 21, train_loss: 0.7082, test_loss: 0.8879, test_f1: 0.5942
 epoch: 22, train_loss: 0.6823, test_loss: 0.8431, test_f1: 0.5964
 epoch: 23, train_loss: 0.6773, test_loss: 0.9041, test_f1: 0.5789
 epoch: 24, train_loss: 0.6909, test_loss: 0.8653, test_f1: 0.5673
 epoch: 25, train_loss: 0.6665, test_loss: 0.8292, test_f1: 0.6031
 epoch: 26, train_loss: 0.6436, test_loss: 0.8521, test_f1: 0.6043
 epoch: 27, train_loss: 0.6393, test_loss: 0.9226, test_f1: 0.5938
 epoch: 28, train_loss: 0.6411, test_loss: 0.8756, test_f1: 0.5995
 epoch: 29, train_loss: 0.6337, test_loss: 0.7992, test_f1: 0.6168
 epoch: 30, train_loss: 0.6111, test_loss: 0.8643, test_f1: 0.5948
 epoch: 31, train_loss: 0.6402, test_loss: 0.9051, test_f1: 0.5930
 epoch: 32, train_loss: 0.5977, test_loss: 0.8839, test_f1: 0.6146
 epoch: 33, train_loss: 0.5860, test_loss: 0.9133, test_f1: 0.6075
 epoch: 34, train_loss: 0.5963, test_loss: 1.0640, test_f1: 0.5340
 epoch: 35, train_loss: 0.5820, test_loss: 0.9440, test_f1: 0.5784
 epoch: 36, train_loss: 0.5950, test_loss: 0.9478, test_f1: 0.5955
 epoch: 37, train_loss: 0.5668, test_loss: 0.8591, test_f1: 0.6364
 epoch: 38, train_loss: 0.5490, test_loss: 0.8420, test_f1: 0.6218
 epoch: 39, train_loss: 0.5650, test_loss: 0.8475, test_f1: 0.6021
 epoch: 40, train_loss: 0.5503, test_loss: 0.7803, test_f1: 0.6561
 epoch: 41, train_loss: 0.5601, test_loss: 0.9058, test_f1: 0.6216
 epoch: 42, train_loss: 0.5408, test_loss: 0.9432, test_f1: 0.5934
 epoch: 43, train_loss: 0.5334, test_loss: 0.8386, test_f1: 0.6186
 epoch: 44, train_loss: 0.5436, test_loss: 0.8234, test_f1: 0.6382
 epoch: 45, train_loss: 0.5074, test_loss: 1.0615, test_f1: 0.5817
 epoch: 46, train_loss: 0.5291, test_loss: 0.8436, test_f1: 0.6319
 epoch: 47, train_loss: 0.5195, test_loss: 0.8294, test_f1: 0.6177
 epoch: 48, train_loss: 0.5139, test_loss: 0.9742, test_f1: 0.5979
 epoch: 49, train_loss: 0.5011, test_loss: 0.8327, test_f1: 0.6423
 epoch: 50, train_loss: 0.5141, test_loss: 0.9765, test_f1: 0.6070
 epoch: 51, train_loss: 0.4869, test_loss: 0.7954, test_f1: 0.6575
 epoch: 52, train_loss: 0.4327, test_loss: 0.8818, test_f1: 0.6465
 epoch: 53, train_loss: 0.4200, test_loss: 0.9533, test_f1: 0.6298
 epoch: 54, train_loss: 0.4232, test_loss: 0.8891, test_f1: 0.6509
 epoch: 55, train_loss: 0.4238, test_loss: 0.9035, test_f1: 0.6523
 epoch: 56, train_loss: 0.4093, test_loss: 0.8731, test_f1: 0.6598
 epoch: 57, train_loss: 0.4149, test_loss: 1.0109, test_f1: 0.6315
 epoch: 58, train_loss: 0.4181, test_loss: 0.9268, test_f1: 0.6293
 epoch: 59, train_loss: 0.3887, test_loss: 0.9815, test_f1: 0.6512
 epoch: 60, train_loss: 0.3819, test_loss: 0.9611, test_f1: 0.6612
 epoch: 61, train_loss: 0.3890, test_loss: 0.9745, test_f1: 0.6488
 epoch: 62, train_loss: 0.3979, test_loss: 0.9823, test_f1: 0.6462
 epoch: 63, train_loss: 0.3904, test_loss: 1.0880, test_f1: 0.6124
 epoch: 64, train_loss: 0.3891, test_loss: 0.9893, test_f1: 0.6412
 epoch: 65, train_loss: 0.3938, test_loss: 1.0205, test_f1: 0.6324
 epoch: 66, train_loss: 0.3743, test_loss: 1.0352, test_f1: 0.6351
 epoch: 67, train_loss: 0.3663, test_loss: 1.0634, test_f1: 0.6425
 epoch: 68, train_loss: 0.3427, test_loss: 0.9946, test_f1: 0.6444
 epoch: 69, train_loss: 0.3669, test_loss: 0.9753, test_f1: 0.6559
 epoch: 70, train_loss: 0.3583, test_loss: 0.9997, test_f1: 0.6758
 epoch: 71, train_loss: 0.3723, test_loss: 1.0569, test_f1: 0.6304
 epoch: 72, train_loss: 0.3514, test_loss: 1.0713, test_f1: 0.6414
 epoch: 73, train_loss: 0.3450, test_loss: 1.0208, test_f1: 0.6339
 epoch: 74, train_loss: 0.3539, test_loss: 1.0558, test_f1: 0.6094
 epoch: 75, train_loss: 0.3556, test_loss: 1.0875, test_f1: 0.6357
 epoch: 76, train_loss: 0.3419, test_loss: 1.0361, test_f1: 0.6411
 epoch: 77, train_loss: 0.3303, test_loss: 1.0557, test_f1: 0.6299
 epoch: 78, train_loss: 0.3541, test_loss: 1.0464, test_f1: 0.6520
 epoch: 79, train_loss: 0.3329, test_loss: 1.0383, test_f1: 0.6525
 epoch: 80, train_loss: 0.3183, test_loss: 1.1727, test_f1: 0.6280
 epoch: 81, train_loss: 0.3316, test_loss: 1.1262, test_f1: 0.6439
 epoch: 82, train_loss: 0.3496, test_loss: 1.0775, test_f1: 0.6307
 epoch: 83, train_loss: 0.3561, test_loss: 0.9864, test_f1: 0.6725
 epoch: 84, train_loss: 0.3399, test_loss: 1.0165, test_f1: 0.6932
 epoch: 85, train_loss: 0.3401, test_loss: 1.0500, test_f1: 0.6478
 epoch: 86, train_loss: 0.3343, test_loss: 1.1428, test_f1: 0.6379
 epoch: 87, train_loss: 0.3250, test_loss: 1.1317, test_f1: 0.6474
 epoch: 88, train_loss: 0.3128, test_loss: 1.0640, test_f1: 0.6536
 epoch: 89, train_loss: 0.3211, test_loss: 1.0987, test_f1: 0.6621
 epoch: 90, train_loss: 0.3003, test_loss: 1.1857, test_f1: 0.6457
 epoch: 91, train_loss: 0.2921, test_loss: 1.0678, test_f1: 0.6614
 epoch: 92, train_loss: 0.3065, test_loss: 1.0852, test_f1: 0.6629
 epoch: 93, train_loss: 0.3035, test_loss: 1.0729, test_f1: 0.6503
 epoch: 94, train_loss: 0.3037, test_loss: 1.1069, test_f1: 0.6442
 epoch: 95, train_loss: 0.3074, test_loss: 1.1412, test_f1: 0.6409
 epoch: 96, train_loss: 0.2897, test_loss: 1.1327, test_f1: 0.6451
 epoch: 97, train_loss: 0.2962, test_loss: 1.1015, test_f1: 0.6468
 epoch: 98, train_loss: 0.2730, test_loss: 1.2209, test_f1: 0.6109
 epoch: 99, train_loss: 0.2769, test_loss: 1.2017, test_f1: 0.6287
##################ITERATION #9 ****************************************
 epoch: 0, train_loss: 1.6056, test_loss: 1.5199, test_f1: 0.2061
 epoch: 1, train_loss: 1.1561, test_loss: 1.3047, test_f1: 0.3121
 epoch: 2, train_loss: 1.0637, test_loss: 0.9822, test_f1: 0.4795
 epoch: 3, train_loss: 1.0025, test_loss: 1.0158, test_f1: 0.4954
 epoch: 4, train_loss: 0.9654, test_loss: 0.9941, test_f1: 0.5078
 epoch: 5, train_loss: 0.9378, test_loss: 0.9909, test_f1: 0.5308
 epoch: 6, train_loss: 0.9135, test_loss: 0.9539, test_f1: 0.5094
 epoch: 7, train_loss: 0.8918, test_loss: 0.9137, test_f1: 0.5173
 epoch: 8, train_loss: 0.8811, test_loss: 0.9741, test_f1: 0.5015
 epoch: 9, train_loss: 0.8580, test_loss: 0.9144, test_f1: 0.5321
 epoch: 10, train_loss: 0.8417, test_loss: 0.8862, test_f1: 0.5251
 epoch: 11, train_loss: 0.8302, test_loss: 0.9115, test_f1: 0.5300
 epoch: 12, train_loss: 0.8222, test_loss: 0.8881, test_f1: 0.5565
 epoch: 13, train_loss: 0.7894, test_loss: 0.8700, test_f1: 0.5703
 epoch: 14, train_loss: 0.7861, test_loss: 0.8940, test_f1: 0.5445
 epoch: 15, train_loss: 0.7893, test_loss: 0.8942, test_f1: 0.5258
 epoch: 16, train_loss: 0.7710, test_loss: 0.9319, test_f1: 0.5275
 epoch: 17, train_loss: 0.7476, test_loss: 0.8395, test_f1: 0.5836
 epoch: 18, train_loss: 0.7590, test_loss: 0.8973, test_f1: 0.5685
 epoch: 19, train_loss: 0.7152, test_loss: 0.8712, test_f1: 0.5916
 epoch: 20, train_loss: 0.7239, test_loss: 0.9348, test_f1: 0.5769
 epoch: 21, train_loss: 0.7056, test_loss: 0.9220, test_f1: 0.5308
 epoch: 22, train_loss: 0.7019, test_loss: 0.9082, test_f1: 0.5605
 epoch: 23, train_loss: 0.6906, test_loss: 0.8882, test_f1: 0.5752
 epoch: 24, train_loss: 0.6866, test_loss: 0.8534, test_f1: 0.6059
 epoch: 25, train_loss: 0.6755, test_loss: 0.8311, test_f1: 0.6015
 epoch: 26, train_loss: 0.6673, test_loss: 0.8652, test_f1: 0.6000
 epoch: 27, train_loss: 0.6499, test_loss: 0.8695, test_f1: 0.5991
 epoch: 28, train_loss: 0.6843, test_loss: 0.9010, test_f1: 0.5697
 epoch: 29, train_loss: 0.6559, test_loss: 0.8967, test_f1: 0.5771
 epoch: 30, train_loss: 0.6299, test_loss: 0.7693, test_f1: 0.6055
 epoch: 31, train_loss: 0.6121, test_loss: 0.9650, test_f1: 0.5697
 epoch: 32, train_loss: 0.6078, test_loss: 0.8917, test_f1: 0.6191
 epoch: 33, train_loss: 0.6057, test_loss: 0.9346, test_f1: 0.5895
 epoch: 34, train_loss: 0.5956, test_loss: 0.8711, test_f1: 0.6217
 epoch: 35, train_loss: 0.5995, test_loss: 0.8800, test_f1: 0.6117
 epoch: 36, train_loss: 0.5788, test_loss: 0.9433, test_f1: 0.6068
 epoch: 37, train_loss: 0.5798, test_loss: 0.8870, test_f1: 0.5886
 epoch: 38, train_loss: 0.5916, test_loss: 1.0579, test_f1: 0.5987
 epoch: 39, train_loss: 0.5737, test_loss: 0.9082, test_f1: 0.6121
 epoch: 40, train_loss: 0.5690, test_loss: 0.9547, test_f1: 0.5781
 epoch: 41, train_loss: 0.5503, test_loss: 0.9149, test_f1: 0.5906
 epoch: 42, train_loss: 0.5331, test_loss: 0.8146, test_f1: 0.6515
 epoch: 43, train_loss: 0.5579, test_loss: 0.9430, test_f1: 0.6041
 epoch: 44, train_loss: 0.5235, test_loss: 0.9791, test_f1: 0.6400
 epoch: 45, train_loss: 0.5277, test_loss: 0.9583, test_f1: 0.6226
 epoch: 46, train_loss: 0.5035, test_loss: 0.9928, test_f1: 0.6205
 epoch: 47, train_loss: 0.5035, test_loss: 1.0279, test_f1: 0.6037
 epoch: 48, train_loss: 0.4970, test_loss: 1.1555, test_f1: 0.5286
 epoch: 49, train_loss: 0.4868, test_loss: 0.9847, test_f1: 0.6214
 epoch: 50, train_loss: 0.4839, test_loss: 0.9845, test_f1: 0.6443
 epoch: 51, train_loss: 0.4705, test_loss: 0.8772, test_f1: 0.6448
 epoch: 52, train_loss: 0.4065, test_loss: 0.8828, test_f1: 0.6568
 epoch: 53, train_loss: 0.4093, test_loss: 0.9051, test_f1: 0.6568
 epoch: 54, train_loss: 0.4103, test_loss: 0.9605, test_f1: 0.6660
 epoch: 55, train_loss: 0.4050, test_loss: 0.9177, test_f1: 0.6708
 epoch: 56, train_loss: 0.3865, test_loss: 0.9308, test_f1: 0.6354
 epoch: 57, train_loss: 0.3936, test_loss: 1.1267, test_f1: 0.6355
 epoch: 58, train_loss: 0.4119, test_loss: 0.9181, test_f1: 0.6621
 epoch: 59, train_loss: 0.3859, test_loss: 0.9580, test_f1: 0.6586
 epoch: 60, train_loss: 0.3864, test_loss: 1.1892, test_f1: 0.6350
 epoch: 61, train_loss: 0.3878, test_loss: 0.9960, test_f1: 0.6442
 epoch: 62, train_loss: 0.3751, test_loss: 0.9930, test_f1: 0.6176
 epoch: 63, train_loss: 0.3634, test_loss: 1.0845, test_f1: 0.6774
 epoch: 64, train_loss: 0.3680, test_loss: 0.9835, test_f1: 0.6586
 epoch: 65, train_loss: 0.3692, test_loss: 0.9967, test_f1: 0.6601
 epoch: 66, train_loss: 0.3710, test_loss: 1.1218, test_f1: 0.6519
 epoch: 67, train_loss: 0.3725, test_loss: 1.1140, test_f1: 0.6183
 epoch: 68, train_loss: 0.3607, test_loss: 0.9880, test_f1: 0.6787
 epoch: 69, train_loss: 0.3530, test_loss: 0.9757, test_f1: 0.6597
 epoch: 70, train_loss: 0.3601, test_loss: 1.0485, test_f1: 0.6397
 epoch: 71, train_loss: 0.3369, test_loss: 1.2189, test_f1: 0.6348
 epoch: 72, train_loss: 0.3365, test_loss: 1.0226, test_f1: 0.6353
 epoch: 73, train_loss: 0.3507, test_loss: 1.0219, test_f1: 0.6421
 epoch: 74, train_loss: 0.3413, test_loss: 1.1064, test_f1: 0.6425
 epoch: 75, train_loss: 0.3215, test_loss: 1.0936, test_f1: 0.6362
 epoch: 76, train_loss: 0.3350, test_loss: 1.1050, test_f1: 0.6562
 epoch: 77, train_loss: 0.3473, test_loss: 1.1983, test_f1: 0.6446
 epoch: 78, train_loss: 0.3615, test_loss: 1.1435, test_f1: 0.6417
 epoch: 79, train_loss: 0.3285, test_loss: 1.1590, test_f1: 0.6295
 epoch: 80, train_loss: 0.3111, test_loss: 1.1952, test_f1: 0.6353
 epoch: 81, train_loss: 0.3055, test_loss: 1.1662, test_f1: 0.6235
 epoch: 82, train_loss: 0.3051, test_loss: 1.3534, test_f1: 0.6257
 epoch: 83, train_loss: 0.3183, test_loss: 1.1160, test_f1: 0.6407
 epoch: 84, train_loss: 0.3086, test_loss: 1.1983, test_f1: 0.6525
 epoch: 85, train_loss: 0.3112, test_loss: 1.1875, test_f1: 0.6041
 epoch: 86, train_loss: 0.3082, test_loss: 1.3137, test_f1: 0.6564
 epoch: 87, train_loss: 0.3176, test_loss: 1.3193, test_f1: 0.6429
 epoch: 88, train_loss: 0.2894, test_loss: 1.1928, test_f1: 0.5750
 epoch: 89, train_loss: 0.2911, test_loss: 1.2936, test_f1: 0.6339
 epoch: 90, train_loss: 0.2889, test_loss: 1.0699, test_f1: 0.6663
 epoch: 91, train_loss: 0.2942, test_loss: 1.1311, test_f1: 0.6515
 epoch: 92, train_loss: 0.2817, test_loss: 1.1881, test_f1: 0.6629
 epoch: 93, train_loss: 0.2904, test_loss: 1.2627, test_f1: 0.6743
 epoch: 94, train_loss: 0.2741, test_loss: 1.4258, test_f1: 0.6522
 epoch: 95, train_loss: 0.2819, test_loss: 1.1983, test_f1: 0.6633
 epoch: 96, train_loss: 0.2661, test_loss: 1.3665, test_f1: 0.6726
 epoch: 97, train_loss: 0.2828, test_loss: 1.3011, test_f1: 0.6433
 epoch: 98, train_loss: 0.2598, test_loss: 1.2325, test_f1: 0.6420
 epoch: 99, train_loss: 0.2728, test_loss: 1.2777, test_f1: 0.6610

Training completed in 550.31 seconds
Best F1: 0.7124 at epoch 91
Mean F1 across iterations: 0.6840  0.0141
========================FINAL RESULTS================================
FEGIN weighted F1: 0.7124  0.0141
python main.py --data ltspice_examples --representation component_pin --model FEGIN --layers 5 --hiddens 64 --batch_size 128 --lr 0.001 --emb_size 250 --epochs 100 --save_appendix component_pin_L5_H64_BS128_LR0.001_E250 --no_val
-----



STDERR:
  File "main.py", line 370, in <module>
    main()
  File "main.py", line 254, in main
    dataset = dataset_class(
  File "/home/philip/projects/ltspice_examples_code_repo/Circuit-Completion-Using-GNNs/component_classification_with_link_prediction_head/evaluation/FEGIN/kernel/circuit_datasets.py", line 15, in __init__
    self.data, self.slices = torch.load(self.processed_paths[0])
  File "/home/philip/.local/lib/python3.8/site-packages/torch/serialization.py", line 1040, in load
    warnings.warn(
  File "/usr/lib/python3.8/warnings.py", line 109, in _showwarnmsg
    sw(msg.message, msg.category, msg.filename, msg.lineno,
  File "main.py", line 47, in warn_with_traceback
    traceback.print_stack(file=log)
/home/philip/projects/ltspice_examples_code_repo/Circuit-Completion-Using-GNNs/component_classification_with_link_prediction_head/evaluation/FEGIN/kernel/circuit_datasets.py:15: FutureWarning: You are using `torch.load` with `weights_only=False` (the current default value), which uses the default pickle module implicitly. It is possible to construct malicious pickle data which will execute arbitrary code during unpickling (See https://github.com/pytorch/pytorch/blob/main/SECURITY.md#untrusted-models for more details). In a future release, the default value for `weights_only` will be flipped to `True`. This limits the functions that could be executed during unpickling. Arbitrary objects will no longer be allowed to be loaded via this mode unless they are explicitly allowlisted by the user via `torch.serialization.add_safe_globals`. We recommend you start setting `weights_only=True` for any use case where you don't have full control of the loaded file. Please open an issue on GitHub for any issues related to this experimental feature.
  self.data, self.slices = torch.load(self.processed_paths[0])
