STDOUT:
Results will be saved in /home/philip/projects/ltspice_examples_code_repo/Circuit-Completion-Using-GNNs/component_classification_with_link_prediction_head/evaluation/FEGIN/results/model_FEGIN_dataset_ltspice_examples
Command line input: python main.py --data ltspice_examples --representation component_pin_net --model FEGIN --layers 2 --hiddens 128 --batch_size 32 --lr 0.01 --emb_size 128 --epochs 100 --save_appendix component_pin_net_L2_H128_BS32_LR0.01_E128 --no_val
 is saved.
-----
ltspice_examples - FEGIN
Using 2 layers, 128 hidden units, h = 2
Loading component_pin_net representation dataset
ENTERED
Training FEGIN on component_pin_net representation
Train: 3558, Test: 846
##################ITERATION #0 ****************************************
 epoch: 0, train_loss: 1.1359, test_loss: 1.0916, test_f1: 0.3607
 epoch: 1, train_loss: 1.0195, test_loss: 1.0428, test_f1: 0.4546
 epoch: 2, train_loss: 0.9889, test_loss: 1.0262, test_f1: 0.4876
 epoch: 3, train_loss: 0.9727, test_loss: 1.0156, test_f1: 0.4950
 epoch: 4, train_loss: 0.9585, test_loss: 1.0517, test_f1: 0.4920
 epoch: 5, train_loss: 0.9539, test_loss: 0.9640, test_f1: 0.5362
 epoch: 6, train_loss: 0.9370, test_loss: 1.1068, test_f1: 0.4529
 epoch: 7, train_loss: 0.9111, test_loss: 0.9479, test_f1: 0.5187
 epoch: 8, train_loss: 0.8960, test_loss: 0.9988, test_f1: 0.4999
 epoch: 9, train_loss: 0.8977, test_loss: 0.8269, test_f1: 0.5655
 epoch: 10, train_loss: 0.8751, test_loss: 0.9635, test_f1: 0.6054
 epoch: 11, train_loss: 0.8591, test_loss: 0.9516, test_f1: 0.5734
 epoch: 12, train_loss: 0.8537, test_loss: 0.8658, test_f1: 0.5573
 epoch: 13, train_loss: 0.8521, test_loss: 0.9144, test_f1: 0.6101
 epoch: 14, train_loss: 0.8405, test_loss: 0.8452, test_f1: 0.5578
 epoch: 15, train_loss: 0.8317, test_loss: 0.9646, test_f1: 0.5177
 epoch: 16, train_loss: 0.8123, test_loss: 0.9247, test_f1: 0.5739
 epoch: 17, train_loss: 0.8057, test_loss: 0.8998, test_f1: 0.5943
 epoch: 18, train_loss: 0.8074, test_loss: 0.8469, test_f1: 0.5736
 epoch: 19, train_loss: 0.8046, test_loss: 0.7953, test_f1: 0.6155
 epoch: 20, train_loss: 0.7954, test_loss: 0.8197, test_f1: 0.5894
 epoch: 21, train_loss: 0.7977, test_loss: 0.8446, test_f1: 0.5711
 epoch: 22, train_loss: 0.7844, test_loss: 0.7984, test_f1: 0.6168
 epoch: 23, train_loss: 0.7761, test_loss: 0.7606, test_f1: 0.6286
 epoch: 24, train_loss: 0.7568, test_loss: 0.8289, test_f1: 0.6205
 epoch: 25, train_loss: 0.7670, test_loss: 0.8748, test_f1: 0.6015
 epoch: 26, train_loss: 0.7572, test_loss: 0.8071, test_f1: 0.6007
 epoch: 27, train_loss: 0.7515, test_loss: 0.7634, test_f1: 0.6601
 epoch: 28, train_loss: 0.7420, test_loss: 0.7996, test_f1: 0.6003
 epoch: 29, train_loss: 0.7421, test_loss: 0.7870, test_f1: 0.6224
 epoch: 30, train_loss: 0.7367, test_loss: 0.7625, test_f1: 0.6194
 epoch: 31, train_loss: 0.7372, test_loss: 0.7680, test_f1: 0.5796
 epoch: 32, train_loss: 0.7110, test_loss: 0.7363, test_f1: 0.6346
 epoch: 33, train_loss: 0.7196, test_loss: 0.8818, test_f1: 0.5873
 epoch: 34, train_loss: 0.6994, test_loss: 0.8139, test_f1: 0.6067
 epoch: 35, train_loss: 0.6757, test_loss: 0.8937, test_f1: 0.6168
 epoch: 36, train_loss: 0.7348, test_loss: 0.7825, test_f1: 0.6181
 epoch: 37, train_loss: 0.6860, test_loss: 0.9833, test_f1: 0.5860
 epoch: 38, train_loss: 0.6679, test_loss: 0.7703, test_f1: 0.6713
 epoch: 39, train_loss: 0.6754, test_loss: 0.7928, test_f1: 0.5976
 epoch: 40, train_loss: 0.6846, test_loss: 0.9251, test_f1: 0.6223
 epoch: 41, train_loss: 0.6765, test_loss: 0.9012, test_f1: 0.6159
 epoch: 42, train_loss: 0.6607, test_loss: 0.9089, test_f1: 0.6484
 epoch: 43, train_loss: 0.6562, test_loss: 0.7895, test_f1: 0.6170
 epoch: 44, train_loss: 0.6697, test_loss: 0.7332, test_f1: 0.6667
 epoch: 45, train_loss: 0.6525, test_loss: 0.7623, test_f1: 0.6501
 epoch: 46, train_loss: 0.6442, test_loss: 0.9641, test_f1: 0.6039
 epoch: 47, train_loss: 0.6468, test_loss: 0.9800, test_f1: 0.6393
 epoch: 48, train_loss: 0.6320, test_loss: 0.7809, test_f1: 0.6535
 epoch: 49, train_loss: 0.6217, test_loss: 0.8429, test_f1: 0.6511
 epoch: 50, train_loss: 0.6450, test_loss: 0.8368, test_f1: 0.5787
 epoch: 51, train_loss: 0.5974, test_loss: 0.8938, test_f1: 0.6659
 epoch: 52, train_loss: 0.5673, test_loss: 0.8132, test_f1: 0.6953
 epoch: 53, train_loss: 0.5748, test_loss: 0.8731, test_f1: 0.7077
 epoch: 54, train_loss: 0.5532, test_loss: 0.9108, test_f1: 0.6908
 epoch: 55, train_loss: 0.5619, test_loss: 0.8269, test_f1: 0.6797
 epoch: 56, train_loss: 0.5566, test_loss: 0.9158, test_f1: 0.6840
 epoch: 57, train_loss: 0.5446, test_loss: 0.9836, test_f1: 0.6718
 epoch: 58, train_loss: 0.5529, test_loss: 0.8927, test_f1: 0.6782
 epoch: 59, train_loss: 0.5392, test_loss: 0.8997, test_f1: 0.6998
 epoch: 60, train_loss: 0.5411, test_loss: 1.1219, test_f1: 0.6650
 epoch: 61, train_loss: 0.5240, test_loss: 0.9834, test_f1: 0.6609
 epoch: 62, train_loss: 0.5319, test_loss: 0.9074, test_f1: 0.6827
 epoch: 63, train_loss: 0.5215, test_loss: 0.9528, test_f1: 0.6731
 epoch: 64, train_loss: 0.5138, test_loss: 0.8905, test_f1: 0.6564
 epoch: 65, train_loss: 0.5035, test_loss: 0.8905, test_f1: 0.6982
 epoch: 66, train_loss: 0.5286, test_loss: 0.8710, test_f1: 0.6921
 epoch: 67, train_loss: 0.5211, test_loss: 0.9644, test_f1: 0.6873
 epoch: 68, train_loss: 0.5015, test_loss: 1.0486, test_f1: 0.6980
 epoch: 69, train_loss: 0.5064, test_loss: 0.8862, test_f1: 0.7006
 epoch: 70, train_loss: 0.4884, test_loss: 0.8649, test_f1: 0.7240
 epoch: 71, train_loss: 0.4963, test_loss: 1.0577, test_f1: 0.6976
 epoch: 72, train_loss: 0.4888, test_loss: 0.9314, test_f1: 0.6460
 epoch: 73, train_loss: 0.4881, test_loss: 0.8809, test_f1: 0.7049
 epoch: 74, train_loss: 0.4868, test_loss: 0.8891, test_f1: 0.6921
 epoch: 75, train_loss: 0.4899, test_loss: 0.9117, test_f1: 0.6924
 epoch: 76, train_loss: 0.4548, test_loss: 0.9107, test_f1: 0.6844
 epoch: 77, train_loss: 0.4716, test_loss: 0.9726, test_f1: 0.6900
 epoch: 78, train_loss: 0.4561, test_loss: 0.9761, test_f1: 0.6777
 epoch: 79, train_loss: 0.4468, test_loss: 0.9722, test_f1: 0.6882
 epoch: 80, train_loss: 0.4842, test_loss: 1.0716, test_f1: 0.6599
 epoch: 81, train_loss: 0.4753, test_loss: 0.8993, test_f1: 0.7075
 epoch: 82, train_loss: 0.4526, test_loss: 1.1051, test_f1: 0.6734
 epoch: 83, train_loss: 0.4654, test_loss: 0.9445, test_f1: 0.6853
 epoch: 84, train_loss: 0.4500, test_loss: 0.9020, test_f1: 0.6940
 epoch: 85, train_loss: 0.4625, test_loss: 0.9212, test_f1: 0.6894
 epoch: 86, train_loss: 0.4358, test_loss: 0.9293, test_f1: 0.6890
 epoch: 87, train_loss: 0.4423, test_loss: 0.9328, test_f1: 0.6840
 epoch: 88, train_loss: 0.4403, test_loss: 1.0823, test_f1: 0.7105
 epoch: 89, train_loss: 0.4362, test_loss: 1.0866, test_f1: 0.6867
 epoch: 90, train_loss: 0.4542, test_loss: 0.9371, test_f1: 0.6818
 epoch: 91, train_loss: 0.4546, test_loss: 1.1102, test_f1: 0.6678
 epoch: 92, train_loss: 0.4304, test_loss: 1.0902, test_f1: 0.6933
 epoch: 93, train_loss: 0.4363, test_loss: 0.9570, test_f1: 0.6665
 epoch: 94, train_loss: 0.4288, test_loss: 0.9582, test_f1: 0.6979
 epoch: 95, train_loss: 0.4410, test_loss: 1.0181, test_f1: 0.6780
 epoch: 96, train_loss: 0.4259, test_loss: 1.0640, test_f1: 0.6973
 epoch: 97, train_loss: 0.4162, test_loss: 1.0309, test_f1: 0.6822
 epoch: 98, train_loss: 0.4154, test_loss: 0.8760, test_f1: 0.6810
 epoch: 99, train_loss: 0.4058, test_loss: 1.1424, test_f1: 0.6769
##################ITERATION #1 ****************************************
 epoch: 0, train_loss: 1.0812, test_loss: 1.1062, test_f1: 0.3526
 epoch: 1, train_loss: 1.0145, test_loss: 1.0311, test_f1: 0.4705
 epoch: 2, train_loss: 1.0067, test_loss: 1.0321, test_f1: 0.4678
 epoch: 3, train_loss: 0.9589, test_loss: 0.9810, test_f1: 0.5060
 epoch: 4, train_loss: 0.9365, test_loss: 0.9384, test_f1: 0.4771
 epoch: 5, train_loss: 0.9481, test_loss: 0.9691, test_f1: 0.4873
 epoch: 6, train_loss: 0.9240, test_loss: 0.9310, test_f1: 0.5041
 epoch: 7, train_loss: 0.9014, test_loss: 0.8848, test_f1: 0.5039
 epoch: 8, train_loss: 0.9087, test_loss: 0.9803, test_f1: 0.5178
 epoch: 9, train_loss: 0.8974, test_loss: 0.8901, test_f1: 0.5167
 epoch: 10, train_loss: 0.8897, test_loss: 0.8462, test_f1: 0.5162
 epoch: 11, train_loss: 0.8765, test_loss: 0.8391, test_f1: 0.5559
 epoch: 12, train_loss: 0.8645, test_loss: 0.8294, test_f1: 0.5323
 epoch: 13, train_loss: 0.8799, test_loss: 0.8371, test_f1: 0.5517
 epoch: 14, train_loss: 0.8515, test_loss: 0.8070, test_f1: 0.5857
 epoch: 15, train_loss: 0.8471, test_loss: 0.8426, test_f1: 0.5323
 epoch: 16, train_loss: 0.8481, test_loss: 0.9671, test_f1: 0.5403
 epoch: 17, train_loss: 0.8422, test_loss: 0.7906, test_f1: 0.5485
 epoch: 18, train_loss: 0.8166, test_loss: 0.8254, test_f1: 0.5459
 epoch: 19, train_loss: 0.8130, test_loss: 0.8258, test_f1: 0.5706
 epoch: 20, train_loss: 0.8074, test_loss: 0.8400, test_f1: 0.5452
 epoch: 21, train_loss: 0.8002, test_loss: 0.7870, test_f1: 0.5624
 epoch: 22, train_loss: 0.7859, test_loss: 0.7866, test_f1: 0.5522
 epoch: 23, train_loss: 0.8005, test_loss: 0.9369, test_f1: 0.5119
 epoch: 24, train_loss: 0.7934, test_loss: 0.8950, test_f1: 0.5754
 epoch: 25, train_loss: 0.7957, test_loss: 0.8167, test_f1: 0.5726
 epoch: 26, train_loss: 0.8261, test_loss: 0.8123, test_f1: 0.5587
 epoch: 27, train_loss: 0.8082, test_loss: 0.8030, test_f1: 0.5422
 epoch: 28, train_loss: 0.7652, test_loss: 0.8029, test_f1: 0.6154
 epoch: 29, train_loss: 0.7395, test_loss: 0.9480, test_f1: 0.5717
 epoch: 30, train_loss: 0.7637, test_loss: 0.8002, test_f1: 0.6031
 epoch: 31, train_loss: 0.7666, test_loss: 0.8175, test_f1: 0.6270
 epoch: 32, train_loss: 0.7727, test_loss: 0.8854, test_f1: 0.6053
 epoch: 33, train_loss: 0.7666, test_loss: 0.8656, test_f1: 0.6169
 epoch: 34, train_loss: 0.7483, test_loss: 0.8438, test_f1: 0.5909
 epoch: 35, train_loss: 0.7471, test_loss: 0.7732, test_f1: 0.6203
 epoch: 36, train_loss: 0.7170, test_loss: 0.7542, test_f1: 0.6171
 epoch: 37, train_loss: 0.7284, test_loss: 0.8304, test_f1: 0.6379
 epoch: 38, train_loss: 0.7749, test_loss: 0.7318, test_f1: 0.6054
 epoch: 39, train_loss: 0.7526, test_loss: 0.7561, test_f1: 0.6544
 epoch: 40, train_loss: 0.7404, test_loss: 0.8397, test_f1: 0.6280
 epoch: 41, train_loss: 0.7364, test_loss: 0.7756, test_f1: 0.5856
 epoch: 42, train_loss: 0.7227, test_loss: 0.8056, test_f1: 0.6318
 epoch: 43, train_loss: 0.7035, test_loss: 0.8040, test_f1: 0.6131
 epoch: 44, train_loss: 0.7106, test_loss: 0.7933, test_f1: 0.6416
 epoch: 45, train_loss: 0.7045, test_loss: 0.7451, test_f1: 0.6511
 epoch: 46, train_loss: 0.6876, test_loss: 0.7841, test_f1: 0.6126
 epoch: 47, train_loss: 0.6857, test_loss: 0.8323, test_f1: 0.6209
 epoch: 48, train_loss: 0.6795, test_loss: 0.8388, test_f1: 0.5646
 epoch: 49, train_loss: 0.6977, test_loss: 0.9468, test_f1: 0.5731
 epoch: 50, train_loss: 0.6924, test_loss: 1.0037, test_f1: 0.6229
 epoch: 51, train_loss: 0.6400, test_loss: 0.7531, test_f1: 0.6652
 epoch: 52, train_loss: 0.6182, test_loss: 0.8357, test_f1: 0.6525
 epoch: 53, train_loss: 0.6215, test_loss: 0.8902, test_f1: 0.6581
 epoch: 54, train_loss: 0.6214, test_loss: 0.9189, test_f1: 0.6766
 epoch: 55, train_loss: 0.6181, test_loss: 0.8404, test_f1: 0.6658
 epoch: 56, train_loss: 0.6012, test_loss: 0.7975, test_f1: 0.6510
 epoch: 57, train_loss: 0.5912, test_loss: 0.9717, test_f1: 0.6460
 epoch: 58, train_loss: 0.5726, test_loss: 0.8481, test_f1: 0.6485
 epoch: 59, train_loss: 0.5631, test_loss: 0.9606, test_f1: 0.6794
 epoch: 60, train_loss: 0.5875, test_loss: 0.8662, test_f1: 0.6766
 epoch: 61, train_loss: 0.5570, test_loss: 0.9105, test_f1: 0.6613
 epoch: 62, train_loss: 0.5544, test_loss: 0.8724, test_f1: 0.6702
 epoch: 63, train_loss: 0.5672, test_loss: 0.9427, test_f1: 0.6623
 epoch: 64, train_loss: 0.5713, test_loss: 0.8208, test_f1: 0.6707
 epoch: 65, train_loss: 0.5525, test_loss: 1.0433, test_f1: 0.6719
 epoch: 66, train_loss: 0.5280, test_loss: 1.0234, test_f1: 0.7033
 epoch: 67, train_loss: 0.5361, test_loss: 0.9311, test_f1: 0.6640
 epoch: 68, train_loss: 0.5436, test_loss: 0.9930, test_f1: 0.6786
 epoch: 69, train_loss: 0.5431, test_loss: 0.9890, test_f1: 0.6887
 epoch: 70, train_loss: 0.5294, test_loss: 1.0881, test_f1: 0.6639
 epoch: 71, train_loss: 0.5290, test_loss: 0.9025, test_f1: 0.6725
 epoch: 72, train_loss: 0.5286, test_loss: 0.9423, test_f1: 0.6663
 epoch: 73, train_loss: 0.5231, test_loss: 0.9255, test_f1: 0.6762
 epoch: 74, train_loss: 0.5020, test_loss: 0.9527, test_f1: 0.6970
 epoch: 75, train_loss: 0.5316, test_loss: 1.0075, test_f1: 0.6650
 epoch: 76, train_loss: 0.5068, test_loss: 0.8963, test_f1: 0.6813
 epoch: 77, train_loss: 0.5050, test_loss: 1.0074, test_f1: 0.7038
 epoch: 78, train_loss: 0.4942, test_loss: 0.9878, test_f1: 0.6777
 epoch: 79, train_loss: 0.5162, test_loss: 0.9037, test_f1: 0.7045
 epoch: 80, train_loss: 0.5073, test_loss: 0.8472, test_f1: 0.6802
 epoch: 81, train_loss: 0.4908, test_loss: 0.9746, test_f1: 0.6750
 epoch: 82, train_loss: 0.4921, test_loss: 0.9911, test_f1: 0.6742
 epoch: 83, train_loss: 0.4691, test_loss: 0.9380, test_f1: 0.7033
 epoch: 84, train_loss: 0.4790, test_loss: 1.1024, test_f1: 0.6645
 epoch: 85, train_loss: 0.4966, test_loss: 1.0371, test_f1: 0.6606
 epoch: 86, train_loss: 0.4908, test_loss: 1.0295, test_f1: 0.6734
 epoch: 87, train_loss: 0.4885, test_loss: 0.9769, test_f1: 0.6717
 epoch: 88, train_loss: 0.4643, test_loss: 1.0874, test_f1: 0.6863
 epoch: 89, train_loss: 0.4810, test_loss: 0.9468, test_f1: 0.6950
 epoch: 90, train_loss: 0.4721, test_loss: 0.8883, test_f1: 0.6745
 epoch: 91, train_loss: 0.4683, test_loss: 0.9166, test_f1: 0.6700
 epoch: 92, train_loss: 0.4598, test_loss: 0.9260, test_f1: 0.6919
 epoch: 93, train_loss: 0.4554, test_loss: 0.9443, test_f1: 0.6762
 epoch: 94, train_loss: 0.4578, test_loss: 1.0446, test_f1: 0.6967
 epoch: 95, train_loss: 0.4581, test_loss: 0.9264, test_f1: 0.6885
 epoch: 96, train_loss: 0.4493, test_loss: 1.1370, test_f1: 0.6643
 epoch: 97, train_loss: 0.4721, test_loss: 1.0533, test_f1: 0.6819
 epoch: 98, train_loss: 0.4463, test_loss: 0.8873, test_f1: 0.6944
 epoch: 99, train_loss: 0.4485, test_loss: 0.9502, test_f1: 0.6919
##################ITERATION #2 ****************************************
 epoch: 0, train_loss: 1.1346, test_loss: 1.5264, test_f1: 0.4069
 epoch: 1, train_loss: 1.0478, test_loss: 1.0522, test_f1: 0.3690
 epoch: 2, train_loss: 1.0265, test_loss: 1.0103, test_f1: 0.4563
 epoch: 3, train_loss: 0.9795, test_loss: 1.0746, test_f1: 0.5293
 epoch: 4, train_loss: 0.9677, test_loss: 1.0621, test_f1: 0.5010
 epoch: 5, train_loss: 0.9469, test_loss: 0.9648, test_f1: 0.4920
 epoch: 6, train_loss: 0.9621, test_loss: 0.9206, test_f1: 0.5034
 epoch: 7, train_loss: 0.9469, test_loss: 0.9033, test_f1: 0.5138
 epoch: 8, train_loss: 0.9325, test_loss: 0.9684, test_f1: 0.4875
 epoch: 9, train_loss: 0.9231, test_loss: 0.9859, test_f1: 0.5231
 epoch: 10, train_loss: 0.9014, test_loss: 1.0574, test_f1: 0.4883
 epoch: 11, train_loss: 0.8922, test_loss: 0.8612, test_f1: 0.5552
 epoch: 12, train_loss: 0.8935, test_loss: 0.8968, test_f1: 0.5135
 epoch: 13, train_loss: 0.9237, test_loss: 0.9086, test_f1: 0.5186
 epoch: 14, train_loss: 0.8875, test_loss: 0.9722, test_f1: 0.4958
 epoch: 15, train_loss: 0.8714, test_loss: 1.0217, test_f1: 0.4717
 epoch: 16, train_loss: 0.8594, test_loss: 0.8810, test_f1: 0.5494
 epoch: 17, train_loss: 0.8565, test_loss: 0.9258, test_f1: 0.5327
 epoch: 18, train_loss: 0.8415, test_loss: 0.9330, test_f1: 0.5646
 epoch: 19, train_loss: 0.8474, test_loss: 0.9137, test_f1: 0.5486
 epoch: 20, train_loss: 0.8305, test_loss: 0.9548, test_f1: 0.5534
 epoch: 21, train_loss: 0.8270, test_loss: 0.8629, test_f1: 0.5461
 epoch: 22, train_loss: 0.8348, test_loss: 0.8716, test_f1: 0.5721
 epoch: 23, train_loss: 0.8032, test_loss: 0.9134, test_f1: 0.5597
 epoch: 24, train_loss: 0.8088, test_loss: 0.9222, test_f1: 0.5492
 epoch: 25, train_loss: 0.8171, test_loss: 1.0617, test_f1: 0.5418
 epoch: 26, train_loss: 0.7992, test_loss: 0.8842, test_f1: 0.5767
 epoch: 27, train_loss: 0.7693, test_loss: 0.8435, test_f1: 0.5878
 epoch: 28, train_loss: 0.7971, test_loss: 0.8748, test_f1: 0.6207
 epoch: 29, train_loss: 0.7798, test_loss: 0.8241, test_f1: 0.5943
 epoch: 30, train_loss: 0.7699, test_loss: 0.8728, test_f1: 0.6180
 epoch: 31, train_loss: 0.7611, test_loss: 0.9979, test_f1: 0.5755
 epoch: 32, train_loss: 0.8016, test_loss: 1.0941, test_f1: 0.5991
 epoch: 33, train_loss: 0.7815, test_loss: 0.9840, test_f1: 0.5814
 epoch: 34, train_loss: 0.7798, test_loss: 1.0024, test_f1: 0.5142
 epoch: 35, train_loss: 0.7750, test_loss: 0.8038, test_f1: 0.6016
 epoch: 36, train_loss: 0.7630, test_loss: 0.8349, test_f1: 0.6281
 epoch: 37, train_loss: 0.7543, test_loss: 0.9213, test_f1: 0.6179
 epoch: 38, train_loss: 0.7364, test_loss: 0.8775, test_f1: 0.6094
 epoch: 39, train_loss: 0.7600, test_loss: 0.9686, test_f1: 0.5707
 epoch: 40, train_loss: 0.7482, test_loss: 0.8651, test_f1: 0.6494
 epoch: 41, train_loss: 0.7113, test_loss: 0.9818, test_f1: 0.6190
 epoch: 42, train_loss: 0.7337, test_loss: 0.9575, test_f1: 0.6517
 epoch: 43, train_loss: 0.7304, test_loss: 0.8990, test_f1: 0.6174
 epoch: 44, train_loss: 0.7494, test_loss: 0.8433, test_f1: 0.6133
 epoch: 45, train_loss: 0.7161, test_loss: 0.8735, test_f1: 0.6855
 epoch: 46, train_loss: 0.6926, test_loss: 0.8003, test_f1: 0.6176
 epoch: 47, train_loss: 0.6833, test_loss: 0.8319, test_f1: 0.6074
 epoch: 48, train_loss: 0.7075, test_loss: 1.0189, test_f1: 0.6264
 epoch: 49, train_loss: 0.6743, test_loss: 0.8797, test_f1: 0.6817
 epoch: 50, train_loss: 0.6766, test_loss: 0.9887, test_f1: 0.6142
 epoch: 51, train_loss: 0.6347, test_loss: 0.8518, test_f1: 0.7029
 epoch: 52, train_loss: 0.6200, test_loss: 0.8917, test_f1: 0.6510
 epoch: 53, train_loss: 0.6084, test_loss: 0.9114, test_f1: 0.6624
 epoch: 54, train_loss: 0.6255, test_loss: 0.8480, test_f1: 0.6631
 epoch: 55, train_loss: 0.6200, test_loss: 0.8752, test_f1: 0.6573
 epoch: 56, train_loss: 0.5944, test_loss: 0.9510, test_f1: 0.6688
 epoch: 57, train_loss: 0.5829, test_loss: 0.9801, test_f1: 0.6770
 epoch: 58, train_loss: 0.5826, test_loss: 1.0362, test_f1: 0.6301
 epoch: 59, train_loss: 0.5822, test_loss: 0.9035, test_f1: 0.6852
 epoch: 60, train_loss: 0.5811, test_loss: 0.9803, test_f1: 0.6796
 epoch: 61, train_loss: 0.5548, test_loss: 1.0513, test_f1: 0.6876
 epoch: 62, train_loss: 0.5580, test_loss: 1.0421, test_f1: 0.6687
 epoch: 63, train_loss: 0.5890, test_loss: 1.0867, test_f1: 0.6514
 epoch: 64, train_loss: 0.5682, test_loss: 1.0279, test_f1: 0.6791
 epoch: 65, train_loss: 0.5599, test_loss: 1.0824, test_f1: 0.6643
 epoch: 66, train_loss: 0.5434, test_loss: 0.9600, test_f1: 0.6877
 epoch: 67, train_loss: 0.5500, test_loss: 0.9663, test_f1: 0.6585
 epoch: 68, train_loss: 0.5538, test_loss: 1.0676, test_f1: 0.6578
 epoch: 69, train_loss: 0.5584, test_loss: 0.9917, test_f1: 0.6649
 epoch: 70, train_loss: 0.5323, test_loss: 1.0021, test_f1: 0.6855
 epoch: 71, train_loss: 0.5484, test_loss: 1.0840, test_f1: 0.6686
 epoch: 72, train_loss: 0.5363, test_loss: 1.0707, test_f1: 0.6764
 epoch: 73, train_loss: 0.5088, test_loss: 1.1442, test_f1: 0.6918
 epoch: 74, train_loss: 0.5106, test_loss: 1.0345, test_f1: 0.6763
 epoch: 75, train_loss: 0.5194, test_loss: 1.0534, test_f1: 0.6453
 epoch: 76, train_loss: 0.5087, test_loss: 1.1569, test_f1: 0.6592
 epoch: 77, train_loss: 0.4974, test_loss: 1.1427, test_f1: 0.6734
 epoch: 78, train_loss: 0.5078, test_loss: 1.0577, test_f1: 0.6760
 epoch: 79, train_loss: 0.4978, test_loss: 1.1456, test_f1: 0.6502
 epoch: 80, train_loss: 0.5093, test_loss: 1.0480, test_f1: 0.6908
 epoch: 81, train_loss: 0.4958, test_loss: 0.9697, test_f1: 0.6865
 epoch: 82, train_loss: 0.4955, test_loss: 1.0476, test_f1: 0.6604
 epoch: 83, train_loss: 0.4884, test_loss: 1.0824, test_f1: 0.6943
 epoch: 84, train_loss: 0.4748, test_loss: 1.0556, test_f1: 0.6724
 epoch: 85, train_loss: 0.4590, test_loss: 0.9936, test_f1: 0.6737
 epoch: 86, train_loss: 0.4670, test_loss: 1.1924, test_f1: 0.6758
 epoch: 87, train_loss: 0.4434, test_loss: 1.1933, test_f1: 0.6793
 epoch: 88, train_loss: 0.4650, test_loss: 1.1829, test_f1: 0.6799
 epoch: 89, train_loss: 0.4586, test_loss: 1.1372, test_f1: 0.6772
 epoch: 90, train_loss: 0.4522, test_loss: 1.2022, test_f1: 0.6492
 epoch: 91, train_loss: 0.4810, test_loss: 1.0710, test_f1: 0.6509
 epoch: 92, train_loss: 0.4330, test_loss: 1.0759, test_f1: 0.6938
 epoch: 93, train_loss: 0.4635, test_loss: 1.1532, test_f1: 0.6636
 epoch: 94, train_loss: 0.4559, test_loss: 1.0734, test_f1: 0.6884
 epoch: 95, train_loss: 0.4350, test_loss: 1.1347, test_f1: 0.6848
 epoch: 96, train_loss: 0.4491, test_loss: 1.1592, test_f1: 0.6904
 epoch: 97, train_loss: 0.4459, test_loss: 1.1650, test_f1: 0.6459
 epoch: 98, train_loss: 0.4208, test_loss: 1.1119, test_f1: 0.6838
 epoch: 99, train_loss: 0.4338, test_loss: 1.2988, test_f1: 0.6654
##################ITERATION #3 ****************************************
 epoch: 0, train_loss: 1.1241, test_loss: 1.4162, test_f1: 0.3695
 epoch: 1, train_loss: 1.0327, test_loss: 0.9720, test_f1: 0.4474
 epoch: 2, train_loss: 0.9804, test_loss: 0.9446, test_f1: 0.4946
 epoch: 3, train_loss: 0.9598, test_loss: 0.9131, test_f1: 0.5111
 epoch: 4, train_loss: 0.9434, test_loss: 1.0078, test_f1: 0.4598
 epoch: 5, train_loss: 0.9328, test_loss: 1.0505, test_f1: 0.4039
 epoch: 6, train_loss: 0.9287, test_loss: 0.9085, test_f1: 0.5052
 epoch: 7, train_loss: 0.9142, test_loss: 1.0336, test_f1: 0.5280
 epoch: 8, train_loss: 0.8942, test_loss: 0.9285, test_f1: 0.4635
 epoch: 9, train_loss: 0.8995, test_loss: 0.9862, test_f1: 0.5084
 epoch: 10, train_loss: 0.8964, test_loss: 0.9640, test_f1: 0.5529
 epoch: 11, train_loss: 0.8892, test_loss: 0.9085, test_f1: 0.5442
 epoch: 12, train_loss: 0.8727, test_loss: 0.9098, test_f1: 0.5444
 epoch: 13, train_loss: 0.8779, test_loss: 0.8091, test_f1: 0.5479
 epoch: 14, train_loss: 0.8677, test_loss: 1.0067, test_f1: 0.5791
 epoch: 15, train_loss: 0.8600, test_loss: 0.8144, test_f1: 0.6248
 epoch: 16, train_loss: 0.8347, test_loss: 1.0763, test_f1: 0.5050
 epoch: 17, train_loss: 0.8365, test_loss: 1.1070, test_f1: 0.5074
 epoch: 18, train_loss: 0.8367, test_loss: 0.9438, test_f1: 0.5974
 epoch: 19, train_loss: 0.8200, test_loss: 0.9215, test_f1: 0.6167
 epoch: 20, train_loss: 0.8290, test_loss: 0.8370, test_f1: 0.6033
 epoch: 21, train_loss: 0.8123, test_loss: 0.9235, test_f1: 0.5936
 epoch: 22, train_loss: 0.7907, test_loss: 0.9755, test_f1: 0.5924
 epoch: 23, train_loss: 0.8065, test_loss: 0.8045, test_f1: 0.5893
 epoch: 24, train_loss: 0.7846, test_loss: 0.9234, test_f1: 0.6415
 epoch: 25, train_loss: 0.7650, test_loss: 1.0153, test_f1: 0.5458
 epoch: 26, train_loss: 0.7666, test_loss: 0.8898, test_f1: 0.6206
 epoch: 27, train_loss: 0.7547, test_loss: 0.8519, test_f1: 0.5867
 epoch: 28, train_loss: 0.7569, test_loss: 0.8919, test_f1: 0.5715
 epoch: 29, train_loss: 0.7558, test_loss: 0.9160, test_f1: 0.6133
 epoch: 30, train_loss: 0.7421, test_loss: 1.0774, test_f1: 0.5406
 epoch: 31, train_loss: 0.7645, test_loss: 0.8146, test_f1: 0.6064
 epoch: 32, train_loss: 0.7330, test_loss: 0.9650, test_f1: 0.6199
 epoch: 33, train_loss: 0.7321, test_loss: 0.7776, test_f1: 0.6328
 epoch: 34, train_loss: 0.7371, test_loss: 0.8840, test_f1: 0.6180
 epoch: 35, train_loss: 0.7200, test_loss: 0.9222, test_f1: 0.6271
 epoch: 36, train_loss: 0.7099, test_loss: 1.0081, test_f1: 0.6610
 epoch: 37, train_loss: 0.6962, test_loss: 0.9556, test_f1: 0.6201
 epoch: 38, train_loss: 0.6742, test_loss: 0.9701, test_f1: 0.6356
 epoch: 39, train_loss: 0.6777, test_loss: 0.9816, test_f1: 0.6166
 epoch: 40, train_loss: 0.6654, test_loss: 1.0002, test_f1: 0.6391
 epoch: 41, train_loss: 0.6931, test_loss: 0.9500, test_f1: 0.6359
 epoch: 42, train_loss: 0.6565, test_loss: 1.0153, test_f1: 0.6381
 epoch: 43, train_loss: 0.6723, test_loss: 0.9043, test_f1: 0.6201
 epoch: 44, train_loss: 0.6738, test_loss: 0.9933, test_f1: 0.6674
 epoch: 45, train_loss: 0.6689, test_loss: 1.1185, test_f1: 0.5982
 epoch: 46, train_loss: 0.7040, test_loss: 0.7834, test_f1: 0.6437
 epoch: 47, train_loss: 0.6527, test_loss: 1.0263, test_f1: 0.6627
 epoch: 48, train_loss: 0.6788, test_loss: 0.8852, test_f1: 0.6420
 epoch: 49, train_loss: 0.6952, test_loss: 0.9411, test_f1: 0.6501
 epoch: 50, train_loss: 0.6441, test_loss: 0.9704, test_f1: 0.6612
 epoch: 51, train_loss: 0.6141, test_loss: 1.0695, test_f1: 0.6266
 epoch: 52, train_loss: 0.6029, test_loss: 0.9926, test_f1: 0.6534
 epoch: 53, train_loss: 0.5911, test_loss: 1.0485, test_f1: 0.6627
 epoch: 54, train_loss: 0.5724, test_loss: 1.1129, test_f1: 0.6578
 epoch: 55, train_loss: 0.5603, test_loss: 1.0681, test_f1: 0.6690
 epoch: 56, train_loss: 0.5602, test_loss: 1.1021, test_f1: 0.6507
 epoch: 57, train_loss: 0.5668, test_loss: 1.0611, test_f1: 0.6482
 epoch: 58, train_loss: 0.5636, test_loss: 1.1130, test_f1: 0.6593
 epoch: 59, train_loss: 0.5494, test_loss: 1.1400, test_f1: 0.6789
 epoch: 60, train_loss: 0.5304, test_loss: 1.1619, test_f1: 0.6510
 epoch: 61, train_loss: 0.5448, test_loss: 1.1255, test_f1: 0.6662
 epoch: 62, train_loss: 0.5640, test_loss: 1.1068, test_f1: 0.6526
 epoch: 63, train_loss: 0.5417, test_loss: 1.1263, test_f1: 0.6817
 epoch: 64, train_loss: 0.5219, test_loss: 1.1353, test_f1: 0.6443
 epoch: 65, train_loss: 0.5328, test_loss: 1.2056, test_f1: 0.6505
 epoch: 66, train_loss: 0.5175, test_loss: 1.1296, test_f1: 0.6633
 epoch: 67, train_loss: 0.5273, test_loss: 1.1668, test_f1: 0.6704
 epoch: 68, train_loss: 0.5222, test_loss: 1.3258, test_f1: 0.6457
 epoch: 69, train_loss: 0.5398, test_loss: 1.1473, test_f1: 0.6747
 epoch: 70, train_loss: 0.5119, test_loss: 1.2660, test_f1: 0.6675
 epoch: 71, train_loss: 0.5053, test_loss: 1.1409, test_f1: 0.6577
 epoch: 72, train_loss: 0.5227, test_loss: 1.1028, test_f1: 0.6496
 epoch: 73, train_loss: 0.5200, test_loss: 1.3745, test_f1: 0.6852
 epoch: 74, train_loss: 0.5106, test_loss: 1.2183, test_f1: 0.6819
 epoch: 75, train_loss: 0.4987, test_loss: 1.1753, test_f1: 0.6817
 epoch: 76, train_loss: 0.5072, test_loss: 1.0696, test_f1: 0.6736
 epoch: 77, train_loss: 0.4830, test_loss: 1.2911, test_f1: 0.6749
 epoch: 78, train_loss: 0.4911, test_loss: 1.1585, test_f1: 0.6810
 epoch: 79, train_loss: 0.4714, test_loss: 1.3290, test_f1: 0.6725
 epoch: 80, train_loss: 0.4781, test_loss: 1.2857, test_f1: 0.6736
 epoch: 81, train_loss: 0.4777, test_loss: 1.2741, test_f1: 0.6731
 epoch: 82, train_loss: 0.4718, test_loss: 1.2810, test_f1: 0.6899
 epoch: 83, train_loss: 0.4758, test_loss: 1.2876, test_f1: 0.6774
 epoch: 84, train_loss: 0.4634, test_loss: 1.2822, test_f1: 0.6844
 epoch: 85, train_loss: 0.4810, test_loss: 1.3011, test_f1: 0.6903
 epoch: 86, train_loss: 0.4718, test_loss: 1.2457, test_f1: 0.6737
 epoch: 87, train_loss: 0.4608, test_loss: 1.2903, test_f1: 0.6829
 epoch: 88, train_loss: 0.4455, test_loss: 1.3949, test_f1: 0.6684
 epoch: 89, train_loss: 0.4689, test_loss: 1.3540, test_f1: 0.6682
 epoch: 90, train_loss: 0.4714, test_loss: 1.1995, test_f1: 0.6670
 epoch: 91, train_loss: 0.4517, test_loss: 1.2099, test_f1: 0.6584
 epoch: 92, train_loss: 0.4423, test_loss: 1.3214, test_f1: 0.6769
 epoch: 93, train_loss: 0.4526, test_loss: 1.3820, test_f1: 0.6657
 epoch: 94, train_loss: 0.4346, test_loss: 1.4008, test_f1: 0.6348
 epoch: 95, train_loss: 0.4474, test_loss: 1.3913, test_f1: 0.6654
 epoch: 96, train_loss: 0.4196, test_loss: 1.2507, test_f1: 0.6566
 epoch: 97, train_loss: 0.4326, test_loss: 1.4872, test_f1: 0.6684
 epoch: 98, train_loss: 0.4384, test_loss: 1.2148, test_f1: 0.6769
 epoch: 99, train_loss: 0.4296, test_loss: 1.4083, test_f1: 0.6600
##################ITERATION #4 ****************************************
 epoch: 0, train_loss: 1.1558, test_loss: 1.0663, test_f1: 0.3838
 epoch: 1, train_loss: 1.0107, test_loss: 1.0543, test_f1: 0.4680
 epoch: 2, train_loss: 0.9747, test_loss: 1.0215, test_f1: 0.5179
 epoch: 3, train_loss: 0.9458, test_loss: 0.8945, test_f1: 0.4874
 epoch: 4, train_loss: 0.9468, test_loss: 0.9262, test_f1: 0.5031
 epoch: 5, train_loss: 0.9059, test_loss: 0.8975, test_f1: 0.5052
 epoch: 6, train_loss: 0.9107, test_loss: 1.0550, test_f1: 0.5009
 epoch: 7, train_loss: 0.9089, test_loss: 0.8857, test_f1: 0.5752
 epoch: 8, train_loss: 0.8821, test_loss: 0.8724, test_f1: 0.5495
 epoch: 9, train_loss: 0.8736, test_loss: 0.8147, test_f1: 0.5847
 epoch: 10, train_loss: 0.8724, test_loss: 0.8595, test_f1: 0.5440
 epoch: 11, train_loss: 0.8659, test_loss: 0.9559, test_f1: 0.5329
 epoch: 12, train_loss: 0.8496, test_loss: 0.8790, test_f1: 0.5221
 epoch: 13, train_loss: 0.8322, test_loss: 0.8838, test_f1: 0.5632
 epoch: 14, train_loss: 0.8400, test_loss: 0.8911, test_f1: 0.5333
 epoch: 15, train_loss: 0.8282, test_loss: 0.8639, test_f1: 0.5509
 epoch: 16, train_loss: 0.8132, test_loss: 0.9257, test_f1: 0.5505
 epoch: 17, train_loss: 0.8124, test_loss: 0.8245, test_f1: 0.6159
 epoch: 18, train_loss: 0.8033, test_loss: 0.9054, test_f1: 0.5886
 epoch: 19, train_loss: 0.8109, test_loss: 0.9003, test_f1: 0.6571
 epoch: 20, train_loss: 0.7718, test_loss: 0.8996, test_f1: 0.5392
 epoch: 21, train_loss: 0.7756, test_loss: 0.8399, test_f1: 0.5667
 epoch: 22, train_loss: 0.7517, test_loss: 0.9504, test_f1: 0.5514
 epoch: 23, train_loss: 0.8447, test_loss: 0.9401, test_f1: 0.5550
 epoch: 24, train_loss: 0.7882, test_loss: 0.8078, test_f1: 0.6251
 epoch: 25, train_loss: 0.7949, test_loss: 0.9947, test_f1: 0.5911
 epoch: 26, train_loss: 0.7709, test_loss: 0.8997, test_f1: 0.5996
 epoch: 27, train_loss: 0.8136, test_loss: 0.8875, test_f1: 0.6144
 epoch: 28, train_loss: 0.7760, test_loss: 0.9232, test_f1: 0.5845
 epoch: 29, train_loss: 0.7245, test_loss: 0.8147, test_f1: 0.6531
 epoch: 30, train_loss: 0.7225, test_loss: 1.0620, test_f1: 0.5303
 epoch: 31, train_loss: 0.7172, test_loss: 0.7577, test_f1: 0.6586
 epoch: 32, train_loss: 0.7522, test_loss: 0.7883, test_f1: 0.6360
 epoch: 33, train_loss: 0.7417, test_loss: 0.8472, test_f1: 0.6590
 epoch: 34, train_loss: 0.7089, test_loss: 0.8783, test_f1: 0.6276
 epoch: 35, train_loss: 0.7138, test_loss: 0.8332, test_f1: 0.6127
 epoch: 36, train_loss: 0.7008, test_loss: 0.7671, test_f1: 0.6089
 epoch: 37, train_loss: 0.6911, test_loss: 0.7505, test_f1: 0.6515
 epoch: 38, train_loss: 0.6856, test_loss: 0.9800, test_f1: 0.6353
 epoch: 39, train_loss: 0.6929, test_loss: 0.8888, test_f1: 0.6465
 epoch: 40, train_loss: 0.6801, test_loss: 0.7855, test_f1: 0.6625
 epoch: 41, train_loss: 0.6845, test_loss: 0.8595, test_f1: 0.6279
 epoch: 42, train_loss: 0.6597, test_loss: 1.0124, test_f1: 0.5956
 epoch: 43, train_loss: 0.7023, test_loss: 0.9069, test_f1: 0.6257
 epoch: 44, train_loss: 0.6636, test_loss: 0.8884, test_f1: 0.6394
 epoch: 45, train_loss: 0.6749, test_loss: 0.9512, test_f1: 0.6281
 epoch: 46, train_loss: 0.6727, test_loss: 0.9074, test_f1: 0.6194
 epoch: 47, train_loss: 0.6564, test_loss: 0.7410, test_f1: 0.6696
 epoch: 48, train_loss: 0.6326, test_loss: 0.8701, test_f1: 0.6826
 epoch: 49, train_loss: 0.6360, test_loss: 0.8313, test_f1: 0.6245
 epoch: 50, train_loss: 0.6397, test_loss: 0.8924, test_f1: 0.6522
 epoch: 51, train_loss: 0.6004, test_loss: 0.8997, test_f1: 0.6708
 epoch: 52, train_loss: 0.5848, test_loss: 0.9080, test_f1: 0.6695
 epoch: 53, train_loss: 0.5679, test_loss: 0.8274, test_f1: 0.6716
 epoch: 54, train_loss: 0.5726, test_loss: 0.9186, test_f1: 0.6556
 epoch: 55, train_loss: 0.5520, test_loss: 0.8816, test_f1: 0.6668
 epoch: 56, train_loss: 0.5781, test_loss: 1.0047, test_f1: 0.6670
 epoch: 57, train_loss: 0.5542, test_loss: 0.9681, test_f1: 0.6518
 epoch: 58, train_loss: 0.5370, test_loss: 1.0047, test_f1: 0.6798
 epoch: 59, train_loss: 0.5485, test_loss: 1.0354, test_f1: 0.6521
 epoch: 60, train_loss: 0.5418, test_loss: 0.9208, test_f1: 0.6635
 epoch: 61, train_loss: 0.5401, test_loss: 1.0270, test_f1: 0.6615
 epoch: 62, train_loss: 0.5552, test_loss: 0.9230, test_f1: 0.6432
 epoch: 63, train_loss: 0.5214, test_loss: 1.2200, test_f1: 0.6530
 epoch: 64, train_loss: 0.5131, test_loss: 1.1111, test_f1: 0.6592
 epoch: 65, train_loss: 0.5242, test_loss: 0.8560, test_f1: 0.6657
 epoch: 66, train_loss: 0.5024, test_loss: 1.0652, test_f1: 0.6683
 epoch: 67, train_loss: 0.5201, test_loss: 1.0225, test_f1: 0.6539
 epoch: 68, train_loss: 0.5223, test_loss: 1.0782, test_f1: 0.6568
 epoch: 69, train_loss: 0.5110, test_loss: 0.9472, test_f1: 0.6682
 epoch: 70, train_loss: 0.4888, test_loss: 1.0304, test_f1: 0.6731
 epoch: 71, train_loss: 0.4930, test_loss: 0.9497, test_f1: 0.6590
 epoch: 72, train_loss: 0.5046, test_loss: 0.9546, test_f1: 0.6500
 epoch: 73, train_loss: 0.5010, test_loss: 1.1699, test_f1: 0.6643
 epoch: 74, train_loss: 0.5147, test_loss: 0.8609, test_f1: 0.6623
 epoch: 75, train_loss: 0.5002, test_loss: 1.0395, test_f1: 0.6582
 epoch: 76, train_loss: 0.4951, test_loss: 1.0690, test_f1: 0.6803
 epoch: 77, train_loss: 0.4952, test_loss: 1.1434, test_f1: 0.6591
 epoch: 78, train_loss: 0.4904, test_loss: 1.1110, test_f1: 0.6660
 epoch: 79, train_loss: 0.4898, test_loss: 0.9702, test_f1: 0.6740
 epoch: 80, train_loss: 0.4892, test_loss: 0.9570, test_f1: 0.6623
 epoch: 81, train_loss: 0.4978, test_loss: 1.0207, test_f1: 0.6553
 epoch: 82, train_loss: 0.4689, test_loss: 1.0376, test_f1: 0.6788
 epoch: 83, train_loss: 0.4860, test_loss: 0.9779, test_f1: 0.6604
 epoch: 84, train_loss: 0.4565, test_loss: 1.1547, test_f1: 0.6895
 epoch: 85, train_loss: 0.4533, test_loss: 1.0774, test_f1: 0.6769
 epoch: 86, train_loss: 0.4801, test_loss: 1.0458, test_f1: 0.6627
 epoch: 87, train_loss: 0.4550, test_loss: 1.0629, test_f1: 0.6756
 epoch: 88, train_loss: 0.4413, test_loss: 0.9854, test_f1: 0.6806
 epoch: 89, train_loss: 0.4495, test_loss: 1.1011, test_f1: 0.6630
 epoch: 90, train_loss: 0.4412, test_loss: 1.1469, test_f1: 0.6653
 epoch: 91, train_loss: 0.4483, test_loss: 1.1783, test_f1: 0.6310
 epoch: 92, train_loss: 0.4445, test_loss: 1.1660, test_f1: 0.6602
 epoch: 93, train_loss: 0.4359, test_loss: 1.1446, test_f1: 0.6595
 epoch: 94, train_loss: 0.4398, test_loss: 1.1617, test_f1: 0.6754
 epoch: 95, train_loss: 0.4392, test_loss: 1.0196, test_f1: 0.6616
 epoch: 96, train_loss: 0.4312, test_loss: 1.1036, test_f1: 0.6267
 epoch: 97, train_loss: 0.4326, test_loss: 1.2366, test_f1: 0.6742
 epoch: 98, train_loss: 0.4376, test_loss: 1.1307, test_f1: 0.6717
 epoch: 99, train_loss: 0.4174, test_loss: 1.0952, test_f1: 0.6574
##################ITERATION #5 ****************************************
 epoch: 0, train_loss: 1.1331, test_loss: 1.0205, test_f1: 0.4653
 epoch: 1, train_loss: 0.9975, test_loss: 1.0330, test_f1: 0.4430
 epoch: 2, train_loss: 0.9802, test_loss: 0.9505, test_f1: 0.4964
 epoch: 3, train_loss: 0.9662, test_loss: 0.9820, test_f1: 0.5222
 epoch: 4, train_loss: 0.9435, test_loss: 0.9196, test_f1: 0.4727
 epoch: 5, train_loss: 0.9402, test_loss: 0.9016, test_f1: 0.5264
 epoch: 6, train_loss: 0.9229, test_loss: 0.9041, test_f1: 0.5328
 epoch: 7, train_loss: 0.9068, test_loss: 1.5625, test_f1: 0.3812
 epoch: 8, train_loss: 0.9299, test_loss: 0.9292, test_f1: 0.4853
 epoch: 9, train_loss: 0.9411, test_loss: 0.9495, test_f1: 0.5197
 epoch: 10, train_loss: 0.8891, test_loss: 0.9636, test_f1: 0.5734
 epoch: 11, train_loss: 0.8741, test_loss: 1.1949, test_f1: 0.5508
 epoch: 12, train_loss: 0.8729, test_loss: 0.8559, test_f1: 0.5348
 epoch: 13, train_loss: 0.8599, test_loss: 0.8786, test_f1: 0.5551
 epoch: 14, train_loss: 0.8556, test_loss: 0.8441, test_f1: 0.5721
 epoch: 15, train_loss: 0.8436, test_loss: 0.8424, test_f1: 0.6001
 epoch: 16, train_loss: 0.8490, test_loss: 0.9134, test_f1: 0.5703
 epoch: 17, train_loss: 0.8262, test_loss: 0.8564, test_f1: 0.5659
 epoch: 18, train_loss: 0.8235, test_loss: 0.8495, test_f1: 0.5992
 epoch: 19, train_loss: 0.8061, test_loss: 0.8357, test_f1: 0.6230
 epoch: 20, train_loss: 0.8439, test_loss: 0.8570, test_f1: 0.5540
 epoch: 21, train_loss: 0.8050, test_loss: 0.9608, test_f1: 0.5632
 epoch: 22, train_loss: 0.8067, test_loss: 0.8733, test_f1: 0.5647
 epoch: 23, train_loss: 0.7958, test_loss: 0.8949, test_f1: 0.6087
 epoch: 24, train_loss: 0.7631, test_loss: 0.9161, test_f1: 0.6006
 epoch: 25, train_loss: 0.7885, test_loss: 1.0031, test_f1: 0.5922
 epoch: 26, train_loss: 0.8036, test_loss: 0.8565, test_f1: 0.6357
 epoch: 27, train_loss: 0.7938, test_loss: 0.8277, test_f1: 0.6213
 epoch: 28, train_loss: 0.7665, test_loss: 0.9062, test_f1: 0.6221
 epoch: 29, train_loss: 0.7904, test_loss: 0.8407, test_f1: 0.6258
 epoch: 30, train_loss: 0.7705, test_loss: 0.8493, test_f1: 0.6396
 epoch: 31, train_loss: 0.7576, test_loss: 0.8242, test_f1: 0.6405
 epoch: 32, train_loss: 0.7432, test_loss: 0.9084, test_f1: 0.6010
 epoch: 33, train_loss: 0.7400, test_loss: 0.9412, test_f1: 0.6414
 epoch: 34, train_loss: 0.7560, test_loss: 0.9076, test_f1: 0.6109
 epoch: 35, train_loss: 0.7334, test_loss: 0.8173, test_f1: 0.6322
 epoch: 36, train_loss: 0.7258, test_loss: 0.8646, test_f1: 0.5771
 epoch: 37, train_loss: 0.7290, test_loss: 0.8871, test_f1: 0.6178
 epoch: 38, train_loss: 0.7263, test_loss: 1.1232, test_f1: 0.4923
 epoch: 39, train_loss: 0.7435, test_loss: 0.9438, test_f1: 0.5390
 epoch: 40, train_loss: 0.7246, test_loss: 0.9645, test_f1: 0.5400
 epoch: 41, train_loss: 0.7147, test_loss: 0.7950, test_f1: 0.6489
 epoch: 42, train_loss: 0.7020, test_loss: 0.8161, test_f1: 0.6146
 epoch: 43, train_loss: 0.6997, test_loss: 0.7898, test_f1: 0.6011
 epoch: 44, train_loss: 0.6947, test_loss: 0.7960, test_f1: 0.6506
 epoch: 45, train_loss: 0.7044, test_loss: 0.7601, test_f1: 0.6186
 epoch: 46, train_loss: 0.7052, test_loss: 0.8202, test_f1: 0.6058
 epoch: 47, train_loss: 0.6651, test_loss: 0.7823, test_f1: 0.6393
 epoch: 48, train_loss: 0.6619, test_loss: 0.7829, test_f1: 0.6345
 epoch: 49, train_loss: 0.6553, test_loss: 0.7971, test_f1: 0.6386
 epoch: 50, train_loss: 0.6615, test_loss: 0.8672, test_f1: 0.6059
 epoch: 51, train_loss: 0.6274, test_loss: 0.7477, test_f1: 0.6633
 epoch: 52, train_loss: 0.6060, test_loss: 0.7569, test_f1: 0.6772
 epoch: 53, train_loss: 0.5959, test_loss: 0.8066, test_f1: 0.6510
 epoch: 54, train_loss: 0.5938, test_loss: 0.7298, test_f1: 0.6624
 epoch: 55, train_loss: 0.5760, test_loss: 0.7615, test_f1: 0.6741
 epoch: 56, train_loss: 0.5768, test_loss: 0.7828, test_f1: 0.6754
 epoch: 57, train_loss: 0.5673, test_loss: 0.8415, test_f1: 0.6648
 epoch: 58, train_loss: 0.5742, test_loss: 0.9147, test_f1: 0.6650
 epoch: 59, train_loss: 0.5424, test_loss: 0.7647, test_f1: 0.6635
 epoch: 60, train_loss: 0.5465, test_loss: 0.7998, test_f1: 0.6332
 epoch: 61, train_loss: 0.5441, test_loss: 0.7640, test_f1: 0.6595
 epoch: 62, train_loss: 0.5465, test_loss: 0.8012, test_f1: 0.6484
 epoch: 63, train_loss: 0.5641, test_loss: 0.8749, test_f1: 0.6777
 epoch: 64, train_loss: 0.5498, test_loss: 0.7111, test_f1: 0.6626
 epoch: 65, train_loss: 0.5494, test_loss: 0.8225, test_f1: 0.6568
 epoch: 66, train_loss: 0.5248, test_loss: 0.7716, test_f1: 0.6863
 epoch: 67, train_loss: 0.5237, test_loss: 0.7448, test_f1: 0.6573
 epoch: 68, train_loss: 0.5157, test_loss: 0.7852, test_f1: 0.6914
 epoch: 69, train_loss: 0.5152, test_loss: 0.7544, test_f1: 0.6848
 epoch: 70, train_loss: 0.5385, test_loss: 0.8210, test_f1: 0.6498
 epoch: 71, train_loss: 0.4977, test_loss: 0.8121, test_f1: 0.6947
 epoch: 72, train_loss: 0.5226, test_loss: 0.7466, test_f1: 0.6901
 epoch: 73, train_loss: 0.5112, test_loss: 0.7250, test_f1: 0.6858
 epoch: 74, train_loss: 0.4978, test_loss: 0.8085, test_f1: 0.6515
 epoch: 75, train_loss: 0.5062, test_loss: 0.7554, test_f1: 0.6973
 epoch: 76, train_loss: 0.4921, test_loss: 0.9112, test_f1: 0.6406
 epoch: 77, train_loss: 0.4685, test_loss: 0.8014, test_f1: 0.6822
 epoch: 78, train_loss: 0.4887, test_loss: 0.7869, test_f1: 0.6770
 epoch: 79, train_loss: 0.4919, test_loss: 0.9393, test_f1: 0.6491
 epoch: 80, train_loss: 0.4752, test_loss: 0.7870, test_f1: 0.6932
 epoch: 81, train_loss: 0.4710, test_loss: 0.8230, test_f1: 0.6575
 epoch: 82, train_loss: 0.4767, test_loss: 0.7928, test_f1: 0.6853
 epoch: 83, train_loss: 0.4625, test_loss: 0.8157, test_f1: 0.6810
 epoch: 84, train_loss: 0.4836, test_loss: 0.9205, test_f1: 0.6550
 epoch: 85, train_loss: 0.4981, test_loss: 0.9467, test_f1: 0.6668
 epoch: 86, train_loss: 0.4669, test_loss: 0.7896, test_f1: 0.6967
 epoch: 87, train_loss: 0.4663, test_loss: 0.8065, test_f1: 0.6823
 epoch: 88, train_loss: 0.4771, test_loss: 0.7586, test_f1: 0.6765
 epoch: 89, train_loss: 0.4680, test_loss: 0.7675, test_f1: 0.7180
 epoch: 90, train_loss: 0.4670, test_loss: 0.9352, test_f1: 0.6832
 epoch: 91, train_loss: 0.4737, test_loss: 0.8432, test_f1: 0.6761
 epoch: 92, train_loss: 0.4465, test_loss: 0.9052, test_f1: 0.6653
 epoch: 93, train_loss: 0.4542, test_loss: 0.8644, test_f1: 0.6889
 epoch: 94, train_loss: 0.4673, test_loss: 0.9005, test_f1: 0.6901
 epoch: 95, train_loss: 0.4485, test_loss: 0.7881, test_f1: 0.6888
 epoch: 96, train_loss: 0.4297, test_loss: 0.9238, test_f1: 0.6734
 epoch: 97, train_loss: 0.4091, test_loss: 0.8427, test_f1: 0.6886
 epoch: 98, train_loss: 0.4436, test_loss: 0.8615, test_f1: 0.6730
 epoch: 99, train_loss: 0.4320, test_loss: 0.8633, test_f1: 0.6830
##################ITERATION #6 ****************************************
 epoch: 0, train_loss: 1.1206, test_loss: 1.0473, test_f1: 0.4576
 epoch: 1, train_loss: 0.9556, test_loss: 1.1470, test_f1: 0.4610
 epoch: 2, train_loss: 0.9322, test_loss: 0.9171, test_f1: 0.5331
 epoch: 3, train_loss: 0.9199, test_loss: 1.0303, test_f1: 0.4955
 epoch: 4, train_loss: 0.9245, test_loss: 1.1004, test_f1: 0.4614
 epoch: 5, train_loss: 0.9032, test_loss: 0.9298, test_f1: 0.5096
 epoch: 6, train_loss: 0.8854, test_loss: 0.8588, test_f1: 0.5373
 epoch: 7, train_loss: 0.8876, test_loss: 0.8492, test_f1: 0.5276
 epoch: 8, train_loss: 0.8852, test_loss: 0.8413, test_f1: 0.6105
 epoch: 9, train_loss: 0.8578, test_loss: 0.9960, test_f1: 0.5164
 epoch: 10, train_loss: 0.8756, test_loss: 0.9167, test_f1: 0.5903
 epoch: 11, train_loss: 0.8453, test_loss: 0.8341, test_f1: 0.5569
 epoch: 12, train_loss: 0.8581, test_loss: 0.8321, test_f1: 0.5619
 epoch: 13, train_loss: 0.8321, test_loss: 0.8187, test_f1: 0.5665
 epoch: 14, train_loss: 0.8372, test_loss: 0.8212, test_f1: 0.5747
 epoch: 15, train_loss: 0.8161, test_loss: 0.8897, test_f1: 0.5564
 epoch: 16, train_loss: 0.8078, test_loss: 0.9185, test_f1: 0.5365
 epoch: 17, train_loss: 0.8089, test_loss: 0.7770, test_f1: 0.5930
 epoch: 18, train_loss: 0.8162, test_loss: 1.0608, test_f1: 0.5248
 epoch: 19, train_loss: 0.8057, test_loss: 1.0309, test_f1: 0.5371
 epoch: 20, train_loss: 0.7994, test_loss: 0.8760, test_f1: 0.6010
 epoch: 21, train_loss: 0.7809, test_loss: 0.8837, test_f1: 0.6000
 epoch: 22, train_loss: 0.7756, test_loss: 0.8951, test_f1: 0.6160
 epoch: 23, train_loss: 0.7705, test_loss: 0.7799, test_f1: 0.5955
 epoch: 24, train_loss: 0.7461, test_loss: 0.8109, test_f1: 0.5965
 epoch: 25, train_loss: 0.7609, test_loss: 0.8291, test_f1: 0.5764
 epoch: 26, train_loss: 0.7763, test_loss: 0.7722, test_f1: 0.5741
 epoch: 27, train_loss: 0.7593, test_loss: 0.8760, test_f1: 0.5747
 epoch: 28, train_loss: 0.7246, test_loss: 0.8639, test_f1: 0.6046
 epoch: 29, train_loss: 0.7573, test_loss: 0.7633, test_f1: 0.6044
 epoch: 30, train_loss: 0.7307, test_loss: 0.7480, test_f1: 0.6554
 epoch: 31, train_loss: 0.7331, test_loss: 0.8000, test_f1: 0.5963
 epoch: 32, train_loss: 0.7206, test_loss: 0.9422, test_f1: 0.5882
 epoch: 33, train_loss: 0.7020, test_loss: 0.8369, test_f1: 0.6069
 epoch: 34, train_loss: 0.6991, test_loss: 0.7835, test_f1: 0.6323
 epoch: 35, train_loss: 0.7075, test_loss: 0.8578, test_f1: 0.6561
 epoch: 36, train_loss: 0.6958, test_loss: 0.9210, test_f1: 0.5821
 epoch: 37, train_loss: 0.7001, test_loss: 0.7534, test_f1: 0.6624
 epoch: 38, train_loss: 0.6912, test_loss: 0.7254, test_f1: 0.6426
 epoch: 39, train_loss: 0.6783, test_loss: 0.9408, test_f1: 0.6506
 epoch: 40, train_loss: 0.6983, test_loss: 0.8316, test_f1: 0.6277
 epoch: 41, train_loss: 0.6882, test_loss: 0.7346, test_f1: 0.6743
 epoch: 42, train_loss: 0.6860, test_loss: 0.7928, test_f1: 0.6351
 epoch: 43, train_loss: 0.6635, test_loss: 0.8371, test_f1: 0.6317
 epoch: 44, train_loss: 0.6713, test_loss: 0.7592, test_f1: 0.6388
 epoch: 45, train_loss: 0.6645, test_loss: 0.7031, test_f1: 0.6889
 epoch: 46, train_loss: 0.6501, test_loss: 0.8644, test_f1: 0.6330
 epoch: 47, train_loss: 0.6705, test_loss: 0.8122, test_f1: 0.6069
 epoch: 48, train_loss: 0.6564, test_loss: 0.8054, test_f1: 0.6399
 epoch: 49, train_loss: 0.6334, test_loss: 0.7140, test_f1: 0.7003
 epoch: 50, train_loss: 0.6402, test_loss: 1.0511, test_f1: 0.5727
 epoch: 51, train_loss: 0.6092, test_loss: 0.9412, test_f1: 0.6762
 epoch: 52, train_loss: 0.5841, test_loss: 0.7956, test_f1: 0.6765
 epoch: 53, train_loss: 0.5564, test_loss: 0.9750, test_f1: 0.6512
 epoch: 54, train_loss: 0.5584, test_loss: 0.9456, test_f1: 0.6565
 epoch: 55, train_loss: 0.5585, test_loss: 0.9065, test_f1: 0.6640
 epoch: 56, train_loss: 0.5390, test_loss: 0.8375, test_f1: 0.6354
 epoch: 57, train_loss: 0.5565, test_loss: 0.7169, test_f1: 0.6933
 epoch: 58, train_loss: 0.5455, test_loss: 0.8448, test_f1: 0.6889
 epoch: 59, train_loss: 0.5521, test_loss: 0.8035, test_f1: 0.6750
 epoch: 60, train_loss: 0.5288, test_loss: 0.7746, test_f1: 0.6942
 epoch: 61, train_loss: 0.5393, test_loss: 0.8234, test_f1: 0.6670
 epoch: 62, train_loss: 0.5334, test_loss: 0.9407, test_f1: 0.6966
 epoch: 63, train_loss: 0.5254, test_loss: 0.8578, test_f1: 0.6568
 epoch: 64, train_loss: 0.5297, test_loss: 0.8119, test_f1: 0.7043
 epoch: 65, train_loss: 0.5143, test_loss: 0.8782, test_f1: 0.6791
 epoch: 66, train_loss: 0.5036, test_loss: 0.7706, test_f1: 0.6806
 epoch: 67, train_loss: 0.5264, test_loss: 0.8549, test_f1: 0.6920
 epoch: 68, train_loss: 0.5246, test_loss: 0.8923, test_f1: 0.6622
 epoch: 69, train_loss: 0.5003, test_loss: 0.9285, test_f1: 0.6654
 epoch: 70, train_loss: 0.5206, test_loss: 0.8632, test_f1: 0.6798
 epoch: 71, train_loss: 0.4909, test_loss: 0.9804, test_f1: 0.6371
 epoch: 72, train_loss: 0.5073, test_loss: 0.9466, test_f1: 0.6761
 epoch: 73, train_loss: 0.4874, test_loss: 0.8643, test_f1: 0.6811
 epoch: 74, train_loss: 0.4848, test_loss: 0.8957, test_f1: 0.6151
 epoch: 75, train_loss: 0.4855, test_loss: 0.8488, test_f1: 0.6780
 epoch: 76, train_loss: 0.4906, test_loss: 0.7953, test_f1: 0.6690
 epoch: 77, train_loss: 0.4588, test_loss: 0.8171, test_f1: 0.6456
 epoch: 78, train_loss: 0.5065, test_loss: 0.7579, test_f1: 0.6811
 epoch: 79, train_loss: 0.4842, test_loss: 0.7811, test_f1: 0.6749
 epoch: 80, train_loss: 0.4570, test_loss: 0.9098, test_f1: 0.6726
 epoch: 81, train_loss: 0.4612, test_loss: 0.7947, test_f1: 0.6863
 epoch: 82, train_loss: 0.4679, test_loss: 0.9292, test_f1: 0.6806
 epoch: 83, train_loss: 0.4664, test_loss: 0.9050, test_f1: 0.6777
 epoch: 84, train_loss: 0.4471, test_loss: 0.9419, test_f1: 0.6935
 epoch: 85, train_loss: 0.4438, test_loss: 0.9227, test_f1: 0.6769
 epoch: 86, train_loss: 0.4481, test_loss: 1.1988, test_f1: 0.6738
 epoch: 87, train_loss: 0.4632, test_loss: 0.7842, test_f1: 0.6918
 epoch: 88, train_loss: 0.4476, test_loss: 1.0810, test_f1: 0.6666
 epoch: 89, train_loss: 0.4852, test_loss: 0.8481, test_f1: 0.6809
 epoch: 90, train_loss: 0.4528, test_loss: 0.8659, test_f1: 0.6577
 epoch: 91, train_loss: 0.4303, test_loss: 1.0072, test_f1: 0.6810
 epoch: 92, train_loss: 0.4525, test_loss: 0.9332, test_f1: 0.6759
 epoch: 93, train_loss: 0.4527, test_loss: 0.8863, test_f1: 0.6679
 epoch: 94, train_loss: 0.4422, test_loss: 0.9006, test_f1: 0.6726
 epoch: 95, train_loss: 0.4390, test_loss: 0.7475, test_f1: 0.6643
 epoch: 96, train_loss: 0.4351, test_loss: 0.8810, test_f1: 0.6817
 epoch: 97, train_loss: 0.4424, test_loss: 0.9076, test_f1: 0.7029
 epoch: 98, train_loss: 0.4416, test_loss: 0.8158, test_f1: 0.6963
 epoch: 99, train_loss: 0.4387, test_loss: 0.7779, test_f1: 0.6690
##################ITERATION #7 ****************************************
 epoch: 0, train_loss: 1.1276, test_loss: 1.0725, test_f1: 0.4837
 epoch: 1, train_loss: 0.9908, test_loss: 0.9451, test_f1: 0.4867
 epoch: 2, train_loss: 0.9574, test_loss: 1.0798, test_f1: 0.4914
 epoch: 3, train_loss: 0.9547, test_loss: 1.0000, test_f1: 0.5018
 epoch: 4, train_loss: 0.9223, test_loss: 1.0072, test_f1: 0.4726
 epoch: 5, train_loss: 0.9163, test_loss: 0.9310, test_f1: 0.5000
 epoch: 6, train_loss: 0.9135, test_loss: 0.8751, test_f1: 0.5323
 epoch: 7, train_loss: 0.9074, test_loss: 0.9275, test_f1: 0.4969
 epoch: 8, train_loss: 0.8885, test_loss: 0.9637, test_f1: 0.5011
 epoch: 9, train_loss: 0.8676, test_loss: 0.8918, test_f1: 0.6191
 epoch: 10, train_loss: 0.8371, test_loss: 0.8207, test_f1: 0.6268
 epoch: 11, train_loss: 0.8614, test_loss: 1.0018, test_f1: 0.4665
 epoch: 12, train_loss: 0.8561, test_loss: 0.8566, test_f1: 0.5538
 epoch: 13, train_loss: 0.8359, test_loss: 0.8442, test_f1: 0.5917
 epoch: 14, train_loss: 0.8340, test_loss: 0.8850, test_f1: 0.5929
 epoch: 15, train_loss: 0.8064, test_loss: 0.8452, test_f1: 0.5768
 epoch: 16, train_loss: 0.8024, test_loss: 0.8683, test_f1: 0.5512
 epoch: 17, train_loss: 0.8107, test_loss: 0.9072, test_f1: 0.5931
 epoch: 18, train_loss: 0.8082, test_loss: 0.8159, test_f1: 0.5668
 epoch: 19, train_loss: 0.7881, test_loss: 0.7980, test_f1: 0.6388
 epoch: 20, train_loss: 0.7948, test_loss: 0.8928, test_f1: 0.5966
 epoch: 21, train_loss: 0.7832, test_loss: 0.8383, test_f1: 0.6199
 epoch: 22, train_loss: 0.7556, test_loss: 0.9491, test_f1: 0.5601
 epoch: 23, train_loss: 0.7569, test_loss: 0.8222, test_f1: 0.6183
 epoch: 24, train_loss: 0.7469, test_loss: 0.8409, test_f1: 0.6065
 epoch: 25, train_loss: 0.7499, test_loss: 0.8307, test_f1: 0.6340
 epoch: 26, train_loss: 0.7562, test_loss: 0.7964, test_f1: 0.6198
 epoch: 27, train_loss: 0.7574, test_loss: 0.7522, test_f1: 0.6009
 epoch: 28, train_loss: 0.7386, test_loss: 0.9479, test_f1: 0.6254
 epoch: 29, train_loss: 0.7553, test_loss: 0.7837, test_f1: 0.6190
 epoch: 30, train_loss: 0.7448, test_loss: 0.8748, test_f1: 0.5961
 epoch: 31, train_loss: 0.7248, test_loss: 0.7659, test_f1: 0.6233
 epoch: 32, train_loss: 0.7310, test_loss: 0.8143, test_f1: 0.6578
 epoch: 33, train_loss: 0.7250, test_loss: 0.9637, test_f1: 0.6090
 epoch: 34, train_loss: 0.7170, test_loss: 0.9327, test_f1: 0.5712
 epoch: 35, train_loss: 0.7236, test_loss: 0.8238, test_f1: 0.6227
 epoch: 36, train_loss: 0.6830, test_loss: 0.8288, test_f1: 0.6407
 epoch: 37, train_loss: 0.6896, test_loss: 0.7250, test_f1: 0.6297
 epoch: 38, train_loss: 0.6825, test_loss: 0.8735, test_f1: 0.6406
 epoch: 39, train_loss: 0.7123, test_loss: 0.7769, test_f1: 0.6418
 epoch: 40, train_loss: 0.6651, test_loss: 0.7968, test_f1: 0.6021
 epoch: 41, train_loss: 0.7614, test_loss: 0.8329, test_f1: 0.6258
 epoch: 42, train_loss: 0.7064, test_loss: 0.8624, test_f1: 0.6355
 epoch: 43, train_loss: 0.6846, test_loss: 0.7681, test_f1: 0.6393
 epoch: 44, train_loss: 0.6672, test_loss: 0.7053, test_f1: 0.6498
 epoch: 45, train_loss: 0.6313, test_loss: 0.8304, test_f1: 0.6609
 epoch: 46, train_loss: 0.6542, test_loss: 0.8006, test_f1: 0.6552
 epoch: 47, train_loss: 0.6763, test_loss: 0.8255, test_f1: 0.6472
 epoch: 48, train_loss: 0.6375, test_loss: 0.7425, test_f1: 0.6571
 epoch: 49, train_loss: 0.7617, test_loss: 0.9528, test_f1: 0.6456
 epoch: 50, train_loss: 0.6774, test_loss: 0.7653, test_f1: 0.6751
 epoch: 51, train_loss: 0.6162, test_loss: 0.7794, test_f1: 0.6776
 epoch: 52, train_loss: 0.5970, test_loss: 0.8232, test_f1: 0.6749
 epoch: 53, train_loss: 0.5907, test_loss: 0.8105, test_f1: 0.6482
 epoch: 54, train_loss: 0.5778, test_loss: 0.7510, test_f1: 0.6836
 epoch: 55, train_loss: 0.5838, test_loss: 0.8101, test_f1: 0.6758
 epoch: 56, train_loss: 0.5775, test_loss: 0.7769, test_f1: 0.6940
 epoch: 57, train_loss: 0.5717, test_loss: 0.8036, test_f1: 0.6680
 epoch: 58, train_loss: 0.5524, test_loss: 0.8964, test_f1: 0.6705
 epoch: 59, train_loss: 0.5591, test_loss: 0.7822, test_f1: 0.6939
 epoch: 60, train_loss: 0.5536, test_loss: 0.8858, test_f1: 0.6754
 epoch: 61, train_loss: 0.5489, test_loss: 0.8783, test_f1: 0.6661
 epoch: 62, train_loss: 0.5297, test_loss: 0.9280, test_f1: 0.6825
 epoch: 63, train_loss: 0.5142, test_loss: 0.8749, test_f1: 0.7026
 epoch: 64, train_loss: 0.5439, test_loss: 0.7865, test_f1: 0.7022
 epoch: 65, train_loss: 0.5221, test_loss: 0.8579, test_f1: 0.6954
 epoch: 66, train_loss: 0.5171, test_loss: 0.8906, test_f1: 0.7001
 epoch: 67, train_loss: 0.5049, test_loss: 0.9467, test_f1: 0.6741
 epoch: 68, train_loss: 0.5443, test_loss: 0.9204, test_f1: 0.6677
 epoch: 69, train_loss: 0.5347, test_loss: 0.8031, test_f1: 0.7177
 epoch: 70, train_loss: 0.5195, test_loss: 0.8088, test_f1: 0.6868
 epoch: 71, train_loss: 0.5140, test_loss: 0.8324, test_f1: 0.7079
 epoch: 72, train_loss: 0.5008, test_loss: 0.7660, test_f1: 0.6850
 epoch: 73, train_loss: 0.5099, test_loss: 0.8231, test_f1: 0.6703
 epoch: 74, train_loss: 0.4929, test_loss: 0.8909, test_f1: 0.6808
 epoch: 75, train_loss: 0.5044, test_loss: 0.7821, test_f1: 0.6747
 epoch: 76, train_loss: 0.4794, test_loss: 0.9006, test_f1: 0.6635
 epoch: 77, train_loss: 0.4944, test_loss: 0.8019, test_f1: 0.6926
 epoch: 78, train_loss: 0.4701, test_loss: 0.8284, test_f1: 0.6759
 epoch: 79, train_loss: 0.4911, test_loss: 0.7542, test_f1: 0.6999
 epoch: 80, train_loss: 0.4783, test_loss: 0.8403, test_f1: 0.6764
 epoch: 81, train_loss: 0.4751, test_loss: 0.8993, test_f1: 0.6784
 epoch: 82, train_loss: 0.4722, test_loss: 0.8504, test_f1: 0.6791
 epoch: 83, train_loss: 0.4598, test_loss: 1.0027, test_f1: 0.6571
 epoch: 84, train_loss: 0.4504, test_loss: 0.8429, test_f1: 0.6821
 epoch: 85, train_loss: 0.4900, test_loss: 0.9472, test_f1: 0.6657
 epoch: 86, train_loss: 0.4689, test_loss: 0.8905, test_f1: 0.6856
 epoch: 87, train_loss: 0.4391, test_loss: 0.9933, test_f1: 0.6866
 epoch: 88, train_loss: 0.4424, test_loss: 0.9369, test_f1: 0.6977
 epoch: 89, train_loss: 0.4249, test_loss: 0.9054, test_f1: 0.6974
 epoch: 90, train_loss: 0.4498, test_loss: 0.9084, test_f1: 0.6844
 epoch: 91, train_loss: 0.4503, test_loss: 0.9880, test_f1: 0.6981
 epoch: 92, train_loss: 0.4318, test_loss: 1.0005, test_f1: 0.6878
 epoch: 93, train_loss: 0.4113, test_loss: 0.9688, test_f1: 0.6780
 epoch: 94, train_loss: 0.4344, test_loss: 0.8947, test_f1: 0.6962
 epoch: 95, train_loss: 0.4674, test_loss: 0.9483, test_f1: 0.6830
 epoch: 96, train_loss: 0.4543, test_loss: 0.9123, test_f1: 0.6737
 epoch: 97, train_loss: 0.4242, test_loss: 0.9080, test_f1: 0.7164
 epoch: 98, train_loss: 0.4470, test_loss: 0.9727, test_f1: 0.6872
 epoch: 99, train_loss: 0.4089, test_loss: 1.0222, test_f1: 0.6689
##################ITERATION #8 ****************************************
 epoch: 0, train_loss: 1.1229, test_loss: 1.0039, test_f1: 0.4370
 epoch: 1, train_loss: 0.9686, test_loss: 0.9661, test_f1: 0.5173
 epoch: 2, train_loss: 0.9440, test_loss: 0.9531, test_f1: 0.4944
 epoch: 3, train_loss: 0.9399, test_loss: 0.9419, test_f1: 0.5531
 epoch: 4, train_loss: 0.9197, test_loss: 0.9978, test_f1: 0.5219
 epoch: 5, train_loss: 0.9153, test_loss: 0.8770, test_f1: 0.5968
 epoch: 6, train_loss: 0.8794, test_loss: 0.9758, test_f1: 0.5101
 epoch: 7, train_loss: 0.8779, test_loss: 0.8663, test_f1: 0.5816
 epoch: 8, train_loss: 0.8585, test_loss: 0.8715, test_f1: 0.5996
 epoch: 9, train_loss: 0.8551, test_loss: 0.8772, test_f1: 0.5794
 epoch: 10, train_loss: 0.8308, test_loss: 0.8529, test_f1: 0.6017
 epoch: 11, train_loss: 0.8536, test_loss: 0.9208, test_f1: 0.5328
 epoch: 12, train_loss: 0.8286, test_loss: 0.9480, test_f1: 0.5996
 epoch: 13, train_loss: 0.8145, test_loss: 0.8508, test_f1: 0.5998
 epoch: 14, train_loss: 0.8121, test_loss: 0.8984, test_f1: 0.6130
 epoch: 15, train_loss: 0.8037, test_loss: 0.8652, test_f1: 0.6193
 epoch: 16, train_loss: 0.7880, test_loss: 0.7945, test_f1: 0.6077
 epoch: 17, train_loss: 0.8102, test_loss: 0.8480, test_f1: 0.5755
 epoch: 18, train_loss: 0.7893, test_loss: 0.8085, test_f1: 0.6269
 epoch: 19, train_loss: 0.7934, test_loss: 0.8496, test_f1: 0.6174
 epoch: 20, train_loss: 0.7769, test_loss: 0.9283, test_f1: 0.5811
 epoch: 21, train_loss: 0.7544, test_loss: 0.9400, test_f1: 0.6306
 epoch: 22, train_loss: 0.7834, test_loss: 0.9754, test_f1: 0.6040
 epoch: 23, train_loss: 0.7379, test_loss: 0.8773, test_f1: 0.6381
 epoch: 24, train_loss: 0.7451, test_loss: 0.9191, test_f1: 0.6187
 epoch: 25, train_loss: 0.7353, test_loss: 1.0365, test_f1: 0.6177
 epoch: 26, train_loss: 0.7406, test_loss: 0.9204, test_f1: 0.6108
 epoch: 27, train_loss: 0.7570, test_loss: 0.7544, test_f1: 0.6558
 epoch: 28, train_loss: 0.7308, test_loss: 0.8245, test_f1: 0.6664
 epoch: 29, train_loss: 0.7019, test_loss: 0.7937, test_f1: 0.6508
 epoch: 30, train_loss: 0.7112, test_loss: 0.8870, test_f1: 0.6422
 epoch: 31, train_loss: 0.7179, test_loss: 0.8249, test_f1: 0.6692
 epoch: 32, train_loss: 0.7018, test_loss: 0.9296, test_f1: 0.6378
 epoch: 33, train_loss: 0.7002, test_loss: 0.8343, test_f1: 0.6423
 epoch: 34, train_loss: 0.7250, test_loss: 0.9082, test_f1: 0.6237
 epoch: 35, train_loss: 0.7497, test_loss: 0.7885, test_f1: 0.6220
 epoch: 36, train_loss: 0.7107, test_loss: 0.9715, test_f1: 0.6610
 epoch: 37, train_loss: 0.6835, test_loss: 0.9224, test_f1: 0.6547
 epoch: 38, train_loss: 0.6624, test_loss: 1.0264, test_f1: 0.6688
 epoch: 39, train_loss: 0.6524, test_loss: 0.8562, test_f1: 0.6714
 epoch: 40, train_loss: 0.6605, test_loss: 1.1580, test_f1: 0.6407
 epoch: 41, train_loss: 0.6805, test_loss: 0.9598, test_f1: 0.6621
 epoch: 42, train_loss: 0.6412, test_loss: 1.1302, test_f1: 0.6263
 epoch: 43, train_loss: 0.6575, test_loss: 0.8186, test_f1: 0.6841
 epoch: 44, train_loss: 0.6328, test_loss: 1.0120, test_f1: 0.6747
 epoch: 45, train_loss: 0.6382, test_loss: 0.9703, test_f1: 0.6422
 epoch: 46, train_loss: 0.6306, test_loss: 0.8440, test_f1: 0.6784
 epoch: 47, train_loss: 0.6142, test_loss: 0.8713, test_f1: 0.6664
 epoch: 48, train_loss: 0.6245, test_loss: 0.9301, test_f1: 0.6363
 epoch: 49, train_loss: 0.6211, test_loss: 0.8062, test_f1: 0.6552
 epoch: 50, train_loss: 0.6209, test_loss: 1.0519, test_f1: 0.6685
 epoch: 51, train_loss: 0.5613, test_loss: 0.9801, test_f1: 0.6947
 epoch: 52, train_loss: 0.5458, test_loss: 1.0941, test_f1: 0.6864
 epoch: 53, train_loss: 0.5621, test_loss: 0.9724, test_f1: 0.6876
 epoch: 54, train_loss: 0.5392, test_loss: 0.9331, test_f1: 0.6802
 epoch: 55, train_loss: 0.5451, test_loss: 0.9608, test_f1: 0.6821
 epoch: 56, train_loss: 0.5126, test_loss: 0.9104, test_f1: 0.6895
 epoch: 57, train_loss: 0.5115, test_loss: 0.9736, test_f1: 0.6969
 epoch: 58, train_loss: 0.5054, test_loss: 1.0175, test_f1: 0.6971
 epoch: 59, train_loss: 0.5150, test_loss: 1.0027, test_f1: 0.6798
 epoch: 60, train_loss: 0.5110, test_loss: 0.9147, test_f1: 0.6750
 epoch: 61, train_loss: 0.5021, test_loss: 0.9805, test_f1: 0.6427
 epoch: 62, train_loss: 0.4928, test_loss: 1.0098, test_f1: 0.6842
 epoch: 63, train_loss: 0.4852, test_loss: 1.0207, test_f1: 0.6734
 epoch: 64, train_loss: 0.4872, test_loss: 1.1173, test_f1: 0.6788
 epoch: 65, train_loss: 0.4812, test_loss: 1.1634, test_f1: 0.6764
 epoch: 66, train_loss: 0.4712, test_loss: 1.1089, test_f1: 0.7090
 epoch: 67, train_loss: 0.4704, test_loss: 0.9752, test_f1: 0.6972
 epoch: 68, train_loss: 0.4586, test_loss: 1.0035, test_f1: 0.6967
 epoch: 69, train_loss: 0.4690, test_loss: 1.1193, test_f1: 0.6677
 epoch: 70, train_loss: 0.4607, test_loss: 1.2037, test_f1: 0.6821
 epoch: 71, train_loss: 0.4842, test_loss: 1.0253, test_f1: 0.6711
 epoch: 72, train_loss: 0.4465, test_loss: 0.9798, test_f1: 0.6775
 epoch: 73, train_loss: 0.4581, test_loss: 1.0882, test_f1: 0.6884
 epoch: 74, train_loss: 0.4477, test_loss: 1.0428, test_f1: 0.7000
 epoch: 75, train_loss: 0.4463, test_loss: 1.1166, test_f1: 0.6762
 epoch: 76, train_loss: 0.4371, test_loss: 1.0646, test_f1: 0.6782
 epoch: 77, train_loss: 0.4662, test_loss: 0.9879, test_f1: 0.6906
 epoch: 78, train_loss: 0.4282, test_loss: 0.9936, test_f1: 0.6683
 epoch: 79, train_loss: 0.4374, test_loss: 1.0991, test_f1: 0.6894
 epoch: 80, train_loss: 0.4413, test_loss: 1.1277, test_f1: 0.6554
 epoch: 81, train_loss: 0.4210, test_loss: 1.1391, test_f1: 0.6742
 epoch: 82, train_loss: 0.4211, test_loss: 1.1482, test_f1: 0.6895
 epoch: 83, train_loss: 0.4051, test_loss: 1.1372, test_f1: 0.6928
 epoch: 84, train_loss: 0.4185, test_loss: 1.0784, test_f1: 0.6906
 epoch: 85, train_loss: 0.4245, test_loss: 1.0808, test_f1: 0.6965
 epoch: 86, train_loss: 0.4193, test_loss: 1.0217, test_f1: 0.6815
 epoch: 87, train_loss: 0.4077, test_loss: 1.0914, test_f1: 0.6950
 epoch: 88, train_loss: 0.4159, test_loss: 1.1447, test_f1: 0.6766
 epoch: 89, train_loss: 0.4303, test_loss: 0.9940, test_f1: 0.7065
 epoch: 90, train_loss: 0.4179, test_loss: 1.0663, test_f1: 0.6682
 epoch: 91, train_loss: 0.4172, test_loss: 1.1039, test_f1: 0.6656
 epoch: 92, train_loss: 0.3790, test_loss: 1.2326, test_f1: 0.6904
 epoch: 93, train_loss: 0.3977, test_loss: 1.1007, test_f1: 0.6860
 epoch: 94, train_loss: 0.3854, test_loss: 1.1990, test_f1: 0.6889
 epoch: 95, train_loss: 0.3944, test_loss: 1.2122, test_f1: 0.6935
 epoch: 96, train_loss: 0.3956, test_loss: 1.2366, test_f1: 0.6821
 epoch: 97, train_loss: 0.3939, test_loss: 1.1043, test_f1: 0.7041
 epoch: 98, train_loss: 0.3856, test_loss: 1.0740, test_f1: 0.7148
 epoch: 99, train_loss: 0.4047, test_loss: 1.1814, test_f1: 0.6403
##################ITERATION #9 ****************************************
 epoch: 0, train_loss: 1.1186, test_loss: 1.0835, test_f1: 0.4933
 epoch: 1, train_loss: 0.9900, test_loss: 0.9413, test_f1: 0.4827
 epoch: 2, train_loss: 0.9657, test_loss: 0.9422, test_f1: 0.5303
 epoch: 3, train_loss: 0.9721, test_loss: 1.0548, test_f1: 0.4534
 epoch: 4, train_loss: 0.9899, test_loss: 0.9545, test_f1: 0.5058
 epoch: 5, train_loss: 0.9418, test_loss: 1.0668, test_f1: 0.5193
 epoch: 6, train_loss: 0.9152, test_loss: 0.9341, test_f1: 0.5139
 epoch: 7, train_loss: 0.9197, test_loss: 0.9460, test_f1: 0.5508
 epoch: 8, train_loss: 0.8826, test_loss: 0.9337, test_f1: 0.5821
 epoch: 9, train_loss: 0.8674, test_loss: 0.8899, test_f1: 0.5278
 epoch: 10, train_loss: 0.8657, test_loss: 0.9185, test_f1: 0.5755
 epoch: 11, train_loss: 0.8784, test_loss: 0.9886, test_f1: 0.5551
 epoch: 12, train_loss: 0.8735, test_loss: 0.8714, test_f1: 0.5682
 epoch: 13, train_loss: 0.8702, test_loss: 0.9409, test_f1: 0.6171
 epoch: 14, train_loss: 0.8536, test_loss: 0.9689, test_f1: 0.5281
 epoch: 15, train_loss: 0.8803, test_loss: 0.8522, test_f1: 0.5472
 epoch: 16, train_loss: 0.8370, test_loss: 0.8552, test_f1: 0.5962
 epoch: 17, train_loss: 0.8452, test_loss: 0.9015, test_f1: 0.5980
 epoch: 18, train_loss: 0.8102, test_loss: 0.9637, test_f1: 0.5994
 epoch: 19, train_loss: 0.8020, test_loss: 0.8696, test_f1: 0.5979
 epoch: 20, train_loss: 0.8060, test_loss: 0.8869, test_f1: 0.6013
 epoch: 21, train_loss: 0.7923, test_loss: 0.8580, test_f1: 0.6289
 epoch: 22, train_loss: 0.8237, test_loss: 1.0775, test_f1: 0.5985
 epoch: 23, train_loss: 0.8033, test_loss: 0.9086, test_f1: 0.6171
 epoch: 24, train_loss: 0.7989, test_loss: 0.9791, test_f1: 0.5612
 epoch: 25, train_loss: 0.7862, test_loss: 0.9074, test_f1: 0.5945
 epoch: 26, train_loss: 0.8016, test_loss: 0.9306, test_f1: 0.5983
 epoch: 27, train_loss: 0.7658, test_loss: 0.9201, test_f1: 0.5950
 epoch: 28, train_loss: 0.7650, test_loss: 0.9755, test_f1: 0.5829
 epoch: 29, train_loss: 0.7970, test_loss: 0.9066, test_f1: 0.5774
 epoch: 30, train_loss: 0.7792, test_loss: 0.8492, test_f1: 0.6525
 epoch: 31, train_loss: 0.7472, test_loss: 1.7459, test_f1: 0.3929
 epoch: 32, train_loss: 0.7546, test_loss: 0.9972, test_f1: 0.6027
 epoch: 33, train_loss: 0.7392, test_loss: 0.8755, test_f1: 0.6219
 epoch: 34, train_loss: 0.7170, test_loss: 0.9016, test_f1: 0.6001
 epoch: 35, train_loss: 0.7517, test_loss: 0.9002, test_f1: 0.6195
 epoch: 36, train_loss: 0.7476, test_loss: 0.9571, test_f1: 0.5787
 epoch: 37, train_loss: 0.7201, test_loss: 0.8936, test_f1: 0.6196
 epoch: 38, train_loss: 0.7080, test_loss: 0.9611, test_f1: 0.6201
 epoch: 39, train_loss: 0.7307, test_loss: 0.9227, test_f1: 0.6299
 epoch: 40, train_loss: 0.6928, test_loss: 1.0059, test_f1: 0.6475
 epoch: 41, train_loss: 0.7155, test_loss: 0.9481, test_f1: 0.6284
 epoch: 42, train_loss: 0.6982, test_loss: 1.0167, test_f1: 0.6411
 epoch: 43, train_loss: 0.6952, test_loss: 0.9511, test_f1: 0.6428
 epoch: 44, train_loss: 0.6935, test_loss: 0.8956, test_f1: 0.6151
 epoch: 45, train_loss: 0.6767, test_loss: 0.9782, test_f1: 0.6131
 epoch: 46, train_loss: 0.6667, test_loss: 0.9476, test_f1: 0.6156
 epoch: 47, train_loss: 0.6805, test_loss: 0.8482, test_f1: 0.6051
 epoch: 48, train_loss: 0.6708, test_loss: 0.8292, test_f1: 0.6718
 epoch: 49, train_loss: 0.6517, test_loss: 0.9136, test_f1: 0.6454
 epoch: 50, train_loss: 0.6637, test_loss: 0.8560, test_f1: 0.6463
 epoch: 51, train_loss: 0.6107, test_loss: 0.8816, test_f1: 0.6567
 epoch: 52, train_loss: 0.5889, test_loss: 0.8699, test_f1: 0.6734
 epoch: 53, train_loss: 0.5734, test_loss: 1.0266, test_f1: 0.6411
 epoch: 54, train_loss: 0.5638, test_loss: 0.9260, test_f1: 0.6363
 epoch: 55, train_loss: 0.5869, test_loss: 0.9195, test_f1: 0.6458
 epoch: 56, train_loss: 0.5798, test_loss: 0.9614, test_f1: 0.6561
 epoch: 57, train_loss: 0.5578, test_loss: 0.8634, test_f1: 0.6622
 epoch: 58, train_loss: 0.6527, test_loss: 1.0288, test_f1: 0.6347
 epoch: 59, train_loss: 0.5632, test_loss: 1.0559, test_f1: 0.6410
 epoch: 60, train_loss: 0.5453, test_loss: 0.9378, test_f1: 0.6788
 epoch: 61, train_loss: 0.5323, test_loss: 1.0182, test_f1: 0.6497
 epoch: 62, train_loss: 0.5254, test_loss: 1.0461, test_f1: 0.6460
 epoch: 63, train_loss: 0.5299, test_loss: 0.9772, test_f1: 0.6712
 epoch: 64, train_loss: 0.5323, test_loss: 0.9184, test_f1: 0.6812
 epoch: 65, train_loss: 0.5355, test_loss: 0.8877, test_f1: 0.6683
 epoch: 66, train_loss: 0.5209, test_loss: 0.9883, test_f1: 0.6644
 epoch: 67, train_loss: 0.5140, test_loss: 1.0240, test_f1: 0.6240
 epoch: 68, train_loss: 0.5345, test_loss: 0.9722, test_f1: 0.6538
 epoch: 69, train_loss: 0.4886, test_loss: 0.9860, test_f1: 0.6808
 epoch: 70, train_loss: 0.5229, test_loss: 1.0580, test_f1: 0.6518
 epoch: 71, train_loss: 0.5007, test_loss: 1.0603, test_f1: 0.6768
 epoch: 72, train_loss: 0.5046, test_loss: 1.1775, test_f1: 0.6460
 epoch: 73, train_loss: 0.4912, test_loss: 1.2642, test_f1: 0.6500
 epoch: 74, train_loss: 0.4987, test_loss: 1.0947, test_f1: 0.6783
 epoch: 75, train_loss: 0.4863, test_loss: 1.1107, test_f1: 0.6485
 epoch: 76, train_loss: 0.5072, test_loss: 1.1106, test_f1: 0.6503
 epoch: 77, train_loss: 0.4928, test_loss: 1.0901, test_f1: 0.6390
 epoch: 78, train_loss: 0.4921, test_loss: 1.1013, test_f1: 0.6550
 epoch: 79, train_loss: 0.4869, test_loss: 1.2126, test_f1: 0.6589
 epoch: 80, train_loss: 0.5033, test_loss: 1.2185, test_f1: 0.6767
 epoch: 81, train_loss: 0.4662, test_loss: 1.1825, test_f1: 0.6502
 epoch: 82, train_loss: 0.5003, test_loss: 1.2877, test_f1: 0.6658
 epoch: 83, train_loss: 0.4899, test_loss: 1.2321, test_f1: 0.6611
 epoch: 84, train_loss: 0.4945, test_loss: 1.1207, test_f1: 0.6834
 epoch: 85, train_loss: 0.4470, test_loss: 1.2190, test_f1: 0.6739
 epoch: 86, train_loss: 0.4787, test_loss: 1.0841, test_f1: 0.6395
 epoch: 87, train_loss: 0.4666, test_loss: 1.1949, test_f1: 0.6622
 epoch: 88, train_loss: 0.4428, test_loss: 1.2401, test_f1: 0.6668
 epoch: 89, train_loss: 0.4486, test_loss: 1.2797, test_f1: 0.6558
 epoch: 90, train_loss: 0.4640, test_loss: 1.2098, test_f1: 0.6645
 epoch: 91, train_loss: 0.4462, test_loss: 1.2466, test_f1: 0.6890
 epoch: 92, train_loss: 0.4391, test_loss: 1.2219, test_f1: 0.6467
 epoch: 93, train_loss: 0.4418, test_loss: 1.1918, test_f1: 0.6639
 epoch: 94, train_loss: 0.4549, test_loss: 1.1123, test_f1: 0.7074
 epoch: 95, train_loss: 0.4392, test_loss: 1.2330, test_f1: 0.6683
 epoch: 96, train_loss: 0.4338, test_loss: 1.2635, test_f1: 0.6819
 epoch: 97, train_loss: 0.4385, test_loss: 1.2121, test_f1: 0.6779
 epoch: 98, train_loss: 0.4561, test_loss: 1.2166, test_f1: 0.6665
 epoch: 99, train_loss: 0.4416, test_loss: 1.2179, test_f1: 0.6827

Training completed in 1612.78 seconds
Best F1: 0.7240 at epoch 70
Mean F1 across iterations: 0.7073  0.0110
========================FINAL RESULTS================================
FEGIN weighted F1: 0.7240  0.0110
python main.py --data ltspice_examples --representation component_pin_net --model FEGIN --layers 2 --hiddens 128 --batch_size 32 --lr 0.01 --emb_size 128 --epochs 100 --save_appendix component_pin_net_L2_H128_BS32_LR0.01_E128 --no_val
-----



STDERR:
  File "main.py", line 370, in <module>
    main()
  File "main.py", line 254, in main
    dataset = dataset_class(
  File "/home/philip/projects/ltspice_examples_code_repo/Circuit-Completion-Using-GNNs/component_classification_with_link_prediction_head/evaluation/FEGIN/kernel/circuit_datasets.py", line 15, in __init__
    self.data, self.slices = torch.load(self.processed_paths[0])
  File "/home/philip/.local/lib/python3.8/site-packages/torch/serialization.py", line 1040, in load
    warnings.warn(
  File "/usr/lib/python3.8/warnings.py", line 109, in _showwarnmsg
    sw(msg.message, msg.category, msg.filename, msg.lineno,
  File "main.py", line 47, in warn_with_traceback
    traceback.print_stack(file=log)
/home/philip/projects/ltspice_examples_code_repo/Circuit-Completion-Using-GNNs/component_classification_with_link_prediction_head/evaluation/FEGIN/kernel/circuit_datasets.py:15: FutureWarning: You are using `torch.load` with `weights_only=False` (the current default value), which uses the default pickle module implicitly. It is possible to construct malicious pickle data which will execute arbitrary code during unpickling (See https://github.com/pytorch/pytorch/blob/main/SECURITY.md#untrusted-models for more details). In a future release, the default value for `weights_only` will be flipped to `True`. This limits the functions that could be executed during unpickling. Arbitrary objects will no longer be allowed to be loaded via this mode unless they are explicitly allowlisted by the user via `torch.serialization.add_safe_globals`. We recommend you start setting `weights_only=True` for any use case where you don't have full control of the loaded file. Please open an issue on GitHub for any issues related to this experimental feature.
  self.data, self.slices = torch.load(self.processed_paths[0])
