STDOUT:
Results will be saved in /home/philip/projects/ltspice_examples_code_repo/Circuit-Completion-Using-GNNs/component_classification_with_link_prediction_head/evaluation/FEGIN/results/model_FEGIN_dataset_ltspice_examples
Command line input: python main.py --data ltspice_examples --representation component_pin --model FEGIN --layers 3 --hiddens 128 --batch_size 128 --lr 0.001 --emb_size 250 --epochs 100 --save_appendix component_pin_L3_H128_BS128_LR0.001_E250 --no_val
 is saved.
-----
ltspice_examples - FEGIN
Using 3 layers, 128 hidden units, h = 2
Loading component_pin representation dataset
ENTERED
Training FEGIN on component_pin representation
Train: 3560, Test: 848
##################ITERATION #0 ****************************************
 epoch: 0, train_loss: 1.2420, test_loss: 1.2274, test_f1: 0.2246
 epoch: 1, train_loss: 1.0249, test_loss: 0.9966, test_f1: 0.4219
 epoch: 2, train_loss: 0.9295, test_loss: 0.9822, test_f1: 0.4798
 epoch: 3, train_loss: 0.8854, test_loss: 0.9313, test_f1: 0.5325
 epoch: 4, train_loss: 0.8384, test_loss: 0.8860, test_f1: 0.5465
 epoch: 5, train_loss: 0.8121, test_loss: 0.8462, test_f1: 0.5611
 epoch: 6, train_loss: 0.7874, test_loss: 0.9070, test_f1: 0.5555
 epoch: 7, train_loss: 0.7694, test_loss: 0.8525, test_f1: 0.5787
 epoch: 8, train_loss: 0.7466, test_loss: 0.8737, test_f1: 0.5594
 epoch: 9, train_loss: 0.7442, test_loss: 0.8043, test_f1: 0.6045
 epoch: 10, train_loss: 0.7215, test_loss: 0.9222, test_f1: 0.5423
 epoch: 11, train_loss: 0.7126, test_loss: 0.7899, test_f1: 0.5952
 epoch: 12, train_loss: 0.6858, test_loss: 0.8338, test_f1: 0.5945
 epoch: 13, train_loss: 0.6789, test_loss: 0.9484, test_f1: 0.5517
 epoch: 14, train_loss: 0.6799, test_loss: 0.8665, test_f1: 0.5959
 epoch: 15, train_loss: 0.6503, test_loss: 1.1236, test_f1: 0.5431
 epoch: 16, train_loss: 0.6360, test_loss: 0.8734, test_f1: 0.5779
 epoch: 17, train_loss: 0.6181, test_loss: 0.9169, test_f1: 0.5786
 epoch: 18, train_loss: 0.6124, test_loss: 0.8586, test_f1: 0.6172
 epoch: 19, train_loss: 0.6005, test_loss: 0.8888, test_f1: 0.6076
 epoch: 20, train_loss: 0.5771, test_loss: 0.9038, test_f1: 0.6235
 epoch: 21, train_loss: 0.5803, test_loss: 0.8746, test_f1: 0.5540
 epoch: 22, train_loss: 0.5721, test_loss: 1.1983, test_f1: 0.6000
 epoch: 23, train_loss: 0.5542, test_loss: 0.9392, test_f1: 0.6120
 epoch: 24, train_loss: 0.5385, test_loss: 0.9344, test_f1: 0.5990
 epoch: 25, train_loss: 0.5336, test_loss: 0.9118, test_f1: 0.6121
 epoch: 26, train_loss: 0.5176, test_loss: 1.0552, test_f1: 0.6157
 epoch: 27, train_loss: 0.4932, test_loss: 1.0126, test_f1: 0.6142
 epoch: 28, train_loss: 0.5074, test_loss: 1.2435, test_f1: 0.5692
 epoch: 29, train_loss: 0.4987, test_loss: 1.0016, test_f1: 0.6191
 epoch: 30, train_loss: 0.4712, test_loss: 1.1049, test_f1: 0.5965
 epoch: 31, train_loss: 0.4631, test_loss: 1.1138, test_f1: 0.6129
 epoch: 32, train_loss: 0.4494, test_loss: 1.1416, test_f1: 0.6389
 epoch: 33, train_loss: 0.4294, test_loss: 1.1189, test_f1: 0.6435
 epoch: 34, train_loss: 0.4260, test_loss: 1.1891, test_f1: 0.6404
 epoch: 35, train_loss: 0.4319, test_loss: 1.2196, test_f1: 0.5950
 epoch: 36, train_loss: 0.4048, test_loss: 1.1830, test_f1: 0.6531
 epoch: 37, train_loss: 0.4266, test_loss: 1.1049, test_f1: 0.6330
 epoch: 38, train_loss: 0.3935, test_loss: 1.4067, test_f1: 0.6164
 epoch: 39, train_loss: 0.3961, test_loss: 1.1940, test_f1: 0.6168
 epoch: 40, train_loss: 0.3717, test_loss: 1.1582, test_f1: 0.6115
 epoch: 41, train_loss: 0.3532, test_loss: 1.2153, test_f1: 0.6273
 epoch: 42, train_loss: 0.3579, test_loss: 1.3162, test_f1: 0.6246
 epoch: 43, train_loss: 0.3377, test_loss: 1.3718, test_f1: 0.6277
 epoch: 44, train_loss: 0.3290, test_loss: 1.4297, test_f1: 0.6343
 epoch: 45, train_loss: 0.3319, test_loss: 1.3187, test_f1: 0.6258
 epoch: 46, train_loss: 0.3061, test_loss: 1.3403, test_f1: 0.6109
 epoch: 47, train_loss: 0.2969, test_loss: 1.2847, test_f1: 0.6445
 epoch: 48, train_loss: 0.3095, test_loss: 1.5556, test_f1: 0.6310
 epoch: 49, train_loss: 0.2923, test_loss: 1.5019, test_f1: 0.6615
 epoch: 50, train_loss: 0.3210, test_loss: 1.3844, test_f1: 0.6342
 epoch: 51, train_loss: 0.2551, test_loss: 1.4839, test_f1: 0.6129
 epoch: 52, train_loss: 0.2299, test_loss: 1.4750, test_f1: 0.6417
 epoch: 53, train_loss: 0.2117, test_loss: 1.4719, test_f1: 0.6269
 epoch: 54, train_loss: 0.2194, test_loss: 1.4618, test_f1: 0.6245
 epoch: 55, train_loss: 0.2002, test_loss: 1.6328, test_f1: 0.6470
 epoch: 56, train_loss: 0.1980, test_loss: 1.6109, test_f1: 0.6177
 epoch: 57, train_loss: 0.1849, test_loss: 1.5703, test_f1: 0.6499
 epoch: 58, train_loss: 0.1810, test_loss: 1.6534, test_f1: 0.6566
 epoch: 59, train_loss: 0.1976, test_loss: 1.7478, test_f1: 0.6669
 epoch: 60, train_loss: 0.1781, test_loss: 1.6834, test_f1: 0.6422
 epoch: 61, train_loss: 0.1679, test_loss: 1.6798, test_f1: 0.6513
 epoch: 62, train_loss: 0.1586, test_loss: 1.5567, test_f1: 0.6630
 epoch: 63, train_loss: 0.1557, test_loss: 1.7511, test_f1: 0.6386
 epoch: 64, train_loss: 0.1649, test_loss: 1.8407, test_f1: 0.6416
 epoch: 65, train_loss: 0.1619, test_loss: 1.7581, test_f1: 0.6451
 epoch: 66, train_loss: 0.1722, test_loss: 2.0094, test_f1: 0.6451
 epoch: 67, train_loss: 0.1608, test_loss: 1.7114, test_f1: 0.6517
 epoch: 68, train_loss: 0.1526, test_loss: 1.7838, test_f1: 0.6418
 epoch: 69, train_loss: 0.1684, test_loss: 1.7803, test_f1: 0.6634
 epoch: 70, train_loss: 0.1503, test_loss: 1.7007, test_f1: 0.6509
 epoch: 71, train_loss: 0.1388, test_loss: 2.0025, test_f1: 0.6420
 epoch: 72, train_loss: 0.1557, test_loss: 1.9779, test_f1: 0.6372
 epoch: 73, train_loss: 0.1512, test_loss: 2.1056, test_f1: 0.6217
 epoch: 74, train_loss: 0.1346, test_loss: 1.9380, test_f1: 0.6349
 epoch: 75, train_loss: 0.1401, test_loss: 2.0462, test_f1: 0.6491
 epoch: 76, train_loss: 0.1342, test_loss: 2.0932, test_f1: 0.6555
 epoch: 77, train_loss: 0.1218, test_loss: 2.1463, test_f1: 0.6611
 epoch: 78, train_loss: 0.1322, test_loss: 2.1838, test_f1: 0.6347
 epoch: 79, train_loss: 0.1365, test_loss: 2.0304, test_f1: 0.6615
 epoch: 80, train_loss: 0.1322, test_loss: 1.9951, test_f1: 0.6496
 epoch: 81, train_loss: 0.1195, test_loss: 2.1431, test_f1: 0.6474
 epoch: 82, train_loss: 0.1316, test_loss: 2.1468, test_f1: 0.6283
 epoch: 83, train_loss: 0.1136, test_loss: 2.2563, test_f1: 0.6356
 epoch: 84, train_loss: 0.1429, test_loss: 2.1439, test_f1: 0.6398
 epoch: 85, train_loss: 0.1179, test_loss: 2.0436, test_f1: 0.6310
 epoch: 86, train_loss: 0.1259, test_loss: 2.2260, test_f1: 0.6135
 epoch: 87, train_loss: 0.1093, test_loss: 2.1185, test_f1: 0.6331
 epoch: 88, train_loss: 0.1247, test_loss: 2.1546, test_f1: 0.6387
 epoch: 89, train_loss: 0.1171, test_loss: 2.4017, test_f1: 0.6324
 epoch: 90, train_loss: 0.1058, test_loss: 2.2805, test_f1: 0.6438
 epoch: 91, train_loss: 0.1017, test_loss: 2.2200, test_f1: 0.6247
 epoch: 92, train_loss: 0.1048, test_loss: 2.3069, test_f1: 0.6559
 epoch: 93, train_loss: 0.0954, test_loss: 2.5275, test_f1: 0.6304
 epoch: 94, train_loss: 0.1232, test_loss: 2.4371, test_f1: 0.6402
 epoch: 95, train_loss: 0.1229, test_loss: 2.3877, test_f1: 0.6758
 epoch: 96, train_loss: 0.1041, test_loss: 2.2360, test_f1: 0.6310
 epoch: 97, train_loss: 0.0945, test_loss: 2.6070, test_f1: 0.6310
 epoch: 98, train_loss: 0.0839, test_loss: 2.5818, test_f1: 0.6302
 epoch: 99, train_loss: 0.0797, test_loss: 2.4586, test_f1: 0.6466
##################ITERATION #1 ****************************************
 epoch: 0, train_loss: 1.1121, test_loss: 1.3153, test_f1: 0.2260
 epoch: 1, train_loss: 0.9463, test_loss: 0.9959, test_f1: 0.4467
 epoch: 2, train_loss: 0.8818, test_loss: 0.8708, test_f1: 0.5486
 epoch: 3, train_loss: 0.8401, test_loss: 0.8702, test_f1: 0.5631
 epoch: 4, train_loss: 0.8178, test_loss: 0.8299, test_f1: 0.5538
 epoch: 5, train_loss: 0.7888, test_loss: 0.8544, test_f1: 0.5417
 epoch: 6, train_loss: 0.7604, test_loss: 0.8604, test_f1: 0.6019
 epoch: 7, train_loss: 0.7293, test_loss: 0.8561, test_f1: 0.6062
 epoch: 8, train_loss: 0.7199, test_loss: 0.9095, test_f1: 0.5310
 epoch: 9, train_loss: 0.7294, test_loss: 0.9028, test_f1: 0.5679
 epoch: 10, train_loss: 0.6844, test_loss: 0.8131, test_f1: 0.5950
 epoch: 11, train_loss: 0.6820, test_loss: 0.8761, test_f1: 0.6185
 epoch: 12, train_loss: 0.6513, test_loss: 0.8566, test_f1: 0.6334
 epoch: 13, train_loss: 0.6343, test_loss: 0.8562, test_f1: 0.6238
 epoch: 14, train_loss: 0.6321, test_loss: 0.8740, test_f1: 0.5976
 epoch: 15, train_loss: 0.6148, test_loss: 0.8758, test_f1: 0.6162
 epoch: 16, train_loss: 0.5961, test_loss: 0.8252, test_f1: 0.6353
 epoch: 17, train_loss: 0.5878, test_loss: 0.8232, test_f1: 0.6487
 epoch: 18, train_loss: 0.5736, test_loss: 0.8332, test_f1: 0.6269
 epoch: 19, train_loss: 0.5655, test_loss: 0.9129, test_f1: 0.6208
 epoch: 20, train_loss: 0.5383, test_loss: 0.9200, test_f1: 0.5987
 epoch: 21, train_loss: 0.5262, test_loss: 0.9421, test_f1: 0.6199
 epoch: 22, train_loss: 0.5146, test_loss: 0.8761, test_f1: 0.6496
 epoch: 23, train_loss: 0.5056, test_loss: 1.0659, test_f1: 0.5957
 epoch: 24, train_loss: 0.5058, test_loss: 1.0186, test_f1: 0.6217
 epoch: 25, train_loss: 0.4972, test_loss: 0.9173, test_f1: 0.6507
 epoch: 26, train_loss: 0.4878, test_loss: 0.8686, test_f1: 0.6576
 epoch: 27, train_loss: 0.4801, test_loss: 1.0144, test_f1: 0.6496
 epoch: 28, train_loss: 0.4668, test_loss: 1.0921, test_f1: 0.5852
 epoch: 29, train_loss: 0.4605, test_loss: 1.0403, test_f1: 0.6306
 epoch: 30, train_loss: 0.4424, test_loss: 1.0717, test_f1: 0.5920
 epoch: 31, train_loss: 0.4098, test_loss: 1.0186, test_f1: 0.6614
 epoch: 32, train_loss: 0.3993, test_loss: 1.0671, test_f1: 0.6005
 epoch: 33, train_loss: 0.4043, test_loss: 1.0459, test_f1: 0.6531
 epoch: 34, train_loss: 0.3828, test_loss: 1.0492, test_f1: 0.6540
 epoch: 35, train_loss: 0.4041, test_loss: 1.1506, test_f1: 0.6146
 epoch: 36, train_loss: 0.3744, test_loss: 1.0349, test_f1: 0.6583
 epoch: 37, train_loss: 0.3698, test_loss: 1.1953, test_f1: 0.6410
 epoch: 38, train_loss: 0.3897, test_loss: 1.0836, test_f1: 0.6639
 epoch: 39, train_loss: 0.3706, test_loss: 1.2504, test_f1: 0.6483
 epoch: 40, train_loss: 0.3381, test_loss: 1.2291, test_f1: 0.6640
 epoch: 41, train_loss: 0.3384, test_loss: 1.2897, test_f1: 0.6490
 epoch: 42, train_loss: 0.3484, test_loss: 1.4772, test_f1: 0.6310
 epoch: 43, train_loss: 0.3316, test_loss: 1.1824, test_f1: 0.6560
 epoch: 44, train_loss: 0.3242, test_loss: 1.2523, test_f1: 0.6582
 epoch: 45, train_loss: 0.2906, test_loss: 1.4249, test_f1: 0.6080
 epoch: 46, train_loss: 0.2954, test_loss: 1.3441, test_f1: 0.6102
 epoch: 47, train_loss: 0.3000, test_loss: 1.3499, test_f1: 0.6502
 epoch: 48, train_loss: 0.3065, test_loss: 1.3422, test_f1: 0.6648
 epoch: 49, train_loss: 0.2812, test_loss: 1.3096, test_f1: 0.6634
 epoch: 50, train_loss: 0.2764, test_loss: 1.2811, test_f1: 0.6225
 epoch: 51, train_loss: 0.2617, test_loss: 1.5268, test_f1: 0.6649
 epoch: 52, train_loss: 0.2093, test_loss: 1.5124, test_f1: 0.6707
 epoch: 53, train_loss: 0.2027, test_loss: 1.5705, test_f1: 0.6433
 epoch: 54, train_loss: 0.1962, test_loss: 1.5806, test_f1: 0.6686
 epoch: 55, train_loss: 0.1918, test_loss: 1.6798, test_f1: 0.6692
 epoch: 56, train_loss: 0.1868, test_loss: 1.5701, test_f1: 0.6747
 epoch: 57, train_loss: 0.1784, test_loss: 1.6787, test_f1: 0.6800
 epoch: 58, train_loss: 0.1719, test_loss: 1.9384, test_f1: 0.6583
 epoch: 59, train_loss: 0.1823, test_loss: 1.7827, test_f1: 0.6557
 epoch: 60, train_loss: 0.1780, test_loss: 1.7652, test_f1: 0.6574
 epoch: 61, train_loss: 0.1662, test_loss: 1.9157, test_f1: 0.6542
 epoch: 62, train_loss: 0.1607, test_loss: 1.8396, test_f1: 0.6620
 epoch: 63, train_loss: 0.1730, test_loss: 1.7630, test_f1: 0.6693
 epoch: 64, train_loss: 0.1644, test_loss: 1.8478, test_f1: 0.6482
 epoch: 65, train_loss: 0.1610, test_loss: 1.9142, test_f1: 0.6834
 epoch: 66, train_loss: 0.1547, test_loss: 1.9047, test_f1: 0.6580
 epoch: 67, train_loss: 0.1609, test_loss: 1.9231, test_f1: 0.6414
 epoch: 68, train_loss: 0.1474, test_loss: 2.0063, test_f1: 0.6447
 epoch: 69, train_loss: 0.1388, test_loss: 1.9033, test_f1: 0.6688
 epoch: 70, train_loss: 0.1508, test_loss: 2.1038, test_f1: 0.6534
 epoch: 71, train_loss: 0.1703, test_loss: 1.9020, test_f1: 0.6945
 epoch: 72, train_loss: 0.1565, test_loss: 2.1129, test_f1: 0.6484
 epoch: 73, train_loss: 0.1488, test_loss: 2.0747, test_f1: 0.6616
 epoch: 74, train_loss: 0.1470, test_loss: 2.0632, test_f1: 0.6666
 epoch: 75, train_loss: 0.1461, test_loss: 1.9688, test_f1: 0.6597
 epoch: 76, train_loss: 0.1530, test_loss: 1.9255, test_f1: 0.6643
 epoch: 77, train_loss: 0.1362, test_loss: 2.2637, test_f1: 0.6736
 epoch: 78, train_loss: 0.1350, test_loss: 2.0756, test_f1: 0.6807
 epoch: 79, train_loss: 0.1503, test_loss: 2.2517, test_f1: 0.6405
 epoch: 80, train_loss: 0.1271, test_loss: 2.1385, test_f1: 0.6461
 epoch: 81, train_loss: 0.1211, test_loss: 2.2467, test_f1: 0.6683
 epoch: 82, train_loss: 0.1214, test_loss: 1.9746, test_f1: 0.6704
 epoch: 83, train_loss: 0.1189, test_loss: 2.3788, test_f1: 0.6243
 epoch: 84, train_loss: 0.1300, test_loss: 2.2360, test_f1: 0.6645
 epoch: 85, train_loss: 0.1306, test_loss: 2.3647, test_f1: 0.6490
 epoch: 86, train_loss: 0.1301, test_loss: 2.1547, test_f1: 0.6590
 epoch: 87, train_loss: 0.1216, test_loss: 2.2585, test_f1: 0.6524
 epoch: 88, train_loss: 0.1368, test_loss: 2.1905, test_f1: 0.6775
 epoch: 89, train_loss: 0.1268, test_loss: 2.3903, test_f1: 0.6592
 epoch: 90, train_loss: 0.1189, test_loss: 2.3059, test_f1: 0.6864
 epoch: 91, train_loss: 0.1091, test_loss: 2.1952, test_f1: 0.6901
 epoch: 92, train_loss: 0.1113, test_loss: 2.3650, test_f1: 0.6693
 epoch: 93, train_loss: 0.1175, test_loss: 2.0918, test_f1: 0.6492
 epoch: 94, train_loss: 0.1109, test_loss: 2.2087, test_f1: 0.6661
 epoch: 95, train_loss: 0.1021, test_loss: 2.3128, test_f1: 0.6620
 epoch: 96, train_loss: 0.0970, test_loss: 2.4069, test_f1: 0.6634
 epoch: 97, train_loss: 0.1039, test_loss: 2.3805, test_f1: 0.6740
 epoch: 98, train_loss: 0.1156, test_loss: 2.3362, test_f1: 0.6840
 epoch: 99, train_loss: 0.1026, test_loss: 2.5963, test_f1: 0.6603
##################ITERATION #2 ****************************************
 epoch: 0, train_loss: 1.0914, test_loss: 1.3538, test_f1: 0.2400
 epoch: 1, train_loss: 0.9340, test_loss: 1.0657, test_f1: 0.4399
 epoch: 2, train_loss: 0.8765, test_loss: 1.0180, test_f1: 0.4740
 epoch: 3, train_loss: 0.8454, test_loss: 0.9322, test_f1: 0.5330
 epoch: 4, train_loss: 0.8109, test_loss: 0.9291, test_f1: 0.5810
 epoch: 5, train_loss: 0.7871, test_loss: 0.8744, test_f1: 0.6041
 epoch: 6, train_loss: 0.7860, test_loss: 0.8629, test_f1: 0.5978
 epoch: 7, train_loss: 0.7498, test_loss: 1.0427, test_f1: 0.5129
 epoch: 8, train_loss: 0.7317, test_loss: 0.8730, test_f1: 0.5751
 epoch: 9, train_loss: 0.7090, test_loss: 0.8775, test_f1: 0.5970
 epoch: 10, train_loss: 0.6959, test_loss: 0.7891, test_f1: 0.6390
 epoch: 11, train_loss: 0.6638, test_loss: 0.7833, test_f1: 0.6294
 epoch: 12, train_loss: 0.6630, test_loss: 0.8457, test_f1: 0.6113
 epoch: 13, train_loss: 0.6541, test_loss: 0.7992, test_f1: 0.6282
 epoch: 14, train_loss: 0.6305, test_loss: 0.9238, test_f1: 0.6008
 epoch: 15, train_loss: 0.5999, test_loss: 0.8162, test_f1: 0.6221
 epoch: 16, train_loss: 0.6048, test_loss: 0.7935, test_f1: 0.6081
 epoch: 17, train_loss: 0.5854, test_loss: 0.8219, test_f1: 0.6190
 epoch: 18, train_loss: 0.5782, test_loss: 0.9570, test_f1: 0.5828
 epoch: 19, train_loss: 0.5454, test_loss: 0.9891, test_f1: 0.6111
 epoch: 20, train_loss: 0.5446, test_loss: 0.8363, test_f1: 0.6042
 epoch: 21, train_loss: 0.5266, test_loss: 0.9202, test_f1: 0.6209
 epoch: 22, train_loss: 0.5426, test_loss: 0.8293, test_f1: 0.6409
 epoch: 23, train_loss: 0.5026, test_loss: 0.9903, test_f1: 0.6236
 epoch: 24, train_loss: 0.4958, test_loss: 0.8750, test_f1: 0.6216
 epoch: 25, train_loss: 0.4890, test_loss: 0.8897, test_f1: 0.6238
 epoch: 26, train_loss: 0.4677, test_loss: 1.0442, test_f1: 0.5801
 epoch: 27, train_loss: 0.4615, test_loss: 0.9652, test_f1: 0.6250
 epoch: 28, train_loss: 0.4400, test_loss: 0.8922, test_f1: 0.6573
 epoch: 29, train_loss: 0.4335, test_loss: 1.0165, test_f1: 0.6162
 epoch: 30, train_loss: 0.4253, test_loss: 0.8680, test_f1: 0.6557
 epoch: 31, train_loss: 0.4186, test_loss: 1.0889, test_f1: 0.5948
 epoch: 32, train_loss: 0.4112, test_loss: 1.1842, test_f1: 0.5956
 epoch: 33, train_loss: 0.4046, test_loss: 0.9399, test_f1: 0.6750
 epoch: 34, train_loss: 0.4061, test_loss: 1.0681, test_f1: 0.6095
 epoch: 35, train_loss: 0.3947, test_loss: 1.0095, test_f1: 0.6309
 epoch: 36, train_loss: 0.3725, test_loss: 0.9543, test_f1: 0.6821
 epoch: 37, train_loss: 0.3732, test_loss: 1.1317, test_f1: 0.6421
 epoch: 38, train_loss: 0.3422, test_loss: 1.0737, test_f1: 0.6149
 epoch: 39, train_loss: 0.3654, test_loss: 1.0748, test_f1: 0.6325
 epoch: 40, train_loss: 0.3532, test_loss: 1.0277, test_f1: 0.6822
 epoch: 41, train_loss: 0.3430, test_loss: 1.0331, test_f1: 0.6361
 epoch: 42, train_loss: 0.3249, test_loss: 1.0881, test_f1: 0.6542
 epoch: 43, train_loss: 0.3281, test_loss: 0.9345, test_f1: 0.6648
 epoch: 44, train_loss: 0.2943, test_loss: 1.2883, test_f1: 0.6205
 epoch: 45, train_loss: 0.2851, test_loss: 1.1671, test_f1: 0.6380
 epoch: 46, train_loss: 0.3015, test_loss: 1.2262, test_f1: 0.6377
 epoch: 47, train_loss: 0.3093, test_loss: 1.0831, test_f1: 0.6636
 epoch: 48, train_loss: 0.2923, test_loss: 1.3081, test_f1: 0.6394
 epoch: 49, train_loss: 0.2732, test_loss: 1.1887, test_f1: 0.6542
 epoch: 50, train_loss: 0.2700, test_loss: 1.3470, test_f1: 0.6428
 epoch: 51, train_loss: 0.2500, test_loss: 1.2586, test_f1: 0.6488
 epoch: 52, train_loss: 0.2200, test_loss: 1.2447, test_f1: 0.6457
 epoch: 53, train_loss: 0.2071, test_loss: 1.3937, test_f1: 0.6560
 epoch: 54, train_loss: 0.1956, test_loss: 1.3556, test_f1: 0.6892
 epoch: 55, train_loss: 0.1985, test_loss: 1.3447, test_f1: 0.6685
 epoch: 56, train_loss: 0.1762, test_loss: 1.4597, test_f1: 0.6438
 epoch: 57, train_loss: 0.1791, test_loss: 1.4184, test_f1: 0.6612
 epoch: 58, train_loss: 0.1751, test_loss: 1.4992, test_f1: 0.6509
 epoch: 59, train_loss: 0.1615, test_loss: 1.4792, test_f1: 0.6885
 epoch: 60, train_loss: 0.1588, test_loss: 1.4631, test_f1: 0.6701
 epoch: 61, train_loss: 0.1640, test_loss: 1.4943, test_f1: 0.6862
 epoch: 62, train_loss: 0.1742, test_loss: 1.4665, test_f1: 0.6600
 epoch: 63, train_loss: 0.1643, test_loss: 1.5804, test_f1: 0.6895
 epoch: 64, train_loss: 0.1759, test_loss: 1.5025, test_f1: 0.6497
 epoch: 65, train_loss: 0.1737, test_loss: 1.6158, test_f1: 0.6502
 epoch: 66, train_loss: 0.1556, test_loss: 1.6171, test_f1: 0.6688
 epoch: 67, train_loss: 0.1425, test_loss: 1.6455, test_f1: 0.6597
 epoch: 68, train_loss: 0.1656, test_loss: 1.6811, test_f1: 0.6495
 epoch: 69, train_loss: 0.1476, test_loss: 1.8223, test_f1: 0.6759
 epoch: 70, train_loss: 0.1549, test_loss: 1.6887, test_f1: 0.6523
 epoch: 71, train_loss: 0.1388, test_loss: 1.6082, test_f1: 0.6466
 epoch: 72, train_loss: 0.1575, test_loss: 1.7702, test_f1: 0.6847
 epoch: 73, train_loss: 0.1500, test_loss: 1.8241, test_f1: 0.6352
 epoch: 74, train_loss: 0.1562, test_loss: 1.7804, test_f1: 0.6500
 epoch: 75, train_loss: 0.1338, test_loss: 1.7597, test_f1: 0.6845
 epoch: 76, train_loss: 0.1317, test_loss: 1.7725, test_f1: 0.6547
 epoch: 77, train_loss: 0.1323, test_loss: 1.6515, test_f1: 0.6708
 epoch: 78, train_loss: 0.1267, test_loss: 1.8452, test_f1: 0.6894
 epoch: 79, train_loss: 0.1244, test_loss: 1.9868, test_f1: 0.6774
 epoch: 80, train_loss: 0.1289, test_loss: 1.8478, test_f1: 0.6743
 epoch: 81, train_loss: 0.1316, test_loss: 2.0517, test_f1: 0.6346
 epoch: 82, train_loss: 0.1215, test_loss: 1.9624, test_f1: 0.6289
 epoch: 83, train_loss: 0.1181, test_loss: 2.0578, test_f1: 0.6518
 epoch: 84, train_loss: 0.1293, test_loss: 2.0062, test_f1: 0.6391
 epoch: 85, train_loss: 0.1413, test_loss: 2.0911, test_f1: 0.6389
 epoch: 86, train_loss: 0.1239, test_loss: 1.9130, test_f1: 0.6870
 epoch: 87, train_loss: 0.1137, test_loss: 1.9366, test_f1: 0.6755
 epoch: 88, train_loss: 0.1169, test_loss: 2.0194, test_f1: 0.6632
 epoch: 89, train_loss: 0.1057, test_loss: 2.1030, test_f1: 0.6463
 epoch: 90, train_loss: 0.1063, test_loss: 2.0813, test_f1: 0.6714
 epoch: 91, train_loss: 0.1154, test_loss: 2.1384, test_f1: 0.6589
 epoch: 92, train_loss: 0.1139, test_loss: 2.0291, test_f1: 0.6681
 epoch: 93, train_loss: 0.1150, test_loss: 2.1376, test_f1: 0.6603
 epoch: 94, train_loss: 0.1150, test_loss: 2.1455, test_f1: 0.6691
 epoch: 95, train_loss: 0.1058, test_loss: 2.0408, test_f1: 0.6888
 epoch: 96, train_loss: 0.1022, test_loss: 2.1008, test_f1: 0.6488
 epoch: 97, train_loss: 0.1067, test_loss: 2.1522, test_f1: 0.6669
 epoch: 98, train_loss: 0.1193, test_loss: 2.0411, test_f1: 0.6705
 epoch: 99, train_loss: 0.1047, test_loss: 2.0358, test_f1: 0.6663
##################ITERATION #3 ****************************************
 epoch: 0, train_loss: 1.2092, test_loss: 1.3841, test_f1: 0.3097
 epoch: 1, train_loss: 0.9904, test_loss: 1.0888, test_f1: 0.5131
 epoch: 2, train_loss: 0.9349, test_loss: 0.9133, test_f1: 0.5573
 epoch: 3, train_loss: 0.8674, test_loss: 1.0288, test_f1: 0.5486
 epoch: 4, train_loss: 0.8491, test_loss: 0.9139, test_f1: 0.5263
 epoch: 5, train_loss: 0.8020, test_loss: 0.8200, test_f1: 0.5953
 epoch: 6, train_loss: 0.7954, test_loss: 0.8846, test_f1: 0.5620
 epoch: 7, train_loss: 0.7697, test_loss: 0.9171, test_f1: 0.5888
 epoch: 8, train_loss: 0.7468, test_loss: 0.8378, test_f1: 0.5986
 epoch: 9, train_loss: 0.7372, test_loss: 0.8122, test_f1: 0.6003
 epoch: 10, train_loss: 0.7147, test_loss: 0.7844, test_f1: 0.6210
 epoch: 11, train_loss: 0.7228, test_loss: 0.8688, test_f1: 0.5792
 epoch: 12, train_loss: 0.6875, test_loss: 0.7926, test_f1: 0.6365
 epoch: 13, train_loss: 0.6763, test_loss: 0.8503, test_f1: 0.5927
 epoch: 14, train_loss: 0.6747, test_loss: 0.7395, test_f1: 0.6522
 epoch: 15, train_loss: 0.6477, test_loss: 0.8469, test_f1: 0.6120
 epoch: 16, train_loss: 0.6460, test_loss: 0.8155, test_f1: 0.6367
 epoch: 17, train_loss: 0.6366, test_loss: 0.8558, test_f1: 0.6374
 epoch: 18, train_loss: 0.5922, test_loss: 0.7541, test_f1: 0.6623
 epoch: 19, train_loss: 0.5925, test_loss: 0.8078, test_f1: 0.6382
 epoch: 20, train_loss: 0.5715, test_loss: 0.8832, test_f1: 0.6275
 epoch: 21, train_loss: 0.5720, test_loss: 0.7839, test_f1: 0.6610
 epoch: 22, train_loss: 0.5688, test_loss: 0.8567, test_f1: 0.6054
 epoch: 23, train_loss: 0.5721, test_loss: 0.8208, test_f1: 0.6563
 epoch: 24, train_loss: 0.5656, test_loss: 0.8359, test_f1: 0.6434
 epoch: 25, train_loss: 0.5315, test_loss: 0.7973, test_f1: 0.6568
 epoch: 26, train_loss: 0.5083, test_loss: 0.7893, test_f1: 0.6814
 epoch: 27, train_loss: 0.4856, test_loss: 0.8544, test_f1: 0.6508
 epoch: 28, train_loss: 0.4966, test_loss: 0.8832, test_f1: 0.6330
 epoch: 29, train_loss: 0.4652, test_loss: 0.8991, test_f1: 0.6703
 epoch: 30, train_loss: 0.4573, test_loss: 0.8892, test_f1: 0.6503
 epoch: 31, train_loss: 0.4562, test_loss: 0.8767, test_f1: 0.6606
 epoch: 32, train_loss: 0.4657, test_loss: 0.8861, test_f1: 0.6582
 epoch: 33, train_loss: 0.4714, test_loss: 0.8095, test_f1: 0.6905
 epoch: 34, train_loss: 0.4512, test_loss: 1.0026, test_f1: 0.6326
 epoch: 35, train_loss: 0.4284, test_loss: 0.9082, test_f1: 0.6674
 epoch: 36, train_loss: 0.4156, test_loss: 0.9115, test_f1: 0.6728
 epoch: 37, train_loss: 0.4102, test_loss: 0.9251, test_f1: 0.6690
 epoch: 38, train_loss: 0.3992, test_loss: 1.1060, test_f1: 0.6545
 epoch: 39, train_loss: 0.3976, test_loss: 0.9956, test_f1: 0.6869
 epoch: 40, train_loss: 0.3742, test_loss: 0.8712, test_f1: 0.6980
 epoch: 41, train_loss: 0.3579, test_loss: 0.9198, test_f1: 0.6933
 epoch: 42, train_loss: 0.3576, test_loss: 1.0014, test_f1: 0.6388
 epoch: 43, train_loss: 0.3406, test_loss: 0.8458, test_f1: 0.7020
 epoch: 44, train_loss: 0.3687, test_loss: 1.0462, test_f1: 0.6399
 epoch: 45, train_loss: 0.3838, test_loss: 0.9793, test_f1: 0.6635
 epoch: 46, train_loss: 0.3592, test_loss: 1.2383, test_f1: 0.6054
 epoch: 47, train_loss: 0.3737, test_loss: 1.0183, test_f1: 0.6876
 epoch: 48, train_loss: 0.3201, test_loss: 1.0890, test_f1: 0.6431
 epoch: 49, train_loss: 0.2887, test_loss: 1.2171, test_f1: 0.6249
 epoch: 50, train_loss: 0.3226, test_loss: 1.0835, test_f1: 0.6639
 epoch: 51, train_loss: 0.2843, test_loss: 1.0840, test_f1: 0.6854
 epoch: 52, train_loss: 0.2460, test_loss: 1.0667, test_f1: 0.6849
 epoch: 53, train_loss: 0.2326, test_loss: 1.1198, test_f1: 0.6659
 epoch: 54, train_loss: 0.2303, test_loss: 1.0863, test_f1: 0.7020
 epoch: 55, train_loss: 0.2420, test_loss: 1.0949, test_f1: 0.7022
 epoch: 56, train_loss: 0.1996, test_loss: 1.1052, test_f1: 0.6900
 epoch: 57, train_loss: 0.2179, test_loss: 1.2134, test_f1: 0.6660
 epoch: 58, train_loss: 0.2207, test_loss: 1.1696, test_f1: 0.6757
 epoch: 59, train_loss: 0.2053, test_loss: 1.2204, test_f1: 0.6650
 epoch: 60, train_loss: 0.2040, test_loss: 1.2131, test_f1: 0.6623
 epoch: 61, train_loss: 0.2035, test_loss: 1.1502, test_f1: 0.6773
 epoch: 62, train_loss: 0.1916, test_loss: 1.3716, test_f1: 0.6879
 epoch: 63, train_loss: 0.1885, test_loss: 1.1992, test_f1: 0.6905
 epoch: 64, train_loss: 0.1885, test_loss: 1.3266, test_f1: 0.6664
 epoch: 65, train_loss: 0.1785, test_loss: 1.3217, test_f1: 0.6737
 epoch: 66, train_loss: 0.1786, test_loss: 1.3075, test_f1: 0.6887
 epoch: 67, train_loss: 0.1766, test_loss: 1.2727, test_f1: 0.6558
 epoch: 68, train_loss: 0.1794, test_loss: 1.2947, test_f1: 0.6891
 epoch: 69, train_loss: 0.2169, test_loss: 1.3049, test_f1: 0.6896
 epoch: 70, train_loss: 0.1859, test_loss: 1.2704, test_f1: 0.6709
 epoch: 71, train_loss: 0.1787, test_loss: 1.1442, test_f1: 0.7037
 epoch: 72, train_loss: 0.1762, test_loss: 1.2264, test_f1: 0.6905
 epoch: 73, train_loss: 0.1701, test_loss: 1.3181, test_f1: 0.6743
 epoch: 74, train_loss: 0.1670, test_loss: 1.2962, test_f1: 0.6964
 epoch: 75, train_loss: 0.1592, test_loss: 1.3610, test_f1: 0.6893
 epoch: 76, train_loss: 0.1521, test_loss: 1.3859, test_f1: 0.6692
 epoch: 77, train_loss: 0.1603, test_loss: 1.3839, test_f1: 0.6806
 epoch: 78, train_loss: 0.1555, test_loss: 1.4242, test_f1: 0.6730
 epoch: 79, train_loss: 0.1411, test_loss: 1.4840, test_f1: 0.6769
 epoch: 80, train_loss: 0.1570, test_loss: 1.5175, test_f1: 0.6739
 epoch: 81, train_loss: 0.1514, test_loss: 1.4542, test_f1: 0.6910
 epoch: 82, train_loss: 0.1372, test_loss: 1.4599, test_f1: 0.6560
 epoch: 83, train_loss: 0.1412, test_loss: 1.5301, test_f1: 0.6697
 epoch: 84, train_loss: 0.1442, test_loss: 1.3985, test_f1: 0.6908
 epoch: 85, train_loss: 0.1463, test_loss: 1.5189, test_f1: 0.6817
 epoch: 86, train_loss: 0.1340, test_loss: 1.5300, test_f1: 0.7009
 epoch: 87, train_loss: 0.1409, test_loss: 1.5041, test_f1: 0.6831
 epoch: 88, train_loss: 0.1524, test_loss: 1.5068, test_f1: 0.6723
 epoch: 89, train_loss: 0.1494, test_loss: 1.5674, test_f1: 0.6764
 epoch: 90, train_loss: 0.1418, test_loss: 1.5745, test_f1: 0.6764
 epoch: 91, train_loss: 0.1355, test_loss: 1.4214, test_f1: 0.7191
 epoch: 92, train_loss: 0.1391, test_loss: 1.6192, test_f1: 0.6702
 epoch: 93, train_loss: 0.1214, test_loss: 1.6576, test_f1: 0.6520
 epoch: 94, train_loss: 0.1248, test_loss: 1.5037, test_f1: 0.6878
 epoch: 95, train_loss: 0.1407, test_loss: 1.6057, test_f1: 0.6840
 epoch: 96, train_loss: 0.1477, test_loss: 1.6410, test_f1: 0.7011
 epoch: 97, train_loss: 0.1274, test_loss: 1.6431, test_f1: 0.6759
 epoch: 98, train_loss: 0.1268, test_loss: 1.7075, test_f1: 0.6810
 epoch: 99, train_loss: 0.1245, test_loss: 1.6439, test_f1: 0.6718
##################ITERATION #4 ****************************************
 epoch: 0, train_loss: 1.2766, test_loss: 1.4848, test_f1: 0.2540
 epoch: 1, train_loss: 1.0092, test_loss: 1.1092, test_f1: 0.3494
 epoch: 2, train_loss: 0.9481, test_loss: 0.9191, test_f1: 0.5478
 epoch: 3, train_loss: 0.8839, test_loss: 0.9910, test_f1: 0.4896
 epoch: 4, train_loss: 0.8732, test_loss: 0.8904, test_f1: 0.5649
 epoch: 5, train_loss: 0.8284, test_loss: 0.9069, test_f1: 0.5348
 epoch: 6, train_loss: 0.8027, test_loss: 0.8883, test_f1: 0.5656
 epoch: 7, train_loss: 0.7734, test_loss: 0.8174, test_f1: 0.5808
 epoch: 8, train_loss: 0.7528, test_loss: 0.8511, test_f1: 0.5769
 epoch: 9, train_loss: 0.7231, test_loss: 0.7908, test_f1: 0.6034
 epoch: 10, train_loss: 0.7068, test_loss: 0.8688, test_f1: 0.5613
 epoch: 11, train_loss: 0.7155, test_loss: 0.8896, test_f1: 0.5803
 epoch: 12, train_loss: 0.6754, test_loss: 0.8364, test_f1: 0.6238
 epoch: 13, train_loss: 0.6657, test_loss: 0.8796, test_f1: 0.5947
 epoch: 14, train_loss: 0.6427, test_loss: 0.8437, test_f1: 0.6229
 epoch: 15, train_loss: 0.6463, test_loss: 0.7572, test_f1: 0.6402
 epoch: 16, train_loss: 0.6085, test_loss: 0.8379, test_f1: 0.6140
 epoch: 17, train_loss: 0.6068, test_loss: 0.9279, test_f1: 0.5879
 epoch: 18, train_loss: 0.6004, test_loss: 0.9151, test_f1: 0.6512
 epoch: 19, train_loss: 0.5806, test_loss: 0.8831, test_f1: 0.6377
 epoch: 20, train_loss: 0.5648, test_loss: 0.9355, test_f1: 0.6055
 epoch: 21, train_loss: 0.5693, test_loss: 0.8393, test_f1: 0.6359
 epoch: 22, train_loss: 0.5236, test_loss: 0.9042, test_f1: 0.5984
 epoch: 23, train_loss: 0.5351, test_loss: 0.7477, test_f1: 0.6725
 epoch: 24, train_loss: 0.5183, test_loss: 0.7454, test_f1: 0.6465
 epoch: 25, train_loss: 0.5197, test_loss: 0.7699, test_f1: 0.6872
 epoch: 26, train_loss: 0.5081, test_loss: 0.8965, test_f1: 0.6132
 epoch: 27, train_loss: 0.5043, test_loss: 0.9373, test_f1: 0.6393
 epoch: 28, train_loss: 0.4915, test_loss: 0.7314, test_f1: 0.6968
 epoch: 29, train_loss: 0.4624, test_loss: 0.8084, test_f1: 0.6647
 epoch: 30, train_loss: 0.4415, test_loss: 0.9034, test_f1: 0.6701
 epoch: 31, train_loss: 0.4358, test_loss: 0.8179, test_f1: 0.6728
 epoch: 32, train_loss: 0.4162, test_loss: 0.9010, test_f1: 0.6490
 epoch: 33, train_loss: 0.4040, test_loss: 1.0207, test_f1: 0.6528
 epoch: 34, train_loss: 0.4118, test_loss: 0.8383, test_f1: 0.6843
 epoch: 35, train_loss: 0.3966, test_loss: 0.9323, test_f1: 0.6713
 epoch: 36, train_loss: 0.3917, test_loss: 0.9094, test_f1: 0.6673
 epoch: 37, train_loss: 0.3877, test_loss: 1.1174, test_f1: 0.6409
 epoch: 38, train_loss: 0.3657, test_loss: 1.0681, test_f1: 0.6476
 epoch: 39, train_loss: 0.3790, test_loss: 1.0125, test_f1: 0.6561
 epoch: 40, train_loss: 0.3568, test_loss: 1.0304, test_f1: 0.6452
 epoch: 41, train_loss: 0.3731, test_loss: 0.8537, test_f1: 0.6792
 epoch: 42, train_loss: 0.3356, test_loss: 1.2666, test_f1: 0.6383
 epoch: 43, train_loss: 0.3460, test_loss: 1.0564, test_f1: 0.6462
 epoch: 44, train_loss: 0.3340, test_loss: 1.0863, test_f1: 0.6695
 epoch: 45, train_loss: 0.3380, test_loss: 1.2606, test_f1: 0.5985
 epoch: 46, train_loss: 0.3336, test_loss: 1.0999, test_f1: 0.6555
 epoch: 47, train_loss: 0.3082, test_loss: 0.9447, test_f1: 0.7091
 epoch: 48, train_loss: 0.2969, test_loss: 1.0943, test_f1: 0.6668
 epoch: 49, train_loss: 0.3013, test_loss: 1.0945, test_f1: 0.6613
 epoch: 50, train_loss: 0.2813, test_loss: 1.0139, test_f1: 0.6880
 epoch: 51, train_loss: 0.2445, test_loss: 1.0699, test_f1: 0.6633
 epoch: 52, train_loss: 0.2205, test_loss: 1.1632, test_f1: 0.6430
 epoch: 53, train_loss: 0.2210, test_loss: 1.1033, test_f1: 0.6714
 epoch: 54, train_loss: 0.2155, test_loss: 1.0979, test_f1: 0.6897
 epoch: 55, train_loss: 0.2123, test_loss: 1.2084, test_f1: 0.6639
 epoch: 56, train_loss: 0.2051, test_loss: 1.1288, test_f1: 0.6681
 epoch: 57, train_loss: 0.1911, test_loss: 1.2112, test_f1: 0.6738
 epoch: 58, train_loss: 0.1985, test_loss: 1.3795, test_f1: 0.6529
 epoch: 59, train_loss: 0.1861, test_loss: 1.2088, test_f1: 0.6800
 epoch: 60, train_loss: 0.1677, test_loss: 1.2212, test_f1: 0.7068
 epoch: 61, train_loss: 0.1732, test_loss: 1.3643, test_f1: 0.6867
 epoch: 62, train_loss: 0.1844, test_loss: 1.2665, test_f1: 0.6711
 epoch: 63, train_loss: 0.1760, test_loss: 1.3810, test_f1: 0.6576
 epoch: 64, train_loss: 0.1648, test_loss: 1.4243, test_f1: 0.6519
 epoch: 65, train_loss: 0.1779, test_loss: 1.4670, test_f1: 0.6360
 epoch: 66, train_loss: 0.1574, test_loss: 1.4230, test_f1: 0.6850
 epoch: 67, train_loss: 0.1763, test_loss: 1.4980, test_f1: 0.6475
 epoch: 68, train_loss: 0.1761, test_loss: 1.4340, test_f1: 0.6625
 epoch: 69, train_loss: 0.1518, test_loss: 1.4098, test_f1: 0.6518
 epoch: 70, train_loss: 0.1560, test_loss: 1.4068, test_f1: 0.6795
 epoch: 71, train_loss: 0.1600, test_loss: 1.5167, test_f1: 0.6676
 epoch: 72, train_loss: 0.1519, test_loss: 1.5033, test_f1: 0.6746
 epoch: 73, train_loss: 0.1678, test_loss: 1.5389, test_f1: 0.6550
 epoch: 74, train_loss: 0.1624, test_loss: 1.4271, test_f1: 0.6774
 epoch: 75, train_loss: 0.1425, test_loss: 1.6462, test_f1: 0.6635
 epoch: 76, train_loss: 0.1414, test_loss: 1.5159, test_f1: 0.6843
 epoch: 77, train_loss: 0.1219, test_loss: 1.6337, test_f1: 0.6593
 epoch: 78, train_loss: 0.1353, test_loss: 1.5540, test_f1: 0.6802
 epoch: 79, train_loss: 0.1509, test_loss: 1.7492, test_f1: 0.6501
 epoch: 80, train_loss: 0.1466, test_loss: 1.6393, test_f1: 0.6564
 epoch: 81, train_loss: 0.1294, test_loss: 1.6211, test_f1: 0.6706
 epoch: 82, train_loss: 0.1307, test_loss: 1.7163, test_f1: 0.6659
 epoch: 83, train_loss: 0.1361, test_loss: 1.7423, test_f1: 0.6690
 epoch: 84, train_loss: 0.1359, test_loss: 1.5542, test_f1: 0.6650
 epoch: 85, train_loss: 0.1246, test_loss: 1.8351, test_f1: 0.6334
 epoch: 86, train_loss: 0.1387, test_loss: 1.6635, test_f1: 0.6556
 epoch: 87, train_loss: 0.1117, test_loss: 1.6083, test_f1: 0.6826
 epoch: 88, train_loss: 0.1210, test_loss: 1.7176, test_f1: 0.6593
 epoch: 89, train_loss: 0.1237, test_loss: 1.7497, test_f1: 0.6534
 epoch: 90, train_loss: 0.1241, test_loss: 1.7019, test_f1: 0.6834
 epoch: 91, train_loss: 0.1317, test_loss: 1.6926, test_f1: 0.6601
 epoch: 92, train_loss: 0.1231, test_loss: 1.7515, test_f1: 0.6500
 epoch: 93, train_loss: 0.1259, test_loss: 1.7486, test_f1: 0.6543
 epoch: 94, train_loss: 0.1371, test_loss: 1.7373, test_f1: 0.6739
 epoch: 95, train_loss: 0.1322, test_loss: 1.9945, test_f1: 0.6317
 epoch: 96, train_loss: 0.1118, test_loss: 1.6221, test_f1: 0.6739
 epoch: 97, train_loss: 0.1077, test_loss: 1.7201, test_f1: 0.6659
 epoch: 98, train_loss: 0.1159, test_loss: 1.9896, test_f1: 0.6524
 epoch: 99, train_loss: 0.0971, test_loss: 1.8435, test_f1: 0.6671
##################ITERATION #5 ****************************************
 epoch: 0, train_loss: 1.3284, test_loss: 1.4292, test_f1: 0.2721
 epoch: 1, train_loss: 1.0010, test_loss: 1.0737, test_f1: 0.4152
 epoch: 2, train_loss: 0.9015, test_loss: 0.9269, test_f1: 0.5543
 epoch: 3, train_loss: 0.8689, test_loss: 0.9206, test_f1: 0.6065
 epoch: 4, train_loss: 0.8307, test_loss: 0.9035, test_f1: 0.5519
 epoch: 5, train_loss: 0.8096, test_loss: 0.8188, test_f1: 0.6187
 epoch: 6, train_loss: 0.7939, test_loss: 0.9230, test_f1: 0.5740
 epoch: 7, train_loss: 0.7570, test_loss: 0.8489, test_f1: 0.6315
 epoch: 8, train_loss: 0.7311, test_loss: 0.9997, test_f1: 0.5737
 epoch: 9, train_loss: 0.7201, test_loss: 0.9328, test_f1: 0.6191
 epoch: 10, train_loss: 0.7201, test_loss: 0.7908, test_f1: 0.6362
 epoch: 11, train_loss: 0.7028, test_loss: 0.8588, test_f1: 0.6002
 epoch: 12, train_loss: 0.6753, test_loss: 0.9632, test_f1: 0.5725
 epoch: 13, train_loss: 0.6542, test_loss: 0.8550, test_f1: 0.5993
 epoch: 14, train_loss: 0.6507, test_loss: 0.9001, test_f1: 0.5956
 epoch: 15, train_loss: 0.6380, test_loss: 0.8666, test_f1: 0.6130
 epoch: 16, train_loss: 0.6079, test_loss: 0.8807, test_f1: 0.6132
 epoch: 17, train_loss: 0.6000, test_loss: 0.8123, test_f1: 0.6438
 epoch: 18, train_loss: 0.6005, test_loss: 0.9475, test_f1: 0.5929
 epoch: 19, train_loss: 0.5985, test_loss: 0.9161, test_f1: 0.6183
 epoch: 20, train_loss: 0.5776, test_loss: 0.8247, test_f1: 0.6270
 epoch: 21, train_loss: 0.5526, test_loss: 0.8961, test_f1: 0.6224
 epoch: 22, train_loss: 0.5571, test_loss: 0.9736, test_f1: 0.6035
 epoch: 23, train_loss: 0.5295, test_loss: 0.8710, test_f1: 0.6277
 epoch: 24, train_loss: 0.5333, test_loss: 0.8552, test_f1: 0.6272
 epoch: 25, train_loss: 0.4915, test_loss: 0.8720, test_f1: 0.6392
 epoch: 26, train_loss: 0.5120, test_loss: 0.8073, test_f1: 0.6812
 epoch: 27, train_loss: 0.4937, test_loss: 0.8820, test_f1: 0.6348
 epoch: 28, train_loss: 0.4730, test_loss: 0.8828, test_f1: 0.6512
 epoch: 29, train_loss: 0.4693, test_loss: 0.9162, test_f1: 0.6397
 epoch: 30, train_loss: 0.4605, test_loss: 0.9448, test_f1: 0.6367
 epoch: 31, train_loss: 0.4417, test_loss: 0.9344, test_f1: 0.6342
 epoch: 32, train_loss: 0.4502, test_loss: 0.9876, test_f1: 0.6222
 epoch: 33, train_loss: 0.4441, test_loss: 0.8898, test_f1: 0.6237
 epoch: 34, train_loss: 0.4244, test_loss: 1.0416, test_f1: 0.6314
 epoch: 35, train_loss: 0.3955, test_loss: 1.0172, test_f1: 0.6448
 epoch: 36, train_loss: 0.4215, test_loss: 1.1620, test_f1: 0.6169
 epoch: 37, train_loss: 0.4344, test_loss: 1.0535, test_f1: 0.6286
 epoch: 38, train_loss: 0.3987, test_loss: 1.0218, test_f1: 0.6642
 epoch: 39, train_loss: 0.3851, test_loss: 1.1242, test_f1: 0.6457
 epoch: 40, train_loss: 0.3936, test_loss: 1.1966, test_f1: 0.6161
 epoch: 41, train_loss: 0.3749, test_loss: 0.9569, test_f1: 0.6745
 epoch: 42, train_loss: 0.3581, test_loss: 1.2045, test_f1: 0.5978
 epoch: 43, train_loss: 0.3607, test_loss: 1.0864, test_f1: 0.6155
 epoch: 44, train_loss: 0.3554, test_loss: 1.1875, test_f1: 0.6279
 epoch: 45, train_loss: 0.3505, test_loss: 1.2204, test_f1: 0.6271
 epoch: 46, train_loss: 0.3416, test_loss: 0.9949, test_f1: 0.6843
 epoch: 47, train_loss: 0.3542, test_loss: 1.0401, test_f1: 0.6576
 epoch: 48, train_loss: 0.3288, test_loss: 1.0076, test_f1: 0.6711
 epoch: 49, train_loss: 0.3073, test_loss: 1.0883, test_f1: 0.6748
 epoch: 50, train_loss: 0.2864, test_loss: 1.0995, test_f1: 0.6415
 epoch: 51, train_loss: 0.2958, test_loss: 1.0237, test_f1: 0.6900
 epoch: 52, train_loss: 0.2640, test_loss: 1.1663, test_f1: 0.6749
 epoch: 53, train_loss: 0.2292, test_loss: 1.1734, test_f1: 0.6642
 epoch: 54, train_loss: 0.2410, test_loss: 1.1757, test_f1: 0.6717
 epoch: 55, train_loss: 0.2021, test_loss: 1.1335, test_f1: 0.6794
 epoch: 56, train_loss: 0.2194, test_loss: 1.2697, test_f1: 0.6617
 epoch: 57, train_loss: 0.2246, test_loss: 1.2849, test_f1: 0.6643
 epoch: 58, train_loss: 0.2256, test_loss: 1.1567, test_f1: 0.6510
 epoch: 59, train_loss: 0.1984, test_loss: 1.1996, test_f1: 0.6574
 epoch: 60, train_loss: 0.2106, test_loss: 1.2820, test_f1: 0.6532
 epoch: 61, train_loss: 0.2175, test_loss: 1.2048, test_f1: 0.6842
 epoch: 62, train_loss: 0.2046, test_loss: 1.3860, test_f1: 0.6635
 epoch: 63, train_loss: 0.1815, test_loss: 1.4744, test_f1: 0.6451
 epoch: 64, train_loss: 0.1830, test_loss: 1.3885, test_f1: 0.6503
 epoch: 65, train_loss: 0.1974, test_loss: 1.4106, test_f1: 0.6478
 epoch: 66, train_loss: 0.1741, test_loss: 1.4210, test_f1: 0.6535
 epoch: 67, train_loss: 0.1872, test_loss: 1.3545, test_f1: 0.6736
 epoch: 68, train_loss: 0.1772, test_loss: 1.5220, test_f1: 0.6457
 epoch: 69, train_loss: 0.1688, test_loss: 1.3362, test_f1: 0.6751
 epoch: 70, train_loss: 0.1643, test_loss: 1.4853, test_f1: 0.6449
 epoch: 71, train_loss: 0.1609, test_loss: 1.5583, test_f1: 0.6552
 epoch: 72, train_loss: 0.1764, test_loss: 1.4775, test_f1: 0.6520
 epoch: 73, train_loss: 0.1652, test_loss: 1.3949, test_f1: 0.6771
 epoch: 74, train_loss: 0.1791, test_loss: 1.7115, test_f1: 0.6194
 epoch: 75, train_loss: 0.1755, test_loss: 1.3760, test_f1: 0.6881
 epoch: 76, train_loss: 0.1658, test_loss: 1.5626, test_f1: 0.6604
 epoch: 77, train_loss: 0.1479, test_loss: 1.4202, test_f1: 0.6704
 epoch: 78, train_loss: 0.1748, test_loss: 1.3773, test_f1: 0.6695
 epoch: 79, train_loss: 0.1749, test_loss: 1.4645, test_f1: 0.6488
 epoch: 80, train_loss: 0.1583, test_loss: 1.4071, test_f1: 0.6704
 epoch: 81, train_loss: 0.1778, test_loss: 1.5935, test_f1: 0.6742
 epoch: 82, train_loss: 0.1535, test_loss: 1.4257, test_f1: 0.6735
 epoch: 83, train_loss: 0.1683, test_loss: 1.7142, test_f1: 0.6149
 epoch: 84, train_loss: 0.1784, test_loss: 1.4384, test_f1: 0.6704
 epoch: 85, train_loss: 0.1857, test_loss: 1.4998, test_f1: 0.6638
 epoch: 86, train_loss: 0.1677, test_loss: 1.5379, test_f1: 0.6814
 epoch: 87, train_loss: 0.1413, test_loss: 1.4478, test_f1: 0.6836
 epoch: 88, train_loss: 0.1399, test_loss: 1.6392, test_f1: 0.6664
 epoch: 89, train_loss: 0.1564, test_loss: 1.5957, test_f1: 0.6699
 epoch: 90, train_loss: 0.1370, test_loss: 1.5390, test_f1: 0.6517
 epoch: 91, train_loss: 0.1371, test_loss: 1.5153, test_f1: 0.6758
 epoch: 92, train_loss: 0.1490, test_loss: 1.5532, test_f1: 0.6728
 epoch: 93, train_loss: 0.1374, test_loss: 1.5841, test_f1: 0.6569
 epoch: 94, train_loss: 0.1178, test_loss: 1.5906, test_f1: 0.6677
 epoch: 95, train_loss: 0.1462, test_loss: 1.5906, test_f1: 0.6552
 epoch: 96, train_loss: 0.1431, test_loss: 1.7388, test_f1: 0.6533
 epoch: 97, train_loss: 0.1164, test_loss: 1.8599, test_f1: 0.6660
 epoch: 98, train_loss: 0.1295, test_loss: 1.6385, test_f1: 0.6646
 epoch: 99, train_loss: 0.1189, test_loss: 1.7188, test_f1: 0.6656
##################ITERATION #6 ****************************************
 epoch: 0, train_loss: 1.3640, test_loss: 1.4716, test_f1: 0.2658
 epoch: 1, train_loss: 0.9955, test_loss: 1.1207, test_f1: 0.3778
 epoch: 2, train_loss: 0.9295, test_loss: 0.9300, test_f1: 0.5408
 epoch: 3, train_loss: 0.8910, test_loss: 0.9170, test_f1: 0.5066
 epoch: 4, train_loss: 0.8456, test_loss: 0.8655, test_f1: 0.5865
 epoch: 5, train_loss: 0.8213, test_loss: 0.8539, test_f1: 0.5808
 epoch: 6, train_loss: 0.7854, test_loss: 0.8423, test_f1: 0.5572
 epoch: 7, train_loss: 0.7917, test_loss: 0.8642, test_f1: 0.5818
 epoch: 8, train_loss: 0.7646, test_loss: 0.8604, test_f1: 0.5676
 epoch: 9, train_loss: 0.7434, test_loss: 0.8417, test_f1: 0.6063
 epoch: 10, train_loss: 0.7359, test_loss: 0.7808, test_f1: 0.6074
 epoch: 11, train_loss: 0.6931, test_loss: 0.8040, test_f1: 0.6175
 epoch: 12, train_loss: 0.6683, test_loss: 0.8719, test_f1: 0.5944
 epoch: 13, train_loss: 0.6597, test_loss: 0.8162, test_f1: 0.6278
 epoch: 14, train_loss: 0.6571, test_loss: 0.9143, test_f1: 0.5853
 epoch: 15, train_loss: 0.6309, test_loss: 0.8280, test_f1: 0.5986
 epoch: 16, train_loss: 0.6172, test_loss: 0.8009, test_f1: 0.6515
 epoch: 17, train_loss: 0.6185, test_loss: 0.8961, test_f1: 0.6078
 epoch: 18, train_loss: 0.5894, test_loss: 0.8644, test_f1: 0.6335
 epoch: 19, train_loss: 0.5905, test_loss: 0.7806, test_f1: 0.6416
 epoch: 20, train_loss: 0.5854, test_loss: 0.7910, test_f1: 0.6648
 epoch: 21, train_loss: 0.5703, test_loss: 0.8897, test_f1: 0.6415
 epoch: 22, train_loss: 0.5464, test_loss: 0.8361, test_f1: 0.6532
 epoch: 23, train_loss: 0.5380, test_loss: 0.7712, test_f1: 0.6730
 epoch: 24, train_loss: 0.5269, test_loss: 0.8709, test_f1: 0.6647
 epoch: 25, train_loss: 0.5377, test_loss: 0.9555, test_f1: 0.6100
 epoch: 26, train_loss: 0.5090, test_loss: 0.8802, test_f1: 0.6504
 epoch: 27, train_loss: 0.4902, test_loss: 0.9168, test_f1: 0.6480
 epoch: 28, train_loss: 0.4938, test_loss: 0.8447, test_f1: 0.6745
 epoch: 29, train_loss: 0.4581, test_loss: 0.9096, test_f1: 0.6519
 epoch: 30, train_loss: 0.4826, test_loss: 1.1307, test_f1: 0.6257
 epoch: 31, train_loss: 0.4473, test_loss: 0.9288, test_f1: 0.6519
 epoch: 32, train_loss: 0.4386, test_loss: 0.9322, test_f1: 0.6525
 epoch: 33, train_loss: 0.4124, test_loss: 0.8869, test_f1: 0.6854
 epoch: 34, train_loss: 0.3979, test_loss: 1.0085, test_f1: 0.6448
 epoch: 35, train_loss: 0.4311, test_loss: 0.9985, test_f1: 0.6223
 epoch: 36, train_loss: 0.4137, test_loss: 1.0929, test_f1: 0.6419
 epoch: 37, train_loss: 0.3987, test_loss: 0.9115, test_f1: 0.6605
 epoch: 38, train_loss: 0.3892, test_loss: 1.0553, test_f1: 0.6103
 epoch: 39, train_loss: 0.4007, test_loss: 1.0154, test_f1: 0.6183
 epoch: 40, train_loss: 0.3896, test_loss: 0.8632, test_f1: 0.6955
 epoch: 41, train_loss: 0.3661, test_loss: 1.0125, test_f1: 0.6411
 epoch: 42, train_loss: 0.3421, test_loss: 0.9967, test_f1: 0.6833
 epoch: 43, train_loss: 0.3227, test_loss: 1.0140, test_f1: 0.6696
 epoch: 44, train_loss: 0.3285, test_loss: 1.0139, test_f1: 0.6461
 epoch: 45, train_loss: 0.3133, test_loss: 1.0302, test_f1: 0.6773
 epoch: 46, train_loss: 0.3272, test_loss: 0.9707, test_f1: 0.6711
 epoch: 47, train_loss: 0.3130, test_loss: 1.1211, test_f1: 0.6457
 epoch: 48, train_loss: 0.3194, test_loss: 1.1951, test_f1: 0.6227
 epoch: 49, train_loss: 0.3207, test_loss: 1.1526, test_f1: 0.6651
 epoch: 50, train_loss: 0.2996, test_loss: 1.1654, test_f1: 0.6684
 epoch: 51, train_loss: 0.2658, test_loss: 1.0480, test_f1: 0.6728
 epoch: 52, train_loss: 0.2383, test_loss: 1.1094, test_f1: 0.6571
 epoch: 53, train_loss: 0.2248, test_loss: 1.1842, test_f1: 0.6783
 epoch: 54, train_loss: 0.2246, test_loss: 1.1750, test_f1: 0.6599
 epoch: 55, train_loss: 0.2100, test_loss: 1.1873, test_f1: 0.6586
 epoch: 56, train_loss: 0.2071, test_loss: 1.2612, test_f1: 0.6700
 epoch: 57, train_loss: 0.1980, test_loss: 1.3157, test_f1: 0.6664
 epoch: 58, train_loss: 0.1976, test_loss: 1.2421, test_f1: 0.6783
 epoch: 59, train_loss: 0.2117, test_loss: 1.2594, test_f1: 0.6570
 epoch: 60, train_loss: 0.2023, test_loss: 1.2037, test_f1: 0.6563
 epoch: 61, train_loss: 0.2041, test_loss: 1.2888, test_f1: 0.6677
 epoch: 62, train_loss: 0.2034, test_loss: 1.3805, test_f1: 0.6593
 epoch: 63, train_loss: 0.1782, test_loss: 1.4585, test_f1: 0.6192
 epoch: 64, train_loss: 0.1730, test_loss: 1.4323, test_f1: 0.6487
 epoch: 65, train_loss: 0.1786, test_loss: 1.4109, test_f1: 0.6506
 epoch: 66, train_loss: 0.1697, test_loss: 1.4300, test_f1: 0.6331
 epoch: 67, train_loss: 0.1807, test_loss: 1.3758, test_f1: 0.6636
 epoch: 68, train_loss: 0.1568, test_loss: 1.5455, test_f1: 0.6687
 epoch: 69, train_loss: 0.1769, test_loss: 1.4144, test_f1: 0.6404
 epoch: 70, train_loss: 0.1773, test_loss: 1.5156, test_f1: 0.6224
 epoch: 71, train_loss: 0.1724, test_loss: 1.5200, test_f1: 0.6619
 epoch: 72, train_loss: 0.1708, test_loss: 1.5599, test_f1: 0.6495
 epoch: 73, train_loss: 0.1670, test_loss: 1.5745, test_f1: 0.6523
 epoch: 74, train_loss: 0.1551, test_loss: 1.5904, test_f1: 0.6517
 epoch: 75, train_loss: 0.1570, test_loss: 1.6170, test_f1: 0.6492
 epoch: 76, train_loss: 0.1500, test_loss: 1.5990, test_f1: 0.6336
 epoch: 77, train_loss: 0.1488, test_loss: 1.5837, test_f1: 0.6344
 epoch: 78, train_loss: 0.1458, test_loss: 1.6489, test_f1: 0.6398
 epoch: 79, train_loss: 0.1477, test_loss: 1.8130, test_f1: 0.6375
 epoch: 80, train_loss: 0.1471, test_loss: 1.7547, test_f1: 0.6271
 epoch: 81, train_loss: 0.1542, test_loss: 1.6587, test_f1: 0.6346
 epoch: 82, train_loss: 0.1577, test_loss: 1.6487, test_f1: 0.6639
 epoch: 83, train_loss: 0.1566, test_loss: 1.6061, test_f1: 0.6572
 epoch: 84, train_loss: 0.1438, test_loss: 1.8750, test_f1: 0.6037
 epoch: 85, train_loss: 0.1279, test_loss: 1.5780, test_f1: 0.6587
 epoch: 86, train_loss: 0.1365, test_loss: 1.8660, test_f1: 0.6312
 epoch: 87, train_loss: 0.1361, test_loss: 1.6536, test_f1: 0.6823
 epoch: 88, train_loss: 0.1289, test_loss: 1.8341, test_f1: 0.6503
 epoch: 89, train_loss: 0.1336, test_loss: 2.0891, test_f1: 0.6086
 epoch: 90, train_loss: 0.1282, test_loss: 2.1465, test_f1: 0.5919
 epoch: 91, train_loss: 0.1418, test_loss: 1.6952, test_f1: 0.6548
 epoch: 92, train_loss: 0.1216, test_loss: 1.7898, test_f1: 0.6313
 epoch: 93, train_loss: 0.1287, test_loss: 1.8569, test_f1: 0.6459
 epoch: 94, train_loss: 0.1149, test_loss: 1.9234, test_f1: 0.6382
 epoch: 95, train_loss: 0.1445, test_loss: 1.8266, test_f1: 0.6468
 epoch: 96, train_loss: 0.1412, test_loss: 1.8204, test_f1: 0.6088
 epoch: 97, train_loss: 0.1289, test_loss: 1.7994, test_f1: 0.6633
 epoch: 98, train_loss: 0.1097, test_loss: 1.8480, test_f1: 0.6468
 epoch: 99, train_loss: 0.1180, test_loss: 2.0329, test_f1: 0.6302
##################ITERATION #7 ****************************************
 epoch: 0, train_loss: 1.4582, test_loss: 1.4543, test_f1: 0.2608
 epoch: 1, train_loss: 0.9961, test_loss: 1.0267, test_f1: 0.4458
 epoch: 2, train_loss: 0.9279, test_loss: 0.9189, test_f1: 0.5557
 epoch: 3, train_loss: 0.8977, test_loss: 0.9135, test_f1: 0.5792
 epoch: 4, train_loss: 0.8689, test_loss: 1.0137, test_f1: 0.5326
 epoch: 5, train_loss: 0.8313, test_loss: 0.9517, test_f1: 0.5717
 epoch: 6, train_loss: 0.8059, test_loss: 0.8915, test_f1: 0.5583
 epoch: 7, train_loss: 0.8074, test_loss: 1.0121, test_f1: 0.5522
 epoch: 8, train_loss: 0.7744, test_loss: 0.9448, test_f1: 0.5942
 epoch: 9, train_loss: 0.7492, test_loss: 0.9035, test_f1: 0.5860
 epoch: 10, train_loss: 0.7207, test_loss: 0.9514, test_f1: 0.5940
 epoch: 11, train_loss: 0.7185, test_loss: 1.1587, test_f1: 0.5559
 epoch: 12, train_loss: 0.6945, test_loss: 0.9335, test_f1: 0.5789
 epoch: 13, train_loss: 0.6683, test_loss: 1.0167, test_f1: 0.6148
 epoch: 14, train_loss: 0.6591, test_loss: 0.9012, test_f1: 0.6317
 epoch: 15, train_loss: 0.6407, test_loss: 0.8788, test_f1: 0.6127
 epoch: 16, train_loss: 0.6320, test_loss: 0.9449, test_f1: 0.6132
 epoch: 17, train_loss: 0.6208, test_loss: 0.8863, test_f1: 0.6231
 epoch: 18, train_loss: 0.6149, test_loss: 0.9284, test_f1: 0.6254
 epoch: 19, train_loss: 0.5822, test_loss: 0.9356, test_f1: 0.5943
 epoch: 20, train_loss: 0.5837, test_loss: 1.0964, test_f1: 0.5806
 epoch: 21, train_loss: 0.5764, test_loss: 0.9515, test_f1: 0.6045
 epoch: 22, train_loss: 0.5488, test_loss: 0.9283, test_f1: 0.6262
 epoch: 23, train_loss: 0.5349, test_loss: 0.9696, test_f1: 0.5901
 epoch: 24, train_loss: 0.5322, test_loss: 1.0219, test_f1: 0.5996
 epoch: 25, train_loss: 0.5114, test_loss: 0.9813, test_f1: 0.6353
 epoch: 26, train_loss: 0.5393, test_loss: 0.9777, test_f1: 0.5933
 epoch: 27, train_loss: 0.5015, test_loss: 0.9079, test_f1: 0.6463
 epoch: 28, train_loss: 0.4802, test_loss: 0.8778, test_f1: 0.6449
 epoch: 29, train_loss: 0.4792, test_loss: 1.0322, test_f1: 0.6349
 epoch: 30, train_loss: 0.4658, test_loss: 0.9277, test_f1: 0.6373
 epoch: 31, train_loss: 0.4666, test_loss: 1.0733, test_f1: 0.5870
 epoch: 32, train_loss: 0.4702, test_loss: 0.9987, test_f1: 0.6124
 epoch: 33, train_loss: 0.4507, test_loss: 0.9951, test_f1: 0.6166
 epoch: 34, train_loss: 0.4420, test_loss: 1.4859, test_f1: 0.5807
 epoch: 35, train_loss: 0.4249, test_loss: 1.0394, test_f1: 0.6010
 epoch: 36, train_loss: 0.4251, test_loss: 0.9745, test_f1: 0.6397
 epoch: 37, train_loss: 0.4179, test_loss: 0.9977, test_f1: 0.6526
 epoch: 38, train_loss: 0.4122, test_loss: 0.9625, test_f1: 0.6628
 epoch: 39, train_loss: 0.4112, test_loss: 0.9779, test_f1: 0.6458
 epoch: 40, train_loss: 0.3953, test_loss: 1.2418, test_f1: 0.6376
 epoch: 41, train_loss: 0.3894, test_loss: 1.0980, test_f1: 0.6045
 epoch: 42, train_loss: 0.3787, test_loss: 1.2425, test_f1: 0.6140
 epoch: 43, train_loss: 0.3483, test_loss: 1.0066, test_f1: 0.6037
 epoch: 44, train_loss: 0.3511, test_loss: 1.1375, test_f1: 0.6393
 epoch: 45, train_loss: 0.3457, test_loss: 1.0366, test_f1: 0.6384
 epoch: 46, train_loss: 0.3428, test_loss: 1.0316, test_f1: 0.6154
 epoch: 47, train_loss: 0.3599, test_loss: 1.1064, test_f1: 0.6620
 epoch: 48, train_loss: 0.3372, test_loss: 1.1061, test_f1: 0.6558
 epoch: 49, train_loss: 0.3248, test_loss: 1.1689, test_f1: 0.6261
 epoch: 50, train_loss: 0.3166, test_loss: 1.1761, test_f1: 0.6525
 epoch: 51, train_loss: 0.2819, test_loss: 1.1506, test_f1: 0.6416
 epoch: 52, train_loss: 0.2506, test_loss: 1.1552, test_f1: 0.6481
 epoch: 53, train_loss: 0.2326, test_loss: 1.1631, test_f1: 0.6545
 epoch: 54, train_loss: 0.2266, test_loss: 1.1425, test_f1: 0.6713
 epoch: 55, train_loss: 0.2449, test_loss: 1.2651, test_f1: 0.6621
 epoch: 56, train_loss: 0.2306, test_loss: 1.2757, test_f1: 0.6925
 epoch: 57, train_loss: 0.2310, test_loss: 1.3163, test_f1: 0.6323
 epoch: 58, train_loss: 0.2185, test_loss: 1.3399, test_f1: 0.6493
 epoch: 59, train_loss: 0.2131, test_loss: 1.3292, test_f1: 0.6387
 epoch: 60, train_loss: 0.2324, test_loss: 1.3877, test_f1: 0.6553
 epoch: 61, train_loss: 0.2024, test_loss: 1.3141, test_f1: 0.6558
 epoch: 62, train_loss: 0.2073, test_loss: 1.3499, test_f1: 0.6554
 epoch: 63, train_loss: 0.2273, test_loss: 1.2789, test_f1: 0.6429
 epoch: 64, train_loss: 0.2011, test_loss: 1.3535, test_f1: 0.6600
 epoch: 65, train_loss: 0.1925, test_loss: 1.2339, test_f1: 0.6449
 epoch: 66, train_loss: 0.1851, test_loss: 1.5668, test_f1: 0.6596
 epoch: 67, train_loss: 0.1862, test_loss: 1.4546, test_f1: 0.6501
 epoch: 68, train_loss: 0.1997, test_loss: 1.3143, test_f1: 0.6964
 epoch: 69, train_loss: 0.1781, test_loss: 1.3269, test_f1: 0.6690
 epoch: 70, train_loss: 0.1883, test_loss: 1.3267, test_f1: 0.6766
 epoch: 71, train_loss: 0.1885, test_loss: 1.4821, test_f1: 0.6538
 epoch: 72, train_loss: 0.1898, test_loss: 1.5715, test_f1: 0.6345
 epoch: 73, train_loss: 0.1793, test_loss: 1.3991, test_f1: 0.6310
 epoch: 74, train_loss: 0.1817, test_loss: 1.5856, test_f1: 0.6279
 epoch: 75, train_loss: 0.1910, test_loss: 1.3869, test_f1: 0.6482
 epoch: 76, train_loss: 0.1820, test_loss: 1.5825, test_f1: 0.6486
 epoch: 77, train_loss: 0.1659, test_loss: 1.5310, test_f1: 0.6333
 epoch: 78, train_loss: 0.1623, test_loss: 1.7430, test_f1: 0.6195
 epoch: 79, train_loss: 0.1677, test_loss: 1.4888, test_f1: 0.6816
 epoch: 80, train_loss: 0.1703, test_loss: 1.6227, test_f1: 0.6491
 epoch: 81, train_loss: 0.1618, test_loss: 1.6428, test_f1: 0.6399
 epoch: 82, train_loss: 0.1570, test_loss: 1.6561, test_f1: 0.6482
 epoch: 83, train_loss: 0.1710, test_loss: 1.7858, test_f1: 0.6363
 epoch: 84, train_loss: 0.1488, test_loss: 1.5525, test_f1: 0.6497
 epoch: 85, train_loss: 0.1683, test_loss: 1.9494, test_f1: 0.6333
 epoch: 86, train_loss: 0.1638, test_loss: 1.5973, test_f1: 0.6594
 epoch: 87, train_loss: 0.1460, test_loss: 1.8664, test_f1: 0.6242
 epoch: 88, train_loss: 0.1517, test_loss: 1.7624, test_f1: 0.6411
 epoch: 89, train_loss: 0.1688, test_loss: 1.9854, test_f1: 0.6053
 epoch: 90, train_loss: 0.1438, test_loss: 1.6527, test_f1: 0.6556
 epoch: 91, train_loss: 0.1555, test_loss: 1.7317, test_f1: 0.6572
 epoch: 92, train_loss: 0.1370, test_loss: 1.7493, test_f1: 0.6498
 epoch: 93, train_loss: 0.1449, test_loss: 1.8779, test_f1: 0.6110
 epoch: 94, train_loss: 0.1570, test_loss: 1.4718, test_f1: 0.6657
 epoch: 95, train_loss: 0.1455, test_loss: 1.6073, test_f1: 0.6607
 epoch: 96, train_loss: 0.1277, test_loss: 1.7953, test_f1: 0.6441
 epoch: 97, train_loss: 0.1313, test_loss: 1.8235, test_f1: 0.6465
 epoch: 98, train_loss: 0.1456, test_loss: 1.9420, test_f1: 0.6284
 epoch: 99, train_loss: 0.1359, test_loss: 1.7849, test_f1: 0.6475
##################ITERATION #8 ****************************************
 epoch: 0, train_loss: 1.4619, test_loss: 1.3061, test_f1: 0.2502
 epoch: 1, train_loss: 1.0026, test_loss: 1.0263, test_f1: 0.4379
 epoch: 2, train_loss: 0.9411, test_loss: 0.9183, test_f1: 0.5098
 epoch: 3, train_loss: 0.9116, test_loss: 0.8974, test_f1: 0.5161
 epoch: 4, train_loss: 0.8795, test_loss: 0.8947, test_f1: 0.5775
 epoch: 5, train_loss: 0.8386, test_loss: 0.9494, test_f1: 0.5905
 epoch: 6, train_loss: 0.8069, test_loss: 0.9713, test_f1: 0.5551
 epoch: 7, train_loss: 0.7956, test_loss: 0.8375, test_f1: 0.6103
 epoch: 8, train_loss: 0.7835, test_loss: 0.8616, test_f1: 0.5865
 epoch: 9, train_loss: 0.7578, test_loss: 0.8340, test_f1: 0.6106
 epoch: 10, train_loss: 0.7427, test_loss: 0.8720, test_f1: 0.5876
 epoch: 11, train_loss: 0.7082, test_loss: 0.7302, test_f1: 0.6194
 epoch: 12, train_loss: 0.7040, test_loss: 0.8867, test_f1: 0.5836
 epoch: 13, train_loss: 0.6793, test_loss: 0.9090, test_f1: 0.6141
 epoch: 14, train_loss: 0.6891, test_loss: 0.7442, test_f1: 0.6285
 epoch: 15, train_loss: 0.6525, test_loss: 0.8108, test_f1: 0.6251
 epoch: 16, train_loss: 0.6559, test_loss: 0.8365, test_f1: 0.6249
 epoch: 17, train_loss: 0.6376, test_loss: 0.8137, test_f1: 0.6141
 epoch: 18, train_loss: 0.6180, test_loss: 0.7331, test_f1: 0.6686
 epoch: 19, train_loss: 0.6087, test_loss: 0.7607, test_f1: 0.6305
 epoch: 20, train_loss: 0.5866, test_loss: 0.8579, test_f1: 0.6350
 epoch: 21, train_loss: 0.5832, test_loss: 0.7857, test_f1: 0.6463
 epoch: 22, train_loss: 0.5782, test_loss: 0.7615, test_f1: 0.6416
 epoch: 23, train_loss: 0.5767, test_loss: 0.7247, test_f1: 0.6511
 epoch: 24, train_loss: 0.5574, test_loss: 0.8598, test_f1: 0.6588
 epoch: 25, train_loss: 0.5276, test_loss: 0.8116, test_f1: 0.6647
 epoch: 26, train_loss: 0.5227, test_loss: 0.9649, test_f1: 0.6187
 epoch: 27, train_loss: 0.5242, test_loss: 0.8658, test_f1: 0.6494
 epoch: 28, train_loss: 0.5127, test_loss: 0.8803, test_f1: 0.6443
 epoch: 29, train_loss: 0.5136, test_loss: 0.8673, test_f1: 0.6346
 epoch: 30, train_loss: 0.4952, test_loss: 0.8445, test_f1: 0.6609
 epoch: 31, train_loss: 0.4972, test_loss: 0.9019, test_f1: 0.6452
 epoch: 32, train_loss: 0.4972, test_loss: 0.8862, test_f1: 0.6563
 epoch: 33, train_loss: 0.4605, test_loss: 0.8724, test_f1: 0.6331
 epoch: 34, train_loss: 0.4553, test_loss: 0.8360, test_f1: 0.6472
 epoch: 35, train_loss: 0.4358, test_loss: 0.7812, test_f1: 0.6861
 epoch: 36, train_loss: 0.4401, test_loss: 0.8171, test_f1: 0.6637
 epoch: 37, train_loss: 0.4547, test_loss: 0.9515, test_f1: 0.6394
 epoch: 38, train_loss: 0.4146, test_loss: 0.9493, test_f1: 0.6393
 epoch: 39, train_loss: 0.4059, test_loss: 0.8799, test_f1: 0.6586
 epoch: 40, train_loss: 0.4037, test_loss: 0.8902, test_f1: 0.6493
 epoch: 41, train_loss: 0.4181, test_loss: 0.9723, test_f1: 0.6519
 epoch: 42, train_loss: 0.3974, test_loss: 1.0248, test_f1: 0.6397
 epoch: 43, train_loss: 0.4307, test_loss: 0.9924, test_f1: 0.6746
 epoch: 44, train_loss: 0.4021, test_loss: 1.0495, test_f1: 0.6466
 epoch: 45, train_loss: 0.4207, test_loss: 0.9171, test_f1: 0.6680
 epoch: 46, train_loss: 0.3850, test_loss: 0.8745, test_f1: 0.6567
 epoch: 47, train_loss: 0.3666, test_loss: 0.8759, test_f1: 0.6499
 epoch: 48, train_loss: 0.3539, test_loss: 0.9025, test_f1: 0.6631
 epoch: 49, train_loss: 0.3401, test_loss: 1.0125, test_f1: 0.6608
 epoch: 50, train_loss: 0.3424, test_loss: 0.9913, test_f1: 0.6633
 epoch: 51, train_loss: 0.3041, test_loss: 0.9515, test_f1: 0.6580
 epoch: 52, train_loss: 0.3014, test_loss: 0.9658, test_f1: 0.6999
 epoch: 53, train_loss: 0.2706, test_loss: 1.0140, test_f1: 0.6715
 epoch: 54, train_loss: 0.2600, test_loss: 1.0496, test_f1: 0.6300
 epoch: 55, train_loss: 0.2724, test_loss: 1.0160, test_f1: 0.6717
 epoch: 56, train_loss: 0.2443, test_loss: 1.0942, test_f1: 0.6475
 epoch: 57, train_loss: 0.2569, test_loss: 1.1011, test_f1: 0.6660
 epoch: 58, train_loss: 0.2375, test_loss: 1.0400, test_f1: 0.6838
 epoch: 59, train_loss: 0.2474, test_loss: 1.1288, test_f1: 0.6593
 epoch: 60, train_loss: 0.2391, test_loss: 1.0975, test_f1: 0.6595
 epoch: 61, train_loss: 0.2545, test_loss: 1.1330, test_f1: 0.6724
 epoch: 62, train_loss: 0.2332, test_loss: 1.1234, test_f1: 0.6747
 epoch: 63, train_loss: 0.2403, test_loss: 1.2367, test_f1: 0.6386
 epoch: 64, train_loss: 0.2425, test_loss: 1.2205, test_f1: 0.6453
 epoch: 65, train_loss: 0.2164, test_loss: 1.0824, test_f1: 0.6714
 epoch: 66, train_loss: 0.2172, test_loss: 1.2915, test_f1: 0.6405
 epoch: 67, train_loss: 0.2261, test_loss: 1.1586, test_f1: 0.6808
 epoch: 68, train_loss: 0.2258, test_loss: 1.2349, test_f1: 0.6360
 epoch: 69, train_loss: 0.2332, test_loss: 1.1218, test_f1: 0.6685
 epoch: 70, train_loss: 0.2143, test_loss: 1.2691, test_f1: 0.6360
 epoch: 71, train_loss: 0.2074, test_loss: 1.2546, test_f1: 0.6568
 epoch: 72, train_loss: 0.2113, test_loss: 1.2374, test_f1: 0.6448
 epoch: 73, train_loss: 0.1990, test_loss: 1.1454, test_f1: 0.6765
 epoch: 74, train_loss: 0.1967, test_loss: 1.2398, test_f1: 0.6721
 epoch: 75, train_loss: 0.1928, test_loss: 1.3928, test_f1: 0.6205
 epoch: 76, train_loss: 0.2113, test_loss: 1.1911, test_f1: 0.6495
 epoch: 77, train_loss: 0.1957, test_loss: 1.3414, test_f1: 0.6425
 epoch: 78, train_loss: 0.1668, test_loss: 1.3054, test_f1: 0.6361
 epoch: 79, train_loss: 0.1872, test_loss: 1.3551, test_f1: 0.6425
 epoch: 80, train_loss: 0.1667, test_loss: 1.2365, test_f1: 0.6613
 epoch: 81, train_loss: 0.1966, test_loss: 1.4431, test_f1: 0.6502
 epoch: 82, train_loss: 0.1958, test_loss: 1.3964, test_f1: 0.6374
 epoch: 83, train_loss: 0.1935, test_loss: 1.1849, test_f1: 0.6719
 epoch: 84, train_loss: 0.1843, test_loss: 1.4209, test_f1: 0.6405
 epoch: 85, train_loss: 0.1862, test_loss: 1.4401, test_f1: 0.6371
 epoch: 86, train_loss: 0.1687, test_loss: 1.3975, test_f1: 0.6273
 epoch: 87, train_loss: 0.1675, test_loss: 1.4809, test_f1: 0.6353
 epoch: 88, train_loss: 0.1780, test_loss: 1.5908, test_f1: 0.6361
 epoch: 89, train_loss: 0.1492, test_loss: 1.5356, test_f1: 0.6334
 epoch: 90, train_loss: 0.1573, test_loss: 1.4007, test_f1: 0.6428
 epoch: 91, train_loss: 0.1539, test_loss: 1.4875, test_f1: 0.6493
 epoch: 92, train_loss: 0.1523, test_loss: 1.6285, test_f1: 0.6352
 epoch: 93, train_loss: 0.1528, test_loss: 1.4789, test_f1: 0.6575
 epoch: 94, train_loss: 0.1768, test_loss: 1.3519, test_f1: 0.6548
 epoch: 95, train_loss: 0.1719, test_loss: 1.5533, test_f1: 0.6467
 epoch: 96, train_loss: 0.1497, test_loss: 1.5936, test_f1: 0.6347
 epoch: 97, train_loss: 0.1524, test_loss: 1.5614, test_f1: 0.6454
 epoch: 98, train_loss: 0.1586, test_loss: 1.5878, test_f1: 0.6441
 epoch: 99, train_loss: 0.1373, test_loss: 1.6233, test_f1: 0.6412
##################ITERATION #9 ****************************************
 epoch: 0, train_loss: 1.5611, test_loss: 1.4319, test_f1: 0.2585
 epoch: 1, train_loss: 1.0050, test_loss: 1.1470, test_f1: 0.3782
 epoch: 2, train_loss: 0.9305, test_loss: 0.9192, test_f1: 0.5555
 epoch: 3, train_loss: 0.8963, test_loss: 0.9647, test_f1: 0.4920
 epoch: 4, train_loss: 0.8718, test_loss: 0.9275, test_f1: 0.5445
 epoch: 5, train_loss: 0.8106, test_loss: 0.9782, test_f1: 0.4834
 epoch: 6, train_loss: 0.8039, test_loss: 0.8849, test_f1: 0.5605
 epoch: 7, train_loss: 0.7836, test_loss: 0.8899, test_f1: 0.5232
 epoch: 8, train_loss: 0.7681, test_loss: 0.8647, test_f1: 0.6174
 epoch: 9, train_loss: 0.7565, test_loss: 0.8753, test_f1: 0.5706
 epoch: 10, train_loss: 0.7216, test_loss: 0.8169, test_f1: 0.6178
 epoch: 11, train_loss: 0.7307, test_loss: 0.8673, test_f1: 0.6085
 epoch: 12, train_loss: 0.7173, test_loss: 0.7915, test_f1: 0.6452
 epoch: 13, train_loss: 0.6710, test_loss: 0.8302, test_f1: 0.6144
 epoch: 14, train_loss: 0.6850, test_loss: 0.8688, test_f1: 0.6053
 epoch: 15, train_loss: 0.6597, test_loss: 0.7796, test_f1: 0.6557
 epoch: 16, train_loss: 0.6357, test_loss: 0.8008, test_f1: 0.6502
 epoch: 17, train_loss: 0.6260, test_loss: 0.9009, test_f1: 0.6236
 epoch: 18, train_loss: 0.6230, test_loss: 0.8109, test_f1: 0.6311
 epoch: 19, train_loss: 0.6195, test_loss: 0.8189, test_f1: 0.6033
 epoch: 20, train_loss: 0.5867, test_loss: 0.8670, test_f1: 0.6224
 epoch: 21, train_loss: 0.5981, test_loss: 0.8270, test_f1: 0.6294
 epoch: 22, train_loss: 0.5737, test_loss: 0.8719, test_f1: 0.6051
 epoch: 23, train_loss: 0.5721, test_loss: 0.7308, test_f1: 0.6480
 epoch: 24, train_loss: 0.5438, test_loss: 0.7643, test_f1: 0.6418
 epoch: 25, train_loss: 0.5399, test_loss: 0.9176, test_f1: 0.6294
 epoch: 26, train_loss: 0.5362, test_loss: 0.8333, test_f1: 0.6546
 epoch: 27, train_loss: 0.5140, test_loss: 0.8170, test_f1: 0.6524
 epoch: 28, train_loss: 0.5127, test_loss: 0.7416, test_f1: 0.6749
 epoch: 29, train_loss: 0.5008, test_loss: 0.8731, test_f1: 0.6478
 epoch: 30, train_loss: 0.5025, test_loss: 0.8765, test_f1: 0.6738
 epoch: 31, train_loss: 0.4747, test_loss: 0.8939, test_f1: 0.6632
 epoch: 32, train_loss: 0.4691, test_loss: 0.7495, test_f1: 0.6570
 epoch: 33, train_loss: 0.4616, test_loss: 1.1329, test_f1: 0.6218
 epoch: 34, train_loss: 0.4555, test_loss: 0.8687, test_f1: 0.6524
 epoch: 35, train_loss: 0.4519, test_loss: 0.7466, test_f1: 0.7087
 epoch: 36, train_loss: 0.4273, test_loss: 0.9779, test_f1: 0.6385
 epoch: 37, train_loss: 0.4329, test_loss: 0.8674, test_f1: 0.6516
 epoch: 38, train_loss: 0.4268, test_loss: 0.9289, test_f1: 0.6336
 epoch: 39, train_loss: 0.3967, test_loss: 0.8803, test_f1: 0.7041
 epoch: 40, train_loss: 0.4026, test_loss: 0.9755, test_f1: 0.6395
 epoch: 41, train_loss: 0.4010, test_loss: 0.8298, test_f1: 0.6792
 epoch: 42, train_loss: 0.3951, test_loss: 0.8749, test_f1: 0.6660
 epoch: 43, train_loss: 0.3934, test_loss: 0.8559, test_f1: 0.6587
 epoch: 44, train_loss: 0.3689, test_loss: 0.9160, test_f1: 0.6817
 epoch: 45, train_loss: 0.3688, test_loss: 0.9691, test_f1: 0.6436
 epoch: 46, train_loss: 0.3743, test_loss: 0.7723, test_f1: 0.6879
 epoch: 47, train_loss: 0.3514, test_loss: 0.9070, test_f1: 0.6687
 epoch: 48, train_loss: 0.3441, test_loss: 0.9452, test_f1: 0.6789
 epoch: 49, train_loss: 0.3655, test_loss: 1.0637, test_f1: 0.6349
 epoch: 50, train_loss: 0.3717, test_loss: 1.0065, test_f1: 0.6291
 epoch: 51, train_loss: 0.3250, test_loss: 1.0240, test_f1: 0.6757
 epoch: 52, train_loss: 0.2847, test_loss: 1.0839, test_f1: 0.6725
 epoch: 53, train_loss: 0.2691, test_loss: 1.0613, test_f1: 0.6610
 epoch: 54, train_loss: 0.2852, test_loss: 1.0018, test_f1: 0.6755
 epoch: 55, train_loss: 0.2759, test_loss: 1.1064, test_f1: 0.6671
 epoch: 56, train_loss: 0.2694, test_loss: 1.0624, test_f1: 0.6871
 epoch: 57, train_loss: 0.2714, test_loss: 1.0753, test_f1: 0.6776
 epoch: 58, train_loss: 0.2646, test_loss: 1.0465, test_f1: 0.6678
 epoch: 59, train_loss: 0.2614, test_loss: 1.1406, test_f1: 0.6736
 epoch: 60, train_loss: 0.2409, test_loss: 1.1046, test_f1: 0.6683
 epoch: 61, train_loss: 0.2333, test_loss: 1.1776, test_f1: 0.6710
 epoch: 62, train_loss: 0.2479, test_loss: 1.1386, test_f1: 0.6675
 epoch: 63, train_loss: 0.2192, test_loss: 1.1895, test_f1: 0.6820
 epoch: 64, train_loss: 0.2326, test_loss: 1.1885, test_f1: 0.6911
 epoch: 65, train_loss: 0.2324, test_loss: 1.3277, test_f1: 0.6512
 epoch: 66, train_loss: 0.2252, test_loss: 1.1235, test_f1: 0.6885
 epoch: 67, train_loss: 0.2333, test_loss: 1.1922, test_f1: 0.6854
 epoch: 68, train_loss: 0.2249, test_loss: 1.3251, test_f1: 0.6818
 epoch: 69, train_loss: 0.2111, test_loss: 1.2366, test_f1: 0.6703
 epoch: 70, train_loss: 0.2231, test_loss: 1.1623, test_f1: 0.7006
 epoch: 71, train_loss: 0.2213, test_loss: 1.2531, test_f1: 0.6802
 epoch: 72, train_loss: 0.2178, test_loss: 1.5645, test_f1: 0.6416
 epoch: 73, train_loss: 0.2047, test_loss: 1.2174, test_f1: 0.6772
 epoch: 74, train_loss: 0.2096, test_loss: 1.2540, test_f1: 0.6715
 epoch: 75, train_loss: 0.2007, test_loss: 1.3987, test_f1: 0.6496
 epoch: 76, train_loss: 0.2073, test_loss: 1.3260, test_f1: 0.6687
 epoch: 77, train_loss: 0.1947, test_loss: 1.3027, test_f1: 0.6886
 epoch: 78, train_loss: 0.1984, test_loss: 1.3658, test_f1: 0.6742
 epoch: 79, train_loss: 0.1948, test_loss: 1.3294, test_f1: 0.6613
 epoch: 80, train_loss: 0.1935, test_loss: 1.3681, test_f1: 0.6631
 epoch: 81, train_loss: 0.1945, test_loss: 1.3312, test_f1: 0.6675
 epoch: 82, train_loss: 0.1838, test_loss: 1.4556, test_f1: 0.6700
 epoch: 83, train_loss: 0.1808, test_loss: 1.5948, test_f1: 0.6407
 epoch: 84, train_loss: 0.1850, test_loss: 1.3389, test_f1: 0.6666
 epoch: 85, train_loss: 0.1916, test_loss: 1.4348, test_f1: 0.6660
 epoch: 86, train_loss: 0.1952, test_loss: 1.4980, test_f1: 0.6807
 epoch: 87, train_loss: 0.1757, test_loss: 1.3391, test_f1: 0.6815
 epoch: 88, train_loss: 0.1653, test_loss: 1.4138, test_f1: 0.6830
 epoch: 89, train_loss: 0.1668, test_loss: 1.3830, test_f1: 0.6858
 epoch: 90, train_loss: 0.1657, test_loss: 1.5869, test_f1: 0.6841
 epoch: 91, train_loss: 0.1556, test_loss: 1.6433, test_f1: 0.6673
 epoch: 92, train_loss: 0.1571, test_loss: 1.6977, test_f1: 0.6645
 epoch: 93, train_loss: 0.1670, test_loss: 1.6032, test_f1: 0.6751
 epoch: 94, train_loss: 0.1776, test_loss: 1.4280, test_f1: 0.6791
 epoch: 95, train_loss: 0.1822, test_loss: 1.4999, test_f1: 0.6813
 epoch: 96, train_loss: 0.1500, test_loss: 1.6603, test_f1: 0.6806
 epoch: 97, train_loss: 0.1414, test_loss: 1.5796, test_f1: 0.6696
 epoch: 98, train_loss: 0.1665, test_loss: 1.6165, test_f1: 0.6652
 epoch: 99, train_loss: 0.1538, test_loss: 1.8225, test_f1: 0.6804

Training completed in 512.71 seconds
Best F1: 0.7191 at epoch 91
Mean F1 across iterations: 0.6979  0.0116
========================FINAL RESULTS================================
FEGIN weighted F1: 0.7191  0.0116
python main.py --data ltspice_examples --representation component_pin --model FEGIN --layers 3 --hiddens 128 --batch_size 128 --lr 0.001 --emb_size 250 --epochs 100 --save_appendix component_pin_L3_H128_BS128_LR0.001_E250 --no_val
-----



STDERR:
  File "main.py", line 370, in <module>
    main()
  File "main.py", line 254, in main
    dataset = dataset_class(
  File "/home/philip/projects/ltspice_examples_code_repo/Circuit-Completion-Using-GNNs/component_classification_with_link_prediction_head/evaluation/FEGIN/kernel/circuit_datasets.py", line 15, in __init__
    self.data, self.slices = torch.load(self.processed_paths[0])
  File "/home/philip/.local/lib/python3.8/site-packages/torch/serialization.py", line 1040, in load
    warnings.warn(
  File "/usr/lib/python3.8/warnings.py", line 109, in _showwarnmsg
    sw(msg.message, msg.category, msg.filename, msg.lineno,
  File "main.py", line 47, in warn_with_traceback
    traceback.print_stack(file=log)
/home/philip/projects/ltspice_examples_code_repo/Circuit-Completion-Using-GNNs/component_classification_with_link_prediction_head/evaluation/FEGIN/kernel/circuit_datasets.py:15: FutureWarning: You are using `torch.load` with `weights_only=False` (the current default value), which uses the default pickle module implicitly. It is possible to construct malicious pickle data which will execute arbitrary code during unpickling (See https://github.com/pytorch/pytorch/blob/main/SECURITY.md#untrusted-models for more details). In a future release, the default value for `weights_only` will be flipped to `True`. This limits the functions that could be executed during unpickling. Arbitrary objects will no longer be allowed to be loaded via this mode unless they are explicitly allowlisted by the user via `torch.serialization.add_safe_globals`. We recommend you start setting `weights_only=True` for any use case where you don't have full control of the loaded file. Please open an issue on GitHub for any issues related to this experimental feature.
  self.data, self.slices = torch.load(self.processed_paths[0])
