STDOUT:
Results will be saved in /home/philip/projects/ltspice_examples_code_repo/Circuit-Completion-Using-GNNs/component_classification_with_link_prediction_head/evaluation/FEGIN/results/model_FEGIN_dataset_ltspice_demos
Command line input: python main.py --data ltspice_demos --representation component_component --model FEGIN --layers 4 --hiddens 32 --batch_size 32 --lr 0.0001 --emb_size 250 --epochs 100 --save_appendix component_component_L4_H32_BS32_LR0.0001_E250 --no_val
 is saved.
-----
ltspice_demos - FEGIN
Using 4 layers, 32 hidden units, h = 2
Loading component_component representation dataset
ENTERED
Training FEGIN on component_component representation
Train: 1565, Test: 383
##################ITERATION #0 ****************************************
 epoch: 0, train_loss: 1.4103, test_loss: 1.3968, test_f1: 0.0678
 epoch: 1, train_loss: 1.3983, test_loss: 1.3881, test_f1: 0.1127
 epoch: 2, train_loss: 1.3922, test_loss: 1.3815, test_f1: 0.2447
 epoch: 3, train_loss: 1.3833, test_loss: 1.3744, test_f1: 0.2593
 epoch: 4, train_loss: 1.3754, test_loss: 1.3664, test_f1: 0.2887
 epoch: 5, train_loss: 1.3618, test_loss: 1.3573, test_f1: 0.3128
 epoch: 6, train_loss: 1.3495, test_loss: 1.3449, test_f1: 0.3032
 epoch: 7, train_loss: 1.3369, test_loss: 1.3324, test_f1: 0.3212
 epoch: 8, train_loss: 1.3175, test_loss: 1.3188, test_f1: 0.3355
 epoch: 9, train_loss: 1.3009, test_loss: 1.3080, test_f1: 0.3252
 epoch: 10, train_loss: 1.2789, test_loss: 1.2979, test_f1: 0.3227
 epoch: 11, train_loss: 1.2611, test_loss: 1.2891, test_f1: 0.3231
 epoch: 12, train_loss: 1.2425, test_loss: 1.2882, test_f1: 0.3118
 epoch: 13, train_loss: 1.2245, test_loss: 1.2851, test_f1: 0.3164
 epoch: 14, train_loss: 1.2178, test_loss: 1.2705, test_f1: 0.3425
 epoch: 15, train_loss: 1.2088, test_loss: 1.2776, test_f1: 0.3166
 epoch: 16, train_loss: 1.2000, test_loss: 1.2712, test_f1: 0.3285
 epoch: 17, train_loss: 1.1885, test_loss: 1.2728, test_f1: 0.3297
 epoch: 18, train_loss: 1.1852, test_loss: 1.2637, test_f1: 0.3310
 epoch: 19, train_loss: 1.1763, test_loss: 1.2676, test_f1: 0.3382
 epoch: 20, train_loss: 1.1797, test_loss: 1.2747, test_f1: 0.3368
 epoch: 21, train_loss: 1.1679, test_loss: 1.2630, test_f1: 0.3459
 epoch: 22, train_loss: 1.1595, test_loss: 1.2692, test_f1: 0.3575
 epoch: 23, train_loss: 1.1635, test_loss: 1.2660, test_f1: 0.3668
 epoch: 24, train_loss: 1.1612, test_loss: 1.2584, test_f1: 0.3482
 epoch: 25, train_loss: 1.1602, test_loss: 1.2603, test_f1: 0.3523
 epoch: 26, train_loss: 1.1580, test_loss: 1.2557, test_f1: 0.3950
 epoch: 27, train_loss: 1.1535, test_loss: 1.2545, test_f1: 0.3909
 epoch: 28, train_loss: 1.1472, test_loss: 1.2551, test_f1: 0.4021
 epoch: 29, train_loss: 1.1376, test_loss: 1.2514, test_f1: 0.4025
 epoch: 30, train_loss: 1.1422, test_loss: 1.2576, test_f1: 0.4033
 epoch: 31, train_loss: 1.1330, test_loss: 1.2601, test_f1: 0.4005
 epoch: 32, train_loss: 1.1356, test_loss: 1.2561, test_f1: 0.4177
 epoch: 33, train_loss: 1.1336, test_loss: 1.2671, test_f1: 0.4077
 epoch: 34, train_loss: 1.1229, test_loss: 1.2542, test_f1: 0.4312
 epoch: 35, train_loss: 1.1196, test_loss: 1.2547, test_f1: 0.4260
 epoch: 36, train_loss: 1.1081, test_loss: 1.2550, test_f1: 0.4341
 epoch: 37, train_loss: 1.1167, test_loss: 1.2552, test_f1: 0.4360
 epoch: 38, train_loss: 1.1099, test_loss: 1.2549, test_f1: 0.4295
 epoch: 39, train_loss: 1.1121, test_loss: 1.2536, test_f1: 0.4458
 epoch: 40, train_loss: 1.1068, test_loss: 1.2714, test_f1: 0.4300
 epoch: 41, train_loss: 1.1063, test_loss: 1.2561, test_f1: 0.4342
 epoch: 42, train_loss: 1.1026, test_loss: 1.2587, test_f1: 0.4242
 epoch: 43, train_loss: 1.1059, test_loss: 1.2495, test_f1: 0.4292
 epoch: 44, train_loss: 1.0937, test_loss: 1.2739, test_f1: 0.4146
 epoch: 45, train_loss: 1.0983, test_loss: 1.2531, test_f1: 0.4201
 epoch: 46, train_loss: 1.0895, test_loss: 1.2618, test_f1: 0.4299
 epoch: 47, train_loss: 1.0960, test_loss: 1.2601, test_f1: 0.4239
 epoch: 48, train_loss: 1.0869, test_loss: 1.2499, test_f1: 0.4277
 epoch: 49, train_loss: 1.0899, test_loss: 1.2442, test_f1: 0.4446
 epoch: 50, train_loss: 1.0853, test_loss: 1.2627, test_f1: 0.4316
 epoch: 51, train_loss: 1.0763, test_loss: 1.2538, test_f1: 0.4325
 epoch: 52, train_loss: 1.0658, test_loss: 1.2428, test_f1: 0.4391
 epoch: 53, train_loss: 1.0785, test_loss: 1.2514, test_f1: 0.4458
 epoch: 54, train_loss: 1.0636, test_loss: 1.2595, test_f1: 0.4389
 epoch: 55, train_loss: 1.0610, test_loss: 1.2484, test_f1: 0.4367
 epoch: 56, train_loss: 1.0724, test_loss: 1.2733, test_f1: 0.4257
 epoch: 57, train_loss: 1.0571, test_loss: 1.2662, test_f1: 0.4311
 epoch: 58, train_loss: 1.0592, test_loss: 1.2714, test_f1: 0.4309
 epoch: 59, train_loss: 1.0709, test_loss: 1.2806, test_f1: 0.4304
 epoch: 60, train_loss: 1.0723, test_loss: 1.2772, test_f1: 0.4466
 epoch: 61, train_loss: 1.0649, test_loss: 1.2599, test_f1: 0.4351
 epoch: 62, train_loss: 1.0624, test_loss: 1.2627, test_f1: 0.4294
 epoch: 63, train_loss: 1.0685, test_loss: 1.2701, test_f1: 0.4319
 epoch: 64, train_loss: 1.0554, test_loss: 1.2565, test_f1: 0.4374
 epoch: 65, train_loss: 1.0579, test_loss: 1.2724, test_f1: 0.4364
 epoch: 66, train_loss: 1.0525, test_loss: 1.2688, test_f1: 0.4376
 epoch: 67, train_loss: 1.0542, test_loss: 1.2688, test_f1: 0.4378
 epoch: 68, train_loss: 1.0536, test_loss: 1.2709, test_f1: 0.4369
 epoch: 69, train_loss: 1.0578, test_loss: 1.2771, test_f1: 0.4358
 epoch: 70, train_loss: 1.0515, test_loss: 1.2682, test_f1: 0.4307
 epoch: 71, train_loss: 1.0531, test_loss: 1.2801, test_f1: 0.4308
 epoch: 72, train_loss: 1.0479, test_loss: 1.2670, test_f1: 0.4376
 epoch: 73, train_loss: 1.0345, test_loss: 1.2796, test_f1: 0.4379
 epoch: 74, train_loss: 1.0457, test_loss: 1.2751, test_f1: 0.4518
 epoch: 75, train_loss: 1.0428, test_loss: 1.2715, test_f1: 0.4407
 epoch: 76, train_loss: 1.0352, test_loss: 1.2873, test_f1: 0.4443
 epoch: 77, train_loss: 1.0281, test_loss: 1.2819, test_f1: 0.4480
 epoch: 78, train_loss: 1.0317, test_loss: 1.2687, test_f1: 0.4420
 epoch: 79, train_loss: 1.0354, test_loss: 1.2665, test_f1: 0.4419
 epoch: 80, train_loss: 1.0374, test_loss: 1.2649, test_f1: 0.4497
 epoch: 81, train_loss: 1.0346, test_loss: 1.2816, test_f1: 0.4498
 epoch: 82, train_loss: 1.0308, test_loss: 1.2698, test_f1: 0.4390
 epoch: 83, train_loss: 1.0308, test_loss: 1.2584, test_f1: 0.4426
 epoch: 84, train_loss: 1.0282, test_loss: 1.2806, test_f1: 0.4524
 epoch: 85, train_loss: 1.0339, test_loss: 1.2910, test_f1: 0.4497
 epoch: 86, train_loss: 1.0297, test_loss: 1.2894, test_f1: 0.4565
 epoch: 87, train_loss: 1.0260, test_loss: 1.3062, test_f1: 0.4489
 epoch: 88, train_loss: 1.0220, test_loss: 1.2881, test_f1: 0.4607
 epoch: 89, train_loss: 1.0164, test_loss: 1.2809, test_f1: 0.4543
 epoch: 90, train_loss: 1.0162, test_loss: 1.2793, test_f1: 0.4624
 epoch: 91, train_loss: 1.0343, test_loss: 1.2811, test_f1: 0.4703
 epoch: 92, train_loss: 1.0086, test_loss: 1.3098, test_f1: 0.4688
 epoch: 93, train_loss: 1.0121, test_loss: 1.2880, test_f1: 0.4673
 epoch: 94, train_loss: 1.0190, test_loss: 1.2896, test_f1: 0.4622
 epoch: 95, train_loss: 1.0208, test_loss: 1.3058, test_f1: 0.4755
 epoch: 96, train_loss: 1.0136, test_loss: 1.3021, test_f1: 0.4660
 epoch: 97, train_loss: 1.0132, test_loss: 1.3218, test_f1: 0.4745
 epoch: 98, train_loss: 1.0110, test_loss: 1.3180, test_f1: 0.4800
 epoch: 99, train_loss: 1.0142, test_loss: 1.3179, test_f1: 0.4783
##################ITERATION #1 ****************************************
 epoch: 0, train_loss: 1.3654, test_loss: 1.3682, test_f1: 0.3202
 epoch: 1, train_loss: 1.3296, test_loss: 1.3400, test_f1: 0.3167
 epoch: 2, train_loss: 1.3035, test_loss: 1.3224, test_f1: 0.3158
 epoch: 3, train_loss: 1.2768, test_loss: 1.3082, test_f1: 0.2677
 epoch: 4, train_loss: 1.2616, test_loss: 1.3005, test_f1: 0.2540
 epoch: 5, train_loss: 1.2415, test_loss: 1.2864, test_f1: 0.2541
 epoch: 6, train_loss: 1.2270, test_loss: 1.2775, test_f1: 0.2501
 epoch: 7, train_loss: 1.2168, test_loss: 1.2665, test_f1: 0.2500
 epoch: 8, train_loss: 1.2102, test_loss: 1.2588, test_f1: 0.2413
 epoch: 9, train_loss: 1.2019, test_loss: 1.2537, test_f1: 0.2453
 epoch: 10, train_loss: 1.1983, test_loss: 1.2520, test_f1: 0.2711
 epoch: 11, train_loss: 1.1927, test_loss: 1.2467, test_f1: 0.2419
 epoch: 12, train_loss: 1.1785, test_loss: 1.2412, test_f1: 0.2488
 epoch: 13, train_loss: 1.1829, test_loss: 1.2416, test_f1: 0.3218
 epoch: 14, train_loss: 1.1734, test_loss: 1.2346, test_f1: 0.2888
 epoch: 15, train_loss: 1.1739, test_loss: 1.2330, test_f1: 0.3088
 epoch: 16, train_loss: 1.1657, test_loss: 1.2305, test_f1: 0.3547
 epoch: 17, train_loss: 1.1715, test_loss: 1.2246, test_f1: 0.3512
 epoch: 18, train_loss: 1.1585, test_loss: 1.2206, test_f1: 0.3121
 epoch: 19, train_loss: 1.1523, test_loss: 1.2231, test_f1: 0.3686
 epoch: 20, train_loss: 1.1533, test_loss: 1.2187, test_f1: 0.3649
 epoch: 21, train_loss: 1.1501, test_loss: 1.2123, test_f1: 0.3701
 epoch: 22, train_loss: 1.1436, test_loss: 1.2076, test_f1: 0.3818
 epoch: 23, train_loss: 1.1436, test_loss: 1.2048, test_f1: 0.3818
 epoch: 24, train_loss: 1.1374, test_loss: 1.2021, test_f1: 0.4012
 epoch: 25, train_loss: 1.1278, test_loss: 1.1985, test_f1: 0.3929
 epoch: 26, train_loss: 1.1348, test_loss: 1.2025, test_f1: 0.3766
 epoch: 27, train_loss: 1.1203, test_loss: 1.1970, test_f1: 0.3850
 epoch: 28, train_loss: 1.1272, test_loss: 1.1921, test_f1: 0.3895
 epoch: 29, train_loss: 1.1253, test_loss: 1.1881, test_f1: 0.4021
 epoch: 30, train_loss: 1.1157, test_loss: 1.1950, test_f1: 0.3929
 epoch: 31, train_loss: 1.1172, test_loss: 1.1866, test_f1: 0.4012
 epoch: 32, train_loss: 1.1138, test_loss: 1.1847, test_f1: 0.3990
 epoch: 33, train_loss: 1.1085, test_loss: 1.1832, test_f1: 0.3890
 epoch: 34, train_loss: 1.1153, test_loss: 1.1753, test_f1: 0.4084
 epoch: 35, train_loss: 1.1021, test_loss: 1.1773, test_f1: 0.4075
 epoch: 36, train_loss: 1.1106, test_loss: 1.1737, test_f1: 0.3895
 epoch: 37, train_loss: 1.0972, test_loss: 1.1816, test_f1: 0.3968
 epoch: 38, train_loss: 1.0979, test_loss: 1.1781, test_f1: 0.3883
 epoch: 39, train_loss: 1.0824, test_loss: 1.1778, test_f1: 0.3953
 epoch: 40, train_loss: 1.0828, test_loss: 1.1811, test_f1: 0.3989
 epoch: 41, train_loss: 1.0970, test_loss: 1.1718, test_f1: 0.4165
 epoch: 42, train_loss: 1.0909, test_loss: 1.1727, test_f1: 0.4086
 epoch: 43, train_loss: 1.0838, test_loss: 1.1736, test_f1: 0.4034
 epoch: 44, train_loss: 1.0785, test_loss: 1.1733, test_f1: 0.4140
 epoch: 45, train_loss: 1.0701, test_loss: 1.1681, test_f1: 0.4105
 epoch: 46, train_loss: 1.0776, test_loss: 1.1658, test_f1: 0.4247
 epoch: 47, train_loss: 1.0667, test_loss: 1.1736, test_f1: 0.4029
 epoch: 48, train_loss: 1.0671, test_loss: 1.1637, test_f1: 0.4193
 epoch: 49, train_loss: 1.0554, test_loss: 1.1791, test_f1: 0.4036
 epoch: 50, train_loss: 1.0608, test_loss: 1.1561, test_f1: 0.4201
 epoch: 51, train_loss: 1.0501, test_loss: 1.1578, test_f1: 0.4199
 epoch: 52, train_loss: 1.0638, test_loss: 1.1565, test_f1: 0.4278
 epoch: 53, train_loss: 1.0561, test_loss: 1.1565, test_f1: 0.4099
 epoch: 54, train_loss: 1.0589, test_loss: 1.1529, test_f1: 0.4292
 epoch: 55, train_loss: 1.0490, test_loss: 1.1515, test_f1: 0.4226
 epoch: 56, train_loss: 1.0499, test_loss: 1.1485, test_f1: 0.4489
 epoch: 57, train_loss: 1.0453, test_loss: 1.1620, test_f1: 0.4307
 epoch: 58, train_loss: 1.0357, test_loss: 1.1566, test_f1: 0.4424
 epoch: 59, train_loss: 1.0454, test_loss: 1.1487, test_f1: 0.4451
 epoch: 60, train_loss: 1.0322, test_loss: 1.1436, test_f1: 0.4395
 epoch: 61, train_loss: 1.0389, test_loss: 1.1428, test_f1: 0.4464
 epoch: 62, train_loss: 1.0445, test_loss: 1.1427, test_f1: 0.4520
 epoch: 63, train_loss: 1.0278, test_loss: 1.1388, test_f1: 0.4629
 epoch: 64, train_loss: 1.0218, test_loss: 1.1391, test_f1: 0.4704
 epoch: 65, train_loss: 1.0407, test_loss: 1.1402, test_f1: 0.4769
 epoch: 66, train_loss: 1.0356, test_loss: 1.1474, test_f1: 0.4603
 epoch: 67, train_loss: 1.0261, test_loss: 1.1449, test_f1: 0.4633
 epoch: 68, train_loss: 1.0438, test_loss: 1.1527, test_f1: 0.4636
 epoch: 69, train_loss: 1.0297, test_loss: 1.1459, test_f1: 0.4524
 epoch: 70, train_loss: 1.0193, test_loss: 1.1562, test_f1: 0.4679
 epoch: 71, train_loss: 1.0217, test_loss: 1.1529, test_f1: 0.4740
 epoch: 72, train_loss: 1.0213, test_loss: 1.1475, test_f1: 0.4664
 epoch: 73, train_loss: 1.0233, test_loss: 1.1527, test_f1: 0.4716
 epoch: 74, train_loss: 1.0216, test_loss: 1.1302, test_f1: 0.4738
 epoch: 75, train_loss: 1.0170, test_loss: 1.1419, test_f1: 0.4779
 epoch: 76, train_loss: 1.0287, test_loss: 1.1361, test_f1: 0.4828
 epoch: 77, train_loss: 1.0080, test_loss: 1.1366, test_f1: 0.4697
 epoch: 78, train_loss: 1.0145, test_loss: 1.1368, test_f1: 0.4740
 epoch: 79, train_loss: 1.0178, test_loss: 1.1345, test_f1: 0.4722
 epoch: 80, train_loss: 1.0237, test_loss: 1.1299, test_f1: 0.4733
 epoch: 81, train_loss: 1.0232, test_loss: 1.1211, test_f1: 0.4888
 epoch: 82, train_loss: 1.0160, test_loss: 1.1276, test_f1: 0.4799
 epoch: 83, train_loss: 1.0068, test_loss: 1.1205, test_f1: 0.4743
 epoch: 84, train_loss: 1.0109, test_loss: 1.1266, test_f1: 0.4742
 epoch: 85, train_loss: 1.0044, test_loss: 1.1273, test_f1: 0.4768
 epoch: 86, train_loss: 1.0114, test_loss: 1.1234, test_f1: 0.4802
 epoch: 87, train_loss: 0.9960, test_loss: 1.1287, test_f1: 0.4744
 epoch: 88, train_loss: 1.0047, test_loss: 1.1200, test_f1: 0.4771
 epoch: 89, train_loss: 1.0008, test_loss: 1.1247, test_f1: 0.4711
 epoch: 90, train_loss: 1.0051, test_loss: 1.1242, test_f1: 0.4810
 epoch: 91, train_loss: 1.0021, test_loss: 1.1196, test_f1: 0.4733
 epoch: 92, train_loss: 0.9886, test_loss: 1.1197, test_f1: 0.4772
 epoch: 93, train_loss: 0.9920, test_loss: 1.1263, test_f1: 0.4650
 epoch: 94, train_loss: 0.9893, test_loss: 1.1531, test_f1: 0.4656
 epoch: 95, train_loss: 0.9982, test_loss: 1.1224, test_f1: 0.4709
 epoch: 96, train_loss: 0.9842, test_loss: 1.1412, test_f1: 0.4833
 epoch: 97, train_loss: 0.9862, test_loss: 1.1454, test_f1: 0.4675
 epoch: 98, train_loss: 0.9849, test_loss: 1.1305, test_f1: 0.4734
 epoch: 99, train_loss: 0.9903, test_loss: 1.1359, test_f1: 0.4673
##################ITERATION #2 ****************************************
 epoch: 0, train_loss: 1.3004, test_loss: 1.3301, test_f1: 0.3010
 epoch: 1, train_loss: 1.2721, test_loss: 1.3402, test_f1: 0.2822
 epoch: 2, train_loss: 1.2557, test_loss: 1.3248, test_f1: 0.2944
 epoch: 3, train_loss: 1.2474, test_loss: 1.3625, test_f1: 0.3075
 epoch: 4, train_loss: 1.2413, test_loss: 1.3206, test_f1: 0.3060
 epoch: 5, train_loss: 1.2295, test_loss: 1.3139, test_f1: 0.3077
 epoch: 6, train_loss: 1.2267, test_loss: 1.3140, test_f1: 0.3318
 epoch: 7, train_loss: 1.2127, test_loss: 1.3037, test_f1: 0.3258
 epoch: 8, train_loss: 1.2060, test_loss: 1.3472, test_f1: 0.3310
 epoch: 9, train_loss: 1.2016, test_loss: 1.2933, test_f1: 0.3614
 epoch: 10, train_loss: 1.1940, test_loss: 1.2871, test_f1: 0.3628
 epoch: 11, train_loss: 1.1899, test_loss: 1.2868, test_f1: 0.3751
 epoch: 12, train_loss: 1.1825, test_loss: 1.2940, test_f1: 0.3837
 epoch: 13, train_loss: 1.1690, test_loss: 1.2901, test_f1: 0.3857
 epoch: 14, train_loss: 1.1733, test_loss: 1.2789, test_f1: 0.4010
 epoch: 15, train_loss: 1.1686, test_loss: 1.2728, test_f1: 0.4092
 epoch: 16, train_loss: 1.1548, test_loss: 1.2646, test_f1: 0.4194
 epoch: 17, train_loss: 1.1495, test_loss: 1.2753, test_f1: 0.4001
 epoch: 18, train_loss: 1.1453, test_loss: 1.2479, test_f1: 0.4277
 epoch: 19, train_loss: 1.1356, test_loss: 1.2395, test_f1: 0.4297
 epoch: 20, train_loss: 1.1378, test_loss: 1.2395, test_f1: 0.4296
 epoch: 21, train_loss: 1.1259, test_loss: 1.2296, test_f1: 0.4262
 epoch: 22, train_loss: 1.1154, test_loss: 1.2387, test_f1: 0.4496
 epoch: 23, train_loss: 1.1232, test_loss: 1.2438, test_f1: 0.4407
 epoch: 24, train_loss: 1.1190, test_loss: 1.2261, test_f1: 0.4495
 epoch: 25, train_loss: 1.1132, test_loss: 1.2239, test_f1: 0.4447
 epoch: 26, train_loss: 1.1128, test_loss: 1.2242, test_f1: 0.4500
 epoch: 27, train_loss: 1.1120, test_loss: 1.2191, test_f1: 0.4425
 epoch: 28, train_loss: 1.0981, test_loss: 1.2169, test_f1: 0.4421
 epoch: 29, train_loss: 1.1090, test_loss: 1.2083, test_f1: 0.4405
 epoch: 30, train_loss: 1.0937, test_loss: 1.2120, test_f1: 0.4566
 epoch: 31, train_loss: 1.0828, test_loss: 1.2135, test_f1: 0.4527
 epoch: 32, train_loss: 1.0819, test_loss: 1.2143, test_f1: 0.4385
 epoch: 33, train_loss: 1.0810, test_loss: 1.2147, test_f1: 0.4504
 epoch: 34, train_loss: 1.0815, test_loss: 1.2103, test_f1: 0.4384
 epoch: 35, train_loss: 1.0723, test_loss: 1.2234, test_f1: 0.4498
 epoch: 36, train_loss: 1.0655, test_loss: 1.2134, test_f1: 0.4430
 epoch: 37, train_loss: 1.0660, test_loss: 1.2168, test_f1: 0.4391
 epoch: 38, train_loss: 1.0612, test_loss: 1.2165, test_f1: 0.4436
 epoch: 39, train_loss: 1.0549, test_loss: 1.2188, test_f1: 0.4488
 epoch: 40, train_loss: 1.0587, test_loss: 1.2242, test_f1: 0.4499
 epoch: 41, train_loss: 1.0455, test_loss: 1.2175, test_f1: 0.4443
 epoch: 42, train_loss: 1.0488, test_loss: 1.2093, test_f1: 0.4441
 epoch: 43, train_loss: 1.0505, test_loss: 1.2144, test_f1: 0.4505
 epoch: 44, train_loss: 1.0378, test_loss: 1.2047, test_f1: 0.4657
 epoch: 45, train_loss: 1.0451, test_loss: 1.2061, test_f1: 0.4536
 epoch: 46, train_loss: 1.0347, test_loss: 1.2052, test_f1: 0.4596
 epoch: 47, train_loss: 1.0367, test_loss: 1.2066, test_f1: 0.4582
 epoch: 48, train_loss: 1.0242, test_loss: 1.2069, test_f1: 0.4675
 epoch: 49, train_loss: 1.0368, test_loss: 1.2074, test_f1: 0.4522
 epoch: 50, train_loss: 1.0268, test_loss: 1.2146, test_f1: 0.4311
 epoch: 51, train_loss: 1.0210, test_loss: 1.1923, test_f1: 0.4699
 epoch: 52, train_loss: 1.0181, test_loss: 1.2014, test_f1: 0.4559
 epoch: 53, train_loss: 1.0226, test_loss: 1.2006, test_f1: 0.4357
 epoch: 54, train_loss: 1.0215, test_loss: 1.2106, test_f1: 0.4272
 epoch: 55, train_loss: 1.0139, test_loss: 1.1957, test_f1: 0.4624
 epoch: 56, train_loss: 1.0057, test_loss: 1.1993, test_f1: 0.4642
 epoch: 57, train_loss: 1.0118, test_loss: 1.2083, test_f1: 0.4390
 epoch: 58, train_loss: 1.0116, test_loss: 1.1961, test_f1: 0.4786
 epoch: 59, train_loss: 1.0141, test_loss: 1.2072, test_f1: 0.4487
 epoch: 60, train_loss: 1.0077, test_loss: 1.2213, test_f1: 0.4506
 epoch: 61, train_loss: 1.0080, test_loss: 1.2050, test_f1: 0.4657
 epoch: 62, train_loss: 1.0050, test_loss: 1.2090, test_f1: 0.5007
 epoch: 63, train_loss: 1.0126, test_loss: 1.2010, test_f1: 0.5008
 epoch: 64, train_loss: 1.0078, test_loss: 1.2125, test_f1: 0.4630
 epoch: 65, train_loss: 1.0133, test_loss: 1.1989, test_f1: 0.4741
 epoch: 66, train_loss: 1.0065, test_loss: 1.2169, test_f1: 0.4780
 epoch: 67, train_loss: 0.9999, test_loss: 1.2100, test_f1: 0.4692
 epoch: 68, train_loss: 1.0036, test_loss: 1.1972, test_f1: 0.4959
 epoch: 69, train_loss: 0.9857, test_loss: 1.2128, test_f1: 0.4698
 epoch: 70, train_loss: 0.9992, test_loss: 1.2149, test_f1: 0.4798
 epoch: 71, train_loss: 0.9971, test_loss: 1.2128, test_f1: 0.4755
 epoch: 72, train_loss: 0.9961, test_loss: 1.2162, test_f1: 0.4781
 epoch: 73, train_loss: 0.9851, test_loss: 1.2192, test_f1: 0.4653
 epoch: 74, train_loss: 1.0051, test_loss: 1.2161, test_f1: 0.4723
 epoch: 75, train_loss: 0.9983, test_loss: 1.2190, test_f1: 0.4820
 epoch: 76, train_loss: 0.9888, test_loss: 1.2151, test_f1: 0.4836
 epoch: 77, train_loss: 0.9967, test_loss: 1.2189, test_f1: 0.4910
 epoch: 78, train_loss: 0.9918, test_loss: 1.2336, test_f1: 0.4716
 epoch: 79, train_loss: 0.9983, test_loss: 1.2068, test_f1: 0.4938
 epoch: 80, train_loss: 0.9933, test_loss: 1.2243, test_f1: 0.4936
 epoch: 81, train_loss: 0.9924, test_loss: 1.2191, test_f1: 0.4841
 epoch: 82, train_loss: 0.9893, test_loss: 1.2212, test_f1: 0.4972
 epoch: 83, train_loss: 0.9883, test_loss: 1.2293, test_f1: 0.4809
 epoch: 84, train_loss: 0.9770, test_loss: 1.2099, test_f1: 0.4922
 epoch: 85, train_loss: 0.9839, test_loss: 1.2236, test_f1: 0.4834
 epoch: 86, train_loss: 0.9814, test_loss: 1.2124, test_f1: 0.4888
 epoch: 87, train_loss: 0.9821, test_loss: 1.2080, test_f1: 0.5058
 epoch: 88, train_loss: 0.9696, test_loss: 1.2318, test_f1: 0.4997
 epoch: 89, train_loss: 0.9800, test_loss: 1.2143, test_f1: 0.4873
 epoch: 90, train_loss: 0.9784, test_loss: 1.2237, test_f1: 0.4891
 epoch: 91, train_loss: 0.9771, test_loss: 1.2329, test_f1: 0.5020
 epoch: 92, train_loss: 0.9795, test_loss: 1.2566, test_f1: 0.4904
 epoch: 93, train_loss: 0.9830, test_loss: 1.2258, test_f1: 0.4977
 epoch: 94, train_loss: 0.9798, test_loss: 1.2469, test_f1: 0.4905
 epoch: 95, train_loss: 0.9837, test_loss: 1.2324, test_f1: 0.4939
 epoch: 96, train_loss: 0.9701, test_loss: 1.2366, test_f1: 0.4869
 epoch: 97, train_loss: 0.9650, test_loss: 1.2506, test_f1: 0.4882
 epoch: 98, train_loss: 0.9746, test_loss: 1.2214, test_f1: 0.4922
 epoch: 99, train_loss: 0.9743, test_loss: 1.2664, test_f1: 0.4978
##################ITERATION #3 ****************************************
 epoch: 0, train_loss: 1.3151, test_loss: 1.3215, test_f1: 0.2281
 epoch: 1, train_loss: 1.2803, test_loss: 1.3071, test_f1: 0.2336
 epoch: 2, train_loss: 1.2651, test_loss: 1.2979, test_f1: 0.2281
 epoch: 3, train_loss: 1.2452, test_loss: 1.2890, test_f1: 0.2263
 epoch: 4, train_loss: 1.2332, test_loss: 1.2860, test_f1: 0.2319
 epoch: 5, train_loss: 1.2273, test_loss: 1.2717, test_f1: 0.2411
 epoch: 6, train_loss: 1.2117, test_loss: 1.2654, test_f1: 0.2523
 epoch: 7, train_loss: 1.1989, test_loss: 1.2626, test_f1: 0.2576
 epoch: 8, train_loss: 1.1923, test_loss: 1.2688, test_f1: 0.2939
 epoch: 9, train_loss: 1.1914, test_loss: 1.2683, test_f1: 0.3033
 epoch: 10, train_loss: 1.1809, test_loss: 1.2579, test_f1: 0.3343
 epoch: 11, train_loss: 1.1752, test_loss: 1.2561, test_f1: 0.3146
 epoch: 12, train_loss: 1.1700, test_loss: 1.2392, test_f1: 0.2989
 epoch: 13, train_loss: 1.1639, test_loss: 1.2467, test_f1: 0.3189
 epoch: 14, train_loss: 1.1564, test_loss: 1.2467, test_f1: 0.3088
 epoch: 15, train_loss: 1.1539, test_loss: 1.2475, test_f1: 0.3450
 epoch: 16, train_loss: 1.1459, test_loss: 1.2509, test_f1: 0.3257
 epoch: 17, train_loss: 1.1406, test_loss: 1.2614, test_f1: 0.3179
 epoch: 18, train_loss: 1.1299, test_loss: 1.2578, test_f1: 0.3142
 epoch: 19, train_loss: 1.1316, test_loss: 1.2672, test_f1: 0.3163
 epoch: 20, train_loss: 1.1334, test_loss: 1.2574, test_f1: 0.3090
 epoch: 21, train_loss: 1.1218, test_loss: 1.2397, test_f1: 0.3235
 epoch: 22, train_loss: 1.1176, test_loss: 1.2498, test_f1: 0.3166
 epoch: 23, train_loss: 1.1194, test_loss: 1.2456, test_f1: 0.3156
 epoch: 24, train_loss: 1.1206, test_loss: 1.2603, test_f1: 0.3091
 epoch: 25, train_loss: 1.1101, test_loss: 1.2588, test_f1: 0.3063
 epoch: 26, train_loss: 1.1155, test_loss: 1.2531, test_f1: 0.3233
 epoch: 27, train_loss: 1.0974, test_loss: 1.2519, test_f1: 0.3150
 epoch: 28, train_loss: 1.1072, test_loss: 1.2542, test_f1: 0.3253
 epoch: 29, train_loss: 1.0996, test_loss: 1.2604, test_f1: 0.3339
 epoch: 30, train_loss: 1.0902, test_loss: 1.2509, test_f1: 0.3244
 epoch: 31, train_loss: 1.0910, test_loss: 1.2495, test_f1: 0.3310
 epoch: 32, train_loss: 1.0795, test_loss: 1.2508, test_f1: 0.3307
 epoch: 33, train_loss: 1.0797, test_loss: 1.2525, test_f1: 0.3166
 epoch: 34, train_loss: 1.0869, test_loss: 1.2451, test_f1: 0.3424
 epoch: 35, train_loss: 1.0799, test_loss: 1.2402, test_f1: 0.3275
 epoch: 36, train_loss: 1.0752, test_loss: 1.2477, test_f1: 0.3548
 epoch: 37, train_loss: 1.0791, test_loss: 1.2471, test_f1: 0.3458
 epoch: 38, train_loss: 1.0732, test_loss: 1.2608, test_f1: 0.3654
 epoch: 39, train_loss: 1.0723, test_loss: 1.2609, test_f1: 0.3584
 epoch: 40, train_loss: 1.0606, test_loss: 1.2516, test_f1: 0.3372
 epoch: 41, train_loss: 1.0629, test_loss: 1.2494, test_f1: 0.3515
 epoch: 42, train_loss: 1.0498, test_loss: 1.2513, test_f1: 0.3711
 epoch: 43, train_loss: 1.0627, test_loss: 1.2732, test_f1: 0.3557
 epoch: 44, train_loss: 1.0481, test_loss: 1.2542, test_f1: 0.3678
 epoch: 45, train_loss: 1.0454, test_loss: 1.2526, test_f1: 0.3648
 epoch: 46, train_loss: 1.0561, test_loss: 1.2348, test_f1: 0.3608
 epoch: 47, train_loss: 1.0554, test_loss: 1.2512, test_f1: 0.3644
 epoch: 48, train_loss: 1.0528, test_loss: 1.2680, test_f1: 0.3604
 epoch: 49, train_loss: 1.0515, test_loss: 1.2340, test_f1: 0.3751
 epoch: 50, train_loss: 1.0508, test_loss: 1.2336, test_f1: 0.3592
 epoch: 51, train_loss: 1.0534, test_loss: 1.2726, test_f1: 0.3771
 epoch: 52, train_loss: 1.0436, test_loss: 1.2676, test_f1: 0.3543
 epoch: 53, train_loss: 1.0278, test_loss: 1.2397, test_f1: 0.3609
 epoch: 54, train_loss: 1.0393, test_loss: 1.2371, test_f1: 0.3668
 epoch: 55, train_loss: 1.0263, test_loss: 1.2443, test_f1: 0.3527
 epoch: 56, train_loss: 1.0227, test_loss: 1.2438, test_f1: 0.3535
 epoch: 57, train_loss: 1.0468, test_loss: 1.2268, test_f1: 0.3371
 epoch: 58, train_loss: 1.0464, test_loss: 1.2473, test_f1: 0.3566
 epoch: 59, train_loss: 1.0328, test_loss: 1.2710, test_f1: 0.3443
 epoch: 60, train_loss: 1.0231, test_loss: 1.2496, test_f1: 0.3462
 epoch: 61, train_loss: 1.0341, test_loss: 1.2566, test_f1: 0.3660
 epoch: 62, train_loss: 1.0335, test_loss: 1.2572, test_f1: 0.3593
 epoch: 63, train_loss: 1.0234, test_loss: 1.2620, test_f1: 0.3421
 epoch: 64, train_loss: 1.0232, test_loss: 1.2665, test_f1: 0.3426
 epoch: 65, train_loss: 1.0224, test_loss: 1.2625, test_f1: 0.3461
 epoch: 66, train_loss: 1.0179, test_loss: 1.2566, test_f1: 0.3580
 epoch: 67, train_loss: 1.0219, test_loss: 1.2723, test_f1: 0.3507
 epoch: 68, train_loss: 1.0310, test_loss: 1.2689, test_f1: 0.3443
 epoch: 69, train_loss: 1.0146, test_loss: 1.2567, test_f1: 0.3538
 epoch: 70, train_loss: 1.0172, test_loss: 1.2461, test_f1: 0.3482
 epoch: 71, train_loss: 1.0039, test_loss: 1.2909, test_f1: 0.3441
 epoch: 72, train_loss: 1.0123, test_loss: 1.2623, test_f1: 0.3552
 epoch: 73, train_loss: 1.0186, test_loss: 1.2818, test_f1: 0.3584
 epoch: 74, train_loss: 1.0215, test_loss: 1.2610, test_f1: 0.3773
 epoch: 75, train_loss: 1.0160, test_loss: 1.2605, test_f1: 0.3633
 epoch: 76, train_loss: 1.0194, test_loss: 1.2711, test_f1: 0.3443
 epoch: 77, train_loss: 1.0120, test_loss: 1.2536, test_f1: 0.3496
 epoch: 78, train_loss: 1.0036, test_loss: 1.2669, test_f1: 0.3641
 epoch: 79, train_loss: 1.0064, test_loss: 1.2785, test_f1: 0.3430
 epoch: 80, train_loss: 1.0058, test_loss: 1.2846, test_f1: 0.3713
 epoch: 81, train_loss: 1.0090, test_loss: 1.2681, test_f1: 0.3698
 epoch: 82, train_loss: 1.0023, test_loss: 1.2685, test_f1: 0.3754
 epoch: 83, train_loss: 1.0182, test_loss: 1.2538, test_f1: 0.3852
 epoch: 84, train_loss: 1.0221, test_loss: 1.2731, test_f1: 0.3771
 epoch: 85, train_loss: 0.9985, test_loss: 1.2733, test_f1: 0.4035
 epoch: 86, train_loss: 1.0118, test_loss: 1.2994, test_f1: 0.3905
 epoch: 87, train_loss: 1.0013, test_loss: 1.2925, test_f1: 0.3822
 epoch: 88, train_loss: 0.9889, test_loss: 1.2892, test_f1: 0.3820
 epoch: 89, train_loss: 0.9819, test_loss: 1.2642, test_f1: 0.3829
 epoch: 90, train_loss: 0.9898, test_loss: 1.2797, test_f1: 0.3777
 epoch: 91, train_loss: 0.9968, test_loss: 1.2783, test_f1: 0.4023
 epoch: 92, train_loss: 1.0057, test_loss: 1.2839, test_f1: 0.3982
 epoch: 93, train_loss: 1.0087, test_loss: 1.2719, test_f1: 0.4044
 epoch: 94, train_loss: 0.9843, test_loss: 1.2573, test_f1: 0.3996
 epoch: 95, train_loss: 0.9872, test_loss: 1.2549, test_f1: 0.3929
 epoch: 96, train_loss: 1.0048, test_loss: 1.2703, test_f1: 0.4098
 epoch: 97, train_loss: 0.9853, test_loss: 1.2940, test_f1: 0.4220
 epoch: 98, train_loss: 0.9825, test_loss: 1.2877, test_f1: 0.4235
 epoch: 99, train_loss: 0.9761, test_loss: 1.3030, test_f1: 0.4319
##################ITERATION #4 ****************************************
 epoch: 0, train_loss: 1.2886, test_loss: 1.3592, test_f1: 0.2404
 epoch: 1, train_loss: 1.2639, test_loss: 1.3531, test_f1: 0.2470
 epoch: 2, train_loss: 1.2379, test_loss: 1.3427, test_f1: 0.2465
 epoch: 3, train_loss: 1.2249, test_loss: 1.3544, test_f1: 0.2567
 epoch: 4, train_loss: 1.2225, test_loss: 1.3374, test_f1: 0.2674
 epoch: 5, train_loss: 1.2085, test_loss: 1.3389, test_f1: 0.2828
 epoch: 6, train_loss: 1.1986, test_loss: 1.3261, test_f1: 0.2968
 epoch: 7, train_loss: 1.1893, test_loss: 1.3432, test_f1: 0.3089
 epoch: 8, train_loss: 1.1852, test_loss: 1.3352, test_f1: 0.3194
 epoch: 9, train_loss: 1.1653, test_loss: 1.3362, test_f1: 0.3146
 epoch: 10, train_loss: 1.1734, test_loss: 1.3445, test_f1: 0.3543
 epoch: 11, train_loss: 1.1562, test_loss: 1.3030, test_f1: 0.3688
 epoch: 12, train_loss: 1.1540, test_loss: 1.3115, test_f1: 0.3594
 epoch: 13, train_loss: 1.1410, test_loss: 1.3013, test_f1: 0.3752
 epoch: 14, train_loss: 1.1363, test_loss: 1.2990, test_f1: 0.3931
 epoch: 15, train_loss: 1.1340, test_loss: 1.3281, test_f1: 0.3895
 epoch: 16, train_loss: 1.1255, test_loss: 1.3116, test_f1: 0.3963
 epoch: 17, train_loss: 1.1311, test_loss: 1.2973, test_f1: 0.3962
 epoch: 18, train_loss: 1.1175, test_loss: 1.2973, test_f1: 0.4056
 epoch: 19, train_loss: 1.1117, test_loss: 1.3179, test_f1: 0.4208
 epoch: 20, train_loss: 1.1086, test_loss: 1.2778, test_f1: 0.3974
 epoch: 21, train_loss: 1.1063, test_loss: 1.2817, test_f1: 0.4024
 epoch: 22, train_loss: 1.1119, test_loss: 1.2727, test_f1: 0.4030
 epoch: 23, train_loss: 1.1101, test_loss: 1.2857, test_f1: 0.4012
 epoch: 24, train_loss: 1.1091, test_loss: 1.2847, test_f1: 0.4072
 epoch: 25, train_loss: 1.0842, test_loss: 1.2743, test_f1: 0.4121
 epoch: 26, train_loss: 1.0845, test_loss: 1.2783, test_f1: 0.4224
 epoch: 27, train_loss: 1.0999, test_loss: 1.2668, test_f1: 0.4156
 epoch: 28, train_loss: 1.0833, test_loss: 1.2780, test_f1: 0.4197
 epoch: 29, train_loss: 1.0908, test_loss: 1.2630, test_f1: 0.4358
 epoch: 30, train_loss: 1.0828, test_loss: 1.2659, test_f1: 0.4175
 epoch: 31, train_loss: 1.0719, test_loss: 1.2977, test_f1: 0.4317
 epoch: 32, train_loss: 1.0703, test_loss: 1.2674, test_f1: 0.4155
 epoch: 33, train_loss: 1.0820, test_loss: 1.2571, test_f1: 0.4221
 epoch: 34, train_loss: 1.0722, test_loss: 1.2763, test_f1: 0.4203
 epoch: 35, train_loss: 1.0687, test_loss: 1.2739, test_f1: 0.4307
 epoch: 36, train_loss: 1.0735, test_loss: 1.2544, test_f1: 0.4143
 epoch: 37, train_loss: 1.0590, test_loss: 1.2610, test_f1: 0.4158
 epoch: 38, train_loss: 1.0557, test_loss: 1.2643, test_f1: 0.4351
 epoch: 39, train_loss: 1.0532, test_loss: 1.2388, test_f1: 0.4186
 epoch: 40, train_loss: 1.0478, test_loss: 1.2734, test_f1: 0.4307
 epoch: 41, train_loss: 1.0407, test_loss: 1.2587, test_f1: 0.4331
 epoch: 42, train_loss: 1.0500, test_loss: 1.2666, test_f1: 0.4369
 epoch: 43, train_loss: 1.0520, test_loss: 1.2605, test_f1: 0.4459
 epoch: 44, train_loss: 1.0412, test_loss: 1.2367, test_f1: 0.4538
 epoch: 45, train_loss: 1.0369, test_loss: 1.2427, test_f1: 0.4551
 epoch: 46, train_loss: 1.0355, test_loss: 1.2502, test_f1: 0.4601
 epoch: 47, train_loss: 1.0297, test_loss: 1.2334, test_f1: 0.4368
 epoch: 48, train_loss: 1.0267, test_loss: 1.2255, test_f1: 0.4568
 epoch: 49, train_loss: 1.0281, test_loss: 1.2578, test_f1: 0.4681
 epoch: 50, train_loss: 1.0338, test_loss: 1.2619, test_f1: 0.4652
 epoch: 51, train_loss: 1.0147, test_loss: 1.2741, test_f1: 0.4874
 epoch: 52, train_loss: 1.0223, test_loss: 1.2333, test_f1: 0.4672
 epoch: 53, train_loss: 1.0242, test_loss: 1.2607, test_f1: 0.4865
 epoch: 54, train_loss: 1.0286, test_loss: 1.2544, test_f1: 0.4843
 epoch: 55, train_loss: 1.0210, test_loss: 1.2390, test_f1: 0.4874
 epoch: 56, train_loss: 1.0196, test_loss: 1.2430, test_f1: 0.4854
 epoch: 57, train_loss: 1.0218, test_loss: 1.2332, test_f1: 0.4821
 epoch: 58, train_loss: 1.0212, test_loss: 1.2277, test_f1: 0.4967
 epoch: 59, train_loss: 1.0178, test_loss: 1.2429, test_f1: 0.4997
 epoch: 60, train_loss: 1.0128, test_loss: 1.2466, test_f1: 0.4985
 epoch: 61, train_loss: 1.0011, test_loss: 1.2261, test_f1: 0.4828
 epoch: 62, train_loss: 1.0094, test_loss: 1.2391, test_f1: 0.4907
 epoch: 63, train_loss: 0.9957, test_loss: 1.2624, test_f1: 0.5017
 epoch: 64, train_loss: 1.0130, test_loss: 1.2346, test_f1: 0.5087
 epoch: 65, train_loss: 1.0020, test_loss: 1.2609, test_f1: 0.5090
 epoch: 66, train_loss: 1.0056, test_loss: 1.2595, test_f1: 0.4978
 epoch: 67, train_loss: 0.9965, test_loss: 1.2578, test_f1: 0.5063
 epoch: 68, train_loss: 1.0132, test_loss: 1.2182, test_f1: 0.5039
 epoch: 69, train_loss: 1.0105, test_loss: 1.2425, test_f1: 0.5201
 epoch: 70, train_loss: 0.9989, test_loss: 1.2450, test_f1: 0.5092
 epoch: 71, train_loss: 1.0083, test_loss: 1.2342, test_f1: 0.5113
 epoch: 72, train_loss: 1.0042, test_loss: 1.2619, test_f1: 0.5069
 epoch: 73, train_loss: 1.0005, test_loss: 1.2586, test_f1: 0.5204
 epoch: 74, train_loss: 1.0011, test_loss: 1.2390, test_f1: 0.5177
 epoch: 75, train_loss: 0.9966, test_loss: 1.2486, test_f1: 0.5229
 epoch: 76, train_loss: 0.9874, test_loss: 1.2532, test_f1: 0.5032
 epoch: 77, train_loss: 0.9849, test_loss: 1.2473, test_f1: 0.5139
 epoch: 78, train_loss: 0.9918, test_loss: 1.2278, test_f1: 0.5352
 epoch: 79, train_loss: 0.9976, test_loss: 1.2510, test_f1: 0.5157
 epoch: 80, train_loss: 0.9986, test_loss: 1.2439, test_f1: 0.5291
 epoch: 81, train_loss: 0.9897, test_loss: 1.2427, test_f1: 0.5235
 epoch: 82, train_loss: 0.9780, test_loss: 1.2414, test_f1: 0.5297
 epoch: 83, train_loss: 0.9868, test_loss: 1.2462, test_f1: 0.5245
 epoch: 84, train_loss: 0.9805, test_loss: 1.2566, test_f1: 0.5294
 epoch: 85, train_loss: 0.9812, test_loss: 1.2608, test_f1: 0.5065
 epoch: 86, train_loss: 0.9739, test_loss: 1.2737, test_f1: 0.5196
 epoch: 87, train_loss: 0.9773, test_loss: 1.2481, test_f1: 0.5416
 epoch: 88, train_loss: 0.9811, test_loss: 1.2596, test_f1: 0.5230
 epoch: 89, train_loss: 0.9703, test_loss: 1.2774, test_f1: 0.5231
 epoch: 90, train_loss: 0.9954, test_loss: 1.2522, test_f1: 0.5138
 epoch: 91, train_loss: 0.9755, test_loss: 1.2733, test_f1: 0.5056
 epoch: 92, train_loss: 0.9728, test_loss: 1.2567, test_f1: 0.5330
 epoch: 93, train_loss: 0.9800, test_loss: 1.2439, test_f1: 0.5271
 epoch: 94, train_loss: 0.9883, test_loss: 1.2634, test_f1: 0.5291
 epoch: 95, train_loss: 0.9611, test_loss: 1.2747, test_f1: 0.4808
 epoch: 96, train_loss: 0.9625, test_loss: 1.2660, test_f1: 0.5239
 epoch: 97, train_loss: 0.9727, test_loss: 1.2542, test_f1: 0.4856
 epoch: 98, train_loss: 0.9660, test_loss: 1.2723, test_f1: 0.4890
 epoch: 99, train_loss: 0.9758, test_loss: 1.2380, test_f1: 0.5148
##################ITERATION #5 ****************************************
 epoch: 0, train_loss: 1.3091, test_loss: 1.3636, test_f1: 0.2648
 epoch: 1, train_loss: 1.2728, test_loss: 1.3254, test_f1: 0.2567
 epoch: 2, train_loss: 1.2497, test_loss: 1.3308, test_f1: 0.2923
 epoch: 3, train_loss: 1.2310, test_loss: 1.3328, test_f1: 0.2988
 epoch: 4, train_loss: 1.2437, test_loss: 1.3282, test_f1: 0.3324
 epoch: 5, train_loss: 1.2331, test_loss: 1.3348, test_f1: 0.3379
 epoch: 6, train_loss: 1.2051, test_loss: 1.3300, test_f1: 0.3420
 epoch: 7, train_loss: 1.2070, test_loss: 1.3149, test_f1: 0.3579
 epoch: 8, train_loss: 1.1987, test_loss: 1.3161, test_f1: 0.3533
 epoch: 9, train_loss: 1.1935, test_loss: 1.3071, test_f1: 0.3515
 epoch: 10, train_loss: 1.1874, test_loss: 1.2958, test_f1: 0.3684
 epoch: 11, train_loss: 1.1873, test_loss: 1.2861, test_f1: 0.3722
 epoch: 12, train_loss: 1.1779, test_loss: 1.2896, test_f1: 0.4022
 epoch: 13, train_loss: 1.1464, test_loss: 1.2749, test_f1: 0.4084
 epoch: 14, train_loss: 1.1435, test_loss: 1.2786, test_f1: 0.4148
 epoch: 15, train_loss: 1.1466, test_loss: 1.2766, test_f1: 0.4185
 epoch: 16, train_loss: 1.1436, test_loss: 1.2830, test_f1: 0.4284
 epoch: 17, train_loss: 1.1431, test_loss: 1.2605, test_f1: 0.4417
 epoch: 18, train_loss: 1.1324, test_loss: 1.2615, test_f1: 0.4444
 epoch: 19, train_loss: 1.1290, test_loss: 1.2506, test_f1: 0.4338
 epoch: 20, train_loss: 1.1230, test_loss: 1.2511, test_f1: 0.4329
 epoch: 21, train_loss: 1.1120, test_loss: 1.2494, test_f1: 0.4309
 epoch: 22, train_loss: 1.1068, test_loss: 1.2448, test_f1: 0.4447
 epoch: 23, train_loss: 1.0946, test_loss: 1.2581, test_f1: 0.4355
 epoch: 24, train_loss: 1.0979, test_loss: 1.2346, test_f1: 0.4463
 epoch: 25, train_loss: 1.0912, test_loss: 1.2378, test_f1: 0.4485
 epoch: 26, train_loss: 1.0899, test_loss: 1.2135, test_f1: 0.4520
 epoch: 27, train_loss: 1.0828, test_loss: 1.2436, test_f1: 0.4487
 epoch: 28, train_loss: 1.0757, test_loss: 1.2238, test_f1: 0.4517
 epoch: 29, train_loss: 1.0835, test_loss: 1.2299, test_f1: 0.4567
 epoch: 30, train_loss: 1.0629, test_loss: 1.2398, test_f1: 0.4525
 epoch: 31, train_loss: 1.0585, test_loss: 1.2802, test_f1: 0.4561
 epoch: 32, train_loss: 1.0610, test_loss: 1.2123, test_f1: 0.4635
 epoch: 33, train_loss: 1.0679, test_loss: 1.2189, test_f1: 0.4494
 epoch: 34, train_loss: 1.0754, test_loss: 1.2315, test_f1: 0.4588
 epoch: 35, train_loss: 1.0559, test_loss: 1.2347, test_f1: 0.4255
 epoch: 36, train_loss: 1.0443, test_loss: 1.2403, test_f1: 0.4468
 epoch: 37, train_loss: 1.0478, test_loss: 1.2319, test_f1: 0.4636
 epoch: 38, train_loss: 1.0495, test_loss: 1.2537, test_f1: 0.4625
 epoch: 39, train_loss: 1.0537, test_loss: 1.2683, test_f1: 0.4510
 epoch: 40, train_loss: 1.0307, test_loss: 1.2492, test_f1: 0.4626
 epoch: 41, train_loss: 1.0256, test_loss: 1.2486, test_f1: 0.4694
 epoch: 42, train_loss: 1.0285, test_loss: 1.2555, test_f1: 0.4668
 epoch: 43, train_loss: 1.0312, test_loss: 1.2509, test_f1: 0.4705
 epoch: 44, train_loss: 1.0317, test_loss: 1.2690, test_f1: 0.4518
 epoch: 45, train_loss: 1.0161, test_loss: 1.2647, test_f1: 0.4406
 epoch: 46, train_loss: 1.0222, test_loss: 1.2643, test_f1: 0.4251
 epoch: 47, train_loss: 1.0287, test_loss: 1.2736, test_f1: 0.4130
 epoch: 48, train_loss: 1.0136, test_loss: 1.2794, test_f1: 0.4057
 epoch: 49, train_loss: 1.0041, test_loss: 1.2451, test_f1: 0.4243
 epoch: 50, train_loss: 1.0142, test_loss: 1.3037, test_f1: 0.4185
 epoch: 51, train_loss: 1.0075, test_loss: 1.2776, test_f1: 0.4241
 epoch: 52, train_loss: 1.0061, test_loss: 1.2633, test_f1: 0.4487
 epoch: 53, train_loss: 1.0176, test_loss: 1.2782, test_f1: 0.4153
 epoch: 54, train_loss: 1.0003, test_loss: 1.2655, test_f1: 0.4189
 epoch: 55, train_loss: 1.0033, test_loss: 1.3262, test_f1: 0.4287
 epoch: 56, train_loss: 1.0115, test_loss: 1.3174, test_f1: 0.4168
 epoch: 57, train_loss: 0.9887, test_loss: 1.2897, test_f1: 0.4180
 epoch: 58, train_loss: 0.9962, test_loss: 1.2831, test_f1: 0.4027
 epoch: 59, train_loss: 1.0071, test_loss: 1.2981, test_f1: 0.4098
 epoch: 60, train_loss: 1.0030, test_loss: 1.2893, test_f1: 0.4127
 epoch: 61, train_loss: 0.9867, test_loss: 1.2957, test_f1: 0.4248
 epoch: 62, train_loss: 0.9873, test_loss: 1.3135, test_f1: 0.4159
 epoch: 63, train_loss: 0.9947, test_loss: 1.2618, test_f1: 0.4232
 epoch: 64, train_loss: 0.9814, test_loss: 1.2931, test_f1: 0.4117
 epoch: 65, train_loss: 1.0107, test_loss: 1.2747, test_f1: 0.4292
 epoch: 66, train_loss: 0.9910, test_loss: 1.2844, test_f1: 0.4231
 epoch: 67, train_loss: 0.9894, test_loss: 1.2855, test_f1: 0.4223
 epoch: 68, train_loss: 0.9708, test_loss: 1.2927, test_f1: 0.4293
 epoch: 69, train_loss: 1.0007, test_loss: 1.2721, test_f1: 0.4199
 epoch: 70, train_loss: 0.9762, test_loss: 1.3075, test_f1: 0.4425
 epoch: 71, train_loss: 0.9787, test_loss: 1.2944, test_f1: 0.4144
 epoch: 72, train_loss: 0.9861, test_loss: 1.3186, test_f1: 0.4233
 epoch: 73, train_loss: 0.9707, test_loss: 1.3101, test_f1: 0.4323
 epoch: 74, train_loss: 0.9824, test_loss: 1.3030, test_f1: 0.4188
 epoch: 75, train_loss: 0.9762, test_loss: 1.2941, test_f1: 0.4315
 epoch: 76, train_loss: 0.9784, test_loss: 1.3063, test_f1: 0.4287
 epoch: 77, train_loss: 0.9747, test_loss: 1.2654, test_f1: 0.4321
 epoch: 78, train_loss: 0.9906, test_loss: 1.2572, test_f1: 0.4538
 epoch: 79, train_loss: 0.9837, test_loss: 1.2810, test_f1: 0.4347
 epoch: 80, train_loss: 0.9829, test_loss: 1.2762, test_f1: 0.4329
 epoch: 81, train_loss: 0.9823, test_loss: 1.3022, test_f1: 0.4739
 epoch: 82, train_loss: 0.9774, test_loss: 1.2701, test_f1: 0.4493
 epoch: 83, train_loss: 0.9727, test_loss: 1.2655, test_f1: 0.4506
 epoch: 84, train_loss: 0.9782, test_loss: 1.2650, test_f1: 0.4442
 epoch: 85, train_loss: 0.9737, test_loss: 1.3138, test_f1: 0.4550
 epoch: 86, train_loss: 0.9775, test_loss: 1.3145, test_f1: 0.4425
 epoch: 87, train_loss: 0.9623, test_loss: 1.3009, test_f1: 0.4525
 epoch: 88, train_loss: 0.9739, test_loss: 1.3120, test_f1: 0.4480
 epoch: 89, train_loss: 0.9698, test_loss: 1.2833, test_f1: 0.4485
 epoch: 90, train_loss: 0.9736, test_loss: 1.2931, test_f1: 0.4445
 epoch: 91, train_loss: 0.9540, test_loss: 1.3055, test_f1: 0.4455
 epoch: 92, train_loss: 0.9786, test_loss: 1.3094, test_f1: 0.4566
 epoch: 93, train_loss: 0.9611, test_loss: 1.3195, test_f1: 0.4601
 epoch: 94, train_loss: 0.9562, test_loss: 1.2953, test_f1: 0.4719
 epoch: 95, train_loss: 0.9602, test_loss: 1.2739, test_f1: 0.4439
 epoch: 96, train_loss: 0.9536, test_loss: 1.3486, test_f1: 0.4594
 epoch: 97, train_loss: 0.9530, test_loss: 1.2800, test_f1: 0.4502
 epoch: 98, train_loss: 0.9450, test_loss: 1.3150, test_f1: 0.4681
 epoch: 99, train_loss: 0.9595, test_loss: 1.2976, test_f1: 0.4636
##################ITERATION #6 ****************************************
 epoch: 0, train_loss: 1.2621, test_loss: 1.3015, test_f1: 0.2422
 epoch: 1, train_loss: 1.2272, test_loss: 1.3081, test_f1: 0.3075
 epoch: 2, train_loss: 1.2241, test_loss: 1.3333, test_f1: 0.3183
 epoch: 3, train_loss: 1.2096, test_loss: 1.3262, test_f1: 0.3275
 epoch: 4, train_loss: 1.2061, test_loss: 1.3268, test_f1: 0.3503
 epoch: 5, train_loss: 1.1938, test_loss: 1.3083, test_f1: 0.3492
 epoch: 6, train_loss: 1.1882, test_loss: 1.3108, test_f1: 0.3592
 epoch: 7, train_loss: 1.1842, test_loss: 1.3428, test_f1: 0.3460
 epoch: 8, train_loss: 1.1738, test_loss: 1.2820, test_f1: 0.3773
 epoch: 9, train_loss: 1.1625, test_loss: 1.3124, test_f1: 0.3691
 epoch: 10, train_loss: 1.1619, test_loss: 1.3126, test_f1: 0.3503
 epoch: 11, train_loss: 1.1495, test_loss: 1.2745, test_f1: 0.3759
 epoch: 12, train_loss: 1.1526, test_loss: 1.2815, test_f1: 0.3708
 epoch: 13, train_loss: 1.1434, test_loss: 1.2556, test_f1: 0.3764
 epoch: 14, train_loss: 1.1378, test_loss: 1.2800, test_f1: 0.3883
 epoch: 15, train_loss: 1.1365, test_loss: 1.2609, test_f1: 0.3835
 epoch: 16, train_loss: 1.1231, test_loss: 1.2789, test_f1: 0.3938
 epoch: 17, train_loss: 1.1321, test_loss: 1.2681, test_f1: 0.3924
 epoch: 18, train_loss: 1.1209, test_loss: 1.2325, test_f1: 0.3954
 epoch: 19, train_loss: 1.1108, test_loss: 1.2399, test_f1: 0.3911
 epoch: 20, train_loss: 1.1206, test_loss: 1.2486, test_f1: 0.3990
 epoch: 21, train_loss: 1.1065, test_loss: 1.2024, test_f1: 0.3731
 epoch: 22, train_loss: 1.1205, test_loss: 1.2070, test_f1: 0.3676
 epoch: 23, train_loss: 1.1059, test_loss: 1.2032, test_f1: 0.3785
 epoch: 24, train_loss: 1.1106, test_loss: 1.2049, test_f1: 0.4159
 epoch: 25, train_loss: 1.1022, test_loss: 1.1992, test_f1: 0.4026
 epoch: 26, train_loss: 1.1042, test_loss: 1.2107, test_f1: 0.4124
 epoch: 27, train_loss: 1.0844, test_loss: 1.1888, test_f1: 0.3986
 epoch: 28, train_loss: 1.0811, test_loss: 1.1949, test_f1: 0.4296
 epoch: 29, train_loss: 1.0827, test_loss: 1.1834, test_f1: 0.4370
 epoch: 30, train_loss: 1.0796, test_loss: 1.1885, test_f1: 0.4314
 epoch: 31, train_loss: 1.0793, test_loss: 1.1916, test_f1: 0.4284
 epoch: 32, train_loss: 1.0843, test_loss: 1.1798, test_f1: 0.4313
 epoch: 33, train_loss: 1.0706, test_loss: 1.1830, test_f1: 0.4215
 epoch: 34, train_loss: 1.0711, test_loss: 1.1852, test_f1: 0.4312
 epoch: 35, train_loss: 1.0782, test_loss: 1.2093, test_f1: 0.4329
 epoch: 36, train_loss: 1.0766, test_loss: 1.1827, test_f1: 0.4398
 epoch: 37, train_loss: 1.0611, test_loss: 1.1970, test_f1: 0.4399
 epoch: 38, train_loss: 1.0700, test_loss: 1.1855, test_f1: 0.4256
 epoch: 39, train_loss: 1.0696, test_loss: 1.1940, test_f1: 0.4390
 epoch: 40, train_loss: 1.0560, test_loss: 1.1843, test_f1: 0.4296
 epoch: 41, train_loss: 1.0694, test_loss: 1.1903, test_f1: 0.4354
 epoch: 42, train_loss: 1.0488, test_loss: 1.1930, test_f1: 0.4314
 epoch: 43, train_loss: 1.0650, test_loss: 1.1980, test_f1: 0.4366
 epoch: 44, train_loss: 1.0639, test_loss: 1.1980, test_f1: 0.4274
 epoch: 45, train_loss: 1.0523, test_loss: 1.1820, test_f1: 0.4431
 epoch: 46, train_loss: 1.0484, test_loss: 1.1878, test_f1: 0.4545
 epoch: 47, train_loss: 1.0378, test_loss: 1.1907, test_f1: 0.4300
 epoch: 48, train_loss: 1.0531, test_loss: 1.1940, test_f1: 0.4545
 epoch: 49, train_loss: 1.0399, test_loss: 1.2041, test_f1: 0.4440
 epoch: 50, train_loss: 1.0287, test_loss: 1.2023, test_f1: 0.4428
 epoch: 51, train_loss: 1.0263, test_loss: 1.2015, test_f1: 0.4425
 epoch: 52, train_loss: 1.0299, test_loss: 1.2042, test_f1: 0.4336
 epoch: 53, train_loss: 1.0367, test_loss: 1.2200, test_f1: 0.4355
 epoch: 54, train_loss: 1.0460, test_loss: 1.1903, test_f1: 0.4378
 epoch: 55, train_loss: 1.0308, test_loss: 1.2092, test_f1: 0.4419
 epoch: 56, train_loss: 1.0284, test_loss: 1.2002, test_f1: 0.4493
 epoch: 57, train_loss: 1.0247, test_loss: 1.1968, test_f1: 0.4336
 epoch: 58, train_loss: 1.0207, test_loss: 1.1938, test_f1: 0.4495
 epoch: 59, train_loss: 1.0181, test_loss: 1.2073, test_f1: 0.4528
 epoch: 60, train_loss: 1.0204, test_loss: 1.2067, test_f1: 0.4586
 epoch: 61, train_loss: 1.0234, test_loss: 1.1975, test_f1: 0.4551
 epoch: 62, train_loss: 1.0277, test_loss: 1.1890, test_f1: 0.4449
 epoch: 63, train_loss: 1.0260, test_loss: 1.1977, test_f1: 0.4493
 epoch: 64, train_loss: 1.0223, test_loss: 1.2050, test_f1: 0.4415
 epoch: 65, train_loss: 1.0216, test_loss: 1.2434, test_f1: 0.4439
 epoch: 66, train_loss: 1.0353, test_loss: 1.2298, test_f1: 0.4407
 epoch: 67, train_loss: 1.0208, test_loss: 1.2364, test_f1: 0.4356
 epoch: 68, train_loss: 1.0121, test_loss: 1.2042, test_f1: 0.4419
 epoch: 69, train_loss: 1.0204, test_loss: 1.2183, test_f1: 0.4357
 epoch: 70, train_loss: 1.0171, test_loss: 1.2039, test_f1: 0.4475
 epoch: 71, train_loss: 1.0186, test_loss: 1.2840, test_f1: 0.4437
 epoch: 72, train_loss: 1.0089, test_loss: 1.2296, test_f1: 0.4393
 epoch: 73, train_loss: 1.0070, test_loss: 1.2129, test_f1: 0.4508
 epoch: 74, train_loss: 1.0170, test_loss: 1.2185, test_f1: 0.4564
 epoch: 75, train_loss: 1.0116, test_loss: 1.2209, test_f1: 0.4536
 epoch: 76, train_loss: 1.0182, test_loss: 1.2061, test_f1: 0.4477
 epoch: 77, train_loss: 1.0030, test_loss: 1.1994, test_f1: 0.4525
 epoch: 78, train_loss: 1.0118, test_loss: 1.2183, test_f1: 0.4621
 epoch: 79, train_loss: 0.9956, test_loss: 1.2543, test_f1: 0.4491
 epoch: 80, train_loss: 1.0226, test_loss: 1.2227, test_f1: 0.4434
 epoch: 81, train_loss: 1.0071, test_loss: 1.1989, test_f1: 0.4549
 epoch: 82, train_loss: 1.0126, test_loss: 1.1944, test_f1: 0.4693
 epoch: 83, train_loss: 0.9985, test_loss: 1.2102, test_f1: 0.4676
 epoch: 84, train_loss: 1.0225, test_loss: 1.2283, test_f1: 0.4461
 epoch: 85, train_loss: 1.0076, test_loss: 1.2110, test_f1: 0.4507
 epoch: 86, train_loss: 1.0114, test_loss: 1.2113, test_f1: 0.4394
 epoch: 87, train_loss: 1.0003, test_loss: 1.1974, test_f1: 0.4389
 epoch: 88, train_loss: 0.9875, test_loss: 1.2049, test_f1: 0.4590
 epoch: 89, train_loss: 0.9937, test_loss: 1.2452, test_f1: 0.4464
 epoch: 90, train_loss: 0.9857, test_loss: 1.2316, test_f1: 0.4423
 epoch: 91, train_loss: 0.9928, test_loss: 1.1975, test_f1: 0.4496
 epoch: 92, train_loss: 1.0064, test_loss: 1.2206, test_f1: 0.4465
 epoch: 93, train_loss: 0.9975, test_loss: 1.2166, test_f1: 0.4507
 epoch: 94, train_loss: 0.9947, test_loss: 1.2160, test_f1: 0.4558
 epoch: 95, train_loss: 1.0049, test_loss: 1.2541, test_f1: 0.4549
 epoch: 96, train_loss: 1.0015, test_loss: 1.2456, test_f1: 0.4450
 epoch: 97, train_loss: 0.9924, test_loss: 1.2869, test_f1: 0.4507
 epoch: 98, train_loss: 0.9853, test_loss: 1.2568, test_f1: 0.4356
 epoch: 99, train_loss: 0.9973, test_loss: 1.2413, test_f1: 0.4485
##################ITERATION #7 ****************************************
 epoch: 0, train_loss: 1.2814, test_loss: 1.3927, test_f1: 0.2404
 epoch: 1, train_loss: 1.2439, test_loss: 1.3910, test_f1: 0.2633
 epoch: 2, train_loss: 1.2352, test_loss: 1.3773, test_f1: 0.2580
 epoch: 3, train_loss: 1.2188, test_loss: 1.3780, test_f1: 0.2668
 epoch: 4, train_loss: 1.2036, test_loss: 1.3687, test_f1: 0.2771
 epoch: 5, train_loss: 1.2010, test_loss: 1.3568, test_f1: 0.2881
 epoch: 6, train_loss: 1.1911, test_loss: 1.3602, test_f1: 0.3282
 epoch: 7, train_loss: 1.1836, test_loss: 1.3402, test_f1: 0.3461
 epoch: 8, train_loss: 1.1697, test_loss: 1.3538, test_f1: 0.3525
 epoch: 9, train_loss: 1.1621, test_loss: 1.3401, test_f1: 0.3812
 epoch: 10, train_loss: 1.1555, test_loss: 1.3290, test_f1: 0.3807
 epoch: 11, train_loss: 1.1468, test_loss: 1.3554, test_f1: 0.3690
 epoch: 12, train_loss: 1.1417, test_loss: 1.3224, test_f1: 0.3863
 epoch: 13, train_loss: 1.1472, test_loss: 1.3382, test_f1: 0.3793
 epoch: 14, train_loss: 1.1420, test_loss: 1.3376, test_f1: 0.3726
 epoch: 15, train_loss: 1.1297, test_loss: 1.3186, test_f1: 0.3965
 epoch: 16, train_loss: 1.1334, test_loss: 1.3333, test_f1: 0.3898
 epoch: 17, train_loss: 1.1316, test_loss: 1.3291, test_f1: 0.3947
 epoch: 18, train_loss: 1.1269, test_loss: 1.3183, test_f1: 0.4036
 epoch: 19, train_loss: 1.1123, test_loss: 1.3901, test_f1: 0.4072
 epoch: 20, train_loss: 1.1142, test_loss: 1.3195, test_f1: 0.4066
 epoch: 21, train_loss: 1.1100, test_loss: 1.3420, test_f1: 0.4019
 epoch: 22, train_loss: 1.1168, test_loss: 1.3170, test_f1: 0.4142
 epoch: 23, train_loss: 1.1030, test_loss: 1.3133, test_f1: 0.4176
 epoch: 24, train_loss: 1.0991, test_loss: 1.3109, test_f1: 0.4031
 epoch: 25, train_loss: 1.1001, test_loss: 1.3019, test_f1: 0.4121
 epoch: 26, train_loss: 1.0886, test_loss: 1.2765, test_f1: 0.4114
 epoch: 27, train_loss: 1.0797, test_loss: 1.2936, test_f1: 0.4100
 epoch: 28, train_loss: 1.0832, test_loss: 1.2798, test_f1: 0.4161
 epoch: 29, train_loss: 1.0769, test_loss: 1.3127, test_f1: 0.4259
 epoch: 30, train_loss: 1.0676, test_loss: 1.2837, test_f1: 0.4265
 epoch: 31, train_loss: 1.0820, test_loss: 1.3139, test_f1: 0.4250
 epoch: 32, train_loss: 1.0754, test_loss: 1.2795, test_f1: 0.4206
 epoch: 33, train_loss: 1.0595, test_loss: 1.2692, test_f1: 0.4264
 epoch: 34, train_loss: 1.0565, test_loss: 1.2985, test_f1: 0.4249
 epoch: 35, train_loss: 1.0542, test_loss: 1.2726, test_f1: 0.4278
 epoch: 36, train_loss: 1.0490, test_loss: 1.3103, test_f1: 0.4356
 epoch: 37, train_loss: 1.0562, test_loss: 1.3235, test_f1: 0.4264
 epoch: 38, train_loss: 1.0496, test_loss: 1.2904, test_f1: 0.4425
 epoch: 39, train_loss: 1.0432, test_loss: 1.2638, test_f1: 0.4352
 epoch: 40, train_loss: 1.0491, test_loss: 1.2800, test_f1: 0.4469
 epoch: 41, train_loss: 1.0390, test_loss: 1.2801, test_f1: 0.4432
 epoch: 42, train_loss: 1.0313, test_loss: 1.2921, test_f1: 0.4412
 epoch: 43, train_loss: 1.0291, test_loss: 1.2682, test_f1: 0.4328
 epoch: 44, train_loss: 1.0300, test_loss: 1.2890, test_f1: 0.4394
 epoch: 45, train_loss: 1.0257, test_loss: 1.2952, test_f1: 0.4341
 epoch: 46, train_loss: 1.0355, test_loss: 1.3162, test_f1: 0.4513
 epoch: 47, train_loss: 1.0213, test_loss: 1.3088, test_f1: 0.4579
 epoch: 48, train_loss: 1.0310, test_loss: 1.3307, test_f1: 0.4430
 epoch: 49, train_loss: 1.0063, test_loss: 1.2985, test_f1: 0.4519
 epoch: 50, train_loss: 1.0245, test_loss: 1.3236, test_f1: 0.4652
 epoch: 51, train_loss: 1.0147, test_loss: 1.3728, test_f1: 0.4818
 epoch: 52, train_loss: 1.0284, test_loss: 1.2770, test_f1: 0.4566
 epoch: 53, train_loss: 1.0092, test_loss: 1.2931, test_f1: 0.4612
 epoch: 54, train_loss: 1.0120, test_loss: 1.2758, test_f1: 0.4542
 epoch: 55, train_loss: 1.0140, test_loss: 1.2670, test_f1: 0.4660
 epoch: 56, train_loss: 1.0162, test_loss: 1.2891, test_f1: 0.4682
 epoch: 57, train_loss: 1.0093, test_loss: 1.2846, test_f1: 0.4776
 epoch: 58, train_loss: 1.0090, test_loss: 1.2761, test_f1: 0.4983
 epoch: 59, train_loss: 1.0040, test_loss: 1.3046, test_f1: 0.4934
 epoch: 60, train_loss: 1.0203, test_loss: 1.2765, test_f1: 0.4853
 epoch: 61, train_loss: 0.9890, test_loss: 1.2523, test_f1: 0.4817
 epoch: 62, train_loss: 1.0193, test_loss: 1.2448, test_f1: 0.5080
 epoch: 63, train_loss: 1.0034, test_loss: 1.2395, test_f1: 0.5023
 epoch: 64, train_loss: 1.0112, test_loss: 1.2777, test_f1: 0.5077
 epoch: 65, train_loss: 0.9937, test_loss: 1.2524, test_f1: 0.4993
 epoch: 66, train_loss: 0.9963, test_loss: 1.2635, test_f1: 0.5130
 epoch: 67, train_loss: 0.9880, test_loss: 1.2401, test_f1: 0.5130
 epoch: 68, train_loss: 0.9918, test_loss: 1.2423, test_f1: 0.5140
 epoch: 69, train_loss: 0.9898, test_loss: 1.2686, test_f1: 0.5114
 epoch: 70, train_loss: 0.9991, test_loss: 1.2331, test_f1: 0.5201
 epoch: 71, train_loss: 0.9977, test_loss: 1.2239, test_f1: 0.5099
 epoch: 72, train_loss: 0.9930, test_loss: 1.2244, test_f1: 0.5052
 epoch: 73, train_loss: 0.9824, test_loss: 1.2187, test_f1: 0.5232
 epoch: 74, train_loss: 0.9738, test_loss: 1.2764, test_f1: 0.5139
 epoch: 75, train_loss: 0.9896, test_loss: 1.2430, test_f1: 0.5081
 epoch: 76, train_loss: 0.9825, test_loss: 1.2275, test_f1: 0.4907
 epoch: 77, train_loss: 0.9866, test_loss: 1.2322, test_f1: 0.4993
 epoch: 78, train_loss: 0.9837, test_loss: 1.2380, test_f1: 0.4680
 epoch: 79, train_loss: 0.9703, test_loss: 1.2365, test_f1: 0.4777
 epoch: 80, train_loss: 0.9818, test_loss: 1.2412, test_f1: 0.5044
 epoch: 81, train_loss: 0.9819, test_loss: 1.2619, test_f1: 0.5098
 epoch: 82, train_loss: 0.9920, test_loss: 1.2478, test_f1: 0.4927
 epoch: 83, train_loss: 0.9766, test_loss: 1.2491, test_f1: 0.5008
 epoch: 84, train_loss: 0.9716, test_loss: 1.2489, test_f1: 0.4979
 epoch: 85, train_loss: 0.9842, test_loss: 1.2582, test_f1: 0.5024
 epoch: 86, train_loss: 0.9691, test_loss: 1.2358, test_f1: 0.4865
 epoch: 87, train_loss: 0.9746, test_loss: 1.2534, test_f1: 0.4833
 epoch: 88, train_loss: 0.9641, test_loss: 1.2302, test_f1: 0.4997
 epoch: 89, train_loss: 0.9695, test_loss: 1.2479, test_f1: 0.4980
 epoch: 90, train_loss: 0.9617, test_loss: 1.2660, test_f1: 0.4798
 epoch: 91, train_loss: 0.9783, test_loss: 1.2994, test_f1: 0.4772
 epoch: 92, train_loss: 0.9804, test_loss: 1.2854, test_f1: 0.4768
 epoch: 93, train_loss: 0.9598, test_loss: 1.2733, test_f1: 0.4837
 epoch: 94, train_loss: 0.9560, test_loss: 1.2595, test_f1: 0.4781
 epoch: 95, train_loss: 0.9660, test_loss: 1.2397, test_f1: 0.4973
 epoch: 96, train_loss: 0.9567, test_loss: 1.2494, test_f1: 0.4894
 epoch: 97, train_loss: 0.9696, test_loss: 1.2450, test_f1: 0.5014
 epoch: 98, train_loss: 0.9554, test_loss: 1.2434, test_f1: 0.4958
 epoch: 99, train_loss: 0.9632, test_loss: 1.2423, test_f1: 0.5113
##################ITERATION #8 ****************************************
 epoch: 0, train_loss: 1.2838, test_loss: 1.3083, test_f1: 0.2281
 epoch: 1, train_loss: 1.2435, test_loss: 1.3135, test_f1: 0.2590
 epoch: 2, train_loss: 1.2303, test_loss: 1.3125, test_f1: 0.3099
 epoch: 3, train_loss: 1.2190, test_loss: 1.3044, test_f1: 0.3275
 epoch: 4, train_loss: 1.2086, test_loss: 1.2980, test_f1: 0.3361
 epoch: 5, train_loss: 1.2017, test_loss: 1.3091, test_f1: 0.3411
 epoch: 6, train_loss: 1.1926, test_loss: 1.3067, test_f1: 0.3573
 epoch: 7, train_loss: 1.1816, test_loss: 1.3079, test_f1: 0.3908
 epoch: 8, train_loss: 1.1804, test_loss: 1.3001, test_f1: 0.4026
 epoch: 9, train_loss: 1.1742, test_loss: 1.3083, test_f1: 0.3941
 epoch: 10, train_loss: 1.1741, test_loss: 1.3094, test_f1: 0.4016
 epoch: 11, train_loss: 1.1566, test_loss: 1.3309, test_f1: 0.4032
 epoch: 12, train_loss: 1.1593, test_loss: 1.3077, test_f1: 0.4042
 epoch: 13, train_loss: 1.1530, test_loss: 1.3130, test_f1: 0.4025
 epoch: 14, train_loss: 1.1450, test_loss: 1.3376, test_f1: 0.4203
 epoch: 15, train_loss: 1.1521, test_loss: 1.2935, test_f1: 0.4165
 epoch: 16, train_loss: 1.1373, test_loss: 1.3000, test_f1: 0.4068
 epoch: 17, train_loss: 1.1294, test_loss: 1.3140, test_f1: 0.4045
 epoch: 18, train_loss: 1.1252, test_loss: 1.2898, test_f1: 0.4045
 epoch: 19, train_loss: 1.1215, test_loss: 1.2924, test_f1: 0.4118
 epoch: 20, train_loss: 1.1184, test_loss: 1.2862, test_f1: 0.4171
 epoch: 21, train_loss: 1.1209, test_loss: 1.2899, test_f1: 0.4155
 epoch: 22, train_loss: 1.1058, test_loss: 1.3188, test_f1: 0.4074
 epoch: 23, train_loss: 1.1129, test_loss: 1.3024, test_f1: 0.4293
 epoch: 24, train_loss: 1.1112, test_loss: 1.3019, test_f1: 0.4354
 epoch: 25, train_loss: 1.1013, test_loss: 1.3043, test_f1: 0.4441
 epoch: 26, train_loss: 1.0991, test_loss: 1.2859, test_f1: 0.4330
 epoch: 27, train_loss: 1.0964, test_loss: 1.2942, test_f1: 0.4533
 epoch: 28, train_loss: 1.0971, test_loss: 1.2879, test_f1: 0.4504
 epoch: 29, train_loss: 1.0847, test_loss: 1.2849, test_f1: 0.4554
 epoch: 30, train_loss: 1.0795, test_loss: 1.2858, test_f1: 0.4501
 epoch: 31, train_loss: 1.0859, test_loss: 1.2600, test_f1: 0.4508
 epoch: 32, train_loss: 1.0900, test_loss: 1.2719, test_f1: 0.4503
 epoch: 33, train_loss: 1.0889, test_loss: 1.2791, test_f1: 0.4563
 epoch: 34, train_loss: 1.0786, test_loss: 1.2751, test_f1: 0.4465
 epoch: 35, train_loss: 1.0586, test_loss: 1.2814, test_f1: 0.4621
 epoch: 36, train_loss: 1.0572, test_loss: 1.2885, test_f1: 0.4734
 epoch: 37, train_loss: 1.0638, test_loss: 1.2847, test_f1: 0.4682
 epoch: 38, train_loss: 1.0582, test_loss: 1.2862, test_f1: 0.4878
 epoch: 39, train_loss: 1.0589, test_loss: 1.2858, test_f1: 0.4781
 epoch: 40, train_loss: 1.0659, test_loss: 1.2906, test_f1: 0.5131
 epoch: 41, train_loss: 1.0573, test_loss: 1.3012, test_f1: 0.5135
 epoch: 42, train_loss: 1.0696, test_loss: 1.2865, test_f1: 0.4895
 epoch: 43, train_loss: 1.0508, test_loss: 1.2780, test_f1: 0.4697
 epoch: 44, train_loss: 1.0555, test_loss: 1.2775, test_f1: 0.5122
 epoch: 45, train_loss: 1.0358, test_loss: 1.2842, test_f1: 0.5181
 epoch: 46, train_loss: 1.0380, test_loss: 1.2729, test_f1: 0.5007
 epoch: 47, train_loss: 1.0283, test_loss: 1.2723, test_f1: 0.5064
 epoch: 48, train_loss: 1.0429, test_loss: 1.2873, test_f1: 0.5210
 epoch: 49, train_loss: 1.0391, test_loss: 1.2890, test_f1: 0.4998
 epoch: 50, train_loss: 1.0304, test_loss: 1.2761, test_f1: 0.5201
 epoch: 51, train_loss: 1.0268, test_loss: 1.2835, test_f1: 0.5314
 epoch: 52, train_loss: 1.0279, test_loss: 1.2899, test_f1: 0.5155
 epoch: 53, train_loss: 1.0238, test_loss: 1.2889, test_f1: 0.5099
 epoch: 54, train_loss: 1.0245, test_loss: 1.2844, test_f1: 0.5105
 epoch: 55, train_loss: 1.0283, test_loss: 1.2761, test_f1: 0.5175
 epoch: 56, train_loss: 1.0266, test_loss: 1.2762, test_f1: 0.5084
 epoch: 57, train_loss: 1.0361, test_loss: 1.2727, test_f1: 0.5097
 epoch: 58, train_loss: 1.0185, test_loss: 1.2765, test_f1: 0.5167
 epoch: 59, train_loss: 1.0229, test_loss: 1.2787, test_f1: 0.5212
 epoch: 60, train_loss: 1.0103, test_loss: 1.2899, test_f1: 0.5112
 epoch: 61, train_loss: 1.0360, test_loss: 1.2843, test_f1: 0.5036
 epoch: 62, train_loss: 1.0202, test_loss: 1.2830, test_f1: 0.5284
 epoch: 63, train_loss: 1.0082, test_loss: 1.2983, test_f1: 0.5277
 epoch: 64, train_loss: 1.0250, test_loss: 1.3045, test_f1: 0.5312
 epoch: 65, train_loss: 1.0034, test_loss: 1.2873, test_f1: 0.5134
 epoch: 66, train_loss: 1.0049, test_loss: 1.2801, test_f1: 0.5321
 epoch: 67, train_loss: 1.0069, test_loss: 1.2805, test_f1: 0.5402
 epoch: 68, train_loss: 1.0216, test_loss: 1.2930, test_f1: 0.5422
 epoch: 69, train_loss: 1.0039, test_loss: 1.2992, test_f1: 0.5170
 epoch: 70, train_loss: 1.0047, test_loss: 1.2865, test_f1: 0.5329
 epoch: 71, train_loss: 1.0079, test_loss: 1.2871, test_f1: 0.5191
 epoch: 72, train_loss: 1.0128, test_loss: 1.2862, test_f1: 0.5147
 epoch: 73, train_loss: 1.0044, test_loss: 1.2786, test_f1: 0.5139
 epoch: 74, train_loss: 0.9970, test_loss: 1.2834, test_f1: 0.5186
 epoch: 75, train_loss: 1.0052, test_loss: 1.2959, test_f1: 0.5137
 epoch: 76, train_loss: 0.9816, test_loss: 1.2956, test_f1: 0.5160
 epoch: 77, train_loss: 1.0009, test_loss: 1.2779, test_f1: 0.5243
 epoch: 78, train_loss: 1.0037, test_loss: 1.3028, test_f1: 0.5239
 epoch: 79, train_loss: 0.9914, test_loss: 1.3015, test_f1: 0.5432
 epoch: 80, train_loss: 0.9873, test_loss: 1.2932, test_f1: 0.5376
 epoch: 81, train_loss: 0.9882, test_loss: 1.2994, test_f1: 0.5124
 epoch: 82, train_loss: 1.0021, test_loss: 1.2985, test_f1: 0.5239
 epoch: 83, train_loss: 0.9913, test_loss: 1.2984, test_f1: 0.5205
 epoch: 84, train_loss: 0.9794, test_loss: 1.2780, test_f1: 0.5200
 epoch: 85, train_loss: 1.0043, test_loss: 1.3153, test_f1: 0.5296
 epoch: 86, train_loss: 0.9738, test_loss: 1.2832, test_f1: 0.5232
 epoch: 87, train_loss: 0.9742, test_loss: 1.2913, test_f1: 0.5234
 epoch: 88, train_loss: 0.9861, test_loss: 1.2942, test_f1: 0.5501
 epoch: 89, train_loss: 0.9707, test_loss: 1.2919, test_f1: 0.5213
 epoch: 90, train_loss: 0.9805, test_loss: 1.3078, test_f1: 0.5305
 epoch: 91, train_loss: 0.9845, test_loss: 1.3029, test_f1: 0.5279
 epoch: 92, train_loss: 0.9798, test_loss: 1.2929, test_f1: 0.5491
 epoch: 93, train_loss: 0.9843, test_loss: 1.3250, test_f1: 0.5334
 epoch: 94, train_loss: 0.9946, test_loss: 1.3156, test_f1: 0.5347
 epoch: 95, train_loss: 0.9804, test_loss: 1.2970, test_f1: 0.5290
 epoch: 96, train_loss: 0.9612, test_loss: 1.3041, test_f1: 0.5332
 epoch: 97, train_loss: 0.9827, test_loss: 1.3125, test_f1: 0.5424
 epoch: 98, train_loss: 0.9864, test_loss: 1.3231, test_f1: 0.5198
 epoch: 99, train_loss: 0.9787, test_loss: 1.3044, test_f1: 0.5259
##################ITERATION #9 ****************************************
 epoch: 0, train_loss: 1.3212, test_loss: 1.3434, test_f1: 0.2391
 epoch: 1, train_loss: 1.2773, test_loss: 1.3027, test_f1: 0.2259
 epoch: 2, train_loss: 1.2702, test_loss: 1.2955, test_f1: 0.2313
 epoch: 3, train_loss: 1.2439, test_loss: 1.2927, test_f1: 0.2336
 epoch: 4, train_loss: 1.2144, test_loss: 1.2849, test_f1: 0.2497
 epoch: 5, train_loss: 1.2212, test_loss: 1.2735, test_f1: 0.2606
 epoch: 6, train_loss: 1.2167, test_loss: 1.2783, test_f1: 0.2811
 epoch: 7, train_loss: 1.2096, test_loss: 1.2704, test_f1: 0.2816
 epoch: 8, train_loss: 1.2042, test_loss: 1.2454, test_f1: 0.3078
 epoch: 9, train_loss: 1.1839, test_loss: 1.2671, test_f1: 0.3411
 epoch: 10, train_loss: 1.1846, test_loss: 1.2339, test_f1: 0.3548
 epoch: 11, train_loss: 1.1803, test_loss: 1.2259, test_f1: 0.4032
 epoch: 12, train_loss: 1.1764, test_loss: 1.2093, test_f1: 0.4080
 epoch: 13, train_loss: 1.1718, test_loss: 1.2102, test_f1: 0.4086
 epoch: 14, train_loss: 1.1623, test_loss: 1.2186, test_f1: 0.4560
 epoch: 15, train_loss: 1.1570, test_loss: 1.1974, test_f1: 0.4185
 epoch: 16, train_loss: 1.1547, test_loss: 1.2134, test_f1: 0.4356
 epoch: 17, train_loss: 1.1425, test_loss: 1.1985, test_f1: 0.4209
 epoch: 18, train_loss: 1.1351, test_loss: 1.1869, test_f1: 0.4159
 epoch: 19, train_loss: 1.1355, test_loss: 1.1981, test_f1: 0.4389
 epoch: 20, train_loss: 1.1267, test_loss: 1.2002, test_f1: 0.4374
 epoch: 21, train_loss: 1.1266, test_loss: 1.1903, test_f1: 0.4404
 epoch: 22, train_loss: 1.1144, test_loss: 1.1812, test_f1: 0.4522
 epoch: 23, train_loss: 1.1218, test_loss: 1.1840, test_f1: 0.4639
 epoch: 24, train_loss: 1.1070, test_loss: 1.1735, test_f1: 0.4351
 epoch: 25, train_loss: 1.1047, test_loss: 1.1764, test_f1: 0.4452
 epoch: 26, train_loss: 1.1041, test_loss: 1.1746, test_f1: 0.4466
 epoch: 27, train_loss: 1.1031, test_loss: 1.1865, test_f1: 0.4695
 epoch: 28, train_loss: 1.0965, test_loss: 1.1869, test_f1: 0.4724
 epoch: 29, train_loss: 1.0869, test_loss: 1.1711, test_f1: 0.4752
 epoch: 30, train_loss: 1.0779, test_loss: 1.1768, test_f1: 0.4762
 epoch: 31, train_loss: 1.0705, test_loss: 1.1725, test_f1: 0.4743
 epoch: 32, train_loss: 1.0788, test_loss: 1.1769, test_f1: 0.4669
 epoch: 33, train_loss: 1.0693, test_loss: 1.1666, test_f1: 0.4509
 epoch: 34, train_loss: 1.0609, test_loss: 1.1754, test_f1: 0.4349
 epoch: 35, train_loss: 1.0682, test_loss: 1.1661, test_f1: 0.4578
 epoch: 36, train_loss: 1.0586, test_loss: 1.1807, test_f1: 0.4610
 epoch: 37, train_loss: 1.0639, test_loss: 1.1804, test_f1: 0.4534
 epoch: 38, train_loss: 1.0588, test_loss: 1.1730, test_f1: 0.4634
 epoch: 39, train_loss: 1.0475, test_loss: 1.1731, test_f1: 0.4605
 epoch: 40, train_loss: 1.0519, test_loss: 1.1688, test_f1: 0.4682
 epoch: 41, train_loss: 1.0403, test_loss: 1.1755, test_f1: 0.4561
 epoch: 42, train_loss: 1.0332, test_loss: 1.1618, test_f1: 0.4625
 epoch: 43, train_loss: 1.0432, test_loss: 1.1645, test_f1: 0.4605
 epoch: 44, train_loss: 1.0225, test_loss: 1.2079, test_f1: 0.4458
 epoch: 45, train_loss: 1.0272, test_loss: 1.2366, test_f1: 0.4688
 epoch: 46, train_loss: 1.0493, test_loss: 1.1733, test_f1: 0.4402
 epoch: 47, train_loss: 1.0360, test_loss: 1.1653, test_f1: 0.4658
 epoch: 48, train_loss: 1.0329, test_loss: 1.2409, test_f1: 0.4623
 epoch: 49, train_loss: 1.0204, test_loss: 1.1665, test_f1: 0.4572
 epoch: 50, train_loss: 1.0241, test_loss: 1.1729, test_f1: 0.4568
 epoch: 51, train_loss: 1.0214, test_loss: 1.2021, test_f1: 0.4522
 epoch: 52, train_loss: 1.0182, test_loss: 1.2236, test_f1: 0.4528
 epoch: 53, train_loss: 0.9984, test_loss: 1.2041, test_f1: 0.4525
 epoch: 54, train_loss: 1.0128, test_loss: 1.2048, test_f1: 0.4495
 epoch: 55, train_loss: 1.0116, test_loss: 1.1701, test_f1: 0.4574
 epoch: 56, train_loss: 1.0117, test_loss: 1.1748, test_f1: 0.4686
 epoch: 57, train_loss: 0.9982, test_loss: 1.2125, test_f1: 0.4409
 epoch: 58, train_loss: 0.9903, test_loss: 1.1679, test_f1: 0.4548
 epoch: 59, train_loss: 0.9875, test_loss: 1.1843, test_f1: 0.4733
 epoch: 60, train_loss: 0.9978, test_loss: 1.2311, test_f1: 0.4760
 epoch: 61, train_loss: 0.9954, test_loss: 1.1679, test_f1: 0.4710
 epoch: 62, train_loss: 0.9956, test_loss: 1.1716, test_f1: 0.4699
 epoch: 63, train_loss: 0.9956, test_loss: 1.2031, test_f1: 0.4877
 epoch: 64, train_loss: 0.9966, test_loss: 1.2118, test_f1: 0.4498
 epoch: 65, train_loss: 0.9994, test_loss: 1.1934, test_f1: 0.4701
 epoch: 66, train_loss: 0.9855, test_loss: 1.2090, test_f1: 0.4468
 epoch: 67, train_loss: 0.9743, test_loss: 1.1818, test_f1: 0.4552
 epoch: 68, train_loss: 0.9599, test_loss: 1.1792, test_f1: 0.4771
 epoch: 69, train_loss: 0.9988, test_loss: 1.2297, test_f1: 0.4642
 epoch: 70, train_loss: 0.9885, test_loss: 1.2029, test_f1: 0.4452
 epoch: 71, train_loss: 0.9888, test_loss: 1.1707, test_f1: 0.4617
 epoch: 72, train_loss: 0.9941, test_loss: 1.2151, test_f1: 0.4822
 epoch: 73, train_loss: 0.9777, test_loss: 1.1786, test_f1: 0.4726
 epoch: 74, train_loss: 0.9699, test_loss: 1.2216, test_f1: 0.4578
 epoch: 75, train_loss: 0.9754, test_loss: 1.2200, test_f1: 0.4767
 epoch: 76, train_loss: 0.9712, test_loss: 1.1859, test_f1: 0.4951
 epoch: 77, train_loss: 0.9729, test_loss: 1.2373, test_f1: 0.4851
 epoch: 78, train_loss: 0.9971, test_loss: 1.2559, test_f1: 0.4516
 epoch: 79, train_loss: 0.9868, test_loss: 1.1962, test_f1: 0.4566
 epoch: 80, train_loss: 0.9753, test_loss: 1.1943, test_f1: 0.4743
 epoch: 81, train_loss: 0.9720, test_loss: 1.2063, test_f1: 0.4599
 epoch: 82, train_loss: 0.9640, test_loss: 1.1775, test_f1: 0.4665
 epoch: 83, train_loss: 0.9571, test_loss: 1.1901, test_f1: 0.4641
 epoch: 84, train_loss: 0.9681, test_loss: 1.2370, test_f1: 0.4738
 epoch: 85, train_loss: 0.9782, test_loss: 1.3937, test_f1: 0.4770
 epoch: 86, train_loss: 0.9687, test_loss: 1.2273, test_f1: 0.4624
 epoch: 87, train_loss: 0.9510, test_loss: 1.2703, test_f1: 0.4592
 epoch: 88, train_loss: 0.9578, test_loss: 1.2994, test_f1: 0.4713
 epoch: 89, train_loss: 0.9484, test_loss: 1.3690, test_f1: 0.4869
 epoch: 90, train_loss: 0.9574, test_loss: 1.2131, test_f1: 0.4731
 epoch: 91, train_loss: 0.9598, test_loss: 1.3274, test_f1: 0.4969
 epoch: 92, train_loss: 0.9532, test_loss: 1.3453, test_f1: 0.4894
 epoch: 93, train_loss: 0.9382, test_loss: 1.3673, test_f1: 0.4921
 epoch: 94, train_loss: 0.9639, test_loss: 1.2895, test_f1: 0.4761
 epoch: 95, train_loss: 0.9595, test_loss: 1.2753, test_f1: 0.4692
 epoch: 96, train_loss: 0.9513, test_loss: 1.3534, test_f1: 0.4976
 epoch: 97, train_loss: 0.9300, test_loss: 1.2493, test_f1: 0.4776
 epoch: 98, train_loss: 0.9559, test_loss: 1.3197, test_f1: 0.4843
 epoch: 99, train_loss: 0.9411, test_loss: 1.3600, test_f1: 0.4700

Training completed in 663.25 seconds
Best F1: 0.5501 at epoch 88
Mean F1 across iterations: 0.4962  0.0339
========================FINAL RESULTS================================
FEGIN weighted F1: 0.5501  0.0339
python main.py --data ltspice_demos --representation component_component --model FEGIN --layers 4 --hiddens 32 --batch_size 32 --lr 0.0001 --emb_size 250 --epochs 100 --save_appendix component_component_L4_H32_BS32_LR0.0001_E250 --no_val
-----



STDERR:
  File "main.py", line 370, in <module>
    main()
  File "main.py", line 254, in main
    dataset = dataset_class(
  File "/home/philip/projects/ltspice_examples_code_repo/Circuit-Completion-Using-GNNs/component_classification_with_link_prediction_head/evaluation/FEGIN/kernel/circuit_datasets.py", line 15, in __init__
    self.data, self.slices = torch.load(self.processed_paths[0])
  File "/home/philip/.local/lib/python3.8/site-packages/torch/serialization.py", line 1040, in load
    warnings.warn(
  File "/usr/lib/python3.8/warnings.py", line 109, in _showwarnmsg
    sw(msg.message, msg.category, msg.filename, msg.lineno,
  File "main.py", line 47, in warn_with_traceback
    traceback.print_stack(file=log)
/home/philip/projects/ltspice_examples_code_repo/Circuit-Completion-Using-GNNs/component_classification_with_link_prediction_head/evaluation/FEGIN/kernel/circuit_datasets.py:15: FutureWarning: You are using `torch.load` with `weights_only=False` (the current default value), which uses the default pickle module implicitly. It is possible to construct malicious pickle data which will execute arbitrary code during unpickling (See https://github.com/pytorch/pytorch/blob/main/SECURITY.md#untrusted-models for more details). In a future release, the default value for `weights_only` will be flipped to `True`. This limits the functions that could be executed during unpickling. Arbitrary objects will no longer be allowed to be loaded via this mode unless they are explicitly allowlisted by the user via `torch.serialization.add_safe_globals`. We recommend you start setting `weights_only=True` for any use case where you don't have full control of the loaded file. Please open an issue on GitHub for any issues related to this experimental feature.
  self.data, self.slices = torch.load(self.processed_paths[0])
