STDOUT:
Results will be saved in /home/philip/projects/ltspice_examples_code_repo/Circuit-Completion-Using-GNNs/component_classification_with_link_prediction_head/evaluation/FEGIN/results/model_FEGIN_dataset_ltspice_demos
Command line input: python main.py --data ltspice_demos --representation component_net --model FEGIN --layers 5 --hiddens 128 --batch_size 64 --lr 0.0001 --emb_size 128 --epochs 100 --save_appendix component_net_L5_H128_BS64_LR0.0001_E128 --no_val
 is saved.
-----
ltspice_demos - FEGIN
Using 5 layers, 128 hidden units, h = 2
Loading component_net representation dataset
ENTERED
Training FEGIN on component_net representation
Train: 1565, Test: 383
##################ITERATION #0 ****************************************
 epoch: 0, train_loss: 1.3520, test_loss: 1.3653, test_f1: 0.2281
 epoch: 1, train_loss: 1.3021, test_loss: 1.3425, test_f1: 0.2281
 epoch: 2, train_loss: 1.2529, test_loss: 1.2749, test_f1: 0.2440
 epoch: 3, train_loss: 1.2018, test_loss: 1.2252, test_f1: 0.2734
 epoch: 4, train_loss: 1.1640, test_loss: 1.1991, test_f1: 0.2718
 epoch: 5, train_loss: 1.1371, test_loss: 1.1892, test_f1: 0.3165
 epoch: 6, train_loss: 1.1244, test_loss: 1.1788, test_f1: 0.3237
 epoch: 7, train_loss: 1.1065, test_loss: 1.1538, test_f1: 0.3348
 epoch: 8, train_loss: 1.0988, test_loss: 1.1592, test_f1: 0.3331
 epoch: 9, train_loss: 1.0812, test_loss: 1.1320, test_f1: 0.3505
 epoch: 10, train_loss: 1.0660, test_loss: 1.1306, test_f1: 0.4207
 epoch: 11, train_loss: 1.0552, test_loss: 1.1098, test_f1: 0.4826
 epoch: 12, train_loss: 1.0365, test_loss: 1.0858, test_f1: 0.4974
 epoch: 13, train_loss: 1.0237, test_loss: 1.0543, test_f1: 0.5202
 epoch: 14, train_loss: 1.0096, test_loss: 1.1151, test_f1: 0.5318
 epoch: 15, train_loss: 0.9836, test_loss: 1.0464, test_f1: 0.5253
 epoch: 16, train_loss: 0.9711, test_loss: 1.0196, test_f1: 0.5358
 epoch: 17, train_loss: 0.9548, test_loss: 1.0422, test_f1: 0.5278
 epoch: 18, train_loss: 0.9274, test_loss: 1.0483, test_f1: 0.5579
 epoch: 19, train_loss: 0.9152, test_loss: 1.0239, test_f1: 0.5340
 epoch: 20, train_loss: 0.9069, test_loss: 1.0236, test_f1: 0.5432
 epoch: 21, train_loss: 0.8891, test_loss: 0.9737, test_f1: 0.5615
 epoch: 22, train_loss: 0.8697, test_loss: 1.0192, test_f1: 0.5479
 epoch: 23, train_loss: 0.8613, test_loss: 1.0035, test_f1: 0.5803
 epoch: 24, train_loss: 0.8426, test_loss: 1.0415, test_f1: 0.5699
 epoch: 25, train_loss: 0.8290, test_loss: 1.0230, test_f1: 0.5516
 epoch: 26, train_loss: 0.8190, test_loss: 1.0088, test_f1: 0.5447
 epoch: 27, train_loss: 0.8192, test_loss: 1.0226, test_f1: 0.5618
 epoch: 28, train_loss: 0.8002, test_loss: 0.9844, test_f1: 0.5622
 epoch: 29, train_loss: 0.7966, test_loss: 1.0539, test_f1: 0.5647
 epoch: 30, train_loss: 0.7852, test_loss: 1.1584, test_f1: 0.5512
 epoch: 31, train_loss: 0.7647, test_loss: 1.0929, test_f1: 0.5699
 epoch: 32, train_loss: 0.7592, test_loss: 1.0428, test_f1: 0.5687
 epoch: 33, train_loss: 0.7671, test_loss: 1.0845, test_f1: 0.5849
 epoch: 34, train_loss: 0.7504, test_loss: 1.0412, test_f1: 0.5771
 epoch: 35, train_loss: 0.7462, test_loss: 1.0602, test_f1: 0.5803
 epoch: 36, train_loss: 0.7345, test_loss: 1.1537, test_f1: 0.5662
 epoch: 37, train_loss: 0.7272, test_loss: 1.1529, test_f1: 0.5659
 epoch: 38, train_loss: 0.7349, test_loss: 1.1713, test_f1: 0.5561
 epoch: 39, train_loss: 0.7130, test_loss: 1.0931, test_f1: 0.5724
 epoch: 40, train_loss: 0.7269, test_loss: 1.1402, test_f1: 0.5560
 epoch: 41, train_loss: 0.7151, test_loss: 1.1393, test_f1: 0.5651
 epoch: 42, train_loss: 0.6835, test_loss: 1.1777, test_f1: 0.5764
 epoch: 43, train_loss: 0.6909, test_loss: 1.1807, test_f1: 0.5688
 epoch: 44, train_loss: 0.6821, test_loss: 1.1649, test_f1: 0.5676
 epoch: 45, train_loss: 0.6929, test_loss: 1.1927, test_f1: 0.5765
 epoch: 46, train_loss: 0.6824, test_loss: 1.2442, test_f1: 0.5490
 epoch: 47, train_loss: 0.6889, test_loss: 1.3082, test_f1: 0.5390
 epoch: 48, train_loss: 0.6781, test_loss: 1.1333, test_f1: 0.5480
 epoch: 49, train_loss: 0.6589, test_loss: 1.2197, test_f1: 0.5661
 epoch: 50, train_loss: 0.6553, test_loss: 1.1740, test_f1: 0.5713
 epoch: 51, train_loss: 0.6323, test_loss: 1.1915, test_f1: 0.5847
 epoch: 52, train_loss: 0.6260, test_loss: 1.2320, test_f1: 0.5651
 epoch: 53, train_loss: 0.6291, test_loss: 1.2176, test_f1: 0.5908
 epoch: 54, train_loss: 0.6280, test_loss: 1.1743, test_f1: 0.5824
 epoch: 55, train_loss: 0.6106, test_loss: 1.2190, test_f1: 0.5769
 epoch: 56, train_loss: 0.6044, test_loss: 1.2450, test_f1: 0.5785
 epoch: 57, train_loss: 0.6319, test_loss: 1.2481, test_f1: 0.5749
 epoch: 58, train_loss: 0.6094, test_loss: 1.2783, test_f1: 0.5789
 epoch: 59, train_loss: 0.6053, test_loss: 1.2845, test_f1: 0.5813
 epoch: 60, train_loss: 0.5979, test_loss: 1.2845, test_f1: 0.5777
 epoch: 61, train_loss: 0.6115, test_loss: 1.2362, test_f1: 0.5766
 epoch: 62, train_loss: 0.6050, test_loss: 1.3180, test_f1: 0.5642
 epoch: 63, train_loss: 0.6028, test_loss: 1.3026, test_f1: 0.5715
 epoch: 64, train_loss: 0.5880, test_loss: 1.2430, test_f1: 0.5770
 epoch: 65, train_loss: 0.5899, test_loss: 1.2898, test_f1: 0.5590
 epoch: 66, train_loss: 0.5912, test_loss: 1.3023, test_f1: 0.5740
 epoch: 67, train_loss: 0.5594, test_loss: 1.3356, test_f1: 0.5769
 epoch: 68, train_loss: 0.5680, test_loss: 1.3225, test_f1: 0.5843
 epoch: 69, train_loss: 0.5774, test_loss: 1.3434, test_f1: 0.5562
 epoch: 70, train_loss: 0.5666, test_loss: 1.3095, test_f1: 0.5671
 epoch: 71, train_loss: 0.5749, test_loss: 1.3623, test_f1: 0.5770
 epoch: 72, train_loss: 0.5812, test_loss: 1.3277, test_f1: 0.5764
 epoch: 73, train_loss: 0.5515, test_loss: 1.3649, test_f1: 0.5910
 epoch: 74, train_loss: 0.5668, test_loss: 1.3856, test_f1: 0.5671
 epoch: 75, train_loss: 0.5598, test_loss: 1.2838, test_f1: 0.5854
 epoch: 76, train_loss: 0.5670, test_loss: 1.4207, test_f1: 0.5588
 epoch: 77, train_loss: 0.5599, test_loss: 1.3153, test_f1: 0.5772
 epoch: 78, train_loss: 0.5592, test_loss: 1.3750, test_f1: 0.5622
 epoch: 79, train_loss: 0.5446, test_loss: 1.3511, test_f1: 0.5762
 epoch: 80, train_loss: 0.5537, test_loss: 1.4299, test_f1: 0.5750
 epoch: 81, train_loss: 0.5411, test_loss: 1.3755, test_f1: 0.5836
 epoch: 82, train_loss: 0.5565, test_loss: 1.3588, test_f1: 0.5926
 epoch: 83, train_loss: 0.5420, test_loss: 1.4036, test_f1: 0.5688
 epoch: 84, train_loss: 0.5461, test_loss: 1.3993, test_f1: 0.5813
 epoch: 85, train_loss: 0.5363, test_loss: 1.4837, test_f1: 0.5714
 epoch: 86, train_loss: 0.5284, test_loss: 1.4456, test_f1: 0.5717
 epoch: 87, train_loss: 0.5338, test_loss: 1.4369, test_f1: 0.5569
 epoch: 88, train_loss: 0.5355, test_loss: 1.5126, test_f1: 0.5882
 epoch: 89, train_loss: 0.5315, test_loss: 1.4423, test_f1: 0.5958
 epoch: 90, train_loss: 0.5213, test_loss: 1.4184, test_f1: 0.5645
 epoch: 91, train_loss: 0.5367, test_loss: 1.4626, test_f1: 0.5695
 epoch: 92, train_loss: 0.5422, test_loss: 1.4522, test_f1: 0.5600
 epoch: 93, train_loss: 0.5262, test_loss: 1.5021, test_f1: 0.5864
 epoch: 94, train_loss: 0.5162, test_loss: 1.4657, test_f1: 0.5774
 epoch: 95, train_loss: 0.5190, test_loss: 1.4898, test_f1: 0.5875
 epoch: 96, train_loss: 0.5178, test_loss: 1.4850, test_f1: 0.5766
 epoch: 97, train_loss: 0.5033, test_loss: 1.5323, test_f1: 0.5679
 epoch: 98, train_loss: 0.4990, test_loss: 1.4822, test_f1: 0.5720
 epoch: 99, train_loss: 0.5132, test_loss: 1.4952, test_f1: 0.5704
##################ITERATION #1 ****************************************
 epoch: 0, train_loss: 1.2617, test_loss: 1.3366, test_f1: 0.2585
 epoch: 1, train_loss: 1.1627, test_loss: 1.2948, test_f1: 0.2696
 epoch: 2, train_loss: 1.1249, test_loss: 1.2079, test_f1: 0.4076
 epoch: 3, train_loss: 1.0919, test_loss: 1.1493, test_f1: 0.4337
 epoch: 4, train_loss: 1.0648, test_loss: 1.1159, test_f1: 0.4878
 epoch: 5, train_loss: 1.0325, test_loss: 1.0895, test_f1: 0.5191
 epoch: 6, train_loss: 1.0139, test_loss: 1.0914, test_f1: 0.5165
 epoch: 7, train_loss: 0.9932, test_loss: 1.0543, test_f1: 0.5356
 epoch: 8, train_loss: 0.9635, test_loss: 1.0542, test_f1: 0.5257
 epoch: 9, train_loss: 0.9502, test_loss: 1.0306, test_f1: 0.5397
 epoch: 10, train_loss: 0.9394, test_loss: 1.0314, test_f1: 0.5353
 epoch: 11, train_loss: 0.9172, test_loss: 1.0273, test_f1: 0.5476
 epoch: 12, train_loss: 0.8922, test_loss: 1.0480, test_f1: 0.5522
 epoch: 13, train_loss: 0.8908, test_loss: 1.0110, test_f1: 0.5576
 epoch: 14, train_loss: 0.8743, test_loss: 1.0110, test_f1: 0.5576
 epoch: 15, train_loss: 0.8620, test_loss: 1.0390, test_f1: 0.5577
 epoch: 16, train_loss: 0.8426, test_loss: 1.0236, test_f1: 0.5472
 epoch: 17, train_loss: 0.8341, test_loss: 1.0411, test_f1: 0.5701
 epoch: 18, train_loss: 0.8406, test_loss: 1.0158, test_f1: 0.5728
 epoch: 19, train_loss: 0.8165, test_loss: 1.0837, test_f1: 0.5650
 epoch: 20, train_loss: 0.8065, test_loss: 1.0639, test_f1: 0.5654
 epoch: 21, train_loss: 0.7881, test_loss: 1.0346, test_f1: 0.5812
 epoch: 22, train_loss: 0.7896, test_loss: 1.0635, test_f1: 0.5760
 epoch: 23, train_loss: 0.7790, test_loss: 1.1059, test_f1: 0.5878
 epoch: 24, train_loss: 0.7671, test_loss: 1.1398, test_f1: 0.5589
 epoch: 25, train_loss: 0.7704, test_loss: 1.0979, test_f1: 0.5920
 epoch: 26, train_loss: 0.7591, test_loss: 1.1664, test_f1: 0.5850
 epoch: 27, train_loss: 0.7547, test_loss: 1.1067, test_f1: 0.5796
 epoch: 28, train_loss: 0.7427, test_loss: 1.2097, test_f1: 0.5543
 epoch: 29, train_loss: 0.7291, test_loss: 1.2311, test_f1: 0.5525
 epoch: 30, train_loss: 0.7146, test_loss: 1.1781, test_f1: 0.5577
 epoch: 31, train_loss: 0.7123, test_loss: 1.1318, test_f1: 0.5758
 epoch: 32, train_loss: 0.7216, test_loss: 1.0834, test_f1: 0.5973
 epoch: 33, train_loss: 0.7193, test_loss: 1.1086, test_f1: 0.6058
 epoch: 34, train_loss: 0.7147, test_loss: 1.2251, test_f1: 0.5819
 epoch: 35, train_loss: 0.7030, test_loss: 1.2644, test_f1: 0.5546
 epoch: 36, train_loss: 0.6981, test_loss: 1.2056, test_f1: 0.5800
 epoch: 37, train_loss: 0.6919, test_loss: 1.1974, test_f1: 0.5675
 epoch: 38, train_loss: 0.6707, test_loss: 1.2070, test_f1: 0.5491
 epoch: 39, train_loss: 0.6691, test_loss: 1.2748, test_f1: 0.5578
 epoch: 40, train_loss: 0.6644, test_loss: 1.2151, test_f1: 0.5751
 epoch: 41, train_loss: 0.6685, test_loss: 1.3267, test_f1: 0.5750
 epoch: 42, train_loss: 0.6621, test_loss: 1.2269, test_f1: 0.5538
 epoch: 43, train_loss: 0.6429, test_loss: 1.3318, test_f1: 0.5656
 epoch: 44, train_loss: 0.6497, test_loss: 1.2990, test_f1: 0.5702
 epoch: 45, train_loss: 0.6113, test_loss: 1.2737, test_f1: 0.5594
 epoch: 46, train_loss: 0.6369, test_loss: 1.3233, test_f1: 0.5704
 epoch: 47, train_loss: 0.6295, test_loss: 1.2823, test_f1: 0.5869
 epoch: 48, train_loss: 0.6183, test_loss: 1.3754, test_f1: 0.5619
 epoch: 49, train_loss: 0.6053, test_loss: 1.3247, test_f1: 0.5827
 epoch: 50, train_loss: 0.6061, test_loss: 1.3744, test_f1: 0.5792
 epoch: 51, train_loss: 0.6026, test_loss: 1.4214, test_f1: 0.5800
 epoch: 52, train_loss: 0.5870, test_loss: 1.3058, test_f1: 0.5957
 epoch: 53, train_loss: 0.5727, test_loss: 1.3815, test_f1: 0.5811
 epoch: 54, train_loss: 0.5752, test_loss: 1.3795, test_f1: 0.5907
 epoch: 55, train_loss: 0.5803, test_loss: 1.4162, test_f1: 0.5869
 epoch: 56, train_loss: 0.5745, test_loss: 1.3991, test_f1: 0.5888
 epoch: 57, train_loss: 0.5760, test_loss: 1.4206, test_f1: 0.5909
 epoch: 58, train_loss: 0.5771, test_loss: 1.5137, test_f1: 0.5837
 epoch: 59, train_loss: 0.5567, test_loss: 1.4606, test_f1: 0.5838
 epoch: 60, train_loss: 0.5538, test_loss: 1.4447, test_f1: 0.5924
 epoch: 61, train_loss: 0.5592, test_loss: 1.4559, test_f1: 0.5978
 epoch: 62, train_loss: 0.5491, test_loss: 1.4958, test_f1: 0.5862
 epoch: 63, train_loss: 0.5459, test_loss: 1.4201, test_f1: 0.6041
 epoch: 64, train_loss: 0.5443, test_loss: 1.4832, test_f1: 0.5969
 epoch: 65, train_loss: 0.5314, test_loss: 1.5330, test_f1: 0.5782
 epoch: 66, train_loss: 0.5245, test_loss: 1.5212, test_f1: 0.6014
 epoch: 67, train_loss: 0.5217, test_loss: 1.5185, test_f1: 0.5948
 epoch: 68, train_loss: 0.5393, test_loss: 1.5399, test_f1: 0.5751
 epoch: 69, train_loss: 0.5311, test_loss: 1.5460, test_f1: 0.6058
 epoch: 70, train_loss: 0.5299, test_loss: 1.5889, test_f1: 0.5899
 epoch: 71, train_loss: 0.5148, test_loss: 1.5632, test_f1: 0.5788
 epoch: 72, train_loss: 0.5160, test_loss: 1.5513, test_f1: 0.5992
 epoch: 73, train_loss: 0.5281, test_loss: 1.5736, test_f1: 0.5758
 epoch: 74, train_loss: 0.5291, test_loss: 1.6660, test_f1: 0.5748
 epoch: 75, train_loss: 0.5107, test_loss: 1.5905, test_f1: 0.6090
 epoch: 76, train_loss: 0.5080, test_loss: 1.6604, test_f1: 0.5629
 epoch: 77, train_loss: 0.4957, test_loss: 1.6268, test_f1: 0.6008
 epoch: 78, train_loss: 0.4908, test_loss: 1.6194, test_f1: 0.5757
 epoch: 79, train_loss: 0.4972, test_loss: 1.7014, test_f1: 0.5810
 epoch: 80, train_loss: 0.5043, test_loss: 1.6152, test_f1: 0.5977
 epoch: 81, train_loss: 0.4919, test_loss: 1.6634, test_f1: 0.5856
 epoch: 82, train_loss: 0.4867, test_loss: 1.6986, test_f1: 0.6042
 epoch: 83, train_loss: 0.4880, test_loss: 1.6586, test_f1: 0.5705
 epoch: 84, train_loss: 0.4739, test_loss: 1.6367, test_f1: 0.5884
 epoch: 85, train_loss: 0.4712, test_loss: 1.6839, test_f1: 0.5934
 epoch: 86, train_loss: 0.4785, test_loss: 1.6940, test_f1: 0.6027
 epoch: 87, train_loss: 0.4810, test_loss: 1.6743, test_f1: 0.5941
 epoch: 88, train_loss: 0.4720, test_loss: 1.7031, test_f1: 0.5856
 epoch: 89, train_loss: 0.4656, test_loss: 1.6803, test_f1: 0.5921
 epoch: 90, train_loss: 0.4541, test_loss: 1.7066, test_f1: 0.5962
 epoch: 91, train_loss: 0.4525, test_loss: 1.7584, test_f1: 0.5812
 epoch: 92, train_loss: 0.4686, test_loss: 1.7110, test_f1: 0.5857
 epoch: 93, train_loss: 0.4478, test_loss: 1.7679, test_f1: 0.5974
 epoch: 94, train_loss: 0.4516, test_loss: 1.7730, test_f1: 0.5842
 epoch: 95, train_loss: 0.4543, test_loss: 1.7808, test_f1: 0.6033
 epoch: 96, train_loss: 0.4551, test_loss: 1.7592, test_f1: 0.5712
 epoch: 97, train_loss: 0.4504, test_loss: 1.7789, test_f1: 0.5787
 epoch: 98, train_loss: 0.4518, test_loss: 1.7274, test_f1: 0.5885
 epoch: 99, train_loss: 0.4389, test_loss: 1.8343, test_f1: 0.5701
##################ITERATION #2 ****************************************
 epoch: 0, train_loss: 1.2182, test_loss: 1.3058, test_f1: 0.2597
 epoch: 1, train_loss: 1.1205, test_loss: 1.2274, test_f1: 0.2777
 epoch: 2, train_loss: 1.0868, test_loss: 1.1708, test_f1: 0.3679
 epoch: 3, train_loss: 1.0569, test_loss: 1.1100, test_f1: 0.4803
 epoch: 4, train_loss: 1.0210, test_loss: 1.0993, test_f1: 0.5118
 epoch: 5, train_loss: 1.0012, test_loss: 1.0786, test_f1: 0.5313
 epoch: 6, train_loss: 0.9784, test_loss: 1.0792, test_f1: 0.5272
 epoch: 7, train_loss: 0.9687, test_loss: 1.0535, test_f1: 0.5336
 epoch: 8, train_loss: 0.9412, test_loss: 1.0457, test_f1: 0.5407
 epoch: 9, train_loss: 0.9268, test_loss: 1.0420, test_f1: 0.5503
 epoch: 10, train_loss: 0.9145, test_loss: 1.0401, test_f1: 0.5474
 epoch: 11, train_loss: 0.8933, test_loss: 1.0564, test_f1: 0.5439
 epoch: 12, train_loss: 0.8693, test_loss: 1.0433, test_f1: 0.5573
 epoch: 13, train_loss: 0.8751, test_loss: 1.0276, test_f1: 0.5640
 epoch: 14, train_loss: 0.8639, test_loss: 1.0514, test_f1: 0.5446
 epoch: 15, train_loss: 0.8432, test_loss: 1.0565, test_f1: 0.5514
 epoch: 16, train_loss: 0.8351, test_loss: 1.0522, test_f1: 0.5901
 epoch: 17, train_loss: 0.8262, test_loss: 1.0745, test_f1: 0.5718
 epoch: 18, train_loss: 0.8177, test_loss: 1.0703, test_f1: 0.5735
 epoch: 19, train_loss: 0.8204, test_loss: 1.0992, test_f1: 0.5672
 epoch: 20, train_loss: 0.8045, test_loss: 1.1125, test_f1: 0.5838
 epoch: 21, train_loss: 0.8031, test_loss: 1.1110, test_f1: 0.5697
 epoch: 22, train_loss: 0.7794, test_loss: 1.0850, test_f1: 0.5834
 epoch: 23, train_loss: 0.7742, test_loss: 1.0778, test_f1: 0.5924
 epoch: 24, train_loss: 0.7713, test_loss: 1.1435, test_f1: 0.5813
 epoch: 25, train_loss: 0.7620, test_loss: 1.1045, test_f1: 0.5824
 epoch: 26, train_loss: 0.7497, test_loss: 1.1638, test_f1: 0.5903
 epoch: 27, train_loss: 0.7399, test_loss: 1.1372, test_f1: 0.5851
 epoch: 28, train_loss: 0.7475, test_loss: 1.1741, test_f1: 0.5782
 epoch: 29, train_loss: 0.7486, test_loss: 1.2272, test_f1: 0.5749
 epoch: 30, train_loss: 0.7306, test_loss: 1.2288, test_f1: 0.5665
 epoch: 31, train_loss: 0.7241, test_loss: 1.1780, test_f1: 0.6117
 epoch: 32, train_loss: 0.7010, test_loss: 1.1978, test_f1: 0.6117
 epoch: 33, train_loss: 0.7125, test_loss: 1.2044, test_f1: 0.6090
 epoch: 34, train_loss: 0.6939, test_loss: 1.2373, test_f1: 0.6009
 epoch: 35, train_loss: 0.6962, test_loss: 1.2535, test_f1: 0.5914
 epoch: 36, train_loss: 0.7029, test_loss: 1.2391, test_f1: 0.6030
 epoch: 37, train_loss: 0.6915, test_loss: 1.3785, test_f1: 0.5749
 epoch: 38, train_loss: 0.6814, test_loss: 1.3349, test_f1: 0.5611
 epoch: 39, train_loss: 0.6676, test_loss: 1.2635, test_f1: 0.5848
 epoch: 40, train_loss: 0.6682, test_loss: 1.2722, test_f1: 0.6225
 epoch: 41, train_loss: 0.6612, test_loss: 1.3416, test_f1: 0.6071
 epoch: 42, train_loss: 0.6492, test_loss: 1.2978, test_f1: 0.5980
 epoch: 43, train_loss: 0.6571, test_loss: 1.3269, test_f1: 0.5876
 epoch: 44, train_loss: 0.6391, test_loss: 1.3500, test_f1: 0.5857
 epoch: 45, train_loss: 0.6320, test_loss: 1.3898, test_f1: 0.5807
 epoch: 46, train_loss: 0.6418, test_loss: 1.4451, test_f1: 0.5642
 epoch: 47, train_loss: 0.6431, test_loss: 1.3901, test_f1: 0.5651
 epoch: 48, train_loss: 0.6430, test_loss: 1.4127, test_f1: 0.6094
 epoch: 49, train_loss: 0.6206, test_loss: 1.4596, test_f1: 0.6153
 epoch: 50, train_loss: 0.6193, test_loss: 1.4783, test_f1: 0.5964
 epoch: 51, train_loss: 0.6017, test_loss: 1.4563, test_f1: 0.6010
 epoch: 52, train_loss: 0.6011, test_loss: 1.4296, test_f1: 0.5960
 epoch: 53, train_loss: 0.5944, test_loss: 1.4702, test_f1: 0.5917
 epoch: 54, train_loss: 0.5848, test_loss: 1.4694, test_f1: 0.5942
 epoch: 55, train_loss: 0.5769, test_loss: 1.4407, test_f1: 0.5817
 epoch: 56, train_loss: 0.5643, test_loss: 1.4765, test_f1: 0.5822
 epoch: 57, train_loss: 0.5723, test_loss: 1.4916, test_f1: 0.5854
 epoch: 58, train_loss: 0.5608, test_loss: 1.5652, test_f1: 0.5744
 epoch: 59, train_loss: 0.5584, test_loss: 1.4917, test_f1: 0.5934
 epoch: 60, train_loss: 0.5672, test_loss: 1.5209, test_f1: 0.5888
 epoch: 61, train_loss: 0.5691, test_loss: 1.5160, test_f1: 0.5836
 epoch: 62, train_loss: 0.5513, test_loss: 1.5185, test_f1: 0.5852
 epoch: 63, train_loss: 0.5645, test_loss: 1.5438, test_f1: 0.5885
 epoch: 64, train_loss: 0.5524, test_loss: 1.5451, test_f1: 0.5782
 epoch: 65, train_loss: 0.5479, test_loss: 1.5279, test_f1: 0.5876
 epoch: 66, train_loss: 0.5344, test_loss: 1.5682, test_f1: 0.5812
 epoch: 67, train_loss: 0.5516, test_loss: 1.5621, test_f1: 0.5871
 epoch: 68, train_loss: 0.5296, test_loss: 1.5477, test_f1: 0.5826
 epoch: 69, train_loss: 0.5313, test_loss: 1.5909, test_f1: 0.5940
 epoch: 70, train_loss: 0.5341, test_loss: 1.5722, test_f1: 0.5799
 epoch: 71, train_loss: 0.5206, test_loss: 1.6015, test_f1: 0.5715
 epoch: 72, train_loss: 0.5152, test_loss: 1.6643, test_f1: 0.5854
 epoch: 73, train_loss: 0.5428, test_loss: 1.6463, test_f1: 0.5733
 epoch: 74, train_loss: 0.5377, test_loss: 1.6465, test_f1: 0.5746
 epoch: 75, train_loss: 0.5166, test_loss: 1.6279, test_f1: 0.5917
 epoch: 76, train_loss: 0.5112, test_loss: 1.6188, test_f1: 0.5820
 epoch: 77, train_loss: 0.5116, test_loss: 1.6489, test_f1: 0.5630
 epoch: 78, train_loss: 0.5091, test_loss: 1.6629, test_f1: 0.5764
 epoch: 79, train_loss: 0.5230, test_loss: 1.6037, test_f1: 0.5834
 epoch: 80, train_loss: 0.5000, test_loss: 1.6525, test_f1: 0.5808
 epoch: 81, train_loss: 0.5208, test_loss: 1.5973, test_f1: 0.5887
 epoch: 82, train_loss: 0.5045, test_loss: 1.6892, test_f1: 0.5853
 epoch: 83, train_loss: 0.5090, test_loss: 1.6753, test_f1: 0.5886
 epoch: 84, train_loss: 0.4952, test_loss: 1.6911, test_f1: 0.5813
 epoch: 85, train_loss: 0.4963, test_loss: 1.6843, test_f1: 0.5702
 epoch: 86, train_loss: 0.4801, test_loss: 1.6887, test_f1: 0.5886
 epoch: 87, train_loss: 0.4978, test_loss: 1.7250, test_f1: 0.5945
 epoch: 88, train_loss: 0.5012, test_loss: 1.6682, test_f1: 0.5793
 epoch: 89, train_loss: 0.4927, test_loss: 1.7232, test_f1: 0.5652
 epoch: 90, train_loss: 0.4964, test_loss: 1.7030, test_f1: 0.5878
 epoch: 91, train_loss: 0.4692, test_loss: 1.6901, test_f1: 0.5913
 epoch: 92, train_loss: 0.4733, test_loss: 1.7073, test_f1: 0.5831
 epoch: 93, train_loss: 0.4927, test_loss: 1.7640, test_f1: 0.5911
 epoch: 94, train_loss: 0.4661, test_loss: 1.7817, test_f1: 0.5993
 epoch: 95, train_loss: 0.4786, test_loss: 1.7309, test_f1: 0.5862
 epoch: 96, train_loss: 0.4759, test_loss: 1.7848, test_f1: 0.5928
 epoch: 97, train_loss: 0.4776, test_loss: 1.7831, test_f1: 0.5699
 epoch: 98, train_loss: 0.4801, test_loss: 1.7741, test_f1: 0.5848
 epoch: 99, train_loss: 0.4544, test_loss: 1.8595, test_f1: 0.5767
##################ITERATION #3 ****************************************
 epoch: 0, train_loss: 1.2035, test_loss: 1.3034, test_f1: 0.2294
 epoch: 1, train_loss: 1.0986, test_loss: 1.2520, test_f1: 0.4062
 epoch: 2, train_loss: 1.0554, test_loss: 1.1520, test_f1: 0.4412
 epoch: 3, train_loss: 1.0300, test_loss: 1.1063, test_f1: 0.4829
 epoch: 4, train_loss: 1.0047, test_loss: 1.0823, test_f1: 0.5006
 epoch: 5, train_loss: 0.9818, test_loss: 1.0692, test_f1: 0.5043
 epoch: 6, train_loss: 0.9650, test_loss: 1.0561, test_f1: 0.5306
 epoch: 7, train_loss: 0.9366, test_loss: 1.0489, test_f1: 0.5287
 epoch: 8, train_loss: 0.9374, test_loss: 1.0283, test_f1: 0.5612
 epoch: 9, train_loss: 0.9168, test_loss: 1.0058, test_f1: 0.5309
 epoch: 10, train_loss: 0.9114, test_loss: 1.0136, test_f1: 0.5510
 epoch: 11, train_loss: 0.8984, test_loss: 1.0271, test_f1: 0.5433
 epoch: 12, train_loss: 0.8791, test_loss: 0.9917, test_f1: 0.5745
 epoch: 13, train_loss: 0.8675, test_loss: 1.0032, test_f1: 0.5608
 epoch: 14, train_loss: 0.8467, test_loss: 1.0034, test_f1: 0.5604
 epoch: 15, train_loss: 0.8427, test_loss: 1.0387, test_f1: 0.5653
 epoch: 16, train_loss: 0.8371, test_loss: 0.9932, test_f1: 0.5747
 epoch: 17, train_loss: 0.8220, test_loss: 1.0055, test_f1: 0.5685
 epoch: 18, train_loss: 0.8207, test_loss: 1.0300, test_f1: 0.5790
 epoch: 19, train_loss: 0.8146, test_loss: 0.9909, test_f1: 0.5828
 epoch: 20, train_loss: 0.8011, test_loss: 1.0503, test_f1: 0.5793
 epoch: 21, train_loss: 0.8086, test_loss: 1.0339, test_f1: 0.5773
 epoch: 22, train_loss: 0.7831, test_loss: 1.0402, test_f1: 0.5751
 epoch: 23, train_loss: 0.7715, test_loss: 1.0729, test_f1: 0.5810
 epoch: 24, train_loss: 0.7561, test_loss: 1.0757, test_f1: 0.5831
 epoch: 25, train_loss: 0.7688, test_loss: 1.0593, test_f1: 0.5835
 epoch: 26, train_loss: 0.7556, test_loss: 1.0059, test_f1: 0.5836
 epoch: 27, train_loss: 0.7555, test_loss: 1.0489, test_f1: 0.5967
 epoch: 28, train_loss: 0.7276, test_loss: 1.0646, test_f1: 0.5981
 epoch: 29, train_loss: 0.7332, test_loss: 1.0648, test_f1: 0.6291
 epoch: 30, train_loss: 0.7192, test_loss: 1.1298, test_f1: 0.6081
 epoch: 31, train_loss: 0.7224, test_loss: 1.0505, test_f1: 0.6051
 epoch: 32, train_loss: 0.7086, test_loss: 1.0660, test_f1: 0.5799
 epoch: 33, train_loss: 0.7087, test_loss: 1.1078, test_f1: 0.6045
 epoch: 34, train_loss: 0.6891, test_loss: 1.1269, test_f1: 0.6022
 epoch: 35, train_loss: 0.6752, test_loss: 1.1322, test_f1: 0.5885
 epoch: 36, train_loss: 0.6819, test_loss: 1.1421, test_f1: 0.6151
 epoch: 37, train_loss: 0.6680, test_loss: 1.1320, test_f1: 0.6011
 epoch: 38, train_loss: 0.6603, test_loss: 1.1690, test_f1: 0.6092
 epoch: 39, train_loss: 0.6617, test_loss: 1.2361, test_f1: 0.5983
 epoch: 40, train_loss: 0.6401, test_loss: 1.1632, test_f1: 0.6156
 epoch: 41, train_loss: 0.6431, test_loss: 1.1856, test_f1: 0.5867
 epoch: 42, train_loss: 0.6356, test_loss: 1.1741, test_f1: 0.6142
 epoch: 43, train_loss: 0.6389, test_loss: 1.1727, test_f1: 0.6083
 epoch: 44, train_loss: 0.6306, test_loss: 1.2477, test_f1: 0.5777
 epoch: 45, train_loss: 0.6246, test_loss: 1.1495, test_f1: 0.6124
 epoch: 46, train_loss: 0.6273, test_loss: 1.1529, test_f1: 0.6434
 epoch: 47, train_loss: 0.6160, test_loss: 1.2498, test_f1: 0.6362
 epoch: 48, train_loss: 0.6069, test_loss: 1.2090, test_f1: 0.5963
 epoch: 49, train_loss: 0.5906, test_loss: 1.2455, test_f1: 0.6692
 epoch: 50, train_loss: 0.5917, test_loss: 1.2817, test_f1: 0.6174
 epoch: 51, train_loss: 0.5761, test_loss: 1.3033, test_f1: 0.6302
 epoch: 52, train_loss: 0.5555, test_loss: 1.2674, test_f1: 0.6479
 epoch: 53, train_loss: 0.5547, test_loss: 1.2421, test_f1: 0.6437
 epoch: 54, train_loss: 0.5395, test_loss: 1.3238, test_f1: 0.6252
 epoch: 55, train_loss: 0.5301, test_loss: 1.2972, test_f1: 0.6460
 epoch: 56, train_loss: 0.5443, test_loss: 1.3052, test_f1: 0.6279
 epoch: 57, train_loss: 0.5359, test_loss: 1.2906, test_f1: 0.6332
 epoch: 58, train_loss: 0.5150, test_loss: 1.2985, test_f1: 0.6280
 epoch: 59, train_loss: 0.5238, test_loss: 1.3632, test_f1: 0.6281
 epoch: 60, train_loss: 0.5334, test_loss: 1.3211, test_f1: 0.6262
 epoch: 61, train_loss: 0.5265, test_loss: 1.3443, test_f1: 0.6066
 epoch: 62, train_loss: 0.5238, test_loss: 1.2995, test_f1: 0.6371
 epoch: 63, train_loss: 0.5053, test_loss: 1.4077, test_f1: 0.6199
 epoch: 64, train_loss: 0.5315, test_loss: 1.3389, test_f1: 0.6238
 epoch: 65, train_loss: 0.5158, test_loss: 1.3723, test_f1: 0.6305
 epoch: 66, train_loss: 0.5050, test_loss: 1.3639, test_f1: 0.6272
 epoch: 67, train_loss: 0.5222, test_loss: 1.4155, test_f1: 0.6152
 epoch: 68, train_loss: 0.4950, test_loss: 1.3637, test_f1: 0.6373
 epoch: 69, train_loss: 0.4913, test_loss: 1.4261, test_f1: 0.6429
 epoch: 70, train_loss: 0.4919, test_loss: 1.3675, test_f1: 0.6653
 epoch: 71, train_loss: 0.4855, test_loss: 1.3960, test_f1: 0.6041
 epoch: 72, train_loss: 0.4924, test_loss: 1.4038, test_f1: 0.6505
 epoch: 73, train_loss: 0.4764, test_loss: 1.4049, test_f1: 0.6352
 epoch: 74, train_loss: 0.4664, test_loss: 1.3778, test_f1: 0.6326
 epoch: 75, train_loss: 0.4683, test_loss: 1.4847, test_f1: 0.5991
 epoch: 76, train_loss: 0.4668, test_loss: 1.4721, test_f1: 0.6311
 epoch: 77, train_loss: 0.4691, test_loss: 1.4504, test_f1: 0.6242
 epoch: 78, train_loss: 0.4496, test_loss: 1.4165, test_f1: 0.6177
 epoch: 79, train_loss: 0.4497, test_loss: 1.4732, test_f1: 0.6300
 epoch: 80, train_loss: 0.4467, test_loss: 1.4305, test_f1: 0.6247
 epoch: 81, train_loss: 0.4471, test_loss: 1.5178, test_f1: 0.6343
 epoch: 82, train_loss: 0.4580, test_loss: 1.4922, test_f1: 0.6179
 epoch: 83, train_loss: 0.4530, test_loss: 1.5391, test_f1: 0.6101
 epoch: 84, train_loss: 0.4327, test_loss: 1.5659, test_f1: 0.6179
 epoch: 85, train_loss: 0.4369, test_loss: 1.5500, test_f1: 0.6092
 epoch: 86, train_loss: 0.4345, test_loss: 1.5739, test_f1: 0.6071
 epoch: 87, train_loss: 0.4277, test_loss: 1.5425, test_f1: 0.6184
 epoch: 88, train_loss: 0.4320, test_loss: 1.5859, test_f1: 0.6300
 epoch: 89, train_loss: 0.4254, test_loss: 1.5752, test_f1: 0.6228
 epoch: 90, train_loss: 0.4282, test_loss: 1.5872, test_f1: 0.6168
 epoch: 91, train_loss: 0.4216, test_loss: 1.5300, test_f1: 0.6228
 epoch: 92, train_loss: 0.4151, test_loss: 1.5891, test_f1: 0.6045
 epoch: 93, train_loss: 0.4047, test_loss: 1.5203, test_f1: 0.6279
 epoch: 94, train_loss: 0.4007, test_loss: 1.5999, test_f1: 0.6230
 epoch: 95, train_loss: 0.4246, test_loss: 1.6572, test_f1: 0.6040
 epoch: 96, train_loss: 0.4210, test_loss: 1.6259, test_f1: 0.6175
 epoch: 97, train_loss: 0.4225, test_loss: 1.7133, test_f1: 0.6049
 epoch: 98, train_loss: 0.3910, test_loss: 1.6084, test_f1: 0.6142
 epoch: 99, train_loss: 0.4032, test_loss: 1.6442, test_f1: 0.5959
##################ITERATION #4 ****************************************
 epoch: 0, train_loss: 1.1918, test_loss: 1.2922, test_f1: 0.3266
 epoch: 1, train_loss: 1.0862, test_loss: 1.2124, test_f1: 0.4350
 epoch: 2, train_loss: 1.0419, test_loss: 1.1533, test_f1: 0.4654
 epoch: 3, train_loss: 1.0297, test_loss: 1.1030, test_f1: 0.4758
 epoch: 4, train_loss: 1.0106, test_loss: 1.0869, test_f1: 0.5174
 epoch: 5, train_loss: 1.0009, test_loss: 1.0640, test_f1: 0.5203
 epoch: 6, train_loss: 0.9796, test_loss: 1.0871, test_f1: 0.5060
 epoch: 7, train_loss: 0.9550, test_loss: 1.0466, test_f1: 0.5250
 epoch: 8, train_loss: 0.9493, test_loss: 1.0213, test_f1: 0.5280
 epoch: 9, train_loss: 0.9337, test_loss: 1.0260, test_f1: 0.5347
 epoch: 10, train_loss: 0.9121, test_loss: 1.0600, test_f1: 0.5273
 epoch: 11, train_loss: 0.9130, test_loss: 1.0359, test_f1: 0.5309
 epoch: 12, train_loss: 0.9045, test_loss: 1.0110, test_f1: 0.5421
 epoch: 13, train_loss: 0.8783, test_loss: 1.0148, test_f1: 0.5434
 epoch: 14, train_loss: 0.8647, test_loss: 1.0109, test_f1: 0.5335
 epoch: 15, train_loss: 0.8626, test_loss: 1.0235, test_f1: 0.5408
 epoch: 16, train_loss: 0.8522, test_loss: 1.0124, test_f1: 0.5482
 epoch: 17, train_loss: 0.8392, test_loss: 1.0027, test_f1: 0.5550
 epoch: 18, train_loss: 0.8454, test_loss: 1.0134, test_f1: 0.5528
 epoch: 19, train_loss: 0.8152, test_loss: 1.0136, test_f1: 0.5559
 epoch: 20, train_loss: 0.8187, test_loss: 0.9879, test_f1: 0.5655
 epoch: 21, train_loss: 0.8042, test_loss: 1.0569, test_f1: 0.5550
 epoch: 22, train_loss: 0.7907, test_loss: 1.0442, test_f1: 0.5621
 epoch: 23, train_loss: 0.7993, test_loss: 1.0492, test_f1: 0.5606
 epoch: 24, train_loss: 0.7580, test_loss: 1.0257, test_f1: 0.5782
 epoch: 25, train_loss: 0.7782, test_loss: 1.0761, test_f1: 0.5743
 epoch: 26, train_loss: 0.7567, test_loss: 1.1133, test_f1: 0.5838
 epoch: 27, train_loss: 0.7529, test_loss: 1.1144, test_f1: 0.5856
 epoch: 28, train_loss: 0.7519, test_loss: 1.0885, test_f1: 0.5905
 epoch: 29, train_loss: 0.7374, test_loss: 1.1444, test_f1: 0.5900
 epoch: 30, train_loss: 0.7331, test_loss: 1.1739, test_f1: 0.5926
 epoch: 31, train_loss: 0.7367, test_loss: 1.1842, test_f1: 0.5653
 epoch: 32, train_loss: 0.7478, test_loss: 1.1150, test_f1: 0.5926
 epoch: 33, train_loss: 0.7330, test_loss: 1.1294, test_f1: 0.5913
 epoch: 34, train_loss: 0.7069, test_loss: 1.1887, test_f1: 0.5880
 epoch: 35, train_loss: 0.7036, test_loss: 1.2690, test_f1: 0.5910
 epoch: 36, train_loss: 0.7005, test_loss: 1.1650, test_f1: 0.5879
 epoch: 37, train_loss: 0.6889, test_loss: 1.2183, test_f1: 0.6016
 epoch: 38, train_loss: 0.6822, test_loss: 1.2181, test_f1: 0.5982
 epoch: 39, train_loss: 0.6895, test_loss: 1.2422, test_f1: 0.5903
 epoch: 40, train_loss: 0.6788, test_loss: 1.2068, test_f1: 0.5965
 epoch: 41, train_loss: 0.6871, test_loss: 1.1946, test_f1: 0.6095
 epoch: 42, train_loss: 0.6629, test_loss: 1.2288, test_f1: 0.6039
 epoch: 43, train_loss: 0.6671, test_loss: 1.2593, test_f1: 0.6041
 epoch: 44, train_loss: 0.6659, test_loss: 1.2673, test_f1: 0.6156
 epoch: 45, train_loss: 0.6315, test_loss: 1.2345, test_f1: 0.5757
 epoch: 46, train_loss: 0.6360, test_loss: 1.3038, test_f1: 0.6216
 epoch: 47, train_loss: 0.6380, test_loss: 1.3444, test_f1: 0.6002
 epoch: 48, train_loss: 0.6078, test_loss: 1.2801, test_f1: 0.6152
 epoch: 49, train_loss: 0.6528, test_loss: 1.3021, test_f1: 0.6037
 epoch: 50, train_loss: 0.6122, test_loss: 1.3323, test_f1: 0.5926
 epoch: 51, train_loss: 0.5998, test_loss: 1.3062, test_f1: 0.6187
 epoch: 52, train_loss: 0.5968, test_loss: 1.3348, test_f1: 0.6087
 epoch: 53, train_loss: 0.5773, test_loss: 1.3396, test_f1: 0.6261
 epoch: 54, train_loss: 0.5893, test_loss: 1.3018, test_f1: 0.6190
 epoch: 55, train_loss: 0.5698, test_loss: 1.3413, test_f1: 0.6256
 epoch: 56, train_loss: 0.5651, test_loss: 1.3798, test_f1: 0.6163
 epoch: 57, train_loss: 0.5759, test_loss: 1.4112, test_f1: 0.6041
 epoch: 58, train_loss: 0.5502, test_loss: 1.3773, test_f1: 0.6239
 epoch: 59, train_loss: 0.5521, test_loss: 1.3607, test_f1: 0.6344
 epoch: 60, train_loss: 0.5651, test_loss: 1.3417, test_f1: 0.6367
 epoch: 61, train_loss: 0.5644, test_loss: 1.4390, test_f1: 0.6290
 epoch: 62, train_loss: 0.5784, test_loss: 1.4164, test_f1: 0.6315
 epoch: 63, train_loss: 0.5540, test_loss: 1.4144, test_f1: 0.6215
 epoch: 64, train_loss: 0.5419, test_loss: 1.3959, test_f1: 0.6317
 epoch: 65, train_loss: 0.5469, test_loss: 1.4273, test_f1: 0.6369
 epoch: 66, train_loss: 0.5414, test_loss: 1.4393, test_f1: 0.6134
 epoch: 67, train_loss: 0.5403, test_loss: 1.4355, test_f1: 0.6203
 epoch: 68, train_loss: 0.5335, test_loss: 1.4726, test_f1: 0.6373
 epoch: 69, train_loss: 0.5424, test_loss: 1.4045, test_f1: 0.6318
 epoch: 70, train_loss: 0.5189, test_loss: 1.4836, test_f1: 0.6190
 epoch: 71, train_loss: 0.5315, test_loss: 1.4521, test_f1: 0.6218
 epoch: 72, train_loss: 0.5326, test_loss: 1.4141, test_f1: 0.6371
 epoch: 73, train_loss: 0.5041, test_loss: 1.5192, test_f1: 0.6082
 epoch: 74, train_loss: 0.5221, test_loss: 1.4957, test_f1: 0.6368
 epoch: 75, train_loss: 0.5113, test_loss: 1.5432, test_f1: 0.6421
 epoch: 76, train_loss: 0.5151, test_loss: 1.4879, test_f1: 0.6239
 epoch: 77, train_loss: 0.5132, test_loss: 1.4972, test_f1: 0.6194
 epoch: 78, train_loss: 0.5003, test_loss: 1.4424, test_f1: 0.6374
 epoch: 79, train_loss: 0.5206, test_loss: 1.5311, test_f1: 0.6287
 epoch: 80, train_loss: 0.4923, test_loss: 1.6054, test_f1: 0.6361
 epoch: 81, train_loss: 0.4965, test_loss: 1.5242, test_f1: 0.6269
 epoch: 82, train_loss: 0.4913, test_loss: 1.4861, test_f1: 0.6291
 epoch: 83, train_loss: 0.4855, test_loss: 1.5461, test_f1: 0.6191
 epoch: 84, train_loss: 0.5051, test_loss: 1.4619, test_f1: 0.6349
 epoch: 85, train_loss: 0.4931, test_loss: 1.5139, test_f1: 0.6395
 epoch: 86, train_loss: 0.4937, test_loss: 1.5453, test_f1: 0.6391
 epoch: 87, train_loss: 0.4665, test_loss: 1.5377, test_f1: 0.6207
 epoch: 88, train_loss: 0.4669, test_loss: 1.5757, test_f1: 0.6271
 epoch: 89, train_loss: 0.4778, test_loss: 1.6765, test_f1: 0.6182
 epoch: 90, train_loss: 0.4830, test_loss: 1.6695, test_f1: 0.6532
 epoch: 91, train_loss: 0.4732, test_loss: 1.5447, test_f1: 0.6371
 epoch: 92, train_loss: 0.4774, test_loss: 1.6128, test_f1: 0.6213
 epoch: 93, train_loss: 0.4436, test_loss: 1.6707, test_f1: 0.6240
 epoch: 94, train_loss: 0.4525, test_loss: 1.6395, test_f1: 0.6574
 epoch: 95, train_loss: 0.4562, test_loss: 1.6886, test_f1: 0.6451
 epoch: 96, train_loss: 0.4575, test_loss: 1.6051, test_f1: 0.6453
 epoch: 97, train_loss: 0.4610, test_loss: 1.6944, test_f1: 0.6220
 epoch: 98, train_loss: 0.4459, test_loss: 1.6666, test_f1: 0.6464
 epoch: 99, train_loss: 0.4417, test_loss: 1.7283, test_f1: 0.6363
##################ITERATION #5 ****************************************
 epoch: 0, train_loss: 1.2030, test_loss: 1.3284, test_f1: 0.2814
 epoch: 1, train_loss: 1.0875, test_loss: 1.1844, test_f1: 0.4537
 epoch: 2, train_loss: 1.0564, test_loss: 1.1333, test_f1: 0.4858
 epoch: 3, train_loss: 1.0225, test_loss: 1.0825, test_f1: 0.5061
 epoch: 4, train_loss: 0.9994, test_loss: 1.0561, test_f1: 0.5194
 epoch: 5, train_loss: 0.9838, test_loss: 1.0467, test_f1: 0.5350
 epoch: 6, train_loss: 0.9659, test_loss: 1.0308, test_f1: 0.5373
 epoch: 7, train_loss: 0.9650, test_loss: 1.0335, test_f1: 0.5318
 epoch: 8, train_loss: 0.9508, test_loss: 1.0567, test_f1: 0.5476
 epoch: 9, train_loss: 0.9285, test_loss: 0.9978, test_f1: 0.5371
 epoch: 10, train_loss: 0.9214, test_loss: 1.0124, test_f1: 0.5596
 epoch: 11, train_loss: 0.9017, test_loss: 1.0039, test_f1: 0.5626
 epoch: 12, train_loss: 0.8914, test_loss: 0.9970, test_f1: 0.5729
 epoch: 13, train_loss: 0.8815, test_loss: 0.9993, test_f1: 0.5595
 epoch: 14, train_loss: 0.8736, test_loss: 1.0474, test_f1: 0.5572
 epoch: 15, train_loss: 0.8649, test_loss: 0.9888, test_f1: 0.5732
 epoch: 16, train_loss: 0.8661, test_loss: 0.9893, test_f1: 0.5718
 epoch: 17, train_loss: 0.8339, test_loss: 0.9997, test_f1: 0.5641
 epoch: 18, train_loss: 0.8565, test_loss: 0.9976, test_f1: 0.5579
 epoch: 19, train_loss: 0.8292, test_loss: 0.9709, test_f1: 0.5802
 epoch: 20, train_loss: 0.8258, test_loss: 1.0010, test_f1: 0.5559
 epoch: 21, train_loss: 0.8185, test_loss: 1.0089, test_f1: 0.5544
 epoch: 22, train_loss: 0.8268, test_loss: 0.9730, test_f1: 0.5697
 epoch: 23, train_loss: 0.7870, test_loss: 0.9908, test_f1: 0.5833
 epoch: 24, train_loss: 0.7901, test_loss: 0.9681, test_f1: 0.5688
 epoch: 25, train_loss: 0.7776, test_loss: 0.9782, test_f1: 0.6147
 epoch: 26, train_loss: 0.7877, test_loss: 0.9848, test_f1: 0.6039
 epoch: 27, train_loss: 0.7594, test_loss: 0.9927, test_f1: 0.5961
 epoch: 28, train_loss: 0.7693, test_loss: 0.9960, test_f1: 0.5936
 epoch: 29, train_loss: 0.7710, test_loss: 0.9961, test_f1: 0.6067
 epoch: 30, train_loss: 0.7576, test_loss: 0.9932, test_f1: 0.5978
 epoch: 31, train_loss: 0.7287, test_loss: 1.0238, test_f1: 0.5929
 epoch: 32, train_loss: 0.7305, test_loss: 0.9653, test_f1: 0.6043
 epoch: 33, train_loss: 0.7275, test_loss: 0.9703, test_f1: 0.6377
 epoch: 34, train_loss: 0.7139, test_loss: 1.0089, test_f1: 0.6166
 epoch: 35, train_loss: 0.7266, test_loss: 0.9618, test_f1: 0.6366
 epoch: 36, train_loss: 0.7373, test_loss: 1.0194, test_f1: 0.6145
 epoch: 37, train_loss: 0.7203, test_loss: 0.9841, test_f1: 0.6135
 epoch: 38, train_loss: 0.7083, test_loss: 1.0015, test_f1: 0.6099
 epoch: 39, train_loss: 0.6914, test_loss: 1.0037, test_f1: 0.5999
 epoch: 40, train_loss: 0.6935, test_loss: 1.0385, test_f1: 0.6162
 epoch: 41, train_loss: 0.7005, test_loss: 0.9893, test_f1: 0.6231
 epoch: 42, train_loss: 0.6907, test_loss: 1.0244, test_f1: 0.6358
 epoch: 43, train_loss: 0.6916, test_loss: 1.0587, test_f1: 0.6088
 epoch: 44, train_loss: 0.6809, test_loss: 1.0663, test_f1: 0.5941
 epoch: 45, train_loss: 0.6702, test_loss: 1.0340, test_f1: 0.5647
 epoch: 46, train_loss: 0.6919, test_loss: 1.0845, test_f1: 0.5917
 epoch: 47, train_loss: 0.6614, test_loss: 1.0547, test_f1: 0.6208
 epoch: 48, train_loss: 0.6580, test_loss: 1.0303, test_f1: 0.6074
 epoch: 49, train_loss: 0.6527, test_loss: 1.0931, test_f1: 0.5849
 epoch: 50, train_loss: 0.6399, test_loss: 1.0623, test_f1: 0.5844
 epoch: 51, train_loss: 0.6149, test_loss: 1.0735, test_f1: 0.6276
 epoch: 52, train_loss: 0.6319, test_loss: 1.0371, test_f1: 0.6243
 epoch: 53, train_loss: 0.6268, test_loss: 1.0679, test_f1: 0.6036
 epoch: 54, train_loss: 0.6320, test_loss: 1.0350, test_f1: 0.6142
 epoch: 55, train_loss: 0.5961, test_loss: 1.0578, test_f1: 0.6039
 epoch: 56, train_loss: 0.6063, test_loss: 1.0231, test_f1: 0.6181
 epoch: 57, train_loss: 0.5881, test_loss: 1.0866, test_f1: 0.6066
 epoch: 58, train_loss: 0.5937, test_loss: 1.0807, test_f1: 0.6193
 epoch: 59, train_loss: 0.5871, test_loss: 1.0571, test_f1: 0.6107
 epoch: 60, train_loss: 0.5881, test_loss: 1.0918, test_f1: 0.6093
 epoch: 61, train_loss: 0.5958, test_loss: 1.0755, test_f1: 0.6107
 epoch: 62, train_loss: 0.5679, test_loss: 1.0870, test_f1: 0.6114
 epoch: 63, train_loss: 0.6000, test_loss: 1.0719, test_f1: 0.6538
 epoch: 64, train_loss: 0.5757, test_loss: 1.0724, test_f1: 0.6237
 epoch: 65, train_loss: 0.5649, test_loss: 1.1044, test_f1: 0.6149
 epoch: 66, train_loss: 0.5512, test_loss: 1.0900, test_f1: 0.6375
 epoch: 67, train_loss: 0.5622, test_loss: 1.0763, test_f1: 0.6293
 epoch: 68, train_loss: 0.5668, test_loss: 1.0824, test_f1: 0.6228
 epoch: 69, train_loss: 0.5657, test_loss: 1.0887, test_f1: 0.6238
 epoch: 70, train_loss: 0.5609, test_loss: 1.0955, test_f1: 0.6265
 epoch: 71, train_loss: 0.5540, test_loss: 1.1124, test_f1: 0.6389
 epoch: 72, train_loss: 0.5555, test_loss: 1.1122, test_f1: 0.6476
 epoch: 73, train_loss: 0.5619, test_loss: 1.1471, test_f1: 0.6328
 epoch: 74, train_loss: 0.5539, test_loss: 1.1303, test_f1: 0.6106
 epoch: 75, train_loss: 0.5428, test_loss: 1.1279, test_f1: 0.6470
 epoch: 76, train_loss: 0.5476, test_loss: 1.0886, test_f1: 0.6494
 epoch: 77, train_loss: 0.5395, test_loss: 1.1263, test_f1: 0.6403
 epoch: 78, train_loss: 0.5282, test_loss: 1.0778, test_f1: 0.6410
 epoch: 79, train_loss: 0.5261, test_loss: 1.1146, test_f1: 0.6523
 epoch: 80, train_loss: 0.5351, test_loss: 1.1484, test_f1: 0.6484
 epoch: 81, train_loss: 0.5458, test_loss: 1.1443, test_f1: 0.6450
 epoch: 82, train_loss: 0.5167, test_loss: 1.1930, test_f1: 0.6512
 epoch: 83, train_loss: 0.5297, test_loss: 1.1788, test_f1: 0.6519
 epoch: 84, train_loss: 0.5140, test_loss: 1.2192, test_f1: 0.6459
 epoch: 85, train_loss: 0.5273, test_loss: 1.1580, test_f1: 0.6712
 epoch: 86, train_loss: 0.5212, test_loss: 1.1594, test_f1: 0.6704
 epoch: 87, train_loss: 0.5114, test_loss: 1.2175, test_f1: 0.6334
 epoch: 88, train_loss: 0.5118, test_loss: 1.1663, test_f1: 0.6401
 epoch: 89, train_loss: 0.5102, test_loss: 1.1910, test_f1: 0.6263
 epoch: 90, train_loss: 0.5124, test_loss: 1.1702, test_f1: 0.6485
 epoch: 91, train_loss: 0.5087, test_loss: 1.2197, test_f1: 0.6200
 epoch: 92, train_loss: 0.4963, test_loss: 1.2105, test_f1: 0.6508
 epoch: 93, train_loss: 0.4977, test_loss: 1.2394, test_f1: 0.6346
 epoch: 94, train_loss: 0.4923, test_loss: 1.2153, test_f1: 0.6346
 epoch: 95, train_loss: 0.5054, test_loss: 1.2454, test_f1: 0.6135
 epoch: 96, train_loss: 0.4779, test_loss: 1.1756, test_f1: 0.6404
 epoch: 97, train_loss: 0.4641, test_loss: 1.2511, test_f1: 0.6450
 epoch: 98, train_loss: 0.4933, test_loss: 1.1741, test_f1: 0.6412
 epoch: 99, train_loss: 0.4820, test_loss: 1.2252, test_f1: 0.6236
##################ITERATION #6 ****************************************
 epoch: 0, train_loss: 1.2067, test_loss: 1.3035, test_f1: 0.3816
 epoch: 1, train_loss: 1.0859, test_loss: 1.2608, test_f1: 0.4180
 epoch: 2, train_loss: 1.0422, test_loss: 1.1313, test_f1: 0.4734
 epoch: 3, train_loss: 1.0166, test_loss: 1.1203, test_f1: 0.4759
 epoch: 4, train_loss: 0.9877, test_loss: 1.0939, test_f1: 0.5417
 epoch: 5, train_loss: 0.9815, test_loss: 1.0609, test_f1: 0.5527
 epoch: 6, train_loss: 0.9553, test_loss: 1.0638, test_f1: 0.5510
 epoch: 7, train_loss: 0.9463, test_loss: 1.0773, test_f1: 0.5762
 epoch: 8, train_loss: 0.9469, test_loss: 1.0511, test_f1: 0.5592
 epoch: 9, train_loss: 0.9210, test_loss: 1.0187, test_f1: 0.5781
 epoch: 10, train_loss: 0.8987, test_loss: 1.0485, test_f1: 0.5636
 epoch: 11, train_loss: 0.8779, test_loss: 1.0299, test_f1: 0.5759
 epoch: 12, train_loss: 0.8857, test_loss: 1.0188, test_f1: 0.5920
 epoch: 13, train_loss: 0.8582, test_loss: 1.0648, test_f1: 0.5699
 epoch: 14, train_loss: 0.8588, test_loss: 1.0026, test_f1: 0.5774
 epoch: 15, train_loss: 0.8465, test_loss: 1.0679, test_f1: 0.5586
 epoch: 16, train_loss: 0.8427, test_loss: 1.0130, test_f1: 0.5741
 epoch: 17, train_loss: 0.8147, test_loss: 1.0324, test_f1: 0.5652
 epoch: 18, train_loss: 0.8224, test_loss: 1.0294, test_f1: 0.5833
 epoch: 19, train_loss: 0.8049, test_loss: 1.0480, test_f1: 0.5876
 epoch: 20, train_loss: 0.7990, test_loss: 1.0268, test_f1: 0.5878
 epoch: 21, train_loss: 0.8014, test_loss: 1.0714, test_f1: 0.5827
 epoch: 22, train_loss: 0.7960, test_loss: 1.0369, test_f1: 0.5746
 epoch: 23, train_loss: 0.7843, test_loss: 1.0463, test_f1: 0.6035
 epoch: 24, train_loss: 0.7889, test_loss: 1.1092, test_f1: 0.5902
 epoch: 25, train_loss: 0.7609, test_loss: 1.0278, test_f1: 0.5957
 epoch: 26, train_loss: 0.7546, test_loss: 1.0574, test_f1: 0.6011
 epoch: 27, train_loss: 0.7533, test_loss: 1.0610, test_f1: 0.5947
 epoch: 28, train_loss: 0.7420, test_loss: 1.0639, test_f1: 0.5931
 epoch: 29, train_loss: 0.7364, test_loss: 1.0565, test_f1: 0.6043
 epoch: 30, train_loss: 0.7466, test_loss: 1.0686, test_f1: 0.6007
 epoch: 31, train_loss: 0.7249, test_loss: 1.0599, test_f1: 0.5979
 epoch: 32, train_loss: 0.7339, test_loss: 1.0994, test_f1: 0.5934
 epoch: 33, train_loss: 0.7285, test_loss: 1.1358, test_f1: 0.6028
 epoch: 34, train_loss: 0.7109, test_loss: 1.0784, test_f1: 0.6134
 epoch: 35, train_loss: 0.7151, test_loss: 1.0644, test_f1: 0.6175
 epoch: 36, train_loss: 0.6875, test_loss: 1.0995, test_f1: 0.6045
 epoch: 37, train_loss: 0.7030, test_loss: 1.0792, test_f1: 0.6232
 epoch: 38, train_loss: 0.6828, test_loss: 1.1119, test_f1: 0.6065
 epoch: 39, train_loss: 0.6843, test_loss: 1.0958, test_f1: 0.6121
 epoch: 40, train_loss: 0.6776, test_loss: 1.1262, test_f1: 0.6019
 epoch: 41, train_loss: 0.6699, test_loss: 1.1669, test_f1: 0.6020
 epoch: 42, train_loss: 0.6726, test_loss: 1.1364, test_f1: 0.6156
 epoch: 43, train_loss: 0.6759, test_loss: 1.1590, test_f1: 0.5979
 epoch: 44, train_loss: 0.6567, test_loss: 1.2024, test_f1: 0.6105
 epoch: 45, train_loss: 0.6510, test_loss: 1.1664, test_f1: 0.6148
 epoch: 46, train_loss: 0.6437, test_loss: 1.1672, test_f1: 0.5998
 epoch: 47, train_loss: 0.6573, test_loss: 1.2279, test_f1: 0.5843
 epoch: 48, train_loss: 0.6394, test_loss: 1.2286, test_f1: 0.6280
 epoch: 49, train_loss: 0.6227, test_loss: 1.1801, test_f1: 0.6314
 epoch: 50, train_loss: 0.6193, test_loss: 1.2244, test_f1: 0.6138
 epoch: 51, train_loss: 0.6079, test_loss: 1.2174, test_f1: 0.6266
 epoch: 52, train_loss: 0.6122, test_loss: 1.2197, test_f1: 0.6371
 epoch: 53, train_loss: 0.5946, test_loss: 1.2614, test_f1: 0.6247
 epoch: 54, train_loss: 0.5956, test_loss: 1.2534, test_f1: 0.6399
 epoch: 55, train_loss: 0.5955, test_loss: 1.2612, test_f1: 0.6281
 epoch: 56, train_loss: 0.5935, test_loss: 1.2509, test_f1: 0.6509
 epoch: 57, train_loss: 0.5813, test_loss: 1.2455, test_f1: 0.6320
 epoch: 58, train_loss: 0.5703, test_loss: 1.2643, test_f1: 0.6183
 epoch: 59, train_loss: 0.5612, test_loss: 1.2790, test_f1: 0.6330
 epoch: 60, train_loss: 0.5749, test_loss: 1.2687, test_f1: 0.6429
 epoch: 61, train_loss: 0.5928, test_loss: 1.2558, test_f1: 0.6403
 epoch: 62, train_loss: 0.5644, test_loss: 1.2965, test_f1: 0.6158
 epoch: 63, train_loss: 0.5590, test_loss: 1.2854, test_f1: 0.6172
 epoch: 64, train_loss: 0.5600, test_loss: 1.2885, test_f1: 0.6259
 epoch: 65, train_loss: 0.5469, test_loss: 1.3156, test_f1: 0.6090
 epoch: 66, train_loss: 0.5518, test_loss: 1.3133, test_f1: 0.6142
 epoch: 67, train_loss: 0.5469, test_loss: 1.2855, test_f1: 0.6428
 epoch: 68, train_loss: 0.5488, test_loss: 1.3750, test_f1: 0.6264
 epoch: 69, train_loss: 0.5468, test_loss: 1.3427, test_f1: 0.6347
 epoch: 70, train_loss: 0.5263, test_loss: 1.3573, test_f1: 0.6201
 epoch: 71, train_loss: 0.5474, test_loss: 1.4000, test_f1: 0.6191
 epoch: 72, train_loss: 0.5446, test_loss: 1.3751, test_f1: 0.6153
 epoch: 73, train_loss: 0.5363, test_loss: 1.3710, test_f1: 0.6251
 epoch: 74, train_loss: 0.5268, test_loss: 1.3517, test_f1: 0.6342
 epoch: 75, train_loss: 0.5053, test_loss: 1.3662, test_f1: 0.6303
 epoch: 76, train_loss: 0.5221, test_loss: 1.4137, test_f1: 0.6180
 epoch: 77, train_loss: 0.5110, test_loss: 1.4395, test_f1: 0.6419
 epoch: 78, train_loss: 0.5143, test_loss: 1.4479, test_f1: 0.6246
 epoch: 79, train_loss: 0.5093, test_loss: 1.4567, test_f1: 0.5968
 epoch: 80, train_loss: 0.5059, test_loss: 1.4741, test_f1: 0.6217
 epoch: 81, train_loss: 0.5126, test_loss: 1.4183, test_f1: 0.6293
 epoch: 82, train_loss: 0.5002, test_loss: 1.4386, test_f1: 0.6353
 epoch: 83, train_loss: 0.4906, test_loss: 1.4518, test_f1: 0.6143
 epoch: 84, train_loss: 0.5105, test_loss: 1.4364, test_f1: 0.5966
 epoch: 85, train_loss: 0.4857, test_loss: 1.4496, test_f1: 0.6242
 epoch: 86, train_loss: 0.4928, test_loss: 1.5198, test_f1: 0.6297
 epoch: 87, train_loss: 0.4814, test_loss: 1.5072, test_f1: 0.6239
 epoch: 88, train_loss: 0.4664, test_loss: 1.4806, test_f1: 0.6272
 epoch: 89, train_loss: 0.4692, test_loss: 1.4790, test_f1: 0.6319
 epoch: 90, train_loss: 0.4800, test_loss: 1.4445, test_f1: 0.6293
 epoch: 91, train_loss: 0.4743, test_loss: 1.5067, test_f1: 0.6171
 epoch: 92, train_loss: 0.4694, test_loss: 1.4991, test_f1: 0.6232
 epoch: 93, train_loss: 0.4628, test_loss: 1.6177, test_f1: 0.6147
 epoch: 94, train_loss: 0.4694, test_loss: 1.5287, test_f1: 0.6273
 epoch: 95, train_loss: 0.4866, test_loss: 1.6182, test_f1: 0.6045
 epoch: 96, train_loss: 0.4752, test_loss: 1.5474, test_f1: 0.6324
 epoch: 97, train_loss: 0.4728, test_loss: 1.5253, test_f1: 0.6437
 epoch: 98, train_loss: 0.4626, test_loss: 1.5331, test_f1: 0.6242
 epoch: 99, train_loss: 0.4741, test_loss: 1.5671, test_f1: 0.6385
##################ITERATION #7 ****************************************
 epoch: 0, train_loss: 1.1897, test_loss: 1.2935, test_f1: 0.2561
 epoch: 1, train_loss: 1.0674, test_loss: 1.1927, test_f1: 0.3825
 epoch: 2, train_loss: 1.0303, test_loss: 1.1226, test_f1: 0.4884
 epoch: 3, train_loss: 1.0229, test_loss: 1.0582, test_f1: 0.5134
 epoch: 4, train_loss: 0.9851, test_loss: 1.0443, test_f1: 0.5299
 epoch: 5, train_loss: 0.9866, test_loss: 1.0608, test_f1: 0.5350
 epoch: 6, train_loss: 0.9515, test_loss: 1.0308, test_f1: 0.5301
 epoch: 7, train_loss: 0.9296, test_loss: 1.0440, test_f1: 0.5365
 epoch: 8, train_loss: 0.9136, test_loss: 0.9973, test_f1: 0.5566
 epoch: 9, train_loss: 0.9126, test_loss: 1.0399, test_f1: 0.5499
 epoch: 10, train_loss: 0.8871, test_loss: 1.0051, test_f1: 0.5529
 epoch: 11, train_loss: 0.9043, test_loss: 0.9933, test_f1: 0.5605
 epoch: 12, train_loss: 0.8686, test_loss: 1.0024, test_f1: 0.5530
 epoch: 13, train_loss: 0.8591, test_loss: 1.0241, test_f1: 0.5590
 epoch: 14, train_loss: 0.8291, test_loss: 1.0227, test_f1: 0.5636
 epoch: 15, train_loss: 0.8343, test_loss: 1.0053, test_f1: 0.5713
 epoch: 16, train_loss: 0.8093, test_loss: 0.9945, test_f1: 0.5750
 epoch: 17, train_loss: 0.8296, test_loss: 1.0110, test_f1: 0.5695
 epoch: 18, train_loss: 0.8192, test_loss: 1.0197, test_f1: 0.5815
 epoch: 19, train_loss: 0.7833, test_loss: 1.0161, test_f1: 0.5654
 epoch: 20, train_loss: 0.7959, test_loss: 1.0147, test_f1: 0.5822
 epoch: 21, train_loss: 0.7936, test_loss: 1.0104, test_f1: 0.5969
 epoch: 22, train_loss: 0.7973, test_loss: 1.0236, test_f1: 0.5838
 epoch: 23, train_loss: 0.7721, test_loss: 1.0027, test_f1: 0.5801
 epoch: 24, train_loss: 0.7682, test_loss: 1.0569, test_f1: 0.5780
 epoch: 25, train_loss: 0.7676, test_loss: 1.0626, test_f1: 0.5928
 epoch: 26, train_loss: 0.7601, test_loss: 1.0311, test_f1: 0.5883
 epoch: 27, train_loss: 0.7564, test_loss: 1.0384, test_f1: 0.5951
 epoch: 28, train_loss: 0.7416, test_loss: 1.0245, test_f1: 0.5878
 epoch: 29, train_loss: 0.7327, test_loss: 1.0439, test_f1: 0.5982
 epoch: 30, train_loss: 0.7279, test_loss: 1.0313, test_f1: 0.6003
 epoch: 31, train_loss: 0.7233, test_loss: 1.0614, test_f1: 0.5784
 epoch: 32, train_loss: 0.7231, test_loss: 1.0602, test_f1: 0.5878
 epoch: 33, train_loss: 0.7079, test_loss: 1.0614, test_f1: 0.6070
 epoch: 34, train_loss: 0.7145, test_loss: 1.0809, test_f1: 0.6074
 epoch: 35, train_loss: 0.7027, test_loss: 1.0601, test_f1: 0.6118
 epoch: 36, train_loss: 0.7121, test_loss: 1.0919, test_f1: 0.5924
 epoch: 37, train_loss: 0.6742, test_loss: 1.0492, test_f1: 0.6215
 epoch: 38, train_loss: 0.6951, test_loss: 1.0353, test_f1: 0.6079
 epoch: 39, train_loss: 0.6796, test_loss: 1.0674, test_f1: 0.6145
 epoch: 40, train_loss: 0.6796, test_loss: 1.0873, test_f1: 0.6061
 epoch: 41, train_loss: 0.6600, test_loss: 1.1098, test_f1: 0.6208
 epoch: 42, train_loss: 0.6681, test_loss: 1.1113, test_f1: 0.6062
 epoch: 43, train_loss: 0.6621, test_loss: 1.1029, test_f1: 0.6294
 epoch: 44, train_loss: 0.6466, test_loss: 1.1032, test_f1: 0.6110
 epoch: 45, train_loss: 0.6589, test_loss: 1.1587, test_f1: 0.5898
 epoch: 46, train_loss: 0.6621, test_loss: 1.1253, test_f1: 0.5992
 epoch: 47, train_loss: 0.6449, test_loss: 1.0823, test_f1: 0.6218
 epoch: 48, train_loss: 0.6544, test_loss: 1.1175, test_f1: 0.6145
 epoch: 49, train_loss: 0.6378, test_loss: 1.1275, test_f1: 0.6104
 epoch: 50, train_loss: 0.6169, test_loss: 1.1663, test_f1: 0.6059
 epoch: 51, train_loss: 0.6143, test_loss: 1.1192, test_f1: 0.6326
 epoch: 52, train_loss: 0.5905, test_loss: 1.1143, test_f1: 0.6467
 epoch: 53, train_loss: 0.6010, test_loss: 1.1161, test_f1: 0.6247
 epoch: 54, train_loss: 0.6127, test_loss: 1.1291, test_f1: 0.6398
 epoch: 55, train_loss: 0.5876, test_loss: 1.0983, test_f1: 0.6428
 epoch: 56, train_loss: 0.5952, test_loss: 1.1223, test_f1: 0.6299
 epoch: 57, train_loss: 0.5850, test_loss: 1.1021, test_f1: 0.6262
 epoch: 58, train_loss: 0.5643, test_loss: 1.1312, test_f1: 0.6268
 epoch: 59, train_loss: 0.5686, test_loss: 1.1442, test_f1: 0.6174
 epoch: 60, train_loss: 0.5783, test_loss: 1.1824, test_f1: 0.6265
 epoch: 61, train_loss: 0.5511, test_loss: 1.1546, test_f1: 0.6145
 epoch: 62, train_loss: 0.5444, test_loss: 1.1566, test_f1: 0.6366
 epoch: 63, train_loss: 0.5490, test_loss: 1.1528, test_f1: 0.6547
 epoch: 64, train_loss: 0.5751, test_loss: 1.1697, test_f1: 0.6342
 epoch: 65, train_loss: 0.5605, test_loss: 1.1573, test_f1: 0.6554
 epoch: 66, train_loss: 0.5598, test_loss: 1.1969, test_f1: 0.6244
 epoch: 67, train_loss: 0.5542, test_loss: 1.1939, test_f1: 0.6341
 epoch: 68, train_loss: 0.5431, test_loss: 1.1895, test_f1: 0.6413
 epoch: 69, train_loss: 0.5401, test_loss: 1.1886, test_f1: 0.6447
 epoch: 70, train_loss: 0.5303, test_loss: 1.2161, test_f1: 0.6370
 epoch: 71, train_loss: 0.5311, test_loss: 1.2485, test_f1: 0.6217
 epoch: 72, train_loss: 0.5315, test_loss: 1.2192, test_f1: 0.6265
 epoch: 73, train_loss: 0.5421, test_loss: 1.1774, test_f1: 0.6506
 epoch: 74, train_loss: 0.5348, test_loss: 1.1968, test_f1: 0.6453
 epoch: 75, train_loss: 0.5243, test_loss: 1.2160, test_f1: 0.6313
 epoch: 76, train_loss: 0.5127, test_loss: 1.2435, test_f1: 0.6396
 epoch: 77, train_loss: 0.5093, test_loss: 1.2694, test_f1: 0.6247
 epoch: 78, train_loss: 0.5142, test_loss: 1.2408, test_f1: 0.6433
 epoch: 79, train_loss: 0.4993, test_loss: 1.2438, test_f1: 0.6432
 epoch: 80, train_loss: 0.5121, test_loss: 1.2594, test_f1: 0.6409
 epoch: 81, train_loss: 0.4943, test_loss: 1.2635, test_f1: 0.6435
 epoch: 82, train_loss: 0.5083, test_loss: 1.2799, test_f1: 0.6176
 epoch: 83, train_loss: 0.5110, test_loss: 1.2726, test_f1: 0.6225
 epoch: 84, train_loss: 0.4894, test_loss: 1.3034, test_f1: 0.6482
 epoch: 85, train_loss: 0.5160, test_loss: 1.2914, test_f1: 0.6478
 epoch: 86, train_loss: 0.4953, test_loss: 1.3226, test_f1: 0.6364
 epoch: 87, train_loss: 0.4768, test_loss: 1.2680, test_f1: 0.6451
 epoch: 88, train_loss: 0.4832, test_loss: 1.3225, test_f1: 0.6513
 epoch: 89, train_loss: 0.4771, test_loss: 1.3566, test_f1: 0.6258
 epoch: 90, train_loss: 0.4724, test_loss: 1.3668, test_f1: 0.6200
 epoch: 91, train_loss: 0.4935, test_loss: 1.3926, test_f1: 0.6325
 epoch: 92, train_loss: 0.4656, test_loss: 1.4065, test_f1: 0.6102
 epoch: 93, train_loss: 0.4886, test_loss: 1.3641, test_f1: 0.6180
 epoch: 94, train_loss: 0.4735, test_loss: 1.3726, test_f1: 0.6335
 epoch: 95, train_loss: 0.4682, test_loss: 1.4112, test_f1: 0.6148
 epoch: 96, train_loss: 0.4677, test_loss: 1.4278, test_f1: 0.6143
 epoch: 97, train_loss: 0.4741, test_loss: 1.4090, test_f1: 0.5885
 epoch: 98, train_loss: 0.4581, test_loss: 1.4254, test_f1: 0.6075
 epoch: 99, train_loss: 0.4449, test_loss: 1.4367, test_f1: 0.5910
##################ITERATION #8 ****************************************
 epoch: 0, train_loss: 1.2544, test_loss: 1.2939, test_f1: 0.3210
 epoch: 1, train_loss: 1.1106, test_loss: 1.2324, test_f1: 0.2814
 epoch: 2, train_loss: 1.0905, test_loss: 1.1790, test_f1: 0.4587
 epoch: 3, train_loss: 1.0793, test_loss: 1.1188, test_f1: 0.4701
 epoch: 4, train_loss: 1.0455, test_loss: 1.0760, test_f1: 0.5058
 epoch: 5, train_loss: 1.0136, test_loss: 1.0734, test_f1: 0.5305
 epoch: 6, train_loss: 0.9960, test_loss: 1.0599, test_f1: 0.5125
 epoch: 7, train_loss: 0.9942, test_loss: 1.0603, test_f1: 0.5374
 epoch: 8, train_loss: 0.9601, test_loss: 1.0459, test_f1: 0.5066
 epoch: 9, train_loss: 0.9607, test_loss: 1.0613, test_f1: 0.5357
 epoch: 10, train_loss: 0.9381, test_loss: 1.0574, test_f1: 0.5236
 epoch: 11, train_loss: 0.9240, test_loss: 1.0285, test_f1: 0.5073
 epoch: 12, train_loss: 0.9269, test_loss: 1.0348, test_f1: 0.5526
 epoch: 13, train_loss: 0.8982, test_loss: 1.0215, test_f1: 0.5618
 epoch: 14, train_loss: 0.8969, test_loss: 1.0067, test_f1: 0.5600
 epoch: 15, train_loss: 0.8943, test_loss: 1.0308, test_f1: 0.5768
 epoch: 16, train_loss: 0.8691, test_loss: 1.0230, test_f1: 0.5779
 epoch: 17, train_loss: 0.8728, test_loss: 1.0368, test_f1: 0.5778
 epoch: 18, train_loss: 0.8615, test_loss: 1.0425, test_f1: 0.5868
 epoch: 19, train_loss: 0.8505, test_loss: 1.0446, test_f1: 0.5584
 epoch: 20, train_loss: 0.8701, test_loss: 1.0628, test_f1: 0.5586
 epoch: 21, train_loss: 0.8338, test_loss: 1.0235, test_f1: 0.5843
 epoch: 22, train_loss: 0.8255, test_loss: 1.0338, test_f1: 0.6080
 epoch: 23, train_loss: 0.8091, test_loss: 1.0280, test_f1: 0.5707
 epoch: 24, train_loss: 0.8076, test_loss: 1.0467, test_f1: 0.5721
 epoch: 25, train_loss: 0.8165, test_loss: 1.0283, test_f1: 0.5813
 epoch: 26, train_loss: 0.7905, test_loss: 0.9944, test_f1: 0.6006
 epoch: 27, train_loss: 0.7837, test_loss: 1.0685, test_f1: 0.5933
 epoch: 28, train_loss: 0.7700, test_loss: 1.0124, test_f1: 0.5877
 epoch: 29, train_loss: 0.7812, test_loss: 1.0750, test_f1: 0.6070
 epoch: 30, train_loss: 0.7655, test_loss: 1.0417, test_f1: 0.6015
 epoch: 31, train_loss: 0.7585, test_loss: 1.0502, test_f1: 0.5992
 epoch: 32, train_loss: 0.7762, test_loss: 1.0838, test_f1: 0.5970
 epoch: 33, train_loss: 0.7346, test_loss: 1.0942, test_f1: 0.6000
 epoch: 34, train_loss: 0.7692, test_loss: 1.0752, test_f1: 0.5872
 epoch: 35, train_loss: 0.7503, test_loss: 1.0727, test_f1: 0.5994
 epoch: 36, train_loss: 0.7292, test_loss: 1.0922, test_f1: 0.5881
 epoch: 37, train_loss: 0.7262, test_loss: 1.0954, test_f1: 0.6061
 epoch: 38, train_loss: 0.6929, test_loss: 1.0774, test_f1: 0.6005
 epoch: 39, train_loss: 0.7147, test_loss: 1.0940, test_f1: 0.6225
 epoch: 40, train_loss: 0.7111, test_loss: 1.1564, test_f1: 0.5957
 epoch: 41, train_loss: 0.7078, test_loss: 1.1285, test_f1: 0.6157
 epoch: 42, train_loss: 0.7035, test_loss: 1.1531, test_f1: 0.5972
 epoch: 43, train_loss: 0.6872, test_loss: 1.1866, test_f1: 0.5946
 epoch: 44, train_loss: 0.6905, test_loss: 1.1245, test_f1: 0.6229
 epoch: 45, train_loss: 0.6866, test_loss: 1.1986, test_f1: 0.6002
 epoch: 46, train_loss: 0.6900, test_loss: 1.1628, test_f1: 0.6068
 epoch: 47, train_loss: 0.6739, test_loss: 1.1949, test_f1: 0.5939
 epoch: 48, train_loss: 0.6472, test_loss: 1.1634, test_f1: 0.6080
 epoch: 49, train_loss: 0.6520, test_loss: 1.1955, test_f1: 0.6013
 epoch: 50, train_loss: 0.6495, test_loss: 1.1631, test_f1: 0.6151
 epoch: 51, train_loss: 0.6327, test_loss: 1.1486, test_f1: 0.6029
 epoch: 52, train_loss: 0.6217, test_loss: 1.1834, test_f1: 0.6023
 epoch: 53, train_loss: 0.6302, test_loss: 1.1900, test_f1: 0.6145
 epoch: 54, train_loss: 0.6133, test_loss: 1.1817, test_f1: 0.6018
 epoch: 55, train_loss: 0.6014, test_loss: 1.2090, test_f1: 0.6089
 epoch: 56, train_loss: 0.6125, test_loss: 1.2175, test_f1: 0.6092
 epoch: 57, train_loss: 0.6100, test_loss: 1.2250, test_f1: 0.5943
 epoch: 58, train_loss: 0.6068, test_loss: 1.2377, test_f1: 0.5893
 epoch: 59, train_loss: 0.6117, test_loss: 1.2180, test_f1: 0.5963
 epoch: 60, train_loss: 0.6068, test_loss: 1.2408, test_f1: 0.6096
 epoch: 61, train_loss: 0.6000, test_loss: 1.2556, test_f1: 0.6133
 epoch: 62, train_loss: 0.5948, test_loss: 1.2531, test_f1: 0.5999
 epoch: 63, train_loss: 0.5951, test_loss: 1.2463, test_f1: 0.6097
 epoch: 64, train_loss: 0.5815, test_loss: 1.2370, test_f1: 0.6115
 epoch: 65, train_loss: 0.5882, test_loss: 1.2836, test_f1: 0.6117
 epoch: 66, train_loss: 0.5752, test_loss: 1.3143, test_f1: 0.5987
 epoch: 67, train_loss: 0.5736, test_loss: 1.3613, test_f1: 0.5959
 epoch: 68, train_loss: 0.5568, test_loss: 1.3584, test_f1: 0.6036
 epoch: 69, train_loss: 0.5698, test_loss: 1.3071, test_f1: 0.6141
 epoch: 70, train_loss: 0.5536, test_loss: 1.3108, test_f1: 0.5994
 epoch: 71, train_loss: 0.5678, test_loss: 1.3449, test_f1: 0.5917
 epoch: 72, train_loss: 0.5583, test_loss: 1.3668, test_f1: 0.5931
 epoch: 73, train_loss: 0.5499, test_loss: 1.3854, test_f1: 0.5940
 epoch: 74, train_loss: 0.5380, test_loss: 1.3678, test_f1: 0.6031
 epoch: 75, train_loss: 0.5408, test_loss: 1.3717, test_f1: 0.6045
 epoch: 76, train_loss: 0.5300, test_loss: 1.4036, test_f1: 0.5963
 epoch: 77, train_loss: 0.5615, test_loss: 1.3733, test_f1: 0.6102
 epoch: 78, train_loss: 0.5276, test_loss: 1.3874, test_f1: 0.6143
 epoch: 79, train_loss: 0.5415, test_loss: 1.3811, test_f1: 0.6087
 epoch: 80, train_loss: 0.5464, test_loss: 1.4227, test_f1: 0.5926
 epoch: 81, train_loss: 0.5404, test_loss: 1.4898, test_f1: 0.5933
 epoch: 82, train_loss: 0.5572, test_loss: 1.3915, test_f1: 0.6080
 epoch: 83, train_loss: 0.5258, test_loss: 1.4213, test_f1: 0.6010
 epoch: 84, train_loss: 0.5181, test_loss: 1.4409, test_f1: 0.6084
 epoch: 85, train_loss: 0.5173, test_loss: 1.4105, test_f1: 0.6187
 epoch: 86, train_loss: 0.5053, test_loss: 1.4480, test_f1: 0.6114
 epoch: 87, train_loss: 0.4921, test_loss: 1.4827, test_f1: 0.6034
 epoch: 88, train_loss: 0.5126, test_loss: 1.5089, test_f1: 0.6086
 epoch: 89, train_loss: 0.5159, test_loss: 1.5046, test_f1: 0.6136
 epoch: 90, train_loss: 0.4991, test_loss: 1.5050, test_f1: 0.6110
 epoch: 91, train_loss: 0.5006, test_loss: 1.5332, test_f1: 0.6188
 epoch: 92, train_loss: 0.4950, test_loss: 1.5713, test_f1: 0.5914
 epoch: 93, train_loss: 0.5249, test_loss: 1.6047, test_f1: 0.6033
 epoch: 94, train_loss: 0.5050, test_loss: 1.5213, test_f1: 0.6108
 epoch: 95, train_loss: 0.5021, test_loss: 1.5212, test_f1: 0.6173
 epoch: 96, train_loss: 0.4934, test_loss: 1.5410, test_f1: 0.6098
 epoch: 97, train_loss: 0.4750, test_loss: 1.5567, test_f1: 0.6214
 epoch: 98, train_loss: 0.4950, test_loss: 1.5253, test_f1: 0.6138
 epoch: 99, train_loss: 0.5138, test_loss: 1.5761, test_f1: 0.6142
##################ITERATION #9 ****************************************
 epoch: 0, train_loss: 1.2658, test_loss: 1.3508, test_f1: 0.1786
 epoch: 1, train_loss: 1.1029, test_loss: 1.2676, test_f1: 0.2548
 epoch: 2, train_loss: 1.0442, test_loss: 1.1661, test_f1: 0.4426
 epoch: 3, train_loss: 1.0456, test_loss: 1.1136, test_f1: 0.5257
 epoch: 4, train_loss: 1.0068, test_loss: 1.0842, test_f1: 0.5092
 epoch: 5, train_loss: 0.9935, test_loss: 1.0813, test_f1: 0.4928
 epoch: 6, train_loss: 0.9624, test_loss: 1.0830, test_f1: 0.4994
 epoch: 7, train_loss: 0.9576, test_loss: 1.0605, test_f1: 0.5337
 epoch: 8, train_loss: 0.9332, test_loss: 1.0613, test_f1: 0.5339
 epoch: 9, train_loss: 0.9299, test_loss: 1.0440, test_f1: 0.5600
 epoch: 10, train_loss: 0.9288, test_loss: 1.0386, test_f1: 0.5295
 epoch: 11, train_loss: 0.9023, test_loss: 1.0317, test_f1: 0.5733
 epoch: 12, train_loss: 0.9015, test_loss: 1.0112, test_f1: 0.5637
 epoch: 13, train_loss: 0.8703, test_loss: 1.0438, test_f1: 0.5523
 epoch: 14, train_loss: 0.8788, test_loss: 1.0348, test_f1: 0.5810
 epoch: 15, train_loss: 0.8587, test_loss: 1.0432, test_f1: 0.5747
 epoch: 16, train_loss: 0.8481, test_loss: 1.0264, test_f1: 0.5935
 epoch: 17, train_loss: 0.8320, test_loss: 1.0422, test_f1: 0.5585
 epoch: 18, train_loss: 0.8308, test_loss: 1.0442, test_f1: 0.5831
 epoch: 19, train_loss: 0.8238, test_loss: 1.0934, test_f1: 0.5858
 epoch: 20, train_loss: 0.8246, test_loss: 1.0266, test_f1: 0.5830
 epoch: 21, train_loss: 0.8217, test_loss: 1.0760, test_f1: 0.5787
 epoch: 22, train_loss: 0.7970, test_loss: 1.0479, test_f1: 0.5737
 epoch: 23, train_loss: 0.7898, test_loss: 1.0330, test_f1: 0.5917
 epoch: 24, train_loss: 0.7838, test_loss: 1.0802, test_f1: 0.5763
 epoch: 25, train_loss: 0.7855, test_loss: 1.0407, test_f1: 0.5833
 epoch: 26, train_loss: 0.7577, test_loss: 1.0660, test_f1: 0.5799
 epoch: 27, train_loss: 0.7645, test_loss: 1.0514, test_f1: 0.5812
 epoch: 28, train_loss: 0.7747, test_loss: 1.0619, test_f1: 0.5869
 epoch: 29, train_loss: 0.7562, test_loss: 1.0835, test_f1: 0.5622
 epoch: 30, train_loss: 0.7444, test_loss: 1.0755, test_f1: 0.5729
 epoch: 31, train_loss: 0.7476, test_loss: 1.0644, test_f1: 0.5734
 epoch: 32, train_loss: 0.7376, test_loss: 1.1216, test_f1: 0.5935
 epoch: 33, train_loss: 0.7288, test_loss: 1.1219, test_f1: 0.5688
 epoch: 34, train_loss: 0.7197, test_loss: 1.0887, test_f1: 0.5868
 epoch: 35, train_loss: 0.7056, test_loss: 1.1616, test_f1: 0.5820
 epoch: 36, train_loss: 0.7321, test_loss: 1.1331, test_f1: 0.5816
 epoch: 37, train_loss: 0.7080, test_loss: 1.1238, test_f1: 0.5848
 epoch: 38, train_loss: 0.7244, test_loss: 1.1362, test_f1: 0.5938
 epoch: 39, train_loss: 0.7003, test_loss: 1.1112, test_f1: 0.5976
 epoch: 40, train_loss: 0.6832, test_loss: 1.1936, test_f1: 0.5722
 epoch: 41, train_loss: 0.7077, test_loss: 1.1506, test_f1: 0.6033
 epoch: 42, train_loss: 0.6983, test_loss: 1.1724, test_f1: 0.6051
 epoch: 43, train_loss: 0.6715, test_loss: 1.2310, test_f1: 0.5685
 epoch: 44, train_loss: 0.6879, test_loss: 1.1404, test_f1: 0.6039
 epoch: 45, train_loss: 0.6613, test_loss: 1.1990, test_f1: 0.5957
 epoch: 46, train_loss: 0.6583, test_loss: 1.1633, test_f1: 0.6032
 epoch: 47, train_loss: 0.6572, test_loss: 1.2784, test_f1: 0.5883
 epoch: 48, train_loss: 0.6561, test_loss: 1.1496, test_f1: 0.5893
 epoch: 49, train_loss: 0.6610, test_loss: 1.2400, test_f1: 0.5884
 epoch: 50, train_loss: 0.6488, test_loss: 1.2851, test_f1: 0.5880
 epoch: 51, train_loss: 0.6343, test_loss: 1.2368, test_f1: 0.6006
 epoch: 52, train_loss: 0.6136, test_loss: 1.2377, test_f1: 0.6015
 epoch: 53, train_loss: 0.6071, test_loss: 1.1970, test_f1: 0.6239
 epoch: 54, train_loss: 0.6141, test_loss: 1.2581, test_f1: 0.5933
 epoch: 55, train_loss: 0.6044, test_loss: 1.2624, test_f1: 0.5906
 epoch: 56, train_loss: 0.5982, test_loss: 1.2908, test_f1: 0.5866
 epoch: 57, train_loss: 0.5938, test_loss: 1.2937, test_f1: 0.5681
 epoch: 58, train_loss: 0.5968, test_loss: 1.2958, test_f1: 0.5862
 epoch: 59, train_loss: 0.5936, test_loss: 1.2806, test_f1: 0.5859
 epoch: 60, train_loss: 0.5844, test_loss: 1.3173, test_f1: 0.5884
 epoch: 61, train_loss: 0.5872, test_loss: 1.2973, test_f1: 0.6040
 epoch: 62, train_loss: 0.5995, test_loss: 1.2754, test_f1: 0.5916
 epoch: 63, train_loss: 0.5755, test_loss: 1.3084, test_f1: 0.6041
 epoch: 64, train_loss: 0.5964, test_loss: 1.3387, test_f1: 0.5990
 epoch: 65, train_loss: 0.5735, test_loss: 1.3084, test_f1: 0.6037
 epoch: 66, train_loss: 0.5480, test_loss: 1.3441, test_f1: 0.5906
 epoch: 67, train_loss: 0.5790, test_loss: 1.3645, test_f1: 0.5764
 epoch: 68, train_loss: 0.5801, test_loss: 1.3712, test_f1: 0.5883
 epoch: 69, train_loss: 0.5537, test_loss: 1.3669, test_f1: 0.5938
 epoch: 70, train_loss: 0.5475, test_loss: 1.4078, test_f1: 0.5882
 epoch: 71, train_loss: 0.5700, test_loss: 1.4080, test_f1: 0.5964
 epoch: 72, train_loss: 0.5553, test_loss: 1.3932, test_f1: 0.5965
 epoch: 73, train_loss: 0.5478, test_loss: 1.3959, test_f1: 0.6147
 epoch: 74, train_loss: 0.5475, test_loss: 1.4029, test_f1: 0.5990
 epoch: 75, train_loss: 0.5411, test_loss: 1.3858, test_f1: 0.5938
 epoch: 76, train_loss: 0.5420, test_loss: 1.3916, test_f1: 0.5920
 epoch: 77, train_loss: 0.5323, test_loss: 1.3977, test_f1: 0.6021
 epoch: 78, train_loss: 0.5327, test_loss: 1.4592, test_f1: 0.5966
 epoch: 79, train_loss: 0.5260, test_loss: 1.4204, test_f1: 0.5941
 epoch: 80, train_loss: 0.5186, test_loss: 1.4707, test_f1: 0.6022
 epoch: 81, train_loss: 0.5304, test_loss: 1.4486, test_f1: 0.6176
 epoch: 82, train_loss: 0.5102, test_loss: 1.5049, test_f1: 0.6146
 epoch: 83, train_loss: 0.5107, test_loss: 1.4223, test_f1: 0.5915
 epoch: 84, train_loss: 0.5168, test_loss: 1.4384, test_f1: 0.5936
 epoch: 85, train_loss: 0.4957, test_loss: 1.4797, test_f1: 0.5856
 epoch: 86, train_loss: 0.5075, test_loss: 1.5199, test_f1: 0.5941
 epoch: 87, train_loss: 0.5234, test_loss: 1.4363, test_f1: 0.5971
 epoch: 88, train_loss: 0.5032, test_loss: 1.5252, test_f1: 0.5890
 epoch: 89, train_loss: 0.4900, test_loss: 1.5041, test_f1: 0.6017
 epoch: 90, train_loss: 0.5257, test_loss: 1.4851, test_f1: 0.6041
 epoch: 91, train_loss: 0.5050, test_loss: 1.4730, test_f1: 0.5870
 epoch: 92, train_loss: 0.4995, test_loss: 1.5042, test_f1: 0.6072
 epoch: 93, train_loss: 0.4981, test_loss: 1.5502, test_f1: 0.5952
 epoch: 94, train_loss: 0.4938, test_loss: 1.5153, test_f1: 0.5815
 epoch: 95, train_loss: 0.4763, test_loss: 1.5069, test_f1: 0.5783
 epoch: 96, train_loss: 0.4890, test_loss: 1.5671, test_f1: 0.6043
 epoch: 97, train_loss: 0.4883, test_loss: 1.5032, test_f1: 0.6145
 epoch: 98, train_loss: 0.4654, test_loss: 1.5299, test_f1: 0.5934
 epoch: 99, train_loss: 0.4692, test_loss: 1.6368, test_f1: 0.6047

Training completed in 504.52 seconds
Best F1: 0.6712 at epoch 85
Mean F1 across iterations: 0.6378  0.0249
========================FINAL RESULTS================================
FEGIN weighted F1: 0.6712  0.0249
python main.py --data ltspice_demos --representation component_net --model FEGIN --layers 5 --hiddens 128 --batch_size 64 --lr 0.0001 --emb_size 128 --epochs 100 --save_appendix component_net_L5_H128_BS64_LR0.0001_E128 --no_val
-----



STDERR:
  File "main.py", line 370, in <module>
    main()
  File "main.py", line 254, in main
    dataset = dataset_class(
  File "/home/philip/projects/ltspice_examples_code_repo/Circuit-Completion-Using-GNNs/component_classification_with_link_prediction_head/evaluation/FEGIN/kernel/circuit_datasets.py", line 15, in __init__
    self.data, self.slices = torch.load(self.processed_paths[0])
  File "/home/philip/.local/lib/python3.8/site-packages/torch/serialization.py", line 1040, in load
    warnings.warn(
  File "/usr/lib/python3.8/warnings.py", line 109, in _showwarnmsg
    sw(msg.message, msg.category, msg.filename, msg.lineno,
  File "main.py", line 47, in warn_with_traceback
    traceback.print_stack(file=log)
/home/philip/projects/ltspice_examples_code_repo/Circuit-Completion-Using-GNNs/component_classification_with_link_prediction_head/evaluation/FEGIN/kernel/circuit_datasets.py:15: FutureWarning: You are using `torch.load` with `weights_only=False` (the current default value), which uses the default pickle module implicitly. It is possible to construct malicious pickle data which will execute arbitrary code during unpickling (See https://github.com/pytorch/pytorch/blob/main/SECURITY.md#untrusted-models for more details). In a future release, the default value for `weights_only` will be flipped to `True`. This limits the functions that could be executed during unpickling. Arbitrary objects will no longer be allowed to be loaded via this mode unless they are explicitly allowlisted by the user via `torch.serialization.add_safe_globals`. We recommend you start setting `weights_only=True` for any use case where you don't have full control of the loaded file. Please open an issue on GitHub for any issues related to this experimental feature.
  self.data, self.slices = torch.load(self.processed_paths[0])
