STDOUT:
Results will be saved in /home/philip/projects/llm_inference_code_repo/Circuit-Completion-Using-GNNs/component_classification_with_link_prediction_head/evaluation/FEGIN/results/model_FEGIN_dataset_ltspice_examples
Command line input: python main.py --data ltspice_examples --representation component_component --model FEGIN --layers 4 --hiddens 64 --batch_size 32 --lr 0.001 --emb_size 128 --epochs 100 --save_appendix component_component_L4_H64_BS32_LR0.001_E128 --no_val
 is saved.
-----
ltspice_examples - FEGIN
Using 4 layers, 64 hidden units, h = 2
Loading component_component representation dataset
ENTERED
Training FEGIN on component_component representation
Train: 3556, Test: 845
##################ITERATION #0 ****************************************
 epoch: 0, train_loss: 1.2647, test_loss: 1.1783, test_f1: 0.3884
 epoch: 1, train_loss: 1.1719, test_loss: 1.0974, test_f1: 0.4541
 epoch: 2, train_loss: 1.1170, test_loss: 1.0829, test_f1: 0.4711
 epoch: 3, train_loss: 1.0696, test_loss: 1.0563, test_f1: 0.4630
 epoch: 4, train_loss: 1.0420, test_loss: 1.0075, test_f1: 0.5141
 epoch: 5, train_loss: 1.0174, test_loss: 0.9737, test_f1: 0.4864
 epoch: 6, train_loss: 0.9900, test_loss: 0.9425, test_f1: 0.5095
 epoch: 7, train_loss: 0.9762, test_loss: 0.9674, test_f1: 0.4878
 epoch: 8, train_loss: 0.9504, test_loss: 1.0040, test_f1: 0.4722
 epoch: 9, train_loss: 0.9333, test_loss: 0.9416, test_f1: 0.5389
 epoch: 10, train_loss: 0.9033, test_loss: 0.9473, test_f1: 0.4934
 epoch: 11, train_loss: 0.9074, test_loss: 0.9627, test_f1: 0.5119
 epoch: 12, train_loss: 0.9099, test_loss: 0.9973, test_f1: 0.5044
 epoch: 13, train_loss: 0.8804, test_loss: 1.0110, test_f1: 0.5179
 epoch: 14, train_loss: 0.8816, test_loss: 0.9583, test_f1: 0.5318
 epoch: 15, train_loss: 0.8702, test_loss: 0.9857, test_f1: 0.5433
 epoch: 16, train_loss: 0.8526, test_loss: 0.9620, test_f1: 0.5239
 epoch: 17, train_loss: 0.8459, test_loss: 0.9978, test_f1: 0.5020
 epoch: 18, train_loss: 0.8577, test_loss: 0.9677, test_f1: 0.5570
 epoch: 19, train_loss: 0.8353, test_loss: 0.9932, test_f1: 0.5241
 epoch: 20, train_loss: 0.8277, test_loss: 1.0459, test_f1: 0.5377
 epoch: 21, train_loss: 0.8110, test_loss: 1.0537, test_f1: 0.5419
 epoch: 22, train_loss: 0.8140, test_loss: 1.0151, test_f1: 0.5647
 epoch: 23, train_loss: 0.8212, test_loss: 1.0218, test_f1: 0.5455
 epoch: 24, train_loss: 0.8057, test_loss: 1.0543, test_f1: 0.5305
 epoch: 25, train_loss: 0.7914, test_loss: 1.1407, test_f1: 0.5363
 epoch: 26, train_loss: 0.7750, test_loss: 1.0687, test_f1: 0.5541
 epoch: 27, train_loss: 0.7755, test_loss: 1.1331, test_f1: 0.5518
 epoch: 28, train_loss: 0.8179, test_loss: 0.9929, test_f1: 0.5553
 epoch: 29, train_loss: 0.8033, test_loss: 0.9902, test_f1: 0.5370
 epoch: 30, train_loss: 0.7786, test_loss: 1.0740, test_f1: 0.5280
 epoch: 31, train_loss: 0.7569, test_loss: 1.1022, test_f1: 0.5357
 epoch: 32, train_loss: 0.7538, test_loss: 0.9856, test_f1: 0.5658
 epoch: 33, train_loss: 0.7809, test_loss: 1.0771, test_f1: 0.5525
 epoch: 34, train_loss: 0.7380, test_loss: 1.0371, test_f1: 0.5109
 epoch: 35, train_loss: 0.7288, test_loss: 1.1065, test_f1: 0.5327
 epoch: 36, train_loss: 0.7364, test_loss: 1.0731, test_f1: 0.5699
 epoch: 37, train_loss: 0.7270, test_loss: 1.0909, test_f1: 0.5487
 epoch: 38, train_loss: 0.7315, test_loss: 1.0857, test_f1: 0.5622
 epoch: 39, train_loss: 0.7113, test_loss: 1.1909, test_f1: 0.5374
 epoch: 40, train_loss: 0.7129, test_loss: 1.1632, test_f1: 0.5577
 epoch: 41, train_loss: 0.7090, test_loss: 1.1114, test_f1: 0.5579
 epoch: 42, train_loss: 0.7111, test_loss: 1.1757, test_f1: 0.5714
 epoch: 43, train_loss: 0.6987, test_loss: 1.2005, test_f1: 0.5758
 epoch: 44, train_loss: 0.6934, test_loss: 1.0945, test_f1: 0.5478
 epoch: 45, train_loss: 0.6951, test_loss: 1.3494, test_f1: 0.5116
 epoch: 46, train_loss: 0.6848, test_loss: 1.1063, test_f1: 0.5703
 epoch: 47, train_loss: 0.6889, test_loss: 1.1168, test_f1: 0.5428
 epoch: 48, train_loss: 0.6881, test_loss: 1.1595, test_f1: 0.5675
 epoch: 49, train_loss: 0.6679, test_loss: 1.2089, test_f1: 0.5360
 epoch: 50, train_loss: 0.6728, test_loss: 1.1335, test_f1: 0.5614
 epoch: 51, train_loss: 0.6383, test_loss: 1.2122, test_f1: 0.5662
 epoch: 52, train_loss: 0.6229, test_loss: 1.3698, test_f1: 0.5557
 epoch: 53, train_loss: 0.6123, test_loss: 1.2622, test_f1: 0.5438
 epoch: 54, train_loss: 0.6113, test_loss: 1.2981, test_f1: 0.5545
 epoch: 55, train_loss: 0.6016, test_loss: 1.3052, test_f1: 0.5537
 epoch: 56, train_loss: 0.6071, test_loss: 1.4386, test_f1: 0.5087
 epoch: 57, train_loss: 0.5834, test_loss: 1.2882, test_f1: 0.5579
 epoch: 58, train_loss: 0.5813, test_loss: 1.3178, test_f1: 0.5788
 epoch: 59, train_loss: 0.5860, test_loss: 1.3835, test_f1: 0.5586
 epoch: 60, train_loss: 0.5739, test_loss: 1.3683, test_f1: 0.5366
 epoch: 61, train_loss: 0.5636, test_loss: 1.3202, test_f1: 0.5620
 epoch: 62, train_loss: 0.6379, test_loss: 1.2907, test_f1: 0.5462
 epoch: 63, train_loss: 0.6030, test_loss: 1.2986, test_f1: 0.5452
 epoch: 64, train_loss: 0.5883, test_loss: 1.3327, test_f1: 0.5496
 epoch: 65, train_loss: 0.5778, test_loss: 1.3048, test_f1: 0.5529
 epoch: 66, train_loss: 0.5635, test_loss: 1.3840, test_f1: 0.5542
 epoch: 67, train_loss: 0.5628, test_loss: 1.3995, test_f1: 0.5463
 epoch: 68, train_loss: 0.5633, test_loss: 1.3586, test_f1: 0.5567
 epoch: 69, train_loss: 0.5663, test_loss: 1.5470, test_f1: 0.5305
 epoch: 70, train_loss: 0.5693, test_loss: 1.4566, test_f1: 0.5470
 epoch: 71, train_loss: 0.5372, test_loss: 1.4447, test_f1: 0.5465
 epoch: 72, train_loss: 0.5382, test_loss: 1.4362, test_f1: 0.5470
 epoch: 73, train_loss: 0.5489, test_loss: 1.4081, test_f1: 0.5620
 epoch: 74, train_loss: 0.5500, test_loss: 1.4842, test_f1: 0.5398
 epoch: 75, train_loss: 0.5457, test_loss: 1.4551, test_f1: 0.5394
 epoch: 76, train_loss: 0.5306, test_loss: 1.4945, test_f1: 0.5677
 epoch: 77, train_loss: 0.5434, test_loss: 1.4614, test_f1: 0.5529
 epoch: 78, train_loss: 0.5408, test_loss: 1.4120, test_f1: 0.5554
 epoch: 79, train_loss: 0.5454, test_loss: 1.4634, test_f1: 0.5434
 epoch: 80, train_loss: 0.5242, test_loss: 1.4999, test_f1: 0.5274
 epoch: 81, train_loss: 0.5069, test_loss: 1.5855, test_f1: 0.5480
 epoch: 82, train_loss: 0.5223, test_loss: 1.5125, test_f1: 0.5642
 epoch: 83, train_loss: 0.5163, test_loss: 1.5045, test_f1: 0.5320
 epoch: 84, train_loss: 0.5233, test_loss: 1.4509, test_f1: 0.5488
 epoch: 85, train_loss: 0.5050, test_loss: 1.5433, test_f1: 0.5417
 epoch: 86, train_loss: 0.5071, test_loss: 1.4883, test_f1: 0.5468
 epoch: 87, train_loss: 0.5077, test_loss: 1.5652, test_f1: 0.5436
 epoch: 88, train_loss: 0.5038, test_loss: 1.5581, test_f1: 0.5599
 epoch: 89, train_loss: 0.5456, test_loss: 1.4624, test_f1: 0.5573
 epoch: 90, train_loss: 0.5054, test_loss: 1.4625, test_f1: 0.5574
 epoch: 91, train_loss: 0.4970, test_loss: 1.5976, test_f1: 0.5291
 epoch: 92, train_loss: 0.4820, test_loss: 1.4748, test_f1: 0.5532
 epoch: 93, train_loss: 0.5666, test_loss: 1.3982, test_f1: 0.5533
 epoch: 94, train_loss: 0.5261, test_loss: 1.3783, test_f1: 0.5469
 epoch: 95, train_loss: 0.5208, test_loss: 1.5337, test_f1: 0.5583
 epoch: 96, train_loss: 0.4827, test_loss: 1.4850, test_f1: 0.5418
 epoch: 97, train_loss: 0.4856, test_loss: 1.5052, test_f1: 0.5640
 epoch: 98, train_loss: 0.4748, test_loss: 1.4986, test_f1: 0.5507
 epoch: 99, train_loss: 0.4803, test_loss: 1.5774, test_f1: 0.5337
##################ITERATION #1 ****************************************
 epoch: 0, train_loss: 1.2290, test_loss: 1.1577, test_f1: 0.4055
 epoch: 1, train_loss: 1.1279, test_loss: 1.0211, test_f1: 0.4516
 epoch: 2, train_loss: 1.0529, test_loss: 1.0266, test_f1: 0.4438
 epoch: 3, train_loss: 1.0320, test_loss: 0.9860, test_f1: 0.4722
 epoch: 4, train_loss: 1.0087, test_loss: 1.0023, test_f1: 0.4620
 epoch: 5, train_loss: 0.9842, test_loss: 0.9324, test_f1: 0.5067
 epoch: 6, train_loss: 0.9722, test_loss: 0.9456, test_f1: 0.5369
 epoch: 7, train_loss: 1.0009, test_loss: 1.0104, test_f1: 0.4845
 epoch: 8, train_loss: 0.9674, test_loss: 0.9674, test_f1: 0.4990
 epoch: 9, train_loss: 0.9585, test_loss: 0.9902, test_f1: 0.5065
 epoch: 10, train_loss: 0.9415, test_loss: 0.9858, test_f1: 0.4781
 epoch: 11, train_loss: 0.9405, test_loss: 0.9668, test_f1: 0.5274
 epoch: 12, train_loss: 0.9235, test_loss: 0.9507, test_f1: 0.5137
 epoch: 13, train_loss: 0.8991, test_loss: 1.0104, test_f1: 0.4991
 epoch: 14, train_loss: 0.8909, test_loss: 0.9638, test_f1: 0.5384
 epoch: 15, train_loss: 0.8757, test_loss: 1.0033, test_f1: 0.5232
 epoch: 16, train_loss: 0.8755, test_loss: 0.9396, test_f1: 0.5133
 epoch: 17, train_loss: 0.8689, test_loss: 1.0094, test_f1: 0.5505
 epoch: 18, train_loss: 0.8462, test_loss: 1.0089, test_f1: 0.5066
 epoch: 19, train_loss: 0.8599, test_loss: 1.0505, test_f1: 0.5066
 epoch: 20, train_loss: 0.8385, test_loss: 1.0682, test_f1: 0.5234
 epoch: 21, train_loss: 0.8418, test_loss: 1.0396, test_f1: 0.5551
 epoch: 22, train_loss: 0.8281, test_loss: 1.1127, test_f1: 0.5367
 epoch: 23, train_loss: 0.8201, test_loss: 1.0415, test_f1: 0.5305
 epoch: 24, train_loss: 0.8198, test_loss: 0.9648, test_f1: 0.5671
 epoch: 25, train_loss: 0.8101, test_loss: 1.0413, test_f1: 0.5357
 epoch: 26, train_loss: 0.8017, test_loss: 1.0298, test_f1: 0.5523
 epoch: 27, train_loss: 0.7918, test_loss: 1.0691, test_f1: 0.5401
 epoch: 28, train_loss: 0.7712, test_loss: 1.1089, test_f1: 0.5361
 epoch: 29, train_loss: 0.7617, test_loss: 1.1037, test_f1: 0.5402
 epoch: 30, train_loss: 0.7816, test_loss: 1.0582, test_f1: 0.5175
 epoch: 31, train_loss: 0.7408, test_loss: 1.0369, test_f1: 0.5525
 epoch: 32, train_loss: 0.7586, test_loss: 1.1568, test_f1: 0.5537
 epoch: 33, train_loss: 0.7495, test_loss: 1.1037, test_f1: 0.5422
 epoch: 34, train_loss: 0.7472, test_loss: 1.0685, test_f1: 0.5457
 epoch: 35, train_loss: 0.7449, test_loss: 1.1232, test_f1: 0.5322
 epoch: 36, train_loss: 0.7966, test_loss: 1.1076, test_f1: 0.5490
 epoch: 37, train_loss: 0.7704, test_loss: 1.0528, test_f1: 0.5649
 epoch: 38, train_loss: 0.7373, test_loss: 1.0772, test_f1: 0.5400
 epoch: 39, train_loss: 0.7293, test_loss: 1.1525, test_f1: 0.5249
 epoch: 40, train_loss: 0.7819, test_loss: 1.1383, test_f1: 0.5413
 epoch: 41, train_loss: 0.7421, test_loss: 1.1985, test_f1: 0.5385
 epoch: 42, train_loss: 0.7434, test_loss: 1.1412, test_f1: 0.5611
 epoch: 43, train_loss: 0.7466, test_loss: 1.0894, test_f1: 0.5702
 epoch: 44, train_loss: 0.7295, test_loss: 1.1836, test_f1: 0.5331
 epoch: 45, train_loss: 0.7236, test_loss: 1.1404, test_f1: 0.5474
 epoch: 46, train_loss: 0.7285, test_loss: 1.1294, test_f1: 0.5717
 epoch: 47, train_loss: 0.7000, test_loss: 1.1679, test_f1: 0.5598
 epoch: 48, train_loss: 0.6852, test_loss: 1.2351, test_f1: 0.5482
 epoch: 49, train_loss: 0.6856, test_loss: 1.1506, test_f1: 0.5624
 epoch: 50, train_loss: 0.6816, test_loss: 1.1003, test_f1: 0.5841
 epoch: 51, train_loss: 0.6568, test_loss: 1.1595, test_f1: 0.5658
 epoch: 52, train_loss: 0.6384, test_loss: 1.1428, test_f1: 0.5866
 epoch: 53, train_loss: 0.6330, test_loss: 1.2699, test_f1: 0.5398
 epoch: 54, train_loss: 0.6176, test_loss: 1.2109, test_f1: 0.5918
 epoch: 55, train_loss: 0.6276, test_loss: 1.2403, test_f1: 0.5678
 epoch: 56, train_loss: 0.6322, test_loss: 1.2689, test_f1: 0.5452
 epoch: 57, train_loss: 0.6222, test_loss: 1.2093, test_f1: 0.5649
 epoch: 58, train_loss: 0.6397, test_loss: 1.2158, test_f1: 0.5773
 epoch: 59, train_loss: 0.6086, test_loss: 1.2773, test_f1: 0.5569
 epoch: 60, train_loss: 0.5889, test_loss: 1.3071, test_f1: 0.5726
 epoch: 61, train_loss: 0.6019, test_loss: 1.2752, test_f1: 0.5738
 epoch: 62, train_loss: 0.5995, test_loss: 1.2676, test_f1: 0.5778
 epoch: 63, train_loss: 0.5858, test_loss: 1.2790, test_f1: 0.5757
 epoch: 64, train_loss: 0.5895, test_loss: 1.1947, test_f1: 0.5799
 epoch: 65, train_loss: 0.5952, test_loss: 1.2801, test_f1: 0.5543
 epoch: 66, train_loss: 0.5835, test_loss: 1.2119, test_f1: 0.5863
 epoch: 67, train_loss: 0.5693, test_loss: 1.2941, test_f1: 0.5536
 epoch: 68, train_loss: 0.5713, test_loss: 1.2394, test_f1: 0.5828
 epoch: 69, train_loss: 0.5624, test_loss: 1.3040, test_f1: 0.5590
 epoch: 70, train_loss: 0.5715, test_loss: 1.3028, test_f1: 0.5636
 epoch: 71, train_loss: 0.5654, test_loss: 1.3035, test_f1: 0.5735
 epoch: 72, train_loss: 0.5638, test_loss: 1.4198, test_f1: 0.5426
 epoch: 73, train_loss: 0.5531, test_loss: 1.2762, test_f1: 0.5788
 epoch: 74, train_loss: 0.5558, test_loss: 1.3627, test_f1: 0.5740
 epoch: 75, train_loss: 0.5498, test_loss: 1.3488, test_f1: 0.5504
 epoch: 76, train_loss: 0.5288, test_loss: 1.3751, test_f1: 0.5500
 epoch: 77, train_loss: 0.5506, test_loss: 1.3484, test_f1: 0.5759
 epoch: 78, train_loss: 0.5591, test_loss: 1.3237, test_f1: 0.5693
 epoch: 79, train_loss: 0.5544, test_loss: 1.4320, test_f1: 0.5480
 epoch: 80, train_loss: 0.5357, test_loss: 1.3760, test_f1: 0.5441
 epoch: 81, train_loss: 0.5263, test_loss: 1.3471, test_f1: 0.5672
 epoch: 82, train_loss: 0.5313, test_loss: 1.3359, test_f1: 0.5770
 epoch: 83, train_loss: 0.5424, test_loss: 1.3870, test_f1: 0.5942
 epoch: 84, train_loss: 0.5311, test_loss: 1.3433, test_f1: 0.5733
 epoch: 85, train_loss: 0.5445, test_loss: 1.3303, test_f1: 0.5785
 epoch: 86, train_loss: 0.5107, test_loss: 1.3637, test_f1: 0.5577
 epoch: 87, train_loss: 0.5308, test_loss: 1.4016, test_f1: 0.5468
 epoch: 88, train_loss: 0.5063, test_loss: 1.3463, test_f1: 0.5804
 epoch: 89, train_loss: 0.5322, test_loss: 1.4061, test_f1: 0.5947
 epoch: 90, train_loss: 0.5127, test_loss: 1.3729, test_f1: 0.6053
 epoch: 91, train_loss: 0.5017, test_loss: 1.3712, test_f1: 0.5980
 epoch: 92, train_loss: 0.4981, test_loss: 1.4723, test_f1: 0.5577
 epoch: 93, train_loss: 0.5227, test_loss: 1.4725, test_f1: 0.5488
 epoch: 94, train_loss: 0.5474, test_loss: 1.3621, test_f1: 0.5720
 epoch: 95, train_loss: 0.5210, test_loss: 1.6132, test_f1: 0.5550
 epoch: 96, train_loss: 0.5084, test_loss: 1.4545, test_f1: 0.5331
 epoch: 97, train_loss: 0.5162, test_loss: 1.3891, test_f1: 0.5662
 epoch: 98, train_loss: 0.5110, test_loss: 1.4277, test_f1: 0.5619
 epoch: 99, train_loss: 0.5028, test_loss: 1.4100, test_f1: 0.5521
##################ITERATION #2 ****************************************
 epoch: 0, train_loss: 1.2630, test_loss: 1.1311, test_f1: 0.4162
 epoch: 1, train_loss: 1.1583, test_loss: 1.0725, test_f1: 0.4446
 epoch: 2, train_loss: 1.1078, test_loss: 1.0635, test_f1: 0.4150
 epoch: 3, train_loss: 1.0961, test_loss: 1.0252, test_f1: 0.4524
 epoch: 4, train_loss: 1.0476, test_loss: 1.0619, test_f1: 0.4353
 epoch: 5, train_loss: 1.0138, test_loss: 0.9882, test_f1: 0.4519
 epoch: 6, train_loss: 1.0063, test_loss: 0.9631, test_f1: 0.4401
 epoch: 7, train_loss: 0.9662, test_loss: 0.9995, test_f1: 0.4552
 epoch: 8, train_loss: 0.9728, test_loss: 0.9768, test_f1: 0.4718
 epoch: 9, train_loss: 0.9669, test_loss: 1.0152, test_f1: 0.4741
 epoch: 10, train_loss: 0.9528, test_loss: 0.9649, test_f1: 0.4837
 epoch: 11, train_loss: 0.9459, test_loss: 1.0140, test_f1: 0.4742
 epoch: 12, train_loss: 0.9322, test_loss: 0.9452, test_f1: 0.4968
 epoch: 13, train_loss: 0.9217, test_loss: 1.0720, test_f1: 0.5107
 epoch: 14, train_loss: 0.9166, test_loss: 0.9999, test_f1: 0.5116
 epoch: 15, train_loss: 0.9003, test_loss: 0.9913, test_f1: 0.4846
 epoch: 16, train_loss: 0.9087, test_loss: 0.9384, test_f1: 0.5358
 epoch: 17, train_loss: 0.8639, test_loss: 0.9720, test_f1: 0.5245
 epoch: 18, train_loss: 0.8638, test_loss: 0.9120, test_f1: 0.5222
 epoch: 19, train_loss: 0.8652, test_loss: 1.0305, test_f1: 0.5310
 epoch: 20, train_loss: 0.8646, test_loss: 1.0442, test_f1: 0.5303
 epoch: 21, train_loss: 0.8688, test_loss: 0.9960, test_f1: 0.5686
 epoch: 22, train_loss: 0.8470, test_loss: 1.0477, test_f1: 0.5384
 epoch: 23, train_loss: 0.8243, test_loss: 1.0082, test_f1: 0.5531
 epoch: 24, train_loss: 0.8245, test_loss: 0.9288, test_f1: 0.5397
 epoch: 25, train_loss: 0.8249, test_loss: 1.0441, test_f1: 0.5323
 epoch: 26, train_loss: 0.8229, test_loss: 1.0242, test_f1: 0.5441
 epoch: 27, train_loss: 0.8128, test_loss: 1.0967, test_f1: 0.5233
 epoch: 28, train_loss: 0.7966, test_loss: 1.0548, test_f1: 0.5410
 epoch: 29, train_loss: 0.8085, test_loss: 1.0173, test_f1: 0.5526
 epoch: 30, train_loss: 0.8068, test_loss: 1.1011, test_f1: 0.5313
 epoch: 31, train_loss: 0.7738, test_loss: 1.0717, test_f1: 0.5119
 epoch: 32, train_loss: 0.7737, test_loss: 1.0795, test_f1: 0.5350
 epoch: 33, train_loss: 0.7592, test_loss: 1.0020, test_f1: 0.5631
 epoch: 34, train_loss: 0.7740, test_loss: 1.0450, test_f1: 0.5437
 epoch: 35, train_loss: 0.7709, test_loss: 1.1376, test_f1: 0.5242
 epoch: 36, train_loss: 0.7625, test_loss: 1.0375, test_f1: 0.5694
 epoch: 37, train_loss: 0.7646, test_loss: 1.0689, test_f1: 0.5702
 epoch: 38, train_loss: 0.7702, test_loss: 1.0899, test_f1: 0.5598
 epoch: 39, train_loss: 0.7392, test_loss: 1.1066, test_f1: 0.5367
 epoch: 40, train_loss: 0.7574, test_loss: 1.0618, test_f1: 0.5482
 epoch: 41, train_loss: 0.7357, test_loss: 1.0953, test_f1: 0.5600
 epoch: 42, train_loss: 0.7304, test_loss: 1.0910, test_f1: 0.5544
 epoch: 43, train_loss: 0.7477, test_loss: 1.0971, test_f1: 0.5367
 epoch: 44, train_loss: 0.7287, test_loss: 1.1232, test_f1: 0.5275
 epoch: 45, train_loss: 0.7055, test_loss: 1.1199, test_f1: 0.5389
 epoch: 46, train_loss: 0.7095, test_loss: 1.1794, test_f1: 0.5411
 epoch: 47, train_loss: 0.7292, test_loss: 1.1264, test_f1: 0.5548
 epoch: 48, train_loss: 0.7266, test_loss: 1.0649, test_f1: 0.5588
 epoch: 49, train_loss: 0.7020, test_loss: 1.0383, test_f1: 0.5437
 epoch: 50, train_loss: 0.7254, test_loss: 1.1400, test_f1: 0.5417
 epoch: 51, train_loss: 0.6645, test_loss: 1.0940, test_f1: 0.5378
 epoch: 52, train_loss: 0.6556, test_loss: 1.1955, test_f1: 0.5398
 epoch: 53, train_loss: 0.6537, test_loss: 1.1600, test_f1: 0.5382
 epoch: 54, train_loss: 0.6455, test_loss: 1.1264, test_f1: 0.5499
 epoch: 55, train_loss: 0.6495, test_loss: 1.1858, test_f1: 0.5484
 epoch: 56, train_loss: 0.6388, test_loss: 1.1739, test_f1: 0.5452
 epoch: 57, train_loss: 0.6134, test_loss: 1.1614, test_f1: 0.5610
 epoch: 58, train_loss: 0.6227, test_loss: 1.2163, test_f1: 0.5350
 epoch: 59, train_loss: 0.6297, test_loss: 1.2472, test_f1: 0.5387
 epoch: 60, train_loss: 0.6254, test_loss: 1.1124, test_f1: 0.5565
 epoch: 61, train_loss: 0.6259, test_loss: 1.2666, test_f1: 0.5506
 epoch: 62, train_loss: 0.6026, test_loss: 1.1796, test_f1: 0.5740
 epoch: 63, train_loss: 0.6297, test_loss: 1.1806, test_f1: 0.5437
 epoch: 64, train_loss: 0.5987, test_loss: 1.1809, test_f1: 0.5600
 epoch: 65, train_loss: 0.5823, test_loss: 1.2061, test_f1: 0.5373
 epoch: 66, train_loss: 0.6011, test_loss: 1.2172, test_f1: 0.5485
 epoch: 67, train_loss: 0.5925, test_loss: 1.2738, test_f1: 0.5377
 epoch: 68, train_loss: 0.5764, test_loss: 1.2395, test_f1: 0.5649
 epoch: 69, train_loss: 0.5852, test_loss: 1.2789, test_f1: 0.5431
 epoch: 70, train_loss: 0.5987, test_loss: 1.2336, test_f1: 0.5449
 epoch: 71, train_loss: 0.5905, test_loss: 1.2492, test_f1: 0.5517
 epoch: 72, train_loss: 0.5818, test_loss: 1.2254, test_f1: 0.5439
 epoch: 73, train_loss: 0.5919, test_loss: 1.2544, test_f1: 0.5435
 epoch: 74, train_loss: 0.5806, test_loss: 1.3149, test_f1: 0.5517
 epoch: 75, train_loss: 0.5814, test_loss: 1.2112, test_f1: 0.5500
 epoch: 76, train_loss: 0.5694, test_loss: 1.2771, test_f1: 0.5451
 epoch: 77, train_loss: 0.5682, test_loss: 1.2913, test_f1: 0.5420
 epoch: 78, train_loss: 0.5500, test_loss: 1.3769, test_f1: 0.5274
 epoch: 79, train_loss: 0.5708, test_loss: 1.2055, test_f1: 0.5659
 epoch: 80, train_loss: 0.5549, test_loss: 1.3122, test_f1: 0.5329
 epoch: 81, train_loss: 0.5479, test_loss: 1.2703, test_f1: 0.5446
 epoch: 82, train_loss: 0.5502, test_loss: 1.2749, test_f1: 0.5568
 epoch: 83, train_loss: 0.5559, test_loss: 1.3355, test_f1: 0.5685
 epoch: 84, train_loss: 0.5406, test_loss: 1.4125, test_f1: 0.5321
 epoch: 85, train_loss: 0.5501, test_loss: 1.3390, test_f1: 0.5630
 epoch: 86, train_loss: 0.5385, test_loss: 1.3617, test_f1: 0.5658
 epoch: 87, train_loss: 0.5440, test_loss: 1.3006, test_f1: 0.5397
 epoch: 88, train_loss: 0.5510, test_loss: 1.3211, test_f1: 0.5504
 epoch: 89, train_loss: 0.5368, test_loss: 1.3098, test_f1: 0.5741
 epoch: 90, train_loss: 0.5166, test_loss: 1.3662, test_f1: 0.5805
 epoch: 91, train_loss: 0.5325, test_loss: 1.2849, test_f1: 0.5721
 epoch: 92, train_loss: 0.5738, test_loss: 1.3331, test_f1: 0.5542
 epoch: 93, train_loss: 0.5264, test_loss: 1.2928, test_f1: 0.5636
 epoch: 94, train_loss: 0.5254, test_loss: 1.3403, test_f1: 0.5586
 epoch: 95, train_loss: 0.4970, test_loss: 1.3493, test_f1: 0.5633
 epoch: 96, train_loss: 0.5211, test_loss: 1.4603, test_f1: 0.5509
 epoch: 97, train_loss: 0.5097, test_loss: 1.3450, test_f1: 0.5922
 epoch: 98, train_loss: 0.5209, test_loss: 1.4290, test_f1: 0.5452
 epoch: 99, train_loss: 0.4941, test_loss: 1.3914, test_f1: 0.5499
##################ITERATION #3 ****************************************
 epoch: 0, train_loss: 1.2815, test_loss: 1.1200, test_f1: 0.4376
 epoch: 1, train_loss: 1.1692, test_loss: 1.0628, test_f1: 0.4462
 epoch: 2, train_loss: 1.1113, test_loss: 1.0551, test_f1: 0.4616
 epoch: 3, train_loss: 1.0718, test_loss: 1.0125, test_f1: 0.4471
 epoch: 4, train_loss: 1.0594, test_loss: 0.9973, test_f1: 0.4682
 epoch: 5, train_loss: 1.0273, test_loss: 0.9796, test_f1: 0.4624
 epoch: 6, train_loss: 1.0128, test_loss: 0.9827, test_f1: 0.4598
 epoch: 7, train_loss: 1.0059, test_loss: 0.9881, test_f1: 0.4626
 epoch: 8, train_loss: 1.0004, test_loss: 1.0027, test_f1: 0.4651
 epoch: 9, train_loss: 0.9625, test_loss: 0.9989, test_f1: 0.4966
 epoch: 10, train_loss: 0.9520, test_loss: 0.9610, test_f1: 0.4725
 epoch: 11, train_loss: 0.9562, test_loss: 0.9865, test_f1: 0.4635
 epoch: 12, train_loss: 0.9789, test_loss: 1.0323, test_f1: 0.4747
 epoch: 13, train_loss: 0.9347, test_loss: 0.9778, test_f1: 0.4928
 epoch: 14, train_loss: 0.9164, test_loss: 0.9870, test_f1: 0.4847
 epoch: 15, train_loss: 0.9211, test_loss: 1.0040, test_f1: 0.4818
 epoch: 16, train_loss: 0.8982, test_loss: 1.0110, test_f1: 0.4939
 epoch: 17, train_loss: 0.8974, test_loss: 1.0091, test_f1: 0.4821
 epoch: 18, train_loss: 0.9008, test_loss: 0.9760, test_f1: 0.5228
 epoch: 19, train_loss: 0.9039, test_loss: 0.9876, test_f1: 0.4887
 epoch: 20, train_loss: 0.8749, test_loss: 1.0610, test_f1: 0.4671
 epoch: 21, train_loss: 0.8596, test_loss: 0.9994, test_f1: 0.5001
 epoch: 22, train_loss: 0.8902, test_loss: 1.0620, test_f1: 0.5111
 epoch: 23, train_loss: 0.8636, test_loss: 0.9996, test_f1: 0.5068
 epoch: 24, train_loss: 0.8645, test_loss: 0.9890, test_f1: 0.5259
 epoch: 25, train_loss: 0.8498, test_loss: 1.0678, test_f1: 0.4915
 epoch: 26, train_loss: 0.8243, test_loss: 1.0800, test_f1: 0.5060
 epoch: 27, train_loss: 0.8580, test_loss: 1.0201, test_f1: 0.5348
 epoch: 28, train_loss: 0.8445, test_loss: 1.0723, test_f1: 0.5128
 epoch: 29, train_loss: 0.8241, test_loss: 1.1182, test_f1: 0.5342
 epoch: 30, train_loss: 0.8249, test_loss: 1.1170, test_f1: 0.5286
 epoch: 31, train_loss: 0.8132, test_loss: 1.1317, test_f1: 0.5515
 epoch: 32, train_loss: 0.8098, test_loss: 1.1248, test_f1: 0.5308
 epoch: 33, train_loss: 0.8167, test_loss: 1.0995, test_f1: 0.5303
 epoch: 34, train_loss: 0.8024, test_loss: 1.1944, test_f1: 0.5287
 epoch: 35, train_loss: 0.8119, test_loss: 1.1587, test_f1: 0.5376
 epoch: 36, train_loss: 0.8083, test_loss: 1.0887, test_f1: 0.5329
 epoch: 37, train_loss: 0.7829, test_loss: 1.1803, test_f1: 0.5271
 epoch: 38, train_loss: 0.7724, test_loss: 1.1727, test_f1: 0.5081
 epoch: 39, train_loss: 0.7793, test_loss: 1.0467, test_f1: 0.5358
 epoch: 40, train_loss: 0.7748, test_loss: 1.1693, test_f1: 0.5153
 epoch: 41, train_loss: 0.7621, test_loss: 1.1682, test_f1: 0.5326
 epoch: 42, train_loss: 0.7472, test_loss: 1.1721, test_f1: 0.5160
 epoch: 43, train_loss: 0.7489, test_loss: 1.1519, test_f1: 0.5240
 epoch: 44, train_loss: 0.7547, test_loss: 1.0568, test_f1: 0.5377
 epoch: 45, train_loss: 0.7366, test_loss: 1.1354, test_f1: 0.5172
 epoch: 46, train_loss: 0.7292, test_loss: 1.1068, test_f1: 0.5398
 epoch: 47, train_loss: 0.7447, test_loss: 1.0938, test_f1: 0.5552
 epoch: 48, train_loss: 0.7218, test_loss: 1.0776, test_f1: 0.5403
 epoch: 49, train_loss: 0.7103, test_loss: 1.1284, test_f1: 0.5369
 epoch: 50, train_loss: 0.7280, test_loss: 1.1121, test_f1: 0.5233
 epoch: 51, train_loss: 0.7101, test_loss: 1.0899, test_f1: 0.5518
 epoch: 52, train_loss: 0.6897, test_loss: 1.0723, test_f1: 0.5484
 epoch: 53, train_loss: 0.6902, test_loss: 1.1061, test_f1: 0.5577
 epoch: 54, train_loss: 0.6728, test_loss: 1.0788, test_f1: 0.5388
 epoch: 55, train_loss: 0.6524, test_loss: 1.1728, test_f1: 0.5533
 epoch: 56, train_loss: 0.7006, test_loss: 1.1284, test_f1: 0.5590
 epoch: 57, train_loss: 0.6589, test_loss: 1.1224, test_f1: 0.5700
 epoch: 58, train_loss: 0.6569, test_loss: 1.1459, test_f1: 0.5426
 epoch: 59, train_loss: 0.6508, test_loss: 1.1484, test_f1: 0.5519
 epoch: 60, train_loss: 0.6395, test_loss: 1.1620, test_f1: 0.5361
 epoch: 61, train_loss: 0.7023, test_loss: 1.1670, test_f1: 0.5421
 epoch: 62, train_loss: 0.6434, test_loss: 1.2775, test_f1: 0.5431
 epoch: 63, train_loss: 0.6483, test_loss: 1.1246, test_f1: 0.5541
 epoch: 64, train_loss: 0.6374, test_loss: 1.2017, test_f1: 0.5237
 epoch: 65, train_loss: 0.6229, test_loss: 1.2152, test_f1: 0.5600
 epoch: 66, train_loss: 0.6178, test_loss: 1.1597, test_f1: 0.5405
 epoch: 67, train_loss: 0.6617, test_loss: 1.2237, test_f1: 0.5354
 epoch: 68, train_loss: 0.6393, test_loss: 1.1693, test_f1: 0.5403
 epoch: 69, train_loss: 0.6218, test_loss: 1.1890, test_f1: 0.5541
 epoch: 70, train_loss: 0.6168, test_loss: 1.1760, test_f1: 0.5449
 epoch: 71, train_loss: 0.6143, test_loss: 1.2647, test_f1: 0.5294
 epoch: 72, train_loss: 0.6032, test_loss: 1.2118, test_f1: 0.5577
 epoch: 73, train_loss: 0.6111, test_loss: 1.1650, test_f1: 0.5460
 epoch: 74, train_loss: 0.5920, test_loss: 1.2314, test_f1: 0.5484
 epoch: 75, train_loss: 0.6067, test_loss: 1.2550, test_f1: 0.5465
 epoch: 76, train_loss: 0.5882, test_loss: 1.2143, test_f1: 0.5580
 epoch: 77, train_loss: 0.5965, test_loss: 1.2319, test_f1: 0.5331
 epoch: 78, train_loss: 0.5734, test_loss: 1.2893, test_f1: 0.5464
 epoch: 79, train_loss: 0.5837, test_loss: 1.2679, test_f1: 0.5382
 epoch: 80, train_loss: 0.5993, test_loss: 1.3101, test_f1: 0.5306
 epoch: 81, train_loss: 0.6023, test_loss: 1.2995, test_f1: 0.5176
 epoch: 82, train_loss: 0.5809, test_loss: 1.2275, test_f1: 0.5477
 epoch: 83, train_loss: 0.5736, test_loss: 1.2386, test_f1: 0.5250
 epoch: 84, train_loss: 0.5738, test_loss: 1.2372, test_f1: 0.5417
 epoch: 85, train_loss: 0.5650, test_loss: 1.2419, test_f1: 0.5376
 epoch: 86, train_loss: 0.5635, test_loss: 1.1873, test_f1: 0.5415
 epoch: 87, train_loss: 0.5879, test_loss: 1.2660, test_f1: 0.5401
 epoch: 88, train_loss: 0.5640, test_loss: 1.3459, test_f1: 0.5308
 epoch: 89, train_loss: 0.5664, test_loss: 1.2979, test_f1: 0.5100
 epoch: 90, train_loss: 0.5487, test_loss: 1.2894, test_f1: 0.5431
 epoch: 91, train_loss: 0.5799, test_loss: 1.2811, test_f1: 0.5505
 epoch: 92, train_loss: 0.5663, test_loss: 1.2293, test_f1: 0.5512
 epoch: 93, train_loss: 0.5554, test_loss: 1.2188, test_f1: 0.5620
 epoch: 94, train_loss: 0.6034, test_loss: 1.2688, test_f1: 0.5461
 epoch: 95, train_loss: 0.5661, test_loss: 1.2888, test_f1: 0.5240
 epoch: 96, train_loss: 0.5378, test_loss: 1.2898, test_f1: 0.5638
 epoch: 97, train_loss: 0.5374, test_loss: 1.3079, test_f1: 0.5591
 epoch: 98, train_loss: 0.5235, test_loss: 1.3426, test_f1: 0.5283
 epoch: 99, train_loss: 0.5432, test_loss: 1.3438, test_f1: 0.5474
##################ITERATION #4 ****************************************
 epoch: 0, train_loss: 1.2839, test_loss: 1.1555, test_f1: 0.4313
 epoch: 1, train_loss: 1.1685, test_loss: 1.0830, test_f1: 0.4527
 epoch: 2, train_loss: 1.1320, test_loss: 1.0356, test_f1: 0.4414
 epoch: 3, train_loss: 1.0836, test_loss: 1.0060, test_f1: 0.4512
 epoch: 4, train_loss: 1.0654, test_loss: 1.0145, test_f1: 0.4335
 epoch: 5, train_loss: 1.0363, test_loss: 0.9758, test_f1: 0.4707
 epoch: 6, train_loss: 1.0290, test_loss: 0.9709, test_f1: 0.4681
 epoch: 7, train_loss: 1.0185, test_loss: 0.9017, test_f1: 0.5033
 epoch: 8, train_loss: 0.9953, test_loss: 0.9100, test_f1: 0.5019
 epoch: 9, train_loss: 0.9802, test_loss: 0.9630, test_f1: 0.4900
 epoch: 10, train_loss: 0.9680, test_loss: 0.9441, test_f1: 0.4879
 epoch: 11, train_loss: 0.9386, test_loss: 0.9492, test_f1: 0.4901
 epoch: 12, train_loss: 0.9443, test_loss: 0.9049, test_f1: 0.5096
 epoch: 13, train_loss: 0.9264, test_loss: 0.9793, test_f1: 0.4966
 epoch: 14, train_loss: 0.9180, test_loss: 0.9198, test_f1: 0.5075
 epoch: 15, train_loss: 0.9049, test_loss: 1.0159, test_f1: 0.4933
 epoch: 16, train_loss: 0.9006, test_loss: 1.0364, test_f1: 0.4783
 epoch: 17, train_loss: 0.8867, test_loss: 0.9941, test_f1: 0.5018
 epoch: 18, train_loss: 0.9209, test_loss: 0.9615, test_f1: 0.5440
 epoch: 19, train_loss: 0.8831, test_loss: 0.9811, test_f1: 0.5247
 epoch: 20, train_loss: 0.8849, test_loss: 0.9365, test_f1: 0.5347
 epoch: 21, train_loss: 0.9235, test_loss: 1.0156, test_f1: 0.5142
 epoch: 22, train_loss: 0.8938, test_loss: 0.9613, test_f1: 0.5250
 epoch: 23, train_loss: 0.8726, test_loss: 0.9981, test_f1: 0.5017
 epoch: 24, train_loss: 0.8592, test_loss: 0.9555, test_f1: 0.5122
 epoch: 25, train_loss: 0.8575, test_loss: 0.9961, test_f1: 0.5337
 epoch: 26, train_loss: 0.8492, test_loss: 1.0477, test_f1: 0.5186
 epoch: 27, train_loss: 0.8706, test_loss: 1.0874, test_f1: 0.4827
 epoch: 28, train_loss: 0.8225, test_loss: 1.0500, test_f1: 0.5421
 epoch: 29, train_loss: 0.8426, test_loss: 1.0555, test_f1: 0.5235
 epoch: 30, train_loss: 0.8234, test_loss: 1.0243, test_f1: 0.5518
 epoch: 31, train_loss: 0.8055, test_loss: 1.0515, test_f1: 0.5421
 epoch: 32, train_loss: 0.8152, test_loss: 1.0502, test_f1: 0.5446
 epoch: 33, train_loss: 0.7964, test_loss: 1.1038, test_f1: 0.5186
 epoch: 34, train_loss: 0.7893, test_loss: 1.0850, test_f1: 0.5219
 epoch: 35, train_loss: 0.7962, test_loss: 1.0912, test_f1: 0.5377
 epoch: 36, train_loss: 0.7865, test_loss: 1.0960, test_f1: 0.5183
 epoch: 37, train_loss: 0.7954, test_loss: 1.0824, test_f1: 0.5379
 epoch: 38, train_loss: 0.7733, test_loss: 1.1560, test_f1: 0.5508
 epoch: 39, train_loss: 0.7756, test_loss: 1.0713, test_f1: 0.5497
 epoch: 40, train_loss: 0.7687, test_loss: 1.1366, test_f1: 0.5373
 epoch: 41, train_loss: 0.7608, test_loss: 1.0652, test_f1: 0.5331
 epoch: 42, train_loss: 0.7611, test_loss: 1.1329, test_f1: 0.5432
 epoch: 43, train_loss: 0.7468, test_loss: 1.0820, test_f1: 0.5475
 epoch: 44, train_loss: 0.7544, test_loss: 1.1028, test_f1: 0.5485
 epoch: 45, train_loss: 0.7297, test_loss: 1.1016, test_f1: 0.5121
 epoch: 46, train_loss: 0.7274, test_loss: 1.1029, test_f1: 0.5229
 epoch: 47, train_loss: 0.7373, test_loss: 1.1144, test_f1: 0.5414
 epoch: 48, train_loss: 0.7316, test_loss: 1.1513, test_f1: 0.5310
 epoch: 49, train_loss: 0.7125, test_loss: 1.1300, test_f1: 0.5748
 epoch: 50, train_loss: 0.7415, test_loss: 1.0901, test_f1: 0.5766
 epoch: 51, train_loss: 0.7026, test_loss: 1.0927, test_f1: 0.5560
 epoch: 52, train_loss: 0.6891, test_loss: 1.1387, test_f1: 0.5558
 epoch: 53, train_loss: 0.6726, test_loss: 1.1857, test_f1: 0.5318
 epoch: 54, train_loss: 0.6762, test_loss: 1.2067, test_f1: 0.5331
 epoch: 55, train_loss: 0.6569, test_loss: 1.2644, test_f1: 0.5534
 epoch: 56, train_loss: 0.6566, test_loss: 1.2446, test_f1: 0.5170
 epoch: 57, train_loss: 0.6667, test_loss: 1.2810, test_f1: 0.5191
 epoch: 58, train_loss: 0.6562, test_loss: 1.3080, test_f1: 0.5072
 epoch: 59, train_loss: 0.6432, test_loss: 1.2966, test_f1: 0.5290
 epoch: 60, train_loss: 0.6338, test_loss: 1.3207, test_f1: 0.5336
 epoch: 61, train_loss: 0.6307, test_loss: 1.2589, test_f1: 0.5344
 epoch: 62, train_loss: 0.6147, test_loss: 1.2380, test_f1: 0.5419
 epoch: 63, train_loss: 0.6187, test_loss: 1.3060, test_f1: 0.5395
 epoch: 64, train_loss: 0.6385, test_loss: 1.2598, test_f1: 0.5344
 epoch: 65, train_loss: 0.6454, test_loss: 1.2854, test_f1: 0.5550
 epoch: 66, train_loss: 0.6262, test_loss: 1.3295, test_f1: 0.5301
 epoch: 67, train_loss: 0.6023, test_loss: 1.3445, test_f1: 0.5547
 epoch: 68, train_loss: 0.5930, test_loss: 1.4307, test_f1: 0.5413
 epoch: 69, train_loss: 0.6206, test_loss: 1.2772, test_f1: 0.5459
 epoch: 70, train_loss: 0.6147, test_loss: 1.3369, test_f1: 0.5489
 epoch: 71, train_loss: 0.6070, test_loss: 1.3351, test_f1: 0.5252
 epoch: 72, train_loss: 0.6051, test_loss: 1.2769, test_f1: 0.5550
 epoch: 73, train_loss: 0.5934, test_loss: 1.2714, test_f1: 0.5051
 epoch: 74, train_loss: 0.5993, test_loss: 1.2936, test_f1: 0.5475
 epoch: 75, train_loss: 0.6136, test_loss: 1.2679, test_f1: 0.5647
 epoch: 76, train_loss: 0.5989, test_loss: 1.2958, test_f1: 0.5516
 epoch: 77, train_loss: 0.6122, test_loss: 1.1918, test_f1: 0.5605
 epoch: 78, train_loss: 0.5918, test_loss: 1.3244, test_f1: 0.5420
 epoch: 79, train_loss: 0.5769, test_loss: 1.2742, test_f1: 0.5668
 epoch: 80, train_loss: 0.5779, test_loss: 1.3477, test_f1: 0.5511
 epoch: 81, train_loss: 0.5678, test_loss: 1.2764, test_f1: 0.5687
 epoch: 82, train_loss: 0.5608, test_loss: 1.4651, test_f1: 0.5559
 epoch: 83, train_loss: 0.5890, test_loss: 1.3591, test_f1: 0.5604
 epoch: 84, train_loss: 0.5795, test_loss: 1.3921, test_f1: 0.5509
 epoch: 85, train_loss: 0.5727, test_loss: 1.3673, test_f1: 0.5524
 epoch: 86, train_loss: 0.5789, test_loss: 1.2372, test_f1: 0.5614
 epoch: 87, train_loss: 0.5515, test_loss: 1.3078, test_f1: 0.5619
 epoch: 88, train_loss: 0.5562, test_loss: 1.3558, test_f1: 0.5504
 epoch: 89, train_loss: 0.5627, test_loss: 1.3719, test_f1: 0.5446
 epoch: 90, train_loss: 0.5471, test_loss: 1.4066, test_f1: 0.5491
 epoch: 91, train_loss: 0.5566, test_loss: 1.3176, test_f1: 0.5309
 epoch: 92, train_loss: 0.5253, test_loss: 1.3379, test_f1: 0.5552
 epoch: 93, train_loss: 0.5433, test_loss: 1.3032, test_f1: 0.5471
 epoch: 94, train_loss: 0.5465, test_loss: 1.3424, test_f1: 0.5097
 epoch: 95, train_loss: 0.5447, test_loss: 1.3860, test_f1: 0.5477
 epoch: 96, train_loss: 0.5164, test_loss: 1.3412, test_f1: 0.5478
 epoch: 97, train_loss: 0.5272, test_loss: 1.4003, test_f1: 0.5491
 epoch: 98, train_loss: 0.5409, test_loss: 1.3144, test_f1: 0.5824
 epoch: 99, train_loss: 0.5262, test_loss: 1.3914, test_f1: 0.5471
##################ITERATION #5 ****************************************
 epoch: 0, train_loss: 1.3061, test_loss: 1.1602, test_f1: 0.3964
 epoch: 1, train_loss: 1.1937, test_loss: 1.1021, test_f1: 0.4217
 epoch: 2, train_loss: 1.1614, test_loss: 1.1104, test_f1: 0.4212
 epoch: 3, train_loss: 1.1248, test_loss: 1.0441, test_f1: 0.4164
 epoch: 4, train_loss: 1.0979, test_loss: 1.0171, test_f1: 0.4491
 epoch: 5, train_loss: 1.0703, test_loss: 0.9870, test_f1: 0.4919
 epoch: 6, train_loss: 1.0693, test_loss: 0.9848, test_f1: 0.4598
 epoch: 7, train_loss: 1.0534, test_loss: 0.9571, test_f1: 0.4925
 epoch: 8, train_loss: 1.0278, test_loss: 0.9913, test_f1: 0.4583
 epoch: 9, train_loss: 1.0221, test_loss: 0.9437, test_f1: 0.4590
 epoch: 10, train_loss: 1.0105, test_loss: 1.0613, test_f1: 0.4550
 epoch: 11, train_loss: 1.0624, test_loss: 0.9686, test_f1: 0.4853
 epoch: 12, train_loss: 1.0138, test_loss: 0.9473, test_f1: 0.4919
 epoch: 13, train_loss: 0.9989, test_loss: 0.9581, test_f1: 0.4824
 epoch: 14, train_loss: 0.9811, test_loss: 0.9385, test_f1: 0.4978
 epoch: 15, train_loss: 0.9725, test_loss: 0.9250, test_f1: 0.5111
 epoch: 16, train_loss: 0.9604, test_loss: 0.9405, test_f1: 0.4962
 epoch: 17, train_loss: 0.9412, test_loss: 0.8967, test_f1: 0.5376
 epoch: 18, train_loss: 0.9592, test_loss: 0.9265, test_f1: 0.5325
 epoch: 19, train_loss: 0.9384, test_loss: 0.9463, test_f1: 0.5067
 epoch: 20, train_loss: 0.9103, test_loss: 0.9172, test_f1: 0.5248
 epoch: 21, train_loss: 0.9217, test_loss: 0.9462, test_f1: 0.5044
 epoch: 22, train_loss: 0.8958, test_loss: 0.9312, test_f1: 0.5344
 epoch: 23, train_loss: 0.8938, test_loss: 1.0251, test_f1: 0.5240
 epoch: 24, train_loss: 0.8949, test_loss: 0.9533, test_f1: 0.5224
 epoch: 25, train_loss: 0.8789, test_loss: 1.0475, test_f1: 0.4619
 epoch: 26, train_loss: 0.8719, test_loss: 0.9629, test_f1: 0.5275
 epoch: 27, train_loss: 0.8749, test_loss: 0.9634, test_f1: 0.5059
 epoch: 28, train_loss: 0.8635, test_loss: 0.9785, test_f1: 0.5238
 epoch: 29, train_loss: 0.8700, test_loss: 0.9206, test_f1: 0.5000
 epoch: 30, train_loss: 0.8510, test_loss: 0.9489, test_f1: 0.5553
 epoch: 31, train_loss: 0.8476, test_loss: 1.0029, test_f1: 0.5331
 epoch: 32, train_loss: 0.8467, test_loss: 1.0051, test_f1: 0.5442
 epoch: 33, train_loss: 0.8480, test_loss: 0.9463, test_f1: 0.4993
 epoch: 34, train_loss: 0.8659, test_loss: 1.0266, test_f1: 0.5035
 epoch: 35, train_loss: 0.8429, test_loss: 1.0412, test_f1: 0.5361
 epoch: 36, train_loss: 0.8441, test_loss: 0.9028, test_f1: 0.5589
 epoch: 37, train_loss: 0.8389, test_loss: 1.0826, test_f1: 0.5110
 epoch: 38, train_loss: 0.8358, test_loss: 1.0441, test_f1: 0.5317
 epoch: 39, train_loss: 0.8174, test_loss: 1.0798, test_f1: 0.5258
 epoch: 40, train_loss: 0.8204, test_loss: 1.0334, test_f1: 0.5328
 epoch: 41, train_loss: 0.8125, test_loss: 1.0474, test_f1: 0.5589
 epoch: 42, train_loss: 0.8073, test_loss: 1.0274, test_f1: 0.5289
 epoch: 43, train_loss: 0.8008, test_loss: 0.9818, test_f1: 0.5240
 epoch: 44, train_loss: 0.7956, test_loss: 1.0860, test_f1: 0.5399
 epoch: 45, train_loss: 0.7781, test_loss: 1.0526, test_f1: 0.5354
 epoch: 46, train_loss: 0.7827, test_loss: 1.0864, test_f1: 0.5206
 epoch: 47, train_loss: 0.7938, test_loss: 1.0630, test_f1: 0.5404
 epoch: 48, train_loss: 0.7671, test_loss: 1.0785, test_f1: 0.5602
 epoch: 49, train_loss: 0.7786, test_loss: 1.0098, test_f1: 0.5289
 epoch: 50, train_loss: 0.7549, test_loss: 1.0898, test_f1: 0.5418
 epoch: 51, train_loss: 0.7374, test_loss: 1.0904, test_f1: 0.5666
 epoch: 52, train_loss: 0.7158, test_loss: 1.0730, test_f1: 0.5423
 epoch: 53, train_loss: 0.7249, test_loss: 1.1084, test_f1: 0.5668
 epoch: 54, train_loss: 0.7249, test_loss: 1.0843, test_f1: 0.5235
 epoch: 55, train_loss: 0.7131, test_loss: 1.1229, test_f1: 0.5714
 epoch: 56, train_loss: 0.6985, test_loss: 1.1744, test_f1: 0.5635
 epoch: 57, train_loss: 0.7503, test_loss: 1.0692, test_f1: 0.5545
 epoch: 58, train_loss: 0.7278, test_loss: 1.1158, test_f1: 0.5656
 epoch: 59, train_loss: 0.7013, test_loss: 1.1302, test_f1: 0.5397
 epoch: 60, train_loss: 0.7119, test_loss: 1.1013, test_f1: 0.5636
 epoch: 61, train_loss: 0.7044, test_loss: 1.1278, test_f1: 0.5811
 epoch: 62, train_loss: 0.6806, test_loss: 1.1048, test_f1: 0.5437
 epoch: 63, train_loss: 0.6747, test_loss: 1.1330, test_f1: 0.5649
 epoch: 64, train_loss: 0.6869, test_loss: 1.1591, test_f1: 0.5507
 epoch: 65, train_loss: 0.6595, test_loss: 1.1748, test_f1: 0.5489
 epoch: 66, train_loss: 0.6703, test_loss: 1.1648, test_f1: 0.5501
 epoch: 67, train_loss: 0.6783, test_loss: 1.0895, test_f1: 0.5826
 epoch: 68, train_loss: 0.6742, test_loss: 1.1054, test_f1: 0.5611
 epoch: 69, train_loss: 0.6661, test_loss: 1.1261, test_f1: 0.5635
 epoch: 70, train_loss: 0.6631, test_loss: 1.2638, test_f1: 0.5154
 epoch: 71, train_loss: 0.6601, test_loss: 1.1985, test_f1: 0.5597
 epoch: 72, train_loss: 0.6626, test_loss: 1.1600, test_f1: 0.5785
 epoch: 73, train_loss: 0.6428, test_loss: 1.1280, test_f1: 0.5614
 epoch: 74, train_loss: 0.6385, test_loss: 1.1878, test_f1: 0.5471
 epoch: 75, train_loss: 0.6469, test_loss: 1.2034, test_f1: 0.5431
 epoch: 76, train_loss: 0.6185, test_loss: 1.2012, test_f1: 0.5434
 epoch: 77, train_loss: 0.6457, test_loss: 1.2323, test_f1: 0.5628
 epoch: 78, train_loss: 0.6296, test_loss: 1.1970, test_f1: 0.5711
 epoch: 79, train_loss: 0.6143, test_loss: 1.2833, test_f1: 0.5836
 epoch: 80, train_loss: 0.6532, test_loss: 1.1538, test_f1: 0.5606
 epoch: 81, train_loss: 0.6380, test_loss: 1.1725, test_f1: 0.5513
 epoch: 82, train_loss: 0.6281, test_loss: 1.1870, test_f1: 0.5769
 epoch: 83, train_loss: 0.6181, test_loss: 1.2333, test_f1: 0.5709
 epoch: 84, train_loss: 0.6255, test_loss: 1.1966, test_f1: 0.5530
 epoch: 85, train_loss: 0.6191, test_loss: 1.2067, test_f1: 0.5644
 epoch: 86, train_loss: 0.6085, test_loss: 1.2069, test_f1: 0.5604
 epoch: 87, train_loss: 0.6200, test_loss: 1.1751, test_f1: 0.5567
 epoch: 88, train_loss: 0.6074, test_loss: 1.1669, test_f1: 0.5847
 epoch: 89, train_loss: 0.5970, test_loss: 1.2458, test_f1: 0.5673
 epoch: 90, train_loss: 0.5941, test_loss: 1.2377, test_f1: 0.5720
 epoch: 91, train_loss: 0.6097, test_loss: 1.2299, test_f1: 0.5452
 epoch: 92, train_loss: 0.6094, test_loss: 1.2304, test_f1: 0.5361
 epoch: 93, train_loss: 0.6044, test_loss: 1.2355, test_f1: 0.5645
 epoch: 94, train_loss: 0.6037, test_loss: 1.2556, test_f1: 0.5431
 epoch: 95, train_loss: 0.5967, test_loss: 1.2519, test_f1: 0.5720
 epoch: 96, train_loss: 0.6024, test_loss: 1.2720, test_f1: 0.5755
 epoch: 97, train_loss: 0.5832, test_loss: 1.3663, test_f1: 0.5389
 epoch: 98, train_loss: 0.5681, test_loss: 1.2346, test_f1: 0.5728
 epoch: 99, train_loss: 0.5937, test_loss: 1.3233, test_f1: 0.5564
##################ITERATION #6 ****************************************
 epoch: 0, train_loss: 1.3155, test_loss: 1.1631, test_f1: 0.4044
 epoch: 1, train_loss: 1.1707, test_loss: 1.1123, test_f1: 0.3990
 epoch: 2, train_loss: 1.1414, test_loss: 1.0809, test_f1: 0.4117
 epoch: 3, train_loss: 1.1062, test_loss: 1.0471, test_f1: 0.4498
 epoch: 4, train_loss: 1.0688, test_loss: 1.0196, test_f1: 0.4247
 epoch: 5, train_loss: 1.0479, test_loss: 0.9844, test_f1: 0.4605
 epoch: 6, train_loss: 1.0180, test_loss: 1.0138, test_f1: 0.4813
 epoch: 7, train_loss: 1.0134, test_loss: 0.9949, test_f1: 0.4674
 epoch: 8, train_loss: 0.9775, test_loss: 0.9379, test_f1: 0.4783
 epoch: 9, train_loss: 0.9672, test_loss: 0.9381, test_f1: 0.5019
 epoch: 10, train_loss: 0.9592, test_loss: 0.9793, test_f1: 0.4795
 epoch: 11, train_loss: 0.9482, test_loss: 0.8869, test_f1: 0.5152
 epoch: 12, train_loss: 0.9271, test_loss: 0.9017, test_f1: 0.5314
 epoch: 13, train_loss: 0.9050, test_loss: 0.8834, test_f1: 0.5506
 epoch: 14, train_loss: 0.9037, test_loss: 0.9922, test_f1: 0.4857
 epoch: 15, train_loss: 0.8986, test_loss: 0.9236, test_f1: 0.5114
 epoch: 16, train_loss: 0.9038, test_loss: 0.9869, test_f1: 0.4725
 epoch: 17, train_loss: 0.8881, test_loss: 0.9241, test_f1: 0.5165
 epoch: 18, train_loss: 0.8863, test_loss: 0.9097, test_f1: 0.5315
 epoch: 19, train_loss: 0.8586, test_loss: 0.9588, test_f1: 0.5193
 epoch: 20, train_loss: 0.8554, test_loss: 0.9591, test_f1: 0.5359
 epoch: 21, train_loss: 0.8434, test_loss: 0.9177, test_f1: 0.5451
 epoch: 22, train_loss: 0.8296, test_loss: 0.9606, test_f1: 0.5229
 epoch: 23, train_loss: 0.8415, test_loss: 0.9479, test_f1: 0.5409
 epoch: 24, train_loss: 0.8336, test_loss: 0.9599, test_f1: 0.5155
 epoch: 25, train_loss: 0.8534, test_loss: 0.9979, test_f1: 0.4987
 epoch: 26, train_loss: 0.8240, test_loss: 0.9730, test_f1: 0.5360
 epoch: 27, train_loss: 0.8076, test_loss: 0.9302, test_f1: 0.5473
 epoch: 28, train_loss: 0.7956, test_loss: 0.9272, test_f1: 0.5456
 epoch: 29, train_loss: 0.8031, test_loss: 0.9059, test_f1: 0.5626
 epoch: 30, train_loss: 0.7954, test_loss: 1.0724, test_f1: 0.5154
 epoch: 31, train_loss: 0.8022, test_loss: 1.0754, test_f1: 0.5199
 epoch: 32, train_loss: 0.8297, test_loss: 1.0406, test_f1: 0.5611
 epoch: 33, train_loss: 0.7951, test_loss: 1.1229, test_f1: 0.5256
 epoch: 34, train_loss: 0.7945, test_loss: 1.0743, test_f1: 0.5419
 epoch: 35, train_loss: 0.7683, test_loss: 1.0559, test_f1: 0.5307
 epoch: 36, train_loss: 0.7652, test_loss: 0.9855, test_f1: 0.5530
 epoch: 37, train_loss: 0.7496, test_loss: 1.0017, test_f1: 0.5264
 epoch: 38, train_loss: 0.7525, test_loss: 1.0889, test_f1: 0.5249
 epoch: 39, train_loss: 0.7335, test_loss: 1.0637, test_f1: 0.5405
 epoch: 40, train_loss: 0.7513, test_loss: 1.1416, test_f1: 0.5232
 epoch: 41, train_loss: 0.7390, test_loss: 0.9795, test_f1: 0.5169
 epoch: 42, train_loss: 0.7327, test_loss: 1.0956, test_f1: 0.5238
 epoch: 43, train_loss: 0.7402, test_loss: 1.0180, test_f1: 0.5278
 epoch: 44, train_loss: 0.7355, test_loss: 1.0221, test_f1: 0.5259
 epoch: 45, train_loss: 0.7609, test_loss: 1.0230, test_f1: 0.5349
 epoch: 46, train_loss: 0.7199, test_loss: 1.3484, test_f1: 0.5096
 epoch: 47, train_loss: 0.7552, test_loss: 1.0162, test_f1: 0.5290
 epoch: 48, train_loss: 0.7302, test_loss: 1.0937, test_f1: 0.5275
 epoch: 49, train_loss: 0.7045, test_loss: 1.1436, test_f1: 0.5311
 epoch: 50, train_loss: 0.7049, test_loss: 1.1654, test_f1: 0.5299
 epoch: 51, train_loss: 0.6652, test_loss: 1.1727, test_f1: 0.5386
 epoch: 52, train_loss: 0.6704, test_loss: 1.2033, test_f1: 0.5350
 epoch: 53, train_loss: 0.6678, test_loss: 1.1477, test_f1: 0.5586
 epoch: 54, train_loss: 0.6579, test_loss: 1.1233, test_f1: 0.5278
 epoch: 55, train_loss: 0.6533, test_loss: 1.1267, test_f1: 0.5540
 epoch: 56, train_loss: 0.6536, test_loss: 1.1838, test_f1: 0.5086
 epoch: 57, train_loss: 0.6456, test_loss: 1.2093, test_f1: 0.5322
 epoch: 58, train_loss: 0.6359, test_loss: 1.1516, test_f1: 0.5272
 epoch: 59, train_loss: 0.6404, test_loss: 1.2913, test_f1: 0.5267
 epoch: 60, train_loss: 0.6241, test_loss: 1.2117, test_f1: 0.5379
 epoch: 61, train_loss: 0.6265, test_loss: 1.2481, test_f1: 0.5404
 epoch: 62, train_loss: 0.6138, test_loss: 1.2650, test_f1: 0.5373
 epoch: 63, train_loss: 0.6198, test_loss: 1.2517, test_f1: 0.5592
 epoch: 64, train_loss: 0.6167, test_loss: 1.2513, test_f1: 0.5841
 epoch: 65, train_loss: 0.5976, test_loss: 1.2725, test_f1: 0.5553
 epoch: 66, train_loss: 0.6052, test_loss: 1.2331, test_f1: 0.5649
 epoch: 67, train_loss: 0.5986, test_loss: 1.3137, test_f1: 0.5668
 epoch: 68, train_loss: 0.6208, test_loss: 1.2419, test_f1: 0.5442
 epoch: 69, train_loss: 0.5999, test_loss: 1.2552, test_f1: 0.5458
 epoch: 70, train_loss: 0.5907, test_loss: 1.2373, test_f1: 0.5530
 epoch: 71, train_loss: 0.5998, test_loss: 1.2651, test_f1: 0.5348
 epoch: 72, train_loss: 0.5967, test_loss: 1.2377, test_f1: 0.5474
 epoch: 73, train_loss: 0.6616, test_loss: 1.1370, test_f1: 0.5492
 epoch: 74, train_loss: 0.6208, test_loss: 1.1647, test_f1: 0.5693
 epoch: 75, train_loss: 0.6058, test_loss: 1.1717, test_f1: 0.5365
 epoch: 76, train_loss: 0.5952, test_loss: 1.2575, test_f1: 0.5615
 epoch: 77, train_loss: 0.5715, test_loss: 1.2353, test_f1: 0.5464
 epoch: 78, train_loss: 0.5707, test_loss: 1.1714, test_f1: 0.5794
 epoch: 79, train_loss: 0.5686, test_loss: 1.2555, test_f1: 0.5505
 epoch: 80, train_loss: 0.5972, test_loss: 1.2872, test_f1: 0.5162
 epoch: 81, train_loss: 0.5748, test_loss: 1.2048, test_f1: 0.5488
 epoch: 82, train_loss: 0.5543, test_loss: 1.2010, test_f1: 0.5672
 epoch: 83, train_loss: 0.5720, test_loss: 1.2341, test_f1: 0.5414
 epoch: 84, train_loss: 0.5580, test_loss: 1.5328, test_f1: 0.5543
 epoch: 85, train_loss: 0.5557, test_loss: 1.2654, test_f1: 0.5684
 epoch: 86, train_loss: 0.5461, test_loss: 1.2629, test_f1: 0.5752
 epoch: 87, train_loss: 0.5471, test_loss: 1.3388, test_f1: 0.5685
 epoch: 88, train_loss: 0.5532, test_loss: 1.3033, test_f1: 0.5346
 epoch: 89, train_loss: 0.5379, test_loss: 1.2940, test_f1: 0.5203
 epoch: 90, train_loss: 0.5487, test_loss: 1.2740, test_f1: 0.5504
 epoch: 91, train_loss: 0.5407, test_loss: 1.2920, test_f1: 0.5409
 epoch: 92, train_loss: 0.5514, test_loss: 1.3397, test_f1: 0.5633
 epoch: 93, train_loss: 0.5438, test_loss: 1.3411, test_f1: 0.5588
 epoch: 94, train_loss: 0.5313, test_loss: 1.2797, test_f1: 0.5591
 epoch: 95, train_loss: 0.5346, test_loss: 1.3460, test_f1: 0.5556
 epoch: 96, train_loss: 0.5346, test_loss: 1.4067, test_f1: 0.5604
 epoch: 97, train_loss: 0.5187, test_loss: 1.4225, test_f1: 0.5662
 epoch: 98, train_loss: 0.5277, test_loss: 1.5209, test_f1: 0.5470
 epoch: 99, train_loss: 0.5322, test_loss: 1.3135, test_f1: 0.5837
##################ITERATION #7 ****************************************
 epoch: 0, train_loss: 1.3180, test_loss: 1.1597, test_f1: 0.3995
 epoch: 1, train_loss: 1.1622, test_loss: 1.0549, test_f1: 0.4347
 epoch: 2, train_loss: 1.1216, test_loss: 1.0314, test_f1: 0.4225
 epoch: 3, train_loss: 1.0918, test_loss: 1.0263, test_f1: 0.4686
 epoch: 4, train_loss: 1.0841, test_loss: 0.9935, test_f1: 0.4578
 epoch: 5, train_loss: 1.0450, test_loss: 0.9992, test_f1: 0.4624
 epoch: 6, train_loss: 1.0243, test_loss: 0.9536, test_f1: 0.5036
 epoch: 7, train_loss: 0.9989, test_loss: 0.9733, test_f1: 0.4780
 epoch: 8, train_loss: 0.9839, test_loss: 1.0009, test_f1: 0.4728
 epoch: 9, train_loss: 0.9833, test_loss: 0.9532, test_f1: 0.5118
 epoch: 10, train_loss: 0.9684, test_loss: 0.9610, test_f1: 0.4893
 epoch: 11, train_loss: 0.9617, test_loss: 0.9217, test_f1: 0.5149
 epoch: 12, train_loss: 0.9466, test_loss: 0.9817, test_f1: 0.4885
 epoch: 13, train_loss: 0.9335, test_loss: 0.9385, test_f1: 0.5004
 epoch: 14, train_loss: 0.9138, test_loss: 0.9355, test_f1: 0.4926
 epoch: 15, train_loss: 0.8982, test_loss: 0.9311, test_f1: 0.5176
 epoch: 16, train_loss: 0.8993, test_loss: 0.9203, test_f1: 0.5162
 epoch: 17, train_loss: 0.8786, test_loss: 0.9019, test_f1: 0.5413
 epoch: 18, train_loss: 0.8814, test_loss: 0.9356, test_f1: 0.4911
 epoch: 19, train_loss: 0.8775, test_loss: 0.9304, test_f1: 0.5130
 epoch: 20, train_loss: 0.8537, test_loss: 0.9167, test_f1: 0.5236
 epoch: 21, train_loss: 0.8627, test_loss: 0.9315, test_f1: 0.5193
 epoch: 22, train_loss: 0.8541, test_loss: 0.9400, test_f1: 0.5332
 epoch: 23, train_loss: 0.8603, test_loss: 0.9304, test_f1: 0.5148
 epoch: 24, train_loss: 0.8445, test_loss: 0.9280, test_f1: 0.5348
 epoch: 25, train_loss: 0.8139, test_loss: 1.0553, test_f1: 0.4928
 epoch: 26, train_loss: 0.8319, test_loss: 0.9419, test_f1: 0.5301
 epoch: 27, train_loss: 0.8232, test_loss: 0.9249, test_f1: 0.5554
 epoch: 28, train_loss: 0.8141, test_loss: 0.9715, test_f1: 0.5442
 epoch: 29, train_loss: 0.8047, test_loss: 0.9638, test_f1: 0.5426
 epoch: 30, train_loss: 0.7868, test_loss: 1.0401, test_f1: 0.5269
 epoch: 31, train_loss: 0.7828, test_loss: 0.9645, test_f1: 0.5560
 epoch: 32, train_loss: 0.7796, test_loss: 0.9783, test_f1: 0.5340
 epoch: 33, train_loss: 0.7762, test_loss: 0.9450, test_f1: 0.5519
 epoch: 34, train_loss: 0.7810, test_loss: 0.9630, test_f1: 0.5325
 epoch: 35, train_loss: 0.7617, test_loss: 0.9490, test_f1: 0.5426
 epoch: 36, train_loss: 0.7566, test_loss: 0.9693, test_f1: 0.5304
 epoch: 37, train_loss: 0.7787, test_loss: 0.9378, test_f1: 0.5699
 epoch: 38, train_loss: 0.7698, test_loss: 1.0609, test_f1: 0.5332
 epoch: 39, train_loss: 0.7445, test_loss: 1.0197, test_f1: 0.5395
 epoch: 40, train_loss: 0.7545, test_loss: 0.9699, test_f1: 0.5465
 epoch: 41, train_loss: 0.7357, test_loss: 1.0472, test_f1: 0.5501
 epoch: 42, train_loss: 0.7503, test_loss: 0.9849, test_f1: 0.5689
 epoch: 43, train_loss: 0.7272, test_loss: 0.9893, test_f1: 0.5918
 epoch: 44, train_loss: 0.7196, test_loss: 1.0102, test_f1: 0.5651
 epoch: 45, train_loss: 0.7199, test_loss: 1.0091, test_f1: 0.5540
 epoch: 46, train_loss: 0.7235, test_loss: 1.0218, test_f1: 0.5345
 epoch: 47, train_loss: 0.7683, test_loss: 0.9873, test_f1: 0.5607
 epoch: 48, train_loss: 0.6993, test_loss: 1.0743, test_f1: 0.5525
 epoch: 49, train_loss: 0.6987, test_loss: 1.1024, test_f1: 0.5308
 epoch: 50, train_loss: 0.7083, test_loss: 1.0677, test_f1: 0.5234
 epoch: 51, train_loss: 0.6814, test_loss: 1.0390, test_f1: 0.5460
 epoch: 52, train_loss: 0.6794, test_loss: 1.0188, test_f1: 0.5366
 epoch: 53, train_loss: 0.6546, test_loss: 1.0189, test_f1: 0.5520
 epoch: 54, train_loss: 0.6502, test_loss: 1.0415, test_f1: 0.5590
 epoch: 55, train_loss: 0.6489, test_loss: 1.0510, test_f1: 0.5770
 epoch: 56, train_loss: 0.6291, test_loss: 1.0915, test_f1: 0.5937
 epoch: 57, train_loss: 0.6182, test_loss: 1.1006, test_f1: 0.5594
 epoch: 58, train_loss: 0.6199, test_loss: 1.1054, test_f1: 0.5816
 epoch: 59, train_loss: 0.6258, test_loss: 1.0573, test_f1: 0.5688
 epoch: 60, train_loss: 0.6151, test_loss: 1.1079, test_f1: 0.5728
 epoch: 61, train_loss: 0.6141, test_loss: 1.1242, test_f1: 0.5833
 epoch: 62, train_loss: 0.6226, test_loss: 1.1478, test_f1: 0.5896
 epoch: 63, train_loss: 0.6124, test_loss: 1.1141, test_f1: 0.5674
 epoch: 64, train_loss: 0.5989, test_loss: 1.1323, test_f1: 0.5862
 epoch: 65, train_loss: 0.5894, test_loss: 1.1178, test_f1: 0.5869
 epoch: 66, train_loss: 0.6033, test_loss: 1.1460, test_f1: 0.5715
 epoch: 67, train_loss: 0.6025, test_loss: 1.1655, test_f1: 0.5889
 epoch: 68, train_loss: 0.5860, test_loss: 1.0969, test_f1: 0.5891
 epoch: 69, train_loss: 0.5600, test_loss: 1.2259, test_f1: 0.5657
 epoch: 70, train_loss: 0.5931, test_loss: 1.1724, test_f1: 0.5673
 epoch: 71, train_loss: 0.5771, test_loss: 1.1677, test_f1: 0.5711
 epoch: 72, train_loss: 0.5713, test_loss: 1.2211, test_f1: 0.5828
 epoch: 73, train_loss: 0.5662, test_loss: 1.1710, test_f1: 0.5702
 epoch: 74, train_loss: 0.5843, test_loss: 1.1641, test_f1: 0.5762
 epoch: 75, train_loss: 0.5784, test_loss: 1.1511, test_f1: 0.5762
 epoch: 76, train_loss: 0.5832, test_loss: 1.1799, test_f1: 0.6010
 epoch: 77, train_loss: 0.5683, test_loss: 1.2379, test_f1: 0.5694
 epoch: 78, train_loss: 0.5675, test_loss: 1.2833, test_f1: 0.5753
 epoch: 79, train_loss: 0.5661, test_loss: 1.2745, test_f1: 0.5569
 epoch: 80, train_loss: 0.5607, test_loss: 1.2392, test_f1: 0.5807
 epoch: 81, train_loss: 0.5601, test_loss: 1.2157, test_f1: 0.5775
 epoch: 82, train_loss: 0.5617, test_loss: 1.2238, test_f1: 0.5693
 epoch: 83, train_loss: 0.5480, test_loss: 1.2440, test_f1: 0.5771
 epoch: 84, train_loss: 0.5157, test_loss: 1.2935, test_f1: 0.5946
 epoch: 85, train_loss: 0.5362, test_loss: 1.2768, test_f1: 0.5625
 epoch: 86, train_loss: 0.5412, test_loss: 1.2526, test_f1: 0.5840
 epoch: 87, train_loss: 0.5431, test_loss: 1.1780, test_f1: 0.5742
 epoch: 88, train_loss: 0.5374, test_loss: 1.2725, test_f1: 0.5591
 epoch: 89, train_loss: 0.5499, test_loss: 1.2994, test_f1: 0.5919
 epoch: 90, train_loss: 0.5248, test_loss: 1.2948, test_f1: 0.5743
 epoch: 91, train_loss: 0.5483, test_loss: 1.2463, test_f1: 0.5939
 epoch: 92, train_loss: 0.5214, test_loss: 1.3176, test_f1: 0.5965
 epoch: 93, train_loss: 0.5201, test_loss: 1.3393, test_f1: 0.5905
 epoch: 94, train_loss: 0.5038, test_loss: 1.3395, test_f1: 0.5739
 epoch: 95, train_loss: 0.5222, test_loss: 1.2403, test_f1: 0.5974
 epoch: 96, train_loss: 0.5026, test_loss: 1.2400, test_f1: 0.5849
 epoch: 97, train_loss: 0.5096, test_loss: 1.2519, test_f1: 0.5987
 epoch: 98, train_loss: 0.4923, test_loss: 1.3842, test_f1: 0.5601
 epoch: 99, train_loss: 0.5313, test_loss: 1.3190, test_f1: 0.5827
##################ITERATION #8 ****************************************
 epoch: 0, train_loss: 1.3127, test_loss: 1.1893, test_f1: 0.3823
 epoch: 1, train_loss: 1.1930, test_loss: 1.1300, test_f1: 0.4192
 epoch: 2, train_loss: 1.1422, test_loss: 1.0615, test_f1: 0.4670
 epoch: 3, train_loss: 1.0849, test_loss: 1.0183, test_f1: 0.4444
 epoch: 4, train_loss: 1.0676, test_loss: 1.0112, test_f1: 0.4497
 epoch: 5, train_loss: 1.0432, test_loss: 0.9786, test_f1: 0.4867
 epoch: 6, train_loss: 1.0245, test_loss: 0.9698, test_f1: 0.5208
 epoch: 7, train_loss: 1.0039, test_loss: 0.9649, test_f1: 0.4943
 epoch: 8, train_loss: 1.0067, test_loss: 1.0151, test_f1: 0.4697
 epoch: 9, train_loss: 0.9864, test_loss: 1.0577, test_f1: 0.4517
 epoch: 10, train_loss: 0.9878, test_loss: 0.9702, test_f1: 0.5070
 epoch: 11, train_loss: 0.9551, test_loss: 0.9215, test_f1: 0.5251
 epoch: 12, train_loss: 0.9512, test_loss: 0.9500, test_f1: 0.4845
 epoch: 13, train_loss: 0.9372, test_loss: 0.9685, test_f1: 0.4999
 epoch: 14, train_loss: 0.9185, test_loss: 0.9870, test_f1: 0.4922
 epoch: 15, train_loss: 0.9060, test_loss: 0.9368, test_f1: 0.5321
 epoch: 16, train_loss: 0.9086, test_loss: 1.0501, test_f1: 0.4964
 epoch: 17, train_loss: 0.8854, test_loss: 0.9291, test_f1: 0.5392
 epoch: 18, train_loss: 0.9033, test_loss: 0.9481, test_f1: 0.5293
 epoch: 19, train_loss: 0.8787, test_loss: 0.9690, test_f1: 0.5178
 epoch: 20, train_loss: 0.8533, test_loss: 0.9658, test_f1: 0.4972
 epoch: 21, train_loss: 0.8476, test_loss: 1.0139, test_f1: 0.5269
 epoch: 22, train_loss: 0.8563, test_loss: 0.9575, test_f1: 0.5103
 epoch: 23, train_loss: 0.8368, test_loss: 0.9788, test_f1: 0.5293
 epoch: 24, train_loss: 0.8343, test_loss: 1.0226, test_f1: 0.5130
 epoch: 25, train_loss: 0.8311, test_loss: 1.0397, test_f1: 0.5355
 epoch: 26, train_loss: 0.8240, test_loss: 1.0569, test_f1: 0.5258
 epoch: 27, train_loss: 0.8367, test_loss: 0.9886, test_f1: 0.5165
 epoch: 28, train_loss: 0.8217, test_loss: 1.1221, test_f1: 0.5215
 epoch: 29, train_loss: 0.8159, test_loss: 1.0209, test_f1: 0.4889
 epoch: 30, train_loss: 0.8143, test_loss: 1.0242, test_f1: 0.5068
 epoch: 31, train_loss: 0.8100, test_loss: 1.0125, test_f1: 0.5104
 epoch: 32, train_loss: 0.7804, test_loss: 1.1544, test_f1: 0.4922
 epoch: 33, train_loss: 0.8022, test_loss: 1.0776, test_f1: 0.5277
 epoch: 34, train_loss: 0.7894, test_loss: 1.0299, test_f1: 0.4995
 epoch: 35, train_loss: 0.7869, test_loss: 1.0776, test_f1: 0.5008
 epoch: 36, train_loss: 0.7803, test_loss: 0.9991, test_f1: 0.5475
 epoch: 37, train_loss: 0.7753, test_loss: 1.0672, test_f1: 0.4887
 epoch: 38, train_loss: 0.7594, test_loss: 1.0754, test_f1: 0.5072
 epoch: 39, train_loss: 0.7744, test_loss: 1.0428, test_f1: 0.5155
 epoch: 40, train_loss: 0.7451, test_loss: 1.0580, test_f1: 0.5544
 epoch: 41, train_loss: 0.7412, test_loss: 1.0489, test_f1: 0.5371
 epoch: 42, train_loss: 0.7713, test_loss: 1.1179, test_f1: 0.5030
 epoch: 43, train_loss: 0.7518, test_loss: 1.0473, test_f1: 0.5290
 epoch: 44, train_loss: 0.7296, test_loss: 1.1904, test_f1: 0.5112
 epoch: 45, train_loss: 0.7402, test_loss: 1.1163, test_f1: 0.5162
 epoch: 46, train_loss: 0.7304, test_loss: 1.1657, test_f1: 0.5157
 epoch: 47, train_loss: 0.7163, test_loss: 1.1256, test_f1: 0.5087
 epoch: 48, train_loss: 0.7223, test_loss: 1.1876, test_f1: 0.5303
 epoch: 49, train_loss: 0.7090, test_loss: 1.1520, test_f1: 0.5440
 epoch: 50, train_loss: 0.6914, test_loss: 1.1481, test_f1: 0.5142
 epoch: 51, train_loss: 0.6798, test_loss: 1.1996, test_f1: 0.5088
 epoch: 52, train_loss: 0.6430, test_loss: 1.2489, test_f1: 0.5206
 epoch: 53, train_loss: 0.6461, test_loss: 1.1665, test_f1: 0.5420
 epoch: 54, train_loss: 0.6485, test_loss: 1.2350, test_f1: 0.5484
 epoch: 55, train_loss: 0.6372, test_loss: 1.2396, test_f1: 0.5341
 epoch: 56, train_loss: 0.6446, test_loss: 1.2583, test_f1: 0.5349
 epoch: 57, train_loss: 0.6377, test_loss: 1.2676, test_f1: 0.5200
 epoch: 58, train_loss: 0.6237, test_loss: 1.1929, test_f1: 0.5505
 epoch: 59, train_loss: 0.6226, test_loss: 1.2832, test_f1: 0.5236
 epoch: 60, train_loss: 0.6215, test_loss: 1.1816, test_f1: 0.5506
 epoch: 61, train_loss: 0.5960, test_loss: 1.2140, test_f1: 0.5489
 epoch: 62, train_loss: 0.6020, test_loss: 1.2264, test_f1: 0.5303
 epoch: 63, train_loss: 0.6123, test_loss: 1.2203, test_f1: 0.5390
 epoch: 64, train_loss: 0.6015, test_loss: 1.2977, test_f1: 0.5351
 epoch: 65, train_loss: 0.5846, test_loss: 1.2620, test_f1: 0.5235
 epoch: 66, train_loss: 0.5917, test_loss: 1.3777, test_f1: 0.5062
 epoch: 67, train_loss: 0.5949, test_loss: 1.2820, test_f1: 0.5406
 epoch: 68, train_loss: 0.6018, test_loss: 1.2683, test_f1: 0.5281
 epoch: 69, train_loss: 0.5860, test_loss: 1.3417, test_f1: 0.5439
 epoch: 70, train_loss: 0.5762, test_loss: 1.3276, test_f1: 0.5383
 epoch: 71, train_loss: 0.5765, test_loss: 1.4128, test_f1: 0.5415
 epoch: 72, train_loss: 0.7086, test_loss: 1.2777, test_f1: 0.5203
 epoch: 73, train_loss: 0.6382, test_loss: 1.3247, test_f1: 0.5316
 epoch: 74, train_loss: 0.6212, test_loss: 1.3178, test_f1: 0.5290
 epoch: 75, train_loss: 0.5971, test_loss: 1.3321, test_f1: 0.5157
 epoch: 76, train_loss: 0.5769, test_loss: 1.3764, test_f1: 0.5208
 epoch: 77, train_loss: 0.5958, test_loss: 1.3677, test_f1: 0.5232
 epoch: 78, train_loss: 0.5562, test_loss: 1.3283, test_f1: 0.5486
 epoch: 79, train_loss: 0.5769, test_loss: 1.3612, test_f1: 0.5392
 epoch: 80, train_loss: 0.5523, test_loss: 1.3495, test_f1: 0.5370
 epoch: 81, train_loss: 0.5535, test_loss: 1.3740, test_f1: 0.5507
 epoch: 82, train_loss: 0.5547, test_loss: 1.3766, test_f1: 0.5469
 epoch: 83, train_loss: 0.5699, test_loss: 1.4036, test_f1: 0.5592
 epoch: 84, train_loss: 0.5502, test_loss: 1.3550, test_f1: 0.5667
 epoch: 85, train_loss: 0.5376, test_loss: 1.4165, test_f1: 0.5237
 epoch: 86, train_loss: 0.5595, test_loss: 1.3559, test_f1: 0.5362
 epoch: 87, train_loss: 0.5472, test_loss: 1.2861, test_f1: 0.5400
 epoch: 88, train_loss: 0.5532, test_loss: 1.3618, test_f1: 0.5298
 epoch: 89, train_loss: 0.5433, test_loss: 1.3236, test_f1: 0.5353
 epoch: 90, train_loss: 0.5458, test_loss: 1.3569, test_f1: 0.5457
 epoch: 91, train_loss: 0.5279, test_loss: 1.3453, test_f1: 0.5237
 epoch: 92, train_loss: 0.5375, test_loss: 1.4281, test_f1: 0.5170
 epoch: 93, train_loss: 0.5332, test_loss: 1.3835, test_f1: 0.5299
 epoch: 94, train_loss: 0.5307, test_loss: 1.3528, test_f1: 0.5605
 epoch: 95, train_loss: 0.5285, test_loss: 1.4214, test_f1: 0.5522
 epoch: 96, train_loss: 0.5151, test_loss: 1.4200, test_f1: 0.5278
 epoch: 97, train_loss: 0.5154, test_loss: 1.4313, test_f1: 0.5611
 epoch: 98, train_loss: 0.5282, test_loss: 1.3469, test_f1: 0.5788
 epoch: 99, train_loss: 0.4854, test_loss: 1.3984, test_f1: 0.5579
##################ITERATION #9 ****************************************
 epoch: 0, train_loss: 1.3519, test_loss: 1.1783, test_f1: 0.4083
 epoch: 1, train_loss: 1.1617, test_loss: 1.0631, test_f1: 0.4301
 epoch: 2, train_loss: 1.1122, test_loss: 1.0306, test_f1: 0.4282
 epoch: 3, train_loss: 1.0787, test_loss: 0.9986, test_f1: 0.4657
 epoch: 4, train_loss: 1.0640, test_loss: 0.9771, test_f1: 0.5056
 epoch: 5, train_loss: 1.0269, test_loss: 0.9991, test_f1: 0.4585
 epoch: 6, train_loss: 1.0142, test_loss: 0.9585, test_f1: 0.4617
 epoch: 7, train_loss: 0.9949, test_loss: 0.9383, test_f1: 0.4871
 epoch: 8, train_loss: 0.9768, test_loss: 0.9386, test_f1: 0.4908
 epoch: 9, train_loss: 0.9750, test_loss: 0.9178, test_f1: 0.5096
 epoch: 10, train_loss: 0.9563, test_loss: 0.9527, test_f1: 0.4791
 epoch: 11, train_loss: 0.9375, test_loss: 0.9217, test_f1: 0.5005
 epoch: 12, train_loss: 0.9265, test_loss: 1.0620, test_f1: 0.4943
 epoch: 13, train_loss: 0.9231, test_loss: 0.9823, test_f1: 0.5171
 epoch: 14, train_loss: 0.9189, test_loss: 0.9735, test_f1: 0.5080
 epoch: 15, train_loss: 0.8879, test_loss: 1.0779, test_f1: 0.5143
 epoch: 16, train_loss: 0.8971, test_loss: 0.9866, test_f1: 0.4903
 epoch: 17, train_loss: 0.8765, test_loss: 1.0089, test_f1: 0.5192
 epoch: 18, train_loss: 0.8770, test_loss: 1.0072, test_f1: 0.5262
 epoch: 19, train_loss: 0.8658, test_loss: 1.0634, test_f1: 0.5035
 epoch: 20, train_loss: 0.8531, test_loss: 1.0082, test_f1: 0.5324
 epoch: 21, train_loss: 0.8666, test_loss: 0.9708, test_f1: 0.5394
 epoch: 22, train_loss: 0.8650, test_loss: 0.9812, test_f1: 0.5525
 epoch: 23, train_loss: 0.8344, test_loss: 0.9639, test_f1: 0.5289
 epoch: 24, train_loss: 0.8285, test_loss: 1.0219, test_f1: 0.5248
 epoch: 25, train_loss: 0.8228, test_loss: 1.0475, test_f1: 0.5381
 epoch: 26, train_loss: 0.8248, test_loss: 1.0127, test_f1: 0.5335
 epoch: 27, train_loss: 0.8056, test_loss: 0.9812, test_f1: 0.5196
 epoch: 28, train_loss: 0.8006, test_loss: 1.0451, test_f1: 0.5555
 epoch: 29, train_loss: 0.7979, test_loss: 1.0310, test_f1: 0.5453
 epoch: 30, train_loss: 0.7766, test_loss: 1.0409, test_f1: 0.5389
 epoch: 31, train_loss: 0.7757, test_loss: 1.0479, test_f1: 0.5088
 epoch: 32, train_loss: 0.7666, test_loss: 1.0285, test_f1: 0.5281
 epoch: 33, train_loss: 0.7915, test_loss: 1.0790, test_f1: 0.5002
 epoch: 34, train_loss: 0.7690, test_loss: 1.0925, test_f1: 0.5234
 epoch: 35, train_loss: 0.7671, test_loss: 1.0204, test_f1: 0.5178
 epoch: 36, train_loss: 0.7597, test_loss: 1.0981, test_f1: 0.5142
 epoch: 37, train_loss: 0.7593, test_loss: 1.1200, test_f1: 0.4827
 epoch: 38, train_loss: 0.7841, test_loss: 1.0047, test_f1: 0.5465
 epoch: 39, train_loss: 0.7446, test_loss: 1.0579, test_f1: 0.5303
 epoch: 40, train_loss: 0.7506, test_loss: 1.0063, test_f1: 0.5677
 epoch: 41, train_loss: 0.7365, test_loss: 1.0735, test_f1: 0.5238
 epoch: 42, train_loss: 0.7318, test_loss: 1.1304, test_f1: 0.5123
 epoch: 43, train_loss: 0.7127, test_loss: 1.0956, test_f1: 0.5404
 epoch: 44, train_loss: 0.7108, test_loss: 1.0923, test_f1: 0.5535
 epoch: 45, train_loss: 0.6983, test_loss: 1.0378, test_f1: 0.5654
 epoch: 46, train_loss: 0.6999, test_loss: 1.0157, test_f1: 0.5429
 epoch: 47, train_loss: 0.7079, test_loss: 1.0864, test_f1: 0.5394
 epoch: 48, train_loss: 0.7175, test_loss: 1.0512, test_f1: 0.5749
 epoch: 49, train_loss: 0.6916, test_loss: 1.0996, test_f1: 0.5253
 epoch: 50, train_loss: 0.7157, test_loss: 1.0796, test_f1: 0.5354
 epoch: 51, train_loss: 0.6591, test_loss: 1.0413, test_f1: 0.5457
 epoch: 52, train_loss: 0.6607, test_loss: 1.0120, test_f1: 0.5489
 epoch: 53, train_loss: 0.6542, test_loss: 1.0538, test_f1: 0.5699
 epoch: 54, train_loss: 0.6391, test_loss: 1.1030, test_f1: 0.5439
 epoch: 55, train_loss: 0.6276, test_loss: 1.0952, test_f1: 0.5518
 epoch: 56, train_loss: 0.6614, test_loss: 1.1245, test_f1: 0.5371
 epoch: 57, train_loss: 0.6179, test_loss: 1.1156, test_f1: 0.5471
 epoch: 58, train_loss: 0.6075, test_loss: 1.1221, test_f1: 0.5604
 epoch: 59, train_loss: 0.6149, test_loss: 1.1686, test_f1: 0.5509
 epoch: 60, train_loss: 0.5917, test_loss: 1.1362, test_f1: 0.5523
 epoch: 61, train_loss: 0.5856, test_loss: 1.1212, test_f1: 0.5623
 epoch: 62, train_loss: 0.6030, test_loss: 1.0854, test_f1: 0.5515
 epoch: 63, train_loss: 0.6124, test_loss: 1.1084, test_f1: 0.5477
 epoch: 64, train_loss: 0.6058, test_loss: 1.1135, test_f1: 0.5537
 epoch: 65, train_loss: 0.5909, test_loss: 1.1401, test_f1: 0.5536
 epoch: 66, train_loss: 0.6065, test_loss: 1.1601, test_f1: 0.5576
 epoch: 67, train_loss: 0.5817, test_loss: 1.2362, test_f1: 0.5513
 epoch: 68, train_loss: 0.5970, test_loss: 1.1825, test_f1: 0.5522
 epoch: 69, train_loss: 0.5777, test_loss: 1.2354, test_f1: 0.5546
 epoch: 70, train_loss: 0.5764, test_loss: 1.1938, test_f1: 0.5591
 epoch: 71, train_loss: 0.5524, test_loss: 1.2173, test_f1: 0.5438
 epoch: 72, train_loss: 0.5587, test_loss: 1.2975, test_f1: 0.5494
 epoch: 73, train_loss: 0.5592, test_loss: 1.2071, test_f1: 0.5695
 epoch: 74, train_loss: 0.5520, test_loss: 1.2288, test_f1: 0.5585
 epoch: 75, train_loss: 0.5714, test_loss: 1.2632, test_f1: 0.5244
 epoch: 76, train_loss: 0.5631, test_loss: 1.2808, test_f1: 0.5535
 epoch: 77, train_loss: 0.5499, test_loss: 1.3335, test_f1: 0.5406
 epoch: 78, train_loss: 0.5480, test_loss: 1.2363, test_f1: 0.5635
 epoch: 79, train_loss: 0.5470, test_loss: 1.2717, test_f1: 0.5707
 epoch: 80, train_loss: 0.5426, test_loss: 1.2824, test_f1: 0.5479
 epoch: 81, train_loss: 0.5321, test_loss: 1.1847, test_f1: 0.5602
 epoch: 82, train_loss: 0.5581, test_loss: 1.2471, test_f1: 0.5513
 epoch: 83, train_loss: 0.5408, test_loss: 1.3120, test_f1: 0.5730
 epoch: 84, train_loss: 0.5315, test_loss: 1.3516, test_f1: 0.5298
 epoch: 85, train_loss: 0.5479, test_loss: 1.2282, test_f1: 0.5345
 epoch: 86, train_loss: 0.5232, test_loss: 1.2842, test_f1: 0.5378
 epoch: 87, train_loss: 0.5275, test_loss: 1.2606, test_f1: 0.5580
 epoch: 88, train_loss: 0.5354, test_loss: 1.3442, test_f1: 0.5425
 epoch: 89, train_loss: 0.5334, test_loss: 1.2022, test_f1: 0.5469
 epoch: 90, train_loss: 0.5299, test_loss: 1.2721, test_f1: 0.5697
 epoch: 91, train_loss: 0.5237, test_loss: 1.3502, test_f1: 0.5516
 epoch: 92, train_loss: 0.5262, test_loss: 1.1921, test_f1: 0.5554
 epoch: 93, train_loss: 0.5228, test_loss: 1.3420, test_f1: 0.5659
 epoch: 94, train_loss: 0.5190, test_loss: 1.2892, test_f1: 0.5553
 epoch: 95, train_loss: 0.5124, test_loss: 1.2960, test_f1: 0.5441
 epoch: 96, train_loss: 0.5098, test_loss: 1.3144, test_f1: 0.5495
 epoch: 97, train_loss: 0.4984, test_loss: 1.2702, test_f1: 0.5562
 epoch: 98, train_loss: 0.5102, test_loss: 1.2860, test_f1: 0.5605
 epoch: 99, train_loss: 0.5197, test_loss: 1.3380, test_f1: 0.5510

Training completed in 1156.39 seconds
Best F1: 0.6053 at epoch 90
Mean F1 across iterations: 0.5852  0.0106
========================FINAL RESULTS================================
FEGIN weighted F1: 0.6053  0.0106
python main.py --data ltspice_examples --representation component_component --model FEGIN --layers 4 --hiddens 64 --batch_size 32 --lr 0.001 --emb_size 128 --epochs 100 --save_appendix component_component_L4_H64_BS32_LR0.001_E128 --no_val
-----



STDERR:
  File "main.py", line 370, in <module>
    main()
  File "main.py", line 254, in main
    dataset = dataset_class(
  File "/home/philip/projects/llm_inference_code_repo/Circuit-Completion-Using-GNNs/component_classification_with_link_prediction_head/evaluation/FEGIN/kernel/circuit_datasets.py", line 15, in __init__
    self.data, self.slices = torch.load(self.processed_paths[0])
  File "/home/philip/.local/lib/python3.8/site-packages/torch/serialization.py", line 1040, in load
    warnings.warn(
  File "/usr/lib/python3.8/warnings.py", line 109, in _showwarnmsg
    sw(msg.message, msg.category, msg.filename, msg.lineno,
  File "main.py", line 47, in warn_with_traceback
    traceback.print_stack(file=log)
/home/philip/projects/llm_inference_code_repo/Circuit-Completion-Using-GNNs/component_classification_with_link_prediction_head/evaluation/FEGIN/kernel/circuit_datasets.py:15: FutureWarning: You are using `torch.load` with `weights_only=False` (the current default value), which uses the default pickle module implicitly. It is possible to construct malicious pickle data which will execute arbitrary code during unpickling (See https://github.com/pytorch/pytorch/blob/main/SECURITY.md#untrusted-models for more details). In a future release, the default value for `weights_only` will be flipped to `True`. This limits the functions that could be executed during unpickling. Arbitrary objects will no longer be allowed to be loaded via this mode unless they are explicitly allowlisted by the user via `torch.serialization.add_safe_globals`. We recommend you start setting `weights_only=True` for any use case where you don't have full control of the loaded file. Please open an issue on GitHub for any issues related to this experimental feature.
  self.data, self.slices = torch.load(self.processed_paths[0])
