STDOUT:
Results will be saved in /home/philip/projects/llm_inference_code_repo/Circuit-Completion-Using-GNNs/component_classification_with_link_prediction_head/evaluation/FEGIN/results/model_FEGIN_dataset_ltspice_examples
Command line input: python main.py --data ltspice_examples --representation component_component --model FEGIN --layers 2 --hiddens 128 --batch_size 32 --lr 0.0001 --emb_size 250 --epochs 100 --save_appendix component_component_L2_H128_BS32_LR0.0001_E250 --no_val
 is saved.
-----
ltspice_examples - FEGIN
Using 2 layers, 128 hidden units, h = 2
Loading component_component representation dataset
ENTERED
Training FEGIN on component_component representation
Train: 3556, Test: 845
##################ITERATION #0 ****************************************
 epoch: 0, train_loss: 1.3255, test_loss: 1.2628, test_f1: 0.2274
 epoch: 1, train_loss: 1.2513, test_loss: 1.2124, test_f1: 0.2424
 epoch: 2, train_loss: 1.2168, test_loss: 1.1746, test_f1: 0.3607
 epoch: 3, train_loss: 1.1800, test_loss: 1.1306, test_f1: 0.4038
 epoch: 4, train_loss: 1.1456, test_loss: 1.0960, test_f1: 0.4261
 epoch: 5, train_loss: 1.1143, test_loss: 1.0769, test_f1: 0.4358
 epoch: 6, train_loss: 1.0869, test_loss: 1.0458, test_f1: 0.4574
 epoch: 7, train_loss: 1.0652, test_loss: 1.0042, test_f1: 0.4896
 epoch: 8, train_loss: 1.0439, test_loss: 0.9931, test_f1: 0.4967
 epoch: 9, train_loss: 1.0274, test_loss: 0.9908, test_f1: 0.4839
 epoch: 10, train_loss: 1.0105, test_loss: 0.9581, test_f1: 0.4750
 epoch: 11, train_loss: 1.0045, test_loss: 0.9613, test_f1: 0.4896
 epoch: 12, train_loss: 0.9929, test_loss: 0.9469, test_f1: 0.5124
 epoch: 13, train_loss: 0.9786, test_loss: 0.9361, test_f1: 0.5181
 epoch: 14, train_loss: 0.9644, test_loss: 0.9187, test_f1: 0.5108
 epoch: 15, train_loss: 0.9519, test_loss: 0.9354, test_f1: 0.5353
 epoch: 16, train_loss: 0.9468, test_loss: 0.9231, test_f1: 0.5029
 epoch: 17, train_loss: 0.9369, test_loss: 0.9444, test_f1: 0.5148
 epoch: 18, train_loss: 0.9270, test_loss: 0.9457, test_f1: 0.4987
 epoch: 19, train_loss: 0.9203, test_loss: 0.9306, test_f1: 0.4846
 epoch: 20, train_loss: 0.9134, test_loss: 0.9339, test_f1: 0.5142
 epoch: 21, train_loss: 0.9080, test_loss: 0.9294, test_f1: 0.5139
 epoch: 22, train_loss: 0.9031, test_loss: 0.9145, test_f1: 0.5364
 epoch: 23, train_loss: 0.8814, test_loss: 0.9269, test_f1: 0.5264
 epoch: 24, train_loss: 0.8746, test_loss: 0.9110, test_f1: 0.5298
 epoch: 25, train_loss: 0.8767, test_loss: 0.9463, test_f1: 0.5042
 epoch: 26, train_loss: 0.8700, test_loss: 0.9270, test_f1: 0.5169
 epoch: 27, train_loss: 0.8700, test_loss: 0.9639, test_f1: 0.5053
 epoch: 28, train_loss: 0.8684, test_loss: 0.9539, test_f1: 0.5092
 epoch: 29, train_loss: 0.8555, test_loss: 0.9370, test_f1: 0.5134
 epoch: 30, train_loss: 0.8548, test_loss: 0.9749, test_f1: 0.5046
 epoch: 31, train_loss: 0.8399, test_loss: 0.9300, test_f1: 0.5076
 epoch: 32, train_loss: 0.8367, test_loss: 0.9449, test_f1: 0.4952
 epoch: 33, train_loss: 0.8314, test_loss: 0.9494, test_f1: 0.5268
 epoch: 34, train_loss: 0.8300, test_loss: 0.9738, test_f1: 0.5129
 epoch: 35, train_loss: 0.8254, test_loss: 0.9681, test_f1: 0.5237
 epoch: 36, train_loss: 0.8195, test_loss: 0.9869, test_f1: 0.5037
 epoch: 37, train_loss: 0.8091, test_loss: 0.9634, test_f1: 0.5117
 epoch: 38, train_loss: 0.8016, test_loss: 0.9564, test_f1: 0.5228
 epoch: 39, train_loss: 0.8219, test_loss: 1.0043, test_f1: 0.5064
 epoch: 40, train_loss: 0.8125, test_loss: 1.0007, test_f1: 0.5186
 epoch: 41, train_loss: 0.7905, test_loss: 1.0092, test_f1: 0.5257
 epoch: 42, train_loss: 0.7866, test_loss: 1.0364, test_f1: 0.5183
 epoch: 43, train_loss: 0.7831, test_loss: 1.0012, test_f1: 0.5197
 epoch: 44, train_loss: 0.7850, test_loss: 1.0002, test_f1: 0.5349
 epoch: 45, train_loss: 0.7902, test_loss: 1.0380, test_f1: 0.5077
 epoch: 46, train_loss: 0.7745, test_loss: 1.0067, test_f1: 0.5316
 epoch: 47, train_loss: 0.7739, test_loss: 1.0309, test_f1: 0.5247
 epoch: 48, train_loss: 0.7643, test_loss: 1.0283, test_f1: 0.5188
 epoch: 49, train_loss: 0.7521, test_loss: 1.0174, test_f1: 0.5296
 epoch: 50, train_loss: 0.7563, test_loss: 1.0762, test_f1: 0.5250
 epoch: 51, train_loss: 0.7345, test_loss: 1.1058, test_f1: 0.5315
 epoch: 52, train_loss: 0.7423, test_loss: 1.0715, test_f1: 0.5052
 epoch: 53, train_loss: 0.7244, test_loss: 1.0372, test_f1: 0.5286
 epoch: 54, train_loss: 0.7312, test_loss: 1.0612, test_f1: 0.5293
 epoch: 55, train_loss: 0.7393, test_loss: 1.0522, test_f1: 0.5266
 epoch: 56, train_loss: 0.7321, test_loss: 1.1018, test_f1: 0.5422
 epoch: 57, train_loss: 0.7304, test_loss: 1.1287, test_f1: 0.5316
 epoch: 58, train_loss: 0.7279, test_loss: 1.0692, test_f1: 0.5438
 epoch: 59, train_loss: 0.7137, test_loss: 1.0567, test_f1: 0.5249
 epoch: 60, train_loss: 0.7302, test_loss: 1.0999, test_f1: 0.5271
 epoch: 61, train_loss: 0.7282, test_loss: 1.0478, test_f1: 0.5318
 epoch: 62, train_loss: 0.7184, test_loss: 1.0469, test_f1: 0.5369
 epoch: 63, train_loss: 0.7114, test_loss: 1.0608, test_f1: 0.5361
 epoch: 64, train_loss: 0.7189, test_loss: 1.0682, test_f1: 0.5219
 epoch: 65, train_loss: 0.7194, test_loss: 1.0410, test_f1: 0.5337
 epoch: 66, train_loss: 0.7106, test_loss: 1.1093, test_f1: 0.5296
 epoch: 67, train_loss: 0.7055, test_loss: 1.0632, test_f1: 0.5453
 epoch: 68, train_loss: 0.6970, test_loss: 1.1079, test_f1: 0.5162
 epoch: 69, train_loss: 0.6909, test_loss: 1.1062, test_f1: 0.5297
 epoch: 70, train_loss: 0.6891, test_loss: 1.1244, test_f1: 0.5333
 epoch: 71, train_loss: 0.6918, test_loss: 1.1485, test_f1: 0.5231
 epoch: 72, train_loss: 0.6989, test_loss: 1.1195, test_f1: 0.5261
 epoch: 73, train_loss: 0.6892, test_loss: 1.1950, test_f1: 0.5134
 epoch: 74, train_loss: 0.6927, test_loss: 1.1667, test_f1: 0.5271
 epoch: 75, train_loss: 0.6895, test_loss: 1.1644, test_f1: 0.5235
 epoch: 76, train_loss: 0.6818, test_loss: 1.1304, test_f1: 0.5416
 epoch: 77, train_loss: 0.6886, test_loss: 1.1337, test_f1: 0.5303
 epoch: 78, train_loss: 0.6729, test_loss: 1.1339, test_f1: 0.5292
 epoch: 79, train_loss: 0.6687, test_loss: 1.1495, test_f1: 0.5370
 epoch: 80, train_loss: 0.6772, test_loss: 1.1697, test_f1: 0.5420
 epoch: 81, train_loss: 0.6802, test_loss: 1.1493, test_f1: 0.5390
 epoch: 82, train_loss: 0.6692, test_loss: 1.1934, test_f1: 0.5056
 epoch: 83, train_loss: 0.6688, test_loss: 1.3335, test_f1: 0.5169
 epoch: 84, train_loss: 0.6635, test_loss: 1.2283, test_f1: 0.5175
 epoch: 85, train_loss: 0.6764, test_loss: 1.1786, test_f1: 0.5221
 epoch: 86, train_loss: 0.6690, test_loss: 1.1669, test_f1: 0.5431
 epoch: 87, train_loss: 0.6578, test_loss: 1.1880, test_f1: 0.5386
 epoch: 88, train_loss: 0.6630, test_loss: 1.1545, test_f1: 0.5275
 epoch: 89, train_loss: 0.6591, test_loss: 1.1860, test_f1: 0.5430
 epoch: 90, train_loss: 0.6578, test_loss: 1.1866, test_f1: 0.5402
 epoch: 91, train_loss: 0.6641, test_loss: 1.1951, test_f1: 0.5176
 epoch: 92, train_loss: 0.6738, test_loss: 1.1985, test_f1: 0.5181
 epoch: 93, train_loss: 0.6492, test_loss: 1.2054, test_f1: 0.5370
 epoch: 94, train_loss: 0.6407, test_loss: 1.1929, test_f1: 0.5448
 epoch: 95, train_loss: 0.6518, test_loss: 1.2284, test_f1: 0.5407
 epoch: 96, train_loss: 0.6415, test_loss: 1.1924, test_f1: 0.5317
 epoch: 97, train_loss: 0.6444, test_loss: 1.1984, test_f1: 0.5144
 epoch: 98, train_loss: 0.6443, test_loss: 1.2618, test_f1: 0.5189
 epoch: 99, train_loss: 0.6377, test_loss: 1.2571, test_f1: 0.5279
##################ITERATION #1 ****************************************
 epoch: 0, train_loss: 1.2685, test_loss: 1.1815, test_f1: 0.4125
 epoch: 1, train_loss: 1.1945, test_loss: 1.1493, test_f1: 0.4646
 epoch: 2, train_loss: 1.1576, test_loss: 1.1127, test_f1: 0.4815
 epoch: 3, train_loss: 1.1385, test_loss: 1.1483, test_f1: 0.4519
 epoch: 4, train_loss: 1.1068, test_loss: 1.0723, test_f1: 0.4447
 epoch: 5, train_loss: 1.0893, test_loss: 1.0443, test_f1: 0.4595
 epoch: 6, train_loss: 1.0678, test_loss: 1.0358, test_f1: 0.4391
 epoch: 7, train_loss: 1.0561, test_loss: 1.0186, test_f1: 0.4514
 epoch: 8, train_loss: 1.0352, test_loss: 1.0201, test_f1: 0.4508
 epoch: 9, train_loss: 1.0278, test_loss: 1.0022, test_f1: 0.4392
 epoch: 10, train_loss: 1.0163, test_loss: 0.9818, test_f1: 0.4755
 epoch: 11, train_loss: 0.9997, test_loss: 0.9837, test_f1: 0.4749
 epoch: 12, train_loss: 0.9944, test_loss: 0.9661, test_f1: 0.4873
 epoch: 13, train_loss: 0.9855, test_loss: 0.9724, test_f1: 0.4859
 epoch: 14, train_loss: 0.9676, test_loss: 0.9644, test_f1: 0.5147
 epoch: 15, train_loss: 0.9475, test_loss: 0.9435, test_f1: 0.5218
 epoch: 16, train_loss: 0.9497, test_loss: 0.9636, test_f1: 0.4985
 epoch: 17, train_loss: 0.9452, test_loss: 0.9541, test_f1: 0.5041
 epoch: 18, train_loss: 0.9437, test_loss: 0.9595, test_f1: 0.4920
 epoch: 19, train_loss: 0.9301, test_loss: 0.9521, test_f1: 0.4868
 epoch: 20, train_loss: 0.9128, test_loss: 0.9665, test_f1: 0.4905
 epoch: 21, train_loss: 0.9173, test_loss: 0.9411, test_f1: 0.5180
 epoch: 22, train_loss: 0.9053, test_loss: 0.9298, test_f1: 0.5180
 epoch: 23, train_loss: 0.8974, test_loss: 0.9232, test_f1: 0.5241
 epoch: 24, train_loss: 0.9035, test_loss: 0.9483, test_f1: 0.5254
 epoch: 25, train_loss: 0.8939, test_loss: 0.9759, test_f1: 0.5024
 epoch: 26, train_loss: 0.8936, test_loss: 0.9342, test_f1: 0.5258
 epoch: 27, train_loss: 0.8827, test_loss: 0.9358, test_f1: 0.5010
 epoch: 28, train_loss: 0.8647, test_loss: 0.9609, test_f1: 0.5122
 epoch: 29, train_loss: 0.8689, test_loss: 0.9601, test_f1: 0.5262
 epoch: 30, train_loss: 0.8474, test_loss: 0.9418, test_f1: 0.5277
 epoch: 31, train_loss: 0.8523, test_loss: 0.9495, test_f1: 0.5300
 epoch: 32, train_loss: 0.8457, test_loss: 0.9638, test_f1: 0.5205
 epoch: 33, train_loss: 0.8572, test_loss: 0.9749, test_f1: 0.5249
 epoch: 34, train_loss: 0.8356, test_loss: 0.9665, test_f1: 0.5262
 epoch: 35, train_loss: 0.8376, test_loss: 0.9822, test_f1: 0.5148
 epoch: 36, train_loss: 0.8208, test_loss: 0.9548, test_f1: 0.5252
 epoch: 37, train_loss: 0.8215, test_loss: 0.9732, test_f1: 0.5325
 epoch: 38, train_loss: 0.8187, test_loss: 0.9581, test_f1: 0.5229
 epoch: 39, train_loss: 0.8097, test_loss: 0.9882, test_f1: 0.5328
 epoch: 40, train_loss: 0.8085, test_loss: 0.9748, test_f1: 0.5209
 epoch: 41, train_loss: 0.8051, test_loss: 0.9902, test_f1: 0.5277
 epoch: 42, train_loss: 0.7881, test_loss: 0.9976, test_f1: 0.5335
 epoch: 43, train_loss: 0.7938, test_loss: 1.0306, test_f1: 0.5257
 epoch: 44, train_loss: 0.7929, test_loss: 0.9893, test_f1: 0.5284
 epoch: 45, train_loss: 0.7772, test_loss: 1.0202, test_f1: 0.5178
 epoch: 46, train_loss: 0.7775, test_loss: 1.0061, test_f1: 0.5174
 epoch: 47, train_loss: 0.7853, test_loss: 1.0268, test_f1: 0.5197
 epoch: 48, train_loss: 0.7808, test_loss: 1.0015, test_f1: 0.5396
 epoch: 49, train_loss: 0.7840, test_loss: 1.0299, test_f1: 0.5146
 epoch: 50, train_loss: 0.7665, test_loss: 1.0821, test_f1: 0.5283
 epoch: 51, train_loss: 0.7536, test_loss: 1.0148, test_f1: 0.5243
 epoch: 52, train_loss: 0.7477, test_loss: 1.0516, test_f1: 0.5227
 epoch: 53, train_loss: 0.7558, test_loss: 1.0363, test_f1: 0.5130
 epoch: 54, train_loss: 0.7392, test_loss: 1.0244, test_f1: 0.5162
 epoch: 55, train_loss: 0.7373, test_loss: 1.0294, test_f1: 0.5288
 epoch: 56, train_loss: 0.7353, test_loss: 1.0470, test_f1: 0.5250
 epoch: 57, train_loss: 0.7247, test_loss: 1.0446, test_f1: 0.5243
 epoch: 58, train_loss: 0.7364, test_loss: 1.0388, test_f1: 0.5280
 epoch: 59, train_loss: 0.7396, test_loss: 1.0505, test_f1: 0.5258
 epoch: 60, train_loss: 0.7331, test_loss: 0.9752, test_f1: 0.5367
 epoch: 61, train_loss: 0.7175, test_loss: 1.0158, test_f1: 0.5433
 epoch: 62, train_loss: 0.7213, test_loss: 1.0374, test_f1: 0.5383
 epoch: 63, train_loss: 0.7069, test_loss: 1.0070, test_f1: 0.5142
 epoch: 64, train_loss: 0.7213, test_loss: 1.0092, test_f1: 0.5235
 epoch: 65, train_loss: 0.7113, test_loss: 1.0268, test_f1: 0.5217
 epoch: 66, train_loss: 0.7091, test_loss: 1.0696, test_f1: 0.5335
 epoch: 67, train_loss: 0.7120, test_loss: 1.0009, test_f1: 0.5376
 epoch: 68, train_loss: 0.7113, test_loss: 1.0370, test_f1: 0.5227
 epoch: 69, train_loss: 0.6994, test_loss: 1.0510, test_f1: 0.5259
 epoch: 70, train_loss: 0.6929, test_loss: 0.9871, test_f1: 0.5407
 epoch: 71, train_loss: 0.7073, test_loss: 0.9732, test_f1: 0.5375
 epoch: 72, train_loss: 0.6858, test_loss: 1.0207, test_f1: 0.5121
 epoch: 73, train_loss: 0.6742, test_loss: 1.0989, test_f1: 0.5108
 epoch: 74, train_loss: 0.6868, test_loss: 1.0664, test_f1: 0.5272
 epoch: 75, train_loss: 0.6843, test_loss: 1.0469, test_f1: 0.5225
 epoch: 76, train_loss: 0.6808, test_loss: 1.0487, test_f1: 0.5312
 epoch: 77, train_loss: 0.7008, test_loss: 1.0415, test_f1: 0.5220
 epoch: 78, train_loss: 0.6878, test_loss: 1.0570, test_f1: 0.5287
 epoch: 79, train_loss: 0.6775, test_loss: 1.0234, test_f1: 0.5306
 epoch: 80, train_loss: 0.6838, test_loss: 1.0418, test_f1: 0.5202
 epoch: 81, train_loss: 0.6660, test_loss: 1.0882, test_f1: 0.5232
 epoch: 82, train_loss: 0.6692, test_loss: 1.0609, test_f1: 0.5232
 epoch: 83, train_loss: 0.6670, test_loss: 1.0884, test_f1: 0.5330
 epoch: 84, train_loss: 0.6648, test_loss: 1.0604, test_f1: 0.5210
 epoch: 85, train_loss: 0.6691, test_loss: 1.0500, test_f1: 0.5187
 epoch: 86, train_loss: 0.6635, test_loss: 1.0339, test_f1: 0.5347
 epoch: 87, train_loss: 0.6886, test_loss: 1.0631, test_f1: 0.5185
 epoch: 88, train_loss: 0.6690, test_loss: 1.1225, test_f1: 0.5206
 epoch: 89, train_loss: 0.6661, test_loss: 1.0789, test_f1: 0.5153
 epoch: 90, train_loss: 0.6510, test_loss: 1.0842, test_f1: 0.5247
 epoch: 91, train_loss: 0.6735, test_loss: 1.1391, test_f1: 0.5239
 epoch: 92, train_loss: 0.6621, test_loss: 1.0796, test_f1: 0.5206
 epoch: 93, train_loss: 0.6513, test_loss: 1.0713, test_f1: 0.5310
 epoch: 94, train_loss: 0.6512, test_loss: 1.1378, test_f1: 0.5236
 epoch: 95, train_loss: 0.6617, test_loss: 1.1250, test_f1: 0.5313
 epoch: 96, train_loss: 0.6603, test_loss: 1.0588, test_f1: 0.5413
 epoch: 97, train_loss: 0.6482, test_loss: 1.1135, test_f1: 0.5229
 epoch: 98, train_loss: 0.6426, test_loss: 1.1669, test_f1: 0.5264
 epoch: 99, train_loss: 0.6354, test_loss: 1.1468, test_f1: 0.5088
##################ITERATION #2 ****************************************
 epoch: 0, train_loss: 1.2263, test_loss: 1.1227, test_f1: 0.4710
 epoch: 1, train_loss: 1.1495, test_loss: 1.0835, test_f1: 0.4723
 epoch: 2, train_loss: 1.1246, test_loss: 1.0682, test_f1: 0.4713
 epoch: 3, train_loss: 1.1060, test_loss: 1.0339, test_f1: 0.4948
 epoch: 4, train_loss: 1.0754, test_loss: 1.0232, test_f1: 0.4942
 epoch: 5, train_loss: 1.0579, test_loss: 1.0262, test_f1: 0.4891
 epoch: 6, train_loss: 1.0444, test_loss: 1.0005, test_f1: 0.5063
 epoch: 7, train_loss: 1.0251, test_loss: 0.9852, test_f1: 0.4803
 epoch: 8, train_loss: 1.0178, test_loss: 0.9939, test_f1: 0.4944
 epoch: 9, train_loss: 0.9959, test_loss: 0.9735, test_f1: 0.4810
 epoch: 10, train_loss: 0.9850, test_loss: 0.9727, test_f1: 0.4994
 epoch: 11, train_loss: 0.9803, test_loss: 0.9729, test_f1: 0.5080
 epoch: 12, train_loss: 0.9716, test_loss: 0.9559, test_f1: 0.5100
 epoch: 13, train_loss: 0.9613, test_loss: 0.9506, test_f1: 0.5088
 epoch: 14, train_loss: 0.9495, test_loss: 0.9455, test_f1: 0.5205
 epoch: 15, train_loss: 0.9425, test_loss: 0.9690, test_f1: 0.5006
 epoch: 16, train_loss: 0.9322, test_loss: 0.9628, test_f1: 0.4949
 epoch: 17, train_loss: 0.9387, test_loss: 0.9467, test_f1: 0.5259
 epoch: 18, train_loss: 0.9269, test_loss: 0.9783, test_f1: 0.5134
 epoch: 19, train_loss: 0.9104, test_loss: 0.9597, test_f1: 0.5092
 epoch: 20, train_loss: 0.9132, test_loss: 0.9685, test_f1: 0.5052
 epoch: 21, train_loss: 0.9045, test_loss: 0.9462, test_f1: 0.5280
 epoch: 22, train_loss: 0.8910, test_loss: 0.9511, test_f1: 0.5304
 epoch: 23, train_loss: 0.8776, test_loss: 0.9871, test_f1: 0.5237
 epoch: 24, train_loss: 0.8769, test_loss: 0.9594, test_f1: 0.5191
 epoch: 25, train_loss: 0.8738, test_loss: 0.9695, test_f1: 0.5378
 epoch: 26, train_loss: 0.8743, test_loss: 0.9740, test_f1: 0.5315
 epoch: 27, train_loss: 0.8636, test_loss: 1.0143, test_f1: 0.5337
 epoch: 28, train_loss: 0.8568, test_loss: 0.9992, test_f1: 0.5271
 epoch: 29, train_loss: 0.8421, test_loss: 0.9872, test_f1: 0.5203
 epoch: 30, train_loss: 0.8410, test_loss: 1.0338, test_f1: 0.5320
 epoch: 31, train_loss: 0.8328, test_loss: 1.0405, test_f1: 0.5205
 epoch: 32, train_loss: 0.8344, test_loss: 0.9900, test_f1: 0.5392
 epoch: 33, train_loss: 0.8103, test_loss: 0.9935, test_f1: 0.5496
 epoch: 34, train_loss: 0.8204, test_loss: 1.0118, test_f1: 0.5346
 epoch: 35, train_loss: 0.8207, test_loss: 1.0254, test_f1: 0.5385
 epoch: 36, train_loss: 0.8072, test_loss: 1.0255, test_f1: 0.5342
 epoch: 37, train_loss: 0.8054, test_loss: 1.0497, test_f1: 0.5173
 epoch: 38, train_loss: 0.8066, test_loss: 1.0240, test_f1: 0.5257
 epoch: 39, train_loss: 0.8036, test_loss: 1.0661, test_f1: 0.5203
 epoch: 40, train_loss: 0.8000, test_loss: 1.0305, test_f1: 0.5443
 epoch: 41, train_loss: 0.7966, test_loss: 1.0305, test_f1: 0.5396
 epoch: 42, train_loss: 0.7788, test_loss: 1.0012, test_f1: 0.5499
 epoch: 43, train_loss: 0.7671, test_loss: 1.0370, test_f1: 0.5051
 epoch: 44, train_loss: 0.7784, test_loss: 1.0635, test_f1: 0.5025
 epoch: 45, train_loss: 0.7773, test_loss: 1.0091, test_f1: 0.5278
 epoch: 46, train_loss: 0.7687, test_loss: 1.0606, test_f1: 0.5367
 epoch: 47, train_loss: 0.7518, test_loss: 1.0381, test_f1: 0.5184
 epoch: 48, train_loss: 0.7521, test_loss: 1.0482, test_f1: 0.5227
 epoch: 49, train_loss: 0.7476, test_loss: 1.0979, test_f1: 0.5246
 epoch: 50, train_loss: 0.7516, test_loss: 1.1174, test_f1: 0.5387
 epoch: 51, train_loss: 0.7309, test_loss: 1.1166, test_f1: 0.5248
 epoch: 52, train_loss: 0.7189, test_loss: 1.0909, test_f1: 0.5332
 epoch: 53, train_loss: 0.7233, test_loss: 1.0918, test_f1: 0.5311
 epoch: 54, train_loss: 0.7232, test_loss: 1.1251, test_f1: 0.5354
 epoch: 55, train_loss: 0.7192, test_loss: 1.1079, test_f1: 0.5475
 epoch: 56, train_loss: 0.7129, test_loss: 1.1346, test_f1: 0.5246
 epoch: 57, train_loss: 0.7207, test_loss: 1.1135, test_f1: 0.5431
 epoch: 58, train_loss: 0.7115, test_loss: 1.1314, test_f1: 0.5326
 epoch: 59, train_loss: 0.6831, test_loss: 1.1302, test_f1: 0.5331
 epoch: 60, train_loss: 0.7094, test_loss: 1.1584, test_f1: 0.5349
 epoch: 61, train_loss: 0.6980, test_loss: 1.1462, test_f1: 0.5427
 epoch: 62, train_loss: 0.6977, test_loss: 1.1413, test_f1: 0.5366
 epoch: 63, train_loss: 0.6954, test_loss: 1.1369, test_f1: 0.5426
 epoch: 64, train_loss: 0.6919, test_loss: 1.1355, test_f1: 0.5335
 epoch: 65, train_loss: 0.7026, test_loss: 1.1622, test_f1: 0.5359
 epoch: 66, train_loss: 0.6867, test_loss: 1.1933, test_f1: 0.5301
 epoch: 67, train_loss: 0.6842, test_loss: 1.1399, test_f1: 0.5315
 epoch: 68, train_loss: 0.6818, test_loss: 1.1322, test_f1: 0.5391
 epoch: 69, train_loss: 0.6704, test_loss: 1.1277, test_f1: 0.5308
 epoch: 70, train_loss: 0.6833, test_loss: 1.1374, test_f1: 0.5406
 epoch: 71, train_loss: 0.6809, test_loss: 1.1148, test_f1: 0.5428
 epoch: 72, train_loss: 0.6876, test_loss: 1.1615, test_f1: 0.5523
 epoch: 73, train_loss: 0.6675, test_loss: 1.1718, test_f1: 0.5473
 epoch: 74, train_loss: 0.6732, test_loss: 1.2344, test_f1: 0.5359
 epoch: 75, train_loss: 0.6674, test_loss: 1.1868, test_f1: 0.5467
 epoch: 76, train_loss: 0.6751, test_loss: 1.1697, test_f1: 0.5342
 epoch: 77, train_loss: 0.6710, test_loss: 1.2017, test_f1: 0.5478
 epoch: 78, train_loss: 0.6565, test_loss: 1.2165, test_f1: 0.5570
 epoch: 79, train_loss: 0.6534, test_loss: 1.2586, test_f1: 0.5247
 epoch: 80, train_loss: 0.6559, test_loss: 1.2293, test_f1: 0.5334
 epoch: 81, train_loss: 0.6511, test_loss: 1.2359, test_f1: 0.5432
 epoch: 82, train_loss: 0.6479, test_loss: 1.2445, test_f1: 0.5356
 epoch: 83, train_loss: 0.6460, test_loss: 1.2555, test_f1: 0.5476
 epoch: 84, train_loss: 0.6646, test_loss: 1.2476, test_f1: 0.5365
 epoch: 85, train_loss: 0.6545, test_loss: 1.2397, test_f1: 0.5455
 epoch: 86, train_loss: 0.6417, test_loss: 1.2701, test_f1: 0.5285
 epoch: 87, train_loss: 0.6485, test_loss: 1.3301, test_f1: 0.5320
 epoch: 88, train_loss: 0.6374, test_loss: 1.2145, test_f1: 0.5448
 epoch: 89, train_loss: 0.6551, test_loss: 1.3039, test_f1: 0.5295
 epoch: 90, train_loss: 0.6378, test_loss: 1.2521, test_f1: 0.5365
 epoch: 91, train_loss: 0.6403, test_loss: 1.2346, test_f1: 0.5435
 epoch: 92, train_loss: 0.6442, test_loss: 1.3258, test_f1: 0.5191
 epoch: 93, train_loss: 0.6482, test_loss: 1.2919, test_f1: 0.5250
 epoch: 94, train_loss: 0.6356, test_loss: 1.3123, test_f1: 0.5259
 epoch: 95, train_loss: 0.6462, test_loss: 1.3755, test_f1: 0.5380
 epoch: 96, train_loss: 0.6386, test_loss: 1.3269, test_f1: 0.5304
 epoch: 97, train_loss: 0.6115, test_loss: 1.2857, test_f1: 0.5193
 epoch: 98, train_loss: 0.6185, test_loss: 1.3273, test_f1: 0.5352
 epoch: 99, train_loss: 0.6284, test_loss: 1.3567, test_f1: 0.5393
##################ITERATION #3 ****************************************
 epoch: 0, train_loss: 1.2568, test_loss: 1.1332, test_f1: 0.4146
 epoch: 1, train_loss: 1.1745, test_loss: 1.1086, test_f1: 0.4332
 epoch: 2, train_loss: 1.1402, test_loss: 1.0822, test_f1: 0.4643
 epoch: 3, train_loss: 1.1215, test_loss: 1.0569, test_f1: 0.4519
 epoch: 4, train_loss: 1.1015, test_loss: 1.0484, test_f1: 0.4715
 epoch: 5, train_loss: 1.0881, test_loss: 1.0322, test_f1: 0.4714
 epoch: 6, train_loss: 1.0732, test_loss: 1.0219, test_f1: 0.4645
 epoch: 7, train_loss: 1.0434, test_loss: 1.0081, test_f1: 0.4684
 epoch: 8, train_loss: 1.0379, test_loss: 0.9958, test_f1: 0.4750
 epoch: 9, train_loss: 1.0163, test_loss: 0.9995, test_f1: 0.4548
 epoch: 10, train_loss: 1.0080, test_loss: 1.0151, test_f1: 0.4404
 epoch: 11, train_loss: 1.0112, test_loss: 0.9780, test_f1: 0.4706
 epoch: 12, train_loss: 0.9911, test_loss: 0.9821, test_f1: 0.4676
 epoch: 13, train_loss: 0.9737, test_loss: 0.9740, test_f1: 0.4774
 epoch: 14, train_loss: 0.9683, test_loss: 0.9520, test_f1: 0.4882
 epoch: 15, train_loss: 0.9609, test_loss: 0.9522, test_f1: 0.4680
 epoch: 16, train_loss: 0.9561, test_loss: 0.9794, test_f1: 0.4823
 epoch: 17, train_loss: 0.9346, test_loss: 0.9424, test_f1: 0.4743
 epoch: 18, train_loss: 0.9451, test_loss: 0.9583, test_f1: 0.4751
 epoch: 19, train_loss: 0.9360, test_loss: 0.9549, test_f1: 0.4873
 epoch: 20, train_loss: 0.9276, test_loss: 0.9481, test_f1: 0.4912
 epoch: 21, train_loss: 0.9184, test_loss: 0.9307, test_f1: 0.4932
 epoch: 22, train_loss: 0.9050, test_loss: 0.9637, test_f1: 0.4961
 epoch: 23, train_loss: 0.9022, test_loss: 0.9674, test_f1: 0.4999
 epoch: 24, train_loss: 0.8955, test_loss: 0.9446, test_f1: 0.5108
 epoch: 25, train_loss: 0.8859, test_loss: 0.9297, test_f1: 0.4969
 epoch: 26, train_loss: 0.8730, test_loss: 0.9212, test_f1: 0.5226
 epoch: 27, train_loss: 0.8756, test_loss: 0.9614, test_f1: 0.4843
 epoch: 28, train_loss: 0.8736, test_loss: 0.9279, test_f1: 0.5265
 epoch: 29, train_loss: 0.8708, test_loss: 0.9277, test_f1: 0.5300
 epoch: 30, train_loss: 0.8698, test_loss: 0.9392, test_f1: 0.5167
 epoch: 31, train_loss: 0.8543, test_loss: 0.8952, test_f1: 0.5396
 epoch: 32, train_loss: 0.8551, test_loss: 0.9472, test_f1: 0.5274
 epoch: 33, train_loss: 0.8570, test_loss: 0.9868, test_f1: 0.5157
 epoch: 34, train_loss: 0.8379, test_loss: 0.9207, test_f1: 0.5294
 epoch: 35, train_loss: 0.8249, test_loss: 0.9769, test_f1: 0.5258
 epoch: 36, train_loss: 0.8216, test_loss: 0.9595, test_f1: 0.5301
 epoch: 37, train_loss: 0.8205, test_loss: 0.9795, test_f1: 0.5159
 epoch: 38, train_loss: 0.8134, test_loss: 0.9186, test_f1: 0.5409
 epoch: 39, train_loss: 0.8151, test_loss: 1.0087, test_f1: 0.5212
 epoch: 40, train_loss: 0.8017, test_loss: 1.0053, test_f1: 0.5398
 epoch: 41, train_loss: 0.8071, test_loss: 0.9415, test_f1: 0.5557
 epoch: 42, train_loss: 0.8124, test_loss: 1.0693, test_f1: 0.5062
 epoch: 43, train_loss: 0.8001, test_loss: 0.9948, test_f1: 0.5500
 epoch: 44, train_loss: 0.7925, test_loss: 0.9827, test_f1: 0.5239
 epoch: 45, train_loss: 0.7849, test_loss: 1.0069, test_f1: 0.5264
 epoch: 46, train_loss: 0.7788, test_loss: 1.0020, test_f1: 0.5379
 epoch: 47, train_loss: 0.7769, test_loss: 1.0360, test_f1: 0.5417
 epoch: 48, train_loss: 0.7651, test_loss: 0.9745, test_f1: 0.5185
 epoch: 49, train_loss: 0.7654, test_loss: 0.9566, test_f1: 0.5429
 epoch: 50, train_loss: 0.7699, test_loss: 1.0382, test_f1: 0.5618
 epoch: 51, train_loss: 0.7455, test_loss: 0.9847, test_f1: 0.5405
 epoch: 52, train_loss: 0.7366, test_loss: 0.9985, test_f1: 0.5316
 epoch: 53, train_loss: 0.7352, test_loss: 0.9817, test_f1: 0.5497
 epoch: 54, train_loss: 0.7489, test_loss: 1.0180, test_f1: 0.5473
 epoch: 55, train_loss: 0.7386, test_loss: 0.9653, test_f1: 0.5617
 epoch: 56, train_loss: 0.7251, test_loss: 0.9943, test_f1: 0.5534
 epoch: 57, train_loss: 0.7337, test_loss: 0.9835, test_f1: 0.5532
 epoch: 58, train_loss: 0.7308, test_loss: 0.9890, test_f1: 0.5437
 epoch: 59, train_loss: 0.7322, test_loss: 0.9977, test_f1: 0.5511
 epoch: 60, train_loss: 0.7301, test_loss: 1.0261, test_f1: 0.5540
 epoch: 61, train_loss: 0.7065, test_loss: 1.0235, test_f1: 0.5539
 epoch: 62, train_loss: 0.7197, test_loss: 1.0261, test_f1: 0.5478
 epoch: 63, train_loss: 0.7064, test_loss: 1.0761, test_f1: 0.5521
 epoch: 64, train_loss: 0.7032, test_loss: 1.1235, test_f1: 0.5337
 epoch: 65, train_loss: 0.7141, test_loss: 1.2148, test_f1: 0.5405
 epoch: 66, train_loss: 0.7134, test_loss: 1.0725, test_f1: 0.5459
 epoch: 67, train_loss: 0.7033, test_loss: 1.1152, test_f1: 0.5258
 epoch: 68, train_loss: 0.6971, test_loss: 1.1026, test_f1: 0.5269
 epoch: 69, train_loss: 0.7036, test_loss: 1.1242, test_f1: 0.5482
 epoch: 70, train_loss: 0.7001, test_loss: 1.0742, test_f1: 0.5562
 epoch: 71, train_loss: 0.6912, test_loss: 1.0709, test_f1: 0.5525
 epoch: 72, train_loss: 0.7182, test_loss: 1.0501, test_f1: 0.5543
 epoch: 73, train_loss: 0.6892, test_loss: 1.1454, test_f1: 0.5454
 epoch: 74, train_loss: 0.6877, test_loss: 1.0896, test_f1: 0.5544
 epoch: 75, train_loss: 0.6892, test_loss: 1.0640, test_f1: 0.5328
 epoch: 76, train_loss: 0.7010, test_loss: 1.1539, test_f1: 0.5397
 epoch: 77, train_loss: 0.6752, test_loss: 1.1386, test_f1: 0.5356
 epoch: 78, train_loss: 0.6751, test_loss: 1.0820, test_f1: 0.5646
 epoch: 79, train_loss: 0.6785, test_loss: 1.1446, test_f1: 0.5356
 epoch: 80, train_loss: 0.6767, test_loss: 1.1301, test_f1: 0.5478
 epoch: 81, train_loss: 0.6718, test_loss: 1.1552, test_f1: 0.5352
 epoch: 82, train_loss: 0.6750, test_loss: 1.1336, test_f1: 0.5413
 epoch: 83, train_loss: 0.6705, test_loss: 1.1053, test_f1: 0.5459
 epoch: 84, train_loss: 0.6658, test_loss: 1.1409, test_f1: 0.5351
 epoch: 85, train_loss: 0.6723, test_loss: 1.2193, test_f1: 0.5310
 epoch: 86, train_loss: 0.6538, test_loss: 1.1397, test_f1: 0.5468
 epoch: 87, train_loss: 0.6628, test_loss: 1.2338, test_f1: 0.5536
 epoch: 88, train_loss: 0.6544, test_loss: 1.1115, test_f1: 0.5451
 epoch: 89, train_loss: 0.6735, test_loss: 1.1550, test_f1: 0.5354
 epoch: 90, train_loss: 0.6500, test_loss: 1.1153, test_f1: 0.5496
 epoch: 91, train_loss: 0.6449, test_loss: 1.1566, test_f1: 0.5441
 epoch: 92, train_loss: 0.6590, test_loss: 1.1606, test_f1: 0.5510
 epoch: 93, train_loss: 0.6340, test_loss: 1.1695, test_f1: 0.5499
 epoch: 94, train_loss: 0.6510, test_loss: 1.1587, test_f1: 0.5359
 epoch: 95, train_loss: 0.6437, test_loss: 1.1799, test_f1: 0.5354
 epoch: 96, train_loss: 0.6485, test_loss: 1.1622, test_f1: 0.5389
 epoch: 97, train_loss: 0.6349, test_loss: 1.0500, test_f1: 0.5580
 epoch: 98, train_loss: 0.6401, test_loss: 1.2057, test_f1: 0.5377
 epoch: 99, train_loss: 0.6481, test_loss: 1.1039, test_f1: 0.5504
##################ITERATION #4 ****************************************
 epoch: 0, train_loss: 1.2877, test_loss: 1.1445, test_f1: 0.4297
 epoch: 1, train_loss: 1.1775, test_loss: 1.1258, test_f1: 0.4611
 epoch: 2, train_loss: 1.1384, test_loss: 1.0985, test_f1: 0.4662
 epoch: 3, train_loss: 1.1264, test_loss: 1.0867, test_f1: 0.4354
 epoch: 4, train_loss: 1.1166, test_loss: 1.0772, test_f1: 0.4648
 epoch: 5, train_loss: 1.0884, test_loss: 1.0521, test_f1: 0.4685
 epoch: 6, train_loss: 1.0767, test_loss: 1.0475, test_f1: 0.4704
 epoch: 7, train_loss: 1.0534, test_loss: 1.0248, test_f1: 0.4699
 epoch: 8, train_loss: 1.0443, test_loss: 1.0115, test_f1: 0.4694
 epoch: 9, train_loss: 1.0334, test_loss: 1.0031, test_f1: 0.4848
 epoch: 10, train_loss: 1.0109, test_loss: 0.9989, test_f1: 0.4924
 epoch: 11, train_loss: 1.0164, test_loss: 0.9969, test_f1: 0.4791
 epoch: 12, train_loss: 1.0033, test_loss: 0.9685, test_f1: 0.5115
 epoch: 13, train_loss: 0.9817, test_loss: 0.9677, test_f1: 0.4928
 epoch: 14, train_loss: 0.9674, test_loss: 0.9507, test_f1: 0.4916
 epoch: 15, train_loss: 0.9612, test_loss: 0.9653, test_f1: 0.4843
 epoch: 16, train_loss: 0.9544, test_loss: 0.9692, test_f1: 0.4895
 epoch: 17, train_loss: 0.9471, test_loss: 0.9570, test_f1: 0.4961
 epoch: 18, train_loss: 0.9324, test_loss: 0.9496, test_f1: 0.5047
 epoch: 19, train_loss: 0.9377, test_loss: 0.9444, test_f1: 0.5056
 epoch: 20, train_loss: 0.9238, test_loss: 0.9709, test_f1: 0.5056
 epoch: 21, train_loss: 0.9222, test_loss: 0.9564, test_f1: 0.4982
 epoch: 22, train_loss: 0.9009, test_loss: 0.9450, test_f1: 0.5173
 epoch: 23, train_loss: 0.8970, test_loss: 0.9581, test_f1: 0.5107
 epoch: 24, train_loss: 0.8934, test_loss: 0.9477, test_f1: 0.5063
 epoch: 25, train_loss: 0.8969, test_loss: 0.9649, test_f1: 0.5239
 epoch: 26, train_loss: 0.8784, test_loss: 0.9980, test_f1: 0.5241
 epoch: 27, train_loss: 0.8822, test_loss: 0.9418, test_f1: 0.5042
 epoch: 28, train_loss: 0.8717, test_loss: 0.9681, test_f1: 0.5085
 epoch: 29, train_loss: 0.8738, test_loss: 0.9869, test_f1: 0.5255
 epoch: 30, train_loss: 0.8592, test_loss: 0.9047, test_f1: 0.5404
 epoch: 31, train_loss: 0.8623, test_loss: 1.0019, test_f1: 0.5230
 epoch: 32, train_loss: 0.8639, test_loss: 0.9423, test_f1: 0.5399
 epoch: 33, train_loss: 0.8492, test_loss: 0.9853, test_f1: 0.5245
 epoch: 34, train_loss: 0.8477, test_loss: 0.9697, test_f1: 0.5375
 epoch: 35, train_loss: 0.8418, test_loss: 0.9508, test_f1: 0.5420
 epoch: 36, train_loss: 0.8278, test_loss: 1.0232, test_f1: 0.5324
 epoch: 37, train_loss: 0.8227, test_loss: 0.9417, test_f1: 0.5285
 epoch: 38, train_loss: 0.8308, test_loss: 1.0328, test_f1: 0.5241
 epoch: 39, train_loss: 0.8244, test_loss: 0.9316, test_f1: 0.5369
 epoch: 40, train_loss: 0.8150, test_loss: 0.9328, test_f1: 0.5395
 epoch: 41, train_loss: 0.7978, test_loss: 0.9989, test_f1: 0.5351
 epoch: 42, train_loss: 0.8086, test_loss: 0.9682, test_f1: 0.5494
 epoch: 43, train_loss: 0.8109, test_loss: 1.0123, test_f1: 0.5344
 epoch: 44, train_loss: 0.8003, test_loss: 0.9085, test_f1: 0.5614
 epoch: 45, train_loss: 0.8035, test_loss: 1.0001, test_f1: 0.5357
 epoch: 46, train_loss: 0.7897, test_loss: 1.0369, test_f1: 0.5411
 epoch: 47, train_loss: 0.7819, test_loss: 1.0275, test_f1: 0.5271
 epoch: 48, train_loss: 0.7813, test_loss: 1.0000, test_f1: 0.5303
 epoch: 49, train_loss: 0.7900, test_loss: 1.0186, test_f1: 0.5489
 epoch: 50, train_loss: 0.7664, test_loss: 1.0456, test_f1: 0.5442
 epoch: 51, train_loss: 0.7629, test_loss: 0.9955, test_f1: 0.5500
 epoch: 52, train_loss: 0.7579, test_loss: 0.9895, test_f1: 0.5415
 epoch: 53, train_loss: 0.7560, test_loss: 1.0096, test_f1: 0.5571
 epoch: 54, train_loss: 0.7430, test_loss: 1.0437, test_f1: 0.5422
 epoch: 55, train_loss: 0.7486, test_loss: 1.0127, test_f1: 0.5598
 epoch: 56, train_loss: 0.7445, test_loss: 1.0411, test_f1: 0.5326
 epoch: 57, train_loss: 0.7496, test_loss: 1.0383, test_f1: 0.5245
 epoch: 58, train_loss: 0.7271, test_loss: 0.9863, test_f1: 0.5464
 epoch: 59, train_loss: 0.7270, test_loss: 0.9696, test_f1: 0.5581
 epoch: 60, train_loss: 0.7397, test_loss: 1.1172, test_f1: 0.5236
 epoch: 61, train_loss: 0.7317, test_loss: 1.0231, test_f1: 0.5442
 epoch: 62, train_loss: 0.7302, test_loss: 1.0522, test_f1: 0.5098
 epoch: 63, train_loss: 0.7343, test_loss: 1.0217, test_f1: 0.5532
 epoch: 64, train_loss: 0.7185, test_loss: 1.0762, test_f1: 0.5437
 epoch: 65, train_loss: 0.7218, test_loss: 1.0333, test_f1: 0.5528
 epoch: 66, train_loss: 0.7240, test_loss: 1.0237, test_f1: 0.5667
 epoch: 67, train_loss: 0.7170, test_loss: 1.0404, test_f1: 0.5477
 epoch: 68, train_loss: 0.7095, test_loss: 1.0695, test_f1: 0.5510
 epoch: 69, train_loss: 0.7070, test_loss: 0.9880, test_f1: 0.5606
 epoch: 70, train_loss: 0.7198, test_loss: 1.0809, test_f1: 0.5448
 epoch: 71, train_loss: 0.7166, test_loss: 1.0443, test_f1: 0.5487
 epoch: 72, train_loss: 0.7213, test_loss: 1.0105, test_f1: 0.5712
 epoch: 73, train_loss: 0.7171, test_loss: 1.0522, test_f1: 0.5545
 epoch: 74, train_loss: 0.7295, test_loss: 1.0196, test_f1: 0.5519
 epoch: 75, train_loss: 0.7132, test_loss: 1.0126, test_f1: 0.5523
 epoch: 76, train_loss: 0.7054, test_loss: 1.0533, test_f1: 0.5628
 epoch: 77, train_loss: 0.7068, test_loss: 1.0658, test_f1: 0.5479
 epoch: 78, train_loss: 0.6916, test_loss: 1.0557, test_f1: 0.5269
 epoch: 79, train_loss: 0.6937, test_loss: 1.0620, test_f1: 0.5236
 epoch: 80, train_loss: 0.6941, test_loss: 1.0646, test_f1: 0.5485
 epoch: 81, train_loss: 0.6937, test_loss: 1.0261, test_f1: 0.5575
 epoch: 82, train_loss: 0.6751, test_loss: 1.0671, test_f1: 0.5546
 epoch: 83, train_loss: 0.7050, test_loss: 1.1195, test_f1: 0.5370
 epoch: 84, train_loss: 0.6749, test_loss: 1.1405, test_f1: 0.5428
 epoch: 85, train_loss: 0.6795, test_loss: 1.0503, test_f1: 0.5790
 epoch: 86, train_loss: 0.6791, test_loss: 1.1572, test_f1: 0.5293
 epoch: 87, train_loss: 0.6727, test_loss: 1.0845, test_f1: 0.5494
 epoch: 88, train_loss: 0.6648, test_loss: 1.0109, test_f1: 0.5554
 epoch: 89, train_loss: 0.6760, test_loss: 1.0435, test_f1: 0.5580
 epoch: 90, train_loss: 0.6800, test_loss: 1.1092, test_f1: 0.5307
 epoch: 91, train_loss: 0.6547, test_loss: 1.1657, test_f1: 0.5426
 epoch: 92, train_loss: 0.6652, test_loss: 1.1207, test_f1: 0.5354
 epoch: 93, train_loss: 0.6784, test_loss: 1.1402, test_f1: 0.5496
 epoch: 94, train_loss: 0.6731, test_loss: 1.1508, test_f1: 0.5517
 epoch: 95, train_loss: 0.6578, test_loss: 1.1130, test_f1: 0.5553
 epoch: 96, train_loss: 0.6778, test_loss: 1.0822, test_f1: 0.5623
 epoch: 97, train_loss: 0.6537, test_loss: 1.0524, test_f1: 0.5739
 epoch: 98, train_loss: 0.6652, test_loss: 1.0859, test_f1: 0.5567
 epoch: 99, train_loss: 0.6524, test_loss: 1.0884, test_f1: 0.5687
##################ITERATION #5 ****************************************
 epoch: 0, train_loss: 1.2918, test_loss: 1.1436, test_f1: 0.4747
 epoch: 1, train_loss: 1.1754, test_loss: 1.1036, test_f1: 0.4307
 epoch: 2, train_loss: 1.1620, test_loss: 1.0695, test_f1: 0.4570
 epoch: 3, train_loss: 1.1312, test_loss: 1.0502, test_f1: 0.4855
 epoch: 4, train_loss: 1.1109, test_loss: 1.0321, test_f1: 0.4845
 epoch: 5, train_loss: 1.0821, test_loss: 1.0022, test_f1: 0.4630
 epoch: 6, train_loss: 1.0709, test_loss: 1.0163, test_f1: 0.4412
 epoch: 7, train_loss: 1.0546, test_loss: 0.9803, test_f1: 0.4578
 epoch: 8, train_loss: 1.0359, test_loss: 0.9925, test_f1: 0.4536
 epoch: 9, train_loss: 1.0288, test_loss: 0.9644, test_f1: 0.4649
 epoch: 10, train_loss: 1.0197, test_loss: 0.9726, test_f1: 0.4890
 epoch: 11, train_loss: 1.0038, test_loss: 0.9619, test_f1: 0.4691
 epoch: 12, train_loss: 0.9973, test_loss: 0.9564, test_f1: 0.4666
 epoch: 13, train_loss: 0.9886, test_loss: 0.9366, test_f1: 0.4810
 epoch: 14, train_loss: 0.9772, test_loss: 0.9484, test_f1: 0.4962
 epoch: 15, train_loss: 0.9664, test_loss: 0.9631, test_f1: 0.4829
 epoch: 16, train_loss: 0.9532, test_loss: 0.9404, test_f1: 0.4928
 epoch: 17, train_loss: 0.9558, test_loss: 0.9325, test_f1: 0.5014
 epoch: 18, train_loss: 0.9466, test_loss: 0.9408, test_f1: 0.5151
 epoch: 19, train_loss: 0.9279, test_loss: 0.9237, test_f1: 0.5182
 epoch: 20, train_loss: 0.9287, test_loss: 0.9378, test_f1: 0.5094
 epoch: 21, train_loss: 0.9164, test_loss: 0.9256, test_f1: 0.5070
 epoch: 22, train_loss: 0.9131, test_loss: 0.9424, test_f1: 0.5164
 epoch: 23, train_loss: 0.9108, test_loss: 0.9174, test_f1: 0.5220
 epoch: 24, train_loss: 0.9036, test_loss: 0.9601, test_f1: 0.5001
 epoch: 25, train_loss: 0.8978, test_loss: 0.9276, test_f1: 0.5270
 epoch: 26, train_loss: 0.8924, test_loss: 0.9304, test_f1: 0.5136
 epoch: 27, train_loss: 0.8902, test_loss: 0.9361, test_f1: 0.5245
 epoch: 28, train_loss: 0.8822, test_loss: 0.9359, test_f1: 0.5317
 epoch: 29, train_loss: 0.8812, test_loss: 0.9592, test_f1: 0.5235
 epoch: 30, train_loss: 0.8762, test_loss: 0.9724, test_f1: 0.5347
 epoch: 31, train_loss: 0.8694, test_loss: 0.9539, test_f1: 0.5311
 epoch: 32, train_loss: 0.8592, test_loss: 0.9588, test_f1: 0.5375
 epoch: 33, train_loss: 0.8650, test_loss: 0.9960, test_f1: 0.5189
 epoch: 34, train_loss: 0.8492, test_loss: 0.9910, test_f1: 0.5049
 epoch: 35, train_loss: 0.8493, test_loss: 0.9738, test_f1: 0.5309
 epoch: 36, train_loss: 0.8397, test_loss: 1.0680, test_f1: 0.4963
 epoch: 37, train_loss: 0.8405, test_loss: 0.9787, test_f1: 0.5119
 epoch: 38, train_loss: 0.8246, test_loss: 1.0016, test_f1: 0.5070
 epoch: 39, train_loss: 0.8270, test_loss: 1.0103, test_f1: 0.5108
 epoch: 40, train_loss: 0.8094, test_loss: 1.0015, test_f1: 0.5291
 epoch: 41, train_loss: 0.8236, test_loss: 1.0370, test_f1: 0.5344
 epoch: 42, train_loss: 0.8203, test_loss: 1.0086, test_f1: 0.5409
 epoch: 43, train_loss: 0.8122, test_loss: 1.0088, test_f1: 0.5410
 epoch: 44, train_loss: 0.8081, test_loss: 1.0376, test_f1: 0.5253
 epoch: 45, train_loss: 0.7992, test_loss: 1.0232, test_f1: 0.5407
 epoch: 46, train_loss: 0.7784, test_loss: 1.0431, test_f1: 0.5346
 epoch: 47, train_loss: 0.7835, test_loss: 1.0415, test_f1: 0.5333
 epoch: 48, train_loss: 0.7779, test_loss: 1.0549, test_f1: 0.5422
 epoch: 49, train_loss: 0.7848, test_loss: 1.0546, test_f1: 0.5221
 epoch: 50, train_loss: 0.7781, test_loss: 1.0182, test_f1: 0.5312
 epoch: 51, train_loss: 0.7491, test_loss: 1.0721, test_f1: 0.5383
 epoch: 52, train_loss: 0.7512, test_loss: 1.0806, test_f1: 0.5358
 epoch: 53, train_loss: 0.7455, test_loss: 1.0900, test_f1: 0.4984
 epoch: 54, train_loss: 0.7478, test_loss: 1.1055, test_f1: 0.5429
 epoch: 55, train_loss: 0.7514, test_loss: 1.0876, test_f1: 0.5224
 epoch: 56, train_loss: 0.7470, test_loss: 1.0846, test_f1: 0.5298
 epoch: 57, train_loss: 0.7434, test_loss: 1.1019, test_f1: 0.5150
 epoch: 58, train_loss: 0.7474, test_loss: 1.0849, test_f1: 0.5103
 epoch: 59, train_loss: 0.7303, test_loss: 1.0785, test_f1: 0.5226
 epoch: 60, train_loss: 0.7446, test_loss: 1.1023, test_f1: 0.5098
 epoch: 61, train_loss: 0.7330, test_loss: 1.1138, test_f1: 0.5121
 epoch: 62, train_loss: 0.7354, test_loss: 1.1396, test_f1: 0.4936
 epoch: 63, train_loss: 0.7117, test_loss: 1.0973, test_f1: 0.5106
 epoch: 64, train_loss: 0.7173, test_loss: 1.1510, test_f1: 0.5030
 epoch: 65, train_loss: 0.7190, test_loss: 1.0799, test_f1: 0.5203
 epoch: 66, train_loss: 0.7209, test_loss: 1.1447, test_f1: 0.5244
 epoch: 67, train_loss: 0.7202, test_loss: 1.0969, test_f1: 0.5179
 epoch: 68, train_loss: 0.7199, test_loss: 1.0914, test_f1: 0.5412
 epoch: 69, train_loss: 0.7110, test_loss: 1.1408, test_f1: 0.5228
 epoch: 70, train_loss: 0.7042, test_loss: 1.1544, test_f1: 0.5167
 epoch: 71, train_loss: 0.7001, test_loss: 1.1594, test_f1: 0.5010
 epoch: 72, train_loss: 0.7056, test_loss: 1.1173, test_f1: 0.5366
 epoch: 73, train_loss: 0.6993, test_loss: 1.1416, test_f1: 0.5243
 epoch: 74, train_loss: 0.6955, test_loss: 1.1277, test_f1: 0.5342
 epoch: 75, train_loss: 0.6987, test_loss: 1.1334, test_f1: 0.5229
 epoch: 76, train_loss: 0.7000, test_loss: 1.1337, test_f1: 0.5359
 epoch: 77, train_loss: 0.6998, test_loss: 1.1791, test_f1: 0.5113
 epoch: 78, train_loss: 0.6843, test_loss: 1.1478, test_f1: 0.5137
 epoch: 79, train_loss: 0.6995, test_loss: 1.1946, test_f1: 0.5127
 epoch: 80, train_loss: 0.6875, test_loss: 1.1587, test_f1: 0.5312
 epoch: 81, train_loss: 0.6815, test_loss: 1.1790, test_f1: 0.5371
 epoch: 82, train_loss: 0.6926, test_loss: 1.1564, test_f1: 0.5136
 epoch: 83, train_loss: 0.6737, test_loss: 1.1630, test_f1: 0.5161
 epoch: 84, train_loss: 0.6746, test_loss: 1.1773, test_f1: 0.5252
 epoch: 85, train_loss: 0.6833, test_loss: 1.1378, test_f1: 0.5153
 epoch: 86, train_loss: 0.6764, test_loss: 1.1725, test_f1: 0.5122
 epoch: 87, train_loss: 0.6725, test_loss: 1.1817, test_f1: 0.5120
 epoch: 88, train_loss: 0.6797, test_loss: 1.2420, test_f1: 0.5078
 epoch: 89, train_loss: 0.6598, test_loss: 1.1885, test_f1: 0.5210
 epoch: 90, train_loss: 0.6666, test_loss: 1.1800, test_f1: 0.5174
 epoch: 91, train_loss: 0.6614, test_loss: 1.2152, test_f1: 0.5016
 epoch: 92, train_loss: 0.6487, test_loss: 1.1871, test_f1: 0.5173
 epoch: 93, train_loss: 0.6533, test_loss: 1.1831, test_f1: 0.5340
 epoch: 94, train_loss: 0.6647, test_loss: 1.2333, test_f1: 0.5172
 epoch: 95, train_loss: 0.6587, test_loss: 1.2895, test_f1: 0.5130
 epoch: 96, train_loss: 0.6568, test_loss: 1.2808, test_f1: 0.4983
 epoch: 97, train_loss: 0.6440, test_loss: 1.2230, test_f1: 0.5201
 epoch: 98, train_loss: 0.6453, test_loss: 1.2031, test_f1: 0.5260
 epoch: 99, train_loss: 0.6437, test_loss: 1.2225, test_f1: 0.5197
##################ITERATION #6 ****************************************
 epoch: 0, train_loss: 1.3179, test_loss: 1.1255, test_f1: 0.4689
 epoch: 1, train_loss: 1.2065, test_loss: 1.1083, test_f1: 0.4659
 epoch: 2, train_loss: 1.1760, test_loss: 1.0846, test_f1: 0.4758
 epoch: 3, train_loss: 1.1536, test_loss: 1.0829, test_f1: 0.4965
 epoch: 4, train_loss: 1.1220, test_loss: 1.0661, test_f1: 0.4826
 epoch: 5, train_loss: 1.1033, test_loss: 1.0610, test_f1: 0.4594
 epoch: 6, train_loss: 1.0967, test_loss: 1.0432, test_f1: 0.4702
 epoch: 7, train_loss: 1.0791, test_loss: 1.0357, test_f1: 0.4640
 epoch: 8, train_loss: 1.0695, test_loss: 1.0032, test_f1: 0.4907
 epoch: 9, train_loss: 1.0559, test_loss: 0.9825, test_f1: 0.4970
 epoch: 10, train_loss: 1.0442, test_loss: 0.9992, test_f1: 0.4941
 epoch: 11, train_loss: 1.0117, test_loss: 0.9670, test_f1: 0.5099
 epoch: 12, train_loss: 1.0157, test_loss: 0.9689, test_f1: 0.5030
 epoch: 13, train_loss: 1.0082, test_loss: 0.9562, test_f1: 0.5027
 epoch: 14, train_loss: 0.9985, test_loss: 0.9572, test_f1: 0.5040
 epoch: 15, train_loss: 0.9890, test_loss: 0.9472, test_f1: 0.4960
 epoch: 16, train_loss: 0.9784, test_loss: 0.9365, test_f1: 0.5169
 epoch: 17, train_loss: 0.9681, test_loss: 0.9544, test_f1: 0.4964
 epoch: 18, train_loss: 0.9690, test_loss: 0.9340, test_f1: 0.5200
 epoch: 19, train_loss: 0.9592, test_loss: 0.9348, test_f1: 0.5226
 epoch: 20, train_loss: 0.9474, test_loss: 0.9348, test_f1: 0.5006
 epoch: 21, train_loss: 0.9431, test_loss: 0.9227, test_f1: 0.5251
 epoch: 22, train_loss: 0.9445, test_loss: 0.9229, test_f1: 0.5240
 epoch: 23, train_loss: 0.9167, test_loss: 0.9317, test_f1: 0.5121
 epoch: 24, train_loss: 0.9139, test_loss: 0.9408, test_f1: 0.4966
 epoch: 25, train_loss: 0.9188, test_loss: 0.9300, test_f1: 0.5093
 epoch: 26, train_loss: 0.9160, test_loss: 0.9359, test_f1: 0.5061
 epoch: 27, train_loss: 0.8932, test_loss: 0.9301, test_f1: 0.5249
 epoch: 28, train_loss: 0.8853, test_loss: 0.9237, test_f1: 0.5107
 epoch: 29, train_loss: 0.8833, test_loss: 0.9446, test_f1: 0.5289
 epoch: 30, train_loss: 0.8857, test_loss: 0.9323, test_f1: 0.5202
 epoch: 31, train_loss: 0.8931, test_loss: 0.9351, test_f1: 0.5267
 epoch: 32, train_loss: 0.8716, test_loss: 0.9311, test_f1: 0.5243
 epoch: 33, train_loss: 0.8675, test_loss: 0.9350, test_f1: 0.5277
 epoch: 34, train_loss: 0.8502, test_loss: 0.9400, test_f1: 0.5177
 epoch: 35, train_loss: 0.8477, test_loss: 0.9387, test_f1: 0.5298
 epoch: 36, train_loss: 0.8421, test_loss: 0.9303, test_f1: 0.5228
 epoch: 37, train_loss: 0.8448, test_loss: 0.9737, test_f1: 0.5332
 epoch: 38, train_loss: 0.8408, test_loss: 0.9858, test_f1: 0.5118
 epoch: 39, train_loss: 0.8411, test_loss: 0.9661, test_f1: 0.5284
 epoch: 40, train_loss: 0.8179, test_loss: 0.9882, test_f1: 0.5205
 epoch: 41, train_loss: 0.8170, test_loss: 0.9699, test_f1: 0.5232
 epoch: 42, train_loss: 0.8131, test_loss: 0.9529, test_f1: 0.5394
 epoch: 43, train_loss: 0.8158, test_loss: 0.9941, test_f1: 0.5440
 epoch: 44, train_loss: 0.7967, test_loss: 0.9640, test_f1: 0.5389
 epoch: 45, train_loss: 0.8021, test_loss: 0.9710, test_f1: 0.5473
 epoch: 46, train_loss: 0.8001, test_loss: 0.9667, test_f1: 0.5497
 epoch: 47, train_loss: 0.7883, test_loss: 0.9721, test_f1: 0.5234
 epoch: 48, train_loss: 0.7783, test_loss: 1.0005, test_f1: 0.5451
 epoch: 49, train_loss: 0.7816, test_loss: 0.9937, test_f1: 0.5153
 epoch: 50, train_loss: 0.7827, test_loss: 0.9954, test_f1: 0.5308
 epoch: 51, train_loss: 0.7684, test_loss: 0.9842, test_f1: 0.5481
 epoch: 52, train_loss: 0.7512, test_loss: 0.9810, test_f1: 0.5438
 epoch: 53, train_loss: 0.7632, test_loss: 0.9966, test_f1: 0.5298
 epoch: 54, train_loss: 0.7645, test_loss: 0.9960, test_f1: 0.5371
 epoch: 55, train_loss: 0.7482, test_loss: 1.0001, test_f1: 0.5355
 epoch: 56, train_loss: 0.7520, test_loss: 1.0332, test_f1: 0.5294
 epoch: 57, train_loss: 0.7482, test_loss: 0.9975, test_f1: 0.5346
 epoch: 58, train_loss: 0.7459, test_loss: 1.0162, test_f1: 0.5596
 epoch: 59, train_loss: 0.7407, test_loss: 0.9810, test_f1: 0.5591
 epoch: 60, train_loss: 0.7428, test_loss: 0.9851, test_f1: 0.5578
 epoch: 61, train_loss: 0.7389, test_loss: 1.0267, test_f1: 0.5378
 epoch: 62, train_loss: 0.7305, test_loss: 1.0166, test_f1: 0.5236
 epoch: 63, train_loss: 0.7298, test_loss: 1.0291, test_f1: 0.5328
 epoch: 64, train_loss: 0.7217, test_loss: 1.0299, test_f1: 0.5188
 epoch: 65, train_loss: 0.7272, test_loss: 1.0045, test_f1: 0.5389
 epoch: 66, train_loss: 0.7310, test_loss: 0.9844, test_f1: 0.5553
 epoch: 67, train_loss: 0.7253, test_loss: 1.0151, test_f1: 0.5387
 epoch: 68, train_loss: 0.7299, test_loss: 0.9947, test_f1: 0.5599
 epoch: 69, train_loss: 0.7208, test_loss: 1.0640, test_f1: 0.5325
 epoch: 70, train_loss: 0.7265, test_loss: 1.0311, test_f1: 0.5391
 epoch: 71, train_loss: 0.7103, test_loss: 1.0043, test_f1: 0.5314
 epoch: 72, train_loss: 0.6926, test_loss: 1.0259, test_f1: 0.5511
 epoch: 73, train_loss: 0.6964, test_loss: 1.0280, test_f1: 0.5322
 epoch: 74, train_loss: 0.7161, test_loss: 1.0353, test_f1: 0.5370
 epoch: 75, train_loss: 0.7064, test_loss: 1.0137, test_f1: 0.5412
 epoch: 76, train_loss: 0.7073, test_loss: 1.0651, test_f1: 0.5359
 epoch: 77, train_loss: 0.7005, test_loss: 1.0171, test_f1: 0.5371
 epoch: 78, train_loss: 0.6881, test_loss: 1.0618, test_f1: 0.5422
 epoch: 79, train_loss: 0.6996, test_loss: 1.0455, test_f1: 0.5479
 epoch: 80, train_loss: 0.7033, test_loss: 1.0233, test_f1: 0.5404
 epoch: 81, train_loss: 0.6836, test_loss: 1.0318, test_f1: 0.5650
 epoch: 82, train_loss: 0.6889, test_loss: 1.0731, test_f1: 0.5373
 epoch: 83, train_loss: 0.6747, test_loss: 1.0537, test_f1: 0.5335
 epoch: 84, train_loss: 0.6718, test_loss: 1.1007, test_f1: 0.5434
 epoch: 85, train_loss: 0.6914, test_loss: 1.0961, test_f1: 0.5382
 epoch: 86, train_loss: 0.6828, test_loss: 1.0617, test_f1: 0.5431
 epoch: 87, train_loss: 0.6747, test_loss: 1.0465, test_f1: 0.5615
 epoch: 88, train_loss: 0.6670, test_loss: 1.0608, test_f1: 0.5702
 epoch: 89, train_loss: 0.6889, test_loss: 1.0816, test_f1: 0.5438
 epoch: 90, train_loss: 0.6851, test_loss: 1.1181, test_f1: 0.5524
 epoch: 91, train_loss: 0.6944, test_loss: 1.0854, test_f1: 0.5624
 epoch: 92, train_loss: 0.6638, test_loss: 1.0990, test_f1: 0.5433
 epoch: 93, train_loss: 0.6764, test_loss: 1.1385, test_f1: 0.5317
 epoch: 94, train_loss: 0.6550, test_loss: 1.0764, test_f1: 0.5636
 epoch: 95, train_loss: 0.6697, test_loss: 1.1070, test_f1: 0.5453
 epoch: 96, train_loss: 0.6482, test_loss: 1.1123, test_f1: 0.5438
 epoch: 97, train_loss: 0.6613, test_loss: 1.1080, test_f1: 0.5489
 epoch: 98, train_loss: 0.6532, test_loss: 1.1256, test_f1: 0.5619
 epoch: 99, train_loss: 0.6610, test_loss: 1.1471, test_f1: 0.5426
##################ITERATION #7 ****************************************
 epoch: 0, train_loss: 1.3329, test_loss: 1.1679, test_f1: 0.4065
 epoch: 1, train_loss: 1.2135, test_loss: 1.1126, test_f1: 0.4528
 epoch: 2, train_loss: 1.1673, test_loss: 1.0947, test_f1: 0.4687
 epoch: 3, train_loss: 1.1399, test_loss: 1.0706, test_f1: 0.4625
 epoch: 4, train_loss: 1.1220, test_loss: 1.0322, test_f1: 0.4701
 epoch: 5, train_loss: 1.1030, test_loss: 1.0328, test_f1: 0.4883
 epoch: 6, train_loss: 1.0789, test_loss: 0.9952, test_f1: 0.5096
 epoch: 7, train_loss: 1.0602, test_loss: 0.9912, test_f1: 0.4919
 epoch: 8, train_loss: 1.0464, test_loss: 0.9898, test_f1: 0.4922
 epoch: 9, train_loss: 1.0462, test_loss: 0.9697, test_f1: 0.4946
 epoch: 10, train_loss: 1.0270, test_loss: 0.9598, test_f1: 0.5138
 epoch: 11, train_loss: 1.0159, test_loss: 0.9512, test_f1: 0.5037
 epoch: 12, train_loss: 1.0135, test_loss: 0.9457, test_f1: 0.4896
 epoch: 13, train_loss: 0.9849, test_loss: 0.9398, test_f1: 0.5089
 epoch: 14, train_loss: 0.9878, test_loss: 0.9387, test_f1: 0.5143
 epoch: 15, train_loss: 0.9772, test_loss: 0.9428, test_f1: 0.5165
 epoch: 16, train_loss: 0.9701, test_loss: 0.9343, test_f1: 0.5112
 epoch: 17, train_loss: 0.9566, test_loss: 0.9195, test_f1: 0.5261
 epoch: 18, train_loss: 0.9482, test_loss: 0.9391, test_f1: 0.5228
 epoch: 19, train_loss: 0.9486, test_loss: 0.9122, test_f1: 0.5350
 epoch: 20, train_loss: 0.9346, test_loss: 0.9123, test_f1: 0.5399
 epoch: 21, train_loss: 0.9331, test_loss: 0.9166, test_f1: 0.5165
 epoch: 22, train_loss: 0.9275, test_loss: 0.9108, test_f1: 0.5335
 epoch: 23, train_loss: 0.9234, test_loss: 0.9328, test_f1: 0.5174
 epoch: 24, train_loss: 0.9140, test_loss: 0.9275, test_f1: 0.5137
 epoch: 25, train_loss: 0.9035, test_loss: 0.9473, test_f1: 0.5131
 epoch: 26, train_loss: 0.9093, test_loss: 0.9041, test_f1: 0.5347
 epoch: 27, train_loss: 0.8850, test_loss: 0.9205, test_f1: 0.5313
 epoch: 28, train_loss: 0.8825, test_loss: 0.9249, test_f1: 0.5299
 epoch: 29, train_loss: 0.8858, test_loss: 0.9393, test_f1: 0.5284
 epoch: 30, train_loss: 0.8793, test_loss: 0.9283, test_f1: 0.5382
 epoch: 31, train_loss: 0.8810, test_loss: 0.9153, test_f1: 0.5281
 epoch: 32, train_loss: 0.8745, test_loss: 0.9192, test_f1: 0.5214
 epoch: 33, train_loss: 0.8620, test_loss: 0.9309, test_f1: 0.5270
 epoch: 34, train_loss: 0.8533, test_loss: 0.9224, test_f1: 0.5240
 epoch: 35, train_loss: 0.8551, test_loss: 0.9203, test_f1: 0.5301
 epoch: 36, train_loss: 0.8505, test_loss: 0.9002, test_f1: 0.5414
 epoch: 37, train_loss: 0.8367, test_loss: 0.9178, test_f1: 0.5321
 epoch: 38, train_loss: 0.8544, test_loss: 0.9410, test_f1: 0.5218
 epoch: 39, train_loss: 0.8247, test_loss: 0.9374, test_f1: 0.5355
 epoch: 40, train_loss: 0.8239, test_loss: 0.9403, test_f1: 0.5336
 epoch: 41, train_loss: 0.8285, test_loss: 0.9484, test_f1: 0.5258
 epoch: 42, train_loss: 0.8130, test_loss: 0.9288, test_f1: 0.5489
 epoch: 43, train_loss: 0.8219, test_loss: 0.9390, test_f1: 0.5372
 epoch: 44, train_loss: 0.8081, test_loss: 0.9322, test_f1: 0.5324
 epoch: 45, train_loss: 0.8012, test_loss: 0.9188, test_f1: 0.5545
 epoch: 46, train_loss: 0.8003, test_loss: 0.9699, test_f1: 0.5298
 epoch: 47, train_loss: 0.8031, test_loss: 0.9583, test_f1: 0.5454
 epoch: 48, train_loss: 0.7972, test_loss: 0.9336, test_f1: 0.5361
 epoch: 49, train_loss: 0.7796, test_loss: 0.9619, test_f1: 0.5238
 epoch: 50, train_loss: 0.7854, test_loss: 0.9064, test_f1: 0.5574
 epoch: 51, train_loss: 0.7848, test_loss: 0.9484, test_f1: 0.5531
 epoch: 52, train_loss: 0.7661, test_loss: 0.9497, test_f1: 0.5376
 epoch: 53, train_loss: 0.7837, test_loss: 0.9260, test_f1: 0.5552
 epoch: 54, train_loss: 0.7565, test_loss: 0.9388, test_f1: 0.5398
 epoch: 55, train_loss: 0.7563, test_loss: 0.9635, test_f1: 0.5444
 epoch: 56, train_loss: 0.7477, test_loss: 0.9648, test_f1: 0.5369
 epoch: 57, train_loss: 0.7619, test_loss: 0.9703, test_f1: 0.5297
 epoch: 58, train_loss: 0.7569, test_loss: 0.9964, test_f1: 0.5359
 epoch: 59, train_loss: 0.7402, test_loss: 0.9538, test_f1: 0.5442
 epoch: 60, train_loss: 0.7475, test_loss: 0.9586, test_f1: 0.5477
 epoch: 61, train_loss: 0.7398, test_loss: 0.9716, test_f1: 0.5369
 epoch: 62, train_loss: 0.7534, test_loss: 0.9206, test_f1: 0.5460
 epoch: 63, train_loss: 0.7385, test_loss: 0.9534, test_f1: 0.5371
 epoch: 64, train_loss: 0.7497, test_loss: 0.9386, test_f1: 0.5458
 epoch: 65, train_loss: 0.7414, test_loss: 0.9463, test_f1: 0.5522
 epoch: 66, train_loss: 0.7280, test_loss: 0.9833, test_f1: 0.5460
 epoch: 67, train_loss: 0.7341, test_loss: 0.9961, test_f1: 0.5483
 epoch: 68, train_loss: 0.7390, test_loss: 0.9365, test_f1: 0.5476
 epoch: 69, train_loss: 0.7135, test_loss: 0.9994, test_f1: 0.5260
 epoch: 70, train_loss: 0.7257, test_loss: 0.9647, test_f1: 0.5475
 epoch: 71, train_loss: 0.7247, test_loss: 0.9510, test_f1: 0.5441
 epoch: 72, train_loss: 0.7296, test_loss: 0.9655, test_f1: 0.5473
 epoch: 73, train_loss: 0.7144, test_loss: 0.9619, test_f1: 0.5317
 epoch: 74, train_loss: 0.7166, test_loss: 0.9752, test_f1: 0.5351
 epoch: 75, train_loss: 0.7087, test_loss: 1.0210, test_f1: 0.5527
 epoch: 76, train_loss: 0.7116, test_loss: 0.9753, test_f1: 0.5494
 epoch: 77, train_loss: 0.7107, test_loss: 0.9687, test_f1: 0.5471
 epoch: 78, train_loss: 0.7038, test_loss: 0.9996, test_f1: 0.5490
 epoch: 79, train_loss: 0.7228, test_loss: 0.9731, test_f1: 0.5377
 epoch: 80, train_loss: 0.7047, test_loss: 1.0069, test_f1: 0.5377
 epoch: 81, train_loss: 0.6929, test_loss: 1.0260, test_f1: 0.5572
 epoch: 82, train_loss: 0.6963, test_loss: 0.9805, test_f1: 0.5581
 epoch: 83, train_loss: 0.7005, test_loss: 0.9862, test_f1: 0.5573
 epoch: 84, train_loss: 0.6904, test_loss: 0.9925, test_f1: 0.5497
 epoch: 85, train_loss: 0.6909, test_loss: 0.9917, test_f1: 0.5454
 epoch: 86, train_loss: 0.6941, test_loss: 0.9612, test_f1: 0.5683
 epoch: 87, train_loss: 0.7054, test_loss: 1.0249, test_f1: 0.5423
 epoch: 88, train_loss: 0.6950, test_loss: 0.9921, test_f1: 0.5442
 epoch: 89, train_loss: 0.6856, test_loss: 1.0286, test_f1: 0.5387
 epoch: 90, train_loss: 0.7007, test_loss: 1.0112, test_f1: 0.5392
 epoch: 91, train_loss: 0.6821, test_loss: 1.0329, test_f1: 0.5394
 epoch: 92, train_loss: 0.6810, test_loss: 1.0335, test_f1: 0.5593
 epoch: 93, train_loss: 0.6826, test_loss: 1.0248, test_f1: 0.5560
 epoch: 94, train_loss: 0.6833, test_loss: 1.0254, test_f1: 0.5527
 epoch: 95, train_loss: 0.6847, test_loss: 1.0366, test_f1: 0.5735
 epoch: 96, train_loss: 0.6727, test_loss: 0.9996, test_f1: 0.5500
 epoch: 97, train_loss: 0.6797, test_loss: 1.0175, test_f1: 0.5506
 epoch: 98, train_loss: 0.6651, test_loss: 1.0209, test_f1: 0.5516
 epoch: 99, train_loss: 0.6700, test_loss: 1.0416, test_f1: 0.5569
##################ITERATION #8 ****************************************
 epoch: 0, train_loss: 1.3310, test_loss: 1.1430, test_f1: 0.4377
 epoch: 1, train_loss: 1.2020, test_loss: 1.0943, test_f1: 0.4572
 epoch: 2, train_loss: 1.1823, test_loss: 1.0842, test_f1: 0.4870
 epoch: 3, train_loss: 1.1446, test_loss: 1.0769, test_f1: 0.4868
 epoch: 4, train_loss: 1.1351, test_loss: 1.0529, test_f1: 0.4349
 epoch: 5, train_loss: 1.0952, test_loss: 1.0485, test_f1: 0.4777
 epoch: 6, train_loss: 1.0791, test_loss: 1.0418, test_f1: 0.4792
 epoch: 7, train_loss: 1.0586, test_loss: 1.0010, test_f1: 0.4851
 epoch: 8, train_loss: 1.0491, test_loss: 1.0040, test_f1: 0.4528
 epoch: 9, train_loss: 1.0384, test_loss: 0.9957, test_f1: 0.5046
 epoch: 10, train_loss: 1.0326, test_loss: 0.9848, test_f1: 0.5137
 epoch: 11, train_loss: 1.0130, test_loss: 0.9928, test_f1: 0.5120
 epoch: 12, train_loss: 1.0004, test_loss: 0.9879, test_f1: 0.4952
 epoch: 13, train_loss: 0.9922, test_loss: 0.9849, test_f1: 0.4889
 epoch: 14, train_loss: 0.9907, test_loss: 0.9661, test_f1: 0.4842
 epoch: 15, train_loss: 0.9760, test_loss: 0.9581, test_f1: 0.5066
 epoch: 16, train_loss: 0.9583, test_loss: 0.9700, test_f1: 0.5093
 epoch: 17, train_loss: 0.9611, test_loss: 0.9802, test_f1: 0.5104
 epoch: 18, train_loss: 0.9404, test_loss: 0.9854, test_f1: 0.5110
 epoch: 19, train_loss: 0.9420, test_loss: 0.9476, test_f1: 0.5112
 epoch: 20, train_loss: 0.9266, test_loss: 0.9642, test_f1: 0.5164
 epoch: 21, train_loss: 0.9225, test_loss: 0.9654, test_f1: 0.5178
 epoch: 22, train_loss: 0.9249, test_loss: 0.9659, test_f1: 0.5237
 epoch: 23, train_loss: 0.9153, test_loss: 0.9651, test_f1: 0.5377
 epoch: 24, train_loss: 0.9019, test_loss: 0.9574, test_f1: 0.5302
 epoch: 25, train_loss: 0.9063, test_loss: 0.9695, test_f1: 0.5289
 epoch: 26, train_loss: 0.8947, test_loss: 0.9596, test_f1: 0.5556
 epoch: 27, train_loss: 0.8848, test_loss: 0.9788, test_f1: 0.5418
 epoch: 28, train_loss: 0.8762, test_loss: 0.9615, test_f1: 0.5284
 epoch: 29, train_loss: 0.8766, test_loss: 0.9772, test_f1: 0.5227
 epoch: 30, train_loss: 0.8622, test_loss: 0.9731, test_f1: 0.5394
 epoch: 31, train_loss: 0.8646, test_loss: 0.9763, test_f1: 0.5275
 epoch: 32, train_loss: 0.8615, test_loss: 0.9695, test_f1: 0.5368
 epoch: 33, train_loss: 0.8468, test_loss: 0.9654, test_f1: 0.5363
 epoch: 34, train_loss: 0.8534, test_loss: 0.9629, test_f1: 0.5520
 epoch: 35, train_loss: 0.8336, test_loss: 0.9707, test_f1: 0.5307
 epoch: 36, train_loss: 0.8370, test_loss: 0.9902, test_f1: 0.5264
 epoch: 37, train_loss: 0.8338, test_loss: 0.9730, test_f1: 0.5395
 epoch: 38, train_loss: 0.8312, test_loss: 0.9837, test_f1: 0.5311
 epoch: 39, train_loss: 0.8179, test_loss: 0.9833, test_f1: 0.5332
 epoch: 40, train_loss: 0.8182, test_loss: 0.9607, test_f1: 0.5537
 epoch: 41, train_loss: 0.8164, test_loss: 1.0297, test_f1: 0.5241
 epoch: 42, train_loss: 0.8101, test_loss: 1.0109, test_f1: 0.5397
 epoch: 43, train_loss: 0.8063, test_loss: 1.0020, test_f1: 0.5451
 epoch: 44, train_loss: 0.8113, test_loss: 1.0130, test_f1: 0.5420
 epoch: 45, train_loss: 0.7983, test_loss: 1.0245, test_f1: 0.5316
 epoch: 46, train_loss: 0.7899, test_loss: 1.0215, test_f1: 0.5446
 epoch: 47, train_loss: 0.7911, test_loss: 0.9982, test_f1: 0.5456
 epoch: 48, train_loss: 0.7806, test_loss: 1.0132, test_f1: 0.5435
 epoch: 49, train_loss: 0.7791, test_loss: 0.9976, test_f1: 0.5457
 epoch: 50, train_loss: 0.7740, test_loss: 0.9907, test_f1: 0.5331
 epoch: 51, train_loss: 0.7589, test_loss: 0.9925, test_f1: 0.5403
 epoch: 52, train_loss: 0.7546, test_loss: 1.0176, test_f1: 0.5377
 epoch: 53, train_loss: 0.7530, test_loss: 1.0340, test_f1: 0.5352
 epoch: 54, train_loss: 0.7355, test_loss: 1.0309, test_f1: 0.5370
 epoch: 55, train_loss: 0.7517, test_loss: 1.0524, test_f1: 0.5434
 epoch: 56, train_loss: 0.7480, test_loss: 1.0190, test_f1: 0.5355
 epoch: 57, train_loss: 0.7497, test_loss: 1.0246, test_f1: 0.5406
 epoch: 58, train_loss: 0.7445, test_loss: 1.0638, test_f1: 0.5372
 epoch: 59, train_loss: 0.7277, test_loss: 1.0136, test_f1: 0.5424
 epoch: 60, train_loss: 0.7455, test_loss: 1.0518, test_f1: 0.5313
 epoch: 61, train_loss: 0.7194, test_loss: 1.0671, test_f1: 0.5415
 epoch: 62, train_loss: 0.7219, test_loss: 1.0581, test_f1: 0.5363
 epoch: 63, train_loss: 0.7378, test_loss: 1.0819, test_f1: 0.5360
 epoch: 64, train_loss: 0.7158, test_loss: 1.0452, test_f1: 0.5431
 epoch: 65, train_loss: 0.7011, test_loss: 1.0366, test_f1: 0.5487
 epoch: 66, train_loss: 0.7106, test_loss: 1.0548, test_f1: 0.5534
 epoch: 67, train_loss: 0.7077, test_loss: 1.0718, test_f1: 0.5483
 epoch: 68, train_loss: 0.7146, test_loss: 1.0961, test_f1: 0.5238
 epoch: 69, train_loss: 0.7097, test_loss: 1.0937, test_f1: 0.5348
 epoch: 70, train_loss: 0.6994, test_loss: 1.0916, test_f1: 0.5293
 epoch: 71, train_loss: 0.7017, test_loss: 1.1040, test_f1: 0.5315
 epoch: 72, train_loss: 0.6994, test_loss: 1.1171, test_f1: 0.5237
 epoch: 73, train_loss: 0.7132, test_loss: 1.1446, test_f1: 0.5256
 epoch: 74, train_loss: 0.6903, test_loss: 1.0943, test_f1: 0.5443
 epoch: 75, train_loss: 0.6939, test_loss: 1.1128, test_f1: 0.5421
 epoch: 76, train_loss: 0.6821, test_loss: 1.1240, test_f1: 0.5333
 epoch: 77, train_loss: 0.7006, test_loss: 1.1275, test_f1: 0.5508
 epoch: 78, train_loss: 0.6899, test_loss: 1.0983, test_f1: 0.5326
 epoch: 79, train_loss: 0.6984, test_loss: 1.1159, test_f1: 0.5424
 epoch: 80, train_loss: 0.6862, test_loss: 1.1528, test_f1: 0.5260
 epoch: 81, train_loss: 0.6798, test_loss: 1.1113, test_f1: 0.5490
 epoch: 82, train_loss: 0.6800, test_loss: 1.1107, test_f1: 0.5375
 epoch: 83, train_loss: 0.6751, test_loss: 1.1445, test_f1: 0.5328
 epoch: 84, train_loss: 0.6692, test_loss: 1.1160, test_f1: 0.5349
 epoch: 85, train_loss: 0.6779, test_loss: 1.1974, test_f1: 0.5253
 epoch: 86, train_loss: 0.6859, test_loss: 1.1306, test_f1: 0.5490
 epoch: 87, train_loss: 0.6743, test_loss: 1.1381, test_f1: 0.5267
 epoch: 88, train_loss: 0.6728, test_loss: 1.1462, test_f1: 0.5393
 epoch: 89, train_loss: 0.6874, test_loss: 1.1533, test_f1: 0.5414
 epoch: 90, train_loss: 0.6632, test_loss: 1.1767, test_f1: 0.5125
 epoch: 91, train_loss: 0.6599, test_loss: 1.1525, test_f1: 0.5419
 epoch: 92, train_loss: 0.6589, test_loss: 1.1639, test_f1: 0.5341
 epoch: 93, train_loss: 0.6469, test_loss: 1.1682, test_f1: 0.5311
 epoch: 94, train_loss: 0.6648, test_loss: 1.1996, test_f1: 0.5201
 epoch: 95, train_loss: 0.6549, test_loss: 1.2089, test_f1: 0.5301
 epoch: 96, train_loss: 0.6675, test_loss: 1.2021, test_f1: 0.5278
 epoch: 97, train_loss: 0.6608, test_loss: 1.2404, test_f1: 0.5293
 epoch: 98, train_loss: 0.6525, test_loss: 1.2036, test_f1: 0.5502
 epoch: 99, train_loss: 0.6551, test_loss: 1.1789, test_f1: 0.5374
##################ITERATION #9 ****************************************
 epoch: 0, train_loss: 1.3233, test_loss: 1.1568, test_f1: 0.4367
 epoch: 1, train_loss: 1.2057, test_loss: 1.0635, test_f1: 0.4589
 epoch: 2, train_loss: 1.1690, test_loss: 1.0384, test_f1: 0.4790
 epoch: 3, train_loss: 1.1409, test_loss: 1.0350, test_f1: 0.4710
 epoch: 4, train_loss: 1.1156, test_loss: 1.0059, test_f1: 0.4701
 epoch: 5, train_loss: 1.0875, test_loss: 0.9965, test_f1: 0.4887
 epoch: 6, train_loss: 1.0774, test_loss: 0.9887, test_f1: 0.4671
 epoch: 7, train_loss: 1.0566, test_loss: 0.9952, test_f1: 0.4859
 epoch: 8, train_loss: 1.0464, test_loss: 0.9773, test_f1: 0.4855
 epoch: 9, train_loss: 1.0306, test_loss: 0.9777, test_f1: 0.4721
 epoch: 10, train_loss: 1.0147, test_loss: 0.9635, test_f1: 0.4828
 epoch: 11, train_loss: 1.0142, test_loss: 0.9606, test_f1: 0.4884
 epoch: 12, train_loss: 0.9994, test_loss: 0.9708, test_f1: 0.4978
 epoch: 13, train_loss: 0.9772, test_loss: 0.9771, test_f1: 0.4928
 epoch: 14, train_loss: 0.9831, test_loss: 0.9546, test_f1: 0.5100
 epoch: 15, train_loss: 0.9768, test_loss: 0.9401, test_f1: 0.5098
 epoch: 16, train_loss: 0.9698, test_loss: 0.9470, test_f1: 0.4932
 epoch: 17, train_loss: 0.9488, test_loss: 0.9388, test_f1: 0.5076
 epoch: 18, train_loss: 0.9576, test_loss: 0.9281, test_f1: 0.5277
 epoch: 19, train_loss: 0.9342, test_loss: 0.9196, test_f1: 0.5310
 epoch: 20, train_loss: 0.9377, test_loss: 0.9202, test_f1: 0.5327
 epoch: 21, train_loss: 0.9187, test_loss: 0.9578, test_f1: 0.5082
 epoch: 22, train_loss: 0.9246, test_loss: 0.9513, test_f1: 0.5044
 epoch: 23, train_loss: 0.9106, test_loss: 0.9424, test_f1: 0.4886
 epoch: 24, train_loss: 0.9179, test_loss: 0.9515, test_f1: 0.4942
 epoch: 25, train_loss: 0.9185, test_loss: 0.9262, test_f1: 0.5255
 epoch: 26, train_loss: 0.9061, test_loss: 0.9357, test_f1: 0.5207
 epoch: 27, train_loss: 0.8843, test_loss: 0.9690, test_f1: 0.4999
 epoch: 28, train_loss: 0.8961, test_loss: 0.9969, test_f1: 0.4996
 epoch: 29, train_loss: 0.8781, test_loss: 0.9182, test_f1: 0.5293
 epoch: 30, train_loss: 0.8789, test_loss: 0.9766, test_f1: 0.5067
 epoch: 31, train_loss: 0.8754, test_loss: 0.9995, test_f1: 0.5097
 epoch: 32, train_loss: 0.8609, test_loss: 0.9887, test_f1: 0.5290
 epoch: 33, train_loss: 0.8675, test_loss: 0.9905, test_f1: 0.5206
 epoch: 34, train_loss: 0.8507, test_loss: 1.0120, test_f1: 0.5199
 epoch: 35, train_loss: 0.8473, test_loss: 1.0062, test_f1: 0.5230
 epoch: 36, train_loss: 0.8430, test_loss: 1.0251, test_f1: 0.5146
 epoch: 37, train_loss: 0.8412, test_loss: 1.0116, test_f1: 0.5308
 epoch: 38, train_loss: 0.8282, test_loss: 1.0172, test_f1: 0.5285
 epoch: 39, train_loss: 0.8213, test_loss: 1.0004, test_f1: 0.5297
 epoch: 40, train_loss: 0.8259, test_loss: 1.0120, test_f1: 0.5270
 epoch: 41, train_loss: 0.8241, test_loss: 1.0469, test_f1: 0.5297
 epoch: 42, train_loss: 0.8013, test_loss: 0.9966, test_f1: 0.5320
 epoch: 43, train_loss: 0.8100, test_loss: 1.0316, test_f1: 0.5336
 epoch: 44, train_loss: 0.8031, test_loss: 1.0375, test_f1: 0.5335
 epoch: 45, train_loss: 0.7924, test_loss: 1.0740, test_f1: 0.5397
 epoch: 46, train_loss: 0.7999, test_loss: 1.0998, test_f1: 0.5085
 epoch: 47, train_loss: 0.8029, test_loss: 1.0803, test_f1: 0.5217
 epoch: 48, train_loss: 0.7893, test_loss: 1.0691, test_f1: 0.5324
 epoch: 49, train_loss: 0.7824, test_loss: 1.0287, test_f1: 0.5320
 epoch: 50, train_loss: 0.7735, test_loss: 1.0897, test_f1: 0.5278
 epoch: 51, train_loss: 0.7708, test_loss: 1.0337, test_f1: 0.5392
 epoch: 52, train_loss: 0.7506, test_loss: 1.0314, test_f1: 0.5335
 epoch: 53, train_loss: 0.7577, test_loss: 1.0547, test_f1: 0.5199
 epoch: 54, train_loss: 0.7514, test_loss: 1.0522, test_f1: 0.5547
 epoch: 55, train_loss: 0.7600, test_loss: 1.0397, test_f1: 0.5460
 epoch: 56, train_loss: 0.7459, test_loss: 1.0527, test_f1: 0.5297
 epoch: 57, train_loss: 0.7486, test_loss: 1.0770, test_f1: 0.5464
 epoch: 58, train_loss: 0.7470, test_loss: 1.1275, test_f1: 0.5374
 epoch: 59, train_loss: 0.7396, test_loss: 1.1343, test_f1: 0.5245
 epoch: 60, train_loss: 0.7331, test_loss: 1.0632, test_f1: 0.5388
 epoch: 61, train_loss: 0.7209, test_loss: 1.0916, test_f1: 0.5441
 epoch: 62, train_loss: 0.7266, test_loss: 1.1066, test_f1: 0.5350
 epoch: 63, train_loss: 0.7334, test_loss: 1.0816, test_f1: 0.5447
 epoch: 64, train_loss: 0.7281, test_loss: 1.0645, test_f1: 0.5433
 epoch: 65, train_loss: 0.7345, test_loss: 1.0890, test_f1: 0.5569
 epoch: 66, train_loss: 0.7225, test_loss: 1.1012, test_f1: 0.5464
 epoch: 67, train_loss: 0.7155, test_loss: 1.1344, test_f1: 0.5556
 epoch: 68, train_loss: 0.7041, test_loss: 1.1286, test_f1: 0.5434
 epoch: 69, train_loss: 0.7169, test_loss: 1.1343, test_f1: 0.5250
 epoch: 70, train_loss: 0.7028, test_loss: 1.1220, test_f1: 0.5351
 epoch: 71, train_loss: 0.7100, test_loss: 1.2221, test_f1: 0.5277
 epoch: 72, train_loss: 0.7004, test_loss: 1.1988, test_f1: 0.5059
 epoch: 73, train_loss: 0.6981, test_loss: 1.1234, test_f1: 0.5286
 epoch: 74, train_loss: 0.6942, test_loss: 1.1405, test_f1: 0.5310
 epoch: 75, train_loss: 0.6983, test_loss: 1.2199, test_f1: 0.5076
 epoch: 76, train_loss: 0.6755, test_loss: 1.1406, test_f1: 0.5400
 epoch: 77, train_loss: 0.6913, test_loss: 1.1401, test_f1: 0.5427
 epoch: 78, train_loss: 0.7004, test_loss: 1.1818, test_f1: 0.5380
 epoch: 79, train_loss: 0.6833, test_loss: 1.1269, test_f1: 0.5365
 epoch: 80, train_loss: 0.6935, test_loss: 1.1521, test_f1: 0.5287
 epoch: 81, train_loss: 0.6808, test_loss: 1.2119, test_f1: 0.5258
 epoch: 82, train_loss: 0.6818, test_loss: 1.2205, test_f1: 0.5400
 epoch: 83, train_loss: 0.6827, test_loss: 1.2033, test_f1: 0.5268
 epoch: 84, train_loss: 0.6701, test_loss: 1.1515, test_f1: 0.5515
 epoch: 85, train_loss: 0.6787, test_loss: 1.2409, test_f1: 0.5169
 epoch: 86, train_loss: 0.6882, test_loss: 1.1818, test_f1: 0.5335
 epoch: 87, train_loss: 0.6697, test_loss: 1.2213, test_f1: 0.5269
 epoch: 88, train_loss: 0.6697, test_loss: 1.2576, test_f1: 0.5308
 epoch: 89, train_loss: 0.6546, test_loss: 1.3502, test_f1: 0.5106
 epoch: 90, train_loss: 0.6659, test_loss: 1.2193, test_f1: 0.5226
 epoch: 91, train_loss: 0.6760, test_loss: 1.2079, test_f1: 0.5197
 epoch: 92, train_loss: 0.6690, test_loss: 1.1935, test_f1: 0.5563
 epoch: 93, train_loss: 0.6537, test_loss: 1.1773, test_f1: 0.5476
 epoch: 94, train_loss: 0.6736, test_loss: 1.2659, test_f1: 0.5090
 epoch: 95, train_loss: 0.6525, test_loss: 1.2012, test_f1: 0.5263
 epoch: 96, train_loss: 0.6525, test_loss: 1.2828, test_f1: 0.5206
 epoch: 97, train_loss: 0.6597, test_loss: 1.2598, test_f1: 0.5263
 epoch: 98, train_loss: 0.6585, test_loss: 1.2579, test_f1: 0.4977
 epoch: 99, train_loss: 0.6634, test_loss: 1.2891, test_f1: 0.4956

Training completed in 1050.18 seconds
Best F1: 0.5790 at epoch 85
Mean F1 across iterations: 0.5588  0.0122
========================FINAL RESULTS================================
FEGIN weighted F1: 0.5790  0.0122
python main.py --data ltspice_examples --representation component_component --model FEGIN --layers 2 --hiddens 128 --batch_size 32 --lr 0.0001 --emb_size 250 --epochs 100 --save_appendix component_component_L2_H128_BS32_LR0.0001_E250 --no_val
-----



STDERR:
  File "main.py", line 370, in <module>
    main()
  File "main.py", line 254, in main
    dataset = dataset_class(
  File "/home/philip/projects/llm_inference_code_repo/Circuit-Completion-Using-GNNs/component_classification_with_link_prediction_head/evaluation/FEGIN/kernel/circuit_datasets.py", line 15, in __init__
    self.data, self.slices = torch.load(self.processed_paths[0])
  File "/home/philip/.local/lib/python3.8/site-packages/torch/serialization.py", line 1040, in load
    warnings.warn(
  File "/usr/lib/python3.8/warnings.py", line 109, in _showwarnmsg
    sw(msg.message, msg.category, msg.filename, msg.lineno,
  File "main.py", line 47, in warn_with_traceback
    traceback.print_stack(file=log)
/home/philip/projects/llm_inference_code_repo/Circuit-Completion-Using-GNNs/component_classification_with_link_prediction_head/evaluation/FEGIN/kernel/circuit_datasets.py:15: FutureWarning: You are using `torch.load` with `weights_only=False` (the current default value), which uses the default pickle module implicitly. It is possible to construct malicious pickle data which will execute arbitrary code during unpickling (See https://github.com/pytorch/pytorch/blob/main/SECURITY.md#untrusted-models for more details). In a future release, the default value for `weights_only` will be flipped to `True`. This limits the functions that could be executed during unpickling. Arbitrary objects will no longer be allowed to be loaded via this mode unless they are explicitly allowlisted by the user via `torch.serialization.add_safe_globals`. We recommend you start setting `weights_only=True` for any use case where you don't have full control of the loaded file. Please open an issue on GitHub for any issues related to this experimental feature.
  self.data, self.slices = torch.load(self.processed_paths[0])
