STDOUT:
Results will be saved in /home/philip/projects/ltspice_examples_code_repo/Circuit-Completion-Using-GNNs/component_classification_with_link_prediction_head/evaluation/FEGIN/results/model_FEGIN_dataset_ltspice_examples
Command line input: python main.py --data ltspice_examples --representation component_pin --model FEGIN --layers 6 --hiddens 128 --batch_size 64 --lr 0.0001 --emb_size 512 --epochs 100 --save_appendix component_pin_L6_H128_BS64_LR0.0001_E512 --no_val
 is saved.
-----
ltspice_examples - FEGIN
Using 6 layers, 128 hidden units, h = 2
Loading component_pin representation dataset
ENTERED
Training FEGIN on component_pin representation
Train: 3560, Test: 848
##################ITERATION #0 ****************************************
 epoch: 0, train_loss: 1.3534, test_loss: 1.3299, test_f1: 0.2260
 epoch: 1, train_loss: 1.2739, test_loss: 1.2353, test_f1: 0.2260
 epoch: 2, train_loss: 1.2060, test_loss: 1.1578, test_f1: 0.3391
 epoch: 3, train_loss: 1.1318, test_loss: 1.1045, test_f1: 0.3229
 epoch: 4, train_loss: 1.0703, test_loss: 1.0587, test_f1: 0.3445
 epoch: 5, train_loss: 1.0311, test_loss: 1.0456, test_f1: 0.3447
 epoch: 6, train_loss: 1.0095, test_loss: 1.0266, test_f1: 0.3553
 epoch: 7, train_loss: 0.9909, test_loss: 1.0125, test_f1: 0.4156
 epoch: 8, train_loss: 0.9742, test_loss: 1.0151, test_f1: 0.4231
 epoch: 9, train_loss: 0.9559, test_loss: 1.0035, test_f1: 0.4492
 epoch: 10, train_loss: 0.9360, test_loss: 0.9670, test_f1: 0.4908
 epoch: 11, train_loss: 0.9362, test_loss: 0.9745, test_f1: 0.4993
 epoch: 12, train_loss: 0.9164, test_loss: 0.9746, test_f1: 0.4824
 epoch: 13, train_loss: 0.9086, test_loss: 0.9633, test_f1: 0.5092
 epoch: 14, train_loss: 0.8900, test_loss: 0.9453, test_f1: 0.5258
 epoch: 15, train_loss: 0.8666, test_loss: 0.9230, test_f1: 0.5136
 epoch: 16, train_loss: 0.8506, test_loss: 0.9313, test_f1: 0.5347
 epoch: 17, train_loss: 0.8351, test_loss: 0.9351, test_f1: 0.5248
 epoch: 18, train_loss: 0.8255, test_loss: 0.9158, test_f1: 0.5494
 epoch: 19, train_loss: 0.8078, test_loss: 0.9374, test_f1: 0.5374
 epoch: 20, train_loss: 0.7928, test_loss: 0.8897, test_f1: 0.5449
 epoch: 21, train_loss: 0.7908, test_loss: 0.9343, test_f1: 0.5080
 epoch: 22, train_loss: 0.7789, test_loss: 0.8808, test_f1: 0.5509
 epoch: 23, train_loss: 0.7503, test_loss: 0.9172, test_f1: 0.5562
 epoch: 24, train_loss: 0.7553, test_loss: 0.9225, test_f1: 0.5562
 epoch: 25, train_loss: 0.7397, test_loss: 0.9231, test_f1: 0.5414
 epoch: 26, train_loss: 0.7471, test_loss: 0.9365, test_f1: 0.5264
 epoch: 27, train_loss: 0.7351, test_loss: 0.8902, test_f1: 0.5615
 epoch: 28, train_loss: 0.7323, test_loss: 0.9304, test_f1: 0.5433
 epoch: 29, train_loss: 0.7259, test_loss: 0.9222, test_f1: 0.5624
 epoch: 30, train_loss: 0.7050, test_loss: 0.8954, test_f1: 0.5619
 epoch: 31, train_loss: 0.6992, test_loss: 0.8957, test_f1: 0.5702
 epoch: 32, train_loss: 0.7039, test_loss: 0.8797, test_f1: 0.5585
 epoch: 33, train_loss: 0.6811, test_loss: 0.8896, test_f1: 0.5592
 epoch: 34, train_loss: 0.6774, test_loss: 0.9129, test_f1: 0.5762
 epoch: 35, train_loss: 0.6652, test_loss: 0.9188, test_f1: 0.5758
 epoch: 36, train_loss: 0.6760, test_loss: 0.9064, test_f1: 0.5642
 epoch: 37, train_loss: 0.6550, test_loss: 0.9080, test_f1: 0.5665
 epoch: 38, train_loss: 0.6456, test_loss: 0.9054, test_f1: 0.5860
 epoch: 39, train_loss: 0.6493, test_loss: 0.9292, test_f1: 0.5648
 epoch: 40, train_loss: 0.6336, test_loss: 0.9981, test_f1: 0.5635
 epoch: 41, train_loss: 0.6393, test_loss: 0.9666, test_f1: 0.5680
 epoch: 42, train_loss: 0.6378, test_loss: 0.9622, test_f1: 0.5790
 epoch: 43, train_loss: 0.6252, test_loss: 0.9523, test_f1: 0.5632
 epoch: 44, train_loss: 0.6186, test_loss: 0.9220, test_f1: 0.5666
 epoch: 45, train_loss: 0.6107, test_loss: 0.9606, test_f1: 0.5862
 epoch: 46, train_loss: 0.6163, test_loss: 0.9893, test_f1: 0.5783
 epoch: 47, train_loss: 0.5996, test_loss: 0.9858, test_f1: 0.5999
 epoch: 48, train_loss: 0.6002, test_loss: 0.9970, test_f1: 0.5813
 epoch: 49, train_loss: 0.5856, test_loss: 0.9425, test_f1: 0.5983
 epoch: 50, train_loss: 0.5787, test_loss: 0.9622, test_f1: 0.5834
 epoch: 51, train_loss: 0.5594, test_loss: 0.9718, test_f1: 0.5900
 epoch: 52, train_loss: 0.5629, test_loss: 1.0049, test_f1: 0.6123
 epoch: 53, train_loss: 0.5422, test_loss: 0.9627, test_f1: 0.5980
 epoch: 54, train_loss: 0.5486, test_loss: 1.0057, test_f1: 0.5960
 epoch: 55, train_loss: 0.5431, test_loss: 1.0234, test_f1: 0.5888
 epoch: 56, train_loss: 0.5465, test_loss: 1.0153, test_f1: 0.5838
 epoch: 57, train_loss: 0.5306, test_loss: 0.9985, test_f1: 0.5919
 epoch: 58, train_loss: 0.5349, test_loss: 1.0415, test_f1: 0.5886
 epoch: 59, train_loss: 0.5256, test_loss: 1.0107, test_f1: 0.6003
 epoch: 60, train_loss: 0.5201, test_loss: 1.0526, test_f1: 0.5716
 epoch: 61, train_loss: 0.5171, test_loss: 1.0187, test_f1: 0.5991
 epoch: 62, train_loss: 0.5118, test_loss: 1.0336, test_f1: 0.5899
 epoch: 63, train_loss: 0.5189, test_loss: 1.0206, test_f1: 0.5844
 epoch: 64, train_loss: 0.5189, test_loss: 1.0365, test_f1: 0.6056
 epoch: 65, train_loss: 0.5162, test_loss: 1.0508, test_f1: 0.5959
 epoch: 66, train_loss: 0.5095, test_loss: 1.0238, test_f1: 0.6010
 epoch: 67, train_loss: 0.5145, test_loss: 1.0375, test_f1: 0.6034
 epoch: 68, train_loss: 0.5009, test_loss: 1.0796, test_f1: 0.5950
 epoch: 69, train_loss: 0.4937, test_loss: 1.0536, test_f1: 0.6008
 epoch: 70, train_loss: 0.4901, test_loss: 1.0861, test_f1: 0.6114
 epoch: 71, train_loss: 0.4848, test_loss: 1.0600, test_f1: 0.6170
 epoch: 72, train_loss: 0.4951, test_loss: 1.0857, test_f1: 0.6034
 epoch: 73, train_loss: 0.4967, test_loss: 1.0616, test_f1: 0.6082
 epoch: 74, train_loss: 0.4826, test_loss: 1.1007, test_f1: 0.6084
 epoch: 75, train_loss: 0.4865, test_loss: 1.0494, test_f1: 0.5908
 epoch: 76, train_loss: 0.4846, test_loss: 1.0707, test_f1: 0.6154
 epoch: 77, train_loss: 0.4710, test_loss: 1.0354, test_f1: 0.6110
 epoch: 78, train_loss: 0.4780, test_loss: 1.1144, test_f1: 0.6101
 epoch: 79, train_loss: 0.4593, test_loss: 1.0920, test_f1: 0.6243
 epoch: 80, train_loss: 0.4637, test_loss: 1.0586, test_f1: 0.6248
 epoch: 81, train_loss: 0.4534, test_loss: 1.1138, test_f1: 0.6250
 epoch: 82, train_loss: 0.4663, test_loss: 1.0909, test_f1: 0.6092
 epoch: 83, train_loss: 0.4602, test_loss: 1.1223, test_f1: 0.6169
 epoch: 84, train_loss: 0.4480, test_loss: 1.0060, test_f1: 0.6264
 epoch: 85, train_loss: 0.4597, test_loss: 1.0666, test_f1: 0.6075
 epoch: 86, train_loss: 0.4513, test_loss: 1.0906, test_f1: 0.6061
 epoch: 87, train_loss: 0.4473, test_loss: 1.1571, test_f1: 0.6022
 epoch: 88, train_loss: 0.4459, test_loss: 1.1462, test_f1: 0.6127
 epoch: 89, train_loss: 0.4337, test_loss: 1.0771, test_f1: 0.6306
 epoch: 90, train_loss: 0.4256, test_loss: 1.0675, test_f1: 0.6323
 epoch: 91, train_loss: 0.4318, test_loss: 1.1535, test_f1: 0.6260
 epoch: 92, train_loss: 0.4358, test_loss: 1.1021, test_f1: 0.6326
 epoch: 93, train_loss: 0.4321, test_loss: 1.1568, test_f1: 0.6234
 epoch: 94, train_loss: 0.4396, test_loss: 1.1705, test_f1: 0.6101
 epoch: 95, train_loss: 0.4355, test_loss: 1.1379, test_f1: 0.6286
 epoch: 96, train_loss: 0.4359, test_loss: 1.2257, test_f1: 0.6191
 epoch: 97, train_loss: 0.4287, test_loss: 1.1381, test_f1: 0.6211
 epoch: 98, train_loss: 0.4130, test_loss: 1.1737, test_f1: 0.6235
 epoch: 99, train_loss: 0.4151, test_loss: 1.1286, test_f1: 0.6287
##################ITERATION #1 ****************************************
 epoch: 0, train_loss: 1.2661, test_loss: 1.2127, test_f1: 0.2286
 epoch: 1, train_loss: 1.1275, test_loss: 1.0682, test_f1: 0.4258
 epoch: 2, train_loss: 1.0542, test_loss: 1.0292, test_f1: 0.4775
 epoch: 3, train_loss: 1.0025, test_loss: 1.0106, test_f1: 0.4745
 epoch: 4, train_loss: 0.9740, test_loss: 0.9761, test_f1: 0.4898
 epoch: 5, train_loss: 0.9405, test_loss: 0.9806, test_f1: 0.5021
 epoch: 6, train_loss: 0.9246, test_loss: 0.9851, test_f1: 0.5112
 epoch: 7, train_loss: 0.9086, test_loss: 0.9902, test_f1: 0.5105
 epoch: 8, train_loss: 0.8876, test_loss: 0.9723, test_f1: 0.4872
 epoch: 9, train_loss: 0.8641, test_loss: 0.9651, test_f1: 0.4956
 epoch: 10, train_loss: 0.8610, test_loss: 0.9475, test_f1: 0.5166
 epoch: 11, train_loss: 0.8413, test_loss: 0.9548, test_f1: 0.5121
 epoch: 12, train_loss: 0.8358, test_loss: 0.9543, test_f1: 0.5276
 epoch: 13, train_loss: 0.8096, test_loss: 0.9718, test_f1: 0.5030
 epoch: 14, train_loss: 0.7985, test_loss: 0.9614, test_f1: 0.5372
 epoch: 15, train_loss: 0.7854, test_loss: 0.9756, test_f1: 0.5208
 epoch: 16, train_loss: 0.7716, test_loss: 0.9778, test_f1: 0.5230
 epoch: 17, train_loss: 0.7808, test_loss: 0.9594, test_f1: 0.5500
 epoch: 18, train_loss: 0.7618, test_loss: 0.9554, test_f1: 0.5571
 epoch: 19, train_loss: 0.7492, test_loss: 0.9513, test_f1: 0.5636
 epoch: 20, train_loss: 0.7304, test_loss: 0.9187, test_f1: 0.5472
 epoch: 21, train_loss: 0.7380, test_loss: 0.9563, test_f1: 0.5556
 epoch: 22, train_loss: 0.7239, test_loss: 0.9696, test_f1: 0.5300
 epoch: 23, train_loss: 0.7087, test_loss: 0.9440, test_f1: 0.5757
 epoch: 24, train_loss: 0.7056, test_loss: 0.9274, test_f1: 0.5760
 epoch: 25, train_loss: 0.7033, test_loss: 0.9332, test_f1: 0.5781
 epoch: 26, train_loss: 0.6858, test_loss: 0.9563, test_f1: 0.5492
 epoch: 27, train_loss: 0.6815, test_loss: 0.9638, test_f1: 0.5605
 epoch: 28, train_loss: 0.6722, test_loss: 0.9531, test_f1: 0.5806
 epoch: 29, train_loss: 0.6621, test_loss: 0.9315, test_f1: 0.5950
 epoch: 30, train_loss: 0.6419, test_loss: 0.9307, test_f1: 0.5643
 epoch: 31, train_loss: 0.6437, test_loss: 0.9570, test_f1: 0.5597
 epoch: 32, train_loss: 0.6437, test_loss: 0.9492, test_f1: 0.5517
 epoch: 33, train_loss: 0.6339, test_loss: 0.9463, test_f1: 0.5979
 epoch: 34, train_loss: 0.6310, test_loss: 0.9475, test_f1: 0.5670
 epoch: 35, train_loss: 0.6153, test_loss: 0.9257, test_f1: 0.6006
 epoch: 36, train_loss: 0.6077, test_loss: 0.9188, test_f1: 0.5865
 epoch: 37, train_loss: 0.6118, test_loss: 0.9490, test_f1: 0.5863
 epoch: 38, train_loss: 0.6031, test_loss: 0.9844, test_f1: 0.5982
 epoch: 39, train_loss: 0.5926, test_loss: 0.9522, test_f1: 0.5957
 epoch: 40, train_loss: 0.5908, test_loss: 0.9521, test_f1: 0.5938
 epoch: 41, train_loss: 0.5751, test_loss: 0.9697, test_f1: 0.6154
 epoch: 42, train_loss: 0.5832, test_loss: 0.9756, test_f1: 0.6123
 epoch: 43, train_loss: 0.5668, test_loss: 0.9597, test_f1: 0.6372
 epoch: 44, train_loss: 0.5567, test_loss: 0.9574, test_f1: 0.5955
 epoch: 45, train_loss: 0.5524, test_loss: 0.9421, test_f1: 0.6110
 epoch: 46, train_loss: 0.5624, test_loss: 0.9654, test_f1: 0.6142
 epoch: 47, train_loss: 0.5530, test_loss: 1.0011, test_f1: 0.6122
 epoch: 48, train_loss: 0.5301, test_loss: 0.9875, test_f1: 0.6289
 epoch: 49, train_loss: 0.5339, test_loss: 1.0078, test_f1: 0.6297
 epoch: 50, train_loss: 0.5240, test_loss: 1.0462, test_f1: 0.6067
 epoch: 51, train_loss: 0.5041, test_loss: 0.9812, test_f1: 0.6200
 epoch: 52, train_loss: 0.4944, test_loss: 0.9924, test_f1: 0.6287
 epoch: 53, train_loss: 0.4892, test_loss: 0.9911, test_f1: 0.6150
 epoch: 54, train_loss: 0.4827, test_loss: 1.0328, test_f1: 0.6243
 epoch: 55, train_loss: 0.4757, test_loss: 1.0260, test_f1: 0.6321
 epoch: 56, train_loss: 0.4803, test_loss: 1.0045, test_f1: 0.6226
 epoch: 57, train_loss: 0.4785, test_loss: 1.0245, test_f1: 0.6282
 epoch: 58, train_loss: 0.4626, test_loss: 1.0360, test_f1: 0.6127
 epoch: 59, train_loss: 0.4588, test_loss: 1.0351, test_f1: 0.6274
 epoch: 60, train_loss: 0.4667, test_loss: 1.0392, test_f1: 0.6280
 epoch: 61, train_loss: 0.4529, test_loss: 1.0650, test_f1: 0.6336
 epoch: 62, train_loss: 0.4667, test_loss: 1.0628, test_f1: 0.6423
 epoch: 63, train_loss: 0.4543, test_loss: 1.0491, test_f1: 0.6179
 epoch: 64, train_loss: 0.4476, test_loss: 1.0594, test_f1: 0.6326
 epoch: 65, train_loss: 0.4580, test_loss: 1.0705, test_f1: 0.6313
 epoch: 66, train_loss: 0.4486, test_loss: 1.0466, test_f1: 0.6562
 epoch: 67, train_loss: 0.4426, test_loss: 1.0600, test_f1: 0.6399
 epoch: 68, train_loss: 0.4360, test_loss: 1.0843, test_f1: 0.6259
 epoch: 69, train_loss: 0.4422, test_loss: 1.1058, test_f1: 0.6260
 epoch: 70, train_loss: 0.4321, test_loss: 1.0765, test_f1: 0.6316
 epoch: 71, train_loss: 0.4284, test_loss: 1.1220, test_f1: 0.6481
 epoch: 72, train_loss: 0.4154, test_loss: 1.0592, test_f1: 0.6449
 epoch: 73, train_loss: 0.4261, test_loss: 1.0978, test_f1: 0.6469
 epoch: 74, train_loss: 0.4282, test_loss: 1.1218, test_f1: 0.6503
 epoch: 75, train_loss: 0.4337, test_loss: 1.0821, test_f1: 0.6321
 epoch: 76, train_loss: 0.4253, test_loss: 1.1083, test_f1: 0.6513
 epoch: 77, train_loss: 0.4151, test_loss: 1.1031, test_f1: 0.6392
 epoch: 78, train_loss: 0.4212, test_loss: 1.1175, test_f1: 0.6293
 epoch: 79, train_loss: 0.4282, test_loss: 1.1433, test_f1: 0.6262
 epoch: 80, train_loss: 0.4167, test_loss: 1.1853, test_f1: 0.6253
 epoch: 81, train_loss: 0.4155, test_loss: 1.1630, test_f1: 0.6225
 epoch: 82, train_loss: 0.3975, test_loss: 1.1574, test_f1: 0.6303
 epoch: 83, train_loss: 0.4012, test_loss: 1.1891, test_f1: 0.6324
 epoch: 84, train_loss: 0.3805, test_loss: 1.1322, test_f1: 0.6424
 epoch: 85, train_loss: 0.3904, test_loss: 1.1894, test_f1: 0.6303
 epoch: 86, train_loss: 0.3799, test_loss: 1.1632, test_f1: 0.6393
 epoch: 87, train_loss: 0.3953, test_loss: 1.1647, test_f1: 0.6406
 epoch: 88, train_loss: 0.3873, test_loss: 1.1421, test_f1: 0.6517
 epoch: 89, train_loss: 0.3756, test_loss: 1.1688, test_f1: 0.6358
 epoch: 90, train_loss: 0.3802, test_loss: 1.1651, test_f1: 0.6316
 epoch: 91, train_loss: 0.3842, test_loss: 1.2061, test_f1: 0.6194
 epoch: 92, train_loss: 0.3739, test_loss: 1.2196, test_f1: 0.6202
 epoch: 93, train_loss: 0.3761, test_loss: 1.1866, test_f1: 0.6369
 epoch: 94, train_loss: 0.3845, test_loss: 1.2317, test_f1: 0.6490
 epoch: 95, train_loss: 0.3749, test_loss: 1.1863, test_f1: 0.6553
 epoch: 96, train_loss: 0.3608, test_loss: 1.1713, test_f1: 0.6468
 epoch: 97, train_loss: 0.3701, test_loss: 1.2369, test_f1: 0.6360
 epoch: 98, train_loss: 0.3601, test_loss: 1.2005, test_f1: 0.6387
 epoch: 99, train_loss: 0.3697, test_loss: 1.2745, test_f1: 0.6279
##################ITERATION #2 ****************************************
 epoch: 0, train_loss: 1.2255, test_loss: 1.1788, test_f1: 0.3437
 epoch: 1, train_loss: 1.1128, test_loss: 1.0531, test_f1: 0.4539
 epoch: 2, train_loss: 1.0495, test_loss: 1.0182, test_f1: 0.4975
 epoch: 3, train_loss: 1.0086, test_loss: 0.9991, test_f1: 0.4981
 epoch: 4, train_loss: 0.9797, test_loss: 0.9815, test_f1: 0.5220
 epoch: 5, train_loss: 0.9549, test_loss: 0.9667, test_f1: 0.5232
 epoch: 6, train_loss: 0.9252, test_loss: 0.9815, test_f1: 0.5448
 epoch: 7, train_loss: 0.9089, test_loss: 0.9712, test_f1: 0.4988
 epoch: 8, train_loss: 0.8862, test_loss: 0.9340, test_f1: 0.5323
 epoch: 9, train_loss: 0.8639, test_loss: 0.9505, test_f1: 0.5447
 epoch: 10, train_loss: 0.8464, test_loss: 0.9226, test_f1: 0.5425
 epoch: 11, train_loss: 0.8280, test_loss: 0.9255, test_f1: 0.5793
 epoch: 12, train_loss: 0.8077, test_loss: 0.9338, test_f1: 0.5700
 epoch: 13, train_loss: 0.8000, test_loss: 0.9261, test_f1: 0.5568
 epoch: 14, train_loss: 0.7917, test_loss: 0.9055, test_f1: 0.5754
 epoch: 15, train_loss: 0.7734, test_loss: 0.9193, test_f1: 0.5828
 epoch: 16, train_loss: 0.7517, test_loss: 0.9660, test_f1: 0.5739
 epoch: 17, train_loss: 0.7514, test_loss: 0.9172, test_f1: 0.5922
 epoch: 18, train_loss: 0.7325, test_loss: 1.0077, test_f1: 0.5466
 epoch: 19, train_loss: 0.7173, test_loss: 0.9349, test_f1: 0.5899
 epoch: 20, train_loss: 0.7084, test_loss: 0.9120, test_f1: 0.5943
 epoch: 21, train_loss: 0.6943, test_loss: 0.9370, test_f1: 0.5911
 epoch: 22, train_loss: 0.6899, test_loss: 0.9424, test_f1: 0.5623
 epoch: 23, train_loss: 0.6915, test_loss: 0.9824, test_f1: 0.5638
 epoch: 24, train_loss: 0.6863, test_loss: 0.9651, test_f1: 0.5707
 epoch: 25, train_loss: 0.6604, test_loss: 0.9867, test_f1: 0.5997
 epoch: 26, train_loss: 0.6567, test_loss: 1.0314, test_f1: 0.5734
 epoch: 27, train_loss: 0.6533, test_loss: 0.9551, test_f1: 0.5967
 epoch: 28, train_loss: 0.6513, test_loss: 0.9535, test_f1: 0.5907
 epoch: 29, train_loss: 0.6196, test_loss: 0.9794, test_f1: 0.5960
 epoch: 30, train_loss: 0.6119, test_loss: 0.9653, test_f1: 0.6201
 epoch: 31, train_loss: 0.6192, test_loss: 1.0457, test_f1: 0.5771
 epoch: 32, train_loss: 0.6040, test_loss: 1.0520, test_f1: 0.5843
 epoch: 33, train_loss: 0.5995, test_loss: 1.0032, test_f1: 0.5917
 epoch: 34, train_loss: 0.5972, test_loss: 1.0467, test_f1: 0.5872
 epoch: 35, train_loss: 0.5997, test_loss: 1.0133, test_f1: 0.6131
 epoch: 36, train_loss: 0.5824, test_loss: 1.0179, test_f1: 0.5739
 epoch: 37, train_loss: 0.5829, test_loss: 1.0112, test_f1: 0.5938
 epoch: 38, train_loss: 0.5632, test_loss: 1.0144, test_f1: 0.5974
 epoch: 39, train_loss: 0.5744, test_loss: 1.0895, test_f1: 0.6076
 epoch: 40, train_loss: 0.5514, test_loss: 1.0691, test_f1: 0.5771
 epoch: 41, train_loss: 0.5581, test_loss: 1.0250, test_f1: 0.5994
 epoch: 42, train_loss: 0.5365, test_loss: 1.1216, test_f1: 0.5958
 epoch: 43, train_loss: 0.5441, test_loss: 1.0287, test_f1: 0.6158
 epoch: 44, train_loss: 0.5252, test_loss: 1.0480, test_f1: 0.6321
 epoch: 45, train_loss: 0.5336, test_loss: 1.1075, test_f1: 0.5883
 epoch: 46, train_loss: 0.5171, test_loss: 1.1244, test_f1: 0.5945
 epoch: 47, train_loss: 0.5132, test_loss: 1.0461, test_f1: 0.6117
 epoch: 48, train_loss: 0.5162, test_loss: 1.0908, test_f1: 0.5907
 epoch: 49, train_loss: 0.5109, test_loss: 1.2320, test_f1: 0.5970
 epoch: 50, train_loss: 0.4883, test_loss: 1.0888, test_f1: 0.6137
 epoch: 51, train_loss: 0.4727, test_loss: 1.1102, test_f1: 0.6047
 epoch: 52, train_loss: 0.4708, test_loss: 1.1220, test_f1: 0.6015
 epoch: 53, train_loss: 0.4797, test_loss: 1.0462, test_f1: 0.6307
 epoch: 54, train_loss: 0.4646, test_loss: 1.0573, test_f1: 0.6257
 epoch: 55, train_loss: 0.4499, test_loss: 1.1108, test_f1: 0.6191
 epoch: 56, train_loss: 0.4426, test_loss: 1.1492, test_f1: 0.6129
 epoch: 57, train_loss: 0.4483, test_loss: 1.1948, test_f1: 0.6021
 epoch: 58, train_loss: 0.4490, test_loss: 1.1452, test_f1: 0.6342
 epoch: 59, train_loss: 0.4339, test_loss: 1.1932, test_f1: 0.6182
 epoch: 60, train_loss: 0.4446, test_loss: 1.1682, test_f1: 0.6158
 epoch: 61, train_loss: 0.4394, test_loss: 1.1780, test_f1: 0.6224
 epoch: 62, train_loss: 0.4232, test_loss: 1.1346, test_f1: 0.6191
 epoch: 63, train_loss: 0.4305, test_loss: 1.1502, test_f1: 0.6130
 epoch: 64, train_loss: 0.4179, test_loss: 1.1883, test_f1: 0.6092
 epoch: 65, train_loss: 0.4109, test_loss: 1.2277, test_f1: 0.6149
 epoch: 66, train_loss: 0.4079, test_loss: 1.1845, test_f1: 0.6101
 epoch: 67, train_loss: 0.4258, test_loss: 1.2857, test_f1: 0.6285
 epoch: 68, train_loss: 0.4134, test_loss: 1.1785, test_f1: 0.6184
 epoch: 69, train_loss: 0.4041, test_loss: 1.2320, test_f1: 0.6237
 epoch: 70, train_loss: 0.3953, test_loss: 1.2764, test_f1: 0.6217
 epoch: 71, train_loss: 0.4041, test_loss: 1.2970, test_f1: 0.6150
 epoch: 72, train_loss: 0.4067, test_loss: 1.1342, test_f1: 0.6379
 epoch: 73, train_loss: 0.3839, test_loss: 1.2449, test_f1: 0.6326
 epoch: 74, train_loss: 0.3999, test_loss: 1.2542, test_f1: 0.6360
 epoch: 75, train_loss: 0.3840, test_loss: 1.2647, test_f1: 0.6274
 epoch: 76, train_loss: 0.3865, test_loss: 1.3110, test_f1: 0.6267
 epoch: 77, train_loss: 0.3794, test_loss: 1.2649, test_f1: 0.6537
 epoch: 78, train_loss: 0.3891, test_loss: 1.3162, test_f1: 0.6203
 epoch: 79, train_loss: 0.3735, test_loss: 1.3033, test_f1: 0.6231
 epoch: 80, train_loss: 0.3799, test_loss: 1.3636, test_f1: 0.6449
 epoch: 81, train_loss: 0.3866, test_loss: 1.2944, test_f1: 0.6406
 epoch: 82, train_loss: 0.3858, test_loss: 1.3144, test_f1: 0.6321
 epoch: 83, train_loss: 0.3819, test_loss: 1.3417, test_f1: 0.6158
 epoch: 84, train_loss: 0.3799, test_loss: 1.2915, test_f1: 0.6218
 epoch: 85, train_loss: 0.3701, test_loss: 1.2960, test_f1: 0.6350
 epoch: 86, train_loss: 0.3553, test_loss: 1.3383, test_f1: 0.6333
 epoch: 87, train_loss: 0.3648, test_loss: 1.3609, test_f1: 0.6459
 epoch: 88, train_loss: 0.3472, test_loss: 1.3635, test_f1: 0.6361
 epoch: 89, train_loss: 0.3583, test_loss: 1.3658, test_f1: 0.6172
 epoch: 90, train_loss: 0.3619, test_loss: 1.3379, test_f1: 0.6340
 epoch: 91, train_loss: 0.3455, test_loss: 1.3113, test_f1: 0.6573
 epoch: 92, train_loss: 0.3411, test_loss: 1.3916, test_f1: 0.6641
 epoch: 93, train_loss: 0.3445, test_loss: 1.3133, test_f1: 0.6382
 epoch: 94, train_loss: 0.3411, test_loss: 1.4030, test_f1: 0.6462
 epoch: 95, train_loss: 0.3366, test_loss: 1.4687, test_f1: 0.6302
 epoch: 96, train_loss: 0.3477, test_loss: 1.2895, test_f1: 0.6621
 epoch: 97, train_loss: 0.3440, test_loss: 1.4416, test_f1: 0.6383
 epoch: 98, train_loss: 0.3338, test_loss: 1.3930, test_f1: 0.6553
 epoch: 99, train_loss: 0.3299, test_loss: 1.4335, test_f1: 0.6503
##################ITERATION #3 ****************************************
 epoch: 0, train_loss: 1.2273, test_loss: 1.1963, test_f1: 0.3502
 epoch: 1, train_loss: 1.0992, test_loss: 1.0342, test_f1: 0.4756
 epoch: 2, train_loss: 1.0491, test_loss: 1.0041, test_f1: 0.5088
 epoch: 3, train_loss: 1.0093, test_loss: 0.9768, test_f1: 0.5124
 epoch: 4, train_loss: 0.9821, test_loss: 0.9683, test_f1: 0.4954
 epoch: 5, train_loss: 0.9597, test_loss: 0.9465, test_f1: 0.5268
 epoch: 6, train_loss: 0.9419, test_loss: 0.9318, test_f1: 0.5411
 epoch: 7, train_loss: 0.9168, test_loss: 0.9308, test_f1: 0.5479
 epoch: 8, train_loss: 0.8933, test_loss: 0.9336, test_f1: 0.5260
 epoch: 9, train_loss: 0.8706, test_loss: 0.9324, test_f1: 0.5321
 epoch: 10, train_loss: 0.8563, test_loss: 0.9032, test_f1: 0.5705
 epoch: 11, train_loss: 0.8441, test_loss: 0.9133, test_f1: 0.5725
 epoch: 12, train_loss: 0.8230, test_loss: 0.9021, test_f1: 0.5738
 epoch: 13, train_loss: 0.8130, test_loss: 0.9174, test_f1: 0.5575
 epoch: 14, train_loss: 0.8025, test_loss: 0.9235, test_f1: 0.5621
 epoch: 15, train_loss: 0.7964, test_loss: 0.8993, test_f1: 0.5908
 epoch: 16, train_loss: 0.7822, test_loss: 0.9177, test_f1: 0.5899
 epoch: 17, train_loss: 0.7665, test_loss: 0.9377, test_f1: 0.5809
 epoch: 18, train_loss: 0.7616, test_loss: 0.9373, test_f1: 0.5857
 epoch: 19, train_loss: 0.7371, test_loss: 0.9126, test_f1: 0.5947
 epoch: 20, train_loss: 0.7357, test_loss: 0.9512, test_f1: 0.5686
 epoch: 21, train_loss: 0.7304, test_loss: 0.9523, test_f1: 0.5783
 epoch: 22, train_loss: 0.7121, test_loss: 0.9535, test_f1: 0.5875
 epoch: 23, train_loss: 0.7050, test_loss: 0.9522, test_f1: 0.6016
 epoch: 24, train_loss: 0.6766, test_loss: 0.9379, test_f1: 0.5857
 epoch: 25, train_loss: 0.6854, test_loss: 0.9407, test_f1: 0.5968
 epoch: 26, train_loss: 0.6616, test_loss: 0.9981, test_f1: 0.5913
 epoch: 27, train_loss: 0.6499, test_loss: 0.9487, test_f1: 0.6117
 epoch: 28, train_loss: 0.6634, test_loss: 0.9603, test_f1: 0.5978
 epoch: 29, train_loss: 0.6414, test_loss: 0.9990, test_f1: 0.6033
 epoch: 30, train_loss: 0.6336, test_loss: 0.9954, test_f1: 0.5950
 epoch: 31, train_loss: 0.6332, test_loss: 1.0159, test_f1: 0.6038
 epoch: 32, train_loss: 0.6170, test_loss: 0.9658, test_f1: 0.6199
 epoch: 33, train_loss: 0.6099, test_loss: 0.9702, test_f1: 0.6025
 epoch: 34, train_loss: 0.6050, test_loss: 1.0162, test_f1: 0.6149
 epoch: 35, train_loss: 0.5886, test_loss: 0.9387, test_f1: 0.6269
 epoch: 36, train_loss: 0.5996, test_loss: 1.0211, test_f1: 0.6175
 epoch: 37, train_loss: 0.5990, test_loss: 0.9762, test_f1: 0.6222
 epoch: 38, train_loss: 0.5797, test_loss: 0.9844, test_f1: 0.6110
 epoch: 39, train_loss: 0.5839, test_loss: 1.0664, test_f1: 0.6164
 epoch: 40, train_loss: 0.5678, test_loss: 0.9603, test_f1: 0.6454
 epoch: 41, train_loss: 0.5674, test_loss: 1.0286, test_f1: 0.6262
 epoch: 42, train_loss: 0.5467, test_loss: 1.0882, test_f1: 0.6202
 epoch: 43, train_loss: 0.5581, test_loss: 1.0093, test_f1: 0.6374
 epoch: 44, train_loss: 0.5314, test_loss: 1.0949, test_f1: 0.5870
 epoch: 45, train_loss: 0.5293, test_loss: 1.0993, test_f1: 0.6128
 epoch: 46, train_loss: 0.5233, test_loss: 1.0996, test_f1: 0.6301
 epoch: 47, train_loss: 0.5147, test_loss: 1.0869, test_f1: 0.6396
 epoch: 48, train_loss: 0.5194, test_loss: 1.1486, test_f1: 0.6127
 epoch: 49, train_loss: 0.5211, test_loss: 1.0462, test_f1: 0.6353
 epoch: 50, train_loss: 0.5272, test_loss: 1.0550, test_f1: 0.6557
 epoch: 51, train_loss: 0.4880, test_loss: 1.0669, test_f1: 0.6358
 epoch: 52, train_loss: 0.4750, test_loss: 1.0888, test_f1: 0.6517
 epoch: 53, train_loss: 0.4648, test_loss: 1.0954, test_f1: 0.6676
 epoch: 54, train_loss: 0.4703, test_loss: 1.1101, test_f1: 0.6482
 epoch: 55, train_loss: 0.4675, test_loss: 1.1406, test_f1: 0.6404
 epoch: 56, train_loss: 0.4486, test_loss: 1.1424, test_f1: 0.6423
 epoch: 57, train_loss: 0.4653, test_loss: 1.1415, test_f1: 0.6341
 epoch: 58, train_loss: 0.4537, test_loss: 1.1197, test_f1: 0.6483
 epoch: 59, train_loss: 0.4588, test_loss: 1.1595, test_f1: 0.6391
 epoch: 60, train_loss: 0.4328, test_loss: 1.1372, test_f1: 0.6630
 epoch: 61, train_loss: 0.4493, test_loss: 1.1588, test_f1: 0.6448
 epoch: 62, train_loss: 0.4459, test_loss: 1.1182, test_f1: 0.6519
 epoch: 63, train_loss: 0.4336, test_loss: 1.1588, test_f1: 0.6239
 epoch: 64, train_loss: 0.4368, test_loss: 1.1901, test_f1: 0.6460
 epoch: 65, train_loss: 0.4427, test_loss: 1.1861, test_f1: 0.6480
 epoch: 66, train_loss: 0.4300, test_loss: 1.1422, test_f1: 0.6340
 epoch: 67, train_loss: 0.4212, test_loss: 1.1786, test_f1: 0.6554
 epoch: 68, train_loss: 0.4352, test_loss: 1.2047, test_f1: 0.6303
 epoch: 69, train_loss: 0.4160, test_loss: 1.1678, test_f1: 0.6652
 epoch: 70, train_loss: 0.4107, test_loss: 1.2086, test_f1: 0.6634
 epoch: 71, train_loss: 0.4235, test_loss: 1.1641, test_f1: 0.6600
 epoch: 72, train_loss: 0.4176, test_loss: 1.2181, test_f1: 0.6519
 epoch: 73, train_loss: 0.4061, test_loss: 1.1666, test_f1: 0.6439
 epoch: 74, train_loss: 0.3991, test_loss: 1.2474, test_f1: 0.6433
 epoch: 75, train_loss: 0.3916, test_loss: 1.2291, test_f1: 0.6366
 epoch: 76, train_loss: 0.3970, test_loss: 1.2405, test_f1: 0.6535
 epoch: 77, train_loss: 0.3906, test_loss: 1.2469, test_f1: 0.6278
 epoch: 78, train_loss: 0.3965, test_loss: 1.2026, test_f1: 0.6611
 epoch: 79, train_loss: 0.3940, test_loss: 1.2676, test_f1: 0.6495
 epoch: 80, train_loss: 0.3806, test_loss: 1.2660, test_f1: 0.6332
 epoch: 81, train_loss: 0.3899, test_loss: 1.2413, test_f1: 0.6435
 epoch: 82, train_loss: 0.3971, test_loss: 1.2222, test_f1: 0.6446
 epoch: 83, train_loss: 0.3760, test_loss: 1.3022, test_f1: 0.6230
 epoch: 84, train_loss: 0.3742, test_loss: 1.3241, test_f1: 0.6377
 epoch: 85, train_loss: 0.3770, test_loss: 1.2925, test_f1: 0.6166
 epoch: 86, train_loss: 0.3766, test_loss: 1.2938, test_f1: 0.6378
 epoch: 87, train_loss: 0.3537, test_loss: 1.2866, test_f1: 0.6333
 epoch: 88, train_loss: 0.3729, test_loss: 1.3427, test_f1: 0.6323
 epoch: 89, train_loss: 0.3666, test_loss: 1.3373, test_f1: 0.6274
 epoch: 90, train_loss: 0.3808, test_loss: 1.3565, test_f1: 0.6271
 epoch: 91, train_loss: 0.3618, test_loss: 1.4010, test_f1: 0.6291
 epoch: 92, train_loss: 0.3555, test_loss: 1.3359, test_f1: 0.6337
 epoch: 93, train_loss: 0.3502, test_loss: 1.3811, test_f1: 0.6353
 epoch: 94, train_loss: 0.3612, test_loss: 1.4654, test_f1: 0.6314
 epoch: 95, train_loss: 0.3581, test_loss: 1.3768, test_f1: 0.6385
 epoch: 96, train_loss: 0.3369, test_loss: 1.4122, test_f1: 0.6173
 epoch: 97, train_loss: 0.3441, test_loss: 1.4491, test_f1: 0.6381
 epoch: 98, train_loss: 0.3497, test_loss: 1.3596, test_f1: 0.6326
 epoch: 99, train_loss: 0.3346, test_loss: 1.4030, test_f1: 0.6380
##################ITERATION #4 ****************************************
 epoch: 0, train_loss: 1.1868, test_loss: 1.1841, test_f1: 0.3797
 epoch: 1, train_loss: 1.0696, test_loss: 1.0243, test_f1: 0.4470
 epoch: 2, train_loss: 1.0328, test_loss: 0.9893, test_f1: 0.4937
 epoch: 3, train_loss: 0.9961, test_loss: 0.9751, test_f1: 0.4992
 epoch: 4, train_loss: 0.9694, test_loss: 0.9682, test_f1: 0.4975
 epoch: 5, train_loss: 0.9487, test_loss: 0.9586, test_f1: 0.5021
 epoch: 6, train_loss: 0.9362, test_loss: 0.9515, test_f1: 0.5116
 epoch: 7, train_loss: 0.9102, test_loss: 0.9282, test_f1: 0.5324
 epoch: 8, train_loss: 0.8922, test_loss: 0.9118, test_f1: 0.5293
 epoch: 9, train_loss: 0.8828, test_loss: 0.9329, test_f1: 0.5258
 epoch: 10, train_loss: 0.8753, test_loss: 0.9089, test_f1: 0.5218
 epoch: 11, train_loss: 0.8483, test_loss: 0.9199, test_f1: 0.5317
 epoch: 12, train_loss: 0.8313, test_loss: 0.9312, test_f1: 0.5277
 epoch: 13, train_loss: 0.8221, test_loss: 0.9490, test_f1: 0.5454
 epoch: 14, train_loss: 0.8029, test_loss: 0.9080, test_f1: 0.5465
 epoch: 15, train_loss: 0.8059, test_loss: 0.9222, test_f1: 0.5480
 epoch: 16, train_loss: 0.7868, test_loss: 0.9785, test_f1: 0.5398
 epoch: 17, train_loss: 0.7768, test_loss: 0.9185, test_f1: 0.5661
 epoch: 18, train_loss: 0.7601, test_loss: 0.9341, test_f1: 0.5404
 epoch: 19, train_loss: 0.7571, test_loss: 0.8945, test_f1: 0.5714
 epoch: 20, train_loss: 0.7468, test_loss: 0.9252, test_f1: 0.5557
 epoch: 21, train_loss: 0.7225, test_loss: 0.9087, test_f1: 0.5745
 epoch: 22, train_loss: 0.7247, test_loss: 0.9651, test_f1: 0.5744
 epoch: 23, train_loss: 0.7153, test_loss: 0.9653, test_f1: 0.5534
 epoch: 24, train_loss: 0.7015, test_loss: 0.9095, test_f1: 0.5930
 epoch: 25, train_loss: 0.6990, test_loss: 0.9224, test_f1: 0.5874
 epoch: 26, train_loss: 0.6758, test_loss: 0.9582, test_f1: 0.5640
 epoch: 27, train_loss: 0.6882, test_loss: 0.9093, test_f1: 0.5694
 epoch: 28, train_loss: 0.6656, test_loss: 0.9039, test_f1: 0.5797
 epoch: 29, train_loss: 0.6603, test_loss: 0.9051, test_f1: 0.5725
 epoch: 30, train_loss: 0.6510, test_loss: 0.9188, test_f1: 0.5840
 epoch: 31, train_loss: 0.6421, test_loss: 0.9413, test_f1: 0.5796
 epoch: 32, train_loss: 0.6209, test_loss: 0.9219, test_f1: 0.5935
 epoch: 33, train_loss: 0.6386, test_loss: 0.9431, test_f1: 0.5854
 epoch: 34, train_loss: 0.6329, test_loss: 0.9144, test_f1: 0.5768
 epoch: 35, train_loss: 0.6164, test_loss: 0.9744, test_f1: 0.5663
 epoch: 36, train_loss: 0.6107, test_loss: 0.9815, test_f1: 0.5817
 epoch: 37, train_loss: 0.6018, test_loss: 0.9504, test_f1: 0.5805
 epoch: 38, train_loss: 0.5975, test_loss: 1.0237, test_f1: 0.5906
 epoch: 39, train_loss: 0.5879, test_loss: 1.0221, test_f1: 0.5870
 epoch: 40, train_loss: 0.5747, test_loss: 0.9209, test_f1: 0.5935
 epoch: 41, train_loss: 0.5721, test_loss: 0.9453, test_f1: 0.5917
 epoch: 42, train_loss: 0.5558, test_loss: 0.9119, test_f1: 0.5986
 epoch: 43, train_loss: 0.5726, test_loss: 0.9562, test_f1: 0.5964
 epoch: 44, train_loss: 0.5437, test_loss: 0.9156, test_f1: 0.6090
 epoch: 45, train_loss: 0.5433, test_loss: 0.9155, test_f1: 0.6104
 epoch: 46, train_loss: 0.5399, test_loss: 0.9705, test_f1: 0.5857
 epoch: 47, train_loss: 0.5307, test_loss: 0.9847, test_f1: 0.6166
 epoch: 48, train_loss: 0.5338, test_loss: 0.9574, test_f1: 0.5892
 epoch: 49, train_loss: 0.5233, test_loss: 0.9619, test_f1: 0.5983
 epoch: 50, train_loss: 0.5167, test_loss: 0.9781, test_f1: 0.6065
 epoch: 51, train_loss: 0.4822, test_loss: 0.9483, test_f1: 0.6264
 epoch: 52, train_loss: 0.4781, test_loss: 0.9774, test_f1: 0.6070
 epoch: 53, train_loss: 0.4732, test_loss: 0.9777, test_f1: 0.6209
 epoch: 54, train_loss: 0.4657, test_loss: 0.9855, test_f1: 0.6246
 epoch: 55, train_loss: 0.4710, test_loss: 0.9765, test_f1: 0.6239
 epoch: 56, train_loss: 0.4690, test_loss: 0.9948, test_f1: 0.6074
 epoch: 57, train_loss: 0.4645, test_loss: 1.0156, test_f1: 0.6199
 epoch: 58, train_loss: 0.4734, test_loss: 1.0390, test_f1: 0.5954
 epoch: 59, train_loss: 0.4593, test_loss: 0.9881, test_f1: 0.6047
 epoch: 60, train_loss: 0.4560, test_loss: 0.9973, test_f1: 0.6305
 epoch: 61, train_loss: 0.4614, test_loss: 0.9927, test_f1: 0.6337
 epoch: 62, train_loss: 0.4450, test_loss: 1.0197, test_f1: 0.6203
 epoch: 63, train_loss: 0.4413, test_loss: 1.0515, test_f1: 0.6141
 epoch: 64, train_loss: 0.4405, test_loss: 1.0221, test_f1: 0.6091
 epoch: 65, train_loss: 0.4302, test_loss: 1.0791, test_f1: 0.5939
 epoch: 66, train_loss: 0.4315, test_loss: 1.0549, test_f1: 0.6324
 epoch: 67, train_loss: 0.4329, test_loss: 1.0308, test_f1: 0.6246
 epoch: 68, train_loss: 0.4163, test_loss: 1.0708, test_f1: 0.6090
 epoch: 69, train_loss: 0.4135, test_loss: 1.0850, test_f1: 0.6097
 epoch: 70, train_loss: 0.4143, test_loss: 1.0981, test_f1: 0.6179
 epoch: 71, train_loss: 0.4321, test_loss: 1.1335, test_f1: 0.6096
 epoch: 72, train_loss: 0.4145, test_loss: 1.0574, test_f1: 0.6283
 epoch: 73, train_loss: 0.3974, test_loss: 1.0814, test_f1: 0.6316
 epoch: 74, train_loss: 0.4103, test_loss: 1.0423, test_f1: 0.6254
 epoch: 75, train_loss: 0.4092, test_loss: 1.1127, test_f1: 0.6124
 epoch: 76, train_loss: 0.3906, test_loss: 1.1005, test_f1: 0.6338
 epoch: 77, train_loss: 0.4031, test_loss: 1.1263, test_f1: 0.6261
 epoch: 78, train_loss: 0.3921, test_loss: 1.1554, test_f1: 0.6402
 epoch: 79, train_loss: 0.3909, test_loss: 1.0823, test_f1: 0.6367
 epoch: 80, train_loss: 0.3834, test_loss: 1.1045, test_f1: 0.6178
 epoch: 81, train_loss: 0.3877, test_loss: 1.1850, test_f1: 0.6085
 epoch: 82, train_loss: 0.3865, test_loss: 1.0898, test_f1: 0.6324
 epoch: 83, train_loss: 0.3818, test_loss: 1.1595, test_f1: 0.6312
 epoch: 84, train_loss: 0.3785, test_loss: 1.1794, test_f1: 0.6280
 epoch: 85, train_loss: 0.3766, test_loss: 1.1148, test_f1: 0.6220
 epoch: 86, train_loss: 0.3657, test_loss: 1.0884, test_f1: 0.6345
 epoch: 87, train_loss: 0.3886, test_loss: 1.2302, test_f1: 0.6051
 epoch: 88, train_loss: 0.3645, test_loss: 1.1518, test_f1: 0.6261
 epoch: 89, train_loss: 0.3708, test_loss: 1.1803, test_f1: 0.6173
 epoch: 90, train_loss: 0.3539, test_loss: 1.1745, test_f1: 0.6285
 epoch: 91, train_loss: 0.3623, test_loss: 1.1210, test_f1: 0.6234
 epoch: 92, train_loss: 0.3501, test_loss: 1.1634, test_f1: 0.6268
 epoch: 93, train_loss: 0.3459, test_loss: 1.1446, test_f1: 0.6461
 epoch: 94, train_loss: 0.3457, test_loss: 1.1800, test_f1: 0.6349
 epoch: 95, train_loss: 0.3491, test_loss: 1.1791, test_f1: 0.6297
 epoch: 96, train_loss: 0.3456, test_loss: 1.2556, test_f1: 0.6473
 epoch: 97, train_loss: 0.3329, test_loss: 1.2928, test_f1: 0.6224
 epoch: 98, train_loss: 0.3450, test_loss: 1.2686, test_f1: 0.6299
 epoch: 99, train_loss: 0.3448, test_loss: 1.2239, test_f1: 0.6400
##################ITERATION #5 ****************************************
 epoch: 0, train_loss: 1.2070, test_loss: 1.1183, test_f1: 0.3566
 epoch: 1, train_loss: 1.0697, test_loss: 0.9920, test_f1: 0.4651
 epoch: 2, train_loss: 1.0221, test_loss: 0.9685, test_f1: 0.5032
 epoch: 3, train_loss: 0.9900, test_loss: 0.9678, test_f1: 0.4775
 epoch: 4, train_loss: 0.9571, test_loss: 0.9608, test_f1: 0.5036
 epoch: 5, train_loss: 0.9485, test_loss: 0.9346, test_f1: 0.5247
 epoch: 6, train_loss: 0.9242, test_loss: 0.9316, test_f1: 0.5539
 epoch: 7, train_loss: 0.9014, test_loss: 0.9279, test_f1: 0.5443
 epoch: 8, train_loss: 0.8883, test_loss: 0.9106, test_f1: 0.5557
 epoch: 9, train_loss: 0.8730, test_loss: 0.9227, test_f1: 0.5515
 epoch: 10, train_loss: 0.8542, test_loss: 0.9130, test_f1: 0.5816
 epoch: 11, train_loss: 0.8436, test_loss: 0.9069, test_f1: 0.5309
 epoch: 12, train_loss: 0.8312, test_loss: 0.8800, test_f1: 0.5754
 epoch: 13, train_loss: 0.8197, test_loss: 0.8792, test_f1: 0.5528
 epoch: 14, train_loss: 0.8060, test_loss: 0.9064, test_f1: 0.5646
 epoch: 15, train_loss: 0.7892, test_loss: 0.8793, test_f1: 0.5681
 epoch: 16, train_loss: 0.7939, test_loss: 0.8850, test_f1: 0.5832
 epoch: 17, train_loss: 0.7691, test_loss: 0.8616, test_f1: 0.5606
 epoch: 18, train_loss: 0.7541, test_loss: 0.8419, test_f1: 0.5918
 epoch: 19, train_loss: 0.7578, test_loss: 0.8445, test_f1: 0.5969
 epoch: 20, train_loss: 0.7449, test_loss: 0.8230, test_f1: 0.6000
 epoch: 21, train_loss: 0.7291, test_loss: 0.8822, test_f1: 0.5966
 epoch: 22, train_loss: 0.7171, test_loss: 0.8712, test_f1: 0.5713
 epoch: 23, train_loss: 0.7131, test_loss: 0.8587, test_f1: 0.5582
 epoch: 24, train_loss: 0.7000, test_loss: 0.8227, test_f1: 0.5968
 epoch: 25, train_loss: 0.6865, test_loss: 0.8058, test_f1: 0.6124
 epoch: 26, train_loss: 0.6938, test_loss: 0.7750, test_f1: 0.6048
 epoch: 27, train_loss: 0.6915, test_loss: 0.8510, test_f1: 0.6006
 epoch: 28, train_loss: 0.6801, test_loss: 0.9286, test_f1: 0.5720
 epoch: 29, train_loss: 0.6687, test_loss: 0.8944, test_f1: 0.5902
 epoch: 30, train_loss: 0.6476, test_loss: 0.8443, test_f1: 0.6040
 epoch: 31, train_loss: 0.6391, test_loss: 0.8756, test_f1: 0.6160
 epoch: 32, train_loss: 0.6468, test_loss: 0.8337, test_f1: 0.6135
 epoch: 33, train_loss: 0.6228, test_loss: 0.8359, test_f1: 0.6021
 epoch: 34, train_loss: 0.6357, test_loss: 0.8878, test_f1: 0.6139
 epoch: 35, train_loss: 0.6128, test_loss: 0.8796, test_f1: 0.5972
 epoch: 36, train_loss: 0.6092, test_loss: 0.8868, test_f1: 0.6074
 epoch: 37, train_loss: 0.5994, test_loss: 0.9939, test_f1: 0.5886
 epoch: 38, train_loss: 0.5791, test_loss: 0.8830, test_f1: 0.5978
 epoch: 39, train_loss: 0.5882, test_loss: 0.9286, test_f1: 0.5963
 epoch: 40, train_loss: 0.5915, test_loss: 0.8209, test_f1: 0.6184
 epoch: 41, train_loss: 0.5877, test_loss: 0.8927, test_f1: 0.6189
 epoch: 42, train_loss: 0.5655, test_loss: 0.8874, test_f1: 0.6202
 epoch: 43, train_loss: 0.5702, test_loss: 0.8432, test_f1: 0.6342
 epoch: 44, train_loss: 0.5624, test_loss: 0.9299, test_f1: 0.6161
 epoch: 45, train_loss: 0.5493, test_loss: 0.8920, test_f1: 0.6196
 epoch: 46, train_loss: 0.5583, test_loss: 0.8777, test_f1: 0.6342
 epoch: 47, train_loss: 0.5395, test_loss: 0.9200, test_f1: 0.6218
 epoch: 48, train_loss: 0.5225, test_loss: 0.8977, test_f1: 0.6288
 epoch: 49, train_loss: 0.5229, test_loss: 0.9311, test_f1: 0.6260
 epoch: 50, train_loss: 0.5224, test_loss: 0.9572, test_f1: 0.6175
 epoch: 51, train_loss: 0.4892, test_loss: 0.8894, test_f1: 0.6281
 epoch: 52, train_loss: 0.4836, test_loss: 0.9144, test_f1: 0.6367
 epoch: 53, train_loss: 0.4756, test_loss: 0.9336, test_f1: 0.6260
 epoch: 54, train_loss: 0.4583, test_loss: 0.8953, test_f1: 0.6533
 epoch: 55, train_loss: 0.4715, test_loss: 0.9333, test_f1: 0.6329
 epoch: 56, train_loss: 0.4699, test_loss: 0.9770, test_f1: 0.6316
 epoch: 57, train_loss: 0.4577, test_loss: 0.9364, test_f1: 0.6551
 epoch: 58, train_loss: 0.4542, test_loss: 1.0197, test_f1: 0.6380
 epoch: 59, train_loss: 0.4615, test_loss: 0.9883, test_f1: 0.6387
 epoch: 60, train_loss: 0.4455, test_loss: 0.9551, test_f1: 0.6474
 epoch: 61, train_loss: 0.4343, test_loss: 0.9437, test_f1: 0.6393
 epoch: 62, train_loss: 0.4434, test_loss: 0.9572, test_f1: 0.6449
 epoch: 63, train_loss: 0.4439, test_loss: 0.9890, test_f1: 0.6341
 epoch: 64, train_loss: 0.4360, test_loss: 0.9754, test_f1: 0.6561
 epoch: 65, train_loss: 0.4392, test_loss: 1.0013, test_f1: 0.6656
 epoch: 66, train_loss: 0.4419, test_loss: 1.0151, test_f1: 0.6391
 epoch: 67, train_loss: 0.4169, test_loss: 0.9808, test_f1: 0.6625
 epoch: 68, train_loss: 0.4361, test_loss: 0.9692, test_f1: 0.6597
 epoch: 69, train_loss: 0.4214, test_loss: 0.9629, test_f1: 0.6486
 epoch: 70, train_loss: 0.4199, test_loss: 0.9637, test_f1: 0.6598
 epoch: 71, train_loss: 0.4055, test_loss: 0.9714, test_f1: 0.6632
 epoch: 72, train_loss: 0.4118, test_loss: 1.0019, test_f1: 0.6351
 epoch: 73, train_loss: 0.4091, test_loss: 0.9998, test_f1: 0.6338
 epoch: 74, train_loss: 0.3982, test_loss: 0.9817, test_f1: 0.6346
 epoch: 75, train_loss: 0.3956, test_loss: 1.0081, test_f1: 0.6529
 epoch: 76, train_loss: 0.3918, test_loss: 1.0258, test_f1: 0.6573
 epoch: 77, train_loss: 0.4015, test_loss: 1.0239, test_f1: 0.6492
 epoch: 78, train_loss: 0.3975, test_loss: 1.0844, test_f1: 0.6505
 epoch: 79, train_loss: 0.3933, test_loss: 1.0280, test_f1: 0.6483
 epoch: 80, train_loss: 0.3977, test_loss: 0.9987, test_f1: 0.6590
 epoch: 81, train_loss: 0.3819, test_loss: 1.0779, test_f1: 0.6515
 epoch: 82, train_loss: 0.3728, test_loss: 1.1042, test_f1: 0.6402
 epoch: 83, train_loss: 0.3840, test_loss: 1.0750, test_f1: 0.6475
 epoch: 84, train_loss: 0.3853, test_loss: 1.1100, test_f1: 0.6354
 epoch: 85, train_loss: 0.3784, test_loss: 1.0836, test_f1: 0.6394
 epoch: 86, train_loss: 0.3671, test_loss: 1.0516, test_f1: 0.6522
 epoch: 87, train_loss: 0.3595, test_loss: 1.1010, test_f1: 0.6444
 epoch: 88, train_loss: 0.3596, test_loss: 1.1481, test_f1: 0.6424
 epoch: 89, train_loss: 0.3650, test_loss: 1.1272, test_f1: 0.6407
 epoch: 90, train_loss: 0.3668, test_loss: 1.0965, test_f1: 0.6566
 epoch: 91, train_loss: 0.3540, test_loss: 1.0529, test_f1: 0.6488
 epoch: 92, train_loss: 0.3489, test_loss: 1.0826, test_f1: 0.6425
 epoch: 93, train_loss: 0.3498, test_loss: 1.0975, test_f1: 0.6443
 epoch: 94, train_loss: 0.3446, test_loss: 1.0684, test_f1: 0.6662
 epoch: 95, train_loss: 0.3453, test_loss: 1.0866, test_f1: 0.6432
 epoch: 96, train_loss: 0.3514, test_loss: 1.0652, test_f1: 0.6555
 epoch: 97, train_loss: 0.3498, test_loss: 1.1164, test_f1: 0.6583
 epoch: 98, train_loss: 0.3426, test_loss: 1.1053, test_f1: 0.6590
 epoch: 99, train_loss: 0.3402, test_loss: 1.0842, test_f1: 0.6530
##################ITERATION #6 ****************************************
 epoch: 0, train_loss: 1.2138, test_loss: 1.1097, test_f1: 0.4420
 epoch: 1, train_loss: 1.0732, test_loss: 0.9899, test_f1: 0.4994
 epoch: 2, train_loss: 1.0273, test_loss: 0.9700, test_f1: 0.5029
 epoch: 3, train_loss: 0.9984, test_loss: 0.9592, test_f1: 0.4962
 epoch: 4, train_loss: 0.9626, test_loss: 0.9532, test_f1: 0.5133
 epoch: 5, train_loss: 0.9536, test_loss: 0.9333, test_f1: 0.5002
 epoch: 6, train_loss: 0.9446, test_loss: 1.0376, test_f1: 0.4952
 epoch: 7, train_loss: 0.9213, test_loss: 0.9376, test_f1: 0.5250
 epoch: 8, train_loss: 0.8976, test_loss: 1.0078, test_f1: 0.5286
 epoch: 9, train_loss: 0.8903, test_loss: 0.9204, test_f1: 0.5320
 epoch: 10, train_loss: 0.8886, test_loss: 0.9269, test_f1: 0.5371
 epoch: 11, train_loss: 0.8714, test_loss: 0.9219, test_f1: 0.5619
 epoch: 12, train_loss: 0.8504, test_loss: 0.9085, test_f1: 0.5526
 epoch: 13, train_loss: 0.8404, test_loss: 1.0117, test_f1: 0.5662
 epoch: 14, train_loss: 0.8285, test_loss: 0.9585, test_f1: 0.5516
 epoch: 15, train_loss: 0.8213, test_loss: 0.9100, test_f1: 0.5666
 epoch: 16, train_loss: 0.8151, test_loss: 0.8939, test_f1: 0.5849
 epoch: 17, train_loss: 0.8024, test_loss: 0.8947, test_f1: 0.6066
 epoch: 18, train_loss: 0.7750, test_loss: 0.9394, test_f1: 0.5562
 epoch: 19, train_loss: 0.7813, test_loss: 1.2628, test_f1: 0.5603
 epoch: 20, train_loss: 0.7630, test_loss: 0.9388, test_f1: 0.5954
 epoch: 21, train_loss: 0.7525, test_loss: 1.1077, test_f1: 0.5794
 epoch: 22, train_loss: 0.7491, test_loss: 1.1044, test_f1: 0.6007
 epoch: 23, train_loss: 0.7403, test_loss: 0.9823, test_f1: 0.5929
 epoch: 24, train_loss: 0.7203, test_loss: 0.9249, test_f1: 0.5946
 epoch: 25, train_loss: 0.7342, test_loss: 0.8914, test_f1: 0.6051
 epoch: 26, train_loss: 0.7221, test_loss: 0.8873, test_f1: 0.5899
 epoch: 27, train_loss: 0.7116, test_loss: 0.8867, test_f1: 0.5748
 epoch: 28, train_loss: 0.6999, test_loss: 0.9473, test_f1: 0.6019
 epoch: 29, train_loss: 0.6997, test_loss: 0.9363, test_f1: 0.6065
 epoch: 30, train_loss: 0.6765, test_loss: 0.8999, test_f1: 0.6148
 epoch: 31, train_loss: 0.6665, test_loss: 0.9470, test_f1: 0.6135
 epoch: 32, train_loss: 0.6507, test_loss: 0.9489, test_f1: 0.6087
 epoch: 33, train_loss: 0.6584, test_loss: 0.9762, test_f1: 0.5973
 epoch: 34, train_loss: 0.6549, test_loss: 0.9072, test_f1: 0.6338
 epoch: 35, train_loss: 0.6525, test_loss: 0.9377, test_f1: 0.5893
 epoch: 36, train_loss: 0.6339, test_loss: 0.9593, test_f1: 0.5800
 epoch: 37, train_loss: 0.6360, test_loss: 0.9306, test_f1: 0.6076
 epoch: 38, train_loss: 0.6232, test_loss: 0.9137, test_f1: 0.6420
 epoch: 39, train_loss: 0.6211, test_loss: 0.9237, test_f1: 0.6142
 epoch: 40, train_loss: 0.6035, test_loss: 0.9465, test_f1: 0.5863
 epoch: 41, train_loss: 0.6065, test_loss: 0.9258, test_f1: 0.6035
 epoch: 42, train_loss: 0.5988, test_loss: 1.0064, test_f1: 0.5984
 epoch: 43, train_loss: 0.6015, test_loss: 0.9036, test_f1: 0.6124
 epoch: 44, train_loss: 0.5904, test_loss: 0.8741, test_f1: 0.6254
 epoch: 45, train_loss: 0.5751, test_loss: 0.9248, test_f1: 0.6225
 epoch: 46, train_loss: 0.5840, test_loss: 0.9679, test_f1: 0.6033
 epoch: 47, train_loss: 0.5803, test_loss: 0.9195, test_f1: 0.6323
 epoch: 48, train_loss: 0.5531, test_loss: 0.9033, test_f1: 0.6159
 epoch: 49, train_loss: 0.5637, test_loss: 0.9310, test_f1: 0.6389
 epoch: 50, train_loss: 0.5579, test_loss: 0.9163, test_f1: 0.6218
 epoch: 51, train_loss: 0.5229, test_loss: 0.9277, test_f1: 0.6150
 epoch: 52, train_loss: 0.5126, test_loss: 0.8645, test_f1: 0.6241
 epoch: 53, train_loss: 0.5062, test_loss: 0.9084, test_f1: 0.6247
 epoch: 54, train_loss: 0.5047, test_loss: 0.9147, test_f1: 0.6349
 epoch: 55, train_loss: 0.5065, test_loss: 0.8849, test_f1: 0.6417
 epoch: 56, train_loss: 0.4975, test_loss: 0.9668, test_f1: 0.6289
 epoch: 57, train_loss: 0.4887, test_loss: 0.9292, test_f1: 0.6397
 epoch: 58, train_loss: 0.4845, test_loss: 0.9553, test_f1: 0.6402
 epoch: 59, train_loss: 0.4855, test_loss: 0.9602, test_f1: 0.6327
 epoch: 60, train_loss: 0.4913, test_loss: 0.9672, test_f1: 0.6239
 epoch: 61, train_loss: 0.4724, test_loss: 0.9765, test_f1: 0.6443
 epoch: 62, train_loss: 0.4662, test_loss: 0.9896, test_f1: 0.6406
 epoch: 63, train_loss: 0.4740, test_loss: 1.0067, test_f1: 0.6225
 epoch: 64, train_loss: 0.4691, test_loss: 1.0055, test_f1: 0.6303
 epoch: 65, train_loss: 0.4563, test_loss: 1.0363, test_f1: 0.6177
 epoch: 66, train_loss: 0.4616, test_loss: 1.0364, test_f1: 0.6108
 epoch: 67, train_loss: 0.4585, test_loss: 1.0106, test_f1: 0.6163
 epoch: 68, train_loss: 0.4612, test_loss: 1.0159, test_f1: 0.6278
 epoch: 69, train_loss: 0.4487, test_loss: 1.0296, test_f1: 0.6107
 epoch: 70, train_loss: 0.4523, test_loss: 1.0371, test_f1: 0.6145
 epoch: 71, train_loss: 0.4478, test_loss: 0.9976, test_f1: 0.6273
 epoch: 72, train_loss: 0.4436, test_loss: 1.0371, test_f1: 0.6422
 epoch: 73, train_loss: 0.4455, test_loss: 1.0293, test_f1: 0.6322
 epoch: 74, train_loss: 0.4370, test_loss: 1.0357, test_f1: 0.6421
 epoch: 75, train_loss: 0.4215, test_loss: 1.0461, test_f1: 0.6504
 epoch: 76, train_loss: 0.4242, test_loss: 1.1347, test_f1: 0.6334
 epoch: 77, train_loss: 0.4261, test_loss: 1.0995, test_f1: 0.6494
 epoch: 78, train_loss: 0.4412, test_loss: 1.1144, test_f1: 0.6436
 epoch: 79, train_loss: 0.4059, test_loss: 1.0686, test_f1: 0.6479
 epoch: 80, train_loss: 0.4145, test_loss: 1.1268, test_f1: 0.6370
 epoch: 81, train_loss: 0.4131, test_loss: 1.1480, test_f1: 0.6259
 epoch: 82, train_loss: 0.4027, test_loss: 1.1530, test_f1: 0.6542
 epoch: 83, train_loss: 0.3926, test_loss: 1.1327, test_f1: 0.6499
 epoch: 84, train_loss: 0.4065, test_loss: 1.1541, test_f1: 0.6379
 epoch: 85, train_loss: 0.4006, test_loss: 1.0831, test_f1: 0.6530
 epoch: 86, train_loss: 0.4068, test_loss: 1.1737, test_f1: 0.6479
 epoch: 87, train_loss: 0.4025, test_loss: 1.1429, test_f1: 0.6576
 epoch: 88, train_loss: 0.4100, test_loss: 1.1184, test_f1: 0.6591
 epoch: 89, train_loss: 0.4057, test_loss: 1.1570, test_f1: 0.6388
 epoch: 90, train_loss: 0.4027, test_loss: 1.1567, test_f1: 0.6396
 epoch: 91, train_loss: 0.3833, test_loss: 1.1573, test_f1: 0.6559
 epoch: 92, train_loss: 0.3738, test_loss: 1.1682, test_f1: 0.6459
 epoch: 93, train_loss: 0.3794, test_loss: 1.1744, test_f1: 0.6374
 epoch: 94, train_loss: 0.3856, test_loss: 1.2183, test_f1: 0.6489
 epoch: 95, train_loss: 0.3925, test_loss: 1.2024, test_f1: 0.6572
 epoch: 96, train_loss: 0.3816, test_loss: 1.2479, test_f1: 0.6433
 epoch: 97, train_loss: 0.3709, test_loss: 1.2246, test_f1: 0.6542
 epoch: 98, train_loss: 0.3862, test_loss: 1.1613, test_f1: 0.6454
 epoch: 99, train_loss: 0.3747, test_loss: 1.1890, test_f1: 0.6414
##################ITERATION #7 ****************************************
 epoch: 0, train_loss: 1.2239, test_loss: 1.0916, test_f1: 0.4129
 epoch: 1, train_loss: 1.0730, test_loss: 0.9906, test_f1: 0.4618
 epoch: 2, train_loss: 1.0199, test_loss: 0.9696, test_f1: 0.4712
 epoch: 3, train_loss: 0.9980, test_loss: 0.9494, test_f1: 0.4759
 epoch: 4, train_loss: 0.9770, test_loss: 0.9487, test_f1: 0.4964
 epoch: 5, train_loss: 0.9400, test_loss: 0.9515, test_f1: 0.4582
 epoch: 6, train_loss: 0.9275, test_loss: 0.9409, test_f1: 0.5110
 epoch: 7, train_loss: 0.9102, test_loss: 0.9420, test_f1: 0.4906
 epoch: 8, train_loss: 0.8931, test_loss: 0.9175, test_f1: 0.5383
 epoch: 9, train_loss: 0.8793, test_loss: 0.9090, test_f1: 0.5633
 epoch: 10, train_loss: 0.8658, test_loss: 0.8974, test_f1: 0.5400
 epoch: 11, train_loss: 0.8485, test_loss: 0.9249, test_f1: 0.5464
 epoch: 12, train_loss: 0.8390, test_loss: 0.8920, test_f1: 0.5538
 epoch: 13, train_loss: 0.8115, test_loss: 0.8897, test_f1: 0.5809
 epoch: 14, train_loss: 0.8107, test_loss: 0.8996, test_f1: 0.5717
 epoch: 15, train_loss: 0.8006, test_loss: 0.8866, test_f1: 0.5368
 epoch: 16, train_loss: 0.7838, test_loss: 0.9011, test_f1: 0.5877
 epoch: 17, train_loss: 0.7776, test_loss: 0.8544, test_f1: 0.5699
 epoch: 18, train_loss: 0.7666, test_loss: 0.8839, test_f1: 0.5647
 epoch: 19, train_loss: 0.7567, test_loss: 0.8963, test_f1: 0.5791
 epoch: 20, train_loss: 0.7570, test_loss: 0.9103, test_f1: 0.5668
 epoch: 21, train_loss: 0.7379, test_loss: 0.8692, test_f1: 0.5626
 epoch: 22, train_loss: 0.7330, test_loss: 0.8539, test_f1: 0.5748
 epoch: 23, train_loss: 0.7252, test_loss: 0.8520, test_f1: 0.6097
 epoch: 24, train_loss: 0.7114, test_loss: 0.9250, test_f1: 0.5766
 epoch: 25, train_loss: 0.7041, test_loss: 0.8689, test_f1: 0.5857
 epoch: 26, train_loss: 0.7027, test_loss: 0.9330, test_f1: 0.5624
 epoch: 27, train_loss: 0.6957, test_loss: 0.8585, test_f1: 0.5722
 epoch: 28, train_loss: 0.6800, test_loss: 0.8832, test_f1: 0.6033
 epoch: 29, train_loss: 0.6772, test_loss: 0.8710, test_f1: 0.5942
 epoch: 30, train_loss: 0.6420, test_loss: 0.9130, test_f1: 0.5600
 epoch: 31, train_loss: 0.6642, test_loss: 0.8635, test_f1: 0.5817
 epoch: 32, train_loss: 0.6433, test_loss: 0.8611, test_f1: 0.5914
 epoch: 33, train_loss: 0.6339, test_loss: 0.8839, test_f1: 0.6028
 epoch: 34, train_loss: 0.6291, test_loss: 0.8991, test_f1: 0.5843
 epoch: 35, train_loss: 0.6286, test_loss: 0.8451, test_f1: 0.5997
 epoch: 36, train_loss: 0.6180, test_loss: 0.8418, test_f1: 0.5830
 epoch: 37, train_loss: 0.6143, test_loss: 0.9053, test_f1: 0.6010
 epoch: 38, train_loss: 0.6025, test_loss: 0.9123, test_f1: 0.6130
 epoch: 39, train_loss: 0.5971, test_loss: 0.9536, test_f1: 0.6062
 epoch: 40, train_loss: 0.5906, test_loss: 0.9131, test_f1: 0.5920
 epoch: 41, train_loss: 0.5865, test_loss: 0.8651, test_f1: 0.6080
 epoch: 42, train_loss: 0.5755, test_loss: 0.9222, test_f1: 0.6170
 epoch: 43, train_loss: 0.5738, test_loss: 0.9102, test_f1: 0.6161
 epoch: 44, train_loss: 0.5861, test_loss: 0.8895, test_f1: 0.6094
 epoch: 45, train_loss: 0.5605, test_loss: 0.9109, test_f1: 0.6377
 epoch: 46, train_loss: 0.5623, test_loss: 0.9225, test_f1: 0.6088
 epoch: 47, train_loss: 0.5556, test_loss: 0.8831, test_f1: 0.6283
 epoch: 48, train_loss: 0.5392, test_loss: 0.8891, test_f1: 0.6287
 epoch: 49, train_loss: 0.5460, test_loss: 0.9182, test_f1: 0.6003
 epoch: 50, train_loss: 0.5414, test_loss: 0.9600, test_f1: 0.6007
 epoch: 51, train_loss: 0.5086, test_loss: 1.0031, test_f1: 0.6049
 epoch: 52, train_loss: 0.5032, test_loss: 0.9150, test_f1: 0.6208
 epoch: 53, train_loss: 0.5064, test_loss: 0.9691, test_f1: 0.6201
 epoch: 54, train_loss: 0.4979, test_loss: 0.9570, test_f1: 0.6271
 epoch: 55, train_loss: 0.4891, test_loss: 0.9993, test_f1: 0.6190
 epoch: 56, train_loss: 0.4883, test_loss: 0.9235, test_f1: 0.6109
 epoch: 57, train_loss: 0.4754, test_loss: 0.9426, test_f1: 0.6227
 epoch: 58, train_loss: 0.4695, test_loss: 0.9739, test_f1: 0.6421
 epoch: 59, train_loss: 0.4757, test_loss: 1.0042, test_f1: 0.6445
 epoch: 60, train_loss: 0.4548, test_loss: 0.9659, test_f1: 0.6487
 epoch: 61, train_loss: 0.4652, test_loss: 1.0645, test_f1: 0.6134
 epoch: 62, train_loss: 0.4672, test_loss: 0.9622, test_f1: 0.6481
 epoch: 63, train_loss: 0.4548, test_loss: 1.0029, test_f1: 0.6259
 epoch: 64, train_loss: 0.4614, test_loss: 1.0830, test_f1: 0.6114
 epoch: 65, train_loss: 0.4423, test_loss: 0.9634, test_f1: 0.6414
 epoch: 66, train_loss: 0.4408, test_loss: 1.0201, test_f1: 0.6238
 epoch: 67, train_loss: 0.4514, test_loss: 1.1133, test_f1: 0.6246
 epoch: 68, train_loss: 0.4430, test_loss: 1.0871, test_f1: 0.6162
 epoch: 69, train_loss: 0.4300, test_loss: 1.1037, test_f1: 0.6284
 epoch: 70, train_loss: 0.4402, test_loss: 1.0798, test_f1: 0.6109
 epoch: 71, train_loss: 0.4487, test_loss: 1.0536, test_f1: 0.6141
 epoch: 72, train_loss: 0.4520, test_loss: 1.1131, test_f1: 0.6016
 epoch: 73, train_loss: 0.4206, test_loss: 1.0087, test_f1: 0.6350
 epoch: 74, train_loss: 0.4110, test_loss: 1.1011, test_f1: 0.6134
 epoch: 75, train_loss: 0.4447, test_loss: 1.1677, test_f1: 0.6088
 epoch: 76, train_loss: 0.4225, test_loss: 1.1587, test_f1: 0.6192
 epoch: 77, train_loss: 0.4210, test_loss: 1.1271, test_f1: 0.6234
 epoch: 78, train_loss: 0.4209, test_loss: 1.1397, test_f1: 0.6233
 epoch: 79, train_loss: 0.4087, test_loss: 1.0987, test_f1: 0.6338
 epoch: 80, train_loss: 0.4120, test_loss: 1.1399, test_f1: 0.6383
 epoch: 81, train_loss: 0.4039, test_loss: 1.1769, test_f1: 0.6428
 epoch: 82, train_loss: 0.4040, test_loss: 1.1439, test_f1: 0.6435
 epoch: 83, train_loss: 0.3974, test_loss: 1.1293, test_f1: 0.6334
 epoch: 84, train_loss: 0.4082, test_loss: 1.1164, test_f1: 0.6285
 epoch: 85, train_loss: 0.4093, test_loss: 1.1079, test_f1: 0.6442
 epoch: 86, train_loss: 0.4055, test_loss: 1.1461, test_f1: 0.6333
 epoch: 87, train_loss: 0.3880, test_loss: 1.0851, test_f1: 0.6483
 epoch: 88, train_loss: 0.3821, test_loss: 1.2232, test_f1: 0.6386
 epoch: 89, train_loss: 0.3899, test_loss: 1.2140, test_f1: 0.6505
 epoch: 90, train_loss: 0.3942, test_loss: 1.1370, test_f1: 0.6369
 epoch: 91, train_loss: 0.3921, test_loss: 1.2971, test_f1: 0.6223
 epoch: 92, train_loss: 0.3732, test_loss: 1.2127, test_f1: 0.6361
 epoch: 93, train_loss: 0.3754, test_loss: 1.1627, test_f1: 0.6304
 epoch: 94, train_loss: 0.3734, test_loss: 1.2588, test_f1: 0.6287
 epoch: 95, train_loss: 0.3685, test_loss: 1.2676, test_f1: 0.6208
 epoch: 96, train_loss: 0.3687, test_loss: 1.1890, test_f1: 0.6483
 epoch: 97, train_loss: 0.3736, test_loss: 1.3044, test_f1: 0.6300
 epoch: 98, train_loss: 0.3699, test_loss: 1.3312, test_f1: 0.6279
 epoch: 99, train_loss: 0.3595, test_loss: 1.1820, test_f1: 0.6441
##################ITERATION #8 ****************************************
 epoch: 0, train_loss: 1.2238, test_loss: 1.1156, test_f1: 0.3693
 epoch: 1, train_loss: 1.0820, test_loss: 0.9712, test_f1: 0.4855
 epoch: 2, train_loss: 1.0377, test_loss: 0.9670, test_f1: 0.4746
 epoch: 3, train_loss: 1.0088, test_loss: 0.9466, test_f1: 0.4863
 epoch: 4, train_loss: 0.9845, test_loss: 0.9343, test_f1: 0.4653
 epoch: 5, train_loss: 0.9610, test_loss: 0.9226, test_f1: 0.5142
 epoch: 6, train_loss: 0.9403, test_loss: 0.9329, test_f1: 0.5057
 epoch: 7, train_loss: 0.9328, test_loss: 0.9041, test_f1: 0.5275
 epoch: 8, train_loss: 0.9162, test_loss: 0.8827, test_f1: 0.5388
 epoch: 9, train_loss: 0.9065, test_loss: 0.9046, test_f1: 0.5334
 epoch: 10, train_loss: 0.8935, test_loss: 0.9043, test_f1: 0.5592
 epoch: 11, train_loss: 0.8740, test_loss: 0.8953, test_f1: 0.5308
 epoch: 12, train_loss: 0.8755, test_loss: 0.9153, test_f1: 0.5276
 epoch: 13, train_loss: 0.8681, test_loss: 0.9099, test_f1: 0.5637
 epoch: 14, train_loss: 0.8459, test_loss: 0.8867, test_f1: 0.5340
 epoch: 15, train_loss: 0.8326, test_loss: 0.9002, test_f1: 0.5501
 epoch: 16, train_loss: 0.8248, test_loss: 0.8985, test_f1: 0.5737
 epoch: 17, train_loss: 0.8229, test_loss: 0.8891, test_f1: 0.5667
 epoch: 18, train_loss: 0.8101, test_loss: 0.8682, test_f1: 0.5593
 epoch: 19, train_loss: 0.7980, test_loss: 0.8595, test_f1: 0.5576
 epoch: 20, train_loss: 0.8055, test_loss: 0.8790, test_f1: 0.5743
 epoch: 21, train_loss: 0.7896, test_loss: 0.8609, test_f1: 0.5683
 epoch: 22, train_loss: 0.7737, test_loss: 0.8691, test_f1: 0.5796
 epoch: 23, train_loss: 0.7673, test_loss: 0.8992, test_f1: 0.5801
 epoch: 24, train_loss: 0.7566, test_loss: 0.8620, test_f1: 0.5996
 epoch: 25, train_loss: 0.7534, test_loss: 0.8353, test_f1: 0.5894
 epoch: 26, train_loss: 0.7409, test_loss: 0.8625, test_f1: 0.5827
 epoch: 27, train_loss: 0.7343, test_loss: 0.8645, test_f1: 0.5915
 epoch: 28, train_loss: 0.7278, test_loss: 0.8797, test_f1: 0.5950
 epoch: 29, train_loss: 0.7094, test_loss: 0.8538, test_f1: 0.6208
 epoch: 30, train_loss: 0.7152, test_loss: 0.8540, test_f1: 0.6050
 epoch: 31, train_loss: 0.6931, test_loss: 0.8271, test_f1: 0.6029
 epoch: 32, train_loss: 0.6999, test_loss: 0.8356, test_f1: 0.5873
 epoch: 33, train_loss: 0.6911, test_loss: 0.8233, test_f1: 0.5930
 epoch: 34, train_loss: 0.6802, test_loss: 0.8373, test_f1: 0.6152
 epoch: 35, train_loss: 0.6770, test_loss: 0.9084, test_f1: 0.5839
 epoch: 36, train_loss: 0.6714, test_loss: 0.8768, test_f1: 0.5870
 epoch: 37, train_loss: 0.6571, test_loss: 0.8351, test_f1: 0.5973
 epoch: 38, train_loss: 0.6610, test_loss: 0.8731, test_f1: 0.5987
 epoch: 39, train_loss: 0.6641, test_loss: 0.8318, test_f1: 0.6053
 epoch: 40, train_loss: 0.6473, test_loss: 0.8714, test_f1: 0.6047
 epoch: 41, train_loss: 0.6413, test_loss: 0.8677, test_f1: 0.6045
 epoch: 42, train_loss: 0.6354, test_loss: 0.8330, test_f1: 0.6188
 epoch: 43, train_loss: 0.6275, test_loss: 0.8467, test_f1: 0.6335
 epoch: 44, train_loss: 0.6188, test_loss: 0.8445, test_f1: 0.6233
 epoch: 45, train_loss: 0.6185, test_loss: 0.8877, test_f1: 0.5979
 epoch: 46, train_loss: 0.6113, test_loss: 0.8921, test_f1: 0.6114
 epoch: 47, train_loss: 0.5950, test_loss: 0.8877, test_f1: 0.6254
 epoch: 48, train_loss: 0.6011, test_loss: 0.8437, test_f1: 0.6215
 epoch: 49, train_loss: 0.5932, test_loss: 0.8914, test_f1: 0.6312
 epoch: 50, train_loss: 0.5973, test_loss: 0.9262, test_f1: 0.6168
 epoch: 51, train_loss: 0.5772, test_loss: 0.8583, test_f1: 0.6379
 epoch: 52, train_loss: 0.5613, test_loss: 0.8734, test_f1: 0.6276
 epoch: 53, train_loss: 0.5445, test_loss: 0.8878, test_f1: 0.6376
 epoch: 54, train_loss: 0.5419, test_loss: 0.8636, test_f1: 0.6523
 epoch: 55, train_loss: 0.5504, test_loss: 0.9111, test_f1: 0.6203
 epoch: 56, train_loss: 0.5378, test_loss: 0.9253, test_f1: 0.6332
 epoch: 57, train_loss: 0.5382, test_loss: 0.9217, test_f1: 0.6357
 epoch: 58, train_loss: 0.5339, test_loss: 0.8998, test_f1: 0.6433
 epoch: 59, train_loss: 0.5191, test_loss: 0.8756, test_f1: 0.6541
 epoch: 60, train_loss: 0.5327, test_loss: 0.8900, test_f1: 0.6373
 epoch: 61, train_loss: 0.5240, test_loss: 1.0176, test_f1: 0.6143
 epoch: 62, train_loss: 0.5269, test_loss: 0.9087, test_f1: 0.6277
 epoch: 63, train_loss: 0.5147, test_loss: 0.9688, test_f1: 0.6119
 epoch: 64, train_loss: 0.5229, test_loss: 0.9662, test_f1: 0.6062
 epoch: 65, train_loss: 0.5100, test_loss: 0.9533, test_f1: 0.6180
 epoch: 66, train_loss: 0.5014, test_loss: 0.9095, test_f1: 0.6522
 epoch: 67, train_loss: 0.5071, test_loss: 0.9014, test_f1: 0.6500
 epoch: 68, train_loss: 0.4886, test_loss: 0.9267, test_f1: 0.6261
 epoch: 69, train_loss: 0.4929, test_loss: 0.9483, test_f1: 0.6346
 epoch: 70, train_loss: 0.4862, test_loss: 0.9427, test_f1: 0.6455
 epoch: 71, train_loss: 0.5010, test_loss: 0.9421, test_f1: 0.6257
 epoch: 72, train_loss: 0.4785, test_loss: 0.9187, test_f1: 0.6577
 epoch: 73, train_loss: 0.4847, test_loss: 0.9278, test_f1: 0.6355
 epoch: 74, train_loss: 0.4920, test_loss: 0.9702, test_f1: 0.6336
 epoch: 75, train_loss: 0.4841, test_loss: 0.9085, test_f1: 0.6463
 epoch: 76, train_loss: 0.4761, test_loss: 0.9408, test_f1: 0.6548
 epoch: 77, train_loss: 0.4777, test_loss: 0.9487, test_f1: 0.6427
 epoch: 78, train_loss: 0.4796, test_loss: 0.9549, test_f1: 0.6381
 epoch: 79, train_loss: 0.4591, test_loss: 0.9615, test_f1: 0.6400
 epoch: 80, train_loss: 0.4603, test_loss: 0.9141, test_f1: 0.6589
 epoch: 81, train_loss: 0.4624, test_loss: 1.0552, test_f1: 0.6247
 epoch: 82, train_loss: 0.4710, test_loss: 0.9710, test_f1: 0.6342
 epoch: 83, train_loss: 0.4612, test_loss: 0.9473, test_f1: 0.6565
 epoch: 84, train_loss: 0.4532, test_loss: 0.9605, test_f1: 0.6573
 epoch: 85, train_loss: 0.4410, test_loss: 0.9541, test_f1: 0.6663
 epoch: 86, train_loss: 0.4483, test_loss: 0.9773, test_f1: 0.6497
 epoch: 87, train_loss: 0.4407, test_loss: 0.9843, test_f1: 0.6525
 epoch: 88, train_loss: 0.4361, test_loss: 0.9573, test_f1: 0.6617
 epoch: 89, train_loss: 0.4479, test_loss: 0.9753, test_f1: 0.6516
 epoch: 90, train_loss: 0.4347, test_loss: 0.9973, test_f1: 0.6568
 epoch: 91, train_loss: 0.4390, test_loss: 1.0005, test_f1: 0.6533
 epoch: 92, train_loss: 0.4265, test_loss: 0.9545, test_f1: 0.6635
 epoch: 93, train_loss: 0.4231, test_loss: 1.0223, test_f1: 0.6581
 epoch: 94, train_loss: 0.4221, test_loss: 0.9904, test_f1: 0.6469
 epoch: 95, train_loss: 0.4152, test_loss: 0.9912, test_f1: 0.6628
 epoch: 96, train_loss: 0.4188, test_loss: 1.0778, test_f1: 0.6384
 epoch: 97, train_loss: 0.4262, test_loss: 1.0003, test_f1: 0.6368
 epoch: 98, train_loss: 0.4022, test_loss: 0.9771, test_f1: 0.6545
 epoch: 99, train_loss: 0.4121, test_loss: 1.0211, test_f1: 0.6539
##################ITERATION #9 ****************************************
 epoch: 0, train_loss: 1.1861, test_loss: 1.1653, test_f1: 0.3491
 epoch: 1, train_loss: 1.0457, test_loss: 0.9869, test_f1: 0.5046
 epoch: 2, train_loss: 1.0053, test_loss: 0.9784, test_f1: 0.5152
 epoch: 3, train_loss: 0.9665, test_loss: 0.9856, test_f1: 0.5313
 epoch: 4, train_loss: 0.9539, test_loss: 0.9789, test_f1: 0.5209
 epoch: 5, train_loss: 0.9316, test_loss: 0.9669, test_f1: 0.5371
 epoch: 6, train_loss: 0.9174, test_loss: 0.9607, test_f1: 0.5386
 epoch: 7, train_loss: 0.9051, test_loss: 0.9281, test_f1: 0.5750
 epoch: 8, train_loss: 0.8848, test_loss: 0.9328, test_f1: 0.5534
 epoch: 9, train_loss: 0.8706, test_loss: 0.9319, test_f1: 0.5950
 epoch: 10, train_loss: 0.8624, test_loss: 0.9222, test_f1: 0.5703
 epoch: 11, train_loss: 0.8316, test_loss: 0.9235, test_f1: 0.5665
 epoch: 12, train_loss: 0.8194, test_loss: 0.9318, test_f1: 0.5635
 epoch: 13, train_loss: 0.8146, test_loss: 0.9263, test_f1: 0.5769
 epoch: 14, train_loss: 0.8094, test_loss: 0.9331, test_f1: 0.5836
 epoch: 15, train_loss: 0.8006, test_loss: 0.9291, test_f1: 0.5863
 epoch: 16, train_loss: 0.7734, test_loss: 0.9122, test_f1: 0.5808
 epoch: 17, train_loss: 0.7607, test_loss: 0.9301, test_f1: 0.5763
 epoch: 18, train_loss: 0.7523, test_loss: 0.9276, test_f1: 0.5886
 epoch: 19, train_loss: 0.7422, test_loss: 0.9326, test_f1: 0.5703
 epoch: 20, train_loss: 0.7258, test_loss: 0.9146, test_f1: 0.5939
 epoch: 21, train_loss: 0.7195, test_loss: 0.9331, test_f1: 0.6176
 epoch: 22, train_loss: 0.7040, test_loss: 0.8932, test_f1: 0.6218
 epoch: 23, train_loss: 0.6912, test_loss: 0.9170, test_f1: 0.5962
 epoch: 24, train_loss: 0.6807, test_loss: 0.9378, test_f1: 0.5936
 epoch: 25, train_loss: 0.6787, test_loss: 0.9185, test_f1: 0.5864
 epoch: 26, train_loss: 0.6728, test_loss: 0.9160, test_f1: 0.5968
 epoch: 27, train_loss: 0.6719, test_loss: 0.8811, test_f1: 0.5916
 epoch: 28, train_loss: 0.6465, test_loss: 0.9006, test_f1: 0.5951
 epoch: 29, train_loss: 0.6438, test_loss: 0.9237, test_f1: 0.5921
 epoch: 30, train_loss: 0.6466, test_loss: 0.8946, test_f1: 0.6045
 epoch: 31, train_loss: 0.6324, test_loss: 0.9188, test_f1: 0.6131
 epoch: 32, train_loss: 0.6274, test_loss: 0.9153, test_f1: 0.6069
 epoch: 33, train_loss: 0.6165, test_loss: 0.9160, test_f1: 0.5995
 epoch: 34, train_loss: 0.6186, test_loss: 0.9149, test_f1: 0.5972
 epoch: 35, train_loss: 0.6118, test_loss: 0.8817, test_f1: 0.6084
 epoch: 36, train_loss: 0.5936, test_loss: 0.8951, test_f1: 0.6081
 epoch: 37, train_loss: 0.5780, test_loss: 0.9197, test_f1: 0.6155
 epoch: 38, train_loss: 0.5824, test_loss: 0.9137, test_f1: 0.6254
 epoch: 39, train_loss: 0.5779, test_loss: 0.8750, test_f1: 0.5932
 epoch: 40, train_loss: 0.5625, test_loss: 0.8969, test_f1: 0.6174
 epoch: 41, train_loss: 0.5633, test_loss: 0.9283, test_f1: 0.6067
 epoch: 42, train_loss: 0.5610, test_loss: 0.9022, test_f1: 0.6156
 epoch: 43, train_loss: 0.5464, test_loss: 0.9411, test_f1: 0.6046
 epoch: 44, train_loss: 0.5367, test_loss: 0.9478, test_f1: 0.6126
 epoch: 45, train_loss: 0.5336, test_loss: 0.9607, test_f1: 0.6132
 epoch: 46, train_loss: 0.5360, test_loss: 0.9116, test_f1: 0.6342
 epoch: 47, train_loss: 0.5280, test_loss: 0.9135, test_f1: 0.6391
 epoch: 48, train_loss: 0.5219, test_loss: 0.9153, test_f1: 0.6217
 epoch: 49, train_loss: 0.5257, test_loss: 0.9291, test_f1: 0.6281
 epoch: 50, train_loss: 0.5086, test_loss: 0.9592, test_f1: 0.6146
 epoch: 51, train_loss: 0.4847, test_loss: 0.8963, test_f1: 0.6367
 epoch: 52, train_loss: 0.4673, test_loss: 0.9181, test_f1: 0.6303
 epoch: 53, train_loss: 0.4701, test_loss: 0.8888, test_f1: 0.6289
 epoch: 54, train_loss: 0.4720, test_loss: 0.9382, test_f1: 0.6189
 epoch: 55, train_loss: 0.4695, test_loss: 0.9538, test_f1: 0.6188
 epoch: 56, train_loss: 0.4643, test_loss: 0.9463, test_f1: 0.6252
 epoch: 57, train_loss: 0.4594, test_loss: 0.9923, test_f1: 0.6471
 epoch: 58, train_loss: 0.4557, test_loss: 0.9018, test_f1: 0.6533
 epoch: 59, train_loss: 0.4570, test_loss: 0.9170, test_f1: 0.6479
 epoch: 60, train_loss: 0.4497, test_loss: 0.9634, test_f1: 0.6411
 epoch: 61, train_loss: 0.4500, test_loss: 0.9904, test_f1: 0.6369
 epoch: 62, train_loss: 0.4439, test_loss: 0.9924, test_f1: 0.6434
 epoch: 63, train_loss: 0.4291, test_loss: 0.9375, test_f1: 0.6370
 epoch: 64, train_loss: 0.4300, test_loss: 0.9396, test_f1: 0.6432
 epoch: 65, train_loss: 0.4337, test_loss: 0.9309, test_f1: 0.6441
 epoch: 66, train_loss: 0.4230, test_loss: 0.9649, test_f1: 0.6525
 epoch: 67, train_loss: 0.4371, test_loss: 0.9710, test_f1: 0.6391
 epoch: 68, train_loss: 0.4102, test_loss: 0.9445, test_f1: 0.6528
 epoch: 69, train_loss: 0.4164, test_loss: 0.9654, test_f1: 0.6227
 epoch: 70, train_loss: 0.4134, test_loss: 0.9760, test_f1: 0.6188
 epoch: 71, train_loss: 0.4259, test_loss: 0.9338, test_f1: 0.6559
 epoch: 72, train_loss: 0.4082, test_loss: 0.9715, test_f1: 0.6535
 epoch: 73, train_loss: 0.3838, test_loss: 0.9518, test_f1: 0.6457
 epoch: 74, train_loss: 0.3845, test_loss: 0.9678, test_f1: 0.6361
 epoch: 75, train_loss: 0.3953, test_loss: 1.0208, test_f1: 0.6232
 epoch: 76, train_loss: 0.3963, test_loss: 0.9910, test_f1: 0.6385
 epoch: 77, train_loss: 0.3932, test_loss: 1.0000, test_f1: 0.6521
 epoch: 78, train_loss: 0.3847, test_loss: 0.9476, test_f1: 0.6474
 epoch: 79, train_loss: 0.3793, test_loss: 1.0038, test_f1: 0.6406
 epoch: 80, train_loss: 0.3810, test_loss: 1.0071, test_f1: 0.6337
 epoch: 81, train_loss: 0.3746, test_loss: 1.0256, test_f1: 0.6526
 epoch: 82, train_loss: 0.3728, test_loss: 1.0347, test_f1: 0.6348
 epoch: 83, train_loss: 0.3764, test_loss: 1.0897, test_f1: 0.6356
 epoch: 84, train_loss: 0.3666, test_loss: 1.0161, test_f1: 0.6691
 epoch: 85, train_loss: 0.3684, test_loss: 1.0601, test_f1: 0.6484
 epoch: 86, train_loss: 0.3695, test_loss: 1.0249, test_f1: 0.6637
 epoch: 87, train_loss: 0.3680, test_loss: 1.0051, test_f1: 0.6593
 epoch: 88, train_loss: 0.3651, test_loss: 1.0446, test_f1: 0.6673
 epoch: 89, train_loss: 0.3657, test_loss: 1.0775, test_f1: 0.6545
 epoch: 90, train_loss: 0.3459, test_loss: 1.0971, test_f1: 0.6456
 epoch: 91, train_loss: 0.3495, test_loss: 1.1195, test_f1: 0.6209
 epoch: 92, train_loss: 0.3411, test_loss: 1.1127, test_f1: 0.6272
 epoch: 93, train_loss: 0.3383, test_loss: 1.1744, test_f1: 0.6326
 epoch: 94, train_loss: 0.3511, test_loss: 1.1318, test_f1: 0.6329
 epoch: 95, train_loss: 0.3481, test_loss: 1.1430, test_f1: 0.6393
 epoch: 96, train_loss: 0.3357, test_loss: 1.1044, test_f1: 0.6583
 epoch: 97, train_loss: 0.3402, test_loss: 1.0929, test_f1: 0.6434
 epoch: 98, train_loss: 0.3243, test_loss: 1.1010, test_f1: 0.6525
 epoch: 99, train_loss: 0.3253, test_loss: 1.2116, test_f1: 0.6482

Training completed in 882.27 seconds
Best F1: 0.6691 at epoch 84
Mean F1 across iterations: 0.6579  0.0110
========================FINAL RESULTS================================
FEGIN weighted F1: 0.6691  0.0110
python main.py --data ltspice_examples --representation component_pin --model FEGIN --layers 6 --hiddens 128 --batch_size 64 --lr 0.0001 --emb_size 512 --epochs 100 --save_appendix component_pin_L6_H128_BS64_LR0.0001_E512 --no_val
-----



STDERR:
  File "main.py", line 370, in <module>
    main()
  File "main.py", line 254, in main
    dataset = dataset_class(
  File "/home/philip/projects/ltspice_examples_code_repo/Circuit-Completion-Using-GNNs/component_classification_with_link_prediction_head/evaluation/FEGIN/kernel/circuit_datasets.py", line 15, in __init__
    self.data, self.slices = torch.load(self.processed_paths[0])
  File "/home/philip/.local/lib/python3.8/site-packages/torch/serialization.py", line 1040, in load
    warnings.warn(
  File "/usr/lib/python3.8/warnings.py", line 109, in _showwarnmsg
    sw(msg.message, msg.category, msg.filename, msg.lineno,
  File "main.py", line 47, in warn_with_traceback
    traceback.print_stack(file=log)
/home/philip/projects/ltspice_examples_code_repo/Circuit-Completion-Using-GNNs/component_classification_with_link_prediction_head/evaluation/FEGIN/kernel/circuit_datasets.py:15: FutureWarning: You are using `torch.load` with `weights_only=False` (the current default value), which uses the default pickle module implicitly. It is possible to construct malicious pickle data which will execute arbitrary code during unpickling (See https://github.com/pytorch/pytorch/blob/main/SECURITY.md#untrusted-models for more details). In a future release, the default value for `weights_only` will be flipped to `True`. This limits the functions that could be executed during unpickling. Arbitrary objects will no longer be allowed to be loaded via this mode unless they are explicitly allowlisted by the user via `torch.serialization.add_safe_globals`. We recommend you start setting `weights_only=True` for any use case where you don't have full control of the loaded file. Please open an issue on GitHub for any issues related to this experimental feature.
  self.data, self.slices = torch.load(self.processed_paths[0])
