STDOUT:
Results will be saved in /home/philip/projects/ltspice_examples_code_repo/Circuit-Completion-Using-GNNs/component_classification_with_link_prediction_head/evaluation/FEGIN/results/model_FEGIN_dataset_ltspice_examples
Command line input: python main.py --data ltspice_examples --representation component_net --model FEGIN --layers 4 --hiddens 64 --batch_size 256 --lr 0.0001 --emb_size 250 --epochs 100 --save_appendix component_net_L4_H64_BS256_LR0.0001_E250 --no_val
 is saved.
-----
ltspice_examples - FEGIN
Using 4 layers, 64 hidden units, h = 2
Loading component_net representation dataset
ENTERED
Training FEGIN on component_net representation
Train: 3558, Test: 846
##################ITERATION #0 ****************************************
 epoch: 0, train_loss: 1.3697, test_loss: 1.3756, test_f1: 0.2270
 epoch: 1, train_loss: 1.3602, test_loss: 1.3738, test_f1: 0.2270
 epoch: 2, train_loss: 1.3535, test_loss: 1.3686, test_f1: 0.2270
 epoch: 3, train_loss: 1.3456, test_loss: 1.3574, test_f1: 0.2270
 epoch: 4, train_loss: 1.3370, test_loss: 1.3415, test_f1: 0.2270
 epoch: 5, train_loss: 1.3275, test_loss: 1.3280, test_f1: 0.2270
 epoch: 6, train_loss: 1.3181, test_loss: 1.3169, test_f1: 0.2270
 epoch: 7, train_loss: 1.3085, test_loss: 1.3060, test_f1: 0.2270
 epoch: 8, train_loss: 1.2981, test_loss: 1.2960, test_f1: 0.2270
 epoch: 9, train_loss: 1.2872, test_loss: 1.2855, test_f1: 0.2270
 epoch: 10, train_loss: 1.2777, test_loss: 1.2740, test_f1: 0.2270
 epoch: 11, train_loss: 1.2656, test_loss: 1.2624, test_f1: 0.2270
 epoch: 12, train_loss: 1.2544, test_loss: 1.2503, test_f1: 0.2270
 epoch: 13, train_loss: 1.2409, test_loss: 1.2373, test_f1: 0.2295
 epoch: 14, train_loss: 1.2311, test_loss: 1.2262, test_f1: 0.2443
 epoch: 15, train_loss: 1.2223, test_loss: 1.2130, test_f1: 0.2770
 epoch: 16, train_loss: 1.2124, test_loss: 1.2031, test_f1: 0.2830
 epoch: 17, train_loss: 1.2017, test_loss: 1.1926, test_f1: 0.3058
 epoch: 18, train_loss: 1.1918, test_loss: 1.1782, test_f1: 0.3308
 epoch: 19, train_loss: 1.1767, test_loss: 1.1662, test_f1: 0.3350
 epoch: 20, train_loss: 1.1681, test_loss: 1.1498, test_f1: 0.3433
 epoch: 21, train_loss: 1.1556, test_loss: 1.1447, test_f1: 0.3393
 epoch: 22, train_loss: 1.1442, test_loss: 1.1212, test_f1: 0.3672
 epoch: 23, train_loss: 1.1255, test_loss: 1.1098, test_f1: 0.3785
 epoch: 24, train_loss: 1.1197, test_loss: 1.0919, test_f1: 0.4185
 epoch: 25, train_loss: 1.1065, test_loss: 1.0802, test_f1: 0.4381
 epoch: 26, train_loss: 1.0884, test_loss: 1.0644, test_f1: 0.4488
 epoch: 27, train_loss: 1.0746, test_loss: 1.0492, test_f1: 0.4855
 epoch: 28, train_loss: 1.0629, test_loss: 1.0315, test_f1: 0.4961
 epoch: 29, train_loss: 1.0538, test_loss: 1.0251, test_f1: 0.4896
 epoch: 30, train_loss: 1.0314, test_loss: 1.0028, test_f1: 0.4944
 epoch: 31, train_loss: 1.0208, test_loss: 0.9934, test_f1: 0.4923
 epoch: 32, train_loss: 1.0088, test_loss: 0.9822, test_f1: 0.5007
 epoch: 33, train_loss: 0.9928, test_loss: 0.9776, test_f1: 0.4978
 epoch: 34, train_loss: 0.9830, test_loss: 0.9673, test_f1: 0.5021
 epoch: 35, train_loss: 0.9743, test_loss: 0.9502, test_f1: 0.5005
 epoch: 36, train_loss: 0.9702, test_loss: 0.9411, test_f1: 0.5096
 epoch: 37, train_loss: 0.9551, test_loss: 0.9366, test_f1: 0.5235
 epoch: 38, train_loss: 0.9443, test_loss: 0.9349, test_f1: 0.5060
 epoch: 39, train_loss: 0.9419, test_loss: 0.9228, test_f1: 0.5083
 epoch: 40, train_loss: 0.9248, test_loss: 0.9227, test_f1: 0.5042
 epoch: 41, train_loss: 0.9216, test_loss: 0.9115, test_f1: 0.5217
 epoch: 42, train_loss: 0.9169, test_loss: 0.9262, test_f1: 0.5181
 epoch: 43, train_loss: 0.9080, test_loss: 0.9405, test_f1: 0.5001
 epoch: 44, train_loss: 0.9018, test_loss: 0.8967, test_f1: 0.5169
 epoch: 45, train_loss: 0.8911, test_loss: 0.9180, test_f1: 0.5079
 epoch: 46, train_loss: 0.8904, test_loss: 0.8944, test_f1: 0.5177
 epoch: 47, train_loss: 0.8880, test_loss: 0.9100, test_f1: 0.5097
 epoch: 48, train_loss: 0.8855, test_loss: 0.8891, test_f1: 0.5366
 epoch: 49, train_loss: 0.8788, test_loss: 0.9026, test_f1: 0.5243
 epoch: 50, train_loss: 0.8675, test_loss: 0.8842, test_f1: 0.5351
 epoch: 51, train_loss: 0.8704, test_loss: 0.8858, test_f1: 0.5337
 epoch: 52, train_loss: 0.8601, test_loss: 0.8944, test_f1: 0.5200
 epoch: 53, train_loss: 0.8569, test_loss: 0.8941, test_f1: 0.5189
 epoch: 54, train_loss: 0.8573, test_loss: 0.8961, test_f1: 0.5087
 epoch: 55, train_loss: 0.8519, test_loss: 0.8878, test_f1: 0.5172
 epoch: 56, train_loss: 0.8583, test_loss: 0.8906, test_f1: 0.5098
 epoch: 57, train_loss: 0.8609, test_loss: 0.8936, test_f1: 0.5160
 epoch: 58, train_loss: 0.8563, test_loss: 0.8878, test_f1: 0.5175
 epoch: 59, train_loss: 0.8577, test_loss: 0.8944, test_f1: 0.5216
 epoch: 60, train_loss: 0.8415, test_loss: 0.8889, test_f1: 0.5129
 epoch: 61, train_loss: 0.8506, test_loss: 0.9001, test_f1: 0.5322
 epoch: 62, train_loss: 0.8437, test_loss: 0.8896, test_f1: 0.5184
 epoch: 63, train_loss: 0.8388, test_loss: 0.8894, test_f1: 0.5198
 epoch: 64, train_loss: 0.8400, test_loss: 0.8964, test_f1: 0.5118
 epoch: 65, train_loss: 0.8377, test_loss: 0.9050, test_f1: 0.5088
 epoch: 66, train_loss: 0.8298, test_loss: 0.8886, test_f1: 0.5221
 epoch: 67, train_loss: 0.8336, test_loss: 0.8913, test_f1: 0.5351
 epoch: 68, train_loss: 0.8314, test_loss: 0.8945, test_f1: 0.5245
 epoch: 69, train_loss: 0.8257, test_loss: 0.8938, test_f1: 0.5424
 epoch: 70, train_loss: 0.8293, test_loss: 0.8890, test_f1: 0.5414
 epoch: 71, train_loss: 0.8302, test_loss: 0.9024, test_f1: 0.5296
 epoch: 72, train_loss: 0.8255, test_loss: 0.8896, test_f1: 0.5366
 epoch: 73, train_loss: 0.8256, test_loss: 0.9022, test_f1: 0.5197
 epoch: 74, train_loss: 0.8330, test_loss: 0.8965, test_f1: 0.5228
 epoch: 75, train_loss: 0.8225, test_loss: 0.8924, test_f1: 0.5426
 epoch: 76, train_loss: 0.8226, test_loss: 0.9010, test_f1: 0.5337
 epoch: 77, train_loss: 0.8298, test_loss: 0.8839, test_f1: 0.5409
 epoch: 78, train_loss: 0.8205, test_loss: 0.8906, test_f1: 0.5128
 epoch: 79, train_loss: 0.8212, test_loss: 0.9064, test_f1: 0.5334
 epoch: 80, train_loss: 0.8251, test_loss: 0.8888, test_f1: 0.5397
 epoch: 81, train_loss: 0.8170, test_loss: 0.9025, test_f1: 0.5293
 epoch: 82, train_loss: 0.8155, test_loss: 0.8981, test_f1: 0.5389
 epoch: 83, train_loss: 0.8184, test_loss: 0.9033, test_f1: 0.5322
 epoch: 84, train_loss: 0.8101, test_loss: 0.9120, test_f1: 0.5325
 epoch: 85, train_loss: 0.8129, test_loss: 0.8958, test_f1: 0.5443
 epoch: 86, train_loss: 0.8156, test_loss: 0.8973, test_f1: 0.5429
 epoch: 87, train_loss: 0.7991, test_loss: 0.9019, test_f1: 0.5343
 epoch: 88, train_loss: 0.8155, test_loss: 0.8885, test_f1: 0.5437
 epoch: 89, train_loss: 0.8056, test_loss: 0.8963, test_f1: 0.5351
 epoch: 90, train_loss: 0.8087, test_loss: 0.8927, test_f1: 0.5423
 epoch: 91, train_loss: 0.7999, test_loss: 0.9009, test_f1: 0.5382
 epoch: 92, train_loss: 0.8037, test_loss: 0.8970, test_f1: 0.5375
 epoch: 93, train_loss: 0.8002, test_loss: 0.8881, test_f1: 0.5395
 epoch: 94, train_loss: 0.7951, test_loss: 0.8927, test_f1: 0.5412
 epoch: 95, train_loss: 0.7960, test_loss: 0.9049, test_f1: 0.5333
 epoch: 96, train_loss: 0.7949, test_loss: 0.9145, test_f1: 0.5291
 epoch: 97, train_loss: 0.7881, test_loss: 0.8889, test_f1: 0.5421
 epoch: 98, train_loss: 0.7906, test_loss: 0.9084, test_f1: 0.5324
 epoch: 99, train_loss: 0.8001, test_loss: 0.8919, test_f1: 0.5468
##################ITERATION #1 ****************************************
 epoch: 0, train_loss: 1.3298, test_loss: 1.3593, test_f1: 0.2270
 epoch: 1, train_loss: 1.3062, test_loss: 1.3448, test_f1: 0.2270
 epoch: 2, train_loss: 1.2910, test_loss: 1.3257, test_f1: 0.2270
 epoch: 3, train_loss: 1.2788, test_loss: 1.2994, test_f1: 0.2270
 epoch: 4, train_loss: 1.2665, test_loss: 1.2727, test_f1: 0.2270
 epoch: 5, train_loss: 1.2527, test_loss: 1.2501, test_f1: 0.2270
 epoch: 6, train_loss: 1.2409, test_loss: 1.2312, test_f1: 0.2728
 epoch: 7, train_loss: 1.2278, test_loss: 1.2139, test_f1: 0.2853
 epoch: 8, train_loss: 1.2143, test_loss: 1.1999, test_f1: 0.3069
 epoch: 9, train_loss: 1.2005, test_loss: 1.1813, test_f1: 0.3319
 epoch: 10, train_loss: 1.1842, test_loss: 1.1661, test_f1: 0.3690
 epoch: 11, train_loss: 1.1702, test_loss: 1.1464, test_f1: 0.4060
 epoch: 12, train_loss: 1.1494, test_loss: 1.1226, test_f1: 0.4161
 epoch: 13, train_loss: 1.1352, test_loss: 1.1069, test_f1: 0.4232
 epoch: 14, train_loss: 1.1139, test_loss: 1.0835, test_f1: 0.4219
 epoch: 15, train_loss: 1.0998, test_loss: 1.0633, test_f1: 0.4459
 epoch: 16, train_loss: 1.0798, test_loss: 1.0454, test_f1: 0.4703
 epoch: 17, train_loss: 1.0652, test_loss: 1.0270, test_f1: 0.4783
 epoch: 18, train_loss: 1.0510, test_loss: 1.0190, test_f1: 0.4801
 epoch: 19, train_loss: 1.0306, test_loss: 1.0049, test_f1: 0.4756
 epoch: 20, train_loss: 1.0202, test_loss: 0.9897, test_f1: 0.4823
 epoch: 21, train_loss: 1.0074, test_loss: 0.9956, test_f1: 0.4834
 epoch: 22, train_loss: 0.9961, test_loss: 0.9682, test_f1: 0.4974
 epoch: 23, train_loss: 0.9957, test_loss: 0.9593, test_f1: 0.5034
 epoch: 24, train_loss: 0.9777, test_loss: 0.9623, test_f1: 0.5010
 epoch: 25, train_loss: 0.9664, test_loss: 0.9458, test_f1: 0.5023
 epoch: 26, train_loss: 0.9588, test_loss: 0.9327, test_f1: 0.5043
 epoch: 27, train_loss: 0.9520, test_loss: 0.9577, test_f1: 0.5053
 epoch: 28, train_loss: 0.9397, test_loss: 0.9260, test_f1: 0.5055
 epoch: 29, train_loss: 0.9306, test_loss: 0.9691, test_f1: 0.4890
 epoch: 30, train_loss: 0.9266, test_loss: 0.9224, test_f1: 0.5099
 epoch: 31, train_loss: 0.9205, test_loss: 0.9219, test_f1: 0.5160
 epoch: 32, train_loss: 0.9093, test_loss: 0.9338, test_f1: 0.5202
 epoch: 33, train_loss: 0.9120, test_loss: 0.9584, test_f1: 0.4998
 epoch: 34, train_loss: 0.9016, test_loss: 0.9215, test_f1: 0.5242
 epoch: 35, train_loss: 0.9003, test_loss: 0.9072, test_f1: 0.5290
 epoch: 36, train_loss: 0.8978, test_loss: 0.9327, test_f1: 0.5253
 epoch: 37, train_loss: 0.8916, test_loss: 0.9599, test_f1: 0.5167
 epoch: 38, train_loss: 0.8885, test_loss: 0.9077, test_f1: 0.5156
 epoch: 39, train_loss: 0.8852, test_loss: 0.9045, test_f1: 0.5299
 epoch: 40, train_loss: 0.8740, test_loss: 0.9011, test_f1: 0.5289
 epoch: 41, train_loss: 0.8719, test_loss: 0.9415, test_f1: 0.5364
 epoch: 42, train_loss: 0.8668, test_loss: 1.1250, test_f1: 0.4794
 epoch: 43, train_loss: 0.8629, test_loss: 0.8948, test_f1: 0.5294
 epoch: 44, train_loss: 0.8635, test_loss: 0.9042, test_f1: 0.5284
 epoch: 45, train_loss: 0.8593, test_loss: 0.9090, test_f1: 0.5267
 epoch: 46, train_loss: 0.8503, test_loss: 1.0040, test_f1: 0.5038
 epoch: 47, train_loss: 0.8524, test_loss: 0.9019, test_f1: 0.5247
 epoch: 48, train_loss: 0.8456, test_loss: 0.8903, test_f1: 0.5269
 epoch: 49, train_loss: 0.8511, test_loss: 0.9421, test_f1: 0.5255
 epoch: 50, train_loss: 0.8478, test_loss: 0.8930, test_f1: 0.5411
 epoch: 51, train_loss: 0.8347, test_loss: 0.9281, test_f1: 0.5313
 epoch: 52, train_loss: 0.8286, test_loss: 0.8985, test_f1: 0.5463
 epoch: 53, train_loss: 0.8312, test_loss: 0.8914, test_f1: 0.5444
 epoch: 54, train_loss: 0.8313, test_loss: 0.9116, test_f1: 0.5429
 epoch: 55, train_loss: 0.8275, test_loss: 0.9189, test_f1: 0.5453
 epoch: 56, train_loss: 0.8309, test_loss: 0.9019, test_f1: 0.5544
 epoch: 57, train_loss: 0.8264, test_loss: 0.9046, test_f1: 0.5534
 epoch: 58, train_loss: 0.8215, test_loss: 0.9311, test_f1: 0.5471
 epoch: 59, train_loss: 0.8188, test_loss: 0.8922, test_f1: 0.5508
 epoch: 60, train_loss: 0.8233, test_loss: 0.9121, test_f1: 0.5429
 epoch: 61, train_loss: 0.8105, test_loss: 0.9287, test_f1: 0.5556
 epoch: 62, train_loss: 0.8123, test_loss: 0.9012, test_f1: 0.5543
 epoch: 63, train_loss: 0.8156, test_loss: 0.9012, test_f1: 0.5425
 epoch: 64, train_loss: 0.8119, test_loss: 0.9148, test_f1: 0.5448
 epoch: 65, train_loss: 0.8177, test_loss: 0.9240, test_f1: 0.5464
 epoch: 66, train_loss: 0.8129, test_loss: 0.9010, test_f1: 0.5449
 epoch: 67, train_loss: 0.8069, test_loss: 0.9152, test_f1: 0.5485
 epoch: 68, train_loss: 0.8118, test_loss: 0.9033, test_f1: 0.5525
 epoch: 69, train_loss: 0.8089, test_loss: 0.9075, test_f1: 0.5460
 epoch: 70, train_loss: 0.8094, test_loss: 0.9100, test_f1: 0.5443
 epoch: 71, train_loss: 0.8106, test_loss: 0.9078, test_f1: 0.5340
 epoch: 72, train_loss: 0.8065, test_loss: 0.9063, test_f1: 0.5323
 epoch: 73, train_loss: 0.8076, test_loss: 0.9005, test_f1: 0.5396
 epoch: 74, train_loss: 0.7982, test_loss: 0.8908, test_f1: 0.5446
 epoch: 75, train_loss: 0.7977, test_loss: 0.9036, test_f1: 0.5349
 epoch: 76, train_loss: 0.8061, test_loss: 0.9026, test_f1: 0.5464
 epoch: 77, train_loss: 0.7970, test_loss: 0.9195, test_f1: 0.5457
 epoch: 78, train_loss: 0.7937, test_loss: 0.9084, test_f1: 0.5448
 epoch: 79, train_loss: 0.7962, test_loss: 0.9216, test_f1: 0.5508
 epoch: 80, train_loss: 0.7948, test_loss: 0.9034, test_f1: 0.5430
 epoch: 81, train_loss: 0.7970, test_loss: 0.9333, test_f1: 0.5398
 epoch: 82, train_loss: 0.7900, test_loss: 0.9085, test_f1: 0.5428
 epoch: 83, train_loss: 0.7857, test_loss: 0.9334, test_f1: 0.5316
 epoch: 84, train_loss: 0.7862, test_loss: 0.8994, test_f1: 0.5376
 epoch: 85, train_loss: 0.7878, test_loss: 0.9127, test_f1: 0.5462
 epoch: 86, train_loss: 0.7866, test_loss: 0.9501, test_f1: 0.5360
 epoch: 87, train_loss: 0.7920, test_loss: 0.9104, test_f1: 0.5393
 epoch: 88, train_loss: 0.7863, test_loss: 0.9370, test_f1: 0.5312
 epoch: 89, train_loss: 0.7823, test_loss: 0.9076, test_f1: 0.5450
 epoch: 90, train_loss: 0.7808, test_loss: 0.9046, test_f1: 0.5477
 epoch: 91, train_loss: 0.7823, test_loss: 0.9115, test_f1: 0.5417
 epoch: 92, train_loss: 0.7818, test_loss: 0.9320, test_f1: 0.5467
 epoch: 93, train_loss: 0.7702, test_loss: 0.9126, test_f1: 0.5461
 epoch: 94, train_loss: 0.7823, test_loss: 0.9442, test_f1: 0.5352
 epoch: 95, train_loss: 0.7784, test_loss: 0.9225, test_f1: 0.5389
 epoch: 96, train_loss: 0.7846, test_loss: 0.9836, test_f1: 0.5185
 epoch: 97, train_loss: 0.7729, test_loss: 0.9141, test_f1: 0.5309
 epoch: 98, train_loss: 0.7746, test_loss: 0.9241, test_f1: 0.5458
 epoch: 99, train_loss: 0.7880, test_loss: 0.9119, test_f1: 0.5464
##################ITERATION #2 ****************************************
 epoch: 0, train_loss: 1.3157, test_loss: 1.3423, test_f1: 0.2270
 epoch: 1, train_loss: 1.2800, test_loss: 1.3266, test_f1: 0.2270
 epoch: 2, train_loss: 1.2659, test_loss: 1.3085, test_f1: 0.2270
 epoch: 3, train_loss: 1.2461, test_loss: 1.2760, test_f1: 0.2344
 epoch: 4, train_loss: 1.2314, test_loss: 1.2325, test_f1: 0.3110
 epoch: 5, train_loss: 1.2147, test_loss: 1.1972, test_f1: 0.3481
 epoch: 6, train_loss: 1.1972, test_loss: 1.1690, test_f1: 0.3765
 epoch: 7, train_loss: 1.1766, test_loss: 1.1474, test_f1: 0.4193
 epoch: 8, train_loss: 1.1646, test_loss: 1.1290, test_f1: 0.4346
 epoch: 9, train_loss: 1.1449, test_loss: 1.1116, test_f1: 0.4319
 epoch: 10, train_loss: 1.1270, test_loss: 1.0923, test_f1: 0.4322
 epoch: 11, train_loss: 1.1119, test_loss: 1.0786, test_f1: 0.4285
 epoch: 12, train_loss: 1.0968, test_loss: 1.0605, test_f1: 0.4350
 epoch: 13, train_loss: 1.0802, test_loss: 1.0465, test_f1: 0.4376
 epoch: 14, train_loss: 1.0641, test_loss: 1.0312, test_f1: 0.4430
 epoch: 15, train_loss: 1.0518, test_loss: 1.0224, test_f1: 0.4420
 epoch: 16, train_loss: 1.0350, test_loss: 1.0108, test_f1: 0.4500
 epoch: 17, train_loss: 1.0220, test_loss: 0.9949, test_f1: 0.4577
 epoch: 18, train_loss: 1.0097, test_loss: 0.9840, test_f1: 0.4623
 epoch: 19, train_loss: 0.9953, test_loss: 0.9733, test_f1: 0.4679
 epoch: 20, train_loss: 0.9861, test_loss: 0.9636, test_f1: 0.4648
 epoch: 21, train_loss: 0.9723, test_loss: 0.9535, test_f1: 0.4728
 epoch: 22, train_loss: 0.9684, test_loss: 0.9413, test_f1: 0.4848
 epoch: 23, train_loss: 0.9557, test_loss: 0.9344, test_f1: 0.4784
 epoch: 24, train_loss: 0.9470, test_loss: 0.9330, test_f1: 0.5101
 epoch: 25, train_loss: 0.9369, test_loss: 0.9284, test_f1: 0.5055
 epoch: 26, train_loss: 0.9317, test_loss: 0.9232, test_f1: 0.5017
 epoch: 27, train_loss: 0.9189, test_loss: 0.9235, test_f1: 0.5146
 epoch: 28, train_loss: 0.9265, test_loss: 0.9207, test_f1: 0.5087
 epoch: 29, train_loss: 0.9155, test_loss: 0.9225, test_f1: 0.5017
 epoch: 30, train_loss: 0.9107, test_loss: 0.9157, test_f1: 0.5080
 epoch: 31, train_loss: 0.9001, test_loss: 0.9176, test_f1: 0.4966
 epoch: 32, train_loss: 0.8961, test_loss: 0.9182, test_f1: 0.5048
 epoch: 33, train_loss: 0.8904, test_loss: 0.9130, test_f1: 0.5057
 epoch: 34, train_loss: 0.8889, test_loss: 0.9131, test_f1: 0.5082
 epoch: 35, train_loss: 0.8790, test_loss: 0.9173, test_f1: 0.5094
 epoch: 36, train_loss: 0.8816, test_loss: 0.9234, test_f1: 0.5209
 epoch: 37, train_loss: 0.8671, test_loss: 0.9342, test_f1: 0.5029
 epoch: 38, train_loss: 0.8729, test_loss: 0.9161, test_f1: 0.5094
 epoch: 39, train_loss: 0.8656, test_loss: 0.9144, test_f1: 0.5148
 epoch: 40, train_loss: 0.8538, test_loss: 0.9164, test_f1: 0.5090
 epoch: 41, train_loss: 0.8544, test_loss: 0.9232, test_f1: 0.5114
 epoch: 42, train_loss: 0.8588, test_loss: 0.9275, test_f1: 0.5135
 epoch: 43, train_loss: 0.8552, test_loss: 0.9288, test_f1: 0.5179
 epoch: 44, train_loss: 0.8425, test_loss: 0.9175, test_f1: 0.5201
 epoch: 45, train_loss: 0.8430, test_loss: 0.9125, test_f1: 0.5247
 epoch: 46, train_loss: 0.8408, test_loss: 0.9064, test_f1: 0.5212
 epoch: 47, train_loss: 0.8346, test_loss: 0.9242, test_f1: 0.5320
 epoch: 48, train_loss: 0.8340, test_loss: 0.9281, test_f1: 0.5337
 epoch: 49, train_loss: 0.8376, test_loss: 0.9260, test_f1: 0.5179
 epoch: 50, train_loss: 0.8363, test_loss: 0.9165, test_f1: 0.5320
 epoch: 51, train_loss: 0.8264, test_loss: 0.9208, test_f1: 0.5238
 epoch: 52, train_loss: 0.8222, test_loss: 0.9301, test_f1: 0.5247
 epoch: 53, train_loss: 0.8196, test_loss: 0.9349, test_f1: 0.5219
 epoch: 54, train_loss: 0.8189, test_loss: 0.9207, test_f1: 0.5235
 epoch: 55, train_loss: 0.8254, test_loss: 0.9246, test_f1: 0.5262
 epoch: 56, train_loss: 0.8199, test_loss: 0.9272, test_f1: 0.5207
 epoch: 57, train_loss: 0.8115, test_loss: 0.9285, test_f1: 0.5209
 epoch: 58, train_loss: 0.8066, test_loss: 0.9294, test_f1: 0.5202
 epoch: 59, train_loss: 0.8074, test_loss: 0.9357, test_f1: 0.5275
 epoch: 60, train_loss: 0.8223, test_loss: 0.9299, test_f1: 0.5239
 epoch: 61, train_loss: 0.8115, test_loss: 0.9332, test_f1: 0.5245
 epoch: 62, train_loss: 0.8090, test_loss: 0.9359, test_f1: 0.5215
 epoch: 63, train_loss: 0.8054, test_loss: 0.9391, test_f1: 0.5231
 epoch: 64, train_loss: 0.8007, test_loss: 0.9362, test_f1: 0.5250
 epoch: 65, train_loss: 0.7982, test_loss: 0.9299, test_f1: 0.5269
 epoch: 66, train_loss: 0.7941, test_loss: 0.9258, test_f1: 0.5284
 epoch: 67, train_loss: 0.7979, test_loss: 0.9273, test_f1: 0.5255
 epoch: 68, train_loss: 0.7968, test_loss: 0.9426, test_f1: 0.5241
 epoch: 69, train_loss: 0.8018, test_loss: 0.9434, test_f1: 0.5224
 epoch: 70, train_loss: 0.7887, test_loss: 0.9424, test_f1: 0.5262
 epoch: 71, train_loss: 0.7951, test_loss: 0.9397, test_f1: 0.5250
 epoch: 72, train_loss: 0.7940, test_loss: 0.9444, test_f1: 0.5333
 epoch: 73, train_loss: 0.7911, test_loss: 0.9362, test_f1: 0.5363
 epoch: 74, train_loss: 0.7901, test_loss: 0.9427, test_f1: 0.5230
 epoch: 75, train_loss: 0.7923, test_loss: 0.9374, test_f1: 0.5370
 epoch: 76, train_loss: 0.7794, test_loss: 0.9406, test_f1: 0.5321
 epoch: 77, train_loss: 0.7858, test_loss: 0.9421, test_f1: 0.5414
 epoch: 78, train_loss: 0.7848, test_loss: 0.9448, test_f1: 0.5435
 epoch: 79, train_loss: 0.7924, test_loss: 0.9410, test_f1: 0.5428
 epoch: 80, train_loss: 0.7910, test_loss: 0.9407, test_f1: 0.5450
 epoch: 81, train_loss: 0.7801, test_loss: 0.9440, test_f1: 0.5425
 epoch: 82, train_loss: 0.7906, test_loss: 0.9390, test_f1: 0.5444
 epoch: 83, train_loss: 0.7818, test_loss: 0.9557, test_f1: 0.5455
 epoch: 84, train_loss: 0.7748, test_loss: 0.9397, test_f1: 0.5453
 epoch: 85, train_loss: 0.7779, test_loss: 0.9428, test_f1: 0.5415
 epoch: 86, train_loss: 0.7779, test_loss: 0.9417, test_f1: 0.5485
 epoch: 87, train_loss: 0.7796, test_loss: 0.9453, test_f1: 0.5415
 epoch: 88, train_loss: 0.7687, test_loss: 0.9362, test_f1: 0.5442
 epoch: 89, train_loss: 0.7753, test_loss: 0.9365, test_f1: 0.5450
 epoch: 90, train_loss: 0.7695, test_loss: 0.9493, test_f1: 0.5410
 epoch: 91, train_loss: 0.7645, test_loss: 0.9438, test_f1: 0.5500
 epoch: 92, train_loss: 0.7674, test_loss: 0.9512, test_f1: 0.5476
 epoch: 93, train_loss: 0.7806, test_loss: 0.9404, test_f1: 0.5478
 epoch: 94, train_loss: 0.7688, test_loss: 0.9395, test_f1: 0.5488
 epoch: 95, train_loss: 0.7647, test_loss: 0.9466, test_f1: 0.5534
 epoch: 96, train_loss: 0.7598, test_loss: 0.9469, test_f1: 0.5525
 epoch: 97, train_loss: 0.7630, test_loss: 0.9550, test_f1: 0.5440
 epoch: 98, train_loss: 0.7567, test_loss: 0.9537, test_f1: 0.5471
 epoch: 99, train_loss: 0.7676, test_loss: 0.9492, test_f1: 0.5423
##################ITERATION #3 ****************************************
 epoch: 0, train_loss: 1.2920, test_loss: 1.3254, test_f1: 0.2270
 epoch: 1, train_loss: 1.2609, test_loss: 1.3146, test_f1: 0.2270
 epoch: 2, train_loss: 1.2486, test_loss: 1.2866, test_f1: 0.2270
 epoch: 3, train_loss: 1.2368, test_loss: 1.2463, test_f1: 0.2270
 epoch: 4, train_loss: 1.2187, test_loss: 1.2120, test_f1: 0.2938
 epoch: 5, train_loss: 1.2066, test_loss: 1.1874, test_f1: 0.3131
 epoch: 6, train_loss: 1.1962, test_loss: 1.1672, test_f1: 0.3835
 epoch: 7, train_loss: 1.1739, test_loss: 1.1487, test_f1: 0.4026
 epoch: 8, train_loss: 1.1653, test_loss: 1.1299, test_f1: 0.4277
 epoch: 9, train_loss: 1.1513, test_loss: 1.1121, test_f1: 0.4477
 epoch: 10, train_loss: 1.1382, test_loss: 1.0925, test_f1: 0.4572
 epoch: 11, train_loss: 1.1181, test_loss: 1.0764, test_f1: 0.4626
 epoch: 12, train_loss: 1.0983, test_loss: 1.0590, test_f1: 0.4661
 epoch: 13, train_loss: 1.0873, test_loss: 1.0377, test_f1: 0.4715
 epoch: 14, train_loss: 1.0735, test_loss: 1.0226, test_f1: 0.4776
 epoch: 15, train_loss: 1.0547, test_loss: 1.0099, test_f1: 0.4820
 epoch: 16, train_loss: 1.0362, test_loss: 0.9888, test_f1: 0.4996
 epoch: 17, train_loss: 1.0299, test_loss: 0.9778, test_f1: 0.4979
 epoch: 18, train_loss: 1.0124, test_loss: 0.9665, test_f1: 0.4955
 epoch: 19, train_loss: 1.0002, test_loss: 0.9521, test_f1: 0.5016
 epoch: 20, train_loss: 0.9899, test_loss: 0.9417, test_f1: 0.4980
 epoch: 21, train_loss: 0.9762, test_loss: 0.9356, test_f1: 0.5076
 epoch: 22, train_loss: 0.9629, test_loss: 0.9316, test_f1: 0.5052
 epoch: 23, train_loss: 0.9574, test_loss: 0.9283, test_f1: 0.5076
 epoch: 24, train_loss: 0.9416, test_loss: 0.9161, test_f1: 0.5286
 epoch: 25, train_loss: 0.9429, test_loss: 0.9098, test_f1: 0.5128
 epoch: 26, train_loss: 0.9397, test_loss: 0.9169, test_f1: 0.5140
 epoch: 27, train_loss: 0.9208, test_loss: 0.9119, test_f1: 0.5145
 epoch: 28, train_loss: 0.9261, test_loss: 0.9126, test_f1: 0.5311
 epoch: 29, train_loss: 0.9208, test_loss: 0.9065, test_f1: 0.5288
 epoch: 30, train_loss: 0.9087, test_loss: 0.8993, test_f1: 0.5284
 epoch: 31, train_loss: 0.8997, test_loss: 0.9044, test_f1: 0.5277
 epoch: 32, train_loss: 0.8930, test_loss: 0.8971, test_f1: 0.5310
 epoch: 33, train_loss: 0.8877, test_loss: 0.8943, test_f1: 0.5325
 epoch: 34, train_loss: 0.8885, test_loss: 0.9035, test_f1: 0.5321
 epoch: 35, train_loss: 0.8806, test_loss: 0.8947, test_f1: 0.5351
 epoch: 36, train_loss: 0.8723, test_loss: 0.9014, test_f1: 0.5328
 epoch: 37, train_loss: 0.8773, test_loss: 0.8951, test_f1: 0.5332
 epoch: 38, train_loss: 0.8785, test_loss: 0.8795, test_f1: 0.5319
 epoch: 39, train_loss: 0.8628, test_loss: 0.8948, test_f1: 0.5338
 epoch: 40, train_loss: 0.8559, test_loss: 0.8864, test_f1: 0.5353
 epoch: 41, train_loss: 0.8536, test_loss: 0.8817, test_f1: 0.5466
 epoch: 42, train_loss: 0.8565, test_loss: 0.9036, test_f1: 0.5303
 epoch: 43, train_loss: 0.8435, test_loss: 0.8984, test_f1: 0.5495
 epoch: 44, train_loss: 0.8499, test_loss: 0.8865, test_f1: 0.5486
 epoch: 45, train_loss: 0.8408, test_loss: 0.8898, test_f1: 0.5448
 epoch: 46, train_loss: 0.8366, test_loss: 0.8943, test_f1: 0.5453
 epoch: 47, train_loss: 0.8254, test_loss: 0.8900, test_f1: 0.5461
 epoch: 48, train_loss: 0.8263, test_loss: 0.8810, test_f1: 0.5500
 epoch: 49, train_loss: 0.8277, test_loss: 0.8904, test_f1: 0.5491
 epoch: 50, train_loss: 0.8179, test_loss: 0.8864, test_f1: 0.5468
 epoch: 51, train_loss: 0.8194, test_loss: 0.8840, test_f1: 0.5517
 epoch: 52, train_loss: 0.8154, test_loss: 0.8896, test_f1: 0.5404
 epoch: 53, train_loss: 0.8148, test_loss: 0.8861, test_f1: 0.5580
 epoch: 54, train_loss: 0.8137, test_loss: 0.8845, test_f1: 0.5522
 epoch: 55, train_loss: 0.8081, test_loss: 0.8951, test_f1: 0.5541
 epoch: 56, train_loss: 0.8051, test_loss: 0.8901, test_f1: 0.5543
 epoch: 57, train_loss: 0.8087, test_loss: 0.8851, test_f1: 0.5529
 epoch: 58, train_loss: 0.8045, test_loss: 0.8795, test_f1: 0.5529
 epoch: 59, train_loss: 0.8027, test_loss: 0.8856, test_f1: 0.5562
 epoch: 60, train_loss: 0.8017, test_loss: 0.8850, test_f1: 0.5559
 epoch: 61, train_loss: 0.8009, test_loss: 0.8811, test_f1: 0.5450
 epoch: 62, train_loss: 0.7903, test_loss: 0.8934, test_f1: 0.5481
 epoch: 63, train_loss: 0.7958, test_loss: 0.8923, test_f1: 0.5535
 epoch: 64, train_loss: 0.7993, test_loss: 0.8954, test_f1: 0.5483
 epoch: 65, train_loss: 0.7925, test_loss: 0.8902, test_f1: 0.5603
 epoch: 66, train_loss: 0.7858, test_loss: 0.8854, test_f1: 0.5498
 epoch: 67, train_loss: 0.7962, test_loss: 0.8880, test_f1: 0.5561
 epoch: 68, train_loss: 0.7881, test_loss: 0.8925, test_f1: 0.5537
 epoch: 69, train_loss: 0.7824, test_loss: 0.8884, test_f1: 0.5603
 epoch: 70, train_loss: 0.7790, test_loss: 0.8854, test_f1: 0.5564
 epoch: 71, train_loss: 0.7784, test_loss: 0.8849, test_f1: 0.5594
 epoch: 72, train_loss: 0.7839, test_loss: 0.8894, test_f1: 0.5566
 epoch: 73, train_loss: 0.7813, test_loss: 0.8948, test_f1: 0.5569
 epoch: 74, train_loss: 0.7752, test_loss: 0.8799, test_f1: 0.5568
 epoch: 75, train_loss: 0.7862, test_loss: 0.9000, test_f1: 0.5476
 epoch: 76, train_loss: 0.7788, test_loss: 0.8943, test_f1: 0.5529
 epoch: 77, train_loss: 0.7740, test_loss: 0.8899, test_f1: 0.5554
 epoch: 78, train_loss: 0.7698, test_loss: 0.8990, test_f1: 0.5580
 epoch: 79, train_loss: 0.7725, test_loss: 0.8913, test_f1: 0.5542
 epoch: 80, train_loss: 0.7713, test_loss: 0.8852, test_f1: 0.5517
 epoch: 81, train_loss: 0.7641, test_loss: 0.8817, test_f1: 0.5600
 epoch: 82, train_loss: 0.7683, test_loss: 0.8907, test_f1: 0.5584
 epoch: 83, train_loss: 0.7568, test_loss: 0.8992, test_f1: 0.5593
 epoch: 84, train_loss: 0.7634, test_loss: 0.8805, test_f1: 0.5583
 epoch: 85, train_loss: 0.7612, test_loss: 0.8926, test_f1: 0.5621
 epoch: 86, train_loss: 0.7684, test_loss: 0.8921, test_f1: 0.5576
 epoch: 87, train_loss: 0.7596, test_loss: 0.8902, test_f1: 0.5509
 epoch: 88, train_loss: 0.7577, test_loss: 0.8944, test_f1: 0.5554
 epoch: 89, train_loss: 0.7614, test_loss: 0.9019, test_f1: 0.5589
 epoch: 90, train_loss: 0.7463, test_loss: 0.9074, test_f1: 0.5563
 epoch: 91, train_loss: 0.7549, test_loss: 0.8961, test_f1: 0.5622
 epoch: 92, train_loss: 0.7604, test_loss: 0.8927, test_f1: 0.5581
 epoch: 93, train_loss: 0.7517, test_loss: 0.8953, test_f1: 0.5535
 epoch: 94, train_loss: 0.7491, test_loss: 0.9020, test_f1: 0.5568
 epoch: 95, train_loss: 0.7512, test_loss: 0.8974, test_f1: 0.5575
 epoch: 96, train_loss: 0.7423, test_loss: 0.8982, test_f1: 0.5546
 epoch: 97, train_loss: 0.7426, test_loss: 0.8968, test_f1: 0.5611
 epoch: 98, train_loss: 0.7480, test_loss: 0.8990, test_f1: 0.5557
 epoch: 99, train_loss: 0.7487, test_loss: 0.8989, test_f1: 0.5509
##################ITERATION #4 ****************************************
 epoch: 0, train_loss: 1.2932, test_loss: 1.3319, test_f1: 0.2270
 epoch: 1, train_loss: 1.2359, test_loss: 1.3108, test_f1: 0.2270
 epoch: 2, train_loss: 1.2235, test_loss: 1.2747, test_f1: 0.2270
 epoch: 3, train_loss: 1.2006, test_loss: 1.2154, test_f1: 0.2766
 epoch: 4, train_loss: 1.1830, test_loss: 1.1652, test_f1: 0.3724
 epoch: 5, train_loss: 1.1653, test_loss: 1.1338, test_f1: 0.3909
 epoch: 6, train_loss: 1.1491, test_loss: 1.1115, test_f1: 0.4144
 epoch: 7, train_loss: 1.1365, test_loss: 1.0934, test_f1: 0.4229
 epoch: 8, train_loss: 1.1209, test_loss: 1.0750, test_f1: 0.4363
 epoch: 9, train_loss: 1.1043, test_loss: 1.0566, test_f1: 0.4443
 epoch: 10, train_loss: 1.0957, test_loss: 1.0414, test_f1: 0.4287
 epoch: 11, train_loss: 1.0787, test_loss: 1.0318, test_f1: 0.4534
 epoch: 12, train_loss: 1.0661, test_loss: 1.0204, test_f1: 0.4630
 epoch: 13, train_loss: 1.0527, test_loss: 1.0054, test_f1: 0.4608
 epoch: 14, train_loss: 1.0398, test_loss: 0.9950, test_f1: 0.4580
 epoch: 15, train_loss: 1.0334, test_loss: 0.9858, test_f1: 0.4901
 epoch: 16, train_loss: 1.0204, test_loss: 0.9734, test_f1: 0.4886
 epoch: 17, train_loss: 1.0041, test_loss: 0.9647, test_f1: 0.4823
 epoch: 18, train_loss: 0.9929, test_loss: 0.9545, test_f1: 0.5025
 epoch: 19, train_loss: 0.9924, test_loss: 0.9519, test_f1: 0.4980
 epoch: 20, train_loss: 0.9827, test_loss: 0.9450, test_f1: 0.5046
 epoch: 21, train_loss: 0.9753, test_loss: 0.9426, test_f1: 0.4912
 epoch: 22, train_loss: 0.9616, test_loss: 0.9371, test_f1: 0.4995
 epoch: 23, train_loss: 0.9615, test_loss: 0.9338, test_f1: 0.5020
 epoch: 24, train_loss: 0.9538, test_loss: 0.9311, test_f1: 0.4994
 epoch: 25, train_loss: 0.9514, test_loss: 0.9256, test_f1: 0.5012
 epoch: 26, train_loss: 0.9410, test_loss: 0.9290, test_f1: 0.5102
 epoch: 27, train_loss: 0.9347, test_loss: 0.9334, test_f1: 0.5024
 epoch: 28, train_loss: 0.9334, test_loss: 0.9244, test_f1: 0.5132
 epoch: 29, train_loss: 0.9204, test_loss: 0.9249, test_f1: 0.5024
 epoch: 30, train_loss: 0.9210, test_loss: 0.9150, test_f1: 0.5107
 epoch: 31, train_loss: 0.9111, test_loss: 0.9197, test_f1: 0.5158
 epoch: 32, train_loss: 0.9050, test_loss: 0.9194, test_f1: 0.5169
 epoch: 33, train_loss: 0.9082, test_loss: 0.9229, test_f1: 0.5193
 epoch: 34, train_loss: 0.9003, test_loss: 0.9280, test_f1: 0.5209
 epoch: 35, train_loss: 0.8922, test_loss: 0.9063, test_f1: 0.5267
 epoch: 36, train_loss: 0.8865, test_loss: 0.9012, test_f1: 0.5230
 epoch: 37, train_loss: 0.8841, test_loss: 0.9036, test_f1: 0.5365
 epoch: 38, train_loss: 0.8801, test_loss: 0.9076, test_f1: 0.5278
 epoch: 39, train_loss: 0.8746, test_loss: 0.9089, test_f1: 0.5287
 epoch: 40, train_loss: 0.8673, test_loss: 0.8990, test_f1: 0.5365
 epoch: 41, train_loss: 0.8779, test_loss: 0.9190, test_f1: 0.5330
 epoch: 42, train_loss: 0.8556, test_loss: 0.9142, test_f1: 0.5334
 epoch: 43, train_loss: 0.8591, test_loss: 0.8985, test_f1: 0.5380
 epoch: 44, train_loss: 0.8584, test_loss: 0.9157, test_f1: 0.5253
 epoch: 45, train_loss: 0.8492, test_loss: 0.9166, test_f1: 0.5290
 epoch: 46, train_loss: 0.8458, test_loss: 0.9078, test_f1: 0.5383
 epoch: 47, train_loss: 0.8447, test_loss: 0.9146, test_f1: 0.5300
 epoch: 48, train_loss: 0.8412, test_loss: 0.9120, test_f1: 0.5311
 epoch: 49, train_loss: 0.8355, test_loss: 0.8997, test_f1: 0.5380
 epoch: 50, train_loss: 0.8366, test_loss: 0.9212, test_f1: 0.5375
 epoch: 51, train_loss: 0.8259, test_loss: 0.8996, test_f1: 0.5416
 epoch: 52, train_loss: 0.8270, test_loss: 0.9019, test_f1: 0.5336
 epoch: 53, train_loss: 0.8201, test_loss: 0.8992, test_f1: 0.5382
 epoch: 54, train_loss: 0.8230, test_loss: 0.9021, test_f1: 0.5495
 epoch: 55, train_loss: 0.8278, test_loss: 0.9241, test_f1: 0.5503
 epoch: 56, train_loss: 0.8188, test_loss: 0.9110, test_f1: 0.5757
 epoch: 57, train_loss: 0.8210, test_loss: 0.9117, test_f1: 0.5526
 epoch: 58, train_loss: 0.8131, test_loss: 0.9162, test_f1: 0.5422
 epoch: 59, train_loss: 0.8191, test_loss: 0.9108, test_f1: 0.5380
 epoch: 60, train_loss: 0.8186, test_loss: 0.9113, test_f1: 0.5428
 epoch: 61, train_loss: 0.8069, test_loss: 0.9045, test_f1: 0.5298
 epoch: 62, train_loss: 0.8030, test_loss: 0.9070, test_f1: 0.5458
 epoch: 63, train_loss: 0.8056, test_loss: 0.9088, test_f1: 0.5497
 epoch: 64, train_loss: 0.8137, test_loss: 0.9157, test_f1: 0.5358
 epoch: 65, train_loss: 0.8063, test_loss: 0.9098, test_f1: 0.5385
 epoch: 66, train_loss: 0.8080, test_loss: 0.9117, test_f1: 0.5323
 epoch: 67, train_loss: 0.8057, test_loss: 0.9049, test_f1: 0.5444
 epoch: 68, train_loss: 0.8074, test_loss: 0.9183, test_f1: 0.5275
 epoch: 69, train_loss: 0.8014, test_loss: 0.9225, test_f1: 0.5406
 epoch: 70, train_loss: 0.7929, test_loss: 0.9044, test_f1: 0.5427
 epoch: 71, train_loss: 0.7966, test_loss: 0.9124, test_f1: 0.5471
 epoch: 72, train_loss: 0.7936, test_loss: 0.9231, test_f1: 0.5520
 epoch: 73, train_loss: 0.7968, test_loss: 0.9153, test_f1: 0.5509
 epoch: 74, train_loss: 0.7903, test_loss: 0.9216, test_f1: 0.5376
 epoch: 75, train_loss: 0.7971, test_loss: 0.9229, test_f1: 0.5462
 epoch: 76, train_loss: 0.7939, test_loss: 0.9167, test_f1: 0.5511
 epoch: 77, train_loss: 0.7826, test_loss: 0.9343, test_f1: 0.5472
 epoch: 78, train_loss: 0.7860, test_loss: 0.9265, test_f1: 0.5544
 epoch: 79, train_loss: 0.7830, test_loss: 0.9166, test_f1: 0.5435
 epoch: 80, train_loss: 0.7896, test_loss: 0.9214, test_f1: 0.5553
 epoch: 81, train_loss: 0.7814, test_loss: 0.9175, test_f1: 0.5692
 epoch: 82, train_loss: 0.7821, test_loss: 0.9173, test_f1: 0.5646
 epoch: 83, train_loss: 0.7832, test_loss: 0.9278, test_f1: 0.5622
 epoch: 84, train_loss: 0.7756, test_loss: 0.9348, test_f1: 0.5528
 epoch: 85, train_loss: 0.7866, test_loss: 0.9263, test_f1: 0.5509
 epoch: 86, train_loss: 0.7749, test_loss: 0.9293, test_f1: 0.5592
 epoch: 87, train_loss: 0.7762, test_loss: 0.9284, test_f1: 0.5542
 epoch: 88, train_loss: 0.7823, test_loss: 0.9232, test_f1: 0.5557
 epoch: 89, train_loss: 0.7771, test_loss: 0.9311, test_f1: 0.5570
 epoch: 90, train_loss: 0.7728, test_loss: 0.9354, test_f1: 0.5535
 epoch: 91, train_loss: 0.7710, test_loss: 0.9308, test_f1: 0.5571
 epoch: 92, train_loss: 0.7819, test_loss: 0.9365, test_f1: 0.5604
 epoch: 93, train_loss: 0.7704, test_loss: 0.9426, test_f1: 0.5720
 epoch: 94, train_loss: 0.7787, test_loss: 0.9260, test_f1: 0.5698
 epoch: 95, train_loss: 0.7744, test_loss: 0.9497, test_f1: 0.5624
 epoch: 96, train_loss: 0.7674, test_loss: 0.9440, test_f1: 0.5628
 epoch: 97, train_loss: 0.7548, test_loss: 0.9331, test_f1: 0.5652
 epoch: 98, train_loss: 0.7708, test_loss: 0.9409, test_f1: 0.5561
 epoch: 99, train_loss: 0.7586, test_loss: 0.9447, test_f1: 0.5590
##################ITERATION #5 ****************************************
 epoch: 0, train_loss: 1.3060, test_loss: 1.3266, test_f1: 0.2270
 epoch: 1, train_loss: 1.2482, test_loss: 1.3060, test_f1: 0.2270
 epoch: 2, train_loss: 1.2155, test_loss: 1.2833, test_f1: 0.2270
 epoch: 3, train_loss: 1.1965, test_loss: 1.2285, test_f1: 0.2270
 epoch: 4, train_loss: 1.1782, test_loss: 1.1743, test_f1: 0.3279
 epoch: 5, train_loss: 1.1496, test_loss: 1.1308, test_f1: 0.4251
 epoch: 6, train_loss: 1.1490, test_loss: 1.0986, test_f1: 0.4408
 epoch: 7, train_loss: 1.1244, test_loss: 1.0816, test_f1: 0.4485
 epoch: 8, train_loss: 1.1155, test_loss: 1.0664, test_f1: 0.4379
 epoch: 9, train_loss: 1.0988, test_loss: 1.0531, test_f1: 0.4524
 epoch: 10, train_loss: 1.0885, test_loss: 1.0402, test_f1: 0.4553
 epoch: 11, train_loss: 1.0697, test_loss: 1.0296, test_f1: 0.4591
 epoch: 12, train_loss: 1.0607, test_loss: 1.0189, test_f1: 0.4650
 epoch: 13, train_loss: 1.0490, test_loss: 1.0095, test_f1: 0.4644
 epoch: 14, train_loss: 1.0416, test_loss: 0.9981, test_f1: 0.4748
 epoch: 15, train_loss: 1.0293, test_loss: 0.9945, test_f1: 0.4662
 epoch: 16, train_loss: 1.0178, test_loss: 0.9796, test_f1: 0.4880
 epoch: 17, train_loss: 1.0086, test_loss: 0.9758, test_f1: 0.4858
 epoch: 18, train_loss: 1.0084, test_loss: 0.9687, test_f1: 0.4924
 epoch: 19, train_loss: 0.9905, test_loss: 0.9675, test_f1: 0.4912
 epoch: 20, train_loss: 0.9921, test_loss: 0.9659, test_f1: 0.4827
 epoch: 21, train_loss: 0.9820, test_loss: 0.9644, test_f1: 0.4859
 epoch: 22, train_loss: 0.9741, test_loss: 0.9583, test_f1: 0.4848
 epoch: 23, train_loss: 0.9650, test_loss: 0.9494, test_f1: 0.4920
 epoch: 24, train_loss: 0.9625, test_loss: 0.9504, test_f1: 0.4990
 epoch: 25, train_loss: 0.9518, test_loss: 0.9496, test_f1: 0.4879
 epoch: 26, train_loss: 0.9524, test_loss: 0.9444, test_f1: 0.4878
 epoch: 27, train_loss: 0.9413, test_loss: 0.9465, test_f1: 0.4940
 epoch: 28, train_loss: 0.9431, test_loss: 0.9477, test_f1: 0.4907
 epoch: 29, train_loss: 0.9326, test_loss: 0.9397, test_f1: 0.4935
 epoch: 30, train_loss: 0.9253, test_loss: 0.9395, test_f1: 0.4960
 epoch: 31, train_loss: 0.9186, test_loss: 0.9416, test_f1: 0.4974
 epoch: 32, train_loss: 0.9126, test_loss: 0.9305, test_f1: 0.5087
 epoch: 33, train_loss: 0.9076, test_loss: 0.9357, test_f1: 0.5150
 epoch: 34, train_loss: 0.9050, test_loss: 0.9369, test_f1: 0.5055
 epoch: 35, train_loss: 0.9065, test_loss: 0.9335, test_f1: 0.5081
 epoch: 36, train_loss: 0.9013, test_loss: 0.9415, test_f1: 0.5036
 epoch: 37, train_loss: 0.8936, test_loss: 0.9369, test_f1: 0.5091
 epoch: 38, train_loss: 0.8891, test_loss: 0.9281, test_f1: 0.5138
 epoch: 39, train_loss: 0.8852, test_loss: 0.9379, test_f1: 0.5213
 epoch: 40, train_loss: 0.8867, test_loss: 0.9483, test_f1: 0.5097
 epoch: 41, train_loss: 0.8730, test_loss: 0.9513, test_f1: 0.5176
 epoch: 42, train_loss: 0.8666, test_loss: 0.9375, test_f1: 0.5267
 epoch: 43, train_loss: 0.8678, test_loss: 0.9375, test_f1: 0.5236
 epoch: 44, train_loss: 0.8695, test_loss: 0.9475, test_f1: 0.5075
 epoch: 45, train_loss: 0.8627, test_loss: 0.9434, test_f1: 0.5282
 epoch: 46, train_loss: 0.8545, test_loss: 0.9340, test_f1: 0.5289
 epoch: 47, train_loss: 0.8466, test_loss: 0.9419, test_f1: 0.5304
 epoch: 48, train_loss: 0.8538, test_loss: 0.9470, test_f1: 0.5336
 epoch: 49, train_loss: 0.8459, test_loss: 0.9516, test_f1: 0.5286
 epoch: 50, train_loss: 0.8458, test_loss: 0.9406, test_f1: 0.5358
 epoch: 51, train_loss: 0.8408, test_loss: 0.9335, test_f1: 0.5368
 epoch: 52, train_loss: 0.8296, test_loss: 0.9402, test_f1: 0.5233
 epoch: 53, train_loss: 0.8318, test_loss: 0.9387, test_f1: 0.5380
 epoch: 54, train_loss: 0.8299, test_loss: 0.9467, test_f1: 0.5254
 epoch: 55, train_loss: 0.8216, test_loss: 0.9453, test_f1: 0.5388
 epoch: 56, train_loss: 0.8303, test_loss: 0.9354, test_f1: 0.5409
 epoch: 57, train_loss: 0.8188, test_loss: 0.9403, test_f1: 0.5376
 epoch: 58, train_loss: 0.8196, test_loss: 0.9450, test_f1: 0.5381
 epoch: 59, train_loss: 0.8159, test_loss: 0.9398, test_f1: 0.5328
 epoch: 60, train_loss: 0.8212, test_loss: 0.9436, test_f1: 0.5392
 epoch: 61, train_loss: 0.8179, test_loss: 0.9408, test_f1: 0.5436
 epoch: 62, train_loss: 0.8172, test_loss: 0.9442, test_f1: 0.5270
 epoch: 63, train_loss: 0.8228, test_loss: 0.9433, test_f1: 0.5318
 epoch: 64, train_loss: 0.8137, test_loss: 0.9342, test_f1: 0.5537
 epoch: 65, train_loss: 0.8173, test_loss: 0.9455, test_f1: 0.5340
 epoch: 66, train_loss: 0.8113, test_loss: 0.9463, test_f1: 0.5407
 epoch: 67, train_loss: 0.8077, test_loss: 0.9369, test_f1: 0.5451
 epoch: 68, train_loss: 0.8173, test_loss: 0.9362, test_f1: 0.5363
 epoch: 69, train_loss: 0.8065, test_loss: 0.9394, test_f1: 0.5428
 epoch: 70, train_loss: 0.8063, test_loss: 0.9442, test_f1: 0.5393
 epoch: 71, train_loss: 0.8072, test_loss: 0.9370, test_f1: 0.5427
 epoch: 72, train_loss: 0.8021, test_loss: 0.9354, test_f1: 0.5424
 epoch: 73, train_loss: 0.7962, test_loss: 0.9435, test_f1: 0.5375
 epoch: 74, train_loss: 0.8003, test_loss: 0.9374, test_f1: 0.5457
 epoch: 75, train_loss: 0.7956, test_loss: 0.9417, test_f1: 0.5470
 epoch: 76, train_loss: 0.8039, test_loss: 0.9419, test_f1: 0.5464
 epoch: 77, train_loss: 0.7978, test_loss: 0.9315, test_f1: 0.5503
 epoch: 78, train_loss: 0.8014, test_loss: 0.9442, test_f1: 0.5460
 epoch: 79, train_loss: 0.7858, test_loss: 0.9515, test_f1: 0.5389
 epoch: 80, train_loss: 0.7945, test_loss: 0.9393, test_f1: 0.5454
 epoch: 81, train_loss: 0.7906, test_loss: 0.9528, test_f1: 0.5442
 epoch: 82, train_loss: 0.7856, test_loss: 0.9461, test_f1: 0.5448
 epoch: 83, train_loss: 0.7813, test_loss: 0.9440, test_f1: 0.5472
 epoch: 84, train_loss: 0.7780, test_loss: 0.9453, test_f1: 0.5452
 epoch: 85, train_loss: 0.7878, test_loss: 0.9419, test_f1: 0.5471
 epoch: 86, train_loss: 0.7884, test_loss: 0.9468, test_f1: 0.5463
 epoch: 87, train_loss: 0.7856, test_loss: 0.9509, test_f1: 0.5459
 epoch: 88, train_loss: 0.7713, test_loss: 0.9426, test_f1: 0.5496
 epoch: 89, train_loss: 0.7757, test_loss: 0.9489, test_f1: 0.5417
 epoch: 90, train_loss: 0.7771, test_loss: 0.9384, test_f1: 0.5509
 epoch: 91, train_loss: 0.7807, test_loss: 0.9431, test_f1: 0.5502
 epoch: 92, train_loss: 0.7771, test_loss: 0.9589, test_f1: 0.5387
 epoch: 93, train_loss: 0.7686, test_loss: 0.9458, test_f1: 0.5432
 epoch: 94, train_loss: 0.7841, test_loss: 0.9528, test_f1: 0.5450
 epoch: 95, train_loss: 0.7771, test_loss: 0.9517, test_f1: 0.5356
 epoch: 96, train_loss: 0.7833, test_loss: 0.9358, test_f1: 0.5597
 epoch: 97, train_loss: 0.7713, test_loss: 0.9643, test_f1: 0.5343
 epoch: 98, train_loss: 0.7713, test_loss: 0.9502, test_f1: 0.5496
 epoch: 99, train_loss: 0.7701, test_loss: 0.9493, test_f1: 0.5425
##################ITERATION #6 ****************************************
 epoch: 0, train_loss: 1.3397, test_loss: 1.3683, test_f1: 0.2270
 epoch: 1, train_loss: 1.2482, test_loss: 1.3309, test_f1: 0.2270
 epoch: 2, train_loss: 1.2123, test_loss: 1.2770, test_f1: 0.2295
 epoch: 3, train_loss: 1.1910, test_loss: 1.2001, test_f1: 0.3671
 epoch: 4, train_loss: 1.1745, test_loss: 1.1479, test_f1: 0.3829
 epoch: 5, train_loss: 1.1537, test_loss: 1.1047, test_f1: 0.4095
 epoch: 6, train_loss: 1.1357, test_loss: 1.0856, test_f1: 0.4352
 epoch: 7, train_loss: 1.1213, test_loss: 1.0616, test_f1: 0.4584
 epoch: 8, train_loss: 1.1023, test_loss: 1.0432, test_f1: 0.4573
 epoch: 9, train_loss: 1.0890, test_loss: 1.0362, test_f1: 0.4580
 epoch: 10, train_loss: 1.0593, test_loss: 1.0251, test_f1: 0.4729
 epoch: 11, train_loss: 1.0552, test_loss: 1.0141, test_f1: 0.4766
 epoch: 12, train_loss: 1.0537, test_loss: 1.0181, test_f1: 0.4745
 epoch: 13, train_loss: 1.0283, test_loss: 1.0037, test_f1: 0.4802
 epoch: 14, train_loss: 1.0197, test_loss: 0.9906, test_f1: 0.4770
 epoch: 15, train_loss: 1.0121, test_loss: 0.9867, test_f1: 0.4856
 epoch: 16, train_loss: 1.0029, test_loss: 0.9797, test_f1: 0.4857
 epoch: 17, train_loss: 0.9844, test_loss: 0.9738, test_f1: 0.4834
 epoch: 18, train_loss: 0.9902, test_loss: 0.9696, test_f1: 0.4849
 epoch: 19, train_loss: 0.9750, test_loss: 0.9774, test_f1: 0.4984
 epoch: 20, train_loss: 0.9749, test_loss: 0.9614, test_f1: 0.4960
 epoch: 21, train_loss: 0.9552, test_loss: 0.9666, test_f1: 0.5107
 epoch: 22, train_loss: 0.9563, test_loss: 0.9541, test_f1: 0.4931
 epoch: 23, train_loss: 0.9453, test_loss: 0.9628, test_f1: 0.4910
 epoch: 24, train_loss: 0.9536, test_loss: 0.9692, test_f1: 0.5044
 epoch: 25, train_loss: 0.9406, test_loss: 0.9638, test_f1: 0.5123
 epoch: 26, train_loss: 0.9318, test_loss: 0.9541, test_f1: 0.5060
 epoch: 27, train_loss: 0.9370, test_loss: 0.9684, test_f1: 0.4917
 epoch: 28, train_loss: 0.9208, test_loss: 0.9482, test_f1: 0.4906
 epoch: 29, train_loss: 0.9195, test_loss: 0.9565, test_f1: 0.5008
 epoch: 30, train_loss: 0.9117, test_loss: 0.9575, test_f1: 0.5017
 epoch: 31, train_loss: 0.9149, test_loss: 0.9577, test_f1: 0.5094
 epoch: 32, train_loss: 0.9029, test_loss: 0.9727, test_f1: 0.4862
 epoch: 33, train_loss: 0.9161, test_loss: 0.9455, test_f1: 0.5204
 epoch: 34, train_loss: 0.8926, test_loss: 0.9591, test_f1: 0.5078
 epoch: 35, train_loss: 0.8912, test_loss: 0.9548, test_f1: 0.5224
 epoch: 36, train_loss: 0.8940, test_loss: 0.9667, test_f1: 0.5293
 epoch: 37, train_loss: 0.8921, test_loss: 0.9658, test_f1: 0.5286
 epoch: 38, train_loss: 0.8815, test_loss: 0.9638, test_f1: 0.5265
 epoch: 39, train_loss: 0.8843, test_loss: 0.9592, test_f1: 0.5220
 epoch: 40, train_loss: 0.8708, test_loss: 0.9612, test_f1: 0.5256
 epoch: 41, train_loss: 0.8761, test_loss: 0.9562, test_f1: 0.5253
 epoch: 42, train_loss: 0.8767, test_loss: 0.9654, test_f1: 0.5312
 epoch: 43, train_loss: 0.8624, test_loss: 0.9598, test_f1: 0.5344
 epoch: 44, train_loss: 0.8606, test_loss: 0.9557, test_f1: 0.5283
 epoch: 45, train_loss: 0.8638, test_loss: 0.9475, test_f1: 0.5378
 epoch: 46, train_loss: 0.8536, test_loss: 0.9629, test_f1: 0.5297
 epoch: 47, train_loss: 0.8536, test_loss: 0.9735, test_f1: 0.5290
 epoch: 48, train_loss: 0.8526, test_loss: 0.9616, test_f1: 0.5288
 epoch: 49, train_loss: 0.8461, test_loss: 0.9775, test_f1: 0.5266
 epoch: 50, train_loss: 0.8481, test_loss: 0.9517, test_f1: 0.5354
 epoch: 51, train_loss: 0.8508, test_loss: 0.9741, test_f1: 0.5248
 epoch: 52, train_loss: 0.8362, test_loss: 0.9687, test_f1: 0.5314
 epoch: 53, train_loss: 0.8422, test_loss: 0.9751, test_f1: 0.5187
 epoch: 54, train_loss: 0.8331, test_loss: 0.9858, test_f1: 0.5275
 epoch: 55, train_loss: 0.8317, test_loss: 0.9711, test_f1: 0.5281
 epoch: 56, train_loss: 0.8365, test_loss: 0.9679, test_f1: 0.5359
 epoch: 57, train_loss: 0.8290, test_loss: 0.9779, test_f1: 0.5277
 epoch: 58, train_loss: 0.8348, test_loss: 0.9662, test_f1: 0.5224
 epoch: 59, train_loss: 0.8312, test_loss: 0.9733, test_f1: 0.5320
 epoch: 60, train_loss: 0.8281, test_loss: 0.9797, test_f1: 0.5359
 epoch: 61, train_loss: 0.8430, test_loss: 0.9725, test_f1: 0.5397
 epoch: 62, train_loss: 0.8193, test_loss: 0.9763, test_f1: 0.5394
 epoch: 63, train_loss: 0.8263, test_loss: 0.9798, test_f1: 0.5399
 epoch: 64, train_loss: 0.8213, test_loss: 0.9886, test_f1: 0.5256
 epoch: 65, train_loss: 0.8211, test_loss: 0.9705, test_f1: 0.5354
 epoch: 66, train_loss: 0.8186, test_loss: 0.9831, test_f1: 0.5227
 epoch: 67, train_loss: 0.8287, test_loss: 0.9720, test_f1: 0.5379
 epoch: 68, train_loss: 0.8190, test_loss: 0.9814, test_f1: 0.5330
 epoch: 69, train_loss: 0.8211, test_loss: 0.9680, test_f1: 0.5330
 epoch: 70, train_loss: 0.8191, test_loss: 0.9801, test_f1: 0.5371
 epoch: 71, train_loss: 0.8193, test_loss: 0.9873, test_f1: 0.5369
 epoch: 72, train_loss: 0.8179, test_loss: 0.9818, test_f1: 0.5410
 epoch: 73, train_loss: 0.8129, test_loss: 0.9746, test_f1: 0.5313
 epoch: 74, train_loss: 0.8129, test_loss: 0.9726, test_f1: 0.5399
 epoch: 75, train_loss: 0.8048, test_loss: 0.9717, test_f1: 0.5279
 epoch: 76, train_loss: 0.8168, test_loss: 0.9778, test_f1: 0.5247
 epoch: 77, train_loss: 0.8069, test_loss: 0.9807, test_f1: 0.5352
 epoch: 78, train_loss: 0.8071, test_loss: 0.9984, test_f1: 0.5314
 epoch: 79, train_loss: 0.8065, test_loss: 0.9918, test_f1: 0.5278
 epoch: 80, train_loss: 0.8023, test_loss: 0.9874, test_f1: 0.5330
 epoch: 81, train_loss: 0.8044, test_loss: 0.9887, test_f1: 0.5369
 epoch: 82, train_loss: 0.7998, test_loss: 1.0035, test_f1: 0.5303
 epoch: 83, train_loss: 0.8184, test_loss: 0.9898, test_f1: 0.5404
 epoch: 84, train_loss: 0.8031, test_loss: 0.9810, test_f1: 0.5439
 epoch: 85, train_loss: 0.7941, test_loss: 0.9766, test_f1: 0.5325
 epoch: 86, train_loss: 0.7961, test_loss: 0.9850, test_f1: 0.5281
 epoch: 87, train_loss: 0.7909, test_loss: 0.9837, test_f1: 0.5176
 epoch: 88, train_loss: 0.7934, test_loss: 1.0004, test_f1: 0.5214
 epoch: 89, train_loss: 0.7997, test_loss: 0.9829, test_f1: 0.5216
 epoch: 90, train_loss: 0.7996, test_loss: 0.9912, test_f1: 0.5257
 epoch: 91, train_loss: 0.7935, test_loss: 0.9849, test_f1: 0.5238
 epoch: 92, train_loss: 0.7932, test_loss: 1.0021, test_f1: 0.5465
 epoch: 93, train_loss: 0.7955, test_loss: 1.0100, test_f1: 0.5263
 epoch: 94, train_loss: 0.7927, test_loss: 0.9938, test_f1: 0.5357
 epoch: 95, train_loss: 0.7950, test_loss: 0.9889, test_f1: 0.5392
 epoch: 96, train_loss: 0.7938, test_loss: 1.0002, test_f1: 0.5280
 epoch: 97, train_loss: 0.7873, test_loss: 1.0022, test_f1: 0.5224
 epoch: 98, train_loss: 0.7908, test_loss: 1.0038, test_f1: 0.5315
 epoch: 99, train_loss: 0.7877, test_loss: 0.9956, test_f1: 0.5269
##################ITERATION #7 ****************************************
 epoch: 0, train_loss: 1.3091, test_loss: 1.3277, test_f1: 0.2270
 epoch: 1, train_loss: 1.2273, test_loss: 1.3093, test_f1: 0.2270
 epoch: 2, train_loss: 1.2023, test_loss: 1.2859, test_f1: 0.2320
 epoch: 3, train_loss: 1.1814, test_loss: 1.2521, test_f1: 0.3318
 epoch: 4, train_loss: 1.1655, test_loss: 1.1908, test_f1: 0.3495
 epoch: 5, train_loss: 1.1459, test_loss: 1.1269, test_f1: 0.3916
 epoch: 6, train_loss: 1.1254, test_loss: 1.0882, test_f1: 0.4276
 epoch: 7, train_loss: 1.1178, test_loss: 1.0620, test_f1: 0.4473
 epoch: 8, train_loss: 1.0988, test_loss: 1.0413, test_f1: 0.4410
 epoch: 9, train_loss: 1.0817, test_loss: 1.0321, test_f1: 0.4354
 epoch: 10, train_loss: 1.0667, test_loss: 1.0150, test_f1: 0.4483
 epoch: 11, train_loss: 1.0539, test_loss: 1.0012, test_f1: 0.4558
 epoch: 12, train_loss: 1.0421, test_loss: 0.9878, test_f1: 0.4816
 epoch: 13, train_loss: 1.0379, test_loss: 0.9822, test_f1: 0.4820
 epoch: 14, train_loss: 1.0219, test_loss: 0.9720, test_f1: 0.4928
 epoch: 15, train_loss: 1.0220, test_loss: 0.9663, test_f1: 0.4896
 epoch: 16, train_loss: 1.0160, test_loss: 0.9620, test_f1: 0.4963
 epoch: 17, train_loss: 1.0015, test_loss: 0.9563, test_f1: 0.4972
 epoch: 18, train_loss: 0.9938, test_loss: 0.9479, test_f1: 0.5080
 epoch: 19, train_loss: 0.9841, test_loss: 0.9449, test_f1: 0.5098
 epoch: 20, train_loss: 0.9778, test_loss: 0.9408, test_f1: 0.5083
 epoch: 21, train_loss: 0.9751, test_loss: 0.9340, test_f1: 0.5129
 epoch: 22, train_loss: 0.9516, test_loss: 0.9363, test_f1: 0.5096
 epoch: 23, train_loss: 0.9586, test_loss: 0.9255, test_f1: 0.5186
 epoch: 24, train_loss: 0.9580, test_loss: 0.9325, test_f1: 0.5165
 epoch: 25, train_loss: 0.9425, test_loss: 0.9230, test_f1: 0.5129
 epoch: 26, train_loss: 0.9396, test_loss: 0.9254, test_f1: 0.5110
 epoch: 27, train_loss: 0.9355, test_loss: 0.9258, test_f1: 0.5094
 epoch: 28, train_loss: 0.9354, test_loss: 0.9167, test_f1: 0.5226
 epoch: 29, train_loss: 0.9263, test_loss: 0.9215, test_f1: 0.5199
 epoch: 30, train_loss: 0.9230, test_loss: 0.9229, test_f1: 0.5170
 epoch: 31, train_loss: 0.9237, test_loss: 0.9168, test_f1: 0.5126
 epoch: 32, train_loss: 0.9103, test_loss: 0.9185, test_f1: 0.5121
 epoch: 33, train_loss: 0.9107, test_loss: 0.9141, test_f1: 0.5225
 epoch: 34, train_loss: 0.8957, test_loss: 0.9237, test_f1: 0.5154
 epoch: 35, train_loss: 0.8909, test_loss: 0.9083, test_f1: 0.5106
 epoch: 36, train_loss: 0.8965, test_loss: 0.9118, test_f1: 0.5205
 epoch: 37, train_loss: 0.8897, test_loss: 0.9200, test_f1: 0.5236
 epoch: 38, train_loss: 0.8861, test_loss: 0.9095, test_f1: 0.5206
 epoch: 39, train_loss: 0.8842, test_loss: 0.9202, test_f1: 0.5229
 epoch: 40, train_loss: 0.8744, test_loss: 0.9090, test_f1: 0.5306
 epoch: 41, train_loss: 0.8747, test_loss: 0.9074, test_f1: 0.5360
 epoch: 42, train_loss: 0.8705, test_loss: 0.9098, test_f1: 0.5323
 epoch: 43, train_loss: 0.8641, test_loss: 0.9236, test_f1: 0.5325
 epoch: 44, train_loss: 0.8599, test_loss: 0.9010, test_f1: 0.5139
 epoch: 45, train_loss: 0.8619, test_loss: 0.9308, test_f1: 0.5277
 epoch: 46, train_loss: 0.8570, test_loss: 0.8967, test_f1: 0.5349
 epoch: 47, train_loss: 0.8489, test_loss: 0.9186, test_f1: 0.5378
 epoch: 48, train_loss: 0.8467, test_loss: 0.9526, test_f1: 0.5199
 epoch: 49, train_loss: 0.8433, test_loss: 0.9154, test_f1: 0.5415
 epoch: 50, train_loss: 0.8404, test_loss: 0.9179, test_f1: 0.5323
 epoch: 51, train_loss: 0.8463, test_loss: 0.9164, test_f1: 0.5310
 epoch: 52, train_loss: 0.8357, test_loss: 0.9150, test_f1: 0.5319
 epoch: 53, train_loss: 0.8268, test_loss: 0.9154, test_f1: 0.5354
 epoch: 54, train_loss: 0.8343, test_loss: 0.9152, test_f1: 0.5385
 epoch: 55, train_loss: 0.8366, test_loss: 0.9252, test_f1: 0.5351
 epoch: 56, train_loss: 0.8316, test_loss: 0.9167, test_f1: 0.5341
 epoch: 57, train_loss: 0.8262, test_loss: 0.9166, test_f1: 0.5402
 epoch: 58, train_loss: 0.8301, test_loss: 0.9352, test_f1: 0.5327
 epoch: 59, train_loss: 0.8200, test_loss: 0.9299, test_f1: 0.5265
 epoch: 60, train_loss: 0.8211, test_loss: 0.9349, test_f1: 0.5304
 epoch: 61, train_loss: 0.8136, test_loss: 0.9184, test_f1: 0.5334
 epoch: 62, train_loss: 0.8180, test_loss: 0.9390, test_f1: 0.5245
 epoch: 63, train_loss: 0.8202, test_loss: 0.9365, test_f1: 0.5298
 epoch: 64, train_loss: 0.8110, test_loss: 0.9284, test_f1: 0.5447
 epoch: 65, train_loss: 0.8192, test_loss: 0.9276, test_f1: 0.5382
 epoch: 66, train_loss: 0.8058, test_loss: 0.9224, test_f1: 0.5341
 epoch: 67, train_loss: 0.8060, test_loss: 0.9147, test_f1: 0.5378
 epoch: 68, train_loss: 0.8114, test_loss: 0.9321, test_f1: 0.5344
 epoch: 69, train_loss: 0.8053, test_loss: 0.9371, test_f1: 0.5339
 epoch: 70, train_loss: 0.8101, test_loss: 0.9438, test_f1: 0.5339
 epoch: 71, train_loss: 0.8076, test_loss: 0.9343, test_f1: 0.5365
 epoch: 72, train_loss: 0.8082, test_loss: 0.9312, test_f1: 0.5451
 epoch: 73, train_loss: 0.8029, test_loss: 0.9475, test_f1: 0.5326
 epoch: 74, train_loss: 0.7989, test_loss: 0.9427, test_f1: 0.5354
 epoch: 75, train_loss: 0.7998, test_loss: 0.9336, test_f1: 0.5349
 epoch: 76, train_loss: 0.7950, test_loss: 0.9494, test_f1: 0.5412
 epoch: 77, train_loss: 0.7958, test_loss: 0.9506, test_f1: 0.5339
 epoch: 78, train_loss: 0.7970, test_loss: 0.9442, test_f1: 0.5307
 epoch: 79, train_loss: 0.7887, test_loss: 0.9354, test_f1: 0.5367
 epoch: 80, train_loss: 0.7943, test_loss: 0.9407, test_f1: 0.5415
 epoch: 81, train_loss: 0.7886, test_loss: 0.9530, test_f1: 0.5389
 epoch: 82, train_loss: 0.7922, test_loss: 0.9357, test_f1: 0.5374
 epoch: 83, train_loss: 0.7898, test_loss: 0.9429, test_f1: 0.5384
 epoch: 84, train_loss: 0.7815, test_loss: 0.9427, test_f1: 0.5360
 epoch: 85, train_loss: 0.7862, test_loss: 0.9486, test_f1: 0.5382
 epoch: 86, train_loss: 0.7878, test_loss: 0.9275, test_f1: 0.5404
 epoch: 87, train_loss: 0.7832, test_loss: 0.9350, test_f1: 0.5475
 epoch: 88, train_loss: 0.7841, test_loss: 0.9305, test_f1: 0.5419
 epoch: 89, train_loss: 0.7766, test_loss: 0.9294, test_f1: 0.5441
 epoch: 90, train_loss: 0.7852, test_loss: 0.9466, test_f1: 0.5294
 epoch: 91, train_loss: 0.7745, test_loss: 0.9411, test_f1: 0.5425
 epoch: 92, train_loss: 0.7768, test_loss: 0.9381, test_f1: 0.5479
 epoch: 93, train_loss: 0.7752, test_loss: 0.9225, test_f1: 0.5430
 epoch: 94, train_loss: 0.7782, test_loss: 0.9434, test_f1: 0.5414
 epoch: 95, train_loss: 0.7732, test_loss: 0.9078, test_f1: 0.5403
 epoch: 96, train_loss: 0.7724, test_loss: 0.9393, test_f1: 0.5562
 epoch: 97, train_loss: 0.7700, test_loss: 0.9095, test_f1: 0.5376
 epoch: 98, train_loss: 0.7683, test_loss: 0.9260, test_f1: 0.5430
 epoch: 99, train_loss: 0.7641, test_loss: 0.9157, test_f1: 0.5399
##################ITERATION #8 ****************************************
 epoch: 0, train_loss: 1.3406, test_loss: 1.3160, test_f1: 0.2270
 epoch: 1, train_loss: 1.2317, test_loss: 1.3079, test_f1: 0.2270
 epoch: 2, train_loss: 1.2126, test_loss: 1.2704, test_f1: 0.3071
 epoch: 3, train_loss: 1.1894, test_loss: 1.2277, test_f1: 0.3137
 epoch: 4, train_loss: 1.1560, test_loss: 1.1603, test_f1: 0.3839
 epoch: 5, train_loss: 1.1408, test_loss: 1.1103, test_f1: 0.4273
 epoch: 6, train_loss: 1.1215, test_loss: 1.0731, test_f1: 0.4540
 epoch: 7, train_loss: 1.1056, test_loss: 1.0580, test_f1: 0.4751
 epoch: 8, train_loss: 1.0860, test_loss: 1.0468, test_f1: 0.4763
 epoch: 9, train_loss: 1.0696, test_loss: 1.0320, test_f1: 0.4865
 epoch: 10, train_loss: 1.0619, test_loss: 1.0154, test_f1: 0.4863
 epoch: 11, train_loss: 1.0376, test_loss: 0.9937, test_f1: 0.4911
 epoch: 12, train_loss: 1.0238, test_loss: 0.9867, test_f1: 0.4962
 epoch: 13, train_loss: 1.0185, test_loss: 0.9870, test_f1: 0.4980
 epoch: 14, train_loss: 1.0080, test_loss: 0.9817, test_f1: 0.5028
 epoch: 15, train_loss: 1.0012, test_loss: 0.9734, test_f1: 0.5085
 epoch: 16, train_loss: 0.9881, test_loss: 0.9718, test_f1: 0.5009
 epoch: 17, train_loss: 0.9749, test_loss: 0.9684, test_f1: 0.4951
 epoch: 18, train_loss: 0.9649, test_loss: 0.9592, test_f1: 0.5131
 epoch: 19, train_loss: 0.9597, test_loss: 0.9575, test_f1: 0.5065
 epoch: 20, train_loss: 0.9539, test_loss: 0.9502, test_f1: 0.5195
 epoch: 21, train_loss: 0.9400, test_loss: 0.9505, test_f1: 0.5175
 epoch: 22, train_loss: 0.9373, test_loss: 0.9468, test_f1: 0.5121
 epoch: 23, train_loss: 0.9287, test_loss: 0.9427, test_f1: 0.5123
 epoch: 24, train_loss: 0.9127, test_loss: 0.9429, test_f1: 0.5086
 epoch: 25, train_loss: 0.9183, test_loss: 0.9463, test_f1: 0.5120
 epoch: 26, train_loss: 0.9164, test_loss: 0.9516, test_f1: 0.5129
 epoch: 27, train_loss: 0.9028, test_loss: 0.9346, test_f1: 0.5194
 epoch: 28, train_loss: 0.9037, test_loss: 0.9392, test_f1: 0.5268
 epoch: 29, train_loss: 0.9002, test_loss: 0.9529, test_f1: 0.5205
 epoch: 30, train_loss: 0.8803, test_loss: 0.9455, test_f1: 0.5216
 epoch: 31, train_loss: 0.8808, test_loss: 0.9352, test_f1: 0.5302
 epoch: 32, train_loss: 0.8816, test_loss: 0.9436, test_f1: 0.5289
 epoch: 33, train_loss: 0.8690, test_loss: 0.9567, test_f1: 0.5146
 epoch: 34, train_loss: 0.8672, test_loss: 0.9524, test_f1: 0.5240
 epoch: 35, train_loss: 0.8626, test_loss: 0.9329, test_f1: 0.5178
 epoch: 36, train_loss: 0.8619, test_loss: 0.9541, test_f1: 0.5162
 epoch: 37, train_loss: 0.8624, test_loss: 0.9452, test_f1: 0.5205
 epoch: 38, train_loss: 0.8512, test_loss: 0.9291, test_f1: 0.5209
 epoch: 39, train_loss: 0.8508, test_loss: 0.9641, test_f1: 0.5166
 epoch: 40, train_loss: 0.8465, test_loss: 0.9620, test_f1: 0.5194
 epoch: 41, train_loss: 0.8443, test_loss: 0.9704, test_f1: 0.5116
 epoch: 42, train_loss: 0.8400, test_loss: 0.9476, test_f1: 0.5211
 epoch: 43, train_loss: 0.8469, test_loss: 0.9447, test_f1: 0.5388
 epoch: 44, train_loss: 0.8410, test_loss: 0.9698, test_f1: 0.5183
 epoch: 45, train_loss: 0.8361, test_loss: 0.9526, test_f1: 0.5415
 epoch: 46, train_loss: 0.8335, test_loss: 0.9497, test_f1: 0.5374
 epoch: 47, train_loss: 0.8275, test_loss: 0.9761, test_f1: 0.5287
 epoch: 48, train_loss: 0.8273, test_loss: 0.9406, test_f1: 0.5486
 epoch: 49, train_loss: 0.8231, test_loss: 0.9571, test_f1: 0.5381
 epoch: 50, train_loss: 0.8149, test_loss: 0.9664, test_f1: 0.5498
 epoch: 51, train_loss: 0.8175, test_loss: 0.9656, test_f1: 0.5390
 epoch: 52, train_loss: 0.8154, test_loss: 0.9618, test_f1: 0.5476
 epoch: 53, train_loss: 0.8122, test_loss: 0.9609, test_f1: 0.5494
 epoch: 54, train_loss: 0.8101, test_loss: 0.9601, test_f1: 0.5437
 epoch: 55, train_loss: 0.8043, test_loss: 0.9537, test_f1: 0.5506
 epoch: 56, train_loss: 0.8094, test_loss: 0.9569, test_f1: 0.5508
 epoch: 57, train_loss: 0.8005, test_loss: 0.9640, test_f1: 0.5515
 epoch: 58, train_loss: 0.8012, test_loss: 0.9552, test_f1: 0.5551
 epoch: 59, train_loss: 0.7967, test_loss: 0.9514, test_f1: 0.5568
 epoch: 60, train_loss: 0.7992, test_loss: 0.9671, test_f1: 0.5482
 epoch: 61, train_loss: 0.7990, test_loss: 0.9567, test_f1: 0.5472
 epoch: 62, train_loss: 0.7930, test_loss: 0.9644, test_f1: 0.5497
 epoch: 63, train_loss: 0.7844, test_loss: 0.9692, test_f1: 0.5521
 epoch: 64, train_loss: 0.7875, test_loss: 0.9599, test_f1: 0.5448
 epoch: 65, train_loss: 0.7884, test_loss: 0.9585, test_f1: 0.5445
 epoch: 66, train_loss: 0.7912, test_loss: 0.9760, test_f1: 0.5483
 epoch: 67, train_loss: 0.7873, test_loss: 0.9785, test_f1: 0.5463
 epoch: 68, train_loss: 0.7855, test_loss: 0.9752, test_f1: 0.5396
 epoch: 69, train_loss: 0.7879, test_loss: 0.9651, test_f1: 0.5500
 epoch: 70, train_loss: 0.7864, test_loss: 0.9715, test_f1: 0.5485
 epoch: 71, train_loss: 0.7873, test_loss: 0.9801, test_f1: 0.5552
 epoch: 72, train_loss: 0.7832, test_loss: 0.9757, test_f1: 0.5512
 epoch: 73, train_loss: 0.7849, test_loss: 0.9863, test_f1: 0.5510
 epoch: 74, train_loss: 0.7929, test_loss: 0.9793, test_f1: 0.5581
 epoch: 75, train_loss: 0.7775, test_loss: 0.9688, test_f1: 0.5619
 epoch: 76, train_loss: 0.7793, test_loss: 0.9707, test_f1: 0.5560
 epoch: 77, train_loss: 0.7688, test_loss: 0.9775, test_f1: 0.5481
 epoch: 78, train_loss: 0.7839, test_loss: 0.9762, test_f1: 0.5559
 epoch: 79, train_loss: 0.7741, test_loss: 0.9758, test_f1: 0.5646
 epoch: 80, train_loss: 0.7729, test_loss: 0.9716, test_f1: 0.5543
 epoch: 81, train_loss: 0.7712, test_loss: 0.9898, test_f1: 0.5530
 epoch: 82, train_loss: 0.7720, test_loss: 0.9719, test_f1: 0.5527
 epoch: 83, train_loss: 0.7740, test_loss: 0.9813, test_f1: 0.5565
 epoch: 84, train_loss: 0.7701, test_loss: 0.9900, test_f1: 0.5493
 epoch: 85, train_loss: 0.7772, test_loss: 0.9835, test_f1: 0.5532
 epoch: 86, train_loss: 0.7722, test_loss: 0.9812, test_f1: 0.5516
 epoch: 87, train_loss: 0.7655, test_loss: 0.9805, test_f1: 0.5557
 epoch: 88, train_loss: 0.7691, test_loss: 0.9738, test_f1: 0.5603
 epoch: 89, train_loss: 0.7720, test_loss: 0.9851, test_f1: 0.5540
 epoch: 90, train_loss: 0.7608, test_loss: 0.9839, test_f1: 0.5593
 epoch: 91, train_loss: 0.7586, test_loss: 0.9807, test_f1: 0.5576
 epoch: 92, train_loss: 0.7646, test_loss: 0.9796, test_f1: 0.5627
 epoch: 93, train_loss: 0.7613, test_loss: 0.9838, test_f1: 0.5568
 epoch: 94, train_loss: 0.7573, test_loss: 0.9836, test_f1: 0.5601
 epoch: 95, train_loss: 0.7620, test_loss: 0.9833, test_f1: 0.5608
 epoch: 96, train_loss: 0.7484, test_loss: 0.9864, test_f1: 0.5601
 epoch: 97, train_loss: 0.7579, test_loss: 0.9914, test_f1: 0.5611
 epoch: 98, train_loss: 0.7526, test_loss: 0.9791, test_f1: 0.5659
 epoch: 99, train_loss: 0.7524, test_loss: 0.9851, test_f1: 0.5612
##################ITERATION #9 ****************************************
 epoch: 0, train_loss: 1.3079, test_loss: 1.3074, test_f1: 0.2270
 epoch: 1, train_loss: 1.2132, test_loss: 1.2968, test_f1: 0.3318
 epoch: 2, train_loss: 1.1838, test_loss: 1.2553, test_f1: 0.2808
 epoch: 3, train_loss: 1.1605, test_loss: 1.1647, test_f1: 0.3703
 epoch: 4, train_loss: 1.1360, test_loss: 1.1204, test_f1: 0.4024
 epoch: 5, train_loss: 1.1088, test_loss: 1.0945, test_f1: 0.4389
 epoch: 6, train_loss: 1.1052, test_loss: 1.0648, test_f1: 0.4555
 epoch: 7, train_loss: 1.0800, test_loss: 1.0307, test_f1: 0.4705
 epoch: 8, train_loss: 1.0677, test_loss: 1.0157, test_f1: 0.4722
 epoch: 9, train_loss: 1.0518, test_loss: 1.0154, test_f1: 0.4563
 epoch: 10, train_loss: 1.0488, test_loss: 1.0074, test_f1: 0.4740
 epoch: 11, train_loss: 1.0282, test_loss: 0.9932, test_f1: 0.4903
 epoch: 12, train_loss: 1.0190, test_loss: 0.9832, test_f1: 0.4943
 epoch: 13, train_loss: 1.0135, test_loss: 0.9790, test_f1: 0.4961
 epoch: 14, train_loss: 1.0001, test_loss: 0.9712, test_f1: 0.4974
 epoch: 15, train_loss: 0.9943, test_loss: 0.9681, test_f1: 0.5015
 epoch: 16, train_loss: 0.9864, test_loss: 0.9604, test_f1: 0.5041
 epoch: 17, train_loss: 0.9767, test_loss: 0.9587, test_f1: 0.4993
 epoch: 18, train_loss: 0.9700, test_loss: 0.9498, test_f1: 0.5055
 epoch: 19, train_loss: 0.9708, test_loss: 0.9393, test_f1: 0.5062
 epoch: 20, train_loss: 0.9508, test_loss: 0.9482, test_f1: 0.5062
 epoch: 21, train_loss: 0.9498, test_loss: 0.9417, test_f1: 0.5029
 epoch: 22, train_loss: 0.9402, test_loss: 0.9328, test_f1: 0.5054
 epoch: 23, train_loss: 0.9408, test_loss: 0.9437, test_f1: 0.5072
 epoch: 24, train_loss: 0.9350, test_loss: 0.9321, test_f1: 0.5075
 epoch: 25, train_loss: 0.9346, test_loss: 0.9337, test_f1: 0.5093
 epoch: 26, train_loss: 0.9331, test_loss: 0.9337, test_f1: 0.5118
 epoch: 27, train_loss: 0.9204, test_loss: 0.9341, test_f1: 0.5128
 epoch: 28, train_loss: 0.9197, test_loss: 0.9349, test_f1: 0.5081
 epoch: 29, train_loss: 0.9165, test_loss: 0.9300, test_f1: 0.5056
 epoch: 30, train_loss: 0.9132, test_loss: 0.9291, test_f1: 0.5065
 epoch: 31, train_loss: 0.9061, test_loss: 0.9325, test_f1: 0.5186
 epoch: 32, train_loss: 0.9002, test_loss: 0.9379, test_f1: 0.5201
 epoch: 33, train_loss: 0.8965, test_loss: 0.9372, test_f1: 0.5126
 epoch: 34, train_loss: 0.8964, test_loss: 0.9308, test_f1: 0.5205
 epoch: 35, train_loss: 0.8887, test_loss: 0.9261, test_f1: 0.5170
 epoch: 36, train_loss: 0.8937, test_loss: 0.9234, test_f1: 0.5099
 epoch: 37, train_loss: 0.8790, test_loss: 0.9102, test_f1: 0.5254
 epoch: 38, train_loss: 0.8796, test_loss: 0.9278, test_f1: 0.5169
 epoch: 39, train_loss: 0.8744, test_loss: 0.9287, test_f1: 0.5221
 epoch: 40, train_loss: 0.8647, test_loss: 0.9325, test_f1: 0.5129
 epoch: 41, train_loss: 0.8710, test_loss: 0.9165, test_f1: 0.5193
 epoch: 42, train_loss: 0.8653, test_loss: 0.9143, test_f1: 0.5247
 epoch: 43, train_loss: 0.8605, test_loss: 0.9231, test_f1: 0.5218
 epoch: 44, train_loss: 0.8604, test_loss: 0.9203, test_f1: 0.5239
 epoch: 45, train_loss: 0.8678, test_loss: 0.9277, test_f1: 0.5285
 epoch: 46, train_loss: 0.8535, test_loss: 0.9313, test_f1: 0.5255
 epoch: 47, train_loss: 0.8507, test_loss: 0.9151, test_f1: 0.5195
 epoch: 48, train_loss: 0.8384, test_loss: 0.9291, test_f1: 0.5197
 epoch: 49, train_loss: 0.8405, test_loss: 0.9297, test_f1: 0.5310
 epoch: 50, train_loss: 0.8419, test_loss: 0.9305, test_f1: 0.5248
 epoch: 51, train_loss: 0.8411, test_loss: 0.9255, test_f1: 0.5316
 epoch: 52, train_loss: 0.8382, test_loss: 0.9310, test_f1: 0.5233
 epoch: 53, train_loss: 0.8302, test_loss: 0.9246, test_f1: 0.5293
 epoch: 54, train_loss: 0.8325, test_loss: 0.9216, test_f1: 0.5310
 epoch: 55, train_loss: 0.8232, test_loss: 0.9200, test_f1: 0.5315
 epoch: 56, train_loss: 0.8327, test_loss: 0.9220, test_f1: 0.5271
 epoch: 57, train_loss: 0.8302, test_loss: 0.9170, test_f1: 0.5252
 epoch: 58, train_loss: 0.8269, test_loss: 0.9163, test_f1: 0.5259
 epoch: 59, train_loss: 0.8189, test_loss: 0.9230, test_f1: 0.5276
 epoch: 60, train_loss: 0.8122, test_loss: 0.9248, test_f1: 0.5266
 epoch: 61, train_loss: 0.8203, test_loss: 0.9231, test_f1: 0.5284
 epoch: 62, train_loss: 0.8179, test_loss: 0.9335, test_f1: 0.5260
 epoch: 63, train_loss: 0.8125, test_loss: 0.9209, test_f1: 0.5288
 epoch: 64, train_loss: 0.8179, test_loss: 0.9246, test_f1: 0.5218
 epoch: 65, train_loss: 0.8099, test_loss: 0.9266, test_f1: 0.5261
 epoch: 66, train_loss: 0.8142, test_loss: 0.9254, test_f1: 0.5296
 epoch: 67, train_loss: 0.8122, test_loss: 0.9240, test_f1: 0.5303
 epoch: 68, train_loss: 0.8092, test_loss: 0.9284, test_f1: 0.5298
 epoch: 69, train_loss: 0.8107, test_loss: 0.9292, test_f1: 0.5294
 epoch: 70, train_loss: 0.8003, test_loss: 0.9257, test_f1: 0.5281
 epoch: 71, train_loss: 0.7962, test_loss: 0.9249, test_f1: 0.5217
 epoch: 72, train_loss: 0.8000, test_loss: 0.9293, test_f1: 0.5279
 epoch: 73, train_loss: 0.8030, test_loss: 0.9311, test_f1: 0.5253
 epoch: 74, train_loss: 0.8015, test_loss: 0.9323, test_f1: 0.5258
 epoch: 75, train_loss: 0.7952, test_loss: 0.9338, test_f1: 0.5283
 epoch: 76, train_loss: 0.7952, test_loss: 0.9316, test_f1: 0.5345
 epoch: 77, train_loss: 0.7934, test_loss: 0.9361, test_f1: 0.5239
 epoch: 78, train_loss: 0.7984, test_loss: 0.9289, test_f1: 0.5323
 epoch: 79, train_loss: 0.7862, test_loss: 0.9312, test_f1: 0.5295
 epoch: 80, train_loss: 0.7864, test_loss: 0.9294, test_f1: 0.5329
 epoch: 81, train_loss: 0.7913, test_loss: 0.9283, test_f1: 0.5346
 epoch: 82, train_loss: 0.7907, test_loss: 0.9313, test_f1: 0.5316
 epoch: 83, train_loss: 0.7821, test_loss: 0.9270, test_f1: 0.5367
 epoch: 84, train_loss: 0.7814, test_loss: 0.9297, test_f1: 0.5379
 epoch: 85, train_loss: 0.7838, test_loss: 0.9317, test_f1: 0.5364
 epoch: 86, train_loss: 0.7855, test_loss: 0.9368, test_f1: 0.5340
 epoch: 87, train_loss: 0.7805, test_loss: 0.9313, test_f1: 0.5415
 epoch: 88, train_loss: 0.7770, test_loss: 0.9318, test_f1: 0.5331
 epoch: 89, train_loss: 0.7786, test_loss: 0.9260, test_f1: 0.5369
 epoch: 90, train_loss: 0.7721, test_loss: 0.9340, test_f1: 0.5417
 epoch: 91, train_loss: 0.7799, test_loss: 0.9424, test_f1: 0.5364
 epoch: 92, train_loss: 0.7760, test_loss: 0.9376, test_f1: 0.5349
 epoch: 93, train_loss: 0.7785, test_loss: 0.9313, test_f1: 0.5435
 epoch: 94, train_loss: 0.7754, test_loss: 0.9307, test_f1: 0.5425
 epoch: 95, train_loss: 0.7700, test_loss: 0.9318, test_f1: 0.5461
 epoch: 96, train_loss: 0.7724, test_loss: 0.9398, test_f1: 0.5453
 epoch: 97, train_loss: 0.7704, test_loss: 0.9384, test_f1: 0.5382
 epoch: 98, train_loss: 0.7680, test_loss: 0.9344, test_f1: 0.5463
 epoch: 99, train_loss: 0.7682, test_loss: 0.9344, test_f1: 0.5498

Training completed in 400.64 seconds
Best F1: 0.5757 at epoch 56
Mean F1 across iterations: 0.5572  0.0086
========================FINAL RESULTS================================
FEGIN weighted F1: 0.5757  0.0086
python main.py --data ltspice_examples --representation component_net --model FEGIN --layers 4 --hiddens 64 --batch_size 256 --lr 0.0001 --emb_size 250 --epochs 100 --save_appendix component_net_L4_H64_BS256_LR0.0001_E250 --no_val
-----



STDERR:
  File "main.py", line 370, in <module>
    main()
  File "main.py", line 254, in main
    dataset = dataset_class(
  File "/home/philip/projects/ltspice_examples_code_repo/Circuit-Completion-Using-GNNs/component_classification_with_link_prediction_head/evaluation/FEGIN/kernel/circuit_datasets.py", line 15, in __init__
    self.data, self.slices = torch.load(self.processed_paths[0])
  File "/home/philip/.local/lib/python3.8/site-packages/torch/serialization.py", line 1040, in load
    warnings.warn(
  File "/usr/lib/python3.8/warnings.py", line 109, in _showwarnmsg
    sw(msg.message, msg.category, msg.filename, msg.lineno,
  File "main.py", line 47, in warn_with_traceback
    traceback.print_stack(file=log)
/home/philip/projects/ltspice_examples_code_repo/Circuit-Completion-Using-GNNs/component_classification_with_link_prediction_head/evaluation/FEGIN/kernel/circuit_datasets.py:15: FutureWarning: You are using `torch.load` with `weights_only=False` (the current default value), which uses the default pickle module implicitly. It is possible to construct malicious pickle data which will execute arbitrary code during unpickling (See https://github.com/pytorch/pytorch/blob/main/SECURITY.md#untrusted-models for more details). In a future release, the default value for `weights_only` will be flipped to `True`. This limits the functions that could be executed during unpickling. Arbitrary objects will no longer be allowed to be loaded via this mode unless they are explicitly allowlisted by the user via `torch.serialization.add_safe_globals`. We recommend you start setting `weights_only=True` for any use case where you don't have full control of the loaded file. Please open an issue on GitHub for any issues related to this experimental feature.
  self.data, self.slices = torch.load(self.processed_paths[0])
