STDOUT:
Results will be saved in /home/philip/projects/ltspice_examples_code_repo/Circuit-Completion-Using-GNNs/component_classification_with_link_prediction_head/evaluation/FEGIN/results/model_FEGIN_dataset_ltspice_examples
Command line input: python main.py --data ltspice_examples --representation component_pin --model FEGIN --layers 3 --hiddens 32 --batch_size 128 --lr 0.01 --emb_size 128 --epochs 100 --save_appendix component_pin_L3_H32_BS128_LR0.01_E128 --no_val
 is saved.
-----
ltspice_examples - FEGIN
Using 3 layers, 32 hidden units, h = 2
Loading component_pin representation dataset
ENTERED
Training FEGIN on component_pin representation
Train: 3560, Test: 848
##################ITERATION #0 ****************************************
 epoch: 0, train_loss: 1.2488, test_loss: 1.2573, test_f1: 0.2260
 epoch: 1, train_loss: 1.1099, test_loss: 1.0758, test_f1: 0.3451
 epoch: 2, train_loss: 1.0385, test_loss: 1.2640, test_f1: 0.3862
 epoch: 3, train_loss: 0.9981, test_loss: 1.0559, test_f1: 0.3785
 epoch: 4, train_loss: 0.9521, test_loss: 0.9177, test_f1: 0.4854
 epoch: 5, train_loss: 0.9240, test_loss: 0.9723, test_f1: 0.5114
 epoch: 6, train_loss: 0.9241, test_loss: 1.0229, test_f1: 0.5040
 epoch: 7, train_loss: 0.8875, test_loss: 1.0123, test_f1: 0.4585
 epoch: 8, train_loss: 0.8669, test_loss: 0.8769, test_f1: 0.5091
 epoch: 9, train_loss: 0.8415, test_loss: 1.0267, test_f1: 0.4841
 epoch: 10, train_loss: 0.8337, test_loss: 0.9777, test_f1: 0.4970
 epoch: 11, train_loss: 0.8241, test_loss: 1.0108, test_f1: 0.4982
 epoch: 12, train_loss: 0.8252, test_loss: 0.9387, test_f1: 0.5008
 epoch: 13, train_loss: 0.8236, test_loss: 1.0311, test_f1: 0.5166
 epoch: 14, train_loss: 0.8216, test_loss: 0.8538, test_f1: 0.5219
 epoch: 15, train_loss: 0.7879, test_loss: 0.8641, test_f1: 0.5917
 epoch: 16, train_loss: 0.7810, test_loss: 0.7663, test_f1: 0.5525
 epoch: 17, train_loss: 0.7887, test_loss: 0.7967, test_f1: 0.5972
 epoch: 18, train_loss: 0.7797, test_loss: 0.8556, test_f1: 0.5343
 epoch: 19, train_loss: 0.7893, test_loss: 0.9856, test_f1: 0.5240
 epoch: 20, train_loss: 0.7731, test_loss: 0.8790, test_f1: 0.5354
 epoch: 21, train_loss: 0.7657, test_loss: 0.9344, test_f1: 0.5174
 epoch: 22, train_loss: 0.7653, test_loss: 0.9215, test_f1: 0.5084
 epoch: 23, train_loss: 0.7626, test_loss: 0.9057, test_f1: 0.5125
 epoch: 24, train_loss: 0.7650, test_loss: 0.8810, test_f1: 0.5033
 epoch: 25, train_loss: 0.7582, test_loss: 0.9231, test_f1: 0.5392
 epoch: 26, train_loss: 0.7397, test_loss: 0.9023, test_f1: 0.5685
 epoch: 27, train_loss: 0.7248, test_loss: 0.9138, test_f1: 0.5581
 epoch: 28, train_loss: 0.7494, test_loss: 1.0631, test_f1: 0.4940
 epoch: 29, train_loss: 0.7433, test_loss: 0.7906, test_f1: 0.6095
 epoch: 30, train_loss: 0.7156, test_loss: 0.9025, test_f1: 0.5826
 epoch: 31, train_loss: 0.7280, test_loss: 0.8222, test_f1: 0.5562
 epoch: 32, train_loss: 0.7227, test_loss: 0.8420, test_f1: 0.5800
 epoch: 33, train_loss: 0.7121, test_loss: 0.8747, test_f1: 0.5668
 epoch: 34, train_loss: 0.6978, test_loss: 0.8767, test_f1: 0.5502
 epoch: 35, train_loss: 0.7000, test_loss: 0.8892, test_f1: 0.5211
 epoch: 36, train_loss: 0.6943, test_loss: 0.9215, test_f1: 0.5357
 epoch: 37, train_loss: 0.6919, test_loss: 0.8417, test_f1: 0.5659
 epoch: 38, train_loss: 0.6814, test_loss: 0.8469, test_f1: 0.5607
 epoch: 39, train_loss: 0.6756, test_loss: 0.8129, test_f1: 0.5922
 epoch: 40, train_loss: 0.7032, test_loss: 0.7813, test_f1: 0.5722
 epoch: 41, train_loss: 0.6911, test_loss: 0.8290, test_f1: 0.6102
 epoch: 42, train_loss: 0.6716, test_loss: 0.9396, test_f1: 0.6246
 epoch: 43, train_loss: 0.6698, test_loss: 1.2473, test_f1: 0.5214
 epoch: 44, train_loss: 0.6725, test_loss: 0.7842, test_f1: 0.5897
 epoch: 45, train_loss: 0.6568, test_loss: 0.8378, test_f1: 0.5948
 epoch: 46, train_loss: 0.6687, test_loss: 0.9277, test_f1: 0.5407
 epoch: 47, train_loss: 0.6626, test_loss: 0.8986, test_f1: 0.6291
 epoch: 48, train_loss: 0.6491, test_loss: 0.7911, test_f1: 0.6104
 epoch: 49, train_loss: 0.6757, test_loss: 0.9129, test_f1: 0.5540
 epoch: 50, train_loss: 0.6794, test_loss: 0.8038, test_f1: 0.5734
 epoch: 51, train_loss: 0.6201, test_loss: 0.7933, test_f1: 0.6065
 epoch: 52, train_loss: 0.6047, test_loss: 0.8918, test_f1: 0.6068
 epoch: 53, train_loss: 0.5931, test_loss: 0.9310, test_f1: 0.5784
 epoch: 54, train_loss: 0.5821, test_loss: 0.8573, test_f1: 0.6061
 epoch: 55, train_loss: 0.5922, test_loss: 0.9465, test_f1: 0.6075
 epoch: 56, train_loss: 0.5843, test_loss: 1.0061, test_f1: 0.5890
 epoch: 57, train_loss: 0.5930, test_loss: 0.8506, test_f1: 0.6600
 epoch: 58, train_loss: 0.5979, test_loss: 0.9617, test_f1: 0.5900
 epoch: 59, train_loss: 0.5829, test_loss: 0.9271, test_f1: 0.5892
 epoch: 60, train_loss: 0.5778, test_loss: 0.8009, test_f1: 0.5981
 epoch: 61, train_loss: 0.5830, test_loss: 0.8436, test_f1: 0.6251
 epoch: 62, train_loss: 0.5722, test_loss: 0.7632, test_f1: 0.6170
 epoch: 63, train_loss: 0.5811, test_loss: 0.8817, test_f1: 0.6032
 epoch: 64, train_loss: 0.5625, test_loss: 0.9211, test_f1: 0.6125
 epoch: 65, train_loss: 0.5658, test_loss: 0.8979, test_f1: 0.6266
 epoch: 66, train_loss: 0.5596, test_loss: 0.8819, test_f1: 0.6206
 epoch: 67, train_loss: 0.5502, test_loss: 1.0699, test_f1: 0.5982
 epoch: 68, train_loss: 0.5523, test_loss: 0.8968, test_f1: 0.6257
 epoch: 69, train_loss: 0.5668, test_loss: 0.9183, test_f1: 0.6444
 epoch: 70, train_loss: 0.5519, test_loss: 0.9358, test_f1: 0.5969
 epoch: 71, train_loss: 0.5366, test_loss: 0.9817, test_f1: 0.5955
 epoch: 72, train_loss: 0.5409, test_loss: 0.9858, test_f1: 0.6198
 epoch: 73, train_loss: 0.5569, test_loss: 0.9411, test_f1: 0.6181
 epoch: 74, train_loss: 0.5515, test_loss: 1.0055, test_f1: 0.5982
 epoch: 75, train_loss: 0.5371, test_loss: 0.9026, test_f1: 0.6202
 epoch: 76, train_loss: 0.5235, test_loss: 0.9547, test_f1: 0.6278
 epoch: 77, train_loss: 0.5421, test_loss: 0.9377, test_f1: 0.5938
 epoch: 78, train_loss: 0.5613, test_loss: 0.9302, test_f1: 0.6545
 epoch: 79, train_loss: 0.5524, test_loss: 0.9073, test_f1: 0.6285
 epoch: 80, train_loss: 0.5375, test_loss: 1.0394, test_f1: 0.5778
 epoch: 81, train_loss: 0.5450, test_loss: 0.8815, test_f1: 0.6372
 epoch: 82, train_loss: 0.5255, test_loss: 0.9050, test_f1: 0.6178
 epoch: 83, train_loss: 0.5224, test_loss: 0.9733, test_f1: 0.6233
 epoch: 84, train_loss: 0.5312, test_loss: 1.0931, test_f1: 0.6119
 epoch: 85, train_loss: 0.5276, test_loss: 0.9241, test_f1: 0.6530
 epoch: 86, train_loss: 0.5302, test_loss: 0.9626, test_f1: 0.6294
 epoch: 87, train_loss: 0.5528, test_loss: 0.9163, test_f1: 0.6372
 epoch: 88, train_loss: 0.5206, test_loss: 0.9099, test_f1: 0.6389
 epoch: 89, train_loss: 0.5178, test_loss: 0.7779, test_f1: 0.6676
 epoch: 90, train_loss: 0.5261, test_loss: 0.9982, test_f1: 0.6434
 epoch: 91, train_loss: 0.4990, test_loss: 0.9823, test_f1: 0.6304
 epoch: 92, train_loss: 0.4988, test_loss: 1.0090, test_f1: 0.6476
 epoch: 93, train_loss: 0.5018, test_loss: 1.0455, test_f1: 0.6230
 epoch: 94, train_loss: 0.5216, test_loss: 0.9910, test_f1: 0.6058
 epoch: 95, train_loss: 0.4971, test_loss: 0.9715, test_f1: 0.6495
 epoch: 96, train_loss: 0.4922, test_loss: 0.9342, test_f1: 0.6339
 epoch: 97, train_loss: 0.5090, test_loss: 1.0447, test_f1: 0.6475
 epoch: 98, train_loss: 0.5018, test_loss: 0.9553, test_f1: 0.6873
 epoch: 99, train_loss: 0.5033, test_loss: 0.9236, test_f1: 0.6300
##################ITERATION #1 ****************************************
 epoch: 0, train_loss: 1.1499, test_loss: 1.0760, test_f1: 0.3948
 epoch: 1, train_loss: 1.0174, test_loss: 1.2425, test_f1: 0.4266
 epoch: 2, train_loss: 0.9946, test_loss: 0.9875, test_f1: 0.4546
 epoch: 3, train_loss: 0.9752, test_loss: 1.3184, test_f1: 0.4406
 epoch: 4, train_loss: 0.9678, test_loss: 1.0225, test_f1: 0.4795
 epoch: 5, train_loss: 0.9329, test_loss: 0.9776, test_f1: 0.4634
 epoch: 6, train_loss: 0.9185, test_loss: 0.9680, test_f1: 0.5405
 epoch: 7, train_loss: 0.9081, test_loss: 0.9495, test_f1: 0.5089
 epoch: 8, train_loss: 0.8849, test_loss: 0.9286, test_f1: 0.4962
 epoch: 9, train_loss: 0.8660, test_loss: 0.8870, test_f1: 0.5502
 epoch: 10, train_loss: 0.8699, test_loss: 1.0303, test_f1: 0.4931
 epoch: 11, train_loss: 0.8609, test_loss: 0.9633, test_f1: 0.5222
 epoch: 12, train_loss: 0.8551, test_loss: 0.9554, test_f1: 0.4945
 epoch: 13, train_loss: 0.8315, test_loss: 0.9248, test_f1: 0.5233
 epoch: 14, train_loss: 0.8271, test_loss: 1.0223, test_f1: 0.4781
 epoch: 15, train_loss: 0.8087, test_loss: 0.9613, test_f1: 0.5184
 epoch: 16, train_loss: 0.8076, test_loss: 0.8943, test_f1: 0.5859
 epoch: 17, train_loss: 0.7977, test_loss: 1.3438, test_f1: 0.4710
 epoch: 18, train_loss: 0.7981, test_loss: 0.9478, test_f1: 0.5424
 epoch: 19, train_loss: 0.7799, test_loss: 1.0580, test_f1: 0.5083
 epoch: 20, train_loss: 0.7661, test_loss: 0.9385, test_f1: 0.5640
 epoch: 21, train_loss: 0.7766, test_loss: 0.9573, test_f1: 0.5503
 epoch: 22, train_loss: 0.7771, test_loss: 0.8929, test_f1: 0.5870
 epoch: 23, train_loss: 0.7502, test_loss: 1.2052, test_f1: 0.4641
 epoch: 24, train_loss: 0.7616, test_loss: 0.9567, test_f1: 0.5294
 epoch: 25, train_loss: 0.7704, test_loss: 1.0333, test_f1: 0.4852
 epoch: 26, train_loss: 0.7664, test_loss: 0.9785, test_f1: 0.5204
 epoch: 27, train_loss: 0.7503, test_loss: 1.0544, test_f1: 0.5557
 epoch: 28, train_loss: 0.7518, test_loss: 0.8186, test_f1: 0.6028
 epoch: 29, train_loss: 0.7573, test_loss: 0.9284, test_f1: 0.5573
 epoch: 30, train_loss: 0.7391, test_loss: 0.9289, test_f1: 0.5925
 epoch: 31, train_loss: 0.7235, test_loss: 0.8542, test_f1: 0.5988
 epoch: 32, train_loss: 0.7067, test_loss: 0.8840, test_f1: 0.6316
 epoch: 33, train_loss: 0.7421, test_loss: 0.8482, test_f1: 0.6278
 epoch: 34, train_loss: 0.7121, test_loss: 0.9315, test_f1: 0.5681
 epoch: 35, train_loss: 0.7180, test_loss: 1.3026, test_f1: 0.4855
 epoch: 36, train_loss: 0.7367, test_loss: 0.9539, test_f1: 0.5443
 epoch: 37, train_loss: 0.7181, test_loss: 0.8894, test_f1: 0.6453
 epoch: 38, train_loss: 0.7020, test_loss: 0.9887, test_f1: 0.5751
 epoch: 39, train_loss: 0.6778, test_loss: 0.8669, test_f1: 0.6311
 epoch: 40, train_loss: 0.6935, test_loss: 0.9598, test_f1: 0.6076
 epoch: 41, train_loss: 0.7018, test_loss: 0.8609, test_f1: 0.5728
 epoch: 42, train_loss: 0.6777, test_loss: 0.9831, test_f1: 0.5661
 epoch: 43, train_loss: 0.6793, test_loss: 0.9044, test_f1: 0.5981
 epoch: 44, train_loss: 0.6874, test_loss: 0.9721, test_f1: 0.6431
 epoch: 45, train_loss: 0.6771, test_loss: 0.8556, test_f1: 0.6049
 epoch: 46, train_loss: 0.6681, test_loss: 0.9544, test_f1: 0.5882
 epoch: 47, train_loss: 0.6659, test_loss: 0.8943, test_f1: 0.5994
 epoch: 48, train_loss: 0.6656, test_loss: 0.9541, test_f1: 0.6197
 epoch: 49, train_loss: 0.6489, test_loss: 0.8749, test_f1: 0.6414
 epoch: 50, train_loss: 0.6482, test_loss: 1.0473, test_f1: 0.5484
 epoch: 51, train_loss: 0.6224, test_loss: 0.9977, test_f1: 0.6275
 epoch: 52, train_loss: 0.6036, test_loss: 1.0185, test_f1: 0.6276
 epoch: 53, train_loss: 0.5865, test_loss: 0.9123, test_f1: 0.6287
 epoch: 54, train_loss: 0.5818, test_loss: 1.0021, test_f1: 0.6090
 epoch: 55, train_loss: 0.5885, test_loss: 0.9780, test_f1: 0.6116
 epoch: 56, train_loss: 0.5687, test_loss: 0.9663, test_f1: 0.6328
 epoch: 57, train_loss: 0.5775, test_loss: 1.0932, test_f1: 0.5670
 epoch: 58, train_loss: 0.5702, test_loss: 0.9875, test_f1: 0.6440
 epoch: 59, train_loss: 0.5795, test_loss: 0.9658, test_f1: 0.6181
 epoch: 60, train_loss: 0.5800, test_loss: 1.1810, test_f1: 0.6338
 epoch: 61, train_loss: 0.5681, test_loss: 1.1243, test_f1: 0.6295
 epoch: 62, train_loss: 0.5593, test_loss: 1.2829, test_f1: 0.5854
 epoch: 63, train_loss: 0.5677, test_loss: 1.1498, test_f1: 0.5667
 epoch: 64, train_loss: 0.5745, test_loss: 1.0387, test_f1: 0.6396
 epoch: 65, train_loss: 0.5564, test_loss: 0.9670, test_f1: 0.6295
 epoch: 66, train_loss: 0.5648, test_loss: 1.0213, test_f1: 0.6390
 epoch: 67, train_loss: 0.5547, test_loss: 0.9991, test_f1: 0.6193
 epoch: 68, train_loss: 0.5462, test_loss: 1.1839, test_f1: 0.6107
 epoch: 69, train_loss: 0.5359, test_loss: 1.0696, test_f1: 0.6341
 epoch: 70, train_loss: 0.5293, test_loss: 1.0672, test_f1: 0.6291
 epoch: 71, train_loss: 0.5416, test_loss: 1.1652, test_f1: 0.6198
 epoch: 72, train_loss: 0.5476, test_loss: 1.0455, test_f1: 0.6425
 epoch: 73, train_loss: 0.5329, test_loss: 1.2304, test_f1: 0.5873
 epoch: 74, train_loss: 0.5362, test_loss: 1.1044, test_f1: 0.6216
 epoch: 75, train_loss: 0.5174, test_loss: 1.2952, test_f1: 0.5966
 epoch: 76, train_loss: 0.5447, test_loss: 1.1160, test_f1: 0.6257
 epoch: 77, train_loss: 0.5261, test_loss: 1.1452, test_f1: 0.6260
 epoch: 78, train_loss: 0.5114, test_loss: 1.0959, test_f1: 0.6458
 epoch: 79, train_loss: 0.5166, test_loss: 1.1830, test_f1: 0.6161
 epoch: 80, train_loss: 0.5279, test_loss: 1.3950, test_f1: 0.5864
 epoch: 81, train_loss: 0.5292, test_loss: 1.2007, test_f1: 0.6262
 epoch: 82, train_loss: 0.5207, test_loss: 1.0852, test_f1: 0.6215
 epoch: 83, train_loss: 0.5312, test_loss: 1.0705, test_f1: 0.6233
 epoch: 84, train_loss: 0.5169, test_loss: 1.2842, test_f1: 0.5897
 epoch: 85, train_loss: 0.5144, test_loss: 1.3109, test_f1: 0.6017
 epoch: 86, train_loss: 0.5143, test_loss: 1.1966, test_f1: 0.6222
 epoch: 87, train_loss: 0.5318, test_loss: 0.9967, test_f1: 0.5945
 epoch: 88, train_loss: 0.5329, test_loss: 1.1314, test_f1: 0.6174
 epoch: 89, train_loss: 0.4909, test_loss: 1.2815, test_f1: 0.6227
 epoch: 90, train_loss: 0.5012, test_loss: 1.1346, test_f1: 0.6158
 epoch: 91, train_loss: 0.4998, test_loss: 1.2016, test_f1: 0.6307
 epoch: 92, train_loss: 0.4987, test_loss: 1.3019, test_f1: 0.6098
 epoch: 93, train_loss: 0.4979, test_loss: 1.3474, test_f1: 0.5891
 epoch: 94, train_loss: 0.4853, test_loss: 1.2997, test_f1: 0.6060
 epoch: 95, train_loss: 0.4673, test_loss: 1.2307, test_f1: 0.6300
 epoch: 96, train_loss: 0.4927, test_loss: 1.4816, test_f1: 0.5999
 epoch: 97, train_loss: 0.4825, test_loss: 1.2991, test_f1: 0.6217
 epoch: 98, train_loss: 0.5125, test_loss: 1.2663, test_f1: 0.5125
 epoch: 99, train_loss: 0.4856, test_loss: 1.2348, test_f1: 0.6276
##################ITERATION #2 ****************************************
 epoch: 0, train_loss: 1.1168, test_loss: 1.1465, test_f1: 0.4499
 epoch: 1, train_loss: 0.9998, test_loss: 1.0466, test_f1: 0.4808
 epoch: 2, train_loss: 0.9638, test_loss: 1.0364, test_f1: 0.4632
 epoch: 3, train_loss: 0.9344, test_loss: 1.0205, test_f1: 0.4743
 epoch: 4, train_loss: 0.9296, test_loss: 1.0356, test_f1: 0.4691
 epoch: 5, train_loss: 0.9114, test_loss: 0.9754, test_f1: 0.4742
 epoch: 6, train_loss: 0.8784, test_loss: 1.0454, test_f1: 0.4574
 epoch: 7, train_loss: 0.8753, test_loss: 0.9581, test_f1: 0.5188
 epoch: 8, train_loss: 0.8703, test_loss: 0.9368, test_f1: 0.5347
 epoch: 9, train_loss: 0.8563, test_loss: 0.9485, test_f1: 0.5305
 epoch: 10, train_loss: 0.8388, test_loss: 0.9009, test_f1: 0.5085
 epoch: 11, train_loss: 0.8224, test_loss: 0.9525, test_f1: 0.4917
 epoch: 12, train_loss: 0.8247, test_loss: 1.0036, test_f1: 0.5819
 epoch: 13, train_loss: 0.8237, test_loss: 0.9590, test_f1: 0.5302
 epoch: 14, train_loss: 0.8125, test_loss: 1.0295, test_f1: 0.5120
 epoch: 15, train_loss: 0.8024, test_loss: 0.8666, test_f1: 0.6054
 epoch: 16, train_loss: 0.8050, test_loss: 0.9331, test_f1: 0.5748
 epoch: 17, train_loss: 0.8126, test_loss: 0.9173, test_f1: 0.6027
 epoch: 18, train_loss: 0.7630, test_loss: 0.8620, test_f1: 0.5980
 epoch: 19, train_loss: 0.7577, test_loss: 0.9089, test_f1: 0.5760
 epoch: 20, train_loss: 0.7480, test_loss: 0.8886, test_f1: 0.5532
 epoch: 21, train_loss: 0.7645, test_loss: 0.9060, test_f1: 0.5711
 epoch: 22, train_loss: 0.7512, test_loss: 0.9443, test_f1: 0.5699
 epoch: 23, train_loss: 0.7393, test_loss: 1.2258, test_f1: 0.4245
 epoch: 24, train_loss: 0.7488, test_loss: 0.9957, test_f1: 0.5272
 epoch: 25, train_loss: 0.7582, test_loss: 0.9485, test_f1: 0.5768
 epoch: 26, train_loss: 0.7182, test_loss: 0.9618, test_f1: 0.6120
 epoch: 27, train_loss: 0.7428, test_loss: 0.9388, test_f1: 0.5689
 epoch: 28, train_loss: 0.7335, test_loss: 0.9113, test_f1: 0.5948
 epoch: 29, train_loss: 0.7208, test_loss: 1.0550, test_f1: 0.5905
 epoch: 30, train_loss: 0.6972, test_loss: 1.0346, test_f1: 0.5786
 epoch: 31, train_loss: 0.7097, test_loss: 1.0156, test_f1: 0.5097
 epoch: 32, train_loss: 0.7088, test_loss: 1.0717, test_f1: 0.5774
 epoch: 33, train_loss: 0.6980, test_loss: 0.9432, test_f1: 0.5707
 epoch: 34, train_loss: 0.7035, test_loss: 1.1177, test_f1: 0.5771
 epoch: 35, train_loss: 0.6932, test_loss: 0.9805, test_f1: 0.5866
 epoch: 36, train_loss: 0.7090, test_loss: 0.9054, test_f1: 0.6007
 epoch: 37, train_loss: 0.6757, test_loss: 0.8807, test_f1: 0.6250
 epoch: 38, train_loss: 0.6931, test_loss: 0.9409, test_f1: 0.5932
 epoch: 39, train_loss: 0.6798, test_loss: 0.9382, test_f1: 0.5952
 epoch: 40, train_loss: 0.6703, test_loss: 1.0722, test_f1: 0.5995
 epoch: 41, train_loss: 0.6651, test_loss: 0.9625, test_f1: 0.6226
 epoch: 42, train_loss: 0.6552, test_loss: 1.1095, test_f1: 0.5446
 epoch: 43, train_loss: 0.6834, test_loss: 1.1529, test_f1: 0.6009
 epoch: 44, train_loss: 0.6668, test_loss: 0.8993, test_f1: 0.6266
 epoch: 45, train_loss: 0.6564, test_loss: 1.1264, test_f1: 0.6071
 epoch: 46, train_loss: 0.6541, test_loss: 1.0683, test_f1: 0.5415
 epoch: 47, train_loss: 0.6592, test_loss: 0.9655, test_f1: 0.6056
 epoch: 48, train_loss: 0.6520, test_loss: 0.9801, test_f1: 0.6009
 epoch: 49, train_loss: 0.6640, test_loss: 0.9909, test_f1: 0.5785
 epoch: 50, train_loss: 0.6355, test_loss: 0.9859, test_f1: 0.5931
 epoch: 51, train_loss: 0.6397, test_loss: 0.9365, test_f1: 0.6390
 epoch: 52, train_loss: 0.5895, test_loss: 1.0574, test_f1: 0.6001
 epoch: 53, train_loss: 0.5879, test_loss: 1.0011, test_f1: 0.6193
 epoch: 54, train_loss: 0.5847, test_loss: 0.9397, test_f1: 0.6105
 epoch: 55, train_loss: 0.5884, test_loss: 1.1429, test_f1: 0.5815
 epoch: 56, train_loss: 0.5763, test_loss: 0.9921, test_f1: 0.6238
 epoch: 57, train_loss: 0.5728, test_loss: 0.9685, test_f1: 0.6072
 epoch: 58, train_loss: 0.5592, test_loss: 0.9513, test_f1: 0.6250
 epoch: 59, train_loss: 0.5713, test_loss: 0.9384, test_f1: 0.6534
 epoch: 60, train_loss: 0.5583, test_loss: 1.0282, test_f1: 0.6166
 epoch: 61, train_loss: 0.5493, test_loss: 0.9503, test_f1: 0.6230
 epoch: 62, train_loss: 0.5634, test_loss: 0.9795, test_f1: 0.6035
 epoch: 63, train_loss: 0.5735, test_loss: 0.9223, test_f1: 0.6072
 epoch: 64, train_loss: 0.5384, test_loss: 1.0093, test_f1: 0.6102
 epoch: 65, train_loss: 0.5405, test_loss: 0.9899, test_f1: 0.6084
 epoch: 66, train_loss: 0.5534, test_loss: 1.0839, test_f1: 0.5926
 epoch: 67, train_loss: 0.5630, test_loss: 0.9746, test_f1: 0.6107
 epoch: 68, train_loss: 0.5488, test_loss: 1.0709, test_f1: 0.6053
 epoch: 69, train_loss: 0.5325, test_loss: 1.0338, test_f1: 0.5926
 epoch: 70, train_loss: 0.5665, test_loss: 1.0950, test_f1: 0.6143
 epoch: 71, train_loss: 0.5480, test_loss: 0.9411, test_f1: 0.6206
 epoch: 72, train_loss: 0.5483, test_loss: 1.0440, test_f1: 0.5972
 epoch: 73, train_loss: 0.5298, test_loss: 0.9891, test_f1: 0.6140
 epoch: 74, train_loss: 0.5416, test_loss: 0.9681, test_f1: 0.6193
 epoch: 75, train_loss: 0.5454, test_loss: 1.0759, test_f1: 0.5987
 epoch: 76, train_loss: 0.5418, test_loss: 0.8940, test_f1: 0.6343
 epoch: 77, train_loss: 0.5388, test_loss: 0.9265, test_f1: 0.6120
 epoch: 78, train_loss: 0.5118, test_loss: 1.1803, test_f1: 0.5831
 epoch: 79, train_loss: 0.5210, test_loss: 0.9303, test_f1: 0.6404
 epoch: 80, train_loss: 0.5054, test_loss: 0.9634, test_f1: 0.6459
 epoch: 81, train_loss: 0.5126, test_loss: 1.0084, test_f1: 0.6237
 epoch: 82, train_loss: 0.5352, test_loss: 0.9395, test_f1: 0.6404
 epoch: 83, train_loss: 0.5145, test_loss: 1.1548, test_f1: 0.6007
 epoch: 84, train_loss: 0.5233, test_loss: 1.0085, test_f1: 0.6033
 epoch: 85, train_loss: 0.5160, test_loss: 0.9883, test_f1: 0.6412
 epoch: 86, train_loss: 0.5284, test_loss: 0.9528, test_f1: 0.6388
 epoch: 87, train_loss: 0.5302, test_loss: 1.0352, test_f1: 0.6362
 epoch: 88, train_loss: 0.5250, test_loss: 1.0311, test_f1: 0.6380
 epoch: 89, train_loss: 0.5072, test_loss: 0.9889, test_f1: 0.6120
 epoch: 90, train_loss: 0.5051, test_loss: 1.0529, test_f1: 0.6336
 epoch: 91, train_loss: 0.5098, test_loss: 0.9232, test_f1: 0.6165
 epoch: 92, train_loss: 0.4973, test_loss: 1.0258, test_f1: 0.6022
 epoch: 93, train_loss: 0.5042, test_loss: 1.1365, test_f1: 0.5982
 epoch: 94, train_loss: 0.4986, test_loss: 0.9423, test_f1: 0.6235
 epoch: 95, train_loss: 0.5157, test_loss: 0.9654, test_f1: 0.6339
 epoch: 96, train_loss: 0.4978, test_loss: 1.0097, test_f1: 0.6345
 epoch: 97, train_loss: 0.4873, test_loss: 1.1173, test_f1: 0.6159
 epoch: 98, train_loss: 0.4908, test_loss: 1.0495, test_f1: 0.5879
 epoch: 99, train_loss: 0.5119, test_loss: 1.0092, test_f1: 0.6295
##################ITERATION #3 ****************************************
 epoch: 0, train_loss: 1.1798, test_loss: 1.0497, test_f1: 0.4093
 epoch: 1, train_loss: 0.9966, test_loss: 1.1098, test_f1: 0.4494
 epoch: 2, train_loss: 0.9585, test_loss: 1.0069, test_f1: 0.4663
 epoch: 3, train_loss: 0.9270, test_loss: 1.6606, test_f1: 0.2858
 epoch: 4, train_loss: 0.9385, test_loss: 0.9957, test_f1: 0.5515
 epoch: 5, train_loss: 0.9081, test_loss: 1.0083, test_f1: 0.5163
 epoch: 6, train_loss: 0.9075, test_loss: 1.0169, test_f1: 0.4512
 epoch: 7, train_loss: 0.8680, test_loss: 1.0196, test_f1: 0.5119
 epoch: 8, train_loss: 0.8533, test_loss: 1.0982, test_f1: 0.4922
 epoch: 9, train_loss: 0.8387, test_loss: 0.9919, test_f1: 0.5083
 epoch: 10, train_loss: 0.8332, test_loss: 0.9732, test_f1: 0.5199
 epoch: 11, train_loss: 0.8082, test_loss: 1.0596, test_f1: 0.5100
 epoch: 12, train_loss: 0.8296, test_loss: 0.9166, test_f1: 0.5211
 epoch: 13, train_loss: 0.8121, test_loss: 0.8844, test_f1: 0.5469
 epoch: 14, train_loss: 0.7975, test_loss: 0.9360, test_f1: 0.5068
 epoch: 15, train_loss: 0.8218, test_loss: 0.8568, test_f1: 0.5307
 epoch: 16, train_loss: 0.7849, test_loss: 0.9240, test_f1: 0.5441
 epoch: 17, train_loss: 0.7935, test_loss: 1.0503, test_f1: 0.4935
 epoch: 18, train_loss: 0.7839, test_loss: 0.9766, test_f1: 0.4968
 epoch: 19, train_loss: 0.7829, test_loss: 0.8417, test_f1: 0.5607
 epoch: 20, train_loss: 0.7858, test_loss: 0.8375, test_f1: 0.5587
 epoch: 21, train_loss: 0.7619, test_loss: 1.2420, test_f1: 0.4696
 epoch: 22, train_loss: 0.7563, test_loss: 0.8633, test_f1: 0.5545
 epoch: 23, train_loss: 0.7338, test_loss: 0.9987, test_f1: 0.5728
 epoch: 24, train_loss: 0.7586, test_loss: 0.9503, test_f1: 0.5354
 epoch: 25, train_loss: 0.7537, test_loss: 1.0369, test_f1: 0.5552
 epoch: 26, train_loss: 0.7336, test_loss: 0.9326, test_f1: 0.6063
 epoch: 27, train_loss: 0.7359, test_loss: 1.0151, test_f1: 0.5585
 epoch: 28, train_loss: 0.7246, test_loss: 0.8675, test_f1: 0.5632
 epoch: 29, train_loss: 0.7130, test_loss: 1.2279, test_f1: 0.4996
 epoch: 30, train_loss: 0.7202, test_loss: 0.7966, test_f1: 0.6349
 epoch: 31, train_loss: 0.7275, test_loss: 0.8961, test_f1: 0.5730
 epoch: 32, train_loss: 0.7102, test_loss: 0.8952, test_f1: 0.5566
 epoch: 33, train_loss: 0.7142, test_loss: 0.9771, test_f1: 0.5715
 epoch: 34, train_loss: 0.6867, test_loss: 0.9428, test_f1: 0.5884
 epoch: 35, train_loss: 0.7037, test_loss: 1.1563, test_f1: 0.4576
 epoch: 36, train_loss: 0.6902, test_loss: 0.9896, test_f1: 0.5855
 epoch: 37, train_loss: 0.6810, test_loss: 1.0098, test_f1: 0.5459
 epoch: 38, train_loss: 0.7012, test_loss: 0.9592, test_f1: 0.5433
 epoch: 39, train_loss: 0.6856, test_loss: 0.9084, test_f1: 0.6133
 epoch: 40, train_loss: 0.6899, test_loss: 0.9370, test_f1: 0.5773
 epoch: 41, train_loss: 0.6808, test_loss: 0.9383, test_f1: 0.5659
 epoch: 42, train_loss: 0.6810, test_loss: 0.9302, test_f1: 0.5614
 epoch: 43, train_loss: 0.6864, test_loss: 1.0011, test_f1: 0.6252
 epoch: 44, train_loss: 0.6784, test_loss: 0.9307, test_f1: 0.6342
 epoch: 45, train_loss: 0.6479, test_loss: 0.9514, test_f1: 0.5969
 epoch: 46, train_loss: 0.6597, test_loss: 1.0410, test_f1: 0.5938
 epoch: 47, train_loss: 0.6406, test_loss: 0.9642, test_f1: 0.5760
 epoch: 48, train_loss: 0.6504, test_loss: 0.8804, test_f1: 0.5913
 epoch: 49, train_loss: 0.6681, test_loss: 1.3098, test_f1: 0.5112
 epoch: 50, train_loss: 0.6906, test_loss: 1.0510, test_f1: 0.5838
 epoch: 51, train_loss: 0.6366, test_loss: 0.9650, test_f1: 0.5984
 epoch: 52, train_loss: 0.6083, test_loss: 0.9009, test_f1: 0.6231
 epoch: 53, train_loss: 0.5974, test_loss: 0.9031, test_f1: 0.6597
 epoch: 54, train_loss: 0.5805, test_loss: 0.8850, test_f1: 0.6126
 epoch: 55, train_loss: 0.5839, test_loss: 0.8668, test_f1: 0.6213
 epoch: 56, train_loss: 0.5801, test_loss: 0.9105, test_f1: 0.6265
 epoch: 57, train_loss: 0.5687, test_loss: 0.8902, test_f1: 0.6325
 epoch: 58, train_loss: 0.5693, test_loss: 0.8755, test_f1: 0.6224
 epoch: 59, train_loss: 0.5824, test_loss: 0.9644, test_f1: 0.6294
 epoch: 60, train_loss: 0.5766, test_loss: 1.0052, test_f1: 0.6015
 epoch: 61, train_loss: 0.5544, test_loss: 0.8729, test_f1: 0.6547
 epoch: 62, train_loss: 0.5747, test_loss: 0.9710, test_f1: 0.6425
 epoch: 63, train_loss: 0.5754, test_loss: 1.0420, test_f1: 0.6123
 epoch: 64, train_loss: 0.5893, test_loss: 0.9527, test_f1: 0.6065
 epoch: 65, train_loss: 0.5727, test_loss: 0.8465, test_f1: 0.6591
 epoch: 66, train_loss: 0.5816, test_loss: 0.9022, test_f1: 0.6377
 epoch: 67, train_loss: 0.5561, test_loss: 0.8862, test_f1: 0.6432
 epoch: 68, train_loss: 0.5405, test_loss: 0.8496, test_f1: 0.6651
 epoch: 69, train_loss: 0.5531, test_loss: 0.9036, test_f1: 0.6347
 epoch: 70, train_loss: 0.5747, test_loss: 0.9470, test_f1: 0.6353
 epoch: 71, train_loss: 0.5622, test_loss: 1.0118, test_f1: 0.5917
 epoch: 72, train_loss: 0.5787, test_loss: 0.8791, test_f1: 0.6420
 epoch: 73, train_loss: 0.5405, test_loss: 0.9603, test_f1: 0.6397
 epoch: 74, train_loss: 0.5632, test_loss: 1.0012, test_f1: 0.6222
 epoch: 75, train_loss: 0.5347, test_loss: 0.9636, test_f1: 0.6412
 epoch: 76, train_loss: 0.5323, test_loss: 1.0109, test_f1: 0.6275
 epoch: 77, train_loss: 0.5489, test_loss: 0.9265, test_f1: 0.6585
 epoch: 78, train_loss: 0.5298, test_loss: 0.9600, test_f1: 0.6433
 epoch: 79, train_loss: 0.5383, test_loss: 0.9672, test_f1: 0.6236
 epoch: 80, train_loss: 0.5312, test_loss: 1.0282, test_f1: 0.6086
 epoch: 81, train_loss: 0.5216, test_loss: 0.9330, test_f1: 0.6309
 epoch: 82, train_loss: 0.5320, test_loss: 0.9755, test_f1: 0.6042
 epoch: 83, train_loss: 0.5323, test_loss: 0.9266, test_f1: 0.6168
 epoch: 84, train_loss: 0.5209, test_loss: 0.9572, test_f1: 0.6732
 epoch: 85, train_loss: 0.5217, test_loss: 0.9683, test_f1: 0.6112
 epoch: 86, train_loss: 0.5259, test_loss: 0.9818, test_f1: 0.6541
 epoch: 87, train_loss: 0.5165, test_loss: 0.8904, test_f1: 0.6616
 epoch: 88, train_loss: 0.5226, test_loss: 0.8834, test_f1: 0.6411
 epoch: 89, train_loss: 0.5029, test_loss: 0.8517, test_f1: 0.6712
 epoch: 90, train_loss: 0.5137, test_loss: 0.8889, test_f1: 0.6808
 epoch: 91, train_loss: 0.5113, test_loss: 1.0139, test_f1: 0.6355
 epoch: 92, train_loss: 0.5056, test_loss: 0.9204, test_f1: 0.6409
 epoch: 93, train_loss: 0.5175, test_loss: 0.9042, test_f1: 0.6682
 epoch: 94, train_loss: 0.5005, test_loss: 1.1325, test_f1: 0.6178
 epoch: 95, train_loss: 0.4982, test_loss: 0.9117, test_f1: 0.6344
 epoch: 96, train_loss: 0.4931, test_loss: 1.0087, test_f1: 0.6463
 epoch: 97, train_loss: 0.5137, test_loss: 1.0060, test_f1: 0.6182
 epoch: 98, train_loss: 0.5071, test_loss: 1.0235, test_f1: 0.6489
 epoch: 99, train_loss: 0.5061, test_loss: 0.9929, test_f1: 0.6200
##################ITERATION #4 ****************************************
 epoch: 0, train_loss: 1.1702, test_loss: 1.0937, test_f1: 0.4556
 epoch: 1, train_loss: 0.9980, test_loss: 1.0376, test_f1: 0.4481
 epoch: 2, train_loss: 0.9653, test_loss: 1.0110, test_f1: 0.4319
 epoch: 3, train_loss: 0.9410, test_loss: 0.9793, test_f1: 0.5065
 epoch: 4, train_loss: 0.9264, test_loss: 1.0551, test_f1: 0.4526
 epoch: 5, train_loss: 0.9116, test_loss: 0.9433, test_f1: 0.4977
 epoch: 6, train_loss: 0.8925, test_loss: 0.9461, test_f1: 0.5358
 epoch: 7, train_loss: 0.8771, test_loss: 0.9712, test_f1: 0.5256
 epoch: 8, train_loss: 0.8663, test_loss: 0.9329, test_f1: 0.5585
 epoch: 9, train_loss: 0.8289, test_loss: 0.9711, test_f1: 0.5100
 epoch: 10, train_loss: 0.8402, test_loss: 1.1744, test_f1: 0.4573
 epoch: 11, train_loss: 0.8192, test_loss: 0.8736, test_f1: 0.5680
 epoch: 12, train_loss: 0.8174, test_loss: 1.0982, test_f1: 0.4304
 epoch: 13, train_loss: 0.8234, test_loss: 0.9699, test_f1: 0.5278
 epoch: 14, train_loss: 0.8193, test_loss: 0.9031, test_f1: 0.5582
 epoch: 15, train_loss: 0.8044, test_loss: 0.9629, test_f1: 0.5492
 epoch: 16, train_loss: 0.7929, test_loss: 0.8677, test_f1: 0.6264
 epoch: 17, train_loss: 0.7742, test_loss: 1.0013, test_f1: 0.5541
 epoch: 18, train_loss: 0.7565, test_loss: 0.8778, test_f1: 0.6238
 epoch: 19, train_loss: 0.7732, test_loss: 1.1099, test_f1: 0.4428
 epoch: 20, train_loss: 0.8025, test_loss: 0.9171, test_f1: 0.5190
 epoch: 21, train_loss: 0.7805, test_loss: 0.8643, test_f1: 0.5947
 epoch: 22, train_loss: 0.7540, test_loss: 0.9718, test_f1: 0.5053
 epoch: 23, train_loss: 0.7563, test_loss: 0.9271, test_f1: 0.5339
 epoch: 24, train_loss: 0.7502, test_loss: 0.8208, test_f1: 0.5978
 epoch: 25, train_loss: 0.7389, test_loss: 0.8991, test_f1: 0.4898
 epoch: 26, train_loss: 0.7300, test_loss: 0.9189, test_f1: 0.5580
 epoch: 27, train_loss: 0.7420, test_loss: 1.1125, test_f1: 0.4524
 epoch: 28, train_loss: 0.7288, test_loss: 1.0994, test_f1: 0.5174
 epoch: 29, train_loss: 0.6986, test_loss: 0.9087, test_f1: 0.5995
 epoch: 30, train_loss: 0.7154, test_loss: 0.9430, test_f1: 0.5788
 epoch: 31, train_loss: 0.7266, test_loss: 0.8629, test_f1: 0.5934
 epoch: 32, train_loss: 0.7124, test_loss: 0.9672, test_f1: 0.5495
 epoch: 33, train_loss: 0.7022, test_loss: 1.0306, test_f1: 0.5456
 epoch: 34, train_loss: 0.6804, test_loss: 0.8777, test_f1: 0.6042
 epoch: 35, train_loss: 0.7080, test_loss: 1.1217, test_f1: 0.4723
 epoch: 36, train_loss: 0.6864, test_loss: 0.8378, test_f1: 0.6389
 epoch: 37, train_loss: 0.6940, test_loss: 0.9612, test_f1: 0.5654
 epoch: 38, train_loss: 0.6927, test_loss: 0.8654, test_f1: 0.5642
 epoch: 39, train_loss: 0.6815, test_loss: 0.8529, test_f1: 0.6126
 epoch: 40, train_loss: 0.6635, test_loss: 0.8384, test_f1: 0.6348
 epoch: 41, train_loss: 0.6478, test_loss: 0.9256, test_f1: 0.5952
 epoch: 42, train_loss: 0.6662, test_loss: 0.8909, test_f1: 0.6221
 epoch: 43, train_loss: 0.6859, test_loss: 1.1218, test_f1: 0.4925
 epoch: 44, train_loss: 0.6941, test_loss: 0.9721, test_f1: 0.5263
 epoch: 45, train_loss: 0.6642, test_loss: 0.8808, test_f1: 0.5888
 epoch: 46, train_loss: 0.6488, test_loss: 0.8455, test_f1: 0.6283
 epoch: 47, train_loss: 0.6747, test_loss: 0.8562, test_f1: 0.6499
 epoch: 48, train_loss: 0.6641, test_loss: 0.8600, test_f1: 0.6305
 epoch: 49, train_loss: 0.6575, test_loss: 0.9119, test_f1: 0.5897
 epoch: 50, train_loss: 0.6574, test_loss: 0.8437, test_f1: 0.5449
 epoch: 51, train_loss: 0.6235, test_loss: 0.9276, test_f1: 0.6284
 epoch: 52, train_loss: 0.6077, test_loss: 0.8606, test_f1: 0.6305
 epoch: 53, train_loss: 0.5942, test_loss: 0.9283, test_f1: 0.6320
 epoch: 54, train_loss: 0.5939, test_loss: 0.8879, test_f1: 0.6297
 epoch: 55, train_loss: 0.5752, test_loss: 0.8695, test_f1: 0.6632
 epoch: 56, train_loss: 0.5723, test_loss: 0.8343, test_f1: 0.6309
 epoch: 57, train_loss: 0.5748, test_loss: 0.8755, test_f1: 0.6435
 epoch: 58, train_loss: 0.5703, test_loss: 0.8810, test_f1: 0.6395
 epoch: 59, train_loss: 0.5864, test_loss: 0.8226, test_f1: 0.6599
 epoch: 60, train_loss: 0.5551, test_loss: 0.8686, test_f1: 0.6612
 epoch: 61, train_loss: 0.5796, test_loss: 0.8697, test_f1: 0.6352
 epoch: 62, train_loss: 0.5769, test_loss: 0.8962, test_f1: 0.6541
 epoch: 63, train_loss: 0.5430, test_loss: 0.8437, test_f1: 0.6335
 epoch: 64, train_loss: 0.5515, test_loss: 0.9849, test_f1: 0.6249
 epoch: 65, train_loss: 0.5667, test_loss: 0.8797, test_f1: 0.6427
 epoch: 66, train_loss: 0.5743, test_loss: 0.9140, test_f1: 0.6211
 epoch: 67, train_loss: 0.5655, test_loss: 0.8333, test_f1: 0.6508
 epoch: 68, train_loss: 0.5637, test_loss: 0.9122, test_f1: 0.6029
 epoch: 69, train_loss: 0.5576, test_loss: 0.9247, test_f1: 0.6304
 epoch: 70, train_loss: 0.5700, test_loss: 0.8452, test_f1: 0.6475
 epoch: 71, train_loss: 0.5428, test_loss: 0.9133, test_f1: 0.6458
 epoch: 72, train_loss: 0.5659, test_loss: 0.9432, test_f1: 0.6320
 epoch: 73, train_loss: 0.5564, test_loss: 0.8181, test_f1: 0.6303
 epoch: 74, train_loss: 0.5607, test_loss: 0.8577, test_f1: 0.6473
 epoch: 75, train_loss: 0.5529, test_loss: 0.8872, test_f1: 0.6248
 epoch: 76, train_loss: 0.5387, test_loss: 0.8796, test_f1: 0.6637
 epoch: 77, train_loss: 0.5129, test_loss: 0.8497, test_f1: 0.6587
 epoch: 78, train_loss: 0.5360, test_loss: 0.8578, test_f1: 0.6346
 epoch: 79, train_loss: 0.5470, test_loss: 0.8533, test_f1: 0.6375
 epoch: 80, train_loss: 0.5428, test_loss: 0.8542, test_f1: 0.6182
 epoch: 81, train_loss: 0.5377, test_loss: 0.9922, test_f1: 0.6144
 epoch: 82, train_loss: 0.5299, test_loss: 0.8604, test_f1: 0.6497
 epoch: 83, train_loss: 0.5181, test_loss: 0.8959, test_f1: 0.6450
 epoch: 84, train_loss: 0.5392, test_loss: 0.8916, test_f1: 0.6468
 epoch: 85, train_loss: 0.5197, test_loss: 0.9304, test_f1: 0.6326
 epoch: 86, train_loss: 0.5380, test_loss: 0.9873, test_f1: 0.6288
 epoch: 87, train_loss: 0.5405, test_loss: 0.8645, test_f1: 0.6179
 epoch: 88, train_loss: 0.5198, test_loss: 0.9034, test_f1: 0.6428
 epoch: 89, train_loss: 0.5225, test_loss: 0.9116, test_f1: 0.6549
 epoch: 90, train_loss: 0.5137, test_loss: 0.8520, test_f1: 0.6441
 epoch: 91, train_loss: 0.5056, test_loss: 0.8631, test_f1: 0.6292
 epoch: 92, train_loss: 0.5067, test_loss: 0.9843, test_f1: 0.6297
 epoch: 93, train_loss: 0.5297, test_loss: 0.9568, test_f1: 0.6272
 epoch: 94, train_loss: 0.5024, test_loss: 0.9039, test_f1: 0.6407
 epoch: 95, train_loss: 0.5093, test_loss: 0.9159, test_f1: 0.6442
 epoch: 96, train_loss: 0.5119, test_loss: 0.8735, test_f1: 0.6356
 epoch: 97, train_loss: 0.4988, test_loss: 0.8700, test_f1: 0.6630
 epoch: 98, train_loss: 0.5126, test_loss: 0.9055, test_f1: 0.6201
 epoch: 99, train_loss: 0.5185, test_loss: 0.8494, test_f1: 0.6283
##################ITERATION #5 ****************************************
 epoch: 0, train_loss: 1.2756, test_loss: 1.0694, test_f1: 0.4007
 epoch: 1, train_loss: 1.0042, test_loss: 1.0162, test_f1: 0.4673
 epoch: 2, train_loss: 0.9592, test_loss: 0.9675, test_f1: 0.4847
 epoch: 3, train_loss: 0.9293, test_loss: 0.9940, test_f1: 0.5246
 epoch: 4, train_loss: 0.9094, test_loss: 1.0023, test_f1: 0.5264
 epoch: 5, train_loss: 0.8927, test_loss: 1.0112, test_f1: 0.5086
 epoch: 6, train_loss: 0.8669, test_loss: 1.0612, test_f1: 0.5055
 epoch: 7, train_loss: 0.8501, test_loss: 1.0074, test_f1: 0.5211
 epoch: 8, train_loss: 0.8576, test_loss: 0.9269, test_f1: 0.5172
 epoch: 9, train_loss: 0.8459, test_loss: 0.9583, test_f1: 0.5132
 epoch: 10, train_loss: 0.8401, test_loss: 0.9232, test_f1: 0.5295
 epoch: 11, train_loss: 0.8131, test_loss: 1.0521, test_f1: 0.4908
 epoch: 12, train_loss: 0.8004, test_loss: 0.9068, test_f1: 0.5591
 epoch: 13, train_loss: 0.7873, test_loss: 1.0155, test_f1: 0.5049
 epoch: 14, train_loss: 0.7809, test_loss: 1.0440, test_f1: 0.5231
 epoch: 15, train_loss: 0.7851, test_loss: 0.9077, test_f1: 0.5607
 epoch: 16, train_loss: 0.7769, test_loss: 1.0441, test_f1: 0.5340
 epoch: 17, train_loss: 0.7706, test_loss: 1.0836, test_f1: 0.5205
 epoch: 18, train_loss: 0.7503, test_loss: 0.8930, test_f1: 0.5589
 epoch: 19, train_loss: 0.7553, test_loss: 0.9655, test_f1: 0.5714
 epoch: 20, train_loss: 0.7513, test_loss: 1.0983, test_f1: 0.5222
 epoch: 21, train_loss: 0.7438, test_loss: 1.0760, test_f1: 0.5560
 epoch: 22, train_loss: 0.7289, test_loss: 1.1522, test_f1: 0.5245
 epoch: 23, train_loss: 0.7298, test_loss: 0.8031, test_f1: 0.6060
 epoch: 24, train_loss: 0.7180, test_loss: 0.8458, test_f1: 0.5374
 epoch: 25, train_loss: 0.7257, test_loss: 1.0261, test_f1: 0.5891
 epoch: 26, train_loss: 0.7219, test_loss: 0.8590, test_f1: 0.5906
 epoch: 27, train_loss: 0.7273, test_loss: 0.9419, test_f1: 0.5800
 epoch: 28, train_loss: 0.7095, test_loss: 0.9610, test_f1: 0.5525
 epoch: 29, train_loss: 0.6949, test_loss: 1.0303, test_f1: 0.5868
 epoch: 30, train_loss: 0.6913, test_loss: 0.9113, test_f1: 0.5862
 epoch: 31, train_loss: 0.6738, test_loss: 0.8499, test_f1: 0.6099
 epoch: 32, train_loss: 0.6983, test_loss: 1.0516, test_f1: 0.5764
 epoch: 33, train_loss: 0.6910, test_loss: 0.8535, test_f1: 0.5519
 epoch: 34, train_loss: 0.6918, test_loss: 1.0990, test_f1: 0.5877
 epoch: 35, train_loss: 0.6867, test_loss: 0.8351, test_f1: 0.6034
 epoch: 36, train_loss: 0.6685, test_loss: 1.1633, test_f1: 0.5675
 epoch: 37, train_loss: 0.6753, test_loss: 0.9250, test_f1: 0.5856
 epoch: 38, train_loss: 0.6686, test_loss: 0.9766, test_f1: 0.5648
 epoch: 39, train_loss: 0.6721, test_loss: 1.0058, test_f1: 0.6082
 epoch: 40, train_loss: 0.6545, test_loss: 0.9854, test_f1: 0.6189
 epoch: 41, train_loss: 0.6560, test_loss: 0.9278, test_f1: 0.5748
 epoch: 42, train_loss: 0.6693, test_loss: 0.8941, test_f1: 0.5526
 epoch: 43, train_loss: 0.6626, test_loss: 0.9936, test_f1: 0.6058
 epoch: 44, train_loss: 0.6585, test_loss: 1.0409, test_f1: 0.5613
 epoch: 45, train_loss: 0.6584, test_loss: 0.9804, test_f1: 0.6119
 epoch: 46, train_loss: 0.6442, test_loss: 0.9989, test_f1: 0.6042
 epoch: 47, train_loss: 0.6462, test_loss: 0.9157, test_f1: 0.6195
 epoch: 48, train_loss: 0.6285, test_loss: 0.8668, test_f1: 0.6391
 epoch: 49, train_loss: 0.6376, test_loss: 1.0375, test_f1: 0.5837
 epoch: 50, train_loss: 0.6428, test_loss: 0.9920, test_f1: 0.5783
 epoch: 51, train_loss: 0.6070, test_loss: 0.9290, test_f1: 0.6140
 epoch: 52, train_loss: 0.5779, test_loss: 1.0784, test_f1: 0.6060
 epoch: 53, train_loss: 0.5808, test_loss: 0.9771, test_f1: 0.6163
 epoch: 54, train_loss: 0.5846, test_loss: 0.9215, test_f1: 0.6257
 epoch: 55, train_loss: 0.5667, test_loss: 0.9843, test_f1: 0.6301
 epoch: 56, train_loss: 0.5685, test_loss: 0.9518, test_f1: 0.6252
 epoch: 57, train_loss: 0.5649, test_loss: 0.9431, test_f1: 0.6367
 epoch: 58, train_loss: 0.5589, test_loss: 0.9381, test_f1: 0.6179
 epoch: 59, train_loss: 0.5560, test_loss: 0.9643, test_f1: 0.6378
 epoch: 60, train_loss: 0.5340, test_loss: 0.9918, test_f1: 0.6316
 epoch: 61, train_loss: 0.5385, test_loss: 1.0053, test_f1: 0.6038
 epoch: 62, train_loss: 0.5553, test_loss: 0.9896, test_f1: 0.6339
 epoch: 63, train_loss: 0.5417, test_loss: 1.1361, test_f1: 0.6040
 epoch: 64, train_loss: 0.5562, test_loss: 0.9410, test_f1: 0.6285
 epoch: 65, train_loss: 0.5436, test_loss: 1.0378, test_f1: 0.6261
 epoch: 66, train_loss: 0.5458, test_loss: 0.9917, test_f1: 0.6398
 epoch: 67, train_loss: 0.5528, test_loss: 1.0769, test_f1: 0.6116
 epoch: 68, train_loss: 0.5455, test_loss: 1.0001, test_f1: 0.6139
 epoch: 69, train_loss: 0.5410, test_loss: 1.0813, test_f1: 0.6137
 epoch: 70, train_loss: 0.5481, test_loss: 1.1329, test_f1: 0.6198
 epoch: 71, train_loss: 0.5408, test_loss: 0.9783, test_f1: 0.6404
 epoch: 72, train_loss: 0.5207, test_loss: 1.0159, test_f1: 0.6206
 epoch: 73, train_loss: 0.5302, test_loss: 0.9846, test_f1: 0.6321
 epoch: 74, train_loss: 0.5303, test_loss: 1.0085, test_f1: 0.6241
 epoch: 75, train_loss: 0.5218, test_loss: 1.0071, test_f1: 0.6226
 epoch: 76, train_loss: 0.5173, test_loss: 0.8667, test_f1: 0.6614
 epoch: 77, train_loss: 0.5121, test_loss: 1.0560, test_f1: 0.6190
 epoch: 78, train_loss: 0.5254, test_loss: 0.9209, test_f1: 0.6410
 epoch: 79, train_loss: 0.5097, test_loss: 1.0120, test_f1: 0.6281
 epoch: 80, train_loss: 0.5053, test_loss: 1.0536, test_f1: 0.6371
 epoch: 81, train_loss: 0.5113, test_loss: 1.0508, test_f1: 0.5977
 epoch: 82, train_loss: 0.5157, test_loss: 0.9822, test_f1: 0.6386
 epoch: 83, train_loss: 0.5224, test_loss: 1.0301, test_f1: 0.6389
 epoch: 84, train_loss: 0.4952, test_loss: 1.1587, test_f1: 0.6147
 epoch: 85, train_loss: 0.4957, test_loss: 0.9713, test_f1: 0.6368
 epoch: 86, train_loss: 0.4980, test_loss: 1.0878, test_f1: 0.6319
 epoch: 87, train_loss: 0.4935, test_loss: 1.0590, test_f1: 0.6284
 epoch: 88, train_loss: 0.4999, test_loss: 1.2127, test_f1: 0.6006
 epoch: 89, train_loss: 0.4929, test_loss: 0.9546, test_f1: 0.6523
 epoch: 90, train_loss: 0.4848, test_loss: 1.0366, test_f1: 0.6236
 epoch: 91, train_loss: 0.4906, test_loss: 0.9763, test_f1: 0.6072
 epoch: 92, train_loss: 0.4866, test_loss: 0.9935, test_f1: 0.6388
 epoch: 93, train_loss: 0.4847, test_loss: 1.1972, test_f1: 0.6034
 epoch: 94, train_loss: 0.5008, test_loss: 1.0375, test_f1: 0.6499
 epoch: 95, train_loss: 0.5012, test_loss: 1.1253, test_f1: 0.6348
 epoch: 96, train_loss: 0.4665, test_loss: 1.1837, test_f1: 0.6113
 epoch: 97, train_loss: 0.4872, test_loss: 1.1858, test_f1: 0.6346
 epoch: 98, train_loss: 0.4935, test_loss: 1.1465, test_f1: 0.6338
 epoch: 99, train_loss: 0.4975, test_loss: 1.0828, test_f1: 0.6396
##################ITERATION #6 ****************************************
 epoch: 0, train_loss: 1.2142, test_loss: 1.0805, test_f1: 0.3442
 epoch: 1, train_loss: 1.0164, test_loss: 1.0574, test_f1: 0.5265
 epoch: 2, train_loss: 0.9692, test_loss: 1.0423, test_f1: 0.5300
 epoch: 3, train_loss: 0.9536, test_loss: 1.0551, test_f1: 0.4713
 epoch: 4, train_loss: 0.9260, test_loss: 0.9878, test_f1: 0.5032
 epoch: 5, train_loss: 0.9074, test_loss: 0.9434, test_f1: 0.5407
 epoch: 6, train_loss: 0.8843, test_loss: 1.2368, test_f1: 0.4464
 epoch: 7, train_loss: 0.8724, test_loss: 0.9255, test_f1: 0.5438
 epoch: 8, train_loss: 0.8926, test_loss: 1.0087, test_f1: 0.5347
 epoch: 9, train_loss: 0.8655, test_loss: 1.0590, test_f1: 0.5212
 epoch: 10, train_loss: 0.8611, test_loss: 1.1110, test_f1: 0.4790
 epoch: 11, train_loss: 0.8511, test_loss: 1.1860, test_f1: 0.4760
 epoch: 12, train_loss: 0.8261, test_loss: 0.9210, test_f1: 0.6135
 epoch: 13, train_loss: 0.8326, test_loss: 0.9529, test_f1: 0.5636
 epoch: 14, train_loss: 0.8172, test_loss: 0.9338, test_f1: 0.5942
 epoch: 15, train_loss: 0.8152, test_loss: 0.9314, test_f1: 0.5650
 epoch: 16, train_loss: 0.7926, test_loss: 1.0040, test_f1: 0.5132
 epoch: 17, train_loss: 0.7954, test_loss: 0.9481, test_f1: 0.5964
 epoch: 18, train_loss: 0.7755, test_loss: 0.9380, test_f1: 0.5898
 epoch: 19, train_loss: 0.7884, test_loss: 1.1824, test_f1: 0.5411
 epoch: 20, train_loss: 0.7572, test_loss: 0.8786, test_f1: 0.6039
 epoch: 21, train_loss: 0.7569, test_loss: 1.0931, test_f1: 0.5029
 epoch: 22, train_loss: 0.7738, test_loss: 0.9430, test_f1: 0.5762
 epoch: 23, train_loss: 0.7468, test_loss: 0.9117, test_f1: 0.5784
 epoch: 24, train_loss: 0.7417, test_loss: 0.9304, test_f1: 0.5399
 epoch: 25, train_loss: 0.7540, test_loss: 0.9206, test_f1: 0.5826
 epoch: 26, train_loss: 0.7458, test_loss: 0.9277, test_f1: 0.5948
 epoch: 27, train_loss: 0.7277, test_loss: 1.0391, test_f1: 0.5670
 epoch: 28, train_loss: 0.7223, test_loss: 0.8995, test_f1: 0.6266
 epoch: 29, train_loss: 0.7365, test_loss: 0.9252, test_f1: 0.5995
 epoch: 30, train_loss: 0.7285, test_loss: 0.9343, test_f1: 0.5982
 epoch: 31, train_loss: 0.7232, test_loss: 1.0294, test_f1: 0.5878
 epoch: 32, train_loss: 0.7204, test_loss: 0.8977, test_f1: 0.6084
 epoch: 33, train_loss: 0.6948, test_loss: 0.9435, test_f1: 0.5829
 epoch: 34, train_loss: 0.6948, test_loss: 0.9229, test_f1: 0.6172
 epoch: 35, train_loss: 0.7085, test_loss: 1.1825, test_f1: 0.5014
 epoch: 36, train_loss: 0.7161, test_loss: 1.1942, test_f1: 0.5242
 epoch: 37, train_loss: 0.7161, test_loss: 1.0080, test_f1: 0.5232
 epoch: 38, train_loss: 0.6981, test_loss: 1.1064, test_f1: 0.5278
 epoch: 39, train_loss: 0.6996, test_loss: 0.9816, test_f1: 0.5903
 epoch: 40, train_loss: 0.6952, test_loss: 1.0418, test_f1: 0.5847
 epoch: 41, train_loss: 0.7121, test_loss: 0.9288, test_f1: 0.6254
 epoch: 42, train_loss: 0.7127, test_loss: 1.1781, test_f1: 0.5202
 epoch: 43, train_loss: 0.6848, test_loss: 0.9962, test_f1: 0.6019
 epoch: 44, train_loss: 0.6867, test_loss: 0.9780, test_f1: 0.5606
 epoch: 45, train_loss: 0.6874, test_loss: 1.0596, test_f1: 0.5684
 epoch: 46, train_loss: 0.6780, test_loss: 1.0100, test_f1: 0.5804
 epoch: 47, train_loss: 0.6688, test_loss: 0.8719, test_f1: 0.6136
 epoch: 48, train_loss: 0.6525, test_loss: 1.1214, test_f1: 0.5185
 epoch: 49, train_loss: 0.6677, test_loss: 0.9800, test_f1: 0.5625
 epoch: 50, train_loss: 0.6637, test_loss: 0.9713, test_f1: 0.5987
 epoch: 51, train_loss: 0.6083, test_loss: 0.8727, test_f1: 0.6435
 epoch: 52, train_loss: 0.6014, test_loss: 0.9918, test_f1: 0.5866
 epoch: 53, train_loss: 0.5925, test_loss: 0.8601, test_f1: 0.6415
 epoch: 54, train_loss: 0.5903, test_loss: 0.8996, test_f1: 0.6174
 epoch: 55, train_loss: 0.5937, test_loss: 0.9045, test_f1: 0.6242
 epoch: 56, train_loss: 0.5927, test_loss: 0.8598, test_f1: 0.6290
 epoch: 57, train_loss: 0.5727, test_loss: 0.9198, test_f1: 0.6105
 epoch: 58, train_loss: 0.5777, test_loss: 0.9007, test_f1: 0.5980
 epoch: 59, train_loss: 0.5741, test_loss: 0.9417, test_f1: 0.6212
 epoch: 60, train_loss: 0.5755, test_loss: 0.8899, test_f1: 0.6381
 epoch: 61, train_loss: 0.5690, test_loss: 0.9800, test_f1: 0.6008
 epoch: 62, train_loss: 0.5562, test_loss: 0.8843, test_f1: 0.6497
 epoch: 63, train_loss: 0.5505, test_loss: 0.9444, test_f1: 0.6290
 epoch: 64, train_loss: 0.5433, test_loss: 0.8969, test_f1: 0.6214
 epoch: 65, train_loss: 0.5658, test_loss: 0.9084, test_f1: 0.5957
 epoch: 66, train_loss: 0.5685, test_loss: 0.8912, test_f1: 0.6132
 epoch: 67, train_loss: 0.5487, test_loss: 0.9649, test_f1: 0.6352
 epoch: 68, train_loss: 0.5430, test_loss: 0.8957, test_f1: 0.6499
 epoch: 69, train_loss: 0.5487, test_loss: 1.0131, test_f1: 0.6034
 epoch: 70, train_loss: 0.5394, test_loss: 0.8920, test_f1: 0.6398
 epoch: 71, train_loss: 0.5378, test_loss: 0.9348, test_f1: 0.6155
 epoch: 72, train_loss: 0.5467, test_loss: 1.0796, test_f1: 0.5941
 epoch: 73, train_loss: 0.5478, test_loss: 0.9403, test_f1: 0.6158
 epoch: 74, train_loss: 0.5462, test_loss: 0.9337, test_f1: 0.6318
 epoch: 75, train_loss: 0.5408, test_loss: 0.9433, test_f1: 0.6524
 epoch: 76, train_loss: 0.5445, test_loss: 0.9475, test_f1: 0.6202
 epoch: 77, train_loss: 0.5280, test_loss: 1.0246, test_f1: 0.6136
 epoch: 78, train_loss: 0.5399, test_loss: 0.9523, test_f1: 0.6078
 epoch: 79, train_loss: 0.5373, test_loss: 0.9519, test_f1: 0.5898
 epoch: 80, train_loss: 0.5170, test_loss: 1.0567, test_f1: 0.6257
 epoch: 81, train_loss: 0.5224, test_loss: 1.0231, test_f1: 0.6192
 epoch: 82, train_loss: 0.5289, test_loss: 0.9447, test_f1: 0.6338
 epoch: 83, train_loss: 0.5252, test_loss: 1.0321, test_f1: 0.6007
 epoch: 84, train_loss: 0.4882, test_loss: 1.1136, test_f1: 0.5991
 epoch: 85, train_loss: 0.4983, test_loss: 0.9738, test_f1: 0.6294
 epoch: 86, train_loss: 0.5035, test_loss: 1.0823, test_f1: 0.5963
 epoch: 87, train_loss: 0.4922, test_loss: 0.9691, test_f1: 0.6428
 epoch: 88, train_loss: 0.5086, test_loss: 1.0003, test_f1: 0.6196
 epoch: 89, train_loss: 0.4946, test_loss: 1.2725, test_f1: 0.5657
 epoch: 90, train_loss: 0.4857, test_loss: 0.9932, test_f1: 0.6163
 epoch: 91, train_loss: 0.5000, test_loss: 1.0068, test_f1: 0.6415
 epoch: 92, train_loss: 0.4824, test_loss: 0.9490, test_f1: 0.6369
 epoch: 93, train_loss: 0.4775, test_loss: 1.0785, test_f1: 0.6259
 epoch: 94, train_loss: 0.4944, test_loss: 1.0085, test_f1: 0.6153
 epoch: 95, train_loss: 0.4760, test_loss: 1.1743, test_f1: 0.5828
 epoch: 96, train_loss: 0.5038, test_loss: 1.0048, test_f1: 0.6328
 epoch: 97, train_loss: 0.4984, test_loss: 1.0841, test_f1: 0.5949
 epoch: 98, train_loss: 0.4908, test_loss: 0.9640, test_f1: 0.6285
 epoch: 99, train_loss: 0.4940, test_loss: 0.9867, test_f1: 0.6216
##################ITERATION #7 ****************************************
 epoch: 0, train_loss: 1.1600, test_loss: 1.1766, test_f1: 0.4044
 epoch: 1, train_loss: 0.9920, test_loss: 0.9959, test_f1: 0.4376
 epoch: 2, train_loss: 0.9515, test_loss: 0.9484, test_f1: 0.5223
 epoch: 3, train_loss: 0.9334, test_loss: 0.9526, test_f1: 0.5650
 epoch: 4, train_loss: 0.9088, test_loss: 1.0772, test_f1: 0.4746
 epoch: 5, train_loss: 0.9064, test_loss: 0.9923, test_f1: 0.4925
 epoch: 6, train_loss: 0.8776, test_loss: 0.9422, test_f1: 0.5424
 epoch: 7, train_loss: 0.8525, test_loss: 0.9666, test_f1: 0.5411
 epoch: 8, train_loss: 0.8675, test_loss: 0.8813, test_f1: 0.5580
 epoch: 9, train_loss: 0.8499, test_loss: 0.9201, test_f1: 0.5745
 epoch: 10, train_loss: 0.8344, test_loss: 1.0689, test_f1: 0.5138
 epoch: 11, train_loss: 0.8222, test_loss: 0.9127, test_f1: 0.5631
 epoch: 12, train_loss: 0.8027, test_loss: 0.9543, test_f1: 0.5458
 epoch: 13, train_loss: 0.7977, test_loss: 0.9577, test_f1: 0.5577
 epoch: 14, train_loss: 0.8057, test_loss: 0.9782, test_f1: 0.5568
 epoch: 15, train_loss: 0.7810, test_loss: 1.0001, test_f1: 0.5477
 epoch: 16, train_loss: 0.7726, test_loss: 0.9112, test_f1: 0.5326
 epoch: 17, train_loss: 0.7680, test_loss: 0.8368, test_f1: 0.5398
 epoch: 18, train_loss: 0.7504, test_loss: 0.8398, test_f1: 0.5666
 epoch: 19, train_loss: 0.7733, test_loss: 0.9188, test_f1: 0.5669
 epoch: 20, train_loss: 0.7568, test_loss: 1.0409, test_f1: 0.4886
 epoch: 21, train_loss: 0.7577, test_loss: 1.0521, test_f1: 0.5269
 epoch: 22, train_loss: 0.7666, test_loss: 0.8670, test_f1: 0.5636
 epoch: 23, train_loss: 0.7445, test_loss: 0.9730, test_f1: 0.5470
 epoch: 24, train_loss: 0.7343, test_loss: 0.9409, test_f1: 0.5572
 epoch: 25, train_loss: 0.7342, test_loss: 0.8852, test_f1: 0.6057
 epoch: 26, train_loss: 0.7265, test_loss: 0.9462, test_f1: 0.6056
 epoch: 27, train_loss: 0.7152, test_loss: 0.9949, test_f1: 0.5265
 epoch: 28, train_loss: 0.7356, test_loss: 0.8903, test_f1: 0.5759
 epoch: 29, train_loss: 0.7163, test_loss: 0.9048, test_f1: 0.5665
 epoch: 30, train_loss: 0.7045, test_loss: 0.8604, test_f1: 0.5677
 epoch: 31, train_loss: 0.7210, test_loss: 0.9317, test_f1: 0.6073
 epoch: 32, train_loss: 0.7046, test_loss: 0.9473, test_f1: 0.5582
 epoch: 33, train_loss: 0.7095, test_loss: 1.0332, test_f1: 0.5378
 epoch: 34, train_loss: 0.7202, test_loss: 0.9508, test_f1: 0.5596
 epoch: 35, train_loss: 0.7013, test_loss: 0.8819, test_f1: 0.5767
 epoch: 36, train_loss: 0.6832, test_loss: 1.0023, test_f1: 0.5817
 epoch: 37, train_loss: 0.7155, test_loss: 1.0723, test_f1: 0.5278
 epoch: 38, train_loss: 0.6881, test_loss: 0.8458, test_f1: 0.6327
 epoch: 39, train_loss: 0.6837, test_loss: 0.8829, test_f1: 0.6456
 epoch: 40, train_loss: 0.6720, test_loss: 0.8405, test_f1: 0.5808
 epoch: 41, train_loss: 0.6689, test_loss: 0.9736, test_f1: 0.5935
 epoch: 42, train_loss: 0.6988, test_loss: 1.0844, test_f1: 0.5005
 epoch: 43, train_loss: 0.6950, test_loss: 0.8496, test_f1: 0.6002
 epoch: 44, train_loss: 0.6830, test_loss: 0.9470, test_f1: 0.5783
 epoch: 45, train_loss: 0.6584, test_loss: 0.8540, test_f1: 0.6370
 epoch: 46, train_loss: 0.6484, test_loss: 0.9220, test_f1: 0.6248
 epoch: 47, train_loss: 0.6458, test_loss: 0.9310, test_f1: 0.6064
 epoch: 48, train_loss: 0.6456, test_loss: 0.9452, test_f1: 0.6137
 epoch: 49, train_loss: 0.6508, test_loss: 0.9025, test_f1: 0.6260
 epoch: 50, train_loss: 0.6506, test_loss: 0.9718, test_f1: 0.6113
 epoch: 51, train_loss: 0.6239, test_loss: 0.9016, test_f1: 0.6346
 epoch: 52, train_loss: 0.6090, test_loss: 0.9630, test_f1: 0.6138
 epoch: 53, train_loss: 0.5914, test_loss: 0.9205, test_f1: 0.6355
 epoch: 54, train_loss: 0.5896, test_loss: 0.9025, test_f1: 0.6390
 epoch: 55, train_loss: 0.5914, test_loss: 0.9011, test_f1: 0.6360
 epoch: 56, train_loss: 0.5940, test_loss: 1.0793, test_f1: 0.5810
 epoch: 57, train_loss: 0.5864, test_loss: 0.9402, test_f1: 0.6549
 epoch: 58, train_loss: 0.5846, test_loss: 0.9927, test_f1: 0.5981
 epoch: 59, train_loss: 0.5791, test_loss: 0.9714, test_f1: 0.6301
 epoch: 60, train_loss: 0.5708, test_loss: 0.9046, test_f1: 0.6379
 epoch: 61, train_loss: 0.5572, test_loss: 0.9933, test_f1: 0.6094
 epoch: 62, train_loss: 0.5698, test_loss: 0.9168, test_f1: 0.6322
 epoch: 63, train_loss: 0.5579, test_loss: 1.0369, test_f1: 0.6308
 epoch: 64, train_loss: 0.5551, test_loss: 1.0286, test_f1: 0.6430
 epoch: 65, train_loss: 0.5719, test_loss: 1.0377, test_f1: 0.6093
 epoch: 66, train_loss: 0.5756, test_loss: 0.9350, test_f1: 0.6378
 epoch: 67, train_loss: 0.5546, test_loss: 0.9532, test_f1: 0.6462
 epoch: 68, train_loss: 0.5587, test_loss: 0.9263, test_f1: 0.6387
 epoch: 69, train_loss: 0.5675, test_loss: 0.9609, test_f1: 0.6303
 epoch: 70, train_loss: 0.5594, test_loss: 0.9064, test_f1: 0.6486
 epoch: 71, train_loss: 0.5604, test_loss: 0.9588, test_f1: 0.6482
 epoch: 72, train_loss: 0.5647, test_loss: 0.8620, test_f1: 0.6304
 epoch: 73, train_loss: 0.5631, test_loss: 1.0809, test_f1: 0.6047
 epoch: 74, train_loss: 0.5681, test_loss: 0.9361, test_f1: 0.6294
 epoch: 75, train_loss: 0.5345, test_loss: 0.9397, test_f1: 0.6326
 epoch: 76, train_loss: 0.5386, test_loss: 1.0347, test_f1: 0.6180
 epoch: 77, train_loss: 0.5499, test_loss: 0.8551, test_f1: 0.6567
 epoch: 78, train_loss: 0.5345, test_loss: 0.9604, test_f1: 0.6247
 epoch: 79, train_loss: 0.5259, test_loss: 1.0504, test_f1: 0.6097
 epoch: 80, train_loss: 0.5245, test_loss: 0.9903, test_f1: 0.6455
 epoch: 81, train_loss: 0.5298, test_loss: 1.0850, test_f1: 0.6021
 epoch: 82, train_loss: 0.5483, test_loss: 0.9266, test_f1: 0.6507
 epoch: 83, train_loss: 0.5265, test_loss: 1.0758, test_f1: 0.6265
 epoch: 84, train_loss: 0.5305, test_loss: 0.9639, test_f1: 0.6398
 epoch: 85, train_loss: 0.5135, test_loss: 1.0887, test_f1: 0.6213
 epoch: 86, train_loss: 0.5179, test_loss: 1.1002, test_f1: 0.6213
 epoch: 87, train_loss: 0.5031, test_loss: 0.9736, test_f1: 0.6422
 epoch: 88, train_loss: 0.5354, test_loss: 0.9257, test_f1: 0.6467
 epoch: 89, train_loss: 0.5204, test_loss: 0.9458, test_f1: 0.6349
 epoch: 90, train_loss: 0.5331, test_loss: 1.0437, test_f1: 0.6251
 epoch: 91, train_loss: 0.5142, test_loss: 1.0085, test_f1: 0.6594
 epoch: 92, train_loss: 0.5079, test_loss: 0.9881, test_f1: 0.6335
 epoch: 93, train_loss: 0.5272, test_loss: 1.0229, test_f1: 0.6314
 epoch: 94, train_loss: 0.5282, test_loss: 1.1067, test_f1: 0.6175
 epoch: 95, train_loss: 0.5090, test_loss: 0.9767, test_f1: 0.6739
 epoch: 96, train_loss: 0.5125, test_loss: 1.0142, test_f1: 0.6573
 epoch: 97, train_loss: 0.5017, test_loss: 1.0308, test_f1: 0.6481
 epoch: 98, train_loss: 0.5078, test_loss: 1.1501, test_f1: 0.6040
 epoch: 99, train_loss: 0.5143, test_loss: 0.9891, test_f1: 0.6286
##################ITERATION #8 ****************************************
 epoch: 0, train_loss: 1.2118, test_loss: 1.0620, test_f1: 0.4483
 epoch: 1, train_loss: 1.0009, test_loss: 1.1010, test_f1: 0.4799
 epoch: 2, train_loss: 0.9709, test_loss: 1.0703, test_f1: 0.4874
 epoch: 3, train_loss: 0.9358, test_loss: 1.0026, test_f1: 0.4951
 epoch: 4, train_loss: 0.9067, test_loss: 1.0992, test_f1: 0.4662
 epoch: 5, train_loss: 0.9024, test_loss: 1.2163, test_f1: 0.4988
 epoch: 6, train_loss: 0.8979, test_loss: 1.0003, test_f1: 0.5494
 epoch: 7, train_loss: 0.8756, test_loss: 0.9625, test_f1: 0.5595
 epoch: 8, train_loss: 0.8436, test_loss: 0.9976, test_f1: 0.4990
 epoch: 9, train_loss: 0.8322, test_loss: 0.9292, test_f1: 0.5562
 epoch: 10, train_loss: 0.8272, test_loss: 0.9597, test_f1: 0.5207
 epoch: 11, train_loss: 0.8225, test_loss: 0.9462, test_f1: 0.5401
 epoch: 12, train_loss: 0.8064, test_loss: 1.2391, test_f1: 0.4208
 epoch: 13, train_loss: 0.8072, test_loss: 0.9131, test_f1: 0.5252
 epoch: 14, train_loss: 0.8271, test_loss: 0.9413, test_f1: 0.4714
 epoch: 15, train_loss: 0.7935, test_loss: 0.9068, test_f1: 0.5585
 epoch: 16, train_loss: 0.7802, test_loss: 1.1307, test_f1: 0.5037
 epoch: 17, train_loss: 0.7690, test_loss: 0.9187, test_f1: 0.5388
 epoch: 18, train_loss: 0.7631, test_loss: 0.9010, test_f1: 0.5752
 epoch: 19, train_loss: 0.7616, test_loss: 0.9595, test_f1: 0.5169
 epoch: 20, train_loss: 0.7605, test_loss: 0.9117, test_f1: 0.5731
 epoch: 21, train_loss: 0.7451, test_loss: 0.9559, test_f1: 0.5382
 epoch: 22, train_loss: 0.7518, test_loss: 0.9473, test_f1: 0.4822
 epoch: 23, train_loss: 0.7500, test_loss: 0.8223, test_f1: 0.5880
 epoch: 24, train_loss: 0.7496, test_loss: 1.0460, test_f1: 0.5238
 epoch: 25, train_loss: 0.7451, test_loss: 1.0439, test_f1: 0.5327
 epoch: 26, train_loss: 0.7551, test_loss: 1.0926, test_f1: 0.4901
 epoch: 27, train_loss: 0.7283, test_loss: 0.9522, test_f1: 0.5326
 epoch: 28, train_loss: 0.7184, test_loss: 0.9221, test_f1: 0.6017
 epoch: 29, train_loss: 0.7183, test_loss: 0.8067, test_f1: 0.5861
 epoch: 30, train_loss: 0.7247, test_loss: 0.8809, test_f1: 0.6214
 epoch: 31, train_loss: 0.7287, test_loss: 0.8163, test_f1: 0.5960
 epoch: 32, train_loss: 0.7263, test_loss: 0.8878, test_f1: 0.6091
 epoch: 33, train_loss: 0.7182, test_loss: 0.9095, test_f1: 0.5640
 epoch: 34, train_loss: 0.7096, test_loss: 0.9184, test_f1: 0.5441
 epoch: 35, train_loss: 0.6984, test_loss: 0.9353, test_f1: 0.5813
 epoch: 36, train_loss: 0.7206, test_loss: 1.1220, test_f1: 0.5093
 epoch: 37, train_loss: 0.7145, test_loss: 0.9648, test_f1: 0.6195
 epoch: 38, train_loss: 0.7044, test_loss: 0.9186, test_f1: 0.5576
 epoch: 39, train_loss: 0.7191, test_loss: 0.9560, test_f1: 0.5690
 epoch: 40, train_loss: 0.6894, test_loss: 0.8561, test_f1: 0.5959
 epoch: 41, train_loss: 0.7030, test_loss: 0.9704, test_f1: 0.5841
 epoch: 42, train_loss: 0.6895, test_loss: 1.0278, test_f1: 0.5684
 epoch: 43, train_loss: 0.6790, test_loss: 0.9340, test_f1: 0.5518
 epoch: 44, train_loss: 0.6812, test_loss: 1.1085, test_f1: 0.5467
 epoch: 45, train_loss: 0.6904, test_loss: 1.0206, test_f1: 0.5112
 epoch: 46, train_loss: 0.6685, test_loss: 0.9333, test_f1: 0.5777
 epoch: 47, train_loss: 0.6799, test_loss: 0.8564, test_f1: 0.5867
 epoch: 48, train_loss: 0.6632, test_loss: 1.1300, test_f1: 0.5772
 epoch: 49, train_loss: 0.6598, test_loss: 0.9546, test_f1: 0.6053
 epoch: 50, train_loss: 0.6535, test_loss: 0.9928, test_f1: 0.5568
 epoch: 51, train_loss: 0.6331, test_loss: 0.9730, test_f1: 0.6286
 epoch: 52, train_loss: 0.6050, test_loss: 1.0201, test_f1: 0.6000
 epoch: 53, train_loss: 0.6185, test_loss: 0.9591, test_f1: 0.5886
 epoch: 54, train_loss: 0.6072, test_loss: 0.9716, test_f1: 0.5927
 epoch: 55, train_loss: 0.5992, test_loss: 1.0002, test_f1: 0.6059
 epoch: 56, train_loss: 0.6130, test_loss: 0.9979, test_f1: 0.6152
 epoch: 57, train_loss: 0.5916, test_loss: 0.9223, test_f1: 0.6234
 epoch: 58, train_loss: 0.5869, test_loss: 0.9350, test_f1: 0.6202
 epoch: 59, train_loss: 0.5847, test_loss: 0.9321, test_f1: 0.5987
 epoch: 60, train_loss: 0.5933, test_loss: 0.9735, test_f1: 0.5831
 epoch: 61, train_loss: 0.5933, test_loss: 0.9300, test_f1: 0.6188
 epoch: 62, train_loss: 0.5927, test_loss: 0.9159, test_f1: 0.6107
 epoch: 63, train_loss: 0.5610, test_loss: 0.9610, test_f1: 0.6120
 epoch: 64, train_loss: 0.5742, test_loss: 0.9546, test_f1: 0.6343
 epoch: 65, train_loss: 0.5815, test_loss: 0.9207, test_f1: 0.6031
 epoch: 66, train_loss: 0.5848, test_loss: 0.9652, test_f1: 0.6199
 epoch: 67, train_loss: 0.5807, test_loss: 0.9372, test_f1: 0.6098
 epoch: 68, train_loss: 0.5771, test_loss: 0.9906, test_f1: 0.6061
 epoch: 69, train_loss: 0.5556, test_loss: 1.0006, test_f1: 0.6184
 epoch: 70, train_loss: 0.5730, test_loss: 1.1011, test_f1: 0.5506
 epoch: 71, train_loss: 0.5584, test_loss: 1.0235, test_f1: 0.6166
 epoch: 72, train_loss: 0.5711, test_loss: 0.9165, test_f1: 0.6147
 epoch: 73, train_loss: 0.5653, test_loss: 1.0698, test_f1: 0.5737
 epoch: 74, train_loss: 0.5329, test_loss: 0.9967, test_f1: 0.6169
 epoch: 75, train_loss: 0.5562, test_loss: 1.0075, test_f1: 0.6050
 epoch: 76, train_loss: 0.5401, test_loss: 1.0331, test_f1: 0.6201
 epoch: 77, train_loss: 0.5568, test_loss: 1.0132, test_f1: 0.6291
 epoch: 78, train_loss: 0.5477, test_loss: 1.0117, test_f1: 0.6304
 epoch: 79, train_loss: 0.5389, test_loss: 1.0490, test_f1: 0.6068
 epoch: 80, train_loss: 0.5288, test_loss: 0.9993, test_f1: 0.6189
 epoch: 81, train_loss: 0.5335, test_loss: 1.0070, test_f1: 0.6406
 epoch: 82, train_loss: 0.5272, test_loss: 0.9688, test_f1: 0.6397
 epoch: 83, train_loss: 0.5544, test_loss: 1.0611, test_f1: 0.5782
 epoch: 84, train_loss: 0.5369, test_loss: 1.0471, test_f1: 0.6444
 epoch: 85, train_loss: 0.5271, test_loss: 0.9599, test_f1: 0.6404
 epoch: 86, train_loss: 0.5139, test_loss: 1.0054, test_f1: 0.6115
 epoch: 87, train_loss: 0.5130, test_loss: 1.1206, test_f1: 0.5810
 epoch: 88, train_loss: 0.5350, test_loss: 1.0521, test_f1: 0.6016
 epoch: 89, train_loss: 0.5363, test_loss: 1.0814, test_f1: 0.6148
 epoch: 90, train_loss: 0.5120, test_loss: 1.0614, test_f1: 0.6382
 epoch: 91, train_loss: 0.5133, test_loss: 1.0834, test_f1: 0.5978
 epoch: 92, train_loss: 0.5224, test_loss: 1.0807, test_f1: 0.5828
 epoch: 93, train_loss: 0.5152, test_loss: 1.1517, test_f1: 0.5767
 epoch: 94, train_loss: 0.5251, test_loss: 0.9979, test_f1: 0.6241
 epoch: 95, train_loss: 0.5293, test_loss: 1.1194, test_f1: 0.6046
 epoch: 96, train_loss: 0.5122, test_loss: 0.9827, test_f1: 0.6189
 epoch: 97, train_loss: 0.4970, test_loss: 1.0721, test_f1: 0.5974
 epoch: 98, train_loss: 0.5016, test_loss: 1.0085, test_f1: 0.6117
 epoch: 99, train_loss: 0.4866, test_loss: 1.0494, test_f1: 0.6378
##################ITERATION #9 ****************************************
 epoch: 0, train_loss: 1.1871, test_loss: 1.1537, test_f1: 0.3329
 epoch: 1, train_loss: 1.0227, test_loss: 0.9796, test_f1: 0.5179
 epoch: 2, train_loss: 0.9727, test_loss: 0.9963, test_f1: 0.4966
 epoch: 3, train_loss: 0.9599, test_loss: 1.0998, test_f1: 0.4634
 epoch: 4, train_loss: 0.9362, test_loss: 0.9832, test_f1: 0.4665
 epoch: 5, train_loss: 0.9434, test_loss: 1.0413, test_f1: 0.4902
 epoch: 6, train_loss: 0.9257, test_loss: 0.9477, test_f1: 0.5344
 epoch: 7, train_loss: 0.8886, test_loss: 0.9986, test_f1: 0.5498
 epoch: 8, train_loss: 0.8734, test_loss: 0.9564, test_f1: 0.4911
 epoch: 9, train_loss: 0.8643, test_loss: 1.0204, test_f1: 0.5251
 epoch: 10, train_loss: 0.8591, test_loss: 1.0992, test_f1: 0.4910
 epoch: 11, train_loss: 0.8459, test_loss: 0.9551, test_f1: 0.5209
 epoch: 12, train_loss: 0.8431, test_loss: 0.9814, test_f1: 0.4721
 epoch: 13, train_loss: 0.8333, test_loss: 0.8872, test_f1: 0.5815
 epoch: 14, train_loss: 0.8105, test_loss: 0.9582, test_f1: 0.5257
 epoch: 15, train_loss: 0.8184, test_loss: 0.9310, test_f1: 0.5904
 epoch: 16, train_loss: 0.8123, test_loss: 0.8741, test_f1: 0.5402
 epoch: 17, train_loss: 0.7975, test_loss: 0.9538, test_f1: 0.5410
 epoch: 18, train_loss: 0.7875, test_loss: 1.1657, test_f1: 0.4668
 epoch: 19, train_loss: 0.7726, test_loss: 0.8564, test_f1: 0.6292
 epoch: 20, train_loss: 0.7553, test_loss: 0.8763, test_f1: 0.5883
 epoch: 21, train_loss: 0.7742, test_loss: 0.9139, test_f1: 0.5888
 epoch: 22, train_loss: 0.7686, test_loss: 1.0410, test_f1: 0.4663
 epoch: 23, train_loss: 0.7639, test_loss: 0.9926, test_f1: 0.5257
 epoch: 24, train_loss: 0.7574, test_loss: 0.9155, test_f1: 0.5730
 epoch: 25, train_loss: 0.7285, test_loss: 0.9326, test_f1: 0.6163
 epoch: 26, train_loss: 0.7240, test_loss: 0.8800, test_f1: 0.5606
 epoch: 27, train_loss: 0.7369, test_loss: 0.9300, test_f1: 0.5990
 epoch: 28, train_loss: 0.7358, test_loss: 0.8649, test_f1: 0.5934
 epoch: 29, train_loss: 0.6971, test_loss: 0.9600, test_f1: 0.6105
 epoch: 30, train_loss: 0.6972, test_loss: 0.8762, test_f1: 0.5764
 epoch: 31, train_loss: 0.6983, test_loss: 0.8627, test_f1: 0.6219
 epoch: 32, train_loss: 0.6853, test_loss: 0.8877, test_f1: 0.5722
 epoch: 33, train_loss: 0.6871, test_loss: 0.9018, test_f1: 0.5812
 epoch: 34, train_loss: 0.6930, test_loss: 0.8816, test_f1: 0.5958
 epoch: 35, train_loss: 0.6721, test_loss: 1.0042, test_f1: 0.5633
 epoch: 36, train_loss: 0.6950, test_loss: 0.8630, test_f1: 0.6459
 epoch: 37, train_loss: 0.6817, test_loss: 1.0043, test_f1: 0.5949
 epoch: 38, train_loss: 0.7012, test_loss: 0.8180, test_f1: 0.6154
 epoch: 39, train_loss: 0.6705, test_loss: 0.8162, test_f1: 0.6319
 epoch: 40, train_loss: 0.6661, test_loss: 0.8691, test_f1: 0.6013
 epoch: 41, train_loss: 0.6671, test_loss: 0.9097, test_f1: 0.5748
 epoch: 42, train_loss: 0.6649, test_loss: 0.8286, test_f1: 0.6364
 epoch: 43, train_loss: 0.6671, test_loss: 0.8693, test_f1: 0.5768
 epoch: 44, train_loss: 0.6522, test_loss: 1.2138, test_f1: 0.5372
 epoch: 45, train_loss: 0.6577, test_loss: 0.9041, test_f1: 0.6085
 epoch: 46, train_loss: 0.6614, test_loss: 1.1065, test_f1: 0.5528
 epoch: 47, train_loss: 0.6584, test_loss: 0.8779, test_f1: 0.5981
 epoch: 48, train_loss: 0.6523, test_loss: 0.9245, test_f1: 0.5545
 epoch: 49, train_loss: 0.6504, test_loss: 0.9202, test_f1: 0.5743
 epoch: 50, train_loss: 0.6442, test_loss: 0.9356, test_f1: 0.5659
 epoch: 51, train_loss: 0.6030, test_loss: 0.8587, test_f1: 0.6436
 epoch: 52, train_loss: 0.6031, test_loss: 0.8928, test_f1: 0.6222
 epoch: 53, train_loss: 0.5872, test_loss: 0.8332, test_f1: 0.6381
 epoch: 54, train_loss: 0.5763, test_loss: 0.8416, test_f1: 0.6696
 epoch: 55, train_loss: 0.5848, test_loss: 0.8318, test_f1: 0.6291
 epoch: 56, train_loss: 0.5845, test_loss: 0.8667, test_f1: 0.6249
 epoch: 57, train_loss: 0.5750, test_loss: 0.8726, test_f1: 0.6362
 epoch: 58, train_loss: 0.5875, test_loss: 0.8501, test_f1: 0.6305
 epoch: 59, train_loss: 0.5807, test_loss: 0.8284, test_f1: 0.6108
 epoch: 60, train_loss: 0.5737, test_loss: 0.8454, test_f1: 0.6236
 epoch: 61, train_loss: 0.5692, test_loss: 0.8696, test_f1: 0.6350
 epoch: 62, train_loss: 0.5596, test_loss: 0.9893, test_f1: 0.5953
 epoch: 63, train_loss: 0.5553, test_loss: 0.9522, test_f1: 0.5937
 epoch: 64, train_loss: 0.5337, test_loss: 0.8574, test_f1: 0.6276
 epoch: 65, train_loss: 0.5396, test_loss: 0.9070, test_f1: 0.6109
 epoch: 66, train_loss: 0.5654, test_loss: 0.8970, test_f1: 0.6448
 epoch: 67, train_loss: 0.5490, test_loss: 0.9006, test_f1: 0.6209
 epoch: 68, train_loss: 0.5570, test_loss: 0.9555, test_f1: 0.6037
 epoch: 69, train_loss: 0.5413, test_loss: 0.9194, test_f1: 0.6239
 epoch: 70, train_loss: 0.5374, test_loss: 0.8974, test_f1: 0.6194
 epoch: 71, train_loss: 0.5408, test_loss: 0.9225, test_f1: 0.6039
 epoch: 72, train_loss: 0.5457, test_loss: 0.9571, test_f1: 0.5975
 epoch: 73, train_loss: 0.5285, test_loss: 0.8949, test_f1: 0.6299
 epoch: 74, train_loss: 0.5351, test_loss: 0.8666, test_f1: 0.6367
 epoch: 75, train_loss: 0.5385, test_loss: 0.8754, test_f1: 0.6313
 epoch: 76, train_loss: 0.5316, test_loss: 0.9038, test_f1: 0.6274
 epoch: 77, train_loss: 0.5353, test_loss: 0.9715, test_f1: 0.6244
 epoch: 78, train_loss: 0.5252, test_loss: 0.9053, test_f1: 0.6262
 epoch: 79, train_loss: 0.5139, test_loss: 0.9593, test_f1: 0.6203
 epoch: 80, train_loss: 0.5266, test_loss: 0.8903, test_f1: 0.6379
 epoch: 81, train_loss: 0.5169, test_loss: 0.8805, test_f1: 0.6436
 epoch: 82, train_loss: 0.5116, test_loss: 0.9791, test_f1: 0.6221
 epoch: 83, train_loss: 0.5085, test_loss: 0.9286, test_f1: 0.6256
 epoch: 84, train_loss: 0.5378, test_loss: 0.9975, test_f1: 0.6088
 epoch: 85, train_loss: 0.5257, test_loss: 0.9035, test_f1: 0.6402
 epoch: 86, train_loss: 0.5390, test_loss: 0.8755, test_f1: 0.6448
 epoch: 87, train_loss: 0.5174, test_loss: 0.9162, test_f1: 0.6080
 epoch: 88, train_loss: 0.5101, test_loss: 0.8819, test_f1: 0.6488
 epoch: 89, train_loss: 0.4920, test_loss: 1.0093, test_f1: 0.6267
 epoch: 90, train_loss: 0.5113, test_loss: 0.9468, test_f1: 0.5725
 epoch: 91, train_loss: 0.4871, test_loss: 1.0273, test_f1: 0.6140
 epoch: 92, train_loss: 0.5035, test_loss: 1.0049, test_f1: 0.6406
 epoch: 93, train_loss: 0.5081, test_loss: 0.8984, test_f1: 0.6147
 epoch: 94, train_loss: 0.5111, test_loss: 0.9172, test_f1: 0.6067
 epoch: 95, train_loss: 0.5017, test_loss: 0.9627, test_f1: 0.6326
 epoch: 96, train_loss: 0.4948, test_loss: 0.9367, test_f1: 0.6111
 epoch: 97, train_loss: 0.4944, test_loss: 0.9955, test_f1: 0.5955
 epoch: 98, train_loss: 0.4967, test_loss: 0.9650, test_f1: 0.6131
 epoch: 99, train_loss: 0.4999, test_loss: 0.9504, test_f1: 0.6315

Training completed in 484.29 seconds
Best F1: 0.6873 at epoch 98
Mean F1 across iterations: 0.6633  0.0139
========================FINAL RESULTS================================
FEGIN weighted F1: 0.6873  0.0139
python main.py --data ltspice_examples --representation component_pin --model FEGIN --layers 3 --hiddens 32 --batch_size 128 --lr 0.01 --emb_size 128 --epochs 100 --save_appendix component_pin_L3_H32_BS128_LR0.01_E128 --no_val
-----



STDERR:
  File "main.py", line 370, in <module>
    main()
  File "main.py", line 254, in main
    dataset = dataset_class(
  File "/home/philip/projects/ltspice_examples_code_repo/Circuit-Completion-Using-GNNs/component_classification_with_link_prediction_head/evaluation/FEGIN/kernel/circuit_datasets.py", line 15, in __init__
    self.data, self.slices = torch.load(self.processed_paths[0])
  File "/home/philip/.local/lib/python3.8/site-packages/torch/serialization.py", line 1040, in load
    warnings.warn(
  File "/usr/lib/python3.8/warnings.py", line 109, in _showwarnmsg
    sw(msg.message, msg.category, msg.filename, msg.lineno,
  File "main.py", line 47, in warn_with_traceback
    traceback.print_stack(file=log)
/home/philip/projects/ltspice_examples_code_repo/Circuit-Completion-Using-GNNs/component_classification_with_link_prediction_head/evaluation/FEGIN/kernel/circuit_datasets.py:15: FutureWarning: You are using `torch.load` with `weights_only=False` (the current default value), which uses the default pickle module implicitly. It is possible to construct malicious pickle data which will execute arbitrary code during unpickling (See https://github.com/pytorch/pytorch/blob/main/SECURITY.md#untrusted-models for more details). In a future release, the default value for `weights_only` will be flipped to `True`. This limits the functions that could be executed during unpickling. Arbitrary objects will no longer be allowed to be loaded via this mode unless they are explicitly allowlisted by the user via `torch.serialization.add_safe_globals`. We recommend you start setting `weights_only=True` for any use case where you don't have full control of the loaded file. Please open an issue on GitHub for any issues related to this experimental feature.
  self.data, self.slices = torch.load(self.processed_paths[0])
