STDOUT:
Results will be saved in /home/philip/projects/ltspice_examples_code_repo/Circuit-Completion-Using-GNNs/component_classification_with_link_prediction_head/evaluation/FEGIN/results/model_FEGIN_dataset_ltspice_examples
Command line input: python main.py --data ltspice_examples --representation component_component --model FEGIN --layers 3 --hiddens 128 --batch_size 32 --lr 0.001 --emb_size 512 --epochs 100 --save_appendix component_component_L3_H128_BS32_LR0.001_E512 --no_val
 is saved.
-----
ltspice_examples - FEGIN
Using 3 layers, 128 hidden units, h = 2
Loading component_component representation dataset
ENTERED
Training FEGIN on component_component representation
Train: 3556, Test: 845
##################ITERATION #0 ****************************************
 epoch: 0, train_loss: 1.2343, test_loss: 1.1009, test_f1: 0.4426
 epoch: 1, train_loss: 1.1201, test_loss: 1.0275, test_f1: 0.4708
 epoch: 2, train_loss: 1.0635, test_loss: 1.0133, test_f1: 0.4755
 epoch: 3, train_loss: 1.0160, test_loss: 0.9835, test_f1: 0.4964
 epoch: 4, train_loss: 0.9949, test_loss: 0.9736, test_f1: 0.4683
 epoch: 5, train_loss: 0.9879, test_loss: 0.9772, test_f1: 0.4767
 epoch: 6, train_loss: 0.9497, test_loss: 1.0180, test_f1: 0.5109
 epoch: 7, train_loss: 0.9345, test_loss: 1.0500, test_f1: 0.4658
 epoch: 8, train_loss: 0.9328, test_loss: 0.9526, test_f1: 0.5450
 epoch: 9, train_loss: 0.8999, test_loss: 1.0117, test_f1: 0.5032
 epoch: 10, train_loss: 0.9003, test_loss: 0.9684, test_f1: 0.4995
 epoch: 11, train_loss: 0.8827, test_loss: 0.9959, test_f1: 0.5097
 epoch: 12, train_loss: 0.8854, test_loss: 1.0381, test_f1: 0.5155
 epoch: 13, train_loss: 0.8702, test_loss: 0.9573, test_f1: 0.5628
 epoch: 14, train_loss: 0.8548, test_loss: 0.9271, test_f1: 0.5606
 epoch: 15, train_loss: 0.8455, test_loss: 1.0467, test_f1: 0.5297
 epoch: 16, train_loss: 0.8303, test_loss: 0.9665, test_f1: 0.5266
 epoch: 17, train_loss: 0.8369, test_loss: 1.0877, test_f1: 0.5383
 epoch: 18, train_loss: 0.8053, test_loss: 1.0608, test_f1: 0.5206
 epoch: 19, train_loss: 0.8151, test_loss: 1.0509, test_f1: 0.5272
 epoch: 20, train_loss: 0.7928, test_loss: 1.0048, test_f1: 0.5535
 epoch: 21, train_loss: 0.8033, test_loss: 1.0032, test_f1: 0.5276
 epoch: 22, train_loss: 0.7778, test_loss: 1.0871, test_f1: 0.5660
 epoch: 23, train_loss: 0.7944, test_loss: 1.0053, test_f1: 0.5324
 epoch: 24, train_loss: 0.7636, test_loss: 1.0405, test_f1: 0.5680
 epoch: 25, train_loss: 0.7507, test_loss: 1.1152, test_f1: 0.5551
 epoch: 26, train_loss: 0.7530, test_loss: 1.0022, test_f1: 0.5592
 epoch: 27, train_loss: 0.7642, test_loss: 1.0065, test_f1: 0.5501
 epoch: 28, train_loss: 0.7411, test_loss: 1.1114, test_f1: 0.5453
 epoch: 29, train_loss: 0.7573, test_loss: 0.9349, test_f1: 0.5766
 epoch: 30, train_loss: 0.7508, test_loss: 1.0323, test_f1: 0.5650
 epoch: 31, train_loss: 0.7178, test_loss: 1.1044, test_f1: 0.5559
 epoch: 32, train_loss: 0.7196, test_loss: 1.0158, test_f1: 0.5706
 epoch: 33, train_loss: 0.7234, test_loss: 1.0764, test_f1: 0.5637
 epoch: 34, train_loss: 0.7185, test_loss: 1.0960, test_f1: 0.5468
 epoch: 35, train_loss: 0.7002, test_loss: 1.0745, test_f1: 0.5434
 epoch: 36, train_loss: 0.6944, test_loss: 1.0707, test_f1: 0.5786
 epoch: 37, train_loss: 0.6875, test_loss: 1.1625, test_f1: 0.5454
 epoch: 38, train_loss: 0.6691, test_loss: 1.1354, test_f1: 0.5439
 epoch: 39, train_loss: 0.7016, test_loss: 1.1051, test_f1: 0.5655
 epoch: 40, train_loss: 0.6728, test_loss: 1.1044, test_f1: 0.5430
 epoch: 41, train_loss: 0.6600, test_loss: 1.0770, test_f1: 0.5700
 epoch: 42, train_loss: 0.6830, test_loss: 0.9962, test_f1: 0.5528
 epoch: 43, train_loss: 0.6743, test_loss: 1.1036, test_f1: 0.5437
 epoch: 44, train_loss: 0.6449, test_loss: 1.1683, test_f1: 0.5246
 epoch: 45, train_loss: 0.6563, test_loss: 1.0669, test_f1: 0.5559
 epoch: 46, train_loss: 0.6471, test_loss: 1.1205, test_f1: 0.5525
 epoch: 47, train_loss: 0.6475, test_loss: 1.2633, test_f1: 0.5307
 epoch: 48, train_loss: 0.6440, test_loss: 1.1157, test_f1: 0.5421
 epoch: 49, train_loss: 0.6590, test_loss: 1.0908, test_f1: 0.5381
 epoch: 50, train_loss: 0.6563, test_loss: 1.4747, test_f1: 0.5062
 epoch: 51, train_loss: 0.6059, test_loss: 1.1157, test_f1: 0.5615
 epoch: 52, train_loss: 0.5763, test_loss: 1.1470, test_f1: 0.5655
 epoch: 53, train_loss: 0.5733, test_loss: 1.1516, test_f1: 0.5522
 epoch: 54, train_loss: 0.6218, test_loss: 1.1377, test_f1: 0.5657
 epoch: 55, train_loss: 0.5647, test_loss: 1.1090, test_f1: 0.5600
 epoch: 56, train_loss: 0.5601, test_loss: 1.1889, test_f1: 0.5511
 epoch: 57, train_loss: 0.5365, test_loss: 1.1829, test_f1: 0.5520
 epoch: 58, train_loss: 0.5258, test_loss: 1.2582, test_f1: 0.5606
 epoch: 59, train_loss: 0.5363, test_loss: 1.2777, test_f1: 0.5519
 epoch: 60, train_loss: 0.5230, test_loss: 1.3287, test_f1: 0.5482
 epoch: 61, train_loss: 0.5053, test_loss: 1.2801, test_f1: 0.5313
 epoch: 62, train_loss: 0.4971, test_loss: 1.3100, test_f1: 0.5407
 epoch: 63, train_loss: 0.5229, test_loss: 1.2478, test_f1: 0.5514
 epoch: 64, train_loss: 0.5037, test_loss: 1.3036, test_f1: 0.5397
 epoch: 65, train_loss: 0.5090, test_loss: 1.2921, test_f1: 0.5568
 epoch: 66, train_loss: 0.5039, test_loss: 1.2972, test_f1: 0.5388
 epoch: 67, train_loss: 0.4884, test_loss: 1.3110, test_f1: 0.5598
 epoch: 68, train_loss: 0.4782, test_loss: 1.3214, test_f1: 0.5351
 epoch: 69, train_loss: 0.4835, test_loss: 1.4363, test_f1: 0.5259
 epoch: 70, train_loss: 0.4730, test_loss: 1.4654, test_f1: 0.5063
 epoch: 71, train_loss: 0.5065, test_loss: 1.3359, test_f1: 0.5495
 epoch: 72, train_loss: 0.4737, test_loss: 1.3252, test_f1: 0.5351
 epoch: 73, train_loss: 0.4677, test_loss: 1.3883, test_f1: 0.5630
 epoch: 74, train_loss: 0.4578, test_loss: 1.3901, test_f1: 0.5399
 epoch: 75, train_loss: 0.4609, test_loss: 1.3702, test_f1: 0.5649
 epoch: 76, train_loss: 0.4337, test_loss: 1.4046, test_f1: 0.5722
 epoch: 77, train_loss: 0.4531, test_loss: 1.6292, test_f1: 0.5178
 epoch: 78, train_loss: 0.4390, test_loss: 1.3451, test_f1: 0.5487
 epoch: 79, train_loss: 0.4399, test_loss: 1.4419, test_f1: 0.5478
 epoch: 80, train_loss: 0.4271, test_loss: 1.4069, test_f1: 0.5534
 epoch: 81, train_loss: 0.4426, test_loss: 1.3456, test_f1: 0.5492
 epoch: 82, train_loss: 0.4357, test_loss: 1.4965, test_f1: 0.5333
 epoch: 83, train_loss: 0.4328, test_loss: 1.4155, test_f1: 0.5591
 epoch: 84, train_loss: 0.4097, test_loss: 1.4688, test_f1: 0.5517
 epoch: 85, train_loss: 0.4378, test_loss: 1.4467, test_f1: 0.5590
 epoch: 86, train_loss: 0.4186, test_loss: 1.4995, test_f1: 0.5394
 epoch: 87, train_loss: 0.4170, test_loss: 1.6491, test_f1: 0.5079
 epoch: 88, train_loss: 0.4143, test_loss: 1.4392, test_f1: 0.5602
 epoch: 89, train_loss: 0.4025, test_loss: 1.5967, test_f1: 0.5461
 epoch: 90, train_loss: 0.4166, test_loss: 1.6673, test_f1: 0.5407
 epoch: 91, train_loss: 0.3864, test_loss: 1.7260, test_f1: 0.5550
 epoch: 92, train_loss: 0.4064, test_loss: 1.4858, test_f1: 0.5725
 epoch: 93, train_loss: 0.3982, test_loss: 1.5555, test_f1: 0.5492
 epoch: 94, train_loss: 0.4147, test_loss: 1.5289, test_f1: 0.5480
 epoch: 95, train_loss: 0.3827, test_loss: 1.6570, test_f1: 0.5312
 epoch: 96, train_loss: 0.3997, test_loss: 1.5456, test_f1: 0.5437
 epoch: 97, train_loss: 0.3752, test_loss: 1.7588, test_f1: 0.5287
 epoch: 98, train_loss: 0.3867, test_loss: 1.5774, test_f1: 0.5429
 epoch: 99, train_loss: 0.4950, test_loss: 1.3637, test_f1: 0.5518
##################ITERATION #1 ****************************************
 epoch: 0, train_loss: 1.1906, test_loss: 1.1096, test_f1: 0.4879
 epoch: 1, train_loss: 1.0843, test_loss: 0.9889, test_f1: 0.4686
 epoch: 2, train_loss: 1.0476, test_loss: 1.0045, test_f1: 0.4654
 epoch: 3, train_loss: 1.0343, test_loss: 0.9572, test_f1: 0.4790
 epoch: 4, train_loss: 1.0023, test_loss: 1.0295, test_f1: 0.4608
 epoch: 5, train_loss: 0.9852, test_loss: 0.9504, test_f1: 0.5198
 epoch: 6, train_loss: 0.9605, test_loss: 0.9675, test_f1: 0.4968
 epoch: 7, train_loss: 0.9416, test_loss: 0.9576, test_f1: 0.4935
 epoch: 8, train_loss: 0.9400, test_loss: 0.9469, test_f1: 0.4967
 epoch: 9, train_loss: 0.9299, test_loss: 1.0109, test_f1: 0.5239
 epoch: 10, train_loss: 0.9107, test_loss: 0.9979, test_f1: 0.5057
 epoch: 11, train_loss: 0.8925, test_loss: 1.0438, test_f1: 0.5149
 epoch: 12, train_loss: 0.9007, test_loss: 0.9236, test_f1: 0.5687
 epoch: 13, train_loss: 0.8826, test_loss: 1.0531, test_f1: 0.5373
 epoch: 14, train_loss: 0.8654, test_loss: 1.0452, test_f1: 0.4896
 epoch: 15, train_loss: 0.8682, test_loss: 1.0702, test_f1: 0.5449
 epoch: 16, train_loss: 0.8588, test_loss: 1.1506, test_f1: 0.4740
 epoch: 17, train_loss: 0.8559, test_loss: 1.0008, test_f1: 0.5266
 epoch: 18, train_loss: 0.8247, test_loss: 0.9935, test_f1: 0.5506
 epoch: 19, train_loss: 0.8016, test_loss: 0.9762, test_f1: 0.5395
 epoch: 20, train_loss: 0.8206, test_loss: 1.0318, test_f1: 0.5284
 epoch: 21, train_loss: 0.7964, test_loss: 1.0729, test_f1: 0.5318
 epoch: 22, train_loss: 0.8049, test_loss: 1.0476, test_f1: 0.5525
 epoch: 23, train_loss: 0.7821, test_loss: 1.0690, test_f1: 0.5437
 epoch: 24, train_loss: 0.7708, test_loss: 1.0542, test_f1: 0.5279
 epoch: 25, train_loss: 0.7687, test_loss: 1.0405, test_f1: 0.5481
 epoch: 26, train_loss: 0.7616, test_loss: 1.0309, test_f1: 0.5413
 epoch: 27, train_loss: 0.7501, test_loss: 1.0259, test_f1: 0.5532
 epoch: 28, train_loss: 0.7547, test_loss: 1.0747, test_f1: 0.5430
 epoch: 29, train_loss: 0.7447, test_loss: 1.0740, test_f1: 0.5583
 epoch: 30, train_loss: 0.7473, test_loss: 1.0172, test_f1: 0.5857
 epoch: 31, train_loss: 0.7536, test_loss: 1.0343, test_f1: 0.5508
 epoch: 32, train_loss: 0.6920, test_loss: 1.1616, test_f1: 0.5520
 epoch: 33, train_loss: 0.7088, test_loss: 0.9905, test_f1: 0.5609
 epoch: 34, train_loss: 0.7033, test_loss: 1.2471, test_f1: 0.5323
 epoch: 35, train_loss: 0.7141, test_loss: 1.1436, test_f1: 0.5190
 epoch: 36, train_loss: 0.7007, test_loss: 1.0876, test_f1: 0.5496
 epoch: 37, train_loss: 0.6869, test_loss: 1.0428, test_f1: 0.5460
 epoch: 38, train_loss: 0.6883, test_loss: 1.1563, test_f1: 0.5339
 epoch: 39, train_loss: 0.6821, test_loss: 1.2176, test_f1: 0.5040
 epoch: 40, train_loss: 0.7058, test_loss: 0.9726, test_f1: 0.5616
 epoch: 41, train_loss: 0.6764, test_loss: 1.0275, test_f1: 0.5637
 epoch: 42, train_loss: 0.6716, test_loss: 1.1631, test_f1: 0.5469
 epoch: 43, train_loss: 0.6566, test_loss: 1.3512, test_f1: 0.5045
 epoch: 44, train_loss: 0.6716, test_loss: 1.2070, test_f1: 0.5347
 epoch: 45, train_loss: 0.6728, test_loss: 1.0162, test_f1: 0.5552
 epoch: 46, train_loss: 0.6497, test_loss: 1.1439, test_f1: 0.5361
 epoch: 47, train_loss: 0.6313, test_loss: 1.1978, test_f1: 0.5643
 epoch: 48, train_loss: 0.6358, test_loss: 1.1671, test_f1: 0.5463
 epoch: 49, train_loss: 0.6203, test_loss: 1.1993, test_f1: 0.5239
 epoch: 50, train_loss: 0.6471, test_loss: 1.1265, test_f1: 0.5552
 epoch: 51, train_loss: 0.6094, test_loss: 1.1568, test_f1: 0.5632
 epoch: 52, train_loss: 0.5717, test_loss: 1.2840, test_f1: 0.5525
 epoch: 53, train_loss: 0.5696, test_loss: 1.3209, test_f1: 0.5359
 epoch: 54, train_loss: 0.5697, test_loss: 1.2916, test_f1: 0.5403
 epoch: 55, train_loss: 0.5583, test_loss: 1.2184, test_f1: 0.5552
 epoch: 56, train_loss: 0.5458, test_loss: 1.4724, test_f1: 0.5155
 epoch: 57, train_loss: 0.5410, test_loss: 1.2288, test_f1: 0.5465
 epoch: 58, train_loss: 0.5356, test_loss: 1.3642, test_f1: 0.5275
 epoch: 59, train_loss: 0.5707, test_loss: 1.2512, test_f1: 0.5418
 epoch: 60, train_loss: 0.5503, test_loss: 1.1662, test_f1: 0.5513
 epoch: 61, train_loss: 0.5171, test_loss: 1.2154, test_f1: 0.5392
 epoch: 62, train_loss: 0.5318, test_loss: 1.1761, test_f1: 0.5591
 epoch: 63, train_loss: 0.5225, test_loss: 1.3084, test_f1: 0.5549
 epoch: 64, train_loss: 0.5798, test_loss: 1.2080, test_f1: 0.5440
 epoch: 65, train_loss: 0.5205, test_loss: 1.3002, test_f1: 0.5412
 epoch: 66, train_loss: 0.5100, test_loss: 1.3343, test_f1: 0.5384
 epoch: 67, train_loss: 0.5086, test_loss: 1.3792, test_f1: 0.5585
 epoch: 68, train_loss: 0.4815, test_loss: 1.3845, test_f1: 0.5255
 epoch: 69, train_loss: 0.4955, test_loss: 1.3469, test_f1: 0.5585
 epoch: 70, train_loss: 0.5043, test_loss: 1.3783, test_f1: 0.5546
 epoch: 71, train_loss: 0.4936, test_loss: 1.3115, test_f1: 0.5641
 epoch: 72, train_loss: 0.4743, test_loss: 1.4238, test_f1: 0.5288
 epoch: 73, train_loss: 0.4885, test_loss: 1.2986, test_f1: 0.5741
 epoch: 74, train_loss: 0.4816, test_loss: 1.4149, test_f1: 0.5614
 epoch: 75, train_loss: 0.4726, test_loss: 1.5364, test_f1: 0.5328
 epoch: 76, train_loss: 0.4560, test_loss: 1.5268, test_f1: 0.5416
 epoch: 77, train_loss: 0.4409, test_loss: 1.5006, test_f1: 0.5431
 epoch: 78, train_loss: 0.4546, test_loss: 1.3983, test_f1: 0.5722
 epoch: 79, train_loss: 0.4675, test_loss: 1.4587, test_f1: 0.5670
 epoch: 80, train_loss: 0.4591, test_loss: 1.6493, test_f1: 0.5483
 epoch: 81, train_loss: 0.4736, test_loss: 1.4256, test_f1: 0.5548
 epoch: 82, train_loss: 0.4395, test_loss: 1.4440, test_f1: 0.5781
 epoch: 83, train_loss: 0.4312, test_loss: 1.4801, test_f1: 0.5491
 epoch: 84, train_loss: 0.4224, test_loss: 1.4685, test_f1: 0.5770
 epoch: 85, train_loss: 0.4344, test_loss: 1.4520, test_f1: 0.5716
 epoch: 86, train_loss: 0.4628, test_loss: 1.4795, test_f1: 0.5569
 epoch: 87, train_loss: 0.4261, test_loss: 1.3688, test_f1: 0.5629
 epoch: 88, train_loss: 0.4277, test_loss: 1.4458, test_f1: 0.5532
 epoch: 89, train_loss: 0.4070, test_loss: 1.5763, test_f1: 0.5446
 epoch: 90, train_loss: 0.4200, test_loss: 1.6074, test_f1: 0.5350
 epoch: 91, train_loss: 0.4080, test_loss: 1.4839, test_f1: 0.5714
 epoch: 92, train_loss: 0.4215, test_loss: 1.5008, test_f1: 0.5712
 epoch: 93, train_loss: 0.4055, test_loss: 1.4410, test_f1: 0.5896
 epoch: 94, train_loss: 0.4047, test_loss: 1.4681, test_f1: 0.5701
 epoch: 95, train_loss: 0.3961, test_loss: 1.6333, test_f1: 0.5315
 epoch: 96, train_loss: 0.4336, test_loss: 1.4433, test_f1: 0.5684
 epoch: 97, train_loss: 0.4057, test_loss: 1.4265, test_f1: 0.5554
 epoch: 98, train_loss: 0.3806, test_loss: 1.4768, test_f1: 0.5677
 epoch: 99, train_loss: 0.4027, test_loss: 1.4355, test_f1: 0.5720
##################ITERATION #2 ****************************************
 epoch: 0, train_loss: 1.2325, test_loss: 1.1186, test_f1: 0.4611
 epoch: 1, train_loss: 1.1198, test_loss: 0.9870, test_f1: 0.4613
 epoch: 2, train_loss: 1.0380, test_loss: 0.9994, test_f1: 0.4862
 epoch: 3, train_loss: 1.0265, test_loss: 0.9404, test_f1: 0.5137
 epoch: 4, train_loss: 1.0175, test_loss: 0.9848, test_f1: 0.4788
 epoch: 5, train_loss: 0.9838, test_loss: 1.1007, test_f1: 0.4335
 epoch: 6, train_loss: 0.9697, test_loss: 0.9698, test_f1: 0.4802
 epoch: 7, train_loss: 0.9509, test_loss: 0.9946, test_f1: 0.4726
 epoch: 8, train_loss: 0.9409, test_loss: 0.9709, test_f1: 0.5099
 epoch: 9, train_loss: 0.9123, test_loss: 0.9495, test_f1: 0.4895
 epoch: 10, train_loss: 0.9066, test_loss: 0.9844, test_f1: 0.4791
 epoch: 11, train_loss: 0.8932, test_loss: 0.9111, test_f1: 0.5012
 epoch: 12, train_loss: 0.8802, test_loss: 0.9384, test_f1: 0.5074
 epoch: 13, train_loss: 0.8732, test_loss: 0.9747, test_f1: 0.5366
 epoch: 14, train_loss: 0.8600, test_loss: 1.0004, test_f1: 0.4778
 epoch: 15, train_loss: 0.8475, test_loss: 1.0174, test_f1: 0.4995
 epoch: 16, train_loss: 0.8309, test_loss: 0.9823, test_f1: 0.5224
 epoch: 17, train_loss: 0.8301, test_loss: 1.0323, test_f1: 0.5322
 epoch: 18, train_loss: 0.8184, test_loss: 0.9833, test_f1: 0.5243
 epoch: 19, train_loss: 0.8105, test_loss: 0.9787, test_f1: 0.5366
 epoch: 20, train_loss: 0.7876, test_loss: 0.9636, test_f1: 0.5167
 epoch: 21, train_loss: 0.7962, test_loss: 0.9611, test_f1: 0.5519
 epoch: 22, train_loss: 0.7865, test_loss: 1.0095, test_f1: 0.5102
 epoch: 23, train_loss: 0.7971, test_loss: 1.0999, test_f1: 0.5366
 epoch: 24, train_loss: 0.7620, test_loss: 1.0349, test_f1: 0.5211
 epoch: 25, train_loss: 0.7575, test_loss: 1.0713, test_f1: 0.5306
 epoch: 26, train_loss: 0.7540, test_loss: 1.0173, test_f1: 0.5304
 epoch: 27, train_loss: 0.7457, test_loss: 1.1000, test_f1: 0.5590
 epoch: 28, train_loss: 0.7317, test_loss: 1.1022, test_f1: 0.5396
 epoch: 29, train_loss: 0.7268, test_loss: 1.1769, test_f1: 0.5227
 epoch: 30, train_loss: 0.7139, test_loss: 1.1224, test_f1: 0.5253
 epoch: 31, train_loss: 0.7236, test_loss: 1.1113, test_f1: 0.5309
 epoch: 32, train_loss: 0.7011, test_loss: 1.0929, test_f1: 0.5524
 epoch: 33, train_loss: 0.7069, test_loss: 1.1176, test_f1: 0.5600
 epoch: 34, train_loss: 0.6949, test_loss: 1.1580, test_f1: 0.5236
 epoch: 35, train_loss: 0.6939, test_loss: 1.1052, test_f1: 0.5487
 epoch: 36, train_loss: 0.6731, test_loss: 1.1127, test_f1: 0.5484
 epoch: 37, train_loss: 0.6745, test_loss: 1.0409, test_f1: 0.5805
 epoch: 38, train_loss: 0.6944, test_loss: 1.1614, test_f1: 0.5604
 epoch: 39, train_loss: 0.6708, test_loss: 1.2050, test_f1: 0.5306
 epoch: 40, train_loss: 0.6532, test_loss: 1.0995, test_f1: 0.5490
 epoch: 41, train_loss: 0.6793, test_loss: 1.0574, test_f1: 0.5487
 epoch: 42, train_loss: 0.6626, test_loss: 1.1075, test_f1: 0.5569
 epoch: 43, train_loss: 0.6459, test_loss: 1.0659, test_f1: 0.5751
 epoch: 44, train_loss: 0.6389, test_loss: 1.1858, test_f1: 0.5609
 epoch: 45, train_loss: 0.6308, test_loss: 1.1038, test_f1: 0.5644
 epoch: 46, train_loss: 0.6324, test_loss: 1.1050, test_f1: 0.5646
 epoch: 47, train_loss: 0.6202, test_loss: 1.1945, test_f1: 0.5465
 epoch: 48, train_loss: 0.6041, test_loss: 1.1772, test_f1: 0.5801
 epoch: 49, train_loss: 0.6060, test_loss: 1.1298, test_f1: 0.5847
 epoch: 50, train_loss: 0.5983, test_loss: 1.1194, test_f1: 0.5799
 epoch: 51, train_loss: 0.5624, test_loss: 1.1752, test_f1: 0.5918
 epoch: 52, train_loss: 0.5822, test_loss: 1.0924, test_f1: 0.5919
 epoch: 53, train_loss: 0.5457, test_loss: 1.1921, test_f1: 0.5757
 epoch: 54, train_loss: 0.5238, test_loss: 1.1883, test_f1: 0.5695
 epoch: 55, train_loss: 0.5266, test_loss: 1.2924, test_f1: 0.5620
 epoch: 56, train_loss: 0.5119, test_loss: 1.2941, test_f1: 0.5840
 epoch: 57, train_loss: 0.5217, test_loss: 1.2823, test_f1: 0.5803
 epoch: 58, train_loss: 0.5099, test_loss: 1.2510, test_f1: 0.5876
 epoch: 59, train_loss: 0.5067, test_loss: 1.2906, test_f1: 0.5839
 epoch: 60, train_loss: 0.4971, test_loss: 1.2899, test_f1: 0.5654
 epoch: 61, train_loss: 0.4983, test_loss: 1.2896, test_f1: 0.5926
 epoch: 62, train_loss: 0.4970, test_loss: 1.2605, test_f1: 0.5942
 epoch: 63, train_loss: 0.5039, test_loss: 1.2776, test_f1: 0.5810
 epoch: 64, train_loss: 0.5066, test_loss: 1.1931, test_f1: 0.6055
 epoch: 65, train_loss: 0.4898, test_loss: 1.2855, test_f1: 0.5691
 epoch: 66, train_loss: 0.4907, test_loss: 1.2000, test_f1: 0.5720
 epoch: 67, train_loss: 0.4791, test_loss: 1.2502, test_f1: 0.5886
 epoch: 68, train_loss: 0.4845, test_loss: 1.3055, test_f1: 0.5560
 epoch: 69, train_loss: 0.4540, test_loss: 1.1831, test_f1: 0.5752
 epoch: 70, train_loss: 0.4804, test_loss: 1.2689, test_f1: 0.6038
 epoch: 71, train_loss: 0.4768, test_loss: 1.2083, test_f1: 0.5823
 epoch: 72, train_loss: 0.4721, test_loss: 1.3298, test_f1: 0.5601
 epoch: 73, train_loss: 0.4318, test_loss: 1.3004, test_f1: 0.5925
 epoch: 74, train_loss: 0.4329, test_loss: 1.3838, test_f1: 0.5879
 epoch: 75, train_loss: 0.4361, test_loss: 1.2999, test_f1: 0.5703
 epoch: 76, train_loss: 0.4479, test_loss: 1.3643, test_f1: 0.5772
 epoch: 77, train_loss: 0.4370, test_loss: 1.3474, test_f1: 0.6044
 epoch: 78, train_loss: 0.4431, test_loss: 1.4179, test_f1: 0.5672
 epoch: 79, train_loss: 0.4217, test_loss: 1.3094, test_f1: 0.5888
 epoch: 80, train_loss: 0.4440, test_loss: 1.3657, test_f1: 0.5743
 epoch: 81, train_loss: 0.4354, test_loss: 1.3081, test_f1: 0.5890
 epoch: 82, train_loss: 0.4229, test_loss: 1.3850, test_f1: 0.6024
 epoch: 83, train_loss: 0.4277, test_loss: 1.3358, test_f1: 0.6012
 epoch: 84, train_loss: 0.4187, test_loss: 1.4850, test_f1: 0.5676
 epoch: 85, train_loss: 0.4077, test_loss: 1.4284, test_f1: 0.5886
 epoch: 86, train_loss: 0.4394, test_loss: 1.5131, test_f1: 0.5624
 epoch: 87, train_loss: 0.4288, test_loss: 1.3993, test_f1: 0.5741
 epoch: 88, train_loss: 0.4133, test_loss: 1.3515, test_f1: 0.5763
 epoch: 89, train_loss: 0.4056, test_loss: 1.4216, test_f1: 0.5637
 epoch: 90, train_loss: 0.4118, test_loss: 1.3264, test_f1: 0.5662
 epoch: 91, train_loss: 0.3903, test_loss: 1.5020, test_f1: 0.5629
 epoch: 92, train_loss: 0.3821, test_loss: 1.3907, test_f1: 0.5784
 epoch: 93, train_loss: 0.3857, test_loss: 1.4976, test_f1: 0.5672
 epoch: 94, train_loss: 0.3551, test_loss: 1.5531, test_f1: 0.5626
 epoch: 95, train_loss: 0.3711, test_loss: 1.4152, test_f1: 0.5682
 epoch: 96, train_loss: 0.3947, test_loss: 1.4794, test_f1: 0.5790
 epoch: 97, train_loss: 0.4059, test_loss: 1.6400, test_f1: 0.5497
 epoch: 98, train_loss: 0.3771, test_loss: 1.5074, test_f1: 0.5789
 epoch: 99, train_loss: 0.3865, test_loss: 1.5500, test_f1: 0.5671
##################ITERATION #3 ****************************************
 epoch: 0, train_loss: 1.2689, test_loss: 1.1217, test_f1: 0.4739
 epoch: 1, train_loss: 1.1173, test_loss: 1.0989, test_f1: 0.4184
 epoch: 2, train_loss: 1.0725, test_loss: 1.0199, test_f1: 0.4441
 epoch: 3, train_loss: 1.0452, test_loss: 0.9889, test_f1: 0.4691
 epoch: 4, train_loss: 1.0265, test_loss: 1.0216, test_f1: 0.4505
 epoch: 5, train_loss: 1.0012, test_loss: 1.0188, test_f1: 0.4523
 epoch: 6, train_loss: 0.9629, test_loss: 1.1234, test_f1: 0.4691
 epoch: 7, train_loss: 0.9508, test_loss: 1.0701, test_f1: 0.4552
 epoch: 8, train_loss: 0.9695, test_loss: 0.9838, test_f1: 0.5114
 epoch: 9, train_loss: 0.9326, test_loss: 1.0482, test_f1: 0.5292
 epoch: 10, train_loss: 0.9195, test_loss: 0.9934, test_f1: 0.5109
 epoch: 11, train_loss: 0.9114, test_loss: 1.0303, test_f1: 0.5241
 epoch: 12, train_loss: 0.8955, test_loss: 1.0137, test_f1: 0.5485
 epoch: 13, train_loss: 0.8741, test_loss: 1.0013, test_f1: 0.5175
 epoch: 14, train_loss: 0.8562, test_loss: 1.0218, test_f1: 0.5217
 epoch: 15, train_loss: 0.8494, test_loss: 1.0357, test_f1: 0.5267
 epoch: 16, train_loss: 0.8584, test_loss: 1.1185, test_f1: 0.5231
 epoch: 17, train_loss: 0.8391, test_loss: 1.1188, test_f1: 0.5171
 epoch: 18, train_loss: 0.8362, test_loss: 0.9341, test_f1: 0.5479
 epoch: 19, train_loss: 0.8348, test_loss: 1.0576, test_f1: 0.5435
 epoch: 20, train_loss: 0.8216, test_loss: 1.0584, test_f1: 0.5397
 epoch: 21, train_loss: 0.8000, test_loss: 1.0139, test_f1: 0.5536
 epoch: 22, train_loss: 0.7944, test_loss: 1.0486, test_f1: 0.5456
 epoch: 23, train_loss: 0.8411, test_loss: 1.1281, test_f1: 0.5225
 epoch: 24, train_loss: 0.7974, test_loss: 1.0254, test_f1: 0.5354
 epoch: 25, train_loss: 0.7899, test_loss: 1.0166, test_f1: 0.5401
 epoch: 26, train_loss: 0.7630, test_loss: 1.1271, test_f1: 0.5507
 epoch: 27, train_loss: 0.7485, test_loss: 1.0579, test_f1: 0.5732
 epoch: 28, train_loss: 0.7421, test_loss: 1.0485, test_f1: 0.5395
 epoch: 29, train_loss: 0.7541, test_loss: 1.0033, test_f1: 0.5473
 epoch: 30, train_loss: 0.7333, test_loss: 1.0480, test_f1: 0.5484
 epoch: 31, train_loss: 0.7272, test_loss: 1.0151, test_f1: 0.5534
 epoch: 32, train_loss: 0.7146, test_loss: 1.0204, test_f1: 0.5515
 epoch: 33, train_loss: 0.7541, test_loss: 1.0395, test_f1: 0.5200
 epoch: 34, train_loss: 0.7441, test_loss: 1.0832, test_f1: 0.5422
 epoch: 35, train_loss: 0.6967, test_loss: 1.0971, test_f1: 0.5590
 epoch: 36, train_loss: 0.7041, test_loss: 1.1351, test_f1: 0.5270
 epoch: 37, train_loss: 0.6934, test_loss: 1.0980, test_f1: 0.5186
 epoch: 38, train_loss: 0.6949, test_loss: 1.1880, test_f1: 0.5191
 epoch: 39, train_loss: 0.7887, test_loss: 1.0096, test_f1: 0.5588
 epoch: 40, train_loss: 0.7545, test_loss: 1.0206, test_f1: 0.5390
 epoch: 41, train_loss: 0.7119, test_loss: 1.0006, test_f1: 0.5690
 epoch: 42, train_loss: 0.7255, test_loss: 1.0279, test_f1: 0.5686
 epoch: 43, train_loss: 0.6728, test_loss: 0.9815, test_f1: 0.5498
 epoch: 44, train_loss: 0.6555, test_loss: 1.1203, test_f1: 0.5439
 epoch: 45, train_loss: 0.6637, test_loss: 1.1734, test_f1: 0.5445
 epoch: 46, train_loss: 0.6534, test_loss: 1.1543, test_f1: 0.5355
 epoch: 47, train_loss: 0.6727, test_loss: 1.0537, test_f1: 0.5681
 epoch: 48, train_loss: 0.6349, test_loss: 1.1478, test_f1: 0.5783
 epoch: 49, train_loss: 0.6247, test_loss: 1.0663, test_f1: 0.5815
 epoch: 50, train_loss: 0.6285, test_loss: 1.1491, test_f1: 0.5404
 epoch: 51, train_loss: 0.5781, test_loss: 1.1358, test_f1: 0.5656
 epoch: 52, train_loss: 0.5543, test_loss: 1.1520, test_f1: 0.5544
 epoch: 53, train_loss: 0.5588, test_loss: 1.2292, test_f1: 0.5533
 epoch: 54, train_loss: 0.5464, test_loss: 1.1685, test_f1: 0.5580
 epoch: 55, train_loss: 0.5545, test_loss: 1.2323, test_f1: 0.5530
 epoch: 56, train_loss: 0.5574, test_loss: 1.1035, test_f1: 0.5750
 epoch: 57, train_loss: 0.5395, test_loss: 1.3110, test_f1: 0.5167
 epoch: 58, train_loss: 0.5580, test_loss: 1.2766, test_f1: 0.5559
 epoch: 59, train_loss: 0.5459, test_loss: 1.2118, test_f1: 0.5376
 epoch: 60, train_loss: 0.5372, test_loss: 1.2649, test_f1: 0.5422
 epoch: 61, train_loss: 0.5195, test_loss: 1.2278, test_f1: 0.5608
 epoch: 62, train_loss: 0.5037, test_loss: 1.2420, test_f1: 0.5578
 epoch: 63, train_loss: 0.5132, test_loss: 1.2936, test_f1: 0.5424
 epoch: 64, train_loss: 0.5128, test_loss: 1.2133, test_f1: 0.5480
 epoch: 65, train_loss: 0.5083, test_loss: 1.3023, test_f1: 0.5570
 epoch: 66, train_loss: 0.5101, test_loss: 1.2578, test_f1: 0.5808
 epoch: 67, train_loss: 0.4842, test_loss: 1.3291, test_f1: 0.5218
 epoch: 68, train_loss: 0.4895, test_loss: 1.2830, test_f1: 0.5764
 epoch: 69, train_loss: 0.4983, test_loss: 1.2774, test_f1: 0.5585
 epoch: 70, train_loss: 0.4909, test_loss: 1.3211, test_f1: 0.5675
 epoch: 71, train_loss: 0.5022, test_loss: 1.2700, test_f1: 0.5616
 epoch: 72, train_loss: 0.4549, test_loss: 1.2926, test_f1: 0.5738
 epoch: 73, train_loss: 0.4846, test_loss: 1.3260, test_f1: 0.5620
 epoch: 74, train_loss: 0.4712, test_loss: 1.3907, test_f1: 0.5323
 epoch: 75, train_loss: 0.4886, test_loss: 1.3431, test_f1: 0.5615
 epoch: 76, train_loss: 0.4748, test_loss: 1.3988, test_f1: 0.5375
 epoch: 77, train_loss: 0.4990, test_loss: 1.2463, test_f1: 0.5407
 epoch: 78, train_loss: 0.4577, test_loss: 1.2528, test_f1: 0.5521
 epoch: 79, train_loss: 0.4507, test_loss: 1.3579, test_f1: 0.5663
 epoch: 80, train_loss: 0.4401, test_loss: 1.3862, test_f1: 0.5625
 epoch: 81, train_loss: 0.4105, test_loss: 1.4104, test_f1: 0.5638
 epoch: 82, train_loss: 0.4382, test_loss: 1.4229, test_f1: 0.5604
 epoch: 83, train_loss: 0.4166, test_loss: 1.4394, test_f1: 0.5649
 epoch: 84, train_loss: 0.4489, test_loss: 1.4069, test_f1: 0.5621
 epoch: 85, train_loss: 0.4343, test_loss: 1.4990, test_f1: 0.5588
 epoch: 86, train_loss: 0.4282, test_loss: 1.4327, test_f1: 0.5699
 epoch: 87, train_loss: 0.4330, test_loss: 1.4834, test_f1: 0.5559
 epoch: 88, train_loss: 0.4256, test_loss: 1.4272, test_f1: 0.5753
 epoch: 89, train_loss: 0.4200, test_loss: 1.4215, test_f1: 0.5630
 epoch: 90, train_loss: 0.4041, test_loss: 1.5178, test_f1: 0.5539
 epoch: 91, train_loss: 0.4014, test_loss: 1.4837, test_f1: 0.5756
 epoch: 92, train_loss: 0.4228, test_loss: 1.4815, test_f1: 0.5415
 epoch: 93, train_loss: 0.4446, test_loss: 1.3615, test_f1: 0.5660
 epoch: 94, train_loss: 0.4233, test_loss: 1.4133, test_f1: 0.5987
 epoch: 95, train_loss: 0.4015, test_loss: 1.4559, test_f1: 0.5773
 epoch: 96, train_loss: 0.4128, test_loss: 1.4362, test_f1: 0.5618
 epoch: 97, train_loss: 0.4020, test_loss: 1.4716, test_f1: 0.5711
 epoch: 98, train_loss: 0.3714, test_loss: 1.4047, test_f1: 0.5746
 epoch: 99, train_loss: 0.4043, test_loss: 1.5194, test_f1: 0.5839
##################ITERATION #4 ****************************************
 epoch: 0, train_loss: 1.2804, test_loss: 1.1370, test_f1: 0.3911
 epoch: 1, train_loss: 1.1228, test_loss: 1.0683, test_f1: 0.4194
 epoch: 2, train_loss: 1.0812, test_loss: 1.0059, test_f1: 0.4557
 epoch: 3, train_loss: 1.0543, test_loss: 1.0283, test_f1: 0.4376
 epoch: 4, train_loss: 1.0194, test_loss: 1.0193, test_f1: 0.4813
 epoch: 5, train_loss: 1.0138, test_loss: 1.0109, test_f1: 0.4413
 epoch: 6, train_loss: 0.9900, test_loss: 0.9222, test_f1: 0.4907
 epoch: 7, train_loss: 0.9548, test_loss: 0.9743, test_f1: 0.4848
 epoch: 8, train_loss: 0.9614, test_loss: 0.9491, test_f1: 0.4898
 epoch: 9, train_loss: 0.9499, test_loss: 0.9469, test_f1: 0.5070
 epoch: 10, train_loss: 0.9293, test_loss: 0.9831, test_f1: 0.5077
 epoch: 11, train_loss: 0.9019, test_loss: 0.9290, test_f1: 0.5026
 epoch: 12, train_loss: 0.9143, test_loss: 1.0090, test_f1: 0.4795
 epoch: 13, train_loss: 0.8782, test_loss: 0.9594, test_f1: 0.5224
 epoch: 14, train_loss: 0.8866, test_loss: 0.9880, test_f1: 0.4965
 epoch: 15, train_loss: 0.8854, test_loss: 1.0304, test_f1: 0.5016
 epoch: 16, train_loss: 0.8767, test_loss: 1.0579, test_f1: 0.4704
 epoch: 17, train_loss: 0.8568, test_loss: 0.9914, test_f1: 0.4789
 epoch: 18, train_loss: 0.8307, test_loss: 1.0213, test_f1: 0.5427
 epoch: 19, train_loss: 0.8454, test_loss: 1.0072, test_f1: 0.5314
 epoch: 20, train_loss: 0.8087, test_loss: 0.9938, test_f1: 0.5488
 epoch: 21, train_loss: 0.7992, test_loss: 1.1520, test_f1: 0.5066
 epoch: 22, train_loss: 0.8005, test_loss: 0.9988, test_f1: 0.5231
 epoch: 23, train_loss: 0.7886, test_loss: 1.0926, test_f1: 0.5498
 epoch: 24, train_loss: 0.7752, test_loss: 1.0683, test_f1: 0.5629
 epoch: 25, train_loss: 0.7688, test_loss: 1.0072, test_f1: 0.5663
 epoch: 26, train_loss: 0.7713, test_loss: 1.0148, test_f1: 0.5764
 epoch: 27, train_loss: 0.7516, test_loss: 1.0467, test_f1: 0.5388
 epoch: 28, train_loss: 0.7391, test_loss: 1.0433, test_f1: 0.5547
 epoch: 29, train_loss: 0.7604, test_loss: 1.0219, test_f1: 0.5440
 epoch: 30, train_loss: 0.7475, test_loss: 1.1481, test_f1: 0.5595
 epoch: 31, train_loss: 0.7293, test_loss: 1.0211, test_f1: 0.5590
 epoch: 32, train_loss: 0.7325, test_loss: 1.0557, test_f1: 0.5334
 epoch: 33, train_loss: 0.7075, test_loss: 1.0966, test_f1: 0.5081
 epoch: 34, train_loss: 0.7260, test_loss: 1.1125, test_f1: 0.5340
 epoch: 35, train_loss: 0.7224, test_loss: 1.0225, test_f1: 0.5585
 epoch: 36, train_loss: 0.7167, test_loss: 1.0773, test_f1: 0.5582
 epoch: 37, train_loss: 0.7090, test_loss: 1.0032, test_f1: 0.5489
 epoch: 38, train_loss: 0.6932, test_loss: 1.0380, test_f1: 0.5732
 epoch: 39, train_loss: 0.6802, test_loss: 1.1080, test_f1: 0.5791
 epoch: 40, train_loss: 0.6987, test_loss: 1.0422, test_f1: 0.5823
 epoch: 41, train_loss: 0.6783, test_loss: 1.0966, test_f1: 0.5538
 epoch: 42, train_loss: 0.6585, test_loss: 1.0974, test_f1: 0.5609
 epoch: 43, train_loss: 0.6498, test_loss: 1.0964, test_f1: 0.6187
 epoch: 44, train_loss: 0.6463, test_loss: 1.0508, test_f1: 0.5620
 epoch: 45, train_loss: 0.6580, test_loss: 1.0109, test_f1: 0.5737
 epoch: 46, train_loss: 0.6335, test_loss: 1.0492, test_f1: 0.5535
 epoch: 47, train_loss: 0.6163, test_loss: 1.0187, test_f1: 0.5591
 epoch: 48, train_loss: 0.6278, test_loss: 1.0792, test_f1: 0.5830
 epoch: 49, train_loss: 0.6268, test_loss: 0.9908, test_f1: 0.5813
 epoch: 50, train_loss: 0.6234, test_loss: 1.0342, test_f1: 0.5651
 epoch: 51, train_loss: 0.5815, test_loss: 1.1057, test_f1: 0.5312
 epoch: 52, train_loss: 0.5567, test_loss: 1.1113, test_f1: 0.5736
 epoch: 53, train_loss: 0.5452, test_loss: 1.0973, test_f1: 0.5727
 epoch: 54, train_loss: 0.5334, test_loss: 1.2165, test_f1: 0.5279
 epoch: 55, train_loss: 0.5280, test_loss: 1.1489, test_f1: 0.5386
 epoch: 56, train_loss: 0.5095, test_loss: 1.1784, test_f1: 0.5662
 epoch: 57, train_loss: 0.5185, test_loss: 1.1526, test_f1: 0.6071
 epoch: 58, train_loss: 0.5294, test_loss: 1.1402, test_f1: 0.5441
 epoch: 59, train_loss: 0.5131, test_loss: 1.1697, test_f1: 0.5921
 epoch: 60, train_loss: 0.5010, test_loss: 1.1715, test_f1: 0.5722
 epoch: 61, train_loss: 0.4922, test_loss: 1.2575, test_f1: 0.5549
 epoch: 62, train_loss: 0.4793, test_loss: 1.1892, test_f1: 0.5662
 epoch: 63, train_loss: 0.4930, test_loss: 1.1260, test_f1: 0.5638
 epoch: 64, train_loss: 0.4683, test_loss: 1.1556, test_f1: 0.5687
 epoch: 65, train_loss: 0.4791, test_loss: 1.2486, test_f1: 0.5563
 epoch: 66, train_loss: 0.4906, test_loss: 1.1858, test_f1: 0.5872
 epoch: 67, train_loss: 0.4770, test_loss: 1.2589, test_f1: 0.5733
 epoch: 68, train_loss: 0.4639, test_loss: 1.2420, test_f1: 0.5686
 epoch: 69, train_loss: 0.4621, test_loss: 1.2294, test_f1: 0.5912
 epoch: 70, train_loss: 0.4475, test_loss: 1.2586, test_f1: 0.5954
 epoch: 71, train_loss: 0.4446, test_loss: 1.2331, test_f1: 0.5733
 epoch: 72, train_loss: 0.4540, test_loss: 1.2260, test_f1: 0.5916
 epoch: 73, train_loss: 0.4387, test_loss: 1.3190, test_f1: 0.5646
 epoch: 74, train_loss: 0.4414, test_loss: 1.2630, test_f1: 0.5922
 epoch: 75, train_loss: 0.4412, test_loss: 1.3098, test_f1: 0.5790
 epoch: 76, train_loss: 0.4420, test_loss: 1.2869, test_f1: 0.5987
 epoch: 77, train_loss: 0.4178, test_loss: 1.3414, test_f1: 0.5651
 epoch: 78, train_loss: 0.4067, test_loss: 1.4000, test_f1: 0.5685
 epoch: 79, train_loss: 0.4288, test_loss: 1.2827, test_f1: 0.6139
 epoch: 80, train_loss: 0.4145, test_loss: 1.3230, test_f1: 0.6120
 epoch: 81, train_loss: 0.4031, test_loss: 1.4022, test_f1: 0.5784
 epoch: 82, train_loss: 0.4044, test_loss: 1.3307, test_f1: 0.5722
 epoch: 83, train_loss: 0.4034, test_loss: 1.3902, test_f1: 0.5690
 epoch: 84, train_loss: 0.3943, test_loss: 1.3731, test_f1: 0.5898
 epoch: 85, train_loss: 0.4016, test_loss: 1.4070, test_f1: 0.5751
 epoch: 86, train_loss: 0.4022, test_loss: 1.4001, test_f1: 0.5832
 epoch: 87, train_loss: 0.3677, test_loss: 1.4627, test_f1: 0.5943
 epoch: 88, train_loss: 0.3788, test_loss: 1.4109, test_f1: 0.5811
 epoch: 89, train_loss: 0.4138, test_loss: 1.3074, test_f1: 0.6081
 epoch: 90, train_loss: 0.3927, test_loss: 1.3097, test_f1: 0.5631
 epoch: 91, train_loss: 0.3886, test_loss: 1.4948, test_f1: 0.5806
 epoch: 92, train_loss: 0.3779, test_loss: 1.3811, test_f1: 0.5902
 epoch: 93, train_loss: 0.3755, test_loss: 1.3561, test_f1: 0.5990
 epoch: 94, train_loss: 0.3690, test_loss: 1.3483, test_f1: 0.5711
 epoch: 95, train_loss: 0.3657, test_loss: 1.4078, test_f1: 0.6066
 epoch: 96, train_loss: 0.3767, test_loss: 1.3270, test_f1: 0.5996
 epoch: 97, train_loss: 0.3555, test_loss: 1.4438, test_f1: 0.5956
 epoch: 98, train_loss: 0.3432, test_loss: 1.4436, test_f1: 0.6018
 epoch: 99, train_loss: 0.3651, test_loss: 1.4607, test_f1: 0.5811
##################ITERATION #5 ****************************************
 epoch: 0, train_loss: 1.2852, test_loss: 1.1178, test_f1: 0.4440
 epoch: 1, train_loss: 1.1154, test_loss: 1.0464, test_f1: 0.4614
 epoch: 2, train_loss: 1.0629, test_loss: 1.0158, test_f1: 0.4442
 epoch: 3, train_loss: 1.0444, test_loss: 1.0112, test_f1: 0.4951
 epoch: 4, train_loss: 1.0114, test_loss: 0.9727, test_f1: 0.4946
 epoch: 5, train_loss: 0.9982, test_loss: 0.9518, test_f1: 0.5153
 epoch: 6, train_loss: 0.9798, test_loss: 1.0163, test_f1: 0.4785
 epoch: 7, train_loss: 0.9492, test_loss: 1.0303, test_f1: 0.4594
 epoch: 8, train_loss: 0.9621, test_loss: 1.0032, test_f1: 0.4939
 epoch: 9, train_loss: 0.9231, test_loss: 0.9841, test_f1: 0.5350
 epoch: 10, train_loss: 0.9192, test_loss: 0.9425, test_f1: 0.5000
 epoch: 11, train_loss: 0.8954, test_loss: 1.0483, test_f1: 0.4954
 epoch: 12, train_loss: 0.8820, test_loss: 0.9525, test_f1: 0.5119
 epoch: 13, train_loss: 0.8636, test_loss: 1.0278, test_f1: 0.5052
 epoch: 14, train_loss: 0.8451, test_loss: 1.0941, test_f1: 0.4884
 epoch: 15, train_loss: 0.8457, test_loss: 0.9879, test_f1: 0.5280
 epoch: 16, train_loss: 0.8467, test_loss: 1.0220, test_f1: 0.5307
 epoch: 17, train_loss: 0.8887, test_loss: 1.0549, test_f1: 0.5275
 epoch: 18, train_loss: 0.8592, test_loss: 1.0360, test_f1: 0.5310
 epoch: 19, train_loss: 0.8245, test_loss: 0.9873, test_f1: 0.5445
 epoch: 20, train_loss: 0.8320, test_loss: 0.9901, test_f1: 0.5437
 epoch: 21, train_loss: 0.7995, test_loss: 0.9867, test_f1: 0.5267
 epoch: 22, train_loss: 0.7795, test_loss: 1.0397, test_f1: 0.5159
 epoch: 23, train_loss: 0.7961, test_loss: 0.9827, test_f1: 0.5211
 epoch: 24, train_loss: 0.7883, test_loss: 1.0942, test_f1: 0.5019
 epoch: 25, train_loss: 0.7788, test_loss: 0.9951, test_f1: 0.5327
 epoch: 26, train_loss: 0.7572, test_loss: 1.0027, test_f1: 0.5321
 epoch: 27, train_loss: 0.7698, test_loss: 1.0845, test_f1: 0.5385
 epoch: 28, train_loss: 0.7415, test_loss: 1.0395, test_f1: 0.5469
 epoch: 29, train_loss: 0.7487, test_loss: 1.0498, test_f1: 0.5406
 epoch: 30, train_loss: 0.7343, test_loss: 1.0511, test_f1: 0.5216
 epoch: 31, train_loss: 0.7333, test_loss: 1.0984, test_f1: 0.5317
 epoch: 32, train_loss: 0.7258, test_loss: 1.0025, test_f1: 0.5524
 epoch: 33, train_loss: 0.7156, test_loss: 1.0269, test_f1: 0.5397
 epoch: 34, train_loss: 0.7364, test_loss: 1.0873, test_f1: 0.5327
 epoch: 35, train_loss: 0.7064, test_loss: 1.0779, test_f1: 0.5235
 epoch: 36, train_loss: 0.6983, test_loss: 1.0969, test_f1: 0.5477
 epoch: 37, train_loss: 0.6962, test_loss: 1.0643, test_f1: 0.5377
 epoch: 38, train_loss: 0.6882, test_loss: 1.0482, test_f1: 0.5627
 epoch: 39, train_loss: 0.6781, test_loss: 1.1063, test_f1: 0.5176
 epoch: 40, train_loss: 0.6942, test_loss: 1.0437, test_f1: 0.5582
 epoch: 41, train_loss: 0.6760, test_loss: 1.0955, test_f1: 0.5498
 epoch: 42, train_loss: 0.7073, test_loss: 1.0367, test_f1: 0.5375
 epoch: 43, train_loss: 0.6820, test_loss: 1.0622, test_f1: 0.5299
 epoch: 44, train_loss: 0.6661, test_loss: 1.1490, test_f1: 0.5197
 epoch: 45, train_loss: 0.6615, test_loss: 1.1139, test_f1: 0.5536
 epoch: 46, train_loss: 0.6566, test_loss: 1.0653, test_f1: 0.5481
 epoch: 47, train_loss: 0.6465, test_loss: 1.0933, test_f1: 0.5748
 epoch: 48, train_loss: 0.6256, test_loss: 1.1566, test_f1: 0.5557
 epoch: 49, train_loss: 0.6178, test_loss: 1.0374, test_f1: 0.5641
 epoch: 50, train_loss: 0.6128, test_loss: 1.2410, test_f1: 0.5690
 epoch: 51, train_loss: 0.6108, test_loss: 1.1224, test_f1: 0.5831
 epoch: 52, train_loss: 0.5539, test_loss: 1.1863, test_f1: 0.5438
 epoch: 53, train_loss: 0.5430, test_loss: 1.2389, test_f1: 0.5644
 epoch: 54, train_loss: 0.5318, test_loss: 1.2630, test_f1: 0.5563
 epoch: 55, train_loss: 0.5363, test_loss: 1.2505, test_f1: 0.5645
 epoch: 56, train_loss: 0.5214, test_loss: 1.2560, test_f1: 0.5656
 epoch: 57, train_loss: 0.5281, test_loss: 1.2397, test_f1: 0.5748
 epoch: 58, train_loss: 0.5092, test_loss: 1.2693, test_f1: 0.5459
 epoch: 59, train_loss: 0.5054, test_loss: 1.2503, test_f1: 0.5383
 epoch: 60, train_loss: 0.5216, test_loss: 1.2699, test_f1: 0.5500
 epoch: 61, train_loss: 0.5083, test_loss: 1.3199, test_f1: 0.5983
 epoch: 62, train_loss: 0.5087, test_loss: 1.2666, test_f1: 0.5646
 epoch: 63, train_loss: 0.5052, test_loss: 1.2895, test_f1: 0.5651
 epoch: 64, train_loss: 0.4944, test_loss: 1.2796, test_f1: 0.5547
 epoch: 65, train_loss: 0.4958, test_loss: 1.2948, test_f1: 0.5698
 epoch: 66, train_loss: 0.4981, test_loss: 1.2679, test_f1: 0.5619
 epoch: 67, train_loss: 0.4919, test_loss: 1.2781, test_f1: 0.5780
 epoch: 68, train_loss: 0.4764, test_loss: 1.3224, test_f1: 0.5572
 epoch: 69, train_loss: 0.5114, test_loss: 1.3041, test_f1: 0.5968
 epoch: 70, train_loss: 0.4834, test_loss: 1.3258, test_f1: 0.5686
 epoch: 71, train_loss: 0.4768, test_loss: 1.3994, test_f1: 0.5567
 epoch: 72, train_loss: 0.4838, test_loss: 1.4130, test_f1: 0.5718
 epoch: 73, train_loss: 0.4759, test_loss: 1.3103, test_f1: 0.5665
 epoch: 74, train_loss: 0.4573, test_loss: 1.3526, test_f1: 0.5813
 epoch: 75, train_loss: 0.4457, test_loss: 1.3402, test_f1: 0.5936
 epoch: 76, train_loss: 0.4348, test_loss: 1.3973, test_f1: 0.5927
 epoch: 77, train_loss: 0.4381, test_loss: 1.3638, test_f1: 0.5664
 epoch: 78, train_loss: 0.4836, test_loss: 1.3928, test_f1: 0.5848
 epoch: 79, train_loss: 0.4394, test_loss: 1.3558, test_f1: 0.5806
 epoch: 80, train_loss: 0.4247, test_loss: 1.4186, test_f1: 0.5793
 epoch: 81, train_loss: 0.4243, test_loss: 1.4463, test_f1: 0.5709
 epoch: 82, train_loss: 0.4312, test_loss: 1.4610, test_f1: 0.5767
 epoch: 83, train_loss: 0.4234, test_loss: 1.3946, test_f1: 0.5720
 epoch: 84, train_loss: 0.4188, test_loss: 1.4634, test_f1: 0.5600
 epoch: 85, train_loss: 0.4070, test_loss: 1.4149, test_f1: 0.5906
 epoch: 86, train_loss: 0.4065, test_loss: 1.5072, test_f1: 0.5499
 epoch: 87, train_loss: 0.4097, test_loss: 1.4587, test_f1: 0.5584
 epoch: 88, train_loss: 0.4115, test_loss: 1.5701, test_f1: 0.5590
 epoch: 89, train_loss: 0.4268, test_loss: 1.4359, test_f1: 0.5678
 epoch: 90, train_loss: 0.4036, test_loss: 1.3918, test_f1: 0.5889
 epoch: 91, train_loss: 0.4104, test_loss: 1.5445, test_f1: 0.5443
 epoch: 92, train_loss: 0.3788, test_loss: 1.4474, test_f1: 0.5486
 epoch: 93, train_loss: 0.4056, test_loss: 1.4224, test_f1: 0.5726
 epoch: 94, train_loss: 0.3913, test_loss: 1.4651, test_f1: 0.5773
 epoch: 95, train_loss: 0.3865, test_loss: 1.5256, test_f1: 0.5761
 epoch: 96, train_loss: 0.3695, test_loss: 1.5626, test_f1: 0.5948
 epoch: 97, train_loss: 0.3740, test_loss: 1.5042, test_f1: 0.5984
 epoch: 98, train_loss: 0.3838, test_loss: 1.4764, test_f1: 0.5786
 epoch: 99, train_loss: 0.3826, test_loss: 1.5899, test_f1: 0.5633
##################ITERATION #6 ****************************************
 epoch: 0, train_loss: 1.2850, test_loss: 1.0833, test_f1: 0.4825
 epoch: 1, train_loss: 1.1249, test_loss: 1.0558, test_f1: 0.4134
 epoch: 2, train_loss: 1.0746, test_loss: 0.9881, test_f1: 0.4757
 epoch: 3, train_loss: 1.0440, test_loss: 0.9945, test_f1: 0.4701
 epoch: 4, train_loss: 1.0298, test_loss: 1.0463, test_f1: 0.4672
 epoch: 5, train_loss: 1.0170, test_loss: 1.0291, test_f1: 0.4629
 epoch: 6, train_loss: 0.9915, test_loss: 0.9714, test_f1: 0.4845
 epoch: 7, train_loss: 0.9608, test_loss: 0.9338, test_f1: 0.5259
 epoch: 8, train_loss: 0.9472, test_loss: 1.0560, test_f1: 0.4973
 epoch: 9, train_loss: 0.9230, test_loss: 0.9836, test_f1: 0.5241
 epoch: 10, train_loss: 0.9437, test_loss: 0.9820, test_f1: 0.5053
 epoch: 11, train_loss: 0.9318, test_loss: 0.9547, test_f1: 0.5460
 epoch: 12, train_loss: 0.9020, test_loss: 0.9386, test_f1: 0.5259
 epoch: 13, train_loss: 0.8876, test_loss: 0.9943, test_f1: 0.5572
 epoch: 14, train_loss: 0.8879, test_loss: 0.9635, test_f1: 0.5557
 epoch: 15, train_loss: 0.8542, test_loss: 0.9265, test_f1: 0.5252
 epoch: 16, train_loss: 0.8709, test_loss: 0.9303, test_f1: 0.5596
 epoch: 17, train_loss: 0.8438, test_loss: 1.0226, test_f1: 0.4979
 epoch: 18, train_loss: 0.8552, test_loss: 0.8807, test_f1: 0.5553
 epoch: 19, train_loss: 0.8655, test_loss: 0.9727, test_f1: 0.5343
 epoch: 20, train_loss: 0.8183, test_loss: 0.9929, test_f1: 0.5455
 epoch: 21, train_loss: 0.8117, test_loss: 1.0073, test_f1: 0.5399
 epoch: 22, train_loss: 0.8125, test_loss: 1.0080, test_f1: 0.5533
 epoch: 23, train_loss: 0.7973, test_loss: 1.0624, test_f1: 0.5321
 epoch: 24, train_loss: 0.7959, test_loss: 1.0630, test_f1: 0.5408
 epoch: 25, train_loss: 0.7864, test_loss: 1.0672, test_f1: 0.5095
 epoch: 26, train_loss: 0.7746, test_loss: 0.9900, test_f1: 0.5648
 epoch: 27, train_loss: 0.7637, test_loss: 0.9940, test_f1: 0.5332
 epoch: 28, train_loss: 0.7803, test_loss: 1.0887, test_f1: 0.5247
 epoch: 29, train_loss: 0.7707, test_loss: 1.0164, test_f1: 0.5546
 epoch: 30, train_loss: 0.7414, test_loss: 1.1788, test_f1: 0.5099
 epoch: 31, train_loss: 0.7515, test_loss: 0.9900, test_f1: 0.5659
 epoch: 32, train_loss: 0.7231, test_loss: 1.0521, test_f1: 0.5310
 epoch: 33, train_loss: 0.7259, test_loss: 1.0902, test_f1: 0.5229
 epoch: 34, train_loss: 0.7417, test_loss: 1.0699, test_f1: 0.5208
 epoch: 35, train_loss: 0.7067, test_loss: 1.0755, test_f1: 0.5487
 epoch: 36, train_loss: 0.6907, test_loss: 1.1593, test_f1: 0.5277
 epoch: 37, train_loss: 0.6944, test_loss: 1.0708, test_f1: 0.5500
 epoch: 38, train_loss: 0.7427, test_loss: 1.1212, test_f1: 0.5403
 epoch: 39, train_loss: 0.7103, test_loss: 1.1344, test_f1: 0.5322
 epoch: 40, train_loss: 0.7003, test_loss: 1.0474, test_f1: 0.5501
 epoch: 41, train_loss: 0.6847, test_loss: 1.0439, test_f1: 0.5349
 epoch: 42, train_loss: 0.6861, test_loss: 1.0288, test_f1: 0.5667
 epoch: 43, train_loss: 0.6637, test_loss: 1.1069, test_f1: 0.5503
 epoch: 44, train_loss: 0.6660, test_loss: 1.1474, test_f1: 0.5508
 epoch: 45, train_loss: 0.6741, test_loss: 1.0696, test_f1: 0.5293
 epoch: 46, train_loss: 0.6995, test_loss: 1.0408, test_f1: 0.5383
 epoch: 47, train_loss: 0.6645, test_loss: 1.2038, test_f1: 0.5175
 epoch: 48, train_loss: 0.6560, test_loss: 1.1308, test_f1: 0.5525
 epoch: 49, train_loss: 0.6500, test_loss: 1.1785, test_f1: 0.5486
 epoch: 50, train_loss: 0.6309, test_loss: 1.1732, test_f1: 0.5320
 epoch: 51, train_loss: 0.5952, test_loss: 1.2133, test_f1: 0.5421
 epoch: 52, train_loss: 0.5752, test_loss: 1.1823, test_f1: 0.5660
 epoch: 53, train_loss: 0.5571, test_loss: 1.2494, test_f1: 0.5372
 epoch: 54, train_loss: 0.5957, test_loss: 1.1964, test_f1: 0.5874
 epoch: 55, train_loss: 0.5437, test_loss: 1.2185, test_f1: 0.5623
 epoch: 56, train_loss: 0.5593, test_loss: 1.2081, test_f1: 0.5728
 epoch: 57, train_loss: 0.5420, test_loss: 1.3529, test_f1: 0.5650
 epoch: 58, train_loss: 0.5401, test_loss: 1.4099, test_f1: 0.5512
 epoch: 59, train_loss: 0.5353, test_loss: 1.2637, test_f1: 0.5803
 epoch: 60, train_loss: 0.5162, test_loss: 1.2628, test_f1: 0.5597
 epoch: 61, train_loss: 0.5253, test_loss: 1.3236, test_f1: 0.5763
 epoch: 62, train_loss: 0.5104, test_loss: 1.3357, test_f1: 0.5659
 epoch: 63, train_loss: 0.5134, test_loss: 1.3479, test_f1: 0.5841
 epoch: 64, train_loss: 0.5402, test_loss: 1.3740, test_f1: 0.5823
 epoch: 65, train_loss: 0.5215, test_loss: 1.2569, test_f1: 0.5654
 epoch: 66, train_loss: 0.4965, test_loss: 1.2654, test_f1: 0.5622
 epoch: 67, train_loss: 0.4799, test_loss: 1.2701, test_f1: 0.5636
 epoch: 68, train_loss: 0.5089, test_loss: 1.2884, test_f1: 0.5875
 epoch: 69, train_loss: 0.5188, test_loss: 1.2242, test_f1: 0.5601
 epoch: 70, train_loss: 0.4714, test_loss: 1.4778, test_f1: 0.5517
 epoch: 71, train_loss: 0.5007, test_loss: 1.4136, test_f1: 0.5580
 epoch: 72, train_loss: 0.5000, test_loss: 1.1906, test_f1: 0.6030
 epoch: 73, train_loss: 0.4603, test_loss: 1.3022, test_f1: 0.5871
 epoch: 74, train_loss: 0.4674, test_loss: 1.3154, test_f1: 0.5813
 epoch: 75, train_loss: 0.4543, test_loss: 1.3516, test_f1: 0.5635
 epoch: 76, train_loss: 0.4445, test_loss: 1.3590, test_f1: 0.5959
 epoch: 77, train_loss: 0.4568, test_loss: 1.2902, test_f1: 0.6103
 epoch: 78, train_loss: 0.4640, test_loss: 1.3960, test_f1: 0.5885
 epoch: 79, train_loss: 0.4786, test_loss: 1.3747, test_f1: 0.5833
 epoch: 80, train_loss: 0.4476, test_loss: 1.3404, test_f1: 0.5678
 epoch: 81, train_loss: 0.4308, test_loss: 1.3993, test_f1: 0.5791
 epoch: 82, train_loss: 0.4353, test_loss: 1.3934, test_f1: 0.5458
 epoch: 83, train_loss: 0.4655, test_loss: 1.4233, test_f1: 0.5346
 epoch: 84, train_loss: 0.4333, test_loss: 1.4540, test_f1: 0.5769
 epoch: 85, train_loss: 0.4218, test_loss: 1.4589, test_f1: 0.5649
 epoch: 86, train_loss: 0.4369, test_loss: 1.3664, test_f1: 0.5622
 epoch: 87, train_loss: 0.4192, test_loss: 1.3504, test_f1: 0.5983
 epoch: 88, train_loss: 0.4244, test_loss: 1.5290, test_f1: 0.5464
 epoch: 89, train_loss: 0.4025, test_loss: 1.4650, test_f1: 0.5861
 epoch: 90, train_loss: 0.4390, test_loss: 1.4413, test_f1: 0.5587
 epoch: 91, train_loss: 0.3962, test_loss: 1.5188, test_f1: 0.5627
 epoch: 92, train_loss: 0.4236, test_loss: 1.3754, test_f1: 0.6072
 epoch: 93, train_loss: 0.4034, test_loss: 1.4967, test_f1: 0.5859
 epoch: 94, train_loss: 0.4158, test_loss: 1.4514, test_f1: 0.5895
 epoch: 95, train_loss: 0.4309, test_loss: 1.4976, test_f1: 0.5664
 epoch: 96, train_loss: 0.4180, test_loss: 1.4937, test_f1: 0.5738
 epoch: 97, train_loss: 0.4170, test_loss: 1.4996, test_f1: 0.5653
 epoch: 98, train_loss: 0.4546, test_loss: 1.2871, test_f1: 0.5848
 epoch: 99, train_loss: 0.3930, test_loss: 1.5390, test_f1: 0.5413
##################ITERATION #7 ****************************************
 epoch: 0, train_loss: 1.3124, test_loss: 1.1772, test_f1: 0.3656
 epoch: 1, train_loss: 1.1601, test_loss: 1.0778, test_f1: 0.3994
 epoch: 2, train_loss: 1.1168, test_loss: 1.0679, test_f1: 0.4204
 epoch: 3, train_loss: 1.0753, test_loss: 1.0413, test_f1: 0.4361
 epoch: 4, train_loss: 1.0423, test_loss: 0.9926, test_f1: 0.4564
 epoch: 5, train_loss: 1.0113, test_loss: 1.0197, test_f1: 0.4528
 epoch: 6, train_loss: 0.9952, test_loss: 0.9946, test_f1: 0.4753
 epoch: 7, train_loss: 0.9689, test_loss: 0.9913, test_f1: 0.4797
 epoch: 8, train_loss: 0.9594, test_loss: 0.9541, test_f1: 0.4514
 epoch: 9, train_loss: 0.9521, test_loss: 1.1464, test_f1: 0.4278
 epoch: 10, train_loss: 0.9210, test_loss: 0.9624, test_f1: 0.5097
 epoch: 11, train_loss: 0.9074, test_loss: 0.9456, test_f1: 0.5213
 epoch: 12, train_loss: 0.8911, test_loss: 1.0059, test_f1: 0.5000
 epoch: 13, train_loss: 0.8856, test_loss: 1.0155, test_f1: 0.5224
 epoch: 14, train_loss: 0.8865, test_loss: 1.0459, test_f1: 0.5667
 epoch: 15, train_loss: 0.8560, test_loss: 0.9639, test_f1: 0.5399
 epoch: 16, train_loss: 0.8391, test_loss: 0.9978, test_f1: 0.5520
 epoch: 17, train_loss: 0.8595, test_loss: 1.0181, test_f1: 0.5143
 epoch: 18, train_loss: 0.8426, test_loss: 1.0607, test_f1: 0.5455
 epoch: 19, train_loss: 0.8226, test_loss: 0.9528, test_f1: 0.5585
 epoch: 20, train_loss: 0.8047, test_loss: 1.0509, test_f1: 0.5459
 epoch: 21, train_loss: 0.8205, test_loss: 1.0575, test_f1: 0.5712
 epoch: 22, train_loss: 0.7937, test_loss: 1.0475, test_f1: 0.5322
 epoch: 23, train_loss: 0.7984, test_loss: 1.0631, test_f1: 0.5427
 epoch: 24, train_loss: 0.8004, test_loss: 1.1076, test_f1: 0.5286
 epoch: 25, train_loss: 0.7925, test_loss: 1.1340, test_f1: 0.5485
 epoch: 26, train_loss: 0.7517, test_loss: 1.2308, test_f1: 0.5587
 epoch: 27, train_loss: 0.7430, test_loss: 1.1216, test_f1: 0.5467
 epoch: 28, train_loss: 0.7510, test_loss: 1.0633, test_f1: 0.5581
 epoch: 29, train_loss: 0.7338, test_loss: 1.0953, test_f1: 0.5462
 epoch: 30, train_loss: 0.7318, test_loss: 1.1276, test_f1: 0.5565
 epoch: 31, train_loss: 0.7287, test_loss: 1.1297, test_f1: 0.5439
 epoch: 32, train_loss: 0.7354, test_loss: 1.1854, test_f1: 0.5088
 epoch: 33, train_loss: 0.7895, test_loss: 1.0605, test_f1: 0.5465
 epoch: 34, train_loss: 0.7462, test_loss: 1.1264, test_f1: 0.5266
 epoch: 35, train_loss: 0.7223, test_loss: 1.0730, test_f1: 0.5419
 epoch: 36, train_loss: 0.7017, test_loss: 1.1237, test_f1: 0.5495
 epoch: 37, train_loss: 0.7050, test_loss: 1.1589, test_f1: 0.5336
 epoch: 38, train_loss: 0.6944, test_loss: 1.1030, test_f1: 0.5632
 epoch: 39, train_loss: 0.6654, test_loss: 1.1641, test_f1: 0.5980
 epoch: 40, train_loss: 0.7359, test_loss: 1.2288, test_f1: 0.5380
 epoch: 41, train_loss: 0.7029, test_loss: 1.1700, test_f1: 0.5567
 epoch: 42, train_loss: 0.6999, test_loss: 1.0986, test_f1: 0.5493
 epoch: 43, train_loss: 0.6708, test_loss: 1.1619, test_f1: 0.5608
 epoch: 44, train_loss: 0.6572, test_loss: 1.2336, test_f1: 0.5368
 epoch: 45, train_loss: 0.6509, test_loss: 1.2204, test_f1: 0.5136
 epoch: 46, train_loss: 0.7541, test_loss: 1.0490, test_f1: 0.5617
 epoch: 47, train_loss: 0.6881, test_loss: 1.1136, test_f1: 0.5642
 epoch: 48, train_loss: 0.6646, test_loss: 1.1707, test_f1: 0.5450
 epoch: 49, train_loss: 0.6857, test_loss: 1.1098, test_f1: 0.5727
 epoch: 50, train_loss: 0.6602, test_loss: 1.1612, test_f1: 0.5663
 epoch: 51, train_loss: 0.6200, test_loss: 1.1487, test_f1: 0.5384
 epoch: 52, train_loss: 0.5787, test_loss: 1.1890, test_f1: 0.5675
 epoch: 53, train_loss: 0.5854, test_loss: 1.2034, test_f1: 0.5541
 epoch: 54, train_loss: 0.5870, test_loss: 1.2263, test_f1: 0.5511
 epoch: 55, train_loss: 0.5874, test_loss: 1.1843, test_f1: 0.5731
 epoch: 56, train_loss: 0.5793, test_loss: 1.2292, test_f1: 0.5924
 epoch: 57, train_loss: 0.5605, test_loss: 1.2503, test_f1: 0.5762
 epoch: 58, train_loss: 0.5554, test_loss: 1.3145, test_f1: 0.5702
 epoch: 59, train_loss: 0.5444, test_loss: 1.3337, test_f1: 0.5562
 epoch: 60, train_loss: 0.5300, test_loss: 1.3264, test_f1: 0.5624
 epoch: 61, train_loss: 0.5410, test_loss: 1.2309, test_f1: 0.5749
 epoch: 62, train_loss: 0.5364, test_loss: 1.2860, test_f1: 0.5842
 epoch: 63, train_loss: 0.5330, test_loss: 1.2739, test_f1: 0.5526
 epoch: 64, train_loss: 0.5311, test_loss: 1.3230, test_f1: 0.5702
 epoch: 65, train_loss: 0.5465, test_loss: 1.2306, test_f1: 0.5679
 epoch: 66, train_loss: 0.5252, test_loss: 1.2750, test_f1: 0.5846
 epoch: 67, train_loss: 0.5191, test_loss: 1.2577, test_f1: 0.5580
 epoch: 68, train_loss: 0.4901, test_loss: 1.3304, test_f1: 0.5608
 epoch: 69, train_loss: 0.5076, test_loss: 1.2958, test_f1: 0.5541
 epoch: 70, train_loss: 0.5285, test_loss: 1.3893, test_f1: 0.5747
 epoch: 71, train_loss: 0.4999, test_loss: 1.3201, test_f1: 0.5666
 epoch: 72, train_loss: 0.5009, test_loss: 1.3320, test_f1: 0.5672
 epoch: 73, train_loss: 0.4921, test_loss: 1.3922, test_f1: 0.5434
 epoch: 74, train_loss: 0.4973, test_loss: 1.4545, test_f1: 0.5526
 epoch: 75, train_loss: 0.4661, test_loss: 1.4814, test_f1: 0.5501
 epoch: 76, train_loss: 0.5060, test_loss: 1.4536, test_f1: 0.5665
 epoch: 77, train_loss: 0.5029, test_loss: 1.3495, test_f1: 0.5639
 epoch: 78, train_loss: 0.4722, test_loss: 1.3978, test_f1: 0.5750
 epoch: 79, train_loss: 0.4773, test_loss: 1.3582, test_f1: 0.5761
 epoch: 80, train_loss: 0.4765, test_loss: 1.4389, test_f1: 0.5438
 epoch: 81, train_loss: 0.4574, test_loss: 1.3626, test_f1: 0.5695
 epoch: 82, train_loss: 0.5133, test_loss: 1.3686, test_f1: 0.5850
 epoch: 83, train_loss: 0.4541, test_loss: 1.4267, test_f1: 0.5821
 epoch: 84, train_loss: 0.4718, test_loss: 1.4214, test_f1: 0.5471
 epoch: 85, train_loss: 0.4491, test_loss: 1.3173, test_f1: 0.5629
 epoch: 86, train_loss: 0.4411, test_loss: 1.3983, test_f1: 0.5563
 epoch: 87, train_loss: 0.4583, test_loss: 1.3719, test_f1: 0.5530
 epoch: 88, train_loss: 0.4472, test_loss: 1.4071, test_f1: 0.5769
 epoch: 89, train_loss: 0.4224, test_loss: 1.3851, test_f1: 0.5679
 epoch: 90, train_loss: 0.4265, test_loss: 1.4267, test_f1: 0.5499
 epoch: 91, train_loss: 0.4449, test_loss: 1.3515, test_f1: 0.5662
 epoch: 92, train_loss: 0.4302, test_loss: 1.4639, test_f1: 0.5592
 epoch: 93, train_loss: 0.4263, test_loss: 1.4348, test_f1: 0.5598
 epoch: 94, train_loss: 0.4114, test_loss: 1.3997, test_f1: 0.5930
 epoch: 95, train_loss: 0.4188, test_loss: 1.4874, test_f1: 0.5758
 epoch: 96, train_loss: 0.4142, test_loss: 1.4706, test_f1: 0.5952
 epoch: 97, train_loss: 0.4273, test_loss: 1.4015, test_f1: 0.5771
 epoch: 98, train_loss: 0.4111, test_loss: 1.3683, test_f1: 0.5834
 epoch: 99, train_loss: 0.3864, test_loss: 1.4068, test_f1: 0.5912
##################ITERATION #8 ****************************************
 epoch: 0, train_loss: 1.2998, test_loss: 1.1403, test_f1: 0.4119
 epoch: 1, train_loss: 1.1284, test_loss: 1.0857, test_f1: 0.4179
 epoch: 2, train_loss: 1.0953, test_loss: 1.0151, test_f1: 0.4547
 epoch: 3, train_loss: 1.0516, test_loss: 0.9889, test_f1: 0.4359
 epoch: 4, train_loss: 1.0397, test_loss: 0.9386, test_f1: 0.5228
 epoch: 5, train_loss: 1.0152, test_loss: 0.9767, test_f1: 0.4662
 epoch: 6, train_loss: 0.9974, test_loss: 1.0636, test_f1: 0.4381
 epoch: 7, train_loss: 0.9769, test_loss: 0.9797, test_f1: 0.4986
 epoch: 8, train_loss: 0.9432, test_loss: 0.9574, test_f1: 0.4972
 epoch: 9, train_loss: 0.9462, test_loss: 0.9819, test_f1: 0.4825
 epoch: 10, train_loss: 0.9194, test_loss: 0.9883, test_f1: 0.5186
 epoch: 11, train_loss: 0.9215, test_loss: 0.9248, test_f1: 0.4861
 epoch: 12, train_loss: 0.9225, test_loss: 0.9351, test_f1: 0.4903
 epoch: 13, train_loss: 0.9231, test_loss: 0.9621, test_f1: 0.4948
 epoch: 14, train_loss: 0.8873, test_loss: 0.9367, test_f1: 0.5550
 epoch: 15, train_loss: 0.8841, test_loss: 1.0039, test_f1: 0.5227
 epoch: 16, train_loss: 0.8722, test_loss: 0.9723, test_f1: 0.5195
 epoch: 17, train_loss: 0.8541, test_loss: 1.0199, test_f1: 0.5247
 epoch: 18, train_loss: 0.8661, test_loss: 0.9815, test_f1: 0.5235
 epoch: 19, train_loss: 0.8421, test_loss: 0.9711, test_f1: 0.5735
 epoch: 20, train_loss: 0.8300, test_loss: 0.9290, test_f1: 0.5386
 epoch: 21, train_loss: 0.8297, test_loss: 0.9827, test_f1: 0.5435
 epoch: 22, train_loss: 0.8074, test_loss: 1.0004, test_f1: 0.5454
 epoch: 23, train_loss: 0.7990, test_loss: 0.9613, test_f1: 0.5478
 epoch: 24, train_loss: 0.7868, test_loss: 1.0156, test_f1: 0.5541
 epoch: 25, train_loss: 0.7840, test_loss: 1.0489, test_f1: 0.5532
 epoch: 26, train_loss: 0.7762, test_loss: 1.0621, test_f1: 0.5560
 epoch: 27, train_loss: 0.7699, test_loss: 1.0835, test_f1: 0.5503
 epoch: 28, train_loss: 0.8291, test_loss: 1.0808, test_f1: 0.5532
 epoch: 29, train_loss: 0.7625, test_loss: 1.0417, test_f1: 0.5375
 epoch: 30, train_loss: 0.7529, test_loss: 1.0205, test_f1: 0.5379
 epoch: 31, train_loss: 0.7489, test_loss: 1.0181, test_f1: 0.5610
 epoch: 32, train_loss: 0.7462, test_loss: 1.0168, test_f1: 0.5669
 epoch: 33, train_loss: 0.7381, test_loss: 1.0421, test_f1: 0.5715
 epoch: 34, train_loss: 0.7156, test_loss: 1.0023, test_f1: 0.5502
 epoch: 35, train_loss: 0.7143, test_loss: 0.9768, test_f1: 0.5566
 epoch: 36, train_loss: 0.6937, test_loss: 1.0469, test_f1: 0.5682
 epoch: 37, train_loss: 0.7115, test_loss: 1.1097, test_f1: 0.5397
 epoch: 38, train_loss: 0.6974, test_loss: 1.0832, test_f1: 0.5569
 epoch: 39, train_loss: 0.6989, test_loss: 0.9981, test_f1: 0.5619
 epoch: 40, train_loss: 0.7052, test_loss: 1.1231, test_f1: 0.5244
 epoch: 41, train_loss: 0.6780, test_loss: 1.1331, test_f1: 0.5530
 epoch: 42, train_loss: 0.6814, test_loss: 1.0282, test_f1: 0.5403
 epoch: 43, train_loss: 0.6747, test_loss: 1.1070, test_f1: 0.5485
 epoch: 44, train_loss: 0.6580, test_loss: 1.2767, test_f1: 0.4773
 epoch: 45, train_loss: 0.6768, test_loss: 1.0353, test_f1: 0.5704
 epoch: 46, train_loss: 0.6255, test_loss: 1.1181, test_f1: 0.5515
 epoch: 47, train_loss: 0.6669, test_loss: 1.0715, test_f1: 0.5281
 epoch: 48, train_loss: 0.6482, test_loss: 1.1713, test_f1: 0.5331
 epoch: 49, train_loss: 0.6728, test_loss: 1.2596, test_f1: 0.5175
 epoch: 50, train_loss: 0.6212, test_loss: 1.1369, test_f1: 0.5718
 epoch: 51, train_loss: 0.5922, test_loss: 1.1234, test_f1: 0.5437
 epoch: 52, train_loss: 0.5481, test_loss: 1.2391, test_f1: 0.5458
 epoch: 53, train_loss: 0.5697, test_loss: 1.2104, test_f1: 0.5603
 epoch: 54, train_loss: 0.5581, test_loss: 1.1661, test_f1: 0.5677
 epoch: 55, train_loss: 0.5582, test_loss: 1.2598, test_f1: 0.5646
 epoch: 56, train_loss: 0.5569, test_loss: 1.2220, test_f1: 0.5303
 epoch: 57, train_loss: 0.5328, test_loss: 1.3162, test_f1: 0.5622
 epoch: 58, train_loss: 0.5481, test_loss: 1.3142, test_f1: 0.5232
 epoch: 59, train_loss: 0.5501, test_loss: 1.2438, test_f1: 0.5437
 epoch: 60, train_loss: 0.5272, test_loss: 1.2161, test_f1: 0.5519
 epoch: 61, train_loss: 0.5471, test_loss: 1.2507, test_f1: 0.5617
 epoch: 62, train_loss: 0.5412, test_loss: 1.2758, test_f1: 0.5551
 epoch: 63, train_loss: 0.5389, test_loss: 1.3172, test_f1: 0.5631
 epoch: 64, train_loss: 0.5123, test_loss: 1.2070, test_f1: 0.5771
 epoch: 65, train_loss: 0.4991, test_loss: 1.2996, test_f1: 0.5675
 epoch: 66, train_loss: 0.5035, test_loss: 1.2618, test_f1: 0.5654
 epoch: 67, train_loss: 0.4961, test_loss: 1.2765, test_f1: 0.5614
 epoch: 68, train_loss: 0.5060, test_loss: 1.2961, test_f1: 0.5609
 epoch: 69, train_loss: 0.4910, test_loss: 1.2682, test_f1: 0.5682
 epoch: 70, train_loss: 0.5051, test_loss: 1.2979, test_f1: 0.5718
 epoch: 71, train_loss: 0.4958, test_loss: 1.3400, test_f1: 0.5692
 epoch: 72, train_loss: 0.4910, test_loss: 1.3777, test_f1: 0.5667
 epoch: 73, train_loss: 0.4845, test_loss: 1.3362, test_f1: 0.5563
 epoch: 74, train_loss: 0.4886, test_loss: 1.3449, test_f1: 0.5463
 epoch: 75, train_loss: 0.4858, test_loss: 1.2917, test_f1: 0.5587
 epoch: 76, train_loss: 0.4837, test_loss: 1.3438, test_f1: 0.5652
 epoch: 77, train_loss: 0.4720, test_loss: 1.3134, test_f1: 0.5854
 epoch: 78, train_loss: 0.4833, test_loss: 1.3452, test_f1: 0.5736
 epoch: 79, train_loss: 0.4661, test_loss: 1.3664, test_f1: 0.5691
 epoch: 80, train_loss: 0.4774, test_loss: 1.4690, test_f1: 0.5502
 epoch: 81, train_loss: 0.4746, test_loss: 1.4357, test_f1: 0.5559
 epoch: 82, train_loss: 0.4495, test_loss: 1.3531, test_f1: 0.5713
 epoch: 83, train_loss: 0.4407, test_loss: 1.4444, test_f1: 0.5822
 epoch: 84, train_loss: 0.4287, test_loss: 1.3901, test_f1: 0.5815
 epoch: 85, train_loss: 0.4269, test_loss: 1.4273, test_f1: 0.5955
 epoch: 86, train_loss: 0.4348, test_loss: 1.4077, test_f1: 0.5784
 epoch: 87, train_loss: 0.4495, test_loss: 1.3624, test_f1: 0.5926
 epoch: 88, train_loss: 0.4385, test_loss: 1.3856, test_f1: 0.5936
 epoch: 89, train_loss: 0.4397, test_loss: 1.3753, test_f1: 0.5794
 epoch: 90, train_loss: 0.4341, test_loss: 1.3851, test_f1: 0.5744
 epoch: 91, train_loss: 0.4185, test_loss: 1.4036, test_f1: 0.5971
 epoch: 92, train_loss: 0.4321, test_loss: 1.4718, test_f1: 0.5861
 epoch: 93, train_loss: 0.4266, test_loss: 1.3289, test_f1: 0.5772
 epoch: 94, train_loss: 0.4045, test_loss: 1.4048, test_f1: 0.5705
 epoch: 95, train_loss: 0.4297, test_loss: 1.3308, test_f1: 0.5942
 epoch: 96, train_loss: 0.3849, test_loss: 1.4636, test_f1: 0.5811
 epoch: 97, train_loss: 0.3986, test_loss: 1.4800, test_f1: 0.5536
 epoch: 98, train_loss: 0.4562, test_loss: 1.4530, test_f1: 0.5790
 epoch: 99, train_loss: 0.4081, test_loss: 1.4232, test_f1: 0.5715
##################ITERATION #9 ****************************************
 epoch: 0, train_loss: 1.2860, test_loss: 1.1309, test_f1: 0.4226
 epoch: 1, train_loss: 1.1001, test_loss: 1.0189, test_f1: 0.4371
 epoch: 2, train_loss: 1.0417, test_loss: 1.0295, test_f1: 0.4332
 epoch: 3, train_loss: 1.0126, test_loss: 0.9585, test_f1: 0.4931
 epoch: 4, train_loss: 0.9974, test_loss: 1.0843, test_f1: 0.4692
 epoch: 5, train_loss: 0.9687, test_loss: 1.0134, test_f1: 0.4901
 epoch: 6, train_loss: 0.9627, test_loss: 1.0983, test_f1: 0.4943
 epoch: 7, train_loss: 0.9261, test_loss: 0.9915, test_f1: 0.5148
 epoch: 8, train_loss: 0.9105, test_loss: 1.0150, test_f1: 0.5392
 epoch: 9, train_loss: 0.9043, test_loss: 0.9715, test_f1: 0.5538
 epoch: 10, train_loss: 0.8821, test_loss: 1.1664, test_f1: 0.4691
 epoch: 11, train_loss: 0.8890, test_loss: 1.0957, test_f1: 0.4886
 epoch: 12, train_loss: 0.8648, test_loss: 1.0850, test_f1: 0.5412
 epoch: 13, train_loss: 0.8480, test_loss: 1.0522, test_f1: 0.5367
 epoch: 14, train_loss: 0.8580, test_loss: 1.1481, test_f1: 0.5322
 epoch: 15, train_loss: 0.8516, test_loss: 1.0594, test_f1: 0.5418
 epoch: 16, train_loss: 0.8208, test_loss: 1.2108, test_f1: 0.5068
 epoch: 17, train_loss: 0.8190, test_loss: 1.1351, test_f1: 0.5381
 epoch: 18, train_loss: 0.8143, test_loss: 1.1732, test_f1: 0.5052
 epoch: 19, train_loss: 0.8045, test_loss: 1.1991, test_f1: 0.5007
 epoch: 20, train_loss: 0.8360, test_loss: 0.9789, test_f1: 0.5151
 epoch: 21, train_loss: 0.7982, test_loss: 1.0509, test_f1: 0.5516
 epoch: 22, train_loss: 0.7958, test_loss: 1.1237, test_f1: 0.5009
 epoch: 23, train_loss: 0.7823, test_loss: 1.1057, test_f1: 0.5408
 epoch: 24, train_loss: 0.7804, test_loss: 1.0063, test_f1: 0.5369
 epoch: 25, train_loss: 0.7742, test_loss: 0.9916, test_f1: 0.5672
 epoch: 26, train_loss: 0.7602, test_loss: 1.0012, test_f1: 0.5517
 epoch: 27, train_loss: 0.7308, test_loss: 1.1165, test_f1: 0.5516
 epoch: 28, train_loss: 0.7411, test_loss: 1.0511, test_f1: 0.5244
 epoch: 29, train_loss: 0.7258, test_loss: 0.9400, test_f1: 0.5248
 epoch: 30, train_loss: 0.7012, test_loss: 1.0508, test_f1: 0.5364
 epoch: 31, train_loss: 0.7104, test_loss: 0.9792, test_f1: 0.5364
 epoch: 32, train_loss: 0.7072, test_loss: 1.1069, test_f1: 0.5360
 epoch: 33, train_loss: 0.6947, test_loss: 1.0424, test_f1: 0.5421
 epoch: 34, train_loss: 0.7375, test_loss: 1.0934, test_f1: 0.5640
 epoch: 35, train_loss: 0.7319, test_loss: 1.0774, test_f1: 0.5585
 epoch: 36, train_loss: 0.6935, test_loss: 1.0326, test_f1: 0.5419
 epoch: 37, train_loss: 0.6879, test_loss: 1.0759, test_f1: 0.5580
 epoch: 38, train_loss: 0.6654, test_loss: 1.0318, test_f1: 0.5348
 epoch: 39, train_loss: 0.6609, test_loss: 1.0166, test_f1: 0.5601
 epoch: 40, train_loss: 0.6690, test_loss: 1.0800, test_f1: 0.5270
 epoch: 41, train_loss: 0.6700, test_loss: 1.0052, test_f1: 0.5462
 epoch: 42, train_loss: 0.6607, test_loss: 1.0627, test_f1: 0.5573
 epoch: 43, train_loss: 0.6461, test_loss: 0.9571, test_f1: 0.5491
 epoch: 44, train_loss: 0.6540, test_loss: 1.1472, test_f1: 0.5246
 epoch: 45, train_loss: 0.6356, test_loss: 1.1381, test_f1: 0.5507
 epoch: 46, train_loss: 0.6268, test_loss: 1.1774, test_f1: 0.5394
 epoch: 47, train_loss: 0.6507, test_loss: 1.0598, test_f1: 0.5996
 epoch: 48, train_loss: 0.6317, test_loss: 1.0763, test_f1: 0.5274
 epoch: 49, train_loss: 0.6050, test_loss: 1.1910, test_f1: 0.5543
 epoch: 50, train_loss: 0.6021, test_loss: 1.1600, test_f1: 0.5426
 epoch: 51, train_loss: 0.5671, test_loss: 1.1332, test_f1: 0.5754
 epoch: 52, train_loss: 0.5883, test_loss: 1.2156, test_f1: 0.5363
 epoch: 53, train_loss: 0.5334, test_loss: 1.2845, test_f1: 0.5370
 epoch: 54, train_loss: 0.5343, test_loss: 1.1879, test_f1: 0.5638
 epoch: 55, train_loss: 0.5269, test_loss: 1.2722, test_f1: 0.5500
 epoch: 56, train_loss: 0.5225, test_loss: 1.3509, test_f1: 0.5313
 epoch: 57, train_loss: 0.5115, test_loss: 1.4085, test_f1: 0.5422
 epoch: 58, train_loss: 0.5399, test_loss: 1.2657, test_f1: 0.5537
 epoch: 59, train_loss: 0.5272, test_loss: 1.1824, test_f1: 0.5311
 epoch: 60, train_loss: 0.5226, test_loss: 1.2231, test_f1: 0.5587
 epoch: 61, train_loss: 0.5024, test_loss: 1.3163, test_f1: 0.5415
 epoch: 62, train_loss: 0.5113, test_loss: 1.2024, test_f1: 0.5365
 epoch: 63, train_loss: 0.4708, test_loss: 1.3783, test_f1: 0.5271
 epoch: 64, train_loss: 0.4884, test_loss: 1.3589, test_f1: 0.5225
 epoch: 65, train_loss: 0.4873, test_loss: 1.3582, test_f1: 0.5431
 epoch: 66, train_loss: 0.4755, test_loss: 1.3225, test_f1: 0.5823
 epoch: 67, train_loss: 0.4841, test_loss: 1.2688, test_f1: 0.5477
 epoch: 68, train_loss: 0.4742, test_loss: 1.3388, test_f1: 0.5372
 epoch: 69, train_loss: 0.4611, test_loss: 1.3224, test_f1: 0.5526
 epoch: 70, train_loss: 0.4638, test_loss: 1.3250, test_f1: 0.5395
 epoch: 71, train_loss: 0.4543, test_loss: 1.2830, test_f1: 0.5499
 epoch: 72, train_loss: 0.4451, test_loss: 1.3445, test_f1: 0.5458
 epoch: 73, train_loss: 0.4303, test_loss: 1.4052, test_f1: 0.5538
 epoch: 74, train_loss: 0.4527, test_loss: 1.3813, test_f1: 0.5638
 epoch: 75, train_loss: 0.4595, test_loss: 1.2910, test_f1: 0.5592
 epoch: 76, train_loss: 0.4674, test_loss: 1.2845, test_f1: 0.5839
 epoch: 77, train_loss: 0.4467, test_loss: 1.2966, test_f1: 0.5442
 epoch: 78, train_loss: 0.4323, test_loss: 1.2844, test_f1: 0.5484
 epoch: 79, train_loss: 0.4569, test_loss: 1.3472, test_f1: 0.5497
 epoch: 80, train_loss: 0.4411, test_loss: 1.2459, test_f1: 0.5743
 epoch: 81, train_loss: 0.3989, test_loss: 1.3894, test_f1: 0.5563
 epoch: 82, train_loss: 0.4270, test_loss: 1.3859, test_f1: 0.5752
 epoch: 83, train_loss: 0.4120, test_loss: 1.3157, test_f1: 0.5527
 epoch: 84, train_loss: 0.4247, test_loss: 1.3022, test_f1: 0.5691
 epoch: 85, train_loss: 0.4083, test_loss: 1.3265, test_f1: 0.5531
 epoch: 86, train_loss: 0.4154, test_loss: 1.4296, test_f1: 0.5604
 epoch: 87, train_loss: 0.4067, test_loss: 1.4802, test_f1: 0.5252
 epoch: 88, train_loss: 0.4377, test_loss: 1.3206, test_f1: 0.5692
 epoch: 89, train_loss: 0.4301, test_loss: 1.5073, test_f1: 0.5547
 epoch: 90, train_loss: 0.4048, test_loss: 1.3623, test_f1: 0.5813
 epoch: 91, train_loss: 0.4080, test_loss: 1.5331, test_f1: 0.5349
 epoch: 92, train_loss: 0.3974, test_loss: 1.4334, test_f1: 0.5614
 epoch: 93, train_loss: 0.3816, test_loss: 1.5713, test_f1: 0.5638
 epoch: 94, train_loss: 0.3778, test_loss: 1.4832, test_f1: 0.5800
 epoch: 95, train_loss: 0.3981, test_loss: 1.4239, test_f1: 0.5765
 epoch: 96, train_loss: 0.3859, test_loss: 1.4659, test_f1: 0.5692
 epoch: 97, train_loss: 0.3721, test_loss: 1.4251, test_f1: 0.5713
 epoch: 98, train_loss: 0.3850, test_loss: 1.4560, test_f1: 0.5394
 epoch: 99, train_loss: 0.3790, test_loss: 1.4219, test_f1: 0.5585

Training completed in 960.84 seconds
Best F1: 0.6187 at epoch 43
Mean F1 across iterations: 0.5994  0.0103
========================FINAL RESULTS================================
FEGIN weighted F1: 0.6187  0.0103
python main.py --data ltspice_examples --representation component_component --model FEGIN --layers 3 --hiddens 128 --batch_size 32 --lr 0.001 --emb_size 512 --epochs 100 --save_appendix component_component_L3_H128_BS32_LR0.001_E512 --no_val
-----



STDERR:
  File "main.py", line 370, in <module>
    main()
  File "main.py", line 254, in main
    dataset = dataset_class(
  File "/home/philip/projects/ltspice_examples_code_repo/Circuit-Completion-Using-GNNs/component_classification_with_link_prediction_head/evaluation/FEGIN/kernel/circuit_datasets.py", line 15, in __init__
    self.data, self.slices = torch.load(self.processed_paths[0])
  File "/home/philip/.local/lib/python3.8/site-packages/torch/serialization.py", line 1040, in load
    warnings.warn(
  File "/usr/lib/python3.8/warnings.py", line 109, in _showwarnmsg
    sw(msg.message, msg.category, msg.filename, msg.lineno,
  File "main.py", line 47, in warn_with_traceback
    traceback.print_stack(file=log)
/home/philip/projects/ltspice_examples_code_repo/Circuit-Completion-Using-GNNs/component_classification_with_link_prediction_head/evaluation/FEGIN/kernel/circuit_datasets.py:15: FutureWarning: You are using `torch.load` with `weights_only=False` (the current default value), which uses the default pickle module implicitly. It is possible to construct malicious pickle data which will execute arbitrary code during unpickling (See https://github.com/pytorch/pytorch/blob/main/SECURITY.md#untrusted-models for more details). In a future release, the default value for `weights_only` will be flipped to `True`. This limits the functions that could be executed during unpickling. Arbitrary objects will no longer be allowed to be loaded via this mode unless they are explicitly allowlisted by the user via `torch.serialization.add_safe_globals`. We recommend you start setting `weights_only=True` for any use case where you don't have full control of the loaded file. Please open an issue on GitHub for any issues related to this experimental feature.
  self.data, self.slices = torch.load(self.processed_paths[0])
