STDOUT:
Results will be saved in /home/philip/projects/ltspice_examples_code_repo/Circuit-Completion-Using-GNNs/component_classification_with_link_prediction_head/evaluation/FEGIN/results/model_FEGIN_dataset_ltspice_demos
Command line input: python main.py --data ltspice_demos --representation component_net --model FEGIN --layers 5 --hiddens 32 --batch_size 128 --lr 0.0001 --emb_size 250 --epochs 100 --save_appendix component_net_L5_H32_BS128_LR0.0001_E250 --no_val
 is saved.
-----
ltspice_demos - FEGIN
Using 5 layers, 32 hidden units, h = 2
Loading component_net representation dataset
ENTERED
Training FEGIN on component_net representation
Train: 1565, Test: 383
##################ITERATION #0 ****************************************
 epoch: 0, train_loss: 1.4424, test_loss: 1.4341, test_f1: 0.0507
 epoch: 1, train_loss: 1.4358, test_loss: 1.4334, test_f1: 0.0507
 epoch: 2, train_loss: 1.4314, test_loss: 1.4294, test_f1: 0.0507
 epoch: 3, train_loss: 1.4279, test_loss: 1.4247, test_f1: 0.0559
 epoch: 4, train_loss: 1.4244, test_loss: 1.4228, test_f1: 0.0772
 epoch: 5, train_loss: 1.4211, test_loss: 1.4153, test_f1: 0.0931
 epoch: 6, train_loss: 1.4165, test_loss: 1.4088, test_f1: 0.1502
 epoch: 7, train_loss: 1.4119, test_loss: 1.4068, test_f1: 0.1646
 epoch: 8, train_loss: 1.4066, test_loss: 1.4003, test_f1: 0.1846
 epoch: 9, train_loss: 1.4017, test_loss: 1.3936, test_f1: 0.1815
 epoch: 10, train_loss: 1.3983, test_loss: 1.3906, test_f1: 0.1894
 epoch: 11, train_loss: 1.3899, test_loss: 1.3854, test_f1: 0.2101
 epoch: 12, train_loss: 1.3840, test_loss: 1.3791, test_f1: 0.2249
 epoch: 13, train_loss: 1.3769, test_loss: 1.3727, test_f1: 0.2371
 epoch: 14, train_loss: 1.3708, test_loss: 1.3662, test_f1: 0.2628
 epoch: 15, train_loss: 1.3620, test_loss: 1.3606, test_f1: 0.3485
 epoch: 16, train_loss: 1.3543, test_loss: 1.3573, test_f1: 0.4055
 epoch: 17, train_loss: 1.3455, test_loss: 1.3480, test_f1: 0.3763
 epoch: 18, train_loss: 1.3358, test_loss: 1.3393, test_f1: 0.4128
 epoch: 19, train_loss: 1.3290, test_loss: 1.3344, test_f1: 0.4013
 epoch: 20, train_loss: 1.3143, test_loss: 1.3227, test_f1: 0.3805
 epoch: 21, train_loss: 1.3046, test_loss: 1.3135, test_f1: 0.3727
 epoch: 22, train_loss: 1.2874, test_loss: 1.3125, test_f1: 0.3686
 epoch: 23, train_loss: 1.2774, test_loss: 1.3064, test_f1: 0.3693
 epoch: 24, train_loss: 1.2658, test_loss: 1.2911, test_f1: 0.3746
 epoch: 25, train_loss: 1.2561, test_loss: 1.2819, test_f1: 0.3830
 epoch: 26, train_loss: 1.2465, test_loss: 1.2712, test_f1: 0.4018
 epoch: 27, train_loss: 1.2333, test_loss: 1.2625, test_f1: 0.3892
 epoch: 28, train_loss: 1.2271, test_loss: 1.2556, test_f1: 0.3878
 epoch: 29, train_loss: 1.2203, test_loss: 1.2498, test_f1: 0.3921
 epoch: 30, train_loss: 1.2074, test_loss: 1.2402, test_f1: 0.3772
 epoch: 31, train_loss: 1.2063, test_loss: 1.2370, test_f1: 0.3798
 epoch: 32, train_loss: 1.1951, test_loss: 1.2332, test_f1: 0.3419
 epoch: 33, train_loss: 1.1901, test_loss: 1.2279, test_f1: 0.3491
 epoch: 34, train_loss: 1.1836, test_loss: 1.2271, test_f1: 0.3141
 epoch: 35, train_loss: 1.1793, test_loss: 1.2239, test_f1: 0.3331
 epoch: 36, train_loss: 1.1748, test_loss: 1.2177, test_f1: 0.3371
 epoch: 37, train_loss: 1.1690, test_loss: 1.2157, test_f1: 0.3126
 epoch: 38, train_loss: 1.1680, test_loss: 1.2117, test_f1: 0.3125
 epoch: 39, train_loss: 1.1556, test_loss: 1.2088, test_f1: 0.3164
 epoch: 40, train_loss: 1.1559, test_loss: 1.2062, test_f1: 0.3204
 epoch: 41, train_loss: 1.1531, test_loss: 1.2041, test_f1: 0.3188
 epoch: 42, train_loss: 1.1505, test_loss: 1.2004, test_f1: 0.3187
 epoch: 43, train_loss: 1.1472, test_loss: 1.1982, test_f1: 0.3201
 epoch: 44, train_loss: 1.1421, test_loss: 1.1970, test_f1: 0.3227
 epoch: 45, train_loss: 1.1414, test_loss: 1.1958, test_f1: 0.3185
 epoch: 46, train_loss: 1.1379, test_loss: 1.1924, test_f1: 0.3261
 epoch: 47, train_loss: 1.1346, test_loss: 1.1927, test_f1: 0.3224
 epoch: 48, train_loss: 1.1345, test_loss: 1.1915, test_f1: 0.3239
 epoch: 49, train_loss: 1.1312, test_loss: 1.1861, test_f1: 0.3497
 epoch: 50, train_loss: 1.1228, test_loss: 1.1818, test_f1: 0.3554
 epoch: 51, train_loss: 1.1262, test_loss: 1.1814, test_f1: 0.3590
 epoch: 52, train_loss: 1.1204, test_loss: 1.1788, test_f1: 0.3437
 epoch: 53, train_loss: 1.1196, test_loss: 1.1804, test_f1: 0.3497
 epoch: 54, train_loss: 1.1183, test_loss: 1.1820, test_f1: 0.3497
 epoch: 55, train_loss: 1.1214, test_loss: 1.1785, test_f1: 0.3552
 epoch: 56, train_loss: 1.1151, test_loss: 1.1768, test_f1: 0.3571
 epoch: 57, train_loss: 1.1138, test_loss: 1.1786, test_f1: 0.3514
 epoch: 58, train_loss: 1.1196, test_loss: 1.1751, test_f1: 0.3571
 epoch: 59, train_loss: 1.1089, test_loss: 1.1717, test_f1: 0.3571
 epoch: 60, train_loss: 1.1143, test_loss: 1.1715, test_f1: 0.3607
 epoch: 61, train_loss: 1.1175, test_loss: 1.1699, test_f1: 0.3642
 epoch: 62, train_loss: 1.1053, test_loss: 1.1678, test_f1: 0.3642
 epoch: 63, train_loss: 1.1164, test_loss: 1.1701, test_f1: 0.3642
 epoch: 64, train_loss: 1.1107, test_loss: 1.1704, test_f1: 0.3607
 epoch: 65, train_loss: 1.0995, test_loss: 1.1686, test_f1: 0.3642
 epoch: 66, train_loss: 1.1137, test_loss: 1.1671, test_f1: 0.3642
 epoch: 67, train_loss: 1.1061, test_loss: 1.1625, test_f1: 0.3787
 epoch: 68, train_loss: 1.1064, test_loss: 1.1629, test_f1: 0.3806
 epoch: 69, train_loss: 1.1007, test_loss: 1.1643, test_f1: 0.3788
 epoch: 70, train_loss: 1.0976, test_loss: 1.1642, test_f1: 0.3856
 epoch: 71, train_loss: 1.1012, test_loss: 1.1713, test_f1: 0.3770
 epoch: 72, train_loss: 1.0967, test_loss: 1.1614, test_f1: 0.3891
 epoch: 73, train_loss: 1.0985, test_loss: 1.1585, test_f1: 0.3891
 epoch: 74, train_loss: 1.0990, test_loss: 1.1559, test_f1: 0.3891
 epoch: 75, train_loss: 1.1008, test_loss: 1.1615, test_f1: 0.3875
 epoch: 76, train_loss: 1.0936, test_loss: 1.1598, test_f1: 0.3910
 epoch: 77, train_loss: 1.0902, test_loss: 1.1558, test_f1: 0.3874
 epoch: 78, train_loss: 1.0971, test_loss: 1.1552, test_f1: 0.3874
 epoch: 79, train_loss: 1.0925, test_loss: 1.1526, test_f1: 0.3876
 epoch: 80, train_loss: 1.0941, test_loss: 1.1555, test_f1: 0.3858
 epoch: 81, train_loss: 1.0870, test_loss: 1.1599, test_f1: 0.3840
 epoch: 82, train_loss: 1.0901, test_loss: 1.1548, test_f1: 0.3893
 epoch: 83, train_loss: 1.0843, test_loss: 1.1552, test_f1: 0.3912
 epoch: 84, train_loss: 1.0889, test_loss: 1.1526, test_f1: 0.3895
 epoch: 85, train_loss: 1.0896, test_loss: 1.1525, test_f1: 0.3876
 epoch: 86, train_loss: 1.0776, test_loss: 1.1512, test_f1: 0.3876
 epoch: 87, train_loss: 1.0796, test_loss: 1.1489, test_f1: 0.3929
 epoch: 88, train_loss: 1.0815, test_loss: 1.1501, test_f1: 0.3873
 epoch: 89, train_loss: 1.0779, test_loss: 1.1569, test_f1: 0.3879
 epoch: 90, train_loss: 1.0857, test_loss: 1.1521, test_f1: 0.3839
 epoch: 91, train_loss: 1.0823, test_loss: 1.1444, test_f1: 0.3910
 epoch: 92, train_loss: 1.0828, test_loss: 1.1517, test_f1: 0.3860
 epoch: 93, train_loss: 1.0789, test_loss: 1.1481, test_f1: 0.3860
 epoch: 94, train_loss: 1.0738, test_loss: 1.1488, test_f1: 0.4003
 epoch: 95, train_loss: 1.0728, test_loss: 1.1476, test_f1: 0.3910
 epoch: 96, train_loss: 1.0778, test_loss: 1.1450, test_f1: 0.3908
 epoch: 97, train_loss: 1.0736, test_loss: 1.1448, test_f1: 0.3874
 epoch: 98, train_loss: 1.0711, test_loss: 1.1432, test_f1: 0.3960
 epoch: 99, train_loss: 1.0753, test_loss: 1.1393, test_f1: 0.4003
##################ITERATION #1 ****************************************
 epoch: 0, train_loss: 1.3644, test_loss: 1.3798, test_f1: 0.2281
 epoch: 1, train_loss: 1.3491, test_loss: 1.3697, test_f1: 0.2281
 epoch: 2, train_loss: 1.3396, test_loss: 1.3613, test_f1: 0.2281
 epoch: 3, train_loss: 1.3273, test_loss: 1.3569, test_f1: 0.2270
 epoch: 4, train_loss: 1.3192, test_loss: 1.3492, test_f1: 0.2270
 epoch: 5, train_loss: 1.3077, test_loss: 1.3425, test_f1: 0.2285
 epoch: 6, train_loss: 1.2967, test_loss: 1.3349, test_f1: 0.2285
 epoch: 7, train_loss: 1.2853, test_loss: 1.3277, test_f1: 0.2242
 epoch: 8, train_loss: 1.2790, test_loss: 1.3203, test_f1: 0.2562
 epoch: 9, train_loss: 1.2661, test_loss: 1.3132, test_f1: 0.2548
 epoch: 10, train_loss: 1.2606, test_loss: 1.3058, test_f1: 0.2575
 epoch: 11, train_loss: 1.2465, test_loss: 1.2977, test_f1: 0.2623
 epoch: 12, train_loss: 1.2352, test_loss: 1.2890, test_f1: 0.2926
 epoch: 13, train_loss: 1.2299, test_loss: 1.2799, test_f1: 0.2920
 epoch: 14, train_loss: 1.2195, test_loss: 1.2755, test_f1: 0.2862
 epoch: 15, train_loss: 1.2078, test_loss: 1.2678, test_f1: 0.3188
 epoch: 16, train_loss: 1.2026, test_loss: 1.2597, test_f1: 0.3224
 epoch: 17, train_loss: 1.1966, test_loss: 1.2536, test_f1: 0.3098
 epoch: 18, train_loss: 1.1894, test_loss: 1.2485, test_f1: 0.3276
 epoch: 19, train_loss: 1.1849, test_loss: 1.2407, test_f1: 0.3214
 epoch: 20, train_loss: 1.1723, test_loss: 1.2344, test_f1: 0.3177
 epoch: 21, train_loss: 1.1758, test_loss: 1.2301, test_f1: 0.3181
 epoch: 22, train_loss: 1.1647, test_loss: 1.2244, test_f1: 0.3242
 epoch: 23, train_loss: 1.1689, test_loss: 1.2225, test_f1: 0.3218
 epoch: 24, train_loss: 1.1593, test_loss: 1.2181, test_f1: 0.3218
 epoch: 25, train_loss: 1.1539, test_loss: 1.2156, test_f1: 0.3303
 epoch: 26, train_loss: 1.1448, test_loss: 1.2105, test_f1: 0.3499
 epoch: 27, train_loss: 1.1498, test_loss: 1.2048, test_f1: 0.3549
 epoch: 28, train_loss: 1.1476, test_loss: 1.2026, test_f1: 0.3508
 epoch: 29, train_loss: 1.1399, test_loss: 1.1985, test_f1: 0.3484
 epoch: 30, train_loss: 1.1409, test_loss: 1.1949, test_f1: 0.3457
 epoch: 31, train_loss: 1.1365, test_loss: 1.1937, test_f1: 0.3549
 epoch: 32, train_loss: 1.1384, test_loss: 1.1884, test_f1: 0.3555
 epoch: 33, train_loss: 1.1333, test_loss: 1.1867, test_f1: 0.3515
 epoch: 34, train_loss: 1.1282, test_loss: 1.1829, test_f1: 0.3535
 epoch: 35, train_loss: 1.1250, test_loss: 1.1785, test_f1: 0.3565
 epoch: 36, train_loss: 1.1227, test_loss: 1.1761, test_f1: 0.3545
 epoch: 37, train_loss: 1.1257, test_loss: 1.1753, test_f1: 0.3759
 epoch: 38, train_loss: 1.1230, test_loss: 1.1733, test_f1: 0.3729
 epoch: 39, train_loss: 1.1185, test_loss: 1.1726, test_f1: 0.3699
 epoch: 40, train_loss: 1.1132, test_loss: 1.1715, test_f1: 0.3775
 epoch: 41, train_loss: 1.1156, test_loss: 1.1652, test_f1: 0.3775
 epoch: 42, train_loss: 1.1071, test_loss: 1.1649, test_f1: 0.3709
 epoch: 43, train_loss: 1.1135, test_loss: 1.1622, test_f1: 0.3815
 epoch: 44, train_loss: 1.1010, test_loss: 1.1601, test_f1: 0.3795
 epoch: 45, train_loss: 1.1095, test_loss: 1.1587, test_f1: 0.3806
 epoch: 46, train_loss: 1.1027, test_loss: 1.1556, test_f1: 0.3778
 epoch: 47, train_loss: 1.0987, test_loss: 1.1531, test_f1: 0.3856
 epoch: 48, train_loss: 1.0944, test_loss: 1.1504, test_f1: 0.3805
 epoch: 49, train_loss: 1.0995, test_loss: 1.1485, test_f1: 0.3969
 epoch: 50, train_loss: 1.0979, test_loss: 1.1467, test_f1: 0.3972
 epoch: 51, train_loss: 1.0908, test_loss: 1.1466, test_f1: 0.3957
 epoch: 52, train_loss: 1.0955, test_loss: 1.1465, test_f1: 0.3916
 epoch: 53, train_loss: 1.0950, test_loss: 1.1449, test_f1: 0.3933
 epoch: 54, train_loss: 1.0965, test_loss: 1.1434, test_f1: 0.3994
 epoch: 55, train_loss: 1.0946, test_loss: 1.1440, test_f1: 0.3971
 epoch: 56, train_loss: 1.0862, test_loss: 1.1434, test_f1: 0.3879
 epoch: 57, train_loss: 1.0908, test_loss: 1.1407, test_f1: 0.3968
 epoch: 58, train_loss: 1.0853, test_loss: 1.1404, test_f1: 0.4037
 epoch: 59, train_loss: 1.0873, test_loss: 1.1384, test_f1: 0.4137
 epoch: 60, train_loss: 1.0837, test_loss: 1.1380, test_f1: 0.4046
 epoch: 61, train_loss: 1.0854, test_loss: 1.1369, test_f1: 0.4001
 epoch: 62, train_loss: 1.0853, test_loss: 1.1356, test_f1: 0.4037
 epoch: 63, train_loss: 1.0817, test_loss: 1.1366, test_f1: 0.4015
 epoch: 64, train_loss: 1.0809, test_loss: 1.1379, test_f1: 0.4083
 epoch: 65, train_loss: 1.0748, test_loss: 1.1359, test_f1: 0.4083
 epoch: 66, train_loss: 1.0852, test_loss: 1.1362, test_f1: 0.4111
 epoch: 67, train_loss: 1.0843, test_loss: 1.1372, test_f1: 0.4130
 epoch: 68, train_loss: 1.0794, test_loss: 1.1333, test_f1: 0.4195
 epoch: 69, train_loss: 1.0788, test_loss: 1.1341, test_f1: 0.4177
 epoch: 70, train_loss: 1.0811, test_loss: 1.1319, test_f1: 0.4017
 epoch: 71, train_loss: 1.0755, test_loss: 1.1313, test_f1: 0.4171
 epoch: 72, train_loss: 1.0762, test_loss: 1.1344, test_f1: 0.4153
 epoch: 73, train_loss: 1.0805, test_loss: 1.1319, test_f1: 0.4270
 epoch: 74, train_loss: 1.0751, test_loss: 1.1293, test_f1: 0.4273
 epoch: 75, train_loss: 1.0788, test_loss: 1.1276, test_f1: 0.4251
 epoch: 76, train_loss: 1.0736, test_loss: 1.1283, test_f1: 0.4238
 epoch: 77, train_loss: 1.0685, test_loss: 1.1282, test_f1: 0.4206
 epoch: 78, train_loss: 1.0734, test_loss: 1.1274, test_f1: 0.4242
 epoch: 79, train_loss: 1.0737, test_loss: 1.1261, test_f1: 0.4182
 epoch: 80, train_loss: 1.0697, test_loss: 1.1232, test_f1: 0.4189
 epoch: 81, train_loss: 1.0651, test_loss: 1.1291, test_f1: 0.4245
 epoch: 82, train_loss: 1.0686, test_loss: 1.1266, test_f1: 0.4176
 epoch: 83, train_loss: 1.0663, test_loss: 1.1234, test_f1: 0.4342
 epoch: 84, train_loss: 1.0684, test_loss: 1.1233, test_f1: 0.4389
 epoch: 85, train_loss: 1.0663, test_loss: 1.1235, test_f1: 0.4265
 epoch: 86, train_loss: 1.0758, test_loss: 1.1228, test_f1: 0.4190
 epoch: 87, train_loss: 1.0730, test_loss: 1.1243, test_f1: 0.4318
 epoch: 88, train_loss: 1.0614, test_loss: 1.1232, test_f1: 0.4321
 epoch: 89, train_loss: 1.0685, test_loss: 1.1214, test_f1: 0.4385
 epoch: 90, train_loss: 1.0688, test_loss: 1.1250, test_f1: 0.4359
 epoch: 91, train_loss: 1.0616, test_loss: 1.1239, test_f1: 0.4342
 epoch: 92, train_loss: 1.0628, test_loss: 1.1227, test_f1: 0.4360
 epoch: 93, train_loss: 1.0605, test_loss: 1.1221, test_f1: 0.4361
 epoch: 94, train_loss: 1.0559, test_loss: 1.1204, test_f1: 0.4370
 epoch: 95, train_loss: 1.0632, test_loss: 1.1215, test_f1: 0.4349
 epoch: 96, train_loss: 1.0593, test_loss: 1.1209, test_f1: 0.4360
 epoch: 97, train_loss: 1.0569, test_loss: 1.1208, test_f1: 0.4393
 epoch: 98, train_loss: 1.0609, test_loss: 1.1191, test_f1: 0.4453
 epoch: 99, train_loss: 1.0540, test_loss: 1.1172, test_f1: 0.4476
##################ITERATION #2 ****************************************
 epoch: 0, train_loss: 1.3350, test_loss: 1.3679, test_f1: 0.2281
 epoch: 1, train_loss: 1.3166, test_loss: 1.3639, test_f1: 0.2281
 epoch: 2, train_loss: 1.3016, test_loss: 1.3608, test_f1: 0.2281
 epoch: 3, train_loss: 1.2941, test_loss: 1.3501, test_f1: 0.2281
 epoch: 4, train_loss: 1.2827, test_loss: 1.3358, test_f1: 0.2281
 epoch: 5, train_loss: 1.2677, test_loss: 1.3217, test_f1: 0.2281
 epoch: 6, train_loss: 1.2620, test_loss: 1.3085, test_f1: 0.2281
 epoch: 7, train_loss: 1.2529, test_loss: 1.2957, test_f1: 0.2281
 epoch: 8, train_loss: 1.2457, test_loss: 1.2904, test_f1: 0.2281
 epoch: 9, train_loss: 1.2331, test_loss: 1.2796, test_f1: 0.2281
 epoch: 10, train_loss: 1.2258, test_loss: 1.2718, test_f1: 0.2281
 epoch: 11, train_loss: 1.2161, test_loss: 1.2664, test_f1: 0.2281
 epoch: 12, train_loss: 1.2125, test_loss: 1.2594, test_f1: 0.2281
 epoch: 13, train_loss: 1.2050, test_loss: 1.2545, test_f1: 0.2281
 epoch: 14, train_loss: 1.1986, test_loss: 1.2495, test_f1: 0.2281
 epoch: 15, train_loss: 1.1896, test_loss: 1.2435, test_f1: 0.2281
 epoch: 16, train_loss: 1.1835, test_loss: 1.2384, test_f1: 0.2281
 epoch: 17, train_loss: 1.1786, test_loss: 1.2339, test_f1: 0.2281
 epoch: 18, train_loss: 1.1718, test_loss: 1.2300, test_f1: 0.2281
 epoch: 19, train_loss: 1.1699, test_loss: 1.2263, test_f1: 0.2281
 epoch: 20, train_loss: 1.1696, test_loss: 1.2212, test_f1: 0.2281
 epoch: 21, train_loss: 1.1655, test_loss: 1.2184, test_f1: 0.2281
 epoch: 22, train_loss: 1.1609, test_loss: 1.2159, test_f1: 0.2281
 epoch: 23, train_loss: 1.1565, test_loss: 1.2150, test_f1: 0.2281
 epoch: 24, train_loss: 1.1574, test_loss: 1.2108, test_f1: 0.2281
 epoch: 25, train_loss: 1.1465, test_loss: 1.2084, test_f1: 0.2281
 epoch: 26, train_loss: 1.1412, test_loss: 1.2064, test_f1: 0.2281
 epoch: 27, train_loss: 1.1438, test_loss: 1.2021, test_f1: 0.2337
 epoch: 28, train_loss: 1.1367, test_loss: 1.2008, test_f1: 0.2678
 epoch: 29, train_loss: 1.1399, test_loss: 1.1966, test_f1: 0.2731
 epoch: 30, train_loss: 1.1364, test_loss: 1.1953, test_f1: 0.2775
 epoch: 31, train_loss: 1.1324, test_loss: 1.1940, test_f1: 0.2858
 epoch: 32, train_loss: 1.1278, test_loss: 1.1910, test_f1: 0.2974
 epoch: 33, train_loss: 1.1280, test_loss: 1.1902, test_f1: 0.3000
 epoch: 34, train_loss: 1.1269, test_loss: 1.1851, test_f1: 0.2840
 epoch: 35, train_loss: 1.1192, test_loss: 1.1826, test_f1: 0.2919
 epoch: 36, train_loss: 1.1278, test_loss: 1.1822, test_f1: 0.3089
 epoch: 37, train_loss: 1.1213, test_loss: 1.1804, test_f1: 0.3064
 epoch: 38, train_loss: 1.1213, test_loss: 1.1765, test_f1: 0.3092
 epoch: 39, train_loss: 1.1086, test_loss: 1.1781, test_f1: 0.3239
 epoch: 40, train_loss: 1.1144, test_loss: 1.1769, test_f1: 0.3281
 epoch: 41, train_loss: 1.1132, test_loss: 1.1729, test_f1: 0.3359
 epoch: 42, train_loss: 1.1114, test_loss: 1.1685, test_f1: 0.3188
 epoch: 43, train_loss: 1.1098, test_loss: 1.1671, test_f1: 0.3489
 epoch: 44, train_loss: 1.1055, test_loss: 1.1672, test_f1: 0.3489
 epoch: 45, train_loss: 1.1081, test_loss: 1.1651, test_f1: 0.3777
 epoch: 46, train_loss: 1.1034, test_loss: 1.1647, test_f1: 0.3843
 epoch: 47, train_loss: 1.0967, test_loss: 1.1656, test_f1: 0.3868
 epoch: 48, train_loss: 1.0927, test_loss: 1.1680, test_f1: 0.4062
 epoch: 49, train_loss: 1.0993, test_loss: 1.1613, test_f1: 0.4180
 epoch: 50, train_loss: 1.0930, test_loss: 1.1597, test_f1: 0.4516
 epoch: 51, train_loss: 1.0864, test_loss: 1.1600, test_f1: 0.4467
 epoch: 52, train_loss: 1.0973, test_loss: 1.1604, test_f1: 0.4273
 epoch: 53, train_loss: 1.0872, test_loss: 1.1602, test_f1: 0.4300
 epoch: 54, train_loss: 1.0880, test_loss: 1.1636, test_f1: 0.4300
 epoch: 55, train_loss: 1.0870, test_loss: 1.1624, test_f1: 0.4382
 epoch: 56, train_loss: 1.0884, test_loss: 1.1594, test_f1: 0.4389
 epoch: 57, train_loss: 1.0879, test_loss: 1.1562, test_f1: 0.4504
 epoch: 58, train_loss: 1.0875, test_loss: 1.1630, test_f1: 0.4371
 epoch: 59, train_loss: 1.0904, test_loss: 1.1574, test_f1: 0.4704
 epoch: 60, train_loss: 1.0875, test_loss: 1.1571, test_f1: 0.4630
 epoch: 61, train_loss: 1.0815, test_loss: 1.1578, test_f1: 0.4707
 epoch: 62, train_loss: 1.0855, test_loss: 1.1574, test_f1: 0.4696
 epoch: 63, train_loss: 1.0843, test_loss: 1.1543, test_f1: 0.4607
 epoch: 64, train_loss: 1.0765, test_loss: 1.1567, test_f1: 0.4674
 epoch: 65, train_loss: 1.0805, test_loss: 1.1542, test_f1: 0.4600
 epoch: 66, train_loss: 1.0773, test_loss: 1.1560, test_f1: 0.4588
 epoch: 67, train_loss: 1.0835, test_loss: 1.1531, test_f1: 0.4655
 epoch: 68, train_loss: 1.0797, test_loss: 1.1571, test_f1: 0.4506
 epoch: 69, train_loss: 1.0701, test_loss: 1.1543, test_f1: 0.4634
 epoch: 70, train_loss: 1.0740, test_loss: 1.1547, test_f1: 0.4749
 epoch: 71, train_loss: 1.0785, test_loss: 1.1525, test_f1: 0.4717
 epoch: 72, train_loss: 1.0794, test_loss: 1.1520, test_f1: 0.4804
 epoch: 73, train_loss: 1.0723, test_loss: 1.1497, test_f1: 0.4654
 epoch: 74, train_loss: 1.0753, test_loss: 1.1475, test_f1: 0.4799
 epoch: 75, train_loss: 1.0744, test_loss: 1.1473, test_f1: 0.4645
 epoch: 76, train_loss: 1.0644, test_loss: 1.1478, test_f1: 0.4671
 epoch: 77, train_loss: 1.0673, test_loss: 1.1462, test_f1: 0.4501
 epoch: 78, train_loss: 1.0683, test_loss: 1.1457, test_f1: 0.4653
 epoch: 79, train_loss: 1.0723, test_loss: 1.1443, test_f1: 0.4505
 epoch: 80, train_loss: 1.0692, test_loss: 1.1452, test_f1: 0.4557
 epoch: 81, train_loss: 1.0614, test_loss: 1.1421, test_f1: 0.4465
 epoch: 82, train_loss: 1.0683, test_loss: 1.1449, test_f1: 0.4543
 epoch: 83, train_loss: 1.0682, test_loss: 1.1487, test_f1: 0.4666
 epoch: 84, train_loss: 1.0608, test_loss: 1.1497, test_f1: 0.4598
 epoch: 85, train_loss: 1.0684, test_loss: 1.1441, test_f1: 0.4466
 epoch: 86, train_loss: 1.0661, test_loss: 1.1485, test_f1: 0.4457
 epoch: 87, train_loss: 1.0660, test_loss: 1.1464, test_f1: 0.4585
 epoch: 88, train_loss: 1.0596, test_loss: 1.1414, test_f1: 0.4471
 epoch: 89, train_loss: 1.0639, test_loss: 1.1434, test_f1: 0.4335
 epoch: 90, train_loss: 1.0587, test_loss: 1.1411, test_f1: 0.4464
 epoch: 91, train_loss: 1.0661, test_loss: 1.1434, test_f1: 0.4523
 epoch: 92, train_loss: 1.0572, test_loss: 1.1410, test_f1: 0.4513
 epoch: 93, train_loss: 1.0594, test_loss: 1.1505, test_f1: 0.4516
 epoch: 94, train_loss: 1.0614, test_loss: 1.1471, test_f1: 0.4393
 epoch: 95, train_loss: 1.0508, test_loss: 1.1383, test_f1: 0.4369
 epoch: 96, train_loss: 1.0595, test_loss: 1.1405, test_f1: 0.4357
 epoch: 97, train_loss: 1.0547, test_loss: 1.1486, test_f1: 0.4481
 epoch: 98, train_loss: 1.0555, test_loss: 1.1478, test_f1: 0.4414
 epoch: 99, train_loss: 1.0545, test_loss: 1.1405, test_f1: 0.4474
##################ITERATION #3 ****************************************
 epoch: 0, train_loss: 1.3154, test_loss: 1.3537, test_f1: 0.2281
 epoch: 1, train_loss: 1.2941, test_loss: 1.3374, test_f1: 0.2281
 epoch: 2, train_loss: 1.2807, test_loss: 1.3269, test_f1: 0.2281
 epoch: 3, train_loss: 1.2665, test_loss: 1.3225, test_f1: 0.2281
 epoch: 4, train_loss: 1.2622, test_loss: 1.3171, test_f1: 0.2281
 epoch: 5, train_loss: 1.2526, test_loss: 1.3108, test_f1: 0.2281
 epoch: 6, train_loss: 1.2450, test_loss: 1.3009, test_f1: 0.2274
 epoch: 7, train_loss: 1.2316, test_loss: 1.2893, test_f1: 0.2337
 epoch: 8, train_loss: 1.2227, test_loss: 1.2799, test_f1: 0.2992
 epoch: 9, train_loss: 1.2239, test_loss: 1.2743, test_f1: 0.2983
 epoch: 10, train_loss: 1.2117, test_loss: 1.2687, test_f1: 0.2929
 epoch: 11, train_loss: 1.2049, test_loss: 1.2619, test_f1: 0.2909
 epoch: 12, train_loss: 1.1997, test_loss: 1.2566, test_f1: 0.2941
 epoch: 13, train_loss: 1.2016, test_loss: 1.2510, test_f1: 0.2928
 epoch: 14, train_loss: 1.1904, test_loss: 1.2465, test_f1: 0.2894
 epoch: 15, train_loss: 1.1871, test_loss: 1.2415, test_f1: 0.2941
 epoch: 16, train_loss: 1.1826, test_loss: 1.2366, test_f1: 0.2941
 epoch: 17, train_loss: 1.1731, test_loss: 1.2340, test_f1: 0.2957
 epoch: 18, train_loss: 1.1758, test_loss: 1.2288, test_f1: 0.2913
 epoch: 19, train_loss: 1.1733, test_loss: 1.2282, test_f1: 0.2941
 epoch: 20, train_loss: 1.1596, test_loss: 1.2234, test_f1: 0.2957
 epoch: 21, train_loss: 1.1647, test_loss: 1.2158, test_f1: 0.3056
 epoch: 22, train_loss: 1.1573, test_loss: 1.2123, test_f1: 0.3056
 epoch: 23, train_loss: 1.1579, test_loss: 1.2090, test_f1: 0.3205
 epoch: 24, train_loss: 1.1464, test_loss: 1.2065, test_f1: 0.3167
 epoch: 25, train_loss: 1.1513, test_loss: 1.2058, test_f1: 0.3261
 epoch: 26, train_loss: 1.1533, test_loss: 1.2004, test_f1: 0.3277
 epoch: 27, train_loss: 1.1430, test_loss: 1.1990, test_f1: 0.3176
 epoch: 28, train_loss: 1.1440, test_loss: 1.1945, test_f1: 0.3233
 epoch: 29, train_loss: 1.1378, test_loss: 1.1909, test_f1: 0.3283
 epoch: 30, train_loss: 1.1344, test_loss: 1.1869, test_f1: 0.3322
 epoch: 31, train_loss: 1.1314, test_loss: 1.1852, test_f1: 0.3372
 epoch: 32, train_loss: 1.1294, test_loss: 1.1832, test_f1: 0.3572
 epoch: 33, train_loss: 1.1305, test_loss: 1.1815, test_f1: 0.3582
 epoch: 34, train_loss: 1.1247, test_loss: 1.1829, test_f1: 0.3647
 epoch: 35, train_loss: 1.1278, test_loss: 1.1779, test_f1: 0.3583
 epoch: 36, train_loss: 1.1271, test_loss: 1.1759, test_f1: 0.3646
 epoch: 37, train_loss: 1.1171, test_loss: 1.1750, test_f1: 0.3680
 epoch: 38, train_loss: 1.1146, test_loss: 1.1714, test_f1: 0.3640
 epoch: 39, train_loss: 1.1169, test_loss: 1.1653, test_f1: 0.3823
 epoch: 40, train_loss: 1.1154, test_loss: 1.1650, test_f1: 0.3803
 epoch: 41, train_loss: 1.1085, test_loss: 1.1657, test_f1: 0.3696
 epoch: 42, train_loss: 1.1113, test_loss: 1.1640, test_f1: 0.3793
 epoch: 43, train_loss: 1.1071, test_loss: 1.1610, test_f1: 0.3720
 epoch: 44, train_loss: 1.1117, test_loss: 1.1591, test_f1: 0.3728
 epoch: 45, train_loss: 1.1137, test_loss: 1.1624, test_f1: 0.3664
 epoch: 46, train_loss: 1.1060, test_loss: 1.1590, test_f1: 0.3648
 epoch: 47, train_loss: 1.1030, test_loss: 1.1543, test_f1: 0.3671
 epoch: 48, train_loss: 1.0964, test_loss: 1.1569, test_f1: 0.3588
 epoch: 49, train_loss: 1.0966, test_loss: 1.1539, test_f1: 0.3752
 epoch: 50, train_loss: 1.0955, test_loss: 1.1506, test_f1: 0.3791
 epoch: 51, train_loss: 1.0944, test_loss: 1.1518, test_f1: 0.3800
 epoch: 52, train_loss: 1.0878, test_loss: 1.1582, test_f1: 0.3769
 epoch: 53, train_loss: 1.0885, test_loss: 1.1527, test_f1: 0.3680
 epoch: 54, train_loss: 1.0861, test_loss: 1.1534, test_f1: 0.3757
 epoch: 55, train_loss: 1.0950, test_loss: 1.1526, test_f1: 0.3785
 epoch: 56, train_loss: 1.0996, test_loss: 1.1520, test_f1: 0.3875
 epoch: 57, train_loss: 1.0887, test_loss: 1.1507, test_f1: 0.3958
 epoch: 58, train_loss: 1.0856, test_loss: 1.1548, test_f1: 0.3727
 epoch: 59, train_loss: 1.0852, test_loss: 1.1506, test_f1: 0.3837
 epoch: 60, train_loss: 1.0874, test_loss: 1.1512, test_f1: 0.3870
 epoch: 61, train_loss: 1.0875, test_loss: 1.1514, test_f1: 0.3934
 epoch: 62, train_loss: 1.0825, test_loss: 1.1474, test_f1: 0.3905
 epoch: 63, train_loss: 1.0821, test_loss: 1.1486, test_f1: 0.3926
 epoch: 64, train_loss: 1.0817, test_loss: 1.1473, test_f1: 0.3969
 epoch: 65, train_loss: 1.0807, test_loss: 1.1495, test_f1: 0.3844
 epoch: 66, train_loss: 1.0858, test_loss: 1.1461, test_f1: 0.3966
 epoch: 67, train_loss: 1.0802, test_loss: 1.1430, test_f1: 0.3880
 epoch: 68, train_loss: 1.0886, test_loss: 1.1469, test_f1: 0.3935
 epoch: 69, train_loss: 1.0675, test_loss: 1.1460, test_f1: 0.3974
 epoch: 70, train_loss: 1.0755, test_loss: 1.1411, test_f1: 0.4041
 epoch: 71, train_loss: 1.0786, test_loss: 1.1477, test_f1: 0.4056
 epoch: 72, train_loss: 1.0751, test_loss: 1.1430, test_f1: 0.4008
 epoch: 73, train_loss: 1.0755, test_loss: 1.1424, test_f1: 0.4134
 epoch: 74, train_loss: 1.0793, test_loss: 1.1384, test_f1: 0.3967
 epoch: 75, train_loss: 1.0692, test_loss: 1.1339, test_f1: 0.4122
 epoch: 76, train_loss: 1.0812, test_loss: 1.1347, test_f1: 0.4055
 epoch: 77, train_loss: 1.0728, test_loss: 1.1383, test_f1: 0.4155
 epoch: 78, train_loss: 1.0707, test_loss: 1.1372, test_f1: 0.4003
 epoch: 79, train_loss: 1.0724, test_loss: 1.1376, test_f1: 0.3955
 epoch: 80, train_loss: 1.0655, test_loss: 1.1383, test_f1: 0.4035
 epoch: 81, train_loss: 1.0695, test_loss: 1.1407, test_f1: 0.4224
 epoch: 82, train_loss: 1.0669, test_loss: 1.1386, test_f1: 0.4240
 epoch: 83, train_loss: 1.0626, test_loss: 1.1354, test_f1: 0.4105
 epoch: 84, train_loss: 1.0639, test_loss: 1.1390, test_f1: 0.4125
 epoch: 85, train_loss: 1.0654, test_loss: 1.1346, test_f1: 0.4096
 epoch: 86, train_loss: 1.0656, test_loss: 1.1321, test_f1: 0.4172
 epoch: 87, train_loss: 1.0608, test_loss: 1.1313, test_f1: 0.4110
 epoch: 88, train_loss: 1.0585, test_loss: 1.1336, test_f1: 0.4273
 epoch: 89, train_loss: 1.0668, test_loss: 1.1322, test_f1: 0.4289
 epoch: 90, train_loss: 1.0635, test_loss: 1.1347, test_f1: 0.4285
 epoch: 91, train_loss: 1.0627, test_loss: 1.1246, test_f1: 0.4290
 epoch: 92, train_loss: 1.0620, test_loss: 1.1183, test_f1: 0.4292
 epoch: 93, train_loss: 1.0668, test_loss: 1.1301, test_f1: 0.4171
 epoch: 94, train_loss: 1.0559, test_loss: 1.1240, test_f1: 0.4192
 epoch: 95, train_loss: 1.0572, test_loss: 1.1299, test_f1: 0.4157
 epoch: 96, train_loss: 1.0646, test_loss: 1.1310, test_f1: 0.4206
 epoch: 97, train_loss: 1.0590, test_loss: 1.1322, test_f1: 0.4219
 epoch: 98, train_loss: 1.0552, test_loss: 1.1254, test_f1: 0.4225
 epoch: 99, train_loss: 1.0654, test_loss: 1.1187, test_f1: 0.4213
##################ITERATION #4 ****************************************
 epoch: 0, train_loss: 1.3101, test_loss: 1.3626, test_f1: 0.2281
 epoch: 1, train_loss: 1.2863, test_loss: 1.3624, test_f1: 0.2281
 epoch: 2, train_loss: 1.2718, test_loss: 1.3470, test_f1: 0.2281
 epoch: 3, train_loss: 1.2570, test_loss: 1.3178, test_f1: 0.2281
 epoch: 4, train_loss: 1.2416, test_loss: 1.2934, test_f1: 0.2281
 epoch: 5, train_loss: 1.2327, test_loss: 1.2821, test_f1: 0.2281
 epoch: 6, train_loss: 1.2231, test_loss: 1.2706, test_f1: 0.2281
 epoch: 7, train_loss: 1.2149, test_loss: 1.2618, test_f1: 0.2281
 epoch: 8, train_loss: 1.2088, test_loss: 1.2511, test_f1: 0.2281
 epoch: 9, train_loss: 1.1989, test_loss: 1.2471, test_f1: 0.2281
 epoch: 10, train_loss: 1.1894, test_loss: 1.2417, test_f1: 0.2281
 epoch: 11, train_loss: 1.1871, test_loss: 1.2346, test_f1: 0.2778
 epoch: 12, train_loss: 1.1793, test_loss: 1.2286, test_f1: 0.2854
 epoch: 13, train_loss: 1.1814, test_loss: 1.2257, test_f1: 0.2854
 epoch: 14, train_loss: 1.1630, test_loss: 1.2230, test_f1: 0.2794
 epoch: 15, train_loss: 1.1550, test_loss: 1.2163, test_f1: 0.2952
 epoch: 16, train_loss: 1.1592, test_loss: 1.2099, test_f1: 0.3128
 epoch: 17, train_loss: 1.1572, test_loss: 1.2090, test_f1: 0.3110
 epoch: 18, train_loss: 1.1535, test_loss: 1.2038, test_f1: 0.3110
 epoch: 19, train_loss: 1.1569, test_loss: 1.1960, test_f1: 0.3225
 epoch: 20, train_loss: 1.1440, test_loss: 1.1945, test_f1: 0.3352
 epoch: 21, train_loss: 1.1419, test_loss: 1.1921, test_f1: 0.3415
 epoch: 22, train_loss: 1.1332, test_loss: 1.1877, test_f1: 0.3400
 epoch: 23, train_loss: 1.1344, test_loss: 1.1858, test_f1: 0.3449
 epoch: 24, train_loss: 1.1249, test_loss: 1.1856, test_f1: 0.3547
 epoch: 25, train_loss: 1.1281, test_loss: 1.1815, test_f1: 0.3571
 epoch: 26, train_loss: 1.1310, test_loss: 1.1750, test_f1: 0.3478
 epoch: 27, train_loss: 1.1251, test_loss: 1.1722, test_f1: 0.3508
 epoch: 28, train_loss: 1.1179, test_loss: 1.1705, test_f1: 0.3699
 epoch: 29, train_loss: 1.1227, test_loss: 1.1662, test_f1: 0.3751
 epoch: 30, train_loss: 1.1232, test_loss: 1.1610, test_f1: 0.3641
 epoch: 31, train_loss: 1.1050, test_loss: 1.1571, test_f1: 0.3704
 epoch: 32, train_loss: 1.1018, test_loss: 1.1593, test_f1: 0.3755
 epoch: 33, train_loss: 1.1078, test_loss: 1.1566, test_f1: 0.3806
 epoch: 34, train_loss: 1.1047, test_loss: 1.1558, test_f1: 0.3690
 epoch: 35, train_loss: 1.1063, test_loss: 1.1527, test_f1: 0.3767
 epoch: 36, train_loss: 1.1068, test_loss: 1.1516, test_f1: 0.3973
 epoch: 37, train_loss: 1.0999, test_loss: 1.1476, test_f1: 0.3932
 epoch: 38, train_loss: 1.0986, test_loss: 1.1483, test_f1: 0.3953
 epoch: 39, train_loss: 1.0918, test_loss: 1.1439, test_f1: 0.4047
 epoch: 40, train_loss: 1.0888, test_loss: 1.1395, test_f1: 0.3952
 epoch: 41, train_loss: 1.0914, test_loss: 1.1372, test_f1: 0.4021
 epoch: 42, train_loss: 1.0801, test_loss: 1.1399, test_f1: 0.4041
 epoch: 43, train_loss: 1.0835, test_loss: 1.1346, test_f1: 0.4159
 epoch: 44, train_loss: 1.0924, test_loss: 1.1334, test_f1: 0.4179
 epoch: 45, train_loss: 1.0752, test_loss: 1.1332, test_f1: 0.4054
 epoch: 46, train_loss: 1.0858, test_loss: 1.1293, test_f1: 0.4313
 epoch: 47, train_loss: 1.0901, test_loss: 1.1328, test_f1: 0.4101
 epoch: 48, train_loss: 1.0720, test_loss: 1.1328, test_f1: 0.4153
 epoch: 49, train_loss: 1.0715, test_loss: 1.1316, test_f1: 0.4212
 epoch: 50, train_loss: 1.0759, test_loss: 1.1270, test_f1: 0.4432
 epoch: 51, train_loss: 1.0701, test_loss: 1.1257, test_f1: 0.4467
 epoch: 52, train_loss: 1.0777, test_loss: 1.1209, test_f1: 0.4480
 epoch: 53, train_loss: 1.0776, test_loss: 1.1210, test_f1: 0.4466
 epoch: 54, train_loss: 1.0670, test_loss: 1.1211, test_f1: 0.4385
 epoch: 55, train_loss: 1.0719, test_loss: 1.1227, test_f1: 0.4464
 epoch: 56, train_loss: 1.0701, test_loss: 1.1221, test_f1: 0.4402
 epoch: 57, train_loss: 1.0731, test_loss: 1.1194, test_f1: 0.4399
 epoch: 58, train_loss: 1.0697, test_loss: 1.1197, test_f1: 0.4436
 epoch: 59, train_loss: 1.0681, test_loss: 1.1163, test_f1: 0.4382
 epoch: 60, train_loss: 1.0661, test_loss: 1.1201, test_f1: 0.4499
 epoch: 61, train_loss: 1.0601, test_loss: 1.1184, test_f1: 0.4434
 epoch: 62, train_loss: 1.0642, test_loss: 1.1225, test_f1: 0.4390
 epoch: 63, train_loss: 1.0579, test_loss: 1.1192, test_f1: 0.4367
 epoch: 64, train_loss: 1.0559, test_loss: 1.1193, test_f1: 0.4372
 epoch: 65, train_loss: 1.0561, test_loss: 1.1155, test_f1: 0.4411
 epoch: 66, train_loss: 1.0563, test_loss: 1.1183, test_f1: 0.4283
 epoch: 67, train_loss: 1.0598, test_loss: 1.1181, test_f1: 0.4351
 epoch: 68, train_loss: 1.0562, test_loss: 1.1151, test_f1: 0.4412
 epoch: 69, train_loss: 1.0636, test_loss: 1.1132, test_f1: 0.4383
 epoch: 70, train_loss: 1.0556, test_loss: 1.1129, test_f1: 0.4413
 epoch: 71, train_loss: 1.0550, test_loss: 1.1119, test_f1: 0.4415
 epoch: 72, train_loss: 1.0577, test_loss: 1.1115, test_f1: 0.4380
 epoch: 73, train_loss: 1.0542, test_loss: 1.1095, test_f1: 0.4438
 epoch: 74, train_loss: 1.0513, test_loss: 1.1124, test_f1: 0.4422
 epoch: 75, train_loss: 1.0592, test_loss: 1.1120, test_f1: 0.4483
 epoch: 76, train_loss: 1.0563, test_loss: 1.1129, test_f1: 0.4392
 epoch: 77, train_loss: 1.0512, test_loss: 1.1108, test_f1: 0.4348
 epoch: 78, train_loss: 1.0481, test_loss: 1.1109, test_f1: 0.4343
 epoch: 79, train_loss: 1.0409, test_loss: 1.1098, test_f1: 0.4398
 epoch: 80, train_loss: 1.0481, test_loss: 1.1067, test_f1: 0.4363
 epoch: 81, train_loss: 1.0514, test_loss: 1.1048, test_f1: 0.4408
 epoch: 82, train_loss: 1.0395, test_loss: 1.1063, test_f1: 0.4470
 epoch: 83, train_loss: 1.0464, test_loss: 1.1055, test_f1: 0.4444
 epoch: 84, train_loss: 1.0505, test_loss: 1.1046, test_f1: 0.4367
 epoch: 85, train_loss: 1.0523, test_loss: 1.1027, test_f1: 0.4354
 epoch: 86, train_loss: 1.0438, test_loss: 1.1023, test_f1: 0.4377
 epoch: 87, train_loss: 1.0510, test_loss: 1.1017, test_f1: 0.4420
 epoch: 88, train_loss: 1.0390, test_loss: 1.1034, test_f1: 0.4435
 epoch: 89, train_loss: 1.0471, test_loss: 1.0997, test_f1: 0.4432
 epoch: 90, train_loss: 1.0401, test_loss: 1.1032, test_f1: 0.4354
 epoch: 91, train_loss: 1.0391, test_loss: 1.1035, test_f1: 0.4355
 epoch: 92, train_loss: 1.0377, test_loss: 1.1041, test_f1: 0.4328
 epoch: 93, train_loss: 1.0377, test_loss: 1.1050, test_f1: 0.4452
 epoch: 94, train_loss: 1.0442, test_loss: 1.1002, test_f1: 0.4436
 epoch: 95, train_loss: 1.0394, test_loss: 1.1012, test_f1: 0.4410
 epoch: 96, train_loss: 1.0349, test_loss: 1.1009, test_f1: 0.4349
 epoch: 97, train_loss: 1.0343, test_loss: 1.0955, test_f1: 0.4416
 epoch: 98, train_loss: 1.0342, test_loss: 1.0937, test_f1: 0.4394
 epoch: 99, train_loss: 1.0318, test_loss: 1.0991, test_f1: 0.4436
##################ITERATION #5 ****************************************
 epoch: 0, train_loss: 1.2512, test_loss: 1.3433, test_f1: 0.2281
 epoch: 1, train_loss: 1.2300, test_loss: 1.3456, test_f1: 0.2281
 epoch: 2, train_loss: 1.2301, test_loss: 1.3175, test_f1: 0.2281
 epoch: 3, train_loss: 1.2146, test_loss: 1.2912, test_f1: 0.2281
 epoch: 4, train_loss: 1.2016, test_loss: 1.2758, test_f1: 0.2281
 epoch: 5, train_loss: 1.1954, test_loss: 1.2684, test_f1: 0.2281
 epoch: 6, train_loss: 1.1915, test_loss: 1.2482, test_f1: 0.2281
 epoch: 7, train_loss: 1.1927, test_loss: 1.2383, test_f1: 0.2614
 epoch: 8, train_loss: 1.1789, test_loss: 1.2313, test_f1: 0.2575
 epoch: 9, train_loss: 1.1683, test_loss: 1.2237, test_f1: 0.2943
 epoch: 10, train_loss: 1.1692, test_loss: 1.2142, test_f1: 0.3104
 epoch: 11, train_loss: 1.1680, test_loss: 1.2096, test_f1: 0.3037
 epoch: 12, train_loss: 1.1616, test_loss: 1.2038, test_f1: 0.3058
 epoch: 13, train_loss: 1.1584, test_loss: 1.1986, test_f1: 0.3024
 epoch: 14, train_loss: 1.1570, test_loss: 1.1997, test_f1: 0.3045
 epoch: 15, train_loss: 1.1491, test_loss: 1.1904, test_f1: 0.3023
 epoch: 16, train_loss: 1.1532, test_loss: 1.1895, test_f1: 0.3014
 epoch: 17, train_loss: 1.1421, test_loss: 1.1860, test_f1: 0.3014
 epoch: 18, train_loss: 1.1471, test_loss: 1.1824, test_f1: 0.3065
 epoch: 19, train_loss: 1.1360, test_loss: 1.1815, test_f1: 0.3115
 epoch: 20, train_loss: 1.1404, test_loss: 1.1780, test_f1: 0.3164
 epoch: 21, train_loss: 1.1345, test_loss: 1.1731, test_f1: 0.3249
 epoch: 22, train_loss: 1.1285, test_loss: 1.1703, test_f1: 0.3284
 epoch: 23, train_loss: 1.1276, test_loss: 1.1675, test_f1: 0.3315
 epoch: 24, train_loss: 1.1261, test_loss: 1.1645, test_f1: 0.3426
 epoch: 25, train_loss: 1.1184, test_loss: 1.1627, test_f1: 0.3483
 epoch: 26, train_loss: 1.1206, test_loss: 1.1590, test_f1: 0.3544
 epoch: 27, train_loss: 1.1128, test_loss: 1.1559, test_f1: 0.3510
 epoch: 28, train_loss: 1.1156, test_loss: 1.1538, test_f1: 0.3613
 epoch: 29, train_loss: 1.1104, test_loss: 1.1559, test_f1: 0.3724
 epoch: 30, train_loss: 1.0964, test_loss: 1.1547, test_f1: 0.3672
 epoch: 31, train_loss: 1.1140, test_loss: 1.1523, test_f1: 0.3768
 epoch: 32, train_loss: 1.1038, test_loss: 1.1489, test_f1: 0.3778
 epoch: 33, train_loss: 1.1061, test_loss: 1.1480, test_f1: 0.3865
 epoch: 34, train_loss: 1.0955, test_loss: 1.1460, test_f1: 0.3818
 epoch: 35, train_loss: 1.0971, test_loss: 1.1436, test_f1: 0.4034
 epoch: 36, train_loss: 1.0998, test_loss: 1.1462, test_f1: 0.4064
 epoch: 37, train_loss: 1.0937, test_loss: 1.1407, test_f1: 0.4199
 epoch: 38, train_loss: 1.0896, test_loss: 1.1389, test_f1: 0.4091
 epoch: 39, train_loss: 1.0826, test_loss: 1.1394, test_f1: 0.4221
 epoch: 40, train_loss: 1.0926, test_loss: 1.1372, test_f1: 0.4188
 epoch: 41, train_loss: 1.0876, test_loss: 1.1328, test_f1: 0.4098
 epoch: 42, train_loss: 1.0830, test_loss: 1.1328, test_f1: 0.4077
 epoch: 43, train_loss: 1.0929, test_loss: 1.1294, test_f1: 0.4087
 epoch: 44, train_loss: 1.0789, test_loss: 1.1278, test_f1: 0.4111
 epoch: 45, train_loss: 1.0854, test_loss: 1.1242, test_f1: 0.4099
 epoch: 46, train_loss: 1.0654, test_loss: 1.1230, test_f1: 0.4169
 epoch: 47, train_loss: 1.0758, test_loss: 1.1249, test_f1: 0.4165
 epoch: 48, train_loss: 1.0681, test_loss: 1.1239, test_f1: 0.4211
 epoch: 49, train_loss: 1.0793, test_loss: 1.1213, test_f1: 0.4328
 epoch: 50, train_loss: 1.0682, test_loss: 1.1187, test_f1: 0.4136
 epoch: 51, train_loss: 1.0715, test_loss: 1.1180, test_f1: 0.4118
 epoch: 52, train_loss: 1.0697, test_loss: 1.1182, test_f1: 0.4151
 epoch: 53, train_loss: 1.0711, test_loss: 1.1185, test_f1: 0.4048
 epoch: 54, train_loss: 1.0628, test_loss: 1.1164, test_f1: 0.4151
 epoch: 55, train_loss: 1.0595, test_loss: 1.1161, test_f1: 0.4318
 epoch: 56, train_loss: 1.0715, test_loss: 1.1178, test_f1: 0.4106
 epoch: 57, train_loss: 1.0726, test_loss: 1.1171, test_f1: 0.4077
 epoch: 58, train_loss: 1.0614, test_loss: 1.1127, test_f1: 0.4186
 epoch: 59, train_loss: 1.0558, test_loss: 1.1156, test_f1: 0.4175
 epoch: 60, train_loss: 1.0569, test_loss: 1.1172, test_f1: 0.4102
 epoch: 61, train_loss: 1.0527, test_loss: 1.1137, test_f1: 0.4163
 epoch: 62, train_loss: 1.0500, test_loss: 1.1138, test_f1: 0.4145
 epoch: 63, train_loss: 1.0570, test_loss: 1.1096, test_f1: 0.4217
 epoch: 64, train_loss: 1.0601, test_loss: 1.1150, test_f1: 0.4320
 epoch: 65, train_loss: 1.0517, test_loss: 1.1151, test_f1: 0.4245
 epoch: 66, train_loss: 1.0548, test_loss: 1.1101, test_f1: 0.4092
 epoch: 67, train_loss: 1.0597, test_loss: 1.1092, test_f1: 0.4259
 epoch: 68, train_loss: 1.0449, test_loss: 1.1079, test_f1: 0.4224
 epoch: 69, train_loss: 1.0490, test_loss: 1.1097, test_f1: 0.4118
 epoch: 70, train_loss: 1.0515, test_loss: 1.1080, test_f1: 0.4195
 epoch: 71, train_loss: 1.0504, test_loss: 1.1059, test_f1: 0.4392
 epoch: 72, train_loss: 1.0484, test_loss: 1.1056, test_f1: 0.4243
 epoch: 73, train_loss: 1.0481, test_loss: 1.1061, test_f1: 0.4231
 epoch: 74, train_loss: 1.0462, test_loss: 1.1064, test_f1: 0.4232
 epoch: 75, train_loss: 1.0473, test_loss: 1.1082, test_f1: 0.4264
 epoch: 76, train_loss: 1.0403, test_loss: 1.1079, test_f1: 0.4398
 epoch: 77, train_loss: 1.0448, test_loss: 1.1046, test_f1: 0.4506
 epoch: 78, train_loss: 1.0405, test_loss: 1.1037, test_f1: 0.4447
 epoch: 79, train_loss: 1.0460, test_loss: 1.1028, test_f1: 0.4487
 epoch: 80, train_loss: 1.0446, test_loss: 1.1000, test_f1: 0.4415
 epoch: 81, train_loss: 1.0418, test_loss: 1.1013, test_f1: 0.4498
 epoch: 82, train_loss: 1.0463, test_loss: 1.1013, test_f1: 0.4337
 epoch: 83, train_loss: 1.0367, test_loss: 1.1031, test_f1: 0.4188
 epoch: 84, train_loss: 1.0317, test_loss: 1.1066, test_f1: 0.4253
 epoch: 85, train_loss: 1.0432, test_loss: 1.1026, test_f1: 0.4354
 epoch: 86, train_loss: 1.0457, test_loss: 1.0962, test_f1: 0.4497
 epoch: 87, train_loss: 1.0366, test_loss: 1.1010, test_f1: 0.4550
 epoch: 88, train_loss: 1.0326, test_loss: 1.0992, test_f1: 0.4444
 epoch: 89, train_loss: 1.0442, test_loss: 1.1022, test_f1: 0.4328
 epoch: 90, train_loss: 1.0273, test_loss: 1.0989, test_f1: 0.4417
 epoch: 91, train_loss: 1.0346, test_loss: 1.0997, test_f1: 0.4324
 epoch: 92, train_loss: 1.0339, test_loss: 1.1055, test_f1: 0.4396
 epoch: 93, train_loss: 1.0281, test_loss: 1.1037, test_f1: 0.4416
 epoch: 94, train_loss: 1.0295, test_loss: 1.1020, test_f1: 0.4310
 epoch: 95, train_loss: 1.0319, test_loss: 1.0978, test_f1: 0.4318
 epoch: 96, train_loss: 1.0237, test_loss: 1.0978, test_f1: 0.4553
 epoch: 97, train_loss: 1.0247, test_loss: 1.0960, test_f1: 0.4203
 epoch: 98, train_loss: 1.0290, test_loss: 1.0992, test_f1: 0.4497
 epoch: 99, train_loss: 1.0360, test_loss: 1.0990, test_f1: 0.4370
##################ITERATION #6 ****************************************
 epoch: 0, train_loss: 1.2754, test_loss: 1.3324, test_f1: 0.2281
 epoch: 1, train_loss: 1.2540, test_loss: 1.3102, test_f1: 0.2281
 epoch: 2, train_loss: 1.2449, test_loss: 1.3096, test_f1: 0.2281
 epoch: 3, train_loss: 1.2304, test_loss: 1.3059, test_f1: 0.2281
 epoch: 4, train_loss: 1.2131, test_loss: 1.2840, test_f1: 0.2281
 epoch: 5, train_loss: 1.2064, test_loss: 1.2725, test_f1: 0.2281
 epoch: 6, train_loss: 1.1996, test_loss: 1.2607, test_f1: 0.2281
 epoch: 7, train_loss: 1.1916, test_loss: 1.2588, test_f1: 0.2285
 epoch: 8, train_loss: 1.1897, test_loss: 1.2512, test_f1: 0.2285
 epoch: 9, train_loss: 1.1868, test_loss: 1.2476, test_f1: 0.2285
 epoch: 10, train_loss: 1.1781, test_loss: 1.2530, test_f1: 0.2285
 epoch: 11, train_loss: 1.1693, test_loss: 1.2525, test_f1: 0.2289
 epoch: 12, train_loss: 1.1705, test_loss: 1.2400, test_f1: 0.2345
 epoch: 13, train_loss: 1.1602, test_loss: 1.2392, test_f1: 0.2349
 epoch: 14, train_loss: 1.1546, test_loss: 1.2355, test_f1: 0.2402
 epoch: 15, train_loss: 1.1509, test_loss: 1.2315, test_f1: 0.2405
 epoch: 16, train_loss: 1.1457, test_loss: 1.2230, test_f1: 0.2399
 epoch: 17, train_loss: 1.1413, test_loss: 1.2217, test_f1: 0.2453
 epoch: 18, train_loss: 1.1342, test_loss: 1.2190, test_f1: 0.2457
 epoch: 19, train_loss: 1.1341, test_loss: 1.2148, test_f1: 0.2453
 epoch: 20, train_loss: 1.1332, test_loss: 1.2089, test_f1: 0.2545
 epoch: 21, train_loss: 1.1216, test_loss: 1.2024, test_f1: 0.2899
 epoch: 22, train_loss: 1.1247, test_loss: 1.1963, test_f1: 0.3069
 epoch: 23, train_loss: 1.1259, test_loss: 1.1974, test_f1: 0.3390
 epoch: 24, train_loss: 1.1194, test_loss: 1.1825, test_f1: 0.3493
 epoch: 25, train_loss: 1.1099, test_loss: 1.1734, test_f1: 0.3452
 epoch: 26, train_loss: 1.1129, test_loss: 1.1809, test_f1: 0.3323
 epoch: 27, train_loss: 1.1092, test_loss: 1.1805, test_f1: 0.3518
 epoch: 28, train_loss: 1.1063, test_loss: 1.1666, test_f1: 0.3546
 epoch: 29, train_loss: 1.1025, test_loss: 1.1755, test_f1: 0.3574
 epoch: 30, train_loss: 1.0959, test_loss: 1.1650, test_f1: 0.3601
 epoch: 31, train_loss: 1.0975, test_loss: 1.1630, test_f1: 0.3729
 epoch: 32, train_loss: 1.0985, test_loss: 1.1672, test_f1: 0.3777
 epoch: 33, train_loss: 1.0924, test_loss: 1.1544, test_f1: 0.3757
 epoch: 34, train_loss: 1.0948, test_loss: 1.1516, test_f1: 0.3839
 epoch: 35, train_loss: 1.0921, test_loss: 1.1543, test_f1: 0.4040
 epoch: 36, train_loss: 1.0873, test_loss: 1.1557, test_f1: 0.4053
 epoch: 37, train_loss: 1.0749, test_loss: 1.1549, test_f1: 0.4175
 epoch: 38, train_loss: 1.0819, test_loss: 1.1529, test_f1: 0.4195
 epoch: 39, train_loss: 1.0787, test_loss: 1.1538, test_f1: 0.4220
 epoch: 40, train_loss: 1.0779, test_loss: 1.1501, test_f1: 0.4145
 epoch: 41, train_loss: 1.0734, test_loss: 1.1568, test_f1: 0.4226
 epoch: 42, train_loss: 1.0717, test_loss: 1.1530, test_f1: 0.4216
 epoch: 43, train_loss: 1.0648, test_loss: 1.1438, test_f1: 0.4246
 epoch: 44, train_loss: 1.0702, test_loss: 1.1408, test_f1: 0.4208
 epoch: 45, train_loss: 1.0658, test_loss: 1.1466, test_f1: 0.4243
 epoch: 46, train_loss: 1.0661, test_loss: 1.1407, test_f1: 0.4229
 epoch: 47, train_loss: 1.0764, test_loss: 1.1478, test_f1: 0.4308
 epoch: 48, train_loss: 1.0673, test_loss: 1.1438, test_f1: 0.4236
 epoch: 49, train_loss: 1.0646, test_loss: 1.1362, test_f1: 0.4261
 epoch: 50, train_loss: 1.0537, test_loss: 1.1322, test_f1: 0.4292
 epoch: 51, train_loss: 1.0603, test_loss: 1.1289, test_f1: 0.4243
 epoch: 52, train_loss: 1.0570, test_loss: 1.1361, test_f1: 0.4243
 epoch: 53, train_loss: 1.0448, test_loss: 1.1338, test_f1: 0.4222
 epoch: 54, train_loss: 1.0462, test_loss: 1.1358, test_f1: 0.4230
 epoch: 55, train_loss: 1.0533, test_loss: 1.1356, test_f1: 0.4268
 epoch: 56, train_loss: 1.0507, test_loss: 1.1341, test_f1: 0.4203
 epoch: 57, train_loss: 1.0486, test_loss: 1.1379, test_f1: 0.4263
 epoch: 58, train_loss: 1.0516, test_loss: 1.1386, test_f1: 0.4203
 epoch: 59, train_loss: 1.0480, test_loss: 1.1310, test_f1: 0.4283
 epoch: 60, train_loss: 1.0555, test_loss: 1.1298, test_f1: 0.4282
 epoch: 61, train_loss: 1.0552, test_loss: 1.1311, test_f1: 0.4241
 epoch: 62, train_loss: 1.0455, test_loss: 1.1316, test_f1: 0.4249
 epoch: 63, train_loss: 1.0521, test_loss: 1.1314, test_f1: 0.4281
 epoch: 64, train_loss: 1.0351, test_loss: 1.1351, test_f1: 0.4328
 epoch: 65, train_loss: 1.0382, test_loss: 1.1259, test_f1: 0.4292
 epoch: 66, train_loss: 1.0430, test_loss: 1.1342, test_f1: 0.4264
 epoch: 67, train_loss: 1.0449, test_loss: 1.1236, test_f1: 0.4283
 epoch: 68, train_loss: 1.0493, test_loss: 1.1216, test_f1: 0.4312
 epoch: 69, train_loss: 1.0438, test_loss: 1.1209, test_f1: 0.4326
 epoch: 70, train_loss: 1.0338, test_loss: 1.1183, test_f1: 0.4218
 epoch: 71, train_loss: 1.0380, test_loss: 1.1195, test_f1: 0.4218
 epoch: 72, train_loss: 1.0325, test_loss: 1.1145, test_f1: 0.4272
 epoch: 73, train_loss: 1.0344, test_loss: 1.1146, test_f1: 0.4302
 epoch: 74, train_loss: 1.0435, test_loss: 1.1255, test_f1: 0.4344
 epoch: 75, train_loss: 1.0356, test_loss: 1.1165, test_f1: 0.4350
 epoch: 76, train_loss: 1.0405, test_loss: 1.1291, test_f1: 0.4312
 epoch: 77, train_loss: 1.0419, test_loss: 1.1170, test_f1: 0.4380
 epoch: 78, train_loss: 1.0394, test_loss: 1.1202, test_f1: 0.4357
 epoch: 79, train_loss: 1.0410, test_loss: 1.1219, test_f1: 0.4339
 epoch: 80, train_loss: 1.0241, test_loss: 1.1161, test_f1: 0.4368
 epoch: 81, train_loss: 1.0298, test_loss: 1.1154, test_f1: 0.4381
 epoch: 82, train_loss: 1.0344, test_loss: 1.1108, test_f1: 0.4400
 epoch: 83, train_loss: 1.0249, test_loss: 1.1036, test_f1: 0.4328
 epoch: 84, train_loss: 1.0227, test_loss: 1.1128, test_f1: 0.4425
 epoch: 85, train_loss: 1.0302, test_loss: 1.1146, test_f1: 0.4383
 epoch: 86, train_loss: 1.0218, test_loss: 1.1138, test_f1: 0.4425
 epoch: 87, train_loss: 1.0329, test_loss: 1.1178, test_f1: 0.4445
 epoch: 88, train_loss: 1.0178, test_loss: 1.1146, test_f1: 0.4413
 epoch: 89, train_loss: 1.0267, test_loss: 1.1110, test_f1: 0.4424
 epoch: 90, train_loss: 1.0270, test_loss: 1.1052, test_f1: 0.4417
 epoch: 91, train_loss: 1.0207, test_loss: 1.1015, test_f1: 0.4423
 epoch: 92, train_loss: 1.0214, test_loss: 1.1065, test_f1: 0.4371
 epoch: 93, train_loss: 1.0182, test_loss: 1.1016, test_f1: 0.4373
 epoch: 94, train_loss: 1.0256, test_loss: 1.0941, test_f1: 0.4374
 epoch: 95, train_loss: 1.0113, test_loss: 1.0926, test_f1: 0.4460
 epoch: 96, train_loss: 1.0177, test_loss: 1.0953, test_f1: 0.4374
 epoch: 97, train_loss: 1.0151, test_loss: 1.0997, test_f1: 0.4374
 epoch: 98, train_loss: 1.0204, test_loss: 1.0914, test_f1: 0.4464
 epoch: 99, train_loss: 1.0155, test_loss: 1.0984, test_f1: 0.4448
##################ITERATION #7 ****************************************
 epoch: 0, train_loss: 1.2922, test_loss: 1.3908, test_f1: 0.2281
 epoch: 1, train_loss: 1.2479, test_loss: 1.3950, test_f1: 0.2117
 epoch: 2, train_loss: 1.2240, test_loss: 1.3989, test_f1: 0.1814
 epoch: 3, train_loss: 1.2117, test_loss: 1.3798, test_f1: 0.2304
 epoch: 4, train_loss: 1.1966, test_loss: 1.3591, test_f1: 0.2629
 epoch: 5, train_loss: 1.1882, test_loss: 1.3349, test_f1: 0.2693
 epoch: 6, train_loss: 1.1798, test_loss: 1.2737, test_f1: 0.2747
 epoch: 7, train_loss: 1.1764, test_loss: 1.2289, test_f1: 0.2607
 epoch: 8, train_loss: 1.1569, test_loss: 1.2073, test_f1: 0.2879
 epoch: 9, train_loss: 1.1542, test_loss: 1.1947, test_f1: 0.3279
 epoch: 10, train_loss: 1.1486, test_loss: 1.1966, test_f1: 0.3348
 epoch: 11, train_loss: 1.1355, test_loss: 1.1922, test_f1: 0.3315
 epoch: 12, train_loss: 1.1302, test_loss: 1.1839, test_f1: 0.3496
 epoch: 13, train_loss: 1.1247, test_loss: 1.1866, test_f1: 0.3526
 epoch: 14, train_loss: 1.1338, test_loss: 1.1774, test_f1: 0.3766
 epoch: 15, train_loss: 1.1265, test_loss: 1.1710, test_f1: 0.3798
 epoch: 16, train_loss: 1.1256, test_loss: 1.1754, test_f1: 0.3784
 epoch: 17, train_loss: 1.1155, test_loss: 1.1628, test_f1: 0.3989
 epoch: 18, train_loss: 1.1090, test_loss: 1.1607, test_f1: 0.4008
 epoch: 19, train_loss: 1.1160, test_loss: 1.1577, test_f1: 0.4094
 epoch: 20, train_loss: 1.1018, test_loss: 1.1523, test_f1: 0.4158
 epoch: 21, train_loss: 1.1018, test_loss: 1.1467, test_f1: 0.4239
 epoch: 22, train_loss: 1.1012, test_loss: 1.1452, test_f1: 0.4191
 epoch: 23, train_loss: 1.0947, test_loss: 1.1431, test_f1: 0.4142
 epoch: 24, train_loss: 1.0842, test_loss: 1.1426, test_f1: 0.4158
 epoch: 25, train_loss: 1.0892, test_loss: 1.1369, test_f1: 0.4415
 epoch: 26, train_loss: 1.0859, test_loss: 1.1340, test_f1: 0.4447
 epoch: 27, train_loss: 1.0855, test_loss: 1.1324, test_f1: 0.4493
 epoch: 28, train_loss: 1.0893, test_loss: 1.1358, test_f1: 0.4405
 epoch: 29, train_loss: 1.0800, test_loss: 1.1356, test_f1: 0.4371
 epoch: 30, train_loss: 1.0688, test_loss: 1.1334, test_f1: 0.4299
 epoch: 31, train_loss: 1.0720, test_loss: 1.1279, test_f1: 0.4428
 epoch: 32, train_loss: 1.0732, test_loss: 1.1357, test_f1: 0.4456
 epoch: 33, train_loss: 1.0724, test_loss: 1.1327, test_f1: 0.4503
 epoch: 34, train_loss: 1.0684, test_loss: 1.1262, test_f1: 0.4491
 epoch: 35, train_loss: 1.0666, test_loss: 1.1208, test_f1: 0.4499
 epoch: 36, train_loss: 1.0646, test_loss: 1.1348, test_f1: 0.4517
 epoch: 37, train_loss: 1.0664, test_loss: 1.1336, test_f1: 0.4533
 epoch: 38, train_loss: 1.0543, test_loss: 1.1269, test_f1: 0.4566
 epoch: 39, train_loss: 1.0531, test_loss: 1.1343, test_f1: 0.4555
 epoch: 40, train_loss: 1.0641, test_loss: 1.1295, test_f1: 0.4382
 epoch: 41, train_loss: 1.0518, test_loss: 1.1196, test_f1: 0.4526
 epoch: 42, train_loss: 1.0447, test_loss: 1.1186, test_f1: 0.4398
 epoch: 43, train_loss: 1.0495, test_loss: 1.1296, test_f1: 0.4413
 epoch: 44, train_loss: 1.0417, test_loss: 1.1383, test_f1: 0.4600
 epoch: 45, train_loss: 1.0359, test_loss: 1.1387, test_f1: 0.4533
 epoch: 46, train_loss: 1.0404, test_loss: 1.1300, test_f1: 0.4455
 epoch: 47, train_loss: 1.0474, test_loss: 1.1284, test_f1: 0.4498
 epoch: 48, train_loss: 1.0511, test_loss: 1.1164, test_f1: 0.4520
 epoch: 49, train_loss: 1.0374, test_loss: 1.1282, test_f1: 0.4482
 epoch: 50, train_loss: 1.0360, test_loss: 1.1181, test_f1: 0.4491
 epoch: 51, train_loss: 1.0274, test_loss: 1.1217, test_f1: 0.4431
 epoch: 52, train_loss: 1.0282, test_loss: 1.1150, test_f1: 0.4475
 epoch: 53, train_loss: 1.0395, test_loss: 1.1124, test_f1: 0.4498
 epoch: 54, train_loss: 1.0369, test_loss: 1.1126, test_f1: 0.4546
 epoch: 55, train_loss: 1.0330, test_loss: 1.1253, test_f1: 0.4520
 epoch: 56, train_loss: 1.0354, test_loss: 1.1138, test_f1: 0.4498
 epoch: 57, train_loss: 1.0271, test_loss: 1.1382, test_f1: 0.4460
 epoch: 58, train_loss: 1.0294, test_loss: 1.1168, test_f1: 0.4482
 epoch: 59, train_loss: 1.0350, test_loss: 1.1499, test_f1: 0.4438
 epoch: 60, train_loss: 1.0312, test_loss: 1.1754, test_f1: 0.4418
 epoch: 61, train_loss: 1.0303, test_loss: 1.1116, test_f1: 0.4482
 epoch: 62, train_loss: 1.0279, test_loss: 1.1149, test_f1: 0.4522
 epoch: 63, train_loss: 1.0294, test_loss: 1.1198, test_f1: 0.4521
 epoch: 64, train_loss: 1.0329, test_loss: 1.1196, test_f1: 0.4462
 epoch: 65, train_loss: 1.0246, test_loss: 1.1253, test_f1: 0.4505
 epoch: 66, train_loss: 1.0247, test_loss: 1.1241, test_f1: 0.4483
 epoch: 67, train_loss: 1.0271, test_loss: 1.1269, test_f1: 0.4507
 epoch: 68, train_loss: 1.0285, test_loss: 1.1236, test_f1: 0.4498
 epoch: 69, train_loss: 1.0282, test_loss: 1.1396, test_f1: 0.4548
 epoch: 70, train_loss: 1.0207, test_loss: 1.1226, test_f1: 0.4482
 epoch: 71, train_loss: 1.0158, test_loss: 1.1734, test_f1: 0.4390
 epoch: 72, train_loss: 1.0251, test_loss: 1.1264, test_f1: 0.4521
 epoch: 73, train_loss: 1.0279, test_loss: 1.1232, test_f1: 0.4409
 epoch: 74, train_loss: 1.0145, test_loss: 1.1314, test_f1: 0.4418
 epoch: 75, train_loss: 1.0136, test_loss: 1.1294, test_f1: 0.4455
 epoch: 76, train_loss: 1.0172, test_loss: 1.1235, test_f1: 0.4560
 epoch: 77, train_loss: 1.0197, test_loss: 1.1082, test_f1: 0.4596
 epoch: 78, train_loss: 1.0199, test_loss: 1.1139, test_f1: 0.4533
 epoch: 79, train_loss: 1.0177, test_loss: 1.1474, test_f1: 0.4455
 epoch: 80, train_loss: 1.0236, test_loss: 1.1317, test_f1: 0.4478
 epoch: 81, train_loss: 1.0245, test_loss: 1.1260, test_f1: 0.4551
 epoch: 82, train_loss: 1.0135, test_loss: 1.1284, test_f1: 0.4522
 epoch: 83, train_loss: 1.0121, test_loss: 1.1185, test_f1: 0.4571
 epoch: 84, train_loss: 1.0227, test_loss: 1.1385, test_f1: 0.4504
 epoch: 85, train_loss: 1.0163, test_loss: 1.1192, test_f1: 0.4474
 epoch: 86, train_loss: 1.0074, test_loss: 1.1159, test_f1: 0.4522
 epoch: 87, train_loss: 1.0128, test_loss: 1.1138, test_f1: 0.4520
 epoch: 88, train_loss: 1.0057, test_loss: 1.1184, test_f1: 0.4506
 epoch: 89, train_loss: 1.0159, test_loss: 1.1129, test_f1: 0.4506
 epoch: 90, train_loss: 1.0051, test_loss: 1.1237, test_f1: 0.4466
 epoch: 91, train_loss: 1.0116, test_loss: 1.1169, test_f1: 0.4510
 epoch: 92, train_loss: 1.0002, test_loss: 1.1343, test_f1: 0.4532
 epoch: 93, train_loss: 1.0027, test_loss: 1.1086, test_f1: 0.4479
 epoch: 94, train_loss: 1.0119, test_loss: 1.1213, test_f1: 0.4531
 epoch: 95, train_loss: 1.0059, test_loss: 1.1153, test_f1: 0.4551
 epoch: 96, train_loss: 1.0023, test_loss: 1.1217, test_f1: 0.4528
 epoch: 97, train_loss: 0.9976, test_loss: 1.1126, test_f1: 0.4537
 epoch: 98, train_loss: 0.9988, test_loss: 1.1368, test_f1: 0.4475
 epoch: 99, train_loss: 1.0074, test_loss: 1.1140, test_f1: 0.4477
##################ITERATION #8 ****************************************
 epoch: 0, train_loss: 1.2668, test_loss: 1.3559, test_f1: 0.2281
 epoch: 1, train_loss: 1.2464, test_loss: 1.3360, test_f1: 0.2281
 epoch: 2, train_loss: 1.2187, test_loss: 1.3290, test_f1: 0.2281
 epoch: 3, train_loss: 1.2088, test_loss: 1.3148, test_f1: 0.2281
 epoch: 4, train_loss: 1.2055, test_loss: 1.2977, test_f1: 0.2341
 epoch: 5, train_loss: 1.1907, test_loss: 1.2757, test_f1: 0.2397
 epoch: 6, train_loss: 1.1848, test_loss: 1.2488, test_f1: 0.2384
 epoch: 7, train_loss: 1.1746, test_loss: 1.2338, test_f1: 0.2391
 epoch: 8, train_loss: 1.1702, test_loss: 1.2287, test_f1: 0.2422
 epoch: 9, train_loss: 1.1616, test_loss: 1.2210, test_f1: 0.2689
 epoch: 10, train_loss: 1.1531, test_loss: 1.2137, test_f1: 0.2741
 epoch: 11, train_loss: 1.1542, test_loss: 1.2084, test_f1: 0.2814
 epoch: 12, train_loss: 1.1453, test_loss: 1.2006, test_f1: 0.2887
 epoch: 13, train_loss: 1.1406, test_loss: 1.1959, test_f1: 0.3019
 epoch: 14, train_loss: 1.1315, test_loss: 1.1871, test_f1: 0.2965
 epoch: 15, train_loss: 1.1279, test_loss: 1.1840, test_f1: 0.3131
 epoch: 16, train_loss: 1.1208, test_loss: 1.1807, test_f1: 0.3348
 epoch: 17, train_loss: 1.1126, test_loss: 1.1766, test_f1: 0.3440
 epoch: 18, train_loss: 1.1154, test_loss: 1.1730, test_f1: 0.3462
 epoch: 19, train_loss: 1.1033, test_loss: 1.1690, test_f1: 0.3603
 epoch: 20, train_loss: 1.1028, test_loss: 1.1689, test_f1: 0.3619
 epoch: 21, train_loss: 1.1001, test_loss: 1.1640, test_f1: 0.3691
 epoch: 22, train_loss: 1.1040, test_loss: 1.1618, test_f1: 0.3893
 epoch: 23, train_loss: 1.0948, test_loss: 1.1579, test_f1: 0.4039
 epoch: 24, train_loss: 1.0876, test_loss: 1.1587, test_f1: 0.3957
 epoch: 25, train_loss: 1.0944, test_loss: 1.1513, test_f1: 0.3998
 epoch: 26, train_loss: 1.0877, test_loss: 1.1509, test_f1: 0.4054
 epoch: 27, train_loss: 1.0920, test_loss: 1.1491, test_f1: 0.4018
 epoch: 28, train_loss: 1.0820, test_loss: 1.1454, test_f1: 0.4100
 epoch: 29, train_loss: 1.0862, test_loss: 1.1473, test_f1: 0.4039
 epoch: 30, train_loss: 1.0701, test_loss: 1.1452, test_f1: 0.4235
 epoch: 31, train_loss: 1.0669, test_loss: 1.1441, test_f1: 0.4205
 epoch: 32, train_loss: 1.0761, test_loss: 1.1356, test_f1: 0.4203
 epoch: 33, train_loss: 1.0738, test_loss: 1.1379, test_f1: 0.4202
 epoch: 34, train_loss: 1.0631, test_loss: 1.1414, test_f1: 0.4390
 epoch: 35, train_loss: 1.0658, test_loss: 1.1401, test_f1: 0.4171
 epoch: 36, train_loss: 1.0641, test_loss: 1.1372, test_f1: 0.4189
 epoch: 37, train_loss: 1.0668, test_loss: 1.1307, test_f1: 0.4316
 epoch: 38, train_loss: 1.0615, test_loss: 1.1264, test_f1: 0.4181
 epoch: 39, train_loss: 1.0615, test_loss: 1.1292, test_f1: 0.4338
 epoch: 40, train_loss: 1.0523, test_loss: 1.1288, test_f1: 0.4410
 epoch: 41, train_loss: 1.0543, test_loss: 1.1294, test_f1: 0.4369
 epoch: 42, train_loss: 1.0524, test_loss: 1.1278, test_f1: 0.4390
 epoch: 43, train_loss: 1.0514, test_loss: 1.1275, test_f1: 0.4349
 epoch: 44, train_loss: 1.0440, test_loss: 1.1330, test_f1: 0.4393
 epoch: 45, train_loss: 1.0462, test_loss: 1.1331, test_f1: 0.4391
 epoch: 46, train_loss: 1.0413, test_loss: 1.1274, test_f1: 0.4462
 epoch: 47, train_loss: 1.0453, test_loss: 1.1219, test_f1: 0.4382
 epoch: 48, train_loss: 1.0445, test_loss: 1.1198, test_f1: 0.4431
 epoch: 49, train_loss: 1.0460, test_loss: 1.1175, test_f1: 0.4460
 epoch: 50, train_loss: 1.0333, test_loss: 1.1101, test_f1: 0.4527
 epoch: 51, train_loss: 1.0276, test_loss: 1.1074, test_f1: 0.4462
 epoch: 52, train_loss: 1.0280, test_loss: 1.1111, test_f1: 0.4464
 epoch: 53, train_loss: 1.0283, test_loss: 1.1108, test_f1: 0.4457
 epoch: 54, train_loss: 1.0308, test_loss: 1.1078, test_f1: 0.4478
 epoch: 55, train_loss: 1.0298, test_loss: 1.1112, test_f1: 0.4443
 epoch: 56, train_loss: 1.0254, test_loss: 1.1073, test_f1: 0.4416
 epoch: 57, train_loss: 1.0164, test_loss: 1.1090, test_f1: 0.4454
 epoch: 58, train_loss: 1.0281, test_loss: 1.1008, test_f1: 0.4547
 epoch: 59, train_loss: 1.0321, test_loss: 1.1037, test_f1: 0.4425
 epoch: 60, train_loss: 1.0294, test_loss: 1.1066, test_f1: 0.4423
 epoch: 61, train_loss: 1.0242, test_loss: 1.0940, test_f1: 0.4497
 epoch: 62, train_loss: 1.0214, test_loss: 1.0978, test_f1: 0.4463
 epoch: 63, train_loss: 1.0218, test_loss: 1.0989, test_f1: 0.4459
 epoch: 64, train_loss: 1.0219, test_loss: 1.1062, test_f1: 0.4470
 epoch: 65, train_loss: 1.0241, test_loss: 1.1087, test_f1: 0.4489
 epoch: 66, train_loss: 1.0182, test_loss: 1.1017, test_f1: 0.4460
 epoch: 67, train_loss: 1.0232, test_loss: 1.0945, test_f1: 0.4471
 epoch: 68, train_loss: 1.0186, test_loss: 1.0960, test_f1: 0.4460
 epoch: 69, train_loss: 1.0195, test_loss: 1.1004, test_f1: 0.4535
 epoch: 70, train_loss: 1.0169, test_loss: 1.0967, test_f1: 0.4554
 epoch: 71, train_loss: 1.0155, test_loss: 1.0987, test_f1: 0.4526
 epoch: 72, train_loss: 1.0080, test_loss: 1.1028, test_f1: 0.4491
 epoch: 73, train_loss: 1.0144, test_loss: 1.1013, test_f1: 0.4575
 epoch: 74, train_loss: 1.0168, test_loss: 1.1045, test_f1: 0.4490
 epoch: 75, train_loss: 1.0090, test_loss: 1.0961, test_f1: 0.4545
 epoch: 76, train_loss: 1.0115, test_loss: 1.0977, test_f1: 0.4546
 epoch: 77, train_loss: 1.0149, test_loss: 1.0947, test_f1: 0.4564
 epoch: 78, train_loss: 1.0060, test_loss: 1.0861, test_f1: 0.4545
 epoch: 79, train_loss: 1.0107, test_loss: 1.0925, test_f1: 0.4523
 epoch: 80, train_loss: 1.0107, test_loss: 1.0968, test_f1: 0.4555
 epoch: 81, train_loss: 1.0110, test_loss: 1.0952, test_f1: 0.4574
 epoch: 82, train_loss: 0.9976, test_loss: 1.0962, test_f1: 0.4563
 epoch: 83, train_loss: 0.9985, test_loss: 1.1045, test_f1: 0.4473
 epoch: 84, train_loss: 1.0119, test_loss: 1.0973, test_f1: 0.4494
 epoch: 85, train_loss: 0.9965, test_loss: 1.1021, test_f1: 0.4493
 epoch: 86, train_loss: 1.0031, test_loss: 1.0997, test_f1: 0.4511
 epoch: 87, train_loss: 0.9989, test_loss: 1.0913, test_f1: 0.4546
 epoch: 88, train_loss: 1.0074, test_loss: 1.0915, test_f1: 0.4464
 epoch: 89, train_loss: 1.0004, test_loss: 1.0942, test_f1: 0.4498
 epoch: 90, train_loss: 1.0019, test_loss: 1.0904, test_f1: 0.4539
 epoch: 91, train_loss: 1.0057, test_loss: 1.0918, test_f1: 0.4562
 epoch: 92, train_loss: 0.9953, test_loss: 1.0877, test_f1: 0.4542
 epoch: 93, train_loss: 0.9896, test_loss: 1.0939, test_f1: 0.4542
 epoch: 94, train_loss: 1.0026, test_loss: 1.0913, test_f1: 0.4490
 epoch: 95, train_loss: 1.0019, test_loss: 1.0932, test_f1: 0.4522
 epoch: 96, train_loss: 0.9904, test_loss: 1.0912, test_f1: 0.4479
 epoch: 97, train_loss: 0.9865, test_loss: 1.0957, test_f1: 0.4460
 epoch: 98, train_loss: 0.9977, test_loss: 1.0963, test_f1: 0.4478
 epoch: 99, train_loss: 0.9864, test_loss: 1.0896, test_f1: 0.4478
##################ITERATION #9 ****************************************
 epoch: 0, train_loss: 1.3002, test_loss: 1.4260, test_f1: 0.0848
 epoch: 1, train_loss: 1.2317, test_loss: 1.3686, test_f1: 0.2281
 epoch: 2, train_loss: 1.2212, test_loss: 1.3436, test_f1: 0.2261
 epoch: 3, train_loss: 1.2004, test_loss: 1.3220, test_f1: 0.2354
 epoch: 4, train_loss: 1.1924, test_loss: 1.2923, test_f1: 0.2657
 epoch: 5, train_loss: 1.1818, test_loss: 1.2831, test_f1: 0.2961
 epoch: 6, train_loss: 1.1777, test_loss: 1.2640, test_f1: 0.2980
 epoch: 7, train_loss: 1.1694, test_loss: 1.2466, test_f1: 0.2983
 epoch: 8, train_loss: 1.1581, test_loss: 1.2296, test_f1: 0.3046
 epoch: 9, train_loss: 1.1478, test_loss: 1.2201, test_f1: 0.3032
 epoch: 10, train_loss: 1.1436, test_loss: 1.2175, test_f1: 0.3158
 epoch: 11, train_loss: 1.1422, test_loss: 1.2106, test_f1: 0.3115
 epoch: 12, train_loss: 1.1420, test_loss: 1.2049, test_f1: 0.3133
 epoch: 13, train_loss: 1.1339, test_loss: 1.2035, test_f1: 0.3086
 epoch: 14, train_loss: 1.1281, test_loss: 1.2040, test_f1: 0.3113
 epoch: 15, train_loss: 1.1296, test_loss: 1.1941, test_f1: 0.3116
 epoch: 16, train_loss: 1.1251, test_loss: 1.1926, test_f1: 0.3334
 epoch: 17, train_loss: 1.1178, test_loss: 1.1950, test_f1: 0.3218
 epoch: 18, train_loss: 1.1092, test_loss: 1.1899, test_f1: 0.3252
 epoch: 19, train_loss: 1.1086, test_loss: 1.1863, test_f1: 0.3272
 epoch: 20, train_loss: 1.1113, test_loss: 1.1836, test_f1: 0.3284
 epoch: 21, train_loss: 1.0981, test_loss: 1.1821, test_f1: 0.3252
 epoch: 22, train_loss: 1.1085, test_loss: 1.1788, test_f1: 0.3307
 epoch: 23, train_loss: 1.1036, test_loss: 1.1756, test_f1: 0.3409
 epoch: 24, train_loss: 1.0982, test_loss: 1.1708, test_f1: 0.3832
 epoch: 25, train_loss: 1.0893, test_loss: 1.1674, test_f1: 0.3870
 epoch: 26, train_loss: 1.0926, test_loss: 1.1693, test_f1: 0.3313
 epoch: 27, train_loss: 1.0920, test_loss: 1.1715, test_f1: 0.3749
 epoch: 28, train_loss: 1.0845, test_loss: 1.1703, test_f1: 0.3953
 epoch: 29, train_loss: 1.0841, test_loss: 1.1668, test_f1: 0.3978
 epoch: 30, train_loss: 1.0826, test_loss: 1.1657, test_f1: 0.3798
 epoch: 31, train_loss: 1.0772, test_loss: 1.1656, test_f1: 0.4047
 epoch: 32, train_loss: 1.0821, test_loss: 1.1635, test_f1: 0.3780
 epoch: 33, train_loss: 1.0785, test_loss: 1.1645, test_f1: 0.3842
 epoch: 34, train_loss: 1.0772, test_loss: 1.1612, test_f1: 0.3987
 epoch: 35, train_loss: 1.0821, test_loss: 1.1568, test_f1: 0.3883
 epoch: 36, train_loss: 1.0689, test_loss: 1.1580, test_f1: 0.3942
 epoch: 37, train_loss: 1.0666, test_loss: 1.1611, test_f1: 0.4131
 epoch: 38, train_loss: 1.0647, test_loss: 1.1629, test_f1: 0.4047
 epoch: 39, train_loss: 1.0673, test_loss: 1.1564, test_f1: 0.4194
 epoch: 40, train_loss: 1.0662, test_loss: 1.1597, test_f1: 0.3921
 epoch: 41, train_loss: 1.0585, test_loss: 1.1597, test_f1: 0.3935
 epoch: 42, train_loss: 1.0594, test_loss: 1.1604, test_f1: 0.4160
 epoch: 43, train_loss: 1.0610, test_loss: 1.1560, test_f1: 0.4301
 epoch: 44, train_loss: 1.0531, test_loss: 1.1453, test_f1: 0.4252
 epoch: 45, train_loss: 1.0640, test_loss: 1.1500, test_f1: 0.4206
 epoch: 46, train_loss: 1.0481, test_loss: 1.1487, test_f1: 0.4092
 epoch: 47, train_loss: 1.0590, test_loss: 1.1450, test_f1: 0.4231
 epoch: 48, train_loss: 1.0489, test_loss: 1.1494, test_f1: 0.4312
 epoch: 49, train_loss: 1.0562, test_loss: 1.1506, test_f1: 0.4290
 epoch: 50, train_loss: 1.0490, test_loss: 1.1448, test_f1: 0.4224
 epoch: 51, train_loss: 1.0443, test_loss: 1.1433, test_f1: 0.4246
 epoch: 52, train_loss: 1.0404, test_loss: 1.1429, test_f1: 0.4224
 epoch: 53, train_loss: 1.0466, test_loss: 1.1419, test_f1: 0.4311
 epoch: 54, train_loss: 1.0478, test_loss: 1.1389, test_f1: 0.4275
 epoch: 55, train_loss: 1.0459, test_loss: 1.1385, test_f1: 0.4263
 epoch: 56, train_loss: 1.0341, test_loss: 1.1424, test_f1: 0.4275
 epoch: 57, train_loss: 1.0485, test_loss: 1.1417, test_f1: 0.4189
 epoch: 58, train_loss: 1.0451, test_loss: 1.1390, test_f1: 0.4268
 epoch: 59, train_loss: 1.0384, test_loss: 1.1382, test_f1: 0.4190
 epoch: 60, train_loss: 1.0374, test_loss: 1.1408, test_f1: 0.4224
 epoch: 61, train_loss: 1.0382, test_loss: 1.1390, test_f1: 0.4177
 epoch: 62, train_loss: 1.0307, test_loss: 1.1370, test_f1: 0.4323
 epoch: 63, train_loss: 1.0326, test_loss: 1.1415, test_f1: 0.4414
 epoch: 64, train_loss: 1.0443, test_loss: 1.1379, test_f1: 0.4291
 epoch: 65, train_loss: 1.0322, test_loss: 1.1382, test_f1: 0.4267
 epoch: 66, train_loss: 1.0325, test_loss: 1.1383, test_f1: 0.4249
 epoch: 67, train_loss: 1.0289, test_loss: 1.1421, test_f1: 0.4260
 epoch: 68, train_loss: 1.0217, test_loss: 1.1386, test_f1: 0.4251
 epoch: 69, train_loss: 1.0382, test_loss: 1.1382, test_f1: 0.4468
 epoch: 70, train_loss: 1.0265, test_loss: 1.1418, test_f1: 0.4304
 epoch: 71, train_loss: 1.0339, test_loss: 1.1386, test_f1: 0.4298
 epoch: 72, train_loss: 1.0318, test_loss: 1.1363, test_f1: 0.4269
 epoch: 73, train_loss: 1.0290, test_loss: 1.1376, test_f1: 0.4207
 epoch: 74, train_loss: 1.0210, test_loss: 1.1365, test_f1: 0.4400
 epoch: 75, train_loss: 1.0222, test_loss: 1.1421, test_f1: 0.4414
 epoch: 76, train_loss: 1.0309, test_loss: 1.1425, test_f1: 0.4392
 epoch: 77, train_loss: 1.0288, test_loss: 1.1436, test_f1: 0.4458
 epoch: 78, train_loss: 1.0250, test_loss: 1.1362, test_f1: 0.4429
 epoch: 79, train_loss: 1.0304, test_loss: 1.1346, test_f1: 0.4420
 epoch: 80, train_loss: 1.0259, test_loss: 1.1427, test_f1: 0.4501
 epoch: 81, train_loss: 1.0347, test_loss: 1.1397, test_f1: 0.4463
 epoch: 82, train_loss: 1.0258, test_loss: 1.1325, test_f1: 0.4385
 epoch: 83, train_loss: 1.0201, test_loss: 1.1345, test_f1: 0.4400
 epoch: 84, train_loss: 1.0284, test_loss: 1.1388, test_f1: 0.4396
 epoch: 85, train_loss: 1.0130, test_loss: 1.1361, test_f1: 0.4364
 epoch: 86, train_loss: 1.0201, test_loss: 1.1360, test_f1: 0.4505
 epoch: 87, train_loss: 1.0132, test_loss: 1.1319, test_f1: 0.4506
 epoch: 88, train_loss: 1.0234, test_loss: 1.1395, test_f1: 0.4433
 epoch: 89, train_loss: 1.0221, test_loss: 1.1434, test_f1: 0.4535
 epoch: 90, train_loss: 1.0166, test_loss: 1.1323, test_f1: 0.4345
 epoch: 91, train_loss: 1.0173, test_loss: 1.1358, test_f1: 0.4398
 epoch: 92, train_loss: 1.0216, test_loss: 1.1344, test_f1: 0.4347
 epoch: 93, train_loss: 1.0288, test_loss: 1.1389, test_f1: 0.4473
 epoch: 94, train_loss: 1.0067, test_loss: 1.1367, test_f1: 0.4554
 epoch: 95, train_loss: 1.0124, test_loss: 1.1412, test_f1: 0.4552
 epoch: 96, train_loss: 1.0139, test_loss: 1.1427, test_f1: 0.4461
 epoch: 97, train_loss: 1.0102, test_loss: 1.1398, test_f1: 0.4497
 epoch: 98, train_loss: 1.0204, test_loss: 1.1324, test_f1: 0.4535
 epoch: 99, train_loss: 1.0114, test_loss: 1.1321, test_f1: 0.4441

Training completed in 367.53 seconds
Best F1: 0.4804 at epoch 72
Mean F1 across iterations: 0.4494  0.0172
========================FINAL RESULTS================================
FEGIN weighted F1: 0.4804  0.0172
python main.py --data ltspice_demos --representation component_net --model FEGIN --layers 5 --hiddens 32 --batch_size 128 --lr 0.0001 --emb_size 250 --epochs 100 --save_appendix component_net_L5_H32_BS128_LR0.0001_E250 --no_val
-----



STDERR:
  File "main.py", line 370, in <module>
    main()
  File "main.py", line 254, in main
    dataset = dataset_class(
  File "/home/philip/projects/ltspice_examples_code_repo/Circuit-Completion-Using-GNNs/component_classification_with_link_prediction_head/evaluation/FEGIN/kernel/circuit_datasets.py", line 15, in __init__
    self.data, self.slices = torch.load(self.processed_paths[0])
  File "/home/philip/.local/lib/python3.8/site-packages/torch/serialization.py", line 1040, in load
    warnings.warn(
  File "/usr/lib/python3.8/warnings.py", line 109, in _showwarnmsg
    sw(msg.message, msg.category, msg.filename, msg.lineno,
  File "main.py", line 47, in warn_with_traceback
    traceback.print_stack(file=log)
/home/philip/projects/ltspice_examples_code_repo/Circuit-Completion-Using-GNNs/component_classification_with_link_prediction_head/evaluation/FEGIN/kernel/circuit_datasets.py:15: FutureWarning: You are using `torch.load` with `weights_only=False` (the current default value), which uses the default pickle module implicitly. It is possible to construct malicious pickle data which will execute arbitrary code during unpickling (See https://github.com/pytorch/pytorch/blob/main/SECURITY.md#untrusted-models for more details). In a future release, the default value for `weights_only` will be flipped to `True`. This limits the functions that could be executed during unpickling. Arbitrary objects will no longer be allowed to be loaded via this mode unless they are explicitly allowlisted by the user via `torch.serialization.add_safe_globals`. We recommend you start setting `weights_only=True` for any use case where you don't have full control of the loaded file. Please open an issue on GitHub for any issues related to this experimental feature.
  self.data, self.slices = torch.load(self.processed_paths[0])
