STDOUT:
Results will be saved in /home/philip/projects/ltspice_examples_code_repo/Circuit-Completion-Using-GNNs/component_classification_with_link_prediction_head/evaluation/FEGIN/results/model_FEGIN_dataset_ltspice_examples
Command line input: python main.py --data ltspice_examples --representation component_pin --model FEGIN --layers 2 --hiddens 32 --batch_size 32 --lr 0.001 --emb_size 512 --epochs 100 --save_appendix component_pin_L2_H32_BS32_LR0.001_E512 --no_val
 is saved.
-----
ltspice_examples - FEGIN
Using 2 layers, 32 hidden units, h = 2
Loading component_pin representation dataset
ENTERED
Training FEGIN on component_pin representation
Train: 3560, Test: 848
##################ITERATION #0 ****************************************
 epoch: 0, train_loss: 1.2483, test_loss: 1.1644, test_f1: 0.3738
 epoch: 1, train_loss: 1.0509, test_loss: 1.0934, test_f1: 0.3513
 epoch: 2, train_loss: 1.0189, test_loss: 1.0357, test_f1: 0.4476
 epoch: 3, train_loss: 1.0138, test_loss: 1.0655, test_f1: 0.4708
 epoch: 4, train_loss: 0.9983, test_loss: 0.9652, test_f1: 0.4783
 epoch: 5, train_loss: 0.9639, test_loss: 0.9844, test_f1: 0.5176
 epoch: 6, train_loss: 0.9439, test_loss: 0.9628, test_f1: 0.4625
 epoch: 7, train_loss: 0.9224, test_loss: 0.9376, test_f1: 0.4584
 epoch: 8, train_loss: 0.9131, test_loss: 0.9181, test_f1: 0.5094
 epoch: 9, train_loss: 0.8949, test_loss: 0.8566, test_f1: 0.5310
 epoch: 10, train_loss: 0.8828, test_loss: 0.8961, test_f1: 0.5044
 epoch: 11, train_loss: 0.8803, test_loss: 0.9166, test_f1: 0.5036
 epoch: 12, train_loss: 0.8559, test_loss: 1.0130, test_f1: 0.4833
 epoch: 13, train_loss: 0.8469, test_loss: 0.8456, test_f1: 0.5607
 epoch: 14, train_loss: 0.8443, test_loss: 0.9262, test_f1: 0.4822
 epoch: 15, train_loss: 0.8299, test_loss: 0.8470, test_f1: 0.5166
 epoch: 16, train_loss: 0.8228, test_loss: 0.8367, test_f1: 0.5155
 epoch: 17, train_loss: 0.8102, test_loss: 0.8518, test_f1: 0.5266
 epoch: 18, train_loss: 0.7937, test_loss: 0.8876, test_f1: 0.5333
 epoch: 19, train_loss: 0.7975, test_loss: 0.8573, test_f1: 0.5412
 epoch: 20, train_loss: 0.7913, test_loss: 0.8335, test_f1: 0.5524
 epoch: 21, train_loss: 0.7813, test_loss: 0.8318, test_f1: 0.5674
 epoch: 22, train_loss: 0.7704, test_loss: 0.8461, test_f1: 0.5529
 epoch: 23, train_loss: 0.7705, test_loss: 0.8126, test_f1: 0.5569
 epoch: 24, train_loss: 0.7498, test_loss: 0.8076, test_f1: 0.5698
 epoch: 25, train_loss: 0.7620, test_loss: 0.8955, test_f1: 0.5590
 epoch: 26, train_loss: 0.7440, test_loss: 0.8671, test_f1: 0.5535
 epoch: 27, train_loss: 0.7454, test_loss: 0.8405, test_f1: 0.5653
 epoch: 28, train_loss: 0.7397, test_loss: 0.8228, test_f1: 0.5651
 epoch: 29, train_loss: 0.7402, test_loss: 0.8360, test_f1: 0.5840
 epoch: 30, train_loss: 0.7441, test_loss: 0.8084, test_f1: 0.6118
 epoch: 31, train_loss: 0.7212, test_loss: 0.8509, test_f1: 0.5756
 epoch: 32, train_loss: 0.7252, test_loss: 0.8739, test_f1: 0.6216
 epoch: 33, train_loss: 0.7186, test_loss: 0.8357, test_f1: 0.5971
 epoch: 34, train_loss: 0.7239, test_loss: 0.8293, test_f1: 0.5869
 epoch: 35, train_loss: 0.7236, test_loss: 0.8640, test_f1: 0.5596
 epoch: 36, train_loss: 0.7100, test_loss: 0.8475, test_f1: 0.5569
 epoch: 37, train_loss: 0.7155, test_loss: 0.8507, test_f1: 0.5901
 epoch: 38, train_loss: 0.7061, test_loss: 0.8576, test_f1: 0.5556
 epoch: 39, train_loss: 0.6977, test_loss: 0.9063, test_f1: 0.5584
 epoch: 40, train_loss: 0.6977, test_loss: 0.8666, test_f1: 0.5916
 epoch: 41, train_loss: 0.6842, test_loss: 0.8443, test_f1: 0.6153
 epoch: 42, train_loss: 0.6800, test_loss: 0.9466, test_f1: 0.5994
 epoch: 43, train_loss: 0.6968, test_loss: 0.8846, test_f1: 0.6297
 epoch: 44, train_loss: 0.6756, test_loss: 0.8833, test_f1: 0.6090
 epoch: 45, train_loss: 0.6863, test_loss: 0.8569, test_f1: 0.6075
 epoch: 46, train_loss: 0.6739, test_loss: 0.7938, test_f1: 0.6165
 epoch: 47, train_loss: 0.6763, test_loss: 0.8569, test_f1: 0.6279
 epoch: 48, train_loss: 0.6572, test_loss: 0.8246, test_f1: 0.6072
 epoch: 49, train_loss: 0.6759, test_loss: 0.7860, test_f1: 0.6284
 epoch: 50, train_loss: 0.6706, test_loss: 0.7998, test_f1: 0.6136
 epoch: 51, train_loss: 0.6313, test_loss: 0.8210, test_f1: 0.6070
 epoch: 52, train_loss: 0.6452, test_loss: 0.8034, test_f1: 0.6222
 epoch: 53, train_loss: 0.6383, test_loss: 0.8847, test_f1: 0.6293
 epoch: 54, train_loss: 0.6535, test_loss: 0.8510, test_f1: 0.6225
 epoch: 55, train_loss: 0.6380, test_loss: 0.8856, test_f1: 0.6284
 epoch: 56, train_loss: 0.6366, test_loss: 0.8897, test_f1: 0.6099
 epoch: 57, train_loss: 0.6320, test_loss: 0.8413, test_f1: 0.6231
 epoch: 58, train_loss: 0.6277, test_loss: 0.8202, test_f1: 0.6356
 epoch: 59, train_loss: 0.6301, test_loss: 0.8683, test_f1: 0.6289
 epoch: 60, train_loss: 0.6382, test_loss: 0.8572, test_f1: 0.6184
 epoch: 61, train_loss: 0.6344, test_loss: 0.8187, test_f1: 0.6224
 epoch: 62, train_loss: 0.6405, test_loss: 0.8872, test_f1: 0.6344
 epoch: 63, train_loss: 0.6166, test_loss: 0.9063, test_f1: 0.6220
 epoch: 64, train_loss: 0.6387, test_loss: 0.7659, test_f1: 0.6178
 epoch: 65, train_loss: 0.6298, test_loss: 0.9189, test_f1: 0.6135
 epoch: 66, train_loss: 0.6263, test_loss: 0.8925, test_f1: 0.6137
 epoch: 67, train_loss: 0.6188, test_loss: 0.7964, test_f1: 0.6256
 epoch: 68, train_loss: 0.6217, test_loss: 0.9111, test_f1: 0.6252
 epoch: 69, train_loss: 0.6052, test_loss: 0.8571, test_f1: 0.6129
 epoch: 70, train_loss: 0.6157, test_loss: 0.8524, test_f1: 0.6095
 epoch: 71, train_loss: 0.6150, test_loss: 0.8681, test_f1: 0.6228
 epoch: 72, train_loss: 0.6029, test_loss: 0.8741, test_f1: 0.6133
 epoch: 73, train_loss: 0.6114, test_loss: 0.8604, test_f1: 0.6255
 epoch: 74, train_loss: 0.6135, test_loss: 0.7975, test_f1: 0.6529
 epoch: 75, train_loss: 0.6038, test_loss: 0.8573, test_f1: 0.6299
 epoch: 76, train_loss: 0.6176, test_loss: 0.9039, test_f1: 0.6313
 epoch: 77, train_loss: 0.6081, test_loss: 0.8184, test_f1: 0.6348
 epoch: 78, train_loss: 0.5973, test_loss: 0.9153, test_f1: 0.6241
 epoch: 79, train_loss: 0.6110, test_loss: 0.8489, test_f1: 0.6160
 epoch: 80, train_loss: 0.5956, test_loss: 0.9252, test_f1: 0.6373
 epoch: 81, train_loss: 0.5973, test_loss: 0.8292, test_f1: 0.6154
 epoch: 82, train_loss: 0.6074, test_loss: 0.8719, test_f1: 0.6289
 epoch: 83, train_loss: 0.6024, test_loss: 0.8752, test_f1: 0.6312
 epoch: 84, train_loss: 0.5972, test_loss: 0.8096, test_f1: 0.6387
 epoch: 85, train_loss: 0.6021, test_loss: 0.8351, test_f1: 0.6427
 epoch: 86, train_loss: 0.5889, test_loss: 0.8481, test_f1: 0.6358
 epoch: 87, train_loss: 0.5921, test_loss: 0.8361, test_f1: 0.6371
 epoch: 88, train_loss: 0.5854, test_loss: 0.8272, test_f1: 0.6239
 epoch: 89, train_loss: 0.5943, test_loss: 0.8761, test_f1: 0.6414
 epoch: 90, train_loss: 0.5829, test_loss: 0.8006, test_f1: 0.6470
 epoch: 91, train_loss: 0.5861, test_loss: 0.7836, test_f1: 0.6206
 epoch: 92, train_loss: 0.6062, test_loss: 0.7877, test_f1: 0.6311
 epoch: 93, train_loss: 0.5770, test_loss: 0.8025, test_f1: 0.6212
 epoch: 94, train_loss: 0.5868, test_loss: 0.7597, test_f1: 0.6571
 epoch: 95, train_loss: 0.5847, test_loss: 0.8083, test_f1: 0.6447
 epoch: 96, train_loss: 0.5818, test_loss: 0.8596, test_f1: 0.6420
 epoch: 97, train_loss: 0.5735, test_loss: 0.9650, test_f1: 0.6056
 epoch: 98, train_loss: 0.5803, test_loss: 0.8752, test_f1: 0.6483
 epoch: 99, train_loss: 0.5773, test_loss: 0.8748, test_f1: 0.6469
##################ITERATION #1 ****************************************
 epoch: 0, train_loss: 1.1377, test_loss: 1.0258, test_f1: 0.4313
 epoch: 1, train_loss: 1.0218, test_loss: 1.0151, test_f1: 0.4741
 epoch: 2, train_loss: 0.9883, test_loss: 0.9926, test_f1: 0.4832
 epoch: 3, train_loss: 0.9612, test_loss: 0.9625, test_f1: 0.5191
 epoch: 4, train_loss: 0.9404, test_loss: 0.9446, test_f1: 0.5259
 epoch: 5, train_loss: 0.9217, test_loss: 0.8673, test_f1: 0.5254
 epoch: 6, train_loss: 0.9001, test_loss: 0.8837, test_f1: 0.5294
 epoch: 7, train_loss: 0.8881, test_loss: 0.8477, test_f1: 0.5562
 epoch: 8, train_loss: 0.8791, test_loss: 0.8943, test_f1: 0.5294
 epoch: 9, train_loss: 0.8744, test_loss: 0.8723, test_f1: 0.5276
 epoch: 10, train_loss: 0.8566, test_loss: 0.8502, test_f1: 0.5557
 epoch: 11, train_loss: 0.8463, test_loss: 0.9098, test_f1: 0.5654
 epoch: 12, train_loss: 0.8457, test_loss: 0.8797, test_f1: 0.5726
 epoch: 13, train_loss: 0.8339, test_loss: 0.9219, test_f1: 0.5637
 epoch: 14, train_loss: 0.8203, test_loss: 0.8779, test_f1: 0.5680
 epoch: 15, train_loss: 0.8093, test_loss: 0.8613, test_f1: 0.5565
 epoch: 16, train_loss: 0.8053, test_loss: 0.8640, test_f1: 0.5976
 epoch: 17, train_loss: 0.7907, test_loss: 0.9194, test_f1: 0.5131
 epoch: 18, train_loss: 0.7896, test_loss: 0.9223, test_f1: 0.5573
 epoch: 19, train_loss: 0.7846, test_loss: 0.8694, test_f1: 0.5480
 epoch: 20, train_loss: 0.7707, test_loss: 0.8842, test_f1: 0.5452
 epoch: 21, train_loss: 0.7712, test_loss: 0.8411, test_f1: 0.5795
 epoch: 22, train_loss: 0.7611, test_loss: 0.8449, test_f1: 0.6142
 epoch: 23, train_loss: 0.7541, test_loss: 0.8226, test_f1: 0.6152
 epoch: 24, train_loss: 0.7579, test_loss: 0.8785, test_f1: 0.5986
 epoch: 25, train_loss: 0.7427, test_loss: 0.9098, test_f1: 0.5897
 epoch: 26, train_loss: 0.7387, test_loss: 0.8753, test_f1: 0.5840
 epoch: 27, train_loss: 0.7330, test_loss: 0.8701, test_f1: 0.6230
 epoch: 28, train_loss: 0.7307, test_loss: 0.8718, test_f1: 0.6147
 epoch: 29, train_loss: 0.7357, test_loss: 0.8624, test_f1: 0.6204
 epoch: 30, train_loss: 0.7310, test_loss: 0.8826, test_f1: 0.5832
 epoch: 31, train_loss: 0.7143, test_loss: 0.8165, test_f1: 0.6243
 epoch: 32, train_loss: 0.7199, test_loss: 0.8168, test_f1: 0.6064
 epoch: 33, train_loss: 0.7137, test_loss: 0.9402, test_f1: 0.6063
 epoch: 34, train_loss: 0.7038, test_loss: 0.8364, test_f1: 0.6396
 epoch: 35, train_loss: 0.6897, test_loss: 0.8927, test_f1: 0.6113
 epoch: 36, train_loss: 0.7019, test_loss: 0.9133, test_f1: 0.6046
 epoch: 37, train_loss: 0.6923, test_loss: 0.8736, test_f1: 0.5934
 epoch: 38, train_loss: 0.6922, test_loss: 0.8778, test_f1: 0.5892
 epoch: 39, train_loss: 0.6907, test_loss: 0.9705, test_f1: 0.6074
 epoch: 40, train_loss: 0.6698, test_loss: 0.9011, test_f1: 0.6074
 epoch: 41, train_loss: 0.6669, test_loss: 0.9246, test_f1: 0.6306
 epoch: 42, train_loss: 0.6704, test_loss: 0.8987, test_f1: 0.5996
 epoch: 43, train_loss: 0.6664, test_loss: 0.8427, test_f1: 0.6262
 epoch: 44, train_loss: 0.6769, test_loss: 0.8418, test_f1: 0.5994
 epoch: 45, train_loss: 0.6533, test_loss: 0.9033, test_f1: 0.5921
 epoch: 46, train_loss: 0.6598, test_loss: 0.8061, test_f1: 0.6496
 epoch: 47, train_loss: 0.6558, test_loss: 0.8584, test_f1: 0.6149
 epoch: 48, train_loss: 0.6611, test_loss: 0.9946, test_f1: 0.5620
 epoch: 49, train_loss: 0.6494, test_loss: 0.8552, test_f1: 0.6124
 epoch: 50, train_loss: 0.6541, test_loss: 0.7897, test_f1: 0.6676
 epoch: 51, train_loss: 0.6135, test_loss: 0.8894, test_f1: 0.6308
 epoch: 52, train_loss: 0.6186, test_loss: 0.8752, test_f1: 0.6338
 epoch: 53, train_loss: 0.6148, test_loss: 0.9164, test_f1: 0.6306
 epoch: 54, train_loss: 0.6065, test_loss: 0.8274, test_f1: 0.6585
 epoch: 55, train_loss: 0.6001, test_loss: 0.8881, test_f1: 0.6300
 epoch: 56, train_loss: 0.6027, test_loss: 0.8355, test_f1: 0.6559
 epoch: 57, train_loss: 0.6093, test_loss: 0.8322, test_f1: 0.6428
 epoch: 58, train_loss: 0.6105, test_loss: 0.8396, test_f1: 0.6451
 epoch: 59, train_loss: 0.5990, test_loss: 0.9702, test_f1: 0.6121
 epoch: 60, train_loss: 0.5896, test_loss: 0.9584, test_f1: 0.6547
 epoch: 61, train_loss: 0.5967, test_loss: 0.9343, test_f1: 0.6236
 epoch: 62, train_loss: 0.5870, test_loss: 0.8843, test_f1: 0.6540
 epoch: 63, train_loss: 0.5926, test_loss: 0.8673, test_f1: 0.6410
 epoch: 64, train_loss: 0.5951, test_loss: 1.0312, test_f1: 0.6153
 epoch: 65, train_loss: 0.5865, test_loss: 0.9279, test_f1: 0.6286
 epoch: 66, train_loss: 0.5953, test_loss: 0.9070, test_f1: 0.6301
 epoch: 67, train_loss: 0.5730, test_loss: 0.8621, test_f1: 0.6494
 epoch: 68, train_loss: 0.5812, test_loss: 0.7806, test_f1: 0.6810
 epoch: 69, train_loss: 0.5636, test_loss: 0.8344, test_f1: 0.6501
 epoch: 70, train_loss: 0.5713, test_loss: 0.8998, test_f1: 0.6371
 epoch: 71, train_loss: 0.5651, test_loss: 0.9925, test_f1: 0.6108
 epoch: 72, train_loss: 0.5656, test_loss: 1.0184, test_f1: 0.6261
 epoch: 73, train_loss: 0.5683, test_loss: 0.9313, test_f1: 0.6207
 epoch: 74, train_loss: 0.5693, test_loss: 0.9242, test_f1: 0.6173
 epoch: 75, train_loss: 0.5663, test_loss: 0.9238, test_f1: 0.6405
 epoch: 76, train_loss: 0.5572, test_loss: 0.8206, test_f1: 0.6762
 epoch: 77, train_loss: 0.5676, test_loss: 0.8437, test_f1: 0.6520
 epoch: 78, train_loss: 0.5619, test_loss: 0.8422, test_f1: 0.6629
 epoch: 79, train_loss: 0.5540, test_loss: 0.8995, test_f1: 0.6622
 epoch: 80, train_loss: 0.5475, test_loss: 0.9961, test_f1: 0.6434
 epoch: 81, train_loss: 0.5522, test_loss: 0.9395, test_f1: 0.6255
 epoch: 82, train_loss: 0.5442, test_loss: 0.9537, test_f1: 0.6436
 epoch: 83, train_loss: 0.5520, test_loss: 0.9669, test_f1: 0.6277
 epoch: 84, train_loss: 0.5595, test_loss: 1.0125, test_f1: 0.6332
 epoch: 85, train_loss: 0.5494, test_loss: 0.9308, test_f1: 0.6465
 epoch: 86, train_loss: 0.5350, test_loss: 0.9679, test_f1: 0.6515
 epoch: 87, train_loss: 0.5563, test_loss: 0.9691, test_f1: 0.6647
 epoch: 88, train_loss: 0.5413, test_loss: 0.9569, test_f1: 0.6553
 epoch: 89, train_loss: 0.5643, test_loss: 0.9581, test_f1: 0.6437
 epoch: 90, train_loss: 0.5349, test_loss: 0.9734, test_f1: 0.6670
 epoch: 91, train_loss: 0.5568, test_loss: 0.9129, test_f1: 0.6209
 epoch: 92, train_loss: 0.5482, test_loss: 0.8570, test_f1: 0.6697
 epoch: 93, train_loss: 0.5416, test_loss: 0.9783, test_f1: 0.6433
 epoch: 94, train_loss: 0.5351, test_loss: 0.9524, test_f1: 0.6161
 epoch: 95, train_loss: 0.5577, test_loss: 0.9704, test_f1: 0.6483
 epoch: 96, train_loss: 0.5324, test_loss: 1.0592, test_f1: 0.6152
 epoch: 97, train_loss: 0.5520, test_loss: 1.0148, test_f1: 0.6302
 epoch: 98, train_loss: 0.5293, test_loss: 0.9282, test_f1: 0.6617
 epoch: 99, train_loss: 0.5332, test_loss: 0.9662, test_f1: 0.6290
##################ITERATION #2 ****************************************
 epoch: 0, train_loss: 1.1222, test_loss: 1.0470, test_f1: 0.3929
 epoch: 1, train_loss: 1.0086, test_loss: 0.9988, test_f1: 0.4300
 epoch: 2, train_loss: 0.9864, test_loss: 0.9909, test_f1: 0.4694
 epoch: 3, train_loss: 0.9602, test_loss: 0.9944, test_f1: 0.5165
 epoch: 4, train_loss: 0.9494, test_loss: 0.9635, test_f1: 0.4901
 epoch: 5, train_loss: 0.9394, test_loss: 0.9723, test_f1: 0.5065
 epoch: 6, train_loss: 0.9211, test_loss: 0.9293, test_f1: 0.5063
 epoch: 7, train_loss: 0.9091, test_loss: 0.9896, test_f1: 0.5160
 epoch: 8, train_loss: 0.8974, test_loss: 1.0486, test_f1: 0.4736
 epoch: 9, train_loss: 0.8940, test_loss: 0.9754, test_f1: 0.4770
 epoch: 10, train_loss: 0.8883, test_loss: 0.9161, test_f1: 0.5253
 epoch: 11, train_loss: 0.8719, test_loss: 0.9467, test_f1: 0.5321
 epoch: 12, train_loss: 0.8779, test_loss: 0.9357, test_f1: 0.5146
 epoch: 13, train_loss: 0.8649, test_loss: 0.9284, test_f1: 0.5649
 epoch: 14, train_loss: 0.8432, test_loss: 1.0033, test_f1: 0.4900
 epoch: 15, train_loss: 0.8599, test_loss: 0.9201, test_f1: 0.5303
 epoch: 16, train_loss: 0.8484, test_loss: 0.9810, test_f1: 0.5032
 epoch: 17, train_loss: 0.8359, test_loss: 0.9113, test_f1: 0.5516
 epoch: 18, train_loss: 0.8323, test_loss: 0.9483, test_f1: 0.5295
 epoch: 19, train_loss: 0.8251, test_loss: 0.8764, test_f1: 0.5329
 epoch: 20, train_loss: 0.8254, test_loss: 0.9482, test_f1: 0.5625
 epoch: 21, train_loss: 0.8251, test_loss: 1.0557, test_f1: 0.4886
 epoch: 22, train_loss: 0.8193, test_loss: 0.9093, test_f1: 0.5625
 epoch: 23, train_loss: 0.8121, test_loss: 0.9356, test_f1: 0.5505
 epoch: 24, train_loss: 0.8190, test_loss: 0.9059, test_f1: 0.5913
 epoch: 25, train_loss: 0.8001, test_loss: 0.9327, test_f1: 0.5716
 epoch: 26, train_loss: 0.7950, test_loss: 0.9188, test_f1: 0.5539
 epoch: 27, train_loss: 0.8023, test_loss: 0.8372, test_f1: 0.5847
 epoch: 28, train_loss: 0.7826, test_loss: 0.9695, test_f1: 0.5255
 epoch: 29, train_loss: 0.8079, test_loss: 0.9615, test_f1: 0.5417
 epoch: 30, train_loss: 0.7949, test_loss: 0.9119, test_f1: 0.5727
 epoch: 31, train_loss: 0.7713, test_loss: 0.8837, test_f1: 0.5861
 epoch: 32, train_loss: 0.7882, test_loss: 0.9191, test_f1: 0.5820
 epoch: 33, train_loss: 0.7645, test_loss: 0.9123, test_f1: 0.5558
 epoch: 34, train_loss: 0.7747, test_loss: 0.9197, test_f1: 0.5931
 epoch: 35, train_loss: 0.7750, test_loss: 0.9293, test_f1: 0.5731
 epoch: 36, train_loss: 0.7625, test_loss: 0.8816, test_f1: 0.6011
 epoch: 37, train_loss: 0.7696, test_loss: 0.8832, test_f1: 0.5927
 epoch: 38, train_loss: 0.7499, test_loss: 0.9713, test_f1: 0.5822
 epoch: 39, train_loss: 0.7563, test_loss: 0.9334, test_f1: 0.5858
 epoch: 40, train_loss: 0.7521, test_loss: 0.8835, test_f1: 0.6056
 epoch: 41, train_loss: 0.7577, test_loss: 0.9194, test_f1: 0.5746
 epoch: 42, train_loss: 0.7547, test_loss: 0.9105, test_f1: 0.5881
 epoch: 43, train_loss: 0.7495, test_loss: 0.9569, test_f1: 0.5709
 epoch: 44, train_loss: 0.7514, test_loss: 0.9296, test_f1: 0.5659
 epoch: 45, train_loss: 0.7331, test_loss: 0.9171, test_f1: 0.5825
 epoch: 46, train_loss: 0.7448, test_loss: 0.9725, test_f1: 0.5602
 epoch: 47, train_loss: 0.7237, test_loss: 0.9621, test_f1: 0.5592
 epoch: 48, train_loss: 0.7437, test_loss: 0.9893, test_f1: 0.5816
 epoch: 49, train_loss: 0.7107, test_loss: 0.8691, test_f1: 0.6335
 epoch: 50, train_loss: 0.7292, test_loss: 0.9057, test_f1: 0.5975
 epoch: 51, train_loss: 0.7089, test_loss: 0.8769, test_f1: 0.5922
 epoch: 52, train_loss: 0.7005, test_loss: 0.9262, test_f1: 0.5936
 epoch: 53, train_loss: 0.7062, test_loss: 0.8991, test_f1: 0.6280
 epoch: 54, train_loss: 0.6929, test_loss: 0.8575, test_f1: 0.6174
 epoch: 55, train_loss: 0.6893, test_loss: 0.8937, test_f1: 0.6115
 epoch: 56, train_loss: 0.7001, test_loss: 0.9518, test_f1: 0.5866
 epoch: 57, train_loss: 0.6974, test_loss: 0.8636, test_f1: 0.6350
 epoch: 58, train_loss: 0.6878, test_loss: 0.8324, test_f1: 0.6512
 epoch: 59, train_loss: 0.6908, test_loss: 0.8902, test_f1: 0.6101
 epoch: 60, train_loss: 0.6782, test_loss: 0.8726, test_f1: 0.6243
 epoch: 61, train_loss: 0.6819, test_loss: 0.9007, test_f1: 0.5966
 epoch: 62, train_loss: 0.6746, test_loss: 0.9073, test_f1: 0.5962
 epoch: 63, train_loss: 0.6761, test_loss: 0.9687, test_f1: 0.5693
 epoch: 64, train_loss: 0.6779, test_loss: 0.9278, test_f1: 0.6127
 epoch: 65, train_loss: 0.6863, test_loss: 0.8569, test_f1: 0.6368
 epoch: 66, train_loss: 0.6750, test_loss: 0.9215, test_f1: 0.6002
 epoch: 67, train_loss: 0.6738, test_loss: 0.8713, test_f1: 0.6347
 epoch: 68, train_loss: 0.6647, test_loss: 0.8877, test_f1: 0.6099
 epoch: 69, train_loss: 0.6848, test_loss: 0.8505, test_f1: 0.6236
 epoch: 70, train_loss: 0.6663, test_loss: 0.8521, test_f1: 0.6335
 epoch: 71, train_loss: 0.6645, test_loss: 0.8958, test_f1: 0.6126
 epoch: 72, train_loss: 0.6544, test_loss: 0.8823, test_f1: 0.6282
 epoch: 73, train_loss: 0.6583, test_loss: 0.9431, test_f1: 0.6072
 epoch: 74, train_loss: 0.6484, test_loss: 0.8690, test_f1: 0.6313
 epoch: 75, train_loss: 0.6464, test_loss: 0.8689, test_f1: 0.6220
 epoch: 76, train_loss: 0.6723, test_loss: 0.8475, test_f1: 0.6461
 epoch: 77, train_loss: 0.6646, test_loss: 0.8941, test_f1: 0.6059
 epoch: 78, train_loss: 0.6493, test_loss: 0.9067, test_f1: 0.6315
 epoch: 79, train_loss: 0.6590, test_loss: 0.9318, test_f1: 0.6311
 epoch: 80, train_loss: 0.6606, test_loss: 0.9398, test_f1: 0.6061
 epoch: 81, train_loss: 0.6575, test_loss: 0.9920, test_f1: 0.5992
 epoch: 82, train_loss: 0.6417, test_loss: 0.9181, test_f1: 0.6190
 epoch: 83, train_loss: 0.6335, test_loss: 0.9307, test_f1: 0.5956
 epoch: 84, train_loss: 0.6427, test_loss: 0.9203, test_f1: 0.6089
 epoch: 85, train_loss: 0.6273, test_loss: 0.8733, test_f1: 0.6297
 epoch: 86, train_loss: 0.6324, test_loss: 0.9185, test_f1: 0.6293
 epoch: 87, train_loss: 0.6573, test_loss: 0.9053, test_f1: 0.6138
 epoch: 88, train_loss: 0.6422, test_loss: 0.8940, test_f1: 0.6116
 epoch: 89, train_loss: 0.6324, test_loss: 0.9202, test_f1: 0.6114
 epoch: 90, train_loss: 0.6306, test_loss: 1.0353, test_f1: 0.6015
 epoch: 91, train_loss: 0.6268, test_loss: 0.8942, test_f1: 0.6268
 epoch: 92, train_loss: 0.6468, test_loss: 0.9112, test_f1: 0.6144
 epoch: 93, train_loss: 0.6286, test_loss: 0.9137, test_f1: 0.6068
 epoch: 94, train_loss: 0.6211, test_loss: 0.9434, test_f1: 0.5974
 epoch: 95, train_loss: 0.6208, test_loss: 0.9341, test_f1: 0.5985
 epoch: 96, train_loss: 0.6351, test_loss: 0.9638, test_f1: 0.6200
 epoch: 97, train_loss: 0.6281, test_loss: 0.9211, test_f1: 0.6369
 epoch: 98, train_loss: 0.6108, test_loss: 0.8964, test_f1: 0.6151
 epoch: 99, train_loss: 0.6165, test_loss: 0.9382, test_f1: 0.6025
##################ITERATION #3 ****************************************
 epoch: 0, train_loss: 1.1559, test_loss: 1.0254, test_f1: 0.4462
 epoch: 1, train_loss: 1.0388, test_loss: 1.0122, test_f1: 0.5155
 epoch: 2, train_loss: 1.0096, test_loss: 1.0052, test_f1: 0.4851
 epoch: 3, train_loss: 0.9877, test_loss: 0.9345, test_f1: 0.5282
 epoch: 4, train_loss: 0.9615, test_loss: 0.9754, test_f1: 0.5105
 epoch: 5, train_loss: 0.9411, test_loss: 0.9769, test_f1: 0.5004
 epoch: 6, train_loss: 0.9339, test_loss: 0.9429, test_f1: 0.5404
 epoch: 7, train_loss: 0.9231, test_loss: 0.9435, test_f1: 0.5289
 epoch: 8, train_loss: 0.9085, test_loss: 0.9896, test_f1: 0.5131
 epoch: 9, train_loss: 0.8915, test_loss: 0.9087, test_f1: 0.5143
 epoch: 10, train_loss: 0.8906, test_loss: 0.9673, test_f1: 0.5238
 epoch: 11, train_loss: 0.8624, test_loss: 0.8765, test_f1: 0.5573
 epoch: 12, train_loss: 0.8634, test_loss: 0.9495, test_f1: 0.5305
 epoch: 13, train_loss: 0.8380, test_loss: 0.8769, test_f1: 0.5612
 epoch: 14, train_loss: 0.8305, test_loss: 0.9777, test_f1: 0.5535
 epoch: 15, train_loss: 0.8275, test_loss: 0.8555, test_f1: 0.5977
 epoch: 16, train_loss: 0.8106, test_loss: 0.8749, test_f1: 0.5547
 epoch: 17, train_loss: 0.7979, test_loss: 0.8657, test_f1: 0.5867
 epoch: 18, train_loss: 0.8101, test_loss: 0.8947, test_f1: 0.5848
 epoch: 19, train_loss: 0.7939, test_loss: 0.8509, test_f1: 0.6275
 epoch: 20, train_loss: 0.7961, test_loss: 0.8344, test_f1: 0.6099
 epoch: 21, train_loss: 0.7852, test_loss: 0.7914, test_f1: 0.6211
 epoch: 22, train_loss: 0.7840, test_loss: 0.8136, test_f1: 0.6257
 epoch: 23, train_loss: 0.7776, test_loss: 0.8170, test_f1: 0.6159
 epoch: 24, train_loss: 0.7708, test_loss: 0.8540, test_f1: 0.6173
 epoch: 25, train_loss: 0.7794, test_loss: 0.9052, test_f1: 0.5759
 epoch: 26, train_loss: 0.7515, test_loss: 0.8103, test_f1: 0.6121
 epoch: 27, train_loss: 0.7456, test_loss: 0.8095, test_f1: 0.6398
 epoch: 28, train_loss: 0.7406, test_loss: 0.8448, test_f1: 0.5927
 epoch: 29, train_loss: 0.7369, test_loss: 0.7996, test_f1: 0.5993
 epoch: 30, train_loss: 0.7480, test_loss: 0.8479, test_f1: 0.5868
 epoch: 31, train_loss: 0.7334, test_loss: 0.8333, test_f1: 0.6232
 epoch: 32, train_loss: 0.7421, test_loss: 0.8000, test_f1: 0.6445
 epoch: 33, train_loss: 0.7251, test_loss: 0.7638, test_f1: 0.6455
 epoch: 34, train_loss: 0.7190, test_loss: 0.7683, test_f1: 0.6565
 epoch: 35, train_loss: 0.7148, test_loss: 0.8290, test_f1: 0.6528
 epoch: 36, train_loss: 0.7300, test_loss: 0.8559, test_f1: 0.6202
 epoch: 37, train_loss: 0.7092, test_loss: 0.9019, test_f1: 0.5893
 epoch: 38, train_loss: 0.7228, test_loss: 0.8482, test_f1: 0.5899
 epoch: 39, train_loss: 0.7134, test_loss: 0.8224, test_f1: 0.6295
 epoch: 40, train_loss: 0.7093, test_loss: 0.8283, test_f1: 0.6158
 epoch: 41, train_loss: 0.6944, test_loss: 0.7798, test_f1: 0.6442
 epoch: 42, train_loss: 0.6929, test_loss: 0.8121, test_f1: 0.6336
 epoch: 43, train_loss: 0.6839, test_loss: 0.7750, test_f1: 0.6552
 epoch: 44, train_loss: 0.6921, test_loss: 0.8038, test_f1: 0.6117
 epoch: 45, train_loss: 0.6874, test_loss: 0.7826, test_f1: 0.6551
 epoch: 46, train_loss: 0.6848, test_loss: 0.8310, test_f1: 0.6509
 epoch: 47, train_loss: 0.6784, test_loss: 0.7632, test_f1: 0.6651
 epoch: 48, train_loss: 0.6704, test_loss: 0.7903, test_f1: 0.6499
 epoch: 49, train_loss: 0.6775, test_loss: 0.7841, test_f1: 0.6585
 epoch: 50, train_loss: 0.6739, test_loss: 0.7587, test_f1: 0.6677
 epoch: 51, train_loss: 0.6487, test_loss: 0.7596, test_f1: 0.6726
 epoch: 52, train_loss: 0.6442, test_loss: 0.7663, test_f1: 0.6367
 epoch: 53, train_loss: 0.6399, test_loss: 0.8162, test_f1: 0.6494
 epoch: 54, train_loss: 0.6399, test_loss: 0.7622, test_f1: 0.6698
 epoch: 55, train_loss: 0.6295, test_loss: 0.8090, test_f1: 0.6354
 epoch: 56, train_loss: 0.6387, test_loss: 0.7938, test_f1: 0.6529
 epoch: 57, train_loss: 0.6233, test_loss: 0.7687, test_f1: 0.6669
 epoch: 58, train_loss: 0.6328, test_loss: 0.7945, test_f1: 0.6665
 epoch: 59, train_loss: 0.6430, test_loss: 0.8092, test_f1: 0.6416
 epoch: 60, train_loss: 0.6157, test_loss: 0.8213, test_f1: 0.6591
 epoch: 61, train_loss: 0.6234, test_loss: 0.8134, test_f1: 0.6345
 epoch: 62, train_loss: 0.6248, test_loss: 0.8279, test_f1: 0.6454
 epoch: 63, train_loss: 0.6155, test_loss: 0.7972, test_f1: 0.6413
 epoch: 64, train_loss: 0.6233, test_loss: 0.8189, test_f1: 0.6634
 epoch: 65, train_loss: 0.6134, test_loss: 0.8064, test_f1: 0.6668
 epoch: 66, train_loss: 0.6062, test_loss: 0.8561, test_f1: 0.6449
 epoch: 67, train_loss: 0.6135, test_loss: 0.8771, test_f1: 0.6413
 epoch: 68, train_loss: 0.6090, test_loss: 0.8519, test_f1: 0.6428
 epoch: 69, train_loss: 0.5983, test_loss: 0.8419, test_f1: 0.6470
 epoch: 70, train_loss: 0.5908, test_loss: 0.8671, test_f1: 0.6538
 epoch: 71, train_loss: 0.6021, test_loss: 0.8703, test_f1: 0.6398
 epoch: 72, train_loss: 0.6035, test_loss: 0.8971, test_f1: 0.6713
 epoch: 73, train_loss: 0.6026, test_loss: 0.8982, test_f1: 0.6433
 epoch: 74, train_loss: 0.6115, test_loss: 0.8416, test_f1: 0.6578
 epoch: 75, train_loss: 0.6020, test_loss: 0.8599, test_f1: 0.6487
 epoch: 76, train_loss: 0.5920, test_loss: 0.8839, test_f1: 0.6444
 epoch: 77, train_loss: 0.5938, test_loss: 0.9117, test_f1: 0.6674
 epoch: 78, train_loss: 0.5986, test_loss: 0.9055, test_f1: 0.6349
 epoch: 79, train_loss: 0.5885, test_loss: 0.8685, test_f1: 0.6402
 epoch: 80, train_loss: 0.5867, test_loss: 0.9209, test_f1: 0.6270
 epoch: 81, train_loss: 0.5896, test_loss: 0.8805, test_f1: 0.6336
 epoch: 82, train_loss: 0.5761, test_loss: 0.8562, test_f1: 0.6632
 epoch: 83, train_loss: 0.5808, test_loss: 0.8898, test_f1: 0.6467
 epoch: 84, train_loss: 0.5757, test_loss: 0.8751, test_f1: 0.6336
 epoch: 85, train_loss: 0.5809, test_loss: 0.8781, test_f1: 0.6526
 epoch: 86, train_loss: 0.5790, test_loss: 0.8497, test_f1: 0.6541
 epoch: 87, train_loss: 0.5816, test_loss: 0.9037, test_f1: 0.6463
 epoch: 88, train_loss: 0.5864, test_loss: 0.8371, test_f1: 0.6476
 epoch: 89, train_loss: 0.5775, test_loss: 0.9175, test_f1: 0.6414
 epoch: 90, train_loss: 0.5686, test_loss: 0.8929, test_f1: 0.6475
 epoch: 91, train_loss: 0.5637, test_loss: 0.8850, test_f1: 0.6360
 epoch: 92, train_loss: 0.5732, test_loss: 0.8940, test_f1: 0.6392
 epoch: 93, train_loss: 0.5660, test_loss: 0.8330, test_f1: 0.6795
 epoch: 94, train_loss: 0.5592, test_loss: 0.9473, test_f1: 0.6199
 epoch: 95, train_loss: 0.5697, test_loss: 0.7840, test_f1: 0.6377
 epoch: 96, train_loss: 0.5653, test_loss: 0.8677, test_f1: 0.6368
 epoch: 97, train_loss: 0.5712, test_loss: 0.8282, test_f1: 0.6503
 epoch: 98, train_loss: 0.5594, test_loss: 0.9122, test_f1: 0.6245
 epoch: 99, train_loss: 0.5673, test_loss: 0.9188, test_f1: 0.6441
##################ITERATION #4 ****************************************
 epoch: 0, train_loss: 1.1792, test_loss: 1.0173, test_f1: 0.5354
 epoch: 1, train_loss: 0.9987, test_loss: 0.9387, test_f1: 0.5328
 epoch: 2, train_loss: 0.9704, test_loss: 0.9292, test_f1: 0.5180
 epoch: 3, train_loss: 0.9462, test_loss: 0.9066, test_f1: 0.5461
 epoch: 4, train_loss: 0.9366, test_loss: 0.9698, test_f1: 0.5105
 epoch: 5, train_loss: 0.9306, test_loss: 0.9677, test_f1: 0.5117
 epoch: 6, train_loss: 0.9002, test_loss: 0.9183, test_f1: 0.5400
 epoch: 7, train_loss: 0.8931, test_loss: 1.0501, test_f1: 0.4827
 epoch: 8, train_loss: 0.8825, test_loss: 0.8751, test_f1: 0.5578
 epoch: 9, train_loss: 0.8643, test_loss: 0.9139, test_f1: 0.5354
 epoch: 10, train_loss: 0.8638, test_loss: 0.8246, test_f1: 0.5583
 epoch: 11, train_loss: 0.8652, test_loss: 0.9512, test_f1: 0.5115
 epoch: 12, train_loss: 0.8467, test_loss: 0.8559, test_f1: 0.5699
 epoch: 13, train_loss: 0.8383, test_loss: 0.8469, test_f1: 0.5939
 epoch: 14, train_loss: 0.8529, test_loss: 0.9140, test_f1: 0.5460
 epoch: 15, train_loss: 0.8417, test_loss: 0.8675, test_f1: 0.5368
 epoch: 16, train_loss: 0.8363, test_loss: 0.8490, test_f1: 0.5745
 epoch: 17, train_loss: 0.8169, test_loss: 0.8564, test_f1: 0.5614
 epoch: 18, train_loss: 0.8149, test_loss: 0.8396, test_f1: 0.5674
 epoch: 19, train_loss: 0.8040, test_loss: 0.8464, test_f1: 0.5646
 epoch: 20, train_loss: 0.8137, test_loss: 0.8246, test_f1: 0.5528
 epoch: 21, train_loss: 0.7827, test_loss: 0.8862, test_f1: 0.5592
 epoch: 22, train_loss: 0.7914, test_loss: 0.8460, test_f1: 0.5973
 epoch: 23, train_loss: 0.7802, test_loss: 0.9503, test_f1: 0.5411
 epoch: 24, train_loss: 0.7849, test_loss: 0.8684, test_f1: 0.5563
 epoch: 25, train_loss: 0.7821, test_loss: 0.8775, test_f1: 0.5711
 epoch: 26, train_loss: 0.7680, test_loss: 0.8198, test_f1: 0.6194
 epoch: 27, train_loss: 0.7633, test_loss: 0.8926, test_f1: 0.5730
 epoch: 28, train_loss: 0.7723, test_loss: 0.9083, test_f1: 0.5717
 epoch: 29, train_loss: 0.7599, test_loss: 0.8851, test_f1: 0.5898
 epoch: 30, train_loss: 0.7490, test_loss: 0.7790, test_f1: 0.5847
 epoch: 31, train_loss: 0.7630, test_loss: 0.8227, test_f1: 0.6365
 epoch: 32, train_loss: 0.7535, test_loss: 0.7963, test_f1: 0.5743
 epoch: 33, train_loss: 0.7466, test_loss: 0.7914, test_f1: 0.6085
 epoch: 34, train_loss: 0.7343, test_loss: 0.8483, test_f1: 0.5890
 epoch: 35, train_loss: 0.7352, test_loss: 0.8377, test_f1: 0.6008
 epoch: 36, train_loss: 0.7390, test_loss: 0.7783, test_f1: 0.6487
 epoch: 37, train_loss: 0.7268, test_loss: 0.8652, test_f1: 0.5793
 epoch: 38, train_loss: 0.7143, test_loss: 0.7921, test_f1: 0.6053
 epoch: 39, train_loss: 0.7350, test_loss: 0.8076, test_f1: 0.6232
 epoch: 40, train_loss: 0.7182, test_loss: 0.8729, test_f1: 0.6152
 epoch: 41, train_loss: 0.7072, test_loss: 0.8140, test_f1: 0.6421
 epoch: 42, train_loss: 0.7191, test_loss: 0.8047, test_f1: 0.6214
 epoch: 43, train_loss: 0.7102, test_loss: 0.8252, test_f1: 0.6351
 epoch: 44, train_loss: 0.7053, test_loss: 0.8174, test_f1: 0.6281
 epoch: 45, train_loss: 0.7030, test_loss: 0.8433, test_f1: 0.6301
 epoch: 46, train_loss: 0.7049, test_loss: 0.9308, test_f1: 0.6075
 epoch: 47, train_loss: 0.7073, test_loss: 0.8512, test_f1: 0.6316
 epoch: 48, train_loss: 0.7081, test_loss: 0.7932, test_f1: 0.6538
 epoch: 49, train_loss: 0.7134, test_loss: 0.8111, test_f1: 0.6291
 epoch: 50, train_loss: 0.6834, test_loss: 0.8046, test_f1: 0.6484
 epoch: 51, train_loss: 0.6801, test_loss: 0.7926, test_f1: 0.6477
 epoch: 52, train_loss: 0.6714, test_loss: 0.8348, test_f1: 0.6283
 epoch: 53, train_loss: 0.6643, test_loss: 0.8656, test_f1: 0.6398
 epoch: 54, train_loss: 0.6520, test_loss: 0.7615, test_f1: 0.6648
 epoch: 55, train_loss: 0.6517, test_loss: 0.7849, test_f1: 0.6644
 epoch: 56, train_loss: 0.6542, test_loss: 0.8095, test_f1: 0.6513
 epoch: 57, train_loss: 0.6548, test_loss: 0.8419, test_f1: 0.6521
 epoch: 58, train_loss: 0.6538, test_loss: 0.7898, test_f1: 0.6631
 epoch: 59, train_loss: 0.6549, test_loss: 0.7732, test_f1: 0.6594
 epoch: 60, train_loss: 0.6437, test_loss: 0.8307, test_f1: 0.6480
 epoch: 61, train_loss: 0.6353, test_loss: 0.7676, test_f1: 0.6529
 epoch: 62, train_loss: 0.6479, test_loss: 0.7340, test_f1: 0.6842
 epoch: 63, train_loss: 0.6356, test_loss: 0.7715, test_f1: 0.6536
 epoch: 64, train_loss: 0.6381, test_loss: 0.7463, test_f1: 0.6634
 epoch: 65, train_loss: 0.6405, test_loss: 0.8249, test_f1: 0.6530
 epoch: 66, train_loss: 0.6368, test_loss: 0.8247, test_f1: 0.6652
 epoch: 67, train_loss: 0.6382, test_loss: 0.7562, test_f1: 0.6565
 epoch: 68, train_loss: 0.6246, test_loss: 0.7801, test_f1: 0.6547
 epoch: 69, train_loss: 0.6353, test_loss: 0.8104, test_f1: 0.6490
 epoch: 70, train_loss: 0.6233, test_loss: 0.8166, test_f1: 0.6490
 epoch: 71, train_loss: 0.6200, test_loss: 0.7527, test_f1: 0.6742
 epoch: 72, train_loss: 0.6245, test_loss: 0.7944, test_f1: 0.6591
 epoch: 73, train_loss: 0.6301, test_loss: 0.8101, test_f1: 0.6392
 epoch: 74, train_loss: 0.6181, test_loss: 0.7690, test_f1: 0.6543
 epoch: 75, train_loss: 0.6181, test_loss: 0.7967, test_f1: 0.6563
 epoch: 76, train_loss: 0.6180, test_loss: 0.8109, test_f1: 0.6538
 epoch: 77, train_loss: 0.6037, test_loss: 0.8060, test_f1: 0.6632
 epoch: 78, train_loss: 0.6029, test_loss: 0.8111, test_f1: 0.6462
 epoch: 79, train_loss: 0.6145, test_loss: 0.7638, test_f1: 0.6745
 epoch: 80, train_loss: 0.6161, test_loss: 0.7579, test_f1: 0.6572
 epoch: 81, train_loss: 0.6261, test_loss: 0.7770, test_f1: 0.6338
 epoch: 82, train_loss: 0.6048, test_loss: 0.8232, test_f1: 0.6420
 epoch: 83, train_loss: 0.6008, test_loss: 0.7993, test_f1: 0.6381
 epoch: 84, train_loss: 0.5895, test_loss: 0.7795, test_f1: 0.6488
 epoch: 85, train_loss: 0.5931, test_loss: 0.8301, test_f1: 0.6437
 epoch: 86, train_loss: 0.5974, test_loss: 0.8450, test_f1: 0.6148
 epoch: 87, train_loss: 0.5917, test_loss: 0.7225, test_f1: 0.6588
 epoch: 88, train_loss: 0.5911, test_loss: 0.7968, test_f1: 0.6465
 epoch: 89, train_loss: 0.6159, test_loss: 0.7459, test_f1: 0.6793
 epoch: 90, train_loss: 0.5968, test_loss: 0.7795, test_f1: 0.6452
 epoch: 91, train_loss: 0.6052, test_loss: 0.7878, test_f1: 0.6428
 epoch: 92, train_loss: 0.5895, test_loss: 0.8100, test_f1: 0.6271
 epoch: 93, train_loss: 0.5970, test_loss: 0.7584, test_f1: 0.6410
 epoch: 94, train_loss: 0.5889, test_loss: 0.7442, test_f1: 0.6806
 epoch: 95, train_loss: 0.6001, test_loss: 0.8114, test_f1: 0.6492
 epoch: 96, train_loss: 0.5913, test_loss: 0.7758, test_f1: 0.6509
 epoch: 97, train_loss: 0.5745, test_loss: 0.7667, test_f1: 0.6555
 epoch: 98, train_loss: 0.5909, test_loss: 0.7596, test_f1: 0.6601
 epoch: 99, train_loss: 0.5888, test_loss: 0.7425, test_f1: 0.6462
##################ITERATION #5 ****************************************
 epoch: 0, train_loss: 1.1619, test_loss: 0.9748, test_f1: 0.4879
 epoch: 1, train_loss: 1.0137, test_loss: 0.9838, test_f1: 0.4961
 epoch: 2, train_loss: 0.9833, test_loss: 0.9525, test_f1: 0.5630
 epoch: 3, train_loss: 0.9625, test_loss: 0.9666, test_f1: 0.5698
 epoch: 4, train_loss: 0.9480, test_loss: 0.9185, test_f1: 0.5126
 epoch: 5, train_loss: 0.9277, test_loss: 0.9476, test_f1: 0.5611
 epoch: 6, train_loss: 0.9191, test_loss: 0.9361, test_f1: 0.5583
 epoch: 7, train_loss: 0.9155, test_loss: 0.9001, test_f1: 0.5635
 epoch: 8, train_loss: 0.8833, test_loss: 0.9503, test_f1: 0.5454
 epoch: 9, train_loss: 0.8919, test_loss: 0.8979, test_f1: 0.5151
 epoch: 10, train_loss: 0.8589, test_loss: 0.8574, test_f1: 0.5553
 epoch: 11, train_loss: 0.8477, test_loss: 0.8573, test_f1: 0.5596
 epoch: 12, train_loss: 0.8265, test_loss: 0.8605, test_f1: 0.5810
 epoch: 13, train_loss: 0.8464, test_loss: 0.8405, test_f1: 0.5549
 epoch: 14, train_loss: 0.8239, test_loss: 0.8929, test_f1: 0.5500
 epoch: 15, train_loss: 0.8184, test_loss: 0.8248, test_f1: 0.5731
 epoch: 16, train_loss: 0.7999, test_loss: 0.8334, test_f1: 0.5966
 epoch: 17, train_loss: 0.7904, test_loss: 0.8258, test_f1: 0.6215
 epoch: 18, train_loss: 0.7974, test_loss: 0.8357, test_f1: 0.5998
 epoch: 19, train_loss: 0.7760, test_loss: 0.8059, test_f1: 0.6151
 epoch: 20, train_loss: 0.7876, test_loss: 0.8377, test_f1: 0.5978
 epoch: 21, train_loss: 0.7690, test_loss: 0.8616, test_f1: 0.6258
 epoch: 22, train_loss: 0.7768, test_loss: 0.7954, test_f1: 0.6117
 epoch: 23, train_loss: 0.7666, test_loss: 0.8075, test_f1: 0.5860
 epoch: 24, train_loss: 0.7548, test_loss: 0.8106, test_f1: 0.6229
 epoch: 25, train_loss: 0.7567, test_loss: 0.8497, test_f1: 0.6014
 epoch: 26, train_loss: 0.7534, test_loss: 0.8277, test_f1: 0.5996
 epoch: 27, train_loss: 0.7431, test_loss: 0.8083, test_f1: 0.6102
 epoch: 28, train_loss: 0.7303, test_loss: 0.8304, test_f1: 0.5936
 epoch: 29, train_loss: 0.7379, test_loss: 0.8429, test_f1: 0.6139
 epoch: 30, train_loss: 0.7368, test_loss: 0.8111, test_f1: 0.6073
 epoch: 31, train_loss: 0.7335, test_loss: 0.8549, test_f1: 0.6211
 epoch: 32, train_loss: 0.7304, test_loss: 0.7908, test_f1: 0.6376
 epoch: 33, train_loss: 0.7168, test_loss: 0.8882, test_f1: 0.5962
 epoch: 34, train_loss: 0.7194, test_loss: 0.7875, test_f1: 0.6348
 epoch: 35, train_loss: 0.7128, test_loss: 0.7694, test_f1: 0.6415
 epoch: 36, train_loss: 0.7116, test_loss: 0.8227, test_f1: 0.6485
 epoch: 37, train_loss: 0.7215, test_loss: 0.7841, test_f1: 0.6264
 epoch: 38, train_loss: 0.6948, test_loss: 0.7886, test_f1: 0.6402
 epoch: 39, train_loss: 0.7021, test_loss: 0.8247, test_f1: 0.6285
 epoch: 40, train_loss: 0.6963, test_loss: 0.7814, test_f1: 0.6333
 epoch: 41, train_loss: 0.7055, test_loss: 0.8267, test_f1: 0.6030
 epoch: 42, train_loss: 0.7069, test_loss: 0.7714, test_f1: 0.6561
 epoch: 43, train_loss: 0.6761, test_loss: 0.8249, test_f1: 0.6033
 epoch: 44, train_loss: 0.6755, test_loss: 0.8179, test_f1: 0.6349
 epoch: 45, train_loss: 0.6963, test_loss: 0.7687, test_f1: 0.6505
 epoch: 46, train_loss: 0.6727, test_loss: 0.8214, test_f1: 0.6263
 epoch: 47, train_loss: 0.6677, test_loss: 0.7800, test_f1: 0.6284
 epoch: 48, train_loss: 0.6731, test_loss: 0.8118, test_f1: 0.6314
 epoch: 49, train_loss: 0.6669, test_loss: 0.8112, test_f1: 0.6075
 epoch: 50, train_loss: 0.6604, test_loss: 0.7640, test_f1: 0.6493
 epoch: 51, train_loss: 0.6655, test_loss: 0.7819, test_f1: 0.6551
 epoch: 52, train_loss: 0.6522, test_loss: 0.7662, test_f1: 0.6471
 epoch: 53, train_loss: 0.6352, test_loss: 0.7785, test_f1: 0.6428
 epoch: 54, train_loss: 0.6355, test_loss: 0.8315, test_f1: 0.6399
 epoch: 55, train_loss: 0.6366, test_loss: 0.8369, test_f1: 0.6397
 epoch: 56, train_loss: 0.6321, test_loss: 0.8136, test_f1: 0.6454
 epoch: 57, train_loss: 0.6356, test_loss: 0.8071, test_f1: 0.6408
 epoch: 58, train_loss: 0.6191, test_loss: 0.7805, test_f1: 0.6626
 epoch: 59, train_loss: 0.6152, test_loss: 0.7728, test_f1: 0.6542
 epoch: 60, train_loss: 0.6148, test_loss: 0.7957, test_f1: 0.6402
 epoch: 61, train_loss: 0.6202, test_loss: 0.8343, test_f1: 0.6698
 epoch: 62, train_loss: 0.6041, test_loss: 0.8037, test_f1: 0.6476
 epoch: 63, train_loss: 0.6197, test_loss: 0.7898, test_f1: 0.6556
 epoch: 64, train_loss: 0.6229, test_loss: 0.8066, test_f1: 0.6496
 epoch: 65, train_loss: 0.6159, test_loss: 0.7878, test_f1: 0.6576
 epoch: 66, train_loss: 0.6121, test_loss: 0.7702, test_f1: 0.6486
 epoch: 67, train_loss: 0.6054, test_loss: 0.7881, test_f1: 0.6588
 epoch: 68, train_loss: 0.6208, test_loss: 0.8307, test_f1: 0.6613
 epoch: 69, train_loss: 0.5996, test_loss: 0.7767, test_f1: 0.6578
 epoch: 70, train_loss: 0.5969, test_loss: 0.8045, test_f1: 0.6533
 epoch: 71, train_loss: 0.6079, test_loss: 0.7847, test_f1: 0.6742
 epoch: 72, train_loss: 0.6089, test_loss: 0.7979, test_f1: 0.6516
 epoch: 73, train_loss: 0.6063, test_loss: 0.8206, test_f1: 0.6403
 epoch: 74, train_loss: 0.6034, test_loss: 0.8268, test_f1: 0.6508
 epoch: 75, train_loss: 0.6026, test_loss: 0.7925, test_f1: 0.6520
 epoch: 76, train_loss: 0.6028, test_loss: 0.7905, test_f1: 0.6497
 epoch: 77, train_loss: 0.5877, test_loss: 0.8293, test_f1: 0.6563
 epoch: 78, train_loss: 0.6047, test_loss: 0.8364, test_f1: 0.6426
 epoch: 79, train_loss: 0.5765, test_loss: 0.7927, test_f1: 0.6520
 epoch: 80, train_loss: 0.5839, test_loss: 0.7938, test_f1: 0.6764
 epoch: 81, train_loss: 0.5945, test_loss: 0.8105, test_f1: 0.6453
 epoch: 82, train_loss: 0.5814, test_loss: 0.7972, test_f1: 0.6688
 epoch: 83, train_loss: 0.5867, test_loss: 0.8167, test_f1: 0.6512
 epoch: 84, train_loss: 0.5845, test_loss: 0.7982, test_f1: 0.6585
 epoch: 85, train_loss: 0.5848, test_loss: 0.8838, test_f1: 0.6446
 epoch: 86, train_loss: 0.5795, test_loss: 0.8136, test_f1: 0.6573
 epoch: 87, train_loss: 0.5808, test_loss: 0.7894, test_f1: 0.6542
 epoch: 88, train_loss: 0.5869, test_loss: 0.8391, test_f1: 0.6525
 epoch: 89, train_loss: 0.5801, test_loss: 0.8157, test_f1: 0.6552
 epoch: 90, train_loss: 0.5658, test_loss: 0.7886, test_f1: 0.6482
 epoch: 91, train_loss: 0.5865, test_loss: 0.8682, test_f1: 0.6331
 epoch: 92, train_loss: 0.5871, test_loss: 0.7879, test_f1: 0.6601
 epoch: 93, train_loss: 0.5688, test_loss: 0.8034, test_f1: 0.6460
 epoch: 94, train_loss: 0.5675, test_loss: 0.7832, test_f1: 0.6497
 epoch: 95, train_loss: 0.5867, test_loss: 0.7988, test_f1: 0.6467
 epoch: 96, train_loss: 0.5473, test_loss: 0.7933, test_f1: 0.6568
 epoch: 97, train_loss: 0.5695, test_loss: 0.8047, test_f1: 0.6510
 epoch: 98, train_loss: 0.5725, test_loss: 0.8367, test_f1: 0.6315
 epoch: 99, train_loss: 0.5582, test_loss: 0.8649, test_f1: 0.6574
##################ITERATION #6 ****************************************
 epoch: 0, train_loss: 1.1905, test_loss: 0.9853, test_f1: 0.4968
 epoch: 1, train_loss: 1.0497, test_loss: 1.0027, test_f1: 0.4703
 epoch: 2, train_loss: 1.0189, test_loss: 0.9873, test_f1: 0.4753
 epoch: 3, train_loss: 1.0104, test_loss: 1.0159, test_f1: 0.4813
 epoch: 4, train_loss: 0.9784, test_loss: 0.9625, test_f1: 0.5077
 epoch: 5, train_loss: 0.9666, test_loss: 0.9006, test_f1: 0.5192
 epoch: 6, train_loss: 0.9365, test_loss: 0.8871, test_f1: 0.5358
 epoch: 7, train_loss: 0.9291, test_loss: 0.8564, test_f1: 0.5609
 epoch: 8, train_loss: 0.9220, test_loss: 0.8515, test_f1: 0.5589
 epoch: 9, train_loss: 0.9102, test_loss: 0.8692, test_f1: 0.5334
 epoch: 10, train_loss: 0.8965, test_loss: 0.9125, test_f1: 0.5683
 epoch: 11, train_loss: 0.8826, test_loss: 0.8622, test_f1: 0.5284
 epoch: 12, train_loss: 0.8831, test_loss: 0.9414, test_f1: 0.5142
 epoch: 13, train_loss: 0.8644, test_loss: 0.9573, test_f1: 0.5417
 epoch: 14, train_loss: 0.8573, test_loss: 0.8287, test_f1: 0.5679
 epoch: 15, train_loss: 0.8508, test_loss: 0.8269, test_f1: 0.5792
 epoch: 16, train_loss: 0.8268, test_loss: 0.8845, test_f1: 0.5393
 epoch: 17, train_loss: 0.8348, test_loss: 0.7884, test_f1: 0.5999
 epoch: 18, train_loss: 0.8180, test_loss: 0.8451, test_f1: 0.5293
 epoch: 19, train_loss: 0.8090, test_loss: 0.8269, test_f1: 0.5626
 epoch: 20, train_loss: 0.8039, test_loss: 0.8076, test_f1: 0.5824
 epoch: 21, train_loss: 0.8111, test_loss: 0.8341, test_f1: 0.5527
 epoch: 22, train_loss: 0.7926, test_loss: 0.7844, test_f1: 0.5861
 epoch: 23, train_loss: 0.7786, test_loss: 0.7754, test_f1: 0.5852
 epoch: 24, train_loss: 0.7708, test_loss: 0.7770, test_f1: 0.5686
 epoch: 25, train_loss: 0.7611, test_loss: 0.9066, test_f1: 0.5630
 epoch: 26, train_loss: 0.7705, test_loss: 0.8374, test_f1: 0.5708
 epoch: 27, train_loss: 0.7551, test_loss: 0.8016, test_f1: 0.5675
 epoch: 28, train_loss: 0.7441, test_loss: 1.0097, test_f1: 0.5550
 epoch: 29, train_loss: 0.7693, test_loss: 0.7546, test_f1: 0.5814
 epoch: 30, train_loss: 0.7237, test_loss: 0.7894, test_f1: 0.6000
 epoch: 31, train_loss: 0.7358, test_loss: 0.8073, test_f1: 0.6025
 epoch: 32, train_loss: 0.7299, test_loss: 0.8023, test_f1: 0.5563
 epoch: 33, train_loss: 0.7264, test_loss: 0.8330, test_f1: 0.5740
 epoch: 34, train_loss: 0.7121, test_loss: 0.8390, test_f1: 0.5615
 epoch: 35, train_loss: 0.7383, test_loss: 0.7848, test_f1: 0.5809
 epoch: 36, train_loss: 0.7267, test_loss: 0.7787, test_f1: 0.5839
 epoch: 37, train_loss: 0.7189, test_loss: 0.8440, test_f1: 0.5573
 epoch: 38, train_loss: 0.6910, test_loss: 0.7934, test_f1: 0.5867
 epoch: 39, train_loss: 0.6993, test_loss: 0.7454, test_f1: 0.6175
 epoch: 40, train_loss: 0.7082, test_loss: 0.7600, test_f1: 0.6221
 epoch: 41, train_loss: 0.6940, test_loss: 0.8922, test_f1: 0.5613
 epoch: 42, train_loss: 0.7063, test_loss: 0.8202, test_f1: 0.6146
 epoch: 43, train_loss: 0.6892, test_loss: 0.8668, test_f1: 0.5892
 epoch: 44, train_loss: 0.6792, test_loss: 0.7773, test_f1: 0.6329
 epoch: 45, train_loss: 0.6622, test_loss: 0.8606, test_f1: 0.6190
 epoch: 46, train_loss: 0.6885, test_loss: 0.8858, test_f1: 0.5774
 epoch: 47, train_loss: 0.6798, test_loss: 0.7860, test_f1: 0.6069
 epoch: 48, train_loss: 0.6627, test_loss: 0.8715, test_f1: 0.5694
 epoch: 49, train_loss: 0.6721, test_loss: 0.7685, test_f1: 0.6230
 epoch: 50, train_loss: 0.6498, test_loss: 0.7879, test_f1: 0.6171
 epoch: 51, train_loss: 0.6385, test_loss: 0.8708, test_f1: 0.6063
 epoch: 52, train_loss: 0.6251, test_loss: 0.7954, test_f1: 0.6140
 epoch: 53, train_loss: 0.6332, test_loss: 0.7793, test_f1: 0.6062
 epoch: 54, train_loss: 0.6305, test_loss: 0.8134, test_f1: 0.5984
 epoch: 55, train_loss: 0.6388, test_loss: 0.7619, test_f1: 0.6323
 epoch: 56, train_loss: 0.6276, test_loss: 0.8486, test_f1: 0.6004
 epoch: 57, train_loss: 0.6162, test_loss: 0.7521, test_f1: 0.6433
 epoch: 58, train_loss: 0.6180, test_loss: 0.8033, test_f1: 0.6294
 epoch: 59, train_loss: 0.6184, test_loss: 0.8186, test_f1: 0.6296
 epoch: 60, train_loss: 0.6046, test_loss: 0.8083, test_f1: 0.6229
 epoch: 61, train_loss: 0.6202, test_loss: 0.7667, test_f1: 0.6082
 epoch: 62, train_loss: 0.5990, test_loss: 0.8403, test_f1: 0.6095
 epoch: 63, train_loss: 0.5855, test_loss: 0.8279, test_f1: 0.6130
 epoch: 64, train_loss: 0.6054, test_loss: 0.7564, test_f1: 0.6369
 epoch: 65, train_loss: 0.5946, test_loss: 0.9436, test_f1: 0.5881
 epoch: 66, train_loss: 0.6009, test_loss: 0.8422, test_f1: 0.5992
 epoch: 67, train_loss: 0.6153, test_loss: 0.8011, test_f1: 0.6229
 epoch: 68, train_loss: 0.5921, test_loss: 0.9165, test_f1: 0.6097
 epoch: 69, train_loss: 0.6067, test_loss: 0.7885, test_f1: 0.6300
 epoch: 70, train_loss: 0.5976, test_loss: 0.8268, test_f1: 0.6242
 epoch: 71, train_loss: 0.6027, test_loss: 0.8272, test_f1: 0.6095
 epoch: 72, train_loss: 0.5875, test_loss: 0.9171, test_f1: 0.6162
 epoch: 73, train_loss: 0.5957, test_loss: 0.8398, test_f1: 0.6136
 epoch: 74, train_loss: 0.5915, test_loss: 0.8976, test_f1: 0.6095
 epoch: 75, train_loss: 0.5867, test_loss: 0.8214, test_f1: 0.6354
 epoch: 76, train_loss: 0.5828, test_loss: 0.8486, test_f1: 0.6272
 epoch: 77, train_loss: 0.5775, test_loss: 0.9216, test_f1: 0.6082
 epoch: 78, train_loss: 0.5806, test_loss: 0.8084, test_f1: 0.6184
 epoch: 79, train_loss: 0.5871, test_loss: 0.8538, test_f1: 0.6129
 epoch: 80, train_loss: 0.5816, test_loss: 0.8173, test_f1: 0.6231
 epoch: 81, train_loss: 0.5778, test_loss: 0.8657, test_f1: 0.6415
 epoch: 82, train_loss: 0.5822, test_loss: 0.8968, test_f1: 0.6028
 epoch: 83, train_loss: 0.5708, test_loss: 0.8739, test_f1: 0.6322
 epoch: 84, train_loss: 0.5653, test_loss: 0.8319, test_f1: 0.6180
 epoch: 85, train_loss: 0.5781, test_loss: 0.9518, test_f1: 0.6251
 epoch: 86, train_loss: 0.5788, test_loss: 0.9298, test_f1: 0.6032
 epoch: 87, train_loss: 0.5839, test_loss: 0.8921, test_f1: 0.6205
 epoch: 88, train_loss: 0.5653, test_loss: 0.8161, test_f1: 0.6125
 epoch: 89, train_loss: 0.5645, test_loss: 0.8709, test_f1: 0.6116
 epoch: 90, train_loss: 0.5591, test_loss: 0.9226, test_f1: 0.6134
 epoch: 91, train_loss: 0.5634, test_loss: 0.8034, test_f1: 0.6387
 epoch: 92, train_loss: 0.5523, test_loss: 0.8645, test_f1: 0.6366
 epoch: 93, train_loss: 0.5529, test_loss: 1.0074, test_f1: 0.6074
 epoch: 94, train_loss: 0.5658, test_loss: 0.9172, test_f1: 0.6093
 epoch: 95, train_loss: 0.5756, test_loss: 0.9410, test_f1: 0.5995
 epoch: 96, train_loss: 0.5523, test_loss: 0.9659, test_f1: 0.6105
 epoch: 97, train_loss: 0.5678, test_loss: 0.9133, test_f1: 0.6363
 epoch: 98, train_loss: 0.5577, test_loss: 0.9041, test_f1: 0.6100
 epoch: 99, train_loss: 0.5419, test_loss: 0.9577, test_f1: 0.5992
##################ITERATION #7 ****************************************
 epoch: 0, train_loss: 1.2176, test_loss: 1.0807, test_f1: 0.4160
 epoch: 1, train_loss: 1.0450, test_loss: 1.0588, test_f1: 0.4859
 epoch: 2, train_loss: 1.0058, test_loss: 1.0476, test_f1: 0.4912
 epoch: 3, train_loss: 0.9782, test_loss: 0.9900, test_f1: 0.5332
 epoch: 4, train_loss: 0.9493, test_loss: 1.0444, test_f1: 0.4719
 epoch: 5, train_loss: 0.9514, test_loss: 1.0126, test_f1: 0.4945
 epoch: 6, train_loss: 0.9159, test_loss: 0.9430, test_f1: 0.5503
 epoch: 7, train_loss: 0.9068, test_loss: 0.9552, test_f1: 0.5036
 epoch: 8, train_loss: 0.9071, test_loss: 0.9349, test_f1: 0.5338
 epoch: 9, train_loss: 0.8845, test_loss: 0.9609, test_f1: 0.5101
 epoch: 10, train_loss: 0.8914, test_loss: 0.9194, test_f1: 0.5729
 epoch: 11, train_loss: 0.8700, test_loss: 0.9147, test_f1: 0.5448
 epoch: 12, train_loss: 0.8684, test_loss: 0.8885, test_f1: 0.5673
 epoch: 13, train_loss: 0.8663, test_loss: 0.9321, test_f1: 0.5655
 epoch: 14, train_loss: 0.8518, test_loss: 0.9036, test_f1: 0.5908
 epoch: 15, train_loss: 0.8549, test_loss: 0.9316, test_f1: 0.5336
 epoch: 16, train_loss: 0.8376, test_loss: 0.8801, test_f1: 0.5671
 epoch: 17, train_loss: 0.8404, test_loss: 0.8873, test_f1: 0.5939
 epoch: 18, train_loss: 0.8207, test_loss: 0.9149, test_f1: 0.5647
 epoch: 19, train_loss: 0.8158, test_loss: 0.8823, test_f1: 0.5977
 epoch: 20, train_loss: 0.7986, test_loss: 0.8742, test_f1: 0.5644
 epoch: 21, train_loss: 0.7975, test_loss: 0.8793, test_f1: 0.6024
 epoch: 22, train_loss: 0.8010, test_loss: 0.8917, test_f1: 0.5883
 epoch: 23, train_loss: 0.7816, test_loss: 0.8539, test_f1: 0.5800
 epoch: 24, train_loss: 0.7857, test_loss: 0.8555, test_f1: 0.5836
 epoch: 25, train_loss: 0.7641, test_loss: 0.8580, test_f1: 0.5855
 epoch: 26, train_loss: 0.7685, test_loss: 0.8455, test_f1: 0.5971
 epoch: 27, train_loss: 0.7753, test_loss: 0.9038, test_f1: 0.5588
 epoch: 28, train_loss: 0.7597, test_loss: 0.9022, test_f1: 0.5655
 epoch: 29, train_loss: 0.7695, test_loss: 0.8435, test_f1: 0.5921
 epoch: 30, train_loss: 0.7687, test_loss: 0.8814, test_f1: 0.5554
 epoch: 31, train_loss: 0.7612, test_loss: 0.9166, test_f1: 0.5772
 epoch: 32, train_loss: 0.7441, test_loss: 0.8992, test_f1: 0.5938
 epoch: 33, train_loss: 0.7383, test_loss: 0.8494, test_f1: 0.6022
 epoch: 34, train_loss: 0.7317, test_loss: 0.8908, test_f1: 0.6086
 epoch: 35, train_loss: 0.7419, test_loss: 0.8182, test_f1: 0.5902
 epoch: 36, train_loss: 0.7401, test_loss: 0.9143, test_f1: 0.6123
 epoch: 37, train_loss: 0.7240, test_loss: 0.9217, test_f1: 0.5988
 epoch: 38, train_loss: 0.7268, test_loss: 1.0084, test_f1: 0.5522
 epoch: 39, train_loss: 0.7269, test_loss: 0.9521, test_f1: 0.6022
 epoch: 40, train_loss: 0.7268, test_loss: 0.8525, test_f1: 0.6132
 epoch: 41, train_loss: 0.7102, test_loss: 0.9946, test_f1: 0.5679
 epoch: 42, train_loss: 0.7144, test_loss: 0.8565, test_f1: 0.6091
 epoch: 43, train_loss: 0.7213, test_loss: 0.8374, test_f1: 0.5988
 epoch: 44, train_loss: 0.7078, test_loss: 0.9322, test_f1: 0.5899
 epoch: 45, train_loss: 0.7049, test_loss: 0.9318, test_f1: 0.5767
 epoch: 46, train_loss: 0.6985, test_loss: 0.8710, test_f1: 0.6214
 epoch: 47, train_loss: 0.7010, test_loss: 0.9097, test_f1: 0.5651
 epoch: 48, train_loss: 0.7000, test_loss: 0.9559, test_f1: 0.5935
 epoch: 49, train_loss: 0.6746, test_loss: 0.8655, test_f1: 0.6415
 epoch: 50, train_loss: 0.6867, test_loss: 0.8679, test_f1: 0.6312
 epoch: 51, train_loss: 0.6622, test_loss: 0.9223, test_f1: 0.6069
 epoch: 52, train_loss: 0.6545, test_loss: 0.8938, test_f1: 0.6287
 epoch: 53, train_loss: 0.6574, test_loss: 0.8609, test_f1: 0.6017
 epoch: 54, train_loss: 0.6511, test_loss: 0.8422, test_f1: 0.6276
 epoch: 55, train_loss: 0.6602, test_loss: 0.8878, test_f1: 0.6256
 epoch: 56, train_loss: 0.6570, test_loss: 0.8922, test_f1: 0.6239
 epoch: 57, train_loss: 0.6606, test_loss: 0.8911, test_f1: 0.6295
 epoch: 58, train_loss: 0.6494, test_loss: 0.8876, test_f1: 0.6507
 epoch: 59, train_loss: 0.6422, test_loss: 0.9155, test_f1: 0.6543
 epoch: 60, train_loss: 0.6415, test_loss: 0.8967, test_f1: 0.6114
 epoch: 61, train_loss: 0.6478, test_loss: 0.8673, test_f1: 0.6530
 epoch: 62, train_loss: 0.6446, test_loss: 0.8829, test_f1: 0.6378
 epoch: 63, train_loss: 0.6313, test_loss: 0.8789, test_f1: 0.6456
 epoch: 64, train_loss: 0.6393, test_loss: 0.9126, test_f1: 0.6384
 epoch: 65, train_loss: 0.6273, test_loss: 0.9137, test_f1: 0.6495
 epoch: 66, train_loss: 0.6390, test_loss: 0.9100, test_f1: 0.6419
 epoch: 67, train_loss: 0.6391, test_loss: 0.9401, test_f1: 0.6141
 epoch: 68, train_loss: 0.6363, test_loss: 0.9229, test_f1: 0.6255
 epoch: 69, train_loss: 0.6418, test_loss: 0.8993, test_f1: 0.6422
 epoch: 70, train_loss: 0.6300, test_loss: 0.9576, test_f1: 0.6238
 epoch: 71, train_loss: 0.6354, test_loss: 0.8731, test_f1: 0.6347
 epoch: 72, train_loss: 0.6108, test_loss: 0.9298, test_f1: 0.6327
 epoch: 73, train_loss: 0.6358, test_loss: 0.9179, test_f1: 0.6409
 epoch: 74, train_loss: 0.6265, test_loss: 0.9234, test_f1: 0.6404
 epoch: 75, train_loss: 0.6209, test_loss: 0.9352, test_f1: 0.6480
 epoch: 76, train_loss: 0.6132, test_loss: 0.9578, test_f1: 0.6352
 epoch: 77, train_loss: 0.6096, test_loss: 0.9299, test_f1: 0.6361
 epoch: 78, train_loss: 0.6190, test_loss: 0.9757, test_f1: 0.6213
 epoch: 79, train_loss: 0.6073, test_loss: 0.9527, test_f1: 0.6216
 epoch: 80, train_loss: 0.6112, test_loss: 0.9238, test_f1: 0.5997
 epoch: 81, train_loss: 0.6123, test_loss: 0.8930, test_f1: 0.6232
 epoch: 82, train_loss: 0.6088, test_loss: 0.9255, test_f1: 0.6271
 epoch: 83, train_loss: 0.6121, test_loss: 0.9645, test_f1: 0.6462
 epoch: 84, train_loss: 0.6164, test_loss: 0.9756, test_f1: 0.6441
 epoch: 85, train_loss: 0.6152, test_loss: 0.9554, test_f1: 0.6314
 epoch: 86, train_loss: 0.6079, test_loss: 0.8956, test_f1: 0.6433
 epoch: 87, train_loss: 0.6144, test_loss: 0.9232, test_f1: 0.6512
 epoch: 88, train_loss: 0.6034, test_loss: 0.9438, test_f1: 0.6484
 epoch: 89, train_loss: 0.5916, test_loss: 0.9222, test_f1: 0.6312
 epoch: 90, train_loss: 0.6118, test_loss: 1.0164, test_f1: 0.6208
 epoch: 91, train_loss: 0.6035, test_loss: 0.9875, test_f1: 0.6145
 epoch: 92, train_loss: 0.5889, test_loss: 0.8886, test_f1: 0.6257
 epoch: 93, train_loss: 0.5936, test_loss: 0.9609, test_f1: 0.6157
 epoch: 94, train_loss: 0.5838, test_loss: 0.9298, test_f1: 0.6365
 epoch: 95, train_loss: 0.6105, test_loss: 1.0057, test_f1: 0.6149
 epoch: 96, train_loss: 0.6027, test_loss: 1.0290, test_f1: 0.6322
 epoch: 97, train_loss: 0.5844, test_loss: 1.0053, test_f1: 0.6186
 epoch: 98, train_loss: 0.5897, test_loss: 0.9241, test_f1: 0.6537
 epoch: 99, train_loss: 0.5869, test_loss: 0.9671, test_f1: 0.6367
##################ITERATION #8 ****************************************
 epoch: 0, train_loss: 1.1613, test_loss: 1.0287, test_f1: 0.5023
 epoch: 1, train_loss: 1.0391, test_loss: 1.0411, test_f1: 0.4692
 epoch: 2, train_loss: 0.9973, test_loss: 1.0096, test_f1: 0.5200
 epoch: 3, train_loss: 0.9850, test_loss: 1.0245, test_f1: 0.5004
 epoch: 4, train_loss: 0.9658, test_loss: 1.0120, test_f1: 0.4937
 epoch: 5, train_loss: 0.9527, test_loss: 0.9842, test_f1: 0.5118
 epoch: 6, train_loss: 0.9190, test_loss: 0.9577, test_f1: 0.5220
 epoch: 7, train_loss: 0.9185, test_loss: 0.9644, test_f1: 0.5181
 epoch: 8, train_loss: 0.9107, test_loss: 1.0345, test_f1: 0.4987
 epoch: 9, train_loss: 0.9044, test_loss: 1.0246, test_f1: 0.4757
 epoch: 10, train_loss: 0.8944, test_loss: 0.9956, test_f1: 0.4351
 epoch: 11, train_loss: 0.8781, test_loss: 0.9428, test_f1: 0.5260
 epoch: 12, train_loss: 0.8953, test_loss: 1.0128, test_f1: 0.4459
 epoch: 13, train_loss: 0.8778, test_loss: 0.9390, test_f1: 0.4918
 epoch: 14, train_loss: 0.8789, test_loss: 0.9551, test_f1: 0.5389
 epoch: 15, train_loss: 0.8564, test_loss: 0.8924, test_f1: 0.5530
 epoch: 16, train_loss: 0.8455, test_loss: 1.0347, test_f1: 0.5169
 epoch: 17, train_loss: 0.8453, test_loss: 0.9338, test_f1: 0.5759
 epoch: 18, train_loss: 0.8481, test_loss: 0.9662, test_f1: 0.5131
 epoch: 19, train_loss: 0.8448, test_loss: 0.9090, test_f1: 0.5420
 epoch: 20, train_loss: 0.8304, test_loss: 0.9396, test_f1: 0.5574
 epoch: 21, train_loss: 0.8403, test_loss: 0.8753, test_f1: 0.5534
 epoch: 22, train_loss: 0.8343, test_loss: 0.9344, test_f1: 0.5300
 epoch: 23, train_loss: 0.8266, test_loss: 0.9046, test_f1: 0.5533
 epoch: 24, train_loss: 0.8063, test_loss: 0.8783, test_f1: 0.5402
 epoch: 25, train_loss: 0.8182, test_loss: 0.9708, test_f1: 0.5729
 epoch: 26, train_loss: 0.8074, test_loss: 0.8459, test_f1: 0.5787
 epoch: 27, train_loss: 0.8042, test_loss: 0.8842, test_f1: 0.5510
 epoch: 28, train_loss: 0.8039, test_loss: 0.9111, test_f1: 0.5369
 epoch: 29, train_loss: 0.7994, test_loss: 0.8771, test_f1: 0.5674
 epoch: 30, train_loss: 0.7862, test_loss: 0.9139, test_f1: 0.5692
 epoch: 31, train_loss: 0.7904, test_loss: 0.8777, test_f1: 0.5716
 epoch: 32, train_loss: 0.7844, test_loss: 0.8543, test_f1: 0.5785
 epoch: 33, train_loss: 0.7928, test_loss: 0.9152, test_f1: 0.5664
 epoch: 34, train_loss: 0.7883, test_loss: 0.8840, test_f1: 0.5757
 epoch: 35, train_loss: 0.7947, test_loss: 0.9109, test_f1: 0.5644
 epoch: 36, train_loss: 0.7810, test_loss: 0.9112, test_f1: 0.5372
 epoch: 37, train_loss: 0.7749, test_loss: 0.8978, test_f1: 0.5609
 epoch: 38, train_loss: 0.7800, test_loss: 0.8480, test_f1: 0.5526
 epoch: 39, train_loss: 0.7693, test_loss: 0.9001, test_f1: 0.5892
 epoch: 40, train_loss: 0.7566, test_loss: 0.8973, test_f1: 0.5711
 epoch: 41, train_loss: 0.7692, test_loss: 0.8529, test_f1: 0.6119
 epoch: 42, train_loss: 0.7353, test_loss: 0.8789, test_f1: 0.6011
 epoch: 43, train_loss: 0.7710, test_loss: 0.9376, test_f1: 0.5597
 epoch: 44, train_loss: 0.7770, test_loss: 0.9238, test_f1: 0.5812
 epoch: 45, train_loss: 0.7527, test_loss: 0.8372, test_f1: 0.6016
 epoch: 46, train_loss: 0.7482, test_loss: 0.8634, test_f1: 0.5956
 epoch: 47, train_loss: 0.7506, test_loss: 0.8548, test_f1: 0.5842
 epoch: 48, train_loss: 0.7301, test_loss: 0.8768, test_f1: 0.5727
 epoch: 49, train_loss: 0.7368, test_loss: 0.9801, test_f1: 0.5489
 epoch: 50, train_loss: 0.7342, test_loss: 0.9176, test_f1: 0.5638
 epoch: 51, train_loss: 0.7181, test_loss: 0.8875, test_f1: 0.5575
 epoch: 52, train_loss: 0.7167, test_loss: 0.8584, test_f1: 0.6125
 epoch: 53, train_loss: 0.7013, test_loss: 0.8675, test_f1: 0.6095
 epoch: 54, train_loss: 0.7050, test_loss: 0.8937, test_f1: 0.5686
 epoch: 55, train_loss: 0.7006, test_loss: 0.8798, test_f1: 0.5812
 epoch: 56, train_loss: 0.7110, test_loss: 0.8538, test_f1: 0.6203
 epoch: 57, train_loss: 0.7085, test_loss: 0.9116, test_f1: 0.5919
 epoch: 58, train_loss: 0.6944, test_loss: 0.8951, test_f1: 0.5781
 epoch: 59, train_loss: 0.6932, test_loss: 0.8774, test_f1: 0.6142
 epoch: 60, train_loss: 0.6973, test_loss: 0.8910, test_f1: 0.6163
 epoch: 61, train_loss: 0.6891, test_loss: 0.9054, test_f1: 0.5973
 epoch: 62, train_loss: 0.6930, test_loss: 0.8946, test_f1: 0.5908
 epoch: 63, train_loss: 0.6980, test_loss: 0.8612, test_f1: 0.5945
 epoch: 64, train_loss: 0.6946, test_loss: 0.8807, test_f1: 0.5968
 epoch: 65, train_loss: 0.6973, test_loss: 0.9243, test_f1: 0.5789
 epoch: 66, train_loss: 0.6855, test_loss: 0.8932, test_f1: 0.5863
 epoch: 67, train_loss: 0.6787, test_loss: 0.8865, test_f1: 0.6078
 epoch: 68, train_loss: 0.6852, test_loss: 0.8668, test_f1: 0.5945
 epoch: 69, train_loss: 0.6921, test_loss: 0.9207, test_f1: 0.5952
 epoch: 70, train_loss: 0.6775, test_loss: 0.8634, test_f1: 0.6049
 epoch: 71, train_loss: 0.6831, test_loss: 0.8538, test_f1: 0.6169
 epoch: 72, train_loss: 0.6888, test_loss: 0.8727, test_f1: 0.6000
 epoch: 73, train_loss: 0.6738, test_loss: 0.9230, test_f1: 0.5723
 epoch: 74, train_loss: 0.6737, test_loss: 0.8437, test_f1: 0.6072
 epoch: 75, train_loss: 0.6764, test_loss: 0.8738, test_f1: 0.5945
 epoch: 76, train_loss: 0.6829, test_loss: 0.8448, test_f1: 0.6345
 epoch: 77, train_loss: 0.6677, test_loss: 0.9719, test_f1: 0.5909
 epoch: 78, train_loss: 0.6663, test_loss: 0.8921, test_f1: 0.5892
 epoch: 79, train_loss: 0.6731, test_loss: 0.8560, test_f1: 0.6103
 epoch: 80, train_loss: 0.6753, test_loss: 0.8686, test_f1: 0.6005
 epoch: 81, train_loss: 0.6670, test_loss: 0.8441, test_f1: 0.6240
 epoch: 82, train_loss: 0.6738, test_loss: 0.8866, test_f1: 0.6251
 epoch: 83, train_loss: 0.6605, test_loss: 0.9014, test_f1: 0.6010
 epoch: 84, train_loss: 0.6746, test_loss: 0.8480, test_f1: 0.6183
 epoch: 85, train_loss: 0.6596, test_loss: 0.8418, test_f1: 0.6257
 epoch: 86, train_loss: 0.6605, test_loss: 0.8756, test_f1: 0.6093
 epoch: 87, train_loss: 0.6765, test_loss: 0.8733, test_f1: 0.6010
 epoch: 88, train_loss: 0.6484, test_loss: 0.9058, test_f1: 0.6205
 epoch: 89, train_loss: 0.6788, test_loss: 0.8595, test_f1: 0.6085
 epoch: 90, train_loss: 0.6580, test_loss: 0.8510, test_f1: 0.6253
 epoch: 91, train_loss: 0.6492, test_loss: 0.9072, test_f1: 0.6013
 epoch: 92, train_loss: 0.6521, test_loss: 0.8700, test_f1: 0.5991
 epoch: 93, train_loss: 0.6417, test_loss: 0.8803, test_f1: 0.5992
 epoch: 94, train_loss: 0.6580, test_loss: 0.8901, test_f1: 0.5991
 epoch: 95, train_loss: 0.6402, test_loss: 0.8765, test_f1: 0.6267
 epoch: 96, train_loss: 0.6610, test_loss: 0.9091, test_f1: 0.6256
 epoch: 97, train_loss: 0.6556, test_loss: 0.8618, test_f1: 0.6465
 epoch: 98, train_loss: 0.6607, test_loss: 0.8667, test_f1: 0.6154
 epoch: 99, train_loss: 0.6506, test_loss: 0.8443, test_f1: 0.6309
##################ITERATION #9 ****************************************
 epoch: 0, train_loss: 1.2337, test_loss: 1.0208, test_f1: 0.4569
 epoch: 1, train_loss: 1.0121, test_loss: 0.9937, test_f1: 0.5217
 epoch: 2, train_loss: 1.0101, test_loss: 0.9828, test_f1: 0.5408
 epoch: 3, train_loss: 0.9859, test_loss: 0.9679, test_f1: 0.5179
 epoch: 4, train_loss: 0.9679, test_loss: 0.9750, test_f1: 0.5276
 epoch: 5, train_loss: 0.9566, test_loss: 1.1116, test_f1: 0.4709
 epoch: 6, train_loss: 0.9517, test_loss: 0.9506, test_f1: 0.5119
 epoch: 7, train_loss: 0.9265, test_loss: 0.9608, test_f1: 0.5535
 epoch: 8, train_loss: 0.9102, test_loss: 0.9488, test_f1: 0.5146
 epoch: 9, train_loss: 0.9028, test_loss: 0.9385, test_f1: 0.5385
 epoch: 10, train_loss: 0.8843, test_loss: 0.9224, test_f1: 0.5427
 epoch: 11, train_loss: 0.8828, test_loss: 0.8853, test_f1: 0.5556
 epoch: 12, train_loss: 0.8659, test_loss: 0.9021, test_f1: 0.5548
 epoch: 13, train_loss: 0.8569, test_loss: 0.9498, test_f1: 0.5414
 epoch: 14, train_loss: 0.8484, test_loss: 0.9724, test_f1: 0.5434
 epoch: 15, train_loss: 0.8490, test_loss: 0.9183, test_f1: 0.5898
 epoch: 16, train_loss: 0.8372, test_loss: 0.9029, test_f1: 0.5626
 epoch: 17, train_loss: 0.8274, test_loss: 0.8934, test_f1: 0.5848
 epoch: 18, train_loss: 0.8136, test_loss: 0.8888, test_f1: 0.5787
 epoch: 19, train_loss: 0.8145, test_loss: 0.9316, test_f1: 0.5842
 epoch: 20, train_loss: 0.8035, test_loss: 0.8474, test_f1: 0.5774
 epoch: 21, train_loss: 0.8041, test_loss: 0.8644, test_f1: 0.5821
 epoch: 22, train_loss: 0.7946, test_loss: 1.0612, test_f1: 0.5565
 epoch: 23, train_loss: 0.8076, test_loss: 0.8596, test_f1: 0.5883
 epoch: 24, train_loss: 0.7859, test_loss: 0.8693, test_f1: 0.6035
 epoch: 25, train_loss: 0.7680, test_loss: 0.8376, test_f1: 0.6205
 epoch: 26, train_loss: 0.7866, test_loss: 0.8213, test_f1: 0.6126
 epoch: 27, train_loss: 0.7678, test_loss: 0.8981, test_f1: 0.5723
 epoch: 28, train_loss: 0.7667, test_loss: 0.8334, test_f1: 0.6309
 epoch: 29, train_loss: 0.7674, test_loss: 0.9089, test_f1: 0.5548
 epoch: 30, train_loss: 0.7538, test_loss: 0.8203, test_f1: 0.6206
 epoch: 31, train_loss: 0.7459, test_loss: 0.8028, test_f1: 0.6406
 epoch: 32, train_loss: 0.7518, test_loss: 0.8341, test_f1: 0.6296
 epoch: 33, train_loss: 0.7482, test_loss: 0.8274, test_f1: 0.6239
 epoch: 34, train_loss: 0.7346, test_loss: 0.7912, test_f1: 0.6388
 epoch: 35, train_loss: 0.7380, test_loss: 0.8374, test_f1: 0.6139
 epoch: 36, train_loss: 0.7526, test_loss: 0.7843, test_f1: 0.6282
 epoch: 37, train_loss: 0.7290, test_loss: 0.7701, test_f1: 0.6156
 epoch: 38, train_loss: 0.7223, test_loss: 0.8203, test_f1: 0.6107
 epoch: 39, train_loss: 0.7191, test_loss: 0.7815, test_f1: 0.6188
 epoch: 40, train_loss: 0.7086, test_loss: 0.7787, test_f1: 0.6212
 epoch: 41, train_loss: 0.7215, test_loss: 0.7867, test_f1: 0.6279
 epoch: 42, train_loss: 0.7164, test_loss: 0.7713, test_f1: 0.6105
 epoch: 43, train_loss: 0.7172, test_loss: 0.7927, test_f1: 0.6185
 epoch: 44, train_loss: 0.7080, test_loss: 0.8314, test_f1: 0.6244
 epoch: 45, train_loss: 0.6977, test_loss: 0.7839, test_f1: 0.6238
 epoch: 46, train_loss: 0.7029, test_loss: 0.7729, test_f1: 0.6372
 epoch: 47, train_loss: 0.6935, test_loss: 0.7826, test_f1: 0.6438
 epoch: 48, train_loss: 0.6990, test_loss: 0.8151, test_f1: 0.6253
 epoch: 49, train_loss: 0.6973, test_loss: 0.7438, test_f1: 0.6393
 epoch: 50, train_loss: 0.6902, test_loss: 0.8112, test_f1: 0.6259
 epoch: 51, train_loss: 0.6704, test_loss: 0.7746, test_f1: 0.6479
 epoch: 52, train_loss: 0.6598, test_loss: 0.8013, test_f1: 0.6213
 epoch: 53, train_loss: 0.6575, test_loss: 0.7862, test_f1: 0.6267
 epoch: 54, train_loss: 0.6561, test_loss: 0.7620, test_f1: 0.6497
 epoch: 55, train_loss: 0.6406, test_loss: 0.7979, test_f1: 0.6444
 epoch: 56, train_loss: 0.6571, test_loss: 0.7762, test_f1: 0.6492
 epoch: 57, train_loss: 0.6415, test_loss: 0.7863, test_f1: 0.6373
 epoch: 58, train_loss: 0.6428, test_loss: 0.8059, test_f1: 0.6444
 epoch: 59, train_loss: 0.6425, test_loss: 0.7631, test_f1: 0.6258
 epoch: 60, train_loss: 0.6425, test_loss: 0.7657, test_f1: 0.6318
 epoch: 61, train_loss: 0.6480, test_loss: 0.7862, test_f1: 0.6212
 epoch: 62, train_loss: 0.6251, test_loss: 0.7484, test_f1: 0.6455
 epoch: 63, train_loss: 0.6336, test_loss: 0.7746, test_f1: 0.6563
 epoch: 64, train_loss: 0.6260, test_loss: 0.7758, test_f1: 0.6417
 epoch: 65, train_loss: 0.6264, test_loss: 0.7820, test_f1: 0.6427
 epoch: 66, train_loss: 0.6307, test_loss: 0.7989, test_f1: 0.6189
 epoch: 67, train_loss: 0.6305, test_loss: 0.7880, test_f1: 0.6293
 epoch: 68, train_loss: 0.6363, test_loss: 0.7647, test_f1: 0.6296
 epoch: 69, train_loss: 0.6222, test_loss: 0.8020, test_f1: 0.6181
 epoch: 70, train_loss: 0.6296, test_loss: 0.7709, test_f1: 0.6465
 epoch: 71, train_loss: 0.6061, test_loss: 0.7982, test_f1: 0.6427
 epoch: 72, train_loss: 0.6117, test_loss: 0.7942, test_f1: 0.6306
 epoch: 73, train_loss: 0.6241, test_loss: 0.7651, test_f1: 0.6422
 epoch: 74, train_loss: 0.6240, test_loss: 0.7255, test_f1: 0.6418
 epoch: 75, train_loss: 0.6268, test_loss: 0.7269, test_f1: 0.6508
 epoch: 76, train_loss: 0.6095, test_loss: 0.7507, test_f1: 0.6419
 epoch: 77, train_loss: 0.5961, test_loss: 0.8087, test_f1: 0.6358
 epoch: 78, train_loss: 0.6068, test_loss: 0.7741, test_f1: 0.6362
 epoch: 79, train_loss: 0.6091, test_loss: 0.7855, test_f1: 0.6375
 epoch: 80, train_loss: 0.6082, test_loss: 0.7836, test_f1: 0.6359
 epoch: 81, train_loss: 0.6100, test_loss: 0.7826, test_f1: 0.6404
 epoch: 82, train_loss: 0.6154, test_loss: 0.8150, test_f1: 0.6235
 epoch: 83, train_loss: 0.6055, test_loss: 0.7814, test_f1: 0.6304
 epoch: 84, train_loss: 0.5979, test_loss: 0.7899, test_f1: 0.6240
 epoch: 85, train_loss: 0.5891, test_loss: 0.7752, test_f1: 0.6533
 epoch: 86, train_loss: 0.6024, test_loss: 0.7495, test_f1: 0.6601
 epoch: 87, train_loss: 0.5952, test_loss: 0.7857, test_f1: 0.6380
 epoch: 88, train_loss: 0.6006, test_loss: 0.8193, test_f1: 0.6291
 epoch: 89, train_loss: 0.5904, test_loss: 0.7881, test_f1: 0.6264
 epoch: 90, train_loss: 0.5890, test_loss: 0.7843, test_f1: 0.6193
 epoch: 91, train_loss: 0.5992, test_loss: 0.8033, test_f1: 0.6362
 epoch: 92, train_loss: 0.6094, test_loss: 0.8756, test_f1: 0.6192
 epoch: 93, train_loss: 0.5807, test_loss: 0.8020, test_f1: 0.6305
 epoch: 94, train_loss: 0.5973, test_loss: 0.8081, test_f1: 0.6467
 epoch: 95, train_loss: 0.5992, test_loss: 0.7617, test_f1: 0.6425
 epoch: 96, train_loss: 0.5869, test_loss: 0.7996, test_f1: 0.6627
 epoch: 97, train_loss: 0.5776, test_loss: 0.7863, test_f1: 0.6346
 epoch: 98, train_loss: 0.5816, test_loss: 0.7680, test_f1: 0.6481
 epoch: 99, train_loss: 0.5820, test_loss: 0.7928, test_f1: 0.6244

Training completed in 819.24 seconds
Best F1: 0.6842 at epoch 62
Mean F1 across iterations: 0.6636  0.0146
========================FINAL RESULTS================================
FEGIN weighted F1: 0.6842  0.0146
python main.py --data ltspice_examples --representation component_pin --model FEGIN --layers 2 --hiddens 32 --batch_size 32 --lr 0.001 --emb_size 512 --epochs 100 --save_appendix component_pin_L2_H32_BS32_LR0.001_E512 --no_val
-----



STDERR:
  File "main.py", line 370, in <module>
    main()
  File "main.py", line 254, in main
    dataset = dataset_class(
  File "/home/philip/projects/ltspice_examples_code_repo/Circuit-Completion-Using-GNNs/component_classification_with_link_prediction_head/evaluation/FEGIN/kernel/circuit_datasets.py", line 15, in __init__
    self.data, self.slices = torch.load(self.processed_paths[0])
  File "/home/philip/.local/lib/python3.8/site-packages/torch/serialization.py", line 1040, in load
    warnings.warn(
  File "/usr/lib/python3.8/warnings.py", line 109, in _showwarnmsg
    sw(msg.message, msg.category, msg.filename, msg.lineno,
  File "main.py", line 47, in warn_with_traceback
    traceback.print_stack(file=log)
/home/philip/projects/ltspice_examples_code_repo/Circuit-Completion-Using-GNNs/component_classification_with_link_prediction_head/evaluation/FEGIN/kernel/circuit_datasets.py:15: FutureWarning: You are using `torch.load` with `weights_only=False` (the current default value), which uses the default pickle module implicitly. It is possible to construct malicious pickle data which will execute arbitrary code during unpickling (See https://github.com/pytorch/pytorch/blob/main/SECURITY.md#untrusted-models for more details). In a future release, the default value for `weights_only` will be flipped to `True`. This limits the functions that could be executed during unpickling. Arbitrary objects will no longer be allowed to be loaded via this mode unless they are explicitly allowlisted by the user via `torch.serialization.add_safe_globals`. We recommend you start setting `weights_only=True` for any use case where you don't have full control of the loaded file. Please open an issue on GitHub for any issues related to this experimental feature.
  self.data, self.slices = torch.load(self.processed_paths[0])
