STDOUT:
Results will be saved in /home/philip/projects/ltspice_examples_code_repo/Circuit-Completion-Using-GNNs/component_classification_with_link_prediction_head/evaluation/FEGIN/results/model_FEGIN_dataset_ltspice_examples
Command line input: python main.py --data ltspice_examples --representation component_pin_net --model FEGIN --layers 2 --hiddens 64 --batch_size 256 --lr 0.0001 --emb_size 512 --epochs 100 --save_appendix component_pin_net_L2_H64_BS256_LR0.0001_E512 --no_val
 is saved.
-----
ltspice_examples - FEGIN
Using 2 layers, 64 hidden units, h = 2
Loading component_pin_net representation dataset
ENTERED
Training FEGIN on component_pin_net representation
Train: 3558, Test: 846
##################ITERATION #0 ****************************************
 epoch: 0, train_loss: 1.3938, test_loss: 1.3924, test_f1: 0.1004
 epoch: 1, train_loss: 1.3854, test_loss: 1.3878, test_f1: 0.1004
 epoch: 2, train_loss: 1.3799, test_loss: 1.3824, test_f1: 0.1004
 epoch: 3, train_loss: 1.3731, test_loss: 1.3739, test_f1: 0.1162
 epoch: 4, train_loss: 1.3657, test_loss: 1.3633, test_f1: 0.1264
 epoch: 5, train_loss: 1.3557, test_loss: 1.3520, test_f1: 0.1436
 epoch: 6, train_loss: 1.3466, test_loss: 1.3395, test_f1: 0.2655
 epoch: 7, train_loss: 1.3338, test_loss: 1.3259, test_f1: 0.2809
 epoch: 8, train_loss: 1.3191, test_loss: 1.3113, test_f1: 0.2586
 epoch: 9, train_loss: 1.3049, test_loss: 1.2959, test_f1: 0.2555
 epoch: 10, train_loss: 1.2914, test_loss: 1.2800, test_f1: 0.2304
 epoch: 11, train_loss: 1.2741, test_loss: 1.2645, test_f1: 0.2302
 epoch: 12, train_loss: 1.2608, test_loss: 1.2502, test_f1: 0.2295
 epoch: 13, train_loss: 1.2504, test_loss: 1.2367, test_f1: 0.2270
 epoch: 14, train_loss: 1.2345, test_loss: 1.2237, test_f1: 0.2270
 epoch: 15, train_loss: 1.2271, test_loss: 1.2115, test_f1: 0.2270
 epoch: 16, train_loss: 1.2158, test_loss: 1.1998, test_f1: 0.2270
 epoch: 17, train_loss: 1.2086, test_loss: 1.1893, test_f1: 0.2679
 epoch: 18, train_loss: 1.1966, test_loss: 1.1791, test_f1: 0.2979
 epoch: 19, train_loss: 1.1889, test_loss: 1.1689, test_f1: 0.3155
 epoch: 20, train_loss: 1.1786, test_loss: 1.1589, test_f1: 0.3474
 epoch: 21, train_loss: 1.1733, test_loss: 1.1488, test_f1: 0.3673
 epoch: 22, train_loss: 1.1622, test_loss: 1.1386, test_f1: 0.3912
 epoch: 23, train_loss: 1.1538, test_loss: 1.1294, test_f1: 0.3900
 epoch: 24, train_loss: 1.1431, test_loss: 1.1190, test_f1: 0.4134
 epoch: 25, train_loss: 1.1345, test_loss: 1.1079, test_f1: 0.4231
 epoch: 26, train_loss: 1.1258, test_loss: 1.0973, test_f1: 0.4597
 epoch: 27, train_loss: 1.1123, test_loss: 1.0850, test_f1: 0.4577
 epoch: 28, train_loss: 1.1037, test_loss: 1.0735, test_f1: 0.4646
 epoch: 29, train_loss: 1.0920, test_loss: 1.0632, test_f1: 0.4767
 epoch: 30, train_loss: 1.0802, test_loss: 1.0528, test_f1: 0.4816
 epoch: 31, train_loss: 1.0726, test_loss: 1.0443, test_f1: 0.4776
 epoch: 32, train_loss: 1.0592, test_loss: 1.0339, test_f1: 0.4819
 epoch: 33, train_loss: 1.0567, test_loss: 1.0262, test_f1: 0.4820
 epoch: 34, train_loss: 1.0397, test_loss: 1.0198, test_f1: 0.4813
 epoch: 35, train_loss: 1.0378, test_loss: 1.0142, test_f1: 0.4818
 epoch: 36, train_loss: 1.0270, test_loss: 1.0068, test_f1: 0.4905
 epoch: 37, train_loss: 1.0180, test_loss: 1.0005, test_f1: 0.4921
 epoch: 38, train_loss: 1.0170, test_loss: 0.9978, test_f1: 0.4957
 epoch: 39, train_loss: 1.0050, test_loss: 0.9927, test_f1: 0.4988
 epoch: 40, train_loss: 1.0049, test_loss: 0.9919, test_f1: 0.4988
 epoch: 41, train_loss: 0.9967, test_loss: 0.9858, test_f1: 0.5035
 epoch: 42, train_loss: 0.9934, test_loss: 0.9826, test_f1: 0.5022
 epoch: 43, train_loss: 0.9904, test_loss: 0.9789, test_f1: 0.5031
 epoch: 44, train_loss: 0.9890, test_loss: 0.9782, test_f1: 0.4865
 epoch: 45, train_loss: 0.9860, test_loss: 0.9768, test_f1: 0.5032
 epoch: 46, train_loss: 0.9767, test_loss: 0.9708, test_f1: 0.5087
 epoch: 47, train_loss: 0.9775, test_loss: 0.9684, test_f1: 0.4949
 epoch: 48, train_loss: 0.9733, test_loss: 0.9657, test_f1: 0.5053
 epoch: 49, train_loss: 0.9758, test_loss: 0.9644, test_f1: 0.5004
 epoch: 50, train_loss: 0.9660, test_loss: 0.9689, test_f1: 0.5044
 epoch: 51, train_loss: 0.9622, test_loss: 0.9611, test_f1: 0.5090
 epoch: 52, train_loss: 0.9673, test_loss: 0.9597, test_f1: 0.5100
 epoch: 53, train_loss: 0.9640, test_loss: 0.9587, test_f1: 0.5098
 epoch: 54, train_loss: 0.9585, test_loss: 0.9581, test_f1: 0.5169
 epoch: 55, train_loss: 0.9581, test_loss: 0.9564, test_f1: 0.5149
 epoch: 56, train_loss: 0.9609, test_loss: 0.9562, test_f1: 0.5159
 epoch: 57, train_loss: 0.9563, test_loss: 0.9553, test_f1: 0.5110
 epoch: 58, train_loss: 0.9540, test_loss: 0.9539, test_f1: 0.5144
 epoch: 59, train_loss: 0.9547, test_loss: 0.9561, test_f1: 0.5074
 epoch: 60, train_loss: 0.9567, test_loss: 0.9531, test_f1: 0.5079
 epoch: 61, train_loss: 0.9529, test_loss: 0.9509, test_f1: 0.5118
 epoch: 62, train_loss: 0.9571, test_loss: 0.9525, test_f1: 0.5138
 epoch: 63, train_loss: 0.9508, test_loss: 0.9493, test_f1: 0.5150
 epoch: 64, train_loss: 0.9496, test_loss: 0.9480, test_f1: 0.5110
 epoch: 65, train_loss: 0.9486, test_loss: 0.9481, test_f1: 0.5133
 epoch: 66, train_loss: 0.9482, test_loss: 0.9500, test_f1: 0.5170
 epoch: 67, train_loss: 0.9489, test_loss: 0.9445, test_f1: 0.5239
 epoch: 68, train_loss: 0.9428, test_loss: 0.9454, test_f1: 0.5142
 epoch: 69, train_loss: 0.9458, test_loss: 0.9438, test_f1: 0.5138
 epoch: 70, train_loss: 0.9473, test_loss: 0.9432, test_f1: 0.5168
 epoch: 71, train_loss: 0.9381, test_loss: 0.9450, test_f1: 0.5147
 epoch: 72, train_loss: 0.9403, test_loss: 0.9434, test_f1: 0.5224
 epoch: 73, train_loss: 0.9393, test_loss: 0.9389, test_f1: 0.5127
 epoch: 74, train_loss: 0.9460, test_loss: 0.9375, test_f1: 0.5205
 epoch: 75, train_loss: 0.9336, test_loss: 0.9379, test_f1: 0.5153
 epoch: 76, train_loss: 0.9384, test_loss: 0.9359, test_f1: 0.5209
 epoch: 77, train_loss: 0.9347, test_loss: 0.9365, test_f1: 0.5195
 epoch: 78, train_loss: 0.9390, test_loss: 0.9341, test_f1: 0.5197
 epoch: 79, train_loss: 0.9330, test_loss: 0.9367, test_f1: 0.5204
 epoch: 80, train_loss: 0.9338, test_loss: 0.9362, test_f1: 0.5213
 epoch: 81, train_loss: 0.9278, test_loss: 0.9336, test_f1: 0.5192
 epoch: 82, train_loss: 0.9268, test_loss: 0.9327, test_f1: 0.5241
 epoch: 83, train_loss: 0.9283, test_loss: 0.9301, test_f1: 0.5143
 epoch: 84, train_loss: 0.9334, test_loss: 0.9314, test_f1: 0.5220
 epoch: 85, train_loss: 0.9311, test_loss: 0.9343, test_f1: 0.5310
 epoch: 86, train_loss: 0.9285, test_loss: 0.9312, test_f1: 0.5171
 epoch: 87, train_loss: 0.9299, test_loss: 0.9310, test_f1: 0.5149
 epoch: 88, train_loss: 0.9268, test_loss: 0.9312, test_f1: 0.5148
 epoch: 89, train_loss: 0.9224, test_loss: 0.9282, test_f1: 0.5333
 epoch: 90, train_loss: 0.9215, test_loss: 0.9296, test_f1: 0.5236
 epoch: 91, train_loss: 0.9265, test_loss: 0.9257, test_f1: 0.5306
 epoch: 92, train_loss: 0.9212, test_loss: 0.9299, test_f1: 0.5198
 epoch: 93, train_loss: 0.9150, test_loss: 0.9278, test_f1: 0.5234
 epoch: 94, train_loss: 0.9178, test_loss: 0.9251, test_f1: 0.5293
 epoch: 95, train_loss: 0.9192, test_loss: 0.9261, test_f1: 0.5284
 epoch: 96, train_loss: 0.9227, test_loss: 0.9237, test_f1: 0.5334
 epoch: 97, train_loss: 0.9138, test_loss: 0.9255, test_f1: 0.5373
 epoch: 98, train_loss: 0.9080, test_loss: 0.9214, test_f1: 0.5406
 epoch: 99, train_loss: 0.9144, test_loss: 0.9219, test_f1: 0.5239
##################ITERATION #1 ****************************************
 epoch: 0, train_loss: 1.3556, test_loss: 1.3668, test_f1: 0.1004
 epoch: 1, train_loss: 1.3352, test_loss: 1.3582, test_f1: 0.1004
 epoch: 2, train_loss: 1.3220, test_loss: 1.3467, test_f1: 0.2111
 epoch: 3, train_loss: 1.3074, test_loss: 1.3257, test_f1: 0.2578
 epoch: 4, train_loss: 1.2902, test_loss: 1.2914, test_f1: 0.2404
 epoch: 5, train_loss: 1.2747, test_loss: 1.2621, test_f1: 0.3130
 epoch: 6, train_loss: 1.2560, test_loss: 1.2377, test_f1: 0.3465
 epoch: 7, train_loss: 1.2356, test_loss: 1.2156, test_f1: 0.3403
 epoch: 8, train_loss: 1.2180, test_loss: 1.1939, test_f1: 0.3422
 epoch: 9, train_loss: 1.2004, test_loss: 1.1735, test_f1: 0.3460
 epoch: 10, train_loss: 1.1822, test_loss: 1.1543, test_f1: 0.3460
 epoch: 11, train_loss: 1.1644, test_loss: 1.1366, test_f1: 0.3460
 epoch: 12, train_loss: 1.1476, test_loss: 1.1206, test_f1: 0.3450
 epoch: 13, train_loss: 1.1317, test_loss: 1.1048, test_f1: 0.3448
 epoch: 14, train_loss: 1.1157, test_loss: 1.0912, test_f1: 0.3429
 epoch: 15, train_loss: 1.1059, test_loss: 1.0798, test_f1: 0.3428
 epoch: 16, train_loss: 1.0896, test_loss: 1.0699, test_f1: 0.3426
 epoch: 17, train_loss: 1.0832, test_loss: 1.0607, test_f1: 0.3502
 epoch: 18, train_loss: 1.0767, test_loss: 1.0524, test_f1: 0.3596
 epoch: 19, train_loss: 1.0662, test_loss: 1.0458, test_f1: 0.3639
 epoch: 20, train_loss: 1.0604, test_loss: 1.0396, test_f1: 0.3810
 epoch: 21, train_loss: 1.0533, test_loss: 1.0339, test_f1: 0.3863
 epoch: 22, train_loss: 1.0481, test_loss: 1.0288, test_f1: 0.3899
 epoch: 23, train_loss: 1.0390, test_loss: 1.0244, test_f1: 0.3994
 epoch: 24, train_loss: 1.0326, test_loss: 1.0189, test_f1: 0.4052
 epoch: 25, train_loss: 1.0294, test_loss: 1.0129, test_f1: 0.4131
 epoch: 26, train_loss: 1.0221, test_loss: 1.0087, test_f1: 0.4118
 epoch: 27, train_loss: 1.0232, test_loss: 1.0036, test_f1: 0.4121
 epoch: 28, train_loss: 1.0126, test_loss: 0.9999, test_f1: 0.4261
 epoch: 29, train_loss: 1.0070, test_loss: 0.9933, test_f1: 0.4337
 epoch: 30, train_loss: 1.0046, test_loss: 0.9898, test_f1: 0.4417
 epoch: 31, train_loss: 1.0049, test_loss: 0.9873, test_f1: 0.4441
 epoch: 32, train_loss: 1.0028, test_loss: 0.9868, test_f1: 0.4614
 epoch: 33, train_loss: 0.9930, test_loss: 0.9816, test_f1: 0.4721
 epoch: 34, train_loss: 0.9932, test_loss: 0.9797, test_f1: 0.4698
 epoch: 35, train_loss: 0.9821, test_loss: 0.9719, test_f1: 0.4750
 epoch: 36, train_loss: 0.9835, test_loss: 0.9671, test_f1: 0.4830
 epoch: 37, train_loss: 0.9814, test_loss: 0.9635, test_f1: 0.4753
 epoch: 38, train_loss: 0.9717, test_loss: 0.9600, test_f1: 0.4849
 epoch: 39, train_loss: 0.9744, test_loss: 0.9578, test_f1: 0.4879
 epoch: 40, train_loss: 0.9680, test_loss: 0.9541, test_f1: 0.4864
 epoch: 41, train_loss: 0.9642, test_loss: 0.9532, test_f1: 0.4937
 epoch: 42, train_loss: 0.9637, test_loss: 0.9503, test_f1: 0.4970
 epoch: 43, train_loss: 0.9587, test_loss: 0.9477, test_f1: 0.4859
 epoch: 44, train_loss: 0.9616, test_loss: 0.9442, test_f1: 0.5017
 epoch: 45, train_loss: 0.9553, test_loss: 0.9397, test_f1: 0.5010
 epoch: 46, train_loss: 0.9516, test_loss: 0.9369, test_f1: 0.4985
 epoch: 47, train_loss: 0.9492, test_loss: 0.9334, test_f1: 0.5001
 epoch: 48, train_loss: 0.9505, test_loss: 0.9368, test_f1: 0.5036
 epoch: 49, train_loss: 0.9459, test_loss: 0.9303, test_f1: 0.5088
 epoch: 50, train_loss: 0.9424, test_loss: 0.9302, test_f1: 0.5089
 epoch: 51, train_loss: 0.9331, test_loss: 0.9285, test_f1: 0.5047
 epoch: 52, train_loss: 0.9381, test_loss: 0.9244, test_f1: 0.5065
 epoch: 53, train_loss: 0.9336, test_loss: 0.9245, test_f1: 0.5084
 epoch: 54, train_loss: 0.9313, test_loss: 0.9251, test_f1: 0.5112
 epoch: 55, train_loss: 0.9339, test_loss: 0.9227, test_f1: 0.5102
 epoch: 56, train_loss: 0.9334, test_loss: 0.9209, test_f1: 0.5103
 epoch: 57, train_loss: 0.9272, test_loss: 0.9222, test_f1: 0.5114
 epoch: 58, train_loss: 0.9243, test_loss: 0.9214, test_f1: 0.5134
 epoch: 59, train_loss: 0.9222, test_loss: 0.9199, test_f1: 0.5094
 epoch: 60, train_loss: 0.9310, test_loss: 0.9173, test_f1: 0.5124
 epoch: 61, train_loss: 0.9276, test_loss: 0.9155, test_f1: 0.5130
 epoch: 62, train_loss: 0.9275, test_loss: 0.9132, test_f1: 0.5193
 epoch: 63, train_loss: 0.9241, test_loss: 0.9145, test_f1: 0.5105
 epoch: 64, train_loss: 0.9248, test_loss: 0.9127, test_f1: 0.5148
 epoch: 65, train_loss: 0.9211, test_loss: 0.9125, test_f1: 0.5105
 epoch: 66, train_loss: 0.9196, test_loss: 0.9118, test_f1: 0.5147
 epoch: 67, train_loss: 0.9192, test_loss: 0.9119, test_f1: 0.5087
 epoch: 68, train_loss: 0.9177, test_loss: 0.9108, test_f1: 0.5108
 epoch: 69, train_loss: 0.9138, test_loss: 0.9061, test_f1: 0.5245
 epoch: 70, train_loss: 0.9127, test_loss: 0.9067, test_f1: 0.5167
 epoch: 71, train_loss: 0.9158, test_loss: 0.9063, test_f1: 0.5143
 epoch: 72, train_loss: 0.9136, test_loss: 0.9067, test_f1: 0.5200
 epoch: 73, train_loss: 0.9074, test_loss: 0.9007, test_f1: 0.5219
 epoch: 74, train_loss: 0.9055, test_loss: 0.9027, test_f1: 0.5224
 epoch: 75, train_loss: 0.9104, test_loss: 0.9049, test_f1: 0.5223
 epoch: 76, train_loss: 0.9032, test_loss: 0.9017, test_f1: 0.5211
 epoch: 77, train_loss: 0.9077, test_loss: 0.9017, test_f1: 0.5254
 epoch: 78, train_loss: 0.8973, test_loss: 0.9017, test_f1: 0.5245
 epoch: 79, train_loss: 0.9051, test_loss: 0.9015, test_f1: 0.5136
 epoch: 80, train_loss: 0.9017, test_loss: 0.8977, test_f1: 0.5364
 epoch: 81, train_loss: 0.8998, test_loss: 0.8958, test_f1: 0.5343
 epoch: 82, train_loss: 0.8965, test_loss: 0.8944, test_f1: 0.5330
 epoch: 83, train_loss: 0.8943, test_loss: 0.8945, test_f1: 0.5275
 epoch: 84, train_loss: 0.8892, test_loss: 0.8956, test_f1: 0.5299
 epoch: 85, train_loss: 0.8930, test_loss: 0.8950, test_f1: 0.5272
 epoch: 86, train_loss: 0.8906, test_loss: 0.8945, test_f1: 0.5259
 epoch: 87, train_loss: 0.8977, test_loss: 0.8930, test_f1: 0.5282
 epoch: 88, train_loss: 0.8929, test_loss: 0.8908, test_f1: 0.5350
 epoch: 89, train_loss: 0.8847, test_loss: 0.8901, test_f1: 0.5354
 epoch: 90, train_loss: 0.8878, test_loss: 0.8888, test_f1: 0.5332
 epoch: 91, train_loss: 0.8840, test_loss: 0.8899, test_f1: 0.5332
 epoch: 92, train_loss: 0.8869, test_loss: 0.8906, test_f1: 0.5309
 epoch: 93, train_loss: 0.8817, test_loss: 0.8917, test_f1: 0.5292
 epoch: 94, train_loss: 0.8784, test_loss: 0.8856, test_f1: 0.5349
 epoch: 95, train_loss: 0.8773, test_loss: 0.8804, test_f1: 0.5334
 epoch: 96, train_loss: 0.8799, test_loss: 0.8834, test_f1: 0.5401
 epoch: 97, train_loss: 0.8752, test_loss: 0.8833, test_f1: 0.5344
 epoch: 98, train_loss: 0.8823, test_loss: 0.8824, test_f1: 0.5352
 epoch: 99, train_loss: 0.8743, test_loss: 0.8806, test_f1: 0.5417
##################ITERATION #2 ****************************************
 epoch: 0, train_loss: 1.3506, test_loss: 1.3593, test_f1: 0.2270
 epoch: 1, train_loss: 1.3228, test_loss: 1.3510, test_f1: 0.2270
 epoch: 2, train_loss: 1.3025, test_loss: 1.3340, test_f1: 0.2270
 epoch: 3, train_loss: 1.2857, test_loss: 1.3046, test_f1: 0.2527
 epoch: 4, train_loss: 1.2666, test_loss: 1.2667, test_f1: 0.3299
 epoch: 5, train_loss: 1.2446, test_loss: 1.2304, test_f1: 0.3471
 epoch: 6, train_loss: 1.2252, test_loss: 1.1986, test_f1: 0.3536
 epoch: 7, train_loss: 1.2053, test_loss: 1.1719, test_f1: 0.3441
 epoch: 8, train_loss: 1.1823, test_loss: 1.1465, test_f1: 0.3441
 epoch: 9, train_loss: 1.1653, test_loss: 1.1262, test_f1: 0.3451
 epoch: 10, train_loss: 1.1443, test_loss: 1.1081, test_f1: 0.3460
 epoch: 11, train_loss: 1.1307, test_loss: 1.0916, test_f1: 0.3460
 epoch: 12, train_loss: 1.1152, test_loss: 1.0781, test_f1: 0.3429
 epoch: 13, train_loss: 1.0987, test_loss: 1.0665, test_f1: 0.3438
 epoch: 14, train_loss: 1.0878, test_loss: 1.0581, test_f1: 0.3428
 epoch: 15, train_loss: 1.0781, test_loss: 1.0480, test_f1: 0.3522
 epoch: 16, train_loss: 1.0705, test_loss: 1.0419, test_f1: 0.3591
 epoch: 17, train_loss: 1.0596, test_loss: 1.0338, test_f1: 0.3754
 epoch: 18, train_loss: 1.0504, test_loss: 1.0308, test_f1: 0.3982
 epoch: 19, train_loss: 1.0441, test_loss: 1.0246, test_f1: 0.4041
 epoch: 20, train_loss: 1.0379, test_loss: 1.0189, test_f1: 0.4097
 epoch: 21, train_loss: 1.0331, test_loss: 1.0135, test_f1: 0.4146
 epoch: 22, train_loss: 1.0255, test_loss: 1.0103, test_f1: 0.4227
 epoch: 23, train_loss: 1.0211, test_loss: 1.0064, test_f1: 0.4304
 epoch: 24, train_loss: 1.0168, test_loss: 1.0033, test_f1: 0.4226
 epoch: 25, train_loss: 1.0104, test_loss: 0.9965, test_f1: 0.4340
 epoch: 26, train_loss: 1.0102, test_loss: 0.9905, test_f1: 0.4431
 epoch: 27, train_loss: 1.0037, test_loss: 0.9878, test_f1: 0.4381
 epoch: 28, train_loss: 0.9929, test_loss: 0.9831, test_f1: 0.4721
 epoch: 29, train_loss: 0.9906, test_loss: 0.9750, test_f1: 0.4670
 epoch: 30, train_loss: 0.9892, test_loss: 0.9734, test_f1: 0.4751
 epoch: 31, train_loss: 0.9866, test_loss: 0.9718, test_f1: 0.4813
 epoch: 32, train_loss: 0.9844, test_loss: 0.9688, test_f1: 0.4825
 epoch: 33, train_loss: 0.9727, test_loss: 0.9639, test_f1: 0.4853
 epoch: 34, train_loss: 0.9757, test_loss: 0.9551, test_f1: 0.4871
 epoch: 35, train_loss: 0.9730, test_loss: 0.9540, test_f1: 0.4892
 epoch: 36, train_loss: 0.9705, test_loss: 0.9540, test_f1: 0.4893
 epoch: 37, train_loss: 0.9673, test_loss: 0.9508, test_f1: 0.4936
 epoch: 38, train_loss: 0.9641, test_loss: 0.9516, test_f1: 0.4944
 epoch: 39, train_loss: 0.9581, test_loss: 0.9430, test_f1: 0.4926
 epoch: 40, train_loss: 0.9535, test_loss: 0.9406, test_f1: 0.4983
 epoch: 41, train_loss: 0.9499, test_loss: 0.9384, test_f1: 0.4966
 epoch: 42, train_loss: 0.9528, test_loss: 0.9406, test_f1: 0.4986
 epoch: 43, train_loss: 0.9420, test_loss: 0.9312, test_f1: 0.4929
 epoch: 44, train_loss: 0.9445, test_loss: 0.9316, test_f1: 0.5004
 epoch: 45, train_loss: 0.9386, test_loss: 0.9338, test_f1: 0.4923
 epoch: 46, train_loss: 0.9346, test_loss: 0.9283, test_f1: 0.4925
 epoch: 47, train_loss: 0.9327, test_loss: 0.9202, test_f1: 0.4953
 epoch: 48, train_loss: 0.9301, test_loss: 0.9246, test_f1: 0.5067
 epoch: 49, train_loss: 0.9289, test_loss: 0.9152, test_f1: 0.5169
 epoch: 50, train_loss: 0.9241, test_loss: 0.9134, test_f1: 0.5119
 epoch: 51, train_loss: 0.9182, test_loss: 0.9107, test_f1: 0.5091
 epoch: 52, train_loss: 0.9187, test_loss: 0.9118, test_f1: 0.5107
 epoch: 53, train_loss: 0.9170, test_loss: 0.9105, test_f1: 0.5137
 epoch: 54, train_loss: 0.9213, test_loss: 0.9096, test_f1: 0.5117
 epoch: 55, train_loss: 0.9140, test_loss: 0.9084, test_f1: 0.5144
 epoch: 56, train_loss: 0.9155, test_loss: 0.9097, test_f1: 0.5128
 epoch: 57, train_loss: 0.9103, test_loss: 0.9054, test_f1: 0.5131
 epoch: 58, train_loss: 0.9119, test_loss: 0.9036, test_f1: 0.5181
 epoch: 59, train_loss: 0.9094, test_loss: 0.9045, test_f1: 0.5210
 epoch: 60, train_loss: 0.9121, test_loss: 0.8999, test_f1: 0.5152
 epoch: 61, train_loss: 0.9109, test_loss: 0.9005, test_f1: 0.5171
 epoch: 62, train_loss: 0.8990, test_loss: 0.8981, test_f1: 0.5194
 epoch: 63, train_loss: 0.9051, test_loss: 0.8974, test_f1: 0.5223
 epoch: 64, train_loss: 0.9008, test_loss: 0.9001, test_f1: 0.5209
 epoch: 65, train_loss: 0.9032, test_loss: 0.8971, test_f1: 0.5211
 epoch: 66, train_loss: 0.8976, test_loss: 0.8931, test_f1: 0.5268
 epoch: 67, train_loss: 0.8971, test_loss: 0.8926, test_f1: 0.5280
 epoch: 68, train_loss: 0.8915, test_loss: 0.8909, test_f1: 0.5264
 epoch: 69, train_loss: 0.9000, test_loss: 0.8944, test_f1: 0.5309
 epoch: 70, train_loss: 0.8932, test_loss: 0.8857, test_f1: 0.5297
 epoch: 71, train_loss: 0.8913, test_loss: 0.8917, test_f1: 0.5317
 epoch: 72, train_loss: 0.8881, test_loss: 0.8846, test_f1: 0.5396
 epoch: 73, train_loss: 0.8877, test_loss: 0.8903, test_f1: 0.5270
 epoch: 74, train_loss: 0.8927, test_loss: 0.8851, test_f1: 0.5332
 epoch: 75, train_loss: 0.8891, test_loss: 0.8900, test_f1: 0.5241
 epoch: 76, train_loss: 0.8873, test_loss: 0.8873, test_f1: 0.5224
 epoch: 77, train_loss: 0.8860, test_loss: 0.8882, test_f1: 0.5303
 epoch: 78, train_loss: 0.8776, test_loss: 0.8856, test_f1: 0.5327
 epoch: 79, train_loss: 0.8790, test_loss: 0.8836, test_f1: 0.5300
 epoch: 80, train_loss: 0.8774, test_loss: 0.8808, test_f1: 0.5283
 epoch: 81, train_loss: 0.8771, test_loss: 0.8830, test_f1: 0.5230
 epoch: 82, train_loss: 0.8771, test_loss: 0.8858, test_f1: 0.5285
 epoch: 83, train_loss: 0.8798, test_loss: 0.8729, test_f1: 0.5343
 epoch: 84, train_loss: 0.8791, test_loss: 0.8789, test_f1: 0.5375
 epoch: 85, train_loss: 0.8734, test_loss: 0.8776, test_f1: 0.5322
 epoch: 86, train_loss: 0.8732, test_loss: 0.8807, test_f1: 0.5297
 epoch: 87, train_loss: 0.8651, test_loss: 0.8750, test_f1: 0.5304
 epoch: 88, train_loss: 0.8756, test_loss: 0.8770, test_f1: 0.5344
 epoch: 89, train_loss: 0.8676, test_loss: 0.8793, test_f1: 0.5343
 epoch: 90, train_loss: 0.8680, test_loss: 0.8732, test_f1: 0.5375
 epoch: 91, train_loss: 0.8655, test_loss: 0.8683, test_f1: 0.5403
 epoch: 92, train_loss: 0.8678, test_loss: 0.8782, test_f1: 0.5294
 epoch: 93, train_loss: 0.8642, test_loss: 0.8808, test_f1: 0.5312
 epoch: 94, train_loss: 0.8596, test_loss: 0.8756, test_f1: 0.5340
 epoch: 95, train_loss: 0.8631, test_loss: 0.8718, test_f1: 0.5270
 epoch: 96, train_loss: 0.8609, test_loss: 0.8736, test_f1: 0.5362
 epoch: 97, train_loss: 0.8604, test_loss: 0.8675, test_f1: 0.5426
 epoch: 98, train_loss: 0.8545, test_loss: 0.8705, test_f1: 0.5306
 epoch: 99, train_loss: 0.8621, test_loss: 0.8688, test_f1: 0.5359
##################ITERATION #3 ****************************************
 epoch: 0, train_loss: 1.3075, test_loss: 1.3169, test_f1: 0.2270
 epoch: 1, train_loss: 1.2738, test_loss: 1.2994, test_f1: 0.2270
 epoch: 2, train_loss: 1.2537, test_loss: 1.2723, test_f1: 0.2270
 epoch: 3, train_loss: 1.2374, test_loss: 1.2343, test_f1: 0.2270
 epoch: 4, train_loss: 1.2186, test_loss: 1.1994, test_f1: 0.3275
 epoch: 5, train_loss: 1.1969, test_loss: 1.1681, test_f1: 0.3419
 epoch: 6, train_loss: 1.1777, test_loss: 1.1414, test_f1: 0.3499
 epoch: 7, train_loss: 1.1579, test_loss: 1.1176, test_f1: 0.3513
 epoch: 8, train_loss: 1.1378, test_loss: 1.0971, test_f1: 0.3611
 epoch: 9, train_loss: 1.1152, test_loss: 1.0805, test_f1: 0.3846
 epoch: 10, train_loss: 1.1002, test_loss: 1.0655, test_f1: 0.3988
 epoch: 11, train_loss: 1.0860, test_loss: 1.0515, test_f1: 0.4114
 epoch: 12, train_loss: 1.0730, test_loss: 1.0392, test_f1: 0.4151
 epoch: 13, train_loss: 1.0586, test_loss: 1.0307, test_f1: 0.4275
 epoch: 14, train_loss: 1.0516, test_loss: 1.0216, test_f1: 0.4345
 epoch: 15, train_loss: 1.0458, test_loss: 1.0153, test_f1: 0.4355
 epoch: 16, train_loss: 1.0406, test_loss: 1.0081, test_f1: 0.4405
 epoch: 17, train_loss: 1.0283, test_loss: 1.0020, test_f1: 0.4397
 epoch: 18, train_loss: 1.0226, test_loss: 0.9967, test_f1: 0.4548
 epoch: 19, train_loss: 1.0152, test_loss: 0.9904, test_f1: 0.4603
 epoch: 20, train_loss: 1.0085, test_loss: 0.9840, test_f1: 0.4697
 epoch: 21, train_loss: 1.0054, test_loss: 0.9835, test_f1: 0.4764
 epoch: 22, train_loss: 1.0005, test_loss: 0.9780, test_f1: 0.4777
 epoch: 23, train_loss: 0.9944, test_loss: 0.9765, test_f1: 0.4853
 epoch: 24, train_loss: 0.9871, test_loss: 0.9714, test_f1: 0.4866
 epoch: 25, train_loss: 0.9868, test_loss: 0.9642, test_f1: 0.4856
 epoch: 26, train_loss: 0.9807, test_loss: 0.9603, test_f1: 0.4973
 epoch: 27, train_loss: 0.9767, test_loss: 0.9577, test_f1: 0.4977
 epoch: 28, train_loss: 0.9697, test_loss: 0.9528, test_f1: 0.4935
 epoch: 29, train_loss: 0.9690, test_loss: 0.9505, test_f1: 0.4963
 epoch: 30, train_loss: 0.9644, test_loss: 0.9476, test_f1: 0.4937
 epoch: 31, train_loss: 0.9631, test_loss: 0.9456, test_f1: 0.4944
 epoch: 32, train_loss: 0.9634, test_loss: 0.9434, test_f1: 0.4946
 epoch: 33, train_loss: 0.9498, test_loss: 0.9437, test_f1: 0.4945
 epoch: 34, train_loss: 0.9491, test_loss: 0.9356, test_f1: 0.5108
 epoch: 35, train_loss: 0.9446, test_loss: 0.9360, test_f1: 0.5120
 epoch: 36, train_loss: 0.9437, test_loss: 0.9322, test_f1: 0.5005
 epoch: 37, train_loss: 0.9420, test_loss: 0.9276, test_f1: 0.5159
 epoch: 38, train_loss: 0.9381, test_loss: 0.9278, test_f1: 0.5124
 epoch: 39, train_loss: 0.9365, test_loss: 0.9284, test_f1: 0.5119
 epoch: 40, train_loss: 0.9246, test_loss: 0.9211, test_f1: 0.5149
 epoch: 41, train_loss: 0.9272, test_loss: 0.9234, test_f1: 0.5157
 epoch: 42, train_loss: 0.9219, test_loss: 0.9151, test_f1: 0.5220
 epoch: 43, train_loss: 0.9189, test_loss: 0.9160, test_f1: 0.5208
 epoch: 44, train_loss: 0.9171, test_loss: 0.9122, test_f1: 0.5159
 epoch: 45, train_loss: 0.9234, test_loss: 0.9096, test_f1: 0.5230
 epoch: 46, train_loss: 0.9113, test_loss: 0.9006, test_f1: 0.5217
 epoch: 47, train_loss: 0.9108, test_loss: 0.9064, test_f1: 0.5191
 epoch: 48, train_loss: 0.9044, test_loss: 0.8976, test_f1: 0.5319
 epoch: 49, train_loss: 0.9054, test_loss: 0.8920, test_f1: 0.5235
 epoch: 50, train_loss: 0.9045, test_loss: 0.8858, test_f1: 0.5329
 epoch: 51, train_loss: 0.8912, test_loss: 0.8876, test_f1: 0.5244
 epoch: 52, train_loss: 0.8964, test_loss: 0.8870, test_f1: 0.5222
 epoch: 53, train_loss: 0.8895, test_loss: 0.8825, test_f1: 0.5324
 epoch: 54, train_loss: 0.8888, test_loss: 0.8802, test_f1: 0.5211
 epoch: 55, train_loss: 0.8898, test_loss: 0.8797, test_f1: 0.5340
 epoch: 56, train_loss: 0.8864, test_loss: 0.8793, test_f1: 0.5272
 epoch: 57, train_loss: 0.8884, test_loss: 0.8803, test_f1: 0.5209
 epoch: 58, train_loss: 0.8806, test_loss: 0.8794, test_f1: 0.5255
 epoch: 59, train_loss: 0.8852, test_loss: 0.8774, test_f1: 0.5291
 epoch: 60, train_loss: 0.8828, test_loss: 0.8772, test_f1: 0.5230
 epoch: 61, train_loss: 0.8803, test_loss: 0.8753, test_f1: 0.5315
 epoch: 62, train_loss: 0.8757, test_loss: 0.8757, test_f1: 0.5339
 epoch: 63, train_loss: 0.8766, test_loss: 0.8710, test_f1: 0.5304
 epoch: 64, train_loss: 0.8745, test_loss: 0.8690, test_f1: 0.5347
 epoch: 65, train_loss: 0.8698, test_loss: 0.8683, test_f1: 0.5301
 epoch: 66, train_loss: 0.8709, test_loss: 0.8695, test_f1: 0.5270
 epoch: 67, train_loss: 0.8686, test_loss: 0.8674, test_f1: 0.5233
 epoch: 68, train_loss: 0.8679, test_loss: 0.8653, test_f1: 0.5309
 epoch: 69, train_loss: 0.8708, test_loss: 0.8664, test_f1: 0.5269
 epoch: 70, train_loss: 0.8651, test_loss: 0.8641, test_f1: 0.5379
 epoch: 71, train_loss: 0.8644, test_loss: 0.8610, test_f1: 0.5265
 epoch: 72, train_loss: 0.8658, test_loss: 0.8605, test_f1: 0.5262
 epoch: 73, train_loss: 0.8622, test_loss: 0.8593, test_f1: 0.5380
 epoch: 74, train_loss: 0.8622, test_loss: 0.8588, test_f1: 0.5388
 epoch: 75, train_loss: 0.8572, test_loss: 0.8580, test_f1: 0.5319
 epoch: 76, train_loss: 0.8604, test_loss: 0.8576, test_f1: 0.5428
 epoch: 77, train_loss: 0.8600, test_loss: 0.8588, test_f1: 0.5306
 epoch: 78, train_loss: 0.8603, test_loss: 0.8554, test_f1: 0.5284
 epoch: 79, train_loss: 0.8550, test_loss: 0.8512, test_f1: 0.5461
 epoch: 80, train_loss: 0.8534, test_loss: 0.8575, test_f1: 0.5281
 epoch: 81, train_loss: 0.8523, test_loss: 0.8527, test_f1: 0.5345
 epoch: 82, train_loss: 0.8427, test_loss: 0.8508, test_f1: 0.5414
 epoch: 83, train_loss: 0.8453, test_loss: 0.8511, test_f1: 0.5384
 epoch: 84, train_loss: 0.8528, test_loss: 0.8516, test_f1: 0.5343
 epoch: 85, train_loss: 0.8469, test_loss: 0.8490, test_f1: 0.5404
 epoch: 86, train_loss: 0.8500, test_loss: 0.8505, test_f1: 0.5504
 epoch: 87, train_loss: 0.8502, test_loss: 0.8497, test_f1: 0.5478
 epoch: 88, train_loss: 0.8450, test_loss: 0.8518, test_f1: 0.5314
 epoch: 89, train_loss: 0.8479, test_loss: 0.8478, test_f1: 0.5434
 epoch: 90, train_loss: 0.8445, test_loss: 0.8459, test_f1: 0.5435
 epoch: 91, train_loss: 0.8463, test_loss: 0.8458, test_f1: 0.5402
 epoch: 92, train_loss: 0.8399, test_loss: 0.8467, test_f1: 0.5402
 epoch: 93, train_loss: 0.8350, test_loss: 0.8439, test_f1: 0.5375
 epoch: 94, train_loss: 0.8345, test_loss: 0.8406, test_f1: 0.5461
 epoch: 95, train_loss: 0.8330, test_loss: 0.8417, test_f1: 0.5410
 epoch: 96, train_loss: 0.8370, test_loss: 0.8357, test_f1: 0.5437
 epoch: 97, train_loss: 0.8356, test_loss: 0.8384, test_f1: 0.5365
 epoch: 98, train_loss: 0.8324, test_loss: 0.8359, test_f1: 0.5437
 epoch: 99, train_loss: 0.8285, test_loss: 0.8352, test_f1: 0.5452
##################ITERATION #4 ****************************************
 epoch: 0, train_loss: 1.3163, test_loss: 1.3350, test_f1: 0.2270
 epoch: 1, train_loss: 1.2811, test_loss: 1.3234, test_f1: 0.2270
 epoch: 2, train_loss: 1.2555, test_loss: 1.3011, test_f1: 0.2270
 epoch: 3, train_loss: 1.2360, test_loss: 1.2628, test_f1: 0.2320
 epoch: 4, train_loss: 1.2149, test_loss: 1.2197, test_f1: 0.3239
 epoch: 5, train_loss: 1.1982, test_loss: 1.1786, test_f1: 0.4183
 epoch: 6, train_loss: 1.1695, test_loss: 1.1437, test_f1: 0.4247
 epoch: 7, train_loss: 1.1518, test_loss: 1.1181, test_f1: 0.4273
 epoch: 8, train_loss: 1.1369, test_loss: 1.0973, test_f1: 0.4345
 epoch: 9, train_loss: 1.1172, test_loss: 1.0798, test_f1: 0.4309
 epoch: 10, train_loss: 1.1000, test_loss: 1.0651, test_f1: 0.4306
 epoch: 11, train_loss: 1.0892, test_loss: 1.0521, test_f1: 0.4315
 epoch: 12, train_loss: 1.0742, test_loss: 1.0420, test_f1: 0.4320
 epoch: 13, train_loss: 1.0676, test_loss: 1.0334, test_f1: 0.4424
 epoch: 14, train_loss: 1.0612, test_loss: 1.0265, test_f1: 0.4502
 epoch: 15, train_loss: 1.0450, test_loss: 1.0206, test_f1: 0.4354
 epoch: 16, train_loss: 1.0422, test_loss: 1.0143, test_f1: 0.4336
 epoch: 17, train_loss: 1.0287, test_loss: 1.0076, test_f1: 0.4382
 epoch: 18, train_loss: 1.0263, test_loss: 1.0031, test_f1: 0.4547
 epoch: 19, train_loss: 1.0196, test_loss: 0.9979, test_f1: 0.4590
 epoch: 20, train_loss: 1.0162, test_loss: 0.9932, test_f1: 0.4647
 epoch: 21, train_loss: 1.0113, test_loss: 0.9881, test_f1: 0.4596
 epoch: 22, train_loss: 1.0023, test_loss: 0.9843, test_f1: 0.4675
 epoch: 23, train_loss: 1.0005, test_loss: 0.9800, test_f1: 0.4725
 epoch: 24, train_loss: 0.9998, test_loss: 0.9760, test_f1: 0.4757
 epoch: 25, train_loss: 0.9879, test_loss: 0.9733, test_f1: 0.4676
 epoch: 26, train_loss: 0.9834, test_loss: 0.9673, test_f1: 0.4757
 epoch: 27, train_loss: 0.9836, test_loss: 0.9644, test_f1: 0.4751
 epoch: 28, train_loss: 0.9817, test_loss: 0.9616, test_f1: 0.4778
 epoch: 29, train_loss: 0.9763, test_loss: 0.9583, test_f1: 0.4787
 epoch: 30, train_loss: 0.9693, test_loss: 0.9561, test_f1: 0.4812
 epoch: 31, train_loss: 0.9638, test_loss: 0.9533, test_f1: 0.4895
 epoch: 32, train_loss: 0.9569, test_loss: 0.9476, test_f1: 0.4915
 epoch: 33, train_loss: 0.9602, test_loss: 0.9464, test_f1: 0.4872
 epoch: 34, train_loss: 0.9556, test_loss: 0.9452, test_f1: 0.4908
 epoch: 35, train_loss: 0.9528, test_loss: 0.9383, test_f1: 0.4847
 epoch: 36, train_loss: 0.9489, test_loss: 0.9352, test_f1: 0.4958
 epoch: 37, train_loss: 0.9472, test_loss: 0.9324, test_f1: 0.5025
 epoch: 38, train_loss: 0.9406, test_loss: 0.9306, test_f1: 0.5056
 epoch: 39, train_loss: 0.9409, test_loss: 0.9283, test_f1: 0.5010
 epoch: 40, train_loss: 0.9335, test_loss: 0.9194, test_f1: 0.5003
 epoch: 41, train_loss: 0.9294, test_loss: 0.9220, test_f1: 0.5026
 epoch: 42, train_loss: 0.9336, test_loss: 0.9170, test_f1: 0.5016
 epoch: 43, train_loss: 0.9213, test_loss: 0.9138, test_f1: 0.5060
 epoch: 44, train_loss: 0.9262, test_loss: 0.9168, test_f1: 0.5063
 epoch: 45, train_loss: 0.9208, test_loss: 0.9101, test_f1: 0.5048
 epoch: 46, train_loss: 0.9203, test_loss: 0.9098, test_f1: 0.5194
 epoch: 47, train_loss: 0.9158, test_loss: 0.9041, test_f1: 0.5058
 epoch: 48, train_loss: 0.9078, test_loss: 0.9025, test_f1: 0.5162
 epoch: 49, train_loss: 0.9105, test_loss: 0.8981, test_f1: 0.5110
 epoch: 50, train_loss: 0.9074, test_loss: 0.9051, test_f1: 0.5140
 epoch: 51, train_loss: 0.9069, test_loss: 0.8932, test_f1: 0.5193
 epoch: 52, train_loss: 0.8978, test_loss: 0.8908, test_f1: 0.5059
 epoch: 53, train_loss: 0.8943, test_loss: 0.8916, test_f1: 0.5107
 epoch: 54, train_loss: 0.9014, test_loss: 0.8884, test_f1: 0.5229
 epoch: 55, train_loss: 0.8987, test_loss: 0.8891, test_f1: 0.5142
 epoch: 56, train_loss: 0.8946, test_loss: 0.8877, test_f1: 0.5255
 epoch: 57, train_loss: 0.8917, test_loss: 0.8863, test_f1: 0.5284
 epoch: 58, train_loss: 0.8905, test_loss: 0.8852, test_f1: 0.5276
 epoch: 59, train_loss: 0.8832, test_loss: 0.8822, test_f1: 0.5194
 epoch: 60, train_loss: 0.8899, test_loss: 0.8828, test_f1: 0.5203
 epoch: 61, train_loss: 0.8853, test_loss: 0.8802, test_f1: 0.5305
 epoch: 62, train_loss: 0.8825, test_loss: 0.8745, test_f1: 0.5285
 epoch: 63, train_loss: 0.8845, test_loss: 0.8762, test_f1: 0.5271
 epoch: 64, train_loss: 0.8810, test_loss: 0.8786, test_f1: 0.5298
 epoch: 65, train_loss: 0.8858, test_loss: 0.8777, test_f1: 0.5315
 epoch: 66, train_loss: 0.8766, test_loss: 0.8773, test_f1: 0.5341
 epoch: 67, train_loss: 0.8785, test_loss: 0.8748, test_f1: 0.5320
 epoch: 68, train_loss: 0.8732, test_loss: 0.8692, test_f1: 0.5355
 epoch: 69, train_loss: 0.8753, test_loss: 0.8715, test_f1: 0.5359
 epoch: 70, train_loss: 0.8740, test_loss: 0.8676, test_f1: 0.5341
 epoch: 71, train_loss: 0.8732, test_loss: 0.8685, test_f1: 0.5338
 epoch: 72, train_loss: 0.8704, test_loss: 0.8697, test_f1: 0.5311
 epoch: 73, train_loss: 0.8671, test_loss: 0.8676, test_f1: 0.5304
 epoch: 74, train_loss: 0.8643, test_loss: 0.8672, test_f1: 0.5389
 epoch: 75, train_loss: 0.8726, test_loss: 0.8629, test_f1: 0.5420
 epoch: 76, train_loss: 0.8651, test_loss: 0.8649, test_f1: 0.5409
 epoch: 77, train_loss: 0.8633, test_loss: 0.8666, test_f1: 0.5377
 epoch: 78, train_loss: 0.8579, test_loss: 0.8587, test_f1: 0.5478
 epoch: 79, train_loss: 0.8528, test_loss: 0.8604, test_f1: 0.5436
 epoch: 80, train_loss: 0.8554, test_loss: 0.8631, test_f1: 0.5413
 epoch: 81, train_loss: 0.8526, test_loss: 0.8590, test_f1: 0.5451
 epoch: 82, train_loss: 0.8574, test_loss: 0.8585, test_f1: 0.5406
 epoch: 83, train_loss: 0.8604, test_loss: 0.8610, test_f1: 0.5485
 epoch: 84, train_loss: 0.8540, test_loss: 0.8609, test_f1: 0.5435
 epoch: 85, train_loss: 0.8524, test_loss: 0.8562, test_f1: 0.5544
 epoch: 86, train_loss: 0.8499, test_loss: 0.8583, test_f1: 0.5495
 epoch: 87, train_loss: 0.8491, test_loss: 0.8609, test_f1: 0.5455
 epoch: 88, train_loss: 0.8489, test_loss: 0.8557, test_f1: 0.5510
 epoch: 89, train_loss: 0.8561, test_loss: 0.8678, test_f1: 0.5436
 epoch: 90, train_loss: 0.8425, test_loss: 0.8537, test_f1: 0.5554
 epoch: 91, train_loss: 0.8440, test_loss: 0.8552, test_f1: 0.5500
 epoch: 92, train_loss: 0.8475, test_loss: 0.8555, test_f1: 0.5553
 epoch: 93, train_loss: 0.8440, test_loss: 0.8561, test_f1: 0.5513
 epoch: 94, train_loss: 0.8442, test_loss: 0.8526, test_f1: 0.5540
 epoch: 95, train_loss: 0.8428, test_loss: 0.8578, test_f1: 0.5490
 epoch: 96, train_loss: 0.8348, test_loss: 0.8499, test_f1: 0.5459
 epoch: 97, train_loss: 0.8400, test_loss: 0.8517, test_f1: 0.5510
 epoch: 98, train_loss: 0.8429, test_loss: 0.8541, test_f1: 0.5512
 epoch: 99, train_loss: 0.8419, test_loss: 0.8494, test_f1: 0.5507
##################ITERATION #5 ****************************************
 epoch: 0, train_loss: 1.3113, test_loss: 1.3171, test_f1: 0.2270
 epoch: 1, train_loss: 1.2511, test_loss: 1.2992, test_f1: 0.2270
 epoch: 2, train_loss: 1.2190, test_loss: 1.2635, test_f1: 0.2270
 epoch: 3, train_loss: 1.1947, test_loss: 1.2076, test_f1: 0.3043
 epoch: 4, train_loss: 1.1668, test_loss: 1.1463, test_f1: 0.3497
 epoch: 5, train_loss: 1.1374, test_loss: 1.1044, test_f1: 0.3833
 epoch: 6, train_loss: 1.1179, test_loss: 1.0804, test_f1: 0.4125
 epoch: 7, train_loss: 1.1046, test_loss: 1.0619, test_f1: 0.4275
 epoch: 8, train_loss: 1.0871, test_loss: 1.0492, test_f1: 0.4387
 epoch: 9, train_loss: 1.0759, test_loss: 1.0392, test_f1: 0.4498
 epoch: 10, train_loss: 1.0575, test_loss: 1.0299, test_f1: 0.4502
 epoch: 11, train_loss: 1.0547, test_loss: 1.0218, test_f1: 0.4462
 epoch: 12, train_loss: 1.0428, test_loss: 1.0151, test_f1: 0.4399
 epoch: 13, train_loss: 1.0288, test_loss: 1.0064, test_f1: 0.4547
 epoch: 14, train_loss: 1.0279, test_loss: 1.0003, test_f1: 0.4585
 epoch: 15, train_loss: 1.0174, test_loss: 0.9927, test_f1: 0.4686
 epoch: 16, train_loss: 1.0114, test_loss: 0.9873, test_f1: 0.4762
 epoch: 17, train_loss: 0.9989, test_loss: 0.9839, test_f1: 0.4818
 epoch: 18, train_loss: 1.0040, test_loss: 0.9795, test_f1: 0.4836
 epoch: 19, train_loss: 0.9953, test_loss: 0.9795, test_f1: 0.4828
 epoch: 20, train_loss: 0.9935, test_loss: 0.9759, test_f1: 0.4870
 epoch: 21, train_loss: 0.9847, test_loss: 0.9706, test_f1: 0.4843
 epoch: 22, train_loss: 0.9795, test_loss: 0.9705, test_f1: 0.4769
 epoch: 23, train_loss: 0.9716, test_loss: 0.9640, test_f1: 0.4841
 epoch: 24, train_loss: 0.9672, test_loss: 0.9628, test_f1: 0.4874
 epoch: 25, train_loss: 0.9658, test_loss: 0.9580, test_f1: 0.4863
 epoch: 26, train_loss: 0.9712, test_loss: 0.9537, test_f1: 0.4844
 epoch: 27, train_loss: 0.9616, test_loss: 0.9509, test_f1: 0.4827
 epoch: 28, train_loss: 0.9562, test_loss: 0.9502, test_f1: 0.4793
 epoch: 29, train_loss: 0.9490, test_loss: 0.9540, test_f1: 0.5092
 epoch: 30, train_loss: 0.9521, test_loss: 0.9463, test_f1: 0.5019
 epoch: 31, train_loss: 0.9498, test_loss: 0.9420, test_f1: 0.5077
 epoch: 32, train_loss: 0.9457, test_loss: 0.9395, test_f1: 0.5072
 epoch: 33, train_loss: 0.9404, test_loss: 0.9429, test_f1: 0.5131
 epoch: 34, train_loss: 0.9300, test_loss: 0.9392, test_f1: 0.5117
 epoch: 35, train_loss: 0.9260, test_loss: 0.9311, test_f1: 0.5113
 epoch: 36, train_loss: 0.9310, test_loss: 0.9312, test_f1: 0.5113
 epoch: 37, train_loss: 0.9276, test_loss: 0.9260, test_f1: 0.5199
 epoch: 38, train_loss: 0.9220, test_loss: 0.9264, test_f1: 0.5204
 epoch: 39, train_loss: 0.9203, test_loss: 0.9227, test_f1: 0.5218
 epoch: 40, train_loss: 0.9224, test_loss: 0.9198, test_f1: 0.5240
 epoch: 41, train_loss: 0.9095, test_loss: 0.9181, test_f1: 0.5232
 epoch: 42, train_loss: 0.9112, test_loss: 0.9146, test_f1: 0.5368
 epoch: 43, train_loss: 0.9097, test_loss: 0.9146, test_f1: 0.5360
 epoch: 44, train_loss: 0.9097, test_loss: 0.9139, test_f1: 0.5346
 epoch: 45, train_loss: 0.9041, test_loss: 0.9124, test_f1: 0.5360
 epoch: 46, train_loss: 0.8971, test_loss: 0.9122, test_f1: 0.5323
 epoch: 47, train_loss: 0.8952, test_loss: 0.9100, test_f1: 0.5267
 epoch: 48, train_loss: 0.8939, test_loss: 0.9066, test_f1: 0.5436
 epoch: 49, train_loss: 0.8991, test_loss: 0.9100, test_f1: 0.5303
 epoch: 50, train_loss: 0.8952, test_loss: 0.9020, test_f1: 0.5320
 epoch: 51, train_loss: 0.8880, test_loss: 0.9039, test_f1: 0.5311
 epoch: 52, train_loss: 0.8823, test_loss: 0.9002, test_f1: 0.5357
 epoch: 53, train_loss: 0.8805, test_loss: 0.8978, test_f1: 0.5340
 epoch: 54, train_loss: 0.8823, test_loss: 0.8985, test_f1: 0.5333
 epoch: 55, train_loss: 0.8856, test_loss: 0.9012, test_f1: 0.5324
 epoch: 56, train_loss: 0.8848, test_loss: 0.8983, test_f1: 0.5335
 epoch: 57, train_loss: 0.8829, test_loss: 0.9010, test_f1: 0.5332
 epoch: 58, train_loss: 0.8724, test_loss: 0.9008, test_f1: 0.5341
 epoch: 59, train_loss: 0.8837, test_loss: 0.9022, test_f1: 0.5338
 epoch: 60, train_loss: 0.8842, test_loss: 0.8980, test_f1: 0.5354
 epoch: 61, train_loss: 0.8756, test_loss: 0.8950, test_f1: 0.5346
 epoch: 62, train_loss: 0.8778, test_loss: 0.8920, test_f1: 0.5383
 epoch: 63, train_loss: 0.8633, test_loss: 0.8905, test_f1: 0.5354
 epoch: 64, train_loss: 0.8712, test_loss: 0.8930, test_f1: 0.5370
 epoch: 65, train_loss: 0.8747, test_loss: 0.8927, test_f1: 0.5405
 epoch: 66, train_loss: 0.8730, test_loss: 0.8900, test_f1: 0.5395
 epoch: 67, train_loss: 0.8740, test_loss: 0.8903, test_f1: 0.5371
 epoch: 68, train_loss: 0.8679, test_loss: 0.8867, test_f1: 0.5333
 epoch: 69, train_loss: 0.8699, test_loss: 0.8854, test_f1: 0.5373
 epoch: 70, train_loss: 0.8677, test_loss: 0.8834, test_f1: 0.5386
 epoch: 71, train_loss: 0.8644, test_loss: 0.8898, test_f1: 0.5377
 epoch: 72, train_loss: 0.8654, test_loss: 0.8875, test_f1: 0.5390
 epoch: 73, train_loss: 0.8605, test_loss: 0.8822, test_f1: 0.5385
 epoch: 74, train_loss: 0.8584, test_loss: 0.8809, test_f1: 0.5390
 epoch: 75, train_loss: 0.8543, test_loss: 0.8840, test_f1: 0.5391
 epoch: 76, train_loss: 0.8547, test_loss: 0.8895, test_f1: 0.5368
 epoch: 77, train_loss: 0.8590, test_loss: 0.8800, test_f1: 0.5408
 epoch: 78, train_loss: 0.8553, test_loss: 0.8813, test_f1: 0.5414
 epoch: 79, train_loss: 0.8556, test_loss: 0.8808, test_f1: 0.5455
 epoch: 80, train_loss: 0.8552, test_loss: 0.8777, test_f1: 0.5411
 epoch: 81, train_loss: 0.8606, test_loss: 0.8789, test_f1: 0.5403
 epoch: 82, train_loss: 0.8532, test_loss: 0.8775, test_f1: 0.5403
 epoch: 83, train_loss: 0.8555, test_loss: 0.8786, test_f1: 0.5419
 epoch: 84, train_loss: 0.8488, test_loss: 0.8784, test_f1: 0.5441
 epoch: 85, train_loss: 0.8512, test_loss: 0.8745, test_f1: 0.5405
 epoch: 86, train_loss: 0.8479, test_loss: 0.8748, test_f1: 0.5399
 epoch: 87, train_loss: 0.8505, test_loss: 0.8706, test_f1: 0.5487
 epoch: 88, train_loss: 0.8512, test_loss: 0.8684, test_f1: 0.5480
 epoch: 89, train_loss: 0.8421, test_loss: 0.8667, test_f1: 0.5492
 epoch: 90, train_loss: 0.8561, test_loss: 0.8706, test_f1: 0.5442
 epoch: 91, train_loss: 0.8458, test_loss: 0.8673, test_f1: 0.5449
 epoch: 92, train_loss: 0.8418, test_loss: 0.8706, test_f1: 0.5443
 epoch: 93, train_loss: 0.8369, test_loss: 0.8657, test_f1: 0.5441
 epoch: 94, train_loss: 0.8344, test_loss: 0.8596, test_f1: 0.5465
 epoch: 95, train_loss: 0.8442, test_loss: 0.8587, test_f1: 0.5490
 epoch: 96, train_loss: 0.8388, test_loss: 0.8627, test_f1: 0.5523
 epoch: 97, train_loss: 0.8332, test_loss: 0.8653, test_f1: 0.5478
 epoch: 98, train_loss: 0.8281, test_loss: 0.8645, test_f1: 0.5450
 epoch: 99, train_loss: 0.8363, test_loss: 0.8621, test_f1: 0.5466
##################ITERATION #6 ****************************************
 epoch: 0, train_loss: 1.3045, test_loss: 1.3152, test_f1: 0.2270
 epoch: 1, train_loss: 1.2317, test_loss: 1.2940, test_f1: 0.2270
 epoch: 2, train_loss: 1.2052, test_loss: 1.2296, test_f1: 0.2251
 epoch: 3, train_loss: 1.1752, test_loss: 1.1582, test_f1: 0.3364
 epoch: 4, train_loss: 1.1529, test_loss: 1.1134, test_f1: 0.4053
 epoch: 5, train_loss: 1.1269, test_loss: 1.0855, test_f1: 0.4229
 epoch: 6, train_loss: 1.1114, test_loss: 1.0626, test_f1: 0.4279
 epoch: 7, train_loss: 1.0897, test_loss: 1.0447, test_f1: 0.4285
 epoch: 8, train_loss: 1.0809, test_loss: 1.0327, test_f1: 0.4513
 epoch: 9, train_loss: 1.0663, test_loss: 1.0241, test_f1: 0.4586
 epoch: 10, train_loss: 1.0543, test_loss: 1.0173, test_f1: 0.4545
 epoch: 11, train_loss: 1.0487, test_loss: 1.0108, test_f1: 0.4605
 epoch: 12, train_loss: 1.0380, test_loss: 1.0048, test_f1: 0.4648
 epoch: 13, train_loss: 1.0327, test_loss: 0.9989, test_f1: 0.4571
 epoch: 14, train_loss: 1.0234, test_loss: 0.9972, test_f1: 0.4555
 epoch: 15, train_loss: 1.0168, test_loss: 0.9942, test_f1: 0.4714
 epoch: 16, train_loss: 1.0108, test_loss: 0.9886, test_f1: 0.4701
 epoch: 17, train_loss: 1.0106, test_loss: 0.9827, test_f1: 0.4689
 epoch: 18, train_loss: 1.0034, test_loss: 0.9814, test_f1: 0.4703
 epoch: 19, train_loss: 0.9961, test_loss: 0.9788, test_f1: 0.4796
 epoch: 20, train_loss: 0.9988, test_loss: 0.9756, test_f1: 0.4766
 epoch: 21, train_loss: 0.9983, test_loss: 0.9720, test_f1: 0.4817
 epoch: 22, train_loss: 0.9852, test_loss: 0.9673, test_f1: 0.4841
 epoch: 23, train_loss: 0.9829, test_loss: 0.9667, test_f1: 0.4844
 epoch: 24, train_loss: 0.9788, test_loss: 0.9690, test_f1: 0.4893
 epoch: 25, train_loss: 0.9739, test_loss: 0.9660, test_f1: 0.4811
 epoch: 26, train_loss: 0.9681, test_loss: 0.9597, test_f1: 0.4846
 epoch: 27, train_loss: 0.9701, test_loss: 0.9592, test_f1: 0.4886
 epoch: 28, train_loss: 0.9683, test_loss: 0.9576, test_f1: 0.4864
 epoch: 29, train_loss: 0.9669, test_loss: 0.9574, test_f1: 0.4921
 epoch: 30, train_loss: 0.9633, test_loss: 0.9565, test_f1: 0.4857
 epoch: 31, train_loss: 0.9617, test_loss: 0.9551, test_f1: 0.4813
 epoch: 32, train_loss: 0.9481, test_loss: 0.9478, test_f1: 0.4879
 epoch: 33, train_loss: 0.9473, test_loss: 0.9492, test_f1: 0.4846
 epoch: 34, train_loss: 0.9465, test_loss: 0.9396, test_f1: 0.5038
 epoch: 35, train_loss: 0.9402, test_loss: 0.9404, test_f1: 0.4977
 epoch: 36, train_loss: 0.9430, test_loss: 0.9400, test_f1: 0.4956
 epoch: 37, train_loss: 0.9359, test_loss: 0.9404, test_f1: 0.5011
 epoch: 38, train_loss: 0.9365, test_loss: 0.9309, test_f1: 0.4974
 epoch: 39, train_loss: 0.9382, test_loss: 0.9347, test_f1: 0.5113
 epoch: 40, train_loss: 0.9316, test_loss: 0.9268, test_f1: 0.5175
 epoch: 41, train_loss: 0.9237, test_loss: 0.9276, test_f1: 0.4984
 epoch: 42, train_loss: 0.9271, test_loss: 0.9269, test_f1: 0.4988
 epoch: 43, train_loss: 0.9193, test_loss: 0.9255, test_f1: 0.5126
 epoch: 44, train_loss: 0.9153, test_loss: 0.9180, test_f1: 0.5064
 epoch: 45, train_loss: 0.9176, test_loss: 0.9176, test_f1: 0.5134
 epoch: 46, train_loss: 0.9130, test_loss: 0.9147, test_f1: 0.5212
 epoch: 47, train_loss: 0.9094, test_loss: 0.9169, test_f1: 0.5385
 epoch: 48, train_loss: 0.9055, test_loss: 0.9118, test_f1: 0.5052
 epoch: 49, train_loss: 0.9116, test_loss: 0.9122, test_f1: 0.5221
 epoch: 50, train_loss: 0.9038, test_loss: 0.9192, test_f1: 0.5288
 epoch: 51, train_loss: 0.8982, test_loss: 0.9170, test_f1: 0.5335
 epoch: 52, train_loss: 0.8936, test_loss: 0.9097, test_f1: 0.5247
 epoch: 53, train_loss: 0.8966, test_loss: 0.9033, test_f1: 0.5424
 epoch: 54, train_loss: 0.8918, test_loss: 0.9023, test_f1: 0.5441
 epoch: 55, train_loss: 0.8905, test_loss: 0.9039, test_f1: 0.5332
 epoch: 56, train_loss: 0.8918, test_loss: 0.8996, test_f1: 0.5413
 epoch: 57, train_loss: 0.8953, test_loss: 0.8969, test_f1: 0.5449
 epoch: 58, train_loss: 0.8875, test_loss: 0.8987, test_f1: 0.5401
 epoch: 59, train_loss: 0.8916, test_loss: 0.9060, test_f1: 0.5359
 epoch: 60, train_loss: 0.8859, test_loss: 0.9020, test_f1: 0.5371
 epoch: 61, train_loss: 0.8870, test_loss: 0.9013, test_f1: 0.5292
 epoch: 62, train_loss: 0.8868, test_loss: 0.9003, test_f1: 0.5392
 epoch: 63, train_loss: 0.8751, test_loss: 0.8958, test_f1: 0.5373
 epoch: 64, train_loss: 0.8792, test_loss: 0.8917, test_f1: 0.5354
 epoch: 65, train_loss: 0.8746, test_loss: 0.8951, test_f1: 0.5398
 epoch: 66, train_loss: 0.8769, test_loss: 0.8928, test_f1: 0.5327
 epoch: 67, train_loss: 0.8734, test_loss: 0.8920, test_f1: 0.5398
 epoch: 68, train_loss: 0.8766, test_loss: 0.8934, test_f1: 0.5426
 epoch: 69, train_loss: 0.8775, test_loss: 0.9011, test_f1: 0.5320
 epoch: 70, train_loss: 0.8693, test_loss: 0.8862, test_f1: 0.5373
 epoch: 71, train_loss: 0.8692, test_loss: 0.8900, test_f1: 0.5429
 epoch: 72, train_loss: 0.8767, test_loss: 0.8871, test_f1: 0.5415
 epoch: 73, train_loss: 0.8708, test_loss: 0.8848, test_f1: 0.5363
 epoch: 74, train_loss: 0.8741, test_loss: 0.8946, test_f1: 0.5427
 epoch: 75, train_loss: 0.8706, test_loss: 0.8781, test_f1: 0.5410
 epoch: 76, train_loss: 0.8654, test_loss: 0.8883, test_f1: 0.5441
 epoch: 77, train_loss: 0.8654, test_loss: 0.8773, test_f1: 0.5398
 epoch: 78, train_loss: 0.8624, test_loss: 0.8887, test_f1: 0.5423
 epoch: 79, train_loss: 0.8579, test_loss: 0.8827, test_f1: 0.5431
 epoch: 80, train_loss: 0.8537, test_loss: 0.8790, test_f1: 0.5453
 epoch: 81, train_loss: 0.8575, test_loss: 0.8741, test_f1: 0.5468
 epoch: 82, train_loss: 0.8590, test_loss: 0.8750, test_f1: 0.5490
 epoch: 83, train_loss: 0.8517, test_loss: 0.8783, test_f1: 0.5449
 epoch: 84, train_loss: 0.8427, test_loss: 0.8769, test_f1: 0.5487
 epoch: 85, train_loss: 0.8534, test_loss: 0.8705, test_f1: 0.5518
 epoch: 86, train_loss: 0.8552, test_loss: 0.8763, test_f1: 0.5471
 epoch: 87, train_loss: 0.8518, test_loss: 0.8732, test_f1: 0.5517
 epoch: 88, train_loss: 0.8498, test_loss: 0.8675, test_f1: 0.5443
 epoch: 89, train_loss: 0.8492, test_loss: 0.8724, test_f1: 0.5469
 epoch: 90, train_loss: 0.8483, test_loss: 0.8662, test_f1: 0.5469
 epoch: 91, train_loss: 0.8437, test_loss: 0.8770, test_f1: 0.5484
 epoch: 92, train_loss: 0.8480, test_loss: 0.8698, test_f1: 0.5410
 epoch: 93, train_loss: 0.8423, test_loss: 0.8628, test_f1: 0.5465
 epoch: 94, train_loss: 0.8442, test_loss: 0.8733, test_f1: 0.5489
 epoch: 95, train_loss: 0.8418, test_loss: 0.8741, test_f1: 0.5416
 epoch: 96, train_loss: 0.8405, test_loss: 0.8677, test_f1: 0.5512
 epoch: 97, train_loss: 0.8382, test_loss: 0.8653, test_f1: 0.5471
 epoch: 98, train_loss: 0.8432, test_loss: 0.8732, test_f1: 0.5485
 epoch: 99, train_loss: 0.8398, test_loss: 0.8650, test_f1: 0.5517
##################ITERATION #7 ****************************************
 epoch: 0, train_loss: 1.2879, test_loss: 1.3059, test_f1: 0.2270
 epoch: 1, train_loss: 1.2225, test_loss: 1.2800, test_f1: 0.2270
 epoch: 2, train_loss: 1.1841, test_loss: 1.2379, test_f1: 0.2270
 epoch: 3, train_loss: 1.1588, test_loss: 1.1735, test_f1: 0.2319
 epoch: 4, train_loss: 1.1231, test_loss: 1.1128, test_f1: 0.4235
 epoch: 5, train_loss: 1.1037, test_loss: 1.0762, test_f1: 0.4410
 epoch: 6, train_loss: 1.0879, test_loss: 1.0544, test_f1: 0.4648
 epoch: 7, train_loss: 1.0800, test_loss: 1.0401, test_f1: 0.4726
 epoch: 8, train_loss: 1.0649, test_loss: 1.0334, test_f1: 0.4708
 epoch: 9, train_loss: 1.0484, test_loss: 1.0212, test_f1: 0.4704
 epoch: 10, train_loss: 1.0359, test_loss: 1.0160, test_f1: 0.4701
 epoch: 11, train_loss: 1.0290, test_loss: 1.0079, test_f1: 0.4747
 epoch: 12, train_loss: 1.0224, test_loss: 1.0023, test_f1: 0.4773
 epoch: 13, train_loss: 1.0141, test_loss: 0.9974, test_f1: 0.4787
 epoch: 14, train_loss: 1.0140, test_loss: 0.9922, test_f1: 0.4812
 epoch: 15, train_loss: 1.0021, test_loss: 0.9803, test_f1: 0.4833
 epoch: 16, train_loss: 0.9956, test_loss: 0.9780, test_f1: 0.4846
 epoch: 17, train_loss: 0.9902, test_loss: 0.9736, test_f1: 0.4905
 epoch: 18, train_loss: 0.9810, test_loss: 0.9674, test_f1: 0.4977
 epoch: 19, train_loss: 0.9776, test_loss: 0.9613, test_f1: 0.4911
 epoch: 20, train_loss: 0.9685, test_loss: 0.9550, test_f1: 0.5086
 epoch: 21, train_loss: 0.9679, test_loss: 0.9516, test_f1: 0.5158
 epoch: 22, train_loss: 0.9631, test_loss: 0.9498, test_f1: 0.5097
 epoch: 23, train_loss: 0.9526, test_loss: 0.9455, test_f1: 0.5218
 epoch: 24, train_loss: 0.9470, test_loss: 0.9379, test_f1: 0.5263
 epoch: 25, train_loss: 0.9449, test_loss: 0.9374, test_f1: 0.5247
 epoch: 26, train_loss: 0.9351, test_loss: 0.9316, test_f1: 0.5239
 epoch: 27, train_loss: 0.9331, test_loss: 0.9275, test_f1: 0.5367
 epoch: 28, train_loss: 0.9320, test_loss: 0.9320, test_f1: 0.5321
 epoch: 29, train_loss: 0.9274, test_loss: 0.9266, test_f1: 0.5236
 epoch: 30, train_loss: 0.9250, test_loss: 0.9280, test_f1: 0.5137
 epoch: 31, train_loss: 0.9183, test_loss: 0.9243, test_f1: 0.5296
 epoch: 32, train_loss: 0.9145, test_loss: 0.9230, test_f1: 0.5293
 epoch: 33, train_loss: 0.9067, test_loss: 0.9218, test_f1: 0.5319
 epoch: 34, train_loss: 0.9031, test_loss: 0.9193, test_f1: 0.5106
 epoch: 35, train_loss: 0.9042, test_loss: 0.9164, test_f1: 0.5387
 epoch: 36, train_loss: 0.9012, test_loss: 0.9195, test_f1: 0.5161
 epoch: 37, train_loss: 0.8950, test_loss: 0.9156, test_f1: 0.5299
 epoch: 38, train_loss: 0.8946, test_loss: 0.9137, test_f1: 0.5226
 epoch: 39, train_loss: 0.8937, test_loss: 0.9060, test_f1: 0.5398
 epoch: 40, train_loss: 0.8813, test_loss: 0.9025, test_f1: 0.5283
 epoch: 41, train_loss: 0.8825, test_loss: 0.9096, test_f1: 0.5358
 epoch: 42, train_loss: 0.8796, test_loss: 0.9116, test_f1: 0.5262
 epoch: 43, train_loss: 0.8722, test_loss: 0.9011, test_f1: 0.5384
 epoch: 44, train_loss: 0.8720, test_loss: 0.9007, test_f1: 0.5401
 epoch: 45, train_loss: 0.8625, test_loss: 0.9015, test_f1: 0.5330
 epoch: 46, train_loss: 0.8667, test_loss: 0.8995, test_f1: 0.5430
 epoch: 47, train_loss: 0.8683, test_loss: 0.8955, test_f1: 0.5471
 epoch: 48, train_loss: 0.8537, test_loss: 0.8941, test_f1: 0.5413
 epoch: 49, train_loss: 0.8584, test_loss: 0.8951, test_f1: 0.5460
 epoch: 50, train_loss: 0.8499, test_loss: 0.8971, test_f1: 0.5473
 epoch: 51, train_loss: 0.8553, test_loss: 0.8909, test_f1: 0.5419
 epoch: 52, train_loss: 0.8491, test_loss: 0.8877, test_f1: 0.5535
 epoch: 53, train_loss: 0.8516, test_loss: 0.8884, test_f1: 0.5524
 epoch: 54, train_loss: 0.8432, test_loss: 0.8892, test_f1: 0.5492
 epoch: 55, train_loss: 0.8404, test_loss: 0.8841, test_f1: 0.5487
 epoch: 56, train_loss: 0.8427, test_loss: 0.8860, test_f1: 0.5526
 epoch: 57, train_loss: 0.8370, test_loss: 0.8864, test_f1: 0.5533
 epoch: 58, train_loss: 0.8374, test_loss: 0.8808, test_f1: 0.5513
 epoch: 59, train_loss: 0.8366, test_loss: 0.8821, test_f1: 0.5481
 epoch: 60, train_loss: 0.8407, test_loss: 0.8859, test_f1: 0.5450
 epoch: 61, train_loss: 0.8373, test_loss: 0.8806, test_f1: 0.5506
 epoch: 62, train_loss: 0.8326, test_loss: 0.8794, test_f1: 0.5526
 epoch: 63, train_loss: 0.8392, test_loss: 0.8823, test_f1: 0.5601
 epoch: 64, train_loss: 0.8337, test_loss: 0.8781, test_f1: 0.5548
 epoch: 65, train_loss: 0.8299, test_loss: 0.8780, test_f1: 0.5547
 epoch: 66, train_loss: 0.8312, test_loss: 0.8770, test_f1: 0.5536
 epoch: 67, train_loss: 0.8330, test_loss: 0.8815, test_f1: 0.5518
 epoch: 68, train_loss: 0.8315, test_loss: 0.8794, test_f1: 0.5531
 epoch: 69, train_loss: 0.8259, test_loss: 0.8785, test_f1: 0.5539
 epoch: 70, train_loss: 0.8147, test_loss: 0.8764, test_f1: 0.5580
 epoch: 71, train_loss: 0.8173, test_loss: 0.8797, test_f1: 0.5566
 epoch: 72, train_loss: 0.8249, test_loss: 0.8748, test_f1: 0.5570
 epoch: 73, train_loss: 0.8181, test_loss: 0.8747, test_f1: 0.5585
 epoch: 74, train_loss: 0.8181, test_loss: 0.8810, test_f1: 0.5587
 epoch: 75, train_loss: 0.8193, test_loss: 0.8725, test_f1: 0.5609
 epoch: 76, train_loss: 0.8157, test_loss: 0.8692, test_f1: 0.5541
 epoch: 77, train_loss: 0.8135, test_loss: 0.8759, test_f1: 0.5531
 epoch: 78, train_loss: 0.8097, test_loss: 0.8735, test_f1: 0.5640
 epoch: 79, train_loss: 0.8084, test_loss: 0.8731, test_f1: 0.5634
 epoch: 80, train_loss: 0.8081, test_loss: 0.8694, test_f1: 0.5525
 epoch: 81, train_loss: 0.8070, test_loss: 0.8705, test_f1: 0.5552
 epoch: 82, train_loss: 0.8102, test_loss: 0.8706, test_f1: 0.5597
 epoch: 83, train_loss: 0.8052, test_loss: 0.8652, test_f1: 0.5555
 epoch: 84, train_loss: 0.8006, test_loss: 0.8690, test_f1: 0.5607
 epoch: 85, train_loss: 0.8009, test_loss: 0.8649, test_f1: 0.5572
 epoch: 86, train_loss: 0.8097, test_loss: 0.8680, test_f1: 0.5631
 epoch: 87, train_loss: 0.8035, test_loss: 0.8672, test_f1: 0.5597
 epoch: 88, train_loss: 0.7940, test_loss: 0.8675, test_f1: 0.5578
 epoch: 89, train_loss: 0.7946, test_loss: 0.8660, test_f1: 0.5613
 epoch: 90, train_loss: 0.8007, test_loss: 0.8629, test_f1: 0.5618
 epoch: 91, train_loss: 0.7938, test_loss: 0.8646, test_f1: 0.5601
 epoch: 92, train_loss: 0.8024, test_loss: 0.8673, test_f1: 0.5669
 epoch: 93, train_loss: 0.7931, test_loss: 0.8638, test_f1: 0.5649
 epoch: 94, train_loss: 0.7922, test_loss: 0.8644, test_f1: 0.5586
 epoch: 95, train_loss: 0.7925, test_loss: 0.8720, test_f1: 0.5524
 epoch: 96, train_loss: 0.7937, test_loss: 0.8673, test_f1: 0.5642
 epoch: 97, train_loss: 0.7924, test_loss: 0.8651, test_f1: 0.5664
 epoch: 98, train_loss: 0.7837, test_loss: 0.8687, test_f1: 0.5596
 epoch: 99, train_loss: 0.7800, test_loss: 0.8673, test_f1: 0.5621
##################ITERATION #8 ****************************************
 epoch: 0, train_loss: 1.3139, test_loss: 1.3449, test_f1: 0.2270
 epoch: 1, train_loss: 1.1939, test_loss: 1.3158, test_f1: 0.2270
 epoch: 2, train_loss: 1.1516, test_loss: 1.2424, test_f1: 0.2270
 epoch: 3, train_loss: 1.1202, test_loss: 1.1424, test_f1: 0.3116
 epoch: 4, train_loss: 1.0953, test_loss: 1.0694, test_f1: 0.3772
 epoch: 5, train_loss: 1.0814, test_loss: 1.0409, test_f1: 0.4266
 epoch: 6, train_loss: 1.0609, test_loss: 1.0294, test_f1: 0.4452
 epoch: 7, train_loss: 1.0480, test_loss: 1.0238, test_f1: 0.4501
 epoch: 8, train_loss: 1.0424, test_loss: 1.0170, test_f1: 0.4578
 epoch: 9, train_loss: 1.0374, test_loss: 1.0138, test_f1: 0.4568
 epoch: 10, train_loss: 1.0334, test_loss: 1.0076, test_f1: 0.4632
 epoch: 11, train_loss: 1.0232, test_loss: 1.0044, test_f1: 0.4686
 epoch: 12, train_loss: 1.0109, test_loss: 0.9996, test_f1: 0.4718
 epoch: 13, train_loss: 1.0105, test_loss: 0.9913, test_f1: 0.4886
 epoch: 14, train_loss: 1.0020, test_loss: 0.9866, test_f1: 0.4969
 epoch: 15, train_loss: 0.9976, test_loss: 0.9846, test_f1: 0.4963
 epoch: 16, train_loss: 0.9924, test_loss: 0.9805, test_f1: 0.5136
 epoch: 17, train_loss: 0.9884, test_loss: 0.9730, test_f1: 0.5203
 epoch: 18, train_loss: 0.9846, test_loss: 0.9691, test_f1: 0.5153
 epoch: 19, train_loss: 0.9751, test_loss: 0.9720, test_f1: 0.5166
 epoch: 20, train_loss: 0.9744, test_loss: 0.9630, test_f1: 0.5151
 epoch: 21, train_loss: 0.9756, test_loss: 0.9573, test_f1: 0.5122
 epoch: 22, train_loss: 0.9701, test_loss: 0.9561, test_f1: 0.5147
 epoch: 23, train_loss: 0.9662, test_loss: 0.9519, test_f1: 0.5235
 epoch: 24, train_loss: 0.9603, test_loss: 0.9500, test_f1: 0.5147
 epoch: 25, train_loss: 0.9502, test_loss: 0.9470, test_f1: 0.5182
 epoch: 26, train_loss: 0.9553, test_loss: 0.9512, test_f1: 0.5248
 epoch: 27, train_loss: 0.9426, test_loss: 0.9456, test_f1: 0.5185
 epoch: 28, train_loss: 0.9494, test_loss: 0.9412, test_f1: 0.5233
 epoch: 29, train_loss: 0.9441, test_loss: 0.9405, test_f1: 0.5234
 epoch: 30, train_loss: 0.9433, test_loss: 0.9376, test_f1: 0.5282
 epoch: 31, train_loss: 0.9336, test_loss: 0.9356, test_f1: 0.5426
 epoch: 32, train_loss: 0.9353, test_loss: 0.9377, test_f1: 0.5269
 epoch: 33, train_loss: 0.9309, test_loss: 0.9310, test_f1: 0.5265
 epoch: 34, train_loss: 0.9292, test_loss: 0.9299, test_f1: 0.5301
 epoch: 35, train_loss: 0.9265, test_loss: 0.9295, test_f1: 0.5203
 epoch: 36, train_loss: 0.9236, test_loss: 0.9267, test_f1: 0.5276
 epoch: 37, train_loss: 0.9144, test_loss: 0.9155, test_f1: 0.5278
 epoch: 38, train_loss: 0.9177, test_loss: 0.9176, test_f1: 0.5342
 epoch: 39, train_loss: 0.9154, test_loss: 0.9116, test_f1: 0.5400
 epoch: 40, train_loss: 0.9125, test_loss: 0.9202, test_f1: 0.5334
 epoch: 41, train_loss: 0.9050, test_loss: 0.9098, test_f1: 0.5271
 epoch: 42, train_loss: 0.9016, test_loss: 0.9120, test_f1: 0.5433
 epoch: 43, train_loss: 0.8980, test_loss: 0.9096, test_f1: 0.5454
 epoch: 44, train_loss: 0.9004, test_loss: 0.9094, test_f1: 0.5442
 epoch: 45, train_loss: 0.8946, test_loss: 0.9004, test_f1: 0.5384
 epoch: 46, train_loss: 0.8923, test_loss: 0.8991, test_f1: 0.5515
 epoch: 47, train_loss: 0.8950, test_loss: 0.8926, test_f1: 0.5439
 epoch: 48, train_loss: 0.8841, test_loss: 0.9028, test_f1: 0.5355
 epoch: 49, train_loss: 0.8808, test_loss: 0.8934, test_f1: 0.5540
 epoch: 50, train_loss: 0.8862, test_loss: 0.8962, test_f1: 0.5578
 epoch: 51, train_loss: 0.8712, test_loss: 0.8943, test_f1: 0.5530
 epoch: 52, train_loss: 0.8697, test_loss: 0.8955, test_f1: 0.5612
 epoch: 53, train_loss: 0.8716, test_loss: 0.8888, test_f1: 0.5593
 epoch: 54, train_loss: 0.8739, test_loss: 0.8873, test_f1: 0.5593
 epoch: 55, train_loss: 0.8700, test_loss: 0.8891, test_f1: 0.5529
 epoch: 56, train_loss: 0.8717, test_loss: 0.8896, test_f1: 0.5538
 epoch: 57, train_loss: 0.8724, test_loss: 0.8822, test_f1: 0.5596
 epoch: 58, train_loss: 0.8689, test_loss: 0.8872, test_f1: 0.5604
 epoch: 59, train_loss: 0.8692, test_loss: 0.8893, test_f1: 0.5613
 epoch: 60, train_loss: 0.8719, test_loss: 0.8866, test_f1: 0.5609
 epoch: 61, train_loss: 0.8646, test_loss: 0.8834, test_f1: 0.5626
 epoch: 62, train_loss: 0.8586, test_loss: 0.8856, test_f1: 0.5624
 epoch: 63, train_loss: 0.8628, test_loss: 0.8800, test_f1: 0.5604
 epoch: 64, train_loss: 0.8563, test_loss: 0.8839, test_f1: 0.5690
 epoch: 65, train_loss: 0.8661, test_loss: 0.8776, test_f1: 0.5638
 epoch: 66, train_loss: 0.8627, test_loss: 0.8844, test_f1: 0.5665
 epoch: 67, train_loss: 0.8603, test_loss: 0.8755, test_f1: 0.5681
 epoch: 68, train_loss: 0.8572, test_loss: 0.8833, test_f1: 0.5605
 epoch: 69, train_loss: 0.8553, test_loss: 0.8752, test_f1: 0.5713
 epoch: 70, train_loss: 0.8594, test_loss: 0.8784, test_f1: 0.5721
 epoch: 71, train_loss: 0.8575, test_loss: 0.8771, test_f1: 0.5745
 epoch: 72, train_loss: 0.8503, test_loss: 0.8765, test_f1: 0.5699
 epoch: 73, train_loss: 0.8471, test_loss: 0.8712, test_f1: 0.5679
 epoch: 74, train_loss: 0.8536, test_loss: 0.8775, test_f1: 0.5734
 epoch: 75, train_loss: 0.8527, test_loss: 0.8753, test_f1: 0.5631
 epoch: 76, train_loss: 0.8478, test_loss: 0.8717, test_f1: 0.5714
 epoch: 77, train_loss: 0.8457, test_loss: 0.8746, test_f1: 0.5734
 epoch: 78, train_loss: 0.8461, test_loss: 0.8758, test_f1: 0.5723
 epoch: 79, train_loss: 0.8468, test_loss: 0.8737, test_f1: 0.5701
 epoch: 80, train_loss: 0.8405, test_loss: 0.8727, test_f1: 0.5722
 epoch: 81, train_loss: 0.8406, test_loss: 0.8730, test_f1: 0.5699
 epoch: 82, train_loss: 0.8422, test_loss: 0.8706, test_f1: 0.5712
 epoch: 83, train_loss: 0.8385, test_loss: 0.8765, test_f1: 0.5711
 epoch: 84, train_loss: 0.8350, test_loss: 0.8748, test_f1: 0.5718
 epoch: 85, train_loss: 0.8352, test_loss: 0.8720, test_f1: 0.5696
 epoch: 86, train_loss: 0.8394, test_loss: 0.8721, test_f1: 0.5653
 epoch: 87, train_loss: 0.8296, test_loss: 0.8727, test_f1: 0.5714
 epoch: 88, train_loss: 0.8344, test_loss: 0.8741, test_f1: 0.5721
 epoch: 89, train_loss: 0.8288, test_loss: 0.8764, test_f1: 0.5640
 epoch: 90, train_loss: 0.8339, test_loss: 0.8678, test_f1: 0.5709
 epoch: 91, train_loss: 0.8350, test_loss: 0.8705, test_f1: 0.5763
 epoch: 92, train_loss: 0.8370, test_loss: 0.8752, test_f1: 0.5699
 epoch: 93, train_loss: 0.8350, test_loss: 0.8694, test_f1: 0.5720
 epoch: 94, train_loss: 0.8341, test_loss: 0.8715, test_f1: 0.5741
 epoch: 95, train_loss: 0.8289, test_loss: 0.8638, test_f1: 0.5725
 epoch: 96, train_loss: 0.8238, test_loss: 0.8712, test_f1: 0.5703
 epoch: 97, train_loss: 0.8230, test_loss: 0.8678, test_f1: 0.5732
 epoch: 98, train_loss: 0.8246, test_loss: 0.8656, test_f1: 0.5737
 epoch: 99, train_loss: 0.8239, test_loss: 0.8642, test_f1: 0.5746
##################ITERATION #9 ****************************************
 epoch: 0, train_loss: 1.3341, test_loss: 1.3192, test_f1: 0.2270
 epoch: 1, train_loss: 1.2241, test_loss: 1.2852, test_f1: 0.2270
 epoch: 2, train_loss: 1.1843, test_loss: 1.2406, test_f1: 0.2271
 epoch: 3, train_loss: 1.1487, test_loss: 1.1714, test_f1: 0.2807
 epoch: 4, train_loss: 1.1231, test_loss: 1.0975, test_f1: 0.3739
 epoch: 5, train_loss: 1.1063, test_loss: 1.0568, test_f1: 0.4325
 epoch: 6, train_loss: 1.0830, test_loss: 1.0353, test_f1: 0.4399
 epoch: 7, train_loss: 1.0745, test_loss: 1.0203, test_f1: 0.4314
 epoch: 8, train_loss: 1.0597, test_loss: 1.0096, test_f1: 0.4358
 epoch: 9, train_loss: 1.0558, test_loss: 1.0017, test_f1: 0.4425
 epoch: 10, train_loss: 1.0452, test_loss: 0.9945, test_f1: 0.4516
 epoch: 11, train_loss: 1.0332, test_loss: 0.9867, test_f1: 0.4594
 epoch: 12, train_loss: 1.0275, test_loss: 0.9816, test_f1: 0.4614
 epoch: 13, train_loss: 1.0187, test_loss: 0.9762, test_f1: 0.4630
 epoch: 14, train_loss: 1.0136, test_loss: 0.9731, test_f1: 0.4661
 epoch: 15, train_loss: 0.9975, test_loss: 0.9657, test_f1: 0.4776
 epoch: 16, train_loss: 1.0019, test_loss: 0.9598, test_f1: 0.4826
 epoch: 17, train_loss: 0.9935, test_loss: 0.9581, test_f1: 0.4755
 epoch: 18, train_loss: 0.9850, test_loss: 0.9531, test_f1: 0.4724
 epoch: 19, train_loss: 0.9789, test_loss: 0.9489, test_f1: 0.4776
 epoch: 20, train_loss: 0.9748, test_loss: 0.9468, test_f1: 0.4776
 epoch: 21, train_loss: 0.9673, test_loss: 0.9424, test_f1: 0.4779
 epoch: 22, train_loss: 0.9643, test_loss: 0.9397, test_f1: 0.4819
 epoch: 23, train_loss: 0.9663, test_loss: 0.9362, test_f1: 0.4870
 epoch: 24, train_loss: 0.9601, test_loss: 0.9314, test_f1: 0.5039
 epoch: 25, train_loss: 0.9514, test_loss: 0.9314, test_f1: 0.5048
 epoch: 26, train_loss: 0.9483, test_loss: 0.9257, test_f1: 0.5085
 epoch: 27, train_loss: 0.9481, test_loss: 0.9239, test_f1: 0.5079
 epoch: 28, train_loss: 0.9416, test_loss: 0.9213, test_f1: 0.5104
 epoch: 29, train_loss: 0.9393, test_loss: 0.9185, test_f1: 0.5112
 epoch: 30, train_loss: 0.9332, test_loss: 0.9141, test_f1: 0.5149
 epoch: 31, train_loss: 0.9316, test_loss: 0.9116, test_f1: 0.5192
 epoch: 32, train_loss: 0.9345, test_loss: 0.9105, test_f1: 0.5156
 epoch: 33, train_loss: 0.9244, test_loss: 0.9081, test_f1: 0.5224
 epoch: 34, train_loss: 0.9169, test_loss: 0.9041, test_f1: 0.5202
 epoch: 35, train_loss: 0.9252, test_loss: 0.9005, test_f1: 0.5243
 epoch: 36, train_loss: 0.9169, test_loss: 0.9017, test_f1: 0.5254
 epoch: 37, train_loss: 0.9163, test_loss: 0.8970, test_f1: 0.5268
 epoch: 38, train_loss: 0.9086, test_loss: 0.8974, test_f1: 0.5324
 epoch: 39, train_loss: 0.9018, test_loss: 0.8960, test_f1: 0.5335
 epoch: 40, train_loss: 0.9047, test_loss: 0.8958, test_f1: 0.5365
 epoch: 41, train_loss: 0.9020, test_loss: 0.8933, test_f1: 0.5283
 epoch: 42, train_loss: 0.9028, test_loss: 0.8896, test_f1: 0.5377
 epoch: 43, train_loss: 0.8918, test_loss: 0.8884, test_f1: 0.5363
 epoch: 44, train_loss: 0.8942, test_loss: 0.8855, test_f1: 0.5403
 epoch: 45, train_loss: 0.8894, test_loss: 0.8848, test_f1: 0.5436
 epoch: 46, train_loss: 0.8832, test_loss: 0.8821, test_f1: 0.5426
 epoch: 47, train_loss: 0.8837, test_loss: 0.8806, test_f1: 0.5429
 epoch: 48, train_loss: 0.8867, test_loss: 0.8805, test_f1: 0.5428
 epoch: 49, train_loss: 0.8760, test_loss: 0.8788, test_f1: 0.5486
 epoch: 50, train_loss: 0.8752, test_loss: 0.8753, test_f1: 0.5505
 epoch: 51, train_loss: 0.8685, test_loss: 0.8742, test_f1: 0.5506
 epoch: 52, train_loss: 0.8730, test_loss: 0.8751, test_f1: 0.5485
 epoch: 53, train_loss: 0.8721, test_loss: 0.8749, test_f1: 0.5475
 epoch: 54, train_loss: 0.8635, test_loss: 0.8738, test_f1: 0.5508
 epoch: 55, train_loss: 0.8657, test_loss: 0.8737, test_f1: 0.5541
 epoch: 56, train_loss: 0.8660, test_loss: 0.8727, test_f1: 0.5540
 epoch: 57, train_loss: 0.8710, test_loss: 0.8718, test_f1: 0.5508
 epoch: 58, train_loss: 0.8642, test_loss: 0.8722, test_f1: 0.5508
 epoch: 59, train_loss: 0.8649, test_loss: 0.8697, test_f1: 0.5530
 epoch: 60, train_loss: 0.8632, test_loss: 0.8683, test_f1: 0.5541
 epoch: 61, train_loss: 0.8592, test_loss: 0.8672, test_f1: 0.5590
 epoch: 62, train_loss: 0.8512, test_loss: 0.8682, test_f1: 0.5486
 epoch: 63, train_loss: 0.8504, test_loss: 0.8687, test_f1: 0.5615
 epoch: 64, train_loss: 0.8628, test_loss: 0.8680, test_f1: 0.5604
 epoch: 65, train_loss: 0.8472, test_loss: 0.8660, test_f1: 0.5614
 epoch: 66, train_loss: 0.8539, test_loss: 0.8661, test_f1: 0.5552
 epoch: 67, train_loss: 0.8500, test_loss: 0.8634, test_f1: 0.5615
 epoch: 68, train_loss: 0.8571, test_loss: 0.8645, test_f1: 0.5614
 epoch: 69, train_loss: 0.8514, test_loss: 0.8613, test_f1: 0.5600
 epoch: 70, train_loss: 0.8473, test_loss: 0.8650, test_f1: 0.5638
 epoch: 71, train_loss: 0.8510, test_loss: 0.8654, test_f1: 0.5636
 epoch: 72, train_loss: 0.8452, test_loss: 0.8642, test_f1: 0.5667
 epoch: 73, train_loss: 0.8375, test_loss: 0.8616, test_f1: 0.5668
 epoch: 74, train_loss: 0.8409, test_loss: 0.8615, test_f1: 0.5646
 epoch: 75, train_loss: 0.8540, test_loss: 0.8594, test_f1: 0.5684
 epoch: 76, train_loss: 0.8451, test_loss: 0.8618, test_f1: 0.5656
 epoch: 77, train_loss: 0.8421, test_loss: 0.8634, test_f1: 0.5654
 epoch: 78, train_loss: 0.8388, test_loss: 0.8634, test_f1: 0.5688
 epoch: 79, train_loss: 0.8386, test_loss: 0.8629, test_f1: 0.5656
 epoch: 80, train_loss: 0.8410, test_loss: 0.8607, test_f1: 0.5676
 epoch: 81, train_loss: 0.8393, test_loss: 0.8619, test_f1: 0.5676
 epoch: 82, train_loss: 0.8344, test_loss: 0.8633, test_f1: 0.5676
 epoch: 83, train_loss: 0.8289, test_loss: 0.8627, test_f1: 0.5696
 epoch: 84, train_loss: 0.8338, test_loss: 0.8630, test_f1: 0.5694
 epoch: 85, train_loss: 0.8326, test_loss: 0.8596, test_f1: 0.5679
 epoch: 86, train_loss: 0.8322, test_loss: 0.8596, test_f1: 0.5662
 epoch: 87, train_loss: 0.8237, test_loss: 0.8600, test_f1: 0.5688
 epoch: 88, train_loss: 0.8291, test_loss: 0.8582, test_f1: 0.5672
 epoch: 89, train_loss: 0.8293, test_loss: 0.8553, test_f1: 0.5682
 epoch: 90, train_loss: 0.8276, test_loss: 0.8561, test_f1: 0.5687
 epoch: 91, train_loss: 0.8301, test_loss: 0.8594, test_f1: 0.5702
 epoch: 92, train_loss: 0.8290, test_loss: 0.8568, test_f1: 0.5686
 epoch: 93, train_loss: 0.8251, test_loss: 0.8553, test_f1: 0.5695
 epoch: 94, train_loss: 0.8191, test_loss: 0.8552, test_f1: 0.5708
 epoch: 95, train_loss: 0.8184, test_loss: 0.8571, test_f1: 0.5696
 epoch: 96, train_loss: 0.8245, test_loss: 0.8569, test_f1: 0.5707
 epoch: 97, train_loss: 0.8268, test_loss: 0.8562, test_f1: 0.5707
 epoch: 98, train_loss: 0.8203, test_loss: 0.8621, test_f1: 0.5702
 epoch: 99, train_loss: 0.8151, test_loss: 0.8625, test_f1: 0.5731

Training completed in 409.93 seconds
Best F1: 0.5763 at epoch 91
Mean F1 across iterations: 0.5551  0.0122
========================FINAL RESULTS================================
FEGIN weighted F1: 0.5763  0.0122
python main.py --data ltspice_examples --representation component_pin_net --model FEGIN --layers 2 --hiddens 64 --batch_size 256 --lr 0.0001 --emb_size 512 --epochs 100 --save_appendix component_pin_net_L2_H64_BS256_LR0.0001_E512 --no_val
-----



STDERR:
  File "main.py", line 370, in <module>
    main()
  File "main.py", line 254, in main
    dataset = dataset_class(
  File "/home/philip/projects/ltspice_examples_code_repo/Circuit-Completion-Using-GNNs/component_classification_with_link_prediction_head/evaluation/FEGIN/kernel/circuit_datasets.py", line 15, in __init__
    self.data, self.slices = torch.load(self.processed_paths[0])
  File "/home/philip/.local/lib/python3.8/site-packages/torch/serialization.py", line 1040, in load
    warnings.warn(
  File "/usr/lib/python3.8/warnings.py", line 109, in _showwarnmsg
    sw(msg.message, msg.category, msg.filename, msg.lineno,
  File "main.py", line 47, in warn_with_traceback
    traceback.print_stack(file=log)
/home/philip/projects/ltspice_examples_code_repo/Circuit-Completion-Using-GNNs/component_classification_with_link_prediction_head/evaluation/FEGIN/kernel/circuit_datasets.py:15: FutureWarning: You are using `torch.load` with `weights_only=False` (the current default value), which uses the default pickle module implicitly. It is possible to construct malicious pickle data which will execute arbitrary code during unpickling (See https://github.com/pytorch/pytorch/blob/main/SECURITY.md#untrusted-models for more details). In a future release, the default value for `weights_only` will be flipped to `True`. This limits the functions that could be executed during unpickling. Arbitrary objects will no longer be allowed to be loaded via this mode unless they are explicitly allowlisted by the user via `torch.serialization.add_safe_globals`. We recommend you start setting `weights_only=True` for any use case where you don't have full control of the loaded file. Please open an issue on GitHub for any issues related to this experimental feature.
  self.data, self.slices = torch.load(self.processed_paths[0])
