STDOUT:
Results will be saved in /home/philip/projects/ltspice_examples_code_repo/Circuit-Completion-Using-GNNs/component_classification_with_link_prediction_head/evaluation/FEGIN/results/model_FEGIN_dataset_ltspice_examples
Command line input: python main.py --data ltspice_examples --representation component_component --model FEGIN --layers 4 --hiddens 16 --batch_size 256 --lr 0.001 --emb_size 512 --epochs 100 --save_appendix component_component_L4_H16_BS256_LR0.001_E512 --no_val
 is saved.
-----
ltspice_examples - FEGIN
Using 4 layers, 16 hidden units, h = 2
Loading component_component representation dataset
ENTERED
Training FEGIN on component_component representation
Train: 3556, Test: 845
##################ITERATION #0 ****************************************
 epoch: 0, train_loss: 1.3533, test_loss: 1.3557, test_f1: 0.2274
 epoch: 1, train_loss: 1.3410, test_loss: 1.3486, test_f1: 0.2274
 epoch: 2, train_loss: 1.3329, test_loss: 1.3404, test_f1: 0.2274
 epoch: 3, train_loss: 1.3235, test_loss: 1.3297, test_f1: 0.2274
 epoch: 4, train_loss: 1.3123, test_loss: 1.3184, test_f1: 0.2274
 epoch: 5, train_loss: 1.3009, test_loss: 1.3029, test_f1: 0.2274
 epoch: 6, train_loss: 1.2867, test_loss: 1.2871, test_f1: 0.2274
 epoch: 7, train_loss: 1.2758, test_loss: 1.2662, test_f1: 0.2274
 epoch: 8, train_loss: 1.2594, test_loss: 1.2516, test_f1: 0.2274
 epoch: 9, train_loss: 1.2466, test_loss: 1.2361, test_f1: 0.2274
 epoch: 10, train_loss: 1.2391, test_loss: 1.2280, test_f1: 0.2376
 epoch: 11, train_loss: 1.2344, test_loss: 1.2226, test_f1: 0.2375
 epoch: 12, train_loss: 1.2273, test_loss: 1.2185, test_f1: 0.2624
 epoch: 13, train_loss: 1.2240, test_loss: 1.2112, test_f1: 0.3088
 epoch: 14, train_loss: 1.2233, test_loss: 1.2072, test_f1: 0.3198
 epoch: 15, train_loss: 1.2137, test_loss: 1.1951, test_f1: 0.3292
 epoch: 16, train_loss: 1.2082, test_loss: 1.1931, test_f1: 0.3585
 epoch: 17, train_loss: 1.2025, test_loss: 1.1871, test_f1: 0.3491
 epoch: 18, train_loss: 1.1991, test_loss: 1.1836, test_f1: 0.3527
 epoch: 19, train_loss: 1.1905, test_loss: 1.1789, test_f1: 0.3514
 epoch: 20, train_loss: 1.1809, test_loss: 1.1839, test_f1: 0.3429
 epoch: 21, train_loss: 1.1855, test_loss: 1.1772, test_f1: 0.3674
 epoch: 22, train_loss: 1.1701, test_loss: 1.1682, test_f1: 0.3719
 epoch: 23, train_loss: 1.1653, test_loss: 1.1722, test_f1: 0.3909
 epoch: 24, train_loss: 1.1576, test_loss: 1.1998, test_f1: 0.4035
 epoch: 25, train_loss: 1.1573, test_loss: 1.1684, test_f1: 0.4146
 epoch: 26, train_loss: 1.1440, test_loss: 1.1958, test_f1: 0.4122
 epoch: 27, train_loss: 1.1401, test_loss: 1.1823, test_f1: 0.4176
 epoch: 28, train_loss: 1.1352, test_loss: 1.1573, test_f1: 0.4225
 epoch: 29, train_loss: 1.1258, test_loss: 1.2058, test_f1: 0.4081
 epoch: 30, train_loss: 1.1298, test_loss: 1.1688, test_f1: 0.4229
 epoch: 31, train_loss: 1.1207, test_loss: 1.1967, test_f1: 0.4182
 epoch: 32, train_loss: 1.1111, test_loss: 1.1712, test_f1: 0.4191
 epoch: 33, train_loss: 1.1146, test_loss: 1.1668, test_f1: 0.4204
 epoch: 34, train_loss: 1.0970, test_loss: 1.1820, test_f1: 0.4261
 epoch: 35, train_loss: 1.0972, test_loss: 1.2047, test_f1: 0.4186
 epoch: 36, train_loss: 1.0897, test_loss: 1.2091, test_f1: 0.4110
 epoch: 37, train_loss: 1.0789, test_loss: 1.1546, test_f1: 0.4097
 epoch: 38, train_loss: 1.0753, test_loss: 1.1671, test_f1: 0.4231
 epoch: 39, train_loss: 1.0792, test_loss: 1.1903, test_f1: 0.4038
 epoch: 40, train_loss: 1.0738, test_loss: 1.1323, test_f1: 0.4339
 epoch: 41, train_loss: 1.0747, test_loss: 1.2090, test_f1: 0.4218
 epoch: 42, train_loss: 1.0715, test_loss: 1.1239, test_f1: 0.4216
 epoch: 43, train_loss: 1.0648, test_loss: 1.1286, test_f1: 0.4374
 epoch: 44, train_loss: 1.0570, test_loss: 1.2206, test_f1: 0.4068
 epoch: 45, train_loss: 1.0552, test_loss: 1.1133, test_f1: 0.4298
 epoch: 46, train_loss: 1.0455, test_loss: 1.1597, test_f1: 0.4229
 epoch: 47, train_loss: 1.0423, test_loss: 1.1880, test_f1: 0.4263
 epoch: 48, train_loss: 1.0446, test_loss: 1.1713, test_f1: 0.4227
 epoch: 49, train_loss: 1.0517, test_loss: 1.1008, test_f1: 0.4384
 epoch: 50, train_loss: 1.0342, test_loss: 1.1455, test_f1: 0.4298
 epoch: 51, train_loss: 1.0294, test_loss: 1.1533, test_f1: 0.4147
 epoch: 52, train_loss: 1.0334, test_loss: 1.1157, test_f1: 0.4353
 epoch: 53, train_loss: 1.0169, test_loss: 1.1299, test_f1: 0.4235
 epoch: 54, train_loss: 1.0146, test_loss: 1.1391, test_f1: 0.4327
 epoch: 55, train_loss: 1.0165, test_loss: 1.1618, test_f1: 0.4211
 epoch: 56, train_loss: 1.0088, test_loss: 1.1584, test_f1: 0.4093
 epoch: 57, train_loss: 1.0119, test_loss: 1.1594, test_f1: 0.4217
 epoch: 58, train_loss: 1.0098, test_loss: 1.1532, test_f1: 0.4216
 epoch: 59, train_loss: 1.0098, test_loss: 1.1857, test_f1: 0.4175
 epoch: 60, train_loss: 1.0068, test_loss: 1.1727, test_f1: 0.4373
 epoch: 61, train_loss: 1.0040, test_loss: 1.1581, test_f1: 0.4173
 epoch: 62, train_loss: 0.9998, test_loss: 1.1416, test_f1: 0.4227
 epoch: 63, train_loss: 0.9990, test_loss: 1.1617, test_f1: 0.4254
 epoch: 64, train_loss: 1.0031, test_loss: 1.1287, test_f1: 0.4315
 epoch: 65, train_loss: 1.0001, test_loss: 1.0950, test_f1: 0.4223
 epoch: 66, train_loss: 0.9925, test_loss: 1.1515, test_f1: 0.4266
 epoch: 67, train_loss: 0.9936, test_loss: 1.1579, test_f1: 0.4166
 epoch: 68, train_loss: 0.9868, test_loss: 1.1572, test_f1: 0.4251
 epoch: 69, train_loss: 0.9904, test_loss: 1.1809, test_f1: 0.4221
 epoch: 70, train_loss: 0.9987, test_loss: 1.2365, test_f1: 0.4142
 epoch: 71, train_loss: 1.0003, test_loss: 1.1926, test_f1: 0.4216
 epoch: 72, train_loss: 0.9906, test_loss: 1.1865, test_f1: 0.4211
 epoch: 73, train_loss: 0.9706, test_loss: 1.1731, test_f1: 0.4284
 epoch: 74, train_loss: 0.9833, test_loss: 1.1760, test_f1: 0.4281
 epoch: 75, train_loss: 0.9938, test_loss: 1.2044, test_f1: 0.4148
 epoch: 76, train_loss: 0.9839, test_loss: 1.1624, test_f1: 0.4237
 epoch: 77, train_loss: 0.9769, test_loss: 1.1714, test_f1: 0.4277
 epoch: 78, train_loss: 0.9673, test_loss: 1.1887, test_f1: 0.4342
 epoch: 79, train_loss: 0.9729, test_loss: 1.1602, test_f1: 0.4239
 epoch: 80, train_loss: 0.9822, test_loss: 1.1822, test_f1: 0.4236
 epoch: 81, train_loss: 0.9795, test_loss: 1.2080, test_f1: 0.4301
 epoch: 82, train_loss: 0.9878, test_loss: 1.1776, test_f1: 0.4374
 epoch: 83, train_loss: 0.9845, test_loss: 1.1605, test_f1: 0.4230
 epoch: 84, train_loss: 0.9744, test_loss: 1.1833, test_f1: 0.4224
 epoch: 85, train_loss: 0.9655, test_loss: 1.1696, test_f1: 0.4246
 epoch: 86, train_loss: 0.9744, test_loss: 1.2016, test_f1: 0.4221
 epoch: 87, train_loss: 0.9599, test_loss: 1.1673, test_f1: 0.4160
 epoch: 88, train_loss: 0.9737, test_loss: 1.1572, test_f1: 0.4302
 epoch: 89, train_loss: 0.9724, test_loss: 1.1818, test_f1: 0.4270
 epoch: 90, train_loss: 0.9618, test_loss: 1.1899, test_f1: 0.4281
 epoch: 91, train_loss: 0.9676, test_loss: 1.2070, test_f1: 0.4183
 epoch: 92, train_loss: 0.9617, test_loss: 1.1954, test_f1: 0.4371
 epoch: 93, train_loss: 0.9593, test_loss: 1.1467, test_f1: 0.4294
 epoch: 94, train_loss: 0.9497, test_loss: 1.1536, test_f1: 0.4264
 epoch: 95, train_loss: 0.9461, test_loss: 1.2185, test_f1: 0.4228
 epoch: 96, train_loss: 0.9566, test_loss: 1.2072, test_f1: 0.4250
 epoch: 97, train_loss: 0.9515, test_loss: 1.1060, test_f1: 0.4398
 epoch: 98, train_loss: 0.9502, test_loss: 1.1710, test_f1: 0.4237
 epoch: 99, train_loss: 0.9432, test_loss: 1.1816, test_f1: 0.4333
##################ITERATION #1 ****************************************
 epoch: 0, train_loss: 1.3661, test_loss: 1.3629, test_f1: 0.2309
 epoch: 1, train_loss: 1.2996, test_loss: 1.3079, test_f1: 0.2274
 epoch: 2, train_loss: 1.2736, test_loss: 1.2742, test_f1: 0.2274
 epoch: 3, train_loss: 1.2624, test_loss: 1.2504, test_f1: 0.2274
 epoch: 4, train_loss: 1.2496, test_loss: 1.2385, test_f1: 0.2595
 epoch: 5, train_loss: 1.2359, test_loss: 1.2253, test_f1: 0.2979
 epoch: 6, train_loss: 1.2264, test_loss: 1.2043, test_f1: 0.2960
 epoch: 7, train_loss: 1.2196, test_loss: 1.1970, test_f1: 0.3167
 epoch: 8, train_loss: 1.2086, test_loss: 1.1844, test_f1: 0.3278
 epoch: 9, train_loss: 1.2049, test_loss: 1.1753, test_f1: 0.3339
 epoch: 10, train_loss: 1.1910, test_loss: 1.1661, test_f1: 0.3796
 epoch: 11, train_loss: 1.1889, test_loss: 1.1541, test_f1: 0.3787
 epoch: 12, train_loss: 1.1765, test_loss: 1.1410, test_f1: 0.3744
 epoch: 13, train_loss: 1.1759, test_loss: 1.1338, test_f1: 0.3875
 epoch: 14, train_loss: 1.1695, test_loss: 1.1290, test_f1: 0.3822
 epoch: 15, train_loss: 1.1603, test_loss: 1.1157, test_f1: 0.4030
 epoch: 16, train_loss: 1.1543, test_loss: 1.1160, test_f1: 0.3976
 epoch: 17, train_loss: 1.1435, test_loss: 1.1054, test_f1: 0.4100
 epoch: 18, train_loss: 1.1390, test_loss: 1.1061, test_f1: 0.4088
 epoch: 19, train_loss: 1.1316, test_loss: 1.1047, test_f1: 0.4081
 epoch: 20, train_loss: 1.1200, test_loss: 1.0820, test_f1: 0.4105
 epoch: 21, train_loss: 1.1201, test_loss: 1.0799, test_f1: 0.4391
 epoch: 22, train_loss: 1.1112, test_loss: 1.0975, test_f1: 0.4159
 epoch: 23, train_loss: 1.1028, test_loss: 1.0723, test_f1: 0.4238
 epoch: 24, train_loss: 1.0994, test_loss: 1.0655, test_f1: 0.4301
 epoch: 25, train_loss: 1.0968, test_loss: 1.0675, test_f1: 0.4530
 epoch: 26, train_loss: 1.0981, test_loss: 1.0555, test_f1: 0.4329
 epoch: 27, train_loss: 1.0795, test_loss: 1.0728, test_f1: 0.4049
 epoch: 28, train_loss: 1.0875, test_loss: 1.0615, test_f1: 0.4244
 epoch: 29, train_loss: 1.0695, test_loss: 1.0666, test_f1: 0.4249
 epoch: 30, train_loss: 1.0729, test_loss: 1.0540, test_f1: 0.4498
 epoch: 31, train_loss: 1.0682, test_loss: 1.0307, test_f1: 0.4480
 epoch: 32, train_loss: 1.0690, test_loss: 1.0738, test_f1: 0.4075
 epoch: 33, train_loss: 1.0705, test_loss: 1.0282, test_f1: 0.4519
 epoch: 34, train_loss: 1.0625, test_loss: 1.0351, test_f1: 0.4437
 epoch: 35, train_loss: 1.0475, test_loss: 1.0377, test_f1: 0.4500
 epoch: 36, train_loss: 1.0537, test_loss: 1.0519, test_f1: 0.4452
 epoch: 37, train_loss: 1.0391, test_loss: 1.0483, test_f1: 0.4648
 epoch: 38, train_loss: 1.0436, test_loss: 1.0578, test_f1: 0.4552
 epoch: 39, train_loss: 1.0293, test_loss: 1.0407, test_f1: 0.4490
 epoch: 40, train_loss: 1.0348, test_loss: 1.0394, test_f1: 0.4445
 epoch: 41, train_loss: 1.0350, test_loss: 1.0562, test_f1: 0.4328
 epoch: 42, train_loss: 1.0222, test_loss: 1.0235, test_f1: 0.4524
 epoch: 43, train_loss: 1.0270, test_loss: 1.0163, test_f1: 0.4678
 epoch: 44, train_loss: 1.0159, test_loss: 1.0639, test_f1: 0.4405
 epoch: 45, train_loss: 1.0049, test_loss: 1.0529, test_f1: 0.4309
 epoch: 46, train_loss: 1.0130, test_loss: 1.0289, test_f1: 0.4548
 epoch: 47, train_loss: 1.0011, test_loss: 1.0362, test_f1: 0.4433
 epoch: 48, train_loss: 1.0071, test_loss: 1.0626, test_f1: 0.4540
 epoch: 49, train_loss: 0.9987, test_loss: 1.0313, test_f1: 0.4601
 epoch: 50, train_loss: 1.0011, test_loss: 1.0206, test_f1: 0.4815
 epoch: 51, train_loss: 0.9858, test_loss: 1.0157, test_f1: 0.4747
 epoch: 52, train_loss: 0.9788, test_loss: 1.0488, test_f1: 0.4488
 epoch: 53, train_loss: 0.9906, test_loss: 1.0202, test_f1: 0.4755
 epoch: 54, train_loss: 0.9829, test_loss: 1.0308, test_f1: 0.4665
 epoch: 55, train_loss: 0.9772, test_loss: 1.0328, test_f1: 0.4719
 epoch: 56, train_loss: 0.9736, test_loss: 1.0295, test_f1: 0.4746
 epoch: 57, train_loss: 0.9735, test_loss: 1.0197, test_f1: 0.4857
 epoch: 58, train_loss: 0.9666, test_loss: 1.0285, test_f1: 0.4819
 epoch: 59, train_loss: 0.9688, test_loss: 1.0292, test_f1: 0.4857
 epoch: 60, train_loss: 0.9758, test_loss: 1.0215, test_f1: 0.5036
 epoch: 61, train_loss: 0.9693, test_loss: 1.0350, test_f1: 0.4775
 epoch: 62, train_loss: 0.9710, test_loss: 1.0777, test_f1: 0.4892
 epoch: 63, train_loss: 0.9578, test_loss: 1.0406, test_f1: 0.4919
 epoch: 64, train_loss: 0.9637, test_loss: 1.0301, test_f1: 0.4919
 epoch: 65, train_loss: 0.9661, test_loss: 1.0331, test_f1: 0.4797
 epoch: 66, train_loss: 0.9576, test_loss: 1.0460, test_f1: 0.4882
 epoch: 67, train_loss: 0.9590, test_loss: 1.0493, test_f1: 0.4855
 epoch: 68, train_loss: 0.9475, test_loss: 1.0477, test_f1: 0.4993
 epoch: 69, train_loss: 0.9535, test_loss: 1.0756, test_f1: 0.4809
 epoch: 70, train_loss: 0.9606, test_loss: 1.0457, test_f1: 0.4842
 epoch: 71, train_loss: 0.9488, test_loss: 1.0901, test_f1: 0.4839
 epoch: 72, train_loss: 0.9516, test_loss: 1.0638, test_f1: 0.4845
 epoch: 73, train_loss: 0.9498, test_loss: 1.1049, test_f1: 0.4791
 epoch: 74, train_loss: 0.9446, test_loss: 1.1087, test_f1: 0.4753
 epoch: 75, train_loss: 0.9300, test_loss: 1.0701, test_f1: 0.4810
 epoch: 76, train_loss: 0.9528, test_loss: 1.0434, test_f1: 0.5054
 epoch: 77, train_loss: 0.9432, test_loss: 1.0396, test_f1: 0.5143
 epoch: 78, train_loss: 0.9398, test_loss: 1.0394, test_f1: 0.5178
 epoch: 79, train_loss: 0.9469, test_loss: 1.0286, test_f1: 0.4885
 epoch: 80, train_loss: 0.9506, test_loss: 1.0414, test_f1: 0.5144
 epoch: 81, train_loss: 0.9405, test_loss: 1.0485, test_f1: 0.5118
 epoch: 82, train_loss: 0.9370, test_loss: 1.0538, test_f1: 0.5150
 epoch: 83, train_loss: 0.9504, test_loss: 1.0285, test_f1: 0.5123
 epoch: 84, train_loss: 0.9439, test_loss: 1.0373, test_f1: 0.5184
 epoch: 85, train_loss: 0.9396, test_loss: 1.0326, test_f1: 0.5125
 epoch: 86, train_loss: 0.9361, test_loss: 1.0551, test_f1: 0.5211
 epoch: 87, train_loss: 0.9379, test_loss: 1.0371, test_f1: 0.5146
 epoch: 88, train_loss: 0.9359, test_loss: 1.0665, test_f1: 0.5120
 epoch: 89, train_loss: 0.9281, test_loss: 1.0593, test_f1: 0.5093
 epoch: 90, train_loss: 0.9342, test_loss: 1.0612, test_f1: 0.5001
 epoch: 91, train_loss: 0.9309, test_loss: 1.0949, test_f1: 0.4714
 epoch: 92, train_loss: 0.9223, test_loss: 1.0680, test_f1: 0.5024
 epoch: 93, train_loss: 0.9211, test_loss: 1.0635, test_f1: 0.5141
 epoch: 94, train_loss: 0.9200, test_loss: 1.0574, test_f1: 0.5220
 epoch: 95, train_loss: 0.9161, test_loss: 1.0521, test_f1: 0.5127
 epoch: 96, train_loss: 0.9127, test_loss: 1.0665, test_f1: 0.4987
 epoch: 97, train_loss: 0.9258, test_loss: 1.0489, test_f1: 0.5119
 epoch: 98, train_loss: 0.9186, test_loss: 1.0738, test_f1: 0.5163
 epoch: 99, train_loss: 0.9183, test_loss: 1.0799, test_f1: 0.5251
##################ITERATION #2 ****************************************
 epoch: 0, train_loss: 1.3475, test_loss: 1.3417, test_f1: 0.2274
 epoch: 1, train_loss: 1.2928, test_loss: 1.3101, test_f1: 0.2274
 epoch: 2, train_loss: 1.2607, test_loss: 1.2752, test_f1: 0.2274
 epoch: 3, train_loss: 1.2463, test_loss: 1.2389, test_f1: 0.2274
 epoch: 4, train_loss: 1.2351, test_loss: 1.2155, test_f1: 0.2320
 epoch: 5, train_loss: 1.2209, test_loss: 1.1974, test_f1: 0.2578
 epoch: 6, train_loss: 1.2165, test_loss: 1.1849, test_f1: 0.3061
 epoch: 7, train_loss: 1.2042, test_loss: 1.1726, test_f1: 0.3411
 epoch: 8, train_loss: 1.1926, test_loss: 1.1626, test_f1: 0.3660
 epoch: 9, train_loss: 1.1865, test_loss: 1.1505, test_f1: 0.3981
 epoch: 10, train_loss: 1.1823, test_loss: 1.1403, test_f1: 0.3967
 epoch: 11, train_loss: 1.1738, test_loss: 1.1381, test_f1: 0.3860
 epoch: 12, train_loss: 1.1665, test_loss: 1.1327, test_f1: 0.4058
 epoch: 13, train_loss: 1.1594, test_loss: 1.1253, test_f1: 0.4244
 epoch: 14, train_loss: 1.1475, test_loss: 1.1203, test_f1: 0.3989
 epoch: 15, train_loss: 1.1423, test_loss: 1.1117, test_f1: 0.4253
 epoch: 16, train_loss: 1.1447, test_loss: 1.1147, test_f1: 0.4286
 epoch: 17, train_loss: 1.1443, test_loss: 1.1106, test_f1: 0.4247
 epoch: 18, train_loss: 1.1315, test_loss: 1.1133, test_f1: 0.4229
 epoch: 19, train_loss: 1.1250, test_loss: 1.0909, test_f1: 0.4376
 epoch: 20, train_loss: 1.1226, test_loss: 1.1093, test_f1: 0.4156
 epoch: 21, train_loss: 1.1232, test_loss: 1.0881, test_f1: 0.4405
 epoch: 22, train_loss: 1.1100, test_loss: 1.0970, test_f1: 0.4190
 epoch: 23, train_loss: 1.1021, test_loss: 1.0697, test_f1: 0.4334
 epoch: 24, train_loss: 1.1007, test_loss: 1.0811, test_f1: 0.4362
 epoch: 25, train_loss: 1.0934, test_loss: 1.0684, test_f1: 0.4258
 epoch: 26, train_loss: 1.0825, test_loss: 1.0687, test_f1: 0.4384
 epoch: 27, train_loss: 1.0738, test_loss: 1.0772, test_f1: 0.4597
 epoch: 28, train_loss: 1.0782, test_loss: 1.0919, test_f1: 0.4377
 epoch: 29, train_loss: 1.0732, test_loss: 1.0727, test_f1: 0.4448
 epoch: 30, train_loss: 1.0633, test_loss: 1.0643, test_f1: 0.4439
 epoch: 31, train_loss: 1.0638, test_loss: 1.0585, test_f1: 0.4314
 epoch: 32, train_loss: 1.0700, test_loss: 1.0692, test_f1: 0.4330
 epoch: 33, train_loss: 1.0604, test_loss: 1.0549, test_f1: 0.4612
 epoch: 34, train_loss: 1.0447, test_loss: 1.0465, test_f1: 0.4639
 epoch: 35, train_loss: 1.0448, test_loss: 1.0659, test_f1: 0.4452
 epoch: 36, train_loss: 1.0395, test_loss: 1.0597, test_f1: 0.4498
 epoch: 37, train_loss: 1.0303, test_loss: 1.0433, test_f1: 0.4573
 epoch: 38, train_loss: 1.0423, test_loss: 1.0654, test_f1: 0.4451
 epoch: 39, train_loss: 1.0279, test_loss: 1.0628, test_f1: 0.4619
 epoch: 40, train_loss: 1.0221, test_loss: 1.0586, test_f1: 0.4495
 epoch: 41, train_loss: 1.0200, test_loss: 1.0548, test_f1: 0.4335
 epoch: 42, train_loss: 1.0160, test_loss: 1.0550, test_f1: 0.4535
 epoch: 43, train_loss: 1.0245, test_loss: 1.0536, test_f1: 0.4438
 epoch: 44, train_loss: 1.0217, test_loss: 1.0711, test_f1: 0.4422
 epoch: 45, train_loss: 1.0120, test_loss: 1.0518, test_f1: 0.4349
 epoch: 46, train_loss: 1.0036, test_loss: 1.0530, test_f1: 0.4641
 epoch: 47, train_loss: 1.0181, test_loss: 1.0556, test_f1: 0.4452
 epoch: 48, train_loss: 1.0064, test_loss: 1.3090, test_f1: 0.4341
 epoch: 49, train_loss: 0.9964, test_loss: 1.1398, test_f1: 0.4382
 epoch: 50, train_loss: 0.9974, test_loss: 1.0535, test_f1: 0.4419
 epoch: 51, train_loss: 0.9891, test_loss: 1.0529, test_f1: 0.4457
 epoch: 52, train_loss: 0.9852, test_loss: 1.0445, test_f1: 0.4472
 epoch: 53, train_loss: 0.9816, test_loss: 1.0474, test_f1: 0.4544
 epoch: 54, train_loss: 0.9699, test_loss: 1.0708, test_f1: 0.4405
 epoch: 55, train_loss: 0.9670, test_loss: 1.0580, test_f1: 0.4601
 epoch: 56, train_loss: 0.9729, test_loss: 1.1734, test_f1: 0.4612
 epoch: 57, train_loss: 0.9610, test_loss: 1.1287, test_f1: 0.4570
 epoch: 58, train_loss: 0.9698, test_loss: 1.0684, test_f1: 0.4411
 epoch: 59, train_loss: 0.9587, test_loss: 1.2218, test_f1: 0.4529
 epoch: 60, train_loss: 0.9621, test_loss: 1.0876, test_f1: 0.4490
 epoch: 61, train_loss: 0.9598, test_loss: 1.3930, test_f1: 0.4333
 epoch: 62, train_loss: 0.9618, test_loss: 1.0824, test_f1: 0.4582
 epoch: 63, train_loss: 0.9541, test_loss: 1.0691, test_f1: 0.4669
 epoch: 64, train_loss: 0.9568, test_loss: 1.0750, test_f1: 0.4496
 epoch: 65, train_loss: 0.9430, test_loss: 1.2275, test_f1: 0.4491
 epoch: 66, train_loss: 0.9548, test_loss: 1.1085, test_f1: 0.4451
 epoch: 67, train_loss: 0.9535, test_loss: 1.0470, test_f1: 0.4596
 epoch: 68, train_loss: 0.9576, test_loss: 1.0693, test_f1: 0.4556
 epoch: 69, train_loss: 0.9350, test_loss: 1.2046, test_f1: 0.4414
 epoch: 70, train_loss: 0.9421, test_loss: 1.0584, test_f1: 0.4381
 epoch: 71, train_loss: 0.9398, test_loss: 1.1218, test_f1: 0.4443
 epoch: 72, train_loss: 0.9425, test_loss: 1.1602, test_f1: 0.4446
 epoch: 73, train_loss: 0.9356, test_loss: 1.2444, test_f1: 0.4333
 epoch: 74, train_loss: 0.9528, test_loss: 1.0685, test_f1: 0.4567
 epoch: 75, train_loss: 0.9346, test_loss: 1.0622, test_f1: 0.4444
 epoch: 76, train_loss: 0.9380, test_loss: 1.0757, test_f1: 0.4461
 epoch: 77, train_loss: 0.9384, test_loss: 1.0625, test_f1: 0.4441
 epoch: 78, train_loss: 0.9312, test_loss: 1.0613, test_f1: 0.4591
 epoch: 79, train_loss: 0.9291, test_loss: 1.0601, test_f1: 0.4531
 epoch: 80, train_loss: 0.9284, test_loss: 1.2234, test_f1: 0.4199
 epoch: 81, train_loss: 0.9238, test_loss: 1.0989, test_f1: 0.4474
 epoch: 82, train_loss: 0.9253, test_loss: 1.0958, test_f1: 0.4379
 epoch: 83, train_loss: 0.9133, test_loss: 1.1679, test_f1: 0.4266
 epoch: 84, train_loss: 0.9295, test_loss: 1.0776, test_f1: 0.4514
 epoch: 85, train_loss: 0.9317, test_loss: 1.0689, test_f1: 0.4444
 epoch: 86, train_loss: 0.9299, test_loss: 1.1311, test_f1: 0.4345
 epoch: 87, train_loss: 0.9260, test_loss: 1.5148, test_f1: 0.4401
 epoch: 88, train_loss: 0.9338, test_loss: 1.0633, test_f1: 0.4476
 epoch: 89, train_loss: 0.9156, test_loss: 1.1002, test_f1: 0.4451
 epoch: 90, train_loss: 0.9150, test_loss: 1.0842, test_f1: 0.4499
 epoch: 91, train_loss: 0.9194, test_loss: 1.1005, test_f1: 0.4476
 epoch: 92, train_loss: 0.9135, test_loss: 1.0749, test_f1: 0.4480
 epoch: 93, train_loss: 0.9169, test_loss: 1.0812, test_f1: 0.4582
 epoch: 94, train_loss: 0.9036, test_loss: 1.0633, test_f1: 0.4673
 epoch: 95, train_loss: 0.9136, test_loss: 1.2055, test_f1: 0.4380
 epoch: 96, train_loss: 0.9265, test_loss: 1.1008, test_f1: 0.4438
 epoch: 97, train_loss: 0.9070, test_loss: 1.0979, test_f1: 0.4427
 epoch: 98, train_loss: 0.9080, test_loss: 1.1030, test_f1: 0.4436
 epoch: 99, train_loss: 0.9099, test_loss: 1.1885, test_f1: 0.4544
##################ITERATION #3 ****************************************
 epoch: 0, train_loss: 1.3162, test_loss: 1.3005, test_f1: 0.2274
 epoch: 1, train_loss: 1.2649, test_loss: 1.2691, test_f1: 0.2274
 epoch: 2, train_loss: 1.2578, test_loss: 1.2448, test_f1: 0.2295
 epoch: 3, train_loss: 1.2451, test_loss: 1.2261, test_f1: 0.2619
 epoch: 4, train_loss: 1.2347, test_loss: 1.2108, test_f1: 0.2831
 epoch: 5, train_loss: 1.2308, test_loss: 1.2006, test_f1: 0.2948
 epoch: 6, train_loss: 1.2214, test_loss: 1.1951, test_f1: 0.3272
 epoch: 7, train_loss: 1.2197, test_loss: 1.1863, test_f1: 0.3575
 epoch: 8, train_loss: 1.2124, test_loss: 1.1802, test_f1: 0.3521
 epoch: 9, train_loss: 1.2076, test_loss: 1.1772, test_f1: 0.3460
 epoch: 10, train_loss: 1.2010, test_loss: 1.1735, test_f1: 0.3672
 epoch: 11, train_loss: 1.1988, test_loss: 1.1708, test_f1: 0.3886
 epoch: 12, train_loss: 1.1953, test_loss: 1.1568, test_f1: 0.3837
 epoch: 13, train_loss: 1.1900, test_loss: 1.1457, test_f1: 0.4256
 epoch: 14, train_loss: 1.1814, test_loss: 1.1400, test_f1: 0.4182
 epoch: 15, train_loss: 1.1792, test_loss: 1.1362, test_f1: 0.4082
 epoch: 16, train_loss: 1.1684, test_loss: 1.1218, test_f1: 0.4160
 epoch: 17, train_loss: 1.1629, test_loss: 1.1180, test_f1: 0.4326
 epoch: 18, train_loss: 1.1532, test_loss: 1.1212, test_f1: 0.4348
 epoch: 19, train_loss: 1.1511, test_loss: 1.1010, test_f1: 0.4434
 epoch: 20, train_loss: 1.1495, test_loss: 1.1100, test_f1: 0.4152
 epoch: 21, train_loss: 1.1398, test_loss: 1.0937, test_f1: 0.4769
 epoch: 22, train_loss: 1.1353, test_loss: 1.1089, test_f1: 0.4397
 epoch: 23, train_loss: 1.1276, test_loss: 1.0887, test_f1: 0.4555
 epoch: 24, train_loss: 1.1211, test_loss: 1.0573, test_f1: 0.4653
 epoch: 25, train_loss: 1.1113, test_loss: 1.0785, test_f1: 0.4589
 epoch: 26, train_loss: 1.1055, test_loss: 1.0503, test_f1: 0.4764
 epoch: 27, train_loss: 1.1016, test_loss: 1.0736, test_f1: 0.4755
 epoch: 28, train_loss: 1.1061, test_loss: 1.0566, test_f1: 0.4826
 epoch: 29, train_loss: 1.0998, test_loss: 1.0508, test_f1: 0.4868
 epoch: 30, train_loss: 1.0886, test_loss: 1.0445, test_f1: 0.4792
 epoch: 31, train_loss: 1.0779, test_loss: 1.0386, test_f1: 0.4699
 epoch: 32, train_loss: 1.0769, test_loss: 1.0504, test_f1: 0.4607
 epoch: 33, train_loss: 1.0717, test_loss: 1.0410, test_f1: 0.4835
 epoch: 34, train_loss: 1.0673, test_loss: 1.0199, test_f1: 0.4811
 epoch: 35, train_loss: 1.0692, test_loss: 1.0322, test_f1: 0.5073
 epoch: 36, train_loss: 1.0615, test_loss: 1.0177, test_f1: 0.4549
 epoch: 37, train_loss: 1.0518, test_loss: 1.0236, test_f1: 0.4770
 epoch: 38, train_loss: 1.0462, test_loss: 1.0152, test_f1: 0.4672
 epoch: 39, train_loss: 1.0572, test_loss: 0.9994, test_f1: 0.4944
 epoch: 40, train_loss: 1.0482, test_loss: 1.0245, test_f1: 0.4788
 epoch: 41, train_loss: 1.0502, test_loss: 1.0178, test_f1: 0.4695
 epoch: 42, train_loss: 1.0431, test_loss: 0.9981, test_f1: 0.4811
 epoch: 43, train_loss: 1.0239, test_loss: 0.9901, test_f1: 0.4684
 epoch: 44, train_loss: 1.0238, test_loss: 1.0017, test_f1: 0.4621
 epoch: 45, train_loss: 1.0337, test_loss: 1.0275, test_f1: 0.4674
 epoch: 46, train_loss: 1.0292, test_loss: 0.9875, test_f1: 0.4746
 epoch: 47, train_loss: 1.0171, test_loss: 0.9783, test_f1: 0.4722
 epoch: 48, train_loss: 1.0177, test_loss: 0.9775, test_f1: 0.4804
 epoch: 49, train_loss: 1.0027, test_loss: 0.9800, test_f1: 0.4869
 epoch: 50, train_loss: 1.0091, test_loss: 0.9823, test_f1: 0.4681
 epoch: 51, train_loss: 1.0083, test_loss: 0.9711, test_f1: 0.4908
 epoch: 52, train_loss: 0.9955, test_loss: 0.9751, test_f1: 0.4751
 epoch: 53, train_loss: 0.9972, test_loss: 0.9777, test_f1: 0.4774
 epoch: 54, train_loss: 0.9999, test_loss: 0.9716, test_f1: 0.4922
 epoch: 55, train_loss: 0.9978, test_loss: 0.9662, test_f1: 0.4847
 epoch: 56, train_loss: 0.9972, test_loss: 0.9876, test_f1: 0.4925
 epoch: 57, train_loss: 0.9788, test_loss: 0.9629, test_f1: 0.4829
 epoch: 58, train_loss: 0.9888, test_loss: 0.9681, test_f1: 0.4827
 epoch: 59, train_loss: 0.9822, test_loss: 0.9560, test_f1: 0.4851
 epoch: 60, train_loss: 0.9726, test_loss: 0.9654, test_f1: 0.4757
 epoch: 61, train_loss: 0.9784, test_loss: 0.9505, test_f1: 0.5024
 epoch: 62, train_loss: 0.9834, test_loss: 0.9544, test_f1: 0.4866
 epoch: 63, train_loss: 0.9759, test_loss: 0.9880, test_f1: 0.4885
 epoch: 64, train_loss: 0.9761, test_loss: 0.9468, test_f1: 0.4907
 epoch: 65, train_loss: 0.9779, test_loss: 0.9884, test_f1: 0.4820
 epoch: 66, train_loss: 0.9812, test_loss: 0.9536, test_f1: 0.4959
 epoch: 67, train_loss: 0.9690, test_loss: 0.9596, test_f1: 0.5139
 epoch: 68, train_loss: 0.9625, test_loss: 0.9619, test_f1: 0.4890
 epoch: 69, train_loss: 0.9656, test_loss: 0.9731, test_f1: 0.4988
 epoch: 70, train_loss: 0.9723, test_loss: 0.9648, test_f1: 0.5080
 epoch: 71, train_loss: 0.9597, test_loss: 0.9656, test_f1: 0.4955
 epoch: 72, train_loss: 0.9701, test_loss: 0.9591, test_f1: 0.4983
 epoch: 73, train_loss: 0.9664, test_loss: 0.9692, test_f1: 0.4931
 epoch: 74, train_loss: 0.9739, test_loss: 0.9596, test_f1: 0.4999
 epoch: 75, train_loss: 0.9506, test_loss: 0.9748, test_f1: 0.5183
 epoch: 76, train_loss: 0.9725, test_loss: 0.9668, test_f1: 0.5051
 epoch: 77, train_loss: 0.9679, test_loss: 0.9602, test_f1: 0.5100
 epoch: 78, train_loss: 0.9592, test_loss: 0.9493, test_f1: 0.5062
 epoch: 79, train_loss: 0.9539, test_loss: 0.9588, test_f1: 0.5117
 epoch: 80, train_loss: 0.9560, test_loss: 0.9643, test_f1: 0.4949
 epoch: 81, train_loss: 0.9583, test_loss: 0.9514, test_f1: 0.5132
 epoch: 82, train_loss: 0.9561, test_loss: 0.9597, test_f1: 0.5105
 epoch: 83, train_loss: 0.9528, test_loss: 0.9454, test_f1: 0.5262
 epoch: 84, train_loss: 0.9646, test_loss: 0.9685, test_f1: 0.5026
 epoch: 85, train_loss: 0.9637, test_loss: 0.9565, test_f1: 0.5048
 epoch: 86, train_loss: 0.9551, test_loss: 0.9509, test_f1: 0.5102
 epoch: 87, train_loss: 0.9565, test_loss: 0.9511, test_f1: 0.5160
 epoch: 88, train_loss: 0.9607, test_loss: 0.9655, test_f1: 0.5048
 epoch: 89, train_loss: 0.9391, test_loss: 0.9492, test_f1: 0.5125
 epoch: 90, train_loss: 0.9525, test_loss: 0.9653, test_f1: 0.4984
 epoch: 91, train_loss: 0.9528, test_loss: 0.9693, test_f1: 0.4960
 epoch: 92, train_loss: 0.9466, test_loss: 0.9992, test_f1: 0.5040
 epoch: 93, train_loss: 0.9404, test_loss: 0.9823, test_f1: 0.5143
 epoch: 94, train_loss: 0.9570, test_loss: 0.9504, test_f1: 0.5181
 epoch: 95, train_loss: 0.9436, test_loss: 0.9618, test_f1: 0.5175
 epoch: 96, train_loss: 0.9509, test_loss: 0.9541, test_f1: 0.5030
 epoch: 97, train_loss: 0.9417, test_loss: 0.9795, test_f1: 0.5085
 epoch: 98, train_loss: 0.9421, test_loss: 0.9730, test_f1: 0.5131
 epoch: 99, train_loss: 0.9333, test_loss: 0.9505, test_f1: 0.5080
##################ITERATION #4 ****************************************
 epoch: 0, train_loss: 1.4003, test_loss: 1.3146, test_f1: 0.2274
 epoch: 1, train_loss: 1.2975, test_loss: 1.2944, test_f1: 0.2274
 epoch: 2, train_loss: 1.2694, test_loss: 1.2802, test_f1: 0.2420
 epoch: 3, train_loss: 1.2473, test_loss: 1.2563, test_f1: 0.3167
 epoch: 4, train_loss: 1.2377, test_loss: 1.2230, test_f1: 0.3165
 epoch: 5, train_loss: 1.2219, test_loss: 1.2019, test_f1: 0.3343
 epoch: 6, train_loss: 1.2209, test_loss: 1.1924, test_f1: 0.3506
 epoch: 7, train_loss: 1.2123, test_loss: 1.1790, test_f1: 0.3602
 epoch: 8, train_loss: 1.2016, test_loss: 1.1638, test_f1: 0.3845
 epoch: 9, train_loss: 1.1975, test_loss: 1.1553, test_f1: 0.3807
 epoch: 10, train_loss: 1.1958, test_loss: 1.1453, test_f1: 0.3794
 epoch: 11, train_loss: 1.1885, test_loss: 1.1380, test_f1: 0.3946
 epoch: 12, train_loss: 1.1672, test_loss: 1.1216, test_f1: 0.4277
 epoch: 13, train_loss: 1.1586, test_loss: 1.1159, test_f1: 0.4305
 epoch: 14, train_loss: 1.1574, test_loss: 1.1053, test_f1: 0.4472
 epoch: 15, train_loss: 1.1587, test_loss: 1.0912, test_f1: 0.4462
 epoch: 16, train_loss: 1.1456, test_loss: 1.0853, test_f1: 0.4515
 epoch: 17, train_loss: 1.1297, test_loss: 1.0648, test_f1: 0.4528
 epoch: 18, train_loss: 1.1292, test_loss: 1.0688, test_f1: 0.4389
 epoch: 19, train_loss: 1.1245, test_loss: 1.0433, test_f1: 0.4450
 epoch: 20, train_loss: 1.1133, test_loss: 1.0396, test_f1: 0.4530
 epoch: 21, train_loss: 1.1025, test_loss: 1.0348, test_f1: 0.4749
 epoch: 22, train_loss: 1.1001, test_loss: 1.0230, test_f1: 0.4847
 epoch: 23, train_loss: 1.0922, test_loss: 1.0164, test_f1: 0.4743
 epoch: 24, train_loss: 1.0840, test_loss: 1.0105, test_f1: 0.4734
 epoch: 25, train_loss: 1.0810, test_loss: 1.0028, test_f1: 0.4614
 epoch: 26, train_loss: 1.0736, test_loss: 0.9977, test_f1: 0.4712
 epoch: 27, train_loss: 1.0671, test_loss: 0.9830, test_f1: 0.4685
 epoch: 28, train_loss: 1.0586, test_loss: 0.9711, test_f1: 0.4778
 epoch: 29, train_loss: 1.0561, test_loss: 0.9850, test_f1: 0.4668
 epoch: 30, train_loss: 1.0577, test_loss: 0.9730, test_f1: 0.4827
 epoch: 31, train_loss: 1.0454, test_loss: 0.9688, test_f1: 0.4828
 epoch: 32, train_loss: 1.0442, test_loss: 0.9620, test_f1: 0.4808
 epoch: 33, train_loss: 1.0368, test_loss: 0.9552, test_f1: 0.4826
 epoch: 34, train_loss: 1.0331, test_loss: 0.9534, test_f1: 0.4966
 epoch: 35, train_loss: 1.0327, test_loss: 0.9603, test_f1: 0.4886
 epoch: 36, train_loss: 1.0260, test_loss: 0.9345, test_f1: 0.4872
 epoch: 37, train_loss: 1.0159, test_loss: 0.9314, test_f1: 0.4865
 epoch: 38, train_loss: 1.0237, test_loss: 0.9443, test_f1: 0.4899
 epoch: 39, train_loss: 1.0171, test_loss: 0.9417, test_f1: 0.4968
 epoch: 40, train_loss: 1.0058, test_loss: 0.9430, test_f1: 0.4773
 epoch: 41, train_loss: 1.0068, test_loss: 0.9309, test_f1: 0.4835
 epoch: 42, train_loss: 1.0095, test_loss: 0.9337, test_f1: 0.4864
 epoch: 43, train_loss: 0.9886, test_loss: 0.9274, test_f1: 0.4854
 epoch: 44, train_loss: 0.9969, test_loss: 0.9364, test_f1: 0.4876
 epoch: 45, train_loss: 1.0023, test_loss: 0.9295, test_f1: 0.5084
 epoch: 46, train_loss: 0.9841, test_loss: 0.9330, test_f1: 0.5010
 epoch: 47, train_loss: 0.9744, test_loss: 0.9259, test_f1: 0.5093
 epoch: 48, train_loss: 0.9883, test_loss: 0.9198, test_f1: 0.4890
 epoch: 49, train_loss: 0.9725, test_loss: 0.9211, test_f1: 0.4814
 epoch: 50, train_loss: 0.9711, test_loss: 0.9284, test_f1: 0.4832
 epoch: 51, train_loss: 0.9722, test_loss: 0.9200, test_f1: 0.4921
 epoch: 52, train_loss: 0.9664, test_loss: 0.9192, test_f1: 0.5042
 epoch: 53, train_loss: 0.9613, test_loss: 0.9275, test_f1: 0.5008
 epoch: 54, train_loss: 0.9654, test_loss: 0.9171, test_f1: 0.5045
 epoch: 55, train_loss: 0.9605, test_loss: 0.9234, test_f1: 0.5053
 epoch: 56, train_loss: 0.9624, test_loss: 0.9322, test_f1: 0.5040
 epoch: 57, train_loss: 0.9613, test_loss: 0.9252, test_f1: 0.4963
 epoch: 58, train_loss: 0.9574, test_loss: 0.9170, test_f1: 0.5066
 epoch: 59, train_loss: 0.9550, test_loss: 0.9354, test_f1: 0.5044
 epoch: 60, train_loss: 0.9555, test_loss: 0.9227, test_f1: 0.5069
 epoch: 61, train_loss: 0.9549, test_loss: 0.9289, test_f1: 0.5118
 epoch: 62, train_loss: 0.9590, test_loss: 0.9266, test_f1: 0.4963
 epoch: 63, train_loss: 0.9603, test_loss: 0.9238, test_f1: 0.5134
 epoch: 64, train_loss: 0.9526, test_loss: 0.9242, test_f1: 0.5126
 epoch: 65, train_loss: 0.9437, test_loss: 0.9224, test_f1: 0.5087
 epoch: 66, train_loss: 0.9399, test_loss: 0.9350, test_f1: 0.4976
 epoch: 67, train_loss: 0.9548, test_loss: 0.9240, test_f1: 0.4891
 epoch: 68, train_loss: 0.9460, test_loss: 0.9229, test_f1: 0.5039
 epoch: 69, train_loss: 0.9465, test_loss: 0.9328, test_f1: 0.5038
 epoch: 70, train_loss: 0.9463, test_loss: 0.9250, test_f1: 0.5051
 epoch: 71, train_loss: 0.9453, test_loss: 0.9214, test_f1: 0.4903
 epoch: 72, train_loss: 0.9358, test_loss: 0.9226, test_f1: 0.4918
 epoch: 73, train_loss: 0.9377, test_loss: 0.9285, test_f1: 0.5098
 epoch: 74, train_loss: 0.9490, test_loss: 0.9374, test_f1: 0.4910
 epoch: 75, train_loss: 0.9446, test_loss: 0.9131, test_f1: 0.4984
 epoch: 76, train_loss: 0.9377, test_loss: 0.9126, test_f1: 0.4959
 epoch: 77, train_loss: 0.9381, test_loss: 0.9325, test_f1: 0.4887
 epoch: 78, train_loss: 0.9356, test_loss: 0.9252, test_f1: 0.4979
 epoch: 79, train_loss: 0.9435, test_loss: 0.9286, test_f1: 0.4902
 epoch: 80, train_loss: 0.9309, test_loss: 0.9212, test_f1: 0.4869
 epoch: 81, train_loss: 0.9273, test_loss: 0.9233, test_f1: 0.4931
 epoch: 82, train_loss: 0.9347, test_loss: 0.9247, test_f1: 0.4974
 epoch: 83, train_loss: 0.9307, test_loss: 0.9260, test_f1: 0.4916
 epoch: 84, train_loss: 0.9205, test_loss: 0.9375, test_f1: 0.4840
 epoch: 85, train_loss: 0.9331, test_loss: 0.9276, test_f1: 0.4940
 epoch: 86, train_loss: 0.9295, test_loss: 0.9386, test_f1: 0.4919
 epoch: 87, train_loss: 0.9244, test_loss: 0.9310, test_f1: 0.4996
 epoch: 88, train_loss: 0.9205, test_loss: 0.9501, test_f1: 0.4770
 epoch: 89, train_loss: 0.9247, test_loss: 0.9533, test_f1: 0.4885
 epoch: 90, train_loss: 0.9361, test_loss: 0.9329, test_f1: 0.5098
 epoch: 91, train_loss: 0.9254, test_loss: 0.9457, test_f1: 0.4869
 epoch: 92, train_loss: 0.9214, test_loss: 0.9364, test_f1: 0.4822
 epoch: 93, train_loss: 0.9218, test_loss: 0.9431, test_f1: 0.4833
 epoch: 94, train_loss: 0.9162, test_loss: 0.9364, test_f1: 0.4934
 epoch: 95, train_loss: 0.9305, test_loss: 0.9425, test_f1: 0.4875
 epoch: 96, train_loss: 0.9236, test_loss: 0.9226, test_f1: 0.5062
 epoch: 97, train_loss: 0.9147, test_loss: 0.9489, test_f1: 0.4905
 epoch: 98, train_loss: 0.9185, test_loss: 0.9383, test_f1: 0.4982
 epoch: 99, train_loss: 0.9276, test_loss: 0.9347, test_f1: 0.4925
##################ITERATION #5 ****************************************
 epoch: 0, train_loss: 1.6003, test_loss: 1.4084, test_f1: 0.1631
 epoch: 1, train_loss: 1.3698, test_loss: 1.3215, test_f1: 0.2658
 epoch: 2, train_loss: 1.3224, test_loss: 1.2734, test_f1: 0.3002
 epoch: 3, train_loss: 1.2873, test_loss: 1.2493, test_f1: 0.3047
 epoch: 4, train_loss: 1.2694, test_loss: 1.2213, test_f1: 0.3331
 epoch: 5, train_loss: 1.2452, test_loss: 1.2028, test_f1: 0.3410
 epoch: 6, train_loss: 1.2358, test_loss: 1.1873, test_f1: 0.3555
 epoch: 7, train_loss: 1.2219, test_loss: 1.1802, test_f1: 0.3784
 epoch: 8, train_loss: 1.2203, test_loss: 1.1628, test_f1: 0.3737
 epoch: 9, train_loss: 1.1978, test_loss: 1.1472, test_f1: 0.4061
 epoch: 10, train_loss: 1.1929, test_loss: 1.1342, test_f1: 0.4020
 epoch: 11, train_loss: 1.1849, test_loss: 1.1222, test_f1: 0.4169
 epoch: 12, train_loss: 1.1698, test_loss: 1.1039, test_f1: 0.4213
 epoch: 13, train_loss: 1.1591, test_loss: 1.0870, test_f1: 0.4310
 epoch: 14, train_loss: 1.1433, test_loss: 1.0787, test_f1: 0.4271
 epoch: 15, train_loss: 1.1465, test_loss: 1.0634, test_f1: 0.4301
 epoch: 16, train_loss: 1.1337, test_loss: 1.0561, test_f1: 0.4387
 epoch: 17, train_loss: 1.1248, test_loss: 1.0382, test_f1: 0.4518
 epoch: 18, train_loss: 1.1138, test_loss: 1.0447, test_f1: 0.4672
 epoch: 19, train_loss: 1.1007, test_loss: 1.0104, test_f1: 0.4698
 epoch: 20, train_loss: 1.0887, test_loss: 1.0097, test_f1: 0.4603
 epoch: 21, train_loss: 1.0879, test_loss: 1.0294, test_f1: 0.4437
 epoch: 22, train_loss: 1.0825, test_loss: 1.0287, test_f1: 0.4580
 epoch: 23, train_loss: 1.0651, test_loss: 1.0023, test_f1: 0.4517
 epoch: 24, train_loss: 1.0622, test_loss: 0.9977, test_f1: 0.4598
 epoch: 25, train_loss: 1.0632, test_loss: 1.0087, test_f1: 0.4337
 epoch: 26, train_loss: 1.0607, test_loss: 1.0070, test_f1: 0.4309
 epoch: 27, train_loss: 1.0400, test_loss: 1.0082, test_f1: 0.4487
 epoch: 28, train_loss: 1.0387, test_loss: 0.9978, test_f1: 0.4570
 epoch: 29, train_loss: 1.0353, test_loss: 0.9903, test_f1: 0.4417
 epoch: 30, train_loss: 1.0299, test_loss: 0.9737, test_f1: 0.4620
 epoch: 31, train_loss: 1.0299, test_loss: 1.0073, test_f1: 0.4338
 epoch: 32, train_loss: 1.0200, test_loss: 0.9956, test_f1: 0.4511
 epoch: 33, train_loss: 1.0163, test_loss: 0.9859, test_f1: 0.4558
 epoch: 34, train_loss: 1.0103, test_loss: 0.9684, test_f1: 0.4569
 epoch: 35, train_loss: 1.0159, test_loss: 0.9679, test_f1: 0.4565
 epoch: 36, train_loss: 1.0021, test_loss: 0.9810, test_f1: 0.4480
 epoch: 37, train_loss: 0.9980, test_loss: 1.0091, test_f1: 0.4402
 epoch: 38, train_loss: 0.9860, test_loss: 0.9763, test_f1: 0.4467
 epoch: 39, train_loss: 0.9841, test_loss: 0.9743, test_f1: 0.4694
 epoch: 40, train_loss: 0.9816, test_loss: 0.9905, test_f1: 0.4550
 epoch: 41, train_loss: 0.9737, test_loss: 0.9769, test_f1: 0.4617
 epoch: 42, train_loss: 0.9827, test_loss: 0.9866, test_f1: 0.4529
 epoch: 43, train_loss: 0.9771, test_loss: 0.9755, test_f1: 0.4857
 epoch: 44, train_loss: 0.9662, test_loss: 0.9758, test_f1: 0.4743
 epoch: 45, train_loss: 0.9624, test_loss: 1.0082, test_f1: 0.4652
 epoch: 46, train_loss: 0.9555, test_loss: 0.9729, test_f1: 0.4905
 epoch: 47, train_loss: 0.9579, test_loss: 0.9688, test_f1: 0.4713
 epoch: 48, train_loss: 0.9611, test_loss: 1.0288, test_f1: 0.4600
 epoch: 49, train_loss: 0.9438, test_loss: 0.9899, test_f1: 0.4806
 epoch: 50, train_loss: 0.9432, test_loss: 0.9904, test_f1: 0.4920
 epoch: 51, train_loss: 0.9440, test_loss: 1.0142, test_f1: 0.4700
 epoch: 52, train_loss: 0.9478, test_loss: 0.9859, test_f1: 0.4865
 epoch: 53, train_loss: 0.9328, test_loss: 1.0071, test_f1: 0.4655
 epoch: 54, train_loss: 0.9352, test_loss: 1.0098, test_f1: 0.4724
 epoch: 55, train_loss: 0.9392, test_loss: 1.0102, test_f1: 0.4871
 epoch: 56, train_loss: 0.9437, test_loss: 1.0394, test_f1: 0.4544
 epoch: 57, train_loss: 0.9259, test_loss: 1.0047, test_f1: 0.4782
 epoch: 58, train_loss: 0.9258, test_loss: 1.0291, test_f1: 0.4550
 epoch: 59, train_loss: 0.9253, test_loss: 1.0046, test_f1: 0.4506
 epoch: 60, train_loss: 0.9268, test_loss: 0.9985, test_f1: 0.4880
 epoch: 61, train_loss: 0.9235, test_loss: 1.0015, test_f1: 0.4987
 epoch: 62, train_loss: 0.9332, test_loss: 0.9982, test_f1: 0.4944
 epoch: 63, train_loss: 0.9182, test_loss: 1.0003, test_f1: 0.4759
 epoch: 64, train_loss: 0.9236, test_loss: 1.0210, test_f1: 0.4675
 epoch: 65, train_loss: 0.9262, test_loss: 1.0099, test_f1: 0.4790
 epoch: 66, train_loss: 0.9170, test_loss: 0.9955, test_f1: 0.4828
 epoch: 67, train_loss: 0.9063, test_loss: 1.0170, test_f1: 0.4732
 epoch: 68, train_loss: 0.9169, test_loss: 1.0728, test_f1: 0.4659
 epoch: 69, train_loss: 0.9166, test_loss: 1.0330, test_f1: 0.4667
 epoch: 70, train_loss: 0.9113, test_loss: 0.9995, test_f1: 0.4981
 epoch: 71, train_loss: 0.9019, test_loss: 1.0039, test_f1: 0.4779
 epoch: 72, train_loss: 0.9089, test_loss: 1.0061, test_f1: 0.4887
 epoch: 73, train_loss: 0.9099, test_loss: 0.9812, test_f1: 0.4939
 epoch: 74, train_loss: 0.9122, test_loss: 1.0003, test_f1: 0.4924
 epoch: 75, train_loss: 0.9019, test_loss: 0.9994, test_f1: 0.5031
 epoch: 76, train_loss: 0.9088, test_loss: 1.0016, test_f1: 0.4983
 epoch: 77, train_loss: 0.9024, test_loss: 0.9977, test_f1: 0.4935
 epoch: 78, train_loss: 0.9069, test_loss: 1.0155, test_f1: 0.4992
 epoch: 79, train_loss: 0.8945, test_loss: 0.9974, test_f1: 0.5105
 epoch: 80, train_loss: 0.8941, test_loss: 1.0078, test_f1: 0.4956
 epoch: 81, train_loss: 0.8933, test_loss: 1.0010, test_f1: 0.4943
 epoch: 82, train_loss: 0.8904, test_loss: 1.0052, test_f1: 0.4984
 epoch: 83, train_loss: 0.8960, test_loss: 1.0133, test_f1: 0.4941
 epoch: 84, train_loss: 0.8968, test_loss: 0.9993, test_f1: 0.5063
 epoch: 85, train_loss: 0.8841, test_loss: 1.0143, test_f1: 0.4833
 epoch: 86, train_loss: 0.8923, test_loss: 1.0110, test_f1: 0.4958
 epoch: 87, train_loss: 0.8836, test_loss: 1.0251, test_f1: 0.4913
 epoch: 88, train_loss: 0.8877, test_loss: 1.0226, test_f1: 0.5047
 epoch: 89, train_loss: 0.8881, test_loss: 0.9976, test_f1: 0.5170
 epoch: 90, train_loss: 0.8855, test_loss: 1.0202, test_f1: 0.4987
 epoch: 91, train_loss: 0.8892, test_loss: 1.0230, test_f1: 0.4813
 epoch: 92, train_loss: 0.8811, test_loss: 1.0345, test_f1: 0.4883
 epoch: 93, train_loss: 0.8703, test_loss: 1.0198, test_f1: 0.5064
 epoch: 94, train_loss: 0.8797, test_loss: 1.0251, test_f1: 0.4911
 epoch: 95, train_loss: 0.8750, test_loss: 1.0189, test_f1: 0.5017
 epoch: 96, train_loss: 0.8823, test_loss: 1.0274, test_f1: 0.5166
 epoch: 97, train_loss: 0.8760, test_loss: 1.0211, test_f1: 0.4940
 epoch: 98, train_loss: 0.8747, test_loss: 1.0218, test_f1: 0.4926
 epoch: 99, train_loss: 0.8768, test_loss: 1.0038, test_f1: 0.5046
##################ITERATION #6 ****************************************
 epoch: 0, train_loss: 1.6116, test_loss: 1.3366, test_f1: 0.2274
 epoch: 1, train_loss: 1.3706, test_loss: 1.3388, test_f1: 0.2274
 epoch: 2, train_loss: 1.3104, test_loss: 1.3005, test_f1: 0.2467
 epoch: 3, train_loss: 1.2910, test_loss: 1.2529, test_f1: 0.2946
 epoch: 4, train_loss: 1.2876, test_loss: 1.2397, test_f1: 0.3262
 epoch: 5, train_loss: 1.2511, test_loss: 1.2206, test_f1: 0.3430
 epoch: 6, train_loss: 1.2398, test_loss: 1.2105, test_f1: 0.3634
 epoch: 7, train_loss: 1.2341, test_loss: 1.1961, test_f1: 0.3795
 epoch: 8, train_loss: 1.2096, test_loss: 1.1775, test_f1: 0.3847
 epoch: 9, train_loss: 1.2143, test_loss: 1.1669, test_f1: 0.3980
 epoch: 10, train_loss: 1.2011, test_loss: 1.1611, test_f1: 0.4160
 epoch: 11, train_loss: 1.1822, test_loss: 1.1546, test_f1: 0.3887
 epoch: 12, train_loss: 1.1846, test_loss: 1.1489, test_f1: 0.3870
 epoch: 13, train_loss: 1.1614, test_loss: 1.1381, test_f1: 0.4015
 epoch: 14, train_loss: 1.1690, test_loss: 1.1271, test_f1: 0.4253
 epoch: 15, train_loss: 1.1474, test_loss: 1.1065, test_f1: 0.4267
 epoch: 16, train_loss: 1.1328, test_loss: 1.1070, test_f1: 0.4218
 epoch: 17, train_loss: 1.1417, test_loss: 1.0851, test_f1: 0.4369
 epoch: 18, train_loss: 1.1181, test_loss: 1.0876, test_f1: 0.4364
 epoch: 19, train_loss: 1.1195, test_loss: 1.0997, test_f1: 0.4317
 epoch: 20, train_loss: 1.1138, test_loss: 1.0861, test_f1: 0.4268
 epoch: 21, train_loss: 1.0978, test_loss: 1.0952, test_f1: 0.4421
 epoch: 22, train_loss: 1.0975, test_loss: 1.0941, test_f1: 0.4415
 epoch: 23, train_loss: 1.0984, test_loss: 1.0755, test_f1: 0.4495
 epoch: 24, train_loss: 1.0793, test_loss: 1.0833, test_f1: 0.4511
 epoch: 25, train_loss: 1.0890, test_loss: 1.0888, test_f1: 0.4277
 epoch: 26, train_loss: 1.0795, test_loss: 1.0939, test_f1: 0.4260
 epoch: 27, train_loss: 1.0698, test_loss: 1.0645, test_f1: 0.4549
 epoch: 28, train_loss: 1.0681, test_loss: 1.0815, test_f1: 0.4181
 epoch: 29, train_loss: 1.0593, test_loss: 1.0785, test_f1: 0.4335
 epoch: 30, train_loss: 1.0530, test_loss: 1.0960, test_f1: 0.4266
 epoch: 31, train_loss: 1.0415, test_loss: 1.0586, test_f1: 0.4345
 epoch: 32, train_loss: 1.0396, test_loss: 1.0790, test_f1: 0.4435
 epoch: 33, train_loss: 1.0445, test_loss: 1.0401, test_f1: 0.4441
 epoch: 34, train_loss: 1.0335, test_loss: 1.0443, test_f1: 0.4537
 epoch: 35, train_loss: 1.0277, test_loss: 1.0680, test_f1: 0.4476
 epoch: 36, train_loss: 1.0230, test_loss: 1.0464, test_f1: 0.4555
 epoch: 37, train_loss: 1.0262, test_loss: 1.0733, test_f1: 0.4476
 epoch: 38, train_loss: 1.0079, test_loss: 1.0663, test_f1: 0.4610
 epoch: 39, train_loss: 1.0105, test_loss: 1.0688, test_f1: 0.4603
 epoch: 40, train_loss: 1.0092, test_loss: 1.0561, test_f1: 0.4785
 epoch: 41, train_loss: 1.0129, test_loss: 1.1003, test_f1: 0.4461
 epoch: 42, train_loss: 0.9805, test_loss: 1.0633, test_f1: 0.4624
 epoch: 43, train_loss: 1.0059, test_loss: 1.0717, test_f1: 0.4382
 epoch: 44, train_loss: 0.9878, test_loss: 1.0827, test_f1: 0.4528
 epoch: 45, train_loss: 0.9828, test_loss: 1.0632, test_f1: 0.4585
 epoch: 46, train_loss: 0.9754, test_loss: 1.0471, test_f1: 0.4813
 epoch: 47, train_loss: 0.9718, test_loss: 1.0637, test_f1: 0.4575
 epoch: 48, train_loss: 0.9564, test_loss: 1.0711, test_f1: 0.4673
 epoch: 49, train_loss: 0.9707, test_loss: 1.1199, test_f1: 0.4481
 epoch: 50, train_loss: 0.9670, test_loss: 1.0544, test_f1: 0.4823
 epoch: 51, train_loss: 0.9479, test_loss: 1.0842, test_f1: 0.4628
 epoch: 52, train_loss: 0.9544, test_loss: 1.0707, test_f1: 0.4800
 epoch: 53, train_loss: 0.9400, test_loss: 1.0851, test_f1: 0.4660
 epoch: 54, train_loss: 0.9519, test_loss: 1.0667, test_f1: 0.4837
 epoch: 55, train_loss: 0.9489, test_loss: 1.0825, test_f1: 0.4640
 epoch: 56, train_loss: 0.9473, test_loss: 1.0692, test_f1: 0.4924
 epoch: 57, train_loss: 0.9446, test_loss: 1.0787, test_f1: 0.4736
 epoch: 58, train_loss: 0.9457, test_loss: 1.1000, test_f1: 0.4793
 epoch: 59, train_loss: 0.9378, test_loss: 1.1423, test_f1: 0.4464
 epoch: 60, train_loss: 0.9422, test_loss: 1.0830, test_f1: 0.4855
 epoch: 61, train_loss: 0.9285, test_loss: 1.0904, test_f1: 0.4582
 epoch: 62, train_loss: 0.9211, test_loss: 1.0860, test_f1: 0.4755
 epoch: 63, train_loss: 0.9214, test_loss: 1.0936, test_f1: 0.4777
 epoch: 64, train_loss: 0.9275, test_loss: 1.0761, test_f1: 0.4797
 epoch: 65, train_loss: 0.9214, test_loss: 1.0734, test_f1: 0.4812
 epoch: 66, train_loss: 0.9222, test_loss: 1.1037, test_f1: 0.4713
 epoch: 67, train_loss: 0.9292, test_loss: 1.0757, test_f1: 0.4860
 epoch: 68, train_loss: 0.9201, test_loss: 1.0827, test_f1: 0.4918
 epoch: 69, train_loss: 0.9179, test_loss: 1.0811, test_f1: 0.4801
 epoch: 70, train_loss: 0.9112, test_loss: 1.0886, test_f1: 0.4765
 epoch: 71, train_loss: 0.9136, test_loss: 1.0884, test_f1: 0.4830
 epoch: 72, train_loss: 0.9168, test_loss: 1.0870, test_f1: 0.4808
 epoch: 73, train_loss: 0.9099, test_loss: 1.0915, test_f1: 0.4814
 epoch: 74, train_loss: 0.8955, test_loss: 1.0824, test_f1: 0.4891
 epoch: 75, train_loss: 0.9133, test_loss: 1.0774, test_f1: 0.4848
 epoch: 76, train_loss: 0.9097, test_loss: 1.0771, test_f1: 0.4847
 epoch: 77, train_loss: 0.8940, test_loss: 1.0966, test_f1: 0.4721
 epoch: 78, train_loss: 0.9078, test_loss: 1.0823, test_f1: 0.4916
 epoch: 79, train_loss: 0.9059, test_loss: 1.1093, test_f1: 0.4634
 epoch: 80, train_loss: 0.8986, test_loss: 1.0857, test_f1: 0.4853
 epoch: 81, train_loss: 0.9019, test_loss: 1.0939, test_f1: 0.4823
 epoch: 82, train_loss: 0.8956, test_loss: 1.1317, test_f1: 0.4536
 epoch: 83, train_loss: 0.8996, test_loss: 1.0784, test_f1: 0.4852
 epoch: 84, train_loss: 0.8936, test_loss: 1.1654, test_f1: 0.4522
 epoch: 85, train_loss: 0.8943, test_loss: 1.0901, test_f1: 0.4827
 epoch: 86, train_loss: 0.8929, test_loss: 1.1060, test_f1: 0.4762
 epoch: 87, train_loss: 0.8857, test_loss: 1.0815, test_f1: 0.4822
 epoch: 88, train_loss: 0.8821, test_loss: 1.1001, test_f1: 0.4651
 epoch: 89, train_loss: 0.8867, test_loss: 1.0880, test_f1: 0.4905
 epoch: 90, train_loss: 0.8901, test_loss: 1.0863, test_f1: 0.4886
 epoch: 91, train_loss: 0.8771, test_loss: 1.1044, test_f1: 0.4759
 epoch: 92, train_loss: 0.8924, test_loss: 1.1071, test_f1: 0.4848
 epoch: 93, train_loss: 0.8829, test_loss: 1.1065, test_f1: 0.4826
 epoch: 94, train_loss: 0.8868, test_loss: 1.1144, test_f1: 0.4789
 epoch: 95, train_loss: 0.8970, test_loss: 1.0892, test_f1: 0.4913
 epoch: 96, train_loss: 0.8752, test_loss: 1.1096, test_f1: 0.4798
 epoch: 97, train_loss: 0.8639, test_loss: 1.0930, test_f1: 0.4829
 epoch: 98, train_loss: 0.8802, test_loss: 1.1356, test_f1: 0.4638
 epoch: 99, train_loss: 0.8753, test_loss: 1.0892, test_f1: 0.4873
##################ITERATION #7 ****************************************
 epoch: 0, train_loss: 1.4931, test_loss: 1.3523, test_f1: 0.2274
 epoch: 1, train_loss: 1.3104, test_loss: 1.2999, test_f1: 0.2879
 epoch: 2, train_loss: 1.2785, test_loss: 1.2426, test_f1: 0.3143
 epoch: 3, train_loss: 1.2448, test_loss: 1.1989, test_f1: 0.3697
 epoch: 4, train_loss: 1.2066, test_loss: 1.1746, test_f1: 0.4072
 epoch: 5, train_loss: 1.1917, test_loss: 1.1422, test_f1: 0.4456
 epoch: 6, train_loss: 1.1818, test_loss: 1.1287, test_f1: 0.4531
 epoch: 7, train_loss: 1.1742, test_loss: 1.1180, test_f1: 0.4542
 epoch: 8, train_loss: 1.1634, test_loss: 1.1044, test_f1: 0.4516
 epoch: 9, train_loss: 1.1466, test_loss: 1.0958, test_f1: 0.4521
 epoch: 10, train_loss: 1.1596, test_loss: 1.0953, test_f1: 0.4522
 epoch: 11, train_loss: 1.1290, test_loss: 1.0851, test_f1: 0.4501
 epoch: 12, train_loss: 1.1361, test_loss: 1.0806, test_f1: 0.4571
 epoch: 13, train_loss: 1.1231, test_loss: 1.0740, test_f1: 0.4571
 epoch: 14, train_loss: 1.1248, test_loss: 1.0713, test_f1: 0.4629
 epoch: 15, train_loss: 1.1189, test_loss: 1.0635, test_f1: 0.4516
 epoch: 16, train_loss: 1.1124, test_loss: 1.0579, test_f1: 0.4594
 epoch: 17, train_loss: 1.1103, test_loss: 1.0553, test_f1: 0.4610
 epoch: 18, train_loss: 1.0980, test_loss: 1.0509, test_f1: 0.4437
 epoch: 19, train_loss: 1.0922, test_loss: 1.0429, test_f1: 0.4356
 epoch: 20, train_loss: 1.0905, test_loss: 1.0413, test_f1: 0.4303
 epoch: 21, train_loss: 1.0867, test_loss: 1.0344, test_f1: 0.4404
 epoch: 22, train_loss: 1.0795, test_loss: 1.0281, test_f1: 0.4377
 epoch: 23, train_loss: 1.0745, test_loss: 1.0385, test_f1: 0.4258
 epoch: 24, train_loss: 1.0701, test_loss: 1.0344, test_f1: 0.4309
 epoch: 25, train_loss: 1.0620, test_loss: 1.0297, test_f1: 0.4282
 epoch: 26, train_loss: 1.0482, test_loss: 1.0209, test_f1: 0.4405
 epoch: 27, train_loss: 1.0426, test_loss: 1.0198, test_f1: 0.4333
 epoch: 28, train_loss: 1.0483, test_loss: 1.0223, test_f1: 0.4284
 epoch: 29, train_loss: 1.0411, test_loss: 1.0136, test_f1: 0.4360
 epoch: 30, train_loss: 1.0302, test_loss: 1.0264, test_f1: 0.4423
 epoch: 31, train_loss: 1.0284, test_loss: 1.0154, test_f1: 0.4402
 epoch: 32, train_loss: 1.0241, test_loss: 1.0234, test_f1: 0.4312
 epoch: 33, train_loss: 1.0230, test_loss: 0.9921, test_f1: 0.4622
 epoch: 34, train_loss: 1.0191, test_loss: 1.0011, test_f1: 0.4537
 epoch: 35, train_loss: 1.0162, test_loss: 0.9867, test_f1: 0.4588
 epoch: 36, train_loss: 1.0028, test_loss: 1.0009, test_f1: 0.4470
 epoch: 37, train_loss: 1.0049, test_loss: 0.9908, test_f1: 0.4530
 epoch: 38, train_loss: 0.9922, test_loss: 1.0319, test_f1: 0.4485
 epoch: 39, train_loss: 1.0045, test_loss: 1.0028, test_f1: 0.4579
 epoch: 40, train_loss: 0.9931, test_loss: 1.0018, test_f1: 0.4659
 epoch: 41, train_loss: 0.9893, test_loss: 1.0025, test_f1: 0.4657
 epoch: 42, train_loss: 0.9865, test_loss: 1.0046, test_f1: 0.4845
 epoch: 43, train_loss: 0.9745, test_loss: 0.9996, test_f1: 0.4726
 epoch: 44, train_loss: 0.9743, test_loss: 0.9863, test_f1: 0.4749
 epoch: 45, train_loss: 0.9816, test_loss: 1.0131, test_f1: 0.4640
 epoch: 46, train_loss: 0.9728, test_loss: 1.0094, test_f1: 0.4705
 epoch: 47, train_loss: 0.9669, test_loss: 1.0059, test_f1: 0.4849
 epoch: 48, train_loss: 0.9730, test_loss: 0.9912, test_f1: 0.4927
 epoch: 49, train_loss: 0.9586, test_loss: 1.0125, test_f1: 0.4601
 epoch: 50, train_loss: 0.9578, test_loss: 1.0064, test_f1: 0.4768
 epoch: 51, train_loss: 0.9553, test_loss: 1.0064, test_f1: 0.4929
 epoch: 52, train_loss: 0.9484, test_loss: 0.9949, test_f1: 0.4768
 epoch: 53, train_loss: 0.9431, test_loss: 1.0158, test_f1: 0.4787
 epoch: 54, train_loss: 0.9382, test_loss: 1.0060, test_f1: 0.4691
 epoch: 55, train_loss: 0.9405, test_loss: 1.0087, test_f1: 0.4639
 epoch: 56, train_loss: 0.9438, test_loss: 1.0196, test_f1: 0.4644
 epoch: 57, train_loss: 0.9441, test_loss: 1.0137, test_f1: 0.4775
 epoch: 58, train_loss: 0.9314, test_loss: 0.9922, test_f1: 0.4917
 epoch: 59, train_loss: 0.9391, test_loss: 1.0038, test_f1: 0.4745
 epoch: 60, train_loss: 0.9377, test_loss: 1.0010, test_f1: 0.4737
 epoch: 61, train_loss: 0.9325, test_loss: 1.0150, test_f1: 0.4910
 epoch: 62, train_loss: 0.9313, test_loss: 1.0180, test_f1: 0.4677
 epoch: 63, train_loss: 0.9285, test_loss: 1.0101, test_f1: 0.4719
 epoch: 64, train_loss: 0.9300, test_loss: 1.0230, test_f1: 0.4757
 epoch: 65, train_loss: 0.9359, test_loss: 1.0198, test_f1: 0.4954
 epoch: 66, train_loss: 0.9320, test_loss: 1.0032, test_f1: 0.4804
 epoch: 67, train_loss: 0.9181, test_loss: 1.0165, test_f1: 0.4796
 epoch: 68, train_loss: 0.9320, test_loss: 1.0108, test_f1: 0.4750
 epoch: 69, train_loss: 0.9375, test_loss: 1.0121, test_f1: 0.4740
 epoch: 70, train_loss: 0.9161, test_loss: 1.0129, test_f1: 0.4843
 epoch: 71, train_loss: 0.9170, test_loss: 1.0327, test_f1: 0.4793
 epoch: 72, train_loss: 0.9152, test_loss: 1.0144, test_f1: 0.4696
 epoch: 73, train_loss: 0.9188, test_loss: 1.0185, test_f1: 0.4806
 epoch: 74, train_loss: 0.9225, test_loss: 1.0336, test_f1: 0.4744
 epoch: 75, train_loss: 0.9134, test_loss: 1.0177, test_f1: 0.4804
 epoch: 76, train_loss: 0.9116, test_loss: 1.0249, test_f1: 0.4765
 epoch: 77, train_loss: 0.8955, test_loss: 1.0414, test_f1: 0.4801
 epoch: 78, train_loss: 0.9123, test_loss: 1.0364, test_f1: 0.4811
 epoch: 79, train_loss: 0.9005, test_loss: 1.0417, test_f1: 0.4731
 epoch: 80, train_loss: 0.9195, test_loss: 1.0465, test_f1: 0.4574
 epoch: 81, train_loss: 0.9049, test_loss: 1.0160, test_f1: 0.4798
 epoch: 82, train_loss: 0.9077, test_loss: 1.0334, test_f1: 0.4662
 epoch: 83, train_loss: 0.9062, test_loss: 1.0605, test_f1: 0.4701
 epoch: 84, train_loss: 0.9104, test_loss: 1.0410, test_f1: 0.4651
 epoch: 85, train_loss: 0.8993, test_loss: 1.0738, test_f1: 0.4589
 epoch: 86, train_loss: 0.8937, test_loss: 1.0479, test_f1: 0.4713
 epoch: 87, train_loss: 0.8986, test_loss: 1.0384, test_f1: 0.4761
 epoch: 88, train_loss: 0.8950, test_loss: 1.0549, test_f1: 0.4770
 epoch: 89, train_loss: 0.8947, test_loss: 1.0559, test_f1: 0.4794
 epoch: 90, train_loss: 0.9029, test_loss: 1.0508, test_f1: 0.4718
 epoch: 91, train_loss: 0.9029, test_loss: 1.0232, test_f1: 0.4705
 epoch: 92, train_loss: 0.9009, test_loss: 1.0691, test_f1: 0.4796
 epoch: 93, train_loss: 0.8989, test_loss: 1.0789, test_f1: 0.4761
 epoch: 94, train_loss: 0.9016, test_loss: 1.0373, test_f1: 0.4729
 epoch: 95, train_loss: 0.8926, test_loss: 1.0555, test_f1: 0.4792
 epoch: 96, train_loss: 0.8883, test_loss: 1.0578, test_f1: 0.4857
 epoch: 97, train_loss: 0.8930, test_loss: 1.0373, test_f1: 0.4834
 epoch: 98, train_loss: 0.8877, test_loss: 1.0630, test_f1: 0.4783
 epoch: 99, train_loss: 0.8836, test_loss: 1.0529, test_f1: 0.4776
##################ITERATION #8 ****************************************
 epoch: 0, train_loss: 1.5758, test_loss: 1.3067, test_f1: 0.2274
 epoch: 1, train_loss: 1.3563, test_loss: 1.2815, test_f1: 0.2555
 epoch: 2, train_loss: 1.2942, test_loss: 1.2286, test_f1: 0.3076
 epoch: 3, train_loss: 1.2573, test_loss: 1.2017, test_f1: 0.3604
 epoch: 4, train_loss: 1.2217, test_loss: 1.1851, test_f1: 0.3661
 epoch: 5, train_loss: 1.2126, test_loss: 1.1718, test_f1: 0.3676
 epoch: 6, train_loss: 1.1996, test_loss: 1.1605, test_f1: 0.3800
 epoch: 7, train_loss: 1.1907, test_loss: 1.1576, test_f1: 0.3846
 epoch: 8, train_loss: 1.1840, test_loss: 1.1396, test_f1: 0.4064
 epoch: 9, train_loss: 1.1753, test_loss: 1.1323, test_f1: 0.3975
 epoch: 10, train_loss: 1.1694, test_loss: 1.1259, test_f1: 0.3933
 epoch: 11, train_loss: 1.1584, test_loss: 1.1285, test_f1: 0.3954
 epoch: 12, train_loss: 1.1528, test_loss: 1.1193, test_f1: 0.4068
 epoch: 13, train_loss: 1.1491, test_loss: 1.1054, test_f1: 0.4096
 epoch: 14, train_loss: 1.1388, test_loss: 1.1050, test_f1: 0.4000
 epoch: 15, train_loss: 1.1294, test_loss: 1.0946, test_f1: 0.4121
 epoch: 16, train_loss: 1.1341, test_loss: 1.0882, test_f1: 0.4091
 epoch: 17, train_loss: 1.1152, test_loss: 1.0868, test_f1: 0.4095
 epoch: 18, train_loss: 1.1088, test_loss: 1.0820, test_f1: 0.4204
 epoch: 19, train_loss: 1.0963, test_loss: 1.0665, test_f1: 0.4308
 epoch: 20, train_loss: 1.1014, test_loss: 1.0662, test_f1: 0.4140
 epoch: 21, train_loss: 1.0847, test_loss: 1.0585, test_f1: 0.4234
 epoch: 22, train_loss: 1.0874, test_loss: 1.0533, test_f1: 0.4134
 epoch: 23, train_loss: 1.0774, test_loss: 1.0394, test_f1: 0.4350
 epoch: 24, train_loss: 1.0734, test_loss: 1.0324, test_f1: 0.4498
 epoch: 25, train_loss: 1.0602, test_loss: 1.0350, test_f1: 0.4397
 epoch: 26, train_loss: 1.0628, test_loss: 1.0360, test_f1: 0.4303
 epoch: 27, train_loss: 1.0535, test_loss: 1.0243, test_f1: 0.4534
 epoch: 28, train_loss: 1.0485, test_loss: 1.0255, test_f1: 0.4407
 epoch: 29, train_loss: 1.0372, test_loss: 1.0182, test_f1: 0.4349
 epoch: 30, train_loss: 1.0339, test_loss: 1.0137, test_f1: 0.4340
 epoch: 31, train_loss: 1.0215, test_loss: 1.0071, test_f1: 0.4474
 epoch: 32, train_loss: 1.0144, test_loss: 1.0062, test_f1: 0.4435
 epoch: 33, train_loss: 1.0142, test_loss: 0.9973, test_f1: 0.4544
 epoch: 34, train_loss: 1.0152, test_loss: 0.9973, test_f1: 0.4528
 epoch: 35, train_loss: 1.0078, test_loss: 0.9846, test_f1: 0.4422
 epoch: 36, train_loss: 1.0113, test_loss: 0.9945, test_f1: 0.4456
 epoch: 37, train_loss: 0.9892, test_loss: 0.9962, test_f1: 0.4522
 epoch: 38, train_loss: 0.9942, test_loss: 0.9778, test_f1: 0.4518
 epoch: 39, train_loss: 0.9822, test_loss: 0.9876, test_f1: 0.4549
 epoch: 40, train_loss: 0.9818, test_loss: 0.9714, test_f1: 0.4572
 epoch: 41, train_loss: 0.9790, test_loss: 0.9724, test_f1: 0.4582
 epoch: 42, train_loss: 0.9783, test_loss: 0.9738, test_f1: 0.4555
 epoch: 43, train_loss: 0.9707, test_loss: 0.9857, test_f1: 0.4526
 epoch: 44, train_loss: 0.9747, test_loss: 0.9764, test_f1: 0.4624
 epoch: 45, train_loss: 0.9636, test_loss: 0.9750, test_f1: 0.4499
 epoch: 46, train_loss: 0.9611, test_loss: 0.9686, test_f1: 0.4540
 epoch: 47, train_loss: 0.9483, test_loss: 0.9805, test_f1: 0.4538
 epoch: 48, train_loss: 0.9489, test_loss: 0.9695, test_f1: 0.4557
 epoch: 49, train_loss: 0.9448, test_loss: 0.9775, test_f1: 0.4640
 epoch: 50, train_loss: 0.9415, test_loss: 0.9772, test_f1: 0.4516
 epoch: 51, train_loss: 0.9426, test_loss: 0.9597, test_f1: 0.4664
 epoch: 52, train_loss: 0.9420, test_loss: 0.9687, test_f1: 0.4735
 epoch: 53, train_loss: 0.9326, test_loss: 0.9773, test_f1: 0.4676
 epoch: 54, train_loss: 0.9308, test_loss: 0.9723, test_f1: 0.4690
 epoch: 55, train_loss: 0.9275, test_loss: 0.9756, test_f1: 0.4686
 epoch: 56, train_loss: 0.9304, test_loss: 0.9588, test_f1: 0.4743
 epoch: 57, train_loss: 0.9314, test_loss: 0.9786, test_f1: 0.4683
 epoch: 58, train_loss: 0.9219, test_loss: 0.9692, test_f1: 0.4785
 epoch: 59, train_loss: 0.9318, test_loss: 0.9790, test_f1: 0.4717
 epoch: 60, train_loss: 0.9180, test_loss: 0.9653, test_f1: 0.4796
 epoch: 61, train_loss: 0.9249, test_loss: 0.9647, test_f1: 0.4817
 epoch: 62, train_loss: 0.9226, test_loss: 0.9538, test_f1: 0.4854
 epoch: 63, train_loss: 0.9214, test_loss: 0.9730, test_f1: 0.4790
 epoch: 64, train_loss: 0.9142, test_loss: 0.9707, test_f1: 0.4671
 epoch: 65, train_loss: 0.9096, test_loss: 0.9691, test_f1: 0.4847
 epoch: 66, train_loss: 0.9159, test_loss: 0.9869, test_f1: 0.4738
 epoch: 67, train_loss: 0.9126, test_loss: 0.9687, test_f1: 0.5100
 epoch: 68, train_loss: 0.9103, test_loss: 0.9810, test_f1: 0.4718
 epoch: 69, train_loss: 0.9052, test_loss: 0.9726, test_f1: 0.4801
 epoch: 70, train_loss: 0.8972, test_loss: 0.9767, test_f1: 0.4741
 epoch: 71, train_loss: 0.9126, test_loss: 0.9750, test_f1: 0.4724
 epoch: 72, train_loss: 0.9024, test_loss: 0.9562, test_f1: 0.4848
 epoch: 73, train_loss: 0.9013, test_loss: 0.9625, test_f1: 0.4861
 epoch: 74, train_loss: 0.9013, test_loss: 0.9866, test_f1: 0.4990
 epoch: 75, train_loss: 0.9016, test_loss: 0.9799, test_f1: 0.4876
 epoch: 76, train_loss: 0.8997, test_loss: 0.9666, test_f1: 0.4810
 epoch: 77, train_loss: 0.8918, test_loss: 0.9752, test_f1: 0.4824
 epoch: 78, train_loss: 0.8988, test_loss: 0.9727, test_f1: 0.4900
 epoch: 79, train_loss: 0.8870, test_loss: 1.0030, test_f1: 0.4842
 epoch: 80, train_loss: 0.8927, test_loss: 1.0042, test_f1: 0.4660
 epoch: 81, train_loss: 0.9003, test_loss: 0.9687, test_f1: 0.4900
 epoch: 82, train_loss: 0.8979, test_loss: 0.9640, test_f1: 0.4913
 epoch: 83, train_loss: 0.8964, test_loss: 0.9850, test_f1: 0.4790
 epoch: 84, train_loss: 0.8857, test_loss: 0.9762, test_f1: 0.4822
 epoch: 85, train_loss: 0.8936, test_loss: 0.9739, test_f1: 0.4773
 epoch: 86, train_loss: 0.8835, test_loss: 0.9697, test_f1: 0.4966
 epoch: 87, train_loss: 0.8879, test_loss: 0.9600, test_f1: 0.4870
 epoch: 88, train_loss: 0.8878, test_loss: 0.9824, test_f1: 0.4734
 epoch: 89, train_loss: 0.8859, test_loss: 0.9854, test_f1: 0.4749
 epoch: 90, train_loss: 0.8719, test_loss: 0.9778, test_f1: 0.4937
 epoch: 91, train_loss: 0.8797, test_loss: 0.9855, test_f1: 0.4851
 epoch: 92, train_loss: 0.8790, test_loss: 0.9814, test_f1: 0.4845
 epoch: 93, train_loss: 0.8894, test_loss: 0.9852, test_f1: 0.4899
 epoch: 94, train_loss: 0.8791, test_loss: 0.9782, test_f1: 0.4846
 epoch: 95, train_loss: 0.8779, test_loss: 0.9857, test_f1: 0.4781
 epoch: 96, train_loss: 0.8755, test_loss: 0.9950, test_f1: 0.4942
 epoch: 97, train_loss: 0.8802, test_loss: 0.9916, test_f1: 0.4808
 epoch: 98, train_loss: 0.8748, test_loss: 0.9809, test_f1: 0.4827
 epoch: 99, train_loss: 0.8693, test_loss: 0.9931, test_f1: 0.4767
##################ITERATION #9 ****************************************
 epoch: 0, train_loss: 1.4060, test_loss: 1.3562, test_f1: 0.2274
 epoch: 1, train_loss: 1.2886, test_loss: 1.3001, test_f1: 0.2374
 epoch: 2, train_loss: 1.2595, test_loss: 1.2440, test_f1: 0.2577
 epoch: 3, train_loss: 1.2381, test_loss: 1.2181, test_f1: 0.3311
 epoch: 4, train_loss: 1.2123, test_loss: 1.1967, test_f1: 0.3457
 epoch: 5, train_loss: 1.2256, test_loss: 1.1780, test_f1: 0.3421
 epoch: 6, train_loss: 1.2117, test_loss: 1.1698, test_f1: 0.3495
 epoch: 7, train_loss: 1.1931, test_loss: 1.1611, test_f1: 0.3796
 epoch: 8, train_loss: 1.1893, test_loss: 1.1537, test_f1: 0.3683
 epoch: 9, train_loss: 1.1951, test_loss: 1.1448, test_f1: 0.3825
 epoch: 10, train_loss: 1.1743, test_loss: 1.1336, test_f1: 0.3818
 epoch: 11, train_loss: 1.1757, test_loss: 1.1223, test_f1: 0.4074
 epoch: 12, train_loss: 1.1668, test_loss: 1.1226, test_f1: 0.3797
 epoch: 13, train_loss: 1.1517, test_loss: 1.1219, test_f1: 0.3827
 epoch: 14, train_loss: 1.1430, test_loss: 1.1145, test_f1: 0.3969
 epoch: 15, train_loss: 1.1457, test_loss: 1.1035, test_f1: 0.4136
 epoch: 16, train_loss: 1.1439, test_loss: 1.0912, test_f1: 0.4076
 epoch: 17, train_loss: 1.1317, test_loss: 1.0887, test_f1: 0.4168
 epoch: 18, train_loss: 1.1302, test_loss: 1.0844, test_f1: 0.4028
 epoch: 19, train_loss: 1.1258, test_loss: 1.0771, test_f1: 0.4117
 epoch: 20, train_loss: 1.1104, test_loss: 1.0840, test_f1: 0.4308
 epoch: 21, train_loss: 1.1035, test_loss: 1.0761, test_f1: 0.4328
 epoch: 22, train_loss: 1.0960, test_loss: 1.0630, test_f1: 0.4308
 epoch: 23, train_loss: 1.1022, test_loss: 1.0806, test_f1: 0.4148
 epoch: 24, train_loss: 1.0861, test_loss: 1.0675, test_f1: 0.4273
 epoch: 25, train_loss: 1.0966, test_loss: 1.0641, test_f1: 0.4273
 epoch: 26, train_loss: 1.0825, test_loss: 1.0502, test_f1: 0.4500
 epoch: 27, train_loss: 1.0730, test_loss: 1.0668, test_f1: 0.4347
 epoch: 28, train_loss: 1.0690, test_loss: 1.0746, test_f1: 0.4160
 epoch: 29, train_loss: 1.0611, test_loss: 1.0714, test_f1: 0.4353
 epoch: 30, train_loss: 1.0644, test_loss: 1.0542, test_f1: 0.4437
 epoch: 31, train_loss: 1.0524, test_loss: 1.0393, test_f1: 0.4580
 epoch: 32, train_loss: 1.0540, test_loss: 1.0347, test_f1: 0.4547
 epoch: 33, train_loss: 1.0448, test_loss: 1.0349, test_f1: 0.4492
 epoch: 34, train_loss: 1.0388, test_loss: 1.0580, test_f1: 0.4513
 epoch: 35, train_loss: 1.0341, test_loss: 1.0435, test_f1: 0.4392
 epoch: 36, train_loss: 1.0313, test_loss: 1.0260, test_f1: 0.4557
 epoch: 37, train_loss: 1.0203, test_loss: 1.0358, test_f1: 0.4428
 epoch: 38, train_loss: 1.0157, test_loss: 1.0218, test_f1: 0.4608
 epoch: 39, train_loss: 1.0160, test_loss: 1.0357, test_f1: 0.4527
 epoch: 40, train_loss: 1.0153, test_loss: 1.0238, test_f1: 0.4360
 epoch: 41, train_loss: 1.0093, test_loss: 1.0269, test_f1: 0.4567
 epoch: 42, train_loss: 1.0156, test_loss: 1.0336, test_f1: 0.4619
 epoch: 43, train_loss: 1.0054, test_loss: 1.0465, test_f1: 0.4470
 epoch: 44, train_loss: 0.9931, test_loss: 1.0312, test_f1: 0.4849
 epoch: 45, train_loss: 0.9961, test_loss: 1.0266, test_f1: 0.4757
 epoch: 46, train_loss: 0.9983, test_loss: 1.0980, test_f1: 0.4329
 epoch: 47, train_loss: 0.9931, test_loss: 1.0311, test_f1: 0.4503
 epoch: 48, train_loss: 0.9781, test_loss: 1.0166, test_f1: 0.4600
 epoch: 49, train_loss: 0.9853, test_loss: 1.0309, test_f1: 0.4602
 epoch: 50, train_loss: 0.9820, test_loss: 1.0133, test_f1: 0.4763
 epoch: 51, train_loss: 0.9790, test_loss: 1.0134, test_f1: 0.4699
 epoch: 52, train_loss: 0.9771, test_loss: 1.0278, test_f1: 0.4634
 epoch: 53, train_loss: 0.9669, test_loss: 1.0248, test_f1: 0.4682
 epoch: 54, train_loss: 0.9635, test_loss: 1.0103, test_f1: 0.4942
 epoch: 55, train_loss: 0.9712, test_loss: 1.0194, test_f1: 0.4733
 epoch: 56, train_loss: 0.9640, test_loss: 1.0353, test_f1: 0.4533
 epoch: 57, train_loss: 0.9668, test_loss: 1.0307, test_f1: 0.4681
 epoch: 58, train_loss: 0.9593, test_loss: 1.0521, test_f1: 0.4619
 epoch: 59, train_loss: 0.9648, test_loss: 1.0165, test_f1: 0.4707
 epoch: 60, train_loss: 0.9586, test_loss: 1.0179, test_f1: 0.4668
 epoch: 61, train_loss: 0.9692, test_loss: 1.0304, test_f1: 0.4358
 epoch: 62, train_loss: 0.9575, test_loss: 1.0290, test_f1: 0.4639
 epoch: 63, train_loss: 0.9558, test_loss: 1.0338, test_f1: 0.4488
 epoch: 64, train_loss: 0.9561, test_loss: 1.0377, test_f1: 0.4411
 epoch: 65, train_loss: 0.9435, test_loss: 1.0597, test_f1: 0.4528
 epoch: 66, train_loss: 0.9531, test_loss: 1.0735, test_f1: 0.4435
 epoch: 67, train_loss: 0.9607, test_loss: 1.0289, test_f1: 0.4453
 epoch: 68, train_loss: 0.9523, test_loss: 1.0359, test_f1: 0.4506
 epoch: 69, train_loss: 0.9449, test_loss: 1.0400, test_f1: 0.4586
 epoch: 70, train_loss: 0.9546, test_loss: 1.0278, test_f1: 0.4499
 epoch: 71, train_loss: 0.9509, test_loss: 1.0258, test_f1: 0.4573
 epoch: 72, train_loss: 0.9404, test_loss: 1.0398, test_f1: 0.4489
 epoch: 73, train_loss: 0.9495, test_loss: 1.0487, test_f1: 0.4385
 epoch: 74, train_loss: 0.9435, test_loss: 1.0283, test_f1: 0.4496
 epoch: 75, train_loss: 0.9343, test_loss: 1.0446, test_f1: 0.4352
 epoch: 76, train_loss: 0.9379, test_loss: 1.0513, test_f1: 0.4406
 epoch: 77, train_loss: 0.9531, test_loss: 1.0114, test_f1: 0.4580
 epoch: 78, train_loss: 0.9460, test_loss: 1.0632, test_f1: 0.4425
 epoch: 79, train_loss: 0.9431, test_loss: 1.0365, test_f1: 0.4516
 epoch: 80, train_loss: 0.9336, test_loss: 1.0345, test_f1: 0.4436
 epoch: 81, train_loss: 0.9300, test_loss: 1.0486, test_f1: 0.4571
 epoch: 82, train_loss: 0.9410, test_loss: 1.0283, test_f1: 0.4720
 epoch: 83, train_loss: 0.9219, test_loss: 1.0417, test_f1: 0.4692
 epoch: 84, train_loss: 0.9160, test_loss: 1.0359, test_f1: 0.4604
 epoch: 85, train_loss: 0.9329, test_loss: 1.0366, test_f1: 0.4561
 epoch: 86, train_loss: 0.9366, test_loss: 1.0395, test_f1: 0.4745
 epoch: 87, train_loss: 0.9367, test_loss: 1.0289, test_f1: 0.4660
 epoch: 88, train_loss: 0.9380, test_loss: 1.0312, test_f1: 0.4604
 epoch: 89, train_loss: 0.9274, test_loss: 1.0304, test_f1: 0.4756
 epoch: 90, train_loss: 0.9267, test_loss: 1.0515, test_f1: 0.4570
 epoch: 91, train_loss: 0.9232, test_loss: 1.0166, test_f1: 0.4674
 epoch: 92, train_loss: 0.9231, test_loss: 1.0370, test_f1: 0.4754
 epoch: 93, train_loss: 0.9238, test_loss: 1.0395, test_f1: 0.4660
 epoch: 94, train_loss: 0.9143, test_loss: 1.0297, test_f1: 0.4739
 epoch: 95, train_loss: 0.9194, test_loss: 1.0537, test_f1: 0.4618
 epoch: 96, train_loss: 0.9200, test_loss: 1.0524, test_f1: 0.4693
 epoch: 97, train_loss: 0.9228, test_loss: 1.0364, test_f1: 0.4776
 epoch: 98, train_loss: 0.9131, test_loss: 1.0234, test_f1: 0.4684
 epoch: 99, train_loss: 0.9199, test_loss: 1.0212, test_f1: 0.4780

Training completed in 387.82 seconds
Best F1: 0.5262 at epoch 83
Mean F1 across iterations: 0.4981  0.0258
========================FINAL RESULTS================================
FEGIN weighted F1: 0.5262  0.0258
python main.py --data ltspice_examples --representation component_component --model FEGIN --layers 4 --hiddens 16 --batch_size 256 --lr 0.001 --emb_size 512 --epochs 100 --save_appendix component_component_L4_H16_BS256_LR0.001_E512 --no_val
-----



STDERR:
  File "main.py", line 370, in <module>
    main()
  File "main.py", line 254, in main
    dataset = dataset_class(
  File "/home/philip/projects/ltspice_examples_code_repo/Circuit-Completion-Using-GNNs/component_classification_with_link_prediction_head/evaluation/FEGIN/kernel/circuit_datasets.py", line 15, in __init__
    self.data, self.slices = torch.load(self.processed_paths[0])
  File "/home/philip/.local/lib/python3.8/site-packages/torch/serialization.py", line 1040, in load
    warnings.warn(
  File "/usr/lib/python3.8/warnings.py", line 109, in _showwarnmsg
    sw(msg.message, msg.category, msg.filename, msg.lineno,
  File "main.py", line 47, in warn_with_traceback
    traceback.print_stack(file=log)
/home/philip/projects/ltspice_examples_code_repo/Circuit-Completion-Using-GNNs/component_classification_with_link_prediction_head/evaluation/FEGIN/kernel/circuit_datasets.py:15: FutureWarning: You are using `torch.load` with `weights_only=False` (the current default value), which uses the default pickle module implicitly. It is possible to construct malicious pickle data which will execute arbitrary code during unpickling (See https://github.com/pytorch/pytorch/blob/main/SECURITY.md#untrusted-models for more details). In a future release, the default value for `weights_only` will be flipped to `True`. This limits the functions that could be executed during unpickling. Arbitrary objects will no longer be allowed to be loaded via this mode unless they are explicitly allowlisted by the user via `torch.serialization.add_safe_globals`. We recommend you start setting `weights_only=True` for any use case where you don't have full control of the loaded file. Please open an issue on GitHub for any issues related to this experimental feature.
  self.data, self.slices = torch.load(self.processed_paths[0])
