STDOUT:
Results will be saved in /home/philip/projects/ltspice_examples_code_repo/Circuit-Completion-Using-GNNs/component_classification_with_link_prediction_head/evaluation/FEGIN/results/model_FEGIN_dataset_ltspice_examples
Command line input: python main.py --data ltspice_examples --representation component_net --model FEGIN --layers 2 --hiddens 64 --batch_size 64 --lr 0.0001 --emb_size 128 --epochs 100 --save_appendix component_net_L2_H64_BS64_LR0.0001_E128 --no_val
 is saved.
-----
ltspice_examples - FEGIN
Using 2 layers, 64 hidden units, h = 2
Loading component_net representation dataset
ENTERED
Training FEGIN on component_net representation
Train: 3558, Test: 846
##################ITERATION #0 ****************************************
 epoch: 0, train_loss: 1.3604, test_loss: 1.3541, test_f1: 0.2270
 epoch: 1, train_loss: 1.3442, test_loss: 1.3421, test_f1: 0.2270
 epoch: 2, train_loss: 1.3303, test_loss: 1.3267, test_f1: 0.2270
 epoch: 3, train_loss: 1.3108, test_loss: 1.3026, test_f1: 0.2270
 epoch: 4, train_loss: 1.2851, test_loss: 1.2721, test_f1: 0.2271
 epoch: 5, train_loss: 1.2584, test_loss: 1.2466, test_f1: 0.2289
 epoch: 6, train_loss: 1.2361, test_loss: 1.2236, test_f1: 0.2677
 epoch: 7, train_loss: 1.2189, test_loss: 1.1998, test_f1: 0.3062
 epoch: 8, train_loss: 1.1944, test_loss: 1.1739, test_f1: 0.3538
 epoch: 9, train_loss: 1.1781, test_loss: 1.1469, test_f1: 0.3723
 epoch: 10, train_loss: 1.1544, test_loss: 1.1200, test_f1: 0.3954
 epoch: 11, train_loss: 1.1322, test_loss: 1.0914, test_f1: 0.4274
 epoch: 12, train_loss: 1.1066, test_loss: 1.0646, test_f1: 0.4438
 epoch: 13, train_loss: 1.0841, test_loss: 1.0410, test_f1: 0.4380
 epoch: 14, train_loss: 1.0623, test_loss: 1.0226, test_f1: 0.4403
 epoch: 15, train_loss: 1.0398, test_loss: 1.0086, test_f1: 0.4437
 epoch: 16, train_loss: 1.0244, test_loss: 0.9882, test_f1: 0.4610
 epoch: 17, train_loss: 1.0134, test_loss: 0.9749, test_f1: 0.4566
 epoch: 18, train_loss: 0.9976, test_loss: 0.9685, test_f1: 0.4684
 epoch: 19, train_loss: 0.9840, test_loss: 0.9570, test_f1: 0.4682
 epoch: 20, train_loss: 0.9761, test_loss: 0.9573, test_f1: 0.4697
 epoch: 21, train_loss: 0.9691, test_loss: 0.9536, test_f1: 0.4793
 epoch: 22, train_loss: 0.9604, test_loss: 0.9517, test_f1: 0.4773
 epoch: 23, train_loss: 0.9591, test_loss: 0.9488, test_f1: 0.4735
 epoch: 24, train_loss: 0.9480, test_loss: 0.9443, test_f1: 0.4843
 epoch: 25, train_loss: 0.9463, test_loss: 0.9324, test_f1: 0.4905
 epoch: 26, train_loss: 0.9414, test_loss: 0.9369, test_f1: 0.4938
 epoch: 27, train_loss: 0.9375, test_loss: 0.9432, test_f1: 0.4836
 epoch: 28, train_loss: 0.9299, test_loss: 0.9320, test_f1: 0.4997
 epoch: 29, train_loss: 0.9250, test_loss: 0.9369, test_f1: 0.4811
 epoch: 30, train_loss: 0.9252, test_loss: 0.9330, test_f1: 0.4877
 epoch: 31, train_loss: 0.9243, test_loss: 0.9338, test_f1: 0.4972
 epoch: 32, train_loss: 0.9205, test_loss: 0.9306, test_f1: 0.4860
 epoch: 33, train_loss: 0.9177, test_loss: 0.9237, test_f1: 0.4998
 epoch: 34, train_loss: 0.9178, test_loss: 0.9226, test_f1: 0.4987
 epoch: 35, train_loss: 0.9065, test_loss: 0.9158, test_f1: 0.5103
 epoch: 36, train_loss: 0.9133, test_loss: 0.9280, test_f1: 0.5025
 epoch: 37, train_loss: 0.9001, test_loss: 0.9234, test_f1: 0.4867
 epoch: 38, train_loss: 0.9012, test_loss: 0.9123, test_f1: 0.5074
 epoch: 39, train_loss: 0.8966, test_loss: 0.9083, test_f1: 0.5125
 epoch: 40, train_loss: 0.8914, test_loss: 0.9087, test_f1: 0.5263
 epoch: 41, train_loss: 0.8901, test_loss: 0.9209, test_f1: 0.4945
 epoch: 42, train_loss: 0.8838, test_loss: 0.8961, test_f1: 0.5262
 epoch: 43, train_loss: 0.8818, test_loss: 0.9083, test_f1: 0.5171
 epoch: 44, train_loss: 0.8761, test_loss: 0.9103, test_f1: 0.5110
 epoch: 45, train_loss: 0.8853, test_loss: 0.8989, test_f1: 0.5184
 epoch: 46, train_loss: 0.8822, test_loss: 0.8985, test_f1: 0.5200
 epoch: 47, train_loss: 0.8669, test_loss: 0.9050, test_f1: 0.5156
 epoch: 48, train_loss: 0.8727, test_loss: 0.9006, test_f1: 0.5127
 epoch: 49, train_loss: 0.8812, test_loss: 0.9169, test_f1: 0.5076
 epoch: 50, train_loss: 0.8702, test_loss: 0.9053, test_f1: 0.5135
 epoch: 51, train_loss: 0.8700, test_loss: 0.8837, test_f1: 0.5217
 epoch: 52, train_loss: 0.8557, test_loss: 0.8967, test_f1: 0.5139
 epoch: 53, train_loss: 0.8641, test_loss: 0.9018, test_f1: 0.5153
 epoch: 54, train_loss: 0.8631, test_loss: 0.8924, test_f1: 0.5119
 epoch: 55, train_loss: 0.8611, test_loss: 0.8814, test_f1: 0.5163
 epoch: 56, train_loss: 0.8585, test_loss: 0.8932, test_f1: 0.5181
 epoch: 57, train_loss: 0.8491, test_loss: 0.8955, test_f1: 0.5162
 epoch: 58, train_loss: 0.8591, test_loss: 0.9091, test_f1: 0.5125
 epoch: 59, train_loss: 0.8626, test_loss: 0.9148, test_f1: 0.5153
 epoch: 60, train_loss: 0.8575, test_loss: 0.8913, test_f1: 0.5143
 epoch: 61, train_loss: 0.8535, test_loss: 0.8921, test_f1: 0.5188
 epoch: 62, train_loss: 0.8484, test_loss: 0.8900, test_f1: 0.5235
 epoch: 63, train_loss: 0.8521, test_loss: 0.8901, test_f1: 0.5203
 epoch: 64, train_loss: 0.8585, test_loss: 0.8981, test_f1: 0.5224
 epoch: 65, train_loss: 0.8445, test_loss: 0.8929, test_f1: 0.5215
 epoch: 66, train_loss: 0.8427, test_loss: 0.8970, test_f1: 0.5213
 epoch: 67, train_loss: 0.8461, test_loss: 0.9044, test_f1: 0.5192
 epoch: 68, train_loss: 0.8490, test_loss: 0.9044, test_f1: 0.5138
 epoch: 69, train_loss: 0.8400, test_loss: 0.9116, test_f1: 0.5132
 epoch: 70, train_loss: 0.8413, test_loss: 0.8998, test_f1: 0.5196
 epoch: 71, train_loss: 0.8407, test_loss: 0.9050, test_f1: 0.5255
 epoch: 72, train_loss: 0.8417, test_loss: 0.8988, test_f1: 0.5232
 epoch: 73, train_loss: 0.8420, test_loss: 0.8876, test_f1: 0.5187
 epoch: 74, train_loss: 0.8433, test_loss: 0.8990, test_f1: 0.5271
 epoch: 75, train_loss: 0.8437, test_loss: 0.8980, test_f1: 0.5181
 epoch: 76, train_loss: 0.8387, test_loss: 0.9147, test_f1: 0.5177
 epoch: 77, train_loss: 0.8410, test_loss: 0.8960, test_f1: 0.5234
 epoch: 78, train_loss: 0.8362, test_loss: 0.9064, test_f1: 0.5228
 epoch: 79, train_loss: 0.8356, test_loss: 0.8946, test_f1: 0.5245
 epoch: 80, train_loss: 0.8312, test_loss: 0.8985, test_f1: 0.5224
 epoch: 81, train_loss: 0.8458, test_loss: 0.9076, test_f1: 0.5192
 epoch: 82, train_loss: 0.8268, test_loss: 0.9038, test_f1: 0.5213
 epoch: 83, train_loss: 0.8297, test_loss: 0.9263, test_f1: 0.5210
 epoch: 84, train_loss: 0.8322, test_loss: 0.9120, test_f1: 0.5202
 epoch: 85, train_loss: 0.8313, test_loss: 0.8932, test_f1: 0.5246
 epoch: 86, train_loss: 0.8292, test_loss: 0.9206, test_f1: 0.5213
 epoch: 87, train_loss: 0.8278, test_loss: 0.8931, test_f1: 0.5273
 epoch: 88, train_loss: 0.8241, test_loss: 0.9091, test_f1: 0.5267
 epoch: 89, train_loss: 0.8231, test_loss: 0.8988, test_f1: 0.5147
 epoch: 90, train_loss: 0.8247, test_loss: 0.9062, test_f1: 0.5225
 epoch: 91, train_loss: 0.8249, test_loss: 0.9115, test_f1: 0.5243
 epoch: 92, train_loss: 0.8317, test_loss: 0.9208, test_f1: 0.5223
 epoch: 93, train_loss: 0.8240, test_loss: 0.9061, test_f1: 0.5234
 epoch: 94, train_loss: 0.8245, test_loss: 0.9094, test_f1: 0.5267
 epoch: 95, train_loss: 0.8214, test_loss: 0.9108, test_f1: 0.5271
 epoch: 96, train_loss: 0.8177, test_loss: 0.9108, test_f1: 0.5153
 epoch: 97, train_loss: 0.8076, test_loss: 0.9161, test_f1: 0.5290
 epoch: 98, train_loss: 0.8136, test_loss: 0.9109, test_f1: 0.5263
 epoch: 99, train_loss: 0.8145, test_loss: 0.8930, test_f1: 0.5254
##################ITERATION #1 ****************************************
 epoch: 0, train_loss: 1.3087, test_loss: 1.2885, test_f1: 0.2270
 epoch: 1, train_loss: 1.2599, test_loss: 1.2366, test_f1: 0.2783
 epoch: 2, train_loss: 1.2362, test_loss: 1.2073, test_f1: 0.2909
 epoch: 3, train_loss: 1.2113, test_loss: 1.1759, test_f1: 0.3192
 epoch: 4, train_loss: 1.1839, test_loss: 1.1470, test_f1: 0.3561
 epoch: 5, train_loss: 1.1533, test_loss: 1.1160, test_f1: 0.3818
 epoch: 6, train_loss: 1.1270, test_loss: 1.0859, test_f1: 0.3774
 epoch: 7, train_loss: 1.0985, test_loss: 1.0533, test_f1: 0.3904
 epoch: 8, train_loss: 1.0689, test_loss: 1.0348, test_f1: 0.3998
 epoch: 9, train_loss: 1.0516, test_loss: 1.0157, test_f1: 0.4083
 epoch: 10, train_loss: 1.0343, test_loss: 1.0039, test_f1: 0.4435
 epoch: 11, train_loss: 1.0176, test_loss: 0.9929, test_f1: 0.4423
 epoch: 12, train_loss: 1.0072, test_loss: 0.9828, test_f1: 0.4574
 epoch: 13, train_loss: 0.9896, test_loss: 0.9721, test_f1: 0.4630
 epoch: 14, train_loss: 0.9843, test_loss: 0.9632, test_f1: 0.4607
 epoch: 15, train_loss: 0.9737, test_loss: 0.9552, test_f1: 0.4724
 epoch: 16, train_loss: 0.9740, test_loss: 0.9545, test_f1: 0.4730
 epoch: 17, train_loss: 0.9629, test_loss: 0.9452, test_f1: 0.4859
 epoch: 18, train_loss: 0.9559, test_loss: 0.9347, test_f1: 0.4994
 epoch: 19, train_loss: 0.9425, test_loss: 0.9357, test_f1: 0.5101
 epoch: 20, train_loss: 0.9389, test_loss: 0.9205, test_f1: 0.5123
 epoch: 21, train_loss: 0.9431, test_loss: 0.9203, test_f1: 0.5143
 epoch: 22, train_loss: 0.9249, test_loss: 0.9212, test_f1: 0.4974
 epoch: 23, train_loss: 0.9252, test_loss: 0.9127, test_f1: 0.5006
 epoch: 24, train_loss: 0.9192, test_loss: 0.9291, test_f1: 0.4999
 epoch: 25, train_loss: 0.9220, test_loss: 0.9099, test_f1: 0.5169
 epoch: 26, train_loss: 0.9119, test_loss: 0.9141, test_f1: 0.5029
 epoch: 27, train_loss: 0.9094, test_loss: 0.9269, test_f1: 0.5044
 epoch: 28, train_loss: 0.9037, test_loss: 0.9216, test_f1: 0.5303
 epoch: 29, train_loss: 0.9016, test_loss: 0.9013, test_f1: 0.5408
 epoch: 30, train_loss: 0.9001, test_loss: 0.9042, test_f1: 0.5232
 epoch: 31, train_loss: 0.8939, test_loss: 0.9145, test_f1: 0.5311
 epoch: 32, train_loss: 0.8987, test_loss: 0.9129, test_f1: 0.5178
 epoch: 33, train_loss: 0.8890, test_loss: 0.9160, test_f1: 0.5292
 epoch: 34, train_loss: 0.8927, test_loss: 0.9107, test_f1: 0.5146
 epoch: 35, train_loss: 0.8869, test_loss: 0.9101, test_f1: 0.5332
 epoch: 36, train_loss: 0.8821, test_loss: 0.9160, test_f1: 0.5313
 epoch: 37, train_loss: 0.8764, test_loss: 0.8971, test_f1: 0.5374
 epoch: 38, train_loss: 0.8763, test_loss: 0.8964, test_f1: 0.5308
 epoch: 39, train_loss: 0.8725, test_loss: 0.9083, test_f1: 0.5397
 epoch: 40, train_loss: 0.8606, test_loss: 0.9206, test_f1: 0.5190
 epoch: 41, train_loss: 0.8592, test_loss: 0.9048, test_f1: 0.5504
 epoch: 42, train_loss: 0.8680, test_loss: 0.9089, test_f1: 0.5390
 epoch: 43, train_loss: 0.8576, test_loss: 0.9138, test_f1: 0.5380
 epoch: 44, train_loss: 0.8584, test_loss: 0.9002, test_f1: 0.5552
 epoch: 45, train_loss: 0.8543, test_loss: 0.8998, test_f1: 0.5606
 epoch: 46, train_loss: 0.8580, test_loss: 0.9042, test_f1: 0.5354
 epoch: 47, train_loss: 0.8516, test_loss: 0.9143, test_f1: 0.5382
 epoch: 48, train_loss: 0.8544, test_loss: 0.9026, test_f1: 0.5369
 epoch: 49, train_loss: 0.8424, test_loss: 0.9199, test_f1: 0.5445
 epoch: 50, train_loss: 0.8346, test_loss: 0.9067, test_f1: 0.5542
 epoch: 51, train_loss: 0.8336, test_loss: 0.9089, test_f1: 0.5500
 epoch: 52, train_loss: 0.8407, test_loss: 0.9059, test_f1: 0.5658
 epoch: 53, train_loss: 0.8330, test_loss: 0.9075, test_f1: 0.5546
 epoch: 54, train_loss: 0.8341, test_loss: 0.9134, test_f1: 0.5469
 epoch: 55, train_loss: 0.8334, test_loss: 0.9171, test_f1: 0.5540
 epoch: 56, train_loss: 0.8265, test_loss: 0.9074, test_f1: 0.5702
 epoch: 57, train_loss: 0.8251, test_loss: 0.9083, test_f1: 0.5677
 epoch: 58, train_loss: 0.8335, test_loss: 0.9063, test_f1: 0.5620
 epoch: 59, train_loss: 0.8248, test_loss: 0.9079, test_f1: 0.5640
 epoch: 60, train_loss: 0.8233, test_loss: 0.9112, test_f1: 0.5514
 epoch: 61, train_loss: 0.8218, test_loss: 0.9130, test_f1: 0.5466
 epoch: 62, train_loss: 0.8201, test_loss: 0.9150, test_f1: 0.5532
 epoch: 63, train_loss: 0.8255, test_loss: 0.9120, test_f1: 0.5637
 epoch: 64, train_loss: 0.8156, test_loss: 0.9180, test_f1: 0.5554
 epoch: 65, train_loss: 0.8199, test_loss: 0.9106, test_f1: 0.5654
 epoch: 66, train_loss: 0.8172, test_loss: 0.9109, test_f1: 0.5658
 epoch: 67, train_loss: 0.8166, test_loss: 0.9142, test_f1: 0.5564
 epoch: 68, train_loss: 0.8179, test_loss: 0.9221, test_f1: 0.5522
 epoch: 69, train_loss: 0.8193, test_loss: 0.9142, test_f1: 0.5706
 epoch: 70, train_loss: 0.8097, test_loss: 0.9111, test_f1: 0.5647
 epoch: 71, train_loss: 0.8049, test_loss: 0.9165, test_f1: 0.5583
 epoch: 72, train_loss: 0.8057, test_loss: 0.9138, test_f1: 0.5669
 epoch: 73, train_loss: 0.8051, test_loss: 0.9208, test_f1: 0.5546
 epoch: 74, train_loss: 0.8045, test_loss: 0.9138, test_f1: 0.5570
 epoch: 75, train_loss: 0.8111, test_loss: 0.9133, test_f1: 0.5651
 epoch: 76, train_loss: 0.7991, test_loss: 0.9038, test_f1: 0.5702
 epoch: 77, train_loss: 0.8099, test_loss: 0.9100, test_f1: 0.5698
 epoch: 78, train_loss: 0.8020, test_loss: 0.9098, test_f1: 0.5636
 epoch: 79, train_loss: 0.7999, test_loss: 0.9128, test_f1: 0.5531
 epoch: 80, train_loss: 0.8065, test_loss: 0.9155, test_f1: 0.5646
 epoch: 81, train_loss: 0.7935, test_loss: 0.9170, test_f1: 0.5599
 epoch: 82, train_loss: 0.7972, test_loss: 0.9157, test_f1: 0.5634
 epoch: 83, train_loss: 0.8005, test_loss: 0.9150, test_f1: 0.5673
 epoch: 84, train_loss: 0.7903, test_loss: 0.9145, test_f1: 0.5657
 epoch: 85, train_loss: 0.7969, test_loss: 0.9176, test_f1: 0.5667
 epoch: 86, train_loss: 0.7897, test_loss: 0.9165, test_f1: 0.5538
 epoch: 87, train_loss: 0.7918, test_loss: 0.9139, test_f1: 0.5676
 epoch: 88, train_loss: 0.8019, test_loss: 0.9169, test_f1: 0.5670
 epoch: 89, train_loss: 0.7874, test_loss: 0.9160, test_f1: 0.5614
 epoch: 90, train_loss: 0.7915, test_loss: 0.9091, test_f1: 0.5768
 epoch: 91, train_loss: 0.7789, test_loss: 0.9192, test_f1: 0.5675
 epoch: 92, train_loss: 0.7928, test_loss: 0.9200, test_f1: 0.5677
 epoch: 93, train_loss: 0.7763, test_loss: 0.9206, test_f1: 0.5644
 epoch: 94, train_loss: 0.7883, test_loss: 0.9189, test_f1: 0.5624
 epoch: 95, train_loss: 0.7773, test_loss: 0.9206, test_f1: 0.5689
 epoch: 96, train_loss: 0.7859, test_loss: 0.9214, test_f1: 0.5640
 epoch: 97, train_loss: 0.7801, test_loss: 0.9197, test_f1: 0.5587
 epoch: 98, train_loss: 0.7771, test_loss: 0.9182, test_f1: 0.5731
 epoch: 99, train_loss: 0.7779, test_loss: 0.9173, test_f1: 0.5661
##################ITERATION #2 ****************************************
 epoch: 0, train_loss: 1.2866, test_loss: 1.2572, test_f1: 0.2270
 epoch: 1, train_loss: 1.2256, test_loss: 1.1799, test_f1: 0.3338
 epoch: 2, train_loss: 1.1901, test_loss: 1.1445, test_f1: 0.3401
 epoch: 3, train_loss: 1.1559, test_loss: 1.1121, test_f1: 0.3475
 epoch: 4, train_loss: 1.1243, test_loss: 1.0884, test_f1: 0.3550
 epoch: 5, train_loss: 1.0979, test_loss: 1.0601, test_f1: 0.3886
 epoch: 6, train_loss: 1.0785, test_loss: 1.0398, test_f1: 0.4050
 epoch: 7, train_loss: 1.0469, test_loss: 1.0184, test_f1: 0.4190
 epoch: 8, train_loss: 1.0363, test_loss: 1.0081, test_f1: 0.4298
 epoch: 9, train_loss: 1.0208, test_loss: 0.9953, test_f1: 0.4404
 epoch: 10, train_loss: 1.0114, test_loss: 0.9898, test_f1: 0.4485
 epoch: 11, train_loss: 1.0052, test_loss: 0.9828, test_f1: 0.4506
 epoch: 12, train_loss: 0.9991, test_loss: 0.9807, test_f1: 0.4643
 epoch: 13, train_loss: 0.9884, test_loss: 0.9748, test_f1: 0.4692
 epoch: 14, train_loss: 0.9776, test_loss: 0.9659, test_f1: 0.4790
 epoch: 15, train_loss: 0.9759, test_loss: 0.9740, test_f1: 0.4776
 epoch: 16, train_loss: 0.9726, test_loss: 0.9597, test_f1: 0.4868
 epoch: 17, train_loss: 0.9684, test_loss: 0.9556, test_f1: 0.4872
 epoch: 18, train_loss: 0.9560, test_loss: 0.9639, test_f1: 0.4950
 epoch: 19, train_loss: 0.9484, test_loss: 0.9551, test_f1: 0.4912
 epoch: 20, train_loss: 0.9463, test_loss: 0.9602, test_f1: 0.4994
 epoch: 21, train_loss: 0.9403, test_loss: 0.9433, test_f1: 0.5014
 epoch: 22, train_loss: 0.9425, test_loss: 0.9597, test_f1: 0.5101
 epoch: 23, train_loss: 0.9320, test_loss: 0.9577, test_f1: 0.4941
 epoch: 24, train_loss: 0.9283, test_loss: 0.9390, test_f1: 0.5060
 epoch: 25, train_loss: 0.9320, test_loss: 0.9346, test_f1: 0.5079
 epoch: 26, train_loss: 0.9246, test_loss: 0.9306, test_f1: 0.5178
 epoch: 27, train_loss: 0.9220, test_loss: 0.9326, test_f1: 0.5196
 epoch: 28, train_loss: 0.9200, test_loss: 0.9374, test_f1: 0.4996
 epoch: 29, train_loss: 0.9178, test_loss: 0.9318, test_f1: 0.5043
 epoch: 30, train_loss: 0.9213, test_loss: 0.9386, test_f1: 0.5113
 epoch: 31, train_loss: 0.9106, test_loss: 0.9439, test_f1: 0.5067
 epoch: 32, train_loss: 0.9062, test_loss: 0.9394, test_f1: 0.5055
 epoch: 33, train_loss: 0.9036, test_loss: 0.9389, test_f1: 0.5125
 epoch: 34, train_loss: 0.9019, test_loss: 0.9022, test_f1: 0.5403
 epoch: 35, train_loss: 0.8925, test_loss: 0.9415, test_f1: 0.5239
 epoch: 36, train_loss: 0.8945, test_loss: 0.9296, test_f1: 0.5247
 epoch: 37, train_loss: 0.8946, test_loss: 0.9161, test_f1: 0.5322
 epoch: 38, train_loss: 0.8860, test_loss: 0.9218, test_f1: 0.5176
 epoch: 39, train_loss: 0.8804, test_loss: 0.9065, test_f1: 0.5199
 epoch: 40, train_loss: 0.8843, test_loss: 0.9248, test_f1: 0.5214
 epoch: 41, train_loss: 0.8768, test_loss: 0.9273, test_f1: 0.5196
 epoch: 42, train_loss: 0.8792, test_loss: 0.9166, test_f1: 0.5206
 epoch: 43, train_loss: 0.8680, test_loss: 0.9131, test_f1: 0.5400
 epoch: 44, train_loss: 0.8710, test_loss: 0.9029, test_f1: 0.5344
 epoch: 45, train_loss: 0.8676, test_loss: 0.9270, test_f1: 0.5283
 epoch: 46, train_loss: 0.8646, test_loss: 0.9157, test_f1: 0.5192
 epoch: 47, train_loss: 0.8675, test_loss: 0.9258, test_f1: 0.5131
 epoch: 48, train_loss: 0.8662, test_loss: 0.9090, test_f1: 0.5119
 epoch: 49, train_loss: 0.8634, test_loss: 0.9172, test_f1: 0.5343
 epoch: 50, train_loss: 0.8513, test_loss: 0.9132, test_f1: 0.5282
 epoch: 51, train_loss: 0.8573, test_loss: 0.9036, test_f1: 0.5309
 epoch: 52, train_loss: 0.8456, test_loss: 0.9213, test_f1: 0.5123
 epoch: 53, train_loss: 0.8571, test_loss: 0.9141, test_f1: 0.5162
 epoch: 54, train_loss: 0.8448, test_loss: 0.9027, test_f1: 0.5314
 epoch: 55, train_loss: 0.8542, test_loss: 0.9114, test_f1: 0.5145
 epoch: 56, train_loss: 0.8372, test_loss: 0.9090, test_f1: 0.5230
 epoch: 57, train_loss: 0.8415, test_loss: 0.9043, test_f1: 0.5190
 epoch: 58, train_loss: 0.8369, test_loss: 0.9307, test_f1: 0.5280
 epoch: 59, train_loss: 0.8373, test_loss: 0.9059, test_f1: 0.5311
 epoch: 60, train_loss: 0.8309, test_loss: 0.9128, test_f1: 0.5404
 epoch: 61, train_loss: 0.8396, test_loss: 0.8987, test_f1: 0.5261
 epoch: 62, train_loss: 0.8298, test_loss: 0.9149, test_f1: 0.5195
 epoch: 63, train_loss: 0.8318, test_loss: 0.8936, test_f1: 0.5222
 epoch: 64, train_loss: 0.8298, test_loss: 0.9068, test_f1: 0.5235
 epoch: 65, train_loss: 0.8367, test_loss: 0.9096, test_f1: 0.5304
 epoch: 66, train_loss: 0.8289, test_loss: 0.9159, test_f1: 0.5162
 epoch: 67, train_loss: 0.8361, test_loss: 0.9240, test_f1: 0.5181
 epoch: 68, train_loss: 0.8385, test_loss: 0.9154, test_f1: 0.5261
 epoch: 69, train_loss: 0.8291, test_loss: 0.9127, test_f1: 0.5219
 epoch: 70, train_loss: 0.8284, test_loss: 0.9215, test_f1: 0.5220
 epoch: 71, train_loss: 0.8257, test_loss: 0.8905, test_f1: 0.5282
 epoch: 72, train_loss: 0.8300, test_loss: 0.9121, test_f1: 0.5171
 epoch: 73, train_loss: 0.8253, test_loss: 0.9291, test_f1: 0.5247
 epoch: 74, train_loss: 0.8272, test_loss: 0.9049, test_f1: 0.5251
 epoch: 75, train_loss: 0.8229, test_loss: 0.9067, test_f1: 0.5248
 epoch: 76, train_loss: 0.8273, test_loss: 0.9078, test_f1: 0.5189
 epoch: 77, train_loss: 0.8253, test_loss: 0.8972, test_f1: 0.5246
 epoch: 78, train_loss: 0.8203, test_loss: 0.9151, test_f1: 0.5182
 epoch: 79, train_loss: 0.8228, test_loss: 0.8816, test_f1: 0.5294
 epoch: 80, train_loss: 0.8132, test_loss: 0.9253, test_f1: 0.5180
 epoch: 81, train_loss: 0.8166, test_loss: 0.8936, test_f1: 0.5237
 epoch: 82, train_loss: 0.8202, test_loss: 0.9274, test_f1: 0.5312
 epoch: 83, train_loss: 0.8201, test_loss: 0.8932, test_f1: 0.5187
 epoch: 84, train_loss: 0.8159, test_loss: 0.8962, test_f1: 0.5247
 epoch: 85, train_loss: 0.8143, test_loss: 0.8826, test_f1: 0.5308
 epoch: 86, train_loss: 0.8175, test_loss: 0.8903, test_f1: 0.5237
 epoch: 87, train_loss: 0.8097, test_loss: 0.8962, test_f1: 0.5126
 epoch: 88, train_loss: 0.8045, test_loss: 0.8792, test_f1: 0.5307
 epoch: 89, train_loss: 0.8058, test_loss: 0.9039, test_f1: 0.5306
 epoch: 90, train_loss: 0.8117, test_loss: 0.9238, test_f1: 0.5198
 epoch: 91, train_loss: 0.8013, test_loss: 0.8947, test_f1: 0.5216
 epoch: 92, train_loss: 0.8038, test_loss: 0.8900, test_f1: 0.5258
 epoch: 93, train_loss: 0.8039, test_loss: 0.8942, test_f1: 0.5301
 epoch: 94, train_loss: 0.8082, test_loss: 0.9025, test_f1: 0.5119
 epoch: 95, train_loss: 0.8061, test_loss: 0.8908, test_f1: 0.5291
 epoch: 96, train_loss: 0.8018, test_loss: 0.9089, test_f1: 0.5274
 epoch: 97, train_loss: 0.7925, test_loss: 0.8821, test_f1: 0.5346
 epoch: 98, train_loss: 0.7945, test_loss: 0.9172, test_f1: 0.5240
 epoch: 99, train_loss: 0.7999, test_loss: 0.8764, test_f1: 0.5389
##################ITERATION #3 ****************************************
 epoch: 0, train_loss: 1.2631, test_loss: 1.2203, test_f1: 0.2464
 epoch: 1, train_loss: 1.1998, test_loss: 1.1611, test_f1: 0.3637
 epoch: 2, train_loss: 1.1743, test_loss: 1.1300, test_f1: 0.3812
 epoch: 3, train_loss: 1.1460, test_loss: 1.1003, test_f1: 0.4458
 epoch: 4, train_loss: 1.1256, test_loss: 1.0771, test_f1: 0.4403
 epoch: 5, train_loss: 1.0995, test_loss: 1.0581, test_f1: 0.4391
 epoch: 6, train_loss: 1.0768, test_loss: 1.0329, test_f1: 0.4530
 epoch: 7, train_loss: 1.0547, test_loss: 1.0201, test_f1: 0.4596
 epoch: 8, train_loss: 1.0420, test_loss: 1.0057, test_f1: 0.4560
 epoch: 9, train_loss: 1.0222, test_loss: 0.9961, test_f1: 0.4594
 epoch: 10, train_loss: 1.0145, test_loss: 0.9850, test_f1: 0.4607
 epoch: 11, train_loss: 1.0000, test_loss: 0.9825, test_f1: 0.4611
 epoch: 12, train_loss: 0.9885, test_loss: 0.9764, test_f1: 0.4648
 epoch: 13, train_loss: 0.9833, test_loss: 0.9663, test_f1: 0.4728
 epoch: 14, train_loss: 0.9763, test_loss: 0.9668, test_f1: 0.4753
 epoch: 15, train_loss: 0.9595, test_loss: 0.9668, test_f1: 0.4835
 epoch: 16, train_loss: 0.9574, test_loss: 0.9683, test_f1: 0.4768
 epoch: 17, train_loss: 0.9538, test_loss: 0.9604, test_f1: 0.5000
 epoch: 18, train_loss: 0.9528, test_loss: 0.9524, test_f1: 0.5022
 epoch: 19, train_loss: 0.9379, test_loss: 0.9558, test_f1: 0.4966
 epoch: 20, train_loss: 0.9356, test_loss: 0.9588, test_f1: 0.5082
 epoch: 21, train_loss: 0.9333, test_loss: 0.9577, test_f1: 0.5090
 epoch: 22, train_loss: 0.9260, test_loss: 0.9571, test_f1: 0.5061
 epoch: 23, train_loss: 0.9184, test_loss: 0.9455, test_f1: 0.5162
 epoch: 24, train_loss: 0.9127, test_loss: 0.9438, test_f1: 0.5049
 epoch: 25, train_loss: 0.9172, test_loss: 0.9513, test_f1: 0.5161
 epoch: 26, train_loss: 0.9064, test_loss: 0.9466, test_f1: 0.5141
 epoch: 27, train_loss: 0.9108, test_loss: 0.9747, test_f1: 0.5079
 epoch: 28, train_loss: 0.8996, test_loss: 0.9557, test_f1: 0.5119
 epoch: 29, train_loss: 0.8968, test_loss: 0.9307, test_f1: 0.5254
 epoch: 30, train_loss: 0.9062, test_loss: 0.9508, test_f1: 0.5085
 epoch: 31, train_loss: 0.8966, test_loss: 0.9473, test_f1: 0.5208
 epoch: 32, train_loss: 0.8786, test_loss: 0.9512, test_f1: 0.5074
 epoch: 33, train_loss: 0.8845, test_loss: 0.9379, test_f1: 0.5187
 epoch: 34, train_loss: 0.8795, test_loss: 0.9627, test_f1: 0.5121
 epoch: 35, train_loss: 0.8738, test_loss: 0.9567, test_f1: 0.5062
 epoch: 36, train_loss: 0.8600, test_loss: 0.9501, test_f1: 0.5149
 epoch: 37, train_loss: 0.8771, test_loss: 0.9575, test_f1: 0.5042
 epoch: 38, train_loss: 0.8556, test_loss: 0.9478, test_f1: 0.5191
 epoch: 39, train_loss: 0.8623, test_loss: 0.9503, test_f1: 0.5103
 epoch: 40, train_loss: 0.8597, test_loss: 0.9625, test_f1: 0.5144
 epoch: 41, train_loss: 0.8666, test_loss: 0.9646, test_f1: 0.5084
 epoch: 42, train_loss: 0.8504, test_loss: 0.9642, test_f1: 0.4951
 epoch: 43, train_loss: 0.8556, test_loss: 0.9534, test_f1: 0.5154
 epoch: 44, train_loss: 0.8482, test_loss: 0.9519, test_f1: 0.5104
 epoch: 45, train_loss: 0.8519, test_loss: 0.9646, test_f1: 0.5088
 epoch: 46, train_loss: 0.8422, test_loss: 0.9743, test_f1: 0.5133
 epoch: 47, train_loss: 0.8431, test_loss: 0.9485, test_f1: 0.5145
 epoch: 48, train_loss: 0.8332, test_loss: 0.9446, test_f1: 0.5149
 epoch: 49, train_loss: 0.8377, test_loss: 0.9567, test_f1: 0.5104
 epoch: 50, train_loss: 0.8366, test_loss: 0.9745, test_f1: 0.5151
 epoch: 51, train_loss: 0.8306, test_loss: 0.9660, test_f1: 0.5159
 epoch: 52, train_loss: 0.8263, test_loss: 0.9580, test_f1: 0.5182
 epoch: 53, train_loss: 0.8201, test_loss: 0.9710, test_f1: 0.5218
 epoch: 54, train_loss: 0.8332, test_loss: 0.9623, test_f1: 0.5187
 epoch: 55, train_loss: 0.8263, test_loss: 0.9580, test_f1: 0.5156
 epoch: 56, train_loss: 0.8137, test_loss: 0.9656, test_f1: 0.5100
 epoch: 57, train_loss: 0.8143, test_loss: 0.9641, test_f1: 0.5166
 epoch: 58, train_loss: 0.8302, test_loss: 0.9680, test_f1: 0.5168
 epoch: 59, train_loss: 0.8215, test_loss: 0.9671, test_f1: 0.5211
 epoch: 60, train_loss: 0.8278, test_loss: 0.9585, test_f1: 0.5107
 epoch: 61, train_loss: 0.8235, test_loss: 0.9869, test_f1: 0.5072
 epoch: 62, train_loss: 0.8236, test_loss: 0.9642, test_f1: 0.5221
 epoch: 63, train_loss: 0.8172, test_loss: 0.9683, test_f1: 0.5012
 epoch: 64, train_loss: 0.8203, test_loss: 0.9559, test_f1: 0.5122
 epoch: 65, train_loss: 0.8196, test_loss: 0.9729, test_f1: 0.5077
 epoch: 66, train_loss: 0.8213, test_loss: 0.9562, test_f1: 0.5174
 epoch: 67, train_loss: 0.8160, test_loss: 0.9618, test_f1: 0.5141
 epoch: 68, train_loss: 0.8121, test_loss: 0.9628, test_f1: 0.5164
 epoch: 69, train_loss: 0.8120, test_loss: 0.9511, test_f1: 0.5196
 epoch: 70, train_loss: 0.8167, test_loss: 0.9618, test_f1: 0.5176
 epoch: 71, train_loss: 0.7987, test_loss: 0.9691, test_f1: 0.5089
 epoch: 72, train_loss: 0.8090, test_loss: 0.9703, test_f1: 0.5196
 epoch: 73, train_loss: 0.8025, test_loss: 0.9600, test_f1: 0.5186
 epoch: 74, train_loss: 0.8007, test_loss: 0.9679, test_f1: 0.5110
 epoch: 75, train_loss: 0.8104, test_loss: 0.9854, test_f1: 0.5039
 epoch: 76, train_loss: 0.8050, test_loss: 0.9612, test_f1: 0.5152
 epoch: 77, train_loss: 0.7984, test_loss: 0.9671, test_f1: 0.5178
 epoch: 78, train_loss: 0.8030, test_loss: 0.9701, test_f1: 0.5102
 epoch: 79, train_loss: 0.8117, test_loss: 0.9703, test_f1: 0.5110
 epoch: 80, train_loss: 0.8026, test_loss: 0.9845, test_f1: 0.5036
 epoch: 81, train_loss: 0.8096, test_loss: 0.9619, test_f1: 0.5168
 epoch: 82, train_loss: 0.7919, test_loss: 0.9608, test_f1: 0.5079
 epoch: 83, train_loss: 0.8021, test_loss: 0.9721, test_f1: 0.5127
 epoch: 84, train_loss: 0.8022, test_loss: 0.9916, test_f1: 0.5087
 epoch: 85, train_loss: 0.8078, test_loss: 0.9733, test_f1: 0.5076
 epoch: 86, train_loss: 0.8019, test_loss: 0.9696, test_f1: 0.5132
 epoch: 87, train_loss: 0.8013, test_loss: 0.9705, test_f1: 0.5175
 epoch: 88, train_loss: 0.7971, test_loss: 0.9700, test_f1: 0.5110
 epoch: 89, train_loss: 0.7910, test_loss: 0.9794, test_f1: 0.5118
 epoch: 90, train_loss: 0.7900, test_loss: 0.9877, test_f1: 0.5086
 epoch: 91, train_loss: 0.7946, test_loss: 0.9736, test_f1: 0.5143
 epoch: 92, train_loss: 0.7926, test_loss: 0.9945, test_f1: 0.5130
 epoch: 93, train_loss: 0.7926, test_loss: 0.9767, test_f1: 0.5046
 epoch: 94, train_loss: 0.7881, test_loss: 0.9808, test_f1: 0.5137
 epoch: 95, train_loss: 0.7873, test_loss: 0.9833, test_f1: 0.5143
 epoch: 96, train_loss: 0.7934, test_loss: 0.9917, test_f1: 0.5127
 epoch: 97, train_loss: 0.7946, test_loss: 0.9769, test_f1: 0.5110
 epoch: 98, train_loss: 0.7779, test_loss: 0.9925, test_f1: 0.4911
 epoch: 99, train_loss: 0.7861, test_loss: 0.9783, test_f1: 0.5212
##################ITERATION #4 ****************************************
 epoch: 0, train_loss: 1.2551, test_loss: 1.1856, test_f1: 0.2801
 epoch: 1, train_loss: 1.1735, test_loss: 1.1137, test_f1: 0.3634
 epoch: 2, train_loss: 1.1456, test_loss: 1.0875, test_f1: 0.3989
 epoch: 3, train_loss: 1.1192, test_loss: 1.0601, test_f1: 0.4224
 epoch: 4, train_loss: 1.0972, test_loss: 1.0377, test_f1: 0.4552
 epoch: 5, train_loss: 1.0725, test_loss: 1.0264, test_f1: 0.4403
 epoch: 6, train_loss: 1.0590, test_loss: 1.0093, test_f1: 0.4615
 epoch: 7, train_loss: 1.0364, test_loss: 1.0029, test_f1: 0.4606
 epoch: 8, train_loss: 1.0137, test_loss: 0.9832, test_f1: 0.4757
 epoch: 9, train_loss: 1.0097, test_loss: 0.9737, test_f1: 0.4828
 epoch: 10, train_loss: 0.9982, test_loss: 0.9697, test_f1: 0.4808
 epoch: 11, train_loss: 0.9851, test_loss: 0.9581, test_f1: 0.4952
 epoch: 12, train_loss: 0.9755, test_loss: 0.9481, test_f1: 0.4985
 epoch: 13, train_loss: 0.9639, test_loss: 0.9476, test_f1: 0.5026
 epoch: 14, train_loss: 0.9532, test_loss: 0.9418, test_f1: 0.5066
 epoch: 15, train_loss: 0.9586, test_loss: 0.9435, test_f1: 0.4982
 epoch: 16, train_loss: 0.9431, test_loss: 0.9337, test_f1: 0.5144
 epoch: 17, train_loss: 0.9398, test_loss: 0.9328, test_f1: 0.4986
 epoch: 18, train_loss: 0.9368, test_loss: 0.9273, test_f1: 0.5047
 epoch: 19, train_loss: 0.9302, test_loss: 0.9304, test_f1: 0.5020
 epoch: 20, train_loss: 0.9238, test_loss: 0.9287, test_f1: 0.5057
 epoch: 21, train_loss: 0.9176, test_loss: 0.9164, test_f1: 0.5121
 epoch: 22, train_loss: 0.9139, test_loss: 0.9147, test_f1: 0.5326
 epoch: 23, train_loss: 0.9078, test_loss: 0.9156, test_f1: 0.5279
 epoch: 24, train_loss: 0.9040, test_loss: 0.9094, test_f1: 0.5458
 epoch: 25, train_loss: 0.8984, test_loss: 0.9213, test_f1: 0.5204
 epoch: 26, train_loss: 0.8904, test_loss: 0.9127, test_f1: 0.5285
 epoch: 27, train_loss: 0.8977, test_loss: 0.9151, test_f1: 0.5406
 epoch: 28, train_loss: 0.8879, test_loss: 0.9296, test_f1: 0.5057
 epoch: 29, train_loss: 0.8953, test_loss: 0.9066, test_f1: 0.5361
 epoch: 30, train_loss: 0.8840, test_loss: 0.9161, test_f1: 0.5053
 epoch: 31, train_loss: 0.8740, test_loss: 0.9067, test_f1: 0.5361
 epoch: 32, train_loss: 0.8728, test_loss: 0.9100, test_f1: 0.5388
 epoch: 33, train_loss: 0.8818, test_loss: 0.9046, test_f1: 0.5347
 epoch: 34, train_loss: 0.8670, test_loss: 0.9308, test_f1: 0.5215
 epoch: 35, train_loss: 0.8718, test_loss: 0.9064, test_f1: 0.5332
 epoch: 36, train_loss: 0.8632, test_loss: 0.9080, test_f1: 0.5396
 epoch: 37, train_loss: 0.8629, test_loss: 0.9060, test_f1: 0.5415
 epoch: 38, train_loss: 0.8541, test_loss: 0.9233, test_f1: 0.5348
 epoch: 39, train_loss: 0.8534, test_loss: 0.8996, test_f1: 0.5494
 epoch: 40, train_loss: 0.8558, test_loss: 0.9087, test_f1: 0.5436
 epoch: 41, train_loss: 0.8570, test_loss: 0.9035, test_f1: 0.5364
 epoch: 42, train_loss: 0.8461, test_loss: 0.9158, test_f1: 0.5378
 epoch: 43, train_loss: 0.8446, test_loss: 0.9089, test_f1: 0.5313
 epoch: 44, train_loss: 0.8352, test_loss: 0.9316, test_f1: 0.5402
 epoch: 45, train_loss: 0.8438, test_loss: 0.9157, test_f1: 0.5400
 epoch: 46, train_loss: 0.8363, test_loss: 0.8999, test_f1: 0.5303
 epoch: 47, train_loss: 0.8358, test_loss: 0.9051, test_f1: 0.5410
 epoch: 48, train_loss: 0.8333, test_loss: 0.9193, test_f1: 0.5437
 epoch: 49, train_loss: 0.8245, test_loss: 0.9125, test_f1: 0.5459
 epoch: 50, train_loss: 0.8229, test_loss: 0.9125, test_f1: 0.5423
 epoch: 51, train_loss: 0.8279, test_loss: 0.9193, test_f1: 0.5395
 epoch: 52, train_loss: 0.8304, test_loss: 0.9105, test_f1: 0.5429
 epoch: 53, train_loss: 0.8203, test_loss: 0.9027, test_f1: 0.5509
 epoch: 54, train_loss: 0.8122, test_loss: 0.9067, test_f1: 0.5505
 epoch: 55, train_loss: 0.8154, test_loss: 0.9118, test_f1: 0.5450
 epoch: 56, train_loss: 0.8109, test_loss: 0.9167, test_f1: 0.5505
 epoch: 57, train_loss: 0.8162, test_loss: 0.9236, test_f1: 0.5431
 epoch: 58, train_loss: 0.8214, test_loss: 0.9146, test_f1: 0.5496
 epoch: 59, train_loss: 0.8088, test_loss: 0.9114, test_f1: 0.5562
 epoch: 60, train_loss: 0.8087, test_loss: 0.9071, test_f1: 0.5530
 epoch: 61, train_loss: 0.8201, test_loss: 0.9086, test_f1: 0.5492
 epoch: 62, train_loss: 0.7994, test_loss: 0.9158, test_f1: 0.5439
 epoch: 63, train_loss: 0.8063, test_loss: 0.9111, test_f1: 0.5457
 epoch: 64, train_loss: 0.8095, test_loss: 0.9044, test_f1: 0.5462
 epoch: 65, train_loss: 0.8078, test_loss: 0.9111, test_f1: 0.5451
 epoch: 66, train_loss: 0.8038, test_loss: 0.9102, test_f1: 0.5530
 epoch: 67, train_loss: 0.8049, test_loss: 0.8956, test_f1: 0.5522
 epoch: 68, train_loss: 0.7956, test_loss: 0.9019, test_f1: 0.5572
 epoch: 69, train_loss: 0.8104, test_loss: 0.9062, test_f1: 0.5537
 epoch: 70, train_loss: 0.8067, test_loss: 0.9004, test_f1: 0.5534
 epoch: 71, train_loss: 0.8005, test_loss: 0.9121, test_f1: 0.5628
 epoch: 72, train_loss: 0.8046, test_loss: 0.9212, test_f1: 0.5576
 epoch: 73, train_loss: 0.7896, test_loss: 0.9185, test_f1: 0.5583
 epoch: 74, train_loss: 0.8022, test_loss: 0.9030, test_f1: 0.5606
 epoch: 75, train_loss: 0.8025, test_loss: 0.9054, test_f1: 0.5627
 epoch: 76, train_loss: 0.7926, test_loss: 0.9102, test_f1: 0.5525
 epoch: 77, train_loss: 0.7940, test_loss: 0.9181, test_f1: 0.5490
 epoch: 78, train_loss: 0.7860, test_loss: 0.9034, test_f1: 0.5589
 epoch: 79, train_loss: 0.7876, test_loss: 0.9062, test_f1: 0.5570
 epoch: 80, train_loss: 0.7839, test_loss: 0.8968, test_f1: 0.5619
 epoch: 81, train_loss: 0.7907, test_loss: 0.9254, test_f1: 0.5572
 epoch: 82, train_loss: 0.7895, test_loss: 0.9064, test_f1: 0.5594
 epoch: 83, train_loss: 0.7914, test_loss: 0.8992, test_f1: 0.5627
 epoch: 84, train_loss: 0.7845, test_loss: 0.8987, test_f1: 0.5591
 epoch: 85, train_loss: 0.7945, test_loss: 0.8969, test_f1: 0.5729
 epoch: 86, train_loss: 0.7750, test_loss: 0.9033, test_f1: 0.5602
 epoch: 87, train_loss: 0.7824, test_loss: 0.9338, test_f1: 0.5522
 epoch: 88, train_loss: 0.7794, test_loss: 0.9125, test_f1: 0.5545
 epoch: 89, train_loss: 0.7771, test_loss: 0.9099, test_f1: 0.5605
 epoch: 90, train_loss: 0.7862, test_loss: 0.9116, test_f1: 0.5565
 epoch: 91, train_loss: 0.7811, test_loss: 0.9083, test_f1: 0.5616
 epoch: 92, train_loss: 0.7830, test_loss: 0.9075, test_f1: 0.5625
 epoch: 93, train_loss: 0.7717, test_loss: 0.9040, test_f1: 0.5592
 epoch: 94, train_loss: 0.7631, test_loss: 0.9103, test_f1: 0.5566
 epoch: 95, train_loss: 0.7742, test_loss: 0.9193, test_f1: 0.5617
 epoch: 96, train_loss: 0.7702, test_loss: 0.9162, test_f1: 0.5540
 epoch: 97, train_loss: 0.7716, test_loss: 0.9193, test_f1: 0.5596
 epoch: 98, train_loss: 0.7780, test_loss: 0.9192, test_f1: 0.5581
 epoch: 99, train_loss: 0.7758, test_loss: 0.9015, test_f1: 0.5640
##################ITERATION #5 ****************************************
 epoch: 0, train_loss: 1.2921, test_loss: 1.1790, test_f1: 0.3274
 epoch: 1, train_loss: 1.1813, test_loss: 1.1214, test_f1: 0.3478
 epoch: 2, train_loss: 1.1495, test_loss: 1.0870, test_f1: 0.3735
 epoch: 3, train_loss: 1.1173, test_loss: 1.0608, test_f1: 0.3974
 epoch: 4, train_loss: 1.0939, test_loss: 1.0423, test_f1: 0.4201
 epoch: 5, train_loss: 1.0701, test_loss: 1.0337, test_f1: 0.4364
 epoch: 6, train_loss: 1.0478, test_loss: 1.0079, test_f1: 0.4507
 epoch: 7, train_loss: 1.0311, test_loss: 1.0055, test_f1: 0.4617
 epoch: 8, train_loss: 1.0247, test_loss: 0.9944, test_f1: 0.4536
 epoch: 9, train_loss: 1.0136, test_loss: 0.9840, test_f1: 0.4714
 epoch: 10, train_loss: 1.0016, test_loss: 0.9712, test_f1: 0.4617
 epoch: 11, train_loss: 0.9942, test_loss: 0.9645, test_f1: 0.4778
 epoch: 12, train_loss: 0.9811, test_loss: 0.9631, test_f1: 0.4861
 epoch: 13, train_loss: 0.9696, test_loss: 0.9610, test_f1: 0.4808
 epoch: 14, train_loss: 0.9727, test_loss: 0.9543, test_f1: 0.4777
 epoch: 15, train_loss: 0.9642, test_loss: 0.9586, test_f1: 0.4917
 epoch: 16, train_loss: 0.9594, test_loss: 0.9602, test_f1: 0.4988
 epoch: 17, train_loss: 0.9547, test_loss: 0.9555, test_f1: 0.4881
 epoch: 18, train_loss: 0.9427, test_loss: 0.9667, test_f1: 0.5039
 epoch: 19, train_loss: 0.9334, test_loss: 0.9256, test_f1: 0.5102
 epoch: 20, train_loss: 0.9374, test_loss: 0.9543, test_f1: 0.5008
 epoch: 21, train_loss: 0.9325, test_loss: 0.9298, test_f1: 0.5050
 epoch: 22, train_loss: 0.9278, test_loss: 0.9247, test_f1: 0.5054
 epoch: 23, train_loss: 0.9308, test_loss: 0.9316, test_f1: 0.5199
 epoch: 24, train_loss: 0.9193, test_loss: 0.9257, test_f1: 0.5067
 epoch: 25, train_loss: 0.9143, test_loss: 0.9171, test_f1: 0.5188
 epoch: 26, train_loss: 0.9018, test_loss: 0.9281, test_f1: 0.5255
 epoch: 27, train_loss: 0.9083, test_loss: 0.9202, test_f1: 0.5251
 epoch: 28, train_loss: 0.9043, test_loss: 0.9203, test_f1: 0.5297
 epoch: 29, train_loss: 0.9087, test_loss: 0.9216, test_f1: 0.5307
 epoch: 30, train_loss: 0.8940, test_loss: 0.9302, test_f1: 0.5161
 epoch: 31, train_loss: 0.8920, test_loss: 0.9143, test_f1: 0.5234
 epoch: 32, train_loss: 0.8914, test_loss: 0.9178, test_f1: 0.5231
 epoch: 33, train_loss: 0.8875, test_loss: 0.9285, test_f1: 0.5261
 epoch: 34, train_loss: 0.8908, test_loss: 0.9188, test_f1: 0.5234
 epoch: 35, train_loss: 0.8857, test_loss: 0.9275, test_f1: 0.5371
 epoch: 36, train_loss: 0.8861, test_loss: 0.9305, test_f1: 0.5333
 epoch: 37, train_loss: 0.8866, test_loss: 0.9490, test_f1: 0.5264
 epoch: 38, train_loss: 0.8738, test_loss: 0.9370, test_f1: 0.5314
 epoch: 39, train_loss: 0.8652, test_loss: 0.9370, test_f1: 0.5266
 epoch: 40, train_loss: 0.8709, test_loss: 0.9362, test_f1: 0.5321
 epoch: 41, train_loss: 0.8651, test_loss: 0.9173, test_f1: 0.5350
 epoch: 42, train_loss: 0.8696, test_loss: 0.9231, test_f1: 0.5443
 epoch: 43, train_loss: 0.8660, test_loss: 0.9391, test_f1: 0.5328
 epoch: 44, train_loss: 0.8564, test_loss: 0.9331, test_f1: 0.5362
 epoch: 45, train_loss: 0.8485, test_loss: 0.9142, test_f1: 0.5348
 epoch: 46, train_loss: 0.8523, test_loss: 0.8980, test_f1: 0.5357
 epoch: 47, train_loss: 0.8585, test_loss: 0.9286, test_f1: 0.5505
 epoch: 48, train_loss: 0.8433, test_loss: 0.9096, test_f1: 0.5497
 epoch: 49, train_loss: 0.8426, test_loss: 0.9299, test_f1: 0.5345
 epoch: 50, train_loss: 0.8507, test_loss: 0.9266, test_f1: 0.5435
 epoch: 51, train_loss: 0.8391, test_loss: 0.9091, test_f1: 0.5437
 epoch: 52, train_loss: 0.8406, test_loss: 0.9234, test_f1: 0.5540
 epoch: 53, train_loss: 0.8375, test_loss: 0.9189, test_f1: 0.5437
 epoch: 54, train_loss: 0.8365, test_loss: 0.9256, test_f1: 0.5438
 epoch: 55, train_loss: 0.8263, test_loss: 0.9283, test_f1: 0.5487
 epoch: 56, train_loss: 0.8391, test_loss: 0.9223, test_f1: 0.5501
 epoch: 57, train_loss: 0.8293, test_loss: 0.9133, test_f1: 0.5564
 epoch: 58, train_loss: 0.8326, test_loss: 0.9249, test_f1: 0.5535
 epoch: 59, train_loss: 0.8332, test_loss: 0.9137, test_f1: 0.5422
 epoch: 60, train_loss: 0.8260, test_loss: 0.9168, test_f1: 0.5434
 epoch: 61, train_loss: 0.8254, test_loss: 0.9149, test_f1: 0.5524
 epoch: 62, train_loss: 0.8242, test_loss: 0.9292, test_f1: 0.5623
 epoch: 63, train_loss: 0.8253, test_loss: 0.9193, test_f1: 0.5497
 epoch: 64, train_loss: 0.8347, test_loss: 0.9259, test_f1: 0.5494
 epoch: 65, train_loss: 0.8172, test_loss: 0.9228, test_f1: 0.5441
 epoch: 66, train_loss: 0.8165, test_loss: 0.9224, test_f1: 0.5465
 epoch: 67, train_loss: 0.8210, test_loss: 0.9280, test_f1: 0.5471
 epoch: 68, train_loss: 0.8109, test_loss: 0.9204, test_f1: 0.5444
 epoch: 69, train_loss: 0.8211, test_loss: 0.9258, test_f1: 0.5441
 epoch: 70, train_loss: 0.8111, test_loss: 0.9194, test_f1: 0.5472
 epoch: 71, train_loss: 0.8188, test_loss: 0.9134, test_f1: 0.5470
 epoch: 72, train_loss: 0.8242, test_loss: 0.9345, test_f1: 0.5419
 epoch: 73, train_loss: 0.8125, test_loss: 0.9375, test_f1: 0.5478
 epoch: 74, train_loss: 0.8198, test_loss: 0.9227, test_f1: 0.5430
 epoch: 75, train_loss: 0.8135, test_loss: 0.9331, test_f1: 0.5427
 epoch: 76, train_loss: 0.8064, test_loss: 0.9375, test_f1: 0.5461
 epoch: 77, train_loss: 0.8015, test_loss: 0.9365, test_f1: 0.5433
 epoch: 78, train_loss: 0.8158, test_loss: 0.9242, test_f1: 0.5488
 epoch: 79, train_loss: 0.8035, test_loss: 0.9256, test_f1: 0.5597
 epoch: 80, train_loss: 0.7980, test_loss: 0.9353, test_f1: 0.5446
 epoch: 81, train_loss: 0.8078, test_loss: 0.9233, test_f1: 0.5455
 epoch: 82, train_loss: 0.8007, test_loss: 0.9297, test_f1: 0.5473
 epoch: 83, train_loss: 0.7941, test_loss: 0.9195, test_f1: 0.5410
 epoch: 84, train_loss: 0.7993, test_loss: 0.9353, test_f1: 0.5337
 epoch: 85, train_loss: 0.8021, test_loss: 0.9205, test_f1: 0.5641
 epoch: 86, train_loss: 0.8058, test_loss: 0.9120, test_f1: 0.5618
 epoch: 87, train_loss: 0.7925, test_loss: 0.9342, test_f1: 0.5412
 epoch: 88, train_loss: 0.8040, test_loss: 0.9345, test_f1: 0.5453
 epoch: 89, train_loss: 0.8081, test_loss: 0.9255, test_f1: 0.5571
 epoch: 90, train_loss: 0.7891, test_loss: 0.9311, test_f1: 0.5455
 epoch: 91, train_loss: 0.7884, test_loss: 0.9400, test_f1: 0.5464
 epoch: 92, train_loss: 0.7916, test_loss: 0.9233, test_f1: 0.5437
 epoch: 93, train_loss: 0.7929, test_loss: 0.9258, test_f1: 0.5426
 epoch: 94, train_loss: 0.7967, test_loss: 0.9138, test_f1: 0.5486
 epoch: 95, train_loss: 0.7751, test_loss: 0.9246, test_f1: 0.5506
 epoch: 96, train_loss: 0.7977, test_loss: 0.9400, test_f1: 0.5503
 epoch: 97, train_loss: 0.7929, test_loss: 0.9299, test_f1: 0.5511
 epoch: 98, train_loss: 0.7868, test_loss: 0.9324, test_f1: 0.5462
 epoch: 99, train_loss: 0.7907, test_loss: 0.9347, test_f1: 0.5445
##################ITERATION #6 ****************************************
 epoch: 0, train_loss: 1.2747, test_loss: 1.1915, test_f1: 0.3000
 epoch: 1, train_loss: 1.1719, test_loss: 1.0813, test_f1: 0.3915
 epoch: 2, train_loss: 1.1427, test_loss: 1.0596, test_f1: 0.4085
 epoch: 3, train_loss: 1.1093, test_loss: 1.0340, test_f1: 0.4386
 epoch: 4, train_loss: 1.0821, test_loss: 1.0152, test_f1: 0.4307
 epoch: 5, train_loss: 1.0741, test_loss: 1.0079, test_f1: 0.4190
 epoch: 6, train_loss: 1.0512, test_loss: 0.9854, test_f1: 0.4426
 epoch: 7, train_loss: 1.0329, test_loss: 0.9739, test_f1: 0.4469
 epoch: 8, train_loss: 1.0196, test_loss: 0.9617, test_f1: 0.4669
 epoch: 9, train_loss: 1.0029, test_loss: 0.9647, test_f1: 0.4741
 epoch: 10, train_loss: 0.9989, test_loss: 0.9557, test_f1: 0.4782
 epoch: 11, train_loss: 0.9926, test_loss: 0.9577, test_f1: 0.4799
 epoch: 12, train_loss: 0.9891, test_loss: 0.9488, test_f1: 0.4722
 epoch: 13, train_loss: 0.9721, test_loss: 0.9359, test_f1: 0.4810
 epoch: 14, train_loss: 0.9602, test_loss: 0.9407, test_f1: 0.4882
 epoch: 15, train_loss: 0.9591, test_loss: 0.9295, test_f1: 0.4840
 epoch: 16, train_loss: 0.9491, test_loss: 0.9305, test_f1: 0.4907
 epoch: 17, train_loss: 0.9406, test_loss: 0.9253, test_f1: 0.5113
 epoch: 18, train_loss: 0.9344, test_loss: 0.9461, test_f1: 0.5157
 epoch: 19, train_loss: 0.9280, test_loss: 0.9195, test_f1: 0.5066
 epoch: 20, train_loss: 0.9240, test_loss: 0.9102, test_f1: 0.5181
 epoch: 21, train_loss: 0.9290, test_loss: 0.9173, test_f1: 0.5150
 epoch: 22, train_loss: 0.9148, test_loss: 0.9119, test_f1: 0.5130
 epoch: 23, train_loss: 0.9135, test_loss: 0.9070, test_f1: 0.5140
 epoch: 24, train_loss: 0.9092, test_loss: 0.9297, test_f1: 0.5188
 epoch: 25, train_loss: 0.9175, test_loss: 0.8875, test_f1: 0.5297
 epoch: 26, train_loss: 0.9059, test_loss: 0.8940, test_f1: 0.5208
 epoch: 27, train_loss: 0.8978, test_loss: 0.8910, test_f1: 0.5350
 epoch: 28, train_loss: 0.8880, test_loss: 0.9061, test_f1: 0.5259
 epoch: 29, train_loss: 0.8917, test_loss: 0.8972, test_f1: 0.5346
 epoch: 30, train_loss: 0.8852, test_loss: 0.9096, test_f1: 0.5195
 epoch: 31, train_loss: 0.8833, test_loss: 0.8843, test_f1: 0.5293
 epoch: 32, train_loss: 0.8907, test_loss: 0.9048, test_f1: 0.5231
 epoch: 33, train_loss: 0.8737, test_loss: 0.8922, test_f1: 0.5199
 epoch: 34, train_loss: 0.8747, test_loss: 0.9196, test_f1: 0.5282
 epoch: 35, train_loss: 0.8732, test_loss: 0.8929, test_f1: 0.5304
 epoch: 36, train_loss: 0.8741, test_loss: 0.8951, test_f1: 0.5285
 epoch: 37, train_loss: 0.8707, test_loss: 0.9055, test_f1: 0.5247
 epoch: 38, train_loss: 0.8641, test_loss: 0.9007, test_f1: 0.5171
 epoch: 39, train_loss: 0.8620, test_loss: 0.8936, test_f1: 0.5372
 epoch: 40, train_loss: 0.8610, test_loss: 0.8711, test_f1: 0.5237
 epoch: 41, train_loss: 0.8511, test_loss: 0.9023, test_f1: 0.5327
 epoch: 42, train_loss: 0.8490, test_loss: 0.9080, test_f1: 0.5283
 epoch: 43, train_loss: 0.8484, test_loss: 0.8974, test_f1: 0.5265
 epoch: 44, train_loss: 0.8456, test_loss: 0.8970, test_f1: 0.5218
 epoch: 45, train_loss: 0.8452, test_loss: 0.9177, test_f1: 0.5274
 epoch: 46, train_loss: 0.8557, test_loss: 0.8983, test_f1: 0.5243
 epoch: 47, train_loss: 0.8429, test_loss: 0.8955, test_f1: 0.5246
 epoch: 48, train_loss: 0.8411, test_loss: 0.9081, test_f1: 0.5169
 epoch: 49, train_loss: 0.8450, test_loss: 0.9034, test_f1: 0.5333
 epoch: 50, train_loss: 0.8369, test_loss: 0.9144, test_f1: 0.5320
 epoch: 51, train_loss: 0.8333, test_loss: 0.8974, test_f1: 0.5255
 epoch: 52, train_loss: 0.8305, test_loss: 0.8949, test_f1: 0.5260
 epoch: 53, train_loss: 0.8327, test_loss: 0.9053, test_f1: 0.5239
 epoch: 54, train_loss: 0.8261, test_loss: 0.8965, test_f1: 0.5354
 epoch: 55, train_loss: 0.8216, test_loss: 0.8983, test_f1: 0.5279
 epoch: 56, train_loss: 0.8256, test_loss: 0.8947, test_f1: 0.5273
 epoch: 57, train_loss: 0.8289, test_loss: 0.8952, test_f1: 0.5472
 epoch: 58, train_loss: 0.8307, test_loss: 0.9271, test_f1: 0.5139
 epoch: 59, train_loss: 0.8177, test_loss: 0.9147, test_f1: 0.5287
 epoch: 60, train_loss: 0.8262, test_loss: 0.9098, test_f1: 0.5176
 epoch: 61, train_loss: 0.8225, test_loss: 0.9002, test_f1: 0.5196
 epoch: 62, train_loss: 0.8197, test_loss: 0.9039, test_f1: 0.5297
 epoch: 63, train_loss: 0.8184, test_loss: 0.8941, test_f1: 0.5348
 epoch: 64, train_loss: 0.8214, test_loss: 0.9047, test_f1: 0.5259
 epoch: 65, train_loss: 0.8205, test_loss: 0.9032, test_f1: 0.5335
 epoch: 66, train_loss: 0.8148, test_loss: 0.9092, test_f1: 0.5288
 epoch: 67, train_loss: 0.8107, test_loss: 0.8983, test_f1: 0.5375
 epoch: 68, train_loss: 0.8137, test_loss: 0.9170, test_f1: 0.5311
 epoch: 69, train_loss: 0.8122, test_loss: 0.8885, test_f1: 0.5403
 epoch: 70, train_loss: 0.8166, test_loss: 0.9102, test_f1: 0.5364
 epoch: 71, train_loss: 0.8097, test_loss: 0.9412, test_f1: 0.5230
 epoch: 72, train_loss: 0.8174, test_loss: 0.9107, test_f1: 0.5305
 epoch: 73, train_loss: 0.8183, test_loss: 0.9199, test_f1: 0.5290
 epoch: 74, train_loss: 0.8223, test_loss: 0.9067, test_f1: 0.5270
 epoch: 75, train_loss: 0.8029, test_loss: 0.9201, test_f1: 0.5333
 epoch: 76, train_loss: 0.8086, test_loss: 0.9193, test_f1: 0.5294
 epoch: 77, train_loss: 0.8125, test_loss: 0.9081, test_f1: 0.5380
 epoch: 78, train_loss: 0.8086, test_loss: 0.9276, test_f1: 0.5271
 epoch: 79, train_loss: 0.8050, test_loss: 0.9238, test_f1: 0.5312
 epoch: 80, train_loss: 0.8038, test_loss: 0.9091, test_f1: 0.5421
 epoch: 81, train_loss: 0.7938, test_loss: 0.9108, test_f1: 0.5450
 epoch: 82, train_loss: 0.8014, test_loss: 0.9161, test_f1: 0.5421
 epoch: 83, train_loss: 0.8077, test_loss: 0.9117, test_f1: 0.5431
 epoch: 84, train_loss: 0.8030, test_loss: 0.9293, test_f1: 0.5453
 epoch: 85, train_loss: 0.8068, test_loss: 0.9273, test_f1: 0.5302
 epoch: 86, train_loss: 0.7932, test_loss: 0.9120, test_f1: 0.5350
 epoch: 87, train_loss: 0.7966, test_loss: 0.9069, test_f1: 0.5520
 epoch: 88, train_loss: 0.7973, test_loss: 0.9271, test_f1: 0.5383
 epoch: 89, train_loss: 0.7952, test_loss: 0.9071, test_f1: 0.5385
 epoch: 90, train_loss: 0.7910, test_loss: 0.9210, test_f1: 0.5400
 epoch: 91, train_loss: 0.7928, test_loss: 0.9182, test_f1: 0.5428
 epoch: 92, train_loss: 0.7985, test_loss: 0.9177, test_f1: 0.5351
 epoch: 93, train_loss: 0.7933, test_loss: 0.9176, test_f1: 0.5341
 epoch: 94, train_loss: 0.7872, test_loss: 0.9218, test_f1: 0.5409
 epoch: 95, train_loss: 0.7909, test_loss: 0.9290, test_f1: 0.5352
 epoch: 96, train_loss: 0.7903, test_loss: 0.9123, test_f1: 0.5389
 epoch: 97, train_loss: 0.7900, test_loss: 0.9098, test_f1: 0.5473
 epoch: 98, train_loss: 0.7876, test_loss: 0.9198, test_f1: 0.5476
 epoch: 99, train_loss: 0.7948, test_loss: 0.9170, test_f1: 0.5427
##################ITERATION #7 ****************************************
 epoch: 0, train_loss: 1.3197, test_loss: 1.1798, test_f1: 0.2836
 epoch: 1, train_loss: 1.1670, test_loss: 1.0944, test_f1: 0.3839
 epoch: 2, train_loss: 1.1309, test_loss: 1.0579, test_f1: 0.4004
 epoch: 3, train_loss: 1.1003, test_loss: 1.0334, test_f1: 0.4028
 epoch: 4, train_loss: 1.0749, test_loss: 1.0175, test_f1: 0.4104
 epoch: 5, train_loss: 1.0614, test_loss: 1.0018, test_f1: 0.4200
 epoch: 6, train_loss: 1.0445, test_loss: 0.9937, test_f1: 0.4227
 epoch: 7, train_loss: 1.0168, test_loss: 0.9840, test_f1: 0.4337
 epoch: 8, train_loss: 1.0133, test_loss: 0.9768, test_f1: 0.4598
 epoch: 9, train_loss: 1.0073, test_loss: 0.9789, test_f1: 0.4613
 epoch: 10, train_loss: 0.9952, test_loss: 0.9676, test_f1: 0.4760
 epoch: 11, train_loss: 0.9853, test_loss: 0.9634, test_f1: 0.4784
 epoch: 12, train_loss: 0.9720, test_loss: 0.9564, test_f1: 0.4656
 epoch: 13, train_loss: 0.9684, test_loss: 0.9448, test_f1: 0.4794
 epoch: 14, train_loss: 0.9630, test_loss: 0.9577, test_f1: 0.4808
 epoch: 15, train_loss: 0.9512, test_loss: 0.9447, test_f1: 0.4971
 epoch: 16, train_loss: 0.9511, test_loss: 0.9489, test_f1: 0.5049
 epoch: 17, train_loss: 0.9539, test_loss: 0.9532, test_f1: 0.5007
 epoch: 18, train_loss: 0.9437, test_loss: 0.9515, test_f1: 0.5049
 epoch: 19, train_loss: 0.9457, test_loss: 0.9450, test_f1: 0.5175
 epoch: 20, train_loss: 0.9337, test_loss: 0.9370, test_f1: 0.5093
 epoch: 21, train_loss: 0.9323, test_loss: 0.9453, test_f1: 0.5045
 epoch: 22, train_loss: 0.9290, test_loss: 0.9504, test_f1: 0.5069
 epoch: 23, train_loss: 0.9222, test_loss: 0.9460, test_f1: 0.5228
 epoch: 24, train_loss: 0.9241, test_loss: 0.9611, test_f1: 0.5076
 epoch: 25, train_loss: 0.9084, test_loss: 0.9421, test_f1: 0.5143
 epoch: 26, train_loss: 0.9015, test_loss: 0.9480, test_f1: 0.5218
 epoch: 27, train_loss: 0.9051, test_loss: 0.9507, test_f1: 0.5230
 epoch: 28, train_loss: 0.9062, test_loss: 0.9487, test_f1: 0.5215
 epoch: 29, train_loss: 0.9079, test_loss: 0.9425, test_f1: 0.5243
 epoch: 30, train_loss: 0.8976, test_loss: 0.9361, test_f1: 0.5211
 epoch: 31, train_loss: 0.9025, test_loss: 0.9374, test_f1: 0.5296
 epoch: 32, train_loss: 0.9005, test_loss: 0.9378, test_f1: 0.5302
 epoch: 33, train_loss: 0.8850, test_loss: 0.9443, test_f1: 0.5221
 epoch: 34, train_loss: 0.8959, test_loss: 0.9496, test_f1: 0.5236
 epoch: 35, train_loss: 0.8869, test_loss: 0.9319, test_f1: 0.5253
 epoch: 36, train_loss: 0.8778, test_loss: 0.9346, test_f1: 0.5314
 epoch: 37, train_loss: 0.8763, test_loss: 0.9297, test_f1: 0.5279
 epoch: 38, train_loss: 0.8744, test_loss: 0.9245, test_f1: 0.5326
 epoch: 39, train_loss: 0.8724, test_loss: 0.9339, test_f1: 0.5269
 epoch: 40, train_loss: 0.8709, test_loss: 0.9361, test_f1: 0.5318
 epoch: 41, train_loss: 0.8619, test_loss: 0.9426, test_f1: 0.5111
 epoch: 42, train_loss: 0.8631, test_loss: 0.9303, test_f1: 0.5266
 epoch: 43, train_loss: 0.8515, test_loss: 0.9305, test_f1: 0.5309
 epoch: 44, train_loss: 0.8687, test_loss: 0.9199, test_f1: 0.5253
 epoch: 45, train_loss: 0.8519, test_loss: 0.9366, test_f1: 0.5259
 epoch: 46, train_loss: 0.8492, test_loss: 0.9398, test_f1: 0.5261
 epoch: 47, train_loss: 0.8457, test_loss: 0.9316, test_f1: 0.5369
 epoch: 48, train_loss: 0.8423, test_loss: 0.9375, test_f1: 0.5217
 epoch: 49, train_loss: 0.8429, test_loss: 0.9251, test_f1: 0.5388
 epoch: 50, train_loss: 0.8466, test_loss: 0.9386, test_f1: 0.5273
 epoch: 51, train_loss: 0.8311, test_loss: 0.9340, test_f1: 0.5316
 epoch: 52, train_loss: 0.8397, test_loss: 0.9276, test_f1: 0.5395
 epoch: 53, train_loss: 0.8371, test_loss: 0.9324, test_f1: 0.5304
 epoch: 54, train_loss: 0.8350, test_loss: 0.9372, test_f1: 0.5395
 epoch: 55, train_loss: 0.8400, test_loss: 0.9365, test_f1: 0.5415
 epoch: 56, train_loss: 0.8353, test_loss: 0.9352, test_f1: 0.5318
 epoch: 57, train_loss: 0.8301, test_loss: 0.9393, test_f1: 0.5286
 epoch: 58, train_loss: 0.8191, test_loss: 0.9404, test_f1: 0.5326
 epoch: 59, train_loss: 0.8219, test_loss: 0.9359, test_f1: 0.5426
 epoch: 60, train_loss: 0.8219, test_loss: 0.9390, test_f1: 0.5455
 epoch: 61, train_loss: 0.8311, test_loss: 0.9415, test_f1: 0.5405
 epoch: 62, train_loss: 0.8141, test_loss: 0.9462, test_f1: 0.5331
 epoch: 63, train_loss: 0.8197, test_loss: 0.9349, test_f1: 0.5367
 epoch: 64, train_loss: 0.8173, test_loss: 0.9362, test_f1: 0.5366
 epoch: 65, train_loss: 0.8237, test_loss: 0.9408, test_f1: 0.5386
 epoch: 66, train_loss: 0.8161, test_loss: 0.9300, test_f1: 0.5367
 epoch: 67, train_loss: 0.8135, test_loss: 0.9384, test_f1: 0.5446
 epoch: 68, train_loss: 0.8196, test_loss: 0.9390, test_f1: 0.5353
 epoch: 69, train_loss: 0.8139, test_loss: 0.9353, test_f1: 0.5418
 epoch: 70, train_loss: 0.8152, test_loss: 0.9305, test_f1: 0.5449
 epoch: 71, train_loss: 0.8013, test_loss: 0.9369, test_f1: 0.5477
 epoch: 72, train_loss: 0.8077, test_loss: 0.9398, test_f1: 0.5373
 epoch: 73, train_loss: 0.8179, test_loss: 0.9378, test_f1: 0.5404
 epoch: 74, train_loss: 0.8141, test_loss: 0.9265, test_f1: 0.5402
 epoch: 75, train_loss: 0.8115, test_loss: 0.9337, test_f1: 0.5447
 epoch: 76, train_loss: 0.8021, test_loss: 0.9407, test_f1: 0.5400
 epoch: 77, train_loss: 0.8132, test_loss: 0.9391, test_f1: 0.5441
 epoch: 78, train_loss: 0.8133, test_loss: 0.9366, test_f1: 0.5527
 epoch: 79, train_loss: 0.8065, test_loss: 0.9439, test_f1: 0.5502
 epoch: 80, train_loss: 0.8037, test_loss: 0.9419, test_f1: 0.5459
 epoch: 81, train_loss: 0.8030, test_loss: 0.9439, test_f1: 0.5509
 epoch: 82, train_loss: 0.7987, test_loss: 0.9447, test_f1: 0.5466
 epoch: 83, train_loss: 0.8088, test_loss: 0.9444, test_f1: 0.5540
 epoch: 84, train_loss: 0.7925, test_loss: 0.9419, test_f1: 0.5489
 epoch: 85, train_loss: 0.8091, test_loss: 0.9447, test_f1: 0.5551
 epoch: 86, train_loss: 0.7952, test_loss: 0.9377, test_f1: 0.5488
 epoch: 87, train_loss: 0.8056, test_loss: 0.9459, test_f1: 0.5500
 epoch: 88, train_loss: 0.7960, test_loss: 0.9374, test_f1: 0.5460
 epoch: 89, train_loss: 0.7973, test_loss: 0.9524, test_f1: 0.5443
 epoch: 90, train_loss: 0.7905, test_loss: 0.9477, test_f1: 0.5569
 epoch: 91, train_loss: 0.7889, test_loss: 0.9484, test_f1: 0.5462
 epoch: 92, train_loss: 0.7950, test_loss: 0.9430, test_f1: 0.5455
 epoch: 93, train_loss: 0.7955, test_loss: 0.9409, test_f1: 0.5507
 epoch: 94, train_loss: 0.7915, test_loss: 0.9459, test_f1: 0.5547
 epoch: 95, train_loss: 0.7860, test_loss: 0.9517, test_f1: 0.5478
 epoch: 96, train_loss: 0.7938, test_loss: 0.9429, test_f1: 0.5487
 epoch: 97, train_loss: 0.7908, test_loss: 0.9456, test_f1: 0.5517
 epoch: 98, train_loss: 0.7853, test_loss: 0.9436, test_f1: 0.5522
 epoch: 99, train_loss: 0.8013, test_loss: 0.9410, test_f1: 0.5618
##################ITERATION #8 ****************************************
 epoch: 0, train_loss: 1.3215, test_loss: 1.1994, test_f1: 0.2755
 epoch: 1, train_loss: 1.1939, test_loss: 1.0972, test_f1: 0.3538
 epoch: 2, train_loss: 1.1607, test_loss: 1.0703, test_f1: 0.3797
 epoch: 3, train_loss: 1.1163, test_loss: 1.0591, test_f1: 0.4340
 epoch: 4, train_loss: 1.0887, test_loss: 1.0380, test_f1: 0.4383
 epoch: 5, train_loss: 1.0786, test_loss: 1.0258, test_f1: 0.4467
 epoch: 6, train_loss: 1.0611, test_loss: 1.0055, test_f1: 0.4624
 epoch: 7, train_loss: 1.0463, test_loss: 0.9973, test_f1: 0.4746
 epoch: 8, train_loss: 1.0401, test_loss: 0.9881, test_f1: 0.4754
 epoch: 9, train_loss: 1.0190, test_loss: 0.9871, test_f1: 0.4718
 epoch: 10, train_loss: 1.0196, test_loss: 0.9791, test_f1: 0.4771
 epoch: 11, train_loss: 0.9996, test_loss: 0.9743, test_f1: 0.4785
 epoch: 12, train_loss: 0.9973, test_loss: 0.9621, test_f1: 0.4749
 epoch: 13, train_loss: 0.9799, test_loss: 0.9587, test_f1: 0.4961
 epoch: 14, train_loss: 0.9814, test_loss: 0.9601, test_f1: 0.4882
 epoch: 15, train_loss: 0.9799, test_loss: 0.9619, test_f1: 0.4989
 epoch: 16, train_loss: 0.9753, test_loss: 0.9659, test_f1: 0.4834
 epoch: 17, train_loss: 0.9569, test_loss: 0.9512, test_f1: 0.4929
 epoch: 18, train_loss: 0.9485, test_loss: 0.9495, test_f1: 0.4847
 epoch: 19, train_loss: 0.9465, test_loss: 0.9544, test_f1: 0.4996
 epoch: 20, train_loss: 0.9403, test_loss: 0.9527, test_f1: 0.4879
 epoch: 21, train_loss: 0.9378, test_loss: 0.9500, test_f1: 0.5137
 epoch: 22, train_loss: 0.9410, test_loss: 0.9340, test_f1: 0.5190
 epoch: 23, train_loss: 0.9303, test_loss: 0.9394, test_f1: 0.5167
 epoch: 24, train_loss: 0.9206, test_loss: 0.9446, test_f1: 0.5169
 epoch: 25, train_loss: 0.9253, test_loss: 0.9496, test_f1: 0.5150
 epoch: 26, train_loss: 0.9118, test_loss: 0.9480, test_f1: 0.5079
 epoch: 27, train_loss: 0.9140, test_loss: 0.9483, test_f1: 0.5087
 epoch: 28, train_loss: 0.9120, test_loss: 0.9347, test_f1: 0.5233
 epoch: 29, train_loss: 0.9012, test_loss: 0.9251, test_f1: 0.5204
 epoch: 30, train_loss: 0.9058, test_loss: 0.9392, test_f1: 0.5251
 epoch: 31, train_loss: 0.8964, test_loss: 0.9446, test_f1: 0.5196
 epoch: 32, train_loss: 0.9072, test_loss: 0.9442, test_f1: 0.5237
 epoch: 33, train_loss: 0.8928, test_loss: 0.9265, test_f1: 0.5277
 epoch: 34, train_loss: 0.8855, test_loss: 0.9268, test_f1: 0.5206
 epoch: 35, train_loss: 0.8859, test_loss: 0.9345, test_f1: 0.5266
 epoch: 36, train_loss: 0.8862, test_loss: 0.9299, test_f1: 0.5322
 epoch: 37, train_loss: 0.8797, test_loss: 0.9389, test_f1: 0.5294
 epoch: 38, train_loss: 0.8852, test_loss: 0.9383, test_f1: 0.5387
 epoch: 39, train_loss: 0.8770, test_loss: 0.9116, test_f1: 0.5296
 epoch: 40, train_loss: 0.8752, test_loss: 0.9381, test_f1: 0.5312
 epoch: 41, train_loss: 0.8760, test_loss: 0.9149, test_f1: 0.5324
 epoch: 42, train_loss: 0.8759, test_loss: 0.9201, test_f1: 0.5297
 epoch: 43, train_loss: 0.8644, test_loss: 0.9242, test_f1: 0.5329
 epoch: 44, train_loss: 0.8589, test_loss: 0.9162, test_f1: 0.5275
 epoch: 45, train_loss: 0.8714, test_loss: 0.9148, test_f1: 0.5271
 epoch: 46, train_loss: 0.8573, test_loss: 0.9179, test_f1: 0.5309
 epoch: 47, train_loss: 0.8477, test_loss: 0.9424, test_f1: 0.5202
 epoch: 48, train_loss: 0.8512, test_loss: 0.8920, test_f1: 0.5352
 epoch: 49, train_loss: 0.8577, test_loss: 0.9180, test_f1: 0.5382
 epoch: 50, train_loss: 0.8585, test_loss: 0.9143, test_f1: 0.5362
 epoch: 51, train_loss: 0.8467, test_loss: 0.9157, test_f1: 0.5352
 epoch: 52, train_loss: 0.8517, test_loss: 0.9105, test_f1: 0.5330
 epoch: 53, train_loss: 0.8454, test_loss: 0.9197, test_f1: 0.5331
 epoch: 54, train_loss: 0.8422, test_loss: 0.9195, test_f1: 0.5413
 epoch: 55, train_loss: 0.8337, test_loss: 0.9137, test_f1: 0.5319
 epoch: 56, train_loss: 0.8485, test_loss: 0.9222, test_f1: 0.5443
 epoch: 57, train_loss: 0.8422, test_loss: 0.9312, test_f1: 0.5356
 epoch: 58, train_loss: 0.8406, test_loss: 0.9296, test_f1: 0.5361
 epoch: 59, train_loss: 0.8351, test_loss: 0.9305, test_f1: 0.5384
 epoch: 60, train_loss: 0.8322, test_loss: 0.9194, test_f1: 0.5400
 epoch: 61, train_loss: 0.8282, test_loss: 0.9314, test_f1: 0.5424
 epoch: 62, train_loss: 0.8299, test_loss: 0.9262, test_f1: 0.5434
 epoch: 63, train_loss: 0.8395, test_loss: 0.9301, test_f1: 0.5478
 epoch: 64, train_loss: 0.8325, test_loss: 0.9288, test_f1: 0.5450
 epoch: 65, train_loss: 0.8348, test_loss: 0.9130, test_f1: 0.5498
 epoch: 66, train_loss: 0.8251, test_loss: 0.9110, test_f1: 0.5466
 epoch: 67, train_loss: 0.8290, test_loss: 0.9340, test_f1: 0.5377
 epoch: 68, train_loss: 0.8242, test_loss: 0.9308, test_f1: 0.5424
 epoch: 69, train_loss: 0.8336, test_loss: 0.9290, test_f1: 0.5456
 epoch: 70, train_loss: 0.8297, test_loss: 0.9177, test_f1: 0.5532
 epoch: 71, train_loss: 0.8196, test_loss: 0.9311, test_f1: 0.5619
 epoch: 72, train_loss: 0.8238, test_loss: 0.9280, test_f1: 0.5488
 epoch: 73, train_loss: 0.8220, test_loss: 0.9112, test_f1: 0.5644
 epoch: 74, train_loss: 0.8155, test_loss: 0.9135, test_f1: 0.5499
 epoch: 75, train_loss: 0.8188, test_loss: 0.9265, test_f1: 0.5474
 epoch: 76, train_loss: 0.8223, test_loss: 0.9172, test_f1: 0.5587
 epoch: 77, train_loss: 0.8261, test_loss: 0.9206, test_f1: 0.5526
 epoch: 78, train_loss: 0.8189, test_loss: 0.9138, test_f1: 0.5548
 epoch: 79, train_loss: 0.8072, test_loss: 0.9369, test_f1: 0.5470
 epoch: 80, train_loss: 0.8097, test_loss: 0.9294, test_f1: 0.5466
 epoch: 81, train_loss: 0.8031, test_loss: 0.9179, test_f1: 0.5561
 epoch: 82, train_loss: 0.8098, test_loss: 0.9149, test_f1: 0.5563
 epoch: 83, train_loss: 0.8205, test_loss: 0.9226, test_f1: 0.5519
 epoch: 84, train_loss: 0.8012, test_loss: 0.9158, test_f1: 0.5498
 epoch: 85, train_loss: 0.8077, test_loss: 0.9124, test_f1: 0.5510
 epoch: 86, train_loss: 0.8173, test_loss: 0.9126, test_f1: 0.5562
 epoch: 87, train_loss: 0.8105, test_loss: 0.9173, test_f1: 0.5539
 epoch: 88, train_loss: 0.8047, test_loss: 0.9245, test_f1: 0.5459
 epoch: 89, train_loss: 0.8125, test_loss: 0.9288, test_f1: 0.5573
 epoch: 90, train_loss: 0.8006, test_loss: 0.9086, test_f1: 0.5502
 epoch: 91, train_loss: 0.7946, test_loss: 0.9283, test_f1: 0.5609
 epoch: 92, train_loss: 0.7970, test_loss: 0.9262, test_f1: 0.5418
 epoch: 93, train_loss: 0.7986, test_loss: 0.9207, test_f1: 0.5500
 epoch: 94, train_loss: 0.8062, test_loss: 0.9147, test_f1: 0.5589
 epoch: 95, train_loss: 0.7929, test_loss: 0.9237, test_f1: 0.5617
 epoch: 96, train_loss: 0.7968, test_loss: 0.9229, test_f1: 0.5521
 epoch: 97, train_loss: 0.7984, test_loss: 0.9201, test_f1: 0.5630
 epoch: 98, train_loss: 0.7946, test_loss: 0.9248, test_f1: 0.5542
 epoch: 99, train_loss: 0.7900, test_loss: 0.9041, test_f1: 0.5610
##################ITERATION #9 ****************************************
 epoch: 0, train_loss: 1.3550, test_loss: 1.1535, test_f1: 0.3291
 epoch: 1, train_loss: 1.1965, test_loss: 1.1002, test_f1: 0.3630
 epoch: 2, train_loss: 1.1451, test_loss: 1.0719, test_f1: 0.3876
 epoch: 3, train_loss: 1.1192, test_loss: 1.0401, test_f1: 0.4108
 epoch: 4, train_loss: 1.0875, test_loss: 1.0255, test_f1: 0.4289
 epoch: 5, train_loss: 1.0713, test_loss: 1.0125, test_f1: 0.4393
 epoch: 6, train_loss: 1.0583, test_loss: 1.0032, test_f1: 0.4292
 epoch: 7, train_loss: 1.0349, test_loss: 0.9922, test_f1: 0.4611
 epoch: 8, train_loss: 1.0281, test_loss: 0.9986, test_f1: 0.4561
 epoch: 9, train_loss: 1.0028, test_loss: 0.9973, test_f1: 0.4756
 epoch: 10, train_loss: 0.9966, test_loss: 0.9902, test_f1: 0.4723
 epoch: 11, train_loss: 0.9788, test_loss: 0.9898, test_f1: 0.4787
 epoch: 12, train_loss: 0.9813, test_loss: 0.9785, test_f1: 0.4917
 epoch: 13, train_loss: 0.9716, test_loss: 0.9715, test_f1: 0.4766
 epoch: 14, train_loss: 0.9667, test_loss: 0.9695, test_f1: 0.4851
 epoch: 15, train_loss: 0.9574, test_loss: 0.9782, test_f1: 0.4934
 epoch: 16, train_loss: 0.9487, test_loss: 0.9683, test_f1: 0.4911
 epoch: 17, train_loss: 0.9438, test_loss: 0.9617, test_f1: 0.4842
 epoch: 18, train_loss: 0.9442, test_loss: 0.9682, test_f1: 0.4810
 epoch: 19, train_loss: 0.9472, test_loss: 0.9601, test_f1: 0.4773
 epoch: 20, train_loss: 0.9339, test_loss: 0.9570, test_f1: 0.4888
 epoch: 21, train_loss: 0.9373, test_loss: 0.9508, test_f1: 0.4895
 epoch: 22, train_loss: 0.9418, test_loss: 0.9467, test_f1: 0.5054
 epoch: 23, train_loss: 0.9328, test_loss: 0.9484, test_f1: 0.5125
 epoch: 24, train_loss: 0.9213, test_loss: 0.9511, test_f1: 0.4927
 epoch: 25, train_loss: 0.9096, test_loss: 0.9441, test_f1: 0.4967
 epoch: 26, train_loss: 0.9119, test_loss: 0.9425, test_f1: 0.5160
 epoch: 27, train_loss: 0.9178, test_loss: 0.9420, test_f1: 0.5037
 epoch: 28, train_loss: 0.9170, test_loss: 0.9362, test_f1: 0.5103
 epoch: 29, train_loss: 0.9108, test_loss: 0.9497, test_f1: 0.5031
 epoch: 30, train_loss: 0.9080, test_loss: 0.9472, test_f1: 0.5089
 epoch: 31, train_loss: 0.8957, test_loss: 0.9290, test_f1: 0.5324
 epoch: 32, train_loss: 0.8883, test_loss: 0.9338, test_f1: 0.5259
 epoch: 33, train_loss: 0.8855, test_loss: 0.9430, test_f1: 0.5241
 epoch: 34, train_loss: 0.8907, test_loss: 0.9291, test_f1: 0.5289
 epoch: 35, train_loss: 0.8815, test_loss: 0.9388, test_f1: 0.5324
 epoch: 36, train_loss: 0.8857, test_loss: 0.9315, test_f1: 0.5372
 epoch: 37, train_loss: 0.8724, test_loss: 0.9289, test_f1: 0.5470
 epoch: 38, train_loss: 0.8708, test_loss: 0.9396, test_f1: 0.5307
 epoch: 39, train_loss: 0.8818, test_loss: 0.9269, test_f1: 0.5456
 epoch: 40, train_loss: 0.8623, test_loss: 0.9259, test_f1: 0.5370
 epoch: 41, train_loss: 0.8608, test_loss: 0.9255, test_f1: 0.5488
 epoch: 42, train_loss: 0.8707, test_loss: 0.9309, test_f1: 0.5514
 epoch: 43, train_loss: 0.8714, test_loss: 0.9273, test_f1: 0.5567
 epoch: 44, train_loss: 0.8479, test_loss: 0.9275, test_f1: 0.5447
 epoch: 45, train_loss: 0.8626, test_loss: 0.9186, test_f1: 0.5545
 epoch: 46, train_loss: 0.8604, test_loss: 0.9198, test_f1: 0.5451
 epoch: 47, train_loss: 0.8511, test_loss: 0.9238, test_f1: 0.5490
 epoch: 48, train_loss: 0.8454, test_loss: 0.9230, test_f1: 0.5463
 epoch: 49, train_loss: 0.8458, test_loss: 0.9217, test_f1: 0.5450
 epoch: 50, train_loss: 0.8516, test_loss: 0.9726, test_f1: 0.5220
 epoch: 51, train_loss: 0.8436, test_loss: 0.9161, test_f1: 0.5529
 epoch: 52, train_loss: 0.8330, test_loss: 0.9280, test_f1: 0.5574
 epoch: 53, train_loss: 0.8363, test_loss: 0.9246, test_f1: 0.5596
 epoch: 54, train_loss: 0.8426, test_loss: 0.9304, test_f1: 0.5591
 epoch: 55, train_loss: 0.8371, test_loss: 0.9176, test_f1: 0.5534
 epoch: 56, train_loss: 0.8325, test_loss: 0.9233, test_f1: 0.5523
 epoch: 57, train_loss: 0.8292, test_loss: 0.9195, test_f1: 0.5463
 epoch: 58, train_loss: 0.8314, test_loss: 0.9234, test_f1: 0.5585
 epoch: 59, train_loss: 0.8305, test_loss: 0.9209, test_f1: 0.5537
 epoch: 60, train_loss: 0.8373, test_loss: 0.9169, test_f1: 0.5526
 epoch: 61, train_loss: 0.8245, test_loss: 0.9160, test_f1: 0.5419
 epoch: 62, train_loss: 0.8287, test_loss: 0.9188, test_f1: 0.5648
 epoch: 63, train_loss: 0.8163, test_loss: 0.9083, test_f1: 0.5570
 epoch: 64, train_loss: 0.8170, test_loss: 0.9076, test_f1: 0.5681
 epoch: 65, train_loss: 0.8270, test_loss: 0.9119, test_f1: 0.5608
 epoch: 66, train_loss: 0.8216, test_loss: 0.9168, test_f1: 0.5645
 epoch: 67, train_loss: 0.8185, test_loss: 0.9104, test_f1: 0.5494
 epoch: 68, train_loss: 0.8204, test_loss: 0.9200, test_f1: 0.5483
 epoch: 69, train_loss: 0.8088, test_loss: 0.9135, test_f1: 0.5677
 epoch: 70, train_loss: 0.8170, test_loss: 0.9126, test_f1: 0.5513
 epoch: 71, train_loss: 0.8108, test_loss: 0.9239, test_f1: 0.5525
 epoch: 72, train_loss: 0.8179, test_loss: 0.9225, test_f1: 0.5529
 epoch: 73, train_loss: 0.8141, test_loss: 0.9281, test_f1: 0.5369
 epoch: 74, train_loss: 0.7985, test_loss: 0.9223, test_f1: 0.5525
 epoch: 75, train_loss: 0.8047, test_loss: 0.9202, test_f1: 0.5566
 epoch: 76, train_loss: 0.8034, test_loss: 0.9122, test_f1: 0.5687
 epoch: 77, train_loss: 0.8043, test_loss: 0.9168, test_f1: 0.5648
 epoch: 78, train_loss: 0.8101, test_loss: 0.9225, test_f1: 0.5384
 epoch: 79, train_loss: 0.8013, test_loss: 0.9146, test_f1: 0.5608
 epoch: 80, train_loss: 0.8031, test_loss: 0.9244, test_f1: 0.5526
 epoch: 81, train_loss: 0.7879, test_loss: 0.9177, test_f1: 0.5636
 epoch: 82, train_loss: 0.7916, test_loss: 0.9133, test_f1: 0.5634
 epoch: 83, train_loss: 0.7984, test_loss: 0.9204, test_f1: 0.5647
 epoch: 84, train_loss: 0.8036, test_loss: 0.9149, test_f1: 0.5691
 epoch: 85, train_loss: 0.7933, test_loss: 0.9136, test_f1: 0.5616
 epoch: 86, train_loss: 0.8148, test_loss: 0.9201, test_f1: 0.5639
 epoch: 87, train_loss: 0.7958, test_loss: 0.9226, test_f1: 0.5706
 epoch: 88, train_loss: 0.7983, test_loss: 0.9176, test_f1: 0.5747
 epoch: 89, train_loss: 0.7917, test_loss: 0.9195, test_f1: 0.5626
 epoch: 90, train_loss: 0.7890, test_loss: 0.9165, test_f1: 0.5583
 epoch: 91, train_loss: 0.7943, test_loss: 0.9339, test_f1: 0.5578
 epoch: 92, train_loss: 0.7815, test_loss: 0.9239, test_f1: 0.5532
 epoch: 93, train_loss: 0.7847, test_loss: 0.9296, test_f1: 0.5656
 epoch: 94, train_loss: 0.7805, test_loss: 0.9142, test_f1: 0.5733
 epoch: 95, train_loss: 0.7752, test_loss: 0.9223, test_f1: 0.5513
 epoch: 96, train_loss: 0.7894, test_loss: 0.9140, test_f1: 0.5718
 epoch: 97, train_loss: 0.7902, test_loss: 0.9150, test_f1: 0.5766
 epoch: 98, train_loss: 0.7855, test_loss: 0.9184, test_f1: 0.5767
 epoch: 99, train_loss: 0.7852, test_loss: 0.9326, test_f1: 0.5652

Training completed in 556.40 seconds
Best F1: 0.5768 at epoch 90
Mean F1 across iterations: 0.5564  0.0180
========================FINAL RESULTS================================
FEGIN weighted F1: 0.5768  0.0180
python main.py --data ltspice_examples --representation component_net --model FEGIN --layers 2 --hiddens 64 --batch_size 64 --lr 0.0001 --emb_size 128 --epochs 100 --save_appendix component_net_L2_H64_BS64_LR0.0001_E128 --no_val
-----



STDERR:
  File "main.py", line 370, in <module>
    main()
  File "main.py", line 254, in main
    dataset = dataset_class(
  File "/home/philip/projects/ltspice_examples_code_repo/Circuit-Completion-Using-GNNs/component_classification_with_link_prediction_head/evaluation/FEGIN/kernel/circuit_datasets.py", line 15, in __init__
    self.data, self.slices = torch.load(self.processed_paths[0])
  File "/home/philip/.local/lib/python3.8/site-packages/torch/serialization.py", line 1040, in load
    warnings.warn(
  File "/usr/lib/python3.8/warnings.py", line 109, in _showwarnmsg
    sw(msg.message, msg.category, msg.filename, msg.lineno,
  File "main.py", line 47, in warn_with_traceback
    traceback.print_stack(file=log)
/home/philip/projects/ltspice_examples_code_repo/Circuit-Completion-Using-GNNs/component_classification_with_link_prediction_head/evaluation/FEGIN/kernel/circuit_datasets.py:15: FutureWarning: You are using `torch.load` with `weights_only=False` (the current default value), which uses the default pickle module implicitly. It is possible to construct malicious pickle data which will execute arbitrary code during unpickling (See https://github.com/pytorch/pytorch/blob/main/SECURITY.md#untrusted-models for more details). In a future release, the default value for `weights_only` will be flipped to `True`. This limits the functions that could be executed during unpickling. Arbitrary objects will no longer be allowed to be loaded via this mode unless they are explicitly allowlisted by the user via `torch.serialization.add_safe_globals`. We recommend you start setting `weights_only=True` for any use case where you don't have full control of the loaded file. Please open an issue on GitHub for any issues related to this experimental feature.
  self.data, self.slices = torch.load(self.processed_paths[0])
