STDOUT:
Results will be saved in /home/philip/projects/llm_inference_code_repo/Circuit-Completion-Using-GNNs/component_classification_with_link_prediction_head/evaluation/FEGIN/results/model_FEGIN_dataset_ltspice_examples
Command line input: python main.py --data ltspice_examples --representation component_pin --model FEGIN --layers 2 --hiddens 128 --batch_size 64 --lr 0.01 --emb_size 512 --epochs 100 --save_appendix component_pin_L2_H128_BS64_LR0.01_E512 --no_val
 is saved.
-----
ltspice_examples - FEGIN
Using 2 layers, 128 hidden units, h = 2
Loading component_pin representation dataset
ENTERED
Training FEGIN on component_pin representation
Train: 3560, Test: 848
##################ITERATION #0 ****************************************
 epoch: 0, train_loss: 1.1415, test_loss: 1.3580, test_f1: 0.3114
 epoch: 1, train_loss: 1.0456, test_loss: 1.0589, test_f1: 0.4646
 epoch: 2, train_loss: 0.9880, test_loss: 1.0214, test_f1: 0.4980
 epoch: 3, train_loss: 0.9503, test_loss: 0.8998, test_f1: 0.5096
 epoch: 4, train_loss: 0.9070, test_loss: 0.8459, test_f1: 0.5222
 epoch: 5, train_loss: 0.8806, test_loss: 0.8787, test_f1: 0.5662
 epoch: 6, train_loss: 0.8836, test_loss: 0.8575, test_f1: 0.5379
 epoch: 7, train_loss: 0.8628, test_loss: 0.9058, test_f1: 0.5158
 epoch: 8, train_loss: 0.8392, test_loss: 0.8353, test_f1: 0.5563
 epoch: 9, train_loss: 0.8265, test_loss: 0.8174, test_f1: 0.5361
 epoch: 10, train_loss: 0.8078, test_loss: 0.8069, test_f1: 0.5424
 epoch: 11, train_loss: 0.7911, test_loss: 0.8152, test_f1: 0.5590
 epoch: 12, train_loss: 0.8001, test_loss: 0.8526, test_f1: 0.5199
 epoch: 13, train_loss: 0.7934, test_loss: 0.7829, test_f1: 0.5724
 epoch: 14, train_loss: 0.7749, test_loss: 0.8604, test_f1: 0.6052
 epoch: 15, train_loss: 0.7592, test_loss: 0.9084, test_f1: 0.5818
 epoch: 16, train_loss: 0.7393, test_loss: 0.7892, test_f1: 0.5848
 epoch: 17, train_loss: 0.7315, test_loss: 1.0868, test_f1: 0.5860
 epoch: 18, train_loss: 0.7531, test_loss: 0.8349, test_f1: 0.5646
 epoch: 19, train_loss: 0.7114, test_loss: 0.7972, test_f1: 0.6433
 epoch: 20, train_loss: 0.6929, test_loss: 1.0456, test_f1: 0.5969
 epoch: 21, train_loss: 0.7191, test_loss: 0.8695, test_f1: 0.6428
 epoch: 22, train_loss: 0.6861, test_loss: 0.8517, test_f1: 0.6213
 epoch: 23, train_loss: 0.6781, test_loss: 0.9445, test_f1: 0.6310
 epoch: 24, train_loss: 0.6839, test_loss: 0.8335, test_f1: 0.6156
 epoch: 25, train_loss: 0.6784, test_loss: 0.8658, test_f1: 0.6245
 epoch: 26, train_loss: 0.6328, test_loss: 0.8029, test_f1: 0.6518
 epoch: 27, train_loss: 0.6610, test_loss: 1.0157, test_f1: 0.6054
 epoch: 28, train_loss: 0.6444, test_loss: 0.8572, test_f1: 0.6187
 epoch: 29, train_loss: 0.6076, test_loss: 0.8783, test_f1: 0.6543
 epoch: 30, train_loss: 0.6013, test_loss: 1.0246, test_f1: 0.6114
 epoch: 31, train_loss: 0.6371, test_loss: 0.8702, test_f1: 0.6434
 epoch: 32, train_loss: 0.5866, test_loss: 1.0515, test_f1: 0.6499
 epoch: 33, train_loss: 0.6294, test_loss: 0.9390, test_f1: 0.5544
 epoch: 34, train_loss: 0.5785, test_loss: 0.7319, test_f1: 0.6683
 epoch: 35, train_loss: 0.5639, test_loss: 1.0895, test_f1: 0.6258
 epoch: 36, train_loss: 0.5871, test_loss: 0.7345, test_f1: 0.6624
 epoch: 37, train_loss: 0.5846, test_loss: 0.8601, test_f1: 0.6549
 epoch: 38, train_loss: 0.5599, test_loss: 0.8617, test_f1: 0.6365
 epoch: 39, train_loss: 0.5684, test_loss: 0.6978, test_f1: 0.6340
 epoch: 40, train_loss: 0.5596, test_loss: 0.7433, test_f1: 0.6470
 epoch: 41, train_loss: 0.5302, test_loss: 0.8224, test_f1: 0.6795
 epoch: 42, train_loss: 0.5098, test_loss: 1.0272, test_f1: 0.6409
 epoch: 43, train_loss: 0.5315, test_loss: 0.7487, test_f1: 0.6192
 epoch: 44, train_loss: 0.5079, test_loss: 0.8239, test_f1: 0.6573
 epoch: 45, train_loss: 0.5215, test_loss: 0.7753, test_f1: 0.6397
 epoch: 46, train_loss: 0.5394, test_loss: 1.0636, test_f1: 0.6464
 epoch: 47, train_loss: 0.4855, test_loss: 0.8939, test_f1: 0.6528
 epoch: 48, train_loss: 0.4973, test_loss: 1.0707, test_f1: 0.6348
 epoch: 49, train_loss: 0.5080, test_loss: 0.8518, test_f1: 0.6390
 epoch: 50, train_loss: 0.4800, test_loss: 0.8369, test_f1: 0.6738
 epoch: 51, train_loss: 0.4389, test_loss: 0.8978, test_f1: 0.6826
 epoch: 52, train_loss: 0.4248, test_loss: 0.8725, test_f1: 0.6567
 epoch: 53, train_loss: 0.4062, test_loss: 1.0413, test_f1: 0.6551
 epoch: 54, train_loss: 0.3832, test_loss: 1.0269, test_f1: 0.6462
 epoch: 55, train_loss: 0.3989, test_loss: 0.9384, test_f1: 0.6740
 epoch: 56, train_loss: 0.3800, test_loss: 1.0840, test_f1: 0.6406
 epoch: 57, train_loss: 0.3729, test_loss: 1.0440, test_f1: 0.6770
 epoch: 58, train_loss: 0.3875, test_loss: 1.0723, test_f1: 0.6352
 epoch: 59, train_loss: 0.3372, test_loss: 1.2198, test_f1: 0.6695
 epoch: 60, train_loss: 0.3684, test_loss: 1.0618, test_f1: 0.6553
 epoch: 61, train_loss: 0.3439, test_loss: 1.1592, test_f1: 0.6497
 epoch: 62, train_loss: 0.3345, test_loss: 1.1275, test_f1: 0.6469
 epoch: 63, train_loss: 0.3402, test_loss: 1.1185, test_f1: 0.6585
 epoch: 64, train_loss: 0.3546, test_loss: 1.1045, test_f1: 0.6729
 epoch: 65, train_loss: 0.3289, test_loss: 0.9173, test_f1: 0.6853
 epoch: 66, train_loss: 0.3198, test_loss: 1.1372, test_f1: 0.6543
 epoch: 67, train_loss: 0.3354, test_loss: 1.0862, test_f1: 0.6568
 epoch: 68, train_loss: 0.3398, test_loss: 0.8738, test_f1: 0.6614
 epoch: 69, train_loss: 0.3401, test_loss: 1.1983, test_f1: 0.6719
 epoch: 70, train_loss: 0.3052, test_loss: 1.1478, test_f1: 0.6591
 epoch: 71, train_loss: 0.3080, test_loss: 1.1424, test_f1: 0.6537
 epoch: 72, train_loss: 0.3290, test_loss: 1.0516, test_f1: 0.6423
 epoch: 73, train_loss: 0.3198, test_loss: 1.0585, test_f1: 0.6396
 epoch: 74, train_loss: 0.3037, test_loss: 1.3154, test_f1: 0.6594
 epoch: 75, train_loss: 0.3076, test_loss: 1.3098, test_f1: 0.6501
 epoch: 76, train_loss: 0.3054, test_loss: 1.1775, test_f1: 0.6742
 epoch: 77, train_loss: 0.2889, test_loss: 1.1118, test_f1: 0.6873
 epoch: 78, train_loss: 0.2936, test_loss: 1.2093, test_f1: 0.6275
 epoch: 79, train_loss: 0.2834, test_loss: 1.0424, test_f1: 0.6882
 epoch: 80, train_loss: 0.2944, test_loss: 1.1638, test_f1: 0.6623
 epoch: 81, train_loss: 0.2901, test_loss: 1.1995, test_f1: 0.6387
 epoch: 82, train_loss: 0.2777, test_loss: 1.1338, test_f1: 0.6666
 epoch: 83, train_loss: 0.2829, test_loss: 1.1783, test_f1: 0.6619
 epoch: 84, train_loss: 0.2914, test_loss: 1.1232, test_f1: 0.6612
 epoch: 85, train_loss: 0.2850, test_loss: 1.1610, test_f1: 0.6367
 epoch: 86, train_loss: 0.2842, test_loss: 1.2907, test_f1: 0.6803
 epoch: 87, train_loss: 0.2684, test_loss: 1.0623, test_f1: 0.7030
 epoch: 88, train_loss: 0.2708, test_loss: 1.1486, test_f1: 0.6656
 epoch: 89, train_loss: 0.2668, test_loss: 1.1021, test_f1: 0.6742
 epoch: 90, train_loss: 0.2579, test_loss: 1.0789, test_f1: 0.6569
 epoch: 91, train_loss: 0.2964, test_loss: 1.1284, test_f1: 0.6503
 epoch: 92, train_loss: 0.2736, test_loss: 1.1637, test_f1: 0.6291
 epoch: 93, train_loss: 0.2482, test_loss: 1.1918, test_f1: 0.6973
 epoch: 94, train_loss: 0.2470, test_loss: 1.2969, test_f1: 0.6580
 epoch: 95, train_loss: 0.2652, test_loss: 1.1561, test_f1: 0.6466
 epoch: 96, train_loss: 0.2831, test_loss: 1.1421, test_f1: 0.6916
 epoch: 97, train_loss: 0.2485, test_loss: 1.2171, test_f1: 0.6459
 epoch: 98, train_loss: 0.2328, test_loss: 1.3847, test_f1: 0.6733
 epoch: 99, train_loss: 0.2264, test_loss: 1.3496, test_f1: 0.6577
##################ITERATION #1 ****************************************
 epoch: 0, train_loss: 1.1835, test_loss: 1.1089, test_f1: 0.4201
 epoch: 1, train_loss: 1.0050, test_loss: 1.0216, test_f1: 0.5409
 epoch: 2, train_loss: 0.9521, test_loss: 1.0043, test_f1: 0.4799
 epoch: 3, train_loss: 0.9268, test_loss: 1.2193, test_f1: 0.4448
 epoch: 4, train_loss: 0.9293, test_loss: 0.9321, test_f1: 0.4940
 epoch: 5, train_loss: 0.9031, test_loss: 1.0320, test_f1: 0.5053
 epoch: 6, train_loss: 0.9045, test_loss: 1.2151, test_f1: 0.4343
 epoch: 7, train_loss: 0.8828, test_loss: 0.9231, test_f1: 0.5644
 epoch: 8, train_loss: 0.8632, test_loss: 1.0571, test_f1: 0.5038
 epoch: 9, train_loss: 0.8294, test_loss: 1.3016, test_f1: 0.5065
 epoch: 10, train_loss: 0.8465, test_loss: 1.0397, test_f1: 0.5510
 epoch: 11, train_loss: 0.8410, test_loss: 0.9286, test_f1: 0.5668
 epoch: 12, train_loss: 0.8117, test_loss: 0.9681, test_f1: 0.5107
 epoch: 13, train_loss: 0.7909, test_loss: 0.9834, test_f1: 0.5743
 epoch: 14, train_loss: 0.7910, test_loss: 0.9839, test_f1: 0.5106
 epoch: 15, train_loss: 0.7920, test_loss: 0.9954, test_f1: 0.5170
 epoch: 16, train_loss: 0.7692, test_loss: 0.9024, test_f1: 0.5988
 epoch: 17, train_loss: 0.7757, test_loss: 0.8873, test_f1: 0.6027
 epoch: 18, train_loss: 0.7545, test_loss: 0.9460, test_f1: 0.5578
 epoch: 19, train_loss: 0.7359, test_loss: 0.9756, test_f1: 0.5718
 epoch: 20, train_loss: 0.7203, test_loss: 1.0393, test_f1: 0.6052
 epoch: 21, train_loss: 0.7417, test_loss: 0.8989, test_f1: 0.6093
 epoch: 22, train_loss: 0.7208, test_loss: 0.9504, test_f1: 0.6352
 epoch: 23, train_loss: 0.6916, test_loss: 0.9842, test_f1: 0.6331
 epoch: 24, train_loss: 0.7070, test_loss: 1.0990, test_f1: 0.6111
 epoch: 25, train_loss: 0.6955, test_loss: 0.9679, test_f1: 0.6493
 epoch: 26, train_loss: 0.6835, test_loss: 1.0910, test_f1: 0.5871
 epoch: 27, train_loss: 0.6518, test_loss: 1.0100, test_f1: 0.6397
 epoch: 28, train_loss: 0.6539, test_loss: 1.2748, test_f1: 0.6163
 epoch: 29, train_loss: 0.6426, test_loss: 0.8640, test_f1: 0.6449
 epoch: 30, train_loss: 0.6661, test_loss: 1.1714, test_f1: 0.6036
 epoch: 31, train_loss: 0.6272, test_loss: 1.1228, test_f1: 0.6496
 epoch: 32, train_loss: 0.6361, test_loss: 1.3537, test_f1: 0.5436
 epoch: 33, train_loss: 0.6093, test_loss: 1.2943, test_f1: 0.6406
 epoch: 34, train_loss: 0.6463, test_loss: 1.2106, test_f1: 0.6024
 epoch: 35, train_loss: 0.5945, test_loss: 1.0444, test_f1: 0.6044
 epoch: 36, train_loss: 0.6450, test_loss: 1.0494, test_f1: 0.6548
 epoch: 37, train_loss: 0.5972, test_loss: 1.0837, test_f1: 0.6421
 epoch: 38, train_loss: 0.6178, test_loss: 0.9800, test_f1: 0.6494
 epoch: 39, train_loss: 0.6061, test_loss: 1.3256, test_f1: 0.6058
 epoch: 40, train_loss: 0.6027, test_loss: 0.9868, test_f1: 0.6033
 epoch: 41, train_loss: 0.6109, test_loss: 1.2289, test_f1: 0.6072
 epoch: 42, train_loss: 0.5949, test_loss: 1.0241, test_f1: 0.6682
 epoch: 43, train_loss: 0.5786, test_loss: 0.9902, test_f1: 0.6571
 epoch: 44, train_loss: 0.5591, test_loss: 1.1166, test_f1: 0.6271
 epoch: 45, train_loss: 0.5744, test_loss: 1.2821, test_f1: 0.6502
 epoch: 46, train_loss: 0.5874, test_loss: 1.1869, test_f1: 0.6407
 epoch: 47, train_loss: 0.5369, test_loss: 1.3206, test_f1: 0.6592
 epoch: 48, train_loss: 0.5344, test_loss: 1.4414, test_f1: 0.6121
 epoch: 49, train_loss: 0.5467, test_loss: 1.3780, test_f1: 0.6155
 epoch: 50, train_loss: 0.5295, test_loss: 1.1517, test_f1: 0.6528
 epoch: 51, train_loss: 0.4876, test_loss: 1.2524, test_f1: 0.6509
 epoch: 52, train_loss: 0.4468, test_loss: 1.1917, test_f1: 0.6369
 epoch: 53, train_loss: 0.4473, test_loss: 1.2760, test_f1: 0.6623
 epoch: 54, train_loss: 0.4366, test_loss: 1.1436, test_f1: 0.6914
 epoch: 55, train_loss: 0.4334, test_loss: 1.3462, test_f1: 0.6501
 epoch: 56, train_loss: 0.4346, test_loss: 1.4152, test_f1: 0.6678
 epoch: 57, train_loss: 0.4227, test_loss: 1.3891, test_f1: 0.6283
 epoch: 58, train_loss: 0.4136, test_loss: 1.3800, test_f1: 0.6623
 epoch: 59, train_loss: 0.4148, test_loss: 1.1809, test_f1: 0.6657
 epoch: 60, train_loss: 0.4060, test_loss: 1.3222, test_f1: 0.6416
 epoch: 61, train_loss: 0.4102, test_loss: 1.2431, test_f1: 0.6732
 epoch: 62, train_loss: 0.4070, test_loss: 1.4911, test_f1: 0.6468
 epoch: 63, train_loss: 0.3921, test_loss: 1.4105, test_f1: 0.6702
 epoch: 64, train_loss: 0.3864, test_loss: 1.6770, test_f1: 0.6794
 epoch: 65, train_loss: 0.3857, test_loss: 1.3087, test_f1: 0.6987
 epoch: 66, train_loss: 0.3992, test_loss: 1.3541, test_f1: 0.6718
 epoch: 67, train_loss: 0.3670, test_loss: 1.6009, test_f1: 0.6510
 epoch: 68, train_loss: 0.3794, test_loss: 1.5307, test_f1: 0.6577
 epoch: 69, train_loss: 0.3757, test_loss: 1.6577, test_f1: 0.6668
 epoch: 70, train_loss: 0.3734, test_loss: 1.4520, test_f1: 0.6962
 epoch: 71, train_loss: 0.3589, test_loss: 1.7359, test_f1: 0.6922
 epoch: 72, train_loss: 0.3569, test_loss: 1.7370, test_f1: 0.6893
 epoch: 73, train_loss: 0.3530, test_loss: 1.8025, test_f1: 0.6348
 epoch: 74, train_loss: 0.3551, test_loss: 1.5557, test_f1: 0.6547
 epoch: 75, train_loss: 0.3594, test_loss: 1.3248, test_f1: 0.6390
 epoch: 76, train_loss: 0.3453, test_loss: 1.4798, test_f1: 0.6567
 epoch: 77, train_loss: 0.3477, test_loss: 1.6376, test_f1: 0.6799
 epoch: 78, train_loss: 0.3467, test_loss: 1.4529, test_f1: 0.6372
 epoch: 79, train_loss: 0.3329, test_loss: 1.6593, test_f1: 0.6923
 epoch: 80, train_loss: 0.3592, test_loss: 1.3886, test_f1: 0.6336
 epoch: 81, train_loss: 0.3393, test_loss: 1.4330, test_f1: 0.6730
 epoch: 82, train_loss: 0.3385, test_loss: 1.8882, test_f1: 0.6494
 epoch: 83, train_loss: 0.3423, test_loss: 1.6266, test_f1: 0.6733
 epoch: 84, train_loss: 0.3267, test_loss: 1.5871, test_f1: 0.6374
 epoch: 85, train_loss: 0.3309, test_loss: 1.6588, test_f1: 0.6618
 epoch: 86, train_loss: 0.3082, test_loss: 1.6250, test_f1: 0.6667
 epoch: 87, train_loss: 0.3083, test_loss: 1.6138, test_f1: 0.6944
 epoch: 88, train_loss: 0.3244, test_loss: 1.6970, test_f1: 0.6782
 epoch: 89, train_loss: 0.3168, test_loss: 1.8794, test_f1: 0.6649
 epoch: 90, train_loss: 0.2914, test_loss: 1.6895, test_f1: 0.6856
 epoch: 91, train_loss: 0.3262, test_loss: 1.8972, test_f1: 0.6472
 epoch: 92, train_loss: 0.2988, test_loss: 1.7994, test_f1: 0.6804
 epoch: 93, train_loss: 0.3147, test_loss: 1.4840, test_f1: 0.6747
 epoch: 94, train_loss: 0.3064, test_loss: 1.7779, test_f1: 0.6724
 epoch: 95, train_loss: 0.2861, test_loss: 1.6966, test_f1: 0.6392
 epoch: 96, train_loss: 0.3308, test_loss: 1.7031, test_f1: 0.6710
 epoch: 97, train_loss: 0.3340, test_loss: 2.1463, test_f1: 0.6475
 epoch: 98, train_loss: 0.3190, test_loss: 1.9738, test_f1: 0.6715
 epoch: 99, train_loss: 0.3006, test_loss: 1.7595, test_f1: 0.6834
##################ITERATION #2 ****************************************
 epoch: 0, train_loss: 1.2245, test_loss: 2.5152, test_f1: 0.1756
 epoch: 1, train_loss: 1.0375, test_loss: 1.0816, test_f1: 0.4694
 epoch: 2, train_loss: 1.0059, test_loss: 1.0259, test_f1: 0.4441
 epoch: 3, train_loss: 0.9710, test_loss: 1.0083, test_f1: 0.5545
 epoch: 4, train_loss: 0.9369, test_loss: 0.9932, test_f1: 0.4681
 epoch: 5, train_loss: 0.9224, test_loss: 0.9626, test_f1: 0.5361
 epoch: 6, train_loss: 0.8993, test_loss: 1.0460, test_f1: 0.4817
 epoch: 7, train_loss: 0.9111, test_loss: 0.9611, test_f1: 0.4999
 epoch: 8, train_loss: 0.8796, test_loss: 0.9826, test_f1: 0.5023
 epoch: 9, train_loss: 0.8627, test_loss: 1.0122, test_f1: 0.4804
 epoch: 10, train_loss: 0.8495, test_loss: 0.9251, test_f1: 0.5370
 epoch: 11, train_loss: 0.8347, test_loss: 0.9688, test_f1: 0.5364
 epoch: 12, train_loss: 0.8136, test_loss: 1.3445, test_f1: 0.4270
 epoch: 13, train_loss: 0.7958, test_loss: 0.9225, test_f1: 0.5029
 epoch: 14, train_loss: 0.7939, test_loss: 0.9315, test_f1: 0.5453
 epoch: 15, train_loss: 0.7786, test_loss: 1.0784, test_f1: 0.5604
 epoch: 16, train_loss: 0.7544, test_loss: 1.2200, test_f1: 0.5119
 epoch: 17, train_loss: 0.7824, test_loss: 0.9710, test_f1: 0.5387
 epoch: 18, train_loss: 0.7458, test_loss: 0.9260, test_f1: 0.6153
 epoch: 19, train_loss: 0.7491, test_loss: 0.9780, test_f1: 0.5578
 epoch: 20, train_loss: 0.7123, test_loss: 0.8967, test_f1: 0.5777
 epoch: 21, train_loss: 0.7208, test_loss: 1.0820, test_f1: 0.6113
 epoch: 22, train_loss: 0.7007, test_loss: 1.0092, test_f1: 0.5759
 epoch: 23, train_loss: 0.7287, test_loss: 0.9469, test_f1: 0.5835
 epoch: 24, train_loss: 0.6970, test_loss: 0.9669, test_f1: 0.6334
 epoch: 25, train_loss: 0.6724, test_loss: 0.8574, test_f1: 0.5886
 epoch: 26, train_loss: 0.7013, test_loss: 0.8973, test_f1: 0.6114
 epoch: 27, train_loss: 0.6577, test_loss: 1.0435, test_f1: 0.6167
 epoch: 28, train_loss: 0.6617, test_loss: 0.9101, test_f1: 0.6028
 epoch: 29, train_loss: 0.6508, test_loss: 1.0668, test_f1: 0.5609
 epoch: 30, train_loss: 0.6414, test_loss: 1.0022, test_f1: 0.6353
 epoch: 31, train_loss: 0.6595, test_loss: 1.0542, test_f1: 0.6433
 epoch: 32, train_loss: 0.6484, test_loss: 0.9707, test_f1: 0.5999
 epoch: 33, train_loss: 0.6343, test_loss: 1.2428, test_f1: 0.5904
 epoch: 34, train_loss: 0.5932, test_loss: 1.1307, test_f1: 0.6126
 epoch: 35, train_loss: 0.6084, test_loss: 1.0149, test_f1: 0.6168
 epoch: 36, train_loss: 0.6351, test_loss: 1.0843, test_f1: 0.5717
 epoch: 37, train_loss: 0.6262, test_loss: 1.3485, test_f1: 0.5637
 epoch: 38, train_loss: 0.5877, test_loss: 1.0331, test_f1: 0.6393
 epoch: 39, train_loss: 0.6050, test_loss: 1.1142, test_f1: 0.6143
 epoch: 40, train_loss: 0.5838, test_loss: 0.9517, test_f1: 0.6157
 epoch: 41, train_loss: 0.5854, test_loss: 1.1204, test_f1: 0.6399
 epoch: 42, train_loss: 0.5683, test_loss: 1.0798, test_f1: 0.6600
 epoch: 43, train_loss: 0.5478, test_loss: 1.1061, test_f1: 0.6116
 epoch: 44, train_loss: 0.5565, test_loss: 1.2885, test_f1: 0.6206
 epoch: 45, train_loss: 0.5626, test_loss: 0.9954, test_f1: 0.6348
 epoch: 46, train_loss: 0.5373, test_loss: 1.2379, test_f1: 0.6333
 epoch: 47, train_loss: 0.5527, test_loss: 1.0977, test_f1: 0.6418
 epoch: 48, train_loss: 0.5555, test_loss: 0.9050, test_f1: 0.6691
 epoch: 49, train_loss: 0.5432, test_loss: 1.2222, test_f1: 0.5920
 epoch: 50, train_loss: 0.5314, test_loss: 1.1145, test_f1: 0.6258
 epoch: 51, train_loss: 0.4748, test_loss: 1.0831, test_f1: 0.6764
 epoch: 52, train_loss: 0.4554, test_loss: 1.2914, test_f1: 0.6400
 epoch: 53, train_loss: 0.4455, test_loss: 1.0900, test_f1: 0.6653
 epoch: 54, train_loss: 0.4400, test_loss: 1.1549, test_f1: 0.6702
 epoch: 55, train_loss: 0.4328, test_loss: 1.1057, test_f1: 0.6602
 epoch: 56, train_loss: 0.4429, test_loss: 1.2117, test_f1: 0.6498
 epoch: 57, train_loss: 0.4098, test_loss: 1.3004, test_f1: 0.6525
 epoch: 58, train_loss: 0.3984, test_loss: 1.1382, test_f1: 0.6517
 epoch: 59, train_loss: 0.4240, test_loss: 1.2508, test_f1: 0.6755
 epoch: 60, train_loss: 0.4081, test_loss: 1.3227, test_f1: 0.6381
 epoch: 61, train_loss: 0.3992, test_loss: 1.2064, test_f1: 0.6717
 epoch: 62, train_loss: 0.3857, test_loss: 1.3606, test_f1: 0.6551
 epoch: 63, train_loss: 0.3889, test_loss: 1.1455, test_f1: 0.6743
 epoch: 64, train_loss: 0.3817, test_loss: 1.1486, test_f1: 0.6391
 epoch: 65, train_loss: 0.3839, test_loss: 1.2321, test_f1: 0.6627
 epoch: 66, train_loss: 0.3827, test_loss: 1.3901, test_f1: 0.6504
 epoch: 67, train_loss: 0.4065, test_loss: 1.2098, test_f1: 0.6800
 epoch: 68, train_loss: 0.3743, test_loss: 1.3352, test_f1: 0.6575
 epoch: 69, train_loss: 0.3786, test_loss: 1.4168, test_f1: 0.6426
 epoch: 70, train_loss: 0.3784, test_loss: 1.3285, test_f1: 0.6367
 epoch: 71, train_loss: 0.3567, test_loss: 1.3448, test_f1: 0.6449
 epoch: 72, train_loss: 0.3697, test_loss: 1.5184, test_f1: 0.6362
 epoch: 73, train_loss: 0.3643, test_loss: 1.3343, test_f1: 0.6625
 epoch: 74, train_loss: 0.3616, test_loss: 1.3450, test_f1: 0.6623
 epoch: 75, train_loss: 0.3564, test_loss: 1.4019, test_f1: 0.6553
 epoch: 76, train_loss: 0.3545, test_loss: 1.3104, test_f1: 0.6495
 epoch: 77, train_loss: 0.3609, test_loss: 1.4187, test_f1: 0.6500
 epoch: 78, train_loss: 0.3499, test_loss: 1.2143, test_f1: 0.6689
 epoch: 79, train_loss: 0.3268, test_loss: 1.3337, test_f1: 0.6479
 epoch: 80, train_loss: 0.3696, test_loss: 1.3310, test_f1: 0.6638
 epoch: 81, train_loss: 0.3616, test_loss: 1.3702, test_f1: 0.6523
 epoch: 82, train_loss: 0.3310, test_loss: 1.3674, test_f1: 0.7068
 epoch: 83, train_loss: 0.3478, test_loss: 1.4866, test_f1: 0.6477
 epoch: 84, train_loss: 0.3072, test_loss: 1.3795, test_f1: 0.6991
 epoch: 85, train_loss: 0.3310, test_loss: 1.3678, test_f1: 0.6854
 epoch: 86, train_loss: 0.3221, test_loss: 1.3938, test_f1: 0.6814
 epoch: 87, train_loss: 0.3165, test_loss: 1.4267, test_f1: 0.6582
 epoch: 88, train_loss: 0.3111, test_loss: 1.4504, test_f1: 0.6861
 epoch: 89, train_loss: 0.3012, test_loss: 1.5359, test_f1: 0.6442
 epoch: 90, train_loss: 0.3000, test_loss: 1.4884, test_f1: 0.6426
 epoch: 91, train_loss: 0.3267, test_loss: 1.3864, test_f1: 0.6723
 epoch: 92, train_loss: 0.2871, test_loss: 1.3739, test_f1: 0.6825
 epoch: 93, train_loss: 0.3252, test_loss: 1.2984, test_f1: 0.6752
 epoch: 94, train_loss: 0.3065, test_loss: 1.3512, test_f1: 0.6590
 epoch: 95, train_loss: 0.3175, test_loss: 1.3273, test_f1: 0.6784
 epoch: 96, train_loss: 0.2979, test_loss: 1.6507, test_f1: 0.6709
 epoch: 97, train_loss: 0.3051, test_loss: 1.4561, test_f1: 0.6740
 epoch: 98, train_loss: 0.2979, test_loss: 1.5633, test_f1: 0.6887
 epoch: 99, train_loss: 0.3112, test_loss: 1.5525, test_f1: 0.6551
##################ITERATION #3 ****************************************
 epoch: 0, train_loss: 1.2396, test_loss: 1.2100, test_f1: 0.4880
 epoch: 1, train_loss: 1.0305, test_loss: 1.0755, test_f1: 0.4792
 epoch: 2, train_loss: 0.9780, test_loss: 1.1886, test_f1: 0.3907
 epoch: 3, train_loss: 0.9599, test_loss: 1.1322, test_f1: 0.4755
 epoch: 4, train_loss: 0.9351, test_loss: 0.9940, test_f1: 0.4775
 epoch: 5, train_loss: 0.9187, test_loss: 1.3025, test_f1: 0.4733
 epoch: 6, train_loss: 0.9090, test_loss: 1.0021, test_f1: 0.5196
 epoch: 7, train_loss: 0.8780, test_loss: 0.9861, test_f1: 0.5113
 epoch: 8, train_loss: 0.8688, test_loss: 0.9062, test_f1: 0.5439
 epoch: 9, train_loss: 0.8464, test_loss: 0.9467, test_f1: 0.5188
 epoch: 10, train_loss: 0.8372, test_loss: 0.9014, test_f1: 0.5337
 epoch: 11, train_loss: 0.8179, test_loss: 0.9119, test_f1: 0.5530
 epoch: 12, train_loss: 0.7995, test_loss: 1.0641, test_f1: 0.5329
 epoch: 13, train_loss: 0.8114, test_loss: 1.1055, test_f1: 0.5237
 epoch: 14, train_loss: 0.7903, test_loss: 0.9282, test_f1: 0.5571
 epoch: 15, train_loss: 0.7782, test_loss: 0.8574, test_f1: 0.5471
 epoch: 16, train_loss: 0.7962, test_loss: 0.8254, test_f1: 0.5446
 epoch: 17, train_loss: 0.7466, test_loss: 0.8489, test_f1: 0.6014
 epoch: 18, train_loss: 0.7581, test_loss: 0.8663, test_f1: 0.5836
 epoch: 19, train_loss: 0.7582, test_loss: 0.8826, test_f1: 0.5408
 epoch: 20, train_loss: 0.7497, test_loss: 0.8779, test_f1: 0.5230
 epoch: 21, train_loss: 0.7079, test_loss: 1.0258, test_f1: 0.5827
 epoch: 22, train_loss: 0.7420, test_loss: 0.9207, test_f1: 0.5553
 epoch: 23, train_loss: 0.7204, test_loss: 1.0665, test_f1: 0.6087
 epoch: 24, train_loss: 0.7071, test_loss: 1.2823, test_f1: 0.5988
 epoch: 25, train_loss: 0.7269, test_loss: 1.0939, test_f1: 0.5313
 epoch: 26, train_loss: 0.6970, test_loss: 1.2634, test_f1: 0.5561
 epoch: 27, train_loss: 0.7108, test_loss: 1.0321, test_f1: 0.5895
 epoch: 28, train_loss: 0.6832, test_loss: 0.9534, test_f1: 0.5739
 epoch: 29, train_loss: 0.6851, test_loss: 1.0038, test_f1: 0.5553
 epoch: 30, train_loss: 0.6716, test_loss: 0.9806, test_f1: 0.5835
 epoch: 31, train_loss: 0.6873, test_loss: 1.0119, test_f1: 0.6294
 epoch: 32, train_loss: 0.6573, test_loss: 1.0515, test_f1: 0.5813
 epoch: 33, train_loss: 0.6295, test_loss: 1.1958, test_f1: 0.6132
 epoch: 34, train_loss: 0.6560, test_loss: 0.9797, test_f1: 0.6143
 epoch: 35, train_loss: 0.6721, test_loss: 0.8374, test_f1: 0.5908
 epoch: 36, train_loss: 0.6475, test_loss: 0.9099, test_f1: 0.5930
 epoch: 37, train_loss: 0.6101, test_loss: 0.9449, test_f1: 0.6111
 epoch: 38, train_loss: 0.6184, test_loss: 0.9412, test_f1: 0.6135
 epoch: 39, train_loss: 0.6024, test_loss: 0.9751, test_f1: 0.5903
 epoch: 40, train_loss: 0.6159, test_loss: 0.7698, test_f1: 0.6332
 epoch: 41, train_loss: 0.5856, test_loss: 0.9525, test_f1: 0.6457
 epoch: 42, train_loss: 0.5877, test_loss: 0.8980, test_f1: 0.6190
 epoch: 43, train_loss: 0.6096, test_loss: 1.2825, test_f1: 0.5364
 epoch: 44, train_loss: 0.6133, test_loss: 0.9015, test_f1: 0.6538
 epoch: 45, train_loss: 0.6105, test_loss: 0.8508, test_f1: 0.6034
 epoch: 46, train_loss: 0.6020, test_loss: 0.9981, test_f1: 0.6264
 epoch: 47, train_loss: 0.5718, test_loss: 1.0457, test_f1: 0.6346
 epoch: 48, train_loss: 0.5706, test_loss: 0.8698, test_f1: 0.6531
 epoch: 49, train_loss: 0.5722, test_loss: 0.8632, test_f1: 0.6533
 epoch: 50, train_loss: 0.5791, test_loss: 0.9573, test_f1: 0.6250
 epoch: 51, train_loss: 0.5260, test_loss: 0.9677, test_f1: 0.6546
 epoch: 52, train_loss: 0.5018, test_loss: 0.9338, test_f1: 0.6836
 epoch: 53, train_loss: 0.4866, test_loss: 0.9022, test_f1: 0.6643
 epoch: 54, train_loss: 0.4799, test_loss: 1.0040, test_f1: 0.6799
 epoch: 55, train_loss: 0.4719, test_loss: 0.8965, test_f1: 0.6775
 epoch: 56, train_loss: 0.4632, test_loss: 1.0004, test_f1: 0.6594
 epoch: 57, train_loss: 0.4572, test_loss: 1.0228, test_f1: 0.6396
 epoch: 58, train_loss: 0.4693, test_loss: 1.0146, test_f1: 0.6772
 epoch: 59, train_loss: 0.4533, test_loss: 0.9997, test_f1: 0.6456
 epoch: 60, train_loss: 0.4442, test_loss: 1.0165, test_f1: 0.6544
 epoch: 61, train_loss: 0.4595, test_loss: 0.8865, test_f1: 0.6583
 epoch: 62, train_loss: 0.4502, test_loss: 1.0882, test_f1: 0.6565
 epoch: 63, train_loss: 0.4521, test_loss: 0.9421, test_f1: 0.6503
 epoch: 64, train_loss: 0.4279, test_loss: 1.1432, test_f1: 0.6630
 epoch: 65, train_loss: 0.4289, test_loss: 0.9255, test_f1: 0.6804
 epoch: 66, train_loss: 0.4295, test_loss: 0.9644, test_f1: 0.6500
 epoch: 67, train_loss: 0.4093, test_loss: 1.0871, test_f1: 0.6574
 epoch: 68, train_loss: 0.4274, test_loss: 1.0807, test_f1: 0.6648
 epoch: 69, train_loss: 0.4004, test_loss: 0.9340, test_f1: 0.6752
 epoch: 70, train_loss: 0.4037, test_loss: 0.9448, test_f1: 0.6645
 epoch: 71, train_loss: 0.4102, test_loss: 0.8916, test_f1: 0.6898
 epoch: 72, train_loss: 0.3979, test_loss: 0.9823, test_f1: 0.6716
 epoch: 73, train_loss: 0.3893, test_loss: 1.0735, test_f1: 0.6744
 epoch: 74, train_loss: 0.3935, test_loss: 1.0404, test_f1: 0.6735
 epoch: 75, train_loss: 0.3977, test_loss: 1.0147, test_f1: 0.6875
 epoch: 76, train_loss: 0.3976, test_loss: 1.0354, test_f1: 0.6907
 epoch: 77, train_loss: 0.3834, test_loss: 0.9288, test_f1: 0.6798
 epoch: 78, train_loss: 0.3739, test_loss: 0.9322, test_f1: 0.6747
 epoch: 79, train_loss: 0.4080, test_loss: 0.8145, test_f1: 0.6969
 epoch: 80, train_loss: 0.3907, test_loss: 0.9947, test_f1: 0.6774
 epoch: 81, train_loss: 0.3562, test_loss: 0.9384, test_f1: 0.6650
 epoch: 82, train_loss: 0.3637, test_loss: 0.8684, test_f1: 0.7000
 epoch: 83, train_loss: 0.3726, test_loss: 1.1785, test_f1: 0.6902
 epoch: 84, train_loss: 0.3608, test_loss: 0.9892, test_f1: 0.6761
 epoch: 85, train_loss: 0.3582, test_loss: 1.1831, test_f1: 0.6692
 epoch: 86, train_loss: 0.3758, test_loss: 0.9092, test_f1: 0.6880
 epoch: 87, train_loss: 0.3767, test_loss: 1.0575, test_f1: 0.6989
 epoch: 88, train_loss: 0.3633, test_loss: 0.9744, test_f1: 0.6628
 epoch: 89, train_loss: 0.3449, test_loss: 1.1413, test_f1: 0.6873
 epoch: 90, train_loss: 0.3370, test_loss: 1.1658, test_f1: 0.6669
 epoch: 91, train_loss: 0.3273, test_loss: 1.0606, test_f1: 0.6596
 epoch: 92, train_loss: 0.3636, test_loss: 0.8451, test_f1: 0.6799
 epoch: 93, train_loss: 0.3406, test_loss: 0.8696, test_f1: 0.6892
 epoch: 94, train_loss: 0.3467, test_loss: 1.0419, test_f1: 0.6563
 epoch: 95, train_loss: 0.3500, test_loss: 0.9589, test_f1: 0.7002
 epoch: 96, train_loss: 0.3411, test_loss: 0.9731, test_f1: 0.7024
 epoch: 97, train_loss: 0.3446, test_loss: 0.9566, test_f1: 0.6875
 epoch: 98, train_loss: 0.3458, test_loss: 1.0025, test_f1: 0.6760
 epoch: 99, train_loss: 0.3397, test_loss: 0.9961, test_f1: 0.6665
##################ITERATION #4 ****************************************
 epoch: 0, train_loss: 1.1832, test_loss: 1.3791, test_f1: 0.4604
 epoch: 1, train_loss: 0.9839, test_loss: 1.0151, test_f1: 0.4312
 epoch: 2, train_loss: 0.9379, test_loss: 0.9127, test_f1: 0.5140
 epoch: 3, train_loss: 0.9064, test_loss: 0.9832, test_f1: 0.5043
 epoch: 4, train_loss: 0.8967, test_loss: 1.0427, test_f1: 0.4889
 epoch: 5, train_loss: 0.8745, test_loss: 1.0280, test_f1: 0.4758
 epoch: 6, train_loss: 0.8796, test_loss: 1.1113, test_f1: 0.4712
 epoch: 7, train_loss: 0.8703, test_loss: 0.9685, test_f1: 0.5267
 epoch: 8, train_loss: 0.8487, test_loss: 1.0079, test_f1: 0.4777
 epoch: 9, train_loss: 0.8431, test_loss: 0.9459, test_f1: 0.5074
 epoch: 10, train_loss: 0.8225, test_loss: 1.0838, test_f1: 0.5054
 epoch: 11, train_loss: 0.8127, test_loss: 0.8924, test_f1: 0.5248
 epoch: 12, train_loss: 0.8181, test_loss: 1.3309, test_f1: 0.4592
 epoch: 13, train_loss: 0.8184, test_loss: 0.9606, test_f1: 0.5059
 epoch: 14, train_loss: 0.8041, test_loss: 1.2287, test_f1: 0.4922
 epoch: 15, train_loss: 0.7949, test_loss: 1.0163, test_f1: 0.5309
 epoch: 16, train_loss: 0.7738, test_loss: 1.4946, test_f1: 0.4306
 epoch: 17, train_loss: 0.7834, test_loss: 1.1619, test_f1: 0.4816
 epoch: 18, train_loss: 0.7741, test_loss: 0.9843, test_f1: 0.5642
 epoch: 19, train_loss: 0.7498, test_loss: 1.1507, test_f1: 0.5123
 epoch: 20, train_loss: 0.7669, test_loss: 0.8884, test_f1: 0.5287
 epoch: 21, train_loss: 0.7437, test_loss: 1.0378, test_f1: 0.5998
 epoch: 22, train_loss: 0.7266, test_loss: 0.9736, test_f1: 0.5650
 epoch: 23, train_loss: 0.7175, test_loss: 0.9882, test_f1: 0.5848
 epoch: 24, train_loss: 0.7002, test_loss: 0.9358, test_f1: 0.5744
 epoch: 25, train_loss: 0.7011, test_loss: 1.0652, test_f1: 0.5126
 epoch: 26, train_loss: 0.6891, test_loss: 0.9918, test_f1: 0.6036
 epoch: 27, train_loss: 0.6811, test_loss: 0.9213, test_f1: 0.5805
 epoch: 28, train_loss: 0.6680, test_loss: 1.2035, test_f1: 0.6388
 epoch: 29, train_loss: 0.6697, test_loss: 1.0069, test_f1: 0.6244
 epoch: 30, train_loss: 0.6670, test_loss: 1.0563, test_f1: 0.5801
 epoch: 31, train_loss: 0.6338, test_loss: 1.0231, test_f1: 0.5672
 epoch: 32, train_loss: 0.6504, test_loss: 0.9024, test_f1: 0.5933
 epoch: 33, train_loss: 0.6483, test_loss: 1.3497, test_f1: 0.5131
 epoch: 34, train_loss: 0.6431, test_loss: 0.9335, test_f1: 0.6021
 epoch: 35, train_loss: 0.6271, test_loss: 1.0027, test_f1: 0.6548
 epoch: 36, train_loss: 0.6171, test_loss: 1.2134, test_f1: 0.5793
 epoch: 37, train_loss: 0.6126, test_loss: 1.0766, test_f1: 0.6221
 epoch: 38, train_loss: 0.6165, test_loss: 1.0469, test_f1: 0.6263
 epoch: 39, train_loss: 0.6181, test_loss: 0.9218, test_f1: 0.5943
 epoch: 40, train_loss: 0.6029, test_loss: 1.0324, test_f1: 0.5948
 epoch: 41, train_loss: 0.5771, test_loss: 1.2051, test_f1: 0.6109
 epoch: 42, train_loss: 0.5849, test_loss: 1.0202, test_f1: 0.5994
 epoch: 43, train_loss: 0.5589, test_loss: 0.9617, test_f1: 0.5853
 epoch: 44, train_loss: 0.5697, test_loss: 1.1399, test_f1: 0.6099
 epoch: 45, train_loss: 0.5905, test_loss: 1.2041, test_f1: 0.6366
 epoch: 46, train_loss: 0.5758, test_loss: 0.8178, test_f1: 0.6192
 epoch: 47, train_loss: 0.5639, test_loss: 1.1562, test_f1: 0.6000
 epoch: 48, train_loss: 0.5844, test_loss: 1.1772, test_f1: 0.5917
 epoch: 49, train_loss: 0.5669, test_loss: 0.9748, test_f1: 0.6001
 epoch: 50, train_loss: 0.5723, test_loss: 0.8594, test_f1: 0.6286
 epoch: 51, train_loss: 0.4861, test_loss: 1.0332, test_f1: 0.6732
 epoch: 52, train_loss: 0.4868, test_loss: 1.1449, test_f1: 0.6649
 epoch: 53, train_loss: 0.4712, test_loss: 1.1067, test_f1: 0.6505
 epoch: 54, train_loss: 0.4412, test_loss: 1.2464, test_f1: 0.6633
 epoch: 55, train_loss: 0.4560, test_loss: 1.0909, test_f1: 0.6478
 epoch: 56, train_loss: 0.4429, test_loss: 1.0762, test_f1: 0.6680
 epoch: 57, train_loss: 0.4174, test_loss: 1.1978, test_f1: 0.6572
 epoch: 58, train_loss: 0.4423, test_loss: 1.1034, test_f1: 0.6567
 epoch: 59, train_loss: 0.4117, test_loss: 1.3213, test_f1: 0.6344
 epoch: 60, train_loss: 0.4268, test_loss: 1.2480, test_f1: 0.6577
 epoch: 61, train_loss: 0.4331, test_loss: 0.8374, test_f1: 0.6450
 epoch: 62, train_loss: 0.4145, test_loss: 1.0375, test_f1: 0.6442
 epoch: 63, train_loss: 0.3975, test_loss: 1.0020, test_f1: 0.6884
 epoch: 64, train_loss: 0.4339, test_loss: 1.0107, test_f1: 0.6616
 epoch: 65, train_loss: 0.4016, test_loss: 0.8537, test_f1: 0.6585
 epoch: 66, train_loss: 0.3983, test_loss: 1.0759, test_f1: 0.6344
 epoch: 67, train_loss: 0.3866, test_loss: 1.0472, test_f1: 0.6218
 epoch: 68, train_loss: 0.3989, test_loss: 1.0690, test_f1: 0.6531
 epoch: 69, train_loss: 0.4141, test_loss: 1.0949, test_f1: 0.6450
 epoch: 70, train_loss: 0.3786, test_loss: 1.0669, test_f1: 0.6618
 epoch: 71, train_loss: 0.3804, test_loss: 1.1141, test_f1: 0.6581
 epoch: 72, train_loss: 0.3983, test_loss: 1.2458, test_f1: 0.6376
 epoch: 73, train_loss: 0.3951, test_loss: 1.0745, test_f1: 0.6479
 epoch: 74, train_loss: 0.3824, test_loss: 1.1833, test_f1: 0.6404
 epoch: 75, train_loss: 0.3809, test_loss: 1.0839, test_f1: 0.6560
 epoch: 76, train_loss: 0.3629, test_loss: 1.0640, test_f1: 0.6427
 epoch: 77, train_loss: 0.3517, test_loss: 1.0002, test_f1: 0.6519
 epoch: 78, train_loss: 0.3839, test_loss: 0.9656, test_f1: 0.6340
 epoch: 79, train_loss: 0.3593, test_loss: 0.9679, test_f1: 0.6373
 epoch: 80, train_loss: 0.3578, test_loss: 1.1632, test_f1: 0.6523
 epoch: 81, train_loss: 0.3408, test_loss: 1.1491, test_f1: 0.6698
 epoch: 82, train_loss: 0.3315, test_loss: 1.2066, test_f1: 0.6350
 epoch: 83, train_loss: 0.3686, test_loss: 1.0861, test_f1: 0.6658
 epoch: 84, train_loss: 0.3318, test_loss: 1.0058, test_f1: 0.6479
 epoch: 85, train_loss: 0.3567, test_loss: 1.1170, test_f1: 0.6648
 epoch: 86, train_loss: 0.3332, test_loss: 0.9034, test_f1: 0.6650
 epoch: 87, train_loss: 0.3379, test_loss: 1.0168, test_f1: 0.6548
 epoch: 88, train_loss: 0.3164, test_loss: 1.0977, test_f1: 0.6424
 epoch: 89, train_loss: 0.3131, test_loss: 0.9818, test_f1: 0.6623
 epoch: 90, train_loss: 0.3160, test_loss: 0.9444, test_f1: 0.6615
 epoch: 91, train_loss: 0.3394, test_loss: 1.1535, test_f1: 0.6595
 epoch: 92, train_loss: 0.3128, test_loss: 1.3604, test_f1: 0.6423
 epoch: 93, train_loss: 0.3065, test_loss: 1.1166, test_f1: 0.6660
 epoch: 94, train_loss: 0.3067, test_loss: 1.1779, test_f1: 0.6569
 epoch: 95, train_loss: 0.3184, test_loss: 0.9563, test_f1: 0.6610
 epoch: 96, train_loss: 0.2968, test_loss: 1.2933, test_f1: 0.6641
 epoch: 97, train_loss: 0.3091, test_loss: 1.0671, test_f1: 0.6270
 epoch: 98, train_loss: 0.2802, test_loss: 1.2627, test_f1: 0.6481
 epoch: 99, train_loss: 0.3091, test_loss: 1.1981, test_f1: 0.6286
##################ITERATION #5 ****************************************
 epoch: 0, train_loss: 1.2193, test_loss: 1.2027, test_f1: 0.3865
 epoch: 1, train_loss: 1.0295, test_loss: 1.1060, test_f1: 0.4089
 epoch: 2, train_loss: 0.9944, test_loss: 1.0675, test_f1: 0.4998
 epoch: 3, train_loss: 0.9717, test_loss: 1.0454, test_f1: 0.4510
 epoch: 4, train_loss: 0.9465, test_loss: 1.0338, test_f1: 0.4174
 epoch: 5, train_loss: 0.9173, test_loss: 1.0204, test_f1: 0.4805
 epoch: 6, train_loss: 0.9328, test_loss: 0.9915, test_f1: 0.5069
 epoch: 7, train_loss: 0.8809, test_loss: 0.9586, test_f1: 0.5118
 epoch: 8, train_loss: 0.8657, test_loss: 1.0489, test_f1: 0.5111
 epoch: 9, train_loss: 0.8859, test_loss: 1.2114, test_f1: 0.4573
 epoch: 10, train_loss: 0.8581, test_loss: 0.9028, test_f1: 0.5299
 epoch: 11, train_loss: 0.8524, test_loss: 1.0471, test_f1: 0.5160
 epoch: 12, train_loss: 0.8529, test_loss: 0.8859, test_f1: 0.5261
 epoch: 13, train_loss: 0.8296, test_loss: 1.2902, test_f1: 0.4039
 epoch: 14, train_loss: 0.8169, test_loss: 1.0450, test_f1: 0.4874
 epoch: 15, train_loss: 0.8033, test_loss: 0.9083, test_f1: 0.5581
 epoch: 16, train_loss: 0.7951, test_loss: 0.8365, test_f1: 0.5163
 epoch: 17, train_loss: 0.7947, test_loss: 0.7906, test_f1: 0.5667
 epoch: 18, train_loss: 0.7725, test_loss: 0.8720, test_f1: 0.5540
 epoch: 19, train_loss: 0.7589, test_loss: 0.8379, test_f1: 0.5453
 epoch: 20, train_loss: 0.7544, test_loss: 0.9899, test_f1: 0.5189
 epoch: 21, train_loss: 0.7560, test_loss: 0.8423, test_f1: 0.5686
 epoch: 22, train_loss: 0.7467, test_loss: 0.8046, test_f1: 0.5533
 epoch: 23, train_loss: 0.7348, test_loss: 0.8782, test_f1: 0.5434
 epoch: 24, train_loss: 0.7135, test_loss: 0.7899, test_f1: 0.5538
 epoch: 25, train_loss: 0.7115, test_loss: 1.0146, test_f1: 0.5315
 epoch: 26, train_loss: 0.7301, test_loss: 0.7848, test_f1: 0.5733
 epoch: 27, train_loss: 0.7210, test_loss: 0.9124, test_f1: 0.5648
 epoch: 28, train_loss: 0.7022, test_loss: 0.7991, test_f1: 0.5666
 epoch: 29, train_loss: 0.6990, test_loss: 0.7866, test_f1: 0.5615
 epoch: 30, train_loss: 0.6853, test_loss: 0.8819, test_f1: 0.6176
 epoch: 31, train_loss: 0.6992, test_loss: 0.8238, test_f1: 0.5732
 epoch: 32, train_loss: 0.6800, test_loss: 0.9100, test_f1: 0.6086
 epoch: 33, train_loss: 0.6747, test_loss: 0.8330, test_f1: 0.6170
 epoch: 34, train_loss: 0.6649, test_loss: 0.7540, test_f1: 0.5766
 epoch: 35, train_loss: 0.6405, test_loss: 0.8912, test_f1: 0.5990
 epoch: 36, train_loss: 0.6610, test_loss: 0.8354, test_f1: 0.6305
 epoch: 37, train_loss: 0.6437, test_loss: 0.9845, test_f1: 0.5738
 epoch: 38, train_loss: 0.6162, test_loss: 1.0627, test_f1: 0.5400
 epoch: 39, train_loss: 0.6560, test_loss: 0.9468, test_f1: 0.5835
 epoch: 40, train_loss: 0.6123, test_loss: 1.1154, test_f1: 0.6265
 epoch: 41, train_loss: 0.6316, test_loss: 0.9784, test_f1: 0.6040
 epoch: 42, train_loss: 0.6166, test_loss: 0.9053, test_f1: 0.5595
 epoch: 43, train_loss: 0.6189, test_loss: 0.9420, test_f1: 0.6101
 epoch: 44, train_loss: 0.5967, test_loss: 0.8728, test_f1: 0.6449
 epoch: 45, train_loss: 0.6025, test_loss: 0.8916, test_f1: 0.5911
 epoch: 46, train_loss: 0.5886, test_loss: 0.8481, test_f1: 0.6039
 epoch: 47, train_loss: 0.5935, test_loss: 1.1017, test_f1: 0.5898
 epoch: 48, train_loss: 0.5653, test_loss: 0.9244, test_f1: 0.6425
 epoch: 49, train_loss: 0.5927, test_loss: 0.7922, test_f1: 0.5845
 epoch: 50, train_loss: 0.5689, test_loss: 0.8174, test_f1: 0.6372
 epoch: 51, train_loss: 0.5147, test_loss: 0.9191, test_f1: 0.6612
 epoch: 52, train_loss: 0.4900, test_loss: 0.9949, test_f1: 0.6742
 epoch: 53, train_loss: 0.4881, test_loss: 1.0376, test_f1: 0.6298
 epoch: 54, train_loss: 0.4742, test_loss: 1.0660, test_f1: 0.6701
 epoch: 55, train_loss: 0.4746, test_loss: 1.1577, test_f1: 0.6629
 epoch: 56, train_loss: 0.4656, test_loss: 1.0530, test_f1: 0.6521
 epoch: 57, train_loss: 0.4572, test_loss: 1.0552, test_f1: 0.6554
 epoch: 58, train_loss: 0.4554, test_loss: 1.0068, test_f1: 0.6720
 epoch: 59, train_loss: 0.4475, test_loss: 1.1269, test_f1: 0.6513
 epoch: 60, train_loss: 0.4519, test_loss: 1.2226, test_f1: 0.6497
 epoch: 61, train_loss: 0.4552, test_loss: 1.2868, test_f1: 0.6375
 epoch: 62, train_loss: 0.4236, test_loss: 1.3138, test_f1: 0.6832
 epoch: 63, train_loss: 0.4127, test_loss: 1.2597, test_f1: 0.6432
 epoch: 64, train_loss: 0.4271, test_loss: 1.3447, test_f1: 0.6679
 epoch: 65, train_loss: 0.4058, test_loss: 1.1695, test_f1: 0.6700
 epoch: 66, train_loss: 0.4154, test_loss: 1.1767, test_f1: 0.6713
 epoch: 67, train_loss: 0.3968, test_loss: 1.1439, test_f1: 0.6839
 epoch: 68, train_loss: 0.4200, test_loss: 1.2070, test_f1: 0.6619
 epoch: 69, train_loss: 0.4015, test_loss: 1.2490, test_f1: 0.6641
 epoch: 70, train_loss: 0.3991, test_loss: 1.2153, test_f1: 0.7067
 epoch: 71, train_loss: 0.3839, test_loss: 1.2700, test_f1: 0.6765
 epoch: 72, train_loss: 0.3854, test_loss: 1.2355, test_f1: 0.6725
 epoch: 73, train_loss: 0.3978, test_loss: 1.2239, test_f1: 0.6766
 epoch: 74, train_loss: 0.3749, test_loss: 1.2046, test_f1: 0.6744
 epoch: 75, train_loss: 0.3751, test_loss: 1.3775, test_f1: 0.6743
 epoch: 76, train_loss: 0.3896, test_loss: 1.2019, test_f1: 0.6633
 epoch: 77, train_loss: 0.3494, test_loss: 1.1949, test_f1: 0.6872
 epoch: 78, train_loss: 0.3660, test_loss: 1.3766, test_f1: 0.6748
 epoch: 79, train_loss: 0.3587, test_loss: 1.1772, test_f1: 0.6592
 epoch: 80, train_loss: 0.3611, test_loss: 1.3402, test_f1: 0.6906
 epoch: 81, train_loss: 0.3584, test_loss: 1.2910, test_f1: 0.6638
 epoch: 82, train_loss: 0.3625, test_loss: 1.3434, test_f1: 0.6869
 epoch: 83, train_loss: 0.3514, test_loss: 1.2904, test_f1: 0.7005
 epoch: 84, train_loss: 0.3552, test_loss: 1.1541, test_f1: 0.6877
 epoch: 85, train_loss: 0.3367, test_loss: 1.3904, test_f1: 0.6834
 epoch: 86, train_loss: 0.3283, test_loss: 1.3326, test_f1: 0.7047
 epoch: 87, train_loss: 0.3391, test_loss: 1.4780, test_f1: 0.6761
 epoch: 88, train_loss: 0.3356, test_loss: 1.4518, test_f1: 0.6836
 epoch: 89, train_loss: 0.3162, test_loss: 1.5592, test_f1: 0.6776
 epoch: 90, train_loss: 0.3414, test_loss: 1.4457, test_f1: 0.6705
 epoch: 91, train_loss: 0.3389, test_loss: 1.4584, test_f1: 0.6727
 epoch: 92, train_loss: 0.3075, test_loss: 1.7410, test_f1: 0.6743
 epoch: 93, train_loss: 0.3145, test_loss: 1.3670, test_f1: 0.6819
 epoch: 94, train_loss: 0.3167, test_loss: 1.2898, test_f1: 0.6597
 epoch: 95, train_loss: 0.3027, test_loss: 1.3226, test_f1: 0.6974
 epoch: 96, train_loss: 0.3121, test_loss: 1.3711, test_f1: 0.6989
 epoch: 97, train_loss: 0.2962, test_loss: 1.3621, test_f1: 0.7059
 epoch: 98, train_loss: 0.3161, test_loss: 1.3835, test_f1: 0.6996
 epoch: 99, train_loss: 0.3100, test_loss: 1.4821, test_f1: 0.6853
##################ITERATION #6 ****************************************
 epoch: 0, train_loss: 1.2477, test_loss: 1.2070, test_f1: 0.4298
 epoch: 1, train_loss: 1.0021, test_loss: 1.0454, test_f1: 0.4735
 epoch: 2, train_loss: 0.9586, test_loss: 1.0989, test_f1: 0.4255
 epoch: 3, train_loss: 0.9308, test_loss: 1.0957, test_f1: 0.4382
 epoch: 4, train_loss: 0.9097, test_loss: 0.8741, test_f1: 0.4740
 epoch: 5, train_loss: 0.8854, test_loss: 0.9519, test_f1: 0.5058
 epoch: 6, train_loss: 0.8686, test_loss: 0.9046, test_f1: 0.4968
 epoch: 7, train_loss: 0.8724, test_loss: 0.8808, test_f1: 0.5507
 epoch: 8, train_loss: 0.8881, test_loss: 0.9145, test_f1: 0.5265
 epoch: 9, train_loss: 0.8610, test_loss: 0.9954, test_f1: 0.5056
 epoch: 10, train_loss: 0.8289, test_loss: 0.9052, test_f1: 0.5050
 epoch: 11, train_loss: 0.8423, test_loss: 0.9891, test_f1: 0.4769
 epoch: 12, train_loss: 0.8233, test_loss: 1.2302, test_f1: 0.4695
 epoch: 13, train_loss: 0.8387, test_loss: 0.8944, test_f1: 0.5523
 epoch: 14, train_loss: 0.8020, test_loss: 0.9930, test_f1: 0.5125
 epoch: 15, train_loss: 0.7940, test_loss: 1.2428, test_f1: 0.4819
 epoch: 16, train_loss: 0.7952, test_loss: 0.9634, test_f1: 0.5476
 epoch: 17, train_loss: 0.7616, test_loss: 1.0709, test_f1: 0.5813
 epoch: 18, train_loss: 0.7841, test_loss: 0.9114, test_f1: 0.5561
 epoch: 19, train_loss: 0.7562, test_loss: 0.9936, test_f1: 0.5789
 epoch: 20, train_loss: 0.7527, test_loss: 1.1794, test_f1: 0.5240
 epoch: 21, train_loss: 0.7609, test_loss: 0.9579, test_f1: 0.5802
 epoch: 22, train_loss: 0.7170, test_loss: 1.1159, test_f1: 0.5703
 epoch: 23, train_loss: 0.7342, test_loss: 1.0100, test_f1: 0.5212
 epoch: 24, train_loss: 0.7291, test_loss: 1.0532, test_f1: 0.5532
 epoch: 25, train_loss: 0.7101, test_loss: 0.8139, test_f1: 0.5756
 epoch: 26, train_loss: 0.7113, test_loss: 0.8447, test_f1: 0.5817
 epoch: 27, train_loss: 0.7154, test_loss: 0.9964, test_f1: 0.5912
 epoch: 28, train_loss: 0.6605, test_loss: 0.9953, test_f1: 0.5923
 epoch: 29, train_loss: 0.6669, test_loss: 1.0041, test_f1: 0.5884
 epoch: 30, train_loss: 0.6525, test_loss: 0.9461, test_f1: 0.6079
 epoch: 31, train_loss: 0.6609, test_loss: 0.9857, test_f1: 0.5680
 epoch: 32, train_loss: 0.6493, test_loss: 1.4477, test_f1: 0.4834
 epoch: 33, train_loss: 0.6287, test_loss: 1.0601, test_f1: 0.5815
 epoch: 34, train_loss: 0.6187, test_loss: 1.0684, test_f1: 0.5966
 epoch: 35, train_loss: 0.6164, test_loss: 1.3083, test_f1: 0.5869
 epoch: 36, train_loss: 0.6207, test_loss: 1.2274, test_f1: 0.6264
 epoch: 37, train_loss: 0.5888, test_loss: 0.9455, test_f1: 0.6729
 epoch: 38, train_loss: 0.6118, test_loss: 0.9999, test_f1: 0.6614
 epoch: 39, train_loss: 0.6043, test_loss: 0.8485, test_f1: 0.6467
 epoch: 40, train_loss: 0.6113, test_loss: 0.9772, test_f1: 0.6521
 epoch: 41, train_loss: 0.5873, test_loss: 1.0566, test_f1: 0.6429
 epoch: 42, train_loss: 0.5684, test_loss: 1.1002, test_f1: 0.6565
 epoch: 43, train_loss: 0.5779, test_loss: 1.1354, test_f1: 0.5648
 epoch: 44, train_loss: 0.5873, test_loss: 1.1266, test_f1: 0.6253
 epoch: 45, train_loss: 0.5643, test_loss: 1.1270, test_f1: 0.6492
 epoch: 46, train_loss: 0.5635, test_loss: 0.8688, test_f1: 0.6451
 epoch: 47, train_loss: 0.5604, test_loss: 1.3318, test_f1: 0.5531
 epoch: 48, train_loss: 0.5820, test_loss: 1.2491, test_f1: 0.6059
 epoch: 49, train_loss: 0.5371, test_loss: 1.3337, test_f1: 0.6645
 epoch: 50, train_loss: 0.5348, test_loss: 1.0734, test_f1: 0.6278
 epoch: 51, train_loss: 0.5269, test_loss: 1.0407, test_f1: 0.6639
 epoch: 52, train_loss: 0.4837, test_loss: 1.2726, test_f1: 0.6430
 epoch: 53, train_loss: 0.4781, test_loss: 1.1411, test_f1: 0.6434
 epoch: 54, train_loss: 0.4689, test_loss: 1.1704, test_f1: 0.6535
 epoch: 55, train_loss: 0.4535, test_loss: 1.1779, test_f1: 0.6787
 epoch: 56, train_loss: 0.4705, test_loss: 1.2985, test_f1: 0.6782
 epoch: 57, train_loss: 0.4338, test_loss: 1.1461, test_f1: 0.6821
 epoch: 58, train_loss: 0.4359, test_loss: 1.4693, test_f1: 0.6684
 epoch: 59, train_loss: 0.4295, test_loss: 1.2718, test_f1: 0.6686
 epoch: 60, train_loss: 0.4323, test_loss: 1.1077, test_f1: 0.6635
 epoch: 61, train_loss: 0.4317, test_loss: 1.4159, test_f1: 0.6427
 epoch: 62, train_loss: 0.4208, test_loss: 1.2311, test_f1: 0.6597
 epoch: 63, train_loss: 0.4092, test_loss: 1.1291, test_f1: 0.6733
 epoch: 64, train_loss: 0.4143, test_loss: 1.4094, test_f1: 0.6617
 epoch: 65, train_loss: 0.4209, test_loss: 1.2276, test_f1: 0.6696
 epoch: 66, train_loss: 0.3976, test_loss: 1.1681, test_f1: 0.6401
 epoch: 67, train_loss: 0.4296, test_loss: 0.9654, test_f1: 0.6437
 epoch: 68, train_loss: 0.3988, test_loss: 1.1403, test_f1: 0.6659
 epoch: 69, train_loss: 0.4046, test_loss: 1.3785, test_f1: 0.6812
 epoch: 70, train_loss: 0.3953, test_loss: 1.4046, test_f1: 0.6589
 epoch: 71, train_loss: 0.3773, test_loss: 1.5221, test_f1: 0.6619
 epoch: 72, train_loss: 0.4015, test_loss: 1.2712, test_f1: 0.6871
 epoch: 73, train_loss: 0.3717, test_loss: 1.3343, test_f1: 0.6626
 epoch: 74, train_loss: 0.3786, test_loss: 1.6200, test_f1: 0.6396
 epoch: 75, train_loss: 0.3905, test_loss: 1.2827, test_f1: 0.6697
 epoch: 76, train_loss: 0.3806, test_loss: 1.2971, test_f1: 0.6911
 epoch: 77, train_loss: 0.3667, test_loss: 1.3905, test_f1: 0.6780
 epoch: 78, train_loss: 0.3632, test_loss: 1.7267, test_f1: 0.6600
 epoch: 79, train_loss: 0.3892, test_loss: 1.5107, test_f1: 0.6769
 epoch: 80, train_loss: 0.3702, test_loss: 1.5571, test_f1: 0.6767
 epoch: 81, train_loss: 0.3461, test_loss: 1.5732, test_f1: 0.6499
 epoch: 82, train_loss: 0.3467, test_loss: 1.7664, test_f1: 0.6473
 epoch: 83, train_loss: 0.3533, test_loss: 1.6156, test_f1: 0.6412
 epoch: 84, train_loss: 0.3543, test_loss: 1.6427, test_f1: 0.6418
 epoch: 85, train_loss: 0.3275, test_loss: 1.8800, test_f1: 0.6360
 epoch: 86, train_loss: 0.3412, test_loss: 1.9773, test_f1: 0.6493
 epoch: 87, train_loss: 0.3387, test_loss: 1.8171, test_f1: 0.6578
 epoch: 88, train_loss: 0.3333, test_loss: 1.3612, test_f1: 0.6861
 epoch: 89, train_loss: 0.3194, test_loss: 1.6503, test_f1: 0.6289
 epoch: 90, train_loss: 0.3230, test_loss: 1.7328, test_f1: 0.6440
 epoch: 91, train_loss: 0.3276, test_loss: 1.4116, test_f1: 0.6707
 epoch: 92, train_loss: 0.3413, test_loss: 1.7087, test_f1: 0.6625
 epoch: 93, train_loss: 0.3215, test_loss: 1.5591, test_f1: 0.6286
 epoch: 94, train_loss: 0.3147, test_loss: 1.5911, test_f1: 0.6478
 epoch: 95, train_loss: 0.3170, test_loss: 1.5195, test_f1: 0.6843
 epoch: 96, train_loss: 0.3103, test_loss: 1.7392, test_f1: 0.6702
 epoch: 97, train_loss: 0.3255, test_loss: 1.6424, test_f1: 0.6597
 epoch: 98, train_loss: 0.3153, test_loss: 1.8815, test_f1: 0.6675
 epoch: 99, train_loss: 0.3133, test_loss: 1.8429, test_f1: 0.6795
##################ITERATION #7 ****************************************
 epoch: 0, train_loss: 1.1720, test_loss: 1.2390, test_f1: 0.4197
 epoch: 1, train_loss: 0.9953, test_loss: 1.0822, test_f1: 0.4310
 epoch: 2, train_loss: 0.9558, test_loss: 1.0179, test_f1: 0.5642
 epoch: 3, train_loss: 0.9400, test_loss: 1.0975, test_f1: 0.5153
 epoch: 4, train_loss: 0.9100, test_loss: 1.2938, test_f1: 0.4819
 epoch: 5, train_loss: 0.8871, test_loss: 0.8447, test_f1: 0.5804
 epoch: 6, train_loss: 0.8925, test_loss: 0.8911, test_f1: 0.5838
 epoch: 7, train_loss: 0.8649, test_loss: 0.9240, test_f1: 0.5866
 epoch: 8, train_loss: 0.8621, test_loss: 0.9194, test_f1: 0.5570
 epoch: 9, train_loss: 0.8403, test_loss: 0.9462, test_f1: 0.5933
 epoch: 10, train_loss: 0.8200, test_loss: 0.9443, test_f1: 0.5445
 epoch: 11, train_loss: 0.8169, test_loss: 0.9278, test_f1: 0.6297
 epoch: 12, train_loss: 0.8051, test_loss: 0.8947, test_f1: 0.5915
 epoch: 13, train_loss: 0.7942, test_loss: 0.9312, test_f1: 0.6072
 epoch: 14, train_loss: 0.7651, test_loss: 0.7704, test_f1: 0.5935
 epoch: 15, train_loss: 0.7623, test_loss: 1.1360, test_f1: 0.5735
 epoch: 16, train_loss: 0.7540, test_loss: 1.0291, test_f1: 0.5727
 epoch: 17, train_loss: 0.7447, test_loss: 0.8740, test_f1: 0.6102
 epoch: 18, train_loss: 0.7548, test_loss: 0.9454, test_f1: 0.6030
 epoch: 19, train_loss: 0.7354, test_loss: 0.8767, test_f1: 0.6425
 epoch: 20, train_loss: 0.7321, test_loss: 0.8790, test_f1: 0.5972
 epoch: 21, train_loss: 0.7163, test_loss: 0.9350, test_f1: 0.6329
 epoch: 22, train_loss: 0.6776, test_loss: 0.9108, test_f1: 0.6259
 epoch: 23, train_loss: 0.6695, test_loss: 1.0707, test_f1: 0.6446
 epoch: 24, train_loss: 0.6801, test_loss: 0.8620, test_f1: 0.6485
 epoch: 25, train_loss: 0.6506, test_loss: 0.8155, test_f1: 0.6489
 epoch: 26, train_loss: 0.6709, test_loss: 0.8777, test_f1: 0.6367
 epoch: 27, train_loss: 0.6780, test_loss: 0.8547, test_f1: 0.6522
 epoch: 28, train_loss: 0.6516, test_loss: 0.9740, test_f1: 0.6513
 epoch: 29, train_loss: 0.6401, test_loss: 1.0491, test_f1: 0.6353
 epoch: 30, train_loss: 0.6571, test_loss: 0.9568, test_f1: 0.6382
 epoch: 31, train_loss: 0.6086, test_loss: 0.8618, test_f1: 0.6720
 epoch: 32, train_loss: 0.6058, test_loss: 0.9186, test_f1: 0.6417
 epoch: 33, train_loss: 0.6067, test_loss: 1.0666, test_f1: 0.6202
 epoch: 34, train_loss: 0.6006, test_loss: 1.0962, test_f1: 0.6474
 epoch: 35, train_loss: 0.5904, test_loss: 1.0537, test_f1: 0.6420
 epoch: 36, train_loss: 0.6225, test_loss: 0.9317, test_f1: 0.6580
 epoch: 37, train_loss: 0.6206, test_loss: 0.9945, test_f1: 0.6144
 epoch: 38, train_loss: 0.5893, test_loss: 1.1830, test_f1: 0.6446
 epoch: 39, train_loss: 0.5622, test_loss: 1.5158, test_f1: 0.5729
 epoch: 40, train_loss: 0.5858, test_loss: 1.4252, test_f1: 0.6409
 epoch: 41, train_loss: 0.5530, test_loss: 1.1168, test_f1: 0.6341
 epoch: 42, train_loss: 0.5474, test_loss: 1.0764, test_f1: 0.6326
 epoch: 43, train_loss: 0.5474, test_loss: 1.2775, test_f1: 0.6156
 epoch: 44, train_loss: 0.5413, test_loss: 1.1727, test_f1: 0.6450
 epoch: 45, train_loss: 0.5606, test_loss: 1.4198, test_f1: 0.5621
 epoch: 46, train_loss: 0.5645, test_loss: 1.1359, test_f1: 0.6257
 epoch: 47, train_loss: 0.5188, test_loss: 1.2076, test_f1: 0.6498
 epoch: 48, train_loss: 0.5129, test_loss: 1.2429, test_f1: 0.6264
 epoch: 49, train_loss: 0.5171, test_loss: 1.3892, test_f1: 0.6158
 epoch: 50, train_loss: 0.5303, test_loss: 1.3096, test_f1: 0.6257
 epoch: 51, train_loss: 0.4919, test_loss: 1.1695, test_f1: 0.6618
 epoch: 52, train_loss: 0.4440, test_loss: 1.2450, test_f1: 0.6539
 epoch: 53, train_loss: 0.4174, test_loss: 1.2923, test_f1: 0.6582
 epoch: 54, train_loss: 0.4088, test_loss: 1.3705, test_f1: 0.6605
 epoch: 55, train_loss: 0.4165, test_loss: 1.4884, test_f1: 0.6567
 epoch: 56, train_loss: 0.4030, test_loss: 1.3302, test_f1: 0.6632
 epoch: 57, train_loss: 0.3934, test_loss: 1.4358, test_f1: 0.6546
 epoch: 58, train_loss: 0.3902, test_loss: 1.4467, test_f1: 0.6585
 epoch: 59, train_loss: 0.3818, test_loss: 1.7858, test_f1: 0.6349
 epoch: 60, train_loss: 0.4009, test_loss: 1.2654, test_f1: 0.6662
 epoch: 61, train_loss: 0.3882, test_loss: 1.4087, test_f1: 0.6460
 epoch: 62, train_loss: 0.3923, test_loss: 1.3129, test_f1: 0.6776
 epoch: 63, train_loss: 0.3897, test_loss: 1.2826, test_f1: 0.6750
 epoch: 64, train_loss: 0.3738, test_loss: 1.5570, test_f1: 0.6432
 epoch: 65, train_loss: 0.3677, test_loss: 1.4932, test_f1: 0.6782
 epoch: 66, train_loss: 0.3688, test_loss: 1.3407, test_f1: 0.6631
 epoch: 67, train_loss: 0.3784, test_loss: 1.2808, test_f1: 0.6788
 epoch: 68, train_loss: 0.3608, test_loss: 1.4053, test_f1: 0.6714
 epoch: 69, train_loss: 0.3539, test_loss: 1.5212, test_f1: 0.6889
 epoch: 70, train_loss: 0.3556, test_loss: 1.5359, test_f1: 0.6732
 epoch: 71, train_loss: 0.3534, test_loss: 1.5378, test_f1: 0.6791
 epoch: 72, train_loss: 0.3578, test_loss: 1.3553, test_f1: 0.6636
 epoch: 73, train_loss: 0.3444, test_loss: 1.3793, test_f1: 0.6551
 epoch: 74, train_loss: 0.3273, test_loss: 1.4084, test_f1: 0.6499
 epoch: 75, train_loss: 0.3653, test_loss: 1.3694, test_f1: 0.6677
 epoch: 76, train_loss: 0.3489, test_loss: 1.3336, test_f1: 0.6747
 epoch: 77, train_loss: 0.3514, test_loss: 1.2947, test_f1: 0.6748
 epoch: 78, train_loss: 0.3236, test_loss: 1.4563, test_f1: 0.6630
 epoch: 79, train_loss: 0.3256, test_loss: 1.5003, test_f1: 0.6556
 epoch: 80, train_loss: 0.3221, test_loss: 1.3471, test_f1: 0.6716
 epoch: 81, train_loss: 0.3319, test_loss: 1.4322, test_f1: 0.6640
 epoch: 82, train_loss: 0.3263, test_loss: 1.4424, test_f1: 0.6826
 epoch: 83, train_loss: 0.3253, test_loss: 1.4248, test_f1: 0.6289
 epoch: 84, train_loss: 0.3238, test_loss: 1.5403, test_f1: 0.6662
 epoch: 85, train_loss: 0.3037, test_loss: 1.6886, test_f1: 0.6617
 epoch: 86, train_loss: 0.2947, test_loss: 1.6022, test_f1: 0.6733
 epoch: 87, train_loss: 0.3254, test_loss: 1.6985, test_f1: 0.6619
 epoch: 88, train_loss: 0.3113, test_loss: 1.5311, test_f1: 0.6608
 epoch: 89, train_loss: 0.3325, test_loss: 1.4525, test_f1: 0.6743
 epoch: 90, train_loss: 0.3203, test_loss: 1.3618, test_f1: 0.6748
 epoch: 91, train_loss: 0.3151, test_loss: 1.6659, test_f1: 0.6576
 epoch: 92, train_loss: 0.3094, test_loss: 1.4425, test_f1: 0.6463
 epoch: 93, train_loss: 0.3051, test_loss: 1.6112, test_f1: 0.6613
 epoch: 94, train_loss: 0.2994, test_loss: 1.5155, test_f1: 0.6701
 epoch: 95, train_loss: 0.2937, test_loss: 1.4676, test_f1: 0.6778
 epoch: 96, train_loss: 0.2914, test_loss: 1.6272, test_f1: 0.6594
 epoch: 97, train_loss: 0.2934, test_loss: 1.6122, test_f1: 0.6539
 epoch: 98, train_loss: 0.2850, test_loss: 1.6780, test_f1: 0.6842
 epoch: 99, train_loss: 0.3042, test_loss: 1.6030, test_f1: 0.6671
##################ITERATION #8 ****************************************
 epoch: 0, train_loss: 1.2551, test_loss: 1.4897, test_f1: 0.4380
 epoch: 1, train_loss: 1.0675, test_loss: 1.2261, test_f1: 0.4330
 epoch: 2, train_loss: 0.9889, test_loss: 1.0414, test_f1: 0.4911
 epoch: 3, train_loss: 0.9708, test_loss: 1.0186, test_f1: 0.5443
 epoch: 4, train_loss: 0.9310, test_loss: 1.1395, test_f1: 0.5455
 epoch: 5, train_loss: 0.9045, test_loss: 0.9349, test_f1: 0.4906
 epoch: 6, train_loss: 0.9149, test_loss: 0.9895, test_f1: 0.4973
 epoch: 7, train_loss: 0.8812, test_loss: 0.9890, test_f1: 0.4942
 epoch: 8, train_loss: 0.8607, test_loss: 0.9555, test_f1: 0.4952
 epoch: 9, train_loss: 0.8530, test_loss: 0.9744, test_f1: 0.4980
 epoch: 10, train_loss: 0.8319, test_loss: 0.9369, test_f1: 0.5047
 epoch: 11, train_loss: 0.8199, test_loss: 0.9168, test_f1: 0.5278
 epoch: 12, train_loss: 0.8119, test_loss: 0.9363, test_f1: 0.5333
 epoch: 13, train_loss: 0.8317, test_loss: 1.1126, test_f1: 0.4579
 epoch: 14, train_loss: 0.8493, test_loss: 1.0255, test_f1: 0.5102
 epoch: 15, train_loss: 0.8098, test_loss: 1.0704, test_f1: 0.5561
 epoch: 16, train_loss: 0.7872, test_loss: 1.0395, test_f1: 0.5134
 epoch: 17, train_loss: 0.7849, test_loss: 1.0915, test_f1: 0.5553
 epoch: 18, train_loss: 0.7660, test_loss: 1.1004, test_f1: 0.5477
 epoch: 19, train_loss: 0.7750, test_loss: 0.8541, test_f1: 0.5632
 epoch: 20, train_loss: 0.7764, test_loss: 0.8706, test_f1: 0.5846
 epoch: 21, train_loss: 0.7709, test_loss: 1.1159, test_f1: 0.5097
 epoch: 22, train_loss: 0.7637, test_loss: 0.8654, test_f1: 0.5952
 epoch: 23, train_loss: 0.7395, test_loss: 0.8984, test_f1: 0.5639
 epoch: 24, train_loss: 0.7341, test_loss: 0.9841, test_f1: 0.5934
 epoch: 25, train_loss: 0.7193, test_loss: 0.9407, test_f1: 0.6151
 epoch: 26, train_loss: 0.7289, test_loss: 0.8775, test_f1: 0.5640
 epoch: 27, train_loss: 0.7087, test_loss: 1.1203, test_f1: 0.5590
 epoch: 28, train_loss: 0.6954, test_loss: 0.9783, test_f1: 0.6412
 epoch: 29, train_loss: 0.6942, test_loss: 0.8741, test_f1: 0.6581
 epoch: 30, train_loss: 0.7065, test_loss: 0.9141, test_f1: 0.6531
 epoch: 31, train_loss: 0.6623, test_loss: 0.8870, test_f1: 0.6735
 epoch: 32, train_loss: 0.6564, test_loss: 1.3845, test_f1: 0.6110
 epoch: 33, train_loss: 0.6859, test_loss: 1.0617, test_f1: 0.6378
 epoch: 34, train_loss: 0.6598, test_loss: 1.0593, test_f1: 0.5748
 epoch: 35, train_loss: 0.6614, test_loss: 0.8869, test_f1: 0.6280
 epoch: 36, train_loss: 0.6401, test_loss: 0.8614, test_f1: 0.6303
 epoch: 37, train_loss: 0.6475, test_loss: 0.9782, test_f1: 0.6656
 epoch: 38, train_loss: 0.6746, test_loss: 1.2885, test_f1: 0.5605
 epoch: 39, train_loss: 0.6418, test_loss: 0.9236, test_f1: 0.6505
 epoch: 40, train_loss: 0.6525, test_loss: 2.1290, test_f1: 0.4811
 epoch: 41, train_loss: 0.6943, test_loss: 0.8097, test_f1: 0.6606
 epoch: 42, train_loss: 0.6336, test_loss: 0.9753, test_f1: 0.6636
 epoch: 43, train_loss: 0.6419, test_loss: 0.9852, test_f1: 0.6529
 epoch: 44, train_loss: 0.6317, test_loss: 0.9001, test_f1: 0.6151
 epoch: 45, train_loss: 0.6265, test_loss: 1.1016, test_f1: 0.6635
 epoch: 46, train_loss: 0.6042, test_loss: 0.7908, test_f1: 0.6667
 epoch: 47, train_loss: 0.5805, test_loss: 1.1651, test_f1: 0.6519
 epoch: 48, train_loss: 0.5886, test_loss: 1.6162, test_f1: 0.6330
 epoch: 49, train_loss: 0.5901, test_loss: 1.2397, test_f1: 0.6410
 epoch: 50, train_loss: 0.5819, test_loss: 0.9835, test_f1: 0.6388
 epoch: 51, train_loss: 0.5567, test_loss: 1.0128, test_f1: 0.6734
 epoch: 52, train_loss: 0.4958, test_loss: 0.8497, test_f1: 0.6650
 epoch: 53, train_loss: 0.4894, test_loss: 0.8187, test_f1: 0.6875
 epoch: 54, train_loss: 0.4874, test_loss: 0.8530, test_f1: 0.6715
 epoch: 55, train_loss: 0.4995, test_loss: 1.0878, test_f1: 0.6461
 epoch: 56, train_loss: 0.4884, test_loss: 0.8941, test_f1: 0.6717
 epoch: 57, train_loss: 0.4991, test_loss: 0.8595, test_f1: 0.6681
 epoch: 58, train_loss: 0.4717, test_loss: 0.8513, test_f1: 0.6662
 epoch: 59, train_loss: 0.4644, test_loss: 0.9093, test_f1: 0.6636
 epoch: 60, train_loss: 0.4827, test_loss: 0.8260, test_f1: 0.6930
 epoch: 61, train_loss: 0.4697, test_loss: 1.0302, test_f1: 0.6722
 epoch: 62, train_loss: 0.4724, test_loss: 0.8806, test_f1: 0.6686
 epoch: 63, train_loss: 0.4456, test_loss: 0.9810, test_f1: 0.6734
 epoch: 64, train_loss: 0.4620, test_loss: 1.0713, test_f1: 0.6583
 epoch: 65, train_loss: 0.4440, test_loss: 1.0547, test_f1: 0.6945
 epoch: 66, train_loss: 0.4169, test_loss: 0.9850, test_f1: 0.6704
 epoch: 67, train_loss: 0.4410, test_loss: 1.1430, test_f1: 0.6544
 epoch: 68, train_loss: 0.4541, test_loss: 1.2297, test_f1: 0.6946
 epoch: 69, train_loss: 0.4288, test_loss: 0.8127, test_f1: 0.6927
 epoch: 70, train_loss: 0.4133, test_loss: 0.8993, test_f1: 0.6823
 epoch: 71, train_loss: 0.4499, test_loss: 0.8537, test_f1: 0.6905
 epoch: 72, train_loss: 0.4386, test_loss: 1.3024, test_f1: 0.6747
 epoch: 73, train_loss: 0.4257, test_loss: 0.9996, test_f1: 0.6882
 epoch: 74, train_loss: 0.3919, test_loss: 1.0384, test_f1: 0.6771
 epoch: 75, train_loss: 0.4066, test_loss: 1.1466, test_f1: 0.6819
 epoch: 76, train_loss: 0.3909, test_loss: 1.2911, test_f1: 0.6857
 epoch: 77, train_loss: 0.4114, test_loss: 0.9603, test_f1: 0.6973
 epoch: 78, train_loss: 0.4153, test_loss: 0.9733, test_f1: 0.7122
 epoch: 79, train_loss: 0.4071, test_loss: 0.9879, test_f1: 0.6691
 epoch: 80, train_loss: 0.3936, test_loss: 0.9853, test_f1: 0.6755
 epoch: 81, train_loss: 0.3949, test_loss: 0.8786, test_f1: 0.7069
 epoch: 82, train_loss: 0.3987, test_loss: 1.1149, test_f1: 0.6959
 epoch: 83, train_loss: 0.3805, test_loss: 0.9828, test_f1: 0.6887
 epoch: 84, train_loss: 0.3629, test_loss: 0.8815, test_f1: 0.7033
 epoch: 85, train_loss: 0.3932, test_loss: 1.3000, test_f1: 0.6460
 epoch: 86, train_loss: 0.3887, test_loss: 1.0344, test_f1: 0.6817
 epoch: 87, train_loss: 0.3860, test_loss: 0.9055, test_f1: 0.6940
 epoch: 88, train_loss: 0.3779, test_loss: 1.0945, test_f1: 0.6936
 epoch: 89, train_loss: 0.3557, test_loss: 0.8885, test_f1: 0.6978
 epoch: 90, train_loss: 0.3538, test_loss: 1.0103, test_f1: 0.6883
 epoch: 91, train_loss: 0.3559, test_loss: 0.9514, test_f1: 0.6963
 epoch: 92, train_loss: 0.3525, test_loss: 1.0310, test_f1: 0.6993
 epoch: 93, train_loss: 0.3436, test_loss: 1.0576, test_f1: 0.6728
 epoch: 94, train_loss: 0.3696, test_loss: 1.1177, test_f1: 0.6779
 epoch: 95, train_loss: 0.3626, test_loss: 0.9742, test_f1: 0.7000
 epoch: 96, train_loss: 0.3468, test_loss: 1.0683, test_f1: 0.7330
 epoch: 97, train_loss: 0.3447, test_loss: 0.9748, test_f1: 0.7096
 epoch: 98, train_loss: 0.3392, test_loss: 1.3394, test_f1: 0.6823
 epoch: 99, train_loss: 0.3415, test_loss: 1.0026, test_f1: 0.6810
##################ITERATION #9 ****************************************
 epoch: 0, train_loss: 1.2123, test_loss: 1.1475, test_f1: 0.4578
 epoch: 1, train_loss: 1.0310, test_loss: 0.9828, test_f1: 0.5202
 epoch: 2, train_loss: 0.9729, test_loss: 0.9558, test_f1: 0.5534
 epoch: 3, train_loss: 0.9481, test_loss: 1.0046, test_f1: 0.5108
 epoch: 4, train_loss: 0.9525, test_loss: 0.9826, test_f1: 0.5288
 epoch: 5, train_loss: 0.9281, test_loss: 0.9065, test_f1: 0.5411
 epoch: 6, train_loss: 0.8855, test_loss: 0.9687, test_f1: 0.5144
 epoch: 7, train_loss: 0.8645, test_loss: 0.8691, test_f1: 0.5627
 epoch: 8, train_loss: 0.8510, test_loss: 1.0431, test_f1: 0.5699
 epoch: 9, train_loss: 0.8260, test_loss: 0.8808, test_f1: 0.5876
 epoch: 10, train_loss: 0.8190, test_loss: 0.8585, test_f1: 0.5664
 epoch: 11, train_loss: 0.8401, test_loss: 0.8918, test_f1: 0.4941
 epoch: 12, train_loss: 0.7984, test_loss: 0.9206, test_f1: 0.5166
 epoch: 13, train_loss: 0.7774, test_loss: 1.1550, test_f1: 0.4632
 epoch: 14, train_loss: 0.7785, test_loss: 0.9116, test_f1: 0.5588
 epoch: 15, train_loss: 0.7937, test_loss: 0.9006, test_f1: 0.5758
 epoch: 16, train_loss: 0.7715, test_loss: 0.8440, test_f1: 0.5991
 epoch: 17, train_loss: 0.7571, test_loss: 0.7898, test_f1: 0.6329
 epoch: 18, train_loss: 0.7282, test_loss: 0.9480, test_f1: 0.5565
 epoch: 19, train_loss: 0.7453, test_loss: 0.8425, test_f1: 0.5628
 epoch: 20, train_loss: 0.7530, test_loss: 0.7364, test_f1: 0.6081
 epoch: 21, train_loss: 0.7216, test_loss: 0.8204, test_f1: 0.6086
 epoch: 22, train_loss: 0.7417, test_loss: 0.9339, test_f1: 0.5940
 epoch: 23, train_loss: 0.7224, test_loss: 0.8860, test_f1: 0.6127
 epoch: 24, train_loss: 0.6922, test_loss: 0.9193, test_f1: 0.6327
 epoch: 25, train_loss: 0.6681, test_loss: 0.8930, test_f1: 0.6191
 epoch: 26, train_loss: 0.6995, test_loss: 0.8725, test_f1: 0.6161
 epoch: 27, train_loss: 0.7025, test_loss: 0.7929, test_f1: 0.5940
 epoch: 28, train_loss: 0.6597, test_loss: 0.9099, test_f1: 0.6106
 epoch: 29, train_loss: 0.6583, test_loss: 0.9891, test_f1: 0.5659
 epoch: 30, train_loss: 0.6752, test_loss: 1.0038, test_f1: 0.6108
 epoch: 31, train_loss: 0.6739, test_loss: 0.7811, test_f1: 0.6194
 epoch: 32, train_loss: 0.6481, test_loss: 0.8651, test_f1: 0.6373
 epoch: 33, train_loss: 0.6325, test_loss: 0.8210, test_f1: 0.6389
 epoch: 34, train_loss: 0.6332, test_loss: 0.8850, test_f1: 0.6450
 epoch: 35, train_loss: 0.6119, test_loss: 0.8460, test_f1: 0.6085
 epoch: 36, train_loss: 0.6127, test_loss: 0.7808, test_f1: 0.6594
 epoch: 37, train_loss: 0.5955, test_loss: 0.9436, test_f1: 0.6184
 epoch: 38, train_loss: 0.6080, test_loss: 1.0659, test_f1: 0.6043
 epoch: 39, train_loss: 0.6017, test_loss: 0.7426, test_f1: 0.6572
 epoch: 40, train_loss: 0.6059, test_loss: 0.8408, test_f1: 0.6524
 epoch: 41, train_loss: 0.5878, test_loss: 0.9824, test_f1: 0.6542
 epoch: 42, train_loss: 0.5670, test_loss: 0.8608, test_f1: 0.5865
 epoch: 43, train_loss: 0.5775, test_loss: 0.9133, test_f1: 0.6505
 epoch: 44, train_loss: 0.5643, test_loss: 0.9817, test_f1: 0.6442
 epoch: 45, train_loss: 0.5734, test_loss: 1.0954, test_f1: 0.6340
 epoch: 46, train_loss: 0.5396, test_loss: 0.8883, test_f1: 0.6657
 epoch: 47, train_loss: 0.5458, test_loss: 0.8556, test_f1: 0.6300
 epoch: 48, train_loss: 0.5443, test_loss: 1.1187, test_f1: 0.6609
 epoch: 49, train_loss: 0.5445, test_loss: 1.0917, test_f1: 0.6377
 epoch: 50, train_loss: 0.5281, test_loss: 0.9428, test_f1: 0.6194
 epoch: 51, train_loss: 0.4825, test_loss: 0.9444, test_f1: 0.6378
 epoch: 52, train_loss: 0.4599, test_loss: 1.0153, test_f1: 0.6094
 epoch: 53, train_loss: 0.4475, test_loss: 1.0526, test_f1: 0.6540
 epoch: 54, train_loss: 0.4524, test_loss: 0.9753, test_f1: 0.6544
 epoch: 55, train_loss: 0.4202, test_loss: 1.0456, test_f1: 0.6590
 epoch: 56, train_loss: 0.4190, test_loss: 0.9717, test_f1: 0.6683
 epoch: 57, train_loss: 0.4209, test_loss: 0.9186, test_f1: 0.6939
 epoch: 58, train_loss: 0.4013, test_loss: 1.2027, test_f1: 0.6796
 epoch: 59, train_loss: 0.4118, test_loss: 1.1767, test_f1: 0.6657
 epoch: 60, train_loss: 0.3926, test_loss: 1.1254, test_f1: 0.6789
 epoch: 61, train_loss: 0.3920, test_loss: 1.1694, test_f1: 0.6698
 epoch: 62, train_loss: 0.4034, test_loss: 0.9181, test_f1: 0.6854
 epoch: 63, train_loss: 0.4036, test_loss: 0.9861, test_f1: 0.6790
 epoch: 64, train_loss: 0.3951, test_loss: 1.1554, test_f1: 0.6680
 epoch: 65, train_loss: 0.3896, test_loss: 0.9015, test_f1: 0.7049
 epoch: 66, train_loss: 0.3564, test_loss: 1.1002, test_f1: 0.6805
 epoch: 67, train_loss: 0.3631, test_loss: 1.1597, test_f1: 0.6683
 epoch: 68, train_loss: 0.3730, test_loss: 1.1853, test_f1: 0.6640
 epoch: 69, train_loss: 0.3651, test_loss: 1.3155, test_f1: 0.6598
 epoch: 70, train_loss: 0.3517, test_loss: 1.1108, test_f1: 0.6618
 epoch: 71, train_loss: 0.3863, test_loss: 1.2648, test_f1: 0.6475
 epoch: 72, train_loss: 0.3612, test_loss: 1.1982, test_f1: 0.6913
 epoch: 73, train_loss: 0.3676, test_loss: 1.1369, test_f1: 0.6732
 epoch: 74, train_loss: 0.3473, test_loss: 1.3064, test_f1: 0.6762
 epoch: 75, train_loss: 0.3312, test_loss: 1.3303, test_f1: 0.6566
 epoch: 76, train_loss: 0.3336, test_loss: 1.5056, test_f1: 0.6641
 epoch: 77, train_loss: 0.3418, test_loss: 1.1946, test_f1: 0.6919
 epoch: 78, train_loss: 0.3514, test_loss: 1.2062, test_f1: 0.6925
 epoch: 79, train_loss: 0.3225, test_loss: 1.1796, test_f1: 0.6976
 epoch: 80, train_loss: 0.3136, test_loss: 1.3350, test_f1: 0.6535
 epoch: 81, train_loss: 0.3466, test_loss: 1.0484, test_f1: 0.6510
 epoch: 82, train_loss: 0.3579, test_loss: 1.1703, test_f1: 0.6920
 epoch: 83, train_loss: 0.3000, test_loss: 1.3909, test_f1: 0.6788
 epoch: 84, train_loss: 0.3206, test_loss: 1.3810, test_f1: 0.6696
 epoch: 85, train_loss: 0.3072, test_loss: 1.4878, test_f1: 0.6659
 epoch: 86, train_loss: 0.3060, test_loss: 1.2698, test_f1: 0.6521
 epoch: 87, train_loss: 0.3130, test_loss: 1.0705, test_f1: 0.6599
 epoch: 88, train_loss: 0.3161, test_loss: 1.2132, test_f1: 0.6571
 epoch: 89, train_loss: 0.3166, test_loss: 1.2304, test_f1: 0.6675
 epoch: 90, train_loss: 0.3135, test_loss: 1.2881, test_f1: 0.6864
 epoch: 91, train_loss: 0.2977, test_loss: 1.1045, test_f1: 0.6815
 epoch: 92, train_loss: 0.3027, test_loss: 1.1594, test_f1: 0.6762
 epoch: 93, train_loss: 0.2992, test_loss: 1.6677, test_f1: 0.6530
 epoch: 94, train_loss: 0.3197, test_loss: 1.6638, test_f1: 0.6530
 epoch: 95, train_loss: 0.3003, test_loss: 1.4599, test_f1: 0.6577
 epoch: 96, train_loss: 0.3047, test_loss: 1.4626, test_f1: 0.6615
 epoch: 97, train_loss: 0.2749, test_loss: 1.4403, test_f1: 0.6659
 epoch: 98, train_loss: 0.2845, test_loss: 1.2012, test_f1: 0.6722
 epoch: 99, train_loss: 0.2985, test_loss: 1.2694, test_f1: 0.6840

Training completed in 1067.94 seconds
Best F1: 0.7330 at epoch 96
Mean F1 across iterations: 0.7024  0.0123
========================FINAL RESULTS================================
FEGIN weighted F1: 0.7330  0.0123
python main.py --data ltspice_examples --representation component_pin --model FEGIN --layers 2 --hiddens 128 --batch_size 64 --lr 0.01 --emb_size 512 --epochs 100 --save_appendix component_pin_L2_H128_BS64_LR0.01_E512 --no_val
-----



STDERR:
  File "main.py", line 370, in <module>
    main()
  File "main.py", line 254, in main
    dataset = dataset_class(
  File "/home/philip/projects/llm_inference_code_repo/Circuit-Completion-Using-GNNs/component_classification_with_link_prediction_head/evaluation/FEGIN/kernel/circuit_datasets.py", line 15, in __init__
    self.data, self.slices = torch.load(self.processed_paths[0])
  File "/home/philip/.local/lib/python3.8/site-packages/torch/serialization.py", line 1040, in load
    warnings.warn(
  File "/usr/lib/python3.8/warnings.py", line 109, in _showwarnmsg
    sw(msg.message, msg.category, msg.filename, msg.lineno,
  File "main.py", line 47, in warn_with_traceback
    traceback.print_stack(file=log)
/home/philip/projects/llm_inference_code_repo/Circuit-Completion-Using-GNNs/component_classification_with_link_prediction_head/evaluation/FEGIN/kernel/circuit_datasets.py:15: FutureWarning: You are using `torch.load` with `weights_only=False` (the current default value), which uses the default pickle module implicitly. It is possible to construct malicious pickle data which will execute arbitrary code during unpickling (See https://github.com/pytorch/pytorch/blob/main/SECURITY.md#untrusted-models for more details). In a future release, the default value for `weights_only` will be flipped to `True`. This limits the functions that could be executed during unpickling. Arbitrary objects will no longer be allowed to be loaded via this mode unless they are explicitly allowlisted by the user via `torch.serialization.add_safe_globals`. We recommend you start setting `weights_only=True` for any use case where you don't have full control of the loaded file. Please open an issue on GitHub for any issues related to this experimental feature.
  self.data, self.slices = torch.load(self.processed_paths[0])
