STDOUT:
Results will be saved in /home/philip/projects/ltspice_examples_code_repo/Circuit-Completion-Using-GNNs/component_classification_with_link_prediction_head/evaluation/FEGIN/results/model_FEGIN_dataset_ltspice_demos
Command line input: python main.py --data ltspice_demos --representation component_pin --model FEGIN --layers 4 --hiddens 64 --batch_size 256 --lr 0.0001 --emb_size 128 --epochs 100 --save_appendix component_pin_L4_H64_BS256_LR0.0001_E128 --no_val
 is saved.
-----
ltspice_demos - FEGIN
Using 4 layers, 64 hidden units, h = 2
Loading component_pin representation dataset
ENTERED
Training FEGIN on component_pin representation
Train: 1565, Test: 383
##################ITERATION #0 ****************************************
 epoch: 0, train_loss: 1.3941, test_loss: 1.3932, test_f1: 0.0301
 epoch: 1, train_loss: 1.3894, test_loss: 1.3912, test_f1: 0.0301
 epoch: 2, train_loss: 1.3871, test_loss: 1.3896, test_f1: 0.0301
 epoch: 3, train_loss: 1.3846, test_loss: 1.3883, test_f1: 0.0301
 epoch: 4, train_loss: 1.3821, test_loss: 1.3871, test_f1: 0.0301
 epoch: 5, train_loss: 1.3799, test_loss: 1.3856, test_f1: 0.0502
 epoch: 6, train_loss: 1.3769, test_loss: 1.3838, test_f1: 0.1096
 epoch: 7, train_loss: 1.3741, test_loss: 1.3815, test_f1: 0.1501
 epoch: 8, train_loss: 1.3717, test_loss: 1.3791, test_f1: 0.1715
 epoch: 9, train_loss: 1.3684, test_loss: 1.3767, test_f1: 0.2265
 epoch: 10, train_loss: 1.3653, test_loss: 1.3741, test_f1: 0.3639
 epoch: 11, train_loss: 1.3625, test_loss: 1.3713, test_f1: 0.3725
 epoch: 12, train_loss: 1.3582, test_loss: 1.3685, test_f1: 0.4040
 epoch: 13, train_loss: 1.3540, test_loss: 1.3652, test_f1: 0.4212
 epoch: 14, train_loss: 1.3502, test_loss: 1.3622, test_f1: 0.3933
 epoch: 15, train_loss: 1.3460, test_loss: 1.3589, test_f1: 0.3620
 epoch: 16, train_loss: 1.3396, test_loss: 1.3553, test_f1: 0.3647
 epoch: 17, train_loss: 1.3328, test_loss: 1.3512, test_f1: 0.3640
 epoch: 18, train_loss: 1.3271, test_loss: 1.3466, test_f1: 0.3532
 epoch: 19, train_loss: 1.3188, test_loss: 1.3413, test_f1: 0.3469
 epoch: 20, train_loss: 1.3102, test_loss: 1.3357, test_f1: 0.3336
 epoch: 21, train_loss: 1.3035, test_loss: 1.3304, test_f1: 0.3365
 epoch: 22, train_loss: 1.2924, test_loss: 1.3248, test_f1: 0.3199
 epoch: 23, train_loss: 1.2808, test_loss: 1.3175, test_f1: 0.3229
 epoch: 24, train_loss: 1.2701, test_loss: 1.3097, test_f1: 0.3229
 epoch: 25, train_loss: 1.2582, test_loss: 1.3021, test_f1: 0.3199
 epoch: 26, train_loss: 1.2491, test_loss: 1.2950, test_f1: 0.3262
 epoch: 27, train_loss: 1.2351, test_loss: 1.2883, test_f1: 0.3269
 epoch: 28, train_loss: 1.2214, test_loss: 1.2790, test_f1: 0.3380
 epoch: 29, train_loss: 1.2116, test_loss: 1.2711, test_f1: 0.3349
 epoch: 30, train_loss: 1.2049, test_loss: 1.2645, test_f1: 0.3381
 epoch: 31, train_loss: 1.1983, test_loss: 1.2589, test_f1: 0.3490
 epoch: 32, train_loss: 1.1928, test_loss: 1.2536, test_f1: 0.3567
 epoch: 33, train_loss: 1.1829, test_loss: 1.2466, test_f1: 0.3617
 epoch: 34, train_loss: 1.1768, test_loss: 1.2401, test_f1: 0.3843
 epoch: 35, train_loss: 1.1654, test_loss: 1.2346, test_f1: 0.4078
 epoch: 36, train_loss: 1.1613, test_loss: 1.2306, test_f1: 0.4247
 epoch: 37, train_loss: 1.1561, test_loss: 1.2253, test_f1: 0.4247
 epoch: 38, train_loss: 1.1514, test_loss: 1.2221, test_f1: 0.4248
 epoch: 39, train_loss: 1.1492, test_loss: 1.2196, test_f1: 0.4370
 epoch: 40, train_loss: 1.1418, test_loss: 1.2162, test_f1: 0.4483
 epoch: 41, train_loss: 1.1376, test_loss: 1.2121, test_f1: 0.4484
 epoch: 42, train_loss: 1.1314, test_loss: 1.2092, test_f1: 0.4478
 epoch: 43, train_loss: 1.1308, test_loss: 1.2072, test_f1: 0.4584
 epoch: 44, train_loss: 1.1275, test_loss: 1.2037, test_f1: 0.4541
 epoch: 45, train_loss: 1.1262, test_loss: 1.2018, test_f1: 0.4610
 epoch: 46, train_loss: 1.1174, test_loss: 1.1980, test_f1: 0.4497
 epoch: 47, train_loss: 1.1156, test_loss: 1.1952, test_f1: 0.4497
 epoch: 48, train_loss: 1.1086, test_loss: 1.1923, test_f1: 0.4496
 epoch: 49, train_loss: 1.1047, test_loss: 1.1911, test_f1: 0.4503
 epoch: 50, train_loss: 1.1000, test_loss: 1.1889, test_f1: 0.4503
 epoch: 51, train_loss: 1.0988, test_loss: 1.1863, test_f1: 0.4503
 epoch: 52, train_loss: 1.0975, test_loss: 1.1846, test_f1: 0.4522
 epoch: 53, train_loss: 1.0970, test_loss: 1.1862, test_f1: 0.4503
 epoch: 54, train_loss: 1.0906, test_loss: 1.1862, test_f1: 0.4517
 epoch: 55, train_loss: 1.0949, test_loss: 1.1847, test_f1: 0.4665
 epoch: 56, train_loss: 1.0893, test_loss: 1.1818, test_f1: 0.4517
 epoch: 57, train_loss: 1.0869, test_loss: 1.1790, test_f1: 0.4503
 epoch: 58, train_loss: 1.0907, test_loss: 1.1769, test_f1: 0.4504
 epoch: 59, train_loss: 1.0815, test_loss: 1.1753, test_f1: 0.4504
 epoch: 60, train_loss: 1.0859, test_loss: 1.1726, test_f1: 0.4516
 epoch: 61, train_loss: 1.0816, test_loss: 1.1714, test_f1: 0.4506
 epoch: 62, train_loss: 1.0777, test_loss: 1.1699, test_f1: 0.4500
 epoch: 63, train_loss: 1.0771, test_loss: 1.1687, test_f1: 0.4500
 epoch: 64, train_loss: 1.0723, test_loss: 1.1666, test_f1: 0.4500
 epoch: 65, train_loss: 1.0701, test_loss: 1.1669, test_f1: 0.4494
 epoch: 66, train_loss: 1.0687, test_loss: 1.1665, test_f1: 0.4499
 epoch: 67, train_loss: 1.0678, test_loss: 1.1655, test_f1: 0.4500
 epoch: 68, train_loss: 1.0660, test_loss: 1.1633, test_f1: 0.4495
 epoch: 69, train_loss: 1.0599, test_loss: 1.1590, test_f1: 0.4500
 epoch: 70, train_loss: 1.0604, test_loss: 1.1586, test_f1: 0.4495
 epoch: 71, train_loss: 1.0523, test_loss: 1.1562, test_f1: 0.4495
 epoch: 72, train_loss: 1.0531, test_loss: 1.1558, test_f1: 0.4500
 epoch: 73, train_loss: 1.0528, test_loss: 1.1550, test_f1: 0.4500
 epoch: 74, train_loss: 1.0519, test_loss: 1.1536, test_f1: 0.4495
 epoch: 75, train_loss: 1.0534, test_loss: 1.1516, test_f1: 0.4500
 epoch: 76, train_loss: 1.0469, test_loss: 1.1507, test_f1: 0.4490
 epoch: 77, train_loss: 1.0458, test_loss: 1.1478, test_f1: 0.4516
 epoch: 78, train_loss: 1.0386, test_loss: 1.1487, test_f1: 0.4458
 epoch: 79, train_loss: 1.0397, test_loss: 1.1461, test_f1: 0.4503
 epoch: 80, train_loss: 1.0360, test_loss: 1.1427, test_f1: 0.4507
 epoch: 81, train_loss: 1.0360, test_loss: 1.1394, test_f1: 0.4511
 epoch: 82, train_loss: 1.0295, test_loss: 1.1396, test_f1: 0.4511
 epoch: 83, train_loss: 1.0290, test_loss: 1.1367, test_f1: 0.4507
 epoch: 84, train_loss: 1.0268, test_loss: 1.1347, test_f1: 0.4477
 epoch: 85, train_loss: 1.0222, test_loss: 1.1314, test_f1: 0.4495
 epoch: 86, train_loss: 1.0266, test_loss: 1.1317, test_f1: 0.4495
 epoch: 87, train_loss: 1.0199, test_loss: 1.1287, test_f1: 0.4511
 epoch: 88, train_loss: 1.0171, test_loss: 1.1263, test_f1: 0.4516
 epoch: 89, train_loss: 1.0093, test_loss: 1.1262, test_f1: 0.4503
 epoch: 90, train_loss: 1.0102, test_loss: 1.1266, test_f1: 0.4503
 epoch: 91, train_loss: 1.0105, test_loss: 1.1271, test_f1: 0.4495
 epoch: 92, train_loss: 1.0096, test_loss: 1.1246, test_f1: 0.4503
 epoch: 93, train_loss: 1.0088, test_loss: 1.1227, test_f1: 0.4507
 epoch: 94, train_loss: 1.0039, test_loss: 1.1237, test_f1: 0.4510
 epoch: 95, train_loss: 1.0030, test_loss: 1.1180, test_f1: 0.4532
 epoch: 96, train_loss: 0.9970, test_loss: 1.1136, test_f1: 0.4516
 epoch: 97, train_loss: 0.9986, test_loss: 1.1124, test_f1: 0.4526
 epoch: 98, train_loss: 0.9949, test_loss: 1.1141, test_f1: 0.4511
 epoch: 99, train_loss: 0.9977, test_loss: 1.1150, test_f1: 0.4499
##################ITERATION #1 ****************************************
 epoch: 0, train_loss: 1.3497, test_loss: 1.3608, test_f1: 0.2404
 epoch: 1, train_loss: 1.3411, test_loss: 1.3583, test_f1: 0.2404
 epoch: 2, train_loss: 1.3358, test_loss: 1.3553, test_f1: 0.2253
 epoch: 3, train_loss: 1.3305, test_loss: 1.3521, test_f1: 0.2281
 epoch: 4, train_loss: 1.3255, test_loss: 1.3489, test_f1: 0.2281
 epoch: 5, train_loss: 1.3203, test_loss: 1.3451, test_f1: 0.2306
 epoch: 6, train_loss: 1.3128, test_loss: 1.3408, test_f1: 0.2432
 epoch: 7, train_loss: 1.3073, test_loss: 1.3360, test_f1: 0.2643
 epoch: 8, train_loss: 1.2989, test_loss: 1.3315, test_f1: 0.2630
 epoch: 9, train_loss: 1.2932, test_loss: 1.3263, test_f1: 0.2644
 epoch: 10, train_loss: 1.2859, test_loss: 1.3211, test_f1: 0.2615
 epoch: 11, train_loss: 1.2814, test_loss: 1.3158, test_f1: 0.2621
 epoch: 12, train_loss: 1.2707, test_loss: 1.3103, test_f1: 0.2618
 epoch: 13, train_loss: 1.2610, test_loss: 1.3050, test_f1: 0.2618
 epoch: 14, train_loss: 1.2558, test_loss: 1.2995, test_f1: 0.2618
 epoch: 15, train_loss: 1.2459, test_loss: 1.2940, test_f1: 0.2663
 epoch: 16, train_loss: 1.2380, test_loss: 1.2878, test_f1: 0.2587
 epoch: 17, train_loss: 1.2294, test_loss: 1.2817, test_f1: 0.2587
 epoch: 18, train_loss: 1.2204, test_loss: 1.2761, test_f1: 0.2587
 epoch: 19, train_loss: 1.2127, test_loss: 1.2704, test_f1: 0.2587
 epoch: 20, train_loss: 1.2072, test_loss: 1.2644, test_f1: 0.2573
 epoch: 21, train_loss: 1.1978, test_loss: 1.2580, test_f1: 0.2648
 epoch: 22, train_loss: 1.1918, test_loss: 1.2524, test_f1: 0.2963
 epoch: 23, train_loss: 1.1812, test_loss: 1.2468, test_f1: 0.3018
 epoch: 24, train_loss: 1.1778, test_loss: 1.2421, test_f1: 0.3239
 epoch: 25, train_loss: 1.1686, test_loss: 1.2368, test_f1: 0.3419
 epoch: 26, train_loss: 1.1607, test_loss: 1.2315, test_f1: 0.3651
 epoch: 27, train_loss: 1.1565, test_loss: 1.2244, test_f1: 0.3726
 epoch: 28, train_loss: 1.1508, test_loss: 1.2186, test_f1: 0.4007
 epoch: 29, train_loss: 1.1426, test_loss: 1.2131, test_f1: 0.4100
 epoch: 30, train_loss: 1.1416, test_loss: 1.2080, test_f1: 0.4243
 epoch: 31, train_loss: 1.1314, test_loss: 1.2063, test_f1: 0.4297
 epoch: 32, train_loss: 1.1263, test_loss: 1.2007, test_f1: 0.4297
 epoch: 33, train_loss: 1.1167, test_loss: 1.1932, test_f1: 0.4401
 epoch: 34, train_loss: 1.1158, test_loss: 1.1859, test_f1: 0.4401
 epoch: 35, train_loss: 1.1064, test_loss: 1.1806, test_f1: 0.4542
 epoch: 36, train_loss: 1.0971, test_loss: 1.1755, test_f1: 0.4461
 epoch: 37, train_loss: 1.0932, test_loss: 1.1714, test_f1: 0.4528
 epoch: 38, train_loss: 1.0859, test_loss: 1.1656, test_f1: 0.4461
 epoch: 39, train_loss: 1.0788, test_loss: 1.1615, test_f1: 0.4510
 epoch: 40, train_loss: 1.0785, test_loss: 1.1566, test_f1: 0.4495
 epoch: 41, train_loss: 1.0651, test_loss: 1.1494, test_f1: 0.4462
 epoch: 42, train_loss: 1.0632, test_loss: 1.1448, test_f1: 0.4476
 epoch: 43, train_loss: 1.0565, test_loss: 1.1432, test_f1: 0.4522
 epoch: 44, train_loss: 1.0516, test_loss: 1.1422, test_f1: 0.4498
 epoch: 45, train_loss: 1.0412, test_loss: 1.1363, test_f1: 0.4477
 epoch: 46, train_loss: 1.0409, test_loss: 1.1297, test_f1: 0.4524
 epoch: 47, train_loss: 1.0296, test_loss: 1.1218, test_f1: 0.4524
 epoch: 48, train_loss: 1.0273, test_loss: 1.1150, test_f1: 0.4492
 epoch: 49, train_loss: 1.0209, test_loss: 1.1070, test_f1: 0.4474
 epoch: 50, train_loss: 1.0211, test_loss: 1.1061, test_f1: 0.4525
 epoch: 51, train_loss: 1.0105, test_loss: 1.1029, test_f1: 0.4430
 epoch: 52, train_loss: 1.0110, test_loss: 1.1024, test_f1: 0.4484
 epoch: 53, train_loss: 1.0109, test_loss: 1.0948, test_f1: 0.4545
 epoch: 54, train_loss: 1.0052, test_loss: 1.0990, test_f1: 0.4517
 epoch: 55, train_loss: 1.0004, test_loss: 1.0961, test_f1: 0.4543
 epoch: 56, train_loss: 0.9953, test_loss: 1.0931, test_f1: 0.4470
 epoch: 57, train_loss: 0.9915, test_loss: 1.0905, test_f1: 0.4431
 epoch: 58, train_loss: 0.9902, test_loss: 1.0867, test_f1: 0.4431
 epoch: 59, train_loss: 0.9819, test_loss: 1.0862, test_f1: 0.4431
 epoch: 60, train_loss: 0.9878, test_loss: 1.0854, test_f1: 0.4427
 epoch: 61, train_loss: 0.9856, test_loss: 1.0802, test_f1: 0.4475
 epoch: 62, train_loss: 0.9817, test_loss: 1.0768, test_f1: 0.4449
 epoch: 63, train_loss: 0.9793, test_loss: 1.0764, test_f1: 0.4504
 epoch: 64, train_loss: 0.9732, test_loss: 1.0730, test_f1: 0.4501
 epoch: 65, train_loss: 0.9742, test_loss: 1.0692, test_f1: 0.4534
 epoch: 66, train_loss: 0.9733, test_loss: 1.0726, test_f1: 0.4529
 epoch: 67, train_loss: 0.9729, test_loss: 1.0747, test_f1: 0.4431
 epoch: 68, train_loss: 0.9712, test_loss: 1.0710, test_f1: 0.4455
 epoch: 69, train_loss: 0.9673, test_loss: 1.0625, test_f1: 0.4451
 epoch: 70, train_loss: 0.9577, test_loss: 1.0601, test_f1: 0.4498
 epoch: 71, train_loss: 0.9544, test_loss: 1.0622, test_f1: 0.4479
 epoch: 72, train_loss: 0.9571, test_loss: 1.0589, test_f1: 0.4553
 epoch: 73, train_loss: 0.9538, test_loss: 1.0538, test_f1: 0.4553
 epoch: 74, train_loss: 0.9563, test_loss: 1.0586, test_f1: 0.4479
 epoch: 75, train_loss: 0.9542, test_loss: 1.0610, test_f1: 0.4479
 epoch: 76, train_loss: 0.9463, test_loss: 1.0542, test_f1: 0.4525
 epoch: 77, train_loss: 0.9503, test_loss: 1.0474, test_f1: 0.4572
 epoch: 78, train_loss: 0.9533, test_loss: 1.0449, test_f1: 0.4548
 epoch: 79, train_loss: 0.9521, test_loss: 1.0407, test_f1: 0.4529
 epoch: 80, train_loss: 0.9441, test_loss: 1.0541, test_f1: 0.4455
 epoch: 81, train_loss: 0.9424, test_loss: 1.0500, test_f1: 0.4543
 epoch: 82, train_loss: 0.9417, test_loss: 1.0372, test_f1: 0.4534
 epoch: 83, train_loss: 0.9404, test_loss: 1.0431, test_f1: 0.4411
 epoch: 84, train_loss: 0.9371, test_loss: 1.0517, test_f1: 0.4521
 epoch: 85, train_loss: 0.9413, test_loss: 1.0534, test_f1: 0.4471
 epoch: 86, train_loss: 0.9373, test_loss: 1.0458, test_f1: 0.4548
 epoch: 87, train_loss: 0.9310, test_loss: 1.0432, test_f1: 0.4419
 epoch: 88, train_loss: 0.9344, test_loss: 1.0453, test_f1: 0.4297
 epoch: 89, train_loss: 0.9353, test_loss: 1.0415, test_f1: 0.4354
 epoch: 90, train_loss: 0.9308, test_loss: 1.0434, test_f1: 0.4553
 epoch: 91, train_loss: 0.9292, test_loss: 1.0455, test_f1: 0.4438
 epoch: 92, train_loss: 0.9216, test_loss: 1.0369, test_f1: 0.4392
 epoch: 93, train_loss: 0.9186, test_loss: 1.0311, test_f1: 0.4461
 epoch: 94, train_loss: 0.9228, test_loss: 1.0337, test_f1: 0.4516
 epoch: 95, train_loss: 0.9235, test_loss: 1.0403, test_f1: 0.4384
 epoch: 96, train_loss: 0.9194, test_loss: 1.0392, test_f1: 0.4396
 epoch: 97, train_loss: 0.9187, test_loss: 1.0266, test_f1: 0.4446
 epoch: 98, train_loss: 0.9118, test_loss: 1.0238, test_f1: 0.4631
 epoch: 99, train_loss: 0.9118, test_loss: 1.0234, test_f1: 0.4464
##################ITERATION #2 ****************************************
 epoch: 0, train_loss: 1.3215, test_loss: 1.3431, test_f1: 0.2281
 epoch: 1, train_loss: 1.3084, test_loss: 1.3414, test_f1: 0.2281
 epoch: 2, train_loss: 1.3001, test_loss: 1.3399, test_f1: 0.2281
 epoch: 3, train_loss: 1.2923, test_loss: 1.3371, test_f1: 0.2281
 epoch: 4, train_loss: 1.2851, test_loss: 1.3333, test_f1: 0.2281
 epoch: 5, train_loss: 1.2778, test_loss: 1.3295, test_f1: 0.2281
 epoch: 6, train_loss: 1.2677, test_loss: 1.3246, test_f1: 0.2281
 epoch: 7, train_loss: 1.2603, test_loss: 1.3196, test_f1: 0.2281
 epoch: 8, train_loss: 1.2502, test_loss: 1.3156, test_f1: 0.2281
 epoch: 9, train_loss: 1.2440, test_loss: 1.3116, test_f1: 0.2281
 epoch: 10, train_loss: 1.2370, test_loss: 1.3064, test_f1: 0.2281
 epoch: 11, train_loss: 1.2303, test_loss: 1.2987, test_f1: 0.2281
 epoch: 12, train_loss: 1.2217, test_loss: 1.2894, test_f1: 0.2281
 epoch: 13, train_loss: 1.2128, test_loss: 1.2759, test_f1: 0.2281
 epoch: 14, train_loss: 1.2043, test_loss: 1.2636, test_f1: 0.2759
 epoch: 15, train_loss: 1.1959, test_loss: 1.2537, test_f1: 0.2913
 epoch: 16, train_loss: 1.1880, test_loss: 1.2473, test_f1: 0.3083
 epoch: 17, train_loss: 1.1799, test_loss: 1.2411, test_f1: 0.3176
 epoch: 18, train_loss: 1.1722, test_loss: 1.2367, test_f1: 0.3521
 epoch: 19, train_loss: 1.1624, test_loss: 1.2303, test_f1: 0.3548
 epoch: 20, train_loss: 1.1534, test_loss: 1.2225, test_f1: 0.3333
 epoch: 21, train_loss: 1.1457, test_loss: 1.2152, test_f1: 0.3370
 epoch: 22, train_loss: 1.1360, test_loss: 1.2086, test_f1: 0.3576
 epoch: 23, train_loss: 1.1301, test_loss: 1.2035, test_f1: 0.3672
 epoch: 24, train_loss: 1.1192, test_loss: 1.1997, test_f1: 0.3672
 epoch: 25, train_loss: 1.1151, test_loss: 1.1933, test_f1: 0.3631
 epoch: 26, train_loss: 1.1075, test_loss: 1.1868, test_f1: 0.3824
 epoch: 27, train_loss: 1.0974, test_loss: 1.1834, test_f1: 0.3767
 epoch: 28, train_loss: 1.0912, test_loss: 1.1767, test_f1: 0.3765
 epoch: 29, train_loss: 1.0853, test_loss: 1.1680, test_f1: 0.3800
 epoch: 30, train_loss: 1.0785, test_loss: 1.1621, test_f1: 0.3838
 epoch: 31, train_loss: 1.0712, test_loss: 1.1560, test_f1: 0.3838
 epoch: 32, train_loss: 1.0636, test_loss: 1.1588, test_f1: 0.3959
 epoch: 33, train_loss: 1.0547, test_loss: 1.1580, test_f1: 0.3880
 epoch: 34, train_loss: 1.0511, test_loss: 1.1525, test_f1: 0.3938
 epoch: 35, train_loss: 1.0476, test_loss: 1.1424, test_f1: 0.3940
 epoch: 36, train_loss: 1.0397, test_loss: 1.1299, test_f1: 0.4031
 epoch: 37, train_loss: 1.0290, test_loss: 1.1297, test_f1: 0.3936
 epoch: 38, train_loss: 1.0223, test_loss: 1.1279, test_f1: 0.4088
 epoch: 39, train_loss: 1.0217, test_loss: 1.1228, test_f1: 0.4094
 epoch: 40, train_loss: 1.0106, test_loss: 1.1198, test_f1: 0.4149
 epoch: 41, train_loss: 1.0074, test_loss: 1.1144, test_f1: 0.4158
 epoch: 42, train_loss: 1.0025, test_loss: 1.1113, test_f1: 0.4195
 epoch: 43, train_loss: 0.9976, test_loss: 1.1054, test_f1: 0.4208
 epoch: 44, train_loss: 0.9945, test_loss: 1.1065, test_f1: 0.4088
 epoch: 45, train_loss: 0.9890, test_loss: 1.1004, test_f1: 0.4105
 epoch: 46, train_loss: 0.9833, test_loss: 1.0925, test_f1: 0.4244
 epoch: 47, train_loss: 0.9811, test_loss: 1.0867, test_f1: 0.4175
 epoch: 48, train_loss: 0.9756, test_loss: 1.0844, test_f1: 0.4111
 epoch: 49, train_loss: 0.9602, test_loss: 1.0838, test_f1: 0.4128
 epoch: 50, train_loss: 0.9565, test_loss: 1.0799, test_f1: 0.4220
 epoch: 51, train_loss: 0.9555, test_loss: 1.0764, test_f1: 0.4239
 epoch: 52, train_loss: 0.9517, test_loss: 1.0717, test_f1: 0.4370
 epoch: 53, train_loss: 0.9515, test_loss: 1.0713, test_f1: 0.4370
 epoch: 54, train_loss: 0.9465, test_loss: 1.0672, test_f1: 0.4377
 epoch: 55, train_loss: 0.9488, test_loss: 1.0701, test_f1: 0.4270
 epoch: 56, train_loss: 0.9506, test_loss: 1.0674, test_f1: 0.4364
 epoch: 57, train_loss: 0.9455, test_loss: 1.0678, test_f1: 0.4395
 epoch: 58, train_loss: 0.9393, test_loss: 1.0696, test_f1: 0.4378
 epoch: 59, train_loss: 0.9450, test_loss: 1.0633, test_f1: 0.4342
 epoch: 60, train_loss: 0.9354, test_loss: 1.0588, test_f1: 0.4365
 epoch: 61, train_loss: 0.9478, test_loss: 1.0610, test_f1: 0.4395
 epoch: 62, train_loss: 0.9381, test_loss: 1.0622, test_f1: 0.4364
 epoch: 63, train_loss: 0.9360, test_loss: 1.0552, test_f1: 0.4389
 epoch: 64, train_loss: 0.9321, test_loss: 1.0580, test_f1: 0.4378
 epoch: 65, train_loss: 0.9306, test_loss: 1.0574, test_f1: 0.4342
 epoch: 66, train_loss: 0.9337, test_loss: 1.0508, test_f1: 0.4431
 epoch: 67, train_loss: 0.9243, test_loss: 1.0563, test_f1: 0.4414
 epoch: 68, train_loss: 0.9261, test_loss: 1.0546, test_f1: 0.4414
 epoch: 69, train_loss: 0.9237, test_loss: 1.0519, test_f1: 0.4323
 epoch: 70, train_loss: 0.9191, test_loss: 1.0489, test_f1: 0.4377
 epoch: 71, train_loss: 0.9228, test_loss: 1.0530, test_f1: 0.4353
 epoch: 72, train_loss: 0.9169, test_loss: 1.0505, test_f1: 0.4388
 epoch: 73, train_loss: 0.9230, test_loss: 1.0414, test_f1: 0.4417
 epoch: 74, train_loss: 0.9140, test_loss: 1.0396, test_f1: 0.4399
 epoch: 75, train_loss: 0.9140, test_loss: 1.0398, test_f1: 0.4405
 epoch: 76, train_loss: 0.9211, test_loss: 1.0418, test_f1: 0.4405
 epoch: 77, train_loss: 0.9108, test_loss: 1.0323, test_f1: 0.4513
 epoch: 78, train_loss: 0.9109, test_loss: 1.0332, test_f1: 0.4496
 epoch: 79, train_loss: 0.9162, test_loss: 1.0360, test_f1: 0.4548
 epoch: 80, train_loss: 0.9171, test_loss: 1.0353, test_f1: 0.4649
 epoch: 81, train_loss: 0.9038, test_loss: 1.0316, test_f1: 0.4631
 epoch: 82, train_loss: 0.9113, test_loss: 1.0377, test_f1: 0.4495
 epoch: 83, train_loss: 0.9034, test_loss: 1.0331, test_f1: 0.4430
 epoch: 84, train_loss: 0.9081, test_loss: 1.0279, test_f1: 0.4430
 epoch: 85, train_loss: 0.9015, test_loss: 1.0308, test_f1: 0.4448
 epoch: 86, train_loss: 0.9033, test_loss: 1.0317, test_f1: 0.4478
 epoch: 87, train_loss: 0.8989, test_loss: 1.0249, test_f1: 0.4518
 epoch: 88, train_loss: 0.8954, test_loss: 1.0260, test_f1: 0.4483
 epoch: 89, train_loss: 0.8970, test_loss: 1.0266, test_f1: 0.4523
 epoch: 90, train_loss: 0.8991, test_loss: 1.0217, test_f1: 0.4543
 epoch: 91, train_loss: 0.8935, test_loss: 1.0217, test_f1: 0.4426
 epoch: 92, train_loss: 0.8925, test_loss: 1.0202, test_f1: 0.4506
 epoch: 93, train_loss: 0.8914, test_loss: 1.0375, test_f1: 0.4424
 epoch: 94, train_loss: 0.8977, test_loss: 1.0249, test_f1: 0.4501
 epoch: 95, train_loss: 0.8936, test_loss: 1.0231, test_f1: 0.4519
 epoch: 96, train_loss: 0.8859, test_loss: 1.0314, test_f1: 0.4556
 epoch: 97, train_loss: 0.8853, test_loss: 1.0328, test_f1: 0.4525
 epoch: 98, train_loss: 0.8887, test_loss: 1.0265, test_f1: 0.4556
 epoch: 99, train_loss: 0.8861, test_loss: 1.0228, test_f1: 0.4550
##################ITERATION #3 ****************************************
 epoch: 0, train_loss: 1.3071, test_loss: 1.3341, test_f1: 0.2281
 epoch: 1, train_loss: 1.2913, test_loss: 1.3274, test_f1: 0.2281
 epoch: 2, train_loss: 1.2828, test_loss: 1.3229, test_f1: 0.2281
 epoch: 3, train_loss: 1.2743, test_loss: 1.3194, test_f1: 0.2281
 epoch: 4, train_loss: 1.2672, test_loss: 1.3169, test_f1: 0.2281
 epoch: 5, train_loss: 1.2595, test_loss: 1.3146, test_f1: 0.2281
 epoch: 6, train_loss: 1.2517, test_loss: 1.3086, test_f1: 0.2281
 epoch: 7, train_loss: 1.2457, test_loss: 1.3021, test_f1: 0.2281
 epoch: 8, train_loss: 1.2385, test_loss: 1.2964, test_f1: 0.2281
 epoch: 9, train_loss: 1.2287, test_loss: 1.2925, test_f1: 0.2281
 epoch: 10, train_loss: 1.2243, test_loss: 1.2889, test_f1: 0.2281
 epoch: 11, train_loss: 1.2174, test_loss: 1.2847, test_f1: 0.2281
 epoch: 12, train_loss: 1.2103, test_loss: 1.2808, test_f1: 0.2281
 epoch: 13, train_loss: 1.2031, test_loss: 1.2765, test_f1: 0.2281
 epoch: 14, train_loss: 1.1976, test_loss: 1.2708, test_f1: 0.2281
 epoch: 15, train_loss: 1.1919, test_loss: 1.2671, test_f1: 0.2281
 epoch: 16, train_loss: 1.1811, test_loss: 1.2640, test_f1: 0.2390
 epoch: 17, train_loss: 1.1785, test_loss: 1.2612, test_f1: 0.2539
 epoch: 18, train_loss: 1.1699, test_loss: 1.2564, test_f1: 0.2718
 epoch: 19, train_loss: 1.1627, test_loss: 1.2518, test_f1: 0.2799
 epoch: 20, train_loss: 1.1577, test_loss: 1.2451, test_f1: 0.3083
 epoch: 21, train_loss: 1.1506, test_loss: 1.2445, test_f1: 0.3212
 epoch: 22, train_loss: 1.1432, test_loss: 1.2399, test_f1: 0.3261
 epoch: 23, train_loss: 1.1366, test_loss: 1.2328, test_f1: 0.3288
 epoch: 24, train_loss: 1.1301, test_loss: 1.2248, test_f1: 0.3310
 epoch: 25, train_loss: 1.1243, test_loss: 1.2188, test_f1: 0.3336
 epoch: 26, train_loss: 1.1211, test_loss: 1.2118, test_f1: 0.3362
 epoch: 27, train_loss: 1.1110, test_loss: 1.2051, test_f1: 0.3340
 epoch: 28, train_loss: 1.1041, test_loss: 1.1999, test_f1: 0.3340
 epoch: 29, train_loss: 1.0931, test_loss: 1.1974, test_f1: 0.3320
 epoch: 30, train_loss: 1.0856, test_loss: 1.1964, test_f1: 0.3323
 epoch: 31, train_loss: 1.0837, test_loss: 1.1921, test_f1: 0.3283
 epoch: 32, train_loss: 1.0757, test_loss: 1.1835, test_f1: 0.3251
 epoch: 33, train_loss: 1.0685, test_loss: 1.1740, test_f1: 0.3351
 epoch: 34, train_loss: 1.0662, test_loss: 1.1682, test_f1: 0.3363
 epoch: 35, train_loss: 1.0578, test_loss: 1.1676, test_f1: 0.3331
 epoch: 36, train_loss: 1.0525, test_loss: 1.1653, test_f1: 0.3256
 epoch: 37, train_loss: 1.0472, test_loss: 1.1621, test_f1: 0.3319
 epoch: 38, train_loss: 1.0411, test_loss: 1.1521, test_f1: 0.3326
 epoch: 39, train_loss: 1.0354, test_loss: 1.1452, test_f1: 0.3331
 epoch: 40, train_loss: 1.0313, test_loss: 1.1446, test_f1: 0.3360
 epoch: 41, train_loss: 1.0244, test_loss: 1.1532, test_f1: 0.3278
 epoch: 42, train_loss: 1.0165, test_loss: 1.1469, test_f1: 0.3260
 epoch: 43, train_loss: 1.0144, test_loss: 1.1372, test_f1: 0.3397
 epoch: 44, train_loss: 1.0115, test_loss: 1.1247, test_f1: 0.3343
 epoch: 45, train_loss: 1.0050, test_loss: 1.1116, test_f1: 0.3349
 epoch: 46, train_loss: 0.9992, test_loss: 1.1176, test_f1: 0.3448
 epoch: 47, train_loss: 0.9988, test_loss: 1.1354, test_f1: 0.3860
 epoch: 48, train_loss: 0.9945, test_loss: 1.1263, test_f1: 0.3940
 epoch: 49, train_loss: 0.9916, test_loss: 1.1138, test_f1: 0.3998
 epoch: 50, train_loss: 0.9846, test_loss: 1.1251, test_f1: 0.3843
 epoch: 51, train_loss: 0.9818, test_loss: 1.1208, test_f1: 0.3958
 epoch: 52, train_loss: 0.9780, test_loss: 1.1171, test_f1: 0.3962
 epoch: 53, train_loss: 0.9703, test_loss: 1.1016, test_f1: 0.3966
 epoch: 54, train_loss: 0.9725, test_loss: 1.0883, test_f1: 0.3931
 epoch: 55, train_loss: 0.9701, test_loss: 1.0848, test_f1: 0.4000
 epoch: 56, train_loss: 0.9642, test_loss: 1.0831, test_f1: 0.3904
 epoch: 57, train_loss: 0.9597, test_loss: 1.0824, test_f1: 0.3818
 epoch: 58, train_loss: 0.9615, test_loss: 1.0780, test_f1: 0.3834
 epoch: 59, train_loss: 0.9597, test_loss: 1.0769, test_f1: 0.3841
 epoch: 60, train_loss: 0.9579, test_loss: 1.0814, test_f1: 0.3832
 epoch: 61, train_loss: 0.9547, test_loss: 1.0786, test_f1: 0.3872
 epoch: 62, train_loss: 0.9583, test_loss: 1.0771, test_f1: 0.3856
 epoch: 63, train_loss: 0.9516, test_loss: 1.0765, test_f1: 0.3845
 epoch: 64, train_loss: 0.9478, test_loss: 1.0763, test_f1: 0.3868
 epoch: 65, train_loss: 0.9507, test_loss: 1.0786, test_f1: 0.3444
 epoch: 66, train_loss: 0.9441, test_loss: 1.0729, test_f1: 0.3808
 epoch: 67, train_loss: 0.9466, test_loss: 1.0750, test_f1: 0.3940
 epoch: 68, train_loss: 0.9451, test_loss: 1.0789, test_f1: 0.4032
 epoch: 69, train_loss: 0.9464, test_loss: 1.0744, test_f1: 0.4003
 epoch: 70, train_loss: 0.9440, test_loss: 1.0672, test_f1: 0.3915
 epoch: 71, train_loss: 0.9358, test_loss: 1.0638, test_f1: 0.3938
 epoch: 72, train_loss: 0.9307, test_loss: 1.0600, test_f1: 0.4021
 epoch: 73, train_loss: 0.9352, test_loss: 1.0595, test_f1: 0.3886
 epoch: 74, train_loss: 0.9344, test_loss: 1.0574, test_f1: 0.3952
 epoch: 75, train_loss: 0.9314, test_loss: 1.0571, test_f1: 0.3971
 epoch: 76, train_loss: 0.9269, test_loss: 1.0610, test_f1: 0.4064
 epoch: 77, train_loss: 0.9296, test_loss: 1.0579, test_f1: 0.4110
 epoch: 78, train_loss: 0.9214, test_loss: 1.0569, test_f1: 0.4131
 epoch: 79, train_loss: 0.9216, test_loss: 1.0533, test_f1: 0.4024
 epoch: 80, train_loss: 0.9165, test_loss: 1.0523, test_f1: 0.4043
 epoch: 81, train_loss: 0.9261, test_loss: 1.0488, test_f1: 0.3942
 epoch: 82, train_loss: 0.9171, test_loss: 1.0482, test_f1: 0.4027
 epoch: 83, train_loss: 0.9163, test_loss: 1.0483, test_f1: 0.4192
 epoch: 84, train_loss: 0.9125, test_loss: 1.0502, test_f1: 0.4032
 epoch: 85, train_loss: 0.9140, test_loss: 1.0435, test_f1: 0.3914
 epoch: 86, train_loss: 0.9135, test_loss: 1.0419, test_f1: 0.3928
 epoch: 87, train_loss: 0.9055, test_loss: 1.0430, test_f1: 0.4006
 epoch: 88, train_loss: 0.9126, test_loss: 1.0498, test_f1: 0.3970
 epoch: 89, train_loss: 0.9047, test_loss: 1.0482, test_f1: 0.3946
 epoch: 90, train_loss: 0.8973, test_loss: 1.0400, test_f1: 0.3969
 epoch: 91, train_loss: 0.9017, test_loss: 1.0371, test_f1: 0.3969
 epoch: 92, train_loss: 0.9010, test_loss: 1.0345, test_f1: 0.3996
 epoch: 93, train_loss: 0.9001, test_loss: 1.0296, test_f1: 0.4050
 epoch: 94, train_loss: 0.8971, test_loss: 1.0294, test_f1: 0.4173
 epoch: 95, train_loss: 0.8977, test_loss: 1.0332, test_f1: 0.4189
 epoch: 96, train_loss: 0.8954, test_loss: 1.0371, test_f1: 0.4104
 epoch: 97, train_loss: 0.8893, test_loss: 1.0322, test_f1: 0.4238
 epoch: 98, train_loss: 0.8926, test_loss: 1.0297, test_f1: 0.4169
 epoch: 99, train_loss: 0.8865, test_loss: 1.0279, test_f1: 0.4157
##################ITERATION #4 ****************************************
 epoch: 0, train_loss: 1.3008, test_loss: 1.3301, test_f1: 0.2281
 epoch: 1, train_loss: 1.2779, test_loss: 1.3228, test_f1: 0.2281
 epoch: 2, train_loss: 1.2595, test_loss: 1.3164, test_f1: 0.2281
 epoch: 3, train_loss: 1.2522, test_loss: 1.3110, test_f1: 0.2281
 epoch: 4, train_loss: 1.2366, test_loss: 1.3048, test_f1: 0.2281
 epoch: 5, train_loss: 1.2254, test_loss: 1.2987, test_f1: 0.2281
 epoch: 6, train_loss: 1.2161, test_loss: 1.2934, test_f1: 0.2281
 epoch: 7, train_loss: 1.2070, test_loss: 1.2862, test_f1: 0.2281
 epoch: 8, train_loss: 1.1963, test_loss: 1.2779, test_f1: 0.2281
 epoch: 9, train_loss: 1.1838, test_loss: 1.2684, test_f1: 0.2281
 epoch: 10, train_loss: 1.1735, test_loss: 1.2584, test_f1: 0.2596
 epoch: 11, train_loss: 1.1722, test_loss: 1.2480, test_f1: 0.3286
 epoch: 12, train_loss: 1.1595, test_loss: 1.2382, test_f1: 0.3448
 epoch: 13, train_loss: 1.1516, test_loss: 1.2295, test_f1: 0.3537
 epoch: 14, train_loss: 1.1426, test_loss: 1.2198, test_f1: 0.3586
 epoch: 15, train_loss: 1.1359, test_loss: 1.2120, test_f1: 0.3590
 epoch: 16, train_loss: 1.1244, test_loss: 1.2036, test_f1: 0.3616
 epoch: 17, train_loss: 1.1181, test_loss: 1.1954, test_f1: 0.3624
 epoch: 18, train_loss: 1.1105, test_loss: 1.1867, test_f1: 0.3649
 epoch: 19, train_loss: 1.1006, test_loss: 1.1773, test_f1: 0.3785
 epoch: 20, train_loss: 1.0895, test_loss: 1.1685, test_f1: 0.3642
 epoch: 21, train_loss: 1.0850, test_loss: 1.1614, test_f1: 0.3868
 epoch: 22, train_loss: 1.0745, test_loss: 1.1537, test_f1: 0.3922
 epoch: 23, train_loss: 1.0657, test_loss: 1.1472, test_f1: 0.4002
 epoch: 24, train_loss: 1.0610, test_loss: 1.1407, test_f1: 0.4064
 epoch: 25, train_loss: 1.0525, test_loss: 1.1352, test_f1: 0.4064
 epoch: 26, train_loss: 1.0497, test_loss: 1.1288, test_f1: 0.4122
 epoch: 27, train_loss: 1.0441, test_loss: 1.1306, test_f1: 0.4180
 epoch: 28, train_loss: 1.0370, test_loss: 1.1235, test_f1: 0.4275
 epoch: 29, train_loss: 1.0289, test_loss: 1.1202, test_f1: 0.4377
 epoch: 30, train_loss: 1.0263, test_loss: 1.1132, test_f1: 0.4446
 epoch: 31, train_loss: 1.0139, test_loss: 1.1134, test_f1: 0.4461
 epoch: 32, train_loss: 1.0079, test_loss: 1.1081, test_f1: 0.4486
 epoch: 33, train_loss: 1.0074, test_loss: 1.1037, test_f1: 0.4527
 epoch: 34, train_loss: 1.0044, test_loss: 1.1036, test_f1: 0.4528
 epoch: 35, train_loss: 0.9943, test_loss: 1.1082, test_f1: 0.4516
 epoch: 36, train_loss: 0.9920, test_loss: 1.0981, test_f1: 0.4613
 epoch: 37, train_loss: 0.9847, test_loss: 1.0900, test_f1: 0.4701
 epoch: 38, train_loss: 0.9811, test_loss: 1.0882, test_f1: 0.4647
 epoch: 39, train_loss: 0.9745, test_loss: 1.0879, test_f1: 0.4547
 epoch: 40, train_loss: 0.9792, test_loss: 1.0826, test_f1: 0.4720
 epoch: 41, train_loss: 0.9741, test_loss: 1.0812, test_f1: 0.4646
 epoch: 42, train_loss: 0.9643, test_loss: 1.0815, test_f1: 0.4689
 epoch: 43, train_loss: 0.9656, test_loss: 1.0759, test_f1: 0.4684
 epoch: 44, train_loss: 0.9544, test_loss: 1.0800, test_f1: 0.4661
 epoch: 45, train_loss: 0.9580, test_loss: 1.0765, test_f1: 0.4742
 epoch: 46, train_loss: 0.9554, test_loss: 1.0722, test_f1: 0.4747
 epoch: 47, train_loss: 0.9471, test_loss: 1.0736, test_f1: 0.4603
 epoch: 48, train_loss: 0.9427, test_loss: 1.0809, test_f1: 0.4590
 epoch: 49, train_loss: 0.9395, test_loss: 1.0676, test_f1: 0.4640
 epoch: 50, train_loss: 0.9498, test_loss: 1.0665, test_f1: 0.4728
 epoch: 51, train_loss: 0.9358, test_loss: 1.0668, test_f1: 0.4699
 epoch: 52, train_loss: 0.9398, test_loss: 1.0661, test_f1: 0.4589
 epoch: 53, train_loss: 0.9348, test_loss: 1.0603, test_f1: 0.4791
 epoch: 54, train_loss: 0.9349, test_loss: 1.0582, test_f1: 0.4656
 epoch: 55, train_loss: 0.9318, test_loss: 1.0561, test_f1: 0.4689
 epoch: 56, train_loss: 0.9251, test_loss: 1.0609, test_f1: 0.4766
 epoch: 57, train_loss: 0.9259, test_loss: 1.0610, test_f1: 0.4798
 epoch: 58, train_loss: 0.9301, test_loss: 1.0626, test_f1: 0.4573
 epoch: 59, train_loss: 0.9267, test_loss: 1.0576, test_f1: 0.4630
 epoch: 60, train_loss: 0.9225, test_loss: 1.0545, test_f1: 0.4781
 epoch: 61, train_loss: 0.9247, test_loss: 1.0542, test_f1: 0.4788
 epoch: 62, train_loss: 0.9169, test_loss: 1.0561, test_f1: 0.4733
 epoch: 63, train_loss: 0.9183, test_loss: 1.0566, test_f1: 0.4570
 epoch: 64, train_loss: 0.9182, test_loss: 1.0532, test_f1: 0.4653
 epoch: 65, train_loss: 0.9087, test_loss: 1.0535, test_f1: 0.4582
 epoch: 66, train_loss: 0.9069, test_loss: 1.0508, test_f1: 0.4718
 epoch: 67, train_loss: 0.9097, test_loss: 1.0522, test_f1: 0.4789
 epoch: 68, train_loss: 0.9135, test_loss: 1.0539, test_f1: 0.4744
 epoch: 69, train_loss: 0.9154, test_loss: 1.0525, test_f1: 0.4690
 epoch: 70, train_loss: 0.9016, test_loss: 1.0533, test_f1: 0.4604
 epoch: 71, train_loss: 0.9062, test_loss: 1.0440, test_f1: 0.4848
 epoch: 72, train_loss: 0.9080, test_loss: 1.0432, test_f1: 0.4720
 epoch: 73, train_loss: 0.9002, test_loss: 1.0459, test_f1: 0.4641
 epoch: 74, train_loss: 0.8901, test_loss: 1.0480, test_f1: 0.4649
 epoch: 75, train_loss: 0.8979, test_loss: 1.0491, test_f1: 0.4793
 epoch: 76, train_loss: 0.8975, test_loss: 1.0500, test_f1: 0.4578
 epoch: 77, train_loss: 0.8920, test_loss: 1.0503, test_f1: 0.4481
 epoch: 78, train_loss: 0.8969, test_loss: 1.0506, test_f1: 0.4549
 epoch: 79, train_loss: 0.8949, test_loss: 1.0468, test_f1: 0.4582
 epoch: 80, train_loss: 0.8829, test_loss: 1.0430, test_f1: 0.4617
 epoch: 81, train_loss: 0.9001, test_loss: 1.0311, test_f1: 0.4640
 epoch: 82, train_loss: 0.8888, test_loss: 1.0347, test_f1: 0.4648
 epoch: 83, train_loss: 0.8898, test_loss: 1.0279, test_f1: 0.4683
 epoch: 84, train_loss: 0.8885, test_loss: 1.0328, test_f1: 0.4547
 epoch: 85, train_loss: 0.8875, test_loss: 1.0403, test_f1: 0.4802
 epoch: 86, train_loss: 0.8804, test_loss: 1.0394, test_f1: 0.4880
 epoch: 87, train_loss: 0.8797, test_loss: 1.0362, test_f1: 0.4775
 epoch: 88, train_loss: 0.8779, test_loss: 1.0377, test_f1: 0.4776
 epoch: 89, train_loss: 0.8780, test_loss: 1.0415, test_f1: 0.4541
 epoch: 90, train_loss: 0.8832, test_loss: 1.0426, test_f1: 0.4776
 epoch: 91, train_loss: 0.8790, test_loss: 1.0414, test_f1: 0.4643
 epoch: 92, train_loss: 0.8762, test_loss: 1.0406, test_f1: 0.4610
 epoch: 93, train_loss: 0.8728, test_loss: 1.0343, test_f1: 0.4824
 epoch: 94, train_loss: 0.8723, test_loss: 1.0294, test_f1: 0.4731
 epoch: 95, train_loss: 0.8704, test_loss: 1.0270, test_f1: 0.4679
 epoch: 96, train_loss: 0.8626, test_loss: 1.0292, test_f1: 0.4656
 epoch: 97, train_loss: 0.8689, test_loss: 1.0305, test_f1: 0.4742
 epoch: 98, train_loss: 0.8681, test_loss: 1.0290, test_f1: 0.5021
 epoch: 99, train_loss: 0.8709, test_loss: 1.0289, test_f1: 0.4994
##################ITERATION #5 ****************************************
 epoch: 0, train_loss: 1.2937, test_loss: 1.3272, test_f1: 0.2281
 epoch: 1, train_loss: 1.2633, test_loss: 1.3204, test_f1: 0.2281
 epoch: 2, train_loss: 1.2520, test_loss: 1.3151, test_f1: 0.2281
 epoch: 3, train_loss: 1.2402, test_loss: 1.3121, test_f1: 0.2281
 epoch: 4, train_loss: 1.2299, test_loss: 1.3089, test_f1: 0.2281
 epoch: 5, train_loss: 1.2195, test_loss: 1.3025, test_f1: 0.2281
 epoch: 6, train_loss: 1.2107, test_loss: 1.2948, test_f1: 0.2281
 epoch: 7, train_loss: 1.2005, test_loss: 1.2851, test_f1: 0.2281
 epoch: 8, train_loss: 1.1892, test_loss: 1.2711, test_f1: 0.2281
 epoch: 9, train_loss: 1.1810, test_loss: 1.2614, test_f1: 0.2675
 epoch: 10, train_loss: 1.1650, test_loss: 1.2453, test_f1: 0.3018
 epoch: 11, train_loss: 1.1623, test_loss: 1.2348, test_f1: 0.3262
 epoch: 12, train_loss: 1.1559, test_loss: 1.2265, test_f1: 0.3344
 epoch: 13, train_loss: 1.1442, test_loss: 1.2187, test_f1: 0.3395
 epoch: 14, train_loss: 1.1416, test_loss: 1.2108, test_f1: 0.3365
 epoch: 15, train_loss: 1.1325, test_loss: 1.2033, test_f1: 0.3365
 epoch: 16, train_loss: 1.1203, test_loss: 1.1923, test_f1: 0.3333
 epoch: 17, train_loss: 1.1136, test_loss: 1.1855, test_f1: 0.3358
 epoch: 18, train_loss: 1.1110, test_loss: 1.1792, test_f1: 0.3270
 epoch: 19, train_loss: 1.1013, test_loss: 1.1766, test_f1: 0.3245
 epoch: 20, train_loss: 1.0888, test_loss: 1.1657, test_f1: 0.3312
 epoch: 21, train_loss: 1.0806, test_loss: 1.1626, test_f1: 0.3432
 epoch: 22, train_loss: 1.0776, test_loss: 1.1543, test_f1: 0.3512
 epoch: 23, train_loss: 1.0709, test_loss: 1.1515, test_f1: 0.3512
 epoch: 24, train_loss: 1.0596, test_loss: 1.1462, test_f1: 0.3509
 epoch: 25, train_loss: 1.0627, test_loss: 1.1437, test_f1: 0.3487
 epoch: 26, train_loss: 1.0545, test_loss: 1.1311, test_f1: 0.3586
 epoch: 27, train_loss: 1.0482, test_loss: 1.1329, test_f1: 0.3492
 epoch: 28, train_loss: 1.0428, test_loss: 1.1330, test_f1: 0.3482
 epoch: 29, train_loss: 1.0388, test_loss: 1.1239, test_f1: 0.3480
 epoch: 30, train_loss: 1.0320, test_loss: 1.1134, test_f1: 0.3534
 epoch: 31, train_loss: 1.0216, test_loss: 1.1094, test_f1: 0.3839
 epoch: 32, train_loss: 1.0190, test_loss: 1.1113, test_f1: 0.3824
 epoch: 33, train_loss: 1.0111, test_loss: 1.1111, test_f1: 0.4150
 epoch: 34, train_loss: 1.0149, test_loss: 1.1052, test_f1: 0.4173
 epoch: 35, train_loss: 1.0068, test_loss: 1.1049, test_f1: 0.4122
 epoch: 36, train_loss: 1.0043, test_loss: 1.1030, test_f1: 0.3973
 epoch: 37, train_loss: 1.0015, test_loss: 1.0983, test_f1: 0.3978
 epoch: 38, train_loss: 0.9889, test_loss: 1.0934, test_f1: 0.4193
 epoch: 39, train_loss: 0.9890, test_loss: 1.0854, test_f1: 0.4308
 epoch: 40, train_loss: 0.9842, test_loss: 1.0837, test_f1: 0.4320
 epoch: 41, train_loss: 0.9816, test_loss: 1.0796, test_f1: 0.4302
 epoch: 42, train_loss: 0.9775, test_loss: 1.0801, test_f1: 0.4302
 epoch: 43, train_loss: 0.9774, test_loss: 1.0787, test_f1: 0.4302
 epoch: 44, train_loss: 0.9655, test_loss: 1.0692, test_f1: 0.4381
 epoch: 45, train_loss: 0.9698, test_loss: 1.0711, test_f1: 0.4338
 epoch: 46, train_loss: 0.9662, test_loss: 1.0686, test_f1: 0.4338
 epoch: 47, train_loss: 0.9573, test_loss: 1.0661, test_f1: 0.4340
 epoch: 48, train_loss: 0.9542, test_loss: 1.0644, test_f1: 0.4500
 epoch: 49, train_loss: 0.9528, test_loss: 1.0725, test_f1: 0.4408
 epoch: 50, train_loss: 0.9511, test_loss: 1.0746, test_f1: 0.4428
 epoch: 51, train_loss: 0.9456, test_loss: 1.0703, test_f1: 0.4329
 epoch: 52, train_loss: 0.9447, test_loss: 1.0676, test_f1: 0.4299
 epoch: 53, train_loss: 0.9425, test_loss: 1.0623, test_f1: 0.4415
 epoch: 54, train_loss: 0.9459, test_loss: 1.0636, test_f1: 0.4327
 epoch: 55, train_loss: 0.9440, test_loss: 1.0621, test_f1: 0.4268
 epoch: 56, train_loss: 0.9316, test_loss: 1.0622, test_f1: 0.4333
 epoch: 57, train_loss: 0.9382, test_loss: 1.0614, test_f1: 0.4251
 epoch: 58, train_loss: 0.9366, test_loss: 1.0541, test_f1: 0.4270
 epoch: 59, train_loss: 0.9291, test_loss: 1.0536, test_f1: 0.4279
 epoch: 60, train_loss: 0.9302, test_loss: 1.0554, test_f1: 0.4343
 epoch: 61, train_loss: 0.9269, test_loss: 1.0600, test_f1: 0.4301
 epoch: 62, train_loss: 0.9235, test_loss: 1.0597, test_f1: 0.4282
 epoch: 63, train_loss: 0.9272, test_loss: 1.0602, test_f1: 0.4541
 epoch: 64, train_loss: 0.9248, test_loss: 1.0573, test_f1: 0.4437
 epoch: 65, train_loss: 0.9172, test_loss: 1.0595, test_f1: 0.4241
 epoch: 66, train_loss: 0.9176, test_loss: 1.0609, test_f1: 0.4410
 epoch: 67, train_loss: 0.9249, test_loss: 1.0573, test_f1: 0.4317
 epoch: 68, train_loss: 0.9189, test_loss: 1.0567, test_f1: 0.4273
 epoch: 69, train_loss: 0.9159, test_loss: 1.0512, test_f1: 0.4490
 epoch: 70, train_loss: 0.9102, test_loss: 1.0549, test_f1: 0.4413
 epoch: 71, train_loss: 0.9076, test_loss: 1.0549, test_f1: 0.4380
 epoch: 72, train_loss: 0.9100, test_loss: 1.0529, test_f1: 0.4489
 epoch: 73, train_loss: 0.9069, test_loss: 1.0554, test_f1: 0.4519
 epoch: 74, train_loss: 0.9026, test_loss: 1.0496, test_f1: 0.4433
 epoch: 75, train_loss: 0.9129, test_loss: 1.0404, test_f1: 0.4331
 epoch: 76, train_loss: 0.8966, test_loss: 1.0388, test_f1: 0.4365
 epoch: 77, train_loss: 0.8991, test_loss: 1.0411, test_f1: 0.4365
 epoch: 78, train_loss: 0.8994, test_loss: 1.0441, test_f1: 0.4349
 epoch: 79, train_loss: 0.9015, test_loss: 1.0455, test_f1: 0.4398
 epoch: 80, train_loss: 0.8983, test_loss: 1.0489, test_f1: 0.4394
 epoch: 81, train_loss: 0.8960, test_loss: 1.0531, test_f1: 0.4369
 epoch: 82, train_loss: 0.8899, test_loss: 1.0381, test_f1: 0.4470
 epoch: 83, train_loss: 0.8946, test_loss: 1.0330, test_f1: 0.4516
 epoch: 84, train_loss: 0.8868, test_loss: 1.0395, test_f1: 0.4458
 epoch: 85, train_loss: 0.8876, test_loss: 1.0438, test_f1: 0.4411
 epoch: 86, train_loss: 0.8852, test_loss: 1.0435, test_f1: 0.4332
 epoch: 87, train_loss: 0.8875, test_loss: 1.0474, test_f1: 0.4421
 epoch: 88, train_loss: 0.8906, test_loss: 1.0501, test_f1: 0.4285
 epoch: 89, train_loss: 0.8857, test_loss: 1.0500, test_f1: 0.4391
 epoch: 90, train_loss: 0.8840, test_loss: 1.0516, test_f1: 0.4329
 epoch: 91, train_loss: 0.8786, test_loss: 1.0492, test_f1: 0.4389
 epoch: 92, train_loss: 0.8788, test_loss: 1.0489, test_f1: 0.4441
 epoch: 93, train_loss: 0.8765, test_loss: 1.0433, test_f1: 0.4431
 epoch: 94, train_loss: 0.8782, test_loss: 1.0381, test_f1: 0.4496
 epoch: 95, train_loss: 0.8754, test_loss: 1.0362, test_f1: 0.4496
 epoch: 96, train_loss: 0.8657, test_loss: 1.0400, test_f1: 0.4464
 epoch: 97, train_loss: 0.8717, test_loss: 1.0456, test_f1: 0.4411
 epoch: 98, train_loss: 0.8744, test_loss: 1.0432, test_f1: 0.4397
 epoch: 99, train_loss: 0.8740, test_loss: 1.0401, test_f1: 0.4378
##################ITERATION #6 ****************************************
 epoch: 0, train_loss: 1.2730, test_loss: 1.3072, test_f1: 0.2281
 epoch: 1, train_loss: 1.2518, test_loss: 1.3031, test_f1: 0.2281
 epoch: 2, train_loss: 1.2368, test_loss: 1.2997, test_f1: 0.2281
 epoch: 3, train_loss: 1.2307, test_loss: 1.2980, test_f1: 0.2281
 epoch: 4, train_loss: 1.2169, test_loss: 1.2938, test_f1: 0.2281
 epoch: 5, train_loss: 1.2136, test_loss: 1.2895, test_f1: 0.2281
 epoch: 6, train_loss: 1.2003, test_loss: 1.2846, test_f1: 0.2281
 epoch: 7, train_loss: 1.1940, test_loss: 1.2764, test_f1: 0.2281
 epoch: 8, train_loss: 1.1938, test_loss: 1.2676, test_f1: 0.2248
 epoch: 9, train_loss: 1.1759, test_loss: 1.2552, test_f1: 0.2281
 epoch: 10, train_loss: 1.1692, test_loss: 1.2422, test_f1: 0.2441
 epoch: 11, train_loss: 1.1568, test_loss: 1.2311, test_f1: 0.2858
 epoch: 12, train_loss: 1.1523, test_loss: 1.2186, test_f1: 0.2974
 epoch: 13, train_loss: 1.1388, test_loss: 1.2103, test_f1: 0.3345
 epoch: 14, train_loss: 1.1302, test_loss: 1.2071, test_f1: 0.3454
 epoch: 15, train_loss: 1.1238, test_loss: 1.2027, test_f1: 0.3483
 epoch: 16, train_loss: 1.1141, test_loss: 1.1900, test_f1: 0.3672
 epoch: 17, train_loss: 1.1093, test_loss: 1.1825, test_f1: 0.3574
 epoch: 18, train_loss: 1.0958, test_loss: 1.1743, test_f1: 0.3837
 epoch: 19, train_loss: 1.0929, test_loss: 1.1668, test_f1: 0.3868
 epoch: 20, train_loss: 1.0815, test_loss: 1.1618, test_f1: 0.3862
 epoch: 21, train_loss: 1.0718, test_loss: 1.1501, test_f1: 0.3967
 epoch: 22, train_loss: 1.0675, test_loss: 1.1398, test_f1: 0.3927
 epoch: 23, train_loss: 1.0559, test_loss: 1.1379, test_f1: 0.3864
 epoch: 24, train_loss: 1.0486, test_loss: 1.1342, test_f1: 0.3801
 epoch: 25, train_loss: 1.0405, test_loss: 1.1295, test_f1: 0.3828
 epoch: 26, train_loss: 1.0328, test_loss: 1.1215, test_f1: 0.4022
 epoch: 27, train_loss: 1.0301, test_loss: 1.1201, test_f1: 0.4090
 epoch: 28, train_loss: 1.0258, test_loss: 1.1176, test_f1: 0.3995
 epoch: 29, train_loss: 1.0132, test_loss: 1.1079, test_f1: 0.4079
 epoch: 30, train_loss: 1.0094, test_loss: 1.1066, test_f1: 0.4115
 epoch: 31, train_loss: 1.0113, test_loss: 1.1046, test_f1: 0.4079
 epoch: 32, train_loss: 1.0004, test_loss: 1.0973, test_f1: 0.4280
 epoch: 33, train_loss: 0.9947, test_loss: 1.0937, test_f1: 0.4319
 epoch: 34, train_loss: 0.9892, test_loss: 1.0930, test_f1: 0.4329
 epoch: 35, train_loss: 0.9885, test_loss: 1.0939, test_f1: 0.4399
 epoch: 36, train_loss: 0.9829, test_loss: 1.0895, test_f1: 0.4360
 epoch: 37, train_loss: 0.9778, test_loss: 1.0856, test_f1: 0.4403
 epoch: 38, train_loss: 0.9758, test_loss: 1.0808, test_f1: 0.4433
 epoch: 39, train_loss: 0.9680, test_loss: 1.0810, test_f1: 0.4414
 epoch: 40, train_loss: 0.9639, test_loss: 1.0794, test_f1: 0.4426
 epoch: 41, train_loss: 0.9615, test_loss: 1.0776, test_f1: 0.4432
 epoch: 42, train_loss: 0.9540, test_loss: 1.0751, test_f1: 0.4410
 epoch: 43, train_loss: 0.9493, test_loss: 1.0749, test_f1: 0.4310
 epoch: 44, train_loss: 0.9435, test_loss: 1.0727, test_f1: 0.4201
 epoch: 45, train_loss: 0.9444, test_loss: 1.0691, test_f1: 0.4304
 epoch: 46, train_loss: 0.9436, test_loss: 1.0670, test_f1: 0.4521
 epoch: 47, train_loss: 0.9338, test_loss: 1.0606, test_f1: 0.4547
 epoch: 48, train_loss: 0.9339, test_loss: 1.0601, test_f1: 0.4271
 epoch: 49, train_loss: 0.9295, test_loss: 1.0592, test_f1: 0.4302
 epoch: 50, train_loss: 0.9319, test_loss: 1.0535, test_f1: 0.4154
 epoch: 51, train_loss: 0.9172, test_loss: 1.0528, test_f1: 0.4247
 epoch: 52, train_loss: 0.9188, test_loss: 1.0489, test_f1: 0.4216
 epoch: 53, train_loss: 0.9154, test_loss: 1.0483, test_f1: 0.4400
 epoch: 54, train_loss: 0.9207, test_loss: 1.0484, test_f1: 0.4250
 epoch: 55, train_loss: 0.9123, test_loss: 1.0490, test_f1: 0.4268
 epoch: 56, train_loss: 0.9101, test_loss: 1.0476, test_f1: 0.4310
 epoch: 57, train_loss: 0.9112, test_loss: 1.0472, test_f1: 0.4216
 epoch: 58, train_loss: 0.9153, test_loss: 1.0459, test_f1: 0.4224
 epoch: 59, train_loss: 0.9027, test_loss: 1.0466, test_f1: 0.4318
 epoch: 60, train_loss: 0.9098, test_loss: 1.0449, test_f1: 0.4462
 epoch: 61, train_loss: 0.8980, test_loss: 1.0418, test_f1: 0.4342
 epoch: 62, train_loss: 0.8990, test_loss: 1.0399, test_f1: 0.4376
 epoch: 63, train_loss: 0.9007, test_loss: 1.0406, test_f1: 0.4361
 epoch: 64, train_loss: 0.8932, test_loss: 1.0407, test_f1: 0.4333
 epoch: 65, train_loss: 0.8990, test_loss: 1.0413, test_f1: 0.4404
 epoch: 66, train_loss: 0.9045, test_loss: 1.0379, test_f1: 0.4392
 epoch: 67, train_loss: 0.8902, test_loss: 1.0351, test_f1: 0.4183
 epoch: 68, train_loss: 0.9012, test_loss: 1.0396, test_f1: 0.4134
 epoch: 69, train_loss: 0.8977, test_loss: 1.0402, test_f1: 0.4079
 epoch: 70, train_loss: 0.8874, test_loss: 1.0425, test_f1: 0.4134
 epoch: 71, train_loss: 0.8908, test_loss: 1.0406, test_f1: 0.4096
 epoch: 72, train_loss: 0.8845, test_loss: 1.0387, test_f1: 0.4087
 epoch: 73, train_loss: 0.8830, test_loss: 1.0399, test_f1: 0.4001
 epoch: 74, train_loss: 0.8953, test_loss: 1.0385, test_f1: 0.4153
 epoch: 75, train_loss: 0.8814, test_loss: 1.0392, test_f1: 0.4053
 epoch: 76, train_loss: 0.8820, test_loss: 1.0412, test_f1: 0.4172
 epoch: 77, train_loss: 0.8775, test_loss: 1.0395, test_f1: 0.4032
 epoch: 78, train_loss: 0.8782, test_loss: 1.0351, test_f1: 0.4136
 epoch: 79, train_loss: 0.8795, test_loss: 1.0387, test_f1: 0.4153
 epoch: 80, train_loss: 0.8688, test_loss: 1.0368, test_f1: 0.4221
 epoch: 81, train_loss: 0.8715, test_loss: 1.0405, test_f1: 0.4192
 epoch: 82, train_loss: 0.8712, test_loss: 1.0413, test_f1: 0.4150
 epoch: 83, train_loss: 0.8723, test_loss: 1.0378, test_f1: 0.4220
 epoch: 84, train_loss: 0.8705, test_loss: 1.0396, test_f1: 0.4290
 epoch: 85, train_loss: 0.8712, test_loss: 1.0367, test_f1: 0.4323
 epoch: 86, train_loss: 0.8642, test_loss: 1.0395, test_f1: 0.4112
 epoch: 87, train_loss: 0.8673, test_loss: 1.0397, test_f1: 0.4322
 epoch: 88, train_loss: 0.8661, test_loss: 1.0400, test_f1: 0.4253
 epoch: 89, train_loss: 0.8556, test_loss: 1.0372, test_f1: 0.4265
 epoch: 90, train_loss: 0.8665, test_loss: 1.0375, test_f1: 0.4310
 epoch: 91, train_loss: 0.8582, test_loss: 1.0436, test_f1: 0.4492
 epoch: 92, train_loss: 0.8516, test_loss: 1.0507, test_f1: 0.4491
 epoch: 93, train_loss: 0.8554, test_loss: 1.0448, test_f1: 0.4426
 epoch: 94, train_loss: 0.8497, test_loss: 1.0400, test_f1: 0.4547
 epoch: 95, train_loss: 0.8501, test_loss: 1.0401, test_f1: 0.4572
 epoch: 96, train_loss: 0.8486, test_loss: 1.0361, test_f1: 0.4424
 epoch: 97, train_loss: 0.8481, test_loss: 1.0416, test_f1: 0.4521
 epoch: 98, train_loss: 0.8502, test_loss: 1.0390, test_f1: 0.4446
 epoch: 99, train_loss: 0.8498, test_loss: 1.0391, test_f1: 0.4521
##################ITERATION #7 ****************************************
 epoch: 0, train_loss: 1.2889, test_loss: 1.3154, test_f1: 0.2281
 epoch: 1, train_loss: 1.2568, test_loss: 1.3126, test_f1: 0.2281
 epoch: 2, train_loss: 1.2432, test_loss: 1.3105, test_f1: 0.2281
 epoch: 3, train_loss: 1.2287, test_loss: 1.3092, test_f1: 0.2281
 epoch: 4, train_loss: 1.2144, test_loss: 1.3076, test_f1: 0.2281
 epoch: 5, train_loss: 1.2073, test_loss: 1.3053, test_f1: 0.2281
 epoch: 6, train_loss: 1.1919, test_loss: 1.2973, test_f1: 0.2281
 epoch: 7, train_loss: 1.1825, test_loss: 1.2811, test_f1: 0.2281
 epoch: 8, train_loss: 1.1693, test_loss: 1.2636, test_f1: 0.2281
 epoch: 9, train_loss: 1.1608, test_loss: 1.2495, test_f1: 0.2631
 epoch: 10, train_loss: 1.1539, test_loss: 1.2363, test_f1: 0.2876
 epoch: 11, train_loss: 1.1440, test_loss: 1.2274, test_f1: 0.3051
 epoch: 12, train_loss: 1.1353, test_loss: 1.2149, test_f1: 0.3317
 epoch: 13, train_loss: 1.1193, test_loss: 1.2071, test_f1: 0.3232
 epoch: 14, train_loss: 1.1184, test_loss: 1.2003, test_f1: 0.3220
 epoch: 15, train_loss: 1.1098, test_loss: 1.1982, test_f1: 0.3192
 epoch: 16, train_loss: 1.1010, test_loss: 1.1908, test_f1: 0.3188
 epoch: 17, train_loss: 1.0944, test_loss: 1.1834, test_f1: 0.3192
 epoch: 18, train_loss: 1.0901, test_loss: 1.1778, test_f1: 0.3192
 epoch: 19, train_loss: 1.0827, test_loss: 1.1721, test_f1: 0.3270
 epoch: 20, train_loss: 1.0747, test_loss: 1.1691, test_f1: 0.3270
 epoch: 21, train_loss: 1.0656, test_loss: 1.1642, test_f1: 0.3289
 epoch: 22, train_loss: 1.0549, test_loss: 1.1540, test_f1: 0.3306
 epoch: 23, train_loss: 1.0624, test_loss: 1.1473, test_f1: 0.3420
 epoch: 24, train_loss: 1.0481, test_loss: 1.1450, test_f1: 0.3378
 epoch: 25, train_loss: 1.0410, test_loss: 1.1425, test_f1: 0.3412
 epoch: 26, train_loss: 1.0470, test_loss: 1.1431, test_f1: 0.3540
 epoch: 27, train_loss: 1.0288, test_loss: 1.1310, test_f1: 0.3651
 epoch: 28, train_loss: 1.0281, test_loss: 1.1224, test_f1: 0.3722
 epoch: 29, train_loss: 1.0208, test_loss: 1.1237, test_f1: 0.3697
 epoch: 30, train_loss: 1.0141, test_loss: 1.1183, test_f1: 0.3697
 epoch: 31, train_loss: 1.0041, test_loss: 1.1129, test_f1: 0.3700
 epoch: 32, train_loss: 0.9993, test_loss: 1.1066, test_f1: 0.3742
 epoch: 33, train_loss: 0.9948, test_loss: 1.1023, test_f1: 0.3725
 epoch: 34, train_loss: 0.9920, test_loss: 1.1008, test_f1: 0.3765
 epoch: 35, train_loss: 0.9912, test_loss: 1.0906, test_f1: 0.3820
 epoch: 36, train_loss: 0.9825, test_loss: 1.0867, test_f1: 0.3791
 epoch: 37, train_loss: 0.9802, test_loss: 1.0950, test_f1: 0.3819
 epoch: 38, train_loss: 0.9851, test_loss: 1.0887, test_f1: 0.3842
 epoch: 39, train_loss: 0.9721, test_loss: 1.0805, test_f1: 0.3891
 epoch: 40, train_loss: 0.9729, test_loss: 1.0780, test_f1: 0.3968
 epoch: 41, train_loss: 0.9688, test_loss: 1.0781, test_f1: 0.4046
 epoch: 42, train_loss: 0.9593, test_loss: 1.0680, test_f1: 0.4176
 epoch: 43, train_loss: 0.9573, test_loss: 1.0670, test_f1: 0.4117
 epoch: 44, train_loss: 0.9542, test_loss: 1.0791, test_f1: 0.3953
 epoch: 45, train_loss: 0.9607, test_loss: 1.0763, test_f1: 0.4054
 epoch: 46, train_loss: 0.9506, test_loss: 1.0700, test_f1: 0.4212
 epoch: 47, train_loss: 0.9425, test_loss: 1.0586, test_f1: 0.4329
 epoch: 48, train_loss: 0.9406, test_loss: 1.0654, test_f1: 0.4329
 epoch: 49, train_loss: 0.9353, test_loss: 1.0670, test_f1: 0.4191
 epoch: 50, train_loss: 0.9279, test_loss: 1.0602, test_f1: 0.4311
 epoch: 51, train_loss: 0.9289, test_loss: 1.0561, test_f1: 0.4403
 epoch: 52, train_loss: 0.9288, test_loss: 1.0543, test_f1: 0.4407
 epoch: 53, train_loss: 0.9222, test_loss: 1.0547, test_f1: 0.4405
 epoch: 54, train_loss: 0.9204, test_loss: 1.0601, test_f1: 0.4311
 epoch: 55, train_loss: 0.9202, test_loss: 1.0607, test_f1: 0.4425
 epoch: 56, train_loss: 0.9174, test_loss: 1.0582, test_f1: 0.4417
 epoch: 57, train_loss: 0.9169, test_loss: 1.0598, test_f1: 0.4274
 epoch: 58, train_loss: 0.9090, test_loss: 1.0603, test_f1: 0.4415
 epoch: 59, train_loss: 0.9166, test_loss: 1.0592, test_f1: 0.4438
 epoch: 60, train_loss: 0.9140, test_loss: 1.0541, test_f1: 0.4491
 epoch: 61, train_loss: 0.9097, test_loss: 1.0540, test_f1: 0.4422
 epoch: 62, train_loss: 0.9163, test_loss: 1.0491, test_f1: 0.4426
 epoch: 63, train_loss: 0.9075, test_loss: 1.0496, test_f1: 0.4421
 epoch: 64, train_loss: 0.9043, test_loss: 1.0462, test_f1: 0.4439
 epoch: 65, train_loss: 0.9082, test_loss: 1.0449, test_f1: 0.4497
 epoch: 66, train_loss: 0.8986, test_loss: 1.0441, test_f1: 0.4473
 epoch: 67, train_loss: 0.8988, test_loss: 1.0475, test_f1: 0.4494
 epoch: 68, train_loss: 0.8949, test_loss: 1.0442, test_f1: 0.4525
 epoch: 69, train_loss: 0.9015, test_loss: 1.0455, test_f1: 0.4500
 epoch: 70, train_loss: 0.8947, test_loss: 1.0429, test_f1: 0.4589
 epoch: 71, train_loss: 0.8944, test_loss: 1.0406, test_f1: 0.4596
 epoch: 72, train_loss: 0.8882, test_loss: 1.0374, test_f1: 0.4475
 epoch: 73, train_loss: 0.8872, test_loss: 1.0349, test_f1: 0.4601
 epoch: 74, train_loss: 0.8863, test_loss: 1.0442, test_f1: 0.4538
 epoch: 75, train_loss: 0.8809, test_loss: 1.0397, test_f1: 0.4551
 epoch: 76, train_loss: 0.8832, test_loss: 1.0333, test_f1: 0.4640
 epoch: 77, train_loss: 0.8788, test_loss: 1.0331, test_f1: 0.4620
 epoch: 78, train_loss: 0.8830, test_loss: 1.0334, test_f1: 0.4576
 epoch: 79, train_loss: 0.8853, test_loss: 1.0380, test_f1: 0.4589
 epoch: 80, train_loss: 0.8813, test_loss: 1.0373, test_f1: 0.4661
 epoch: 81, train_loss: 0.8865, test_loss: 1.0356, test_f1: 0.4628
 epoch: 82, train_loss: 0.8782, test_loss: 1.0259, test_f1: 0.4625
 epoch: 83, train_loss: 0.8773, test_loss: 1.0208, test_f1: 0.4619
 epoch: 84, train_loss: 0.8706, test_loss: 1.0175, test_f1: 0.4627
 epoch: 85, train_loss: 0.8692, test_loss: 1.0220, test_f1: 0.4619
 epoch: 86, train_loss: 0.8718, test_loss: 1.0296, test_f1: 0.4631
 epoch: 87, train_loss: 0.8757, test_loss: 1.0250, test_f1: 0.4647
 epoch: 88, train_loss: 0.8740, test_loss: 1.0228, test_f1: 0.4728
 epoch: 89, train_loss: 0.8682, test_loss: 1.0225, test_f1: 0.4741
 epoch: 90, train_loss: 0.8627, test_loss: 1.0215, test_f1: 0.4798
 epoch: 91, train_loss: 0.8577, test_loss: 1.0203, test_f1: 0.4804
 epoch: 92, train_loss: 0.8599, test_loss: 1.0295, test_f1: 0.4853
 epoch: 93, train_loss: 0.8631, test_loss: 1.0235, test_f1: 0.4775
 epoch: 94, train_loss: 0.8595, test_loss: 1.0203, test_f1: 0.4757
 epoch: 95, train_loss: 0.8565, test_loss: 1.0252, test_f1: 0.4753
 epoch: 96, train_loss: 0.8538, test_loss: 1.0285, test_f1: 0.4947
 epoch: 97, train_loss: 0.8522, test_loss: 1.0243, test_f1: 0.4907
 epoch: 98, train_loss: 0.8576, test_loss: 1.0241, test_f1: 0.4969
 epoch: 99, train_loss: 0.8512, test_loss: 1.0227, test_f1: 0.5056
##################ITERATION #8 ****************************************
 epoch: 0, train_loss: 1.2899, test_loss: 1.3225, test_f1: 0.2281
 epoch: 1, train_loss: 1.2418, test_loss: 1.3176, test_f1: 0.2281
 epoch: 2, train_loss: 1.2224, test_loss: 1.3129, test_f1: 0.2281
 epoch: 3, train_loss: 1.2085, test_loss: 1.3007, test_f1: 0.2281
 epoch: 4, train_loss: 1.1980, test_loss: 1.2908, test_f1: 0.2281
 epoch: 5, train_loss: 1.1743, test_loss: 1.2802, test_f1: 0.2281
 epoch: 6, train_loss: 1.1660, test_loss: 1.2690, test_f1: 0.2281
 epoch: 7, train_loss: 1.1573, test_loss: 1.2570, test_f1: 0.2281
 epoch: 8, train_loss: 1.1391, test_loss: 1.2376, test_f1: 0.2281
 epoch: 9, train_loss: 1.1258, test_loss: 1.2210, test_f1: 0.2949
 epoch: 10, train_loss: 1.1160, test_loss: 1.2060, test_f1: 0.3317
 epoch: 11, train_loss: 1.1057, test_loss: 1.1950, test_f1: 0.3323
 epoch: 12, train_loss: 1.1009, test_loss: 1.1916, test_f1: 0.3471
 epoch: 13, train_loss: 1.0867, test_loss: 1.1896, test_f1: 0.3536
 epoch: 14, train_loss: 1.0828, test_loss: 1.1769, test_f1: 0.3598
 epoch: 15, train_loss: 1.0729, test_loss: 1.1682, test_f1: 0.3578
 epoch: 16, train_loss: 1.0552, test_loss: 1.1613, test_f1: 0.3624
 epoch: 17, train_loss: 1.0512, test_loss: 1.1515, test_f1: 0.3737
 epoch: 18, train_loss: 1.0434, test_loss: 1.1462, test_f1: 0.3744
 epoch: 19, train_loss: 1.0368, test_loss: 1.1481, test_f1: 0.3783
 epoch: 20, train_loss: 1.0323, test_loss: 1.1433, test_f1: 0.3817
 epoch: 21, train_loss: 1.0275, test_loss: 1.1318, test_f1: 0.3781
 epoch: 22, train_loss: 1.0184, test_loss: 1.1281, test_f1: 0.3787
 epoch: 23, train_loss: 1.0116, test_loss: 1.1199, test_f1: 0.3883
 epoch: 24, train_loss: 1.0070, test_loss: 1.1201, test_f1: 0.3979
 epoch: 25, train_loss: 1.0044, test_loss: 1.1150, test_f1: 0.3955
 epoch: 26, train_loss: 0.9911, test_loss: 1.1052, test_f1: 0.3966
 epoch: 27, train_loss: 0.9917, test_loss: 1.0994, test_f1: 0.4003
 epoch: 28, train_loss: 0.9820, test_loss: 1.0991, test_f1: 0.4012
 epoch: 29, train_loss: 0.9787, test_loss: 1.0935, test_f1: 0.4038
 epoch: 30, train_loss: 0.9713, test_loss: 1.0898, test_f1: 0.4038
 epoch: 31, train_loss: 0.9698, test_loss: 1.0946, test_f1: 0.4079
 epoch: 32, train_loss: 0.9625, test_loss: 1.0843, test_f1: 0.4045
 epoch: 33, train_loss: 0.9635, test_loss: 1.0847, test_f1: 0.4178
 epoch: 34, train_loss: 0.9565, test_loss: 1.0872, test_f1: 0.4044
 epoch: 35, train_loss: 0.9551, test_loss: 1.0918, test_f1: 0.4071
 epoch: 36, train_loss: 0.9499, test_loss: 1.0806, test_f1: 0.4110
 epoch: 37, train_loss: 0.9434, test_loss: 1.0747, test_f1: 0.4100
 epoch: 38, train_loss: 0.9330, test_loss: 1.0724, test_f1: 0.4173
 epoch: 39, train_loss: 0.9270, test_loss: 1.0772, test_f1: 0.4304
 epoch: 40, train_loss: 0.9263, test_loss: 1.0831, test_f1: 0.4345
 epoch: 41, train_loss: 0.9210, test_loss: 1.0844, test_f1: 0.4322
 epoch: 42, train_loss: 0.9222, test_loss: 1.0748, test_f1: 0.4336
 epoch: 43, train_loss: 0.9152, test_loss: 1.0671, test_f1: 0.4471
 epoch: 44, train_loss: 0.9094, test_loss: 1.0607, test_f1: 0.4499
 epoch: 45, train_loss: 0.9070, test_loss: 1.0641, test_f1: 0.4683
 epoch: 46, train_loss: 0.9044, test_loss: 1.0685, test_f1: 0.4711
 epoch: 47, train_loss: 0.9046, test_loss: 1.0757, test_f1: 0.4734
 epoch: 48, train_loss: 0.8974, test_loss: 1.0796, test_f1: 0.4770
 epoch: 49, train_loss: 0.8986, test_loss: 1.0749, test_f1: 0.4812
 epoch: 50, train_loss: 0.8873, test_loss: 1.0625, test_f1: 0.4813
 epoch: 51, train_loss: 0.8867, test_loss: 1.0595, test_f1: 0.4793
 epoch: 52, train_loss: 0.8817, test_loss: 1.0655, test_f1: 0.4877
 epoch: 53, train_loss: 0.8852, test_loss: 1.0562, test_f1: 0.4815
 epoch: 54, train_loss: 0.8873, test_loss: 1.0578, test_f1: 0.4850
 epoch: 55, train_loss: 0.8776, test_loss: 1.0680, test_f1: 0.4887
 epoch: 56, train_loss: 0.8775, test_loss: 1.0806, test_f1: 0.4967
 epoch: 57, train_loss: 0.8707, test_loss: 1.0860, test_f1: 0.5054
 epoch: 58, train_loss: 0.8813, test_loss: 1.0791, test_f1: 0.5061
 epoch: 59, train_loss: 0.8772, test_loss: 1.0778, test_f1: 0.5004
 epoch: 60, train_loss: 0.8694, test_loss: 1.0748, test_f1: 0.4993
 epoch: 61, train_loss: 0.8687, test_loss: 1.0826, test_f1: 0.5131
 epoch: 62, train_loss: 0.8711, test_loss: 1.0872, test_f1: 0.5063
 epoch: 63, train_loss: 0.8678, test_loss: 1.0786, test_f1: 0.5012
 epoch: 64, train_loss: 0.8589, test_loss: 1.0885, test_f1: 0.5072
 epoch: 65, train_loss: 0.8583, test_loss: 1.0822, test_f1: 0.5063
 epoch: 66, train_loss: 0.8560, test_loss: 1.0818, test_f1: 0.5052
 epoch: 67, train_loss: 0.8563, test_loss: 1.0837, test_f1: 0.5051
 epoch: 68, train_loss: 0.8627, test_loss: 1.0771, test_f1: 0.5155
 epoch: 69, train_loss: 0.8500, test_loss: 1.0675, test_f1: 0.5176
 epoch: 70, train_loss: 0.8559, test_loss: 1.0683, test_f1: 0.5195
 epoch: 71, train_loss: 0.8495, test_loss: 1.0789, test_f1: 0.5188
 epoch: 72, train_loss: 0.8527, test_loss: 1.0635, test_f1: 0.5122
 epoch: 73, train_loss: 0.8552, test_loss: 1.0730, test_f1: 0.5098
 epoch: 74, train_loss: 0.8463, test_loss: 1.0784, test_f1: 0.5191
 epoch: 75, train_loss: 0.8455, test_loss: 1.0926, test_f1: 0.5136
 epoch: 76, train_loss: 0.8362, test_loss: 1.1064, test_f1: 0.5224
 epoch: 77, train_loss: 0.8401, test_loss: 1.0971, test_f1: 0.5342
 epoch: 78, train_loss: 0.8369, test_loss: 1.0831, test_f1: 0.5311
 epoch: 79, train_loss: 0.8415, test_loss: 1.0860, test_f1: 0.5255
 epoch: 80, train_loss: 0.8401, test_loss: 1.0793, test_f1: 0.5301
 epoch: 81, train_loss: 0.8378, test_loss: 1.0827, test_f1: 0.5404
 epoch: 82, train_loss: 0.8421, test_loss: 1.0779, test_f1: 0.5304
 epoch: 83, train_loss: 0.8317, test_loss: 1.0667, test_f1: 0.5297
 epoch: 84, train_loss: 0.8278, test_loss: 1.0685, test_f1: 0.5254
 epoch: 85, train_loss: 0.8257, test_loss: 1.0773, test_f1: 0.5293
 epoch: 86, train_loss: 0.8299, test_loss: 1.0767, test_f1: 0.5320
 epoch: 87, train_loss: 0.8251, test_loss: 1.0724, test_f1: 0.5407
 epoch: 88, train_loss: 0.8230, test_loss: 1.0772, test_f1: 0.5322
 epoch: 89, train_loss: 0.8256, test_loss: 1.0752, test_f1: 0.5356
 epoch: 90, train_loss: 0.8264, test_loss: 1.0792, test_f1: 0.5321
 epoch: 91, train_loss: 0.8230, test_loss: 1.0822, test_f1: 0.5288
 epoch: 92, train_loss: 0.8199, test_loss: 1.0811, test_f1: 0.5199
 epoch: 93, train_loss: 0.8279, test_loss: 1.0852, test_f1: 0.5273
 epoch: 94, train_loss: 0.8092, test_loss: 1.1022, test_f1: 0.5300
 epoch: 95, train_loss: 0.8185, test_loss: 1.1020, test_f1: 0.5351
 epoch: 96, train_loss: 0.8171, test_loss: 1.1010, test_f1: 0.5298
 epoch: 97, train_loss: 0.8125, test_loss: 1.1069, test_f1: 0.5300
 epoch: 98, train_loss: 0.8119, test_loss: 1.0901, test_f1: 0.5249
 epoch: 99, train_loss: 0.8081, test_loss: 1.0933, test_f1: 0.5294
##################ITERATION #9 ****************************************
 epoch: 0, train_loss: 1.2618, test_loss: 1.2990, test_f1: 0.2281
 epoch: 1, train_loss: 1.2236, test_loss: 1.3109, test_f1: 0.2281
 epoch: 2, train_loss: 1.2018, test_loss: 1.3083, test_f1: 0.2281
 epoch: 3, train_loss: 1.1985, test_loss: 1.2969, test_f1: 0.2281
 epoch: 4, train_loss: 1.1788, test_loss: 1.2887, test_f1: 0.2281
 epoch: 5, train_loss: 1.1661, test_loss: 1.2863, test_f1: 0.2270
 epoch: 6, train_loss: 1.1575, test_loss: 1.2726, test_f1: 0.2281
 epoch: 7, train_loss: 1.1424, test_loss: 1.2513, test_f1: 0.2281
 epoch: 8, train_loss: 1.1451, test_loss: 1.2373, test_f1: 0.2586
 epoch: 9, train_loss: 1.1277, test_loss: 1.2191, test_f1: 0.3146
 epoch: 10, train_loss: 1.1159, test_loss: 1.2075, test_f1: 0.3262
 epoch: 11, train_loss: 1.1095, test_loss: 1.1972, test_f1: 0.3460
 epoch: 12, train_loss: 1.1037, test_loss: 1.1898, test_f1: 0.3688
 epoch: 13, train_loss: 1.1018, test_loss: 1.1819, test_f1: 0.3939
 epoch: 14, train_loss: 1.0924, test_loss: 1.1768, test_f1: 0.3974
 epoch: 15, train_loss: 1.0780, test_loss: 1.1734, test_f1: 0.3884
 epoch: 16, train_loss: 1.0767, test_loss: 1.1703, test_f1: 0.4016
 epoch: 17, train_loss: 1.0626, test_loss: 1.1649, test_f1: 0.3997
 epoch: 18, train_loss: 1.0583, test_loss: 1.1586, test_f1: 0.4025
 epoch: 19, train_loss: 1.0457, test_loss: 1.1594, test_f1: 0.4074
 epoch: 20, train_loss: 1.0492, test_loss: 1.1578, test_f1: 0.4056
 epoch: 21, train_loss: 1.0389, test_loss: 1.1544, test_f1: 0.4093
 epoch: 22, train_loss: 1.0383, test_loss: 1.1510, test_f1: 0.4107
 epoch: 23, train_loss: 1.0292, test_loss: 1.1516, test_f1: 0.4306
 epoch: 24, train_loss: 1.0246, test_loss: 1.1512, test_f1: 0.4297
 epoch: 25, train_loss: 1.0116, test_loss: 1.1472, test_f1: 0.4218
 epoch: 26, train_loss: 1.0130, test_loss: 1.1456, test_f1: 0.4299
 epoch: 27, train_loss: 1.0084, test_loss: 1.1453, test_f1: 0.4216
 epoch: 28, train_loss: 1.0025, test_loss: 1.1442, test_f1: 0.4316
 epoch: 29, train_loss: 0.9983, test_loss: 1.1430, test_f1: 0.4371
 epoch: 30, train_loss: 0.9964, test_loss: 1.1446, test_f1: 0.4429
 epoch: 31, train_loss: 0.9891, test_loss: 1.1411, test_f1: 0.4486
 epoch: 32, train_loss: 0.9832, test_loss: 1.1412, test_f1: 0.4451
 epoch: 33, train_loss: 0.9838, test_loss: 1.1424, test_f1: 0.4542
 epoch: 34, train_loss: 0.9762, test_loss: 1.1408, test_f1: 0.4469
 epoch: 35, train_loss: 0.9768, test_loss: 1.1415, test_f1: 0.4370
 epoch: 36, train_loss: 0.9751, test_loss: 1.1383, test_f1: 0.4453
 epoch: 37, train_loss: 0.9653, test_loss: 1.1374, test_f1: 0.4440
 epoch: 38, train_loss: 0.9621, test_loss: 1.1343, test_f1: 0.4472
 epoch: 39, train_loss: 0.9612, test_loss: 1.1331, test_f1: 0.4426
 epoch: 40, train_loss: 0.9558, test_loss: 1.1237, test_f1: 0.4372
 epoch: 41, train_loss: 0.9514, test_loss: 1.1178, test_f1: 0.4410
 epoch: 42, train_loss: 0.9469, test_loss: 1.1131, test_f1: 0.4369
 epoch: 43, train_loss: 0.9417, test_loss: 1.1140, test_f1: 0.4382
 epoch: 44, train_loss: 0.9404, test_loss: 1.1109, test_f1: 0.4566
 epoch: 45, train_loss: 0.9337, test_loss: 1.1162, test_f1: 0.4530
 epoch: 46, train_loss: 0.9372, test_loss: 1.1128, test_f1: 0.4403
 epoch: 47, train_loss: 0.9319, test_loss: 1.1062, test_f1: 0.4381
 epoch: 48, train_loss: 0.9307, test_loss: 1.0987, test_f1: 0.4361
 epoch: 49, train_loss: 0.9161, test_loss: 1.0987, test_f1: 0.4464
 epoch: 50, train_loss: 0.9284, test_loss: 1.0911, test_f1: 0.4410
 epoch: 51, train_loss: 0.9209, test_loss: 1.0996, test_f1: 0.4373
 epoch: 52, train_loss: 0.9139, test_loss: 1.1013, test_f1: 0.4299
 epoch: 53, train_loss: 0.9172, test_loss: 1.0856, test_f1: 0.4306
 epoch: 54, train_loss: 0.9080, test_loss: 1.0940, test_f1: 0.4397
 epoch: 55, train_loss: 0.9161, test_loss: 1.0996, test_f1: 0.4401
 epoch: 56, train_loss: 0.9115, test_loss: 1.1084, test_f1: 0.4453
 epoch: 57, train_loss: 0.9022, test_loss: 1.1058, test_f1: 0.4398
 epoch: 58, train_loss: 0.9059, test_loss: 1.1032, test_f1: 0.4348
 epoch: 59, train_loss: 0.9018, test_loss: 1.1089, test_f1: 0.4408
 epoch: 60, train_loss: 0.8993, test_loss: 1.1134, test_f1: 0.4331
 epoch: 61, train_loss: 0.9023, test_loss: 1.1048, test_f1: 0.4352
 epoch: 62, train_loss: 0.8978, test_loss: 1.1015, test_f1: 0.4429
 epoch: 63, train_loss: 0.8931, test_loss: 1.1060, test_f1: 0.4353
 epoch: 64, train_loss: 0.8936, test_loss: 1.1021, test_f1: 0.4403
 epoch: 65, train_loss: 0.8871, test_loss: 1.1000, test_f1: 0.4455
 epoch: 66, train_loss: 0.8927, test_loss: 1.0989, test_f1: 0.4387
 epoch: 67, train_loss: 0.8902, test_loss: 1.0937, test_f1: 0.4386
 epoch: 68, train_loss: 0.8907, test_loss: 1.0942, test_f1: 0.4396
 epoch: 69, train_loss: 0.8858, test_loss: 1.0938, test_f1: 0.4378
 epoch: 70, train_loss: 0.8871, test_loss: 1.0875, test_f1: 0.4359
 epoch: 71, train_loss: 0.8795, test_loss: 1.0825, test_f1: 0.4279
 epoch: 72, train_loss: 0.8822, test_loss: 1.0812, test_f1: 0.4345
 epoch: 73, train_loss: 0.8793, test_loss: 1.0893, test_f1: 0.4306
 epoch: 74, train_loss: 0.8765, test_loss: 1.0915, test_f1: 0.4306
 epoch: 75, train_loss: 0.8771, test_loss: 1.0960, test_f1: 0.4306
 epoch: 76, train_loss: 0.8798, test_loss: 1.0965, test_f1: 0.4269
 epoch: 77, train_loss: 0.8739, test_loss: 1.0967, test_f1: 0.4312
 epoch: 78, train_loss: 0.8753, test_loss: 1.0935, test_f1: 0.4226
 epoch: 79, train_loss: 0.8715, test_loss: 1.0805, test_f1: 0.4242
 epoch: 80, train_loss: 0.8639, test_loss: 1.0881, test_f1: 0.4391
 epoch: 81, train_loss: 0.8665, test_loss: 1.0887, test_f1: 0.4347
 epoch: 82, train_loss: 0.8620, test_loss: 1.0990, test_f1: 0.4343
 epoch: 83, train_loss: 0.8659, test_loss: 1.0976, test_f1: 0.4348
 epoch: 84, train_loss: 0.8627, test_loss: 1.0970, test_f1: 0.4353
 epoch: 85, train_loss: 0.8607, test_loss: 1.1127, test_f1: 0.4315
 epoch: 86, train_loss: 0.8620, test_loss: 1.1082, test_f1: 0.4241
 epoch: 87, train_loss: 0.8514, test_loss: 1.0883, test_f1: 0.4313
 epoch: 88, train_loss: 0.8601, test_loss: 1.0904, test_f1: 0.4478
 epoch: 89, train_loss: 0.8573, test_loss: 1.0953, test_f1: 0.4507
 epoch: 90, train_loss: 0.8540, test_loss: 1.0907, test_f1: 0.4457
 epoch: 91, train_loss: 0.8514, test_loss: 1.0908, test_f1: 0.4529
 epoch: 92, train_loss: 0.8455, test_loss: 1.1116, test_f1: 0.4404
 epoch: 93, train_loss: 0.8446, test_loss: 1.1011, test_f1: 0.4478
 epoch: 94, train_loss: 0.8470, test_loss: 1.1138, test_f1: 0.4409
 epoch: 95, train_loss: 0.8436, test_loss: 1.1174, test_f1: 0.4441
 epoch: 96, train_loss: 0.8425, test_loss: 1.0996, test_f1: 0.4456
 epoch: 97, train_loss: 0.8496, test_loss: 1.0834, test_f1: 0.4665
 epoch: 98, train_loss: 0.8401, test_loss: 1.0653, test_f1: 0.4755
 epoch: 99, train_loss: 0.8419, test_loss: 1.0747, test_f1: 0.4784

Training completed in 391.84 seconds
Best F1: 0.5407 at epoch 87
Mean F1 across iterations: 0.4756  0.0311
========================FINAL RESULTS================================
FEGIN weighted F1: 0.5407  0.0311
python main.py --data ltspice_demos --representation component_pin --model FEGIN --layers 4 --hiddens 64 --batch_size 256 --lr 0.0001 --emb_size 128 --epochs 100 --save_appendix component_pin_L4_H64_BS256_LR0.0001_E128 --no_val
-----



STDERR:
  File "main.py", line 370, in <module>
    main()
  File "main.py", line 254, in main
    dataset = dataset_class(
  File "/home/philip/projects/ltspice_examples_code_repo/Circuit-Completion-Using-GNNs/component_classification_with_link_prediction_head/evaluation/FEGIN/kernel/circuit_datasets.py", line 15, in __init__
    self.data, self.slices = torch.load(self.processed_paths[0])
  File "/home/philip/.local/lib/python3.8/site-packages/torch/serialization.py", line 1040, in load
    warnings.warn(
  File "/usr/lib/python3.8/warnings.py", line 109, in _showwarnmsg
    sw(msg.message, msg.category, msg.filename, msg.lineno,
  File "main.py", line 47, in warn_with_traceback
    traceback.print_stack(file=log)
/home/philip/projects/ltspice_examples_code_repo/Circuit-Completion-Using-GNNs/component_classification_with_link_prediction_head/evaluation/FEGIN/kernel/circuit_datasets.py:15: FutureWarning: You are using `torch.load` with `weights_only=False` (the current default value), which uses the default pickle module implicitly. It is possible to construct malicious pickle data which will execute arbitrary code during unpickling (See https://github.com/pytorch/pytorch/blob/main/SECURITY.md#untrusted-models for more details). In a future release, the default value for `weights_only` will be flipped to `True`. This limits the functions that could be executed during unpickling. Arbitrary objects will no longer be allowed to be loaded via this mode unless they are explicitly allowlisted by the user via `torch.serialization.add_safe_globals`. We recommend you start setting `weights_only=True` for any use case where you don't have full control of the loaded file. Please open an issue on GitHub for any issues related to this experimental feature.
  self.data, self.slices = torch.load(self.processed_paths[0])
