STDOUT:
Results will be saved in /home/philip/projects/ltspice_examples_code_repo/Circuit-Completion-Using-GNNs/component_classification_with_link_prediction_head/evaluation/FEGIN/results/model_FEGIN_dataset_ltspice_examples
Command line input: python main.py --data ltspice_examples --representation component_pin_net --model FEGIN --layers 2 --hiddens 128 --batch_size 32 --lr 0.01 --emb_size 128 --epochs 100 --save_appendix component_pin_net_L2_H128_BS32_LR0.01_E128 --no_val
 is saved.
-----
ltspice_examples - FEGIN
Using 2 layers, 128 hidden units, h = 2
Loading component_pin_net representation dataset
ENTERED
Training FEGIN on component_pin_net representation
Train: 3558, Test: 846
##################ITERATION #0 ****************************************
 epoch: 0, train_loss: 1.1338, test_loss: 1.0867, test_f1: 0.4010
 epoch: 1, train_loss: 1.0182, test_loss: 0.9792, test_f1: 0.4749
 epoch: 2, train_loss: 0.9853, test_loss: 1.0323, test_f1: 0.4847
 epoch: 3, train_loss: 0.9684, test_loss: 1.2388, test_f1: 0.4914
 epoch: 4, train_loss: 0.9505, test_loss: 0.9867, test_f1: 0.5075
 epoch: 5, train_loss: 0.9463, test_loss: 0.9470, test_f1: 0.5250
 epoch: 6, train_loss: 0.9324, test_loss: 0.9812, test_f1: 0.5016
 epoch: 7, train_loss: 0.9467, test_loss: 0.9760, test_f1: 0.4738
 epoch: 8, train_loss: 0.9150, test_loss: 0.9629, test_f1: 0.5050
 epoch: 9, train_loss: 0.8860, test_loss: 0.8737, test_f1: 0.5585
 epoch: 10, train_loss: 0.8802, test_loss: 0.9023, test_f1: 0.5743
 epoch: 11, train_loss: 0.8659, test_loss: 0.9349, test_f1: 0.5842
 epoch: 12, train_loss: 0.8471, test_loss: 0.8790, test_f1: 0.5725
 epoch: 13, train_loss: 0.8517, test_loss: 0.8831, test_f1: 0.5749
 epoch: 14, train_loss: 0.8396, test_loss: 0.8950, test_f1: 0.5185
 epoch: 15, train_loss: 0.8369, test_loss: 0.8756, test_f1: 0.5654
 epoch: 16, train_loss: 0.8281, test_loss: 0.8152, test_f1: 0.5908
 epoch: 17, train_loss: 0.8332, test_loss: 1.0203, test_f1: 0.5593
 epoch: 18, train_loss: 0.8288, test_loss: 0.8752, test_f1: 0.5915
 epoch: 19, train_loss: 0.8064, test_loss: 0.7998, test_f1: 0.6171
 epoch: 20, train_loss: 0.7947, test_loss: 0.8610, test_f1: 0.6245
 epoch: 21, train_loss: 0.8018, test_loss: 0.9446, test_f1: 0.6163
 epoch: 22, train_loss: 0.7956, test_loss: 0.9458, test_f1: 0.6239
 epoch: 23, train_loss: 0.8110, test_loss: 0.8622, test_f1: 0.6038
 epoch: 24, train_loss: 0.7844, test_loss: 0.8865, test_f1: 0.6146
 epoch: 25, train_loss: 0.7995, test_loss: 0.8393, test_f1: 0.6304
 epoch: 26, train_loss: 0.7980, test_loss: 0.8522, test_f1: 0.5448
 epoch: 27, train_loss: 0.7919, test_loss: 0.7591, test_f1: 0.6252
 epoch: 28, train_loss: 0.7815, test_loss: 0.8181, test_f1: 0.5904
 epoch: 29, train_loss: 0.7599, test_loss: 0.8219, test_f1: 0.5956
 epoch: 30, train_loss: 0.7545, test_loss: 0.8295, test_f1: 0.6375
 epoch: 31, train_loss: 0.7562, test_loss: 0.8831, test_f1: 0.6438
 epoch: 32, train_loss: 0.7294, test_loss: 0.9753, test_f1: 0.6350
 epoch: 33, train_loss: 0.7266, test_loss: 0.8633, test_f1: 0.6330
 epoch: 34, train_loss: 0.7328, test_loss: 1.1326, test_f1: 0.6167
 epoch: 35, train_loss: 0.7129, test_loss: 0.9117, test_f1: 0.6168
 epoch: 36, train_loss: 0.7081, test_loss: 0.8024, test_f1: 0.6563
 epoch: 37, train_loss: 0.6971, test_loss: 0.9600, test_f1: 0.6335
 epoch: 38, train_loss: 0.6949, test_loss: 0.8640, test_f1: 0.6604
 epoch: 39, train_loss: 0.7199, test_loss: 0.7680, test_f1: 0.6466
 epoch: 40, train_loss: 0.7133, test_loss: 0.9070, test_f1: 0.6642
 epoch: 41, train_loss: 0.6884, test_loss: 0.9682, test_f1: 0.6185
 epoch: 42, train_loss: 0.6773, test_loss: 0.8182, test_f1: 0.6377
 epoch: 43, train_loss: 0.6812, test_loss: 0.8810, test_f1: 0.6533
 epoch: 44, train_loss: 0.6748, test_loss: 0.9798, test_f1: 0.6669
 epoch: 45, train_loss: 0.7099, test_loss: 0.7686, test_f1: 0.6335
 epoch: 46, train_loss: 0.6781, test_loss: 0.9403, test_f1: 0.6702
 epoch: 47, train_loss: 0.6744, test_loss: 0.8691, test_f1: 0.6611
 epoch: 48, train_loss: 0.6692, test_loss: 0.9840, test_f1: 0.6166
 epoch: 49, train_loss: 0.6778, test_loss: 0.9572, test_f1: 0.6537
 epoch: 50, train_loss: 0.6635, test_loss: 0.8093, test_f1: 0.6385
 epoch: 51, train_loss: 0.6395, test_loss: 0.9147, test_f1: 0.6711
 epoch: 52, train_loss: 0.6164, test_loss: 0.9018, test_f1: 0.6988
 epoch: 53, train_loss: 0.5967, test_loss: 0.9542, test_f1: 0.6713
 epoch: 54, train_loss: 0.5863, test_loss: 0.9642, test_f1: 0.6797
 epoch: 55, train_loss: 0.5827, test_loss: 1.0694, test_f1: 0.6733
 epoch: 56, train_loss: 0.5870, test_loss: 0.9580, test_f1: 0.6751
 epoch: 57, train_loss: 0.5863, test_loss: 1.0530, test_f1: 0.6816
 epoch: 58, train_loss: 0.5890, test_loss: 0.8990, test_f1: 0.6616
 epoch: 59, train_loss: 0.5743, test_loss: 0.9468, test_f1: 0.6672
 epoch: 60, train_loss: 0.5866, test_loss: 1.1742, test_f1: 0.6970
 epoch: 61, train_loss: 0.5604, test_loss: 0.9738, test_f1: 0.6822
 epoch: 62, train_loss: 0.5724, test_loss: 1.0179, test_f1: 0.6775
 epoch: 63, train_loss: 0.5507, test_loss: 1.1056, test_f1: 0.6814
 epoch: 64, train_loss: 0.5521, test_loss: 1.0518, test_f1: 0.6617
 epoch: 65, train_loss: 0.5546, test_loss: 1.0433, test_f1: 0.6655
 epoch: 66, train_loss: 0.5507, test_loss: 1.1639, test_f1: 0.6411
 epoch: 67, train_loss: 0.5346, test_loss: 1.0449, test_f1: 0.6825
 epoch: 68, train_loss: 0.5505, test_loss: 0.9324, test_f1: 0.6443
 epoch: 69, train_loss: 0.5240, test_loss: 1.0751, test_f1: 0.6748
 epoch: 70, train_loss: 0.5193, test_loss: 1.1200, test_f1: 0.7032
 epoch: 71, train_loss: 0.5249, test_loss: 1.1637, test_f1: 0.6817
 epoch: 72, train_loss: 0.5359, test_loss: 0.9484, test_f1: 0.6744
 epoch: 73, train_loss: 0.5222, test_loss: 1.2723, test_f1: 0.6828
 epoch: 74, train_loss: 0.5216, test_loss: 0.9740, test_f1: 0.6940
 epoch: 75, train_loss: 0.5281, test_loss: 1.0362, test_f1: 0.6800
 epoch: 76, train_loss: 0.5110, test_loss: 1.0249, test_f1: 0.6673
 epoch: 77, train_loss: 0.5214, test_loss: 1.0414, test_f1: 0.6602
 epoch: 78, train_loss: 0.5049, test_loss: 1.1446, test_f1: 0.6823
 epoch: 79, train_loss: 0.5025, test_loss: 1.2342, test_f1: 0.6922
 epoch: 80, train_loss: 0.4960, test_loss: 1.2474, test_f1: 0.6774
 epoch: 81, train_loss: 0.4910, test_loss: 1.1912, test_f1: 0.6591
 epoch: 82, train_loss: 0.5040, test_loss: 1.0449, test_f1: 0.6846
 epoch: 83, train_loss: 0.4945, test_loss: 1.1380, test_f1: 0.6744
 epoch: 84, train_loss: 0.4921, test_loss: 1.1836, test_f1: 0.6767
 epoch: 85, train_loss: 0.4788, test_loss: 1.0923, test_f1: 0.6867
 epoch: 86, train_loss: 0.4718, test_loss: 1.1708, test_f1: 0.6833
 epoch: 87, train_loss: 0.4785, test_loss: 1.0818, test_f1: 0.6892
 epoch: 88, train_loss: 0.4810, test_loss: 1.0870, test_f1: 0.6937
 epoch: 89, train_loss: 0.4861, test_loss: 0.9970, test_f1: 0.6874
 epoch: 90, train_loss: 0.4802, test_loss: 1.1474, test_f1: 0.6851
 epoch: 91, train_loss: 0.4582, test_loss: 1.0830, test_f1: 0.6964
 epoch: 92, train_loss: 0.4788, test_loss: 1.1391, test_f1: 0.6986
 epoch: 93, train_loss: 0.4506, test_loss: 1.1434, test_f1: 0.7030
 epoch: 94, train_loss: 0.4572, test_loss: 1.2786, test_f1: 0.6631
 epoch: 95, train_loss: 0.4533, test_loss: 1.3577, test_f1: 0.6550
 epoch: 96, train_loss: 0.4640, test_loss: 1.1068, test_f1: 0.6658
 epoch: 97, train_loss: 0.4561, test_loss: 1.2819, test_f1: 0.6844
 epoch: 98, train_loss: 0.4683, test_loss: 1.1312, test_f1: 0.6913
 epoch: 99, train_loss: 0.4456, test_loss: 1.5074, test_f1: 0.6906
##################ITERATION #1 ****************************************
 epoch: 0, train_loss: 1.0882, test_loss: 0.9926, test_f1: 0.4440
 epoch: 1, train_loss: 1.0080, test_loss: 0.9499, test_f1: 0.5023
 epoch: 2, train_loss: 0.9713, test_loss: 1.0224, test_f1: 0.4913
 epoch: 3, train_loss: 0.9540, test_loss: 0.9470, test_f1: 0.4967
 epoch: 4, train_loss: 0.9357, test_loss: 0.9563, test_f1: 0.4827
 epoch: 5, train_loss: 0.9515, test_loss: 1.0292, test_f1: 0.4917
 epoch: 6, train_loss: 0.9206, test_loss: 0.9869, test_f1: 0.4795
 epoch: 7, train_loss: 0.9016, test_loss: 0.8972, test_f1: 0.5116
 epoch: 8, train_loss: 0.9105, test_loss: 0.9926, test_f1: 0.5023
 epoch: 9, train_loss: 0.9015, test_loss: 0.8514, test_f1: 0.5223
 epoch: 10, train_loss: 0.8959, test_loss: 0.8893, test_f1: 0.5147
 epoch: 11, train_loss: 0.8894, test_loss: 0.8297, test_f1: 0.5451
 epoch: 12, train_loss: 0.8793, test_loss: 0.8907, test_f1: 0.5255
 epoch: 13, train_loss: 0.8747, test_loss: 0.8797, test_f1: 0.5229
 epoch: 14, train_loss: 0.8577, test_loss: 0.9213, test_f1: 0.5438
 epoch: 15, train_loss: 0.8544, test_loss: 0.9426, test_f1: 0.5329
 epoch: 16, train_loss: 0.8491, test_loss: 0.9465, test_f1: 0.5097
 epoch: 17, train_loss: 0.8489, test_loss: 1.0702, test_f1: 0.4802
 epoch: 18, train_loss: 0.8473, test_loss: 1.9049, test_f1: 0.2941
 epoch: 19, train_loss: 0.8393, test_loss: 0.8459, test_f1: 0.5454
 epoch: 20, train_loss: 0.8132, test_loss: 0.8766, test_f1: 0.5737
 epoch: 21, train_loss: 0.8204, test_loss: 0.8175, test_f1: 0.5874
 epoch: 22, train_loss: 0.8061, test_loss: 0.8259, test_f1: 0.5680
 epoch: 23, train_loss: 0.8024, test_loss: 0.9473, test_f1: 0.5577
 epoch: 24, train_loss: 0.8106, test_loss: 0.8883, test_f1: 0.5968
 epoch: 25, train_loss: 0.8067, test_loss: 0.9179, test_f1: 0.5501
 epoch: 26, train_loss: 0.7897, test_loss: 0.8741, test_f1: 0.5709
 epoch: 27, train_loss: 0.7746, test_loss: 0.9034, test_f1: 0.5524
 epoch: 28, train_loss: 0.7730, test_loss: 0.8561, test_f1: 0.5759
 epoch: 29, train_loss: 0.7880, test_loss: 0.8859, test_f1: 0.6102
 epoch: 30, train_loss: 0.8091, test_loss: 0.9578, test_f1: 0.5435
 epoch: 31, train_loss: 0.7778, test_loss: 0.9945, test_f1: 0.5773
 epoch: 32, train_loss: 0.7574, test_loss: 0.8923, test_f1: 0.6430
 epoch: 33, train_loss: 0.7722, test_loss: 0.9225, test_f1: 0.6168
 epoch: 34, train_loss: 0.8304, test_loss: 0.8836, test_f1: 0.5556
 epoch: 35, train_loss: 0.7616, test_loss: 0.9209, test_f1: 0.6456
 epoch: 36, train_loss: 0.7379, test_loss: 0.8656, test_f1: 0.6519
 epoch: 37, train_loss: 0.7250, test_loss: 0.9099, test_f1: 0.6171
 epoch: 38, train_loss: 0.7279, test_loss: 0.9855, test_f1: 0.5702
 epoch: 39, train_loss: 0.7204, test_loss: 0.9233, test_f1: 0.6163
 epoch: 40, train_loss: 0.7221, test_loss: 0.9052, test_f1: 0.6055
 epoch: 41, train_loss: 0.7154, test_loss: 1.0368, test_f1: 0.5708
 epoch: 42, train_loss: 0.7271, test_loss: 1.0409, test_f1: 0.6226
 epoch: 43, train_loss: 0.7307, test_loss: 0.9526, test_f1: 0.5947
 epoch: 44, train_loss: 0.7128, test_loss: 1.0436, test_f1: 0.6236
 epoch: 45, train_loss: 0.6972, test_loss: 1.0080, test_f1: 0.6239
 epoch: 46, train_loss: 0.7021, test_loss: 0.9727, test_f1: 0.6171
 epoch: 47, train_loss: 0.6842, test_loss: 0.8842, test_f1: 0.6234
 epoch: 48, train_loss: 0.6837, test_loss: 0.9509, test_f1: 0.5798
 epoch: 49, train_loss: 0.6970, test_loss: 0.9462, test_f1: 0.6115
 epoch: 50, train_loss: 0.6756, test_loss: 1.0232, test_f1: 0.6097
 epoch: 51, train_loss: 0.6339, test_loss: 0.9264, test_f1: 0.6543
 epoch: 52, train_loss: 0.6161, test_loss: 1.0040, test_f1: 0.6109
 epoch: 53, train_loss: 0.6142, test_loss: 0.9677, test_f1: 0.6433
 epoch: 54, train_loss: 0.6252, test_loss: 0.9964, test_f1: 0.6463
 epoch: 55, train_loss: 0.6165, test_loss: 0.8849, test_f1: 0.6479
 epoch: 56, train_loss: 0.5930, test_loss: 0.9777, test_f1: 0.6635
 epoch: 57, train_loss: 0.5893, test_loss: 1.1038, test_f1: 0.6709
 epoch: 58, train_loss: 0.5835, test_loss: 0.8617, test_f1: 0.6061
 epoch: 59, train_loss: 0.5774, test_loss: 1.1571, test_f1: 0.6395
 epoch: 60, train_loss: 0.5973, test_loss: 0.9848, test_f1: 0.6507
 epoch: 61, train_loss: 0.5709, test_loss: 1.0173, test_f1: 0.6466
 epoch: 62, train_loss: 0.5759, test_loss: 0.9934, test_f1: 0.6391
 epoch: 63, train_loss: 0.6051, test_loss: 0.9304, test_f1: 0.6346
 epoch: 64, train_loss: 0.5759, test_loss: 0.9754, test_f1: 0.6362
 epoch: 65, train_loss: 0.5594, test_loss: 1.0446, test_f1: 0.6588
 epoch: 66, train_loss: 0.5387, test_loss: 0.9885, test_f1: 0.6411
 epoch: 67, train_loss: 0.5599, test_loss: 1.0042, test_f1: 0.6824
 epoch: 68, train_loss: 0.5496, test_loss: 1.0040, test_f1: 0.6482
 epoch: 69, train_loss: 0.5521, test_loss: 1.1214, test_f1: 0.6544
 epoch: 70, train_loss: 0.5519, test_loss: 1.0905, test_f1: 0.6420
 epoch: 71, train_loss: 0.5419, test_loss: 1.0598, test_f1: 0.6618
 epoch: 72, train_loss: 0.5401, test_loss: 1.1868, test_f1: 0.6525
 epoch: 73, train_loss: 0.5441, test_loss: 0.8846, test_f1: 0.6533
 epoch: 74, train_loss: 0.5432, test_loss: 1.0919, test_f1: 0.6522
 epoch: 75, train_loss: 0.5283, test_loss: 1.1779, test_f1: 0.6406
 epoch: 76, train_loss: 0.5223, test_loss: 1.1184, test_f1: 0.6849
 epoch: 77, train_loss: 0.5226, test_loss: 0.9390, test_f1: 0.6658
 epoch: 78, train_loss: 0.5217, test_loss: 1.2143, test_f1: 0.6565
 epoch: 79, train_loss: 0.5187, test_loss: 1.0897, test_f1: 0.6739
 epoch: 80, train_loss: 0.5117, test_loss: 1.0886, test_f1: 0.6681
 epoch: 81, train_loss: 0.5090, test_loss: 1.1410, test_f1: 0.6739
 epoch: 82, train_loss: 0.5116, test_loss: 1.1153, test_f1: 0.6673
 epoch: 83, train_loss: 0.5153, test_loss: 1.1419, test_f1: 0.6624
 epoch: 84, train_loss: 0.5169, test_loss: 1.1945, test_f1: 0.6636
 epoch: 85, train_loss: 0.5184, test_loss: 1.2474, test_f1: 0.6571
 epoch: 86, train_loss: 0.5006, test_loss: 1.2245, test_f1: 0.6765
 epoch: 87, train_loss: 0.5012, test_loss: 1.1735, test_f1: 0.6433
 epoch: 88, train_loss: 0.4985, test_loss: 1.2965, test_f1: 0.6440
 epoch: 89, train_loss: 0.4880, test_loss: 1.0921, test_f1: 0.6597
 epoch: 90, train_loss: 0.4873, test_loss: 1.2954, test_f1: 0.6789
 epoch: 91, train_loss: 0.4783, test_loss: 1.2067, test_f1: 0.6749
 epoch: 92, train_loss: 0.4837, test_loss: 1.2466, test_f1: 0.6712
 epoch: 93, train_loss: 0.4766, test_loss: 1.0328, test_f1: 0.6665
 epoch: 94, train_loss: 0.4992, test_loss: 1.3632, test_f1: 0.6451
 epoch: 95, train_loss: 0.4791, test_loss: 1.1641, test_f1: 0.6733
 epoch: 96, train_loss: 0.4638, test_loss: 1.3863, test_f1: 0.6715
 epoch: 97, train_loss: 0.4850, test_loss: 1.0204, test_f1: 0.6748
 epoch: 98, train_loss: 0.4667, test_loss: 1.1854, test_f1: 0.6829
 epoch: 99, train_loss: 0.4753, test_loss: 1.2071, test_f1: 0.6538
##################ITERATION #2 ****************************************
 epoch: 0, train_loss: 1.1278, test_loss: 1.2984, test_f1: 0.3442
 epoch: 1, train_loss: 1.0701, test_loss: 1.0685, test_f1: 0.4046
 epoch: 2, train_loss: 1.0236, test_loss: 1.1311, test_f1: 0.3770
 epoch: 3, train_loss: 1.0098, test_loss: 1.0615, test_f1: 0.4873
 epoch: 4, train_loss: 1.0051, test_loss: 1.0337, test_f1: 0.5147
 epoch: 5, train_loss: 0.9810, test_loss: 1.0309, test_f1: 0.4708
 epoch: 6, train_loss: 0.9725, test_loss: 0.9843, test_f1: 0.4606
 epoch: 7, train_loss: 0.9484, test_loss: 0.9630, test_f1: 0.4978
 epoch: 8, train_loss: 0.9519, test_loss: 0.9324, test_f1: 0.5287
 epoch: 9, train_loss: 0.9203, test_loss: 1.0762, test_f1: 0.5139
 epoch: 10, train_loss: 0.9287, test_loss: 1.1937, test_f1: 0.4507
 epoch: 11, train_loss: 0.9238, test_loss: 0.8824, test_f1: 0.5434
 epoch: 12, train_loss: 0.9156, test_loss: 0.9225, test_f1: 0.5155
 epoch: 13, train_loss: 0.9066, test_loss: 0.9291, test_f1: 0.5326
 epoch: 14, train_loss: 0.8904, test_loss: 1.0556, test_f1: 0.5011
 epoch: 15, train_loss: 0.8945, test_loss: 0.8882, test_f1: 0.5271
 epoch: 16, train_loss: 0.8873, test_loss: 0.8666, test_f1: 0.5312
 epoch: 17, train_loss: 0.8653, test_loss: 0.9352, test_f1: 0.5341
 epoch: 18, train_loss: 0.8518, test_loss: 0.8996, test_f1: 0.5182
 epoch: 19, train_loss: 0.8615, test_loss: 0.9545, test_f1: 0.5915
 epoch: 20, train_loss: 0.8416, test_loss: 0.8510, test_f1: 0.5335
 epoch: 21, train_loss: 0.8436, test_loss: 0.8983, test_f1: 0.5451
 epoch: 22, train_loss: 0.8257, test_loss: 0.8648, test_f1: 0.6086
 epoch: 23, train_loss: 0.8218, test_loss: 0.9290, test_f1: 0.5343
 epoch: 24, train_loss: 0.8376, test_loss: 1.1202, test_f1: 0.5142
 epoch: 25, train_loss: 0.8295, test_loss: 0.8609, test_f1: 0.5588
 epoch: 26, train_loss: 0.8173, test_loss: 0.8818, test_f1: 0.5711
 epoch: 27, train_loss: 0.7887, test_loss: 0.8291, test_f1: 0.5744
 epoch: 28, train_loss: 0.8174, test_loss: 0.9790, test_f1: 0.5673
 epoch: 29, train_loss: 0.8131, test_loss: 0.8540, test_f1: 0.5749
 epoch: 30, train_loss: 0.8250, test_loss: 0.7806, test_f1: 0.6165
 epoch: 31, train_loss: 0.8038, test_loss: 0.9811, test_f1: 0.6103
 epoch: 32, train_loss: 0.8010, test_loss: 1.0853, test_f1: 0.5838
 epoch: 33, train_loss: 0.7893, test_loss: 0.8090, test_f1: 0.5593
 epoch: 34, train_loss: 0.7707, test_loss: 1.0085, test_f1: 0.5783
 epoch: 35, train_loss: 0.7619, test_loss: 1.0755, test_f1: 0.6126
 epoch: 36, train_loss: 0.7626, test_loss: 0.8852, test_f1: 0.6200
 epoch: 37, train_loss: 0.7704, test_loss: 0.9567, test_f1: 0.5983
 epoch: 38, train_loss: 0.7636, test_loss: 0.7845, test_f1: 0.6024
 epoch: 39, train_loss: 0.7748, test_loss: 1.0940, test_f1: 0.6144
 epoch: 40, train_loss: 0.7457, test_loss: 1.0678, test_f1: 0.6052
 epoch: 41, train_loss: 0.7359, test_loss: 0.9023, test_f1: 0.6547
 epoch: 42, train_loss: 0.7307, test_loss: 1.0835, test_f1: 0.6042
 epoch: 43, train_loss: 0.7429, test_loss: 0.8824, test_f1: 0.6042
 epoch: 44, train_loss: 0.7436, test_loss: 0.9708, test_f1: 0.6396
 epoch: 45, train_loss: 0.7322, test_loss: 1.0059, test_f1: 0.6019
 epoch: 46, train_loss: 0.7351, test_loss: 0.9543, test_f1: 0.6210
 epoch: 47, train_loss: 0.7125, test_loss: 0.9773, test_f1: 0.5887
 epoch: 48, train_loss: 0.7061, test_loss: 0.9982, test_f1: 0.6052
 epoch: 49, train_loss: 0.7018, test_loss: 1.0177, test_f1: 0.6241
 epoch: 50, train_loss: 0.7036, test_loss: 1.0141, test_f1: 0.6005
 epoch: 51, train_loss: 0.6638, test_loss: 1.1240, test_f1: 0.6129
 epoch: 52, train_loss: 0.6362, test_loss: 0.7872, test_f1: 0.6700
 epoch: 53, train_loss: 0.6514, test_loss: 0.9826, test_f1: 0.6371
 epoch: 54, train_loss: 0.6539, test_loss: 0.8676, test_f1: 0.6474
 epoch: 55, train_loss: 0.6259, test_loss: 0.9637, test_f1: 0.6349
 epoch: 56, train_loss: 0.6064, test_loss: 1.0378, test_f1: 0.6584
 epoch: 57, train_loss: 0.6194, test_loss: 0.9511, test_f1: 0.6357
 epoch: 58, train_loss: 0.5985, test_loss: 1.0380, test_f1: 0.6126
 epoch: 59, train_loss: 0.6141, test_loss: 0.7744, test_f1: 0.6272
 epoch: 60, train_loss: 0.6095, test_loss: 1.0977, test_f1: 0.6470
 epoch: 61, train_loss: 0.6035, test_loss: 1.1429, test_f1: 0.6376
 epoch: 62, train_loss: 0.5801, test_loss: 0.8982, test_f1: 0.6771
 epoch: 63, train_loss: 0.5756, test_loss: 0.9897, test_f1: 0.6451
 epoch: 64, train_loss: 0.5782, test_loss: 0.8755, test_f1: 0.6634
 epoch: 65, train_loss: 0.5797, test_loss: 1.0155, test_f1: 0.6617
 epoch: 66, train_loss: 0.5844, test_loss: 1.0439, test_f1: 0.6447
 epoch: 67, train_loss: 0.5751, test_loss: 0.8361, test_f1: 0.6743
 epoch: 68, train_loss: 0.5730, test_loss: 0.8678, test_f1: 0.6500
 epoch: 69, train_loss: 0.5467, test_loss: 0.9820, test_f1: 0.6579
 epoch: 70, train_loss: 0.5551, test_loss: 1.1949, test_f1: 0.6407
 epoch: 71, train_loss: 0.5451, test_loss: 1.0103, test_f1: 0.6557
 epoch: 72, train_loss: 0.5689, test_loss: 1.1141, test_f1: 0.6517
 epoch: 73, train_loss: 0.5244, test_loss: 0.9619, test_f1: 0.6482
 epoch: 74, train_loss: 0.5475, test_loss: 1.0038, test_f1: 0.6665
 epoch: 75, train_loss: 0.5350, test_loss: 0.9122, test_f1: 0.6835
 epoch: 76, train_loss: 0.5450, test_loss: 1.0389, test_f1: 0.6490
 epoch: 77, train_loss: 0.5252, test_loss: 0.8890, test_f1: 0.6781
 epoch: 78, train_loss: 0.5150, test_loss: 0.9312, test_f1: 0.6542
 epoch: 79, train_loss: 0.5187, test_loss: 0.8830, test_f1: 0.6709
 epoch: 80, train_loss: 0.5187, test_loss: 0.8280, test_f1: 0.6605
 epoch: 81, train_loss: 0.5269, test_loss: 0.9024, test_f1: 0.6441
 epoch: 82, train_loss: 0.5009, test_loss: 0.8906, test_f1: 0.6569
 epoch: 83, train_loss: 0.5092, test_loss: 1.1912, test_f1: 0.6629
 epoch: 84, train_loss: 0.5198, test_loss: 0.9037, test_f1: 0.6665
 epoch: 85, train_loss: 0.4884, test_loss: 0.9319, test_f1: 0.6546
 epoch: 86, train_loss: 0.4959, test_loss: 0.9557, test_f1: 0.6616
 epoch: 87, train_loss: 0.4831, test_loss: 1.0209, test_f1: 0.6468
 epoch: 88, train_loss: 0.4888, test_loss: 0.8373, test_f1: 0.6817
 epoch: 89, train_loss: 0.4778, test_loss: 1.0738, test_f1: 0.6817
 epoch: 90, train_loss: 0.5017, test_loss: 1.0100, test_f1: 0.6401
 epoch: 91, train_loss: 0.4781, test_loss: 0.9534, test_f1: 0.6792
 epoch: 92, train_loss: 0.4824, test_loss: 0.9229, test_f1: 0.6968
 epoch: 93, train_loss: 0.4894, test_loss: 0.8827, test_f1: 0.6780
 epoch: 94, train_loss: 0.4718, test_loss: 1.0769, test_f1: 0.6799
 epoch: 95, train_loss: 0.4653, test_loss: 0.8977, test_f1: 0.7071
 epoch: 96, train_loss: 0.4593, test_loss: 0.9486, test_f1: 0.6521
 epoch: 97, train_loss: 0.4982, test_loss: 0.9869, test_f1: 0.6757
 epoch: 98, train_loss: 0.4594, test_loss: 0.9161, test_f1: 0.7012
 epoch: 99, train_loss: 0.4596, test_loss: 0.9243, test_f1: 0.6964
##################ITERATION #3 ****************************************
 epoch: 0, train_loss: 1.0947, test_loss: 1.0778, test_f1: 0.4744
 epoch: 1, train_loss: 0.9892, test_loss: 0.9879, test_f1: 0.4834
 epoch: 2, train_loss: 0.9552, test_loss: 0.9373, test_f1: 0.5031
 epoch: 3, train_loss: 0.9343, test_loss: 1.0142, test_f1: 0.4901
 epoch: 4, train_loss: 0.9139, test_loss: 0.8834, test_f1: 0.5323
 epoch: 5, train_loss: 0.8965, test_loss: 1.1252, test_f1: 0.4631
 epoch: 6, train_loss: 0.9058, test_loss: 0.9401, test_f1: 0.4955
 epoch: 7, train_loss: 0.8847, test_loss: 0.8677, test_f1: 0.5749
 epoch: 8, train_loss: 0.8616, test_loss: 0.8296, test_f1: 0.5539
 epoch: 9, train_loss: 0.8585, test_loss: 0.8778, test_f1: 0.5958
 epoch: 10, train_loss: 0.8421, test_loss: 0.7796, test_f1: 0.6048
 epoch: 11, train_loss: 0.8458, test_loss: 0.9309, test_f1: 0.5217
 epoch: 12, train_loss: 0.8276, test_loss: 0.8266, test_f1: 0.6011
 epoch: 13, train_loss: 0.8278, test_loss: 0.8949, test_f1: 0.5347
 epoch: 14, train_loss: 0.8223, test_loss: 0.8228, test_f1: 0.6222
 epoch: 15, train_loss: 0.8092, test_loss: 0.8879, test_f1: 0.5712
 epoch: 16, train_loss: 0.7981, test_loss: 0.8794, test_f1: 0.6227
 epoch: 17, train_loss: 0.7744, test_loss: 0.9110, test_f1: 0.5962
 epoch: 18, train_loss: 0.7879, test_loss: 0.8766, test_f1: 0.6180
 epoch: 19, train_loss: 0.7766, test_loss: 0.8292, test_f1: 0.5963
 epoch: 20, train_loss: 0.7602, test_loss: 1.0349, test_f1: 0.5564
 epoch: 21, train_loss: 0.7642, test_loss: 0.9414, test_f1: 0.5758
 epoch: 22, train_loss: 0.7494, test_loss: 0.9000, test_f1: 0.5699
 epoch: 23, train_loss: 0.7501, test_loss: 0.9310, test_f1: 0.6064
 epoch: 24, train_loss: 0.7404, test_loss: 0.8537, test_f1: 0.6504
 epoch: 25, train_loss: 0.7248, test_loss: 0.8551, test_f1: 0.6206
 epoch: 26, train_loss: 0.7289, test_loss: 0.7995, test_f1: 0.6396
 epoch: 27, train_loss: 0.7223, test_loss: 0.8166, test_f1: 0.6345
 epoch: 28, train_loss: 0.7306, test_loss: 0.8416, test_f1: 0.6166
 epoch: 29, train_loss: 0.7133, test_loss: 1.2227, test_f1: 0.5478
 epoch: 30, train_loss: 0.7083, test_loss: 0.8823, test_f1: 0.6061
 epoch: 31, train_loss: 0.6990, test_loss: 0.7999, test_f1: 0.5638
 epoch: 32, train_loss: 0.7218, test_loss: 0.7369, test_f1: 0.6431
 epoch: 33, train_loss: 0.6977, test_loss: 0.7983, test_f1: 0.6187
 epoch: 34, train_loss: 0.6978, test_loss: 0.9795, test_f1: 0.6489
 epoch: 35, train_loss: 0.6767, test_loss: 0.9365, test_f1: 0.5970
 epoch: 36, train_loss: 0.6816, test_loss: 1.1550, test_f1: 0.6459
 epoch: 37, train_loss: 0.6690, test_loss: 1.0967, test_f1: 0.6335
 epoch: 38, train_loss: 0.6675, test_loss: 1.0008, test_f1: 0.6361
 epoch: 39, train_loss: 0.6418, test_loss: 1.0252, test_f1: 0.6090
 epoch: 40, train_loss: 0.6648, test_loss: 1.0768, test_f1: 0.6123
 epoch: 41, train_loss: 0.6501, test_loss: 1.0683, test_f1: 0.6457
 epoch: 42, train_loss: 0.6392, test_loss: 1.0397, test_f1: 0.6465
 epoch: 43, train_loss: 0.6577, test_loss: 1.2080, test_f1: 0.6573
 epoch: 44, train_loss: 0.6415, test_loss: 1.0172, test_f1: 0.6509
 epoch: 45, train_loss: 0.6258, test_loss: 1.1076, test_f1: 0.6503
 epoch: 46, train_loss: 0.6228, test_loss: 1.0717, test_f1: 0.6397
 epoch: 47, train_loss: 0.6278, test_loss: 1.0361, test_f1: 0.6860
 epoch: 48, train_loss: 0.5950, test_loss: 0.9751, test_f1: 0.6091
 epoch: 49, train_loss: 0.6068, test_loss: 1.1615, test_f1: 0.6386
 epoch: 50, train_loss: 0.5939, test_loss: 1.0056, test_f1: 0.6648
 epoch: 51, train_loss: 0.5665, test_loss: 1.0322, test_f1: 0.6507
 epoch: 52, train_loss: 0.5419, test_loss: 1.1136, test_f1: 0.6535
 epoch: 53, train_loss: 0.5238, test_loss: 1.1882, test_f1: 0.6581
 epoch: 54, train_loss: 0.5120, test_loss: 1.1695, test_f1: 0.6903
 epoch: 55, train_loss: 0.5066, test_loss: 1.2986, test_f1: 0.6880
 epoch: 56, train_loss: 0.5063, test_loss: 1.2498, test_f1: 0.6577
 epoch: 57, train_loss: 0.4989, test_loss: 1.3136, test_f1: 0.6786
 epoch: 58, train_loss: 0.4965, test_loss: 1.3246, test_f1: 0.6576
 epoch: 59, train_loss: 0.4842, test_loss: 1.2990, test_f1: 0.6671
 epoch: 60, train_loss: 0.4754, test_loss: 1.3074, test_f1: 0.6979
 epoch: 61, train_loss: 0.4782, test_loss: 1.3759, test_f1: 0.6533
 epoch: 62, train_loss: 0.5028, test_loss: 1.2614, test_f1: 0.6695
 epoch: 63, train_loss: 0.4803, test_loss: 1.2976, test_f1: 0.6832
 epoch: 64, train_loss: 0.4828, test_loss: 1.5827, test_f1: 0.6647
 epoch: 65, train_loss: 0.4754, test_loss: 1.4811, test_f1: 0.6827
 epoch: 66, train_loss: 0.4619, test_loss: 1.4115, test_f1: 0.6840
 epoch: 67, train_loss: 0.4701, test_loss: 1.3582, test_f1: 0.6810
 epoch: 68, train_loss: 0.4742, test_loss: 1.4107, test_f1: 0.6882
 epoch: 69, train_loss: 0.4357, test_loss: 1.3945, test_f1: 0.6895
 epoch: 70, train_loss: 0.4459, test_loss: 1.4785, test_f1: 0.6887
 epoch: 71, train_loss: 0.4437, test_loss: 1.4431, test_f1: 0.6892
 epoch: 72, train_loss: 0.4584, test_loss: 1.3428, test_f1: 0.6812
 epoch: 73, train_loss: 0.4435, test_loss: 1.3698, test_f1: 0.6930
 epoch: 74, train_loss: 0.4344, test_loss: 1.4173, test_f1: 0.6946
 epoch: 75, train_loss: 0.4664, test_loss: 1.4122, test_f1: 0.6784
 epoch: 76, train_loss: 0.4452, test_loss: 1.4758, test_f1: 0.6862
 epoch: 77, train_loss: 0.4332, test_loss: 1.5761, test_f1: 0.6973
 epoch: 78, train_loss: 0.4230, test_loss: 1.4228, test_f1: 0.6694
 epoch: 79, train_loss: 0.4147, test_loss: 1.7692, test_f1: 0.6807
 epoch: 80, train_loss: 0.4155, test_loss: 1.6411, test_f1: 0.6675
 epoch: 81, train_loss: 0.4041, test_loss: 1.3244, test_f1: 0.6688
 epoch: 82, train_loss: 0.4148, test_loss: 1.7012, test_f1: 0.6791
 epoch: 83, train_loss: 0.4044, test_loss: 1.5109, test_f1: 0.6697
 epoch: 84, train_loss: 0.3977, test_loss: 1.4973, test_f1: 0.6942
 epoch: 85, train_loss: 0.4142, test_loss: 1.7879, test_f1: 0.6899
 epoch: 86, train_loss: 0.4126, test_loss: 1.3229, test_f1: 0.6901
 epoch: 87, train_loss: 0.4037, test_loss: 1.4685, test_f1: 0.7054
 epoch: 88, train_loss: 0.3931, test_loss: 1.6509, test_f1: 0.6957
 epoch: 89, train_loss: 0.4184, test_loss: 1.2975, test_f1: 0.6838
 epoch: 90, train_loss: 0.3857, test_loss: 1.4655, test_f1: 0.6925
 epoch: 91, train_loss: 0.3663, test_loss: 1.6485, test_f1: 0.6764
 epoch: 92, train_loss: 0.3817, test_loss: 1.3622, test_f1: 0.6740
 epoch: 93, train_loss: 0.3774, test_loss: 1.4110, test_f1: 0.6540
 epoch: 94, train_loss: 0.3679, test_loss: 1.5321, test_f1: 0.6601
 epoch: 95, train_loss: 0.3929, test_loss: 1.4350, test_f1: 0.6658
 epoch: 96, train_loss: 0.3469, test_loss: 1.5630, test_f1: 0.6742
 epoch: 97, train_loss: 0.3817, test_loss: 1.4106, test_f1: 0.6725
 epoch: 98, train_loss: 0.3471, test_loss: 1.5177, test_f1: 0.6753
 epoch: 99, train_loss: 0.3722, test_loss: 1.5411, test_f1: 0.6696
##################ITERATION #4 ****************************************
 epoch: 0, train_loss: 1.1022, test_loss: 1.1016, test_f1: 0.4389
 epoch: 1, train_loss: 0.9926, test_loss: 1.2865, test_f1: 0.4425
 epoch: 2, train_loss: 0.9543, test_loss: 0.9706, test_f1: 0.5541
 epoch: 3, train_loss: 0.9360, test_loss: 0.9042, test_f1: 0.5704
 epoch: 4, train_loss: 0.9263, test_loss: 0.9454, test_f1: 0.5140
 epoch: 5, train_loss: 0.8951, test_loss: 0.9557, test_f1: 0.4971
 epoch: 6, train_loss: 0.8968, test_loss: 0.8740, test_f1: 0.5404
 epoch: 7, train_loss: 0.8884, test_loss: 0.9195, test_f1: 0.5325
 epoch: 8, train_loss: 0.8726, test_loss: 0.9595, test_f1: 0.5143
 epoch: 9, train_loss: 0.8608, test_loss: 0.8688, test_f1: 0.5798
 epoch: 10, train_loss: 0.8713, test_loss: 0.8824, test_f1: 0.5545
 epoch: 11, train_loss: 0.8893, test_loss: 0.9240, test_f1: 0.5555
 epoch: 12, train_loss: 0.8593, test_loss: 0.8857, test_f1: 0.4951
 epoch: 13, train_loss: 0.8272, test_loss: 0.8107, test_f1: 0.6358
 epoch: 14, train_loss: 0.8324, test_loss: 0.9101, test_f1: 0.5264
 epoch: 15, train_loss: 0.8416, test_loss: 0.8610, test_f1: 0.5516
 epoch: 16, train_loss: 0.8158, test_loss: 0.8220, test_f1: 0.5744
 epoch: 17, train_loss: 0.8061, test_loss: 0.8346, test_f1: 0.6468
 epoch: 18, train_loss: 0.8014, test_loss: 0.9577, test_f1: 0.5691
 epoch: 19, train_loss: 0.8088, test_loss: 0.8538, test_f1: 0.6094
 epoch: 20, train_loss: 0.8066, test_loss: 0.8240, test_f1: 0.6086
 epoch: 21, train_loss: 0.7862, test_loss: 0.8371, test_f1: 0.6150
 epoch: 22, train_loss: 0.7815, test_loss: 0.9156, test_f1: 0.5826
 epoch: 23, train_loss: 0.7611, test_loss: 0.8373, test_f1: 0.6427
 epoch: 24, train_loss: 0.7717, test_loss: 0.8938, test_f1: 0.5544
 epoch: 25, train_loss: 0.7619, test_loss: 0.8956, test_f1: 0.6245
 epoch: 26, train_loss: 0.7737, test_loss: 0.7963, test_f1: 0.6409
 epoch: 27, train_loss: 0.7497, test_loss: 1.1114, test_f1: 0.5603
 epoch: 28, train_loss: 0.7779, test_loss: 0.9648, test_f1: 0.6024
 epoch: 29, train_loss: 0.7433, test_loss: 0.7864, test_f1: 0.6532
 epoch: 30, train_loss: 0.7142, test_loss: 0.9875, test_f1: 0.6075
 epoch: 31, train_loss: 0.7013, test_loss: 0.8586, test_f1: 0.6667
 epoch: 32, train_loss: 0.7212, test_loss: 0.9192, test_f1: 0.6599
 epoch: 33, train_loss: 0.6797, test_loss: 0.8637, test_f1: 0.6481
 epoch: 34, train_loss: 0.7730, test_loss: 1.0184, test_f1: 0.6439
 epoch: 35, train_loss: 0.7091, test_loss: 0.8270, test_f1: 0.5981
 epoch: 36, train_loss: 0.7209, test_loss: 0.8916, test_f1: 0.6382
 epoch: 37, train_loss: 0.7058, test_loss: 0.8591, test_f1: 0.6650
 epoch: 38, train_loss: 0.6869, test_loss: 1.0451, test_f1: 0.6554
 epoch: 39, train_loss: 0.7253, test_loss: 0.9761, test_f1: 0.6312
 epoch: 40, train_loss: 0.6863, test_loss: 0.8519, test_f1: 0.6527
 epoch: 41, train_loss: 0.7911, test_loss: 1.0136, test_f1: 0.5663
 epoch: 42, train_loss: 0.7624, test_loss: 1.1304, test_f1: 0.4613
 epoch: 43, train_loss: 0.8215, test_loss: 1.1765, test_f1: 0.5109
 epoch: 44, train_loss: 0.7443, test_loss: 1.1531, test_f1: 0.5770
 epoch: 45, train_loss: 0.7254, test_loss: 1.0734, test_f1: 0.6209
 epoch: 46, train_loss: 0.7029, test_loss: 1.0691, test_f1: 0.5656
 epoch: 47, train_loss: 0.6762, test_loss: 0.9522, test_f1: 0.6265
 epoch: 48, train_loss: 0.6966, test_loss: 0.9054, test_f1: 0.6418
 epoch: 49, train_loss: 0.6693, test_loss: 0.9873, test_f1: 0.6352
 epoch: 50, train_loss: 0.6548, test_loss: 0.9348, test_f1: 0.6356
 epoch: 51, train_loss: 0.6262, test_loss: 1.0478, test_f1: 0.6661
 epoch: 52, train_loss: 0.5949, test_loss: 0.9151, test_f1: 0.6483
 epoch: 53, train_loss: 0.5802, test_loss: 0.9883, test_f1: 0.6509
 epoch: 54, train_loss: 0.5929, test_loss: 1.1224, test_f1: 0.6462
 epoch: 55, train_loss: 0.5755, test_loss: 1.0978, test_f1: 0.6564
 epoch: 56, train_loss: 0.5666, test_loss: 0.9503, test_f1: 0.6665
 epoch: 57, train_loss: 0.5762, test_loss: 1.0412, test_f1: 0.6459
 epoch: 58, train_loss: 0.5474, test_loss: 1.0199, test_f1: 0.6559
 epoch: 59, train_loss: 0.5609, test_loss: 1.1386, test_f1: 0.6809
 epoch: 60, train_loss: 0.5658, test_loss: 1.0408, test_f1: 0.6582
 epoch: 61, train_loss: 0.5628, test_loss: 1.0505, test_f1: 0.6546
 epoch: 62, train_loss: 0.5547, test_loss: 1.0414, test_f1: 0.6517
 epoch: 63, train_loss: 0.5385, test_loss: 1.2046, test_f1: 0.6609
 epoch: 64, train_loss: 0.5418, test_loss: 1.0701, test_f1: 0.6606
 epoch: 65, train_loss: 0.5442, test_loss: 1.1043, test_f1: 0.6634
 epoch: 66, train_loss: 0.5189, test_loss: 1.1120, test_f1: 0.6361
 epoch: 67, train_loss: 0.5216, test_loss: 1.2371, test_f1: 0.6366
 epoch: 68, train_loss: 0.5215, test_loss: 1.2686, test_f1: 0.6472
 epoch: 69, train_loss: 0.5121, test_loss: 1.1127, test_f1: 0.6563
 epoch: 70, train_loss: 0.4949, test_loss: 1.1139, test_f1: 0.6479
 epoch: 71, train_loss: 0.5156, test_loss: 1.1947, test_f1: 0.6588
 epoch: 72, train_loss: 0.5105, test_loss: 1.2382, test_f1: 0.6455
 epoch: 73, train_loss: 0.5242, test_loss: 1.1864, test_f1: 0.6369
 epoch: 74, train_loss: 0.5339, test_loss: 1.2871, test_f1: 0.6628
 epoch: 75, train_loss: 0.4810, test_loss: 1.1842, test_f1: 0.6668
 epoch: 76, train_loss: 0.4932, test_loss: 1.2744, test_f1: 0.6477
 epoch: 77, train_loss: 0.4906, test_loss: 1.2259, test_f1: 0.6736
 epoch: 78, train_loss: 0.4874, test_loss: 1.2284, test_f1: 0.6659
 epoch: 79, train_loss: 0.4758, test_loss: 1.1212, test_f1: 0.6607
 epoch: 80, train_loss: 0.4749, test_loss: 1.2835, test_f1: 0.6702
 epoch: 81, train_loss: 0.4772, test_loss: 1.1461, test_f1: 0.6507
 epoch: 82, train_loss: 0.4721, test_loss: 1.2999, test_f1: 0.6477
 epoch: 83, train_loss: 0.4684, test_loss: 1.3064, test_f1: 0.6608
 epoch: 84, train_loss: 0.4820, test_loss: 1.2665, test_f1: 0.6440
 epoch: 85, train_loss: 0.4814, test_loss: 1.2645, test_f1: 0.6550
 epoch: 86, train_loss: 0.4776, test_loss: 1.3921, test_f1: 0.6483
 epoch: 87, train_loss: 0.4730, test_loss: 1.2488, test_f1: 0.6573
 epoch: 88, train_loss: 0.4607, test_loss: 1.1882, test_f1: 0.6377
 epoch: 89, train_loss: 0.4559, test_loss: 1.2596, test_f1: 0.6614
 epoch: 90, train_loss: 0.4250, test_loss: 1.3402, test_f1: 0.6581
 epoch: 91, train_loss: 0.4708, test_loss: 1.2258, test_f1: 0.6681
 epoch: 92, train_loss: 0.4500, test_loss: 1.4355, test_f1: 0.6792
 epoch: 93, train_loss: 0.4338, test_loss: 1.2227, test_f1: 0.6391
 epoch: 94, train_loss: 0.4468, test_loss: 1.2810, test_f1: 0.6606
 epoch: 95, train_loss: 0.4555, test_loss: 1.1917, test_f1: 0.6722
 epoch: 96, train_loss: 0.4279, test_loss: 1.0450, test_f1: 0.6568
 epoch: 97, train_loss: 0.4272, test_loss: 1.4134, test_f1: 0.6437
 epoch: 98, train_loss: 0.4417, test_loss: 1.4260, test_f1: 0.6419
 epoch: 99, train_loss: 0.4585, test_loss: 1.2207, test_f1: 0.6505
##################ITERATION #5 ****************************************
 epoch: 0, train_loss: 1.1157, test_loss: 1.0043, test_f1: 0.4537
 epoch: 1, train_loss: 0.9758, test_loss: 0.9204, test_f1: 0.5369
 epoch: 2, train_loss: 0.9597, test_loss: 0.9375, test_f1: 0.5460
 epoch: 3, train_loss: 0.9345, test_loss: 0.9945, test_f1: 0.5061
 epoch: 4, train_loss: 0.9314, test_loss: 0.9764, test_f1: 0.5107
 epoch: 5, train_loss: 0.9328, test_loss: 1.1230, test_f1: 0.4398
 epoch: 6, train_loss: 0.9105, test_loss: 0.8532, test_f1: 0.5354
 epoch: 7, train_loss: 0.8889, test_loss: 0.9564, test_f1: 0.5638
 epoch: 8, train_loss: 0.8731, test_loss: 0.9597, test_f1: 0.5879
 epoch: 9, train_loss: 0.8671, test_loss: 0.8995, test_f1: 0.5941
 epoch: 10, train_loss: 0.8492, test_loss: 0.9724, test_f1: 0.5568
 epoch: 11, train_loss: 0.8519, test_loss: 0.8402, test_f1: 0.5850
 epoch: 12, train_loss: 0.8434, test_loss: 0.8627, test_f1: 0.5589
 epoch: 13, train_loss: 0.8396, test_loss: 0.9501, test_f1: 0.5310
 epoch: 14, train_loss: 0.8288, test_loss: 0.8632, test_f1: 0.6010
 epoch: 15, train_loss: 0.8379, test_loss: 0.8893, test_f1: 0.5822
 epoch: 16, train_loss: 0.8195, test_loss: 0.8348, test_f1: 0.5921
 epoch: 17, train_loss: 0.8048, test_loss: 0.8973, test_f1: 0.5679
 epoch: 18, train_loss: 0.8010, test_loss: 0.8916, test_f1: 0.5980
 epoch: 19, train_loss: 0.7879, test_loss: 0.8571, test_f1: 0.6073
 epoch: 20, train_loss: 0.7945, test_loss: 0.9035, test_f1: 0.5500
 epoch: 21, train_loss: 0.7860, test_loss: 0.8654, test_f1: 0.5950
 epoch: 22, train_loss: 0.7647, test_loss: 0.9810, test_f1: 0.5909
 epoch: 23, train_loss: 0.7621, test_loss: 0.9495, test_f1: 0.5900
 epoch: 24, train_loss: 0.7481, test_loss: 0.9242, test_f1: 0.5691
 epoch: 25, train_loss: 0.7734, test_loss: 0.9995, test_f1: 0.5990
 epoch: 26, train_loss: 0.7591, test_loss: 0.9751, test_f1: 0.6283
 epoch: 27, train_loss: 0.7440, test_loss: 0.8284, test_f1: 0.6051
 epoch: 28, train_loss: 0.7427, test_loss: 0.8805, test_f1: 0.6055
 epoch: 29, train_loss: 0.7281, test_loss: 0.9016, test_f1: 0.6131
 epoch: 30, train_loss: 0.7259, test_loss: 0.9351, test_f1: 0.6263
 epoch: 31, train_loss: 0.7392, test_loss: 0.8890, test_f1: 0.6378
 epoch: 32, train_loss: 0.7024, test_loss: 0.8439, test_f1: 0.6451
 epoch: 33, train_loss: 0.7056, test_loss: 1.0314, test_f1: 0.6308
 epoch: 34, train_loss: 0.7166, test_loss: 0.9376, test_f1: 0.6379
 epoch: 35, train_loss: 0.6749, test_loss: 0.9378, test_f1: 0.6221
 epoch: 36, train_loss: 0.6996, test_loss: 0.9816, test_f1: 0.6151
 epoch: 37, train_loss: 0.7069, test_loss: 0.9226, test_f1: 0.6550
 epoch: 38, train_loss: 0.6718, test_loss: 0.9450, test_f1: 0.6345
 epoch: 39, train_loss: 0.7004, test_loss: 0.9206, test_f1: 0.6582
 epoch: 40, train_loss: 0.6920, test_loss: 1.1475, test_f1: 0.6675
 epoch: 41, train_loss: 0.7125, test_loss: 0.8995, test_f1: 0.6520
 epoch: 42, train_loss: 0.6671, test_loss: 0.8976, test_f1: 0.6555
 epoch: 43, train_loss: 0.6817, test_loss: 0.9207, test_f1: 0.6481
 epoch: 44, train_loss: 0.6536, test_loss: 0.9977, test_f1: 0.6317
 epoch: 45, train_loss: 0.6778, test_loss: 0.9417, test_f1: 0.5871
 epoch: 46, train_loss: 0.6881, test_loss: 1.1406, test_f1: 0.6390
 epoch: 47, train_loss: 0.6577, test_loss: 1.0315, test_f1: 0.6415
 epoch: 48, train_loss: 0.6505, test_loss: 0.9577, test_f1: 0.6379
 epoch: 49, train_loss: 0.6851, test_loss: 0.8724, test_f1: 0.6178
 epoch: 50, train_loss: 0.6509, test_loss: 1.1564, test_f1: 0.6008
 epoch: 51, train_loss: 0.6061, test_loss: 0.9137, test_f1: 0.6706
 epoch: 52, train_loss: 0.5986, test_loss: 1.0344, test_f1: 0.6663
 epoch: 53, train_loss: 0.5721, test_loss: 1.0754, test_f1: 0.6426
 epoch: 54, train_loss: 0.5757, test_loss: 1.1038, test_f1: 0.6597
 epoch: 55, train_loss: 0.5667, test_loss: 1.1111, test_f1: 0.6748
 epoch: 56, train_loss: 0.5549, test_loss: 1.1543, test_f1: 0.6552
 epoch: 57, train_loss: 0.5653, test_loss: 1.1249, test_f1: 0.6460
 epoch: 58, train_loss: 0.5653, test_loss: 0.9260, test_f1: 0.6636
 epoch: 59, train_loss: 0.5298, test_loss: 1.0613, test_f1: 0.6331
 epoch: 60, train_loss: 0.5431, test_loss: 1.1723, test_f1: 0.6431
 epoch: 61, train_loss: 0.5381, test_loss: 1.1536, test_f1: 0.6814
 epoch: 62, train_loss: 0.5220, test_loss: 1.1674, test_f1: 0.6641
 epoch: 63, train_loss: 0.5630, test_loss: 1.2320, test_f1: 0.6510
 epoch: 64, train_loss: 0.5298, test_loss: 0.9991, test_f1: 0.6856
 epoch: 65, train_loss: 0.5368, test_loss: 1.0912, test_f1: 0.6590
 epoch: 66, train_loss: 0.5371, test_loss: 1.0544, test_f1: 0.6686
 epoch: 67, train_loss: 0.5218, test_loss: 1.0274, test_f1: 0.6649
 epoch: 68, train_loss: 0.5076, test_loss: 1.2561, test_f1: 0.6713
 epoch: 69, train_loss: 0.5083, test_loss: 1.2294, test_f1: 0.6822
 epoch: 70, train_loss: 0.5113, test_loss: 1.2631, test_f1: 0.6644
 epoch: 71, train_loss: 0.4974, test_loss: 1.1909, test_f1: 0.6530
 epoch: 72, train_loss: 0.4912, test_loss: 1.1059, test_f1: 0.6757
 epoch: 73, train_loss: 0.4956, test_loss: 1.0818, test_f1: 0.6795
 epoch: 74, train_loss: 0.5049, test_loss: 1.2249, test_f1: 0.6714
 epoch: 75, train_loss: 0.4948, test_loss: 1.1985, test_f1: 0.6827
 epoch: 76, train_loss: 0.5035, test_loss: 1.1414, test_f1: 0.6773
 epoch: 77, train_loss: 0.4799, test_loss: 1.1343, test_f1: 0.6904
 epoch: 78, train_loss: 0.4933, test_loss: 1.2298, test_f1: 0.6754
 epoch: 79, train_loss: 0.4786, test_loss: 1.5383, test_f1: 0.6174
 epoch: 80, train_loss: 0.4929, test_loss: 1.2222, test_f1: 0.6451
 epoch: 81, train_loss: 0.4783, test_loss: 1.3227, test_f1: 0.6525
 epoch: 82, train_loss: 0.4764, test_loss: 1.4112, test_f1: 0.6903
 epoch: 83, train_loss: 0.4562, test_loss: 1.2529, test_f1: 0.6767
 epoch: 84, train_loss: 0.4677, test_loss: 1.4288, test_f1: 0.6538
 epoch: 85, train_loss: 0.4742, test_loss: 1.2782, test_f1: 0.6693
 epoch: 86, train_loss: 0.4603, test_loss: 1.3988, test_f1: 0.6313
 epoch: 87, train_loss: 0.4580, test_loss: 1.2205, test_f1: 0.6502
 epoch: 88, train_loss: 0.4907, test_loss: 1.1937, test_f1: 0.6726
 epoch: 89, train_loss: 0.4398, test_loss: 1.0628, test_f1: 0.6673
 epoch: 90, train_loss: 0.4563, test_loss: 1.3730, test_f1: 0.6535
 epoch: 91, train_loss: 0.4668, test_loss: 1.1734, test_f1: 0.6564
 epoch: 92, train_loss: 0.4575, test_loss: 1.3690, test_f1: 0.6389
 epoch: 93, train_loss: 0.4523, test_loss: 1.2818, test_f1: 0.6524
 epoch: 94, train_loss: 0.4450, test_loss: 1.4172, test_f1: 0.6528
 epoch: 95, train_loss: 0.4535, test_loss: 1.3138, test_f1: 0.6836
 epoch: 96, train_loss: 0.4389, test_loss: 1.3395, test_f1: 0.6839
 epoch: 97, train_loss: 0.4252, test_loss: 1.1862, test_f1: 0.6823
 epoch: 98, train_loss: 0.4416, test_loss: 1.2312, test_f1: 0.6806
 epoch: 99, train_loss: 0.4142, test_loss: 1.3284, test_f1: 0.6760
##################ITERATION #6 ****************************************
 epoch: 0, train_loss: 1.1021, test_loss: 1.0527, test_f1: 0.4441
 epoch: 1, train_loss: 0.9571, test_loss: 0.9579, test_f1: 0.5024
 epoch: 2, train_loss: 0.9400, test_loss: 0.8833, test_f1: 0.5233
 epoch: 3, train_loss: 0.9226, test_loss: 1.0139, test_f1: 0.5261
 epoch: 4, train_loss: 0.9210, test_loss: 1.2389, test_f1: 0.4088
 epoch: 5, train_loss: 0.9174, test_loss: 1.0458, test_f1: 0.4809
 epoch: 6, train_loss: 0.9031, test_loss: 0.9919, test_f1: 0.4834
 epoch: 7, train_loss: 0.9006, test_loss: 0.9169, test_f1: 0.5088
 epoch: 8, train_loss: 0.8686, test_loss: 0.9097, test_f1: 0.5275
 epoch: 9, train_loss: 0.8672, test_loss: 1.0562, test_f1: 0.5561
 epoch: 10, train_loss: 0.8649, test_loss: 0.8589, test_f1: 0.5542
 epoch: 11, train_loss: 0.8671, test_loss: 0.9609, test_f1: 0.5690
 epoch: 12, train_loss: 0.8321, test_loss: 0.8644, test_f1: 0.5736
 epoch: 13, train_loss: 0.8602, test_loss: 0.9515, test_f1: 0.5772
 epoch: 14, train_loss: 0.8549, test_loss: 0.8828, test_f1: 0.5486
 epoch: 15, train_loss: 0.8403, test_loss: 0.8848, test_f1: 0.5416
 epoch: 16, train_loss: 0.8153, test_loss: 0.9240, test_f1: 0.5413
 epoch: 17, train_loss: 0.8097, test_loss: 0.8858, test_f1: 0.5408
 epoch: 18, train_loss: 0.8094, test_loss: 0.8220, test_f1: 0.6209
 epoch: 19, train_loss: 0.7882, test_loss: 0.9222, test_f1: 0.5639
 epoch: 20, train_loss: 0.7712, test_loss: 0.8197, test_f1: 0.5847
 epoch: 21, train_loss: 0.7919, test_loss: 0.8289, test_f1: 0.6327
 epoch: 22, train_loss: 0.7538, test_loss: 0.9045, test_f1: 0.5989
 epoch: 23, train_loss: 0.7647, test_loss: 0.8104, test_f1: 0.6039
 epoch: 24, train_loss: 0.7530, test_loss: 0.8510, test_f1: 0.5891
 epoch: 25, train_loss: 0.7334, test_loss: 0.8437, test_f1: 0.5252
 epoch: 26, train_loss: 0.7427, test_loss: 0.8807, test_f1: 0.6085
 epoch: 27, train_loss: 0.7424, test_loss: 0.8160, test_f1: 0.5613
 epoch: 28, train_loss: 0.7693, test_loss: 0.9342, test_f1: 0.6045
 epoch: 29, train_loss: 0.7575, test_loss: 0.9849, test_f1: 0.5839
 epoch: 30, train_loss: 0.7686, test_loss: 0.7965, test_f1: 0.6542
 epoch: 31, train_loss: 0.7247, test_loss: 0.8434, test_f1: 0.6532
 epoch: 32, train_loss: 0.7136, test_loss: 0.8124, test_f1: 0.6526
 epoch: 33, train_loss: 0.6973, test_loss: 0.8925, test_f1: 0.6217
 epoch: 34, train_loss: 0.6958, test_loss: 0.7979, test_f1: 0.6347
 epoch: 35, train_loss: 0.6813, test_loss: 0.9959, test_f1: 0.6555
 epoch: 36, train_loss: 0.6865, test_loss: 1.1990, test_f1: 0.5787
 epoch: 37, train_loss: 0.6752, test_loss: 0.8293, test_f1: 0.6325
 epoch: 38, train_loss: 0.6611, test_loss: 0.8393, test_f1: 0.6137
 epoch: 39, train_loss: 0.6832, test_loss: 0.8951, test_f1: 0.6330
 epoch: 40, train_loss: 0.6710, test_loss: 0.8564, test_f1: 0.6454
 epoch: 41, train_loss: 0.6642, test_loss: 0.8060, test_f1: 0.6443
 epoch: 42, train_loss: 0.6802, test_loss: 0.8284, test_f1: 0.6720
 epoch: 43, train_loss: 0.6518, test_loss: 0.7570, test_f1: 0.6760
 epoch: 44, train_loss: 0.6745, test_loss: 1.1532, test_f1: 0.6008
 epoch: 45, train_loss: 0.6245, test_loss: 0.7790, test_f1: 0.6651
 epoch: 46, train_loss: 0.6325, test_loss: 0.8144, test_f1: 0.6633
 epoch: 47, train_loss: 0.6383, test_loss: 0.7750, test_f1: 0.6337
 epoch: 48, train_loss: 0.6172, test_loss: 0.8464, test_f1: 0.6366
 epoch: 49, train_loss: 0.6124, test_loss: 0.8199, test_f1: 0.6839
 epoch: 50, train_loss: 0.6188, test_loss: 0.8231, test_f1: 0.6832
 epoch: 51, train_loss: 0.5934, test_loss: 0.8369, test_f1: 0.6747
 epoch: 52, train_loss: 0.5509, test_loss: 0.8069, test_f1: 0.7162
 epoch: 53, train_loss: 0.5352, test_loss: 0.8092, test_f1: 0.6916
 epoch: 54, train_loss: 0.5247, test_loss: 0.8386, test_f1: 0.6792
 epoch: 55, train_loss: 0.5436, test_loss: 0.8510, test_f1: 0.6793
 epoch: 56, train_loss: 0.5177, test_loss: 0.9306, test_f1: 0.6622
 epoch: 57, train_loss: 0.5242, test_loss: 0.8305, test_f1: 0.6735
 epoch: 58, train_loss: 0.5277, test_loss: 0.8268, test_f1: 0.6883
 epoch: 59, train_loss: 0.5405, test_loss: 0.8170, test_f1: 0.6580
 epoch: 60, train_loss: 0.5030, test_loss: 0.8657, test_f1: 0.6838
 epoch: 61, train_loss: 0.5098, test_loss: 0.8795, test_f1: 0.6459
 epoch: 62, train_loss: 0.5132, test_loss: 0.9061, test_f1: 0.6687
 epoch: 63, train_loss: 0.5084, test_loss: 0.7995, test_f1: 0.6694
 epoch: 64, train_loss: 0.5069, test_loss: 0.7872, test_f1: 0.7009
 epoch: 65, train_loss: 0.5073, test_loss: 0.8413, test_f1: 0.6828
 epoch: 66, train_loss: 0.5037, test_loss: 0.8369, test_f1: 0.6777
 epoch: 67, train_loss: 0.4923, test_loss: 0.7875, test_f1: 0.7065
 epoch: 68, train_loss: 0.5034, test_loss: 0.8763, test_f1: 0.6591
 epoch: 69, train_loss: 0.4741, test_loss: 0.8702, test_f1: 0.7018
 epoch: 70, train_loss: 0.4736, test_loss: 0.8159, test_f1: 0.6879
 epoch: 71, train_loss: 0.4733, test_loss: 0.8096, test_f1: 0.6737
 epoch: 72, train_loss: 0.4679, test_loss: 0.8590, test_f1: 0.6916
 epoch: 73, train_loss: 0.4591, test_loss: 0.9121, test_f1: 0.6389
 epoch: 74, train_loss: 0.4663, test_loss: 0.8454, test_f1: 0.6555
 epoch: 75, train_loss: 0.4879, test_loss: 0.8463, test_f1: 0.6716
 epoch: 76, train_loss: 0.4612, test_loss: 0.9267, test_f1: 0.6873
 epoch: 77, train_loss: 0.4402, test_loss: 0.9103, test_f1: 0.6998
 epoch: 78, train_loss: 0.4731, test_loss: 0.8821, test_f1: 0.6728
 epoch: 79, train_loss: 0.4572, test_loss: 0.8272, test_f1: 0.6888
 epoch: 80, train_loss: 0.4438, test_loss: 0.9492, test_f1: 0.6534
 epoch: 81, train_loss: 0.4545, test_loss: 0.8983, test_f1: 0.6784
 epoch: 82, train_loss: 0.4430, test_loss: 0.8441, test_f1: 0.6688
 epoch: 83, train_loss: 0.4423, test_loss: 0.8089, test_f1: 0.6923
 epoch: 84, train_loss: 0.4070, test_loss: 0.8070, test_f1: 0.6962
 epoch: 85, train_loss: 0.4285, test_loss: 0.9033, test_f1: 0.7021
 epoch: 86, train_loss: 0.4330, test_loss: 0.8844, test_f1: 0.6738
 epoch: 87, train_loss: 0.4366, test_loss: 0.8961, test_f1: 0.6902
 epoch: 88, train_loss: 0.4312, test_loss: 0.9576, test_f1: 0.6784
 epoch: 89, train_loss: 0.4403, test_loss: 0.8482, test_f1: 0.6729
 epoch: 90, train_loss: 0.4419, test_loss: 0.9058, test_f1: 0.6785
 epoch: 91, train_loss: 0.4149, test_loss: 0.9342, test_f1: 0.6768
 epoch: 92, train_loss: 0.4302, test_loss: 0.8631, test_f1: 0.6907
 epoch: 93, train_loss: 0.4101, test_loss: 0.9563, test_f1: 0.7071
 epoch: 94, train_loss: 0.4174, test_loss: 0.9232, test_f1: 0.6855
 epoch: 95, train_loss: 0.4130, test_loss: 0.8765, test_f1: 0.6745
 epoch: 96, train_loss: 0.4129, test_loss: 0.9834, test_f1: 0.6634
 epoch: 97, train_loss: 0.4086, test_loss: 0.9129, test_f1: 0.6556
 epoch: 98, train_loss: 0.4126, test_loss: 0.9535, test_f1: 0.6765
 epoch: 99, train_loss: 0.4432, test_loss: 0.8323, test_f1: 0.6967
##################ITERATION #7 ****************************************
 epoch: 0, train_loss: 1.1101, test_loss: 1.1277, test_f1: 0.4722
 epoch: 1, train_loss: 0.9672, test_loss: 0.9867, test_f1: 0.4746
 epoch: 2, train_loss: 0.9338, test_loss: 1.0750, test_f1: 0.4804
 epoch: 3, train_loss: 0.9343, test_loss: 0.9282, test_f1: 0.4817
 epoch: 4, train_loss: 0.9002, test_loss: 0.9771, test_f1: 0.5040
 epoch: 5, train_loss: 0.9153, test_loss: 0.8749, test_f1: 0.5196
 epoch: 6, train_loss: 0.9056, test_loss: 0.9156, test_f1: 0.5649
 epoch: 7, train_loss: 0.8774, test_loss: 0.8441, test_f1: 0.5615
 epoch: 8, train_loss: 0.8722, test_loss: 0.8919, test_f1: 0.5393
 epoch: 9, train_loss: 0.8646, test_loss: 0.8757, test_f1: 0.5964
 epoch: 10, train_loss: 0.9029, test_loss: 0.9266, test_f1: 0.5313
 epoch: 11, train_loss: 0.8978, test_loss: 0.8896, test_f1: 0.5647
 epoch: 12, train_loss: 0.8474, test_loss: 1.0480, test_f1: 0.4393
 epoch: 13, train_loss: 0.8433, test_loss: 0.8534, test_f1: 0.5871
 epoch: 14, train_loss: 0.8230, test_loss: 1.0293, test_f1: 0.4833
 epoch: 15, train_loss: 0.8153, test_loss: 0.8832, test_f1: 0.5566
 epoch: 16, train_loss: 0.8150, test_loss: 0.8672, test_f1: 0.5540
 epoch: 17, train_loss: 0.8105, test_loss: 0.8511, test_f1: 0.5598
 epoch: 18, train_loss: 0.8043, test_loss: 0.8568, test_f1: 0.5879
 epoch: 19, train_loss: 0.8457, test_loss: 0.8692, test_f1: 0.5308
 epoch: 20, train_loss: 0.8074, test_loss: 0.9908, test_f1: 0.5899
 epoch: 21, train_loss: 0.7932, test_loss: 0.8392, test_f1: 0.6004
 epoch: 22, train_loss: 0.7649, test_loss: 0.8625, test_f1: 0.6135
 epoch: 23, train_loss: 0.7616, test_loss: 0.8788, test_f1: 0.5644
 epoch: 24, train_loss: 0.7554, test_loss: 0.9777, test_f1: 0.5742
 epoch: 25, train_loss: 0.7490, test_loss: 0.8987, test_f1: 0.5458
 epoch: 26, train_loss: 0.7460, test_loss: 0.8296, test_f1: 0.6183
 epoch: 27, train_loss: 0.7281, test_loss: 0.8449, test_f1: 0.6122
 epoch: 28, train_loss: 0.7273, test_loss: 0.9455, test_f1: 0.5681
 epoch: 29, train_loss: 0.7378, test_loss: 0.8476, test_f1: 0.6243
 epoch: 30, train_loss: 0.7017, test_loss: 1.0353, test_f1: 0.5807
 epoch: 31, train_loss: 0.7123, test_loss: 0.9099, test_f1: 0.5756
 epoch: 32, train_loss: 0.7165, test_loss: 0.9997, test_f1: 0.6346
 epoch: 33, train_loss: 0.7188, test_loss: 0.9352, test_f1: 0.6348
 epoch: 34, train_loss: 0.6842, test_loss: 0.8869, test_f1: 0.6056
 epoch: 35, train_loss: 0.6851, test_loss: 0.9489, test_f1: 0.6762
 epoch: 36, train_loss: 0.7139, test_loss: 0.9562, test_f1: 0.6485
 epoch: 37, train_loss: 0.6825, test_loss: 0.9552, test_f1: 0.5933
 epoch: 38, train_loss: 0.6542, test_loss: 1.0374, test_f1: 0.6263
 epoch: 39, train_loss: 0.7151, test_loss: 1.0072, test_f1: 0.6460
 epoch: 40, train_loss: 0.6966, test_loss: 0.9274, test_f1: 0.6467
 epoch: 41, train_loss: 0.6723, test_loss: 0.8124, test_f1: 0.6749
 epoch: 42, train_loss: 0.6810, test_loss: 0.9462, test_f1: 0.6445
 epoch: 43, train_loss: 0.6544, test_loss: 0.7634, test_f1: 0.6229
 epoch: 44, train_loss: 0.6511, test_loss: 0.8009, test_f1: 0.6381
 epoch: 45, train_loss: 0.6389, test_loss: 0.9231, test_f1: 0.6409
 epoch: 46, train_loss: 0.6651, test_loss: 0.9491, test_f1: 0.6663
 epoch: 47, train_loss: 0.6132, test_loss: 0.8962, test_f1: 0.6460
 epoch: 48, train_loss: 0.6482, test_loss: 0.8592, test_f1: 0.6759
 epoch: 49, train_loss: 0.6138, test_loss: 0.9386, test_f1: 0.6480
 epoch: 50, train_loss: 0.5903, test_loss: 0.9944, test_f1: 0.6376
 epoch: 51, train_loss: 0.6058, test_loss: 0.7915, test_f1: 0.6556
 epoch: 52, train_loss: 0.5880, test_loss: 0.8131, test_f1: 0.6615
 epoch: 53, train_loss: 0.5619, test_loss: 0.8926, test_f1: 0.6606
 epoch: 54, train_loss: 0.5481, test_loss: 0.8271, test_f1: 0.6600
 epoch: 55, train_loss: 0.5557, test_loss: 0.9071, test_f1: 0.6677
 epoch: 56, train_loss: 0.5519, test_loss: 0.8522, test_f1: 0.6795
 epoch: 57, train_loss: 0.5162, test_loss: 0.8078, test_f1: 0.6697
 epoch: 58, train_loss: 0.5393, test_loss: 0.8414, test_f1: 0.6860
 epoch: 59, train_loss: 0.5451, test_loss: 0.9169, test_f1: 0.6562
 epoch: 60, train_loss: 0.5763, test_loss: 0.8661, test_f1: 0.6808
 epoch: 61, train_loss: 0.5261, test_loss: 1.1370, test_f1: 0.6251
 epoch: 62, train_loss: 0.5193, test_loss: 0.9018, test_f1: 0.6605
 epoch: 63, train_loss: 0.5140, test_loss: 0.8661, test_f1: 0.6890
 epoch: 64, train_loss: 0.5151, test_loss: 0.8479, test_f1: 0.6684
 epoch: 65, train_loss: 0.5200, test_loss: 0.8355, test_f1: 0.6700
 epoch: 66, train_loss: 0.5572, test_loss: 0.9791, test_f1: 0.6703
 epoch: 67, train_loss: 0.5274, test_loss: 0.9852, test_f1: 0.6639
 epoch: 68, train_loss: 0.5106, test_loss: 0.9177, test_f1: 0.6446
 epoch: 69, train_loss: 0.4778, test_loss: 0.8059, test_f1: 0.6880
 epoch: 70, train_loss: 0.4698, test_loss: 0.8640, test_f1: 0.6771
 epoch: 71, train_loss: 0.4634, test_loss: 0.8978, test_f1: 0.6792
 epoch: 72, train_loss: 0.4781, test_loss: 0.9701, test_f1: 0.6540
 epoch: 73, train_loss: 0.4661, test_loss: 0.7839, test_f1: 0.6592
 epoch: 74, train_loss: 0.4792, test_loss: 0.9851, test_f1: 0.6468
 epoch: 75, train_loss: 0.4806, test_loss: 1.1525, test_f1: 0.6354
 epoch: 76, train_loss: 0.4832, test_loss: 0.8959, test_f1: 0.6720
 epoch: 77, train_loss: 0.4767, test_loss: 0.8002, test_f1: 0.6652
 epoch: 78, train_loss: 0.4511, test_loss: 0.8121, test_f1: 0.6978
 epoch: 79, train_loss: 0.4802, test_loss: 0.8559, test_f1: 0.6931
 epoch: 80, train_loss: 0.4420, test_loss: 0.8912, test_f1: 0.6673
 epoch: 81, train_loss: 0.4451, test_loss: 0.8935, test_f1: 0.6849
 epoch: 82, train_loss: 0.4606, test_loss: 0.8608, test_f1: 0.6629
 epoch: 83, train_loss: 0.4410, test_loss: 1.0043, test_f1: 0.6534
 epoch: 84, train_loss: 0.4332, test_loss: 1.0262, test_f1: 0.6797
 epoch: 85, train_loss: 0.4288, test_loss: 0.8663, test_f1: 0.6931
 epoch: 86, train_loss: 0.4269, test_loss: 0.8957, test_f1: 0.6808
 epoch: 87, train_loss: 0.4017, test_loss: 0.9631, test_f1: 0.6640
 epoch: 88, train_loss: 0.4533, test_loss: 1.0829, test_f1: 0.6164
 epoch: 89, train_loss: 0.4464, test_loss: 0.9809, test_f1: 0.6762
 epoch: 90, train_loss: 0.4246, test_loss: 0.8471, test_f1: 0.6671
 epoch: 91, train_loss: 0.4297, test_loss: 0.8698, test_f1: 0.6477
 epoch: 92, train_loss: 0.4228, test_loss: 0.8504, test_f1: 0.6481
 epoch: 93, train_loss: 0.4104, test_loss: 0.9446, test_f1: 0.6558
 epoch: 94, train_loss: 0.4415, test_loss: 0.9500, test_f1: 0.6848
 epoch: 95, train_loss: 0.4347, test_loss: 0.9170, test_f1: 0.6644
 epoch: 96, train_loss: 0.4062, test_loss: 0.9363, test_f1: 0.6689
 epoch: 97, train_loss: 0.4123, test_loss: 0.9210, test_f1: 0.6695
 epoch: 98, train_loss: 0.4109, test_loss: 0.9238, test_f1: 0.6709
 epoch: 99, train_loss: 0.3963, test_loss: 0.8213, test_f1: 0.6755
##################ITERATION #8 ****************************************
 epoch: 0, train_loss: 1.1244, test_loss: 1.0955, test_f1: 0.4568
 epoch: 1, train_loss: 0.9714, test_loss: 1.0082, test_f1: 0.5211
 epoch: 2, train_loss: 0.9378, test_loss: 1.1172, test_f1: 0.4871
 epoch: 3, train_loss: 0.9411, test_loss: 0.9876, test_f1: 0.5316
 epoch: 4, train_loss: 0.9219, test_loss: 0.9338, test_f1: 0.5671
 epoch: 5, train_loss: 0.8982, test_loss: 0.9781, test_f1: 0.5879
 epoch: 6, train_loss: 0.8961, test_loss: 1.1563, test_f1: 0.4860
 epoch: 7, train_loss: 0.8912, test_loss: 0.9210, test_f1: 0.5310
 epoch: 8, train_loss: 0.8902, test_loss: 0.9491, test_f1: 0.5474
 epoch: 9, train_loss: 0.8880, test_loss: 0.8822, test_f1: 0.5859
 epoch: 10, train_loss: 0.8493, test_loss: 0.8558, test_f1: 0.6071
 epoch: 11, train_loss: 0.8573, test_loss: 0.9419, test_f1: 0.5571
 epoch: 12, train_loss: 0.8469, test_loss: 0.9260, test_f1: 0.5420
 epoch: 13, train_loss: 0.8361, test_loss: 0.9201, test_f1: 0.5738
 epoch: 14, train_loss: 0.8327, test_loss: 1.0615, test_f1: 0.4999
 epoch: 15, train_loss: 0.8063, test_loss: 1.0012, test_f1: 0.5571
 epoch: 16, train_loss: 0.8318, test_loss: 0.9338, test_f1: 0.5707
 epoch: 17, train_loss: 0.8035, test_loss: 0.8649, test_f1: 0.5820
 epoch: 18, train_loss: 0.8156, test_loss: 1.0136, test_f1: 0.5583
 epoch: 19, train_loss: 0.7859, test_loss: 0.7582, test_f1: 0.6580
 epoch: 20, train_loss: 0.7941, test_loss: 0.9715, test_f1: 0.5844
 epoch: 21, train_loss: 0.7592, test_loss: 0.9161, test_f1: 0.6357
 epoch: 22, train_loss: 0.7605, test_loss: 0.9928, test_f1: 0.5752
 epoch: 23, train_loss: 0.7995, test_loss: 0.8255, test_f1: 0.6274
 epoch: 24, train_loss: 0.7708, test_loss: 0.9608, test_f1: 0.6095
 epoch: 25, train_loss: 0.7483, test_loss: 0.9738, test_f1: 0.6301
 epoch: 26, train_loss: 0.7685, test_loss: 1.0194, test_f1: 0.6032
 epoch: 27, train_loss: 0.7435, test_loss: 0.9563, test_f1: 0.6460
 epoch: 28, train_loss: 0.7423, test_loss: 1.0929, test_f1: 0.5636
 epoch: 29, train_loss: 0.7253, test_loss: 0.8812, test_f1: 0.6520
 epoch: 30, train_loss: 0.7210, test_loss: 1.1029, test_f1: 0.5475
 epoch: 31, train_loss: 0.7298, test_loss: 1.0279, test_f1: 0.6272
 epoch: 32, train_loss: 0.7027, test_loss: 1.2151, test_f1: 0.5851
 epoch: 33, train_loss: 0.7046, test_loss: 1.0336, test_f1: 0.6367
 epoch: 34, train_loss: 0.6903, test_loss: 1.0767, test_f1: 0.6398
 epoch: 35, train_loss: 0.6981, test_loss: 1.0668, test_f1: 0.6338
 epoch: 36, train_loss: 0.8162, test_loss: 0.8710, test_f1: 0.6429
 epoch: 37, train_loss: 0.7243, test_loss: 0.9708, test_f1: 0.5833
 epoch: 38, train_loss: 0.7152, test_loss: 0.9069, test_f1: 0.5764
 epoch: 39, train_loss: 0.7219, test_loss: 0.9339, test_f1: 0.6174
 epoch: 40, train_loss: 0.6801, test_loss: 0.9960, test_f1: 0.6512
 epoch: 41, train_loss: 0.6863, test_loss: 1.1264, test_f1: 0.6179
 epoch: 42, train_loss: 0.6698, test_loss: 1.1298, test_f1: 0.6242
 epoch: 43, train_loss: 0.6580, test_loss: 0.9800, test_f1: 0.5875
 epoch: 44, train_loss: 0.6483, test_loss: 1.2031, test_f1: 0.6095
 epoch: 45, train_loss: 0.6592, test_loss: 0.8308, test_f1: 0.6356
 epoch: 46, train_loss: 0.6485, test_loss: 1.1352, test_f1: 0.6168
 epoch: 47, train_loss: 0.6663, test_loss: 0.8704, test_f1: 0.6467
 epoch: 48, train_loss: 0.6401, test_loss: 1.1521, test_f1: 0.5495
 epoch: 49, train_loss: 0.6469, test_loss: 0.9698, test_f1: 0.6125
 epoch: 50, train_loss: 0.6135, test_loss: 1.3966, test_f1: 0.5870
 epoch: 51, train_loss: 0.5689, test_loss: 0.9981, test_f1: 0.6603
 epoch: 52, train_loss: 0.5621, test_loss: 0.9847, test_f1: 0.6557
 epoch: 53, train_loss: 0.5520, test_loss: 0.9952, test_f1: 0.6696
 epoch: 54, train_loss: 0.5983, test_loss: 1.0508, test_f1: 0.6626
 epoch: 55, train_loss: 0.5614, test_loss: 0.9645, test_f1: 0.6912
 epoch: 56, train_loss: 0.5517, test_loss: 1.0838, test_f1: 0.6500
 epoch: 57, train_loss: 0.5436, test_loss: 1.0361, test_f1: 0.6534
 epoch: 58, train_loss: 0.5174, test_loss: 1.1743, test_f1: 0.6561
 epoch: 59, train_loss: 0.5300, test_loss: 1.1268, test_f1: 0.6534
 epoch: 60, train_loss: 0.5215, test_loss: 1.0587, test_f1: 0.6481
 epoch: 61, train_loss: 0.5255, test_loss: 1.1673, test_f1: 0.6593
 epoch: 62, train_loss: 0.5125, test_loss: 1.0764, test_f1: 0.6628
 epoch: 63, train_loss: 0.5161, test_loss: 1.2312, test_f1: 0.6481
 epoch: 64, train_loss: 0.5014, test_loss: 1.1912, test_f1: 0.6604
 epoch: 65, train_loss: 0.5128, test_loss: 1.2484, test_f1: 0.6505
 epoch: 66, train_loss: 0.5097, test_loss: 1.1946, test_f1: 0.6540
 epoch: 67, train_loss: 0.4966, test_loss: 1.2905, test_f1: 0.6255
 epoch: 68, train_loss: 0.5018, test_loss: 1.1850, test_f1: 0.6512
 epoch: 69, train_loss: 0.5044, test_loss: 1.1329, test_f1: 0.6470
 epoch: 70, train_loss: 0.4962, test_loss: 1.3319, test_f1: 0.6442
 epoch: 71, train_loss: 0.4821, test_loss: 1.1450, test_f1: 0.6547
 epoch: 72, train_loss: 0.4951, test_loss: 1.1160, test_f1: 0.6680
 epoch: 73, train_loss: 0.5059, test_loss: 1.2725, test_f1: 0.6583
 epoch: 74, train_loss: 0.4845, test_loss: 1.2363, test_f1: 0.6544
 epoch: 75, train_loss: 0.4872, test_loss: 1.2498, test_f1: 0.6463
 epoch: 76, train_loss: 0.4832, test_loss: 1.2966, test_f1: 0.6586
 epoch: 77, train_loss: 0.4841, test_loss: 1.2866, test_f1: 0.6843
 epoch: 78, train_loss: 0.4664, test_loss: 1.2858, test_f1: 0.6642
 epoch: 79, train_loss: 0.4631, test_loss: 1.3168, test_f1: 0.6537
 epoch: 80, train_loss: 0.4506, test_loss: 1.4568, test_f1: 0.6687
 epoch: 81, train_loss: 0.4502, test_loss: 1.3870, test_f1: 0.6537
 epoch: 82, train_loss: 0.4435, test_loss: 1.3121, test_f1: 0.6621
 epoch: 83, train_loss: 0.4497, test_loss: 1.4597, test_f1: 0.6813
 epoch: 84, train_loss: 0.4621, test_loss: 1.3353, test_f1: 0.6598
 epoch: 85, train_loss: 0.4419, test_loss: 1.2313, test_f1: 0.6776
 epoch: 86, train_loss: 0.4329, test_loss: 1.4322, test_f1: 0.6373
 epoch: 87, train_loss: 0.4611, test_loss: 1.4801, test_f1: 0.6684
 epoch: 88, train_loss: 0.4301, test_loss: 1.4164, test_f1: 0.6566
 epoch: 89, train_loss: 0.4650, test_loss: 1.3021, test_f1: 0.6228
 epoch: 90, train_loss: 0.4342, test_loss: 1.4056, test_f1: 0.6590
 epoch: 91, train_loss: 0.4543, test_loss: 1.3951, test_f1: 0.6680
 epoch: 92, train_loss: 0.4082, test_loss: 1.3852, test_f1: 0.6192
 epoch: 93, train_loss: 0.4255, test_loss: 1.3564, test_f1: 0.6658
 epoch: 94, train_loss: 0.4221, test_loss: 1.5048, test_f1: 0.6429
 epoch: 95, train_loss: 0.4421, test_loss: 1.4180, test_f1: 0.6429
 epoch: 96, train_loss: 0.4158, test_loss: 1.4533, test_f1: 0.6572
 epoch: 97, train_loss: 0.4206, test_loss: 1.6377, test_f1: 0.6536
 epoch: 98, train_loss: 0.4153, test_loss: 1.3896, test_f1: 0.6485
 epoch: 99, train_loss: 0.4172, test_loss: 1.3123, test_f1: 0.6590
##################ITERATION #9 ****************************************
 epoch: 0, train_loss: 1.1141, test_loss: 1.0727, test_f1: 0.5208
 epoch: 1, train_loss: 0.9649, test_loss: 0.9179, test_f1: 0.5154
 epoch: 2, train_loss: 0.9372, test_loss: 0.9973, test_f1: 0.5029
 epoch: 3, train_loss: 0.9312, test_loss: 0.9248, test_f1: 0.4881
 epoch: 4, train_loss: 0.9181, test_loss: 0.9684, test_f1: 0.5072
 epoch: 5, train_loss: 0.9112, test_loss: 0.9710, test_f1: 0.5780
 epoch: 6, train_loss: 0.8942, test_loss: 0.9456, test_f1: 0.5777
 epoch: 7, train_loss: 0.9167, test_loss: 0.9609, test_f1: 0.5486
 epoch: 8, train_loss: 0.8828, test_loss: 0.9001, test_f1: 0.6033
 epoch: 9, train_loss: 0.8580, test_loss: 0.8601, test_f1: 0.5245
 epoch: 10, train_loss: 0.8738, test_loss: 0.8689, test_f1: 0.5809
 epoch: 11, train_loss: 0.8763, test_loss: 1.0931, test_f1: 0.5806
 epoch: 12, train_loss: 0.8558, test_loss: 0.9186, test_f1: 0.5755
 epoch: 13, train_loss: 0.8491, test_loss: 0.9657, test_f1: 0.6107
 epoch: 14, train_loss: 0.8606, test_loss: 0.8770, test_f1: 0.6269
 epoch: 15, train_loss: 0.8397, test_loss: 0.9075, test_f1: 0.5960
 epoch: 16, train_loss: 0.8220, test_loss: 0.8413, test_f1: 0.5977
 epoch: 17, train_loss: 0.8321, test_loss: 0.8492, test_f1: 0.6268
 epoch: 18, train_loss: 0.7922, test_loss: 0.8614, test_f1: 0.5948
 epoch: 19, train_loss: 0.7908, test_loss: 0.8171, test_f1: 0.5789
 epoch: 20, train_loss: 0.7790, test_loss: 0.8251, test_f1: 0.6365
 epoch: 21, train_loss: 0.7735, test_loss: 0.9312, test_f1: 0.5862
 epoch: 22, train_loss: 0.7924, test_loss: 0.8552, test_f1: 0.5616
 epoch: 23, train_loss: 0.7757, test_loss: 0.9073, test_f1: 0.5674
 epoch: 24, train_loss: 0.9201, test_loss: 0.8839, test_f1: 0.5181
 epoch: 25, train_loss: 0.8820, test_loss: 0.8698, test_f1: 0.5972
 epoch: 26, train_loss: 0.8189, test_loss: 0.9093, test_f1: 0.5928
 epoch: 27, train_loss: 0.8118, test_loss: 0.9271, test_f1: 0.5891
 epoch: 28, train_loss: 0.8311, test_loss: 0.8423, test_f1: 0.6021
 epoch: 29, train_loss: 0.7877, test_loss: 0.8091, test_f1: 0.6264
 epoch: 30, train_loss: 0.8473, test_loss: 0.8083, test_f1: 0.6240
 epoch: 31, train_loss: 0.7761, test_loss: 0.8338, test_f1: 0.6370
 epoch: 32, train_loss: 0.7705, test_loss: 0.8945, test_f1: 0.6412
 epoch: 33, train_loss: 0.7563, test_loss: 0.8333, test_f1: 0.6470
 epoch: 34, train_loss: 0.7412, test_loss: 0.7838, test_f1: 0.6477
 epoch: 35, train_loss: 0.7345, test_loss: 0.8580, test_f1: 0.6201
 epoch: 36, train_loss: 0.7373, test_loss: 0.7849, test_f1: 0.6334
 epoch: 37, train_loss: 0.7054, test_loss: 0.8353, test_f1: 0.6151
 epoch: 38, train_loss: 0.7182, test_loss: 0.8355, test_f1: 0.6464
 epoch: 39, train_loss: 0.6983, test_loss: 0.8049, test_f1: 0.6376
 epoch: 40, train_loss: 0.7017, test_loss: 1.0246, test_f1: 0.6134
 epoch: 41, train_loss: 0.6973, test_loss: 0.7981, test_f1: 0.6688
 epoch: 42, train_loss: 0.7409, test_loss: 1.0051, test_f1: 0.6517
 epoch: 43, train_loss: 0.7076, test_loss: 0.9001, test_f1: 0.6510
 epoch: 44, train_loss: 0.7057, test_loss: 0.9076, test_f1: 0.6573
 epoch: 45, train_loss: 0.6798, test_loss: 1.0609, test_f1: 0.6565
 epoch: 46, train_loss: 0.7054, test_loss: 0.9026, test_f1: 0.6502
 epoch: 47, train_loss: 0.6843, test_loss: 1.0036, test_f1: 0.5898
 epoch: 48, train_loss: 0.6644, test_loss: 0.7275, test_f1: 0.6641
 epoch: 49, train_loss: 0.6724, test_loss: 0.7442, test_f1: 0.6721
 epoch: 50, train_loss: 0.6573, test_loss: 0.7875, test_f1: 0.6505
 epoch: 51, train_loss: 0.6185, test_loss: 0.7931, test_f1: 0.6661
 epoch: 52, train_loss: 0.6017, test_loss: 0.7733, test_f1: 0.6668
 epoch: 53, train_loss: 0.5846, test_loss: 0.8744, test_f1: 0.7031
 epoch: 54, train_loss: 0.5836, test_loss: 0.7781, test_f1: 0.6593
 epoch: 55, train_loss: 0.5840, test_loss: 0.7631, test_f1: 0.6667
 epoch: 56, train_loss: 0.5868, test_loss: 0.8299, test_f1: 0.6838
 epoch: 57, train_loss: 0.5745, test_loss: 0.7813, test_f1: 0.6484
 epoch: 58, train_loss: 0.5563, test_loss: 0.8323, test_f1: 0.6649
 epoch: 59, train_loss: 0.5651, test_loss: 0.7527, test_f1: 0.6736
 epoch: 60, train_loss: 0.5620, test_loss: 0.7682, test_f1: 0.6693
 epoch: 61, train_loss: 0.5421, test_loss: 0.7968, test_f1: 0.6564
 epoch: 62, train_loss: 0.5403, test_loss: 0.8526, test_f1: 0.6787
 epoch: 63, train_loss: 0.5576, test_loss: 0.8378, test_f1: 0.6751
 epoch: 64, train_loss: 0.5421, test_loss: 0.7385, test_f1: 0.6953
 epoch: 65, train_loss: 0.5371, test_loss: 0.8143, test_f1: 0.6608
 epoch: 66, train_loss: 0.5296, test_loss: 0.8868, test_f1: 0.6787
 epoch: 67, train_loss: 0.5422, test_loss: 0.8039, test_f1: 0.6381
 epoch: 68, train_loss: 0.5318, test_loss: 0.9098, test_f1: 0.6756
 epoch: 69, train_loss: 0.5470, test_loss: 0.7370, test_f1: 0.6654
 epoch: 70, train_loss: 0.5412, test_loss: 0.8662, test_f1: 0.6467
 epoch: 71, train_loss: 0.5346, test_loss: 0.8360, test_f1: 0.6969
 epoch: 72, train_loss: 0.5210, test_loss: 0.7958, test_f1: 0.6744
 epoch: 73, train_loss: 0.4987, test_loss: 0.7756, test_f1: 0.6848
 epoch: 74, train_loss: 0.5121, test_loss: 0.7905, test_f1: 0.6726
 epoch: 75, train_loss: 0.5041, test_loss: 0.8835, test_f1: 0.6543
 epoch: 76, train_loss: 0.4936, test_loss: 0.7917, test_f1: 0.6624
 epoch: 77, train_loss: 0.4984, test_loss: 0.7740, test_f1: 0.6721
 epoch: 78, train_loss: 0.4822, test_loss: 0.7819, test_f1: 0.6506
 epoch: 79, train_loss: 0.5075, test_loss: 0.8220, test_f1: 0.6343
 epoch: 80, train_loss: 0.5047, test_loss: 0.7479, test_f1: 0.6661
 epoch: 81, train_loss: 0.5141, test_loss: 0.9614, test_f1: 0.6558
 epoch: 82, train_loss: 0.4937, test_loss: 0.7583, test_f1: 0.6686
 epoch: 83, train_loss: 0.4854, test_loss: 0.8612, test_f1: 0.6637
 epoch: 84, train_loss: 0.5150, test_loss: 0.7216, test_f1: 0.6848
 epoch: 85, train_loss: 0.4777, test_loss: 0.8059, test_f1: 0.7050
 epoch: 86, train_loss: 0.5115, test_loss: 1.0160, test_f1: 0.6852
 epoch: 87, train_loss: 0.4969, test_loss: 0.8320, test_f1: 0.6766
 epoch: 88, train_loss: 0.4655, test_loss: 0.8602, test_f1: 0.6632
 epoch: 89, train_loss: 0.4580, test_loss: 0.8887, test_f1: 0.6759
 epoch: 90, train_loss: 0.4520, test_loss: 0.7943, test_f1: 0.6726
 epoch: 91, train_loss: 0.4530, test_loss: 0.7966, test_f1: 0.6810
 epoch: 92, train_loss: 0.4456, test_loss: 0.8375, test_f1: 0.6704
 epoch: 93, train_loss: 0.4365, test_loss: 0.7963, test_f1: 0.6801
 epoch: 94, train_loss: 0.4681, test_loss: 0.7654, test_f1: 0.6912
 epoch: 95, train_loss: 0.4610, test_loss: 0.7540, test_f1: 0.7152
 epoch: 96, train_loss: 0.4352, test_loss: 0.7485, test_f1: 0.6827
 epoch: 97, train_loss: 0.4684, test_loss: 0.8415, test_f1: 0.6921
 epoch: 98, train_loss: 0.4690, test_loss: 0.8397, test_f1: 0.6741
 epoch: 99, train_loss: 0.4650, test_loss: 0.8063, test_f1: 0.6969

Training completed in 829.64 seconds
Best F1: 0.7162 at epoch 52
Mean F1 across iterations: 0.6992  0.0116
========================FINAL RESULTS================================
FEGIN weighted F1: 0.7162  0.0116
python main.py --data ltspice_examples --representation component_pin_net --model FEGIN --layers 2 --hiddens 128 --batch_size 32 --lr 0.01 --emb_size 128 --epochs 100 --save_appendix component_pin_net_L2_H128_BS32_LR0.01_E128 --no_val
-----



STDERR:
  File "main.py", line 370, in <module>
    main()
  File "main.py", line 254, in main
    dataset = dataset_class(
  File "/home/philip/projects/ltspice_examples_code_repo/Circuit-Completion-Using-GNNs/component_classification_with_link_prediction_head/evaluation/FEGIN/kernel/circuit_datasets.py", line 15, in __init__
    self.data, self.slices = torch.load(self.processed_paths[0])
  File "/home/philip/.local/lib/python3.8/site-packages/torch/serialization.py", line 1040, in load
    warnings.warn(
  File "/usr/lib/python3.8/warnings.py", line 109, in _showwarnmsg
    sw(msg.message, msg.category, msg.filename, msg.lineno,
  File "main.py", line 47, in warn_with_traceback
    traceback.print_stack(file=log)
/home/philip/projects/ltspice_examples_code_repo/Circuit-Completion-Using-GNNs/component_classification_with_link_prediction_head/evaluation/FEGIN/kernel/circuit_datasets.py:15: FutureWarning: You are using `torch.load` with `weights_only=False` (the current default value), which uses the default pickle module implicitly. It is possible to construct malicious pickle data which will execute arbitrary code during unpickling (See https://github.com/pytorch/pytorch/blob/main/SECURITY.md#untrusted-models for more details). In a future release, the default value for `weights_only` will be flipped to `True`. This limits the functions that could be executed during unpickling. Arbitrary objects will no longer be allowed to be loaded via this mode unless they are explicitly allowlisted by the user via `torch.serialization.add_safe_globals`. We recommend you start setting `weights_only=True` for any use case where you don't have full control of the loaded file. Please open an issue on GitHub for any issues related to this experimental feature.
  self.data, self.slices = torch.load(self.processed_paths[0])
