STDOUT:
Results will be saved in /home/philip/projects/ltspice_examples_code_repo/Circuit-Completion-Using-GNNs/component_classification_with_link_prediction_head/evaluation/FEGIN/results/model_FEGIN_dataset_ltspice_examples
Command line input: python main.py --data ltspice_examples --representation component_pin_net --model FEGIN --layers 5 --hiddens 128 --batch_size 256 --lr 0.01 --emb_size 512 --epochs 100 --save_appendix component_pin_net_L5_H128_BS256_LR0.01_E512 --no_val
 is saved.
-----
ltspice_examples - FEGIN
Using 5 layers, 128 hidden units, h = 2
Loading component_pin_net representation dataset
Loading component_pin_net representation data...
Loaded 4404 examples (component_pin_net)
saving path: data/processed/ltspice_examples_component_pin_net_processed.pt
ENTERED
Training FEGIN on component_pin_net representation
Train: 3558, Test: 846
##################ITERATION #0 ****************************************
 epoch: 0, train_loss: 1.1809, test_loss: 1.2447, test_f1: 0.2486
 epoch: 1, train_loss: 1.0461, test_loss: 1.0169, test_f1: 0.4694
 epoch: 2, train_loss: 0.9894, test_loss: 1.0152, test_f1: 0.4181
 epoch: 3, train_loss: 0.9485, test_loss: 0.9444, test_f1: 0.4797
 epoch: 4, train_loss: 0.9310, test_loss: 0.9095, test_f1: 0.4987
 epoch: 5, train_loss: 0.9030, test_loss: 0.9624, test_f1: 0.5123
 epoch: 6, train_loss: 0.8871, test_loss: 0.9707, test_f1: 0.4991
 epoch: 7, train_loss: 0.8561, test_loss: 0.9192, test_f1: 0.4966
 epoch: 8, train_loss: 0.8434, test_loss: 1.0398, test_f1: 0.5357
 epoch: 9, train_loss: 0.8082, test_loss: 0.9584, test_f1: 0.5075
 epoch: 10, train_loss: 0.8087, test_loss: 0.8668, test_f1: 0.5427
 epoch: 11, train_loss: 0.7894, test_loss: 1.0187, test_f1: 0.5499
 epoch: 12, train_loss: 0.7467, test_loss: 0.8083, test_f1: 0.6052
 epoch: 13, train_loss: 0.7462, test_loss: 0.8756, test_f1: 0.5270
 epoch: 14, train_loss: 0.7430, test_loss: 1.5190, test_f1: 0.4976
 epoch: 15, train_loss: 0.7311, test_loss: 0.9100, test_f1: 0.5714
 epoch: 16, train_loss: 0.7128, test_loss: 0.9212, test_f1: 0.6339
 epoch: 17, train_loss: 0.7120, test_loss: 1.1100, test_f1: 0.5705
 epoch: 18, train_loss: 0.6953, test_loss: 1.0122, test_f1: 0.5826
 epoch: 19, train_loss: 0.6815, test_loss: 0.9038, test_f1: 0.5722
 epoch: 20, train_loss: 0.6724, test_loss: 0.8091, test_f1: 0.6358
 epoch: 21, train_loss: 0.6347, test_loss: 0.9055, test_f1: 0.5286
 epoch: 22, train_loss: 0.6283, test_loss: 0.8130, test_f1: 0.6271
 epoch: 23, train_loss: 0.6141, test_loss: 0.9410, test_f1: 0.6538
 epoch: 24, train_loss: 0.6434, test_loss: 1.2428, test_f1: 0.5402
 epoch: 25, train_loss: 0.5966, test_loss: 0.8634, test_f1: 0.6404
 epoch: 26, train_loss: 0.5968, test_loss: 1.1644, test_f1: 0.5368
 epoch: 27, train_loss: 0.5796, test_loss: 1.1702, test_f1: 0.5209
 epoch: 28, train_loss: 0.5577, test_loss: 0.8005, test_f1: 0.6638
 epoch: 29, train_loss: 0.5598, test_loss: 1.0231, test_f1: 0.5968
 epoch: 30, train_loss: 0.5615, test_loss: 1.6936, test_f1: 0.4994
 epoch: 31, train_loss: 0.5544, test_loss: 0.9832, test_f1: 0.6249
 epoch: 32, train_loss: 0.5520, test_loss: 1.0201, test_f1: 0.6102
 epoch: 33, train_loss: 0.5401, test_loss: 0.9717, test_f1: 0.5762
 epoch: 34, train_loss: 0.5204, test_loss: 0.8911, test_f1: 0.6440
 epoch: 35, train_loss: 0.5283, test_loss: 1.3506, test_f1: 0.5931
 epoch: 36, train_loss: 0.4955, test_loss: 1.0501, test_f1: 0.6543
 epoch: 37, train_loss: 0.4919, test_loss: 1.6188, test_f1: 0.4884
 epoch: 38, train_loss: 0.5077, test_loss: 1.1272, test_f1: 0.5853
 epoch: 39, train_loss: 0.4824, test_loss: 1.0022, test_f1: 0.5972
 epoch: 40, train_loss: 0.4852, test_loss: 1.2344, test_f1: 0.6152
 epoch: 41, train_loss: 0.4518, test_loss: 1.1704, test_f1: 0.6427
 epoch: 42, train_loss: 0.4481, test_loss: 1.2394, test_f1: 0.6507
 epoch: 43, train_loss: 0.4228, test_loss: 1.4316, test_f1: 0.6196
 epoch: 44, train_loss: 0.4310, test_loss: 1.2904, test_f1: 0.6282
 epoch: 45, train_loss: 0.4289, test_loss: 1.2564, test_f1: 0.6459
 epoch: 46, train_loss: 0.4300, test_loss: 1.7732, test_f1: 0.5933
 epoch: 47, train_loss: 0.4315, test_loss: 1.7131, test_f1: 0.6208
 epoch: 48, train_loss: 0.4430, test_loss: 1.2915, test_f1: 0.6108
 epoch: 49, train_loss: 0.3982, test_loss: 1.4199, test_f1: 0.5997
 epoch: 50, train_loss: 0.3964, test_loss: 1.2976, test_f1: 0.6635
 epoch: 51, train_loss: 0.3475, test_loss: 1.3158, test_f1: 0.6758
 epoch: 52, train_loss: 0.3210, test_loss: 1.2948, test_f1: 0.6901
 epoch: 53, train_loss: 0.3007, test_loss: 1.3496, test_f1: 0.6852
 epoch: 54, train_loss: 0.2885, test_loss: 1.3789, test_f1: 0.6668
 epoch: 55, train_loss: 0.2989, test_loss: 1.3604, test_f1: 0.6720
 epoch: 56, train_loss: 0.2740, test_loss: 1.4408, test_f1: 0.6488
 epoch: 57, train_loss: 0.2606, test_loss: 1.4061, test_f1: 0.6637
 epoch: 58, train_loss: 0.2559, test_loss: 1.3978, test_f1: 0.6664
 epoch: 59, train_loss: 0.2438, test_loss: 1.5286, test_f1: 0.6867
 epoch: 60, train_loss: 0.2645, test_loss: 1.5225, test_f1: 0.6690
 epoch: 61, train_loss: 0.2568, test_loss: 1.6177, test_f1: 0.6472
 epoch: 62, train_loss: 0.2668, test_loss: 1.6039, test_f1: 0.6441
 epoch: 63, train_loss: 0.2475, test_loss: 1.5966, test_f1: 0.6376
 epoch: 64, train_loss: 0.2478, test_loss: 1.4576, test_f1: 0.6531
 epoch: 65, train_loss: 0.2417, test_loss: 1.5898, test_f1: 0.6557
 epoch: 66, train_loss: 0.2222, test_loss: 1.5289, test_f1: 0.6844
 epoch: 67, train_loss: 0.2280, test_loss: 1.6814, test_f1: 0.6542
 epoch: 68, train_loss: 0.2114, test_loss: 1.6908, test_f1: 0.6637
 epoch: 69, train_loss: 0.2227, test_loss: 1.6727, test_f1: 0.6956
 epoch: 70, train_loss: 0.2259, test_loss: 1.4975, test_f1: 0.6952
 epoch: 71, train_loss: 0.2187, test_loss: 1.5410, test_f1: 0.6665
 epoch: 72, train_loss: 0.2162, test_loss: 1.6945, test_f1: 0.6829
 epoch: 73, train_loss: 0.2090, test_loss: 1.6780, test_f1: 0.6997
 epoch: 74, train_loss: 0.1864, test_loss: 1.8223, test_f1: 0.6535
 epoch: 75, train_loss: 0.1832, test_loss: 2.1286, test_f1: 0.6401
 epoch: 76, train_loss: 0.1876, test_loss: 1.9190, test_f1: 0.6469
 epoch: 77, train_loss: 0.2077, test_loss: 1.6582, test_f1: 0.6662
 epoch: 78, train_loss: 0.1964, test_loss: 1.8853, test_f1: 0.6634
 epoch: 79, train_loss: 0.1848, test_loss: 1.8344, test_f1: 0.6693
 epoch: 80, train_loss: 0.1898, test_loss: 1.7910, test_f1: 0.6690
 epoch: 81, train_loss: 0.1960, test_loss: 1.7903, test_f1: 0.6685
 epoch: 82, train_loss: 0.1858, test_loss: 1.8225, test_f1: 0.6818
 epoch: 83, train_loss: 0.1763, test_loss: 1.7376, test_f1: 0.6677
 epoch: 84, train_loss: 0.2011, test_loss: 1.8358, test_f1: 0.6802
 epoch: 85, train_loss: 0.1896, test_loss: 2.0205, test_f1: 0.6326
 epoch: 86, train_loss: 0.1933, test_loss: 2.0439, test_f1: 0.6760
 epoch: 87, train_loss: 0.1827, test_loss: 1.9836, test_f1: 0.6704
 epoch: 88, train_loss: 0.1712, test_loss: 1.7224, test_f1: 0.6600
 epoch: 89, train_loss: 0.1727, test_loss: 1.9495, test_f1: 0.6502
 epoch: 90, train_loss: 0.1655, test_loss: 1.9662, test_f1: 0.6670
 epoch: 91, train_loss: 0.1532, test_loss: 2.0971, test_f1: 0.6308
 epoch: 92, train_loss: 0.1681, test_loss: 2.0787, test_f1: 0.6325
 epoch: 93, train_loss: 0.1788, test_loss: 1.8931, test_f1: 0.6621
 epoch: 94, train_loss: 0.1838, test_loss: 1.9053, test_f1: 0.6769
 epoch: 95, train_loss: 0.1790, test_loss: 1.7777, test_f1: 0.6572
 epoch: 96, train_loss: 0.1765, test_loss: 1.9389, test_f1: 0.6369
 epoch: 97, train_loss: 0.1795, test_loss: 2.0440, test_f1: 0.6753
 epoch: 98, train_loss: 0.1685, test_loss: 1.7425, test_f1: 0.6653
 epoch: 99, train_loss: 0.1640, test_loss: 1.7946, test_f1: 0.6654
##################ITERATION #1 ****************************************
 epoch: 0, train_loss: 1.2920, test_loss: 1.6617, test_f1: 0.2574
 epoch: 1, train_loss: 1.0143, test_loss: 1.1420, test_f1: 0.3158
 epoch: 2, train_loss: 0.9637, test_loss: 1.0365, test_f1: 0.4746
 epoch: 3, train_loss: 0.9466, test_loss: 0.9559, test_f1: 0.4681
 epoch: 4, train_loss: 0.9245, test_loss: 1.0217, test_f1: 0.4554
 epoch: 5, train_loss: 0.9132, test_loss: 0.9474, test_f1: 0.5113
 epoch: 6, train_loss: 0.8867, test_loss: 0.9585, test_f1: 0.4787
 epoch: 7, train_loss: 0.8691, test_loss: 0.9641, test_f1: 0.5119
 epoch: 8, train_loss: 0.8629, test_loss: 0.9363, test_f1: 0.4939
 epoch: 9, train_loss: 0.8434, test_loss: 1.0440, test_f1: 0.5253
 epoch: 10, train_loss: 0.8139, test_loss: 1.0154, test_f1: 0.4628
 epoch: 11, train_loss: 0.8091, test_loss: 0.8640, test_f1: 0.5745
 epoch: 12, train_loss: 0.7836, test_loss: 1.0033, test_f1: 0.5495
 epoch: 13, train_loss: 0.7542, test_loss: 1.0406, test_f1: 0.5291
 epoch: 14, train_loss: 0.7426, test_loss: 1.3214, test_f1: 0.4271
 epoch: 15, train_loss: 0.7102, test_loss: 0.8127, test_f1: 0.5766
 epoch: 16, train_loss: 0.6963, test_loss: 0.9304, test_f1: 0.5694
 epoch: 17, train_loss: 0.6900, test_loss: 0.9365, test_f1: 0.5972
 epoch: 18, train_loss: 0.6978, test_loss: 1.0877, test_f1: 0.5800
 epoch: 19, train_loss: 0.6706, test_loss: 0.8990, test_f1: 0.6014
 epoch: 20, train_loss: 0.6589, test_loss: 0.8260, test_f1: 0.6400
 epoch: 21, train_loss: 0.6453, test_loss: 0.7925, test_f1: 0.6273
 epoch: 22, train_loss: 0.6346, test_loss: 0.9601, test_f1: 0.6112
 epoch: 23, train_loss: 0.6522, test_loss: 1.7516, test_f1: 0.4395
 epoch: 24, train_loss: 0.6356, test_loss: 0.8246, test_f1: 0.6040
 epoch: 25, train_loss: 0.6454, test_loss: 0.8183, test_f1: 0.6209
 epoch: 26, train_loss: 0.5977, test_loss: 1.3117, test_f1: 0.5315
 epoch: 27, train_loss: 0.6052, test_loss: 0.8838, test_f1: 0.6306
 epoch: 28, train_loss: 0.6209, test_loss: 0.7085, test_f1: 0.6581
 epoch: 29, train_loss: 0.5822, test_loss: 0.9477, test_f1: 0.6313
 epoch: 30, train_loss: 0.5798, test_loss: 1.2600, test_f1: 0.5159
 epoch: 31, train_loss: 0.5643, test_loss: 0.9013, test_f1: 0.6315
 epoch: 32, train_loss: 0.5632, test_loss: 1.0219, test_f1: 0.6131
 epoch: 33, train_loss: 0.5647, test_loss: 0.9234, test_f1: 0.6172
 epoch: 34, train_loss: 0.5605, test_loss: 0.8985, test_f1: 0.6024
 epoch: 35, train_loss: 0.5374, test_loss: 0.9230, test_f1: 0.6294
 epoch: 36, train_loss: 0.5824, test_loss: 0.8766, test_f1: 0.6140
 epoch: 37, train_loss: 0.5345, test_loss: 0.8944, test_f1: 0.6671
 epoch: 38, train_loss: 0.5111, test_loss: 0.9454, test_f1: 0.6542
 epoch: 39, train_loss: 0.5324, test_loss: 0.9236, test_f1: 0.6577
 epoch: 40, train_loss: 0.5240, test_loss: 0.9910, test_f1: 0.6657
 epoch: 41, train_loss: 0.5134, test_loss: 0.8919, test_f1: 0.6176
 epoch: 42, train_loss: 0.4830, test_loss: 0.8793, test_f1: 0.6622
 epoch: 43, train_loss: 0.4710, test_loss: 0.9350, test_f1: 0.6110
 epoch: 44, train_loss: 0.4569, test_loss: 1.0207, test_f1: 0.6652
 epoch: 45, train_loss: 0.4478, test_loss: 1.1511, test_f1: 0.5917
 epoch: 46, train_loss: 0.4728, test_loss: 1.1674, test_f1: 0.6105
 epoch: 47, train_loss: 0.4756, test_loss: 1.2011, test_f1: 0.5997
 epoch: 48, train_loss: 0.4503, test_loss: 1.1311, test_f1: 0.5726
 epoch: 49, train_loss: 0.4623, test_loss: 0.8334, test_f1: 0.6693
 epoch: 50, train_loss: 0.4538, test_loss: 1.0769, test_f1: 0.6179
 epoch: 51, train_loss: 0.4002, test_loss: 0.9183, test_f1: 0.6564
 epoch: 52, train_loss: 0.3620, test_loss: 0.9108, test_f1: 0.7053
 epoch: 53, train_loss: 0.3349, test_loss: 0.9525, test_f1: 0.6500
 epoch: 54, train_loss: 0.3324, test_loss: 0.9505, test_f1: 0.7056
 epoch: 55, train_loss: 0.3032, test_loss: 1.0227, test_f1: 0.6794
 epoch: 56, train_loss: 0.3134, test_loss: 1.0189, test_f1: 0.6751
 epoch: 57, train_loss: 0.3089, test_loss: 1.1935, test_f1: 0.6478
 epoch: 58, train_loss: 0.2962, test_loss: 0.9581, test_f1: 0.6721
 epoch: 59, train_loss: 0.2911, test_loss: 1.1783, test_f1: 0.6842
 epoch: 60, train_loss: 0.2860, test_loss: 1.0929, test_f1: 0.6698
 epoch: 61, train_loss: 0.3083, test_loss: 1.1251, test_f1: 0.6699
 epoch: 62, train_loss: 0.2933, test_loss: 1.0518, test_f1: 0.6875
 epoch: 63, train_loss: 0.2905, test_loss: 1.2465, test_f1: 0.6580
 epoch: 64, train_loss: 0.2855, test_loss: 1.2058, test_f1: 0.6470
 epoch: 65, train_loss: 0.2641, test_loss: 1.2428, test_f1: 0.6615
 epoch: 66, train_loss: 0.2645, test_loss: 1.2535, test_f1: 0.6304
 epoch: 67, train_loss: 0.2531, test_loss: 1.2812, test_f1: 0.6635
 epoch: 68, train_loss: 0.2901, test_loss: 1.1338, test_f1: 0.6793
 epoch: 69, train_loss: 0.2671, test_loss: 1.2668, test_f1: 0.6517
 epoch: 70, train_loss: 0.2522, test_loss: 1.2107, test_f1: 0.6750
 epoch: 71, train_loss: 0.2488, test_loss: 1.2091, test_f1: 0.6491
 epoch: 72, train_loss: 0.2468, test_loss: 1.3017, test_f1: 0.6590
 epoch: 73, train_loss: 0.2673, test_loss: 1.3471, test_f1: 0.6505
 epoch: 74, train_loss: 0.2750, test_loss: 1.4274, test_f1: 0.6266
 epoch: 75, train_loss: 0.2521, test_loss: 1.2873, test_f1: 0.6605
 epoch: 76, train_loss: 0.2436, test_loss: 1.3534, test_f1: 0.6447
 epoch: 77, train_loss: 0.2387, test_loss: 1.3381, test_f1: 0.6467
 epoch: 78, train_loss: 0.2225, test_loss: 1.3324, test_f1: 0.6364
 epoch: 79, train_loss: 0.2422, test_loss: 1.5870, test_f1: 0.6640
 epoch: 80, train_loss: 0.2368, test_loss: 1.4171, test_f1: 0.6753
 epoch: 81, train_loss: 0.2284, test_loss: 1.4764, test_f1: 0.6345
 epoch: 82, train_loss: 0.2137, test_loss: 1.2778, test_f1: 0.6648
 epoch: 83, train_loss: 0.2167, test_loss: 1.4466, test_f1: 0.6662
 epoch: 84, train_loss: 0.2185, test_loss: 1.4750, test_f1: 0.6665
 epoch: 85, train_loss: 0.2035, test_loss: 1.3855, test_f1: 0.6654
 epoch: 86, train_loss: 0.2186, test_loss: 1.3930, test_f1: 0.6628
 epoch: 87, train_loss: 0.2310, test_loss: 1.4429, test_f1: 0.6450
 epoch: 88, train_loss: 0.2373, test_loss: 1.4445, test_f1: 0.6365
 epoch: 89, train_loss: 0.2114, test_loss: 1.5808, test_f1: 0.6653
 epoch: 90, train_loss: 0.2125, test_loss: 1.4843, test_f1: 0.6868
 epoch: 91, train_loss: 0.2202, test_loss: 1.5345, test_f1: 0.6697
 epoch: 92, train_loss: 0.2118, test_loss: 1.3437, test_f1: 0.6606
 epoch: 93, train_loss: 0.1906, test_loss: 1.5066, test_f1: 0.6838
 epoch: 94, train_loss: 0.1873, test_loss: 1.6279, test_f1: 0.6454
 epoch: 95, train_loss: 0.1960, test_loss: 1.4155, test_f1: 0.6448
 epoch: 96, train_loss: 0.1995, test_loss: 1.5061, test_f1: 0.6597
 epoch: 97, train_loss: 0.1731, test_loss: 1.3681, test_f1: 0.6610
 epoch: 98, train_loss: 0.2037, test_loss: 1.5249, test_f1: 0.6381
 epoch: 99, train_loss: 0.1875, test_loss: 1.4860, test_f1: 0.6525
##################ITERATION #2 ****************************************
 epoch: 0, train_loss: 1.3784, test_loss: 2.4859, test_f1: 0.1843
 epoch: 1, train_loss: 1.0351, test_loss: 1.5323, test_f1: 0.2275
 epoch: 2, train_loss: 0.9807, test_loss: 1.0088, test_f1: 0.4830
 epoch: 3, train_loss: 0.9504, test_loss: 1.0642, test_f1: 0.4674
 epoch: 4, train_loss: 0.9433, test_loss: 0.9209, test_f1: 0.4826
 epoch: 5, train_loss: 0.9252, test_loss: 1.0644, test_f1: 0.5110
 epoch: 6, train_loss: 0.9194, test_loss: 1.0075, test_f1: 0.4719
 epoch: 7, train_loss: 0.8930, test_loss: 0.9887, test_f1: 0.5344
 epoch: 8, train_loss: 0.8693, test_loss: 0.9797, test_f1: 0.5184
 epoch: 9, train_loss: 0.8419, test_loss: 0.9631, test_f1: 0.5136
 epoch: 10, train_loss: 0.8318, test_loss: 1.0723, test_f1: 0.5150
 epoch: 11, train_loss: 0.8010, test_loss: 0.9697, test_f1: 0.5506
 epoch: 12, train_loss: 0.8006, test_loss: 0.9418, test_f1: 0.5612
 epoch: 13, train_loss: 0.7979, test_loss: 1.0159, test_f1: 0.5489
 epoch: 14, train_loss: 0.7895, test_loss: 0.9636, test_f1: 0.5628
 epoch: 15, train_loss: 0.7704, test_loss: 0.9403, test_f1: 0.5808
 epoch: 16, train_loss: 0.7608, test_loss: 0.9362, test_f1: 0.6021
 epoch: 17, train_loss: 0.7213, test_loss: 0.9045, test_f1: 0.5610
 epoch: 18, train_loss: 0.7286, test_loss: 1.0348, test_f1: 0.5484
 epoch: 19, train_loss: 0.7104, test_loss: 0.8765, test_f1: 0.5963
 epoch: 20, train_loss: 0.6938, test_loss: 1.1270, test_f1: 0.5139
 epoch: 21, train_loss: 0.7165, test_loss: 0.8809, test_f1: 0.5945
 epoch: 22, train_loss: 0.7076, test_loss: 1.0691, test_f1: 0.5670
 epoch: 23, train_loss: 0.6793, test_loss: 0.9423, test_f1: 0.5867
 epoch: 24, train_loss: 0.6910, test_loss: 0.9835, test_f1: 0.6473
 epoch: 25, train_loss: 0.6738, test_loss: 1.2548, test_f1: 0.5510
 epoch: 26, train_loss: 0.6472, test_loss: 0.9992, test_f1: 0.6325
 epoch: 27, train_loss: 0.6500, test_loss: 1.3205, test_f1: 0.5190
 epoch: 28, train_loss: 0.6800, test_loss: 0.9425, test_f1: 0.6064
 epoch: 29, train_loss: 0.6626, test_loss: 1.0520, test_f1: 0.5823
 epoch: 30, train_loss: 0.6556, test_loss: 0.8675, test_f1: 0.6164
 epoch: 31, train_loss: 0.6090, test_loss: 1.1009, test_f1: 0.5909
 epoch: 32, train_loss: 0.6324, test_loss: 0.9953, test_f1: 0.6205
 epoch: 33, train_loss: 0.6368, test_loss: 0.9411, test_f1: 0.6011
 epoch: 34, train_loss: 0.5924, test_loss: 1.0888, test_f1: 0.6497
 epoch: 35, train_loss: 0.6115, test_loss: 1.3291, test_f1: 0.5705
 epoch: 36, train_loss: 0.6028, test_loss: 1.0610, test_f1: 0.6001
 epoch: 37, train_loss: 0.5947, test_loss: 1.0973, test_f1: 0.6022
 epoch: 38, train_loss: 0.5709, test_loss: 1.0668, test_f1: 0.6217
 epoch: 39, train_loss: 0.5715, test_loss: 1.0048, test_f1: 0.6244
 epoch: 40, train_loss: 0.5620, test_loss: 1.1449, test_f1: 0.6075
 epoch: 41, train_loss: 0.5827, test_loss: 1.1030, test_f1: 0.6460
 epoch: 42, train_loss: 0.5626, test_loss: 1.2019, test_f1: 0.6378
 epoch: 43, train_loss: 0.5519, test_loss: 2.0510, test_f1: 0.4908
 epoch: 44, train_loss: 0.5117, test_loss: 1.1813, test_f1: 0.6569
 epoch: 45, train_loss: 0.5196, test_loss: 1.2188, test_f1: 0.6185
 epoch: 46, train_loss: 0.5456, test_loss: 1.2375, test_f1: 0.5935
 epoch: 47, train_loss: 0.5213, test_loss: 1.1906, test_f1: 0.6216
 epoch: 48, train_loss: 0.5353, test_loss: 3.3416, test_f1: 0.6219
 epoch: 49, train_loss: 0.5364, test_loss: 1.1991, test_f1: 0.6393
 epoch: 50, train_loss: 0.5340, test_loss: 1.2700, test_f1: 0.6411
 epoch: 51, train_loss: 0.4781, test_loss: 1.1756, test_f1: 0.6671
 epoch: 52, train_loss: 0.4426, test_loss: 1.2482, test_f1: 0.6544
 epoch: 53, train_loss: 0.4276, test_loss: 1.3116, test_f1: 0.6575
 epoch: 54, train_loss: 0.3983, test_loss: 1.2261, test_f1: 0.6677
 epoch: 55, train_loss: 0.3876, test_loss: 1.3974, test_f1: 0.6262
 epoch: 56, train_loss: 0.3938, test_loss: 1.2125, test_f1: 0.6572
 epoch: 57, train_loss: 0.4042, test_loss: 1.3501, test_f1: 0.6554
 epoch: 58, train_loss: 0.3845, test_loss: 1.4250, test_f1: 0.6551
 epoch: 59, train_loss: 0.3696, test_loss: 1.3551, test_f1: 0.6267
 epoch: 60, train_loss: 0.3587, test_loss: 1.3042, test_f1: 0.6518
 epoch: 61, train_loss: 0.3587, test_loss: 1.3115, test_f1: 0.6507
 epoch: 62, train_loss: 0.3658, test_loss: 1.2821, test_f1: 0.6692
 epoch: 63, train_loss: 0.3424, test_loss: 1.3714, test_f1: 0.6570
 epoch: 64, train_loss: 0.3689, test_loss: 1.4813, test_f1: 0.6445
 epoch: 65, train_loss: 0.3534, test_loss: 1.4590, test_f1: 0.6347
 epoch: 66, train_loss: 0.3452, test_loss: 1.4227, test_f1: 0.6576
 epoch: 67, train_loss: 0.3354, test_loss: 1.5163, test_f1: 0.6443
 epoch: 68, train_loss: 0.3115, test_loss: 1.4484, test_f1: 0.6525
 epoch: 69, train_loss: 0.3290, test_loss: 1.5109, test_f1: 0.6374
 epoch: 70, train_loss: 0.3214, test_loss: 1.4810, test_f1: 0.6624
 epoch: 71, train_loss: 0.3266, test_loss: 1.5074, test_f1: 0.6884
 epoch: 72, train_loss: 0.3385, test_loss: 1.5719, test_f1: 0.6474
 epoch: 73, train_loss: 0.3462, test_loss: 1.3184, test_f1: 0.6543
 epoch: 74, train_loss: 0.3288, test_loss: 1.5182, test_f1: 0.6611
 epoch: 75, train_loss: 0.3286, test_loss: 1.4762, test_f1: 0.6545
 epoch: 76, train_loss: 0.3045, test_loss: 1.3023, test_f1: 0.6886
 epoch: 77, train_loss: 0.3070, test_loss: 1.4666, test_f1: 0.6717
 epoch: 78, train_loss: 0.3074, test_loss: 1.4709, test_f1: 0.6463
 epoch: 79, train_loss: 0.3055, test_loss: 1.6254, test_f1: 0.6309
 epoch: 80, train_loss: 0.2799, test_loss: 1.5402, test_f1: 0.6510
 epoch: 81, train_loss: 0.2793, test_loss: 1.7468, test_f1: 0.6706
 epoch: 82, train_loss: 0.2780, test_loss: 1.6042, test_f1: 0.6691
 epoch: 83, train_loss: 0.2959, test_loss: 1.4856, test_f1: 0.6588
 epoch: 84, train_loss: 0.2962, test_loss: 1.5867, test_f1: 0.6303
 epoch: 85, train_loss: 0.3069, test_loss: 1.6729, test_f1: 0.6703
 epoch: 86, train_loss: 0.2758, test_loss: 1.7683, test_f1: 0.6434
 epoch: 87, train_loss: 0.2634, test_loss: 1.9425, test_f1: 0.6741
 epoch: 88, train_loss: 0.3062, test_loss: 1.6270, test_f1: 0.6437
 epoch: 89, train_loss: 0.2707, test_loss: 1.4583, test_f1: 0.6685
 epoch: 90, train_loss: 0.2556, test_loss: 1.5850, test_f1: 0.6442
 epoch: 91, train_loss: 0.2749, test_loss: 1.8751, test_f1: 0.6425
 epoch: 92, train_loss: 0.2556, test_loss: 1.7952, test_f1: 0.6633
 epoch: 93, train_loss: 0.2765, test_loss: 1.8101, test_f1: 0.6358
 epoch: 94, train_loss: 0.2732, test_loss: 1.7465, test_f1: 0.6564
 epoch: 95, train_loss: 0.2743, test_loss: 1.7608, test_f1: 0.6685
 epoch: 96, train_loss: 0.2589, test_loss: 1.5997, test_f1: 0.6605
 epoch: 97, train_loss: 0.2391, test_loss: 1.7527, test_f1: 0.6526
 epoch: 98, train_loss: 0.2547, test_loss: 1.6425, test_f1: 0.6602
 epoch: 99, train_loss: 0.2545, test_loss: 1.5838, test_f1: 0.6867
##################ITERATION #3 ****************************************
 epoch: 0, train_loss: 1.4782, test_loss: 1.3266, test_f1: 0.2745
 epoch: 1, train_loss: 1.1195, test_loss: 1.2092, test_f1: 0.2807
 epoch: 2, train_loss: 1.0159, test_loss: 1.0058, test_f1: 0.4201
 epoch: 3, train_loss: 0.9695, test_loss: 0.9405, test_f1: 0.4976
 epoch: 4, train_loss: 0.9346, test_loss: 0.9047, test_f1: 0.5177
 epoch: 5, train_loss: 0.9041, test_loss: 0.8608, test_f1: 0.5238
 epoch: 6, train_loss: 0.8756, test_loss: 0.9143, test_f1: 0.5013
 epoch: 7, train_loss: 0.8776, test_loss: 0.9382, test_f1: 0.4834
 epoch: 8, train_loss: 0.8631, test_loss: 0.9638, test_f1: 0.5046
 epoch: 9, train_loss: 0.8364, test_loss: 0.8946, test_f1: 0.5593
 epoch: 10, train_loss: 0.8273, test_loss: 0.8652, test_f1: 0.5258
 epoch: 11, train_loss: 0.8053, test_loss: 0.8125, test_f1: 0.5527
 epoch: 12, train_loss: 0.8026, test_loss: 0.8821, test_f1: 0.5587
 epoch: 13, train_loss: 0.7639, test_loss: 0.8024, test_f1: 0.5952
 epoch: 14, train_loss: 0.7536, test_loss: 0.8038, test_f1: 0.5378
 epoch: 15, train_loss: 0.7486, test_loss: 0.8552, test_f1: 0.5841
 epoch: 16, train_loss: 0.7458, test_loss: 0.7936, test_f1: 0.5946
 epoch: 17, train_loss: 0.7177, test_loss: 0.8466, test_f1: 0.5975
 epoch: 18, train_loss: 0.7171, test_loss: 0.7800, test_f1: 0.6404
 epoch: 19, train_loss: 0.7120, test_loss: 0.7810, test_f1: 0.6230
 epoch: 20, train_loss: 0.6919, test_loss: 0.8417, test_f1: 0.6068
 epoch: 21, train_loss: 0.7042, test_loss: 0.8960, test_f1: 0.5733
 epoch: 22, train_loss: 0.6957, test_loss: 0.9413, test_f1: 0.5583
 epoch: 23, train_loss: 0.6773, test_loss: 0.9232, test_f1: 0.6330
 epoch: 24, train_loss: 0.6731, test_loss: 0.8031, test_f1: 0.6647
 epoch: 25, train_loss: 0.6691, test_loss: 0.7343, test_f1: 0.6530
 epoch: 26, train_loss: 0.6397, test_loss: 0.7547, test_f1: 0.6429
 epoch: 27, train_loss: 0.6195, test_loss: 0.8939, test_f1: 0.6032
 epoch: 28, train_loss: 0.6087, test_loss: 0.8009, test_f1: 0.6174
 epoch: 29, train_loss: 0.6239, test_loss: 0.9950, test_f1: 0.5869
 epoch: 30, train_loss: 0.6070, test_loss: 0.7966, test_f1: 0.6294
 epoch: 31, train_loss: 0.6102, test_loss: 0.9421, test_f1: 0.5851
 epoch: 32, train_loss: 0.5880, test_loss: 0.9036, test_f1: 0.6242
 epoch: 33, train_loss: 0.5778, test_loss: 0.8266, test_f1: 0.6248
 epoch: 34, train_loss: 0.5771, test_loss: 0.9408, test_f1: 0.6054
 epoch: 35, train_loss: 0.5807, test_loss: 0.9337, test_f1: 0.5839
 epoch: 36, train_loss: 0.5605, test_loss: 1.0290, test_f1: 0.5380
 epoch: 37, train_loss: 0.5627, test_loss: 0.8770, test_f1: 0.5995
 epoch: 38, train_loss: 0.5668, test_loss: 0.9664, test_f1: 0.6124
 epoch: 39, train_loss: 0.5661, test_loss: 0.9107, test_f1: 0.6033
 epoch: 40, train_loss: 0.5565, test_loss: 0.8009, test_f1: 0.6349
 epoch: 41, train_loss: 0.5212, test_loss: 0.8868, test_f1: 0.6172
 epoch: 42, train_loss: 0.5225, test_loss: 1.0434, test_f1: 0.5810
 epoch: 43, train_loss: 0.5293, test_loss: 1.0664, test_f1: 0.6010
 epoch: 44, train_loss: 0.5164, test_loss: 0.9523, test_f1: 0.6284
 epoch: 45, train_loss: 0.5060, test_loss: 0.8977, test_f1: 0.6285
 epoch: 46, train_loss: 0.4932, test_loss: 1.0188, test_f1: 0.6031
 epoch: 47, train_loss: 0.5034, test_loss: 0.9675, test_f1: 0.6161
 epoch: 48, train_loss: 0.5039, test_loss: 0.8410, test_f1: 0.6412
 epoch: 49, train_loss: 0.5072, test_loss: 0.7296, test_f1: 0.6879
 epoch: 50, train_loss: 0.4743, test_loss: 0.8637, test_f1: 0.6468
 epoch: 51, train_loss: 0.4390, test_loss: 0.8190, test_f1: 0.6668
 epoch: 52, train_loss: 0.4163, test_loss: 0.7830, test_f1: 0.6760
 epoch: 53, train_loss: 0.4064, test_loss: 0.7878, test_f1: 0.6707
 epoch: 54, train_loss: 0.3910, test_loss: 0.7961, test_f1: 0.6577
 epoch: 55, train_loss: 0.3648, test_loss: 0.9387, test_f1: 0.6652
 epoch: 56, train_loss: 0.3732, test_loss: 0.9922, test_f1: 0.6460
 epoch: 57, train_loss: 0.3578, test_loss: 0.8588, test_f1: 0.6578
 epoch: 58, train_loss: 0.3709, test_loss: 0.9465, test_f1: 0.6607
 epoch: 59, train_loss: 0.3527, test_loss: 0.9942, test_f1: 0.6156
 epoch: 60, train_loss: 0.3349, test_loss: 0.9676, test_f1: 0.6648
 epoch: 61, train_loss: 0.3197, test_loss: 1.0817, test_f1: 0.6337
 epoch: 62, train_loss: 0.3227, test_loss: 0.8801, test_f1: 0.6497
 epoch: 63, train_loss: 0.3441, test_loss: 0.8590, test_f1: 0.6874
 epoch: 64, train_loss: 0.3176, test_loss: 1.0555, test_f1: 0.6267
 epoch: 65, train_loss: 0.3358, test_loss: 0.9583, test_f1: 0.6426
 epoch: 66, train_loss: 0.3278, test_loss: 0.9927, test_f1: 0.6690
 epoch: 67, train_loss: 0.3248, test_loss: 0.9471, test_f1: 0.6696
 epoch: 68, train_loss: 0.3082, test_loss: 1.0239, test_f1: 0.6479
 epoch: 69, train_loss: 0.2830, test_loss: 1.0621, test_f1: 0.6555
 epoch: 70, train_loss: 0.2845, test_loss: 1.0372, test_f1: 0.6442
 epoch: 71, train_loss: 0.2780, test_loss: 0.9922, test_f1: 0.6469
 epoch: 72, train_loss: 0.3027, test_loss: 1.0847, test_f1: 0.6484
 epoch: 73, train_loss: 0.2751, test_loss: 1.1426, test_f1: 0.6295
 epoch: 74, train_loss: 0.2781, test_loss: 0.9511, test_f1: 0.6913
 epoch: 75, train_loss: 0.2988, test_loss: 1.4795, test_f1: 0.6096
 epoch: 76, train_loss: 0.2946, test_loss: 1.0929, test_f1: 0.6336
 epoch: 77, train_loss: 0.2779, test_loss: 1.0928, test_f1: 0.6374
 epoch: 78, train_loss: 0.2826, test_loss: 1.0837, test_f1: 0.6445
 epoch: 79, train_loss: 0.2505, test_loss: 1.1104, test_f1: 0.6617
 epoch: 80, train_loss: 0.2548, test_loss: 1.1265, test_f1: 0.6703
 epoch: 81, train_loss: 0.2829, test_loss: 1.0108, test_f1: 0.6542
 epoch: 82, train_loss: 0.2538, test_loss: 1.0498, test_f1: 0.6434
 epoch: 83, train_loss: 0.2583, test_loss: 1.0036, test_f1: 0.6720
 epoch: 84, train_loss: 0.2596, test_loss: 1.2206, test_f1: 0.6463
 epoch: 85, train_loss: 0.2316, test_loss: 1.4077, test_f1: 0.6106
 epoch: 86, train_loss: 0.2325, test_loss: 1.2556, test_f1: 0.6576
 epoch: 87, train_loss: 0.2507, test_loss: 1.3504, test_f1: 0.6529
 epoch: 88, train_loss: 0.2714, test_loss: 1.1907, test_f1: 0.6299
 epoch: 89, train_loss: 0.2455, test_loss: 1.1516, test_f1: 0.6742
 epoch: 90, train_loss: 0.2561, test_loss: 1.1908, test_f1: 0.6463
 epoch: 91, train_loss: 0.2744, test_loss: 1.1853, test_f1: 0.6423
 epoch: 92, train_loss: 0.2610, test_loss: 1.3370, test_f1: 0.6237
 epoch: 93, train_loss: 0.2306, test_loss: 1.2547, test_f1: 0.6173
 epoch: 94, train_loss: 0.2122, test_loss: 1.2174, test_f1: 0.6536
 epoch: 95, train_loss: 0.2277, test_loss: 1.2201, test_f1: 0.6364
 epoch: 96, train_loss: 0.2152, test_loss: 1.3669, test_f1: 0.6539
 epoch: 97, train_loss: 0.2403, test_loss: 1.1538, test_f1: 0.6246
 epoch: 98, train_loss: 0.2410, test_loss: 1.2340, test_f1: 0.6480
 epoch: 99, train_loss: 0.1979, test_loss: 1.1610, test_f1: 0.6652
##################ITERATION #4 ****************************************
 epoch: 0, train_loss: 1.5069, test_loss: 1.5796, test_f1: 0.2782
 epoch: 1, train_loss: 1.0105, test_loss: 1.2608, test_f1: 0.3882
 epoch: 2, train_loss: 0.9471, test_loss: 0.9237, test_f1: 0.4505
 epoch: 3, train_loss: 0.9517, test_loss: 0.9678, test_f1: 0.4893
 epoch: 4, train_loss: 0.9397, test_loss: 0.9676, test_f1: 0.4722
 epoch: 5, train_loss: 0.9006, test_loss: 0.8706, test_f1: 0.5557
 epoch: 6, train_loss: 0.8888, test_loss: 0.8887, test_f1: 0.5161
 epoch: 7, train_loss: 0.8634, test_loss: 0.9403, test_f1: 0.5379
 epoch: 8, train_loss: 0.8273, test_loss: 0.9489, test_f1: 0.5155
 epoch: 9, train_loss: 0.8248, test_loss: 0.9334, test_f1: 0.6000
 epoch: 10, train_loss: 0.8104, test_loss: 0.9683, test_f1: 0.5793
 epoch: 11, train_loss: 0.8180, test_loss: 0.8115, test_f1: 0.5224
 epoch: 12, train_loss: 0.7939, test_loss: 0.8609, test_f1: 0.5222
 epoch: 13, train_loss: 0.7826, test_loss: 0.9248, test_f1: 0.6033
 epoch: 14, train_loss: 0.7770, test_loss: 0.8862, test_f1: 0.5896
 epoch: 15, train_loss: 0.7482, test_loss: 0.8971, test_f1: 0.5964
 epoch: 16, train_loss: 0.7387, test_loss: 0.8856, test_f1: 0.5695
 epoch: 17, train_loss: 0.7684, test_loss: 0.8554, test_f1: 0.5738
 epoch: 18, train_loss: 0.7425, test_loss: 0.8835, test_f1: 0.5838
 epoch: 19, train_loss: 0.7375, test_loss: 1.0984, test_f1: 0.5087
 epoch: 20, train_loss: 0.7290, test_loss: 0.9644, test_f1: 0.5505
 epoch: 21, train_loss: 0.7291, test_loss: 0.8802, test_f1: 0.6285
 epoch: 22, train_loss: 0.6878, test_loss: 0.9621, test_f1: 0.5851
 epoch: 23, train_loss: 0.6782, test_loss: 0.8726, test_f1: 0.5768
 epoch: 24, train_loss: 0.6891, test_loss: 0.9368, test_f1: 0.5616
 epoch: 25, train_loss: 0.6560, test_loss: 0.9318, test_f1: 0.5480
 epoch: 26, train_loss: 0.6462, test_loss: 0.8737, test_f1: 0.6320
 epoch: 27, train_loss: 0.6147, test_loss: 0.9002, test_f1: 0.6434
 epoch: 28, train_loss: 0.5865, test_loss: 0.8587, test_f1: 0.6474
 epoch: 29, train_loss: 0.6284, test_loss: 0.8107, test_f1: 0.6432
 epoch: 30, train_loss: 0.6127, test_loss: 0.9133, test_f1: 0.6333
 epoch: 31, train_loss: 0.6193, test_loss: 0.8000, test_f1: 0.6262
 epoch: 32, train_loss: 0.5909, test_loss: 0.9295, test_f1: 0.6403
 epoch: 33, train_loss: 0.6046, test_loss: 0.7879, test_f1: 0.6024
 epoch: 34, train_loss: 0.5863, test_loss: 1.2026, test_f1: 0.6049
 epoch: 35, train_loss: 0.5826, test_loss: 1.1641, test_f1: 0.5562
 epoch: 36, train_loss: 0.5607, test_loss: 0.8120, test_f1: 0.6653
 epoch: 37, train_loss: 0.5524, test_loss: 0.9503, test_f1: 0.6373
 epoch: 38, train_loss: 0.5307, test_loss: 0.8861, test_f1: 0.6440
 epoch: 39, train_loss: 0.5459, test_loss: 0.9655, test_f1: 0.6013
 epoch: 40, train_loss: 0.5414, test_loss: 1.0414, test_f1: 0.6240
 epoch: 41, train_loss: 0.5390, test_loss: 0.9733, test_f1: 0.6561
 epoch: 42, train_loss: 0.5346, test_loss: 0.8404, test_f1: 0.6504
 epoch: 43, train_loss: 0.5168, test_loss: 1.0786, test_f1: 0.6311
 epoch: 44, train_loss: 0.5003, test_loss: 1.0697, test_f1: 0.6245
 epoch: 45, train_loss: 0.4981, test_loss: 1.0486, test_f1: 0.6294
 epoch: 46, train_loss: 0.4991, test_loss: 0.9613, test_f1: 0.5935
 epoch: 47, train_loss: 0.4926, test_loss: 0.9502, test_f1: 0.6580
 epoch: 48, train_loss: 0.4799, test_loss: 1.0546, test_f1: 0.6391
 epoch: 49, train_loss: 0.4758, test_loss: 0.8916, test_f1: 0.6603
 epoch: 50, train_loss: 0.4733, test_loss: 0.9265, test_f1: 0.6322
 epoch: 51, train_loss: 0.4470, test_loss: 1.3131, test_f1: 0.5883
 epoch: 52, train_loss: 0.3972, test_loss: 1.0172, test_f1: 0.6143
 epoch: 53, train_loss: 0.3873, test_loss: 0.9458, test_f1: 0.6693
 epoch: 54, train_loss: 0.3901, test_loss: 0.9010, test_f1: 0.6697
 epoch: 55, train_loss: 0.3790, test_loss: 0.9769, test_f1: 0.6669
 epoch: 56, train_loss: 0.3700, test_loss: 0.9306, test_f1: 0.6511
 epoch: 57, train_loss: 0.3726, test_loss: 0.9191, test_f1: 0.6592
 epoch: 58, train_loss: 0.3515, test_loss: 1.0936, test_f1: 0.6652
 epoch: 59, train_loss: 0.3442, test_loss: 0.9891, test_f1: 0.6560
 epoch: 60, train_loss: 0.3494, test_loss: 1.0246, test_f1: 0.6749
 epoch: 61, train_loss: 0.3396, test_loss: 0.8710, test_f1: 0.6797
 epoch: 62, train_loss: 0.3464, test_loss: 0.8196, test_f1: 0.6925
 epoch: 63, train_loss: 0.3231, test_loss: 1.0610, test_f1: 0.6351
 epoch: 64, train_loss: 0.3253, test_loss: 0.9234, test_f1: 0.6716
 epoch: 65, train_loss: 0.3430, test_loss: 1.1709, test_f1: 0.6373
 epoch: 66, train_loss: 0.3350, test_loss: 1.0267, test_f1: 0.6658
 epoch: 67, train_loss: 0.3337, test_loss: 1.0545, test_f1: 0.6367
 epoch: 68, train_loss: 0.3141, test_loss: 1.0403, test_f1: 0.6697
 epoch: 69, train_loss: 0.3195, test_loss: 1.1091, test_f1: 0.6808
 epoch: 70, train_loss: 0.3210, test_loss: 1.2072, test_f1: 0.6356
 epoch: 71, train_loss: 0.3031, test_loss: 1.0887, test_f1: 0.6489
 epoch: 72, train_loss: 0.2839, test_loss: 1.0119, test_f1: 0.6718
 epoch: 73, train_loss: 0.3060, test_loss: 1.2406, test_f1: 0.6494
 epoch: 74, train_loss: 0.3169, test_loss: 1.1283, test_f1: 0.6509
 epoch: 75, train_loss: 0.2815, test_loss: 1.0613, test_f1: 0.6494
 epoch: 76, train_loss: 0.2868, test_loss: 1.2302, test_f1: 0.6382
 epoch: 77, train_loss: 0.2816, test_loss: 1.1466, test_f1: 0.6383
 epoch: 78, train_loss: 0.2814, test_loss: 1.3699, test_f1: 0.6299
 epoch: 79, train_loss: 0.2850, test_loss: 1.2418, test_f1: 0.6585
 epoch: 80, train_loss: 0.2789, test_loss: 1.1852, test_f1: 0.6466
 epoch: 81, train_loss: 0.2806, test_loss: 1.1237, test_f1: 0.6595
 epoch: 82, train_loss: 0.2755, test_loss: 1.2047, test_f1: 0.6345
 epoch: 83, train_loss: 0.2779, test_loss: 1.2241, test_f1: 0.6636
 epoch: 84, train_loss: 0.2438, test_loss: 1.2138, test_f1: 0.6306
 epoch: 85, train_loss: 0.2598, test_loss: 1.2608, test_f1: 0.6423
 epoch: 86, train_loss: 0.2509, test_loss: 1.1855, test_f1: 0.6469
 epoch: 87, train_loss: 0.2566, test_loss: 1.1529, test_f1: 0.6453
 epoch: 88, train_loss: 0.2459, test_loss: 1.2219, test_f1: 0.6605
 epoch: 89, train_loss: 0.2665, test_loss: 1.3203, test_f1: 0.6527
 epoch: 90, train_loss: 0.2672, test_loss: 1.2456, test_f1: 0.6173
 epoch: 91, train_loss: 0.2605, test_loss: 1.3289, test_f1: 0.6386
 epoch: 92, train_loss: 0.2486, test_loss: 1.4134, test_f1: 0.6327
 epoch: 93, train_loss: 0.2396, test_loss: 1.3556, test_f1: 0.6416
 epoch: 94, train_loss: 0.2425, test_loss: 1.3702, test_f1: 0.6520
 epoch: 95, train_loss: 0.2446, test_loss: 1.1047, test_f1: 0.6653
 epoch: 96, train_loss: 0.2426, test_loss: 1.4033, test_f1: 0.6259
 epoch: 97, train_loss: 0.2263, test_loss: 1.3398, test_f1: 0.6427
 epoch: 98, train_loss: 0.2301, test_loss: 1.5712, test_f1: 0.6432
 epoch: 99, train_loss: 0.2247, test_loss: 1.2179, test_f1: 0.6499
##################ITERATION #5 ****************************************
 epoch: 0, train_loss: 2.0049, test_loss: 1.4252, test_f1: 0.2275
 epoch: 1, train_loss: 1.1921, test_loss: 1.2096, test_f1: 0.3801
 epoch: 2, train_loss: 1.1011, test_loss: 1.1071, test_f1: 0.4256
 epoch: 3, train_loss: 1.0517, test_loss: 1.0898, test_f1: 0.4838
 epoch: 4, train_loss: 1.0265, test_loss: 1.0501, test_f1: 0.4781
 epoch: 5, train_loss: 0.9959, test_loss: 1.0388, test_f1: 0.4638
 epoch: 6, train_loss: 0.9901, test_loss: 1.0602, test_f1: 0.4832
 epoch: 7, train_loss: 0.9789, test_loss: 1.0000, test_f1: 0.4966
 epoch: 8, train_loss: 0.9422, test_loss: 0.9809, test_f1: 0.4996
 epoch: 9, train_loss: 0.9282, test_loss: 0.9085, test_f1: 0.5041
 epoch: 10, train_loss: 0.9195, test_loss: 0.9438, test_f1: 0.4999
 epoch: 11, train_loss: 0.9198, test_loss: 0.9754, test_f1: 0.5083
 epoch: 12, train_loss: 0.9092, test_loss: 0.9897, test_f1: 0.4901
 epoch: 13, train_loss: 0.9082, test_loss: 0.9686, test_f1: 0.4869
 epoch: 14, train_loss: 0.8706, test_loss: 1.0061, test_f1: 0.4950
 epoch: 15, train_loss: 0.8546, test_loss: 0.9745, test_f1: 0.4737
 epoch: 16, train_loss: 0.8628, test_loss: 0.9310, test_f1: 0.5105
 epoch: 17, train_loss: 0.8671, test_loss: 0.9620, test_f1: 0.4557
 epoch: 18, train_loss: 0.8414, test_loss: 1.3006, test_f1: 0.4365
 epoch: 19, train_loss: 0.8406, test_loss: 1.3211, test_f1: 0.4355
 epoch: 20, train_loss: 0.8343, test_loss: 0.9090, test_f1: 0.4992
 epoch: 21, train_loss: 0.8026, test_loss: 0.9152, test_f1: 0.5118
 epoch: 22, train_loss: 0.7900, test_loss: 1.1467, test_f1: 0.4815
 epoch: 23, train_loss: 0.7810, test_loss: 0.9328, test_f1: 0.5561
 epoch: 24, train_loss: 0.7802, test_loss: 1.0651, test_f1: 0.5232
 epoch: 25, train_loss: 0.7870, test_loss: 0.8562, test_f1: 0.5210
 epoch: 26, train_loss: 0.7543, test_loss: 0.9784, test_f1: 0.5296
 epoch: 27, train_loss: 0.7474, test_loss: 0.7921, test_f1: 0.5596
 epoch: 28, train_loss: 0.7238, test_loss: 1.0413, test_f1: 0.5677
 epoch: 29, train_loss: 0.7253, test_loss: 0.9769, test_f1: 0.4901
 epoch: 30, train_loss: 0.7445, test_loss: 0.8478, test_f1: 0.5794
 epoch: 31, train_loss: 0.7405, test_loss: 1.1467, test_f1: 0.5384
 epoch: 32, train_loss: 0.7271, test_loss: 0.9466, test_f1: 0.5535
 epoch: 33, train_loss: 0.7124, test_loss: 1.0107, test_f1: 0.5196
 epoch: 34, train_loss: 0.6881, test_loss: 0.8399, test_f1: 0.6026
 epoch: 35, train_loss: 0.6917, test_loss: 0.9128, test_f1: 0.6009
 epoch: 36, train_loss: 0.6796, test_loss: 1.0090, test_f1: 0.6388
 epoch: 37, train_loss: 0.7072, test_loss: 1.1077, test_f1: 0.5728
 epoch: 38, train_loss: 0.6790, test_loss: 1.0811, test_f1: 0.6417
 epoch: 39, train_loss: 0.6342, test_loss: 0.9704, test_f1: 0.6511
 epoch: 40, train_loss: 0.6585, test_loss: 1.3430, test_f1: 0.5701
 epoch: 41, train_loss: 0.6373, test_loss: 1.1092, test_f1: 0.6130
 epoch: 42, train_loss: 0.6480, test_loss: 0.9457, test_f1: 0.6050
 epoch: 43, train_loss: 0.6354, test_loss: 1.1051, test_f1: 0.5894
 epoch: 44, train_loss: 0.6085, test_loss: 1.0017, test_f1: 0.5707
 epoch: 45, train_loss: 0.6290, test_loss: 1.0609, test_f1: 0.5911
 epoch: 46, train_loss: 0.6249, test_loss: 0.9390, test_f1: 0.6222
 epoch: 47, train_loss: 0.6062, test_loss: 1.0539, test_f1: 0.6102
 epoch: 48, train_loss: 0.5873, test_loss: 1.1667, test_f1: 0.6238
 epoch: 49, train_loss: 0.5936, test_loss: 1.1592, test_f1: 0.6521
 epoch: 50, train_loss: 0.5914, test_loss: 1.4020, test_f1: 0.4351
 epoch: 51, train_loss: 0.5527, test_loss: 1.0229, test_f1: 0.6622
 epoch: 52, train_loss: 0.5281, test_loss: 1.0793, test_f1: 0.6310
 epoch: 53, train_loss: 0.4954, test_loss: 0.9864, test_f1: 0.6611
 epoch: 54, train_loss: 0.4840, test_loss: 0.9552, test_f1: 0.6786
 epoch: 55, train_loss: 0.4807, test_loss: 1.0554, test_f1: 0.6552
 epoch: 56, train_loss: 0.4792, test_loss: 0.9544, test_f1: 0.6798
 epoch: 57, train_loss: 0.4584, test_loss: 1.0514, test_f1: 0.6314
 epoch: 58, train_loss: 0.4775, test_loss: 1.0287, test_f1: 0.6488
 epoch: 59, train_loss: 0.4635, test_loss: 1.1123, test_f1: 0.6526
 epoch: 60, train_loss: 0.4405, test_loss: 1.1333, test_f1: 0.6468
 epoch: 61, train_loss: 0.4378, test_loss: 1.0606, test_f1: 0.6672
 epoch: 62, train_loss: 0.4446, test_loss: 1.3770, test_f1: 0.6408
 epoch: 63, train_loss: 0.4431, test_loss: 1.1984, test_f1: 0.6530
 epoch: 64, train_loss: 0.4378, test_loss: 0.9871, test_f1: 0.6838
 epoch: 65, train_loss: 0.4306, test_loss: 1.0731, test_f1: 0.6468
 epoch: 66, train_loss: 0.4232, test_loss: 1.2528, test_f1: 0.6479
 epoch: 67, train_loss: 0.4346, test_loss: 1.1524, test_f1: 0.6574
 epoch: 68, train_loss: 0.4311, test_loss: 1.1268, test_f1: 0.6589
 epoch: 69, train_loss: 0.4294, test_loss: 1.2645, test_f1: 0.6720
 epoch: 70, train_loss: 0.4275, test_loss: 1.0537, test_f1: 0.6244
 epoch: 71, train_loss: 0.4304, test_loss: 1.1496, test_f1: 0.6613
 epoch: 72, train_loss: 0.4087, test_loss: 1.1759, test_f1: 0.6465
 epoch: 73, train_loss: 0.3856, test_loss: 1.2675, test_f1: 0.6491
 epoch: 74, train_loss: 0.4030, test_loss: 1.1442, test_f1: 0.6574
 epoch: 75, train_loss: 0.3862, test_loss: 1.4474, test_f1: 0.6217
 epoch: 76, train_loss: 0.4046, test_loss: 1.1188, test_f1: 0.6564
 epoch: 77, train_loss: 0.4079, test_loss: 1.3092, test_f1: 0.6017
 epoch: 78, train_loss: 0.3912, test_loss: 1.1388, test_f1: 0.6545
 epoch: 79, train_loss: 0.3859, test_loss: 1.0515, test_f1: 0.6324
 epoch: 80, train_loss: 0.3779, test_loss: 1.2778, test_f1: 0.6815
 epoch: 81, train_loss: 0.3859, test_loss: 1.6304, test_f1: 0.6342
 epoch: 82, train_loss: 0.3951, test_loss: 1.3458, test_f1: 0.6405
 epoch: 83, train_loss: 0.4112, test_loss: 1.1801, test_f1: 0.6546
 epoch: 84, train_loss: 0.3992, test_loss: 1.3161, test_f1: 0.6212
 epoch: 85, train_loss: 0.3692, test_loss: 1.2485, test_f1: 0.6788
 epoch: 86, train_loss: 0.3589, test_loss: 1.3331, test_f1: 0.6402
 epoch: 87, train_loss: 0.3495, test_loss: 1.3099, test_f1: 0.6539
 epoch: 88, train_loss: 0.3507, test_loss: 1.1772, test_f1: 0.6348
 epoch: 89, train_loss: 0.3523, test_loss: 1.2365, test_f1: 0.6514
 epoch: 90, train_loss: 0.3299, test_loss: 1.2437, test_f1: 0.6539
 epoch: 91, train_loss: 0.3515, test_loss: 1.3290, test_f1: 0.6256
 epoch: 92, train_loss: 0.3137, test_loss: 1.3539, test_f1: 0.6306
 epoch: 93, train_loss: 0.3392, test_loss: 1.3411, test_f1: 0.6662
 epoch: 94, train_loss: 0.3229, test_loss: 1.7575, test_f1: 0.6305
 epoch: 95, train_loss: 0.3478, test_loss: 1.4984, test_f1: 0.6632
 epoch: 96, train_loss: 0.3565, test_loss: 1.5208, test_f1: 0.6210
 epoch: 97, train_loss: 0.3573, test_loss: 1.6043, test_f1: 0.6126
 epoch: 98, train_loss: 0.3427, test_loss: 1.0807, test_f1: 0.6518
 epoch: 99, train_loss: 0.3398, test_loss: 2.0083, test_f1: 0.5662
##################ITERATION #6 ****************************************
 epoch: 0, train_loss: 1.7455, test_loss: 1.4542, test_f1: 0.2270
 epoch: 1, train_loss: 1.1463, test_loss: 1.4279, test_f1: 0.2368
 epoch: 2, train_loss: 1.0610, test_loss: 1.1403, test_f1: 0.3919
 epoch: 3, train_loss: 1.0054, test_loss: 1.0040, test_f1: 0.4621
 epoch: 4, train_loss: 0.9636, test_loss: 1.0120, test_f1: 0.4776
 epoch: 5, train_loss: 0.9572, test_loss: 1.0277, test_f1: 0.4912
 epoch: 6, train_loss: 0.9395, test_loss: 0.9632, test_f1: 0.4914
 epoch: 7, train_loss: 0.9379, test_loss: 0.9268, test_f1: 0.5137
 epoch: 8, train_loss: 0.9272, test_loss: 0.9600, test_f1: 0.4913
 epoch: 9, train_loss: 0.9071, test_loss: 1.0290, test_f1: 0.4668
 epoch: 10, train_loss: 0.8957, test_loss: 1.1058, test_f1: 0.4753
 epoch: 11, train_loss: 0.8872, test_loss: 1.0069, test_f1: 0.4978
 epoch: 12, train_loss: 0.8782, test_loss: 1.0667, test_f1: 0.5094
 epoch: 13, train_loss: 0.8735, test_loss: 0.9322, test_f1: 0.5204
 epoch: 14, train_loss: 0.8596, test_loss: 0.8684, test_f1: 0.5556
 epoch: 15, train_loss: 0.8551, test_loss: 1.0446, test_f1: 0.4902
 epoch: 16, train_loss: 0.8323, test_loss: 0.9687, test_f1: 0.4976
 epoch: 17, train_loss: 0.8330, test_loss: 0.9779, test_f1: 0.5064
 epoch: 18, train_loss: 0.8012, test_loss: 0.8921, test_f1: 0.5333
 epoch: 19, train_loss: 0.8098, test_loss: 0.9809, test_f1: 0.5241
 epoch: 20, train_loss: 0.8058, test_loss: 1.0229, test_f1: 0.5292
 epoch: 21, train_loss: 0.7871, test_loss: 1.0767, test_f1: 0.5291
 epoch: 22, train_loss: 0.7923, test_loss: 0.9424, test_f1: 0.5411
 epoch: 23, train_loss: 0.7776, test_loss: 0.9850, test_f1: 0.5598
 epoch: 24, train_loss: 0.7407, test_loss: 1.0659, test_f1: 0.5426
 epoch: 25, train_loss: 0.7500, test_loss: 1.1866, test_f1: 0.5397
 epoch: 26, train_loss: 0.7501, test_loss: 1.1290, test_f1: 0.5352
 epoch: 27, train_loss: 0.7599, test_loss: 1.1872, test_f1: 0.5457
 epoch: 28, train_loss: 0.7505, test_loss: 0.8670, test_f1: 0.5528
 epoch: 29, train_loss: 0.7163, test_loss: 0.9322, test_f1: 0.5129
 epoch: 30, train_loss: 0.7102, test_loss: 0.8425, test_f1: 0.5926
 epoch: 31, train_loss: 0.6872, test_loss: 0.9821, test_f1: 0.5551
 epoch: 32, train_loss: 0.6981, test_loss: 0.8751, test_f1: 0.5665
 epoch: 33, train_loss: 0.6918, test_loss: 1.0876, test_f1: 0.5596
 epoch: 34, train_loss: 0.6967, test_loss: 1.0875, test_f1: 0.5764
 epoch: 35, train_loss: 0.6719, test_loss: 1.0309, test_f1: 0.5420
 epoch: 36, train_loss: 0.6678, test_loss: 1.0446, test_f1: 0.5560
 epoch: 37, train_loss: 0.6430, test_loss: 1.0887, test_f1: 0.5705
 epoch: 38, train_loss: 0.6339, test_loss: 1.0718, test_f1: 0.5918
 epoch: 39, train_loss: 0.6473, test_loss: 0.8897, test_f1: 0.5788
 epoch: 40, train_loss: 0.6584, test_loss: 0.8450, test_f1: 0.5618
 epoch: 41, train_loss: 0.6919, test_loss: 0.8493, test_f1: 0.6064
 epoch: 42, train_loss: 0.6700, test_loss: 0.9695, test_f1: 0.5698
 epoch: 43, train_loss: 0.6397, test_loss: 0.9269, test_f1: 0.5846
 epoch: 44, train_loss: 0.6001, test_loss: 1.2853, test_f1: 0.5727
 epoch: 45, train_loss: 0.5838, test_loss: 1.0411, test_f1: 0.5982
 epoch: 46, train_loss: 0.6116, test_loss: 0.9889, test_f1: 0.5898
 epoch: 47, train_loss: 0.6228, test_loss: 0.9205, test_f1: 0.5806
 epoch: 48, train_loss: 0.6276, test_loss: 1.2993, test_f1: 0.5195
 epoch: 49, train_loss: 0.6285, test_loss: 1.2578, test_f1: 0.5949
 epoch: 50, train_loss: 0.6157, test_loss: 1.1018, test_f1: 0.6144
 epoch: 51, train_loss: 0.5547, test_loss: 0.9085, test_f1: 0.6301
 epoch: 52, train_loss: 0.5280, test_loss: 0.8103, test_f1: 0.6549
 epoch: 53, train_loss: 0.5101, test_loss: 0.8721, test_f1: 0.6499
 epoch: 54, train_loss: 0.4954, test_loss: 0.9044, test_f1: 0.6645
 epoch: 55, train_loss: 0.4796, test_loss: 1.0608, test_f1: 0.6584
 epoch: 56, train_loss: 0.4888, test_loss: 0.9722, test_f1: 0.6445
 epoch: 57, train_loss: 0.4653, test_loss: 0.9004, test_f1: 0.6624
 epoch: 58, train_loss: 0.4855, test_loss: 1.1410, test_f1: 0.6225
 epoch: 59, train_loss: 0.4631, test_loss: 1.0492, test_f1: 0.6289
 epoch: 60, train_loss: 0.4597, test_loss: 1.0583, test_f1: 0.6489
 epoch: 61, train_loss: 0.4623, test_loss: 0.9512, test_f1: 0.6784
 epoch: 62, train_loss: 0.4434, test_loss: 1.1932, test_f1: 0.6432
 epoch: 63, train_loss: 0.4373, test_loss: 1.1697, test_f1: 0.6445
 epoch: 64, train_loss: 0.4469, test_loss: 0.9675, test_f1: 0.6689
 epoch: 65, train_loss: 0.4265, test_loss: 1.0934, test_f1: 0.6442
 epoch: 66, train_loss: 0.4151, test_loss: 1.0184, test_f1: 0.6443
 epoch: 67, train_loss: 0.4261, test_loss: 1.4789, test_f1: 0.6506
 epoch: 68, train_loss: 0.4168, test_loss: 1.1640, test_f1: 0.6169
 epoch: 69, train_loss: 0.4052, test_loss: 1.1306, test_f1: 0.6562
 epoch: 70, train_loss: 0.4277, test_loss: 1.0587, test_f1: 0.6874
 epoch: 71, train_loss: 0.3854, test_loss: 1.0294, test_f1: 0.6587
 epoch: 72, train_loss: 0.3794, test_loss: 1.1250, test_f1: 0.6424
 epoch: 73, train_loss: 0.3750, test_loss: 1.1732, test_f1: 0.6472
 epoch: 74, train_loss: 0.3899, test_loss: 1.1723, test_f1: 0.6504
 epoch: 75, train_loss: 0.3767, test_loss: 1.4605, test_f1: 0.6283
 epoch: 76, train_loss: 0.3688, test_loss: 0.9941, test_f1: 0.6555
 epoch: 77, train_loss: 0.3682, test_loss: 1.3845, test_f1: 0.6674
 epoch: 78, train_loss: 0.3582, test_loss: 1.3124, test_f1: 0.6775
 epoch: 79, train_loss: 0.3802, test_loss: 1.3358, test_f1: 0.6619
 epoch: 80, train_loss: 0.3595, test_loss: 1.4173, test_f1: 0.6719
 epoch: 81, train_loss: 0.3490, test_loss: 1.3388, test_f1: 0.6453
 epoch: 82, train_loss: 0.3599, test_loss: 1.1600, test_f1: 0.6855
 epoch: 83, train_loss: 0.3519, test_loss: 1.2420, test_f1: 0.6709
 epoch: 84, train_loss: 0.3623, test_loss: 1.2062, test_f1: 0.6726
 epoch: 85, train_loss: 0.3465, test_loss: 1.1699, test_f1: 0.6963
 epoch: 86, train_loss: 0.3513, test_loss: 1.4285, test_f1: 0.6441
 epoch: 87, train_loss: 0.3382, test_loss: 1.2855, test_f1: 0.6775
 epoch: 88, train_loss: 0.3321, test_loss: 1.8093, test_f1: 0.6523
 epoch: 89, train_loss: 0.3188, test_loss: 1.1816, test_f1: 0.6680
 epoch: 90, train_loss: 0.3121, test_loss: 1.7094, test_f1: 0.6517
 epoch: 91, train_loss: 0.3312, test_loss: 1.5684, test_f1: 0.6582
 epoch: 92, train_loss: 0.3335, test_loss: 1.2901, test_f1: 0.6976
 epoch: 93, train_loss: 0.3106, test_loss: 1.2604, test_f1: 0.6613
 epoch: 94, train_loss: 0.3053, test_loss: 2.0244, test_f1: 0.6415
 epoch: 95, train_loss: 0.2986, test_loss: 1.4702, test_f1: 0.6838
 epoch: 96, train_loss: 0.3277, test_loss: 1.3158, test_f1: 0.6719
 epoch: 97, train_loss: 0.2978, test_loss: 1.2843, test_f1: 0.6679
 epoch: 98, train_loss: 0.2823, test_loss: 1.3248, test_f1: 0.6443
 epoch: 99, train_loss: 0.2852, test_loss: 1.6508, test_f1: 0.6582
##################ITERATION #7 ****************************************
 epoch: 0, train_loss: 2.0509, test_loss: 1.7332, test_f1: 0.1767
 epoch: 1, train_loss: 1.0642, test_loss: 1.3422, test_f1: 0.3083
 epoch: 2, train_loss: 0.9835, test_loss: 1.0584, test_f1: 0.4586
 epoch: 3, train_loss: 0.9641, test_loss: 0.9551, test_f1: 0.5496
 epoch: 4, train_loss: 0.9436, test_loss: 0.9238, test_f1: 0.5298
 epoch: 5, train_loss: 0.9326, test_loss: 0.9724, test_f1: 0.5329
 epoch: 6, train_loss: 0.9237, test_loss: 1.0573, test_f1: 0.5259
 epoch: 7, train_loss: 0.8952, test_loss: 1.0917, test_f1: 0.5462
 epoch: 8, train_loss: 0.8978, test_loss: 1.0316, test_f1: 0.5404
 epoch: 9, train_loss: 0.8718, test_loss: 0.8801, test_f1: 0.5717
 epoch: 10, train_loss: 0.8472, test_loss: 0.8542, test_f1: 0.5532
 epoch: 11, train_loss: 0.8409, test_loss: 0.9727, test_f1: 0.6123
 epoch: 12, train_loss: 0.8240, test_loss: 0.8431, test_f1: 0.6049
 epoch: 13, train_loss: 0.8158, test_loss: 0.8358, test_f1: 0.5893
 epoch: 14, train_loss: 0.7986, test_loss: 0.9777, test_f1: 0.5803
 epoch: 15, train_loss: 0.7982, test_loss: 0.8877, test_f1: 0.5857
 epoch: 16, train_loss: 0.8217, test_loss: 0.8915, test_f1: 0.5849
 epoch: 17, train_loss: 0.7798, test_loss: 0.8864, test_f1: 0.5698
 epoch: 18, train_loss: 0.7930, test_loss: 0.9682, test_f1: 0.5808
 epoch: 19, train_loss: 0.7711, test_loss: 0.8232, test_f1: 0.6389
 epoch: 20, train_loss: 0.7430, test_loss: 0.8145, test_f1: 0.6507
 epoch: 21, train_loss: 0.7421, test_loss: 0.8369, test_f1: 0.6214
 epoch: 22, train_loss: 0.7506, test_loss: 0.9863, test_f1: 0.5656
 epoch: 23, train_loss: 0.7308, test_loss: 0.8828, test_f1: 0.6374
 epoch: 24, train_loss: 0.7308, test_loss: 0.8219, test_f1: 0.6567
 epoch: 25, train_loss: 0.7597, test_loss: 0.8373, test_f1: 0.6464
 epoch: 26, train_loss: 0.7245, test_loss: 0.8690, test_f1: 0.6524
 epoch: 27, train_loss: 0.7091, test_loss: 0.9056, test_f1: 0.6267
 epoch: 28, train_loss: 0.6988, test_loss: 0.7753, test_f1: 0.6686
 epoch: 29, train_loss: 0.6883, test_loss: 0.8793, test_f1: 0.6245
 epoch: 30, train_loss: 0.6977, test_loss: 0.8813, test_f1: 0.6234
 epoch: 31, train_loss: 0.6695, test_loss: 0.8355, test_f1: 0.6354
 epoch: 32, train_loss: 0.6401, test_loss: 0.7834, test_f1: 0.6350
 epoch: 33, train_loss: 0.6485, test_loss: 0.8742, test_f1: 0.6004
 epoch: 34, train_loss: 0.6662, test_loss: 0.8328, test_f1: 0.6618
 epoch: 35, train_loss: 0.6438, test_loss: 0.8282, test_f1: 0.6025
 epoch: 36, train_loss: 0.6559, test_loss: 0.8032, test_f1: 0.6378
 epoch: 37, train_loss: 0.6639, test_loss: 0.9460, test_f1: 0.6379
 epoch: 38, train_loss: 0.6629, test_loss: 0.8565, test_f1: 0.6561
 epoch: 39, train_loss: 0.6271, test_loss: 0.7772, test_f1: 0.6591
 epoch: 40, train_loss: 0.6175, test_loss: 0.8151, test_f1: 0.6069
 epoch: 41, train_loss: 0.6075, test_loss: 0.8186, test_f1: 0.6544
 epoch: 42, train_loss: 0.6061, test_loss: 0.9745, test_f1: 0.6437
 epoch: 43, train_loss: 0.5818, test_loss: 0.9913, test_f1: 0.6179
 epoch: 44, train_loss: 0.5762, test_loss: 0.8991, test_f1: 0.6604
 epoch: 45, train_loss: 0.5869, test_loss: 0.8342, test_f1: 0.6322
 epoch: 46, train_loss: 0.5679, test_loss: 0.9265, test_f1: 0.6665
 epoch: 47, train_loss: 0.5838, test_loss: 0.7462, test_f1: 0.6605
 epoch: 48, train_loss: 0.5679, test_loss: 0.8901, test_f1: 0.6457
 epoch: 49, train_loss: 0.5416, test_loss: 0.9470, test_f1: 0.5782
 epoch: 50, train_loss: 0.5659, test_loss: 0.9156, test_f1: 0.6363
 epoch: 51, train_loss: 0.5341, test_loss: 0.8360, test_f1: 0.6444
 epoch: 52, train_loss: 0.4764, test_loss: 0.8767, test_f1: 0.6430
 epoch: 53, train_loss: 0.4649, test_loss: 0.8703, test_f1: 0.6745
 epoch: 54, train_loss: 0.4564, test_loss: 0.9101, test_f1: 0.6703
 epoch: 55, train_loss: 0.4592, test_loss: 0.9060, test_f1: 0.6745
 epoch: 56, train_loss: 0.4321, test_loss: 0.9294, test_f1: 0.6693
 epoch: 57, train_loss: 0.4435, test_loss: 1.0338, test_f1: 0.6311
 epoch: 58, train_loss: 0.4308, test_loss: 0.9264, test_f1: 0.6543
 epoch: 59, train_loss: 0.4188, test_loss: 0.9370, test_f1: 0.6454
 epoch: 60, train_loss: 0.4026, test_loss: 0.9093, test_f1: 0.6539
 epoch: 61, train_loss: 0.4064, test_loss: 1.0198, test_f1: 0.6755
 epoch: 62, train_loss: 0.4126, test_loss: 1.0079, test_f1: 0.6402
 epoch: 63, train_loss: 0.4012, test_loss: 1.0939, test_f1: 0.6675
 epoch: 64, train_loss: 0.4023, test_loss: 0.9578, test_f1: 0.6514
 epoch: 65, train_loss: 0.3940, test_loss: 0.8907, test_f1: 0.6795
 epoch: 66, train_loss: 0.3805, test_loss: 0.9986, test_f1: 0.6851
 epoch: 67, train_loss: 0.3845, test_loss: 0.9162, test_f1: 0.6296
 epoch: 68, train_loss: 0.3766, test_loss: 0.9846, test_f1: 0.6487
 epoch: 69, train_loss: 0.4029, test_loss: 1.2271, test_f1: 0.5983
 epoch: 70, train_loss: 0.3570, test_loss: 1.1596, test_f1: 0.6400
 epoch: 71, train_loss: 0.3565, test_loss: 1.0493, test_f1: 0.6811
 epoch: 72, train_loss: 0.3521, test_loss: 1.0375, test_f1: 0.6646
 epoch: 73, train_loss: 0.3422, test_loss: 1.0511, test_f1: 0.6793
 epoch: 74, train_loss: 0.3493, test_loss: 1.3516, test_f1: 0.6412
 epoch: 75, train_loss: 0.3675, test_loss: 0.9759, test_f1: 0.6757
 epoch: 76, train_loss: 0.3629, test_loss: 1.0059, test_f1: 0.6555
 epoch: 77, train_loss: 0.3699, test_loss: 1.3050, test_f1: 0.6301
 epoch: 78, train_loss: 0.3510, test_loss: 1.0524, test_f1: 0.6872
 epoch: 79, train_loss: 0.3212, test_loss: 1.0686, test_f1: 0.6815
 epoch: 80, train_loss: 0.3352, test_loss: 1.4783, test_f1: 0.6415
 epoch: 81, train_loss: 0.3260, test_loss: 1.1982, test_f1: 0.6612
 epoch: 82, train_loss: 0.3213, test_loss: 1.4695, test_f1: 0.6475
 epoch: 83, train_loss: 0.3381, test_loss: 1.2359, test_f1: 0.6438
 epoch: 84, train_loss: 0.3326, test_loss: 1.2479, test_f1: 0.6849
 epoch: 85, train_loss: 0.3352, test_loss: 1.6544, test_f1: 0.5815
 epoch: 86, train_loss: 0.3564, test_loss: 1.2548, test_f1: 0.6789
 epoch: 87, train_loss: 0.3514, test_loss: 1.3769, test_f1: 0.6178
 epoch: 88, train_loss: 0.3266, test_loss: 1.2043, test_f1: 0.6666
 epoch: 89, train_loss: 0.3246, test_loss: 1.0011, test_f1: 0.6954
 epoch: 90, train_loss: 0.3098, test_loss: 1.3205, test_f1: 0.6785
 epoch: 91, train_loss: 0.3148, test_loss: 1.2154, test_f1: 0.6759
 epoch: 92, train_loss: 0.3069, test_loss: 1.3170, test_f1: 0.6298
 epoch: 93, train_loss: 0.2930, test_loss: 1.3631, test_f1: 0.6563
 epoch: 94, train_loss: 0.3144, test_loss: 1.1914, test_f1: 0.6568
 epoch: 95, train_loss: 0.3164, test_loss: 1.1776, test_f1: 0.6618
 epoch: 96, train_loss: 0.3216, test_loss: 1.3263, test_f1: 0.6480
 epoch: 97, train_loss: 0.2940, test_loss: 1.1963, test_f1: 0.7063
 epoch: 98, train_loss: 0.2951, test_loss: 1.3504, test_f1: 0.6670
 epoch: 99, train_loss: 0.2659, test_loss: 1.3578, test_f1: 0.6734
##################ITERATION #8 ****************************************
 epoch: 0, train_loss: 1.6324, test_loss: 1.7847, test_f1: 0.2270
 epoch: 1, train_loss: 1.0302, test_loss: 1.2827, test_f1: 0.3266
 epoch: 2, train_loss: 0.9930, test_loss: 0.9664, test_f1: 0.4815
 epoch: 3, train_loss: 0.9656, test_loss: 0.9995, test_f1: 0.4129
 epoch: 4, train_loss: 0.9531, test_loss: 1.0241, test_f1: 0.4908
 epoch: 5, train_loss: 0.9313, test_loss: 0.9134, test_f1: 0.4790
 epoch: 6, train_loss: 0.9205, test_loss: 0.9632, test_f1: 0.4886
 epoch: 7, train_loss: 0.8989, test_loss: 0.9680, test_f1: 0.4782
 epoch: 8, train_loss: 0.8765, test_loss: 0.9553, test_f1: 0.5179
 epoch: 9, train_loss: 0.8973, test_loss: 1.0094, test_f1: 0.4930
 epoch: 10, train_loss: 0.8935, test_loss: 0.9869, test_f1: 0.4718
 epoch: 11, train_loss: 0.8884, test_loss: 0.9717, test_f1: 0.4797
 epoch: 12, train_loss: 0.8611, test_loss: 1.0547, test_f1: 0.4829
 epoch: 13, train_loss: 0.8544, test_loss: 0.9519, test_f1: 0.4807
 epoch: 14, train_loss: 0.8396, test_loss: 0.8921, test_f1: 0.5284
 epoch: 15, train_loss: 0.8135, test_loss: 1.2009, test_f1: 0.5202
 epoch: 16, train_loss: 0.8238, test_loss: 0.9496, test_f1: 0.5056
 epoch: 17, train_loss: 0.8222, test_loss: 1.0299, test_f1: 0.5161
 epoch: 18, train_loss: 0.8265, test_loss: 1.0545, test_f1: 0.5466
 epoch: 19, train_loss: 0.8001, test_loss: 1.0293, test_f1: 0.5071
 epoch: 20, train_loss: 0.7694, test_loss: 0.9196, test_f1: 0.5294
 epoch: 21, train_loss: 0.7742, test_loss: 0.9976, test_f1: 0.4964
 epoch: 22, train_loss: 0.7573, test_loss: 1.6030, test_f1: 0.4188
 epoch: 23, train_loss: 0.7680, test_loss: 0.7986, test_f1: 0.5777
 epoch: 24, train_loss: 0.7334, test_loss: 0.9631, test_f1: 0.5877
 epoch: 25, train_loss: 0.7378, test_loss: 0.9863, test_f1: 0.5596
 epoch: 26, train_loss: 0.7322, test_loss: 1.0084, test_f1: 0.5563
 epoch: 27, train_loss: 0.7311, test_loss: 1.0549, test_f1: 0.5555
 epoch: 28, train_loss: 0.6895, test_loss: 0.9473, test_f1: 0.5601
 epoch: 29, train_loss: 0.6889, test_loss: 0.8019, test_f1: 0.6000
 epoch: 30, train_loss: 0.6732, test_loss: 0.8800, test_f1: 0.5575
 epoch: 31, train_loss: 0.6619, test_loss: 0.8459, test_f1: 0.5914
 epoch: 32, train_loss: 0.6629, test_loss: 0.9530, test_f1: 0.5604
 epoch: 33, train_loss: 0.6617, test_loss: 0.9122, test_f1: 0.5429
 epoch: 34, train_loss: 0.6932, test_loss: 0.8483, test_f1: 0.5899
 epoch: 35, train_loss: 0.6816, test_loss: 0.8166, test_f1: 0.5830
 epoch: 36, train_loss: 0.6416, test_loss: 0.8852, test_f1: 0.5825
 epoch: 37, train_loss: 0.6318, test_loss: 0.8883, test_f1: 0.5789
 epoch: 38, train_loss: 0.6189, test_loss: 0.8171, test_f1: 0.6070
 epoch: 39, train_loss: 0.6243, test_loss: 1.1317, test_f1: 0.5052
 epoch: 40, train_loss: 0.5769, test_loss: 0.7821, test_f1: 0.6489
 epoch: 41, train_loss: 0.5869, test_loss: 0.8981, test_f1: 0.5967
 epoch: 42, train_loss: 0.5656, test_loss: 0.9007, test_f1: 0.6594
 epoch: 43, train_loss: 0.5938, test_loss: 0.9571, test_f1: 0.6231
 epoch: 44, train_loss: 0.5851, test_loss: 0.7725, test_f1: 0.6347
 epoch: 45, train_loss: 0.5767, test_loss: 0.8794, test_f1: 0.6210
 epoch: 46, train_loss: 0.5611, test_loss: 0.9029, test_f1: 0.6450
 epoch: 47, train_loss: 0.5421, test_loss: 1.0615, test_f1: 0.6035
 epoch: 48, train_loss: 0.5364, test_loss: 0.9567, test_f1: 0.6115
 epoch: 49, train_loss: 0.5493, test_loss: 1.2031, test_f1: 0.5619
 epoch: 50, train_loss: 0.5285, test_loss: 0.7564, test_f1: 0.6583
 epoch: 51, train_loss: 0.5036, test_loss: 0.8518, test_f1: 0.6457
 epoch: 52, train_loss: 0.4666, test_loss: 0.7745, test_f1: 0.6812
 epoch: 53, train_loss: 0.4440, test_loss: 0.8723, test_f1: 0.6498
 epoch: 54, train_loss: 0.4410, test_loss: 0.8479, test_f1: 0.6465
 epoch: 55, train_loss: 0.4319, test_loss: 0.7856, test_f1: 0.6598
 epoch: 56, train_loss: 0.4149, test_loss: 0.9375, test_f1: 0.6315
 epoch: 57, train_loss: 0.4106, test_loss: 0.7704, test_f1: 0.6768
 epoch: 58, train_loss: 0.3943, test_loss: 0.9097, test_f1: 0.6473
 epoch: 59, train_loss: 0.4102, test_loss: 0.9320, test_f1: 0.6460
 epoch: 60, train_loss: 0.4351, test_loss: 0.9674, test_f1: 0.6174
 epoch: 61, train_loss: 0.4261, test_loss: 0.8767, test_f1: 0.6619
 epoch: 62, train_loss: 0.3874, test_loss: 1.0077, test_f1: 0.6484
 epoch: 63, train_loss: 0.3702, test_loss: 1.0876, test_f1: 0.6241
 epoch: 64, train_loss: 0.3816, test_loss: 0.8821, test_f1: 0.6595
 epoch: 65, train_loss: 0.3629, test_loss: 1.0273, test_f1: 0.6376
 epoch: 66, train_loss: 0.3762, test_loss: 1.0899, test_f1: 0.6477
 epoch: 67, train_loss: 0.3955, test_loss: 1.0949, test_f1: 0.6465
 epoch: 68, train_loss: 0.3920, test_loss: 0.8352, test_f1: 0.6818
 epoch: 69, train_loss: 0.3635, test_loss: 0.9927, test_f1: 0.6297
 epoch: 70, train_loss: 0.3829, test_loss: 1.0155, test_f1: 0.6483
 epoch: 71, train_loss: 0.3909, test_loss: 1.0827, test_f1: 0.6601
 epoch: 72, train_loss: 0.3730, test_loss: 1.0452, test_f1: 0.6513
 epoch: 73, train_loss: 0.3612, test_loss: 0.9526, test_f1: 0.6356
 epoch: 74, train_loss: 0.3378, test_loss: 1.4137, test_f1: 0.6162
 epoch: 75, train_loss: 0.3357, test_loss: 1.1300, test_f1: 0.6462
 epoch: 76, train_loss: 0.3305, test_loss: 1.2991, test_f1: 0.6187
 epoch: 77, train_loss: 0.3262, test_loss: 0.9586, test_f1: 0.6612
 epoch: 78, train_loss: 0.3335, test_loss: 1.1576, test_f1: 0.6543
 epoch: 79, train_loss: 0.3441, test_loss: 1.0292, test_f1: 0.6427
 epoch: 80, train_loss: 0.3242, test_loss: 1.1577, test_f1: 0.6372
 epoch: 81, train_loss: 0.3208, test_loss: 0.9392, test_f1: 0.6538
 epoch: 82, train_loss: 0.3179, test_loss: 1.2659, test_f1: 0.6478
 epoch: 83, train_loss: 0.3173, test_loss: 1.3942, test_f1: 0.6275
 epoch: 84, train_loss: 0.3047, test_loss: 1.0288, test_f1: 0.6618
 epoch: 85, train_loss: 0.3170, test_loss: 1.2844, test_f1: 0.6316
 epoch: 86, train_loss: 0.3122, test_loss: 1.1467, test_f1: 0.6275
 epoch: 87, train_loss: 0.2994, test_loss: 1.0824, test_f1: 0.6479
 epoch: 88, train_loss: 0.2905, test_loss: 1.1054, test_f1: 0.6526
 epoch: 89, train_loss: 0.2971, test_loss: 1.1108, test_f1: 0.6610
 epoch: 90, train_loss: 0.2971, test_loss: 1.3992, test_f1: 0.6100
 epoch: 91, train_loss: 0.2916, test_loss: 1.2687, test_f1: 0.6450
 epoch: 92, train_loss: 0.2815, test_loss: 1.3953, test_f1: 0.6030
 epoch: 93, train_loss: 0.3029, test_loss: 1.1903, test_f1: 0.6274
 epoch: 94, train_loss: 0.2835, test_loss: 1.2733, test_f1: 0.6337
 epoch: 95, train_loss: 0.2745, test_loss: 1.1297, test_f1: 0.6501
 epoch: 96, train_loss: 0.2995, test_loss: 1.1596, test_f1: 0.6413
 epoch: 97, train_loss: 0.2865, test_loss: 1.1455, test_f1: 0.6380
 epoch: 98, train_loss: 0.2932, test_loss: 1.1517, test_f1: 0.6430
 epoch: 99, train_loss: 0.3014, test_loss: 1.2902, test_f1: 0.6493
##################ITERATION #9 ****************************************
 epoch: 0, train_loss: 1.5549, test_loss: 1.8096, test_f1: 0.2271
 epoch: 1, train_loss: 1.0383, test_loss: 1.1521, test_f1: 0.3733
 epoch: 2, train_loss: 0.9898, test_loss: 1.0182, test_f1: 0.4259
 epoch: 3, train_loss: 0.9637, test_loss: 1.0983, test_f1: 0.4183
 epoch: 4, train_loss: 0.9422, test_loss: 0.9936, test_f1: 0.4806
 epoch: 5, train_loss: 0.9204, test_loss: 0.9994, test_f1: 0.4653
 epoch: 6, train_loss: 0.9207, test_loss: 0.9035, test_f1: 0.4963
 epoch: 7, train_loss: 0.9045, test_loss: 0.9061, test_f1: 0.4809
 epoch: 8, train_loss: 0.8965, test_loss: 0.9979, test_f1: 0.4735
 epoch: 9, train_loss: 0.8797, test_loss: 0.8813, test_f1: 0.5352
 epoch: 10, train_loss: 0.8857, test_loss: 0.9870, test_f1: 0.4993
 epoch: 11, train_loss: 0.8585, test_loss: 0.9546, test_f1: 0.5341
 epoch: 12, train_loss: 0.8344, test_loss: 0.9155, test_f1: 0.5649
 epoch: 13, train_loss: 0.8351, test_loss: 0.9461, test_f1: 0.5370
 epoch: 14, train_loss: 0.8507, test_loss: 0.9221, test_f1: 0.5606
 epoch: 15, train_loss: 0.8237, test_loss: 0.8314, test_f1: 0.5967
 epoch: 16, train_loss: 0.8866, test_loss: 1.1772, test_f1: 0.5381
 epoch: 17, train_loss: 0.8191, test_loss: 0.8932, test_f1: 0.5629
 epoch: 18, train_loss: 0.7998, test_loss: 0.8358, test_f1: 0.5805
 epoch: 19, train_loss: 0.7917, test_loss: 0.9249, test_f1: 0.5458
 epoch: 20, train_loss: 0.7822, test_loss: 0.8758, test_f1: 0.5426
 epoch: 21, train_loss: 0.7612, test_loss: 0.8384, test_f1: 0.5931
 epoch: 22, train_loss: 0.7425, test_loss: 0.7841, test_f1: 0.6204
 epoch: 23, train_loss: 0.7325, test_loss: 0.7844, test_f1: 0.6324
 epoch: 24, train_loss: 0.7146, test_loss: 0.7729, test_f1: 0.5926
 epoch: 25, train_loss: 0.7063, test_loss: 0.9161, test_f1: 0.5662
 epoch: 26, train_loss: 0.7291, test_loss: 0.8733, test_f1: 0.5509
 epoch: 27, train_loss: 0.7321, test_loss: 1.2018, test_f1: 0.5476
 epoch: 28, train_loss: 0.7200, test_loss: 0.9815, test_f1: 0.6411
 epoch: 29, train_loss: 0.7107, test_loss: 0.8897, test_f1: 0.5807
 epoch: 30, train_loss: 0.6988, test_loss: 0.8203, test_f1: 0.6068
 epoch: 31, train_loss: 0.6637, test_loss: 0.8877, test_f1: 0.5768
 epoch: 32, train_loss: 0.6379, test_loss: 1.1504, test_f1: 0.5431
 epoch: 33, train_loss: 0.6255, test_loss: 1.2350, test_f1: 0.4489
 epoch: 34, train_loss: 0.6537, test_loss: 1.2118, test_f1: 0.5666
 epoch: 35, train_loss: 0.6196, test_loss: 0.9678, test_f1: 0.5679
 epoch: 36, train_loss: 0.6256, test_loss: 0.7903, test_f1: 0.6374
 epoch: 37, train_loss: 0.6354, test_loss: 0.9222, test_f1: 0.6218
 epoch: 38, train_loss: 0.6333, test_loss: 0.7576, test_f1: 0.6309
 epoch: 39, train_loss: 0.6381, test_loss: 0.8632, test_f1: 0.6119
 epoch: 40, train_loss: 0.5991, test_loss: 0.8545, test_f1: 0.6348
 epoch: 41, train_loss: 0.5927, test_loss: 1.4506, test_f1: 0.5262
 epoch: 42, train_loss: 0.5543, test_loss: 0.8075, test_f1: 0.6633
 epoch: 43, train_loss: 0.5608, test_loss: 0.9172, test_f1: 0.6502
 epoch: 44, train_loss: 0.5662, test_loss: 0.8053, test_f1: 0.6470
 epoch: 45, train_loss: 0.5778, test_loss: 1.0860, test_f1: 0.6245
 epoch: 46, train_loss: 0.5595, test_loss: 0.8815, test_f1: 0.6433
 epoch: 47, train_loss: 0.5408, test_loss: 0.9541, test_f1: 0.6095
 epoch: 48, train_loss: 0.5666, test_loss: 0.9038, test_f1: 0.6450
 epoch: 49, train_loss: 0.5683, test_loss: 0.9458, test_f1: 0.6196
 epoch: 50, train_loss: 0.5389, test_loss: 0.8681, test_f1: 0.6224
 epoch: 51, train_loss: 0.4892, test_loss: 0.7199, test_f1: 0.6738
 epoch: 52, train_loss: 0.4649, test_loss: 0.7863, test_f1: 0.6538
 epoch: 53, train_loss: 0.4406, test_loss: 0.8403, test_f1: 0.6531
 epoch: 54, train_loss: 0.4461, test_loss: 0.8153, test_f1: 0.6617
 epoch: 55, train_loss: 0.4448, test_loss: 0.9026, test_f1: 0.6525
 epoch: 56, train_loss: 0.4261, test_loss: 0.8784, test_f1: 0.6749
 epoch: 57, train_loss: 0.4117, test_loss: 0.8047, test_f1: 0.6824
 epoch: 58, train_loss: 0.4325, test_loss: 0.9126, test_f1: 0.6672
 epoch: 59, train_loss: 0.4323, test_loss: 0.7910, test_f1: 0.6811
 epoch: 60, train_loss: 0.4019, test_loss: 0.8325, test_f1: 0.6626
 epoch: 61, train_loss: 0.4000, test_loss: 0.9410, test_f1: 0.6739
 epoch: 62, train_loss: 0.4135, test_loss: 0.7973, test_f1: 0.6735
 epoch: 63, train_loss: 0.3913, test_loss: 0.9465, test_f1: 0.6254
 epoch: 64, train_loss: 0.3939, test_loss: 1.0796, test_f1: 0.6634
 epoch: 65, train_loss: 0.3901, test_loss: 1.0164, test_f1: 0.6337
 epoch: 66, train_loss: 0.3848, test_loss: 0.8593, test_f1: 0.6549
 epoch: 67, train_loss: 0.3974, test_loss: 1.0402, test_f1: 0.6257
 epoch: 68, train_loss: 0.3803, test_loss: 1.0014, test_f1: 0.6743
 epoch: 69, train_loss: 0.3676, test_loss: 1.0168, test_f1: 0.6645
 epoch: 70, train_loss: 0.3596, test_loss: 1.0631, test_f1: 0.6205
 epoch: 71, train_loss: 0.3660, test_loss: 0.9599, test_f1: 0.6724
 epoch: 72, train_loss: 0.3821, test_loss: 1.0116, test_f1: 0.6747
 epoch: 73, train_loss: 0.3614, test_loss: 1.1154, test_f1: 0.6818
 epoch: 74, train_loss: 0.3787, test_loss: 0.9758, test_f1: 0.6678
 epoch: 75, train_loss: 0.3483, test_loss: 1.0142, test_f1: 0.6820
 epoch: 76, train_loss: 0.3516, test_loss: 0.9934, test_f1: 0.6972
 epoch: 77, train_loss: 0.3515, test_loss: 0.9980, test_f1: 0.6788
 epoch: 78, train_loss: 0.3319, test_loss: 0.9761, test_f1: 0.6749
 epoch: 79, train_loss: 0.3259, test_loss: 1.0091, test_f1: 0.6828
 epoch: 80, train_loss: 0.3288, test_loss: 0.9558, test_f1: 0.6814
 epoch: 81, train_loss: 0.3273, test_loss: 1.0604, test_f1: 0.6761
 epoch: 82, train_loss: 0.3038, test_loss: 1.1678, test_f1: 0.6330
 epoch: 83, train_loss: 0.3135, test_loss: 1.3807, test_f1: 0.6545
 epoch: 84, train_loss: 0.3116, test_loss: 1.0934, test_f1: 0.6581
 epoch: 85, train_loss: 0.3128, test_loss: 0.9776, test_f1: 0.6728
 epoch: 86, train_loss: 0.3266, test_loss: 1.2597, test_f1: 0.6137
 epoch: 87, train_loss: 0.3120, test_loss: 1.2219, test_f1: 0.6497
 epoch: 88, train_loss: 0.3065, test_loss: 1.0296, test_f1: 0.6602
 epoch: 89, train_loss: 0.3151, test_loss: 1.0546, test_f1: 0.6613
 epoch: 90, train_loss: 0.2969, test_loss: 0.9479, test_f1: 0.6879
 epoch: 91, train_loss: 0.3127, test_loss: 0.9723, test_f1: 0.6712
 epoch: 92, train_loss: 0.3149, test_loss: 1.1327, test_f1: 0.6578
 epoch: 93, train_loss: 0.2995, test_loss: 0.9739, test_f1: 0.6698
 epoch: 94, train_loss: 0.2955, test_loss: 0.9991, test_f1: 0.6884
 epoch: 95, train_loss: 0.2934, test_loss: 1.0690, test_f1: 0.6751
 epoch: 96, train_loss: 0.2895, test_loss: 0.9483, test_f1: 0.6705
 epoch: 97, train_loss: 0.2903, test_loss: 1.0849, test_f1: 0.6548
 epoch: 98, train_loss: 0.3029, test_loss: 1.2918, test_f1: 0.6333
 epoch: 99, train_loss: 0.3241, test_loss: 1.3730, test_f1: 0.6260

Training completed in 505.11 seconds
Best F1: 0.7063 at epoch 97
Mean F1 across iterations: 0.6944  0.0080
========================FINAL RESULTS================================
FEGIN weighted F1: 0.7063  0.0080
python main.py --data ltspice_examples --representation component_pin_net --model FEGIN --layers 5 --hiddens 128 --batch_size 256 --lr 0.01 --emb_size 512 --epochs 100 --save_appendix component_pin_net_L5_H128_BS256_LR0.01_E512 --no_val
-----



STDERR:
Processing...
Done!
  File "main.py", line 370, in <module>
    main()
  File "main.py", line 254, in main
    dataset = dataset_class(
  File "/home/philip/projects/ltspice_examples_code_repo/Circuit-Completion-Using-GNNs/component_classification_with_link_prediction_head/evaluation/FEGIN/kernel/circuit_datasets.py", line 15, in __init__
    self.data, self.slices = torch.load(self.processed_paths[0])
  File "/home/philip/.local/lib/python3.8/site-packages/torch/serialization.py", line 1040, in load
    warnings.warn(
  File "/usr/lib/python3.8/warnings.py", line 109, in _showwarnmsg
    sw(msg.message, msg.category, msg.filename, msg.lineno,
  File "main.py", line 47, in warn_with_traceback
    traceback.print_stack(file=log)
/home/philip/projects/ltspice_examples_code_repo/Circuit-Completion-Using-GNNs/component_classification_with_link_prediction_head/evaluation/FEGIN/kernel/circuit_datasets.py:15: FutureWarning: You are using `torch.load` with `weights_only=False` (the current default value), which uses the default pickle module implicitly. It is possible to construct malicious pickle data which will execute arbitrary code during unpickling (See https://github.com/pytorch/pytorch/blob/main/SECURITY.md#untrusted-models for more details). In a future release, the default value for `weights_only` will be flipped to `True`. This limits the functions that could be executed during unpickling. Arbitrary objects will no longer be allowed to be loaded via this mode unless they are explicitly allowlisted by the user via `torch.serialization.add_safe_globals`. We recommend you start setting `weights_only=True` for any use case where you don't have full control of the loaded file. Please open an issue on GitHub for any issues related to this experimental feature.
  self.data, self.slices = torch.load(self.processed_paths[0])
