STDOUT:
Results will be saved in /home/philip/projects/llm_inference_code_repo/Circuit-Completion-Using-GNNs/component_classification_with_link_prediction_head/evaluation/FEGIN/results/model_FEGIN_dataset_ltspice_examples
Command line input: python main.py --data ltspice_examples --representation component_net --model FEGIN --layers 4 --hiddens 128 --batch_size 64 --lr 0.001 --emb_size 128 --epochs 100 --save_appendix component_net_L4_H128_BS64_LR0.001_E128 --no_val
 is saved.
-----
ltspice_examples - FEGIN
Using 4 layers, 128 hidden units, h = 2
Loading component_net representation dataset
Loading component_net representation data...
Loaded 4404 examples (component_net)
saving path: data/processed/ltspice_examples_component_net_processed.pt
ENTERED
Training FEGIN on component_net representation
Train: 3558, Test: 846
##################ITERATION #0 ****************************************
 epoch: 0, train_loss: 1.2086, test_loss: 1.0503, test_f1: 0.4540
 epoch: 1, train_loss: 1.0058, test_loss: 0.9800, test_f1: 0.4703
 epoch: 2, train_loss: 0.9531, test_loss: 0.9902, test_f1: 0.4764
 epoch: 3, train_loss: 0.9095, test_loss: 0.8813, test_f1: 0.5520
 epoch: 4, train_loss: 0.8931, test_loss: 0.8972, test_f1: 0.5458
 epoch: 5, train_loss: 0.8754, test_loss: 1.0095, test_f1: 0.5316
 epoch: 6, train_loss: 0.8599, test_loss: 0.9160, test_f1: 0.5791
 epoch: 7, train_loss: 0.8425, test_loss: 0.9174, test_f1: 0.5890
 epoch: 8, train_loss: 0.8260, test_loss: 1.0863, test_f1: 0.5429
 epoch: 9, train_loss: 0.8040, test_loss: 0.9085, test_f1: 0.5791
 epoch: 10, train_loss: 0.8133, test_loss: 0.9863, test_f1: 0.5350
 epoch: 11, train_loss: 0.7942, test_loss: 0.9372, test_f1: 0.5611
 epoch: 12, train_loss: 0.7747, test_loss: 0.9761, test_f1: 0.6069
 epoch: 13, train_loss: 0.7486, test_loss: 1.0452, test_f1: 0.5595
 epoch: 14, train_loss: 0.7446, test_loss: 0.9351, test_f1: 0.6173
 epoch: 15, train_loss: 0.7425, test_loss: 0.9081, test_f1: 0.6229
 epoch: 16, train_loss: 0.7063, test_loss: 0.9771, test_f1: 0.5993
 epoch: 17, train_loss: 0.7038, test_loss: 0.9351, test_f1: 0.6351
 epoch: 18, train_loss: 0.7010, test_loss: 0.9562, test_f1: 0.6138
 epoch: 19, train_loss: 0.6852, test_loss: 0.9446, test_f1: 0.6510
 epoch: 20, train_loss: 0.6865, test_loss: 1.0446, test_f1: 0.6181
 epoch: 21, train_loss: 0.6632, test_loss: 0.9331, test_f1: 0.6544
 epoch: 22, train_loss: 0.6472, test_loss: 0.9579, test_f1: 0.6496
 epoch: 23, train_loss: 0.6498, test_loss: 0.9129, test_f1: 0.6188
 epoch: 24, train_loss: 0.6560, test_loss: 1.0316, test_f1: 0.6257
 epoch: 25, train_loss: 0.6297, test_loss: 0.9910, test_f1: 0.6483
 epoch: 26, train_loss: 0.6124, test_loss: 0.9355, test_f1: 0.6675
 epoch: 27, train_loss: 0.6110, test_loss: 0.9724, test_f1: 0.6377
 epoch: 28, train_loss: 0.5999, test_loss: 0.9898, test_f1: 0.6355
 epoch: 29, train_loss: 0.6076, test_loss: 0.9587, test_f1: 0.6679
 epoch: 30, train_loss: 0.5745, test_loss: 0.9926, test_f1: 0.6682
 epoch: 31, train_loss: 0.5791, test_loss: 1.0402, test_f1: 0.6369
 epoch: 32, train_loss: 0.5721, test_loss: 1.0300, test_f1: 0.6219
 epoch: 33, train_loss: 0.5526, test_loss: 0.9773, test_f1: 0.6662
 epoch: 34, train_loss: 0.5249, test_loss: 0.9957, test_f1: 0.6887
 epoch: 35, train_loss: 0.5229, test_loss: 1.0796, test_f1: 0.6738
 epoch: 36, train_loss: 0.5061, test_loss: 1.1783, test_f1: 0.6526
 epoch: 37, train_loss: 0.5327, test_loss: 1.1112, test_f1: 0.6239
 epoch: 38, train_loss: 0.4876, test_loss: 1.1428, test_f1: 0.6098
 epoch: 39, train_loss: 0.4766, test_loss: 1.1814, test_f1: 0.6811
 epoch: 40, train_loss: 0.4552, test_loss: 1.2534, test_f1: 0.6305
 epoch: 41, train_loss: 0.4736, test_loss: 1.2874, test_f1: 0.6182
 epoch: 42, train_loss: 0.4554, test_loss: 1.1781, test_f1: 0.6632
 epoch: 43, train_loss: 0.4634, test_loss: 1.2602, test_f1: 0.6513
 epoch: 44, train_loss: 0.4695, test_loss: 1.2510, test_f1: 0.6463
 epoch: 45, train_loss: 0.4176, test_loss: 1.2631, test_f1: 0.6597
 epoch: 46, train_loss: 0.4017, test_loss: 1.2656, test_f1: 0.6815
 epoch: 47, train_loss: 0.3966, test_loss: 1.4168, test_f1: 0.6414
 epoch: 48, train_loss: 0.4100, test_loss: 1.3112, test_f1: 0.6457
 epoch: 49, train_loss: 0.4027, test_loss: 1.3144, test_f1: 0.6353
 epoch: 50, train_loss: 0.3823, test_loss: 1.2565, test_f1: 0.6430
 epoch: 51, train_loss: 0.3669, test_loss: 1.3459, test_f1: 0.6575
 epoch: 52, train_loss: 0.3284, test_loss: 1.3498, test_f1: 0.6721
 epoch: 53, train_loss: 0.3112, test_loss: 1.4920, test_f1: 0.6475
 epoch: 54, train_loss: 0.3049, test_loss: 1.5807, test_f1: 0.6593
 epoch: 55, train_loss: 0.2995, test_loss: 1.6422, test_f1: 0.6474
 epoch: 56, train_loss: 0.2995, test_loss: 1.5677, test_f1: 0.6634
 epoch: 57, train_loss: 0.2927, test_loss: 1.5700, test_f1: 0.6647
 epoch: 58, train_loss: 0.2874, test_loss: 1.5385, test_f1: 0.6697
 epoch: 59, train_loss: 0.2703, test_loss: 1.7547, test_f1: 0.6490
 epoch: 60, train_loss: 0.2702, test_loss: 1.7314, test_f1: 0.6565
 epoch: 61, train_loss: 0.2733, test_loss: 1.8760, test_f1: 0.6694
 epoch: 62, train_loss: 0.2887, test_loss: 1.7982, test_f1: 0.6442
 epoch: 63, train_loss: 0.2728, test_loss: 1.7441, test_f1: 0.6628
 epoch: 64, train_loss: 0.2541, test_loss: 1.8308, test_f1: 0.6714
 epoch: 65, train_loss: 0.2475, test_loss: 1.7207, test_f1: 0.6816
 epoch: 66, train_loss: 0.2381, test_loss: 1.7865, test_f1: 0.6490
 epoch: 67, train_loss: 0.2414, test_loss: 1.6747, test_f1: 0.6730
 epoch: 68, train_loss: 0.2311, test_loss: 1.9554, test_f1: 0.6670
 epoch: 69, train_loss: 0.2414, test_loss: 1.8816, test_f1: 0.6692
 epoch: 70, train_loss: 0.2337, test_loss: 1.9744, test_f1: 0.6567
 epoch: 71, train_loss: 0.2180, test_loss: 1.8355, test_f1: 0.6678
 epoch: 72, train_loss: 0.2266, test_loss: 1.8875, test_f1: 0.6472
 epoch: 73, train_loss: 0.2305, test_loss: 1.9197, test_f1: 0.6446
 epoch: 74, train_loss: 0.2326, test_loss: 2.0382, test_f1: 0.6754
 epoch: 75, train_loss: 0.2134, test_loss: 2.0253, test_f1: 0.6355
 epoch: 76, train_loss: 0.2195, test_loss: 1.8382, test_f1: 0.6413
 epoch: 77, train_loss: 0.2260, test_loss: 1.9831, test_f1: 0.6567
 epoch: 78, train_loss: 0.1920, test_loss: 2.1527, test_f1: 0.6443
 epoch: 79, train_loss: 0.2161, test_loss: 2.0305, test_f1: 0.6534
 epoch: 80, train_loss: 0.2234, test_loss: 1.9086, test_f1: 0.6920
 epoch: 81, train_loss: 0.2000, test_loss: 2.0511, test_f1: 0.6524
 epoch: 82, train_loss: 0.2107, test_loss: 2.0337, test_f1: 0.6640
 epoch: 83, train_loss: 0.1929, test_loss: 2.0678, test_f1: 0.6814
 epoch: 84, train_loss: 0.1965, test_loss: 2.1791, test_f1: 0.6696
 epoch: 85, train_loss: 0.2049, test_loss: 2.2027, test_f1: 0.6398
 epoch: 86, train_loss: 0.1969, test_loss: 2.0296, test_f1: 0.6601
 epoch: 87, train_loss: 0.1950, test_loss: 2.1325, test_f1: 0.6388
 epoch: 88, train_loss: 0.1823, test_loss: 2.1343, test_f1: 0.6650
 epoch: 89, train_loss: 0.1839, test_loss: 2.1390, test_f1: 0.6626
 epoch: 90, train_loss: 0.1687, test_loss: 2.2248, test_f1: 0.6624
 epoch: 91, train_loss: 0.1853, test_loss: 2.4590, test_f1: 0.6351
 epoch: 92, train_loss: 0.1613, test_loss: 2.2246, test_f1: 0.6601
 epoch: 93, train_loss: 0.1824, test_loss: 2.2399, test_f1: 0.6707
 epoch: 94, train_loss: 0.1842, test_loss: 2.4124, test_f1: 0.6431
 epoch: 95, train_loss: 0.1903, test_loss: 2.1728, test_f1: 0.6668
 epoch: 96, train_loss: 0.1900, test_loss: 2.2531, test_f1: 0.6400
 epoch: 97, train_loss: 0.1796, test_loss: 2.3770, test_f1: 0.6367
 epoch: 98, train_loss: 0.1928, test_loss: 2.3920, test_f1: 0.6545
 epoch: 99, train_loss: 0.1788, test_loss: 2.3542, test_f1: 0.6556
##################ITERATION #1 ****************************************
 epoch: 0, train_loss: 1.1309, test_loss: 1.0262, test_f1: 0.4868
 epoch: 1, train_loss: 0.9873, test_loss: 0.9578, test_f1: 0.5164
 epoch: 2, train_loss: 0.9428, test_loss: 1.0091, test_f1: 0.5014
 epoch: 3, train_loss: 0.9191, test_loss: 0.9488, test_f1: 0.4971
 epoch: 4, train_loss: 0.8965, test_loss: 0.9256, test_f1: 0.5098
 epoch: 5, train_loss: 0.8772, test_loss: 0.9258, test_f1: 0.5217
 epoch: 6, train_loss: 0.8402, test_loss: 1.0170, test_f1: 0.5124
 epoch: 7, train_loss: 0.8527, test_loss: 0.9362, test_f1: 0.5822
 epoch: 8, train_loss: 0.8259, test_loss: 0.9581, test_f1: 0.5821
 epoch: 9, train_loss: 0.8243, test_loss: 0.9742, test_f1: 0.5853
 epoch: 10, train_loss: 0.7982, test_loss: 0.9500, test_f1: 0.5755
 epoch: 11, train_loss: 0.7835, test_loss: 0.9029, test_f1: 0.6121
 epoch: 12, train_loss: 0.7507, test_loss: 0.9298, test_f1: 0.6207
 epoch: 13, train_loss: 0.7514, test_loss: 0.9258, test_f1: 0.5987
 epoch: 14, train_loss: 0.7328, test_loss: 0.9645, test_f1: 0.6206
 epoch: 15, train_loss: 0.7353, test_loss: 0.9691, test_f1: 0.6167
 epoch: 16, train_loss: 0.7294, test_loss: 0.9606, test_f1: 0.6030
 epoch: 17, train_loss: 0.7040, test_loss: 0.9335, test_f1: 0.5899
 epoch: 18, train_loss: 0.6841, test_loss: 1.0070, test_f1: 0.6130
 epoch: 19, train_loss: 0.6770, test_loss: 0.9568, test_f1: 0.6376
 epoch: 20, train_loss: 0.6788, test_loss: 0.9558, test_f1: 0.6401
 epoch: 21, train_loss: 0.6638, test_loss: 1.0138, test_f1: 0.6542
 epoch: 22, train_loss: 0.6355, test_loss: 0.9808, test_f1: 0.5989
 epoch: 23, train_loss: 0.6408, test_loss: 0.9456, test_f1: 0.6078
 epoch: 24, train_loss: 0.6156, test_loss: 1.0778, test_f1: 0.5945
 epoch: 25, train_loss: 0.6348, test_loss: 0.8896, test_f1: 0.6296
 epoch: 26, train_loss: 0.5911, test_loss: 0.9482, test_f1: 0.6338
 epoch: 27, train_loss: 0.6124, test_loss: 1.0025, test_f1: 0.6177
 epoch: 28, train_loss: 0.5796, test_loss: 0.9722, test_f1: 0.6131
 epoch: 29, train_loss: 0.5712, test_loss: 0.9864, test_f1: 0.6546
 epoch: 30, train_loss: 0.5581, test_loss: 1.0095, test_f1: 0.6279
 epoch: 31, train_loss: 0.5311, test_loss: 1.0054, test_f1: 0.6745
 epoch: 32, train_loss: 0.5387, test_loss: 1.0363, test_f1: 0.6215
 epoch: 33, train_loss: 0.5478, test_loss: 1.0912, test_f1: 0.6261
 epoch: 34, train_loss: 0.5107, test_loss: 1.0826, test_f1: 0.6978
 epoch: 35, train_loss: 0.5154, test_loss: 1.1577, test_f1: 0.6565
 epoch: 36, train_loss: 0.5210, test_loss: 0.9784, test_f1: 0.6704
 epoch: 37, train_loss: 0.5098, test_loss: 1.0155, test_f1: 0.6598
 epoch: 38, train_loss: 0.5067, test_loss: 1.1888, test_f1: 0.6243
 epoch: 39, train_loss: 0.4927, test_loss: 1.0658, test_f1: 0.6418
 epoch: 40, train_loss: 0.4834, test_loss: 1.0706, test_f1: 0.6395
 epoch: 41, train_loss: 0.4786, test_loss: 1.0594, test_f1: 0.6675
 epoch: 42, train_loss: 0.4533, test_loss: 1.1911, test_f1: 0.6574
 epoch: 43, train_loss: 0.4362, test_loss: 1.1234, test_f1: 0.6609
 epoch: 44, train_loss: 0.4489, test_loss: 1.1563, test_f1: 0.6230
 epoch: 45, train_loss: 0.4228, test_loss: 1.1280, test_f1: 0.6434
 epoch: 46, train_loss: 0.4357, test_loss: 1.1499, test_f1: 0.6757
 epoch: 47, train_loss: 0.4149, test_loss: 1.2908, test_f1: 0.6272
 epoch: 48, train_loss: 0.4332, test_loss: 1.1890, test_f1: 0.6698
 epoch: 49, train_loss: 0.4072, test_loss: 1.2041, test_f1: 0.6547
 epoch: 50, train_loss: 0.3964, test_loss: 1.3628, test_f1: 0.6669
 epoch: 51, train_loss: 0.3428, test_loss: 1.2277, test_f1: 0.6812
 epoch: 52, train_loss: 0.3255, test_loss: 1.3242, test_f1: 0.6798
 epoch: 53, train_loss: 0.3165, test_loss: 1.3747, test_f1: 0.6709
 epoch: 54, train_loss: 0.3152, test_loss: 1.3272, test_f1: 0.6746
 epoch: 55, train_loss: 0.3047, test_loss: 1.4752, test_f1: 0.6684
 epoch: 56, train_loss: 0.2951, test_loss: 1.3842, test_f1: 0.6863
 epoch: 57, train_loss: 0.2885, test_loss: 1.3924, test_f1: 0.6984
 epoch: 58, train_loss: 0.2901, test_loss: 1.3175, test_f1: 0.6946
 epoch: 59, train_loss: 0.2731, test_loss: 1.4563, test_f1: 0.6852
 epoch: 60, train_loss: 0.2931, test_loss: 1.4972, test_f1: 0.6674
 epoch: 61, train_loss: 0.2641, test_loss: 1.4042, test_f1: 0.6769
 epoch: 62, train_loss: 0.2658, test_loss: 1.5252, test_f1: 0.6742
 epoch: 63, train_loss: 0.2737, test_loss: 1.5189, test_f1: 0.6710
 epoch: 64, train_loss: 0.2566, test_loss: 1.5796, test_f1: 0.6663
 epoch: 65, train_loss: 0.2405, test_loss: 1.5193, test_f1: 0.6938
 epoch: 66, train_loss: 0.2513, test_loss: 1.4829, test_f1: 0.6598
 epoch: 67, train_loss: 0.2542, test_loss: 1.6248, test_f1: 0.6684
 epoch: 68, train_loss: 0.2396, test_loss: 1.5607, test_f1: 0.7014
 epoch: 69, train_loss: 0.2366, test_loss: 1.7123, test_f1: 0.6545
 epoch: 70, train_loss: 0.2434, test_loss: 1.5374, test_f1: 0.6882
 epoch: 71, train_loss: 0.2382, test_loss: 1.5292, test_f1: 0.6754
 epoch: 72, train_loss: 0.2303, test_loss: 1.7420, test_f1: 0.6621
 epoch: 73, train_loss: 0.2592, test_loss: 1.5747, test_f1: 0.6930
 epoch: 74, train_loss: 0.2357, test_loss: 1.6269, test_f1: 0.6843
 epoch: 75, train_loss: 0.2214, test_loss: 1.5855, test_f1: 0.6778
 epoch: 76, train_loss: 0.2182, test_loss: 1.7210, test_f1: 0.6824
 epoch: 77, train_loss: 0.2128, test_loss: 1.6032, test_f1: 0.6797
 epoch: 78, train_loss: 0.2154, test_loss: 1.6696, test_f1: 0.6787
 epoch: 79, train_loss: 0.1989, test_loss: 1.7577, test_f1: 0.6687
 epoch: 80, train_loss: 0.2309, test_loss: 1.7435, test_f1: 0.6537
 epoch: 81, train_loss: 0.2137, test_loss: 1.7447, test_f1: 0.6720
 epoch: 82, train_loss: 0.2036, test_loss: 1.7908, test_f1: 0.6811
 epoch: 83, train_loss: 0.2022, test_loss: 1.8437, test_f1: 0.6688
 epoch: 84, train_loss: 0.2082, test_loss: 1.7120, test_f1: 0.6950
 epoch: 85, train_loss: 0.2011, test_loss: 1.7571, test_f1: 0.6771
 epoch: 86, train_loss: 0.1891, test_loss: 1.7453, test_f1: 0.6684
 epoch: 87, train_loss: 0.1820, test_loss: 1.7165, test_f1: 0.6733
 epoch: 88, train_loss: 0.1836, test_loss: 1.7450, test_f1: 0.6956
 epoch: 89, train_loss: 0.1900, test_loss: 1.8313, test_f1: 0.6743
 epoch: 90, train_loss: 0.1672, test_loss: 1.8997, test_f1: 0.6712
 epoch: 91, train_loss: 0.1934, test_loss: 1.7447, test_f1: 0.6707
 epoch: 92, train_loss: 0.1795, test_loss: 1.7768, test_f1: 0.6834
 epoch: 93, train_loss: 0.1997, test_loss: 1.8842, test_f1: 0.6820
 epoch: 94, train_loss: 0.2207, test_loss: 1.8080, test_f1: 0.6587
 epoch: 95, train_loss: 0.1912, test_loss: 1.7394, test_f1: 0.6937
 epoch: 96, train_loss: 0.1860, test_loss: 1.8029, test_f1: 0.6684
 epoch: 97, train_loss: 0.1904, test_loss: 1.8587, test_f1: 0.6815
 epoch: 98, train_loss: 0.1923, test_loss: 1.8112, test_f1: 0.6726
 epoch: 99, train_loss: 0.1750, test_loss: 1.8076, test_f1: 0.6763
##################ITERATION #2 ****************************************
 epoch: 0, train_loss: 1.1750, test_loss: 1.0226, test_f1: 0.4794
 epoch: 1, train_loss: 0.9875, test_loss: 0.9509, test_f1: 0.5253
 epoch: 2, train_loss: 0.9324, test_loss: 0.9292, test_f1: 0.5453
 epoch: 3, train_loss: 0.9183, test_loss: 0.9606, test_f1: 0.5206
 epoch: 4, train_loss: 0.9014, test_loss: 0.9083, test_f1: 0.5637
 epoch: 5, train_loss: 0.8744, test_loss: 0.9219, test_f1: 0.5305
 epoch: 6, train_loss: 0.8706, test_loss: 0.9144, test_f1: 0.5907
 epoch: 7, train_loss: 0.8552, test_loss: 0.8993, test_f1: 0.5789
 epoch: 8, train_loss: 0.8282, test_loss: 0.8570, test_f1: 0.5767
 epoch: 9, train_loss: 0.8213, test_loss: 0.9519, test_f1: 0.5670
 epoch: 10, train_loss: 0.8123, test_loss: 0.9691, test_f1: 0.5120
 epoch: 11, train_loss: 0.7964, test_loss: 0.9266, test_f1: 0.5715
 epoch: 12, train_loss: 0.7939, test_loss: 0.9027, test_f1: 0.5845
 epoch: 13, train_loss: 0.7974, test_loss: 0.9835, test_f1: 0.5902
 epoch: 14, train_loss: 0.7659, test_loss: 0.9430, test_f1: 0.5845
 epoch: 15, train_loss: 0.7529, test_loss: 1.0375, test_f1: 0.5675
 epoch: 16, train_loss: 0.7517, test_loss: 0.9400, test_f1: 0.6152
 epoch: 17, train_loss: 0.7243, test_loss: 0.9002, test_f1: 0.5864
 epoch: 18, train_loss: 0.7409, test_loss: 0.9890, test_f1: 0.5561
 epoch: 19, train_loss: 0.7203, test_loss: 0.9745, test_f1: 0.6085
 epoch: 20, train_loss: 0.7103, test_loss: 1.0191, test_f1: 0.5939
 epoch: 21, train_loss: 0.6993, test_loss: 0.9814, test_f1: 0.6106
 epoch: 22, train_loss: 0.6840, test_loss: 0.8499, test_f1: 0.6250
 epoch: 23, train_loss: 0.6792, test_loss: 1.0121, test_f1: 0.5971
 epoch: 24, train_loss: 0.6732, test_loss: 0.9487, test_f1: 0.6076
 epoch: 25, train_loss: 0.6457, test_loss: 1.0614, test_f1: 0.5797
 epoch: 26, train_loss: 0.6587, test_loss: 0.9889, test_f1: 0.6356
 epoch: 27, train_loss: 0.6312, test_loss: 1.0336, test_f1: 0.6362
 epoch: 28, train_loss: 0.6495, test_loss: 0.9419, test_f1: 0.6387
 epoch: 29, train_loss: 0.6164, test_loss: 1.0174, test_f1: 0.6283
 epoch: 30, train_loss: 0.6187, test_loss: 0.9837, test_f1: 0.6518
 epoch: 31, train_loss: 0.6079, test_loss: 0.9565, test_f1: 0.6375
 epoch: 32, train_loss: 0.5962, test_loss: 1.0116, test_f1: 0.6152
 epoch: 33, train_loss: 0.5879, test_loss: 1.0755, test_f1: 0.6723
 epoch: 34, train_loss: 0.5743, test_loss: 1.1375, test_f1: 0.6439
 epoch: 35, train_loss: 0.5640, test_loss: 1.0289, test_f1: 0.6304
 epoch: 36, train_loss: 0.5545, test_loss: 1.1126, test_f1: 0.6601
 epoch: 37, train_loss: 0.5391, test_loss: 1.1216, test_f1: 0.6697
 epoch: 38, train_loss: 0.5347, test_loss: 1.0383, test_f1: 0.6484
 epoch: 39, train_loss: 0.5232, test_loss: 1.1168, test_f1: 0.6373
 epoch: 40, train_loss: 0.5012, test_loss: 1.1471, test_f1: 0.6368
 epoch: 41, train_loss: 0.4977, test_loss: 1.1908, test_f1: 0.6259
 epoch: 42, train_loss: 0.4954, test_loss: 1.1549, test_f1: 0.6321
 epoch: 43, train_loss: 0.4919, test_loss: 1.0856, test_f1: 0.5857
 epoch: 44, train_loss: 0.4702, test_loss: 1.1063, test_f1: 0.6483
 epoch: 45, train_loss: 0.4450, test_loss: 1.2130, test_f1: 0.6359
 epoch: 46, train_loss: 0.4793, test_loss: 1.2322, test_f1: 0.6341
 epoch: 47, train_loss: 0.4618, test_loss: 1.1841, test_f1: 0.6490
 epoch: 48, train_loss: 0.4737, test_loss: 1.1058, test_f1: 0.6483
 epoch: 49, train_loss: 0.4402, test_loss: 1.2010, test_f1: 0.6487
 epoch: 50, train_loss: 0.4475, test_loss: 1.1980, test_f1: 0.6336
 epoch: 51, train_loss: 0.4044, test_loss: 1.2164, test_f1: 0.6470
 epoch: 52, train_loss: 0.3595, test_loss: 1.2654, test_f1: 0.6537
 epoch: 53, train_loss: 0.3505, test_loss: 1.3484, test_f1: 0.6413
 epoch: 54, train_loss: 0.3426, test_loss: 1.3361, test_f1: 0.6589
 epoch: 55, train_loss: 0.3278, test_loss: 1.3984, test_f1: 0.6738
 epoch: 56, train_loss: 0.3447, test_loss: 1.4137, test_f1: 0.6564
 epoch: 57, train_loss: 0.3102, test_loss: 1.4422, test_f1: 0.6482
 epoch: 58, train_loss: 0.3214, test_loss: 1.4125, test_f1: 0.6458
 epoch: 59, train_loss: 0.3100, test_loss: 1.3706, test_f1: 0.6523
 epoch: 60, train_loss: 0.2936, test_loss: 1.3969, test_f1: 0.6653
 epoch: 61, train_loss: 0.3120, test_loss: 1.4089, test_f1: 0.6487
 epoch: 62, train_loss: 0.3008, test_loss: 1.5475, test_f1: 0.6429
 epoch: 63, train_loss: 0.2863, test_loss: 1.5402, test_f1: 0.6515
 epoch: 64, train_loss: 0.3051, test_loss: 1.4018, test_f1: 0.6435
 epoch: 65, train_loss: 0.2888, test_loss: 1.3936, test_f1: 0.6152
 epoch: 66, train_loss: 0.2771, test_loss: 1.5042, test_f1: 0.6491
 epoch: 67, train_loss: 0.2560, test_loss: 1.5210, test_f1: 0.6439
 epoch: 68, train_loss: 0.2524, test_loss: 1.5569, test_f1: 0.6229
 epoch: 69, train_loss: 0.2575, test_loss: 1.4535, test_f1: 0.6523
 epoch: 70, train_loss: 0.2670, test_loss: 1.6768, test_f1: 0.6438
 epoch: 71, train_loss: 0.2784, test_loss: 1.8470, test_f1: 0.6043
 epoch: 72, train_loss: 0.2781, test_loss: 1.4912, test_f1: 0.6628
 epoch: 73, train_loss: 0.2780, test_loss: 1.4674, test_f1: 0.6362
 epoch: 74, train_loss: 0.2650, test_loss: 1.6751, test_f1: 0.6385
 epoch: 75, train_loss: 0.2419, test_loss: 1.6258, test_f1: 0.6368
 epoch: 76, train_loss: 0.2371, test_loss: 1.6642, test_f1: 0.6466
 epoch: 77, train_loss: 0.2393, test_loss: 1.6613, test_f1: 0.6378
 epoch: 78, train_loss: 0.2356, test_loss: 1.6524, test_f1: 0.6452
 epoch: 79, train_loss: 0.2353, test_loss: 1.6414, test_f1: 0.6295
 epoch: 80, train_loss: 0.2389, test_loss: 1.6400, test_f1: 0.6261
 epoch: 81, train_loss: 0.2240, test_loss: 1.5809, test_f1: 0.6460
 epoch: 82, train_loss: 0.2228, test_loss: 1.7558, test_f1: 0.6578
 epoch: 83, train_loss: 0.2233, test_loss: 1.8701, test_f1: 0.6249
 epoch: 84, train_loss: 0.2024, test_loss: 1.9193, test_f1: 0.6418
 epoch: 85, train_loss: 0.2158, test_loss: 1.8137, test_f1: 0.6385
 epoch: 86, train_loss: 0.2206, test_loss: 1.9316, test_f1: 0.6373
 epoch: 87, train_loss: 0.2212, test_loss: 2.0366, test_f1: 0.6172
 epoch: 88, train_loss: 0.2589, test_loss: 1.6359, test_f1: 0.6471
 epoch: 89, train_loss: 0.2144, test_loss: 1.7056, test_f1: 0.6378
 epoch: 90, train_loss: 0.2198, test_loss: 1.8079, test_f1: 0.6406
 epoch: 91, train_loss: 0.1986, test_loss: 1.8751, test_f1: 0.6307
 epoch: 92, train_loss: 0.2101, test_loss: 1.8836, test_f1: 0.6448
 epoch: 93, train_loss: 0.2031, test_loss: 1.9062, test_f1: 0.6294
 epoch: 94, train_loss: 0.2029, test_loss: 1.8668, test_f1: 0.6613
 epoch: 95, train_loss: 0.2026, test_loss: 1.8172, test_f1: 0.6545
 epoch: 96, train_loss: 0.2150, test_loss: 1.7354, test_f1: 0.6373
 epoch: 97, train_loss: 0.1984, test_loss: 1.8025, test_f1: 0.6404
 epoch: 98, train_loss: 0.1839, test_loss: 1.8312, test_f1: 0.6471
 epoch: 99, train_loss: 0.2002, test_loss: 1.9179, test_f1: 0.6456
##################ITERATION #3 ****************************************
 epoch: 0, train_loss: 1.2202, test_loss: 0.9728, test_f1: 0.4643
 epoch: 1, train_loss: 0.9803, test_loss: 0.9515, test_f1: 0.4765
 epoch: 2, train_loss: 0.9487, test_loss: 0.9610, test_f1: 0.4810
 epoch: 3, train_loss: 0.9248, test_loss: 0.9188, test_f1: 0.5174
 epoch: 4, train_loss: 0.8925, test_loss: 0.9235, test_f1: 0.5304
 epoch: 5, train_loss: 0.8835, test_loss: 0.9577, test_f1: 0.5069
 epoch: 6, train_loss: 0.8586, test_loss: 0.9083, test_f1: 0.5095
 epoch: 7, train_loss: 0.8491, test_loss: 0.9552, test_f1: 0.5348
 epoch: 8, train_loss: 0.8393, test_loss: 0.9493, test_f1: 0.5102
 epoch: 9, train_loss: 0.8134, test_loss: 0.9387, test_f1: 0.5582
 epoch: 10, train_loss: 0.8073, test_loss: 1.0003, test_f1: 0.5425
 epoch: 11, train_loss: 0.7972, test_loss: 0.9732, test_f1: 0.5586
 epoch: 12, train_loss: 0.7786, test_loss: 0.9853, test_f1: 0.5452
 epoch: 13, train_loss: 0.7821, test_loss: 0.8791, test_f1: 0.5583
 epoch: 14, train_loss: 0.7632, test_loss: 0.9847, test_f1: 0.5213
 epoch: 15, train_loss: 0.7545, test_loss: 0.9053, test_f1: 0.5929
 epoch: 16, train_loss: 0.7483, test_loss: 0.8674, test_f1: 0.6145
 epoch: 17, train_loss: 0.7271, test_loss: 0.9849, test_f1: 0.5951
 epoch: 18, train_loss: 0.7299, test_loss: 0.9600, test_f1: 0.6179
 epoch: 19, train_loss: 0.7192, test_loss: 0.9397, test_f1: 0.5403
 epoch: 20, train_loss: 0.6909, test_loss: 0.9760, test_f1: 0.5627
 epoch: 21, train_loss: 0.6863, test_loss: 0.9464, test_f1: 0.5805
 epoch: 22, train_loss: 0.6834, test_loss: 0.9014, test_f1: 0.6091
 epoch: 23, train_loss: 0.6600, test_loss: 0.9601, test_f1: 0.5853
 epoch: 24, train_loss: 0.6670, test_loss: 1.0067, test_f1: 0.5732
 epoch: 25, train_loss: 0.6532, test_loss: 0.9782, test_f1: 0.5948
 epoch: 26, train_loss: 0.6319, test_loss: 1.0611, test_f1: 0.5818
 epoch: 27, train_loss: 0.6679, test_loss: 0.8751, test_f1: 0.6081
 epoch: 28, train_loss: 0.6305, test_loss: 0.8991, test_f1: 0.6546
 epoch: 29, train_loss: 0.6198, test_loss: 0.8946, test_f1: 0.5700
 epoch: 30, train_loss: 0.6346, test_loss: 1.2622, test_f1: 0.5616
 epoch: 31, train_loss: 0.6068, test_loss: 0.9436, test_f1: 0.6350
 epoch: 32, train_loss: 0.5924, test_loss: 1.0104, test_f1: 0.5999
 epoch: 33, train_loss: 0.5620, test_loss: 1.0401, test_f1: 0.6351
 epoch: 34, train_loss: 0.5754, test_loss: 1.0613, test_f1: 0.6036
 epoch: 35, train_loss: 0.5485, test_loss: 1.0083, test_f1: 0.5976
 epoch: 36, train_loss: 0.5508, test_loss: 1.0929, test_f1: 0.5969
 epoch: 37, train_loss: 0.5627, test_loss: 1.2370, test_f1: 0.5928
 epoch: 38, train_loss: 0.5356, test_loss: 1.0242, test_f1: 0.6370
 epoch: 39, train_loss: 0.5338, test_loss: 1.0594, test_f1: 0.6131
 epoch: 40, train_loss: 0.5393, test_loss: 1.0418, test_f1: 0.6465
 epoch: 41, train_loss: 0.5136, test_loss: 1.0051, test_f1: 0.6481
 epoch: 42, train_loss: 0.4915, test_loss: 0.9768, test_f1: 0.5951
 epoch: 43, train_loss: 0.5056, test_loss: 1.0166, test_f1: 0.6272
 epoch: 44, train_loss: 0.5123, test_loss: 1.1380, test_f1: 0.6441
 epoch: 45, train_loss: 0.5042, test_loss: 1.0479, test_f1: 0.6254
 epoch: 46, train_loss: 0.4805, test_loss: 1.1348, test_f1: 0.6084
 epoch: 47, train_loss: 0.4710, test_loss: 1.1678, test_f1: 0.6545
 epoch: 48, train_loss: 0.4712, test_loss: 1.0391, test_f1: 0.6543
 epoch: 49, train_loss: 0.4616, test_loss: 1.0390, test_f1: 0.6334
 epoch: 50, train_loss: 0.4337, test_loss: 1.1204, test_f1: 0.5983
 epoch: 51, train_loss: 0.3914, test_loss: 1.1968, test_f1: 0.6366
 epoch: 52, train_loss: 0.3623, test_loss: 1.1532, test_f1: 0.6408
 epoch: 53, train_loss: 0.3609, test_loss: 1.2529, test_f1: 0.6314
 epoch: 54, train_loss: 0.3454, test_loss: 1.2489, test_f1: 0.6431
 epoch: 55, train_loss: 0.3419, test_loss: 1.1842, test_f1: 0.6459
 epoch: 56, train_loss: 0.3252, test_loss: 1.2446, test_f1: 0.6543
 epoch: 57, train_loss: 0.3277, test_loss: 1.2639, test_f1: 0.6618
 epoch: 58, train_loss: 0.3053, test_loss: 1.2754, test_f1: 0.6402
 epoch: 59, train_loss: 0.3143, test_loss: 1.3388, test_f1: 0.6215
 epoch: 60, train_loss: 0.3393, test_loss: 1.3508, test_f1: 0.6473
 epoch: 61, train_loss: 0.3154, test_loss: 1.3508, test_f1: 0.6421
 epoch: 62, train_loss: 0.3134, test_loss: 1.3511, test_f1: 0.6317
 epoch: 63, train_loss: 0.2975, test_loss: 1.3216, test_f1: 0.6271
 epoch: 64, train_loss: 0.2919, test_loss: 1.3422, test_f1: 0.6568
 epoch: 65, train_loss: 0.3048, test_loss: 1.3276, test_f1: 0.6302
 epoch: 66, train_loss: 0.2837, test_loss: 1.3722, test_f1: 0.6391
 epoch: 67, train_loss: 0.2741, test_loss: 1.4224, test_f1: 0.6396
 epoch: 68, train_loss: 0.2860, test_loss: 1.4281, test_f1: 0.6297
 epoch: 69, train_loss: 0.2755, test_loss: 1.4459, test_f1: 0.6351
 epoch: 70, train_loss: 0.2770, test_loss: 1.5367, test_f1: 0.6181
 epoch: 71, train_loss: 0.2735, test_loss: 1.4367, test_f1: 0.6307
 epoch: 72, train_loss: 0.2752, test_loss: 1.5146, test_f1: 0.6231
 epoch: 73, train_loss: 0.2668, test_loss: 1.4143, test_f1: 0.6553
 epoch: 74, train_loss: 0.2439, test_loss: 1.5180, test_f1: 0.6221
 epoch: 75, train_loss: 0.2463, test_loss: 1.4316, test_f1: 0.6283
 epoch: 76, train_loss: 0.2610, test_loss: 1.5161, test_f1: 0.6242
 epoch: 77, train_loss: 0.2536, test_loss: 1.5982, test_f1: 0.6367
 epoch: 78, train_loss: 0.2542, test_loss: 1.5167, test_f1: 0.6259
 epoch: 79, train_loss: 0.2406, test_loss: 1.6159, test_f1: 0.6148
 epoch: 80, train_loss: 0.2451, test_loss: 1.5757, test_f1: 0.6334
 epoch: 81, train_loss: 0.2206, test_loss: 1.7184, test_f1: 0.6281
 epoch: 82, train_loss: 0.2505, test_loss: 1.6567, test_f1: 0.6360
 epoch: 83, train_loss: 0.2260, test_loss: 1.6149, test_f1: 0.6406
 epoch: 84, train_loss: 0.2281, test_loss: 1.8997, test_f1: 0.6214
 epoch: 85, train_loss: 0.2279, test_loss: 1.6653, test_f1: 0.6258
 epoch: 86, train_loss: 0.2263, test_loss: 1.5741, test_f1: 0.6432
 epoch: 87, train_loss: 0.2270, test_loss: 1.7718, test_f1: 0.6294
 epoch: 88, train_loss: 0.2284, test_loss: 1.6672, test_f1: 0.6361
 epoch: 89, train_loss: 0.2209, test_loss: 1.6953, test_f1: 0.6440
 epoch: 90, train_loss: 0.2268, test_loss: 1.9279, test_f1: 0.6158
 epoch: 91, train_loss: 0.2016, test_loss: 1.8659, test_f1: 0.6304
 epoch: 92, train_loss: 0.1970, test_loss: 1.6984, test_f1: 0.6525
 epoch: 93, train_loss: 0.2176, test_loss: 1.6937, test_f1: 0.6349
 epoch: 94, train_loss: 0.1971, test_loss: 1.8775, test_f1: 0.6097
 epoch: 95, train_loss: 0.2107, test_loss: 1.9774, test_f1: 0.6262
 epoch: 96, train_loss: 0.2102, test_loss: 1.7293, test_f1: 0.6256
 epoch: 97, train_loss: 0.2114, test_loss: 1.7746, test_f1: 0.6318
 epoch: 98, train_loss: 0.2221, test_loss: 1.8282, test_f1: 0.6258
 epoch: 99, train_loss: 0.1987, test_loss: 1.8680, test_f1: 0.6275
##################ITERATION #4 ****************************************
 epoch: 0, train_loss: 1.2237, test_loss: 1.0579, test_f1: 0.4910
 epoch: 1, train_loss: 0.9918, test_loss: 0.9375, test_f1: 0.4671
 epoch: 2, train_loss: 0.9446, test_loss: 0.9517, test_f1: 0.5116
 epoch: 3, train_loss: 0.9090, test_loss: 0.9890, test_f1: 0.5323
 epoch: 4, train_loss: 0.9035, test_loss: 1.0148, test_f1: 0.4775
 epoch: 5, train_loss: 0.8843, test_loss: 0.9074, test_f1: 0.5481
 epoch: 6, train_loss: 0.8668, test_loss: 0.9519, test_f1: 0.5358
 epoch: 7, train_loss: 0.8694, test_loss: 0.9144, test_f1: 0.5156
 epoch: 8, train_loss: 0.8512, test_loss: 0.8758, test_f1: 0.5477
 epoch: 9, train_loss: 0.8332, test_loss: 0.9375, test_f1: 0.5433
 epoch: 10, train_loss: 0.8088, test_loss: 0.9587, test_f1: 0.5688
 epoch: 11, train_loss: 0.8053, test_loss: 0.9422, test_f1: 0.5805
 epoch: 12, train_loss: 0.7809, test_loss: 0.9402, test_f1: 0.5851
 epoch: 13, train_loss: 0.7746, test_loss: 0.9375, test_f1: 0.5619
 epoch: 14, train_loss: 0.7916, test_loss: 0.9265, test_f1: 0.6228
 epoch: 15, train_loss: 0.7430, test_loss: 0.9831, test_f1: 0.5895
 epoch: 16, train_loss: 0.7435, test_loss: 0.9602, test_f1: 0.5829
 epoch: 17, train_loss: 0.7429, test_loss: 0.9247, test_f1: 0.6102
 epoch: 18, train_loss: 0.7229, test_loss: 0.9899, test_f1: 0.5826
 epoch: 19, train_loss: 0.7129, test_loss: 0.9788, test_f1: 0.6176
 epoch: 20, train_loss: 0.7088, test_loss: 1.0325, test_f1: 0.5492
 epoch: 21, train_loss: 0.6930, test_loss: 0.9814, test_f1: 0.5876
 epoch: 22, train_loss: 0.6704, test_loss: 1.0229, test_f1: 0.6175
 epoch: 23, train_loss: 0.6781, test_loss: 0.9784, test_f1: 0.6105
 epoch: 24, train_loss: 0.6462, test_loss: 0.9870, test_f1: 0.5877
 epoch: 25, train_loss: 0.6540, test_loss: 0.9292, test_f1: 0.6326
 epoch: 26, train_loss: 0.6374, test_loss: 0.9841, test_f1: 0.6094
 epoch: 27, train_loss: 0.6176, test_loss: 0.9537, test_f1: 0.6768
 epoch: 28, train_loss: 0.6333, test_loss: 0.9567, test_f1: 0.6351
 epoch: 29, train_loss: 0.6192, test_loss: 1.0186, test_f1: 0.6115
 epoch: 30, train_loss: 0.5956, test_loss: 1.0379, test_f1: 0.6160
 epoch: 31, train_loss: 0.5868, test_loss: 0.9800, test_f1: 0.6059
 epoch: 32, train_loss: 0.5640, test_loss: 1.1100, test_f1: 0.6301
 epoch: 33, train_loss: 0.5922, test_loss: 0.9437, test_f1: 0.6339
 epoch: 34, train_loss: 0.5765, test_loss: 1.0108, test_f1: 0.5834
 epoch: 35, train_loss: 0.5301, test_loss: 0.9823, test_f1: 0.6136
 epoch: 36, train_loss: 0.5423, test_loss: 1.0425, test_f1: 0.6386
 epoch: 37, train_loss: 0.5208, test_loss: 0.9692, test_f1: 0.6614
 epoch: 38, train_loss: 0.5236, test_loss: 1.0527, test_f1: 0.6384
 epoch: 39, train_loss: 0.5066, test_loss: 1.0677, test_f1: 0.6398
 epoch: 40, train_loss: 0.5380, test_loss: 1.0628, test_f1: 0.6551
 epoch: 41, train_loss: 0.4903, test_loss: 1.0985, test_f1: 0.6396
 epoch: 42, train_loss: 0.4675, test_loss: 1.0839, test_f1: 0.6720
 epoch: 43, train_loss: 0.4346, test_loss: 1.3054, test_f1: 0.6336
 epoch: 44, train_loss: 0.4695, test_loss: 1.2244, test_f1: 0.6473
 epoch: 45, train_loss: 0.4852, test_loss: 0.8862, test_f1: 0.6561
 epoch: 46, train_loss: 0.4575, test_loss: 1.0494, test_f1: 0.6730
 epoch: 47, train_loss: 0.4291, test_loss: 1.1251, test_f1: 0.6494
 epoch: 48, train_loss: 0.4432, test_loss: 1.0776, test_f1: 0.6502
 epoch: 49, train_loss: 0.4231, test_loss: 1.1312, test_f1: 0.6570
 epoch: 50, train_loss: 0.4350, test_loss: 1.1551, test_f1: 0.6073
 epoch: 51, train_loss: 0.3849, test_loss: 1.1407, test_f1: 0.6559
 epoch: 52, train_loss: 0.3481, test_loss: 1.2089, test_f1: 0.6613
 epoch: 53, train_loss: 0.3307, test_loss: 1.1936, test_f1: 0.6438
 epoch: 54, train_loss: 0.3220, test_loss: 1.2565, test_f1: 0.6548
 epoch: 55, train_loss: 0.3061, test_loss: 1.3301, test_f1: 0.6116
 epoch: 56, train_loss: 0.3244, test_loss: 1.2957, test_f1: 0.6628
 epoch: 57, train_loss: 0.3267, test_loss: 1.2815, test_f1: 0.6585
 epoch: 58, train_loss: 0.2996, test_loss: 1.3956, test_f1: 0.6197
 epoch: 59, train_loss: 0.3112, test_loss: 1.3064, test_f1: 0.6368
 epoch: 60, train_loss: 0.3130, test_loss: 1.2997, test_f1: 0.6403
 epoch: 61, train_loss: 0.2934, test_loss: 1.3517, test_f1: 0.6566
 epoch: 62, train_loss: 0.2958, test_loss: 1.2886, test_f1: 0.6604
 epoch: 63, train_loss: 0.2711, test_loss: 1.3784, test_f1: 0.6737
 epoch: 64, train_loss: 0.2854, test_loss: 1.3644, test_f1: 0.6460
 epoch: 65, train_loss: 0.2819, test_loss: 1.4688, test_f1: 0.6490
 epoch: 66, train_loss: 0.2752, test_loss: 1.4460, test_f1: 0.6484
 epoch: 67, train_loss: 0.2620, test_loss: 1.4984, test_f1: 0.6563
 epoch: 68, train_loss: 0.2598, test_loss: 1.4310, test_f1: 0.6465
 epoch: 69, train_loss: 0.2866, test_loss: 1.6317, test_f1: 0.6211
 epoch: 70, train_loss: 0.2533, test_loss: 1.5564, test_f1: 0.6504
 epoch: 71, train_loss: 0.2484, test_loss: 1.5641, test_f1: 0.6475
 epoch: 72, train_loss: 0.2485, test_loss: 1.5128, test_f1: 0.6576
 epoch: 73, train_loss: 0.2467, test_loss: 1.6092, test_f1: 0.6405
 epoch: 74, train_loss: 0.2459, test_loss: 1.5364, test_f1: 0.6355
 epoch: 75, train_loss: 0.2449, test_loss: 1.5138, test_f1: 0.6364
 epoch: 76, train_loss: 0.2466, test_loss: 1.6030, test_f1: 0.6588
 epoch: 77, train_loss: 0.2296, test_loss: 1.7964, test_f1: 0.6318
 epoch: 78, train_loss: 0.2475, test_loss: 1.6366, test_f1: 0.6364
 epoch: 79, train_loss: 0.2138, test_loss: 1.6141, test_f1: 0.6535
 epoch: 80, train_loss: 0.2441, test_loss: 1.6620, test_f1: 0.6370
 epoch: 81, train_loss: 0.2310, test_loss: 1.5975, test_f1: 0.6325
 epoch: 82, train_loss: 0.2318, test_loss: 1.7455, test_f1: 0.6452
 epoch: 83, train_loss: 0.2280, test_loss: 1.6287, test_f1: 0.6479
 epoch: 84, train_loss: 0.2229, test_loss: 1.7101, test_f1: 0.6408
 epoch: 85, train_loss: 0.2346, test_loss: 1.7391, test_f1: 0.6185
 epoch: 86, train_loss: 0.2128, test_loss: 1.6198, test_f1: 0.6504
 epoch: 87, train_loss: 0.2279, test_loss: 1.7346, test_f1: 0.6469
 epoch: 88, train_loss: 0.2167, test_loss: 1.8135, test_f1: 0.6359
 epoch: 89, train_loss: 0.2185, test_loss: 1.7280, test_f1: 0.6456
 epoch: 90, train_loss: 0.2014, test_loss: 1.6461, test_f1: 0.6569
 epoch: 91, train_loss: 0.1908, test_loss: 1.8327, test_f1: 0.6406
 epoch: 92, train_loss: 0.2046, test_loss: 1.7833, test_f1: 0.6359
 epoch: 93, train_loss: 0.2032, test_loss: 1.8351, test_f1: 0.6421
 epoch: 94, train_loss: 0.1891, test_loss: 1.8183, test_f1: 0.6372
 epoch: 95, train_loss: 0.1916, test_loss: 1.7195, test_f1: 0.6450
 epoch: 96, train_loss: 0.2027, test_loss: 1.7933, test_f1: 0.6546
 epoch: 97, train_loss: 0.2001, test_loss: 1.8068, test_f1: 0.6514
 epoch: 98, train_loss: 0.2094, test_loss: 1.7893, test_f1: 0.6338
 epoch: 99, train_loss: 0.2005, test_loss: 1.7501, test_f1: 0.6584
##################ITERATION #5 ****************************************
 epoch: 0, train_loss: 1.2845, test_loss: 1.0227, test_f1: 0.4274
 epoch: 1, train_loss: 0.9910, test_loss: 0.9613, test_f1: 0.4966
 epoch: 2, train_loss: 0.9450, test_loss: 0.9659, test_f1: 0.5001
 epoch: 3, train_loss: 0.9210, test_loss: 1.0456, test_f1: 0.5344
 epoch: 4, train_loss: 0.9093, test_loss: 0.9736, test_f1: 0.5484
 epoch: 5, train_loss: 0.8935, test_loss: 0.9965, test_f1: 0.5495
 epoch: 6, train_loss: 0.8773, test_loss: 0.9661, test_f1: 0.5250
 epoch: 7, train_loss: 0.8593, test_loss: 0.9592, test_f1: 0.5390
 epoch: 8, train_loss: 0.8511, test_loss: 0.9531, test_f1: 0.5472
 epoch: 9, train_loss: 0.8258, test_loss: 0.9657, test_f1: 0.5463
 epoch: 10, train_loss: 0.8084, test_loss: 0.9668, test_f1: 0.5350
 epoch: 11, train_loss: 0.8046, test_loss: 0.9801, test_f1: 0.5453
 epoch: 12, train_loss: 0.7985, test_loss: 0.9616, test_f1: 0.5647
 epoch: 13, train_loss: 0.7764, test_loss: 1.0210, test_f1: 0.5311
 epoch: 14, train_loss: 0.7617, test_loss: 0.9681, test_f1: 0.5516
 epoch: 15, train_loss: 0.7547, test_loss: 1.0318, test_f1: 0.6059
 epoch: 16, train_loss: 0.7561, test_loss: 0.9290, test_f1: 0.5780
 epoch: 17, train_loss: 0.7459, test_loss: 0.9344, test_f1: 0.5778
 epoch: 18, train_loss: 0.7522, test_loss: 0.9809, test_f1: 0.5806
 epoch: 19, train_loss: 0.7305, test_loss: 0.9434, test_f1: 0.5788
 epoch: 20, train_loss: 0.7217, test_loss: 1.0077, test_f1: 0.5770
 epoch: 21, train_loss: 0.6995, test_loss: 1.0615, test_f1: 0.5805
 epoch: 22, train_loss: 0.6937, test_loss: 0.9865, test_f1: 0.5903
 epoch: 23, train_loss: 0.6742, test_loss: 0.9620, test_f1: 0.5898
 epoch: 24, train_loss: 0.6865, test_loss: 1.0112, test_f1: 0.6094
 epoch: 25, train_loss: 0.6724, test_loss: 0.9557, test_f1: 0.6011
 epoch: 26, train_loss: 0.6873, test_loss: 0.9436, test_f1: 0.6078
 epoch: 27, train_loss: 0.6443, test_loss: 1.0048, test_f1: 0.6039
 epoch: 28, train_loss: 0.6393, test_loss: 1.0829, test_f1: 0.5991
 epoch: 29, train_loss: 0.6285, test_loss: 0.9914, test_f1: 0.6210
 epoch: 30, train_loss: 0.6086, test_loss: 0.9484, test_f1: 0.6081
 epoch: 31, train_loss: 0.6222, test_loss: 0.9425, test_f1: 0.6446
 epoch: 32, train_loss: 0.5988, test_loss: 1.0082, test_f1: 0.6353
 epoch: 33, train_loss: 0.5923, test_loss: 0.9655, test_f1: 0.6293
 epoch: 34, train_loss: 0.5892, test_loss: 1.0498, test_f1: 0.5903
 epoch: 35, train_loss: 0.5811, test_loss: 1.0917, test_f1: 0.6024
 epoch: 36, train_loss: 0.5839, test_loss: 1.0756, test_f1: 0.6321
 epoch: 37, train_loss: 0.5619, test_loss: 1.0085, test_f1: 0.6361
 epoch: 38, train_loss: 0.5758, test_loss: 0.9317, test_f1: 0.6509
 epoch: 39, train_loss: 0.5591, test_loss: 1.0446, test_f1: 0.6504
 epoch: 40, train_loss: 0.5449, test_loss: 0.9883, test_f1: 0.6492
 epoch: 41, train_loss: 0.5368, test_loss: 1.0335, test_f1: 0.6109
 epoch: 42, train_loss: 0.5067, test_loss: 1.0193, test_f1: 0.6610
 epoch: 43, train_loss: 0.5281, test_loss: 1.0602, test_f1: 0.6577
 epoch: 44, train_loss: 0.5101, test_loss: 1.0530, test_f1: 0.6468
 epoch: 45, train_loss: 0.4920, test_loss: 1.2037, test_f1: 0.5920
 epoch: 46, train_loss: 0.5075, test_loss: 1.0387, test_f1: 0.6351
 epoch: 47, train_loss: 0.4917, test_loss: 1.1071, test_f1: 0.6545
 epoch: 48, train_loss: 0.4758, test_loss: 1.3071, test_f1: 0.6356
 epoch: 49, train_loss: 0.4518, test_loss: 1.3304, test_f1: 0.6168
 epoch: 50, train_loss: 0.4577, test_loss: 1.1476, test_f1: 0.6509
 epoch: 51, train_loss: 0.3972, test_loss: 1.2407, test_f1: 0.6596
 epoch: 52, train_loss: 0.4038, test_loss: 1.2932, test_f1: 0.6550
 epoch: 53, train_loss: 0.3826, test_loss: 1.3382, test_f1: 0.6445
 epoch: 54, train_loss: 0.3667, test_loss: 1.3166, test_f1: 0.6547
 epoch: 55, train_loss: 0.3645, test_loss: 1.3442, test_f1: 0.6783
 epoch: 56, train_loss: 0.3591, test_loss: 1.2912, test_f1: 0.6552
 epoch: 57, train_loss: 0.3559, test_loss: 1.4103, test_f1: 0.6234
 epoch: 58, train_loss: 0.3293, test_loss: 1.4220, test_f1: 0.6490
 epoch: 59, train_loss: 0.3453, test_loss: 1.4184, test_f1: 0.6592
 epoch: 60, train_loss: 0.3469, test_loss: 1.4220, test_f1: 0.6551
 epoch: 61, train_loss: 0.3468, test_loss: 1.4913, test_f1: 0.6349
 epoch: 62, train_loss: 0.3304, test_loss: 1.4466, test_f1: 0.6452
 epoch: 63, train_loss: 0.3151, test_loss: 1.4214, test_f1: 0.6598
 epoch: 64, train_loss: 0.3200, test_loss: 1.4768, test_f1: 0.6335
 epoch: 65, train_loss: 0.3176, test_loss: 1.4634, test_f1: 0.6467
 epoch: 66, train_loss: 0.3117, test_loss: 1.3888, test_f1: 0.6976
 epoch: 67, train_loss: 0.3079, test_loss: 1.4955, test_f1: 0.6599
 epoch: 68, train_loss: 0.3099, test_loss: 1.6264, test_f1: 0.6221
 epoch: 69, train_loss: 0.2936, test_loss: 1.5310, test_f1: 0.6540
 epoch: 70, train_loss: 0.2999, test_loss: 1.6077, test_f1: 0.6405
 epoch: 71, train_loss: 0.2928, test_loss: 1.5795, test_f1: 0.6469
 epoch: 72, train_loss: 0.2892, test_loss: 1.5745, test_f1: 0.6589
 epoch: 73, train_loss: 0.2929, test_loss: 1.4856, test_f1: 0.6544
 epoch: 74, train_loss: 0.2944, test_loss: 1.5077, test_f1: 0.6524
 epoch: 75, train_loss: 0.2758, test_loss: 1.6299, test_f1: 0.6537
 epoch: 76, train_loss: 0.2910, test_loss: 1.5563, test_f1: 0.6400
 epoch: 77, train_loss: 0.2673, test_loss: 1.5515, test_f1: 0.6604
 epoch: 78, train_loss: 0.2951, test_loss: 1.4684, test_f1: 0.6728
 epoch: 79, train_loss: 0.2879, test_loss: 1.6029, test_f1: 0.6616
 epoch: 80, train_loss: 0.2740, test_loss: 1.5218, test_f1: 0.6506
 epoch: 81, train_loss: 0.2695, test_loss: 1.5235, test_f1: 0.6577
 epoch: 82, train_loss: 0.2455, test_loss: 1.5201, test_f1: 0.6363
 epoch: 83, train_loss: 0.2564, test_loss: 1.7588, test_f1: 0.6441
 epoch: 84, train_loss: 0.2401, test_loss: 1.6605, test_f1: 0.6512
 epoch: 85, train_loss: 0.2502, test_loss: 1.7023, test_f1: 0.6636
 epoch: 86, train_loss: 0.2290, test_loss: 1.6656, test_f1: 0.6639
 epoch: 87, train_loss: 0.2372, test_loss: 1.7281, test_f1: 0.6568
 epoch: 88, train_loss: 0.2369, test_loss: 1.5831, test_f1: 0.6429
 epoch: 89, train_loss: 0.2433, test_loss: 1.5633, test_f1: 0.6662
 epoch: 90, train_loss: 0.2386, test_loss: 1.7480, test_f1: 0.6624
 epoch: 91, train_loss: 0.2367, test_loss: 1.7384, test_f1: 0.6638
 epoch: 92, train_loss: 0.2169, test_loss: 1.9495, test_f1: 0.6463
 epoch: 93, train_loss: 0.2349, test_loss: 1.6216, test_f1: 0.6784
 epoch: 94, train_loss: 0.2340, test_loss: 1.6285, test_f1: 0.6581
 epoch: 95, train_loss: 0.2137, test_loss: 1.8222, test_f1: 0.6588
 epoch: 96, train_loss: 0.2447, test_loss: 1.7547, test_f1: 0.6624
 epoch: 97, train_loss: 0.2140, test_loss: 1.7300, test_f1: 0.6639
 epoch: 98, train_loss: 0.2144, test_loss: 1.8388, test_f1: 0.6593
 epoch: 99, train_loss: 0.2154, test_loss: 1.7951, test_f1: 0.6764
##################ITERATION #6 ****************************************
 epoch: 0, train_loss: 1.2651, test_loss: 1.0555, test_f1: 0.4258
 epoch: 1, train_loss: 0.9780, test_loss: 0.9188, test_f1: 0.4969
 epoch: 2, train_loss: 0.9313, test_loss: 0.9412, test_f1: 0.5026
 epoch: 3, train_loss: 0.9115, test_loss: 0.8850, test_f1: 0.5586
 epoch: 4, train_loss: 0.8902, test_loss: 0.8744, test_f1: 0.5127
 epoch: 5, train_loss: 0.8743, test_loss: 0.8698, test_f1: 0.5480
 epoch: 6, train_loss: 0.8442, test_loss: 0.8269, test_f1: 0.5451
 epoch: 7, train_loss: 0.8303, test_loss: 0.8893, test_f1: 0.5811
 epoch: 8, train_loss: 0.8252, test_loss: 0.9516, test_f1: 0.5449
 epoch: 9, train_loss: 0.8144, test_loss: 0.9629, test_f1: 0.5969
 epoch: 10, train_loss: 0.8033, test_loss: 0.9191, test_f1: 0.5761
 epoch: 11, train_loss: 0.7897, test_loss: 0.8655, test_f1: 0.5822
 epoch: 12, train_loss: 0.7722, test_loss: 0.9197, test_f1: 0.6073
 epoch: 13, train_loss: 0.7819, test_loss: 0.8932, test_f1: 0.5993
 epoch: 14, train_loss: 0.7559, test_loss: 0.9911, test_f1: 0.5750
 epoch: 15, train_loss: 0.7505, test_loss: 0.8723, test_f1: 0.5932
 epoch: 16, train_loss: 0.7432, test_loss: 0.9130, test_f1: 0.6105
 epoch: 17, train_loss: 0.7296, test_loss: 0.7894, test_f1: 0.6333
 epoch: 18, train_loss: 0.7318, test_loss: 0.9256, test_f1: 0.5947
 epoch: 19, train_loss: 0.7161, test_loss: 0.9227, test_f1: 0.6010
 epoch: 20, train_loss: 0.6954, test_loss: 0.8853, test_f1: 0.5888
 epoch: 21, train_loss: 0.6929, test_loss: 0.9048, test_f1: 0.6441
 epoch: 22, train_loss: 0.6836, test_loss: 0.9340, test_f1: 0.5970
 epoch: 23, train_loss: 0.6687, test_loss: 0.9159, test_f1: 0.6384
 epoch: 24, train_loss: 0.6412, test_loss: 0.9647, test_f1: 0.6274
 epoch: 25, train_loss: 0.6524, test_loss: 0.9494, test_f1: 0.6062
 epoch: 26, train_loss: 0.6440, test_loss: 0.9977, test_f1: 0.6228
 epoch: 27, train_loss: 0.6223, test_loss: 0.9022, test_f1: 0.6318
 epoch: 28, train_loss: 0.6424, test_loss: 0.8787, test_f1: 0.6336
 epoch: 29, train_loss: 0.6092, test_loss: 0.8832, test_f1: 0.6512
 epoch: 30, train_loss: 0.6072, test_loss: 0.9301, test_f1: 0.6226
 epoch: 31, train_loss: 0.5977, test_loss: 0.9068, test_f1: 0.6366
 epoch: 32, train_loss: 0.6051, test_loss: 0.9004, test_f1: 0.6150
 epoch: 33, train_loss: 0.5818, test_loss: 0.8826, test_f1: 0.6779
 epoch: 34, train_loss: 0.5750, test_loss: 0.9986, test_f1: 0.6732
 epoch: 35, train_loss: 0.5518, test_loss: 1.1129, test_f1: 0.5745
 epoch: 36, train_loss: 0.5390, test_loss: 1.0363, test_f1: 0.6485
 epoch: 37, train_loss: 0.5468, test_loss: 0.9795, test_f1: 0.6756
 epoch: 38, train_loss: 0.5246, test_loss: 0.8879, test_f1: 0.6402
 epoch: 39, train_loss: 0.5162, test_loss: 0.9964, test_f1: 0.6571
 epoch: 40, train_loss: 0.5176, test_loss: 0.9501, test_f1: 0.6713
 epoch: 41, train_loss: 0.5046, test_loss: 1.0213, test_f1: 0.6609
 epoch: 42, train_loss: 0.5046, test_loss: 1.0850, test_f1: 0.6559
 epoch: 43, train_loss: 0.4750, test_loss: 1.1076, test_f1: 0.6369
 epoch: 44, train_loss: 0.4996, test_loss: 1.0044, test_f1: 0.6408
 epoch: 45, train_loss: 0.4974, test_loss: 1.0309, test_f1: 0.6505
 epoch: 46, train_loss: 0.4604, test_loss: 1.2155, test_f1: 0.6348
 epoch: 47, train_loss: 0.4695, test_loss: 1.0529, test_f1: 0.6661
 epoch: 48, train_loss: 0.4547, test_loss: 1.1285, test_f1: 0.6368
 epoch: 49, train_loss: 0.4407, test_loss: 1.1725, test_f1: 0.6460
 epoch: 50, train_loss: 0.4461, test_loss: 1.1000, test_f1: 0.6810
 epoch: 51, train_loss: 0.4027, test_loss: 1.0848, test_f1: 0.6719
 epoch: 52, train_loss: 0.3808, test_loss: 1.1647, test_f1: 0.6760
 epoch: 53, train_loss: 0.3569, test_loss: 1.1677, test_f1: 0.6847
 epoch: 54, train_loss: 0.3470, test_loss: 1.1967, test_f1: 0.6679
 epoch: 55, train_loss: 0.3297, test_loss: 1.1924, test_f1: 0.6804
 epoch: 56, train_loss: 0.3352, test_loss: 1.2469, test_f1: 0.6929
 epoch: 57, train_loss: 0.3267, test_loss: 1.3086, test_f1: 0.6574
 epoch: 58, train_loss: 0.3327, test_loss: 1.2089, test_f1: 0.6786
 epoch: 59, train_loss: 0.3267, test_loss: 1.2657, test_f1: 0.6627
 epoch: 60, train_loss: 0.3083, test_loss: 1.2059, test_f1: 0.6833
 epoch: 61, train_loss: 0.3022, test_loss: 1.2154, test_f1: 0.6729
 epoch: 62, train_loss: 0.3245, test_loss: 1.2224, test_f1: 0.6960
 epoch: 63, train_loss: 0.3028, test_loss: 1.2778, test_f1: 0.6523
 epoch: 64, train_loss: 0.2845, test_loss: 1.3507, test_f1: 0.6598
 epoch: 65, train_loss: 0.2788, test_loss: 1.3401, test_f1: 0.6837
 epoch: 66, train_loss: 0.2699, test_loss: 1.3606, test_f1: 0.6726
 epoch: 67, train_loss: 0.2842, test_loss: 1.3553, test_f1: 0.6548
 epoch: 68, train_loss: 0.2851, test_loss: 1.3428, test_f1: 0.6738
 epoch: 69, train_loss: 0.2704, test_loss: 1.3608, test_f1: 0.6831
 epoch: 70, train_loss: 0.2820, test_loss: 1.2697, test_f1: 0.6664
 epoch: 71, train_loss: 0.2680, test_loss: 1.3228, test_f1: 0.6704
 epoch: 72, train_loss: 0.2677, test_loss: 1.3573, test_f1: 0.6757
 epoch: 73, train_loss: 0.2486, test_loss: 1.5260, test_f1: 0.6225
 epoch: 74, train_loss: 0.2585, test_loss: 1.5257, test_f1: 0.6454
 epoch: 75, train_loss: 0.2730, test_loss: 1.3999, test_f1: 0.6618
 epoch: 76, train_loss: 0.2470, test_loss: 1.5257, test_f1: 0.6434
 epoch: 77, train_loss: 0.2444, test_loss: 1.3313, test_f1: 0.6581
 epoch: 78, train_loss: 0.2369, test_loss: 1.4325, test_f1: 0.6703
 epoch: 79, train_loss: 0.2341, test_loss: 1.3595, test_f1: 0.6867
 epoch: 80, train_loss: 0.2398, test_loss: 1.4583, test_f1: 0.6982
 epoch: 81, train_loss: 0.2427, test_loss: 1.4266, test_f1: 0.6664
 epoch: 82, train_loss: 0.2222, test_loss: 1.5388, test_f1: 0.6693
 epoch: 83, train_loss: 0.2196, test_loss: 1.5682, test_f1: 0.6702
 epoch: 84, train_loss: 0.2347, test_loss: 1.5910, test_f1: 0.6609
 epoch: 85, train_loss: 0.2070, test_loss: 1.5116, test_f1: 0.6829
 epoch: 86, train_loss: 0.2378, test_loss: 1.5267, test_f1: 0.6697
 epoch: 87, train_loss: 0.2228, test_loss: 1.7063, test_f1: 0.6524
 epoch: 88, train_loss: 0.2090, test_loss: 1.6249, test_f1: 0.6660
 epoch: 89, train_loss: 0.2257, test_loss: 1.4612, test_f1: 0.6993
 epoch: 90, train_loss: 0.2155, test_loss: 1.4885, test_f1: 0.6696
 epoch: 91, train_loss: 0.2022, test_loss: 1.6175, test_f1: 0.6750
 epoch: 92, train_loss: 0.2027, test_loss: 1.4594, test_f1: 0.6874
 epoch: 93, train_loss: 0.1997, test_loss: 1.6155, test_f1: 0.6851
 epoch: 94, train_loss: 0.1982, test_loss: 1.7855, test_f1: 0.6387
 epoch: 95, train_loss: 0.2159, test_loss: 1.5034, test_f1: 0.6797
 epoch: 96, train_loss: 0.2073, test_loss: 1.8176, test_f1: 0.6586
 epoch: 97, train_loss: 0.1868, test_loss: 1.7131, test_f1: 0.6667
 epoch: 98, train_loss: 0.2056, test_loss: 1.6073, test_f1: 0.6639
 epoch: 99, train_loss: 0.1931, test_loss: 1.6692, test_f1: 0.6534
##################ITERATION #7 ****************************************
 epoch: 0, train_loss: 1.3316, test_loss: 1.0112, test_f1: 0.4766
 epoch: 1, train_loss: 1.0018, test_loss: 0.9789, test_f1: 0.4785
 epoch: 2, train_loss: 0.9582, test_loss: 0.9429, test_f1: 0.5013
 epoch: 3, train_loss: 0.9404, test_loss: 0.9320, test_f1: 0.4878
 epoch: 4, train_loss: 0.8998, test_loss: 0.8611, test_f1: 0.5224
 epoch: 5, train_loss: 0.8815, test_loss: 0.9339, test_f1: 0.5264
 epoch: 6, train_loss: 0.8624, test_loss: 0.8406, test_f1: 0.5651
 epoch: 7, train_loss: 0.8662, test_loss: 0.9813, test_f1: 0.5442
 epoch: 8, train_loss: 0.8369, test_loss: 0.9338, test_f1: 0.5934
 epoch: 9, train_loss: 0.8434, test_loss: 0.8753, test_f1: 0.5541
 epoch: 10, train_loss: 0.8297, test_loss: 0.9152, test_f1: 0.5380
 epoch: 11, train_loss: 0.7961, test_loss: 0.9278, test_f1: 0.5813
 epoch: 12, train_loss: 0.8023, test_loss: 0.9498, test_f1: 0.6149
 epoch: 13, train_loss: 0.8015, test_loss: 0.9688, test_f1: 0.5871
 epoch: 14, train_loss: 0.7963, test_loss: 0.9351, test_f1: 0.6165
 epoch: 15, train_loss: 0.7620, test_loss: 0.9217, test_f1: 0.6195
 epoch: 16, train_loss: 0.7683, test_loss: 0.8915, test_f1: 0.6271
 epoch: 17, train_loss: 0.7404, test_loss: 0.9195, test_f1: 0.5812
 epoch: 18, train_loss: 0.7310, test_loss: 0.9829, test_f1: 0.5859
 epoch: 19, train_loss: 0.7293, test_loss: 1.0001, test_f1: 0.6055
 epoch: 20, train_loss: 0.7151, test_loss: 0.9379, test_f1: 0.5950
 epoch: 21, train_loss: 0.7128, test_loss: 0.9733, test_f1: 0.6088
 epoch: 22, train_loss: 0.6967, test_loss: 1.0188, test_f1: 0.5875
 epoch: 23, train_loss: 0.6847, test_loss: 0.9616, test_f1: 0.5901
 epoch: 24, train_loss: 0.6978, test_loss: 1.0353, test_f1: 0.6214
 epoch: 25, train_loss: 0.6877, test_loss: 0.9292, test_f1: 0.5843
 epoch: 26, train_loss: 0.6601, test_loss: 0.9303, test_f1: 0.6419
 epoch: 27, train_loss: 0.6636, test_loss: 0.9867, test_f1: 0.6325
 epoch: 28, train_loss: 0.6360, test_loss: 0.9757, test_f1: 0.6532
 epoch: 29, train_loss: 0.6097, test_loss: 0.9846, test_f1: 0.6259
 epoch: 30, train_loss: 0.6086, test_loss: 0.9636, test_f1: 0.6557
 epoch: 31, train_loss: 0.5973, test_loss: 1.0901, test_f1: 0.6372
 epoch: 32, train_loss: 0.6133, test_loss: 1.0074, test_f1: 0.6187
 epoch: 33, train_loss: 0.6269, test_loss: 1.0356, test_f1: 0.5947
 epoch: 34, train_loss: 0.6018, test_loss: 0.9990, test_f1: 0.6374
 epoch: 35, train_loss: 0.5792, test_loss: 1.0078, test_f1: 0.6569
 epoch: 36, train_loss: 0.5824, test_loss: 0.9737, test_f1: 0.6291
 epoch: 37, train_loss: 0.5514, test_loss: 1.1042, test_f1: 0.6445
 epoch: 38, train_loss: 0.5464, test_loss: 1.0352, test_f1: 0.6323
 epoch: 39, train_loss: 0.5290, test_loss: 1.0591, test_f1: 0.6576
 epoch: 40, train_loss: 0.5376, test_loss: 0.9848, test_f1: 0.6661
 epoch: 41, train_loss: 0.5126, test_loss: 0.9703, test_f1: 0.6513
 epoch: 42, train_loss: 0.5092, test_loss: 1.0453, test_f1: 0.6424
 epoch: 43, train_loss: 0.5066, test_loss: 1.1280, test_f1: 0.6284
 epoch: 44, train_loss: 0.5182, test_loss: 1.0749, test_f1: 0.6555
 epoch: 45, train_loss: 0.4956, test_loss: 1.2642, test_f1: 0.6222
 epoch: 46, train_loss: 0.4883, test_loss: 1.1801, test_f1: 0.6165
 epoch: 47, train_loss: 0.4893, test_loss: 1.2202, test_f1: 0.6376
 epoch: 48, train_loss: 0.4532, test_loss: 1.1555, test_f1: 0.6467
 epoch: 49, train_loss: 0.4717, test_loss: 1.1404, test_f1: 0.6619
 epoch: 50, train_loss: 0.4603, test_loss: 1.1832, test_f1: 0.6372
 epoch: 51, train_loss: 0.4113, test_loss: 1.1287, test_f1: 0.6659
 epoch: 52, train_loss: 0.3698, test_loss: 1.1706, test_f1: 0.6458
 epoch: 53, train_loss: 0.3827, test_loss: 1.1576, test_f1: 0.6646
 epoch: 54, train_loss: 0.3571, test_loss: 1.2061, test_f1: 0.6489
 epoch: 55, train_loss: 0.3655, test_loss: 1.1689, test_f1: 0.6671
 epoch: 56, train_loss: 0.3558, test_loss: 1.1957, test_f1: 0.6535
 epoch: 57, train_loss: 0.3386, test_loss: 1.2303, test_f1: 0.6601
 epoch: 58, train_loss: 0.3496, test_loss: 1.2344, test_f1: 0.6558
 epoch: 59, train_loss: 0.3384, test_loss: 1.2266, test_f1: 0.6421
 epoch: 60, train_loss: 0.3366, test_loss: 1.2801, test_f1: 0.6400
 epoch: 61, train_loss: 0.3414, test_loss: 1.2721, test_f1: 0.6513
 epoch: 62, train_loss: 0.3438, test_loss: 1.1917, test_f1: 0.6601
 epoch: 63, train_loss: 0.3351, test_loss: 1.2892, test_f1: 0.6420
 epoch: 64, train_loss: 0.3211, test_loss: 1.2909, test_f1: 0.6663
 epoch: 65, train_loss: 0.3164, test_loss: 1.3145, test_f1: 0.6533
 epoch: 66, train_loss: 0.2998, test_loss: 1.3778, test_f1: 0.6575
 epoch: 67, train_loss: 0.3114, test_loss: 1.2622, test_f1: 0.6436
 epoch: 68, train_loss: 0.2932, test_loss: 1.4115, test_f1: 0.6449
 epoch: 69, train_loss: 0.3079, test_loss: 1.3533, test_f1: 0.6375
 epoch: 70, train_loss: 0.3058, test_loss: 1.3623, test_f1: 0.6500
 epoch: 71, train_loss: 0.2851, test_loss: 1.3690, test_f1: 0.6664
 epoch: 72, train_loss: 0.3059, test_loss: 1.4056, test_f1: 0.6688
 epoch: 73, train_loss: 0.2786, test_loss: 1.4272, test_f1: 0.6628
 epoch: 74, train_loss: 0.2673, test_loss: 1.4139, test_f1: 0.6510
 epoch: 75, train_loss: 0.2688, test_loss: 1.5777, test_f1: 0.6697
 epoch: 76, train_loss: 0.2633, test_loss: 1.3947, test_f1: 0.6714
 epoch: 77, train_loss: 0.2765, test_loss: 1.4404, test_f1: 0.6440
 epoch: 78, train_loss: 0.2562, test_loss: 1.5117, test_f1: 0.6420
 epoch: 79, train_loss: 0.2484, test_loss: 1.6017, test_f1: 0.6480
 epoch: 80, train_loss: 0.2739, test_loss: 1.6150, test_f1: 0.6378
 epoch: 81, train_loss: 0.2484, test_loss: 1.5099, test_f1: 0.6568
 epoch: 82, train_loss: 0.2449, test_loss: 1.7165, test_f1: 0.6358
 epoch: 83, train_loss: 0.2527, test_loss: 1.5676, test_f1: 0.6071
 epoch: 84, train_loss: 0.2573, test_loss: 1.6281, test_f1: 0.6408
 epoch: 85, train_loss: 0.2496, test_loss: 1.7102, test_f1: 0.6322
 epoch: 86, train_loss: 0.2437, test_loss: 1.6882, test_f1: 0.6126
 epoch: 87, train_loss: 0.2363, test_loss: 1.5800, test_f1: 0.6460
 epoch: 88, train_loss: 0.2483, test_loss: 1.6392, test_f1: 0.6317
 epoch: 89, train_loss: 0.2400, test_loss: 1.6720, test_f1: 0.6419
 epoch: 90, train_loss: 0.2382, test_loss: 1.6714, test_f1: 0.6446
 epoch: 91, train_loss: 0.2268, test_loss: 1.6741, test_f1: 0.6379
 epoch: 92, train_loss: 0.2343, test_loss: 1.8056, test_f1: 0.6338
 epoch: 93, train_loss: 0.2379, test_loss: 1.6404, test_f1: 0.6580
 epoch: 94, train_loss: 0.2202, test_loss: 1.6915, test_f1: 0.6453
 epoch: 95, train_loss: 0.2096, test_loss: 1.7144, test_f1: 0.6591
 epoch: 96, train_loss: 0.2177, test_loss: 1.6847, test_f1: 0.6584
 epoch: 97, train_loss: 0.2310, test_loss: 1.7125, test_f1: 0.6507
 epoch: 98, train_loss: 0.2216, test_loss: 1.7862, test_f1: 0.6121
 epoch: 99, train_loss: 0.2123, test_loss: 1.7735, test_f1: 0.6198
##################ITERATION #8 ****************************************
 epoch: 0, train_loss: 1.3367, test_loss: 1.0067, test_f1: 0.4546
 epoch: 1, train_loss: 1.0012, test_loss: 0.9490, test_f1: 0.4872
 epoch: 2, train_loss: 0.9492, test_loss: 0.9620, test_f1: 0.4826
 epoch: 3, train_loss: 0.9423, test_loss: 0.9516, test_f1: 0.5030
 epoch: 4, train_loss: 0.9159, test_loss: 0.9922, test_f1: 0.5435
 epoch: 5, train_loss: 0.8952, test_loss: 1.0125, test_f1: 0.5024
 epoch: 6, train_loss: 0.8695, test_loss: 0.9432, test_f1: 0.5176
 epoch: 7, train_loss: 0.8660, test_loss: 0.8989, test_f1: 0.5470
 epoch: 8, train_loss: 0.8327, test_loss: 0.9057, test_f1: 0.5678
 epoch: 9, train_loss: 0.8310, test_loss: 1.0138, test_f1: 0.5589
 epoch: 10, train_loss: 0.8065, test_loss: 0.9485, test_f1: 0.5304
 epoch: 11, train_loss: 0.8067, test_loss: 1.0084, test_f1: 0.5252
 epoch: 12, train_loss: 0.8050, test_loss: 0.9415, test_f1: 0.5520
 epoch: 13, train_loss: 0.7762, test_loss: 0.8833, test_f1: 0.5738
 epoch: 14, train_loss: 0.7774, test_loss: 0.9582, test_f1: 0.5843
 epoch: 15, train_loss: 0.7659, test_loss: 0.8541, test_f1: 0.5770
 epoch: 16, train_loss: 0.7441, test_loss: 0.9327, test_f1: 0.6044
 epoch: 17, train_loss: 0.7255, test_loss: 0.9097, test_f1: 0.5909
 epoch: 18, train_loss: 0.7089, test_loss: 1.0121, test_f1: 0.6017
 epoch: 19, train_loss: 0.7147, test_loss: 1.0218, test_f1: 0.6008
 epoch: 20, train_loss: 0.7113, test_loss: 0.9635, test_f1: 0.5947
 epoch: 21, train_loss: 0.7008, test_loss: 0.9802, test_f1: 0.6389
 epoch: 22, train_loss: 0.6833, test_loss: 0.9537, test_f1: 0.6288
 epoch: 23, train_loss: 0.6818, test_loss: 0.9500, test_f1: 0.6207
 epoch: 24, train_loss: 0.6692, test_loss: 1.0857, test_f1: 0.6099
 epoch: 25, train_loss: 0.6604, test_loss: 1.0891, test_f1: 0.5899
 epoch: 26, train_loss: 0.6409, test_loss: 1.0824, test_f1: 0.5746
 epoch: 27, train_loss: 0.6063, test_loss: 1.0722, test_f1: 0.6000
 epoch: 28, train_loss: 0.6275, test_loss: 0.9668, test_f1: 0.6006
 epoch: 29, train_loss: 0.6053, test_loss: 1.0458, test_f1: 0.5926
 epoch: 30, train_loss: 0.5929, test_loss: 1.0269, test_f1: 0.6193
 epoch: 31, train_loss: 0.5971, test_loss: 1.1104, test_f1: 0.6300
 epoch: 32, train_loss: 0.5711, test_loss: 0.9836, test_f1: 0.6303
 epoch: 33, train_loss: 0.5761, test_loss: 1.0448, test_f1: 0.6059
 epoch: 34, train_loss: 0.5503, test_loss: 1.1156, test_f1: 0.5956
 epoch: 35, train_loss: 0.5577, test_loss: 1.0455, test_f1: 0.6184
 epoch: 36, train_loss: 0.5241, test_loss: 1.1307, test_f1: 0.6339
 epoch: 37, train_loss: 0.5416, test_loss: 1.1026, test_f1: 0.6298
 epoch: 38, train_loss: 0.5150, test_loss: 1.0781, test_f1: 0.6362
 epoch: 39, train_loss: 0.5267, test_loss: 1.1413, test_f1: 0.6333
 epoch: 40, train_loss: 0.5175, test_loss: 1.2126, test_f1: 0.6215
 epoch: 41, train_loss: 0.5058, test_loss: 1.1091, test_f1: 0.6444
 epoch: 42, train_loss: 0.5226, test_loss: 1.1383, test_f1: 0.6382
 epoch: 43, train_loss: 0.4964, test_loss: 1.1347, test_f1: 0.6297
 epoch: 44, train_loss: 0.4949, test_loss: 1.2783, test_f1: 0.6526
 epoch: 45, train_loss: 0.4801, test_loss: 1.1297, test_f1: 0.6274
 epoch: 46, train_loss: 0.4846, test_loss: 1.1333, test_f1: 0.6447
 epoch: 47, train_loss: 0.4732, test_loss: 1.2198, test_f1: 0.6403
 epoch: 48, train_loss: 0.4367, test_loss: 1.2837, test_f1: 0.6548
 epoch: 49, train_loss: 0.4423, test_loss: 1.2575, test_f1: 0.6285
 epoch: 50, train_loss: 0.4190, test_loss: 1.2418, test_f1: 0.6366
 epoch: 51, train_loss: 0.4113, test_loss: 1.2339, test_f1: 0.6590
 epoch: 52, train_loss: 0.3688, test_loss: 1.2280, test_f1: 0.6503
 epoch: 53, train_loss: 0.3562, test_loss: 1.3960, test_f1: 0.6354
 epoch: 54, train_loss: 0.3522, test_loss: 1.3787, test_f1: 0.6667
 epoch: 55, train_loss: 0.3406, test_loss: 1.3695, test_f1: 0.6304
 epoch: 56, train_loss: 0.3369, test_loss: 1.4057, test_f1: 0.6321
 epoch: 57, train_loss: 0.3142, test_loss: 1.3829, test_f1: 0.6452
 epoch: 58, train_loss: 0.3355, test_loss: 1.2922, test_f1: 0.6481
 epoch: 59, train_loss: 0.3336, test_loss: 1.4446, test_f1: 0.6404
 epoch: 60, train_loss: 0.2977, test_loss: 1.4907, test_f1: 0.6442
 epoch: 61, train_loss: 0.3166, test_loss: 1.4122, test_f1: 0.6584
 epoch: 62, train_loss: 0.2919, test_loss: 1.5295, test_f1: 0.6396
 epoch: 63, train_loss: 0.2923, test_loss: 1.4675, test_f1: 0.6487
 epoch: 64, train_loss: 0.2897, test_loss: 1.4791, test_f1: 0.6617
 epoch: 65, train_loss: 0.2741, test_loss: 1.5475, test_f1: 0.6684
 epoch: 66, train_loss: 0.2734, test_loss: 1.5324, test_f1: 0.6635
 epoch: 67, train_loss: 0.2724, test_loss: 1.5905, test_f1: 0.6390
 epoch: 68, train_loss: 0.2852, test_loss: 1.6440, test_f1: 0.6302
 epoch: 69, train_loss: 0.2917, test_loss: 1.5949, test_f1: 0.6410
 epoch: 70, train_loss: 0.2622, test_loss: 1.6504, test_f1: 0.6385
 epoch: 71, train_loss: 0.2782, test_loss: 1.5125, test_f1: 0.6560
 epoch: 72, train_loss: 0.2662, test_loss: 1.6567, test_f1: 0.6455
 epoch: 73, train_loss: 0.2592, test_loss: 1.5685, test_f1: 0.6450
 epoch: 74, train_loss: 0.2461, test_loss: 1.5753, test_f1: 0.6479
 epoch: 75, train_loss: 0.2551, test_loss: 1.6134, test_f1: 0.6283
 epoch: 76, train_loss: 0.2478, test_loss: 1.6114, test_f1: 0.6615
 epoch: 77, train_loss: 0.2371, test_loss: 1.6376, test_f1: 0.6436
 epoch: 78, train_loss: 0.2388, test_loss: 1.8632, test_f1: 0.6391
 epoch: 79, train_loss: 0.2598, test_loss: 1.6042, test_f1: 0.6527
 epoch: 80, train_loss: 0.2383, test_loss: 1.7274, test_f1: 0.6477
 epoch: 81, train_loss: 0.2324, test_loss: 1.8677, test_f1: 0.6518
 epoch: 82, train_loss: 0.2508, test_loss: 1.7066, test_f1: 0.6671
 epoch: 83, train_loss: 0.2326, test_loss: 1.6999, test_f1: 0.6577
 epoch: 84, train_loss: 0.2170, test_loss: 1.7337, test_f1: 0.6553
 epoch: 85, train_loss: 0.2252, test_loss: 1.8085, test_f1: 0.6445
 epoch: 86, train_loss: 0.2337, test_loss: 1.7455, test_f1: 0.6525
 epoch: 87, train_loss: 0.2189, test_loss: 1.8128, test_f1: 0.6659
 epoch: 88, train_loss: 0.2108, test_loss: 1.8785, test_f1: 0.6402
 epoch: 89, train_loss: 0.2091, test_loss: 1.7978, test_f1: 0.6589
 epoch: 90, train_loss: 0.2135, test_loss: 1.8016, test_f1: 0.6732
 epoch: 91, train_loss: 0.2183, test_loss: 1.8156, test_f1: 0.6476
 epoch: 92, train_loss: 0.2006, test_loss: 1.8863, test_f1: 0.6506
 epoch: 93, train_loss: 0.1989, test_loss: 1.7427, test_f1: 0.6520
 epoch: 94, train_loss: 0.2107, test_loss: 1.7952, test_f1: 0.6716
 epoch: 95, train_loss: 0.2130, test_loss: 1.7101, test_f1: 0.6703
 epoch: 96, train_loss: 0.1983, test_loss: 1.9171, test_f1: 0.6634
 epoch: 97, train_loss: 0.1845, test_loss: 2.0210, test_f1: 0.6386
 epoch: 98, train_loss: 0.1948, test_loss: 2.0135, test_f1: 0.6535
 epoch: 99, train_loss: 0.1985, test_loss: 1.9934, test_f1: 0.6700
##################ITERATION #9 ****************************************
 epoch: 0, train_loss: 1.3705, test_loss: 1.0051, test_f1: 0.4835
 epoch: 1, train_loss: 1.0181, test_loss: 0.9703, test_f1: 0.4754
 epoch: 2, train_loss: 0.9428, test_loss: 0.9649, test_f1: 0.4570
 epoch: 3, train_loss: 0.9271, test_loss: 0.9220, test_f1: 0.5123
 epoch: 4, train_loss: 0.8958, test_loss: 0.9582, test_f1: 0.5367
 epoch: 5, train_loss: 0.8787, test_loss: 0.9366, test_f1: 0.5471
 epoch: 6, train_loss: 0.8837, test_loss: 0.9305, test_f1: 0.5320
 epoch: 7, train_loss: 0.8459, test_loss: 0.9662, test_f1: 0.5376
 epoch: 8, train_loss: 0.8614, test_loss: 0.9468, test_f1: 0.5448
 epoch: 9, train_loss: 0.8177, test_loss: 0.9379, test_f1: 0.5633
 epoch: 10, train_loss: 0.8139, test_loss: 0.8986, test_f1: 0.5844
 epoch: 11, train_loss: 0.8037, test_loss: 0.9851, test_f1: 0.5344
 epoch: 12, train_loss: 0.7947, test_loss: 0.9278, test_f1: 0.5520
 epoch: 13, train_loss: 0.7852, test_loss: 0.9662, test_f1: 0.5858
 epoch: 14, train_loss: 0.7950, test_loss: 0.9723, test_f1: 0.5310
 epoch: 15, train_loss: 0.7734, test_loss: 0.9912, test_f1: 0.5469
 epoch: 16, train_loss: 0.7620, test_loss: 0.9950, test_f1: 0.5753
 epoch: 17, train_loss: 0.7574, test_loss: 0.9679, test_f1: 0.5756
 epoch: 18, train_loss: 0.7376, test_loss: 0.9663, test_f1: 0.5522
 epoch: 19, train_loss: 0.7216, test_loss: 0.9756, test_f1: 0.5751
 epoch: 20, train_loss: 0.7211, test_loss: 0.9303, test_f1: 0.5839
 epoch: 21, train_loss: 0.7111, test_loss: 1.0223, test_f1: 0.5719
 epoch: 22, train_loss: 0.6963, test_loss: 0.9307, test_f1: 0.5717
 epoch: 23, train_loss: 0.6976, test_loss: 0.9416, test_f1: 0.5879
 epoch: 24, train_loss: 0.6944, test_loss: 1.1122, test_f1: 0.5784
 epoch: 25, train_loss: 0.6978, test_loss: 0.9154, test_f1: 0.5926
 epoch: 26, train_loss: 0.6652, test_loss: 0.9848, test_f1: 0.5967
 epoch: 27, train_loss: 0.6847, test_loss: 0.9486, test_f1: 0.5888
 epoch: 28, train_loss: 0.6545, test_loss: 1.0291, test_f1: 0.5896
 epoch: 29, train_loss: 0.6537, test_loss: 1.0157, test_f1: 0.5958
 epoch: 30, train_loss: 0.6216, test_loss: 1.0751, test_f1: 0.6189
 epoch: 31, train_loss: 0.6346, test_loss: 1.0211, test_f1: 0.5647
 epoch: 32, train_loss: 0.6109, test_loss: 1.0470, test_f1: 0.6601
 epoch: 33, train_loss: 0.6103, test_loss: 1.0235, test_f1: 0.6138
 epoch: 34, train_loss: 0.6074, test_loss: 0.9477, test_f1: 0.6123
 epoch: 35, train_loss: 0.6166, test_loss: 1.0204, test_f1: 0.6177
 epoch: 36, train_loss: 0.5939, test_loss: 0.9098, test_f1: 0.6364
 epoch: 37, train_loss: 0.5813, test_loss: 1.0628, test_f1: 0.6181
 epoch: 38, train_loss: 0.5684, test_loss: 0.9885, test_f1: 0.6327
 epoch: 39, train_loss: 0.5723, test_loss: 1.0470, test_f1: 0.6080
 epoch: 40, train_loss: 0.5555, test_loss: 1.0393, test_f1: 0.6527
 epoch: 41, train_loss: 0.5410, test_loss: 1.0190, test_f1: 0.6294
 epoch: 42, train_loss: 0.5476, test_loss: 0.9419, test_f1: 0.6078
 epoch: 43, train_loss: 0.5220, test_loss: 1.0422, test_f1: 0.6508
 epoch: 44, train_loss: 0.5162, test_loss: 1.0900, test_f1: 0.6407
 epoch: 45, train_loss: 0.5094, test_loss: 1.0797, test_f1: 0.6063
 epoch: 46, train_loss: 0.5076, test_loss: 1.0452, test_f1: 0.6494
 epoch: 47, train_loss: 0.4995, test_loss: 1.0972, test_f1: 0.6255
 epoch: 48, train_loss: 0.4890, test_loss: 0.9572, test_f1: 0.6616
 epoch: 49, train_loss: 0.4790, test_loss: 1.0522, test_f1: 0.6201
 epoch: 50, train_loss: 0.4776, test_loss: 1.1274, test_f1: 0.6327
 epoch: 51, train_loss: 0.4348, test_loss: 1.1697, test_f1: 0.6298
 epoch: 52, train_loss: 0.3938, test_loss: 1.0994, test_f1: 0.6763
 epoch: 53, train_loss: 0.3985, test_loss: 1.1611, test_f1: 0.6566
 epoch: 54, train_loss: 0.3868, test_loss: 1.2096, test_f1: 0.6765
 epoch: 55, train_loss: 0.3709, test_loss: 1.2449, test_f1: 0.6467
 epoch: 56, train_loss: 0.3767, test_loss: 1.2781, test_f1: 0.6502
 epoch: 57, train_loss: 0.3526, test_loss: 1.3044, test_f1: 0.6371
 epoch: 58, train_loss: 0.3621, test_loss: 1.2607, test_f1: 0.6249
 epoch: 59, train_loss: 0.3454, test_loss: 1.2622, test_f1: 0.6439
 epoch: 60, train_loss: 0.3263, test_loss: 1.3041, test_f1: 0.6432
 epoch: 61, train_loss: 0.3249, test_loss: 1.3746, test_f1: 0.6420
 epoch: 62, train_loss: 0.3371, test_loss: 1.3594, test_f1: 0.6272
 epoch: 63, train_loss: 0.3247, test_loss: 1.4130, test_f1: 0.6327
 epoch: 64, train_loss: 0.3410, test_loss: 1.3254, test_f1: 0.6424
 epoch: 65, train_loss: 0.3294, test_loss: 1.3232, test_f1: 0.6563
 epoch: 66, train_loss: 0.3205, test_loss: 1.3942, test_f1: 0.6530
 epoch: 67, train_loss: 0.3037, test_loss: 1.4749, test_f1: 0.6373
 epoch: 68, train_loss: 0.2998, test_loss: 1.3978, test_f1: 0.6441
 epoch: 69, train_loss: 0.2811, test_loss: 1.4228, test_f1: 0.6546
 epoch: 70, train_loss: 0.2926, test_loss: 1.3949, test_f1: 0.6377
 epoch: 71, train_loss: 0.3057, test_loss: 1.3234, test_f1: 0.6631
 epoch: 72, train_loss: 0.2946, test_loss: 1.4766, test_f1: 0.6332
 epoch: 73, train_loss: 0.3021, test_loss: 1.4727, test_f1: 0.6255
 epoch: 74, train_loss: 0.2792, test_loss: 1.5635, test_f1: 0.6522
 epoch: 75, train_loss: 0.2715, test_loss: 1.5190, test_f1: 0.6447
 epoch: 76, train_loss: 0.2791, test_loss: 1.5766, test_f1: 0.6363
 epoch: 77, train_loss: 0.2787, test_loss: 1.5340, test_f1: 0.6563
 epoch: 78, train_loss: 0.2692, test_loss: 1.5068, test_f1: 0.6594
 epoch: 79, train_loss: 0.2676, test_loss: 1.4400, test_f1: 0.6656
 epoch: 80, train_loss: 0.2590, test_loss: 1.5558, test_f1: 0.6481
 epoch: 81, train_loss: 0.2620, test_loss: 1.5226, test_f1: 0.6457
 epoch: 82, train_loss: 0.2634, test_loss: 1.4812, test_f1: 0.6434
 epoch: 83, train_loss: 0.2577, test_loss: 1.5367, test_f1: 0.6421
 epoch: 84, train_loss: 0.2540, test_loss: 1.6304, test_f1: 0.6630
 epoch: 85, train_loss: 0.2531, test_loss: 1.6601, test_f1: 0.6494
 epoch: 86, train_loss: 0.2512, test_loss: 1.5036, test_f1: 0.6482
 epoch: 87, train_loss: 0.2311, test_loss: 1.5321, test_f1: 0.6710
 epoch: 88, train_loss: 0.2629, test_loss: 1.5395, test_f1: 0.6751
 epoch: 89, train_loss: 0.2251, test_loss: 1.4945, test_f1: 0.6527
 epoch: 90, train_loss: 0.2269, test_loss: 1.5321, test_f1: 0.6354
 epoch: 91, train_loss: 0.2328, test_loss: 1.5902, test_f1: 0.6483
 epoch: 92, train_loss: 0.2477, test_loss: 1.7151, test_f1: 0.6383
 epoch: 93, train_loss: 0.2411, test_loss: 1.7391, test_f1: 0.6407
 epoch: 94, train_loss: 0.2427, test_loss: 1.6156, test_f1: 0.6452
 epoch: 95, train_loss: 0.2281, test_loss: 1.6297, test_f1: 0.6417
 epoch: 96, train_loss: 0.2234, test_loss: 1.6646, test_f1: 0.6259
 epoch: 97, train_loss: 0.2265, test_loss: 1.7254, test_f1: 0.6381
 epoch: 98, train_loss: 0.2152, test_loss: 1.6945, test_f1: 0.6415
 epoch: 99, train_loss: 0.2095, test_loss: 2.3566, test_f1: 0.6250

Training completed in 1162.46 seconds
Best F1: 0.7014 at epoch 68
Mean F1 across iterations: 0.6824  0.0132
========================FINAL RESULTS================================
FEGIN weighted F1: 0.7014  0.0132
python main.py --data ltspice_examples --representation component_net --model FEGIN --layers 4 --hiddens 128 --batch_size 64 --lr 0.001 --emb_size 128 --epochs 100 --save_appendix component_net_L4_H128_BS64_LR0.001_E128 --no_val
-----



STDERR:
Processing...
Done!
  File "main.py", line 370, in <module>
    main()
  File "main.py", line 254, in main
    dataset = dataset_class(
  File "/home/philip/projects/llm_inference_code_repo/Circuit-Completion-Using-GNNs/component_classification_with_link_prediction_head/evaluation/FEGIN/kernel/circuit_datasets.py", line 15, in __init__
    self.data, self.slices = torch.load(self.processed_paths[0])
  File "/home/philip/.local/lib/python3.8/site-packages/torch/serialization.py", line 1040, in load
    warnings.warn(
  File "/usr/lib/python3.8/warnings.py", line 109, in _showwarnmsg
    sw(msg.message, msg.category, msg.filename, msg.lineno,
  File "main.py", line 47, in warn_with_traceback
    traceback.print_stack(file=log)
/home/philip/projects/llm_inference_code_repo/Circuit-Completion-Using-GNNs/component_classification_with_link_prediction_head/evaluation/FEGIN/kernel/circuit_datasets.py:15: FutureWarning: You are using `torch.load` with `weights_only=False` (the current default value), which uses the default pickle module implicitly. It is possible to construct malicious pickle data which will execute arbitrary code during unpickling (See https://github.com/pytorch/pytorch/blob/main/SECURITY.md#untrusted-models for more details). In a future release, the default value for `weights_only` will be flipped to `True`. This limits the functions that could be executed during unpickling. Arbitrary objects will no longer be allowed to be loaded via this mode unless they are explicitly allowlisted by the user via `torch.serialization.add_safe_globals`. We recommend you start setting `weights_only=True` for any use case where you don't have full control of the loaded file. Please open an issue on GitHub for any issues related to this experimental feature.
  self.data, self.slices = torch.load(self.processed_paths[0])
