STDOUT:
Results will be saved in /home/philip/projects/ltspice_examples_code_repo/Circuit-Completion-Using-GNNs/component_classification_with_link_prediction_head/evaluation/FEGIN/results/model_FEGIN_dataset_ltspice_examples
Command line input: python main.py --data ltspice_examples --representation component_pin --model FEGIN --layers 5 --hiddens 16 --batch_size 256 --lr 0.001 --emb_size 128 --epochs 100 --save_appendix component_pin_L5_H16_BS256_LR0.001_E128 --no_val
 is saved.
-----
ltspice_examples - FEGIN
Using 5 layers, 16 hidden units, h = 2
Loading component_pin representation dataset
ENTERED
Training FEGIN on component_pin representation
Train: 3560, Test: 848
##################ITERATION #0 ****************************************
 epoch: 0, train_loss: 1.4368, test_loss: 1.4214, test_f1: 0.1017
 epoch: 1, train_loss: 1.4145, test_loss: 1.4059, test_f1: 0.1017
 epoch: 2, train_loss: 1.3940, test_loss: 1.3844, test_f1: 0.1017
 epoch: 3, train_loss: 1.3658, test_loss: 1.3537, test_f1: 0.2076
 epoch: 4, train_loss: 1.3377, test_loss: 1.3245, test_f1: 0.2433
 epoch: 5, train_loss: 1.3117, test_loss: 1.2998, test_f1: 0.2486
 epoch: 6, train_loss: 1.2928, test_loss: 1.2721, test_f1: 0.2499
 epoch: 7, train_loss: 1.2623, test_loss: 1.2449, test_f1: 0.2260
 epoch: 8, train_loss: 1.2353, test_loss: 1.2101, test_f1: 0.2462
 epoch: 9, train_loss: 1.2004, test_loss: 1.1732, test_f1: 0.3806
 epoch: 10, train_loss: 1.1772, test_loss: 1.1325, test_f1: 0.3970
 epoch: 11, train_loss: 1.1444, test_loss: 1.0971, test_f1: 0.3845
 epoch: 12, train_loss: 1.1175, test_loss: 1.0907, test_f1: 0.3840
 epoch: 13, train_loss: 1.0950, test_loss: 1.0797, test_f1: 0.3928
 epoch: 14, train_loss: 1.0865, test_loss: 1.2087, test_f1: 0.3389
 epoch: 15, train_loss: 1.0871, test_loss: 1.0587, test_f1: 0.3758
 epoch: 16, train_loss: 1.0747, test_loss: 1.1277, test_f1: 0.3514
 epoch: 17, train_loss: 1.0648, test_loss: 1.0290, test_f1: 0.3713
 epoch: 18, train_loss: 1.0477, test_loss: 1.0456, test_f1: 0.3655
 epoch: 19, train_loss: 1.0322, test_loss: 1.0294, test_f1: 0.3653
 epoch: 20, train_loss: 1.0246, test_loss: 1.0210, test_f1: 0.3800
 epoch: 21, train_loss: 1.0149, test_loss: 1.0781, test_f1: 0.3968
 epoch: 22, train_loss: 1.0060, test_loss: 1.0487, test_f1: 0.4021
 epoch: 23, train_loss: 1.0120, test_loss: 1.0250, test_f1: 0.4536
 epoch: 24, train_loss: 1.0030, test_loss: 1.0507, test_f1: 0.4051
 epoch: 25, train_loss: 0.9976, test_loss: 1.0353, test_f1: 0.4609
 epoch: 26, train_loss: 0.9823, test_loss: 1.0589, test_f1: 0.4612
 epoch: 27, train_loss: 0.9753, test_loss: 1.0161, test_f1: 0.4712
 epoch: 28, train_loss: 0.9679, test_loss: 1.0371, test_f1: 0.4575
 epoch: 29, train_loss: 0.9672, test_loss: 1.1114, test_f1: 0.5034
 epoch: 30, train_loss: 0.9620, test_loss: 1.0314, test_f1: 0.4551
 epoch: 31, train_loss: 0.9432, test_loss: 1.1161, test_f1: 0.4564
 epoch: 32, train_loss: 0.9481, test_loss: 1.1356, test_f1: 0.5033
 epoch: 33, train_loss: 0.9351, test_loss: 0.9654, test_f1: 0.5096
 epoch: 34, train_loss: 0.9383, test_loss: 1.0009, test_f1: 0.4724
 epoch: 35, train_loss: 0.9360, test_loss: 1.0406, test_f1: 0.5064
 epoch: 36, train_loss: 0.9215, test_loss: 0.9546, test_f1: 0.5092
 epoch: 37, train_loss: 0.9189, test_loss: 0.9953, test_f1: 0.4896
 epoch: 38, train_loss: 0.9221, test_loss: 1.0695, test_f1: 0.4945
 epoch: 39, train_loss: 0.9104, test_loss: 0.9379, test_f1: 0.5396
 epoch: 40, train_loss: 0.9152, test_loss: 1.0231, test_f1: 0.4786
 epoch: 41, train_loss: 0.8970, test_loss: 0.9452, test_f1: 0.5485
 epoch: 42, train_loss: 0.9008, test_loss: 0.9018, test_f1: 0.5182
 epoch: 43, train_loss: 0.8893, test_loss: 0.8945, test_f1: 0.5342
 epoch: 44, train_loss: 0.8890, test_loss: 0.9733, test_f1: 0.5164
 epoch: 45, train_loss: 0.8753, test_loss: 1.0026, test_f1: 0.5101
 epoch: 46, train_loss: 0.8807, test_loss: 0.8924, test_f1: 0.5610
 epoch: 47, train_loss: 0.8663, test_loss: 0.9218, test_f1: 0.5168
 epoch: 48, train_loss: 0.8736, test_loss: 0.8998, test_f1: 0.5284
 epoch: 49, train_loss: 0.8654, test_loss: 1.0165, test_f1: 0.5269
 epoch: 50, train_loss: 0.8580, test_loss: 0.9848, test_f1: 0.5165
 epoch: 51, train_loss: 0.8551, test_loss: 1.0876, test_f1: 0.4959
 epoch: 52, train_loss: 0.8479, test_loss: 0.9132, test_f1: 0.5356
 epoch: 53, train_loss: 0.8397, test_loss: 0.9542, test_f1: 0.5204
 epoch: 54, train_loss: 0.8442, test_loss: 0.9256, test_f1: 0.5191
 epoch: 55, train_loss: 0.8363, test_loss: 0.9089, test_f1: 0.5479
 epoch: 56, train_loss: 0.8325, test_loss: 0.9143, test_f1: 0.5268
 epoch: 57, train_loss: 0.8343, test_loss: 0.9607, test_f1: 0.5343
 epoch: 58, train_loss: 0.8299, test_loss: 0.9193, test_f1: 0.5359
 epoch: 59, train_loss: 0.8306, test_loss: 0.9087, test_f1: 0.5235
 epoch: 60, train_loss: 0.8341, test_loss: 0.9248, test_f1: 0.5400
 epoch: 61, train_loss: 0.8209, test_loss: 0.9912, test_f1: 0.5079
 epoch: 62, train_loss: 0.8253, test_loss: 0.9278, test_f1: 0.5458
 epoch: 63, train_loss: 0.8155, test_loss: 0.9763, test_f1: 0.5456
 epoch: 64, train_loss: 0.8259, test_loss: 0.9147, test_f1: 0.5383
 epoch: 65, train_loss: 0.8280, test_loss: 0.9181, test_f1: 0.5469
 epoch: 66, train_loss: 0.8124, test_loss: 0.9392, test_f1: 0.5398
 epoch: 67, train_loss: 0.8176, test_loss: 0.8909, test_f1: 0.5508
 epoch: 68, train_loss: 0.8177, test_loss: 1.0205, test_f1: 0.5223
 epoch: 69, train_loss: 0.8083, test_loss: 0.9128, test_f1: 0.5347
 epoch: 70, train_loss: 0.8112, test_loss: 0.9198, test_f1: 0.5584
 epoch: 71, train_loss: 0.7989, test_loss: 0.9173, test_f1: 0.5543
 epoch: 72, train_loss: 0.7923, test_loss: 0.9211, test_f1: 0.5403
 epoch: 73, train_loss: 0.8013, test_loss: 0.8908, test_f1: 0.5614
 epoch: 74, train_loss: 0.7970, test_loss: 0.9240, test_f1: 0.5624
 epoch: 75, train_loss: 0.7985, test_loss: 0.8849, test_f1: 0.5479
 epoch: 76, train_loss: 0.8010, test_loss: 1.0198, test_f1: 0.5407
 epoch: 77, train_loss: 0.7959, test_loss: 0.8930, test_f1: 0.5557
 epoch: 78, train_loss: 0.7961, test_loss: 0.8867, test_f1: 0.5533
 epoch: 79, train_loss: 0.7861, test_loss: 0.9298, test_f1: 0.5669
 epoch: 80, train_loss: 0.7894, test_loss: 0.8995, test_f1: 0.5697
 epoch: 81, train_loss: 0.7884, test_loss: 0.9713, test_f1: 0.5519
 epoch: 82, train_loss: 0.7942, test_loss: 0.8890, test_f1: 0.5640
 epoch: 83, train_loss: 0.7884, test_loss: 0.8994, test_f1: 0.5678
 epoch: 84, train_loss: 0.7888, test_loss: 0.9461, test_f1: 0.5308
 epoch: 85, train_loss: 0.7827, test_loss: 0.9010, test_f1: 0.5562
 epoch: 86, train_loss: 0.7849, test_loss: 0.9249, test_f1: 0.5511
 epoch: 87, train_loss: 0.7789, test_loss: 0.9913, test_f1: 0.5687
 epoch: 88, train_loss: 0.7707, test_loss: 0.9019, test_f1: 0.5652
 epoch: 89, train_loss: 0.7827, test_loss: 0.9045, test_f1: 0.5492
 epoch: 90, train_loss: 0.7763, test_loss: 0.9182, test_f1: 0.5628
 epoch: 91, train_loss: 0.7721, test_loss: 0.8450, test_f1: 0.5658
 epoch: 92, train_loss: 0.7756, test_loss: 0.9398, test_f1: 0.5710
 epoch: 93, train_loss: 0.7668, test_loss: 0.9160, test_f1: 0.5560
 epoch: 94, train_loss: 0.7849, test_loss: 0.9178, test_f1: 0.5552
 epoch: 95, train_loss: 0.7648, test_loss: 0.9184, test_f1: 0.5689
 epoch: 96, train_loss: 0.7674, test_loss: 0.9018, test_f1: 0.5462
 epoch: 97, train_loss: 0.7599, test_loss: 0.9014, test_f1: 0.5562
 epoch: 98, train_loss: 0.7725, test_loss: 0.9151, test_f1: 0.5691
 epoch: 99, train_loss: 0.7558, test_loss: 0.9341, test_f1: 0.5613
##################ITERATION #1 ****************************************
 epoch: 0, train_loss: 1.3541, test_loss: 1.3553, test_f1: 0.1017
 epoch: 1, train_loss: 1.2821, test_loss: 1.3287, test_f1: 0.2473
 epoch: 2, train_loss: 1.2344, test_loss: 1.2714, test_f1: 0.2260
 epoch: 3, train_loss: 1.1949, test_loss: 1.1816, test_f1: 0.3388
 epoch: 4, train_loss: 1.1579, test_loss: 1.1363, test_f1: 0.3317
 epoch: 5, train_loss: 1.1240, test_loss: 1.1136, test_f1: 0.3378
 epoch: 6, train_loss: 1.0954, test_loss: 1.1023, test_f1: 0.3419
 epoch: 7, train_loss: 1.0744, test_loss: 1.0992, test_f1: 0.3400
 epoch: 8, train_loss: 1.0558, test_loss: 1.1065, test_f1: 0.3385
 epoch: 9, train_loss: 1.0395, test_loss: 1.1082, test_f1: 0.3566
 epoch: 10, train_loss: 1.0298, test_loss: 1.0850, test_f1: 0.4367
 epoch: 11, train_loss: 1.0284, test_loss: 1.0731, test_f1: 0.4290
 epoch: 12, train_loss: 1.0166, test_loss: 1.0807, test_f1: 0.4446
 epoch: 13, train_loss: 1.0090, test_loss: 1.0892, test_f1: 0.4481
 epoch: 14, train_loss: 0.9998, test_loss: 1.0804, test_f1: 0.4521
 epoch: 15, train_loss: 0.9906, test_loss: 1.0501, test_f1: 0.4542
 epoch: 16, train_loss: 0.9799, test_loss: 1.0676, test_f1: 0.4479
 epoch: 17, train_loss: 0.9765, test_loss: 1.1537, test_f1: 0.4332
 epoch: 18, train_loss: 0.9666, test_loss: 1.0287, test_f1: 0.4730
 epoch: 19, train_loss: 0.9603, test_loss: 1.0617, test_f1: 0.4592
 epoch: 20, train_loss: 0.9591, test_loss: 1.3260, test_f1: 0.4170
 epoch: 21, train_loss: 0.9554, test_loss: 1.0393, test_f1: 0.4692
 epoch: 22, train_loss: 0.9467, test_loss: 0.9988, test_f1: 0.4706
 epoch: 23, train_loss: 0.9411, test_loss: 1.0711, test_f1: 0.4544
 epoch: 24, train_loss: 0.9361, test_loss: 1.0295, test_f1: 0.4739
 epoch: 25, train_loss: 0.9327, test_loss: 1.0750, test_f1: 0.4717
 epoch: 26, train_loss: 0.9239, test_loss: 1.1273, test_f1: 0.4795
 epoch: 27, train_loss: 0.9326, test_loss: 1.0250, test_f1: 0.4871
 epoch: 28, train_loss: 0.9137, test_loss: 1.0079, test_f1: 0.5011
 epoch: 29, train_loss: 0.9093, test_loss: 0.9893, test_f1: 0.4850
 epoch: 30, train_loss: 0.9213, test_loss: 1.1816, test_f1: 0.4723
 epoch: 31, train_loss: 0.9094, test_loss: 1.0387, test_f1: 0.5000
 epoch: 32, train_loss: 0.9192, test_loss: 0.9765, test_f1: 0.5027
 epoch: 33, train_loss: 0.8995, test_loss: 1.0973, test_f1: 0.4939
 epoch: 34, train_loss: 0.9079, test_loss: 1.0082, test_f1: 0.4932
 epoch: 35, train_loss: 0.9167, test_loss: 1.0457, test_f1: 0.4846
 epoch: 36, train_loss: 0.9001, test_loss: 1.0385, test_f1: 0.4839
 epoch: 37, train_loss: 0.8893, test_loss: 1.0151, test_f1: 0.5082
 epoch: 38, train_loss: 0.8875, test_loss: 1.0146, test_f1: 0.4862
 epoch: 39, train_loss: 0.8893, test_loss: 1.0016, test_f1: 0.4908
 epoch: 40, train_loss: 0.8747, test_loss: 0.9960, test_f1: 0.5076
 epoch: 41, train_loss: 0.8746, test_loss: 1.0872, test_f1: 0.4920
 epoch: 42, train_loss: 0.8761, test_loss: 0.9843, test_f1: 0.5168
 epoch: 43, train_loss: 0.8689, test_loss: 0.9856, test_f1: 0.4973
 epoch: 44, train_loss: 0.8588, test_loss: 0.9964, test_f1: 0.4982
 epoch: 45, train_loss: 0.8594, test_loss: 0.9795, test_f1: 0.5107
 epoch: 46, train_loss: 0.8740, test_loss: 1.0425, test_f1: 0.4883
 epoch: 47, train_loss: 0.8516, test_loss: 1.0364, test_f1: 0.5033
 epoch: 48, train_loss: 0.8550, test_loss: 1.0412, test_f1: 0.4875
 epoch: 49, train_loss: 0.8444, test_loss: 1.0013, test_f1: 0.5184
 epoch: 50, train_loss: 0.8463, test_loss: 1.0499, test_f1: 0.5264
 epoch: 51, train_loss: 0.8393, test_loss: 0.9938, test_f1: 0.5143
 epoch: 52, train_loss: 0.8378, test_loss: 0.9813, test_f1: 0.5042
 epoch: 53, train_loss: 0.8292, test_loss: 1.0240, test_f1: 0.4964
 epoch: 54, train_loss: 0.8196, test_loss: 1.0439, test_f1: 0.5000
 epoch: 55, train_loss: 0.8278, test_loss: 1.0323, test_f1: 0.5246
 epoch: 56, train_loss: 0.8344, test_loss: 1.0128, test_f1: 0.5107
 epoch: 57, train_loss: 0.8285, test_loss: 1.0225, test_f1: 0.5296
 epoch: 58, train_loss: 0.8214, test_loss: 1.0075, test_f1: 0.5189
 epoch: 59, train_loss: 0.8149, test_loss: 1.0077, test_f1: 0.5087
 epoch: 60, train_loss: 0.8175, test_loss: 1.0193, test_f1: 0.5116
 epoch: 61, train_loss: 0.8149, test_loss: 1.0112, test_f1: 0.5062
 epoch: 62, train_loss: 0.8145, test_loss: 1.0235, test_f1: 0.5180
 epoch: 63, train_loss: 0.8110, test_loss: 1.0202, test_f1: 0.5227
 epoch: 64, train_loss: 0.8116, test_loss: 1.1132, test_f1: 0.5139
 epoch: 65, train_loss: 0.8193, test_loss: 1.0145, test_f1: 0.5179
 epoch: 66, train_loss: 0.8059, test_loss: 1.0146, test_f1: 0.5241
 epoch: 67, train_loss: 0.8016, test_loss: 1.0262, test_f1: 0.5288
 epoch: 68, train_loss: 0.8071, test_loss: 0.9973, test_f1: 0.5146
 epoch: 69, train_loss: 0.8068, test_loss: 1.0877, test_f1: 0.5174
 epoch: 70, train_loss: 0.7984, test_loss: 1.0737, test_f1: 0.5140
 epoch: 71, train_loss: 0.7899, test_loss: 1.0448, test_f1: 0.5184
 epoch: 72, train_loss: 0.7968, test_loss: 1.0486, test_f1: 0.5158
 epoch: 73, train_loss: 0.7998, test_loss: 1.0318, test_f1: 0.5199
 epoch: 74, train_loss: 0.7981, test_loss: 1.0954, test_f1: 0.5163
 epoch: 75, train_loss: 0.7991, test_loss: 1.0340, test_f1: 0.5183
 epoch: 76, train_loss: 0.7867, test_loss: 1.0814, test_f1: 0.5160
 epoch: 77, train_loss: 0.7940, test_loss: 1.0803, test_f1: 0.5172
 epoch: 78, train_loss: 0.7991, test_loss: 1.1076, test_f1: 0.5128
 epoch: 79, train_loss: 0.7917, test_loss: 1.0718, test_f1: 0.5145
 epoch: 80, train_loss: 0.7918, test_loss: 1.0153, test_f1: 0.5236
 epoch: 81, train_loss: 0.7850, test_loss: 1.0422, test_f1: 0.5332
 epoch: 82, train_loss: 0.7815, test_loss: 1.0594, test_f1: 0.5204
 epoch: 83, train_loss: 0.7912, test_loss: 1.0596, test_f1: 0.5177
 epoch: 84, train_loss: 0.7730, test_loss: 1.0396, test_f1: 0.5272
 epoch: 85, train_loss: 0.7794, test_loss: 1.0857, test_f1: 0.5114
 epoch: 86, train_loss: 0.7921, test_loss: 1.0914, test_f1: 0.5163
 epoch: 87, train_loss: 0.7802, test_loss: 1.0852, test_f1: 0.5095
 epoch: 88, train_loss: 0.7682, test_loss: 1.0840, test_f1: 0.5122
 epoch: 89, train_loss: 0.7708, test_loss: 1.0338, test_f1: 0.5218
 epoch: 90, train_loss: 0.7741, test_loss: 1.0844, test_f1: 0.4961
 epoch: 91, train_loss: 0.7776, test_loss: 1.0687, test_f1: 0.5144
 epoch: 92, train_loss: 0.7675, test_loss: 1.0883, test_f1: 0.5222
 epoch: 93, train_loss: 0.7726, test_loss: 1.0353, test_f1: 0.5159
 epoch: 94, train_loss: 0.7686, test_loss: 1.1769, test_f1: 0.4932
 epoch: 95, train_loss: 0.7645, test_loss: 1.0690, test_f1: 0.5025
 epoch: 96, train_loss: 0.7747, test_loss: 1.0599, test_f1: 0.5002
 epoch: 97, train_loss: 0.7642, test_loss: 1.1688, test_f1: 0.4965
 epoch: 98, train_loss: 0.7806, test_loss: 1.1005, test_f1: 0.4736
 epoch: 99, train_loss: 0.7633, test_loss: 1.1118, test_f1: 0.5128
##################ITERATION #2 ****************************************
 epoch: 0, train_loss: 1.3439, test_loss: 1.3439, test_f1: 0.1017
 epoch: 1, train_loss: 1.2696, test_loss: 1.3206, test_f1: 0.2262
 epoch: 2, train_loss: 1.2170, test_loss: 1.2592, test_f1: 0.2406
 epoch: 3, train_loss: 1.1609, test_loss: 1.1380, test_f1: 0.3437
 epoch: 4, train_loss: 1.1180, test_loss: 1.0732, test_f1: 0.4214
 epoch: 5, train_loss: 1.0877, test_loss: 1.0532, test_f1: 0.4523
 epoch: 6, train_loss: 1.0671, test_loss: 1.0403, test_f1: 0.4599
 epoch: 7, train_loss: 1.0517, test_loss: 1.0327, test_f1: 0.4597
 epoch: 8, train_loss: 1.0306, test_loss: 1.0151, test_f1: 0.4672
 epoch: 9, train_loss: 1.0248, test_loss: 1.0171, test_f1: 0.4687
 epoch: 10, train_loss: 1.0141, test_loss: 1.0079, test_f1: 0.4637
 epoch: 11, train_loss: 1.0092, test_loss: 1.0117, test_f1: 0.4909
 epoch: 12, train_loss: 0.9906, test_loss: 0.9933, test_f1: 0.4896
 epoch: 13, train_loss: 0.9881, test_loss: 0.9729, test_f1: 0.4985
 epoch: 14, train_loss: 0.9797, test_loss: 0.9650, test_f1: 0.4943
 epoch: 15, train_loss: 0.9737, test_loss: 0.9682, test_f1: 0.5126
 epoch: 16, train_loss: 0.9616, test_loss: 0.9609, test_f1: 0.4894
 epoch: 17, train_loss: 0.9515, test_loss: 0.9598, test_f1: 0.4972
 epoch: 18, train_loss: 0.9508, test_loss: 0.9759, test_f1: 0.4994
 epoch: 19, train_loss: 0.9424, test_loss: 0.9555, test_f1: 0.5073
 epoch: 20, train_loss: 0.9365, test_loss: 0.9946, test_f1: 0.4910
 epoch: 21, train_loss: 0.9305, test_loss: 0.9740, test_f1: 0.4944
 epoch: 22, train_loss: 0.9226, test_loss: 0.9724, test_f1: 0.4959
 epoch: 23, train_loss: 0.9174, test_loss: 0.9532, test_f1: 0.5029
 epoch: 24, train_loss: 0.9278, test_loss: 1.0028, test_f1: 0.4907
 epoch: 25, train_loss: 0.9141, test_loss: 0.9764, test_f1: 0.5126
 epoch: 26, train_loss: 0.8985, test_loss: 0.9706, test_f1: 0.4952
 epoch: 27, train_loss: 0.9064, test_loss: 0.9660, test_f1: 0.5093
 epoch: 28, train_loss: 0.8875, test_loss: 0.9664, test_f1: 0.4933
 epoch: 29, train_loss: 0.8878, test_loss: 1.1057, test_f1: 0.4580
 epoch: 30, train_loss: 0.8939, test_loss: 0.9230, test_f1: 0.5186
 epoch: 31, train_loss: 0.8725, test_loss: 0.9486, test_f1: 0.4991
 epoch: 32, train_loss: 0.8665, test_loss: 0.9802, test_f1: 0.4863
 epoch: 33, train_loss: 0.8671, test_loss: 0.9437, test_f1: 0.5009
 epoch: 34, train_loss: 0.8524, test_loss: 0.9261, test_f1: 0.5060
 epoch: 35, train_loss: 0.8487, test_loss: 0.9454, test_f1: 0.5058
 epoch: 36, train_loss: 0.8461, test_loss: 0.9575, test_f1: 0.5102
 epoch: 37, train_loss: 0.8609, test_loss: 0.9249, test_f1: 0.5105
 epoch: 38, train_loss: 0.8614, test_loss: 0.9372, test_f1: 0.5082
 epoch: 39, train_loss: 0.8479, test_loss: 0.9491, test_f1: 0.5219
 epoch: 40, train_loss: 0.8450, test_loss: 0.9578, test_f1: 0.5219
 epoch: 41, train_loss: 0.8416, test_loss: 0.9399, test_f1: 0.5112
 epoch: 42, train_loss: 0.8353, test_loss: 0.9071, test_f1: 0.5147
 epoch: 43, train_loss: 0.8219, test_loss: 0.9576, test_f1: 0.5308
 epoch: 44, train_loss: 0.8127, test_loss: 0.9435, test_f1: 0.5192
 epoch: 45, train_loss: 0.8292, test_loss: 0.9092, test_f1: 0.5206
 epoch: 46, train_loss: 0.8178, test_loss: 0.9281, test_f1: 0.5173
 epoch: 47, train_loss: 0.8134, test_loss: 0.9214, test_f1: 0.5205
 epoch: 48, train_loss: 0.8061, test_loss: 0.9702, test_f1: 0.5199
 epoch: 49, train_loss: 0.8235, test_loss: 0.9471, test_f1: 0.5414
 epoch: 50, train_loss: 0.8019, test_loss: 0.9394, test_f1: 0.5355
 epoch: 51, train_loss: 0.7855, test_loss: 0.9194, test_f1: 0.5277
 epoch: 52, train_loss: 0.7928, test_loss: 0.9700, test_f1: 0.5217
 epoch: 53, train_loss: 0.7899, test_loss: 0.9311, test_f1: 0.5384
 epoch: 54, train_loss: 0.7963, test_loss: 0.9310, test_f1: 0.5380
 epoch: 55, train_loss: 0.7836, test_loss: 0.9698, test_f1: 0.5292
 epoch: 56, train_loss: 0.7810, test_loss: 0.9342, test_f1: 0.5335
 epoch: 57, train_loss: 0.7814, test_loss: 0.9500, test_f1: 0.5238
 epoch: 58, train_loss: 0.7753, test_loss: 0.9243, test_f1: 0.5369
 epoch: 59, train_loss: 0.7644, test_loss: 0.9207, test_f1: 0.5262
 epoch: 60, train_loss: 0.7742, test_loss: 0.9693, test_f1: 0.5238
 epoch: 61, train_loss: 0.7757, test_loss: 0.9703, test_f1: 0.5188
 epoch: 62, train_loss: 0.7528, test_loss: 0.9659, test_f1: 0.5346
 epoch: 63, train_loss: 0.7690, test_loss: 0.9601, test_f1: 0.5326
 epoch: 64, train_loss: 0.7668, test_loss: 0.9694, test_f1: 0.5305
 epoch: 65, train_loss: 0.7590, test_loss: 0.9359, test_f1: 0.5523
 epoch: 66, train_loss: 0.7676, test_loss: 1.0024, test_f1: 0.5270
 epoch: 67, train_loss: 0.7687, test_loss: 0.9626, test_f1: 0.5309
 epoch: 68, train_loss: 0.7629, test_loss: 0.9321, test_f1: 0.5374
 epoch: 69, train_loss: 0.7591, test_loss: 0.9676, test_f1: 0.5261
 epoch: 70, train_loss: 0.7611, test_loss: 0.9314, test_f1: 0.5323
 epoch: 71, train_loss: 0.7571, test_loss: 0.9564, test_f1: 0.5292
 epoch: 72, train_loss: 0.7488, test_loss: 0.9385, test_f1: 0.5364
 epoch: 73, train_loss: 0.7528, test_loss: 0.9893, test_f1: 0.5309
 epoch: 74, train_loss: 0.7503, test_loss: 0.9246, test_f1: 0.5396
 epoch: 75, train_loss: 0.7631, test_loss: 0.9847, test_f1: 0.5354
 epoch: 76, train_loss: 0.7420, test_loss: 0.9451, test_f1: 0.5506
 epoch: 77, train_loss: 0.7430, test_loss: 1.0058, test_f1: 0.5169
 epoch: 78, train_loss: 0.7449, test_loss: 0.9582, test_f1: 0.5395
 epoch: 79, train_loss: 0.7410, test_loss: 0.9789, test_f1: 0.5503
 epoch: 80, train_loss: 0.7450, test_loss: 0.9558, test_f1: 0.5490
 epoch: 81, train_loss: 0.7394, test_loss: 0.9706, test_f1: 0.5428
 epoch: 82, train_loss: 0.7447, test_loss: 0.9305, test_f1: 0.5542
 epoch: 83, train_loss: 0.7502, test_loss: 0.9625, test_f1: 0.5489
 epoch: 84, train_loss: 0.7301, test_loss: 0.9674, test_f1: 0.5379
 epoch: 85, train_loss: 0.7514, test_loss: 0.9650, test_f1: 0.5479
 epoch: 86, train_loss: 0.7289, test_loss: 0.9910, test_f1: 0.5330
 epoch: 87, train_loss: 0.7431, test_loss: 0.9832, test_f1: 0.5446
 epoch: 88, train_loss: 0.7372, test_loss: 0.9481, test_f1: 0.5500
 epoch: 89, train_loss: 0.7193, test_loss: 1.0519, test_f1: 0.5088
 epoch: 90, train_loss: 0.7330, test_loss: 1.0084, test_f1: 0.5563
 epoch: 91, train_loss: 0.7469, test_loss: 1.0224, test_f1: 0.5399
 epoch: 92, train_loss: 0.7325, test_loss: 1.0092, test_f1: 0.5312
 epoch: 93, train_loss: 0.7228, test_loss: 0.9965, test_f1: 0.5315
 epoch: 94, train_loss: 0.7306, test_loss: 0.9611, test_f1: 0.5358
 epoch: 95, train_loss: 0.7269, test_loss: 0.9992, test_f1: 0.5273
 epoch: 96, train_loss: 0.7252, test_loss: 0.9530, test_f1: 0.5588
 epoch: 97, train_loss: 0.7278, test_loss: 1.0649, test_f1: 0.5121
 epoch: 98, train_loss: 0.7197, test_loss: 0.9880, test_f1: 0.5593
 epoch: 99, train_loss: 0.7416, test_loss: 1.0259, test_f1: 0.5352
##################ITERATION #3 ****************************************
 epoch: 0, train_loss: 1.2877, test_loss: 1.3097, test_f1: 0.2260
 epoch: 1, train_loss: 1.2197, test_loss: 1.2948, test_f1: 0.2260
 epoch: 2, train_loss: 1.1928, test_loss: 1.2712, test_f1: 0.2260
 epoch: 3, train_loss: 1.1603, test_loss: 1.1837, test_f1: 0.2754
 epoch: 4, train_loss: 1.1314, test_loss: 1.1004, test_f1: 0.3510
 epoch: 5, train_loss: 1.1053, test_loss: 1.0682, test_f1: 0.3566
 epoch: 6, train_loss: 1.0857, test_loss: 1.0505, test_f1: 0.3583
 epoch: 7, train_loss: 1.0680, test_loss: 1.0334, test_f1: 0.3616
 epoch: 8, train_loss: 1.0625, test_loss: 1.0318, test_f1: 0.3653
 epoch: 9, train_loss: 1.0442, test_loss: 1.0435, test_f1: 0.3482
 epoch: 10, train_loss: 1.0352, test_loss: 1.0147, test_f1: 0.3588
 epoch: 11, train_loss: 1.0241, test_loss: 1.0079, test_f1: 0.3693
 epoch: 12, train_loss: 1.0174, test_loss: 1.0089, test_f1: 0.3984
 epoch: 13, train_loss: 1.0031, test_loss: 1.0466, test_f1: 0.4157
 epoch: 14, train_loss: 0.9965, test_loss: 1.0094, test_f1: 0.4370
 epoch: 15, train_loss: 0.9865, test_loss: 0.9966, test_f1: 0.4422
 epoch: 16, train_loss: 0.9794, test_loss: 1.0164, test_f1: 0.4355
 epoch: 17, train_loss: 0.9772, test_loss: 1.0293, test_f1: 0.4283
 epoch: 18, train_loss: 0.9709, test_loss: 1.0653, test_f1: 0.4204
 epoch: 19, train_loss: 0.9681, test_loss: 1.0722, test_f1: 0.4398
 epoch: 20, train_loss: 0.9604, test_loss: 1.0366, test_f1: 0.4676
 epoch: 21, train_loss: 0.9552, test_loss: 1.0024, test_f1: 0.4567
 epoch: 22, train_loss: 0.9464, test_loss: 1.0121, test_f1: 0.4676
 epoch: 23, train_loss: 0.9453, test_loss: 1.0018, test_f1: 0.4570
 epoch: 24, train_loss: 0.9432, test_loss: 1.0184, test_f1: 0.4595
 epoch: 25, train_loss: 0.9357, test_loss: 1.0087, test_f1: 0.4668
 epoch: 26, train_loss: 0.9341, test_loss: 0.9801, test_f1: 0.4593
 epoch: 27, train_loss: 0.9213, test_loss: 1.0384, test_f1: 0.4684
 epoch: 28, train_loss: 0.9189, test_loss: 1.0767, test_f1: 0.4569
 epoch: 29, train_loss: 0.9179, test_loss: 1.0211, test_f1: 0.4748
 epoch: 30, train_loss: 0.9051, test_loss: 1.0428, test_f1: 0.4705
 epoch: 31, train_loss: 0.9144, test_loss: 1.0487, test_f1: 0.4697
 epoch: 32, train_loss: 0.9114, test_loss: 0.9991, test_f1: 0.4848
 epoch: 33, train_loss: 0.9025, test_loss: 1.0284, test_f1: 0.4717
 epoch: 34, train_loss: 0.8837, test_loss: 0.9818, test_f1: 0.4753
 epoch: 35, train_loss: 0.8947, test_loss: 1.0282, test_f1: 0.4730
 epoch: 36, train_loss: 0.8925, test_loss: 1.0236, test_f1: 0.4873
 epoch: 37, train_loss: 0.8909, test_loss: 1.0489, test_f1: 0.4769
 epoch: 38, train_loss: 0.8821, test_loss: 1.0099, test_f1: 0.4845
 epoch: 39, train_loss: 0.8825, test_loss: 0.9951, test_f1: 0.4796
 epoch: 40, train_loss: 0.8780, test_loss: 1.0592, test_f1: 0.4489
 epoch: 41, train_loss: 0.8698, test_loss: 1.0004, test_f1: 0.4803
 epoch: 42, train_loss: 0.8657, test_loss: 1.0214, test_f1: 0.4618
 epoch: 43, train_loss: 0.8742, test_loss: 1.0601, test_f1: 0.4682
 epoch: 44, train_loss: 0.8632, test_loss: 1.0017, test_f1: 0.4805
 epoch: 45, train_loss: 0.8661, test_loss: 0.9536, test_f1: 0.5001
 epoch: 46, train_loss: 0.8539, test_loss: 1.0150, test_f1: 0.5003
 epoch: 47, train_loss: 0.8560, test_loss: 1.0018, test_f1: 0.5032
 epoch: 48, train_loss: 0.8551, test_loss: 0.9560, test_f1: 0.4980
 epoch: 49, train_loss: 0.8529, test_loss: 1.0616, test_f1: 0.4636
 epoch: 50, train_loss: 0.8567, test_loss: 1.0016, test_f1: 0.4993
 epoch: 51, train_loss: 0.8479, test_loss: 0.9879, test_f1: 0.4986
 epoch: 52, train_loss: 0.8339, test_loss: 0.9480, test_f1: 0.5163
 epoch: 53, train_loss: 0.8288, test_loss: 0.9642, test_f1: 0.5216
 epoch: 54, train_loss: 0.8244, test_loss: 0.9616, test_f1: 0.5103
 epoch: 55, train_loss: 0.8266, test_loss: 0.9614, test_f1: 0.5170
 epoch: 56, train_loss: 0.8283, test_loss: 0.9730, test_f1: 0.5256
 epoch: 57, train_loss: 0.8195, test_loss: 0.9481, test_f1: 0.5345
 epoch: 58, train_loss: 0.8223, test_loss: 0.9600, test_f1: 0.5292
 epoch: 59, train_loss: 0.8128, test_loss: 0.9748, test_f1: 0.5106
 epoch: 60, train_loss: 0.8186, test_loss: 0.9473, test_f1: 0.5230
 epoch: 61, train_loss: 0.8064, test_loss: 0.9817, test_f1: 0.5240
 epoch: 62, train_loss: 0.8143, test_loss: 0.9873, test_f1: 0.5148
 epoch: 63, train_loss: 0.8053, test_loss: 0.9459, test_f1: 0.5338
 epoch: 64, train_loss: 0.8040, test_loss: 0.9891, test_f1: 0.5013
 epoch: 65, train_loss: 0.8023, test_loss: 0.9556, test_f1: 0.5279
 epoch: 66, train_loss: 0.8020, test_loss: 0.9851, test_f1: 0.5213
 epoch: 67, train_loss: 0.8056, test_loss: 0.9802, test_f1: 0.5215
 epoch: 68, train_loss: 0.7992, test_loss: 0.9816, test_f1: 0.5147
 epoch: 69, train_loss: 0.7968, test_loss: 0.9608, test_f1: 0.5202
 epoch: 70, train_loss: 0.7958, test_loss: 0.9898, test_f1: 0.5176
 epoch: 71, train_loss: 0.7979, test_loss: 0.9285, test_f1: 0.5261
 epoch: 72, train_loss: 0.8012, test_loss: 0.9757, test_f1: 0.4983
 epoch: 73, train_loss: 0.7997, test_loss: 0.9895, test_f1: 0.5099
 epoch: 74, train_loss: 0.8086, test_loss: 0.9389, test_f1: 0.5357
 epoch: 75, train_loss: 0.7849, test_loss: 0.9422, test_f1: 0.5295
 epoch: 76, train_loss: 0.7880, test_loss: 0.9669, test_f1: 0.5203
 epoch: 77, train_loss: 0.7873, test_loss: 0.9514, test_f1: 0.5250
 epoch: 78, train_loss: 0.7893, test_loss: 0.9697, test_f1: 0.5150
 epoch: 79, train_loss: 0.7847, test_loss: 0.9744, test_f1: 0.5157
 epoch: 80, train_loss: 0.7743, test_loss: 0.9795, test_f1: 0.5151
 epoch: 81, train_loss: 0.7862, test_loss: 0.9334, test_f1: 0.5342
 epoch: 82, train_loss: 0.7796, test_loss: 0.9542, test_f1: 0.5217
 epoch: 83, train_loss: 0.7813, test_loss: 0.9887, test_f1: 0.4990
 epoch: 84, train_loss: 0.7918, test_loss: 0.9353, test_f1: 0.5456
 epoch: 85, train_loss: 0.7925, test_loss: 0.9543, test_f1: 0.5328
 epoch: 86, train_loss: 0.7674, test_loss: 0.9720, test_f1: 0.5180
 epoch: 87, train_loss: 0.7696, test_loss: 0.9737, test_f1: 0.5232
 epoch: 88, train_loss: 0.7597, test_loss: 0.9724, test_f1: 0.5109
 epoch: 89, train_loss: 0.7714, test_loss: 0.9465, test_f1: 0.5116
 epoch: 90, train_loss: 0.7628, test_loss: 0.9676, test_f1: 0.5189
 epoch: 91, train_loss: 0.7692, test_loss: 0.9552, test_f1: 0.5315
 epoch: 92, train_loss: 0.7714, test_loss: 0.9656, test_f1: 0.5276
 epoch: 93, train_loss: 0.7686, test_loss: 0.9569, test_f1: 0.5163
 epoch: 94, train_loss: 0.7557, test_loss: 0.9813, test_f1: 0.5202
 epoch: 95, train_loss: 0.7607, test_loss: 0.9539, test_f1: 0.5372
 epoch: 96, train_loss: 0.7624, test_loss: 0.9847, test_f1: 0.5271
 epoch: 97, train_loss: 0.7606, test_loss: 0.9539, test_f1: 0.5357
 epoch: 98, train_loss: 0.7409, test_loss: 0.9907, test_f1: 0.5126
 epoch: 99, train_loss: 0.7570, test_loss: 0.9436, test_f1: 0.5422
##################ITERATION #4 ****************************************
 epoch: 0, train_loss: 1.2989, test_loss: 1.3377, test_f1: 0.2260
 epoch: 1, train_loss: 1.2262, test_loss: 1.3263, test_f1: 0.2260
 epoch: 2, train_loss: 1.1953, test_loss: 1.3074, test_f1: 0.2260
 epoch: 3, train_loss: 1.1609, test_loss: 1.2454, test_f1: 0.2260
 epoch: 4, train_loss: 1.1337, test_loss: 1.1252, test_f1: 0.3390
 epoch: 5, train_loss: 1.1197, test_loss: 1.0991, test_f1: 0.3475
 epoch: 6, train_loss: 1.0924, test_loss: 1.0904, test_f1: 0.3620
 epoch: 7, train_loss: 1.0725, test_loss: 1.0816, test_f1: 0.3911
 epoch: 8, train_loss: 1.0591, test_loss: 1.0731, test_f1: 0.4107
 epoch: 9, train_loss: 1.0455, test_loss: 1.0709, test_f1: 0.4185
 epoch: 10, train_loss: 1.0378, test_loss: 1.0739, test_f1: 0.4545
 epoch: 11, train_loss: 1.0258, test_loss: 1.0861, test_f1: 0.4586
 epoch: 12, train_loss: 1.0224, test_loss: 1.0763, test_f1: 0.4467
 epoch: 13, train_loss: 1.0111, test_loss: 1.0825, test_f1: 0.4378
 epoch: 14, train_loss: 1.0104, test_loss: 1.0395, test_f1: 0.4452
 epoch: 15, train_loss: 1.0081, test_loss: 1.0420, test_f1: 0.4740
 epoch: 16, train_loss: 0.9942, test_loss: 1.0339, test_f1: 0.4691
 epoch: 17, train_loss: 0.9847, test_loss: 1.0390, test_f1: 0.4650
 epoch: 18, train_loss: 0.9836, test_loss: 1.0204, test_f1: 0.4636
 epoch: 19, train_loss: 0.9777, test_loss: 1.0132, test_f1: 0.4844
 epoch: 20, train_loss: 0.9681, test_loss: 1.0207, test_f1: 0.4709
 epoch: 21, train_loss: 0.9664, test_loss: 1.0575, test_f1: 0.4545
 epoch: 22, train_loss: 0.9607, test_loss: 1.0193, test_f1: 0.4786
 epoch: 23, train_loss: 0.9512, test_loss: 1.0333, test_f1: 0.4879
 epoch: 24, train_loss: 0.9515, test_loss: 1.0303, test_f1: 0.4914
 epoch: 25, train_loss: 0.9426, test_loss: 1.0347, test_f1: 0.5037
 epoch: 26, train_loss: 0.9395, test_loss: 1.0232, test_f1: 0.4827
 epoch: 27, train_loss: 0.9459, test_loss: 1.0154, test_f1: 0.4907
 epoch: 28, train_loss: 0.9352, test_loss: 1.0146, test_f1: 0.4924
 epoch: 29, train_loss: 0.9385, test_loss: 1.0046, test_f1: 0.4867
 epoch: 30, train_loss: 0.9281, test_loss: 1.0179, test_f1: 0.4868
 epoch: 31, train_loss: 0.9222, test_loss: 1.0980, test_f1: 0.4432
 epoch: 32, train_loss: 0.9166, test_loss: 1.0468, test_f1: 0.4782
 epoch: 33, train_loss: 0.9155, test_loss: 1.0164, test_f1: 0.4908
 epoch: 34, train_loss: 0.9089, test_loss: 1.0254, test_f1: 0.4957
 epoch: 35, train_loss: 0.9021, test_loss: 1.0418, test_f1: 0.4836
 epoch: 36, train_loss: 0.9042, test_loss: 1.0432, test_f1: 0.4913
 epoch: 37, train_loss: 0.9049, test_loss: 1.0029, test_f1: 0.5215
 epoch: 38, train_loss: 0.8946, test_loss: 1.0596, test_f1: 0.4826
 epoch: 39, train_loss: 0.8944, test_loss: 1.0124, test_f1: 0.5057
 epoch: 40, train_loss: 0.8810, test_loss: 1.0242, test_f1: 0.5089
 epoch: 41, train_loss: 0.8892, test_loss: 1.0424, test_f1: 0.4859
 epoch: 42, train_loss: 0.8873, test_loss: 1.0017, test_f1: 0.5034
 epoch: 43, train_loss: 0.8851, test_loss: 1.0324, test_f1: 0.4854
 epoch: 44, train_loss: 0.8795, test_loss: 1.0627, test_f1: 0.4922
 epoch: 45, train_loss: 0.8740, test_loss: 1.0003, test_f1: 0.5086
 epoch: 46, train_loss: 0.8759, test_loss: 1.0026, test_f1: 0.5018
 epoch: 47, train_loss: 0.8756, test_loss: 1.0365, test_f1: 0.4853
 epoch: 48, train_loss: 0.8588, test_loss: 1.0216, test_f1: 0.4867
 epoch: 49, train_loss: 0.8513, test_loss: 1.0442, test_f1: 0.4788
 epoch: 50, train_loss: 0.8638, test_loss: 1.0258, test_f1: 0.4966
 epoch: 51, train_loss: 0.8553, test_loss: 1.0163, test_f1: 0.5073
 epoch: 52, train_loss: 0.8454, test_loss: 0.9964, test_f1: 0.5177
 epoch: 53, train_loss: 0.8472, test_loss: 1.0155, test_f1: 0.5082
 epoch: 54, train_loss: 0.8420, test_loss: 1.0290, test_f1: 0.5014
 epoch: 55, train_loss: 0.8358, test_loss: 0.9996, test_f1: 0.5107
 epoch: 56, train_loss: 0.8338, test_loss: 1.0137, test_f1: 0.5023
 epoch: 57, train_loss: 0.8407, test_loss: 1.0011, test_f1: 0.5025
 epoch: 58, train_loss: 0.8270, test_loss: 1.0075, test_f1: 0.5127
 epoch: 59, train_loss: 0.8280, test_loss: 1.0105, test_f1: 0.4972
 epoch: 60, train_loss: 0.8325, test_loss: 1.0066, test_f1: 0.5145
 epoch: 61, train_loss: 0.8279, test_loss: 1.0553, test_f1: 0.5185
 epoch: 62, train_loss: 0.8360, test_loss: 1.0544, test_f1: 0.5008
 epoch: 63, train_loss: 0.8406, test_loss: 1.0301, test_f1: 0.5103
 epoch: 64, train_loss: 0.8333, test_loss: 1.0725, test_f1: 0.5085
 epoch: 65, train_loss: 0.8199, test_loss: 1.0239, test_f1: 0.5368
 epoch: 66, train_loss: 0.8387, test_loss: 1.0079, test_f1: 0.5414
 epoch: 67, train_loss: 0.8277, test_loss: 1.0308, test_f1: 0.5181
 epoch: 68, train_loss: 0.8238, test_loss: 1.0194, test_f1: 0.5176
 epoch: 69, train_loss: 0.8188, test_loss: 0.9865, test_f1: 0.5165
 epoch: 70, train_loss: 0.8228, test_loss: 0.9909, test_f1: 0.5224
 epoch: 71, train_loss: 0.8110, test_loss: 1.0862, test_f1: 0.5068
 epoch: 72, train_loss: 0.8195, test_loss: 1.0390, test_f1: 0.5104
 epoch: 73, train_loss: 0.8168, test_loss: 1.0208, test_f1: 0.5152
 epoch: 74, train_loss: 0.8202, test_loss: 1.0126, test_f1: 0.5276
 epoch: 75, train_loss: 0.8168, test_loss: 1.0150, test_f1: 0.5190
 epoch: 76, train_loss: 0.8074, test_loss: 1.0056, test_f1: 0.5232
 epoch: 77, train_loss: 0.8036, test_loss: 1.0121, test_f1: 0.5208
 epoch: 78, train_loss: 0.7949, test_loss: 1.0166, test_f1: 0.5322
 epoch: 79, train_loss: 0.8028, test_loss: 1.0243, test_f1: 0.5165
 epoch: 80, train_loss: 0.8074, test_loss: 1.0366, test_f1: 0.5072
 epoch: 81, train_loss: 0.8094, test_loss: 1.0116, test_f1: 0.5152
 epoch: 82, train_loss: 0.8084, test_loss: 1.0264, test_f1: 0.4974
 epoch: 83, train_loss: 0.8043, test_loss: 1.0287, test_f1: 0.5131
 epoch: 84, train_loss: 0.8142, test_loss: 1.0268, test_f1: 0.5292
 epoch: 85, train_loss: 0.7909, test_loss: 0.9879, test_f1: 0.5366
 epoch: 86, train_loss: 0.7928, test_loss: 1.0473, test_f1: 0.5203
 epoch: 87, train_loss: 0.7892, test_loss: 1.0000, test_f1: 0.5271
 epoch: 88, train_loss: 0.7903, test_loss: 0.9840, test_f1: 0.5203
 epoch: 89, train_loss: 0.8084, test_loss: 1.0291, test_f1: 0.5218
 epoch: 90, train_loss: 0.8030, test_loss: 1.0345, test_f1: 0.5204
 epoch: 91, train_loss: 0.8062, test_loss: 0.9887, test_f1: 0.5420
 epoch: 92, train_loss: 0.7934, test_loss: 1.0157, test_f1: 0.5420
 epoch: 93, train_loss: 0.7887, test_loss: 1.0414, test_f1: 0.5159
 epoch: 94, train_loss: 0.7862, test_loss: 1.0587, test_f1: 0.5283
 epoch: 95, train_loss: 0.7865, test_loss: 1.0046, test_f1: 0.5343
 epoch: 96, train_loss: 0.7846, test_loss: 1.0215, test_f1: 0.5497
 epoch: 97, train_loss: 0.7905, test_loss: 1.0508, test_f1: 0.5190
 epoch: 98, train_loss: 0.7938, test_loss: 1.0827, test_f1: 0.4979
 epoch: 99, train_loss: 0.7925, test_loss: 1.0249, test_f1: 0.5264
##################ITERATION #5 ****************************************
 epoch: 0, train_loss: 1.2868, test_loss: 1.2883, test_f1: 0.2260
 epoch: 1, train_loss: 1.2159, test_loss: 1.2606, test_f1: 0.2260
 epoch: 2, train_loss: 1.1745, test_loss: 1.2338, test_f1: 0.3143
 epoch: 3, train_loss: 1.1346, test_loss: 1.1628, test_f1: 0.3392
 epoch: 4, train_loss: 1.1087, test_loss: 1.0978, test_f1: 0.3557
 epoch: 5, train_loss: 1.0728, test_loss: 1.0518, test_f1: 0.4282
 epoch: 6, train_loss: 1.0592, test_loss: 1.0184, test_f1: 0.4076
 epoch: 7, train_loss: 1.0400, test_loss: 1.0089, test_f1: 0.4360
 epoch: 8, train_loss: 1.0273, test_loss: 1.0092, test_f1: 0.4097
 epoch: 9, train_loss: 1.0138, test_loss: 1.0114, test_f1: 0.4312
 epoch: 10, train_loss: 1.0116, test_loss: 1.0013, test_f1: 0.4512
 epoch: 11, train_loss: 0.9889, test_loss: 0.9940, test_f1: 0.4429
 epoch: 12, train_loss: 0.9840, test_loss: 0.9695, test_f1: 0.4434
 epoch: 13, train_loss: 0.9657, test_loss: 1.0229, test_f1: 0.4604
 epoch: 14, train_loss: 0.9679, test_loss: 1.0033, test_f1: 0.4576
 epoch: 15, train_loss: 0.9693, test_loss: 1.0087, test_f1: 0.4734
 epoch: 16, train_loss: 0.9585, test_loss: 1.0001, test_f1: 0.4517
 epoch: 17, train_loss: 0.9507, test_loss: 1.0021, test_f1: 0.4775
 epoch: 18, train_loss: 0.9504, test_loss: 1.0455, test_f1: 0.4718
 epoch: 19, train_loss: 0.9379, test_loss: 0.9790, test_f1: 0.4819
 epoch: 20, train_loss: 0.9343, test_loss: 0.9714, test_f1: 0.5032
 epoch: 21, train_loss: 0.9282, test_loss: 0.9803, test_f1: 0.4935
 epoch: 22, train_loss: 0.9176, test_loss: 0.9825, test_f1: 0.4921
 epoch: 23, train_loss: 0.9120, test_loss: 1.0055, test_f1: 0.4661
 epoch: 24, train_loss: 0.9114, test_loss: 0.9626, test_f1: 0.4893
 epoch: 25, train_loss: 0.9063, test_loss: 0.9918, test_f1: 0.4817
 epoch: 26, train_loss: 0.8977, test_loss: 1.0627, test_f1: 0.4696
 epoch: 27, train_loss: 0.8976, test_loss: 0.9586, test_f1: 0.4898
 epoch: 28, train_loss: 0.8999, test_loss: 0.9693, test_f1: 0.5153
 epoch: 29, train_loss: 0.8882, test_loss: 0.9717, test_f1: 0.5160
 epoch: 30, train_loss: 0.8761, test_loss: 0.9513, test_f1: 0.4949
 epoch: 31, train_loss: 0.8816, test_loss: 0.9422, test_f1: 0.5119
 epoch: 32, train_loss: 0.8735, test_loss: 0.9845, test_f1: 0.4585
 epoch: 33, train_loss: 0.8763, test_loss: 0.9504, test_f1: 0.5145
 epoch: 34, train_loss: 0.8828, test_loss: 1.4151, test_f1: 0.3985
 epoch: 35, train_loss: 0.8827, test_loss: 0.9433, test_f1: 0.5129
 epoch: 36, train_loss: 0.8707, test_loss: 1.0212, test_f1: 0.5116
 epoch: 37, train_loss: 0.8627, test_loss: 0.9727, test_f1: 0.4949
 epoch: 38, train_loss: 0.8581, test_loss: 0.9480, test_f1: 0.5130
 epoch: 39, train_loss: 0.8487, test_loss: 0.9257, test_f1: 0.5172
 epoch: 40, train_loss: 0.8395, test_loss: 0.9326, test_f1: 0.5177
 epoch: 41, train_loss: 0.8512, test_loss: 0.9353, test_f1: 0.4994
 epoch: 42, train_loss: 0.8472, test_loss: 0.9985, test_f1: 0.5041
 epoch: 43, train_loss: 0.8367, test_loss: 0.9423, test_f1: 0.5200
 epoch: 44, train_loss: 0.8268, test_loss: 0.9426, test_f1: 0.5064
 epoch: 45, train_loss: 0.8308, test_loss: 0.9227, test_f1: 0.5230
 epoch: 46, train_loss: 0.8278, test_loss: 0.9373, test_f1: 0.5114
 epoch: 47, train_loss: 0.8326, test_loss: 0.9435, test_f1: 0.5307
 epoch: 48, train_loss: 0.8307, test_loss: 1.0093, test_f1: 0.5149
 epoch: 49, train_loss: 0.8167, test_loss: 0.9300, test_f1: 0.5386
 epoch: 50, train_loss: 0.8201, test_loss: 0.9549, test_f1: 0.5205
 epoch: 51, train_loss: 0.8238, test_loss: 0.9457, test_f1: 0.5225
 epoch: 52, train_loss: 0.8103, test_loss: 0.9337, test_f1: 0.5519
 epoch: 53, train_loss: 0.8053, test_loss: 0.9317, test_f1: 0.5479
 epoch: 54, train_loss: 0.8081, test_loss: 0.9385, test_f1: 0.5441
 epoch: 55, train_loss: 0.8009, test_loss: 0.9872, test_f1: 0.5302
 epoch: 56, train_loss: 0.7898, test_loss: 0.9582, test_f1: 0.5320
 epoch: 57, train_loss: 0.7921, test_loss: 0.9328, test_f1: 0.5392
 epoch: 58, train_loss: 0.8019, test_loss: 0.9614, test_f1: 0.5330
 epoch: 59, train_loss: 0.7971, test_loss: 0.9644, test_f1: 0.5379
 epoch: 60, train_loss: 0.7924, test_loss: 0.9950, test_f1: 0.5323
 epoch: 61, train_loss: 0.7794, test_loss: 0.9365, test_f1: 0.5388
 epoch: 62, train_loss: 0.7896, test_loss: 0.9282, test_f1: 0.5375
 epoch: 63, train_loss: 0.7959, test_loss: 0.9497, test_f1: 0.5397
 epoch: 64, train_loss: 0.7810, test_loss: 0.9544, test_f1: 0.5550
 epoch: 65, train_loss: 0.7844, test_loss: 0.9338, test_f1: 0.5551
 epoch: 66, train_loss: 0.7852, test_loss: 0.9318, test_f1: 0.5504
 epoch: 67, train_loss: 0.7907, test_loss: 0.9426, test_f1: 0.5538
 epoch: 68, train_loss: 0.7790, test_loss: 0.9782, test_f1: 0.5446
 epoch: 69, train_loss: 0.7806, test_loss: 1.0135, test_f1: 0.5186
 epoch: 70, train_loss: 0.7870, test_loss: 0.9671, test_f1: 0.5393
 epoch: 71, train_loss: 0.7720, test_loss: 0.9412, test_f1: 0.5286
 epoch: 72, train_loss: 0.7789, test_loss: 0.9728, test_f1: 0.5394
 epoch: 73, train_loss: 0.7675, test_loss: 1.0018, test_f1: 0.5359
 epoch: 74, train_loss: 0.7840, test_loss: 0.9527, test_f1: 0.5517
 epoch: 75, train_loss: 0.7768, test_loss: 0.9457, test_f1: 0.5389
 epoch: 76, train_loss: 0.7789, test_loss: 0.9437, test_f1: 0.5484
 epoch: 77, train_loss: 0.7617, test_loss: 0.9657, test_f1: 0.5239
 epoch: 78, train_loss: 0.7649, test_loss: 0.9507, test_f1: 0.5514
 epoch: 79, train_loss: 0.7734, test_loss: 0.9466, test_f1: 0.5338
 epoch: 80, train_loss: 0.7566, test_loss: 0.9302, test_f1: 0.5447
 epoch: 81, train_loss: 0.7677, test_loss: 0.9614, test_f1: 0.5414
 epoch: 82, train_loss: 0.7676, test_loss: 0.9629, test_f1: 0.5417
 epoch: 83, train_loss: 0.7607, test_loss: 0.9678, test_f1: 0.5393
 epoch: 84, train_loss: 0.7552, test_loss: 0.9413, test_f1: 0.5378
 epoch: 85, train_loss: 0.7533, test_loss: 0.9551, test_f1: 0.5344
 epoch: 86, train_loss: 0.7542, test_loss: 1.0101, test_f1: 0.5236
 epoch: 87, train_loss: 0.7652, test_loss: 0.9921, test_f1: 0.5078
 epoch: 88, train_loss: 0.7818, test_loss: 1.0211, test_f1: 0.5374
 epoch: 89, train_loss: 0.7709, test_loss: 0.9870, test_f1: 0.5458
 epoch: 90, train_loss: 0.7580, test_loss: 0.9552, test_f1: 0.5427
 epoch: 91, train_loss: 0.7607, test_loss: 0.9836, test_f1: 0.5328
 epoch: 92, train_loss: 0.7586, test_loss: 0.9909, test_f1: 0.5358
 epoch: 93, train_loss: 0.7570, test_loss: 0.9434, test_f1: 0.5403
 epoch: 94, train_loss: 0.7490, test_loss: 0.9953, test_f1: 0.5363
 epoch: 95, train_loss: 0.7497, test_loss: 1.0006, test_f1: 0.5392
 epoch: 96, train_loss: 0.7515, test_loss: 0.9615, test_f1: 0.5457
 epoch: 97, train_loss: 0.7466, test_loss: 0.9505, test_f1: 0.5428
 epoch: 98, train_loss: 0.7460, test_loss: 0.9649, test_f1: 0.5466
 epoch: 99, train_loss: 0.7437, test_loss: 0.9874, test_f1: 0.5319
##################ITERATION #6 ****************************************
 epoch: 0, train_loss: 1.5524, test_loss: 1.4115, test_f1: 0.2540
 epoch: 1, train_loss: 1.3442, test_loss: 1.3478, test_f1: 0.2260
 epoch: 2, train_loss: 1.2667, test_loss: 1.2713, test_f1: 0.2540
 epoch: 3, train_loss: 1.2275, test_loss: 1.2040, test_f1: 0.2589
 epoch: 4, train_loss: 1.1799, test_loss: 1.1494, test_f1: 0.3622
 epoch: 5, train_loss: 1.1454, test_loss: 1.1017, test_f1: 0.4074
 epoch: 6, train_loss: 1.1216, test_loss: 1.0719, test_f1: 0.4281
 epoch: 7, train_loss: 1.0866, test_loss: 1.0622, test_f1: 0.4157
 epoch: 8, train_loss: 1.0560, test_loss: 1.0335, test_f1: 0.4362
 epoch: 9, train_loss: 1.0381, test_loss: 1.0194, test_f1: 0.4082
 epoch: 10, train_loss: 1.0139, test_loss: 0.9949, test_f1: 0.4534
 epoch: 11, train_loss: 1.0055, test_loss: 0.9883, test_f1: 0.4409
 epoch: 12, train_loss: 0.9839, test_loss: 0.9894, test_f1: 0.4585
 epoch: 13, train_loss: 0.9803, test_loss: 1.0043, test_f1: 0.4526
 epoch: 14, train_loss: 0.9706, test_loss: 0.9724, test_f1: 0.4727
 epoch: 15, train_loss: 0.9640, test_loss: 1.0215, test_f1: 0.4598
 epoch: 16, train_loss: 0.9578, test_loss: 0.9916, test_f1: 0.4887
 epoch: 17, train_loss: 0.9535, test_loss: 1.0035, test_f1: 0.4601
 epoch: 18, train_loss: 0.9448, test_loss: 0.9850, test_f1: 0.4755
 epoch: 19, train_loss: 0.9397, test_loss: 0.9952, test_f1: 0.4733
 epoch: 20, train_loss: 0.9264, test_loss: 0.9873, test_f1: 0.4841
 epoch: 21, train_loss: 0.9314, test_loss: 1.0083, test_f1: 0.4835
 epoch: 22, train_loss: 0.9268, test_loss: 1.0055, test_f1: 0.4730
 epoch: 23, train_loss: 0.9194, test_loss: 0.9742, test_f1: 0.4675
 epoch: 24, train_loss: 0.9116, test_loss: 1.0135, test_f1: 0.4775
 epoch: 25, train_loss: 0.9067, test_loss: 0.9962, test_f1: 0.4869
 epoch: 26, train_loss: 0.8998, test_loss: 0.9842, test_f1: 0.4922
 epoch: 27, train_loss: 0.9070, test_loss: 1.0088, test_f1: 0.4828
 epoch: 28, train_loss: 0.8931, test_loss: 0.9934, test_f1: 0.4937
 epoch: 29, train_loss: 0.9036, test_loss: 1.0048, test_f1: 0.4751
 epoch: 30, train_loss: 0.8959, test_loss: 0.9911, test_f1: 0.4907
 epoch: 31, train_loss: 0.8804, test_loss: 1.1476, test_f1: 0.4199
 epoch: 32, train_loss: 0.8823, test_loss: 0.9734, test_f1: 0.4750
 epoch: 33, train_loss: 0.8890, test_loss: 0.9647, test_f1: 0.4852
 epoch: 34, train_loss: 0.8772, test_loss: 1.0314, test_f1: 0.4698
 epoch: 35, train_loss: 0.8755, test_loss: 0.9688, test_f1: 0.4917
 epoch: 36, train_loss: 0.8648, test_loss: 0.9771, test_f1: 0.5056
 epoch: 37, train_loss: 0.8700, test_loss: 1.0545, test_f1: 0.4852
 epoch: 38, train_loss: 0.8592, test_loss: 0.9812, test_f1: 0.5179
 epoch: 39, train_loss: 0.8647, test_loss: 1.0041, test_f1: 0.4653
 epoch: 40, train_loss: 0.8689, test_loss: 1.4751, test_f1: 0.4162
 epoch: 41, train_loss: 0.8619, test_loss: 0.9885, test_f1: 0.4922
 epoch: 42, train_loss: 0.8431, test_loss: 1.0358, test_f1: 0.4840
 epoch: 43, train_loss: 0.8591, test_loss: 0.9386, test_f1: 0.4764
 epoch: 44, train_loss: 0.8541, test_loss: 1.0111, test_f1: 0.4950
 epoch: 45, train_loss: 0.8561, test_loss: 0.9790, test_f1: 0.5053
 epoch: 46, train_loss: 0.8526, test_loss: 0.9779, test_f1: 0.4963
 epoch: 47, train_loss: 0.8409, test_loss: 0.9870, test_f1: 0.5022
 epoch: 48, train_loss: 0.8320, test_loss: 0.9645, test_f1: 0.5102
 epoch: 49, train_loss: 0.8432, test_loss: 0.9682, test_f1: 0.5069
 epoch: 50, train_loss: 0.8341, test_loss: 0.9866, test_f1: 0.5119
 epoch: 51, train_loss: 0.8373, test_loss: 0.9779, test_f1: 0.5071
 epoch: 52, train_loss: 0.8234, test_loss: 0.9742, test_f1: 0.5215
 epoch: 53, train_loss: 0.8262, test_loss: 0.9869, test_f1: 0.5147
 epoch: 54, train_loss: 0.8238, test_loss: 0.9847, test_f1: 0.5009
 epoch: 55, train_loss: 0.8103, test_loss: 0.9652, test_f1: 0.5192
 epoch: 56, train_loss: 0.8191, test_loss: 0.9642, test_f1: 0.5224
 epoch: 57, train_loss: 0.8160, test_loss: 0.9872, test_f1: 0.5088
 epoch: 58, train_loss: 0.8019, test_loss: 0.9871, test_f1: 0.5159
 epoch: 59, train_loss: 0.8194, test_loss: 0.9791, test_f1: 0.5084
 epoch: 60, train_loss: 0.8106, test_loss: 0.9797, test_f1: 0.5149
 epoch: 61, train_loss: 0.7966, test_loss: 0.9866, test_f1: 0.5079
 epoch: 62, train_loss: 0.7977, test_loss: 0.9678, test_f1: 0.5099
 epoch: 63, train_loss: 0.8062, test_loss: 1.0030, test_f1: 0.5172
 epoch: 64, train_loss: 0.8080, test_loss: 0.9803, test_f1: 0.5163
 epoch: 65, train_loss: 0.7953, test_loss: 0.9800, test_f1: 0.5094
 epoch: 66, train_loss: 0.8060, test_loss: 0.9948, test_f1: 0.5197
 epoch: 67, train_loss: 0.7990, test_loss: 0.9909, test_f1: 0.5081
 epoch: 68, train_loss: 0.7938, test_loss: 0.9967, test_f1: 0.5119
 epoch: 69, train_loss: 0.8025, test_loss: 0.9666, test_f1: 0.4942
 epoch: 70, train_loss: 0.7950, test_loss: 0.9941, test_f1: 0.5301
 epoch: 71, train_loss: 0.8046, test_loss: 0.9775, test_f1: 0.5171
 epoch: 72, train_loss: 0.7914, test_loss: 1.0097, test_f1: 0.5061
 epoch: 73, train_loss: 0.7962, test_loss: 0.9829, test_f1: 0.5158
 epoch: 74, train_loss: 0.7878, test_loss: 0.9588, test_f1: 0.5336
 epoch: 75, train_loss: 0.7912, test_loss: 0.9772, test_f1: 0.5245
 epoch: 76, train_loss: 0.7883, test_loss: 1.0122, test_f1: 0.5085
 epoch: 77, train_loss: 0.7854, test_loss: 0.9628, test_f1: 0.5205
 epoch: 78, train_loss: 0.7847, test_loss: 0.9638, test_f1: 0.5218
 epoch: 79, train_loss: 0.7760, test_loss: 0.9897, test_f1: 0.5186
 epoch: 80, train_loss: 0.7865, test_loss: 0.9847, test_f1: 0.5254
 epoch: 81, train_loss: 0.7872, test_loss: 0.9947, test_f1: 0.5212
 epoch: 82, train_loss: 0.7965, test_loss: 0.9632, test_f1: 0.5278
 epoch: 83, train_loss: 0.7804, test_loss: 0.9652, test_f1: 0.5161
 epoch: 84, train_loss: 0.7796, test_loss: 0.9737, test_f1: 0.5378
 epoch: 85, train_loss: 0.7742, test_loss: 0.9661, test_f1: 0.5199
 epoch: 86, train_loss: 0.7735, test_loss: 1.0114, test_f1: 0.5109
 epoch: 87, train_loss: 0.7701, test_loss: 0.9756, test_f1: 0.5390
 epoch: 88, train_loss: 0.7749, test_loss: 1.0299, test_f1: 0.5048
 epoch: 89, train_loss: 0.7635, test_loss: 0.9612, test_f1: 0.5362
 epoch: 90, train_loss: 0.7623, test_loss: 0.9662, test_f1: 0.5451
 epoch: 91, train_loss: 0.7662, test_loss: 0.9287, test_f1: 0.5340
 epoch: 92, train_loss: 0.7614, test_loss: 0.9777, test_f1: 0.5387
 epoch: 93, train_loss: 0.7644, test_loss: 0.9665, test_f1: 0.5213
 epoch: 94, train_loss: 0.7645, test_loss: 0.9703, test_f1: 0.5291
 epoch: 95, train_loss: 0.7657, test_loss: 0.9584, test_f1: 0.5227
 epoch: 96, train_loss: 0.7564, test_loss: 0.9890, test_f1: 0.5237
 epoch: 97, train_loss: 0.7625, test_loss: 0.9662, test_f1: 0.5227
 epoch: 98, train_loss: 0.7599, test_loss: 0.9726, test_f1: 0.5319
 epoch: 99, train_loss: 0.7616, test_loss: 0.9646, test_f1: 0.5281
##################ITERATION #7 ****************************************
 epoch: 0, train_loss: 1.3988, test_loss: 1.3475, test_f1: 0.2260
 epoch: 1, train_loss: 1.3002, test_loss: 1.3124, test_f1: 0.2260
 epoch: 2, train_loss: 1.2556, test_loss: 1.2620, test_f1: 0.2425
 epoch: 3, train_loss: 1.2309, test_loss: 1.2005, test_f1: 0.2919
 epoch: 4, train_loss: 1.2077, test_loss: 1.1633, test_f1: 0.4180
 epoch: 5, train_loss: 1.1670, test_loss: 1.1054, test_f1: 0.4473
 epoch: 6, train_loss: 1.1256, test_loss: 1.0736, test_f1: 0.4787
 epoch: 7, train_loss: 1.0920, test_loss: 1.0214, test_f1: 0.5017
 epoch: 8, train_loss: 1.0759, test_loss: 1.0675, test_f1: 0.4462
 epoch: 9, train_loss: 1.0556, test_loss: 1.0069, test_f1: 0.5088
 epoch: 10, train_loss: 1.0282, test_loss: 1.0503, test_f1: 0.4504
 epoch: 11, train_loss: 1.0199, test_loss: 1.0528, test_f1: 0.4419
 epoch: 12, train_loss: 1.0032, test_loss: 0.9796, test_f1: 0.4934
 epoch: 13, train_loss: 0.9835, test_loss: 0.9960, test_f1: 0.4732
 epoch: 14, train_loss: 0.9773, test_loss: 0.9822, test_f1: 0.4923
 epoch: 15, train_loss: 0.9709, test_loss: 0.9857, test_f1: 0.4882
 epoch: 16, train_loss: 0.9616, test_loss: 0.9806, test_f1: 0.4837
 epoch: 17, train_loss: 0.9601, test_loss: 1.0119, test_f1: 0.4755
 epoch: 18, train_loss: 0.9442, test_loss: 1.0326, test_f1: 0.4714
 epoch: 19, train_loss: 0.9501, test_loss: 0.9302, test_f1: 0.5208
 epoch: 20, train_loss: 0.9393, test_loss: 0.9791, test_f1: 0.4711
 epoch: 21, train_loss: 0.9249, test_loss: 0.9847, test_f1: 0.4910
 epoch: 22, train_loss: 0.9259, test_loss: 1.0869, test_f1: 0.4293
 epoch: 23, train_loss: 0.9271, test_loss: 0.9635, test_f1: 0.4907
 epoch: 24, train_loss: 0.9208, test_loss: 0.9436, test_f1: 0.5148
 epoch: 25, train_loss: 0.9184, test_loss: 0.9601, test_f1: 0.4910
 epoch: 26, train_loss: 0.9086, test_loss: 0.9268, test_f1: 0.4887
 epoch: 27, train_loss: 0.9015, test_loss: 0.9342, test_f1: 0.5095
 epoch: 28, train_loss: 0.9124, test_loss: 0.9757, test_f1: 0.4989
 epoch: 29, train_loss: 0.9019, test_loss: 0.9357, test_f1: 0.5063
 epoch: 30, train_loss: 0.8867, test_loss: 0.9211, test_f1: 0.5005
 epoch: 31, train_loss: 0.8905, test_loss: 0.9510, test_f1: 0.5179
 epoch: 32, train_loss: 0.8797, test_loss: 0.9941, test_f1: 0.5041
 epoch: 33, train_loss: 0.8891, test_loss: 0.9475, test_f1: 0.5228
 epoch: 34, train_loss: 0.8778, test_loss: 0.9425, test_f1: 0.4994
 epoch: 35, train_loss: 0.8779, test_loss: 0.9640, test_f1: 0.5002
 epoch: 36, train_loss: 0.8716, test_loss: 0.9726, test_f1: 0.4960
 epoch: 37, train_loss: 0.8686, test_loss: 0.9525, test_f1: 0.5168
 epoch: 38, train_loss: 0.8675, test_loss: 1.0991, test_f1: 0.4745
 epoch: 39, train_loss: 0.8637, test_loss: 0.9612, test_f1: 0.5095
 epoch: 40, train_loss: 0.8492, test_loss: 0.9722, test_f1: 0.4967
 epoch: 41, train_loss: 0.8572, test_loss: 0.9321, test_f1: 0.5173
 epoch: 42, train_loss: 0.8444, test_loss: 0.9657, test_f1: 0.5261
 epoch: 43, train_loss: 0.8395, test_loss: 0.9376, test_f1: 0.5146
 epoch: 44, train_loss: 0.8422, test_loss: 0.9397, test_f1: 0.5273
 epoch: 45, train_loss: 0.8375, test_loss: 0.9520, test_f1: 0.5391
 epoch: 46, train_loss: 0.8365, test_loss: 0.9424, test_f1: 0.5200
 epoch: 47, train_loss: 0.8325, test_loss: 0.9405, test_f1: 0.5258
 epoch: 48, train_loss: 0.8380, test_loss: 0.9510, test_f1: 0.5069
 epoch: 49, train_loss: 0.8347, test_loss: 0.9225, test_f1: 0.5248
 epoch: 50, train_loss: 0.8313, test_loss: 0.9122, test_f1: 0.5298
 epoch: 51, train_loss: 0.8187, test_loss: 0.9023, test_f1: 0.5283
 epoch: 52, train_loss: 0.8256, test_loss: 0.9265, test_f1: 0.5355
 epoch: 53, train_loss: 0.8160, test_loss: 0.9255, test_f1: 0.5270
 epoch: 54, train_loss: 0.8222, test_loss: 0.9199, test_f1: 0.5365
 epoch: 55, train_loss: 0.8151, test_loss: 0.9286, test_f1: 0.5325
 epoch: 56, train_loss: 0.8167, test_loss: 0.9312, test_f1: 0.5336
 epoch: 57, train_loss: 0.8173, test_loss: 0.9164, test_f1: 0.5273
 epoch: 58, train_loss: 0.8111, test_loss: 0.8997, test_f1: 0.5525
 epoch: 59, train_loss: 0.8065, test_loss: 0.9268, test_f1: 0.5502
 epoch: 60, train_loss: 0.8006, test_loss: 0.9406, test_f1: 0.5406
 epoch: 61, train_loss: 0.8127, test_loss: 0.9199, test_f1: 0.5346
 epoch: 62, train_loss: 0.7972, test_loss: 0.8958, test_f1: 0.5294
 epoch: 63, train_loss: 0.8040, test_loss: 0.9237, test_f1: 0.5400
 epoch: 64, train_loss: 0.7985, test_loss: 0.9388, test_f1: 0.5439
 epoch: 65, train_loss: 0.7923, test_loss: 0.9079, test_f1: 0.5425
 epoch: 66, train_loss: 0.7868, test_loss: 0.9321, test_f1: 0.5437
 epoch: 67, train_loss: 0.7942, test_loss: 0.9226, test_f1: 0.5294
 epoch: 68, train_loss: 0.7890, test_loss: 0.9207, test_f1: 0.5448
 epoch: 69, train_loss: 0.7901, test_loss: 0.9645, test_f1: 0.5397
 epoch: 70, train_loss: 0.7955, test_loss: 0.9150, test_f1: 0.5518
 epoch: 71, train_loss: 0.8013, test_loss: 0.8931, test_f1: 0.5388
 epoch: 72, train_loss: 0.7923, test_loss: 0.9070, test_f1: 0.5427
 epoch: 73, train_loss: 0.7906, test_loss: 0.9324, test_f1: 0.5319
 epoch: 74, train_loss: 0.8016, test_loss: 0.9616, test_f1: 0.5347
 epoch: 75, train_loss: 0.7803, test_loss: 0.8919, test_f1: 0.5517
 epoch: 76, train_loss: 0.7876, test_loss: 0.9263, test_f1: 0.5404
 epoch: 77, train_loss: 0.7813, test_loss: 1.0034, test_f1: 0.5200
 epoch: 78, train_loss: 0.7868, test_loss: 0.9411, test_f1: 0.5465
 epoch: 79, train_loss: 0.7855, test_loss: 0.9592, test_f1: 0.5422
 epoch: 80, train_loss: 0.7756, test_loss: 0.9119, test_f1: 0.5473
 epoch: 81, train_loss: 0.7860, test_loss: 0.9573, test_f1: 0.5275
 epoch: 82, train_loss: 0.7816, test_loss: 0.9315, test_f1: 0.5323
 epoch: 83, train_loss: 0.7710, test_loss: 0.9224, test_f1: 0.5337
 epoch: 84, train_loss: 0.7768, test_loss: 0.9417, test_f1: 0.5379
 epoch: 85, train_loss: 0.7794, test_loss: 0.9033, test_f1: 0.5474
 epoch: 86, train_loss: 0.7774, test_loss: 0.9531, test_f1: 0.5329
 epoch: 87, train_loss: 0.7810, test_loss: 0.9524, test_f1: 0.5354
 epoch: 88, train_loss: 0.7912, test_loss: 0.9746, test_f1: 0.5518
 epoch: 89, train_loss: 0.7879, test_loss: 0.9451, test_f1: 0.5403
 epoch: 90, train_loss: 0.7780, test_loss: 0.9570, test_f1: 0.5514
 epoch: 91, train_loss: 0.7795, test_loss: 0.9383, test_f1: 0.5489
 epoch: 92, train_loss: 0.7654, test_loss: 0.9125, test_f1: 0.5547
 epoch: 93, train_loss: 0.7701, test_loss: 0.9309, test_f1: 0.5287
 epoch: 94, train_loss: 0.7607, test_loss: 0.9689, test_f1: 0.5440
 epoch: 95, train_loss: 0.7586, test_loss: 0.9595, test_f1: 0.5489
 epoch: 96, train_loss: 0.7717, test_loss: 0.9621, test_f1: 0.5305
 epoch: 97, train_loss: 0.7595, test_loss: 0.9447, test_f1: 0.5524
 epoch: 98, train_loss: 0.7673, test_loss: 0.9452, test_f1: 0.5382
 epoch: 99, train_loss: 0.7698, test_loss: 0.9127, test_f1: 0.5475
##################ITERATION #8 ****************************************
 epoch: 0, train_loss: 1.3656, test_loss: 1.3527, test_f1: 0.2260
 epoch: 1, train_loss: 1.2099, test_loss: 1.3086, test_f1: 0.2500
 epoch: 2, train_loss: 1.1657, test_loss: 1.2443, test_f1: 0.2914
 epoch: 3, train_loss: 1.1231, test_loss: 1.1178, test_f1: 0.4364
 epoch: 4, train_loss: 1.1091, test_loss: 1.0873, test_f1: 0.4225
 epoch: 5, train_loss: 1.0868, test_loss: 1.0809, test_f1: 0.4287
 epoch: 6, train_loss: 1.0666, test_loss: 1.0815, test_f1: 0.4219
 epoch: 7, train_loss: 1.0585, test_loss: 1.0602, test_f1: 0.4520
 epoch: 8, train_loss: 1.0443, test_loss: 1.0803, test_f1: 0.4326
 epoch: 9, train_loss: 1.0437, test_loss: 1.0690, test_f1: 0.4577
 epoch: 10, train_loss: 1.0314, test_loss: 1.0636, test_f1: 0.4520
 epoch: 11, train_loss: 1.0336, test_loss: 1.0836, test_f1: 0.4404
 epoch: 12, train_loss: 1.0259, test_loss: 1.0785, test_f1: 0.4469
 epoch: 13, train_loss: 1.0101, test_loss: 1.0776, test_f1: 0.4441
 epoch: 14, train_loss: 1.0080, test_loss: 1.0789, test_f1: 0.4402
 epoch: 15, train_loss: 0.9973, test_loss: 1.0936, test_f1: 0.4433
 epoch: 16, train_loss: 0.9913, test_loss: 1.0974, test_f1: 0.4547
 epoch: 17, train_loss: 0.9866, test_loss: 1.0996, test_f1: 0.4480
 epoch: 18, train_loss: 0.9852, test_loss: 1.0763, test_f1: 0.4545
 epoch: 19, train_loss: 0.9848, test_loss: 1.1182, test_f1: 0.4637
 epoch: 20, train_loss: 0.9778, test_loss: 1.0986, test_f1: 0.4476
 epoch: 21, train_loss: 0.9790, test_loss: 1.0679, test_f1: 0.4618
 epoch: 22, train_loss: 0.9769, test_loss: 1.0972, test_f1: 0.4733
 epoch: 23, train_loss: 0.9672, test_loss: 1.0955, test_f1: 0.4739
 epoch: 24, train_loss: 0.9670, test_loss: 1.1207, test_f1: 0.4554
 epoch: 25, train_loss: 0.9615, test_loss: 1.1196, test_f1: 0.4495
 epoch: 26, train_loss: 0.9534, test_loss: 1.0816, test_f1: 0.4850
 epoch: 27, train_loss: 0.9491, test_loss: 1.0972, test_f1: 0.4666
 epoch: 28, train_loss: 0.9454, test_loss: 1.0741, test_f1: 0.4868
 epoch: 29, train_loss: 0.9317, test_loss: 1.1524, test_f1: 0.4764
 epoch: 30, train_loss: 0.9333, test_loss: 1.0968, test_f1: 0.4780
 epoch: 31, train_loss: 0.9268, test_loss: 1.0987, test_f1: 0.4739
 epoch: 32, train_loss: 0.9249, test_loss: 1.0948, test_f1: 0.4770
 epoch: 33, train_loss: 0.9267, test_loss: 1.0870, test_f1: 0.4772
 epoch: 34, train_loss: 0.9319, test_loss: 1.0825, test_f1: 0.4853
 epoch: 35, train_loss: 0.9145, test_loss: 1.0957, test_f1: 0.4902
 epoch: 36, train_loss: 0.9168, test_loss: 1.1056, test_f1: 0.4808
 epoch: 37, train_loss: 0.9135, test_loss: 1.1602, test_f1: 0.4696
 epoch: 38, train_loss: 0.9141, test_loss: 1.0867, test_f1: 0.5134
 epoch: 39, train_loss: 0.9109, test_loss: 1.1583, test_f1: 0.4684
 epoch: 40, train_loss: 0.8908, test_loss: 1.0974, test_f1: 0.4817
 epoch: 41, train_loss: 0.9010, test_loss: 1.1414, test_f1: 0.4855
 epoch: 42, train_loss: 0.8965, test_loss: 1.0682, test_f1: 0.4802
 epoch: 43, train_loss: 0.8985, test_loss: 1.1098, test_f1: 0.4828
 epoch: 44, train_loss: 0.9023, test_loss: 1.1046, test_f1: 0.4986
 epoch: 45, train_loss: 0.8832, test_loss: 1.0678, test_f1: 0.5140
 epoch: 46, train_loss: 0.8845, test_loss: 1.0767, test_f1: 0.5068
 epoch: 47, train_loss: 0.8784, test_loss: 1.0914, test_f1: 0.4836
 epoch: 48, train_loss: 0.8969, test_loss: 1.0970, test_f1: 0.4827
 epoch: 49, train_loss: 0.8718, test_loss: 1.1203, test_f1: 0.4791
 epoch: 50, train_loss: 0.8742, test_loss: 1.1025, test_f1: 0.5141
 epoch: 51, train_loss: 0.8686, test_loss: 1.1481, test_f1: 0.4942
 epoch: 52, train_loss: 0.8583, test_loss: 1.0948, test_f1: 0.4903
 epoch: 53, train_loss: 0.8610, test_loss: 1.0861, test_f1: 0.5053
 epoch: 54, train_loss: 0.8500, test_loss: 1.1209, test_f1: 0.4992
 epoch: 55, train_loss: 0.8544, test_loss: 1.0876, test_f1: 0.5025
 epoch: 56, train_loss: 0.8539, test_loss: 1.1112, test_f1: 0.4840
 epoch: 57, train_loss: 0.8564, test_loss: 1.0883, test_f1: 0.5092
 epoch: 58, train_loss: 0.8461, test_loss: 1.0930, test_f1: 0.5061
 epoch: 59, train_loss: 0.8482, test_loss: 1.1128, test_f1: 0.5106
 epoch: 60, train_loss: 0.8452, test_loss: 1.1025, test_f1: 0.5172
 epoch: 61, train_loss: 0.8458, test_loss: 1.0938, test_f1: 0.4942
 epoch: 62, train_loss: 0.8486, test_loss: 1.1173, test_f1: 0.5074
 epoch: 63, train_loss: 0.8448, test_loss: 1.1375, test_f1: 0.4920
 epoch: 64, train_loss: 0.8410, test_loss: 1.1109, test_f1: 0.5025
 epoch: 65, train_loss: 0.8315, test_loss: 1.0900, test_f1: 0.5147
 epoch: 66, train_loss: 0.8452, test_loss: 1.0933, test_f1: 0.5026
 epoch: 67, train_loss: 0.8406, test_loss: 1.1213, test_f1: 0.5059
 epoch: 68, train_loss: 0.8359, test_loss: 1.1171, test_f1: 0.5047
 epoch: 69, train_loss: 0.8417, test_loss: 1.0951, test_f1: 0.5146
 epoch: 70, train_loss: 0.8433, test_loss: 1.0927, test_f1: 0.5047
 epoch: 71, train_loss: 0.8272, test_loss: 1.1317, test_f1: 0.4859
 epoch: 72, train_loss: 0.8291, test_loss: 1.0758, test_f1: 0.5181
 epoch: 73, train_loss: 0.8250, test_loss: 1.0795, test_f1: 0.5194
 epoch: 74, train_loss: 0.8300, test_loss: 1.0788, test_f1: 0.5033
 epoch: 75, train_loss: 0.8360, test_loss: 1.1133, test_f1: 0.5064
 epoch: 76, train_loss: 0.8221, test_loss: 1.0770, test_f1: 0.5140
 epoch: 77, train_loss: 0.8225, test_loss: 1.1078, test_f1: 0.5040
 epoch: 78, train_loss: 0.8295, test_loss: 1.1081, test_f1: 0.5096
 epoch: 79, train_loss: 0.8240, test_loss: 1.0952, test_f1: 0.5191
 epoch: 80, train_loss: 0.8182, test_loss: 1.1273, test_f1: 0.4983
 epoch: 81, train_loss: 0.8172, test_loss: 1.0785, test_f1: 0.5106
 epoch: 82, train_loss: 0.8200, test_loss: 1.0632, test_f1: 0.5077
 epoch: 83, train_loss: 0.8219, test_loss: 1.1038, test_f1: 0.5170
 epoch: 84, train_loss: 0.8171, test_loss: 1.0718, test_f1: 0.5212
 epoch: 85, train_loss: 0.8143, test_loss: 1.1103, test_f1: 0.5038
 epoch: 86, train_loss: 0.8077, test_loss: 1.0779, test_f1: 0.5064
 epoch: 87, train_loss: 0.8260, test_loss: 1.0896, test_f1: 0.5067
 epoch: 88, train_loss: 0.8201, test_loss: 1.0740, test_f1: 0.5181
 epoch: 89, train_loss: 0.8028, test_loss: 1.0919, test_f1: 0.5019
 epoch: 90, train_loss: 0.7998, test_loss: 1.1102, test_f1: 0.4942
 epoch: 91, train_loss: 0.8106, test_loss: 1.1156, test_f1: 0.5018
 epoch: 92, train_loss: 0.8143, test_loss: 1.0955, test_f1: 0.5157
 epoch: 93, train_loss: 0.8401, test_loss: 1.1022, test_f1: 0.4921
 epoch: 94, train_loss: 0.8325, test_loss: 1.0877, test_f1: 0.5044
 epoch: 95, train_loss: 0.8097, test_loss: 1.0742, test_f1: 0.5183
 epoch: 96, train_loss: 0.8069, test_loss: 1.1180, test_f1: 0.5030
 epoch: 97, train_loss: 0.8054, test_loss: 1.1389, test_f1: 0.4840
 epoch: 98, train_loss: 0.7973, test_loss: 1.0764, test_f1: 0.5093
 epoch: 99, train_loss: 0.7935, test_loss: 1.0949, test_f1: 0.5087
##################ITERATION #9 ****************************************
 epoch: 0, train_loss: 1.3933, test_loss: 1.3381, test_f1: 0.2260
 epoch: 1, train_loss: 1.1906, test_loss: 1.2417, test_f1: 0.2260
 epoch: 2, train_loss: 1.1312, test_loss: 1.1429, test_f1: 0.3685
 epoch: 3, train_loss: 1.0902, test_loss: 1.0911, test_f1: 0.4161
 epoch: 4, train_loss: 1.0757, test_loss: 1.0751, test_f1: 0.4371
 epoch: 5, train_loss: 1.0592, test_loss: 1.0705, test_f1: 0.4314
 epoch: 6, train_loss: 1.0449, test_loss: 1.0682, test_f1: 0.4326
 epoch: 7, train_loss: 1.0414, test_loss: 1.0688, test_f1: 0.4324
 epoch: 8, train_loss: 1.0277, test_loss: 1.0540, test_f1: 0.4484
 epoch: 9, train_loss: 1.0238, test_loss: 1.0448, test_f1: 0.4651
 epoch: 10, train_loss: 1.0114, test_loss: 1.0441, test_f1: 0.4668
 epoch: 11, train_loss: 1.0056, test_loss: 1.0340, test_f1: 0.4740
 epoch: 12, train_loss: 0.9918, test_loss: 1.0418, test_f1: 0.4717
 epoch: 13, train_loss: 0.9912, test_loss: 1.0171, test_f1: 0.5049
 epoch: 14, train_loss: 0.9827, test_loss: 1.0241, test_f1: 0.4763
 epoch: 15, train_loss: 0.9760, test_loss: 1.0163, test_f1: 0.4923
 epoch: 16, train_loss: 0.9598, test_loss: 1.0126, test_f1: 0.5005
 epoch: 17, train_loss: 0.9593, test_loss: 1.0019, test_f1: 0.4888
 epoch: 18, train_loss: 0.9573, test_loss: 1.0021, test_f1: 0.5113
 epoch: 19, train_loss: 0.9490, test_loss: 1.0311, test_f1: 0.5016
 epoch: 20, train_loss: 0.9591, test_loss: 1.0250, test_f1: 0.5117
 epoch: 21, train_loss: 0.9451, test_loss: 1.0175, test_f1: 0.5014
 epoch: 22, train_loss: 0.9373, test_loss: 1.0117, test_f1: 0.5068
 epoch: 23, train_loss: 0.9367, test_loss: 0.9922, test_f1: 0.5022
 epoch: 24, train_loss: 0.9232, test_loss: 1.0228, test_f1: 0.5234
 epoch: 25, train_loss: 0.9195, test_loss: 1.0206, test_f1: 0.4984
 epoch: 26, train_loss: 0.9188, test_loss: 1.0093, test_f1: 0.5219
 epoch: 27, train_loss: 0.9326, test_loss: 0.9863, test_f1: 0.4805
 epoch: 28, train_loss: 0.9185, test_loss: 1.0067, test_f1: 0.5241
 epoch: 29, train_loss: 0.9047, test_loss: 1.0050, test_f1: 0.5191
 epoch: 30, train_loss: 0.9143, test_loss: 0.9900, test_f1: 0.5053
 epoch: 31, train_loss: 0.9072, test_loss: 0.9898, test_f1: 0.4909
 epoch: 32, train_loss: 0.8864, test_loss: 1.0566, test_f1: 0.4917
 epoch: 33, train_loss: 0.9000, test_loss: 1.0444, test_f1: 0.5074
 epoch: 34, train_loss: 0.8895, test_loss: 1.0305, test_f1: 0.5173
 epoch: 35, train_loss: 0.8873, test_loss: 0.9656, test_f1: 0.5254
 epoch: 36, train_loss: 0.8812, test_loss: 0.9676, test_f1: 0.5385
 epoch: 37, train_loss: 0.8754, test_loss: 1.0004, test_f1: 0.5113
 epoch: 38, train_loss: 0.8793, test_loss: 0.9829, test_f1: 0.5073
 epoch: 39, train_loss: 0.8743, test_loss: 0.9769, test_f1: 0.5320
 epoch: 40, train_loss: 0.8609, test_loss: 0.9485, test_f1: 0.5424
 epoch: 41, train_loss: 0.8743, test_loss: 0.9748, test_f1: 0.5346
 epoch: 42, train_loss: 0.8587, test_loss: 0.9585, test_f1: 0.5261
 epoch: 43, train_loss: 0.8603, test_loss: 1.0283, test_f1: 0.5219
 epoch: 44, train_loss: 0.8613, test_loss: 0.9949, test_f1: 0.5229
 epoch: 45, train_loss: 0.8573, test_loss: 0.9533, test_f1: 0.5379
 epoch: 46, train_loss: 0.8512, test_loss: 1.0287, test_f1: 0.5206
 epoch: 47, train_loss: 0.8474, test_loss: 0.9228, test_f1: 0.5294
 epoch: 48, train_loss: 0.8522, test_loss: 0.9847, test_f1: 0.5066
 epoch: 49, train_loss: 0.8420, test_loss: 0.9730, test_f1: 0.5236
 epoch: 50, train_loss: 0.8471, test_loss: 0.9557, test_f1: 0.5505
 epoch: 51, train_loss: 0.8385, test_loss: 0.9364, test_f1: 0.5251
 epoch: 52, train_loss: 0.8336, test_loss: 1.0053, test_f1: 0.5240
 epoch: 53, train_loss: 0.8223, test_loss: 0.9802, test_f1: 0.5328
 epoch: 54, train_loss: 0.8292, test_loss: 0.9731, test_f1: 0.5313
 epoch: 55, train_loss: 0.8234, test_loss: 0.9851, test_f1: 0.5318
 epoch: 56, train_loss: 0.8198, test_loss: 0.9893, test_f1: 0.5247
 epoch: 57, train_loss: 0.8147, test_loss: 0.9875, test_f1: 0.5311
 epoch: 58, train_loss: 0.8153, test_loss: 0.9780, test_f1: 0.5388
 epoch: 59, train_loss: 0.8100, test_loss: 0.9699, test_f1: 0.5324
 epoch: 60, train_loss: 0.8269, test_loss: 0.9334, test_f1: 0.5428
 epoch: 61, train_loss: 0.8124, test_loss: 1.0062, test_f1: 0.5285
 epoch: 62, train_loss: 0.8177, test_loss: 0.9186, test_f1: 0.5472
 epoch: 63, train_loss: 0.8327, test_loss: 0.9432, test_f1: 0.5422
 epoch: 64, train_loss: 0.8124, test_loss: 0.9676, test_f1: 0.5344
 epoch: 65, train_loss: 0.8086, test_loss: 0.9350, test_f1: 0.5411
 epoch: 66, train_loss: 0.8114, test_loss: 0.9354, test_f1: 0.5340
 epoch: 67, train_loss: 0.8088, test_loss: 0.9871, test_f1: 0.5524
 epoch: 68, train_loss: 0.8082, test_loss: 0.9637, test_f1: 0.5296
 epoch: 69, train_loss: 0.8034, test_loss: 0.9782, test_f1: 0.5259
 epoch: 70, train_loss: 0.8067, test_loss: 1.0218, test_f1: 0.5288
 epoch: 71, train_loss: 0.7978, test_loss: 0.9540, test_f1: 0.5531
 epoch: 72, train_loss: 0.8065, test_loss: 0.9541, test_f1: 0.5460
 epoch: 73, train_loss: 0.8107, test_loss: 0.9528, test_f1: 0.5294
 epoch: 74, train_loss: 0.8106, test_loss: 0.9761, test_f1: 0.5375
 epoch: 75, train_loss: 0.8043, test_loss: 0.9960, test_f1: 0.5346
 epoch: 76, train_loss: 0.7876, test_loss: 1.0125, test_f1: 0.5318
 epoch: 77, train_loss: 0.8015, test_loss: 0.9851, test_f1: 0.5304
 epoch: 78, train_loss: 0.7829, test_loss: 0.9907, test_f1: 0.5250
 epoch: 79, train_loss: 0.7853, test_loss: 0.9670, test_f1: 0.5398
 epoch: 80, train_loss: 0.7839, test_loss: 0.9605, test_f1: 0.5411
 epoch: 81, train_loss: 0.7991, test_loss: 1.0227, test_f1: 0.5277
 epoch: 82, train_loss: 0.7893, test_loss: 0.9611, test_f1: 0.5397
 epoch: 83, train_loss: 0.7838, test_loss: 0.9835, test_f1: 0.5379
 epoch: 84, train_loss: 0.7911, test_loss: 0.9975, test_f1: 0.5443
 epoch: 85, train_loss: 0.7809, test_loss: 0.9986, test_f1: 0.5414
 epoch: 86, train_loss: 0.7834, test_loss: 1.0373, test_f1: 0.5316
 epoch: 87, train_loss: 0.7762, test_loss: 1.0192, test_f1: 0.5335
 epoch: 88, train_loss: 0.7732, test_loss: 1.0534, test_f1: 0.5198
 epoch: 89, train_loss: 0.7576, test_loss: 0.9729, test_f1: 0.5429
 epoch: 90, train_loss: 0.7700, test_loss: 0.9675, test_f1: 0.5469
 epoch: 91, train_loss: 0.7757, test_loss: 1.0173, test_f1: 0.5307
 epoch: 92, train_loss: 0.7801, test_loss: 0.9595, test_f1: 0.5263
 epoch: 93, train_loss: 0.7672, test_loss: 0.9684, test_f1: 0.5398
 epoch: 94, train_loss: 0.7730, test_loss: 0.9852, test_f1: 0.5267
 epoch: 95, train_loss: 0.7705, test_loss: 0.9734, test_f1: 0.5328
 epoch: 96, train_loss: 0.7649, test_loss: 1.0198, test_f1: 0.5252
 epoch: 97, train_loss: 0.7677, test_loss: 0.9688, test_f1: 0.5288
 epoch: 98, train_loss: 0.7657, test_loss: 1.0389, test_f1: 0.5278
 epoch: 99, train_loss: 0.7748, test_loss: 0.9792, test_f1: 0.5507

Training completed in 434.03 seconds
Best F1: 0.5710 at epoch 92
Mean F1 across iterations: 0.5488  0.0131
========================FINAL RESULTS================================
FEGIN weighted F1: 0.5710  0.0131
python main.py --data ltspice_examples --representation component_pin --model FEGIN --layers 5 --hiddens 16 --batch_size 256 --lr 0.001 --emb_size 128 --epochs 100 --save_appendix component_pin_L5_H16_BS256_LR0.001_E128 --no_val
-----



STDERR:
  File "main.py", line 370, in <module>
    main()
  File "main.py", line 254, in main
    dataset = dataset_class(
  File "/home/philip/projects/ltspice_examples_code_repo/Circuit-Completion-Using-GNNs/component_classification_with_link_prediction_head/evaluation/FEGIN/kernel/circuit_datasets.py", line 15, in __init__
    self.data, self.slices = torch.load(self.processed_paths[0])
  File "/home/philip/.local/lib/python3.8/site-packages/torch/serialization.py", line 1040, in load
    warnings.warn(
  File "/usr/lib/python3.8/warnings.py", line 109, in _showwarnmsg
    sw(msg.message, msg.category, msg.filename, msg.lineno,
  File "main.py", line 47, in warn_with_traceback
    traceback.print_stack(file=log)
/home/philip/projects/ltspice_examples_code_repo/Circuit-Completion-Using-GNNs/component_classification_with_link_prediction_head/evaluation/FEGIN/kernel/circuit_datasets.py:15: FutureWarning: You are using `torch.load` with `weights_only=False` (the current default value), which uses the default pickle module implicitly. It is possible to construct malicious pickle data which will execute arbitrary code during unpickling (See https://github.com/pytorch/pytorch/blob/main/SECURITY.md#untrusted-models for more details). In a future release, the default value for `weights_only` will be flipped to `True`. This limits the functions that could be executed during unpickling. Arbitrary objects will no longer be allowed to be loaded via this mode unless they are explicitly allowlisted by the user via `torch.serialization.add_safe_globals`. We recommend you start setting `weights_only=True` for any use case where you don't have full control of the loaded file. Please open an issue on GitHub for any issues related to this experimental feature.
  self.data, self.slices = torch.load(self.processed_paths[0])
