STDOUT:
Results will be saved in /home/philip/projects/ltspice_examples_code_repo/Circuit-Completion-Using-GNNs/component_classification_with_link_prediction_head/evaluation/FEGIN/results/model_FEGIN_dataset_ltspice_demos
Command line input: python main.py --data ltspice_demos --representation component_pin_net --model FEGIN --layers 3 --hiddens 16 --batch_size 128 --lr 0.1 --emb_size 128 --epochs 100 --save_appendix component_pin_net_L3_H16_BS128_LR0.1_E128 --no_val
 is saved.
-----
ltspice_demos - FEGIN
Using 3 layers, 16 hidden units, h = 2
Loading component_pin_net representation dataset
ENTERED
Training FEGIN on component_pin_net representation
Train: 1565, Test: 383
##################ITERATION #0 ****************************************
 epoch: 0, train_loss: 1.2882, test_loss: 3.6911, test_f1: 0.1365
 epoch: 1, train_loss: 1.1379, test_loss: 1.3993, test_f1: 0.2829
 epoch: 2, train_loss: 1.0863, test_loss: 1.2564, test_f1: 0.3798
 epoch: 3, train_loss: 1.0585, test_loss: 1.1558, test_f1: 0.3290
 epoch: 4, train_loss: 1.0678, test_loss: 1.1199, test_f1: 0.3395
 epoch: 5, train_loss: 1.0685, test_loss: 1.1024, test_f1: 0.4034
 epoch: 6, train_loss: 1.0452, test_loss: 1.6800, test_f1: 0.2890
 epoch: 7, train_loss: 1.0657, test_loss: 1.1212, test_f1: 0.4341
 epoch: 8, train_loss: 1.0268, test_loss: 1.2306, test_f1: 0.4201
 epoch: 9, train_loss: 1.0282, test_loss: 1.2758, test_f1: 0.4032
 epoch: 10, train_loss: 1.0406, test_loss: 1.2932, test_f1: 0.3642
 epoch: 11, train_loss: 1.0407, test_loss: 1.1193, test_f1: 0.3824
 epoch: 12, train_loss: 1.0448, test_loss: 1.1945, test_f1: 0.4132
 epoch: 13, train_loss: 1.0661, test_loss: 1.1038, test_f1: 0.3444
 epoch: 14, train_loss: 1.0379, test_loss: 1.1373, test_f1: 0.3444
 epoch: 15, train_loss: 1.0375, test_loss: 1.1338, test_f1: 0.4178
 epoch: 16, train_loss: 1.0291, test_loss: 1.2498, test_f1: 0.3205
 epoch: 17, train_loss: 1.0296, test_loss: 1.2657, test_f1: 0.2764
 epoch: 18, train_loss: 1.0235, test_loss: 1.2517, test_f1: 0.4078
 epoch: 19, train_loss: 1.0274, test_loss: 1.1363, test_f1: 0.3648
 epoch: 20, train_loss: 1.0142, test_loss: 1.0894, test_f1: 0.3890
 epoch: 21, train_loss: 1.0205, test_loss: 1.2715, test_f1: 0.4238
 epoch: 22, train_loss: 1.0369, test_loss: 1.1093, test_f1: 0.4326
 epoch: 23, train_loss: 1.0383, test_loss: 1.1113, test_f1: 0.4321
 epoch: 24, train_loss: 1.0174, test_loss: 1.2716, test_f1: 0.4110
 epoch: 25, train_loss: 1.0527, test_loss: 1.3045, test_f1: 0.2631
 epoch: 26, train_loss: 1.0254, test_loss: 1.1666, test_f1: 0.3708
 epoch: 27, train_loss: 1.0547, test_loss: 1.1111, test_f1: 0.3395
 epoch: 28, train_loss: 1.0269, test_loss: 1.1383, test_f1: 0.4619
 epoch: 29, train_loss: 1.0377, test_loss: 1.1807, test_f1: 0.3205
 epoch: 30, train_loss: 1.0486, test_loss: 1.0924, test_f1: 0.3538
 epoch: 31, train_loss: 1.0382, test_loss: 1.1443, test_f1: 0.4520
 epoch: 32, train_loss: 1.0284, test_loss: 1.0975, test_f1: 0.3480
 epoch: 33, train_loss: 1.0118, test_loss: 1.1209, test_f1: 0.4360
 epoch: 34, train_loss: 1.0176, test_loss: 1.1266, test_f1: 0.4314
 epoch: 35, train_loss: 1.0116, test_loss: 1.0773, test_f1: 0.4350
 epoch: 36, train_loss: 1.0044, test_loss: 1.0616, test_f1: 0.4422
 epoch: 37, train_loss: 0.9938, test_loss: 1.2667, test_f1: 0.4030
 epoch: 38, train_loss: 1.0004, test_loss: 1.2967, test_f1: 0.3935
 epoch: 39, train_loss: 1.0048, test_loss: 1.2792, test_f1: 0.2913
 epoch: 40, train_loss: 0.9935, test_loss: 1.2768, test_f1: 0.2977
 epoch: 41, train_loss: 1.0121, test_loss: 1.0845, test_f1: 0.3984
 epoch: 42, train_loss: 0.9977, test_loss: 1.3037, test_f1: 0.2727
 epoch: 43, train_loss: 1.0035, test_loss: 1.0933, test_f1: 0.4105
 epoch: 44, train_loss: 1.0025, test_loss: 2.7337, test_f1: 0.2439
 epoch: 45, train_loss: 1.0606, test_loss: 1.5841, test_f1: 0.2446
 epoch: 46, train_loss: 1.0598, test_loss: 1.1646, test_f1: 0.4096
 epoch: 47, train_loss: 1.0451, test_loss: 1.1485, test_f1: 0.3295
 epoch: 48, train_loss: 1.0498, test_loss: 1.1339, test_f1: 0.3317
 epoch: 49, train_loss: 1.0406, test_loss: 1.1398, test_f1: 0.3336
 epoch: 50, train_loss: 1.0239, test_loss: 1.1516, test_f1: 0.3322
 epoch: 51, train_loss: 1.0116, test_loss: 1.1258, test_f1: 0.3344
 epoch: 52, train_loss: 1.0021, test_loss: 1.0956, test_f1: 0.3461
 epoch: 53, train_loss: 0.9985, test_loss: 1.0785, test_f1: 0.3461
 epoch: 54, train_loss: 0.9922, test_loss: 1.1094, test_f1: 0.3353
 epoch: 55, train_loss: 0.9896, test_loss: 1.0815, test_f1: 0.4583
 epoch: 56, train_loss: 0.9788, test_loss: 1.0758, test_f1: 0.3949
 epoch: 57, train_loss: 0.9797, test_loss: 1.0815, test_f1: 0.4639
 epoch: 58, train_loss: 0.9856, test_loss: 1.1183, test_f1: 0.4252
 epoch: 59, train_loss: 0.9982, test_loss: 1.0861, test_f1: 0.3566
 epoch: 60, train_loss: 0.9808, test_loss: 1.1658, test_f1: 0.3506
 epoch: 61, train_loss: 0.9888, test_loss: 1.1360, test_f1: 0.3451
 epoch: 62, train_loss: 0.9971, test_loss: 1.0922, test_f1: 0.3344
 epoch: 63, train_loss: 0.9788, test_loss: 1.1108, test_f1: 0.3400
 epoch: 64, train_loss: 0.9728, test_loss: 1.1186, test_f1: 0.3465
 epoch: 65, train_loss: 0.9903, test_loss: 1.1046, test_f1: 0.3405
 epoch: 66, train_loss: 0.9863, test_loss: 1.0954, test_f1: 0.4409
 epoch: 67, train_loss: 0.9795, test_loss: 1.0833, test_f1: 0.4306
 epoch: 68, train_loss: 0.9654, test_loss: 1.0978, test_f1: 0.3438
 epoch: 69, train_loss: 0.9890, test_loss: 1.1364, test_f1: 0.4233
 epoch: 70, train_loss: 0.9813, test_loss: 1.1280, test_f1: 0.4030
 epoch: 71, train_loss: 0.9735, test_loss: 1.1171, test_f1: 0.3461
 epoch: 72, train_loss: 0.9650, test_loss: 1.1012, test_f1: 0.4290
 epoch: 73, train_loss: 0.9628, test_loss: 1.0688, test_f1: 0.4625
 epoch: 74, train_loss: 0.9582, test_loss: 1.1147, test_f1: 0.4053
 epoch: 75, train_loss: 0.9641, test_loss: 1.1336, test_f1: 0.3793
 epoch: 76, train_loss: 0.9525, test_loss: 1.1183, test_f1: 0.4206
 epoch: 77, train_loss: 0.9507, test_loss: 1.0733, test_f1: 0.4874
 epoch: 78, train_loss: 0.9469, test_loss: 1.1065, test_f1: 0.4203
 epoch: 79, train_loss: 0.9482, test_loss: 1.0760, test_f1: 0.4975
 epoch: 80, train_loss: 0.9473, test_loss: 1.1607, test_f1: 0.4436
 epoch: 81, train_loss: 0.9414, test_loss: 1.0875, test_f1: 0.4803
 epoch: 82, train_loss: 0.9534, test_loss: 1.0659, test_f1: 0.3859
 epoch: 83, train_loss: 0.9249, test_loss: 1.0627, test_f1: 0.4745
 epoch: 84, train_loss: 0.9429, test_loss: 1.0887, test_f1: 0.4142
 epoch: 85, train_loss: 0.9400, test_loss: 1.2608, test_f1: 0.3611
 epoch: 86, train_loss: 0.9670, test_loss: 1.2216, test_f1: 0.3065
 epoch: 87, train_loss: 0.9218, test_loss: 1.0902, test_f1: 0.3583
 epoch: 88, train_loss: 0.9409, test_loss: 1.3672, test_f1: 0.3594
 epoch: 89, train_loss: 0.9476, test_loss: 1.1231, test_f1: 0.3535
 epoch: 90, train_loss: 0.9652, test_loss: 1.1575, test_f1: 0.3690
 epoch: 91, train_loss: 0.9529, test_loss: 1.0690, test_f1: 0.4144
 epoch: 92, train_loss: 0.9505, test_loss: 1.1361, test_f1: 0.4064
 epoch: 93, train_loss: 0.9492, test_loss: 1.2916, test_f1: 0.3522
 epoch: 94, train_loss: 0.9380, test_loss: 1.1450, test_f1: 0.3910
 epoch: 95, train_loss: 0.9337, test_loss: 1.1000, test_f1: 0.4081
 epoch: 96, train_loss: 0.9061, test_loss: 1.0925, test_f1: 0.4077
 epoch: 97, train_loss: 0.9658, test_loss: 1.1578, test_f1: 0.4202
 epoch: 98, train_loss: 0.9497, test_loss: 1.1414, test_f1: 0.4684
 epoch: 99, train_loss: 0.9644, test_loss: 1.0868, test_f1: 0.4082
##################ITERATION #1 ****************************************
 epoch: 0, train_loss: 1.4697, test_loss: 1.4007, test_f1: 0.2281
 epoch: 1, train_loss: 1.2806, test_loss: 1.3145, test_f1: 0.2281
 epoch: 2, train_loss: 1.2582, test_loss: 1.2972, test_f1: 0.2281
 epoch: 3, train_loss: 1.2566, test_loss: 1.3028, test_f1: 0.2281
 epoch: 4, train_loss: 1.2538, test_loss: 1.3108, test_f1: 0.2281
 epoch: 5, train_loss: 1.2526, test_loss: 1.3041, test_f1: 0.2281
 epoch: 6, train_loss: 1.2528, test_loss: 1.3053, test_f1: 0.2281
 epoch: 7, train_loss: 1.2525, test_loss: 1.3030, test_f1: 0.2281
 epoch: 8, train_loss: 1.2526, test_loss: 1.3040, test_f1: 0.2281
 epoch: 9, train_loss: 1.2528, test_loss: 1.3035, test_f1: 0.2281
 epoch: 10, train_loss: 1.2541, test_loss: 1.3054, test_f1: 0.2281
 epoch: 11, train_loss: 1.2531, test_loss: 1.3035, test_f1: 0.2281
 epoch: 12, train_loss: 1.2533, test_loss: 1.3036, test_f1: 0.2281
 epoch: 13, train_loss: 1.2529, test_loss: 1.3043, test_f1: 0.2281
 epoch: 14, train_loss: 1.2529, test_loss: 1.3054, test_f1: 0.2281
 epoch: 15, train_loss: 1.2532, test_loss: 1.3033, test_f1: 0.2281
 epoch: 16, train_loss: 1.2529, test_loss: 1.3032, test_f1: 0.2281
 epoch: 17, train_loss: 1.2530, test_loss: 1.3047, test_f1: 0.2281
 epoch: 18, train_loss: 1.2534, test_loss: 1.3063, test_f1: 0.2281
 epoch: 19, train_loss: 1.2528, test_loss: 1.3021, test_f1: 0.2281
 epoch: 20, train_loss: 1.2534, test_loss: 1.3025, test_f1: 0.2281
 epoch: 21, train_loss: 1.2524, test_loss: 1.3063, test_f1: 0.2281
 epoch: 22, train_loss: 1.2533, test_loss: 1.3098, test_f1: 0.2281
 epoch: 23, train_loss: 1.2535, test_loss: 1.3043, test_f1: 0.2281
 epoch: 24, train_loss: 1.2529, test_loss: 1.3033, test_f1: 0.2281
 epoch: 25, train_loss: 1.2527, test_loss: 1.3065, test_f1: 0.2281
 epoch: 26, train_loss: 1.2528, test_loss: 1.3035, test_f1: 0.2281
 epoch: 27, train_loss: 1.2533, test_loss: 1.3054, test_f1: 0.2281
 epoch: 28, train_loss: 1.2547, test_loss: 1.3037, test_f1: 0.2281
 epoch: 29, train_loss: 1.2536, test_loss: 1.3076, test_f1: 0.2281
 epoch: 30, train_loss: 1.2530, test_loss: 1.3061, test_f1: 0.2281
 epoch: 31, train_loss: 1.2529, test_loss: 1.3027, test_f1: 0.2281
 epoch: 32, train_loss: 1.2543, test_loss: 1.3035, test_f1: 0.2281
 epoch: 33, train_loss: 1.2526, test_loss: 1.3027, test_f1: 0.2281
 epoch: 34, train_loss: 1.2537, test_loss: 1.3037, test_f1: 0.2281
 epoch: 35, train_loss: 1.2530, test_loss: 1.3062, test_f1: 0.2281
 epoch: 36, train_loss: 1.2530, test_loss: 1.3034, test_f1: 0.2281
 epoch: 37, train_loss: 1.2533, test_loss: 1.3035, test_f1: 0.2281
 epoch: 38, train_loss: 1.2528, test_loss: 1.3065, test_f1: 0.2281
 epoch: 39, train_loss: 1.2541, test_loss: 1.3074, test_f1: 0.2281
 epoch: 40, train_loss: 1.2537, test_loss: 1.3038, test_f1: 0.2281
 epoch: 41, train_loss: 1.2542, test_loss: 1.3087, test_f1: 0.2281
 epoch: 42, train_loss: 1.2529, test_loss: 1.3057, test_f1: 0.2281
 epoch: 43, train_loss: 1.2531, test_loss: 1.3054, test_f1: 0.2281
 epoch: 44, train_loss: 1.2529, test_loss: 1.3042, test_f1: 0.2281
 epoch: 45, train_loss: 1.2531, test_loss: 1.3026, test_f1: 0.2281
 epoch: 46, train_loss: 1.2527, test_loss: 1.3068, test_f1: 0.2281
 epoch: 47, train_loss: 1.2525, test_loss: 1.3038, test_f1: 0.2281
 epoch: 48, train_loss: 1.2536, test_loss: 1.3035, test_f1: 0.2281
 epoch: 49, train_loss: 1.2535, test_loss: 1.3042, test_f1: 0.2281
 epoch: 50, train_loss: 1.2546, test_loss: 1.3082, test_f1: 0.2281
 epoch: 51, train_loss: 1.2532, test_loss: 1.3050, test_f1: 0.2281
 epoch: 52, train_loss: 1.2533, test_loss: 1.3040, test_f1: 0.2281
 epoch: 53, train_loss: 1.2528, test_loss: 1.3080, test_f1: 0.2281
 epoch: 54, train_loss: 1.2534, test_loss: 1.3061, test_f1: 0.2281
 epoch: 55, train_loss: 1.2531, test_loss: 1.3046, test_f1: 0.2281
 epoch: 56, train_loss: 1.2527, test_loss: 1.3052, test_f1: 0.2281
 epoch: 57, train_loss: 1.2523, test_loss: 1.3031, test_f1: 0.2281
 epoch: 58, train_loss: 1.2526, test_loss: 1.3014, test_f1: 0.2281
 epoch: 59, train_loss: 1.2529, test_loss: 1.3035, test_f1: 0.2281
 epoch: 60, train_loss: 1.2529, test_loss: 1.3039, test_f1: 0.2281
 epoch: 61, train_loss: 1.2524, test_loss: 1.3053, test_f1: 0.2281
 epoch: 62, train_loss: 1.2526, test_loss: 1.3072, test_f1: 0.2281
 epoch: 63, train_loss: 1.2526, test_loss: 1.3039, test_f1: 0.2281
 epoch: 64, train_loss: 1.2524, test_loss: 1.3062, test_f1: 0.2281
 epoch: 65, train_loss: 1.2528, test_loss: 1.3054, test_f1: 0.2281
 epoch: 66, train_loss: 1.2527, test_loss: 1.3052, test_f1: 0.2281
 epoch: 67, train_loss: 1.2522, test_loss: 1.3038, test_f1: 0.2281
 epoch: 68, train_loss: 1.2529, test_loss: 1.3048, test_f1: 0.2281
 epoch: 69, train_loss: 1.2521, test_loss: 1.3057, test_f1: 0.2281
 epoch: 70, train_loss: 1.2524, test_loss: 1.3064, test_f1: 0.2281
 epoch: 71, train_loss: 1.2530, test_loss: 1.3061, test_f1: 0.2281
 epoch: 72, train_loss: 1.2533, test_loss: 1.3060, test_f1: 0.2281
 epoch: 73, train_loss: 1.2522, test_loss: 1.3037, test_f1: 0.2281
 epoch: 74, train_loss: 1.2527, test_loss: 1.3044, test_f1: 0.2281
 epoch: 75, train_loss: 1.2524, test_loss: 1.3059, test_f1: 0.2281
 epoch: 76, train_loss: 1.2537, test_loss: 1.3019, test_f1: 0.2281
 epoch: 77, train_loss: 1.2520, test_loss: 1.3055, test_f1: 0.2281
 epoch: 78, train_loss: 1.2527, test_loss: 1.3063, test_f1: 0.2281
 epoch: 79, train_loss: 1.2525, test_loss: 1.3050, test_f1: 0.2281
 epoch: 80, train_loss: 1.2527, test_loss: 1.3043, test_f1: 0.2281
 epoch: 81, train_loss: 1.2527, test_loss: 1.3027, test_f1: 0.2281
 epoch: 82, train_loss: 1.2528, test_loss: 1.3023, test_f1: 0.2281
 epoch: 83, train_loss: 1.2532, test_loss: 1.3080, test_f1: 0.2281
 epoch: 84, train_loss: 1.2524, test_loss: 1.3048, test_f1: 0.2281
 epoch: 85, train_loss: 1.2529, test_loss: 1.3021, test_f1: 0.2281
 epoch: 86, train_loss: 1.2529, test_loss: 1.3042, test_f1: 0.2281
 epoch: 87, train_loss: 1.2532, test_loss: 1.3095, test_f1: 0.2281
 epoch: 88, train_loss: 1.2522, test_loss: 1.3052, test_f1: 0.2281
 epoch: 89, train_loss: 1.2524, test_loss: 1.3043, test_f1: 0.2281
 epoch: 90, train_loss: 1.2521, test_loss: 1.3040, test_f1: 0.2281
 epoch: 91, train_loss: 1.2524, test_loss: 1.3060, test_f1: 0.2281
 epoch: 92, train_loss: 1.2525, test_loss: 1.3057, test_f1: 0.2281
 epoch: 93, train_loss: 1.2523, test_loss: 1.3057, test_f1: 0.2281
 epoch: 94, train_loss: 1.2529, test_loss: 1.3080, test_f1: 0.2281
 epoch: 95, train_loss: 1.2527, test_loss: 1.3024, test_f1: 0.2281
 epoch: 96, train_loss: 1.2527, test_loss: 1.3044, test_f1: 0.2281
 epoch: 97, train_loss: 1.2526, test_loss: 1.3041, test_f1: 0.2281
 epoch: 98, train_loss: 1.2522, test_loss: 1.3043, test_f1: 0.2281
 epoch: 99, train_loss: 1.2523, test_loss: 1.3060, test_f1: 0.2281
##################ITERATION #2 ****************************************
 epoch: 0, train_loss: 1.2691, test_loss: 1.3065, test_f1: 0.2281
 epoch: 1, train_loss: 1.2554, test_loss: 1.3037, test_f1: 0.2281
 epoch: 2, train_loss: 1.2548, test_loss: 1.3064, test_f1: 0.2281
 epoch: 3, train_loss: 1.2530, test_loss: 1.3050, test_f1: 0.2281
 epoch: 4, train_loss: 1.2537, test_loss: 1.3021, test_f1: 0.2281
 epoch: 5, train_loss: 1.2540, test_loss: 1.3119, test_f1: 0.2281
 epoch: 6, train_loss: 1.2525, test_loss: 1.3022, test_f1: 0.2281
 epoch: 7, train_loss: 1.2530, test_loss: 1.3048, test_f1: 0.2281
 epoch: 8, train_loss: 1.2542, test_loss: 1.3081, test_f1: 0.2281
 epoch: 9, train_loss: 1.2521, test_loss: 1.3018, test_f1: 0.2281
 epoch: 10, train_loss: 1.2532, test_loss: 1.3059, test_f1: 0.2281
 epoch: 11, train_loss: 1.2522, test_loss: 1.3043, test_f1: 0.2281
 epoch: 12, train_loss: 1.2527, test_loss: 1.3034, test_f1: 0.2281
 epoch: 13, train_loss: 1.2535, test_loss: 1.3061, test_f1: 0.2281
 epoch: 14, train_loss: 1.2546, test_loss: 1.3018, test_f1: 0.2281
 epoch: 15, train_loss: 1.2526, test_loss: 1.3074, test_f1: 0.2281
 epoch: 16, train_loss: 1.2537, test_loss: 1.3033, test_f1: 0.2281
 epoch: 17, train_loss: 1.2535, test_loss: 1.3050, test_f1: 0.2281
 epoch: 18, train_loss: 1.2529, test_loss: 1.3062, test_f1: 0.2281
 epoch: 19, train_loss: 1.2541, test_loss: 1.3046, test_f1: 0.2281
 epoch: 20, train_loss: 1.2529, test_loss: 1.3033, test_f1: 0.2281
 epoch: 21, train_loss: 1.2529, test_loss: 1.3031, test_f1: 0.2281
 epoch: 22, train_loss: 1.2535, test_loss: 1.3062, test_f1: 0.2281
 epoch: 23, train_loss: 1.2543, test_loss: 1.3086, test_f1: 0.2281
 epoch: 24, train_loss: 1.2535, test_loss: 1.3014, test_f1: 0.2281
 epoch: 25, train_loss: 1.2537, test_loss: 1.3066, test_f1: 0.2281
 epoch: 26, train_loss: 1.2524, test_loss: 1.3072, test_f1: 0.2281
 epoch: 27, train_loss: 1.2532, test_loss: 1.3094, test_f1: 0.2281
 epoch: 28, train_loss: 1.2532, test_loss: 1.3028, test_f1: 0.2281
 epoch: 29, train_loss: 1.2532, test_loss: 1.3036, test_f1: 0.2281
 epoch: 30, train_loss: 1.2529, test_loss: 1.3025, test_f1: 0.2281
 epoch: 31, train_loss: 1.2528, test_loss: 1.3076, test_f1: 0.2281
 epoch: 32, train_loss: 1.2530, test_loss: 1.3010, test_f1: 0.2281
 epoch: 33, train_loss: 1.2523, test_loss: 1.3058, test_f1: 0.2281
 epoch: 34, train_loss: 1.2534, test_loss: 1.3078, test_f1: 0.2281
 epoch: 35, train_loss: 1.2532, test_loss: 1.3045, test_f1: 0.2281
 epoch: 36, train_loss: 1.2550, test_loss: 1.3026, test_f1: 0.2281
 epoch: 37, train_loss: 1.2532, test_loss: 1.3105, test_f1: 0.2281
 epoch: 38, train_loss: 1.2537, test_loss: 1.3074, test_f1: 0.2281
 epoch: 39, train_loss: 1.2528, test_loss: 1.3040, test_f1: 0.2281
 epoch: 40, train_loss: 1.2536, test_loss: 1.3060, test_f1: 0.2281
 epoch: 41, train_loss: 1.2558, test_loss: 1.3017, test_f1: 0.2281
 epoch: 42, train_loss: 1.2521, test_loss: 1.3070, test_f1: 0.2281
 epoch: 43, train_loss: 1.2545, test_loss: 1.3059, test_f1: 0.2281
 epoch: 44, train_loss: 1.2544, test_loss: 1.3037, test_f1: 0.2281
 epoch: 45, train_loss: 1.2525, test_loss: 1.3064, test_f1: 0.2281
 epoch: 46, train_loss: 1.2528, test_loss: 1.3040, test_f1: 0.2281
 epoch: 47, train_loss: 1.2540, test_loss: 1.3035, test_f1: 0.2281
 epoch: 48, train_loss: 1.2524, test_loss: 1.3032, test_f1: 0.2281
 epoch: 49, train_loss: 1.2540, test_loss: 1.3043, test_f1: 0.2281
 epoch: 50, train_loss: 1.2532, test_loss: 1.3045, test_f1: 0.2281
 epoch: 51, train_loss: 1.2522, test_loss: 1.3048, test_f1: 0.2281
 epoch: 52, train_loss: 1.2523, test_loss: 1.3036, test_f1: 0.2281
 epoch: 53, train_loss: 1.2524, test_loss: 1.3057, test_f1: 0.2281
 epoch: 54, train_loss: 1.2523, test_loss: 1.3062, test_f1: 0.2281
 epoch: 55, train_loss: 1.2526, test_loss: 1.3045, test_f1: 0.2281
 epoch: 56, train_loss: 1.2535, test_loss: 1.3017, test_f1: 0.2281
 epoch: 57, train_loss: 1.2527, test_loss: 1.3052, test_f1: 0.2281
 epoch: 58, train_loss: 1.2526, test_loss: 1.3055, test_f1: 0.2281
 epoch: 59, train_loss: 1.2529, test_loss: 1.3046, test_f1: 0.2281
 epoch: 60, train_loss: 1.2526, test_loss: 1.3029, test_f1: 0.2281
 epoch: 61, train_loss: 1.2531, test_loss: 1.3015, test_f1: 0.2281
 epoch: 62, train_loss: 1.2536, test_loss: 1.3090, test_f1: 0.2281
 epoch: 63, train_loss: 1.2534, test_loss: 1.3060, test_f1: 0.2281
 epoch: 64, train_loss: 1.2523, test_loss: 1.3038, test_f1: 0.2281
 epoch: 65, train_loss: 1.2530, test_loss: 1.3019, test_f1: 0.2281
 epoch: 66, train_loss: 1.2526, test_loss: 1.3028, test_f1: 0.2281
 epoch: 67, train_loss: 1.2526, test_loss: 1.3092, test_f1: 0.2281
 epoch: 68, train_loss: 1.2523, test_loss: 1.3049, test_f1: 0.2281
 epoch: 69, train_loss: 1.2532, test_loss: 1.3009, test_f1: 0.2281
 epoch: 70, train_loss: 1.2526, test_loss: 1.3037, test_f1: 0.2281
 epoch: 71, train_loss: 1.2525, test_loss: 1.3045, test_f1: 0.2281
 epoch: 72, train_loss: 1.2524, test_loss: 1.3023, test_f1: 0.2281
 epoch: 73, train_loss: 1.2530, test_loss: 1.3042, test_f1: 0.2281
 epoch: 74, train_loss: 1.2523, test_loss: 1.3047, test_f1: 0.2281
 epoch: 75, train_loss: 1.2526, test_loss: 1.3074, test_f1: 0.2281
 epoch: 76, train_loss: 1.2524, test_loss: 1.3065, test_f1: 0.2281
 epoch: 77, train_loss: 1.2525, test_loss: 1.3047, test_f1: 0.2281
 epoch: 78, train_loss: 1.2527, test_loss: 1.3054, test_f1: 0.2281
 epoch: 79, train_loss: 1.2520, test_loss: 1.3049, test_f1: 0.2281
 epoch: 80, train_loss: 1.2528, test_loss: 1.3072, test_f1: 0.2281
 epoch: 81, train_loss: 1.2525, test_loss: 1.3066, test_f1: 0.2281
 epoch: 82, train_loss: 1.2527, test_loss: 1.3049, test_f1: 0.2281
 epoch: 83, train_loss: 1.2532, test_loss: 1.3047, test_f1: 0.2281
 epoch: 84, train_loss: 1.2520, test_loss: 1.3041, test_f1: 0.2281
 epoch: 85, train_loss: 1.2529, test_loss: 1.3045, test_f1: 0.2281
 epoch: 86, train_loss: 1.2530, test_loss: 1.3051, test_f1: 0.2281
 epoch: 87, train_loss: 1.2523, test_loss: 1.3041, test_f1: 0.2281
 epoch: 88, train_loss: 1.2530, test_loss: 1.3024, test_f1: 0.2281
 epoch: 89, train_loss: 1.2530, test_loss: 1.3029, test_f1: 0.2281
 epoch: 90, train_loss: 1.2523, test_loss: 1.3099, test_f1: 0.2281
 epoch: 91, train_loss: 1.2536, test_loss: 1.3090, test_f1: 0.2281
 epoch: 92, train_loss: 1.2526, test_loss: 1.3045, test_f1: 0.2281
 epoch: 93, train_loss: 1.2528, test_loss: 1.3040, test_f1: 0.2281
 epoch: 94, train_loss: 1.2530, test_loss: 1.3045, test_f1: 0.2281
 epoch: 95, train_loss: 1.2531, test_loss: 1.3080, test_f1: 0.2281
 epoch: 96, train_loss: 1.2528, test_loss: 1.3014, test_f1: 0.2281
 epoch: 97, train_loss: 1.2530, test_loss: 1.3036, test_f1: 0.2281
 epoch: 98, train_loss: 1.2527, test_loss: 1.3019, test_f1: 0.2281
 epoch: 99, train_loss: 1.2536, test_loss: 1.3048, test_f1: 0.2281
##################ITERATION #3 ****************************************
 epoch: 0, train_loss: 1.2791, test_loss: 1.3046, test_f1: 0.2281
 epoch: 1, train_loss: 1.2535, test_loss: 1.3089, test_f1: 0.2281
 epoch: 2, train_loss: 1.2530, test_loss: 1.3032, test_f1: 0.2281
 epoch: 3, train_loss: 1.2531, test_loss: 1.3043, test_f1: 0.2281
 epoch: 4, train_loss: 1.2539, test_loss: 1.3088, test_f1: 0.2281
 epoch: 5, train_loss: 1.2542, test_loss: 1.3041, test_f1: 0.2281
 epoch: 6, train_loss: 1.2536, test_loss: 1.3016, test_f1: 0.2281
 epoch: 7, train_loss: 1.2532, test_loss: 1.3046, test_f1: 0.2281
 epoch: 8, train_loss: 1.2528, test_loss: 1.3074, test_f1: 0.2281
 epoch: 9, train_loss: 1.2559, test_loss: 1.3101, test_f1: 0.2281
 epoch: 10, train_loss: 1.2554, test_loss: 1.3023, test_f1: 0.2281
 epoch: 11, train_loss: 1.2539, test_loss: 1.3086, test_f1: 0.2281
 epoch: 12, train_loss: 1.2533, test_loss: 1.3039, test_f1: 0.2281
 epoch: 13, train_loss: 1.2533, test_loss: 1.3058, test_f1: 0.2281
 epoch: 14, train_loss: 1.2539, test_loss: 1.3054, test_f1: 0.2281
 epoch: 15, train_loss: 1.2537, test_loss: 1.3033, test_f1: 0.2281
 epoch: 16, train_loss: 1.2535, test_loss: 1.3050, test_f1: 0.2281
 epoch: 17, train_loss: 1.2525, test_loss: 1.3062, test_f1: 0.2281
 epoch: 18, train_loss: 1.2535, test_loss: 1.3058, test_f1: 0.2281
 epoch: 19, train_loss: 1.2532, test_loss: 1.3036, test_f1: 0.2281
 epoch: 20, train_loss: 1.2532, test_loss: 1.3069, test_f1: 0.2281
 epoch: 21, train_loss: 1.2533, test_loss: 1.3034, test_f1: 0.2281
 epoch: 22, train_loss: 1.2532, test_loss: 1.3026, test_f1: 0.2281
 epoch: 23, train_loss: 1.2537, test_loss: 1.3061, test_f1: 0.2281
 epoch: 24, train_loss: 1.2529, test_loss: 1.3027, test_f1: 0.2281
 epoch: 25, train_loss: 1.2527, test_loss: 1.3042, test_f1: 0.2281
 epoch: 26, train_loss: 1.2530, test_loss: 1.3035, test_f1: 0.2281
 epoch: 27, train_loss: 1.2532, test_loss: 1.3083, test_f1: 0.2281
 epoch: 28, train_loss: 1.2526, test_loss: 1.3029, test_f1: 0.2281
 epoch: 29, train_loss: 1.2530, test_loss: 1.3051, test_f1: 0.2281
 epoch: 30, train_loss: 1.2536, test_loss: 1.3037, test_f1: 0.2281
 epoch: 31, train_loss: 1.2529, test_loss: 1.3080, test_f1: 0.2281
 epoch: 32, train_loss: 1.2544, test_loss: 1.3061, test_f1: 0.2281
 epoch: 33, train_loss: 1.2533, test_loss: 1.3055, test_f1: 0.2281
 epoch: 34, train_loss: 1.2530, test_loss: 1.3066, test_f1: 0.2281
 epoch: 35, train_loss: 1.2528, test_loss: 1.3038, test_f1: 0.2281
 epoch: 36, train_loss: 1.2525, test_loss: 1.3023, test_f1: 0.2281
 epoch: 37, train_loss: 1.2539, test_loss: 1.3077, test_f1: 0.2281
 epoch: 38, train_loss: 1.2562, test_loss: 1.3054, test_f1: 0.2281
 epoch: 39, train_loss: 1.2542, test_loss: 1.3055, test_f1: 0.2281
 epoch: 40, train_loss: 1.2559, test_loss: 1.3061, test_f1: 0.2281
 epoch: 41, train_loss: 1.2542, test_loss: 1.3083, test_f1: 0.2281
 epoch: 42, train_loss: 1.2547, test_loss: 1.3060, test_f1: 0.2281
 epoch: 43, train_loss: 1.2529, test_loss: 1.3049, test_f1: 0.2281
 epoch: 44, train_loss: 1.2531, test_loss: 1.3042, test_f1: 0.2281
 epoch: 45, train_loss: 1.2539, test_loss: 1.3049, test_f1: 0.2281
 epoch: 46, train_loss: 1.2547, test_loss: 1.3100, test_f1: 0.2281
 epoch: 47, train_loss: 1.2525, test_loss: 1.2998, test_f1: 0.2281
 epoch: 48, train_loss: 1.2537, test_loss: 1.3032, test_f1: 0.2281
 epoch: 49, train_loss: 1.2538, test_loss: 1.3092, test_f1: 0.2281
 epoch: 50, train_loss: 1.2558, test_loss: 1.3008, test_f1: 0.2281
 epoch: 51, train_loss: 1.2535, test_loss: 1.3067, test_f1: 0.2281
 epoch: 52, train_loss: 1.2525, test_loss: 1.3042, test_f1: 0.2281
 epoch: 53, train_loss: 1.2523, test_loss: 1.3048, test_f1: 0.2281
 epoch: 54, train_loss: 1.2521, test_loss: 1.3073, test_f1: 0.2281
 epoch: 55, train_loss: 1.2526, test_loss: 1.3067, test_f1: 0.2281
 epoch: 56, train_loss: 1.2528, test_loss: 1.3070, test_f1: 0.2281
 epoch: 57, train_loss: 1.2523, test_loss: 1.3027, test_f1: 0.2281
 epoch: 58, train_loss: 1.2529, test_loss: 1.3030, test_f1: 0.2281
 epoch: 59, train_loss: 1.2527, test_loss: 1.3048, test_f1: 0.2281
 epoch: 60, train_loss: 1.2525, test_loss: 1.3026, test_f1: 0.2281
 epoch: 61, train_loss: 1.2523, test_loss: 1.3049, test_f1: 0.2281
 epoch: 62, train_loss: 1.2526, test_loss: 1.3032, test_f1: 0.2281
 epoch: 63, train_loss: 1.2524, test_loss: 1.3051, test_f1: 0.2281
 epoch: 64, train_loss: 1.2525, test_loss: 1.3064, test_f1: 0.2281
 epoch: 65, train_loss: 1.2524, test_loss: 1.3058, test_f1: 0.2281
 epoch: 66, train_loss: 1.2527, test_loss: 1.3045, test_f1: 0.2281
 epoch: 67, train_loss: 1.2529, test_loss: 1.3068, test_f1: 0.2281
 epoch: 68, train_loss: 1.2527, test_loss: 1.3034, test_f1: 0.2281
 epoch: 69, train_loss: 1.2521, test_loss: 1.3064, test_f1: 0.2281
 epoch: 70, train_loss: 1.2536, test_loss: 1.3033, test_f1: 0.2281
 epoch: 71, train_loss: 1.2527, test_loss: 1.3066, test_f1: 0.2281
 epoch: 72, train_loss: 1.2524, test_loss: 1.3054, test_f1: 0.2281
 epoch: 73, train_loss: 1.2528, test_loss: 1.3024, test_f1: 0.2281
 epoch: 74, train_loss: 1.2529, test_loss: 1.3053, test_f1: 0.2281
 epoch: 75, train_loss: 1.2522, test_loss: 1.3051, test_f1: 0.2281
 epoch: 76, train_loss: 1.2532, test_loss: 1.3061, test_f1: 0.2281
 epoch: 77, train_loss: 1.2526, test_loss: 1.3064, test_f1: 0.2281
 epoch: 78, train_loss: 1.2531, test_loss: 1.3046, test_f1: 0.2281
 epoch: 79, train_loss: 1.2525, test_loss: 1.3040, test_f1: 0.2281
 epoch: 80, train_loss: 1.2530, test_loss: 1.3036, test_f1: 0.2281
 epoch: 81, train_loss: 1.2527, test_loss: 1.3075, test_f1: 0.2281
 epoch: 82, train_loss: 1.2526, test_loss: 1.3053, test_f1: 0.2281
 epoch: 83, train_loss: 1.2523, test_loss: 1.3052, test_f1: 0.2281
 epoch: 84, train_loss: 1.2526, test_loss: 1.3058, test_f1: 0.2281
 epoch: 85, train_loss: 1.2527, test_loss: 1.3069, test_f1: 0.2281
 epoch: 86, train_loss: 1.2531, test_loss: 1.3033, test_f1: 0.2281
 epoch: 87, train_loss: 1.2532, test_loss: 1.3040, test_f1: 0.2281
 epoch: 88, train_loss: 1.2527, test_loss: 1.3034, test_f1: 0.2281
 epoch: 89, train_loss: 1.2526, test_loss: 1.3073, test_f1: 0.2281
 epoch: 90, train_loss: 1.2529, test_loss: 1.3054, test_f1: 0.2281
 epoch: 91, train_loss: 1.2527, test_loss: 1.3076, test_f1: 0.2281
 epoch: 92, train_loss: 1.2530, test_loss: 1.3089, test_f1: 0.2281
 epoch: 93, train_loss: 1.2526, test_loss: 1.3039, test_f1: 0.2281
 epoch: 94, train_loss: 1.2521, test_loss: 1.3047, test_f1: 0.2281
 epoch: 95, train_loss: 1.2525, test_loss: 1.3060, test_f1: 0.2281
 epoch: 96, train_loss: 1.2524, test_loss: 1.3060, test_f1: 0.2281
 epoch: 97, train_loss: 1.2523, test_loss: 1.3022, test_f1: 0.2281
 epoch: 98, train_loss: 1.2534, test_loss: 1.3051, test_f1: 0.2281
 epoch: 99, train_loss: 1.2530, test_loss: 1.3065, test_f1: 0.2281
##################ITERATION #4 ****************************************
 epoch: 0, train_loss: 1.2626, test_loss: 1.3175, test_f1: 0.2281
 epoch: 1, train_loss: 1.2579, test_loss: 1.3071, test_f1: 0.2281
 epoch: 2, train_loss: 1.2538, test_loss: 1.3027, test_f1: 0.2281
 epoch: 3, train_loss: 1.2532, test_loss: 1.3077, test_f1: 0.2281
 epoch: 4, train_loss: 1.2526, test_loss: 1.3014, test_f1: 0.2281
 epoch: 5, train_loss: 1.2544, test_loss: 1.3025, test_f1: 0.2281
 epoch: 6, train_loss: 1.2526, test_loss: 1.3064, test_f1: 0.2281
 epoch: 7, train_loss: 1.2526, test_loss: 1.3039, test_f1: 0.2281
 epoch: 8, train_loss: 1.2531, test_loss: 1.3042, test_f1: 0.2281
 epoch: 9, train_loss: 1.2527, test_loss: 1.3045, test_f1: 0.2281
 epoch: 10, train_loss: 1.2536, test_loss: 1.3030, test_f1: 0.2281
 epoch: 11, train_loss: 1.2540, test_loss: 1.3041, test_f1: 0.2281
 epoch: 12, train_loss: 1.2570, test_loss: 1.3055, test_f1: 0.2281
 epoch: 13, train_loss: 1.2550, test_loss: 1.3061, test_f1: 0.2281
 epoch: 14, train_loss: 1.2541, test_loss: 1.3056, test_f1: 0.2281
 epoch: 15, train_loss: 1.2526, test_loss: 1.3017, test_f1: 0.2281
 epoch: 16, train_loss: 1.2549, test_loss: 1.3079, test_f1: 0.2281
 epoch: 17, train_loss: 1.2527, test_loss: 1.3028, test_f1: 0.2281
 epoch: 18, train_loss: 1.2529, test_loss: 1.3053, test_f1: 0.2281
 epoch: 19, train_loss: 1.2545, test_loss: 1.3076, test_f1: 0.2281
 epoch: 20, train_loss: 1.2549, test_loss: 1.2998, test_f1: 0.2281
 epoch: 21, train_loss: 1.2560, test_loss: 1.3069, test_f1: 0.2281
 epoch: 22, train_loss: 1.2549, test_loss: 1.3067, test_f1: 0.2281
 epoch: 23, train_loss: 1.2535, test_loss: 1.3043, test_f1: 0.2281
 epoch: 24, train_loss: 1.2542, test_loss: 1.3070, test_f1: 0.2281
 epoch: 25, train_loss: 1.2536, test_loss: 1.3021, test_f1: 0.2281
 epoch: 26, train_loss: 1.2532, test_loss: 1.3077, test_f1: 0.2281
 epoch: 27, train_loss: 1.2537, test_loss: 1.3048, test_f1: 0.2281
 epoch: 28, train_loss: 1.2526, test_loss: 1.3084, test_f1: 0.2281
 epoch: 29, train_loss: 1.2540, test_loss: 1.3060, test_f1: 0.2281
 epoch: 30, train_loss: 1.2532, test_loss: 1.3064, test_f1: 0.2281
 epoch: 31, train_loss: 1.2528, test_loss: 1.3043, test_f1: 0.2281
 epoch: 32, train_loss: 1.2525, test_loss: 1.3061, test_f1: 0.2281
 epoch: 33, train_loss: 1.2534, test_loss: 1.3034, test_f1: 0.2281
 epoch: 34, train_loss: 1.2553, test_loss: 1.3011, test_f1: 0.2281
 epoch: 35, train_loss: 1.2541, test_loss: 1.3082, test_f1: 0.2281
 epoch: 36, train_loss: 1.2539, test_loss: 1.3038, test_f1: 0.2281
 epoch: 37, train_loss: 1.2543, test_loss: 1.3039, test_f1: 0.2281
 epoch: 38, train_loss: 1.2542, test_loss: 1.3058, test_f1: 0.2281
 epoch: 39, train_loss: 1.2529, test_loss: 1.3018, test_f1: 0.2281
 epoch: 40, train_loss: 1.2541, test_loss: 1.3116, test_f1: 0.2281
 epoch: 41, train_loss: 1.2541, test_loss: 1.2999, test_f1: 0.2281
 epoch: 42, train_loss: 1.2529, test_loss: 1.3078, test_f1: 0.2281
 epoch: 43, train_loss: 1.2538, test_loss: 1.3033, test_f1: 0.2281
 epoch: 44, train_loss: 1.2529, test_loss: 1.3059, test_f1: 0.2281
 epoch: 45, train_loss: 1.2536, test_loss: 1.3058, test_f1: 0.2281
 epoch: 46, train_loss: 1.2528, test_loss: 1.3086, test_f1: 0.2281
 epoch: 47, train_loss: 1.2537, test_loss: 1.3042, test_f1: 0.2281
 epoch: 48, train_loss: 1.2533, test_loss: 1.3074, test_f1: 0.2281
 epoch: 49, train_loss: 1.2539, test_loss: 1.3041, test_f1: 0.2281
 epoch: 50, train_loss: 1.2539, test_loss: 1.3076, test_f1: 0.2281
 epoch: 51, train_loss: 1.2538, test_loss: 1.3056, test_f1: 0.2281
 epoch: 52, train_loss: 1.2528, test_loss: 1.3073, test_f1: 0.2281
 epoch: 53, train_loss: 1.2522, test_loss: 1.3036, test_f1: 0.2281
 epoch: 54, train_loss: 1.2522, test_loss: 1.3032, test_f1: 0.2281
 epoch: 55, train_loss: 1.2525, test_loss: 1.3048, test_f1: 0.2281
 epoch: 56, train_loss: 1.2524, test_loss: 1.3074, test_f1: 0.2281
 epoch: 57, train_loss: 1.2525, test_loss: 1.3074, test_f1: 0.2281
 epoch: 58, train_loss: 1.2523, test_loss: 1.3035, test_f1: 0.2281
 epoch: 59, train_loss: 1.2523, test_loss: 1.3042, test_f1: 0.2281
 epoch: 60, train_loss: 1.2523, test_loss: 1.3030, test_f1: 0.2281
 epoch: 61, train_loss: 1.2527, test_loss: 1.3019, test_f1: 0.2281
 epoch: 62, train_loss: 1.2523, test_loss: 1.3062, test_f1: 0.2281
 epoch: 63, train_loss: 1.2525, test_loss: 1.3039, test_f1: 0.2281
 epoch: 64, train_loss: 1.2523, test_loss: 1.3027, test_f1: 0.2281
 epoch: 65, train_loss: 1.2522, test_loss: 1.3041, test_f1: 0.2281
 epoch: 66, train_loss: 1.2521, test_loss: 1.3046, test_f1: 0.2281
 epoch: 67, train_loss: 1.2525, test_loss: 1.3027, test_f1: 0.2281
 epoch: 68, train_loss: 1.2526, test_loss: 1.3036, test_f1: 0.2281
 epoch: 69, train_loss: 1.2529, test_loss: 1.3076, test_f1: 0.2281
 epoch: 70, train_loss: 1.2527, test_loss: 1.3034, test_f1: 0.2281
 epoch: 71, train_loss: 1.2532, test_loss: 1.3008, test_f1: 0.2281
 epoch: 72, train_loss: 1.2535, test_loss: 1.3051, test_f1: 0.2281
 epoch: 73, train_loss: 1.2522, test_loss: 1.3078, test_f1: 0.2281
 epoch: 74, train_loss: 1.2528, test_loss: 1.3062, test_f1: 0.2281
 epoch: 75, train_loss: 1.2523, test_loss: 1.3046, test_f1: 0.2281
 epoch: 76, train_loss: 1.2530, test_loss: 1.3032, test_f1: 0.2281
 epoch: 77, train_loss: 1.2529, test_loss: 1.3061, test_f1: 0.2281
 epoch: 78, train_loss: 1.2523, test_loss: 1.3043, test_f1: 0.2281
 epoch: 79, train_loss: 1.2528, test_loss: 1.3032, test_f1: 0.2281
 epoch: 80, train_loss: 1.2523, test_loss: 1.3034, test_f1: 0.2281
 epoch: 81, train_loss: 1.2525, test_loss: 1.3033, test_f1: 0.2281
 epoch: 82, train_loss: 1.2533, test_loss: 1.3007, test_f1: 0.2281
 epoch: 83, train_loss: 1.2527, test_loss: 1.3038, test_f1: 0.2281
 epoch: 84, train_loss: 1.2522, test_loss: 1.3057, test_f1: 0.2281
 epoch: 85, train_loss: 1.2525, test_loss: 1.3053, test_f1: 0.2281
 epoch: 86, train_loss: 1.2526, test_loss: 1.3050, test_f1: 0.2281
 epoch: 87, train_loss: 1.2539, test_loss: 1.3013, test_f1: 0.2281
 epoch: 88, train_loss: 1.2527, test_loss: 1.3045, test_f1: 0.2281
 epoch: 89, train_loss: 1.2528, test_loss: 1.3058, test_f1: 0.2281
 epoch: 90, train_loss: 1.2530, test_loss: 1.3025, test_f1: 0.2281
 epoch: 91, train_loss: 1.2521, test_loss: 1.3055, test_f1: 0.2281
 epoch: 92, train_loss: 1.2528, test_loss: 1.3071, test_f1: 0.2281
 epoch: 93, train_loss: 1.2527, test_loss: 1.3045, test_f1: 0.2281
 epoch: 94, train_loss: 1.2522, test_loss: 1.3036, test_f1: 0.2281
 epoch: 95, train_loss: 1.2522, test_loss: 1.3042, test_f1: 0.2281
 epoch: 96, train_loss: 1.2522, test_loss: 1.3047, test_f1: 0.2281
 epoch: 97, train_loss: 1.2525, test_loss: 1.3052, test_f1: 0.2281
 epoch: 98, train_loss: 1.2527, test_loss: 1.3023, test_f1: 0.2281
 epoch: 99, train_loss: 1.2527, test_loss: 1.3059, test_f1: 0.2281
##################ITERATION #5 ****************************************
 epoch: 0, train_loss: 1.2709, test_loss: 1.3091, test_f1: 0.2281
 epoch: 1, train_loss: 1.2550, test_loss: 1.3010, test_f1: 0.2281
 epoch: 2, train_loss: 1.2547, test_loss: 1.3043, test_f1: 0.2281
 epoch: 3, train_loss: 1.2525, test_loss: 1.3061, test_f1: 0.2281
 epoch: 4, train_loss: 1.2536, test_loss: 1.3056, test_f1: 0.2281
 epoch: 5, train_loss: 1.2542, test_loss: 1.3060, test_f1: 0.2281
 epoch: 6, train_loss: 1.2534, test_loss: 1.3013, test_f1: 0.2281
 epoch: 7, train_loss: 1.2525, test_loss: 1.3044, test_f1: 0.2281
 epoch: 8, train_loss: 1.2534, test_loss: 1.3091, test_f1: 0.2281
 epoch: 9, train_loss: 1.2558, test_loss: 1.3035, test_f1: 0.2281
 epoch: 10, train_loss: 1.2575, test_loss: 1.3026, test_f1: 0.2281
 epoch: 11, train_loss: 1.2531, test_loss: 1.3046, test_f1: 0.2281
 epoch: 12, train_loss: 1.2534, test_loss: 1.3092, test_f1: 0.2281
 epoch: 13, train_loss: 1.2534, test_loss: 1.3006, test_f1: 0.2281
 epoch: 14, train_loss: 1.2528, test_loss: 1.3087, test_f1: 0.2281
 epoch: 15, train_loss: 1.2525, test_loss: 1.3068, test_f1: 0.2281
 epoch: 16, train_loss: 1.2560, test_loss: 1.3102, test_f1: 0.2281
 epoch: 17, train_loss: 1.2528, test_loss: 1.3062, test_f1: 0.2281
 epoch: 18, train_loss: 1.2535, test_loss: 1.3029, test_f1: 0.2281
 epoch: 19, train_loss: 1.2544, test_loss: 1.3026, test_f1: 0.2281
 epoch: 20, train_loss: 1.2525, test_loss: 1.3050, test_f1: 0.2281
 epoch: 21, train_loss: 1.2546, test_loss: 1.3076, test_f1: 0.2281
 epoch: 22, train_loss: 1.2533, test_loss: 1.3064, test_f1: 0.2281
 epoch: 23, train_loss: 1.2525, test_loss: 1.3059, test_f1: 0.2281
 epoch: 24, train_loss: 1.2529, test_loss: 1.3061, test_f1: 0.2281
 epoch: 25, train_loss: 1.2533, test_loss: 1.3069, test_f1: 0.2281
 epoch: 26, train_loss: 1.2535, test_loss: 1.3024, test_f1: 0.2281
 epoch: 27, train_loss: 1.2526, test_loss: 1.3055, test_f1: 0.2281
 epoch: 28, train_loss: 1.2537, test_loss: 1.3078, test_f1: 0.2281
 epoch: 29, train_loss: 1.2543, test_loss: 1.3035, test_f1: 0.2281
 epoch: 30, train_loss: 1.2534, test_loss: 1.3056, test_f1: 0.2281
 epoch: 31, train_loss: 1.2530, test_loss: 1.3061, test_f1: 0.2281
 epoch: 32, train_loss: 1.2525, test_loss: 1.3063, test_f1: 0.2281
 epoch: 33, train_loss: 1.2529, test_loss: 1.3025, test_f1: 0.2281
 epoch: 34, train_loss: 1.2535, test_loss: 1.3068, test_f1: 0.2281
 epoch: 35, train_loss: 1.2533, test_loss: 1.3048, test_f1: 0.2281
 epoch: 36, train_loss: 1.2530, test_loss: 1.3087, test_f1: 0.2281
 epoch: 37, train_loss: 1.2528, test_loss: 1.3039, test_f1: 0.2281
 epoch: 38, train_loss: 1.2540, test_loss: 1.3045, test_f1: 0.2281
 epoch: 39, train_loss: 1.2529, test_loss: 1.3029, test_f1: 0.2281
 epoch: 40, train_loss: 1.2532, test_loss: 1.3097, test_f1: 0.2281
 epoch: 41, train_loss: 1.2535, test_loss: 1.3017, test_f1: 0.2281
 epoch: 42, train_loss: 1.2530, test_loss: 1.3028, test_f1: 0.2281
 epoch: 43, train_loss: 1.2533, test_loss: 1.3061, test_f1: 0.2281
 epoch: 44, train_loss: 1.2530, test_loss: 1.3048, test_f1: 0.2281
 epoch: 45, train_loss: 1.2537, test_loss: 1.2995, test_f1: 0.2281
 epoch: 46, train_loss: 1.2530, test_loss: 1.3073, test_f1: 0.2281
 epoch: 47, train_loss: 1.2549, test_loss: 1.3103, test_f1: 0.2281
 epoch: 48, train_loss: 1.2527, test_loss: 1.3011, test_f1: 0.2281
 epoch: 49, train_loss: 1.2553, test_loss: 1.3046, test_f1: 0.2281
 epoch: 50, train_loss: 1.2533, test_loss: 1.3045, test_f1: 0.2281
 epoch: 51, train_loss: 1.2526, test_loss: 1.3062, test_f1: 0.2281
 epoch: 52, train_loss: 1.2530, test_loss: 1.3073, test_f1: 0.2281
 epoch: 53, train_loss: 1.2526, test_loss: 1.3054, test_f1: 0.2281
 epoch: 54, train_loss: 1.2525, test_loss: 1.3024, test_f1: 0.2281
 epoch: 55, train_loss: 1.2525, test_loss: 1.3057, test_f1: 0.2281
 epoch: 56, train_loss: 1.2524, test_loss: 1.3073, test_f1: 0.2281
 epoch: 57, train_loss: 1.2528, test_loss: 1.3058, test_f1: 0.2281
 epoch: 58, train_loss: 1.2524, test_loss: 1.3064, test_f1: 0.2281
 epoch: 59, train_loss: 1.2531, test_loss: 1.3033, test_f1: 0.2281
 epoch: 60, train_loss: 1.2524, test_loss: 1.3043, test_f1: 0.2281
 epoch: 61, train_loss: 1.2525, test_loss: 1.3065, test_f1: 0.2281
 epoch: 62, train_loss: 1.2526, test_loss: 1.3084, test_f1: 0.2281
 epoch: 63, train_loss: 1.2527, test_loss: 1.3062, test_f1: 0.2281
 epoch: 64, train_loss: 1.2526, test_loss: 1.3027, test_f1: 0.2281
 epoch: 65, train_loss: 1.2522, test_loss: 1.3047, test_f1: 0.2281
 epoch: 66, train_loss: 1.2525, test_loss: 1.3043, test_f1: 0.2281
 epoch: 67, train_loss: 1.2529, test_loss: 1.3050, test_f1: 0.2281
 epoch: 68, train_loss: 1.2523, test_loss: 1.3040, test_f1: 0.2281
 epoch: 69, train_loss: 1.2525, test_loss: 1.3039, test_f1: 0.2281
 epoch: 70, train_loss: 1.2534, test_loss: 1.3066, test_f1: 0.2281
 epoch: 71, train_loss: 1.2529, test_loss: 1.3054, test_f1: 0.2281
 epoch: 72, train_loss: 1.2529, test_loss: 1.3029, test_f1: 0.2281
 epoch: 73, train_loss: 1.2526, test_loss: 1.3047, test_f1: 0.2281
 epoch: 74, train_loss: 1.2526, test_loss: 1.3045, test_f1: 0.2281
 epoch: 75, train_loss: 1.2522, test_loss: 1.3056, test_f1: 0.2281
 epoch: 76, train_loss: 1.2532, test_loss: 1.3065, test_f1: 0.2281
 epoch: 77, train_loss: 1.2522, test_loss: 1.3056, test_f1: 0.2281
 epoch: 78, train_loss: 1.2527, test_loss: 1.3047, test_f1: 0.2281
 epoch: 79, train_loss: 1.2523, test_loss: 1.3040, test_f1: 0.2281
 epoch: 80, train_loss: 1.2523, test_loss: 1.3036, test_f1: 0.2281
 epoch: 81, train_loss: 1.2528, test_loss: 1.3041, test_f1: 0.2281
 epoch: 82, train_loss: 1.2525, test_loss: 1.3058, test_f1: 0.2281
 epoch: 83, train_loss: 1.2524, test_loss: 1.3056, test_f1: 0.2281
 epoch: 84, train_loss: 1.2524, test_loss: 1.3024, test_f1: 0.2281
 epoch: 85, train_loss: 1.2522, test_loss: 1.3036, test_f1: 0.2281
 epoch: 86, train_loss: 1.2535, test_loss: 1.3072, test_f1: 0.2281
 epoch: 87, train_loss: 1.2522, test_loss: 1.3070, test_f1: 0.2281
 epoch: 88, train_loss: 1.2537, test_loss: 1.3049, test_f1: 0.2281
 epoch: 89, train_loss: 1.2547, test_loss: 1.3037, test_f1: 0.2281
 epoch: 90, train_loss: 1.2529, test_loss: 1.3058, test_f1: 0.2281
 epoch: 91, train_loss: 1.2522, test_loss: 1.3060, test_f1: 0.2281
 epoch: 92, train_loss: 1.2525, test_loss: 1.3056, test_f1: 0.2281
 epoch: 93, train_loss: 1.2531, test_loss: 1.3042, test_f1: 0.2281
 epoch: 94, train_loss: 1.2526, test_loss: 1.3057, test_f1: 0.2281
 epoch: 95, train_loss: 1.2527, test_loss: 1.3035, test_f1: 0.2281
 epoch: 96, train_loss: 1.2523, test_loss: 1.3046, test_f1: 0.2281
 epoch: 97, train_loss: 1.2524, test_loss: 1.3031, test_f1: 0.2281
 epoch: 98, train_loss: 1.2527, test_loss: 1.3056, test_f1: 0.2281
 epoch: 99, train_loss: 1.2523, test_loss: 1.3040, test_f1: 0.2281
##################ITERATION #6 ****************************************
 epoch: 0, train_loss: 1.2791, test_loss: 1.3073, test_f1: 0.2281
 epoch: 1, train_loss: 1.2537, test_loss: 1.3094, test_f1: 0.2281
 epoch: 2, train_loss: 1.2524, test_loss: 1.3020, test_f1: 0.2281
 epoch: 3, train_loss: 1.2537, test_loss: 1.3055, test_f1: 0.2281
 epoch: 4, train_loss: 1.2529, test_loss: 1.3097, test_f1: 0.2281
 epoch: 5, train_loss: 1.2534, test_loss: 1.3054, test_f1: 0.2281
 epoch: 6, train_loss: 1.2534, test_loss: 1.3015, test_f1: 0.2281
 epoch: 7, train_loss: 1.2537, test_loss: 1.3061, test_f1: 0.2281
 epoch: 8, train_loss: 1.2529, test_loss: 1.3048, test_f1: 0.2281
 epoch: 9, train_loss: 1.2532, test_loss: 1.3064, test_f1: 0.2281
 epoch: 10, train_loss: 1.2522, test_loss: 1.3035, test_f1: 0.2281
 epoch: 11, train_loss: 1.2537, test_loss: 1.3047, test_f1: 0.2281
 epoch: 12, train_loss: 1.2530, test_loss: 1.3083, test_f1: 0.2281
 epoch: 13, train_loss: 1.2532, test_loss: 1.3031, test_f1: 0.2281
 epoch: 14, train_loss: 1.2532, test_loss: 1.3028, test_f1: 0.2281
 epoch: 15, train_loss: 1.2534, test_loss: 1.3034, test_f1: 0.2281
 epoch: 16, train_loss: 1.2530, test_loss: 1.3057, test_f1: 0.2281
 epoch: 17, train_loss: 1.2542, test_loss: 1.3081, test_f1: 0.2281
 epoch: 18, train_loss: 1.2546, test_loss: 1.3021, test_f1: 0.2281
 epoch: 19, train_loss: 1.2540, test_loss: 1.3084, test_f1: 0.2281
 epoch: 20, train_loss: 1.2533, test_loss: 1.3078, test_f1: 0.2281
 epoch: 21, train_loss: 1.2534, test_loss: 1.3016, test_f1: 0.2281
 epoch: 22, train_loss: 1.2528, test_loss: 1.3053, test_f1: 0.2281
 epoch: 23, train_loss: 1.2537, test_loss: 1.3095, test_f1: 0.2281
 epoch: 24, train_loss: 1.2547, test_loss: 1.3039, test_f1: 0.2281
 epoch: 25, train_loss: 1.2534, test_loss: 1.3079, test_f1: 0.2281
 epoch: 26, train_loss: 1.2538, test_loss: 1.3043, test_f1: 0.2281
 epoch: 27, train_loss: 1.2533, test_loss: 1.3065, test_f1: 0.2281
 epoch: 28, train_loss: 1.2528, test_loss: 1.3025, test_f1: 0.2281
 epoch: 29, train_loss: 1.2528, test_loss: 1.3038, test_f1: 0.2281
 epoch: 30, train_loss: 1.2529, test_loss: 1.3046, test_f1: 0.2281
 epoch: 31, train_loss: 1.2528, test_loss: 1.3054, test_f1: 0.2281
 epoch: 32, train_loss: 1.2529, test_loss: 1.3026, test_f1: 0.2281
 epoch: 33, train_loss: 1.2547, test_loss: 1.3030, test_f1: 0.2281
 epoch: 34, train_loss: 1.2527, test_loss: 1.3045, test_f1: 0.2281
 epoch: 35, train_loss: 1.2531, test_loss: 1.3046, test_f1: 0.2281
 epoch: 36, train_loss: 1.2551, test_loss: 1.3062, test_f1: 0.2281
 epoch: 37, train_loss: 1.2525, test_loss: 1.3022, test_f1: 0.2281
 epoch: 38, train_loss: 1.2528, test_loss: 1.3054, test_f1: 0.2281
 epoch: 39, train_loss: 1.2537, test_loss: 1.3069, test_f1: 0.2281
 epoch: 40, train_loss: 1.2529, test_loss: 1.3034, test_f1: 0.2281
 epoch: 41, train_loss: 1.2550, test_loss: 1.3011, test_f1: 0.2281
 epoch: 42, train_loss: 1.2528, test_loss: 1.3084, test_f1: 0.2281
 epoch: 43, train_loss: 1.2533, test_loss: 1.3050, test_f1: 0.2281
 epoch: 44, train_loss: 1.2531, test_loss: 1.3062, test_f1: 0.2281
 epoch: 45, train_loss: 1.2526, test_loss: 1.3050, test_f1: 0.2281
 epoch: 46, train_loss: 1.2531, test_loss: 1.3033, test_f1: 0.2281
 epoch: 47, train_loss: 1.2534, test_loss: 1.3049, test_f1: 0.2281
 epoch: 48, train_loss: 1.2529, test_loss: 1.3026, test_f1: 0.2281
 epoch: 49, train_loss: 1.2527, test_loss: 1.3020, test_f1: 0.2281
 epoch: 50, train_loss: 1.2528, test_loss: 1.3058, test_f1: 0.2281
 epoch: 51, train_loss: 1.2535, test_loss: 1.3054, test_f1: 0.2281
 epoch: 52, train_loss: 1.2528, test_loss: 1.3060, test_f1: 0.2281
 epoch: 53, train_loss: 1.2527, test_loss: 1.3020, test_f1: 0.2281
 epoch: 54, train_loss: 1.2525, test_loss: 1.3052, test_f1: 0.2281
 epoch: 55, train_loss: 1.2528, test_loss: 1.3053, test_f1: 0.2281
 epoch: 56, train_loss: 1.2531, test_loss: 1.3020, test_f1: 0.2281
 epoch: 57, train_loss: 1.2523, test_loss: 1.3035, test_f1: 0.2281
 epoch: 58, train_loss: 1.2526, test_loss: 1.3054, test_f1: 0.2281
 epoch: 59, train_loss: 1.2526, test_loss: 1.3044, test_f1: 0.2281
 epoch: 60, train_loss: 1.2533, test_loss: 1.3045, test_f1: 0.2281
 epoch: 61, train_loss: 1.2535, test_loss: 1.3057, test_f1: 0.2281
 epoch: 62, train_loss: 1.2521, test_loss: 1.3054, test_f1: 0.2281
 epoch: 63, train_loss: 1.2526, test_loss: 1.3042, test_f1: 0.2281
 epoch: 64, train_loss: 1.2525, test_loss: 1.3039, test_f1: 0.2281
 epoch: 65, train_loss: 1.2519, test_loss: 1.3021, test_f1: 0.2281
 epoch: 66, train_loss: 1.2524, test_loss: 1.3026, test_f1: 0.2281
 epoch: 67, train_loss: 1.2521, test_loss: 1.3062, test_f1: 0.2281
 epoch: 68, train_loss: 1.2522, test_loss: 1.3043, test_f1: 0.2281
 epoch: 69, train_loss: 1.2525, test_loss: 1.3029, test_f1: 0.2281
 epoch: 70, train_loss: 1.2524, test_loss: 1.3040, test_f1: 0.2281
 epoch: 71, train_loss: 1.2530, test_loss: 1.3049, test_f1: 0.2281
 epoch: 72, train_loss: 1.2525, test_loss: 1.3049, test_f1: 0.2281
 epoch: 73, train_loss: 1.2524, test_loss: 1.3048, test_f1: 0.2281
 epoch: 74, train_loss: 1.2525, test_loss: 1.3042, test_f1: 0.2281
 epoch: 75, train_loss: 1.2524, test_loss: 1.3040, test_f1: 0.2281
 epoch: 76, train_loss: 1.2522, test_loss: 1.3036, test_f1: 0.2281
 epoch: 77, train_loss: 1.2527, test_loss: 1.3061, test_f1: 0.2281
 epoch: 78, train_loss: 1.2526, test_loss: 1.3075, test_f1: 0.2281
 epoch: 79, train_loss: 1.2526, test_loss: 1.3037, test_f1: 0.2281
 epoch: 80, train_loss: 1.2533, test_loss: 1.3029, test_f1: 0.2281
 epoch: 81, train_loss: 1.2526, test_loss: 1.3044, test_f1: 0.2281
 epoch: 82, train_loss: 1.2525, test_loss: 1.3043, test_f1: 0.2281
 epoch: 83, train_loss: 1.2525, test_loss: 1.3071, test_f1: 0.2281
 epoch: 84, train_loss: 1.2522, test_loss: 1.3038, test_f1: 0.2281
 epoch: 85, train_loss: 1.2526, test_loss: 1.3026, test_f1: 0.2281
 epoch: 86, train_loss: 1.2531, test_loss: 1.3036, test_f1: 0.2281
 epoch: 87, train_loss: 1.2525, test_loss: 1.3068, test_f1: 0.2281
 epoch: 88, train_loss: 1.2526, test_loss: 1.3057, test_f1: 0.2281
 epoch: 89, train_loss: 1.2520, test_loss: 1.3020, test_f1: 0.2281
 epoch: 90, train_loss: 1.2535, test_loss: 1.3006, test_f1: 0.2281
 epoch: 91, train_loss: 1.2527, test_loss: 1.3072, test_f1: 0.2281
 epoch: 92, train_loss: 1.2532, test_loss: 1.3039, test_f1: 0.2281
 epoch: 93, train_loss: 1.2526, test_loss: 1.3067, test_f1: 0.2281
 epoch: 94, train_loss: 1.2526, test_loss: 1.3064, test_f1: 0.2281
 epoch: 95, train_loss: 1.2521, test_loss: 1.3027, test_f1: 0.2281
 epoch: 96, train_loss: 1.2530, test_loss: 1.3020, test_f1: 0.2281
 epoch: 97, train_loss: 1.2522, test_loss: 1.3059, test_f1: 0.2281
 epoch: 98, train_loss: 1.2528, test_loss: 1.3054, test_f1: 0.2281
 epoch: 99, train_loss: 1.2530, test_loss: 1.3056, test_f1: 0.2281
##################ITERATION #7 ****************************************
 epoch: 0, train_loss: 1.2563, test_loss: 1.3031, test_f1: 0.2281
 epoch: 1, train_loss: 1.2533, test_loss: 1.3048, test_f1: 0.2281
 epoch: 2, train_loss: 1.2528, test_loss: 1.3021, test_f1: 0.2281
 epoch: 3, train_loss: 1.2525, test_loss: 1.3066, test_f1: 0.2281
 epoch: 4, train_loss: 1.2525, test_loss: 1.3039, test_f1: 0.2281
 epoch: 5, train_loss: 1.2536, test_loss: 1.3003, test_f1: 0.2281
 epoch: 6, train_loss: 1.2537, test_loss: 1.3080, test_f1: 0.2281
 epoch: 7, train_loss: 1.2529, test_loss: 1.3039, test_f1: 0.2281
 epoch: 8, train_loss: 1.2540, test_loss: 1.3027, test_f1: 0.2281
 epoch: 9, train_loss: 1.2545, test_loss: 1.3047, test_f1: 0.2281
 epoch: 10, train_loss: 1.2560, test_loss: 1.3040, test_f1: 0.2281
 epoch: 11, train_loss: 1.2548, test_loss: 1.3100, test_f1: 0.2281
 epoch: 12, train_loss: 1.2556, test_loss: 1.3021, test_f1: 0.2281
 epoch: 13, train_loss: 1.2543, test_loss: 1.3059, test_f1: 0.2281
 epoch: 14, train_loss: 1.2539, test_loss: 1.3053, test_f1: 0.2281
 epoch: 15, train_loss: 1.2550, test_loss: 1.3023, test_f1: 0.2281
 epoch: 16, train_loss: 1.2534, test_loss: 1.3043, test_f1: 0.2281
 epoch: 17, train_loss: 1.2536, test_loss: 1.3073, test_f1: 0.2281
 epoch: 18, train_loss: 1.2560, test_loss: 1.3007, test_f1: 0.2281
 epoch: 19, train_loss: 1.2531, test_loss: 1.3097, test_f1: 0.2281
 epoch: 20, train_loss: 1.2527, test_loss: 1.3032, test_f1: 0.2281
 epoch: 21, train_loss: 1.2539, test_loss: 1.3049, test_f1: 0.2281
 epoch: 22, train_loss: 1.2543, test_loss: 1.3023, test_f1: 0.2281
 epoch: 23, train_loss: 1.2532, test_loss: 1.3076, test_f1: 0.2281
 epoch: 24, train_loss: 1.2548, test_loss: 1.3037, test_f1: 0.2281
 epoch: 25, train_loss: 1.2529, test_loss: 1.3087, test_f1: 0.2281
 epoch: 26, train_loss: 1.2548, test_loss: 1.3032, test_f1: 0.2281
 epoch: 27, train_loss: 1.2552, test_loss: 1.3061, test_f1: 0.2281
 epoch: 28, train_loss: 1.2531, test_loss: 1.3058, test_f1: 0.2281
 epoch: 29, train_loss: 1.2536, test_loss: 1.3041, test_f1: 0.2281
 epoch: 30, train_loss: 1.2530, test_loss: 1.3054, test_f1: 0.2281
 epoch: 31, train_loss: 1.2535, test_loss: 1.3053, test_f1: 0.2281
 epoch: 32, train_loss: 1.2535, test_loss: 1.3041, test_f1: 0.2281
 epoch: 33, train_loss: 1.2535, test_loss: 1.3037, test_f1: 0.2281
 epoch: 34, train_loss: 1.2537, test_loss: 1.3031, test_f1: 0.2281
 epoch: 35, train_loss: 1.2535, test_loss: 1.3037, test_f1: 0.2281
 epoch: 36, train_loss: 1.2536, test_loss: 1.3060, test_f1: 0.2281
 epoch: 37, train_loss: 1.2527, test_loss: 1.3043, test_f1: 0.2281
 epoch: 38, train_loss: 1.2530, test_loss: 1.3047, test_f1: 0.2281
 epoch: 39, train_loss: 1.2533, test_loss: 1.3038, test_f1: 0.2281
 epoch: 40, train_loss: 1.2523, test_loss: 1.3057, test_f1: 0.2281
 epoch: 41, train_loss: 1.2532, test_loss: 1.3066, test_f1: 0.2281
 epoch: 42, train_loss: 1.2526, test_loss: 1.3036, test_f1: 0.2281
 epoch: 43, train_loss: 1.2535, test_loss: 1.3032, test_f1: 0.2281
 epoch: 44, train_loss: 1.2529, test_loss: 1.3037, test_f1: 0.2281
 epoch: 45, train_loss: 1.2543, test_loss: 1.3032, test_f1: 0.2281
 epoch: 46, train_loss: 1.2558, test_loss: 1.3089, test_f1: 0.2281
 epoch: 47, train_loss: 1.2558, test_loss: 1.3069, test_f1: 0.2281
 epoch: 48, train_loss: 1.2556, test_loss: 1.3060, test_f1: 0.2281
 epoch: 49, train_loss: 1.2556, test_loss: 1.3055, test_f1: 0.2281
 epoch: 50, train_loss: 1.2532, test_loss: 1.3048, test_f1: 0.2281
 epoch: 51, train_loss: 1.2528, test_loss: 1.3046, test_f1: 0.2281
 epoch: 52, train_loss: 1.2522, test_loss: 1.3054, test_f1: 0.2281
 epoch: 53, train_loss: 1.2524, test_loss: 1.3048, test_f1: 0.2281
 epoch: 54, train_loss: 1.2525, test_loss: 1.3032, test_f1: 0.2281
 epoch: 55, train_loss: 1.2526, test_loss: 1.3030, test_f1: 0.2281
 epoch: 56, train_loss: 1.2522, test_loss: 1.3028, test_f1: 0.2281
 epoch: 57, train_loss: 1.2524, test_loss: 1.3061, test_f1: 0.2281
 epoch: 58, train_loss: 1.2523, test_loss: 1.3055, test_f1: 0.2281
 epoch: 59, train_loss: 1.2524, test_loss: 1.3047, test_f1: 0.2281
 epoch: 60, train_loss: 1.2531, test_loss: 1.3019, test_f1: 0.2281
 epoch: 61, train_loss: 1.2531, test_loss: 1.3044, test_f1: 0.2281
 epoch: 62, train_loss: 1.2523, test_loss: 1.3040, test_f1: 0.2281
 epoch: 63, train_loss: 1.2524, test_loss: 1.3062, test_f1: 0.2281
 epoch: 64, train_loss: 1.2527, test_loss: 1.3058, test_f1: 0.2281
 epoch: 65, train_loss: 1.2527, test_loss: 1.3048, test_f1: 0.2281
 epoch: 66, train_loss: 1.2527, test_loss: 1.3045, test_f1: 0.2281
 epoch: 67, train_loss: 1.2526, test_loss: 1.3042, test_f1: 0.2281
 epoch: 68, train_loss: 1.2527, test_loss: 1.3040, test_f1: 0.2281
 epoch: 69, train_loss: 1.2527, test_loss: 1.3071, test_f1: 0.2281
 epoch: 70, train_loss: 1.2526, test_loss: 1.3052, test_f1: 0.2281
 epoch: 71, train_loss: 1.2524, test_loss: 1.3036, test_f1: 0.2281
 epoch: 72, train_loss: 1.2526, test_loss: 1.3023, test_f1: 0.2281
 epoch: 73, train_loss: 1.2523, test_loss: 1.3033, test_f1: 0.2281
 epoch: 74, train_loss: 1.2526, test_loss: 1.3060, test_f1: 0.2281
 epoch: 75, train_loss: 1.2527, test_loss: 1.3036, test_f1: 0.2281
 epoch: 76, train_loss: 1.2525, test_loss: 1.3035, test_f1: 0.2281
 epoch: 77, train_loss: 1.2525, test_loss: 1.3057, test_f1: 0.2281
 epoch: 78, train_loss: 1.2529, test_loss: 1.3070, test_f1: 0.2281
 epoch: 79, train_loss: 1.2526, test_loss: 1.3039, test_f1: 0.2281
 epoch: 80, train_loss: 1.2528, test_loss: 1.3036, test_f1: 0.2281
 epoch: 81, train_loss: 1.2532, test_loss: 1.3087, test_f1: 0.2281
 epoch: 82, train_loss: 1.2525, test_loss: 1.3054, test_f1: 0.2281
 epoch: 83, train_loss: 1.2543, test_loss: 1.3027, test_f1: 0.2281
 epoch: 84, train_loss: 1.2528, test_loss: 1.3029, test_f1: 0.2281
 epoch: 85, train_loss: 1.2526, test_loss: 1.3040, test_f1: 0.2281
 epoch: 86, train_loss: 1.2522, test_loss: 1.3077, test_f1: 0.2281
 epoch: 87, train_loss: 1.2527, test_loss: 1.3070, test_f1: 0.2281
 epoch: 88, train_loss: 1.2527, test_loss: 1.3061, test_f1: 0.2281
 epoch: 89, train_loss: 1.2523, test_loss: 1.3048, test_f1: 0.2281
 epoch: 90, train_loss: 1.2525, test_loss: 1.3044, test_f1: 0.2281
 epoch: 91, train_loss: 1.2525, test_loss: 1.3047, test_f1: 0.2281
 epoch: 92, train_loss: 1.2537, test_loss: 1.3065, test_f1: 0.2281
 epoch: 93, train_loss: 1.2525, test_loss: 1.3038, test_f1: 0.2281
 epoch: 94, train_loss: 1.2529, test_loss: 1.3069, test_f1: 0.2281
 epoch: 95, train_loss: 1.2526, test_loss: 1.3070, test_f1: 0.2281
 epoch: 96, train_loss: 1.2523, test_loss: 1.3040, test_f1: 0.2281
 epoch: 97, train_loss: 1.2526, test_loss: 1.3030, test_f1: 0.2281
 epoch: 98, train_loss: 1.2529, test_loss: 1.3035, test_f1: 0.2281
 epoch: 99, train_loss: 1.2528, test_loss: 1.3045, test_f1: 0.2281
##################ITERATION #8 ****************************************
 epoch: 0, train_loss: 1.2727, test_loss: 1.3137, test_f1: 0.2281
 epoch: 1, train_loss: 1.2632, test_loss: 1.3125, test_f1: 0.2281
 epoch: 2, train_loss: 1.2533, test_loss: 1.2992, test_f1: 0.2281
 epoch: 3, train_loss: 1.2531, test_loss: 1.3046, test_f1: 0.2281
 epoch: 4, train_loss: 1.2525, test_loss: 1.3062, test_f1: 0.2281
 epoch: 5, train_loss: 1.2529, test_loss: 1.3063, test_f1: 0.2281
 epoch: 6, train_loss: 1.2541, test_loss: 1.3047, test_f1: 0.2281
 epoch: 7, train_loss: 1.2533, test_loss: 1.3056, test_f1: 0.2281
 epoch: 8, train_loss: 1.2530, test_loss: 1.3075, test_f1: 0.2281
 epoch: 9, train_loss: 1.2533, test_loss: 1.3035, test_f1: 0.2281
 epoch: 10, train_loss: 1.2532, test_loss: 1.3041, test_f1: 0.2281
 epoch: 11, train_loss: 1.2532, test_loss: 1.3064, test_f1: 0.2281
 epoch: 12, train_loss: 1.2529, test_loss: 1.3044, test_f1: 0.2281
 epoch: 13, train_loss: 1.2529, test_loss: 1.3057, test_f1: 0.2281
 epoch: 14, train_loss: 1.2527, test_loss: 1.3026, test_f1: 0.2281
 epoch: 15, train_loss: 1.2534, test_loss: 1.3067, test_f1: 0.2281
 epoch: 16, train_loss: 1.2537, test_loss: 1.3085, test_f1: 0.2281
 epoch: 17, train_loss: 1.2536, test_loss: 1.3067, test_f1: 0.2281
 epoch: 18, train_loss: 1.2530, test_loss: 1.3039, test_f1: 0.2281
 epoch: 19, train_loss: 1.2522, test_loss: 1.3014, test_f1: 0.2281
 epoch: 20, train_loss: 1.2538, test_loss: 1.3060, test_f1: 0.2281
 epoch: 21, train_loss: 1.2529, test_loss: 1.3040, test_f1: 0.2281
 epoch: 22, train_loss: 1.2526, test_loss: 1.3059, test_f1: 0.2281
 epoch: 23, train_loss: 1.2532, test_loss: 1.3030, test_f1: 0.2281
 epoch: 24, train_loss: 1.2531, test_loss: 1.3061, test_f1: 0.2281
 epoch: 25, train_loss: 1.2537, test_loss: 1.3042, test_f1: 0.2281
 epoch: 26, train_loss: 1.2553, test_loss: 1.3034, test_f1: 0.2281
 epoch: 27, train_loss: 1.2535, test_loss: 1.3042, test_f1: 0.2281
 epoch: 28, train_loss: 1.2530, test_loss: 1.3044, test_f1: 0.2281
 epoch: 29, train_loss: 1.2527, test_loss: 1.3045, test_f1: 0.2281
 epoch: 30, train_loss: 1.2542, test_loss: 1.3101, test_f1: 0.2281
 epoch: 31, train_loss: 1.2521, test_loss: 1.3018, test_f1: 0.2281
 epoch: 32, train_loss: 1.2530, test_loss: 1.3029, test_f1: 0.2281
 epoch: 33, train_loss: 1.2533, test_loss: 1.3131, test_f1: 0.2281
 epoch: 34, train_loss: 1.2526, test_loss: 1.3033, test_f1: 0.2281
 epoch: 35, train_loss: 1.2534, test_loss: 1.3023, test_f1: 0.2281
 epoch: 36, train_loss: 1.2527, test_loss: 1.3045, test_f1: 0.2281
 epoch: 37, train_loss: 1.2524, test_loss: 1.3072, test_f1: 0.2281
 epoch: 38, train_loss: 1.2526, test_loss: 1.3051, test_f1: 0.2281
 epoch: 39, train_loss: 1.2530, test_loss: 1.3027, test_f1: 0.2281
 epoch: 40, train_loss: 1.2528, test_loss: 1.3039, test_f1: 0.2281
 epoch: 41, train_loss: 1.2531, test_loss: 1.3062, test_f1: 0.2281
 epoch: 42, train_loss: 1.2532, test_loss: 1.3031, test_f1: 0.2281
 epoch: 43, train_loss: 1.2519, test_loss: 1.3083, test_f1: 0.2281
 epoch: 44, train_loss: 1.2531, test_loss: 1.3053, test_f1: 0.2281
 epoch: 45, train_loss: 1.2529, test_loss: 1.3068, test_f1: 0.2281
 epoch: 46, train_loss: 1.2545, test_loss: 1.3059, test_f1: 0.2281
 epoch: 47, train_loss: 1.2521, test_loss: 1.3046, test_f1: 0.2281
 epoch: 48, train_loss: 1.2531, test_loss: 1.3030, test_f1: 0.2281
 epoch: 49, train_loss: 1.2534, test_loss: 1.3019, test_f1: 0.2281
 epoch: 50, train_loss: 1.2532, test_loss: 1.3073, test_f1: 0.2281
 epoch: 51, train_loss: 1.2535, test_loss: 1.3050, test_f1: 0.2281
 epoch: 52, train_loss: 1.2518, test_loss: 1.3044, test_f1: 0.2281
 epoch: 53, train_loss: 1.2532, test_loss: 1.3049, test_f1: 0.2281
 epoch: 54, train_loss: 1.2525, test_loss: 1.3055, test_f1: 0.2281
 epoch: 55, train_loss: 1.2531, test_loss: 1.3030, test_f1: 0.2281
 epoch: 56, train_loss: 1.2527, test_loss: 1.3048, test_f1: 0.2281
 epoch: 57, train_loss: 1.2532, test_loss: 1.3079, test_f1: 0.2281
 epoch: 58, train_loss: 1.2533, test_loss: 1.3056, test_f1: 0.2281
 epoch: 59, train_loss: 1.2521, test_loss: 1.3058, test_f1: 0.2281
 epoch: 60, train_loss: 1.2522, test_loss: 1.3048, test_f1: 0.2281
 epoch: 61, train_loss: 1.2524, test_loss: 1.3042, test_f1: 0.2281
 epoch: 62, train_loss: 1.2529, test_loss: 1.3026, test_f1: 0.2281
 epoch: 63, train_loss: 1.2528, test_loss: 1.3036, test_f1: 0.2281
 epoch: 64, train_loss: 1.2530, test_loss: 1.3028, test_f1: 0.2281
 epoch: 65, train_loss: 1.2532, test_loss: 1.3039, test_f1: 0.2281
 epoch: 66, train_loss: 1.2527, test_loss: 1.3046, test_f1: 0.2281
 epoch: 67, train_loss: 1.2529, test_loss: 1.3063, test_f1: 0.2281
 epoch: 68, train_loss: 1.2522, test_loss: 1.3035, test_f1: 0.2281
 epoch: 69, train_loss: 1.2525, test_loss: 1.3046, test_f1: 0.2281
 epoch: 70, train_loss: 1.2524, test_loss: 1.3038, test_f1: 0.2281
 epoch: 71, train_loss: 1.2525, test_loss: 1.3048, test_f1: 0.2281
 epoch: 72, train_loss: 1.2524, test_loss: 1.3039, test_f1: 0.2281
 epoch: 73, train_loss: 1.2527, test_loss: 1.3071, test_f1: 0.2281
 epoch: 74, train_loss: 1.2539, test_loss: 1.3065, test_f1: 0.2281
 epoch: 75, train_loss: 1.2524, test_loss: 1.3033, test_f1: 0.2281
 epoch: 76, train_loss: 1.2528, test_loss: 1.3040, test_f1: 0.2281
 epoch: 77, train_loss: 1.2537, test_loss: 1.3031, test_f1: 0.2281
 epoch: 78, train_loss: 1.2532, test_loss: 1.3046, test_f1: 0.2281
 epoch: 79, train_loss: 1.2536, test_loss: 1.3065, test_f1: 0.2281
 epoch: 80, train_loss: 1.2518, test_loss: 1.3020, test_f1: 0.2281
 epoch: 81, train_loss: 1.2538, test_loss: 1.3029, test_f1: 0.2281
 epoch: 82, train_loss: 1.2538, test_loss: 1.3050, test_f1: 0.2281
 epoch: 83, train_loss: 1.2520, test_loss: 1.3057, test_f1: 0.2281
 epoch: 84, train_loss: 1.2531, test_loss: 1.3050, test_f1: 0.2281
 epoch: 85, train_loss: 1.2522, test_loss: 1.3035, test_f1: 0.2281
 epoch: 86, train_loss: 1.2523, test_loss: 1.3040, test_f1: 0.2281
 epoch: 87, train_loss: 1.2527, test_loss: 1.3030, test_f1: 0.2281
 epoch: 88, train_loss: 1.2526, test_loss: 1.3037, test_f1: 0.2281
 epoch: 89, train_loss: 1.2523, test_loss: 1.3075, test_f1: 0.2281
 epoch: 90, train_loss: 1.2526, test_loss: 1.3047, test_f1: 0.2281
 epoch: 91, train_loss: 1.2524, test_loss: 1.3035, test_f1: 0.2281
 epoch: 92, train_loss: 1.2528, test_loss: 1.3060, test_f1: 0.2281
 epoch: 93, train_loss: 1.2526, test_loss: 1.3054, test_f1: 0.2281
 epoch: 94, train_loss: 1.2522, test_loss: 1.3026, test_f1: 0.2281
 epoch: 95, train_loss: 1.2523, test_loss: 1.3043, test_f1: 0.2281
 epoch: 96, train_loss: 1.2522, test_loss: 1.3043, test_f1: 0.2281
 epoch: 97, train_loss: 1.2529, test_loss: 1.3022, test_f1: 0.2281
 epoch: 98, train_loss: 1.2527, test_loss: 1.3037, test_f1: 0.2281
 epoch: 99, train_loss: 1.2520, test_loss: 1.3044, test_f1: 0.2281
##################ITERATION #9 ****************************************
 epoch: 0, train_loss: 1.2584, test_loss: 1.3016, test_f1: 0.2281
 epoch: 1, train_loss: 1.2241, test_loss: 2.3096, test_f1: 0.1373
 epoch: 2, train_loss: 1.1761, test_loss: 1.2804, test_f1: 0.2281
 epoch: 3, train_loss: 1.1647, test_loss: 1.3021, test_f1: 0.1374
 epoch: 4, train_loss: 1.1336, test_loss: 1.8162, test_f1: 0.1938
 epoch: 5, train_loss: 1.0921, test_loss: 1.1482, test_f1: 0.3444
 epoch: 6, train_loss: 1.0630, test_loss: 1.3357, test_f1: 0.3272
 epoch: 7, train_loss: 1.0628, test_loss: 1.1263, test_f1: 0.4153
 epoch: 8, train_loss: 1.0419, test_loss: 1.1206, test_f1: 0.3420
 epoch: 9, train_loss: 1.0564, test_loss: 1.1554, test_f1: 0.4226
 epoch: 10, train_loss: 1.0557, test_loss: 1.6044, test_f1: 0.2890
 epoch: 11, train_loss: 1.0720, test_loss: 1.4592, test_f1: 0.3556
 epoch: 12, train_loss: 1.0472, test_loss: 1.2962, test_f1: 0.3450
 epoch: 13, train_loss: 1.0411, test_loss: 1.1662, test_f1: 0.4104
 epoch: 14, train_loss: 1.0608, test_loss: 1.2289, test_f1: 0.2949
 epoch: 15, train_loss: 1.0559, test_loss: 1.1261, test_f1: 0.3384
 epoch: 16, train_loss: 1.0420, test_loss: 1.1373, test_f1: 0.3395
 epoch: 17, train_loss: 1.0421, test_loss: 1.2732, test_f1: 0.4261
 epoch: 18, train_loss: 1.0339, test_loss: 1.1609, test_f1: 0.3317
 epoch: 19, train_loss: 1.0497, test_loss: 1.7228, test_f1: 0.3863
 epoch: 20, train_loss: 1.0521, test_loss: 2.8805, test_f1: 0.3444
 epoch: 21, train_loss: 1.0469, test_loss: 1.1701, test_f1: 0.3322
 epoch: 22, train_loss: 1.0576, test_loss: 1.1735, test_f1: 0.4294
 epoch: 23, train_loss: 1.0490, test_loss: 1.2679, test_f1: 0.2675
 epoch: 24, train_loss: 1.0927, test_loss: 1.2171, test_f1: 0.2973
 epoch: 25, train_loss: 1.0631, test_loss: 1.2553, test_f1: 0.3686
 epoch: 26, train_loss: 1.0880, test_loss: 1.1569, test_f1: 0.3344
 epoch: 27, train_loss: 1.0792, test_loss: 1.1896, test_f1: 0.3205
 epoch: 28, train_loss: 1.0934, test_loss: 1.2337, test_f1: 0.2356
 epoch: 29, train_loss: 1.0915, test_loss: 1.1524, test_f1: 0.3290
 epoch: 30, train_loss: 1.0800, test_loss: 1.1500, test_f1: 0.3290
 epoch: 31, train_loss: 1.0674, test_loss: 1.2599, test_f1: 0.2336
 epoch: 32, train_loss: 1.1051, test_loss: 1.2623, test_f1: 0.2281
 epoch: 33, train_loss: 1.0793, test_loss: 1.2725, test_f1: 0.2804
 epoch: 34, train_loss: 1.0852, test_loss: 1.1516, test_f1: 0.3344
 epoch: 35, train_loss: 1.0750, test_loss: 4.6966, test_f1: 0.3057
 epoch: 36, train_loss: 1.0612, test_loss: 1.1038, test_f1: 0.3444
 epoch: 37, train_loss: 1.0664, test_loss: 1.1496, test_f1: 0.3290
 epoch: 38, train_loss: 1.1824, test_loss: 1.3143, test_f1: 0.2281
 epoch: 39, train_loss: 1.2104, test_loss: 1.2067, test_f1: 0.2984
 epoch: 40, train_loss: 1.1112, test_loss: 1.2204, test_f1: 0.3051
 epoch: 41, train_loss: 1.0677, test_loss: 1.1493, test_f1: 0.3290
 epoch: 42, train_loss: 1.0575, test_loss: 1.1167, test_f1: 0.3395
 epoch: 43, train_loss: 1.1022, test_loss: 1.1984, test_f1: 0.3051
 epoch: 44, train_loss: 1.0742, test_loss: 1.1465, test_f1: 0.3290
 epoch: 45, train_loss: 1.0695, test_loss: 1.1541, test_f1: 0.3290
 epoch: 46, train_loss: 1.0616, test_loss: 1.1167, test_f1: 0.3395
 epoch: 47, train_loss: 1.0963, test_loss: 1.1230, test_f1: 0.3395
 epoch: 48, train_loss: 1.0560, test_loss: 1.1164, test_f1: 0.3395
 epoch: 49, train_loss: 1.0647, test_loss: 1.1112, test_f1: 0.3395
 epoch: 50, train_loss: 1.0631, test_loss: 1.1595, test_f1: 0.3290
 epoch: 51, train_loss: 1.1210, test_loss: 1.1545, test_f1: 0.3290
 epoch: 52, train_loss: 1.0684, test_loss: 1.1499, test_f1: 0.3290
 epoch: 53, train_loss: 1.0657, test_loss: 1.1391, test_f1: 0.3317
 epoch: 54, train_loss: 1.0581, test_loss: 1.1359, test_f1: 0.3344
 epoch: 55, train_loss: 1.0542, test_loss: 1.1253, test_f1: 0.3395
 epoch: 56, train_loss: 1.0538, test_loss: 1.1225, test_f1: 0.3395
 epoch: 57, train_loss: 1.0566, test_loss: 1.1468, test_f1: 0.3317
 epoch: 58, train_loss: 1.0630, test_loss: 1.1461, test_f1: 0.3317
 epoch: 59, train_loss: 1.0600, test_loss: 1.1412, test_f1: 0.3322
 epoch: 60, train_loss: 1.0636, test_loss: 1.1418, test_f1: 0.3322
 epoch: 61, train_loss: 1.0551, test_loss: 1.1175, test_f1: 0.3395
 epoch: 62, train_loss: 1.0503, test_loss: 1.1195, test_f1: 0.3395
 epoch: 63, train_loss: 1.0490, test_loss: 1.1385, test_f1: 0.3344
 epoch: 64, train_loss: 1.0516, test_loss: 1.1475, test_f1: 0.3317
 epoch: 65, train_loss: 1.0507, test_loss: 1.1375, test_f1: 0.3344
 epoch: 66, train_loss: 1.0915, test_loss: 1.1404, test_f1: 0.3344
 epoch: 67, train_loss: 1.0790, test_loss: 1.1408, test_f1: 0.3290
 epoch: 68, train_loss: 1.0673, test_loss: 1.1405, test_f1: 0.3317
 epoch: 69, train_loss: 1.0620, test_loss: 1.1211, test_f1: 0.3395
 epoch: 70, train_loss: 1.0526, test_loss: 1.1218, test_f1: 0.3395
 epoch: 71, train_loss: 1.0347, test_loss: 1.0994, test_f1: 0.3468
 epoch: 72, train_loss: 1.0577, test_loss: 1.1279, test_f1: 0.3395
 epoch: 73, train_loss: 1.0469, test_loss: 1.1237, test_f1: 0.3395
 epoch: 74, train_loss: 1.0501, test_loss: 1.1183, test_f1: 0.3395
 epoch: 75, train_loss: 1.0451, test_loss: 1.1216, test_f1: 0.3395
 epoch: 76, train_loss: 1.0390, test_loss: 1.1194, test_f1: 0.3395
 epoch: 77, train_loss: 1.0347, test_loss: 1.1205, test_f1: 0.3395
 epoch: 78, train_loss: 1.0356, test_loss: 1.1274, test_f1: 0.3395
 epoch: 79, train_loss: 1.0367, test_loss: 1.1142, test_f1: 0.3395
 epoch: 80, train_loss: 1.0287, test_loss: 1.0958, test_f1: 0.3468
 epoch: 81, train_loss: 1.0356, test_loss: 1.1170, test_f1: 0.3395
 epoch: 82, train_loss: 1.0417, test_loss: 1.1316, test_f1: 0.3395
 epoch: 83, train_loss: 1.0307, test_loss: 1.1242, test_f1: 0.3395
 epoch: 84, train_loss: 1.0370, test_loss: 1.0941, test_f1: 0.3468
 epoch: 85, train_loss: 1.0328, test_loss: 1.1107, test_f1: 0.3395
 epoch: 86, train_loss: 1.0309, test_loss: 1.1175, test_f1: 0.3395
 epoch: 87, train_loss: 1.0264, test_loss: 1.1199, test_f1: 0.3400
 epoch: 88, train_loss: 1.0327, test_loss: 1.1001, test_f1: 0.3468
 epoch: 89, train_loss: 1.0248, test_loss: 1.1129, test_f1: 0.3420
 epoch: 90, train_loss: 1.0711, test_loss: 1.1159, test_f1: 0.3395
 epoch: 91, train_loss: 1.1066, test_loss: 1.3061, test_f1: 0.2366
 epoch: 92, train_loss: 1.0944, test_loss: 1.1550, test_f1: 0.3244
 epoch: 93, train_loss: 1.0688, test_loss: 1.1439, test_f1: 0.3317
 epoch: 94, train_loss: 1.0695, test_loss: 1.1380, test_f1: 0.3344
 epoch: 95, train_loss: 1.0597, test_loss: 1.1290, test_f1: 0.3344
 epoch: 96, train_loss: 1.0536, test_loss: 1.1221, test_f1: 0.3395
 epoch: 97, train_loss: 1.0404, test_loss: 1.1239, test_f1: 0.3395
 epoch: 98, train_loss: 1.0434, test_loss: 1.1100, test_f1: 0.3395
 epoch: 99, train_loss: 1.0333, test_loss: 1.1146, test_f1: 0.3395

Training completed in 341.32 seconds
Best F1: 0.4975 at epoch 79
Mean F1 across iterations: 0.2751  0.0954
========================FINAL RESULTS================================
FEGIN weighted F1: 0.4975  0.0954
python main.py --data ltspice_demos --representation component_pin_net --model FEGIN --layers 3 --hiddens 16 --batch_size 128 --lr 0.1 --emb_size 128 --epochs 100 --save_appendix component_pin_net_L3_H16_BS128_LR0.1_E128 --no_val
-----



STDERR:
  File "main.py", line 370, in <module>
    main()
  File "main.py", line 254, in main
    dataset = dataset_class(
  File "/home/philip/projects/ltspice_examples_code_repo/Circuit-Completion-Using-GNNs/component_classification_with_link_prediction_head/evaluation/FEGIN/kernel/circuit_datasets.py", line 15, in __init__
    self.data, self.slices = torch.load(self.processed_paths[0])
  File "/home/philip/.local/lib/python3.8/site-packages/torch/serialization.py", line 1040, in load
    warnings.warn(
  File "/usr/lib/python3.8/warnings.py", line 109, in _showwarnmsg
    sw(msg.message, msg.category, msg.filename, msg.lineno,
  File "main.py", line 47, in warn_with_traceback
    traceback.print_stack(file=log)
/home/philip/projects/ltspice_examples_code_repo/Circuit-Completion-Using-GNNs/component_classification_with_link_prediction_head/evaluation/FEGIN/kernel/circuit_datasets.py:15: FutureWarning: You are using `torch.load` with `weights_only=False` (the current default value), which uses the default pickle module implicitly. It is possible to construct malicious pickle data which will execute arbitrary code during unpickling (See https://github.com/pytorch/pytorch/blob/main/SECURITY.md#untrusted-models for more details). In a future release, the default value for `weights_only` will be flipped to `True`. This limits the functions that could be executed during unpickling. Arbitrary objects will no longer be allowed to be loaded via this mode unless they are explicitly allowlisted by the user via `torch.serialization.add_safe_globals`. We recommend you start setting `weights_only=True` for any use case where you don't have full control of the loaded file. Please open an issue on GitHub for any issues related to this experimental feature.
  self.data, self.slices = torch.load(self.processed_paths[0])
