STDOUT:
Results will be saved in /home/philip/projects/ltspice_examples_code_repo/Circuit-Completion-Using-GNNs/component_classification_with_link_prediction_head/evaluation/FEGIN/results/model_FEGIN_dataset_ltspice_examples
Command line input: python main.py --data ltspice_examples --representation component_pin --model FEGIN --layers 3 --hiddens 128 --batch_size 128 --lr 0.001 --emb_size 250 --epochs 100 --save_appendix component_pin_L3_H128_BS128_LR0.001_E250 --no_val
 is saved.
-----
ltspice_examples - FEGIN
Using 3 layers, 128 hidden units, h = 2
Loading component_pin representation dataset
ENTERED
Training FEGIN on component_pin representation
Train: 3560, Test: 848
##################ITERATION #0 ****************************************
 epoch: 0, train_loss: 1.2420, test_loss: 1.2300, test_f1: 0.2260
 epoch: 1, train_loss: 1.0261, test_loss: 0.9911, test_f1: 0.4196
 epoch: 2, train_loss: 0.9306, test_loss: 0.9258, test_f1: 0.5303
 epoch: 3, train_loss: 0.8868, test_loss: 0.8862, test_f1: 0.5639
 epoch: 4, train_loss: 0.8384, test_loss: 1.1161, test_f1: 0.4519
 epoch: 5, train_loss: 0.8150, test_loss: 0.8915, test_f1: 0.5549
 epoch: 6, train_loss: 0.7979, test_loss: 0.9002, test_f1: 0.5069
 epoch: 7, train_loss: 0.7705, test_loss: 0.9507, test_f1: 0.5368
 epoch: 8, train_loss: 0.7466, test_loss: 0.8749, test_f1: 0.5482
 epoch: 9, train_loss: 0.7428, test_loss: 0.7957, test_f1: 0.5568
 epoch: 10, train_loss: 0.7333, test_loss: 0.8880, test_f1: 0.5443
 epoch: 11, train_loss: 0.7052, test_loss: 0.8405, test_f1: 0.5482
 epoch: 12, train_loss: 0.6852, test_loss: 0.8056, test_f1: 0.5775
 epoch: 13, train_loss: 0.6703, test_loss: 0.8682, test_f1: 0.5720
 epoch: 14, train_loss: 0.6618, test_loss: 0.8096, test_f1: 0.5812
 epoch: 15, train_loss: 0.6446, test_loss: 0.9131, test_f1: 0.5708
 epoch: 16, train_loss: 0.6371, test_loss: 0.8176, test_f1: 0.5882
 epoch: 17, train_loss: 0.6262, test_loss: 0.8366, test_f1: 0.6012
 epoch: 18, train_loss: 0.5991, test_loss: 0.9538, test_f1: 0.5835
 epoch: 19, train_loss: 0.5948, test_loss: 0.8817, test_f1: 0.6151
 epoch: 20, train_loss: 0.6026, test_loss: 0.9088, test_f1: 0.5917
 epoch: 21, train_loss: 0.6010, test_loss: 0.7793, test_f1: 0.6289
 epoch: 22, train_loss: 0.5675, test_loss: 0.9012, test_f1: 0.6191
 epoch: 23, train_loss: 0.5558, test_loss: 0.7899, test_f1: 0.6504
 epoch: 24, train_loss: 0.5362, test_loss: 0.8178, test_f1: 0.6299
 epoch: 25, train_loss: 0.5316, test_loss: 0.9007, test_f1: 0.6272
 epoch: 26, train_loss: 0.5438, test_loss: 0.8517, test_f1: 0.6158
 epoch: 27, train_loss: 0.5312, test_loss: 0.9791, test_f1: 0.6308
 epoch: 28, train_loss: 0.5147, test_loss: 0.7927, test_f1: 0.6250
 epoch: 29, train_loss: 0.5042, test_loss: 0.8691, test_f1: 0.6147
 epoch: 30, train_loss: 0.4810, test_loss: 0.8729, test_f1: 0.6270
 epoch: 31, train_loss: 0.4713, test_loss: 0.9505, test_f1: 0.6111
 epoch: 32, train_loss: 0.4609, test_loss: 0.8132, test_f1: 0.6552
 epoch: 33, train_loss: 0.4495, test_loss: 0.7907, test_f1: 0.6776
 epoch: 34, train_loss: 0.4421, test_loss: 1.0636, test_f1: 0.6364
 epoch: 35, train_loss: 0.4360, test_loss: 0.9426, test_f1: 0.6469
 epoch: 36, train_loss: 0.4359, test_loss: 0.9031, test_f1: 0.6431
 epoch: 37, train_loss: 0.4211, test_loss: 0.8842, test_f1: 0.6652
 epoch: 38, train_loss: 0.4054, test_loss: 0.9929, test_f1: 0.6404
 epoch: 39, train_loss: 0.4044, test_loss: 1.1061, test_f1: 0.6259
 epoch: 40, train_loss: 0.3897, test_loss: 0.8793, test_f1: 0.6933
 epoch: 41, train_loss: 0.3710, test_loss: 1.0205, test_f1: 0.6613
 epoch: 42, train_loss: 0.3825, test_loss: 1.1016, test_f1: 0.6327
 epoch: 43, train_loss: 0.3568, test_loss: 1.0778, test_f1: 0.6543
 epoch: 44, train_loss: 0.3329, test_loss: 0.9828, test_f1: 0.6581
 epoch: 45, train_loss: 0.3370, test_loss: 1.1099, test_f1: 0.6281
 epoch: 46, train_loss: 0.3245, test_loss: 1.0871, test_f1: 0.6372
 epoch: 47, train_loss: 0.3222, test_loss: 0.9501, test_f1: 0.6608
 epoch: 48, train_loss: 0.3149, test_loss: 1.0610, test_f1: 0.6663
 epoch: 49, train_loss: 0.2961, test_loss: 1.1625, test_f1: 0.6965
 epoch: 50, train_loss: 0.3402, test_loss: 1.1827, test_f1: 0.6464
 epoch: 51, train_loss: 0.2792, test_loss: 1.1408, test_f1: 0.6574
 epoch: 52, train_loss: 0.2338, test_loss: 1.0125, test_f1: 0.6800
 epoch: 53, train_loss: 0.2258, test_loss: 1.1305, test_f1: 0.6635
 epoch: 54, train_loss: 0.2152, test_loss: 1.0964, test_f1: 0.6837
 epoch: 55, train_loss: 0.2069, test_loss: 1.1965, test_f1: 0.6622
 epoch: 56, train_loss: 0.2142, test_loss: 1.2136, test_f1: 0.6640
 epoch: 57, train_loss: 0.1812, test_loss: 1.3441, test_f1: 0.6942
 epoch: 58, train_loss: 0.1963, test_loss: 1.1717, test_f1: 0.6861
 epoch: 59, train_loss: 0.2135, test_loss: 1.4954, test_f1: 0.6683
 epoch: 60, train_loss: 0.1983, test_loss: 1.3770, test_f1: 0.6552
 epoch: 61, train_loss: 0.1802, test_loss: 1.2234, test_f1: 0.6692
 epoch: 62, train_loss: 0.1870, test_loss: 1.2339, test_f1: 0.6983
 epoch: 63, train_loss: 0.1766, test_loss: 1.2123, test_f1: 0.6845
 epoch: 64, train_loss: 0.1674, test_loss: 1.3189, test_f1: 0.6781
 epoch: 65, train_loss: 0.1596, test_loss: 1.5887, test_f1: 0.6630
 epoch: 66, train_loss: 0.1676, test_loss: 1.3163, test_f1: 0.6821
 epoch: 67, train_loss: 0.1630, test_loss: 1.3758, test_f1: 0.6794
 epoch: 68, train_loss: 0.1487, test_loss: 1.4188, test_f1: 0.6743
 epoch: 69, train_loss: 0.1849, test_loss: 1.5363, test_f1: 0.6718
 epoch: 70, train_loss: 0.1670, test_loss: 1.4381, test_f1: 0.6672
 epoch: 71, train_loss: 0.1528, test_loss: 1.6730, test_f1: 0.6650
 epoch: 72, train_loss: 0.1504, test_loss: 1.4372, test_f1: 0.6836
 epoch: 73, train_loss: 0.1547, test_loss: 1.7005, test_f1: 0.6644
 epoch: 74, train_loss: 0.1506, test_loss: 1.5654, test_f1: 0.6510
 epoch: 75, train_loss: 0.1475, test_loss: 1.3131, test_f1: 0.6927
 epoch: 76, train_loss: 0.1410, test_loss: 1.6113, test_f1: 0.6749
 epoch: 77, train_loss: 0.1393, test_loss: 1.6459, test_f1: 0.6973
 epoch: 78, train_loss: 0.1425, test_loss: 1.5703, test_f1: 0.6739
 epoch: 79, train_loss: 0.1397, test_loss: 1.7550, test_f1: 0.6602
 epoch: 80, train_loss: 0.1396, test_loss: 1.6329, test_f1: 0.6504
 epoch: 81, train_loss: 0.1359, test_loss: 1.6035, test_f1: 0.6880
 epoch: 82, train_loss: 0.1363, test_loss: 1.6322, test_f1: 0.6874
 epoch: 83, train_loss: 0.1137, test_loss: 1.6540, test_f1: 0.6706
 epoch: 84, train_loss: 0.1401, test_loss: 1.4914, test_f1: 0.6981
 epoch: 85, train_loss: 0.1105, test_loss: 1.6468, test_f1: 0.6790
 epoch: 86, train_loss: 0.1172, test_loss: 1.7103, test_f1: 0.6751
 epoch: 87, train_loss: 0.1207, test_loss: 1.7087, test_f1: 0.6807
 epoch: 88, train_loss: 0.1312, test_loss: 1.6632, test_f1: 0.6625
 epoch: 89, train_loss: 0.1136, test_loss: 1.5566, test_f1: 0.6890
 epoch: 90, train_loss: 0.1092, test_loss: 1.6152, test_f1: 0.6995
 epoch: 91, train_loss: 0.1138, test_loss: 1.7531, test_f1: 0.6703
 epoch: 92, train_loss: 0.1138, test_loss: 1.8864, test_f1: 0.6617
 epoch: 93, train_loss: 0.0961, test_loss: 1.7234, test_f1: 0.6906
 epoch: 94, train_loss: 0.1147, test_loss: 1.6149, test_f1: 0.6775
 epoch: 95, train_loss: 0.1014, test_loss: 1.9988, test_f1: 0.6988
 epoch: 96, train_loss: 0.1228, test_loss: 1.9574, test_f1: 0.6638
 epoch: 97, train_loss: 0.0997, test_loss: 1.7146, test_f1: 0.6837
 epoch: 98, train_loss: 0.0996, test_loss: 1.9062, test_f1: 0.6673
 epoch: 99, train_loss: 0.0995, test_loss: 1.9616, test_f1: 0.6671
##################ITERATION #1 ****************************************
 epoch: 0, train_loss: 1.1036, test_loss: 1.3429, test_f1: 0.2260
 epoch: 1, train_loss: 0.9460, test_loss: 0.9614, test_f1: 0.4534
 epoch: 2, train_loss: 0.8810, test_loss: 0.9010, test_f1: 0.4958
 epoch: 3, train_loss: 0.8337, test_loss: 0.9366, test_f1: 0.5475
 epoch: 4, train_loss: 0.8058, test_loss: 0.8625, test_f1: 0.5683
 epoch: 5, train_loss: 0.7777, test_loss: 0.9086, test_f1: 0.5334
 epoch: 6, train_loss: 0.7586, test_loss: 0.9182, test_f1: 0.5682
 epoch: 7, train_loss: 0.7357, test_loss: 0.9204, test_f1: 0.5307
 epoch: 8, train_loss: 0.7158, test_loss: 0.8949, test_f1: 0.5835
 epoch: 9, train_loss: 0.7112, test_loss: 0.8505, test_f1: 0.5743
 epoch: 10, train_loss: 0.6932, test_loss: 0.9173, test_f1: 0.5392
 epoch: 11, train_loss: 0.6528, test_loss: 1.0024, test_f1: 0.5602
 epoch: 12, train_loss: 0.6404, test_loss: 0.9862, test_f1: 0.5602
 epoch: 13, train_loss: 0.6393, test_loss: 0.8617, test_f1: 0.5998
 epoch: 14, train_loss: 0.6407, test_loss: 0.9261, test_f1: 0.5612
 epoch: 15, train_loss: 0.6070, test_loss: 1.0726, test_f1: 0.5900
 epoch: 16, train_loss: 0.6022, test_loss: 0.8320, test_f1: 0.6564
 epoch: 17, train_loss: 0.5740, test_loss: 1.0674, test_f1: 0.5723
 epoch: 18, train_loss: 0.5610, test_loss: 0.9575, test_f1: 0.5848
 epoch: 19, train_loss: 0.5635, test_loss: 0.8790, test_f1: 0.6327
 epoch: 20, train_loss: 0.5359, test_loss: 0.8809, test_f1: 0.6206
 epoch: 21, train_loss: 0.5410, test_loss: 0.8172, test_f1: 0.6310
 epoch: 22, train_loss: 0.5156, test_loss: 0.8847, test_f1: 0.6343
 epoch: 23, train_loss: 0.5021, test_loss: 1.2608, test_f1: 0.5785
 epoch: 24, train_loss: 0.4975, test_loss: 0.9444, test_f1: 0.6523
 epoch: 25, train_loss: 0.4782, test_loss: 0.9555, test_f1: 0.6344
 epoch: 26, train_loss: 0.4772, test_loss: 1.0437, test_f1: 0.5859
 epoch: 27, train_loss: 0.4436, test_loss: 0.9529, test_f1: 0.6476
 epoch: 28, train_loss: 0.4466, test_loss: 1.1357, test_f1: 0.5983
 epoch: 29, train_loss: 0.4390, test_loss: 1.3133, test_f1: 0.6009
 epoch: 30, train_loss: 0.4452, test_loss: 1.0323, test_f1: 0.5992
 epoch: 31, train_loss: 0.4275, test_loss: 0.9801, test_f1: 0.6356
 epoch: 32, train_loss: 0.4173, test_loss: 1.0157, test_f1: 0.6108
 epoch: 33, train_loss: 0.3918, test_loss: 0.8221, test_f1: 0.6963
 epoch: 34, train_loss: 0.3986, test_loss: 0.9347, test_f1: 0.6477
 epoch: 35, train_loss: 0.3853, test_loss: 1.0579, test_f1: 0.6803
 epoch: 36, train_loss: 0.3759, test_loss: 1.0527, test_f1: 0.6418
 epoch: 37, train_loss: 0.3818, test_loss: 1.1386, test_f1: 0.6461
 epoch: 38, train_loss: 0.3736, test_loss: 1.1282, test_f1: 0.6131
 epoch: 39, train_loss: 0.3603, test_loss: 1.3131, test_f1: 0.5998
 epoch: 40, train_loss: 0.3387, test_loss: 1.1158, test_f1: 0.6374
 epoch: 41, train_loss: 0.3115, test_loss: 0.9557, test_f1: 0.6547
 epoch: 42, train_loss: 0.3196, test_loss: 1.0708, test_f1: 0.6464
 epoch: 43, train_loss: 0.3181, test_loss: 0.9839, test_f1: 0.6844
 epoch: 44, train_loss: 0.3152, test_loss: 1.2321, test_f1: 0.6210
 epoch: 45, train_loss: 0.3116, test_loss: 1.0706, test_f1: 0.6730
 epoch: 46, train_loss: 0.2890, test_loss: 1.2032, test_f1: 0.6508
 epoch: 47, train_loss: 0.3188, test_loss: 1.1665, test_f1: 0.6656
 epoch: 48, train_loss: 0.3211, test_loss: 1.4893, test_f1: 0.5794
 epoch: 49, train_loss: 0.3010, test_loss: 1.5059, test_f1: 0.6154
 epoch: 50, train_loss: 0.2700, test_loss: 1.5036, test_f1: 0.6344
 epoch: 51, train_loss: 0.2540, test_loss: 1.2744, test_f1: 0.6705
 epoch: 52, train_loss: 0.2133, test_loss: 1.3578, test_f1: 0.6795
 epoch: 53, train_loss: 0.2197, test_loss: 1.3589, test_f1: 0.6522
 epoch: 54, train_loss: 0.2070, test_loss: 1.4784, test_f1: 0.6268
 epoch: 55, train_loss: 0.1963, test_loss: 1.4610, test_f1: 0.6826
 epoch: 56, train_loss: 0.1928, test_loss: 1.3667, test_f1: 0.6820
 epoch: 57, train_loss: 0.1771, test_loss: 1.5319, test_f1: 0.6558
 epoch: 58, train_loss: 0.1841, test_loss: 1.6368, test_f1: 0.6341
 epoch: 59, train_loss: 0.1830, test_loss: 1.5378, test_f1: 0.6510
 epoch: 60, train_loss: 0.1851, test_loss: 1.6017, test_f1: 0.6547
 epoch: 61, train_loss: 0.1790, test_loss: 1.6838, test_f1: 0.6440
 epoch: 62, train_loss: 0.1706, test_loss: 1.6740, test_f1: 0.6353
 epoch: 63, train_loss: 0.1779, test_loss: 1.4901, test_f1: 0.6607
 epoch: 64, train_loss: 0.1725, test_loss: 1.6265, test_f1: 0.6451
 epoch: 65, train_loss: 0.1603, test_loss: 1.6107, test_f1: 0.6674
 epoch: 66, train_loss: 0.1806, test_loss: 1.4849, test_f1: 0.6683
 epoch: 67, train_loss: 0.1685, test_loss: 1.6604, test_f1: 0.6576
 epoch: 68, train_loss: 0.1531, test_loss: 1.6332, test_f1: 0.6429
 epoch: 69, train_loss: 0.1601, test_loss: 1.7946, test_f1: 0.6448
 epoch: 70, train_loss: 0.1602, test_loss: 1.7610, test_f1: 0.6381
 epoch: 71, train_loss: 0.1746, test_loss: 1.7421, test_f1: 0.6709
 epoch: 72, train_loss: 0.1527, test_loss: 1.7398, test_f1: 0.6283
 epoch: 73, train_loss: 0.1533, test_loss: 1.8270, test_f1: 0.6494
 epoch: 74, train_loss: 0.1524, test_loss: 1.8486, test_f1: 0.6747
 epoch: 75, train_loss: 0.1500, test_loss: 1.6989, test_f1: 0.6626
 epoch: 76, train_loss: 0.1506, test_loss: 1.7335, test_f1: 0.6610
 epoch: 77, train_loss: 0.1429, test_loss: 1.8197, test_f1: 0.6651
 epoch: 78, train_loss: 0.1423, test_loss: 2.0251, test_f1: 0.6364
 epoch: 79, train_loss: 0.1493, test_loss: 1.7816, test_f1: 0.6564
 epoch: 80, train_loss: 0.1341, test_loss: 1.8038, test_f1: 0.6548
 epoch: 81, train_loss: 0.1216, test_loss: 1.8808, test_f1: 0.6488
 epoch: 82, train_loss: 0.1206, test_loss: 1.8642, test_f1: 0.6730
 epoch: 83, train_loss: 0.1270, test_loss: 1.9368, test_f1: 0.6225
 epoch: 84, train_loss: 0.1457, test_loss: 1.8663, test_f1: 0.6339
 epoch: 85, train_loss: 0.1283, test_loss: 1.7618, test_f1: 0.6614
 epoch: 86, train_loss: 0.1330, test_loss: 1.9831, test_f1: 0.6443
 epoch: 87, train_loss: 0.1247, test_loss: 1.7664, test_f1: 0.6763
 epoch: 88, train_loss: 0.1341, test_loss: 2.0433, test_f1: 0.6498
 epoch: 89, train_loss: 0.1235, test_loss: 1.9776, test_f1: 0.6457
 epoch: 90, train_loss: 0.1250, test_loss: 2.0982, test_f1: 0.6454
 epoch: 91, train_loss: 0.1188, test_loss: 2.1081, test_f1: 0.6362
 epoch: 92, train_loss: 0.1119, test_loss: 2.2622, test_f1: 0.6438
 epoch: 93, train_loss: 0.1266, test_loss: 1.9935, test_f1: 0.6738
 epoch: 94, train_loss: 0.1106, test_loss: 2.0600, test_f1: 0.6523
 epoch: 95, train_loss: 0.1058, test_loss: 2.0194, test_f1: 0.6603
 epoch: 96, train_loss: 0.0974, test_loss: 2.1959, test_f1: 0.6392
 epoch: 97, train_loss: 0.1077, test_loss: 2.0256, test_f1: 0.6491
 epoch: 98, train_loss: 0.1063, test_loss: 2.1450, test_f1: 0.6699
 epoch: 99, train_loss: 0.1162, test_loss: 2.0423, test_f1: 0.6406
##################ITERATION #2 ****************************************
 epoch: 0, train_loss: 1.0858, test_loss: 1.3283, test_f1: 0.2260
 epoch: 1, train_loss: 0.9495, test_loss: 1.0064, test_f1: 0.4632
 epoch: 2, train_loss: 0.8824, test_loss: 0.9098, test_f1: 0.5229
 epoch: 3, train_loss: 0.8435, test_loss: 0.8647, test_f1: 0.5778
 epoch: 4, train_loss: 0.8084, test_loss: 0.8932, test_f1: 0.5621
 epoch: 5, train_loss: 0.7973, test_loss: 1.0474, test_f1: 0.5327
 epoch: 6, train_loss: 0.7698, test_loss: 0.8922, test_f1: 0.5692
 epoch: 7, train_loss: 0.7338, test_loss: 0.9101, test_f1: 0.5959
 epoch: 8, train_loss: 0.7235, test_loss: 0.8539, test_f1: 0.6154
 epoch: 9, train_loss: 0.7193, test_loss: 0.8975, test_f1: 0.6297
 epoch: 10, train_loss: 0.6852, test_loss: 0.7906, test_f1: 0.6299
 epoch: 11, train_loss: 0.6571, test_loss: 0.8169, test_f1: 0.6085
 epoch: 12, train_loss: 0.6466, test_loss: 0.8467, test_f1: 0.6261
 epoch: 13, train_loss: 0.6468, test_loss: 0.8953, test_f1: 0.6028
 epoch: 14, train_loss: 0.6230, test_loss: 0.8047, test_f1: 0.6521
 epoch: 15, train_loss: 0.6188, test_loss: 0.8131, test_f1: 0.6656
 epoch: 16, train_loss: 0.5930, test_loss: 1.0404, test_f1: 0.5479
 epoch: 17, train_loss: 0.5832, test_loss: 0.9323, test_f1: 0.6305
 epoch: 18, train_loss: 0.5740, test_loss: 0.8425, test_f1: 0.6405
 epoch: 19, train_loss: 0.5411, test_loss: 1.0054, test_f1: 0.5967
 epoch: 20, train_loss: 0.5340, test_loss: 0.7920, test_f1: 0.6677
 epoch: 21, train_loss: 0.5295, test_loss: 0.8794, test_f1: 0.6258
 epoch: 22, train_loss: 0.5164, test_loss: 0.9498, test_f1: 0.5956
 epoch: 23, train_loss: 0.5150, test_loss: 0.8765, test_f1: 0.6526
 epoch: 24, train_loss: 0.4953, test_loss: 0.9021, test_f1: 0.6385
 epoch: 25, train_loss: 0.4638, test_loss: 0.9201, test_f1: 0.6445
 epoch: 26, train_loss: 0.4654, test_loss: 1.1581, test_f1: 0.5977
 epoch: 27, train_loss: 0.4383, test_loss: 0.9490, test_f1: 0.6413
 epoch: 28, train_loss: 0.4451, test_loss: 0.9282, test_f1: 0.6532
 epoch: 29, train_loss: 0.4255, test_loss: 1.2045, test_f1: 0.6293
 epoch: 30, train_loss: 0.4018, test_loss: 1.0877, test_f1: 0.6225
 epoch: 31, train_loss: 0.3982, test_loss: 1.0319, test_f1: 0.6250
 epoch: 32, train_loss: 0.4230, test_loss: 0.9686, test_f1: 0.6771
 epoch: 33, train_loss: 0.3980, test_loss: 1.0669, test_f1: 0.6537
 epoch: 34, train_loss: 0.3738, test_loss: 1.0390, test_f1: 0.6288
 epoch: 35, train_loss: 0.3556, test_loss: 1.1477, test_f1: 0.6309
 epoch: 36, train_loss: 0.3850, test_loss: 1.1549, test_f1: 0.6121
 epoch: 37, train_loss: 0.3441, test_loss: 1.1184, test_f1: 0.6364
 epoch: 38, train_loss: 0.3241, test_loss: 1.0454, test_f1: 0.6241
 epoch: 39, train_loss: 0.3322, test_loss: 1.2630, test_f1: 0.6061
 epoch: 40, train_loss: 0.3380, test_loss: 1.2230, test_f1: 0.5632
 epoch: 41, train_loss: 0.3313, test_loss: 1.0517, test_f1: 0.6245
 epoch: 42, train_loss: 0.3143, test_loss: 1.1262, test_f1: 0.6567
 epoch: 43, train_loss: 0.3175, test_loss: 1.1310, test_f1: 0.6604
 epoch: 44, train_loss: 0.2891, test_loss: 1.3268, test_f1: 0.6393
 epoch: 45, train_loss: 0.2757, test_loss: 1.3482, test_f1: 0.6436
 epoch: 46, train_loss: 0.2696, test_loss: 1.2846, test_f1: 0.6320
 epoch: 47, train_loss: 0.2820, test_loss: 1.2027, test_f1: 0.6592
 epoch: 48, train_loss: 0.3129, test_loss: 1.1552, test_f1: 0.6480
 epoch: 49, train_loss: 0.2824, test_loss: 1.4521, test_f1: 0.6280
 epoch: 50, train_loss: 0.2431, test_loss: 1.2517, test_f1: 0.6454
 epoch: 51, train_loss: 0.2248, test_loss: 1.4020, test_f1: 0.6422
 epoch: 52, train_loss: 0.1981, test_loss: 1.3042, test_f1: 0.6573
 epoch: 53, train_loss: 0.1961, test_loss: 1.5171, test_f1: 0.6594
 epoch: 54, train_loss: 0.1804, test_loss: 1.5832, test_f1: 0.6596
 epoch: 55, train_loss: 0.1813, test_loss: 1.5040, test_f1: 0.6607
 epoch: 56, train_loss: 0.1825, test_loss: 1.4823, test_f1: 0.6411
 epoch: 57, train_loss: 0.1845, test_loss: 1.5045, test_f1: 0.6591
 epoch: 58, train_loss: 0.1599, test_loss: 1.5392, test_f1: 0.6597
 epoch: 59, train_loss: 0.1714, test_loss: 1.5223, test_f1: 0.6606
 epoch: 60, train_loss: 0.1659, test_loss: 1.4729, test_f1: 0.6762
 epoch: 61, train_loss: 0.1544, test_loss: 1.6723, test_f1: 0.6501
 epoch: 62, train_loss: 0.1567, test_loss: 1.6483, test_f1: 0.6456
 epoch: 63, train_loss: 0.1571, test_loss: 1.5583, test_f1: 0.6781
 epoch: 64, train_loss: 0.1483, test_loss: 1.6719, test_f1: 0.6407
 epoch: 65, train_loss: 0.1482, test_loss: 1.7872, test_f1: 0.6373
 epoch: 66, train_loss: 0.1652, test_loss: 1.7401, test_f1: 0.6424
 epoch: 67, train_loss: 0.1565, test_loss: 1.6224, test_f1: 0.6911
 epoch: 68, train_loss: 0.1308, test_loss: 1.7295, test_f1: 0.6554
 epoch: 69, train_loss: 0.1460, test_loss: 1.9065, test_f1: 0.6530
 epoch: 70, train_loss: 0.1521, test_loss: 1.6863, test_f1: 0.6556
 epoch: 71, train_loss: 0.1293, test_loss: 1.7391, test_f1: 0.6615
 epoch: 72, train_loss: 0.1389, test_loss: 1.6575, test_f1: 0.6539
 epoch: 73, train_loss: 0.1320, test_loss: 1.8918, test_f1: 0.6337
 epoch: 74, train_loss: 0.1253, test_loss: 1.7554, test_f1: 0.6852
 epoch: 75, train_loss: 0.1311, test_loss: 1.9365, test_f1: 0.6373
 epoch: 76, train_loss: 0.1177, test_loss: 1.8995, test_f1: 0.6548
 epoch: 77, train_loss: 0.1338, test_loss: 1.9161, test_f1: 0.6632
 epoch: 78, train_loss: 0.1335, test_loss: 1.9356, test_f1: 0.6576
 epoch: 79, train_loss: 0.1184, test_loss: 1.9810, test_f1: 0.6520
 epoch: 80, train_loss: 0.1210, test_loss: 2.1465, test_f1: 0.6372
 epoch: 81, train_loss: 0.1257, test_loss: 2.0090, test_f1: 0.6606
 epoch: 82, train_loss: 0.1213, test_loss: 2.0746, test_f1: 0.6516
 epoch: 83, train_loss: 0.1439, test_loss: 1.9941, test_f1: 0.6586
 epoch: 84, train_loss: 0.1209, test_loss: 1.9403, test_f1: 0.6509
 epoch: 85, train_loss: 0.1300, test_loss: 1.8969, test_f1: 0.6643
 epoch: 86, train_loss: 0.1197, test_loss: 1.7208, test_f1: 0.6756
 epoch: 87, train_loss: 0.1186, test_loss: 1.9330, test_f1: 0.6421
 epoch: 88, train_loss: 0.1110, test_loss: 1.9305, test_f1: 0.6658
 epoch: 89, train_loss: 0.1094, test_loss: 2.0386, test_f1: 0.6572
 epoch: 90, train_loss: 0.1209, test_loss: 2.0622, test_f1: 0.6414
 epoch: 91, train_loss: 0.1012, test_loss: 1.9805, test_f1: 0.6543
 epoch: 92, train_loss: 0.1009, test_loss: 1.8840, test_f1: 0.6490
 epoch: 93, train_loss: 0.1108, test_loss: 1.9368, test_f1: 0.6405
 epoch: 94, train_loss: 0.1025, test_loss: 2.0512, test_f1: 0.6678
 epoch: 95, train_loss: 0.0996, test_loss: 1.8244, test_f1: 0.6941
 epoch: 96, train_loss: 0.0914, test_loss: 1.9314, test_f1: 0.6869
 epoch: 97, train_loss: 0.0887, test_loss: 2.0456, test_f1: 0.6417
 epoch: 98, train_loss: 0.1068, test_loss: 2.0997, test_f1: 0.6347
 epoch: 99, train_loss: 0.1112, test_loss: 1.8209, test_f1: 0.6846
##################ITERATION #3 ****************************************
 epoch: 0, train_loss: 1.1927, test_loss: 1.1970, test_f1: 0.3613
 epoch: 1, train_loss: 1.0161, test_loss: 1.0121, test_f1: 0.4743
 epoch: 2, train_loss: 0.9107, test_loss: 0.9446, test_f1: 0.5044
 epoch: 3, train_loss: 0.8666, test_loss: 1.0355, test_f1: 0.5470
 epoch: 4, train_loss: 0.8465, test_loss: 0.8713, test_f1: 0.5550
 epoch: 5, train_loss: 0.8137, test_loss: 0.9539, test_f1: 0.5116
 epoch: 6, train_loss: 0.7822, test_loss: 0.9126, test_f1: 0.5681
 epoch: 7, train_loss: 0.7594, test_loss: 0.8959, test_f1: 0.5833
 epoch: 8, train_loss: 0.7165, test_loss: 0.8736, test_f1: 0.5794
 epoch: 9, train_loss: 0.7261, test_loss: 0.8809, test_f1: 0.5594
 epoch: 10, train_loss: 0.7086, test_loss: 0.8553, test_f1: 0.6093
 epoch: 11, train_loss: 0.6940, test_loss: 0.8922, test_f1: 0.6034
 epoch: 12, train_loss: 0.6523, test_loss: 0.8271, test_f1: 0.6213
 epoch: 13, train_loss: 0.6566, test_loss: 0.9361, test_f1: 0.6327
 epoch: 14, train_loss: 0.6437, test_loss: 0.7898, test_f1: 0.6382
 epoch: 15, train_loss: 0.6221, test_loss: 0.8991, test_f1: 0.6316
 epoch: 16, train_loss: 0.6226, test_loss: 0.9306, test_f1: 0.5844
 epoch: 17, train_loss: 0.6028, test_loss: 0.8940, test_f1: 0.6121
 epoch: 18, train_loss: 0.5870, test_loss: 0.8615, test_f1: 0.6445
 epoch: 19, train_loss: 0.5656, test_loss: 0.9136, test_f1: 0.6161
 epoch: 20, train_loss: 0.5636, test_loss: 0.8318, test_f1: 0.6600
 epoch: 21, train_loss: 0.5606, test_loss: 0.8657, test_f1: 0.6184
 epoch: 22, train_loss: 0.5420, test_loss: 0.8798, test_f1: 0.6292
 epoch: 23, train_loss: 0.5332, test_loss: 0.8475, test_f1: 0.6389
 epoch: 24, train_loss: 0.5443, test_loss: 0.8567, test_f1: 0.6406
 epoch: 25, train_loss: 0.5285, test_loss: 0.8815, test_f1: 0.6365
 epoch: 26, train_loss: 0.4814, test_loss: 0.9991, test_f1: 0.6338
 epoch: 27, train_loss: 0.4714, test_loss: 0.9472, test_f1: 0.6549
 epoch: 28, train_loss: 0.5072, test_loss: 1.1228, test_f1: 0.6057
 epoch: 29, train_loss: 0.4706, test_loss: 0.9411, test_f1: 0.6241
 epoch: 30, train_loss: 0.4549, test_loss: 0.9650, test_f1: 0.6230
 epoch: 31, train_loss: 0.4553, test_loss: 0.9562, test_f1: 0.6446
 epoch: 32, train_loss: 0.4530, test_loss: 1.1807, test_f1: 0.5887
 epoch: 33, train_loss: 0.4630, test_loss: 0.9653, test_f1: 0.6474
 epoch: 34, train_loss: 0.4471, test_loss: 1.0426, test_f1: 0.6480
 epoch: 35, train_loss: 0.4166, test_loss: 0.9770, test_f1: 0.6688
 epoch: 36, train_loss: 0.4020, test_loss: 1.1528, test_f1: 0.6361
 epoch: 37, train_loss: 0.4024, test_loss: 1.0363, test_f1: 0.6459
 epoch: 38, train_loss: 0.4022, test_loss: 1.0027, test_f1: 0.6504
 epoch: 39, train_loss: 0.3934, test_loss: 1.1514, test_f1: 0.6005
 epoch: 40, train_loss: 0.3832, test_loss: 1.0114, test_f1: 0.6734
 epoch: 41, train_loss: 0.3810, test_loss: 1.2552, test_f1: 0.6095
 epoch: 42, train_loss: 0.3694, test_loss: 1.0690, test_f1: 0.6565
 epoch: 43, train_loss: 0.3489, test_loss: 1.1561, test_f1: 0.6189
 epoch: 44, train_loss: 0.3536, test_loss: 1.0684, test_f1: 0.6738
 epoch: 45, train_loss: 0.3464, test_loss: 1.0814, test_f1: 0.6804
 epoch: 46, train_loss: 0.3437, test_loss: 0.9700, test_f1: 0.6716
 epoch: 47, train_loss: 0.3255, test_loss: 1.1012, test_f1: 0.6788
 epoch: 48, train_loss: 0.3182, test_loss: 1.3797, test_f1: 0.6426
 epoch: 49, train_loss: 0.3117, test_loss: 1.2462, test_f1: 0.6580
 epoch: 50, train_loss: 0.3156, test_loss: 1.1556, test_f1: 0.6678
 epoch: 51, train_loss: 0.2629, test_loss: 1.1725, test_f1: 0.6906
 epoch: 52, train_loss: 0.2327, test_loss: 1.1652, test_f1: 0.6964
 epoch: 53, train_loss: 0.2266, test_loss: 1.2213, test_f1: 0.6783
 epoch: 54, train_loss: 0.2255, test_loss: 1.2286, test_f1: 0.6993
 epoch: 55, train_loss: 0.2255, test_loss: 1.2789, test_f1: 0.6941
 epoch: 56, train_loss: 0.2192, test_loss: 1.2921, test_f1: 0.6749
 epoch: 57, train_loss: 0.2220, test_loss: 1.2940, test_f1: 0.6670
 epoch: 58, train_loss: 0.2038, test_loss: 1.3556, test_f1: 0.6740
 epoch: 59, train_loss: 0.2071, test_loss: 1.2922, test_f1: 0.6950
 epoch: 60, train_loss: 0.1947, test_loss: 1.4510, test_f1: 0.6388
 epoch: 61, train_loss: 0.1961, test_loss: 1.2959, test_f1: 0.6963
 epoch: 62, train_loss: 0.2018, test_loss: 1.3937, test_f1: 0.6785
 epoch: 63, train_loss: 0.1841, test_loss: 1.3740, test_f1: 0.6599
 epoch: 64, train_loss: 0.1874, test_loss: 1.2558, test_f1: 0.6649
 epoch: 65, train_loss: 0.1724, test_loss: 1.4606, test_f1: 0.6853
 epoch: 66, train_loss: 0.1699, test_loss: 1.4063, test_f1: 0.6821
 epoch: 67, train_loss: 0.1737, test_loss: 1.3944, test_f1: 0.6790
 epoch: 68, train_loss: 0.1897, test_loss: 1.4733, test_f1: 0.6575
 epoch: 69, train_loss: 0.2190, test_loss: 1.4762, test_f1: 0.6834
 epoch: 70, train_loss: 0.1788, test_loss: 1.4279, test_f1: 0.6437
 epoch: 71, train_loss: 0.1592, test_loss: 1.4412, test_f1: 0.6734
 epoch: 72, train_loss: 0.1618, test_loss: 1.4474, test_f1: 0.6813
 epoch: 73, train_loss: 0.1694, test_loss: 1.5481, test_f1: 0.6655
 epoch: 74, train_loss: 0.1558, test_loss: 1.6257, test_f1: 0.6691
 epoch: 75, train_loss: 0.1595, test_loss: 1.4732, test_f1: 0.6991
 epoch: 76, train_loss: 0.1689, test_loss: 1.4637, test_f1: 0.6638
 epoch: 77, train_loss: 0.1456, test_loss: 1.7296, test_f1: 0.6356
 epoch: 78, train_loss: 0.1466, test_loss: 1.5704, test_f1: 0.6720
 epoch: 79, train_loss: 0.1518, test_loss: 1.6318, test_f1: 0.6561
 epoch: 80, train_loss: 0.1444, test_loss: 1.5803, test_f1: 0.6538
 epoch: 81, train_loss: 0.1656, test_loss: 1.5991, test_f1: 0.6563
 epoch: 82, train_loss: 0.1600, test_loss: 1.6647, test_f1: 0.6554
 epoch: 83, train_loss: 0.1593, test_loss: 1.7432, test_f1: 0.6421
 epoch: 84, train_loss: 0.1486, test_loss: 1.5820, test_f1: 0.6653
 epoch: 85, train_loss: 0.1535, test_loss: 1.6582, test_f1: 0.6624
 epoch: 86, train_loss: 0.1390, test_loss: 1.5283, test_f1: 0.7046
 epoch: 87, train_loss: 0.1437, test_loss: 1.6998, test_f1: 0.6700
 epoch: 88, train_loss: 0.1324, test_loss: 1.6705, test_f1: 0.6731
 epoch: 89, train_loss: 0.1351, test_loss: 1.8317, test_f1: 0.6568
 epoch: 90, train_loss: 0.1321, test_loss: 1.7567, test_f1: 0.6258
 epoch: 91, train_loss: 0.1344, test_loss: 1.6265, test_f1: 0.6547
 epoch: 92, train_loss: 0.1329, test_loss: 1.6787, test_f1: 0.6599
 epoch: 93, train_loss: 0.1193, test_loss: 1.8150, test_f1: 0.6350
 epoch: 94, train_loss: 0.1153, test_loss: 1.7992, test_f1: 0.6780
 epoch: 95, train_loss: 0.1370, test_loss: 1.6695, test_f1: 0.6717
 epoch: 96, train_loss: 0.1465, test_loss: 1.6311, test_f1: 0.6668
 epoch: 97, train_loss: 0.1293, test_loss: 1.6348, test_f1: 0.6901
 epoch: 98, train_loss: 0.1198, test_loss: 1.6660, test_f1: 0.6642
 epoch: 99, train_loss: 0.1236, test_loss: 1.7041, test_f1: 0.6540
##################ITERATION #4 ****************************************
 epoch: 0, train_loss: 1.2292, test_loss: 1.3052, test_f1: 0.2403
 epoch: 1, train_loss: 0.9907, test_loss: 1.0725, test_f1: 0.3822
 epoch: 2, train_loss: 0.9182, test_loss: 0.9497, test_f1: 0.5951
 epoch: 3, train_loss: 0.8615, test_loss: 0.9856, test_f1: 0.5367
 epoch: 4, train_loss: 0.8425, test_loss: 0.9487, test_f1: 0.5332
 epoch: 5, train_loss: 0.7959, test_loss: 0.9163, test_f1: 0.5839
 epoch: 6, train_loss: 0.7622, test_loss: 0.8542, test_f1: 0.6354
 epoch: 7, train_loss: 0.7591, test_loss: 0.8781, test_f1: 0.6074
 epoch: 8, train_loss: 0.7304, test_loss: 0.9905, test_f1: 0.5209
 epoch: 9, train_loss: 0.7274, test_loss: 0.8290, test_f1: 0.6421
 epoch: 10, train_loss: 0.7057, test_loss: 0.8631, test_f1: 0.5812
 epoch: 11, train_loss: 0.6743, test_loss: 0.8412, test_f1: 0.6333
 epoch: 12, train_loss: 0.6738, test_loss: 0.8459, test_f1: 0.6045
 epoch: 13, train_loss: 0.6451, test_loss: 0.8106, test_f1: 0.6351
 epoch: 14, train_loss: 0.6518, test_loss: 1.0042, test_f1: 0.5822
 epoch: 15, train_loss: 0.6234, test_loss: 0.8725, test_f1: 0.6113
 epoch: 16, train_loss: 0.6009, test_loss: 1.0042, test_f1: 0.6185
 epoch: 17, train_loss: 0.5753, test_loss: 0.8868, test_f1: 0.5928
 epoch: 18, train_loss: 0.6067, test_loss: 1.0231, test_f1: 0.6089
 epoch: 19, train_loss: 0.5981, test_loss: 0.8736, test_f1: 0.6198
 epoch: 20, train_loss: 0.5567, test_loss: 0.9556, test_f1: 0.6121
 epoch: 21, train_loss: 0.5616, test_loss: 0.9268, test_f1: 0.6102
 epoch: 22, train_loss: 0.5291, test_loss: 0.8403, test_f1: 0.6544
 epoch: 23, train_loss: 0.5013, test_loss: 0.9198, test_f1: 0.6574
 epoch: 24, train_loss: 0.5030, test_loss: 0.8698, test_f1: 0.6495
 epoch: 25, train_loss: 0.4854, test_loss: 1.0282, test_f1: 0.6248
 epoch: 26, train_loss: 0.4898, test_loss: 0.9488, test_f1: 0.6379
 epoch: 27, train_loss: 0.4697, test_loss: 0.9578, test_f1: 0.6187
 epoch: 28, train_loss: 0.4596, test_loss: 0.9213, test_f1: 0.6343
 epoch: 29, train_loss: 0.4404, test_loss: 0.9542, test_f1: 0.6342
 epoch: 30, train_loss: 0.4395, test_loss: 0.9583, test_f1: 0.6951
 epoch: 31, train_loss: 0.4166, test_loss: 1.0924, test_f1: 0.6323
 epoch: 32, train_loss: 0.4380, test_loss: 0.9585, test_f1: 0.6416
 epoch: 33, train_loss: 0.4166, test_loss: 0.9480, test_f1: 0.6265
 epoch: 34, train_loss: 0.3914, test_loss: 1.0307, test_f1: 0.6166
 epoch: 35, train_loss: 0.3821, test_loss: 0.9501, test_f1: 0.6628
 epoch: 36, train_loss: 0.3735, test_loss: 1.0174, test_f1: 0.6261
 epoch: 37, train_loss: 0.4119, test_loss: 0.9710, test_f1: 0.6601
 epoch: 38, train_loss: 0.3833, test_loss: 0.9741, test_f1: 0.6827
 epoch: 39, train_loss: 0.3527, test_loss: 1.0245, test_f1: 0.6636
 epoch: 40, train_loss: 0.3479, test_loss: 1.1817, test_f1: 0.6571
 epoch: 41, train_loss: 0.3633, test_loss: 0.9601, test_f1: 0.6745
 epoch: 42, train_loss: 0.3496, test_loss: 1.0796, test_f1: 0.6564
 epoch: 43, train_loss: 0.3214, test_loss: 0.9820, test_f1: 0.6791
 epoch: 44, train_loss: 0.3255, test_loss: 1.0537, test_f1: 0.6693
 epoch: 45, train_loss: 0.3191, test_loss: 1.2176, test_f1: 0.6438
 epoch: 46, train_loss: 0.3179, test_loss: 1.0767, test_f1: 0.6929
 epoch: 47, train_loss: 0.2979, test_loss: 1.0708, test_f1: 0.6723
 epoch: 48, train_loss: 0.3076, test_loss: 1.0694, test_f1: 0.6816
 epoch: 49, train_loss: 0.2776, test_loss: 1.1313, test_f1: 0.6807
 epoch: 50, train_loss: 0.2844, test_loss: 1.1116, test_f1: 0.6972
 epoch: 51, train_loss: 0.2396, test_loss: 1.1351, test_f1: 0.6840
 epoch: 52, train_loss: 0.2303, test_loss: 1.1327, test_f1: 0.6818
 epoch: 53, train_loss: 0.2200, test_loss: 1.2713, test_f1: 0.6694
 epoch: 54, train_loss: 0.2060, test_loss: 1.1603, test_f1: 0.6854
 epoch: 55, train_loss: 0.1925, test_loss: 1.1869, test_f1: 0.6892
 epoch: 56, train_loss: 0.1920, test_loss: 1.2985, test_f1: 0.6567
 epoch: 57, train_loss: 0.1772, test_loss: 1.2089, test_f1: 0.6966
 epoch: 58, train_loss: 0.1893, test_loss: 1.3172, test_f1: 0.6672
 epoch: 59, train_loss: 0.1862, test_loss: 1.3481, test_f1: 0.6682
 epoch: 60, train_loss: 0.1906, test_loss: 1.3544, test_f1: 0.6912
 epoch: 61, train_loss: 0.1765, test_loss: 1.3828, test_f1: 0.6781
 epoch: 62, train_loss: 0.1831, test_loss: 1.3985, test_f1: 0.6671
 epoch: 63, train_loss: 0.1675, test_loss: 1.2676, test_f1: 0.6672
 epoch: 64, train_loss: 0.1782, test_loss: 1.4738, test_f1: 0.6501
 epoch: 65, train_loss: 0.1846, test_loss: 1.3025, test_f1: 0.6674
 epoch: 66, train_loss: 0.1732, test_loss: 1.4288, test_f1: 0.6677
 epoch: 67, train_loss: 0.1663, test_loss: 1.3503, test_f1: 0.6913
 epoch: 68, train_loss: 0.1717, test_loss: 1.4343, test_f1: 0.6803
 epoch: 69, train_loss: 0.1524, test_loss: 1.4112, test_f1: 0.6823
 epoch: 70, train_loss: 0.1499, test_loss: 1.4314, test_f1: 0.6742
 epoch: 71, train_loss: 0.1505, test_loss: 1.4967, test_f1: 0.6469
 epoch: 72, train_loss: 0.1477, test_loss: 1.5597, test_f1: 0.6524
 epoch: 73, train_loss: 0.1529, test_loss: 1.6398, test_f1: 0.6556
 epoch: 74, train_loss: 0.1611, test_loss: 1.5483, test_f1: 0.6893
 epoch: 75, train_loss: 0.1612, test_loss: 1.4365, test_f1: 0.6852
 epoch: 76, train_loss: 0.1498, test_loss: 1.6504, test_f1: 0.6481
 epoch: 77, train_loss: 0.1507, test_loss: 1.6666, test_f1: 0.6571
 epoch: 78, train_loss: 0.1474, test_loss: 1.5262, test_f1: 0.6642
 epoch: 79, train_loss: 0.1460, test_loss: 1.5601, test_f1: 0.6520
 epoch: 80, train_loss: 0.1392, test_loss: 1.5873, test_f1: 0.6678
 epoch: 81, train_loss: 0.1426, test_loss: 1.7092, test_f1: 0.6730
 epoch: 82, train_loss: 0.1432, test_loss: 1.6664, test_f1: 0.6772
 epoch: 83, train_loss: 0.1524, test_loss: 1.5636, test_f1: 0.6934
 epoch: 84, train_loss: 0.1280, test_loss: 1.6839, test_f1: 0.6453
 epoch: 85, train_loss: 0.1262, test_loss: 1.6648, test_f1: 0.6543
 epoch: 86, train_loss: 0.1223, test_loss: 1.7293, test_f1: 0.6688
 epoch: 87, train_loss: 0.1193, test_loss: 1.7292, test_f1: 0.6459
 epoch: 88, train_loss: 0.1238, test_loss: 1.7767, test_f1: 0.6595
 epoch: 89, train_loss: 0.1378, test_loss: 1.7887, test_f1: 0.6263
 epoch: 90, train_loss: 0.1348, test_loss: 1.7565, test_f1: 0.6450
 epoch: 91, train_loss: 0.1430, test_loss: 1.8480, test_f1: 0.6619
 epoch: 92, train_loss: 0.1440, test_loss: 1.7593, test_f1: 0.6740
 epoch: 93, train_loss: 0.1372, test_loss: 1.7369, test_f1: 0.6587
 epoch: 94, train_loss: 0.1397, test_loss: 1.5685, test_f1: 0.6868
 epoch: 95, train_loss: 0.1197, test_loss: 1.8319, test_f1: 0.6774
 epoch: 96, train_loss: 0.1178, test_loss: 1.7785, test_f1: 0.6624
 epoch: 97, train_loss: 0.1095, test_loss: 1.7686, test_f1: 0.6767
 epoch: 98, train_loss: 0.1100, test_loss: 1.7713, test_f1: 0.6578
 epoch: 99, train_loss: 0.0998, test_loss: 1.7169, test_f1: 0.6784
##################ITERATION #5 ****************************************
 epoch: 0, train_loss: 1.3297, test_loss: 1.3234, test_f1: 0.3248
 epoch: 1, train_loss: 0.9776, test_loss: 1.1489, test_f1: 0.4032
 epoch: 2, train_loss: 0.9081, test_loss: 0.9131, test_f1: 0.5167
 epoch: 3, train_loss: 0.8808, test_loss: 0.9249, test_f1: 0.5677
 epoch: 4, train_loss: 0.8485, test_loss: 0.8700, test_f1: 0.5983
 epoch: 5, train_loss: 0.8136, test_loss: 0.8398, test_f1: 0.5807
 epoch: 6, train_loss: 0.7833, test_loss: 0.7972, test_f1: 0.6037
 epoch: 7, train_loss: 0.7410, test_loss: 0.8464, test_f1: 0.6271
 epoch: 8, train_loss: 0.7404, test_loss: 0.8334, test_f1: 0.6139
 epoch: 9, train_loss: 0.7149, test_loss: 0.8955, test_f1: 0.6068
 epoch: 10, train_loss: 0.6808, test_loss: 0.7507, test_f1: 0.6532
 epoch: 11, train_loss: 0.6881, test_loss: 0.8540, test_f1: 0.6141
 epoch: 12, train_loss: 0.6574, test_loss: 0.7394, test_f1: 0.6707
 epoch: 13, train_loss: 0.6272, test_loss: 0.7768, test_f1: 0.6397
 epoch: 14, train_loss: 0.6330, test_loss: 0.8137, test_f1: 0.6629
 epoch: 15, train_loss: 0.6075, test_loss: 0.8175, test_f1: 0.6354
 epoch: 16, train_loss: 0.5894, test_loss: 0.8142, test_f1: 0.6365
 epoch: 17, train_loss: 0.5832, test_loss: 0.8493, test_f1: 0.6375
 epoch: 18, train_loss: 0.5921, test_loss: 0.8567, test_f1: 0.6065
 epoch: 19, train_loss: 0.5608, test_loss: 0.9514, test_f1: 0.5757
 epoch: 20, train_loss: 0.5650, test_loss: 0.8445, test_f1: 0.6302
 epoch: 21, train_loss: 0.5261, test_loss: 0.7518, test_f1: 0.6651
 epoch: 22, train_loss: 0.5348, test_loss: 0.8229, test_f1: 0.6589
 epoch: 23, train_loss: 0.5038, test_loss: 0.7873, test_f1: 0.6799
 epoch: 24, train_loss: 0.5063, test_loss: 1.0880, test_f1: 0.5746
 epoch: 25, train_loss: 0.4939, test_loss: 0.8125, test_f1: 0.6403
 epoch: 26, train_loss: 0.4802, test_loss: 0.8317, test_f1: 0.6487
 epoch: 27, train_loss: 0.4698, test_loss: 0.7834, test_f1: 0.6735
 epoch: 28, train_loss: 0.4587, test_loss: 0.8333, test_f1: 0.6388
 epoch: 29, train_loss: 0.4478, test_loss: 0.8159, test_f1: 0.6537
 epoch: 30, train_loss: 0.4235, test_loss: 0.9420, test_f1: 0.6254
 epoch: 31, train_loss: 0.4559, test_loss: 1.0528, test_f1: 0.6207
 epoch: 32, train_loss: 0.4498, test_loss: 0.7851, test_f1: 0.6786
 epoch: 33, train_loss: 0.4004, test_loss: 0.7275, test_f1: 0.6970
 epoch: 34, train_loss: 0.4164, test_loss: 0.7699, test_f1: 0.6934
 epoch: 35, train_loss: 0.3671, test_loss: 0.8595, test_f1: 0.6825
 epoch: 36, train_loss: 0.3753, test_loss: 0.7887, test_f1: 0.6965
 epoch: 37, train_loss: 0.4016, test_loss: 0.9731, test_f1: 0.6479
 epoch: 38, train_loss: 0.3795, test_loss: 0.9128, test_f1: 0.6581
 epoch: 39, train_loss: 0.3668, test_loss: 0.8675, test_f1: 0.7041
 epoch: 40, train_loss: 0.3679, test_loss: 0.9461, test_f1: 0.6642
 epoch: 41, train_loss: 0.3501, test_loss: 0.8681, test_f1: 0.6793
 epoch: 42, train_loss: 0.3500, test_loss: 0.8128, test_f1: 0.7145
 epoch: 43, train_loss: 0.3069, test_loss: 0.8145, test_f1: 0.7047
 epoch: 44, train_loss: 0.3306, test_loss: 0.9496, test_f1: 0.6807
 epoch: 45, train_loss: 0.3159, test_loss: 0.8547, test_f1: 0.6923
 epoch: 46, train_loss: 0.3008, test_loss: 1.0591, test_f1: 0.6713
 epoch: 47, train_loss: 0.3274, test_loss: 1.0140, test_f1: 0.6752
 epoch: 48, train_loss: 0.3197, test_loss: 0.8620, test_f1: 0.6901
 epoch: 49, train_loss: 0.3042, test_loss: 0.9317, test_f1: 0.6803
 epoch: 50, train_loss: 0.2732, test_loss: 0.9446, test_f1: 0.6935
 epoch: 51, train_loss: 0.2462, test_loss: 1.0624, test_f1: 0.6706
 epoch: 52, train_loss: 0.2364, test_loss: 0.9870, test_f1: 0.7181
 epoch: 53, train_loss: 0.2154, test_loss: 1.0748, test_f1: 0.6897
 epoch: 54, train_loss: 0.2176, test_loss: 1.0623, test_f1: 0.6822
 epoch: 55, train_loss: 0.1979, test_loss: 0.9692, test_f1: 0.7004
 epoch: 56, train_loss: 0.1983, test_loss: 1.1397, test_f1: 0.6855
 epoch: 57, train_loss: 0.2049, test_loss: 1.0799, test_f1: 0.6775
 epoch: 58, train_loss: 0.1930, test_loss: 1.0858, test_f1: 0.6958
 epoch: 59, train_loss: 0.1767, test_loss: 1.1194, test_f1: 0.6832
 epoch: 60, train_loss: 0.1713, test_loss: 1.1176, test_f1: 0.6966
 epoch: 61, train_loss: 0.1858, test_loss: 1.0824, test_f1: 0.7079
 epoch: 62, train_loss: 0.1804, test_loss: 1.1261, test_f1: 0.6665
 epoch: 63, train_loss: 0.1712, test_loss: 1.2269, test_f1: 0.6881
 epoch: 64, train_loss: 0.1789, test_loss: 1.0660, test_f1: 0.7254
 epoch: 65, train_loss: 0.1905, test_loss: 1.2338, test_f1: 0.6599
 epoch: 66, train_loss: 0.1709, test_loss: 1.3749, test_f1: 0.6445
 epoch: 67, train_loss: 0.1582, test_loss: 1.2333, test_f1: 0.6634
 epoch: 68, train_loss: 0.1629, test_loss: 1.1743, test_f1: 0.7143
 epoch: 69, train_loss: 0.1554, test_loss: 1.3004, test_f1: 0.6867
 epoch: 70, train_loss: 0.1707, test_loss: 1.1963, test_f1: 0.7123
 epoch: 71, train_loss: 0.1563, test_loss: 1.1659, test_f1: 0.6969
 epoch: 72, train_loss: 0.1758, test_loss: 1.3039, test_f1: 0.6958
 epoch: 73, train_loss: 0.1540, test_loss: 1.1276, test_f1: 0.7018
 epoch: 74, train_loss: 0.1663, test_loss: 1.2368, test_f1: 0.7068
 epoch: 75, train_loss: 0.1749, test_loss: 1.1040, test_f1: 0.6949
 epoch: 76, train_loss: 0.1719, test_loss: 1.2852, test_f1: 0.6968
 epoch: 77, train_loss: 0.1622, test_loss: 1.2266, test_f1: 0.7147
 epoch: 78, train_loss: 0.1701, test_loss: 1.0958, test_f1: 0.7082
 epoch: 79, train_loss: 0.1433, test_loss: 1.2009, test_f1: 0.6890
 epoch: 80, train_loss: 0.1552, test_loss: 1.2475, test_f1: 0.6887
 epoch: 81, train_loss: 0.1552, test_loss: 1.4196, test_f1: 0.6688
 epoch: 82, train_loss: 0.1491, test_loss: 1.1530, test_f1: 0.7237
 epoch: 83, train_loss: 0.1542, test_loss: 1.3597, test_f1: 0.6968
 epoch: 84, train_loss: 0.1378, test_loss: 1.2799, test_f1: 0.7003
 epoch: 85, train_loss: 0.1311, test_loss: 1.2748, test_f1: 0.6923
 epoch: 86, train_loss: 0.1349, test_loss: 1.3454, test_f1: 0.6745
 epoch: 87, train_loss: 0.1430, test_loss: 1.3826, test_f1: 0.6594
 epoch: 88, train_loss: 0.1249, test_loss: 1.4246, test_f1: 0.6786
 epoch: 89, train_loss: 0.1383, test_loss: 1.2658, test_f1: 0.6946
 epoch: 90, train_loss: 0.1170, test_loss: 1.3452, test_f1: 0.6789
 epoch: 91, train_loss: 0.1229, test_loss: 1.3145, test_f1: 0.7079
 epoch: 92, train_loss: 0.1252, test_loss: 1.3727, test_f1: 0.7046
 epoch: 93, train_loss: 0.1140, test_loss: 1.5382, test_f1: 0.6603
 epoch: 94, train_loss: 0.1220, test_loss: 1.2651, test_f1: 0.7109
 epoch: 95, train_loss: 0.1289, test_loss: 1.5009, test_f1: 0.6825
 epoch: 96, train_loss: 0.1387, test_loss: 1.3887, test_f1: 0.6846
 epoch: 97, train_loss: 0.1282, test_loss: 1.5884, test_f1: 0.6698
 epoch: 98, train_loss: 0.1128, test_loss: 1.4090, test_f1: 0.6909
 epoch: 99, train_loss: 0.1275, test_loss: 1.4652, test_f1: 0.6865
##################ITERATION #6 ****************************************
 epoch: 0, train_loss: 1.3743, test_loss: 1.2593, test_f1: 0.2769
 epoch: 1, train_loss: 1.0209, test_loss: 1.0731, test_f1: 0.3570
 epoch: 2, train_loss: 0.9355, test_loss: 1.0007, test_f1: 0.4843
 epoch: 3, train_loss: 0.8913, test_loss: 0.9182, test_f1: 0.5102
 epoch: 4, train_loss: 0.8521, test_loss: 0.9769, test_f1: 0.4879
 epoch: 5, train_loss: 0.8144, test_loss: 0.9227, test_f1: 0.5706
 epoch: 6, train_loss: 0.7862, test_loss: 0.8516, test_f1: 0.5261
 epoch: 7, train_loss: 0.7689, test_loss: 0.8435, test_f1: 0.5888
 epoch: 8, train_loss: 0.7684, test_loss: 0.8398, test_f1: 0.5881
 epoch: 9, train_loss: 0.7434, test_loss: 0.8061, test_f1: 0.5957
 epoch: 10, train_loss: 0.7128, test_loss: 0.8025, test_f1: 0.6238
 epoch: 11, train_loss: 0.6872, test_loss: 0.9896, test_f1: 0.5707
 epoch: 12, train_loss: 0.6717, test_loss: 0.8120, test_f1: 0.6100
 epoch: 13, train_loss: 0.6438, test_loss: 0.7203, test_f1: 0.6705
 epoch: 14, train_loss: 0.6356, test_loss: 0.8676, test_f1: 0.6152
 epoch: 15, train_loss: 0.6137, test_loss: 0.7673, test_f1: 0.6407
 epoch: 16, train_loss: 0.6107, test_loss: 0.8143, test_f1: 0.6376
 epoch: 17, train_loss: 0.6049, test_loss: 0.7504, test_f1: 0.6531
 epoch: 18, train_loss: 0.5534, test_loss: 0.7785, test_f1: 0.6559
 epoch: 19, train_loss: 0.5472, test_loss: 0.7946, test_f1: 0.6666
 epoch: 20, train_loss: 0.5625, test_loss: 0.8501, test_f1: 0.6288
 epoch: 21, train_loss: 0.5445, test_loss: 0.7986, test_f1: 0.6678
 epoch: 22, train_loss: 0.5173, test_loss: 0.7960, test_f1: 0.6791
 epoch: 23, train_loss: 0.5201, test_loss: 0.8916, test_f1: 0.6188
 epoch: 24, train_loss: 0.5034, test_loss: 0.8188, test_f1: 0.6391
 epoch: 25, train_loss: 0.4949, test_loss: 0.8054, test_f1: 0.6651
 epoch: 26, train_loss: 0.4985, test_loss: 0.8607, test_f1: 0.6551
 epoch: 27, train_loss: 0.4623, test_loss: 0.7878, test_f1: 0.6729
 epoch: 28, train_loss: 0.4540, test_loss: 0.8561, test_f1: 0.6641
 epoch: 29, train_loss: 0.4557, test_loss: 0.8272, test_f1: 0.6611
 epoch: 30, train_loss: 0.4531, test_loss: 0.9446, test_f1: 0.6228
 epoch: 31, train_loss: 0.4191, test_loss: 0.9402, test_f1: 0.6623
 epoch: 32, train_loss: 0.4237, test_loss: 0.9734, test_f1: 0.6263
 epoch: 33, train_loss: 0.4237, test_loss: 0.8604, test_f1: 0.6687
 epoch: 34, train_loss: 0.4095, test_loss: 0.8992, test_f1: 0.6543
 epoch: 35, train_loss: 0.4076, test_loss: 0.8567, test_f1: 0.6816
 epoch: 36, train_loss: 0.3807, test_loss: 0.9665, test_f1: 0.6282
 epoch: 37, train_loss: 0.3859, test_loss: 0.8900, test_f1: 0.6521
 epoch: 38, train_loss: 0.3600, test_loss: 0.9175, test_f1: 0.6540
 epoch: 39, train_loss: 0.3771, test_loss: 1.1647, test_f1: 0.6158
 epoch: 40, train_loss: 0.3696, test_loss: 0.9303, test_f1: 0.6452
 epoch: 41, train_loss: 0.3390, test_loss: 1.0574, test_f1: 0.6389
 epoch: 42, train_loss: 0.3393, test_loss: 1.1267, test_f1: 0.6256
 epoch: 43, train_loss: 0.3184, test_loss: 1.0528, test_f1: 0.6467
 epoch: 44, train_loss: 0.3208, test_loss: 1.1621, test_f1: 0.6114
 epoch: 45, train_loss: 0.2955, test_loss: 1.0739, test_f1: 0.6376
 epoch: 46, train_loss: 0.2920, test_loss: 1.1209, test_f1: 0.6263
 epoch: 47, train_loss: 0.2988, test_loss: 1.1157, test_f1: 0.6702
 epoch: 48, train_loss: 0.2803, test_loss: 1.2675, test_f1: 0.6090
 epoch: 49, train_loss: 0.2985, test_loss: 1.1253, test_f1: 0.6686
 epoch: 50, train_loss: 0.2941, test_loss: 1.0883, test_f1: 0.6700
 epoch: 51, train_loss: 0.2540, test_loss: 1.1125, test_f1: 0.6511
 epoch: 52, train_loss: 0.2263, test_loss: 1.1633, test_f1: 0.6453
 epoch: 53, train_loss: 0.2277, test_loss: 1.2494, test_f1: 0.6621
 epoch: 54, train_loss: 0.2040, test_loss: 1.2130, test_f1: 0.6509
 epoch: 55, train_loss: 0.2004, test_loss: 1.3137, test_f1: 0.6644
 epoch: 56, train_loss: 0.1997, test_loss: 1.2440, test_f1: 0.6773
 epoch: 57, train_loss: 0.1948, test_loss: 1.3163, test_f1: 0.6509
 epoch: 58, train_loss: 0.1784, test_loss: 1.3609, test_f1: 0.6457
 epoch: 59, train_loss: 0.1873, test_loss: 1.3399, test_f1: 0.6289
 epoch: 60, train_loss: 0.1882, test_loss: 1.3517, test_f1: 0.6484
 epoch: 61, train_loss: 0.1872, test_loss: 1.3516, test_f1: 0.6437
 epoch: 62, train_loss: 0.1758, test_loss: 1.3434, test_f1: 0.6433
 epoch: 63, train_loss: 0.1632, test_loss: 1.3847, test_f1: 0.6495
 epoch: 64, train_loss: 0.1636, test_loss: 1.4080, test_f1: 0.6523
 epoch: 65, train_loss: 0.1606, test_loss: 1.3267, test_f1: 0.6593
 epoch: 66, train_loss: 0.1652, test_loss: 1.5059, test_f1: 0.6348
 epoch: 67, train_loss: 0.1563, test_loss: 1.4236, test_f1: 0.6402
 epoch: 68, train_loss: 0.1414, test_loss: 1.3367, test_f1: 0.6576
 epoch: 69, train_loss: 0.1769, test_loss: 1.4273, test_f1: 0.6401
 epoch: 70, train_loss: 0.1739, test_loss: 1.5286, test_f1: 0.6335
 epoch: 71, train_loss: 0.1626, test_loss: 1.6084, test_f1: 0.6472
 epoch: 72, train_loss: 0.1697, test_loss: 1.5175, test_f1: 0.6140
 epoch: 73, train_loss: 0.1531, test_loss: 1.5467, test_f1: 0.6543
 epoch: 74, train_loss: 0.1614, test_loss: 1.5792, test_f1: 0.6327
 epoch: 75, train_loss: 0.1462, test_loss: 1.5172, test_f1: 0.6346
 epoch: 76, train_loss: 0.1392, test_loss: 1.6033, test_f1: 0.6329
 epoch: 77, train_loss: 0.1393, test_loss: 1.4920, test_f1: 0.6493
 epoch: 78, train_loss: 0.1338, test_loss: 1.6443, test_f1: 0.6279
 epoch: 79, train_loss: 0.1398, test_loss: 1.6832, test_f1: 0.6456
 epoch: 80, train_loss: 0.1399, test_loss: 1.4846, test_f1: 0.6484
 epoch: 81, train_loss: 0.1319, test_loss: 1.7734, test_f1: 0.6133
 epoch: 82, train_loss: 0.1415, test_loss: 1.4770, test_f1: 0.6630
 epoch: 83, train_loss: 0.1387, test_loss: 1.7736, test_f1: 0.6212
 epoch: 84, train_loss: 0.1373, test_loss: 1.8098, test_f1: 0.6213
 epoch: 85, train_loss: 0.1374, test_loss: 1.7013, test_f1: 0.6041
 epoch: 86, train_loss: 0.1362, test_loss: 1.6413, test_f1: 0.6591
 epoch: 87, train_loss: 0.1294, test_loss: 1.6570, test_f1: 0.6320
 epoch: 88, train_loss: 0.1092, test_loss: 1.6169, test_f1: 0.6460
 epoch: 89, train_loss: 0.1143, test_loss: 1.7841, test_f1: 0.6556
 epoch: 90, train_loss: 0.1301, test_loss: 1.7675, test_f1: 0.6503
 epoch: 91, train_loss: 0.1265, test_loss: 1.6568, test_f1: 0.6429
 epoch: 92, train_loss: 0.1160, test_loss: 1.7593, test_f1: 0.6305
 epoch: 93, train_loss: 0.1046, test_loss: 1.6453, test_f1: 0.6525
 epoch: 94, train_loss: 0.1040, test_loss: 1.9622, test_f1: 0.6116
 epoch: 95, train_loss: 0.1434, test_loss: 1.7950, test_f1: 0.6348
 epoch: 96, train_loss: 0.1394, test_loss: 1.6377, test_f1: 0.6320
 epoch: 97, train_loss: 0.1129, test_loss: 1.7219, test_f1: 0.6396
 epoch: 98, train_loss: 0.1126, test_loss: 1.5775, test_f1: 0.6565
 epoch: 99, train_loss: 0.1110, test_loss: 1.7019, test_f1: 0.6467
##################ITERATION #7 ****************************************
 epoch: 0, train_loss: 1.4407, test_loss: 1.5492, test_f1: 0.2246
 epoch: 1, train_loss: 0.9969, test_loss: 1.1477, test_f1: 0.4041
 epoch: 2, train_loss: 0.9246, test_loss: 1.0002, test_f1: 0.5461
 epoch: 3, train_loss: 0.8825, test_loss: 0.9619, test_f1: 0.5612
 epoch: 4, train_loss: 0.8467, test_loss: 0.9484, test_f1: 0.5609
 epoch: 5, train_loss: 0.8191, test_loss: 1.0153, test_f1: 0.5261
 epoch: 6, train_loss: 0.7897, test_loss: 0.9446, test_f1: 0.5766
 epoch: 7, train_loss: 0.7634, test_loss: 0.9397, test_f1: 0.5916
 epoch: 8, train_loss: 0.7538, test_loss: 0.9279, test_f1: 0.6018
 epoch: 9, train_loss: 0.7262, test_loss: 0.9619, test_f1: 0.5649
 epoch: 10, train_loss: 0.7056, test_loss: 0.9117, test_f1: 0.6318
 epoch: 11, train_loss: 0.6965, test_loss: 1.0616, test_f1: 0.5961
 epoch: 12, train_loss: 0.6968, test_loss: 0.8320, test_f1: 0.6579
 epoch: 13, train_loss: 0.6499, test_loss: 0.8192, test_f1: 0.5987
 epoch: 14, train_loss: 0.6340, test_loss: 1.2733, test_f1: 0.5662
 epoch: 15, train_loss: 0.6278, test_loss: 0.9791, test_f1: 0.6046
 epoch: 16, train_loss: 0.6213, test_loss: 0.9628, test_f1: 0.6330
 epoch: 17, train_loss: 0.5927, test_loss: 0.8066, test_f1: 0.6426
 epoch: 18, train_loss: 0.5883, test_loss: 0.8703, test_f1: 0.6497
 epoch: 19, train_loss: 0.5686, test_loss: 0.8512, test_f1: 0.6567
 epoch: 20, train_loss: 0.5463, test_loss: 0.9132, test_f1: 0.6473
 epoch: 21, train_loss: 0.5696, test_loss: 1.1985, test_f1: 0.5782
 epoch: 22, train_loss: 0.5335, test_loss: 0.9772, test_f1: 0.6143
 epoch: 23, train_loss: 0.5188, test_loss: 0.9722, test_f1: 0.6319
 epoch: 24, train_loss: 0.4823, test_loss: 0.8471, test_f1: 0.6567
 epoch: 25, train_loss: 0.5037, test_loss: 0.9404, test_f1: 0.6096
 epoch: 26, train_loss: 0.5195, test_loss: 0.9801, test_f1: 0.6414
 epoch: 27, train_loss: 0.4915, test_loss: 0.7963, test_f1: 0.6559
 epoch: 28, train_loss: 0.4675, test_loss: 0.8125, test_f1: 0.6405
 epoch: 29, train_loss: 0.4437, test_loss: 1.1622, test_f1: 0.6149
 epoch: 30, train_loss: 0.4603, test_loss: 1.0958, test_f1: 0.6271
 epoch: 31, train_loss: 0.4745, test_loss: 0.9734, test_f1: 0.6418
 epoch: 32, train_loss: 0.4441, test_loss: 0.8663, test_f1: 0.6645
 epoch: 33, train_loss: 0.4573, test_loss: 0.9671, test_f1: 0.6561
 epoch: 34, train_loss: 0.4346, test_loss: 1.0799, test_f1: 0.6584
 epoch: 35, train_loss: 0.4208, test_loss: 1.0244, test_f1: 0.6236
 epoch: 36, train_loss: 0.4061, test_loss: 1.0983, test_f1: 0.6518
 epoch: 37, train_loss: 0.3958, test_loss: 1.0412, test_f1: 0.6509
 epoch: 38, train_loss: 0.3932, test_loss: 1.0167, test_f1: 0.6136
 epoch: 39, train_loss: 0.3775, test_loss: 1.0170, test_f1: 0.6146
 epoch: 40, train_loss: 0.3933, test_loss: 1.1214, test_f1: 0.6498
 epoch: 41, train_loss: 0.3901, test_loss: 1.1830, test_f1: 0.6116
 epoch: 42, train_loss: 0.3463, test_loss: 1.1283, test_f1: 0.6299
 epoch: 43, train_loss: 0.3538, test_loss: 1.0445, test_f1: 0.6319
 epoch: 44, train_loss: 0.3644, test_loss: 0.9857, test_f1: 0.6920
 epoch: 45, train_loss: 0.3267, test_loss: 1.0821, test_f1: 0.6454
 epoch: 46, train_loss: 0.3326, test_loss: 1.3951, test_f1: 0.6005
 epoch: 47, train_loss: 0.3296, test_loss: 1.1198, test_f1: 0.6365
 epoch: 48, train_loss: 0.3345, test_loss: 1.1274, test_f1: 0.6743
 epoch: 49, train_loss: 0.3044, test_loss: 1.2216, test_f1: 0.6276
 epoch: 50, train_loss: 0.3022, test_loss: 1.2133, test_f1: 0.6513
 epoch: 51, train_loss: 0.2737, test_loss: 1.1261, test_f1: 0.6310
 epoch: 52, train_loss: 0.2496, test_loss: 1.2537, test_f1: 0.6331
 epoch: 53, train_loss: 0.2290, test_loss: 1.1277, test_f1: 0.6662
 epoch: 54, train_loss: 0.2295, test_loss: 1.2440, test_f1: 0.6575
 epoch: 55, train_loss: 0.2228, test_loss: 1.3206, test_f1: 0.6674
 epoch: 56, train_loss: 0.2184, test_loss: 1.1978, test_f1: 0.6655
 epoch: 57, train_loss: 0.2138, test_loss: 1.3626, test_f1: 0.6656
 epoch: 58, train_loss: 0.2101, test_loss: 1.3564, test_f1: 0.6721
 epoch: 59, train_loss: 0.2080, test_loss: 1.3918, test_f1: 0.6660
 epoch: 60, train_loss: 0.2209, test_loss: 1.3553, test_f1: 0.6586
 epoch: 61, train_loss: 0.1948, test_loss: 1.3691, test_f1: 0.6414
 epoch: 62, train_loss: 0.2107, test_loss: 1.2526, test_f1: 0.6540
 epoch: 63, train_loss: 0.2158, test_loss: 1.3091, test_f1: 0.6703
 epoch: 64, train_loss: 0.1997, test_loss: 1.2891, test_f1: 0.6584
 epoch: 65, train_loss: 0.2010, test_loss: 1.5267, test_f1: 0.6549
 epoch: 66, train_loss: 0.1838, test_loss: 1.3608, test_f1: 0.6695
 epoch: 67, train_loss: 0.1766, test_loss: 1.3831, test_f1: 0.6511
 epoch: 68, train_loss: 0.1773, test_loss: 1.5094, test_f1: 0.6529
 epoch: 69, train_loss: 0.1806, test_loss: 1.4898, test_f1: 0.6401
 epoch: 70, train_loss: 0.1675, test_loss: 1.3518, test_f1: 0.6799
 epoch: 71, train_loss: 0.1739, test_loss: 1.5077, test_f1: 0.6429
 epoch: 72, train_loss: 0.1598, test_loss: 1.3937, test_f1: 0.6554
 epoch: 73, train_loss: 0.1714, test_loss: 1.6552, test_f1: 0.6672
 epoch: 74, train_loss: 0.1692, test_loss: 1.4604, test_f1: 0.6486
 epoch: 75, train_loss: 0.1707, test_loss: 1.4916, test_f1: 0.6559
 epoch: 76, train_loss: 0.1943, test_loss: 1.7216, test_f1: 0.6462
 epoch: 77, train_loss: 0.1689, test_loss: 1.5499, test_f1: 0.6418
 epoch: 78, train_loss: 0.1513, test_loss: 1.5248, test_f1: 0.6602
 epoch: 79, train_loss: 0.1556, test_loss: 1.6083, test_f1: 0.6737
 epoch: 80, train_loss: 0.1485, test_loss: 1.6593, test_f1: 0.6377
 epoch: 81, train_loss: 0.1543, test_loss: 1.4352, test_f1: 0.6753
 epoch: 82, train_loss: 0.1533, test_loss: 1.5501, test_f1: 0.6352
 epoch: 83, train_loss: 0.1678, test_loss: 1.6187, test_f1: 0.6224
 epoch: 84, train_loss: 0.1491, test_loss: 1.7217, test_f1: 0.6156
 epoch: 85, train_loss: 0.1616, test_loss: 1.7174, test_f1: 0.6428
 epoch: 86, train_loss: 0.1499, test_loss: 1.5491, test_f1: 0.6399
 epoch: 87, train_loss: 0.1468, test_loss: 1.7079, test_f1: 0.6312
 epoch: 88, train_loss: 0.1464, test_loss: 1.6147, test_f1: 0.6494
 epoch: 89, train_loss: 0.1554, test_loss: 1.6036, test_f1: 0.6381
 epoch: 90, train_loss: 0.1417, test_loss: 1.5936, test_f1: 0.6733
 epoch: 91, train_loss: 0.1472, test_loss: 1.9511, test_f1: 0.6315
 epoch: 92, train_loss: 0.1431, test_loss: 1.4631, test_f1: 0.6542
 epoch: 93, train_loss: 0.1450, test_loss: 1.6943, test_f1: 0.6915
 epoch: 94, train_loss: 0.1450, test_loss: 1.6501, test_f1: 0.6559
 epoch: 95, train_loss: 0.1546, test_loss: 1.9576, test_f1: 0.6322
 epoch: 96, train_loss: 0.1293, test_loss: 1.6064, test_f1: 0.6573
 epoch: 97, train_loss: 0.1278, test_loss: 1.9334, test_f1: 0.6031
 epoch: 98, train_loss: 0.1262, test_loss: 1.8921, test_f1: 0.6421
 epoch: 99, train_loss: 0.1221, test_loss: 1.7939, test_f1: 0.6641
##################ITERATION #8 ****************************************
 epoch: 0, train_loss: 1.3785, test_loss: 1.2984, test_f1: 0.2599
 epoch: 1, train_loss: 0.9864, test_loss: 0.9822, test_f1: 0.4700
 epoch: 2, train_loss: 0.9227, test_loss: 0.8961, test_f1: 0.5534
 epoch: 3, train_loss: 0.8811, test_loss: 0.9075, test_f1: 0.5773
 epoch: 4, train_loss: 0.8551, test_loss: 0.8528, test_f1: 0.6031
 epoch: 5, train_loss: 0.8126, test_loss: 0.8885, test_f1: 0.5822
 epoch: 6, train_loss: 0.7961, test_loss: 0.9126, test_f1: 0.5581
 epoch: 7, train_loss: 0.7640, test_loss: 0.8831, test_f1: 0.5909
 epoch: 8, train_loss: 0.7402, test_loss: 0.8458, test_f1: 0.5900
 epoch: 9, train_loss: 0.7404, test_loss: 0.8326, test_f1: 0.6149
 epoch: 10, train_loss: 0.7127, test_loss: 0.8421, test_f1: 0.6023
 epoch: 11, train_loss: 0.6847, test_loss: 0.8749, test_f1: 0.6124
 epoch: 12, train_loss: 0.6819, test_loss: 0.8724, test_f1: 0.6291
 epoch: 13, train_loss: 0.6504, test_loss: 0.7784, test_f1: 0.6686
 epoch: 14, train_loss: 0.6524, test_loss: 0.7982, test_f1: 0.6119
 epoch: 15, train_loss: 0.6373, test_loss: 0.8307, test_f1: 0.6281
 epoch: 16, train_loss: 0.6280, test_loss: 0.7861, test_f1: 0.6322
 epoch: 17, train_loss: 0.5938, test_loss: 0.8225, test_f1: 0.6373
 epoch: 18, train_loss: 0.6049, test_loss: 0.7781, test_f1: 0.6359
 epoch: 19, train_loss: 0.5994, test_loss: 0.8227, test_f1: 0.6389
 epoch: 20, train_loss: 0.5636, test_loss: 0.8357, test_f1: 0.6429
 epoch: 21, train_loss: 0.5747, test_loss: 0.8215, test_f1: 0.6559
 epoch: 22, train_loss: 0.5675, test_loss: 0.9013, test_f1: 0.6481
 epoch: 23, train_loss: 0.5513, test_loss: 0.8017, test_f1: 0.6542
 epoch: 24, train_loss: 0.5351, test_loss: 1.0136, test_f1: 0.6104
 epoch: 25, train_loss: 0.5205, test_loss: 0.8872, test_f1: 0.6312
 epoch: 26, train_loss: 0.4879, test_loss: 0.9393, test_f1: 0.6414
 epoch: 27, train_loss: 0.4858, test_loss: 0.8942, test_f1: 0.6574
 epoch: 28, train_loss: 0.4999, test_loss: 0.9248, test_f1: 0.6658
 epoch: 29, train_loss: 0.4654, test_loss: 0.8694, test_f1: 0.6620
 epoch: 30, train_loss: 0.4665, test_loss: 0.8528, test_f1: 0.6650
 epoch: 31, train_loss: 0.4571, test_loss: 0.9449, test_f1: 0.6649
 epoch: 32, train_loss: 0.4272, test_loss: 0.9439, test_f1: 0.6636
 epoch: 33, train_loss: 0.4399, test_loss: 0.8944, test_f1: 0.6681
 epoch: 34, train_loss: 0.4496, test_loss: 0.8678, test_f1: 0.6849
 epoch: 35, train_loss: 0.4107, test_loss: 0.9501, test_f1: 0.6542
 epoch: 36, train_loss: 0.4043, test_loss: 1.2220, test_f1: 0.5802
 epoch: 37, train_loss: 0.4440, test_loss: 0.9506, test_f1: 0.6266
 epoch: 38, train_loss: 0.4017, test_loss: 0.9810, test_f1: 0.6738
 epoch: 39, train_loss: 0.3773, test_loss: 1.2221, test_f1: 0.5875
 epoch: 40, train_loss: 0.3837, test_loss: 0.9917, test_f1: 0.6830
 epoch: 41, train_loss: 0.3714, test_loss: 0.9699, test_f1: 0.6630
 epoch: 42, train_loss: 0.3843, test_loss: 1.0315, test_f1: 0.6534
 epoch: 43, train_loss: 0.3774, test_loss: 0.9652, test_f1: 0.6793
 epoch: 44, train_loss: 0.3606, test_loss: 1.0204, test_f1: 0.6673
 epoch: 45, train_loss: 0.3501, test_loss: 1.1405, test_f1: 0.6338
 epoch: 46, train_loss: 0.3551, test_loss: 1.1502, test_f1: 0.6477
 epoch: 47, train_loss: 0.3516, test_loss: 1.0394, test_f1: 0.6598
 epoch: 48, train_loss: 0.3281, test_loss: 1.1576, test_f1: 0.6359
 epoch: 49, train_loss: 0.3386, test_loss: 1.0252, test_f1: 0.6639
 epoch: 50, train_loss: 0.3194, test_loss: 1.1226, test_f1: 0.6630
 epoch: 51, train_loss: 0.2785, test_loss: 1.2474, test_f1: 0.6634
 epoch: 52, train_loss: 0.2621, test_loss: 1.1480, test_f1: 0.6431
 epoch: 53, train_loss: 0.2430, test_loss: 1.2464, test_f1: 0.6363
 epoch: 54, train_loss: 0.2390, test_loss: 1.2078, test_f1: 0.6517
 epoch: 55, train_loss: 0.2385, test_loss: 1.3007, test_f1: 0.6637
 epoch: 56, train_loss: 0.2200, test_loss: 1.2068, test_f1: 0.6591
 epoch: 57, train_loss: 0.2288, test_loss: 1.2575, test_f1: 0.6535
 epoch: 58, train_loss: 0.2201, test_loss: 1.2649, test_f1: 0.6634
 epoch: 59, train_loss: 0.2241, test_loss: 1.3302, test_f1: 0.6454
 epoch: 60, train_loss: 0.2229, test_loss: 1.3300, test_f1: 0.6562
 epoch: 61, train_loss: 0.2195, test_loss: 1.3221, test_f1: 0.6650
 epoch: 62, train_loss: 0.2109, test_loss: 1.4139, test_f1: 0.6465
 epoch: 63, train_loss: 0.1986, test_loss: 1.3168, test_f1: 0.6521
 epoch: 64, train_loss: 0.2048, test_loss: 1.4602, test_f1: 0.6431
 epoch: 65, train_loss: 0.1897, test_loss: 1.4014, test_f1: 0.6377
 epoch: 66, train_loss: 0.1848, test_loss: 1.4076, test_f1: 0.6667
 epoch: 67, train_loss: 0.1963, test_loss: 1.3306, test_f1: 0.6629
 epoch: 68, train_loss: 0.1985, test_loss: 1.5226, test_f1: 0.6442
 epoch: 69, train_loss: 0.1965, test_loss: 1.3271, test_f1: 0.6523
 epoch: 70, train_loss: 0.1746, test_loss: 1.3867, test_f1: 0.6528
 epoch: 71, train_loss: 0.1948, test_loss: 1.6097, test_f1: 0.6234
 epoch: 72, train_loss: 0.1904, test_loss: 1.4235, test_f1: 0.6373
 epoch: 73, train_loss: 0.1818, test_loss: 1.4429, test_f1: 0.6472
 epoch: 74, train_loss: 0.1701, test_loss: 1.4184, test_f1: 0.6631
 epoch: 75, train_loss: 0.1599, test_loss: 1.4959, test_f1: 0.6619
 epoch: 76, train_loss: 0.1686, test_loss: 1.5234, test_f1: 0.6428
 epoch: 77, train_loss: 0.1592, test_loss: 1.5415, test_f1: 0.6710
 epoch: 78, train_loss: 0.1649, test_loss: 1.4265, test_f1: 0.6699
 epoch: 79, train_loss: 0.1566, test_loss: 1.6166, test_f1: 0.6264
 epoch: 80, train_loss: 0.1515, test_loss: 1.5482, test_f1: 0.6589
 epoch: 81, train_loss: 0.1773, test_loss: 1.5850, test_f1: 0.6525
 epoch: 82, train_loss: 0.1808, test_loss: 1.5068, test_f1: 0.6650
 epoch: 83, train_loss: 0.1583, test_loss: 1.4340, test_f1: 0.6514
 epoch: 84, train_loss: 0.1593, test_loss: 1.6608, test_f1: 0.6290
 epoch: 85, train_loss: 0.1551, test_loss: 1.6312, test_f1: 0.6425
 epoch: 86, train_loss: 0.1496, test_loss: 1.7562, test_f1: 0.6369
 epoch: 87, train_loss: 0.1438, test_loss: 1.6169, test_f1: 0.6577
 epoch: 88, train_loss: 0.1540, test_loss: 1.5441, test_f1: 0.6614
 epoch: 89, train_loss: 0.1461, test_loss: 1.8564, test_f1: 0.6443
 epoch: 90, train_loss: 0.1468, test_loss: 1.5441, test_f1: 0.6480
 epoch: 91, train_loss: 0.1423, test_loss: 1.8387, test_f1: 0.6237
 epoch: 92, train_loss: 0.1538, test_loss: 1.5027, test_f1: 0.6756
 epoch: 93, train_loss: 0.1521, test_loss: 1.7933, test_f1: 0.6400
 epoch: 94, train_loss: 0.1422, test_loss: 1.7325, test_f1: 0.6579
 epoch: 95, train_loss: 0.1447, test_loss: 1.7128, test_f1: 0.6371
 epoch: 96, train_loss: 0.1339, test_loss: 1.5634, test_f1: 0.6458
 epoch: 97, train_loss: 0.1401, test_loss: 1.9618, test_f1: 0.6175
 epoch: 98, train_loss: 0.1263, test_loss: 1.6213, test_f1: 0.6216
 epoch: 99, train_loss: 0.1317, test_loss: 1.8592, test_f1: 0.6267
##################ITERATION #9 ****************************************
 epoch: 0, train_loss: 1.5692, test_loss: 1.3036, test_f1: 0.2448
 epoch: 1, train_loss: 1.0188, test_loss: 1.0646, test_f1: 0.3997
 epoch: 2, train_loss: 0.9628, test_loss: 0.9918, test_f1: 0.5209
 epoch: 3, train_loss: 0.9183, test_loss: 0.9679, test_f1: 0.5494
 epoch: 4, train_loss: 0.8824, test_loss: 0.9341, test_f1: 0.5727
 epoch: 5, train_loss: 0.8326, test_loss: 0.9094, test_f1: 0.5575
 epoch: 6, train_loss: 0.8438, test_loss: 0.8794, test_f1: 0.5749
 epoch: 7, train_loss: 0.8073, test_loss: 0.9573, test_f1: 0.5266
 epoch: 8, train_loss: 0.7832, test_loss: 1.0195, test_f1: 0.5163
 epoch: 9, train_loss: 0.7682, test_loss: 0.9000, test_f1: 0.5730
 epoch: 10, train_loss: 0.7417, test_loss: 0.8171, test_f1: 0.6040
 epoch: 11, train_loss: 0.7404, test_loss: 0.8196, test_f1: 0.6066
 epoch: 12, train_loss: 0.7019, test_loss: 0.8673, test_f1: 0.5782
 epoch: 13, train_loss: 0.6792, test_loss: 0.8631, test_f1: 0.6404
 epoch: 14, train_loss: 0.7019, test_loss: 0.8303, test_f1: 0.6457
 epoch: 15, train_loss: 0.6741, test_loss: 0.9913, test_f1: 0.5534
 epoch: 16, train_loss: 0.6450, test_loss: 0.8367, test_f1: 0.6318
 epoch: 17, train_loss: 0.6346, test_loss: 0.8436, test_f1: 0.6158
 epoch: 18, train_loss: 0.6105, test_loss: 0.8142, test_f1: 0.6338
 epoch: 19, train_loss: 0.5964, test_loss: 0.8484, test_f1: 0.5925
 epoch: 20, train_loss: 0.5987, test_loss: 0.9001, test_f1: 0.5814
 epoch: 21, train_loss: 0.6231, test_loss: 0.7636, test_f1: 0.6627
 epoch: 22, train_loss: 0.5761, test_loss: 0.8615, test_f1: 0.6403
 epoch: 23, train_loss: 0.5794, test_loss: 0.8077, test_f1: 0.6446
 epoch: 24, train_loss: 0.5630, test_loss: 0.8468, test_f1: 0.6471
 epoch: 25, train_loss: 0.5471, test_loss: 0.7601, test_f1: 0.6603
 epoch: 26, train_loss: 0.5339, test_loss: 0.8682, test_f1: 0.6153
 epoch: 27, train_loss: 0.5301, test_loss: 0.8649, test_f1: 0.6410
 epoch: 28, train_loss: 0.5242, test_loss: 0.7949, test_f1: 0.6739
 epoch: 29, train_loss: 0.4930, test_loss: 0.9130, test_f1: 0.6043
 epoch: 30, train_loss: 0.5203, test_loss: 0.8248, test_f1: 0.6563
 epoch: 31, train_loss: 0.5065, test_loss: 0.9409, test_f1: 0.6304
 epoch: 32, train_loss: 0.5215, test_loss: 0.9216, test_f1: 0.6354
 epoch: 33, train_loss: 0.4817, test_loss: 0.8807, test_f1: 0.6444
 epoch: 34, train_loss: 0.4557, test_loss: 0.9328, test_f1: 0.6264
 epoch: 35, train_loss: 0.4484, test_loss: 0.7985, test_f1: 0.6629
 epoch: 36, train_loss: 0.4412, test_loss: 0.8907, test_f1: 0.6585
 epoch: 37, train_loss: 0.4304, test_loss: 0.8104, test_f1: 0.6903
 epoch: 38, train_loss: 0.4581, test_loss: 0.8395, test_f1: 0.6571
 epoch: 39, train_loss: 0.4293, test_loss: 0.9118, test_f1: 0.6708
 epoch: 40, train_loss: 0.4120, test_loss: 0.8746, test_f1: 0.6887
 epoch: 41, train_loss: 0.4048, test_loss: 1.0153, test_f1: 0.6590
 epoch: 42, train_loss: 0.4079, test_loss: 0.8352, test_f1: 0.6956
 epoch: 43, train_loss: 0.3870, test_loss: 0.7733, test_f1: 0.7038
 epoch: 44, train_loss: 0.3918, test_loss: 0.9648, test_f1: 0.6809
 epoch: 45, train_loss: 0.3635, test_loss: 1.1694, test_f1: 0.6326
 epoch: 46, train_loss: 0.3584, test_loss: 0.8257, test_f1: 0.7034
 epoch: 47, train_loss: 0.3783, test_loss: 0.9482, test_f1: 0.6852
 epoch: 48, train_loss: 0.3746, test_loss: 0.8690, test_f1: 0.6967
 epoch: 49, train_loss: 0.3422, test_loss: 0.8783, test_f1: 0.6733
 epoch: 50, train_loss: 0.3530, test_loss: 0.9160, test_f1: 0.6598
 epoch: 51, train_loss: 0.3183, test_loss: 0.8665, test_f1: 0.6847
 epoch: 52, train_loss: 0.2782, test_loss: 1.0360, test_f1: 0.6746
 epoch: 53, train_loss: 0.2699, test_loss: 0.9182, test_f1: 0.6986
 epoch: 54, train_loss: 0.2624, test_loss: 1.0244, test_f1: 0.6757
 epoch: 55, train_loss: 0.2456, test_loss: 1.0196, test_f1: 0.7068
 epoch: 56, train_loss: 0.2652, test_loss: 1.1428, test_f1: 0.6893
 epoch: 57, train_loss: 0.2727, test_loss: 1.0937, test_f1: 0.6765
 epoch: 58, train_loss: 0.2597, test_loss: 0.9290, test_f1: 0.6996
 epoch: 59, train_loss: 0.2369, test_loss: 1.0374, test_f1: 0.6961
 epoch: 60, train_loss: 0.2402, test_loss: 1.1372, test_f1: 0.6840
 epoch: 61, train_loss: 0.2366, test_loss: 1.0648, test_f1: 0.7114
 epoch: 62, train_loss: 0.2441, test_loss: 1.0732, test_f1: 0.6830
 epoch: 63, train_loss: 0.2315, test_loss: 1.0860, test_f1: 0.6906
 epoch: 64, train_loss: 0.2268, test_loss: 0.9920, test_f1: 0.6831
 epoch: 65, train_loss: 0.2261, test_loss: 1.1052, test_f1: 0.6857
 epoch: 66, train_loss: 0.2377, test_loss: 1.1166, test_f1: 0.6851
 epoch: 67, train_loss: 0.2214, test_loss: 1.0713, test_f1: 0.6904
 epoch: 68, train_loss: 0.2220, test_loss: 1.1074, test_f1: 0.6982
 epoch: 69, train_loss: 0.2075, test_loss: 1.2491, test_f1: 0.6809
 epoch: 70, train_loss: 0.2025, test_loss: 1.2235, test_f1: 0.6950
 epoch: 71, train_loss: 0.2190, test_loss: 1.3808, test_f1: 0.6706
 epoch: 72, train_loss: 0.2194, test_loss: 1.2274, test_f1: 0.6634
 epoch: 73, train_loss: 0.2065, test_loss: 1.1077, test_f1: 0.6975
 epoch: 74, train_loss: 0.1952, test_loss: 1.3205, test_f1: 0.6745
 epoch: 75, train_loss: 0.2023, test_loss: 1.2387, test_f1: 0.7101
 epoch: 76, train_loss: 0.2044, test_loss: 1.1367, test_f1: 0.6781
 epoch: 77, train_loss: 0.1890, test_loss: 1.2408, test_f1: 0.6946
 epoch: 78, train_loss: 0.1955, test_loss: 1.1561, test_f1: 0.7069
 epoch: 79, train_loss: 0.1799, test_loss: 1.2016, test_f1: 0.6988
 epoch: 80, train_loss: 0.1926, test_loss: 1.3218, test_f1: 0.6789
 epoch: 81, train_loss: 0.2078, test_loss: 1.2124, test_f1: 0.6800
 epoch: 82, train_loss: 0.1797, test_loss: 1.2276, test_f1: 0.6860
 epoch: 83, train_loss: 0.1794, test_loss: 1.2740, test_f1: 0.6938
 epoch: 84, train_loss: 0.1980, test_loss: 1.2426, test_f1: 0.6767
 epoch: 85, train_loss: 0.1757, test_loss: 1.3999, test_f1: 0.6742
 epoch: 86, train_loss: 0.1891, test_loss: 1.3175, test_f1: 0.6930
 epoch: 87, train_loss: 0.1772, test_loss: 1.2637, test_f1: 0.6768
 epoch: 88, train_loss: 0.1693, test_loss: 1.4275, test_f1: 0.6911
 epoch: 89, train_loss: 0.1741, test_loss: 1.2494, test_f1: 0.7098
 epoch: 90, train_loss: 0.1747, test_loss: 1.2393, test_f1: 0.7021
 epoch: 91, train_loss: 0.1735, test_loss: 1.4346, test_f1: 0.6849
 epoch: 92, train_loss: 0.1532, test_loss: 1.3813, test_f1: 0.6696
 epoch: 93, train_loss: 0.1599, test_loss: 1.3152, test_f1: 0.6818
 epoch: 94, train_loss: 0.1451, test_loss: 1.4260, test_f1: 0.6852
 epoch: 95, train_loss: 0.1757, test_loss: 1.3252, test_f1: 0.7171
 epoch: 96, train_loss: 0.1675, test_loss: 1.5352, test_f1: 0.6425
 epoch: 97, train_loss: 0.1765, test_loss: 1.4881, test_f1: 0.6639
 epoch: 98, train_loss: 0.1559, test_loss: 1.6491, test_f1: 0.6410
 epoch: 99, train_loss: 0.1450, test_loss: 1.6020, test_f1: 0.6759

Training completed in 513.71 seconds
Best F1: 0.7254 at epoch 64
Mean F1 across iterations: 0.6993  0.0128
========================FINAL RESULTS================================
FEGIN weighted F1: 0.7254  0.0128
python main.py --data ltspice_examples --representation component_pin --model FEGIN --layers 3 --hiddens 128 --batch_size 128 --lr 0.001 --emb_size 250 --epochs 100 --save_appendix component_pin_L3_H128_BS128_LR0.001_E250 --no_val
-----



STDERR:
  File "main.py", line 370, in <module>
    main()
  File "main.py", line 254, in main
    dataset = dataset_class(
  File "/home/philip/projects/ltspice_examples_code_repo/Circuit-Completion-Using-GNNs/component_classification_with_link_prediction_head/evaluation/FEGIN/kernel/circuit_datasets.py", line 15, in __init__
    self.data, self.slices = torch.load(self.processed_paths[0])
  File "/home/philip/.local/lib/python3.8/site-packages/torch/serialization.py", line 1040, in load
    warnings.warn(
  File "/usr/lib/python3.8/warnings.py", line 109, in _showwarnmsg
    sw(msg.message, msg.category, msg.filename, msg.lineno,
  File "main.py", line 47, in warn_with_traceback
    traceback.print_stack(file=log)
/home/philip/projects/ltspice_examples_code_repo/Circuit-Completion-Using-GNNs/component_classification_with_link_prediction_head/evaluation/FEGIN/kernel/circuit_datasets.py:15: FutureWarning: You are using `torch.load` with `weights_only=False` (the current default value), which uses the default pickle module implicitly. It is possible to construct malicious pickle data which will execute arbitrary code during unpickling (See https://github.com/pytorch/pytorch/blob/main/SECURITY.md#untrusted-models for more details). In a future release, the default value for `weights_only` will be flipped to `True`. This limits the functions that could be executed during unpickling. Arbitrary objects will no longer be allowed to be loaded via this mode unless they are explicitly allowlisted by the user via `torch.serialization.add_safe_globals`. We recommend you start setting `weights_only=True` for any use case where you don't have full control of the loaded file. Please open an issue on GitHub for any issues related to this experimental feature.
  self.data, self.slices = torch.load(self.processed_paths[0])
