STDOUT:
Results will be saved in /home/philip/projects/llm_inference_code_repo/Circuit-Completion-Using-GNNs/component_classification_with_link_prediction_head/evaluation/FEGIN/results/model_FEGIN_dataset_ltspice_examples
Command line input: python main.py --data ltspice_examples --representation component_pin --model FEGIN --layers 5 --hiddens 64 --batch_size 128 --lr 0.001 --emb_size 250 --epochs 100 --save_appendix component_pin_L5_H64_BS128_LR0.001_E250 --no_val
 is saved.
-----
ltspice_examples - FEGIN
Using 5 layers, 64 hidden units, h = 2
Loading component_pin representation dataset
ENTERED
Training FEGIN on component_pin representation
Train: 3560, Test: 848
##################ITERATION #0 ****************************************
 epoch: 0, train_loss: 1.2869, test_loss: 1.3222, test_f1: 0.2260
 epoch: 1, train_loss: 1.0659, test_loss: 1.2397, test_f1: 0.2508
 epoch: 2, train_loss: 0.9918, test_loss: 1.1119, test_f1: 0.3358
 epoch: 3, train_loss: 0.9733, test_loss: 0.9734, test_f1: 0.4654
 epoch: 4, train_loss: 0.9492, test_loss: 0.9691, test_f1: 0.5093
 epoch: 5, train_loss: 0.9072, test_loss: 1.0000, test_f1: 0.5140
 epoch: 6, train_loss: 0.8797, test_loss: 0.9197, test_f1: 0.5096
 epoch: 7, train_loss: 0.8630, test_loss: 0.9596, test_f1: 0.5019
 epoch: 8, train_loss: 0.8409, test_loss: 0.9370, test_f1: 0.4830
 epoch: 9, train_loss: 0.8234, test_loss: 0.9592, test_f1: 0.4995
 epoch: 10, train_loss: 0.8142, test_loss: 1.2273, test_f1: 0.4727
 epoch: 11, train_loss: 0.7827, test_loss: 0.9546, test_f1: 0.5076
 epoch: 12, train_loss: 0.7681, test_loss: 1.0266, test_f1: 0.5556
 epoch: 13, train_loss: 0.7496, test_loss: 0.9001, test_f1: 0.5635
 epoch: 14, train_loss: 0.7149, test_loss: 0.9789, test_f1: 0.5245
 epoch: 15, train_loss: 0.7240, test_loss: 0.9599, test_f1: 0.5732
 epoch: 16, train_loss: 0.7125, test_loss: 0.8644, test_f1: 0.5467
 epoch: 17, train_loss: 0.6983, test_loss: 1.0415, test_f1: 0.5564
 epoch: 18, train_loss: 0.7005, test_loss: 0.8828, test_f1: 0.5684
 epoch: 19, train_loss: 0.6736, test_loss: 0.9138, test_f1: 0.5707
 epoch: 20, train_loss: 0.6789, test_loss: 0.9432, test_f1: 0.5964
 epoch: 21, train_loss: 0.6593, test_loss: 0.9826, test_f1: 0.5729
 epoch: 22, train_loss: 0.6529, test_loss: 0.8559, test_f1: 0.6115
 epoch: 23, train_loss: 0.6266, test_loss: 0.8946, test_f1: 0.5796
 epoch: 24, train_loss: 0.6219, test_loss: 1.0169, test_f1: 0.5884
 epoch: 25, train_loss: 0.6114, test_loss: 0.8710, test_f1: 0.6150
 epoch: 26, train_loss: 0.6179, test_loss: 0.9972, test_f1: 0.5910
 epoch: 27, train_loss: 0.6125, test_loss: 1.0372, test_f1: 0.5601
 epoch: 28, train_loss: 0.5910, test_loss: 0.9947, test_f1: 0.5951
 epoch: 29, train_loss: 0.5716, test_loss: 0.8753, test_f1: 0.6262
 epoch: 30, train_loss: 0.5730, test_loss: 1.0456, test_f1: 0.5775
 epoch: 31, train_loss: 0.5755, test_loss: 0.9079, test_f1: 0.6238
 epoch: 32, train_loss: 0.5599, test_loss: 0.8567, test_f1: 0.6382
 epoch: 33, train_loss: 0.5460, test_loss: 1.0495, test_f1: 0.5978
 epoch: 34, train_loss: 0.5931, test_loss: 1.1188, test_f1: 0.5613
 epoch: 35, train_loss: 0.5725, test_loss: 0.9388, test_f1: 0.6117
 epoch: 36, train_loss: 0.5599, test_loss: 0.9963, test_f1: 0.6135
 epoch: 37, train_loss: 0.5533, test_loss: 0.9182, test_f1: 0.5913
 epoch: 38, train_loss: 0.5365, test_loss: 1.1006, test_f1: 0.5852
 epoch: 39, train_loss: 0.5144, test_loss: 1.0996, test_f1: 0.5898
 epoch: 40, train_loss: 0.5137, test_loss: 1.0217, test_f1: 0.6185
 epoch: 41, train_loss: 0.5070, test_loss: 1.0566, test_f1: 0.5994
 epoch: 42, train_loss: 0.5042, test_loss: 1.1614, test_f1: 0.5852
 epoch: 43, train_loss: 0.4986, test_loss: 1.0800, test_f1: 0.6309
 epoch: 44, train_loss: 0.5071, test_loss: 1.2109, test_f1: 0.5609
 epoch: 45, train_loss: 0.5079, test_loss: 1.1172, test_f1: 0.6025
 epoch: 46, train_loss: 0.4876, test_loss: 1.2013, test_f1: 0.5985
 epoch: 47, train_loss: 0.4837, test_loss: 1.2914, test_f1: 0.6000
 epoch: 48, train_loss: 0.5052, test_loss: 1.2438, test_f1: 0.5896
 epoch: 49, train_loss: 0.4806, test_loss: 1.2064, test_f1: 0.6052
 epoch: 50, train_loss: 0.4676, test_loss: 1.0266, test_f1: 0.6239
 epoch: 51, train_loss: 0.4439, test_loss: 1.0429, test_f1: 0.6330
 epoch: 52, train_loss: 0.4133, test_loss: 1.0906, test_f1: 0.6436
 epoch: 53, train_loss: 0.3980, test_loss: 1.0177, test_f1: 0.6550
 epoch: 54, train_loss: 0.3893, test_loss: 1.1576, test_f1: 0.6602
 epoch: 55, train_loss: 0.3860, test_loss: 1.2598, test_f1: 0.6370
 epoch: 56, train_loss: 0.3755, test_loss: 1.2171, test_f1: 0.6258
 epoch: 57, train_loss: 0.3733, test_loss: 1.3046, test_f1: 0.6152
 epoch: 58, train_loss: 0.3795, test_loss: 1.1353, test_f1: 0.6345
 epoch: 59, train_loss: 0.3736, test_loss: 1.2222, test_f1: 0.6228
 epoch: 60, train_loss: 0.3703, test_loss: 1.2261, test_f1: 0.6438
 epoch: 61, train_loss: 0.3616, test_loss: 1.2787, test_f1: 0.6261
 epoch: 62, train_loss: 0.3717, test_loss: 1.4189, test_f1: 0.6243
 epoch: 63, train_loss: 0.3537, test_loss: 1.4316, test_f1: 0.6214
 epoch: 64, train_loss: 0.3543, test_loss: 1.4244, test_f1: 0.6344
 epoch: 65, train_loss: 0.3410, test_loss: 1.3596, test_f1: 0.6630
 epoch: 66, train_loss: 0.3373, test_loss: 1.3819, test_f1: 0.6137
 epoch: 67, train_loss: 0.3373, test_loss: 1.5115, test_f1: 0.6295
 epoch: 68, train_loss: 0.3379, test_loss: 1.7791, test_f1: 0.6172
 epoch: 69, train_loss: 0.3461, test_loss: 1.5028, test_f1: 0.6324
 epoch: 70, train_loss: 0.3543, test_loss: 1.2842, test_f1: 0.6182
 epoch: 71, train_loss: 0.3291, test_loss: 1.4728, test_f1: 0.5915
 epoch: 72, train_loss: 0.3292, test_loss: 1.8202, test_f1: 0.6310
 epoch: 73, train_loss: 0.3312, test_loss: 1.5041, test_f1: 0.6465
 epoch: 74, train_loss: 0.3153, test_loss: 1.5411, test_f1: 0.6226
 epoch: 75, train_loss: 0.3071, test_loss: 1.4967, test_f1: 0.6362
 epoch: 76, train_loss: 0.2985, test_loss: 1.5786, test_f1: 0.6354
 epoch: 77, train_loss: 0.2904, test_loss: 1.5424, test_f1: 0.6405
 epoch: 78, train_loss: 0.2996, test_loss: 1.5919, test_f1: 0.6291
 epoch: 79, train_loss: 0.3116, test_loss: 1.7485, test_f1: 0.6097
 epoch: 80, train_loss: 0.2968, test_loss: 1.6183, test_f1: 0.6205
 epoch: 81, train_loss: 0.3023, test_loss: 1.7357, test_f1: 0.6107
 epoch: 82, train_loss: 0.2996, test_loss: 1.6549, test_f1: 0.6287
 epoch: 83, train_loss: 0.2884, test_loss: 1.6685, test_f1: 0.6384
 epoch: 84, train_loss: 0.2876, test_loss: 1.4703, test_f1: 0.6126
 epoch: 85, train_loss: 0.2898, test_loss: 1.6504, test_f1: 0.6341
 epoch: 86, train_loss: 0.2813, test_loss: 1.7069, test_f1: 0.6205
 epoch: 87, train_loss: 0.2768, test_loss: 1.6630, test_f1: 0.6241
 epoch: 88, train_loss: 0.2664, test_loss: 1.7726, test_f1: 0.6266
 epoch: 89, train_loss: 0.2749, test_loss: 1.8700, test_f1: 0.6266
 epoch: 90, train_loss: 0.2705, test_loss: 1.7103, test_f1: 0.6225
 epoch: 91, train_loss: 0.2727, test_loss: 1.6561, test_f1: 0.6198
 epoch: 92, train_loss: 0.2701, test_loss: 1.5137, test_f1: 0.6496
 epoch: 93, train_loss: 0.2601, test_loss: 1.7962, test_f1: 0.6214
 epoch: 94, train_loss: 0.2506, test_loss: 1.9232, test_f1: 0.6330
 epoch: 95, train_loss: 0.2472, test_loss: 1.7388, test_f1: 0.5864
 epoch: 96, train_loss: 0.2532, test_loss: 1.8074, test_f1: 0.6252
 epoch: 97, train_loss: 0.2526, test_loss: 1.7806, test_f1: 0.6396
 epoch: 98, train_loss: 0.2565, test_loss: 1.9021, test_f1: 0.6306
 epoch: 99, train_loss: 0.2627, test_loss: 1.7515, test_f1: 0.6154
##################ITERATION #1 ****************************************
 epoch: 0, train_loss: 1.1887, test_loss: 1.2683, test_f1: 0.2286
 epoch: 1, train_loss: 1.0112, test_loss: 1.0312, test_f1: 0.3945
 epoch: 2, train_loss: 0.9619, test_loss: 1.0011, test_f1: 0.5040
 epoch: 3, train_loss: 0.9194, test_loss: 0.9667, test_f1: 0.4991
 epoch: 4, train_loss: 0.8912, test_loss: 0.9843, test_f1: 0.5183
 epoch: 5, train_loss: 0.8660, test_loss: 0.9726, test_f1: 0.5308
 epoch: 6, train_loss: 0.8406, test_loss: 1.0497, test_f1: 0.5149
 epoch: 7, train_loss: 0.8205, test_loss: 0.9738, test_f1: 0.5316
 epoch: 8, train_loss: 0.8073, test_loss: 0.9625, test_f1: 0.5533
 epoch: 9, train_loss: 0.8030, test_loss: 1.3088, test_f1: 0.5462
 epoch: 10, train_loss: 0.7740, test_loss: 0.9094, test_f1: 0.5726
 epoch: 11, train_loss: 0.7543, test_loss: 1.0322, test_f1: 0.5291
 epoch: 12, train_loss: 0.7549, test_loss: 0.9304, test_f1: 0.5609
 epoch: 13, train_loss: 0.7443, test_loss: 0.9027, test_f1: 0.5831
 epoch: 14, train_loss: 0.7191, test_loss: 1.0021, test_f1: 0.5693
 epoch: 15, train_loss: 0.7044, test_loss: 0.9775, test_f1: 0.5475
 epoch: 16, train_loss: 0.7049, test_loss: 0.9740, test_f1: 0.5578
 epoch: 17, train_loss: 0.6910, test_loss: 0.9558, test_f1: 0.5973
 epoch: 18, train_loss: 0.6838, test_loss: 0.9469, test_f1: 0.5786
 epoch: 19, train_loss: 0.6575, test_loss: 1.0023, test_f1: 0.5817
 epoch: 20, train_loss: 0.6430, test_loss: 0.9824, test_f1: 0.6019
 epoch: 21, train_loss: 0.6399, test_loss: 0.9734, test_f1: 0.5797
 epoch: 22, train_loss: 0.6234, test_loss: 1.0063, test_f1: 0.5683
 epoch: 23, train_loss: 0.6100, test_loss: 0.9905, test_f1: 0.5793
 epoch: 24, train_loss: 0.6242, test_loss: 1.1626, test_f1: 0.5814
 epoch: 25, train_loss: 0.6189, test_loss: 1.2144, test_f1: 0.5372
 epoch: 26, train_loss: 0.6296, test_loss: 1.0100, test_f1: 0.5946
 epoch: 27, train_loss: 0.6163, test_loss: 1.1607, test_f1: 0.5847
 epoch: 28, train_loss: 0.5923, test_loss: 1.2218, test_f1: 0.6067
 epoch: 29, train_loss: 0.5835, test_loss: 1.0903, test_f1: 0.5863
 epoch: 30, train_loss: 0.5510, test_loss: 1.0138, test_f1: 0.6266
 epoch: 31, train_loss: 0.5381, test_loss: 1.0851, test_f1: 0.6153
 epoch: 32, train_loss: 0.5466, test_loss: 1.1722, test_f1: 0.5787
 epoch: 33, train_loss: 0.5389, test_loss: 1.1927, test_f1: 0.6026
 epoch: 34, train_loss: 0.5230, test_loss: 1.2863, test_f1: 0.5900
 epoch: 35, train_loss: 0.5367, test_loss: 1.0947, test_f1: 0.6137
 epoch: 36, train_loss: 0.5203, test_loss: 1.1680, test_f1: 0.6052
 epoch: 37, train_loss: 0.5283, test_loss: 1.2691, test_f1: 0.5837
 epoch: 38, train_loss: 0.5401, test_loss: 0.9893, test_f1: 0.6374
 epoch: 39, train_loss: 0.5066, test_loss: 1.4209, test_f1: 0.5845
 epoch: 40, train_loss: 0.4965, test_loss: 1.0848, test_f1: 0.6391
 epoch: 41, train_loss: 0.4844, test_loss: 1.1333, test_f1: 0.6135
 epoch: 42, train_loss: 0.4698, test_loss: 1.2207, test_f1: 0.5925
 epoch: 43, train_loss: 0.4608, test_loss: 1.4190, test_f1: 0.5950
 epoch: 44, train_loss: 0.4570, test_loss: 1.2766, test_f1: 0.6198
 epoch: 45, train_loss: 0.4600, test_loss: 1.1645, test_f1: 0.6311
 epoch: 46, train_loss: 0.4424, test_loss: 1.0717, test_f1: 0.6579
 epoch: 47, train_loss: 0.4450, test_loss: 1.6102, test_f1: 0.5749
 epoch: 48, train_loss: 0.4297, test_loss: 1.2500, test_f1: 0.6332
 epoch: 49, train_loss: 0.4319, test_loss: 1.1936, test_f1: 0.6309
 epoch: 50, train_loss: 0.4327, test_loss: 1.2632, test_f1: 0.6182
 epoch: 51, train_loss: 0.3815, test_loss: 1.3040, test_f1: 0.6348
 epoch: 52, train_loss: 0.3521, test_loss: 1.2916, test_f1: 0.6401
 epoch: 53, train_loss: 0.3441, test_loss: 1.4028, test_f1: 0.6465
 epoch: 54, train_loss: 0.3424, test_loss: 1.4292, test_f1: 0.6429
 epoch: 55, train_loss: 0.3339, test_loss: 1.4373, test_f1: 0.6587
 epoch: 56, train_loss: 0.3356, test_loss: 1.4003, test_f1: 0.6395
 epoch: 57, train_loss: 0.3093, test_loss: 1.4468, test_f1: 0.6600
 epoch: 58, train_loss: 0.3144, test_loss: 1.3877, test_f1: 0.6433
 epoch: 59, train_loss: 0.3186, test_loss: 1.5074, test_f1: 0.6507
 epoch: 60, train_loss: 0.3116, test_loss: 1.4579, test_f1: 0.6236
 epoch: 61, train_loss: 0.2920, test_loss: 1.4872, test_f1: 0.6676
 epoch: 62, train_loss: 0.2893, test_loss: 1.3332, test_f1: 0.6491
 epoch: 63, train_loss: 0.3068, test_loss: 1.4733, test_f1: 0.6393
 epoch: 64, train_loss: 0.3088, test_loss: 1.3047, test_f1: 0.6675
 epoch: 65, train_loss: 0.2965, test_loss: 1.6511, test_f1: 0.6497
 epoch: 66, train_loss: 0.2942, test_loss: 1.4885, test_f1: 0.6578
 epoch: 67, train_loss: 0.3000, test_loss: 1.5146, test_f1: 0.6127
 epoch: 68, train_loss: 0.3033, test_loss: 1.5959, test_f1: 0.6243
 epoch: 69, train_loss: 0.2814, test_loss: 1.5473, test_f1: 0.6479
 epoch: 70, train_loss: 0.2957, test_loss: 1.4499, test_f1: 0.6604
 epoch: 71, train_loss: 0.2785, test_loss: 1.5367, test_f1: 0.6281
 epoch: 72, train_loss: 0.2812, test_loss: 1.5522, test_f1: 0.6614
 epoch: 73, train_loss: 0.2850, test_loss: 1.6415, test_f1: 0.6434
 epoch: 74, train_loss: 0.2615, test_loss: 1.6320, test_f1: 0.6716
 epoch: 75, train_loss: 0.2513, test_loss: 1.5726, test_f1: 0.6568
 epoch: 76, train_loss: 0.2446, test_loss: 1.7598, test_f1: 0.6406
 epoch: 77, train_loss: 0.2621, test_loss: 1.6694, test_f1: 0.6617
 epoch: 78, train_loss: 0.2667, test_loss: 1.6292, test_f1: 0.6560
 epoch: 79, train_loss: 0.2431, test_loss: 1.7177, test_f1: 0.6386
 epoch: 80, train_loss: 0.2232, test_loss: 1.7427, test_f1: 0.6405
 epoch: 81, train_loss: 0.2387, test_loss: 1.7725, test_f1: 0.6479
 epoch: 82, train_loss: 0.2377, test_loss: 1.7327, test_f1: 0.6486
 epoch: 83, train_loss: 0.2483, test_loss: 1.7171, test_f1: 0.6546
 epoch: 84, train_loss: 0.2303, test_loss: 1.6935, test_f1: 0.6723
 epoch: 85, train_loss: 0.2299, test_loss: 1.7617, test_f1: 0.6724
 epoch: 86, train_loss: 0.2382, test_loss: 1.7341, test_f1: 0.6510
 epoch: 87, train_loss: 0.2322, test_loss: 1.8427, test_f1: 0.6471
 epoch: 88, train_loss: 0.2224, test_loss: 1.7837, test_f1: 0.6551
 epoch: 89, train_loss: 0.2359, test_loss: 1.9259, test_f1: 0.6262
 epoch: 90, train_loss: 0.2282, test_loss: 1.8161, test_f1: 0.6492
 epoch: 91, train_loss: 0.2355, test_loss: 1.7062, test_f1: 0.6404
 epoch: 92, train_loss: 0.2199, test_loss: 1.6969, test_f1: 0.6629
 epoch: 93, train_loss: 0.2168, test_loss: 1.7138, test_f1: 0.6591
 epoch: 94, train_loss: 0.2172, test_loss: 1.9535, test_f1: 0.6361
 epoch: 95, train_loss: 0.2129, test_loss: 1.8351, test_f1: 0.6529
 epoch: 96, train_loss: 0.2104, test_loss: 1.8883, test_f1: 0.6406
 epoch: 97, train_loss: 0.2104, test_loss: 1.6747, test_f1: 0.6699
 epoch: 98, train_loss: 0.1931, test_loss: 1.9191, test_f1: 0.6523
 epoch: 99, train_loss: 0.2120, test_loss: 1.8467, test_f1: 0.6511
##################ITERATION #2 ****************************************
 epoch: 0, train_loss: 1.1668, test_loss: 1.3034, test_f1: 0.2286
 epoch: 1, train_loss: 1.0119, test_loss: 1.0069, test_f1: 0.4689
 epoch: 2, train_loss: 0.9716, test_loss: 0.9523, test_f1: 0.5187
 epoch: 3, train_loss: 0.9262, test_loss: 0.9054, test_f1: 0.5797
 epoch: 4, train_loss: 0.8878, test_loss: 0.9330, test_f1: 0.5737
 epoch: 5, train_loss: 0.8672, test_loss: 0.9310, test_f1: 0.5294
 epoch: 6, train_loss: 0.8302, test_loss: 0.9133, test_f1: 0.5929
 epoch: 7, train_loss: 0.8279, test_loss: 0.9041, test_f1: 0.5404
 epoch: 8, train_loss: 0.8141, test_loss: 0.9343, test_f1: 0.5337
 epoch: 9, train_loss: 0.7987, test_loss: 0.8977, test_f1: 0.5501
 epoch: 10, train_loss: 0.7685, test_loss: 0.8713, test_f1: 0.5924
 epoch: 11, train_loss: 0.7603, test_loss: 0.9648, test_f1: 0.5720
 epoch: 12, train_loss: 0.7383, test_loss: 0.8056, test_f1: 0.6146
 epoch: 13, train_loss: 0.7406, test_loss: 0.9673, test_f1: 0.5772
 epoch: 14, train_loss: 0.7209, test_loss: 0.8830, test_f1: 0.5631
 epoch: 15, train_loss: 0.7028, test_loss: 0.9487, test_f1: 0.6049
 epoch: 16, train_loss: 0.6987, test_loss: 0.9334, test_f1: 0.5815
 epoch: 17, train_loss: 0.6994, test_loss: 0.8785, test_f1: 0.6199
 epoch: 18, train_loss: 0.6634, test_loss: 0.8688, test_f1: 0.6296
 epoch: 19, train_loss: 0.6661, test_loss: 0.9119, test_f1: 0.6070
 epoch: 20, train_loss: 0.6580, test_loss: 0.9228, test_f1: 0.6125
 epoch: 21, train_loss: 0.6289, test_loss: 0.9992, test_f1: 0.5745
 epoch: 22, train_loss: 0.6313, test_loss: 0.8847, test_f1: 0.6169
 epoch: 23, train_loss: 0.6194, test_loss: 0.8431, test_f1: 0.6193
 epoch: 24, train_loss: 0.6193, test_loss: 1.0032, test_f1: 0.5909
 epoch: 25, train_loss: 0.5837, test_loss: 0.9078, test_f1: 0.6018
 epoch: 26, train_loss: 0.6009, test_loss: 1.0465, test_f1: 0.5804
 epoch: 27, train_loss: 0.5997, test_loss: 0.9176, test_f1: 0.6222
 epoch: 28, train_loss: 0.5897, test_loss: 0.8192, test_f1: 0.6258
 epoch: 29, train_loss: 0.5688, test_loss: 0.9333, test_f1: 0.6012
 epoch: 30, train_loss: 0.5455, test_loss: 0.8969, test_f1: 0.6239
 epoch: 31, train_loss: 0.5720, test_loss: 0.9262, test_f1: 0.6142
 epoch: 32, train_loss: 0.5408, test_loss: 1.2839, test_f1: 0.5741
 epoch: 33, train_loss: 0.5315, test_loss: 1.0610, test_f1: 0.5648
 epoch: 34, train_loss: 0.5255, test_loss: 0.9523, test_f1: 0.6363
 epoch: 35, train_loss: 0.5828, test_loss: 1.0225, test_f1: 0.5679
 epoch: 36, train_loss: 0.5490, test_loss: 0.9201, test_f1: 0.6377
 epoch: 37, train_loss: 0.5250, test_loss: 1.0693, test_f1: 0.6039
 epoch: 38, train_loss: 0.5276, test_loss: 0.9498, test_f1: 0.6159
 epoch: 39, train_loss: 0.5125, test_loss: 1.0087, test_f1: 0.6306
 epoch: 40, train_loss: 0.5001, test_loss: 1.1246, test_f1: 0.6046
 epoch: 41, train_loss: 0.4811, test_loss: 1.0485, test_f1: 0.6049
 epoch: 42, train_loss: 0.4665, test_loss: 1.0926, test_f1: 0.6194
 epoch: 43, train_loss: 0.4630, test_loss: 1.1187, test_f1: 0.5946
 epoch: 44, train_loss: 0.4711, test_loss: 1.1268, test_f1: 0.5942
 epoch: 45, train_loss: 0.4653, test_loss: 1.1536, test_f1: 0.6226
 epoch: 46, train_loss: 0.4527, test_loss: 1.0229, test_f1: 0.6335
 epoch: 47, train_loss: 0.4271, test_loss: 1.0365, test_f1: 0.6229
 epoch: 48, train_loss: 0.4227, test_loss: 1.0390, test_f1: 0.6245
 epoch: 49, train_loss: 0.4388, test_loss: 1.0536, test_f1: 0.6249
 epoch: 50, train_loss: 0.4583, test_loss: 1.1662, test_f1: 0.6266
 epoch: 51, train_loss: 0.3926, test_loss: 1.0448, test_f1: 0.6364
 epoch: 52, train_loss: 0.3628, test_loss: 1.0763, test_f1: 0.6260
 epoch: 53, train_loss: 0.3523, test_loss: 1.1129, test_f1: 0.6488
 epoch: 54, train_loss: 0.3433, test_loss: 1.1464, test_f1: 0.6281
 epoch: 55, train_loss: 0.3313, test_loss: 1.1744, test_f1: 0.6226
 epoch: 56, train_loss: 0.3448, test_loss: 1.1315, test_f1: 0.6363
 epoch: 57, train_loss: 0.3269, test_loss: 1.0906, test_f1: 0.6601
 epoch: 58, train_loss: 0.3371, test_loss: 1.3189, test_f1: 0.6333
 epoch: 59, train_loss: 0.3420, test_loss: 1.1987, test_f1: 0.6387
 epoch: 60, train_loss: 0.3239, test_loss: 1.2634, test_f1: 0.6520
 epoch: 61, train_loss: 0.3103, test_loss: 1.3592, test_f1: 0.6251
 epoch: 62, train_loss: 0.3022, test_loss: 1.4068, test_f1: 0.6220
 epoch: 63, train_loss: 0.3054, test_loss: 1.1535, test_f1: 0.6544
 epoch: 64, train_loss: 0.2878, test_loss: 1.3098, test_f1: 0.6543
 epoch: 65, train_loss: 0.3136, test_loss: 1.2993, test_f1: 0.6664
 epoch: 66, train_loss: 0.3102, test_loss: 1.3197, test_f1: 0.6565
 epoch: 67, train_loss: 0.3046, test_loss: 1.2669, test_f1: 0.6388
 epoch: 68, train_loss: 0.2926, test_loss: 1.2711, test_f1: 0.6284
 epoch: 69, train_loss: 0.2771, test_loss: 1.2827, test_f1: 0.6558
 epoch: 70, train_loss: 0.2628, test_loss: 1.4433, test_f1: 0.6436
 epoch: 71, train_loss: 0.2906, test_loss: 1.3902, test_f1: 0.6596
 epoch: 72, train_loss: 0.2891, test_loss: 1.4120, test_f1: 0.6356
 epoch: 73, train_loss: 0.2805, test_loss: 1.3163, test_f1: 0.6357
 epoch: 74, train_loss: 0.2888, test_loss: 1.3112, test_f1: 0.6608
 epoch: 75, train_loss: 0.2720, test_loss: 1.3799, test_f1: 0.6680
 epoch: 76, train_loss: 0.2542, test_loss: 1.3869, test_f1: 0.6551
 epoch: 77, train_loss: 0.2497, test_loss: 1.5131, test_f1: 0.6585
 epoch: 78, train_loss: 0.2590, test_loss: 1.4202, test_f1: 0.6635
 epoch: 79, train_loss: 0.2369, test_loss: 1.6858, test_f1: 0.6453
 epoch: 80, train_loss: 0.2418, test_loss: 1.4882, test_f1: 0.6573
 epoch: 81, train_loss: 0.2500, test_loss: 1.5906, test_f1: 0.6757
 epoch: 82, train_loss: 0.2444, test_loss: 1.3594, test_f1: 0.6820
 epoch: 83, train_loss: 0.2432, test_loss: 1.5872, test_f1: 0.6364
 epoch: 84, train_loss: 0.2543, test_loss: 1.5308, test_f1: 0.6608
 epoch: 85, train_loss: 0.2520, test_loss: 1.4657, test_f1: 0.6372
 epoch: 86, train_loss: 0.2456, test_loss: 1.7175, test_f1: 0.6466
 epoch: 87, train_loss: 0.2403, test_loss: 1.5528, test_f1: 0.6659
 epoch: 88, train_loss: 0.2471, test_loss: 1.6314, test_f1: 0.6452
 epoch: 89, train_loss: 0.2415, test_loss: 1.6175, test_f1: 0.6485
 epoch: 90, train_loss: 0.2310, test_loss: 1.7250, test_f1: 0.6540
 epoch: 91, train_loss: 0.2056, test_loss: 1.7847, test_f1: 0.6408
 epoch: 92, train_loss: 0.2119, test_loss: 1.7438, test_f1: 0.6548
 epoch: 93, train_loss: 0.2058, test_loss: 1.7785, test_f1: 0.6450
 epoch: 94, train_loss: 0.2035, test_loss: 1.7012, test_f1: 0.6728
 epoch: 95, train_loss: 0.2102, test_loss: 1.8232, test_f1: 0.6594
 epoch: 96, train_loss: 0.2265, test_loss: 1.5746, test_f1: 0.6489
 epoch: 97, train_loss: 0.2032, test_loss: 1.8162, test_f1: 0.6432
 epoch: 98, train_loss: 0.2100, test_loss: 1.8290, test_f1: 0.6461
 epoch: 99, train_loss: 0.2109, test_loss: 1.8040, test_f1: 0.6561
##################ITERATION #3 ****************************************
 epoch: 0, train_loss: 1.1882, test_loss: 1.2776, test_f1: 0.2574
 epoch: 1, train_loss: 1.0322, test_loss: 1.0524, test_f1: 0.4519
 epoch: 2, train_loss: 0.9647, test_loss: 0.9758, test_f1: 0.5249
 epoch: 3, train_loss: 0.9429, test_loss: 0.9145, test_f1: 0.5472
 epoch: 4, train_loss: 0.8989, test_loss: 0.9132, test_f1: 0.5384
 epoch: 5, train_loss: 0.8751, test_loss: 0.9129, test_f1: 0.5422
 epoch: 6, train_loss: 0.8643, test_loss: 0.8783, test_f1: 0.5695
 epoch: 7, train_loss: 0.8522, test_loss: 0.9556, test_f1: 0.5516
 epoch: 8, train_loss: 0.8253, test_loss: 0.9096, test_f1: 0.5625
 epoch: 9, train_loss: 0.8112, test_loss: 0.9427, test_f1: 0.5670
 epoch: 10, train_loss: 0.7853, test_loss: 0.9438, test_f1: 0.5591
 epoch: 11, train_loss: 0.7713, test_loss: 0.8863, test_f1: 0.5928
 epoch: 12, train_loss: 0.7642, test_loss: 0.9305, test_f1: 0.5654
 epoch: 13, train_loss: 0.7505, test_loss: 0.9040, test_f1: 0.5948
 epoch: 14, train_loss: 0.7492, test_loss: 0.9101, test_f1: 0.5700
 epoch: 15, train_loss: 0.7235, test_loss: 0.8973, test_f1: 0.6031
 epoch: 16, train_loss: 0.7255, test_loss: 0.8872, test_f1: 0.5972
 epoch: 17, train_loss: 0.7021, test_loss: 0.9109, test_f1: 0.6130
 epoch: 18, train_loss: 0.6929, test_loss: 0.8258, test_f1: 0.6346
 epoch: 19, train_loss: 0.6753, test_loss: 0.9687, test_f1: 0.5892
 epoch: 20, train_loss: 0.6640, test_loss: 0.9036, test_f1: 0.6182
 epoch: 21, train_loss: 0.6618, test_loss: 0.8429, test_f1: 0.6277
 epoch: 22, train_loss: 0.6536, test_loss: 0.9221, test_f1: 0.6019
 epoch: 23, train_loss: 0.6636, test_loss: 0.8401, test_f1: 0.6114
 epoch: 24, train_loss: 0.6559, test_loss: 1.0108, test_f1: 0.5756
 epoch: 25, train_loss: 0.6408, test_loss: 0.9894, test_f1: 0.5664
 epoch: 26, train_loss: 0.6315, test_loss: 0.8890, test_f1: 0.5954
 epoch: 27, train_loss: 0.6281, test_loss: 0.7986, test_f1: 0.6154
 epoch: 28, train_loss: 0.6015, test_loss: 0.8372, test_f1: 0.6440
 epoch: 29, train_loss: 0.5898, test_loss: 0.8968, test_f1: 0.6225
 epoch: 30, train_loss: 0.5987, test_loss: 0.8437, test_f1: 0.6469
 epoch: 31, train_loss: 0.5910, test_loss: 0.8422, test_f1: 0.6384
 epoch: 32, train_loss: 0.5842, test_loss: 0.9454, test_f1: 0.5980
 epoch: 33, train_loss: 0.5864, test_loss: 0.7743, test_f1: 0.6404
 epoch: 34, train_loss: 0.5612, test_loss: 0.9141, test_f1: 0.6121
 epoch: 35, train_loss: 0.5720, test_loss: 0.8773, test_f1: 0.6351
 epoch: 36, train_loss: 0.5501, test_loss: 0.8807, test_f1: 0.6394
 epoch: 37, train_loss: 0.5559, test_loss: 0.8604, test_f1: 0.6167
 epoch: 38, train_loss: 0.5251, test_loss: 0.8755, test_f1: 0.6407
 epoch: 39, train_loss: 0.5337, test_loss: 0.9363, test_f1: 0.6327
 epoch: 40, train_loss: 0.5210, test_loss: 0.8424, test_f1: 0.6532
 epoch: 41, train_loss: 0.5151, test_loss: 0.9837, test_f1: 0.6206
 epoch: 42, train_loss: 0.5245, test_loss: 0.8784, test_f1: 0.6560
 epoch: 43, train_loss: 0.5052, test_loss: 0.8443, test_f1: 0.6613
 epoch: 44, train_loss: 0.5095, test_loss: 0.8513, test_f1: 0.6794
 epoch: 45, train_loss: 0.4968, test_loss: 1.0086, test_f1: 0.6168
 epoch: 46, train_loss: 0.5124, test_loss: 0.9410, test_f1: 0.6043
 epoch: 47, train_loss: 0.4789, test_loss: 0.9473, test_f1: 0.6316
 epoch: 48, train_loss: 0.4719, test_loss: 1.0051, test_f1: 0.6383
 epoch: 49, train_loss: 0.4701, test_loss: 0.9693, test_f1: 0.6126
 epoch: 50, train_loss: 0.4769, test_loss: 0.8317, test_f1: 0.6761
 epoch: 51, train_loss: 0.4303, test_loss: 1.0026, test_f1: 0.6446
 epoch: 52, train_loss: 0.4065, test_loss: 0.8531, test_f1: 0.6636
 epoch: 53, train_loss: 0.4039, test_loss: 0.8844, test_f1: 0.6636
 epoch: 54, train_loss: 0.3832, test_loss: 0.8952, test_f1: 0.6715
 epoch: 55, train_loss: 0.3801, test_loss: 0.8540, test_f1: 0.6865
 epoch: 56, train_loss: 0.3907, test_loss: 0.9393, test_f1: 0.6510
 epoch: 57, train_loss: 0.3731, test_loss: 0.8814, test_f1: 0.6832
 epoch: 58, train_loss: 0.3665, test_loss: 0.9498, test_f1: 0.6769
 epoch: 59, train_loss: 0.3639, test_loss: 0.8585, test_f1: 0.6921
 epoch: 60, train_loss: 0.3667, test_loss: 0.9700, test_f1: 0.6787
 epoch: 61, train_loss: 0.3592, test_loss: 0.8700, test_f1: 0.6744
 epoch: 62, train_loss: 0.3616, test_loss: 1.0151, test_f1: 0.6475
 epoch: 63, train_loss: 0.3352, test_loss: 0.8867, test_f1: 0.6779
 epoch: 64, train_loss: 0.3340, test_loss: 0.9814, test_f1: 0.6587
 epoch: 65, train_loss: 0.3419, test_loss: 1.0180, test_f1: 0.6547
 epoch: 66, train_loss: 0.3412, test_loss: 1.1018, test_f1: 0.6311
 epoch: 67, train_loss: 0.3374, test_loss: 0.9431, test_f1: 0.6509
 epoch: 68, train_loss: 0.3208, test_loss: 0.9791, test_f1: 0.6792
 epoch: 69, train_loss: 0.3243, test_loss: 0.9890, test_f1: 0.6796
 epoch: 70, train_loss: 0.3223, test_loss: 1.0681, test_f1: 0.6663
 epoch: 71, train_loss: 0.3269, test_loss: 0.9056, test_f1: 0.6772
 epoch: 72, train_loss: 0.3382, test_loss: 0.9353, test_f1: 0.6708
 epoch: 73, train_loss: 0.3306, test_loss: 1.0933, test_f1: 0.6160
 epoch: 74, train_loss: 0.3315, test_loss: 1.0590, test_f1: 0.6692
 epoch: 75, train_loss: 0.3101, test_loss: 1.0236, test_f1: 0.6627
 epoch: 76, train_loss: 0.3040, test_loss: 0.9498, test_f1: 0.6744
 epoch: 77, train_loss: 0.2902, test_loss: 0.9700, test_f1: 0.6954
 epoch: 78, train_loss: 0.3201, test_loss: 1.0374, test_f1: 0.6395
 epoch: 79, train_loss: 0.3006, test_loss: 1.2237, test_f1: 0.6341
 epoch: 80, train_loss: 0.3088, test_loss: 0.9752, test_f1: 0.6720
 epoch: 81, train_loss: 0.2863, test_loss: 1.0590, test_f1: 0.6698
 epoch: 82, train_loss: 0.2856, test_loss: 1.1313, test_f1: 0.6716
 epoch: 83, train_loss: 0.2885, test_loss: 1.3270, test_f1: 0.6400
 epoch: 84, train_loss: 0.2772, test_loss: 1.1486, test_f1: 0.6622
 epoch: 85, train_loss: 0.2660, test_loss: 1.1253, test_f1: 0.6847
 epoch: 86, train_loss: 0.2852, test_loss: 1.0264, test_f1: 0.6733
 epoch: 87, train_loss: 0.2698, test_loss: 1.1885, test_f1: 0.6702
 epoch: 88, train_loss: 0.2762, test_loss: 1.0975, test_f1: 0.6644
 epoch: 89, train_loss: 0.2722, test_loss: 1.2927, test_f1: 0.6730
 epoch: 90, train_loss: 0.2780, test_loss: 1.1569, test_f1: 0.6746
 epoch: 91, train_loss: 0.2790, test_loss: 1.2214, test_f1: 0.6360
 epoch: 92, train_loss: 0.2557, test_loss: 1.1225, test_f1: 0.6641
 epoch: 93, train_loss: 0.2662, test_loss: 1.1155, test_f1: 0.6887
 epoch: 94, train_loss: 0.2767, test_loss: 1.1961, test_f1: 0.6685
 epoch: 95, train_loss: 0.2464, test_loss: 1.0419, test_f1: 0.6759
 epoch: 96, train_loss: 0.2394, test_loss: 1.1580, test_f1: 0.6621
 epoch: 97, train_loss: 0.2444, test_loss: 1.2181, test_f1: 0.6667
 epoch: 98, train_loss: 0.2710, test_loss: 1.1090, test_f1: 0.6763
 epoch: 99, train_loss: 0.2550, test_loss: 1.1577, test_f1: 0.6922
##################ITERATION #4 ****************************************
 epoch: 0, train_loss: 1.2338, test_loss: 1.2244, test_f1: 0.3747
 epoch: 1, train_loss: 1.0319, test_loss: 1.0507, test_f1: 0.4287
 epoch: 2, train_loss: 0.9660, test_loss: 0.9513, test_f1: 0.4836
 epoch: 3, train_loss: 0.9448, test_loss: 0.9413, test_f1: 0.5256
 epoch: 4, train_loss: 0.9148, test_loss: 0.9774, test_f1: 0.5151
 epoch: 5, train_loss: 0.8839, test_loss: 0.9268, test_f1: 0.5376
 epoch: 6, train_loss: 0.8794, test_loss: 0.9555, test_f1: 0.5153
 epoch: 7, train_loss: 0.8610, test_loss: 0.9601, test_f1: 0.5285
 epoch: 8, train_loss: 0.8489, test_loss: 0.9521, test_f1: 0.5323
 epoch: 9, train_loss: 0.8199, test_loss: 0.9061, test_f1: 0.5153
 epoch: 10, train_loss: 0.8158, test_loss: 0.9687, test_f1: 0.5502
 epoch: 11, train_loss: 0.7829, test_loss: 0.8731, test_f1: 0.5985
 epoch: 12, train_loss: 0.7903, test_loss: 0.9459, test_f1: 0.5831
 epoch: 13, train_loss: 0.7811, test_loss: 0.9082, test_f1: 0.5546
 epoch: 14, train_loss: 0.7745, test_loss: 0.8850, test_f1: 0.5432
 epoch: 15, train_loss: 0.7468, test_loss: 0.9038, test_f1: 0.5761
 epoch: 16, train_loss: 0.7417, test_loss: 0.8782, test_f1: 0.5823
 epoch: 17, train_loss: 0.7269, test_loss: 0.9206, test_f1: 0.5739
 epoch: 18, train_loss: 0.7131, test_loss: 0.8658, test_f1: 0.5954
 epoch: 19, train_loss: 0.7010, test_loss: 0.9080, test_f1: 0.5921
 epoch: 20, train_loss: 0.6892, test_loss: 0.9092, test_f1: 0.5720
 epoch: 21, train_loss: 0.6714, test_loss: 0.8608, test_f1: 0.6043
 epoch: 22, train_loss: 0.6780, test_loss: 0.8652, test_f1: 0.6020
 epoch: 23, train_loss: 0.6627, test_loss: 0.9170, test_f1: 0.6150
 epoch: 24, train_loss: 0.6387, test_loss: 0.8841, test_f1: 0.6052
 epoch: 25, train_loss: 0.6303, test_loss: 0.8375, test_f1: 0.6159
 epoch: 26, train_loss: 0.6324, test_loss: 0.8599, test_f1: 0.6051
 epoch: 27, train_loss: 0.6117, test_loss: 0.9333, test_f1: 0.5952
 epoch: 28, train_loss: 0.6092, test_loss: 0.8614, test_f1: 0.6296
 epoch: 29, train_loss: 0.5964, test_loss: 0.8835, test_f1: 0.6156
 epoch: 30, train_loss: 0.5904, test_loss: 0.8569, test_f1: 0.6451
 epoch: 31, train_loss: 0.5904, test_loss: 0.9437, test_f1: 0.5999
 epoch: 32, train_loss: 0.5646, test_loss: 0.8495, test_f1: 0.6178
 epoch: 33, train_loss: 0.5613, test_loss: 0.8643, test_f1: 0.6259
 epoch: 34, train_loss: 0.5673, test_loss: 0.8352, test_f1: 0.6308
 epoch: 35, train_loss: 0.5441, test_loss: 0.8260, test_f1: 0.6244
 epoch: 36, train_loss: 0.5316, test_loss: 0.8661, test_f1: 0.6214
 epoch: 37, train_loss: 0.5517, test_loss: 0.8553, test_f1: 0.6235
 epoch: 38, train_loss: 0.5225, test_loss: 0.9556, test_f1: 0.5889
 epoch: 39, train_loss: 0.5031, test_loss: 0.8832, test_f1: 0.6373
 epoch: 40, train_loss: 0.5033, test_loss: 0.9162, test_f1: 0.6412
 epoch: 41, train_loss: 0.4876, test_loss: 0.9184, test_f1: 0.6336
 epoch: 42, train_loss: 0.4912, test_loss: 0.9363, test_f1: 0.6218
 epoch: 43, train_loss: 0.5057, test_loss: 0.9530, test_f1: 0.6031
 epoch: 44, train_loss: 0.4995, test_loss: 0.9289, test_f1: 0.6248
 epoch: 45, train_loss: 0.4761, test_loss: 0.9639, test_f1: 0.6312
 epoch: 46, train_loss: 0.4758, test_loss: 1.0057, test_f1: 0.6171
 epoch: 47, train_loss: 0.4530, test_loss: 0.9065, test_f1: 0.6313
 epoch: 48, train_loss: 0.4637, test_loss: 0.9717, test_f1: 0.6229
 epoch: 49, train_loss: 0.4466, test_loss: 0.9944, test_f1: 0.6391
 epoch: 50, train_loss: 0.4479, test_loss: 0.9007, test_f1: 0.6443
 epoch: 51, train_loss: 0.4130, test_loss: 0.9289, test_f1: 0.6588
 epoch: 52, train_loss: 0.3801, test_loss: 0.9950, test_f1: 0.6447
 epoch: 53, train_loss: 0.3748, test_loss: 0.9977, test_f1: 0.6549
 epoch: 54, train_loss: 0.3668, test_loss: 0.9646, test_f1: 0.6451
 epoch: 55, train_loss: 0.3697, test_loss: 1.0118, test_f1: 0.6473
 epoch: 56, train_loss: 0.3381, test_loss: 1.0389, test_f1: 0.6486
 epoch: 57, train_loss: 0.3585, test_loss: 1.0132, test_f1: 0.6614
 epoch: 58, train_loss: 0.3521, test_loss: 1.0595, test_f1: 0.6390
 epoch: 59, train_loss: 0.3592, test_loss: 1.0686, test_f1: 0.6605
 epoch: 60, train_loss: 0.3454, test_loss: 1.0996, test_f1: 0.6346
 epoch: 61, train_loss: 0.3300, test_loss: 1.0585, test_f1: 0.6342
 epoch: 62, train_loss: 0.3363, test_loss: 1.0546, test_f1: 0.6793
 epoch: 63, train_loss: 0.3276, test_loss: 1.0581, test_f1: 0.6528
 epoch: 64, train_loss: 0.3289, test_loss: 0.9979, test_f1: 0.6622
 epoch: 65, train_loss: 0.3319, test_loss: 1.1184, test_f1: 0.6398
 epoch: 66, train_loss: 0.3073, test_loss: 1.0921, test_f1: 0.6367
 epoch: 67, train_loss: 0.3242, test_loss: 1.1470, test_f1: 0.6432
 epoch: 68, train_loss: 0.3033, test_loss: 1.1387, test_f1: 0.6559
 epoch: 69, train_loss: 0.3106, test_loss: 1.0822, test_f1: 0.6518
 epoch: 70, train_loss: 0.3100, test_loss: 1.1608, test_f1: 0.6627
 epoch: 71, train_loss: 0.2996, test_loss: 1.1782, test_f1: 0.6350
 epoch: 72, train_loss: 0.3029, test_loss: 1.1657, test_f1: 0.6625
 epoch: 73, train_loss: 0.2927, test_loss: 1.1606, test_f1: 0.6345
 epoch: 74, train_loss: 0.2821, test_loss: 1.2268, test_f1: 0.6484
 epoch: 75, train_loss: 0.2819, test_loss: 1.2001, test_f1: 0.6358
 epoch: 76, train_loss: 0.2853, test_loss: 1.3193, test_f1: 0.6326
 epoch: 77, train_loss: 0.2756, test_loss: 1.1795, test_f1: 0.6551
 epoch: 78, train_loss: 0.2923, test_loss: 1.3040, test_f1: 0.6182
 epoch: 79, train_loss: 0.2675, test_loss: 1.3763, test_f1: 0.6357
 epoch: 80, train_loss: 0.2854, test_loss: 1.1584, test_f1: 0.6748
 epoch: 81, train_loss: 0.2875, test_loss: 1.2941, test_f1: 0.6496
 epoch: 82, train_loss: 0.2871, test_loss: 1.2782, test_f1: 0.6350
 epoch: 83, train_loss: 0.2767, test_loss: 1.2733, test_f1: 0.6507
 epoch: 84, train_loss: 0.2640, test_loss: 1.3776, test_f1: 0.6263
 epoch: 85, train_loss: 0.2731, test_loss: 1.2923, test_f1: 0.6231
 epoch: 86, train_loss: 0.2535, test_loss: 1.3316, test_f1: 0.6361
 epoch: 87, train_loss: 0.2595, test_loss: 1.2479, test_f1: 0.6388
 epoch: 88, train_loss: 0.2646, test_loss: 1.3285, test_f1: 0.6363
 epoch: 89, train_loss: 0.2749, test_loss: 1.4245, test_f1: 0.6404
 epoch: 90, train_loss: 0.2425, test_loss: 1.3634, test_f1: 0.6394
 epoch: 91, train_loss: 0.2472, test_loss: 1.4332, test_f1: 0.6191
 epoch: 92, train_loss: 0.2574, test_loss: 1.4021, test_f1: 0.6394
 epoch: 93, train_loss: 0.2572, test_loss: 1.5112, test_f1: 0.6351
 epoch: 94, train_loss: 0.2644, test_loss: 1.3399, test_f1: 0.6456
 epoch: 95, train_loss: 0.2533, test_loss: 1.5392, test_f1: 0.6212
 epoch: 96, train_loss: 0.2323, test_loss: 1.4258, test_f1: 0.6349
 epoch: 97, train_loss: 0.2440, test_loss: 1.4398, test_f1: 0.6566
 epoch: 98, train_loss: 0.2352, test_loss: 1.5456, test_f1: 0.6588
 epoch: 99, train_loss: 0.2373, test_loss: 1.5060, test_f1: 0.6558
##################ITERATION #5 ****************************************
 epoch: 0, train_loss: 1.2355, test_loss: 1.2336, test_f1: 0.2260
 epoch: 1, train_loss: 1.0395, test_loss: 1.0112, test_f1: 0.4447
 epoch: 2, train_loss: 0.9619, test_loss: 0.9614, test_f1: 0.4836
 epoch: 3, train_loss: 0.9336, test_loss: 0.9510, test_f1: 0.5224
 epoch: 4, train_loss: 0.9037, test_loss: 1.0092, test_f1: 0.5239
 epoch: 5, train_loss: 0.8808, test_loss: 0.8947, test_f1: 0.5539
 epoch: 6, train_loss: 0.8475, test_loss: 0.8926, test_f1: 0.5619
 epoch: 7, train_loss: 0.8486, test_loss: 0.8305, test_f1: 0.5627
 epoch: 8, train_loss: 0.8248, test_loss: 0.9302, test_f1: 0.5217
 epoch: 9, train_loss: 0.8026, test_loss: 0.9013, test_f1: 0.5883
 epoch: 10, train_loss: 0.7939, test_loss: 0.8886, test_f1: 0.5825
 epoch: 11, train_loss: 0.7749, test_loss: 0.8717, test_f1: 0.5885
 epoch: 12, train_loss: 0.7629, test_loss: 0.8157, test_f1: 0.5986
 epoch: 13, train_loss: 0.7379, test_loss: 0.8498, test_f1: 0.6061
 epoch: 14, train_loss: 0.7444, test_loss: 0.8823, test_f1: 0.5977
 epoch: 15, train_loss: 0.7186, test_loss: 0.7852, test_f1: 0.6133
 epoch: 16, train_loss: 0.7144, test_loss: 0.7990, test_f1: 0.6028
 epoch: 17, train_loss: 0.7034, test_loss: 0.8882, test_f1: 0.6096
 epoch: 18, train_loss: 0.6979, test_loss: 0.8331, test_f1: 0.6149
 epoch: 19, train_loss: 0.6801, test_loss: 0.8491, test_f1: 0.6298
 epoch: 20, train_loss: 0.6600, test_loss: 0.8582, test_f1: 0.5920
 epoch: 21, train_loss: 0.6526, test_loss: 0.9017, test_f1: 0.6432
 epoch: 22, train_loss: 0.6541, test_loss: 0.8694, test_f1: 0.6011
 epoch: 23, train_loss: 0.6597, test_loss: 0.8922, test_f1: 0.6357
 epoch: 24, train_loss: 0.6373, test_loss: 0.9485, test_f1: 0.6032
 epoch: 25, train_loss: 0.6094, test_loss: 0.8904, test_f1: 0.6374
 epoch: 26, train_loss: 0.6039, test_loss: 0.9130, test_f1: 0.6117
 epoch: 27, train_loss: 0.6173, test_loss: 0.8038, test_f1: 0.6392
 epoch: 28, train_loss: 0.5925, test_loss: 0.8721, test_f1: 0.6144
 epoch: 29, train_loss: 0.5867, test_loss: 0.8979, test_f1: 0.6338
 epoch: 30, train_loss: 0.5723, test_loss: 0.8987, test_f1: 0.6453
 epoch: 31, train_loss: 0.5667, test_loss: 0.8631, test_f1: 0.6265
 epoch: 32, train_loss: 0.5666, test_loss: 0.8867, test_f1: 0.6197
 epoch: 33, train_loss: 0.5691, test_loss: 0.8902, test_f1: 0.6375
 epoch: 34, train_loss: 0.5370, test_loss: 0.8979, test_f1: 0.6313
 epoch: 35, train_loss: 0.5565, test_loss: 0.9203, test_f1: 0.6473
 epoch: 36, train_loss: 0.5380, test_loss: 0.9003, test_f1: 0.6223
 epoch: 37, train_loss: 0.5192, test_loss: 0.9508, test_f1: 0.5936
 epoch: 38, train_loss: 0.5347, test_loss: 0.9354, test_f1: 0.6311
 epoch: 39, train_loss: 0.5309, test_loss: 0.8916, test_f1: 0.6523
 epoch: 40, train_loss: 0.5207, test_loss: 0.8580, test_f1: 0.6459
 epoch: 41, train_loss: 0.5239, test_loss: 0.8590, test_f1: 0.6601
 epoch: 42, train_loss: 0.5104, test_loss: 0.9306, test_f1: 0.6370
 epoch: 43, train_loss: 0.4940, test_loss: 0.9968, test_f1: 0.6427
 epoch: 44, train_loss: 0.4845, test_loss: 0.9543, test_f1: 0.6575
 epoch: 45, train_loss: 0.4827, test_loss: 0.9874, test_f1: 0.6516
 epoch: 46, train_loss: 0.4700, test_loss: 0.9452, test_f1: 0.6460
 epoch: 47, train_loss: 0.4552, test_loss: 0.9464, test_f1: 0.6485
 epoch: 48, train_loss: 0.4382, test_loss: 0.9276, test_f1: 0.6450
 epoch: 49, train_loss: 0.4715, test_loss: 1.0002, test_f1: 0.6096
 epoch: 50, train_loss: 0.4510, test_loss: 1.0656, test_f1: 0.6344
 epoch: 51, train_loss: 0.4194, test_loss: 0.8895, test_f1: 0.6778
 epoch: 52, train_loss: 0.3966, test_loss: 0.8988, test_f1: 0.6732
 epoch: 53, train_loss: 0.3755, test_loss: 0.9423, test_f1: 0.6503
 epoch: 54, train_loss: 0.3823, test_loss: 1.0035, test_f1: 0.6520
 epoch: 55, train_loss: 0.3728, test_loss: 0.9310, test_f1: 0.6571
 epoch: 56, train_loss: 0.3444, test_loss: 0.9798, test_f1: 0.6579
 epoch: 57, train_loss: 0.3589, test_loss: 1.0281, test_f1: 0.6544
 epoch: 58, train_loss: 0.3601, test_loss: 1.0619, test_f1: 0.6659
 epoch: 59, train_loss: 0.3472, test_loss: 1.0352, test_f1: 0.6514
 epoch: 60, train_loss: 0.3274, test_loss: 0.9924, test_f1: 0.6592
 epoch: 61, train_loss: 0.3372, test_loss: 1.0527, test_f1: 0.6300
 epoch: 62, train_loss: 0.3455, test_loss: 1.0627, test_f1: 0.6397
 epoch: 63, train_loss: 0.3304, test_loss: 1.0124, test_f1: 0.6497
 epoch: 64, train_loss: 0.3190, test_loss: 1.0894, test_f1: 0.6654
 epoch: 65, train_loss: 0.3160, test_loss: 1.0213, test_f1: 0.6703
 epoch: 66, train_loss: 0.3067, test_loss: 0.9887, test_f1: 0.6799
 epoch: 67, train_loss: 0.3243, test_loss: 1.1123, test_f1: 0.6400
 epoch: 68, train_loss: 0.3230, test_loss: 1.1786, test_f1: 0.6494
 epoch: 69, train_loss: 0.3082, test_loss: 1.0591, test_f1: 0.6689
 epoch: 70, train_loss: 0.2973, test_loss: 1.1419, test_f1: 0.6484
 epoch: 71, train_loss: 0.2942, test_loss: 1.1413, test_f1: 0.6567
 epoch: 72, train_loss: 0.3168, test_loss: 1.0967, test_f1: 0.6670
 epoch: 73, train_loss: 0.3187, test_loss: 1.1069, test_f1: 0.6670
 epoch: 74, train_loss: 0.3138, test_loss: 1.2011, test_f1: 0.6177
 epoch: 75, train_loss: 0.2905, test_loss: 0.9948, test_f1: 0.6627
 epoch: 76, train_loss: 0.2848, test_loss: 1.0584, test_f1: 0.6698
 epoch: 77, train_loss: 0.2917, test_loss: 1.1119, test_f1: 0.6656
 epoch: 78, train_loss: 0.2857, test_loss: 1.0595, test_f1: 0.6615
 epoch: 79, train_loss: 0.2872, test_loss: 1.1040, test_f1: 0.6347
 epoch: 80, train_loss: 0.2812, test_loss: 1.2210, test_f1: 0.6332
 epoch: 81, train_loss: 0.2794, test_loss: 1.1803, test_f1: 0.6306
 epoch: 82, train_loss: 0.2778, test_loss: 1.0882, test_f1: 0.6551
 epoch: 83, train_loss: 0.2658, test_loss: 1.1876, test_f1: 0.6527
 epoch: 84, train_loss: 0.2717, test_loss: 1.1044, test_f1: 0.6630
 epoch: 85, train_loss: 0.2845, test_loss: 1.0868, test_f1: 0.6703
 epoch: 86, train_loss: 0.2723, test_loss: 1.1521, test_f1: 0.6648
 epoch: 87, train_loss: 0.2683, test_loss: 1.2641, test_f1: 0.6570
 epoch: 88, train_loss: 0.2513, test_loss: 1.0762, test_f1: 0.6739
 epoch: 89, train_loss: 0.2532, test_loss: 1.0787, test_f1: 0.6632
 epoch: 90, train_loss: 0.2454, test_loss: 1.1191, test_f1: 0.6813
 epoch: 91, train_loss: 0.2840, test_loss: 1.1327, test_f1: 0.6519
 epoch: 92, train_loss: 0.2431, test_loss: 1.0592, test_f1: 0.6902
 epoch: 93, train_loss: 0.2362, test_loss: 1.3104, test_f1: 0.6576
 epoch: 94, train_loss: 0.2453, test_loss: 1.3284, test_f1: 0.6759
 epoch: 95, train_loss: 0.2423, test_loss: 1.1518, test_f1: 0.6650
 epoch: 96, train_loss: 0.2371, test_loss: 1.2314, test_f1: 0.6647
 epoch: 97, train_loss: 0.2386, test_loss: 1.2769, test_f1: 0.6564
 epoch: 98, train_loss: 0.2208, test_loss: 1.3836, test_f1: 0.6317
 epoch: 99, train_loss: 0.2132, test_loss: 1.2384, test_f1: 0.6695
##################ITERATION #6 ****************************************
 epoch: 0, train_loss: 1.3474, test_loss: 1.3733, test_f1: 0.2509
 epoch: 1, train_loss: 1.0595, test_loss: 1.1082, test_f1: 0.4528
 epoch: 2, train_loss: 0.9811, test_loss: 1.0625, test_f1: 0.4892
 epoch: 3, train_loss: 0.9474, test_loss: 0.9977, test_f1: 0.5294
 epoch: 4, train_loss: 0.9299, test_loss: 0.9888, test_f1: 0.5265
 epoch: 5, train_loss: 0.8984, test_loss: 0.9321, test_f1: 0.5540
 epoch: 6, train_loss: 0.8852, test_loss: 0.9628, test_f1: 0.5423
 epoch: 7, train_loss: 0.8560, test_loss: 0.8963, test_f1: 0.5638
 epoch: 8, train_loss: 0.8505, test_loss: 1.0274, test_f1: 0.5602
 epoch: 9, train_loss: 0.8127, test_loss: 0.9390, test_f1: 0.5612
 epoch: 10, train_loss: 0.8057, test_loss: 0.9475, test_f1: 0.5725
 epoch: 11, train_loss: 0.7842, test_loss: 1.0331, test_f1: 0.5446
 epoch: 12, train_loss: 0.7674, test_loss: 0.9111, test_f1: 0.5843
 epoch: 13, train_loss: 0.7501, test_loss: 0.8971, test_f1: 0.5757
 epoch: 14, train_loss: 0.7265, test_loss: 0.9123, test_f1: 0.6183
 epoch: 15, train_loss: 0.7309, test_loss: 0.8886, test_f1: 0.6173
 epoch: 16, train_loss: 0.7230, test_loss: 0.8843, test_f1: 0.5996
 epoch: 17, train_loss: 0.7033, test_loss: 1.0174, test_f1: 0.5434
 epoch: 18, train_loss: 0.6919, test_loss: 0.8674, test_f1: 0.6104
 epoch: 19, train_loss: 0.6833, test_loss: 0.9384, test_f1: 0.5798
 epoch: 20, train_loss: 0.6652, test_loss: 0.8676, test_f1: 0.6250
 epoch: 21, train_loss: 0.6622, test_loss: 0.8985, test_f1: 0.5651
 epoch: 22, train_loss: 0.6568, test_loss: 0.8619, test_f1: 0.5982
 epoch: 23, train_loss: 0.6567, test_loss: 0.9654, test_f1: 0.5969
 epoch: 24, train_loss: 0.6468, test_loss: 0.8954, test_f1: 0.6331
 epoch: 25, train_loss: 0.6166, test_loss: 0.9349, test_f1: 0.6119
 epoch: 26, train_loss: 0.6147, test_loss: 0.8356, test_f1: 0.6286
 epoch: 27, train_loss: 0.6067, test_loss: 0.8663, test_f1: 0.6341
 epoch: 28, train_loss: 0.5960, test_loss: 0.8618, test_f1: 0.6126
 epoch: 29, train_loss: 0.5894, test_loss: 0.9252, test_f1: 0.6077
 epoch: 30, train_loss: 0.5584, test_loss: 0.8954, test_f1: 0.6261
 epoch: 31, train_loss: 0.5716, test_loss: 1.0214, test_f1: 0.5754
 epoch: 32, train_loss: 0.5803, test_loss: 0.8617, test_f1: 0.6276
 epoch: 33, train_loss: 0.5513, test_loss: 0.9122, test_f1: 0.6283
 epoch: 34, train_loss: 0.5300, test_loss: 0.8688, test_f1: 0.6157
 epoch: 35, train_loss: 0.5428, test_loss: 0.8511, test_f1: 0.6241
 epoch: 36, train_loss: 0.5253, test_loss: 0.8708, test_f1: 0.6383
 epoch: 37, train_loss: 0.5241, test_loss: 0.8851, test_f1: 0.6338
 epoch: 38, train_loss: 0.5251, test_loss: 0.8678, test_f1: 0.6554
 epoch: 39, train_loss: 0.5163, test_loss: 0.8959, test_f1: 0.6306
 epoch: 40, train_loss: 0.5052, test_loss: 0.9554, test_f1: 0.6235
 epoch: 41, train_loss: 0.4962, test_loss: 0.9258, test_f1: 0.6111
 epoch: 42, train_loss: 0.5170, test_loss: 0.8427, test_f1: 0.6415
 epoch: 43, train_loss: 0.4804, test_loss: 0.8975, test_f1: 0.6347
 epoch: 44, train_loss: 0.4759, test_loss: 0.9968, test_f1: 0.6125
 epoch: 45, train_loss: 0.4846, test_loss: 0.8742, test_f1: 0.6461
 epoch: 46, train_loss: 0.4823, test_loss: 0.8842, test_f1: 0.6710
 epoch: 47, train_loss: 0.4815, test_loss: 1.0080, test_f1: 0.6144
 epoch: 48, train_loss: 0.4654, test_loss: 0.9647, test_f1: 0.6428
 epoch: 49, train_loss: 0.4476, test_loss: 0.9171, test_f1: 0.6430
 epoch: 50, train_loss: 0.4713, test_loss: 0.9982, test_f1: 0.5931
 epoch: 51, train_loss: 0.4245, test_loss: 0.9579, test_f1: 0.6491
 epoch: 52, train_loss: 0.4020, test_loss: 0.9633, test_f1: 0.6462
 epoch: 53, train_loss: 0.3863, test_loss: 1.0004, test_f1: 0.6378
 epoch: 54, train_loss: 0.3803, test_loss: 0.9718, test_f1: 0.6399
 epoch: 55, train_loss: 0.3576, test_loss: 0.9274, test_f1: 0.6374
 epoch: 56, train_loss: 0.3772, test_loss: 1.0361, test_f1: 0.6271
 epoch: 57, train_loss: 0.3666, test_loss: 0.9619, test_f1: 0.6701
 epoch: 58, train_loss: 0.3387, test_loss: 0.9682, test_f1: 0.6500
 epoch: 59, train_loss: 0.3545, test_loss: 0.9975, test_f1: 0.6487
 epoch: 60, train_loss: 0.3583, test_loss: 1.0602, test_f1: 0.6235
 epoch: 61, train_loss: 0.3359, test_loss: 1.0313, test_f1: 0.6462
 epoch: 62, train_loss: 0.3386, test_loss: 1.0184, test_f1: 0.6420
 epoch: 63, train_loss: 0.3322, test_loss: 0.9693, test_f1: 0.6451
 epoch: 64, train_loss: 0.3383, test_loss: 1.0602, test_f1: 0.6434
 epoch: 65, train_loss: 0.3122, test_loss: 1.0548, test_f1: 0.6367
 epoch: 66, train_loss: 0.3251, test_loss: 1.0736, test_f1: 0.6404
 epoch: 67, train_loss: 0.3183, test_loss: 1.0236, test_f1: 0.6672
 epoch: 68, train_loss: 0.3286, test_loss: 1.1089, test_f1: 0.6432
 epoch: 69, train_loss: 0.3203, test_loss: 0.9844, test_f1: 0.6531
 epoch: 70, train_loss: 0.3224, test_loss: 1.0795, test_f1: 0.6484
 epoch: 71, train_loss: 0.3212, test_loss: 1.0418, test_f1: 0.6356
 epoch: 72, train_loss: 0.3168, test_loss: 1.1364, test_f1: 0.6311
 epoch: 73, train_loss: 0.3189, test_loss: 1.0015, test_f1: 0.6672
 epoch: 74, train_loss: 0.3045, test_loss: 1.0274, test_f1: 0.6767
 epoch: 75, train_loss: 0.2898, test_loss: 1.0735, test_f1: 0.6545
 epoch: 76, train_loss: 0.3186, test_loss: 1.0484, test_f1: 0.6390
 epoch: 77, train_loss: 0.2805, test_loss: 1.1030, test_f1: 0.6420
 epoch: 78, train_loss: 0.2767, test_loss: 1.1663, test_f1: 0.6541
 epoch: 79, train_loss: 0.2772, test_loss: 1.1825, test_f1: 0.6052
 epoch: 80, train_loss: 0.2848, test_loss: 1.1313, test_f1: 0.6413
 epoch: 81, train_loss: 0.2947, test_loss: 1.1672, test_f1: 0.6638
 epoch: 82, train_loss: 0.2819, test_loss: 1.0332, test_f1: 0.6785
 epoch: 83, train_loss: 0.2649, test_loss: 1.0747, test_f1: 0.6437
 epoch: 84, train_loss: 0.2593, test_loss: 1.2363, test_f1: 0.6478
 epoch: 85, train_loss: 0.2697, test_loss: 1.1629, test_f1: 0.6391
 epoch: 86, train_loss: 0.2869, test_loss: 1.1398, test_f1: 0.6535
 epoch: 87, train_loss: 0.2587, test_loss: 1.1846, test_f1: 0.6582
 epoch: 88, train_loss: 0.2606, test_loss: 1.2681, test_f1: 0.6295
 epoch: 89, train_loss: 0.2540, test_loss: 1.1930, test_f1: 0.6654
 epoch: 90, train_loss: 0.2572, test_loss: 1.1374, test_f1: 0.6422
 epoch: 91, train_loss: 0.2599, test_loss: 1.2033, test_f1: 0.6701
 epoch: 92, train_loss: 0.2507, test_loss: 1.2735, test_f1: 0.6374
 epoch: 93, train_loss: 0.2457, test_loss: 1.2249, test_f1: 0.6251
 epoch: 94, train_loss: 0.2429, test_loss: 1.2577, test_f1: 0.6439
 epoch: 95, train_loss: 0.2459, test_loss: 1.2894, test_f1: 0.6472
 epoch: 96, train_loss: 0.2401, test_loss: 1.2323, test_f1: 0.6650
 epoch: 97, train_loss: 0.2423, test_loss: 1.3217, test_f1: 0.6101
 epoch: 98, train_loss: 0.2442, test_loss: 1.2977, test_f1: 0.6743
 epoch: 99, train_loss: 0.2303, test_loss: 1.2506, test_f1: 0.6451
##################ITERATION #7 ****************************************
 epoch: 0, train_loss: 1.3064, test_loss: 1.2411, test_f1: 0.3580
 epoch: 1, train_loss: 1.0415, test_loss: 1.3541, test_f1: 0.2766
 epoch: 2, train_loss: 0.9750, test_loss: 1.0589, test_f1: 0.4621
 epoch: 3, train_loss: 0.9231, test_loss: 0.9651, test_f1: 0.5458
 epoch: 4, train_loss: 0.8977, test_loss: 0.9519, test_f1: 0.5386
 epoch: 5, train_loss: 0.8862, test_loss: 0.9541, test_f1: 0.5508
 epoch: 6, train_loss: 0.8801, test_loss: 0.9165, test_f1: 0.5843
 epoch: 7, train_loss: 0.8349, test_loss: 0.9276, test_f1: 0.5728
 epoch: 8, train_loss: 0.8190, test_loss: 0.8807, test_f1: 0.5744
 epoch: 9, train_loss: 0.8133, test_loss: 0.9435, test_f1: 0.5633
 epoch: 10, train_loss: 0.7854, test_loss: 0.8789, test_f1: 0.5965
 epoch: 11, train_loss: 0.7699, test_loss: 0.9276, test_f1: 0.5666
 epoch: 12, train_loss: 0.7525, test_loss: 0.8473, test_f1: 0.6199
 epoch: 13, train_loss: 0.7363, test_loss: 0.9539, test_f1: 0.5925
 epoch: 14, train_loss: 0.7315, test_loss: 0.8798, test_f1: 0.6113
 epoch: 15, train_loss: 0.7192, test_loss: 0.8488, test_f1: 0.6368
 epoch: 16, train_loss: 0.6978, test_loss: 0.9205, test_f1: 0.5869
 epoch: 17, train_loss: 0.6788, test_loss: 0.8872, test_f1: 0.6090
 epoch: 18, train_loss: 0.6842, test_loss: 0.8601, test_f1: 0.6293
 epoch: 19, train_loss: 0.6654, test_loss: 0.8586, test_f1: 0.6271
 epoch: 20, train_loss: 0.6414, test_loss: 0.8341, test_f1: 0.6263
 epoch: 21, train_loss: 0.6601, test_loss: 0.8792, test_f1: 0.6471
 epoch: 22, train_loss: 0.6253, test_loss: 0.8715, test_f1: 0.6289
 epoch: 23, train_loss: 0.6478, test_loss: 0.8839, test_f1: 0.6167
 epoch: 24, train_loss: 0.6520, test_loss: 0.9585, test_f1: 0.6032
 epoch: 25, train_loss: 0.6383, test_loss: 0.9035, test_f1: 0.6132
 epoch: 26, train_loss: 0.6191, test_loss: 0.8588, test_f1: 0.6091
 epoch: 27, train_loss: 0.5898, test_loss: 0.8256, test_f1: 0.6450
 epoch: 28, train_loss: 0.5822, test_loss: 0.9202, test_f1: 0.6162
 epoch: 29, train_loss: 0.5924, test_loss: 0.8718, test_f1: 0.6463
 epoch: 30, train_loss: 0.5877, test_loss: 0.8622, test_f1: 0.6048
 epoch: 31, train_loss: 0.5895, test_loss: 0.8672, test_f1: 0.6442
 epoch: 32, train_loss: 0.5477, test_loss: 0.9037, test_f1: 0.6285
 epoch: 33, train_loss: 0.5506, test_loss: 0.8295, test_f1: 0.6619
 epoch: 34, train_loss: 0.5171, test_loss: 0.8805, test_f1: 0.6212
 epoch: 35, train_loss: 0.5307, test_loss: 0.8597, test_f1: 0.6562
 epoch: 36, train_loss: 0.5180, test_loss: 0.9057, test_f1: 0.6614
 epoch: 37, train_loss: 0.5207, test_loss: 0.8651, test_f1: 0.6555
 epoch: 38, train_loss: 0.5220, test_loss: 0.8937, test_f1: 0.6451
 epoch: 39, train_loss: 0.5186, test_loss: 0.8837, test_f1: 0.6554
 epoch: 40, train_loss: 0.4991, test_loss: 0.8411, test_f1: 0.6530
 epoch: 41, train_loss: 0.4807, test_loss: 0.8798, test_f1: 0.6549
 epoch: 42, train_loss: 0.4818, test_loss: 0.8998, test_f1: 0.6783
 epoch: 43, train_loss: 0.4696, test_loss: 0.9455, test_f1: 0.6398
 epoch: 44, train_loss: 0.4790, test_loss: 0.8871, test_f1: 0.6696
 epoch: 45, train_loss: 0.4869, test_loss: 1.0817, test_f1: 0.6166
 epoch: 46, train_loss: 0.4571, test_loss: 0.8255, test_f1: 0.6620
 epoch: 47, train_loss: 0.4659, test_loss: 0.9584, test_f1: 0.6674
 epoch: 48, train_loss: 0.4492, test_loss: 0.9912, test_f1: 0.6277
 epoch: 49, train_loss: 0.4574, test_loss: 0.9687, test_f1: 0.6453
 epoch: 50, train_loss: 0.4584, test_loss: 0.8914, test_f1: 0.6805
 epoch: 51, train_loss: 0.4142, test_loss: 0.9151, test_f1: 0.6858
 epoch: 52, train_loss: 0.3962, test_loss: 0.8937, test_f1: 0.6838
 epoch: 53, train_loss: 0.3740, test_loss: 0.9493, test_f1: 0.6760
 epoch: 54, train_loss: 0.3770, test_loss: 0.9631, test_f1: 0.6699
 epoch: 55, train_loss: 0.3653, test_loss: 0.9524, test_f1: 0.6939
 epoch: 56, train_loss: 0.3544, test_loss: 1.0026, test_f1: 0.6887
 epoch: 57, train_loss: 0.3528, test_loss: 0.9950, test_f1: 0.6646
 epoch: 58, train_loss: 0.3434, test_loss: 1.0179, test_f1: 0.6816
 epoch: 59, train_loss: 0.3401, test_loss: 0.9621, test_f1: 0.6827
 epoch: 60, train_loss: 0.3368, test_loss: 0.9790, test_f1: 0.7050
 epoch: 61, train_loss: 0.3317, test_loss: 1.0020, test_f1: 0.6850
 epoch: 62, train_loss: 0.3419, test_loss: 1.0323, test_f1: 0.6956
 epoch: 63, train_loss: 0.3287, test_loss: 1.0267, test_f1: 0.6881
 epoch: 64, train_loss: 0.3236, test_loss: 1.0232, test_f1: 0.6729
 epoch: 65, train_loss: 0.3372, test_loss: 1.0366, test_f1: 0.6707
 epoch: 66, train_loss: 0.3364, test_loss: 1.0097, test_f1: 0.6631
 epoch: 67, train_loss: 0.3150, test_loss: 1.0006, test_f1: 0.7027
 epoch: 68, train_loss: 0.3152, test_loss: 1.0184, test_f1: 0.6762
 epoch: 69, train_loss: 0.3013, test_loss: 1.0331, test_f1: 0.6905
 epoch: 70, train_loss: 0.2974, test_loss: 1.0328, test_f1: 0.6777
 epoch: 71, train_loss: 0.3097, test_loss: 1.0709, test_f1: 0.6853
 epoch: 72, train_loss: 0.3080, test_loss: 1.0151, test_f1: 0.6819
 epoch: 73, train_loss: 0.2867, test_loss: 1.1443, test_f1: 0.6683
 epoch: 74, train_loss: 0.2959, test_loss: 1.0127, test_f1: 0.6969
 epoch: 75, train_loss: 0.2849, test_loss: 1.0179, test_f1: 0.7146
 epoch: 76, train_loss: 0.2821, test_loss: 1.1484, test_f1: 0.6675
 epoch: 77, train_loss: 0.2785, test_loss: 1.1833, test_f1: 0.6849
 epoch: 78, train_loss: 0.2938, test_loss: 1.1007, test_f1: 0.6921
 epoch: 79, train_loss: 0.2891, test_loss: 1.0862, test_f1: 0.6948
 epoch: 80, train_loss: 0.2783, test_loss: 1.0741, test_f1: 0.6926
 epoch: 81, train_loss: 0.2674, test_loss: 1.1023, test_f1: 0.6828
 epoch: 82, train_loss: 0.2749, test_loss: 1.1346, test_f1: 0.6883
 epoch: 83, train_loss: 0.2792, test_loss: 1.0906, test_f1: 0.6954
 epoch: 84, train_loss: 0.2889, test_loss: 1.0733, test_f1: 0.6659
 epoch: 85, train_loss: 0.2845, test_loss: 1.1093, test_f1: 0.6969
 epoch: 86, train_loss: 0.2622, test_loss: 1.1363, test_f1: 0.6767
 epoch: 87, train_loss: 0.2484, test_loss: 1.1495, test_f1: 0.6657
 epoch: 88, train_loss: 0.2544, test_loss: 1.1258, test_f1: 0.7118
 epoch: 89, train_loss: 0.2307, test_loss: 1.2778, test_f1: 0.6696
 epoch: 90, train_loss: 0.2514, test_loss: 1.2254, test_f1: 0.6688
 epoch: 91, train_loss: 0.2574, test_loss: 1.1688, test_f1: 0.6763
 epoch: 92, train_loss: 0.2578, test_loss: 1.1880, test_f1: 0.6736
 epoch: 93, train_loss: 0.2500, test_loss: 1.1741, test_f1: 0.6768
 epoch: 94, train_loss: 0.2597, test_loss: 1.1873, test_f1: 0.6956
 epoch: 95, train_loss: 0.2592, test_loss: 1.2029, test_f1: 0.6971
 epoch: 96, train_loss: 0.2329, test_loss: 1.1633, test_f1: 0.7023
 epoch: 97, train_loss: 0.2493, test_loss: 1.1354, test_f1: 0.6960
 epoch: 98, train_loss: 0.2395, test_loss: 1.2037, test_f1: 0.7082
 epoch: 99, train_loss: 0.2445, test_loss: 1.3161, test_f1: 0.6584
##################ITERATION #8 ****************************************
 epoch: 0, train_loss: 1.3591, test_loss: 1.2502, test_f1: 0.3223
 epoch: 1, train_loss: 1.0563, test_loss: 1.0424, test_f1: 0.3854
 epoch: 2, train_loss: 0.9844, test_loss: 1.0018, test_f1: 0.5232
 epoch: 3, train_loss: 0.9409, test_loss: 0.9720, test_f1: 0.5488
 epoch: 4, train_loss: 0.9287, test_loss: 0.8972, test_f1: 0.5679
 epoch: 5, train_loss: 0.8930, test_loss: 0.8829, test_f1: 0.5736
 epoch: 6, train_loss: 0.8577, test_loss: 0.8656, test_f1: 0.5729
 epoch: 7, train_loss: 0.8483, test_loss: 0.9317, test_f1: 0.5426
 epoch: 8, train_loss: 0.8373, test_loss: 0.9210, test_f1: 0.5701
 epoch: 9, train_loss: 0.8121, test_loss: 0.8551, test_f1: 0.6039
 epoch: 10, train_loss: 0.8019, test_loss: 0.8746, test_f1: 0.6116
 epoch: 11, train_loss: 0.7893, test_loss: 0.8604, test_f1: 0.6170
 epoch: 12, train_loss: 0.7804, test_loss: 0.8893, test_f1: 0.5871
 epoch: 13, train_loss: 0.7576, test_loss: 0.9203, test_f1: 0.5987
 epoch: 14, train_loss: 0.7439, test_loss: 0.8492, test_f1: 0.6055
 epoch: 15, train_loss: 0.7328, test_loss: 0.8577, test_f1: 0.6104
 epoch: 16, train_loss: 0.7192, test_loss: 0.8616, test_f1: 0.6065
 epoch: 17, train_loss: 0.7066, test_loss: 0.9668, test_f1: 0.5804
 epoch: 18, train_loss: 0.7086, test_loss: 0.8755, test_f1: 0.6013
 epoch: 19, train_loss: 0.6822, test_loss: 0.8773, test_f1: 0.5937
 epoch: 20, train_loss: 0.6975, test_loss: 0.8944, test_f1: 0.5780
 epoch: 21, train_loss: 0.6985, test_loss: 0.8444, test_f1: 0.6218
 epoch: 22, train_loss: 0.6575, test_loss: 0.8687, test_f1: 0.6357
 epoch: 23, train_loss: 0.6465, test_loss: 0.8458, test_f1: 0.6383
 epoch: 24, train_loss: 0.6387, test_loss: 0.8917, test_f1: 0.6098
 epoch: 25, train_loss: 0.6308, test_loss: 0.8592, test_f1: 0.6205
 epoch: 26, train_loss: 0.6240, test_loss: 0.8162, test_f1: 0.6316
 epoch: 27, train_loss: 0.6299, test_loss: 0.8518, test_f1: 0.6103
 epoch: 28, train_loss: 0.6160, test_loss: 0.8451, test_f1: 0.6096
 epoch: 29, train_loss: 0.5987, test_loss: 0.8519, test_f1: 0.6286
 epoch: 30, train_loss: 0.5923, test_loss: 0.8815, test_f1: 0.6080
 epoch: 31, train_loss: 0.5902, test_loss: 0.8895, test_f1: 0.6109
 epoch: 32, train_loss: 0.5817, test_loss: 0.9445, test_f1: 0.5744
 epoch: 33, train_loss: 0.5761, test_loss: 0.8888, test_f1: 0.6372
 epoch: 34, train_loss: 0.5709, test_loss: 1.0483, test_f1: 0.5702
 epoch: 35, train_loss: 0.5414, test_loss: 0.9255, test_f1: 0.6377
 epoch: 36, train_loss: 0.5648, test_loss: 0.9977, test_f1: 0.6060
 epoch: 37, train_loss: 0.5644, test_loss: 0.9509, test_f1: 0.6149
 epoch: 38, train_loss: 0.5390, test_loss: 0.8505, test_f1: 0.6196
 epoch: 39, train_loss: 0.5490, test_loss: 0.9047, test_f1: 0.6449
 epoch: 40, train_loss: 0.5435, test_loss: 0.9006, test_f1: 0.6290
 epoch: 41, train_loss: 0.5317, test_loss: 1.0859, test_f1: 0.5691
 epoch: 42, train_loss: 0.5304, test_loss: 0.9563, test_f1: 0.6220
 epoch: 43, train_loss: 0.5006, test_loss: 0.8889, test_f1: 0.6313
 epoch: 44, train_loss: 0.5048, test_loss: 0.9029, test_f1: 0.6337
 epoch: 45, train_loss: 0.4777, test_loss: 1.0017, test_f1: 0.6169
 epoch: 46, train_loss: 0.5077, test_loss: 0.8561, test_f1: 0.6381
 epoch: 47, train_loss: 0.4815, test_loss: 0.9247, test_f1: 0.6426
 epoch: 48, train_loss: 0.4985, test_loss: 0.9430, test_f1: 0.6284
 epoch: 49, train_loss: 0.4773, test_loss: 0.9511, test_f1: 0.6227
 epoch: 50, train_loss: 0.4713, test_loss: 1.0063, test_f1: 0.6166
 epoch: 51, train_loss: 0.4479, test_loss: 0.9475, test_f1: 0.6480
 epoch: 52, train_loss: 0.3945, test_loss: 0.9830, test_f1: 0.6504
 epoch: 53, train_loss: 0.4002, test_loss: 0.9718, test_f1: 0.6477
 epoch: 54, train_loss: 0.3992, test_loss: 1.0131, test_f1: 0.6286
 epoch: 55, train_loss: 0.3904, test_loss: 0.9685, test_f1: 0.6500
 epoch: 56, train_loss: 0.3902, test_loss: 0.9993, test_f1: 0.6308
 epoch: 57, train_loss: 0.3754, test_loss: 1.0320, test_f1: 0.6437
 epoch: 58, train_loss: 0.3764, test_loss: 1.0503, test_f1: 0.6112
 epoch: 59, train_loss: 0.3539, test_loss: 1.0303, test_f1: 0.6317
 epoch: 60, train_loss: 0.3667, test_loss: 1.0700, test_f1: 0.6291
 epoch: 61, train_loss: 0.3689, test_loss: 1.0425, test_f1: 0.6298
 epoch: 62, train_loss: 0.3481, test_loss: 1.0376, test_f1: 0.6330
 epoch: 63, train_loss: 0.3453, test_loss: 0.9766, test_f1: 0.6670
 epoch: 64, train_loss: 0.3466, test_loss: 1.1156, test_f1: 0.6462
 epoch: 65, train_loss: 0.3407, test_loss: 1.0536, test_f1: 0.6497
 epoch: 66, train_loss: 0.3516, test_loss: 1.0308, test_f1: 0.6544
 epoch: 67, train_loss: 0.3459, test_loss: 1.0832, test_f1: 0.6257
 epoch: 68, train_loss: 0.3366, test_loss: 1.0991, test_f1: 0.6416
 epoch: 69, train_loss: 0.3345, test_loss: 1.0365, test_f1: 0.6689
 epoch: 70, train_loss: 0.3153, test_loss: 1.1613, test_f1: 0.6289
 epoch: 71, train_loss: 0.3165, test_loss: 1.0870, test_f1: 0.6549
 epoch: 72, train_loss: 0.3293, test_loss: 1.0966, test_f1: 0.6433
 epoch: 73, train_loss: 0.3369, test_loss: 1.2188, test_f1: 0.6336
 epoch: 74, train_loss: 0.3277, test_loss: 1.1900, test_f1: 0.6419
 epoch: 75, train_loss: 0.3176, test_loss: 1.0890, test_f1: 0.6470
 epoch: 76, train_loss: 0.3024, test_loss: 1.2246, test_f1: 0.6402
 epoch: 77, train_loss: 0.3228, test_loss: 1.1238, test_f1: 0.6549
 epoch: 78, train_loss: 0.3205, test_loss: 1.2402, test_f1: 0.6317
 epoch: 79, train_loss: 0.3058, test_loss: 1.1351, test_f1: 0.6596
 epoch: 80, train_loss: 0.2855, test_loss: 1.1838, test_f1: 0.6349
 epoch: 81, train_loss: 0.2811, test_loss: 1.2227, test_f1: 0.6538
 epoch: 82, train_loss: 0.2960, test_loss: 1.4726, test_f1: 0.6146
 epoch: 83, train_loss: 0.3338, test_loss: 1.2522, test_f1: 0.6308
 epoch: 84, train_loss: 0.2852, test_loss: 1.1802, test_f1: 0.6493
 epoch: 85, train_loss: 0.2792, test_loss: 1.1692, test_f1: 0.6464
 epoch: 86, train_loss: 0.2720, test_loss: 1.1955, test_f1: 0.6335
 epoch: 87, train_loss: 0.2979, test_loss: 1.2165, test_f1: 0.6334
 epoch: 88, train_loss: 0.2847, test_loss: 1.1566, test_f1: 0.6573
 epoch: 89, train_loss: 0.2766, test_loss: 1.2188, test_f1: 0.6340
 epoch: 90, train_loss: 0.2768, test_loss: 1.3528, test_f1: 0.6404
 epoch: 91, train_loss: 0.2741, test_loss: 1.2122, test_f1: 0.6355
 epoch: 92, train_loss: 0.2610, test_loss: 1.3664, test_f1: 0.6330
 epoch: 93, train_loss: 0.2763, test_loss: 1.3194, test_f1: 0.6300
 epoch: 94, train_loss: 0.2712, test_loss: 1.2023, test_f1: 0.6658
 epoch: 95, train_loss: 0.2745, test_loss: 1.2900, test_f1: 0.6560
 epoch: 96, train_loss: 0.2585, test_loss: 1.4146, test_f1: 0.6332
 epoch: 97, train_loss: 0.2501, test_loss: 1.3443, test_f1: 0.6417
 epoch: 98, train_loss: 0.2721, test_loss: 1.2031, test_f1: 0.6740
 epoch: 99, train_loss: 0.2787, test_loss: 1.4053, test_f1: 0.6502
##################ITERATION #9 ****************************************
 epoch: 0, train_loss: 1.4687, test_loss: 1.2771, test_f1: 0.2917
 epoch: 1, train_loss: 1.0896, test_loss: 1.0877, test_f1: 0.4382
 epoch: 2, train_loss: 1.0182, test_loss: 0.9891, test_f1: 0.5241
 epoch: 3, train_loss: 0.9820, test_loss: 1.0315, test_f1: 0.4839
 epoch: 4, train_loss: 0.9519, test_loss: 0.9836, test_f1: 0.5289
 epoch: 5, train_loss: 0.9472, test_loss: 0.9759, test_f1: 0.5500
 epoch: 6, train_loss: 0.9151, test_loss: 0.9551, test_f1: 0.5453
 epoch: 7, train_loss: 0.8805, test_loss: 0.9567, test_f1: 0.5710
 epoch: 8, train_loss: 0.8586, test_loss: 0.9093, test_f1: 0.5711
 epoch: 9, train_loss: 0.8434, test_loss: 0.9284, test_f1: 0.6184
 epoch: 10, train_loss: 0.8284, test_loss: 0.8943, test_f1: 0.5770
 epoch: 11, train_loss: 0.7922, test_loss: 0.8739, test_f1: 0.6083
 epoch: 12, train_loss: 0.7739, test_loss: 0.9050, test_f1: 0.5965
 epoch: 13, train_loss: 0.7703, test_loss: 0.9646, test_f1: 0.5698
 epoch: 14, train_loss: 0.7648, test_loss: 0.8859, test_f1: 0.5812
 epoch: 15, train_loss: 0.7491, test_loss: 0.9061, test_f1: 0.6068
 epoch: 16, train_loss: 0.7322, test_loss: 0.8590, test_f1: 0.6129
 epoch: 17, train_loss: 0.7138, test_loss: 0.9233, test_f1: 0.5657
 epoch: 18, train_loss: 0.7082, test_loss: 0.9383, test_f1: 0.5974
 epoch: 19, train_loss: 0.7012, test_loss: 0.9037, test_f1: 0.6135
 epoch: 20, train_loss: 0.6906, test_loss: 0.8382, test_f1: 0.6030
 epoch: 21, train_loss: 0.6752, test_loss: 0.8735, test_f1: 0.6046
 epoch: 22, train_loss: 0.6913, test_loss: 0.8949, test_f1: 0.5916
 epoch: 23, train_loss: 0.6901, test_loss: 0.8483, test_f1: 0.6330
 epoch: 24, train_loss: 0.6715, test_loss: 0.8620, test_f1: 0.6358
 epoch: 25, train_loss: 0.6383, test_loss: 0.8652, test_f1: 0.6132
 epoch: 26, train_loss: 0.6330, test_loss: 0.9263, test_f1: 0.6049
 epoch: 27, train_loss: 0.6195, test_loss: 1.0374, test_f1: 0.5781
 epoch: 28, train_loss: 0.6308, test_loss: 0.7847, test_f1: 0.6337
 epoch: 29, train_loss: 0.6257, test_loss: 0.9040, test_f1: 0.6333
 epoch: 30, train_loss: 0.6093, test_loss: 0.8541, test_f1: 0.6042
 epoch: 31, train_loss: 0.5964, test_loss: 0.8710, test_f1: 0.5897
 epoch: 32, train_loss: 0.5867, test_loss: 0.9475, test_f1: 0.6184
 epoch: 33, train_loss: 0.5750, test_loss: 0.9600, test_f1: 0.6096
 epoch: 34, train_loss: 0.5748, test_loss: 0.9505, test_f1: 0.6033
 epoch: 35, train_loss: 0.5668, test_loss: 0.9941, test_f1: 0.6169
 epoch: 36, train_loss: 0.5500, test_loss: 0.7986, test_f1: 0.6478
 epoch: 37, train_loss: 0.5428, test_loss: 1.0423, test_f1: 0.5981
 epoch: 38, train_loss: 0.5402, test_loss: 0.8878, test_f1: 0.6275
 epoch: 39, train_loss: 0.5320, test_loss: 1.0139, test_f1: 0.6232
 epoch: 40, train_loss: 0.5362, test_loss: 0.8850, test_f1: 0.6337
 epoch: 41, train_loss: 0.5329, test_loss: 1.1290, test_f1: 0.6065
 epoch: 42, train_loss: 0.5362, test_loss: 0.9485, test_f1: 0.6201
 epoch: 43, train_loss: 0.5217, test_loss: 0.9949, test_f1: 0.6189
 epoch: 44, train_loss: 0.5105, test_loss: 1.0784, test_f1: 0.5835
 epoch: 45, train_loss: 0.5106, test_loss: 0.9462, test_f1: 0.6235
 epoch: 46, train_loss: 0.4931, test_loss: 0.9246, test_f1: 0.6268
 epoch: 47, train_loss: 0.4943, test_loss: 0.8870, test_f1: 0.6413
 epoch: 48, train_loss: 0.4976, test_loss: 1.0854, test_f1: 0.5396
 epoch: 49, train_loss: 0.5264, test_loss: 0.9709, test_f1: 0.6284
 epoch: 50, train_loss: 0.4495, test_loss: 0.9713, test_f1: 0.6403
 epoch: 51, train_loss: 0.4306, test_loss: 0.9429, test_f1: 0.6503
 epoch: 52, train_loss: 0.4022, test_loss: 1.0569, test_f1: 0.6293
 epoch: 53, train_loss: 0.3965, test_loss: 1.0260, test_f1: 0.6472
 epoch: 54, train_loss: 0.3918, test_loss: 0.9867, test_f1: 0.6459
 epoch: 55, train_loss: 0.3797, test_loss: 1.0015, test_f1: 0.6489
 epoch: 56, train_loss: 0.3837, test_loss: 1.0637, test_f1: 0.6322
 epoch: 57, train_loss: 0.3659, test_loss: 1.0235, test_f1: 0.6433
 epoch: 58, train_loss: 0.3612, test_loss: 1.1017, test_f1: 0.6367
 epoch: 59, train_loss: 0.3627, test_loss: 1.1571, test_f1: 0.6377
 epoch: 60, train_loss: 0.3731, test_loss: 0.9909, test_f1: 0.6492
 epoch: 61, train_loss: 0.3354, test_loss: 1.2985, test_f1: 0.6284
 epoch: 62, train_loss: 0.3667, test_loss: 1.1406, test_f1: 0.6381
 epoch: 63, train_loss: 0.3512, test_loss: 1.1703, test_f1: 0.6327
 epoch: 64, train_loss: 0.3481, test_loss: 1.0457, test_f1: 0.6587
 epoch: 65, train_loss: 0.3378, test_loss: 1.1578, test_f1: 0.6339
 epoch: 66, train_loss: 0.3480, test_loss: 1.0931, test_f1: 0.6339
 epoch: 67, train_loss: 0.3341, test_loss: 1.1070, test_f1: 0.6427
 epoch: 68, train_loss: 0.3436, test_loss: 1.0852, test_f1: 0.6293
 epoch: 69, train_loss: 0.3490, test_loss: 1.2007, test_f1: 0.6397
 epoch: 70, train_loss: 0.3250, test_loss: 1.1137, test_f1: 0.6368
 epoch: 71, train_loss: 0.3102, test_loss: 1.1829, test_f1: 0.6463
 epoch: 72, train_loss: 0.3365, test_loss: 0.9892, test_f1: 0.6636
 epoch: 73, train_loss: 0.3212, test_loss: 1.1992, test_f1: 0.6257
 epoch: 74, train_loss: 0.3169, test_loss: 1.1155, test_f1: 0.6401
 epoch: 75, train_loss: 0.3140, test_loss: 1.2467, test_f1: 0.6176
 epoch: 76, train_loss: 0.3127, test_loss: 1.1026, test_f1: 0.6509
 epoch: 77, train_loss: 0.2946, test_loss: 1.2205, test_f1: 0.6419
 epoch: 78, train_loss: 0.3018, test_loss: 1.2395, test_f1: 0.6622
 epoch: 79, train_loss: 0.2840, test_loss: 1.1904, test_f1: 0.6376
 epoch: 80, train_loss: 0.3083, test_loss: 1.1600, test_f1: 0.6339
 epoch: 81, train_loss: 0.2947, test_loss: 1.1701, test_f1: 0.6453
 epoch: 82, train_loss: 0.2989, test_loss: 1.1404, test_f1: 0.6335
 epoch: 83, train_loss: 0.2886, test_loss: 1.2027, test_f1: 0.6424
 epoch: 84, train_loss: 0.2814, test_loss: 1.1402, test_f1: 0.6451
 epoch: 85, train_loss: 0.2798, test_loss: 1.3425, test_f1: 0.6389
 epoch: 86, train_loss: 0.2843, test_loss: 1.2343, test_f1: 0.6369
 epoch: 87, train_loss: 0.2807, test_loss: 1.2095, test_f1: 0.6571
 epoch: 88, train_loss: 0.2836, test_loss: 1.2518, test_f1: 0.6464
 epoch: 89, train_loss: 0.2861, test_loss: 1.2111, test_f1: 0.6416
 epoch: 90, train_loss: 0.2673, test_loss: 1.2712, test_f1: 0.6291
 epoch: 91, train_loss: 0.2666, test_loss: 1.3661, test_f1: 0.6304
 epoch: 92, train_loss: 0.2639, test_loss: 1.2620, test_f1: 0.6362
 epoch: 93, train_loss: 0.2818, test_loss: 1.2804, test_f1: 0.6135
 epoch: 94, train_loss: 0.2782, test_loss: 1.2562, test_f1: 0.6273
 epoch: 95, train_loss: 0.2661, test_loss: 1.3571, test_f1: 0.6347
 epoch: 96, train_loss: 0.2632, test_loss: 1.3004, test_f1: 0.6281
 epoch: 97, train_loss: 0.2592, test_loss: 1.3933, test_f1: 0.6301
 epoch: 98, train_loss: 0.2697, test_loss: 1.3462, test_f1: 0.6471
 epoch: 99, train_loss: 0.2541, test_loss: 1.4331, test_f1: 0.6492

Training completed in 995.78 seconds
Best F1: 0.7146 at epoch 75
Mean F1 across iterations: 0.6813  0.0148
========================FINAL RESULTS================================
FEGIN weighted F1: 0.7146  0.0148
python main.py --data ltspice_examples --representation component_pin --model FEGIN --layers 5 --hiddens 64 --batch_size 128 --lr 0.001 --emb_size 250 --epochs 100 --save_appendix component_pin_L5_H64_BS128_LR0.001_E250 --no_val
-----



STDERR:
  File "main.py", line 370, in <module>
    main()
  File "main.py", line 254, in main
    dataset = dataset_class(
  File "/home/philip/projects/llm_inference_code_repo/Circuit-Completion-Using-GNNs/component_classification_with_link_prediction_head/evaluation/FEGIN/kernel/circuit_datasets.py", line 15, in __init__
    self.data, self.slices = torch.load(self.processed_paths[0])
  File "/home/philip/.local/lib/python3.8/site-packages/torch/serialization.py", line 1040, in load
    warnings.warn(
  File "/usr/lib/python3.8/warnings.py", line 109, in _showwarnmsg
    sw(msg.message, msg.category, msg.filename, msg.lineno,
  File "main.py", line 47, in warn_with_traceback
    traceback.print_stack(file=log)
/home/philip/projects/llm_inference_code_repo/Circuit-Completion-Using-GNNs/component_classification_with_link_prediction_head/evaluation/FEGIN/kernel/circuit_datasets.py:15: FutureWarning: You are using `torch.load` with `weights_only=False` (the current default value), which uses the default pickle module implicitly. It is possible to construct malicious pickle data which will execute arbitrary code during unpickling (See https://github.com/pytorch/pytorch/blob/main/SECURITY.md#untrusted-models for more details). In a future release, the default value for `weights_only` will be flipped to `True`. This limits the functions that could be executed during unpickling. Arbitrary objects will no longer be allowed to be loaded via this mode unless they are explicitly allowlisted by the user via `torch.serialization.add_safe_globals`. We recommend you start setting `weights_only=True` for any use case where you don't have full control of the loaded file. Please open an issue on GitHub for any issues related to this experimental feature.
  self.data, self.slices = torch.load(self.processed_paths[0])
