STDOUT:
Results will be saved in /home/philip/projects/ltspice_examples_code_repo/Circuit-Completion-Using-GNNs/component_classification_with_link_prediction_head/evaluation/FEGIN/results/model_FEGIN_dataset_ltspice_demos
Command line input: python main.py --data ltspice_demos --representation component_pin --model FEGIN --layers 3 --hiddens 16 --batch_size 128 --lr 0.01 --emb_size 250 --epochs 100 --save_appendix component_pin_L3_H16_BS128_LR0.01_E250 --no_val
 is saved.
-----
ltspice_demos - FEGIN
Using 3 layers, 16 hidden units, h = 2
Loading component_pin representation dataset
ENTERED
Training FEGIN on component_pin representation
Train: 1565, Test: 383
##################ITERATION #0 ****************************************
 epoch: 0, train_loss: 1.2803, test_loss: 1.3145, test_f1: 0.2281
 epoch: 1, train_loss: 1.1925, test_loss: 1.3371, test_f1: 0.2281
 epoch: 2, train_loss: 1.1583, test_loss: 1.3312, test_f1: 0.3515
 epoch: 3, train_loss: 1.1351, test_loss: 1.2409, test_f1: 0.2395
 epoch: 4, train_loss: 1.1163, test_loss: 1.1885, test_f1: 0.3493
 epoch: 5, train_loss: 1.0652, test_loss: 1.1856, test_f1: 0.4468
 epoch: 6, train_loss: 1.0288, test_loss: 1.1506, test_f1: 0.4284
 epoch: 7, train_loss: 0.9827, test_loss: 2.0156, test_f1: 0.2543
 epoch: 8, train_loss: 0.9602, test_loss: 3.9962, test_f1: 0.1530
 epoch: 9, train_loss: 0.9485, test_loss: 0.9988, test_f1: 0.5384
 epoch: 10, train_loss: 0.8926, test_loss: 1.0249, test_f1: 0.5526
 epoch: 11, train_loss: 0.8949, test_loss: 1.1391, test_f1: 0.4229
 epoch: 12, train_loss: 0.8721, test_loss: 1.2361, test_f1: 0.5068
 epoch: 13, train_loss: 0.8852, test_loss: 1.3980, test_f1: 0.3904
 epoch: 14, train_loss: 0.8390, test_loss: 1.1181, test_f1: 0.4572
 epoch: 15, train_loss: 0.8223, test_loss: 1.2608, test_f1: 0.4634
 epoch: 16, train_loss: 0.8408, test_loss: 0.9795, test_f1: 0.4435
 epoch: 17, train_loss: 0.7980, test_loss: 1.5846, test_f1: 0.4712
 epoch: 18, train_loss: 0.7745, test_loss: 1.3721, test_f1: 0.5393
 epoch: 19, train_loss: 0.7651, test_loss: 1.4250, test_f1: 0.5508
 epoch: 20, train_loss: 0.7501, test_loss: 1.1514, test_f1: 0.5463
 epoch: 21, train_loss: 0.7775, test_loss: 1.4530, test_f1: 0.4845
 epoch: 22, train_loss: 0.7831, test_loss: 1.5228, test_f1: 0.5649
 epoch: 23, train_loss: 0.7504, test_loss: 1.4040, test_f1: 0.5323
 epoch: 24, train_loss: 0.8172, test_loss: 1.8781, test_f1: 0.3573
 epoch: 25, train_loss: 0.7753, test_loss: 1.3195, test_f1: 0.5252
 epoch: 26, train_loss: 0.7681, test_loss: 1.2074, test_f1: 0.5446
 epoch: 27, train_loss: 0.7413, test_loss: 1.2079, test_f1: 0.4886
 epoch: 28, train_loss: 0.7250, test_loss: 1.4623, test_f1: 0.5780
 epoch: 29, train_loss: 0.7412, test_loss: 1.6198, test_f1: 0.4355
 epoch: 30, train_loss: 0.7440, test_loss: 1.1879, test_f1: 0.5139
 epoch: 31, train_loss: 0.7258, test_loss: 1.2498, test_f1: 0.5486
 epoch: 32, train_loss: 0.7167, test_loss: 1.3366, test_f1: 0.5451
 epoch: 33, train_loss: 0.7066, test_loss: 1.4699, test_f1: 0.5505
 epoch: 34, train_loss: 0.6966, test_loss: 1.7132, test_f1: 0.5238
 epoch: 35, train_loss: 0.7157, test_loss: 1.5915, test_f1: 0.5573
 epoch: 36, train_loss: 0.7206, test_loss: 1.5180, test_f1: 0.5458
 epoch: 37, train_loss: 0.7161, test_loss: 1.9262, test_f1: 0.4763
 epoch: 38, train_loss: 0.7109, test_loss: 1.8193, test_f1: 0.5176
 epoch: 39, train_loss: 0.7053, test_loss: 1.7364, test_f1: 0.5081
 epoch: 40, train_loss: 0.6955, test_loss: 2.0747, test_f1: 0.5552
 epoch: 41, train_loss: 0.6833, test_loss: 1.6977, test_f1: 0.5558
 epoch: 42, train_loss: 0.6875, test_loss: 1.4530, test_f1: 0.5581
 epoch: 43, train_loss: 0.6907, test_loss: 1.6648, test_f1: 0.5683
 epoch: 44, train_loss: 0.6855, test_loss: 1.5099, test_f1: 0.5554
 epoch: 45, train_loss: 0.6973, test_loss: 1.3870, test_f1: 0.5449
 epoch: 46, train_loss: 0.7010, test_loss: 1.6341, test_f1: 0.5364
 epoch: 47, train_loss: 0.7127, test_loss: 1.9926, test_f1: 0.5341
 epoch: 48, train_loss: 0.7129, test_loss: 1.9265, test_f1: 0.5153
 epoch: 49, train_loss: 0.6874, test_loss: 2.1067, test_f1: 0.5844
 epoch: 50, train_loss: 0.6782, test_loss: 1.8524, test_f1: 0.4538
 epoch: 51, train_loss: 0.6736, test_loss: 1.8076, test_f1: 0.5643
 epoch: 52, train_loss: 0.6557, test_loss: 1.7546, test_f1: 0.5524
 epoch: 53, train_loss: 0.6374, test_loss: 1.8838, test_f1: 0.5884
 epoch: 54, train_loss: 0.6411, test_loss: 2.0231, test_f1: 0.5731
 epoch: 55, train_loss: 0.6367, test_loss: 1.9086, test_f1: 0.5763
 epoch: 56, train_loss: 0.6373, test_loss: 1.7046, test_f1: 0.5870
 epoch: 57, train_loss: 0.6426, test_loss: 1.8757, test_f1: 0.5979
 epoch: 58, train_loss: 0.6316, test_loss: 2.1969, test_f1: 0.5621
 epoch: 59, train_loss: 0.6262, test_loss: 1.9064, test_f1: 0.5407
 epoch: 60, train_loss: 0.6361, test_loss: 2.1053, test_f1: 0.5745
 epoch: 61, train_loss: 0.6354, test_loss: 1.9960, test_f1: 0.5840
 epoch: 62, train_loss: 0.6343, test_loss: 2.3636, test_f1: 0.5842
 epoch: 63, train_loss: 0.6272, test_loss: 2.0917, test_f1: 0.5625
 epoch: 64, train_loss: 0.6155, test_loss: 2.1924, test_f1: 0.5663
 epoch: 65, train_loss: 0.6355, test_loss: 2.1102, test_f1: 0.5526
 epoch: 66, train_loss: 0.6082, test_loss: 2.3433, test_f1: 0.5778
 epoch: 67, train_loss: 0.6340, test_loss: 2.3541, test_f1: 0.4875
 epoch: 68, train_loss: 0.6394, test_loss: 2.4400, test_f1: 0.5601
 epoch: 69, train_loss: 0.6202, test_loss: 2.2299, test_f1: 0.5724
 epoch: 70, train_loss: 0.6229, test_loss: 2.4401, test_f1: 0.5869
 epoch: 71, train_loss: 0.6225, test_loss: 1.7367, test_f1: 0.5734
 epoch: 72, train_loss: 0.6079, test_loss: 1.8365, test_f1: 0.6184
 epoch: 73, train_loss: 0.6168, test_loss: 1.8994, test_f1: 0.6205
 epoch: 74, train_loss: 0.6078, test_loss: 1.8986, test_f1: 0.5708
 epoch: 75, train_loss: 0.6083, test_loss: 1.9609, test_f1: 0.5980
 epoch: 76, train_loss: 0.5913, test_loss: 2.1809, test_f1: 0.5901
 epoch: 77, train_loss: 0.5828, test_loss: 2.2875, test_f1: 0.6107
 epoch: 78, train_loss: 0.6013, test_loss: 2.5083, test_f1: 0.6021
 epoch: 79, train_loss: 0.6120, test_loss: 2.2255, test_f1: 0.6038
 epoch: 80, train_loss: 0.6079, test_loss: 1.8054, test_f1: 0.5841
 epoch: 81, train_loss: 0.5950, test_loss: 2.1533, test_f1: 0.5369
 epoch: 82, train_loss: 0.6145, test_loss: 2.2842, test_f1: 0.5852
 epoch: 83, train_loss: 0.6163, test_loss: 1.9807, test_f1: 0.4685
 epoch: 84, train_loss: 0.6267, test_loss: 1.9780, test_f1: 0.6189
 epoch: 85, train_loss: 0.6010, test_loss: 2.0849, test_f1: 0.5959
 epoch: 86, train_loss: 0.5752, test_loss: 2.1148, test_f1: 0.6118
 epoch: 87, train_loss: 0.5811, test_loss: 2.3629, test_f1: 0.5930
 epoch: 88, train_loss: 0.5876, test_loss: 2.0406, test_f1: 0.5611
 epoch: 89, train_loss: 0.5665, test_loss: 1.9962, test_f1: 0.5720
 epoch: 90, train_loss: 0.5851, test_loss: 2.4230, test_f1: 0.5396
 epoch: 91, train_loss: 0.5796, test_loss: 2.7377, test_f1: 0.5834
 epoch: 92, train_loss: 0.5832, test_loss: 2.8016, test_f1: 0.5678
 epoch: 93, train_loss: 0.5938, test_loss: 1.9523, test_f1: 0.5912
 epoch: 94, train_loss: 0.6168, test_loss: 1.8761, test_f1: 0.6312
 epoch: 95, train_loss: 0.5912, test_loss: 1.8252, test_f1: 0.6483
 epoch: 96, train_loss: 0.5538, test_loss: 1.8009, test_f1: 0.6351
 epoch: 97, train_loss: 0.5648, test_loss: 1.7382, test_f1: 0.6265
 epoch: 98, train_loss: 0.5512, test_loss: 2.3144, test_f1: 0.6012
 epoch: 99, train_loss: 0.6259, test_loss: 2.0882, test_f1: 0.5466
##################ITERATION #1 ****************************************
 epoch: 0, train_loss: 1.1886, test_loss: 1.4421, test_f1: 0.3135
 epoch: 1, train_loss: 1.0707, test_loss: 1.4734, test_f1: 0.3416
 epoch: 2, train_loss: 1.0112, test_loss: 1.3316, test_f1: 0.2644
 epoch: 3, train_loss: 0.9634, test_loss: 1.0760, test_f1: 0.4755
 epoch: 4, train_loss: 0.9348, test_loss: 1.0345, test_f1: 0.5246
 epoch: 5, train_loss: 0.9057, test_loss: 1.0931, test_f1: 0.4892
 epoch: 6, train_loss: 0.8894, test_loss: 1.0657, test_f1: 0.5214
 epoch: 7, train_loss: 0.8767, test_loss: 1.1216, test_f1: 0.4851
 epoch: 8, train_loss: 0.8692, test_loss: 0.9984, test_f1: 0.5208
 epoch: 9, train_loss: 0.8634, test_loss: 1.1048, test_f1: 0.4554
 epoch: 10, train_loss: 0.8237, test_loss: 1.0874, test_f1: 0.4643
 epoch: 11, train_loss: 0.8092, test_loss: 1.0151, test_f1: 0.4945
 epoch: 12, train_loss: 0.8448, test_loss: 1.3719, test_f1: 0.4335
 epoch: 13, train_loss: 0.8511, test_loss: 1.3603, test_f1: 0.4066
 epoch: 14, train_loss: 0.8174, test_loss: 1.1391, test_f1: 0.4811
 epoch: 15, train_loss: 0.8195, test_loss: 1.1192, test_f1: 0.4930
 epoch: 16, train_loss: 0.8069, test_loss: 1.5073, test_f1: 0.4278
 epoch: 17, train_loss: 0.7959, test_loss: 0.9734, test_f1: 0.5875
 epoch: 18, train_loss: 0.8163, test_loss: 1.0066, test_f1: 0.5899
 epoch: 19, train_loss: 0.8016, test_loss: 1.0410, test_f1: 0.5010
 epoch: 20, train_loss: 0.7730, test_loss: 0.9462, test_f1: 0.5493
 epoch: 21, train_loss: 0.7544, test_loss: 1.0354, test_f1: 0.5370
 epoch: 22, train_loss: 0.7535, test_loss: 1.0943, test_f1: 0.4909
 epoch: 23, train_loss: 0.7459, test_loss: 1.0425, test_f1: 0.5057
 epoch: 24, train_loss: 0.7323, test_loss: 1.1014, test_f1: 0.5484
 epoch: 25, train_loss: 0.7369, test_loss: 1.0797, test_f1: 0.4907
 epoch: 26, train_loss: 0.7537, test_loss: 0.9834, test_f1: 0.6124
 epoch: 27, train_loss: 0.7286, test_loss: 1.1927, test_f1: 0.5046
 epoch: 28, train_loss: 0.7406, test_loss: 1.0976, test_f1: 0.5982
 epoch: 29, train_loss: 0.7406, test_loss: 1.0522, test_f1: 0.5832
 epoch: 30, train_loss: 0.7311, test_loss: 0.8896, test_f1: 0.5139
 epoch: 31, train_loss: 0.7148, test_loss: 1.0160, test_f1: 0.5594
 epoch: 32, train_loss: 0.7585, test_loss: 1.5521, test_f1: 0.5204
 epoch: 33, train_loss: 0.7561, test_loss: 1.2660, test_f1: 0.5173
 epoch: 34, train_loss: 0.7338, test_loss: 1.1358, test_f1: 0.5586
 epoch: 35, train_loss: 0.7206, test_loss: 1.2802, test_f1: 0.5180
 epoch: 36, train_loss: 0.7180, test_loss: 0.9200, test_f1: 0.5774
 epoch: 37, train_loss: 0.7189, test_loss: 0.9462, test_f1: 0.6167
 epoch: 38, train_loss: 0.7216, test_loss: 1.5360, test_f1: 0.4749
 epoch: 39, train_loss: 0.7244, test_loss: 1.0061, test_f1: 0.6028
 epoch: 40, train_loss: 0.7229, test_loss: 1.3186, test_f1: 0.5039
 epoch: 41, train_loss: 0.7962, test_loss: 1.1793, test_f1: 0.5061
 epoch: 42, train_loss: 0.7862, test_loss: 1.0036, test_f1: 0.5736
 epoch: 43, train_loss: 0.7910, test_loss: 1.0774, test_f1: 0.5396
 epoch: 44, train_loss: 0.7644, test_loss: 0.9059, test_f1: 0.6184
 epoch: 45, train_loss: 0.7409, test_loss: 0.8969, test_f1: 0.6257
 epoch: 46, train_loss: 0.7170, test_loss: 0.9783, test_f1: 0.6102
 epoch: 47, train_loss: 0.7285, test_loss: 0.9902, test_f1: 0.5847
 epoch: 48, train_loss: 0.7035, test_loss: 0.9875, test_f1: 0.5967
 epoch: 49, train_loss: 0.7014, test_loss: 0.9412, test_f1: 0.5975
 epoch: 50, train_loss: 0.8004, test_loss: 1.1685, test_f1: 0.5184
 epoch: 51, train_loss: 0.7805, test_loss: 0.9225, test_f1: 0.5852
 epoch: 52, train_loss: 0.7391, test_loss: 0.9152, test_f1: 0.6082
 epoch: 53, train_loss: 0.7187, test_loss: 0.9831, test_f1: 0.5445
 epoch: 54, train_loss: 0.6939, test_loss: 0.9593, test_f1: 0.5922
 epoch: 55, train_loss: 0.7030, test_loss: 1.0682, test_f1: 0.5646
 epoch: 56, train_loss: 0.6847, test_loss: 0.9647, test_f1: 0.5777
 epoch: 57, train_loss: 0.6848, test_loss: 1.0017, test_f1: 0.6089
 epoch: 58, train_loss: 0.6804, test_loss: 1.0076, test_f1: 0.5880
 epoch: 59, train_loss: 0.6706, test_loss: 1.1007, test_f1: 0.5810
 epoch: 60, train_loss: 0.6697, test_loss: 1.0654, test_f1: 0.5932
 epoch: 61, train_loss: 0.6862, test_loss: 1.0944, test_f1: 0.5741
 epoch: 62, train_loss: 0.6855, test_loss: 0.9975, test_f1: 0.6090
 epoch: 63, train_loss: 0.6576, test_loss: 0.9945, test_f1: 0.5998
 epoch: 64, train_loss: 0.6581, test_loss: 1.1799, test_f1: 0.5739
 epoch: 65, train_loss: 0.6648, test_loss: 1.1482, test_f1: 0.6255
 epoch: 66, train_loss: 0.6636, test_loss: 1.0298, test_f1: 0.6327
 epoch: 67, train_loss: 0.6694, test_loss: 1.1083, test_f1: 0.6128
 epoch: 68, train_loss: 0.6613, test_loss: 1.0889, test_f1: 0.6108
 epoch: 69, train_loss: 0.6386, test_loss: 1.0815, test_f1: 0.6248
 epoch: 70, train_loss: 0.6367, test_loss: 1.1230, test_f1: 0.6323
 epoch: 71, train_loss: 0.6428, test_loss: 1.0862, test_f1: 0.6463
 epoch: 72, train_loss: 0.6424, test_loss: 1.1446, test_f1: 0.6260
 epoch: 73, train_loss: 0.6515, test_loss: 1.0160, test_f1: 0.6022
 epoch: 74, train_loss: 0.6382, test_loss: 1.1710, test_f1: 0.6049
 epoch: 75, train_loss: 0.6507, test_loss: 1.0612, test_f1: 0.5906
 epoch: 76, train_loss: 0.6517, test_loss: 0.9599, test_f1: 0.6737
 epoch: 77, train_loss: 0.6540, test_loss: 1.1592, test_f1: 0.5864
 epoch: 78, train_loss: 0.6111, test_loss: 1.1440, test_f1: 0.6101
 epoch: 79, train_loss: 0.6316, test_loss: 1.1312, test_f1: 0.5970
 epoch: 80, train_loss: 0.6273, test_loss: 1.0764, test_f1: 0.6058
 epoch: 81, train_loss: 0.6571, test_loss: 1.4317, test_f1: 0.5290
 epoch: 82, train_loss: 0.6611, test_loss: 1.0122, test_f1: 0.6200
 epoch: 83, train_loss: 0.6681, test_loss: 1.1674, test_f1: 0.5500
 epoch: 84, train_loss: 0.6463, test_loss: 1.0488, test_f1: 0.6120
 epoch: 85, train_loss: 0.6336, test_loss: 1.0918, test_f1: 0.6180
 epoch: 86, train_loss: 0.6177, test_loss: 1.1885, test_f1: 0.5399
 epoch: 87, train_loss: 0.6291, test_loss: 1.0881, test_f1: 0.6316
 epoch: 88, train_loss: 0.6130, test_loss: 1.1858, test_f1: 0.5612
 epoch: 89, train_loss: 0.6003, test_loss: 1.0948, test_f1: 0.6162
 epoch: 90, train_loss: 0.5774, test_loss: 1.1282, test_f1: 0.6266
 epoch: 91, train_loss: 0.5937, test_loss: 1.0995, test_f1: 0.6150
 epoch: 92, train_loss: 0.5945, test_loss: 1.3728, test_f1: 0.6075
 epoch: 93, train_loss: 0.6184, test_loss: 1.2799, test_f1: 0.6240
 epoch: 94, train_loss: 0.5924, test_loss: 1.2440, test_f1: 0.6535
 epoch: 95, train_loss: 0.6021, test_loss: 1.3782, test_f1: 0.5851
 epoch: 96, train_loss: 0.5968, test_loss: 1.4285, test_f1: 0.5333
 epoch: 97, train_loss: 0.5799, test_loss: 1.3473, test_f1: 0.5378
 epoch: 98, train_loss: 0.5950, test_loss: 1.0448, test_f1: 0.6224
 epoch: 99, train_loss: 0.5905, test_loss: 1.1194, test_f1: 0.6113
##################ITERATION #2 ****************************************
 epoch: 0, train_loss: 1.2838, test_loss: 1.2935, test_f1: 0.2281
 epoch: 1, train_loss: 1.1584, test_loss: 1.2960, test_f1: 0.2595
 epoch: 2, train_loss: 1.1206, test_loss: 1.2051, test_f1: 0.3265
 epoch: 3, train_loss: 1.0792, test_loss: 1.1671, test_f1: 0.4886
 epoch: 4, train_loss: 1.0289, test_loss: 1.1497, test_f1: 0.4414
 epoch: 5, train_loss: 0.9875, test_loss: 1.1806, test_f1: 0.4500
 epoch: 6, train_loss: 0.9697, test_loss: 1.0945, test_f1: 0.5299
 epoch: 7, train_loss: 0.9357, test_loss: 1.1480, test_f1: 0.4532
 epoch: 8, train_loss: 0.8864, test_loss: 1.1686, test_f1: 0.4338
 epoch: 9, train_loss: 0.8842, test_loss: 1.0798, test_f1: 0.5907
 epoch: 10, train_loss: 0.8652, test_loss: 1.1775, test_f1: 0.5730
 epoch: 11, train_loss: 0.8696, test_loss: 1.0621, test_f1: 0.5635
 epoch: 12, train_loss: 0.8566, test_loss: 1.1277, test_f1: 0.5850
 epoch: 13, train_loss: 0.8473, test_loss: 1.0458, test_f1: 0.4713
 epoch: 14, train_loss: 0.8278, test_loss: 1.1068, test_f1: 0.5284
 epoch: 15, train_loss: 0.8464, test_loss: 1.0216, test_f1: 0.5542
 epoch: 16, train_loss: 0.8178, test_loss: 1.1434, test_f1: 0.5611
 epoch: 17, train_loss: 0.7802, test_loss: 1.4036, test_f1: 0.4932
 epoch: 18, train_loss: 0.7818, test_loss: 1.2948, test_f1: 0.5351
 epoch: 19, train_loss: 0.7850, test_loss: 1.5287, test_f1: 0.4120
 epoch: 20, train_loss: 0.7766, test_loss: 1.5434, test_f1: 0.4818
 epoch: 21, train_loss: 0.7788, test_loss: 1.1589, test_f1: 0.5384
 epoch: 22, train_loss: 0.7779, test_loss: 1.0781, test_f1: 0.5615
 epoch: 23, train_loss: 0.7729, test_loss: 1.3857, test_f1: 0.4720
 epoch: 24, train_loss: 0.7758, test_loss: 1.4559, test_f1: 0.5109
 epoch: 25, train_loss: 0.7616, test_loss: 1.2744, test_f1: 0.5403
 epoch: 26, train_loss: 0.7862, test_loss: 1.1072, test_f1: 0.5536
 epoch: 27, train_loss: 0.7534, test_loss: 1.2478, test_f1: 0.5641
 epoch: 28, train_loss: 0.7549, test_loss: 1.1734, test_f1: 0.5059
 epoch: 29, train_loss: 0.7490, test_loss: 1.1112, test_f1: 0.5771
 epoch: 30, train_loss: 0.7524, test_loss: 1.3603, test_f1: 0.5439
 epoch: 31, train_loss: 0.7350, test_loss: 1.2488, test_f1: 0.5519
 epoch: 32, train_loss: 0.7475, test_loss: 1.2262, test_f1: 0.5682
 epoch: 33, train_loss: 0.7488, test_loss: 1.1011, test_f1: 0.5627
 epoch: 34, train_loss: 0.7303, test_loss: 1.3288, test_f1: 0.5227
 epoch: 35, train_loss: 0.7244, test_loss: 1.3479, test_f1: 0.5629
 epoch: 36, train_loss: 0.7374, test_loss: 1.1980, test_f1: 0.6016
 epoch: 37, train_loss: 0.7228, test_loss: 1.2035, test_f1: 0.6011
 epoch: 38, train_loss: 0.7077, test_loss: 1.3198, test_f1: 0.5943
 epoch: 39, train_loss: 0.6900, test_loss: 1.1612, test_f1: 0.5981
 epoch: 40, train_loss: 0.6910, test_loss: 1.3279, test_f1: 0.5599
 epoch: 41, train_loss: 0.7000, test_loss: 1.7020, test_f1: 0.5787
 epoch: 42, train_loss: 0.7154, test_loss: 1.2688, test_f1: 0.5568
 epoch: 43, train_loss: 0.7578, test_loss: 1.2291, test_f1: 0.5637
 epoch: 44, train_loss: 0.7446, test_loss: 1.2656, test_f1: 0.5848
 epoch: 45, train_loss: 0.7085, test_loss: 1.2235, test_f1: 0.5944
 epoch: 46, train_loss: 0.7051, test_loss: 1.3455, test_f1: 0.5936
 epoch: 47, train_loss: 0.7032, test_loss: 1.3059, test_f1: 0.5738
 epoch: 48, train_loss: 0.6943, test_loss: 1.2855, test_f1: 0.4905
 epoch: 49, train_loss: 0.6886, test_loss: 1.1335, test_f1: 0.6130
 epoch: 50, train_loss: 0.6805, test_loss: 1.1315, test_f1: 0.6009
 epoch: 51, train_loss: 0.6707, test_loss: 1.3116, test_f1: 0.5633
 epoch: 52, train_loss: 0.6696, test_loss: 1.3929, test_f1: 0.6043
 epoch: 53, train_loss: 0.6602, test_loss: 1.1895, test_f1: 0.5997
 epoch: 54, train_loss: 0.6602, test_loss: 1.3185, test_f1: 0.5785
 epoch: 55, train_loss: 0.6463, test_loss: 1.3847, test_f1: 0.6109
 epoch: 56, train_loss: 0.6525, test_loss: 1.3351, test_f1: 0.5771
 epoch: 57, train_loss: 0.6375, test_loss: 1.4937, test_f1: 0.5762
 epoch: 58, train_loss: 0.6478, test_loss: 1.4042, test_f1: 0.5901
 epoch: 59, train_loss: 0.6369, test_loss: 1.3113, test_f1: 0.5678
 epoch: 60, train_loss: 0.6406, test_loss: 1.3546, test_f1: 0.5890
 epoch: 61, train_loss: 0.6330, test_loss: 1.4899, test_f1: 0.5807
 epoch: 62, train_loss: 0.6299, test_loss: 1.4643, test_f1: 0.5900
 epoch: 63, train_loss: 0.6367, test_loss: 1.6238, test_f1: 0.6011
 epoch: 64, train_loss: 0.6152, test_loss: 1.5345, test_f1: 0.5878
 epoch: 65, train_loss: 0.6262, test_loss: 1.5577, test_f1: 0.5804
 epoch: 66, train_loss: 0.6134, test_loss: 1.3721, test_f1: 0.5820
 epoch: 67, train_loss: 0.6132, test_loss: 1.4334, test_f1: 0.6292
 epoch: 68, train_loss: 0.6333, test_loss: 1.5452, test_f1: 0.5549
 epoch: 69, train_loss: 0.6333, test_loss: 1.3323, test_f1: 0.5604
 epoch: 70, train_loss: 0.6449, test_loss: 1.4559, test_f1: 0.5700
 epoch: 71, train_loss: 0.6180, test_loss: 1.1915, test_f1: 0.6089
 epoch: 72, train_loss: 0.6396, test_loss: 1.2292, test_f1: 0.6005
 epoch: 73, train_loss: 0.6349, test_loss: 1.2100, test_f1: 0.5808
 epoch: 74, train_loss: 0.6502, test_loss: 1.2964, test_f1: 0.5603
 epoch: 75, train_loss: 0.6037, test_loss: 1.3854, test_f1: 0.5922
 epoch: 76, train_loss: 0.6008, test_loss: 1.4392, test_f1: 0.5856
 epoch: 77, train_loss: 0.5943, test_loss: 1.5405, test_f1: 0.6079
 epoch: 78, train_loss: 0.5978, test_loss: 1.4179, test_f1: 0.5346
 epoch: 79, train_loss: 0.6017, test_loss: 1.2683, test_f1: 0.5480
 epoch: 80, train_loss: 0.5895, test_loss: 1.1219, test_f1: 0.5987
 epoch: 81, train_loss: 0.6036, test_loss: 1.4967, test_f1: 0.5909
 epoch: 82, train_loss: 0.5994, test_loss: 1.3665, test_f1: 0.5478
 epoch: 83, train_loss: 0.5884, test_loss: 1.3396, test_f1: 0.5761
 epoch: 84, train_loss: 0.5893, test_loss: 1.1197, test_f1: 0.6246
 epoch: 85, train_loss: 0.5949, test_loss: 0.9836, test_f1: 0.6437
 epoch: 86, train_loss: 0.6037, test_loss: 1.1826, test_f1: 0.5540
 epoch: 87, train_loss: 0.5685, test_loss: 1.3489, test_f1: 0.5360
 epoch: 88, train_loss: 0.5865, test_loss: 1.1314, test_f1: 0.5994
 epoch: 89, train_loss: 0.6053, test_loss: 1.2981, test_f1: 0.6194
 epoch: 90, train_loss: 0.5824, test_loss: 1.2903, test_f1: 0.5883
 epoch: 91, train_loss: 0.5817, test_loss: 1.3310, test_f1: 0.5922
 epoch: 92, train_loss: 0.5629, test_loss: 1.4374, test_f1: 0.5547
 epoch: 93, train_loss: 0.5754, test_loss: 1.5717, test_f1: 0.5663
 epoch: 94, train_loss: 0.5844, test_loss: 1.5437, test_f1: 0.5390
 epoch: 95, train_loss: 0.5866, test_loss: 1.3632, test_f1: 0.5995
 epoch: 96, train_loss: 0.5767, test_loss: 1.1591, test_f1: 0.5978
 epoch: 97, train_loss: 0.5526, test_loss: 1.1123, test_f1: 0.5949
 epoch: 98, train_loss: 0.5464, test_loss: 1.2435, test_f1: 0.5687
 epoch: 99, train_loss: 0.6088, test_loss: 1.6643, test_f1: 0.5712
##################ITERATION #3 ****************************************
 epoch: 0, train_loss: 1.2297, test_loss: 1.4012, test_f1: 0.3054
 epoch: 1, train_loss: 1.0397, test_loss: 1.4411, test_f1: 0.2948
 epoch: 2, train_loss: 0.9753, test_loss: 1.7980, test_f1: 0.1716
 epoch: 3, train_loss: 0.9375, test_loss: 1.5607, test_f1: 0.3238
 epoch: 4, train_loss: 0.9006, test_loss: 1.4574, test_f1: 0.3385
 epoch: 5, train_loss: 0.8656, test_loss: 1.2713, test_f1: 0.4674
 epoch: 6, train_loss: 0.8632, test_loss: 1.3860, test_f1: 0.4744
 epoch: 7, train_loss: 0.8641, test_loss: 1.2427, test_f1: 0.4576
 epoch: 8, train_loss: 0.8442, test_loss: 1.2562, test_f1: 0.4983
 epoch: 9, train_loss: 0.8193, test_loss: 1.1155, test_f1: 0.5318
 epoch: 10, train_loss: 0.8128, test_loss: 1.1183, test_f1: 0.5561
 epoch: 11, train_loss: 0.8177, test_loss: 1.2878, test_f1: 0.4703
 epoch: 12, train_loss: 0.7824, test_loss: 1.2731, test_f1: 0.5420
 epoch: 13, train_loss: 0.8133, test_loss: 1.1745, test_f1: 0.5211
 epoch: 14, train_loss: 0.8213, test_loss: 1.0885, test_f1: 0.5642
 epoch: 15, train_loss: 0.8109, test_loss: 1.2008, test_f1: 0.5188
 epoch: 16, train_loss: 0.8193, test_loss: 1.8449, test_f1: 0.2509
 epoch: 17, train_loss: 0.8317, test_loss: 1.2320, test_f1: 0.5270
 epoch: 18, train_loss: 0.7860, test_loss: 1.4094, test_f1: 0.5086
 epoch: 19, train_loss: 0.7814, test_loss: 1.4062, test_f1: 0.4840
 epoch: 20, train_loss: 0.7682, test_loss: 1.3125, test_f1: 0.5111
 epoch: 21, train_loss: 0.7623, test_loss: 1.5305, test_f1: 0.5387
 epoch: 22, train_loss: 0.7883, test_loss: 1.5668, test_f1: 0.4880
 epoch: 23, train_loss: 0.7564, test_loss: 1.2272, test_f1: 0.5352
 epoch: 24, train_loss: 0.7438, test_loss: 1.5713, test_f1: 0.5748
 epoch: 25, train_loss: 0.7673, test_loss: 1.4876, test_f1: 0.5274
 epoch: 26, train_loss: 0.7913, test_loss: 2.1836, test_f1: 0.4384
 epoch: 27, train_loss: 0.7976, test_loss: 1.2518, test_f1: 0.5598
 epoch: 28, train_loss: 0.7699, test_loss: 1.0537, test_f1: 0.5616
 epoch: 29, train_loss: 0.7611, test_loss: 1.1902, test_f1: 0.5378
 epoch: 30, train_loss: 0.7684, test_loss: 1.4343, test_f1: 0.5438
 epoch: 31, train_loss: 0.7593, test_loss: 1.1140, test_f1: 0.5573
 epoch: 32, train_loss: 0.7518, test_loss: 1.0340, test_f1: 0.5691
 epoch: 33, train_loss: 0.7376, test_loss: 1.1947, test_f1: 0.5270
 epoch: 34, train_loss: 0.7419, test_loss: 1.1545, test_f1: 0.5337
 epoch: 35, train_loss: 0.7339, test_loss: 1.2460, test_f1: 0.5392
 epoch: 36, train_loss: 0.7131, test_loss: 1.4825, test_f1: 0.4934
 epoch: 37, train_loss: 0.7267, test_loss: 1.1548, test_f1: 0.5778
 epoch: 38, train_loss: 0.7113, test_loss: 1.2875, test_f1: 0.5244
 epoch: 39, train_loss: 0.7103, test_loss: 1.2712, test_f1: 0.5429
 epoch: 40, train_loss: 0.7177, test_loss: 1.1560, test_f1: 0.5719
 epoch: 41, train_loss: 0.7401, test_loss: 1.2155, test_f1: 0.5094
 epoch: 42, train_loss: 0.7244, test_loss: 1.7846, test_f1: 0.4454
 epoch: 43, train_loss: 0.7017, test_loss: 1.2076, test_f1: 0.5504
 epoch: 44, train_loss: 0.7243, test_loss: 1.4419, test_f1: 0.5684
 epoch: 45, train_loss: 0.7122, test_loss: 1.3189, test_f1: 0.5514
 epoch: 46, train_loss: 0.7202, test_loss: 1.4415, test_f1: 0.5655
 epoch: 47, train_loss: 0.7199, test_loss: 1.4310, test_f1: 0.4902
 epoch: 48, train_loss: 0.7148, test_loss: 1.1497, test_f1: 0.5417
 epoch: 49, train_loss: 0.6851, test_loss: 1.2918, test_f1: 0.5826
 epoch: 50, train_loss: 0.7066, test_loss: 1.4892, test_f1: 0.5682
 epoch: 51, train_loss: 0.7063, test_loss: 1.2863, test_f1: 0.5564
 epoch: 52, train_loss: 0.7019, test_loss: 1.7557, test_f1: 0.4466
 epoch: 53, train_loss: 0.6775, test_loss: 1.3706, test_f1: 0.5661
 epoch: 54, train_loss: 0.6787, test_loss: 1.2009, test_f1: 0.5410
 epoch: 55, train_loss: 0.6813, test_loss: 1.3705, test_f1: 0.5750
 epoch: 56, train_loss: 0.6628, test_loss: 1.3598, test_f1: 0.5705
 epoch: 57, train_loss: 0.6707, test_loss: 1.3076, test_f1: 0.5598
 epoch: 58, train_loss: 0.6678, test_loss: 1.3454, test_f1: 0.5795
 epoch: 59, train_loss: 0.6667, test_loss: 1.3052, test_f1: 0.5500
 epoch: 60, train_loss: 0.6522, test_loss: 1.4370, test_f1: 0.5442
 epoch: 61, train_loss: 0.6546, test_loss: 1.4486, test_f1: 0.5501
 epoch: 62, train_loss: 0.6586, test_loss: 1.3623, test_f1: 0.5648
 epoch: 63, train_loss: 0.6578, test_loss: 1.4149, test_f1: 0.5510
 epoch: 64, train_loss: 0.6764, test_loss: 1.6519, test_f1: 0.5708
 epoch: 65, train_loss: 0.6586, test_loss: 1.3786, test_f1: 0.5284
 epoch: 66, train_loss: 0.6958, test_loss: 1.3765, test_f1: 0.5255
 epoch: 67, train_loss: 0.6899, test_loss: 1.2750, test_f1: 0.5821
 epoch: 68, train_loss: 0.6739, test_loss: 1.2291, test_f1: 0.5614
 epoch: 69, train_loss: 0.6684, test_loss: 1.4024, test_f1: 0.5926
 epoch: 70, train_loss: 0.6725, test_loss: 1.3264, test_f1: 0.5659
 epoch: 71, train_loss: 0.6819, test_loss: 1.3069, test_f1: 0.5790
 epoch: 72, train_loss: 0.6617, test_loss: 1.3422, test_f1: 0.5677
 epoch: 73, train_loss: 0.6518, test_loss: 1.2586, test_f1: 0.5557
 epoch: 74, train_loss: 0.6582, test_loss: 1.5115, test_f1: 0.5805
 epoch: 75, train_loss: 0.6374, test_loss: 1.5895, test_f1: 0.5286
 epoch: 76, train_loss: 0.6462, test_loss: 1.5231, test_f1: 0.5659
 epoch: 77, train_loss: 0.6457, test_loss: 1.5015, test_f1: 0.6028
 epoch: 78, train_loss: 0.6435, test_loss: 1.4089, test_f1: 0.5569
 epoch: 79, train_loss: 0.6423, test_loss: 1.5093, test_f1: 0.5809
 epoch: 80, train_loss: 0.6323, test_loss: 1.2894, test_f1: 0.5538
 epoch: 81, train_loss: 0.6317, test_loss: 1.5557, test_f1: 0.5802
 epoch: 82, train_loss: 0.6399, test_loss: 1.3464, test_f1: 0.5675
 epoch: 83, train_loss: 0.6487, test_loss: 1.9476, test_f1: 0.5000
 epoch: 84, train_loss: 0.6600, test_loss: 1.4102, test_f1: 0.5856
 epoch: 85, train_loss: 0.6646, test_loss: 1.1817, test_f1: 0.5950
 epoch: 86, train_loss: 0.6820, test_loss: 1.4756, test_f1: 0.5155
 epoch: 87, train_loss: 0.6628, test_loss: 3.0726, test_f1: 0.4276
 epoch: 88, train_loss: 0.6628, test_loss: 1.5535, test_f1: 0.5143
 epoch: 89, train_loss: 0.6572, test_loss: 1.7094, test_f1: 0.5825
 epoch: 90, train_loss: 0.6476, test_loss: 1.4611, test_f1: 0.5674
 epoch: 91, train_loss: 0.6570, test_loss: 1.6841, test_f1: 0.5749
 epoch: 92, train_loss: 0.6585, test_loss: 1.3389, test_f1: 0.5438
 epoch: 93, train_loss: 0.6605, test_loss: 1.3672, test_f1: 0.5883
 epoch: 94, train_loss: 0.6470, test_loss: 1.4459, test_f1: 0.5597
 epoch: 95, train_loss: 0.6148, test_loss: 1.4334, test_f1: 0.5676
 epoch: 96, train_loss: 0.6191, test_loss: 1.5006, test_f1: 0.5561
 epoch: 97, train_loss: 0.5983, test_loss: 1.4668, test_f1: 0.5641
 epoch: 98, train_loss: 0.6091, test_loss: 1.5179, test_f1: 0.5601
 epoch: 99, train_loss: 0.6282, test_loss: 1.4132, test_f1: 0.5634
##################ITERATION #4 ****************************************
 epoch: 0, train_loss: 1.2982, test_loss: 1.4454, test_f1: 0.2361
 epoch: 1, train_loss: 1.1003, test_loss: 1.2915, test_f1: 0.2523
 epoch: 2, train_loss: 1.0496, test_loss: 1.2645, test_f1: 0.3415
 epoch: 3, train_loss: 1.0153, test_loss: 1.0765, test_f1: 0.4538
 epoch: 4, train_loss: 0.9923, test_loss: 1.2272, test_f1: 0.3876
 epoch: 5, train_loss: 0.9825, test_loss: 1.1672, test_f1: 0.3644
 epoch: 6, train_loss: 0.8996, test_loss: 1.0004, test_f1: 0.5295
 epoch: 7, train_loss: 0.9136, test_loss: 1.0066, test_f1: 0.5268
 epoch: 8, train_loss: 0.8897, test_loss: 1.0579, test_f1: 0.5454
 epoch: 9, train_loss: 0.9113, test_loss: 1.2194, test_f1: 0.4830
 epoch: 10, train_loss: 0.8911, test_loss: 1.1451, test_f1: 0.4231
 epoch: 11, train_loss: 0.8643, test_loss: 0.9620, test_f1: 0.4898
 epoch: 12, train_loss: 0.8564, test_loss: 1.0221, test_f1: 0.4772
 epoch: 13, train_loss: 0.8503, test_loss: 1.0605, test_f1: 0.5152
 epoch: 14, train_loss: 0.8186, test_loss: 1.0972, test_f1: 0.4698
 epoch: 15, train_loss: 0.8475, test_loss: 1.3694, test_f1: 0.4336
 epoch: 16, train_loss: 0.8423, test_loss: 1.0254, test_f1: 0.5070
 epoch: 17, train_loss: 0.8370, test_loss: 1.0399, test_f1: 0.5905
 epoch: 18, train_loss: 0.7998, test_loss: 1.0371, test_f1: 0.5599
 epoch: 19, train_loss: 0.8248, test_loss: 1.1037, test_f1: 0.5645
 epoch: 20, train_loss: 0.8472, test_loss: 0.9934, test_f1: 0.5851
 epoch: 21, train_loss: 0.8171, test_loss: 1.0665, test_f1: 0.5097
 epoch: 22, train_loss: 0.7792, test_loss: 1.0696, test_f1: 0.4896
 epoch: 23, train_loss: 0.7877, test_loss: 1.2105, test_f1: 0.4943
 epoch: 24, train_loss: 0.7644, test_loss: 1.0395, test_f1: 0.5457
 epoch: 25, train_loss: 0.7609, test_loss: 1.0447, test_f1: 0.5707
 epoch: 26, train_loss: 0.7690, test_loss: 1.1524, test_f1: 0.5515
 epoch: 27, train_loss: 0.8077, test_loss: 1.0005, test_f1: 0.5524
 epoch: 28, train_loss: 0.8283, test_loss: 1.1372, test_f1: 0.5046
 epoch: 29, train_loss: 0.8254, test_loss: 1.0566, test_f1: 0.4954
 epoch: 30, train_loss: 0.7720, test_loss: 1.1189, test_f1: 0.5156
 epoch: 31, train_loss: 0.7521, test_loss: 1.1022, test_f1: 0.5760
 epoch: 32, train_loss: 0.7557, test_loss: 1.0017, test_f1: 0.6132
 epoch: 33, train_loss: 0.7482, test_loss: 1.0959, test_f1: 0.5908
 epoch: 34, train_loss: 0.7356, test_loss: 1.0173, test_f1: 0.6141
 epoch: 35, train_loss: 0.7426, test_loss: 1.0970, test_f1: 0.5839
 epoch: 36, train_loss: 0.7543, test_loss: 1.3590, test_f1: 0.5255
 epoch: 37, train_loss: 0.7639, test_loss: 1.0747, test_f1: 0.5411
 epoch: 38, train_loss: 0.7506, test_loss: 1.1617, test_f1: 0.5414
 epoch: 39, train_loss: 0.7560, test_loss: 1.0387, test_f1: 0.5509
 epoch: 40, train_loss: 0.7532, test_loss: 1.4445, test_f1: 0.4571
 epoch: 41, train_loss: 0.7376, test_loss: 1.0378, test_f1: 0.5907
 epoch: 42, train_loss: 0.7442, test_loss: 1.0624, test_f1: 0.5484
 epoch: 43, train_loss: 0.7359, test_loss: 1.0280, test_f1: 0.5646
 epoch: 44, train_loss: 0.7065, test_loss: 1.1829, test_f1: 0.4946
 epoch: 45, train_loss: 0.7148, test_loss: 1.1494, test_f1: 0.6046
 epoch: 46, train_loss: 0.7087, test_loss: 1.1085, test_f1: 0.5201
 epoch: 47, train_loss: 0.7152, test_loss: 1.0909, test_f1: 0.5363
 epoch: 48, train_loss: 0.7122, test_loss: 1.1689, test_f1: 0.5190
 epoch: 49, train_loss: 0.7789, test_loss: 0.9786, test_f1: 0.5428
 epoch: 50, train_loss: 0.7402, test_loss: 1.2442, test_f1: 0.4894
 epoch: 51, train_loss: 0.7277, test_loss: 1.1704, test_f1: 0.5033
 epoch: 52, train_loss: 0.6988, test_loss: 1.0837, test_f1: 0.5500
 epoch: 53, train_loss: 0.6859, test_loss: 1.1378, test_f1: 0.5363
 epoch: 54, train_loss: 0.6853, test_loss: 1.1358, test_f1: 0.5358
 epoch: 55, train_loss: 0.7055, test_loss: 1.0846, test_f1: 0.5737
 epoch: 56, train_loss: 0.6825, test_loss: 1.0951, test_f1: 0.5681
 epoch: 57, train_loss: 0.6906, test_loss: 1.0591, test_f1: 0.5291
 epoch: 58, train_loss: 0.6841, test_loss: 1.0782, test_f1: 0.5787
 epoch: 59, train_loss: 0.6961, test_loss: 1.1910, test_f1: 0.5798
 epoch: 60, train_loss: 0.6935, test_loss: 1.2028, test_f1: 0.5773
 epoch: 61, train_loss: 0.6904, test_loss: 1.2172, test_f1: 0.5438
 epoch: 62, train_loss: 0.6681, test_loss: 1.1158, test_f1: 0.5688
 epoch: 63, train_loss: 0.6824, test_loss: 1.2427, test_f1: 0.5630
 epoch: 64, train_loss: 0.7153, test_loss: 1.2178, test_f1: 0.5208
 epoch: 65, train_loss: 0.6915, test_loss: 0.9838, test_f1: 0.5734
 epoch: 66, train_loss: 0.6774, test_loss: 1.2165, test_f1: 0.5654
 epoch: 67, train_loss: 0.6624, test_loss: 1.2215, test_f1: 0.5455
 epoch: 68, train_loss: 0.6673, test_loss: 1.2080, test_f1: 0.5580
 epoch: 69, train_loss: 0.6405, test_loss: 1.1047, test_f1: 0.5740
 epoch: 70, train_loss: 0.6633, test_loss: 1.3400, test_f1: 0.5742
 epoch: 71, train_loss: 0.6820, test_loss: 1.1130, test_f1: 0.5599
 epoch: 72, train_loss: 0.6625, test_loss: 1.0621, test_f1: 0.5711
 epoch: 73, train_loss: 0.6743, test_loss: 1.0799, test_f1: 0.5789
 epoch: 74, train_loss: 0.6457, test_loss: 1.0616, test_f1: 0.6094
 epoch: 75, train_loss: 0.6738, test_loss: 1.1711, test_f1: 0.5740
 epoch: 76, train_loss: 0.6623, test_loss: 1.1875, test_f1: 0.5794
 epoch: 77, train_loss: 0.6770, test_loss: 1.1880, test_f1: 0.5964
 epoch: 78, train_loss: 0.6583, test_loss: 1.3648, test_f1: 0.5681
 epoch: 79, train_loss: 0.6495, test_loss: 1.1449, test_f1: 0.5856
 epoch: 80, train_loss: 0.6461, test_loss: 1.1410, test_f1: 0.5770
 epoch: 81, train_loss: 0.6422, test_loss: 1.1785, test_f1: 0.6005
 epoch: 82, train_loss: 0.6477, test_loss: 1.1327, test_f1: 0.6039
 epoch: 83, train_loss: 0.6418, test_loss: 1.1878, test_f1: 0.5771
 epoch: 84, train_loss: 0.6358, test_loss: 1.0859, test_f1: 0.6050
 epoch: 85, train_loss: 0.6430, test_loss: 1.0988, test_f1: 0.5852
 epoch: 86, train_loss: 0.6386, test_loss: 1.2101, test_f1: 0.6009
 epoch: 87, train_loss: 0.6252, test_loss: 1.2429, test_f1: 0.5486
 epoch: 88, train_loss: 0.6188, test_loss: 1.1912, test_f1: 0.5984
 epoch: 89, train_loss: 0.6151, test_loss: 1.3997, test_f1: 0.5495
 epoch: 90, train_loss: 0.6413, test_loss: 1.1555, test_f1: 0.5642
 epoch: 91, train_loss: 0.6590, test_loss: 1.3016, test_f1: 0.5848
 epoch: 92, train_loss: 0.6296, test_loss: 1.3539, test_f1: 0.5488
 epoch: 93, train_loss: 0.6409, test_loss: 1.1891, test_f1: 0.5916
 epoch: 94, train_loss: 0.6254, test_loss: 1.0868, test_f1: 0.6074
 epoch: 95, train_loss: 0.6263, test_loss: 1.2623, test_f1: 0.5521
 epoch: 96, train_loss: 0.6138, test_loss: 1.2155, test_f1: 0.6159
 epoch: 97, train_loss: 0.6102, test_loss: 1.4534, test_f1: 0.5856
 epoch: 98, train_loss: 0.6335, test_loss: 1.4074, test_f1: 0.5688
 epoch: 99, train_loss: 0.6201, test_loss: 1.1113, test_f1: 0.6213
##################ITERATION #5 ****************************************
 epoch: 0, train_loss: 1.2146, test_loss: 1.3462, test_f1: 0.2713
 epoch: 1, train_loss: 1.0760, test_loss: 1.3481, test_f1: 0.2587
 epoch: 2, train_loss: 1.0091, test_loss: 1.1560, test_f1: 0.3752
 epoch: 3, train_loss: 0.9782, test_loss: 1.0708, test_f1: 0.4554
 epoch: 4, train_loss: 0.9354, test_loss: 1.0853, test_f1: 0.5041
 epoch: 5, train_loss: 0.9296, test_loss: 1.0425, test_f1: 0.5421
 epoch: 6, train_loss: 0.9137, test_loss: 1.1055, test_f1: 0.5375
 epoch: 7, train_loss: 0.8549, test_loss: 1.0295, test_f1: 0.5582
 epoch: 8, train_loss: 0.8762, test_loss: 1.0340, test_f1: 0.5560
 epoch: 9, train_loss: 0.8556, test_loss: 1.0706, test_f1: 0.5051
 epoch: 10, train_loss: 0.8781, test_loss: 1.0277, test_f1: 0.4932
 epoch: 11, train_loss: 0.8261, test_loss: 1.2391, test_f1: 0.4743
 epoch: 12, train_loss: 0.8423, test_loss: 1.0829, test_f1: 0.5704
 epoch: 13, train_loss: 0.8282, test_loss: 1.0995, test_f1: 0.5258
 epoch: 14, train_loss: 0.8046, test_loss: 1.1665, test_f1: 0.5046
 epoch: 15, train_loss: 0.8052, test_loss: 1.1845, test_f1: 0.5490
 epoch: 16, train_loss: 0.8491, test_loss: 1.2951, test_f1: 0.4752
 epoch: 17, train_loss: 0.8166, test_loss: 1.0452, test_f1: 0.5350
 epoch: 18, train_loss: 0.8117, test_loss: 1.0204, test_f1: 0.5735
 epoch: 19, train_loss: 0.7859, test_loss: 1.1712, test_f1: 0.5205
 epoch: 20, train_loss: 0.7850, test_loss: 1.0524, test_f1: 0.5456
 epoch: 21, train_loss: 0.7591, test_loss: 1.0566, test_f1: 0.5444
 epoch: 22, train_loss: 0.7654, test_loss: 1.2829, test_f1: 0.5002
 epoch: 23, train_loss: 0.7800, test_loss: 1.0954, test_f1: 0.5766
 epoch: 24, train_loss: 0.7496, test_loss: 1.0583, test_f1: 0.5609
 epoch: 25, train_loss: 0.7847, test_loss: 1.1305, test_f1: 0.5851
 epoch: 26, train_loss: 0.7469, test_loss: 1.3576, test_f1: 0.4975
 epoch: 27, train_loss: 0.7579, test_loss: 1.9228, test_f1: 0.4936
 epoch: 28, train_loss: 0.7551, test_loss: 1.0085, test_f1: 0.5699
 epoch: 29, train_loss: 0.7441, test_loss: 1.2352, test_f1: 0.5554
 epoch: 30, train_loss: 0.7403, test_loss: 1.1381, test_f1: 0.5988
 epoch: 31, train_loss: 0.7500, test_loss: 1.1638, test_f1: 0.5657
 epoch: 32, train_loss: 0.7455, test_loss: 1.1973, test_f1: 0.5504
 epoch: 33, train_loss: 0.7263, test_loss: 1.1916, test_f1: 0.5835
 epoch: 34, train_loss: 0.7276, test_loss: 1.3478, test_f1: 0.5172
 epoch: 35, train_loss: 0.7626, test_loss: 1.1248, test_f1: 0.5459
 epoch: 36, train_loss: 0.7340, test_loss: 1.2086, test_f1: 0.5603
 epoch: 37, train_loss: 0.7643, test_loss: 1.2632, test_f1: 0.5660
 epoch: 38, train_loss: 0.7676, test_loss: 1.1926, test_f1: 0.5776
 epoch: 39, train_loss: 0.7459, test_loss: 1.3180, test_f1: 0.5158
 epoch: 40, train_loss: 0.7090, test_loss: 1.3638, test_f1: 0.5540
 epoch: 41, train_loss: 0.7102, test_loss: 1.1489, test_f1: 0.5515
 epoch: 42, train_loss: 0.7183, test_loss: 1.1386, test_f1: 0.5879
 epoch: 43, train_loss: 0.7273, test_loss: 1.1425, test_f1: 0.5408
 epoch: 44, train_loss: 0.7135, test_loss: 1.2207, test_f1: 0.5901
 epoch: 45, train_loss: 0.7218, test_loss: 1.4006, test_f1: 0.5935
 epoch: 46, train_loss: 0.7498, test_loss: 2.1292, test_f1: 0.4342
 epoch: 47, train_loss: 0.7450, test_loss: 1.3070, test_f1: 0.5851
 epoch: 48, train_loss: 0.6979, test_loss: 1.2552, test_f1: 0.5143
 epoch: 49, train_loss: 0.7066, test_loss: 1.3131, test_f1: 0.5931
 epoch: 50, train_loss: 0.6912, test_loss: 1.3782, test_f1: 0.5487
 epoch: 51, train_loss: 0.6811, test_loss: 1.3382, test_f1: 0.5891
 epoch: 52, train_loss: 0.6738, test_loss: 1.2231, test_f1: 0.5936
 epoch: 53, train_loss: 0.6649, test_loss: 1.4890, test_f1: 0.5699
 epoch: 54, train_loss: 0.6578, test_loss: 1.3933, test_f1: 0.5817
 epoch: 55, train_loss: 0.6571, test_loss: 1.6927, test_f1: 0.5476
 epoch: 56, train_loss: 0.6570, test_loss: 1.4111, test_f1: 0.5703
 epoch: 57, train_loss: 0.6535, test_loss: 1.4722, test_f1: 0.5565
 epoch: 58, train_loss: 0.6693, test_loss: 1.3948, test_f1: 0.5735
 epoch: 59, train_loss: 0.6589, test_loss: 1.7117, test_f1: 0.5796
 epoch: 60, train_loss: 0.6467, test_loss: 1.5981, test_f1: 0.5899
 epoch: 61, train_loss: 0.6536, test_loss: 1.4099, test_f1: 0.5907
 epoch: 62, train_loss: 0.6523, test_loss: 1.6277, test_f1: 0.5727
 epoch: 63, train_loss: 0.6629, test_loss: 1.3143, test_f1: 0.5717
 epoch: 64, train_loss: 0.6372, test_loss: 1.6181, test_f1: 0.5751
 epoch: 65, train_loss: 0.6466, test_loss: 1.6840, test_f1: 0.5853
 epoch: 66, train_loss: 0.6580, test_loss: 1.4702, test_f1: 0.5743
 epoch: 67, train_loss: 0.6441, test_loss: 1.7924, test_f1: 0.5512
 epoch: 68, train_loss: 0.6389, test_loss: 1.5613, test_f1: 0.5462
 epoch: 69, train_loss: 0.6334, test_loss: 1.4264, test_f1: 0.5373
 epoch: 70, train_loss: 0.6628, test_loss: 1.6020, test_f1: 0.5558
 epoch: 71, train_loss: 0.7018, test_loss: 1.4333, test_f1: 0.5600
 epoch: 72, train_loss: 0.7137, test_loss: 1.6684, test_f1: 0.5661
 epoch: 73, train_loss: 0.6680, test_loss: 1.2265, test_f1: 0.5818
 epoch: 74, train_loss: 0.6537, test_loss: 1.5748, test_f1: 0.5633
 epoch: 75, train_loss: 0.6302, test_loss: 1.7591, test_f1: 0.5504
 epoch: 76, train_loss: 0.6245, test_loss: 1.4510, test_f1: 0.5709
 epoch: 77, train_loss: 0.6347, test_loss: 1.4964, test_f1: 0.5730
 epoch: 78, train_loss: 0.6234, test_loss: 1.7468, test_f1: 0.5866
 epoch: 79, train_loss: 0.6276, test_loss: 1.5307, test_f1: 0.5717
 epoch: 80, train_loss: 0.6317, test_loss: 1.8100, test_f1: 0.5771
 epoch: 81, train_loss: 0.6395, test_loss: 1.6026, test_f1: 0.6050
 epoch: 82, train_loss: 0.6148, test_loss: 1.6969, test_f1: 0.5456
 epoch: 83, train_loss: 0.6029, test_loss: 1.5207, test_f1: 0.5986
 epoch: 84, train_loss: 0.6130, test_loss: 1.9851, test_f1: 0.5945
 epoch: 85, train_loss: 0.6490, test_loss: 1.4735, test_f1: 0.5796
 epoch: 86, train_loss: 0.6290, test_loss: 1.9821, test_f1: 0.5950
 epoch: 87, train_loss: 0.6290, test_loss: 1.6392, test_f1: 0.5759
 epoch: 88, train_loss: 0.6139, test_loss: 1.4269, test_f1: 0.5756
 epoch: 89, train_loss: 0.6073, test_loss: 1.5219, test_f1: 0.5575
 epoch: 90, train_loss: 0.6019, test_loss: 1.8377, test_f1: 0.5809
 epoch: 91, train_loss: 0.5825, test_loss: 1.6933, test_f1: 0.5951
 epoch: 92, train_loss: 0.6082, test_loss: 2.4512, test_f1: 0.5612
 epoch: 93, train_loss: 0.6214, test_loss: 1.9961, test_f1: 0.5375
 epoch: 94, train_loss: 0.6208, test_loss: 1.8389, test_f1: 0.5814
 epoch: 95, train_loss: 0.6049, test_loss: 1.4731, test_f1: 0.5686
 epoch: 96, train_loss: 0.6050, test_loss: 1.9025, test_f1: 0.6262
 epoch: 97, train_loss: 0.5980, test_loss: 1.8798, test_f1: 0.6030
 epoch: 98, train_loss: 0.6135, test_loss: 1.5294, test_f1: 0.5847
 epoch: 99, train_loss: 0.5853, test_loss: 1.5583, test_f1: 0.5730
##################ITERATION #6 ****************************************
 epoch: 0, train_loss: 1.3124, test_loss: 1.3702, test_f1: 0.3472
 epoch: 1, train_loss: 1.0409, test_loss: 1.3737, test_f1: 0.4134
 epoch: 2, train_loss: 1.0043, test_loss: 1.4927, test_f1: 0.2782
 epoch: 3, train_loss: 0.9655, test_loss: 1.3444, test_f1: 0.3945
 epoch: 4, train_loss: 0.9194, test_loss: 1.2340, test_f1: 0.4462
 epoch: 5, train_loss: 0.8888, test_loss: 1.1135, test_f1: 0.4947
 epoch: 6, train_loss: 0.9014, test_loss: 1.0554, test_f1: 0.5165
 epoch: 7, train_loss: 0.8753, test_loss: 1.0880, test_f1: 0.5372
 epoch: 8, train_loss: 0.8363, test_loss: 0.9977, test_f1: 0.5597
 epoch: 9, train_loss: 0.8158, test_loss: 1.0563, test_f1: 0.5513
 epoch: 10, train_loss: 0.8287, test_loss: 1.0605, test_f1: 0.5343
 epoch: 11, train_loss: 0.8366, test_loss: 1.0923, test_f1: 0.5352
 epoch: 12, train_loss: 0.8147, test_loss: 1.0594, test_f1: 0.5678
 epoch: 13, train_loss: 0.8041, test_loss: 0.9978, test_f1: 0.5772
 epoch: 14, train_loss: 0.8146, test_loss: 1.3174, test_f1: 0.5166
 epoch: 15, train_loss: 0.8085, test_loss: 0.9627, test_f1: 0.5828
 epoch: 16, train_loss: 0.7780, test_loss: 1.0469, test_f1: 0.5716
 epoch: 17, train_loss: 0.8011, test_loss: 1.0005, test_f1: 0.5299
 epoch: 18, train_loss: 0.7884, test_loss: 1.1875, test_f1: 0.5188
 epoch: 19, train_loss: 0.8105, test_loss: 1.3090, test_f1: 0.5083
 epoch: 20, train_loss: 0.8309, test_loss: 1.0431, test_f1: 0.5293
 epoch: 21, train_loss: 0.8088, test_loss: 1.0176, test_f1: 0.5795
 epoch: 22, train_loss: 0.8230, test_loss: 0.9962, test_f1: 0.5734
 epoch: 23, train_loss: 0.7845, test_loss: 1.5671, test_f1: 0.4385
 epoch: 24, train_loss: 0.7929, test_loss: 0.9697, test_f1: 0.6070
 epoch: 25, train_loss: 0.7768, test_loss: 1.0435, test_f1: 0.5762
 epoch: 26, train_loss: 0.7813, test_loss: 1.2093, test_f1: 0.5789
 epoch: 27, train_loss: 0.7715, test_loss: 1.0299, test_f1: 0.5667
 epoch: 28, train_loss: 0.7567, test_loss: 1.0897, test_f1: 0.5362
 epoch: 29, train_loss: 0.7312, test_loss: 1.0413, test_f1: 0.5932
 epoch: 30, train_loss: 0.7498, test_loss: 1.0860, test_f1: 0.5187
 epoch: 31, train_loss: 0.7494, test_loss: 1.2158, test_f1: 0.5427
 epoch: 32, train_loss: 0.7280, test_loss: 1.0092, test_f1: 0.5735
 epoch: 33, train_loss: 0.7343, test_loss: 1.1102, test_f1: 0.5681
 epoch: 34, train_loss: 0.7055, test_loss: 1.0450, test_f1: 0.6021
 epoch: 35, train_loss: 0.7461, test_loss: 1.1781, test_f1: 0.5850
 epoch: 36, train_loss: 0.7448, test_loss: 0.9914, test_f1: 0.5914
 epoch: 37, train_loss: 0.7539, test_loss: 1.0756, test_f1: 0.5650
 epoch: 38, train_loss: 0.7030, test_loss: 1.0500, test_f1: 0.5954
 epoch: 39, train_loss: 0.7297, test_loss: 1.3048, test_f1: 0.5716
 epoch: 40, train_loss: 0.7200, test_loss: 1.3728, test_f1: 0.4574
 epoch: 41, train_loss: 0.8350, test_loss: 1.0959, test_f1: 0.5634
 epoch: 42, train_loss: 0.8035, test_loss: 1.1811, test_f1: 0.5218
 epoch: 43, train_loss: 0.7408, test_loss: 0.9958, test_f1: 0.5877
 epoch: 44, train_loss: 0.7302, test_loss: 1.1810, test_f1: 0.5465
 epoch: 45, train_loss: 0.7224, test_loss: 1.1437, test_f1: 0.5831
 epoch: 46, train_loss: 0.7054, test_loss: 1.0231, test_f1: 0.5792
 epoch: 47, train_loss: 0.6881, test_loss: 0.9376, test_f1: 0.6139
 epoch: 48, train_loss: 0.7163, test_loss: 1.3316, test_f1: 0.5570
 epoch: 49, train_loss: 0.6927, test_loss: 1.1001, test_f1: 0.5970
 epoch: 50, train_loss: 0.6911, test_loss: 1.0790, test_f1: 0.5535
 epoch: 51, train_loss: 0.6888, test_loss: 0.9523, test_f1: 0.6411
 epoch: 52, train_loss: 0.6783, test_loss: 1.0786, test_f1: 0.5918
 epoch: 53, train_loss: 0.6813, test_loss: 1.0908, test_f1: 0.6259
 epoch: 54, train_loss: 0.6622, test_loss: 0.9362, test_f1: 0.6198
 epoch: 55, train_loss: 0.6650, test_loss: 0.9607, test_f1: 0.6708
 epoch: 56, train_loss: 0.6901, test_loss: 0.9647, test_f1: 0.6007
 epoch: 57, train_loss: 0.6546, test_loss: 0.9464, test_f1: 0.6658
 epoch: 58, train_loss: 0.6540, test_loss: 1.0035, test_f1: 0.6536
 epoch: 59, train_loss: 0.6556, test_loss: 1.0264, test_f1: 0.6630
 epoch: 60, train_loss: 0.6560, test_loss: 0.8771, test_f1: 0.6565
 epoch: 61, train_loss: 0.6531, test_loss: 1.0164, test_f1: 0.5760
 epoch: 62, train_loss: 0.6346, test_loss: 0.9391, test_f1: 0.6838
 epoch: 63, train_loss: 0.6463, test_loss: 1.3517, test_f1: 0.5927
 epoch: 64, train_loss: 0.6636, test_loss: 0.9621, test_f1: 0.6563
 epoch: 65, train_loss: 0.6399, test_loss: 1.0283, test_f1: 0.6064
 epoch: 66, train_loss: 0.6350, test_loss: 0.9376, test_f1: 0.6485
 epoch: 67, train_loss: 0.6322, test_loss: 1.0822, test_f1: 0.6171
 epoch: 68, train_loss: 0.6438, test_loss: 1.2163, test_f1: 0.5604
 epoch: 69, train_loss: 0.6469, test_loss: 0.9793, test_f1: 0.6150
 epoch: 70, train_loss: 0.6431, test_loss: 0.9645, test_f1: 0.6219
 epoch: 71, train_loss: 0.6514, test_loss: 1.0313, test_f1: 0.6529
 epoch: 72, train_loss: 0.6312, test_loss: 1.5230, test_f1: 0.5731
 epoch: 73, train_loss: 0.6341, test_loss: 1.1010, test_f1: 0.6235
 epoch: 74, train_loss: 0.6345, test_loss: 0.9831, test_f1: 0.5815
 epoch: 75, train_loss: 0.6241, test_loss: 1.2514, test_f1: 0.6272
 epoch: 76, train_loss: 0.6379, test_loss: 1.0228, test_f1: 0.6494
 epoch: 77, train_loss: 0.6636, test_loss: 0.9322, test_f1: 0.6387
 epoch: 78, train_loss: 0.6568, test_loss: 1.3018, test_f1: 0.6237
 epoch: 79, train_loss: 0.6167, test_loss: 0.9569, test_f1: 0.6674
 epoch: 80, train_loss: 0.6095, test_loss: 1.0753, test_f1: 0.6837
 epoch: 81, train_loss: 0.6149, test_loss: 1.0169, test_f1: 0.6347
 epoch: 82, train_loss: 0.6132, test_loss: 1.1223, test_f1: 0.6356
 epoch: 83, train_loss: 0.6115, test_loss: 1.1804, test_f1: 0.6077
 epoch: 84, train_loss: 0.6077, test_loss: 0.9885, test_f1: 0.6667
 epoch: 85, train_loss: 0.6040, test_loss: 1.0136, test_f1: 0.6680
 epoch: 86, train_loss: 0.6240, test_loss: 1.1455, test_f1: 0.6635
 epoch: 87, train_loss: 0.6327, test_loss: 1.0315, test_f1: 0.6330
 epoch: 88, train_loss: 0.5995, test_loss: 1.0605, test_f1: 0.6489
 epoch: 89, train_loss: 0.6195, test_loss: 1.0107, test_f1: 0.6360
 epoch: 90, train_loss: 0.5978, test_loss: 1.1477, test_f1: 0.6168
 epoch: 91, train_loss: 0.5766, test_loss: 1.0112, test_f1: 0.6425
 epoch: 92, train_loss: 0.5959, test_loss: 1.2429, test_f1: 0.6097
 epoch: 93, train_loss: 0.5979, test_loss: 1.3981, test_f1: 0.6163
 epoch: 94, train_loss: 0.6017, test_loss: 0.8983, test_f1: 0.6809
 epoch: 95, train_loss: 0.5823, test_loss: 0.9667, test_f1: 0.6624
 epoch: 96, train_loss: 0.5968, test_loss: 1.6370, test_f1: 0.6159
 epoch: 97, train_loss: 0.5845, test_loss: 1.0947, test_f1: 0.6327
 epoch: 98, train_loss: 0.5728, test_loss: 1.0394, test_f1: 0.6133
 epoch: 99, train_loss: 0.5576, test_loss: 1.2497, test_f1: 0.6502
##################ITERATION #7 ****************************************
 epoch: 0, train_loss: 1.3101, test_loss: 1.4514, test_f1: 0.2357
 epoch: 1, train_loss: 1.0891, test_loss: 1.4563, test_f1: 0.2639
 epoch: 2, train_loss: 1.0291, test_loss: 1.3541, test_f1: 0.2376
 epoch: 3, train_loss: 1.0068, test_loss: 1.2890, test_f1: 0.3458
 epoch: 4, train_loss: 0.9839, test_loss: 1.0726, test_f1: 0.5171
 epoch: 5, train_loss: 0.9596, test_loss: 1.0462, test_f1: 0.5102
 epoch: 6, train_loss: 0.9415, test_loss: 1.0607, test_f1: 0.5127
 epoch: 7, train_loss: 0.9085, test_loss: 1.0356, test_f1: 0.4821
 epoch: 8, train_loss: 0.8626, test_loss: 0.9536, test_f1: 0.6030
 epoch: 9, train_loss: 0.8646, test_loss: 1.0058, test_f1: 0.5551
 epoch: 10, train_loss: 0.8416, test_loss: 1.0385, test_f1: 0.5698
 epoch: 11, train_loss: 0.8773, test_loss: 1.0045, test_f1: 0.5720
 epoch: 12, train_loss: 0.8380, test_loss: 1.0647, test_f1: 0.5006
 epoch: 13, train_loss: 0.8784, test_loss: 1.5637, test_f1: 0.4846
 epoch: 14, train_loss: 0.8699, test_loss: 1.0805, test_f1: 0.5543
 epoch: 15, train_loss: 0.8332, test_loss: 0.9662, test_f1: 0.5737
 epoch: 16, train_loss: 0.8259, test_loss: 1.0874, test_f1: 0.5280
 epoch: 17, train_loss: 0.7920, test_loss: 1.0418, test_f1: 0.5527
 epoch: 18, train_loss: 0.7772, test_loss: 1.1183, test_f1: 0.5307
 epoch: 19, train_loss: 0.8033, test_loss: 1.7467, test_f1: 0.2520
 epoch: 20, train_loss: 0.7716, test_loss: 0.9525, test_f1: 0.6188
 epoch: 21, train_loss: 0.7657, test_loss: 1.1968, test_f1: 0.4809
 epoch: 22, train_loss: 0.8248, test_loss: 1.0366, test_f1: 0.5137
 epoch: 23, train_loss: 0.8124, test_loss: 1.0329, test_f1: 0.5705
 epoch: 24, train_loss: 0.7698, test_loss: 1.0840, test_f1: 0.5357
 epoch: 25, train_loss: 0.7613, test_loss: 0.9690, test_f1: 0.5630
 epoch: 26, train_loss: 0.7633, test_loss: 0.9546, test_f1: 0.5906
 epoch: 27, train_loss: 0.7714, test_loss: 0.9734, test_f1: 0.6087
 epoch: 28, train_loss: 0.7199, test_loss: 0.9647, test_f1: 0.5849
 epoch: 29, train_loss: 0.7316, test_loss: 1.0096, test_f1: 0.5587
 epoch: 30, train_loss: 0.7428, test_loss: 0.9446, test_f1: 0.6134
 epoch: 31, train_loss: 0.7303, test_loss: 1.0390, test_f1: 0.5461
 epoch: 32, train_loss: 0.7534, test_loss: 1.1796, test_f1: 0.4674
 epoch: 33, train_loss: 0.7318, test_loss: 1.4351, test_f1: 0.3342
 epoch: 34, train_loss: 0.7064, test_loss: 1.2567, test_f1: 0.4862
 epoch: 35, train_loss: 0.7220, test_loss: 1.0422, test_f1: 0.5234
 epoch: 36, train_loss: 0.7027, test_loss: 1.0014, test_f1: 0.5725
 epoch: 37, train_loss: 0.7029, test_loss: 1.0768, test_f1: 0.6309
 epoch: 38, train_loss: 0.6840, test_loss: 0.9893, test_f1: 0.5683
 epoch: 39, train_loss: 0.6782, test_loss: 1.0585, test_f1: 0.5724
 epoch: 40, train_loss: 0.6920, test_loss: 1.4328, test_f1: 0.4768
 epoch: 41, train_loss: 0.6607, test_loss: 1.2992, test_f1: 0.4822
 epoch: 42, train_loss: 0.6657, test_loss: 1.4107, test_f1: 0.5334
 epoch: 43, train_loss: 0.6893, test_loss: 1.1130, test_f1: 0.5219
 epoch: 44, train_loss: 0.6733, test_loss: 0.9403, test_f1: 0.6419
 epoch: 45, train_loss: 0.7027, test_loss: 1.5414, test_f1: 0.3911
 epoch: 46, train_loss: 0.6685, test_loss: 0.9796, test_f1: 0.6089
 epoch: 47, train_loss: 0.6388, test_loss: 0.9315, test_f1: 0.5825
 epoch: 48, train_loss: 0.6476, test_loss: 1.0205, test_f1: 0.6205
 epoch: 49, train_loss: 0.6677, test_loss: 0.9858, test_f1: 0.6049
 epoch: 50, train_loss: 0.6791, test_loss: 1.3424, test_f1: 0.4991
 epoch: 51, train_loss: 0.6430, test_loss: 1.0705, test_f1: 0.5542
 epoch: 52, train_loss: 0.6271, test_loss: 0.9431, test_f1: 0.6582
 epoch: 53, train_loss: 0.6086, test_loss: 1.2221, test_f1: 0.5748
 epoch: 54, train_loss: 0.6022, test_loss: 0.9750, test_f1: 0.6107
 epoch: 55, train_loss: 0.5745, test_loss: 0.9961, test_f1: 0.6426
 epoch: 56, train_loss: 0.5795, test_loss: 1.0352, test_f1: 0.5883
 epoch: 57, train_loss: 0.6075, test_loss: 1.0631, test_f1: 0.5388
 epoch: 58, train_loss: 0.5611, test_loss: 1.3108, test_f1: 0.5359
 epoch: 59, train_loss: 0.5759, test_loss: 1.1475, test_f1: 0.5955
 epoch: 60, train_loss: 0.5749, test_loss: 1.3312, test_f1: 0.5175
 epoch: 61, train_loss: 0.5826, test_loss: 1.0766, test_f1: 0.6220
 epoch: 62, train_loss: 0.5591, test_loss: 1.1667, test_f1: 0.5815
 epoch: 63, train_loss: 0.5707, test_loss: 1.0912, test_f1: 0.6046
 epoch: 64, train_loss: 0.5590, test_loss: 1.0306, test_f1: 0.5933
 epoch: 65, train_loss: 0.5740, test_loss: 1.1481, test_f1: 0.5391
 epoch: 66, train_loss: 0.5409, test_loss: 1.0360, test_f1: 0.6150
 epoch: 67, train_loss: 0.5630, test_loss: 1.2178, test_f1: 0.5527
 epoch: 68, train_loss: 0.5592, test_loss: 1.0635, test_f1: 0.6284
 epoch: 69, train_loss: 0.5452, test_loss: 1.3136, test_f1: 0.5343
 epoch: 70, train_loss: 0.5432, test_loss: 1.1053, test_f1: 0.5681
 epoch: 71, train_loss: 0.5332, test_loss: 1.1349, test_f1: 0.5772
 epoch: 72, train_loss: 0.5467, test_loss: 1.1256, test_f1: 0.6119
 epoch: 73, train_loss: 0.5501, test_loss: 1.0615, test_f1: 0.6098
 epoch: 74, train_loss: 0.5259, test_loss: 1.1405, test_f1: 0.6055
 epoch: 75, train_loss: 0.5337, test_loss: 1.2899, test_f1: 0.5288
 epoch: 76, train_loss: 0.5337, test_loss: 1.2617, test_f1: 0.5959
 epoch: 77, train_loss: 0.5153, test_loss: 1.4126, test_f1: 0.5422
 epoch: 78, train_loss: 0.5193, test_loss: 1.2487, test_f1: 0.5596
 epoch: 79, train_loss: 0.5173, test_loss: 1.1318, test_f1: 0.5746
 epoch: 80, train_loss: 0.5044, test_loss: 1.1957, test_f1: 0.5706
 epoch: 81, train_loss: 0.5159, test_loss: 1.6993, test_f1: 0.5215
 epoch: 82, train_loss: 0.5257, test_loss: 1.4050, test_f1: 0.5814
 epoch: 83, train_loss: 0.5650, test_loss: 1.7688, test_f1: 0.4440
 epoch: 84, train_loss: 0.5303, test_loss: 1.4280, test_f1: 0.5551
 epoch: 85, train_loss: 0.5039, test_loss: 1.2667, test_f1: 0.5617
 epoch: 86, train_loss: 0.5219, test_loss: 1.2016, test_f1: 0.5668
 epoch: 87, train_loss: 0.5158, test_loss: 1.6191, test_f1: 0.5526
 epoch: 88, train_loss: 0.5058, test_loss: 1.3961, test_f1: 0.5549
 epoch: 89, train_loss: 0.5192, test_loss: 1.1717, test_f1: 0.6129
 epoch: 90, train_loss: 0.4917, test_loss: 1.4153, test_f1: 0.6046
 epoch: 91, train_loss: 0.5644, test_loss: 1.2709, test_f1: 0.6239
 epoch: 92, train_loss: 0.5299, test_loss: 1.1945, test_f1: 0.6339
 epoch: 93, train_loss: 0.5273, test_loss: 1.2934, test_f1: 0.5324
 epoch: 94, train_loss: 0.4815, test_loss: 1.1581, test_f1: 0.6315
 epoch: 95, train_loss: 0.4857, test_loss: 1.2548, test_f1: 0.6160
 epoch: 96, train_loss: 0.4827, test_loss: 1.3332, test_f1: 0.5970
 epoch: 97, train_loss: 0.4869, test_loss: 1.3464, test_f1: 0.6113
 epoch: 98, train_loss: 0.5201, test_loss: 1.3507, test_f1: 0.6111
 epoch: 99, train_loss: 0.5522, test_loss: 1.2184, test_f1: 0.6327
##################ITERATION #8 ****************************************
 epoch: 0, train_loss: 1.2984, test_loss: 1.4087, test_f1: 0.3328
 epoch: 1, train_loss: 1.1122, test_loss: 1.2214, test_f1: 0.3496
 epoch: 2, train_loss: 1.0122, test_loss: 1.1328, test_f1: 0.4264
 epoch: 3, train_loss: 0.9312, test_loss: 1.0728, test_f1: 0.5108
 epoch: 4, train_loss: 0.9109, test_loss: 1.1193, test_f1: 0.4769
 epoch: 5, train_loss: 0.8754, test_loss: 0.9818, test_f1: 0.5903
 epoch: 6, train_loss: 0.9167, test_loss: 1.3224, test_f1: 0.3927
 epoch: 7, train_loss: 0.8663, test_loss: 1.0575, test_f1: 0.5416
 epoch: 8, train_loss: 0.8482, test_loss: 1.0298, test_f1: 0.5414
 epoch: 9, train_loss: 0.8331, test_loss: 1.3556, test_f1: 0.5192
 epoch: 10, train_loss: 0.8276, test_loss: 1.0223, test_f1: 0.5703
 epoch: 11, train_loss: 0.8168, test_loss: 0.9552, test_f1: 0.5957
 epoch: 12, train_loss: 0.7975, test_loss: 1.8023, test_f1: 0.4603
 epoch: 13, train_loss: 0.7936, test_loss: 1.2191, test_f1: 0.5355
 epoch: 14, train_loss: 0.7999, test_loss: 1.0231, test_f1: 0.5307
 epoch: 15, train_loss: 0.8341, test_loss: 1.1237, test_f1: 0.5414
 epoch: 16, train_loss: 0.8202, test_loss: 0.9762, test_f1: 0.5685
 epoch: 17, train_loss: 0.7923, test_loss: 2.1124, test_f1: 0.4575
 epoch: 18, train_loss: 0.8139, test_loss: 1.0582, test_f1: 0.5893
 epoch: 19, train_loss: 0.7960, test_loss: 1.0067, test_f1: 0.5799
 epoch: 20, train_loss: 0.7998, test_loss: 1.3711, test_f1: 0.5652
 epoch: 21, train_loss: 0.7770, test_loss: 1.0198, test_f1: 0.6008
 epoch: 22, train_loss: 0.7708, test_loss: 1.2834, test_f1: 0.5391
 epoch: 23, train_loss: 0.7571, test_loss: 1.1316, test_f1: 0.5619
 epoch: 24, train_loss: 0.7417, test_loss: 2.5283, test_f1: 0.5110
 epoch: 25, train_loss: 0.7662, test_loss: 1.8541, test_f1: 0.5480
 epoch: 26, train_loss: 0.7632, test_loss: 0.9783, test_f1: 0.5954
 epoch: 27, train_loss: 0.7421, test_loss: 0.9647, test_f1: 0.6239
 epoch: 28, train_loss: 0.7417, test_loss: 1.0099, test_f1: 0.5929
 epoch: 29, train_loss: 0.7438, test_loss: 1.0803, test_f1: 0.5751
 epoch: 30, train_loss: 0.7372, test_loss: 0.9481, test_f1: 0.6235
 epoch: 31, train_loss: 0.7464, test_loss: 1.0172, test_f1: 0.5917
 epoch: 32, train_loss: 0.7371, test_loss: 1.1756, test_f1: 0.5917
 epoch: 33, train_loss: 0.7394, test_loss: 1.7217, test_f1: 0.5182
 epoch: 34, train_loss: 0.7462, test_loss: 0.9618, test_f1: 0.6096
 epoch: 35, train_loss: 0.7453, test_loss: 1.2234, test_f1: 0.5637
 epoch: 36, train_loss: 0.7392, test_loss: 0.9957, test_f1: 0.5923
 epoch: 37, train_loss: 0.7499, test_loss: 1.1244, test_f1: 0.5791
 epoch: 38, train_loss: 0.7442, test_loss: 1.2431, test_f1: 0.5666
 epoch: 39, train_loss: 0.7402, test_loss: 1.0247, test_f1: 0.5966
 epoch: 40, train_loss: 0.7230, test_loss: 0.9782, test_f1: 0.6129
 epoch: 41, train_loss: 0.7131, test_loss: 1.3753, test_f1: 0.5561
 epoch: 42, train_loss: 0.7217, test_loss: 1.1923, test_f1: 0.6047
 epoch: 43, train_loss: 0.7270, test_loss: 1.1805, test_f1: 0.5915
 epoch: 44, train_loss: 0.7552, test_loss: 2.4707, test_f1: 0.5077
 epoch: 45, train_loss: 0.7192, test_loss: 1.2622, test_f1: 0.5708
 epoch: 46, train_loss: 0.7263, test_loss: 1.2098, test_f1: 0.5875
 epoch: 47, train_loss: 0.7739, test_loss: 1.4165, test_f1: 0.5265
 epoch: 48, train_loss: 0.7693, test_loss: 0.9961, test_f1: 0.5807
 epoch: 49, train_loss: 0.7222, test_loss: 1.1714, test_f1: 0.5801
 epoch: 50, train_loss: 0.7213, test_loss: 1.0705, test_f1: 0.5961
 epoch: 51, train_loss: 0.7070, test_loss: 1.0425, test_f1: 0.5755
 epoch: 52, train_loss: 0.7120, test_loss: 1.1380, test_f1: 0.5837
 epoch: 53, train_loss: 0.6972, test_loss: 1.2462, test_f1: 0.6024
 epoch: 54, train_loss: 0.7007, test_loss: 1.0729, test_f1: 0.6003
 epoch: 55, train_loss: 0.6931, test_loss: 1.0966, test_f1: 0.5985
 epoch: 56, train_loss: 0.6738, test_loss: 1.1171, test_f1: 0.5926
 epoch: 57, train_loss: 0.6695, test_loss: 1.2039, test_f1: 0.5745
 epoch: 58, train_loss: 0.6752, test_loss: 1.0778, test_f1: 0.6217
 epoch: 59, train_loss: 0.6720, test_loss: 1.0528, test_f1: 0.5755
 epoch: 60, train_loss: 0.6591, test_loss: 1.1751, test_f1: 0.5921
 epoch: 61, train_loss: 0.6862, test_loss: 1.0627, test_f1: 0.6074
 epoch: 62, train_loss: 0.6754, test_loss: 1.0700, test_f1: 0.6281
 epoch: 63, train_loss: 0.6641, test_loss: 1.2503, test_f1: 0.6061
 epoch: 64, train_loss: 0.6708, test_loss: 1.1210, test_f1: 0.6006
 epoch: 65, train_loss: 0.6899, test_loss: 1.2176, test_f1: 0.6021
 epoch: 66, train_loss: 0.6643, test_loss: 1.2044, test_f1: 0.5963
 epoch: 67, train_loss: 0.6819, test_loss: 1.2616, test_f1: 0.5578
 epoch: 68, train_loss: 0.6878, test_loss: 1.2171, test_f1: 0.5881
 epoch: 69, train_loss: 0.6764, test_loss: 1.1048, test_f1: 0.6059
 epoch: 70, train_loss: 0.6715, test_loss: 1.1626, test_f1: 0.6001
 epoch: 71, train_loss: 0.6603, test_loss: 1.3279, test_f1: 0.5933
 epoch: 72, train_loss: 0.6598, test_loss: 1.2168, test_f1: 0.5847
 epoch: 73, train_loss: 0.6639, test_loss: 1.2896, test_f1: 0.5661
 epoch: 74, train_loss: 0.6531, test_loss: 1.2089, test_f1: 0.5893
 epoch: 75, train_loss: 0.6563, test_loss: 1.1482, test_f1: 0.5774
 epoch: 76, train_loss: 0.6577, test_loss: 1.3454, test_f1: 0.5998
 epoch: 77, train_loss: 0.6800, test_loss: 1.0395, test_f1: 0.5787
 epoch: 78, train_loss: 0.6672, test_loss: 1.4362, test_f1: 0.5631
 epoch: 79, train_loss: 0.6600, test_loss: 1.2137, test_f1: 0.6029
 epoch: 80, train_loss: 0.6325, test_loss: 1.2292, test_f1: 0.5989
 epoch: 81, train_loss: 0.6261, test_loss: 1.1412, test_f1: 0.6076
 epoch: 82, train_loss: 0.6400, test_loss: 1.2156, test_f1: 0.5975
 epoch: 83, train_loss: 0.6547, test_loss: 1.1156, test_f1: 0.6038
 epoch: 84, train_loss: 0.6501, test_loss: 1.0887, test_f1: 0.5978
 epoch: 85, train_loss: 0.6367, test_loss: 1.2617, test_f1: 0.5775
 epoch: 86, train_loss: 0.6278, test_loss: 1.3252, test_f1: 0.5946
 epoch: 87, train_loss: 0.6354, test_loss: 1.1437, test_f1: 0.5883
 epoch: 88, train_loss: 0.6322, test_loss: 1.2534, test_f1: 0.5524
 epoch: 89, train_loss: 0.6523, test_loss: 1.2790, test_f1: 0.5612
 epoch: 90, train_loss: 0.6326, test_loss: 1.3686, test_f1: 0.5762
 epoch: 91, train_loss: 0.6225, test_loss: 1.1520, test_f1: 0.5923
 epoch: 92, train_loss: 0.6247, test_loss: 1.2623, test_f1: 0.5878
 epoch: 93, train_loss: 0.6502, test_loss: 1.4272, test_f1: 0.5724
 epoch: 94, train_loss: 0.6081, test_loss: 1.2846, test_f1: 0.5699
 epoch: 95, train_loss: 0.6273, test_loss: 1.3688, test_f1: 0.5810
 epoch: 96, train_loss: 0.6341, test_loss: 1.2950, test_f1: 0.5042
 epoch: 97, train_loss: 0.6470, test_loss: 1.1362, test_f1: 0.6154
 epoch: 98, train_loss: 0.6299, test_loss: 1.1445, test_f1: 0.5638
 epoch: 99, train_loss: 0.6323, test_loss: 1.4503, test_f1: 0.5750
##################ITERATION #9 ****************************************
 epoch: 0, train_loss: 1.3076, test_loss: 1.5199, test_f1: 0.3034
 epoch: 1, train_loss: 1.0765, test_loss: 1.2873, test_f1: 0.3674
 epoch: 2, train_loss: 0.9920, test_loss: 1.1869, test_f1: 0.3786
 epoch: 3, train_loss: 0.9812, test_loss: 1.1074, test_f1: 0.4485
 epoch: 4, train_loss: 0.9351, test_loss: 1.0594, test_f1: 0.4862
 epoch: 5, train_loss: 0.8958, test_loss: 1.1459, test_f1: 0.4889
 epoch: 6, train_loss: 0.8886, test_loss: 1.0004, test_f1: 0.5670
 epoch: 7, train_loss: 0.8958, test_loss: 1.0059, test_f1: 0.5706
 epoch: 8, train_loss: 0.8901, test_loss: 1.1458, test_f1: 0.5182
 epoch: 9, train_loss: 0.8774, test_loss: 1.0744, test_f1: 0.5370
 epoch: 10, train_loss: 0.8692, test_loss: 1.0597, test_f1: 0.5469
 epoch: 11, train_loss: 0.8777, test_loss: 1.0597, test_f1: 0.5501
 epoch: 12, train_loss: 0.8315, test_loss: 1.0423, test_f1: 0.5591
 epoch: 13, train_loss: 0.8646, test_loss: 1.0426, test_f1: 0.5636
 epoch: 14, train_loss: 0.8391, test_loss: 1.0217, test_f1: 0.5604
 epoch: 15, train_loss: 0.8440, test_loss: 1.0796, test_f1: 0.5341
 epoch: 16, train_loss: 0.8126, test_loss: 1.1592, test_f1: 0.5647
 epoch: 17, train_loss: 0.8135, test_loss: 1.0386, test_f1: 0.5387
 epoch: 18, train_loss: 0.7991, test_loss: 1.8841, test_f1: 0.4300
 epoch: 19, train_loss: 0.8273, test_loss: 1.3034, test_f1: 0.5404
 epoch: 20, train_loss: 0.8044, test_loss: 1.0563, test_f1: 0.5457
 epoch: 21, train_loss: 0.7988, test_loss: 1.0161, test_f1: 0.5431
 epoch: 22, train_loss: 0.7795, test_loss: 1.0486, test_f1: 0.5671
 epoch: 23, train_loss: 0.7837, test_loss: 1.3157, test_f1: 0.5361
 epoch: 24, train_loss: 0.7820, test_loss: 1.2232, test_f1: 0.5688
 epoch: 25, train_loss: 0.8366, test_loss: 1.1528, test_f1: 0.5196
 epoch: 26, train_loss: 0.7853, test_loss: 1.1271, test_f1: 0.5091
 epoch: 27, train_loss: 0.8010, test_loss: 1.0616, test_f1: 0.5636
 epoch: 28, train_loss: 0.7764, test_loss: 1.1189, test_f1: 0.5626
 epoch: 29, train_loss: 0.7732, test_loss: 0.9830, test_f1: 0.6031
 epoch: 30, train_loss: 0.7606, test_loss: 1.0626, test_f1: 0.5753
 epoch: 31, train_loss: 0.7728, test_loss: 1.3224, test_f1: 0.5206
 epoch: 32, train_loss: 0.7491, test_loss: 1.0654, test_f1: 0.5671
 epoch: 33, train_loss: 0.7614, test_loss: 1.2080, test_f1: 0.5337
 epoch: 34, train_loss: 0.7701, test_loss: 1.0494, test_f1: 0.5733
 epoch: 35, train_loss: 0.7786, test_loss: 1.2576, test_f1: 0.5390
 epoch: 36, train_loss: 0.7910, test_loss: 1.0696, test_f1: 0.5863
 epoch: 37, train_loss: 0.7533, test_loss: 1.0710, test_f1: 0.5684
 epoch: 38, train_loss: 0.7488, test_loss: 0.9950, test_f1: 0.5855
 epoch: 39, train_loss: 0.7347, test_loss: 1.0471, test_f1: 0.5878
 epoch: 40, train_loss: 0.7285, test_loss: 1.0793, test_f1: 0.6175
 epoch: 41, train_loss: 0.7463, test_loss: 1.4643, test_f1: 0.5462
 epoch: 42, train_loss: 0.7922, test_loss: 1.0735, test_f1: 0.5486
 epoch: 43, train_loss: 0.7982, test_loss: 1.1662, test_f1: 0.5450
 epoch: 44, train_loss: 0.7724, test_loss: 1.2245, test_f1: 0.5589
 epoch: 45, train_loss: 0.7399, test_loss: 1.4795, test_f1: 0.5757
 epoch: 46, train_loss: 0.6997, test_loss: 1.0822, test_f1: 0.6174
 epoch: 47, train_loss: 0.7057, test_loss: 1.1446, test_f1: 0.5650
 epoch: 48, train_loss: 0.7027, test_loss: 1.2311, test_f1: 0.6151
 epoch: 49, train_loss: 0.6921, test_loss: 1.3093, test_f1: 0.5158
 epoch: 50, train_loss: 0.7179, test_loss: 1.2719, test_f1: 0.5960
 epoch: 51, train_loss: 0.7015, test_loss: 1.3706, test_f1: 0.5942
 epoch: 52, train_loss: 0.6885, test_loss: 1.0845, test_f1: 0.5700
 epoch: 53, train_loss: 0.6712, test_loss: 1.1013, test_f1: 0.6135
 epoch: 54, train_loss: 0.6646, test_loss: 1.1011, test_f1: 0.6180
 epoch: 55, train_loss: 0.6802, test_loss: 1.2369, test_f1: 0.5481
 epoch: 56, train_loss: 0.6835, test_loss: 1.3600, test_f1: 0.6074
 epoch: 57, train_loss: 0.6673, test_loss: 1.0400, test_f1: 0.6396
 epoch: 58, train_loss: 0.6513, test_loss: 1.1943, test_f1: 0.5653
 epoch: 59, train_loss: 0.6509, test_loss: 1.2649, test_f1: 0.6119
 epoch: 60, train_loss: 0.6600, test_loss: 1.2448, test_f1: 0.5820
 epoch: 61, train_loss: 0.6369, test_loss: 1.1735, test_f1: 0.6014
 epoch: 62, train_loss: 0.6514, test_loss: 1.3188, test_f1: 0.5700
 epoch: 63, train_loss: 0.6405, test_loss: 1.2675, test_f1: 0.5803
 epoch: 64, train_loss: 0.6490, test_loss: 1.2974, test_f1: 0.5752
 epoch: 65, train_loss: 0.6639, test_loss: 1.1900, test_f1: 0.6106
 epoch: 66, train_loss: 0.6435, test_loss: 1.2958, test_f1: 0.5868
 epoch: 67, train_loss: 0.6358, test_loss: 1.3280, test_f1: 0.6049
 epoch: 68, train_loss: 0.6213, test_loss: 1.4820, test_f1: 0.5746
 epoch: 69, train_loss: 0.6633, test_loss: 1.6128, test_f1: 0.5845
 epoch: 70, train_loss: 0.6391, test_loss: 1.5913, test_f1: 0.5734
 epoch: 71, train_loss: 0.6381, test_loss: 1.2591, test_f1: 0.6097
 epoch: 72, train_loss: 0.6291, test_loss: 1.2357, test_f1: 0.5788
 epoch: 73, train_loss: 0.6163, test_loss: 1.4643, test_f1: 0.5421
 epoch: 74, train_loss: 0.6152, test_loss: 1.2433, test_f1: 0.5973
 epoch: 75, train_loss: 0.6161, test_loss: 1.4447, test_f1: 0.5357
 epoch: 76, train_loss: 0.6304, test_loss: 1.8783, test_f1: 0.5766
 epoch: 77, train_loss: 0.6301, test_loss: 1.6886, test_f1: 0.5961
 epoch: 78, train_loss: 0.6162, test_loss: 1.8030, test_f1: 0.5474
 epoch: 79, train_loss: 0.6286, test_loss: 1.1769, test_f1: 0.6506
 epoch: 80, train_loss: 0.6098, test_loss: 1.3725, test_f1: 0.6227
 epoch: 81, train_loss: 0.6226, test_loss: 1.4154, test_f1: 0.5882
 epoch: 82, train_loss: 0.6374, test_loss: 1.6275, test_f1: 0.5275
 epoch: 83, train_loss: 0.6437, test_loss: 1.4873, test_f1: 0.5840
 epoch: 84, train_loss: 0.6353, test_loss: 1.3907, test_f1: 0.5909
 epoch: 85, train_loss: 0.6378, test_loss: 1.5819, test_f1: 0.5961
 epoch: 86, train_loss: 0.6456, test_loss: 1.2467, test_f1: 0.6021
 epoch: 87, train_loss: 0.6359, test_loss: 1.5640, test_f1: 0.5984
 epoch: 88, train_loss: 0.6106, test_loss: 1.4572, test_f1: 0.5955
 epoch: 89, train_loss: 0.6058, test_loss: 1.1895, test_f1: 0.6416
 epoch: 90, train_loss: 0.6230, test_loss: 1.4389, test_f1: 0.6117
 epoch: 91, train_loss: 0.6161, test_loss: 1.3457, test_f1: 0.5944
 epoch: 92, train_loss: 0.5994, test_loss: 1.5847, test_f1: 0.5898
 epoch: 93, train_loss: 0.6073, test_loss: 1.8217, test_f1: 0.5895
 epoch: 94, train_loss: 0.6173, test_loss: 1.5030, test_f1: 0.5859
 epoch: 95, train_loss: 0.5974, test_loss: 1.4118, test_f1: 0.5882
 epoch: 96, train_loss: 0.6023, test_loss: 1.3950, test_f1: 0.6172
 epoch: 97, train_loss: 0.5894, test_loss: 1.4442, test_f1: 0.5808
 epoch: 98, train_loss: 0.6027, test_loss: 1.3826, test_f1: 0.6032
 epoch: 99, train_loss: 0.6031, test_loss: 1.5208, test_f1: 0.5976

Training completed in 438.54 seconds
Best F1: 0.6838 at epoch 62
Mean F1 across iterations: 0.6437  0.0235
========================FINAL RESULTS================================
FEGIN weighted F1: 0.6838  0.0235
python main.py --data ltspice_demos --representation component_pin --model FEGIN --layers 3 --hiddens 16 --batch_size 128 --lr 0.01 --emb_size 250 --epochs 100 --save_appendix component_pin_L3_H16_BS128_LR0.01_E250 --no_val
-----



STDERR:
  File "main.py", line 370, in <module>
    main()
  File "main.py", line 254, in main
    dataset = dataset_class(
  File "/home/philip/projects/ltspice_examples_code_repo/Circuit-Completion-Using-GNNs/component_classification_with_link_prediction_head/evaluation/FEGIN/kernel/circuit_datasets.py", line 15, in __init__
    self.data, self.slices = torch.load(self.processed_paths[0])
  File "/home/philip/.local/lib/python3.8/site-packages/torch/serialization.py", line 1040, in load
    warnings.warn(
  File "/usr/lib/python3.8/warnings.py", line 109, in _showwarnmsg
    sw(msg.message, msg.category, msg.filename, msg.lineno,
  File "main.py", line 47, in warn_with_traceback
    traceback.print_stack(file=log)
/home/philip/projects/ltspice_examples_code_repo/Circuit-Completion-Using-GNNs/component_classification_with_link_prediction_head/evaluation/FEGIN/kernel/circuit_datasets.py:15: FutureWarning: You are using `torch.load` with `weights_only=False` (the current default value), which uses the default pickle module implicitly. It is possible to construct malicious pickle data which will execute arbitrary code during unpickling (See https://github.com/pytorch/pytorch/blob/main/SECURITY.md#untrusted-models for more details). In a future release, the default value for `weights_only` will be flipped to `True`. This limits the functions that could be executed during unpickling. Arbitrary objects will no longer be allowed to be loaded via this mode unless they are explicitly allowlisted by the user via `torch.serialization.add_safe_globals`. We recommend you start setting `weights_only=True` for any use case where you don't have full control of the loaded file. Please open an issue on GitHub for any issues related to this experimental feature.
  self.data, self.slices = torch.load(self.processed_paths[0])
