STDOUT:
Results will be saved in /home/philip/projects/ltspice_examples_code_repo/Circuit-Completion-Using-GNNs/component_classification_with_link_prediction_head/evaluation/FEGIN/results/model_FEGIN_dataset_ltspice_demos
Command line input: python main.py --data ltspice_demos --representation component_net --model FEGIN --layers 2 --hiddens 128 --batch_size 32 --lr 0.0001 --emb_size 128 --epochs 100 --save_appendix component_net_L2_H128_BS32_LR0.0001_E128 --no_val
 is saved.
-----
ltspice_demos - FEGIN
Using 2 layers, 128 hidden units, h = 2
Loading component_net representation dataset
ENTERED
Training FEGIN on component_net representation
Train: 1565, Test: 383
##################ITERATION #0 ****************************************
 epoch: 0, train_loss: 1.3545, test_loss: 1.3498, test_f1: 0.2281
 epoch: 1, train_loss: 1.2905, test_loss: 1.2972, test_f1: 0.2281
 epoch: 2, train_loss: 1.2279, test_loss: 1.2567, test_f1: 0.2281
 epoch: 3, train_loss: 1.1855, test_loss: 1.2332, test_f1: 0.2833
 epoch: 4, train_loss: 1.1554, test_loss: 1.2160, test_f1: 0.2936
 epoch: 5, train_loss: 1.1280, test_loss: 1.1995, test_f1: 0.3408
 epoch: 6, train_loss: 1.1033, test_loss: 1.1923, test_f1: 0.3940
 epoch: 7, train_loss: 1.0810, test_loss: 1.1684, test_f1: 0.4047
 epoch: 8, train_loss: 1.0616, test_loss: 1.1582, test_f1: 0.4039
 epoch: 9, train_loss: 1.0376, test_loss: 1.1391, test_f1: 0.4145
 epoch: 10, train_loss: 1.0131, test_loss: 1.1263, test_f1: 0.4295
 epoch: 11, train_loss: 0.9998, test_loss: 1.0971, test_f1: 0.4463
 epoch: 12, train_loss: 0.9783, test_loss: 1.0891, test_f1: 0.4585
 epoch: 13, train_loss: 0.9672, test_loss: 1.0782, test_f1: 0.4642
 epoch: 14, train_loss: 0.9455, test_loss: 1.0687, test_f1: 0.4743
 epoch: 15, train_loss: 0.9310, test_loss: 1.0578, test_f1: 0.4797
 epoch: 16, train_loss: 0.9275, test_loss: 1.0748, test_f1: 0.4953
 epoch: 17, train_loss: 0.9164, test_loss: 1.0583, test_f1: 0.4945
 epoch: 18, train_loss: 0.9060, test_loss: 1.0522, test_f1: 0.5033
 epoch: 19, train_loss: 0.8977, test_loss: 1.0682, test_f1: 0.5221
 epoch: 20, train_loss: 0.8875, test_loss: 1.0755, test_f1: 0.5314
 epoch: 21, train_loss: 0.8764, test_loss: 1.0398, test_f1: 0.5298
 epoch: 22, train_loss: 0.8774, test_loss: 1.0430, test_f1: 0.5327
 epoch: 23, train_loss: 0.8650, test_loss: 1.0361, test_f1: 0.5539
 epoch: 24, train_loss: 0.8519, test_loss: 1.0905, test_f1: 0.5441
 epoch: 25, train_loss: 0.8431, test_loss: 1.0913, test_f1: 0.5376
 epoch: 26, train_loss: 0.8454, test_loss: 1.0724, test_f1: 0.5657
 epoch: 27, train_loss: 0.8288, test_loss: 1.0481, test_f1: 0.5474
 epoch: 28, train_loss: 0.8365, test_loss: 1.0625, test_f1: 0.5762
 epoch: 29, train_loss: 0.8195, test_loss: 1.0515, test_f1: 0.5772
 epoch: 30, train_loss: 0.8165, test_loss: 1.0373, test_f1: 0.5811
 epoch: 31, train_loss: 0.8101, test_loss: 1.0514, test_f1: 0.5858
 epoch: 32, train_loss: 0.8104, test_loss: 1.0379, test_f1: 0.5965
 epoch: 33, train_loss: 0.7934, test_loss: 1.0555, test_f1: 0.5612
 epoch: 34, train_loss: 0.7972, test_loss: 1.0335, test_f1: 0.5915
 epoch: 35, train_loss: 0.7818, test_loss: 1.0503, test_f1: 0.5758
 epoch: 36, train_loss: 0.7776, test_loss: 1.0502, test_f1: 0.5887
 epoch: 37, train_loss: 0.7759, test_loss: 1.0537, test_f1: 0.5490
 epoch: 38, train_loss: 0.7789, test_loss: 1.0676, test_f1: 0.5512
 epoch: 39, train_loss: 0.7471, test_loss: 1.0465, test_f1: 0.5662
 epoch: 40, train_loss: 0.7555, test_loss: 1.0319, test_f1: 0.5819
 epoch: 41, train_loss: 0.7466, test_loss: 1.0535, test_f1: 0.6176
 epoch: 42, train_loss: 0.7439, test_loss: 1.0575, test_f1: 0.5553
 epoch: 43, train_loss: 0.7310, test_loss: 1.1031, test_f1: 0.5622
 epoch: 44, train_loss: 0.7215, test_loss: 1.0806, test_f1: 0.5623
 epoch: 45, train_loss: 0.7220, test_loss: 1.0588, test_f1: 0.5816
 epoch: 46, train_loss: 0.7198, test_loss: 1.0968, test_f1: 0.5755
 epoch: 47, train_loss: 0.7025, test_loss: 1.0962, test_f1: 0.5886
 epoch: 48, train_loss: 0.7115, test_loss: 1.1172, test_f1: 0.5628
 epoch: 49, train_loss: 0.6916, test_loss: 1.0614, test_f1: 0.5901
 epoch: 50, train_loss: 0.6890, test_loss: 1.0468, test_f1: 0.6045
 epoch: 51, train_loss: 0.6835, test_loss: 1.1012, test_f1: 0.5870
 epoch: 52, train_loss: 0.6638, test_loss: 1.0576, test_f1: 0.5959
 epoch: 53, train_loss: 0.6652, test_loss: 1.0676, test_f1: 0.6145
 epoch: 54, train_loss: 0.6599, test_loss: 1.0384, test_f1: 0.6090
 epoch: 55, train_loss: 0.6426, test_loss: 1.0791, test_f1: 0.5855
 epoch: 56, train_loss: 0.6473, test_loss: 1.0952, test_f1: 0.5933
 epoch: 57, train_loss: 0.6593, test_loss: 1.0771, test_f1: 0.6176
 epoch: 58, train_loss: 0.6397, test_loss: 1.0891, test_f1: 0.6166
 epoch: 59, train_loss: 0.6500, test_loss: 1.1068, test_f1: 0.5982
 epoch: 60, train_loss: 0.6409, test_loss: 1.0827, test_f1: 0.5866
 epoch: 61, train_loss: 0.6417, test_loss: 1.0796, test_f1: 0.6101
 epoch: 62, train_loss: 0.6240, test_loss: 1.1228, test_f1: 0.6105
 epoch: 63, train_loss: 0.6473, test_loss: 1.0488, test_f1: 0.6224
 epoch: 64, train_loss: 0.6266, test_loss: 1.0777, test_f1: 0.6144
 epoch: 65, train_loss: 0.6196, test_loss: 1.1445, test_f1: 0.5951
 epoch: 66, train_loss: 0.6087, test_loss: 1.1043, test_f1: 0.6246
 epoch: 67, train_loss: 0.6153, test_loss: 1.1133, test_f1: 0.6252
 epoch: 68, train_loss: 0.6109, test_loss: 1.1254, test_f1: 0.6032
 epoch: 69, train_loss: 0.6056, test_loss: 1.1084, test_f1: 0.6160
 epoch: 70, train_loss: 0.6063, test_loss: 1.1471, test_f1: 0.6126
 epoch: 71, train_loss: 0.6049, test_loss: 1.1468, test_f1: 0.6112
 epoch: 72, train_loss: 0.6024, test_loss: 1.1115, test_f1: 0.6288
 epoch: 73, train_loss: 0.6008, test_loss: 1.1382, test_f1: 0.6118
 epoch: 74, train_loss: 0.6032, test_loss: 1.1616, test_f1: 0.6062
 epoch: 75, train_loss: 0.5824, test_loss: 1.1516, test_f1: 0.6205
 epoch: 76, train_loss: 0.6038, test_loss: 1.1485, test_f1: 0.6267
 epoch: 77, train_loss: 0.5693, test_loss: 1.2098, test_f1: 0.5994
 epoch: 78, train_loss: 0.5786, test_loss: 1.1524, test_f1: 0.6326
 epoch: 79, train_loss: 0.5917, test_loss: 1.1602, test_f1: 0.6190
 epoch: 80, train_loss: 0.5571, test_loss: 1.1544, test_f1: 0.6423
 epoch: 81, train_loss: 0.5718, test_loss: 1.1504, test_f1: 0.6016
 epoch: 82, train_loss: 0.5728, test_loss: 1.2096, test_f1: 0.5897
 epoch: 83, train_loss: 0.5722, test_loss: 1.2102, test_f1: 0.5977
 epoch: 84, train_loss: 0.5700, test_loss: 1.1676, test_f1: 0.6293
 epoch: 85, train_loss: 0.5537, test_loss: 1.2415, test_f1: 0.5800
 epoch: 86, train_loss: 0.5716, test_loss: 1.2200, test_f1: 0.6351
 epoch: 87, train_loss: 0.5542, test_loss: 1.3097, test_f1: 0.5982
 epoch: 88, train_loss: 0.5508, test_loss: 1.2584, test_f1: 0.5801
 epoch: 89, train_loss: 0.5491, test_loss: 1.2411, test_f1: 0.6063
 epoch: 90, train_loss: 0.5358, test_loss: 1.2626, test_f1: 0.6192
 epoch: 91, train_loss: 0.5350, test_loss: 1.2463, test_f1: 0.5942
 epoch: 92, train_loss: 0.5441, test_loss: 1.2524, test_f1: 0.6166
 epoch: 93, train_loss: 0.5362, test_loss: 1.2663, test_f1: 0.6058
 epoch: 94, train_loss: 0.5453, test_loss: 1.2333, test_f1: 0.6303
 epoch: 95, train_loss: 0.5283, test_loss: 1.2350, test_f1: 0.6315
 epoch: 96, train_loss: 0.5217, test_loss: 1.2608, test_f1: 0.6069
 epoch: 97, train_loss: 0.5209, test_loss: 1.3670, test_f1: 0.5888
 epoch: 98, train_loss: 0.5239, test_loss: 1.2644, test_f1: 0.6206
 epoch: 99, train_loss: 0.5098, test_loss: 1.2976, test_f1: 0.6339
##################ITERATION #1 ****************************************
 epoch: 0, train_loss: 1.2647, test_loss: 1.2758, test_f1: 0.3180
 epoch: 1, train_loss: 1.1573, test_loss: 1.2168, test_f1: 0.3740
 epoch: 2, train_loss: 1.1175, test_loss: 1.1847, test_f1: 0.3460
 epoch: 3, train_loss: 1.0910, test_loss: 1.1576, test_f1: 0.4208
 epoch: 4, train_loss: 1.0534, test_loss: 1.1326, test_f1: 0.4481
 epoch: 5, train_loss: 1.0315, test_loss: 1.1086, test_f1: 0.4622
 epoch: 6, train_loss: 1.0114, test_loss: 1.0898, test_f1: 0.4911
 epoch: 7, train_loss: 0.9804, test_loss: 1.0855, test_f1: 0.4923
 epoch: 8, train_loss: 0.9603, test_loss: 1.0578, test_f1: 0.5032
 epoch: 9, train_loss: 0.9349, test_loss: 1.0454, test_f1: 0.5109
 epoch: 10, train_loss: 0.9204, test_loss: 1.0344, test_f1: 0.5298
 epoch: 11, train_loss: 0.9190, test_loss: 1.0417, test_f1: 0.5272
 epoch: 12, train_loss: 0.9003, test_loss: 1.0317, test_f1: 0.5326
 epoch: 13, train_loss: 0.8881, test_loss: 1.0261, test_f1: 0.5613
 epoch: 14, train_loss: 0.8729, test_loss: 1.0230, test_f1: 0.5387
 epoch: 15, train_loss: 0.8634, test_loss: 1.0210, test_f1: 0.5370
 epoch: 16, train_loss: 0.8623, test_loss: 1.0352, test_f1: 0.5400
 epoch: 17, train_loss: 0.8336, test_loss: 1.0279, test_f1: 0.5419
 epoch: 18, train_loss: 0.8425, test_loss: 1.0277, test_f1: 0.5769
 epoch: 19, train_loss: 0.8290, test_loss: 1.0154, test_f1: 0.5610
 epoch: 20, train_loss: 0.8090, test_loss: 1.0074, test_f1: 0.5624
 epoch: 21, train_loss: 0.8145, test_loss: 1.0147, test_f1: 0.5425
 epoch: 22, train_loss: 0.8134, test_loss: 0.9986, test_f1: 0.6088
 epoch: 23, train_loss: 0.8067, test_loss: 1.0008, test_f1: 0.5846
 epoch: 24, train_loss: 0.7789, test_loss: 1.0348, test_f1: 0.5801
 epoch: 25, train_loss: 0.7700, test_loss: 1.0429, test_f1: 0.5602
 epoch: 26, train_loss: 0.7739, test_loss: 1.0635, test_f1: 0.5952
 epoch: 27, train_loss: 0.7599, test_loss: 1.0100, test_f1: 0.6073
 epoch: 28, train_loss: 0.7554, test_loss: 1.0024, test_f1: 0.6120
 epoch: 29, train_loss: 0.7464, test_loss: 1.0153, test_f1: 0.6141
 epoch: 30, train_loss: 0.7410, test_loss: 1.0385, test_f1: 0.6002
 epoch: 31, train_loss: 0.7382, test_loss: 1.0202, test_f1: 0.6199
 epoch: 32, train_loss: 0.7330, test_loss: 1.0253, test_f1: 0.5761
 epoch: 33, train_loss: 0.7155, test_loss: 1.0095, test_f1: 0.6162
 epoch: 34, train_loss: 0.7033, test_loss: 0.9990, test_f1: 0.6370
 epoch: 35, train_loss: 0.6962, test_loss: 1.0065, test_f1: 0.6248
 epoch: 36, train_loss: 0.7062, test_loss: 1.0180, test_f1: 0.6142
 epoch: 37, train_loss: 0.7014, test_loss: 0.9921, test_f1: 0.6155
 epoch: 38, train_loss: 0.6846, test_loss: 1.0497, test_f1: 0.5903
 epoch: 39, train_loss: 0.6747, test_loss: 1.0064, test_f1: 0.6241
 epoch: 40, train_loss: 0.6579, test_loss: 1.0582, test_f1: 0.6054
 epoch: 41, train_loss: 0.6608, test_loss: 1.0765, test_f1: 0.5933
 epoch: 42, train_loss: 0.6661, test_loss: 1.0674, test_f1: 0.6076
 epoch: 43, train_loss: 0.6439, test_loss: 1.0960, test_f1: 0.5991
 epoch: 44, train_loss: 0.6469, test_loss: 1.0633, test_f1: 0.6147
 epoch: 45, train_loss: 0.6484, test_loss: 1.1319, test_f1: 0.6016
 epoch: 46, train_loss: 0.6572, test_loss: 1.1048, test_f1: 0.6078
 epoch: 47, train_loss: 0.6254, test_loss: 1.1071, test_f1: 0.6069
 epoch: 48, train_loss: 0.6426, test_loss: 1.0186, test_f1: 0.6373
 epoch: 49, train_loss: 0.6233, test_loss: 1.0670, test_f1: 0.6217
 epoch: 50, train_loss: 0.6241, test_loss: 0.9937, test_f1: 0.6572
 epoch: 51, train_loss: 0.5975, test_loss: 1.0566, test_f1: 0.6208
 epoch: 52, train_loss: 0.5978, test_loss: 1.0552, test_f1: 0.6416
 epoch: 53, train_loss: 0.5899, test_loss: 1.0691, test_f1: 0.6348
 epoch: 54, train_loss: 0.5808, test_loss: 1.0769, test_f1: 0.6206
 epoch: 55, train_loss: 0.5859, test_loss: 1.0324, test_f1: 0.6417
 epoch: 56, train_loss: 0.5843, test_loss: 1.0500, test_f1: 0.6420
 epoch: 57, train_loss: 0.5808, test_loss: 1.0797, test_f1: 0.6315
 epoch: 58, train_loss: 0.5747, test_loss: 1.0723, test_f1: 0.6395
 epoch: 59, train_loss: 0.5786, test_loss: 1.0693, test_f1: 0.6481
 epoch: 60, train_loss: 0.5712, test_loss: 1.0812, test_f1: 0.6486
 epoch: 61, train_loss: 0.5617, test_loss: 1.0542, test_f1: 0.6456
 epoch: 62, train_loss: 0.5531, test_loss: 1.0983, test_f1: 0.6283
 epoch: 63, train_loss: 0.5544, test_loss: 1.0784, test_f1: 0.6233
 epoch: 64, train_loss: 0.5431, test_loss: 1.1221, test_f1: 0.6103
 epoch: 65, train_loss: 0.5537, test_loss: 1.1162, test_f1: 0.6284
 epoch: 66, train_loss: 0.5473, test_loss: 1.1119, test_f1: 0.6104
 epoch: 67, train_loss: 0.5507, test_loss: 1.0782, test_f1: 0.6266
 epoch: 68, train_loss: 0.5486, test_loss: 1.1069, test_f1: 0.6208
 epoch: 69, train_loss: 0.5448, test_loss: 1.0977, test_f1: 0.6412
 epoch: 70, train_loss: 0.5501, test_loss: 1.0747, test_f1: 0.6457
 epoch: 71, train_loss: 0.5280, test_loss: 1.1415, test_f1: 0.6234
 epoch: 72, train_loss: 0.5362, test_loss: 1.1065, test_f1: 0.6274
 epoch: 73, train_loss: 0.5179, test_loss: 1.0651, test_f1: 0.6309
 epoch: 74, train_loss: 0.5097, test_loss: 1.0924, test_f1: 0.6272
 epoch: 75, train_loss: 0.5234, test_loss: 1.1394, test_f1: 0.6384
 epoch: 76, train_loss: 0.5248, test_loss: 1.1607, test_f1: 0.6265
 epoch: 77, train_loss: 0.5344, test_loss: 1.0997, test_f1: 0.6302
 epoch: 78, train_loss: 0.5229, test_loss: 1.1218, test_f1: 0.6495
 epoch: 79, train_loss: 0.5091, test_loss: 1.1413, test_f1: 0.6424
 epoch: 80, train_loss: 0.5191, test_loss: 1.1410, test_f1: 0.6449
 epoch: 81, train_loss: 0.5116, test_loss: 1.1649, test_f1: 0.6445
 epoch: 82, train_loss: 0.4998, test_loss: 1.1428, test_f1: 0.6471
 epoch: 83, train_loss: 0.5029, test_loss: 1.1087, test_f1: 0.6326
 epoch: 84, train_loss: 0.5120, test_loss: 1.1117, test_f1: 0.6450
 epoch: 85, train_loss: 0.5010, test_loss: 1.1142, test_f1: 0.6411
 epoch: 86, train_loss: 0.5033, test_loss: 1.1245, test_f1: 0.6365
 epoch: 87, train_loss: 0.4875, test_loss: 1.0992, test_f1: 0.6520
 epoch: 88, train_loss: 0.4725, test_loss: 1.2004, test_f1: 0.6454
 epoch: 89, train_loss: 0.4986, test_loss: 1.1337, test_f1: 0.6509
 epoch: 90, train_loss: 0.4772, test_loss: 1.1225, test_f1: 0.6566
 epoch: 91, train_loss: 0.4778, test_loss: 1.1414, test_f1: 0.6304
 epoch: 92, train_loss: 0.4718, test_loss: 1.1455, test_f1: 0.6545
 epoch: 93, train_loss: 0.4737, test_loss: 1.1659, test_f1: 0.6512
 epoch: 94, train_loss: 0.4742, test_loss: 1.2038, test_f1: 0.6428
 epoch: 95, train_loss: 0.4614, test_loss: 1.1826, test_f1: 0.6314
 epoch: 96, train_loss: 0.4893, test_loss: 1.1806, test_f1: 0.6546
 epoch: 97, train_loss: 0.4730, test_loss: 1.1690, test_f1: 0.6331
 epoch: 98, train_loss: 0.4791, test_loss: 1.1968, test_f1: 0.6456
 epoch: 99, train_loss: 0.4777, test_loss: 1.1990, test_f1: 0.6429
##################ITERATION #2 ****************************************
 epoch: 0, train_loss: 1.2115, test_loss: 1.2353, test_f1: 0.3619
 epoch: 1, train_loss: 1.1048, test_loss: 1.1696, test_f1: 0.4480
 epoch: 2, train_loss: 1.0673, test_loss: 1.1389, test_f1: 0.4670
 epoch: 3, train_loss: 1.0312, test_loss: 1.1194, test_f1: 0.4734
 epoch: 4, train_loss: 1.0168, test_loss: 1.1009, test_f1: 0.4865
 epoch: 5, train_loss: 0.9956, test_loss: 1.0900, test_f1: 0.4928
 epoch: 6, train_loss: 0.9713, test_loss: 1.0848, test_f1: 0.5029
 epoch: 7, train_loss: 0.9557, test_loss: 1.0751, test_f1: 0.5149
 epoch: 8, train_loss: 0.9499, test_loss: 1.0656, test_f1: 0.5218
 epoch: 9, train_loss: 0.9363, test_loss: 1.0542, test_f1: 0.5286
 epoch: 10, train_loss: 0.9193, test_loss: 1.0488, test_f1: 0.5315
 epoch: 11, train_loss: 0.9093, test_loss: 1.0423, test_f1: 0.5432
 epoch: 12, train_loss: 0.8840, test_loss: 1.0351, test_f1: 0.5601
 epoch: 13, train_loss: 0.8787, test_loss: 1.0559, test_f1: 0.5504
 epoch: 14, train_loss: 0.8692, test_loss: 1.0549, test_f1: 0.5472
 epoch: 15, train_loss: 0.8681, test_loss: 1.0487, test_f1: 0.5694
 epoch: 16, train_loss: 0.8457, test_loss: 1.0583, test_f1: 0.5550
 epoch: 17, train_loss: 0.8438, test_loss: 1.0541, test_f1: 0.5605
 epoch: 18, train_loss: 0.8325, test_loss: 1.0501, test_f1: 0.5629
 epoch: 19, train_loss: 0.8269, test_loss: 1.0616, test_f1: 0.5817
 epoch: 20, train_loss: 0.8211, test_loss: 1.0517, test_f1: 0.5669
 epoch: 21, train_loss: 0.8055, test_loss: 1.0364, test_f1: 0.5428
 epoch: 22, train_loss: 0.7901, test_loss: 1.0417, test_f1: 0.5826
 epoch: 23, train_loss: 0.7751, test_loss: 1.0595, test_f1: 0.5720
 epoch: 24, train_loss: 0.7657, test_loss: 1.0443, test_f1: 0.5946
 epoch: 25, train_loss: 0.7675, test_loss: 1.0197, test_f1: 0.6046
 epoch: 26, train_loss: 0.7542, test_loss: 1.0630, test_f1: 0.6169
 epoch: 27, train_loss: 0.7536, test_loss: 1.0606, test_f1: 0.6079
 epoch: 28, train_loss: 0.7398, test_loss: 1.0459, test_f1: 0.6130
 epoch: 29, train_loss: 0.7406, test_loss: 1.0186, test_f1: 0.6038
 epoch: 30, train_loss: 0.7193, test_loss: 1.0450, test_f1: 0.5989
 epoch: 31, train_loss: 0.7277, test_loss: 1.0523, test_f1: 0.5882
 epoch: 32, train_loss: 0.7226, test_loss: 1.0530, test_f1: 0.5995
 epoch: 33, train_loss: 0.7112, test_loss: 1.0079, test_f1: 0.6234
 epoch: 34, train_loss: 0.6906, test_loss: 1.0848, test_f1: 0.5410
 epoch: 35, train_loss: 0.6716, test_loss: 1.0303, test_f1: 0.6224
 epoch: 36, train_loss: 0.6650, test_loss: 1.0590, test_f1: 0.5909
 epoch: 37, train_loss: 0.6810, test_loss: 1.0749, test_f1: 0.5968
 epoch: 38, train_loss: 0.6764, test_loss: 1.0579, test_f1: 0.5481
 epoch: 39, train_loss: 0.6603, test_loss: 1.0677, test_f1: 0.6058
 epoch: 40, train_loss: 0.6542, test_loss: 1.0501, test_f1: 0.5891
 epoch: 41, train_loss: 0.6383, test_loss: 1.0341, test_f1: 0.6294
 epoch: 42, train_loss: 0.6471, test_loss: 1.1175, test_f1: 0.6124
 epoch: 43, train_loss: 0.6317, test_loss: 1.0738, test_f1: 0.5953
 epoch: 44, train_loss: 0.6243, test_loss: 1.0458, test_f1: 0.6156
 epoch: 45, train_loss: 0.6150, test_loss: 1.0611, test_f1: 0.6189
 epoch: 46, train_loss: 0.6218, test_loss: 1.1299, test_f1: 0.5727
 epoch: 47, train_loss: 0.5953, test_loss: 1.0882, test_f1: 0.6144
 epoch: 48, train_loss: 0.6024, test_loss: 1.1410, test_f1: 0.5710
 epoch: 49, train_loss: 0.5945, test_loss: 1.1132, test_f1: 0.6032
 epoch: 50, train_loss: 0.5942, test_loss: 1.1024, test_f1: 0.6163
 epoch: 51, train_loss: 0.5590, test_loss: 1.0813, test_f1: 0.6170
 epoch: 52, train_loss: 0.5586, test_loss: 1.0877, test_f1: 0.6128
 epoch: 53, train_loss: 0.5661, test_loss: 1.1479, test_f1: 0.5926
 epoch: 54, train_loss: 0.5513, test_loss: 1.1308, test_f1: 0.6148
 epoch: 55, train_loss: 0.5547, test_loss: 1.1833, test_f1: 0.6044
 epoch: 56, train_loss: 0.5654, test_loss: 1.1285, test_f1: 0.6325
 epoch: 57, train_loss: 0.5368, test_loss: 1.1366, test_f1: 0.6082
 epoch: 58, train_loss: 0.5160, test_loss: 1.1648, test_f1: 0.6143
 epoch: 59, train_loss: 0.5439, test_loss: 1.1441, test_f1: 0.6193
 epoch: 60, train_loss: 0.5301, test_loss: 1.1490, test_f1: 0.6089
 epoch: 61, train_loss: 0.5120, test_loss: 1.1532, test_f1: 0.5911
 epoch: 62, train_loss: 0.5136, test_loss: 1.1904, test_f1: 0.6146
 epoch: 63, train_loss: 0.5050, test_loss: 1.1597, test_f1: 0.6247
 epoch: 64, train_loss: 0.5308, test_loss: 1.2000, test_f1: 0.5770
 epoch: 65, train_loss: 0.4904, test_loss: 1.2509, test_f1: 0.5889
 epoch: 66, train_loss: 0.5113, test_loss: 1.2106, test_f1: 0.5797
 epoch: 67, train_loss: 0.4818, test_loss: 1.2364, test_f1: 0.5956
 epoch: 68, train_loss: 0.5089, test_loss: 1.2531, test_f1: 0.5846
 epoch: 69, train_loss: 0.5129, test_loss: 1.2048, test_f1: 0.6255
 epoch: 70, train_loss: 0.5162, test_loss: 1.2553, test_f1: 0.5964
 epoch: 71, train_loss: 0.4966, test_loss: 1.1788, test_f1: 0.6115
 epoch: 72, train_loss: 0.5140, test_loss: 1.2395, test_f1: 0.6097
 epoch: 73, train_loss: 0.4979, test_loss: 1.2386, test_f1: 0.6039
 epoch: 74, train_loss: 0.4748, test_loss: 1.2274, test_f1: 0.6205
 epoch: 75, train_loss: 0.5016, test_loss: 1.2474, test_f1: 0.6514
 epoch: 76, train_loss: 0.4696, test_loss: 1.2730, test_f1: 0.6450
 epoch: 77, train_loss: 0.4719, test_loss: 1.2645, test_f1: 0.6242
 epoch: 78, train_loss: 0.4847, test_loss: 1.2659, test_f1: 0.6288
 epoch: 79, train_loss: 0.4678, test_loss: 1.2528, test_f1: 0.6292
 epoch: 80, train_loss: 0.4820, test_loss: 1.3306, test_f1: 0.5880
 epoch: 81, train_loss: 0.4732, test_loss: 1.2879, test_f1: 0.6306
 epoch: 82, train_loss: 0.4576, test_loss: 1.3120, test_f1: 0.6252
 epoch: 83, train_loss: 0.4688, test_loss: 1.3206, test_f1: 0.6154
 epoch: 84, train_loss: 0.4463, test_loss: 1.2719, test_f1: 0.6478
 epoch: 85, train_loss: 0.4626, test_loss: 1.3186, test_f1: 0.6355
 epoch: 86, train_loss: 0.4654, test_loss: 1.2974, test_f1: 0.6300
 epoch: 87, train_loss: 0.4650, test_loss: 1.3075, test_f1: 0.6324
 epoch: 88, train_loss: 0.4522, test_loss: 1.3980, test_f1: 0.5696
 epoch: 89, train_loss: 0.4344, test_loss: 1.3244, test_f1: 0.6133
 epoch: 90, train_loss: 0.4533, test_loss: 1.3519, test_f1: 0.6151
 epoch: 91, train_loss: 0.4400, test_loss: 1.4215, test_f1: 0.5784
 epoch: 92, train_loss: 0.4372, test_loss: 1.4189, test_f1: 0.6130
 epoch: 93, train_loss: 0.4271, test_loss: 1.3722, test_f1: 0.6187
 epoch: 94, train_loss: 0.4004, test_loss: 1.3672, test_f1: 0.6167
 epoch: 95, train_loss: 0.4087, test_loss: 1.4102, test_f1: 0.6239
 epoch: 96, train_loss: 0.4385, test_loss: 1.4068, test_f1: 0.6404
 epoch: 97, train_loss: 0.4202, test_loss: 1.4100, test_f1: 0.6081
 epoch: 98, train_loss: 0.4279, test_loss: 1.4097, test_f1: 0.6182
 epoch: 99, train_loss: 0.4298, test_loss: 1.4796, test_f1: 0.6306
##################ITERATION #3 ****************************************
 epoch: 0, train_loss: 1.1710, test_loss: 1.2201, test_f1: 0.3816
 epoch: 1, train_loss: 1.0809, test_loss: 1.1268, test_f1: 0.4678
 epoch: 2, train_loss: 1.0424, test_loss: 1.1059, test_f1: 0.4807
 epoch: 3, train_loss: 1.0224, test_loss: 1.0835, test_f1: 0.4750
 epoch: 4, train_loss: 0.9990, test_loss: 1.0629, test_f1: 0.4876
 epoch: 5, train_loss: 0.9842, test_loss: 1.0490, test_f1: 0.4893
 epoch: 6, train_loss: 0.9720, test_loss: 1.0354, test_f1: 0.5022
 epoch: 7, train_loss: 0.9499, test_loss: 1.0455, test_f1: 0.5227
 epoch: 8, train_loss: 0.9190, test_loss: 1.0342, test_f1: 0.5098
 epoch: 9, train_loss: 0.9217, test_loss: 1.0421, test_f1: 0.5245
 epoch: 10, train_loss: 0.8998, test_loss: 1.0355, test_f1: 0.5206
 epoch: 11, train_loss: 0.8890, test_loss: 1.0396, test_f1: 0.5301
 epoch: 12, train_loss: 0.8880, test_loss: 1.0321, test_f1: 0.5288
 epoch: 13, train_loss: 0.8807, test_loss: 1.0260, test_f1: 0.5556
 epoch: 14, train_loss: 0.8646, test_loss: 1.0453, test_f1: 0.5572
 epoch: 15, train_loss: 0.8540, test_loss: 1.0241, test_f1: 0.5650
 epoch: 16, train_loss: 0.8463, test_loss: 1.0457, test_f1: 0.5646
 epoch: 17, train_loss: 0.8397, test_loss: 1.0412, test_f1: 0.5630
 epoch: 18, train_loss: 0.8266, test_loss: 1.0400, test_f1: 0.5787
 epoch: 19, train_loss: 0.8126, test_loss: 1.0358, test_f1: 0.5597
 epoch: 20, train_loss: 0.8161, test_loss: 1.0502, test_f1: 0.5991
 epoch: 21, train_loss: 0.8151, test_loss: 1.0359, test_f1: 0.5930
 epoch: 22, train_loss: 0.7911, test_loss: 1.0529, test_f1: 0.5915
 epoch: 23, train_loss: 0.7702, test_loss: 1.0389, test_f1: 0.5918
 epoch: 24, train_loss: 0.7775, test_loss: 1.0837, test_f1: 0.5757
 epoch: 25, train_loss: 0.7743, test_loss: 1.0541, test_f1: 0.6023
 epoch: 26, train_loss: 0.7621, test_loss: 1.1017, test_f1: 0.6014
 epoch: 27, train_loss: 0.7474, test_loss: 1.0768, test_f1: 0.6050
 epoch: 28, train_loss: 0.7573, test_loss: 1.0733, test_f1: 0.6027
 epoch: 29, train_loss: 0.7524, test_loss: 1.0604, test_f1: 0.6042
 epoch: 30, train_loss: 0.7358, test_loss: 1.0740, test_f1: 0.6170
 epoch: 31, train_loss: 0.7271, test_loss: 1.0808, test_f1: 0.6023
 epoch: 32, train_loss: 0.7184, test_loss: 1.1146, test_f1: 0.6180
 epoch: 33, train_loss: 0.7244, test_loss: 1.1095, test_f1: 0.6214
 epoch: 34, train_loss: 0.7301, test_loss: 1.1678, test_f1: 0.6164
 epoch: 35, train_loss: 0.7128, test_loss: 1.0986, test_f1: 0.6103
 epoch: 36, train_loss: 0.7034, test_loss: 1.1241, test_f1: 0.6212
 epoch: 37, train_loss: 0.6993, test_loss: 1.1385, test_f1: 0.6181
 epoch: 38, train_loss: 0.6870, test_loss: 1.1133, test_f1: 0.6431
 epoch: 39, train_loss: 0.6886, test_loss: 1.1559, test_f1: 0.6276
 epoch: 40, train_loss: 0.6647, test_loss: 1.1668, test_f1: 0.6059
 epoch: 41, train_loss: 0.6708, test_loss: 1.1504, test_f1: 0.6383
 epoch: 42, train_loss: 0.6655, test_loss: 1.2027, test_f1: 0.6288
 epoch: 43, train_loss: 0.6510, test_loss: 1.1563, test_f1: 0.6287
 epoch: 44, train_loss: 0.6573, test_loss: 1.1905, test_f1: 0.5943
 epoch: 45, train_loss: 0.6616, test_loss: 1.1650, test_f1: 0.6321
 epoch: 46, train_loss: 0.6421, test_loss: 1.2048, test_f1: 0.5985
 epoch: 47, train_loss: 0.6343, test_loss: 1.2625, test_f1: 0.6012
 epoch: 48, train_loss: 0.6259, test_loss: 1.1833, test_f1: 0.6387
 epoch: 49, train_loss: 0.6282, test_loss: 1.1647, test_f1: 0.6174
 epoch: 50, train_loss: 0.6217, test_loss: 1.2473, test_f1: 0.5945
 epoch: 51, train_loss: 0.5972, test_loss: 1.2036, test_f1: 0.6194
 epoch: 52, train_loss: 0.5921, test_loss: 1.2430, test_f1: 0.6246
 epoch: 53, train_loss: 0.5845, test_loss: 1.2312, test_f1: 0.6342
 epoch: 54, train_loss: 0.6110, test_loss: 1.2179, test_f1: 0.6355
 epoch: 55, train_loss: 0.5813, test_loss: 1.2350, test_f1: 0.6132
 epoch: 56, train_loss: 0.6007, test_loss: 1.2601, test_f1: 0.6096
 epoch: 57, train_loss: 0.5828, test_loss: 1.2742, test_f1: 0.5956
 epoch: 58, train_loss: 0.5961, test_loss: 1.2521, test_f1: 0.6296
 epoch: 59, train_loss: 0.5747, test_loss: 1.2916, test_f1: 0.6202
 epoch: 60, train_loss: 0.5873, test_loss: 1.2537, test_f1: 0.6378
 epoch: 61, train_loss: 0.5787, test_loss: 1.2607, test_f1: 0.6358
 epoch: 62, train_loss: 0.5789, test_loss: 1.2578, test_f1: 0.6378
 epoch: 63, train_loss: 0.5662, test_loss: 1.2678, test_f1: 0.6279
 epoch: 64, train_loss: 0.5696, test_loss: 1.2716, test_f1: 0.6299
 epoch: 65, train_loss: 0.5518, test_loss: 1.3131, test_f1: 0.5893
 epoch: 66, train_loss: 0.5449, test_loss: 1.2475, test_f1: 0.6344
 epoch: 67, train_loss: 0.5496, test_loss: 1.3357, test_f1: 0.6244
 epoch: 68, train_loss: 0.5348, test_loss: 1.3176, test_f1: 0.6075
 epoch: 69, train_loss: 0.5292, test_loss: 1.3122, test_f1: 0.6198
 epoch: 70, train_loss: 0.5428, test_loss: 1.3224, test_f1: 0.6189
 epoch: 71, train_loss: 0.5385, test_loss: 1.3335, test_f1: 0.6195
 epoch: 72, train_loss: 0.5379, test_loss: 1.3295, test_f1: 0.6313
 epoch: 73, train_loss: 0.5328, test_loss: 1.3384, test_f1: 0.6137
 epoch: 74, train_loss: 0.5340, test_loss: 1.3778, test_f1: 0.6073
 epoch: 75, train_loss: 0.5335, test_loss: 1.3700, test_f1: 0.6419
 epoch: 76, train_loss: 0.5337, test_loss: 1.4085, test_f1: 0.6074
 epoch: 77, train_loss: 0.5266, test_loss: 1.4273, test_f1: 0.6012
 epoch: 78, train_loss: 0.5240, test_loss: 1.3868, test_f1: 0.6136
 epoch: 79, train_loss: 0.5238, test_loss: 1.4398, test_f1: 0.5992
 epoch: 80, train_loss: 0.5169, test_loss: 1.3844, test_f1: 0.6177
 epoch: 81, train_loss: 0.5104, test_loss: 1.4199, test_f1: 0.5969
 epoch: 82, train_loss: 0.5045, test_loss: 1.4389, test_f1: 0.6171
 epoch: 83, train_loss: 0.5222, test_loss: 1.4025, test_f1: 0.6471
 epoch: 84, train_loss: 0.5008, test_loss: 1.4388, test_f1: 0.6249
 epoch: 85, train_loss: 0.4898, test_loss: 1.4029, test_f1: 0.6127
 epoch: 86, train_loss: 0.5141, test_loss: 1.5202, test_f1: 0.5711
 epoch: 87, train_loss: 0.4931, test_loss: 1.4396, test_f1: 0.6190
 epoch: 88, train_loss: 0.4799, test_loss: 1.4773, test_f1: 0.6209
 epoch: 89, train_loss: 0.4838, test_loss: 1.4746, test_f1: 0.5991
 epoch: 90, train_loss: 0.4867, test_loss: 1.4491, test_f1: 0.6102
 epoch: 91, train_loss: 0.5097, test_loss: 1.4596, test_f1: 0.6284
 epoch: 92, train_loss: 0.4854, test_loss: 1.5163, test_f1: 0.6023
 epoch: 93, train_loss: 0.4944, test_loss: 1.4109, test_f1: 0.6160
 epoch: 94, train_loss: 0.4772, test_loss: 1.4926, test_f1: 0.6095
 epoch: 95, train_loss: 0.4473, test_loss: 1.5658, test_f1: 0.6053
 epoch: 96, train_loss: 0.4861, test_loss: 1.5702, test_f1: 0.6283
 epoch: 97, train_loss: 0.4702, test_loss: 1.5313, test_f1: 0.6035
 epoch: 98, train_loss: 0.4694, test_loss: 1.5209, test_f1: 0.5855
 epoch: 99, train_loss: 0.5034, test_loss: 1.5728, test_f1: 0.6263
##################ITERATION #4 ****************************************
 epoch: 0, train_loss: 1.1864, test_loss: 1.1909, test_f1: 0.4095
 epoch: 1, train_loss: 1.0835, test_loss: 1.0956, test_f1: 0.4770
 epoch: 2, train_loss: 1.0290, test_loss: 1.0764, test_f1: 0.4705
 epoch: 3, train_loss: 1.0193, test_loss: 1.0635, test_f1: 0.4996
 epoch: 4, train_loss: 0.9928, test_loss: 1.0683, test_f1: 0.4916
 epoch: 5, train_loss: 0.9510, test_loss: 1.0518, test_f1: 0.5226
 epoch: 6, train_loss: 0.9673, test_loss: 1.0183, test_f1: 0.5507
 epoch: 7, train_loss: 0.9458, test_loss: 1.0228, test_f1: 0.5209
 epoch: 8, train_loss: 0.9243, test_loss: 1.0163, test_f1: 0.5443
 epoch: 9, train_loss: 0.9060, test_loss: 1.0195, test_f1: 0.5527
 epoch: 10, train_loss: 0.8879, test_loss: 1.0173, test_f1: 0.5455
 epoch: 11, train_loss: 0.8690, test_loss: 1.0247, test_f1: 0.5521
 epoch: 12, train_loss: 0.8743, test_loss: 1.0307, test_f1: 0.5668
 epoch: 13, train_loss: 0.8414, test_loss: 1.0359, test_f1: 0.5581
 epoch: 14, train_loss: 0.8555, test_loss: 0.9859, test_f1: 0.5992
 epoch: 15, train_loss: 0.8332, test_loss: 1.0081, test_f1: 0.5680
 epoch: 16, train_loss: 0.8359, test_loss: 1.0190, test_f1: 0.5763
 epoch: 17, train_loss: 0.8164, test_loss: 1.0078, test_f1: 0.6125
 epoch: 18, train_loss: 0.8104, test_loss: 0.9865, test_f1: 0.6047
 epoch: 19, train_loss: 0.7982, test_loss: 0.9839, test_f1: 0.6127
 epoch: 20, train_loss: 0.8065, test_loss: 1.0042, test_f1: 0.6141
 epoch: 21, train_loss: 0.7890, test_loss: 1.0078, test_f1: 0.6294
 epoch: 22, train_loss: 0.7763, test_loss: 0.9920, test_f1: 0.6278
 epoch: 23, train_loss: 0.7800, test_loss: 0.9945, test_f1: 0.6452
 epoch: 24, train_loss: 0.7711, test_loss: 1.0058, test_f1: 0.6306
 epoch: 25, train_loss: 0.7675, test_loss: 1.0323, test_f1: 0.6000
 epoch: 26, train_loss: 0.7490, test_loss: 1.0208, test_f1: 0.6218
 epoch: 27, train_loss: 0.7475, test_loss: 1.0463, test_f1: 0.5894
 epoch: 28, train_loss: 0.7263, test_loss: 1.0012, test_f1: 0.6408
 epoch: 29, train_loss: 0.7332, test_loss: 1.0367, test_f1: 0.6393
 epoch: 30, train_loss: 0.7298, test_loss: 1.0542, test_f1: 0.6267
 epoch: 31, train_loss: 0.6988, test_loss: 1.0630, test_f1: 0.6236
 epoch: 32, train_loss: 0.7076, test_loss: 1.0508, test_f1: 0.6286
 epoch: 33, train_loss: 0.6916, test_loss: 1.0232, test_f1: 0.5989
 epoch: 34, train_loss: 0.6924, test_loss: 1.0889, test_f1: 0.6209
 epoch: 35, train_loss: 0.6909, test_loss: 1.0718, test_f1: 0.6124
 epoch: 36, train_loss: 0.6678, test_loss: 1.1115, test_f1: 0.6053
 epoch: 37, train_loss: 0.6731, test_loss: 1.0996, test_f1: 0.5947
 epoch: 38, train_loss: 0.6492, test_loss: 1.0512, test_f1: 0.6108
 epoch: 39, train_loss: 0.6651, test_loss: 1.0483, test_f1: 0.6295
 epoch: 40, train_loss: 0.6388, test_loss: 1.0705, test_f1: 0.6142
 epoch: 41, train_loss: 0.6380, test_loss: 1.0973, test_f1: 0.6531
 epoch: 42, train_loss: 0.6383, test_loss: 1.1166, test_f1: 0.6017
 epoch: 43, train_loss: 0.6233, test_loss: 1.0972, test_f1: 0.6351
 epoch: 44, train_loss: 0.6459, test_loss: 1.1743, test_f1: 0.5917
 epoch: 45, train_loss: 0.6190, test_loss: 1.1361, test_f1: 0.6394
 epoch: 46, train_loss: 0.6235, test_loss: 1.1185, test_f1: 0.6139
 epoch: 47, train_loss: 0.6037, test_loss: 1.1713, test_f1: 0.6377
 epoch: 48, train_loss: 0.5933, test_loss: 1.1738, test_f1: 0.6312
 epoch: 49, train_loss: 0.6108, test_loss: 1.1571, test_f1: 0.6184
 epoch: 50, train_loss: 0.5931, test_loss: 1.1647, test_f1: 0.6181
 epoch: 51, train_loss: 0.5867, test_loss: 1.1648, test_f1: 0.6311
 epoch: 52, train_loss: 0.5582, test_loss: 1.1907, test_f1: 0.6481
 epoch: 53, train_loss: 0.5740, test_loss: 1.1987, test_f1: 0.6288
 epoch: 54, train_loss: 0.5724, test_loss: 1.1933, test_f1: 0.6537
 epoch: 55, train_loss: 0.5641, test_loss: 1.1731, test_f1: 0.6434
 epoch: 56, train_loss: 0.5606, test_loss: 1.1900, test_f1: 0.6298
 epoch: 57, train_loss: 0.5500, test_loss: 1.1969, test_f1: 0.6521
 epoch: 58, train_loss: 0.5616, test_loss: 1.2391, test_f1: 0.6411
 epoch: 59, train_loss: 0.5591, test_loss: 1.2080, test_f1: 0.6240
 epoch: 60, train_loss: 0.5416, test_loss: 1.2013, test_f1: 0.6273
 epoch: 61, train_loss: 0.5428, test_loss: 1.2136, test_f1: 0.6284
 epoch: 62, train_loss: 0.5267, test_loss: 1.2198, test_f1: 0.6316
 epoch: 63, train_loss: 0.5422, test_loss: 1.2520, test_f1: 0.6466
 epoch: 64, train_loss: 0.5355, test_loss: 1.2418, test_f1: 0.6322
 epoch: 65, train_loss: 0.5442, test_loss: 1.2468, test_f1: 0.6469
 epoch: 66, train_loss: 0.5266, test_loss: 1.2408, test_f1: 0.6381
 epoch: 67, train_loss: 0.5212, test_loss: 1.2649, test_f1: 0.6199
 epoch: 68, train_loss: 0.5376, test_loss: 1.2524, test_f1: 0.6274
 epoch: 69, train_loss: 0.5193, test_loss: 1.3038, test_f1: 0.6198
 epoch: 70, train_loss: 0.4996, test_loss: 1.3334, test_f1: 0.6184
 epoch: 71, train_loss: 0.4970, test_loss: 1.2578, test_f1: 0.6228
 epoch: 72, train_loss: 0.4928, test_loss: 1.3143, test_f1: 0.6172
 epoch: 73, train_loss: 0.5138, test_loss: 1.2869, test_f1: 0.6503
 epoch: 74, train_loss: 0.5133, test_loss: 1.3199, test_f1: 0.6221
 epoch: 75, train_loss: 0.4979, test_loss: 1.3801, test_f1: 0.6222
 epoch: 76, train_loss: 0.5132, test_loss: 1.3586, test_f1: 0.6195
 epoch: 77, train_loss: 0.5144, test_loss: 1.3349, test_f1: 0.6399
 epoch: 78, train_loss: 0.4854, test_loss: 1.3470, test_f1: 0.6276
 epoch: 79, train_loss: 0.4765, test_loss: 1.4033, test_f1: 0.6271
 epoch: 80, train_loss: 0.4690, test_loss: 1.3506, test_f1: 0.6372
 epoch: 81, train_loss: 0.4908, test_loss: 1.3577, test_f1: 0.6449
 epoch: 82, train_loss: 0.4796, test_loss: 1.3963, test_f1: 0.6539
 epoch: 83, train_loss: 0.4973, test_loss: 1.3826, test_f1: 0.6413
 epoch: 84, train_loss: 0.4877, test_loss: 1.3528, test_f1: 0.6419
 epoch: 85, train_loss: 0.4920, test_loss: 1.3782, test_f1: 0.6383
 epoch: 86, train_loss: 0.4766, test_loss: 1.3868, test_f1: 0.6227
 epoch: 87, train_loss: 0.4937, test_loss: 1.3958, test_f1: 0.6342
 epoch: 88, train_loss: 0.4682, test_loss: 1.3970, test_f1: 0.6390
 epoch: 89, train_loss: 0.4694, test_loss: 1.3924, test_f1: 0.6442
 epoch: 90, train_loss: 0.4390, test_loss: 1.3806, test_f1: 0.6343
 epoch: 91, train_loss: 0.4772, test_loss: 1.4445, test_f1: 0.6394
 epoch: 92, train_loss: 0.4652, test_loss: 1.3832, test_f1: 0.6271
 epoch: 93, train_loss: 0.4757, test_loss: 1.3936, test_f1: 0.6294
 epoch: 94, train_loss: 0.4651, test_loss: 1.3928, test_f1: 0.6332
 epoch: 95, train_loss: 0.4403, test_loss: 1.4301, test_f1: 0.6321
 epoch: 96, train_loss: 0.4664, test_loss: 1.4133, test_f1: 0.6447
 epoch: 97, train_loss: 0.4544, test_loss: 1.4635, test_f1: 0.6328
 epoch: 98, train_loss: 0.4490, test_loss: 1.4067, test_f1: 0.6398
 epoch: 99, train_loss: 0.4491, test_loss: 1.4489, test_f1: 0.6473
##################ITERATION #5 ****************************************
 epoch: 0, train_loss: 1.1967, test_loss: 1.1975, test_f1: 0.4713
 epoch: 1, train_loss: 1.1044, test_loss: 1.1304, test_f1: 0.4630
 epoch: 2, train_loss: 1.0590, test_loss: 1.0984, test_f1: 0.4752
 epoch: 3, train_loss: 1.0317, test_loss: 1.0840, test_f1: 0.5004
 epoch: 4, train_loss: 0.9947, test_loss: 1.0873, test_f1: 0.4826
 epoch: 5, train_loss: 0.9895, test_loss: 1.0809, test_f1: 0.4886
 epoch: 6, train_loss: 0.9747, test_loss: 1.0545, test_f1: 0.4974
 epoch: 7, train_loss: 0.9398, test_loss: 1.0449, test_f1: 0.5052
 epoch: 8, train_loss: 0.9463, test_loss: 1.0541, test_f1: 0.5154
 epoch: 9, train_loss: 0.9158, test_loss: 1.0342, test_f1: 0.5405
 epoch: 10, train_loss: 0.9134, test_loss: 1.0301, test_f1: 0.5282
 epoch: 11, train_loss: 0.9133, test_loss: 1.0322, test_f1: 0.5445
 epoch: 12, train_loss: 0.8922, test_loss: 1.0387, test_f1: 0.5366
 epoch: 13, train_loss: 0.8675, test_loss: 1.0024, test_f1: 0.5957
 epoch: 14, train_loss: 0.8665, test_loss: 1.0186, test_f1: 0.5582
 epoch: 15, train_loss: 0.8643, test_loss: 1.0075, test_f1: 0.5825
 epoch: 16, train_loss: 0.8518, test_loss: 1.0231, test_f1: 0.5413
 epoch: 17, train_loss: 0.8428, test_loss: 1.0135, test_f1: 0.5656
 epoch: 18, train_loss: 0.8380, test_loss: 1.0191, test_f1: 0.5817
 epoch: 19, train_loss: 0.8307, test_loss: 1.0188, test_f1: 0.5866
 epoch: 20, train_loss: 0.8157, test_loss: 1.0276, test_f1: 0.5642
 epoch: 21, train_loss: 0.8171, test_loss: 1.0253, test_f1: 0.5869
 epoch: 22, train_loss: 0.8130, test_loss: 1.0259, test_f1: 0.5706
 epoch: 23, train_loss: 0.7850, test_loss: 1.0356, test_f1: 0.6178
 epoch: 24, train_loss: 0.7991, test_loss: 1.0254, test_f1: 0.6163
 epoch: 25, train_loss: 0.7886, test_loss: 0.9921, test_f1: 0.6167
 epoch: 26, train_loss: 0.7917, test_loss: 1.0182, test_f1: 0.6133
 epoch: 27, train_loss: 0.7725, test_loss: 1.0229, test_f1: 0.5879
 epoch: 28, train_loss: 0.7739, test_loss: 0.9957, test_f1: 0.6108
 epoch: 29, train_loss: 0.7647, test_loss: 1.0081, test_f1: 0.6004
 epoch: 30, train_loss: 0.7509, test_loss: 1.0232, test_f1: 0.6227
 epoch: 31, train_loss: 0.7380, test_loss: 1.0227, test_f1: 0.5964
 epoch: 32, train_loss: 0.7390, test_loss: 1.0089, test_f1: 0.6118
 epoch: 33, train_loss: 0.7294, test_loss: 1.0171, test_f1: 0.5993
 epoch: 34, train_loss: 0.7222, test_loss: 0.9995, test_f1: 0.6595
 epoch: 35, train_loss: 0.7132, test_loss: 1.0028, test_f1: 0.6269
 epoch: 36, train_loss: 0.7018, test_loss: 1.0090, test_f1: 0.6211
 epoch: 37, train_loss: 0.7105, test_loss: 1.0141, test_f1: 0.6345
 epoch: 38, train_loss: 0.6860, test_loss: 1.0095, test_f1: 0.6299
 epoch: 39, train_loss: 0.7047, test_loss: 1.0317, test_f1: 0.6354
 epoch: 40, train_loss: 0.6715, test_loss: 1.0084, test_f1: 0.6404
 epoch: 41, train_loss: 0.6876, test_loss: 1.0231, test_f1: 0.6183
 epoch: 42, train_loss: 0.6860, test_loss: 1.0132, test_f1: 0.6133
 epoch: 43, train_loss: 0.6681, test_loss: 1.0605, test_f1: 0.6070
 epoch: 44, train_loss: 0.6677, test_loss: 1.0450, test_f1: 0.6162
 epoch: 45, train_loss: 0.6804, test_loss: 1.0314, test_f1: 0.6394
 epoch: 46, train_loss: 0.6609, test_loss: 1.0748, test_f1: 0.6130
 epoch: 47, train_loss: 0.6409, test_loss: 1.0266, test_f1: 0.6355
 epoch: 48, train_loss: 0.6421, test_loss: 1.0856, test_f1: 0.6314
 epoch: 49, train_loss: 0.6511, test_loss: 1.0435, test_f1: 0.6487
 epoch: 50, train_loss: 0.6499, test_loss: 1.0495, test_f1: 0.6214
 epoch: 51, train_loss: 0.6240, test_loss: 1.0649, test_f1: 0.6199
 epoch: 52, train_loss: 0.6095, test_loss: 1.0712, test_f1: 0.6102
 epoch: 53, train_loss: 0.6094, test_loss: 1.0887, test_f1: 0.6273
 epoch: 54, train_loss: 0.6061, test_loss: 1.0612, test_f1: 0.6321
 epoch: 55, train_loss: 0.5992, test_loss: 1.0704, test_f1: 0.6107
 epoch: 56, train_loss: 0.5967, test_loss: 1.0808, test_f1: 0.6443
 epoch: 57, train_loss: 0.6090, test_loss: 1.0587, test_f1: 0.6331
 epoch: 58, train_loss: 0.6038, test_loss: 1.0632, test_f1: 0.6309
 epoch: 59, train_loss: 0.5927, test_loss: 1.0757, test_f1: 0.6424
 epoch: 60, train_loss: 0.5915, test_loss: 1.1345, test_f1: 0.6235
 epoch: 61, train_loss: 0.5926, test_loss: 1.0885, test_f1: 0.6061
 epoch: 62, train_loss: 0.5821, test_loss: 1.1028, test_f1: 0.6109
 epoch: 63, train_loss: 0.5810, test_loss: 1.0637, test_f1: 0.5992
 epoch: 64, train_loss: 0.5655, test_loss: 1.1561, test_f1: 0.6251
 epoch: 65, train_loss: 0.5780, test_loss: 1.1249, test_f1: 0.6077
 epoch: 66, train_loss: 0.5708, test_loss: 1.0938, test_f1: 0.6231
 epoch: 67, train_loss: 0.5576, test_loss: 1.1073, test_f1: 0.6135
 epoch: 68, train_loss: 0.5643, test_loss: 1.1055, test_f1: 0.6112
 epoch: 69, train_loss: 0.5666, test_loss: 1.1405, test_f1: 0.6164
 epoch: 70, train_loss: 0.5536, test_loss: 1.1074, test_f1: 0.6185
 epoch: 71, train_loss: 0.5540, test_loss: 1.1383, test_f1: 0.6208
 epoch: 72, train_loss: 0.5715, test_loss: 1.1202, test_f1: 0.6159
 epoch: 73, train_loss: 0.5567, test_loss: 1.1512, test_f1: 0.6248
 epoch: 74, train_loss: 0.5505, test_loss: 1.1929, test_f1: 0.6385
 epoch: 75, train_loss: 0.5316, test_loss: 1.1849, test_f1: 0.6376
 epoch: 76, train_loss: 0.5375, test_loss: 1.1457, test_f1: 0.6265
 epoch: 77, train_loss: 0.5312, test_loss: 1.1260, test_f1: 0.6128
 epoch: 78, train_loss: 0.5412, test_loss: 1.1359, test_f1: 0.6244
 epoch: 79, train_loss: 0.5388, test_loss: 1.1211, test_f1: 0.6187
 epoch: 80, train_loss: 0.5320, test_loss: 1.1811, test_f1: 0.5877
 epoch: 81, train_loss: 0.5418, test_loss: 1.1611, test_f1: 0.6278
 epoch: 82, train_loss: 0.5499, test_loss: 1.1702, test_f1: 0.6116
 epoch: 83, train_loss: 0.5336, test_loss: 1.1543, test_f1: 0.6195
 epoch: 84, train_loss: 0.5136, test_loss: 1.1559, test_f1: 0.6152
 epoch: 85, train_loss: 0.5063, test_loss: 1.2008, test_f1: 0.6108
 epoch: 86, train_loss: 0.5249, test_loss: 1.1773, test_f1: 0.6398
 epoch: 87, train_loss: 0.5100, test_loss: 1.1905, test_f1: 0.6140
 epoch: 88, train_loss: 0.5104, test_loss: 1.1943, test_f1: 0.6234
 epoch: 89, train_loss: 0.5114, test_loss: 1.2262, test_f1: 0.6353
 epoch: 90, train_loss: 0.5051, test_loss: 1.1636, test_f1: 0.6181
 epoch: 91, train_loss: 0.5022, test_loss: 1.2265, test_f1: 0.6214
 epoch: 92, train_loss: 0.4929, test_loss: 1.2344, test_f1: 0.6238
 epoch: 93, train_loss: 0.4915, test_loss: 1.1514, test_f1: 0.6375
 epoch: 94, train_loss: 0.5052, test_loss: 1.2390, test_f1: 0.6339
 epoch: 95, train_loss: 0.4950, test_loss: 1.2290, test_f1: 0.6266
 epoch: 96, train_loss: 0.4969, test_loss: 1.2402, test_f1: 0.6198
 epoch: 97, train_loss: 0.4942, test_loss: 1.2189, test_f1: 0.6270
 epoch: 98, train_loss: 0.4789, test_loss: 1.2551, test_f1: 0.6174
 epoch: 99, train_loss: 0.4795, test_loss: 1.2393, test_f1: 0.6116
##################ITERATION #6 ****************************************
 epoch: 0, train_loss: 1.2380, test_loss: 1.2258, test_f1: 0.3891
 epoch: 1, train_loss: 1.0942, test_loss: 1.1496, test_f1: 0.4740
 epoch: 2, train_loss: 1.0524, test_loss: 1.1318, test_f1: 0.4912
 epoch: 3, train_loss: 1.0281, test_loss: 1.1312, test_f1: 0.4970
 epoch: 4, train_loss: 1.0037, test_loss: 1.1164, test_f1: 0.5039
 epoch: 5, train_loss: 1.0079, test_loss: 1.1092, test_f1: 0.4935
 epoch: 6, train_loss: 0.9720, test_loss: 1.0793, test_f1: 0.4987
 epoch: 7, train_loss: 0.9385, test_loss: 1.0809, test_f1: 0.5205
 epoch: 8, train_loss: 0.9206, test_loss: 1.0635, test_f1: 0.5214
 epoch: 9, train_loss: 0.9203, test_loss: 1.0812, test_f1: 0.5147
 epoch: 10, train_loss: 0.9051, test_loss: 1.0696, test_f1: 0.5412
 epoch: 11, train_loss: 0.8937, test_loss: 1.0511, test_f1: 0.5528
 epoch: 12, train_loss: 0.8787, test_loss: 1.0435, test_f1: 0.5686
 epoch: 13, train_loss: 0.8834, test_loss: 1.0473, test_f1: 0.5851
 epoch: 14, train_loss: 0.8630, test_loss: 1.0540, test_f1: 0.5538
 epoch: 15, train_loss: 0.8564, test_loss: 1.0423, test_f1: 0.6154
 epoch: 16, train_loss: 0.8542, test_loss: 1.0388, test_f1: 0.5882
 epoch: 17, train_loss: 0.8323, test_loss: 1.0590, test_f1: 0.5460
 epoch: 18, train_loss: 0.8351, test_loss: 1.0321, test_f1: 0.6039
 epoch: 19, train_loss: 0.8305, test_loss: 1.0403, test_f1: 0.5942
 epoch: 20, train_loss: 0.8216, test_loss: 1.0451, test_f1: 0.6057
 epoch: 21, train_loss: 0.8014, test_loss: 1.0338, test_f1: 0.6056
 epoch: 22, train_loss: 0.8051, test_loss: 1.0408, test_f1: 0.6132
 epoch: 23, train_loss: 0.7985, test_loss: 1.0461, test_f1: 0.6207
 epoch: 24, train_loss: 0.7760, test_loss: 1.0393, test_f1: 0.6061
 epoch: 25, train_loss: 0.7748, test_loss: 1.0456, test_f1: 0.5709
 epoch: 26, train_loss: 0.7702, test_loss: 1.0072, test_f1: 0.6300
 epoch: 27, train_loss: 0.7644, test_loss: 1.0260, test_f1: 0.6234
 epoch: 28, train_loss: 0.7465, test_loss: 1.0084, test_f1: 0.6182
 epoch: 29, train_loss: 0.7535, test_loss: 1.0230, test_f1: 0.6145
 epoch: 30, train_loss: 0.7485, test_loss: 1.0329, test_f1: 0.6289
 epoch: 31, train_loss: 0.7404, test_loss: 1.0175, test_f1: 0.6029
 epoch: 32, train_loss: 0.7245, test_loss: 1.0043, test_f1: 0.6095
 epoch: 33, train_loss: 0.7258, test_loss: 1.0009, test_f1: 0.6019
 epoch: 34, train_loss: 0.7146, test_loss: 1.0359, test_f1: 0.6222
 epoch: 35, train_loss: 0.7147, test_loss: 1.0433, test_f1: 0.6056
 epoch: 36, train_loss: 0.7004, test_loss: 1.0630, test_f1: 0.6327
 epoch: 37, train_loss: 0.7167, test_loss: 1.0161, test_f1: 0.6425
 epoch: 38, train_loss: 0.6781, test_loss: 1.0399, test_f1: 0.6302
 epoch: 39, train_loss: 0.6929, test_loss: 1.0413, test_f1: 0.6221
 epoch: 40, train_loss: 0.6745, test_loss: 1.0008, test_f1: 0.6422
 epoch: 41, train_loss: 0.6652, test_loss: 1.0364, test_f1: 0.6529
 epoch: 42, train_loss: 0.6733, test_loss: 1.0240, test_f1: 0.6354
 epoch: 43, train_loss: 0.6522, test_loss: 1.0364, test_f1: 0.6279
 epoch: 44, train_loss: 0.6368, test_loss: 1.0278, test_f1: 0.6406
 epoch: 45, train_loss: 0.6530, test_loss: 1.0814, test_f1: 0.6508
 epoch: 46, train_loss: 0.6292, test_loss: 1.0616, test_f1: 0.6467
 epoch: 47, train_loss: 0.6291, test_loss: 1.0412, test_f1: 0.6334
 epoch: 48, train_loss: 0.6537, test_loss: 1.1582, test_f1: 0.6162
 epoch: 49, train_loss: 0.6276, test_loss: 1.0941, test_f1: 0.6559
 epoch: 50, train_loss: 0.6201, test_loss: 1.0975, test_f1: 0.6524
 epoch: 51, train_loss: 0.5983, test_loss: 1.0718, test_f1: 0.6579
 epoch: 52, train_loss: 0.5827, test_loss: 1.0870, test_f1: 0.6551
 epoch: 53, train_loss: 0.5903, test_loss: 1.0828, test_f1: 0.6398
 epoch: 54, train_loss: 0.5915, test_loss: 1.1166, test_f1: 0.6569
 epoch: 55, train_loss: 0.5771, test_loss: 1.0777, test_f1: 0.6554
 epoch: 56, train_loss: 0.5877, test_loss: 1.1108, test_f1: 0.6377
 epoch: 57, train_loss: 0.5715, test_loss: 1.1017, test_f1: 0.6310
 epoch: 58, train_loss: 0.5663, test_loss: 1.0951, test_f1: 0.6518
 epoch: 59, train_loss: 0.5624, test_loss: 1.1166, test_f1: 0.6459
 epoch: 60, train_loss: 0.5775, test_loss: 1.1312, test_f1: 0.6418
 epoch: 61, train_loss: 0.5814, test_loss: 1.1268, test_f1: 0.6403
 epoch: 62, train_loss: 0.5687, test_loss: 1.1434, test_f1: 0.6430
 epoch: 63, train_loss: 0.5807, test_loss: 1.1120, test_f1: 0.6217
 epoch: 64, train_loss: 0.5389, test_loss: 1.1326, test_f1: 0.6360
 epoch: 65, train_loss: 0.5597, test_loss: 1.1485, test_f1: 0.6283
 epoch: 66, train_loss: 0.5329, test_loss: 1.1589, test_f1: 0.6238
 epoch: 67, train_loss: 0.5527, test_loss: 1.1452, test_f1: 0.6285
 epoch: 68, train_loss: 0.5461, test_loss: 1.1433, test_f1: 0.6588
 epoch: 69, train_loss: 0.5469, test_loss: 1.1569, test_f1: 0.6490
 epoch: 70, train_loss: 0.5582, test_loss: 1.1673, test_f1: 0.6434
 epoch: 71, train_loss: 0.5207, test_loss: 1.1827, test_f1: 0.6336
 epoch: 72, train_loss: 0.5421, test_loss: 1.1725, test_f1: 0.6363
 epoch: 73, train_loss: 0.5267, test_loss: 1.1586, test_f1: 0.6412
 epoch: 74, train_loss: 0.5046, test_loss: 1.1847, test_f1: 0.6338
 epoch: 75, train_loss: 0.5374, test_loss: 1.1668, test_f1: 0.6283
 epoch: 76, train_loss: 0.5230, test_loss: 1.1804, test_f1: 0.6390
 epoch: 77, train_loss: 0.5323, test_loss: 1.2019, test_f1: 0.6436
 epoch: 78, train_loss: 0.4999, test_loss: 1.2183, test_f1: 0.6288
 epoch: 79, train_loss: 0.5060, test_loss: 1.2146, test_f1: 0.6040
 epoch: 80, train_loss: 0.5012, test_loss: 1.1807, test_f1: 0.6307
 epoch: 81, train_loss: 0.5170, test_loss: 1.2416, test_f1: 0.6207
 epoch: 82, train_loss: 0.5056, test_loss: 1.2383, test_f1: 0.6093
 epoch: 83, train_loss: 0.5215, test_loss: 1.2169, test_f1: 0.6497
 epoch: 84, train_loss: 0.4916, test_loss: 1.2569, test_f1: 0.6117
 epoch: 85, train_loss: 0.4949, test_loss: 1.2355, test_f1: 0.6412
 epoch: 86, train_loss: 0.4976, test_loss: 1.2207, test_f1: 0.6333
 epoch: 87, train_loss: 0.5092, test_loss: 1.2966, test_f1: 0.6183
 epoch: 88, train_loss: 0.5129, test_loss: 1.2348, test_f1: 0.6219
 epoch: 89, train_loss: 0.4742, test_loss: 1.2585, test_f1: 0.6396
 epoch: 90, train_loss: 0.4617, test_loss: 1.2913, test_f1: 0.5743
 epoch: 91, train_loss: 0.4776, test_loss: 1.2647, test_f1: 0.5864
 epoch: 92, train_loss: 0.4791, test_loss: 1.2504, test_f1: 0.5905
 epoch: 93, train_loss: 0.4882, test_loss: 1.3040, test_f1: 0.6406
 epoch: 94, train_loss: 0.4908, test_loss: 1.2840, test_f1: 0.6352
 epoch: 95, train_loss: 0.4671, test_loss: 1.2952, test_f1: 0.5902
 epoch: 96, train_loss: 0.4609, test_loss: 1.3322, test_f1: 0.6362
 epoch: 97, train_loss: 0.4715, test_loss: 1.3144, test_f1: 0.6299
 epoch: 98, train_loss: 0.4710, test_loss: 1.3525, test_f1: 0.6116
 epoch: 99, train_loss: 0.4757, test_loss: 1.3837, test_f1: 0.5812
##################ITERATION #7 ****************************************
 epoch: 0, train_loss: 1.2802, test_loss: 1.2180, test_f1: 0.3567
 epoch: 1, train_loss: 1.1014, test_loss: 1.1726, test_f1: 0.4772
 epoch: 2, train_loss: 1.0555, test_loss: 1.1337, test_f1: 0.5345
 epoch: 3, train_loss: 1.0272, test_loss: 1.1226, test_f1: 0.5147
 epoch: 4, train_loss: 1.0353, test_loss: 1.1241, test_f1: 0.5179
 epoch: 5, train_loss: 0.9799, test_loss: 1.1123, test_f1: 0.5260
 epoch: 6, train_loss: 0.9922, test_loss: 1.0943, test_f1: 0.5380
 epoch: 7, train_loss: 0.9573, test_loss: 1.0755, test_f1: 0.5548
 epoch: 8, train_loss: 0.9652, test_loss: 1.0669, test_f1: 0.5456
 epoch: 9, train_loss: 0.9409, test_loss: 1.0741, test_f1: 0.5341
 epoch: 10, train_loss: 0.9291, test_loss: 1.0423, test_f1: 0.5459
 epoch: 11, train_loss: 0.9247, test_loss: 1.0221, test_f1: 0.5477
 epoch: 12, train_loss: 0.9119, test_loss: 1.0349, test_f1: 0.5487
 epoch: 13, train_loss: 0.8929, test_loss: 1.0391, test_f1: 0.5598
 epoch: 14, train_loss: 0.8680, test_loss: 1.0263, test_f1: 0.5444
 epoch: 15, train_loss: 0.8590, test_loss: 1.0412, test_f1: 0.5579
 epoch: 16, train_loss: 0.8639, test_loss: 1.0177, test_f1: 0.5879
 epoch: 17, train_loss: 0.8393, test_loss: 1.0163, test_f1: 0.5971
 epoch: 18, train_loss: 0.8585, test_loss: 0.9980, test_f1: 0.5851
 epoch: 19, train_loss: 0.8309, test_loss: 1.0182, test_f1: 0.6139
 epoch: 20, train_loss: 0.8350, test_loss: 1.0025, test_f1: 0.5935
 epoch: 21, train_loss: 0.8210, test_loss: 1.0228, test_f1: 0.5920
 epoch: 22, train_loss: 0.8339, test_loss: 0.9990, test_f1: 0.5973
 epoch: 23, train_loss: 0.8110, test_loss: 1.0068, test_f1: 0.5988
 epoch: 24, train_loss: 0.8006, test_loss: 1.0141, test_f1: 0.5722
 epoch: 25, train_loss: 0.7985, test_loss: 0.9938, test_f1: 0.6010
 epoch: 26, train_loss: 0.8125, test_loss: 1.0049, test_f1: 0.6122
 epoch: 27, train_loss: 0.7720, test_loss: 1.0068, test_f1: 0.6147
 epoch: 28, train_loss: 0.7878, test_loss: 1.0096, test_f1: 0.6192
 epoch: 29, train_loss: 0.7708, test_loss: 1.0169, test_f1: 0.6036
 epoch: 30, train_loss: 0.7824, test_loss: 1.0308, test_f1: 0.5944
 epoch: 31, train_loss: 0.7647, test_loss: 1.0267, test_f1: 0.6044
 epoch: 32, train_loss: 0.7637, test_loss: 1.0242, test_f1: 0.6108
 epoch: 33, train_loss: 0.7472, test_loss: 1.0399, test_f1: 0.6195
 epoch: 34, train_loss: 0.7430, test_loss: 1.0660, test_f1: 0.6216
 epoch: 35, train_loss: 0.7202, test_loss: 1.0503, test_f1: 0.6281
 epoch: 36, train_loss: 0.7359, test_loss: 1.0249, test_f1: 0.6163
 epoch: 37, train_loss: 0.7181, test_loss: 1.0476, test_f1: 0.6055
 epoch: 38, train_loss: 0.7294, test_loss: 1.0244, test_f1: 0.6378
 epoch: 39, train_loss: 0.7253, test_loss: 1.0751, test_f1: 0.6122
 epoch: 40, train_loss: 0.7063, test_loss: 1.0607, test_f1: 0.6095
 epoch: 41, train_loss: 0.6958, test_loss: 1.0708, test_f1: 0.6254
 epoch: 42, train_loss: 0.6892, test_loss: 1.0514, test_f1: 0.6038
 epoch: 43, train_loss: 0.6814, test_loss: 1.0060, test_f1: 0.6147
 epoch: 44, train_loss: 0.6743, test_loss: 1.0577, test_f1: 0.6116
 epoch: 45, train_loss: 0.6776, test_loss: 1.0779, test_f1: 0.6155
 epoch: 46, train_loss: 0.6540, test_loss: 1.0658, test_f1: 0.6083
 epoch: 47, train_loss: 0.6677, test_loss: 1.0919, test_f1: 0.6072
 epoch: 48, train_loss: 0.6476, test_loss: 1.0879, test_f1: 0.6298
 epoch: 49, train_loss: 0.6334, test_loss: 1.1265, test_f1: 0.6187
 epoch: 50, train_loss: 0.6298, test_loss: 1.0876, test_f1: 0.6301
 epoch: 51, train_loss: 0.6204, test_loss: 1.0673, test_f1: 0.6345
 epoch: 52, train_loss: 0.6266, test_loss: 1.0734, test_f1: 0.6269
 epoch: 53, train_loss: 0.6017, test_loss: 1.0904, test_f1: 0.6242
 epoch: 54, train_loss: 0.6029, test_loss: 1.1121, test_f1: 0.6193
 epoch: 55, train_loss: 0.6107, test_loss: 1.1144, test_f1: 0.6198
 epoch: 56, train_loss: 0.6021, test_loss: 1.1373, test_f1: 0.6187
 epoch: 57, train_loss: 0.5993, test_loss: 1.1585, test_f1: 0.6020
 epoch: 58, train_loss: 0.5944, test_loss: 1.1331, test_f1: 0.6220
 epoch: 59, train_loss: 0.5766, test_loss: 1.1741, test_f1: 0.6033
 epoch: 60, train_loss: 0.5992, test_loss: 1.1493, test_f1: 0.6273
 epoch: 61, train_loss: 0.5836, test_loss: 1.1538, test_f1: 0.6135
 epoch: 62, train_loss: 0.5799, test_loss: 1.1275, test_f1: 0.6297
 epoch: 63, train_loss: 0.6002, test_loss: 1.1633, test_f1: 0.6265
 epoch: 64, train_loss: 0.5969, test_loss: 1.1473, test_f1: 0.6224
 epoch: 65, train_loss: 0.5746, test_loss: 1.1622, test_f1: 0.6299
 epoch: 66, train_loss: 0.5597, test_loss: 1.1534, test_f1: 0.6074
 epoch: 67, train_loss: 0.5793, test_loss: 1.1671, test_f1: 0.6246
 epoch: 68, train_loss: 0.5700, test_loss: 1.1674, test_f1: 0.6421
 epoch: 69, train_loss: 0.5790, test_loss: 1.1687, test_f1: 0.6348
 epoch: 70, train_loss: 0.5777, test_loss: 1.1946, test_f1: 0.6298
 epoch: 71, train_loss: 0.5689, test_loss: 1.1804, test_f1: 0.6248
 epoch: 72, train_loss: 0.5597, test_loss: 1.2490, test_f1: 0.6169
 epoch: 73, train_loss: 0.5602, test_loss: 1.1695, test_f1: 0.6263
 epoch: 74, train_loss: 0.5523, test_loss: 1.1856, test_f1: 0.6236
 epoch: 75, train_loss: 0.5631, test_loss: 1.1892, test_f1: 0.6239
 epoch: 76, train_loss: 0.5434, test_loss: 1.2137, test_f1: 0.6238
 epoch: 77, train_loss: 0.5429, test_loss: 1.2182, test_f1: 0.6205
 epoch: 78, train_loss: 0.5603, test_loss: 1.2519, test_f1: 0.6320
 epoch: 79, train_loss: 0.5611, test_loss: 1.2399, test_f1: 0.6397
 epoch: 80, train_loss: 0.5519, test_loss: 1.2231, test_f1: 0.6144
 epoch: 81, train_loss: 0.5427, test_loss: 1.2531, test_f1: 0.6181
 epoch: 82, train_loss: 0.5438, test_loss: 1.2739, test_f1: 0.6205
 epoch: 83, train_loss: 0.5366, test_loss: 1.2908, test_f1: 0.6255
 epoch: 84, train_loss: 0.5158, test_loss: 1.2758, test_f1: 0.6290
 epoch: 85, train_loss: 0.5219, test_loss: 1.2832, test_f1: 0.6121
 epoch: 86, train_loss: 0.5433, test_loss: 1.3095, test_f1: 0.6263
 epoch: 87, train_loss: 0.5083, test_loss: 1.2344, test_f1: 0.6221
 epoch: 88, train_loss: 0.5076, test_loss: 1.2771, test_f1: 0.6236
 epoch: 89, train_loss: 0.5131, test_loss: 1.2848, test_f1: 0.6215
 epoch: 90, train_loss: 0.5118, test_loss: 1.2352, test_f1: 0.6267
 epoch: 91, train_loss: 0.5091, test_loss: 1.2981, test_f1: 0.6299
 epoch: 92, train_loss: 0.5104, test_loss: 1.3465, test_f1: 0.6317
 epoch: 93, train_loss: 0.4995, test_loss: 1.3768, test_f1: 0.6347
 epoch: 94, train_loss: 0.5025, test_loss: 1.3485, test_f1: 0.6262
 epoch: 95, train_loss: 0.4994, test_loss: 1.3481, test_f1: 0.6059
 epoch: 96, train_loss: 0.5073, test_loss: 1.3536, test_f1: 0.6217
 epoch: 97, train_loss: 0.4910, test_loss: 1.3896, test_f1: 0.6290
 epoch: 98, train_loss: 0.4928, test_loss: 1.3429, test_f1: 0.6209
 epoch: 99, train_loss: 0.4830, test_loss: 1.3798, test_f1: 0.6263
##################ITERATION #8 ****************************************
 epoch: 0, train_loss: 1.2882, test_loss: 1.2036, test_f1: 0.3959
 epoch: 1, train_loss: 1.1084, test_loss: 1.1174, test_f1: 0.5259
 epoch: 2, train_loss: 1.0846, test_loss: 1.1168, test_f1: 0.5319
 epoch: 3, train_loss: 1.0451, test_loss: 1.0930, test_f1: 0.5365
 epoch: 4, train_loss: 1.0162, test_loss: 1.0717, test_f1: 0.5263
 epoch: 5, train_loss: 1.0048, test_loss: 1.0610, test_f1: 0.5498
 epoch: 6, train_loss: 0.9779, test_loss: 1.0529, test_f1: 0.5448
 epoch: 7, train_loss: 0.9453, test_loss: 1.0507, test_f1: 0.5366
 epoch: 8, train_loss: 0.9352, test_loss: 1.0337, test_f1: 0.5364
 epoch: 9, train_loss: 0.9389, test_loss: 1.0310, test_f1: 0.5640
 epoch: 10, train_loss: 0.9102, test_loss: 1.0374, test_f1: 0.5544
 epoch: 11, train_loss: 0.9022, test_loss: 1.0271, test_f1: 0.5675
 epoch: 12, train_loss: 0.8988, test_loss: 1.0384, test_f1: 0.6036
 epoch: 13, train_loss: 0.8865, test_loss: 1.0062, test_f1: 0.5967
 epoch: 14, train_loss: 0.8717, test_loss: 1.0333, test_f1: 0.5732
 epoch: 15, train_loss: 0.8387, test_loss: 1.0288, test_f1: 0.6200
 epoch: 16, train_loss: 0.8507, test_loss: 1.0411, test_f1: 0.5774
 epoch: 17, train_loss: 0.8308, test_loss: 1.0294, test_f1: 0.5596
 epoch: 18, train_loss: 0.8304, test_loss: 1.0423, test_f1: 0.5885
 epoch: 19, train_loss: 0.8151, test_loss: 1.0414, test_f1: 0.5927
 epoch: 20, train_loss: 0.8038, test_loss: 1.0002, test_f1: 0.5876
 epoch: 21, train_loss: 0.7830, test_loss: 1.0282, test_f1: 0.5855
 epoch: 22, train_loss: 0.7852, test_loss: 1.0213, test_f1: 0.5994
 epoch: 23, train_loss: 0.7951, test_loss: 1.0456, test_f1: 0.6004
 epoch: 24, train_loss: 0.7809, test_loss: 1.0302, test_f1: 0.5953
 epoch: 25, train_loss: 0.7819, test_loss: 1.0500, test_f1: 0.5878
 epoch: 26, train_loss: 0.7640, test_loss: 1.0256, test_f1: 0.6334
 epoch: 27, train_loss: 0.7574, test_loss: 1.0426, test_f1: 0.6098
 epoch: 28, train_loss: 0.7633, test_loss: 1.0798, test_f1: 0.6059
 epoch: 29, train_loss: 0.7524, test_loss: 1.0523, test_f1: 0.6014
 epoch: 30, train_loss: 0.7386, test_loss: 1.0794, test_f1: 0.6063
 epoch: 31, train_loss: 0.7377, test_loss: 1.0571, test_f1: 0.6093
 epoch: 32, train_loss: 0.7315, test_loss: 1.0572, test_f1: 0.6064
 epoch: 33, train_loss: 0.7309, test_loss: 1.0785, test_f1: 0.5970
 epoch: 34, train_loss: 0.7142, test_loss: 1.0777, test_f1: 0.6099
 epoch: 35, train_loss: 0.6926, test_loss: 1.1176, test_f1: 0.6090
 epoch: 36, train_loss: 0.7060, test_loss: 1.1089, test_f1: 0.6358
 epoch: 37, train_loss: 0.6941, test_loss: 1.0809, test_f1: 0.6099
 epoch: 38, train_loss: 0.6983, test_loss: 1.1156, test_f1: 0.6113
 epoch: 39, train_loss: 0.6698, test_loss: 1.0528, test_f1: 0.6095
 epoch: 40, train_loss: 0.6813, test_loss: 1.0960, test_f1: 0.6257
 epoch: 41, train_loss: 0.6911, test_loss: 1.1294, test_f1: 0.5999
 epoch: 42, train_loss: 0.6705, test_loss: 1.1330, test_f1: 0.6232
 epoch: 43, train_loss: 0.6698, test_loss: 1.1065, test_f1: 0.5971
 epoch: 44, train_loss: 0.6655, test_loss: 1.0559, test_f1: 0.6303
 epoch: 45, train_loss: 0.6472, test_loss: 1.0861, test_f1: 0.6058
 epoch: 46, train_loss: 0.6452, test_loss: 1.1099, test_f1: 0.6249
 epoch: 47, train_loss: 0.6432, test_loss: 1.1478, test_f1: 0.6198
 epoch: 48, train_loss: 0.6493, test_loss: 1.1251, test_f1: 0.6079
 epoch: 49, train_loss: 0.6254, test_loss: 1.1272, test_f1: 0.6320
 epoch: 50, train_loss: 0.6123, test_loss: 1.1188, test_f1: 0.6582
 epoch: 51, train_loss: 0.6075, test_loss: 1.1210, test_f1: 0.6287
 epoch: 52, train_loss: 0.5994, test_loss: 1.1155, test_f1: 0.6351
 epoch: 53, train_loss: 0.5909, test_loss: 1.1124, test_f1: 0.6312
 epoch: 54, train_loss: 0.5875, test_loss: 1.1218, test_f1: 0.6413
 epoch: 55, train_loss: 0.5702, test_loss: 1.1397, test_f1: 0.6249
 epoch: 56, train_loss: 0.5654, test_loss: 1.1767, test_f1: 0.6208
 epoch: 57, train_loss: 0.5869, test_loss: 1.1546, test_f1: 0.6080
 epoch: 58, train_loss: 0.5619, test_loss: 1.1925, test_f1: 0.6077
 epoch: 59, train_loss: 0.5770, test_loss: 1.1541, test_f1: 0.6347
 epoch: 60, train_loss: 0.5568, test_loss: 1.1892, test_f1: 0.5972
 epoch: 61, train_loss: 0.5929, test_loss: 1.1315, test_f1: 0.6208
 epoch: 62, train_loss: 0.5536, test_loss: 1.2129, test_f1: 0.6075
 epoch: 63, train_loss: 0.5826, test_loss: 1.1483, test_f1: 0.6286
 epoch: 64, train_loss: 0.5652, test_loss: 1.1978, test_f1: 0.6329
 epoch: 65, train_loss: 0.5590, test_loss: 1.2220, test_f1: 0.6051
 epoch: 66, train_loss: 0.5372, test_loss: 1.2202, test_f1: 0.6253
 epoch: 67, train_loss: 0.5638, test_loss: 1.1969, test_f1: 0.6484
 epoch: 68, train_loss: 0.5453, test_loss: 1.1756, test_f1: 0.6109
 epoch: 69, train_loss: 0.5425, test_loss: 1.2764, test_f1: 0.6115
 epoch: 70, train_loss: 0.5471, test_loss: 1.2321, test_f1: 0.6087
 epoch: 71, train_loss: 0.5551, test_loss: 1.2578, test_f1: 0.6229
 epoch: 72, train_loss: 0.5367, test_loss: 1.2276, test_f1: 0.6241
 epoch: 73, train_loss: 0.5210, test_loss: 1.2515, test_f1: 0.6000
 epoch: 74, train_loss: 0.5162, test_loss: 1.2263, test_f1: 0.6146
 epoch: 75, train_loss: 0.5305, test_loss: 1.2581, test_f1: 0.6288
 epoch: 76, train_loss: 0.5213, test_loss: 1.2546, test_f1: 0.6226
 epoch: 77, train_loss: 0.5282, test_loss: 1.2896, test_f1: 0.6122
 epoch: 78, train_loss: 0.5012, test_loss: 1.3062, test_f1: 0.6047
 epoch: 79, train_loss: 0.5052, test_loss: 1.2946, test_f1: 0.6119
 epoch: 80, train_loss: 0.4933, test_loss: 1.3032, test_f1: 0.6074
 epoch: 81, train_loss: 0.5187, test_loss: 1.2370, test_f1: 0.6263
 epoch: 82, train_loss: 0.5004, test_loss: 1.2397, test_f1: 0.6289
 epoch: 83, train_loss: 0.5005, test_loss: 1.2735, test_f1: 0.6089
 epoch: 84, train_loss: 0.4954, test_loss: 1.2529, test_f1: 0.6186
 epoch: 85, train_loss: 0.5005, test_loss: 1.2983, test_f1: 0.6256
 epoch: 86, train_loss: 0.4868, test_loss: 1.3140, test_f1: 0.6448
 epoch: 87, train_loss: 0.5062, test_loss: 1.3072, test_f1: 0.6266
 epoch: 88, train_loss: 0.5003, test_loss: 1.3104, test_f1: 0.6291
 epoch: 89, train_loss: 0.4850, test_loss: 1.3870, test_f1: 0.6041
 epoch: 90, train_loss: 0.4825, test_loss: 1.3592, test_f1: 0.6286
 epoch: 91, train_loss: 0.4877, test_loss: 1.2918, test_f1: 0.6213
 epoch: 92, train_loss: 0.4878, test_loss: 1.3073, test_f1: 0.6364
 epoch: 93, train_loss: 0.4829, test_loss: 1.3650, test_f1: 0.5966
 epoch: 94, train_loss: 0.4809, test_loss: 1.3679, test_f1: 0.6157
 epoch: 95, train_loss: 0.4742, test_loss: 1.2951, test_f1: 0.6189
 epoch: 96, train_loss: 0.4763, test_loss: 1.3451, test_f1: 0.6181
 epoch: 97, train_loss: 0.4646, test_loss: 1.3679, test_f1: 0.6332
 epoch: 98, train_loss: 0.4678, test_loss: 1.3037, test_f1: 0.6181
 epoch: 99, train_loss: 0.4761, test_loss: 1.3002, test_f1: 0.6316
##################ITERATION #9 ****************************************
 epoch: 0, train_loss: 1.2810, test_loss: 1.2255, test_f1: 0.3955
 epoch: 1, train_loss: 1.0958, test_loss: 1.1347, test_f1: 0.4699
 epoch: 2, train_loss: 1.0643, test_loss: 1.1001, test_f1: 0.5074
 epoch: 3, train_loss: 1.0046, test_loss: 1.0930, test_f1: 0.5446
 epoch: 4, train_loss: 1.0239, test_loss: 1.0736, test_f1: 0.5302
 epoch: 5, train_loss: 0.9909, test_loss: 1.0504, test_f1: 0.5485
 epoch: 6, train_loss: 0.9635, test_loss: 1.0615, test_f1: 0.5587
 epoch: 7, train_loss: 0.9574, test_loss: 1.0371, test_f1: 0.5653
 epoch: 8, train_loss: 0.9241, test_loss: 1.0495, test_f1: 0.5644
 epoch: 9, train_loss: 0.9171, test_loss: 1.0404, test_f1: 0.5380
 epoch: 10, train_loss: 0.8954, test_loss: 1.0217, test_f1: 0.5557
 epoch: 11, train_loss: 0.9026, test_loss: 1.0360, test_f1: 0.5570
 epoch: 12, train_loss: 0.8839, test_loss: 1.0167, test_f1: 0.5804
 epoch: 13, train_loss: 0.8849, test_loss: 1.0170, test_f1: 0.5999
 epoch: 14, train_loss: 0.8647, test_loss: 1.0142, test_f1: 0.5911
 epoch: 15, train_loss: 0.8652, test_loss: 1.0130, test_f1: 0.6115
 epoch: 16, train_loss: 0.8371, test_loss: 0.9960, test_f1: 0.6016
 epoch: 17, train_loss: 0.8559, test_loss: 0.9986, test_f1: 0.6220
 epoch: 18, train_loss: 0.8310, test_loss: 1.0018, test_f1: 0.6248
 epoch: 19, train_loss: 0.8253, test_loss: 1.0107, test_f1: 0.5987
 epoch: 20, train_loss: 0.7970, test_loss: 1.0142, test_f1: 0.6151
 epoch: 21, train_loss: 0.8276, test_loss: 1.0207, test_f1: 0.5901
 epoch: 22, train_loss: 0.7884, test_loss: 1.0081, test_f1: 0.6381
 epoch: 23, train_loss: 0.8082, test_loss: 1.0166, test_f1: 0.6199
 epoch: 24, train_loss: 0.7879, test_loss: 0.9975, test_f1: 0.6034
 epoch: 25, train_loss: 0.7988, test_loss: 0.9913, test_f1: 0.6209
 epoch: 26, train_loss: 0.7621, test_loss: 0.9748, test_f1: 0.6210
 epoch: 27, train_loss: 0.7635, test_loss: 0.9739, test_f1: 0.6482
 epoch: 28, train_loss: 0.7695, test_loss: 0.9784, test_f1: 0.6412
 epoch: 29, train_loss: 0.7601, test_loss: 0.9665, test_f1: 0.6653
 epoch: 30, train_loss: 0.7543, test_loss: 0.9598, test_f1: 0.6191
 epoch: 31, train_loss: 0.7453, test_loss: 1.0040, test_f1: 0.5989
 epoch: 32, train_loss: 0.7266, test_loss: 1.0014, test_f1: 0.6358
 epoch: 33, train_loss: 0.7312, test_loss: 0.9793, test_f1: 0.6365
 epoch: 34, train_loss: 0.7155, test_loss: 0.9875, test_f1: 0.6527
 epoch: 35, train_loss: 0.7199, test_loss: 1.0288, test_f1: 0.6260
 epoch: 36, train_loss: 0.7078, test_loss: 1.0275, test_f1: 0.6376
 epoch: 37, train_loss: 0.7051, test_loss: 1.0027, test_f1: 0.6395
 epoch: 38, train_loss: 0.7053, test_loss: 1.0165, test_f1: 0.6326
 epoch: 39, train_loss: 0.6903, test_loss: 1.0742, test_f1: 0.6430
 epoch: 40, train_loss: 0.6738, test_loss: 1.0255, test_f1: 0.6583
 epoch: 41, train_loss: 0.6819, test_loss: 1.0477, test_f1: 0.6324
 epoch: 42, train_loss: 0.6576, test_loss: 1.0767, test_f1: 0.6556
 epoch: 43, train_loss: 0.6745, test_loss: 1.0246, test_f1: 0.6582
 epoch: 44, train_loss: 0.6530, test_loss: 1.0371, test_f1: 0.6370
 epoch: 45, train_loss: 0.6382, test_loss: 1.0839, test_f1: 0.6513
 epoch: 46, train_loss: 0.6549, test_loss: 1.0801, test_f1: 0.6561
 epoch: 47, train_loss: 0.6319, test_loss: 1.0313, test_f1: 0.6514
 epoch: 48, train_loss: 0.6370, test_loss: 1.0591, test_f1: 0.6600
 epoch: 49, train_loss: 0.6495, test_loss: 1.0568, test_f1: 0.6709
 epoch: 50, train_loss: 0.6265, test_loss: 1.0848, test_f1: 0.6393
 epoch: 51, train_loss: 0.6014, test_loss: 1.0761, test_f1: 0.6471
 epoch: 52, train_loss: 0.6246, test_loss: 1.0568, test_f1: 0.6661
 epoch: 53, train_loss: 0.6080, test_loss: 1.1048, test_f1: 0.6659
 epoch: 54, train_loss: 0.5842, test_loss: 1.1546, test_f1: 0.6437
 epoch: 55, train_loss: 0.5923, test_loss: 1.0820, test_f1: 0.6697
 epoch: 56, train_loss: 0.5814, test_loss: 1.1410, test_f1: 0.6515
 epoch: 57, train_loss: 0.5754, test_loss: 1.1128, test_f1: 0.6614
 epoch: 58, train_loss: 0.5888, test_loss: 1.1481, test_f1: 0.6605
 epoch: 59, train_loss: 0.6029, test_loss: 1.1151, test_f1: 0.6719
 epoch: 60, train_loss: 0.5832, test_loss: 1.1174, test_f1: 0.6517
 epoch: 61, train_loss: 0.5858, test_loss: 1.1214, test_f1: 0.6478
 epoch: 62, train_loss: 0.5579, test_loss: 1.1358, test_f1: 0.6649
 epoch: 63, train_loss: 0.5773, test_loss: 1.1217, test_f1: 0.6624
 epoch: 64, train_loss: 0.5569, test_loss: 1.1618, test_f1: 0.6636
 epoch: 65, train_loss: 0.5573, test_loss: 1.1334, test_f1: 0.6821
 epoch: 66, train_loss: 0.5510, test_loss: 1.1848, test_f1: 0.6325
 epoch: 67, train_loss: 0.5551, test_loss: 1.1749, test_f1: 0.6547
 epoch: 68, train_loss: 0.5421, test_loss: 1.1901, test_f1: 0.6589
 epoch: 69, train_loss: 0.5486, test_loss: 1.1481, test_f1: 0.6604
 epoch: 70, train_loss: 0.5497, test_loss: 1.1657, test_f1: 0.6744
 epoch: 71, train_loss: 0.5301, test_loss: 1.1667, test_f1: 0.6442
 epoch: 72, train_loss: 0.5385, test_loss: 1.1889, test_f1: 0.6571
 epoch: 73, train_loss: 0.5471, test_loss: 1.2349, test_f1: 0.6584
 epoch: 74, train_loss: 0.5490, test_loss: 1.2033, test_f1: 0.6547
 epoch: 75, train_loss: 0.5408, test_loss: 1.2235, test_f1: 0.6591
 epoch: 76, train_loss: 0.5321, test_loss: 1.2004, test_f1: 0.6720
 epoch: 77, train_loss: 0.5433, test_loss: 1.2163, test_f1: 0.6547
 epoch: 78, train_loss: 0.5178, test_loss: 1.2936, test_f1: 0.6442
 epoch: 79, train_loss: 0.5321, test_loss: 1.2281, test_f1: 0.6467
 epoch: 80, train_loss: 0.5342, test_loss: 1.2383, test_f1: 0.6502
 epoch: 81, train_loss: 0.5220, test_loss: 1.2432, test_f1: 0.6438
 epoch: 82, train_loss: 0.5072, test_loss: 1.2618, test_f1: 0.6645
 epoch: 83, train_loss: 0.5139, test_loss: 1.2880, test_f1: 0.6430
 epoch: 84, train_loss: 0.5154, test_loss: 1.2580, test_f1: 0.6449
 epoch: 85, train_loss: 0.5052, test_loss: 1.3047, test_f1: 0.6263
 epoch: 86, train_loss: 0.4935, test_loss: 1.2576, test_f1: 0.6207
 epoch: 87, train_loss: 0.4911, test_loss: 1.2379, test_f1: 0.6514
 epoch: 88, train_loss: 0.5106, test_loss: 1.2371, test_f1: 0.6582
 epoch: 89, train_loss: 0.5137, test_loss: 1.2852, test_f1: 0.6437
 epoch: 90, train_loss: 0.5053, test_loss: 1.3484, test_f1: 0.6515
 epoch: 91, train_loss: 0.5028, test_loss: 1.2956, test_f1: 0.6575
 epoch: 92, train_loss: 0.4733, test_loss: 1.2670, test_f1: 0.6440
 epoch: 93, train_loss: 0.4960, test_loss: 1.3349, test_f1: 0.6590
 epoch: 94, train_loss: 0.4755, test_loss: 1.2667, test_f1: 0.6409
 epoch: 95, train_loss: 0.4866, test_loss: 1.3108, test_f1: 0.6415
 epoch: 96, train_loss: 0.4765, test_loss: 1.3301, test_f1: 0.6441
 epoch: 97, train_loss: 0.4591, test_loss: 1.3843, test_f1: 0.6357
 epoch: 98, train_loss: 0.4761, test_loss: 1.3131, test_f1: 0.6309
 epoch: 99, train_loss: 0.4598, test_loss: 1.3142, test_f1: 0.6421

Training completed in 504.82 seconds
Best F1: 0.6821 at epoch 65
Mean F1 across iterations: 0.6553  0.0109
========================FINAL RESULTS================================
FEGIN weighted F1: 0.6821  0.0109
python main.py --data ltspice_demos --representation component_net --model FEGIN --layers 2 --hiddens 128 --batch_size 32 --lr 0.0001 --emb_size 128 --epochs 100 --save_appendix component_net_L2_H128_BS32_LR0.0001_E128 --no_val
-----



STDERR:
  File "main.py", line 370, in <module>
    main()
  File "main.py", line 254, in main
    dataset = dataset_class(
  File "/home/philip/projects/ltspice_examples_code_repo/Circuit-Completion-Using-GNNs/component_classification_with_link_prediction_head/evaluation/FEGIN/kernel/circuit_datasets.py", line 15, in __init__
    self.data, self.slices = torch.load(self.processed_paths[0])
  File "/home/philip/.local/lib/python3.8/site-packages/torch/serialization.py", line 1040, in load
    warnings.warn(
  File "/usr/lib/python3.8/warnings.py", line 109, in _showwarnmsg
    sw(msg.message, msg.category, msg.filename, msg.lineno,
  File "main.py", line 47, in warn_with_traceback
    traceback.print_stack(file=log)
/home/philip/projects/ltspice_examples_code_repo/Circuit-Completion-Using-GNNs/component_classification_with_link_prediction_head/evaluation/FEGIN/kernel/circuit_datasets.py:15: FutureWarning: You are using `torch.load` with `weights_only=False` (the current default value), which uses the default pickle module implicitly. It is possible to construct malicious pickle data which will execute arbitrary code during unpickling (See https://github.com/pytorch/pytorch/blob/main/SECURITY.md#untrusted-models for more details). In a future release, the default value for `weights_only` will be flipped to `True`. This limits the functions that could be executed during unpickling. Arbitrary objects will no longer be allowed to be loaded via this mode unless they are explicitly allowlisted by the user via `torch.serialization.add_safe_globals`. We recommend you start setting `weights_only=True` for any use case where you don't have full control of the loaded file. Please open an issue on GitHub for any issues related to this experimental feature.
  self.data, self.slices = torch.load(self.processed_paths[0])
