STDOUT:
Results will be saved in /home/philip/projects/ltspice_examples_code_repo/Circuit-Completion-Using-GNNs/component_classification_with_link_prediction_head/evaluation/FEGIN/results/model_FEGIN_dataset_ltspice_examples
Command line input: python main.py --data ltspice_examples --representation component_pin_net --model FEGIN --layers 5 --hiddens 32 --batch_size 32 --lr 0.001 --emb_size 128 --epochs 100 --save_appendix component_pin_net_L5_H32_BS32_LR0.001_E128 --no_val
 is saved.
-----
ltspice_examples - FEGIN
Using 5 layers, 32 hidden units, h = 2
Loading component_pin_net representation dataset
ENTERED
Training FEGIN on component_pin_net representation
Train: 3558, Test: 846
##################ITERATION #0 ****************************************
 epoch: 0, train_loss: 1.2155, test_loss: 1.0704, test_f1: 0.4404
 epoch: 1, train_loss: 1.0502, test_loss: 1.0184, test_f1: 0.4852
 epoch: 2, train_loss: 1.0132, test_loss: 1.0211, test_f1: 0.5169
 epoch: 3, train_loss: 1.0007, test_loss: 0.9579, test_f1: 0.5012
 epoch: 4, train_loss: 0.9752, test_loss: 0.9951, test_f1: 0.5047
 epoch: 5, train_loss: 0.9518, test_loss: 0.9220, test_f1: 0.5211
 epoch: 6, train_loss: 0.9447, test_loss: 0.9218, test_f1: 0.5064
 epoch: 7, train_loss: 0.9231, test_loss: 0.9229, test_f1: 0.5362
 epoch: 8, train_loss: 0.9198, test_loss: 0.9329, test_f1: 0.5455
 epoch: 9, train_loss: 0.9094, test_loss: 0.9083, test_f1: 0.5253
 epoch: 10, train_loss: 0.8934, test_loss: 0.9352, test_f1: 0.5327
 epoch: 11, train_loss: 0.8882, test_loss: 0.8717, test_f1: 0.5461
 epoch: 12, train_loss: 0.8775, test_loss: 0.8442, test_f1: 0.5335
 epoch: 13, train_loss: 0.8662, test_loss: 0.8496, test_f1: 0.5323
 epoch: 14, train_loss: 0.8595, test_loss: 0.8753, test_f1: 0.5246
 epoch: 15, train_loss: 0.8601, test_loss: 0.8842, test_f1: 0.5495
 epoch: 16, train_loss: 0.8387, test_loss: 0.8801, test_f1: 0.5437
 epoch: 17, train_loss: 0.8377, test_loss: 0.8661, test_f1: 0.5373
 epoch: 18, train_loss: 0.8353, test_loss: 0.8586, test_f1: 0.5443
 epoch: 19, train_loss: 0.8140, test_loss: 0.8581, test_f1: 0.5389
 epoch: 20, train_loss: 0.8126, test_loss: 0.8383, test_f1: 0.5639
 epoch: 21, train_loss: 0.8043, test_loss: 0.8255, test_f1: 0.5811
 epoch: 22, train_loss: 0.8032, test_loss: 0.9710, test_f1: 0.5198
 epoch: 23, train_loss: 0.7868, test_loss: 0.8800, test_f1: 0.5466
 epoch: 24, train_loss: 0.7874, test_loss: 0.7869, test_f1: 0.5673
 epoch: 25, train_loss: 0.7631, test_loss: 0.8110, test_f1: 0.5548
 epoch: 26, train_loss: 0.7639, test_loss: 0.7611, test_f1: 0.5875
 epoch: 27, train_loss: 0.7612, test_loss: 0.8800, test_f1: 0.5654
 epoch: 28, train_loss: 0.7620, test_loss: 0.7642, test_f1: 0.6025
 epoch: 29, train_loss: 0.7543, test_loss: 0.8953, test_f1: 0.5502
 epoch: 30, train_loss: 0.7395, test_loss: 0.8508, test_f1: 0.5839
 epoch: 31, train_loss: 0.7382, test_loss: 0.8497, test_f1: 0.5649
 epoch: 32, train_loss: 0.7383, test_loss: 0.8257, test_f1: 0.5929
 epoch: 33, train_loss: 0.7355, test_loss: 0.8480, test_f1: 0.5604
 epoch: 34, train_loss: 0.7225, test_loss: 0.7687, test_f1: 0.5927
 epoch: 35, train_loss: 0.7238, test_loss: 0.7959, test_f1: 0.5622
 epoch: 36, train_loss: 0.7153, test_loss: 0.8169, test_f1: 0.5759
 epoch: 37, train_loss: 0.7062, test_loss: 0.8398, test_f1: 0.5908
 epoch: 38, train_loss: 0.7099, test_loss: 0.8323, test_f1: 0.5684
 epoch: 39, train_loss: 0.7013, test_loss: 0.8344, test_f1: 0.6190
 epoch: 40, train_loss: 0.7117, test_loss: 0.8023, test_f1: 0.6147
 epoch: 41, train_loss: 0.6869, test_loss: 0.7615, test_f1: 0.5964
 epoch: 42, train_loss: 0.6747, test_loss: 0.7083, test_f1: 0.6373
 epoch: 43, train_loss: 0.6745, test_loss: 0.8335, test_f1: 0.5865
 epoch: 44, train_loss: 0.6784, test_loss: 0.7253, test_f1: 0.6515
 epoch: 45, train_loss: 0.6632, test_loss: 0.8550, test_f1: 0.6091
 epoch: 46, train_loss: 0.6740, test_loss: 0.7548, test_f1: 0.6051
 epoch: 47, train_loss: 0.6728, test_loss: 0.7448, test_f1: 0.6099
 epoch: 48, train_loss: 0.6558, test_loss: 0.8765, test_f1: 0.6296
 epoch: 49, train_loss: 0.6536, test_loss: 0.7781, test_f1: 0.6328
 epoch: 50, train_loss: 0.6522, test_loss: 0.7766, test_f1: 0.6350
 epoch: 51, train_loss: 0.6255, test_loss: 0.7997, test_f1: 0.6384
 epoch: 52, train_loss: 0.6152, test_loss: 0.8370, test_f1: 0.6317
 epoch: 53, train_loss: 0.6117, test_loss: 0.8489, test_f1: 0.6317
 epoch: 54, train_loss: 0.6147, test_loss: 0.7518, test_f1: 0.6522
 epoch: 55, train_loss: 0.6082, test_loss: 0.7962, test_f1: 0.6546
 epoch: 56, train_loss: 0.6002, test_loss: 0.8706, test_f1: 0.6527
 epoch: 57, train_loss: 0.6011, test_loss: 0.8531, test_f1: 0.6381
 epoch: 58, train_loss: 0.5949, test_loss: 0.8257, test_f1: 0.6484
 epoch: 59, train_loss: 0.5981, test_loss: 0.8322, test_f1: 0.6378
 epoch: 60, train_loss: 0.5931, test_loss: 0.8607, test_f1: 0.6319
 epoch: 61, train_loss: 0.5876, test_loss: 0.8214, test_f1: 0.6442
 epoch: 62, train_loss: 0.5962, test_loss: 0.8566, test_f1: 0.6451
 epoch: 63, train_loss: 0.6073, test_loss: 0.8371, test_f1: 0.6340
 epoch: 64, train_loss: 0.5911, test_loss: 0.8465, test_f1: 0.6616
 epoch: 65, train_loss: 0.5931, test_loss: 0.8452, test_f1: 0.6710
 epoch: 66, train_loss: 0.5874, test_loss: 0.8716, test_f1: 0.6456
 epoch: 67, train_loss: 0.5751, test_loss: 0.9312, test_f1: 0.6121
 epoch: 68, train_loss: 0.5837, test_loss: 0.8898, test_f1: 0.6613
 epoch: 69, train_loss: 0.5812, test_loss: 0.8392, test_f1: 0.6302
 epoch: 70, train_loss: 0.5803, test_loss: 0.8726, test_f1: 0.6391
 epoch: 71, train_loss: 0.5750, test_loss: 0.7586, test_f1: 0.6977
 epoch: 72, train_loss: 0.5790, test_loss: 0.8573, test_f1: 0.6405
 epoch: 73, train_loss: 0.5711, test_loss: 0.9219, test_f1: 0.6477
 epoch: 74, train_loss: 0.5651, test_loss: 0.8187, test_f1: 0.6720
 epoch: 75, train_loss: 0.5672, test_loss: 0.9097, test_f1: 0.6587
 epoch: 76, train_loss: 0.5712, test_loss: 0.8465, test_f1: 0.6378
 epoch: 77, train_loss: 0.5594, test_loss: 0.7972, test_f1: 0.6577
 epoch: 78, train_loss: 0.5440, test_loss: 1.0429, test_f1: 0.6706
 epoch: 79, train_loss: 0.5602, test_loss: 0.9142, test_f1: 0.6374
 epoch: 80, train_loss: 0.5614, test_loss: 1.0200, test_f1: 0.6247
 epoch: 81, train_loss: 0.5586, test_loss: 0.9431, test_f1: 0.6701
 epoch: 82, train_loss: 0.5487, test_loss: 0.8964, test_f1: 0.6325
 epoch: 83, train_loss: 0.5457, test_loss: 0.9207, test_f1: 0.6306
 epoch: 84, train_loss: 0.5508, test_loss: 0.8757, test_f1: 0.6343
 epoch: 85, train_loss: 0.5530, test_loss: 0.8649, test_f1: 0.6414
 epoch: 86, train_loss: 0.5519, test_loss: 0.8702, test_f1: 0.6430
 epoch: 87, train_loss: 0.5464, test_loss: 0.9411, test_f1: 0.6288
 epoch: 88, train_loss: 0.5432, test_loss: 0.8921, test_f1: 0.6642
 epoch: 89, train_loss: 0.5425, test_loss: 0.8571, test_f1: 0.6710
 epoch: 90, train_loss: 0.5557, test_loss: 0.9490, test_f1: 0.6465
 epoch: 91, train_loss: 0.5381, test_loss: 0.9125, test_f1: 0.6418
 epoch: 92, train_loss: 0.5291, test_loss: 0.9099, test_f1: 0.6445
 epoch: 93, train_loss: 0.5508, test_loss: 0.9746, test_f1: 0.6559
 epoch: 94, train_loss: 0.5631, test_loss: 0.8807, test_f1: 0.6551
 epoch: 95, train_loss: 0.5349, test_loss: 0.9193, test_f1: 0.6530
 epoch: 96, train_loss: 0.5270, test_loss: 0.9169, test_f1: 0.6252
 epoch: 97, train_loss: 0.5348, test_loss: 0.9719, test_f1: 0.6403
 epoch: 98, train_loss: 0.5451, test_loss: 0.8792, test_f1: 0.6557
 epoch: 99, train_loss: 0.5385, test_loss: 0.8961, test_f1: 0.6458
##################ITERATION #1 ****************************************
 epoch: 0, train_loss: 1.1344, test_loss: 1.0338, test_f1: 0.4017
 epoch: 1, train_loss: 1.0137, test_loss: 1.0014, test_f1: 0.4789
 epoch: 2, train_loss: 0.9866, test_loss: 0.9836, test_f1: 0.5025
 epoch: 3, train_loss: 0.9610, test_loss: 0.9954, test_f1: 0.4978
 epoch: 4, train_loss: 0.9518, test_loss: 0.9334, test_f1: 0.5134
 epoch: 5, train_loss: 0.9342, test_loss: 0.8952, test_f1: 0.5195
 epoch: 6, train_loss: 0.9268, test_loss: 0.9468, test_f1: 0.5073
 epoch: 7, train_loss: 0.9059, test_loss: 0.8940, test_f1: 0.5210
 epoch: 8, train_loss: 0.8969, test_loss: 0.9437, test_f1: 0.5357
 epoch: 9, train_loss: 0.8818, test_loss: 0.9009, test_f1: 0.5289
 epoch: 10, train_loss: 0.8804, test_loss: 0.8841, test_f1: 0.5392
 epoch: 11, train_loss: 0.8564, test_loss: 0.8193, test_f1: 0.5438
 epoch: 12, train_loss: 0.8767, test_loss: 0.8562, test_f1: 0.5388
 epoch: 13, train_loss: 0.8458, test_loss: 0.8699, test_f1: 0.5368
 epoch: 14, train_loss: 0.8380, test_loss: 0.8628, test_f1: 0.5471
 epoch: 15, train_loss: 0.8316, test_loss: 0.7899, test_f1: 0.5689
 epoch: 16, train_loss: 0.8187, test_loss: 0.8297, test_f1: 0.5719
 epoch: 17, train_loss: 0.8215, test_loss: 0.8001, test_f1: 0.5476
 epoch: 18, train_loss: 0.8113, test_loss: 0.8644, test_f1: 0.5632
 epoch: 19, train_loss: 0.7989, test_loss: 0.8113, test_f1: 0.5544
 epoch: 20, train_loss: 0.7978, test_loss: 0.8161, test_f1: 0.5726
 epoch: 21, train_loss: 0.7892, test_loss: 0.7805, test_f1: 0.5568
 epoch: 22, train_loss: 0.7672, test_loss: 0.8419, test_f1: 0.5709
 epoch: 23, train_loss: 0.7965, test_loss: 0.7758, test_f1: 0.6063
 epoch: 24, train_loss: 0.7691, test_loss: 0.7498, test_f1: 0.6049
 epoch: 25, train_loss: 0.7632, test_loss: 0.7222, test_f1: 0.6016
 epoch: 26, train_loss: 0.7679, test_loss: 0.7247, test_f1: 0.6384
 epoch: 27, train_loss: 0.7464, test_loss: 0.7480, test_f1: 0.5606
 epoch: 28, train_loss: 0.7469, test_loss: 0.7927, test_f1: 0.6013
 epoch: 29, train_loss: 0.7468, test_loss: 0.7360, test_f1: 0.6258
 epoch: 30, train_loss: 0.7280, test_loss: 0.7858, test_f1: 0.6208
 epoch: 31, train_loss: 0.7231, test_loss: 0.7756, test_f1: 0.6178
 epoch: 32, train_loss: 0.7301, test_loss: 0.7919, test_f1: 0.6187
 epoch: 33, train_loss: 0.7075, test_loss: 0.8200, test_f1: 0.5895
 epoch: 34, train_loss: 0.7175, test_loss: 0.8641, test_f1: 0.5678
 epoch: 35, train_loss: 0.7196, test_loss: 0.7787, test_f1: 0.6132
 epoch: 36, train_loss: 0.6906, test_loss: 0.7383, test_f1: 0.6134
 epoch: 37, train_loss: 0.7014, test_loss: 0.7752, test_f1: 0.6253
 epoch: 38, train_loss: 0.6900, test_loss: 0.7526, test_f1: 0.6436
 epoch: 39, train_loss: 0.6795, test_loss: 0.8295, test_f1: 0.6280
 epoch: 40, train_loss: 0.7041, test_loss: 0.7129, test_f1: 0.6568
 epoch: 41, train_loss: 0.6847, test_loss: 0.6788, test_f1: 0.6616
 epoch: 42, train_loss: 0.6919, test_loss: 0.7543, test_f1: 0.6179
 epoch: 43, train_loss: 0.6714, test_loss: 0.6845, test_f1: 0.6532
 epoch: 44, train_loss: 0.6599, test_loss: 0.7696, test_f1: 0.6123
 epoch: 45, train_loss: 0.6596, test_loss: 0.8132, test_f1: 0.6208
 epoch: 46, train_loss: 0.6718, test_loss: 0.7692, test_f1: 0.6445
 epoch: 47, train_loss: 0.6668, test_loss: 0.7592, test_f1: 0.6502
 epoch: 48, train_loss: 0.6566, test_loss: 0.8480, test_f1: 0.6488
 epoch: 49, train_loss: 0.7081, test_loss: 0.7335, test_f1: 0.6365
 epoch: 50, train_loss: 0.6618, test_loss: 0.7554, test_f1: 0.6264
 epoch: 51, train_loss: 0.6461, test_loss: 0.6891, test_f1: 0.6763
 epoch: 52, train_loss: 0.6384, test_loss: 0.7027, test_f1: 0.6776
 epoch: 53, train_loss: 0.6173, test_loss: 0.7250, test_f1: 0.6471
 epoch: 54, train_loss: 0.6101, test_loss: 0.6876, test_f1: 0.6795
 epoch: 55, train_loss: 0.6153, test_loss: 0.7201, test_f1: 0.6706
 epoch: 56, train_loss: 0.6038, test_loss: 0.7431, test_f1: 0.6600
 epoch: 57, train_loss: 0.6012, test_loss: 0.7556, test_f1: 0.6736
 epoch: 58, train_loss: 0.6193, test_loss: 0.7743, test_f1: 0.6723
 epoch: 59, train_loss: 0.6188, test_loss: 0.7085, test_f1: 0.6577
 epoch: 60, train_loss: 0.5991, test_loss: 0.7499, test_f1: 0.6482
 epoch: 61, train_loss: 0.6006, test_loss: 0.6756, test_f1: 0.6942
 epoch: 62, train_loss: 0.5961, test_loss: 0.7295, test_f1: 0.6623
 epoch: 63, train_loss: 0.5906, test_loss: 0.6470, test_f1: 0.6892
 epoch: 64, train_loss: 0.5895, test_loss: 0.6779, test_f1: 0.6768
 epoch: 65, train_loss: 0.5907, test_loss: 0.7476, test_f1: 0.6785
 epoch: 66, train_loss: 0.5822, test_loss: 0.7647, test_f1: 0.6655
 epoch: 67, train_loss: 0.5854, test_loss: 0.7211, test_f1: 0.6765
 epoch: 68, train_loss: 0.5854, test_loss: 0.7372, test_f1: 0.6630
 epoch: 69, train_loss: 0.5759, test_loss: 0.7288, test_f1: 0.6776
 epoch: 70, train_loss: 0.5714, test_loss: 0.7816, test_f1: 0.6565
 epoch: 71, train_loss: 0.5880, test_loss: 0.7059, test_f1: 0.6756
 epoch: 72, train_loss: 0.5868, test_loss: 0.7994, test_f1: 0.6599
 epoch: 73, train_loss: 0.5720, test_loss: 0.8137, test_f1: 0.6538
 epoch: 74, train_loss: 0.5604, test_loss: 0.8011, test_f1: 0.6584
 epoch: 75, train_loss: 0.5771, test_loss: 0.8229, test_f1: 0.6509
 epoch: 76, train_loss: 0.5778, test_loss: 0.7278, test_f1: 0.6671
 epoch: 77, train_loss: 0.5707, test_loss: 0.7439, test_f1: 0.6493
 epoch: 78, train_loss: 0.5617, test_loss: 0.7497, test_f1: 0.6887
 epoch: 79, train_loss: 0.5690, test_loss: 0.7965, test_f1: 0.6485
 epoch: 80, train_loss: 0.5721, test_loss: 0.7967, test_f1: 0.6613
 epoch: 81, train_loss: 0.5530, test_loss: 0.7960, test_f1: 0.6495
 epoch: 82, train_loss: 0.5600, test_loss: 0.7837, test_f1: 0.6768
 epoch: 83, train_loss: 0.5579, test_loss: 0.7895, test_f1: 0.6654
 epoch: 84, train_loss: 0.5573, test_loss: 0.7927, test_f1: 0.6418
 epoch: 85, train_loss: 0.5538, test_loss: 0.8593, test_f1: 0.6560
 epoch: 86, train_loss: 0.5415, test_loss: 0.8184, test_f1: 0.6596
 epoch: 87, train_loss: 0.5511, test_loss: 0.8290, test_f1: 0.6425
 epoch: 88, train_loss: 0.5412, test_loss: 0.8040, test_f1: 0.6455
 epoch: 89, train_loss: 0.5348, test_loss: 0.8146, test_f1: 0.6634
 epoch: 90, train_loss: 0.5374, test_loss: 0.8277, test_f1: 0.6666
 epoch: 91, train_loss: 0.5175, test_loss: 0.8427, test_f1: 0.6623
 epoch: 92, train_loss: 0.5351, test_loss: 0.9052, test_f1: 0.6582
 epoch: 93, train_loss: 0.5390, test_loss: 0.8403, test_f1: 0.6500
 epoch: 94, train_loss: 0.5290, test_loss: 0.8177, test_f1: 0.6609
 epoch: 95, train_loss: 0.5341, test_loss: 0.8682, test_f1: 0.6616
 epoch: 96, train_loss: 0.5410, test_loss: 0.8251, test_f1: 0.6662
 epoch: 97, train_loss: 0.5240, test_loss: 0.8189, test_f1: 0.6710
 epoch: 98, train_loss: 0.5323, test_loss: 0.8164, test_f1: 0.6796
 epoch: 99, train_loss: 0.5300, test_loss: 0.8322, test_f1: 0.6554
##################ITERATION #2 ****************************************
 epoch: 0, train_loss: 1.1168, test_loss: 0.9835, test_f1: 0.4871
 epoch: 1, train_loss: 0.9922, test_loss: 0.9738, test_f1: 0.4757
 epoch: 2, train_loss: 0.9680, test_loss: 0.9602, test_f1: 0.5337
 epoch: 3, train_loss: 0.9418, test_loss: 0.9644, test_f1: 0.5191
 epoch: 4, train_loss: 0.9196, test_loss: 0.9654, test_f1: 0.5100
 epoch: 5, train_loss: 0.9213, test_loss: 0.9411, test_f1: 0.5073
 epoch: 6, train_loss: 0.8927, test_loss: 0.9087, test_f1: 0.5342
 epoch: 7, train_loss: 0.8814, test_loss: 0.9345, test_f1: 0.5732
 epoch: 8, train_loss: 0.8743, test_loss: 0.8924, test_f1: 0.5351
 epoch: 9, train_loss: 0.8613, test_loss: 0.9151, test_f1: 0.5352
 epoch: 10, train_loss: 0.8650, test_loss: 0.8409, test_f1: 0.5565
 epoch: 11, train_loss: 0.8683, test_loss: 0.8894, test_f1: 0.5610
 epoch: 12, train_loss: 0.8417, test_loss: 0.8759, test_f1: 0.5689
 epoch: 13, train_loss: 0.8351, test_loss: 0.8932, test_f1: 0.5881
 epoch: 14, train_loss: 0.8200, test_loss: 0.8525, test_f1: 0.5707
 epoch: 15, train_loss: 0.8041, test_loss: 0.9174, test_f1: 0.5720
 epoch: 16, train_loss: 0.7995, test_loss: 0.8189, test_f1: 0.5500
 epoch: 17, train_loss: 0.7851, test_loss: 0.7876, test_f1: 0.5714
 epoch: 18, train_loss: 0.8082, test_loss: 0.9159, test_f1: 0.5643
 epoch: 19, train_loss: 0.7926, test_loss: 0.7836, test_f1: 0.5901
 epoch: 20, train_loss: 0.7731, test_loss: 0.7835, test_f1: 0.6031
 epoch: 21, train_loss: 0.7690, test_loss: 0.7899, test_f1: 0.5707
 epoch: 22, train_loss: 0.7614, test_loss: 0.7889, test_f1: 0.6231
 epoch: 23, train_loss: 0.7533, test_loss: 0.8550, test_f1: 0.5915
 epoch: 24, train_loss: 0.7693, test_loss: 0.8009, test_f1: 0.5611
 epoch: 25, train_loss: 0.7582, test_loss: 0.7513, test_f1: 0.6104
 epoch: 26, train_loss: 0.7326, test_loss: 0.8390, test_f1: 0.5956
 epoch: 27, train_loss: 0.7284, test_loss: 0.7668, test_f1: 0.6174
 epoch: 28, train_loss: 0.7169, test_loss: 0.7334, test_f1: 0.6230
 epoch: 29, train_loss: 0.7122, test_loss: 0.7445, test_f1: 0.6154
 epoch: 30, train_loss: 0.7228, test_loss: 0.7739, test_f1: 0.6049
 epoch: 31, train_loss: 0.7187, test_loss: 0.7444, test_f1: 0.6196
 epoch: 32, train_loss: 0.7116, test_loss: 0.7261, test_f1: 0.6256
 epoch: 33, train_loss: 0.6967, test_loss: 0.7473, test_f1: 0.6285
 epoch: 34, train_loss: 0.6906, test_loss: 0.7615, test_f1: 0.6306
 epoch: 35, train_loss: 0.6853, test_loss: 0.8154, test_f1: 0.6191
 epoch: 36, train_loss: 0.6811, test_loss: 0.7416, test_f1: 0.6308
 epoch: 37, train_loss: 0.6745, test_loss: 0.8951, test_f1: 0.5954
 epoch: 38, train_loss: 0.6542, test_loss: 0.7166, test_f1: 0.6455
 epoch: 39, train_loss: 0.6663, test_loss: 0.8507, test_f1: 0.6065
 epoch: 40, train_loss: 0.6731, test_loss: 0.7196, test_f1: 0.6554
 epoch: 41, train_loss: 0.6485, test_loss: 0.8348, test_f1: 0.5916
 epoch: 42, train_loss: 0.6590, test_loss: 0.8452, test_f1: 0.6406
 epoch: 43, train_loss: 0.6476, test_loss: 0.8260, test_f1: 0.6385
 epoch: 44, train_loss: 0.6503, test_loss: 0.8344, test_f1: 0.6730
 epoch: 45, train_loss: 0.6420, test_loss: 0.8580, test_f1: 0.6249
 epoch: 46, train_loss: 0.6340, test_loss: 0.7538, test_f1: 0.6409
 epoch: 47, train_loss: 0.6494, test_loss: 0.8729, test_f1: 0.6334
 epoch: 48, train_loss: 0.6581, test_loss: 0.8736, test_f1: 0.6193
 epoch: 49, train_loss: 0.6273, test_loss: 0.7982, test_f1: 0.5976
 epoch: 50, train_loss: 0.6326, test_loss: 0.7839, test_f1: 0.6598
 epoch: 51, train_loss: 0.5903, test_loss: 0.7512, test_f1: 0.6914
 epoch: 52, train_loss: 0.5903, test_loss: 0.8257, test_f1: 0.6703
 epoch: 53, train_loss: 0.5844, test_loss: 0.8108, test_f1: 0.6533
 epoch: 54, train_loss: 0.5686, test_loss: 0.7934, test_f1: 0.6582
 epoch: 55, train_loss: 0.5665, test_loss: 0.8433, test_f1: 0.6431
 epoch: 56, train_loss: 0.5689, test_loss: 0.7672, test_f1: 0.6734
 epoch: 57, train_loss: 0.5681, test_loss: 0.8093, test_f1: 0.6584
 epoch: 58, train_loss: 0.5667, test_loss: 0.7818, test_f1: 0.6689
 epoch: 59, train_loss: 0.5540, test_loss: 0.8444, test_f1: 0.6591
 epoch: 60, train_loss: 0.5477, test_loss: 0.7678, test_f1: 0.6524
 epoch: 61, train_loss: 0.5661, test_loss: 0.8478, test_f1: 0.6584
 epoch: 62, train_loss: 0.5478, test_loss: 0.8572, test_f1: 0.6451
 epoch: 63, train_loss: 0.5507, test_loss: 0.7578, test_f1: 0.6894
 epoch: 64, train_loss: 0.5356, test_loss: 0.7992, test_f1: 0.6612
 epoch: 65, train_loss: 0.5351, test_loss: 0.8578, test_f1: 0.6736
 epoch: 66, train_loss: 0.5472, test_loss: 0.7962, test_f1: 0.6729
 epoch: 67, train_loss: 0.5335, test_loss: 0.8455, test_f1: 0.6931
 epoch: 68, train_loss: 0.5283, test_loss: 0.7596, test_f1: 0.6805
 epoch: 69, train_loss: 0.5267, test_loss: 0.7807, test_f1: 0.6441
 epoch: 70, train_loss: 0.5202, test_loss: 0.8932, test_f1: 0.6411
 epoch: 71, train_loss: 0.5334, test_loss: 0.9134, test_f1: 0.6373
 epoch: 72, train_loss: 0.5202, test_loss: 0.9798, test_f1: 0.6423
 epoch: 73, train_loss: 0.5161, test_loss: 0.8945, test_f1: 0.6816
 epoch: 74, train_loss: 0.5183, test_loss: 0.8549, test_f1: 0.6922
 epoch: 75, train_loss: 0.5217, test_loss: 0.7979, test_f1: 0.6737
 epoch: 76, train_loss: 0.5155, test_loss: 0.8977, test_f1: 0.6494
 epoch: 77, train_loss: 0.5018, test_loss: 0.8595, test_f1: 0.6537
 epoch: 78, train_loss: 0.4965, test_loss: 0.8901, test_f1: 0.6697
 epoch: 79, train_loss: 0.4992, test_loss: 0.7601, test_f1: 0.6562
 epoch: 80, train_loss: 0.5002, test_loss: 0.9242, test_f1: 0.6471
 epoch: 81, train_loss: 0.4915, test_loss: 0.8969, test_f1: 0.6920
 epoch: 82, train_loss: 0.5024, test_loss: 0.7520, test_f1: 0.6656
 epoch: 83, train_loss: 0.5019, test_loss: 0.8988, test_f1: 0.6444
 epoch: 84, train_loss: 0.4883, test_loss: 1.0043, test_f1: 0.6535
 epoch: 85, train_loss: 0.4772, test_loss: 0.9473, test_f1: 0.6811
 epoch: 86, train_loss: 0.4904, test_loss: 0.9928, test_f1: 0.6534
 epoch: 87, train_loss: 0.5070, test_loss: 0.9367, test_f1: 0.6541
 epoch: 88, train_loss: 0.4897, test_loss: 0.8809, test_f1: 0.6753
 epoch: 89, train_loss: 0.4872, test_loss: 0.9587, test_f1: 0.6694
 epoch: 90, train_loss: 0.4745, test_loss: 0.8919, test_f1: 0.6785
 epoch: 91, train_loss: 0.4827, test_loss: 0.9295, test_f1: 0.6707
 epoch: 92, train_loss: 0.4753, test_loss: 0.9951, test_f1: 0.6603
 epoch: 93, train_loss: 0.4696, test_loss: 0.9566, test_f1: 0.6638
 epoch: 94, train_loss: 0.4690, test_loss: 0.9207, test_f1: 0.6731
 epoch: 95, train_loss: 0.4775, test_loss: 1.0107, test_f1: 0.6652
 epoch: 96, train_loss: 0.4619, test_loss: 1.0172, test_f1: 0.6534
 epoch: 97, train_loss: 0.4593, test_loss: 0.9935, test_f1: 0.6716
 epoch: 98, train_loss: 0.4589, test_loss: 0.9448, test_f1: 0.6725
 epoch: 99, train_loss: 0.4632, test_loss: 0.9874, test_f1: 0.6679
##################ITERATION #3 ****************************************
 epoch: 0, train_loss: 1.1687, test_loss: 1.0474, test_f1: 0.4879
 epoch: 1, train_loss: 1.0296, test_loss: 1.0056, test_f1: 0.5171
 epoch: 2, train_loss: 1.0007, test_loss: 1.0142, test_f1: 0.4817
 epoch: 3, train_loss: 0.9767, test_loss: 0.9754, test_f1: 0.5079
 epoch: 4, train_loss: 0.9478, test_loss: 0.9781, test_f1: 0.5022
 epoch: 5, train_loss: 0.9466, test_loss: 0.9844, test_f1: 0.5171
 epoch: 6, train_loss: 0.9291, test_loss: 0.9499, test_f1: 0.5343
 epoch: 7, train_loss: 0.9094, test_loss: 0.9684, test_f1: 0.5123
 epoch: 8, train_loss: 0.9083, test_loss: 0.9359, test_f1: 0.5653
 epoch: 9, train_loss: 0.8979, test_loss: 0.9433, test_f1: 0.5161
 epoch: 10, train_loss: 0.8794, test_loss: 0.9537, test_f1: 0.5227
 epoch: 11, train_loss: 0.8610, test_loss: 0.9270, test_f1: 0.5357
 epoch: 12, train_loss: 0.8621, test_loss: 0.8776, test_f1: 0.5435
 epoch: 13, train_loss: 0.8489, test_loss: 0.9877, test_f1: 0.5687
 epoch: 14, train_loss: 0.8454, test_loss: 0.9013, test_f1: 0.5403
 epoch: 15, train_loss: 0.8450, test_loss: 0.8446, test_f1: 0.5780
 epoch: 16, train_loss: 0.8225, test_loss: 0.8862, test_f1: 0.5589
 epoch: 17, train_loss: 0.8167, test_loss: 0.8740, test_f1: 0.6086
 epoch: 18, train_loss: 0.8139, test_loss: 0.8637, test_f1: 0.6143
 epoch: 19, train_loss: 0.8037, test_loss: 0.8526, test_f1: 0.6090
 epoch: 20, train_loss: 0.7908, test_loss: 0.8439, test_f1: 0.6036
 epoch: 21, train_loss: 0.7793, test_loss: 0.8091, test_f1: 0.6208
 epoch: 22, train_loss: 0.7813, test_loss: 0.8365, test_f1: 0.6093
 epoch: 23, train_loss: 0.7732, test_loss: 0.8364, test_f1: 0.6178
 epoch: 24, train_loss: 0.7507, test_loss: 0.8237, test_f1: 0.6185
 epoch: 25, train_loss: 0.7499, test_loss: 0.8605, test_f1: 0.6333
 epoch: 26, train_loss: 0.7570, test_loss: 0.8100, test_f1: 0.6492
 epoch: 27, train_loss: 0.7454, test_loss: 0.7733, test_f1: 0.6380
 epoch: 28, train_loss: 0.7423, test_loss: 0.8372, test_f1: 0.6292
 epoch: 29, train_loss: 0.7304, test_loss: 0.8121, test_f1: 0.6345
 epoch: 30, train_loss: 0.7190, test_loss: 0.8346, test_f1: 0.6549
 epoch: 31, train_loss: 0.7236, test_loss: 0.8243, test_f1: 0.6372
 epoch: 32, train_loss: 0.7179, test_loss: 0.8017, test_f1: 0.6455
 epoch: 33, train_loss: 0.7008, test_loss: 0.7786, test_f1: 0.6598
 epoch: 34, train_loss: 0.7065, test_loss: 0.8769, test_f1: 0.6097
 epoch: 35, train_loss: 0.7078, test_loss: 0.7348, test_f1: 0.6348
 epoch: 36, train_loss: 0.7029, test_loss: 0.7955, test_f1: 0.6146
 epoch: 37, train_loss: 0.6794, test_loss: 0.8065, test_f1: 0.6275
 epoch: 38, train_loss: 0.6814, test_loss: 0.7750, test_f1: 0.6649
 epoch: 39, train_loss: 0.6875, test_loss: 0.8251, test_f1: 0.6346
 epoch: 40, train_loss: 0.6840, test_loss: 0.7799, test_f1: 0.6493
 epoch: 41, train_loss: 0.6689, test_loss: 0.7815, test_f1: 0.6529
 epoch: 42, train_loss: 0.6780, test_loss: 0.7337, test_f1: 0.6498
 epoch: 43, train_loss: 0.6680, test_loss: 0.7499, test_f1: 0.6733
 epoch: 44, train_loss: 0.6426, test_loss: 0.7821, test_f1: 0.6308
 epoch: 45, train_loss: 0.6658, test_loss: 0.7185, test_f1: 0.6317
 epoch: 46, train_loss: 0.6425, test_loss: 0.8069, test_f1: 0.6376
 epoch: 47, train_loss: 0.6442, test_loss: 0.8180, test_f1: 0.6458
 epoch: 48, train_loss: 0.6575, test_loss: 0.7566, test_f1: 0.6508
 epoch: 49, train_loss: 0.6526, test_loss: 0.8157, test_f1: 0.6457
 epoch: 50, train_loss: 0.6448, test_loss: 0.8269, test_f1: 0.6491
 epoch: 51, train_loss: 0.6264, test_loss: 0.7665, test_f1: 0.6525
 epoch: 52, train_loss: 0.6031, test_loss: 0.7500, test_f1: 0.6669
 epoch: 53, train_loss: 0.6037, test_loss: 0.7685, test_f1: 0.6662
 epoch: 54, train_loss: 0.5972, test_loss: 0.7887, test_f1: 0.6556
 epoch: 55, train_loss: 0.5850, test_loss: 0.7565, test_f1: 0.6447
 epoch: 56, train_loss: 0.5945, test_loss: 0.7697, test_f1: 0.6536
 epoch: 57, train_loss: 0.5851, test_loss: 0.7843, test_f1: 0.6545
 epoch: 58, train_loss: 0.5703, test_loss: 0.8007, test_f1: 0.6633
 epoch: 59, train_loss: 0.5644, test_loss: 0.8279, test_f1: 0.6448
 epoch: 60, train_loss: 0.5828, test_loss: 0.7712, test_f1: 0.6471
 epoch: 61, train_loss: 0.5709, test_loss: 0.7853, test_f1: 0.6556
 epoch: 62, train_loss: 0.5729, test_loss: 0.7964, test_f1: 0.6661
 epoch: 63, train_loss: 0.5673, test_loss: 0.8339, test_f1: 0.6548
 epoch: 64, train_loss: 0.5612, test_loss: 0.7831, test_f1: 0.6710
 epoch: 65, train_loss: 0.5838, test_loss: 0.8222, test_f1: 0.6440
 epoch: 66, train_loss: 0.5605, test_loss: 0.8273, test_f1: 0.6716
 epoch: 67, train_loss: 0.5599, test_loss: 0.7694, test_f1: 0.6471
 epoch: 68, train_loss: 0.5577, test_loss: 0.8111, test_f1: 0.6861
 epoch: 69, train_loss: 0.5457, test_loss: 0.7866, test_f1: 0.6566
 epoch: 70, train_loss: 0.5418, test_loss: 0.8435, test_f1: 0.6495
 epoch: 71, train_loss: 0.5473, test_loss: 0.8742, test_f1: 0.6532
 epoch: 72, train_loss: 0.5536, test_loss: 0.7837, test_f1: 0.6890
 epoch: 73, train_loss: 0.5406, test_loss: 0.8476, test_f1: 0.6766
 epoch: 74, train_loss: 0.5564, test_loss: 0.7765, test_f1: 0.6956
 epoch: 75, train_loss: 0.5577, test_loss: 0.8369, test_f1: 0.6445
 epoch: 76, train_loss: 0.5171, test_loss: 0.7976, test_f1: 0.6458
 epoch: 77, train_loss: 0.5537, test_loss: 0.8122, test_f1: 0.6783
 epoch: 78, train_loss: 0.5266, test_loss: 0.8352, test_f1: 0.6559
 epoch: 79, train_loss: 0.5248, test_loss: 0.9049, test_f1: 0.6766
 epoch: 80, train_loss: 0.5275, test_loss: 0.8350, test_f1: 0.6535
 epoch: 81, train_loss: 0.5365, test_loss: 0.8737, test_f1: 0.6443
 epoch: 82, train_loss: 0.5273, test_loss: 0.8697, test_f1: 0.6759
 epoch: 83, train_loss: 0.5065, test_loss: 0.7692, test_f1: 0.6816
 epoch: 84, train_loss: 0.5272, test_loss: 0.8189, test_f1: 0.6414
 epoch: 85, train_loss: 0.5113, test_loss: 0.8772, test_f1: 0.6569
 epoch: 86, train_loss: 0.5323, test_loss: 0.8483, test_f1: 0.6539
 epoch: 87, train_loss: 0.5270, test_loss: 0.8299, test_f1: 0.6303
 epoch: 88, train_loss: 0.5129, test_loss: 0.8253, test_f1: 0.6744
 epoch: 89, train_loss: 0.5053, test_loss: 0.9177, test_f1: 0.7060
 epoch: 90, train_loss: 0.5272, test_loss: 0.8670, test_f1: 0.6635
 epoch: 91, train_loss: 0.5159, test_loss: 0.9466, test_f1: 0.6563
 epoch: 92, train_loss: 0.5069, test_loss: 0.8168, test_f1: 0.6577
 epoch: 93, train_loss: 0.5152, test_loss: 0.8346, test_f1: 0.6532
 epoch: 94, train_loss: 0.5234, test_loss: 0.8932, test_f1: 0.6579
 epoch: 95, train_loss: 0.4999, test_loss: 0.8936, test_f1: 0.6722
 epoch: 96, train_loss: 0.5095, test_loss: 0.9167, test_f1: 0.6706
 epoch: 97, train_loss: 0.5176, test_loss: 0.8612, test_f1: 0.6571
 epoch: 98, train_loss: 0.5164, test_loss: 0.8068, test_f1: 0.6736
 epoch: 99, train_loss: 0.5062, test_loss: 0.8917, test_f1: 0.6777
##################ITERATION #4 ****************************************
 epoch: 0, train_loss: 1.1624, test_loss: 1.0126, test_f1: 0.4858
 epoch: 1, train_loss: 1.0149, test_loss: 0.9699, test_f1: 0.5101
 epoch: 2, train_loss: 0.9645, test_loss: 0.9517, test_f1: 0.4600
 epoch: 3, train_loss: 0.9672, test_loss: 0.9528, test_f1: 0.5003
 epoch: 4, train_loss: 0.9337, test_loss: 0.9351, test_f1: 0.4859
 epoch: 5, train_loss: 0.9344, test_loss: 0.8946, test_f1: 0.5652
 epoch: 6, train_loss: 0.9150, test_loss: 0.9034, test_f1: 0.5515
 epoch: 7, train_loss: 0.9064, test_loss: 0.8460, test_f1: 0.5765
 epoch: 8, train_loss: 0.8797, test_loss: 0.8964, test_f1: 0.5777
 epoch: 9, train_loss: 0.8767, test_loss: 0.9051, test_f1: 0.5618
 epoch: 10, train_loss: 0.8591, test_loss: 0.8956, test_f1: 0.5486
 epoch: 11, train_loss: 0.8512, test_loss: 0.8897, test_f1: 0.5544
 epoch: 12, train_loss: 0.8520, test_loss: 0.8670, test_f1: 0.5434
 epoch: 13, train_loss: 0.8412, test_loss: 0.8567, test_f1: 0.5522
 epoch: 14, train_loss: 0.8130, test_loss: 0.8461, test_f1: 0.5785
 epoch: 15, train_loss: 0.8143, test_loss: 0.8061, test_f1: 0.5657
 epoch: 16, train_loss: 0.8032, test_loss: 0.7529, test_f1: 0.6178
 epoch: 17, train_loss: 0.8067, test_loss: 0.7963, test_f1: 0.5691
 epoch: 18, train_loss: 0.7836, test_loss: 0.7645, test_f1: 0.5934
 epoch: 19, train_loss: 0.7779, test_loss: 0.7865, test_f1: 0.6091
 epoch: 20, train_loss: 0.7624, test_loss: 0.8018, test_f1: 0.5976
 epoch: 21, train_loss: 0.7689, test_loss: 0.8480, test_f1: 0.5886
 epoch: 22, train_loss: 0.7574, test_loss: 0.8128, test_f1: 0.6157
 epoch: 23, train_loss: 0.7512, test_loss: 0.7298, test_f1: 0.6313
 epoch: 24, train_loss: 0.7355, test_loss: 0.8430, test_f1: 0.6084
 epoch: 25, train_loss: 0.7358, test_loss: 0.7983, test_f1: 0.6290
 epoch: 26, train_loss: 0.7234, test_loss: 0.8298, test_f1: 0.6121
 epoch: 27, train_loss: 0.7188, test_loss: 0.7870, test_f1: 0.6492
 epoch: 28, train_loss: 0.7279, test_loss: 0.8458, test_f1: 0.5775
 epoch: 29, train_loss: 0.7341, test_loss: 0.7267, test_f1: 0.6588
 epoch: 30, train_loss: 0.7326, test_loss: 0.7341, test_f1: 0.6463
 epoch: 31, train_loss: 0.7100, test_loss: 0.7525, test_f1: 0.6388
 epoch: 32, train_loss: 0.7054, test_loss: 0.7190, test_f1: 0.6275
 epoch: 33, train_loss: 0.6969, test_loss: 0.7187, test_f1: 0.6669
 epoch: 34, train_loss: 0.6889, test_loss: 0.7003, test_f1: 0.6545
 epoch: 35, train_loss: 0.6904, test_loss: 0.7478, test_f1: 0.6101
 epoch: 36, train_loss: 0.7056, test_loss: 0.7355, test_f1: 0.6151
 epoch: 37, train_loss: 0.6788, test_loss: 0.7192, test_f1: 0.6223
 epoch: 38, train_loss: 0.6856, test_loss: 0.7132, test_f1: 0.6433
 epoch: 39, train_loss: 0.6756, test_loss: 0.7592, test_f1: 0.6200
 epoch: 40, train_loss: 0.6679, test_loss: 0.7276, test_f1: 0.6397
 epoch: 41, train_loss: 0.6640, test_loss: 0.7868, test_f1: 0.6170
 epoch: 42, train_loss: 0.6589, test_loss: 0.6812, test_f1: 0.6500
 epoch: 43, train_loss: 0.6642, test_loss: 0.6890, test_f1: 0.6515
 epoch: 44, train_loss: 0.6557, test_loss: 0.7779, test_f1: 0.6307
 epoch: 45, train_loss: 0.6378, test_loss: 0.7492, test_f1: 0.6398
 epoch: 46, train_loss: 0.6318, test_loss: 0.7123, test_f1: 0.6344
 epoch: 47, train_loss: 0.6416, test_loss: 0.7502, test_f1: 0.6520
 epoch: 48, train_loss: 0.6175, test_loss: 0.7733, test_f1: 0.6309
 epoch: 49, train_loss: 0.6511, test_loss: 0.7013, test_f1: 0.6540
 epoch: 50, train_loss: 0.6217, test_loss: 0.7575, test_f1: 0.6482
 epoch: 51, train_loss: 0.6012, test_loss: 0.6852, test_f1: 0.6996
 epoch: 52, train_loss: 0.5830, test_loss: 0.7116, test_f1: 0.6508
 epoch: 53, train_loss: 0.5723, test_loss: 0.7461, test_f1: 0.6661
 epoch: 54, train_loss: 0.5622, test_loss: 0.7922, test_f1: 0.6502
 epoch: 55, train_loss: 0.5770, test_loss: 0.7341, test_f1: 0.6557
 epoch: 56, train_loss: 0.5618, test_loss: 0.6881, test_f1: 0.6731
 epoch: 57, train_loss: 0.5577, test_loss: 0.6796, test_f1: 0.6884
 epoch: 58, train_loss: 0.5421, test_loss: 0.7405, test_f1: 0.6705
 epoch: 59, train_loss: 0.5603, test_loss: 0.7156, test_f1: 0.6691
 epoch: 60, train_loss: 0.5657, test_loss: 0.7240, test_f1: 0.6586
 epoch: 61, train_loss: 0.5574, test_loss: 0.7611, test_f1: 0.6521
 epoch: 62, train_loss: 0.5561, test_loss: 0.6814, test_f1: 0.6617
 epoch: 63, train_loss: 0.5579, test_loss: 0.7240, test_f1: 0.6730
 epoch: 64, train_loss: 0.5489, test_loss: 0.7565, test_f1: 0.6555
 epoch: 65, train_loss: 0.5476, test_loss: 0.7543, test_f1: 0.6740
 epoch: 66, train_loss: 0.5669, test_loss: 0.7282, test_f1: 0.6750
 epoch: 67, train_loss: 0.5499, test_loss: 0.7496, test_f1: 0.6625
 epoch: 68, train_loss: 0.5384, test_loss: 0.7852, test_f1: 0.6657
 epoch: 69, train_loss: 0.5277, test_loss: 0.7429, test_f1: 0.6549
 epoch: 70, train_loss: 0.5409, test_loss: 0.7847, test_f1: 0.6637
 epoch: 71, train_loss: 0.5339, test_loss: 0.7957, test_f1: 0.6687
 epoch: 72, train_loss: 0.5437, test_loss: 0.8410, test_f1: 0.6607
 epoch: 73, train_loss: 0.5228, test_loss: 0.7443, test_f1: 0.6509
 epoch: 74, train_loss: 0.5306, test_loss: 0.7778, test_f1: 0.6586
 epoch: 75, train_loss: 0.5307, test_loss: 0.7393, test_f1: 0.6843
 epoch: 76, train_loss: 0.5063, test_loss: 0.7883, test_f1: 0.6702
 epoch: 77, train_loss: 0.5088, test_loss: 0.7775, test_f1: 0.6648
 epoch: 78, train_loss: 0.5228, test_loss: 0.7483, test_f1: 0.6736
 epoch: 79, train_loss: 0.5023, test_loss: 0.7341, test_f1: 0.6760
 epoch: 80, train_loss: 0.5254, test_loss: 0.8402, test_f1: 0.6728
 epoch: 81, train_loss: 0.5659, test_loss: 0.7008, test_f1: 0.6851
 epoch: 82, train_loss: 0.5080, test_loss: 0.7301, test_f1: 0.7009
 epoch: 83, train_loss: 0.5052, test_loss: 0.7460, test_f1: 0.6808
 epoch: 84, train_loss: 0.4891, test_loss: 0.7979, test_f1: 0.6801
 epoch: 85, train_loss: 0.4974, test_loss: 0.7377, test_f1: 0.6821
 epoch: 86, train_loss: 0.4890, test_loss: 0.7977, test_f1: 0.6645
 epoch: 87, train_loss: 0.4928, test_loss: 0.8146, test_f1: 0.6544
 epoch: 88, train_loss: 0.4878, test_loss: 0.8181, test_f1: 0.6730
 epoch: 89, train_loss: 0.4875, test_loss: 0.8374, test_f1: 0.6649
 epoch: 90, train_loss: 0.4810, test_loss: 0.8138, test_f1: 0.6581
 epoch: 91, train_loss: 0.4781, test_loss: 0.8736, test_f1: 0.6736
 epoch: 92, train_loss: 0.4835, test_loss: 0.9544, test_f1: 0.6591
 epoch: 93, train_loss: 0.4804, test_loss: 0.8441, test_f1: 0.6515
 epoch: 94, train_loss: 0.4807, test_loss: 0.8000, test_f1: 0.6742
 epoch: 95, train_loss: 0.4603, test_loss: 0.8612, test_f1: 0.6625
 epoch: 96, train_loss: 0.4894, test_loss: 0.9220, test_f1: 0.6510
 epoch: 97, train_loss: 0.4629, test_loss: 0.7958, test_f1: 0.6830
 epoch: 98, train_loss: 0.4685, test_loss: 0.8708, test_f1: 0.6699
 epoch: 99, train_loss: 0.4684, test_loss: 0.8234, test_f1: 0.6866
##################ITERATION #5 ****************************************
 epoch: 0, train_loss: 1.2131, test_loss: 1.0441, test_f1: 0.4772
 epoch: 1, train_loss: 1.0317, test_loss: 1.0221, test_f1: 0.4832
 epoch: 2, train_loss: 1.0070, test_loss: 0.9649, test_f1: 0.5016
 epoch: 3, train_loss: 0.9774, test_loss: 0.9958, test_f1: 0.4759
 epoch: 4, train_loss: 0.9686, test_loss: 0.9841, test_f1: 0.5155
 epoch: 5, train_loss: 0.9441, test_loss: 1.0103, test_f1: 0.4888
 epoch: 6, train_loss: 0.9311, test_loss: 0.9754, test_f1: 0.4901
 epoch: 7, train_loss: 0.9257, test_loss: 0.9766, test_f1: 0.5077
 epoch: 8, train_loss: 0.9083, test_loss: 0.9344, test_f1: 0.5681
 epoch: 9, train_loss: 0.8973, test_loss: 0.8823, test_f1: 0.5575
 epoch: 10, train_loss: 0.8689, test_loss: 0.9019, test_f1: 0.5619
 epoch: 11, train_loss: 0.8660, test_loss: 0.9078, test_f1: 0.5539
 epoch: 12, train_loss: 0.8555, test_loss: 0.8890, test_f1: 0.5564
 epoch: 13, train_loss: 0.8658, test_loss: 0.8569, test_f1: 0.5952
 epoch: 14, train_loss: 0.8261, test_loss: 0.8550, test_f1: 0.5568
 epoch: 15, train_loss: 0.8289, test_loss: 0.8747, test_f1: 0.5961
 epoch: 16, train_loss: 0.8224, test_loss: 0.8715, test_f1: 0.5770
 epoch: 17, train_loss: 0.7994, test_loss: 0.8799, test_f1: 0.5923
 epoch: 18, train_loss: 0.7902, test_loss: 0.8583, test_f1: 0.5734
 epoch: 19, train_loss: 0.7917, test_loss: 0.8640, test_f1: 0.6135
 epoch: 20, train_loss: 0.7983, test_loss: 0.8637, test_f1: 0.5719
 epoch: 21, train_loss: 0.7738, test_loss: 0.7893, test_f1: 0.6164
 epoch: 22, train_loss: 0.7656, test_loss: 0.8088, test_f1: 0.6368
 epoch: 23, train_loss: 0.7634, test_loss: 0.8339, test_f1: 0.5936
 epoch: 24, train_loss: 0.7491, test_loss: 0.8242, test_f1: 0.6077
 epoch: 25, train_loss: 0.7565, test_loss: 0.8523, test_f1: 0.6335
 epoch: 26, train_loss: 0.7477, test_loss: 0.8270, test_f1: 0.5694
 epoch: 27, train_loss: 0.7485, test_loss: 0.8137, test_f1: 0.6028
 epoch: 28, train_loss: 0.7394, test_loss: 0.8370, test_f1: 0.6021
 epoch: 29, train_loss: 0.7365, test_loss: 0.8060, test_f1: 0.6221
 epoch: 30, train_loss: 0.7385, test_loss: 0.7646, test_f1: 0.6300
 epoch: 31, train_loss: 0.7193, test_loss: 0.8150, test_f1: 0.6170
 epoch: 32, train_loss: 0.7132, test_loss: 0.8408, test_f1: 0.6453
 epoch: 33, train_loss: 0.6960, test_loss: 0.8363, test_f1: 0.6091
 epoch: 34, train_loss: 0.7030, test_loss: 0.8775, test_f1: 0.6314
 epoch: 35, train_loss: 0.6969, test_loss: 0.8334, test_f1: 0.6541
 epoch: 36, train_loss: 0.6923, test_loss: 0.8552, test_f1: 0.6372
 epoch: 37, train_loss: 0.7026, test_loss: 0.8672, test_f1: 0.6535
 epoch: 38, train_loss: 0.6775, test_loss: 0.8208, test_f1: 0.6231
 epoch: 39, train_loss: 0.6742, test_loss: 0.8788, test_f1: 0.6005
 epoch: 40, train_loss: 0.6925, test_loss: 0.8362, test_f1: 0.6399
 epoch: 41, train_loss: 0.6795, test_loss: 0.8117, test_f1: 0.6447
 epoch: 42, train_loss: 0.6886, test_loss: 0.7804, test_f1: 0.6541
 epoch: 43, train_loss: 0.6683, test_loss: 0.7581, test_f1: 0.6561
 epoch: 44, train_loss: 0.6569, test_loss: 0.7652, test_f1: 0.6495
 epoch: 45, train_loss: 0.6669, test_loss: 0.8578, test_f1: 0.6253
 epoch: 46, train_loss: 0.6939, test_loss: 0.7842, test_f1: 0.6202
 epoch: 47, train_loss: 0.6550, test_loss: 0.8292, test_f1: 0.6360
 epoch: 48, train_loss: 0.6756, test_loss: 0.8493, test_f1: 0.6298
 epoch: 49, train_loss: 0.6535, test_loss: 0.7982, test_f1: 0.6475
 epoch: 50, train_loss: 0.6315, test_loss: 0.8540, test_f1: 0.6524
 epoch: 51, train_loss: 0.6185, test_loss: 0.7988, test_f1: 0.6610
 epoch: 52, train_loss: 0.6212, test_loss: 0.7824, test_f1: 0.6579
 epoch: 53, train_loss: 0.5993, test_loss: 0.8409, test_f1: 0.6714
 epoch: 54, train_loss: 0.5975, test_loss: 0.8291, test_f1: 0.6478
 epoch: 55, train_loss: 0.6033, test_loss: 0.8438, test_f1: 0.6471
 epoch: 56, train_loss: 0.5951, test_loss: 0.8075, test_f1: 0.6640
 epoch: 57, train_loss: 0.5888, test_loss: 0.8250, test_f1: 0.6504
 epoch: 58, train_loss: 0.5782, test_loss: 0.8391, test_f1: 0.6429
 epoch: 59, train_loss: 0.5863, test_loss: 0.8329, test_f1: 0.6680
 epoch: 60, train_loss: 0.5856, test_loss: 0.7971, test_f1: 0.6763
 epoch: 61, train_loss: 0.5829, test_loss: 0.8631, test_f1: 0.6667
 epoch: 62, train_loss: 0.5842, test_loss: 0.8269, test_f1: 0.6734
 epoch: 63, train_loss: 0.5587, test_loss: 0.8533, test_f1: 0.6806
 epoch: 64, train_loss: 0.5782, test_loss: 0.8426, test_f1: 0.6477
 epoch: 65, train_loss: 0.5683, test_loss: 0.8712, test_f1: 0.6579
 epoch: 66, train_loss: 0.5779, test_loss: 0.8790, test_f1: 0.6482
 epoch: 67, train_loss: 0.5736, test_loss: 0.8321, test_f1: 0.6904
 epoch: 68, train_loss: 0.5635, test_loss: 0.8585, test_f1: 0.6894
 epoch: 69, train_loss: 0.5816, test_loss: 0.8876, test_f1: 0.6433
 epoch: 70, train_loss: 0.5578, test_loss: 0.8697, test_f1: 0.6614
 epoch: 71, train_loss: 0.5565, test_loss: 0.8355, test_f1: 0.6506
 epoch: 72, train_loss: 0.5504, test_loss: 0.8514, test_f1: 0.6764
 epoch: 73, train_loss: 0.5734, test_loss: 0.9536, test_f1: 0.6461
 epoch: 74, train_loss: 0.5564, test_loss: 0.8890, test_f1: 0.6571
 epoch: 75, train_loss: 0.5571, test_loss: 0.9049, test_f1: 0.6585
 epoch: 76, train_loss: 0.5468, test_loss: 0.8505, test_f1: 0.6639
 epoch: 77, train_loss: 0.5344, test_loss: 0.8474, test_f1: 0.6839
 epoch: 78, train_loss: 0.5389, test_loss: 0.8387, test_f1: 0.6884
 epoch: 79, train_loss: 0.5483, test_loss: 0.9436, test_f1: 0.6566
 epoch: 80, train_loss: 0.5519, test_loss: 0.9102, test_f1: 0.6741
 epoch: 81, train_loss: 0.5415, test_loss: 0.9084, test_f1: 0.6670
 epoch: 82, train_loss: 0.5389, test_loss: 0.8817, test_f1: 0.6333
 epoch: 83, train_loss: 0.5285, test_loss: 0.8884, test_f1: 0.6771
 epoch: 84, train_loss: 0.5344, test_loss: 0.8467, test_f1: 0.6923
 epoch: 85, train_loss: 0.5323, test_loss: 0.8833, test_f1: 0.6773
 epoch: 86, train_loss: 0.5230, test_loss: 0.9113, test_f1: 0.6669
 epoch: 87, train_loss: 0.5377, test_loss: 0.8722, test_f1: 0.6513
 epoch: 88, train_loss: 0.5269, test_loss: 0.9316, test_f1: 0.6612
 epoch: 89, train_loss: 0.5120, test_loss: 0.8830, test_f1: 0.6810
 epoch: 90, train_loss: 0.5599, test_loss: 0.8116, test_f1: 0.6774
 epoch: 91, train_loss: 0.5352, test_loss: 0.9213, test_f1: 0.6827
 epoch: 92, train_loss: 0.5317, test_loss: 0.8729, test_f1: 0.6698
 epoch: 93, train_loss: 0.5298, test_loss: 0.8709, test_f1: 0.6826
 epoch: 94, train_loss: 0.5234, test_loss: 0.9012, test_f1: 0.6858
 epoch: 95, train_loss: 0.5018, test_loss: 0.9242, test_f1: 0.6859
 epoch: 96, train_loss: 0.4979, test_loss: 0.9068, test_f1: 0.6578
 epoch: 97, train_loss: 0.5152, test_loss: 0.8708, test_f1: 0.6723
 epoch: 98, train_loss: 0.5108, test_loss: 0.9172, test_f1: 0.6735
 epoch: 99, train_loss: 0.5122, test_loss: 0.8977, test_f1: 0.6736
##################ITERATION #6 ****************************************
 epoch: 0, train_loss: 1.2237, test_loss: 0.9571, test_f1: 0.4934
 epoch: 1, train_loss: 1.0142, test_loss: 0.9217, test_f1: 0.5138
 epoch: 2, train_loss: 0.9691, test_loss: 0.8964, test_f1: 0.5221
 epoch: 3, train_loss: 0.9419, test_loss: 0.8972, test_f1: 0.4818
 epoch: 4, train_loss: 0.9268, test_loss: 0.9412, test_f1: 0.4876
 epoch: 5, train_loss: 0.9156, test_loss: 0.9203, test_f1: 0.5371
 epoch: 6, train_loss: 0.9040, test_loss: 0.8639, test_f1: 0.5403
 epoch: 7, train_loss: 0.8912, test_loss: 0.9017, test_f1: 0.5281
 epoch: 8, train_loss: 0.8724, test_loss: 0.8904, test_f1: 0.5478
 epoch: 9, train_loss: 0.8563, test_loss: 0.8147, test_f1: 0.5971
 epoch: 10, train_loss: 0.8541, test_loss: 0.8378, test_f1: 0.5704
 epoch: 11, train_loss: 0.8415, test_loss: 0.8115, test_f1: 0.6155
 epoch: 12, train_loss: 0.8406, test_loss: 0.8890, test_f1: 0.5662
 epoch: 13, train_loss: 0.8137, test_loss: 0.8388, test_f1: 0.5935
 epoch: 14, train_loss: 0.8233, test_loss: 0.8355, test_f1: 0.6203
 epoch: 15, train_loss: 0.8054, test_loss: 0.8188, test_f1: 0.6148
 epoch: 16, train_loss: 0.7853, test_loss: 0.8286, test_f1: 0.6271
 epoch: 17, train_loss: 0.7868, test_loss: 0.8345, test_f1: 0.6437
 epoch: 18, train_loss: 0.7713, test_loss: 0.8099, test_f1: 0.6413
 epoch: 19, train_loss: 0.7494, test_loss: 0.7490, test_f1: 0.6457
 epoch: 20, train_loss: 0.7783, test_loss: 0.8090, test_f1: 0.6068
 epoch: 21, train_loss: 0.7513, test_loss: 0.7266, test_f1: 0.6469
 epoch: 22, train_loss: 0.7466, test_loss: 0.8148, test_f1: 0.6239
 epoch: 23, train_loss: 0.7219, test_loss: 0.8082, test_f1: 0.6012
 epoch: 24, train_loss: 0.7275, test_loss: 0.7807, test_f1: 0.6558
 epoch: 25, train_loss: 0.7136, test_loss: 0.7816, test_f1: 0.6280
 epoch: 26, train_loss: 0.7226, test_loss: 0.8195, test_f1: 0.6429
 epoch: 27, train_loss: 0.7121, test_loss: 0.7640, test_f1: 0.6240
 epoch: 28, train_loss: 0.7050, test_loss: 0.8605, test_f1: 0.6186
 epoch: 29, train_loss: 0.7089, test_loss: 0.7953, test_f1: 0.6482
 epoch: 30, train_loss: 0.7093, test_loss: 0.8104, test_f1: 0.6322
 epoch: 31, train_loss: 0.6745, test_loss: 0.7721, test_f1: 0.6340
 epoch: 32, train_loss: 0.6902, test_loss: 0.8050, test_f1: 0.6327
 epoch: 33, train_loss: 0.6820, test_loss: 0.7924, test_f1: 0.6429
 epoch: 34, train_loss: 0.6900, test_loss: 0.8077, test_f1: 0.6480
 epoch: 35, train_loss: 0.6831, test_loss: 0.7358, test_f1: 0.6459
 epoch: 36, train_loss: 0.6831, test_loss: 0.7870, test_f1: 0.6201
 epoch: 37, train_loss: 0.6404, test_loss: 0.7700, test_f1: 0.6523
 epoch: 38, train_loss: 0.6824, test_loss: 0.7933, test_f1: 0.6492
 epoch: 39, train_loss: 0.6777, test_loss: 0.8075, test_f1: 0.6400
 epoch: 40, train_loss: 0.6513, test_loss: 0.7746, test_f1: 0.6482
 epoch: 41, train_loss: 0.6343, test_loss: 0.7994, test_f1: 0.6447
 epoch: 42, train_loss: 0.6777, test_loss: 0.6934, test_f1: 0.6713
 epoch: 43, train_loss: 0.6498, test_loss: 0.7852, test_f1: 0.6309
 epoch: 44, train_loss: 0.6443, test_loss: 0.7730, test_f1: 0.6617
 epoch: 45, train_loss: 0.6297, test_loss: 0.8312, test_f1: 0.6570
 epoch: 46, train_loss: 0.6299, test_loss: 0.8095, test_f1: 0.6487
 epoch: 47, train_loss: 0.6353, test_loss: 0.8270, test_f1: 0.6517
 epoch: 48, train_loss: 0.6167, test_loss: 0.7871, test_f1: 0.6591
 epoch: 49, train_loss: 0.6376, test_loss: 0.7978, test_f1: 0.6666
 epoch: 50, train_loss: 0.6108, test_loss: 0.7973, test_f1: 0.6700
 epoch: 51, train_loss: 0.5932, test_loss: 0.7999, test_f1: 0.6731
 epoch: 52, train_loss: 0.5683, test_loss: 0.8182, test_f1: 0.6644
 epoch: 53, train_loss: 0.5449, test_loss: 0.7897, test_f1: 0.6604
 epoch: 54, train_loss: 0.5537, test_loss: 0.7982, test_f1: 0.6859
 epoch: 55, train_loss: 0.5514, test_loss: 0.7959, test_f1: 0.6815
 epoch: 56, train_loss: 0.5533, test_loss: 0.8142, test_f1: 0.6685
 epoch: 57, train_loss: 0.5471, test_loss: 0.8734, test_f1: 0.6655
 epoch: 58, train_loss: 0.5528, test_loss: 0.8258, test_f1: 0.6610
 epoch: 59, train_loss: 0.5454, test_loss: 0.8509, test_f1: 0.6568
 epoch: 60, train_loss: 0.5338, test_loss: 0.8581, test_f1: 0.6654
 epoch: 61, train_loss: 0.5387, test_loss: 0.8381, test_f1: 0.6688
 epoch: 62, train_loss: 0.5277, test_loss: 0.8724, test_f1: 0.6677
 epoch: 63, train_loss: 0.5280, test_loss: 0.8625, test_f1: 0.6538
 epoch: 64, train_loss: 0.5299, test_loss: 0.8523, test_f1: 0.6638
 epoch: 65, train_loss: 0.5118, test_loss: 0.8211, test_f1: 0.6654
 epoch: 66, train_loss: 0.5314, test_loss: 0.8778, test_f1: 0.6543
 epoch: 67, train_loss: 0.5292, test_loss: 0.8699, test_f1: 0.6727
 epoch: 68, train_loss: 0.5256, test_loss: 0.8600, test_f1: 0.6572
 epoch: 69, train_loss: 0.5203, test_loss: 0.8870, test_f1: 0.6621
 epoch: 70, train_loss: 0.5069, test_loss: 0.8600, test_f1: 0.6761
 epoch: 71, train_loss: 0.5026, test_loss: 0.8608, test_f1: 0.6787
 epoch: 72, train_loss: 0.4973, test_loss: 0.9134, test_f1: 0.6759
 epoch: 73, train_loss: 0.5112, test_loss: 0.9058, test_f1: 0.6540
 epoch: 74, train_loss: 0.5067, test_loss: 0.8993, test_f1: 0.6670
 epoch: 75, train_loss: 0.4955, test_loss: 0.8965, test_f1: 0.6801
 epoch: 76, train_loss: 0.4908, test_loss: 0.9185, test_f1: 0.6814
 epoch: 77, train_loss: 0.4960, test_loss: 0.8897, test_f1: 0.6668
 epoch: 78, train_loss: 0.4970, test_loss: 0.8569, test_f1: 0.6717
 epoch: 79, train_loss: 0.5022, test_loss: 0.8952, test_f1: 0.6829
 epoch: 80, train_loss: 0.4770, test_loss: 0.9066, test_f1: 0.7031
 epoch: 81, train_loss: 0.4867, test_loss: 0.8659, test_f1: 0.6907
 epoch: 82, train_loss: 0.4822, test_loss: 0.8609, test_f1: 0.6970
 epoch: 83, train_loss: 0.4823, test_loss: 0.9189, test_f1: 0.6616
 epoch: 84, train_loss: 0.4809, test_loss: 0.8870, test_f1: 0.6971
 epoch: 85, train_loss: 0.4918, test_loss: 0.9095, test_f1: 0.6826
 epoch: 86, train_loss: 0.4703, test_loss: 0.9345, test_f1: 0.6862
 epoch: 87, train_loss: 0.4889, test_loss: 0.9624, test_f1: 0.6546
 epoch: 88, train_loss: 0.4886, test_loss: 0.9122, test_f1: 0.6764
 epoch: 89, train_loss: 0.4712, test_loss: 0.9508, test_f1: 0.6789
 epoch: 90, train_loss: 0.4923, test_loss: 0.9057, test_f1: 0.6803
 epoch: 91, train_loss: 0.4617, test_loss: 0.9161, test_f1: 0.6767
 epoch: 92, train_loss: 0.4659, test_loss: 0.9000, test_f1: 0.6884
 epoch: 93, train_loss: 0.4615, test_loss: 0.9357, test_f1: 0.6836
 epoch: 94, train_loss: 0.4748, test_loss: 0.8699, test_f1: 0.6900
 epoch: 95, train_loss: 0.4681, test_loss: 0.8875, test_f1: 0.6773
 epoch: 96, train_loss: 0.4596, test_loss: 0.9452, test_f1: 0.6705
 epoch: 97, train_loss: 0.4674, test_loss: 0.9437, test_f1: 0.6724
 epoch: 98, train_loss: 0.4440, test_loss: 0.9576, test_f1: 0.6830
 epoch: 99, train_loss: 0.4667, test_loss: 1.0044, test_f1: 0.6676
##################ITERATION #7 ****************************************
 epoch: 0, train_loss: 1.2744, test_loss: 0.9771, test_f1: 0.4731
 epoch: 1, train_loss: 1.0360, test_loss: 0.9627, test_f1: 0.4930
 epoch: 2, train_loss: 0.9825, test_loss: 0.9426, test_f1: 0.4903
 epoch: 3, train_loss: 0.9726, test_loss: 0.9546, test_f1: 0.5157
 epoch: 4, train_loss: 0.9595, test_loss: 0.9456, test_f1: 0.4992
 epoch: 5, train_loss: 0.9360, test_loss: 0.9175, test_f1: 0.5399
 epoch: 6, train_loss: 0.9270, test_loss: 0.9102, test_f1: 0.5637
 epoch: 7, train_loss: 0.9032, test_loss: 0.9350, test_f1: 0.5100
 epoch: 8, train_loss: 0.8916, test_loss: 0.8838, test_f1: 0.5929
 epoch: 9, train_loss: 0.8800, test_loss: 0.8777, test_f1: 0.5761
 epoch: 10, train_loss: 0.8730, test_loss: 0.9124, test_f1: 0.5342
 epoch: 11, train_loss: 0.8564, test_loss: 0.8260, test_f1: 0.5877
 epoch: 12, train_loss: 0.8453, test_loss: 0.8259, test_f1: 0.6175
 epoch: 13, train_loss: 0.8317, test_loss: 0.8464, test_f1: 0.5804
 epoch: 14, train_loss: 0.8266, test_loss: 0.8369, test_f1: 0.5968
 epoch: 15, train_loss: 0.8306, test_loss: 0.8541, test_f1: 0.6023
 epoch: 16, train_loss: 0.8174, test_loss: 0.7993, test_f1: 0.6168
 epoch: 17, train_loss: 0.8067, test_loss: 0.7666, test_f1: 0.6093
 epoch: 18, train_loss: 0.7976, test_loss: 0.7936, test_f1: 0.6125
 epoch: 19, train_loss: 0.7889, test_loss: 0.7979, test_f1: 0.6172
 epoch: 20, train_loss: 0.7905, test_loss: 0.7867, test_f1: 0.5810
 epoch: 21, train_loss: 0.7748, test_loss: 0.7439, test_f1: 0.5953
 epoch: 22, train_loss: 0.7599, test_loss: 0.8004, test_f1: 0.6093
 epoch: 23, train_loss: 0.7613, test_loss: 0.7636, test_f1: 0.6449
 epoch: 24, train_loss: 0.7646, test_loss: 0.7550, test_f1: 0.6136
 epoch: 25, train_loss: 0.7703, test_loss: 0.7745, test_f1: 0.6251
 epoch: 26, train_loss: 0.7373, test_loss: 0.7659, test_f1: 0.6183
 epoch: 27, train_loss: 0.7509, test_loss: 0.7258, test_f1: 0.6398
 epoch: 28, train_loss: 0.7399, test_loss: 0.7280, test_f1: 0.6543
 epoch: 29, train_loss: 0.7342, test_loss: 0.7459, test_f1: 0.6332
 epoch: 30, train_loss: 0.7295, test_loss: 0.7953, test_f1: 0.5842
 epoch: 31, train_loss: 0.7218, test_loss: 0.7276, test_f1: 0.6204
 epoch: 32, train_loss: 0.7182, test_loss: 0.7416, test_f1: 0.6533
 epoch: 33, train_loss: 0.7009, test_loss: 0.7116, test_f1: 0.6395
 epoch: 34, train_loss: 0.7193, test_loss: 0.7673, test_f1: 0.6023
 epoch: 35, train_loss: 0.7017, test_loss: 0.7837, test_f1: 0.6473
 epoch: 36, train_loss: 0.7011, test_loss: 0.7883, test_f1: 0.6197
 epoch: 37, train_loss: 0.7011, test_loss: 0.7481, test_f1: 0.6468
 epoch: 38, train_loss: 0.6822, test_loss: 0.7809, test_f1: 0.6289
 epoch: 39, train_loss: 0.6915, test_loss: 0.8019, test_f1: 0.5977
 epoch: 40, train_loss: 0.6907, test_loss: 0.7698, test_f1: 0.6162
 epoch: 41, train_loss: 0.6853, test_loss: 0.8023, test_f1: 0.6398
 epoch: 42, train_loss: 0.6761, test_loss: 0.7904, test_f1: 0.6431
 epoch: 43, train_loss: 0.6517, test_loss: 0.7553, test_f1: 0.6608
 epoch: 44, train_loss: 0.6564, test_loss: 0.7542, test_f1: 0.6610
 epoch: 45, train_loss: 0.6536, test_loss: 0.7979, test_f1: 0.6350
 epoch: 46, train_loss: 0.6774, test_loss: 0.8018, test_f1: 0.6348
 epoch: 47, train_loss: 0.6627, test_loss: 0.7912, test_f1: 0.6466
 epoch: 48, train_loss: 0.6492, test_loss: 0.7624, test_f1: 0.6400
 epoch: 49, train_loss: 0.6575, test_loss: 0.8131, test_f1: 0.6416
 epoch: 50, train_loss: 0.6441, test_loss: 0.7984, test_f1: 0.6186
 epoch: 51, train_loss: 0.6139, test_loss: 0.7403, test_f1: 0.6610
 epoch: 52, train_loss: 0.6094, test_loss: 0.7381, test_f1: 0.6815
 epoch: 53, train_loss: 0.5983, test_loss: 0.7501, test_f1: 0.6837
 epoch: 54, train_loss: 0.5949, test_loss: 0.7841, test_f1: 0.6578
 epoch: 55, train_loss: 0.5802, test_loss: 0.7534, test_f1: 0.6688
 epoch: 56, train_loss: 0.5843, test_loss: 0.7644, test_f1: 0.6803
 epoch: 57, train_loss: 0.5905, test_loss: 0.7951, test_f1: 0.6667
 epoch: 58, train_loss: 0.5906, test_loss: 0.7692, test_f1: 0.6589
 epoch: 59, train_loss: 0.5563, test_loss: 0.7681, test_f1: 0.6623
 epoch: 60, train_loss: 0.5742, test_loss: 0.7685, test_f1: 0.6413
 epoch: 61, train_loss: 0.5714, test_loss: 0.7617, test_f1: 0.6626
 epoch: 62, train_loss: 0.5903, test_loss: 0.7539, test_f1: 0.6647
 epoch: 63, train_loss: 0.5693, test_loss: 0.8180, test_f1: 0.6372
 epoch: 64, train_loss: 0.5845, test_loss: 0.7268, test_f1: 0.6837
 epoch: 65, train_loss: 0.5663, test_loss: 0.7672, test_f1: 0.6734
 epoch: 66, train_loss: 0.5638, test_loss: 0.8038, test_f1: 0.6424
 epoch: 67, train_loss: 0.5521, test_loss: 0.7390, test_f1: 0.6402
 epoch: 68, train_loss: 0.5550, test_loss: 0.7593, test_f1: 0.6560
 epoch: 69, train_loss: 0.5504, test_loss: 0.7765, test_f1: 0.6661
 epoch: 70, train_loss: 0.5504, test_loss: 0.7673, test_f1: 0.6689
 epoch: 71, train_loss: 0.5310, test_loss: 0.7976, test_f1: 0.6725
 epoch: 72, train_loss: 0.5483, test_loss: 0.7609, test_f1: 0.6798
 epoch: 73, train_loss: 0.5428, test_loss: 0.7546, test_f1: 0.6661
 epoch: 74, train_loss: 0.5423, test_loss: 0.7580, test_f1: 0.6627
 epoch: 75, train_loss: 0.5441, test_loss: 0.7805, test_f1: 0.6567
 epoch: 76, train_loss: 0.5306, test_loss: 0.7687, test_f1: 0.6632
 epoch: 77, train_loss: 0.5316, test_loss: 0.7793, test_f1: 0.6734
 epoch: 78, train_loss: 0.5498, test_loss: 0.7835, test_f1: 0.6932
 epoch: 79, train_loss: 0.5395, test_loss: 0.7337, test_f1: 0.6798
 epoch: 80, train_loss: 0.5141, test_loss: 0.8459, test_f1: 0.6736
 epoch: 81, train_loss: 0.5193, test_loss: 0.8309, test_f1: 0.6696
 epoch: 82, train_loss: 0.5305, test_loss: 0.8201, test_f1: 0.6793
 epoch: 83, train_loss: 0.5239, test_loss: 0.8505, test_f1: 0.6572
 epoch: 84, train_loss: 0.5136, test_loss: 0.8786, test_f1: 0.6486
 epoch: 85, train_loss: 0.5212, test_loss: 0.8431, test_f1: 0.6686
 epoch: 86, train_loss: 0.5236, test_loss: 0.8592, test_f1: 0.6837
 epoch: 87, train_loss: 0.5075, test_loss: 0.8376, test_f1: 0.6711
 epoch: 88, train_loss: 0.5289, test_loss: 0.8683, test_f1: 0.6682
 epoch: 89, train_loss: 0.4973, test_loss: 0.8157, test_f1: 0.6772
 epoch: 90, train_loss: 0.5187, test_loss: 0.8352, test_f1: 0.6677
 epoch: 91, train_loss: 0.5028, test_loss: 0.8106, test_f1: 0.6606
 epoch: 92, train_loss: 0.5061, test_loss: 0.8205, test_f1: 0.6832
 epoch: 93, train_loss: 0.5050, test_loss: 0.8436, test_f1: 0.6634
 epoch: 94, train_loss: 0.4946, test_loss: 0.8598, test_f1: 0.6587
 epoch: 95, train_loss: 0.4923, test_loss: 0.8407, test_f1: 0.6579
 epoch: 96, train_loss: 0.4990, test_loss: 0.8003, test_f1: 0.6632
 epoch: 97, train_loss: 0.4893, test_loss: 0.7608, test_f1: 0.6932
 epoch: 98, train_loss: 0.4911, test_loss: 0.8229, test_f1: 0.6815
 epoch: 99, train_loss: 0.5009, test_loss: 0.8024, test_f1: 0.6502
##################ITERATION #8 ****************************************
 epoch: 0, train_loss: 1.2165, test_loss: 1.0248, test_f1: 0.4811
 epoch: 1, train_loss: 1.0183, test_loss: 0.9539, test_f1: 0.5149
 epoch: 2, train_loss: 0.9807, test_loss: 0.9526, test_f1: 0.4968
 epoch: 3, train_loss: 0.9482, test_loss: 0.9317, test_f1: 0.5179
 epoch: 4, train_loss: 0.9409, test_loss: 0.8780, test_f1: 0.5033
 epoch: 5, train_loss: 0.9254, test_loss: 0.8660, test_f1: 0.5407
 epoch: 6, train_loss: 0.9227, test_loss: 0.8581, test_f1: 0.5515
 epoch: 7, train_loss: 0.8910, test_loss: 0.9076, test_f1: 0.5363
 epoch: 8, train_loss: 0.8831, test_loss: 0.8883, test_f1: 0.5392
 epoch: 9, train_loss: 0.8770, test_loss: 0.8582, test_f1: 0.5446
 epoch: 10, train_loss: 0.8657, test_loss: 0.8236, test_f1: 0.5585
 epoch: 11, train_loss: 0.8488, test_loss: 0.8451, test_f1: 0.5626
 epoch: 12, train_loss: 0.8445, test_loss: 0.7944, test_f1: 0.5590
 epoch: 13, train_loss: 0.8308, test_loss: 0.7750, test_f1: 0.5842
 epoch: 14, train_loss: 0.8174, test_loss: 0.7412, test_f1: 0.6305
 epoch: 15, train_loss: 0.8059, test_loss: 0.7947, test_f1: 0.6121
 epoch: 16, train_loss: 0.8076, test_loss: 0.8329, test_f1: 0.5722
 epoch: 17, train_loss: 0.7930, test_loss: 0.7040, test_f1: 0.6300
 epoch: 18, train_loss: 0.7722, test_loss: 0.7401, test_f1: 0.6167
 epoch: 19, train_loss: 0.7726, test_loss: 0.7390, test_f1: 0.5978
 epoch: 20, train_loss: 0.7691, test_loss: 0.6957, test_f1: 0.6367
 epoch: 21, train_loss: 0.7604, test_loss: 0.8050, test_f1: 0.5947
 epoch: 22, train_loss: 0.7629, test_loss: 0.8036, test_f1: 0.6009
 epoch: 23, train_loss: 0.7443, test_loss: 0.7898, test_f1: 0.5747
 epoch: 24, train_loss: 0.7456, test_loss: 0.7167, test_f1: 0.6316
 epoch: 25, train_loss: 0.7381, test_loss: 0.7761, test_f1: 0.6363
 epoch: 26, train_loss: 0.7425, test_loss: 0.7072, test_f1: 0.6280
 epoch: 27, train_loss: 0.7238, test_loss: 0.7638, test_f1: 0.6143
 epoch: 28, train_loss: 0.7121, test_loss: 0.6670, test_f1: 0.6488
 epoch: 29, train_loss: 0.7263, test_loss: 0.7489, test_f1: 0.6458
 epoch: 30, train_loss: 0.6886, test_loss: 0.8189, test_f1: 0.5986
 epoch: 31, train_loss: 0.7135, test_loss: 0.7157, test_f1: 0.6549
 epoch: 32, train_loss: 0.6896, test_loss: 0.7393, test_f1: 0.6413
 epoch: 33, train_loss: 0.6765, test_loss: 0.7789, test_f1: 0.6476
 epoch: 34, train_loss: 0.6902, test_loss: 0.7384, test_f1: 0.6353
 epoch: 35, train_loss: 0.7055, test_loss: 0.7696, test_f1: 0.6405
 epoch: 36, train_loss: 0.6943, test_loss: 0.7225, test_f1: 0.6744
 epoch: 37, train_loss: 0.6898, test_loss: 0.6703, test_f1: 0.6497
 epoch: 38, train_loss: 0.6729, test_loss: 0.7084, test_f1: 0.6795
 epoch: 39, train_loss: 0.6787, test_loss: 0.7824, test_f1: 0.6619
 epoch: 40, train_loss: 0.6663, test_loss: 0.8033, test_f1: 0.6516
 epoch: 41, train_loss: 0.6472, test_loss: 0.7334, test_f1: 0.6261
 epoch: 42, train_loss: 0.6537, test_loss: 0.7298, test_f1: 0.6435
 epoch: 43, train_loss: 0.6383, test_loss: 0.7869, test_f1: 0.6579
 epoch: 44, train_loss: 0.6577, test_loss: 0.8030, test_f1: 0.6780
 epoch: 45, train_loss: 0.6371, test_loss: 0.7526, test_f1: 0.6533
 epoch: 46, train_loss: 0.6456, test_loss: 0.7565, test_f1: 0.6621
 epoch: 47, train_loss: 0.6366, test_loss: 0.6995, test_f1: 0.6630
 epoch: 48, train_loss: 0.6257, test_loss: 0.8348, test_f1: 0.6550
 epoch: 49, train_loss: 0.6361, test_loss: 0.7765, test_f1: 0.6586
 epoch: 50, train_loss: 0.6249, test_loss: 0.7455, test_f1: 0.6639
 epoch: 51, train_loss: 0.6016, test_loss: 0.7635, test_f1: 0.6824
 epoch: 52, train_loss: 0.5851, test_loss: 0.7203, test_f1: 0.7006
 epoch: 53, train_loss: 0.5745, test_loss: 0.7010, test_f1: 0.6628
 epoch: 54, train_loss: 0.5625, test_loss: 0.7339, test_f1: 0.6745
 epoch: 55, train_loss: 0.5642, test_loss: 0.7458, test_f1: 0.6901
 epoch: 56, train_loss: 0.5593, test_loss: 0.7785, test_f1: 0.6720
 epoch: 57, train_loss: 0.5656, test_loss: 0.7238, test_f1: 0.6835
 epoch: 58, train_loss: 0.5566, test_loss: 0.7865, test_f1: 0.6988
 epoch: 59, train_loss: 0.5541, test_loss: 0.7036, test_f1: 0.6967
 epoch: 60, train_loss: 0.5659, test_loss: 0.7428, test_f1: 0.6971
 epoch: 61, train_loss: 0.5504, test_loss: 0.7670, test_f1: 0.6904
 epoch: 62, train_loss: 0.5575, test_loss: 0.7792, test_f1: 0.6987
 epoch: 63, train_loss: 0.5643, test_loss: 0.8070, test_f1: 0.6771
 epoch: 64, train_loss: 0.5379, test_loss: 0.7787, test_f1: 0.7035
 epoch: 65, train_loss: 0.5363, test_loss: 0.7660, test_f1: 0.6845
 epoch: 66, train_loss: 0.5464, test_loss: 0.6588, test_f1: 0.7023
 epoch: 67, train_loss: 0.5296, test_loss: 0.8228, test_f1: 0.6851
 epoch: 68, train_loss: 0.5324, test_loss: 0.8313, test_f1: 0.6955
 epoch: 69, train_loss: 0.5355, test_loss: 0.8176, test_f1: 0.6799
 epoch: 70, train_loss: 0.5375, test_loss: 0.8005, test_f1: 0.6584
 epoch: 71, train_loss: 0.5307, test_loss: 0.8261, test_f1: 0.6580
 epoch: 72, train_loss: 0.5486, test_loss: 0.8492, test_f1: 0.6657
 epoch: 73, train_loss: 0.5272, test_loss: 0.8588, test_f1: 0.6812
 epoch: 74, train_loss: 0.5127, test_loss: 0.8595, test_f1: 0.6723
 epoch: 75, train_loss: 0.5121, test_loss: 0.8769, test_f1: 0.6655
 epoch: 76, train_loss: 0.5260, test_loss: 0.8768, test_f1: 0.6652
 epoch: 77, train_loss: 0.5137, test_loss: 0.8983, test_f1: 0.6734
 epoch: 78, train_loss: 0.5316, test_loss: 0.8683, test_f1: 0.6715
 epoch: 79, train_loss: 0.5177, test_loss: 0.8925, test_f1: 0.6527
 epoch: 80, train_loss: 0.5125, test_loss: 0.8360, test_f1: 0.6962
 epoch: 81, train_loss: 0.4966, test_loss: 0.9226, test_f1: 0.6807
 epoch: 82, train_loss: 0.5110, test_loss: 0.8934, test_f1: 0.6894
 epoch: 83, train_loss: 0.5012, test_loss: 0.8800, test_f1: 0.6842
 epoch: 84, train_loss: 0.5027, test_loss: 0.8066, test_f1: 0.6764
 epoch: 85, train_loss: 0.4987, test_loss: 0.8586, test_f1: 0.6672
 epoch: 86, train_loss: 0.5001, test_loss: 0.8568, test_f1: 0.6967
 epoch: 87, train_loss: 0.4940, test_loss: 0.8675, test_f1: 0.6513
 epoch: 88, train_loss: 0.5055, test_loss: 0.8542, test_f1: 0.7081
 epoch: 89, train_loss: 0.4809, test_loss: 0.8608, test_f1: 0.6755
 epoch: 90, train_loss: 0.4829, test_loss: 0.8297, test_f1: 0.6836
 epoch: 91, train_loss: 0.4808, test_loss: 0.8989, test_f1: 0.6709
 epoch: 92, train_loss: 0.4818, test_loss: 0.9649, test_f1: 0.6569
 epoch: 93, train_loss: 0.4946, test_loss: 0.8846, test_f1: 0.6898
 epoch: 94, train_loss: 0.4901, test_loss: 0.8722, test_f1: 0.6835
 epoch: 95, train_loss: 0.4745, test_loss: 0.9728, test_f1: 0.6771
 epoch: 96, train_loss: 0.4832, test_loss: 0.9805, test_f1: 0.6747
 epoch: 97, train_loss: 0.4740, test_loss: 0.9521, test_f1: 0.6742
 epoch: 98, train_loss: 0.4559, test_loss: 1.0362, test_f1: 0.6551
 epoch: 99, train_loss: 0.4827, test_loss: 1.0077, test_f1: 0.6664
##################ITERATION #9 ****************************************
 epoch: 0, train_loss: 1.2497, test_loss: 1.0374, test_f1: 0.4738
 epoch: 1, train_loss: 1.0274, test_loss: 0.9680, test_f1: 0.5025
 epoch: 2, train_loss: 0.9999, test_loss: 1.0029, test_f1: 0.5099
 epoch: 3, train_loss: 0.9756, test_loss: 0.9695, test_f1: 0.5001
 epoch: 4, train_loss: 0.9557, test_loss: 0.9997, test_f1: 0.5287
 epoch: 5, train_loss: 0.9590, test_loss: 0.9963, test_f1: 0.5249
 epoch: 6, train_loss: 0.9435, test_loss: 0.9595, test_f1: 0.4949
 epoch: 7, train_loss: 0.9293, test_loss: 0.9128, test_f1: 0.5352
 epoch: 8, train_loss: 0.9197, test_loss: 0.9418, test_f1: 0.5417
 epoch: 9, train_loss: 0.9120, test_loss: 0.9319, test_f1: 0.5499
 epoch: 10, train_loss: 0.8868, test_loss: 0.8417, test_f1: 0.5725
 epoch: 11, train_loss: 0.8810, test_loss: 0.8519, test_f1: 0.5372
 epoch: 12, train_loss: 0.8748, test_loss: 0.8836, test_f1: 0.5361
 epoch: 13, train_loss: 0.8723, test_loss: 0.8454, test_f1: 0.5484
 epoch: 14, train_loss: 0.8646, test_loss: 0.8600, test_f1: 0.5524
 epoch: 15, train_loss: 0.8462, test_loss: 0.8089, test_f1: 0.6110
 epoch: 16, train_loss: 0.8414, test_loss: 0.8208, test_f1: 0.5885
 epoch: 17, train_loss: 0.8321, test_loss: 0.8311, test_f1: 0.5817
 epoch: 18, train_loss: 0.8305, test_loss: 0.8268, test_f1: 0.6153
 epoch: 19, train_loss: 0.8253, test_loss: 0.7692, test_f1: 0.6311
 epoch: 20, train_loss: 0.8283, test_loss: 0.8574, test_f1: 0.6069
 epoch: 21, train_loss: 0.8055, test_loss: 0.7805, test_f1: 0.6073
 epoch: 22, train_loss: 0.7971, test_loss: 0.7714, test_f1: 0.6068
 epoch: 23, train_loss: 0.8017, test_loss: 0.8229, test_f1: 0.6152
 epoch: 24, train_loss: 0.7905, test_loss: 0.8345, test_f1: 0.5851
 epoch: 25, train_loss: 0.7832, test_loss: 0.8437, test_f1: 0.6326
 epoch: 26, train_loss: 0.7671, test_loss: 0.7703, test_f1: 0.6158
 epoch: 27, train_loss: 0.7743, test_loss: 0.7479, test_f1: 0.6338
 epoch: 28, train_loss: 0.7630, test_loss: 0.7749, test_f1: 0.6366
 epoch: 29, train_loss: 0.7626, test_loss: 0.7727, test_f1: 0.6173
 epoch: 30, train_loss: 0.7409, test_loss: 0.7746, test_f1: 0.6294
 epoch: 31, train_loss: 0.7413, test_loss: 0.7780, test_f1: 0.6032
 epoch: 32, train_loss: 0.7431, test_loss: 0.7107, test_f1: 0.6741
 epoch: 33, train_loss: 0.7380, test_loss: 0.8024, test_f1: 0.6209
 epoch: 34, train_loss: 0.7355, test_loss: 0.7871, test_f1: 0.6175
 epoch: 35, train_loss: 0.7259, test_loss: 0.7795, test_f1: 0.6410
 epoch: 36, train_loss: 0.7402, test_loss: 0.7518, test_f1: 0.6401
 epoch: 37, train_loss: 0.7305, test_loss: 0.7980, test_f1: 0.6381
 epoch: 38, train_loss: 0.7071, test_loss: 0.7570, test_f1: 0.6471
 epoch: 39, train_loss: 0.7122, test_loss: 0.7598, test_f1: 0.6616
 epoch: 40, train_loss: 0.6968, test_loss: 0.7103, test_f1: 0.6324
 epoch: 41, train_loss: 0.7040, test_loss: 0.7611, test_f1: 0.6299
 epoch: 42, train_loss: 0.7114, test_loss: 0.7312, test_f1: 0.6507
 epoch: 43, train_loss: 0.6868, test_loss: 0.7105, test_f1: 0.6492
 epoch: 44, train_loss: 0.6801, test_loss: 0.7979, test_f1: 0.6108
 epoch: 45, train_loss: 0.6760, test_loss: 0.7498, test_f1: 0.6454
 epoch: 46, train_loss: 0.6801, test_loss: 0.7570, test_f1: 0.6288
 epoch: 47, train_loss: 0.6890, test_loss: 0.7070, test_f1: 0.6388
 epoch: 48, train_loss: 0.6794, test_loss: 0.7013, test_f1: 0.6801
 epoch: 49, train_loss: 0.6722, test_loss: 0.7386, test_f1: 0.6552
 epoch: 50, train_loss: 0.6617, test_loss: 0.7774, test_f1: 0.6567
 epoch: 51, train_loss: 0.6393, test_loss: 0.7773, test_f1: 0.6705
 epoch: 52, train_loss: 0.6311, test_loss: 0.7962, test_f1: 0.6667
 epoch: 53, train_loss: 0.6290, test_loss: 0.7437, test_f1: 0.6707
 epoch: 54, train_loss: 0.6131, test_loss: 0.7888, test_f1: 0.6652
 epoch: 55, train_loss: 0.6245, test_loss: 0.7541, test_f1: 0.6682
 epoch: 56, train_loss: 0.6189, test_loss: 0.7880, test_f1: 0.6927
 epoch: 57, train_loss: 0.6036, test_loss: 0.8340, test_f1: 0.6368
 epoch: 58, train_loss: 0.6066, test_loss: 0.7525, test_f1: 0.6629
 epoch: 59, train_loss: 0.6160, test_loss: 0.7573, test_f1: 0.6572
 epoch: 60, train_loss: 0.5963, test_loss: 0.8795, test_f1: 0.6692
 epoch: 61, train_loss: 0.6019, test_loss: 0.7926, test_f1: 0.6599
 epoch: 62, train_loss: 0.5910, test_loss: 0.8072, test_f1: 0.6348
 epoch: 63, train_loss: 0.5956, test_loss: 0.8167, test_f1: 0.6545
 epoch: 64, train_loss: 0.6045, test_loss: 0.8120, test_f1: 0.6825
 epoch: 65, train_loss: 0.6030, test_loss: 0.7872, test_f1: 0.6848
 epoch: 66, train_loss: 0.5996, test_loss: 0.8500, test_f1: 0.6593
 epoch: 67, train_loss: 0.5711, test_loss: 0.8125, test_f1: 0.6460
 epoch: 68, train_loss: 0.6090, test_loss: 0.8756, test_f1: 0.6524
 epoch: 69, train_loss: 0.5808, test_loss: 0.8052, test_f1: 0.6652
 epoch: 70, train_loss: 0.5852, test_loss: 0.8133, test_f1: 0.6342
 epoch: 71, train_loss: 0.5885, test_loss: 0.8112, test_f1: 0.6625
 epoch: 72, train_loss: 0.5679, test_loss: 0.8202, test_f1: 0.6489
 epoch: 73, train_loss: 0.5792, test_loss: 0.8073, test_f1: 0.6581
 epoch: 74, train_loss: 0.5834, test_loss: 0.8542, test_f1: 0.6719
 epoch: 75, train_loss: 0.5613, test_loss: 0.8498, test_f1: 0.6884
 epoch: 76, train_loss: 0.5660, test_loss: 0.8448, test_f1: 0.6647
 epoch: 77, train_loss: 0.5761, test_loss: 0.8138, test_f1: 0.6921
 epoch: 78, train_loss: 0.5541, test_loss: 0.8626, test_f1: 0.6836
 epoch: 79, train_loss: 0.5742, test_loss: 0.8518, test_f1: 0.6513
 epoch: 80, train_loss: 0.5805, test_loss: 0.8439, test_f1: 0.6550
 epoch: 81, train_loss: 0.5530, test_loss: 0.7943, test_f1: 0.6743
 epoch: 82, train_loss: 0.5675, test_loss: 0.8517, test_f1: 0.6603
 epoch: 83, train_loss: 0.5739, test_loss: 0.7980, test_f1: 0.6660
 epoch: 84, train_loss: 0.5517, test_loss: 0.7817, test_f1: 0.6677
 epoch: 85, train_loss: 0.5466, test_loss: 0.8724, test_f1: 0.6576
 epoch: 86, train_loss: 0.5354, test_loss: 0.8524, test_f1: 0.6643
 epoch: 87, train_loss: 0.5469, test_loss: 0.8793, test_f1: 0.6619
 epoch: 88, train_loss: 0.5630, test_loss: 0.8069, test_f1: 0.6880
 epoch: 89, train_loss: 0.5476, test_loss: 0.9144, test_f1: 0.6798
 epoch: 90, train_loss: 0.5391, test_loss: 0.9246, test_f1: 0.6686
 epoch: 91, train_loss: 0.5580, test_loss: 0.8359, test_f1: 0.6682
 epoch: 92, train_loss: 0.5440, test_loss: 0.8425, test_f1: 0.6588
 epoch: 93, train_loss: 0.5263, test_loss: 0.9130, test_f1: 0.6632
 epoch: 94, train_loss: 0.5418, test_loss: 0.8448, test_f1: 0.6689
 epoch: 95, train_loss: 0.5445, test_loss: 0.8427, test_f1: 0.6775
 epoch: 96, train_loss: 0.5268, test_loss: 0.8586, test_f1: 0.6537
 epoch: 97, train_loss: 0.5424, test_loss: 0.8527, test_f1: 0.6543
 epoch: 98, train_loss: 0.5332, test_loss: 0.8291, test_f1: 0.6527
 epoch: 99, train_loss: 0.5548, test_loss: 0.8859, test_f1: 0.6882

Training completed in 1322.86 seconds
Best F1: 0.7081 at epoch 88
Mean F1 across iterations: 0.6982  0.0057
========================FINAL RESULTS================================
FEGIN weighted F1: 0.7081  0.0057
python main.py --data ltspice_examples --representation component_pin_net --model FEGIN --layers 5 --hiddens 32 --batch_size 32 --lr 0.001 --emb_size 128 --epochs 100 --save_appendix component_pin_net_L5_H32_BS32_LR0.001_E128 --no_val
-----



STDERR:
  File "main.py", line 370, in <module>
    main()
  File "main.py", line 254, in main
    dataset = dataset_class(
  File "/home/philip/projects/ltspice_examples_code_repo/Circuit-Completion-Using-GNNs/component_classification_with_link_prediction_head/evaluation/FEGIN/kernel/circuit_datasets.py", line 15, in __init__
    self.data, self.slices = torch.load(self.processed_paths[0])
  File "/home/philip/.local/lib/python3.8/site-packages/torch/serialization.py", line 1040, in load
    warnings.warn(
  File "/usr/lib/python3.8/warnings.py", line 109, in _showwarnmsg
    sw(msg.message, msg.category, msg.filename, msg.lineno,
  File "main.py", line 47, in warn_with_traceback
    traceback.print_stack(file=log)
/home/philip/projects/ltspice_examples_code_repo/Circuit-Completion-Using-GNNs/component_classification_with_link_prediction_head/evaluation/FEGIN/kernel/circuit_datasets.py:15: FutureWarning: You are using `torch.load` with `weights_only=False` (the current default value), which uses the default pickle module implicitly. It is possible to construct malicious pickle data which will execute arbitrary code during unpickling (See https://github.com/pytorch/pytorch/blob/main/SECURITY.md#untrusted-models for more details). In a future release, the default value for `weights_only` will be flipped to `True`. This limits the functions that could be executed during unpickling. Arbitrary objects will no longer be allowed to be loaded via this mode unless they are explicitly allowlisted by the user via `torch.serialization.add_safe_globals`. We recommend you start setting `weights_only=True` for any use case where you don't have full control of the loaded file. Please open an issue on GitHub for any issues related to this experimental feature.
  self.data, self.slices = torch.load(self.processed_paths[0])
