STDOUT:
Results will be saved in /home/philip/projects/ltspice_examples_code_repo/Circuit-Completion-Using-GNNs/component_classification_with_link_prediction_head/evaluation/FEGIN/results/model_FEGIN_dataset_ltspice_examples
Command line input: python main.py --data ltspice_examples --representation component_pin_net --model FEGIN --layers 3 --hiddens 128 --batch_size 256 --lr 0.0001 --emb_size 128 --epochs 100 --save_appendix component_pin_net_L3_H128_BS256_LR0.0001_E128 --no_val
 is saved.
-----
ltspice_examples - FEGIN
Using 3 layers, 128 hidden units, h = 2
Loading component_pin_net representation dataset
ENTERED
Training FEGIN on component_pin_net representation
Train: 3558, Test: 846
##################ITERATION #0 ****************************************
 epoch: 0, train_loss: 1.3891, test_loss: 1.3914, test_f1: 0.0304
 epoch: 1, train_loss: 1.3687, test_loss: 1.3830, test_f1: 0.2117
 epoch: 2, train_loss: 1.3500, test_loss: 1.3684, test_f1: 0.2270
 epoch: 3, train_loss: 1.3258, test_loss: 1.3400, test_f1: 0.2270
 epoch: 4, train_loss: 1.2943, test_loss: 1.2920, test_f1: 0.2270
 epoch: 5, train_loss: 1.2611, test_loss: 1.2443, test_f1: 0.2392
 epoch: 6, train_loss: 1.2351, test_loss: 1.2127, test_f1: 0.2671
 epoch: 7, train_loss: 1.2117, test_loss: 1.1881, test_f1: 0.2903
 epoch: 8, train_loss: 1.1928, test_loss: 1.1694, test_f1: 0.3372
 epoch: 9, train_loss: 1.1760, test_loss: 1.1543, test_f1: 0.3467
 epoch: 10, train_loss: 1.1638, test_loss: 1.1397, test_f1: 0.3536
 epoch: 11, train_loss: 1.1484, test_loss: 1.1263, test_f1: 0.3545
 epoch: 12, train_loss: 1.1341, test_loss: 1.1082, test_f1: 0.3805
 epoch: 13, train_loss: 1.1131, test_loss: 1.0905, test_f1: 0.4011
 epoch: 14, train_loss: 1.0916, test_loss: 1.0678, test_f1: 0.4364
 epoch: 15, train_loss: 1.0654, test_loss: 1.0465, test_f1: 0.4551
 epoch: 16, train_loss: 1.0421, test_loss: 1.0223, test_f1: 0.4611
 epoch: 17, train_loss: 1.0197, test_loss: 1.0062, test_f1: 0.4736
 epoch: 18, train_loss: 1.0005, test_loss: 0.9891, test_f1: 0.4993
 epoch: 19, train_loss: 0.9835, test_loss: 0.9880, test_f1: 0.4843
 epoch: 20, train_loss: 0.9652, test_loss: 0.9763, test_f1: 0.4942
 epoch: 21, train_loss: 0.9530, test_loss: 0.9640, test_f1: 0.4990
 epoch: 22, train_loss: 0.9437, test_loss: 0.9546, test_f1: 0.5230
 epoch: 23, train_loss: 0.9244, test_loss: 0.9393, test_f1: 0.5133
 epoch: 24, train_loss: 0.9139, test_loss: 0.9371, test_f1: 0.5340
 epoch: 25, train_loss: 0.9079, test_loss: 0.9436, test_f1: 0.4954
 epoch: 26, train_loss: 0.9024, test_loss: 0.9367, test_f1: 0.5257
 epoch: 27, train_loss: 0.8847, test_loss: 0.9228, test_f1: 0.5169
 epoch: 28, train_loss: 0.8783, test_loss: 0.9106, test_f1: 0.5280
 epoch: 29, train_loss: 0.8692, test_loss: 0.9234, test_f1: 0.5332
 epoch: 30, train_loss: 0.8647, test_loss: 0.8866, test_f1: 0.5460
 epoch: 31, train_loss: 0.8590, test_loss: 0.8947, test_f1: 0.5465
 epoch: 32, train_loss: 0.8547, test_loss: 0.9214, test_f1: 0.5384
 epoch: 33, train_loss: 0.8465, test_loss: 0.9007, test_f1: 0.5368
 epoch: 34, train_loss: 0.8378, test_loss: 0.8935, test_f1: 0.5422
 epoch: 35, train_loss: 0.8369, test_loss: 0.8956, test_f1: 0.5547
 epoch: 36, train_loss: 0.8278, test_loss: 0.8902, test_f1: 0.5351
 epoch: 37, train_loss: 0.8201, test_loss: 0.8798, test_f1: 0.5435
 epoch: 38, train_loss: 0.8140, test_loss: 0.8834, test_f1: 0.5449
 epoch: 39, train_loss: 0.8076, test_loss: 0.8788, test_f1: 0.5457
 epoch: 40, train_loss: 0.8024, test_loss: 0.8787, test_f1: 0.5375
 epoch: 41, train_loss: 0.7988, test_loss: 0.8580, test_f1: 0.5430
 epoch: 42, train_loss: 0.7941, test_loss: 0.8605, test_f1: 0.5502
 epoch: 43, train_loss: 0.7945, test_loss: 0.9015, test_f1: 0.5635
 epoch: 44, train_loss: 0.7937, test_loss: 0.8552, test_f1: 0.5606
 epoch: 45, train_loss: 0.7763, test_loss: 0.9268, test_f1: 0.5472
 epoch: 46, train_loss: 0.7791, test_loss: 0.8573, test_f1: 0.5338
 epoch: 47, train_loss: 0.7769, test_loss: 0.8649, test_f1: 0.5527
 epoch: 48, train_loss: 0.7707, test_loss: 0.8986, test_f1: 0.5455
 epoch: 49, train_loss: 0.7750, test_loss: 0.8585, test_f1: 0.5526
 epoch: 50, train_loss: 0.7680, test_loss: 0.8764, test_f1: 0.5432
 epoch: 51, train_loss: 0.7531, test_loss: 0.8721, test_f1: 0.5601
 epoch: 52, train_loss: 0.7523, test_loss: 0.8708, test_f1: 0.5608
 epoch: 53, train_loss: 0.7449, test_loss: 0.8750, test_f1: 0.5552
 epoch: 54, train_loss: 0.7499, test_loss: 0.8756, test_f1: 0.5546
 epoch: 55, train_loss: 0.7512, test_loss: 0.8793, test_f1: 0.5550
 epoch: 56, train_loss: 0.7397, test_loss: 0.8607, test_f1: 0.5555
 epoch: 57, train_loss: 0.7352, test_loss: 0.8771, test_f1: 0.5401
 epoch: 58, train_loss: 0.7376, test_loss: 0.8761, test_f1: 0.5659
 epoch: 59, train_loss: 0.7371, test_loss: 0.8808, test_f1: 0.5444
 epoch: 60, train_loss: 0.7294, test_loss: 0.8656, test_f1: 0.5635
 epoch: 61, train_loss: 0.7308, test_loss: 0.8944, test_f1: 0.5550
 epoch: 62, train_loss: 0.7315, test_loss: 0.8739, test_f1: 0.5501
 epoch: 63, train_loss: 0.7323, test_loss: 0.8862, test_f1: 0.5606
 epoch: 64, train_loss: 0.7254, test_loss: 0.8597, test_f1: 0.5644
 epoch: 65, train_loss: 0.7227, test_loss: 0.8755, test_f1: 0.5698
 epoch: 66, train_loss: 0.7179, test_loss: 0.8994, test_f1: 0.5598
 epoch: 67, train_loss: 0.7168, test_loss: 0.8833, test_f1: 0.5614
 epoch: 68, train_loss: 0.7176, test_loss: 0.8858, test_f1: 0.5589
 epoch: 69, train_loss: 0.7123, test_loss: 0.8757, test_f1: 0.5743
 epoch: 70, train_loss: 0.7173, test_loss: 0.8752, test_f1: 0.5693
 epoch: 71, train_loss: 0.7038, test_loss: 0.8726, test_f1: 0.5680
 epoch: 72, train_loss: 0.7098, test_loss: 0.8907, test_f1: 0.5826
 epoch: 73, train_loss: 0.7090, test_loss: 0.8710, test_f1: 0.5637
 epoch: 74, train_loss: 0.7039, test_loss: 0.8803, test_f1: 0.5684
 epoch: 75, train_loss: 0.7016, test_loss: 0.8979, test_f1: 0.5668
 epoch: 76, train_loss: 0.7083, test_loss: 0.8586, test_f1: 0.5624
 epoch: 77, train_loss: 0.7038, test_loss: 0.8983, test_f1: 0.5706
 epoch: 78, train_loss: 0.6988, test_loss: 0.8867, test_f1: 0.5689
 epoch: 79, train_loss: 0.6954, test_loss: 0.9000, test_f1: 0.5566
 epoch: 80, train_loss: 0.6927, test_loss: 0.8986, test_f1: 0.5756
 epoch: 81, train_loss: 0.6945, test_loss: 0.8858, test_f1: 0.5718
 epoch: 82, train_loss: 0.6862, test_loss: 0.8776, test_f1: 0.5747
 epoch: 83, train_loss: 0.6885, test_loss: 0.8976, test_f1: 0.5751
 epoch: 84, train_loss: 0.6917, test_loss: 0.9009, test_f1: 0.5907
 epoch: 85, train_loss: 0.6863, test_loss: 0.9075, test_f1: 0.5634
 epoch: 86, train_loss: 0.6863, test_loss: 0.9077, test_f1: 0.5638
 epoch: 87, train_loss: 0.6910, test_loss: 0.8742, test_f1: 0.5697
 epoch: 88, train_loss: 0.6824, test_loss: 0.8889, test_f1: 0.5893
 epoch: 89, train_loss: 0.6790, test_loss: 0.9211, test_f1: 0.5700
 epoch: 90, train_loss: 0.6878, test_loss: 0.9061, test_f1: 0.5770
 epoch: 91, train_loss: 0.6647, test_loss: 0.8935, test_f1: 0.5918
 epoch: 92, train_loss: 0.6680, test_loss: 0.8997, test_f1: 0.5652
 epoch: 93, train_loss: 0.6725, test_loss: 0.9144, test_f1: 0.5899
 epoch: 94, train_loss: 0.6656, test_loss: 0.9009, test_f1: 0.5904
 epoch: 95, train_loss: 0.6720, test_loss: 0.8982, test_f1: 0.5953
 epoch: 96, train_loss: 0.6725, test_loss: 0.8925, test_f1: 0.5829
 epoch: 97, train_loss: 0.6637, test_loss: 0.9112, test_f1: 0.5773
 epoch: 98, train_loss: 0.6667, test_loss: 0.9205, test_f1: 0.5750
 epoch: 99, train_loss: 0.6562, test_loss: 0.9246, test_f1: 0.5907
##################ITERATION #1 ****************************************
 epoch: 0, train_loss: 1.3436, test_loss: 1.3691, test_f1: 0.2270
 epoch: 1, train_loss: 1.2791, test_loss: 1.3380, test_f1: 0.2270
 epoch: 2, train_loss: 1.2356, test_loss: 1.2985, test_f1: 0.2270
 epoch: 3, train_loss: 1.1891, test_loss: 1.2281, test_f1: 0.2270
 epoch: 4, train_loss: 1.1497, test_loss: 1.1412, test_f1: 0.3801
 epoch: 5, train_loss: 1.1122, test_loss: 1.0845, test_f1: 0.4199
 epoch: 6, train_loss: 1.0770, test_loss: 1.0500, test_f1: 0.4398
 epoch: 7, train_loss: 1.0531, test_loss: 1.0273, test_f1: 0.4614
 epoch: 8, train_loss: 1.0273, test_loss: 1.0090, test_f1: 0.4872
 epoch: 9, train_loss: 1.0042, test_loss: 0.9926, test_f1: 0.5067
 epoch: 10, train_loss: 0.9900, test_loss: 0.9873, test_f1: 0.5034
 epoch: 11, train_loss: 0.9725, test_loss: 0.9726, test_f1: 0.5169
 epoch: 12, train_loss: 0.9624, test_loss: 0.9618, test_f1: 0.5180
 epoch: 13, train_loss: 0.9507, test_loss: 0.9572, test_f1: 0.5282
 epoch: 14, train_loss: 0.9405, test_loss: 0.9415, test_f1: 0.5368
 epoch: 15, train_loss: 0.9314, test_loss: 0.9546, test_f1: 0.5120
 epoch: 16, train_loss: 0.9263, test_loss: 0.9290, test_f1: 0.5288
 epoch: 17, train_loss: 0.9148, test_loss: 0.9332, test_f1: 0.5330
 epoch: 18, train_loss: 0.8998, test_loss: 0.9154, test_f1: 0.5528
 epoch: 19, train_loss: 0.8929, test_loss: 0.9122, test_f1: 0.5358
 epoch: 20, train_loss: 0.8883, test_loss: 0.9026, test_f1: 0.5460
 epoch: 21, train_loss: 0.8776, test_loss: 0.8969, test_f1: 0.5594
 epoch: 22, train_loss: 0.8686, test_loss: 0.8905, test_f1: 0.5468
 epoch: 23, train_loss: 0.8687, test_loss: 0.8867, test_f1: 0.5601
 epoch: 24, train_loss: 0.8553, test_loss: 0.8749, test_f1: 0.5433
 epoch: 25, train_loss: 0.8466, test_loss: 0.8991, test_f1: 0.5455
 epoch: 26, train_loss: 0.8529, test_loss: 0.8734, test_f1: 0.5448
 epoch: 27, train_loss: 0.8376, test_loss: 0.8730, test_f1: 0.5430
 epoch: 28, train_loss: 0.8297, test_loss: 0.8795, test_f1: 0.5672
 epoch: 29, train_loss: 0.8310, test_loss: 0.8763, test_f1: 0.5726
 epoch: 30, train_loss: 0.8256, test_loss: 0.8812, test_f1: 0.5710
 epoch: 31, train_loss: 0.8183, test_loss: 0.8559, test_f1: 0.5447
 epoch: 32, train_loss: 0.8058, test_loss: 0.8523, test_f1: 0.5563
 epoch: 33, train_loss: 0.8020, test_loss: 0.8518, test_f1: 0.5592
 epoch: 34, train_loss: 0.8083, test_loss: 0.8487, test_f1: 0.5572
 epoch: 35, train_loss: 0.7935, test_loss: 0.8751, test_f1: 0.5595
 epoch: 36, train_loss: 0.7860, test_loss: 0.8394, test_f1: 0.5599
 epoch: 37, train_loss: 0.7784, test_loss: 0.8466, test_f1: 0.5465
 epoch: 38, train_loss: 0.7797, test_loss: 0.8295, test_f1: 0.5629
 epoch: 39, train_loss: 0.7712, test_loss: 0.8617, test_f1: 0.5526
 epoch: 40, train_loss: 0.7665, test_loss: 0.8148, test_f1: 0.5801
 epoch: 41, train_loss: 0.7525, test_loss: 0.8379, test_f1: 0.5727
 epoch: 42, train_loss: 0.7530, test_loss: 0.8153, test_f1: 0.5691
 epoch: 43, train_loss: 0.7448, test_loss: 0.8163, test_f1: 0.5626
 epoch: 44, train_loss: 0.7436, test_loss: 0.8213, test_f1: 0.5683
 epoch: 45, train_loss: 0.7532, test_loss: 0.8258, test_f1: 0.5746
 epoch: 46, train_loss: 0.7381, test_loss: 0.8607, test_f1: 0.5683
 epoch: 47, train_loss: 0.7420, test_loss: 0.8265, test_f1: 0.5658
 epoch: 48, train_loss: 0.7365, test_loss: 0.8509, test_f1: 0.5690
 epoch: 49, train_loss: 0.7275, test_loss: 0.8093, test_f1: 0.5739
 epoch: 50, train_loss: 0.7269, test_loss: 0.8464, test_f1: 0.5691
 epoch: 51, train_loss: 0.7083, test_loss: 0.8360, test_f1: 0.5603
 epoch: 52, train_loss: 0.7055, test_loss: 0.8282, test_f1: 0.5626
 epoch: 53, train_loss: 0.7035, test_loss: 0.8294, test_f1: 0.5759
 epoch: 54, train_loss: 0.7046, test_loss: 0.8259, test_f1: 0.5786
 epoch: 55, train_loss: 0.7037, test_loss: 0.8230, test_f1: 0.5694
 epoch: 56, train_loss: 0.6941, test_loss: 0.8254, test_f1: 0.5606
 epoch: 57, train_loss: 0.6953, test_loss: 0.8428, test_f1: 0.5907
 epoch: 58, train_loss: 0.6883, test_loss: 0.8196, test_f1: 0.5685
 epoch: 59, train_loss: 0.6951, test_loss: 0.8305, test_f1: 0.5889
 epoch: 60, train_loss: 0.6874, test_loss: 0.8106, test_f1: 0.5845
 epoch: 61, train_loss: 0.6858, test_loss: 0.8280, test_f1: 0.5717
 epoch: 62, train_loss: 0.6852, test_loss: 0.8266, test_f1: 0.5672
 epoch: 63, train_loss: 0.6847, test_loss: 0.8292, test_f1: 0.5782
 epoch: 64, train_loss: 0.6863, test_loss: 0.8295, test_f1: 0.5811
 epoch: 65, train_loss: 0.6748, test_loss: 0.8339, test_f1: 0.5837
 epoch: 66, train_loss: 0.6730, test_loss: 0.8461, test_f1: 0.5894
 epoch: 67, train_loss: 0.6766, test_loss: 0.8358, test_f1: 0.5731
 epoch: 68, train_loss: 0.6670, test_loss: 0.8265, test_f1: 0.5809
 epoch: 69, train_loss: 0.6722, test_loss: 0.8419, test_f1: 0.5840
 epoch: 70, train_loss: 0.6727, test_loss: 0.8379, test_f1: 0.5908
 epoch: 71, train_loss: 0.6675, test_loss: 0.8145, test_f1: 0.5854
 epoch: 72, train_loss: 0.6644, test_loss: 0.8445, test_f1: 0.5843
 epoch: 73, train_loss: 0.6615, test_loss: 0.8284, test_f1: 0.5840
 epoch: 74, train_loss: 0.6541, test_loss: 0.8416, test_f1: 0.5940
 epoch: 75, train_loss: 0.6520, test_loss: 0.8257, test_f1: 0.5888
 epoch: 76, train_loss: 0.6533, test_loss: 0.8356, test_f1: 0.5895
 epoch: 77, train_loss: 0.6517, test_loss: 0.8488, test_f1: 0.5896
 epoch: 78, train_loss: 0.6475, test_loss: 0.8519, test_f1: 0.5866
 epoch: 79, train_loss: 0.6533, test_loss: 0.8285, test_f1: 0.5960
 epoch: 80, train_loss: 0.6503, test_loss: 0.8739, test_f1: 0.5940
 epoch: 81, train_loss: 0.6404, test_loss: 0.8465, test_f1: 0.5932
 epoch: 82, train_loss: 0.6455, test_loss: 0.8530, test_f1: 0.5909
 epoch: 83, train_loss: 0.6366, test_loss: 0.8588, test_f1: 0.5897
 epoch: 84, train_loss: 0.6354, test_loss: 0.8541, test_f1: 0.5945
 epoch: 85, train_loss: 0.6417, test_loss: 0.8462, test_f1: 0.5929
 epoch: 86, train_loss: 0.6441, test_loss: 0.8767, test_f1: 0.5956
 epoch: 87, train_loss: 0.6426, test_loss: 0.8552, test_f1: 0.5892
 epoch: 88, train_loss: 0.6329, test_loss: 0.8551, test_f1: 0.5967
 epoch: 89, train_loss: 0.6288, test_loss: 0.8701, test_f1: 0.5959
 epoch: 90, train_loss: 0.6281, test_loss: 0.8667, test_f1: 0.5921
 epoch: 91, train_loss: 0.6267, test_loss: 0.8648, test_f1: 0.5985
 epoch: 92, train_loss: 0.6243, test_loss: 0.8462, test_f1: 0.5907
 epoch: 93, train_loss: 0.6285, test_loss: 0.8762, test_f1: 0.5969
 epoch: 94, train_loss: 0.6211, test_loss: 0.8256, test_f1: 0.5861
 epoch: 95, train_loss: 0.6177, test_loss: 0.8728, test_f1: 0.6027
 epoch: 96, train_loss: 0.6071, test_loss: 0.8616, test_f1: 0.5857
 epoch: 97, train_loss: 0.6087, test_loss: 0.8791, test_f1: 0.5905
 epoch: 98, train_loss: 0.6020, test_loss: 0.8790, test_f1: 0.5840
 epoch: 99, train_loss: 0.6094, test_loss: 0.8590, test_f1: 0.5976
##################ITERATION #2 ****************************************
 epoch: 0, train_loss: 1.3080, test_loss: 1.3515, test_f1: 0.2270
 epoch: 1, train_loss: 1.2259, test_loss: 1.3154, test_f1: 0.2270
 epoch: 2, train_loss: 1.1750, test_loss: 1.2794, test_f1: 0.2270
 epoch: 3, train_loss: 1.1289, test_loss: 1.1924, test_f1: 0.2345
 epoch: 4, train_loss: 1.0872, test_loss: 1.0817, test_f1: 0.4066
 epoch: 5, train_loss: 1.0531, test_loss: 1.0307, test_f1: 0.4523
 epoch: 6, train_loss: 1.0305, test_loss: 1.0035, test_f1: 0.4882
 epoch: 7, train_loss: 1.0051, test_loss: 0.9868, test_f1: 0.4927
 epoch: 8, train_loss: 0.9904, test_loss: 0.9718, test_f1: 0.4940
 epoch: 9, train_loss: 0.9744, test_loss: 0.9607, test_f1: 0.5036
 epoch: 10, train_loss: 0.9645, test_loss: 0.9538, test_f1: 0.4949
 epoch: 11, train_loss: 0.9574, test_loss: 0.9459, test_f1: 0.5234
 epoch: 12, train_loss: 0.9472, test_loss: 0.9382, test_f1: 0.5080
 epoch: 13, train_loss: 0.9297, test_loss: 0.9262, test_f1: 0.5429
 epoch: 14, train_loss: 0.9260, test_loss: 0.9173, test_f1: 0.5288
 epoch: 15, train_loss: 0.9151, test_loss: 0.9149, test_f1: 0.5402
 epoch: 16, train_loss: 0.9064, test_loss: 0.9151, test_f1: 0.5216
 epoch: 17, train_loss: 0.8982, test_loss: 0.9028, test_f1: 0.5454
 epoch: 18, train_loss: 0.8874, test_loss: 0.8912, test_f1: 0.5512
 epoch: 19, train_loss: 0.8879, test_loss: 0.8968, test_f1: 0.5541
 epoch: 20, train_loss: 0.8805, test_loss: 0.8792, test_f1: 0.5637
 epoch: 21, train_loss: 0.8753, test_loss: 0.9017, test_f1: 0.5087
 epoch: 22, train_loss: 0.8613, test_loss: 0.8793, test_f1: 0.5641
 epoch: 23, train_loss: 0.8620, test_loss: 0.8710, test_f1: 0.5363
 epoch: 24, train_loss: 0.8462, test_loss: 0.8757, test_f1: 0.5489
 epoch: 25, train_loss: 0.8462, test_loss: 0.8727, test_f1: 0.5499
 epoch: 26, train_loss: 0.8396, test_loss: 0.8597, test_f1: 0.5385
 epoch: 27, train_loss: 0.8306, test_loss: 0.8532, test_f1: 0.5486
 epoch: 28, train_loss: 0.8227, test_loss: 0.8984, test_f1: 0.5423
 epoch: 29, train_loss: 0.8232, test_loss: 0.8487, test_f1: 0.5387
 epoch: 30, train_loss: 0.8115, test_loss: 0.8581, test_f1: 0.5480
 epoch: 31, train_loss: 0.8044, test_loss: 0.8461, test_f1: 0.5390
 epoch: 32, train_loss: 0.7994, test_loss: 0.8530, test_f1: 0.5448
 epoch: 33, train_loss: 0.7964, test_loss: 0.8393, test_f1: 0.5517
 epoch: 34, train_loss: 0.7922, test_loss: 0.8431, test_f1: 0.5511
 epoch: 35, train_loss: 0.7820, test_loss: 0.8360, test_f1: 0.5633
 epoch: 36, train_loss: 0.7801, test_loss: 0.8176, test_f1: 0.5674
 epoch: 37, train_loss: 0.7636, test_loss: 0.8344, test_f1: 0.5486
 epoch: 38, train_loss: 0.7634, test_loss: 0.8478, test_f1: 0.5525
 epoch: 39, train_loss: 0.7588, test_loss: 0.8201, test_f1: 0.5702
 epoch: 40, train_loss: 0.7504, test_loss: 0.8251, test_f1: 0.5554
 epoch: 41, train_loss: 0.7398, test_loss: 0.8362, test_f1: 0.5652
 epoch: 42, train_loss: 0.7379, test_loss: 0.8257, test_f1: 0.5672
 epoch: 43, train_loss: 0.7377, test_loss: 0.8211, test_f1: 0.5529
 epoch: 44, train_loss: 0.7356, test_loss: 0.8571, test_f1: 0.5507
 epoch: 45, train_loss: 0.7334, test_loss: 0.8227, test_f1: 0.5555
 epoch: 46, train_loss: 0.7246, test_loss: 0.8294, test_f1: 0.5570
 epoch: 47, train_loss: 0.7191, test_loss: 0.8376, test_f1: 0.5539
 epoch: 48, train_loss: 0.7131, test_loss: 0.8375, test_f1: 0.5691
 epoch: 49, train_loss: 0.7046, test_loss: 0.8600, test_f1: 0.5416
 epoch: 50, train_loss: 0.7100, test_loss: 0.8143, test_f1: 0.5746
 epoch: 51, train_loss: 0.6941, test_loss: 0.8234, test_f1: 0.5729
 epoch: 52, train_loss: 0.6925, test_loss: 0.8412, test_f1: 0.5679
 epoch: 53, train_loss: 0.6922, test_loss: 0.8352, test_f1: 0.5803
 epoch: 54, train_loss: 0.6785, test_loss: 0.8428, test_f1: 0.5761
 epoch: 55, train_loss: 0.6794, test_loss: 0.8329, test_f1: 0.5666
 epoch: 56, train_loss: 0.6779, test_loss: 0.8335, test_f1: 0.5663
 epoch: 57, train_loss: 0.6809, test_loss: 0.8554, test_f1: 0.5669
 epoch: 58, train_loss: 0.6708, test_loss: 0.8397, test_f1: 0.5602
 epoch: 59, train_loss: 0.6649, test_loss: 0.8295, test_f1: 0.5794
 epoch: 60, train_loss: 0.6669, test_loss: 0.8316, test_f1: 0.5730
 epoch: 61, train_loss: 0.6672, test_loss: 0.8365, test_f1: 0.5829
 epoch: 62, train_loss: 0.6693, test_loss: 0.8450, test_f1: 0.5843
 epoch: 63, train_loss: 0.6642, test_loss: 0.8387, test_f1: 0.5764
 epoch: 64, train_loss: 0.6576, test_loss: 0.8330, test_f1: 0.5734
 epoch: 65, train_loss: 0.6522, test_loss: 0.8420, test_f1: 0.5625
 epoch: 66, train_loss: 0.6610, test_loss: 0.8524, test_f1: 0.5790
 epoch: 67, train_loss: 0.6492, test_loss: 0.8306, test_f1: 0.5806
 epoch: 68, train_loss: 0.6414, test_loss: 0.8406, test_f1: 0.5754
 epoch: 69, train_loss: 0.6453, test_loss: 0.8655, test_f1: 0.5569
 epoch: 70, train_loss: 0.6390, test_loss: 0.8497, test_f1: 0.5882
 epoch: 71, train_loss: 0.6458, test_loss: 0.8425, test_f1: 0.5753
 epoch: 72, train_loss: 0.6377, test_loss: 0.8482, test_f1: 0.5861
 epoch: 73, train_loss: 0.6307, test_loss: 0.8502, test_f1: 0.5701
 epoch: 74, train_loss: 0.6327, test_loss: 0.8763, test_f1: 0.5859
 epoch: 75, train_loss: 0.6319, test_loss: 0.8673, test_f1: 0.5724
 epoch: 76, train_loss: 0.6219, test_loss: 0.8705, test_f1: 0.5779
 epoch: 77, train_loss: 0.6296, test_loss: 0.8692, test_f1: 0.5619
 epoch: 78, train_loss: 0.6229, test_loss: 0.8701, test_f1: 0.5778
 epoch: 79, train_loss: 0.6230, test_loss: 0.8809, test_f1: 0.5825
 epoch: 80, train_loss: 0.6244, test_loss: 0.8764, test_f1: 0.5848
 epoch: 81, train_loss: 0.6214, test_loss: 0.8763, test_f1: 0.5807
 epoch: 82, train_loss: 0.6190, test_loss: 0.8988, test_f1: 0.5644
 epoch: 83, train_loss: 0.6205, test_loss: 0.8673, test_f1: 0.5841
 epoch: 84, train_loss: 0.6125, test_loss: 0.9138, test_f1: 0.5695
 epoch: 85, train_loss: 0.6117, test_loss: 0.9116, test_f1: 0.5627
 epoch: 86, train_loss: 0.5988, test_loss: 0.8819, test_f1: 0.5838
 epoch: 87, train_loss: 0.6041, test_loss: 0.8963, test_f1: 0.5680
 epoch: 88, train_loss: 0.6042, test_loss: 0.8908, test_f1: 0.5882
 epoch: 89, train_loss: 0.5986, test_loss: 0.8995, test_f1: 0.5766
 epoch: 90, train_loss: 0.6029, test_loss: 0.8960, test_f1: 0.5756
 epoch: 91, train_loss: 0.5919, test_loss: 0.9001, test_f1: 0.5714
 epoch: 92, train_loss: 0.6008, test_loss: 0.9013, test_f1: 0.5828
 epoch: 93, train_loss: 0.5966, test_loss: 0.9012, test_f1: 0.5778
 epoch: 94, train_loss: 0.5867, test_loss: 0.9188, test_f1: 0.5737
 epoch: 95, train_loss: 0.5960, test_loss: 0.9128, test_f1: 0.5770
 epoch: 96, train_loss: 0.5880, test_loss: 0.9206, test_f1: 0.5863
 epoch: 97, train_loss: 0.6037, test_loss: 0.9043, test_f1: 0.5711
 epoch: 98, train_loss: 0.5805, test_loss: 0.9127, test_f1: 0.5732
 epoch: 99, train_loss: 0.5903, test_loss: 0.9161, test_f1: 0.5815
##################ITERATION #3 ****************************************
 epoch: 0, train_loss: 1.2666, test_loss: 1.3302, test_f1: 0.2270
 epoch: 1, train_loss: 1.1643, test_loss: 1.2804, test_f1: 0.2270
 epoch: 2, train_loss: 1.1089, test_loss: 1.1974, test_f1: 0.2461
 epoch: 3, train_loss: 1.0710, test_loss: 1.0917, test_f1: 0.3658
 epoch: 4, train_loss: 1.0405, test_loss: 1.0424, test_f1: 0.4538
 epoch: 5, train_loss: 1.0155, test_loss: 1.0166, test_f1: 0.4699
 epoch: 6, train_loss: 0.9932, test_loss: 0.9983, test_f1: 0.4992
 epoch: 7, train_loss: 0.9768, test_loss: 0.9810, test_f1: 0.5131
 epoch: 8, train_loss: 0.9675, test_loss: 0.9701, test_f1: 0.5179
 epoch: 9, train_loss: 0.9525, test_loss: 0.9557, test_f1: 0.5162
 epoch: 10, train_loss: 0.9417, test_loss: 0.9503, test_f1: 0.5281
 epoch: 11, train_loss: 0.9274, test_loss: 0.9468, test_f1: 0.5264
 epoch: 12, train_loss: 0.9296, test_loss: 0.9508, test_f1: 0.5257
 epoch: 13, train_loss: 0.9122, test_loss: 0.9296, test_f1: 0.5369
 epoch: 14, train_loss: 0.9057, test_loss: 0.9282, test_f1: 0.5294
 epoch: 15, train_loss: 0.8985, test_loss: 0.9327, test_f1: 0.5307
 epoch: 16, train_loss: 0.8920, test_loss: 0.9234, test_f1: 0.5426
 epoch: 17, train_loss: 0.8891, test_loss: 0.9238, test_f1: 0.5248
 epoch: 18, train_loss: 0.8730, test_loss: 0.9233, test_f1: 0.5304
 epoch: 19, train_loss: 0.8627, test_loss: 0.9112, test_f1: 0.5407
 epoch: 20, train_loss: 0.8518, test_loss: 0.8998, test_f1: 0.5380
 epoch: 21, train_loss: 0.8515, test_loss: 0.9056, test_f1: 0.5398
 epoch: 22, train_loss: 0.8481, test_loss: 0.8900, test_f1: 0.5478
 epoch: 23, train_loss: 0.8390, test_loss: 0.9027, test_f1: 0.5452
 epoch: 24, train_loss: 0.8317, test_loss: 0.8776, test_f1: 0.5398
 epoch: 25, train_loss: 0.8180, test_loss: 0.8816, test_f1: 0.5507
 epoch: 26, train_loss: 0.8086, test_loss: 0.8720, test_f1: 0.5448
 epoch: 27, train_loss: 0.8090, test_loss: 0.8838, test_f1: 0.5511
 epoch: 28, train_loss: 0.8038, test_loss: 0.9060, test_f1: 0.5394
 epoch: 29, train_loss: 0.8006, test_loss: 0.8647, test_f1: 0.5625
 epoch: 30, train_loss: 0.8003, test_loss: 0.8564, test_f1: 0.5497
 epoch: 31, train_loss: 0.7822, test_loss: 0.8758, test_f1: 0.5571
 epoch: 32, train_loss: 0.7788, test_loss: 0.8486, test_f1: 0.5635
 epoch: 33, train_loss: 0.7660, test_loss: 0.8740, test_f1: 0.5652
 epoch: 34, train_loss: 0.7598, test_loss: 0.8609, test_f1: 0.5862
 epoch: 35, train_loss: 0.7555, test_loss: 0.8520, test_f1: 0.5601
 epoch: 36, train_loss: 0.7480, test_loss: 0.8745, test_f1: 0.5697
 epoch: 37, train_loss: 0.7430, test_loss: 0.8389, test_f1: 0.5705
 epoch: 38, train_loss: 0.7402, test_loss: 0.8409, test_f1: 0.5752
 epoch: 39, train_loss: 0.7340, test_loss: 0.8348, test_f1: 0.5683
 epoch: 40, train_loss: 0.7290, test_loss: 0.8494, test_f1: 0.5590
 epoch: 41, train_loss: 0.7182, test_loss: 0.8658, test_f1: 0.5562
 epoch: 42, train_loss: 0.7220, test_loss: 0.8824, test_f1: 0.5789
 epoch: 43, train_loss: 0.7150, test_loss: 0.8451, test_f1: 0.5898
 epoch: 44, train_loss: 0.7102, test_loss: 0.8659, test_f1: 0.5868
 epoch: 45, train_loss: 0.7079, test_loss: 0.8328, test_f1: 0.5730
 epoch: 46, train_loss: 0.6895, test_loss: 0.8444, test_f1: 0.5872
 epoch: 47, train_loss: 0.7029, test_loss: 0.8544, test_f1: 0.5797
 epoch: 48, train_loss: 0.6890, test_loss: 0.8722, test_f1: 0.5890
 epoch: 49, train_loss: 0.6906, test_loss: 0.8626, test_f1: 0.5792
 epoch: 50, train_loss: 0.6794, test_loss: 0.8368, test_f1: 0.5881
 epoch: 51, train_loss: 0.6720, test_loss: 0.8274, test_f1: 0.5892
 epoch: 52, train_loss: 0.6609, test_loss: 0.8366, test_f1: 0.5947
 epoch: 53, train_loss: 0.6589, test_loss: 0.8555, test_f1: 0.5982
 epoch: 54, train_loss: 0.6606, test_loss: 0.8441, test_f1: 0.5929
 epoch: 55, train_loss: 0.6492, test_loss: 0.8550, test_f1: 0.5972
 epoch: 56, train_loss: 0.6555, test_loss: 0.8439, test_f1: 0.5960
 epoch: 57, train_loss: 0.6574, test_loss: 0.8481, test_f1: 0.5876
 epoch: 58, train_loss: 0.6507, test_loss: 0.8466, test_f1: 0.5995
 epoch: 59, train_loss: 0.6582, test_loss: 0.8377, test_f1: 0.6054
 epoch: 60, train_loss: 0.6464, test_loss: 0.8350, test_f1: 0.5993
 epoch: 61, train_loss: 0.6457, test_loss: 0.8518, test_f1: 0.5997
 epoch: 62, train_loss: 0.6442, test_loss: 0.8521, test_f1: 0.6053
 epoch: 63, train_loss: 0.6338, test_loss: 0.8389, test_f1: 0.5989
 epoch: 64, train_loss: 0.6384, test_loss: 0.8484, test_f1: 0.6074
 epoch: 65, train_loss: 0.6382, test_loss: 0.8591, test_f1: 0.6067
 epoch: 66, train_loss: 0.6241, test_loss: 0.8663, test_f1: 0.6004
 epoch: 67, train_loss: 0.6360, test_loss: 0.8631, test_f1: 0.5796
 epoch: 68, train_loss: 0.6353, test_loss: 0.8500, test_f1: 0.6009
 epoch: 69, train_loss: 0.6312, test_loss: 0.8648, test_f1: 0.6135
 epoch: 70, train_loss: 0.6202, test_loss: 0.8661, test_f1: 0.5987
 epoch: 71, train_loss: 0.6238, test_loss: 0.8645, test_f1: 0.6143
 epoch: 72, train_loss: 0.6165, test_loss: 0.8741, test_f1: 0.5937
 epoch: 73, train_loss: 0.6171, test_loss: 0.8648, test_f1: 0.6122
 epoch: 74, train_loss: 0.6152, test_loss: 0.8641, test_f1: 0.6096
 epoch: 75, train_loss: 0.6099, test_loss: 0.8629, test_f1: 0.6101
 epoch: 76, train_loss: 0.6044, test_loss: 0.8795, test_f1: 0.6113
 epoch: 77, train_loss: 0.6057, test_loss: 0.8808, test_f1: 0.6107
 epoch: 78, train_loss: 0.6059, test_loss: 0.8674, test_f1: 0.6102
 epoch: 79, train_loss: 0.6038, test_loss: 0.8752, test_f1: 0.6107
 epoch: 80, train_loss: 0.6076, test_loss: 0.8714, test_f1: 0.6258
 epoch: 81, train_loss: 0.6032, test_loss: 0.8736, test_f1: 0.6056
 epoch: 82, train_loss: 0.6074, test_loss: 0.8878, test_f1: 0.6121
 epoch: 83, train_loss: 0.5974, test_loss: 0.8968, test_f1: 0.6017
 epoch: 84, train_loss: 0.5929, test_loss: 0.8645, test_f1: 0.6123
 epoch: 85, train_loss: 0.5963, test_loss: 0.8712, test_f1: 0.6061
 epoch: 86, train_loss: 0.5989, test_loss: 0.8706, test_f1: 0.6078
 epoch: 87, train_loss: 0.5898, test_loss: 0.8771, test_f1: 0.6233
 epoch: 88, train_loss: 0.5978, test_loss: 0.9074, test_f1: 0.6097
 epoch: 89, train_loss: 0.5893, test_loss: 0.8963, test_f1: 0.5951
 epoch: 90, train_loss: 0.5925, test_loss: 0.8784, test_f1: 0.6222
 epoch: 91, train_loss: 0.5770, test_loss: 0.8898, test_f1: 0.6088
 epoch: 92, train_loss: 0.5852, test_loss: 0.8972, test_f1: 0.6209
 epoch: 93, train_loss: 0.6021, test_loss: 0.8852, test_f1: 0.6192
 epoch: 94, train_loss: 0.5804, test_loss: 0.8982, test_f1: 0.6071
 epoch: 95, train_loss: 0.5812, test_loss: 0.8944, test_f1: 0.6225
 epoch: 96, train_loss: 0.5772, test_loss: 0.9039, test_f1: 0.6164
 epoch: 97, train_loss: 0.5765, test_loss: 0.8880, test_f1: 0.6240
 epoch: 98, train_loss: 0.5786, test_loss: 0.8986, test_f1: 0.6194
 epoch: 99, train_loss: 0.5641, test_loss: 0.8926, test_f1: 0.6347
##################ITERATION #4 ****************************************
 epoch: 0, train_loss: 1.2541, test_loss: 1.3253, test_f1: 0.2270
 epoch: 1, train_loss: 1.1285, test_loss: 1.3005, test_f1: 0.2270
 epoch: 2, train_loss: 1.0737, test_loss: 1.2261, test_f1: 0.2570
 epoch: 3, train_loss: 1.0367, test_loss: 1.1102, test_f1: 0.3620
 epoch: 4, train_loss: 1.0068, test_loss: 1.0432, test_f1: 0.4616
 epoch: 5, train_loss: 0.9853, test_loss: 0.9902, test_f1: 0.4902
 epoch: 6, train_loss: 0.9673, test_loss: 0.9602, test_f1: 0.5172
 epoch: 7, train_loss: 0.9556, test_loss: 0.9393, test_f1: 0.5249
 epoch: 8, train_loss: 0.9392, test_loss: 0.9259, test_f1: 0.5350
 epoch: 9, train_loss: 0.9319, test_loss: 0.9136, test_f1: 0.5368
 epoch: 10, train_loss: 0.9225, test_loss: 0.9056, test_f1: 0.5395
 epoch: 11, train_loss: 0.9082, test_loss: 0.9011, test_f1: 0.5392
 epoch: 12, train_loss: 0.8971, test_loss: 0.8911, test_f1: 0.5278
 epoch: 13, train_loss: 0.8896, test_loss: 0.8771, test_f1: 0.5421
 epoch: 14, train_loss: 0.8874, test_loss: 0.8744, test_f1: 0.5494
 epoch: 15, train_loss: 0.8745, test_loss: 0.8680, test_f1: 0.5427
 epoch: 16, train_loss: 0.8705, test_loss: 0.8601, test_f1: 0.5454
 epoch: 17, train_loss: 0.8611, test_loss: 0.8632, test_f1: 0.5567
 epoch: 18, train_loss: 0.8480, test_loss: 0.8514, test_f1: 0.5530
 epoch: 19, train_loss: 0.8406, test_loss: 0.8465, test_f1: 0.5560
 epoch: 20, train_loss: 0.8305, test_loss: 0.8354, test_f1: 0.5476
 epoch: 21, train_loss: 0.8265, test_loss: 0.8466, test_f1: 0.5555
 epoch: 22, train_loss: 0.8148, test_loss: 0.8283, test_f1: 0.5591
 epoch: 23, train_loss: 0.8092, test_loss: 0.8279, test_f1: 0.5652
 epoch: 24, train_loss: 0.7946, test_loss: 0.8153, test_f1: 0.5572
 epoch: 25, train_loss: 0.7870, test_loss: 0.8229, test_f1: 0.5673
 epoch: 26, train_loss: 0.7843, test_loss: 0.8047, test_f1: 0.5629
 epoch: 27, train_loss: 0.7728, test_loss: 0.8120, test_f1: 0.5826
 epoch: 28, train_loss: 0.7746, test_loss: 0.8033, test_f1: 0.5587
 epoch: 29, train_loss: 0.7564, test_loss: 0.8025, test_f1: 0.5574
 epoch: 30, train_loss: 0.7593, test_loss: 0.8244, test_f1: 0.5733
 epoch: 31, train_loss: 0.7531, test_loss: 0.8023, test_f1: 0.5937
 epoch: 32, train_loss: 0.7437, test_loss: 0.7881, test_f1: 0.5908
 epoch: 33, train_loss: 0.7462, test_loss: 0.7966, test_f1: 0.5750
 epoch: 34, train_loss: 0.7282, test_loss: 0.7877, test_f1: 0.5828
 epoch: 35, train_loss: 0.7250, test_loss: 0.8103, test_f1: 0.5762
 epoch: 36, train_loss: 0.7176, test_loss: 0.7814, test_f1: 0.5905
 epoch: 37, train_loss: 0.7167, test_loss: 0.7877, test_f1: 0.5839
 epoch: 38, train_loss: 0.7056, test_loss: 0.7735, test_f1: 0.6037
 epoch: 39, train_loss: 0.7065, test_loss: 0.7964, test_f1: 0.5893
 epoch: 40, train_loss: 0.6980, test_loss: 0.7793, test_f1: 0.6017
 epoch: 41, train_loss: 0.7021, test_loss: 0.7771, test_f1: 0.6237
 epoch: 42, train_loss: 0.6918, test_loss: 0.7908, test_f1: 0.5894
 epoch: 43, train_loss: 0.6970, test_loss: 0.8038, test_f1: 0.5865
 epoch: 44, train_loss: 0.6852, test_loss: 0.7754, test_f1: 0.6056
 epoch: 45, train_loss: 0.6757, test_loss: 0.7751, test_f1: 0.6009
 epoch: 46, train_loss: 0.6656, test_loss: 0.7527, test_f1: 0.6188
 epoch: 47, train_loss: 0.6655, test_loss: 0.7660, test_f1: 0.6054
 epoch: 48, train_loss: 0.6687, test_loss: 0.8085, test_f1: 0.6027
 epoch: 49, train_loss: 0.6590, test_loss: 0.7648, test_f1: 0.6206
 epoch: 50, train_loss: 0.6534, test_loss: 0.7638, test_f1: 0.6142
 epoch: 51, train_loss: 0.6505, test_loss: 0.7706, test_f1: 0.6209
 epoch: 52, train_loss: 0.6418, test_loss: 0.7761, test_f1: 0.6196
 epoch: 53, train_loss: 0.6293, test_loss: 0.7701, test_f1: 0.6252
 epoch: 54, train_loss: 0.6328, test_loss: 0.7696, test_f1: 0.6227
 epoch: 55, train_loss: 0.6385, test_loss: 0.7773, test_f1: 0.6250
 epoch: 56, train_loss: 0.6303, test_loss: 0.7844, test_f1: 0.6087
 epoch: 57, train_loss: 0.6294, test_loss: 0.7703, test_f1: 0.6452
 epoch: 58, train_loss: 0.6093, test_loss: 0.7682, test_f1: 0.6348
 epoch: 59, train_loss: 0.6145, test_loss: 0.7692, test_f1: 0.6382
 epoch: 60, train_loss: 0.6215, test_loss: 0.7832, test_f1: 0.6286
 epoch: 61, train_loss: 0.6116, test_loss: 0.7763, test_f1: 0.6352
 epoch: 62, train_loss: 0.6024, test_loss: 0.7851, test_f1: 0.6310
 epoch: 63, train_loss: 0.6104, test_loss: 0.7704, test_f1: 0.6487
 epoch: 64, train_loss: 0.6098, test_loss: 0.7919, test_f1: 0.6177
 epoch: 65, train_loss: 0.5975, test_loss: 0.7859, test_f1: 0.6506
 epoch: 66, train_loss: 0.6062, test_loss: 0.7808, test_f1: 0.6556
 epoch: 67, train_loss: 0.6031, test_loss: 0.8004, test_f1: 0.6287
 epoch: 68, train_loss: 0.6003, test_loss: 0.7834, test_f1: 0.6567
 epoch: 69, train_loss: 0.5974, test_loss: 0.7790, test_f1: 0.6786
 epoch: 70, train_loss: 0.5861, test_loss: 0.7903, test_f1: 0.6491
 epoch: 71, train_loss: 0.5850, test_loss: 0.7949, test_f1: 0.6530
 epoch: 72, train_loss: 0.5844, test_loss: 0.7917, test_f1: 0.6482
 epoch: 73, train_loss: 0.5919, test_loss: 0.7830, test_f1: 0.6556
 epoch: 74, train_loss: 0.5775, test_loss: 0.7880, test_f1: 0.6686
 epoch: 75, train_loss: 0.5814, test_loss: 0.8035, test_f1: 0.6557
 epoch: 76, train_loss: 0.5898, test_loss: 0.7835, test_f1: 0.6707
 epoch: 77, train_loss: 0.5857, test_loss: 0.8039, test_f1: 0.6606
 epoch: 78, train_loss: 0.5779, test_loss: 0.7994, test_f1: 0.6580
 epoch: 79, train_loss: 0.5838, test_loss: 0.7957, test_f1: 0.6554
 epoch: 80, train_loss: 0.5701, test_loss: 0.8252, test_f1: 0.6355
 epoch: 81, train_loss: 0.5707, test_loss: 0.7914, test_f1: 0.6562
 epoch: 82, train_loss: 0.5754, test_loss: 0.7988, test_f1: 0.6719
 epoch: 83, train_loss: 0.5612, test_loss: 0.8126, test_f1: 0.6400
 epoch: 84, train_loss: 0.5688, test_loss: 0.8054, test_f1: 0.6507
 epoch: 85, train_loss: 0.5660, test_loss: 0.8154, test_f1: 0.6453
 epoch: 86, train_loss: 0.5684, test_loss: 0.8106, test_f1: 0.6594
 epoch: 87, train_loss: 0.5591, test_loss: 0.8037, test_f1: 0.6542
 epoch: 88, train_loss: 0.5483, test_loss: 0.8165, test_f1: 0.6530
 epoch: 89, train_loss: 0.5507, test_loss: 0.8265, test_f1: 0.6524
 epoch: 90, train_loss: 0.5429, test_loss: 0.8205, test_f1: 0.6537
 epoch: 91, train_loss: 0.5507, test_loss: 0.8225, test_f1: 0.6577
 epoch: 92, train_loss: 0.5471, test_loss: 0.8355, test_f1: 0.6577
 epoch: 93, train_loss: 0.5467, test_loss: 0.8399, test_f1: 0.6470
 epoch: 94, train_loss: 0.5438, test_loss: 0.8356, test_f1: 0.6536
 epoch: 95, train_loss: 0.5403, test_loss: 0.8360, test_f1: 0.6523
 epoch: 96, train_loss: 0.5439, test_loss: 0.8454, test_f1: 0.6521
 epoch: 97, train_loss: 0.5443, test_loss: 0.8536, test_f1: 0.6331
 epoch: 98, train_loss: 0.5310, test_loss: 0.8479, test_f1: 0.6706
 epoch: 99, train_loss: 0.5381, test_loss: 0.8500, test_f1: 0.6531
##################ITERATION #5 ****************************************
 epoch: 0, train_loss: 1.2102, test_loss: 1.3095, test_f1: 0.2270
 epoch: 1, train_loss: 1.0859, test_loss: 1.2766, test_f1: 0.2396
 epoch: 2, train_loss: 1.0460, test_loss: 1.1924, test_f1: 0.3190
 epoch: 3, train_loss: 1.0202, test_loss: 1.0666, test_f1: 0.4849
 epoch: 4, train_loss: 0.9962, test_loss: 0.9978, test_f1: 0.4932
 epoch: 5, train_loss: 0.9839, test_loss: 0.9759, test_f1: 0.5227
 epoch: 6, train_loss: 0.9635, test_loss: 0.9647, test_f1: 0.5357
 epoch: 7, train_loss: 0.9562, test_loss: 0.9507, test_f1: 0.5404
 epoch: 8, train_loss: 0.9419, test_loss: 0.9423, test_f1: 0.5381
 epoch: 9, train_loss: 0.9296, test_loss: 0.9335, test_f1: 0.5235
 epoch: 10, train_loss: 0.9147, test_loss: 0.9276, test_f1: 0.5350
 epoch: 11, train_loss: 0.9068, test_loss: 0.9243, test_f1: 0.5398
 epoch: 12, train_loss: 0.8967, test_loss: 0.9118, test_f1: 0.5440
 epoch: 13, train_loss: 0.8896, test_loss: 0.9054, test_f1: 0.5395
 epoch: 14, train_loss: 0.8816, test_loss: 0.9064, test_f1: 0.5526
 epoch: 15, train_loss: 0.8709, test_loss: 0.8904, test_f1: 0.5625
 epoch: 16, train_loss: 0.8570, test_loss: 0.8834, test_f1: 0.5601
 epoch: 17, train_loss: 0.8566, test_loss: 0.8860, test_f1: 0.5517
 epoch: 18, train_loss: 0.8537, test_loss: 0.8889, test_f1: 0.5550
 epoch: 19, train_loss: 0.8346, test_loss: 0.8761, test_f1: 0.5646
 epoch: 20, train_loss: 0.8409, test_loss: 0.8847, test_f1: 0.5513
 epoch: 21, train_loss: 0.8303, test_loss: 0.8692, test_f1: 0.5663
 epoch: 22, train_loss: 0.8195, test_loss: 0.8653, test_f1: 0.5578
 epoch: 23, train_loss: 0.8105, test_loss: 0.8517, test_f1: 0.5730
 epoch: 24, train_loss: 0.7961, test_loss: 0.8613, test_f1: 0.5642
 epoch: 25, train_loss: 0.7954, test_loss: 0.8646, test_f1: 0.5623
 epoch: 26, train_loss: 0.7810, test_loss: 0.8439, test_f1: 0.5716
 epoch: 27, train_loss: 0.7770, test_loss: 0.8474, test_f1: 0.5681
 epoch: 28, train_loss: 0.7820, test_loss: 0.8588, test_f1: 0.5668
 epoch: 29, train_loss: 0.7707, test_loss: 0.8351, test_f1: 0.5742
 epoch: 30, train_loss: 0.7498, test_loss: 0.8459, test_f1: 0.5744
 epoch: 31, train_loss: 0.7540, test_loss: 0.8726, test_f1: 0.5671
 epoch: 32, train_loss: 0.7522, test_loss: 0.8473, test_f1: 0.5801
 epoch: 33, train_loss: 0.7406, test_loss: 0.8453, test_f1: 0.5873
 epoch: 34, train_loss: 0.7398, test_loss: 0.8386, test_f1: 0.5864
 epoch: 35, train_loss: 0.7303, test_loss: 0.8354, test_f1: 0.5914
 epoch: 36, train_loss: 0.7217, test_loss: 0.8491, test_f1: 0.5877
 epoch: 37, train_loss: 0.7174, test_loss: 0.8636, test_f1: 0.5915
 epoch: 38, train_loss: 0.7129, test_loss: 0.8389, test_f1: 0.6065
 epoch: 39, train_loss: 0.7084, test_loss: 0.8760, test_f1: 0.5789
 epoch: 40, train_loss: 0.7062, test_loss: 0.8440, test_f1: 0.6129
 epoch: 41, train_loss: 0.6961, test_loss: 0.8404, test_f1: 0.6371
 epoch: 42, train_loss: 0.6847, test_loss: 0.8355, test_f1: 0.5982
 epoch: 43, train_loss: 0.6823, test_loss: 0.8616, test_f1: 0.6194
 epoch: 44, train_loss: 0.6783, test_loss: 0.8574, test_f1: 0.6148
 epoch: 45, train_loss: 0.6740, test_loss: 0.8509, test_f1: 0.6010
 epoch: 46, train_loss: 0.6596, test_loss: 0.8714, test_f1: 0.6352
 epoch: 47, train_loss: 0.6588, test_loss: 0.8674, test_f1: 0.6097
 epoch: 48, train_loss: 0.6659, test_loss: 0.8304, test_f1: 0.6121
 epoch: 49, train_loss: 0.6699, test_loss: 0.8592, test_f1: 0.6154
 epoch: 50, train_loss: 0.6470, test_loss: 0.8619, test_f1: 0.6183
 epoch: 51, train_loss: 0.6517, test_loss: 0.8718, test_f1: 0.6425
 epoch: 52, train_loss: 0.6301, test_loss: 0.8647, test_f1: 0.6278
 epoch: 53, train_loss: 0.6360, test_loss: 0.8662, test_f1: 0.6294
 epoch: 54, train_loss: 0.6341, test_loss: 0.8725, test_f1: 0.6282
 epoch: 55, train_loss: 0.6214, test_loss: 0.8711, test_f1: 0.6412
 epoch: 56, train_loss: 0.6174, test_loss: 0.8741, test_f1: 0.6252
 epoch: 57, train_loss: 0.6223, test_loss: 0.8869, test_f1: 0.6186
 epoch: 58, train_loss: 0.6124, test_loss: 0.8766, test_f1: 0.6305
 epoch: 59, train_loss: 0.6039, test_loss: 0.8673, test_f1: 0.6330
 epoch: 60, train_loss: 0.6179, test_loss: 0.8719, test_f1: 0.6395
 epoch: 61, train_loss: 0.6091, test_loss: 0.8844, test_f1: 0.6331
 epoch: 62, train_loss: 0.6042, test_loss: 0.8715, test_f1: 0.6478
 epoch: 63, train_loss: 0.6100, test_loss: 0.8875, test_f1: 0.6360
 epoch: 64, train_loss: 0.6010, test_loss: 0.8797, test_f1: 0.6365
 epoch: 65, train_loss: 0.5927, test_loss: 0.9052, test_f1: 0.6258
 epoch: 66, train_loss: 0.5995, test_loss: 0.8993, test_f1: 0.6372
 epoch: 67, train_loss: 0.5966, test_loss: 0.9052, test_f1: 0.6318
 epoch: 68, train_loss: 0.6006, test_loss: 0.8898, test_f1: 0.6259
 epoch: 69, train_loss: 0.5827, test_loss: 0.9120, test_f1: 0.6368
 epoch: 70, train_loss: 0.5896, test_loss: 0.9244, test_f1: 0.6116
 epoch: 71, train_loss: 0.5873, test_loss: 0.9117, test_f1: 0.6135
 epoch: 72, train_loss: 0.5844, test_loss: 0.9223, test_f1: 0.6471
 epoch: 73, train_loss: 0.5801, test_loss: 0.9220, test_f1: 0.6252
 epoch: 74, train_loss: 0.5752, test_loss: 0.9219, test_f1: 0.6387
 epoch: 75, train_loss: 0.5701, test_loss: 0.9248, test_f1: 0.6304
 epoch: 76, train_loss: 0.5793, test_loss: 0.9260, test_f1: 0.6411
 epoch: 77, train_loss: 0.5703, test_loss: 0.9178, test_f1: 0.6292
 epoch: 78, train_loss: 0.5691, test_loss: 0.9319, test_f1: 0.6307
 epoch: 79, train_loss: 0.5677, test_loss: 0.9231, test_f1: 0.6339
 epoch: 80, train_loss: 0.5605, test_loss: 0.9273, test_f1: 0.6214
 epoch: 81, train_loss: 0.5600, test_loss: 0.9332, test_f1: 0.6395
 epoch: 82, train_loss: 0.5686, test_loss: 0.9462, test_f1: 0.6449
 epoch: 83, train_loss: 0.5572, test_loss: 0.9109, test_f1: 0.6327
 epoch: 84, train_loss: 0.5551, test_loss: 0.9318, test_f1: 0.6337
 epoch: 85, train_loss: 0.5535, test_loss: 0.9424, test_f1: 0.6245
 epoch: 86, train_loss: 0.5605, test_loss: 0.9748, test_f1: 0.6195
 epoch: 87, train_loss: 0.5613, test_loss: 0.9468, test_f1: 0.6462
 epoch: 88, train_loss: 0.5482, test_loss: 0.9776, test_f1: 0.6161
 epoch: 89, train_loss: 0.5505, test_loss: 0.9636, test_f1: 0.6316
 epoch: 90, train_loss: 0.5443, test_loss: 0.9676, test_f1: 0.6353
 epoch: 91, train_loss: 0.5343, test_loss: 0.9708, test_f1: 0.6325
 epoch: 92, train_loss: 0.5358, test_loss: 0.9697, test_f1: 0.6302
 epoch: 93, train_loss: 0.5410, test_loss: 1.0020, test_f1: 0.6405
 epoch: 94, train_loss: 0.5338, test_loss: 1.0140, test_f1: 0.6169
 epoch: 95, train_loss: 0.5366, test_loss: 0.9930, test_f1: 0.6522
 epoch: 96, train_loss: 0.5384, test_loss: 0.9693, test_f1: 0.6453
 epoch: 97, train_loss: 0.5261, test_loss: 0.9896, test_f1: 0.6167
 epoch: 98, train_loss: 0.5300, test_loss: 1.0165, test_f1: 0.6400
 epoch: 99, train_loss: 0.5277, test_loss: 0.9832, test_f1: 0.6360
##################ITERATION #6 ****************************************
 epoch: 0, train_loss: 1.2636, test_loss: 1.3223, test_f1: 0.2270
 epoch: 1, train_loss: 1.1083, test_loss: 1.3365, test_f1: 0.2270
 epoch: 2, train_loss: 1.0539, test_loss: 1.3183, test_f1: 0.2270
 epoch: 3, train_loss: 1.0260, test_loss: 1.1919, test_f1: 0.2378
 epoch: 4, train_loss: 0.9990, test_loss: 1.0663, test_f1: 0.4170
 epoch: 5, train_loss: 0.9846, test_loss: 0.9918, test_f1: 0.4870
 epoch: 6, train_loss: 0.9665, test_loss: 0.9687, test_f1: 0.5081
 epoch: 7, train_loss: 0.9663, test_loss: 0.9571, test_f1: 0.5117
 epoch: 8, train_loss: 0.9471, test_loss: 0.9506, test_f1: 0.5195
 epoch: 9, train_loss: 0.9380, test_loss: 0.9438, test_f1: 0.5228
 epoch: 10, train_loss: 0.9346, test_loss: 0.9342, test_f1: 0.5272
 epoch: 11, train_loss: 0.9160, test_loss: 0.9223, test_f1: 0.5211
 epoch: 12, train_loss: 0.9058, test_loss: 0.9099, test_f1: 0.5257
 epoch: 13, train_loss: 0.8990, test_loss: 0.9065, test_f1: 0.5297
 epoch: 14, train_loss: 0.8947, test_loss: 0.8978, test_f1: 0.5317
 epoch: 15, train_loss: 0.8781, test_loss: 0.8859, test_f1: 0.5317
 epoch: 16, train_loss: 0.8710, test_loss: 0.8907, test_f1: 0.5514
 epoch: 17, train_loss: 0.8652, test_loss: 0.8805, test_f1: 0.5508
 epoch: 18, train_loss: 0.8526, test_loss: 0.8758, test_f1: 0.5541
 epoch: 19, train_loss: 0.8505, test_loss: 0.8730, test_f1: 0.5515
 epoch: 20, train_loss: 0.8403, test_loss: 0.8628, test_f1: 0.5552
 epoch: 21, train_loss: 0.8350, test_loss: 0.8532, test_f1: 0.5591
 epoch: 22, train_loss: 0.8244, test_loss: 0.8650, test_f1: 0.5564
 epoch: 23, train_loss: 0.8171, test_loss: 0.8525, test_f1: 0.5591
 epoch: 24, train_loss: 0.8119, test_loss: 0.8561, test_f1: 0.5699
 epoch: 25, train_loss: 0.8020, test_loss: 0.8369, test_f1: 0.5756
 epoch: 26, train_loss: 0.7965, test_loss: 0.8355, test_f1: 0.5711
 epoch: 27, train_loss: 0.7917, test_loss: 0.8214, test_f1: 0.5692
 epoch: 28, train_loss: 0.7819, test_loss: 0.8194, test_f1: 0.5577
 epoch: 29, train_loss: 0.7778, test_loss: 0.8196, test_f1: 0.5841
 epoch: 30, train_loss: 0.7732, test_loss: 0.8176, test_f1: 0.5797
 epoch: 31, train_loss: 0.7655, test_loss: 0.8259, test_f1: 0.5879
 epoch: 32, train_loss: 0.7623, test_loss: 0.8115, test_f1: 0.5747
 epoch: 33, train_loss: 0.7545, test_loss: 0.8148, test_f1: 0.5875
 epoch: 34, train_loss: 0.7456, test_loss: 0.8027, test_f1: 0.5904
 epoch: 35, train_loss: 0.7451, test_loss: 0.8050, test_f1: 0.5957
 epoch: 36, train_loss: 0.7401, test_loss: 0.8052, test_f1: 0.5834
 epoch: 37, train_loss: 0.7323, test_loss: 0.8193, test_f1: 0.5849
 epoch: 38, train_loss: 0.7297, test_loss: 0.8248, test_f1: 0.5800
 epoch: 39, train_loss: 0.7266, test_loss: 0.8144, test_f1: 0.6078
 epoch: 40, train_loss: 0.7222, test_loss: 0.8108, test_f1: 0.6066
 epoch: 41, train_loss: 0.7177, test_loss: 0.8282, test_f1: 0.6049
 epoch: 42, train_loss: 0.7171, test_loss: 0.8092, test_f1: 0.6080
 epoch: 43, train_loss: 0.7062, test_loss: 0.8114, test_f1: 0.5958
 epoch: 44, train_loss: 0.6967, test_loss: 0.8157, test_f1: 0.5877
 epoch: 45, train_loss: 0.6987, test_loss: 0.8343, test_f1: 0.5896
 epoch: 46, train_loss: 0.6872, test_loss: 0.8038, test_f1: 0.5838
 epoch: 47, train_loss: 0.6883, test_loss: 0.8171, test_f1: 0.5959
 epoch: 48, train_loss: 0.6758, test_loss: 0.8246, test_f1: 0.6106
 epoch: 49, train_loss: 0.6867, test_loss: 0.8152, test_f1: 0.6094
 epoch: 50, train_loss: 0.6665, test_loss: 0.8397, test_f1: 0.5853
 epoch: 51, train_loss: 0.6614, test_loss: 0.8328, test_f1: 0.6157
 epoch: 52, train_loss: 0.6560, test_loss: 0.8121, test_f1: 0.6151
 epoch: 53, train_loss: 0.6537, test_loss: 0.8050, test_f1: 0.6025
 epoch: 54, train_loss: 0.6611, test_loss: 0.8145, test_f1: 0.6130
 epoch: 55, train_loss: 0.6505, test_loss: 0.7949, test_f1: 0.6118
 epoch: 56, train_loss: 0.6427, test_loss: 0.8167, test_f1: 0.5994
 epoch: 57, train_loss: 0.6391, test_loss: 0.8268, test_f1: 0.6092
 epoch: 58, train_loss: 0.6414, test_loss: 0.8009, test_f1: 0.6160
 epoch: 59, train_loss: 0.6440, test_loss: 0.8136, test_f1: 0.5942
 epoch: 60, train_loss: 0.6391, test_loss: 0.8283, test_f1: 0.6043
 epoch: 61, train_loss: 0.6340, test_loss: 0.8331, test_f1: 0.6066
 epoch: 62, train_loss: 0.6380, test_loss: 0.8521, test_f1: 0.6089
 epoch: 63, train_loss: 0.6329, test_loss: 0.8300, test_f1: 0.6159
 epoch: 64, train_loss: 0.6217, test_loss: 0.8138, test_f1: 0.6094
 epoch: 65, train_loss: 0.6215, test_loss: 0.8336, test_f1: 0.6018
 epoch: 66, train_loss: 0.6274, test_loss: 0.8469, test_f1: 0.6098
 epoch: 67, train_loss: 0.6229, test_loss: 0.8280, test_f1: 0.6087
 epoch: 68, train_loss: 0.6146, test_loss: 0.8363, test_f1: 0.6069
 epoch: 69, train_loss: 0.6130, test_loss: 0.8436, test_f1: 0.5931
 epoch: 70, train_loss: 0.6197, test_loss: 0.8404, test_f1: 0.6126
 epoch: 71, train_loss: 0.6154, test_loss: 0.8326, test_f1: 0.6258
 epoch: 72, train_loss: 0.6151, test_loss: 0.8620, test_f1: 0.5987
 epoch: 73, train_loss: 0.6083, test_loss: 0.8441, test_f1: 0.6022
 epoch: 74, train_loss: 0.6092, test_loss: 0.8283, test_f1: 0.6164
 epoch: 75, train_loss: 0.6076, test_loss: 0.8433, test_f1: 0.6049
 epoch: 76, train_loss: 0.6039, test_loss: 0.8489, test_f1: 0.6075
 epoch: 77, train_loss: 0.6048, test_loss: 0.8631, test_f1: 0.6130
 epoch: 78, train_loss: 0.5905, test_loss: 0.8603, test_f1: 0.6137
 epoch: 79, train_loss: 0.5986, test_loss: 0.8703, test_f1: 0.6063
 epoch: 80, train_loss: 0.5946, test_loss: 0.8763, test_f1: 0.6211
 epoch: 81, train_loss: 0.6005, test_loss: 0.8628, test_f1: 0.6156
 epoch: 82, train_loss: 0.5929, test_loss: 0.8448, test_f1: 0.6181
 epoch: 83, train_loss: 0.5877, test_loss: 0.8620, test_f1: 0.5966
 epoch: 84, train_loss: 0.5830, test_loss: 0.8575, test_f1: 0.6185
 epoch: 85, train_loss: 0.5887, test_loss: 0.8529, test_f1: 0.6096
 epoch: 86, train_loss: 0.5817, test_loss: 0.8785, test_f1: 0.6131
 epoch: 87, train_loss: 0.5839, test_loss: 0.8806, test_f1: 0.6096
 epoch: 88, train_loss: 0.5865, test_loss: 0.8726, test_f1: 0.6105
 epoch: 89, train_loss: 0.5711, test_loss: 0.8694, test_f1: 0.6227
 epoch: 90, train_loss: 0.5700, test_loss: 0.8692, test_f1: 0.6233
 epoch: 91, train_loss: 0.5728, test_loss: 0.8777, test_f1: 0.6243
 epoch: 92, train_loss: 0.5633, test_loss: 0.8618, test_f1: 0.6218
 epoch: 93, train_loss: 0.5645, test_loss: 0.8644, test_f1: 0.6095
 epoch: 94, train_loss: 0.5743, test_loss: 0.8812, test_f1: 0.6225
 epoch: 95, train_loss: 0.5653, test_loss: 0.8713, test_f1: 0.6346
 epoch: 96, train_loss: 0.5582, test_loss: 0.8780, test_f1: 0.6259
 epoch: 97, train_loss: 0.5578, test_loss: 0.8982, test_f1: 0.6220
 epoch: 98, train_loss: 0.5641, test_loss: 0.8766, test_f1: 0.6297
 epoch: 99, train_loss: 0.5583, test_loss: 0.9383, test_f1: 0.6172
##################ITERATION #7 ****************************************
 epoch: 0, train_loss: 1.2139, test_loss: 1.3068, test_f1: 0.2270
 epoch: 1, train_loss: 1.0617, test_loss: 1.2802, test_f1: 0.2303
 epoch: 2, train_loss: 1.0317, test_loss: 1.2486, test_f1: 0.3252
 epoch: 3, train_loss: 0.9990, test_loss: 1.0857, test_f1: 0.4747
 epoch: 4, train_loss: 0.9952, test_loss: 1.0162, test_f1: 0.4721
 epoch: 5, train_loss: 0.9673, test_loss: 0.9920, test_f1: 0.4940
 epoch: 6, train_loss: 0.9541, test_loss: 0.9728, test_f1: 0.5121
 epoch: 7, train_loss: 0.9404, test_loss: 0.9395, test_f1: 0.5140
 epoch: 8, train_loss: 0.9305, test_loss: 0.9336, test_f1: 0.5454
 epoch: 9, train_loss: 0.9173, test_loss: 0.9152, test_f1: 0.5498
 epoch: 10, train_loss: 0.9104, test_loss: 0.9179, test_f1: 0.5476
 epoch: 11, train_loss: 0.9069, test_loss: 0.9208, test_f1: 0.5274
 epoch: 12, train_loss: 0.8950, test_loss: 0.8922, test_f1: 0.5508
 epoch: 13, train_loss: 0.8885, test_loss: 0.9070, test_f1: 0.5563
 epoch: 14, train_loss: 0.8724, test_loss: 0.8973, test_f1: 0.5528
 epoch: 15, train_loss: 0.8674, test_loss: 0.8774, test_f1: 0.5617
 epoch: 16, train_loss: 0.8521, test_loss: 0.8918, test_f1: 0.5515
 epoch: 17, train_loss: 0.8398, test_loss: 0.8930, test_f1: 0.5448
 epoch: 18, train_loss: 0.8450, test_loss: 0.8820, test_f1: 0.5510
 epoch: 19, train_loss: 0.8375, test_loss: 0.8882, test_f1: 0.5410
 epoch: 20, train_loss: 0.8242, test_loss: 0.9031, test_f1: 0.5388
 epoch: 21, train_loss: 0.8162, test_loss: 0.8675, test_f1: 0.5466
 epoch: 22, train_loss: 0.8176, test_loss: 0.8777, test_f1: 0.5416
 epoch: 23, train_loss: 0.8071, test_loss: 0.8713, test_f1: 0.5434
 epoch: 24, train_loss: 0.8048, test_loss: 0.8821, test_f1: 0.5463
 epoch: 25, train_loss: 0.7875, test_loss: 0.8631, test_f1: 0.5470
 epoch: 26, train_loss: 0.7825, test_loss: 0.8789, test_f1: 0.5397
 epoch: 27, train_loss: 0.7840, test_loss: 0.8768, test_f1: 0.5462
 epoch: 28, train_loss: 0.7702, test_loss: 0.8660, test_f1: 0.5560
 epoch: 29, train_loss: 0.7694, test_loss: 0.8832, test_f1: 0.5583
 epoch: 30, train_loss: 0.7764, test_loss: 0.8806, test_f1: 0.5627
 epoch: 31, train_loss: 0.7586, test_loss: 0.8612, test_f1: 0.5655
 epoch: 32, train_loss: 0.7644, test_loss: 0.8533, test_f1: 0.5715
 epoch: 33, train_loss: 0.7460, test_loss: 0.8558, test_f1: 0.5677
 epoch: 34, train_loss: 0.7414, test_loss: 0.8835, test_f1: 0.5657
 epoch: 35, train_loss: 0.7428, test_loss: 0.8393, test_f1: 0.5540
 epoch: 36, train_loss: 0.7316, test_loss: 0.8675, test_f1: 0.5808
 epoch: 37, train_loss: 0.7248, test_loss: 0.8371, test_f1: 0.5536
 epoch: 38, train_loss: 0.7246, test_loss: 0.8462, test_f1: 0.5783
 epoch: 39, train_loss: 0.7178, test_loss: 0.8266, test_f1: 0.5547
 epoch: 40, train_loss: 0.7136, test_loss: 0.8504, test_f1: 0.5762
 epoch: 41, train_loss: 0.7043, test_loss: 0.8423, test_f1: 0.5827
 epoch: 42, train_loss: 0.6966, test_loss: 0.8713, test_f1: 0.5596
 epoch: 43, train_loss: 0.6846, test_loss: 0.8541, test_f1: 0.5604
 epoch: 44, train_loss: 0.6907, test_loss: 0.8490, test_f1: 0.5581
 epoch: 45, train_loss: 0.6852, test_loss: 0.8821, test_f1: 0.5591
 epoch: 46, train_loss: 0.6818, test_loss: 0.8766, test_f1: 0.5684
 epoch: 47, train_loss: 0.6755, test_loss: 0.8324, test_f1: 0.5773
 epoch: 48, train_loss: 0.6715, test_loss: 0.8462, test_f1: 0.5887
 epoch: 49, train_loss: 0.6691, test_loss: 0.8546, test_f1: 0.5723
 epoch: 50, train_loss: 0.6686, test_loss: 0.8698, test_f1: 0.5700
 epoch: 51, train_loss: 0.6574, test_loss: 0.8725, test_f1: 0.5832
 epoch: 52, train_loss: 0.6531, test_loss: 0.8484, test_f1: 0.5797
 epoch: 53, train_loss: 0.6478, test_loss: 0.8578, test_f1: 0.5817
 epoch: 54, train_loss: 0.6453, test_loss: 0.8559, test_f1: 0.5782
 epoch: 55, train_loss: 0.6453, test_loss: 0.8516, test_f1: 0.5732
 epoch: 56, train_loss: 0.6471, test_loss: 0.8520, test_f1: 0.5804
 epoch: 57, train_loss: 0.6402, test_loss: 0.8566, test_f1: 0.5817
 epoch: 58, train_loss: 0.6347, test_loss: 0.8798, test_f1: 0.5830
 epoch: 59, train_loss: 0.6368, test_loss: 0.8781, test_f1: 0.5860
 epoch: 60, train_loss: 0.6399, test_loss: 0.8251, test_f1: 0.5801
 epoch: 61, train_loss: 0.6342, test_loss: 0.8606, test_f1: 0.5815
 epoch: 62, train_loss: 0.6271, test_loss: 0.8902, test_f1: 0.5793
 epoch: 63, train_loss: 0.6292, test_loss: 0.8643, test_f1: 0.5829
 epoch: 64, train_loss: 0.6255, test_loss: 0.8554, test_f1: 0.5905
 epoch: 65, train_loss: 0.6173, test_loss: 0.8867, test_f1: 0.5927
 epoch: 66, train_loss: 0.6199, test_loss: 0.8570, test_f1: 0.5957
 epoch: 67, train_loss: 0.6134, test_loss: 0.8496, test_f1: 0.5921
 epoch: 68, train_loss: 0.6185, test_loss: 0.8991, test_f1: 0.5839
 epoch: 69, train_loss: 0.6077, test_loss: 0.9069, test_f1: 0.6052
 epoch: 70, train_loss: 0.6015, test_loss: 0.8832, test_f1: 0.5906
 epoch: 71, train_loss: 0.5933, test_loss: 0.8966, test_f1: 0.5900
 epoch: 72, train_loss: 0.6077, test_loss: 0.8635, test_f1: 0.6084
 epoch: 73, train_loss: 0.6051, test_loss: 0.8889, test_f1: 0.5915
 epoch: 74, train_loss: 0.5946, test_loss: 0.8833, test_f1: 0.5959
 epoch: 75, train_loss: 0.6055, test_loss: 0.8784, test_f1: 0.5989
 epoch: 76, train_loss: 0.6004, test_loss: 0.8767, test_f1: 0.5780
 epoch: 77, train_loss: 0.5936, test_loss: 0.8943, test_f1: 0.6038
 epoch: 78, train_loss: 0.5874, test_loss: 0.9112, test_f1: 0.5950
 epoch: 79, train_loss: 0.5897, test_loss: 0.9004, test_f1: 0.5839
 epoch: 80, train_loss: 0.5899, test_loss: 0.9058, test_f1: 0.6157
 epoch: 81, train_loss: 0.5864, test_loss: 0.8950, test_f1: 0.6174
 epoch: 82, train_loss: 0.5814, test_loss: 0.8657, test_f1: 0.6177
 epoch: 83, train_loss: 0.5742, test_loss: 0.9229, test_f1: 0.6163
 epoch: 84, train_loss: 0.5895, test_loss: 0.9090, test_f1: 0.6050
 epoch: 85, train_loss: 0.5749, test_loss: 0.8846, test_f1: 0.6086
 epoch: 86, train_loss: 0.5715, test_loss: 0.8653, test_f1: 0.6248
 epoch: 87, train_loss: 0.5815, test_loss: 0.8901, test_f1: 0.6264
 epoch: 88, train_loss: 0.5649, test_loss: 0.8874, test_f1: 0.6186
 epoch: 89, train_loss: 0.5657, test_loss: 0.9151, test_f1: 0.6129
 epoch: 90, train_loss: 0.5669, test_loss: 0.9117, test_f1: 0.6152
 epoch: 91, train_loss: 0.5714, test_loss: 0.9176, test_f1: 0.6079
 epoch: 92, train_loss: 0.5662, test_loss: 0.9096, test_f1: 0.6339
 epoch: 93, train_loss: 0.5631, test_loss: 0.8785, test_f1: 0.6444
 epoch: 94, train_loss: 0.5682, test_loss: 0.8751, test_f1: 0.6272
 epoch: 95, train_loss: 0.5559, test_loss: 0.9023, test_f1: 0.6361
 epoch: 96, train_loss: 0.5609, test_loss: 0.9001, test_f1: 0.6427
 epoch: 97, train_loss: 0.5636, test_loss: 0.8748, test_f1: 0.6398
 epoch: 98, train_loss: 0.5478, test_loss: 0.9022, test_f1: 0.6464
 epoch: 99, train_loss: 0.5473, test_loss: 0.9302, test_f1: 0.6083
##################ITERATION #8 ****************************************
 epoch: 0, train_loss: 1.2520, test_loss: 1.2971, test_f1: 0.2270
 epoch: 1, train_loss: 1.0904, test_loss: 1.2675, test_f1: 0.2270
 epoch: 2, train_loss: 1.0383, test_loss: 1.2116, test_f1: 0.2270
 epoch: 3, train_loss: 1.0163, test_loss: 1.1384, test_f1: 0.3058
 epoch: 4, train_loss: 0.9900, test_loss: 1.0284, test_f1: 0.4448
 epoch: 5, train_loss: 0.9774, test_loss: 0.9799, test_f1: 0.4968
 epoch: 6, train_loss: 0.9560, test_loss: 0.9649, test_f1: 0.5188
 epoch: 7, train_loss: 0.9391, test_loss: 0.9561, test_f1: 0.5154
 epoch: 8, train_loss: 0.9427, test_loss: 0.9490, test_f1: 0.5150
 epoch: 9, train_loss: 0.9216, test_loss: 0.9515, test_f1: 0.5109
 epoch: 10, train_loss: 0.9066, test_loss: 0.9308, test_f1: 0.5228
 epoch: 11, train_loss: 0.9012, test_loss: 0.9245, test_f1: 0.5155
 epoch: 12, train_loss: 0.9020, test_loss: 0.9267, test_f1: 0.5272
 epoch: 13, train_loss: 0.8899, test_loss: 0.9161, test_f1: 0.5291
 epoch: 14, train_loss: 0.8729, test_loss: 0.9178, test_f1: 0.5262
 epoch: 15, train_loss: 0.8666, test_loss: 0.9054, test_f1: 0.5292
 epoch: 16, train_loss: 0.8610, test_loss: 0.8930, test_f1: 0.5347
 epoch: 17, train_loss: 0.8527, test_loss: 0.8824, test_f1: 0.5253
 epoch: 18, train_loss: 0.8506, test_loss: 0.8756, test_f1: 0.5502
 epoch: 19, train_loss: 0.8342, test_loss: 0.8751, test_f1: 0.5378
 epoch: 20, train_loss: 0.8246, test_loss: 0.8695, test_f1: 0.5412
 epoch: 21, train_loss: 0.8183, test_loss: 0.8704, test_f1: 0.5554
 epoch: 22, train_loss: 0.8161, test_loss: 0.8580, test_f1: 0.5451
 epoch: 23, train_loss: 0.8102, test_loss: 0.8601, test_f1: 0.5466
 epoch: 24, train_loss: 0.7963, test_loss: 0.8560, test_f1: 0.5551
 epoch: 25, train_loss: 0.7849, test_loss: 0.8493, test_f1: 0.5548
 epoch: 26, train_loss: 0.7773, test_loss: 0.8533, test_f1: 0.5376
 epoch: 27, train_loss: 0.7760, test_loss: 0.8629, test_f1: 0.5210
 epoch: 28, train_loss: 0.7746, test_loss: 0.8342, test_f1: 0.5539
 epoch: 29, train_loss: 0.7707, test_loss: 0.8503, test_f1: 0.5668
 epoch: 30, train_loss: 0.7546, test_loss: 0.8528, test_f1: 0.5479
 epoch: 31, train_loss: 0.7630, test_loss: 0.8352, test_f1: 0.5806
 epoch: 32, train_loss: 0.7433, test_loss: 0.8330, test_f1: 0.5769
 epoch: 33, train_loss: 0.7491, test_loss: 0.8271, test_f1: 0.5780
 epoch: 34, train_loss: 0.7405, test_loss: 0.8287, test_f1: 0.5788
 epoch: 35, train_loss: 0.7276, test_loss: 0.8257, test_f1: 0.5875
 epoch: 36, train_loss: 0.7320, test_loss: 0.8305, test_f1: 0.5563
 epoch: 37, train_loss: 0.7269, test_loss: 0.8214, test_f1: 0.5794
 epoch: 38, train_loss: 0.7234, test_loss: 0.8059, test_f1: 0.5854
 epoch: 39, train_loss: 0.7117, test_loss: 0.8291, test_f1: 0.5804
 epoch: 40, train_loss: 0.7026, test_loss: 0.7908, test_f1: 0.5843
 epoch: 41, train_loss: 0.6981, test_loss: 0.7933, test_f1: 0.5939
 epoch: 42, train_loss: 0.6945, test_loss: 0.7966, test_f1: 0.6008
 epoch: 43, train_loss: 0.6992, test_loss: 0.8107, test_f1: 0.5865
 epoch: 44, train_loss: 0.6799, test_loss: 0.7975, test_f1: 0.6051
 epoch: 45, train_loss: 0.6863, test_loss: 0.8235, test_f1: 0.5870
 epoch: 46, train_loss: 0.6710, test_loss: 0.8032, test_f1: 0.6026
 epoch: 47, train_loss: 0.6638, test_loss: 0.8123, test_f1: 0.5936
 epoch: 48, train_loss: 0.6649, test_loss: 0.8181, test_f1: 0.6073
 epoch: 49, train_loss: 0.6581, test_loss: 0.8277, test_f1: 0.5986
 epoch: 50, train_loss: 0.6654, test_loss: 0.8296, test_f1: 0.5808
 epoch: 51, train_loss: 0.6543, test_loss: 0.7958, test_f1: 0.6325
 epoch: 52, train_loss: 0.6497, test_loss: 0.8145, test_f1: 0.6151
 epoch: 53, train_loss: 0.6473, test_loss: 0.8210, test_f1: 0.6072
 epoch: 54, train_loss: 0.6501, test_loss: 0.8055, test_f1: 0.6071
 epoch: 55, train_loss: 0.6331, test_loss: 0.8183, test_f1: 0.6032
 epoch: 56, train_loss: 0.6438, test_loss: 0.8185, test_f1: 0.5959
 epoch: 57, train_loss: 0.6301, test_loss: 0.8139, test_f1: 0.6111
 epoch: 58, train_loss: 0.6407, test_loss: 0.8243, test_f1: 0.5974
 epoch: 59, train_loss: 0.6284, test_loss: 0.8262, test_f1: 0.6093
 epoch: 60, train_loss: 0.6293, test_loss: 0.8276, test_f1: 0.6126
 epoch: 61, train_loss: 0.6294, test_loss: 0.8108, test_f1: 0.6266
 epoch: 62, train_loss: 0.6293, test_loss: 0.8156, test_f1: 0.6388
 epoch: 63, train_loss: 0.6227, test_loss: 0.8506, test_f1: 0.5941
 epoch: 64, train_loss: 0.6153, test_loss: 0.8449, test_f1: 0.6230
 epoch: 65, train_loss: 0.6046, test_loss: 0.8324, test_f1: 0.6466
 epoch: 66, train_loss: 0.6186, test_loss: 0.8192, test_f1: 0.6239
 epoch: 67, train_loss: 0.6102, test_loss: 0.8216, test_f1: 0.6065
 epoch: 68, train_loss: 0.6121, test_loss: 0.8464, test_f1: 0.6359
 epoch: 69, train_loss: 0.5984, test_loss: 0.8194, test_f1: 0.6177
 epoch: 70, train_loss: 0.6158, test_loss: 0.8381, test_f1: 0.6098
 epoch: 71, train_loss: 0.6051, test_loss: 0.8396, test_f1: 0.6524
 epoch: 72, train_loss: 0.5932, test_loss: 0.8433, test_f1: 0.6217
 epoch: 73, train_loss: 0.5939, test_loss: 0.8231, test_f1: 0.6513
 epoch: 74, train_loss: 0.5845, test_loss: 0.8371, test_f1: 0.6644
 epoch: 75, train_loss: 0.5981, test_loss: 0.8425, test_f1: 0.6303
 epoch: 76, train_loss: 0.5838, test_loss: 0.8452, test_f1: 0.6486
 epoch: 77, train_loss: 0.5845, test_loss: 0.8474, test_f1: 0.6430
 epoch: 78, train_loss: 0.5836, test_loss: 0.8824, test_f1: 0.6440
 epoch: 79, train_loss: 0.5885, test_loss: 0.8659, test_f1: 0.6456
 epoch: 80, train_loss: 0.5804, test_loss: 0.8425, test_f1: 0.6402
 epoch: 81, train_loss: 0.5691, test_loss: 0.8792, test_f1: 0.6508
 epoch: 82, train_loss: 0.5684, test_loss: 0.8428, test_f1: 0.6522
 epoch: 83, train_loss: 0.5697, test_loss: 0.8812, test_f1: 0.6240
 epoch: 84, train_loss: 0.5829, test_loss: 0.8742, test_f1: 0.6398
 epoch: 85, train_loss: 0.5644, test_loss: 0.8581, test_f1: 0.6538
 epoch: 86, train_loss: 0.5685, test_loss: 0.8692, test_f1: 0.6289
 epoch: 87, train_loss: 0.5718, test_loss: 0.8684, test_f1: 0.6404
 epoch: 88, train_loss: 0.5690, test_loss: 0.8955, test_f1: 0.6391
 epoch: 89, train_loss: 0.5620, test_loss: 0.8896, test_f1: 0.6225
 epoch: 90, train_loss: 0.5577, test_loss: 0.8676, test_f1: 0.6672
 epoch: 91, train_loss: 0.5568, test_loss: 0.9017, test_f1: 0.6345
 epoch: 92, train_loss: 0.5627, test_loss: 0.8738, test_f1: 0.6332
 epoch: 93, train_loss: 0.5548, test_loss: 0.8685, test_f1: 0.6574
 epoch: 94, train_loss: 0.5577, test_loss: 0.8883, test_f1: 0.6365
 epoch: 95, train_loss: 0.5423, test_loss: 0.8892, test_f1: 0.6349
 epoch: 96, train_loss: 0.5516, test_loss: 0.8817, test_f1: 0.6466
 epoch: 97, train_loss: 0.5503, test_loss: 0.9156, test_f1: 0.6202
 epoch: 98, train_loss: 0.5433, test_loss: 0.8955, test_f1: 0.6290
 epoch: 99, train_loss: 0.5381, test_loss: 0.9006, test_f1: 0.6297
##################ITERATION #9 ****************************************
 epoch: 0, train_loss: 1.2645, test_loss: 1.2904, test_f1: 0.2270
 epoch: 1, train_loss: 1.0882, test_loss: 1.2445, test_f1: 0.2270
 epoch: 2, train_loss: 1.0599, test_loss: 1.1648, test_f1: 0.2963
 epoch: 3, train_loss: 1.0248, test_loss: 1.0517, test_f1: 0.4500
 epoch: 4, train_loss: 0.9885, test_loss: 0.9980, test_f1: 0.4964
 epoch: 5, train_loss: 0.9859, test_loss: 0.9636, test_f1: 0.5181
 epoch: 6, train_loss: 0.9721, test_loss: 0.9421, test_f1: 0.5342
 epoch: 7, train_loss: 0.9429, test_loss: 0.9201, test_f1: 0.5316
 epoch: 8, train_loss: 0.9352, test_loss: 0.9148, test_f1: 0.5345
 epoch: 9, train_loss: 0.9240, test_loss: 0.9011, test_f1: 0.5446
 epoch: 10, train_loss: 0.9101, test_loss: 0.8902, test_f1: 0.5304
 epoch: 11, train_loss: 0.9071, test_loss: 0.8883, test_f1: 0.5486
 epoch: 12, train_loss: 0.9026, test_loss: 0.8840, test_f1: 0.5316
 epoch: 13, train_loss: 0.8847, test_loss: 0.8746, test_f1: 0.5429
 epoch: 14, train_loss: 0.8708, test_loss: 0.8702, test_f1: 0.5445
 epoch: 15, train_loss: 0.8594, test_loss: 0.8661, test_f1: 0.5439
 epoch: 16, train_loss: 0.8563, test_loss: 0.8417, test_f1: 0.5592
 epoch: 17, train_loss: 0.8524, test_loss: 0.8439, test_f1: 0.5541
 epoch: 18, train_loss: 0.8360, test_loss: 0.8433, test_f1: 0.5692
 epoch: 19, train_loss: 0.8302, test_loss: 0.8620, test_f1: 0.5553
 epoch: 20, train_loss: 0.8317, test_loss: 0.8272, test_f1: 0.5561
 epoch: 21, train_loss: 0.8177, test_loss: 0.8166, test_f1: 0.5584
 epoch: 22, train_loss: 0.8138, test_loss: 0.8286, test_f1: 0.5527
 epoch: 23, train_loss: 0.8049, test_loss: 0.8107, test_f1: 0.5680
 epoch: 24, train_loss: 0.7987, test_loss: 0.8073, test_f1: 0.5841
 epoch: 25, train_loss: 0.7924, test_loss: 0.7932, test_f1: 0.5919
 epoch: 26, train_loss: 0.7784, test_loss: 0.8251, test_f1: 0.5665
 epoch: 27, train_loss: 0.7779, test_loss: 0.8090, test_f1: 0.5837
 epoch: 28, train_loss: 0.7713, test_loss: 0.7919, test_f1: 0.5860
 epoch: 29, train_loss: 0.7585, test_loss: 0.8003, test_f1: 0.5974
 epoch: 30, train_loss: 0.7641, test_loss: 0.7950, test_f1: 0.5921
 epoch: 31, train_loss: 0.7517, test_loss: 0.8027, test_f1: 0.5679
 epoch: 32, train_loss: 0.7553, test_loss: 0.8045, test_f1: 0.5639
 epoch: 33, train_loss: 0.7419, test_loss: 0.7728, test_f1: 0.5932
 epoch: 34, train_loss: 0.7248, test_loss: 0.7817, test_f1: 0.5903
 epoch: 35, train_loss: 0.7378, test_loss: 0.7776, test_f1: 0.6173
 epoch: 36, train_loss: 0.7290, test_loss: 0.7793, test_f1: 0.5858
 epoch: 37, train_loss: 0.7232, test_loss: 0.7930, test_f1: 0.5969
 epoch: 38, train_loss: 0.7119, test_loss: 0.7882, test_f1: 0.6002
 epoch: 39, train_loss: 0.7154, test_loss: 0.7754, test_f1: 0.5997
 epoch: 40, train_loss: 0.7039, test_loss: 0.7863, test_f1: 0.6097
 epoch: 41, train_loss: 0.7101, test_loss: 0.7838, test_f1: 0.5907
 epoch: 42, train_loss: 0.6899, test_loss: 0.7680, test_f1: 0.6186
 epoch: 43, train_loss: 0.6979, test_loss: 0.7690, test_f1: 0.6019
 epoch: 44, train_loss: 0.6835, test_loss: 0.7547, test_f1: 0.6444
 epoch: 45, train_loss: 0.6869, test_loss: 0.7939, test_f1: 0.6190
 epoch: 46, train_loss: 0.6778, test_loss: 0.7629, test_f1: 0.6351
 epoch: 47, train_loss: 0.6725, test_loss: 0.7816, test_f1: 0.5943
 epoch: 48, train_loss: 0.6684, test_loss: 0.7686, test_f1: 0.6357
 epoch: 49, train_loss: 0.6670, test_loss: 0.7639, test_f1: 0.6440
 epoch: 50, train_loss: 0.6579, test_loss: 0.7950, test_f1: 0.6155
 epoch: 51, train_loss: 0.6430, test_loss: 0.7754, test_f1: 0.6290
 epoch: 52, train_loss: 0.6465, test_loss: 0.7760, test_f1: 0.6274
 epoch: 53, train_loss: 0.6428, test_loss: 0.7805, test_f1: 0.6113
 epoch: 54, train_loss: 0.6369, test_loss: 0.7800, test_f1: 0.6167
 epoch: 55, train_loss: 0.6413, test_loss: 0.7663, test_f1: 0.6403
 epoch: 56, train_loss: 0.6282, test_loss: 0.7737, test_f1: 0.6228
 epoch: 57, train_loss: 0.6410, test_loss: 0.7704, test_f1: 0.6269
 epoch: 58, train_loss: 0.6324, test_loss: 0.7877, test_f1: 0.6434
 epoch: 59, train_loss: 0.6231, test_loss: 0.7755, test_f1: 0.6361
 epoch: 60, train_loss: 0.6230, test_loss: 0.7778, test_f1: 0.6478
 epoch: 61, train_loss: 0.6264, test_loss: 0.7907, test_f1: 0.6581
 epoch: 62, train_loss: 0.6247, test_loss: 0.7857, test_f1: 0.6332
 epoch: 63, train_loss: 0.6239, test_loss: 0.7985, test_f1: 0.6341
 epoch: 64, train_loss: 0.6109, test_loss: 0.7935, test_f1: 0.6340
 epoch: 65, train_loss: 0.6094, test_loss: 0.7817, test_f1: 0.6505
 epoch: 66, train_loss: 0.6049, test_loss: 0.7816, test_f1: 0.6428
 epoch: 67, train_loss: 0.6041, test_loss: 0.7945, test_f1: 0.6473
 epoch: 68, train_loss: 0.5984, test_loss: 0.7918, test_f1: 0.6483
 epoch: 69, train_loss: 0.5997, test_loss: 0.7897, test_f1: 0.6411
 epoch: 70, train_loss: 0.5963, test_loss: 0.7898, test_f1: 0.6418
 epoch: 71, train_loss: 0.5891, test_loss: 0.8059, test_f1: 0.6376
 epoch: 72, train_loss: 0.6022, test_loss: 0.7989, test_f1: 0.6550
 epoch: 73, train_loss: 0.6064, test_loss: 0.8136, test_f1: 0.6244
 epoch: 74, train_loss: 0.6056, test_loss: 0.7966, test_f1: 0.6395
 epoch: 75, train_loss: 0.5942, test_loss: 0.8044, test_f1: 0.6288
 epoch: 76, train_loss: 0.5825, test_loss: 0.7985, test_f1: 0.6531
 epoch: 77, train_loss: 0.5862, test_loss: 0.7895, test_f1: 0.6650
 epoch: 78, train_loss: 0.5870, test_loss: 0.7933, test_f1: 0.6430
 epoch: 79, train_loss: 0.5836, test_loss: 0.8084, test_f1: 0.6276
 epoch: 80, train_loss: 0.5843, test_loss: 0.8142, test_f1: 0.6470
 epoch: 81, train_loss: 0.5790, test_loss: 0.7980, test_f1: 0.6555
 epoch: 82, train_loss: 0.5852, test_loss: 0.8088, test_f1: 0.6536
 epoch: 83, train_loss: 0.5709, test_loss: 0.8229, test_f1: 0.6513
 epoch: 84, train_loss: 0.5829, test_loss: 0.8115, test_f1: 0.6580
 epoch: 85, train_loss: 0.5823, test_loss: 0.8367, test_f1: 0.6483
 epoch: 86, train_loss: 0.5697, test_loss: 0.8142, test_f1: 0.6414
 epoch: 87, train_loss: 0.5724, test_loss: 0.8209, test_f1: 0.6300
 epoch: 88, train_loss: 0.5772, test_loss: 0.8275, test_f1: 0.6406
 epoch: 89, train_loss: 0.5615, test_loss: 0.8084, test_f1: 0.6375
 epoch: 90, train_loss: 0.5539, test_loss: 0.8425, test_f1: 0.6336
 epoch: 91, train_loss: 0.5611, test_loss: 0.8200, test_f1: 0.6272
 epoch: 92, train_loss: 0.5654, test_loss: 0.8212, test_f1: 0.6473
 epoch: 93, train_loss: 0.5653, test_loss: 0.8463, test_f1: 0.6297
 epoch: 94, train_loss: 0.5549, test_loss: 0.8362, test_f1: 0.6288
 epoch: 95, train_loss: 0.5575, test_loss: 0.8370, test_f1: 0.6406
 epoch: 96, train_loss: 0.5536, test_loss: 0.8342, test_f1: 0.6350
 epoch: 97, train_loss: 0.5535, test_loss: 0.8426, test_f1: 0.6246
 epoch: 98, train_loss: 0.5524, test_loss: 0.8564, test_f1: 0.6442
 epoch: 99, train_loss: 0.5489, test_loss: 0.8619, test_f1: 0.6354

Training completed in 464.97 seconds
Best F1: 0.6786 at epoch 69
Mean F1 across iterations: 0.6365  0.0301
========================FINAL RESULTS================================
FEGIN weighted F1: 0.6786  0.0301
python main.py --data ltspice_examples --representation component_pin_net --model FEGIN --layers 3 --hiddens 128 --batch_size 256 --lr 0.0001 --emb_size 128 --epochs 100 --save_appendix component_pin_net_L3_H128_BS256_LR0.0001_E128 --no_val
-----



STDERR:
  File "main.py", line 370, in <module>
    main()
  File "main.py", line 254, in main
    dataset = dataset_class(
  File "/home/philip/projects/ltspice_examples_code_repo/Circuit-Completion-Using-GNNs/component_classification_with_link_prediction_head/evaluation/FEGIN/kernel/circuit_datasets.py", line 15, in __init__
    self.data, self.slices = torch.load(self.processed_paths[0])
  File "/home/philip/.local/lib/python3.8/site-packages/torch/serialization.py", line 1040, in load
    warnings.warn(
  File "/usr/lib/python3.8/warnings.py", line 109, in _showwarnmsg
    sw(msg.message, msg.category, msg.filename, msg.lineno,
  File "main.py", line 47, in warn_with_traceback
    traceback.print_stack(file=log)
/home/philip/projects/ltspice_examples_code_repo/Circuit-Completion-Using-GNNs/component_classification_with_link_prediction_head/evaluation/FEGIN/kernel/circuit_datasets.py:15: FutureWarning: You are using `torch.load` with `weights_only=False` (the current default value), which uses the default pickle module implicitly. It is possible to construct malicious pickle data which will execute arbitrary code during unpickling (See https://github.com/pytorch/pytorch/blob/main/SECURITY.md#untrusted-models for more details). In a future release, the default value for `weights_only` will be flipped to `True`. This limits the functions that could be executed during unpickling. Arbitrary objects will no longer be allowed to be loaded via this mode unless they are explicitly allowlisted by the user via `torch.serialization.add_safe_globals`. We recommend you start setting `weights_only=True` for any use case where you don't have full control of the loaded file. Please open an issue on GitHub for any issues related to this experimental feature.
  self.data, self.slices = torch.load(self.processed_paths[0])
