STDOUT:
Results will be saved in /home/philip/projects/ltspice_examples_code_repo/Circuit-Completion-Using-GNNs/component_classification_with_link_prediction_head/evaluation/FEGIN/results/model_FEGIN_dataset_ltspice_examples
Command line input: python main.py --data ltspice_examples --representation component_net --model FEGIN --layers 5 --hiddens 32 --batch_size 64 --lr 0.01 --emb_size 512 --epochs 100 --save_appendix component_net_L5_H32_BS64_LR0.01_E512 --no_val
 is saved.
-----
ltspice_examples - FEGIN
Using 5 layers, 32 hidden units, h = 2
Loading component_net representation dataset
ENTERED
Training FEGIN on component_net representation
Train: 3558, Test: 846
##################ITERATION #0 ****************************************
 epoch: 0, train_loss: 1.2103, test_loss: 1.1488, test_f1: 0.4310
 epoch: 1, train_loss: 1.0471, test_loss: 1.0363, test_f1: 0.5098
 epoch: 2, train_loss: 1.0070, test_loss: 0.9519, test_f1: 0.4896
 epoch: 3, train_loss: 0.9905, test_loss: 1.0815, test_f1: 0.4811
 epoch: 4, train_loss: 0.9954, test_loss: 1.0935, test_f1: 0.4582
 epoch: 5, train_loss: 0.9729, test_loss: 1.1107, test_f1: 0.4178
 epoch: 6, train_loss: 0.9677, test_loss: 1.0461, test_f1: 0.4866
 epoch: 7, train_loss: 0.9476, test_loss: 1.0880, test_f1: 0.4730
 epoch: 8, train_loss: 0.9383, test_loss: 1.0790, test_f1: 0.4663
 epoch: 9, train_loss: 0.9231, test_loss: 1.0093, test_f1: 0.4935
 epoch: 10, train_loss: 0.9202, test_loss: 0.9457, test_f1: 0.5086
 epoch: 11, train_loss: 0.9293, test_loss: 0.9544, test_f1: 0.4788
 epoch: 12, train_loss: 0.9027, test_loss: 0.9873, test_f1: 0.5245
 epoch: 13, train_loss: 0.9026, test_loss: 1.0776, test_f1: 0.3632
 epoch: 14, train_loss: 0.8992, test_loss: 0.9662, test_f1: 0.5188
 epoch: 15, train_loss: 0.9004, test_loss: 1.0725, test_f1: 0.4899
 epoch: 16, train_loss: 0.8801, test_loss: 1.1083, test_f1: 0.4939
 epoch: 17, train_loss: 0.8862, test_loss: 0.9972, test_f1: 0.5028
 epoch: 18, train_loss: 0.8941, test_loss: 1.1089, test_f1: 0.5011
 epoch: 19, train_loss: 0.8811, test_loss: 0.9696, test_f1: 0.5109
 epoch: 20, train_loss: 0.8764, test_loss: 1.0416, test_f1: 0.5224
 epoch: 21, train_loss: 0.8678, test_loss: 0.9647, test_f1: 0.4892
 epoch: 22, train_loss: 0.8844, test_loss: 1.0211, test_f1: 0.5249
 epoch: 23, train_loss: 0.8529, test_loss: 0.9708, test_f1: 0.5270
 epoch: 24, train_loss: 0.8491, test_loss: 0.9590, test_f1: 0.5119
 epoch: 25, train_loss: 0.8565, test_loss: 0.9460, test_f1: 0.5846
 epoch: 26, train_loss: 0.8760, test_loss: 1.0220, test_f1: 0.5448
 epoch: 27, train_loss: 0.8418, test_loss: 1.0144, test_f1: 0.5348
 epoch: 28, train_loss: 0.8498, test_loss: 1.0375, test_f1: 0.5185
 epoch: 29, train_loss: 0.8366, test_loss: 1.1829, test_f1: 0.5196
 epoch: 30, train_loss: 0.8604, test_loss: 1.1107, test_f1: 0.5024
 epoch: 31, train_loss: 0.8260, test_loss: 1.0478, test_f1: 0.5752
 epoch: 32, train_loss: 0.8320, test_loss: 1.0290, test_f1: 0.5610
 epoch: 33, train_loss: 0.8277, test_loss: 1.1684, test_f1: 0.5411
 epoch: 34, train_loss: 0.8332, test_loss: 1.1247, test_f1: 0.5776
 epoch: 35, train_loss: 0.8335, test_loss: 1.0394, test_f1: 0.5685
 epoch: 36, train_loss: 0.8127, test_loss: 1.0987, test_f1: 0.5815
 epoch: 37, train_loss: 0.8240, test_loss: 1.0077, test_f1: 0.5857
 epoch: 38, train_loss: 0.8088, test_loss: 1.0266, test_f1: 0.5951
 epoch: 39, train_loss: 0.8009, test_loss: 1.1015, test_f1: 0.5673
 epoch: 40, train_loss: 0.8113, test_loss: 1.1105, test_f1: 0.6003
 epoch: 41, train_loss: 0.7942, test_loss: 1.0946, test_f1: 0.5593
 epoch: 42, train_loss: 0.8074, test_loss: 1.0399, test_f1: 0.6014
 epoch: 43, train_loss: 0.7895, test_loss: 1.1257, test_f1: 0.5871
 epoch: 44, train_loss: 0.8159, test_loss: 1.0450, test_f1: 0.5304
 epoch: 45, train_loss: 0.8116, test_loss: 1.2309, test_f1: 0.6061
 epoch: 46, train_loss: 0.8030, test_loss: 1.0558, test_f1: 0.5923
 epoch: 47, train_loss: 0.7970, test_loss: 1.0747, test_f1: 0.5697
 epoch: 48, train_loss: 0.7882, test_loss: 1.1766, test_f1: 0.5693
 epoch: 49, train_loss: 0.7900, test_loss: 1.1282, test_f1: 0.5928
 epoch: 50, train_loss: 0.7762, test_loss: 1.1350, test_f1: 0.5902
 epoch: 51, train_loss: 0.7549, test_loss: 1.1484, test_f1: 0.6187
 epoch: 52, train_loss: 0.7513, test_loss: 1.1341, test_f1: 0.5884
 epoch: 53, train_loss: 0.7332, test_loss: 1.1575, test_f1: 0.6019
 epoch: 54, train_loss: 0.7333, test_loss: 1.1098, test_f1: 0.5805
 epoch: 55, train_loss: 0.7415, test_loss: 1.1802, test_f1: 0.5993
 epoch: 56, train_loss: 0.7258, test_loss: 1.1538, test_f1: 0.6055
 epoch: 57, train_loss: 0.7206, test_loss: 1.0855, test_f1: 0.5933
 epoch: 58, train_loss: 0.7282, test_loss: 1.1546, test_f1: 0.6058
 epoch: 59, train_loss: 0.7244, test_loss: 1.1101, test_f1: 0.6241
 epoch: 60, train_loss: 0.7226, test_loss: 1.1274, test_f1: 0.6005
 epoch: 61, train_loss: 0.7079, test_loss: 1.0739, test_f1: 0.6247
 epoch: 62, train_loss: 0.7013, test_loss: 1.0839, test_f1: 0.6382
 epoch: 63, train_loss: 0.6990, test_loss: 1.1486, test_f1: 0.5592
 epoch: 64, train_loss: 0.7022, test_loss: 1.3228, test_f1: 0.6379
 epoch: 65, train_loss: 0.6916, test_loss: 1.0894, test_f1: 0.6126
 epoch: 66, train_loss: 0.7036, test_loss: 1.1903, test_f1: 0.6254
 epoch: 67, train_loss: 0.7011, test_loss: 1.2579, test_f1: 0.6300
 epoch: 68, train_loss: 0.7079, test_loss: 1.1635, test_f1: 0.6235
 epoch: 69, train_loss: 0.6963, test_loss: 1.2382, test_f1: 0.6327
 epoch: 70, train_loss: 0.7103, test_loss: 1.2379, test_f1: 0.6265
 epoch: 71, train_loss: 0.6895, test_loss: 1.1688, test_f1: 0.6387
 epoch: 72, train_loss: 0.6946, test_loss: 1.1510, test_f1: 0.6476
 epoch: 73, train_loss: 0.6774, test_loss: 1.1385, test_f1: 0.6411
 epoch: 74, train_loss: 0.6831, test_loss: 1.2054, test_f1: 0.6309
 epoch: 75, train_loss: 0.6796, test_loss: 1.2331, test_f1: 0.6234
 epoch: 76, train_loss: 0.6892, test_loss: 1.1858, test_f1: 0.6616
 epoch: 77, train_loss: 0.6779, test_loss: 1.1912, test_f1: 0.6208
 epoch: 78, train_loss: 0.6699, test_loss: 1.2947, test_f1: 0.6288
 epoch: 79, train_loss: 0.6876, test_loss: 1.2178, test_f1: 0.6355
 epoch: 80, train_loss: 0.6692, test_loss: 1.2136, test_f1: 0.6507
 epoch: 81, train_loss: 0.6725, test_loss: 1.2034, test_f1: 0.6093
 epoch: 82, train_loss: 0.6876, test_loss: 1.0340, test_f1: 0.6242
 epoch: 83, train_loss: 0.6714, test_loss: 1.1999, test_f1: 0.6312
 epoch: 84, train_loss: 0.6730, test_loss: 1.2759, test_f1: 0.6223
 epoch: 85, train_loss: 0.6929, test_loss: 1.3451, test_f1: 0.6023
 epoch: 86, train_loss: 0.6874, test_loss: 1.2595, test_f1: 0.6428
 epoch: 87, train_loss: 0.6852, test_loss: 1.1611, test_f1: 0.6407
 epoch: 88, train_loss: 0.6648, test_loss: 1.2466, test_f1: 0.6353
 epoch: 89, train_loss: 0.6821, test_loss: 1.2180, test_f1: 0.6548
 epoch: 90, train_loss: 0.6670, test_loss: 1.2671, test_f1: 0.6487
 epoch: 91, train_loss: 0.6616, test_loss: 1.1747, test_f1: 0.6290
 epoch: 92, train_loss: 0.6646, test_loss: 1.2992, test_f1: 0.6204
 epoch: 93, train_loss: 0.6730, test_loss: 1.1505, test_f1: 0.6347
 epoch: 94, train_loss: 0.6525, test_loss: 1.2512, test_f1: 0.6543
 epoch: 95, train_loss: 0.6554, test_loss: 1.2392, test_f1: 0.6082
 epoch: 96, train_loss: 0.6471, test_loss: 1.2374, test_f1: 0.6429
 epoch: 97, train_loss: 0.6550, test_loss: 1.1547, test_f1: 0.6224
 epoch: 98, train_loss: 0.6440, test_loss: 1.3561, test_f1: 0.6580
 epoch: 99, train_loss: 0.6445, test_loss: 1.3085, test_f1: 0.6228
##################ITERATION #1 ****************************************
 epoch: 0, train_loss: 1.1653, test_loss: 1.0824, test_f1: 0.4195
 epoch: 1, train_loss: 1.0169, test_loss: 1.0282, test_f1: 0.4814
 epoch: 2, train_loss: 0.9803, test_loss: 0.9583, test_f1: 0.5304
 epoch: 3, train_loss: 0.9953, test_loss: 1.0206, test_f1: 0.4387
 epoch: 4, train_loss: 0.9691, test_loss: 1.0307, test_f1: 0.4540
 epoch: 5, train_loss: 0.9808, test_loss: 0.9913, test_f1: 0.4820
 epoch: 6, train_loss: 0.9592, test_loss: 0.9529, test_f1: 0.4827
 epoch: 7, train_loss: 0.9464, test_loss: 0.9717, test_f1: 0.4922
 epoch: 8, train_loss: 0.9417, test_loss: 0.9490, test_f1: 0.4705
 epoch: 9, train_loss: 0.9444, test_loss: 0.9960, test_f1: 0.5164
 epoch: 10, train_loss: 0.9310, test_loss: 0.9657, test_f1: 0.5138
 epoch: 11, train_loss: 0.9326, test_loss: 0.9802, test_f1: 0.4845
 epoch: 12, train_loss: 0.9210, test_loss: 0.9874, test_f1: 0.4954
 epoch: 13, train_loss: 0.9088, test_loss: 1.0109, test_f1: 0.5015
 epoch: 14, train_loss: 0.9018, test_loss: 0.9578, test_f1: 0.5135
 epoch: 15, train_loss: 0.8947, test_loss: 0.9787, test_f1: 0.5269
 epoch: 16, train_loss: 0.8897, test_loss: 0.8850, test_f1: 0.5163
 epoch: 17, train_loss: 0.8903, test_loss: 0.9926, test_f1: 0.5087
 epoch: 18, train_loss: 0.8806, test_loss: 0.9119, test_f1: 0.5058
 epoch: 19, train_loss: 0.8789, test_loss: 1.0028, test_f1: 0.4997
 epoch: 20, train_loss: 0.8683, test_loss: 0.9990, test_f1: 0.5025
 epoch: 21, train_loss: 0.8803, test_loss: 1.0012, test_f1: 0.4989
 epoch: 22, train_loss: 0.8891, test_loss: 0.9755, test_f1: 0.5034
 epoch: 23, train_loss: 0.8786, test_loss: 0.9465, test_f1: 0.4993
 epoch: 24, train_loss: 0.8689, test_loss: 1.0415, test_f1: 0.5007
 epoch: 25, train_loss: 0.8563, test_loss: 0.9401, test_f1: 0.5221
 epoch: 26, train_loss: 0.8639, test_loss: 0.9909, test_f1: 0.4934
 epoch: 27, train_loss: 0.8586, test_loss: 0.9761, test_f1: 0.5075
 epoch: 28, train_loss: 0.8487, test_loss: 0.9119, test_f1: 0.5435
 epoch: 29, train_loss: 0.8360, test_loss: 0.9661, test_f1: 0.5307
 epoch: 30, train_loss: 0.8322, test_loss: 1.0184, test_f1: 0.5463
 epoch: 31, train_loss: 0.8401, test_loss: 0.9644, test_f1: 0.5581
 epoch: 32, train_loss: 0.8220, test_loss: 0.8991, test_f1: 0.5803
 epoch: 33, train_loss: 0.8320, test_loss: 0.9533, test_f1: 0.5792
 epoch: 34, train_loss: 0.8139, test_loss: 0.9096, test_f1: 0.5286
 epoch: 35, train_loss: 0.8116, test_loss: 1.1223, test_f1: 0.5130
 epoch: 36, train_loss: 0.8155, test_loss: 0.9713, test_f1: 0.5688
 epoch: 37, train_loss: 0.8261, test_loss: 0.9080, test_f1: 0.5243
 epoch: 38, train_loss: 0.8097, test_loss: 1.0132, test_f1: 0.5663
 epoch: 39, train_loss: 0.8202, test_loss: 0.9283, test_f1: 0.4987
 epoch: 40, train_loss: 0.8062, test_loss: 0.9473, test_f1: 0.5911
 epoch: 41, train_loss: 0.7929, test_loss: 1.1069, test_f1: 0.5767
 epoch: 42, train_loss: 0.8028, test_loss: 0.9932, test_f1: 0.5276
 epoch: 43, train_loss: 0.8066, test_loss: 0.9310, test_f1: 0.5529
 epoch: 44, train_loss: 0.8056, test_loss: 1.0327, test_f1: 0.5120
 epoch: 45, train_loss: 0.8339, test_loss: 0.9159, test_f1: 0.5656
 epoch: 46, train_loss: 0.8126, test_loss: 0.9057, test_f1: 0.5328
 epoch: 47, train_loss: 0.8092, test_loss: 0.9314, test_f1: 0.6015
 epoch: 48, train_loss: 0.7973, test_loss: 0.9069, test_f1: 0.5523
 epoch: 49, train_loss: 0.8011, test_loss: 0.9319, test_f1: 0.5945
 epoch: 50, train_loss: 0.7906, test_loss: 1.0100, test_f1: 0.5291
 epoch: 51, train_loss: 0.7720, test_loss: 0.9121, test_f1: 0.6213
 epoch: 52, train_loss: 0.7470, test_loss: 0.9513, test_f1: 0.5691
 epoch: 53, train_loss: 0.7513, test_loss: 0.9445, test_f1: 0.6239
 epoch: 54, train_loss: 0.7405, test_loss: 0.9325, test_f1: 0.6446
 epoch: 55, train_loss: 0.7427, test_loss: 0.9292, test_f1: 0.6083
 epoch: 56, train_loss: 0.7386, test_loss: 0.9127, test_f1: 0.6517
 epoch: 57, train_loss: 0.7223, test_loss: 0.9155, test_f1: 0.6117
 epoch: 58, train_loss: 0.7372, test_loss: 0.9452, test_f1: 0.6371
 epoch: 59, train_loss: 0.7099, test_loss: 0.9603, test_f1: 0.6137
 epoch: 60, train_loss: 0.7216, test_loss: 0.9537, test_f1: 0.6450
 epoch: 61, train_loss: 0.7163, test_loss: 0.9216, test_f1: 0.6514
 epoch: 62, train_loss: 0.7175, test_loss: 0.9532, test_f1: 0.6530
 epoch: 63, train_loss: 0.7245, test_loss: 0.9459, test_f1: 0.6138
 epoch: 64, train_loss: 0.7119, test_loss: 1.0113, test_f1: 0.6306
 epoch: 65, train_loss: 0.7167, test_loss: 1.0103, test_f1: 0.6327
 epoch: 66, train_loss: 0.6964, test_loss: 1.0069, test_f1: 0.6404
 epoch: 67, train_loss: 0.7100, test_loss: 0.9545, test_f1: 0.6348
 epoch: 68, train_loss: 0.7152, test_loss: 0.9774, test_f1: 0.6432
 epoch: 69, train_loss: 0.7060, test_loss: 0.9795, test_f1: 0.6470
 epoch: 70, train_loss: 0.7117, test_loss: 0.9610, test_f1: 0.6266
 epoch: 71, train_loss: 0.7136, test_loss: 0.9464, test_f1: 0.6476
 epoch: 72, train_loss: 0.7088, test_loss: 0.9651, test_f1: 0.6523
 epoch: 73, train_loss: 0.6941, test_loss: 0.9264, test_f1: 0.6359
 epoch: 74, train_loss: 0.6981, test_loss: 0.9527, test_f1: 0.6328
 epoch: 75, train_loss: 0.7010, test_loss: 0.9517, test_f1: 0.6294
 epoch: 76, train_loss: 0.7009, test_loss: 0.9723, test_f1: 0.6338
 epoch: 77, train_loss: 0.7031, test_loss: 0.9618, test_f1: 0.6246
 epoch: 78, train_loss: 0.6928, test_loss: 1.0275, test_f1: 0.6545
 epoch: 79, train_loss: 0.6944, test_loss: 1.0533, test_f1: 0.6297
 epoch: 80, train_loss: 0.6909, test_loss: 1.0015, test_f1: 0.6303
 epoch: 81, train_loss: 0.7069, test_loss: 0.9490, test_f1: 0.6495
 epoch: 82, train_loss: 0.6856, test_loss: 0.9772, test_f1: 0.6360
 epoch: 83, train_loss: 0.6777, test_loss: 1.0061, test_f1: 0.6276
 epoch: 84, train_loss: 0.6899, test_loss: 0.9752, test_f1: 0.6245
 epoch: 85, train_loss: 0.6634, test_loss: 1.0105, test_f1: 0.6602
 epoch: 86, train_loss: 0.6791, test_loss: 0.9831, test_f1: 0.6392
 epoch: 87, train_loss: 0.6950, test_loss: 0.8985, test_f1: 0.6524
 epoch: 88, train_loss: 0.6920, test_loss: 0.9292, test_f1: 0.6308
 epoch: 89, train_loss: 0.6784, test_loss: 0.9459, test_f1: 0.6883
 epoch: 90, train_loss: 0.6803, test_loss: 1.1141, test_f1: 0.6247
 epoch: 91, train_loss: 0.6754, test_loss: 0.9898, test_f1: 0.6500
 epoch: 92, train_loss: 0.6831, test_loss: 0.9407, test_f1: 0.6481
 epoch: 93, train_loss: 0.6703, test_loss: 1.0429, test_f1: 0.6452
 epoch: 94, train_loss: 0.6655, test_loss: 0.9540, test_f1: 0.6474
 epoch: 95, train_loss: 0.6617, test_loss: 0.9625, test_f1: 0.6870
 epoch: 96, train_loss: 0.6684, test_loss: 0.9834, test_f1: 0.6744
 epoch: 97, train_loss: 0.6543, test_loss: 1.0067, test_f1: 0.6482
 epoch: 98, train_loss: 0.6665, test_loss: 0.9605, test_f1: 0.6584
 epoch: 99, train_loss: 0.6474, test_loss: 0.9395, test_f1: 0.6666
##################ITERATION #2 ****************************************
 epoch: 0, train_loss: 1.1550, test_loss: 1.1103, test_f1: 0.3692
 epoch: 1, train_loss: 1.0063, test_loss: 1.0189, test_f1: 0.4982
 epoch: 2, train_loss: 0.9784, test_loss: 1.0137, test_f1: 0.4990
 epoch: 3, train_loss: 0.9702, test_loss: 0.9955, test_f1: 0.5232
 epoch: 4, train_loss: 0.9686, test_loss: 1.0276, test_f1: 0.5140
 epoch: 5, train_loss: 0.9557, test_loss: 1.0464, test_f1: 0.4677
 epoch: 6, train_loss: 0.9408, test_loss: 0.8935, test_f1: 0.5095
 epoch: 7, train_loss: 0.9319, test_loss: 0.9458, test_f1: 0.5115
 epoch: 8, train_loss: 0.9274, test_loss: 0.9611, test_f1: 0.5386
 epoch: 9, train_loss: 0.9160, test_loss: 0.9540, test_f1: 0.5600
 epoch: 10, train_loss: 0.9157, test_loss: 0.9651, test_f1: 0.5176
 epoch: 11, train_loss: 0.9396, test_loss: 1.0117, test_f1: 0.5285
 epoch: 12, train_loss: 0.9155, test_loss: 0.9363, test_f1: 0.5292
 epoch: 13, train_loss: 0.9113, test_loss: 0.9298, test_f1: 0.5510
 epoch: 14, train_loss: 0.8902, test_loss: 0.9544, test_f1: 0.5659
 epoch: 15, train_loss: 0.8719, test_loss: 0.9572, test_f1: 0.4902
 epoch: 16, train_loss: 0.9048, test_loss: 0.9879, test_f1: 0.4883
 epoch: 17, train_loss: 0.8909, test_loss: 1.1277, test_f1: 0.4319
 epoch: 18, train_loss: 0.8889, test_loss: 1.0305, test_f1: 0.5164
 epoch: 19, train_loss: 0.8677, test_loss: 0.8992, test_f1: 0.5874
 epoch: 20, train_loss: 0.8621, test_loss: 0.9584, test_f1: 0.5003
 epoch: 21, train_loss: 0.8513, test_loss: 0.9011, test_f1: 0.5603
 epoch: 22, train_loss: 0.8614, test_loss: 0.9763, test_f1: 0.5432
 epoch: 23, train_loss: 0.8303, test_loss: 0.9334, test_f1: 0.5698
 epoch: 24, train_loss: 0.8257, test_loss: 0.9134, test_f1: 0.5588
 epoch: 25, train_loss: 0.8403, test_loss: 0.9245, test_f1: 0.5811
 epoch: 26, train_loss: 0.8272, test_loss: 0.9495, test_f1: 0.5320
 epoch: 27, train_loss: 0.8397, test_loss: 0.9540, test_f1: 0.5859
 epoch: 28, train_loss: 0.8180, test_loss: 0.9752, test_f1: 0.5594
 epoch: 29, train_loss: 0.8257, test_loss: 0.9362, test_f1: 0.5526
 epoch: 30, train_loss: 0.8187, test_loss: 1.0693, test_f1: 0.5733
 epoch: 31, train_loss: 0.8196, test_loss: 0.9957, test_f1: 0.5461
 epoch: 32, train_loss: 0.8167, test_loss: 0.8839, test_f1: 0.5610
 epoch: 33, train_loss: 0.7997, test_loss: 0.9917, test_f1: 0.5997
 epoch: 34, train_loss: 0.7974, test_loss: 0.9295, test_f1: 0.5550
 epoch: 35, train_loss: 0.7817, test_loss: 0.9705, test_f1: 0.6028
 epoch: 36, train_loss: 0.7735, test_loss: 0.8864, test_f1: 0.6166
 epoch: 37, train_loss: 0.7843, test_loss: 0.9760, test_f1: 0.5632
 epoch: 38, train_loss: 0.7893, test_loss: 0.9613, test_f1: 0.5841
 epoch: 39, train_loss: 0.7663, test_loss: 0.9566, test_f1: 0.5910
 epoch: 40, train_loss: 0.7606, test_loss: 0.9536, test_f1: 0.5534
 epoch: 41, train_loss: 0.7599, test_loss: 0.9697, test_f1: 0.6238
 epoch: 42, train_loss: 0.7562, test_loss: 1.0827, test_f1: 0.6071
 epoch: 43, train_loss: 0.7608, test_loss: 1.0058, test_f1: 0.5576
 epoch: 44, train_loss: 0.7550, test_loss: 1.0693, test_f1: 0.5648
 epoch: 45, train_loss: 0.7583, test_loss: 0.9557, test_f1: 0.5850
 epoch: 46, train_loss: 0.7713, test_loss: 0.9767, test_f1: 0.5669
 epoch: 47, train_loss: 0.7547, test_loss: 1.0348, test_f1: 0.5666
 epoch: 48, train_loss: 0.7434, test_loss: 0.9990, test_f1: 0.5832
 epoch: 49, train_loss: 0.7604, test_loss: 1.0101, test_f1: 0.5908
 epoch: 50, train_loss: 0.7437, test_loss: 0.9099, test_f1: 0.6279
 epoch: 51, train_loss: 0.7297, test_loss: 0.9264, test_f1: 0.6305
 epoch: 52, train_loss: 0.6966, test_loss: 0.9718, test_f1: 0.6466
 epoch: 53, train_loss: 0.6922, test_loss: 0.9889, test_f1: 0.5944
 epoch: 54, train_loss: 0.7036, test_loss: 0.9393, test_f1: 0.6124
 epoch: 55, train_loss: 0.6804, test_loss: 1.0308, test_f1: 0.6485
 epoch: 56, train_loss: 0.6768, test_loss: 1.0362, test_f1: 0.6087
 epoch: 57, train_loss: 0.6843, test_loss: 1.0454, test_f1: 0.6289
 epoch: 58, train_loss: 0.6977, test_loss: 1.0371, test_f1: 0.6041
 epoch: 59, train_loss: 0.6749, test_loss: 1.1234, test_f1: 0.6150
 epoch: 60, train_loss: 0.6640, test_loss: 1.0244, test_f1: 0.6414
 epoch: 61, train_loss: 0.6723, test_loss: 1.0668, test_f1: 0.6486
 epoch: 62, train_loss: 0.6642, test_loss: 1.0186, test_f1: 0.6304
 epoch: 63, train_loss: 0.6486, test_loss: 1.0871, test_f1: 0.6098
 epoch: 64, train_loss: 0.6561, test_loss: 1.0288, test_f1: 0.6375
 epoch: 65, train_loss: 0.6587, test_loss: 1.0644, test_f1: 0.6508
 epoch: 66, train_loss: 0.6504, test_loss: 1.0737, test_f1: 0.6491
 epoch: 67, train_loss: 0.6618, test_loss: 1.0491, test_f1: 0.6711
 epoch: 68, train_loss: 0.6441, test_loss: 1.1205, test_f1: 0.6335
 epoch: 69, train_loss: 0.6492, test_loss: 1.0957, test_f1: 0.6592
 epoch: 70, train_loss: 0.6560, test_loss: 1.2267, test_f1: 0.6311
 epoch: 71, train_loss: 0.6612, test_loss: 1.2320, test_f1: 0.6609
 epoch: 72, train_loss: 0.6443, test_loss: 1.1502, test_f1: 0.5754
 epoch: 73, train_loss: 0.6446, test_loss: 1.2110, test_f1: 0.6234
 epoch: 74, train_loss: 0.6542, test_loss: 1.1110, test_f1: 0.6475
 epoch: 75, train_loss: 0.6380, test_loss: 1.1628, test_f1: 0.6198
 epoch: 76, train_loss: 0.6384, test_loss: 1.1099, test_f1: 0.6096
 epoch: 77, train_loss: 0.6458, test_loss: 1.1259, test_f1: 0.6352
 epoch: 78, train_loss: 0.6422, test_loss: 1.1195, test_f1: 0.6406
 epoch: 79, train_loss: 0.6284, test_loss: 1.1179, test_f1: 0.6465
 epoch: 80, train_loss: 0.6529, test_loss: 1.1149, test_f1: 0.6499
 epoch: 81, train_loss: 0.6305, test_loss: 1.1850, test_f1: 0.6441
 epoch: 82, train_loss: 0.6146, test_loss: 1.1416, test_f1: 0.6301
 epoch: 83, train_loss: 0.6337, test_loss: 1.0920, test_f1: 0.5937
 epoch: 84, train_loss: 0.6340, test_loss: 1.1252, test_f1: 0.6420
 epoch: 85, train_loss: 0.6170, test_loss: 1.1353, test_f1: 0.6197
 epoch: 86, train_loss: 0.6123, test_loss: 1.1305, test_f1: 0.6448
 epoch: 87, train_loss: 0.6091, test_loss: 1.1957, test_f1: 0.6441
 epoch: 88, train_loss: 0.6228, test_loss: 1.1065, test_f1: 0.6494
 epoch: 89, train_loss: 0.6131, test_loss: 1.2790, test_f1: 0.6410
 epoch: 90, train_loss: 0.6245, test_loss: 1.3035, test_f1: 0.6696
 epoch: 91, train_loss: 0.6193, test_loss: 1.2371, test_f1: 0.6174
 epoch: 92, train_loss: 0.6120, test_loss: 1.1311, test_f1: 0.6563
 epoch: 93, train_loss: 0.6167, test_loss: 1.1088, test_f1: 0.6124
 epoch: 94, train_loss: 0.6070, test_loss: 1.1695, test_f1: 0.6437
 epoch: 95, train_loss: 0.6083, test_loss: 1.1216, test_f1: 0.6097
 epoch: 96, train_loss: 0.6185, test_loss: 1.1444, test_f1: 0.6710
 epoch: 97, train_loss: 0.6064, test_loss: 1.1748, test_f1: 0.6602
 epoch: 98, train_loss: 0.6116, test_loss: 1.1604, test_f1: 0.6612
 epoch: 99, train_loss: 0.5867, test_loss: 1.2719, test_f1: 0.6671
##################ITERATION #3 ****************************************
 epoch: 0, train_loss: 1.2050, test_loss: 1.0648, test_f1: 0.4482
 epoch: 1, train_loss: 1.0199, test_loss: 0.9584, test_f1: 0.4605
 epoch: 2, train_loss: 0.9830, test_loss: 1.0097, test_f1: 0.4422
 epoch: 3, train_loss: 0.9772, test_loss: 0.9757, test_f1: 0.4828
 epoch: 4, train_loss: 0.9682, test_loss: 0.9716, test_f1: 0.5066
 epoch: 5, train_loss: 0.9496, test_loss: 0.9441, test_f1: 0.4910
 epoch: 6, train_loss: 0.9394, test_loss: 0.9541, test_f1: 0.5092
 epoch: 7, train_loss: 0.9232, test_loss: 0.9612, test_f1: 0.4829
 epoch: 8, train_loss: 0.9232, test_loss: 0.9895, test_f1: 0.4986
 epoch: 9, train_loss: 0.9270, test_loss: 0.9704, test_f1: 0.5390
 epoch: 10, train_loss: 0.9144, test_loss: 0.9545, test_f1: 0.5212
 epoch: 11, train_loss: 0.9112, test_loss: 0.8870, test_f1: 0.4992
 epoch: 12, train_loss: 0.8943, test_loss: 0.9025, test_f1: 0.4976
 epoch: 13, train_loss: 0.8902, test_loss: 0.9652, test_f1: 0.5091
 epoch: 14, train_loss: 0.8732, test_loss: 0.9224, test_f1: 0.5311
 epoch: 15, train_loss: 0.8543, test_loss: 0.9541, test_f1: 0.5252
 epoch: 16, train_loss: 0.8680, test_loss: 0.9332, test_f1: 0.5422
 epoch: 17, train_loss: 0.8498, test_loss: 0.9014, test_f1: 0.5854
 epoch: 18, train_loss: 0.8554, test_loss: 0.9959, test_f1: 0.5356
 epoch: 19, train_loss: 0.8621, test_loss: 1.0211, test_f1: 0.4998
 epoch: 20, train_loss: 0.8494, test_loss: 0.9343, test_f1: 0.5269
 epoch: 21, train_loss: 0.8357, test_loss: 0.9007, test_f1: 0.5635
 epoch: 22, train_loss: 0.8390, test_loss: 0.9506, test_f1: 0.5394
 epoch: 23, train_loss: 0.8353, test_loss: 0.9200, test_f1: 0.5384
 epoch: 24, train_loss: 0.8374, test_loss: 0.9199, test_f1: 0.5727
 epoch: 25, train_loss: 0.8160, test_loss: 1.0355, test_f1: 0.4919
 epoch: 26, train_loss: 0.8350, test_loss: 0.8909, test_f1: 0.5627
 epoch: 27, train_loss: 0.8079, test_loss: 0.9346, test_f1: 0.5241
 epoch: 28, train_loss: 0.8216, test_loss: 0.8381, test_f1: 0.5946
 epoch: 29, train_loss: 0.7900, test_loss: 0.8599, test_f1: 0.5435
 epoch: 30, train_loss: 0.7897, test_loss: 1.0205, test_f1: 0.5788
 epoch: 31, train_loss: 0.7999, test_loss: 0.8801, test_f1: 0.5948
 epoch: 32, train_loss: 0.7870, test_loss: 0.9705, test_f1: 0.5233
 epoch: 33, train_loss: 0.8101, test_loss: 1.0517, test_f1: 0.5212
 epoch: 34, train_loss: 0.7961, test_loss: 0.9802, test_f1: 0.5232
 epoch: 35, train_loss: 0.8206, test_loss: 0.9577, test_f1: 0.5655
 epoch: 36, train_loss: 0.7826, test_loss: 0.9856, test_f1: 0.5673
 epoch: 37, train_loss: 0.7796, test_loss: 0.9010, test_f1: 0.5495
 epoch: 38, train_loss: 0.7716, test_loss: 0.8720, test_f1: 0.5423
 epoch: 39, train_loss: 0.7736, test_loss: 0.9671, test_f1: 0.5231
 epoch: 40, train_loss: 0.7631, test_loss: 0.9965, test_f1: 0.5563
 epoch: 41, train_loss: 0.7760, test_loss: 0.8857, test_f1: 0.6171
 epoch: 42, train_loss: 0.7809, test_loss: 0.8788, test_f1: 0.5490
 epoch: 43, train_loss: 0.7698, test_loss: 0.9415, test_f1: 0.5850
 epoch: 44, train_loss: 0.7674, test_loss: 0.8601, test_f1: 0.5459
 epoch: 45, train_loss: 0.7521, test_loss: 0.9973, test_f1: 0.5967
 epoch: 46, train_loss: 0.7462, test_loss: 0.8660, test_f1: 0.5533
 epoch: 47, train_loss: 0.7546, test_loss: 0.8824, test_f1: 0.5453
 epoch: 48, train_loss: 0.7427, test_loss: 0.9448, test_f1: 0.6097
 epoch: 49, train_loss: 0.7390, test_loss: 0.9448, test_f1: 0.6159
 epoch: 50, train_loss: 0.7394, test_loss: 0.8958, test_f1: 0.6151
 epoch: 51, train_loss: 0.7074, test_loss: 0.8788, test_f1: 0.6249
 epoch: 52, train_loss: 0.7154, test_loss: 0.9190, test_f1: 0.6167
 epoch: 53, train_loss: 0.6936, test_loss: 0.8869, test_f1: 0.6064
 epoch: 54, train_loss: 0.6973, test_loss: 0.9296, test_f1: 0.6163
 epoch: 55, train_loss: 0.6918, test_loss: 0.8875, test_f1: 0.6146
 epoch: 56, train_loss: 0.6758, test_loss: 0.9712, test_f1: 0.6339
 epoch: 57, train_loss: 0.6825, test_loss: 0.9529, test_f1: 0.5783
 epoch: 58, train_loss: 0.6765, test_loss: 0.9496, test_f1: 0.6537
 epoch: 59, train_loss: 0.6884, test_loss: 0.9656, test_f1: 0.6438
 epoch: 60, train_loss: 0.6605, test_loss: 0.9944, test_f1: 0.6021
 epoch: 61, train_loss: 0.6644, test_loss: 1.0467, test_f1: 0.6619
 epoch: 62, train_loss: 0.6513, test_loss: 0.9618, test_f1: 0.5919
 epoch: 63, train_loss: 0.6586, test_loss: 0.9805, test_f1: 0.6380
 epoch: 64, train_loss: 0.6523, test_loss: 0.9743, test_f1: 0.6446
 epoch: 65, train_loss: 0.6542, test_loss: 0.9787, test_f1: 0.6418
 epoch: 66, train_loss: 0.6547, test_loss: 0.9402, test_f1: 0.6575
 epoch: 67, train_loss: 0.6693, test_loss: 0.9878, test_f1: 0.5934
 epoch: 68, train_loss: 0.6654, test_loss: 0.9368, test_f1: 0.6547
 epoch: 69, train_loss: 0.6409, test_loss: 1.0385, test_f1: 0.6575
 epoch: 70, train_loss: 0.6670, test_loss: 0.9627, test_f1: 0.6553
 epoch: 71, train_loss: 0.6417, test_loss: 0.8976, test_f1: 0.6380
 epoch: 72, train_loss: 0.6378, test_loss: 0.9254, test_f1: 0.6369
 epoch: 73, train_loss: 0.6530, test_loss: 0.9073, test_f1: 0.6636
 epoch: 74, train_loss: 0.6290, test_loss: 0.9322, test_f1: 0.6786
 epoch: 75, train_loss: 0.6472, test_loss: 0.9960, test_f1: 0.6156
 epoch: 76, train_loss: 0.6291, test_loss: 0.9068, test_f1: 0.6691
 epoch: 77, train_loss: 0.6411, test_loss: 1.0185, test_f1: 0.6665
 epoch: 78, train_loss: 0.6377, test_loss: 1.0980, test_f1: 0.6676
 epoch: 79, train_loss: 0.6336, test_loss: 1.0258, test_f1: 0.6116
 epoch: 80, train_loss: 0.6271, test_loss: 1.0350, test_f1: 0.6463
 epoch: 81, train_loss: 0.6318, test_loss: 1.0111, test_f1: 0.6390
 epoch: 82, train_loss: 0.6396, test_loss: 0.9816, test_f1: 0.6354
 epoch: 83, train_loss: 0.6350, test_loss: 0.9538, test_f1: 0.6499
 epoch: 84, train_loss: 0.6501, test_loss: 0.9037, test_f1: 0.6579
 epoch: 85, train_loss: 0.6322, test_loss: 0.9838, test_f1: 0.6544
 epoch: 86, train_loss: 0.6173, test_loss: 0.9462, test_f1: 0.6753
 epoch: 87, train_loss: 0.6109, test_loss: 0.9844, test_f1: 0.6383
 epoch: 88, train_loss: 0.5980, test_loss: 0.9938, test_f1: 0.6594
 epoch: 89, train_loss: 0.6193, test_loss: 0.9654, test_f1: 0.6387
 epoch: 90, train_loss: 0.6147, test_loss: 0.9651, test_f1: 0.6875
 epoch: 91, train_loss: 0.5843, test_loss: 0.9884, test_f1: 0.6528
 epoch: 92, train_loss: 0.6127, test_loss: 0.8353, test_f1: 0.6732
 epoch: 93, train_loss: 0.6182, test_loss: 0.8846, test_f1: 0.6269
 epoch: 94, train_loss: 0.6191, test_loss: 0.9473, test_f1: 0.6613
 epoch: 95, train_loss: 0.6185, test_loss: 0.9143, test_f1: 0.6280
 epoch: 96, train_loss: 0.6003, test_loss: 0.9144, test_f1: 0.6711
 epoch: 97, train_loss: 0.6040, test_loss: 0.9517, test_f1: 0.6713
 epoch: 98, train_loss: 0.6035, test_loss: 0.9548, test_f1: 0.6606
 epoch: 99, train_loss: 0.6064, test_loss: 1.0288, test_f1: 0.6532
##################ITERATION #4 ****************************************
 epoch: 0, train_loss: 1.2038, test_loss: 1.2246, test_f1: 0.3848
 epoch: 1, train_loss: 1.0357, test_loss: 1.0130, test_f1: 0.4792
 epoch: 2, train_loss: 0.9950, test_loss: 0.9790, test_f1: 0.4904
 epoch: 3, train_loss: 0.9757, test_loss: 1.0836, test_f1: 0.4389
 epoch: 4, train_loss: 0.9646, test_loss: 0.9564, test_f1: 0.4701
 epoch: 5, train_loss: 0.9545, test_loss: 0.9484, test_f1: 0.5299
 epoch: 6, train_loss: 0.9444, test_loss: 0.9806, test_f1: 0.4828
 epoch: 7, train_loss: 0.9300, test_loss: 0.9635, test_f1: 0.5244
 epoch: 8, train_loss: 0.9326, test_loss: 0.9535, test_f1: 0.4782
 epoch: 9, train_loss: 0.9366, test_loss: 0.9797, test_f1: 0.5047
 epoch: 10, train_loss: 0.9170, test_loss: 0.9380, test_f1: 0.5125
 epoch: 11, train_loss: 0.9093, test_loss: 0.9936, test_f1: 0.5089
 epoch: 12, train_loss: 0.9207, test_loss: 1.0265, test_f1: 0.4785
 epoch: 13, train_loss: 0.8916, test_loss: 0.9340, test_f1: 0.5366
 epoch: 14, train_loss: 0.8808, test_loss: 0.9700, test_f1: 0.5101
 epoch: 15, train_loss: 0.9008, test_loss: 0.9058, test_f1: 0.5496
 epoch: 16, train_loss: 0.8999, test_loss: 0.9647, test_f1: 0.5097
 epoch: 17, train_loss: 0.8764, test_loss: 0.8708, test_f1: 0.4977
 epoch: 18, train_loss: 0.8833, test_loss: 0.8920, test_f1: 0.5496
 epoch: 19, train_loss: 0.8803, test_loss: 0.9095, test_f1: 0.5470
 epoch: 20, train_loss: 0.8770, test_loss: 0.8937, test_f1: 0.5318
 epoch: 21, train_loss: 0.8576, test_loss: 0.9466, test_f1: 0.5314
 epoch: 22, train_loss: 0.8538, test_loss: 0.9596, test_f1: 0.5455
 epoch: 23, train_loss: 0.8597, test_loss: 0.8745, test_f1: 0.5281
 epoch: 24, train_loss: 0.8593, test_loss: 0.8872, test_f1: 0.5220
 epoch: 25, train_loss: 0.8357, test_loss: 1.0434, test_f1: 0.5238
 epoch: 26, train_loss: 0.8443, test_loss: 0.9700, test_f1: 0.5072
 epoch: 27, train_loss: 0.8320, test_loss: 1.0879, test_f1: 0.5391
 epoch: 28, train_loss: 0.8335, test_loss: 0.9574, test_f1: 0.5302
 epoch: 29, train_loss: 0.8150, test_loss: 1.0289, test_f1: 0.5183
 epoch: 30, train_loss: 0.8358, test_loss: 0.9422, test_f1: 0.5691
 epoch: 31, train_loss: 0.8043, test_loss: 0.9456, test_f1: 0.6008
 epoch: 32, train_loss: 0.7917, test_loss: 0.9885, test_f1: 0.5342
 epoch: 33, train_loss: 0.8025, test_loss: 1.0694, test_f1: 0.4836
 epoch: 34, train_loss: 0.8144, test_loss: 1.0024, test_f1: 0.5606
 epoch: 35, train_loss: 0.8211, test_loss: 1.0748, test_f1: 0.5142
 epoch: 36, train_loss: 0.7824, test_loss: 0.9673, test_f1: 0.5532
 epoch: 37, train_loss: 0.7881, test_loss: 0.9947, test_f1: 0.5547
 epoch: 38, train_loss: 0.7949, test_loss: 1.1438, test_f1: 0.5461
 epoch: 39, train_loss: 0.7795, test_loss: 1.0090, test_f1: 0.5717
 epoch: 40, train_loss: 0.7763, test_loss: 0.9251, test_f1: 0.5836
 epoch: 41, train_loss: 0.7741, test_loss: 1.0121, test_f1: 0.5731
 epoch: 42, train_loss: 0.7713, test_loss: 0.9281, test_f1: 0.5835
 epoch: 43, train_loss: 0.7817, test_loss: 1.1711, test_f1: 0.4802
 epoch: 44, train_loss: 0.7746, test_loss: 0.9538, test_f1: 0.6166
 epoch: 45, train_loss: 0.7693, test_loss: 0.9656, test_f1: 0.5729
 epoch: 46, train_loss: 0.7678, test_loss: 0.9413, test_f1: 0.5720
 epoch: 47, train_loss: 0.7486, test_loss: 0.9281, test_f1: 0.5921
 epoch: 48, train_loss: 0.7452, test_loss: 0.9774, test_f1: 0.5690
 epoch: 49, train_loss: 0.7407, test_loss: 0.9802, test_f1: 0.6146
 epoch: 50, train_loss: 0.7573, test_loss: 0.9579, test_f1: 0.5623
 epoch: 51, train_loss: 0.7159, test_loss: 0.9991, test_f1: 0.5845
 epoch: 52, train_loss: 0.6925, test_loss: 0.9981, test_f1: 0.6033
 epoch: 53, train_loss: 0.6934, test_loss: 0.9513, test_f1: 0.5968
 epoch: 54, train_loss: 0.6898, test_loss: 1.0162, test_f1: 0.5988
 epoch: 55, train_loss: 0.6848, test_loss: 1.0287, test_f1: 0.5904
 epoch: 56, train_loss: 0.6845, test_loss: 0.9962, test_f1: 0.6347
 epoch: 57, train_loss: 0.6717, test_loss: 0.9765, test_f1: 0.6510
 epoch: 58, train_loss: 0.6894, test_loss: 1.0087, test_f1: 0.5922
 epoch: 59, train_loss: 0.6896, test_loss: 1.0385, test_f1: 0.6223
 epoch: 60, train_loss: 0.6733, test_loss: 1.0247, test_f1: 0.6142
 epoch: 61, train_loss: 0.6687, test_loss: 1.0016, test_f1: 0.6368
 epoch: 62, train_loss: 0.6609, test_loss: 1.0404, test_f1: 0.6153
 epoch: 63, train_loss: 0.6576, test_loss: 0.9569, test_f1: 0.6050
 epoch: 64, train_loss: 0.6850, test_loss: 0.9794, test_f1: 0.5988
 epoch: 65, train_loss: 0.6711, test_loss: 0.9154, test_f1: 0.6239
 epoch: 66, train_loss: 0.6716, test_loss: 0.9206, test_f1: 0.6267
 epoch: 67, train_loss: 0.6732, test_loss: 1.0629, test_f1: 0.6279
 epoch: 68, train_loss: 0.6501, test_loss: 1.0274, test_f1: 0.6322
 epoch: 69, train_loss: 0.6427, test_loss: 1.0156, test_f1: 0.6317
 epoch: 70, train_loss: 0.6412, test_loss: 0.9508, test_f1: 0.6032
 epoch: 71, train_loss: 0.6527, test_loss: 0.9849, test_f1: 0.6404
 epoch: 72, train_loss: 0.6487, test_loss: 1.0622, test_f1: 0.6132
 epoch: 73, train_loss: 0.6408, test_loss: 1.0210, test_f1: 0.6440
 epoch: 74, train_loss: 0.6491, test_loss: 0.9992, test_f1: 0.6217
 epoch: 75, train_loss: 0.6386, test_loss: 1.0649, test_f1: 0.6343
 epoch: 76, train_loss: 0.6488, test_loss: 1.0110, test_f1: 0.6509
 epoch: 77, train_loss: 0.6272, test_loss: 1.0844, test_f1: 0.6456
 epoch: 78, train_loss: 0.6496, test_loss: 1.0790, test_f1: 0.6312
 epoch: 79, train_loss: 0.6365, test_loss: 1.0562, test_f1: 0.6373
 epoch: 80, train_loss: 0.6392, test_loss: 1.1477, test_f1: 0.6078
 epoch: 81, train_loss: 0.6382, test_loss: 1.1816, test_f1: 0.6302
 epoch: 82, train_loss: 0.6311, test_loss: 1.1417, test_f1: 0.6440
 epoch: 83, train_loss: 0.6342, test_loss: 1.0916, test_f1: 0.6086
 epoch: 84, train_loss: 0.6369, test_loss: 1.0862, test_f1: 0.6342
 epoch: 85, train_loss: 0.6096, test_loss: 1.1834, test_f1: 0.6065
 epoch: 86, train_loss: 0.6071, test_loss: 1.0569, test_f1: 0.6330
 epoch: 87, train_loss: 0.6204, test_loss: 1.0535, test_f1: 0.6336
 epoch: 88, train_loss: 0.6230, test_loss: 1.1132, test_f1: 0.6083
 epoch: 89, train_loss: 0.6145, test_loss: 1.0556, test_f1: 0.6290
 epoch: 90, train_loss: 0.6024, test_loss: 1.0571, test_f1: 0.6379
 epoch: 91, train_loss: 0.6162, test_loss: 0.9850, test_f1: 0.6190
 epoch: 92, train_loss: 0.6317, test_loss: 1.0835, test_f1: 0.6190
 epoch: 93, train_loss: 0.6089, test_loss: 1.0483, test_f1: 0.6230
 epoch: 94, train_loss: 0.6087, test_loss: 1.0629, test_f1: 0.6610
 epoch: 95, train_loss: 0.5969, test_loss: 1.1538, test_f1: 0.6660
 epoch: 96, train_loss: 0.6070, test_loss: 1.0928, test_f1: 0.6649
 epoch: 97, train_loss: 0.6096, test_loss: 1.0952, test_f1: 0.6588
 epoch: 98, train_loss: 0.6029, test_loss: 1.0521, test_f1: 0.6344
 epoch: 99, train_loss: 0.6150, test_loss: 1.0956, test_f1: 0.6548
##################ITERATION #5 ****************************************
 epoch: 0, train_loss: 1.2153, test_loss: 1.0789, test_f1: 0.4679
 epoch: 1, train_loss: 1.0505, test_loss: 1.0865, test_f1: 0.4460
 epoch: 2, train_loss: 1.0343, test_loss: 1.0559, test_f1: 0.3837
 epoch: 3, train_loss: 1.0169, test_loss: 0.9901, test_f1: 0.4776
 epoch: 4, train_loss: 1.0025, test_loss: 1.0341, test_f1: 0.4806
 epoch: 5, train_loss: 0.9931, test_loss: 1.0224, test_f1: 0.5068
 epoch: 6, train_loss: 0.9774, test_loss: 1.0116, test_f1: 0.4145
 epoch: 7, train_loss: 0.9764, test_loss: 1.0307, test_f1: 0.4944
 epoch: 8, train_loss: 0.9771, test_loss: 0.9542, test_f1: 0.5062
 epoch: 9, train_loss: 0.9555, test_loss: 0.9911, test_f1: 0.4947
 epoch: 10, train_loss: 0.9434, test_loss: 0.9696, test_f1: 0.4906
 epoch: 11, train_loss: 0.9362, test_loss: 0.9508, test_f1: 0.5637
 epoch: 12, train_loss: 0.9311, test_loss: 0.9753, test_f1: 0.5086
 epoch: 13, train_loss: 0.9199, test_loss: 0.9436, test_f1: 0.4809
 epoch: 14, train_loss: 0.9281, test_loss: 0.8953, test_f1: 0.5086
 epoch: 15, train_loss: 0.9147, test_loss: 0.9664, test_f1: 0.4821
 epoch: 16, train_loss: 0.9206, test_loss: 0.9888, test_f1: 0.4934
 epoch: 17, train_loss: 0.9261, test_loss: 0.9727, test_f1: 0.4840
 epoch: 18, train_loss: 0.9073, test_loss: 1.0206, test_f1: 0.4737
 epoch: 19, train_loss: 0.9000, test_loss: 1.0061, test_f1: 0.4958
 epoch: 20, train_loss: 0.9209, test_loss: 0.9684, test_f1: 0.4669
 epoch: 21, train_loss: 0.9112, test_loss: 0.9502, test_f1: 0.5104
 epoch: 22, train_loss: 0.8932, test_loss: 0.8810, test_f1: 0.5658
 epoch: 23, train_loss: 0.8842, test_loss: 0.9316, test_f1: 0.5481
 epoch: 24, train_loss: 0.8820, test_loss: 0.9513, test_f1: 0.5225
 epoch: 25, train_loss: 0.8688, test_loss: 0.9394, test_f1: 0.4906
 epoch: 26, train_loss: 0.8642, test_loss: 0.9524, test_f1: 0.5147
 epoch: 27, train_loss: 0.8682, test_loss: 0.9075, test_f1: 0.5229
 epoch: 28, train_loss: 0.8684, test_loss: 0.8944, test_f1: 0.6016
 epoch: 29, train_loss: 0.8554, test_loss: 0.8849, test_f1: 0.5436
 epoch: 30, train_loss: 0.8572, test_loss: 1.1909, test_f1: 0.4426
 epoch: 31, train_loss: 0.8656, test_loss: 0.9315, test_f1: 0.5278
 epoch: 32, train_loss: 0.8477, test_loss: 0.8972, test_f1: 0.5321
 epoch: 33, train_loss: 0.8335, test_loss: 0.9129, test_f1: 0.5592
 epoch: 34, train_loss: 0.8550, test_loss: 0.9132, test_f1: 0.5457
 epoch: 35, train_loss: 0.8455, test_loss: 0.9163, test_f1: 0.5510
 epoch: 36, train_loss: 0.8347, test_loss: 0.9578, test_f1: 0.5100
 epoch: 37, train_loss: 0.8225, test_loss: 0.9286, test_f1: 0.5544
 epoch: 38, train_loss: 0.8217, test_loss: 0.9455, test_f1: 0.5308
 epoch: 39, train_loss: 0.8238, test_loss: 0.8930, test_f1: 0.5853
 epoch: 40, train_loss: 0.8144, test_loss: 0.8879, test_f1: 0.5379
 epoch: 41, train_loss: 0.8245, test_loss: 0.9148, test_f1: 0.5717
 epoch: 42, train_loss: 0.7970, test_loss: 0.9201, test_f1: 0.5323
 epoch: 43, train_loss: 0.7994, test_loss: 0.9482, test_f1: 0.5554
 epoch: 44, train_loss: 0.7840, test_loss: 0.8970, test_f1: 0.5438
 epoch: 45, train_loss: 0.7821, test_loss: 0.9460, test_f1: 0.5215
 epoch: 46, train_loss: 0.7891, test_loss: 0.9145, test_f1: 0.6241
 epoch: 47, train_loss: 0.7986, test_loss: 0.8802, test_f1: 0.5761
 epoch: 48, train_loss: 0.7903, test_loss: 0.9678, test_f1: 0.5556
 epoch: 49, train_loss: 0.7894, test_loss: 0.8823, test_f1: 0.5587
 epoch: 50, train_loss: 0.7870, test_loss: 0.8377, test_f1: 0.6045
 epoch: 51, train_loss: 0.7611, test_loss: 0.8526, test_f1: 0.6283
 epoch: 52, train_loss: 0.7463, test_loss: 0.8697, test_f1: 0.6224
 epoch: 53, train_loss: 0.7400, test_loss: 0.8844, test_f1: 0.6026
 epoch: 54, train_loss: 0.7443, test_loss: 0.8971, test_f1: 0.6033
 epoch: 55, train_loss: 0.7399, test_loss: 0.8353, test_f1: 0.6180
 epoch: 56, train_loss: 0.7342, test_loss: 0.8401, test_f1: 0.6272
 epoch: 57, train_loss: 0.7499, test_loss: 0.8827, test_f1: 0.6166
 epoch: 58, train_loss: 0.7211, test_loss: 0.8542, test_f1: 0.5792
 epoch: 59, train_loss: 0.7206, test_loss: 0.8466, test_f1: 0.6344
 epoch: 60, train_loss: 0.7272, test_loss: 0.8633, test_f1: 0.6087
 epoch: 61, train_loss: 0.7133, test_loss: 0.9041, test_f1: 0.6344
 epoch: 62, train_loss: 0.7158, test_loss: 0.9005, test_f1: 0.6428
 epoch: 63, train_loss: 0.7204, test_loss: 0.8350, test_f1: 0.6438
 epoch: 64, train_loss: 0.6993, test_loss: 0.8518, test_f1: 0.6433
 epoch: 65, train_loss: 0.7116, test_loss: 0.8450, test_f1: 0.6401
 epoch: 66, train_loss: 0.6836, test_loss: 0.9149, test_f1: 0.5836
 epoch: 67, train_loss: 0.7003, test_loss: 0.9772, test_f1: 0.6045
 epoch: 68, train_loss: 0.7076, test_loss: 0.8711, test_f1: 0.6316
 epoch: 69, train_loss: 0.7040, test_loss: 0.9582, test_f1: 0.5991
 epoch: 70, train_loss: 0.7083, test_loss: 0.8470, test_f1: 0.5890
 epoch: 71, train_loss: 0.6939, test_loss: 0.8611, test_f1: 0.5919
 epoch: 72, train_loss: 0.6984, test_loss: 0.8587, test_f1: 0.6600
 epoch: 73, train_loss: 0.6917, test_loss: 0.8489, test_f1: 0.6144
 epoch: 74, train_loss: 0.6983, test_loss: 0.9023, test_f1: 0.6437
 epoch: 75, train_loss: 0.6944, test_loss: 0.9115, test_f1: 0.6555
 epoch: 76, train_loss: 0.7001, test_loss: 0.8392, test_f1: 0.6112
 epoch: 77, train_loss: 0.6825, test_loss: 0.8673, test_f1: 0.6369
 epoch: 78, train_loss: 0.6895, test_loss: 0.9877, test_f1: 0.6273
 epoch: 79, train_loss: 0.6809, test_loss: 0.9620, test_f1: 0.6441
 epoch: 80, train_loss: 0.6794, test_loss: 0.9086, test_f1: 0.6296
 epoch: 81, train_loss: 0.6830, test_loss: 0.9066, test_f1: 0.6005
 epoch: 82, train_loss: 0.6934, test_loss: 0.9173, test_f1: 0.6090
 epoch: 83, train_loss: 0.6830, test_loss: 0.9703, test_f1: 0.6445
 epoch: 84, train_loss: 0.6743, test_loss: 0.9552, test_f1: 0.5957
 epoch: 85, train_loss: 0.6710, test_loss: 0.8925, test_f1: 0.6353
 epoch: 86, train_loss: 0.6670, test_loss: 0.9531, test_f1: 0.6460
 epoch: 87, train_loss: 0.6757, test_loss: 1.0705, test_f1: 0.6087
 epoch: 88, train_loss: 0.6787, test_loss: 0.9360, test_f1: 0.6368
 epoch: 89, train_loss: 0.6669, test_loss: 0.9764, test_f1: 0.6328
 epoch: 90, train_loss: 0.6768, test_loss: 0.9390, test_f1: 0.6130
 epoch: 91, train_loss: 0.6698, test_loss: 0.9405, test_f1: 0.6365
 epoch: 92, train_loss: 0.6843, test_loss: 0.9189, test_f1: 0.6228
 epoch: 93, train_loss: 0.6664, test_loss: 0.9159, test_f1: 0.6489
 epoch: 94, train_loss: 0.6488, test_loss: 0.9390, test_f1: 0.6403
 epoch: 95, train_loss: 0.6541, test_loss: 0.9465, test_f1: 0.6426
 epoch: 96, train_loss: 0.6800, test_loss: 1.0244, test_f1: 0.6166
 epoch: 97, train_loss: 0.6357, test_loss: 1.0491, test_f1: 0.6335
 epoch: 98, train_loss: 0.6560, test_loss: 0.9267, test_f1: 0.6326
 epoch: 99, train_loss: 0.6529, test_loss: 0.9882, test_f1: 0.6290
##################ITERATION #6 ****************************************
 epoch: 0, train_loss: 1.1812, test_loss: 1.0784, test_f1: 0.4614
 epoch: 1, train_loss: 1.0313, test_loss: 0.9803, test_f1: 0.4472
 epoch: 2, train_loss: 0.9845, test_loss: 1.0486, test_f1: 0.4525
 epoch: 3, train_loss: 0.9576, test_loss: 1.0369, test_f1: 0.4443
 epoch: 4, train_loss: 0.9497, test_loss: 0.9782, test_f1: 0.4943
 epoch: 5, train_loss: 0.9318, test_loss: 0.9779, test_f1: 0.4962
 epoch: 6, train_loss: 0.9365, test_loss: 1.0144, test_f1: 0.4712
 epoch: 7, train_loss: 0.9279, test_loss: 0.9497, test_f1: 0.5020
 epoch: 8, train_loss: 0.9242, test_loss: 0.9157, test_f1: 0.5419
 epoch: 9, train_loss: 0.9124, test_loss: 1.0525, test_f1: 0.5114
 epoch: 10, train_loss: 0.9191, test_loss: 0.9750, test_f1: 0.5304
 epoch: 11, train_loss: 0.9006, test_loss: 1.0735, test_f1: 0.4499
 epoch: 12, train_loss: 0.8904, test_loss: 0.9932, test_f1: 0.5367
 epoch: 13, train_loss: 0.9131, test_loss: 0.9315, test_f1: 0.4865
 epoch: 14, train_loss: 0.8791, test_loss: 0.9663, test_f1: 0.5043
 epoch: 15, train_loss: 0.8743, test_loss: 0.9532, test_f1: 0.5367
 epoch: 16, train_loss: 0.8553, test_loss: 0.8322, test_f1: 0.5362
 epoch: 17, train_loss: 0.8654, test_loss: 0.9906, test_f1: 0.4845
 epoch: 18, train_loss: 0.8548, test_loss: 0.9103, test_f1: 0.5111
 epoch: 19, train_loss: 0.8704, test_loss: 0.8635, test_f1: 0.5651
 epoch: 20, train_loss: 0.8298, test_loss: 0.8402, test_f1: 0.5261
 epoch: 21, train_loss: 0.8436, test_loss: 1.0152, test_f1: 0.4924
 epoch: 22, train_loss: 0.8597, test_loss: 0.9107, test_f1: 0.5243
 epoch: 23, train_loss: 0.8496, test_loss: 0.9107, test_f1: 0.5558
 epoch: 24, train_loss: 0.8341, test_loss: 0.9147, test_f1: 0.5065
 epoch: 25, train_loss: 0.8250, test_loss: 0.8850, test_f1: 0.5824
 epoch: 26, train_loss: 0.8482, test_loss: 0.9172, test_f1: 0.5080
 epoch: 27, train_loss: 0.8248, test_loss: 0.8941, test_f1: 0.5541
 epoch: 28, train_loss: 0.8216, test_loss: 0.9592, test_f1: 0.5075
 epoch: 29, train_loss: 0.8076, test_loss: 0.8881, test_f1: 0.5284
 epoch: 30, train_loss: 0.8048, test_loss: 0.9047, test_f1: 0.5789
 epoch: 31, train_loss: 0.7930, test_loss: 0.8564, test_f1: 0.5536
 epoch: 32, train_loss: 0.8086, test_loss: 0.9023, test_f1: 0.5850
 epoch: 33, train_loss: 0.7963, test_loss: 1.0939, test_f1: 0.5310
 epoch: 34, train_loss: 0.7883, test_loss: 0.8895, test_f1: 0.6124
 epoch: 35, train_loss: 0.7896, test_loss: 1.0240, test_f1: 0.5884
 epoch: 36, train_loss: 0.7821, test_loss: 1.0419, test_f1: 0.5437
 epoch: 37, train_loss: 0.7865, test_loss: 0.9115, test_f1: 0.5535
 epoch: 38, train_loss: 0.7761, test_loss: 0.9460, test_f1: 0.6008
 epoch: 39, train_loss: 0.7654, test_loss: 0.9628, test_f1: 0.5778
 epoch: 40, train_loss: 0.7757, test_loss: 0.8806, test_f1: 0.5895
 epoch: 41, train_loss: 0.7690, test_loss: 0.9809, test_f1: 0.5425
 epoch: 42, train_loss: 0.7722, test_loss: 0.8946, test_f1: 0.5660
 epoch: 43, train_loss: 0.7598, test_loss: 0.8786, test_f1: 0.5995
 epoch: 44, train_loss: 0.7657, test_loss: 0.9235, test_f1: 0.5849
 epoch: 45, train_loss: 0.7648, test_loss: 0.9774, test_f1: 0.6068
 epoch: 46, train_loss: 0.7534, test_loss: 0.9270, test_f1: 0.6113
 epoch: 47, train_loss: 0.7572, test_loss: 0.8982, test_f1: 0.6126
 epoch: 48, train_loss: 0.7680, test_loss: 0.9132, test_f1: 0.5806
 epoch: 49, train_loss: 0.7444, test_loss: 0.9494, test_f1: 0.6303
 epoch: 50, train_loss: 0.7341, test_loss: 0.9413, test_f1: 0.5825
 epoch: 51, train_loss: 0.7257, test_loss: 0.9571, test_f1: 0.6264
 epoch: 52, train_loss: 0.7096, test_loss: 0.9429, test_f1: 0.6164
 epoch: 53, train_loss: 0.7185, test_loss: 0.9497, test_f1: 0.6308
 epoch: 54, train_loss: 0.7037, test_loss: 0.9320, test_f1: 0.6499
 epoch: 55, train_loss: 0.7013, test_loss: 0.9527, test_f1: 0.6076
 epoch: 56, train_loss: 0.6998, test_loss: 0.8931, test_f1: 0.6768
 epoch: 57, train_loss: 0.6930, test_loss: 0.9420, test_f1: 0.6123
 epoch: 58, train_loss: 0.6896, test_loss: 0.9368, test_f1: 0.6604
 epoch: 59, train_loss: 0.6906, test_loss: 0.9130, test_f1: 0.6289
 epoch: 60, train_loss: 0.6888, test_loss: 0.9768, test_f1: 0.6344
 epoch: 61, train_loss: 0.6847, test_loss: 0.9660, test_f1: 0.6364
 epoch: 62, train_loss: 0.6865, test_loss: 0.9897, test_f1: 0.6390
 epoch: 63, train_loss: 0.6836, test_loss: 0.9598, test_f1: 0.6219
 epoch: 64, train_loss: 0.6879, test_loss: 0.9046, test_f1: 0.6682
 epoch: 65, train_loss: 0.6775, test_loss: 0.9133, test_f1: 0.6282
 epoch: 66, train_loss: 0.6659, test_loss: 0.9535, test_f1: 0.6313
 epoch: 67, train_loss: 0.6606, test_loss: 0.9258, test_f1: 0.6558
 epoch: 68, train_loss: 0.6714, test_loss: 0.8787, test_f1: 0.6614
 epoch: 69, train_loss: 0.6705, test_loss: 0.9240, test_f1: 0.6390
 epoch: 70, train_loss: 0.6749, test_loss: 0.9425, test_f1: 0.6407
 epoch: 71, train_loss: 0.6570, test_loss: 0.9035, test_f1: 0.6744
 epoch: 72, train_loss: 0.6801, test_loss: 0.9874, test_f1: 0.6234
 epoch: 73, train_loss: 0.6624, test_loss: 0.9404, test_f1: 0.6349
 epoch: 74, train_loss: 0.6750, test_loss: 0.9913, test_f1: 0.6317
 epoch: 75, train_loss: 0.6459, test_loss: 1.0018, test_f1: 0.6025
 epoch: 76, train_loss: 0.6535, test_loss: 0.9238, test_f1: 0.6589
 epoch: 77, train_loss: 0.6484, test_loss: 0.9933, test_f1: 0.6349
 epoch: 78, train_loss: 0.6369, test_loss: 0.9268, test_f1: 0.6413
 epoch: 79, train_loss: 0.6657, test_loss: 0.9792, test_f1: 0.6367
 epoch: 80, train_loss: 0.6346, test_loss: 0.9751, test_f1: 0.6562
 epoch: 81, train_loss: 0.6459, test_loss: 1.1200, test_f1: 0.6042
 epoch: 82, train_loss: 0.6413, test_loss: 1.0326, test_f1: 0.6336
 epoch: 83, train_loss: 0.6489, test_loss: 0.9806, test_f1: 0.6616
 epoch: 84, train_loss: 0.6174, test_loss: 0.9213, test_f1: 0.6342
 epoch: 85, train_loss: 0.6570, test_loss: 0.9729, test_f1: 0.6229
 epoch: 86, train_loss: 0.6367, test_loss: 0.9999, test_f1: 0.6338
 epoch: 87, train_loss: 0.6296, test_loss: 0.9706, test_f1: 0.6128
 epoch: 88, train_loss: 0.6277, test_loss: 1.0363, test_f1: 0.6141
 epoch: 89, train_loss: 0.6178, test_loss: 1.0601, test_f1: 0.6135
 epoch: 90, train_loss: 0.6343, test_loss: 0.9991, test_f1: 0.6454
 epoch: 91, train_loss: 0.6253, test_loss: 0.9833, test_f1: 0.6373
 epoch: 92, train_loss: 0.6466, test_loss: 0.8947, test_f1: 0.6485
 epoch: 93, train_loss: 0.6195, test_loss: 0.9731, test_f1: 0.6550
 epoch: 94, train_loss: 0.6283, test_loss: 1.0191, test_f1: 0.6327
 epoch: 95, train_loss: 0.6236, test_loss: 0.9966, test_f1: 0.6341
 epoch: 96, train_loss: 0.6258, test_loss: 0.9386, test_f1: 0.6254
 epoch: 97, train_loss: 0.6172, test_loss: 0.9307, test_f1: 0.6824
 epoch: 98, train_loss: 0.6169, test_loss: 1.0287, test_f1: 0.6505
 epoch: 99, train_loss: 0.6186, test_loss: 1.0413, test_f1: 0.6279
##################ITERATION #7 ****************************************
 epoch: 0, train_loss: 1.1923, test_loss: 1.0889, test_f1: 0.4474
 epoch: 1, train_loss: 1.0490, test_loss: 1.0381, test_f1: 0.5120
 epoch: 2, train_loss: 1.0234, test_loss: 1.0381, test_f1: 0.4958
 epoch: 3, train_loss: 0.9927, test_loss: 1.0167, test_f1: 0.5005
 epoch: 4, train_loss: 0.9905, test_loss: 1.0366, test_f1: 0.4620
 epoch: 5, train_loss: 0.9707, test_loss: 0.9738, test_f1: 0.4976
 epoch: 6, train_loss: 0.9819, test_loss: 1.0027, test_f1: 0.5101
 epoch: 7, train_loss: 0.9567, test_loss: 0.9641, test_f1: 0.4943
 epoch: 8, train_loss: 0.9516, test_loss: 0.9491, test_f1: 0.4795
 epoch: 9, train_loss: 0.9393, test_loss: 0.9914, test_f1: 0.4890
 epoch: 10, train_loss: 0.9419, test_loss: 0.9581, test_f1: 0.5077
 epoch: 11, train_loss: 0.9319, test_loss: 0.9650, test_f1: 0.5207
 epoch: 12, train_loss: 0.9318, test_loss: 0.9674, test_f1: 0.5118
 epoch: 13, train_loss: 0.9153, test_loss: 0.9743, test_f1: 0.4981
 epoch: 14, train_loss: 0.9165, test_loss: 0.9700, test_f1: 0.5032
 epoch: 15, train_loss: 0.9018, test_loss: 0.9366, test_f1: 0.5177
 epoch: 16, train_loss: 0.8906, test_loss: 1.3245, test_f1: 0.4172
 epoch: 17, train_loss: 0.9118, test_loss: 0.9244, test_f1: 0.5224
 epoch: 18, train_loss: 0.8995, test_loss: 1.0115, test_f1: 0.4915
 epoch: 19, train_loss: 0.8948, test_loss: 0.9589, test_f1: 0.5105
 epoch: 20, train_loss: 0.8883, test_loss: 0.9165, test_f1: 0.5472
 epoch: 21, train_loss: 0.8783, test_loss: 0.9406, test_f1: 0.5024
 epoch: 22, train_loss: 0.8796, test_loss: 0.9470, test_f1: 0.5525
 epoch: 23, train_loss: 0.8867, test_loss: 0.9064, test_f1: 0.5754
 epoch: 24, train_loss: 0.8645, test_loss: 1.1241, test_f1: 0.5026
 epoch: 25, train_loss: 0.8491, test_loss: 0.9495, test_f1: 0.5791
 epoch: 26, train_loss: 0.8699, test_loss: 0.9238, test_f1: 0.5376
 epoch: 27, train_loss: 0.8582, test_loss: 0.9569, test_f1: 0.5455
 epoch: 28, train_loss: 0.8571, test_loss: 0.9235, test_f1: 0.5674
 epoch: 29, train_loss: 0.8319, test_loss: 0.9221, test_f1: 0.5597
 epoch: 30, train_loss: 0.8227, test_loss: 0.9717, test_f1: 0.5903
 epoch: 31, train_loss: 0.8155, test_loss: 1.0433, test_f1: 0.5145
 epoch: 32, train_loss: 0.8406, test_loss: 0.9415, test_f1: 0.5635
 epoch: 33, train_loss: 0.8479, test_loss: 0.8996, test_f1: 0.5804
 epoch: 34, train_loss: 0.8257, test_loss: 0.9593, test_f1: 0.5390
 epoch: 35, train_loss: 0.8142, test_loss: 0.9377, test_f1: 0.5529
 epoch: 36, train_loss: 0.8318, test_loss: 0.9427, test_f1: 0.5887
 epoch: 37, train_loss: 0.8103, test_loss: 0.9757, test_f1: 0.5762
 epoch: 38, train_loss: 0.8160, test_loss: 0.9283, test_f1: 0.5656
 epoch: 39, train_loss: 0.8104, test_loss: 1.0014, test_f1: 0.5814
 epoch: 40, train_loss: 0.8077, test_loss: 0.8884, test_f1: 0.6055
 epoch: 41, train_loss: 0.7941, test_loss: 0.8609, test_f1: 0.6173
 epoch: 42, train_loss: 0.8002, test_loss: 0.9367, test_f1: 0.6024
 epoch: 43, train_loss: 0.7712, test_loss: 0.9899, test_f1: 0.5945
 epoch: 44, train_loss: 0.7730, test_loss: 0.9837, test_f1: 0.5915
 epoch: 45, train_loss: 0.7870, test_loss: 0.9766, test_f1: 0.5992
 epoch: 46, train_loss: 0.7812, test_loss: 0.9887, test_f1: 0.6258
 epoch: 47, train_loss: 0.7755, test_loss: 0.9947, test_f1: 0.6445
 epoch: 48, train_loss: 0.7890, test_loss: 0.9259, test_f1: 0.6114
 epoch: 49, train_loss: 0.7887, test_loss: 0.9091, test_f1: 0.5774
 epoch: 50, train_loss: 0.7631, test_loss: 0.8805, test_f1: 0.6140
 epoch: 51, train_loss: 0.7522, test_loss: 0.8750, test_f1: 0.6136
 epoch: 52, train_loss: 0.7263, test_loss: 0.8936, test_f1: 0.6225
 epoch: 53, train_loss: 0.7283, test_loss: 0.9049, test_f1: 0.6056
 epoch: 54, train_loss: 0.7145, test_loss: 0.9004, test_f1: 0.6276
 epoch: 55, train_loss: 0.7076, test_loss: 0.8732, test_f1: 0.6270
 epoch: 56, train_loss: 0.7226, test_loss: 0.8654, test_f1: 0.6470
 epoch: 57, train_loss: 0.7185, test_loss: 0.9343, test_f1: 0.5872
 epoch: 58, train_loss: 0.7056, test_loss: 0.9146, test_f1: 0.6145
 epoch: 59, train_loss: 0.7037, test_loss: 0.9133, test_f1: 0.6361
 epoch: 60, train_loss: 0.7167, test_loss: 0.8777, test_f1: 0.6405
 epoch: 61, train_loss: 0.7122, test_loss: 0.8860, test_f1: 0.6405
 epoch: 62, train_loss: 0.6975, test_loss: 0.9198, test_f1: 0.6478
 epoch: 63, train_loss: 0.6937, test_loss: 0.9155, test_f1: 0.6172
 epoch: 64, train_loss: 0.7050, test_loss: 0.9280, test_f1: 0.6073
 epoch: 65, train_loss: 0.6978, test_loss: 0.9077, test_f1: 0.6189
 epoch: 66, train_loss: 0.7097, test_loss: 0.9170, test_f1: 0.5935
 epoch: 67, train_loss: 0.7005, test_loss: 0.8858, test_f1: 0.6189
 epoch: 68, train_loss: 0.6743, test_loss: 0.9438, test_f1: 0.6035
 epoch: 69, train_loss: 0.7096, test_loss: 0.8931, test_f1: 0.6395
 epoch: 70, train_loss: 0.6860, test_loss: 0.9547, test_f1: 0.6444
 epoch: 71, train_loss: 0.6768, test_loss: 0.9292, test_f1: 0.6211
 epoch: 72, train_loss: 0.6812, test_loss: 0.9013, test_f1: 0.6271
 epoch: 73, train_loss: 0.6928, test_loss: 0.8865, test_f1: 0.6405
 epoch: 74, train_loss: 0.6862, test_loss: 0.9174, test_f1: 0.6327
 epoch: 75, train_loss: 0.6847, test_loss: 0.9577, test_f1: 0.6136
 epoch: 76, train_loss: 0.6815, test_loss: 0.9282, test_f1: 0.6391
 epoch: 77, train_loss: 0.6809, test_loss: 0.9320, test_f1: 0.6210
 epoch: 78, train_loss: 0.6802, test_loss: 0.9139, test_f1: 0.6271
 epoch: 79, train_loss: 0.6886, test_loss: 0.9828, test_f1: 0.6256
 epoch: 80, train_loss: 0.6787, test_loss: 0.9266, test_f1: 0.6321
 epoch: 81, train_loss: 0.6792, test_loss: 0.9522, test_f1: 0.6293
 epoch: 82, train_loss: 0.6558, test_loss: 0.9356, test_f1: 0.6217
 epoch: 83, train_loss: 0.6588, test_loss: 0.9871, test_f1: 0.6362
 epoch: 84, train_loss: 0.6638, test_loss: 0.9292, test_f1: 0.6200
 epoch: 85, train_loss: 0.6707, test_loss: 0.9472, test_f1: 0.6188
 epoch: 86, train_loss: 0.6606, test_loss: 0.9010, test_f1: 0.6487
 epoch: 87, train_loss: 0.6524, test_loss: 0.9376, test_f1: 0.6436
 epoch: 88, train_loss: 0.6761, test_loss: 0.8952, test_f1: 0.6447
 epoch: 89, train_loss: 0.6529, test_loss: 0.9195, test_f1: 0.6353
 epoch: 90, train_loss: 0.6522, test_loss: 0.8865, test_f1: 0.6437
 epoch: 91, train_loss: 0.6446, test_loss: 0.8804, test_f1: 0.6412
 epoch: 92, train_loss: 0.6356, test_loss: 0.9413, test_f1: 0.6282
 epoch: 93, train_loss: 0.6479, test_loss: 0.9486, test_f1: 0.6576
 epoch: 94, train_loss: 0.6312, test_loss: 0.9713, test_f1: 0.6034
 epoch: 95, train_loss: 0.6584, test_loss: 0.9456, test_f1: 0.6306
 epoch: 96, train_loss: 0.6373, test_loss: 0.9619, test_f1: 0.6398
 epoch: 97, train_loss: 0.6424, test_loss: 0.9639, test_f1: 0.6325
 epoch: 98, train_loss: 0.6341, test_loss: 0.9550, test_f1: 0.6396
 epoch: 99, train_loss: 0.6348, test_loss: 0.9586, test_f1: 0.6652
##################ITERATION #8 ****************************************
 epoch: 0, train_loss: 1.1713, test_loss: 1.0788, test_f1: 0.4448
 epoch: 1, train_loss: 1.0100, test_loss: 1.0230, test_f1: 0.4592
 epoch: 2, train_loss: 0.9961, test_loss: 1.0012, test_f1: 0.4797
 epoch: 3, train_loss: 0.9799, test_loss: 1.0202, test_f1: 0.5154
 epoch: 4, train_loss: 0.9607, test_loss: 1.0137, test_f1: 0.4698
 epoch: 5, train_loss: 0.9528, test_loss: 0.9785, test_f1: 0.4611
 epoch: 6, train_loss: 0.9482, test_loss: 0.9945, test_f1: 0.4657
 epoch: 7, train_loss: 0.9346, test_loss: 1.0298, test_f1: 0.4948
 epoch: 8, train_loss: 0.9441, test_loss: 0.9388, test_f1: 0.4797
 epoch: 9, train_loss: 0.9437, test_loss: 1.0225, test_f1: 0.4681
 epoch: 10, train_loss: 0.9411, test_loss: 0.9782, test_f1: 0.5075
 epoch: 11, train_loss: 0.9116, test_loss: 0.9462, test_f1: 0.5085
 epoch: 12, train_loss: 0.9006, test_loss: 0.9621, test_f1: 0.5212
 epoch: 13, train_loss: 0.9062, test_loss: 0.9251, test_f1: 0.4904
 epoch: 14, train_loss: 0.9039, test_loss: 0.9893, test_f1: 0.5333
 epoch: 15, train_loss: 0.8840, test_loss: 0.9720, test_f1: 0.5587
 epoch: 16, train_loss: 0.8801, test_loss: 0.9325, test_f1: 0.5002
 epoch: 17, train_loss: 0.8848, test_loss: 1.0214, test_f1: 0.4983
 epoch: 18, train_loss: 0.8615, test_loss: 1.0096, test_f1: 0.5290
 epoch: 19, train_loss: 0.8613, test_loss: 0.9434, test_f1: 0.5287
 epoch: 20, train_loss: 0.8488, test_loss: 0.9787, test_f1: 0.5243
 epoch: 21, train_loss: 0.8567, test_loss: 0.9779, test_f1: 0.5007
 epoch: 22, train_loss: 0.8455, test_loss: 0.9255, test_f1: 0.5395
 epoch: 23, train_loss: 0.8449, test_loss: 0.9827, test_f1: 0.5614
 epoch: 24, train_loss: 0.8350, test_loss: 0.9286, test_f1: 0.5887
 epoch: 25, train_loss: 0.8564, test_loss: 0.9552, test_f1: 0.5496
 epoch: 26, train_loss: 0.8469, test_loss: 0.9591, test_f1: 0.5722
 epoch: 27, train_loss: 0.8362, test_loss: 0.9584, test_f1: 0.5607
 epoch: 28, train_loss: 0.8300, test_loss: 0.9599, test_f1: 0.5668
 epoch: 29, train_loss: 0.8200, test_loss: 0.9373, test_f1: 0.5519
 epoch: 30, train_loss: 0.8121, test_loss: 0.9449, test_f1: 0.5780
 epoch: 31, train_loss: 0.8031, test_loss: 0.9672, test_f1: 0.5421
 epoch: 32, train_loss: 0.8151, test_loss: 0.9196, test_f1: 0.5559
 epoch: 33, train_loss: 0.7948, test_loss: 0.9485, test_f1: 0.5343
 epoch: 34, train_loss: 0.8056, test_loss: 0.9137, test_f1: 0.5868
 epoch: 35, train_loss: 0.7828, test_loss: 0.9784, test_f1: 0.5840
 epoch: 36, train_loss: 0.7940, test_loss: 0.9571, test_f1: 0.5808
 epoch: 37, train_loss: 0.7870, test_loss: 0.9736, test_f1: 0.5375
 epoch: 38, train_loss: 0.8235, test_loss: 0.9275, test_f1: 0.5995
 epoch: 39, train_loss: 0.7938, test_loss: 0.9140, test_f1: 0.5887
 epoch: 40, train_loss: 0.7909, test_loss: 0.9365, test_f1: 0.5655
 epoch: 41, train_loss: 0.7797, test_loss: 0.9785, test_f1: 0.5236
 epoch: 42, train_loss: 0.7737, test_loss: 0.9184, test_f1: 0.5396
 epoch: 43, train_loss: 0.7742, test_loss: 0.9204, test_f1: 0.5817
 epoch: 44, train_loss: 0.7806, test_loss: 0.9170, test_f1: 0.6007
 epoch: 45, train_loss: 0.7606, test_loss: 0.8562, test_f1: 0.6112
 epoch: 46, train_loss: 0.7570, test_loss: 0.9794, test_f1: 0.5565
 epoch: 47, train_loss: 0.7684, test_loss: 0.9448, test_f1: 0.6030
 epoch: 48, train_loss: 0.7577, test_loss: 0.9196, test_f1: 0.5617
 epoch: 49, train_loss: 0.7482, test_loss: 0.9252, test_f1: 0.5822
 epoch: 50, train_loss: 0.7482, test_loss: 0.9020, test_f1: 0.6149
 epoch: 51, train_loss: 0.7197, test_loss: 0.8890, test_f1: 0.6220
 epoch: 52, train_loss: 0.7073, test_loss: 0.8690, test_f1: 0.6000
 epoch: 53, train_loss: 0.6862, test_loss: 0.9043, test_f1: 0.6285
 epoch: 54, train_loss: 0.7021, test_loss: 0.9609, test_f1: 0.6321
 epoch: 55, train_loss: 0.6876, test_loss: 0.9425, test_f1: 0.6448
 epoch: 56, train_loss: 0.6833, test_loss: 0.9182, test_f1: 0.6551
 epoch: 57, train_loss: 0.6971, test_loss: 0.9539, test_f1: 0.6361
 epoch: 58, train_loss: 0.6803, test_loss: 0.9702, test_f1: 0.6581
 epoch: 59, train_loss: 0.6743, test_loss: 0.9361, test_f1: 0.6457
 epoch: 60, train_loss: 0.6849, test_loss: 0.9670, test_f1: 0.6266
 epoch: 61, train_loss: 0.6748, test_loss: 0.9498, test_f1: 0.6505
 epoch: 62, train_loss: 0.6712, test_loss: 0.9679, test_f1: 0.6063
 epoch: 63, train_loss: 0.6707, test_loss: 0.9190, test_f1: 0.6361
 epoch: 64, train_loss: 0.6697, test_loss: 0.9405, test_f1: 0.6271
 epoch: 65, train_loss: 0.6507, test_loss: 0.9532, test_f1: 0.6130
 epoch: 66, train_loss: 0.6618, test_loss: 1.0091, test_f1: 0.5990
 epoch: 67, train_loss: 0.6619, test_loss: 1.0506, test_f1: 0.5917
 epoch: 68, train_loss: 0.6591, test_loss: 0.9606, test_f1: 0.6135
 epoch: 69, train_loss: 0.6579, test_loss: 0.9738, test_f1: 0.6611
 epoch: 70, train_loss: 0.6429, test_loss: 0.9735, test_f1: 0.6208
 epoch: 71, train_loss: 0.6624, test_loss: 0.9349, test_f1: 0.6168
 epoch: 72, train_loss: 0.6512, test_loss: 0.9442, test_f1: 0.6134
 epoch: 73, train_loss: 0.6399, test_loss: 1.0088, test_f1: 0.6279
 epoch: 74, train_loss: 0.6423, test_loss: 1.0137, test_f1: 0.6513
 epoch: 75, train_loss: 0.6570, test_loss: 0.9484, test_f1: 0.6582
 epoch: 76, train_loss: 0.6318, test_loss: 1.0038, test_f1: 0.6221
 epoch: 77, train_loss: 0.6404, test_loss: 1.1273, test_f1: 0.6182
 epoch: 78, train_loss: 0.6431, test_loss: 1.0004, test_f1: 0.6344
 epoch: 79, train_loss: 0.6390, test_loss: 0.9662, test_f1: 0.6462
 epoch: 80, train_loss: 0.6495, test_loss: 1.0018, test_f1: 0.6300
 epoch: 81, train_loss: 0.6366, test_loss: 1.0154, test_f1: 0.6599
 epoch: 82, train_loss: 0.6317, test_loss: 1.0387, test_f1: 0.6451
 epoch: 83, train_loss: 0.6261, test_loss: 1.0737, test_f1: 0.6456
 epoch: 84, train_loss: 0.6105, test_loss: 1.0008, test_f1: 0.6341
 epoch: 85, train_loss: 0.6267, test_loss: 1.0477, test_f1: 0.6573
 epoch: 86, train_loss: 0.6289, test_loss: 1.0699, test_f1: 0.6484
 epoch: 87, train_loss: 0.6286, test_loss: 1.0604, test_f1: 0.6131
 epoch: 88, train_loss: 0.6312, test_loss: 1.0181, test_f1: 0.6373
 epoch: 89, train_loss: 0.6266, test_loss: 1.0291, test_f1: 0.6309
 epoch: 90, train_loss: 0.6120, test_loss: 1.0571, test_f1: 0.6322
 epoch: 91, train_loss: 0.6270, test_loss: 1.0403, test_f1: 0.6568
 epoch: 92, train_loss: 0.6180, test_loss: 1.0204, test_f1: 0.6335
 epoch: 93, train_loss: 0.6094, test_loss: 0.9590, test_f1: 0.6410
 epoch: 94, train_loss: 0.5869, test_loss: 1.0489, test_f1: 0.6259
 epoch: 95, train_loss: 0.6081, test_loss: 1.0447, test_f1: 0.6298
 epoch: 96, train_loss: 0.6112, test_loss: 0.9924, test_f1: 0.6708
 epoch: 97, train_loss: 0.6224, test_loss: 1.0339, test_f1: 0.6522
 epoch: 98, train_loss: 0.6031, test_loss: 1.0505, test_f1: 0.6636
 epoch: 99, train_loss: 0.5897, test_loss: 1.0772, test_f1: 0.6272
##################ITERATION #9 ****************************************
 epoch: 0, train_loss: 1.1765, test_loss: 1.0702, test_f1: 0.4755
 epoch: 1, train_loss: 1.0260, test_loss: 1.0225, test_f1: 0.4720
 epoch: 2, train_loss: 0.9920, test_loss: 0.9616, test_f1: 0.4712
 epoch: 3, train_loss: 0.9691, test_loss: 0.9679, test_f1: 0.5016
 epoch: 4, train_loss: 0.9508, test_loss: 1.0458, test_f1: 0.3976
 epoch: 5, train_loss: 0.9593, test_loss: 0.9969, test_f1: 0.4503
 epoch: 6, train_loss: 0.9532, test_loss: 0.9602, test_f1: 0.5316
 epoch: 7, train_loss: 0.9278, test_loss: 0.9374, test_f1: 0.5054
 epoch: 8, train_loss: 0.9252, test_loss: 1.0125, test_f1: 0.4742
 epoch: 9, train_loss: 0.9142, test_loss: 0.9562, test_f1: 0.4890
 epoch: 10, train_loss: 0.9257, test_loss: 0.9751, test_f1: 0.4450
 epoch: 11, train_loss: 0.9117, test_loss: 0.9590, test_f1: 0.5156
 epoch: 12, train_loss: 0.9096, test_loss: 0.9821, test_f1: 0.4918
 epoch: 13, train_loss: 0.9012, test_loss: 1.0329, test_f1: 0.4701
 epoch: 14, train_loss: 0.8868, test_loss: 0.9904, test_f1: 0.4856
 epoch: 15, train_loss: 0.8845, test_loss: 0.9265, test_f1: 0.5244
 epoch: 16, train_loss: 0.8696, test_loss: 0.9721, test_f1: 0.4637
 epoch: 17, train_loss: 0.8657, test_loss: 0.8937, test_f1: 0.5404
 epoch: 18, train_loss: 0.8619, test_loss: 0.9808, test_f1: 0.4506
 epoch: 19, train_loss: 0.8553, test_loss: 0.9413, test_f1: 0.5162
 epoch: 20, train_loss: 0.8516, test_loss: 0.9809, test_f1: 0.5559
 epoch: 21, train_loss: 0.8383, test_loss: 0.8830, test_f1: 0.5548
 epoch: 22, train_loss: 0.8423, test_loss: 0.8909, test_f1: 0.5514
 epoch: 23, train_loss: 0.8490, test_loss: 0.9132, test_f1: 0.5649
 epoch: 24, train_loss: 0.8478, test_loss: 0.9324, test_f1: 0.5719
 epoch: 25, train_loss: 0.8332, test_loss: 0.9840, test_f1: 0.5365
 epoch: 26, train_loss: 0.8332, test_loss: 0.9442, test_f1: 0.5913
 epoch: 27, train_loss: 0.8212, test_loss: 0.9977, test_f1: 0.5082
 epoch: 28, train_loss: 0.8510, test_loss: 0.9000, test_f1: 0.5657
 epoch: 29, train_loss: 0.8151, test_loss: 0.9630, test_f1: 0.5361
 epoch: 30, train_loss: 0.8233, test_loss: 0.9085, test_f1: 0.5497
 epoch: 31, train_loss: 0.8077, test_loss: 0.9144, test_f1: 0.5490
 epoch: 32, train_loss: 0.8010, test_loss: 1.0257, test_f1: 0.5396
 epoch: 33, train_loss: 0.8188, test_loss: 0.9209, test_f1: 0.5613
 epoch: 34, train_loss: 0.7994, test_loss: 0.9263, test_f1: 0.5833
 epoch: 35, train_loss: 0.8042, test_loss: 0.9131, test_f1: 0.5431
 epoch: 36, train_loss: 0.7881, test_loss: 0.9340, test_f1: 0.5744
 epoch: 37, train_loss: 0.7842, test_loss: 0.8681, test_f1: 0.6117
 epoch: 38, train_loss: 0.7898, test_loss: 0.8746, test_f1: 0.6046
 epoch: 39, train_loss: 0.7892, test_loss: 0.8665, test_f1: 0.6166
 epoch: 40, train_loss: 0.7731, test_loss: 0.9188, test_f1: 0.5769
 epoch: 41, train_loss: 0.7702, test_loss: 0.9328, test_f1: 0.5720
 epoch: 42, train_loss: 0.7810, test_loss: 0.8907, test_f1: 0.6010
 epoch: 43, train_loss: 0.7560, test_loss: 0.8508, test_f1: 0.6265
 epoch: 44, train_loss: 0.7754, test_loss: 0.8900, test_f1: 0.6045
 epoch: 45, train_loss: 0.7725, test_loss: 0.8720, test_f1: 0.6013
 epoch: 46, train_loss: 0.7557, test_loss: 1.0158, test_f1: 0.5601
 epoch: 47, train_loss: 0.7577, test_loss: 0.9393, test_f1: 0.5660
 epoch: 48, train_loss: 0.7437, test_loss: 0.8345, test_f1: 0.6066
 epoch: 49, train_loss: 0.7457, test_loss: 0.9365, test_f1: 0.5487
 epoch: 50, train_loss: 0.7641, test_loss: 0.8537, test_f1: 0.5650
 epoch: 51, train_loss: 0.7230, test_loss: 0.8536, test_f1: 0.6248
 epoch: 52, train_loss: 0.6911, test_loss: 0.8710, test_f1: 0.6141
 epoch: 53, train_loss: 0.7043, test_loss: 0.8579, test_f1: 0.6303
 epoch: 54, train_loss: 0.7042, test_loss: 0.8765, test_f1: 0.6335
 epoch: 55, train_loss: 0.6793, test_loss: 0.8604, test_f1: 0.6313
 epoch: 56, train_loss: 0.6914, test_loss: 0.8483, test_f1: 0.6456
 epoch: 57, train_loss: 0.6762, test_loss: 0.8432, test_f1: 0.6069
 epoch: 58, train_loss: 0.6871, test_loss: 0.8623, test_f1: 0.6361
 epoch: 59, train_loss: 0.6820, test_loss: 0.8613, test_f1: 0.6104
 epoch: 60, train_loss: 0.6807, test_loss: 0.8352, test_f1: 0.6262
 epoch: 61, train_loss: 0.6709, test_loss: 0.8614, test_f1: 0.6368
 epoch: 62, train_loss: 0.6693, test_loss: 0.8684, test_f1: 0.6308
 epoch: 63, train_loss: 0.6624, test_loss: 0.8756, test_f1: 0.6372
 epoch: 64, train_loss: 0.6644, test_loss: 0.8777, test_f1: 0.6159
 epoch: 65, train_loss: 0.6576, test_loss: 0.8398, test_f1: 0.6483
 epoch: 66, train_loss: 0.6621, test_loss: 0.8709, test_f1: 0.6459
 epoch: 67, train_loss: 0.6556, test_loss: 0.8733, test_f1: 0.6334
 epoch: 68, train_loss: 0.6632, test_loss: 0.9022, test_f1: 0.6256
 epoch: 69, train_loss: 0.6500, test_loss: 0.9107, test_f1: 0.6360
 epoch: 70, train_loss: 0.6261, test_loss: 0.8485, test_f1: 0.6247
 epoch: 71, train_loss: 0.6492, test_loss: 0.9104, test_f1: 0.6150
 epoch: 72, train_loss: 0.6675, test_loss: 0.9115, test_f1: 0.6168
 epoch: 73, train_loss: 0.6465, test_loss: 0.8724, test_f1: 0.6568
 epoch: 74, train_loss: 0.6364, test_loss: 0.8962, test_f1: 0.6427
 epoch: 75, train_loss: 0.6453, test_loss: 0.8953, test_f1: 0.6466
 epoch: 76, train_loss: 0.6334, test_loss: 0.9054, test_f1: 0.6371
 epoch: 77, train_loss: 0.6332, test_loss: 0.8956, test_f1: 0.6220
 epoch: 78, train_loss: 0.6385, test_loss: 0.8728, test_f1: 0.6323
 epoch: 79, train_loss: 0.6299, test_loss: 0.8741, test_f1: 0.6301
 epoch: 80, train_loss: 0.6425, test_loss: 0.8811, test_f1: 0.6353
 epoch: 81, train_loss: 0.6119, test_loss: 0.8804, test_f1: 0.6383
 epoch: 82, train_loss: 0.6088, test_loss: 0.9312, test_f1: 0.6321
 epoch: 83, train_loss: 0.6096, test_loss: 0.8876, test_f1: 0.6250
 epoch: 84, train_loss: 0.6351, test_loss: 0.8845, test_f1: 0.6378
 epoch: 85, train_loss: 0.6124, test_loss: 0.8887, test_f1: 0.6276
 epoch: 86, train_loss: 0.6008, test_loss: 0.8988, test_f1: 0.6435
 epoch: 87, train_loss: 0.6114, test_loss: 0.8706, test_f1: 0.6430
 epoch: 88, train_loss: 0.6130, test_loss: 0.9164, test_f1: 0.6372
 epoch: 89, train_loss: 0.6013, test_loss: 0.9568, test_f1: 0.6327
 epoch: 90, train_loss: 0.6211, test_loss: 0.9180, test_f1: 0.6318
 epoch: 91, train_loss: 0.6196, test_loss: 0.9425, test_f1: 0.6466
 epoch: 92, train_loss: 0.6178, test_loss: 0.9671, test_f1: 0.5961
 epoch: 93, train_loss: 0.5989, test_loss: 0.8976, test_f1: 0.6356
 epoch: 94, train_loss: 0.6042, test_loss: 0.9133, test_f1: 0.6296
 epoch: 95, train_loss: 0.6115, test_loss: 0.8971, test_f1: 0.6232
 epoch: 96, train_loss: 0.5902, test_loss: 0.9082, test_f1: 0.6205
 epoch: 97, train_loss: 0.5959, test_loss: 0.9208, test_f1: 0.6271
 epoch: 98, train_loss: 0.5853, test_loss: 0.9441, test_f1: 0.6149
 epoch: 99, train_loss: 0.5850, test_loss: 0.9586, test_f1: 0.6264

Training completed in 742.31 seconds
Best F1: 0.6883 at epoch 89
Mean F1 across iterations: 0.6710  0.0108
========================FINAL RESULTS================================
FEGIN weighted F1: 0.6883  0.0108
python main.py --data ltspice_examples --representation component_net --model FEGIN --layers 5 --hiddens 32 --batch_size 64 --lr 0.01 --emb_size 512 --epochs 100 --save_appendix component_net_L5_H32_BS64_LR0.01_E512 --no_val
-----



STDERR:
  File "main.py", line 370, in <module>
    main()
  File "main.py", line 254, in main
    dataset = dataset_class(
  File "/home/philip/projects/ltspice_examples_code_repo/Circuit-Completion-Using-GNNs/component_classification_with_link_prediction_head/evaluation/FEGIN/kernel/circuit_datasets.py", line 15, in __init__
    self.data, self.slices = torch.load(self.processed_paths[0])
  File "/home/philip/.local/lib/python3.8/site-packages/torch/serialization.py", line 1040, in load
    warnings.warn(
  File "/usr/lib/python3.8/warnings.py", line 109, in _showwarnmsg
    sw(msg.message, msg.category, msg.filename, msg.lineno,
  File "main.py", line 47, in warn_with_traceback
    traceback.print_stack(file=log)
/home/philip/projects/ltspice_examples_code_repo/Circuit-Completion-Using-GNNs/component_classification_with_link_prediction_head/evaluation/FEGIN/kernel/circuit_datasets.py:15: FutureWarning: You are using `torch.load` with `weights_only=False` (the current default value), which uses the default pickle module implicitly. It is possible to construct malicious pickle data which will execute arbitrary code during unpickling (See https://github.com/pytorch/pytorch/blob/main/SECURITY.md#untrusted-models for more details). In a future release, the default value for `weights_only` will be flipped to `True`. This limits the functions that could be executed during unpickling. Arbitrary objects will no longer be allowed to be loaded via this mode unless they are explicitly allowlisted by the user via `torch.serialization.add_safe_globals`. We recommend you start setting `weights_only=True` for any use case where you don't have full control of the loaded file. Please open an issue on GitHub for any issues related to this experimental feature.
  self.data, self.slices = torch.load(self.processed_paths[0])
