STDOUT:
Results will be saved in /home/philip/projects/ltspice_examples_code_repo/Circuit-Completion-Using-GNNs/component_classification_with_link_prediction_head/evaluation/FEGIN/results/model_FEGIN_dataset_ltspice_demos
Command line input: python main.py --data ltspice_demos --representation component_net --model FEGIN --layers 5 --hiddens 128 --batch_size 64 --lr 0.0001 --emb_size 128 --epochs 100 --save_appendix component_net_L5_H128_BS64_LR0.0001_E128 --no_val
 is saved.
-----
ltspice_demos - FEGIN
Using 5 layers, 128 hidden units, h = 2
Loading component_net representation dataset
ENTERED
Training FEGIN on component_net representation
Train: 1565, Test: 383
##################ITERATION #0 ****************************************
 epoch: 0, train_loss: 1.3520, test_loss: 1.3653, test_f1: 0.2281
 epoch: 1, train_loss: 1.3021, test_loss: 1.3425, test_f1: 0.2281
 epoch: 2, train_loss: 1.2530, test_loss: 1.2754, test_f1: 0.2465
 epoch: 3, train_loss: 1.2014, test_loss: 1.2245, test_f1: 0.2734
 epoch: 4, train_loss: 1.1642, test_loss: 1.1994, test_f1: 0.2820
 epoch: 5, train_loss: 1.1361, test_loss: 1.1878, test_f1: 0.3164
 epoch: 6, train_loss: 1.1232, test_loss: 1.1804, test_f1: 0.3237
 epoch: 7, train_loss: 1.1070, test_loss: 1.1543, test_f1: 0.3292
 epoch: 8, train_loss: 1.0975, test_loss: 1.1508, test_f1: 0.3325
 epoch: 9, train_loss: 1.0819, test_loss: 1.1331, test_f1: 0.3553
 epoch: 10, train_loss: 1.0670, test_loss: 1.1307, test_f1: 0.4090
 epoch: 11, train_loss: 1.0580, test_loss: 1.1072, test_f1: 0.4895
 epoch: 12, train_loss: 1.0377, test_loss: 1.0841, test_f1: 0.5009
 epoch: 13, train_loss: 1.0237, test_loss: 1.0606, test_f1: 0.5098
 epoch: 14, train_loss: 1.0111, test_loss: 1.1200, test_f1: 0.5389
 epoch: 15, train_loss: 0.9843, test_loss: 1.0396, test_f1: 0.5257
 epoch: 16, train_loss: 0.9701, test_loss: 1.0261, test_f1: 0.5371
 epoch: 17, train_loss: 0.9514, test_loss: 1.0383, test_f1: 0.5314
 epoch: 18, train_loss: 0.9287, test_loss: 1.0631, test_f1: 0.5564
 epoch: 19, train_loss: 0.9156, test_loss: 1.0138, test_f1: 0.5611
 epoch: 20, train_loss: 0.9012, test_loss: 1.0441, test_f1: 0.5634
 epoch: 21, train_loss: 0.8869, test_loss: 1.0124, test_f1: 0.5542
 epoch: 22, train_loss: 0.8716, test_loss: 1.0203, test_f1: 0.5603
 epoch: 23, train_loss: 0.8641, test_loss: 0.9858, test_f1: 0.5817
 epoch: 24, train_loss: 0.8420, test_loss: 1.0696, test_f1: 0.5381
 epoch: 25, train_loss: 0.8317, test_loss: 1.0236, test_f1: 0.5641
 epoch: 26, train_loss: 0.8121, test_loss: 1.0030, test_f1: 0.5668
 epoch: 27, train_loss: 0.8145, test_loss: 1.0388, test_f1: 0.5594
 epoch: 28, train_loss: 0.8047, test_loss: 0.9975, test_f1: 0.5715
 epoch: 29, train_loss: 0.7902, test_loss: 1.0447, test_f1: 0.5368
 epoch: 30, train_loss: 0.7820, test_loss: 1.1180, test_f1: 0.5598
 epoch: 31, train_loss: 0.7639, test_loss: 1.0281, test_f1: 0.5699
 epoch: 32, train_loss: 0.7579, test_loss: 1.0298, test_f1: 0.5673
 epoch: 33, train_loss: 0.7616, test_loss: 1.0913, test_f1: 0.5533
 epoch: 34, train_loss: 0.7525, test_loss: 1.0791, test_f1: 0.5679
 epoch: 35, train_loss: 0.7464, test_loss: 1.0356, test_f1: 0.5826
 epoch: 36, train_loss: 0.7426, test_loss: 1.1245, test_f1: 0.5708
 epoch: 37, train_loss: 0.7203, test_loss: 1.1256, test_f1: 0.5600
 epoch: 38, train_loss: 0.7239, test_loss: 1.0995, test_f1: 0.5433
 epoch: 39, train_loss: 0.7100, test_loss: 1.1737, test_f1: 0.5341
 epoch: 40, train_loss: 0.7235, test_loss: 1.1506, test_f1: 0.5751
 epoch: 41, train_loss: 0.7103, test_loss: 1.1376, test_f1: 0.5758
 epoch: 42, train_loss: 0.6810, test_loss: 1.1923, test_f1: 0.5601
 epoch: 43, train_loss: 0.6966, test_loss: 1.1593, test_f1: 0.5785
 epoch: 44, train_loss: 0.6801, test_loss: 1.1951, test_f1: 0.5628
 epoch: 45, train_loss: 0.6858, test_loss: 1.2738, test_f1: 0.5741
 epoch: 46, train_loss: 0.6737, test_loss: 1.2465, test_f1: 0.5691
 epoch: 47, train_loss: 0.6873, test_loss: 1.2757, test_f1: 0.5629
 epoch: 48, train_loss: 0.6829, test_loss: 1.1953, test_f1: 0.5739
 epoch: 49, train_loss: 0.6550, test_loss: 1.2472, test_f1: 0.5591
 epoch: 50, train_loss: 0.6425, test_loss: 1.2409, test_f1: 0.5766
 epoch: 51, train_loss: 0.6324, test_loss: 1.2850, test_f1: 0.5540
 epoch: 52, train_loss: 0.6251, test_loss: 1.2787, test_f1: 0.5595
 epoch: 53, train_loss: 0.6223, test_loss: 1.2845, test_f1: 0.5694
 epoch: 54, train_loss: 0.6286, test_loss: 1.3074, test_f1: 0.5691
 epoch: 55, train_loss: 0.6099, test_loss: 1.3328, test_f1: 0.5779
 epoch: 56, train_loss: 0.6122, test_loss: 1.2815, test_f1: 0.5640
 epoch: 57, train_loss: 0.6204, test_loss: 1.3304, test_f1: 0.5741
 epoch: 58, train_loss: 0.6011, test_loss: 1.3200, test_f1: 0.5766
 epoch: 59, train_loss: 0.6006, test_loss: 1.3304, test_f1: 0.5823
 epoch: 60, train_loss: 0.5944, test_loss: 1.3496, test_f1: 0.5658
 epoch: 61, train_loss: 0.6118, test_loss: 1.3828, test_f1: 0.5681
 epoch: 62, train_loss: 0.5989, test_loss: 1.3912, test_f1: 0.5722
 epoch: 63, train_loss: 0.5842, test_loss: 1.3647, test_f1: 0.5796
 epoch: 64, train_loss: 0.5847, test_loss: 1.3701, test_f1: 0.5482
 epoch: 65, train_loss: 0.5870, test_loss: 1.3840, test_f1: 0.5678
 epoch: 66, train_loss: 0.5894, test_loss: 1.4067, test_f1: 0.5665
 epoch: 67, train_loss: 0.5659, test_loss: 1.4162, test_f1: 0.5661
 epoch: 68, train_loss: 0.5572, test_loss: 1.4247, test_f1: 0.5724
 epoch: 69, train_loss: 0.5664, test_loss: 1.4312, test_f1: 0.5726
 epoch: 70, train_loss: 0.5574, test_loss: 1.4083, test_f1: 0.5751
 epoch: 71, train_loss: 0.5684, test_loss: 1.4827, test_f1: 0.5555
 epoch: 72, train_loss: 0.5691, test_loss: 1.4348, test_f1: 0.5548
 epoch: 73, train_loss: 0.5405, test_loss: 1.4495, test_f1: 0.5775
 epoch: 74, train_loss: 0.5517, test_loss: 1.5001, test_f1: 0.5590
 epoch: 75, train_loss: 0.5558, test_loss: 1.4710, test_f1: 0.5820
 epoch: 76, train_loss: 0.5589, test_loss: 1.4802, test_f1: 0.5861
 epoch: 77, train_loss: 0.5455, test_loss: 1.4421, test_f1: 0.5779
 epoch: 78, train_loss: 0.5454, test_loss: 1.4930, test_f1: 0.5623
 epoch: 79, train_loss: 0.5365, test_loss: 1.4751, test_f1: 0.5764
 epoch: 80, train_loss: 0.5398, test_loss: 1.5644, test_f1: 0.5555
 epoch: 81, train_loss: 0.5232, test_loss: 1.4988, test_f1: 0.5567
 epoch: 82, train_loss: 0.5433, test_loss: 1.4829, test_f1: 0.5693
 epoch: 83, train_loss: 0.5209, test_loss: 1.5232, test_f1: 0.5586
 epoch: 84, train_loss: 0.5285, test_loss: 1.5468, test_f1: 0.5731
 epoch: 85, train_loss: 0.5203, test_loss: 1.5464, test_f1: 0.5649
 epoch: 86, train_loss: 0.5119, test_loss: 1.5461, test_f1: 0.5698
 epoch: 87, train_loss: 0.5127, test_loss: 1.5283, test_f1: 0.5705
 epoch: 88, train_loss: 0.5141, test_loss: 1.6105, test_f1: 0.5801
 epoch: 89, train_loss: 0.5125, test_loss: 1.5755, test_f1: 0.5777
 epoch: 90, train_loss: 0.5004, test_loss: 1.5198, test_f1: 0.5899
 epoch: 91, train_loss: 0.5087, test_loss: 1.6004, test_f1: 0.5779
 epoch: 92, train_loss: 0.5218, test_loss: 1.5869, test_f1: 0.5543
 epoch: 93, train_loss: 0.4998, test_loss: 1.6557, test_f1: 0.5747
 epoch: 94, train_loss: 0.4999, test_loss: 1.6144, test_f1: 0.5609
 epoch: 95, train_loss: 0.4882, test_loss: 1.6471, test_f1: 0.5684
 epoch: 96, train_loss: 0.5056, test_loss: 1.6580, test_f1: 0.5627
 epoch: 97, train_loss: 0.4933, test_loss: 1.6285, test_f1: 0.5675
 epoch: 98, train_loss: 0.4931, test_loss: 1.7121, test_f1: 0.5466
 epoch: 99, train_loss: 0.4780, test_loss: 1.7071, test_f1: 0.5702
##################ITERATION #1 ****************************************
 epoch: 0, train_loss: 1.2605, test_loss: 1.3367, test_f1: 0.2585
 epoch: 1, train_loss: 1.1633, test_loss: 1.2922, test_f1: 0.2654
 epoch: 2, train_loss: 1.1254, test_loss: 1.2126, test_f1: 0.3991
 epoch: 3, train_loss: 1.0943, test_loss: 1.1571, test_f1: 0.4282
 epoch: 4, train_loss: 1.0671, test_loss: 1.1207, test_f1: 0.4722
 epoch: 5, train_loss: 1.0365, test_loss: 1.1033, test_f1: 0.4975
 epoch: 6, train_loss: 1.0208, test_loss: 1.0807, test_f1: 0.5198
 epoch: 7, train_loss: 1.0030, test_loss: 1.0663, test_f1: 0.5285
 epoch: 8, train_loss: 0.9717, test_loss: 1.0539, test_f1: 0.5516
 epoch: 9, train_loss: 0.9570, test_loss: 1.0409, test_f1: 0.5552
 epoch: 10, train_loss: 0.9458, test_loss: 1.0268, test_f1: 0.5520
 epoch: 11, train_loss: 0.9213, test_loss: 1.0354, test_f1: 0.5552
 epoch: 12, train_loss: 0.9020, test_loss: 1.0309, test_f1: 0.5623
 epoch: 13, train_loss: 0.8992, test_loss: 1.0305, test_f1: 0.5585
 epoch: 14, train_loss: 0.8815, test_loss: 0.9924, test_f1: 0.5763
 epoch: 15, train_loss: 0.8643, test_loss: 1.0456, test_f1: 0.5643
 epoch: 16, train_loss: 0.8541, test_loss: 1.0303, test_f1: 0.5765
 epoch: 17, train_loss: 0.8373, test_loss: 1.0367, test_f1: 0.5753
 epoch: 18, train_loss: 0.8407, test_loss: 1.0087, test_f1: 0.5640
 epoch: 19, train_loss: 0.8271, test_loss: 1.1015, test_f1: 0.5673
 epoch: 20, train_loss: 0.8089, test_loss: 1.0266, test_f1: 0.5823
 epoch: 21, train_loss: 0.7886, test_loss: 1.0520, test_f1: 0.5860
 epoch: 22, train_loss: 0.7907, test_loss: 1.0448, test_f1: 0.5762
 epoch: 23, train_loss: 0.7860, test_loss: 1.1160, test_f1: 0.5830
 epoch: 24, train_loss: 0.7739, test_loss: 1.0927, test_f1: 0.5703
 epoch: 25, train_loss: 0.7651, test_loss: 1.0862, test_f1: 0.5907
 epoch: 26, train_loss: 0.7597, test_loss: 1.1320, test_f1: 0.5686
 epoch: 27, train_loss: 0.7524, test_loss: 1.1220, test_f1: 0.5918
 epoch: 28, train_loss: 0.7446, test_loss: 1.1679, test_f1: 0.5824
 epoch: 29, train_loss: 0.7315, test_loss: 1.1557, test_f1: 0.5778
 epoch: 30, train_loss: 0.7200, test_loss: 1.0816, test_f1: 0.6044
 epoch: 31, train_loss: 0.7306, test_loss: 1.0917, test_f1: 0.5966
 epoch: 32, train_loss: 0.7479, test_loss: 1.1525, test_f1: 0.6048
 epoch: 33, train_loss: 0.7280, test_loss: 1.0853, test_f1: 0.6112
 epoch: 34, train_loss: 0.7228, test_loss: 1.1787, test_f1: 0.6017
 epoch: 35, train_loss: 0.7058, test_loss: 1.2241, test_f1: 0.5971
 epoch: 36, train_loss: 0.7001, test_loss: 1.1689, test_f1: 0.6016
 epoch: 37, train_loss: 0.6960, test_loss: 1.2066, test_f1: 0.6007
 epoch: 38, train_loss: 0.6783, test_loss: 1.1665, test_f1: 0.6036
 epoch: 39, train_loss: 0.6661, test_loss: 1.2132, test_f1: 0.5975
 epoch: 40, train_loss: 0.6678, test_loss: 1.2695, test_f1: 0.5943
 epoch: 41, train_loss: 0.6653, test_loss: 1.2734, test_f1: 0.6034
 epoch: 42, train_loss: 0.6652, test_loss: 1.1925, test_f1: 0.5861
 epoch: 43, train_loss: 0.6474, test_loss: 1.2503, test_f1: 0.5940
 epoch: 44, train_loss: 0.6474, test_loss: 1.2687, test_f1: 0.6004
 epoch: 45, train_loss: 0.6190, test_loss: 1.2747, test_f1: 0.5865
 epoch: 46, train_loss: 0.6347, test_loss: 1.3038, test_f1: 0.6159
 epoch: 47, train_loss: 0.6321, test_loss: 1.2735, test_f1: 0.6138
 epoch: 48, train_loss: 0.6199, test_loss: 1.3101, test_f1: 0.5863
 epoch: 49, train_loss: 0.6090, test_loss: 1.3950, test_f1: 0.6107
 epoch: 50, train_loss: 0.6010, test_loss: 1.2556, test_f1: 0.6246
 epoch: 51, train_loss: 0.6096, test_loss: 1.3189, test_f1: 0.6230
 epoch: 52, train_loss: 0.5910, test_loss: 1.2689, test_f1: 0.6242
 epoch: 53, train_loss: 0.5785, test_loss: 1.3362, test_f1: 0.6048
 epoch: 54, train_loss: 0.5786, test_loss: 1.3122, test_f1: 0.5933
 epoch: 55, train_loss: 0.5956, test_loss: 1.3514, test_f1: 0.6030
 epoch: 56, train_loss: 0.5850, test_loss: 1.3394, test_f1: 0.6140
 epoch: 57, train_loss: 0.5805, test_loss: 1.3410, test_f1: 0.6140
 epoch: 58, train_loss: 0.5786, test_loss: 1.4154, test_f1: 0.6117
 epoch: 59, train_loss: 0.5677, test_loss: 1.4113, test_f1: 0.6072
 epoch: 60, train_loss: 0.5621, test_loss: 1.4123, test_f1: 0.6157
 epoch: 61, train_loss: 0.5698, test_loss: 1.4460, test_f1: 0.6215
 epoch: 62, train_loss: 0.5461, test_loss: 1.4377, test_f1: 0.6048
 epoch: 63, train_loss: 0.5580, test_loss: 1.4347, test_f1: 0.6046
 epoch: 64, train_loss: 0.5629, test_loss: 1.4163, test_f1: 0.6225
 epoch: 65, train_loss: 0.5337, test_loss: 1.4737, test_f1: 0.5971
 epoch: 66, train_loss: 0.5317, test_loss: 1.4573, test_f1: 0.6113
 epoch: 67, train_loss: 0.5282, test_loss: 1.4457, test_f1: 0.5999
 epoch: 68, train_loss: 0.5510, test_loss: 1.4691, test_f1: 0.6135
 epoch: 69, train_loss: 0.5368, test_loss: 1.4753, test_f1: 0.6049
 epoch: 70, train_loss: 0.5397, test_loss: 1.5405, test_f1: 0.5858
 epoch: 71, train_loss: 0.5254, test_loss: 1.4430, test_f1: 0.6210
 epoch: 72, train_loss: 0.5397, test_loss: 1.4912, test_f1: 0.6159
 epoch: 73, train_loss: 0.5210, test_loss: 1.4637, test_f1: 0.6010
 epoch: 74, train_loss: 0.5489, test_loss: 1.5753, test_f1: 0.5758
 epoch: 75, train_loss: 0.5083, test_loss: 1.4853, test_f1: 0.5832
 epoch: 76, train_loss: 0.5244, test_loss: 1.5108, test_f1: 0.5796
 epoch: 77, train_loss: 0.5097, test_loss: 1.5369, test_f1: 0.6007
 epoch: 78, train_loss: 0.5040, test_loss: 1.5222, test_f1: 0.5775
 epoch: 79, train_loss: 0.5030, test_loss: 1.5204, test_f1: 0.6030
 epoch: 80, train_loss: 0.5084, test_loss: 1.5883, test_f1: 0.5725
 epoch: 81, train_loss: 0.4942, test_loss: 1.5462, test_f1: 0.5799
 epoch: 82, train_loss: 0.4858, test_loss: 1.6187, test_f1: 0.5818
 epoch: 83, train_loss: 0.4983, test_loss: 1.5176, test_f1: 0.5969
 epoch: 84, train_loss: 0.4903, test_loss: 1.5298, test_f1: 0.5926
 epoch: 85, train_loss: 0.4859, test_loss: 1.6093, test_f1: 0.5924
 epoch: 86, train_loss: 0.4926, test_loss: 1.6083, test_f1: 0.6051
 epoch: 87, train_loss: 0.4987, test_loss: 1.6082, test_f1: 0.5784
 epoch: 88, train_loss: 0.4866, test_loss: 1.6252, test_f1: 0.5866
 epoch: 89, train_loss: 0.4758, test_loss: 1.6606, test_f1: 0.5827
 epoch: 90, train_loss: 0.4722, test_loss: 1.6330, test_f1: 0.5870
 epoch: 91, train_loss: 0.4541, test_loss: 1.6501, test_f1: 0.5776
 epoch: 92, train_loss: 0.4626, test_loss: 1.7190, test_f1: 0.5764
 epoch: 93, train_loss: 0.4466, test_loss: 1.6773, test_f1: 0.5864
 epoch: 94, train_loss: 0.4572, test_loss: 1.6711, test_f1: 0.5910
 epoch: 95, train_loss: 0.4616, test_loss: 1.7003, test_f1: 0.6107
 epoch: 96, train_loss: 0.4655, test_loss: 1.6532, test_f1: 0.6049
 epoch: 97, train_loss: 0.4522, test_loss: 1.6800, test_f1: 0.5943
 epoch: 98, train_loss: 0.4533, test_loss: 1.6984, test_f1: 0.5792
 epoch: 99, train_loss: 0.4527, test_loss: 1.7342, test_f1: 0.5966
##################ITERATION #2 ****************************************
 epoch: 0, train_loss: 1.2189, test_loss: 1.3046, test_f1: 0.2611
 epoch: 1, train_loss: 1.1186, test_loss: 1.2324, test_f1: 0.2777
 epoch: 2, train_loss: 1.0855, test_loss: 1.1710, test_f1: 0.3723
 epoch: 3, train_loss: 1.0550, test_loss: 1.1154, test_f1: 0.4846
 epoch: 4, train_loss: 1.0169, test_loss: 1.1098, test_f1: 0.5254
 epoch: 5, train_loss: 0.9984, test_loss: 1.1013, test_f1: 0.5273
 epoch: 6, train_loss: 0.9754, test_loss: 1.0910, test_f1: 0.5433
 epoch: 7, train_loss: 0.9672, test_loss: 1.0969, test_f1: 0.5492
 epoch: 8, train_loss: 0.9391, test_loss: 1.1147, test_f1: 0.5309
 epoch: 9, train_loss: 0.9226, test_loss: 1.0681, test_f1: 0.5418
 epoch: 10, train_loss: 0.9100, test_loss: 1.1071, test_f1: 0.5444
 epoch: 11, train_loss: 0.8916, test_loss: 1.0956, test_f1: 0.5415
 epoch: 12, train_loss: 0.8703, test_loss: 1.0783, test_f1: 0.5556
 epoch: 13, train_loss: 0.8754, test_loss: 1.1005, test_f1: 0.5524
 epoch: 14, train_loss: 0.8634, test_loss: 1.1504, test_f1: 0.5479
 epoch: 15, train_loss: 0.8450, test_loss: 1.0563, test_f1: 0.5636
 epoch: 16, train_loss: 0.8439, test_loss: 1.1022, test_f1: 0.5832
 epoch: 17, train_loss: 0.8437, test_loss: 1.0548, test_f1: 0.5413
 epoch: 18, train_loss: 0.8222, test_loss: 1.0898, test_f1: 0.5436
 epoch: 19, train_loss: 0.8156, test_loss: 1.1066, test_f1: 0.5651
 epoch: 20, train_loss: 0.8101, test_loss: 1.1077, test_f1: 0.5691
 epoch: 21, train_loss: 0.8032, test_loss: 1.1171, test_f1: 0.5658
 epoch: 22, train_loss: 0.7876, test_loss: 1.1141, test_f1: 0.5554
 epoch: 23, train_loss: 0.7764, test_loss: 1.1388, test_f1: 0.5615
 epoch: 24, train_loss: 0.7744, test_loss: 1.1357, test_f1: 0.5613
 epoch: 25, train_loss: 0.7672, test_loss: 1.0891, test_f1: 0.5605
 epoch: 26, train_loss: 0.7602, test_loss: 1.1032, test_f1: 0.5493
 epoch: 27, train_loss: 0.7462, test_loss: 1.1052, test_f1: 0.5712
 epoch: 28, train_loss: 0.7489, test_loss: 1.1373, test_f1: 0.5739
 epoch: 29, train_loss: 0.7543, test_loss: 1.1508, test_f1: 0.5802
 epoch: 30, train_loss: 0.7384, test_loss: 1.2096, test_f1: 0.5542
 epoch: 31, train_loss: 0.7249, test_loss: 1.1457, test_f1: 0.5664
 epoch: 32, train_loss: 0.7068, test_loss: 1.1623, test_f1: 0.5875
 epoch: 33, train_loss: 0.7170, test_loss: 1.1804, test_f1: 0.5695
 epoch: 34, train_loss: 0.7022, test_loss: 1.1504, test_f1: 0.5832
 epoch: 35, train_loss: 0.7017, test_loss: 1.2418, test_f1: 0.5479
 epoch: 36, train_loss: 0.7091, test_loss: 1.2877, test_f1: 0.5632
 epoch: 37, train_loss: 0.6856, test_loss: 1.2924, test_f1: 0.5653
 epoch: 38, train_loss: 0.6856, test_loss: 1.2540, test_f1: 0.5389
 epoch: 39, train_loss: 0.6854, test_loss: 1.2399, test_f1: 0.5655
 epoch: 40, train_loss: 0.6715, test_loss: 1.1748, test_f1: 0.5752
 epoch: 41, train_loss: 0.6567, test_loss: 1.2411, test_f1: 0.5642
 epoch: 42, train_loss: 0.6529, test_loss: 1.2201, test_f1: 0.5953
 epoch: 43, train_loss: 0.6650, test_loss: 1.2736, test_f1: 0.5716
 epoch: 44, train_loss: 0.6532, test_loss: 1.2351, test_f1: 0.5505
 epoch: 45, train_loss: 0.6254, test_loss: 1.3629, test_f1: 0.5493
 epoch: 46, train_loss: 0.6376, test_loss: 1.2927, test_f1: 0.5379
 epoch: 47, train_loss: 0.6488, test_loss: 1.2657, test_f1: 0.5625
 epoch: 48, train_loss: 0.6447, test_loss: 1.3150, test_f1: 0.5797
 epoch: 49, train_loss: 0.6161, test_loss: 1.2897, test_f1: 0.5779
 epoch: 50, train_loss: 0.6263, test_loss: 1.2673, test_f1: 0.5954
 epoch: 51, train_loss: 0.6030, test_loss: 1.2422, test_f1: 0.5799
 epoch: 52, train_loss: 0.6029, test_loss: 1.2518, test_f1: 0.5975
 epoch: 53, train_loss: 0.5793, test_loss: 1.2800, test_f1: 0.5900
 epoch: 54, train_loss: 0.5925, test_loss: 1.2940, test_f1: 0.5816
 epoch: 55, train_loss: 0.5760, test_loss: 1.2823, test_f1: 0.5952
 epoch: 56, train_loss: 0.5610, test_loss: 1.3408, test_f1: 0.5855
 epoch: 57, train_loss: 0.5682, test_loss: 1.3477, test_f1: 0.5851
 epoch: 58, train_loss: 0.5588, test_loss: 1.3637, test_f1: 0.5627
 epoch: 59, train_loss: 0.5657, test_loss: 1.3852, test_f1: 0.5831
 epoch: 60, train_loss: 0.5487, test_loss: 1.3697, test_f1: 0.5566
 epoch: 61, train_loss: 0.5626, test_loss: 1.3716, test_f1: 0.5895
 epoch: 62, train_loss: 0.5607, test_loss: 1.3917, test_f1: 0.5930
 epoch: 63, train_loss: 0.5539, test_loss: 1.4363, test_f1: 0.5830
 epoch: 64, train_loss: 0.5445, test_loss: 1.3831, test_f1: 0.5748
 epoch: 65, train_loss: 0.5491, test_loss: 1.4159, test_f1: 0.5900
 epoch: 66, train_loss: 0.5319, test_loss: 1.4424, test_f1: 0.5776
 epoch: 67, train_loss: 0.5405, test_loss: 1.4054, test_f1: 0.5679
 epoch: 68, train_loss: 0.5297, test_loss: 1.4340, test_f1: 0.5730
 epoch: 69, train_loss: 0.5211, test_loss: 1.4411, test_f1: 0.5588
 epoch: 70, train_loss: 0.5393, test_loss: 1.4394, test_f1: 0.5680
 epoch: 71, train_loss: 0.5086, test_loss: 1.4763, test_f1: 0.5985
 epoch: 72, train_loss: 0.5195, test_loss: 1.4637, test_f1: 0.5806
 epoch: 73, train_loss: 0.5386, test_loss: 1.5442, test_f1: 0.5531
 epoch: 74, train_loss: 0.5398, test_loss: 1.5156, test_f1: 0.5695
 epoch: 75, train_loss: 0.5201, test_loss: 1.5387, test_f1: 0.5926
 epoch: 76, train_loss: 0.5131, test_loss: 1.5338, test_f1: 0.5717
 epoch: 77, train_loss: 0.5139, test_loss: 1.5233, test_f1: 0.5788
 epoch: 78, train_loss: 0.4990, test_loss: 1.5581, test_f1: 0.5542
 epoch: 79, train_loss: 0.5176, test_loss: 1.5094, test_f1: 0.5610
 epoch: 80, train_loss: 0.4983, test_loss: 1.5903, test_f1: 0.5613
 epoch: 81, train_loss: 0.5157, test_loss: 1.5226, test_f1: 0.5724
 epoch: 82, train_loss: 0.5018, test_loss: 1.5900, test_f1: 0.5980
 epoch: 83, train_loss: 0.4905, test_loss: 1.5781, test_f1: 0.5597
 epoch: 84, train_loss: 0.4900, test_loss: 1.5503, test_f1: 0.5718
 epoch: 85, train_loss: 0.4963, test_loss: 1.6226, test_f1: 0.5703
 epoch: 86, train_loss: 0.4769, test_loss: 1.6401, test_f1: 0.6083
 epoch: 87, train_loss: 0.4930, test_loss: 1.6498, test_f1: 0.5642
 epoch: 88, train_loss: 0.4859, test_loss: 1.6870, test_f1: 0.5648
 epoch: 89, train_loss: 0.4793, test_loss: 1.6626, test_f1: 0.5656
 epoch: 90, train_loss: 0.4903, test_loss: 1.6671, test_f1: 0.5810
 epoch: 91, train_loss: 0.4634, test_loss: 1.7378, test_f1: 0.5681
 epoch: 92, train_loss: 0.4672, test_loss: 1.6801, test_f1: 0.5852
 epoch: 93, train_loss: 0.4829, test_loss: 1.6460, test_f1: 0.6060
 epoch: 94, train_loss: 0.4660, test_loss: 1.6873, test_f1: 0.5960
 epoch: 95, train_loss: 0.4690, test_loss: 1.6323, test_f1: 0.5806
 epoch: 96, train_loss: 0.4707, test_loss: 1.7283, test_f1: 0.5804
 epoch: 97, train_loss: 0.4711, test_loss: 1.6759, test_f1: 0.5754
 epoch: 98, train_loss: 0.4842, test_loss: 1.7652, test_f1: 0.5725
 epoch: 99, train_loss: 0.4526, test_loss: 1.7665, test_f1: 0.5837
##################ITERATION #3 ****************************************
 epoch: 0, train_loss: 1.2042, test_loss: 1.2988, test_f1: 0.3367
 epoch: 1, train_loss: 1.0977, test_loss: 1.2550, test_f1: 0.4173
 epoch: 2, train_loss: 1.0517, test_loss: 1.1497, test_f1: 0.4581
 epoch: 3, train_loss: 1.0237, test_loss: 1.0911, test_f1: 0.4871
 epoch: 4, train_loss: 0.9977, test_loss: 1.0600, test_f1: 0.5221
 epoch: 5, train_loss: 0.9766, test_loss: 1.0467, test_f1: 0.5255
 epoch: 6, train_loss: 0.9605, test_loss: 1.0350, test_f1: 0.5306
 epoch: 7, train_loss: 0.9274, test_loss: 1.0366, test_f1: 0.5278
 epoch: 8, train_loss: 0.9275, test_loss: 1.0030, test_f1: 0.5548
 epoch: 9, train_loss: 0.9115, test_loss: 1.0218, test_f1: 0.5383
 epoch: 10, train_loss: 0.9078, test_loss: 0.9974, test_f1: 0.5647
 epoch: 11, train_loss: 0.8908, test_loss: 1.0272, test_f1: 0.5457
 epoch: 12, train_loss: 0.8771, test_loss: 0.9949, test_f1: 0.5454
 epoch: 13, train_loss: 0.8572, test_loss: 0.9961, test_f1: 0.5565
 epoch: 14, train_loss: 0.8453, test_loss: 0.9817, test_f1: 0.5672
 epoch: 15, train_loss: 0.8405, test_loss: 1.0259, test_f1: 0.5763
 epoch: 16, train_loss: 0.8307, test_loss: 0.9886, test_f1: 0.5610
 epoch: 17, train_loss: 0.8232, test_loss: 0.9989, test_f1: 0.5713
 epoch: 18, train_loss: 0.8191, test_loss: 1.0139, test_f1: 0.5729
 epoch: 19, train_loss: 0.7999, test_loss: 0.9937, test_f1: 0.5783
 epoch: 20, train_loss: 0.7976, test_loss: 1.0321, test_f1: 0.5690
 epoch: 21, train_loss: 0.7938, test_loss: 1.0453, test_f1: 0.5697
 epoch: 22, train_loss: 0.7795, test_loss: 1.0653, test_f1: 0.5680
 epoch: 23, train_loss: 0.7600, test_loss: 1.0401, test_f1: 0.5771
 epoch: 24, train_loss: 0.7567, test_loss: 1.0990, test_f1: 0.5586
 epoch: 25, train_loss: 0.7533, test_loss: 1.1220, test_f1: 0.5733
 epoch: 26, train_loss: 0.7478, test_loss: 1.0730, test_f1: 0.5813
 epoch: 27, train_loss: 0.7430, test_loss: 1.1310, test_f1: 0.5744
 epoch: 28, train_loss: 0.7132, test_loss: 1.1057, test_f1: 0.5703
 epoch: 29, train_loss: 0.7328, test_loss: 1.0827, test_f1: 0.5997
 epoch: 30, train_loss: 0.7058, test_loss: 1.1549, test_f1: 0.5778
 epoch: 31, train_loss: 0.7113, test_loss: 1.1101, test_f1: 0.5735
 epoch: 32, train_loss: 0.7037, test_loss: 1.1777, test_f1: 0.5735
 epoch: 33, train_loss: 0.6995, test_loss: 1.1931, test_f1: 0.5766
 epoch: 34, train_loss: 0.6842, test_loss: 1.1727, test_f1: 0.5625
 epoch: 35, train_loss: 0.6746, test_loss: 1.1984, test_f1: 0.6009
 epoch: 36, train_loss: 0.6809, test_loss: 1.2345, test_f1: 0.5882
 epoch: 37, train_loss: 0.6607, test_loss: 1.2709, test_f1: 0.5566
 epoch: 38, train_loss: 0.6538, test_loss: 1.3138, test_f1: 0.5819
 epoch: 39, train_loss: 0.6545, test_loss: 1.2476, test_f1: 0.5835
 epoch: 40, train_loss: 0.6359, test_loss: 1.2977, test_f1: 0.6023
 epoch: 41, train_loss: 0.6409, test_loss: 1.3306, test_f1: 0.5322
 epoch: 42, train_loss: 0.6261, test_loss: 1.2621, test_f1: 0.6154
 epoch: 43, train_loss: 0.6260, test_loss: 1.3069, test_f1: 0.5879
 epoch: 44, train_loss: 0.6167, test_loss: 1.3690, test_f1: 0.5717
 epoch: 45, train_loss: 0.6143, test_loss: 1.2489, test_f1: 0.6058
 epoch: 46, train_loss: 0.6051, test_loss: 1.3141, test_f1: 0.6036
 epoch: 47, train_loss: 0.5947, test_loss: 1.3555, test_f1: 0.5932
 epoch: 48, train_loss: 0.5978, test_loss: 1.3358, test_f1: 0.5974
 epoch: 49, train_loss: 0.5857, test_loss: 1.4132, test_f1: 0.5888
 epoch: 50, train_loss: 0.6088, test_loss: 1.4185, test_f1: 0.5733
 epoch: 51, train_loss: 0.5719, test_loss: 1.4510, test_f1: 0.5882
 epoch: 52, train_loss: 0.5557, test_loss: 1.4681, test_f1: 0.5746
 epoch: 53, train_loss: 0.5555, test_loss: 1.4598, test_f1: 0.5981
 epoch: 54, train_loss: 0.5443, test_loss: 1.4773, test_f1: 0.5947
 epoch: 55, train_loss: 0.5264, test_loss: 1.5101, test_f1: 0.5671
 epoch: 56, train_loss: 0.5315, test_loss: 1.5684, test_f1: 0.5559
 epoch: 57, train_loss: 0.5297, test_loss: 1.5128, test_f1: 0.5870
 epoch: 58, train_loss: 0.5095, test_loss: 1.5579, test_f1: 0.5715
 epoch: 59, train_loss: 0.5228, test_loss: 1.5406, test_f1: 0.5651
 epoch: 60, train_loss: 0.5170, test_loss: 1.6369, test_f1: 0.5685
 epoch: 61, train_loss: 0.5255, test_loss: 1.5940, test_f1: 0.5654
 epoch: 62, train_loss: 0.5201, test_loss: 1.5424, test_f1: 0.5920
 epoch: 63, train_loss: 0.5168, test_loss: 1.6365, test_f1: 0.5681
 epoch: 64, train_loss: 0.5158, test_loss: 1.5815, test_f1: 0.5793
 epoch: 65, train_loss: 0.5162, test_loss: 1.6491, test_f1: 0.5654
 epoch: 66, train_loss: 0.4969, test_loss: 1.6305, test_f1: 0.5823
 epoch: 67, train_loss: 0.5087, test_loss: 1.6521, test_f1: 0.5666
 epoch: 68, train_loss: 0.4990, test_loss: 1.6492, test_f1: 0.5800
 epoch: 69, train_loss: 0.4895, test_loss: 1.7527, test_f1: 0.5661
 epoch: 70, train_loss: 0.4997, test_loss: 1.5745, test_f1: 0.5849
 epoch: 71, train_loss: 0.4842, test_loss: 1.6137, test_f1: 0.5878
 epoch: 72, train_loss: 0.4846, test_loss: 1.6619, test_f1: 0.5833
 epoch: 73, train_loss: 0.4868, test_loss: 1.6065, test_f1: 0.5773
 epoch: 74, train_loss: 0.4615, test_loss: 1.6623, test_f1: 0.5833
 epoch: 75, train_loss: 0.4567, test_loss: 1.7429, test_f1: 0.5707
 epoch: 76, train_loss: 0.4627, test_loss: 1.6677, test_f1: 0.5793
 epoch: 77, train_loss: 0.4736, test_loss: 1.6859, test_f1: 0.5690
 epoch: 78, train_loss: 0.4489, test_loss: 1.6361, test_f1: 0.5995
 epoch: 79, train_loss: 0.4788, test_loss: 1.7871, test_f1: 0.5800
 epoch: 80, train_loss: 0.4543, test_loss: 1.7058, test_f1: 0.5793
 epoch: 81, train_loss: 0.4552, test_loss: 1.7022, test_f1: 0.5973
 epoch: 82, train_loss: 0.4625, test_loss: 1.6623, test_f1: 0.6146
 epoch: 83, train_loss: 0.4507, test_loss: 1.8002, test_f1: 0.5884
 epoch: 84, train_loss: 0.4362, test_loss: 1.7772, test_f1: 0.5811
 epoch: 85, train_loss: 0.4380, test_loss: 1.7763, test_f1: 0.6013
 epoch: 86, train_loss: 0.4501, test_loss: 1.7877, test_f1: 0.5756
 epoch: 87, train_loss: 0.4367, test_loss: 1.8456, test_f1: 0.5579
 epoch: 88, train_loss: 0.4373, test_loss: 1.8105, test_f1: 0.5909
 epoch: 89, train_loss: 0.4256, test_loss: 1.8210, test_f1: 0.5858
 epoch: 90, train_loss: 0.4318, test_loss: 1.7899, test_f1: 0.5934
 epoch: 91, train_loss: 0.4306, test_loss: 1.8135, test_f1: 0.5790
 epoch: 92, train_loss: 0.4187, test_loss: 1.7914, test_f1: 0.6004
 epoch: 93, train_loss: 0.4058, test_loss: 1.8127, test_f1: 0.6014
 epoch: 94, train_loss: 0.4036, test_loss: 1.9033, test_f1: 0.5862
 epoch: 95, train_loss: 0.4296, test_loss: 1.9882, test_f1: 0.5766
 epoch: 96, train_loss: 0.4229, test_loss: 1.9142, test_f1: 0.5819
 epoch: 97, train_loss: 0.4290, test_loss: 2.0257, test_f1: 0.5554
 epoch: 98, train_loss: 0.3987, test_loss: 1.9229, test_f1: 0.5868
 epoch: 99, train_loss: 0.4130, test_loss: 1.8957, test_f1: 0.5742
##################ITERATION #4 ****************************************
 epoch: 0, train_loss: 1.1917, test_loss: 1.2956, test_f1: 0.2216
 epoch: 1, train_loss: 1.0837, test_loss: 1.2155, test_f1: 0.4829
 epoch: 2, train_loss: 1.0440, test_loss: 1.1617, test_f1: 0.4802
 epoch: 3, train_loss: 1.0225, test_loss: 1.0946, test_f1: 0.5129
 epoch: 4, train_loss: 1.0118, test_loss: 1.0795, test_f1: 0.5231
 epoch: 5, train_loss: 0.9966, test_loss: 1.0481, test_f1: 0.5205
 epoch: 6, train_loss: 0.9763, test_loss: 1.0605, test_f1: 0.5242
 epoch: 7, train_loss: 0.9447, test_loss: 1.0246, test_f1: 0.5554
 epoch: 8, train_loss: 0.9459, test_loss: 1.0151, test_f1: 0.5311
 epoch: 9, train_loss: 0.9256, test_loss: 1.0485, test_f1: 0.5495
 epoch: 10, train_loss: 0.9077, test_loss: 1.0235, test_f1: 0.5372
 epoch: 11, train_loss: 0.9016, test_loss: 1.0162, test_f1: 0.5391
 epoch: 12, train_loss: 0.8948, test_loss: 1.0148, test_f1: 0.5463
 epoch: 13, train_loss: 0.8657, test_loss: 1.0183, test_f1: 0.5520
 epoch: 14, train_loss: 0.8546, test_loss: 1.0174, test_f1: 0.5576
 epoch: 15, train_loss: 0.8603, test_loss: 1.0257, test_f1: 0.5646
 epoch: 16, train_loss: 0.8480, test_loss: 1.0668, test_f1: 0.5549
 epoch: 17, train_loss: 0.8310, test_loss: 1.0405, test_f1: 0.5516
 epoch: 18, train_loss: 0.8365, test_loss: 1.0170, test_f1: 0.5457
 epoch: 19, train_loss: 0.8127, test_loss: 1.0636, test_f1: 0.5412
 epoch: 20, train_loss: 0.8086, test_loss: 1.0204, test_f1: 0.5702
 epoch: 21, train_loss: 0.7987, test_loss: 1.0663, test_f1: 0.5834
 epoch: 22, train_loss: 0.7888, test_loss: 1.0668, test_f1: 0.5574
 epoch: 23, train_loss: 0.7904, test_loss: 1.0718, test_f1: 0.5823
 epoch: 24, train_loss: 0.7546, test_loss: 1.0517, test_f1: 0.5796
 epoch: 25, train_loss: 0.7829, test_loss: 1.0903, test_f1: 0.5754
 epoch: 26, train_loss: 0.7537, test_loss: 1.0645, test_f1: 0.5860
 epoch: 27, train_loss: 0.7487, test_loss: 1.1303, test_f1: 0.5908
 epoch: 28, train_loss: 0.7498, test_loss: 1.1118, test_f1: 0.5879
 epoch: 29, train_loss: 0.7414, test_loss: 1.1004, test_f1: 0.5963
 epoch: 30, train_loss: 0.7313, test_loss: 1.1372, test_f1: 0.5875
 epoch: 31, train_loss: 0.7330, test_loss: 1.1443, test_f1: 0.5805
 epoch: 32, train_loss: 0.7309, test_loss: 1.0816, test_f1: 0.5757
 epoch: 33, train_loss: 0.7256, test_loss: 1.1354, test_f1: 0.5997
 epoch: 34, train_loss: 0.7001, test_loss: 1.1671, test_f1: 0.5795
 epoch: 35, train_loss: 0.6977, test_loss: 1.1794, test_f1: 0.6019
 epoch: 36, train_loss: 0.7061, test_loss: 1.1400, test_f1: 0.5972
 epoch: 37, train_loss: 0.6798, test_loss: 1.1983, test_f1: 0.5912
 epoch: 38, train_loss: 0.6773, test_loss: 1.1522, test_f1: 0.6011
 epoch: 39, train_loss: 0.6918, test_loss: 1.2150, test_f1: 0.5679
 epoch: 40, train_loss: 0.6678, test_loss: 1.2015, test_f1: 0.5957
 epoch: 41, train_loss: 0.6920, test_loss: 1.1943, test_f1: 0.5906
 epoch: 42, train_loss: 0.6536, test_loss: 1.2332, test_f1: 0.5909
 epoch: 43, train_loss: 0.6696, test_loss: 1.2592, test_f1: 0.6007
 epoch: 44, train_loss: 0.6616, test_loss: 1.2375, test_f1: 0.6224
 epoch: 45, train_loss: 0.6338, test_loss: 1.3043, test_f1: 0.5323
 epoch: 46, train_loss: 0.6400, test_loss: 1.2877, test_f1: 0.5922
 epoch: 47, train_loss: 0.6510, test_loss: 1.2892, test_f1: 0.5814
 epoch: 48, train_loss: 0.6082, test_loss: 1.2968, test_f1: 0.6114
 epoch: 49, train_loss: 0.6374, test_loss: 1.2568, test_f1: 0.5816
 epoch: 50, train_loss: 0.6154, test_loss: 1.3731, test_f1: 0.5868
 epoch: 51, train_loss: 0.5896, test_loss: 1.3028, test_f1: 0.6122
 epoch: 52, train_loss: 0.5913, test_loss: 1.3739, test_f1: 0.6104
 epoch: 53, train_loss: 0.5797, test_loss: 1.3442, test_f1: 0.6260
 epoch: 54, train_loss: 0.5858, test_loss: 1.3320, test_f1: 0.6202
 epoch: 55, train_loss: 0.5603, test_loss: 1.3563, test_f1: 0.6056
 epoch: 56, train_loss: 0.5604, test_loss: 1.3365, test_f1: 0.6263
 epoch: 57, train_loss: 0.5677, test_loss: 1.3754, test_f1: 0.6160
 epoch: 58, train_loss: 0.5593, test_loss: 1.3600, test_f1: 0.6105
 epoch: 59, train_loss: 0.5500, test_loss: 1.3417, test_f1: 0.6204
 epoch: 60, train_loss: 0.5533, test_loss: 1.4015, test_f1: 0.5877
 epoch: 61, train_loss: 0.5558, test_loss: 1.4468, test_f1: 0.5980
 epoch: 62, train_loss: 0.5665, test_loss: 1.3980, test_f1: 0.6127
 epoch: 63, train_loss: 0.5524, test_loss: 1.4646, test_f1: 0.5889
 epoch: 64, train_loss: 0.5326, test_loss: 1.4170, test_f1: 0.5978
 epoch: 65, train_loss: 0.5505, test_loss: 1.3971, test_f1: 0.6088
 epoch: 66, train_loss: 0.5428, test_loss: 1.3886, test_f1: 0.5978
 epoch: 67, train_loss: 0.5261, test_loss: 1.4352, test_f1: 0.5973
 epoch: 68, train_loss: 0.5192, test_loss: 1.4182, test_f1: 0.5909
 epoch: 69, train_loss: 0.5316, test_loss: 1.4459, test_f1: 0.5859
 epoch: 70, train_loss: 0.5180, test_loss: 1.5166, test_f1: 0.5997
 epoch: 71, train_loss: 0.5280, test_loss: 1.4335, test_f1: 0.5867
 epoch: 72, train_loss: 0.5120, test_loss: 1.4269, test_f1: 0.6087
 epoch: 73, train_loss: 0.4965, test_loss: 1.5108, test_f1: 0.5921
 epoch: 74, train_loss: 0.5058, test_loss: 1.4859, test_f1: 0.5864
 epoch: 75, train_loss: 0.5048, test_loss: 1.5511, test_f1: 0.5758
 epoch: 76, train_loss: 0.4944, test_loss: 1.5247, test_f1: 0.6035
 epoch: 77, train_loss: 0.5076, test_loss: 1.5007, test_f1: 0.6011
 epoch: 78, train_loss: 0.4880, test_loss: 1.4874, test_f1: 0.6089
 epoch: 79, train_loss: 0.4968, test_loss: 1.5014, test_f1: 0.6019
 epoch: 80, train_loss: 0.4818, test_loss: 1.5935, test_f1: 0.5953
 epoch: 81, train_loss: 0.4728, test_loss: 1.5470, test_f1: 0.5782
 epoch: 82, train_loss: 0.4893, test_loss: 1.5557, test_f1: 0.5978
 epoch: 83, train_loss: 0.4733, test_loss: 1.6400, test_f1: 0.5991
 epoch: 84, train_loss: 0.4944, test_loss: 1.5368, test_f1: 0.6048
 epoch: 85, train_loss: 0.4845, test_loss: 1.5608, test_f1: 0.6003
 epoch: 86, train_loss: 0.4693, test_loss: 1.5786, test_f1: 0.5952
 epoch: 87, train_loss: 0.4540, test_loss: 1.5665, test_f1: 0.5847
 epoch: 88, train_loss: 0.4603, test_loss: 1.6409, test_f1: 0.5749
 epoch: 89, train_loss: 0.4650, test_loss: 1.6657, test_f1: 0.6034
 epoch: 90, train_loss: 0.4736, test_loss: 1.6533, test_f1: 0.5846
 epoch: 91, train_loss: 0.4646, test_loss: 1.6337, test_f1: 0.5778
 epoch: 92, train_loss: 0.4629, test_loss: 1.6144, test_f1: 0.5764
 epoch: 93, train_loss: 0.4513, test_loss: 1.7055, test_f1: 0.5876
 epoch: 94, train_loss: 0.4229, test_loss: 1.7278, test_f1: 0.5770
 epoch: 95, train_loss: 0.4500, test_loss: 1.7141, test_f1: 0.5672
 epoch: 96, train_loss: 0.4533, test_loss: 1.6888, test_f1: 0.5749
 epoch: 97, train_loss: 0.4505, test_loss: 1.7761, test_f1: 0.5794
 epoch: 98, train_loss: 0.4334, test_loss: 1.7579, test_f1: 0.5821
 epoch: 99, train_loss: 0.4338, test_loss: 1.7835, test_f1: 0.5815
##################ITERATION #5 ****************************************
 epoch: 0, train_loss: 1.2012, test_loss: 1.3231, test_f1: 0.2940
 epoch: 1, train_loss: 1.0957, test_loss: 1.1953, test_f1: 0.3687
 epoch: 2, train_loss: 1.0583, test_loss: 1.1222, test_f1: 0.4939
 epoch: 3, train_loss: 1.0274, test_loss: 1.0771, test_f1: 0.5220
 epoch: 4, train_loss: 1.0049, test_loss: 1.0545, test_f1: 0.5261
 epoch: 5, train_loss: 0.9929, test_loss: 1.0583, test_f1: 0.5267
 epoch: 6, train_loss: 0.9633, test_loss: 1.0233, test_f1: 0.5441
 epoch: 7, train_loss: 0.9529, test_loss: 1.0224, test_f1: 0.5456
 epoch: 8, train_loss: 0.9444, test_loss: 1.0185, test_f1: 0.5134
 epoch: 9, train_loss: 0.9205, test_loss: 1.0002, test_f1: 0.5282
 epoch: 10, train_loss: 0.9259, test_loss: 1.0149, test_f1: 0.5622
 epoch: 11, train_loss: 0.8963, test_loss: 1.0051, test_f1: 0.5191
 epoch: 12, train_loss: 0.8811, test_loss: 0.9894, test_f1: 0.5162
 epoch: 13, train_loss: 0.8870, test_loss: 1.0016, test_f1: 0.5358
 epoch: 14, train_loss: 0.8662, test_loss: 1.0120, test_f1: 0.5584
 epoch: 15, train_loss: 0.8709, test_loss: 1.0064, test_f1: 0.5734
 epoch: 16, train_loss: 0.8662, test_loss: 1.0320, test_f1: 0.5292
 epoch: 17, train_loss: 0.8328, test_loss: 1.0299, test_f1: 0.5496
 epoch: 18, train_loss: 0.8464, test_loss: 1.0132, test_f1: 0.5488
 epoch: 19, train_loss: 0.8286, test_loss: 1.0113, test_f1: 0.5500
 epoch: 20, train_loss: 0.8316, test_loss: 1.0067, test_f1: 0.5656
 epoch: 21, train_loss: 0.8256, test_loss: 1.0086, test_f1: 0.5785
 epoch: 22, train_loss: 0.8257, test_loss: 1.0240, test_f1: 0.5576
 epoch: 23, train_loss: 0.7831, test_loss: 1.0131, test_f1: 0.5460
 epoch: 24, train_loss: 0.7866, test_loss: 0.9932, test_f1: 0.5554
 epoch: 25, train_loss: 0.7690, test_loss: 1.0572, test_f1: 0.5621
 epoch: 26, train_loss: 0.7875, test_loss: 1.0671, test_f1: 0.5641
 epoch: 27, train_loss: 0.7536, test_loss: 1.0510, test_f1: 0.5374
 epoch: 28, train_loss: 0.7701, test_loss: 1.0441, test_f1: 0.5685
 epoch: 29, train_loss: 0.7625, test_loss: 1.0432, test_f1: 0.5720
 epoch: 30, train_loss: 0.7573, test_loss: 1.0271, test_f1: 0.5727
 epoch: 31, train_loss: 0.7277, test_loss: 1.0496, test_f1: 0.5782
 epoch: 32, train_loss: 0.7288, test_loss: 1.0257, test_f1: 0.5669
 epoch: 33, train_loss: 0.7281, test_loss: 1.0540, test_f1: 0.5969
 epoch: 34, train_loss: 0.7133, test_loss: 1.0766, test_f1: 0.5749
 epoch: 35, train_loss: 0.7129, test_loss: 1.0460, test_f1: 0.5761
 epoch: 36, train_loss: 0.7216, test_loss: 1.0748, test_f1: 0.6152
 epoch: 37, train_loss: 0.7207, test_loss: 1.0460, test_f1: 0.5878
 epoch: 38, train_loss: 0.7113, test_loss: 1.0389, test_f1: 0.6209
 epoch: 39, train_loss: 0.6867, test_loss: 1.0396, test_f1: 0.6205
 epoch: 40, train_loss: 0.6856, test_loss: 1.0551, test_f1: 0.5875
 epoch: 41, train_loss: 0.6946, test_loss: 1.1109, test_f1: 0.5841
 epoch: 42, train_loss: 0.6828, test_loss: 1.0875, test_f1: 0.5762
 epoch: 43, train_loss: 0.6700, test_loss: 1.1292, test_f1: 0.5788
 epoch: 44, train_loss: 0.6580, test_loss: 1.1327, test_f1: 0.5673
 epoch: 45, train_loss: 0.6592, test_loss: 1.1528, test_f1: 0.5692
 epoch: 46, train_loss: 0.6809, test_loss: 1.1742, test_f1: 0.6061
 epoch: 47, train_loss: 0.6558, test_loss: 1.1018, test_f1: 0.6086
 epoch: 48, train_loss: 0.6563, test_loss: 1.0959, test_f1: 0.5927
 epoch: 49, train_loss: 0.6418, test_loss: 1.1152, test_f1: 0.6044
 epoch: 50, train_loss: 0.6229, test_loss: 1.1074, test_f1: 0.5993
 epoch: 51, train_loss: 0.6091, test_loss: 1.1479, test_f1: 0.5695
 epoch: 52, train_loss: 0.6100, test_loss: 1.1555, test_f1: 0.5962
 epoch: 53, train_loss: 0.6070, test_loss: 1.1747, test_f1: 0.5792
 epoch: 54, train_loss: 0.6101, test_loss: 1.1381, test_f1: 0.6020
 epoch: 55, train_loss: 0.5870, test_loss: 1.1156, test_f1: 0.6024
 epoch: 56, train_loss: 0.5919, test_loss: 1.1506, test_f1: 0.6045
 epoch: 57, train_loss: 0.5839, test_loss: 1.1426, test_f1: 0.6175
 epoch: 58, train_loss: 0.5771, test_loss: 1.1532, test_f1: 0.6100
 epoch: 59, train_loss: 0.5708, test_loss: 1.1565, test_f1: 0.6127
 epoch: 60, train_loss: 0.5781, test_loss: 1.2089, test_f1: 0.6115
 epoch: 61, train_loss: 0.5894, test_loss: 1.1641, test_f1: 0.6123
 epoch: 62, train_loss: 0.5557, test_loss: 1.2103, test_f1: 0.6028
 epoch: 63, train_loss: 0.5840, test_loss: 1.2420, test_f1: 0.6170
 epoch: 64, train_loss: 0.5630, test_loss: 1.2126, test_f1: 0.6128
 epoch: 65, train_loss: 0.5656, test_loss: 1.2482, test_f1: 0.5929
 epoch: 66, train_loss: 0.5479, test_loss: 1.2458, test_f1: 0.5867
 epoch: 67, train_loss: 0.5514, test_loss: 1.2370, test_f1: 0.6075
 epoch: 68, train_loss: 0.5602, test_loss: 1.2657, test_f1: 0.5910
 epoch: 69, train_loss: 0.5769, test_loss: 1.2331, test_f1: 0.6074
 epoch: 70, train_loss: 0.5510, test_loss: 1.2419, test_f1: 0.6100
 epoch: 71, train_loss: 0.5366, test_loss: 1.2131, test_f1: 0.6331
 epoch: 72, train_loss: 0.5455, test_loss: 1.2666, test_f1: 0.6011
 epoch: 73, train_loss: 0.5479, test_loss: 1.2651, test_f1: 0.6076
 epoch: 74, train_loss: 0.5292, test_loss: 1.2811, test_f1: 0.5979
 epoch: 75, train_loss: 0.5314, test_loss: 1.3003, test_f1: 0.6308
 epoch: 76, train_loss: 0.5344, test_loss: 1.2463, test_f1: 0.6205
 epoch: 77, train_loss: 0.5396, test_loss: 1.2923, test_f1: 0.6379
 epoch: 78, train_loss: 0.5255, test_loss: 1.1968, test_f1: 0.6174
 epoch: 79, train_loss: 0.5192, test_loss: 1.2775, test_f1: 0.6212
 epoch: 80, train_loss: 0.5268, test_loss: 1.2689, test_f1: 0.6112
 epoch: 81, train_loss: 0.5337, test_loss: 1.3421, test_f1: 0.5902
 epoch: 82, train_loss: 0.5073, test_loss: 1.3252, test_f1: 0.6132
 epoch: 83, train_loss: 0.5189, test_loss: 1.3514, test_f1: 0.6080
 epoch: 84, train_loss: 0.5148, test_loss: 1.3617, test_f1: 0.6049
 epoch: 85, train_loss: 0.5153, test_loss: 1.2642, test_f1: 0.6085
 epoch: 86, train_loss: 0.5272, test_loss: 1.3653, test_f1: 0.6052
 epoch: 87, train_loss: 0.4997, test_loss: 1.3240, test_f1: 0.6045
 epoch: 88, train_loss: 0.5136, test_loss: 1.3092, test_f1: 0.6092
 epoch: 89, train_loss: 0.4939, test_loss: 1.3698, test_f1: 0.6188
 epoch: 90, train_loss: 0.5070, test_loss: 1.3428, test_f1: 0.6153
 epoch: 91, train_loss: 0.5082, test_loss: 1.3753, test_f1: 0.6143
 epoch: 92, train_loss: 0.4913, test_loss: 1.4369, test_f1: 0.6014
 epoch: 93, train_loss: 0.4960, test_loss: 1.3602, test_f1: 0.6219
 epoch: 94, train_loss: 0.4814, test_loss: 1.4279, test_f1: 0.6145
 epoch: 95, train_loss: 0.4829, test_loss: 1.3967, test_f1: 0.6053
 epoch: 96, train_loss: 0.4731, test_loss: 1.3926, test_f1: 0.6012
 epoch: 97, train_loss: 0.4650, test_loss: 1.4404, test_f1: 0.5907
 epoch: 98, train_loss: 0.4893, test_loss: 1.3133, test_f1: 0.6331
 epoch: 99, train_loss: 0.4687, test_loss: 1.3589, test_f1: 0.6113
##################ITERATION #6 ****************************************
 epoch: 0, train_loss: 1.2030, test_loss: 1.2999, test_f1: 0.3880
 epoch: 1, train_loss: 1.0767, test_loss: 1.2702, test_f1: 0.3959
 epoch: 2, train_loss: 1.0517, test_loss: 1.1544, test_f1: 0.4852
 epoch: 3, train_loss: 1.0187, test_loss: 1.1040, test_f1: 0.5075
 epoch: 4, train_loss: 0.9822, test_loss: 1.1065, test_f1: 0.5339
 epoch: 5, train_loss: 0.9781, test_loss: 1.0724, test_f1: 0.5388
 epoch: 6, train_loss: 0.9636, test_loss: 1.0468, test_f1: 0.5481
 epoch: 7, train_loss: 0.9423, test_loss: 1.0418, test_f1: 0.5562
 epoch: 8, train_loss: 0.9397, test_loss: 1.0301, test_f1: 0.5591
 epoch: 9, train_loss: 0.9068, test_loss: 1.0279, test_f1: 0.5624
 epoch: 10, train_loss: 0.8903, test_loss: 1.0328, test_f1: 0.5490
 epoch: 11, train_loss: 0.8813, test_loss: 1.0432, test_f1: 0.5566
 epoch: 12, train_loss: 0.8794, test_loss: 1.0031, test_f1: 0.5815
 epoch: 13, train_loss: 0.8468, test_loss: 1.0327, test_f1: 0.5711
 epoch: 14, train_loss: 0.8607, test_loss: 1.0383, test_f1: 0.5855
 epoch: 15, train_loss: 0.8450, test_loss: 1.0609, test_f1: 0.5590
 epoch: 16, train_loss: 0.8385, test_loss: 1.0261, test_f1: 0.5867
 epoch: 17, train_loss: 0.8236, test_loss: 1.0227, test_f1: 0.5889
 epoch: 18, train_loss: 0.8215, test_loss: 0.9950, test_f1: 0.6041
 epoch: 19, train_loss: 0.7955, test_loss: 1.0231, test_f1: 0.5914
 epoch: 20, train_loss: 0.7803, test_loss: 1.0168, test_f1: 0.5905
 epoch: 21, train_loss: 0.7836, test_loss: 1.0621, test_f1: 0.5887
 epoch: 22, train_loss: 0.7870, test_loss: 1.0281, test_f1: 0.5927
 epoch: 23, train_loss: 0.7887, test_loss: 1.0409, test_f1: 0.5944
 epoch: 24, train_loss: 0.7861, test_loss: 1.0848, test_f1: 0.5793
 epoch: 25, train_loss: 0.7597, test_loss: 1.0324, test_f1: 0.5858
 epoch: 26, train_loss: 0.7600, test_loss: 1.0420, test_f1: 0.5979
 epoch: 27, train_loss: 0.7481, test_loss: 1.0770, test_f1: 0.6057
 epoch: 28, train_loss: 0.7465, test_loss: 1.0910, test_f1: 0.5968
 epoch: 29, train_loss: 0.7349, test_loss: 1.0655, test_f1: 0.5961
 epoch: 30, train_loss: 0.7326, test_loss: 1.0584, test_f1: 0.5844
 epoch: 31, train_loss: 0.7102, test_loss: 1.0917, test_f1: 0.5771
 epoch: 32, train_loss: 0.7210, test_loss: 1.1213, test_f1: 0.5850
 epoch: 33, train_loss: 0.7287, test_loss: 1.1957, test_f1: 0.5981
 epoch: 34, train_loss: 0.6950, test_loss: 1.0845, test_f1: 0.5960
 epoch: 35, train_loss: 0.7114, test_loss: 1.1101, test_f1: 0.5982
 epoch: 36, train_loss: 0.6898, test_loss: 1.1062, test_f1: 0.5932
 epoch: 37, train_loss: 0.6980, test_loss: 1.0951, test_f1: 0.5849
 epoch: 38, train_loss: 0.6706, test_loss: 1.1426, test_f1: 0.5985
 epoch: 39, train_loss: 0.6756, test_loss: 1.0690, test_f1: 0.6030
 epoch: 40, train_loss: 0.6825, test_loss: 1.1852, test_f1: 0.5846
 epoch: 41, train_loss: 0.6654, test_loss: 1.1861, test_f1: 0.5836
 epoch: 42, train_loss: 0.6805, test_loss: 1.1218, test_f1: 0.6050
 epoch: 43, train_loss: 0.6694, test_loss: 1.1512, test_f1: 0.6238
 epoch: 44, train_loss: 0.6357, test_loss: 1.1789, test_f1: 0.5998
 epoch: 45, train_loss: 0.6496, test_loss: 1.2170, test_f1: 0.5920
 epoch: 46, train_loss: 0.6398, test_loss: 1.1956, test_f1: 0.6082
 epoch: 47, train_loss: 0.6551, test_loss: 1.2515, test_f1: 0.5805
 epoch: 48, train_loss: 0.6380, test_loss: 1.3150, test_f1: 0.5998
 epoch: 49, train_loss: 0.6247, test_loss: 1.2529, test_f1: 0.6030
 epoch: 50, train_loss: 0.6255, test_loss: 1.3040, test_f1: 0.6105
 epoch: 51, train_loss: 0.6089, test_loss: 1.2771, test_f1: 0.5966
 epoch: 52, train_loss: 0.6102, test_loss: 1.2672, test_f1: 0.5952
 epoch: 53, train_loss: 0.5970, test_loss: 1.2690, test_f1: 0.6019
 epoch: 54, train_loss: 0.5899, test_loss: 1.2804, test_f1: 0.6199
 epoch: 55, train_loss: 0.5898, test_loss: 1.3369, test_f1: 0.5902
 epoch: 56, train_loss: 0.5959, test_loss: 1.3012, test_f1: 0.6210
 epoch: 57, train_loss: 0.5811, test_loss: 1.3178, test_f1: 0.6074
 epoch: 58, train_loss: 0.5652, test_loss: 1.3423, test_f1: 0.6133
 epoch: 59, train_loss: 0.5558, test_loss: 1.3868, test_f1: 0.6178
 epoch: 60, train_loss: 0.5616, test_loss: 1.3643, test_f1: 0.6243
 epoch: 61, train_loss: 0.5777, test_loss: 1.4151, test_f1: 0.5993
 epoch: 62, train_loss: 0.5711, test_loss: 1.4054, test_f1: 0.6111
 epoch: 63, train_loss: 0.5522, test_loss: 1.4843, test_f1: 0.5907
 epoch: 64, train_loss: 0.5626, test_loss: 1.3823, test_f1: 0.6106
 epoch: 65, train_loss: 0.5434, test_loss: 1.4164, test_f1: 0.5988
 epoch: 66, train_loss: 0.5432, test_loss: 1.4139, test_f1: 0.6060
 epoch: 67, train_loss: 0.5347, test_loss: 1.4037, test_f1: 0.6059
 epoch: 68, train_loss: 0.5380, test_loss: 1.4415, test_f1: 0.6038
 epoch: 69, train_loss: 0.5415, test_loss: 1.4597, test_f1: 0.5880
 epoch: 70, train_loss: 0.5298, test_loss: 1.4244, test_f1: 0.6079
 epoch: 71, train_loss: 0.5421, test_loss: 1.4272, test_f1: 0.6373
 epoch: 72, train_loss: 0.5260, test_loss: 1.4405, test_f1: 0.6232
 epoch: 73, train_loss: 0.5300, test_loss: 1.4809, test_f1: 0.6032
 epoch: 74, train_loss: 0.5165, test_loss: 1.4599, test_f1: 0.6209
 epoch: 75, train_loss: 0.5128, test_loss: 1.4258, test_f1: 0.6275
 epoch: 76, train_loss: 0.5132, test_loss: 1.5443, test_f1: 0.6084
 epoch: 77, train_loss: 0.5007, test_loss: 1.5182, test_f1: 0.6066
 epoch: 78, train_loss: 0.5112, test_loss: 1.5642, test_f1: 0.6189
 epoch: 79, train_loss: 0.4950, test_loss: 1.6034, test_f1: 0.6045
 epoch: 80, train_loss: 0.4945, test_loss: 1.5576, test_f1: 0.6055
 epoch: 81, train_loss: 0.5162, test_loss: 1.5184, test_f1: 0.6127
 epoch: 82, train_loss: 0.4910, test_loss: 1.5952, test_f1: 0.6107
 epoch: 83, train_loss: 0.4865, test_loss: 1.5718, test_f1: 0.6040
 epoch: 84, train_loss: 0.4861, test_loss: 1.6061, test_f1: 0.6125
 epoch: 85, train_loss: 0.4739, test_loss: 1.6041, test_f1: 0.6110
 epoch: 86, train_loss: 0.4756, test_loss: 1.6079, test_f1: 0.6026
 epoch: 87, train_loss: 0.4768, test_loss: 1.5834, test_f1: 0.6215
 epoch: 88, train_loss: 0.4710, test_loss: 1.6032, test_f1: 0.6325
 epoch: 89, train_loss: 0.4662, test_loss: 1.6013, test_f1: 0.6161
 epoch: 90, train_loss: 0.4641, test_loss: 1.6292, test_f1: 0.5969
 epoch: 91, train_loss: 0.4643, test_loss: 1.7042, test_f1: 0.6136
 epoch: 92, train_loss: 0.4455, test_loss: 1.6923, test_f1: 0.5787
 epoch: 93, train_loss: 0.4533, test_loss: 1.7167, test_f1: 0.6072
 epoch: 94, train_loss: 0.4639, test_loss: 1.6649, test_f1: 0.5945
 epoch: 95, train_loss: 0.4807, test_loss: 1.7080, test_f1: 0.6102
 epoch: 96, train_loss: 0.4644, test_loss: 1.7595, test_f1: 0.5852
 epoch: 97, train_loss: 0.4513, test_loss: 1.6850, test_f1: 0.5780
 epoch: 98, train_loss: 0.4674, test_loss: 1.6447, test_f1: 0.5944
 epoch: 99, train_loss: 0.4545, test_loss: 1.6832, test_f1: 0.5961
##################ITERATION #7 ****************************************
 epoch: 0, train_loss: 1.2010, test_loss: 1.2958, test_f1: 0.3234
 epoch: 1, train_loss: 1.0798, test_loss: 1.2065, test_f1: 0.3774
 epoch: 2, train_loss: 1.0359, test_loss: 1.1193, test_f1: 0.4396
 epoch: 3, train_loss: 1.0228, test_loss: 1.0543, test_f1: 0.5274
 epoch: 4, train_loss: 0.9951, test_loss: 1.0343, test_f1: 0.5134
 epoch: 5, train_loss: 0.9815, test_loss: 1.0300, test_f1: 0.5422
 epoch: 6, train_loss: 0.9536, test_loss: 1.0494, test_f1: 0.5402
 epoch: 7, train_loss: 0.9305, test_loss: 1.0269, test_f1: 0.5332
 epoch: 8, train_loss: 0.9181, test_loss: 1.0195, test_f1: 0.5443
 epoch: 9, train_loss: 0.9190, test_loss: 1.0387, test_f1: 0.5593
 epoch: 10, train_loss: 0.8938, test_loss: 1.0139, test_f1: 0.5515
 epoch: 11, train_loss: 0.9030, test_loss: 1.0164, test_f1: 0.5538
 epoch: 12, train_loss: 0.8653, test_loss: 1.0488, test_f1: 0.5458
 epoch: 13, train_loss: 0.8733, test_loss: 1.0407, test_f1: 0.5569
 epoch: 14, train_loss: 0.8472, test_loss: 1.0507, test_f1: 0.5671
 epoch: 15, train_loss: 0.8568, test_loss: 1.0465, test_f1: 0.5713
 epoch: 16, train_loss: 0.8313, test_loss: 1.0217, test_f1: 0.5831
 epoch: 17, train_loss: 0.8394, test_loss: 1.0285, test_f1: 0.5864
 epoch: 18, train_loss: 0.8068, test_loss: 1.0374, test_f1: 0.5795
 epoch: 19, train_loss: 0.7920, test_loss: 1.0431, test_f1: 0.5832
 epoch: 20, train_loss: 0.8143, test_loss: 1.0416, test_f1: 0.5679
 epoch: 21, train_loss: 0.8050, test_loss: 1.0512, test_f1: 0.5901
 epoch: 22, train_loss: 0.7986, test_loss: 1.0459, test_f1: 0.5863
 epoch: 23, train_loss: 0.7808, test_loss: 1.0483, test_f1: 0.5885
 epoch: 24, train_loss: 0.7722, test_loss: 1.0222, test_f1: 0.6050
 epoch: 25, train_loss: 0.7676, test_loss: 1.0758, test_f1: 0.5759
 epoch: 26, train_loss: 0.7803, test_loss: 1.0788, test_f1: 0.5854
 epoch: 27, train_loss: 0.7656, test_loss: 1.0377, test_f1: 0.5932
 epoch: 28, train_loss: 0.7464, test_loss: 1.0535, test_f1: 0.6037
 epoch: 29, train_loss: 0.7381, test_loss: 1.1265, test_f1: 0.6039
 epoch: 30, train_loss: 0.7325, test_loss: 1.0602, test_f1: 0.6263
 epoch: 31, train_loss: 0.7395, test_loss: 1.0925, test_f1: 0.6181
 epoch: 32, train_loss: 0.7184, test_loss: 1.0595, test_f1: 0.6173
 epoch: 33, train_loss: 0.7185, test_loss: 1.0722, test_f1: 0.6299
 epoch: 34, train_loss: 0.7253, test_loss: 1.0996, test_f1: 0.6110
 epoch: 35, train_loss: 0.7111, test_loss: 1.0896, test_f1: 0.5992
 epoch: 36, train_loss: 0.7039, test_loss: 1.1509, test_f1: 0.5975
 epoch: 37, train_loss: 0.6808, test_loss: 1.1193, test_f1: 0.6089
 epoch: 38, train_loss: 0.6999, test_loss: 1.0866, test_f1: 0.6238
 epoch: 39, train_loss: 0.6872, test_loss: 1.0690, test_f1: 0.6314
 epoch: 40, train_loss: 0.6726, test_loss: 1.1409, test_f1: 0.6089
 epoch: 41, train_loss: 0.6715, test_loss: 1.1535, test_f1: 0.6021
 epoch: 42, train_loss: 0.6713, test_loss: 1.1912, test_f1: 0.6041
 epoch: 43, train_loss: 0.6652, test_loss: 1.1645, test_f1: 0.6090
 epoch: 44, train_loss: 0.6497, test_loss: 1.1585, test_f1: 0.6274
 epoch: 45, train_loss: 0.6489, test_loss: 1.2240, test_f1: 0.6060
 epoch: 46, train_loss: 0.6505, test_loss: 1.1253, test_f1: 0.6058
 epoch: 47, train_loss: 0.6399, test_loss: 1.1699, test_f1: 0.6159
 epoch: 48, train_loss: 0.6394, test_loss: 1.1710, test_f1: 0.6237
 epoch: 49, train_loss: 0.6392, test_loss: 1.2056, test_f1: 0.6034
 epoch: 50, train_loss: 0.6168, test_loss: 1.2375, test_f1: 0.5933
 epoch: 51, train_loss: 0.6066, test_loss: 1.2007, test_f1: 0.6044
 epoch: 52, train_loss: 0.5818, test_loss: 1.1793, test_f1: 0.6190
 epoch: 53, train_loss: 0.6076, test_loss: 1.1811, test_f1: 0.6142
 epoch: 54, train_loss: 0.5947, test_loss: 1.2220, test_f1: 0.6442
 epoch: 55, train_loss: 0.5760, test_loss: 1.2267, test_f1: 0.5925
 epoch: 56, train_loss: 0.5850, test_loss: 1.2137, test_f1: 0.5928
 epoch: 57, train_loss: 0.5810, test_loss: 1.2297, test_f1: 0.5928
 epoch: 58, train_loss: 0.5699, test_loss: 1.2153, test_f1: 0.6158
 epoch: 59, train_loss: 0.5681, test_loss: 1.2095, test_f1: 0.6052
 epoch: 60, train_loss: 0.5634, test_loss: 1.2533, test_f1: 0.5967
 epoch: 61, train_loss: 0.5527, test_loss: 1.2427, test_f1: 0.5984
 epoch: 62, train_loss: 0.5502, test_loss: 1.2391, test_f1: 0.6393
 epoch: 63, train_loss: 0.5452, test_loss: 1.2452, test_f1: 0.6389
 epoch: 64, train_loss: 0.5620, test_loss: 1.2836, test_f1: 0.5969
 epoch: 65, train_loss: 0.5531, test_loss: 1.2305, test_f1: 0.6287
 epoch: 66, train_loss: 0.5450, test_loss: 1.2639, test_f1: 0.6255
 epoch: 67, train_loss: 0.5426, test_loss: 1.2699, test_f1: 0.6315
 epoch: 68, train_loss: 0.5524, test_loss: 1.2583, test_f1: 0.6255
 epoch: 69, train_loss: 0.5334, test_loss: 1.2818, test_f1: 0.6218
 epoch: 70, train_loss: 0.5253, test_loss: 1.2940, test_f1: 0.6267
 epoch: 71, train_loss: 0.5378, test_loss: 1.3122, test_f1: 0.6350
 epoch: 72, train_loss: 0.5357, test_loss: 1.3135, test_f1: 0.6341
 epoch: 73, train_loss: 0.5359, test_loss: 1.3172, test_f1: 0.6130
 epoch: 74, train_loss: 0.5326, test_loss: 1.2975, test_f1: 0.6273
 epoch: 75, train_loss: 0.5083, test_loss: 1.3147, test_f1: 0.6215
 epoch: 76, train_loss: 0.5158, test_loss: 1.3479, test_f1: 0.6424
 epoch: 77, train_loss: 0.5195, test_loss: 1.3395, test_f1: 0.6269
 epoch: 78, train_loss: 0.5037, test_loss: 1.3431, test_f1: 0.6079
 epoch: 79, train_loss: 0.5035, test_loss: 1.3696, test_f1: 0.5954
 epoch: 80, train_loss: 0.5107, test_loss: 1.4150, test_f1: 0.6000
 epoch: 81, train_loss: 0.4993, test_loss: 1.4305, test_f1: 0.6015
 epoch: 82, train_loss: 0.5003, test_loss: 1.4009, test_f1: 0.5980
 epoch: 83, train_loss: 0.5035, test_loss: 1.3706, test_f1: 0.6173
 epoch: 84, train_loss: 0.4932, test_loss: 1.4626, test_f1: 0.6064
 epoch: 85, train_loss: 0.5069, test_loss: 1.4113, test_f1: 0.6143
 epoch: 86, train_loss: 0.4883, test_loss: 1.4686, test_f1: 0.6314
 epoch: 87, train_loss: 0.4853, test_loss: 1.3883, test_f1: 0.6197
 epoch: 88, train_loss: 0.4790, test_loss: 1.4305, test_f1: 0.6300
 epoch: 89, train_loss: 0.4677, test_loss: 1.5156, test_f1: 0.6119
 epoch: 90, train_loss: 0.4818, test_loss: 1.4901, test_f1: 0.6113
 epoch: 91, train_loss: 0.4903, test_loss: 1.5088, test_f1: 0.6362
 epoch: 92, train_loss: 0.4563, test_loss: 1.4780, test_f1: 0.6090
 epoch: 93, train_loss: 0.4898, test_loss: 1.4416, test_f1: 0.6287
 epoch: 94, train_loss: 0.4828, test_loss: 1.4120, test_f1: 0.6318
 epoch: 95, train_loss: 0.4714, test_loss: 1.4718, test_f1: 0.6069
 epoch: 96, train_loss: 0.4658, test_loss: 1.4798, test_f1: 0.6034
 epoch: 97, train_loss: 0.4650, test_loss: 1.4623, test_f1: 0.6257
 epoch: 98, train_loss: 0.4550, test_loss: 1.5037, test_f1: 0.6146
 epoch: 99, train_loss: 0.4456, test_loss: 1.5560, test_f1: 0.5961
##################ITERATION #8 ****************************************
 epoch: 0, train_loss: 1.2576, test_loss: 1.2901, test_f1: 0.3232
 epoch: 1, train_loss: 1.1222, test_loss: 1.2129, test_f1: 0.3408
 epoch: 2, train_loss: 1.0805, test_loss: 1.1845, test_f1: 0.4683
 epoch: 3, train_loss: 1.0820, test_loss: 1.1129, test_f1: 0.5002
 epoch: 4, train_loss: 1.0507, test_loss: 1.0966, test_f1: 0.5060
 epoch: 5, train_loss: 1.0086, test_loss: 1.0821, test_f1: 0.5070
 epoch: 6, train_loss: 1.0029, test_loss: 1.0721, test_f1: 0.5167
 epoch: 7, train_loss: 0.9934, test_loss: 1.0737, test_f1: 0.5423
 epoch: 8, train_loss: 0.9574, test_loss: 1.0538, test_f1: 0.5547
 epoch: 9, train_loss: 0.9647, test_loss: 1.0614, test_f1: 0.5445
 epoch: 10, train_loss: 0.9445, test_loss: 1.0366, test_f1: 0.5430
 epoch: 11, train_loss: 0.9246, test_loss: 1.0142, test_f1: 0.5602
 epoch: 12, train_loss: 0.9183, test_loss: 1.0328, test_f1: 0.5356
 epoch: 13, train_loss: 0.8960, test_loss: 1.0180, test_f1: 0.5562
 epoch: 14, train_loss: 0.8895, test_loss: 1.0237, test_f1: 0.5358
 epoch: 15, train_loss: 0.8895, test_loss: 1.0355, test_f1: 0.5437
 epoch: 16, train_loss: 0.8854, test_loss: 1.0397, test_f1: 0.5505
 epoch: 17, train_loss: 0.8714, test_loss: 1.0495, test_f1: 0.5341
 epoch: 18, train_loss: 0.8639, test_loss: 1.0325, test_f1: 0.5565
 epoch: 19, train_loss: 0.8585, test_loss: 1.0648, test_f1: 0.5739
 epoch: 20, train_loss: 0.8599, test_loss: 1.0689, test_f1: 0.5632
 epoch: 21, train_loss: 0.8426, test_loss: 1.0463, test_f1: 0.5792
 epoch: 22, train_loss: 0.8241, test_loss: 1.0541, test_f1: 0.5469
 epoch: 23, train_loss: 0.8090, test_loss: 1.0283, test_f1: 0.5718
 epoch: 24, train_loss: 0.8131, test_loss: 1.0667, test_f1: 0.5521
 epoch: 25, train_loss: 0.8172, test_loss: 1.0573, test_f1: 0.5733
 epoch: 26, train_loss: 0.7911, test_loss: 1.0590, test_f1: 0.5636
 epoch: 27, train_loss: 0.7895, test_loss: 1.0950, test_f1: 0.5614
 epoch: 28, train_loss: 0.7788, test_loss: 1.0410, test_f1: 0.5809
 epoch: 29, train_loss: 0.7897, test_loss: 1.0973, test_f1: 0.5804
 epoch: 30, train_loss: 0.7712, test_loss: 1.0747, test_f1: 0.5544
 epoch: 31, train_loss: 0.7794, test_loss: 1.0608, test_f1: 0.5605
 epoch: 32, train_loss: 0.7920, test_loss: 1.1063, test_f1: 0.5720
 epoch: 33, train_loss: 0.7412, test_loss: 1.1112, test_f1: 0.5854
 epoch: 34, train_loss: 0.7575, test_loss: 1.0842, test_f1: 0.5723
 epoch: 35, train_loss: 0.7526, test_loss: 1.1374, test_f1: 0.5487
 epoch: 36, train_loss: 0.7391, test_loss: 1.1349, test_f1: 0.5544
 epoch: 37, train_loss: 0.7437, test_loss: 1.2016, test_f1: 0.5487
 epoch: 38, train_loss: 0.6973, test_loss: 1.1176, test_f1: 0.5955
 epoch: 39, train_loss: 0.7160, test_loss: 1.1462, test_f1: 0.5929
 epoch: 40, train_loss: 0.7076, test_loss: 1.2017, test_f1: 0.5695
 epoch: 41, train_loss: 0.7029, test_loss: 1.1514, test_f1: 0.5792
 epoch: 42, train_loss: 0.6927, test_loss: 1.1913, test_f1: 0.5717
 epoch: 43, train_loss: 0.6828, test_loss: 1.1480, test_f1: 0.5934
 epoch: 44, train_loss: 0.7033, test_loss: 1.1467, test_f1: 0.5904
 epoch: 45, train_loss: 0.6846, test_loss: 1.1962, test_f1: 0.5743
 epoch: 46, train_loss: 0.6801, test_loss: 1.1698, test_f1: 0.6099
 epoch: 47, train_loss: 0.6696, test_loss: 1.2193, test_f1: 0.5963
 epoch: 48, train_loss: 0.6546, test_loss: 1.2677, test_f1: 0.5651
 epoch: 49, train_loss: 0.6546, test_loss: 1.2564, test_f1: 0.5855
 epoch: 50, train_loss: 0.6672, test_loss: 1.2395, test_f1: 0.5873
 epoch: 51, train_loss: 0.6490, test_loss: 1.2052, test_f1: 0.5910
 epoch: 52, train_loss: 0.6270, test_loss: 1.2085, test_f1: 0.6020
 epoch: 53, train_loss: 0.6319, test_loss: 1.2364, test_f1: 0.6148
 epoch: 54, train_loss: 0.6183, test_loss: 1.2046, test_f1: 0.5981
 epoch: 55, train_loss: 0.6145, test_loss: 1.2070, test_f1: 0.6168
 epoch: 56, train_loss: 0.6208, test_loss: 1.2396, test_f1: 0.6111
 epoch: 57, train_loss: 0.6040, test_loss: 1.2494, test_f1: 0.5968
 epoch: 58, train_loss: 0.6084, test_loss: 1.2581, test_f1: 0.6209
 epoch: 59, train_loss: 0.6068, test_loss: 1.2708, test_f1: 0.6054
 epoch: 60, train_loss: 0.6011, test_loss: 1.2409, test_f1: 0.6171
 epoch: 61, train_loss: 0.6132, test_loss: 1.2574, test_f1: 0.6277
 epoch: 62, train_loss: 0.5992, test_loss: 1.2480, test_f1: 0.6122
 epoch: 63, train_loss: 0.6039, test_loss: 1.2664, test_f1: 0.6039
 epoch: 64, train_loss: 0.5863, test_loss: 1.2507, test_f1: 0.6009
 epoch: 65, train_loss: 0.5763, test_loss: 1.2980, test_f1: 0.6170
 epoch: 66, train_loss: 0.5803, test_loss: 1.3227, test_f1: 0.6160
 epoch: 67, train_loss: 0.5793, test_loss: 1.3274, test_f1: 0.6253
 epoch: 68, train_loss: 0.5753, test_loss: 1.3195, test_f1: 0.6102
 epoch: 69, train_loss: 0.5785, test_loss: 1.3033, test_f1: 0.6034
 epoch: 70, train_loss: 0.5685, test_loss: 1.3288, test_f1: 0.6116
 epoch: 71, train_loss: 0.5691, test_loss: 1.2716, test_f1: 0.6254
 epoch: 72, train_loss: 0.5652, test_loss: 1.3286, test_f1: 0.6044
 epoch: 73, train_loss: 0.5725, test_loss: 1.3416, test_f1: 0.6059
 epoch: 74, train_loss: 0.5541, test_loss: 1.3347, test_f1: 0.6425
 epoch: 75, train_loss: 0.5519, test_loss: 1.3406, test_f1: 0.6323
 epoch: 76, train_loss: 0.5399, test_loss: 1.3510, test_f1: 0.6294
 epoch: 77, train_loss: 0.5722, test_loss: 1.3670, test_f1: 0.6150
 epoch: 78, train_loss: 0.5582, test_loss: 1.3600, test_f1: 0.6274
 epoch: 79, train_loss: 0.5568, test_loss: 1.3435, test_f1: 0.6281
 epoch: 80, train_loss: 0.5560, test_loss: 1.3531, test_f1: 0.6232
 epoch: 81, train_loss: 0.5530, test_loss: 1.3748, test_f1: 0.6166
 epoch: 82, train_loss: 0.5590, test_loss: 1.3796, test_f1: 0.6248
 epoch: 83, train_loss: 0.5372, test_loss: 1.3397, test_f1: 0.6190
 epoch: 84, train_loss: 0.5347, test_loss: 1.3967, test_f1: 0.6367
 epoch: 85, train_loss: 0.5256, test_loss: 1.3687, test_f1: 0.6213
 epoch: 86, train_loss: 0.5035, test_loss: 1.3495, test_f1: 0.6252
 epoch: 87, train_loss: 0.5124, test_loss: 1.3529, test_f1: 0.6170
 epoch: 88, train_loss: 0.5142, test_loss: 1.3549, test_f1: 0.6080
 epoch: 89, train_loss: 0.5124, test_loss: 1.4552, test_f1: 0.6231
 epoch: 90, train_loss: 0.5075, test_loss: 1.4111, test_f1: 0.6204
 epoch: 91, train_loss: 0.5147, test_loss: 1.4640, test_f1: 0.6016
 epoch: 92, train_loss: 0.5047, test_loss: 1.4443, test_f1: 0.6040
 epoch: 93, train_loss: 0.5361, test_loss: 1.5278, test_f1: 0.6112
 epoch: 94, train_loss: 0.5244, test_loss: 1.3895, test_f1: 0.6249
 epoch: 95, train_loss: 0.5144, test_loss: 1.4554, test_f1: 0.6138
 epoch: 96, train_loss: 0.5098, test_loss: 1.4392, test_f1: 0.6121
 epoch: 97, train_loss: 0.4883, test_loss: 1.4712, test_f1: 0.6172
 epoch: 98, train_loss: 0.4849, test_loss: 1.5156, test_f1: 0.6063
 epoch: 99, train_loss: 0.5241, test_loss: 1.5016, test_f1: 0.6181
##################ITERATION #9 ****************************************
 epoch: 0, train_loss: 1.2652, test_loss: 1.3419, test_f1: 0.1865
 epoch: 1, train_loss: 1.1082, test_loss: 1.3415, test_f1: 0.2175
 epoch: 2, train_loss: 1.0635, test_loss: 1.2012, test_f1: 0.4446
 epoch: 3, train_loss: 1.0613, test_loss: 1.1049, test_f1: 0.5154
 epoch: 4, train_loss: 1.0138, test_loss: 1.0784, test_f1: 0.5480
 epoch: 5, train_loss: 0.9981, test_loss: 1.0825, test_f1: 0.5273
 epoch: 6, train_loss: 0.9599, test_loss: 1.0862, test_f1: 0.5552
 epoch: 7, train_loss: 0.9611, test_loss: 1.0803, test_f1: 0.5477
 epoch: 8, train_loss: 0.9295, test_loss: 1.0826, test_f1: 0.5504
 epoch: 9, train_loss: 0.9309, test_loss: 1.0387, test_f1: 0.5722
 epoch: 10, train_loss: 0.9254, test_loss: 1.0378, test_f1: 0.5732
 epoch: 11, train_loss: 0.9056, test_loss: 1.0431, test_f1: 0.5498
 epoch: 12, train_loss: 0.9089, test_loss: 1.0223, test_f1: 0.5775
 epoch: 13, train_loss: 0.8662, test_loss: 1.0256, test_f1: 0.5814
 epoch: 14, train_loss: 0.8723, test_loss: 1.0126, test_f1: 0.5832
 epoch: 15, train_loss: 0.8541, test_loss: 1.0287, test_f1: 0.5798
 epoch: 16, train_loss: 0.8453, test_loss: 1.0108, test_f1: 0.5806
 epoch: 17, train_loss: 0.8328, test_loss: 1.0218, test_f1: 0.5775
 epoch: 18, train_loss: 0.8259, test_loss: 0.9920, test_f1: 0.5813
 epoch: 19, train_loss: 0.8177, test_loss: 0.9953, test_f1: 0.6020
 epoch: 20, train_loss: 0.8268, test_loss: 1.0247, test_f1: 0.5745
 epoch: 21, train_loss: 0.8320, test_loss: 1.0386, test_f1: 0.5748
 epoch: 22, train_loss: 0.8146, test_loss: 1.0047, test_f1: 0.6004
 epoch: 23, train_loss: 0.7920, test_loss: 1.0318, test_f1: 0.5775
 epoch: 24, train_loss: 0.7929, test_loss: 1.0404, test_f1: 0.5948
 epoch: 25, train_loss: 0.7878, test_loss: 1.0131, test_f1: 0.6026
 epoch: 26, train_loss: 0.7782, test_loss: 1.0656, test_f1: 0.5838
 epoch: 27, train_loss: 0.7760, test_loss: 1.0389, test_f1: 0.5614
 epoch: 28, train_loss: 0.7650, test_loss: 1.0426, test_f1: 0.6001
 epoch: 29, train_loss: 0.7611, test_loss: 1.0272, test_f1: 0.5857
 epoch: 30, train_loss: 0.7509, test_loss: 1.0423, test_f1: 0.5942
 epoch: 31, train_loss: 0.7542, test_loss: 1.0415, test_f1: 0.6094
 epoch: 32, train_loss: 0.7316, test_loss: 1.0547, test_f1: 0.6083
 epoch: 33, train_loss: 0.7333, test_loss: 1.1013, test_f1: 0.5857
 epoch: 34, train_loss: 0.7382, test_loss: 1.0524, test_f1: 0.5999
 epoch: 35, train_loss: 0.7120, test_loss: 1.0537, test_f1: 0.6212
 epoch: 36, train_loss: 0.7452, test_loss: 1.0784, test_f1: 0.5825
 epoch: 37, train_loss: 0.7113, test_loss: 1.1180, test_f1: 0.5958
 epoch: 38, train_loss: 0.7305, test_loss: 1.0844, test_f1: 0.5867
 epoch: 39, train_loss: 0.7095, test_loss: 1.1449, test_f1: 0.5944
 epoch: 40, train_loss: 0.6966, test_loss: 1.1422, test_f1: 0.5934
 epoch: 41, train_loss: 0.6965, test_loss: 1.1288, test_f1: 0.6109
 epoch: 42, train_loss: 0.7199, test_loss: 1.1065, test_f1: 0.5881
 epoch: 43, train_loss: 0.6853, test_loss: 1.1589, test_f1: 0.5738
 epoch: 44, train_loss: 0.6961, test_loss: 1.0767, test_f1: 0.5972
 epoch: 45, train_loss: 0.6715, test_loss: 1.1465, test_f1: 0.6191
 epoch: 46, train_loss: 0.6714, test_loss: 1.1418, test_f1: 0.6030
 epoch: 47, train_loss: 0.6608, test_loss: 1.2455, test_f1: 0.5781
 epoch: 48, train_loss: 0.6605, test_loss: 1.1557, test_f1: 0.6061
 epoch: 49, train_loss: 0.6443, test_loss: 1.2406, test_f1: 0.5875
 epoch: 50, train_loss: 0.6554, test_loss: 1.2628, test_f1: 0.5885
 epoch: 51, train_loss: 0.6323, test_loss: 1.2004, test_f1: 0.5903
 epoch: 52, train_loss: 0.6013, test_loss: 1.2203, test_f1: 0.6141
 epoch: 53, train_loss: 0.6157, test_loss: 1.2254, test_f1: 0.6089
 epoch: 54, train_loss: 0.6243, test_loss: 1.2457, test_f1: 0.6219
 epoch: 55, train_loss: 0.6102, test_loss: 1.2782, test_f1: 0.5909
 epoch: 56, train_loss: 0.6065, test_loss: 1.2613, test_f1: 0.5923
 epoch: 57, train_loss: 0.6059, test_loss: 1.2688, test_f1: 0.5983
 epoch: 58, train_loss: 0.6112, test_loss: 1.2872, test_f1: 0.6078
 epoch: 59, train_loss: 0.5916, test_loss: 1.2742, test_f1: 0.6062
 epoch: 60, train_loss: 0.5903, test_loss: 1.3113, test_f1: 0.5890
 epoch: 61, train_loss: 0.5921, test_loss: 1.3072, test_f1: 0.5845
 epoch: 62, train_loss: 0.5845, test_loss: 1.2689, test_f1: 0.6020
 epoch: 63, train_loss: 0.5888, test_loss: 1.2781, test_f1: 0.5978
 epoch: 64, train_loss: 0.5867, test_loss: 1.2921, test_f1: 0.5845
 epoch: 65, train_loss: 0.5631, test_loss: 1.2792, test_f1: 0.6163
 epoch: 66, train_loss: 0.5543, test_loss: 1.2944, test_f1: 0.6074
 epoch: 67, train_loss: 0.5807, test_loss: 1.3227, test_f1: 0.5959
 epoch: 68, train_loss: 0.5804, test_loss: 1.3401, test_f1: 0.5811
 epoch: 69, train_loss: 0.5686, test_loss: 1.3522, test_f1: 0.5889
 epoch: 70, train_loss: 0.5628, test_loss: 1.3343, test_f1: 0.6007
 epoch: 71, train_loss: 0.5668, test_loss: 1.3421, test_f1: 0.5728
 epoch: 72, train_loss: 0.5561, test_loss: 1.3320, test_f1: 0.5986
 epoch: 73, train_loss: 0.5510, test_loss: 1.3617, test_f1: 0.5783
 epoch: 74, train_loss: 0.5481, test_loss: 1.3352, test_f1: 0.6086
 epoch: 75, train_loss: 0.5280, test_loss: 1.4056, test_f1: 0.5703
 epoch: 76, train_loss: 0.5362, test_loss: 1.4041, test_f1: 0.5865
 epoch: 77, train_loss: 0.5246, test_loss: 1.3852, test_f1: 0.5777
 epoch: 78, train_loss: 0.5348, test_loss: 1.4063, test_f1: 0.5963
 epoch: 79, train_loss: 0.5319, test_loss: 1.4071, test_f1: 0.5978
 epoch: 80, train_loss: 0.5441, test_loss: 1.4523, test_f1: 0.5967
 epoch: 81, train_loss: 0.5278, test_loss: 1.4630, test_f1: 0.5836
 epoch: 82, train_loss: 0.5239, test_loss: 1.4558, test_f1: 0.5838
 epoch: 83, train_loss: 0.5009, test_loss: 1.3898, test_f1: 0.5890
 epoch: 84, train_loss: 0.5182, test_loss: 1.4531, test_f1: 0.5870
 epoch: 85, train_loss: 0.4970, test_loss: 1.4146, test_f1: 0.6038
 epoch: 86, train_loss: 0.5083, test_loss: 1.4644, test_f1: 0.6056
 epoch: 87, train_loss: 0.5081, test_loss: 1.4480, test_f1: 0.6049
 epoch: 88, train_loss: 0.5082, test_loss: 1.4918, test_f1: 0.5906
 epoch: 89, train_loss: 0.4928, test_loss: 1.5063, test_f1: 0.5936
 epoch: 90, train_loss: 0.5208, test_loss: 1.4360, test_f1: 0.5979
 epoch: 91, train_loss: 0.4992, test_loss: 1.4694, test_f1: 0.5923
 epoch: 92, train_loss: 0.4883, test_loss: 1.5087, test_f1: 0.5926
 epoch: 93, train_loss: 0.4865, test_loss: 1.5348, test_f1: 0.5943
 epoch: 94, train_loss: 0.4897, test_loss: 1.5193, test_f1: 0.5809
 epoch: 95, train_loss: 0.4741, test_loss: 1.4681, test_f1: 0.6043
 epoch: 96, train_loss: 0.4784, test_loss: 1.5472, test_f1: 0.5900
 epoch: 97, train_loss: 0.4784, test_loss: 1.5377, test_f1: 0.5777
 epoch: 98, train_loss: 0.4714, test_loss: 1.5875, test_f1: 0.5745
 epoch: 99, train_loss: 0.4822, test_loss: 1.5971, test_f1: 0.6026

Training completed in 685.38 seconds
Best F1: 0.6442 at epoch 54
Mean F1 across iterations: 0.6248  0.0161
========================FINAL RESULTS================================
FEGIN weighted F1: 0.6442  0.0161
python main.py --data ltspice_demos --representation component_net --model FEGIN --layers 5 --hiddens 128 --batch_size 64 --lr 0.0001 --emb_size 128 --epochs 100 --save_appendix component_net_L5_H128_BS64_LR0.0001_E128 --no_val
-----



STDERR:
  File "main.py", line 370, in <module>
    main()
  File "main.py", line 254, in main
    dataset = dataset_class(
  File "/home/philip/projects/ltspice_examples_code_repo/Circuit-Completion-Using-GNNs/component_classification_with_link_prediction_head/evaluation/FEGIN/kernel/circuit_datasets.py", line 15, in __init__
    self.data, self.slices = torch.load(self.processed_paths[0])
  File "/home/philip/.local/lib/python3.8/site-packages/torch/serialization.py", line 1040, in load
    warnings.warn(
  File "/usr/lib/python3.8/warnings.py", line 109, in _showwarnmsg
    sw(msg.message, msg.category, msg.filename, msg.lineno,
  File "main.py", line 47, in warn_with_traceback
    traceback.print_stack(file=log)
/home/philip/projects/ltspice_examples_code_repo/Circuit-Completion-Using-GNNs/component_classification_with_link_prediction_head/evaluation/FEGIN/kernel/circuit_datasets.py:15: FutureWarning: You are using `torch.load` with `weights_only=False` (the current default value), which uses the default pickle module implicitly. It is possible to construct malicious pickle data which will execute arbitrary code during unpickling (See https://github.com/pytorch/pytorch/blob/main/SECURITY.md#untrusted-models for more details). In a future release, the default value for `weights_only` will be flipped to `True`. This limits the functions that could be executed during unpickling. Arbitrary objects will no longer be allowed to be loaded via this mode unless they are explicitly allowlisted by the user via `torch.serialization.add_safe_globals`. We recommend you start setting `weights_only=True` for any use case where you don't have full control of the loaded file. Please open an issue on GitHub for any issues related to this experimental feature.
  self.data, self.slices = torch.load(self.processed_paths[0])
