STDOUT:
Results will be saved in /home/philip/projects/ltspice_examples_code_repo/Circuit-Completion-Using-GNNs/component_classification_with_link_prediction_head/evaluation/FEGIN/results/model_FEGIN_dataset_ltspice_demos
Command line input: python main.py --data ltspice_demos --representation component_component --model FEGIN --layers 4 --hiddens 16 --batch_size 256 --lr 0.001 --emb_size 512 --epochs 100 --save_appendix component_component_L4_H16_BS256_LR0.001_E512 --no_val
 is saved.
-----
ltspice_demos - FEGIN
Using 4 layers, 16 hidden units, h = 2
Loading component_component representation dataset
ENTERED
Training FEGIN on component_component representation
Train: 1565, Test: 383
##################ITERATION #0 ****************************************
 epoch: 0, train_loss: 1.3696, test_loss: 1.3636, test_f1: 0.2281
 epoch: 1, train_loss: 1.3597, test_loss: 1.3600, test_f1: 0.2281
 epoch: 2, train_loss: 1.3548, test_loss: 1.3567, test_f1: 0.2281
 epoch: 3, train_loss: 1.3500, test_loss: 1.3529, test_f1: 0.2281
 epoch: 4, train_loss: 1.3445, test_loss: 1.3490, test_f1: 0.2281
 epoch: 5, train_loss: 1.3393, test_loss: 1.3446, test_f1: 0.2281
 epoch: 6, train_loss: 1.3331, test_loss: 1.3403, test_f1: 0.2281
 epoch: 7, train_loss: 1.3269, test_loss: 1.3353, test_f1: 0.2281
 epoch: 8, train_loss: 1.3188, test_loss: 1.3298, test_f1: 0.2281
 epoch: 9, train_loss: 1.3105, test_loss: 1.3227, test_f1: 0.2281
 epoch: 10, train_loss: 1.3005, test_loss: 1.3159, test_f1: 0.2281
 epoch: 11, train_loss: 1.2904, test_loss: 1.3080, test_f1: 0.2281
 epoch: 12, train_loss: 1.2734, test_loss: 1.3013, test_f1: 0.2281
 epoch: 13, train_loss: 1.2591, test_loss: 1.2921, test_f1: 0.2281
 epoch: 14, train_loss: 1.2499, test_loss: 1.2800, test_f1: 0.2281
 epoch: 15, train_loss: 1.2352, test_loss: 1.2674, test_f1: 0.2281
 epoch: 16, train_loss: 1.2197, test_loss: 1.2633, test_f1: 0.2281
 epoch: 17, train_loss: 1.2105, test_loss: 1.2710, test_f1: 0.2281
 epoch: 18, train_loss: 1.2014, test_loss: 1.2599, test_f1: 0.2281
 epoch: 19, train_loss: 1.1893, test_loss: 1.2496, test_f1: 0.2984
 epoch: 20, train_loss: 1.1830, test_loss: 1.2444, test_f1: 0.2894
 epoch: 21, train_loss: 1.1830, test_loss: 1.2621, test_f1: 0.2350
 epoch: 22, train_loss: 1.1683, test_loss: 1.2885, test_f1: 0.2655
 epoch: 23, train_loss: 1.1682, test_loss: 1.2912, test_f1: 0.3003
 epoch: 24, train_loss: 1.1528, test_loss: 1.2975, test_f1: 0.3058
 epoch: 25, train_loss: 1.1541, test_loss: 1.2958, test_f1: 0.3348
 epoch: 26, train_loss: 1.1505, test_loss: 1.2924, test_f1: 0.3528
 epoch: 27, train_loss: 1.1461, test_loss: 1.3134, test_f1: 0.4121
 epoch: 28, train_loss: 1.1359, test_loss: 1.3337, test_f1: 0.4015
 epoch: 29, train_loss: 1.1335, test_loss: 1.3472, test_f1: 0.3969
 epoch: 30, train_loss: 1.1288, test_loss: 1.3269, test_f1: 0.3945
 epoch: 31, train_loss: 1.1173, test_loss: 1.3002, test_f1: 0.3842
 epoch: 32, train_loss: 1.1089, test_loss: 1.3085, test_f1: 0.3972
 epoch: 33, train_loss: 1.1128, test_loss: 1.3560, test_f1: 0.4068
 epoch: 34, train_loss: 1.1109, test_loss: 1.3959, test_f1: 0.4054
 epoch: 35, train_loss: 1.1034, test_loss: 1.4547, test_f1: 0.3748
 epoch: 36, train_loss: 1.0962, test_loss: 1.4555, test_f1: 0.3814
 epoch: 37, train_loss: 1.0977, test_loss: 1.4970, test_f1: 0.3910
 epoch: 38, train_loss: 1.0937, test_loss: 1.5387, test_f1: 0.3847
 epoch: 39, train_loss: 1.0913, test_loss: 1.5989, test_f1: 0.3882
 epoch: 40, train_loss: 1.0803, test_loss: 1.6309, test_f1: 0.3961
 epoch: 41, train_loss: 1.0800, test_loss: 1.5625, test_f1: 0.3875
 epoch: 42, train_loss: 1.0769, test_loss: 1.5530, test_f1: 0.3892
 epoch: 43, train_loss: 1.0766, test_loss: 1.5713, test_f1: 0.3870
 epoch: 44, train_loss: 1.0632, test_loss: 1.5132, test_f1: 0.3917
 epoch: 45, train_loss: 1.0585, test_loss: 1.5393, test_f1: 0.3896
 epoch: 46, train_loss: 1.0543, test_loss: 1.5890, test_f1: 0.3929
 epoch: 47, train_loss: 1.0542, test_loss: 1.6243, test_f1: 0.3861
 epoch: 48, train_loss: 1.0399, test_loss: 1.5857, test_f1: 0.3858
 epoch: 49, train_loss: 1.0498, test_loss: 1.6518, test_f1: 0.3962
 epoch: 50, train_loss: 1.0424, test_loss: 1.6954, test_f1: 0.3962
 epoch: 51, train_loss: 1.0284, test_loss: 1.6463, test_f1: 0.4042
 epoch: 52, train_loss: 1.0256, test_loss: 1.6858, test_f1: 0.3971
 epoch: 53, train_loss: 1.0213, test_loss: 1.7000, test_f1: 0.3935
 epoch: 54, train_loss: 1.0174, test_loss: 1.7007, test_f1: 0.4095
 epoch: 55, train_loss: 1.0193, test_loss: 1.7047, test_f1: 0.4123
 epoch: 56, train_loss: 1.0168, test_loss: 1.6856, test_f1: 0.4125
 epoch: 57, train_loss: 1.0113, test_loss: 1.6811, test_f1: 0.4172
 epoch: 58, train_loss: 1.0133, test_loss: 1.6349, test_f1: 0.4250
 epoch: 59, train_loss: 1.0192, test_loss: 1.6544, test_f1: 0.4254
 epoch: 60, train_loss: 1.0163, test_loss: 1.6390, test_f1: 0.4260
 epoch: 61, train_loss: 1.0130, test_loss: 1.7001, test_f1: 0.4256
 epoch: 62, train_loss: 1.0139, test_loss: 1.7341, test_f1: 0.3959
 epoch: 63, train_loss: 1.0025, test_loss: 1.6956, test_f1: 0.3864
 epoch: 64, train_loss: 1.0108, test_loss: 1.7063, test_f1: 0.3979
 epoch: 65, train_loss: 0.9877, test_loss: 1.7026, test_f1: 0.3914
 epoch: 66, train_loss: 0.9813, test_loss: 1.6826, test_f1: 0.4002
 epoch: 67, train_loss: 0.9911, test_loss: 1.6500, test_f1: 0.4340
 epoch: 68, train_loss: 0.9863, test_loss: 1.6577, test_f1: 0.4235
 epoch: 69, train_loss: 0.9930, test_loss: 1.6706, test_f1: 0.4378
 epoch: 70, train_loss: 0.9691, test_loss: 1.6630, test_f1: 0.4422
 epoch: 71, train_loss: 0.9810, test_loss: 1.7008, test_f1: 0.4295
 epoch: 72, train_loss: 0.9992, test_loss: 1.7516, test_f1: 0.4333
 epoch: 73, train_loss: 0.9859, test_loss: 1.8069, test_f1: 0.4415
 epoch: 74, train_loss: 0.9774, test_loss: 1.8362, test_f1: 0.4393
 epoch: 75, train_loss: 0.9825, test_loss: 1.7535, test_f1: 0.4235
 epoch: 76, train_loss: 0.9818, test_loss: 1.7483, test_f1: 0.4331
 epoch: 77, train_loss: 0.9732, test_loss: 1.7055, test_f1: 0.4520
 epoch: 78, train_loss: 0.9761, test_loss: 1.7207, test_f1: 0.4419
 epoch: 79, train_loss: 0.9717, test_loss: 1.7714, test_f1: 0.4256
 epoch: 80, train_loss: 0.9743, test_loss: 1.8464, test_f1: 0.4027
 epoch: 81, train_loss: 0.9680, test_loss: 1.8437, test_f1: 0.4129
 epoch: 82, train_loss: 0.9566, test_loss: 1.9037, test_f1: 0.4134
 epoch: 83, train_loss: 0.9528, test_loss: 1.9765, test_f1: 0.4108
 epoch: 84, train_loss: 0.9737, test_loss: 1.9312, test_f1: 0.4191
 epoch: 85, train_loss: 0.9674, test_loss: 1.9291, test_f1: 0.4247
 epoch: 86, train_loss: 0.9678, test_loss: 1.9968, test_f1: 0.4417
 epoch: 87, train_loss: 0.9540, test_loss: 1.9175, test_f1: 0.4300
 epoch: 88, train_loss: 0.9445, test_loss: 1.9761, test_f1: 0.4317
 epoch: 89, train_loss: 0.9599, test_loss: 1.9795, test_f1: 0.4112
 epoch: 90, train_loss: 0.9449, test_loss: 2.0072, test_f1: 0.4019
 epoch: 91, train_loss: 0.9518, test_loss: 1.9441, test_f1: 0.3925
 epoch: 92, train_loss: 0.9527, test_loss: 1.8787, test_f1: 0.4213
 epoch: 93, train_loss: 0.9600, test_loss: 1.9583, test_f1: 0.4210
 epoch: 94, train_loss: 0.9478, test_loss: 2.1137, test_f1: 0.4238
 epoch: 95, train_loss: 0.9446, test_loss: 2.1434, test_f1: 0.4192
 epoch: 96, train_loss: 0.9455, test_loss: 2.1080, test_f1: 0.4257
 epoch: 97, train_loss: 0.9369, test_loss: 2.0772, test_f1: 0.4306
 epoch: 98, train_loss: 0.9431, test_loss: 2.0707, test_f1: 0.4364
 epoch: 99, train_loss: 0.9429, test_loss: 2.0870, test_f1: 0.4236
##################ITERATION #1 ****************************************
 epoch: 0, train_loss: 1.3567, test_loss: 1.3562, test_f1: 0.2281
 epoch: 1, train_loss: 1.3190, test_loss: 1.3460, test_f1: 0.2281
 epoch: 2, train_loss: 1.3034, test_loss: 1.3372, test_f1: 0.2281
 epoch: 3, train_loss: 1.2869, test_loss: 1.3271, test_f1: 0.2281
 epoch: 4, train_loss: 1.2740, test_loss: 1.3157, test_f1: 0.2281
 epoch: 5, train_loss: 1.2649, test_loss: 1.3042, test_f1: 0.2289
 epoch: 6, train_loss: 1.2555, test_loss: 1.2968, test_f1: 0.2239
 epoch: 7, train_loss: 1.2390, test_loss: 1.2909, test_f1: 0.2401
 epoch: 8, train_loss: 1.2226, test_loss: 1.2829, test_f1: 0.2381
 epoch: 9, train_loss: 1.2159, test_loss: 1.2866, test_f1: 0.2515
 epoch: 10, train_loss: 1.1973, test_loss: 1.2896, test_f1: 0.2548
 epoch: 11, train_loss: 1.1917, test_loss: 1.2911, test_f1: 0.2888
 epoch: 12, train_loss: 1.1802, test_loss: 1.2940, test_f1: 0.3007
 epoch: 13, train_loss: 1.1634, test_loss: 1.2923, test_f1: 0.3042
 epoch: 14, train_loss: 1.1503, test_loss: 1.2926, test_f1: 0.3118
 epoch: 15, train_loss: 1.1474, test_loss: 1.2925, test_f1: 0.3101
 epoch: 16, train_loss: 1.1305, test_loss: 1.2940, test_f1: 0.3228
 epoch: 17, train_loss: 1.1296, test_loss: 1.2962, test_f1: 0.3415
 epoch: 18, train_loss: 1.1214, test_loss: 1.2619, test_f1: 0.3389
 epoch: 19, train_loss: 1.1169, test_loss: 1.2659, test_f1: 0.3432
 epoch: 20, train_loss: 1.1127, test_loss: 1.2678, test_f1: 0.3560
 epoch: 21, train_loss: 1.1040, test_loss: 1.2658, test_f1: 0.3518
 epoch: 22, train_loss: 1.0992, test_loss: 1.2676, test_f1: 0.3514
 epoch: 23, train_loss: 1.0923, test_loss: 1.2580, test_f1: 0.3583
 epoch: 24, train_loss: 1.0899, test_loss: 1.2612, test_f1: 0.3584
 epoch: 25, train_loss: 1.0719, test_loss: 1.2830, test_f1: 0.3333
 epoch: 26, train_loss: 1.0847, test_loss: 1.2690, test_f1: 0.3589
 epoch: 27, train_loss: 1.0657, test_loss: 1.2719, test_f1: 0.3647
 epoch: 28, train_loss: 1.0710, test_loss: 1.2608, test_f1: 0.3951
 epoch: 29, train_loss: 1.0590, test_loss: 1.2655, test_f1: 0.3694
 epoch: 30, train_loss: 1.0516, test_loss: 1.2732, test_f1: 0.3828
 epoch: 31, train_loss: 1.0526, test_loss: 1.2652, test_f1: 0.3927
 epoch: 32, train_loss: 1.0455, test_loss: 1.2426, test_f1: 0.3699
 epoch: 33, train_loss: 1.0449, test_loss: 1.2417, test_f1: 0.3777
 epoch: 34, train_loss: 1.0466, test_loss: 1.2592, test_f1: 0.3697
 epoch: 35, train_loss: 1.0375, test_loss: 1.2698, test_f1: 0.4263
 epoch: 36, train_loss: 1.0281, test_loss: 1.2524, test_f1: 0.4609
 epoch: 37, train_loss: 1.0285, test_loss: 1.2586, test_f1: 0.4535
 epoch: 38, train_loss: 1.0261, test_loss: 1.2627, test_f1: 0.4623
 epoch: 39, train_loss: 1.0108, test_loss: 1.2472, test_f1: 0.4660
 epoch: 40, train_loss: 1.0288, test_loss: 1.2690, test_f1: 0.4416
 epoch: 41, train_loss: 1.0368, test_loss: 1.2727, test_f1: 0.4303
 epoch: 42, train_loss: 1.0225, test_loss: 1.2628, test_f1: 0.4452
 epoch: 43, train_loss: 1.0188, test_loss: 1.2658, test_f1: 0.4470
 epoch: 44, train_loss: 1.0230, test_loss: 1.2978, test_f1: 0.4042
 epoch: 45, train_loss: 1.0191, test_loss: 1.3400, test_f1: 0.3845
 epoch: 46, train_loss: 1.0189, test_loss: 1.3452, test_f1: 0.4184
 epoch: 47, train_loss: 1.0070, test_loss: 1.3041, test_f1: 0.4574
 epoch: 48, train_loss: 1.0051, test_loss: 1.3287, test_f1: 0.4368
 epoch: 49, train_loss: 1.0010, test_loss: 1.3680, test_f1: 0.4190
 epoch: 50, train_loss: 0.9945, test_loss: 1.3253, test_f1: 0.4263
 epoch: 51, train_loss: 0.9926, test_loss: 1.3478, test_f1: 0.4130
 epoch: 52, train_loss: 0.9898, test_loss: 1.3617, test_f1: 0.4222
 epoch: 53, train_loss: 0.9907, test_loss: 1.3829, test_f1: 0.4158
 epoch: 54, train_loss: 0.9845, test_loss: 1.3986, test_f1: 0.4074
 epoch: 55, train_loss: 0.9819, test_loss: 1.4290, test_f1: 0.4347
 epoch: 56, train_loss: 0.9914, test_loss: 1.3948, test_f1: 0.4473
 epoch: 57, train_loss: 0.9785, test_loss: 1.3942, test_f1: 0.4350
 epoch: 58, train_loss: 0.9921, test_loss: 1.4254, test_f1: 0.4227
 epoch: 59, train_loss: 0.9758, test_loss: 1.4039, test_f1: 0.4190
 epoch: 60, train_loss: 0.9748, test_loss: 1.4207, test_f1: 0.4263
 epoch: 61, train_loss: 0.9730, test_loss: 1.4461, test_f1: 0.4285
 epoch: 62, train_loss: 0.9729, test_loss: 1.4572, test_f1: 0.4258
 epoch: 63, train_loss: 0.9836, test_loss: 1.4415, test_f1: 0.4405
 epoch: 64, train_loss: 0.9783, test_loss: 1.4004, test_f1: 0.4398
 epoch: 65, train_loss: 0.9689, test_loss: 1.4810, test_f1: 0.4430
 epoch: 66, train_loss: 0.9703, test_loss: 1.5181, test_f1: 0.4411
 epoch: 67, train_loss: 0.9697, test_loss: 1.5302, test_f1: 0.4202
 epoch: 68, train_loss: 0.9641, test_loss: 1.5494, test_f1: 0.4228
 epoch: 69, train_loss: 0.9625, test_loss: 1.5234, test_f1: 0.4299
 epoch: 70, train_loss: 0.9647, test_loss: 1.4755, test_f1: 0.4249
 epoch: 71, train_loss: 0.9662, test_loss: 1.4711, test_f1: 0.4322
 epoch: 72, train_loss: 0.9641, test_loss: 1.5223, test_f1: 0.4242
 epoch: 73, train_loss: 0.9605, test_loss: 1.5884, test_f1: 0.4246
 epoch: 74, train_loss: 0.9663, test_loss: 1.5603, test_f1: 0.4251
 epoch: 75, train_loss: 0.9694, test_loss: 1.5587, test_f1: 0.4226
 epoch: 76, train_loss: 0.9782, test_loss: 1.5369, test_f1: 0.4246
 epoch: 77, train_loss: 0.9576, test_loss: 1.5339, test_f1: 0.4338
 epoch: 78, train_loss: 0.9605, test_loss: 1.5420, test_f1: 0.4429
 epoch: 79, train_loss: 0.9609, test_loss: 1.5329, test_f1: 0.4311
 epoch: 80, train_loss: 0.9468, test_loss: 1.5431, test_f1: 0.4312
 epoch: 81, train_loss: 0.9542, test_loss: 1.5681, test_f1: 0.4473
 epoch: 82, train_loss: 0.9461, test_loss: 1.5710, test_f1: 0.4471
 epoch: 83, train_loss: 0.9509, test_loss: 1.5810, test_f1: 0.4315
 epoch: 84, train_loss: 0.9511, test_loss: 1.5695, test_f1: 0.4261
 epoch: 85, train_loss: 0.9315, test_loss: 1.5555, test_f1: 0.4312
 epoch: 86, train_loss: 0.9424, test_loss: 1.5824, test_f1: 0.4359
 epoch: 87, train_loss: 0.9500, test_loss: 1.6036, test_f1: 0.4342
 epoch: 88, train_loss: 0.9394, test_loss: 1.6310, test_f1: 0.4344
 epoch: 89, train_loss: 0.9388, test_loss: 1.6112, test_f1: 0.4270
 epoch: 90, train_loss: 0.9370, test_loss: 1.5566, test_f1: 0.4319
 epoch: 91, train_loss: 0.9366, test_loss: 1.5812, test_f1: 0.4364
 epoch: 92, train_loss: 0.9431, test_loss: 1.5785, test_f1: 0.4347
 epoch: 93, train_loss: 0.9279, test_loss: 1.5698, test_f1: 0.4280
 epoch: 94, train_loss: 0.9445, test_loss: 1.6137, test_f1: 0.4311
 epoch: 95, train_loss: 0.9172, test_loss: 1.6262, test_f1: 0.4256
 epoch: 96, train_loss: 0.9303, test_loss: 1.6140, test_f1: 0.4443
 epoch: 97, train_loss: 0.9351, test_loss: 1.6067, test_f1: 0.4465
 epoch: 98, train_loss: 0.9310, test_loss: 1.6093, test_f1: 0.4382
 epoch: 99, train_loss: 0.9308, test_loss: 1.6632, test_f1: 0.4436
##################ITERATION #2 ****************************************
 epoch: 0, train_loss: 1.2928, test_loss: 1.3199, test_f1: 0.2281
 epoch: 1, train_loss: 1.2615, test_loss: 1.3178, test_f1: 0.2281
 epoch: 2, train_loss: 1.2552, test_loss: 1.3150, test_f1: 0.2281
 epoch: 3, train_loss: 1.2464, test_loss: 1.3129, test_f1: 0.2281
 epoch: 4, train_loss: 1.2404, test_loss: 1.3160, test_f1: 0.2404
 epoch: 5, train_loss: 1.2293, test_loss: 1.3164, test_f1: 0.2404
 epoch: 6, train_loss: 1.2143, test_loss: 1.3110, test_f1: 0.2341
 epoch: 7, train_loss: 1.2049, test_loss: 1.3091, test_f1: 0.2329
 epoch: 8, train_loss: 1.2034, test_loss: 1.3051, test_f1: 0.2628
 epoch: 9, train_loss: 1.1928, test_loss: 1.2977, test_f1: 0.2630
 epoch: 10, train_loss: 1.1840, test_loss: 1.2908, test_f1: 0.2684
 epoch: 11, train_loss: 1.1716, test_loss: 1.2827, test_f1: 0.3156
 epoch: 12, train_loss: 1.1606, test_loss: 1.2713, test_f1: 0.3263
 epoch: 13, train_loss: 1.1547, test_loss: 1.2531, test_f1: 0.3501
 epoch: 14, train_loss: 1.1577, test_loss: 1.2401, test_f1: 0.3444
 epoch: 15, train_loss: 1.1327, test_loss: 1.2350, test_f1: 0.3538
 epoch: 16, train_loss: 1.1411, test_loss: 1.2328, test_f1: 0.3607
 epoch: 17, train_loss: 1.1252, test_loss: 1.2402, test_f1: 0.3359
 epoch: 18, train_loss: 1.1307, test_loss: 1.2428, test_f1: 0.3211
 epoch: 19, train_loss: 1.1260, test_loss: 1.2381, test_f1: 0.3702
 epoch: 20, train_loss: 1.1163, test_loss: 1.2357, test_f1: 0.3686
 epoch: 21, train_loss: 1.1106, test_loss: 1.2321, test_f1: 0.3772
 epoch: 22, train_loss: 1.1119, test_loss: 1.2351, test_f1: 0.3556
 epoch: 23, train_loss: 1.1139, test_loss: 1.2241, test_f1: 0.3668
 epoch: 24, train_loss: 1.1111, test_loss: 1.2496, test_f1: 0.3673
 epoch: 25, train_loss: 1.1103, test_loss: 1.2341, test_f1: 0.3820
 epoch: 26, train_loss: 1.0979, test_loss: 1.2411, test_f1: 0.3608
 epoch: 27, train_loss: 1.1067, test_loss: 1.2321, test_f1: 0.3886
 epoch: 28, train_loss: 1.0919, test_loss: 1.2234, test_f1: 0.3853
 epoch: 29, train_loss: 1.0960, test_loss: 1.3089, test_f1: 0.3611
 epoch: 30, train_loss: 1.0958, test_loss: 1.2666, test_f1: 0.3447
 epoch: 31, train_loss: 1.0740, test_loss: 1.2200, test_f1: 0.3747
 epoch: 32, train_loss: 1.0811, test_loss: 1.2115, test_f1: 0.3881
 epoch: 33, train_loss: 1.0790, test_loss: 1.1992, test_f1: 0.3827
 epoch: 34, train_loss: 1.0734, test_loss: 1.2231, test_f1: 0.3575
 epoch: 35, train_loss: 1.0730, test_loss: 1.2837, test_f1: 0.3434
 epoch: 36, train_loss: 1.0693, test_loss: 1.2326, test_f1: 0.3705
 epoch: 37, train_loss: 1.0671, test_loss: 1.2196, test_f1: 0.3618
 epoch: 38, train_loss: 1.0654, test_loss: 1.2597, test_f1: 0.3403
 epoch: 39, train_loss: 1.0602, test_loss: 1.2415, test_f1: 0.3477
 epoch: 40, train_loss: 1.0562, test_loss: 1.2280, test_f1: 0.3568
 epoch: 41, train_loss: 1.0510, test_loss: 1.2880, test_f1: 0.3708
 epoch: 42, train_loss: 1.0570, test_loss: 1.4269, test_f1: 0.3646
 epoch: 43, train_loss: 1.0542, test_loss: 1.2794, test_f1: 0.3918
 epoch: 44, train_loss: 1.0466, test_loss: 1.2286, test_f1: 0.3964
 epoch: 45, train_loss: 1.0489, test_loss: 1.3228, test_f1: 0.3478
 epoch: 46, train_loss: 1.0474, test_loss: 1.4055, test_f1: 0.3694
 epoch: 47, train_loss: 1.0429, test_loss: 1.2954, test_f1: 0.3605
 epoch: 48, train_loss: 1.0339, test_loss: 1.3121, test_f1: 0.3718
 epoch: 49, train_loss: 1.0395, test_loss: 1.3690, test_f1: 0.3816
 epoch: 50, train_loss: 1.0319, test_loss: 1.2625, test_f1: 0.3601
 epoch: 51, train_loss: 1.0450, test_loss: 1.2382, test_f1: 0.3680
 epoch: 52, train_loss: 1.0315, test_loss: 1.3114, test_f1: 0.3710
 epoch: 53, train_loss: 1.0297, test_loss: 1.4052, test_f1: 0.3773
 epoch: 54, train_loss: 1.0302, test_loss: 1.4051, test_f1: 0.3865
 epoch: 55, train_loss: 1.0185, test_loss: 1.3684, test_f1: 0.3715
 epoch: 56, train_loss: 1.0167, test_loss: 1.4214, test_f1: 0.3734
 epoch: 57, train_loss: 1.0162, test_loss: 1.4664, test_f1: 0.3754
 epoch: 58, train_loss: 1.0219, test_loss: 1.4652, test_f1: 0.3719
 epoch: 59, train_loss: 1.0191, test_loss: 1.4247, test_f1: 0.3849
 epoch: 60, train_loss: 1.0239, test_loss: 1.4565, test_f1: 0.3761
 epoch: 61, train_loss: 1.0049, test_loss: 1.4871, test_f1: 0.3730
 epoch: 62, train_loss: 1.0208, test_loss: 1.5249, test_f1: 0.3730
 epoch: 63, train_loss: 1.0079, test_loss: 1.5657, test_f1: 0.3749
 epoch: 64, train_loss: 1.0186, test_loss: 1.5415, test_f1: 0.3763
 epoch: 65, train_loss: 1.0202, test_loss: 1.5157, test_f1: 0.3768
 epoch: 66, train_loss: 1.0135, test_loss: 1.4819, test_f1: 0.3847
 epoch: 67, train_loss: 1.0144, test_loss: 1.4726, test_f1: 0.3874
 epoch: 68, train_loss: 1.0092, test_loss: 1.5784, test_f1: 0.3974
 epoch: 69, train_loss: 1.0215, test_loss: 1.6285, test_f1: 0.3944
 epoch: 70, train_loss: 1.0117, test_loss: 1.6035, test_f1: 0.4025
 epoch: 71, train_loss: 1.0061, test_loss: 1.6439, test_f1: 0.3898
 epoch: 72, train_loss: 1.0117, test_loss: 1.7182, test_f1: 0.3965
 epoch: 73, train_loss: 1.0117, test_loss: 1.6267, test_f1: 0.3974
 epoch: 74, train_loss: 1.0019, test_loss: 1.5648, test_f1: 0.4059
 epoch: 75, train_loss: 1.0075, test_loss: 1.3878, test_f1: 0.4013
 epoch: 76, train_loss: 1.0188, test_loss: 1.4090, test_f1: 0.3936
 epoch: 77, train_loss: 1.0126, test_loss: 1.5921, test_f1: 0.4046
 epoch: 78, train_loss: 1.0051, test_loss: 1.6370, test_f1: 0.4013
 epoch: 79, train_loss: 1.0071, test_loss: 1.5301, test_f1: 0.4009
 epoch: 80, train_loss: 1.0095, test_loss: 1.4033, test_f1: 0.4137
 epoch: 81, train_loss: 0.9939, test_loss: 1.4625, test_f1: 0.4204
 epoch: 82, train_loss: 0.9951, test_loss: 1.5310, test_f1: 0.4205
 epoch: 83, train_loss: 1.0089, test_loss: 1.5745, test_f1: 0.4086
 epoch: 84, train_loss: 1.0047, test_loss: 1.7254, test_f1: 0.4258
 epoch: 85, train_loss: 1.0058, test_loss: 1.6863, test_f1: 0.4165
 epoch: 86, train_loss: 1.0023, test_loss: 1.6087, test_f1: 0.4090
 epoch: 87, train_loss: 1.0105, test_loss: 1.6153, test_f1: 0.4115
 epoch: 88, train_loss: 0.9957, test_loss: 1.6894, test_f1: 0.4136
 epoch: 89, train_loss: 1.0061, test_loss: 1.7194, test_f1: 0.4107
 epoch: 90, train_loss: 0.9986, test_loss: 1.6601, test_f1: 0.4091
 epoch: 91, train_loss: 0.9922, test_loss: 1.5434, test_f1: 0.4198
 epoch: 92, train_loss: 0.9932, test_loss: 1.4555, test_f1: 0.4145
 epoch: 93, train_loss: 0.9947, test_loss: 1.4454, test_f1: 0.3908
 epoch: 94, train_loss: 0.9931, test_loss: 1.4873, test_f1: 0.4178
 epoch: 95, train_loss: 1.0039, test_loss: 1.5407, test_f1: 0.4254
 epoch: 96, train_loss: 1.0029, test_loss: 1.4835, test_f1: 0.4242
 epoch: 97, train_loss: 1.0048, test_loss: 1.4824, test_f1: 0.4142
 epoch: 98, train_loss: 0.9879, test_loss: 1.5421, test_f1: 0.4065
 epoch: 99, train_loss: 0.9719, test_loss: 1.5725, test_f1: 0.4000
##################ITERATION #3 ****************************************
 epoch: 0, train_loss: 1.2767, test_loss: 1.3103, test_f1: 0.2281
 epoch: 1, train_loss: 1.2475, test_loss: 1.3077, test_f1: 0.2281
 epoch: 2, train_loss: 1.2253, test_loss: 1.3003, test_f1: 0.2281
 epoch: 3, train_loss: 1.2224, test_loss: 1.2873, test_f1: 0.2281
 epoch: 4, train_loss: 1.2059, test_loss: 1.2745, test_f1: 0.2357
 epoch: 5, train_loss: 1.1991, test_loss: 1.2675, test_f1: 0.2398
 epoch: 6, train_loss: 1.1947, test_loss: 1.2577, test_f1: 0.2398
 epoch: 7, train_loss: 1.1862, test_loss: 1.2498, test_f1: 0.2561
 epoch: 8, train_loss: 1.1805, test_loss: 1.2428, test_f1: 0.2741
 epoch: 9, train_loss: 1.1580, test_loss: 1.2309, test_f1: 0.2943
 epoch: 10, train_loss: 1.1553, test_loss: 1.2235, test_f1: 0.3048
 epoch: 11, train_loss: 1.1484, test_loss: 1.2195, test_f1: 0.3330
 epoch: 12, train_loss: 1.1501, test_loss: 1.2205, test_f1: 0.3383
 epoch: 13, train_loss: 1.1421, test_loss: 1.2236, test_f1: 0.3391
 epoch: 14, train_loss: 1.1417, test_loss: 1.2280, test_f1: 0.3359
 epoch: 15, train_loss: 1.1243, test_loss: 1.2287, test_f1: 0.3266
 epoch: 16, train_loss: 1.1196, test_loss: 1.2318, test_f1: 0.3424
 epoch: 17, train_loss: 1.1100, test_loss: 1.2115, test_f1: 0.3557
 epoch: 18, train_loss: 1.1028, test_loss: 1.2169, test_f1: 0.3579
 epoch: 19, train_loss: 1.1023, test_loss: 1.2175, test_f1: 0.3536
 epoch: 20, train_loss: 1.1003, test_loss: 1.2127, test_f1: 0.3724
 epoch: 21, train_loss: 1.1025, test_loss: 1.2160, test_f1: 0.4245
 epoch: 22, train_loss: 1.0874, test_loss: 1.2321, test_f1: 0.4157
 epoch: 23, train_loss: 1.0991, test_loss: 1.2102, test_f1: 0.4034
 epoch: 24, train_loss: 1.0907, test_loss: 1.1908, test_f1: 0.4341
 epoch: 25, train_loss: 1.0711, test_loss: 1.1960, test_f1: 0.4258
 epoch: 26, train_loss: 1.0808, test_loss: 1.2054, test_f1: 0.4136
 epoch: 27, train_loss: 1.0789, test_loss: 1.2058, test_f1: 0.3983
 epoch: 28, train_loss: 1.0671, test_loss: 1.1956, test_f1: 0.4053
 epoch: 29, train_loss: 1.0749, test_loss: 1.1981, test_f1: 0.4289
 epoch: 30, train_loss: 1.0634, test_loss: 1.2125, test_f1: 0.4185
 epoch: 31, train_loss: 1.0724, test_loss: 1.2146, test_f1: 0.4167
 epoch: 32, train_loss: 1.0603, test_loss: 1.2172, test_f1: 0.4074
 epoch: 33, train_loss: 1.0558, test_loss: 1.2179, test_f1: 0.4103
 epoch: 34, train_loss: 1.0469, test_loss: 1.2223, test_f1: 0.4100
 epoch: 35, train_loss: 1.0434, test_loss: 1.2136, test_f1: 0.4128
 epoch: 36, train_loss: 1.0404, test_loss: 1.2203, test_f1: 0.4180
 epoch: 37, train_loss: 1.0375, test_loss: 1.2133, test_f1: 0.4204
 epoch: 38, train_loss: 1.0395, test_loss: 1.2240, test_f1: 0.4225
 epoch: 39, train_loss: 1.0310, test_loss: 1.2228, test_f1: 0.4250
 epoch: 40, train_loss: 1.0380, test_loss: 1.2298, test_f1: 0.4204
 epoch: 41, train_loss: 1.0254, test_loss: 1.2184, test_f1: 0.4153
 epoch: 42, train_loss: 1.0279, test_loss: 1.1998, test_f1: 0.4283
 epoch: 43, train_loss: 1.0171, test_loss: 1.2000, test_f1: 0.4221
 epoch: 44, train_loss: 1.0200, test_loss: 1.2185, test_f1: 0.4241
 epoch: 45, train_loss: 1.0178, test_loss: 1.2304, test_f1: 0.4146
 epoch: 46, train_loss: 1.0228, test_loss: 1.2289, test_f1: 0.4102
 epoch: 47, train_loss: 1.0225, test_loss: 1.2456, test_f1: 0.4109
 epoch: 48, train_loss: 1.0294, test_loss: 1.2410, test_f1: 0.4259
 epoch: 49, train_loss: 1.0173, test_loss: 1.2178, test_f1: 0.4334
 epoch: 50, train_loss: 1.0030, test_loss: 1.2083, test_f1: 0.4327
 epoch: 51, train_loss: 1.0022, test_loss: 1.2058, test_f1: 0.4310
 epoch: 52, train_loss: 1.0064, test_loss: 1.2018, test_f1: 0.4378
 epoch: 53, train_loss: 1.0032, test_loss: 1.1990, test_f1: 0.4308
 epoch: 54, train_loss: 1.0103, test_loss: 1.1984, test_f1: 0.4435
 epoch: 55, train_loss: 1.0058, test_loss: 1.2031, test_f1: 0.4329
 epoch: 56, train_loss: 0.9939, test_loss: 1.2017, test_f1: 0.4397
 epoch: 57, train_loss: 1.0015, test_loss: 1.2082, test_f1: 0.4378
 epoch: 58, train_loss: 0.9857, test_loss: 1.2148, test_f1: 0.4372
 epoch: 59, train_loss: 1.0035, test_loss: 1.2162, test_f1: 0.4322
 epoch: 60, train_loss: 0.9998, test_loss: 1.2101, test_f1: 0.4284
 epoch: 61, train_loss: 0.9902, test_loss: 1.2123, test_f1: 0.4315
 epoch: 62, train_loss: 0.9909, test_loss: 1.2120, test_f1: 0.4314
 epoch: 63, train_loss: 0.9929, test_loss: 1.2262, test_f1: 0.4343
 epoch: 64, train_loss: 0.9876, test_loss: 1.2393, test_f1: 0.4341
 epoch: 65, train_loss: 0.9821, test_loss: 1.2334, test_f1: 0.4293
 epoch: 66, train_loss: 0.9996, test_loss: 1.2177, test_f1: 0.4323
 epoch: 67, train_loss: 0.9857, test_loss: 1.2275, test_f1: 0.4300
 epoch: 68, train_loss: 0.9726, test_loss: 1.2285, test_f1: 0.4281
 epoch: 69, train_loss: 0.9869, test_loss: 1.2237, test_f1: 0.4230
 epoch: 70, train_loss: 0.9850, test_loss: 1.2236, test_f1: 0.4247
 epoch: 71, train_loss: 0.9831, test_loss: 1.2249, test_f1: 0.4253
 epoch: 72, train_loss: 0.9831, test_loss: 1.2223, test_f1: 0.4259
 epoch: 73, train_loss: 0.9749, test_loss: 1.2220, test_f1: 0.4227
 epoch: 74, train_loss: 0.9916, test_loss: 1.2173, test_f1: 0.4329
 epoch: 75, train_loss: 0.9755, test_loss: 1.2266, test_f1: 0.4229
 epoch: 76, train_loss: 0.9738, test_loss: 1.2409, test_f1: 0.4213
 epoch: 77, train_loss: 0.9750, test_loss: 1.2556, test_f1: 0.4317
 epoch: 78, train_loss: 0.9783, test_loss: 1.2799, test_f1: 0.4161
 epoch: 79, train_loss: 0.9833, test_loss: 1.2840, test_f1: 0.4286
 epoch: 80, train_loss: 0.9812, test_loss: 1.2465, test_f1: 0.4306
 epoch: 81, train_loss: 0.9790, test_loss: 1.2274, test_f1: 0.4359
 epoch: 82, train_loss: 0.9641, test_loss: 1.2288, test_f1: 0.4366
 epoch: 83, train_loss: 0.9610, test_loss: 1.2443, test_f1: 0.4290
 epoch: 84, train_loss: 0.9512, test_loss: 1.2553, test_f1: 0.4308
 epoch: 85, train_loss: 0.9788, test_loss: 1.2597, test_f1: 0.4238
 epoch: 86, train_loss: 0.9605, test_loss: 1.2734, test_f1: 0.4334
 epoch: 87, train_loss: 0.9607, test_loss: 1.2761, test_f1: 0.4297
 epoch: 88, train_loss: 0.9664, test_loss: 1.2959, test_f1: 0.4298
 epoch: 89, train_loss: 0.9665, test_loss: 1.2851, test_f1: 0.4289
 epoch: 90, train_loss: 0.9567, test_loss: 1.2712, test_f1: 0.4343
 epoch: 91, train_loss: 0.9634, test_loss: 1.2616, test_f1: 0.4373
 epoch: 92, train_loss: 0.9547, test_loss: 1.2622, test_f1: 0.4419
 epoch: 93, train_loss: 0.9566, test_loss: 1.2474, test_f1: 0.4286
 epoch: 94, train_loss: 0.9521, test_loss: 1.2496, test_f1: 0.4331
 epoch: 95, train_loss: 0.9499, test_loss: 1.2506, test_f1: 0.4326
 epoch: 96, train_loss: 0.9545, test_loss: 1.2576, test_f1: 0.4294
 epoch: 97, train_loss: 0.9508, test_loss: 1.2481, test_f1: 0.4215
 epoch: 98, train_loss: 0.9552, test_loss: 1.2453, test_f1: 0.4372
 epoch: 99, train_loss: 0.9399, test_loss: 1.2521, test_f1: 0.4317
##################ITERATION #4 ****************************************
 epoch: 0, train_loss: 1.2956, test_loss: 1.3516, test_f1: 0.2281
 epoch: 1, train_loss: 1.2515, test_loss: 1.3443, test_f1: 0.2281
 epoch: 2, train_loss: 1.2403, test_loss: 1.3283, test_f1: 0.2281
 epoch: 3, train_loss: 1.2280, test_loss: 1.3120, test_f1: 0.2281
 epoch: 4, train_loss: 1.2195, test_loss: 1.2971, test_f1: 0.2325
 epoch: 5, train_loss: 1.2102, test_loss: 1.2879, test_f1: 0.2418
 epoch: 6, train_loss: 1.2008, test_loss: 1.2855, test_f1: 0.2557
 epoch: 7, train_loss: 1.1968, test_loss: 1.2829, test_f1: 0.2631
 epoch: 8, train_loss: 1.1831, test_loss: 1.2699, test_f1: 0.2833
 epoch: 9, train_loss: 1.1902, test_loss: 1.2602, test_f1: 0.3318
 epoch: 10, train_loss: 1.1754, test_loss: 1.2567, test_f1: 0.3554
 epoch: 11, train_loss: 1.1640, test_loss: 1.2549, test_f1: 0.3527
 epoch: 12, train_loss: 1.1556, test_loss: 1.2551, test_f1: 0.3775
 epoch: 13, train_loss: 1.1499, test_loss: 1.2422, test_f1: 0.4120
 epoch: 14, train_loss: 1.1543, test_loss: 1.2316, test_f1: 0.4112
 epoch: 15, train_loss: 1.1468, test_loss: 1.2289, test_f1: 0.4088
 epoch: 16, train_loss: 1.1357, test_loss: 1.2323, test_f1: 0.4238
 epoch: 17, train_loss: 1.1283, test_loss: 1.2333, test_f1: 0.4271
 epoch: 18, train_loss: 1.1204, test_loss: 1.2263, test_f1: 0.4349
 epoch: 19, train_loss: 1.1237, test_loss: 1.2277, test_f1: 0.4047
 epoch: 20, train_loss: 1.1160, test_loss: 1.2368, test_f1: 0.4066
 epoch: 21, train_loss: 1.1131, test_loss: 1.2349, test_f1: 0.4087
 epoch: 22, train_loss: 1.0987, test_loss: 1.2394, test_f1: 0.3906
 epoch: 23, train_loss: 1.1017, test_loss: 1.2381, test_f1: 0.3932
 epoch: 24, train_loss: 1.0962, test_loss: 1.2413, test_f1: 0.3891
 epoch: 25, train_loss: 1.0798, test_loss: 1.2418, test_f1: 0.3968
 epoch: 26, train_loss: 1.0883, test_loss: 1.2443, test_f1: 0.4061
 epoch: 27, train_loss: 1.0899, test_loss: 1.2609, test_f1: 0.3841
 epoch: 28, train_loss: 1.0849, test_loss: 1.2627, test_f1: 0.4119
 epoch: 29, train_loss: 1.0696, test_loss: 1.2463, test_f1: 0.4186
 epoch: 30, train_loss: 1.0718, test_loss: 1.2341, test_f1: 0.4252
 epoch: 31, train_loss: 1.0786, test_loss: 1.2382, test_f1: 0.4329
 epoch: 32, train_loss: 1.0698, test_loss: 1.2516, test_f1: 0.3978
 epoch: 33, train_loss: 1.0661, test_loss: 1.2572, test_f1: 0.4089
 epoch: 34, train_loss: 1.0510, test_loss: 1.2523, test_f1: 0.4315
 epoch: 35, train_loss: 1.0722, test_loss: 1.2506, test_f1: 0.4281
 epoch: 36, train_loss: 1.0632, test_loss: 1.2417, test_f1: 0.4435
 epoch: 37, train_loss: 1.0683, test_loss: 1.2269, test_f1: 0.4222
 epoch: 38, train_loss: 1.0516, test_loss: 1.2431, test_f1: 0.4183
 epoch: 39, train_loss: 1.0531, test_loss: 1.2640, test_f1: 0.4210
 epoch: 40, train_loss: 1.0425, test_loss: 1.2545, test_f1: 0.4309
 epoch: 41, train_loss: 1.0432, test_loss: 1.2506, test_f1: 0.4255
 epoch: 42, train_loss: 1.0350, test_loss: 1.2595, test_f1: 0.4054
 epoch: 43, train_loss: 1.0361, test_loss: 1.2591, test_f1: 0.4125
 epoch: 44, train_loss: 1.0299, test_loss: 1.2638, test_f1: 0.4227
 epoch: 45, train_loss: 1.0320, test_loss: 1.2668, test_f1: 0.4247
 epoch: 46, train_loss: 1.0194, test_loss: 1.2695, test_f1: 0.4088
 epoch: 47, train_loss: 1.0136, test_loss: 1.2578, test_f1: 0.4023
 epoch: 48, train_loss: 1.0269, test_loss: 1.2478, test_f1: 0.4211
 epoch: 49, train_loss: 1.0143, test_loss: 1.2492, test_f1: 0.4194
 epoch: 50, train_loss: 1.0157, test_loss: 1.2445, test_f1: 0.4246
 epoch: 51, train_loss: 1.0141, test_loss: 1.2509, test_f1: 0.4294
 epoch: 52, train_loss: 1.0055, test_loss: 1.2632, test_f1: 0.4238
 epoch: 53, train_loss: 1.0113, test_loss: 1.2499, test_f1: 0.4179
 epoch: 54, train_loss: 1.0099, test_loss: 1.2619, test_f1: 0.4118
 epoch: 55, train_loss: 1.0016, test_loss: 1.2674, test_f1: 0.4043
 epoch: 56, train_loss: 1.0123, test_loss: 1.2542, test_f1: 0.4229
 epoch: 57, train_loss: 1.0095, test_loss: 1.2509, test_f1: 0.4361
 epoch: 58, train_loss: 0.9966, test_loss: 1.2460, test_f1: 0.4389
 epoch: 59, train_loss: 1.0033, test_loss: 1.2517, test_f1: 0.4109
 epoch: 60, train_loss: 0.9949, test_loss: 1.2534, test_f1: 0.4119
 epoch: 61, train_loss: 1.0001, test_loss: 1.2534, test_f1: 0.4139
 epoch: 62, train_loss: 0.9859, test_loss: 1.2552, test_f1: 0.4220
 epoch: 63, train_loss: 0.9878, test_loss: 1.2827, test_f1: 0.4169
 epoch: 64, train_loss: 0.9945, test_loss: 1.2668, test_f1: 0.4106
 epoch: 65, train_loss: 0.9832, test_loss: 1.2621, test_f1: 0.4179
 epoch: 66, train_loss: 0.9753, test_loss: 1.2507, test_f1: 0.4247
 epoch: 67, train_loss: 0.9771, test_loss: 1.2438, test_f1: 0.4096
 epoch: 68, train_loss: 0.9807, test_loss: 1.2484, test_f1: 0.3990
 epoch: 69, train_loss: 0.9812, test_loss: 1.2528, test_f1: 0.4028
 epoch: 70, train_loss: 0.9779, test_loss: 1.2494, test_f1: 0.4074
 epoch: 71, train_loss: 0.9645, test_loss: 1.2488, test_f1: 0.4033
 epoch: 72, train_loss: 0.9752, test_loss: 1.2645, test_f1: 0.4036
 epoch: 73, train_loss: 0.9682, test_loss: 1.2706, test_f1: 0.4221
 epoch: 74, train_loss: 0.9705, test_loss: 1.2876, test_f1: 0.4204
 epoch: 75, train_loss: 0.9762, test_loss: 1.2646, test_f1: 0.4132
 epoch: 76, train_loss: 0.9820, test_loss: 1.2538, test_f1: 0.3863
 epoch: 77, train_loss: 0.9687, test_loss: 1.2638, test_f1: 0.3794
 epoch: 78, train_loss: 0.9641, test_loss: 1.2706, test_f1: 0.3981
 epoch: 79, train_loss: 0.9687, test_loss: 1.2693, test_f1: 0.4096
 epoch: 80, train_loss: 0.9597, test_loss: 1.2642, test_f1: 0.4138
 epoch: 81, train_loss: 0.9607, test_loss: 1.2760, test_f1: 0.4105
 epoch: 82, train_loss: 0.9609, test_loss: 1.2646, test_f1: 0.3941
 epoch: 83, train_loss: 0.9602, test_loss: 1.2739, test_f1: 0.4086
 epoch: 84, train_loss: 0.9597, test_loss: 1.3046, test_f1: 0.4117
 epoch: 85, train_loss: 0.9662, test_loss: 1.2923, test_f1: 0.4044
 epoch: 86, train_loss: 0.9540, test_loss: 1.2923, test_f1: 0.3887
 epoch: 87, train_loss: 0.9586, test_loss: 1.2853, test_f1: 0.4233
 epoch: 88, train_loss: 0.9573, test_loss: 1.2712, test_f1: 0.4176
 epoch: 89, train_loss: 0.9590, test_loss: 1.2635, test_f1: 0.4358
 epoch: 90, train_loss: 0.9558, test_loss: 1.2666, test_f1: 0.4539
 epoch: 91, train_loss: 0.9635, test_loss: 1.2907, test_f1: 0.4380
 epoch: 92, train_loss: 0.9595, test_loss: 1.2835, test_f1: 0.4298
 epoch: 93, train_loss: 0.9600, test_loss: 1.2893, test_f1: 0.4259
 epoch: 94, train_loss: 0.9485, test_loss: 1.2946, test_f1: 0.4402
 epoch: 95, train_loss: 0.9422, test_loss: 1.3082, test_f1: 0.4588
 epoch: 96, train_loss: 0.9456, test_loss: 1.3170, test_f1: 0.4371
 epoch: 97, train_loss: 0.9407, test_loss: 1.3006, test_f1: 0.4309
 epoch: 98, train_loss: 0.9367, test_loss: 1.2865, test_f1: 0.4387
 epoch: 99, train_loss: 0.9433, test_loss: 1.3085, test_f1: 0.4423
##################ITERATION #5 ****************************************
 epoch: 0, train_loss: 1.2903, test_loss: 1.3399, test_f1: 0.2404
 epoch: 1, train_loss: 1.2585, test_loss: 1.3356, test_f1: 0.2404
 epoch: 2, train_loss: 1.2422, test_loss: 1.3321, test_f1: 0.2404
 epoch: 3, train_loss: 1.2378, test_loss: 1.3359, test_f1: 0.2404
 epoch: 4, train_loss: 1.2330, test_loss: 1.3299, test_f1: 0.2404
 epoch: 5, train_loss: 1.2300, test_loss: 1.3250, test_f1: 0.2404
 epoch: 6, train_loss: 1.2237, test_loss: 1.3203, test_f1: 0.2404
 epoch: 7, train_loss: 1.2155, test_loss: 1.3141, test_f1: 0.2404
 epoch: 8, train_loss: 1.2016, test_loss: 1.3100, test_f1: 0.2404
 epoch: 9, train_loss: 1.2008, test_loss: 1.3088, test_f1: 0.2391
 epoch: 10, train_loss: 1.2044, test_loss: 1.3060, test_f1: 0.2744
 epoch: 11, train_loss: 1.2014, test_loss: 1.3118, test_f1: 0.2973
 epoch: 12, train_loss: 1.1976, test_loss: 1.3065, test_f1: 0.2690
 epoch: 13, train_loss: 1.1879, test_loss: 1.2914, test_f1: 0.2944
 epoch: 14, train_loss: 1.1914, test_loss: 1.2827, test_f1: 0.3005
 epoch: 15, train_loss: 1.1900, test_loss: 1.2813, test_f1: 0.3085
 epoch: 16, train_loss: 1.1891, test_loss: 1.2838, test_f1: 0.3427
 epoch: 17, train_loss: 1.1776, test_loss: 1.2873, test_f1: 0.3758
 epoch: 18, train_loss: 1.1779, test_loss: 1.2989, test_f1: 0.3817
 epoch: 19, train_loss: 1.1728, test_loss: 1.3072, test_f1: 0.3838
 epoch: 20, train_loss: 1.1787, test_loss: 1.3060, test_f1: 0.3894
 epoch: 21, train_loss: 1.1688, test_loss: 1.2961, test_f1: 0.3893
 epoch: 22, train_loss: 1.1626, test_loss: 1.3119, test_f1: 0.3919
 epoch: 23, train_loss: 1.1573, test_loss: 1.3065, test_f1: 0.3519
 epoch: 24, train_loss: 1.1498, test_loss: 1.2964, test_f1: 0.3629
 epoch: 25, train_loss: 1.1571, test_loss: 1.3059, test_f1: 0.3897
 epoch: 26, train_loss: 1.1446, test_loss: 1.2873, test_f1: 0.3937
 epoch: 27, train_loss: 1.1383, test_loss: 1.2904, test_f1: 0.4144
 epoch: 28, train_loss: 1.1368, test_loss: 1.2824, test_f1: 0.4175
 epoch: 29, train_loss: 1.1322, test_loss: 1.2727, test_f1: 0.4078
 epoch: 30, train_loss: 1.1212, test_loss: 1.2809, test_f1: 0.4249
 epoch: 31, train_loss: 1.1215, test_loss: 1.2808, test_f1: 0.4109
 epoch: 32, train_loss: 1.1214, test_loss: 1.2804, test_f1: 0.4089
 epoch: 33, train_loss: 1.1147, test_loss: 1.2746, test_f1: 0.4117
 epoch: 34, train_loss: 1.1097, test_loss: 1.2506, test_f1: 0.4210
 epoch: 35, train_loss: 1.1068, test_loss: 1.2478, test_f1: 0.4220
 epoch: 36, train_loss: 1.1024, test_loss: 1.2352, test_f1: 0.4203
 epoch: 37, train_loss: 1.1093, test_loss: 1.2447, test_f1: 0.4189
 epoch: 38, train_loss: 1.1044, test_loss: 1.2552, test_f1: 0.4211
 epoch: 39, train_loss: 1.0969, test_loss: 1.2389, test_f1: 0.4181
 epoch: 40, train_loss: 1.0895, test_loss: 1.2279, test_f1: 0.4254
 epoch: 41, train_loss: 1.0899, test_loss: 1.2194, test_f1: 0.4344
 epoch: 42, train_loss: 1.0834, test_loss: 1.2187, test_f1: 0.4227
 epoch: 43, train_loss: 1.0760, test_loss: 1.2258, test_f1: 0.4258
 epoch: 44, train_loss: 1.0779, test_loss: 1.2265, test_f1: 0.4251
 epoch: 45, train_loss: 1.0676, test_loss: 1.2336, test_f1: 0.4292
 epoch: 46, train_loss: 1.0662, test_loss: 1.2285, test_f1: 0.4368
 epoch: 47, train_loss: 1.0576, test_loss: 1.2304, test_f1: 0.4367
 epoch: 48, train_loss: 1.0574, test_loss: 1.2401, test_f1: 0.4233
 epoch: 49, train_loss: 1.0544, test_loss: 1.2347, test_f1: 0.4233
 epoch: 50, train_loss: 1.0501, test_loss: 1.2386, test_f1: 0.4119
 epoch: 51, train_loss: 1.0486, test_loss: 1.2425, test_f1: 0.4181
 epoch: 52, train_loss: 1.0538, test_loss: 1.2282, test_f1: 0.4281
 epoch: 53, train_loss: 1.0367, test_loss: 1.2142, test_f1: 0.4336
 epoch: 54, train_loss: 1.0451, test_loss: 1.2119, test_f1: 0.4281
 epoch: 55, train_loss: 1.0401, test_loss: 1.2155, test_f1: 0.4378
 epoch: 56, train_loss: 1.0300, test_loss: 1.2082, test_f1: 0.4332
 epoch: 57, train_loss: 1.0326, test_loss: 1.2063, test_f1: 0.4394
 epoch: 58, train_loss: 1.0308, test_loss: 1.2175, test_f1: 0.4390
 epoch: 59, train_loss: 1.0337, test_loss: 1.2281, test_f1: 0.4318
 epoch: 60, train_loss: 1.0231, test_loss: 1.2279, test_f1: 0.4415
 epoch: 61, train_loss: 1.0225, test_loss: 1.2088, test_f1: 0.4235
 epoch: 62, train_loss: 1.0205, test_loss: 1.2040, test_f1: 0.4416
 epoch: 63, train_loss: 1.0237, test_loss: 1.1941, test_f1: 0.4502
 epoch: 64, train_loss: 1.0234, test_loss: 1.2020, test_f1: 0.4477
 epoch: 65, train_loss: 1.0208, test_loss: 1.2079, test_f1: 0.4380
 epoch: 66, train_loss: 1.0174, test_loss: 1.2042, test_f1: 0.4410
 epoch: 67, train_loss: 1.0085, test_loss: 1.2072, test_f1: 0.4408
 epoch: 68, train_loss: 1.0146, test_loss: 1.1989, test_f1: 0.4408
 epoch: 69, train_loss: 1.0077, test_loss: 1.1953, test_f1: 0.4482
 epoch: 70, train_loss: 1.0014, test_loss: 1.1926, test_f1: 0.4631
 epoch: 71, train_loss: 1.0057, test_loss: 1.2015, test_f1: 0.4560
 epoch: 72, train_loss: 1.0111, test_loss: 1.2142, test_f1: 0.4494
 epoch: 73, train_loss: 1.0002, test_loss: 1.2108, test_f1: 0.4525
 epoch: 74, train_loss: 0.9988, test_loss: 1.2012, test_f1: 0.4637
 epoch: 75, train_loss: 0.9997, test_loss: 1.1922, test_f1: 0.4683
 epoch: 76, train_loss: 0.9909, test_loss: 1.1715, test_f1: 0.4651
 epoch: 77, train_loss: 0.9926, test_loss: 1.1827, test_f1: 0.4512
 epoch: 78, train_loss: 0.9960, test_loss: 1.1777, test_f1: 0.4552
 epoch: 79, train_loss: 0.9947, test_loss: 1.1904, test_f1: 0.4505
 epoch: 80, train_loss: 0.9968, test_loss: 1.2017, test_f1: 0.4481
 epoch: 81, train_loss: 0.9891, test_loss: 1.2156, test_f1: 0.4518
 epoch: 82, train_loss: 0.9897, test_loss: 1.2229, test_f1: 0.4448
 epoch: 83, train_loss: 0.9833, test_loss: 1.2175, test_f1: 0.4404
 epoch: 84, train_loss: 0.9747, test_loss: 1.2203, test_f1: 0.4498
 epoch: 85, train_loss: 0.9910, test_loss: 1.2332, test_f1: 0.4285
 epoch: 86, train_loss: 0.9650, test_loss: 1.2340, test_f1: 0.4463
 epoch: 87, train_loss: 0.9707, test_loss: 1.2171, test_f1: 0.4363
 epoch: 88, train_loss: 0.9773, test_loss: 1.2278, test_f1: 0.4553
 epoch: 89, train_loss: 0.9688, test_loss: 1.2142, test_f1: 0.4552
 epoch: 90, train_loss: 0.9672, test_loss: 1.1956, test_f1: 0.4571
 epoch: 91, train_loss: 0.9702, test_loss: 1.2046, test_f1: 0.4500
 epoch: 92, train_loss: 0.9741, test_loss: 1.2137, test_f1: 0.4514
 epoch: 93, train_loss: 0.9786, test_loss: 1.2332, test_f1: 0.4513
 epoch: 94, train_loss: 0.9647, test_loss: 1.2362, test_f1: 0.4507
 epoch: 95, train_loss: 0.9782, test_loss: 1.2444, test_f1: 0.4511
 epoch: 96, train_loss: 0.9678, test_loss: 1.2244, test_f1: 0.4551
 epoch: 97, train_loss: 0.9545, test_loss: 1.1995, test_f1: 0.4333
 epoch: 98, train_loss: 0.9647, test_loss: 1.2120, test_f1: 0.4368
 epoch: 99, train_loss: 0.9567, test_loss: 1.2201, test_f1: 0.4501
##################ITERATION #6 ****************************************
 epoch: 0, train_loss: 1.2875, test_loss: 1.3429, test_f1: 0.2281
 epoch: 1, train_loss: 1.2538, test_loss: 1.3326, test_f1: 0.2281
 epoch: 2, train_loss: 1.2398, test_loss: 1.3240, test_f1: 0.2281
 epoch: 3, train_loss: 1.2489, test_loss: 1.3110, test_f1: 0.2281
 epoch: 4, train_loss: 1.2220, test_loss: 1.3016, test_f1: 0.2281
 epoch: 5, train_loss: 1.2009, test_loss: 1.2914, test_f1: 0.2281
 epoch: 6, train_loss: 1.1966, test_loss: 1.2826, test_f1: 0.2366
 epoch: 7, train_loss: 1.2019, test_loss: 1.2669, test_f1: 0.2709
 epoch: 8, train_loss: 1.1869, test_loss: 1.2547, test_f1: 0.3297
 epoch: 9, train_loss: 1.1838, test_loss: 1.2367, test_f1: 0.3503
 epoch: 10, train_loss: 1.1836, test_loss: 1.2310, test_f1: 0.3911
 epoch: 11, train_loss: 1.1697, test_loss: 1.2316, test_f1: 0.3859
 epoch: 12, train_loss: 1.1524, test_loss: 1.2241, test_f1: 0.4115
 epoch: 13, train_loss: 1.1467, test_loss: 1.2112, test_f1: 0.4112
 epoch: 14, train_loss: 1.1415, test_loss: 1.2059, test_f1: 0.4307
 epoch: 15, train_loss: 1.1487, test_loss: 1.2009, test_f1: 0.4404
 epoch: 16, train_loss: 1.1484, test_loss: 1.1949, test_f1: 0.4474
 epoch: 17, train_loss: 1.1391, test_loss: 1.1932, test_f1: 0.4403
 epoch: 18, train_loss: 1.1286, test_loss: 1.1906, test_f1: 0.4447
 epoch: 19, train_loss: 1.1226, test_loss: 1.1883, test_f1: 0.4402
 epoch: 20, train_loss: 1.1095, test_loss: 1.1839, test_f1: 0.4559
 epoch: 21, train_loss: 1.1022, test_loss: 1.1851, test_f1: 0.4401
 epoch: 22, train_loss: 1.0981, test_loss: 1.1763, test_f1: 0.4605
 epoch: 23, train_loss: 1.1049, test_loss: 1.1753, test_f1: 0.4591
 epoch: 24, train_loss: 1.0947, test_loss: 1.1714, test_f1: 0.4534
 epoch: 25, train_loss: 1.0996, test_loss: 1.1730, test_f1: 0.4507
 epoch: 26, train_loss: 1.0895, test_loss: 1.1706, test_f1: 0.4539
 epoch: 27, train_loss: 1.0869, test_loss: 1.1663, test_f1: 0.4483
 epoch: 28, train_loss: 1.0781, test_loss: 1.1662, test_f1: 0.4501
 epoch: 29, train_loss: 1.0862, test_loss: 1.1650, test_f1: 0.4704
 epoch: 30, train_loss: 1.0775, test_loss: 1.1695, test_f1: 0.4742
 epoch: 31, train_loss: 1.0790, test_loss: 1.1694, test_f1: 0.4637
 epoch: 32, train_loss: 1.0676, test_loss: 1.1557, test_f1: 0.4624
 epoch: 33, train_loss: 1.0659, test_loss: 1.1540, test_f1: 0.4768
 epoch: 34, train_loss: 1.0738, test_loss: 1.1572, test_f1: 0.4743
 epoch: 35, train_loss: 1.0751, test_loss: 1.1508, test_f1: 0.4765
 epoch: 36, train_loss: 1.0805, test_loss: 1.1480, test_f1: 0.4621
 epoch: 37, train_loss: 1.0664, test_loss: 1.1508, test_f1: 0.4668
 epoch: 38, train_loss: 1.0646, test_loss: 1.1568, test_f1: 0.4894
 epoch: 39, train_loss: 1.0561, test_loss: 1.1567, test_f1: 0.4738
 epoch: 40, train_loss: 1.0418, test_loss: 1.1554, test_f1: 0.4544
 epoch: 41, train_loss: 1.0485, test_loss: 1.1544, test_f1: 0.4673
 epoch: 42, train_loss: 1.0542, test_loss: 1.1597, test_f1: 0.5004
 epoch: 43, train_loss: 1.0419, test_loss: 1.1552, test_f1: 0.4793
 epoch: 44, train_loss: 1.0314, test_loss: 1.1480, test_f1: 0.4664
 epoch: 45, train_loss: 1.0378, test_loss: 1.1508, test_f1: 0.4725
 epoch: 46, train_loss: 1.0355, test_loss: 1.1540, test_f1: 0.4681
 epoch: 47, train_loss: 1.0247, test_loss: 1.1487, test_f1: 0.4746
 epoch: 48, train_loss: 1.0245, test_loss: 1.1526, test_f1: 0.4753
 epoch: 49, train_loss: 1.0266, test_loss: 1.1584, test_f1: 0.4730
 epoch: 50, train_loss: 1.0515, test_loss: 1.1644, test_f1: 0.4540
 epoch: 51, train_loss: 1.0191, test_loss: 1.1606, test_f1: 0.4683
 epoch: 52, train_loss: 1.0119, test_loss: 1.1643, test_f1: 0.4664
 epoch: 53, train_loss: 1.0173, test_loss: 1.1673, test_f1: 0.4671
 epoch: 54, train_loss: 1.0142, test_loss: 1.1676, test_f1: 0.4640
 epoch: 55, train_loss: 1.0133, test_loss: 1.1634, test_f1: 0.4654
 epoch: 56, train_loss: 1.0100, test_loss: 1.1592, test_f1: 0.4573
 epoch: 57, train_loss: 1.0182, test_loss: 1.1526, test_f1: 0.4572
 epoch: 58, train_loss: 1.0097, test_loss: 1.1524, test_f1: 0.4684
 epoch: 59, train_loss: 1.0022, test_loss: 1.1611, test_f1: 0.4680
 epoch: 60, train_loss: 1.0066, test_loss: 1.1708, test_f1: 0.4701
 epoch: 61, train_loss: 1.0058, test_loss: 1.1660, test_f1: 0.4523
 epoch: 62, train_loss: 1.0105, test_loss: 1.1649, test_f1: 0.4621
 epoch: 63, train_loss: 1.0079, test_loss: 1.1642, test_f1: 0.4485
 epoch: 64, train_loss: 0.9967, test_loss: 1.1626, test_f1: 0.4627
 epoch: 65, train_loss: 1.0041, test_loss: 1.1584, test_f1: 0.4541
 epoch: 66, train_loss: 1.0024, test_loss: 1.1572, test_f1: 0.4626
 epoch: 67, train_loss: 1.0155, test_loss: 1.1591, test_f1: 0.4491
 epoch: 68, train_loss: 1.0125, test_loss: 1.1572, test_f1: 0.4572
 epoch: 69, train_loss: 1.0118, test_loss: 1.1559, test_f1: 0.4671
 epoch: 70, train_loss: 0.9934, test_loss: 1.1552, test_f1: 0.4760
 epoch: 71, train_loss: 1.0025, test_loss: 1.1538, test_f1: 0.4915
 epoch: 72, train_loss: 0.9968, test_loss: 1.1539, test_f1: 0.4821
 epoch: 73, train_loss: 0.9903, test_loss: 1.1565, test_f1: 0.4749
 epoch: 74, train_loss: 0.9883, test_loss: 1.1561, test_f1: 0.4737
 epoch: 75, train_loss: 0.9845, test_loss: 1.1517, test_f1: 0.4547
 epoch: 76, train_loss: 0.9777, test_loss: 1.1487, test_f1: 0.4486
 epoch: 77, train_loss: 0.9907, test_loss: 1.1509, test_f1: 0.4609
 epoch: 78, train_loss: 0.9906, test_loss: 1.1529, test_f1: 0.4649
 epoch: 79, train_loss: 0.9864, test_loss: 1.1561, test_f1: 0.4732
 epoch: 80, train_loss: 0.9808, test_loss: 1.1565, test_f1: 0.4663
 epoch: 81, train_loss: 0.9809, test_loss: 1.1607, test_f1: 0.4781
 epoch: 82, train_loss: 0.9629, test_loss: 1.1639, test_f1: 0.4865
 epoch: 83, train_loss: 0.9725, test_loss: 1.1628, test_f1: 0.4915
 epoch: 84, train_loss: 0.9726, test_loss: 1.1547, test_f1: 0.4911
 epoch: 85, train_loss: 0.9681, test_loss: 1.1631, test_f1: 0.4827
 epoch: 86, train_loss: 0.9558, test_loss: 1.1637, test_f1: 0.4742
 epoch: 87, train_loss: 0.9750, test_loss: 1.1668, test_f1: 0.4755
 epoch: 88, train_loss: 0.9621, test_loss: 1.1713, test_f1: 0.4735
 epoch: 89, train_loss: 0.9824, test_loss: 1.1733, test_f1: 0.4828
 epoch: 90, train_loss: 0.9725, test_loss: 1.1666, test_f1: 0.4787
 epoch: 91, train_loss: 0.9641, test_loss: 1.1697, test_f1: 0.4832
 epoch: 92, train_loss: 0.9569, test_loss: 1.1720, test_f1: 0.4871
 epoch: 93, train_loss: 0.9660, test_loss: 1.1587, test_f1: 0.4858
 epoch: 94, train_loss: 0.9688, test_loss: 1.1586, test_f1: 0.4871
 epoch: 95, train_loss: 0.9598, test_loss: 1.1682, test_f1: 0.4870
 epoch: 96, train_loss: 0.9378, test_loss: 1.1737, test_f1: 0.5017
 epoch: 97, train_loss: 0.9636, test_loss: 1.1854, test_f1: 0.4915
 epoch: 98, train_loss: 0.9554, test_loss: 1.1915, test_f1: 0.5082
 epoch: 99, train_loss: 0.9628, test_loss: 1.1750, test_f1: 0.4985
##################ITERATION #7 ****************************************
 epoch: 0, train_loss: 1.3850, test_loss: 1.3541, test_f1: 0.2281
 epoch: 1, train_loss: 1.2970, test_loss: 1.3453, test_f1: 0.2281
 epoch: 2, train_loss: 1.2766, test_loss: 1.3327, test_f1: 0.2238
 epoch: 3, train_loss: 1.2608, test_loss: 1.3262, test_f1: 0.2398
 epoch: 4, train_loss: 1.2355, test_loss: 1.3298, test_f1: 0.2404
 epoch: 5, train_loss: 1.2157, test_loss: 1.3372, test_f1: 0.2404
 epoch: 6, train_loss: 1.2148, test_loss: 1.3431, test_f1: 0.2404
 epoch: 7, train_loss: 1.1933, test_loss: 1.3481, test_f1: 0.2460
 epoch: 8, train_loss: 1.1824, test_loss: 1.3392, test_f1: 0.2560
 epoch: 9, train_loss: 1.1714, test_loss: 1.3329, test_f1: 0.2560
 epoch: 10, train_loss: 1.1727, test_loss: 1.3248, test_f1: 0.2638
 epoch: 11, train_loss: 1.1787, test_loss: 1.2955, test_f1: 0.2850
 epoch: 12, train_loss: 1.1594, test_loss: 1.2908, test_f1: 0.2949
 epoch: 13, train_loss: 1.1513, test_loss: 1.2888, test_f1: 0.3013
 epoch: 14, train_loss: 1.1394, test_loss: 1.2893, test_f1: 0.3012
 epoch: 15, train_loss: 1.1458, test_loss: 1.2795, test_f1: 0.3281
 epoch: 16, train_loss: 1.1297, test_loss: 1.2615, test_f1: 0.3455
 epoch: 17, train_loss: 1.1294, test_loss: 1.2457, test_f1: 0.3442
 epoch: 18, train_loss: 1.1141, test_loss: 1.2392, test_f1: 0.3442
 epoch: 19, train_loss: 1.1188, test_loss: 1.2359, test_f1: 0.3492
 epoch: 20, train_loss: 1.1043, test_loss: 1.2380, test_f1: 0.3596
 epoch: 21, train_loss: 1.1089, test_loss: 1.2338, test_f1: 0.3489
 epoch: 22, train_loss: 1.1031, test_loss: 1.2340, test_f1: 0.3696
 epoch: 23, train_loss: 1.0942, test_loss: 1.2373, test_f1: 0.3701
 epoch: 24, train_loss: 1.0877, test_loss: 1.2478, test_f1: 0.3622
 epoch: 25, train_loss: 1.0834, test_loss: 1.2590, test_f1: 0.3738
 epoch: 26, train_loss: 1.0832, test_loss: 1.2619, test_f1: 0.3661
 epoch: 27, train_loss: 1.0802, test_loss: 1.2886, test_f1: 0.3597
 epoch: 28, train_loss: 1.0736, test_loss: 1.2795, test_f1: 0.3608
 epoch: 29, train_loss: 1.0664, test_loss: 1.2651, test_f1: 0.3684
 epoch: 30, train_loss: 1.0589, test_loss: 1.2761, test_f1: 0.4035
 epoch: 31, train_loss: 1.0658, test_loss: 1.2655, test_f1: 0.4027
 epoch: 32, train_loss: 1.0681, test_loss: 1.2607, test_f1: 0.3933
 epoch: 33, train_loss: 1.0390, test_loss: 1.2503, test_f1: 0.3918
 epoch: 34, train_loss: 1.0375, test_loss: 1.2440, test_f1: 0.4028
 epoch: 35, train_loss: 1.0349, test_loss: 1.2373, test_f1: 0.4172
 epoch: 36, train_loss: 1.0319, test_loss: 1.2336, test_f1: 0.4071
 epoch: 37, train_loss: 1.0299, test_loss: 1.2547, test_f1: 0.3800
 epoch: 38, train_loss: 1.0325, test_loss: 1.2679, test_f1: 0.3956
 epoch: 39, train_loss: 1.0195, test_loss: 1.2976, test_f1: 0.4010
 epoch: 40, train_loss: 1.0299, test_loss: 1.3073, test_f1: 0.3971
 epoch: 41, train_loss: 1.0290, test_loss: 1.3205, test_f1: 0.3954
 epoch: 42, train_loss: 1.0351, test_loss: 1.3446, test_f1: 0.3795
 epoch: 43, train_loss: 1.0312, test_loss: 1.3299, test_f1: 0.3868
 epoch: 44, train_loss: 1.0272, test_loss: 1.2856, test_f1: 0.3865
 epoch: 45, train_loss: 1.0203, test_loss: 1.2782, test_f1: 0.3743
 epoch: 46, train_loss: 1.0193, test_loss: 1.2519, test_f1: 0.3756
 epoch: 47, train_loss: 1.0087, test_loss: 1.2647, test_f1: 0.3954
 epoch: 48, train_loss: 1.0000, test_loss: 1.3258, test_f1: 0.3955
 epoch: 49, train_loss: 1.0095, test_loss: 1.3195, test_f1: 0.3907
 epoch: 50, train_loss: 1.0149, test_loss: 1.3046, test_f1: 0.3919
 epoch: 51, train_loss: 0.9975, test_loss: 1.3089, test_f1: 0.4122
 epoch: 52, train_loss: 1.0028, test_loss: 1.3032, test_f1: 0.4190
 epoch: 53, train_loss: 0.9922, test_loss: 1.2936, test_f1: 0.4081
 epoch: 54, train_loss: 1.0027, test_loss: 1.2882, test_f1: 0.4131
 epoch: 55, train_loss: 0.9875, test_loss: 1.2915, test_f1: 0.4163
 epoch: 56, train_loss: 0.9863, test_loss: 1.2964, test_f1: 0.4118
 epoch: 57, train_loss: 0.9878, test_loss: 1.2904, test_f1: 0.4049
 epoch: 58, train_loss: 0.9893, test_loss: 1.2994, test_f1: 0.4101
 epoch: 59, train_loss: 0.9854, test_loss: 1.2919, test_f1: 0.4320
 epoch: 60, train_loss: 0.9844, test_loss: 1.3013, test_f1: 0.4230
 epoch: 61, train_loss: 0.9837, test_loss: 1.3045, test_f1: 0.3998
 epoch: 62, train_loss: 0.9800, test_loss: 1.2966, test_f1: 0.4104
 epoch: 63, train_loss: 0.9889, test_loss: 1.2627, test_f1: 0.4236
 epoch: 64, train_loss: 0.9929, test_loss: 1.2498, test_f1: 0.4094
 epoch: 65, train_loss: 1.0049, test_loss: 1.2620, test_f1: 0.4125
 epoch: 66, train_loss: 0.9945, test_loss: 1.2546, test_f1: 0.4196
 epoch: 67, train_loss: 0.9854, test_loss: 1.2863, test_f1: 0.4250
 epoch: 68, train_loss: 0.9913, test_loss: 1.2907, test_f1: 0.4239
 epoch: 69, train_loss: 0.9843, test_loss: 1.2366, test_f1: 0.4254
 epoch: 70, train_loss: 0.9801, test_loss: 1.2267, test_f1: 0.4242
 epoch: 71, train_loss: 0.9846, test_loss: 1.2292, test_f1: 0.4267
 epoch: 72, train_loss: 0.9811, test_loss: 1.2471, test_f1: 0.4161
 epoch: 73, train_loss: 0.9738, test_loss: 1.2514, test_f1: 0.4223
 epoch: 74, train_loss: 0.9693, test_loss: 1.2683, test_f1: 0.4296
 epoch: 75, train_loss: 0.9705, test_loss: 1.2495, test_f1: 0.4202
 epoch: 76, train_loss: 0.9722, test_loss: 1.2302, test_f1: 0.4036
 epoch: 77, train_loss: 0.9809, test_loss: 1.2457, test_f1: 0.4260
 epoch: 78, train_loss: 0.9679, test_loss: 1.2579, test_f1: 0.4335
 epoch: 79, train_loss: 0.9743, test_loss: 1.2499, test_f1: 0.4277
 epoch: 80, train_loss: 0.9650, test_loss: 1.2696, test_f1: 0.4107
 epoch: 81, train_loss: 0.9686, test_loss: 1.2687, test_f1: 0.4086
 epoch: 82, train_loss: 0.9568, test_loss: 1.2698, test_f1: 0.4159
 epoch: 83, train_loss: 0.9590, test_loss: 1.2749, test_f1: 0.4192
 epoch: 84, train_loss: 0.9572, test_loss: 1.2594, test_f1: 0.4261
 epoch: 85, train_loss: 0.9558, test_loss: 1.2545, test_f1: 0.4413
 epoch: 86, train_loss: 0.9608, test_loss: 1.2430, test_f1: 0.4252
 epoch: 87, train_loss: 0.9581, test_loss: 1.2410, test_f1: 0.4209
 epoch: 88, train_loss: 0.9519, test_loss: 1.2463, test_f1: 0.4301
 epoch: 89, train_loss: 0.9528, test_loss: 1.2414, test_f1: 0.4369
 epoch: 90, train_loss: 0.9622, test_loss: 1.2608, test_f1: 0.4231
 epoch: 91, train_loss: 0.9546, test_loss: 1.2616, test_f1: 0.4286
 epoch: 92, train_loss: 0.9691, test_loss: 1.2631, test_f1: 0.4223
 epoch: 93, train_loss: 0.9547, test_loss: 1.2614, test_f1: 0.4173
 epoch: 94, train_loss: 0.9387, test_loss: 1.2450, test_f1: 0.4177
 epoch: 95, train_loss: 0.9531, test_loss: 1.2515, test_f1: 0.4331
 epoch: 96, train_loss: 0.9531, test_loss: 1.2681, test_f1: 0.4377
 epoch: 97, train_loss: 0.9394, test_loss: 1.2797, test_f1: 0.4662
 epoch: 98, train_loss: 0.9461, test_loss: 1.2832, test_f1: 0.4670
 epoch: 99, train_loss: 0.9428, test_loss: 1.2920, test_f1: 0.4530
##################ITERATION #8 ****************************************
 epoch: 0, train_loss: 1.3370, test_loss: 1.3392, test_f1: 0.2281
 epoch: 1, train_loss: 1.2719, test_loss: 1.3389, test_f1: 0.2281
 epoch: 2, train_loss: 1.2544, test_loss: 1.3280, test_f1: 0.2281
 epoch: 3, train_loss: 1.2146, test_loss: 1.3166, test_f1: 0.2281
 epoch: 4, train_loss: 1.2159, test_loss: 1.2976, test_f1: 0.2381
 epoch: 5, train_loss: 1.2033, test_loss: 1.2831, test_f1: 0.3338
 epoch: 6, train_loss: 1.1875, test_loss: 1.2738, test_f1: 0.3764
 epoch: 7, train_loss: 1.1790, test_loss: 1.2586, test_f1: 0.3607
 epoch: 8, train_loss: 1.1743, test_loss: 1.2529, test_f1: 0.3695
 epoch: 9, train_loss: 1.1764, test_loss: 1.2575, test_f1: 0.3737
 epoch: 10, train_loss: 1.1658, test_loss: 1.2546, test_f1: 0.3864
 epoch: 11, train_loss: 1.1618, test_loss: 1.2372, test_f1: 0.3902
 epoch: 12, train_loss: 1.1580, test_loss: 1.2290, test_f1: 0.4026
 epoch: 13, train_loss: 1.1497, test_loss: 1.2367, test_f1: 0.3986
 epoch: 14, train_loss: 1.1375, test_loss: 1.2308, test_f1: 0.4021
 epoch: 15, train_loss: 1.1301, test_loss: 1.2179, test_f1: 0.4199
 epoch: 16, train_loss: 1.1328, test_loss: 1.2201, test_f1: 0.4086
 epoch: 17, train_loss: 1.1228, test_loss: 1.2219, test_f1: 0.4200
 epoch: 18, train_loss: 1.1213, test_loss: 1.2104, test_f1: 0.4403
 epoch: 19, train_loss: 1.1189, test_loss: 1.2073, test_f1: 0.4259
 epoch: 20, train_loss: 1.1155, test_loss: 1.2132, test_f1: 0.4137
 epoch: 21, train_loss: 1.0981, test_loss: 1.2181, test_f1: 0.4078
 epoch: 22, train_loss: 1.1117, test_loss: 1.2160, test_f1: 0.4061
 epoch: 23, train_loss: 1.1077, test_loss: 1.2138, test_f1: 0.4313
 epoch: 24, train_loss: 1.0980, test_loss: 1.2134, test_f1: 0.4300
 epoch: 25, train_loss: 1.1055, test_loss: 1.2251, test_f1: 0.4176
 epoch: 26, train_loss: 1.1074, test_loss: 1.2260, test_f1: 0.4114
 epoch: 27, train_loss: 1.0861, test_loss: 1.2083, test_f1: 0.4267
 epoch: 28, train_loss: 1.0763, test_loss: 1.2057, test_f1: 0.4294
 epoch: 29, train_loss: 1.0903, test_loss: 1.2154, test_f1: 0.4299
 epoch: 30, train_loss: 1.0865, test_loss: 1.2149, test_f1: 0.4414
 epoch: 31, train_loss: 1.0788, test_loss: 1.2118, test_f1: 0.4432
 epoch: 32, train_loss: 1.0672, test_loss: 1.2125, test_f1: 0.4376
 epoch: 33, train_loss: 1.0892, test_loss: 1.2072, test_f1: 0.4429
 epoch: 34, train_loss: 1.0770, test_loss: 1.2054, test_f1: 0.4441
 epoch: 35, train_loss: 1.0645, test_loss: 1.2138, test_f1: 0.4376
 epoch: 36, train_loss: 1.0842, test_loss: 1.2223, test_f1: 0.4362
 epoch: 37, train_loss: 1.0600, test_loss: 1.2070, test_f1: 0.4521
 epoch: 38, train_loss: 1.0616, test_loss: 1.1868, test_f1: 0.4558
 epoch: 39, train_loss: 1.0471, test_loss: 1.1931, test_f1: 0.4457
 epoch: 40, train_loss: 1.0520, test_loss: 1.1861, test_f1: 0.4552
 epoch: 41, train_loss: 1.0540, test_loss: 1.1815, test_f1: 0.4526
 epoch: 42, train_loss: 1.0508, test_loss: 1.1936, test_f1: 0.4606
 epoch: 43, train_loss: 1.0455, test_loss: 1.2004, test_f1: 0.4543
 epoch: 44, train_loss: 1.0488, test_loss: 1.1922, test_f1: 0.4397
 epoch: 45, train_loss: 1.0461, test_loss: 1.2075, test_f1: 0.4334
 epoch: 46, train_loss: 1.0420, test_loss: 1.2115, test_f1: 0.4426
 epoch: 47, train_loss: 1.0452, test_loss: 1.2226, test_f1: 0.4400
 epoch: 48, train_loss: 1.0503, test_loss: 1.2239, test_f1: 0.4328
 epoch: 49, train_loss: 1.0300, test_loss: 1.2068, test_f1: 0.4443
 epoch: 50, train_loss: 1.0523, test_loss: 1.2064, test_f1: 0.4476
 epoch: 51, train_loss: 1.0193, test_loss: 1.1972, test_f1: 0.4595
 epoch: 52, train_loss: 1.0282, test_loss: 1.1918, test_f1: 0.4590
 epoch: 53, train_loss: 1.0247, test_loss: 1.1833, test_f1: 0.4551
 epoch: 54, train_loss: 1.0241, test_loss: 1.1786, test_f1: 0.4548
 epoch: 55, train_loss: 1.0277, test_loss: 1.1820, test_f1: 0.4409
 epoch: 56, train_loss: 1.0280, test_loss: 1.1829, test_f1: 0.4482
 epoch: 57, train_loss: 1.0217, test_loss: 1.1811, test_f1: 0.4482
 epoch: 58, train_loss: 1.0201, test_loss: 1.1760, test_f1: 0.4476
 epoch: 59, train_loss: 1.0146, test_loss: 1.1730, test_f1: 0.4549
 epoch: 60, train_loss: 1.0083, test_loss: 1.1825, test_f1: 0.4508
 epoch: 61, train_loss: 1.0164, test_loss: 1.1903, test_f1: 0.4407
 epoch: 62, train_loss: 1.0024, test_loss: 1.1951, test_f1: 0.4378
 epoch: 63, train_loss: 1.0171, test_loss: 1.1892, test_f1: 0.4403
 epoch: 64, train_loss: 1.0075, test_loss: 1.1973, test_f1: 0.4331
 epoch: 65, train_loss: 0.9974, test_loss: 1.2028, test_f1: 0.4515
 epoch: 66, train_loss: 1.0101, test_loss: 1.2083, test_f1: 0.4566
 epoch: 67, train_loss: 1.0004, test_loss: 1.2048, test_f1: 0.4499
 epoch: 68, train_loss: 1.0141, test_loss: 1.2014, test_f1: 0.4470
 epoch: 69, train_loss: 0.9972, test_loss: 1.1955, test_f1: 0.4534
 epoch: 70, train_loss: 1.0037, test_loss: 1.2023, test_f1: 0.4561
 epoch: 71, train_loss: 1.0009, test_loss: 1.2025, test_f1: 0.4633
 epoch: 72, train_loss: 1.0046, test_loss: 1.2060, test_f1: 0.4565
 epoch: 73, train_loss: 0.9986, test_loss: 1.2026, test_f1: 0.4539
 epoch: 74, train_loss: 0.9961, test_loss: 1.1854, test_f1: 0.4377
 epoch: 75, train_loss: 1.0078, test_loss: 1.1795, test_f1: 0.4454
 epoch: 76, train_loss: 0.9870, test_loss: 1.1797, test_f1: 0.4462
 epoch: 77, train_loss: 0.9899, test_loss: 1.1823, test_f1: 0.4630
 epoch: 78, train_loss: 0.9874, test_loss: 1.1868, test_f1: 0.4680
 epoch: 79, train_loss: 0.9977, test_loss: 1.1909, test_f1: 0.4601
 epoch: 80, train_loss: 0.9921, test_loss: 1.1912, test_f1: 0.4472
 epoch: 81, train_loss: 0.9813, test_loss: 1.1799, test_f1: 0.4428
 epoch: 82, train_loss: 0.9935, test_loss: 1.1727, test_f1: 0.4563
 epoch: 83, train_loss: 0.9979, test_loss: 1.1810, test_f1: 0.4618
 epoch: 84, train_loss: 0.9896, test_loss: 1.1905, test_f1: 0.4614
 epoch: 85, train_loss: 0.9921, test_loss: 1.1922, test_f1: 0.4516
 epoch: 86, train_loss: 0.9861, test_loss: 1.1977, test_f1: 0.4634
 epoch: 87, train_loss: 0.9769, test_loss: 1.1905, test_f1: 0.4642
 epoch: 88, train_loss: 0.9895, test_loss: 1.1848, test_f1: 0.4714
 epoch: 89, train_loss: 0.9937, test_loss: 1.1911, test_f1: 0.4545
 epoch: 90, train_loss: 0.9878, test_loss: 1.1868, test_f1: 0.4519
 epoch: 91, train_loss: 0.9901, test_loss: 1.1927, test_f1: 0.4564
 epoch: 92, train_loss: 0.9790, test_loss: 1.1851, test_f1: 0.4383
 epoch: 93, train_loss: 0.9873, test_loss: 1.1724, test_f1: 0.4431
 epoch: 94, train_loss: 0.9702, test_loss: 1.1747, test_f1: 0.4403
 epoch: 95, train_loss: 0.9726, test_loss: 1.1704, test_f1: 0.4497
 epoch: 96, train_loss: 0.9602, test_loss: 1.1858, test_f1: 0.4438
 epoch: 97, train_loss: 0.9797, test_loss: 1.1980, test_f1: 0.4422
 epoch: 98, train_loss: 0.9732, test_loss: 1.2003, test_f1: 0.4512
 epoch: 99, train_loss: 0.9731, test_loss: 1.1944, test_f1: 0.4583
##################ITERATION #9 ****************************************
 epoch: 0, train_loss: 1.2989, test_loss: 1.4758, test_f1: 0.2630
 epoch: 1, train_loss: 1.2446, test_loss: 1.4144, test_f1: 0.2357
 epoch: 2, train_loss: 1.2162, test_loss: 1.3838, test_f1: 0.2357
 epoch: 3, train_loss: 1.2103, test_loss: 1.3691, test_f1: 0.2463
 epoch: 4, train_loss: 1.1983, test_loss: 1.3579, test_f1: 0.2630
 epoch: 5, train_loss: 1.1788, test_loss: 1.3346, test_f1: 0.2686
 epoch: 6, train_loss: 1.1662, test_loss: 1.3283, test_f1: 0.3002
 epoch: 7, train_loss: 1.1670, test_loss: 1.3096, test_f1: 0.3226
 epoch: 8, train_loss: 1.1569, test_loss: 1.2867, test_f1: 0.3447
 epoch: 9, train_loss: 1.1607, test_loss: 1.2737, test_f1: 0.3547
 epoch: 10, train_loss: 1.1540, test_loss: 1.2736, test_f1: 0.3779
 epoch: 11, train_loss: 1.1446, test_loss: 1.2733, test_f1: 0.3940
 epoch: 12, train_loss: 1.1486, test_loss: 1.2558, test_f1: 0.4041
 epoch: 13, train_loss: 1.1394, test_loss: 1.2497, test_f1: 0.4037
 epoch: 14, train_loss: 1.1234, test_loss: 1.2398, test_f1: 0.4105
 epoch: 15, train_loss: 1.1265, test_loss: 1.2372, test_f1: 0.4087
 epoch: 16, train_loss: 1.1093, test_loss: 1.2409, test_f1: 0.4040
 epoch: 17, train_loss: 1.1179, test_loss: 1.2404, test_f1: 0.3983
 epoch: 18, train_loss: 1.1057, test_loss: 1.2400, test_f1: 0.4141
 epoch: 19, train_loss: 1.1065, test_loss: 1.2403, test_f1: 0.4142
 epoch: 20, train_loss: 1.1076, test_loss: 1.2356, test_f1: 0.4063
 epoch: 21, train_loss: 1.0856, test_loss: 1.2441, test_f1: 0.4043
 epoch: 22, train_loss: 1.1031, test_loss: 1.2431, test_f1: 0.4180
 epoch: 23, train_loss: 1.0914, test_loss: 1.2325, test_f1: 0.4019
 epoch: 24, train_loss: 1.0900, test_loss: 1.2319, test_f1: 0.3935
 epoch: 25, train_loss: 1.0904, test_loss: 1.2318, test_f1: 0.3974
 epoch: 26, train_loss: 1.0864, test_loss: 1.2372, test_f1: 0.3857
 epoch: 27, train_loss: 1.0792, test_loss: 1.2334, test_f1: 0.4137
 epoch: 28, train_loss: 1.0701, test_loss: 1.2184, test_f1: 0.4252
 epoch: 29, train_loss: 1.0819, test_loss: 1.2005, test_f1: 0.4285
 epoch: 30, train_loss: 1.0728, test_loss: 1.1986, test_f1: 0.4431
 epoch: 31, train_loss: 1.0683, test_loss: 1.2059, test_f1: 0.4125
 epoch: 32, train_loss: 1.0784, test_loss: 1.2115, test_f1: 0.4157
 epoch: 33, train_loss: 1.0549, test_loss: 1.2140, test_f1: 0.3934
 epoch: 34, train_loss: 1.0555, test_loss: 1.1922, test_f1: 0.3907
 epoch: 35, train_loss: 1.0548, test_loss: 1.1881, test_f1: 0.3760
 epoch: 36, train_loss: 1.0481, test_loss: 1.1865, test_f1: 0.3974
 epoch: 37, train_loss: 1.0467, test_loss: 1.1964, test_f1: 0.4217
 epoch: 38, train_loss: 1.0510, test_loss: 1.2074, test_f1: 0.4047
 epoch: 39, train_loss: 1.0402, test_loss: 1.2105, test_f1: 0.4103
 epoch: 40, train_loss: 1.0502, test_loss: 1.2200, test_f1: 0.4123
 epoch: 41, train_loss: 1.0460, test_loss: 1.2070, test_f1: 0.4022
 epoch: 42, train_loss: 1.0395, test_loss: 1.2117, test_f1: 0.4010
 epoch: 43, train_loss: 1.0405, test_loss: 1.2098, test_f1: 0.4263
 epoch: 44, train_loss: 1.0306, test_loss: 1.2217, test_f1: 0.4254
 epoch: 45, train_loss: 1.0429, test_loss: 1.2442, test_f1: 0.4094
 epoch: 46, train_loss: 1.0330, test_loss: 1.2416, test_f1: 0.4185
 epoch: 47, train_loss: 1.0171, test_loss: 1.2195, test_f1: 0.4414
 epoch: 48, train_loss: 1.0196, test_loss: 1.2255, test_f1: 0.4440
 epoch: 49, train_loss: 1.0284, test_loss: 1.2165, test_f1: 0.4297
 epoch: 50, train_loss: 1.0254, test_loss: 1.2283, test_f1: 0.4261
 epoch: 51, train_loss: 0.9998, test_loss: 1.2363, test_f1: 0.4506
 epoch: 52, train_loss: 1.0051, test_loss: 1.2509, test_f1: 0.4040
 epoch: 53, train_loss: 0.9976, test_loss: 1.2473, test_f1: 0.4567
 epoch: 54, train_loss: 1.0077, test_loss: 1.2239, test_f1: 0.4604
 epoch: 55, train_loss: 1.0168, test_loss: 1.2533, test_f1: 0.4524
 epoch: 56, train_loss: 1.0071, test_loss: 1.2754, test_f1: 0.4478
 epoch: 57, train_loss: 1.0023, test_loss: 1.2550, test_f1: 0.4398
 epoch: 58, train_loss: 0.9965, test_loss: 1.2640, test_f1: 0.4370
 epoch: 59, train_loss: 0.9959, test_loss: 1.2591, test_f1: 0.4434
 epoch: 60, train_loss: 0.9891, test_loss: 1.2561, test_f1: 0.4374
 epoch: 61, train_loss: 1.0010, test_loss: 1.2644, test_f1: 0.4676
 epoch: 62, train_loss: 0.9794, test_loss: 1.2625, test_f1: 0.4462
 epoch: 63, train_loss: 0.9949, test_loss: 1.2696, test_f1: 0.4653
 epoch: 64, train_loss: 0.9892, test_loss: 1.2617, test_f1: 0.4636
 epoch: 65, train_loss: 0.9805, test_loss: 1.2421, test_f1: 0.4510
 epoch: 66, train_loss: 0.9874, test_loss: 1.2692, test_f1: 0.4533
 epoch: 67, train_loss: 0.9898, test_loss: 1.2859, test_f1: 0.4508
 epoch: 68, train_loss: 0.9920, test_loss: 1.2805, test_f1: 0.4550
 epoch: 69, train_loss: 0.9782, test_loss: 1.2776, test_f1: 0.4483
 epoch: 70, train_loss: 0.9846, test_loss: 1.2932, test_f1: 0.4605
 epoch: 71, train_loss: 0.9899, test_loss: 1.2992, test_f1: 0.4562
 epoch: 72, train_loss: 0.9814, test_loss: 1.3096, test_f1: 0.4318
 epoch: 73, train_loss: 0.9868, test_loss: 1.2830, test_f1: 0.4397
 epoch: 74, train_loss: 0.9769, test_loss: 1.2775, test_f1: 0.4646
 epoch: 75, train_loss: 0.9799, test_loss: 1.2867, test_f1: 0.4309
 epoch: 76, train_loss: 0.9776, test_loss: 1.2826, test_f1: 0.4395
 epoch: 77, train_loss: 0.9806, test_loss: 1.2935, test_f1: 0.4623
 epoch: 78, train_loss: 0.9557, test_loss: 1.3008, test_f1: 0.4652
 epoch: 79, train_loss: 0.9623, test_loss: 1.2984, test_f1: 0.4686
 epoch: 80, train_loss: 0.9649, test_loss: 1.3033, test_f1: 0.4665
 epoch: 81, train_loss: 0.9608, test_loss: 1.3211, test_f1: 0.4611
 epoch: 82, train_loss: 0.9739, test_loss: 1.3466, test_f1: 0.4507
 epoch: 83, train_loss: 0.9491, test_loss: 1.3314, test_f1: 0.4726
 epoch: 84, train_loss: 0.9663, test_loss: 1.3323, test_f1: 0.4580
 epoch: 85, train_loss: 0.9682, test_loss: 1.3622, test_f1: 0.4487
 epoch: 86, train_loss: 0.9717, test_loss: 1.3765, test_f1: 0.4538
 epoch: 87, train_loss: 0.9490, test_loss: 1.3776, test_f1: 0.4602
 epoch: 88, train_loss: 0.9587, test_loss: 1.3766, test_f1: 0.4555
 epoch: 89, train_loss: 0.9554, test_loss: 1.3865, test_f1: 0.4338
 epoch: 90, train_loss: 0.9494, test_loss: 1.3762, test_f1: 0.4499
 epoch: 91, train_loss: 0.9495, test_loss: 1.3738, test_f1: 0.4607
 epoch: 92, train_loss: 0.9389, test_loss: 1.3817, test_f1: 0.4524
 epoch: 93, train_loss: 0.9365, test_loss: 1.3997, test_f1: 0.4490
 epoch: 94, train_loss: 0.9368, test_loss: 1.3860, test_f1: 0.4335
 epoch: 95, train_loss: 0.9488, test_loss: 1.3719, test_f1: 0.4479
 epoch: 96, train_loss: 0.9492, test_loss: 1.3347, test_f1: 0.4546
 epoch: 97, train_loss: 0.9422, test_loss: 1.3462, test_f1: 0.4494
 epoch: 98, train_loss: 0.9350, test_loss: 1.3577, test_f1: 0.4337
 epoch: 99, train_loss: 0.9419, test_loss: 1.3334, test_f1: 0.4439

Training completed in 295.17 seconds
Best F1: 0.5082 at epoch 98
Mean F1 across iterations: 0.4634  0.0204
========================FINAL RESULTS================================
FEGIN weighted F1: 0.5082  0.0204
python main.py --data ltspice_demos --representation component_component --model FEGIN --layers 4 --hiddens 16 --batch_size 256 --lr 0.001 --emb_size 512 --epochs 100 --save_appendix component_component_L4_H16_BS256_LR0.001_E512 --no_val
-----



STDERR:
  File "main.py", line 370, in <module>
    main()
  File "main.py", line 254, in main
    dataset = dataset_class(
  File "/home/philip/projects/ltspice_examples_code_repo/Circuit-Completion-Using-GNNs/component_classification_with_link_prediction_head/evaluation/FEGIN/kernel/circuit_datasets.py", line 15, in __init__
    self.data, self.slices = torch.load(self.processed_paths[0])
  File "/home/philip/.local/lib/python3.8/site-packages/torch/serialization.py", line 1040, in load
    warnings.warn(
  File "/usr/lib/python3.8/warnings.py", line 109, in _showwarnmsg
    sw(msg.message, msg.category, msg.filename, msg.lineno,
  File "main.py", line 47, in warn_with_traceback
    traceback.print_stack(file=log)
/home/philip/projects/ltspice_examples_code_repo/Circuit-Completion-Using-GNNs/component_classification_with_link_prediction_head/evaluation/FEGIN/kernel/circuit_datasets.py:15: FutureWarning: You are using `torch.load` with `weights_only=False` (the current default value), which uses the default pickle module implicitly. It is possible to construct malicious pickle data which will execute arbitrary code during unpickling (See https://github.com/pytorch/pytorch/blob/main/SECURITY.md#untrusted-models for more details). In a future release, the default value for `weights_only` will be flipped to `True`. This limits the functions that could be executed during unpickling. Arbitrary objects will no longer be allowed to be loaded via this mode unless they are explicitly allowlisted by the user via `torch.serialization.add_safe_globals`. We recommend you start setting `weights_only=True` for any use case where you don't have full control of the loaded file. Please open an issue on GitHub for any issues related to this experimental feature.
  self.data, self.slices = torch.load(self.processed_paths[0])
