STDOUT:
Results will be saved in /home/philip/projects/ltspice_examples_code_repo/Circuit-Completion-Using-GNNs/component_classification_with_link_prediction_head/evaluation/FEGIN/results/model_FEGIN_dataset_ltspice_examples
Command line input: python main.py --data ltspice_examples --representation component_pin --model FEGIN --layers 6 --hiddens 64 --batch_size 128 --lr 0.0001 --emb_size 250 --epochs 100 --save_appendix component_pin_L6_H64_BS128_LR0.0001_E250 --no_val
 is saved.
-----
ltspice_examples - FEGIN
Using 6 layers, 64 hidden units, h = 2
Loading component_pin representation dataset
ENTERED
Training FEGIN on component_pin representation
Train: 3560, Test: 848
##################ITERATION #0 ****************************************
 epoch: 0, train_loss: 1.3880, test_loss: 1.3842, test_f1: 0.1735
 epoch: 1, train_loss: 1.3701, test_loss: 1.3732, test_f1: 0.3414
 epoch: 2, train_loss: 1.3521, test_loss: 1.3458, test_f1: 0.2435
 epoch: 3, train_loss: 1.3260, test_loss: 1.3145, test_f1: 0.2260
 epoch: 4, train_loss: 1.2957, test_loss: 1.2802, test_f1: 0.2260
 epoch: 5, train_loss: 1.2691, test_loss: 1.2547, test_f1: 0.2260
 epoch: 6, train_loss: 1.2464, test_loss: 1.2296, test_f1: 0.2260
 epoch: 7, train_loss: 1.2288, test_loss: 1.2120, test_f1: 0.2260
 epoch: 8, train_loss: 1.2110, test_loss: 1.1898, test_f1: 0.2260
 epoch: 9, train_loss: 1.1994, test_loss: 1.1754, test_f1: 0.2406
 epoch: 10, train_loss: 1.1843, test_loss: 1.1594, test_f1: 0.3275
 epoch: 11, train_loss: 1.1693, test_loss: 1.1480, test_f1: 0.3355
 epoch: 12, train_loss: 1.1500, test_loss: 1.1333, test_f1: 0.3546
 epoch: 13, train_loss: 1.1338, test_loss: 1.1176, test_f1: 0.3707
 epoch: 14, train_loss: 1.1137, test_loss: 1.0963, test_f1: 0.4030
 epoch: 15, train_loss: 1.0911, test_loss: 1.0792, test_f1: 0.4200
 epoch: 16, train_loss: 1.0704, test_loss: 1.0623, test_f1: 0.4408
 epoch: 17, train_loss: 1.0493, test_loss: 1.0485, test_f1: 0.4690
 epoch: 18, train_loss: 1.0331, test_loss: 1.0289, test_f1: 0.4467
 epoch: 19, train_loss: 1.0166, test_loss: 1.0255, test_f1: 0.4308
 epoch: 20, train_loss: 1.0074, test_loss: 1.0207, test_f1: 0.4677
 epoch: 21, train_loss: 1.0042, test_loss: 1.0102, test_f1: 0.4279
 epoch: 22, train_loss: 0.9925, test_loss: 1.0170, test_f1: 0.4290
 epoch: 23, train_loss: 0.9855, test_loss: 1.0176, test_f1: 0.4672
 epoch: 24, train_loss: 0.9744, test_loss: 1.0175, test_f1: 0.4230
 epoch: 25, train_loss: 0.9724, test_loss: 1.0225, test_f1: 0.4913
 epoch: 26, train_loss: 0.9637, test_loss: 1.0341, test_f1: 0.4815
 epoch: 27, train_loss: 0.9658, test_loss: 1.0198, test_f1: 0.4760
 epoch: 28, train_loss: 0.9505, test_loss: 1.0298, test_f1: 0.4798
 epoch: 29, train_loss: 0.9460, test_loss: 1.0186, test_f1: 0.4927
 epoch: 30, train_loss: 0.9449, test_loss: 1.0278, test_f1: 0.4915
 epoch: 31, train_loss: 0.9429, test_loss: 1.0128, test_f1: 0.4966
 epoch: 32, train_loss: 0.9296, test_loss: 1.0157, test_f1: 0.4967
 epoch: 33, train_loss: 0.9233, test_loss: 0.9925, test_f1: 0.5059
 epoch: 34, train_loss: 0.9269, test_loss: 1.0036, test_f1: 0.5062
 epoch: 35, train_loss: 0.9207, test_loss: 1.0122, test_f1: 0.5202
 epoch: 36, train_loss: 0.9176, test_loss: 0.9999, test_f1: 0.5105
 epoch: 37, train_loss: 0.9104, test_loss: 0.9972, test_f1: 0.5043
 epoch: 38, train_loss: 0.9050, test_loss: 1.0035, test_f1: 0.5204
 epoch: 39, train_loss: 0.9069, test_loss: 0.9912, test_f1: 0.5203
 epoch: 40, train_loss: 0.9029, test_loss: 0.9947, test_f1: 0.5076
 epoch: 41, train_loss: 0.8934, test_loss: 1.0052, test_f1: 0.4962
 epoch: 42, train_loss: 0.9002, test_loss: 0.9888, test_f1: 0.5147
 epoch: 43, train_loss: 0.8827, test_loss: 0.9787, test_f1: 0.4857
 epoch: 44, train_loss: 0.8881, test_loss: 0.9479, test_f1: 0.4945
 epoch: 45, train_loss: 0.8711, test_loss: 0.9997, test_f1: 0.5053
 epoch: 46, train_loss: 0.8780, test_loss: 0.9582, test_f1: 0.5113
 epoch: 47, train_loss: 0.8634, test_loss: 0.9563, test_f1: 0.5030
 epoch: 48, train_loss: 0.8569, test_loss: 0.9853, test_f1: 0.4973
 epoch: 49, train_loss: 0.8656, test_loss: 0.9754, test_f1: 0.5175
 epoch: 50, train_loss: 0.8542, test_loss: 0.9485, test_f1: 0.5124
 epoch: 51, train_loss: 0.8425, test_loss: 0.9498, test_f1: 0.5170
 epoch: 52, train_loss: 0.8429, test_loss: 0.9546, test_f1: 0.5181
 epoch: 53, train_loss: 0.8407, test_loss: 0.9396, test_f1: 0.5162
 epoch: 54, train_loss: 0.8294, test_loss: 0.9489, test_f1: 0.5179
 epoch: 55, train_loss: 0.8316, test_loss: 0.9411, test_f1: 0.5159
 epoch: 56, train_loss: 0.8273, test_loss: 0.9271, test_f1: 0.5338
 epoch: 57, train_loss: 0.8348, test_loss: 0.9652, test_f1: 0.5079
 epoch: 58, train_loss: 0.8288, test_loss: 0.9488, test_f1: 0.5125
 epoch: 59, train_loss: 0.8092, test_loss: 0.9525, test_f1: 0.5172
 epoch: 60, train_loss: 0.8113, test_loss: 0.9317, test_f1: 0.5386
 epoch: 61, train_loss: 0.8104, test_loss: 0.9403, test_f1: 0.5197
 epoch: 62, train_loss: 0.8105, test_loss: 0.9367, test_f1: 0.5438
 epoch: 63, train_loss: 0.8132, test_loss: 0.9275, test_f1: 0.5463
 epoch: 64, train_loss: 0.8148, test_loss: 0.9452, test_f1: 0.5249
 epoch: 65, train_loss: 0.8041, test_loss: 0.9296, test_f1: 0.5362
 epoch: 66, train_loss: 0.7990, test_loss: 0.9286, test_f1: 0.5364
 epoch: 67, train_loss: 0.7964, test_loss: 0.9068, test_f1: 0.5360
 epoch: 68, train_loss: 0.8014, test_loss: 0.9214, test_f1: 0.5373
 epoch: 69, train_loss: 0.8023, test_loss: 0.9251, test_f1: 0.5238
 epoch: 70, train_loss: 0.7879, test_loss: 0.9131, test_f1: 0.5482
 epoch: 71, train_loss: 0.7979, test_loss: 0.9266, test_f1: 0.5347
 epoch: 72, train_loss: 0.7874, test_loss: 0.9214, test_f1: 0.5346
 epoch: 73, train_loss: 0.7914, test_loss: 0.9011, test_f1: 0.5411
 epoch: 74, train_loss: 0.7789, test_loss: 0.9417, test_f1: 0.5290
 epoch: 75, train_loss: 0.7709, test_loss: 0.9051, test_f1: 0.5496
 epoch: 76, train_loss: 0.7699, test_loss: 0.9168, test_f1: 0.5377
 epoch: 77, train_loss: 0.7684, test_loss: 0.9196, test_f1: 0.5407
 epoch: 78, train_loss: 0.7641, test_loss: 0.8895, test_f1: 0.5558
 epoch: 79, train_loss: 0.7726, test_loss: 0.9031, test_f1: 0.5437
 epoch: 80, train_loss: 0.7758, test_loss: 0.8991, test_f1: 0.5376
 epoch: 81, train_loss: 0.7676, test_loss: 0.9016, test_f1: 0.5463
 epoch: 82, train_loss: 0.7642, test_loss: 0.9188, test_f1: 0.5330
 epoch: 83, train_loss: 0.7650, test_loss: 0.9075, test_f1: 0.5479
 epoch: 84, train_loss: 0.7608, test_loss: 0.8903, test_f1: 0.5451
 epoch: 85, train_loss: 0.7576, test_loss: 0.8871, test_f1: 0.5532
 epoch: 86, train_loss: 0.7544, test_loss: 0.9024, test_f1: 0.5536
 epoch: 87, train_loss: 0.7388, test_loss: 0.9139, test_f1: 0.5467
 epoch: 88, train_loss: 0.7442, test_loss: 0.8856, test_f1: 0.5511
 epoch: 89, train_loss: 0.7354, test_loss: 0.8882, test_f1: 0.5444
 epoch: 90, train_loss: 0.7351, test_loss: 0.9057, test_f1: 0.5398
 epoch: 91, train_loss: 0.7382, test_loss: 0.8982, test_f1: 0.5431
 epoch: 92, train_loss: 0.7273, test_loss: 0.9181, test_f1: 0.5290
 epoch: 93, train_loss: 0.7308, test_loss: 0.8932, test_f1: 0.5453
 epoch: 94, train_loss: 0.7318, test_loss: 0.8812, test_f1: 0.5618
 epoch: 95, train_loss: 0.7330, test_loss: 0.8937, test_f1: 0.5408
 epoch: 96, train_loss: 0.7279, test_loss: 0.8744, test_f1: 0.5523
 epoch: 97, train_loss: 0.7280, test_loss: 0.8909, test_f1: 0.5499
 epoch: 98, train_loss: 0.7209, test_loss: 0.8977, test_f1: 0.5531
 epoch: 99, train_loss: 0.7217, test_loss: 0.9073, test_f1: 0.5460
##################ITERATION #1 ****************************************
 epoch: 0, train_loss: 1.3536, test_loss: 1.3576, test_f1: 0.2512
 epoch: 1, train_loss: 1.3108, test_loss: 1.3431, test_f1: 0.2260
 epoch: 2, train_loss: 1.2776, test_loss: 1.2687, test_f1: 0.2335
 epoch: 3, train_loss: 1.2437, test_loss: 1.2179, test_f1: 0.3289
 epoch: 4, train_loss: 1.2077, test_loss: 1.1806, test_f1: 0.3381
 epoch: 5, train_loss: 1.1760, test_loss: 1.1446, test_f1: 0.3410
 epoch: 6, train_loss: 1.1448, test_loss: 1.1169, test_f1: 0.3397
 epoch: 7, train_loss: 1.1118, test_loss: 1.0903, test_f1: 0.3390
 epoch: 8, train_loss: 1.0888, test_loss: 1.0745, test_f1: 0.3548
 epoch: 9, train_loss: 1.0607, test_loss: 1.0542, test_f1: 0.3694
 epoch: 10, train_loss: 1.0422, test_loss: 1.0511, test_f1: 0.4355
 epoch: 11, train_loss: 1.0299, test_loss: 1.0393, test_f1: 0.4111
 epoch: 12, train_loss: 1.0247, test_loss: 1.0306, test_f1: 0.4530
 epoch: 13, train_loss: 1.0043, test_loss: 1.0349, test_f1: 0.4342
 epoch: 14, train_loss: 0.9969, test_loss: 1.0214, test_f1: 0.4695
 epoch: 15, train_loss: 0.9873, test_loss: 1.0146, test_f1: 0.4791
 epoch: 16, train_loss: 0.9767, test_loss: 1.0034, test_f1: 0.4753
 epoch: 17, train_loss: 0.9669, test_loss: 1.0022, test_f1: 0.4932
 epoch: 18, train_loss: 0.9730, test_loss: 1.0005, test_f1: 0.5099
 epoch: 19, train_loss: 0.9464, test_loss: 0.9984, test_f1: 0.4942
 epoch: 20, train_loss: 0.9483, test_loss: 0.9843, test_f1: 0.5000
 epoch: 21, train_loss: 0.9340, test_loss: 0.9784, test_f1: 0.5066
 epoch: 22, train_loss: 0.9291, test_loss: 0.9836, test_f1: 0.5082
 epoch: 23, train_loss: 0.9198, test_loss: 1.0005, test_f1: 0.4928
 epoch: 24, train_loss: 0.9119, test_loss: 0.9742, test_f1: 0.5144
 epoch: 25, train_loss: 0.9043, test_loss: 0.9706, test_f1: 0.5171
 epoch: 26, train_loss: 0.8952, test_loss: 0.9744, test_f1: 0.5038
 epoch: 27, train_loss: 0.8897, test_loss: 0.9713, test_f1: 0.5049
 epoch: 28, train_loss: 0.8844, test_loss: 0.9753, test_f1: 0.5137
 epoch: 29, train_loss: 0.8710, test_loss: 0.9874, test_f1: 0.4980
 epoch: 30, train_loss: 0.8759, test_loss: 0.9844, test_f1: 0.5027
 epoch: 31, train_loss: 0.8786, test_loss: 0.9756, test_f1: 0.4980
 epoch: 32, train_loss: 0.8711, test_loss: 0.9829, test_f1: 0.4972
 epoch: 33, train_loss: 0.8501, test_loss: 0.9867, test_f1: 0.5176
 epoch: 34, train_loss: 0.8422, test_loss: 0.9601, test_f1: 0.5005
 epoch: 35, train_loss: 0.8421, test_loss: 0.9777, test_f1: 0.4742
 epoch: 36, train_loss: 0.8452, test_loss: 0.9771, test_f1: 0.4913
 epoch: 37, train_loss: 0.8258, test_loss: 0.9602, test_f1: 0.5018
 epoch: 38, train_loss: 0.8220, test_loss: 0.9745, test_f1: 0.4894
 epoch: 39, train_loss: 0.8251, test_loss: 0.9697, test_f1: 0.4948
 epoch: 40, train_loss: 0.8149, test_loss: 0.9586, test_f1: 0.5009
 epoch: 41, train_loss: 0.7964, test_loss: 0.9691, test_f1: 0.5010
 epoch: 42, train_loss: 0.7975, test_loss: 0.9881, test_f1: 0.4801
 epoch: 43, train_loss: 0.7931, test_loss: 0.9599, test_f1: 0.4983
 epoch: 44, train_loss: 0.7928, test_loss: 0.9480, test_f1: 0.5201
 epoch: 45, train_loss: 0.7925, test_loss: 0.9670, test_f1: 0.5171
 epoch: 46, train_loss: 0.7832, test_loss: 0.9584, test_f1: 0.5074
 epoch: 47, train_loss: 0.7737, test_loss: 0.9555, test_f1: 0.4968
 epoch: 48, train_loss: 0.7728, test_loss: 0.9545, test_f1: 0.4995
 epoch: 49, train_loss: 0.7648, test_loss: 0.9490, test_f1: 0.5065
 epoch: 50, train_loss: 0.7527, test_loss: 0.9595, test_f1: 0.5045
 epoch: 51, train_loss: 0.7471, test_loss: 0.9502, test_f1: 0.5025
 epoch: 52, train_loss: 0.7494, test_loss: 0.9282, test_f1: 0.5186
 epoch: 53, train_loss: 0.7439, test_loss: 0.9500, test_f1: 0.5114
 epoch: 54, train_loss: 0.7434, test_loss: 0.9399, test_f1: 0.5077
 epoch: 55, train_loss: 0.7310, test_loss: 0.9366, test_f1: 0.5238
 epoch: 56, train_loss: 0.7353, test_loss: 0.9593, test_f1: 0.5018
 epoch: 57, train_loss: 0.7292, test_loss: 0.9604, test_f1: 0.5093
 epoch: 58, train_loss: 0.7280, test_loss: 0.9537, test_f1: 0.5211
 epoch: 59, train_loss: 0.7269, test_loss: 0.9718, test_f1: 0.5071
 epoch: 60, train_loss: 0.7225, test_loss: 0.9613, test_f1: 0.5158
 epoch: 61, train_loss: 0.7182, test_loss: 0.9597, test_f1: 0.5072
 epoch: 62, train_loss: 0.7224, test_loss: 0.9672, test_f1: 0.5053
 epoch: 63, train_loss: 0.7253, test_loss: 0.9415, test_f1: 0.5285
 epoch: 64, train_loss: 0.7169, test_loss: 0.9733, test_f1: 0.5170
 epoch: 65, train_loss: 0.7128, test_loss: 0.9622, test_f1: 0.5142
 epoch: 66, train_loss: 0.7088, test_loss: 0.9583, test_f1: 0.5244
 epoch: 67, train_loss: 0.7056, test_loss: 0.9590, test_f1: 0.5221
 epoch: 68, train_loss: 0.7076, test_loss: 0.9506, test_f1: 0.5134
 epoch: 69, train_loss: 0.7109, test_loss: 0.9596, test_f1: 0.5233
 epoch: 70, train_loss: 0.7087, test_loss: 0.9577, test_f1: 0.5291
 epoch: 71, train_loss: 0.6929, test_loss: 0.9712, test_f1: 0.5248
 epoch: 72, train_loss: 0.6975, test_loss: 0.9746, test_f1: 0.5207
 epoch: 73, train_loss: 0.6986, test_loss: 0.9602, test_f1: 0.5240
 epoch: 74, train_loss: 0.6909, test_loss: 0.9800, test_f1: 0.5233
 epoch: 75, train_loss: 0.6976, test_loss: 0.9520, test_f1: 0.5313
 epoch: 76, train_loss: 0.7010, test_loss: 0.9741, test_f1: 0.5294
 epoch: 77, train_loss: 0.6920, test_loss: 0.9854, test_f1: 0.5298
 epoch: 78, train_loss: 0.6799, test_loss: 0.9933, test_f1: 0.5150
 epoch: 79, train_loss: 0.6771, test_loss: 0.9889, test_f1: 0.5161
 epoch: 80, train_loss: 0.6931, test_loss: 0.9817, test_f1: 0.5245
 epoch: 81, train_loss: 0.6870, test_loss: 1.0079, test_f1: 0.5135
 epoch: 82, train_loss: 0.6807, test_loss: 0.9678, test_f1: 0.5194
 epoch: 83, train_loss: 0.6793, test_loss: 0.9570, test_f1: 0.5328
 epoch: 84, train_loss: 0.6764, test_loss: 0.9774, test_f1: 0.5261
 epoch: 85, train_loss: 0.6813, test_loss: 0.9863, test_f1: 0.5175
 epoch: 86, train_loss: 0.6675, test_loss: 1.0070, test_f1: 0.5180
 epoch: 87, train_loss: 0.6747, test_loss: 0.9791, test_f1: 0.5233
 epoch: 88, train_loss: 0.6642, test_loss: 1.0007, test_f1: 0.5184
 epoch: 89, train_loss: 0.6648, test_loss: 0.9830, test_f1: 0.5266
 epoch: 90, train_loss: 0.6646, test_loss: 0.9840, test_f1: 0.5267
 epoch: 91, train_loss: 0.6586, test_loss: 0.9857, test_f1: 0.5241
 epoch: 92, train_loss: 0.6678, test_loss: 0.9823, test_f1: 0.5235
 epoch: 93, train_loss: 0.6668, test_loss: 0.9997, test_f1: 0.5277
 epoch: 94, train_loss: 0.6707, test_loss: 1.0021, test_f1: 0.5253
 epoch: 95, train_loss: 0.6582, test_loss: 1.0015, test_f1: 0.5233
 epoch: 96, train_loss: 0.6726, test_loss: 0.9708, test_f1: 0.5203
 epoch: 97, train_loss: 0.6591, test_loss: 0.9707, test_f1: 0.5278
 epoch: 98, train_loss: 0.6614, test_loss: 0.9880, test_f1: 0.5373
 epoch: 99, train_loss: 0.6525, test_loss: 1.0084, test_f1: 0.5311
##################ITERATION #2 ****************************************
 epoch: 0, train_loss: 1.3289, test_loss: 1.3434, test_f1: 0.2260
 epoch: 1, train_loss: 1.2862, test_loss: 1.2957, test_f1: 0.2660
 epoch: 2, train_loss: 1.2544, test_loss: 1.2307, test_f1: 0.3875
 epoch: 3, train_loss: 1.2195, test_loss: 1.1845, test_f1: 0.4113
 epoch: 4, train_loss: 1.1871, test_loss: 1.1455, test_f1: 0.4177
 epoch: 5, train_loss: 1.1496, test_loss: 1.1075, test_f1: 0.4277
 epoch: 6, train_loss: 1.1157, test_loss: 1.0807, test_f1: 0.4269
 epoch: 7, train_loss: 1.0853, test_loss: 1.0626, test_f1: 0.4251
 epoch: 8, train_loss: 1.0550, test_loss: 1.0359, test_f1: 0.4459
 epoch: 9, train_loss: 1.0398, test_loss: 1.0225, test_f1: 0.4463
 epoch: 10, train_loss: 1.0187, test_loss: 1.0097, test_f1: 0.4608
 epoch: 11, train_loss: 1.0134, test_loss: 1.0059, test_f1: 0.4473
 epoch: 12, train_loss: 0.9945, test_loss: 0.9967, test_f1: 0.4709
 epoch: 13, train_loss: 0.9814, test_loss: 1.0027, test_f1: 0.4761
 epoch: 14, train_loss: 0.9706, test_loss: 0.9870, test_f1: 0.4822
 epoch: 15, train_loss: 0.9625, test_loss: 0.9799, test_f1: 0.4830
 epoch: 16, train_loss: 0.9457, test_loss: 0.9914, test_f1: 0.4859
 epoch: 17, train_loss: 0.9389, test_loss: 0.9569, test_f1: 0.4956
 epoch: 18, train_loss: 0.9343, test_loss: 0.9752, test_f1: 0.4796
 epoch: 19, train_loss: 0.9300, test_loss: 0.9402, test_f1: 0.4924
 epoch: 20, train_loss: 0.9167, test_loss: 0.9672, test_f1: 0.4755
 epoch: 21, train_loss: 0.9091, test_loss: 0.9502, test_f1: 0.4880
 epoch: 22, train_loss: 0.8984, test_loss: 0.9608, test_f1: 0.4830
 epoch: 23, train_loss: 0.9010, test_loss: 0.9583, test_f1: 0.4872
 epoch: 24, train_loss: 0.8970, test_loss: 0.9821, test_f1: 0.4824
 epoch: 25, train_loss: 0.8843, test_loss: 0.9670, test_f1: 0.5045
 epoch: 26, train_loss: 0.8804, test_loss: 0.9606, test_f1: 0.4959
 epoch: 27, train_loss: 0.8704, test_loss: 0.9370, test_f1: 0.5016
 epoch: 28, train_loss: 0.8749, test_loss: 0.9612, test_f1: 0.4867
 epoch: 29, train_loss: 0.8590, test_loss: 0.9652, test_f1: 0.5001
 epoch: 30, train_loss: 0.8637, test_loss: 0.9530, test_f1: 0.4955
 epoch: 31, train_loss: 0.8583, test_loss: 0.9641, test_f1: 0.4967
 epoch: 32, train_loss: 0.8448, test_loss: 0.9557, test_f1: 0.4970
 epoch: 33, train_loss: 0.8446, test_loss: 0.9414, test_f1: 0.5014
 epoch: 34, train_loss: 0.8415, test_loss: 0.9443, test_f1: 0.4933
 epoch: 35, train_loss: 0.8417, test_loss: 0.9601, test_f1: 0.5000
 epoch: 36, train_loss: 0.8279, test_loss: 0.9533, test_f1: 0.4905
 epoch: 37, train_loss: 0.8163, test_loss: 0.9521, test_f1: 0.4985
 epoch: 38, train_loss: 0.8141, test_loss: 0.9831, test_f1: 0.4841
 epoch: 39, train_loss: 0.8064, test_loss: 0.9643, test_f1: 0.4966
 epoch: 40, train_loss: 0.8123, test_loss: 0.9668, test_f1: 0.4960
 epoch: 41, train_loss: 0.8103, test_loss: 0.9742, test_f1: 0.5007
 epoch: 42, train_loss: 0.8106, test_loss: 0.9663, test_f1: 0.4942
 epoch: 43, train_loss: 0.7952, test_loss: 0.9888, test_f1: 0.5125
 epoch: 44, train_loss: 0.7897, test_loss: 1.0144, test_f1: 0.4966
 epoch: 45, train_loss: 0.7839, test_loss: 1.0258, test_f1: 0.4865
 epoch: 46, train_loss: 0.7817, test_loss: 0.9729, test_f1: 0.5015
 epoch: 47, train_loss: 0.7817, test_loss: 0.9824, test_f1: 0.5177
 epoch: 48, train_loss: 0.7826, test_loss: 0.9699, test_f1: 0.5027
 epoch: 49, train_loss: 0.7702, test_loss: 0.9631, test_f1: 0.5052
 epoch: 50, train_loss: 0.7751, test_loss: 0.9905, test_f1: 0.5245
 epoch: 51, train_loss: 0.7571, test_loss: 1.0050, test_f1: 0.4957
 epoch: 52, train_loss: 0.7584, test_loss: 0.9975, test_f1: 0.5016
 epoch: 53, train_loss: 0.7617, test_loss: 1.0079, test_f1: 0.5014
 epoch: 54, train_loss: 0.7570, test_loss: 1.0157, test_f1: 0.5011
 epoch: 55, train_loss: 0.7485, test_loss: 1.0114, test_f1: 0.4933
 epoch: 56, train_loss: 0.7408, test_loss: 1.0148, test_f1: 0.5074
 epoch: 57, train_loss: 0.7528, test_loss: 1.0188, test_f1: 0.4878
 epoch: 58, train_loss: 0.7407, test_loss: 1.0110, test_f1: 0.4994
 epoch: 59, train_loss: 0.7452, test_loss: 1.0298, test_f1: 0.5054
 epoch: 60, train_loss: 0.7422, test_loss: 1.0088, test_f1: 0.5179
 epoch: 61, train_loss: 0.7368, test_loss: 1.0343, test_f1: 0.5115
 epoch: 62, train_loss: 0.7370, test_loss: 1.0348, test_f1: 0.5190
 epoch: 63, train_loss: 0.7378, test_loss: 1.0247, test_f1: 0.5143
 epoch: 64, train_loss: 0.7370, test_loss: 1.0350, test_f1: 0.5171
 epoch: 65, train_loss: 0.7293, test_loss: 1.0340, test_f1: 0.5152
 epoch: 66, train_loss: 0.7302, test_loss: 1.0551, test_f1: 0.4867
 epoch: 67, train_loss: 0.7296, test_loss: 1.0307, test_f1: 0.5118
 epoch: 68, train_loss: 0.7115, test_loss: 1.0402, test_f1: 0.5086
 epoch: 69, train_loss: 0.7221, test_loss: 1.0707, test_f1: 0.4942
 epoch: 70, train_loss: 0.7190, test_loss: 1.0698, test_f1: 0.5043
 epoch: 71, train_loss: 0.7174, test_loss: 1.0367, test_f1: 0.5016
 epoch: 72, train_loss: 0.7207, test_loss: 1.0489, test_f1: 0.5085
 epoch: 73, train_loss: 0.7167, test_loss: 1.0445, test_f1: 0.5103
 epoch: 74, train_loss: 0.7286, test_loss: 1.0533, test_f1: 0.4916
 epoch: 75, train_loss: 0.7134, test_loss: 1.0672, test_f1: 0.4962
 epoch: 76, train_loss: 0.7134, test_loss: 1.0547, test_f1: 0.5135
 epoch: 77, train_loss: 0.7076, test_loss: 1.0611, test_f1: 0.5083
 epoch: 78, train_loss: 0.7121, test_loss: 1.0428, test_f1: 0.5224
 epoch: 79, train_loss: 0.7018, test_loss: 1.0659, test_f1: 0.5175
 epoch: 80, train_loss: 0.7009, test_loss: 1.0765, test_f1: 0.5142
 epoch: 81, train_loss: 0.7023, test_loss: 1.0525, test_f1: 0.5130
 epoch: 82, train_loss: 0.6993, test_loss: 1.0551, test_f1: 0.5078
 epoch: 83, train_loss: 0.7098, test_loss: 1.0771, test_f1: 0.5053
 epoch: 84, train_loss: 0.6971, test_loss: 1.0667, test_f1: 0.5053
 epoch: 85, train_loss: 0.7011, test_loss: 1.0694, test_f1: 0.5055
 epoch: 86, train_loss: 0.6990, test_loss: 1.0596, test_f1: 0.5000
 epoch: 87, train_loss: 0.7008, test_loss: 1.0762, test_f1: 0.5208
 epoch: 88, train_loss: 0.6922, test_loss: 1.0492, test_f1: 0.5134
 epoch: 89, train_loss: 0.6957, test_loss: 1.0912, test_f1: 0.5147
 epoch: 90, train_loss: 0.6939, test_loss: 1.0924, test_f1: 0.4894
 epoch: 91, train_loss: 0.6863, test_loss: 1.0773, test_f1: 0.5073
 epoch: 92, train_loss: 0.7000, test_loss: 1.0687, test_f1: 0.5111
 epoch: 93, train_loss: 0.6799, test_loss: 1.0794, test_f1: 0.5168
 epoch: 94, train_loss: 0.6909, test_loss: 1.0776, test_f1: 0.5176
 epoch: 95, train_loss: 0.6801, test_loss: 1.0697, test_f1: 0.5110
 epoch: 96, train_loss: 0.6843, test_loss: 1.0606, test_f1: 0.5156
 epoch: 97, train_loss: 0.6868, test_loss: 1.0760, test_f1: 0.5068
 epoch: 98, train_loss: 0.6810, test_loss: 1.0835, test_f1: 0.4999
 epoch: 99, train_loss: 0.6785, test_loss: 1.0952, test_f1: 0.5207
##################ITERATION #3 ****************************************
 epoch: 0, train_loss: 1.2975, test_loss: 1.3081, test_f1: 0.2260
 epoch: 1, train_loss: 1.2499, test_loss: 1.2800, test_f1: 0.2260
 epoch: 2, train_loss: 1.2165, test_loss: 1.2132, test_f1: 0.2711
 epoch: 3, train_loss: 1.1830, test_loss: 1.1399, test_f1: 0.4187
 epoch: 4, train_loss: 1.1520, test_loss: 1.1027, test_f1: 0.4321
 epoch: 5, train_loss: 1.1205, test_loss: 1.0766, test_f1: 0.4420
 epoch: 6, train_loss: 1.0902, test_loss: 1.0474, test_f1: 0.4680
 epoch: 7, train_loss: 1.0651, test_loss: 1.0285, test_f1: 0.4772
 epoch: 8, train_loss: 1.0475, test_loss: 1.0126, test_f1: 0.4880
 epoch: 9, train_loss: 1.0316, test_loss: 1.0029, test_f1: 0.4874
 epoch: 10, train_loss: 1.0137, test_loss: 0.9920, test_f1: 0.4817
 epoch: 11, train_loss: 0.9915, test_loss: 0.9883, test_f1: 0.4740
 epoch: 12, train_loss: 0.9853, test_loss: 0.9780, test_f1: 0.4846
 epoch: 13, train_loss: 0.9700, test_loss: 0.9754, test_f1: 0.4663
 epoch: 14, train_loss: 0.9617, test_loss: 0.9757, test_f1: 0.4791
 epoch: 15, train_loss: 0.9427, test_loss: 0.9684, test_f1: 0.4874
 epoch: 16, train_loss: 0.9362, test_loss: 0.9422, test_f1: 0.4903
 epoch: 17, train_loss: 0.9345, test_loss: 0.9421, test_f1: 0.4882
 epoch: 18, train_loss: 0.9262, test_loss: 0.9362, test_f1: 0.4976
 epoch: 19, train_loss: 0.9099, test_loss: 0.9305, test_f1: 0.4846
 epoch: 20, train_loss: 0.9053, test_loss: 0.9339, test_f1: 0.4879
 epoch: 21, train_loss: 0.8993, test_loss: 0.9270, test_f1: 0.4953
 epoch: 22, train_loss: 0.8938, test_loss: 0.9098, test_f1: 0.4963
 epoch: 23, train_loss: 0.8826, test_loss: 0.9079, test_f1: 0.5113
 epoch: 24, train_loss: 0.8682, test_loss: 0.9591, test_f1: 0.4791
 epoch: 25, train_loss: 0.8749, test_loss: 0.9231, test_f1: 0.4993
 epoch: 26, train_loss: 0.8703, test_loss: 0.9468, test_f1: 0.5027
 epoch: 27, train_loss: 0.8581, test_loss: 0.9085, test_f1: 0.5215
 epoch: 28, train_loss: 0.8393, test_loss: 0.9331, test_f1: 0.5117
 epoch: 29, train_loss: 0.8381, test_loss: 0.8987, test_f1: 0.5217
 epoch: 30, train_loss: 0.8330, test_loss: 0.9222, test_f1: 0.5269
 epoch: 31, train_loss: 0.8259, test_loss: 0.9047, test_f1: 0.5249
 epoch: 32, train_loss: 0.8122, test_loss: 0.9203, test_f1: 0.5314
 epoch: 33, train_loss: 0.8163, test_loss: 0.9006, test_f1: 0.5455
 epoch: 34, train_loss: 0.7986, test_loss: 0.9476, test_f1: 0.5280
 epoch: 35, train_loss: 0.7888, test_loss: 0.9311, test_f1: 0.5289
 epoch: 36, train_loss: 0.7892, test_loss: 0.9716, test_f1: 0.5265
 epoch: 37, train_loss: 0.7936, test_loss: 0.9062, test_f1: 0.5484
 epoch: 38, train_loss: 0.7897, test_loss: 0.9212, test_f1: 0.5415
 epoch: 39, train_loss: 0.7863, test_loss: 0.9155, test_f1: 0.5386
 epoch: 40, train_loss: 0.7732, test_loss: 0.9315, test_f1: 0.5280
 epoch: 41, train_loss: 0.7546, test_loss: 0.9195, test_f1: 0.5464
 epoch: 42, train_loss: 0.7594, test_loss: 0.9320, test_f1: 0.5372
 epoch: 43, train_loss: 0.7686, test_loss: 0.9554, test_f1: 0.5567
 epoch: 44, train_loss: 0.7501, test_loss: 0.9065, test_f1: 0.5637
 epoch: 45, train_loss: 0.7426, test_loss: 0.9496, test_f1: 0.5330
 epoch: 46, train_loss: 0.7311, test_loss: 0.9650, test_f1: 0.5455
 epoch: 47, train_loss: 0.7389, test_loss: 0.9822, test_f1: 0.5240
 epoch: 48, train_loss: 0.7244, test_loss: 0.9391, test_f1: 0.5489
 epoch: 49, train_loss: 0.7075, test_loss: 0.9477, test_f1: 0.5378
 epoch: 50, train_loss: 0.7159, test_loss: 0.9669, test_f1: 0.5526
 epoch: 51, train_loss: 0.6970, test_loss: 0.9582, test_f1: 0.5216
 epoch: 52, train_loss: 0.7019, test_loss: 0.9559, test_f1: 0.5523
 epoch: 53, train_loss: 0.7040, test_loss: 0.9574, test_f1: 0.5332
 epoch: 54, train_loss: 0.6895, test_loss: 0.9441, test_f1: 0.5627
 epoch: 55, train_loss: 0.7006, test_loss: 0.9648, test_f1: 0.5457
 epoch: 56, train_loss: 0.6888, test_loss: 0.9382, test_f1: 0.5565
 epoch: 57, train_loss: 0.6900, test_loss: 0.9680, test_f1: 0.5384
 epoch: 58, train_loss: 0.6889, test_loss: 0.9813, test_f1: 0.5440
 epoch: 59, train_loss: 0.6824, test_loss: 0.9518, test_f1: 0.5419
 epoch: 60, train_loss: 0.6869, test_loss: 0.9690, test_f1: 0.5469
 epoch: 61, train_loss: 0.6864, test_loss: 0.9718, test_f1: 0.5323
 epoch: 62, train_loss: 0.6823, test_loss: 0.9703, test_f1: 0.5534
 epoch: 63, train_loss: 0.6716, test_loss: 0.9868, test_f1: 0.5372
 epoch: 64, train_loss: 0.6701, test_loss: 0.9826, test_f1: 0.5277
 epoch: 65, train_loss: 0.6682, test_loss: 0.9813, test_f1: 0.5394
 epoch: 66, train_loss: 0.6631, test_loss: 0.9618, test_f1: 0.5491
 epoch: 67, train_loss: 0.6806, test_loss: 0.9765, test_f1: 0.5448
 epoch: 68, train_loss: 0.6541, test_loss: 0.9915, test_f1: 0.5290
 epoch: 69, train_loss: 0.6506, test_loss: 0.9906, test_f1: 0.5456
 epoch: 70, train_loss: 0.6688, test_loss: 0.9977, test_f1: 0.5357
 epoch: 71, train_loss: 0.6512, test_loss: 0.9942, test_f1: 0.5389
 epoch: 72, train_loss: 0.6643, test_loss: 0.9787, test_f1: 0.5463
 epoch: 73, train_loss: 0.6513, test_loss: 0.9829, test_f1: 0.5482
 epoch: 74, train_loss: 0.6573, test_loss: 0.9897, test_f1: 0.5487
 epoch: 75, train_loss: 0.6454, test_loss: 1.0085, test_f1: 0.5416
 epoch: 76, train_loss: 0.6483, test_loss: 0.9963, test_f1: 0.5483
 epoch: 77, train_loss: 0.6450, test_loss: 0.9811, test_f1: 0.5372
 epoch: 78, train_loss: 0.6535, test_loss: 0.9897, test_f1: 0.5445
 epoch: 79, train_loss: 0.6370, test_loss: 1.0068, test_f1: 0.5468
 epoch: 80, train_loss: 0.6540, test_loss: 1.0055, test_f1: 0.5366
 epoch: 81, train_loss: 0.6335, test_loss: 0.9842, test_f1: 0.5377
 epoch: 82, train_loss: 0.6381, test_loss: 1.0062, test_f1: 0.5494
 epoch: 83, train_loss: 0.6396, test_loss: 1.0148, test_f1: 0.5462
 epoch: 84, train_loss: 0.6379, test_loss: 1.0070, test_f1: 0.5471
 epoch: 85, train_loss: 0.6467, test_loss: 1.0397, test_f1: 0.5437
 epoch: 86, train_loss: 0.6359, test_loss: 1.0224, test_f1: 0.5651
 epoch: 87, train_loss: 0.6326, test_loss: 1.0421, test_f1: 0.5521
 epoch: 88, train_loss: 0.6211, test_loss: 1.0082, test_f1: 0.5460
 epoch: 89, train_loss: 0.6245, test_loss: 1.0258, test_f1: 0.5464
 epoch: 90, train_loss: 0.6243, test_loss: 1.0132, test_f1: 0.5487
 epoch: 91, train_loss: 0.6272, test_loss: 1.0155, test_f1: 0.5512
 epoch: 92, train_loss: 0.6437, test_loss: 1.0158, test_f1: 0.5458
 epoch: 93, train_loss: 0.6439, test_loss: 1.0045, test_f1: 0.5537
 epoch: 94, train_loss: 0.6195, test_loss: 1.0402, test_f1: 0.5469
 epoch: 95, train_loss: 0.6195, test_loss: 1.0148, test_f1: 0.5494
 epoch: 96, train_loss: 0.6146, test_loss: 1.0242, test_f1: 0.5497
 epoch: 97, train_loss: 0.6234, test_loss: 1.0462, test_f1: 0.5348
 epoch: 98, train_loss: 0.6234, test_loss: 1.0106, test_f1: 0.5510
 epoch: 99, train_loss: 0.6236, test_loss: 1.0105, test_f1: 0.5517
##################ITERATION #4 ****************************************
 epoch: 0, train_loss: 1.2832, test_loss: 1.2870, test_f1: 0.2260
 epoch: 1, train_loss: 1.2257, test_loss: 1.2595, test_f1: 0.2260
 epoch: 2, train_loss: 1.1820, test_loss: 1.1534, test_f1: 0.3476
 epoch: 3, train_loss: 1.1429, test_loss: 1.0948, test_f1: 0.4344
 epoch: 4, train_loss: 1.1048, test_loss: 1.0623, test_f1: 0.4638
 epoch: 5, train_loss: 1.0666, test_loss: 1.0338, test_f1: 0.4534
 epoch: 6, train_loss: 1.0357, test_loss: 1.0190, test_f1: 0.4629
 epoch: 7, train_loss: 1.0144, test_loss: 1.0102, test_f1: 0.4622
 epoch: 8, train_loss: 0.9957, test_loss: 0.9931, test_f1: 0.4678
 epoch: 9, train_loss: 0.9775, test_loss: 0.9786, test_f1: 0.4682
 epoch: 10, train_loss: 0.9668, test_loss: 0.9835, test_f1: 0.4632
 epoch: 11, train_loss: 0.9511, test_loss: 0.9913, test_f1: 0.4776
 epoch: 12, train_loss: 0.9405, test_loss: 0.9639, test_f1: 0.4981
 epoch: 13, train_loss: 0.9441, test_loss: 0.9657, test_f1: 0.5083
 epoch: 14, train_loss: 0.9272, test_loss: 0.9594, test_f1: 0.4997
 epoch: 15, train_loss: 0.9213, test_loss: 0.9597, test_f1: 0.5081
 epoch: 16, train_loss: 0.9127, test_loss: 0.9445, test_f1: 0.4932
 epoch: 17, train_loss: 0.8982, test_loss: 0.9457, test_f1: 0.5038
 epoch: 18, train_loss: 0.9018, test_loss: 0.9462, test_f1: 0.5231
 epoch: 19, train_loss: 0.8874, test_loss: 0.9427, test_f1: 0.5169
 epoch: 20, train_loss: 0.8857, test_loss: 0.9132, test_f1: 0.5213
 epoch: 21, train_loss: 0.8785, test_loss: 0.9335, test_f1: 0.5130
 epoch: 22, train_loss: 0.8673, test_loss: 0.9032, test_f1: 0.5250
 epoch: 23, train_loss: 0.8521, test_loss: 0.9187, test_f1: 0.5207
 epoch: 24, train_loss: 0.8638, test_loss: 0.9320, test_f1: 0.5316
 epoch: 25, train_loss: 0.8533, test_loss: 0.9049, test_f1: 0.5202
 epoch: 26, train_loss: 0.8430, test_loss: 0.8977, test_f1: 0.5295
 epoch: 27, train_loss: 0.8313, test_loss: 0.8929, test_f1: 0.5306
 epoch: 28, train_loss: 0.8339, test_loss: 0.9283, test_f1: 0.4907
 epoch: 29, train_loss: 0.8344, test_loss: 0.9029, test_f1: 0.5285
 epoch: 30, train_loss: 0.8208, test_loss: 0.8781, test_f1: 0.5336
 epoch: 31, train_loss: 0.8186, test_loss: 0.8988, test_f1: 0.5332
 epoch: 32, train_loss: 0.8177, test_loss: 0.9078, test_f1: 0.5364
 epoch: 33, train_loss: 0.8033, test_loss: 0.9065, test_f1: 0.5350
 epoch: 34, train_loss: 0.7998, test_loss: 0.9097, test_f1: 0.5127
 epoch: 35, train_loss: 0.7985, test_loss: 0.8879, test_f1: 0.5232
 epoch: 36, train_loss: 0.7986, test_loss: 0.9027, test_f1: 0.5307
 epoch: 37, train_loss: 0.7971, test_loss: 0.9075, test_f1: 0.5230
 epoch: 38, train_loss: 0.7880, test_loss: 0.8860, test_f1: 0.5434
 epoch: 39, train_loss: 0.7764, test_loss: 0.8914, test_f1: 0.5286
 epoch: 40, train_loss: 0.7758, test_loss: 0.8945, test_f1: 0.5453
 epoch: 41, train_loss: 0.7694, test_loss: 0.9135, test_f1: 0.5143
 epoch: 42, train_loss: 0.7669, test_loss: 0.8599, test_f1: 0.5470
 epoch: 43, train_loss: 0.7648, test_loss: 0.9067, test_f1: 0.5272
 epoch: 44, train_loss: 0.7555, test_loss: 0.8963, test_f1: 0.5307
 epoch: 45, train_loss: 0.7590, test_loss: 0.9194, test_f1: 0.5278
 epoch: 46, train_loss: 0.7487, test_loss: 0.8725, test_f1: 0.5370
 epoch: 47, train_loss: 0.7503, test_loss: 0.9018, test_f1: 0.5410
 epoch: 48, train_loss: 0.7598, test_loss: 0.8976, test_f1: 0.5359
 epoch: 49, train_loss: 0.7464, test_loss: 0.8887, test_f1: 0.5426
 epoch: 50, train_loss: 0.7357, test_loss: 0.9021, test_f1: 0.5276
 epoch: 51, train_loss: 0.7287, test_loss: 0.9091, test_f1: 0.5423
 epoch: 52, train_loss: 0.7243, test_loss: 0.9212, test_f1: 0.5281
 epoch: 53, train_loss: 0.7145, test_loss: 0.9152, test_f1: 0.5397
 epoch: 54, train_loss: 0.7215, test_loss: 0.9316, test_f1: 0.5281
 epoch: 55, train_loss: 0.7076, test_loss: 0.9176, test_f1: 0.5342
 epoch: 56, train_loss: 0.7094, test_loss: 0.9168, test_f1: 0.5219
 epoch: 57, train_loss: 0.7136, test_loss: 0.9027, test_f1: 0.5383
 epoch: 58, train_loss: 0.7182, test_loss: 0.9157, test_f1: 0.5447
 epoch: 59, train_loss: 0.7088, test_loss: 0.9386, test_f1: 0.5313
 epoch: 60, train_loss: 0.7058, test_loss: 0.9075, test_f1: 0.5239
 epoch: 61, train_loss: 0.7129, test_loss: 0.9378, test_f1: 0.5167
 epoch: 62, train_loss: 0.7019, test_loss: 0.9311, test_f1: 0.5342
 epoch: 63, train_loss: 0.7030, test_loss: 0.9006, test_f1: 0.5407
 epoch: 64, train_loss: 0.6864, test_loss: 0.9013, test_f1: 0.5469
 epoch: 65, train_loss: 0.7150, test_loss: 0.9464, test_f1: 0.5395
 epoch: 66, train_loss: 0.7046, test_loss: 0.9087, test_f1: 0.5360
 epoch: 67, train_loss: 0.6892, test_loss: 0.9346, test_f1: 0.5356
 epoch: 68, train_loss: 0.6935, test_loss: 0.9262, test_f1: 0.5422
 epoch: 69, train_loss: 0.6841, test_loss: 0.9211, test_f1: 0.5366
 epoch: 70, train_loss: 0.6870, test_loss: 0.9105, test_f1: 0.5447
 epoch: 71, train_loss: 0.6905, test_loss: 0.9224, test_f1: 0.5380
 epoch: 72, train_loss: 0.6796, test_loss: 0.9382, test_f1: 0.5399
 epoch: 73, train_loss: 0.6821, test_loss: 0.9267, test_f1: 0.5367
 epoch: 74, train_loss: 0.6775, test_loss: 0.9551, test_f1: 0.5295
 epoch: 75, train_loss: 0.6865, test_loss: 0.9560, test_f1: 0.5287
 epoch: 76, train_loss: 0.6820, test_loss: 0.9293, test_f1: 0.5346
 epoch: 77, train_loss: 0.6731, test_loss: 0.9320, test_f1: 0.5414
 epoch: 78, train_loss: 0.6668, test_loss: 0.9422, test_f1: 0.5400
 epoch: 79, train_loss: 0.6749, test_loss: 0.9459, test_f1: 0.5339
 epoch: 80, train_loss: 0.6692, test_loss: 0.9390, test_f1: 0.5374
 epoch: 81, train_loss: 0.6667, test_loss: 0.9329, test_f1: 0.5476
 epoch: 82, train_loss: 0.6711, test_loss: 0.9273, test_f1: 0.5498
 epoch: 83, train_loss: 0.6748, test_loss: 0.9347, test_f1: 0.5527
 epoch: 84, train_loss: 0.6620, test_loss: 0.9397, test_f1: 0.5351
 epoch: 85, train_loss: 0.6641, test_loss: 0.9435, test_f1: 0.5337
 epoch: 86, train_loss: 0.6625, test_loss: 0.9711, test_f1: 0.5330
 epoch: 87, train_loss: 0.6570, test_loss: 0.9265, test_f1: 0.5318
 epoch: 88, train_loss: 0.6536, test_loss: 0.9497, test_f1: 0.5339
 epoch: 89, train_loss: 0.6665, test_loss: 0.9384, test_f1: 0.5505
 epoch: 90, train_loss: 0.6605, test_loss: 0.9457, test_f1: 0.5417
 epoch: 91, train_loss: 0.6512, test_loss: 0.9543, test_f1: 0.5425
 epoch: 92, train_loss: 0.6622, test_loss: 0.9436, test_f1: 0.5355
 epoch: 93, train_loss: 0.6512, test_loss: 0.9564, test_f1: 0.5378
 epoch: 94, train_loss: 0.6504, test_loss: 0.9535, test_f1: 0.5445
 epoch: 95, train_loss: 0.6432, test_loss: 0.9680, test_f1: 0.5387
 epoch: 96, train_loss: 0.6474, test_loss: 0.9699, test_f1: 0.5375
 epoch: 97, train_loss: 0.6392, test_loss: 0.9449, test_f1: 0.5497
 epoch: 98, train_loss: 0.6359, test_loss: 0.9617, test_f1: 0.5405
 epoch: 99, train_loss: 0.6409, test_loss: 0.9692, test_f1: 0.5464
##################ITERATION #5 ****************************************
 epoch: 0, train_loss: 1.2844, test_loss: 1.2888, test_f1: 0.2260
 epoch: 1, train_loss: 1.1865, test_loss: 1.1980, test_f1: 0.3006
 epoch: 2, train_loss: 1.1495, test_loss: 1.1052, test_f1: 0.4322
 epoch: 3, train_loss: 1.1231, test_loss: 1.0660, test_f1: 0.4484
 epoch: 4, train_loss: 1.0941, test_loss: 1.0457, test_f1: 0.4475
 epoch: 5, train_loss: 1.0680, test_loss: 1.0262, test_f1: 0.4534
 epoch: 6, train_loss: 1.0456, test_loss: 1.0121, test_f1: 0.4545
 epoch: 7, train_loss: 1.0313, test_loss: 0.9997, test_f1: 0.4496
 epoch: 8, train_loss: 1.0139, test_loss: 0.9939, test_f1: 0.4466
 epoch: 9, train_loss: 0.9891, test_loss: 0.9881, test_f1: 0.4565
 epoch: 10, train_loss: 0.9771, test_loss: 0.9799, test_f1: 0.4764
 epoch: 11, train_loss: 0.9653, test_loss: 0.9720, test_f1: 0.4782
 epoch: 12, train_loss: 0.9539, test_loss: 0.9736, test_f1: 0.4590
 epoch: 13, train_loss: 0.9397, test_loss: 0.9757, test_f1: 0.4876
 epoch: 14, train_loss: 0.9351, test_loss: 0.9490, test_f1: 0.5061
 epoch: 15, train_loss: 0.9166, test_loss: 0.9444, test_f1: 0.5037
 epoch: 16, train_loss: 0.9179, test_loss: 0.9673, test_f1: 0.5100
 epoch: 17, train_loss: 0.9123, test_loss: 0.9429, test_f1: 0.5106
 epoch: 18, train_loss: 0.9071, test_loss: 0.9575, test_f1: 0.5147
 epoch: 19, train_loss: 0.8953, test_loss: 0.9411, test_f1: 0.5211
 epoch: 20, train_loss: 0.8942, test_loss: 0.9588, test_f1: 0.5179
 epoch: 21, train_loss: 0.8744, test_loss: 0.9345, test_f1: 0.5242
 epoch: 22, train_loss: 0.8627, test_loss: 0.9362, test_f1: 0.5301
 epoch: 23, train_loss: 0.8663, test_loss: 0.9433, test_f1: 0.5093
 epoch: 24, train_loss: 0.8651, test_loss: 0.9326, test_f1: 0.5253
 epoch: 25, train_loss: 0.8439, test_loss: 0.9518, test_f1: 0.5179
 epoch: 26, train_loss: 0.8409, test_loss: 0.9496, test_f1: 0.5167
 epoch: 27, train_loss: 0.8432, test_loss: 0.9548, test_f1: 0.5217
 epoch: 28, train_loss: 0.8259, test_loss: 0.9444, test_f1: 0.5176
 epoch: 29, train_loss: 0.8309, test_loss: 0.9592, test_f1: 0.5081
 epoch: 30, train_loss: 0.8224, test_loss: 0.9343, test_f1: 0.5352
 epoch: 31, train_loss: 0.8143, test_loss: 0.9443, test_f1: 0.5233
 epoch: 32, train_loss: 0.8183, test_loss: 0.9290, test_f1: 0.5309
 epoch: 33, train_loss: 0.8111, test_loss: 0.9315, test_f1: 0.5267
 epoch: 34, train_loss: 0.7987, test_loss: 0.9344, test_f1: 0.5313
 epoch: 35, train_loss: 0.7997, test_loss: 0.9309, test_f1: 0.5367
 epoch: 36, train_loss: 0.7954, test_loss: 0.9503, test_f1: 0.5242
 epoch: 37, train_loss: 0.7881, test_loss: 0.9785, test_f1: 0.5115
 epoch: 38, train_loss: 0.7792, test_loss: 0.9869, test_f1: 0.5086
 epoch: 39, train_loss: 0.7708, test_loss: 0.9701, test_f1: 0.5318
 epoch: 40, train_loss: 0.7672, test_loss: 0.9430, test_f1: 0.5292
 epoch: 41, train_loss: 0.7554, test_loss: 0.9650, test_f1: 0.5335
 epoch: 42, train_loss: 0.7634, test_loss: 0.9835, test_f1: 0.5297
 epoch: 43, train_loss: 0.7578, test_loss: 0.9681, test_f1: 0.5068
 epoch: 44, train_loss: 0.7572, test_loss: 0.9944, test_f1: 0.5264
 epoch: 45, train_loss: 0.7465, test_loss: 0.9655, test_f1: 0.5456
 epoch: 46, train_loss: 0.7502, test_loss: 0.9678, test_f1: 0.5252
 epoch: 47, train_loss: 0.7384, test_loss: 0.9985, test_f1: 0.5202
 epoch: 48, train_loss: 0.7390, test_loss: 0.9991, test_f1: 0.5232
 epoch: 49, train_loss: 0.7272, test_loss: 1.0241, test_f1: 0.5010
 epoch: 50, train_loss: 0.7274, test_loss: 0.9718, test_f1: 0.5305
 epoch: 51, train_loss: 0.7180, test_loss: 0.9716, test_f1: 0.5349
 epoch: 52, train_loss: 0.7119, test_loss: 0.9911, test_f1: 0.5101
 epoch: 53, train_loss: 0.7025, test_loss: 1.0011, test_f1: 0.5259
 epoch: 54, train_loss: 0.7126, test_loss: 0.9824, test_f1: 0.5350
 epoch: 55, train_loss: 0.7093, test_loss: 0.9899, test_f1: 0.5265
 epoch: 56, train_loss: 0.7070, test_loss: 0.9748, test_f1: 0.5345
 epoch: 57, train_loss: 0.6957, test_loss: 0.9871, test_f1: 0.5294
 epoch: 58, train_loss: 0.7051, test_loss: 0.9799, test_f1: 0.5309
 epoch: 59, train_loss: 0.6877, test_loss: 0.9955, test_f1: 0.5389
 epoch: 60, train_loss: 0.6940, test_loss: 1.0025, test_f1: 0.5253
 epoch: 61, train_loss: 0.6975, test_loss: 0.9972, test_f1: 0.5317
 epoch: 62, train_loss: 0.6866, test_loss: 1.0091, test_f1: 0.5204
 epoch: 63, train_loss: 0.6865, test_loss: 1.0114, test_f1: 0.5280
 epoch: 64, train_loss: 0.6906, test_loss: 1.0073, test_f1: 0.5394
 epoch: 65, train_loss: 0.6782, test_loss: 1.0114, test_f1: 0.5354
 epoch: 66, train_loss: 0.6799, test_loss: 1.0079, test_f1: 0.5383
 epoch: 67, train_loss: 0.6653, test_loss: 1.0221, test_f1: 0.5232
 epoch: 68, train_loss: 0.6723, test_loss: 1.0211, test_f1: 0.5448
 epoch: 69, train_loss: 0.6731, test_loss: 0.9912, test_f1: 0.5443
 epoch: 70, train_loss: 0.6616, test_loss: 1.0300, test_f1: 0.5403
 epoch: 71, train_loss: 0.6787, test_loss: 1.0133, test_f1: 0.5384
 epoch: 72, train_loss: 0.6717, test_loss: 1.0071, test_f1: 0.5353
 epoch: 73, train_loss: 0.6632, test_loss: 1.0395, test_f1: 0.5198
 epoch: 74, train_loss: 0.6625, test_loss: 1.0265, test_f1: 0.5408
 epoch: 75, train_loss: 0.6633, test_loss: 1.0117, test_f1: 0.5491
 epoch: 76, train_loss: 0.6823, test_loss: 1.0489, test_f1: 0.5292
 epoch: 77, train_loss: 0.6560, test_loss: 1.0222, test_f1: 0.5422
 epoch: 78, train_loss: 0.6491, test_loss: 1.0722, test_f1: 0.5181
 epoch: 79, train_loss: 0.6554, test_loss: 1.0729, test_f1: 0.5273
 epoch: 80, train_loss: 0.6498, test_loss: 1.0640, test_f1: 0.5263
 epoch: 81, train_loss: 0.6531, test_loss: 1.0458, test_f1: 0.5356
 epoch: 82, train_loss: 0.6559, test_loss: 1.0690, test_f1: 0.5298
 epoch: 83, train_loss: 0.6421, test_loss: 1.0695, test_f1: 0.5310
 epoch: 84, train_loss: 0.6406, test_loss: 1.0065, test_f1: 0.5398
 epoch: 85, train_loss: 0.6500, test_loss: 1.0549, test_f1: 0.5304
 epoch: 86, train_loss: 0.6422, test_loss: 1.0735, test_f1: 0.5242
 epoch: 87, train_loss: 0.6479, test_loss: 1.0381, test_f1: 0.5426
 epoch: 88, train_loss: 0.6388, test_loss: 1.0635, test_f1: 0.5382
 epoch: 89, train_loss: 0.6347, test_loss: 1.0971, test_f1: 0.5290
 epoch: 90, train_loss: 0.6457, test_loss: 1.0265, test_f1: 0.5432
 epoch: 91, train_loss: 0.6325, test_loss: 1.0465, test_f1: 0.5452
 epoch: 92, train_loss: 0.6499, test_loss: 1.0437, test_f1: 0.5480
 epoch: 93, train_loss: 0.6339, test_loss: 1.0615, test_f1: 0.5254
 epoch: 94, train_loss: 0.6329, test_loss: 1.0257, test_f1: 0.5430
 epoch: 95, train_loss: 0.6251, test_loss: 1.0501, test_f1: 0.5400
 epoch: 96, train_loss: 0.6216, test_loss: 1.0874, test_f1: 0.5310
 epoch: 97, train_loss: 0.6274, test_loss: 1.0836, test_f1: 0.5290
 epoch: 98, train_loss: 0.6182, test_loss: 1.0567, test_f1: 0.5343
 epoch: 99, train_loss: 0.6287, test_loss: 1.0750, test_f1: 0.5340
##################ITERATION #6 ****************************************
 epoch: 0, train_loss: 1.2806, test_loss: 1.2759, test_f1: 0.2260
 epoch: 1, train_loss: 1.1774, test_loss: 1.1827, test_f1: 0.2856
 epoch: 2, train_loss: 1.1397, test_loss: 1.0691, test_f1: 0.4749
 epoch: 3, train_loss: 1.1039, test_loss: 1.0253, test_f1: 0.4751
 epoch: 4, train_loss: 1.0760, test_loss: 1.0025, test_f1: 0.4768
 epoch: 5, train_loss: 1.0466, test_loss: 0.9942, test_f1: 0.4693
 epoch: 6, train_loss: 1.0173, test_loss: 0.9750, test_f1: 0.4960
 epoch: 7, train_loss: 1.0108, test_loss: 0.9674, test_f1: 0.4799
 epoch: 8, train_loss: 0.9871, test_loss: 0.9691, test_f1: 0.4730
 epoch: 9, train_loss: 0.9818, test_loss: 0.9617, test_f1: 0.4888
 epoch: 10, train_loss: 0.9667, test_loss: 0.9631, test_f1: 0.4899
 epoch: 11, train_loss: 0.9485, test_loss: 0.9746, test_f1: 0.4870
 epoch: 12, train_loss: 0.9448, test_loss: 0.9548, test_f1: 0.4953
 epoch: 13, train_loss: 0.9354, test_loss: 0.9332, test_f1: 0.5110
 epoch: 14, train_loss: 0.9241, test_loss: 0.9366, test_f1: 0.5109
 epoch: 15, train_loss: 0.9144, test_loss: 0.9365, test_f1: 0.5112
 epoch: 16, train_loss: 0.8945, test_loss: 0.9166, test_f1: 0.5072
 epoch: 17, train_loss: 0.8941, test_loss: 0.9376, test_f1: 0.5154
 epoch: 18, train_loss: 0.8890, test_loss: 0.9259, test_f1: 0.5249
 epoch: 19, train_loss: 0.8765, test_loss: 0.9310, test_f1: 0.5219
 epoch: 20, train_loss: 0.8760, test_loss: 0.9243, test_f1: 0.5183
 epoch: 21, train_loss: 0.8661, test_loss: 0.9174, test_f1: 0.5388
 epoch: 22, train_loss: 0.8555, test_loss: 0.9377, test_f1: 0.5273
 epoch: 23, train_loss: 0.8510, test_loss: 0.9131, test_f1: 0.5271
 epoch: 24, train_loss: 0.8427, test_loss: 0.9270, test_f1: 0.5312
 epoch: 25, train_loss: 0.8364, test_loss: 0.9212, test_f1: 0.5330
 epoch: 26, train_loss: 0.8368, test_loss: 0.9121, test_f1: 0.5277
 epoch: 27, train_loss: 0.8288, test_loss: 0.8870, test_f1: 0.5330
 epoch: 28, train_loss: 0.8204, test_loss: 0.9068, test_f1: 0.5339
 epoch: 29, train_loss: 0.8131, test_loss: 0.9160, test_f1: 0.5351
 epoch: 30, train_loss: 0.8054, test_loss: 0.8992, test_f1: 0.5392
 epoch: 31, train_loss: 0.8004, test_loss: 0.9387, test_f1: 0.5291
 epoch: 32, train_loss: 0.7998, test_loss: 0.8962, test_f1: 0.5431
 epoch: 33, train_loss: 0.7962, test_loss: 0.9156, test_f1: 0.5535
 epoch: 34, train_loss: 0.7800, test_loss: 0.9088, test_f1: 0.5431
 epoch: 35, train_loss: 0.7876, test_loss: 0.8934, test_f1: 0.5424
 epoch: 36, train_loss: 0.7802, test_loss: 0.8839, test_f1: 0.5383
 epoch: 37, train_loss: 0.7776, test_loss: 0.8924, test_f1: 0.5430
 epoch: 38, train_loss: 0.7613, test_loss: 0.8970, test_f1: 0.5332
 epoch: 39, train_loss: 0.7576, test_loss: 0.8786, test_f1: 0.5417
 epoch: 40, train_loss: 0.7517, test_loss: 0.9046, test_f1: 0.5325
 epoch: 41, train_loss: 0.7482, test_loss: 0.9016, test_f1: 0.5545
 epoch: 42, train_loss: 0.7368, test_loss: 0.8857, test_f1: 0.5504
 epoch: 43, train_loss: 0.7338, test_loss: 0.8893, test_f1: 0.5447
 epoch: 44, train_loss: 0.7368, test_loss: 0.8938, test_f1: 0.5451
 epoch: 45, train_loss: 0.7295, test_loss: 0.9460, test_f1: 0.5568
 epoch: 46, train_loss: 0.7270, test_loss: 0.8777, test_f1: 0.5310
 epoch: 47, train_loss: 0.7453, test_loss: 0.9238, test_f1: 0.5340
 epoch: 48, train_loss: 0.7202, test_loss: 0.9484, test_f1: 0.5496
 epoch: 49, train_loss: 0.7169, test_loss: 0.8964, test_f1: 0.5429
 epoch: 50, train_loss: 0.7099, test_loss: 0.9180, test_f1: 0.5404
 epoch: 51, train_loss: 0.7115, test_loss: 0.8997, test_f1: 0.5545
 epoch: 52, train_loss: 0.6937, test_loss: 0.9037, test_f1: 0.5550
 epoch: 53, train_loss: 0.6971, test_loss: 0.8976, test_f1: 0.5605
 epoch: 54, train_loss: 0.6892, test_loss: 0.9024, test_f1: 0.5644
 epoch: 55, train_loss: 0.7031, test_loss: 0.8885, test_f1: 0.5520
 epoch: 56, train_loss: 0.6952, test_loss: 0.9294, test_f1: 0.5607
 epoch: 57, train_loss: 0.6873, test_loss: 0.9190, test_f1: 0.5550
 epoch: 58, train_loss: 0.7034, test_loss: 0.9324, test_f1: 0.5472
 epoch: 59, train_loss: 0.6849, test_loss: 0.9298, test_f1: 0.5579
 epoch: 60, train_loss: 0.6691, test_loss: 0.9127, test_f1: 0.5551
 epoch: 61, train_loss: 0.6749, test_loss: 0.9306, test_f1: 0.5498
 epoch: 62, train_loss: 0.6781, test_loss: 0.9129, test_f1: 0.5608
 epoch: 63, train_loss: 0.6753, test_loss: 0.9285, test_f1: 0.5575
 epoch: 64, train_loss: 0.6777, test_loss: 0.9104, test_f1: 0.5590
 epoch: 65, train_loss: 0.6718, test_loss: 0.9131, test_f1: 0.5614
 epoch: 66, train_loss: 0.6760, test_loss: 0.9267, test_f1: 0.5533
 epoch: 67, train_loss: 0.6775, test_loss: 0.9239, test_f1: 0.5556
 epoch: 68, train_loss: 0.6630, test_loss: 0.9187, test_f1: 0.5616
 epoch: 69, train_loss: 0.6579, test_loss: 0.9427, test_f1: 0.5614
 epoch: 70, train_loss: 0.6583, test_loss: 0.9326, test_f1: 0.5624
 epoch: 71, train_loss: 0.6614, test_loss: 0.9680, test_f1: 0.5628
 epoch: 72, train_loss: 0.6791, test_loss: 0.9443, test_f1: 0.5497
 epoch: 73, train_loss: 0.6623, test_loss: 0.9648, test_f1: 0.5405
 epoch: 74, train_loss: 0.6608, test_loss: 0.9477, test_f1: 0.5573
 epoch: 75, train_loss: 0.6581, test_loss: 0.9485, test_f1: 0.5610
 epoch: 76, train_loss: 0.6494, test_loss: 0.9660, test_f1: 0.5543
 epoch: 77, train_loss: 0.6493, test_loss: 0.9332, test_f1: 0.5550
 epoch: 78, train_loss: 0.6586, test_loss: 0.9557, test_f1: 0.5547
 epoch: 79, train_loss: 0.6375, test_loss: 0.9667, test_f1: 0.5570
 epoch: 80, train_loss: 0.6535, test_loss: 0.9357, test_f1: 0.5706
 epoch: 81, train_loss: 0.6559, test_loss: 0.9513, test_f1: 0.5570
 epoch: 82, train_loss: 0.6455, test_loss: 0.9473, test_f1: 0.5570
 epoch: 83, train_loss: 0.6510, test_loss: 0.9578, test_f1: 0.5651
 epoch: 84, train_loss: 0.6397, test_loss: 0.9703, test_f1: 0.5599
 epoch: 85, train_loss: 0.6419, test_loss: 0.9459, test_f1: 0.5621
 epoch: 86, train_loss: 0.6286, test_loss: 0.9779, test_f1: 0.5590
 epoch: 87, train_loss: 0.6476, test_loss: 0.9628, test_f1: 0.5606
 epoch: 88, train_loss: 0.6339, test_loss: 0.9487, test_f1: 0.5603
 epoch: 89, train_loss: 0.6340, test_loss: 0.9539, test_f1: 0.5742
 epoch: 90, train_loss: 0.6441, test_loss: 0.9902, test_f1: 0.5701
 epoch: 91, train_loss: 0.6484, test_loss: 0.9723, test_f1: 0.5616
 epoch: 92, train_loss: 0.6341, test_loss: 0.9611, test_f1: 0.5606
 epoch: 93, train_loss: 0.6289, test_loss: 0.9984, test_f1: 0.5744
 epoch: 94, train_loss: 0.6314, test_loss: 0.9996, test_f1: 0.5553
 epoch: 95, train_loss: 0.6313, test_loss: 0.9989, test_f1: 0.5651
 epoch: 96, train_loss: 0.6235, test_loss: 0.9940, test_f1: 0.5702
 epoch: 97, train_loss: 0.6374, test_loss: 1.0062, test_f1: 0.5801
 epoch: 98, train_loss: 0.6327, test_loss: 0.9737, test_f1: 0.5620
 epoch: 99, train_loss: 0.6174, test_loss: 1.0155, test_f1: 0.5669
##################ITERATION #7 ****************************************
 epoch: 0, train_loss: 1.2746, test_loss: 1.3022, test_f1: 0.2633
 epoch: 1, train_loss: 1.2007, test_loss: 1.2415, test_f1: 0.3228
 epoch: 2, train_loss: 1.1537, test_loss: 1.1420, test_f1: 0.4168
 epoch: 3, train_loss: 1.1217, test_loss: 1.0751, test_f1: 0.4471
 epoch: 4, train_loss: 1.0950, test_loss: 1.0532, test_f1: 0.4544
 epoch: 5, train_loss: 1.0751, test_loss: 1.0370, test_f1: 0.4497
 epoch: 6, train_loss: 1.0469, test_loss: 1.0376, test_f1: 0.4618
 epoch: 7, train_loss: 1.0395, test_loss: 1.0246, test_f1: 0.4646
 epoch: 8, train_loss: 1.0265, test_loss: 1.0204, test_f1: 0.4691
 epoch: 9, train_loss: 1.0113, test_loss: 1.0200, test_f1: 0.4753
 epoch: 10, train_loss: 1.0032, test_loss: 1.0036, test_f1: 0.4885
 epoch: 11, train_loss: 0.9948, test_loss: 1.0081, test_f1: 0.4758
 epoch: 12, train_loss: 0.9812, test_loss: 1.0077, test_f1: 0.4755
 epoch: 13, train_loss: 0.9823, test_loss: 0.9914, test_f1: 0.4974
 epoch: 14, train_loss: 0.9670, test_loss: 0.9895, test_f1: 0.4855
 epoch: 15, train_loss: 0.9663, test_loss: 0.9877, test_f1: 0.4879
 epoch: 16, train_loss: 0.9529, test_loss: 0.9952, test_f1: 0.4840
 epoch: 17, train_loss: 0.9355, test_loss: 0.9873, test_f1: 0.4935
 epoch: 18, train_loss: 0.9344, test_loss: 0.9797, test_f1: 0.5094
 epoch: 19, train_loss: 0.9251, test_loss: 0.9720, test_f1: 0.5065
 epoch: 20, train_loss: 0.9231, test_loss: 0.9657, test_f1: 0.5084
 epoch: 21, train_loss: 0.9169, test_loss: 0.9679, test_f1: 0.5150
 epoch: 22, train_loss: 0.9055, test_loss: 0.9757, test_f1: 0.5206
 epoch: 23, train_loss: 0.9003, test_loss: 0.9627, test_f1: 0.5153
 epoch: 24, train_loss: 0.8824, test_loss: 0.9545, test_f1: 0.5318
 epoch: 25, train_loss: 0.8935, test_loss: 0.9681, test_f1: 0.5191
 epoch: 26, train_loss: 0.8817, test_loss: 0.9636, test_f1: 0.5216
 epoch: 27, train_loss: 0.8723, test_loss: 0.9615, test_f1: 0.5063
 epoch: 28, train_loss: 0.8662, test_loss: 0.9538, test_f1: 0.5237
 epoch: 29, train_loss: 0.8594, test_loss: 0.9575, test_f1: 0.5137
 epoch: 30, train_loss: 0.8590, test_loss: 0.9754, test_f1: 0.5138
 epoch: 31, train_loss: 0.8560, test_loss: 0.9774, test_f1: 0.5130
 epoch: 32, train_loss: 0.8492, test_loss: 0.9777, test_f1: 0.5252
 epoch: 33, train_loss: 0.8620, test_loss: 0.9513, test_f1: 0.5344
 epoch: 34, train_loss: 0.8565, test_loss: 0.9631, test_f1: 0.5196
 epoch: 35, train_loss: 0.8342, test_loss: 0.9660, test_f1: 0.5214
 epoch: 36, train_loss: 0.8283, test_loss: 0.9616, test_f1: 0.5268
 epoch: 37, train_loss: 0.8272, test_loss: 0.9573, test_f1: 0.5312
 epoch: 38, train_loss: 0.8214, test_loss: 0.9671, test_f1: 0.5161
 epoch: 39, train_loss: 0.8116, test_loss: 0.9921, test_f1: 0.5065
 epoch: 40, train_loss: 0.8034, test_loss: 0.9545, test_f1: 0.5417
 epoch: 41, train_loss: 0.8140, test_loss: 0.9796, test_f1: 0.5147
 epoch: 42, train_loss: 0.7965, test_loss: 0.9839, test_f1: 0.5104
 epoch: 43, train_loss: 0.8080, test_loss: 0.9756, test_f1: 0.5361
 epoch: 44, train_loss: 0.7921, test_loss: 0.9796, test_f1: 0.5109
 epoch: 45, train_loss: 0.7945, test_loss: 0.9843, test_f1: 0.5226
 epoch: 46, train_loss: 0.7905, test_loss: 0.9814, test_f1: 0.5270
 epoch: 47, train_loss: 0.7690, test_loss: 0.9875, test_f1: 0.5302
 epoch: 48, train_loss: 0.7787, test_loss: 0.9692, test_f1: 0.5212
 epoch: 49, train_loss: 0.7738, test_loss: 0.9915, test_f1: 0.5171
 epoch: 50, train_loss: 0.7752, test_loss: 0.9882, test_f1: 0.5174
 epoch: 51, train_loss: 0.7659, test_loss: 0.9955, test_f1: 0.5328
 epoch: 52, train_loss: 0.7578, test_loss: 1.0004, test_f1: 0.5217
 epoch: 53, train_loss: 0.7577, test_loss: 0.9845, test_f1: 0.5189
 epoch: 54, train_loss: 0.7587, test_loss: 0.9781, test_f1: 0.5333
 epoch: 55, train_loss: 0.7449, test_loss: 0.9909, test_f1: 0.5218
 epoch: 56, train_loss: 0.7476, test_loss: 0.9764, test_f1: 0.5244
 epoch: 57, train_loss: 0.7455, test_loss: 1.0002, test_f1: 0.5304
 epoch: 58, train_loss: 0.7495, test_loss: 0.9996, test_f1: 0.5203
 epoch: 59, train_loss: 0.7493, test_loss: 0.9906, test_f1: 0.5229
 epoch: 60, train_loss: 0.7527, test_loss: 0.9925, test_f1: 0.5445
 epoch: 61, train_loss: 0.7366, test_loss: 0.9847, test_f1: 0.5272
 epoch: 62, train_loss: 0.7394, test_loss: 1.0011, test_f1: 0.5400
 epoch: 63, train_loss: 0.7417, test_loss: 0.9861, test_f1: 0.5323
 epoch: 64, train_loss: 0.7346, test_loss: 0.9870, test_f1: 0.5262
 epoch: 65, train_loss: 0.7342, test_loss: 0.9840, test_f1: 0.5316
 epoch: 66, train_loss: 0.7186, test_loss: 0.9930, test_f1: 0.5430
 epoch: 67, train_loss: 0.7295, test_loss: 0.9990, test_f1: 0.5342
 epoch: 68, train_loss: 0.7328, test_loss: 0.9923, test_f1: 0.5280
 epoch: 69, train_loss: 0.7306, test_loss: 1.0262, test_f1: 0.5152
 epoch: 70, train_loss: 0.7220, test_loss: 1.0199, test_f1: 0.5238
 epoch: 71, train_loss: 0.7310, test_loss: 1.0203, test_f1: 0.5202
 epoch: 72, train_loss: 0.7154, test_loss: 1.0119, test_f1: 0.5342
 epoch: 73, train_loss: 0.7184, test_loss: 1.0117, test_f1: 0.5345
 epoch: 74, train_loss: 0.7246, test_loss: 0.9948, test_f1: 0.5309
 epoch: 75, train_loss: 0.7143, test_loss: 1.0093, test_f1: 0.5222
 epoch: 76, train_loss: 0.7132, test_loss: 1.0133, test_f1: 0.5381
 epoch: 77, train_loss: 0.7085, test_loss: 1.0052, test_f1: 0.5394
 epoch: 78, train_loss: 0.7036, test_loss: 1.0103, test_f1: 0.5387
 epoch: 79, train_loss: 0.7132, test_loss: 0.9984, test_f1: 0.5407
 epoch: 80, train_loss: 0.7043, test_loss: 1.0051, test_f1: 0.5451
 epoch: 81, train_loss: 0.7169, test_loss: 1.0220, test_f1: 0.5211
 epoch: 82, train_loss: 0.6993, test_loss: 0.9919, test_f1: 0.5427
 epoch: 83, train_loss: 0.7069, test_loss: 1.0268, test_f1: 0.5304
 epoch: 84, train_loss: 0.7017, test_loss: 0.9942, test_f1: 0.5390
 epoch: 85, train_loss: 0.6983, test_loss: 0.9937, test_f1: 0.5446
 epoch: 86, train_loss: 0.6961, test_loss: 1.0060, test_f1: 0.5338
 epoch: 87, train_loss: 0.6855, test_loss: 1.0196, test_f1: 0.5325
 epoch: 88, train_loss: 0.6957, test_loss: 1.0403, test_f1: 0.5304
 epoch: 89, train_loss: 0.6878, test_loss: 1.0291, test_f1: 0.5365
 epoch: 90, train_loss: 0.6938, test_loss: 1.0303, test_f1: 0.5393
 epoch: 91, train_loss: 0.6967, test_loss: 1.0291, test_f1: 0.5378
 epoch: 92, train_loss: 0.6887, test_loss: 1.0273, test_f1: 0.5431
 epoch: 93, train_loss: 0.6865, test_loss: 1.0442, test_f1: 0.5279
 epoch: 94, train_loss: 0.6896, test_loss: 1.0354, test_f1: 0.5384
 epoch: 95, train_loss: 0.6859, test_loss: 1.0510, test_f1: 0.5365
 epoch: 96, train_loss: 0.6790, test_loss: 1.0243, test_f1: 0.5335
 epoch: 97, train_loss: 0.6824, test_loss: 1.0582, test_f1: 0.5297
 epoch: 98, train_loss: 0.6754, test_loss: 1.0493, test_f1: 0.5511
 epoch: 99, train_loss: 0.6754, test_loss: 1.0468, test_f1: 0.5484
##################ITERATION #8 ****************************************
 epoch: 0, train_loss: 1.2534, test_loss: 1.2627, test_f1: 0.2260
 epoch: 1, train_loss: 1.1795, test_loss: 1.1360, test_f1: 0.4161
 epoch: 2, train_loss: 1.1392, test_loss: 1.0667, test_f1: 0.4560
 epoch: 3, train_loss: 1.1086, test_loss: 1.0321, test_f1: 0.4784
 epoch: 4, train_loss: 1.0922, test_loss: 1.0118, test_f1: 0.5103
 epoch: 5, train_loss: 1.0694, test_loss: 1.0012, test_f1: 0.4814
 epoch: 6, train_loss: 1.0528, test_loss: 0.9861, test_f1: 0.4976
 epoch: 7, train_loss: 1.0387, test_loss: 0.9777, test_f1: 0.4921
 epoch: 8, train_loss: 1.0203, test_loss: 0.9663, test_f1: 0.5005
 epoch: 9, train_loss: 1.0334, test_loss: 0.9706, test_f1: 0.4928
 epoch: 10, train_loss: 1.0120, test_loss: 0.9731, test_f1: 0.4942
 epoch: 11, train_loss: 0.9946, test_loss: 0.9692, test_f1: 0.4780
 epoch: 12, train_loss: 0.9880, test_loss: 0.9595, test_f1: 0.4943
 epoch: 13, train_loss: 0.9789, test_loss: 0.9603, test_f1: 0.4895
 epoch: 14, train_loss: 0.9689, test_loss: 0.9442, test_f1: 0.5019
 epoch: 15, train_loss: 0.9640, test_loss: 0.9526, test_f1: 0.4841
 epoch: 16, train_loss: 0.9579, test_loss: 0.9564, test_f1: 0.4917
 epoch: 17, train_loss: 0.9422, test_loss: 0.9463, test_f1: 0.4975
 epoch: 18, train_loss: 0.9376, test_loss: 0.9461, test_f1: 0.5026
 epoch: 19, train_loss: 0.9179, test_loss: 0.9373, test_f1: 0.5089
 epoch: 20, train_loss: 0.9279, test_loss: 0.9532, test_f1: 0.4928
 epoch: 21, train_loss: 0.9234, test_loss: 0.9348, test_f1: 0.5077
 epoch: 22, train_loss: 0.9128, test_loss: 0.9414, test_f1: 0.4958
 epoch: 23, train_loss: 0.9017, test_loss: 0.9324, test_f1: 0.5060
 epoch: 24, train_loss: 0.9001, test_loss: 0.9341, test_f1: 0.4877
 epoch: 25, train_loss: 0.8954, test_loss: 0.9492, test_f1: 0.4907
 epoch: 26, train_loss: 0.8830, test_loss: 0.9218, test_f1: 0.5042
 epoch: 27, train_loss: 0.8656, test_loss: 0.9231, test_f1: 0.5098
 epoch: 28, train_loss: 0.8703, test_loss: 0.9449, test_f1: 0.4919
 epoch: 29, train_loss: 0.8702, test_loss: 0.9436, test_f1: 0.4981
 epoch: 30, train_loss: 0.8587, test_loss: 0.9372, test_f1: 0.5073
 epoch: 31, train_loss: 0.8565, test_loss: 0.9375, test_f1: 0.5135
 epoch: 32, train_loss: 0.8373, test_loss: 0.9260, test_f1: 0.5237
 epoch: 33, train_loss: 0.8513, test_loss: 0.9189, test_f1: 0.5263
 epoch: 34, train_loss: 0.8337, test_loss: 0.9399, test_f1: 0.5203
 epoch: 35, train_loss: 0.8358, test_loss: 0.9327, test_f1: 0.5262
 epoch: 36, train_loss: 0.8314, test_loss: 0.9413, test_f1: 0.5255
 epoch: 37, train_loss: 0.8218, test_loss: 0.9376, test_f1: 0.5166
 epoch: 38, train_loss: 0.8250, test_loss: 0.9514, test_f1: 0.5099
 epoch: 39, train_loss: 0.8133, test_loss: 0.9499, test_f1: 0.5139
 epoch: 40, train_loss: 0.8127, test_loss: 0.9501, test_f1: 0.5133
 epoch: 41, train_loss: 0.7914, test_loss: 0.9637, test_f1: 0.5192
 epoch: 42, train_loss: 0.8011, test_loss: 0.9393, test_f1: 0.5247
 epoch: 43, train_loss: 0.7862, test_loss: 0.9447, test_f1: 0.5225
 epoch: 44, train_loss: 0.7851, test_loss: 0.9313, test_f1: 0.5411
 epoch: 45, train_loss: 0.7862, test_loss: 0.9226, test_f1: 0.5334
 epoch: 46, train_loss: 0.7782, test_loss: 0.9207, test_f1: 0.5384
 epoch: 47, train_loss: 0.7752, test_loss: 0.9266, test_f1: 0.5409
 epoch: 48, train_loss: 0.7670, test_loss: 0.9022, test_f1: 0.5429
 epoch: 49, train_loss: 0.7689, test_loss: 0.9390, test_f1: 0.5267
 epoch: 50, train_loss: 0.7688, test_loss: 0.9623, test_f1: 0.5245
 epoch: 51, train_loss: 0.7544, test_loss: 0.9201, test_f1: 0.5396
 epoch: 52, train_loss: 0.7495, test_loss: 0.9131, test_f1: 0.5429
 epoch: 53, train_loss: 0.7496, test_loss: 0.9124, test_f1: 0.5515
 epoch: 54, train_loss: 0.7417, test_loss: 0.9341, test_f1: 0.5285
 epoch: 55, train_loss: 0.7353, test_loss: 0.9422, test_f1: 0.5363
 epoch: 56, train_loss: 0.7427, test_loss: 0.9319, test_f1: 0.5411
 epoch: 57, train_loss: 0.7411, test_loss: 0.9383, test_f1: 0.5415
 epoch: 58, train_loss: 0.7308, test_loss: 0.9262, test_f1: 0.5417
 epoch: 59, train_loss: 0.7315, test_loss: 0.9523, test_f1: 0.5433
 epoch: 60, train_loss: 0.7262, test_loss: 0.9514, test_f1: 0.5472
 epoch: 61, train_loss: 0.7240, test_loss: 0.9433, test_f1: 0.5357
 epoch: 62, train_loss: 0.7449, test_loss: 0.9477, test_f1: 0.5389
 epoch: 63, train_loss: 0.7261, test_loss: 0.9486, test_f1: 0.5262
 epoch: 64, train_loss: 0.7359, test_loss: 0.9678, test_f1: 0.5480
 epoch: 65, train_loss: 0.7281, test_loss: 0.9335, test_f1: 0.5407
 epoch: 66, train_loss: 0.7219, test_loss: 0.9370, test_f1: 0.5486
 epoch: 67, train_loss: 0.7112, test_loss: 0.9314, test_f1: 0.5512
 epoch: 68, train_loss: 0.7108, test_loss: 0.9468, test_f1: 0.5311
 epoch: 69, train_loss: 0.7183, test_loss: 0.9341, test_f1: 0.5438
 epoch: 70, train_loss: 0.7067, test_loss: 0.9623, test_f1: 0.5519
 epoch: 71, train_loss: 0.7172, test_loss: 0.9702, test_f1: 0.5334
 epoch: 72, train_loss: 0.7014, test_loss: 0.9304, test_f1: 0.5600
 epoch: 73, train_loss: 0.7004, test_loss: 0.9326, test_f1: 0.5572
 epoch: 74, train_loss: 0.7087, test_loss: 0.9503, test_f1: 0.5494
 epoch: 75, train_loss: 0.7140, test_loss: 0.9448, test_f1: 0.5389
 epoch: 76, train_loss: 0.7107, test_loss: 0.9542, test_f1: 0.5477
 epoch: 77, train_loss: 0.6955, test_loss: 0.9388, test_f1: 0.5598
 epoch: 78, train_loss: 0.6932, test_loss: 0.9589, test_f1: 0.5334
 epoch: 79, train_loss: 0.7004, test_loss: 0.9478, test_f1: 0.5369
 epoch: 80, train_loss: 0.6899, test_loss: 0.9491, test_f1: 0.5438
 epoch: 81, train_loss: 0.6870, test_loss: 0.9444, test_f1: 0.5635
 epoch: 82, train_loss: 0.6875, test_loss: 0.9492, test_f1: 0.5488
 epoch: 83, train_loss: 0.6835, test_loss: 0.9454, test_f1: 0.5534
 epoch: 84, train_loss: 0.7008, test_loss: 0.9552, test_f1: 0.5409
 epoch: 85, train_loss: 0.6797, test_loss: 0.9479, test_f1: 0.5385
 epoch: 86, train_loss: 0.6874, test_loss: 0.9453, test_f1: 0.5421
 epoch: 87, train_loss: 0.6951, test_loss: 0.9556, test_f1: 0.5404
 epoch: 88, train_loss: 0.6747, test_loss: 0.9623, test_f1: 0.5505
 epoch: 89, train_loss: 0.6795, test_loss: 0.9589, test_f1: 0.5487
 epoch: 90, train_loss: 0.6832, test_loss: 1.0030, test_f1: 0.5494
 epoch: 91, train_loss: 0.6740, test_loss: 0.9709, test_f1: 0.5508
 epoch: 92, train_loss: 0.6733, test_loss: 0.9633, test_f1: 0.5540
 epoch: 93, train_loss: 0.6718, test_loss: 0.9778, test_f1: 0.5496
 epoch: 94, train_loss: 0.6745, test_loss: 0.9797, test_f1: 0.5321
 epoch: 95, train_loss: 0.6788, test_loss: 0.9849, test_f1: 0.5513
 epoch: 96, train_loss: 0.6647, test_loss: 0.9755, test_f1: 0.5502
 epoch: 97, train_loss: 0.6728, test_loss: 0.9740, test_f1: 0.5592
 epoch: 98, train_loss: 0.6627, test_loss: 0.9844, test_f1: 0.5535
 epoch: 99, train_loss: 0.6675, test_loss: 0.9762, test_f1: 0.5654
##################ITERATION #9 ****************************************
 epoch: 0, train_loss: 1.2804, test_loss: 1.2681, test_f1: 0.3167
 epoch: 1, train_loss: 1.1683, test_loss: 1.1677, test_f1: 0.3913
 epoch: 2, train_loss: 1.1345, test_loss: 1.0754, test_f1: 0.4874
 epoch: 3, train_loss: 1.0957, test_loss: 1.0430, test_f1: 0.4934
 epoch: 4, train_loss: 1.0857, test_loss: 1.0286, test_f1: 0.4764
 epoch: 5, train_loss: 1.0480, test_loss: 1.0195, test_f1: 0.4740
 epoch: 6, train_loss: 1.0426, test_loss: 1.0034, test_f1: 0.4903
 epoch: 7, train_loss: 1.0248, test_loss: 0.9978, test_f1: 0.4835
 epoch: 8, train_loss: 1.0095, test_loss: 0.9862, test_f1: 0.4951
 epoch: 9, train_loss: 0.9974, test_loss: 0.9771, test_f1: 0.4998
 epoch: 10, train_loss: 0.9854, test_loss: 0.9788, test_f1: 0.4969
 epoch: 11, train_loss: 0.9707, test_loss: 0.9645, test_f1: 0.5040
 epoch: 12, train_loss: 0.9684, test_loss: 0.9539, test_f1: 0.5137
 epoch: 13, train_loss: 0.9608, test_loss: 0.9481, test_f1: 0.5108
 epoch: 14, train_loss: 0.9470, test_loss: 0.9602, test_f1: 0.5128
 epoch: 15, train_loss: 0.9403, test_loss: 0.9538, test_f1: 0.5189
 epoch: 16, train_loss: 0.9248, test_loss: 0.9556, test_f1: 0.5042
 epoch: 17, train_loss: 0.9260, test_loss: 0.9229, test_f1: 0.5273
 epoch: 18, train_loss: 0.9097, test_loss: 0.9379, test_f1: 0.5123
 epoch: 19, train_loss: 0.9075, test_loss: 0.9332, test_f1: 0.5110
 epoch: 20, train_loss: 0.8966, test_loss: 0.9308, test_f1: 0.5018
 epoch: 21, train_loss: 0.8919, test_loss: 0.9387, test_f1: 0.5293
 epoch: 22, train_loss: 0.8813, test_loss: 0.9282, test_f1: 0.5257
 epoch: 23, train_loss: 0.8755, test_loss: 0.9278, test_f1: 0.5279
 epoch: 24, train_loss: 0.8741, test_loss: 0.9282, test_f1: 0.5383
 epoch: 25, train_loss: 0.8674, test_loss: 0.9255, test_f1: 0.5280
 epoch: 26, train_loss: 0.8627, test_loss: 0.9188, test_f1: 0.5205
 epoch: 27, train_loss: 0.8520, test_loss: 0.9281, test_f1: 0.5185
 epoch: 28, train_loss: 0.8449, test_loss: 0.9213, test_f1: 0.5217
 epoch: 29, train_loss: 0.8373, test_loss: 0.9090, test_f1: 0.5361
 epoch: 30, train_loss: 0.8383, test_loss: 0.9247, test_f1: 0.5433
 epoch: 31, train_loss: 0.8246, test_loss: 0.9140, test_f1: 0.5189
 epoch: 32, train_loss: 0.8162, test_loss: 0.9130, test_f1: 0.5340
 epoch: 33, train_loss: 0.8168, test_loss: 0.9225, test_f1: 0.5274
 epoch: 34, train_loss: 0.8045, test_loss: 0.9182, test_f1: 0.5367
 epoch: 35, train_loss: 0.8038, test_loss: 0.9201, test_f1: 0.5335
 epoch: 36, train_loss: 0.8074, test_loss: 0.9360, test_f1: 0.5427
 epoch: 37, train_loss: 0.7973, test_loss: 0.9288, test_f1: 0.5446
 epoch: 38, train_loss: 0.7916, test_loss: 0.9075, test_f1: 0.5563
 epoch: 39, train_loss: 0.7805, test_loss: 0.9302, test_f1: 0.5344
 epoch: 40, train_loss: 0.7727, test_loss: 0.9348, test_f1: 0.5245
 epoch: 41, train_loss: 0.7698, test_loss: 0.9266, test_f1: 0.5309
 epoch: 42, train_loss: 0.7674, test_loss: 0.8994, test_f1: 0.5534
 epoch: 43, train_loss: 0.7621, test_loss: 0.9299, test_f1: 0.5497
 epoch: 44, train_loss: 0.7640, test_loss: 0.9257, test_f1: 0.5535
 epoch: 45, train_loss: 0.7488, test_loss: 0.9344, test_f1: 0.5331
 epoch: 46, train_loss: 0.7542, test_loss: 0.9072, test_f1: 0.5420
 epoch: 47, train_loss: 0.7429, test_loss: 0.9557, test_f1: 0.5362
 epoch: 48, train_loss: 0.7447, test_loss: 0.9599, test_f1: 0.5220
 epoch: 49, train_loss: 0.7469, test_loss: 0.9264, test_f1: 0.5579
 epoch: 50, train_loss: 0.7439, test_loss: 0.9277, test_f1: 0.5378
 epoch: 51, train_loss: 0.7285, test_loss: 0.9232, test_f1: 0.5349
 epoch: 52, train_loss: 0.7307, test_loss: 0.9228, test_f1: 0.5507
 epoch: 53, train_loss: 0.7239, test_loss: 0.9498, test_f1: 0.5386
 epoch: 54, train_loss: 0.7333, test_loss: 0.9355, test_f1: 0.5443
 epoch: 55, train_loss: 0.7129, test_loss: 0.9379, test_f1: 0.5394
 epoch: 56, train_loss: 0.7068, test_loss: 0.9714, test_f1: 0.5338
 epoch: 57, train_loss: 0.7078, test_loss: 0.9525, test_f1: 0.5419
 epoch: 58, train_loss: 0.7158, test_loss: 0.9548, test_f1: 0.5293
 epoch: 59, train_loss: 0.7065, test_loss: 0.9439, test_f1: 0.5390
 epoch: 60, train_loss: 0.7204, test_loss: 0.9569, test_f1: 0.5396
 epoch: 61, train_loss: 0.7069, test_loss: 0.9439, test_f1: 0.5394
 epoch: 62, train_loss: 0.6985, test_loss: 0.9577, test_f1: 0.5372
 epoch: 63, train_loss: 0.7055, test_loss: 0.9418, test_f1: 0.5333
 epoch: 64, train_loss: 0.7121, test_loss: 0.9660, test_f1: 0.5223
 epoch: 65, train_loss: 0.6997, test_loss: 0.9453, test_f1: 0.5332
 epoch: 66, train_loss: 0.7025, test_loss: 0.9545, test_f1: 0.5369
 epoch: 67, train_loss: 0.6961, test_loss: 0.9464, test_f1: 0.5367
 epoch: 68, train_loss: 0.6823, test_loss: 0.9564, test_f1: 0.5393
 epoch: 69, train_loss: 0.6901, test_loss: 0.9649, test_f1: 0.5287
 epoch: 70, train_loss: 0.6935, test_loss: 0.9555, test_f1: 0.5326
 epoch: 71, train_loss: 0.6826, test_loss: 0.9630, test_f1: 0.5434
 epoch: 72, train_loss: 0.6859, test_loss: 0.9684, test_f1: 0.5332
 epoch: 73, train_loss: 0.6981, test_loss: 0.9698, test_f1: 0.5465
 epoch: 74, train_loss: 0.6894, test_loss: 0.9924, test_f1: 0.5494
 epoch: 75, train_loss: 0.6846, test_loss: 0.9247, test_f1: 0.5603
 epoch: 76, train_loss: 0.6841, test_loss: 0.9626, test_f1: 0.5451
 epoch: 77, train_loss: 0.6936, test_loss: 0.9355, test_f1: 0.5409
 epoch: 78, train_loss: 0.6749, test_loss: 0.9421, test_f1: 0.5398
 epoch: 79, train_loss: 0.6824, test_loss: 0.9546, test_f1: 0.5485
 epoch: 80, train_loss: 0.6735, test_loss: 0.9508, test_f1: 0.5504
 epoch: 81, train_loss: 0.6670, test_loss: 0.9343, test_f1: 0.5544
 epoch: 82, train_loss: 0.6747, test_loss: 0.9528, test_f1: 0.5576
 epoch: 83, train_loss: 0.6671, test_loss: 0.9542, test_f1: 0.5395
 epoch: 84, train_loss: 0.6615, test_loss: 0.9570, test_f1: 0.5492
 epoch: 85, train_loss: 0.6649, test_loss: 0.9848, test_f1: 0.5359
 epoch: 86, train_loss: 0.6578, test_loss: 0.9745, test_f1: 0.5428
 epoch: 87, train_loss: 0.6720, test_loss: 0.9876, test_f1: 0.5464
 epoch: 88, train_loss: 0.6587, test_loss: 0.9767, test_f1: 0.5433
 epoch: 89, train_loss: 0.6771, test_loss: 0.9538, test_f1: 0.5449
 epoch: 90, train_loss: 0.6678, test_loss: 0.9682, test_f1: 0.5435
 epoch: 91, train_loss: 0.6571, test_loss: 0.9736, test_f1: 0.5341
 epoch: 92, train_loss: 0.6538, test_loss: 0.9700, test_f1: 0.5442
 epoch: 93, train_loss: 0.6452, test_loss: 0.9733, test_f1: 0.5521
 epoch: 94, train_loss: 0.6649, test_loss: 0.9820, test_f1: 0.5305
 epoch: 95, train_loss: 0.6719, test_loss: 0.9517, test_f1: 0.5602
 epoch: 96, train_loss: 0.6554, test_loss: 0.9763, test_f1: 0.5564
 epoch: 97, train_loss: 0.6490, test_loss: 0.9828, test_f1: 0.5450
 epoch: 98, train_loss: 0.6415, test_loss: 0.9475, test_f1: 0.5547
 epoch: 99, train_loss: 0.6648, test_loss: 0.9760, test_f1: 0.5573

Training completed in 579.60 seconds
Best F1: 0.5801 at epoch 97
Mean F1 across iterations: 0.5547  0.0149
========================FINAL RESULTS================================
FEGIN weighted F1: 0.5801  0.0149
python main.py --data ltspice_examples --representation component_pin --model FEGIN --layers 6 --hiddens 64 --batch_size 128 --lr 0.0001 --emb_size 250 --epochs 100 --save_appendix component_pin_L6_H64_BS128_LR0.0001_E250 --no_val
-----



STDERR:
  File "main.py", line 370, in <module>
    main()
  File "main.py", line 254, in main
    dataset = dataset_class(
  File "/home/philip/projects/ltspice_examples_code_repo/Circuit-Completion-Using-GNNs/component_classification_with_link_prediction_head/evaluation/FEGIN/kernel/circuit_datasets.py", line 15, in __init__
    self.data, self.slices = torch.load(self.processed_paths[0])
  File "/home/philip/.local/lib/python3.8/site-packages/torch/serialization.py", line 1040, in load
    warnings.warn(
  File "/usr/lib/python3.8/warnings.py", line 109, in _showwarnmsg
    sw(msg.message, msg.category, msg.filename, msg.lineno,
  File "main.py", line 47, in warn_with_traceback
    traceback.print_stack(file=log)
/home/philip/projects/ltspice_examples_code_repo/Circuit-Completion-Using-GNNs/component_classification_with_link_prediction_head/evaluation/FEGIN/kernel/circuit_datasets.py:15: FutureWarning: You are using `torch.load` with `weights_only=False` (the current default value), which uses the default pickle module implicitly. It is possible to construct malicious pickle data which will execute arbitrary code during unpickling (See https://github.com/pytorch/pytorch/blob/main/SECURITY.md#untrusted-models for more details). In a future release, the default value for `weights_only` will be flipped to `True`. This limits the functions that could be executed during unpickling. Arbitrary objects will no longer be allowed to be loaded via this mode unless they are explicitly allowlisted by the user via `torch.serialization.add_safe_globals`. We recommend you start setting `weights_only=True` for any use case where you don't have full control of the loaded file. Please open an issue on GitHub for any issues related to this experimental feature.
  self.data, self.slices = torch.load(self.processed_paths[0])
