STDOUT:
Results will be saved in /home/philip/projects/ltspice_examples_code_repo/Circuit-Completion-Using-GNNs/component_classification_with_link_prediction_head/evaluation/FEGIN/results/model_FEGIN_dataset_ltspice_examples
Command line input: python main.py --data ltspice_examples --representation component_net --model FEGIN --layers 6 --hiddens 128 --batch_size 128 --lr 0.001 --emb_size 128 --epochs 100 --save_appendix component_net_L6_H128_BS128_LR0.001_E128 --no_val
 is saved.
-----
ltspice_examples - FEGIN
Using 6 layers, 128 hidden units, h = 2
Loading component_net representation dataset
ENTERED
Training FEGIN on component_net representation
Train: 3558, Test: 846
##################ITERATION #0 ****************************************
 epoch: 0, train_loss: 1.2214, test_loss: 1.2759, test_f1: 0.3482
 epoch: 1, train_loss: 1.0355, test_loss: 0.9947, test_f1: 0.4946
 epoch: 2, train_loss: 0.9565, test_loss: 0.9596, test_f1: 0.5199
 epoch: 3, train_loss: 0.9215, test_loss: 0.9922, test_f1: 0.4764
 epoch: 4, train_loss: 0.9023, test_loss: 0.9355, test_f1: 0.4903
 epoch: 5, train_loss: 0.8791, test_loss: 0.9445, test_f1: 0.4876
 epoch: 6, train_loss: 0.8466, test_loss: 0.8681, test_f1: 0.5806
 epoch: 7, train_loss: 0.8469, test_loss: 0.9923, test_f1: 0.5623
 epoch: 8, train_loss: 0.8180, test_loss: 0.8486, test_f1: 0.5644
 epoch: 9, train_loss: 0.8077, test_loss: 0.9515, test_f1: 0.5195
 epoch: 10, train_loss: 0.7874, test_loss: 0.9686, test_f1: 0.5757
 epoch: 11, train_loss: 0.7707, test_loss: 1.0427, test_f1: 0.5537
 epoch: 12, train_loss: 0.7775, test_loss: 0.9043, test_f1: 0.5833
 epoch: 13, train_loss: 0.7786, test_loss: 0.8984, test_f1: 0.5779
 epoch: 14, train_loss: 0.7526, test_loss: 1.1555, test_f1: 0.5156
 epoch: 15, train_loss: 0.7454, test_loss: 0.9715, test_f1: 0.5579
 epoch: 16, train_loss: 0.7189, test_loss: 0.9797, test_f1: 0.5975
 epoch: 17, train_loss: 0.7009, test_loss: 0.9562, test_f1: 0.6072
 epoch: 18, train_loss: 0.6981, test_loss: 0.9921, test_f1: 0.5971
 epoch: 19, train_loss: 0.7015, test_loss: 0.9877, test_f1: 0.5747
 epoch: 20, train_loss: 0.6787, test_loss: 1.0041, test_f1: 0.6053
 epoch: 21, train_loss: 0.6612, test_loss: 1.0247, test_f1: 0.5933
 epoch: 22, train_loss: 0.6472, test_loss: 1.0890, test_f1: 0.5679
 epoch: 23, train_loss: 0.6589, test_loss: 1.0207, test_f1: 0.5704
 epoch: 24, train_loss: 0.6578, test_loss: 0.9506, test_f1: 0.6163
 epoch: 25, train_loss: 0.6234, test_loss: 1.0493, test_f1: 0.6069
 epoch: 26, train_loss: 0.6288, test_loss: 1.0406, test_f1: 0.5851
 epoch: 27, train_loss: 0.6418, test_loss: 0.9320, test_f1: 0.6398
 epoch: 28, train_loss: 0.6186, test_loss: 1.0741, test_f1: 0.5902
 epoch: 29, train_loss: 0.5823, test_loss: 0.9654, test_f1: 0.6282
 epoch: 30, train_loss: 0.5874, test_loss: 1.0702, test_f1: 0.5704
 epoch: 31, train_loss: 0.5524, test_loss: 1.1068, test_f1: 0.5837
 epoch: 32, train_loss: 0.5681, test_loss: 1.1063, test_f1: 0.5766
 epoch: 33, train_loss: 0.5588, test_loss: 1.0086, test_f1: 0.6243
 epoch: 34, train_loss: 0.5309, test_loss: 1.0527, test_f1: 0.6104
 epoch: 35, train_loss: 0.5250, test_loss: 1.0986, test_f1: 0.6202
 epoch: 36, train_loss: 0.5321, test_loss: 1.0988, test_f1: 0.6317
 epoch: 37, train_loss: 0.5143, test_loss: 1.0809, test_f1: 0.6031
 epoch: 38, train_loss: 0.4851, test_loss: 1.2483, test_f1: 0.6170
 epoch: 39, train_loss: 0.5043, test_loss: 1.0601, test_f1: 0.6606
 epoch: 40, train_loss: 0.4901, test_loss: 1.1971, test_f1: 0.6247
 epoch: 41, train_loss: 0.4774, test_loss: 1.2300, test_f1: 0.6329
 epoch: 42, train_loss: 0.4772, test_loss: 1.1673, test_f1: 0.6214
 epoch: 43, train_loss: 0.4651, test_loss: 1.2286, test_f1: 0.6054
 epoch: 44, train_loss: 0.4290, test_loss: 1.3985, test_f1: 0.6042
 epoch: 45, train_loss: 0.4373, test_loss: 1.2098, test_f1: 0.6159
 epoch: 46, train_loss: 0.4726, test_loss: 1.2594, test_f1: 0.6006
 epoch: 47, train_loss: 0.4529, test_loss: 1.2683, test_f1: 0.6674
 epoch: 48, train_loss: 0.4366, test_loss: 1.3155, test_f1: 0.5946
 epoch: 49, train_loss: 0.3780, test_loss: 1.4314, test_f1: 0.6104
 epoch: 50, train_loss: 0.4097, test_loss: 1.2968, test_f1: 0.6261
 epoch: 51, train_loss: 0.3564, test_loss: 1.3426, test_f1: 0.6303
 epoch: 52, train_loss: 0.3138, test_loss: 1.3704, test_f1: 0.6317
 epoch: 53, train_loss: 0.3066, test_loss: 1.4648, test_f1: 0.6313
 epoch: 54, train_loss: 0.2970, test_loss: 1.5034, test_f1: 0.6443
 epoch: 55, train_loss: 0.2897, test_loss: 1.6279, test_f1: 0.6412
 epoch: 56, train_loss: 0.2898, test_loss: 1.6148, test_f1: 0.6178
 epoch: 57, train_loss: 0.2793, test_loss: 1.5765, test_f1: 0.6333
 epoch: 58, train_loss: 0.2610, test_loss: 1.7931, test_f1: 0.6182
 epoch: 59, train_loss: 0.2684, test_loss: 1.7968, test_f1: 0.6504
 epoch: 60, train_loss: 0.2748, test_loss: 1.7123, test_f1: 0.6438
 epoch: 61, train_loss: 0.2711, test_loss: 1.7717, test_f1: 0.6018
 epoch: 62, train_loss: 0.2604, test_loss: 1.8017, test_f1: 0.6454
 epoch: 63, train_loss: 0.2744, test_loss: 1.8203, test_f1: 0.6147
 epoch: 64, train_loss: 0.2435, test_loss: 1.7744, test_f1: 0.6542
 epoch: 65, train_loss: 0.2470, test_loss: 1.8774, test_f1: 0.6378
 epoch: 66, train_loss: 0.2485, test_loss: 2.0544, test_f1: 0.6197
 epoch: 67, train_loss: 0.2422, test_loss: 1.7761, test_f1: 0.6247
 epoch: 68, train_loss: 0.2191, test_loss: 1.9309, test_f1: 0.6540
 epoch: 69, train_loss: 0.2103, test_loss: 1.9441, test_f1: 0.6426
 epoch: 70, train_loss: 0.2039, test_loss: 2.1375, test_f1: 0.6413
 epoch: 71, train_loss: 0.2185, test_loss: 2.0807, test_f1: 0.6475
 epoch: 72, train_loss: 0.2169, test_loss: 2.2572, test_f1: 0.6079
 epoch: 73, train_loss: 0.2321, test_loss: 1.9638, test_f1: 0.6206
 epoch: 74, train_loss: 0.2072, test_loss: 1.9182, test_f1: 0.6562
 epoch: 75, train_loss: 0.1996, test_loss: 2.1567, test_f1: 0.6416
 epoch: 76, train_loss: 0.2066, test_loss: 2.0582, test_f1: 0.6263
 epoch: 77, train_loss: 0.2145, test_loss: 2.0127, test_f1: 0.6433
 epoch: 78, train_loss: 0.2087, test_loss: 2.2113, test_f1: 0.6304
 epoch: 79, train_loss: 0.1930, test_loss: 2.3013, test_f1: 0.6015
 epoch: 80, train_loss: 0.2072, test_loss: 2.1963, test_f1: 0.6259
 epoch: 81, train_loss: 0.1885, test_loss: 2.1301, test_f1: 0.6275
 epoch: 82, train_loss: 0.2462, test_loss: 2.3442, test_f1: 0.6217
 epoch: 83, train_loss: 0.2114, test_loss: 2.2063, test_f1: 0.6324
 epoch: 84, train_loss: 0.2192, test_loss: 2.2637, test_f1: 0.6442
 epoch: 85, train_loss: 0.2011, test_loss: 2.1830, test_f1: 0.6131
 epoch: 86, train_loss: 0.2018, test_loss: 2.2466, test_f1: 0.6139
 epoch: 87, train_loss: 0.1726, test_loss: 2.1787, test_f1: 0.6346
 epoch: 88, train_loss: 0.1895, test_loss: 2.3135, test_f1: 0.6345
 epoch: 89, train_loss: 0.1632, test_loss: 2.2635, test_f1: 0.6315
 epoch: 90, train_loss: 0.1620, test_loss: 2.3995, test_f1: 0.6240
 epoch: 91, train_loss: 0.1678, test_loss: 2.5583, test_f1: 0.6241
 epoch: 92, train_loss: 0.1765, test_loss: 2.2558, test_f1: 0.6064
 epoch: 93, train_loss: 0.1760, test_loss: 2.4630, test_f1: 0.6251
 epoch: 94, train_loss: 0.1839, test_loss: 2.5850, test_f1: 0.6227
 epoch: 95, train_loss: 0.1854, test_loss: 2.3733, test_f1: 0.6154
 epoch: 96, train_loss: 0.1907, test_loss: 2.2875, test_f1: 0.6333
 epoch: 97, train_loss: 0.1778, test_loss: 2.2428, test_f1: 0.6435
 epoch: 98, train_loss: 0.1711, test_loss: 2.3717, test_f1: 0.6460
 epoch: 99, train_loss: 0.1644, test_loss: 2.4402, test_f1: 0.6298
##################ITERATION #1 ****************************************
 epoch: 0, train_loss: 1.1412, test_loss: 1.0991, test_f1: 0.3698
 epoch: 1, train_loss: 1.0006, test_loss: 0.9680, test_f1: 0.4714
 epoch: 2, train_loss: 0.9417, test_loss: 0.9692, test_f1: 0.4821
 epoch: 3, train_loss: 0.9182, test_loss: 0.9475, test_f1: 0.4910
 epoch: 4, train_loss: 0.8761, test_loss: 0.8902, test_f1: 0.5327
 epoch: 5, train_loss: 0.8713, test_loss: 0.9050, test_f1: 0.5253
 epoch: 6, train_loss: 0.8515, test_loss: 0.9534, test_f1: 0.5581
 epoch: 7, train_loss: 0.8180, test_loss: 1.0083, test_f1: 0.5238
 epoch: 8, train_loss: 0.8135, test_loss: 0.9072, test_f1: 0.5770
 epoch: 9, train_loss: 0.7929, test_loss: 1.0183, test_f1: 0.5656
 epoch: 10, train_loss: 0.7809, test_loss: 1.0455, test_f1: 0.5334
 epoch: 11, train_loss: 0.7719, test_loss: 0.9752, test_f1: 0.5521
 epoch: 12, train_loss: 0.7581, test_loss: 0.9032, test_f1: 0.5876
 epoch: 13, train_loss: 0.7360, test_loss: 0.9269, test_f1: 0.5705
 epoch: 14, train_loss: 0.7108, test_loss: 0.9613, test_f1: 0.5786
 epoch: 15, train_loss: 0.7092, test_loss: 0.9810, test_f1: 0.5875
 epoch: 16, train_loss: 0.7050, test_loss: 0.9023, test_f1: 0.5974
 epoch: 17, train_loss: 0.6751, test_loss: 0.9345, test_f1: 0.5885
 epoch: 18, train_loss: 0.6637, test_loss: 1.0653, test_f1: 0.5695
 epoch: 19, train_loss: 0.6970, test_loss: 0.8688, test_f1: 0.6157
 epoch: 20, train_loss: 0.6478, test_loss: 0.9207, test_f1: 0.6199
 epoch: 21, train_loss: 0.6403, test_loss: 1.0096, test_f1: 0.6028
 epoch: 22, train_loss: 0.6454, test_loss: 1.0043, test_f1: 0.6044
 epoch: 23, train_loss: 0.6254, test_loss: 1.0292, test_f1: 0.5827
 epoch: 24, train_loss: 0.6173, test_loss: 0.9511, test_f1: 0.6207
 epoch: 25, train_loss: 0.6076, test_loss: 0.9572, test_f1: 0.6312
 epoch: 26, train_loss: 0.6139, test_loss: 1.3686, test_f1: 0.5668
 epoch: 27, train_loss: 0.5976, test_loss: 1.0243, test_f1: 0.6094
 epoch: 28, train_loss: 0.5644, test_loss: 1.0812, test_f1: 0.6011
 epoch: 29, train_loss: 0.5891, test_loss: 1.0867, test_f1: 0.6209
 epoch: 30, train_loss: 0.5623, test_loss: 1.0130, test_f1: 0.6128
 epoch: 31, train_loss: 0.5414, test_loss: 1.0226, test_f1: 0.6499
 epoch: 32, train_loss: 0.5334, test_loss: 1.0395, test_f1: 0.6081
 epoch: 33, train_loss: 0.5142, test_loss: 1.1463, test_f1: 0.6567
 epoch: 34, train_loss: 0.4995, test_loss: 1.1364, test_f1: 0.6420
 epoch: 35, train_loss: 0.4877, test_loss: 1.2079, test_f1: 0.6211
 epoch: 36, train_loss: 0.5146, test_loss: 1.0472, test_f1: 0.6285
 epoch: 37, train_loss: 0.4789, test_loss: 1.1965, test_f1: 0.6296
 epoch: 38, train_loss: 0.4806, test_loss: 1.2123, test_f1: 0.6395
 epoch: 39, train_loss: 0.4692, test_loss: 1.2663, test_f1: 0.6103
 epoch: 40, train_loss: 0.4507, test_loss: 1.1403, test_f1: 0.6487
 epoch: 41, train_loss: 0.4562, test_loss: 1.1735, test_f1: 0.6369
 epoch: 42, train_loss: 0.4307, test_loss: 1.1923, test_f1: 0.6281
 epoch: 43, train_loss: 0.4062, test_loss: 1.2740, test_f1: 0.6242
 epoch: 44, train_loss: 0.4474, test_loss: 1.1673, test_f1: 0.6545
 epoch: 45, train_loss: 0.4242, test_loss: 1.3573, test_f1: 0.6298
 epoch: 46, train_loss: 0.3997, test_loss: 1.2603, test_f1: 0.6148
 epoch: 47, train_loss: 0.4320, test_loss: 1.2226, test_f1: 0.6501
 epoch: 48, train_loss: 0.3834, test_loss: 1.3371, test_f1: 0.6511
 epoch: 49, train_loss: 0.3927, test_loss: 1.3259, test_f1: 0.6610
 epoch: 50, train_loss: 0.3842, test_loss: 1.3958, test_f1: 0.6578
 epoch: 51, train_loss: 0.3412, test_loss: 1.3361, test_f1: 0.6380
 epoch: 52, train_loss: 0.2884, test_loss: 1.4633, test_f1: 0.6684
 epoch: 53, train_loss: 0.2870, test_loss: 1.4235, test_f1: 0.6514
 epoch: 54, train_loss: 0.2701, test_loss: 1.5548, test_f1: 0.6774
 epoch: 55, train_loss: 0.2813, test_loss: 1.6439, test_f1: 0.6528
 epoch: 56, train_loss: 0.2621, test_loss: 1.7091, test_f1: 0.6204
 epoch: 57, train_loss: 0.2681, test_loss: 1.6058, test_f1: 0.6648
 epoch: 58, train_loss: 0.2566, test_loss: 1.5242, test_f1: 0.6489
 epoch: 59, train_loss: 0.2336, test_loss: 1.6334, test_f1: 0.6629
 epoch: 60, train_loss: 0.2579, test_loss: 1.5608, test_f1: 0.6792
 epoch: 61, train_loss: 0.2357, test_loss: 1.7427, test_f1: 0.6743
 epoch: 62, train_loss: 0.2238, test_loss: 1.6264, test_f1: 0.6640
 epoch: 63, train_loss: 0.2297, test_loss: 1.9590, test_f1: 0.6647
 epoch: 64, train_loss: 0.2370, test_loss: 1.7334, test_f1: 0.6740
 epoch: 65, train_loss: 0.2314, test_loss: 1.8352, test_f1: 0.6530
 epoch: 66, train_loss: 0.2237, test_loss: 1.9514, test_f1: 0.6472
 epoch: 67, train_loss: 0.2075, test_loss: 1.8095, test_f1: 0.6639
 epoch: 68, train_loss: 0.2347, test_loss: 1.9122, test_f1: 0.6398
 epoch: 69, train_loss: 0.2195, test_loss: 2.0225, test_f1: 0.6600
 epoch: 70, train_loss: 0.2165, test_loss: 2.0453, test_f1: 0.6386
 epoch: 71, train_loss: 0.2001, test_loss: 2.0270, test_f1: 0.6524
 epoch: 72, train_loss: 0.1832, test_loss: 2.0559, test_f1: 0.6696
 epoch: 73, train_loss: 0.1972, test_loss: 2.1700, test_f1: 0.6482
 epoch: 74, train_loss: 0.1958, test_loss: 1.9861, test_f1: 0.6542
 epoch: 75, train_loss: 0.1881, test_loss: 2.1007, test_f1: 0.6428
 epoch: 76, train_loss: 0.1937, test_loss: 2.1293, test_f1: 0.6325
 epoch: 77, train_loss: 0.1893, test_loss: 2.0922, test_f1: 0.6273
 epoch: 78, train_loss: 0.1931, test_loss: 2.4030, test_f1: 0.6561
 epoch: 79, train_loss: 0.1828, test_loss: 2.2474, test_f1: 0.6314
 epoch: 80, train_loss: 0.1839, test_loss: 2.1850, test_f1: 0.6381
 epoch: 81, train_loss: 0.1790, test_loss: 2.0446, test_f1: 0.6464
 epoch: 82, train_loss: 0.1831, test_loss: 2.2368, test_f1: 0.6631
 epoch: 83, train_loss: 0.1751, test_loss: 2.3331, test_f1: 0.6334
 epoch: 84, train_loss: 0.1850, test_loss: 2.1542, test_f1: 0.6324
 epoch: 85, train_loss: 0.1730, test_loss: 2.1647, test_f1: 0.6402
 epoch: 86, train_loss: 0.1674, test_loss: 2.1119, test_f1: 0.6623
 epoch: 87, train_loss: 0.1767, test_loss: 2.3131, test_f1: 0.6251
 epoch: 88, train_loss: 0.1736, test_loss: 2.3121, test_f1: 0.6260
 epoch: 89, train_loss: 0.1723, test_loss: 2.1644, test_f1: 0.6457
 epoch: 90, train_loss: 0.1778, test_loss: 2.4241, test_f1: 0.6176
 epoch: 91, train_loss: 0.1991, test_loss: 2.2317, test_f1: 0.6408
 epoch: 92, train_loss: 0.1665, test_loss: 2.1609, test_f1: 0.6445
 epoch: 93, train_loss: 0.1596, test_loss: 2.4575, test_f1: 0.6490
 epoch: 94, train_loss: 0.1485, test_loss: 2.2686, test_f1: 0.6515
 epoch: 95, train_loss: 0.1507, test_loss: 2.3847, test_f1: 0.6319
 epoch: 96, train_loss: 0.1481, test_loss: 2.3181, test_f1: 0.6484
 epoch: 97, train_loss: 0.1612, test_loss: 2.3915, test_f1: 0.6592
 epoch: 98, train_loss: 0.1824, test_loss: 2.4761, test_f1: 0.6412
 epoch: 99, train_loss: 0.1558, test_loss: 2.5334, test_f1: 0.6223
##################ITERATION #2 ****************************************
 epoch: 0, train_loss: 1.1758, test_loss: 1.2463, test_f1: 0.2715
 epoch: 1, train_loss: 1.0253, test_loss: 0.9918, test_f1: 0.5144
 epoch: 2, train_loss: 0.9691, test_loss: 0.9359, test_f1: 0.5030
 epoch: 3, train_loss: 0.9287, test_loss: 0.9408, test_f1: 0.5005
 epoch: 4, train_loss: 0.8911, test_loss: 0.9581, test_f1: 0.5161
 epoch: 5, train_loss: 0.8769, test_loss: 0.9350, test_f1: 0.4748
 epoch: 6, train_loss: 0.8697, test_loss: 0.9420, test_f1: 0.5040
 epoch: 7, train_loss: 0.8482, test_loss: 0.9382, test_f1: 0.5248
 epoch: 8, train_loss: 0.8221, test_loss: 0.9286, test_f1: 0.5558
 epoch: 9, train_loss: 0.8181, test_loss: 0.9109, test_f1: 0.5453
 epoch: 10, train_loss: 0.7993, test_loss: 0.8915, test_f1: 0.5809
 epoch: 11, train_loss: 0.7928, test_loss: 0.9044, test_f1: 0.5630
 epoch: 12, train_loss: 0.7897, test_loss: 0.8974, test_f1: 0.6010
 epoch: 13, train_loss: 0.7697, test_loss: 0.9590, test_f1: 0.5439
 epoch: 14, train_loss: 0.7483, test_loss: 0.9806, test_f1: 0.5975
 epoch: 15, train_loss: 0.7477, test_loss: 0.8951, test_f1: 0.6045
 epoch: 16, train_loss: 0.7342, test_loss: 0.9458, test_f1: 0.5937
 epoch: 17, train_loss: 0.7250, test_loss: 0.9210, test_f1: 0.6220
 epoch: 18, train_loss: 0.7111, test_loss: 0.9341, test_f1: 0.5888
 epoch: 19, train_loss: 0.7075, test_loss: 0.9356, test_f1: 0.6081
 epoch: 20, train_loss: 0.6928, test_loss: 1.0190, test_f1: 0.5930
 epoch: 21, train_loss: 0.6742, test_loss: 0.9671, test_f1: 0.6054
 epoch: 22, train_loss: 0.6700, test_loss: 1.0083, test_f1: 0.6257
 epoch: 23, train_loss: 0.6702, test_loss: 1.0705, test_f1: 0.5864
 epoch: 24, train_loss: 0.6455, test_loss: 1.0005, test_f1: 0.6017
 epoch: 25, train_loss: 0.6278, test_loss: 1.0343, test_f1: 0.5785
 epoch: 26, train_loss: 0.6399, test_loss: 0.9822, test_f1: 0.6224
 epoch: 27, train_loss: 0.6236, test_loss: 1.1458, test_f1: 0.5942
 epoch: 28, train_loss: 0.6089, test_loss: 1.0923, test_f1: 0.6154
 epoch: 29, train_loss: 0.5840, test_loss: 1.0126, test_f1: 0.6078
 epoch: 30, train_loss: 0.5913, test_loss: 1.0446, test_f1: 0.5780
 epoch: 31, train_loss: 0.6030, test_loss: 0.9988, test_f1: 0.6089
 epoch: 32, train_loss: 0.5852, test_loss: 1.0010, test_f1: 0.6187
 epoch: 33, train_loss: 0.5672, test_loss: 1.2780, test_f1: 0.5840
 epoch: 34, train_loss: 0.5655, test_loss: 1.0447, test_f1: 0.6078
 epoch: 35, train_loss: 0.5575, test_loss: 1.0365, test_f1: 0.5934
 epoch: 36, train_loss: 0.5449, test_loss: 1.0500, test_f1: 0.6569
 epoch: 37, train_loss: 0.5343, test_loss: 1.0950, test_f1: 0.6294
 epoch: 38, train_loss: 0.5079, test_loss: 1.0174, test_f1: 0.6545
 epoch: 39, train_loss: 0.4917, test_loss: 1.2543, test_f1: 0.6176
 epoch: 40, train_loss: 0.4998, test_loss: 1.1687, test_f1: 0.6789
 epoch: 41, train_loss: 0.4976, test_loss: 1.2486, test_f1: 0.6169
 epoch: 42, train_loss: 0.5041, test_loss: 1.1244, test_f1: 0.6397
 epoch: 43, train_loss: 0.4618, test_loss: 1.1127, test_f1: 0.6383
 epoch: 44, train_loss: 0.4361, test_loss: 1.2127, test_f1: 0.6459
 epoch: 45, train_loss: 0.4544, test_loss: 1.1522, test_f1: 0.6430
 epoch: 46, train_loss: 0.4424, test_loss: 1.1424, test_f1: 0.6354
 epoch: 47, train_loss: 0.4621, test_loss: 1.1738, test_f1: 0.6275
 epoch: 48, train_loss: 0.4501, test_loss: 1.2383, test_f1: 0.6573
 epoch: 49, train_loss: 0.4597, test_loss: 1.2151, test_f1: 0.6155
 epoch: 50, train_loss: 0.4281, test_loss: 1.3123, test_f1: 0.6141
 epoch: 51, train_loss: 0.3743, test_loss: 1.2811, test_f1: 0.6499
 epoch: 52, train_loss: 0.3437, test_loss: 1.3154, test_f1: 0.6737
 epoch: 53, train_loss: 0.3220, test_loss: 1.3818, test_f1: 0.6422
 epoch: 54, train_loss: 0.3108, test_loss: 1.4692, test_f1: 0.6415
 epoch: 55, train_loss: 0.3146, test_loss: 1.3847, test_f1: 0.6566
 epoch: 56, train_loss: 0.3112, test_loss: 1.4299, test_f1: 0.6689
 epoch: 57, train_loss: 0.3159, test_loss: 1.3520, test_f1: 0.6387
 epoch: 58, train_loss: 0.3104, test_loss: 1.4172, test_f1: 0.6552
 epoch: 59, train_loss: 0.2912, test_loss: 1.4989, test_f1: 0.6839
 epoch: 60, train_loss: 0.2894, test_loss: 1.3962, test_f1: 0.6741
 epoch: 61, train_loss: 0.2782, test_loss: 1.5817, test_f1: 0.6697
 epoch: 62, train_loss: 0.2790, test_loss: 1.4436, test_f1: 0.6717
 epoch: 63, train_loss: 0.2857, test_loss: 1.5675, test_f1: 0.6507
 epoch: 64, train_loss: 0.2685, test_loss: 1.5509, test_f1: 0.6683
 epoch: 65, train_loss: 0.2549, test_loss: 1.5777, test_f1: 0.6700
 epoch: 66, train_loss: 0.2539, test_loss: 1.4989, test_f1: 0.6513
 epoch: 67, train_loss: 0.2811, test_loss: 1.6373, test_f1: 0.6623
 epoch: 68, train_loss: 0.2737, test_loss: 1.5375, test_f1: 0.6623
 epoch: 69, train_loss: 0.2640, test_loss: 1.6656, test_f1: 0.6704
 epoch: 70, train_loss: 0.2510, test_loss: 1.6633, test_f1: 0.6605
 epoch: 71, train_loss: 0.2504, test_loss: 1.6617, test_f1: 0.6715
 epoch: 72, train_loss: 0.2302, test_loss: 1.8390, test_f1: 0.6600
 epoch: 73, train_loss: 0.2438, test_loss: 1.7554, test_f1: 0.6688
 epoch: 74, train_loss: 0.2426, test_loss: 1.7833, test_f1: 0.6712
 epoch: 75, train_loss: 0.2404, test_loss: 1.8090, test_f1: 0.6733
 epoch: 76, train_loss: 0.2308, test_loss: 1.6987, test_f1: 0.6836
 epoch: 77, train_loss: 0.2350, test_loss: 1.7131, test_f1: 0.6823
 epoch: 78, train_loss: 0.2310, test_loss: 1.8646, test_f1: 0.6601
 epoch: 79, train_loss: 0.2403, test_loss: 1.7823, test_f1: 0.6522
 epoch: 80, train_loss: 0.2349, test_loss: 1.8586, test_f1: 0.6372
 epoch: 81, train_loss: 0.2053, test_loss: 2.0382, test_f1: 0.6523
 epoch: 82, train_loss: 0.2098, test_loss: 1.9463, test_f1: 0.6543
 epoch: 83, train_loss: 0.2034, test_loss: 1.8675, test_f1: 0.6531
 epoch: 84, train_loss: 0.2066, test_loss: 1.9239, test_f1: 0.6630
 epoch: 85, train_loss: 0.2085, test_loss: 1.8685, test_f1: 0.6712
 epoch: 86, train_loss: 0.2007, test_loss: 2.0269, test_f1: 0.6557
 epoch: 87, train_loss: 0.2029, test_loss: 1.9493, test_f1: 0.6573
 epoch: 88, train_loss: 0.2041, test_loss: 1.9878, test_f1: 0.6742
 epoch: 89, train_loss: 0.2154, test_loss: 2.0880, test_f1: 0.6454
 epoch: 90, train_loss: 0.2139, test_loss: 1.9028, test_f1: 0.6513
 epoch: 91, train_loss: 0.2236, test_loss: 1.8688, test_f1: 0.6512
 epoch: 92, train_loss: 0.2220, test_loss: 2.1287, test_f1: 0.6510
 epoch: 93, train_loss: 0.1962, test_loss: 2.0399, test_f1: 0.6538
 epoch: 94, train_loss: 0.2077, test_loss: 2.0765, test_f1: 0.6590
 epoch: 95, train_loss: 0.1984, test_loss: 1.8555, test_f1: 0.6941
 epoch: 96, train_loss: 0.1901, test_loss: 1.9183, test_f1: 0.6603
 epoch: 97, train_loss: 0.1912, test_loss: 2.1249, test_f1: 0.6515
 epoch: 98, train_loss: 0.1966, test_loss: 2.0656, test_f1: 0.6451
 epoch: 99, train_loss: 0.1855, test_loss: 2.1411, test_f1: 0.6723
##################ITERATION #3 ****************************************
 epoch: 0, train_loss: 1.1984, test_loss: 1.2396, test_f1: 0.2865
 epoch: 1, train_loss: 0.9943, test_loss: 0.9589, test_f1: 0.4780
 epoch: 2, train_loss: 0.9415, test_loss: 0.9653, test_f1: 0.5222
 epoch: 3, train_loss: 0.9216, test_loss: 0.9396, test_f1: 0.5043
 epoch: 4, train_loss: 0.8877, test_loss: 1.0096, test_f1: 0.5579
 epoch: 5, train_loss: 0.8640, test_loss: 0.9634, test_f1: 0.5426
 epoch: 6, train_loss: 0.8539, test_loss: 0.9879, test_f1: 0.5250
 epoch: 7, train_loss: 0.8279, test_loss: 1.0433, test_f1: 0.5576
 epoch: 8, train_loss: 0.8285, test_loss: 1.0722, test_f1: 0.5372
 epoch: 9, train_loss: 0.8158, test_loss: 0.9255, test_f1: 0.5531
 epoch: 10, train_loss: 0.7998, test_loss: 1.0415, test_f1: 0.5348
 epoch: 11, train_loss: 0.7923, test_loss: 1.0224, test_f1: 0.5810
 epoch: 12, train_loss: 0.7721, test_loss: 1.0278, test_f1: 0.5816
 epoch: 13, train_loss: 0.7650, test_loss: 1.0282, test_f1: 0.5926
 epoch: 14, train_loss: 0.7494, test_loss: 1.0666, test_f1: 0.5629
 epoch: 15, train_loss: 0.7425, test_loss: 1.0559, test_f1: 0.6015
 epoch: 16, train_loss: 0.7293, test_loss: 1.0913, test_f1: 0.5974
 epoch: 17, train_loss: 0.7079, test_loss: 1.0972, test_f1: 0.5842
 epoch: 18, train_loss: 0.7135, test_loss: 1.0453, test_f1: 0.6084
 epoch: 19, train_loss: 0.6992, test_loss: 1.0239, test_f1: 0.6160
 epoch: 20, train_loss: 0.6913, test_loss: 1.1156, test_f1: 0.6149
 epoch: 21, train_loss: 0.7025, test_loss: 1.1394, test_f1: 0.5963
 epoch: 22, train_loss: 0.6905, test_loss: 1.0690, test_f1: 0.6189
 epoch: 23, train_loss: 0.6669, test_loss: 1.0953, test_f1: 0.6306
 epoch: 24, train_loss: 0.6603, test_loss: 1.0689, test_f1: 0.6319
 epoch: 25, train_loss: 0.6287, test_loss: 1.1556, test_f1: 0.6128
 epoch: 26, train_loss: 0.6170, test_loss: 1.1633, test_f1: 0.6042
 epoch: 27, train_loss: 0.6211, test_loss: 1.1574, test_f1: 0.5864
 epoch: 28, train_loss: 0.6059, test_loss: 1.1818, test_f1: 0.6116
 epoch: 29, train_loss: 0.6156, test_loss: 1.1456, test_f1: 0.6375
 epoch: 30, train_loss: 0.6143, test_loss: 1.1958, test_f1: 0.6327
 epoch: 31, train_loss: 0.5968, test_loss: 1.1584, test_f1: 0.6148
 epoch: 32, train_loss: 0.5716, test_loss: 1.2671, test_f1: 0.5848
 epoch: 33, train_loss: 0.5841, test_loss: 1.2150, test_f1: 0.6215
 epoch: 34, train_loss: 0.5523, test_loss: 1.3229, test_f1: 0.6050
 epoch: 35, train_loss: 0.5489, test_loss: 1.2466, test_f1: 0.6274
 epoch: 36, train_loss: 0.5367, test_loss: 1.2754, test_f1: 0.6484
 epoch: 37, train_loss: 0.5412, test_loss: 1.2581, test_f1: 0.6223
 epoch: 38, train_loss: 0.5324, test_loss: 1.2438, test_f1: 0.6346
 epoch: 39, train_loss: 0.5134, test_loss: 1.2767, test_f1: 0.6166
 epoch: 40, train_loss: 0.5700, test_loss: 1.2163, test_f1: 0.6009
 epoch: 41, train_loss: 0.5757, test_loss: 1.2430, test_f1: 0.6305
 epoch: 42, train_loss: 0.5443, test_loss: 1.2855, test_f1: 0.6501
 epoch: 43, train_loss: 0.5229, test_loss: 1.2184, test_f1: 0.6468
 epoch: 44, train_loss: 0.5039, test_loss: 1.1853, test_f1: 0.6429
 epoch: 45, train_loss: 0.4899, test_loss: 1.2488, test_f1: 0.6223
 epoch: 46, train_loss: 0.4918, test_loss: 1.3589, test_f1: 0.6256
 epoch: 47, train_loss: 0.4547, test_loss: 1.3702, test_f1: 0.6596
 epoch: 48, train_loss: 0.4844, test_loss: 1.4603, test_f1: 0.6158
 epoch: 49, train_loss: 0.4501, test_loss: 1.3308, test_f1: 0.6328
 epoch: 50, train_loss: 0.4479, test_loss: 1.4761, test_f1: 0.6347
 epoch: 51, train_loss: 0.3927, test_loss: 1.5788, test_f1: 0.6280
 epoch: 52, train_loss: 0.3849, test_loss: 1.4928, test_f1: 0.6011
 epoch: 53, train_loss: 0.3645, test_loss: 1.5774, test_f1: 0.6431
 epoch: 54, train_loss: 0.3415, test_loss: 1.6652, test_f1: 0.6422
 epoch: 55, train_loss: 0.3462, test_loss: 1.6223, test_f1: 0.6221
 epoch: 56, train_loss: 0.3357, test_loss: 1.6884, test_f1: 0.6411
 epoch: 57, train_loss: 0.3328, test_loss: 1.7570, test_f1: 0.6662
 epoch: 58, train_loss: 0.3405, test_loss: 1.7455, test_f1: 0.6252
 epoch: 59, train_loss: 0.3219, test_loss: 1.6512, test_f1: 0.6464
 epoch: 60, train_loss: 0.3131, test_loss: 1.7587, test_f1: 0.6048
 epoch: 61, train_loss: 0.3243, test_loss: 1.6568, test_f1: 0.6757
 epoch: 62, train_loss: 0.2953, test_loss: 1.8820, test_f1: 0.6188
 epoch: 63, train_loss: 0.3089, test_loss: 1.7203, test_f1: 0.6743
 epoch: 64, train_loss: 0.3089, test_loss: 1.8762, test_f1: 0.6372
 epoch: 65, train_loss: 0.3007, test_loss: 1.9081, test_f1: 0.6107
 epoch: 66, train_loss: 0.2974, test_loss: 1.8042, test_f1: 0.6464
 epoch: 67, train_loss: 0.2941, test_loss: 1.9198, test_f1: 0.6474
 epoch: 68, train_loss: 0.2892, test_loss: 1.8123, test_f1: 0.6351
 epoch: 69, train_loss: 0.2720, test_loss: 1.9623, test_f1: 0.6562
 epoch: 70, train_loss: 0.2607, test_loss: 1.8436, test_f1: 0.6625
 epoch: 71, train_loss: 0.2669, test_loss: 2.0234, test_f1: 0.6350
 epoch: 72, train_loss: 0.2559, test_loss: 1.9775, test_f1: 0.6677
 epoch: 73, train_loss: 0.2452, test_loss: 1.8813, test_f1: 0.6471
 epoch: 74, train_loss: 0.2521, test_loss: 2.1828, test_f1: 0.6430
 epoch: 75, train_loss: 0.2931, test_loss: 2.0538, test_f1: 0.6575
 epoch: 76, train_loss: 0.2693, test_loss: 1.9451, test_f1: 0.6486
 epoch: 77, train_loss: 0.2519, test_loss: 2.1821, test_f1: 0.6640
 epoch: 78, train_loss: 0.2653, test_loss: 2.0444, test_f1: 0.6607
 epoch: 79, train_loss: 0.2547, test_loss: 2.1781, test_f1: 0.6599
 epoch: 80, train_loss: 0.2469, test_loss: 1.9599, test_f1: 0.6604
 epoch: 81, train_loss: 0.2566, test_loss: 1.9585, test_f1: 0.6413
 epoch: 82, train_loss: 0.2610, test_loss: 2.0114, test_f1: 0.6405
 epoch: 83, train_loss: 0.2566, test_loss: 2.1967, test_f1: 0.6401
 epoch: 84, train_loss: 0.2395, test_loss: 2.1406, test_f1: 0.6362
 epoch: 85, train_loss: 0.2475, test_loss: 2.1618, test_f1: 0.6302
 epoch: 86, train_loss: 0.2352, test_loss: 2.1004, test_f1: 0.6342
 epoch: 87, train_loss: 0.2268, test_loss: 2.0901, test_f1: 0.6416
 epoch: 88, train_loss: 0.2264, test_loss: 2.3076, test_f1: 0.6298
 epoch: 89, train_loss: 0.2274, test_loss: 2.2067, test_f1: 0.6305
 epoch: 90, train_loss: 0.2521, test_loss: 2.1219, test_f1: 0.6189
 epoch: 91, train_loss: 0.2015, test_loss: 2.3122, test_f1: 0.6418
 epoch: 92, train_loss: 0.1941, test_loss: 2.3488, test_f1: 0.6434
 epoch: 93, train_loss: 0.1972, test_loss: 2.5348, test_f1: 0.6389
 epoch: 94, train_loss: 0.2094, test_loss: 2.3316, test_f1: 0.6286
 epoch: 95, train_loss: 0.1987, test_loss: 2.3639, test_f1: 0.6454
 epoch: 96, train_loss: 0.2113, test_loss: 2.4066, test_f1: 0.6286
 epoch: 97, train_loss: 0.1952, test_loss: 2.3375, test_f1: 0.6426
 epoch: 98, train_loss: 0.1958, test_loss: 2.3306, test_f1: 0.6581
 epoch: 99, train_loss: 0.1859, test_loss: 2.5806, test_f1: 0.6362
##################ITERATION #4 ****************************************
 epoch: 0, train_loss: 1.3071, test_loss: 1.2024, test_f1: 0.4080
 epoch: 1, train_loss: 1.0471, test_loss: 0.9964, test_f1: 0.4655
 epoch: 2, train_loss: 0.9643, test_loss: 0.9095, test_f1: 0.4821
 epoch: 3, train_loss: 0.9390, test_loss: 0.9352, test_f1: 0.5065
 epoch: 4, train_loss: 0.9048, test_loss: 0.9469, test_f1: 0.5203
 epoch: 5, train_loss: 0.8807, test_loss: 0.9394, test_f1: 0.5262
 epoch: 6, train_loss: 0.8731, test_loss: 0.9657, test_f1: 0.5356
 epoch: 7, train_loss: 0.8419, test_loss: 0.9663, test_f1: 0.5201
 epoch: 8, train_loss: 0.8393, test_loss: 0.9646, test_f1: 0.5710
 epoch: 9, train_loss: 0.8260, test_loss: 0.9626, test_f1: 0.5637
 epoch: 10, train_loss: 0.8110, test_loss: 0.9154, test_f1: 0.5353
 epoch: 11, train_loss: 0.8067, test_loss: 0.9925, test_f1: 0.5604
 epoch: 12, train_loss: 0.7874, test_loss: 1.0140, test_f1: 0.5537
 epoch: 13, train_loss: 0.7819, test_loss: 0.9899, test_f1: 0.5873
 epoch: 14, train_loss: 0.7629, test_loss: 0.9631, test_f1: 0.5808
 epoch: 15, train_loss: 0.7704, test_loss: 0.9552, test_f1: 0.5990
 epoch: 16, train_loss: 0.7667, test_loss: 1.0279, test_f1: 0.5517
 epoch: 17, train_loss: 0.7410, test_loss: 1.0169, test_f1: 0.5683
 epoch: 18, train_loss: 0.7251, test_loss: 1.0686, test_f1: 0.5675
 epoch: 19, train_loss: 0.7205, test_loss: 1.0289, test_f1: 0.5925
 epoch: 20, train_loss: 0.7231, test_loss: 1.0204, test_f1: 0.6035
 epoch: 21, train_loss: 0.7073, test_loss: 1.0077, test_f1: 0.6061
 epoch: 22, train_loss: 0.6974, test_loss: 1.0110, test_f1: 0.5823
 epoch: 23, train_loss: 0.6947, test_loss: 1.0066, test_f1: 0.6114
 epoch: 24, train_loss: 0.6829, test_loss: 1.1078, test_f1: 0.5735
 epoch: 25, train_loss: 0.7050, test_loss: 1.0868, test_f1: 0.6039
 epoch: 26, train_loss: 0.6869, test_loss: 1.0212, test_f1: 0.5726
 epoch: 27, train_loss: 0.6505, test_loss: 1.0126, test_f1: 0.6005
 epoch: 28, train_loss: 0.6380, test_loss: 1.0148, test_f1: 0.6238
 epoch: 29, train_loss: 0.6205, test_loss: 1.1948, test_f1: 0.6099
 epoch: 30, train_loss: 0.6492, test_loss: 1.0318, test_f1: 0.6142
 epoch: 31, train_loss: 0.6449, test_loss: 1.0083, test_f1: 0.6300
 epoch: 32, train_loss: 0.6302, test_loss: 1.0545, test_f1: 0.6400
 epoch: 33, train_loss: 0.6397, test_loss: 1.1051, test_f1: 0.5693
 epoch: 34, train_loss: 0.6134, test_loss: 1.1184, test_f1: 0.6174
 epoch: 35, train_loss: 0.5923, test_loss: 1.0106, test_f1: 0.6236
 epoch: 36, train_loss: 0.5835, test_loss: 1.0894, test_f1: 0.6173
 epoch: 37, train_loss: 0.5700, test_loss: 1.1112, test_f1: 0.6240
 epoch: 38, train_loss: 0.5581, test_loss: 1.1072, test_f1: 0.6128
 epoch: 39, train_loss: 0.5457, test_loss: 1.1449, test_f1: 0.6003
 epoch: 40, train_loss: 0.5684, test_loss: 1.1567, test_f1: 0.6022
 epoch: 41, train_loss: 0.5540, test_loss: 1.1513, test_f1: 0.6044
 epoch: 42, train_loss: 0.5405, test_loss: 1.1246, test_f1: 0.6358
 epoch: 43, train_loss: 0.5192, test_loss: 1.1336, test_f1: 0.6120
 epoch: 44, train_loss: 0.5235, test_loss: 1.1882, test_f1: 0.6585
 epoch: 45, train_loss: 0.5030, test_loss: 1.1415, test_f1: 0.6075
 epoch: 46, train_loss: 0.4782, test_loss: 1.1700, test_f1: 0.6209
 epoch: 47, train_loss: 0.4904, test_loss: 1.2570, test_f1: 0.6105
 epoch: 48, train_loss: 0.4918, test_loss: 1.2670, test_f1: 0.6013
 epoch: 49, train_loss: 0.4808, test_loss: 1.2339, test_f1: 0.6117
 epoch: 50, train_loss: 0.4687, test_loss: 1.3315, test_f1: 0.6176
 epoch: 51, train_loss: 0.4314, test_loss: 1.2946, test_f1: 0.6275
 epoch: 52, train_loss: 0.3925, test_loss: 1.2890, test_f1: 0.6220
 epoch: 53, train_loss: 0.3789, test_loss: 1.3771, test_f1: 0.6342
 epoch: 54, train_loss: 0.3762, test_loss: 1.3328, test_f1: 0.6277
 epoch: 55, train_loss: 0.3613, test_loss: 1.4043, test_f1: 0.6326
 epoch: 56, train_loss: 0.3428, test_loss: 1.3672, test_f1: 0.6455
 epoch: 57, train_loss: 0.3328, test_loss: 1.4176, test_f1: 0.6238
 epoch: 58, train_loss: 0.3388, test_loss: 1.4559, test_f1: 0.6450
 epoch: 59, train_loss: 0.3331, test_loss: 1.4725, test_f1: 0.6589
 epoch: 60, train_loss: 0.3311, test_loss: 1.4184, test_f1: 0.6210
 epoch: 61, train_loss: 0.3164, test_loss: 1.5250, test_f1: 0.6640
 epoch: 62, train_loss: 0.3106, test_loss: 1.5046, test_f1: 0.6176
 epoch: 63, train_loss: 0.3160, test_loss: 1.6294, test_f1: 0.6282
 epoch: 64, train_loss: 0.3249, test_loss: 1.5818, test_f1: 0.6166
 epoch: 65, train_loss: 0.3265, test_loss: 1.6292, test_f1: 0.6563
 epoch: 66, train_loss: 0.3209, test_loss: 1.5587, test_f1: 0.6317
 epoch: 67, train_loss: 0.2941, test_loss: 1.5242, test_f1: 0.6445
 epoch: 68, train_loss: 0.3054, test_loss: 1.6265, test_f1: 0.6601
 epoch: 69, train_loss: 0.2964, test_loss: 1.5842, test_f1: 0.6402
 epoch: 70, train_loss: 0.3039, test_loss: 1.6954, test_f1: 0.6389
 epoch: 71, train_loss: 0.2754, test_loss: 1.6305, test_f1: 0.6216
 epoch: 72, train_loss: 0.2674, test_loss: 1.7786, test_f1: 0.6287
 epoch: 73, train_loss: 0.2652, test_loss: 1.7177, test_f1: 0.6333
 epoch: 74, train_loss: 0.2811, test_loss: 1.7249, test_f1: 0.6208
 epoch: 75, train_loss: 0.2618, test_loss: 1.8130, test_f1: 0.6260
 epoch: 76, train_loss: 0.2555, test_loss: 1.7004, test_f1: 0.6230
 epoch: 77, train_loss: 0.2699, test_loss: 1.7984, test_f1: 0.6281
 epoch: 78, train_loss: 0.2668, test_loss: 1.7223, test_f1: 0.6636
 epoch: 79, train_loss: 0.2831, test_loss: 1.6987, test_f1: 0.6541
 epoch: 80, train_loss: 0.2490, test_loss: 1.8942, test_f1: 0.6125
 epoch: 81, train_loss: 0.2338, test_loss: 1.8102, test_f1: 0.6552
 epoch: 82, train_loss: 0.2460, test_loss: 1.8820, test_f1: 0.6448
 epoch: 83, train_loss: 0.2497, test_loss: 1.9251, test_f1: 0.6491
 epoch: 84, train_loss: 0.2397, test_loss: 1.9253, test_f1: 0.6287
 epoch: 85, train_loss: 0.2439, test_loss: 2.0037, test_f1: 0.6571
 epoch: 86, train_loss: 0.2327, test_loss: 1.9420, test_f1: 0.6319
 epoch: 87, train_loss: 0.2405, test_loss: 1.9553, test_f1: 0.6192
 epoch: 88, train_loss: 0.2353, test_loss: 1.8579, test_f1: 0.6263
 epoch: 89, train_loss: 0.2498, test_loss: 1.9822, test_f1: 0.6238
 epoch: 90, train_loss: 0.2176, test_loss: 1.9620, test_f1: 0.6309
 epoch: 91, train_loss: 0.2281, test_loss: 2.0846, test_f1: 0.6107
 epoch: 92, train_loss: 0.2013, test_loss: 2.0776, test_f1: 0.6512
 epoch: 93, train_loss: 0.2009, test_loss: 1.9445, test_f1: 0.6389
 epoch: 94, train_loss: 0.2282, test_loss: 2.0058, test_f1: 0.6312
 epoch: 95, train_loss: 0.2102, test_loss: 1.9461, test_f1: 0.6506
 epoch: 96, train_loss: 0.2057, test_loss: 2.1136, test_f1: 0.6153
 epoch: 97, train_loss: 0.2146, test_loss: 2.1875, test_f1: 0.6129
 epoch: 98, train_loss: 0.2087, test_loss: 2.0460, test_f1: 0.6454
 epoch: 99, train_loss: 0.2104, test_loss: 2.1286, test_f1: 0.6468
##################ITERATION #5 ****************************************
 epoch: 0, train_loss: 1.3174, test_loss: 1.1262, test_f1: 0.3677
 epoch: 1, train_loss: 1.0276, test_loss: 0.9437, test_f1: 0.5116
 epoch: 2, train_loss: 0.9670, test_loss: 0.9544, test_f1: 0.4659
 epoch: 3, train_loss: 0.9387, test_loss: 0.9424, test_f1: 0.4844
 epoch: 4, train_loss: 0.9034, test_loss: 0.9274, test_f1: 0.5050
 epoch: 5, train_loss: 0.8881, test_loss: 0.9614, test_f1: 0.4839
 epoch: 6, train_loss: 0.8896, test_loss: 0.9329, test_f1: 0.5170
 epoch: 7, train_loss: 0.8659, test_loss: 0.9433, test_f1: 0.5228
 epoch: 8, train_loss: 0.8520, test_loss: 0.9227, test_f1: 0.5475
 epoch: 9, train_loss: 0.8285, test_loss: 0.9889, test_f1: 0.5116
 epoch: 10, train_loss: 0.8273, test_loss: 0.9439, test_f1: 0.5402
 epoch: 11, train_loss: 0.8046, test_loss: 0.9680, test_f1: 0.5557
 epoch: 12, train_loss: 0.8063, test_loss: 0.9983, test_f1: 0.5263
 epoch: 13, train_loss: 0.7938, test_loss: 0.9582, test_f1: 0.5707
 epoch: 14, train_loss: 0.7627, test_loss: 0.9769, test_f1: 0.5802
 epoch: 15, train_loss: 0.7587, test_loss: 0.9556, test_f1: 0.5765
 epoch: 16, train_loss: 0.7597, test_loss: 1.0132, test_f1: 0.5147
 epoch: 17, train_loss: 0.7288, test_loss: 0.9556, test_f1: 0.5886
 epoch: 18, train_loss: 0.7318, test_loss: 0.9879, test_f1: 0.5766
 epoch: 19, train_loss: 0.7240, test_loss: 0.9733, test_f1: 0.5529
 epoch: 20, train_loss: 0.7075, test_loss: 1.0359, test_f1: 0.5769
 epoch: 21, train_loss: 0.7226, test_loss: 0.9633, test_f1: 0.5788
 epoch: 22, train_loss: 0.7030, test_loss: 0.9358, test_f1: 0.5735
 epoch: 23, train_loss: 0.6927, test_loss: 0.9573, test_f1: 0.6086
 epoch: 24, train_loss: 0.6977, test_loss: 1.0674, test_f1: 0.5705
 epoch: 25, train_loss: 0.6733, test_loss: 0.9395, test_f1: 0.5997
 epoch: 26, train_loss: 0.6364, test_loss: 1.0462, test_f1: 0.6258
 epoch: 27, train_loss: 0.6402, test_loss: 0.9641, test_f1: 0.6025
 epoch: 28, train_loss: 0.6629, test_loss: 0.9969, test_f1: 0.6210
 epoch: 29, train_loss: 0.6276, test_loss: 1.0710, test_f1: 0.6020
 epoch: 30, train_loss: 0.6452, test_loss: 1.1353, test_f1: 0.5906
 epoch: 31, train_loss: 0.6507, test_loss: 1.1434, test_f1: 0.6064
 epoch: 32, train_loss: 0.6188, test_loss: 1.0368, test_f1: 0.5966
 epoch: 33, train_loss: 0.6079, test_loss: 1.0934, test_f1: 0.5631
 epoch: 34, train_loss: 0.6158, test_loss: 0.9902, test_f1: 0.5939
 epoch: 35, train_loss: 0.6063, test_loss: 1.0747, test_f1: 0.5959
 epoch: 36, train_loss: 0.5840, test_loss: 1.1643, test_f1: 0.5607
 epoch: 37, train_loss: 0.5971, test_loss: 1.1163, test_f1: 0.5867
 epoch: 38, train_loss: 0.5680, test_loss: 1.1048, test_f1: 0.6217
 epoch: 39, train_loss: 0.5720, test_loss: 1.0776, test_f1: 0.6187
 epoch: 40, train_loss: 0.5935, test_loss: 1.0192, test_f1: 0.6262
 epoch: 41, train_loss: 0.5777, test_loss: 1.1349, test_f1: 0.6275
 epoch: 42, train_loss: 0.5361, test_loss: 1.1246, test_f1: 0.6072
 epoch: 43, train_loss: 0.5244, test_loss: 1.1060, test_f1: 0.5764
 epoch: 44, train_loss: 0.5247, test_loss: 1.1996, test_f1: 0.6174
 epoch: 45, train_loss: 0.5305, test_loss: 1.1188, test_f1: 0.6234
 epoch: 46, train_loss: 0.5194, test_loss: 1.1193, test_f1: 0.6145
 epoch: 47, train_loss: 0.5034, test_loss: 1.1353, test_f1: 0.6078
 epoch: 48, train_loss: 0.5161, test_loss: 1.1138, test_f1: 0.6222
 epoch: 49, train_loss: 0.5011, test_loss: 1.2239, test_f1: 0.5932
 epoch: 50, train_loss: 0.4833, test_loss: 1.1750, test_f1: 0.6345
 epoch: 51, train_loss: 0.4367, test_loss: 1.1883, test_f1: 0.6226
 epoch: 52, train_loss: 0.4095, test_loss: 1.2451, test_f1: 0.6163
 epoch: 53, train_loss: 0.3880, test_loss: 1.2024, test_f1: 0.6441
 epoch: 54, train_loss: 0.3798, test_loss: 1.2808, test_f1: 0.6234
 epoch: 55, train_loss: 0.3821, test_loss: 1.3375, test_f1: 0.6270
 epoch: 56, train_loss: 0.3753, test_loss: 1.3768, test_f1: 0.6224
 epoch: 57, train_loss: 0.3876, test_loss: 1.3062, test_f1: 0.6422
 epoch: 58, train_loss: 0.3699, test_loss: 1.3820, test_f1: 0.6454
 epoch: 59, train_loss: 0.3622, test_loss: 1.3775, test_f1: 0.6238
 epoch: 60, train_loss: 0.3542, test_loss: 1.4169, test_f1: 0.6401
 epoch: 61, train_loss: 0.3354, test_loss: 1.4577, test_f1: 0.6067
 epoch: 62, train_loss: 0.3698, test_loss: 1.3827, test_f1: 0.6364
 epoch: 63, train_loss: 0.3371, test_loss: 1.4442, test_f1: 0.6129
 epoch: 64, train_loss: 0.3521, test_loss: 1.5155, test_f1: 0.6193
 epoch: 65, train_loss: 0.3515, test_loss: 1.4303, test_f1: 0.5960
 epoch: 66, train_loss: 0.3290, test_loss: 1.4782, test_f1: 0.5995
 epoch: 67, train_loss: 0.3430, test_loss: 1.3978, test_f1: 0.6217
 epoch: 68, train_loss: 0.3403, test_loss: 1.4763, test_f1: 0.6271
 epoch: 69, train_loss: 0.3057, test_loss: 1.4946, test_f1: 0.6426
 epoch: 70, train_loss: 0.3190, test_loss: 1.4362, test_f1: 0.6368
 epoch: 71, train_loss: 0.3009, test_loss: 1.4200, test_f1: 0.6565
 epoch: 72, train_loss: 0.3128, test_loss: 1.5704, test_f1: 0.6277
 epoch: 73, train_loss: 0.3141, test_loss: 1.5393, test_f1: 0.6296
 epoch: 74, train_loss: 0.3092, test_loss: 1.3856, test_f1: 0.6537
 epoch: 75, train_loss: 0.2887, test_loss: 1.5008, test_f1: 0.6345
 epoch: 76, train_loss: 0.2921, test_loss: 1.5603, test_f1: 0.6354
 epoch: 77, train_loss: 0.2914, test_loss: 1.6477, test_f1: 0.6234
 epoch: 78, train_loss: 0.2672, test_loss: 1.6949, test_f1: 0.6251
 epoch: 79, train_loss: 0.2859, test_loss: 1.6320, test_f1: 0.6237
 epoch: 80, train_loss: 0.2702, test_loss: 1.6645, test_f1: 0.6277
 epoch: 81, train_loss: 0.2592, test_loss: 1.6899, test_f1: 0.6270
 epoch: 82, train_loss: 0.2628, test_loss: 1.5653, test_f1: 0.6366
 epoch: 83, train_loss: 0.2533, test_loss: 1.7072, test_f1: 0.6278
 epoch: 84, train_loss: 0.2507, test_loss: 1.6191, test_f1: 0.6285
 epoch: 85, train_loss: 0.2563, test_loss: 1.7045, test_f1: 0.6375
 epoch: 86, train_loss: 0.2412, test_loss: 1.7521, test_f1: 0.6132
 epoch: 87, train_loss: 0.2461, test_loss: 1.7592, test_f1: 0.6195
 epoch: 88, train_loss: 0.2654, test_loss: 1.7096, test_f1: 0.6261
 epoch: 89, train_loss: 0.2356, test_loss: 1.8755, test_f1: 0.6005
 epoch: 90, train_loss: 0.2421, test_loss: 1.7796, test_f1: 0.6151
 epoch: 91, train_loss: 0.2313, test_loss: 1.8066, test_f1: 0.6274
 epoch: 92, train_loss: 0.2310, test_loss: 1.9706, test_f1: 0.6226
 epoch: 93, train_loss: 0.2358, test_loss: 1.7804, test_f1: 0.6328
 epoch: 94, train_loss: 0.2308, test_loss: 1.9563, test_f1: 0.6149
 epoch: 95, train_loss: 0.2287, test_loss: 1.9141, test_f1: 0.6167
 epoch: 96, train_loss: 0.2405, test_loss: 1.8753, test_f1: 0.6382
 epoch: 97, train_loss: 0.2261, test_loss: 1.7333, test_f1: 0.6488
 epoch: 98, train_loss: 0.2135, test_loss: 1.8895, test_f1: 0.6324
 epoch: 99, train_loss: 0.2106, test_loss: 2.0441, test_f1: 0.6401
##################ITERATION #6 ****************************************
 epoch: 0, train_loss: 1.3685, test_loss: 1.2751, test_f1: 0.2826
 epoch: 1, train_loss: 1.0406, test_loss: 1.0090, test_f1: 0.4728
 epoch: 2, train_loss: 0.9832, test_loss: 0.9922, test_f1: 0.4833
 epoch: 3, train_loss: 0.9301, test_loss: 0.9922, test_f1: 0.4812
 epoch: 4, train_loss: 0.9086, test_loss: 0.9670, test_f1: 0.5241
 epoch: 5, train_loss: 0.8925, test_loss: 0.9494, test_f1: 0.5271
 epoch: 6, train_loss: 0.8791, test_loss: 0.9399, test_f1: 0.5068
 epoch: 7, train_loss: 0.8504, test_loss: 1.0070, test_f1: 0.5080
 epoch: 8, train_loss: 0.8394, test_loss: 0.9916, test_f1: 0.5401
 epoch: 9, train_loss: 0.8387, test_loss: 0.9541, test_f1: 0.5450
 epoch: 10, train_loss: 0.8337, test_loss: 0.9729, test_f1: 0.5334
 epoch: 11, train_loss: 0.8046, test_loss: 0.9457, test_f1: 0.5393
 epoch: 12, train_loss: 0.7938, test_loss: 0.9554, test_f1: 0.5583
 epoch: 13, train_loss: 0.7809, test_loss: 0.9086, test_f1: 0.5426
 epoch: 14, train_loss: 0.7816, test_loss: 0.9441, test_f1: 0.5725
 epoch: 15, train_loss: 0.7527, test_loss: 0.9806, test_f1: 0.5244
 epoch: 16, train_loss: 0.7397, test_loss: 0.9128, test_f1: 0.5849
 epoch: 17, train_loss: 0.7516, test_loss: 0.9999, test_f1: 0.5683
 epoch: 18, train_loss: 0.7465, test_loss: 1.0552, test_f1: 0.5683
 epoch: 19, train_loss: 0.7208, test_loss: 0.9805, test_f1: 0.5883
 epoch: 20, train_loss: 0.7124, test_loss: 0.9691, test_f1: 0.5920
 epoch: 21, train_loss: 0.7187, test_loss: 0.9816, test_f1: 0.5764
 epoch: 22, train_loss: 0.7112, test_loss: 0.9484, test_f1: 0.5786
 epoch: 23, train_loss: 0.6919, test_loss: 0.9956, test_f1: 0.6075
 epoch: 24, train_loss: 0.6965, test_loss: 1.0570, test_f1: 0.5651
 epoch: 25, train_loss: 0.7013, test_loss: 0.8857, test_f1: 0.6194
 epoch: 26, train_loss: 0.6794, test_loss: 0.9782, test_f1: 0.5763
 epoch: 27, train_loss: 0.6461, test_loss: 1.1032, test_f1: 0.5919
 epoch: 28, train_loss: 0.6658, test_loss: 0.9838, test_f1: 0.5993
 epoch: 29, train_loss: 0.6410, test_loss: 1.0504, test_f1: 0.6113
 epoch: 30, train_loss: 0.6226, test_loss: 1.0185, test_f1: 0.6307
 epoch: 31, train_loss: 0.6205, test_loss: 1.1233, test_f1: 0.5560
 epoch: 32, train_loss: 0.6030, test_loss: 1.0054, test_f1: 0.6253
 epoch: 33, train_loss: 0.5927, test_loss: 1.0646, test_f1: 0.6251
 epoch: 34, train_loss: 0.5995, test_loss: 1.0914, test_f1: 0.6066
 epoch: 35, train_loss: 0.5929, test_loss: 1.0348, test_f1: 0.6103
 epoch: 36, train_loss: 0.5885, test_loss: 1.3026, test_f1: 0.5711
 epoch: 37, train_loss: 0.5751, test_loss: 1.1720, test_f1: 0.6099
 epoch: 38, train_loss: 0.5646, test_loss: 1.2233, test_f1: 0.6105
 epoch: 39, train_loss: 0.5894, test_loss: 1.1926, test_f1: 0.5980
 epoch: 40, train_loss: 0.5769, test_loss: 1.1136, test_f1: 0.5974
 epoch: 41, train_loss: 0.5637, test_loss: 1.1250, test_f1: 0.6091
 epoch: 42, train_loss: 0.5452, test_loss: 1.1586, test_f1: 0.6538
 epoch: 43, train_loss: 0.5501, test_loss: 1.1067, test_f1: 0.6239
 epoch: 44, train_loss: 0.5107, test_loss: 1.1591, test_f1: 0.6326
 epoch: 45, train_loss: 0.5182, test_loss: 1.0527, test_f1: 0.6317
 epoch: 46, train_loss: 0.5215, test_loss: 1.1447, test_f1: 0.6506
 epoch: 47, train_loss: 0.5264, test_loss: 1.1366, test_f1: 0.6084
 epoch: 48, train_loss: 0.5195, test_loss: 1.0842, test_f1: 0.6509
 epoch: 49, train_loss: 0.5084, test_loss: 1.2936, test_f1: 0.6033
 epoch: 50, train_loss: 0.4767, test_loss: 1.2338, test_f1: 0.6085
 epoch: 51, train_loss: 0.4605, test_loss: 1.2047, test_f1: 0.6457
 epoch: 52, train_loss: 0.4051, test_loss: 1.2452, test_f1: 0.6309
 epoch: 53, train_loss: 0.3997, test_loss: 1.1591, test_f1: 0.6468
 epoch: 54, train_loss: 0.3756, test_loss: 1.3129, test_f1: 0.6212
 epoch: 55, train_loss: 0.3867, test_loss: 1.3026, test_f1: 0.6538
 epoch: 56, train_loss: 0.3741, test_loss: 1.3147, test_f1: 0.6165
 epoch: 57, train_loss: 0.3680, test_loss: 1.3454, test_f1: 0.6352
 epoch: 58, train_loss: 0.3587, test_loss: 1.4482, test_f1: 0.6210
 epoch: 59, train_loss: 0.3442, test_loss: 1.4060, test_f1: 0.6506
 epoch: 60, train_loss: 0.3402, test_loss: 1.3604, test_f1: 0.6317
 epoch: 61, train_loss: 0.3521, test_loss: 1.5098, test_f1: 0.6183
 epoch: 62, train_loss: 0.3531, test_loss: 1.4554, test_f1: 0.6222
 epoch: 63, train_loss: 0.3611, test_loss: 1.4724, test_f1: 0.6419
 epoch: 64, train_loss: 0.3105, test_loss: 1.4103, test_f1: 0.6391
 epoch: 65, train_loss: 0.3053, test_loss: 1.3862, test_f1: 0.6470
 epoch: 66, train_loss: 0.3215, test_loss: 1.4299, test_f1: 0.6355
 epoch: 67, train_loss: 0.3352, test_loss: 1.4818, test_f1: 0.6277
 epoch: 68, train_loss: 0.3150, test_loss: 1.5943, test_f1: 0.6348
 epoch: 69, train_loss: 0.2857, test_loss: 1.4303, test_f1: 0.6319
 epoch: 70, train_loss: 0.2891, test_loss: 1.6831, test_f1: 0.6221
 epoch: 71, train_loss: 0.2973, test_loss: 1.5225, test_f1: 0.6373
 epoch: 72, train_loss: 0.3078, test_loss: 1.4711, test_f1: 0.6493
 epoch: 73, train_loss: 0.2893, test_loss: 1.6154, test_f1: 0.6415
 epoch: 74, train_loss: 0.2851, test_loss: 1.7254, test_f1: 0.6422
 epoch: 75, train_loss: 0.2909, test_loss: 1.5928, test_f1: 0.6371
 epoch: 76, train_loss: 0.3151, test_loss: 1.5648, test_f1: 0.6400
 epoch: 77, train_loss: 0.2768, test_loss: 1.5986, test_f1: 0.6463
 epoch: 78, train_loss: 0.2760, test_loss: 1.6434, test_f1: 0.6392
 epoch: 79, train_loss: 0.2732, test_loss: 1.7280, test_f1: 0.6457
 epoch: 80, train_loss: 0.2960, test_loss: 1.5236, test_f1: 0.6413
 epoch: 81, train_loss: 0.2647, test_loss: 1.6333, test_f1: 0.6423
 epoch: 82, train_loss: 0.2528, test_loss: 1.7653, test_f1: 0.6525
 epoch: 83, train_loss: 0.2501, test_loss: 1.7121, test_f1: 0.6414
 epoch: 84, train_loss: 0.2650, test_loss: 1.6606, test_f1: 0.6500
 epoch: 85, train_loss: 0.2544, test_loss: 1.9431, test_f1: 0.6263
 epoch: 86, train_loss: 0.2607, test_loss: 1.6587, test_f1: 0.6463
 epoch: 87, train_loss: 0.2630, test_loss: 1.7541, test_f1: 0.6267
 epoch: 88, train_loss: 0.2587, test_loss: 1.6231, test_f1: 0.6286
 epoch: 89, train_loss: 0.2612, test_loss: 1.7224, test_f1: 0.6182
 epoch: 90, train_loss: 0.2446, test_loss: 1.7291, test_f1: 0.6305
 epoch: 91, train_loss: 0.2364, test_loss: 1.8123, test_f1: 0.6414
 epoch: 92, train_loss: 0.2516, test_loss: 1.9180, test_f1: 0.6125
 epoch: 93, train_loss: 0.2411, test_loss: 1.8172, test_f1: 0.6304
 epoch: 94, train_loss: 0.2354, test_loss: 1.9009, test_f1: 0.6373
 epoch: 95, train_loss: 0.2219, test_loss: 1.7388, test_f1: 0.6349
 epoch: 96, train_loss: 0.2189, test_loss: 1.7891, test_f1: 0.6756
 epoch: 97, train_loss: 0.2320, test_loss: 1.9333, test_f1: 0.6185
 epoch: 98, train_loss: 0.2289, test_loss: 1.6800, test_f1: 0.6591
 epoch: 99, train_loss: 0.2359, test_loss: 1.8240, test_f1: 0.6427
##################ITERATION #7 ****************************************
 epoch: 0, train_loss: 1.3286, test_loss: 1.2070, test_f1: 0.2820
 epoch: 1, train_loss: 1.0456, test_loss: 1.0392, test_f1: 0.4276
 epoch: 2, train_loss: 0.9865, test_loss: 0.9894, test_f1: 0.4541
 epoch: 3, train_loss: 0.9374, test_loss: 0.9389, test_f1: 0.5190
 epoch: 4, train_loss: 0.9087, test_loss: 0.9425, test_f1: 0.5274
 epoch: 5, train_loss: 0.8857, test_loss: 0.9108, test_f1: 0.5341
 epoch: 6, train_loss: 0.8781, test_loss: 0.9778, test_f1: 0.5266
 epoch: 7, train_loss: 0.8522, test_loss: 1.0209, test_f1: 0.5376
 epoch: 8, train_loss: 0.8280, test_loss: 0.9293, test_f1: 0.5421
 epoch: 9, train_loss: 0.8162, test_loss: 0.9633, test_f1: 0.5347
 epoch: 10, train_loss: 0.8072, test_loss: 0.9480, test_f1: 0.5488
 epoch: 11, train_loss: 0.8126, test_loss: 0.9369, test_f1: 0.5217
 epoch: 12, train_loss: 0.7972, test_loss: 1.0310, test_f1: 0.5658
 epoch: 13, train_loss: 0.7739, test_loss: 0.9889, test_f1: 0.5549
 epoch: 14, train_loss: 0.7550, test_loss: 0.9603, test_f1: 0.5617
 epoch: 15, train_loss: 0.7385, test_loss: 1.0013, test_f1: 0.5799
 epoch: 16, train_loss: 0.7505, test_loss: 0.9773, test_f1: 0.5921
 epoch: 17, train_loss: 0.7300, test_loss: 0.9773, test_f1: 0.6066
 epoch: 18, train_loss: 0.7260, test_loss: 0.9536, test_f1: 0.5755
 epoch: 19, train_loss: 0.7113, test_loss: 0.9328, test_f1: 0.5941
 epoch: 20, train_loss: 0.7212, test_loss: 0.9304, test_f1: 0.5624
 epoch: 21, train_loss: 0.7050, test_loss: 0.9692, test_f1: 0.6200
 epoch: 22, train_loss: 0.6894, test_loss: 0.9531, test_f1: 0.5945
 epoch: 23, train_loss: 0.6851, test_loss: 0.9674, test_f1: 0.6375
 epoch: 24, train_loss: 0.6538, test_loss: 1.0139, test_f1: 0.6029
 epoch: 25, train_loss: 0.6596, test_loss: 1.0489, test_f1: 0.6090
 epoch: 26, train_loss: 0.6644, test_loss: 1.0256, test_f1: 0.6198
 epoch: 27, train_loss: 0.6670, test_loss: 0.9413, test_f1: 0.6098
 epoch: 28, train_loss: 0.6356, test_loss: 0.9786, test_f1: 0.5993
 epoch: 29, train_loss: 0.6450, test_loss: 1.0097, test_f1: 0.6132
 epoch: 30, train_loss: 0.6161, test_loss: 0.9539, test_f1: 0.6382
 epoch: 31, train_loss: 0.6074, test_loss: 1.0681, test_f1: 0.6039
 epoch: 32, train_loss: 0.5618, test_loss: 1.0530, test_f1: 0.6109
 epoch: 33, train_loss: 0.5993, test_loss: 1.0132, test_f1: 0.6091
 epoch: 34, train_loss: 0.5826, test_loss: 1.0490, test_f1: 0.6029
 epoch: 35, train_loss: 0.5934, test_loss: 1.0190, test_f1: 0.6159
 epoch: 36, train_loss: 0.5591, test_loss: 1.0510, test_f1: 0.6383
 epoch: 37, train_loss: 0.5578, test_loss: 1.1990, test_f1: 0.5954
 epoch: 38, train_loss: 0.5519, test_loss: 1.0624, test_f1: 0.6607
 epoch: 39, train_loss: 0.6030, test_loss: 1.0627, test_f1: 0.5955
 epoch: 40, train_loss: 0.5856, test_loss: 1.1046, test_f1: 0.6137
 epoch: 41, train_loss: 0.5548, test_loss: 1.1110, test_f1: 0.6501
 epoch: 42, train_loss: 0.5504, test_loss: 1.1611, test_f1: 0.6119
 epoch: 43, train_loss: 0.5360, test_loss: 1.1585, test_f1: 0.5863
 epoch: 44, train_loss: 0.5027, test_loss: 1.0753, test_f1: 0.6611
 epoch: 45, train_loss: 0.5109, test_loss: 1.1743, test_f1: 0.6321
 epoch: 46, train_loss: 0.5059, test_loss: 1.0345, test_f1: 0.6718
 epoch: 47, train_loss: 0.4784, test_loss: 1.2289, test_f1: 0.6319
 epoch: 48, train_loss: 0.4728, test_loss: 1.3524, test_f1: 0.6527
 epoch: 49, train_loss: 0.4689, test_loss: 1.2472, test_f1: 0.6364
 epoch: 50, train_loss: 0.4800, test_loss: 1.4676, test_f1: 0.6199
 epoch: 51, train_loss: 0.4298, test_loss: 1.1514, test_f1: 0.6683
 epoch: 52, train_loss: 0.3995, test_loss: 1.2851, test_f1: 0.6555
 epoch: 53, train_loss: 0.3841, test_loss: 1.2753, test_f1: 0.6604
 epoch: 54, train_loss: 0.3622, test_loss: 1.3332, test_f1: 0.6666
 epoch: 55, train_loss: 0.3556, test_loss: 1.2728, test_f1: 0.6739
 epoch: 56, train_loss: 0.3472, test_loss: 1.3343, test_f1: 0.6467
 epoch: 57, train_loss: 0.3551, test_loss: 1.3800, test_f1: 0.6613
 epoch: 58, train_loss: 0.3567, test_loss: 1.4009, test_f1: 0.6640
 epoch: 59, train_loss: 0.3349, test_loss: 1.4952, test_f1: 0.6578
 epoch: 60, train_loss: 0.3272, test_loss: 1.4757, test_f1: 0.6555
 epoch: 61, train_loss: 0.3239, test_loss: 1.5426, test_f1: 0.6615
 epoch: 62, train_loss: 0.3187, test_loss: 1.5607, test_f1: 0.6164
 epoch: 63, train_loss: 0.3203, test_loss: 1.4296, test_f1: 0.6700
 epoch: 64, train_loss: 0.3047, test_loss: 1.4234, test_f1: 0.6544
 epoch: 65, train_loss: 0.2970, test_loss: 1.5782, test_f1: 0.6644
 epoch: 66, train_loss: 0.3017, test_loss: 1.6252, test_f1: 0.6472
 epoch: 67, train_loss: 0.3135, test_loss: 1.7532, test_f1: 0.6599
 epoch: 68, train_loss: 0.2890, test_loss: 1.6653, test_f1: 0.6479
 epoch: 69, train_loss: 0.2823, test_loss: 1.6919, test_f1: 0.6506
 epoch: 70, train_loss: 0.3007, test_loss: 1.6320, test_f1: 0.6602
 epoch: 71, train_loss: 0.2667, test_loss: 1.6685, test_f1: 0.6634
 epoch: 72, train_loss: 0.2762, test_loss: 1.6702, test_f1: 0.6427
 epoch: 73, train_loss: 0.2947, test_loss: 1.7093, test_f1: 0.6517
 epoch: 74, train_loss: 0.2805, test_loss: 1.7842, test_f1: 0.6294
 epoch: 75, train_loss: 0.2682, test_loss: 1.7977, test_f1: 0.6326
 epoch: 76, train_loss: 0.2638, test_loss: 1.8196, test_f1: 0.6418
 epoch: 77, train_loss: 0.2891, test_loss: 1.7108, test_f1: 0.6740
 epoch: 78, train_loss: 0.2592, test_loss: 1.8013, test_f1: 0.6592
 epoch: 79, train_loss: 0.2592, test_loss: 1.7556, test_f1: 0.6575
 epoch: 80, train_loss: 0.2397, test_loss: 1.7225, test_f1: 0.6722
 epoch: 81, train_loss: 0.2485, test_loss: 1.8367, test_f1: 0.6557
 epoch: 82, train_loss: 0.2395, test_loss: 1.8041, test_f1: 0.6816
 epoch: 83, train_loss: 0.2341, test_loss: 1.8225, test_f1: 0.6636
 epoch: 84, train_loss: 0.2428, test_loss: 1.8671, test_f1: 0.6588
 epoch: 85, train_loss: 0.2245, test_loss: 1.8464, test_f1: 0.6843
 epoch: 86, train_loss: 0.2291, test_loss: 1.9538, test_f1: 0.6650
 epoch: 87, train_loss: 0.2238, test_loss: 1.7972, test_f1: 0.6501
 epoch: 88, train_loss: 0.2295, test_loss: 1.8876, test_f1: 0.6687
 epoch: 89, train_loss: 0.2272, test_loss: 1.9484, test_f1: 0.6473
 epoch: 90, train_loss: 0.2420, test_loss: 1.6951, test_f1: 0.6518
 epoch: 91, train_loss: 0.2225, test_loss: 1.9649, test_f1: 0.6526
 epoch: 92, train_loss: 0.2264, test_loss: 1.7822, test_f1: 0.6697
 epoch: 93, train_loss: 0.2215, test_loss: 1.9001, test_f1: 0.6550
 epoch: 94, train_loss: 0.2070, test_loss: 2.0144, test_f1: 0.6611
 epoch: 95, train_loss: 0.2128, test_loss: 1.9660, test_f1: 0.6814
 epoch: 96, train_loss: 0.2023, test_loss: 2.0863, test_f1: 0.6584
 epoch: 97, train_loss: 0.1962, test_loss: 2.0703, test_f1: 0.6498
 epoch: 98, train_loss: 0.1998, test_loss: 2.1878, test_f1: 0.6105
 epoch: 99, train_loss: 0.2166, test_loss: 2.2038, test_f1: 0.6562
##################ITERATION #8 ****************************************
 epoch: 0, train_loss: 1.3941, test_loss: 1.1430, test_f1: 0.3324
 epoch: 1, train_loss: 1.0232, test_loss: 0.9611, test_f1: 0.4666
 epoch: 2, train_loss: 0.9509, test_loss: 0.9746, test_f1: 0.4795
 epoch: 3, train_loss: 0.9313, test_loss: 0.9822, test_f1: 0.4777
 epoch: 4, train_loss: 0.9077, test_loss: 0.9393, test_f1: 0.5010
 epoch: 5, train_loss: 0.8779, test_loss: 0.9495, test_f1: 0.5101
 epoch: 6, train_loss: 0.8662, test_loss: 0.9701, test_f1: 0.5044
 epoch: 7, train_loss: 0.8475, test_loss: 1.0008, test_f1: 0.5073
 epoch: 8, train_loss: 0.8216, test_loss: 1.0143, test_f1: 0.4978
 epoch: 9, train_loss: 0.8354, test_loss: 0.9642, test_f1: 0.4973
 epoch: 10, train_loss: 0.8158, test_loss: 0.9972, test_f1: 0.5240
 epoch: 11, train_loss: 0.8213, test_loss: 0.9441, test_f1: 0.5548
 epoch: 12, train_loss: 0.7949, test_loss: 0.9623, test_f1: 0.5444
 epoch: 13, train_loss: 0.7833, test_loss: 0.9591, test_f1: 0.5600
 epoch: 14, train_loss: 0.7753, test_loss: 0.9262, test_f1: 0.5438
 epoch: 15, train_loss: 0.7561, test_loss: 0.9695, test_f1: 0.5493
 epoch: 16, train_loss: 0.7444, test_loss: 0.9468, test_f1: 0.5547
 epoch: 17, train_loss: 0.7389, test_loss: 0.9720, test_f1: 0.5881
 epoch: 18, train_loss: 0.7436, test_loss: 0.9516, test_f1: 0.5730
 epoch: 19, train_loss: 0.7289, test_loss: 1.0292, test_f1: 0.5479
 epoch: 20, train_loss: 0.7245, test_loss: 1.0523, test_f1: 0.5271
 epoch: 21, train_loss: 0.7044, test_loss: 1.0649, test_f1: 0.5823
 epoch: 22, train_loss: 0.7091, test_loss: 0.9326, test_f1: 0.5794
 epoch: 23, train_loss: 0.6764, test_loss: 1.0863, test_f1: 0.5342
 epoch: 24, train_loss: 0.6836, test_loss: 1.0711, test_f1: 0.5749
 epoch: 25, train_loss: 0.6906, test_loss: 0.9483, test_f1: 0.5895
 epoch: 26, train_loss: 0.6654, test_loss: 1.0233, test_f1: 0.5913
 epoch: 27, train_loss: 0.6643, test_loss: 1.0818, test_f1: 0.5546
 epoch: 28, train_loss: 0.6555, test_loss: 1.0099, test_f1: 0.5957
 epoch: 29, train_loss: 0.6583, test_loss: 1.1047, test_f1: 0.5553
 epoch: 30, train_loss: 0.6579, test_loss: 1.0398, test_f1: 0.5803
 epoch: 31, train_loss: 0.6361, test_loss: 1.0312, test_f1: 0.5845
 epoch: 32, train_loss: 0.6245, test_loss: 1.1114, test_f1: 0.5892
 epoch: 33, train_loss: 0.6238, test_loss: 1.0080, test_f1: 0.6127
 epoch: 34, train_loss: 0.5968, test_loss: 1.1869, test_f1: 0.5940
 epoch: 35, train_loss: 0.5783, test_loss: 1.0356, test_f1: 0.6142
 epoch: 36, train_loss: 0.5718, test_loss: 1.1030, test_f1: 0.5908
 epoch: 37, train_loss: 0.5749, test_loss: 1.1239, test_f1: 0.6221
 epoch: 38, train_loss: 0.5732, test_loss: 1.1638, test_f1: 0.6125
 epoch: 39, train_loss: 0.5826, test_loss: 1.0269, test_f1: 0.6664
 epoch: 40, train_loss: 0.5763, test_loss: 1.0323, test_f1: 0.6374
 epoch: 41, train_loss: 0.5366, test_loss: 1.0920, test_f1: 0.6279
 epoch: 42, train_loss: 0.5496, test_loss: 1.1645, test_f1: 0.6336
 epoch: 43, train_loss: 0.5360, test_loss: 1.0446, test_f1: 0.6499
 epoch: 44, train_loss: 0.5218, test_loss: 1.1245, test_f1: 0.6221
 epoch: 45, train_loss: 0.5221, test_loss: 1.1408, test_f1: 0.6306
 epoch: 46, train_loss: 0.5153, test_loss: 1.2181, test_f1: 0.6163
 epoch: 47, train_loss: 0.5103, test_loss: 1.2165, test_f1: 0.6169
 epoch: 48, train_loss: 0.5194, test_loss: 1.2298, test_f1: 0.6228
 epoch: 49, train_loss: 0.4941, test_loss: 1.1797, test_f1: 0.6433
 epoch: 50, train_loss: 0.4732, test_loss: 1.2986, test_f1: 0.6186
 epoch: 51, train_loss: 0.4303, test_loss: 1.2294, test_f1: 0.6221
 epoch: 52, train_loss: 0.4128, test_loss: 1.3027, test_f1: 0.6500
 epoch: 53, train_loss: 0.3862, test_loss: 1.2913, test_f1: 0.6342
 epoch: 54, train_loss: 0.4001, test_loss: 1.1900, test_f1: 0.6583
 epoch: 55, train_loss: 0.3756, test_loss: 1.4105, test_f1: 0.6341
 epoch: 56, train_loss: 0.3679, test_loss: 1.3948, test_f1: 0.6523
 epoch: 57, train_loss: 0.3619, test_loss: 1.4240, test_f1: 0.6052
 epoch: 58, train_loss: 0.3675, test_loss: 1.3887, test_f1: 0.6351
 epoch: 59, train_loss: 0.3575, test_loss: 1.4774, test_f1: 0.6171
 epoch: 60, train_loss: 0.3278, test_loss: 1.4642, test_f1: 0.6328
 epoch: 61, train_loss: 0.3113, test_loss: 1.5280, test_f1: 0.6694
 epoch: 62, train_loss: 0.3314, test_loss: 1.4537, test_f1: 0.6541
 epoch: 63, train_loss: 0.3156, test_loss: 1.6032, test_f1: 0.6266
 epoch: 64, train_loss: 0.3177, test_loss: 1.4900, test_f1: 0.6246
 epoch: 65, train_loss: 0.3150, test_loss: 1.5931, test_f1: 0.6451
 epoch: 66, train_loss: 0.3176, test_loss: 1.5243, test_f1: 0.6328
 epoch: 67, train_loss: 0.3100, test_loss: 1.5364, test_f1: 0.6502
 epoch: 68, train_loss: 0.3169, test_loss: 1.5677, test_f1: 0.6142
 epoch: 69, train_loss: 0.3185, test_loss: 1.5728, test_f1: 0.6349
 epoch: 70, train_loss: 0.2998, test_loss: 1.6061, test_f1: 0.6561
 epoch: 71, train_loss: 0.2815, test_loss: 1.7082, test_f1: 0.6235
 epoch: 72, train_loss: 0.2804, test_loss: 1.6211, test_f1: 0.6246
 epoch: 73, train_loss: 0.2868, test_loss: 1.6630, test_f1: 0.6309
 epoch: 74, train_loss: 0.2826, test_loss: 1.6996, test_f1: 0.6325
 epoch: 75, train_loss: 0.2741, test_loss: 1.6554, test_f1: 0.6431
 epoch: 76, train_loss: 0.2761, test_loss: 1.7813, test_f1: 0.6308
 epoch: 77, train_loss: 0.2905, test_loss: 1.6037, test_f1: 0.6467
 epoch: 78, train_loss: 0.2606, test_loss: 1.7386, test_f1: 0.6260
 epoch: 79, train_loss: 0.2818, test_loss: 1.7525, test_f1: 0.6272
 epoch: 80, train_loss: 0.2557, test_loss: 1.7291, test_f1: 0.6352
 epoch: 81, train_loss: 0.2588, test_loss: 1.8191, test_f1: 0.6461
 epoch: 82, train_loss: 0.2734, test_loss: 1.7617, test_f1: 0.6210
 epoch: 83, train_loss: 0.2499, test_loss: 1.6832, test_f1: 0.6530
 epoch: 84, train_loss: 0.2449, test_loss: 1.8463, test_f1: 0.6373
 epoch: 85, train_loss: 0.2443, test_loss: 1.8929, test_f1: 0.6345
 epoch: 86, train_loss: 0.2649, test_loss: 1.8106, test_f1: 0.6400
 epoch: 87, train_loss: 0.2199, test_loss: 1.9383, test_f1: 0.6105
 epoch: 88, train_loss: 0.2492, test_loss: 1.9772, test_f1: 0.6280
 epoch: 89, train_loss: 0.2258, test_loss: 2.0265, test_f1: 0.6230
 epoch: 90, train_loss: 0.2479, test_loss: 1.9414, test_f1: 0.6257
 epoch: 91, train_loss: 0.2401, test_loss: 1.6640, test_f1: 0.6319
 epoch: 92, train_loss: 0.2625, test_loss: 2.0530, test_f1: 0.6492
 epoch: 93, train_loss: 0.2311, test_loss: 1.9550, test_f1: 0.6515
 epoch: 94, train_loss: 0.2207, test_loss: 2.0686, test_f1: 0.6391
 epoch: 95, train_loss: 0.2067, test_loss: 2.0048, test_f1: 0.6542
 epoch: 96, train_loss: 0.2090, test_loss: 2.2893, test_f1: 0.6304
 epoch: 97, train_loss: 0.2141, test_loss: 2.0988, test_f1: 0.6393
 epoch: 98, train_loss: 0.2154, test_loss: 2.0110, test_f1: 0.6540
 epoch: 99, train_loss: 0.2157, test_loss: 2.1008, test_f1: 0.6394
##################ITERATION #9 ****************************************
 epoch: 0, train_loss: 1.4931, test_loss: 1.2215, test_f1: 0.3441
 epoch: 1, train_loss: 1.0455, test_loss: 1.0138, test_f1: 0.4442
 epoch: 2, train_loss: 0.9673, test_loss: 0.9488, test_f1: 0.4807
 epoch: 3, train_loss: 0.9382, test_loss: 0.9973, test_f1: 0.4729
 epoch: 4, train_loss: 0.9220, test_loss: 0.9512, test_f1: 0.4885
 epoch: 5, train_loss: 0.8951, test_loss: 0.9790, test_f1: 0.4957
 epoch: 6, train_loss: 0.8793, test_loss: 1.0522, test_f1: 0.4629
 epoch: 7, train_loss: 0.8605, test_loss: 0.9292, test_f1: 0.5000
 epoch: 8, train_loss: 0.8544, test_loss: 0.9810, test_f1: 0.5067
 epoch: 9, train_loss: 0.8384, test_loss: 1.0349, test_f1: 0.5041
 epoch: 10, train_loss: 0.8218, test_loss: 1.0196, test_f1: 0.5207
 epoch: 11, train_loss: 0.8012, test_loss: 0.9626, test_f1: 0.5334
 epoch: 12, train_loss: 0.7980, test_loss: 0.9841, test_f1: 0.5515
 epoch: 13, train_loss: 0.7947, test_loss: 0.9184, test_f1: 0.5952
 epoch: 14, train_loss: 0.7763, test_loss: 0.9343, test_f1: 0.5630
 epoch: 15, train_loss: 0.7528, test_loss: 1.0275, test_f1: 0.5457
 epoch: 16, train_loss: 0.7553, test_loss: 1.0043, test_f1: 0.5442
 epoch: 17, train_loss: 0.7421, test_loss: 0.9672, test_f1: 0.5613
 epoch: 18, train_loss: 0.7413, test_loss: 0.9646, test_f1: 0.5978
 epoch: 19, train_loss: 0.7199, test_loss: 1.0061, test_f1: 0.5911
 epoch: 20, train_loss: 0.7085, test_loss: 1.0036, test_f1: 0.5977
 epoch: 21, train_loss: 0.7126, test_loss: 1.0636, test_f1: 0.5713
 epoch: 22, train_loss: 0.7288, test_loss: 1.0125, test_f1: 0.5584
 epoch: 23, train_loss: 0.6952, test_loss: 1.0324, test_f1: 0.5944
 epoch: 24, train_loss: 0.6796, test_loss: 0.9665, test_f1: 0.6077
 epoch: 25, train_loss: 0.6838, test_loss: 0.9794, test_f1: 0.5966
 epoch: 26, train_loss: 0.6622, test_loss: 1.0544, test_f1: 0.6163
 epoch: 27, train_loss: 0.6661, test_loss: 1.0661, test_f1: 0.6108
 epoch: 28, train_loss: 0.6537, test_loss: 1.0185, test_f1: 0.5990
 epoch: 29, train_loss: 0.6498, test_loss: 1.0317, test_f1: 0.5978
 epoch: 30, train_loss: 0.6343, test_loss: 0.9897, test_f1: 0.6264
 epoch: 31, train_loss: 0.6372, test_loss: 1.1454, test_f1: 0.5728
 epoch: 32, train_loss: 0.6270, test_loss: 1.0616, test_f1: 0.6170
 epoch: 33, train_loss: 0.6466, test_loss: 1.1351, test_f1: 0.6044
 epoch: 34, train_loss: 0.6167, test_loss: 1.1349, test_f1: 0.5875
 epoch: 35, train_loss: 0.6074, test_loss: 1.0891, test_f1: 0.5749
 epoch: 36, train_loss: 0.5861, test_loss: 0.9883, test_f1: 0.6094
 epoch: 37, train_loss: 0.5841, test_loss: 1.2018, test_f1: 0.5748
 epoch: 38, train_loss: 0.5952, test_loss: 1.0309, test_f1: 0.5735
 epoch: 39, train_loss: 0.5608, test_loss: 1.0770, test_f1: 0.6559
 epoch: 40, train_loss: 0.5690, test_loss: 1.0067, test_f1: 0.6022
 epoch: 41, train_loss: 0.5589, test_loss: 1.0872, test_f1: 0.5928
 epoch: 42, train_loss: 0.5464, test_loss: 1.1224, test_f1: 0.6183
 epoch: 43, train_loss: 0.5685, test_loss: 1.1504, test_f1: 0.6231
 epoch: 44, train_loss: 0.5448, test_loss: 1.2395, test_f1: 0.5992
 epoch: 45, train_loss: 0.5309, test_loss: 1.0954, test_f1: 0.6085
 epoch: 46, train_loss: 0.5375, test_loss: 1.0862, test_f1: 0.6441
 epoch: 47, train_loss: 0.5160, test_loss: 1.1019, test_f1: 0.6471
 epoch: 48, train_loss: 0.5179, test_loss: 1.2844, test_f1: 0.5799
 epoch: 49, train_loss: 0.4905, test_loss: 1.1406, test_f1: 0.6098
 epoch: 50, train_loss: 0.5029, test_loss: 1.1625, test_f1: 0.6578
 epoch: 51, train_loss: 0.4568, test_loss: 1.0797, test_f1: 0.6344
 epoch: 52, train_loss: 0.4276, test_loss: 1.1479, test_f1: 0.6364
 epoch: 53, train_loss: 0.4142, test_loss: 1.1884, test_f1: 0.6484
 epoch: 54, train_loss: 0.3967, test_loss: 1.2347, test_f1: 0.6459
 epoch: 55, train_loss: 0.3972, test_loss: 1.2665, test_f1: 0.6304
 epoch: 56, train_loss: 0.3790, test_loss: 1.2860, test_f1: 0.6347
 epoch: 57, train_loss: 0.3789, test_loss: 1.2787, test_f1: 0.6489
 epoch: 58, train_loss: 0.3606, test_loss: 1.2873, test_f1: 0.6420
 epoch: 59, train_loss: 0.3670, test_loss: 1.3849, test_f1: 0.6218
 epoch: 60, train_loss: 0.3534, test_loss: 1.3708, test_f1: 0.6208
 epoch: 61, train_loss: 0.3508, test_loss: 1.4503, test_f1: 0.6257
 epoch: 62, train_loss: 0.3347, test_loss: 1.3306, test_f1: 0.6411
 epoch: 63, train_loss: 0.3562, test_loss: 1.4452, test_f1: 0.6302
 epoch: 64, train_loss: 0.3366, test_loss: 1.3625, test_f1: 0.6381
 epoch: 65, train_loss: 0.3328, test_loss: 1.4271, test_f1: 0.6613
 epoch: 66, train_loss: 0.3472, test_loss: 1.3553, test_f1: 0.6455
 epoch: 67, train_loss: 0.3178, test_loss: 1.5300, test_f1: 0.6489
 epoch: 68, train_loss: 0.2983, test_loss: 1.4020, test_f1: 0.6504
 epoch: 69, train_loss: 0.3244, test_loss: 1.5772, test_f1: 0.6356
 epoch: 70, train_loss: 0.3310, test_loss: 1.4965, test_f1: 0.6394
 epoch: 71, train_loss: 0.3147, test_loss: 1.5203, test_f1: 0.6398
 epoch: 72, train_loss: 0.3087, test_loss: 1.3446, test_f1: 0.6364
 epoch: 73, train_loss: 0.3017, test_loss: 1.5523, test_f1: 0.6251
 epoch: 74, train_loss: 0.3033, test_loss: 1.5083, test_f1: 0.6220
 epoch: 75, train_loss: 0.3165, test_loss: 1.4930, test_f1: 0.6534
 epoch: 76, train_loss: 0.3078, test_loss: 1.5412, test_f1: 0.6344
 epoch: 77, train_loss: 0.3037, test_loss: 1.5157, test_f1: 0.6276
 epoch: 78, train_loss: 0.3076, test_loss: 1.5152, test_f1: 0.6621
 epoch: 79, train_loss: 0.2929, test_loss: 1.6200, test_f1: 0.6160
 epoch: 80, train_loss: 0.2812, test_loss: 1.5599, test_f1: 0.6326
 epoch: 81, train_loss: 0.2780, test_loss: 1.5506, test_f1: 0.6598
 epoch: 82, train_loss: 0.2693, test_loss: 1.5141, test_f1: 0.6541
 epoch: 83, train_loss: 0.2749, test_loss: 1.4983, test_f1: 0.6257
 epoch: 84, train_loss: 0.2642, test_loss: 1.5089, test_f1: 0.6565
 epoch: 85, train_loss: 0.2590, test_loss: 1.5264, test_f1: 0.6500
 epoch: 86, train_loss: 0.2639, test_loss: 1.6042, test_f1: 0.6497
 epoch: 87, train_loss: 0.2443, test_loss: 1.5345, test_f1: 0.6546
 epoch: 88, train_loss: 0.2598, test_loss: 1.6695, test_f1: 0.6327
 epoch: 89, train_loss: 0.2520, test_loss: 1.5737, test_f1: 0.6258
 epoch: 90, train_loss: 0.2416, test_loss: 1.4974, test_f1: 0.6484
 epoch: 91, train_loss: 0.2407, test_loss: 1.8805, test_f1: 0.6339
 epoch: 92, train_loss: 0.2276, test_loss: 1.8124, test_f1: 0.6163
 epoch: 93, train_loss: 0.2525, test_loss: 1.8231, test_f1: 0.6263
 epoch: 94, train_loss: 0.2449, test_loss: 1.6302, test_f1: 0.6598
 epoch: 95, train_loss: 0.2254, test_loss: 1.8556, test_f1: 0.6308
 epoch: 96, train_loss: 0.2217, test_loss: 1.7595, test_f1: 0.6188
 epoch: 97, train_loss: 0.2276, test_loss: 1.7528, test_f1: 0.6593
 epoch: 98, train_loss: 0.2304, test_loss: 1.7908, test_f1: 0.6330
 epoch: 99, train_loss: 0.2456, test_loss: 1.6869, test_f1: 0.6412

Training completed in 568.50 seconds
Best F1: 0.6941 at epoch 95
Mean F1 across iterations: 0.6728  0.0107
========================FINAL RESULTS================================
FEGIN weighted F1: 0.6941  0.0107
python main.py --data ltspice_examples --representation component_net --model FEGIN --layers 6 --hiddens 128 --batch_size 128 --lr 0.001 --emb_size 128 --epochs 100 --save_appendix component_net_L6_H128_BS128_LR0.001_E128 --no_val
-----



STDERR:
  File "main.py", line 370, in <module>
    main()
  File "main.py", line 254, in main
    dataset = dataset_class(
  File "/home/philip/projects/ltspice_examples_code_repo/Circuit-Completion-Using-GNNs/component_classification_with_link_prediction_head/evaluation/FEGIN/kernel/circuit_datasets.py", line 15, in __init__
    self.data, self.slices = torch.load(self.processed_paths[0])
  File "/home/philip/.local/lib/python3.8/site-packages/torch/serialization.py", line 1040, in load
    warnings.warn(
  File "/usr/lib/python3.8/warnings.py", line 109, in _showwarnmsg
    sw(msg.message, msg.category, msg.filename, msg.lineno,
  File "main.py", line 47, in warn_with_traceback
    traceback.print_stack(file=log)
/home/philip/projects/ltspice_examples_code_repo/Circuit-Completion-Using-GNNs/component_classification_with_link_prediction_head/evaluation/FEGIN/kernel/circuit_datasets.py:15: FutureWarning: You are using `torch.load` with `weights_only=False` (the current default value), which uses the default pickle module implicitly. It is possible to construct malicious pickle data which will execute arbitrary code during unpickling (See https://github.com/pytorch/pytorch/blob/main/SECURITY.md#untrusted-models for more details). In a future release, the default value for `weights_only` will be flipped to `True`. This limits the functions that could be executed during unpickling. Arbitrary objects will no longer be allowed to be loaded via this mode unless they are explicitly allowlisted by the user via `torch.serialization.add_safe_globals`. We recommend you start setting `weights_only=True` for any use case where you don't have full control of the loaded file. Please open an issue on GitHub for any issues related to this experimental feature.
  self.data, self.slices = torch.load(self.processed_paths[0])
