STDOUT:
Results will be saved in /home/philip/projects/ltspice_examples_code_repo/Circuit-Completion-Using-GNNs/component_classification_with_link_prediction_head/evaluation/FEGIN/results/model_FEGIN_dataset_ltspice_demos
Command line input: python main.py --data ltspice_demos --representation component_net --model FEGIN --layers 5 --hiddens 64 --batch_size 32 --lr 0.0001 --emb_size 250 --epochs 100 --save_appendix component_net_L5_H64_BS32_LR0.0001_E250 --no_val
 is saved.
-----
ltspice_demos - FEGIN
Using 5 layers, 64 hidden units, h = 2
Loading component_net representation dataset
ENTERED
Training FEGIN on component_net representation
Train: 1565, Test: 383
##################ITERATION #0 ****************************************
 epoch: 0, train_loss: 1.3810, test_loss: 1.3765, test_f1: 0.1365
 epoch: 1, train_loss: 1.3393, test_loss: 1.3426, test_f1: 0.2592
 epoch: 2, train_loss: 1.2978, test_loss: 1.3029, test_f1: 0.2836
 epoch: 3, train_loss: 1.2487, test_loss: 1.2611, test_f1: 0.2780
 epoch: 4, train_loss: 1.2109, test_loss: 1.2398, test_f1: 0.2803
 epoch: 5, train_loss: 1.1807, test_loss: 1.2250, test_f1: 0.2755
 epoch: 6, train_loss: 1.1630, test_loss: 1.2095, test_f1: 0.2887
 epoch: 7, train_loss: 1.1465, test_loss: 1.1950, test_f1: 0.2818
 epoch: 8, train_loss: 1.1397, test_loss: 1.1845, test_f1: 0.2870
 epoch: 9, train_loss: 1.1298, test_loss: 1.1743, test_f1: 0.3187
 epoch: 10, train_loss: 1.1137, test_loss: 1.1693, test_f1: 0.3252
 epoch: 11, train_loss: 1.1080, test_loss: 1.1542, test_f1: 0.3531
 epoch: 12, train_loss: 1.0992, test_loss: 1.1489, test_f1: 0.4048
 epoch: 13, train_loss: 1.0911, test_loss: 1.1417, test_f1: 0.3966
 epoch: 14, train_loss: 1.0913, test_loss: 1.1307, test_f1: 0.4209
 epoch: 15, train_loss: 1.0838, test_loss: 1.1233, test_f1: 0.4810
 epoch: 16, train_loss: 1.0657, test_loss: 1.1144, test_f1: 0.4544
 epoch: 17, train_loss: 1.0578, test_loss: 1.1202, test_f1: 0.4620
 epoch: 18, train_loss: 1.0425, test_loss: 1.1049, test_f1: 0.4826
 epoch: 19, train_loss: 1.0346, test_loss: 1.0934, test_f1: 0.4880
 epoch: 20, train_loss: 1.0319, test_loss: 1.0796, test_f1: 0.5024
 epoch: 21, train_loss: 1.0287, test_loss: 1.0894, test_f1: 0.5043
 epoch: 22, train_loss: 1.0073, test_loss: 1.0759, test_f1: 0.4963
 epoch: 23, train_loss: 0.9941, test_loss: 1.0675, test_f1: 0.5242
 epoch: 24, train_loss: 0.9913, test_loss: 1.0427, test_f1: 0.4923
 epoch: 25, train_loss: 0.9822, test_loss: 1.0358, test_f1: 0.5317
 epoch: 26, train_loss: 0.9677, test_loss: 1.0311, test_f1: 0.5296
 epoch: 27, train_loss: 0.9667, test_loss: 1.0565, test_f1: 0.5344
 epoch: 28, train_loss: 0.9503, test_loss: 1.0383, test_f1: 0.5315
 epoch: 29, train_loss: 0.9416, test_loss: 1.0470, test_f1: 0.5401
 epoch: 30, train_loss: 0.9411, test_loss: 1.0178, test_f1: 0.5478
 epoch: 31, train_loss: 0.9277, test_loss: 1.0425, test_f1: 0.5414
 epoch: 32, train_loss: 0.9104, test_loss: 1.0446, test_f1: 0.5471
 epoch: 33, train_loss: 0.9111, test_loss: 1.0223, test_f1: 0.5600
 epoch: 34, train_loss: 0.9172, test_loss: 1.0131, test_f1: 0.5602
 epoch: 35, train_loss: 0.8986, test_loss: 1.0153, test_f1: 0.5573
 epoch: 36, train_loss: 0.8962, test_loss: 1.0203, test_f1: 0.5552
 epoch: 37, train_loss: 0.8893, test_loss: 1.0323, test_f1: 0.5657
 epoch: 38, train_loss: 0.8793, test_loss: 1.0469, test_f1: 0.5590
 epoch: 39, train_loss: 0.8758, test_loss: 1.0363, test_f1: 0.5737
 epoch: 40, train_loss: 0.8697, test_loss: 1.0366, test_f1: 0.5608
 epoch: 41, train_loss: 0.8758, test_loss: 1.0561, test_f1: 0.5584
 epoch: 42, train_loss: 0.8609, test_loss: 1.0661, test_f1: 0.5752
 epoch: 43, train_loss: 0.8583, test_loss: 1.0718, test_f1: 0.5553
 epoch: 44, train_loss: 0.8724, test_loss: 1.0392, test_f1: 0.5592
 epoch: 45, train_loss: 0.8459, test_loss: 1.0663, test_f1: 0.5639
 epoch: 46, train_loss: 0.8493, test_loss: 1.0002, test_f1: 0.5707
 epoch: 47, train_loss: 0.8411, test_loss: 1.0380, test_f1: 0.5723
 epoch: 48, train_loss: 0.8420, test_loss: 1.0280, test_f1: 0.5772
 epoch: 49, train_loss: 0.8302, test_loss: 1.0768, test_f1: 0.5748
 epoch: 50, train_loss: 0.8309, test_loss: 1.1096, test_f1: 0.5915
 epoch: 51, train_loss: 0.8315, test_loss: 1.0950, test_f1: 0.5792
 epoch: 52, train_loss: 0.8201, test_loss: 1.0613, test_f1: 0.5807
 epoch: 53, train_loss: 0.8085, test_loss: 1.0567, test_f1: 0.5721
 epoch: 54, train_loss: 0.8173, test_loss: 1.0460, test_f1: 0.5851
 epoch: 55, train_loss: 0.8167, test_loss: 1.0484, test_f1: 0.5807
 epoch: 56, train_loss: 0.8001, test_loss: 1.0430, test_f1: 0.5895
 epoch: 57, train_loss: 0.8103, test_loss: 1.0574, test_f1: 0.5978
 epoch: 58, train_loss: 0.8181, test_loss: 1.0408, test_f1: 0.5826
 epoch: 59, train_loss: 0.8051, test_loss: 1.0369, test_f1: 0.5760
 epoch: 60, train_loss: 0.7977, test_loss: 1.0727, test_f1: 0.5859
 epoch: 61, train_loss: 0.7940, test_loss: 1.0845, test_f1: 0.5813
 epoch: 62, train_loss: 0.8035, test_loss: 1.0887, test_f1: 0.5864
 epoch: 63, train_loss: 0.7928, test_loss: 1.0824, test_f1: 0.5770
 epoch: 64, train_loss: 0.8026, test_loss: 1.0792, test_f1: 0.5867
 epoch: 65, train_loss: 0.7899, test_loss: 1.0698, test_f1: 0.5832
 epoch: 66, train_loss: 0.7848, test_loss: 1.0985, test_f1: 0.5703
 epoch: 67, train_loss: 0.7801, test_loss: 1.0607, test_f1: 0.5828
 epoch: 68, train_loss: 0.7921, test_loss: 1.0745, test_f1: 0.5733
 epoch: 69, train_loss: 0.7754, test_loss: 1.0551, test_f1: 0.5845
 epoch: 70, train_loss: 0.8036, test_loss: 1.0830, test_f1: 0.5826
 epoch: 71, train_loss: 0.7856, test_loss: 1.1080, test_f1: 0.5799
 epoch: 72, train_loss: 0.7701, test_loss: 1.0881, test_f1: 0.5782
 epoch: 73, train_loss: 0.7847, test_loss: 1.1023, test_f1: 0.5741
 epoch: 74, train_loss: 0.7703, test_loss: 1.0758, test_f1: 0.5774
 epoch: 75, train_loss: 0.7877, test_loss: 1.1083, test_f1: 0.5748
 epoch: 76, train_loss: 0.7740, test_loss: 1.1248, test_f1: 0.5728
 epoch: 77, train_loss: 0.7795, test_loss: 1.1368, test_f1: 0.5654
 epoch: 78, train_loss: 0.7976, test_loss: 1.1038, test_f1: 0.5742
 epoch: 79, train_loss: 0.7950, test_loss: 1.1617, test_f1: 0.5848
 epoch: 80, train_loss: 0.7835, test_loss: 1.1110, test_f1: 0.5695
 epoch: 81, train_loss: 0.7830, test_loss: 1.0971, test_f1: 0.5863
 epoch: 82, train_loss: 0.7893, test_loss: 1.0858, test_f1: 0.5816
 epoch: 83, train_loss: 0.7752, test_loss: 1.1149, test_f1: 0.5723
 epoch: 84, train_loss: 0.7663, test_loss: 1.0962, test_f1: 0.5666
 epoch: 85, train_loss: 0.7728, test_loss: 1.1498, test_f1: 0.5664
 epoch: 86, train_loss: 0.7734, test_loss: 1.1579, test_f1: 0.5609
 epoch: 87, train_loss: 0.7705, test_loss: 1.1473, test_f1: 0.5498
 epoch: 88, train_loss: 0.7627, test_loss: 1.1119, test_f1: 0.5757
 epoch: 89, train_loss: 0.7611, test_loss: 1.1377, test_f1: 0.5603
 epoch: 90, train_loss: 0.7586, test_loss: 1.1121, test_f1: 0.5674
 epoch: 91, train_loss: 0.7481, test_loss: 1.1176, test_f1: 0.5594
 epoch: 92, train_loss: 0.7521, test_loss: 1.1403, test_f1: 0.5612
 epoch: 93, train_loss: 0.7669, test_loss: 1.1250, test_f1: 0.5646
 epoch: 94, train_loss: 0.7721, test_loss: 1.1049, test_f1: 0.5759
 epoch: 95, train_loss: 0.7573, test_loss: 1.1429, test_f1: 0.5624
 epoch: 96, train_loss: 0.7472, test_loss: 1.1578, test_f1: 0.5573
 epoch: 97, train_loss: 0.7600, test_loss: 1.1628, test_f1: 0.5623
 epoch: 98, train_loss: 0.7439, test_loss: 1.1674, test_f1: 0.5655
 epoch: 99, train_loss: 0.7370, test_loss: 1.1533, test_f1: 0.5707
##################ITERATION #1 ****************************************
 epoch: 0, train_loss: 1.3019, test_loss: 1.3290, test_f1: 0.1513
 epoch: 1, train_loss: 1.2175, test_loss: 1.2654, test_f1: 0.3593
 epoch: 2, train_loss: 1.1867, test_loss: 1.2384, test_f1: 0.3088
 epoch: 3, train_loss: 1.1600, test_loss: 1.2141, test_f1: 0.3169
 epoch: 4, train_loss: 1.1462, test_loss: 1.1961, test_f1: 0.3039
 epoch: 5, train_loss: 1.1252, test_loss: 1.1861, test_f1: 0.3066
 epoch: 6, train_loss: 1.1099, test_loss: 1.1757, test_f1: 0.3453
 epoch: 7, train_loss: 1.1000, test_loss: 1.1671, test_f1: 0.3867
 epoch: 8, train_loss: 1.0798, test_loss: 1.1449, test_f1: 0.3856
 epoch: 9, train_loss: 1.0759, test_loss: 1.1404, test_f1: 0.4322
 epoch: 10, train_loss: 1.0642, test_loss: 1.1313, test_f1: 0.3772
 epoch: 11, train_loss: 1.0542, test_loss: 1.1144, test_f1: 0.4254
 epoch: 12, train_loss: 1.0350, test_loss: 1.1073, test_f1: 0.4457
 epoch: 13, train_loss: 1.0266, test_loss: 1.1048, test_f1: 0.4642
 epoch: 14, train_loss: 1.0067, test_loss: 1.0908, test_f1: 0.4858
 epoch: 15, train_loss: 1.0080, test_loss: 1.0900, test_f1: 0.5002
 epoch: 16, train_loss: 0.9927, test_loss: 1.0593, test_f1: 0.5125
 epoch: 17, train_loss: 0.9854, test_loss: 1.0566, test_f1: 0.5147
 epoch: 18, train_loss: 0.9713, test_loss: 1.0630, test_f1: 0.5281
 epoch: 19, train_loss: 0.9633, test_loss: 1.0553, test_f1: 0.5293
 epoch: 20, train_loss: 0.9703, test_loss: 1.0840, test_f1: 0.5176
 epoch: 21, train_loss: 0.9499, test_loss: 1.0773, test_f1: 0.5361
 epoch: 22, train_loss: 0.9491, test_loss: 1.0289, test_f1: 0.5347
 epoch: 23, train_loss: 0.9339, test_loss: 1.0478, test_f1: 0.5566
 epoch: 24, train_loss: 0.9327, test_loss: 1.0449, test_f1: 0.5460
 epoch: 25, train_loss: 0.9185, test_loss: 1.0437, test_f1: 0.5531
 epoch: 26, train_loss: 0.9239, test_loss: 1.0818, test_f1: 0.5495
 epoch: 27, train_loss: 0.9128, test_loss: 1.0578, test_f1: 0.5721
 epoch: 28, train_loss: 0.9008, test_loss: 1.0214, test_f1: 0.5725
 epoch: 29, train_loss: 0.8989, test_loss: 1.0146, test_f1: 0.5601
 epoch: 30, train_loss: 0.9044, test_loss: 1.0245, test_f1: 0.5656
 epoch: 31, train_loss: 0.8990, test_loss: 1.0350, test_f1: 0.5590
 epoch: 32, train_loss: 0.8963, test_loss: 1.0189, test_f1: 0.5587
 epoch: 33, train_loss: 0.8884, test_loss: 1.0576, test_f1: 0.5642
 epoch: 34, train_loss: 0.8689, test_loss: 1.0847, test_f1: 0.5741
 epoch: 35, train_loss: 0.8807, test_loss: 1.0344, test_f1: 0.5684
 epoch: 36, train_loss: 0.8744, test_loss: 1.0083, test_f1: 0.5725
 epoch: 37, train_loss: 0.8667, test_loss: 1.0326, test_f1: 0.5736
 epoch: 38, train_loss: 0.8599, test_loss: 1.0205, test_f1: 0.5790
 epoch: 39, train_loss: 0.8624, test_loss: 1.0498, test_f1: 0.5649
 epoch: 40, train_loss: 0.8657, test_loss: 1.0203, test_f1: 0.5549
 epoch: 41, train_loss: 0.8570, test_loss: 1.0244, test_f1: 0.5624
 epoch: 42, train_loss: 0.8566, test_loss: 1.0188, test_f1: 0.5697
 epoch: 43, train_loss: 0.8446, test_loss: 1.0119, test_f1: 0.5660
 epoch: 44, train_loss: 0.8529, test_loss: 1.0322, test_f1: 0.5676
 epoch: 45, train_loss: 0.8421, test_loss: 1.0037, test_f1: 0.5798
 epoch: 46, train_loss: 0.8438, test_loss: 1.0492, test_f1: 0.5857
 epoch: 47, train_loss: 0.8431, test_loss: 1.0807, test_f1: 0.5701
 epoch: 48, train_loss: 0.8338, test_loss: 1.0583, test_f1: 0.5772
 epoch: 49, train_loss: 0.8240, test_loss: 1.0846, test_f1: 0.5898
 epoch: 50, train_loss: 0.8194, test_loss: 1.0150, test_f1: 0.5912
 epoch: 51, train_loss: 0.8198, test_loss: 1.0276, test_f1: 0.5736
 epoch: 52, train_loss: 0.8105, test_loss: 1.0427, test_f1: 0.5818
 epoch: 53, train_loss: 0.8027, test_loss: 1.0366, test_f1: 0.5887
 epoch: 54, train_loss: 0.8062, test_loss: 1.0389, test_f1: 0.5815
 epoch: 55, train_loss: 0.8229, test_loss: 1.0604, test_f1: 0.5808
 epoch: 56, train_loss: 0.8058, test_loss: 1.0643, test_f1: 0.5827
 epoch: 57, train_loss: 0.8128, test_loss: 1.0692, test_f1: 0.5829
 epoch: 58, train_loss: 0.7951, test_loss: 1.0829, test_f1: 0.5788
 epoch: 59, train_loss: 0.7966, test_loss: 1.0597, test_f1: 0.5940
 epoch: 60, train_loss: 0.7970, test_loss: 1.0651, test_f1: 0.5774
 epoch: 61, train_loss: 0.8059, test_loss: 1.0643, test_f1: 0.5847
 epoch: 62, train_loss: 0.7988, test_loss: 1.0404, test_f1: 0.5829
 epoch: 63, train_loss: 0.7942, test_loss: 1.0616, test_f1: 0.5805
 epoch: 64, train_loss: 0.7945, test_loss: 1.0151, test_f1: 0.5949
 epoch: 65, train_loss: 0.7928, test_loss: 1.0397, test_f1: 0.5817
 epoch: 66, train_loss: 0.8077, test_loss: 1.0366, test_f1: 0.5892
 epoch: 67, train_loss: 0.7793, test_loss: 1.0358, test_f1: 0.5948
 epoch: 68, train_loss: 0.7909, test_loss: 1.0894, test_f1: 0.5747
 epoch: 69, train_loss: 0.7785, test_loss: 1.0518, test_f1: 0.5948
 epoch: 70, train_loss: 0.7635, test_loss: 1.0884, test_f1: 0.5809
 epoch: 71, train_loss: 0.7947, test_loss: 1.0765, test_f1: 0.5861
 epoch: 72, train_loss: 0.7856, test_loss: 1.0899, test_f1: 0.5807
 epoch: 73, train_loss: 0.7877, test_loss: 1.1143, test_f1: 0.5871
 epoch: 74, train_loss: 0.7730, test_loss: 1.0704, test_f1: 0.6004
 epoch: 75, train_loss: 0.7905, test_loss: 1.1284, test_f1: 0.5819
 epoch: 76, train_loss: 0.7851, test_loss: 1.0604, test_f1: 0.6000
 epoch: 77, train_loss: 0.7756, test_loss: 1.0432, test_f1: 0.5934
 epoch: 78, train_loss: 0.7842, test_loss: 1.0813, test_f1: 0.6026
 epoch: 79, train_loss: 0.7707, test_loss: 1.1367, test_f1: 0.5592
 epoch: 80, train_loss: 0.7776, test_loss: 1.0974, test_f1: 0.5918
 epoch: 81, train_loss: 0.7745, test_loss: 1.1104, test_f1: 0.5667
 epoch: 82, train_loss: 0.7598, test_loss: 1.0659, test_f1: 0.5856
 epoch: 83, train_loss: 0.7795, test_loss: 1.0890, test_f1: 0.5835
 epoch: 84, train_loss: 0.7619, test_loss: 1.1272, test_f1: 0.5885
 epoch: 85, train_loss: 0.7724, test_loss: 1.0878, test_f1: 0.5986
 epoch: 86, train_loss: 0.7694, test_loss: 1.0737, test_f1: 0.5684
 epoch: 87, train_loss: 0.7612, test_loss: 1.0769, test_f1: 0.5900
 epoch: 88, train_loss: 0.7610, test_loss: 1.1389, test_f1: 0.5790
 epoch: 89, train_loss: 0.7619, test_loss: 1.1414, test_f1: 0.5950
 epoch: 90, train_loss: 0.7501, test_loss: 1.0633, test_f1: 0.5941
 epoch: 91, train_loss: 0.7566, test_loss: 1.0664, test_f1: 0.6105
 epoch: 92, train_loss: 0.7479, test_loss: 1.1103, test_f1: 0.5805
 epoch: 93, train_loss: 0.7463, test_loss: 1.0858, test_f1: 0.5847
 epoch: 94, train_loss: 0.7557, test_loss: 1.0712, test_f1: 0.6015
 epoch: 95, train_loss: 0.7561, test_loss: 1.1041, test_f1: 0.5837
 epoch: 96, train_loss: 0.7630, test_loss: 1.1042, test_f1: 0.5970
 epoch: 97, train_loss: 0.7570, test_loss: 1.1089, test_f1: 0.5917
 epoch: 98, train_loss: 0.7635, test_loss: 1.1391, test_f1: 0.5800
 epoch: 99, train_loss: 0.7374, test_loss: 1.0911, test_f1: 0.5923
##################ITERATION #2 ****************************************
 epoch: 0, train_loss: 1.2568, test_loss: 1.3237, test_f1: 0.2281
 epoch: 1, train_loss: 1.1833, test_loss: 1.2335, test_f1: 0.2600
 epoch: 2, train_loss: 1.1436, test_loss: 1.2333, test_f1: 0.3222
 epoch: 3, train_loss: 1.1279, test_loss: 1.2220, test_f1: 0.3662
 epoch: 4, train_loss: 1.0981, test_loss: 1.2057, test_f1: 0.3695
 epoch: 5, train_loss: 1.0934, test_loss: 1.2258, test_f1: 0.4158
 epoch: 6, train_loss: 1.0770, test_loss: 1.1944, test_f1: 0.4088
 epoch: 7, train_loss: 1.0564, test_loss: 1.2005, test_f1: 0.4449
 epoch: 8, train_loss: 1.0473, test_loss: 1.1926, test_f1: 0.4299
 epoch: 9, train_loss: 1.0395, test_loss: 1.2088, test_f1: 0.4716
 epoch: 10, train_loss: 1.0275, test_loss: 1.1466, test_f1: 0.4806
 epoch: 11, train_loss: 1.0158, test_loss: 1.1450, test_f1: 0.4894
 epoch: 12, train_loss: 1.0090, test_loss: 1.1410, test_f1: 0.5040
 epoch: 13, train_loss: 0.9879, test_loss: 1.1119, test_f1: 0.5014
 epoch: 14, train_loss: 0.9831, test_loss: 1.1138, test_f1: 0.5065
 epoch: 15, train_loss: 0.9713, test_loss: 1.0910, test_f1: 0.5037
 epoch: 16, train_loss: 0.9706, test_loss: 1.0914, test_f1: 0.5069
 epoch: 17, train_loss: 0.9658, test_loss: 1.1035, test_f1: 0.5134
 epoch: 18, train_loss: 0.9552, test_loss: 1.0624, test_f1: 0.5162
 epoch: 19, train_loss: 0.9407, test_loss: 1.0961, test_f1: 0.5038
 epoch: 20, train_loss: 0.9276, test_loss: 1.0733, test_f1: 0.5227
 epoch: 21, train_loss: 0.9215, test_loss: 1.0786, test_f1: 0.5374
 epoch: 22, train_loss: 0.9347, test_loss: 1.0810, test_f1: 0.5331
 epoch: 23, train_loss: 0.9183, test_loss: 1.0758, test_f1: 0.5421
 epoch: 24, train_loss: 0.9019, test_loss: 1.0462, test_f1: 0.5553
 epoch: 25, train_loss: 0.9146, test_loss: 1.0540, test_f1: 0.5442
 epoch: 26, train_loss: 0.8989, test_loss: 1.0795, test_f1: 0.5434
 epoch: 27, train_loss: 0.8923, test_loss: 1.1086, test_f1: 0.5502
 epoch: 28, train_loss: 0.8878, test_loss: 1.1181, test_f1: 0.5662
 epoch: 29, train_loss: 0.8867, test_loss: 1.1257, test_f1: 0.5631
 epoch: 30, train_loss: 0.8743, test_loss: 1.1058, test_f1: 0.5546
 epoch: 31, train_loss: 0.8639, test_loss: 1.1419, test_f1: 0.5501
 epoch: 32, train_loss: 0.8668, test_loss: 1.1644, test_f1: 0.5636
 epoch: 33, train_loss: 0.8559, test_loss: 1.1468, test_f1: 0.5652
 epoch: 34, train_loss: 0.8712, test_loss: 1.0855, test_f1: 0.5736
 epoch: 35, train_loss: 0.8528, test_loss: 1.0748, test_f1: 0.5644
 epoch: 36, train_loss: 0.8572, test_loss: 1.0980, test_f1: 0.5592
 epoch: 37, train_loss: 0.8599, test_loss: 1.1019, test_f1: 0.5783
 epoch: 38, train_loss: 0.8366, test_loss: 1.0608, test_f1: 0.5702
 epoch: 39, train_loss: 0.8473, test_loss: 1.0899, test_f1: 0.5769
 epoch: 40, train_loss: 0.8312, test_loss: 1.0833, test_f1: 0.5642
 epoch: 41, train_loss: 0.8474, test_loss: 1.0585, test_f1: 0.5725
 epoch: 42, train_loss: 0.8473, test_loss: 1.0583, test_f1: 0.5671
 epoch: 43, train_loss: 0.8347, test_loss: 1.0892, test_f1: 0.5906
 epoch: 44, train_loss: 0.8188, test_loss: 1.0480, test_f1: 0.5992
 epoch: 45, train_loss: 0.8185, test_loss: 1.0904, test_f1: 0.5771
 epoch: 46, train_loss: 0.8305, test_loss: 1.0945, test_f1: 0.5799
 epoch: 47, train_loss: 0.8184, test_loss: 1.1170, test_f1: 0.5630
 epoch: 48, train_loss: 0.8155, test_loss: 1.0767, test_f1: 0.5624
 epoch: 49, train_loss: 0.7978, test_loss: 1.0925, test_f1: 0.5736
 epoch: 50, train_loss: 0.8060, test_loss: 1.1500, test_f1: 0.5780
 epoch: 51, train_loss: 0.7825, test_loss: 1.1205, test_f1: 0.5823
 epoch: 52, train_loss: 0.7893, test_loss: 1.0896, test_f1: 0.5799
 epoch: 53, train_loss: 0.7824, test_loss: 1.0998, test_f1: 0.5796
 epoch: 54, train_loss: 0.7931, test_loss: 1.1004, test_f1: 0.5703
 epoch: 55, train_loss: 0.7725, test_loss: 1.1286, test_f1: 0.5665
 epoch: 56, train_loss: 0.7810, test_loss: 1.0745, test_f1: 0.5737
 epoch: 57, train_loss: 0.7771, test_loss: 1.1185, test_f1: 0.5906
 epoch: 58, train_loss: 0.7817, test_loss: 1.0991, test_f1: 0.5809
 epoch: 59, train_loss: 0.7730, test_loss: 1.0793, test_f1: 0.5790
 epoch: 60, train_loss: 0.7801, test_loss: 1.0928, test_f1: 0.5754
 epoch: 61, train_loss: 0.7640, test_loss: 1.1023, test_f1: 0.5791
 epoch: 62, train_loss: 0.7847, test_loss: 1.1236, test_f1: 0.5762
 epoch: 63, train_loss: 0.7916, test_loss: 1.0761, test_f1: 0.5785
 epoch: 64, train_loss: 0.7718, test_loss: 1.0874, test_f1: 0.5898
 epoch: 65, train_loss: 0.7790, test_loss: 1.1199, test_f1: 0.5744
 epoch: 66, train_loss: 0.7569, test_loss: 1.1144, test_f1: 0.5747
 epoch: 67, train_loss: 0.7644, test_loss: 1.1218, test_f1: 0.5903
 epoch: 68, train_loss: 0.7814, test_loss: 1.1086, test_f1: 0.5634
 epoch: 69, train_loss: 0.7530, test_loss: 1.1387, test_f1: 0.5695
 epoch: 70, train_loss: 0.7591, test_loss: 1.1172, test_f1: 0.5635
 epoch: 71, train_loss: 0.7580, test_loss: 1.1377, test_f1: 0.5725
 epoch: 72, train_loss: 0.7659, test_loss: 1.1103, test_f1: 0.5803
 epoch: 73, train_loss: 0.7616, test_loss: 1.1556, test_f1: 0.5622
 epoch: 74, train_loss: 0.7474, test_loss: 1.1109, test_f1: 0.5809
 epoch: 75, train_loss: 0.7459, test_loss: 1.1407, test_f1: 0.5880
 epoch: 76, train_loss: 0.7541, test_loss: 1.1343, test_f1: 0.5780
 epoch: 77, train_loss: 0.7333, test_loss: 1.1535, test_f1: 0.5780
 epoch: 78, train_loss: 0.7458, test_loss: 1.1664, test_f1: 0.5842
 epoch: 79, train_loss: 0.7465, test_loss: 1.1483, test_f1: 0.5688
 epoch: 80, train_loss: 0.7437, test_loss: 1.1586, test_f1: 0.5711
 epoch: 81, train_loss: 0.7594, test_loss: 1.1636, test_f1: 0.5703
 epoch: 82, train_loss: 0.7276, test_loss: 1.1541, test_f1: 0.5885
 epoch: 83, train_loss: 0.7401, test_loss: 1.1671, test_f1: 0.5730
 epoch: 84, train_loss: 0.7420, test_loss: 1.1506, test_f1: 0.5761
 epoch: 85, train_loss: 0.7489, test_loss: 1.1513, test_f1: 0.5725
 epoch: 86, train_loss: 0.7359, test_loss: 1.1581, test_f1: 0.5735
 epoch: 87, train_loss: 0.7356, test_loss: 1.1908, test_f1: 0.5836
 epoch: 88, train_loss: 0.7377, test_loss: 1.1219, test_f1: 0.5892
 epoch: 89, train_loss: 0.7393, test_loss: 1.1303, test_f1: 0.5791
 epoch: 90, train_loss: 0.7295, test_loss: 1.1390, test_f1: 0.5819
 epoch: 91, train_loss: 0.7223, test_loss: 1.1615, test_f1: 0.5800
 epoch: 92, train_loss: 0.7284, test_loss: 1.1564, test_f1: 0.5725
 epoch: 93, train_loss: 0.7362, test_loss: 1.1086, test_f1: 0.5787
 epoch: 94, train_loss: 0.7340, test_loss: 1.1100, test_f1: 0.5943
 epoch: 95, train_loss: 0.7327, test_loss: 1.1637, test_f1: 0.5857
 epoch: 96, train_loss: 0.7263, test_loss: 1.1454, test_f1: 0.5845
 epoch: 97, train_loss: 0.7323, test_loss: 1.1626, test_f1: 0.5867
 epoch: 98, train_loss: 0.7106, test_loss: 1.1332, test_f1: 0.5891
 epoch: 99, train_loss: 0.7323, test_loss: 1.1468, test_f1: 0.5783
##################ITERATION #3 ****************************************
 epoch: 0, train_loss: 1.2391, test_loss: 1.2649, test_f1: 0.2585
 epoch: 1, train_loss: 1.1557, test_loss: 1.2042, test_f1: 0.3518
 epoch: 2, train_loss: 1.1317, test_loss: 1.1895, test_f1: 0.3608
 epoch: 3, train_loss: 1.1093, test_loss: 1.1661, test_f1: 0.4033
 epoch: 4, train_loss: 1.0933, test_loss: 1.1564, test_f1: 0.3980
 epoch: 5, train_loss: 1.0797, test_loss: 1.1379, test_f1: 0.4312
 epoch: 6, train_loss: 1.0587, test_loss: 1.1336, test_f1: 0.4404
 epoch: 7, train_loss: 1.0543, test_loss: 1.0989, test_f1: 0.4722
 epoch: 8, train_loss: 1.0388, test_loss: 1.1026, test_f1: 0.4812
 epoch: 9, train_loss: 1.0258, test_loss: 1.0840, test_f1: 0.5131
 epoch: 10, train_loss: 1.0069, test_loss: 1.0787, test_f1: 0.5122
 epoch: 11, train_loss: 1.0111, test_loss: 1.0744, test_f1: 0.5156
 epoch: 12, train_loss: 0.9956, test_loss: 1.0692, test_f1: 0.5027
 epoch: 13, train_loss: 0.9743, test_loss: 1.0601, test_f1: 0.5090
 epoch: 14, train_loss: 0.9636, test_loss: 1.0473, test_f1: 0.5137
 epoch: 15, train_loss: 0.9626, test_loss: 1.0335, test_f1: 0.5147
 epoch: 16, train_loss: 0.9534, test_loss: 1.0596, test_f1: 0.5378
 epoch: 17, train_loss: 0.9455, test_loss: 1.0494, test_f1: 0.5298
 epoch: 18, train_loss: 0.9379, test_loss: 1.0618, test_f1: 0.5219
 epoch: 19, train_loss: 0.9464, test_loss: 1.0395, test_f1: 0.5405
 epoch: 20, train_loss: 0.9157, test_loss: 1.0478, test_f1: 0.5451
 epoch: 21, train_loss: 0.9166, test_loss: 1.0289, test_f1: 0.5285
 epoch: 22, train_loss: 0.9058, test_loss: 1.0411, test_f1: 0.5405
 epoch: 23, train_loss: 0.9065, test_loss: 1.0350, test_f1: 0.5308
 epoch: 24, train_loss: 0.8986, test_loss: 1.0533, test_f1: 0.5380
 epoch: 25, train_loss: 0.8939, test_loss: 1.0238, test_f1: 0.5366
 epoch: 26, train_loss: 0.8868, test_loss: 1.0129, test_f1: 0.5811
 epoch: 27, train_loss: 0.8831, test_loss: 1.0133, test_f1: 0.5698
 epoch: 28, train_loss: 0.8779, test_loss: 1.0286, test_f1: 0.5422
 epoch: 29, train_loss: 0.8750, test_loss: 1.0263, test_f1: 0.5719
 epoch: 30, train_loss: 0.8662, test_loss: 1.0126, test_f1: 0.5531
 epoch: 31, train_loss: 0.8524, test_loss: 1.0291, test_f1: 0.5910
 epoch: 32, train_loss: 0.8552, test_loss: 1.0226, test_f1: 0.5780
 epoch: 33, train_loss: 0.8456, test_loss: 1.0332, test_f1: 0.5886
 epoch: 34, train_loss: 0.8484, test_loss: 1.0180, test_f1: 0.5700
 epoch: 35, train_loss: 0.8309, test_loss: 1.0081, test_f1: 0.5714
 epoch: 36, train_loss: 0.8328, test_loss: 1.0510, test_f1: 0.6026
 epoch: 37, train_loss: 0.8236, test_loss: 1.0525, test_f1: 0.5876
 epoch: 38, train_loss: 0.8173, test_loss: 1.0584, test_f1: 0.5820
 epoch: 39, train_loss: 0.8208, test_loss: 1.0402, test_f1: 0.5797
 epoch: 40, train_loss: 0.8072, test_loss: 1.0577, test_f1: 0.5664
 epoch: 41, train_loss: 0.8167, test_loss: 1.0781, test_f1: 0.5814
 epoch: 42, train_loss: 0.8045, test_loss: 1.0503, test_f1: 0.6009
 epoch: 43, train_loss: 0.8127, test_loss: 1.0597, test_f1: 0.5632
 epoch: 44, train_loss: 0.7981, test_loss: 1.0716, test_f1: 0.5669
 epoch: 45, train_loss: 0.8047, test_loss: 1.0422, test_f1: 0.5608
 epoch: 46, train_loss: 0.7924, test_loss: 1.0653, test_f1: 0.5675
 epoch: 47, train_loss: 0.7858, test_loss: 1.0947, test_f1: 0.5751
 epoch: 48, train_loss: 0.7856, test_loss: 1.0742, test_f1: 0.5991
 epoch: 49, train_loss: 0.7795, test_loss: 1.0608, test_f1: 0.5852
 epoch: 50, train_loss: 0.7790, test_loss: 1.0932, test_f1: 0.5667
 epoch: 51, train_loss: 0.7672, test_loss: 1.0883, test_f1: 0.5740
 epoch: 52, train_loss: 0.7788, test_loss: 1.0897, test_f1: 0.5759
 epoch: 53, train_loss: 0.7677, test_loss: 1.0994, test_f1: 0.5911
 epoch: 54, train_loss: 0.7627, test_loss: 1.1214, test_f1: 0.5825
 epoch: 55, train_loss: 0.7507, test_loss: 1.1053, test_f1: 0.5933
 epoch: 56, train_loss: 0.7329, test_loss: 1.1265, test_f1: 0.5761
 epoch: 57, train_loss: 0.7642, test_loss: 1.1257, test_f1: 0.5801
 epoch: 58, train_loss: 0.7557, test_loss: 1.0921, test_f1: 0.5947
 epoch: 59, train_loss: 0.7545, test_loss: 1.1270, test_f1: 0.5927
 epoch: 60, train_loss: 0.7519, test_loss: 1.1201, test_f1: 0.5849
 epoch: 61, train_loss: 0.7434, test_loss: 1.1203, test_f1: 0.5929
 epoch: 62, train_loss: 0.7425, test_loss: 1.1547, test_f1: 0.5765
 epoch: 63, train_loss: 0.7570, test_loss: 1.1315, test_f1: 0.5977
 epoch: 64, train_loss: 0.7432, test_loss: 1.1104, test_f1: 0.5893
 epoch: 65, train_loss: 0.7339, test_loss: 1.1395, test_f1: 0.5783
 epoch: 66, train_loss: 0.7404, test_loss: 1.1490, test_f1: 0.5893
 epoch: 67, train_loss: 0.7152, test_loss: 1.1410, test_f1: 0.5925
 epoch: 68, train_loss: 0.7391, test_loss: 1.1587, test_f1: 0.5951
 epoch: 69, train_loss: 0.7437, test_loss: 1.1503, test_f1: 0.5896
 epoch: 70, train_loss: 0.7374, test_loss: 1.1115, test_f1: 0.5921
 epoch: 71, train_loss: 0.7332, test_loss: 1.1739, test_f1: 0.5924
 epoch: 72, train_loss: 0.7401, test_loss: 1.1654, test_f1: 0.5890
 epoch: 73, train_loss: 0.7198, test_loss: 1.1439, test_f1: 0.5740
 epoch: 74, train_loss: 0.7233, test_loss: 1.1776, test_f1: 0.5840
 epoch: 75, train_loss: 0.7371, test_loss: 1.1214, test_f1: 0.5811
 epoch: 76, train_loss: 0.7138, test_loss: 1.1625, test_f1: 0.5745
 epoch: 77, train_loss: 0.7148, test_loss: 1.1721, test_f1: 0.5827
 epoch: 78, train_loss: 0.7269, test_loss: 1.1728, test_f1: 0.5945
 epoch: 79, train_loss: 0.7083, test_loss: 1.1748, test_f1: 0.5799
 epoch: 80, train_loss: 0.7163, test_loss: 1.1832, test_f1: 0.5713
 epoch: 81, train_loss: 0.7180, test_loss: 1.1556, test_f1: 0.5891
 epoch: 82, train_loss: 0.7137, test_loss: 1.1589, test_f1: 0.5939
 epoch: 83, train_loss: 0.7153, test_loss: 1.1662, test_f1: 0.5734
 epoch: 84, train_loss: 0.7085, test_loss: 1.1822, test_f1: 0.5999
 epoch: 85, train_loss: 0.7019, test_loss: 1.2005, test_f1: 0.6060
 epoch: 86, train_loss: 0.7013, test_loss: 1.1975, test_f1: 0.5826
 epoch: 87, train_loss: 0.7171, test_loss: 1.2147, test_f1: 0.5750
 epoch: 88, train_loss: 0.7010, test_loss: 1.2212, test_f1: 0.5961
 epoch: 89, train_loss: 0.6879, test_loss: 1.2362, test_f1: 0.6098
 epoch: 90, train_loss: 0.6944, test_loss: 1.2502, test_f1: 0.6043
 epoch: 91, train_loss: 0.6826, test_loss: 1.2174, test_f1: 0.5965
 epoch: 92, train_loss: 0.7098, test_loss: 1.2159, test_f1: 0.6002
 epoch: 93, train_loss: 0.6976, test_loss: 1.2035, test_f1: 0.5898
 epoch: 94, train_loss: 0.7097, test_loss: 1.2244, test_f1: 0.6030
 epoch: 95, train_loss: 0.6897, test_loss: 1.2571, test_f1: 0.5904
 epoch: 96, train_loss: 0.6893, test_loss: 1.2558, test_f1: 0.5995
 epoch: 97, train_loss: 0.7046, test_loss: 1.2501, test_f1: 0.5943
 epoch: 98, train_loss: 0.6980, test_loss: 1.2609, test_f1: 0.5974
 epoch: 99, train_loss: 0.6757, test_loss: 1.2299, test_f1: 0.6040
##################ITERATION #4 ****************************************
 epoch: 0, train_loss: 1.2234, test_loss: 1.2763, test_f1: 0.2722
 epoch: 1, train_loss: 1.1554, test_loss: 1.2117, test_f1: 0.3296
 epoch: 2, train_loss: 1.1287, test_loss: 1.1853, test_f1: 0.3871
 epoch: 3, train_loss: 1.1084, test_loss: 1.1725, test_f1: 0.4169
 epoch: 4, train_loss: 1.0831, test_loss: 1.1516, test_f1: 0.4254
 epoch: 5, train_loss: 1.0906, test_loss: 1.1329, test_f1: 0.4455
 epoch: 6, train_loss: 1.0647, test_loss: 1.1186, test_f1: 0.4488
 epoch: 7, train_loss: 1.0497, test_loss: 1.1080, test_f1: 0.4559
 epoch: 8, train_loss: 1.0507, test_loss: 1.1013, test_f1: 0.4538
 epoch: 9, train_loss: 1.0319, test_loss: 1.0944, test_f1: 0.4633
 epoch: 10, train_loss: 1.0128, test_loss: 1.0942, test_f1: 0.4772
 epoch: 11, train_loss: 1.0257, test_loss: 1.0825, test_f1: 0.4969
 epoch: 12, train_loss: 1.0015, test_loss: 1.0667, test_f1: 0.5160
 epoch: 13, train_loss: 0.9932, test_loss: 1.0737, test_f1: 0.5336
 epoch: 14, train_loss: 0.9991, test_loss: 1.0566, test_f1: 0.5108
 epoch: 15, train_loss: 0.9840, test_loss: 1.0619, test_f1: 0.5291
 epoch: 16, train_loss: 0.9758, test_loss: 1.0405, test_f1: 0.5245
 epoch: 17, train_loss: 0.9683, test_loss: 1.0509, test_f1: 0.5197
 epoch: 18, train_loss: 0.9553, test_loss: 1.0470, test_f1: 0.5204
 epoch: 19, train_loss: 0.9553, test_loss: 1.0437, test_f1: 0.5298
 epoch: 20, train_loss: 0.9439, test_loss: 1.0580, test_f1: 0.5324
 epoch: 21, train_loss: 0.9469, test_loss: 1.0695, test_f1: 0.5287
 epoch: 22, train_loss: 0.9477, test_loss: 1.0393, test_f1: 0.5355
 epoch: 23, train_loss: 0.9413, test_loss: 1.0464, test_f1: 0.5398
 epoch: 24, train_loss: 0.9338, test_loss: 1.0432, test_f1: 0.5437
 epoch: 25, train_loss: 0.9267, test_loss: 1.0235, test_f1: 0.5420
 epoch: 26, train_loss: 0.9193, test_loss: 1.0293, test_f1: 0.5453
 epoch: 27, train_loss: 0.9077, test_loss: 1.0292, test_f1: 0.5392
 epoch: 28, train_loss: 0.9236, test_loss: 1.0416, test_f1: 0.5370
 epoch: 29, train_loss: 0.9046, test_loss: 1.0682, test_f1: 0.5424
 epoch: 30, train_loss: 0.9038, test_loss: 1.0443, test_f1: 0.5495
 epoch: 31, train_loss: 0.8947, test_loss: 1.0350, test_f1: 0.5532
 epoch: 32, train_loss: 0.8802, test_loss: 1.0317, test_f1: 0.5528
 epoch: 33, train_loss: 0.8883, test_loss: 1.0136, test_f1: 0.5426
 epoch: 34, train_loss: 0.8781, test_loss: 1.0462, test_f1: 0.5502
 epoch: 35, train_loss: 0.8841, test_loss: 1.0391, test_f1: 0.5656
 epoch: 36, train_loss: 0.8712, test_loss: 1.0359, test_f1: 0.5442
 epoch: 37, train_loss: 0.8835, test_loss: 1.0429, test_f1: 0.5385
 epoch: 38, train_loss: 0.8697, test_loss: 1.0330, test_f1: 0.5467
 epoch: 39, train_loss: 0.8681, test_loss: 1.0145, test_f1: 0.5413
 epoch: 40, train_loss: 0.8652, test_loss: 1.0356, test_f1: 0.5569
 epoch: 41, train_loss: 0.8623, test_loss: 1.0297, test_f1: 0.5482
 epoch: 42, train_loss: 0.8586, test_loss: 1.0329, test_f1: 0.5590
 epoch: 43, train_loss: 0.8709, test_loss: 1.0189, test_f1: 0.5574
 epoch: 44, train_loss: 0.8390, test_loss: 1.0244, test_f1: 0.5570
 epoch: 45, train_loss: 0.8274, test_loss: 1.0182, test_f1: 0.5511
 epoch: 46, train_loss: 0.8424, test_loss: 1.0349, test_f1: 0.5812
 epoch: 47, train_loss: 0.8345, test_loss: 1.0238, test_f1: 0.5584
 epoch: 48, train_loss: 0.8277, test_loss: 1.0173, test_f1: 0.5585
 epoch: 49, train_loss: 0.8337, test_loss: 1.0217, test_f1: 0.5482
 epoch: 50, train_loss: 0.8177, test_loss: 1.0057, test_f1: 0.5679
 epoch: 51, train_loss: 0.8258, test_loss: 1.0497, test_f1: 0.5656
 epoch: 52, train_loss: 0.8290, test_loss: 1.0437, test_f1: 0.5623
 epoch: 53, train_loss: 0.8062, test_loss: 1.0309, test_f1: 0.5687
 epoch: 54, train_loss: 0.8068, test_loss: 1.0328, test_f1: 0.5678
 epoch: 55, train_loss: 0.8083, test_loss: 1.0432, test_f1: 0.5771
 epoch: 56, train_loss: 0.8009, test_loss: 1.0242, test_f1: 0.5715
 epoch: 57, train_loss: 0.7975, test_loss: 1.0578, test_f1: 0.5564
 epoch: 58, train_loss: 0.8050, test_loss: 1.0708, test_f1: 0.5513
 epoch: 59, train_loss: 0.8066, test_loss: 1.0422, test_f1: 0.5602
 epoch: 60, train_loss: 0.7876, test_loss: 1.0482, test_f1: 0.5618
 epoch: 61, train_loss: 0.7885, test_loss: 1.0588, test_f1: 0.5554
 epoch: 62, train_loss: 0.7927, test_loss: 1.0573, test_f1: 0.5692
 epoch: 63, train_loss: 0.7879, test_loss: 1.0687, test_f1: 0.5621
 epoch: 64, train_loss: 0.7869, test_loss: 1.0252, test_f1: 0.5766
 epoch: 65, train_loss: 0.7924, test_loss: 1.0504, test_f1: 0.5547
 epoch: 66, train_loss: 0.7885, test_loss: 1.0776, test_f1: 0.5584
 epoch: 67, train_loss: 0.7835, test_loss: 1.0666, test_f1: 0.5732
 epoch: 68, train_loss: 0.7897, test_loss: 1.0766, test_f1: 0.5698
 epoch: 69, train_loss: 0.7840, test_loss: 1.1256, test_f1: 0.5551
 epoch: 70, train_loss: 0.7890, test_loss: 1.0672, test_f1: 0.5536
 epoch: 71, train_loss: 0.7687, test_loss: 1.0726, test_f1: 0.5707
 epoch: 72, train_loss: 0.7783, test_loss: 1.0491, test_f1: 0.5601
 epoch: 73, train_loss: 0.7768, test_loss: 1.0583, test_f1: 0.5644
 epoch: 74, train_loss: 0.7674, test_loss: 1.0818, test_f1: 0.5568
 epoch: 75, train_loss: 0.7820, test_loss: 1.1074, test_f1: 0.5544
 epoch: 76, train_loss: 0.7665, test_loss: 1.0493, test_f1: 0.5609
 epoch: 77, train_loss: 0.7816, test_loss: 1.0824, test_f1: 0.5614
 epoch: 78, train_loss: 0.7653, test_loss: 1.0875, test_f1: 0.5500
 epoch: 79, train_loss: 0.7637, test_loss: 1.1142, test_f1: 0.5570
 epoch: 80, train_loss: 0.7632, test_loss: 1.1232, test_f1: 0.5534
 epoch: 81, train_loss: 0.7575, test_loss: 1.0995, test_f1: 0.5533
 epoch: 82, train_loss: 0.7642, test_loss: 1.1153, test_f1: 0.5601
 epoch: 83, train_loss: 0.7566, test_loss: 1.0772, test_f1: 0.5561
 epoch: 84, train_loss: 0.7579, test_loss: 1.0980, test_f1: 0.5635
 epoch: 85, train_loss: 0.7497, test_loss: 1.1133, test_f1: 0.5613
 epoch: 86, train_loss: 0.7534, test_loss: 1.1383, test_f1: 0.5583
 epoch: 87, train_loss: 0.7515, test_loss: 1.1187, test_f1: 0.5618
 epoch: 88, train_loss: 0.7459, test_loss: 1.1121, test_f1: 0.5641
 epoch: 89, train_loss: 0.7412, test_loss: 1.1280, test_f1: 0.5604
 epoch: 90, train_loss: 0.7383, test_loss: 1.0858, test_f1: 0.5718
 epoch: 91, train_loss: 0.7341, test_loss: 1.0998, test_f1: 0.5703
 epoch: 92, train_loss: 0.7500, test_loss: 1.0812, test_f1: 0.5643
 epoch: 93, train_loss: 0.7365, test_loss: 1.1000, test_f1: 0.5796
 epoch: 94, train_loss: 0.7320, test_loss: 1.1012, test_f1: 0.5643
 epoch: 95, train_loss: 0.7315, test_loss: 1.1328, test_f1: 0.5763
 epoch: 96, train_loss: 0.7328, test_loss: 1.0967, test_f1: 0.5645
 epoch: 97, train_loss: 0.7312, test_loss: 1.0972, test_f1: 0.5799
 epoch: 98, train_loss: 0.7247, test_loss: 1.1856, test_f1: 0.5613
 epoch: 99, train_loss: 0.7179, test_loss: 1.1292, test_f1: 0.5640
##################ITERATION #5 ****************************************
 epoch: 0, train_loss: 1.2281, test_loss: 1.2817, test_f1: 0.3765
 epoch: 1, train_loss: 1.1366, test_loss: 1.1920, test_f1: 0.4141
 epoch: 2, train_loss: 1.1095, test_loss: 1.1766, test_f1: 0.4455
 epoch: 3, train_loss: 1.0998, test_loss: 1.1519, test_f1: 0.4920
 epoch: 4, train_loss: 1.0721, test_loss: 1.1334, test_f1: 0.4814
 epoch: 5, train_loss: 1.0571, test_loss: 1.1214, test_f1: 0.4909
 epoch: 6, train_loss: 1.0399, test_loss: 1.1171, test_f1: 0.4856
 epoch: 7, train_loss: 1.0305, test_loss: 1.1219, test_f1: 0.4751
 epoch: 8, train_loss: 1.0030, test_loss: 1.1074, test_f1: 0.5077
 epoch: 9, train_loss: 1.0037, test_loss: 1.0845, test_f1: 0.4773
 epoch: 10, train_loss: 1.0076, test_loss: 1.0779, test_f1: 0.5083
 epoch: 11, train_loss: 0.9831, test_loss: 1.0648, test_f1: 0.4970
 epoch: 12, train_loss: 0.9634, test_loss: 1.0797, test_f1: 0.5036
 epoch: 13, train_loss: 0.9612, test_loss: 1.0541, test_f1: 0.5174
 epoch: 14, train_loss: 0.9719, test_loss: 1.0725, test_f1: 0.5168
 epoch: 15, train_loss: 0.9595, test_loss: 1.0677, test_f1: 0.5076
 epoch: 16, train_loss: 0.9366, test_loss: 1.0932, test_f1: 0.5299
 epoch: 17, train_loss: 0.9372, test_loss: 1.0738, test_f1: 0.5472
 epoch: 18, train_loss: 0.9227, test_loss: 1.0725, test_f1: 0.5538
 epoch: 19, train_loss: 0.9134, test_loss: 1.0631, test_f1: 0.5573
 epoch: 20, train_loss: 0.9243, test_loss: 1.0584, test_f1: 0.5434
 epoch: 21, train_loss: 0.9093, test_loss: 1.0464, test_f1: 0.5555
 epoch: 22, train_loss: 0.9097, test_loss: 1.0532, test_f1: 0.5585
 epoch: 23, train_loss: 0.8887, test_loss: 1.0680, test_f1: 0.5636
 epoch: 24, train_loss: 0.8902, test_loss: 1.0509, test_f1: 0.5598
 epoch: 25, train_loss: 0.8799, test_loss: 1.0538, test_f1: 0.5598
 epoch: 26, train_loss: 0.8748, test_loss: 1.0751, test_f1: 0.5507
 epoch: 27, train_loss: 0.8685, test_loss: 1.0736, test_f1: 0.5756
 epoch: 28, train_loss: 0.8558, test_loss: 1.0711, test_f1: 0.5756
 epoch: 29, train_loss: 0.8796, test_loss: 1.0710, test_f1: 0.5750
 epoch: 30, train_loss: 0.8598, test_loss: 1.0414, test_f1: 0.5636
 epoch: 31, train_loss: 0.8541, test_loss: 1.0932, test_f1: 0.5644
 epoch: 32, train_loss: 0.8483, test_loss: 1.0474, test_f1: 0.5666
 epoch: 33, train_loss: 0.8516, test_loss: 1.0534, test_f1: 0.5633
 epoch: 34, train_loss: 0.8256, test_loss: 1.0973, test_f1: 0.5594
 epoch: 35, train_loss: 0.8289, test_loss: 1.0856, test_f1: 0.5847
 epoch: 36, train_loss: 0.8229, test_loss: 1.0979, test_f1: 0.5749
 epoch: 37, train_loss: 0.8329, test_loss: 1.1018, test_f1: 0.5675
 epoch: 38, train_loss: 0.8294, test_loss: 1.0871, test_f1: 0.5634
 epoch: 39, train_loss: 0.8246, test_loss: 1.0952, test_f1: 0.5589
 epoch: 40, train_loss: 0.8182, test_loss: 1.1199, test_f1: 0.5583
 epoch: 41, train_loss: 0.8127, test_loss: 1.0849, test_f1: 0.5717
 epoch: 42, train_loss: 0.8003, test_loss: 1.1043, test_f1: 0.5669
 epoch: 43, train_loss: 0.8141, test_loss: 1.1139, test_f1: 0.5861
 epoch: 44, train_loss: 0.8008, test_loss: 1.0715, test_f1: 0.5796
 epoch: 45, train_loss: 0.8039, test_loss: 1.1284, test_f1: 0.5828
 epoch: 46, train_loss: 0.7929, test_loss: 1.1322, test_f1: 0.5823
 epoch: 47, train_loss: 0.7893, test_loss: 1.1240, test_f1: 0.5809
 epoch: 48, train_loss: 0.7779, test_loss: 1.1412, test_f1: 0.5765
 epoch: 49, train_loss: 0.7812, test_loss: 1.1216, test_f1: 0.5894
 epoch: 50, train_loss: 0.7675, test_loss: 1.1435, test_f1: 0.5777
 epoch: 51, train_loss: 0.7524, test_loss: 1.1508, test_f1: 0.5819
 epoch: 52, train_loss: 0.7594, test_loss: 1.1617, test_f1: 0.5841
 epoch: 53, train_loss: 0.7767, test_loss: 1.1465, test_f1: 0.5883
 epoch: 54, train_loss: 0.7800, test_loss: 1.1537, test_f1: 0.5847
 epoch: 55, train_loss: 0.7533, test_loss: 1.1455, test_f1: 0.5688
 epoch: 56, train_loss: 0.7586, test_loss: 1.1597, test_f1: 0.5849
 epoch: 57, train_loss: 0.7588, test_loss: 1.1600, test_f1: 0.5785
 epoch: 58, train_loss: 0.7516, test_loss: 1.1500, test_f1: 0.5755
 epoch: 59, train_loss: 0.7489, test_loss: 1.1877, test_f1: 0.5756
 epoch: 60, train_loss: 0.7697, test_loss: 1.1621, test_f1: 0.5840
 epoch: 61, train_loss: 0.7512, test_loss: 1.1715, test_f1: 0.5831
 epoch: 62, train_loss: 0.7362, test_loss: 1.1765, test_f1: 0.5808
 epoch: 63, train_loss: 0.7318, test_loss: 1.2008, test_f1: 0.5782
 epoch: 64, train_loss: 0.7414, test_loss: 1.1792, test_f1: 0.5808
 epoch: 65, train_loss: 0.7480, test_loss: 1.1903, test_f1: 0.5733
 epoch: 66, train_loss: 0.7301, test_loss: 1.2156, test_f1: 0.5705
 epoch: 67, train_loss: 0.7374, test_loss: 1.2284, test_f1: 0.5643
 epoch: 68, train_loss: 0.7367, test_loss: 1.2336, test_f1: 0.5696
 epoch: 69, train_loss: 0.7208, test_loss: 1.1821, test_f1: 0.5947
 epoch: 70, train_loss: 0.7232, test_loss: 1.1531, test_f1: 0.5794
 epoch: 71, train_loss: 0.7343, test_loss: 1.2389, test_f1: 0.5739
 epoch: 72, train_loss: 0.7231, test_loss: 1.2337, test_f1: 0.5730
 epoch: 73, train_loss: 0.7136, test_loss: 1.2070, test_f1: 0.5763
 epoch: 74, train_loss: 0.7256, test_loss: 1.2554, test_f1: 0.5655
 epoch: 75, train_loss: 0.7112, test_loss: 1.2396, test_f1: 0.5709
 epoch: 76, train_loss: 0.7076, test_loss: 1.2302, test_f1: 0.5807
 epoch: 77, train_loss: 0.7212, test_loss: 1.2340, test_f1: 0.5616
 epoch: 78, train_loss: 0.7033, test_loss: 1.2341, test_f1: 0.5765
 epoch: 79, train_loss: 0.7003, test_loss: 1.2587, test_f1: 0.5734
 epoch: 80, train_loss: 0.7203, test_loss: 1.2605, test_f1: 0.5815
 epoch: 81, train_loss: 0.7147, test_loss: 1.2757, test_f1: 0.5656
 epoch: 82, train_loss: 0.7067, test_loss: 1.2636, test_f1: 0.5538
 epoch: 83, train_loss: 0.7061, test_loss: 1.2588, test_f1: 0.5758
 epoch: 84, train_loss: 0.7091, test_loss: 1.2766, test_f1: 0.5725
 epoch: 85, train_loss: 0.7071, test_loss: 1.2715, test_f1: 0.5888
 epoch: 86, train_loss: 0.6776, test_loss: 1.2675, test_f1: 0.5864
 epoch: 87, train_loss: 0.7029, test_loss: 1.2613, test_f1: 0.5749
 epoch: 88, train_loss: 0.6895, test_loss: 1.2634, test_f1: 0.5914
 epoch: 89, train_loss: 0.6864, test_loss: 1.2574, test_f1: 0.5805
 epoch: 90, train_loss: 0.6841, test_loss: 1.2680, test_f1: 0.5720
 epoch: 91, train_loss: 0.6912, test_loss: 1.2875, test_f1: 0.5857
 epoch: 92, train_loss: 0.7066, test_loss: 1.2691, test_f1: 0.5766
 epoch: 93, train_loss: 0.6886, test_loss: 1.3206, test_f1: 0.5706
 epoch: 94, train_loss: 0.6879, test_loss: 1.2877, test_f1: 0.5819
 epoch: 95, train_loss: 0.6861, test_loss: 1.2867, test_f1: 0.5966
 epoch: 96, train_loss: 0.6945, test_loss: 1.2931, test_f1: 0.5818
 epoch: 97, train_loss: 0.6783, test_loss: 1.3156, test_f1: 0.5840
 epoch: 98, train_loss: 0.6857, test_loss: 1.3124, test_f1: 0.5736
 epoch: 99, train_loss: 0.6705, test_loss: 1.2944, test_f1: 0.5943
##################ITERATION #6 ****************************************
 epoch: 0, train_loss: 1.2396, test_loss: 1.2898, test_f1: 0.2380
 epoch: 1, train_loss: 1.1403, test_loss: 1.1858, test_f1: 0.3765
 epoch: 2, train_loss: 1.1034, test_loss: 1.1507, test_f1: 0.4230
 epoch: 3, train_loss: 1.0974, test_loss: 1.1347, test_f1: 0.4695
 epoch: 4, train_loss: 1.0649, test_loss: 1.1123, test_f1: 0.4724
 epoch: 5, train_loss: 1.0526, test_loss: 1.1011, test_f1: 0.5020
 epoch: 6, train_loss: 1.0317, test_loss: 1.0846, test_f1: 0.4837
 epoch: 7, train_loss: 1.0125, test_loss: 1.0814, test_f1: 0.5209
 epoch: 8, train_loss: 1.0036, test_loss: 1.0750, test_f1: 0.5048
 epoch: 9, train_loss: 1.0019, test_loss: 1.0707, test_f1: 0.5126
 epoch: 10, train_loss: 0.9748, test_loss: 1.0712, test_f1: 0.5078
 epoch: 11, train_loss: 0.9719, test_loss: 1.0506, test_f1: 0.5082
 epoch: 12, train_loss: 0.9825, test_loss: 1.0608, test_f1: 0.5166
 epoch: 13, train_loss: 0.9630, test_loss: 1.0700, test_f1: 0.5342
 epoch: 14, train_loss: 0.9714, test_loss: 1.0743, test_f1: 0.5365
 epoch: 15, train_loss: 0.9492, test_loss: 1.0666, test_f1: 0.5361
 epoch: 16, train_loss: 0.9385, test_loss: 1.0709, test_f1: 0.5348
 epoch: 17, train_loss: 0.9477, test_loss: 1.0602, test_f1: 0.5446
 epoch: 18, train_loss: 0.9353, test_loss: 1.0698, test_f1: 0.5492
 epoch: 19, train_loss: 0.9176, test_loss: 1.0752, test_f1: 0.5238
 epoch: 20, train_loss: 0.9162, test_loss: 1.0763, test_f1: 0.5355
 epoch: 21, train_loss: 0.9100, test_loss: 1.0602, test_f1: 0.5487
 epoch: 22, train_loss: 0.9083, test_loss: 1.0578, test_f1: 0.5395
 epoch: 23, train_loss: 0.8975, test_loss: 1.0712, test_f1: 0.5490
 epoch: 24, train_loss: 0.8866, test_loss: 1.0815, test_f1: 0.5298
 epoch: 25, train_loss: 0.8843, test_loss: 1.0733, test_f1: 0.5464
 epoch: 26, train_loss: 0.8767, test_loss: 1.0899, test_f1: 0.5469
 epoch: 27, train_loss: 0.8763, test_loss: 1.0760, test_f1: 0.5374
 epoch: 28, train_loss: 0.8760, test_loss: 1.0669, test_f1: 0.5427
 epoch: 29, train_loss: 0.8652, test_loss: 1.0524, test_f1: 0.5699
 epoch: 30, train_loss: 0.8668, test_loss: 1.0832, test_f1: 0.5461
 epoch: 31, train_loss: 0.8530, test_loss: 1.0620, test_f1: 0.5673
 epoch: 32, train_loss: 0.8586, test_loss: 1.0721, test_f1: 0.5650
 epoch: 33, train_loss: 0.8580, test_loss: 1.0452, test_f1: 0.5672
 epoch: 34, train_loss: 0.8510, test_loss: 1.0483, test_f1: 0.5710
 epoch: 35, train_loss: 0.8548, test_loss: 1.0681, test_f1: 0.5517
 epoch: 36, train_loss: 0.8349, test_loss: 1.0925, test_f1: 0.5540
 epoch: 37, train_loss: 0.8178, test_loss: 1.0659, test_f1: 0.5669
 epoch: 38, train_loss: 0.8268, test_loss: 1.0733, test_f1: 0.5719
 epoch: 39, train_loss: 0.8342, test_loss: 1.0530, test_f1: 0.5664
 epoch: 40, train_loss: 0.8267, test_loss: 1.0711, test_f1: 0.5624
 epoch: 41, train_loss: 0.8124, test_loss: 1.0885, test_f1: 0.5657
 epoch: 42, train_loss: 0.8228, test_loss: 1.0779, test_f1: 0.5583
 epoch: 43, train_loss: 0.8229, test_loss: 1.0617, test_f1: 0.5909
 epoch: 44, train_loss: 0.8019, test_loss: 1.0965, test_f1: 0.5752
 epoch: 45, train_loss: 0.8120, test_loss: 1.1011, test_f1: 0.5632
 epoch: 46, train_loss: 0.8161, test_loss: 1.0808, test_f1: 0.5860
 epoch: 47, train_loss: 0.8114, test_loss: 1.0719, test_f1: 0.5963
 epoch: 48, train_loss: 0.8101, test_loss: 1.0766, test_f1: 0.5911
 epoch: 49, train_loss: 0.7975, test_loss: 1.0912, test_f1: 0.5624
 epoch: 50, train_loss: 0.7925, test_loss: 1.0732, test_f1: 0.5643
 epoch: 51, train_loss: 0.7826, test_loss: 1.0834, test_f1: 0.5747
 epoch: 52, train_loss: 0.7820, test_loss: 1.0812, test_f1: 0.5803
 epoch: 53, train_loss: 0.7832, test_loss: 1.1026, test_f1: 0.5762
 epoch: 54, train_loss: 0.7618, test_loss: 1.1063, test_f1: 0.5785
 epoch: 55, train_loss: 0.7801, test_loss: 1.1011, test_f1: 0.5810
 epoch: 56, train_loss: 0.7624, test_loss: 1.0861, test_f1: 0.5855
 epoch: 57, train_loss: 0.7731, test_loss: 1.1008, test_f1: 0.5788
 epoch: 58, train_loss: 0.7846, test_loss: 1.1188, test_f1: 0.5662
 epoch: 59, train_loss: 0.7541, test_loss: 1.1056, test_f1: 0.5791
 epoch: 60, train_loss: 0.7513, test_loss: 1.1263, test_f1: 0.5739
 epoch: 61, train_loss: 0.7701, test_loss: 1.1379, test_f1: 0.5759
 epoch: 62, train_loss: 0.7611, test_loss: 1.1122, test_f1: 0.5658
 epoch: 63, train_loss: 0.7473, test_loss: 1.1297, test_f1: 0.5633
 epoch: 64, train_loss: 0.7513, test_loss: 1.1177, test_f1: 0.5688
 epoch: 65, train_loss: 0.7534, test_loss: 1.1433, test_f1: 0.5647
 epoch: 66, train_loss: 0.7407, test_loss: 1.1365, test_f1: 0.5680
 epoch: 67, train_loss: 0.7464, test_loss: 1.1521, test_f1: 0.5728
 epoch: 68, train_loss: 0.7520, test_loss: 1.1228, test_f1: 0.5758
 epoch: 69, train_loss: 0.7405, test_loss: 1.1363, test_f1: 0.5735
 epoch: 70, train_loss: 0.7471, test_loss: 1.1288, test_f1: 0.5745
 epoch: 71, train_loss: 0.7585, test_loss: 1.1622, test_f1: 0.5622
 epoch: 72, train_loss: 0.7469, test_loss: 1.1486, test_f1: 0.5582
 epoch: 73, train_loss: 0.7488, test_loss: 1.1453, test_f1: 0.5820
 epoch: 74, train_loss: 0.7484, test_loss: 1.1818, test_f1: 0.5635
 epoch: 75, train_loss: 0.7264, test_loss: 1.1689, test_f1: 0.5563
 epoch: 76, train_loss: 0.7482, test_loss: 1.1653, test_f1: 0.5515
 epoch: 77, train_loss: 0.7278, test_loss: 1.1622, test_f1: 0.5432
 epoch: 78, train_loss: 0.7463, test_loss: 1.1964, test_f1: 0.5579
 epoch: 79, train_loss: 0.7107, test_loss: 1.1671, test_f1: 0.5559
 epoch: 80, train_loss: 0.7269, test_loss: 1.1876, test_f1: 0.5485
 epoch: 81, train_loss: 0.7388, test_loss: 1.1857, test_f1: 0.5578
 epoch: 82, train_loss: 0.7377, test_loss: 1.1797, test_f1: 0.5636
 epoch: 83, train_loss: 0.7197, test_loss: 1.1713, test_f1: 0.5570
 epoch: 84, train_loss: 0.7212, test_loss: 1.2174, test_f1: 0.5498
 epoch: 85, train_loss: 0.7364, test_loss: 1.1957, test_f1: 0.5476
 epoch: 86, train_loss: 0.7195, test_loss: 1.2354, test_f1: 0.5464
 epoch: 87, train_loss: 0.7298, test_loss: 1.1704, test_f1: 0.5722
 epoch: 88, train_loss: 0.7272, test_loss: 1.1907, test_f1: 0.5712
 epoch: 89, train_loss: 0.7146, test_loss: 1.1969, test_f1: 0.5544
 epoch: 90, train_loss: 0.7238, test_loss: 1.1739, test_f1: 0.5567
 epoch: 91, train_loss: 0.7037, test_loss: 1.2217, test_f1: 0.5445
 epoch: 92, train_loss: 0.7189, test_loss: 1.1983, test_f1: 0.5638
 epoch: 93, train_loss: 0.7109, test_loss: 1.1858, test_f1: 0.5580
 epoch: 94, train_loss: 0.7163, test_loss: 1.1946, test_f1: 0.5591
 epoch: 95, train_loss: 0.7005, test_loss: 1.1819, test_f1: 0.5618
 epoch: 96, train_loss: 0.7095, test_loss: 1.2012, test_f1: 0.5576
 epoch: 97, train_loss: 0.7125, test_loss: 1.2040, test_f1: 0.5529
 epoch: 98, train_loss: 0.7074, test_loss: 1.2076, test_f1: 0.5433
 epoch: 99, train_loss: 0.7104, test_loss: 1.2057, test_f1: 0.5495
##################ITERATION #7 ****************************************
 epoch: 0, train_loss: 1.2350, test_loss: 1.3212, test_f1: 0.2914
 epoch: 1, train_loss: 1.1486, test_loss: 1.2133, test_f1: 0.3934
 epoch: 2, train_loss: 1.1227, test_loss: 1.1972, test_f1: 0.4460
 epoch: 3, train_loss: 1.0985, test_loss: 1.1852, test_f1: 0.4351
 epoch: 4, train_loss: 1.0827, test_loss: 1.1647, test_f1: 0.4808
 epoch: 5, train_loss: 1.0895, test_loss: 1.1652, test_f1: 0.4678
 epoch: 6, train_loss: 1.0617, test_loss: 1.1521, test_f1: 0.4591
 epoch: 7, train_loss: 1.0395, test_loss: 1.1426, test_f1: 0.4593
 epoch: 8, train_loss: 1.0386, test_loss: 1.1338, test_f1: 0.5059
 epoch: 9, train_loss: 1.0266, test_loss: 1.1018, test_f1: 0.5209
 epoch: 10, train_loss: 1.0222, test_loss: 1.1039, test_f1: 0.5199
 epoch: 11, train_loss: 0.9941, test_loss: 1.1019, test_f1: 0.5149
 epoch: 12, train_loss: 0.9949, test_loss: 1.1033, test_f1: 0.5043
 epoch: 13, train_loss: 0.9847, test_loss: 1.0915, test_f1: 0.5291
 epoch: 14, train_loss: 0.9749, test_loss: 1.0787, test_f1: 0.5239
 epoch: 15, train_loss: 0.9829, test_loss: 1.0817, test_f1: 0.5397
 epoch: 16, train_loss: 0.9674, test_loss: 1.0727, test_f1: 0.5428
 epoch: 17, train_loss: 0.9512, test_loss: 1.0625, test_f1: 0.5477
 epoch: 18, train_loss: 0.9361, test_loss: 1.0683, test_f1: 0.5519
 epoch: 19, train_loss: 0.9419, test_loss: 1.0876, test_f1: 0.5439
 epoch: 20, train_loss: 0.9513, test_loss: 1.0580, test_f1: 0.5500
 epoch: 21, train_loss: 0.9481, test_loss: 1.0398, test_f1: 0.5534
 epoch: 22, train_loss: 0.9233, test_loss: 1.0521, test_f1: 0.5533
 epoch: 23, train_loss: 0.9231, test_loss: 1.0582, test_f1: 0.5390
 epoch: 24, train_loss: 0.9291, test_loss: 1.0495, test_f1: 0.5522
 epoch: 25, train_loss: 0.9087, test_loss: 1.0416, test_f1: 0.5541
 epoch: 26, train_loss: 0.8967, test_loss: 1.0387, test_f1: 0.5520
 epoch: 27, train_loss: 0.9029, test_loss: 1.0301, test_f1: 0.5427
 epoch: 28, train_loss: 0.8899, test_loss: 1.0342, test_f1: 0.5478
 epoch: 29, train_loss: 0.8912, test_loss: 1.0449, test_f1: 0.5721
 epoch: 30, train_loss: 0.9022, test_loss: 1.0123, test_f1: 0.5719
 epoch: 31, train_loss: 0.8605, test_loss: 1.0262, test_f1: 0.5806
 epoch: 32, train_loss: 0.8780, test_loss: 1.0410, test_f1: 0.5723
 epoch: 33, train_loss: 0.8658, test_loss: 1.0286, test_f1: 0.5944
 epoch: 34, train_loss: 0.8591, test_loss: 0.9999, test_f1: 0.5656
 epoch: 35, train_loss: 0.8656, test_loss: 1.0467, test_f1: 0.5500
 epoch: 36, train_loss: 0.8629, test_loss: 1.0364, test_f1: 0.5577
 epoch: 37, train_loss: 0.8501, test_loss: 1.0220, test_f1: 0.5575
 epoch: 38, train_loss: 0.8610, test_loss: 1.0452, test_f1: 0.5614
 epoch: 39, train_loss: 0.8493, test_loss: 1.0588, test_f1: 0.5450
 epoch: 40, train_loss: 0.8392, test_loss: 1.0258, test_f1: 0.5709
 epoch: 41, train_loss: 0.8447, test_loss: 1.0020, test_f1: 0.5684
 epoch: 42, train_loss: 0.8413, test_loss: 1.0495, test_f1: 0.5709
 epoch: 43, train_loss: 0.8395, test_loss: 1.0278, test_f1: 0.5741
 epoch: 44, train_loss: 0.8357, test_loss: 1.0234, test_f1: 0.5809
 epoch: 45, train_loss: 0.8254, test_loss: 0.9938, test_f1: 0.5756
 epoch: 46, train_loss: 0.8172, test_loss: 1.0325, test_f1: 0.5742
 epoch: 47, train_loss: 0.8204, test_loss: 1.0642, test_f1: 0.5677
 epoch: 48, train_loss: 0.8229, test_loss: 1.0658, test_f1: 0.5544
 epoch: 49, train_loss: 0.8292, test_loss: 1.0294, test_f1: 0.5699
 epoch: 50, train_loss: 0.8105, test_loss: 1.0491, test_f1: 0.5730
 epoch: 51, train_loss: 0.7981, test_loss: 1.0600, test_f1: 0.5674
 epoch: 52, train_loss: 0.8055, test_loss: 1.0396, test_f1: 0.5782
 epoch: 53, train_loss: 0.8052, test_loss: 1.0596, test_f1: 0.5716
 epoch: 54, train_loss: 0.7940, test_loss: 1.0495, test_f1: 0.5812
 epoch: 55, train_loss: 0.7844, test_loss: 1.0488, test_f1: 0.5862
 epoch: 56, train_loss: 0.7904, test_loss: 1.0517, test_f1: 0.5731
 epoch: 57, train_loss: 0.7837, test_loss: 1.0456, test_f1: 0.5874
 epoch: 58, train_loss: 0.7893, test_loss: 1.0537, test_f1: 0.5850
 epoch: 59, train_loss: 0.7842, test_loss: 1.0341, test_f1: 0.6017
 epoch: 60, train_loss: 0.7823, test_loss: 1.0417, test_f1: 0.5777
 epoch: 61, train_loss: 0.7841, test_loss: 1.0570, test_f1: 0.5831
 epoch: 62, train_loss: 0.7776, test_loss: 1.0765, test_f1: 0.5757
 epoch: 63, train_loss: 0.7927, test_loss: 1.0634, test_f1: 0.5633
 epoch: 64, train_loss: 0.7744, test_loss: 1.0882, test_f1: 0.5780
 epoch: 65, train_loss: 0.7671, test_loss: 1.1002, test_f1: 0.5846
 epoch: 66, train_loss: 0.7664, test_loss: 1.0784, test_f1: 0.5852
 epoch: 67, train_loss: 0.7899, test_loss: 1.0828, test_f1: 0.5815
 epoch: 68, train_loss: 0.7696, test_loss: 1.0892, test_f1: 0.5923
 epoch: 69, train_loss: 0.7701, test_loss: 1.1110, test_f1: 0.5748
 epoch: 70, train_loss: 0.7461, test_loss: 1.0776, test_f1: 0.5838
 epoch: 71, train_loss: 0.7679, test_loss: 1.0884, test_f1: 0.5805
 epoch: 72, train_loss: 0.7599, test_loss: 1.0815, test_f1: 0.5895
 epoch: 73, train_loss: 0.7624, test_loss: 1.0883, test_f1: 0.5840
 epoch: 74, train_loss: 0.7745, test_loss: 1.1046, test_f1: 0.5675
 epoch: 75, train_loss: 0.7437, test_loss: 1.0980, test_f1: 0.5920
 epoch: 76, train_loss: 0.7644, test_loss: 1.0984, test_f1: 0.5883
 epoch: 77, train_loss: 0.7516, test_loss: 1.1007, test_f1: 0.5744
 epoch: 78, train_loss: 0.7652, test_loss: 1.0900, test_f1: 0.5725
 epoch: 79, train_loss: 0.7613, test_loss: 1.1196, test_f1: 0.5803
 epoch: 80, train_loss: 0.7501, test_loss: 1.1054, test_f1: 0.5895
 epoch: 81, train_loss: 0.7475, test_loss: 1.0981, test_f1: 0.5843
 epoch: 82, train_loss: 0.7639, test_loss: 1.1126, test_f1: 0.5945
 epoch: 83, train_loss: 0.7565, test_loss: 1.1312, test_f1: 0.5861
 epoch: 84, train_loss: 0.7502, test_loss: 1.1039, test_f1: 0.5991
 epoch: 85, train_loss: 0.7432, test_loss: 1.1148, test_f1: 0.5834
 epoch: 86, train_loss: 0.7532, test_loss: 1.0981, test_f1: 0.5927
 epoch: 87, train_loss: 0.7477, test_loss: 1.1141, test_f1: 0.5935
 epoch: 88, train_loss: 0.7377, test_loss: 1.1381, test_f1: 0.6015
 epoch: 89, train_loss: 0.7477, test_loss: 1.1191, test_f1: 0.5909
 epoch: 90, train_loss: 0.7351, test_loss: 1.1447, test_f1: 0.5722
 epoch: 91, train_loss: 0.7503, test_loss: 1.1419, test_f1: 0.5920
 epoch: 92, train_loss: 0.7288, test_loss: 1.1203, test_f1: 0.5936
 epoch: 93, train_loss: 0.7370, test_loss: 1.1358, test_f1: 0.5934
 epoch: 94, train_loss: 0.7274, test_loss: 1.1466, test_f1: 0.5901
 epoch: 95, train_loss: 0.7326, test_loss: 1.1566, test_f1: 0.5781
 epoch: 96, train_loss: 0.7219, test_loss: 1.1566, test_f1: 0.5848
 epoch: 97, train_loss: 0.7345, test_loss: 1.1608, test_f1: 0.5955
 epoch: 98, train_loss: 0.7230, test_loss: 1.1585, test_f1: 0.6001
 epoch: 99, train_loss: 0.7087, test_loss: 1.1421, test_f1: 0.5896
##################ITERATION #8 ****************************************
 epoch: 0, train_loss: 1.2754, test_loss: 1.2230, test_f1: 0.3578
 epoch: 1, train_loss: 1.1465, test_loss: 1.1690, test_f1: 0.3979
 epoch: 2, train_loss: 1.1157, test_loss: 1.1204, test_f1: 0.4483
 epoch: 3, train_loss: 1.0990, test_loss: 1.1184, test_f1: 0.4744
 epoch: 4, train_loss: 1.1023, test_loss: 1.0971, test_f1: 0.4853
 epoch: 5, train_loss: 1.0720, test_loss: 1.0992, test_f1: 0.4954
 epoch: 6, train_loss: 1.0579, test_loss: 1.0832, test_f1: 0.4914
 epoch: 7, train_loss: 1.0160, test_loss: 1.0897, test_f1: 0.4868
 epoch: 8, train_loss: 1.0392, test_loss: 1.0826, test_f1: 0.5116
 epoch: 9, train_loss: 1.0148, test_loss: 1.0842, test_f1: 0.5203
 epoch: 10, train_loss: 1.0017, test_loss: 1.0854, test_f1: 0.5002
 epoch: 11, train_loss: 1.0020, test_loss: 1.0776, test_f1: 0.5088
 epoch: 12, train_loss: 0.9895, test_loss: 1.0780, test_f1: 0.5375
 epoch: 13, train_loss: 0.9825, test_loss: 1.0672, test_f1: 0.5166
 epoch: 14, train_loss: 1.0010, test_loss: 1.0476, test_f1: 0.5197
 epoch: 15, train_loss: 0.9484, test_loss: 1.0478, test_f1: 0.5253
 epoch: 16, train_loss: 0.9611, test_loss: 1.0387, test_f1: 0.5421
 epoch: 17, train_loss: 0.9383, test_loss: 1.0661, test_f1: 0.5272
 epoch: 18, train_loss: 0.9397, test_loss: 1.0553, test_f1: 0.5457
 epoch: 19, train_loss: 0.9240, test_loss: 1.0516, test_f1: 0.5492
 epoch: 20, train_loss: 0.9182, test_loss: 1.0521, test_f1: 0.5472
 epoch: 21, train_loss: 0.9388, test_loss: 1.0450, test_f1: 0.5477
 epoch: 22, train_loss: 0.9133, test_loss: 1.0318, test_f1: 0.5632
 epoch: 23, train_loss: 0.9084, test_loss: 1.0504, test_f1: 0.5615
 epoch: 24, train_loss: 0.9024, test_loss: 0.9997, test_f1: 0.5704
 epoch: 25, train_loss: 0.9028, test_loss: 1.0345, test_f1: 0.5592
 epoch: 26, train_loss: 0.8990, test_loss: 1.0260, test_f1: 0.5638
 epoch: 27, train_loss: 0.9069, test_loss: 1.0051, test_f1: 0.5620
 epoch: 28, train_loss: 0.8771, test_loss: 1.0490, test_f1: 0.5691
 epoch: 29, train_loss: 0.8801, test_loss: 1.0027, test_f1: 0.5722
 epoch: 30, train_loss: 0.8906, test_loss: 1.0444, test_f1: 0.5641
 epoch: 31, train_loss: 0.8828, test_loss: 1.0152, test_f1: 0.5858
 epoch: 32, train_loss: 0.8664, test_loss: 1.0366, test_f1: 0.5666
 epoch: 33, train_loss: 0.8652, test_loss: 1.0413, test_f1: 0.5620
 epoch: 34, train_loss: 0.8535, test_loss: 1.0446, test_f1: 0.5545
 epoch: 35, train_loss: 0.8586, test_loss: 1.0579, test_f1: 0.5736
 epoch: 36, train_loss: 0.8474, test_loss: 1.0766, test_f1: 0.5834
 epoch: 37, train_loss: 0.8556, test_loss: 1.0563, test_f1: 0.5889
 epoch: 38, train_loss: 0.8558, test_loss: 1.0546, test_f1: 0.5753
 epoch: 39, train_loss: 0.8483, test_loss: 1.0501, test_f1: 0.5760
 epoch: 40, train_loss: 0.8229, test_loss: 1.0597, test_f1: 0.5933
 epoch: 41, train_loss: 0.8285, test_loss: 1.0183, test_f1: 0.5607
 epoch: 42, train_loss: 0.8497, test_loss: 1.0828, test_f1: 0.5877
 epoch: 43, train_loss: 0.8305, test_loss: 1.0670, test_f1: 0.5810
 epoch: 44, train_loss: 0.7980, test_loss: 1.0789, test_f1: 0.5838
 epoch: 45, train_loss: 0.8145, test_loss: 1.0565, test_f1: 0.6094
 epoch: 46, train_loss: 0.8110, test_loss: 1.0418, test_f1: 0.5832
 epoch: 47, train_loss: 0.8103, test_loss: 1.0385, test_f1: 0.6041
 epoch: 48, train_loss: 0.8222, test_loss: 1.0449, test_f1: 0.5916
 epoch: 49, train_loss: 0.7799, test_loss: 1.0699, test_f1: 0.5856
 epoch: 50, train_loss: 0.8021, test_loss: 1.0106, test_f1: 0.5857
 epoch: 51, train_loss: 0.7800, test_loss: 1.0313, test_f1: 0.5874
 epoch: 52, train_loss: 0.7843, test_loss: 1.0397, test_f1: 0.5907
 epoch: 53, train_loss: 0.7714, test_loss: 1.0424, test_f1: 0.5894
 epoch: 54, train_loss: 0.7838, test_loss: 1.0426, test_f1: 0.6147
 epoch: 55, train_loss: 0.7802, test_loss: 1.0530, test_f1: 0.5783
 epoch: 56, train_loss: 0.7674, test_loss: 1.0575, test_f1: 0.5958
 epoch: 57, train_loss: 0.7631, test_loss: 1.0824, test_f1: 0.6014
 epoch: 58, train_loss: 0.7840, test_loss: 1.0861, test_f1: 0.6003
 epoch: 59, train_loss: 0.7632, test_loss: 1.0703, test_f1: 0.5944
 epoch: 60, train_loss: 0.7614, test_loss: 1.0642, test_f1: 0.5921
 epoch: 61, train_loss: 0.7547, test_loss: 1.0914, test_f1: 0.5872
 epoch: 62, train_loss: 0.7560, test_loss: 1.1213, test_f1: 0.5897
 epoch: 63, train_loss: 0.7778, test_loss: 1.0659, test_f1: 0.6127
 epoch: 64, train_loss: 0.7613, test_loss: 1.0653, test_f1: 0.5984
 epoch: 65, train_loss: 0.7351, test_loss: 1.0784, test_f1: 0.6041
 epoch: 66, train_loss: 0.7366, test_loss: 1.0817, test_f1: 0.6107
 epoch: 67, train_loss: 0.7474, test_loss: 1.0839, test_f1: 0.5974
 epoch: 68, train_loss: 0.7534, test_loss: 1.0975, test_f1: 0.6066
 epoch: 69, train_loss: 0.7482, test_loss: 1.1092, test_f1: 0.6054
 epoch: 70, train_loss: 0.7648, test_loss: 1.1004, test_f1: 0.6061
 epoch: 71, train_loss: 0.7417, test_loss: 1.1152, test_f1: 0.5982
 epoch: 72, train_loss: 0.7330, test_loss: 1.1461, test_f1: 0.5894
 epoch: 73, train_loss: 0.7568, test_loss: 1.0945, test_f1: 0.6020
 epoch: 74, train_loss: 0.7482, test_loss: 1.0992, test_f1: 0.6080
 epoch: 75, train_loss: 0.7341, test_loss: 1.1252, test_f1: 0.6139
 epoch: 76, train_loss: 0.7382, test_loss: 1.0900, test_f1: 0.6050
 epoch: 77, train_loss: 0.7374, test_loss: 1.0938, test_f1: 0.6053
 epoch: 78, train_loss: 0.7427, test_loss: 1.1276, test_f1: 0.6006
 epoch: 79, train_loss: 0.7287, test_loss: 1.2083, test_f1: 0.6054
 epoch: 80, train_loss: 0.7361, test_loss: 1.1555, test_f1: 0.6139
 epoch: 81, train_loss: 0.7155, test_loss: 1.1416, test_f1: 0.6021
 epoch: 82, train_loss: 0.7177, test_loss: 1.1738, test_f1: 0.6189
 epoch: 83, train_loss: 0.7252, test_loss: 1.1517, test_f1: 0.5934
 epoch: 84, train_loss: 0.7193, test_loss: 1.1282, test_f1: 0.6098
 epoch: 85, train_loss: 0.7180, test_loss: 1.1386, test_f1: 0.6105
 epoch: 86, train_loss: 0.7194, test_loss: 1.1877, test_f1: 0.6107
 epoch: 87, train_loss: 0.7253, test_loss: 1.1790, test_f1: 0.6069
 epoch: 88, train_loss: 0.7081, test_loss: 1.1878, test_f1: 0.6148
 epoch: 89, train_loss: 0.7055, test_loss: 1.2051, test_f1: 0.6164
 epoch: 90, train_loss: 0.7266, test_loss: 1.1587, test_f1: 0.6235
 epoch: 91, train_loss: 0.7179, test_loss: 1.1667, test_f1: 0.6214
 epoch: 92, train_loss: 0.7105, test_loss: 1.1749, test_f1: 0.6190
 epoch: 93, train_loss: 0.6959, test_loss: 1.1926, test_f1: 0.6082
 epoch: 94, train_loss: 0.7140, test_loss: 1.1802, test_f1: 0.6236
 epoch: 95, train_loss: 0.7004, test_loss: 1.2357, test_f1: 0.6147
 epoch: 96, train_loss: 0.6968, test_loss: 1.1747, test_f1: 0.6375
 epoch: 97, train_loss: 0.7009, test_loss: 1.2028, test_f1: 0.6034
 epoch: 98, train_loss: 0.7091, test_loss: 1.2656, test_f1: 0.6131
 epoch: 99, train_loss: 0.6903, test_loss: 1.2677, test_f1: 0.6181
##################ITERATION #9 ****************************************
 epoch: 0, train_loss: 1.2667, test_loss: 1.3004, test_f1: 0.3293
 epoch: 1, train_loss: 1.1486, test_loss: 1.2289, test_f1: 0.4448
 epoch: 2, train_loss: 1.1279, test_loss: 1.2066, test_f1: 0.4598
 epoch: 3, train_loss: 1.0815, test_loss: 1.1947, test_f1: 0.4558
 epoch: 4, train_loss: 1.0736, test_loss: 1.1877, test_f1: 0.4598
 epoch: 5, train_loss: 1.0387, test_loss: 1.1882, test_f1: 0.4858
 epoch: 6, train_loss: 1.0420, test_loss: 1.1768, test_f1: 0.4911
 epoch: 7, train_loss: 1.0305, test_loss: 1.1598, test_f1: 0.4820
 epoch: 8, train_loss: 1.0024, test_loss: 1.1442, test_f1: 0.5264
 epoch: 9, train_loss: 0.9947, test_loss: 1.1430, test_f1: 0.5250
 epoch: 10, train_loss: 0.9881, test_loss: 1.1246, test_f1: 0.5161
 epoch: 11, train_loss: 0.9786, test_loss: 1.1236, test_f1: 0.5280
 epoch: 12, train_loss: 0.9622, test_loss: 1.1309, test_f1: 0.5336
 epoch: 13, train_loss: 0.9624, test_loss: 1.1217, test_f1: 0.5318
 epoch: 14, train_loss: 0.9434, test_loss: 1.1021, test_f1: 0.5209
 epoch: 15, train_loss: 0.9412, test_loss: 1.1241, test_f1: 0.5336
 epoch: 16, train_loss: 0.9342, test_loss: 1.1254, test_f1: 0.5381
 epoch: 17, train_loss: 0.9265, test_loss: 1.1040, test_f1: 0.5485
 epoch: 18, train_loss: 0.9138, test_loss: 1.1221, test_f1: 0.5380
 epoch: 19, train_loss: 0.9371, test_loss: 1.1101, test_f1: 0.5479
 epoch: 20, train_loss: 0.9153, test_loss: 1.0992, test_f1: 0.5433
 epoch: 21, train_loss: 0.8928, test_loss: 1.0941, test_f1: 0.5479
 epoch: 22, train_loss: 0.8949, test_loss: 1.1152, test_f1: 0.5555
 epoch: 23, train_loss: 0.8869, test_loss: 1.0800, test_f1: 0.5617
 epoch: 24, train_loss: 0.8967, test_loss: 1.0890, test_f1: 0.5324
 epoch: 25, train_loss: 0.8678, test_loss: 1.1010, test_f1: 0.5520
 epoch: 26, train_loss: 0.8649, test_loss: 1.0691, test_f1: 0.5504
 epoch: 27, train_loss: 0.8843, test_loss: 1.0900, test_f1: 0.5576
 epoch: 28, train_loss: 0.8671, test_loss: 1.0839, test_f1: 0.5658
 epoch: 29, train_loss: 0.8573, test_loss: 1.0858, test_f1: 0.5760
 epoch: 30, train_loss: 0.8517, test_loss: 1.1073, test_f1: 0.5518
 epoch: 31, train_loss: 0.8507, test_loss: 1.0803, test_f1: 0.5490
 epoch: 32, train_loss: 0.8494, test_loss: 1.1156, test_f1: 0.5702
 epoch: 33, train_loss: 0.8422, test_loss: 1.0961, test_f1: 0.5745
 epoch: 34, train_loss: 0.8347, test_loss: 1.1184, test_f1: 0.5654
 epoch: 35, train_loss: 0.8575, test_loss: 1.1233, test_f1: 0.5724
 epoch: 36, train_loss: 0.8383, test_loss: 1.1082, test_f1: 0.5656
 epoch: 37, train_loss: 0.8266, test_loss: 1.1147, test_f1: 0.5591
 epoch: 38, train_loss: 0.8145, test_loss: 1.0976, test_f1: 0.5717
 epoch: 39, train_loss: 0.8156, test_loss: 1.0936, test_f1: 0.5786
 epoch: 40, train_loss: 0.8105, test_loss: 1.1034, test_f1: 0.5920
 epoch: 41, train_loss: 0.8194, test_loss: 1.1784, test_f1: 0.5675
 epoch: 42, train_loss: 0.7966, test_loss: 1.1509, test_f1: 0.5758
 epoch: 43, train_loss: 0.8029, test_loss: 1.1671, test_f1: 0.5633
 epoch: 44, train_loss: 0.7917, test_loss: 1.1517, test_f1: 0.5589
 epoch: 45, train_loss: 0.8026, test_loss: 1.1719, test_f1: 0.5358
 epoch: 46, train_loss: 0.7847, test_loss: 1.1785, test_f1: 0.5492
 epoch: 47, train_loss: 0.7887, test_loss: 1.1384, test_f1: 0.5743
 epoch: 48, train_loss: 0.7844, test_loss: 1.1377, test_f1: 0.5622
 epoch: 49, train_loss: 0.7768, test_loss: 1.1755, test_f1: 0.5770
 epoch: 50, train_loss: 0.7655, test_loss: 1.1608, test_f1: 0.5851
 epoch: 51, train_loss: 0.7600, test_loss: 1.1857, test_f1: 0.5407
 epoch: 52, train_loss: 0.7574, test_loss: 1.2035, test_f1: 0.5486
 epoch: 53, train_loss: 0.7602, test_loss: 1.1941, test_f1: 0.5498
 epoch: 54, train_loss: 0.7440, test_loss: 1.2138, test_f1: 0.5567
 epoch: 55, train_loss: 0.7546, test_loss: 1.2208, test_f1: 0.5617
 epoch: 56, train_loss: 0.7489, test_loss: 1.2097, test_f1: 0.5562
 epoch: 57, train_loss: 0.7512, test_loss: 1.2003, test_f1: 0.5540
 epoch: 58, train_loss: 0.7450, test_loss: 1.2029, test_f1: 0.5766
 epoch: 59, train_loss: 0.7380, test_loss: 1.2259, test_f1: 0.5458
 epoch: 60, train_loss: 0.7482, test_loss: 1.2184, test_f1: 0.5565
 epoch: 61, train_loss: 0.7375, test_loss: 1.2246, test_f1: 0.5517
 epoch: 62, train_loss: 0.7207, test_loss: 1.2397, test_f1: 0.5552
 epoch: 63, train_loss: 0.7276, test_loss: 1.2403, test_f1: 0.5459
 epoch: 64, train_loss: 0.7369, test_loss: 1.2201, test_f1: 0.5674
 epoch: 65, train_loss: 0.7468, test_loss: 1.2618, test_f1: 0.5594
 epoch: 66, train_loss: 0.7329, test_loss: 1.2384, test_f1: 0.5476
 epoch: 67, train_loss: 0.7258, test_loss: 1.2201, test_f1: 0.5696
 epoch: 68, train_loss: 0.7124, test_loss: 1.2462, test_f1: 0.5538
 epoch: 69, train_loss: 0.7208, test_loss: 1.2590, test_f1: 0.5400
 epoch: 70, train_loss: 0.7270, test_loss: 1.2559, test_f1: 0.5548
 epoch: 71, train_loss: 0.7225, test_loss: 1.2771, test_f1: 0.5565
 epoch: 72, train_loss: 0.7252, test_loss: 1.2383, test_f1: 0.5610
 epoch: 73, train_loss: 0.7280, test_loss: 1.2756, test_f1: 0.5627
 epoch: 74, train_loss: 0.7134, test_loss: 1.2662, test_f1: 0.5428
 epoch: 75, train_loss: 0.7111, test_loss: 1.2411, test_f1: 0.5687
 epoch: 76, train_loss: 0.6997, test_loss: 1.2495, test_f1: 0.5679
 epoch: 77, train_loss: 0.7066, test_loss: 1.2633, test_f1: 0.5375
 epoch: 78, train_loss: 0.7000, test_loss: 1.2875, test_f1: 0.5344
 epoch: 79, train_loss: 0.7051, test_loss: 1.2841, test_f1: 0.5511
 epoch: 80, train_loss: 0.7150, test_loss: 1.2582, test_f1: 0.5405
 epoch: 81, train_loss: 0.6910, test_loss: 1.2780, test_f1: 0.5385
 epoch: 82, train_loss: 0.7021, test_loss: 1.2888, test_f1: 0.5700
 epoch: 83, train_loss: 0.6937, test_loss: 1.2836, test_f1: 0.5502
 epoch: 84, train_loss: 0.7135, test_loss: 1.2924, test_f1: 0.5411
 epoch: 85, train_loss: 0.6963, test_loss: 1.2882, test_f1: 0.5541
 epoch: 86, train_loss: 0.6780, test_loss: 1.3290, test_f1: 0.5431
 epoch: 87, train_loss: 0.6849, test_loss: 1.2834, test_f1: 0.5439
 epoch: 88, train_loss: 0.6904, test_loss: 1.2654, test_f1: 0.5480
 epoch: 89, train_loss: 0.7003, test_loss: 1.3190, test_f1: 0.5435
 epoch: 90, train_loss: 0.6761, test_loss: 1.3252, test_f1: 0.5330
 epoch: 91, train_loss: 0.6740, test_loss: 1.3255, test_f1: 0.5607
 epoch: 92, train_loss: 0.6813, test_loss: 1.3268, test_f1: 0.5449
 epoch: 93, train_loss: 0.6726, test_loss: 1.3449, test_f1: 0.5451
 epoch: 94, train_loss: 0.6719, test_loss: 1.3434, test_f1: 0.5502
 epoch: 95, train_loss: 0.6739, test_loss: 1.3156, test_f1: 0.5361
 epoch: 96, train_loss: 0.6649, test_loss: 1.3494, test_f1: 0.5451
 epoch: 97, train_loss: 0.6653, test_loss: 1.3460, test_f1: 0.5497
 epoch: 98, train_loss: 0.6729, test_loss: 1.3053, test_f1: 0.5473
 epoch: 99, train_loss: 0.6785, test_loss: 1.3588, test_f1: 0.5454

Training completed in 1081.38 seconds
Best F1: 0.6375 at epoch 96
Mean F1 across iterations: 0.6023  0.0142
========================FINAL RESULTS================================
FEGIN weighted F1: 0.6375  0.0142
python main.py --data ltspice_demos --representation component_net --model FEGIN --layers 5 --hiddens 64 --batch_size 32 --lr 0.0001 --emb_size 250 --epochs 100 --save_appendix component_net_L5_H64_BS32_LR0.0001_E250 --no_val
-----



STDERR:
  File "main.py", line 370, in <module>
    main()
  File "main.py", line 254, in main
    dataset = dataset_class(
  File "/home/philip/projects/ltspice_examples_code_repo/Circuit-Completion-Using-GNNs/component_classification_with_link_prediction_head/evaluation/FEGIN/kernel/circuit_datasets.py", line 15, in __init__
    self.data, self.slices = torch.load(self.processed_paths[0])
  File "/home/philip/.local/lib/python3.8/site-packages/torch/serialization.py", line 1040, in load
    warnings.warn(
  File "/usr/lib/python3.8/warnings.py", line 109, in _showwarnmsg
    sw(msg.message, msg.category, msg.filename, msg.lineno,
  File "main.py", line 47, in warn_with_traceback
    traceback.print_stack(file=log)
/home/philip/projects/ltspice_examples_code_repo/Circuit-Completion-Using-GNNs/component_classification_with_link_prediction_head/evaluation/FEGIN/kernel/circuit_datasets.py:15: FutureWarning: You are using `torch.load` with `weights_only=False` (the current default value), which uses the default pickle module implicitly. It is possible to construct malicious pickle data which will execute arbitrary code during unpickling (See https://github.com/pytorch/pytorch/blob/main/SECURITY.md#untrusted-models for more details). In a future release, the default value for `weights_only` will be flipped to `True`. This limits the functions that could be executed during unpickling. Arbitrary objects will no longer be allowed to be loaded via this mode unless they are explicitly allowlisted by the user via `torch.serialization.add_safe_globals`. We recommend you start setting `weights_only=True` for any use case where you don't have full control of the loaded file. Please open an issue on GitHub for any issues related to this experimental feature.
  self.data, self.slices = torch.load(self.processed_paths[0])
