STDOUT:
Results will be saved in /home/philip/projects/ltspice_examples_code_repo/Circuit-Completion-Using-GNNs/component_classification_with_link_prediction_head/evaluation/FEGIN/results/model_FEGIN_dataset_ltspice_demos
Command line input: python main.py --data ltspice_demos --representation component_net --model FEGIN --layers 2 --hiddens 16 --batch_size 256 --lr 0.001 --emb_size 250 --epochs 100 --save_appendix component_net_L2_H16_BS256_LR0.001_E250 --no_val
 is saved.
-----
ltspice_demos - FEGIN
Using 2 layers, 16 hidden units, h = 2
Loading component_net representation dataset
ENTERED
Training FEGIN on component_net representation
Train: 1565, Test: 383
##################ITERATION #0 ****************************************
 epoch: 0, train_loss: 1.4174, test_loss: 1.4097, test_f1: 0.0507
 epoch: 1, train_loss: 1.4017, test_loss: 1.4030, test_f1: 0.0507
 epoch: 2, train_loss: 1.3920, test_loss: 1.3968, test_f1: 0.1370
 epoch: 3, train_loss: 1.3825, test_loss: 1.3908, test_f1: 0.1365
 epoch: 4, train_loss: 1.3739, test_loss: 1.3852, test_f1: 0.1365
 epoch: 5, train_loss: 1.3663, test_loss: 1.3795, test_f1: 0.1365
 epoch: 6, train_loss: 1.3556, test_loss: 1.3725, test_f1: 0.1365
 epoch: 7, train_loss: 1.3438, test_loss: 1.3638, test_f1: 0.1365
 epoch: 8, train_loss: 1.3313, test_loss: 1.3530, test_f1: 0.1365
 epoch: 9, train_loss: 1.3166, test_loss: 1.3401, test_f1: 0.1365
 epoch: 10, train_loss: 1.2997, test_loss: 1.3267, test_f1: 0.1365
 epoch: 11, train_loss: 1.2828, test_loss: 1.3123, test_f1: 0.1365
 epoch: 12, train_loss: 1.2642, test_loss: 1.2974, test_f1: 0.1430
 epoch: 13, train_loss: 1.2455, test_loss: 1.2837, test_f1: 0.2213
 epoch: 14, train_loss: 1.2293, test_loss: 1.2726, test_f1: 0.3372
 epoch: 15, train_loss: 1.2192, test_loss: 1.2648, test_f1: 0.3438
 epoch: 16, train_loss: 1.2062, test_loss: 1.2597, test_f1: 0.3279
 epoch: 17, train_loss: 1.1985, test_loss: 1.2548, test_f1: 0.3397
 epoch: 18, train_loss: 1.1944, test_loss: 1.2531, test_f1: 0.3229
 epoch: 19, train_loss: 1.1877, test_loss: 1.2521, test_f1: 0.3230
 epoch: 20, train_loss: 1.1743, test_loss: 1.2453, test_f1: 0.3230
 epoch: 21, train_loss: 1.1725, test_loss: 1.2401, test_f1: 0.3230
 epoch: 22, train_loss: 1.1669, test_loss: 1.2356, test_f1: 0.3297
 epoch: 23, train_loss: 1.1636, test_loss: 1.2311, test_f1: 0.3229
 epoch: 24, train_loss: 1.1607, test_loss: 1.2254, test_f1: 0.3268
 epoch: 25, train_loss: 1.1464, test_loss: 1.2163, test_f1: 0.3245
 epoch: 26, train_loss: 1.1504, test_loss: 1.2139, test_f1: 0.3250
 epoch: 27, train_loss: 1.1453, test_loss: 1.2083, test_f1: 0.3250
 epoch: 28, train_loss: 1.1404, test_loss: 1.2014, test_f1: 0.3305
 epoch: 29, train_loss: 1.1281, test_loss: 1.1989, test_f1: 0.3304
 epoch: 30, train_loss: 1.1268, test_loss: 1.2013, test_f1: 0.3310
 epoch: 31, train_loss: 1.1231, test_loss: 1.1976, test_f1: 0.3261
 epoch: 32, train_loss: 1.1176, test_loss: 1.1888, test_f1: 0.3265
 epoch: 33, train_loss: 1.1160, test_loss: 1.1857, test_f1: 0.3301
 epoch: 34, train_loss: 1.1069, test_loss: 1.1837, test_f1: 0.3352
 epoch: 35, train_loss: 1.1021, test_loss: 1.1742, test_f1: 0.3483
 epoch: 36, train_loss: 1.1030, test_loss: 1.1680, test_f1: 0.3489
 epoch: 37, train_loss: 1.0918, test_loss: 1.1630, test_f1: 0.3631
 epoch: 38, train_loss: 1.0873, test_loss: 1.1663, test_f1: 0.3886
 epoch: 39, train_loss: 1.0739, test_loss: 1.1758, test_f1: 0.4031
 epoch: 40, train_loss: 1.0821, test_loss: 1.1636, test_f1: 0.4155
 epoch: 41, train_loss: 1.0767, test_loss: 1.1523, test_f1: 0.4228
 epoch: 42, train_loss: 1.0707, test_loss: 1.1525, test_f1: 0.4357
 epoch: 43, train_loss: 1.0643, test_loss: 1.1509, test_f1: 0.4280
 epoch: 44, train_loss: 1.0579, test_loss: 1.1634, test_f1: 0.4304
 epoch: 45, train_loss: 1.0436, test_loss: 1.1726, test_f1: 0.4322
 epoch: 46, train_loss: 1.0443, test_loss: 1.1765, test_f1: 0.4250
 epoch: 47, train_loss: 1.0471, test_loss: 1.1667, test_f1: 0.4241
 epoch: 48, train_loss: 1.0401, test_loss: 1.1643, test_f1: 0.4180
 epoch: 49, train_loss: 1.0339, test_loss: 1.1584, test_f1: 0.4147
 epoch: 50, train_loss: 1.0381, test_loss: 1.1638, test_f1: 0.4121
 epoch: 51, train_loss: 1.0302, test_loss: 1.1489, test_f1: 0.4133
 epoch: 52, train_loss: 1.0366, test_loss: 1.1380, test_f1: 0.4222
 epoch: 53, train_loss: 1.0233, test_loss: 1.1325, test_f1: 0.4161
 epoch: 54, train_loss: 1.0184, test_loss: 1.1408, test_f1: 0.4221
 epoch: 55, train_loss: 1.0209, test_loss: 1.1510, test_f1: 0.4245
 epoch: 56, train_loss: 1.0248, test_loss: 1.1565, test_f1: 0.4215
 epoch: 57, train_loss: 1.0222, test_loss: 1.1531, test_f1: 0.4328
 epoch: 58, train_loss: 1.0202, test_loss: 1.1531, test_f1: 0.4177
 epoch: 59, train_loss: 1.0096, test_loss: 1.1570, test_f1: 0.4169
 epoch: 60, train_loss: 1.0171, test_loss: 1.1484, test_f1: 0.4224
 epoch: 61, train_loss: 1.0082, test_loss: 1.1492, test_f1: 0.4175
 epoch: 62, train_loss: 1.0171, test_loss: 1.1581, test_f1: 0.4200
 epoch: 63, train_loss: 1.0054, test_loss: 1.1622, test_f1: 0.4267
 epoch: 64, train_loss: 0.9978, test_loss: 1.1543, test_f1: 0.4224
 epoch: 65, train_loss: 1.0110, test_loss: 1.1551, test_f1: 0.4200
 epoch: 66, train_loss: 0.9982, test_loss: 1.1636, test_f1: 0.4535
 epoch: 67, train_loss: 1.0009, test_loss: 1.1615, test_f1: 0.4249
 epoch: 68, train_loss: 0.9974, test_loss: 1.1592, test_f1: 0.4369
 epoch: 69, train_loss: 1.0038, test_loss: 1.1463, test_f1: 0.4287
 epoch: 70, train_loss: 1.0026, test_loss: 1.1447, test_f1: 0.4292
 epoch: 71, train_loss: 0.9975, test_loss: 1.1508, test_f1: 0.4361
 epoch: 72, train_loss: 1.0008, test_loss: 1.1570, test_f1: 0.4263
 epoch: 73, train_loss: 0.9981, test_loss: 1.1699, test_f1: 0.4282
 epoch: 74, train_loss: 0.9896, test_loss: 1.1764, test_f1: 0.4282
 epoch: 75, train_loss: 0.9930, test_loss: 1.1596, test_f1: 0.4307
 epoch: 76, train_loss: 0.9902, test_loss: 1.1603, test_f1: 0.4307
 epoch: 77, train_loss: 0.9943, test_loss: 1.1524, test_f1: 0.4449
 epoch: 78, train_loss: 0.9939, test_loss: 1.1440, test_f1: 0.4623
 epoch: 79, train_loss: 0.9856, test_loss: 1.1469, test_f1: 0.4643
 epoch: 80, train_loss: 0.9885, test_loss: 1.1456, test_f1: 0.4517
 epoch: 81, train_loss: 0.9908, test_loss: 1.1379, test_f1: 0.4626
 epoch: 82, train_loss: 0.9958, test_loss: 1.1417, test_f1: 0.4230
 epoch: 83, train_loss: 0.9972, test_loss: 1.1545, test_f1: 0.4309
 epoch: 84, train_loss: 0.9880, test_loss: 1.1628, test_f1: 0.4364
 epoch: 85, train_loss: 0.9875, test_loss: 1.1647, test_f1: 0.4201
 epoch: 86, train_loss: 0.9804, test_loss: 1.1582, test_f1: 0.4202
 epoch: 87, train_loss: 0.9831, test_loss: 1.1557, test_f1: 0.4234
 epoch: 88, train_loss: 0.9839, test_loss: 1.1504, test_f1: 0.4207
 epoch: 89, train_loss: 0.9808, test_loss: 1.1518, test_f1: 0.4254
 epoch: 90, train_loss: 0.9822, test_loss: 1.1517, test_f1: 0.4506
 epoch: 91, train_loss: 0.9767, test_loss: 1.1484, test_f1: 0.4531
 epoch: 92, train_loss: 0.9872, test_loss: 1.1377, test_f1: 0.4598
 epoch: 93, train_loss: 0.9823, test_loss: 1.1407, test_f1: 0.4652
 epoch: 94, train_loss: 0.9785, test_loss: 1.1448, test_f1: 0.4642
 epoch: 95, train_loss: 0.9766, test_loss: 1.1409, test_f1: 0.4479
 epoch: 96, train_loss: 0.9849, test_loss: 1.1347, test_f1: 0.4437
 epoch: 97, train_loss: 0.9763, test_loss: 1.1301, test_f1: 0.4218
 epoch: 98, train_loss: 0.9679, test_loss: 1.1292, test_f1: 0.4212
 epoch: 99, train_loss: 0.9655, test_loss: 1.1342, test_f1: 0.4477
##################ITERATION #1 ****************************************
 epoch: 0, train_loss: 1.3486, test_loss: 1.3609, test_f1: 0.1365
 epoch: 1, train_loss: 1.3126, test_loss: 1.3554, test_f1: 0.1365
 epoch: 2, train_loss: 1.2934, test_loss: 1.3475, test_f1: 0.1365
 epoch: 3, train_loss: 1.2789, test_loss: 1.3394, test_f1: 0.1365
 epoch: 4, train_loss: 1.2590, test_loss: 1.3290, test_f1: 0.1365
 epoch: 5, train_loss: 1.2458, test_loss: 1.3145, test_f1: 0.1365
 epoch: 6, train_loss: 1.2338, test_loss: 1.2968, test_f1: 0.1365
 epoch: 7, train_loss: 1.2223, test_loss: 1.2769, test_f1: 0.1738
 epoch: 8, train_loss: 1.2147, test_loss: 1.2576, test_f1: 0.2103
 epoch: 9, train_loss: 1.1946, test_loss: 1.2446, test_f1: 0.2819
 epoch: 10, train_loss: 1.1862, test_loss: 1.2340, test_f1: 0.2810
 epoch: 11, train_loss: 1.1782, test_loss: 1.2246, test_f1: 0.2866
 epoch: 12, train_loss: 1.1675, test_loss: 1.2141, test_f1: 0.2572
 epoch: 13, train_loss: 1.1585, test_loss: 1.2067, test_f1: 0.2692
 epoch: 14, train_loss: 1.1491, test_loss: 1.2089, test_f1: 0.2733
 epoch: 15, train_loss: 1.1390, test_loss: 1.2123, test_f1: 0.2693
 epoch: 16, train_loss: 1.1291, test_loss: 1.2096, test_f1: 0.2940
 epoch: 17, train_loss: 1.1217, test_loss: 1.2002, test_f1: 0.3171
 epoch: 18, train_loss: 1.1154, test_loss: 1.2025, test_f1: 0.3215
 epoch: 19, train_loss: 1.1124, test_loss: 1.2109, test_f1: 0.3169
 epoch: 20, train_loss: 1.0999, test_loss: 1.2098, test_f1: 0.3146
 epoch: 21, train_loss: 1.0916, test_loss: 1.1855, test_f1: 0.3281
 epoch: 22, train_loss: 1.0993, test_loss: 1.1784, test_f1: 0.3284
 epoch: 23, train_loss: 1.0726, test_loss: 1.1890, test_f1: 0.3596
 epoch: 24, train_loss: 1.0827, test_loss: 1.1835, test_f1: 0.3620
 epoch: 25, train_loss: 1.0696, test_loss: 1.1813, test_f1: 0.3605
 epoch: 26, train_loss: 1.0749, test_loss: 1.1808, test_f1: 0.3626
 epoch: 27, train_loss: 1.0529, test_loss: 1.1774, test_f1: 0.3630
 epoch: 28, train_loss: 1.0591, test_loss: 1.1688, test_f1: 0.3652
 epoch: 29, train_loss: 1.0532, test_loss: 1.1756, test_f1: 0.3694
 epoch: 30, train_loss: 1.0518, test_loss: 1.1785, test_f1: 0.3643
 epoch: 31, train_loss: 1.0448, test_loss: 1.1775, test_f1: 0.3616
 epoch: 32, train_loss: 1.0340, test_loss: 1.1561, test_f1: 0.3648
 epoch: 33, train_loss: 1.0384, test_loss: 1.1461, test_f1: 0.3673
 epoch: 34, train_loss: 1.0234, test_loss: 1.1464, test_f1: 0.3669
 epoch: 35, train_loss: 1.0292, test_loss: 1.1671, test_f1: 0.3634
 epoch: 36, train_loss: 1.0274, test_loss: 1.1652, test_f1: 0.3522
 epoch: 37, train_loss: 1.0221, test_loss: 1.1849, test_f1: 0.3665
 epoch: 38, train_loss: 1.0276, test_loss: 1.1535, test_f1: 0.3648
 epoch: 39, train_loss: 1.0176, test_loss: 1.1507, test_f1: 0.3669
 epoch: 40, train_loss: 1.0189, test_loss: 1.1417, test_f1: 0.3640
 epoch: 41, train_loss: 1.0180, test_loss: 1.1448, test_f1: 0.3568
 epoch: 42, train_loss: 1.0109, test_loss: 1.1540, test_f1: 0.3573
 epoch: 43, train_loss: 1.0053, test_loss: 1.1479, test_f1: 0.3553
 epoch: 44, train_loss: 0.9989, test_loss: 1.1528, test_f1: 0.3656
 epoch: 45, train_loss: 1.0074, test_loss: 1.1288, test_f1: 0.3707
 epoch: 46, train_loss: 1.0024, test_loss: 1.1121, test_f1: 0.3704
 epoch: 47, train_loss: 1.0093, test_loss: 1.1105, test_f1: 0.3710
 epoch: 48, train_loss: 0.9996, test_loss: 1.1519, test_f1: 0.3693
 epoch: 49, train_loss: 1.0034, test_loss: 1.1379, test_f1: 0.3688
 epoch: 50, train_loss: 1.0044, test_loss: 1.1139, test_f1: 0.3612
 epoch: 51, train_loss: 0.9934, test_loss: 1.1254, test_f1: 0.3735
 epoch: 52, train_loss: 1.0004, test_loss: 1.1318, test_f1: 0.3760
 epoch: 53, train_loss: 0.9853, test_loss: 1.1313, test_f1: 0.3772
 epoch: 54, train_loss: 0.9786, test_loss: 1.1309, test_f1: 0.3772
 epoch: 55, train_loss: 0.9852, test_loss: 1.1403, test_f1: 0.3720
 epoch: 56, train_loss: 0.9703, test_loss: 1.1353, test_f1: 0.3760
 epoch: 57, train_loss: 0.9944, test_loss: 1.1233, test_f1: 0.3733
 epoch: 58, train_loss: 0.9905, test_loss: 1.1353, test_f1: 0.3720
 epoch: 59, train_loss: 0.9875, test_loss: 1.1280, test_f1: 0.3728
 epoch: 60, train_loss: 0.9842, test_loss: 1.1305, test_f1: 0.3760
 epoch: 61, train_loss: 0.9816, test_loss: 1.1241, test_f1: 0.3753
 epoch: 62, train_loss: 0.9789, test_loss: 1.1256, test_f1: 0.3785
 epoch: 63, train_loss: 0.9830, test_loss: 1.1295, test_f1: 0.3766
 epoch: 64, train_loss: 0.9840, test_loss: 1.1296, test_f1: 0.3720
 epoch: 65, train_loss: 0.9750, test_loss: 1.1223, test_f1: 0.3780
 epoch: 66, train_loss: 0.9762, test_loss: 1.1127, test_f1: 0.3777
 epoch: 67, train_loss: 0.9761, test_loss: 1.1227, test_f1: 0.3740
 epoch: 68, train_loss: 0.9785, test_loss: 1.1315, test_f1: 0.3766
 epoch: 69, train_loss: 0.9701, test_loss: 1.1201, test_f1: 0.3745
 epoch: 70, train_loss: 0.9727, test_loss: 1.1190, test_f1: 0.3750
 epoch: 71, train_loss: 0.9687, test_loss: 1.1169, test_f1: 0.3753
 epoch: 72, train_loss: 0.9673, test_loss: 1.1295, test_f1: 0.3766
 epoch: 73, train_loss: 0.9786, test_loss: 1.1228, test_f1: 0.3798
 epoch: 74, train_loss: 0.9750, test_loss: 1.1176, test_f1: 0.3733
 epoch: 75, train_loss: 0.9759, test_loss: 1.1201, test_f1: 0.3803
 epoch: 76, train_loss: 0.9710, test_loss: 1.1094, test_f1: 0.3753
 epoch: 77, train_loss: 0.9660, test_loss: 1.1200, test_f1: 0.3826
 epoch: 78, train_loss: 0.9634, test_loss: 1.1287, test_f1: 0.3755
 epoch: 79, train_loss: 0.9640, test_loss: 1.1233, test_f1: 0.3758
 epoch: 80, train_loss: 0.9576, test_loss: 1.1377, test_f1: 0.3842
 epoch: 81, train_loss: 0.9674, test_loss: 1.1301, test_f1: 0.3709
 epoch: 82, train_loss: 0.9656, test_loss: 1.1220, test_f1: 0.3894
 epoch: 83, train_loss: 0.9597, test_loss: 1.1260, test_f1: 0.3891
 epoch: 84, train_loss: 0.9670, test_loss: 1.1308, test_f1: 0.3766
 epoch: 85, train_loss: 0.9679, test_loss: 1.1142, test_f1: 0.3847
 epoch: 86, train_loss: 0.9562, test_loss: 1.1083, test_f1: 0.3809
 epoch: 87, train_loss: 0.9615, test_loss: 1.1188, test_f1: 0.3804
 epoch: 88, train_loss: 0.9583, test_loss: 1.1195, test_f1: 0.3797
 epoch: 89, train_loss: 0.9521, test_loss: 1.1187, test_f1: 0.3975
 epoch: 90, train_loss: 0.9479, test_loss: 1.1208, test_f1: 0.3793
 epoch: 91, train_loss: 0.9553, test_loss: 1.1242, test_f1: 0.3854
 epoch: 92, train_loss: 0.9556, test_loss: 1.1261, test_f1: 0.3755
 epoch: 93, train_loss: 0.9531, test_loss: 1.1294, test_f1: 0.3801
 epoch: 94, train_loss: 0.9469, test_loss: 1.1336, test_f1: 0.3760
 epoch: 95, train_loss: 0.9636, test_loss: 1.1256, test_f1: 0.3827
 epoch: 96, train_loss: 0.9558, test_loss: 1.1294, test_f1: 0.3728
 epoch: 97, train_loss: 0.9489, test_loss: 1.1326, test_f1: 0.3817
 epoch: 98, train_loss: 0.9578, test_loss: 1.1193, test_f1: 0.3787
 epoch: 99, train_loss: 0.9569, test_loss: 1.1388, test_f1: 0.3842
##################ITERATION #2 ****************************************
 epoch: 0, train_loss: 1.2886, test_loss: 1.3249, test_f1: 0.2281
 epoch: 1, train_loss: 1.2489, test_loss: 1.3192, test_f1: 0.1485
 epoch: 2, train_loss: 1.2246, test_loss: 1.3157, test_f1: 0.1365
 epoch: 3, train_loss: 1.2069, test_loss: 1.3140, test_f1: 0.2641
 epoch: 4, train_loss: 1.1863, test_loss: 1.3117, test_f1: 0.2755
 epoch: 5, train_loss: 1.1828, test_loss: 1.3045, test_f1: 0.2583
 epoch: 6, train_loss: 1.1636, test_loss: 1.2926, test_f1: 0.2720
 epoch: 7, train_loss: 1.1510, test_loss: 1.2754, test_f1: 0.2928
 epoch: 8, train_loss: 1.1438, test_loss: 1.2523, test_f1: 0.3291
 epoch: 9, train_loss: 1.1385, test_loss: 1.2327, test_f1: 0.3450
 epoch: 10, train_loss: 1.1335, test_loss: 1.2113, test_f1: 0.3615
 epoch: 11, train_loss: 1.1192, test_loss: 1.2074, test_f1: 0.3672
 epoch: 12, train_loss: 1.1096, test_loss: 1.2015, test_f1: 0.3704
 epoch: 13, train_loss: 1.1073, test_loss: 1.1963, test_f1: 0.3769
 epoch: 14, train_loss: 1.0925, test_loss: 1.1850, test_f1: 0.3827
 epoch: 15, train_loss: 1.0990, test_loss: 1.1891, test_f1: 0.4030
 epoch: 16, train_loss: 1.0848, test_loss: 1.1869, test_f1: 0.4085
 epoch: 17, train_loss: 1.0816, test_loss: 1.1855, test_f1: 0.4101
 epoch: 18, train_loss: 1.0877, test_loss: 1.1972, test_f1: 0.4236
 epoch: 19, train_loss: 1.0723, test_loss: 1.1822, test_f1: 0.4029
 epoch: 20, train_loss: 1.0699, test_loss: 1.1741, test_f1: 0.3990
 epoch: 21, train_loss: 1.0662, test_loss: 1.1801, test_f1: 0.4187
 epoch: 22, train_loss: 1.0617, test_loss: 1.1631, test_f1: 0.4193
 epoch: 23, train_loss: 1.0522, test_loss: 1.1588, test_f1: 0.4260
 epoch: 24, train_loss: 1.0584, test_loss: 1.1690, test_f1: 0.4338
 epoch: 25, train_loss: 1.0449, test_loss: 1.1621, test_f1: 0.4400
 epoch: 26, train_loss: 1.0454, test_loss: 1.1515, test_f1: 0.4183
 epoch: 27, train_loss: 1.0440, test_loss: 1.1536, test_f1: 0.4177
 epoch: 28, train_loss: 1.0333, test_loss: 1.1762, test_f1: 0.4332
 epoch: 29, train_loss: 1.0346, test_loss: 1.2018, test_f1: 0.4280
 epoch: 30, train_loss: 1.0307, test_loss: 1.2103, test_f1: 0.4293
 epoch: 31, train_loss: 1.0314, test_loss: 1.1569, test_f1: 0.4282
 epoch: 32, train_loss: 1.0243, test_loss: 1.1466, test_f1: 0.4172
 epoch: 33, train_loss: 1.0285, test_loss: 1.1583, test_f1: 0.4271
 epoch: 34, train_loss: 1.0074, test_loss: 1.1702, test_f1: 0.4226
 epoch: 35, train_loss: 1.0185, test_loss: 1.1404, test_f1: 0.4292
 epoch: 36, train_loss: 1.0084, test_loss: 1.1482, test_f1: 0.4394
 epoch: 37, train_loss: 1.0181, test_loss: 1.1680, test_f1: 0.4439
 epoch: 38, train_loss: 1.0020, test_loss: 1.1334, test_f1: 0.4424
 epoch: 39, train_loss: 1.0108, test_loss: 1.1712, test_f1: 0.4312
 epoch: 40, train_loss: 1.0111, test_loss: 1.1597, test_f1: 0.4240
 epoch: 41, train_loss: 1.0048, test_loss: 1.1439, test_f1: 0.4203
 epoch: 42, train_loss: 0.9951, test_loss: 1.1450, test_f1: 0.4303
 epoch: 43, train_loss: 0.9966, test_loss: 1.1586, test_f1: 0.4369
 epoch: 44, train_loss: 0.9947, test_loss: 1.1569, test_f1: 0.4418
 epoch: 45, train_loss: 0.9932, test_loss: 1.1578, test_f1: 0.4377
 epoch: 46, train_loss: 0.9903, test_loss: 1.1611, test_f1: 0.4312
 epoch: 47, train_loss: 0.9890, test_loss: 1.1543, test_f1: 0.4206
 epoch: 48, train_loss: 0.9712, test_loss: 1.1237, test_f1: 0.4252
 epoch: 49, train_loss: 0.9802, test_loss: 1.1384, test_f1: 0.4209
 epoch: 50, train_loss: 0.9738, test_loss: 1.1706, test_f1: 0.4166
 epoch: 51, train_loss: 0.9741, test_loss: 1.1615, test_f1: 0.4232
 epoch: 52, train_loss: 0.9783, test_loss: 1.1339, test_f1: 0.4119
 epoch: 53, train_loss: 0.9659, test_loss: 1.1275, test_f1: 0.4165
 epoch: 54, train_loss: 0.9675, test_loss: 1.1158, test_f1: 0.4230
 epoch: 55, train_loss: 0.9731, test_loss: 1.1196, test_f1: 0.4292
 epoch: 56, train_loss: 0.9682, test_loss: 1.1210, test_f1: 0.4320
 epoch: 57, train_loss: 0.9677, test_loss: 1.1341, test_f1: 0.4256
 epoch: 58, train_loss: 0.9713, test_loss: 1.1171, test_f1: 0.4254
 epoch: 59, train_loss: 0.9636, test_loss: 1.1134, test_f1: 0.4259
 epoch: 60, train_loss: 0.9655, test_loss: 1.1267, test_f1: 0.4269
 epoch: 61, train_loss: 0.9683, test_loss: 1.1367, test_f1: 0.4221
 epoch: 62, train_loss: 0.9612, test_loss: 1.1417, test_f1: 0.4360
 epoch: 63, train_loss: 0.9557, test_loss: 1.1391, test_f1: 0.4259
 epoch: 64, train_loss: 0.9631, test_loss: 1.1181, test_f1: 0.4316
 epoch: 65, train_loss: 0.9587, test_loss: 1.1053, test_f1: 0.4262
 epoch: 66, train_loss: 0.9514, test_loss: 1.1543, test_f1: 0.4256
 epoch: 67, train_loss: 0.9525, test_loss: 1.1599, test_f1: 0.4229
 epoch: 68, train_loss: 0.9642, test_loss: 1.1457, test_f1: 0.4238
 epoch: 69, train_loss: 0.9603, test_loss: 1.1349, test_f1: 0.4224
 epoch: 70, train_loss: 0.9511, test_loss: 1.1268, test_f1: 0.4130
 epoch: 71, train_loss: 0.9483, test_loss: 1.1137, test_f1: 0.4305
 epoch: 72, train_loss: 0.9540, test_loss: 1.1287, test_f1: 0.4258
 epoch: 73, train_loss: 0.9518, test_loss: 1.1143, test_f1: 0.4203
 epoch: 74, train_loss: 0.9499, test_loss: 1.1266, test_f1: 0.4216
 epoch: 75, train_loss: 0.9481, test_loss: 1.1347, test_f1: 0.4244
 epoch: 76, train_loss: 0.9425, test_loss: 1.1333, test_f1: 0.4271
 epoch: 77, train_loss: 0.9484, test_loss: 1.1321, test_f1: 0.4220
 epoch: 78, train_loss: 0.9469, test_loss: 1.1552, test_f1: 0.4166
 epoch: 79, train_loss: 0.9381, test_loss: 1.1501, test_f1: 0.4264
 epoch: 80, train_loss: 0.9542, test_loss: 1.1123, test_f1: 0.4389
 epoch: 81, train_loss: 0.9506, test_loss: 1.1143, test_f1: 0.4180
 epoch: 82, train_loss: 0.9316, test_loss: 1.1457, test_f1: 0.4211
 epoch: 83, train_loss: 0.9409, test_loss: 1.1734, test_f1: 0.4213
 epoch: 84, train_loss: 0.9451, test_loss: 1.1711, test_f1: 0.4299
 epoch: 85, train_loss: 0.9436, test_loss: 1.1280, test_f1: 0.4208
 epoch: 86, train_loss: 0.9407, test_loss: 1.1202, test_f1: 0.4139
 epoch: 87, train_loss: 0.9379, test_loss: 1.1642, test_f1: 0.4395
 epoch: 88, train_loss: 0.9377, test_loss: 1.1713, test_f1: 0.4188
 epoch: 89, train_loss: 0.9450, test_loss: 1.1462, test_f1: 0.4258
 epoch: 90, train_loss: 0.9406, test_loss: 1.1023, test_f1: 0.4297
 epoch: 91, train_loss: 0.9364, test_loss: 1.1190, test_f1: 0.4213
 epoch: 92, train_loss: 0.9369, test_loss: 1.1432, test_f1: 0.4312
 epoch: 93, train_loss: 0.9369, test_loss: 1.1602, test_f1: 0.4308
 epoch: 94, train_loss: 0.9350, test_loss: 1.1676, test_f1: 0.4274
 epoch: 95, train_loss: 0.9230, test_loss: 1.1370, test_f1: 0.4181
 epoch: 96, train_loss: 0.9303, test_loss: 1.1162, test_f1: 0.4224
 epoch: 97, train_loss: 0.9310, test_loss: 1.1278, test_f1: 0.4247
 epoch: 98, train_loss: 0.9232, test_loss: 1.1549, test_f1: 0.4329
 epoch: 99, train_loss: 0.9315, test_loss: 1.1266, test_f1: 0.4308
##################ITERATION #3 ****************************************
 epoch: 0, train_loss: 1.2830, test_loss: 1.3121, test_f1: 0.2281
 epoch: 1, train_loss: 1.2398, test_loss: 1.3097, test_f1: 0.2281
 epoch: 2, train_loss: 1.2273, test_loss: 1.3060, test_f1: 0.2281
 epoch: 3, train_loss: 1.2062, test_loss: 1.2991, test_f1: 0.2281
 epoch: 4, train_loss: 1.1972, test_loss: 1.2899, test_f1: 0.2281
 epoch: 5, train_loss: 1.1869, test_loss: 1.2776, test_f1: 0.2281
 epoch: 6, train_loss: 1.1804, test_loss: 1.2627, test_f1: 0.2336
 epoch: 7, train_loss: 1.1572, test_loss: 1.2488, test_f1: 0.2390
 epoch: 8, train_loss: 1.1477, test_loss: 1.2419, test_f1: 0.2420
 epoch: 9, train_loss: 1.1389, test_loss: 1.2345, test_f1: 0.3027
 epoch: 10, train_loss: 1.1375, test_loss: 1.2248, test_f1: 0.3073
 epoch: 11, train_loss: 1.1353, test_loss: 1.2200, test_f1: 0.3133
 epoch: 12, train_loss: 1.1248, test_loss: 1.2168, test_f1: 0.3566
 epoch: 13, train_loss: 1.1206, test_loss: 1.2127, test_f1: 0.3613
 epoch: 14, train_loss: 1.1170, test_loss: 1.2103, test_f1: 0.3632
 epoch: 15, train_loss: 1.0978, test_loss: 1.2049, test_f1: 0.3777
 epoch: 16, train_loss: 1.1006, test_loss: 1.1955, test_f1: 0.3803
 epoch: 17, train_loss: 1.0920, test_loss: 1.2006, test_f1: 0.3913
 epoch: 18, train_loss: 1.0916, test_loss: 1.1992, test_f1: 0.3993
 epoch: 19, train_loss: 1.0793, test_loss: 1.1934, test_f1: 0.4041
 epoch: 20, train_loss: 1.0823, test_loss: 1.1840, test_f1: 0.3694
 epoch: 21, train_loss: 1.0728, test_loss: 1.1882, test_f1: 0.4017
 epoch: 22, train_loss: 1.0699, test_loss: 1.1630, test_f1: 0.4322
 epoch: 23, train_loss: 1.0737, test_loss: 1.1626, test_f1: 0.4369
 epoch: 24, train_loss: 1.0652, test_loss: 1.1805, test_f1: 0.4190
 epoch: 25, train_loss: 1.0669, test_loss: 1.1780, test_f1: 0.4414
 epoch: 26, train_loss: 1.0558, test_loss: 1.1621, test_f1: 0.4356
 epoch: 27, train_loss: 1.0639, test_loss: 1.1535, test_f1: 0.4439
 epoch: 28, train_loss: 1.0494, test_loss: 1.1645, test_f1: 0.4482
 epoch: 29, train_loss: 1.0462, test_loss: 1.1448, test_f1: 0.4387
 epoch: 30, train_loss: 1.0372, test_loss: 1.1397, test_f1: 0.4274
 epoch: 31, train_loss: 1.0436, test_loss: 1.1603, test_f1: 0.4338
 epoch: 32, train_loss: 1.0284, test_loss: 1.1531, test_f1: 0.4216
 epoch: 33, train_loss: 1.0349, test_loss: 1.1465, test_f1: 0.4146
 epoch: 34, train_loss: 1.0248, test_loss: 1.1505, test_f1: 0.4170
 epoch: 35, train_loss: 1.0302, test_loss: 1.1626, test_f1: 0.4135
 epoch: 36, train_loss: 1.0124, test_loss: 1.1449, test_f1: 0.4290
 epoch: 37, train_loss: 1.0217, test_loss: 1.1508, test_f1: 0.4135
 epoch: 38, train_loss: 1.0048, test_loss: 1.1538, test_f1: 0.4156
 epoch: 39, train_loss: 1.0101, test_loss: 1.1634, test_f1: 0.4108
 epoch: 40, train_loss: 1.0179, test_loss: 1.1510, test_f1: 0.4268
 epoch: 41, train_loss: 1.0084, test_loss: 1.1583, test_f1: 0.4211
 epoch: 42, train_loss: 1.0024, test_loss: 1.1435, test_f1: 0.4295
 epoch: 43, train_loss: 1.0096, test_loss: 1.1449, test_f1: 0.4302
 epoch: 44, train_loss: 1.0016, test_loss: 1.1531, test_f1: 0.4452
 epoch: 45, train_loss: 1.0028, test_loss: 1.1322, test_f1: 0.4453
 epoch: 46, train_loss: 1.0040, test_loss: 1.1297, test_f1: 0.4355
 epoch: 47, train_loss: 1.0027, test_loss: 1.1314, test_f1: 0.4147
 epoch: 48, train_loss: 0.9980, test_loss: 1.1353, test_f1: 0.4277
 epoch: 49, train_loss: 0.9832, test_loss: 1.1391, test_f1: 0.4451
 epoch: 50, train_loss: 0.9886, test_loss: 1.1370, test_f1: 0.4418
 epoch: 51, train_loss: 0.9841, test_loss: 1.1396, test_f1: 0.4361
 epoch: 52, train_loss: 0.9834, test_loss: 1.1503, test_f1: 0.4361
 epoch: 53, train_loss: 0.9874, test_loss: 1.1561, test_f1: 0.4383
 epoch: 54, train_loss: 0.9793, test_loss: 1.1457, test_f1: 0.4373
 epoch: 55, train_loss: 0.9833, test_loss: 1.1270, test_f1: 0.4274
 epoch: 56, train_loss: 0.9889, test_loss: 1.1235, test_f1: 0.4325
 epoch: 57, train_loss: 0.9664, test_loss: 1.1393, test_f1: 0.4322
 epoch: 58, train_loss: 0.9747, test_loss: 1.1612, test_f1: 0.4359
 epoch: 59, train_loss: 0.9672, test_loss: 1.1638, test_f1: 0.4416
 epoch: 60, train_loss: 0.9803, test_loss: 1.1507, test_f1: 0.4356
 epoch: 61, train_loss: 0.9784, test_loss: 1.1298, test_f1: 0.4295
 epoch: 62, train_loss: 0.9735, test_loss: 1.1313, test_f1: 0.4312
 epoch: 63, train_loss: 0.9644, test_loss: 1.1441, test_f1: 0.4346
 epoch: 64, train_loss: 0.9680, test_loss: 1.1402, test_f1: 0.4323
 epoch: 65, train_loss: 0.9768, test_loss: 1.1300, test_f1: 0.4382
 epoch: 66, train_loss: 0.9716, test_loss: 1.1318, test_f1: 0.4330
 epoch: 67, train_loss: 0.9809, test_loss: 1.1547, test_f1: 0.4420
 epoch: 68, train_loss: 0.9675, test_loss: 1.1773, test_f1: 0.4432
 epoch: 69, train_loss: 0.9810, test_loss: 1.1856, test_f1: 0.4431
 epoch: 70, train_loss: 0.9674, test_loss: 1.1362, test_f1: 0.4462
 epoch: 71, train_loss: 0.9709, test_loss: 1.1257, test_f1: 0.4531
 epoch: 72, train_loss: 0.9733, test_loss: 1.1173, test_f1: 0.4429
 epoch: 73, train_loss: 0.9738, test_loss: 1.1141, test_f1: 0.4383
 epoch: 74, train_loss: 0.9629, test_loss: 1.1250, test_f1: 0.4290
 epoch: 75, train_loss: 0.9762, test_loss: 1.1212, test_f1: 0.4391
 epoch: 76, train_loss: 0.9635, test_loss: 1.1257, test_f1: 0.4400
 epoch: 77, train_loss: 0.9530, test_loss: 1.1454, test_f1: 0.4303
 epoch: 78, train_loss: 0.9609, test_loss: 1.1711, test_f1: 0.4321
 epoch: 79, train_loss: 0.9628, test_loss: 1.1555, test_f1: 0.4457
 epoch: 80, train_loss: 0.9641, test_loss: 1.1423, test_f1: 0.4378
 epoch: 81, train_loss: 0.9573, test_loss: 1.1453, test_f1: 0.4307
 epoch: 82, train_loss: 0.9542, test_loss: 1.1320, test_f1: 0.4402
 epoch: 83, train_loss: 0.9637, test_loss: 1.1289, test_f1: 0.4345
 epoch: 84, train_loss: 0.9548, test_loss: 1.1393, test_f1: 0.4374
 epoch: 85, train_loss: 0.9632, test_loss: 1.1421, test_f1: 0.4377
 epoch: 86, train_loss: 0.9403, test_loss: 1.1461, test_f1: 0.4339
 epoch: 87, train_loss: 0.9536, test_loss: 1.1401, test_f1: 0.4360
 epoch: 88, train_loss: 0.9574, test_loss: 1.1506, test_f1: 0.4404
 epoch: 89, train_loss: 0.9559, test_loss: 1.1801, test_f1: 0.4332
 epoch: 90, train_loss: 0.9556, test_loss: 1.1949, test_f1: 0.4316
 epoch: 91, train_loss: 0.9483, test_loss: 1.1935, test_f1: 0.4242
 epoch: 92, train_loss: 0.9493, test_loss: 1.1978, test_f1: 0.4389
 epoch: 93, train_loss: 0.9536, test_loss: 1.2039, test_f1: 0.4370
 epoch: 94, train_loss: 0.9457, test_loss: 1.2028, test_f1: 0.4450
 epoch: 95, train_loss: 0.9490, test_loss: 1.1877, test_f1: 0.4332
 epoch: 96, train_loss: 0.9535, test_loss: 1.1836, test_f1: 0.4311
 epoch: 97, train_loss: 0.9521, test_loss: 1.2125, test_f1: 0.4595
 epoch: 98, train_loss: 0.9553, test_loss: 1.2082, test_f1: 0.4443
 epoch: 99, train_loss: 0.9442, test_loss: 1.1815, test_f1: 0.4440
##################ITERATION #4 ****************************************
 epoch: 0, train_loss: 1.3608, test_loss: 1.3144, test_f1: 0.2281
 epoch: 1, train_loss: 1.2656, test_loss: 1.3096, test_f1: 0.2281
 epoch: 2, train_loss: 1.2374, test_loss: 1.3043, test_f1: 0.2281
 epoch: 3, train_loss: 1.2213, test_loss: 1.2962, test_f1: 0.2281
 epoch: 4, train_loss: 1.1936, test_loss: 1.2820, test_f1: 0.2281
 epoch: 5, train_loss: 1.1826, test_loss: 1.2654, test_f1: 0.2336
 epoch: 6, train_loss: 1.1734, test_loss: 1.2505, test_f1: 0.2336
 epoch: 7, train_loss: 1.1521, test_loss: 1.2380, test_f1: 0.2492
 epoch: 8, train_loss: 1.1371, test_loss: 1.2254, test_f1: 0.2526
 epoch: 9, train_loss: 1.1373, test_loss: 1.2169, test_f1: 0.2570
 epoch: 10, train_loss: 1.1138, test_loss: 1.2125, test_f1: 0.2556
 epoch: 11, train_loss: 1.1125, test_loss: 1.2049, test_f1: 0.2960
 epoch: 12, train_loss: 1.1168, test_loss: 1.1985, test_f1: 0.3070
 epoch: 13, train_loss: 1.0923, test_loss: 1.1912, test_f1: 0.3322
 epoch: 14, train_loss: 1.0820, test_loss: 1.1859, test_f1: 0.4027
 epoch: 15, train_loss: 1.0782, test_loss: 1.1795, test_f1: 0.4174
 epoch: 16, train_loss: 1.0817, test_loss: 1.1753, test_f1: 0.4261
 epoch: 17, train_loss: 1.0800, test_loss: 1.1761, test_f1: 0.4196
 epoch: 18, train_loss: 1.0627, test_loss: 1.1784, test_f1: 0.4085
 epoch: 19, train_loss: 1.0648, test_loss: 1.1681, test_f1: 0.4154
 epoch: 20, train_loss: 1.0548, test_loss: 1.1787, test_f1: 0.4393
 epoch: 21, train_loss: 1.0566, test_loss: 1.2004, test_f1: 0.4379
 epoch: 22, train_loss: 1.0669, test_loss: 1.1917, test_f1: 0.4428
 epoch: 23, train_loss: 1.0445, test_loss: 1.1734, test_f1: 0.4158
 epoch: 24, train_loss: 1.0473, test_loss: 1.1365, test_f1: 0.4226
 epoch: 25, train_loss: 1.0362, test_loss: 1.1520, test_f1: 0.4203
 epoch: 26, train_loss: 1.0294, test_loss: 1.1468, test_f1: 0.4165
 epoch: 27, train_loss: 1.0256, test_loss: 1.1574, test_f1: 0.4140
 epoch: 28, train_loss: 1.0269, test_loss: 1.1750, test_f1: 0.4278
 epoch: 29, train_loss: 1.0229, test_loss: 1.1765, test_f1: 0.4294
 epoch: 30, train_loss: 1.0190, test_loss: 1.1566, test_f1: 0.4285
 epoch: 31, train_loss: 1.0230, test_loss: 1.1520, test_f1: 0.4130
 epoch: 32, train_loss: 1.0138, test_loss: 1.1575, test_f1: 0.4169
 epoch: 33, train_loss: 1.0108, test_loss: 1.1593, test_f1: 0.4462
 epoch: 34, train_loss: 1.0145, test_loss: 1.1567, test_f1: 0.4478
 epoch: 35, train_loss: 1.0123, test_loss: 1.1384, test_f1: 0.4572
 epoch: 36, train_loss: 1.0119, test_loss: 1.1582, test_f1: 0.4374
 epoch: 37, train_loss: 1.0094, test_loss: 1.1493, test_f1: 0.4460
 epoch: 38, train_loss: 1.0046, test_loss: 1.1487, test_f1: 0.4427
 epoch: 39, train_loss: 0.9995, test_loss: 1.1486, test_f1: 0.4138
 epoch: 40, train_loss: 0.9947, test_loss: 1.1435, test_f1: 0.4174
 epoch: 41, train_loss: 1.0002, test_loss: 1.1380, test_f1: 0.4233
 epoch: 42, train_loss: 0.9814, test_loss: 1.1522, test_f1: 0.4358
 epoch: 43, train_loss: 0.9918, test_loss: 1.1528, test_f1: 0.4392
 epoch: 44, train_loss: 0.9867, test_loss: 1.1711, test_f1: 0.4546
 epoch: 45, train_loss: 0.9962, test_loss: 1.1493, test_f1: 0.4527
 epoch: 46, train_loss: 0.9842, test_loss: 1.1220, test_f1: 0.4504
 epoch: 47, train_loss: 0.9766, test_loss: 1.1544, test_f1: 0.4466
 epoch: 48, train_loss: 0.9741, test_loss: 1.1736, test_f1: 0.4357
 epoch: 49, train_loss: 0.9836, test_loss: 1.1561, test_f1: 0.4379
 epoch: 50, train_loss: 0.9812, test_loss: 1.1337, test_f1: 0.4160
 epoch: 51, train_loss: 0.9850, test_loss: 1.1460, test_f1: 0.4187
 epoch: 52, train_loss: 0.9735, test_loss: 1.1660, test_f1: 0.4233
 epoch: 53, train_loss: 0.9729, test_loss: 1.1599, test_f1: 0.4205
 epoch: 54, train_loss: 0.9739, test_loss: 1.1471, test_f1: 0.4183
 epoch: 55, train_loss: 0.9741, test_loss: 1.1258, test_f1: 0.4126
 epoch: 56, train_loss: 0.9692, test_loss: 1.1300, test_f1: 0.4152
 epoch: 57, train_loss: 0.9719, test_loss: 1.1267, test_f1: 0.4196
 epoch: 58, train_loss: 0.9653, test_loss: 1.1410, test_f1: 0.4188
 epoch: 59, train_loss: 0.9575, test_loss: 1.1441, test_f1: 0.4335
 epoch: 60, train_loss: 0.9651, test_loss: 1.1502, test_f1: 0.4405
 epoch: 61, train_loss: 0.9636, test_loss: 1.1340, test_f1: 0.4397
 epoch: 62, train_loss: 0.9630, test_loss: 1.1249, test_f1: 0.4422
 epoch: 63, train_loss: 0.9638, test_loss: 1.1432, test_f1: 0.4367
 epoch: 64, train_loss: 0.9584, test_loss: 1.1527, test_f1: 0.4384
 epoch: 65, train_loss: 0.9702, test_loss: 1.1598, test_f1: 0.4435
 epoch: 66, train_loss: 0.9571, test_loss: 1.1483, test_f1: 0.4360
 epoch: 67, train_loss: 0.9649, test_loss: 1.1446, test_f1: 0.4422
 epoch: 68, train_loss: 0.9549, test_loss: 1.1511, test_f1: 0.4396
 epoch: 69, train_loss: 0.9631, test_loss: 1.1600, test_f1: 0.4419
 epoch: 70, train_loss: 0.9606, test_loss: 1.1530, test_f1: 0.4524
 epoch: 71, train_loss: 0.9526, test_loss: 1.1406, test_f1: 0.4488
 epoch: 72, train_loss: 0.9526, test_loss: 1.1379, test_f1: 0.4693
 epoch: 73, train_loss: 0.9517, test_loss: 1.1628, test_f1: 0.4443
 epoch: 74, train_loss: 0.9553, test_loss: 1.1567, test_f1: 0.4530
 epoch: 75, train_loss: 0.9510, test_loss: 1.1478, test_f1: 0.4601
 epoch: 76, train_loss: 0.9555, test_loss: 1.1471, test_f1: 0.4624
 epoch: 77, train_loss: 0.9561, test_loss: 1.1613, test_f1: 0.4377
 epoch: 78, train_loss: 0.9521, test_loss: 1.1356, test_f1: 0.4513
 epoch: 79, train_loss: 0.9444, test_loss: 1.1588, test_f1: 0.4429
 epoch: 80, train_loss: 0.9465, test_loss: 1.1727, test_f1: 0.4371
 epoch: 81, train_loss: 0.9480, test_loss: 1.1553, test_f1: 0.4692
 epoch: 82, train_loss: 0.9472, test_loss: 1.1405, test_f1: 0.4339
 epoch: 83, train_loss: 0.9493, test_loss: 1.1306, test_f1: 0.4458
 epoch: 84, train_loss: 0.9404, test_loss: 1.1289, test_f1: 0.4277
 epoch: 85, train_loss: 0.9452, test_loss: 1.1165, test_f1: 0.4260
 epoch: 86, train_loss: 0.9424, test_loss: 1.1443, test_f1: 0.4327
 epoch: 87, train_loss: 0.9450, test_loss: 1.1602, test_f1: 0.4421
 epoch: 88, train_loss: 0.9354, test_loss: 1.1680, test_f1: 0.4477
 epoch: 89, train_loss: 0.9423, test_loss: 1.1759, test_f1: 0.4420
 epoch: 90, train_loss: 0.9467, test_loss: 1.1591, test_f1: 0.4602
 epoch: 91, train_loss: 0.9405, test_loss: 1.1661, test_f1: 0.4509
 epoch: 92, train_loss: 0.9484, test_loss: 1.1545, test_f1: 0.4436
 epoch: 93, train_loss: 0.9480, test_loss: 1.1556, test_f1: 0.4432
 epoch: 94, train_loss: 0.9283, test_loss: 1.1598, test_f1: 0.4463
 epoch: 95, train_loss: 0.9404, test_loss: 1.1498, test_f1: 0.4484
 epoch: 96, train_loss: 0.9274, test_loss: 1.1272, test_f1: 0.4596
 epoch: 97, train_loss: 0.9419, test_loss: 1.1533, test_f1: 0.4516
 epoch: 98, train_loss: 0.9398, test_loss: 1.1769, test_f1: 0.4335
 epoch: 99, train_loss: 0.9217, test_loss: 1.1649, test_f1: 0.4391
##################ITERATION #5 ****************************************
 epoch: 0, train_loss: 1.3307, test_loss: 1.3246, test_f1: 0.2281
 epoch: 1, train_loss: 1.2614, test_loss: 1.3231, test_f1: 0.2281
 epoch: 2, train_loss: 1.2411, test_loss: 1.3130, test_f1: 0.2281
 epoch: 3, train_loss: 1.2267, test_loss: 1.2969, test_f1: 0.2281
 epoch: 4, train_loss: 1.2129, test_loss: 1.2729, test_f1: 0.2281
 epoch: 5, train_loss: 1.1908, test_loss: 1.2521, test_f1: 0.2583
 epoch: 6, train_loss: 1.1766, test_loss: 1.2371, test_f1: 0.2641
 epoch: 7, train_loss: 1.1638, test_loss: 1.2224, test_f1: 0.3252
 epoch: 8, train_loss: 1.1528, test_loss: 1.2026, test_f1: 0.3337
 epoch: 9, train_loss: 1.1380, test_loss: 1.1869, test_f1: 0.4080
 epoch: 10, train_loss: 1.1335, test_loss: 1.1744, test_f1: 0.4105
 epoch: 11, train_loss: 1.1233, test_loss: 1.1644, test_f1: 0.4122
 epoch: 12, train_loss: 1.1124, test_loss: 1.1531, test_f1: 0.4243
 epoch: 13, train_loss: 1.1084, test_loss: 1.1480, test_f1: 0.4084
 epoch: 14, train_loss: 1.0878, test_loss: 1.1426, test_f1: 0.4125
 epoch: 15, train_loss: 1.0781, test_loss: 1.1387, test_f1: 0.4104
 epoch: 16, train_loss: 1.0657, test_loss: 1.1364, test_f1: 0.4178
 epoch: 17, train_loss: 1.0716, test_loss: 1.1357, test_f1: 0.4160
 epoch: 18, train_loss: 1.0644, test_loss: 1.1324, test_f1: 0.4131
 epoch: 19, train_loss: 1.0577, test_loss: 1.1321, test_f1: 0.4137
 epoch: 20, train_loss: 1.0525, test_loss: 1.1329, test_f1: 0.4020
 epoch: 21, train_loss: 1.0501, test_loss: 1.1308, test_f1: 0.4017
 epoch: 22, train_loss: 1.0425, test_loss: 1.1303, test_f1: 0.4019
 epoch: 23, train_loss: 1.0464, test_loss: 1.1239, test_f1: 0.4019
 epoch: 24, train_loss: 1.0316, test_loss: 1.1237, test_f1: 0.4001
 epoch: 25, train_loss: 1.0311, test_loss: 1.1245, test_f1: 0.4001
 epoch: 26, train_loss: 1.0180, test_loss: 1.1214, test_f1: 0.4046
 epoch: 27, train_loss: 1.0164, test_loss: 1.1230, test_f1: 0.4080
 epoch: 28, train_loss: 1.0300, test_loss: 1.1199, test_f1: 0.4158
 epoch: 29, train_loss: 1.0095, test_loss: 1.1234, test_f1: 0.4101
 epoch: 30, train_loss: 1.0084, test_loss: 1.1239, test_f1: 0.4236
 epoch: 31, train_loss: 1.0111, test_loss: 1.1157, test_f1: 0.4226
 epoch: 32, train_loss: 1.0113, test_loss: 1.1111, test_f1: 0.4217
 epoch: 33, train_loss: 1.0014, test_loss: 1.1109, test_f1: 0.4146
 epoch: 34, train_loss: 1.0153, test_loss: 1.1125, test_f1: 0.4193
 epoch: 35, train_loss: 0.9943, test_loss: 1.1076, test_f1: 0.4112
 epoch: 36, train_loss: 1.0044, test_loss: 1.1036, test_f1: 0.4108
 epoch: 37, train_loss: 0.9888, test_loss: 1.1007, test_f1: 0.4085
 epoch: 38, train_loss: 0.9939, test_loss: 1.1015, test_f1: 0.4083
 epoch: 39, train_loss: 0.9880, test_loss: 1.1062, test_f1: 0.4088
 epoch: 40, train_loss: 0.9937, test_loss: 1.1077, test_f1: 0.4201
 epoch: 41, train_loss: 0.9794, test_loss: 1.1132, test_f1: 0.4197
 epoch: 42, train_loss: 0.9897, test_loss: 1.1076, test_f1: 0.4271
 epoch: 43, train_loss: 0.9795, test_loss: 1.1094, test_f1: 0.4219
 epoch: 44, train_loss: 0.9824, test_loss: 1.1129, test_f1: 0.4169
 epoch: 45, train_loss: 0.9740, test_loss: 1.1182, test_f1: 0.4161
 epoch: 46, train_loss: 0.9783, test_loss: 1.1111, test_f1: 0.4233
 epoch: 47, train_loss: 0.9742, test_loss: 1.1072, test_f1: 0.4172
 epoch: 48, train_loss: 0.9667, test_loss: 1.1043, test_f1: 0.4279
 epoch: 49, train_loss: 0.9755, test_loss: 1.1104, test_f1: 0.4234
 epoch: 50, train_loss: 0.9590, test_loss: 1.1143, test_f1: 0.4284
 epoch: 51, train_loss: 0.9748, test_loss: 1.1126, test_f1: 0.4227
 epoch: 52, train_loss: 0.9699, test_loss: 1.1136, test_f1: 0.4263
 epoch: 53, train_loss: 0.9630, test_loss: 1.1123, test_f1: 0.4182
 epoch: 54, train_loss: 0.9642, test_loss: 1.1170, test_f1: 0.4188
 epoch: 55, train_loss: 0.9626, test_loss: 1.1163, test_f1: 0.4214
 epoch: 56, train_loss: 0.9650, test_loss: 1.1114, test_f1: 0.4218
 epoch: 57, train_loss: 0.9614, test_loss: 1.1060, test_f1: 0.4227
 epoch: 58, train_loss: 0.9549, test_loss: 1.1043, test_f1: 0.4232
 epoch: 59, train_loss: 0.9620, test_loss: 1.1016, test_f1: 0.4232
 epoch: 60, train_loss: 0.9593, test_loss: 1.0946, test_f1: 0.4250
 epoch: 61, train_loss: 0.9505, test_loss: 1.0916, test_f1: 0.4263
 epoch: 62, train_loss: 0.9590, test_loss: 1.0881, test_f1: 0.4249
 epoch: 63, train_loss: 0.9535, test_loss: 1.0928, test_f1: 0.4227
 epoch: 64, train_loss: 0.9643, test_loss: 1.0933, test_f1: 0.4285
 epoch: 65, train_loss: 0.9505, test_loss: 1.0908, test_f1: 0.4371
 epoch: 66, train_loss: 0.9515, test_loss: 1.0905, test_f1: 0.4371
 epoch: 67, train_loss: 0.9467, test_loss: 1.0950, test_f1: 0.4371
 epoch: 68, train_loss: 0.9487, test_loss: 1.0994, test_f1: 0.4320
 epoch: 69, train_loss: 0.9542, test_loss: 1.0945, test_f1: 0.4250
 epoch: 70, train_loss: 0.9465, test_loss: 1.0935, test_f1: 0.4270
 epoch: 71, train_loss: 0.9565, test_loss: 1.0944, test_f1: 0.4233
 epoch: 72, train_loss: 0.9532, test_loss: 1.0988, test_f1: 0.4265
 epoch: 73, train_loss: 0.9451, test_loss: 1.1017, test_f1: 0.4307
 epoch: 74, train_loss: 0.9520, test_loss: 1.1075, test_f1: 0.4262
 epoch: 75, train_loss: 0.9489, test_loss: 1.1110, test_f1: 0.4319
 epoch: 76, train_loss: 0.9364, test_loss: 1.1059, test_f1: 0.4243
 epoch: 77, train_loss: 0.9494, test_loss: 1.1057, test_f1: 0.4243
 epoch: 78, train_loss: 0.9447, test_loss: 1.1055, test_f1: 0.4246
 epoch: 79, train_loss: 0.9339, test_loss: 1.0968, test_f1: 0.4376
 epoch: 80, train_loss: 0.9427, test_loss: 1.0944, test_f1: 0.4404
 epoch: 81, train_loss: 0.9414, test_loss: 1.0918, test_f1: 0.4371
 epoch: 82, train_loss: 0.9456, test_loss: 1.0956, test_f1: 0.4385
 epoch: 83, train_loss: 0.9393, test_loss: 1.0998, test_f1: 0.4385
 epoch: 84, train_loss: 0.9366, test_loss: 1.0996, test_f1: 0.4367
 epoch: 85, train_loss: 0.9388, test_loss: 1.0984, test_f1: 0.4363
 epoch: 86, train_loss: 0.9485, test_loss: 1.1048, test_f1: 0.4300
 epoch: 87, train_loss: 0.9389, test_loss: 1.1039, test_f1: 0.4352
 epoch: 88, train_loss: 0.9410, test_loss: 1.1071, test_f1: 0.4441
 epoch: 89, train_loss: 0.9466, test_loss: 1.1002, test_f1: 0.4385
 epoch: 90, train_loss: 0.9386, test_loss: 1.1023, test_f1: 0.4365
 epoch: 91, train_loss: 0.9394, test_loss: 1.1069, test_f1: 0.4306
 epoch: 92, train_loss: 0.9304, test_loss: 1.1058, test_f1: 0.4316
 epoch: 93, train_loss: 0.9361, test_loss: 1.0997, test_f1: 0.4356
 epoch: 94, train_loss: 0.9308, test_loss: 1.1009, test_f1: 0.4385
 epoch: 95, train_loss: 0.9287, test_loss: 1.1048, test_f1: 0.4499
 epoch: 96, train_loss: 0.9270, test_loss: 1.1106, test_f1: 0.4469
 epoch: 97, train_loss: 0.9245, test_loss: 1.1186, test_f1: 0.4405
 epoch: 98, train_loss: 0.9172, test_loss: 1.1162, test_f1: 0.4386
 epoch: 99, train_loss: 0.9298, test_loss: 1.1062, test_f1: 0.4467
##################ITERATION #6 ****************************************
 epoch: 0, train_loss: 1.4326, test_loss: 1.3273, test_f1: 0.2281
 epoch: 1, train_loss: 1.2982, test_loss: 1.3152, test_f1: 0.2281
 epoch: 2, train_loss: 1.2726, test_loss: 1.3108, test_f1: 0.2281
 epoch: 3, train_loss: 1.2507, test_loss: 1.3057, test_f1: 0.2281
 epoch: 4, train_loss: 1.2302, test_loss: 1.2904, test_f1: 0.2281
 epoch: 5, train_loss: 1.2218, test_loss: 1.2726, test_f1: 0.2281
 epoch: 6, train_loss: 1.2041, test_loss: 1.2578, test_f1: 0.2583
 epoch: 7, train_loss: 1.1806, test_loss: 1.2475, test_f1: 0.2829
 epoch: 8, train_loss: 1.1892, test_loss: 1.2347, test_f1: 0.2882
 epoch: 9, train_loss: 1.1589, test_loss: 1.2061, test_f1: 0.2980
 epoch: 10, train_loss: 1.1441, test_loss: 1.1926, test_f1: 0.3178
 epoch: 11, train_loss: 1.1269, test_loss: 1.1847, test_f1: 0.3274
 epoch: 12, train_loss: 1.1077, test_loss: 1.1700, test_f1: 0.3507
 epoch: 13, train_loss: 1.0914, test_loss: 1.1618, test_f1: 0.4076
 epoch: 14, train_loss: 1.0954, test_loss: 1.1522, test_f1: 0.4187
 epoch: 15, train_loss: 1.0825, test_loss: 1.1452, test_f1: 0.4187
 epoch: 16, train_loss: 1.0818, test_loss: 1.1392, test_f1: 0.4187
 epoch: 17, train_loss: 1.0771, test_loss: 1.1327, test_f1: 0.4187
 epoch: 18, train_loss: 1.0623, test_loss: 1.1210, test_f1: 0.4246
 epoch: 19, train_loss: 1.0657, test_loss: 1.1216, test_f1: 0.4165
 epoch: 20, train_loss: 1.0518, test_loss: 1.1217, test_f1: 0.4241
 epoch: 21, train_loss: 1.0417, test_loss: 1.1193, test_f1: 0.4283
 epoch: 22, train_loss: 1.0513, test_loss: 1.1178, test_f1: 0.4324
 epoch: 23, train_loss: 1.0410, test_loss: 1.1118, test_f1: 0.4355
 epoch: 24, train_loss: 1.0410, test_loss: 1.1118, test_f1: 0.4302
 epoch: 25, train_loss: 1.0251, test_loss: 1.1102, test_f1: 0.4379
 epoch: 26, train_loss: 1.0203, test_loss: 1.1074, test_f1: 0.4373
 epoch: 27, train_loss: 1.0128, test_loss: 1.1070, test_f1: 0.4373
 epoch: 28, train_loss: 1.0138, test_loss: 1.1114, test_f1: 0.4362
 epoch: 29, train_loss: 1.0127, test_loss: 1.1067, test_f1: 0.4341
 epoch: 30, train_loss: 1.0104, test_loss: 1.0993, test_f1: 0.4402
 epoch: 31, train_loss: 1.0117, test_loss: 1.0940, test_f1: 0.4342
 epoch: 32, train_loss: 1.0052, test_loss: 1.0862, test_f1: 0.4337
 epoch: 33, train_loss: 1.0112, test_loss: 1.0808, test_f1: 0.4337
 epoch: 34, train_loss: 1.0092, test_loss: 1.0808, test_f1: 0.4354
 epoch: 35, train_loss: 0.9972, test_loss: 1.0790, test_f1: 0.4354
 epoch: 36, train_loss: 1.0050, test_loss: 1.0859, test_f1: 0.4350
 epoch: 37, train_loss: 0.9912, test_loss: 1.0833, test_f1: 0.4347
 epoch: 38, train_loss: 0.9938, test_loss: 1.0800, test_f1: 0.4416
 epoch: 39, train_loss: 0.9983, test_loss: 1.0748, test_f1: 0.4386
 epoch: 40, train_loss: 0.9941, test_loss: 1.0752, test_f1: 0.4455
 epoch: 41, train_loss: 0.9868, test_loss: 1.0704, test_f1: 0.4380
 epoch: 42, train_loss: 0.9919, test_loss: 1.0629, test_f1: 0.4421
 epoch: 43, train_loss: 0.9827, test_loss: 1.0567, test_f1: 0.4427
 epoch: 44, train_loss: 0.9789, test_loss: 1.0563, test_f1: 0.4386
 epoch: 45, train_loss: 0.9846, test_loss: 1.0763, test_f1: 0.4333
 epoch: 46, train_loss: 0.9850, test_loss: 1.0829, test_f1: 0.4342
 epoch: 47, train_loss: 0.9764, test_loss: 1.0653, test_f1: 0.4342
 epoch: 48, train_loss: 0.9763, test_loss: 1.0510, test_f1: 0.4271
 epoch: 49, train_loss: 0.9733, test_loss: 1.0630, test_f1: 0.4228
 epoch: 50, train_loss: 0.9657, test_loss: 1.0672, test_f1: 0.4387
 epoch: 51, train_loss: 0.9823, test_loss: 1.0702, test_f1: 0.4479
 epoch: 52, train_loss: 0.9714, test_loss: 1.0633, test_f1: 0.4537
 epoch: 53, train_loss: 0.9621, test_loss: 1.0540, test_f1: 0.4411
 epoch: 54, train_loss: 0.9656, test_loss: 1.0461, test_f1: 0.4357
 epoch: 55, train_loss: 0.9715, test_loss: 1.0516, test_f1: 0.4387
 epoch: 56, train_loss: 0.9558, test_loss: 1.0609, test_f1: 0.4317
 epoch: 57, train_loss: 0.9621, test_loss: 1.0636, test_f1: 0.4276
 epoch: 58, train_loss: 0.9590, test_loss: 1.0665, test_f1: 0.4531
 epoch: 59, train_loss: 0.9574, test_loss: 1.0641, test_f1: 0.4590
 epoch: 60, train_loss: 0.9650, test_loss: 1.0614, test_f1: 0.4537
 epoch: 61, train_loss: 0.9575, test_loss: 1.0538, test_f1: 0.4509
 epoch: 62, train_loss: 0.9588, test_loss: 1.0500, test_f1: 0.4419
 epoch: 63, train_loss: 0.9608, test_loss: 1.0508, test_f1: 0.4366
 epoch: 64, train_loss: 0.9483, test_loss: 1.0498, test_f1: 0.4453
 epoch: 65, train_loss: 0.9640, test_loss: 1.0534, test_f1: 0.4478
 epoch: 66, train_loss: 0.9524, test_loss: 1.0596, test_f1: 0.4475
 epoch: 67, train_loss: 0.9490, test_loss: 1.0588, test_f1: 0.4472
 epoch: 68, train_loss: 0.9554, test_loss: 1.0575, test_f1: 0.4288
 epoch: 69, train_loss: 0.9473, test_loss: 1.0492, test_f1: 0.4409
 epoch: 70, train_loss: 0.9552, test_loss: 1.0513, test_f1: 0.4492
 epoch: 71, train_loss: 0.9492, test_loss: 1.0534, test_f1: 0.4654
 epoch: 72, train_loss: 0.9483, test_loss: 1.0539, test_f1: 0.4585
 epoch: 73, train_loss: 0.9511, test_loss: 1.0591, test_f1: 0.4483
 epoch: 74, train_loss: 0.9546, test_loss: 1.0512, test_f1: 0.4530
 epoch: 75, train_loss: 0.9505, test_loss: 1.0443, test_f1: 0.4464
 epoch: 76, train_loss: 0.9455, test_loss: 1.0488, test_f1: 0.4622
 epoch: 77, train_loss: 0.9489, test_loss: 1.0456, test_f1: 0.4657
 epoch: 78, train_loss: 0.9481, test_loss: 1.0475, test_f1: 0.4574
 epoch: 79, train_loss: 0.9468, test_loss: 1.0497, test_f1: 0.4541
 epoch: 80, train_loss: 0.9466, test_loss: 1.0581, test_f1: 0.4403
 epoch: 81, train_loss: 0.9394, test_loss: 1.0553, test_f1: 0.4486
 epoch: 82, train_loss: 0.9364, test_loss: 1.0567, test_f1: 0.4522
 epoch: 83, train_loss: 0.9346, test_loss: 1.0617, test_f1: 0.4515
 epoch: 84, train_loss: 0.9512, test_loss: 1.0542, test_f1: 0.4466
 epoch: 85, train_loss: 0.9319, test_loss: 1.0524, test_f1: 0.4560
 epoch: 86, train_loss: 0.9415, test_loss: 1.0530, test_f1: 0.4550
 epoch: 87, train_loss: 0.9496, test_loss: 1.0590, test_f1: 0.4543
 epoch: 88, train_loss: 0.9375, test_loss: 1.0428, test_f1: 0.4578
 epoch: 89, train_loss: 0.9401, test_loss: 1.0463, test_f1: 0.4607
 epoch: 90, train_loss: 0.9443, test_loss: 1.0530, test_f1: 0.4693
 epoch: 91, train_loss: 0.9357, test_loss: 1.0516, test_f1: 0.4612
 epoch: 92, train_loss: 0.9492, test_loss: 1.0487, test_f1: 0.4466
 epoch: 93, train_loss: 0.9333, test_loss: 1.0426, test_f1: 0.4724
 epoch: 94, train_loss: 0.9322, test_loss: 1.0368, test_f1: 0.4724
 epoch: 95, train_loss: 0.9384, test_loss: 1.0402, test_f1: 0.4655
 epoch: 96, train_loss: 0.9381, test_loss: 1.0378, test_f1: 0.4688
 epoch: 97, train_loss: 0.9421, test_loss: 1.0365, test_f1: 0.4756
 epoch: 98, train_loss: 0.9342, test_loss: 1.0479, test_f1: 0.4588
 epoch: 99, train_loss: 0.9363, test_loss: 1.0469, test_f1: 0.4653
##################ITERATION #7 ****************************************
 epoch: 0, train_loss: 1.2809, test_loss: 1.3410, test_f1: 0.2281
 epoch: 1, train_loss: 1.2301, test_loss: 1.3385, test_f1: 0.2281
 epoch: 2, train_loss: 1.2142, test_loss: 1.3339, test_f1: 0.2281
 epoch: 3, train_loss: 1.2044, test_loss: 1.3313, test_f1: 0.2281
 epoch: 4, train_loss: 1.1928, test_loss: 1.3301, test_f1: 0.2281
 epoch: 5, train_loss: 1.1746, test_loss: 1.3258, test_f1: 0.2281
 epoch: 6, train_loss: 1.1592, test_loss: 1.3243, test_f1: 0.2344
 epoch: 7, train_loss: 1.1685, test_loss: 1.3088, test_f1: 0.2468
 epoch: 8, train_loss: 1.1640, test_loss: 1.2905, test_f1: 0.2792
 epoch: 9, train_loss: 1.1554, test_loss: 1.2699, test_f1: 0.2846
 epoch: 10, train_loss: 1.1437, test_loss: 1.2543, test_f1: 0.3329
 epoch: 11, train_loss: 1.1479, test_loss: 1.2381, test_f1: 0.3347
 epoch: 12, train_loss: 1.1340, test_loss: 1.2239, test_f1: 0.3184
 epoch: 13, train_loss: 1.1243, test_loss: 1.2136, test_f1: 0.3156
 epoch: 14, train_loss: 1.1173, test_loss: 1.2086, test_f1: 0.3337
 epoch: 15, train_loss: 1.1149, test_loss: 1.2008, test_f1: 0.3395
 epoch: 16, train_loss: 1.1044, test_loss: 1.1914, test_f1: 0.3492
 epoch: 17, train_loss: 1.0927, test_loss: 1.1906, test_f1: 0.3634
 epoch: 18, train_loss: 1.0944, test_loss: 1.1892, test_f1: 0.3636
 epoch: 19, train_loss: 1.0962, test_loss: 1.1847, test_f1: 0.3679
 epoch: 20, train_loss: 1.0901, test_loss: 1.1756, test_f1: 0.3551
 epoch: 21, train_loss: 1.0872, test_loss: 1.1571, test_f1: 0.3895
 epoch: 22, train_loss: 1.0865, test_loss: 1.1489, test_f1: 0.3919
 epoch: 23, train_loss: 1.0777, test_loss: 1.1544, test_f1: 0.3973
 epoch: 24, train_loss: 1.0772, test_loss: 1.1510, test_f1: 0.4278
 epoch: 25, train_loss: 1.0538, test_loss: 1.1394, test_f1: 0.4398
 epoch: 26, train_loss: 1.0557, test_loss: 1.1408, test_f1: 0.4429
 epoch: 27, train_loss: 1.0571, test_loss: 1.1378, test_f1: 0.4488
 epoch: 28, train_loss: 1.0459, test_loss: 1.1477, test_f1: 0.4595
 epoch: 29, train_loss: 1.0527, test_loss: 1.1466, test_f1: 0.4475
 epoch: 30, train_loss: 1.0460, test_loss: 1.1317, test_f1: 0.4602
 epoch: 31, train_loss: 1.0414, test_loss: 1.1196, test_f1: 0.4649
 epoch: 32, train_loss: 1.0493, test_loss: 1.1102, test_f1: 0.4464
 epoch: 33, train_loss: 1.0445, test_loss: 1.1131, test_f1: 0.4491
 epoch: 34, train_loss: 1.0400, test_loss: 1.1200, test_f1: 0.4550
 epoch: 35, train_loss: 1.0325, test_loss: 1.1090, test_f1: 0.4645
 epoch: 36, train_loss: 1.0234, test_loss: 1.1079, test_f1: 0.4389
 epoch: 37, train_loss: 1.0061, test_loss: 1.1036, test_f1: 0.4556
 epoch: 38, train_loss: 1.0086, test_loss: 1.1119, test_f1: 0.4471
 epoch: 39, train_loss: 1.0167, test_loss: 1.0978, test_f1: 0.4419
 epoch: 40, train_loss: 1.0151, test_loss: 1.0911, test_f1: 0.4513
 epoch: 41, train_loss: 1.0049, test_loss: 1.0895, test_f1: 0.4475
 epoch: 42, train_loss: 0.9955, test_loss: 1.0747, test_f1: 0.4545
 epoch: 43, train_loss: 0.9935, test_loss: 1.0732, test_f1: 0.4614
 epoch: 44, train_loss: 0.9975, test_loss: 1.0860, test_f1: 0.4489
 epoch: 45, train_loss: 1.0053, test_loss: 1.0776, test_f1: 0.4564
 epoch: 46, train_loss: 0.9982, test_loss: 1.0711, test_f1: 0.4595
 epoch: 47, train_loss: 0.9993, test_loss: 1.0753, test_f1: 0.4659
 epoch: 48, train_loss: 0.9962, test_loss: 1.0713, test_f1: 0.4272
 epoch: 49, train_loss: 0.9919, test_loss: 1.0544, test_f1: 0.4282
 epoch: 50, train_loss: 0.9785, test_loss: 1.0577, test_f1: 0.4457
 epoch: 51, train_loss: 0.9796, test_loss: 1.0633, test_f1: 0.4417
 epoch: 52, train_loss: 0.9783, test_loss: 1.0625, test_f1: 0.4484
 epoch: 53, train_loss: 0.9840, test_loss: 1.0589, test_f1: 0.4533
 epoch: 54, train_loss: 0.9906, test_loss: 1.0581, test_f1: 0.4458
 epoch: 55, train_loss: 0.9878, test_loss: 1.0638, test_f1: 0.4477
 epoch: 56, train_loss: 0.9707, test_loss: 1.0727, test_f1: 0.4617
 epoch: 57, train_loss: 0.9693, test_loss: 1.0771, test_f1: 0.4684
 epoch: 58, train_loss: 0.9792, test_loss: 1.0812, test_f1: 0.4698
 epoch: 59, train_loss: 0.9771, test_loss: 1.0657, test_f1: 0.4665
 epoch: 60, train_loss: 0.9735, test_loss: 1.0535, test_f1: 0.4438
 epoch: 61, train_loss: 0.9739, test_loss: 1.0586, test_f1: 0.4486
 epoch: 62, train_loss: 0.9687, test_loss: 1.0609, test_f1: 0.4634
 epoch: 63, train_loss: 0.9699, test_loss: 1.0618, test_f1: 0.4666
 epoch: 64, train_loss: 0.9722, test_loss: 1.0560, test_f1: 0.4695
 epoch: 65, train_loss: 0.9662, test_loss: 1.0537, test_f1: 0.4552
 epoch: 66, train_loss: 0.9665, test_loss: 1.0544, test_f1: 0.4652
 epoch: 67, train_loss: 0.9615, test_loss: 1.0599, test_f1: 0.4721
 epoch: 68, train_loss: 0.9676, test_loss: 1.0517, test_f1: 0.4670
 epoch: 69, train_loss: 0.9621, test_loss: 1.0511, test_f1: 0.4626
 epoch: 70, train_loss: 0.9704, test_loss: 1.0535, test_f1: 0.4701
 epoch: 71, train_loss: 0.9612, test_loss: 1.0525, test_f1: 0.4676
 epoch: 72, train_loss: 0.9738, test_loss: 1.0491, test_f1: 0.4795
 epoch: 73, train_loss: 0.9669, test_loss: 1.0575, test_f1: 0.4716
 epoch: 74, train_loss: 0.9537, test_loss: 1.0624, test_f1: 0.4741
 epoch: 75, train_loss: 0.9492, test_loss: 1.0622, test_f1: 0.4714
 epoch: 76, train_loss: 0.9544, test_loss: 1.0728, test_f1: 0.4639
 epoch: 77, train_loss: 0.9519, test_loss: 1.0714, test_f1: 0.4772
 epoch: 78, train_loss: 0.9571, test_loss: 1.0605, test_f1: 0.4790
 epoch: 79, train_loss: 0.9577, test_loss: 1.0618, test_f1: 0.4775
 epoch: 80, train_loss: 0.9532, test_loss: 1.0617, test_f1: 0.4783
 epoch: 81, train_loss: 0.9608, test_loss: 1.0496, test_f1: 0.4683
 epoch: 82, train_loss: 0.9513, test_loss: 1.0419, test_f1: 0.4675
 epoch: 83, train_loss: 0.9634, test_loss: 1.0368, test_f1: 0.4698
 epoch: 84, train_loss: 0.9501, test_loss: 1.0397, test_f1: 0.4927
 epoch: 85, train_loss: 0.9539, test_loss: 1.0469, test_f1: 0.4838
 epoch: 86, train_loss: 0.9534, test_loss: 1.0539, test_f1: 0.4764
 epoch: 87, train_loss: 0.9464, test_loss: 1.0447, test_f1: 0.4684
 epoch: 88, train_loss: 0.9552, test_loss: 1.0441, test_f1: 0.4682
 epoch: 89, train_loss: 0.9473, test_loss: 1.0408, test_f1: 0.4728
 epoch: 90, train_loss: 0.9498, test_loss: 1.0390, test_f1: 0.4686
 epoch: 91, train_loss: 0.9530, test_loss: 1.0355, test_f1: 0.4770
 epoch: 92, train_loss: 0.9496, test_loss: 1.0453, test_f1: 0.4721
 epoch: 93, train_loss: 0.9456, test_loss: 1.0477, test_f1: 0.4654
 epoch: 94, train_loss: 0.9513, test_loss: 1.0465, test_f1: 0.4926
 epoch: 95, train_loss: 0.9443, test_loss: 1.0384, test_f1: 0.4951
 epoch: 96, train_loss: 0.9505, test_loss: 1.0371, test_f1: 0.4995
 epoch: 97, train_loss: 0.9557, test_loss: 1.0347, test_f1: 0.4954
 epoch: 98, train_loss: 0.9361, test_loss: 1.0312, test_f1: 0.4846
 epoch: 99, train_loss: 0.9455, test_loss: 1.0402, test_f1: 0.4783
##################ITERATION #8 ****************************************
 epoch: 0, train_loss: 1.4110, test_loss: 1.3289, test_f1: 0.2281
 epoch: 1, train_loss: 1.2705, test_loss: 1.3364, test_f1: 0.2281
 epoch: 2, train_loss: 1.2386, test_loss: 1.3391, test_f1: 0.2281
 epoch: 3, train_loss: 1.2066, test_loss: 1.3336, test_f1: 0.2281
 epoch: 4, train_loss: 1.2044, test_loss: 1.3212, test_f1: 0.2465
 epoch: 5, train_loss: 1.1789, test_loss: 1.3086, test_f1: 0.2720
 epoch: 6, train_loss: 1.1688, test_loss: 1.2897, test_f1: 0.2763
 epoch: 7, train_loss: 1.1661, test_loss: 1.2747, test_f1: 0.3170
 epoch: 8, train_loss: 1.1598, test_loss: 1.2642, test_f1: 0.3464
 epoch: 9, train_loss: 1.1365, test_loss: 1.2475, test_f1: 0.3755
 epoch: 10, train_loss: 1.1237, test_loss: 1.2175, test_f1: 0.3779
 epoch: 11, train_loss: 1.1324, test_loss: 1.2064, test_f1: 0.3819
 epoch: 12, train_loss: 1.1225, test_loss: 1.1974, test_f1: 0.3693
 epoch: 13, train_loss: 1.1144, test_loss: 1.1942, test_f1: 0.3693
 epoch: 14, train_loss: 1.1197, test_loss: 1.1869, test_f1: 0.3851
 epoch: 15, train_loss: 1.0976, test_loss: 1.1783, test_f1: 0.4079
 epoch: 16, train_loss: 1.0978, test_loss: 1.1723, test_f1: 0.4026
 epoch: 17, train_loss: 1.0940, test_loss: 1.1728, test_f1: 0.4073
 epoch: 18, train_loss: 1.0781, test_loss: 1.1755, test_f1: 0.4066
 epoch: 19, train_loss: 1.0830, test_loss: 1.1594, test_f1: 0.4011
 epoch: 20, train_loss: 1.0804, test_loss: 1.1504, test_f1: 0.4133
 epoch: 21, train_loss: 1.0692, test_loss: 1.1513, test_f1: 0.4177
 epoch: 22, train_loss: 1.0742, test_loss: 1.1550, test_f1: 0.4066
 epoch: 23, train_loss: 1.0699, test_loss: 1.1552, test_f1: 0.3915
 epoch: 24, train_loss: 1.0714, test_loss: 1.1491, test_f1: 0.4038
 epoch: 25, train_loss: 1.0657, test_loss: 1.1487, test_f1: 0.4095
 epoch: 26, train_loss: 1.0611, test_loss: 1.1590, test_f1: 0.4243
 epoch: 27, train_loss: 1.0500, test_loss: 1.1629, test_f1: 0.4255
 epoch: 28, train_loss: 1.0528, test_loss: 1.1342, test_f1: 0.4193
 epoch: 29, train_loss: 1.0520, test_loss: 1.1212, test_f1: 0.4158
 epoch: 30, train_loss: 1.0532, test_loss: 1.1200, test_f1: 0.4346
 epoch: 31, train_loss: 1.0400, test_loss: 1.1229, test_f1: 0.4258
 epoch: 32, train_loss: 1.0387, test_loss: 1.1288, test_f1: 0.4210
 epoch: 33, train_loss: 1.0342, test_loss: 1.1277, test_f1: 0.4392
 epoch: 34, train_loss: 1.0251, test_loss: 1.1205, test_f1: 0.4510
 epoch: 35, train_loss: 1.0132, test_loss: 1.1052, test_f1: 0.4349
 epoch: 36, train_loss: 1.0203, test_loss: 1.0987, test_f1: 0.4010
 epoch: 37, train_loss: 1.0144, test_loss: 1.0970, test_f1: 0.4444
 epoch: 38, train_loss: 1.0140, test_loss: 1.0945, test_f1: 0.4338
 epoch: 39, train_loss: 1.0103, test_loss: 1.0963, test_f1: 0.4523
 epoch: 40, train_loss: 1.0010, test_loss: 1.0886, test_f1: 0.4364
 epoch: 41, train_loss: 1.0099, test_loss: 1.0920, test_f1: 0.4342
 epoch: 42, train_loss: 1.0053, test_loss: 1.0925, test_f1: 0.4424
 epoch: 43, train_loss: 1.0018, test_loss: 1.0961, test_f1: 0.4415
 epoch: 44, train_loss: 1.0024, test_loss: 1.0949, test_f1: 0.4346
 epoch: 45, train_loss: 1.0002, test_loss: 1.0883, test_f1: 0.4127
 epoch: 46, train_loss: 1.0098, test_loss: 1.0809, test_f1: 0.4332
 epoch: 47, train_loss: 1.0046, test_loss: 1.0751, test_f1: 0.4347
 epoch: 48, train_loss: 1.0022, test_loss: 1.0723, test_f1: 0.4239
 epoch: 49, train_loss: 0.9978, test_loss: 1.0845, test_f1: 0.4113
 epoch: 50, train_loss: 0.9957, test_loss: 1.0749, test_f1: 0.4149
 epoch: 51, train_loss: 0.9897, test_loss: 1.0673, test_f1: 0.4211
 epoch: 52, train_loss: 1.0005, test_loss: 1.0702, test_f1: 0.4491
 epoch: 53, train_loss: 0.9833, test_loss: 1.0753, test_f1: 0.4572
 epoch: 54, train_loss: 0.9939, test_loss: 1.0769, test_f1: 0.4636
 epoch: 55, train_loss: 0.9877, test_loss: 1.0724, test_f1: 0.4674
 epoch: 56, train_loss: 0.9838, test_loss: 1.0707, test_f1: 0.4553
 epoch: 57, train_loss: 0.9870, test_loss: 1.0672, test_f1: 0.4592
 epoch: 58, train_loss: 0.9752, test_loss: 1.0628, test_f1: 0.4622
 epoch: 59, train_loss: 0.9676, test_loss: 1.0613, test_f1: 0.4514
 epoch: 60, train_loss: 0.9852, test_loss: 1.0608, test_f1: 0.4531
 epoch: 61, train_loss: 0.9859, test_loss: 1.0613, test_f1: 0.4579
 epoch: 62, train_loss: 0.9739, test_loss: 1.0613, test_f1: 0.4569
 epoch: 63, train_loss: 0.9817, test_loss: 1.0664, test_f1: 0.4563
 epoch: 64, train_loss: 0.9746, test_loss: 1.0677, test_f1: 0.4551
 epoch: 65, train_loss: 0.9784, test_loss: 1.0591, test_f1: 0.4549
 epoch: 66, train_loss: 0.9807, test_loss: 1.0547, test_f1: 0.4534
 epoch: 67, train_loss: 0.9717, test_loss: 1.0537, test_f1: 0.4457
 epoch: 68, train_loss: 0.9686, test_loss: 1.0559, test_f1: 0.4591
 epoch: 69, train_loss: 0.9748, test_loss: 1.0624, test_f1: 0.4546
 epoch: 70, train_loss: 0.9716, test_loss: 1.0592, test_f1: 0.4529
 epoch: 71, train_loss: 0.9655, test_loss: 1.0622, test_f1: 0.4477
 epoch: 72, train_loss: 0.9662, test_loss: 1.0620, test_f1: 0.4567
 epoch: 73, train_loss: 0.9709, test_loss: 1.0570, test_f1: 0.4675
 epoch: 74, train_loss: 0.9765, test_loss: 1.0609, test_f1: 0.4752
 epoch: 75, train_loss: 0.9693, test_loss: 1.0632, test_f1: 0.4706
 epoch: 76, train_loss: 0.9688, test_loss: 1.0650, test_f1: 0.4671
 epoch: 77, train_loss: 0.9621, test_loss: 1.0540, test_f1: 0.4577
 epoch: 78, train_loss: 0.9718, test_loss: 1.0531, test_f1: 0.4602
 epoch: 79, train_loss: 0.9609, test_loss: 1.0511, test_f1: 0.4518
 epoch: 80, train_loss: 0.9630, test_loss: 1.0480, test_f1: 0.4504
 epoch: 81, train_loss: 0.9627, test_loss: 1.0447, test_f1: 0.4577
 epoch: 82, train_loss: 0.9548, test_loss: 1.0443, test_f1: 0.4593
 epoch: 83, train_loss: 0.9568, test_loss: 1.0555, test_f1: 0.4698
 epoch: 84, train_loss: 0.9631, test_loss: 1.0488, test_f1: 0.4587
 epoch: 85, train_loss: 0.9514, test_loss: 1.0515, test_f1: 0.4585
 epoch: 86, train_loss: 0.9567, test_loss: 1.0481, test_f1: 0.4562
 epoch: 87, train_loss: 0.9564, test_loss: 1.0490, test_f1: 0.4489
 epoch: 88, train_loss: 0.9551, test_loss: 1.0489, test_f1: 0.4550
 epoch: 89, train_loss: 0.9529, test_loss: 1.0507, test_f1: 0.4623
 epoch: 90, train_loss: 0.9640, test_loss: 1.0500, test_f1: 0.4516
 epoch: 91, train_loss: 0.9643, test_loss: 1.0441, test_f1: 0.4598
 epoch: 92, train_loss: 0.9564, test_loss: 1.0430, test_f1: 0.4583
 epoch: 93, train_loss: 0.9528, test_loss: 1.0443, test_f1: 0.4579
 epoch: 94, train_loss: 0.9538, test_loss: 1.0438, test_f1: 0.4532
 epoch: 95, train_loss: 0.9566, test_loss: 1.0494, test_f1: 0.4605
 epoch: 96, train_loss: 0.9573, test_loss: 1.0502, test_f1: 0.4544
 epoch: 97, train_loss: 0.9507, test_loss: 1.0490, test_f1: 0.4548
 epoch: 98, train_loss: 0.9560, test_loss: 1.0531, test_f1: 0.4589
 epoch: 99, train_loss: 0.9570, test_loss: 1.0449, test_f1: 0.4631
##################ITERATION #9 ****************************************
 epoch: 0, train_loss: 1.7957, test_loss: 1.4497, test_f1: 0.0737
 epoch: 1, train_loss: 1.4423, test_loss: 1.4037, test_f1: 0.2281
 epoch: 2, train_loss: 1.3698, test_loss: 1.3780, test_f1: 0.2281
 epoch: 3, train_loss: 1.3244, test_loss: 1.3531, test_f1: 0.2281
 epoch: 4, train_loss: 1.2754, test_loss: 1.3332, test_f1: 0.2281
 epoch: 5, train_loss: 1.2376, test_loss: 1.3141, test_f1: 0.2281
 epoch: 6, train_loss: 1.2082, test_loss: 1.2979, test_f1: 0.2343
 epoch: 7, train_loss: 1.1955, test_loss: 1.2657, test_f1: 0.2446
 epoch: 8, train_loss: 1.1762, test_loss: 1.2317, test_f1: 0.2585
 epoch: 9, train_loss: 1.1694, test_loss: 1.2112, test_f1: 0.3530
 epoch: 10, train_loss: 1.1419, test_loss: 1.2030, test_f1: 0.3814
 epoch: 11, train_loss: 1.1451, test_loss: 1.2004, test_f1: 0.3967
 epoch: 12, train_loss: 1.1185, test_loss: 1.1945, test_f1: 0.4006
 epoch: 13, train_loss: 1.1092, test_loss: 1.1966, test_f1: 0.3995
 epoch: 14, train_loss: 1.1169, test_loss: 1.1902, test_f1: 0.3919
 epoch: 15, train_loss: 1.1010, test_loss: 1.1824, test_f1: 0.3961
 epoch: 16, train_loss: 1.1025, test_loss: 1.1797, test_f1: 0.3853
 epoch: 17, train_loss: 1.0885, test_loss: 1.1778, test_f1: 0.3994
 epoch: 18, train_loss: 1.0972, test_loss: 1.1987, test_f1: 0.3950
 epoch: 19, train_loss: 1.0789, test_loss: 1.2167, test_f1: 0.3898
 epoch: 20, train_loss: 1.0743, test_loss: 1.1988, test_f1: 0.4137
 epoch: 21, train_loss: 1.0611, test_loss: 1.1805, test_f1: 0.4156
 epoch: 22, train_loss: 1.0626, test_loss: 1.1782, test_f1: 0.4293
 epoch: 23, train_loss: 1.0458, test_loss: 1.1530, test_f1: 0.4227
 epoch: 24, train_loss: 1.0582, test_loss: 1.1508, test_f1: 0.4074
 epoch: 25, train_loss: 1.0583, test_loss: 1.1510, test_f1: 0.4094
 epoch: 26, train_loss: 1.0521, test_loss: 1.1546, test_f1: 0.4200
 epoch: 27, train_loss: 1.0482, test_loss: 1.1692, test_f1: 0.4456
 epoch: 28, train_loss: 1.0367, test_loss: 1.1613, test_f1: 0.4409
 epoch: 29, train_loss: 1.0368, test_loss: 1.1561, test_f1: 0.4392
 epoch: 30, train_loss: 1.0413, test_loss: 1.1590, test_f1: 0.4207
 epoch: 31, train_loss: 1.0266, test_loss: 1.1488, test_f1: 0.4353
 epoch: 32, train_loss: 1.0376, test_loss: 1.1703, test_f1: 0.4230
 epoch: 33, train_loss: 1.0162, test_loss: 1.1635, test_f1: 0.4266
 epoch: 34, train_loss: 1.0237, test_loss: 1.1367, test_f1: 0.4316
 epoch: 35, train_loss: 1.0284, test_loss: 1.1511, test_f1: 0.4432
 epoch: 36, train_loss: 1.0228, test_loss: 1.1542, test_f1: 0.4386
 epoch: 37, train_loss: 1.0107, test_loss: 1.1434, test_f1: 0.4317
 epoch: 38, train_loss: 1.0094, test_loss: 1.1342, test_f1: 0.4268
 epoch: 39, train_loss: 1.0162, test_loss: 1.1528, test_f1: 0.4350
 epoch: 40, train_loss: 1.0164, test_loss: 1.2108, test_f1: 0.4483
 epoch: 41, train_loss: 1.0070, test_loss: 1.1725, test_f1: 0.4210
 epoch: 42, train_loss: 1.0005, test_loss: 1.1608, test_f1: 0.4184
 epoch: 43, train_loss: 1.0044, test_loss: 1.1429, test_f1: 0.4233
 epoch: 44, train_loss: 1.0015, test_loss: 1.1497, test_f1: 0.4375
 epoch: 45, train_loss: 0.9947, test_loss: 1.1697, test_f1: 0.4396
 epoch: 46, train_loss: 0.9950, test_loss: 1.1658, test_f1: 0.4457
 epoch: 47, train_loss: 0.9967, test_loss: 1.1631, test_f1: 0.4280
 epoch: 48, train_loss: 1.0001, test_loss: 1.1495, test_f1: 0.4272
 epoch: 49, train_loss: 0.9950, test_loss: 1.1568, test_f1: 0.4426
 epoch: 50, train_loss: 0.9963, test_loss: 1.1541, test_f1: 0.4403
 epoch: 51, train_loss: 0.9830, test_loss: 1.1552, test_f1: 0.4404
 epoch: 52, train_loss: 0.9849, test_loss: 1.1545, test_f1: 0.4437
 epoch: 53, train_loss: 0.9899, test_loss: 1.1780, test_f1: 0.4410
 epoch: 54, train_loss: 0.9815, test_loss: 1.1750, test_f1: 0.4311
 epoch: 55, train_loss: 0.9762, test_loss: 1.1713, test_f1: 0.4386
 epoch: 56, train_loss: 0.9900, test_loss: 1.1605, test_f1: 0.4378
 epoch: 57, train_loss: 0.9847, test_loss: 1.1439, test_f1: 0.4341
 epoch: 58, train_loss: 0.9885, test_loss: 1.1673, test_f1: 0.4512
 epoch: 59, train_loss: 0.9885, test_loss: 1.1670, test_f1: 0.4524
 epoch: 60, train_loss: 0.9832, test_loss: 1.1524, test_f1: 0.4338
 epoch: 61, train_loss: 0.9686, test_loss: 1.1453, test_f1: 0.4315
 epoch: 62, train_loss: 0.9775, test_loss: 1.1784, test_f1: 0.4400
 epoch: 63, train_loss: 0.9722, test_loss: 1.1697, test_f1: 0.4401
 epoch: 64, train_loss: 0.9695, test_loss: 1.1595, test_f1: 0.4423
 epoch: 65, train_loss: 0.9623, test_loss: 1.1683, test_f1: 0.4435
 epoch: 66, train_loss: 0.9599, test_loss: 1.1850, test_f1: 0.4520
 epoch: 67, train_loss: 0.9722, test_loss: 1.1981, test_f1: 0.4474
 epoch: 68, train_loss: 0.9852, test_loss: 1.1718, test_f1: 0.4324
 epoch: 69, train_loss: 0.9601, test_loss: 1.1641, test_f1: 0.4500
 epoch: 70, train_loss: 0.9696, test_loss: 1.1799, test_f1: 0.4485
 epoch: 71, train_loss: 0.9689, test_loss: 1.1871, test_f1: 0.4465
 epoch: 72, train_loss: 0.9719, test_loss: 1.2014, test_f1: 0.4445
 epoch: 73, train_loss: 0.9705, test_loss: 1.1658, test_f1: 0.4478
 epoch: 74, train_loss: 0.9652, test_loss: 1.1431, test_f1: 0.4540
 epoch: 75, train_loss: 0.9687, test_loss: 1.1679, test_f1: 0.4539
 epoch: 76, train_loss: 0.9642, test_loss: 1.1894, test_f1: 0.4536
 epoch: 77, train_loss: 0.9486, test_loss: 1.1837, test_f1: 0.4492
 epoch: 78, train_loss: 0.9640, test_loss: 1.1811, test_f1: 0.4518
 epoch: 79, train_loss: 0.9635, test_loss: 1.1807, test_f1: 0.4506
 epoch: 80, train_loss: 0.9604, test_loss: 1.1467, test_f1: 0.4409
 epoch: 81, train_loss: 0.9630, test_loss: 1.1667, test_f1: 0.4493
 epoch: 82, train_loss: 0.9684, test_loss: 1.1710, test_f1: 0.4391
 epoch: 83, train_loss: 0.9624, test_loss: 1.1463, test_f1: 0.4319
 epoch: 84, train_loss: 0.9583, test_loss: 1.1558, test_f1: 0.4426
 epoch: 85, train_loss: 0.9567, test_loss: 1.1782, test_f1: 0.4427
 epoch: 86, train_loss: 0.9604, test_loss: 1.1845, test_f1: 0.4461
 epoch: 87, train_loss: 0.9528, test_loss: 1.1830, test_f1: 0.4524
 epoch: 88, train_loss: 0.9646, test_loss: 1.1892, test_f1: 0.4222
 epoch: 89, train_loss: 0.9623, test_loss: 1.1704, test_f1: 0.4491
 epoch: 90, train_loss: 0.9572, test_loss: 1.2005, test_f1: 0.4384
 epoch: 91, train_loss: 0.9593, test_loss: 1.1862, test_f1: 0.4450
 epoch: 92, train_loss: 0.9619, test_loss: 1.1672, test_f1: 0.4363
 epoch: 93, train_loss: 0.9527, test_loss: 1.1900, test_f1: 0.4526
 epoch: 94, train_loss: 0.9465, test_loss: 1.2339, test_f1: 0.4569
 epoch: 95, train_loss: 0.9624, test_loss: 1.1803, test_f1: 0.4418
 epoch: 96, train_loss: 0.9574, test_loss: 1.1764, test_f1: 0.4476
 epoch: 97, train_loss: 0.9396, test_loss: 1.1526, test_f1: 0.4504
 epoch: 98, train_loss: 0.9435, test_loss: 1.1635, test_f1: 0.4495
 epoch: 99, train_loss: 0.9520, test_loss: 1.1633, test_f1: 0.4503

Training completed in 280.21 seconds
Best F1: 0.4995 at epoch 96
Mean F1 across iterations: 0.4592  0.0253
========================FINAL RESULTS================================
FEGIN weighted F1: 0.4995  0.0253
python main.py --data ltspice_demos --representation component_net --model FEGIN --layers 2 --hiddens 16 --batch_size 256 --lr 0.001 --emb_size 250 --epochs 100 --save_appendix component_net_L2_H16_BS256_LR0.001_E250 --no_val
-----



STDERR:
  File "main.py", line 370, in <module>
    main()
  File "main.py", line 254, in main
    dataset = dataset_class(
  File "/home/philip/projects/ltspice_examples_code_repo/Circuit-Completion-Using-GNNs/component_classification_with_link_prediction_head/evaluation/FEGIN/kernel/circuit_datasets.py", line 15, in __init__
    self.data, self.slices = torch.load(self.processed_paths[0])
  File "/home/philip/.local/lib/python3.8/site-packages/torch/serialization.py", line 1040, in load
    warnings.warn(
  File "/usr/lib/python3.8/warnings.py", line 109, in _showwarnmsg
    sw(msg.message, msg.category, msg.filename, msg.lineno,
  File "main.py", line 47, in warn_with_traceback
    traceback.print_stack(file=log)
/home/philip/projects/ltspice_examples_code_repo/Circuit-Completion-Using-GNNs/component_classification_with_link_prediction_head/evaluation/FEGIN/kernel/circuit_datasets.py:15: FutureWarning: You are using `torch.load` with `weights_only=False` (the current default value), which uses the default pickle module implicitly. It is possible to construct malicious pickle data which will execute arbitrary code during unpickling (See https://github.com/pytorch/pytorch/blob/main/SECURITY.md#untrusted-models for more details). In a future release, the default value for `weights_only` will be flipped to `True`. This limits the functions that could be executed during unpickling. Arbitrary objects will no longer be allowed to be loaded via this mode unless they are explicitly allowlisted by the user via `torch.serialization.add_safe_globals`. We recommend you start setting `weights_only=True` for any use case where you don't have full control of the loaded file. Please open an issue on GitHub for any issues related to this experimental feature.
  self.data, self.slices = torch.load(self.processed_paths[0])
