STDOUT:
Results will be saved in /home/philip/projects/ltspice_examples_code_repo/Circuit-Completion-Using-GNNs/component_classification_with_link_prediction_head/evaluation/FEGIN/results/model_FEGIN_dataset_ltspice_demos
Command line input: python main.py --data ltspice_demos --representation component_net --model FEGIN --layers 4 --hiddens 64 --batch_size 256 --lr 0.0001 --emb_size 250 --epochs 100 --save_appendix component_net_L4_H64_BS256_LR0.0001_E250 --no_val
 is saved.
-----
ltspice_demos - FEGIN
Using 4 layers, 64 hidden units, h = 2
Loading component_net representation dataset
ENTERED
Training FEGIN on component_net representation
Train: 1565, Test: 383
##################ITERATION #0 ****************************************
 epoch: 0, train_loss: 1.3652, test_loss: 1.3699, test_f1: 0.2281
 epoch: 1, train_loss: 1.3586, test_loss: 1.3693, test_f1: 0.2281
 epoch: 2, train_loss: 1.3560, test_loss: 1.3682, test_f1: 0.2281
 epoch: 3, train_loss: 1.3533, test_loss: 1.3669, test_f1: 0.2281
 epoch: 4, train_loss: 1.3484, test_loss: 1.3650, test_f1: 0.2281
 epoch: 5, train_loss: 1.3440, test_loss: 1.3633, test_f1: 0.2281
 epoch: 6, train_loss: 1.3401, test_loss: 1.3613, test_f1: 0.2281
 epoch: 7, train_loss: 1.3368, test_loss: 1.3592, test_f1: 0.2281
 epoch: 8, train_loss: 1.3316, test_loss: 1.3566, test_f1: 0.2281
 epoch: 9, train_loss: 1.3261, test_loss: 1.3535, test_f1: 0.2281
 epoch: 10, train_loss: 1.3215, test_loss: 1.3500, test_f1: 0.2281
 epoch: 11, train_loss: 1.3149, test_loss: 1.3461, test_f1: 0.2274
 epoch: 12, train_loss: 1.3091, test_loss: 1.3424, test_f1: 0.2597
 epoch: 13, train_loss: 1.3018, test_loss: 1.3385, test_f1: 0.2583
 epoch: 14, train_loss: 1.2957, test_loss: 1.3339, test_f1: 0.2583
 epoch: 15, train_loss: 1.2900, test_loss: 1.3298, test_f1: 0.2585
 epoch: 16, train_loss: 1.2819, test_loss: 1.3258, test_f1: 0.2585
 epoch: 17, train_loss: 1.2772, test_loss: 1.3212, test_f1: 0.2585
 epoch: 18, train_loss: 1.2685, test_loss: 1.3164, test_f1: 0.2587
 epoch: 19, train_loss: 1.2595, test_loss: 1.3117, test_f1: 0.2765
 epoch: 20, train_loss: 1.2554, test_loss: 1.3068, test_f1: 0.2765
 epoch: 21, train_loss: 1.2467, test_loss: 1.3025, test_f1: 0.2765
 epoch: 22, train_loss: 1.2426, test_loss: 1.2964, test_f1: 0.2721
 epoch: 23, train_loss: 1.2326, test_loss: 1.2887, test_f1: 0.2721
 epoch: 24, train_loss: 1.2282, test_loss: 1.2831, test_f1: 0.2721
 epoch: 25, train_loss: 1.2183, test_loss: 1.2777, test_f1: 0.2763
 epoch: 26, train_loss: 1.2121, test_loss: 1.2707, test_f1: 0.2991
 epoch: 27, train_loss: 1.2049, test_loss: 1.2649, test_f1: 0.2991
 epoch: 28, train_loss: 1.1996, test_loss: 1.2594, test_f1: 0.3164
 epoch: 29, train_loss: 1.1932, test_loss: 1.2530, test_f1: 0.3164
 epoch: 30, train_loss: 1.1864, test_loss: 1.2470, test_f1: 0.3164
 epoch: 31, train_loss: 1.1853, test_loss: 1.2415, test_f1: 0.3201
 epoch: 32, train_loss: 1.1766, test_loss: 1.2371, test_f1: 0.3164
 epoch: 33, train_loss: 1.1728, test_loss: 1.2324, test_f1: 0.3237
 epoch: 34, train_loss: 1.1649, test_loss: 1.2285, test_f1: 0.3237
 epoch: 35, train_loss: 1.1591, test_loss: 1.2234, test_f1: 0.3237
 epoch: 36, train_loss: 1.1515, test_loss: 1.2191, test_f1: 0.3237
 epoch: 37, train_loss: 1.1517, test_loss: 1.2150, test_f1: 0.3237
 epoch: 38, train_loss: 1.1468, test_loss: 1.2110, test_f1: 0.3237
 epoch: 39, train_loss: 1.1416, test_loss: 1.2083, test_f1: 0.3237
 epoch: 40, train_loss: 1.1396, test_loss: 1.2062, test_f1: 0.3237
 epoch: 41, train_loss: 1.1410, test_loss: 1.2030, test_f1: 0.3237
 epoch: 42, train_loss: 1.1331, test_loss: 1.1983, test_f1: 0.3237
 epoch: 43, train_loss: 1.1321, test_loss: 1.1951, test_f1: 0.3201
 epoch: 44, train_loss: 1.1283, test_loss: 1.1913, test_f1: 0.3323
 epoch: 45, train_loss: 1.1228, test_loss: 1.1899, test_f1: 0.3489
 epoch: 46, train_loss: 1.1162, test_loss: 1.1876, test_f1: 0.3489
 epoch: 47, train_loss: 1.1162, test_loss: 1.1834, test_f1: 0.3237
 epoch: 48, train_loss: 1.1160, test_loss: 1.1814, test_f1: 0.3201
 epoch: 49, train_loss: 1.1158, test_loss: 1.1783, test_f1: 0.3489
 epoch: 50, train_loss: 1.1071, test_loss: 1.1748, test_f1: 0.3483
 epoch: 51, train_loss: 1.1044, test_loss: 1.1737, test_f1: 0.3527
 epoch: 52, train_loss: 1.1027, test_loss: 1.1710, test_f1: 0.3483
 epoch: 53, train_loss: 1.1051, test_loss: 1.1704, test_f1: 0.3527
 epoch: 54, train_loss: 1.0995, test_loss: 1.1711, test_f1: 0.3527
 epoch: 55, train_loss: 1.0981, test_loss: 1.1705, test_f1: 0.3496
 epoch: 56, train_loss: 1.0964, test_loss: 1.1694, test_f1: 0.3483
 epoch: 57, train_loss: 1.0980, test_loss: 1.1685, test_f1: 0.3489
 epoch: 58, train_loss: 1.1000, test_loss: 1.1672, test_f1: 0.3483
 epoch: 59, train_loss: 1.0948, test_loss: 1.1640, test_f1: 0.3515
 epoch: 60, train_loss: 1.0938, test_loss: 1.1641, test_f1: 0.3515
 epoch: 61, train_loss: 1.0958, test_loss: 1.1624, test_f1: 0.3515
 epoch: 62, train_loss: 1.0914, test_loss: 1.1624, test_f1: 0.3515
 epoch: 63, train_loss: 1.0909, test_loss: 1.1605, test_f1: 0.3515
 epoch: 64, train_loss: 1.0934, test_loss: 1.1608, test_f1: 0.3578
 epoch: 65, train_loss: 1.0904, test_loss: 1.1583, test_f1: 0.3515
 epoch: 66, train_loss: 1.0869, test_loss: 1.1572, test_f1: 0.3515
 epoch: 67, train_loss: 1.0847, test_loss: 1.1557, test_f1: 0.3534
 epoch: 68, train_loss: 1.0906, test_loss: 1.1538, test_f1: 0.3534
 epoch: 69, train_loss: 1.0895, test_loss: 1.1542, test_f1: 0.3541
 epoch: 70, train_loss: 1.0821, test_loss: 1.1530, test_f1: 0.3534
 epoch: 71, train_loss: 1.0819, test_loss: 1.1507, test_f1: 0.3534
 epoch: 72, train_loss: 1.0826, test_loss: 1.1504, test_f1: 0.3534
 epoch: 73, train_loss: 1.0779, test_loss: 1.1502, test_f1: 0.3534
 epoch: 74, train_loss: 1.0816, test_loss: 1.1501, test_f1: 0.3566
 epoch: 75, train_loss: 1.0808, test_loss: 1.1499, test_f1: 0.3566
 epoch: 76, train_loss: 1.0814, test_loss: 1.1495, test_f1: 0.3578
 epoch: 77, train_loss: 1.0763, test_loss: 1.1483, test_f1: 0.3566
 epoch: 78, train_loss: 1.0786, test_loss: 1.1440, test_f1: 0.3566
 epoch: 79, train_loss: 1.0748, test_loss: 1.1425, test_f1: 0.3566
 epoch: 80, train_loss: 1.0738, test_loss: 1.1429, test_f1: 0.3620
 epoch: 81, train_loss: 1.0692, test_loss: 1.1423, test_f1: 0.3620
 epoch: 82, train_loss: 1.0690, test_loss: 1.1420, test_f1: 0.3650
 epoch: 83, train_loss: 1.0690, test_loss: 1.1440, test_f1: 0.3662
 epoch: 84, train_loss: 1.0727, test_loss: 1.1437, test_f1: 0.3713
 epoch: 85, train_loss: 1.0700, test_loss: 1.1379, test_f1: 0.3699
 epoch: 86, train_loss: 1.0665, test_loss: 1.1359, test_f1: 0.3713
 epoch: 87, train_loss: 1.0691, test_loss: 1.1373, test_f1: 0.3793
 epoch: 88, train_loss: 1.0646, test_loss: 1.1369, test_f1: 0.3773
 epoch: 89, train_loss: 1.0683, test_loss: 1.1337, test_f1: 0.3848
 epoch: 90, train_loss: 1.0622, test_loss: 1.1312, test_f1: 0.3900
 epoch: 91, train_loss: 1.0608, test_loss: 1.1314, test_f1: 0.3843
 epoch: 92, train_loss: 1.0617, test_loss: 1.1327, test_f1: 0.3841
 epoch: 93, train_loss: 1.0586, test_loss: 1.1365, test_f1: 0.3890
 epoch: 94, train_loss: 1.0592, test_loss: 1.1342, test_f1: 0.3866
 epoch: 95, train_loss: 1.0564, test_loss: 1.1314, test_f1: 0.3944
 epoch: 96, train_loss: 1.0549, test_loss: 1.1284, test_f1: 0.4013
 epoch: 97, train_loss: 1.0555, test_loss: 1.1312, test_f1: 0.3993
 epoch: 98, train_loss: 1.0509, test_loss: 1.1276, test_f1: 0.4061
 epoch: 99, train_loss: 1.0507, test_loss: 1.1250, test_f1: 0.4065
##################ITERATION #1 ****************************************
 epoch: 0, train_loss: 1.3257, test_loss: 1.3529, test_f1: 0.2281
 epoch: 1, train_loss: 1.3128, test_loss: 1.3492, test_f1: 0.2281
 epoch: 2, train_loss: 1.3051, test_loss: 1.3440, test_f1: 0.2281
 epoch: 3, train_loss: 1.2983, test_loss: 1.3376, test_f1: 0.2281
 epoch: 4, train_loss: 1.2902, test_loss: 1.3328, test_f1: 0.2281
 epoch: 5, train_loss: 1.2831, test_loss: 1.3302, test_f1: 0.2281
 epoch: 6, train_loss: 1.2743, test_loss: 1.3280, test_f1: 0.2281
 epoch: 7, train_loss: 1.2666, test_loss: 1.3241, test_f1: 0.2281
 epoch: 8, train_loss: 1.2585, test_loss: 1.3168, test_f1: 0.2281
 epoch: 9, train_loss: 1.2505, test_loss: 1.3091, test_f1: 0.2281
 epoch: 10, train_loss: 1.2391, test_loss: 1.2984, test_f1: 0.2281
 epoch: 11, train_loss: 1.2305, test_loss: 1.2872, test_f1: 0.2281
 epoch: 12, train_loss: 1.2237, test_loss: 1.2775, test_f1: 0.2281
 epoch: 13, train_loss: 1.2158, test_loss: 1.2678, test_f1: 0.2281
 epoch: 14, train_loss: 1.2066, test_loss: 1.2583, test_f1: 0.2281
 epoch: 15, train_loss: 1.2010, test_loss: 1.2511, test_f1: 0.2248
 epoch: 16, train_loss: 1.1916, test_loss: 1.2442, test_f1: 0.2248
 epoch: 17, train_loss: 1.1872, test_loss: 1.2388, test_f1: 0.2248
 epoch: 18, train_loss: 1.1800, test_loss: 1.2330, test_f1: 0.2450
 epoch: 19, train_loss: 1.1723, test_loss: 1.2288, test_f1: 0.2450
 epoch: 20, train_loss: 1.1692, test_loss: 1.2232, test_f1: 0.2450
 epoch: 21, train_loss: 1.1643, test_loss: 1.2179, test_f1: 0.2644
 epoch: 22, train_loss: 1.1592, test_loss: 1.2132, test_f1: 0.2674
 epoch: 23, train_loss: 1.1518, test_loss: 1.2086, test_f1: 0.2674
 epoch: 24, train_loss: 1.1476, test_loss: 1.2057, test_f1: 0.2804
 epoch: 25, train_loss: 1.1404, test_loss: 1.2038, test_f1: 0.2762
 epoch: 26, train_loss: 1.1397, test_loss: 1.2004, test_f1: 0.2762
 epoch: 27, train_loss: 1.1383, test_loss: 1.1963, test_f1: 0.2762
 epoch: 28, train_loss: 1.1338, test_loss: 1.1929, test_f1: 0.2762
 epoch: 29, train_loss: 1.1299, test_loss: 1.1906, test_f1: 0.2762
 epoch: 30, train_loss: 1.1242, test_loss: 1.1890, test_f1: 0.2777
 epoch: 31, train_loss: 1.1222, test_loss: 1.1883, test_f1: 0.2777
 epoch: 32, train_loss: 1.1180, test_loss: 1.1871, test_f1: 0.2862
 epoch: 33, train_loss: 1.1136, test_loss: 1.1825, test_f1: 0.2945
 epoch: 34, train_loss: 1.1162, test_loss: 1.1810, test_f1: 0.3009
 epoch: 35, train_loss: 1.1047, test_loss: 1.1777, test_f1: 0.2992
 epoch: 36, train_loss: 1.1075, test_loss: 1.1756, test_f1: 0.2992
 epoch: 37, train_loss: 1.1026, test_loss: 1.1760, test_f1: 0.2976
 epoch: 38, train_loss: 1.1008, test_loss: 1.1788, test_f1: 0.3015
 epoch: 39, train_loss: 1.0954, test_loss: 1.1774, test_f1: 0.2981
 epoch: 40, train_loss: 1.0942, test_loss: 1.1729, test_f1: 0.3037
 epoch: 41, train_loss: 1.0918, test_loss: 1.1693, test_f1: 0.3070
 epoch: 42, train_loss: 1.0897, test_loss: 1.1700, test_f1: 0.3048
 epoch: 43, train_loss: 1.0912, test_loss: 1.1688, test_f1: 0.3031
 epoch: 44, train_loss: 1.0818, test_loss: 1.1674, test_f1: 0.3348
 epoch: 45, train_loss: 1.0783, test_loss: 1.1630, test_f1: 0.3402
 epoch: 46, train_loss: 1.0803, test_loss: 1.1660, test_f1: 0.3365
 epoch: 47, train_loss: 1.0771, test_loss: 1.1621, test_f1: 0.3417
 epoch: 48, train_loss: 1.0791, test_loss: 1.1665, test_f1: 0.3643
 epoch: 49, train_loss: 1.0747, test_loss: 1.1594, test_f1: 0.3688
 epoch: 50, train_loss: 1.0713, test_loss: 1.1585, test_f1: 0.3688
 epoch: 51, train_loss: 1.0722, test_loss: 1.1534, test_f1: 0.3688
 epoch: 52, train_loss: 1.0731, test_loss: 1.1549, test_f1: 0.3688
 epoch: 53, train_loss: 1.0727, test_loss: 1.1547, test_f1: 0.3688
 epoch: 54, train_loss: 1.0671, test_loss: 1.1513, test_f1: 0.3690
 epoch: 55, train_loss: 1.0622, test_loss: 1.1511, test_f1: 0.3732
 epoch: 56, train_loss: 1.0593, test_loss: 1.1456, test_f1: 0.3833
 epoch: 57, train_loss: 1.0621, test_loss: 1.1478, test_f1: 0.3870
 epoch: 58, train_loss: 1.0599, test_loss: 1.1500, test_f1: 0.3833
 epoch: 59, train_loss: 1.0597, test_loss: 1.1520, test_f1: 0.3833
 epoch: 60, train_loss: 1.0534, test_loss: 1.1504, test_f1: 0.3792
 epoch: 61, train_loss: 1.0523, test_loss: 1.1433, test_f1: 0.3864
 epoch: 62, train_loss: 1.0517, test_loss: 1.1398, test_f1: 0.3935
 epoch: 63, train_loss: 1.0521, test_loss: 1.1427, test_f1: 0.3998
 epoch: 64, train_loss: 1.0546, test_loss: 1.1381, test_f1: 0.4041
 epoch: 65, train_loss: 1.0518, test_loss: 1.1443, test_f1: 0.4010
 epoch: 66, train_loss: 1.0513, test_loss: 1.1472, test_f1: 0.4055
 epoch: 67, train_loss: 1.0460, test_loss: 1.1512, test_f1: 0.3974
 epoch: 68, train_loss: 1.0487, test_loss: 1.1426, test_f1: 0.4072
 epoch: 69, train_loss: 1.0471, test_loss: 1.1391, test_f1: 0.4075
 epoch: 70, train_loss: 1.0495, test_loss: 1.1449, test_f1: 0.4025
 epoch: 71, train_loss: 1.0413, test_loss: 1.1522, test_f1: 0.4023
 epoch: 72, train_loss: 1.0449, test_loss: 1.1421, test_f1: 0.4088
 epoch: 73, train_loss: 1.0472, test_loss: 1.1339, test_f1: 0.4054
 epoch: 74, train_loss: 1.0413, test_loss: 1.1295, test_f1: 0.4079
 epoch: 75, train_loss: 1.0432, test_loss: 1.1329, test_f1: 0.4075
 epoch: 76, train_loss: 1.0356, test_loss: 1.1351, test_f1: 0.4056
 epoch: 77, train_loss: 1.0337, test_loss: 1.1398, test_f1: 0.4104
 epoch: 78, train_loss: 1.0359, test_loss: 1.1422, test_f1: 0.4096
 epoch: 79, train_loss: 1.0342, test_loss: 1.1469, test_f1: 0.4102
 epoch: 80, train_loss: 1.0368, test_loss: 1.1380, test_f1: 0.4081
 epoch: 81, train_loss: 1.0304, test_loss: 1.1422, test_f1: 0.4141
 epoch: 82, train_loss: 1.0308, test_loss: 1.1439, test_f1: 0.4178
 epoch: 83, train_loss: 1.0275, test_loss: 1.1410, test_f1: 0.4260
 epoch: 84, train_loss: 1.0302, test_loss: 1.1410, test_f1: 0.4301
 epoch: 85, train_loss: 1.0311, test_loss: 1.1410, test_f1: 0.4261
 epoch: 86, train_loss: 1.0244, test_loss: 1.1445, test_f1: 0.4275
 epoch: 87, train_loss: 1.0217, test_loss: 1.1405, test_f1: 0.4268
 epoch: 88, train_loss: 1.0228, test_loss: 1.1399, test_f1: 0.4311
 epoch: 89, train_loss: 1.0273, test_loss: 1.1281, test_f1: 0.4282
 epoch: 90, train_loss: 1.0221, test_loss: 1.1224, test_f1: 0.4295
 epoch: 91, train_loss: 1.0231, test_loss: 1.1206, test_f1: 0.4277
 epoch: 92, train_loss: 1.0149, test_loss: 1.1293, test_f1: 0.4325
 epoch: 93, train_loss: 1.0177, test_loss: 1.1368, test_f1: 0.4335
 epoch: 94, train_loss: 1.0113, test_loss: 1.1367, test_f1: 0.4300
 epoch: 95, train_loss: 1.0151, test_loss: 1.1307, test_f1: 0.4322
 epoch: 96, train_loss: 1.0113, test_loss: 1.1423, test_f1: 0.4311
 epoch: 97, train_loss: 1.0076, test_loss: 1.1389, test_f1: 0.4257
 epoch: 98, train_loss: 1.0103, test_loss: 1.1222, test_f1: 0.4327
 epoch: 99, train_loss: 1.0108, test_loss: 1.1161, test_f1: 0.4315
##################ITERATION #2 ****************************************
 epoch: 0, train_loss: 1.3044, test_loss: 1.3521, test_f1: 0.2281
 epoch: 1, train_loss: 1.2854, test_loss: 1.3518, test_f1: 0.2281
 epoch: 2, train_loss: 1.2766, test_loss: 1.3501, test_f1: 0.2281
 epoch: 3, train_loss: 1.2639, test_loss: 1.3464, test_f1: 0.2281
 epoch: 4, train_loss: 1.2551, test_loss: 1.3399, test_f1: 0.2281
 epoch: 5, train_loss: 1.2425, test_loss: 1.3295, test_f1: 0.2281
 epoch: 6, train_loss: 1.2349, test_loss: 1.3186, test_f1: 0.2281
 epoch: 7, train_loss: 1.2200, test_loss: 1.3085, test_f1: 0.2281
 epoch: 8, train_loss: 1.2159, test_loss: 1.2971, test_f1: 0.2281
 epoch: 9, train_loss: 1.2108, test_loss: 1.2835, test_f1: 0.2281
 epoch: 10, train_loss: 1.2008, test_loss: 1.2724, test_f1: 0.2281
 epoch: 11, train_loss: 1.1944, test_loss: 1.2622, test_f1: 0.2281
 epoch: 12, train_loss: 1.1847, test_loss: 1.2512, test_f1: 0.2281
 epoch: 13, train_loss: 1.1792, test_loss: 1.2402, test_f1: 0.2281
 epoch: 14, train_loss: 1.1745, test_loss: 1.2308, test_f1: 0.2281
 epoch: 15, train_loss: 1.1677, test_loss: 1.2242, test_f1: 0.2281
 epoch: 16, train_loss: 1.1625, test_loss: 1.2173, test_f1: 0.2281
 epoch: 17, train_loss: 1.1548, test_loss: 1.2144, test_f1: 0.2281
 epoch: 18, train_loss: 1.1543, test_loss: 1.2058, test_f1: 0.2281
 epoch: 19, train_loss: 1.1502, test_loss: 1.2010, test_f1: 0.2281
 epoch: 20, train_loss: 1.1471, test_loss: 1.1956, test_f1: 0.2270
 epoch: 21, train_loss: 1.1371, test_loss: 1.1924, test_f1: 0.2487
 epoch: 22, train_loss: 1.1362, test_loss: 1.1901, test_f1: 0.2539
 epoch: 23, train_loss: 1.1303, test_loss: 1.1863, test_f1: 0.2527
 epoch: 24, train_loss: 1.1240, test_loss: 1.1824, test_f1: 0.2869
 epoch: 25, train_loss: 1.1224, test_loss: 1.1781, test_f1: 0.2958
 epoch: 26, train_loss: 1.1181, test_loss: 1.1751, test_f1: 0.3002
 epoch: 27, train_loss: 1.1103, test_loss: 1.1744, test_f1: 0.2958
 epoch: 28, train_loss: 1.1152, test_loss: 1.1727, test_f1: 0.3002
 epoch: 29, train_loss: 1.1085, test_loss: 1.1685, test_f1: 0.3057
 epoch: 30, train_loss: 1.1044, test_loss: 1.1655, test_f1: 0.3057
 epoch: 31, train_loss: 1.1026, test_loss: 1.1613, test_f1: 0.3100
 epoch: 32, train_loss: 1.0981, test_loss: 1.1601, test_f1: 0.3100
 epoch: 33, train_loss: 1.0994, test_loss: 1.1582, test_f1: 0.3163
 epoch: 34, train_loss: 1.0952, test_loss: 1.1527, test_f1: 0.3215
 epoch: 35, train_loss: 1.0929, test_loss: 1.1504, test_f1: 0.3215
 epoch: 36, train_loss: 1.0878, test_loss: 1.1451, test_f1: 0.3215
 epoch: 37, train_loss: 1.0877, test_loss: 1.1392, test_f1: 0.3297
 epoch: 38, train_loss: 1.0808, test_loss: 1.1362, test_f1: 0.3475
 epoch: 39, train_loss: 1.0766, test_loss: 1.1349, test_f1: 0.3559
 epoch: 40, train_loss: 1.0747, test_loss: 1.1354, test_f1: 0.3638
 epoch: 41, train_loss: 1.0757, test_loss: 1.1379, test_f1: 0.3635
 epoch: 42, train_loss: 1.0727, test_loss: 1.1385, test_f1: 0.3635
 epoch: 43, train_loss: 1.0674, test_loss: 1.1360, test_f1: 0.3829
 epoch: 44, train_loss: 1.0682, test_loss: 1.1350, test_f1: 0.3887
 epoch: 45, train_loss: 1.0612, test_loss: 1.1355, test_f1: 0.3941
 epoch: 46, train_loss: 1.0559, test_loss: 1.1326, test_f1: 0.3855
 epoch: 47, train_loss: 1.0548, test_loss: 1.1310, test_f1: 0.3847
 epoch: 48, train_loss: 1.0568, test_loss: 1.1302, test_f1: 0.3789
 epoch: 49, train_loss: 1.0538, test_loss: 1.1234, test_f1: 0.3839
 epoch: 50, train_loss: 1.0550, test_loss: 1.1233, test_f1: 0.3878
 epoch: 51, train_loss: 1.0472, test_loss: 1.1184, test_f1: 0.3893
 epoch: 52, train_loss: 1.0432, test_loss: 1.1194, test_f1: 0.3896
 epoch: 53, train_loss: 1.0436, test_loss: 1.1228, test_f1: 0.3984
 epoch: 54, train_loss: 1.0326, test_loss: 1.1176, test_f1: 0.3967
 epoch: 55, train_loss: 1.0422, test_loss: 1.1130, test_f1: 0.3967
 epoch: 56, train_loss: 1.0380, test_loss: 1.1159, test_f1: 0.4081
 epoch: 57, train_loss: 1.0340, test_loss: 1.1137, test_f1: 0.4053
 epoch: 58, train_loss: 1.0389, test_loss: 1.1123, test_f1: 0.4032
 epoch: 59, train_loss: 1.0314, test_loss: 1.1106, test_f1: 0.4248
 epoch: 60, train_loss: 1.0379, test_loss: 1.1106, test_f1: 0.4267
 epoch: 61, train_loss: 1.0285, test_loss: 1.1087, test_f1: 0.4228
 epoch: 62, train_loss: 1.0268, test_loss: 1.1061, test_f1: 0.4223
 epoch: 63, train_loss: 1.0264, test_loss: 1.1007, test_f1: 0.4238
 epoch: 64, train_loss: 1.0279, test_loss: 1.1009, test_f1: 0.4254
 epoch: 65, train_loss: 1.0177, test_loss: 1.1045, test_f1: 0.4295
 epoch: 66, train_loss: 1.0255, test_loss: 1.1068, test_f1: 0.4263
 epoch: 67, train_loss: 1.0169, test_loss: 1.0991, test_f1: 0.4292
 epoch: 68, train_loss: 1.0212, test_loss: 1.0912, test_f1: 0.4262
 epoch: 69, train_loss: 1.0184, test_loss: 1.0943, test_f1: 0.4313
 epoch: 70, train_loss: 1.0178, test_loss: 1.0932, test_f1: 0.4260
 epoch: 71, train_loss: 1.0124, test_loss: 1.0952, test_f1: 0.4299
 epoch: 72, train_loss: 1.0230, test_loss: 1.0993, test_f1: 0.4299
 epoch: 73, train_loss: 1.0091, test_loss: 1.0988, test_f1: 0.4270
 epoch: 74, train_loss: 1.0101, test_loss: 1.1005, test_f1: 0.4276
 epoch: 75, train_loss: 1.0142, test_loss: 1.1079, test_f1: 0.4296
 epoch: 76, train_loss: 1.0074, test_loss: 1.0985, test_f1: 0.4296
 epoch: 77, train_loss: 1.0067, test_loss: 1.0962, test_f1: 0.4296
 epoch: 78, train_loss: 1.0109, test_loss: 1.0847, test_f1: 0.4317
 epoch: 79, train_loss: 1.0018, test_loss: 1.0836, test_f1: 0.4317
 epoch: 80, train_loss: 1.0019, test_loss: 1.0815, test_f1: 0.4270
 epoch: 81, train_loss: 1.0030, test_loss: 1.0888, test_f1: 0.4285
 epoch: 82, train_loss: 1.0005, test_loss: 1.0902, test_f1: 0.4255
 epoch: 83, train_loss: 0.9940, test_loss: 1.1049, test_f1: 0.4244
 epoch: 84, train_loss: 0.9953, test_loss: 1.0999, test_f1: 0.4263
 epoch: 85, train_loss: 0.9891, test_loss: 1.0958, test_f1: 0.4302
 epoch: 86, train_loss: 0.9964, test_loss: 1.0869, test_f1: 0.4299
 epoch: 87, train_loss: 0.9894, test_loss: 1.0835, test_f1: 0.4304
 epoch: 88, train_loss: 0.9912, test_loss: 1.0774, test_f1: 0.4258
 epoch: 89, train_loss: 0.9865, test_loss: 1.0865, test_f1: 0.4274
 epoch: 90, train_loss: 0.9880, test_loss: 1.0901, test_f1: 0.4295
 epoch: 91, train_loss: 0.9792, test_loss: 1.1041, test_f1: 0.4295
 epoch: 92, train_loss: 0.9765, test_loss: 1.1002, test_f1: 0.4295
 epoch: 93, train_loss: 0.9831, test_loss: 1.0900, test_f1: 0.4294
 epoch: 94, train_loss: 0.9814, test_loss: 1.0878, test_f1: 0.4250
 epoch: 95, train_loss: 0.9752, test_loss: 1.0894, test_f1: 0.4250
 epoch: 96, train_loss: 0.9785, test_loss: 1.0820, test_f1: 0.4270
 epoch: 97, train_loss: 0.9733, test_loss: 1.0763, test_f1: 0.4259
 epoch: 98, train_loss: 0.9681, test_loss: 1.0773, test_f1: 0.4292
 epoch: 99, train_loss: 0.9656, test_loss: 1.0808, test_f1: 0.4315
##################ITERATION #3 ****************************************
 epoch: 0, train_loss: 1.2765, test_loss: 1.3459, test_f1: 0.2281
 epoch: 1, train_loss: 1.2530, test_loss: 1.3398, test_f1: 0.2281
 epoch: 2, train_loss: 1.2419, test_loss: 1.3327, test_f1: 0.2281
 epoch: 3, train_loss: 1.2323, test_loss: 1.3246, test_f1: 0.2281
 epoch: 4, train_loss: 1.2230, test_loss: 1.3167, test_f1: 0.2281
 epoch: 5, train_loss: 1.2109, test_loss: 1.3098, test_f1: 0.2281
 epoch: 6, train_loss: 1.2030, test_loss: 1.3016, test_f1: 0.2281
 epoch: 7, train_loss: 1.1961, test_loss: 1.2945, test_f1: 0.2281
 epoch: 8, train_loss: 1.1899, test_loss: 1.2842, test_f1: 0.2281
 epoch: 9, train_loss: 1.1803, test_loss: 1.2693, test_f1: 0.2281
 epoch: 10, train_loss: 1.1739, test_loss: 1.2573, test_f1: 0.2281
 epoch: 11, train_loss: 1.1674, test_loss: 1.2455, test_f1: 0.2281
 epoch: 12, train_loss: 1.1594, test_loss: 1.2362, test_f1: 0.2651
 epoch: 13, train_loss: 1.1557, test_loss: 1.2286, test_f1: 0.2610
 epoch: 14, train_loss: 1.1476, test_loss: 1.2208, test_f1: 0.2599
 epoch: 15, train_loss: 1.1452, test_loss: 1.2155, test_f1: 0.2587
 epoch: 16, train_loss: 1.1377, test_loss: 1.2103, test_f1: 0.2642
 epoch: 17, train_loss: 1.1368, test_loss: 1.2064, test_f1: 0.2688
 epoch: 18, train_loss: 1.1311, test_loss: 1.2033, test_f1: 0.2926
 epoch: 19, train_loss: 1.1255, test_loss: 1.1982, test_f1: 0.3301
 epoch: 20, train_loss: 1.1195, test_loss: 1.1944, test_f1: 0.3549
 epoch: 21, train_loss: 1.1173, test_loss: 1.1902, test_f1: 0.3914
 epoch: 22, train_loss: 1.1134, test_loss: 1.1885, test_f1: 0.3929
 epoch: 23, train_loss: 1.1123, test_loss: 1.1871, test_f1: 0.3868
 epoch: 24, train_loss: 1.1055, test_loss: 1.1823, test_f1: 0.3898
 epoch: 25, train_loss: 1.1049, test_loss: 1.1795, test_f1: 0.3968
 epoch: 26, train_loss: 1.0992, test_loss: 1.1765, test_f1: 0.4004
 epoch: 27, train_loss: 1.0939, test_loss: 1.1756, test_f1: 0.3964
 epoch: 28, train_loss: 1.0915, test_loss: 1.1757, test_f1: 0.3973
 epoch: 29, train_loss: 1.0848, test_loss: 1.1701, test_f1: 0.4156
 epoch: 30, train_loss: 1.0793, test_loss: 1.1679, test_f1: 0.4155
 epoch: 31, train_loss: 1.0823, test_loss: 1.1673, test_f1: 0.4301
 epoch: 32, train_loss: 1.0765, test_loss: 1.1616, test_f1: 0.4316
 epoch: 33, train_loss: 1.0730, test_loss: 1.1629, test_f1: 0.4348
 epoch: 34, train_loss: 1.0691, test_loss: 1.1562, test_f1: 0.4342
 epoch: 35, train_loss: 1.0660, test_loss: 1.1583, test_f1: 0.4342
 epoch: 36, train_loss: 1.0657, test_loss: 1.1573, test_f1: 0.4231
 epoch: 37, train_loss: 1.0616, test_loss: 1.1544, test_f1: 0.4277
 epoch: 38, train_loss: 1.0512, test_loss: 1.1482, test_f1: 0.4351
 epoch: 39, train_loss: 1.0549, test_loss: 1.1469, test_f1: 0.4397
 epoch: 40, train_loss: 1.0463, test_loss: 1.1511, test_f1: 0.4356
 epoch: 41, train_loss: 1.0492, test_loss: 1.1515, test_f1: 0.4356
 epoch: 42, train_loss: 1.0483, test_loss: 1.1488, test_f1: 0.4270
 epoch: 43, train_loss: 1.0384, test_loss: 1.1462, test_f1: 0.4242
 epoch: 44, train_loss: 1.0331, test_loss: 1.1436, test_f1: 0.4242
 epoch: 45, train_loss: 1.0396, test_loss: 1.1458, test_f1: 0.4245
 epoch: 46, train_loss: 1.0327, test_loss: 1.1460, test_f1: 0.4307
 epoch: 47, train_loss: 1.0273, test_loss: 1.1461, test_f1: 0.4325
 epoch: 48, train_loss: 1.0224, test_loss: 1.1492, test_f1: 0.4378
 epoch: 49, train_loss: 1.0220, test_loss: 1.1486, test_f1: 0.4337
 epoch: 50, train_loss: 1.0161, test_loss: 1.1427, test_f1: 0.4296
 epoch: 51, train_loss: 1.0182, test_loss: 1.1403, test_f1: 0.4319
 epoch: 52, train_loss: 1.0078, test_loss: 1.1412, test_f1: 0.4335
 epoch: 53, train_loss: 1.0097, test_loss: 1.1454, test_f1: 0.4434
 epoch: 54, train_loss: 1.0148, test_loss: 1.1334, test_f1: 0.4372
 epoch: 55, train_loss: 1.0002, test_loss: 1.1277, test_f1: 0.4351
 epoch: 56, train_loss: 1.0059, test_loss: 1.1261, test_f1: 0.4320
 epoch: 57, train_loss: 1.0021, test_loss: 1.1376, test_f1: 0.4348
 epoch: 58, train_loss: 1.0027, test_loss: 1.1329, test_f1: 0.4311
 epoch: 59, train_loss: 1.0000, test_loss: 1.1312, test_f1: 0.4279
 epoch: 60, train_loss: 0.9980, test_loss: 1.1334, test_f1: 0.4320
 epoch: 61, train_loss: 0.9913, test_loss: 1.1353, test_f1: 0.4377
 epoch: 62, train_loss: 0.9978, test_loss: 1.1412, test_f1: 0.4405
 epoch: 63, train_loss: 0.9963, test_loss: 1.1353, test_f1: 0.4454
 epoch: 64, train_loss: 0.9855, test_loss: 1.1396, test_f1: 0.4455
 epoch: 65, train_loss: 0.9932, test_loss: 1.1327, test_f1: 0.4457
 epoch: 66, train_loss: 0.9934, test_loss: 1.1352, test_f1: 0.4455
 epoch: 67, train_loss: 0.9888, test_loss: 1.1306, test_f1: 0.4454
 epoch: 68, train_loss: 0.9872, test_loss: 1.1371, test_f1: 0.4499
 epoch: 69, train_loss: 0.9909, test_loss: 1.1321, test_f1: 0.4440
 epoch: 70, train_loss: 0.9859, test_loss: 1.1292, test_f1: 0.4447
 epoch: 71, train_loss: 0.9869, test_loss: 1.1232, test_f1: 0.4427
 epoch: 72, train_loss: 0.9820, test_loss: 1.1210, test_f1: 0.4436
 epoch: 73, train_loss: 0.9743, test_loss: 1.1261, test_f1: 0.4463
 epoch: 74, train_loss: 0.9800, test_loss: 1.1265, test_f1: 0.4484
 epoch: 75, train_loss: 0.9872, test_loss: 1.1339, test_f1: 0.4465
 epoch: 76, train_loss: 0.9807, test_loss: 1.1403, test_f1: 0.4485
 epoch: 77, train_loss: 0.9812, test_loss: 1.1285, test_f1: 0.4485
 epoch: 78, train_loss: 0.9781, test_loss: 1.1262, test_f1: 0.4436
 epoch: 79, train_loss: 0.9783, test_loss: 1.1194, test_f1: 0.4501
 epoch: 80, train_loss: 0.9699, test_loss: 1.1294, test_f1: 0.4499
 epoch: 81, train_loss: 0.9645, test_loss: 1.1271, test_f1: 0.4419
 epoch: 82, train_loss: 0.9767, test_loss: 1.1414, test_f1: 0.4478
 epoch: 83, train_loss: 0.9641, test_loss: 1.1327, test_f1: 0.4449
 epoch: 84, train_loss: 0.9659, test_loss: 1.1266, test_f1: 0.4477
 epoch: 85, train_loss: 0.9636, test_loss: 1.1283, test_f1: 0.4506
 epoch: 86, train_loss: 0.9632, test_loss: 1.1236, test_f1: 0.4506
 epoch: 87, train_loss: 0.9538, test_loss: 1.1293, test_f1: 0.4484
 epoch: 88, train_loss: 0.9613, test_loss: 1.1349, test_f1: 0.4484
 epoch: 89, train_loss: 0.9599, test_loss: 1.1376, test_f1: 0.4507
 epoch: 90, train_loss: 0.9534, test_loss: 1.1293, test_f1: 0.4508
 epoch: 91, train_loss: 0.9543, test_loss: 1.1286, test_f1: 0.4553
 epoch: 92, train_loss: 0.9524, test_loss: 1.1236, test_f1: 0.4553
 epoch: 93, train_loss: 0.9569, test_loss: 1.1173, test_f1: 0.4531
 epoch: 94, train_loss: 0.9447, test_loss: 1.1188, test_f1: 0.4530
 epoch: 95, train_loss: 0.9506, test_loss: 1.1254, test_f1: 0.4488
 epoch: 96, train_loss: 0.9435, test_loss: 1.1312, test_f1: 0.4487
 epoch: 97, train_loss: 0.9395, test_loss: 1.1312, test_f1: 0.4509
 epoch: 98, train_loss: 0.9500, test_loss: 1.1256, test_f1: 0.4531
 epoch: 99, train_loss: 0.9487, test_loss: 1.1238, test_f1: 0.4449
##################ITERATION #4 ****************************************
 epoch: 0, train_loss: 1.2897, test_loss: 1.3600, test_f1: 0.2281
 epoch: 1, train_loss: 1.2523, test_loss: 1.3507, test_f1: 0.2281
 epoch: 2, train_loss: 1.2383, test_loss: 1.3352, test_f1: 0.2281
 epoch: 3, train_loss: 1.2231, test_loss: 1.3174, test_f1: 0.2281
 epoch: 4, train_loss: 1.2074, test_loss: 1.3018, test_f1: 0.2281
 epoch: 5, train_loss: 1.1957, test_loss: 1.2932, test_f1: 0.2281
 epoch: 6, train_loss: 1.1878, test_loss: 1.2876, test_f1: 0.2281
 epoch: 7, train_loss: 1.1808, test_loss: 1.2779, test_f1: 0.2336
 epoch: 8, train_loss: 1.1685, test_loss: 1.2689, test_f1: 0.2434
 epoch: 9, train_loss: 1.1645, test_loss: 1.2564, test_f1: 0.2742
 epoch: 10, train_loss: 1.1542, test_loss: 1.2390, test_f1: 0.2575
 epoch: 11, train_loss: 1.1492, test_loss: 1.2234, test_f1: 0.2792
 epoch: 12, train_loss: 1.1407, test_loss: 1.2145, test_f1: 0.2876
 epoch: 13, train_loss: 1.1361, test_loss: 1.2104, test_f1: 0.3387
 epoch: 14, train_loss: 1.1300, test_loss: 1.2103, test_f1: 0.3482
 epoch: 15, train_loss: 1.1268, test_loss: 1.2131, test_f1: 0.3481
 epoch: 16, train_loss: 1.1153, test_loss: 1.2235, test_f1: 0.3551
 epoch: 17, train_loss: 1.1115, test_loss: 1.2190, test_f1: 0.3893
 epoch: 18, train_loss: 1.1044, test_loss: 1.2300, test_f1: 0.3861
 epoch: 19, train_loss: 1.1010, test_loss: 1.2354, test_f1: 0.3875
 epoch: 20, train_loss: 1.0968, test_loss: 1.2310, test_f1: 0.3939
 epoch: 21, train_loss: 1.0974, test_loss: 1.2388, test_f1: 0.3828
 epoch: 22, train_loss: 1.0844, test_loss: 1.2391, test_f1: 0.3946
 epoch: 23, train_loss: 1.0841, test_loss: 1.2223, test_f1: 0.3961
 epoch: 24, train_loss: 1.0750, test_loss: 1.2195, test_f1: 0.4106
 epoch: 25, train_loss: 1.0754, test_loss: 1.2061, test_f1: 0.4068
 epoch: 26, train_loss: 1.0668, test_loss: 1.2109, test_f1: 0.4151
 epoch: 27, train_loss: 1.0665, test_loss: 1.2218, test_f1: 0.4071
 epoch: 28, train_loss: 1.0696, test_loss: 1.2248, test_f1: 0.4183
 epoch: 29, train_loss: 1.0596, test_loss: 1.2144, test_f1: 0.4168
 epoch: 30, train_loss: 1.0591, test_loss: 1.2111, test_f1: 0.4280
 epoch: 31, train_loss: 1.0550, test_loss: 1.2126, test_f1: 0.4257
 epoch: 32, train_loss: 1.0545, test_loss: 1.2046, test_f1: 0.4275
 epoch: 33, train_loss: 1.0493, test_loss: 1.2073, test_f1: 0.4255
 epoch: 34, train_loss: 1.0432, test_loss: 1.2139, test_f1: 0.4279
 epoch: 35, train_loss: 1.0381, test_loss: 1.2154, test_f1: 0.4222
 epoch: 36, train_loss: 1.0307, test_loss: 1.2146, test_f1: 0.4214
 epoch: 37, train_loss: 1.0320, test_loss: 1.1989, test_f1: 0.4244
 epoch: 38, train_loss: 1.0347, test_loss: 1.1788, test_f1: 0.4344
 epoch: 39, train_loss: 1.0261, test_loss: 1.1739, test_f1: 0.4466
 epoch: 40, train_loss: 1.0238, test_loss: 1.1771, test_f1: 0.4407
 epoch: 41, train_loss: 1.0214, test_loss: 1.1730, test_f1: 0.4544
 epoch: 42, train_loss: 1.0121, test_loss: 1.1649, test_f1: 0.4593
 epoch: 43, train_loss: 1.0110, test_loss: 1.1758, test_f1: 0.4554
 epoch: 44, train_loss: 1.0099, test_loss: 1.1626, test_f1: 0.4654
 epoch: 45, train_loss: 1.0025, test_loss: 1.1749, test_f1: 0.4788
 epoch: 46, train_loss: 0.9994, test_loss: 1.1794, test_f1: 0.4773
 epoch: 47, train_loss: 0.9960, test_loss: 1.1859, test_f1: 0.4881
 epoch: 48, train_loss: 0.9973, test_loss: 1.1818, test_f1: 0.4847
 epoch: 49, train_loss: 0.9899, test_loss: 1.1821, test_f1: 0.4766
 epoch: 50, train_loss: 0.9865, test_loss: 1.1883, test_f1: 0.4751
 epoch: 51, train_loss: 0.9817, test_loss: 1.1809, test_f1: 0.4735
 epoch: 52, train_loss: 0.9826, test_loss: 1.1662, test_f1: 0.4878
 epoch: 53, train_loss: 0.9756, test_loss: 1.1758, test_f1: 0.4885
 epoch: 54, train_loss: 0.9846, test_loss: 1.1764, test_f1: 0.4860
 epoch: 55, train_loss: 0.9752, test_loss: 1.1716, test_f1: 0.4936
 epoch: 56, train_loss: 0.9772, test_loss: 1.1723, test_f1: 0.5030
 epoch: 57, train_loss: 0.9794, test_loss: 1.1667, test_f1: 0.4929
 epoch: 58, train_loss: 0.9757, test_loss: 1.1655, test_f1: 0.4859
 epoch: 59, train_loss: 0.9734, test_loss: 1.1722, test_f1: 0.4867
 epoch: 60, train_loss: 0.9705, test_loss: 1.1572, test_f1: 0.4925
 epoch: 61, train_loss: 0.9697, test_loss: 1.1445, test_f1: 0.4888
 epoch: 62, train_loss: 0.9727, test_loss: 1.1625, test_f1: 0.4888
 epoch: 63, train_loss: 0.9657, test_loss: 1.1672, test_f1: 0.4989
 epoch: 64, train_loss: 0.9610, test_loss: 1.1767, test_f1: 0.5135
 epoch: 65, train_loss: 0.9604, test_loss: 1.1649, test_f1: 0.4945
 epoch: 66, train_loss: 0.9617, test_loss: 1.1710, test_f1: 0.4931
 epoch: 67, train_loss: 0.9557, test_loss: 1.1679, test_f1: 0.5090
 epoch: 68, train_loss: 0.9590, test_loss: 1.1573, test_f1: 0.5069
 epoch: 69, train_loss: 0.9632, test_loss: 1.1601, test_f1: 0.5066
 epoch: 70, train_loss: 0.9468, test_loss: 1.1304, test_f1: 0.5237
 epoch: 71, train_loss: 0.9476, test_loss: 1.1350, test_f1: 0.5081
 epoch: 72, train_loss: 0.9446, test_loss: 1.1439, test_f1: 0.4977
 epoch: 73, train_loss: 0.9466, test_loss: 1.1341, test_f1: 0.5091
 epoch: 74, train_loss: 0.9511, test_loss: 1.1485, test_f1: 0.5105
 epoch: 75, train_loss: 0.9509, test_loss: 1.1573, test_f1: 0.4998
 epoch: 76, train_loss: 0.9459, test_loss: 1.1565, test_f1: 0.5047
 epoch: 77, train_loss: 0.9379, test_loss: 1.1575, test_f1: 0.5121
 epoch: 78, train_loss: 0.9357, test_loss: 1.1513, test_f1: 0.5080
 epoch: 79, train_loss: 0.9374, test_loss: 1.1589, test_f1: 0.5077
 epoch: 80, train_loss: 0.9363, test_loss: 1.1688, test_f1: 0.5183
 epoch: 81, train_loss: 0.9361, test_loss: 1.1534, test_f1: 0.5226
 epoch: 82, train_loss: 0.9343, test_loss: 1.1665, test_f1: 0.5156
 epoch: 83, train_loss: 0.9343, test_loss: 1.1578, test_f1: 0.5196
 epoch: 84, train_loss: 0.9328, test_loss: 1.1466, test_f1: 0.5134
 epoch: 85, train_loss: 0.9287, test_loss: 1.1485, test_f1: 0.5195
 epoch: 86, train_loss: 0.9264, test_loss: 1.1429, test_f1: 0.5206
 epoch: 87, train_loss: 0.9202, test_loss: 1.1475, test_f1: 0.5234
 epoch: 88, train_loss: 0.9279, test_loss: 1.1450, test_f1: 0.5282
 epoch: 89, train_loss: 0.9216, test_loss: 1.1407, test_f1: 0.5259
 epoch: 90, train_loss: 0.9164, test_loss: 1.1437, test_f1: 0.5192
 epoch: 91, train_loss: 0.9198, test_loss: 1.1460, test_f1: 0.5197
 epoch: 92, train_loss: 0.9200, test_loss: 1.1362, test_f1: 0.5279
 epoch: 93, train_loss: 0.9127, test_loss: 1.1271, test_f1: 0.5276
 epoch: 94, train_loss: 0.9199, test_loss: 1.1327, test_f1: 0.5216
 epoch: 95, train_loss: 0.9211, test_loss: 1.1350, test_f1: 0.5303
 epoch: 96, train_loss: 0.9145, test_loss: 1.1310, test_f1: 0.5309
 epoch: 97, train_loss: 0.9128, test_loss: 1.1417, test_f1: 0.5296
 epoch: 98, train_loss: 0.9141, test_loss: 1.1546, test_f1: 0.5378
 epoch: 99, train_loss: 0.9071, test_loss: 1.1696, test_f1: 0.5280
##################ITERATION #5 ****************************************
 epoch: 0, train_loss: 1.2655, test_loss: 1.3299, test_f1: 0.2281
 epoch: 1, train_loss: 1.2306, test_loss: 1.3172, test_f1: 0.2281
 epoch: 2, train_loss: 1.2203, test_loss: 1.3046, test_f1: 0.2281
 epoch: 3, train_loss: 1.2098, test_loss: 1.2964, test_f1: 0.2281
 epoch: 4, train_loss: 1.1997, test_loss: 1.2914, test_f1: 0.2281
 epoch: 5, train_loss: 1.1914, test_loss: 1.2908, test_f1: 0.2281
 epoch: 6, train_loss: 1.1829, test_loss: 1.2882, test_f1: 0.2281
 epoch: 7, train_loss: 1.1693, test_loss: 1.2773, test_f1: 0.2281
 epoch: 8, train_loss: 1.1642, test_loss: 1.2612, test_f1: 0.2281
 epoch: 9, train_loss: 1.1537, test_loss: 1.2457, test_f1: 0.2281
 epoch: 10, train_loss: 1.1495, test_loss: 1.2325, test_f1: 0.2555
 epoch: 11, train_loss: 1.1447, test_loss: 1.2208, test_f1: 0.2737
 epoch: 12, train_loss: 1.1346, test_loss: 1.2118, test_f1: 0.3207
 epoch: 13, train_loss: 1.1303, test_loss: 1.2062, test_f1: 0.3234
 epoch: 14, train_loss: 1.1287, test_loss: 1.1980, test_f1: 0.3321
 epoch: 15, train_loss: 1.1138, test_loss: 1.1971, test_f1: 0.3397
 epoch: 16, train_loss: 1.1147, test_loss: 1.1974, test_f1: 0.3471
 epoch: 17, train_loss: 1.1084, test_loss: 1.1926, test_f1: 0.3591
 epoch: 18, train_loss: 1.1042, test_loss: 1.1887, test_f1: 0.3621
 epoch: 19, train_loss: 1.0926, test_loss: 1.1943, test_f1: 0.3615
 epoch: 20, train_loss: 1.0925, test_loss: 1.1805, test_f1: 0.3768
 epoch: 21, train_loss: 1.0915, test_loss: 1.1772, test_f1: 0.3848
 epoch: 22, train_loss: 1.0808, test_loss: 1.1701, test_f1: 0.3902
 epoch: 23, train_loss: 1.0829, test_loss: 1.1622, test_f1: 0.3950
 epoch: 24, train_loss: 1.0737, test_loss: 1.1560, test_f1: 0.4036
 epoch: 25, train_loss: 1.0684, test_loss: 1.1548, test_f1: 0.4153
 epoch: 26, train_loss: 1.0689, test_loss: 1.1582, test_f1: 0.4083
 epoch: 27, train_loss: 1.0601, test_loss: 1.1685, test_f1: 0.4070
 epoch: 28, train_loss: 1.0655, test_loss: 1.1614, test_f1: 0.4117
 epoch: 29, train_loss: 1.0502, test_loss: 1.1605, test_f1: 0.4029
 epoch: 30, train_loss: 1.0478, test_loss: 1.1456, test_f1: 0.4044
 epoch: 31, train_loss: 1.0440, test_loss: 1.1542, test_f1: 0.4134
 epoch: 32, train_loss: 1.0415, test_loss: 1.1466, test_f1: 0.4184
 epoch: 33, train_loss: 1.0373, test_loss: 1.1601, test_f1: 0.4078
 epoch: 34, train_loss: 1.0374, test_loss: 1.1611, test_f1: 0.4286
 epoch: 35, train_loss: 1.0376, test_loss: 1.1487, test_f1: 0.4132
 epoch: 36, train_loss: 1.0297, test_loss: 1.1352, test_f1: 0.4017
 epoch: 37, train_loss: 1.0259, test_loss: 1.1324, test_f1: 0.4189
 epoch: 38, train_loss: 1.0141, test_loss: 1.1070, test_f1: 0.4261
 epoch: 39, train_loss: 1.0228, test_loss: 1.1055, test_f1: 0.4217
 epoch: 40, train_loss: 1.0182, test_loss: 1.1177, test_f1: 0.4144
 epoch: 41, train_loss: 1.0104, test_loss: 1.0969, test_f1: 0.4260
 epoch: 42, train_loss: 1.0161, test_loss: 1.1081, test_f1: 0.4271
 epoch: 43, train_loss: 1.0048, test_loss: 1.1334, test_f1: 0.4224
 epoch: 44, train_loss: 1.0013, test_loss: 1.1265, test_f1: 0.4260
 epoch: 45, train_loss: 0.9998, test_loss: 1.1324, test_f1: 0.4268
 epoch: 46, train_loss: 0.9955, test_loss: 1.1317, test_f1: 0.4246
 epoch: 47, train_loss: 0.9826, test_loss: 1.1356, test_f1: 0.4163
 epoch: 48, train_loss: 0.9934, test_loss: 1.1131, test_f1: 0.4215
 epoch: 49, train_loss: 0.9823, test_loss: 1.0995, test_f1: 0.4261
 epoch: 50, train_loss: 0.9802, test_loss: 1.0971, test_f1: 0.4195
 epoch: 51, train_loss: 0.9829, test_loss: 1.1021, test_f1: 0.4197
 epoch: 52, train_loss: 0.9775, test_loss: 1.1034, test_f1: 0.4271
 epoch: 53, train_loss: 0.9817, test_loss: 1.1092, test_f1: 0.4240
 epoch: 54, train_loss: 0.9786, test_loss: 1.1116, test_f1: 0.4158
 epoch: 55, train_loss: 0.9759, test_loss: 1.1128, test_f1: 0.4231
 epoch: 56, train_loss: 0.9764, test_loss: 1.1277, test_f1: 0.4278
 epoch: 57, train_loss: 0.9711, test_loss: 1.1295, test_f1: 0.4348
 epoch: 58, train_loss: 0.9710, test_loss: 1.1226, test_f1: 0.4330
 epoch: 59, train_loss: 0.9655, test_loss: 1.1336, test_f1: 0.4225
 epoch: 60, train_loss: 0.9645, test_loss: 1.1257, test_f1: 0.4348
 epoch: 61, train_loss: 0.9632, test_loss: 1.1115, test_f1: 0.4429
 epoch: 62, train_loss: 0.9631, test_loss: 1.1015, test_f1: 0.4384
 epoch: 63, train_loss: 0.9708, test_loss: 1.0963, test_f1: 0.4340
 epoch: 64, train_loss: 0.9548, test_loss: 1.1079, test_f1: 0.4281
 epoch: 65, train_loss: 0.9566, test_loss: 1.1178, test_f1: 0.4438
 epoch: 66, train_loss: 0.9548, test_loss: 1.1240, test_f1: 0.4312
 epoch: 67, train_loss: 0.9598, test_loss: 1.1429, test_f1: 0.4250
 epoch: 68, train_loss: 0.9533, test_loss: 1.0983, test_f1: 0.4193
 epoch: 69, train_loss: 0.9526, test_loss: 1.1008, test_f1: 0.4166
 epoch: 70, train_loss: 0.9523, test_loss: 1.1166, test_f1: 0.4166
 epoch: 71, train_loss: 0.9513, test_loss: 1.1164, test_f1: 0.4386
 epoch: 72, train_loss: 0.9545, test_loss: 1.1111, test_f1: 0.4401
 epoch: 73, train_loss: 0.9433, test_loss: 1.1064, test_f1: 0.4344
 epoch: 74, train_loss: 0.9463, test_loss: 1.1040, test_f1: 0.4289
 epoch: 75, train_loss: 0.9436, test_loss: 1.1117, test_f1: 0.4214
 epoch: 76, train_loss: 0.9476, test_loss: 1.1104, test_f1: 0.4267
 epoch: 77, train_loss: 0.9437, test_loss: 1.1178, test_f1: 0.4274
 epoch: 78, train_loss: 0.9402, test_loss: 1.1277, test_f1: 0.4244
 epoch: 79, train_loss: 0.9366, test_loss: 1.1322, test_f1: 0.4199
 epoch: 80, train_loss: 0.9370, test_loss: 1.1512, test_f1: 0.4253
 epoch: 81, train_loss: 0.9340, test_loss: 1.1422, test_f1: 0.4297
 epoch: 82, train_loss: 0.9348, test_loss: 1.1396, test_f1: 0.4368
 epoch: 83, train_loss: 0.9281, test_loss: 1.1352, test_f1: 0.4481
 epoch: 84, train_loss: 0.9368, test_loss: 1.1206, test_f1: 0.4439
 epoch: 85, train_loss: 0.9284, test_loss: 1.1053, test_f1: 0.4491
 epoch: 86, train_loss: 0.9247, test_loss: 1.1367, test_f1: 0.4532
 epoch: 87, train_loss: 0.9215, test_loss: 1.1476, test_f1: 0.4493
 epoch: 88, train_loss: 0.9315, test_loss: 1.1570, test_f1: 0.4701
 epoch: 89, train_loss: 0.9150, test_loss: 1.1371, test_f1: 0.4597
 epoch: 90, train_loss: 0.9250, test_loss: 1.1303, test_f1: 0.4616
 epoch: 91, train_loss: 0.9279, test_loss: 1.1408, test_f1: 0.4749
 epoch: 92, train_loss: 0.9299, test_loss: 1.1449, test_f1: 0.4586
 epoch: 93, train_loss: 0.9147, test_loss: 1.1357, test_f1: 0.4693
 epoch: 94, train_loss: 0.9211, test_loss: 1.1701, test_f1: 0.4771
 epoch: 95, train_loss: 0.9130, test_loss: 1.1557, test_f1: 0.4718
 epoch: 96, train_loss: 0.9099, test_loss: 1.1616, test_f1: 0.4995
 epoch: 97, train_loss: 0.9039, test_loss: 1.1703, test_f1: 0.4873
 epoch: 98, train_loss: 0.9082, test_loss: 1.1672, test_f1: 0.4761
 epoch: 99, train_loss: 0.9200, test_loss: 1.1824, test_f1: 0.4828
##################ITERATION #6 ****************************************
 epoch: 0, train_loss: 1.2956, test_loss: 1.3683, test_f1: 0.2281
 epoch: 1, train_loss: 1.2463, test_loss: 1.3656, test_f1: 0.2281
 epoch: 2, train_loss: 1.2217, test_loss: 1.3570, test_f1: 0.2281
 epoch: 3, train_loss: 1.2096, test_loss: 1.3487, test_f1: 0.2281
 epoch: 4, train_loss: 1.1911, test_loss: 1.3438, test_f1: 0.2336
 epoch: 5, train_loss: 1.1863, test_loss: 1.3335, test_f1: 0.2698
 epoch: 6, train_loss: 1.1692, test_loss: 1.3177, test_f1: 0.2865
 epoch: 7, train_loss: 1.1634, test_loss: 1.3017, test_f1: 0.2953
 epoch: 8, train_loss: 1.1465, test_loss: 1.2795, test_f1: 0.2914
 epoch: 9, train_loss: 1.1361, test_loss: 1.2585, test_f1: 0.2903
 epoch: 10, train_loss: 1.1341, test_loss: 1.2370, test_f1: 0.2924
 epoch: 11, train_loss: 1.1294, test_loss: 1.2145, test_f1: 0.3051
 epoch: 12, train_loss: 1.1189, test_loss: 1.2052, test_f1: 0.3038
 epoch: 13, train_loss: 1.1082, test_loss: 1.1886, test_f1: 0.3419
 epoch: 14, train_loss: 1.1065, test_loss: 1.1764, test_f1: 0.3573
 epoch: 15, train_loss: 1.1015, test_loss: 1.1655, test_f1: 0.3804
 epoch: 16, train_loss: 1.0949, test_loss: 1.1651, test_f1: 0.3729
 epoch: 17, train_loss: 1.0861, test_loss: 1.1561, test_f1: 0.3831
 epoch: 18, train_loss: 1.0861, test_loss: 1.1492, test_f1: 0.3914
 epoch: 19, train_loss: 1.0842, test_loss: 1.1442, test_f1: 0.4017
 epoch: 20, train_loss: 1.0697, test_loss: 1.1332, test_f1: 0.4022
 epoch: 21, train_loss: 1.0609, test_loss: 1.1323, test_f1: 0.4136
 epoch: 22, train_loss: 1.0608, test_loss: 1.1306, test_f1: 0.4134
 epoch: 23, train_loss: 1.0539, test_loss: 1.1265, test_f1: 0.4069
 epoch: 24, train_loss: 1.0492, test_loss: 1.1336, test_f1: 0.4197
 epoch: 25, train_loss: 1.0456, test_loss: 1.1231, test_f1: 0.4197
 epoch: 26, train_loss: 1.0380, test_loss: 1.1273, test_f1: 0.4214
 epoch: 27, train_loss: 1.0491, test_loss: 1.1187, test_f1: 0.4148
 epoch: 28, train_loss: 1.0363, test_loss: 1.1184, test_f1: 0.4289
 epoch: 29, train_loss: 1.0338, test_loss: 1.1214, test_f1: 0.4313
 epoch: 30, train_loss: 1.0350, test_loss: 1.1156, test_f1: 0.4264
 epoch: 31, train_loss: 1.0256, test_loss: 1.1160, test_f1: 0.4254
 epoch: 32, train_loss: 1.0236, test_loss: 1.1311, test_f1: 0.4358
 epoch: 33, train_loss: 1.0190, test_loss: 1.1306, test_f1: 0.4296
 epoch: 34, train_loss: 1.0190, test_loss: 1.1104, test_f1: 0.4115
 epoch: 35, train_loss: 1.0014, test_loss: 1.1003, test_f1: 0.4166
 epoch: 36, train_loss: 1.0099, test_loss: 1.1016, test_f1: 0.4364
 epoch: 37, train_loss: 1.0046, test_loss: 1.1023, test_f1: 0.4393
 epoch: 38, train_loss: 1.0011, test_loss: 1.1014, test_f1: 0.4238
 epoch: 39, train_loss: 0.9950, test_loss: 1.0965, test_f1: 0.4261
 epoch: 40, train_loss: 0.9932, test_loss: 1.0989, test_f1: 0.4260
 epoch: 41, train_loss: 0.9896, test_loss: 1.1036, test_f1: 0.4276
 epoch: 42, train_loss: 0.9859, test_loss: 1.0928, test_f1: 0.4379
 epoch: 43, train_loss: 0.9873, test_loss: 1.0922, test_f1: 0.4424
 epoch: 44, train_loss: 0.9780, test_loss: 1.0947, test_f1: 0.4485
 epoch: 45, train_loss: 0.9778, test_loss: 1.0910, test_f1: 0.4466
 epoch: 46, train_loss: 0.9745, test_loss: 1.1027, test_f1: 0.4425
 epoch: 47, train_loss: 0.9685, test_loss: 1.1009, test_f1: 0.4456
 epoch: 48, train_loss: 0.9650, test_loss: 1.0957, test_f1: 0.4540
 epoch: 49, train_loss: 0.9662, test_loss: 1.0909, test_f1: 0.4391
 epoch: 50, train_loss: 0.9621, test_loss: 1.1076, test_f1: 0.4371
 epoch: 51, train_loss: 0.9638, test_loss: 1.1034, test_f1: 0.4504
 epoch: 52, train_loss: 0.9538, test_loss: 1.0854, test_f1: 0.4601
 epoch: 53, train_loss: 0.9507, test_loss: 1.0789, test_f1: 0.4547
 epoch: 54, train_loss: 0.9610, test_loss: 1.0829, test_f1: 0.4787
 epoch: 55, train_loss: 0.9630, test_loss: 1.0895, test_f1: 0.4641
 epoch: 56, train_loss: 0.9567, test_loss: 1.0849, test_f1: 0.4700
 epoch: 57, train_loss: 0.9570, test_loss: 1.0887, test_f1: 0.4608
 epoch: 58, train_loss: 0.9479, test_loss: 1.0770, test_f1: 0.4688
 epoch: 59, train_loss: 0.9501, test_loss: 1.0775, test_f1: 0.4665
 epoch: 60, train_loss: 0.9479, test_loss: 1.0829, test_f1: 0.4757
 epoch: 61, train_loss: 0.9519, test_loss: 1.0843, test_f1: 0.4716
 epoch: 62, train_loss: 0.9410, test_loss: 1.0807, test_f1: 0.4738
 epoch: 63, train_loss: 0.9449, test_loss: 1.0864, test_f1: 0.4759
 epoch: 64, train_loss: 0.9423, test_loss: 1.0964, test_f1: 0.4700
 epoch: 65, train_loss: 0.9339, test_loss: 1.0865, test_f1: 0.4669
 epoch: 66, train_loss: 0.9347, test_loss: 1.0857, test_f1: 0.4819
 epoch: 67, train_loss: 0.9384, test_loss: 1.0822, test_f1: 0.4778
 epoch: 68, train_loss: 0.9397, test_loss: 1.0874, test_f1: 0.4760
 epoch: 69, train_loss: 0.9289, test_loss: 1.0909, test_f1: 0.4779
 epoch: 70, train_loss: 0.9306, test_loss: 1.0847, test_f1: 0.4891
 epoch: 71, train_loss: 0.9356, test_loss: 1.0713, test_f1: 0.4875
 epoch: 72, train_loss: 0.9279, test_loss: 1.0751, test_f1: 0.4894
 epoch: 73, train_loss: 0.9438, test_loss: 1.0713, test_f1: 0.4961
 epoch: 74, train_loss: 0.9327, test_loss: 1.0718, test_f1: 0.4969
 epoch: 75, train_loss: 0.9294, test_loss: 1.0711, test_f1: 0.5026
 epoch: 76, train_loss: 0.9275, test_loss: 1.0804, test_f1: 0.4827
 epoch: 77, train_loss: 0.9223, test_loss: 1.0794, test_f1: 0.4901
 epoch: 78, train_loss: 0.9270, test_loss: 1.0764, test_f1: 0.4986
 epoch: 79, train_loss: 0.9227, test_loss: 1.0765, test_f1: 0.4974
 epoch: 80, train_loss: 0.9278, test_loss: 1.0795, test_f1: 0.4879
 epoch: 81, train_loss: 0.9192, test_loss: 1.0834, test_f1: 0.4937
 epoch: 82, train_loss: 0.9226, test_loss: 1.0880, test_f1: 0.4892
 epoch: 83, train_loss: 0.9294, test_loss: 1.0840, test_f1: 0.5025
 epoch: 84, train_loss: 0.9104, test_loss: 1.0841, test_f1: 0.4965
 epoch: 85, train_loss: 0.9072, test_loss: 1.0849, test_f1: 0.4923
 epoch: 86, train_loss: 0.9207, test_loss: 1.0818, test_f1: 0.5104
 epoch: 87, train_loss: 0.9077, test_loss: 1.0800, test_f1: 0.5050
 epoch: 88, train_loss: 0.9140, test_loss: 1.0811, test_f1: 0.5075
 epoch: 89, train_loss: 0.9273, test_loss: 1.0793, test_f1: 0.5118
 epoch: 90, train_loss: 0.9084, test_loss: 1.0860, test_f1: 0.5093
 epoch: 91, train_loss: 0.9135, test_loss: 1.0877, test_f1: 0.5114
 epoch: 92, train_loss: 0.9091, test_loss: 1.0855, test_f1: 0.5141
 epoch: 93, train_loss: 0.9078, test_loss: 1.0758, test_f1: 0.5184
 epoch: 94, train_loss: 0.9140, test_loss: 1.0774, test_f1: 0.5116
 epoch: 95, train_loss: 0.8967, test_loss: 1.0674, test_f1: 0.4978
 epoch: 96, train_loss: 0.8988, test_loss: 1.0647, test_f1: 0.5037
 epoch: 97, train_loss: 0.9077, test_loss: 1.0665, test_f1: 0.5099
 epoch: 98, train_loss: 0.8987, test_loss: 1.0538, test_f1: 0.5054
 epoch: 99, train_loss: 0.8929, test_loss: 1.0714, test_f1: 0.5192
##################ITERATION #7 ****************************************
 epoch: 0, train_loss: 1.2783, test_loss: 1.3598, test_f1: 0.2281
 epoch: 1, train_loss: 1.2329, test_loss: 1.3613, test_f1: 0.2281
 epoch: 2, train_loss: 1.2110, test_loss: 1.3540, test_f1: 0.2281
 epoch: 3, train_loss: 1.2049, test_loss: 1.3479, test_f1: 0.2281
 epoch: 4, train_loss: 1.1908, test_loss: 1.3410, test_f1: 0.2281
 epoch: 5, train_loss: 1.1700, test_loss: 1.3299, test_f1: 0.2285
 epoch: 6, train_loss: 1.1726, test_loss: 1.3051, test_f1: 0.2873
 epoch: 7, train_loss: 1.1613, test_loss: 1.2790, test_f1: 0.2979
 epoch: 8, train_loss: 1.1523, test_loss: 1.2583, test_f1: 0.3070
 epoch: 9, train_loss: 1.1366, test_loss: 1.2378, test_f1: 0.3214
 epoch: 10, train_loss: 1.1334, test_loss: 1.2178, test_f1: 0.3162
 epoch: 11, train_loss: 1.1199, test_loss: 1.2084, test_f1: 0.3274
 epoch: 12, train_loss: 1.1238, test_loss: 1.1917, test_f1: 0.3853
 epoch: 13, train_loss: 1.1005, test_loss: 1.1827, test_f1: 0.3868
 epoch: 14, train_loss: 1.1010, test_loss: 1.1721, test_f1: 0.3858
 epoch: 15, train_loss: 1.1001, test_loss: 1.1673, test_f1: 0.3892
 epoch: 16, train_loss: 1.0860, test_loss: 1.1620, test_f1: 0.3889
 epoch: 17, train_loss: 1.0841, test_loss: 1.1544, test_f1: 0.3878
 epoch: 18, train_loss: 1.0805, test_loss: 1.1484, test_f1: 0.3838
 epoch: 19, train_loss: 1.0737, test_loss: 1.1449, test_f1: 0.4019
 epoch: 20, train_loss: 1.0677, test_loss: 1.1390, test_f1: 0.4084
 epoch: 21, train_loss: 1.0730, test_loss: 1.1355, test_f1: 0.4092
 epoch: 22, train_loss: 1.0566, test_loss: 1.1325, test_f1: 0.4095
 epoch: 23, train_loss: 1.0593, test_loss: 1.1219, test_f1: 0.4221
 epoch: 24, train_loss: 1.0419, test_loss: 1.1181, test_f1: 0.4325
 epoch: 25, train_loss: 1.0535, test_loss: 1.1146, test_f1: 0.4250
 epoch: 26, train_loss: 1.0387, test_loss: 1.1152, test_f1: 0.4225
 epoch: 27, train_loss: 1.0378, test_loss: 1.1170, test_f1: 0.4225
 epoch: 28, train_loss: 1.0350, test_loss: 1.1140, test_f1: 0.4165
 epoch: 29, train_loss: 1.0291, test_loss: 1.1087, test_f1: 0.4138
 epoch: 30, train_loss: 1.0313, test_loss: 1.1021, test_f1: 0.4401
 epoch: 31, train_loss: 1.0242, test_loss: 1.1063, test_f1: 0.4266
 epoch: 32, train_loss: 1.0172, test_loss: 1.1059, test_f1: 0.4285
 epoch: 33, train_loss: 1.0074, test_loss: 1.1066, test_f1: 0.4390
 epoch: 34, train_loss: 1.0123, test_loss: 1.1002, test_f1: 0.4390
 epoch: 35, train_loss: 1.0061, test_loss: 1.0933, test_f1: 0.4433
 epoch: 36, train_loss: 1.0094, test_loss: 1.0877, test_f1: 0.4365
 epoch: 37, train_loss: 1.0071, test_loss: 1.0910, test_f1: 0.4437
 epoch: 38, train_loss: 1.0048, test_loss: 1.0965, test_f1: 0.4528
 epoch: 39, train_loss: 1.0007, test_loss: 1.0859, test_f1: 0.4474
 epoch: 40, train_loss: 0.9883, test_loss: 1.0831, test_f1: 0.4427
 epoch: 41, train_loss: 0.9918, test_loss: 1.0788, test_f1: 0.4713
 epoch: 42, train_loss: 0.9957, test_loss: 1.0760, test_f1: 0.4612
 epoch: 43, train_loss: 0.9909, test_loss: 1.0743, test_f1: 0.4609
 epoch: 44, train_loss: 0.9976, test_loss: 1.0804, test_f1: 0.4739
 epoch: 45, train_loss: 0.9827, test_loss: 1.0846, test_f1: 0.4673
 epoch: 46, train_loss: 0.9829, test_loss: 1.0697, test_f1: 0.4746
 epoch: 47, train_loss: 0.9730, test_loss: 1.0617, test_f1: 0.4794
 epoch: 48, train_loss: 0.9757, test_loss: 1.0693, test_f1: 0.4508
 epoch: 49, train_loss: 0.9675, test_loss: 1.0697, test_f1: 0.4757
 epoch: 50, train_loss: 0.9757, test_loss: 1.0755, test_f1: 0.4635
 epoch: 51, train_loss: 0.9718, test_loss: 1.0658, test_f1: 0.4334
 epoch: 52, train_loss: 0.9595, test_loss: 1.0587, test_f1: 0.4508
 epoch: 53, train_loss: 0.9748, test_loss: 1.0570, test_f1: 0.4661
 epoch: 54, train_loss: 0.9596, test_loss: 1.0597, test_f1: 0.4610
 epoch: 55, train_loss: 0.9716, test_loss: 1.0655, test_f1: 0.4649
 epoch: 56, train_loss: 0.9533, test_loss: 1.0573, test_f1: 0.4842
 epoch: 57, train_loss: 0.9579, test_loss: 1.0545, test_f1: 0.4707
 epoch: 58, train_loss: 0.9593, test_loss: 1.0575, test_f1: 0.4770
 epoch: 59, train_loss: 0.9582, test_loss: 1.0690, test_f1: 0.4719
 epoch: 60, train_loss: 0.9649, test_loss: 1.0655, test_f1: 0.4615
 epoch: 61, train_loss: 0.9596, test_loss: 1.0573, test_f1: 0.4610
 epoch: 62, train_loss: 0.9473, test_loss: 1.0627, test_f1: 0.4540
 epoch: 63, train_loss: 0.9505, test_loss: 1.0586, test_f1: 0.4470
 epoch: 64, train_loss: 0.9470, test_loss: 1.0562, test_f1: 0.4642
 epoch: 65, train_loss: 0.9465, test_loss: 1.0497, test_f1: 0.4412
 epoch: 66, train_loss: 0.9416, test_loss: 1.0516, test_f1: 0.4722
 epoch: 67, train_loss: 0.9486, test_loss: 1.0500, test_f1: 0.4522
 epoch: 68, train_loss: 0.9434, test_loss: 1.0509, test_f1: 0.4811
 epoch: 69, train_loss: 0.9468, test_loss: 1.0492, test_f1: 0.4832
 epoch: 70, train_loss: 0.9379, test_loss: 1.0457, test_f1: 0.4661
 epoch: 71, train_loss: 0.9383, test_loss: 1.0456, test_f1: 0.4631
 epoch: 72, train_loss: 0.9359, test_loss: 1.0506, test_f1: 0.4682
 epoch: 73, train_loss: 0.9313, test_loss: 1.0538, test_f1: 0.4687
 epoch: 74, train_loss: 0.9252, test_loss: 1.0585, test_f1: 0.4747
 epoch: 75, train_loss: 0.9279, test_loss: 1.0524, test_f1: 0.4785
 epoch: 76, train_loss: 0.9343, test_loss: 1.0468, test_f1: 0.4862
 epoch: 77, train_loss: 0.9281, test_loss: 1.0442, test_f1: 0.4934
 epoch: 78, train_loss: 0.9279, test_loss: 1.0428, test_f1: 0.4928
 epoch: 79, train_loss: 0.9336, test_loss: 1.0511, test_f1: 0.4833
 epoch: 80, train_loss: 0.9299, test_loss: 1.0482, test_f1: 0.4789
 epoch: 81, train_loss: 0.9318, test_loss: 1.0542, test_f1: 0.4770
 epoch: 82, train_loss: 0.9296, test_loss: 1.0555, test_f1: 0.4891
 epoch: 83, train_loss: 0.9228, test_loss: 1.0403, test_f1: 0.4745
 epoch: 84, train_loss: 0.9207, test_loss: 1.0373, test_f1: 0.4766
 epoch: 85, train_loss: 0.9221, test_loss: 1.0484, test_f1: 0.4908
 epoch: 86, train_loss: 0.9218, test_loss: 1.0550, test_f1: 0.5062
 epoch: 87, train_loss: 0.9164, test_loss: 1.0537, test_f1: 0.5064
 epoch: 88, train_loss: 0.9148, test_loss: 1.0486, test_f1: 0.5164
 epoch: 89, train_loss: 0.9163, test_loss: 1.0555, test_f1: 0.5115
 epoch: 90, train_loss: 0.9132, test_loss: 1.0503, test_f1: 0.4873
 epoch: 91, train_loss: 0.9203, test_loss: 1.0482, test_f1: 0.5014
 epoch: 92, train_loss: 0.9095, test_loss: 1.0525, test_f1: 0.5080
 epoch: 93, train_loss: 0.9059, test_loss: 1.0501, test_f1: 0.5061
 epoch: 94, train_loss: 0.9179, test_loss: 1.0433, test_f1: 0.5056
 epoch: 95, train_loss: 0.9101, test_loss: 1.0415, test_f1: 0.5161
 epoch: 96, train_loss: 0.9182, test_loss: 1.0435, test_f1: 0.5131
 epoch: 97, train_loss: 0.9153, test_loss: 1.0386, test_f1: 0.5164
 epoch: 98, train_loss: 0.9123, test_loss: 1.0450, test_f1: 0.5102
 epoch: 99, train_loss: 0.9032, test_loss: 1.0464, test_f1: 0.5048
##################ITERATION #8 ****************************************
 epoch: 0, train_loss: 1.2640, test_loss: 1.3460, test_f1: 0.2281
 epoch: 1, train_loss: 1.2168, test_loss: 1.3398, test_f1: 0.2281
 epoch: 2, train_loss: 1.2055, test_loss: 1.3320, test_f1: 0.2281
 epoch: 3, train_loss: 1.1861, test_loss: 1.3255, test_f1: 0.2281
 epoch: 4, train_loss: 1.1781, test_loss: 1.3234, test_f1: 0.2281
 epoch: 5, train_loss: 1.1742, test_loss: 1.3211, test_f1: 0.2641
 epoch: 6, train_loss: 1.1617, test_loss: 1.3084, test_f1: 0.2631
 epoch: 7, train_loss: 1.1431, test_loss: 1.2895, test_f1: 0.2606
 epoch: 8, train_loss: 1.1401, test_loss: 1.2643, test_f1: 0.2996
 epoch: 9, train_loss: 1.1298, test_loss: 1.2436, test_f1: 0.3124
 epoch: 10, train_loss: 1.1267, test_loss: 1.2280, test_f1: 0.3416
 epoch: 11, train_loss: 1.1114, test_loss: 1.2115, test_f1: 0.3223
 epoch: 12, train_loss: 1.1104, test_loss: 1.1958, test_f1: 0.3258
 epoch: 13, train_loss: 1.1009, test_loss: 1.1821, test_f1: 0.3278
 epoch: 14, train_loss: 1.0940, test_loss: 1.1746, test_f1: 0.3623
 epoch: 15, train_loss: 1.0836, test_loss: 1.1692, test_f1: 0.3463
 epoch: 16, train_loss: 1.0782, test_loss: 1.1639, test_f1: 0.3680
 epoch: 17, train_loss: 1.0799, test_loss: 1.1600, test_f1: 0.3709
 epoch: 18, train_loss: 1.0751, test_loss: 1.1587, test_f1: 0.3598
 epoch: 19, train_loss: 1.0697, test_loss: 1.1469, test_f1: 0.3618
 epoch: 20, train_loss: 1.0573, test_loss: 1.1369, test_f1: 0.3767
 epoch: 21, train_loss: 1.0575, test_loss: 1.1379, test_f1: 0.3632
 epoch: 22, train_loss: 1.0515, test_loss: 1.1365, test_f1: 0.3663
 epoch: 23, train_loss: 1.0447, test_loss: 1.1292, test_f1: 0.3683
 epoch: 24, train_loss: 1.0571, test_loss: 1.1232, test_f1: 0.3783
 epoch: 25, train_loss: 1.0366, test_loss: 1.1205, test_f1: 0.3988
 epoch: 26, train_loss: 1.0371, test_loss: 1.1199, test_f1: 0.3986
 epoch: 27, train_loss: 1.0279, test_loss: 1.1199, test_f1: 0.3931
 epoch: 28, train_loss: 1.0258, test_loss: 1.1167, test_f1: 0.4059
 epoch: 29, train_loss: 1.0202, test_loss: 1.1125, test_f1: 0.4143
 epoch: 30, train_loss: 1.0239, test_loss: 1.1096, test_f1: 0.4144
 epoch: 31, train_loss: 1.0252, test_loss: 1.1061, test_f1: 0.4256
 epoch: 32, train_loss: 1.0033, test_loss: 1.1040, test_f1: 0.4423
 epoch: 33, train_loss: 1.0083, test_loss: 1.1064, test_f1: 0.4573
 epoch: 34, train_loss: 1.0149, test_loss: 1.1097, test_f1: 0.4505
 epoch: 35, train_loss: 1.0044, test_loss: 1.1068, test_f1: 0.4453
 epoch: 36, train_loss: 0.9966, test_loss: 1.1056, test_f1: 0.4293
 epoch: 37, train_loss: 0.9886, test_loss: 1.1072, test_f1: 0.4484
 epoch: 38, train_loss: 0.9967, test_loss: 1.1000, test_f1: 0.4569
 epoch: 39, train_loss: 0.9852, test_loss: 1.0996, test_f1: 0.4766
 epoch: 40, train_loss: 0.9900, test_loss: 1.1147, test_f1: 0.4718
 epoch: 41, train_loss: 0.9926, test_loss: 1.1072, test_f1: 0.4768
 epoch: 42, train_loss: 0.9882, test_loss: 1.0958, test_f1: 0.4660
 epoch: 43, train_loss: 0.9758, test_loss: 1.0865, test_f1: 0.4768
 epoch: 44, train_loss: 0.9770, test_loss: 1.0874, test_f1: 0.4854
 epoch: 45, train_loss: 0.9818, test_loss: 1.0875, test_f1: 0.4758
 epoch: 46, train_loss: 0.9687, test_loss: 1.0930, test_f1: 0.4787
 epoch: 47, train_loss: 0.9658, test_loss: 1.0901, test_f1: 0.4846
 epoch: 48, train_loss: 0.9613, test_loss: 1.0892, test_f1: 0.4892
 epoch: 49, train_loss: 0.9608, test_loss: 1.0846, test_f1: 0.5074
 epoch: 50, train_loss: 0.9571, test_loss: 1.0838, test_f1: 0.5072
 epoch: 51, train_loss: 0.9562, test_loss: 1.0771, test_f1: 0.5119
 epoch: 52, train_loss: 0.9543, test_loss: 1.0822, test_f1: 0.5125
 epoch: 53, train_loss: 0.9505, test_loss: 1.0834, test_f1: 0.5146
 epoch: 54, train_loss: 0.9475, test_loss: 1.0817, test_f1: 0.5071
 epoch: 55, train_loss: 0.9607, test_loss: 1.0776, test_f1: 0.5024
 epoch: 56, train_loss: 0.9507, test_loss: 1.0841, test_f1: 0.5073
 epoch: 57, train_loss: 0.9448, test_loss: 1.0826, test_f1: 0.4991
 epoch: 58, train_loss: 0.9517, test_loss: 1.0884, test_f1: 0.4993
 epoch: 59, train_loss: 0.9512, test_loss: 1.0846, test_f1: 0.5034
 epoch: 60, train_loss: 0.9461, test_loss: 1.0829, test_f1: 0.5155
 epoch: 61, train_loss: 0.9510, test_loss: 1.0835, test_f1: 0.5192
 epoch: 62, train_loss: 0.9371, test_loss: 1.0783, test_f1: 0.5221
 epoch: 63, train_loss: 0.9335, test_loss: 1.0771, test_f1: 0.5245
 epoch: 64, train_loss: 0.9391, test_loss: 1.0860, test_f1: 0.5243
 epoch: 65, train_loss: 0.9368, test_loss: 1.0856, test_f1: 0.5133
 epoch: 66, train_loss: 0.9400, test_loss: 1.0874, test_f1: 0.5143
 epoch: 67, train_loss: 0.9405, test_loss: 1.0826, test_f1: 0.5287
 epoch: 68, train_loss: 0.9428, test_loss: 1.0802, test_f1: 0.5069
 epoch: 69, train_loss: 0.9262, test_loss: 1.0755, test_f1: 0.5194
 epoch: 70, train_loss: 0.9336, test_loss: 1.0683, test_f1: 0.5214
 epoch: 71, train_loss: 0.9402, test_loss: 1.0634, test_f1: 0.5258
 epoch: 72, train_loss: 0.9288, test_loss: 1.0672, test_f1: 0.5170
 epoch: 73, train_loss: 0.9240, test_loss: 1.0709, test_f1: 0.5151
 epoch: 74, train_loss: 0.9291, test_loss: 1.0655, test_f1: 0.5235
 epoch: 75, train_loss: 0.9171, test_loss: 1.0688, test_f1: 0.5283
 epoch: 76, train_loss: 0.9202, test_loss: 1.0759, test_f1: 0.5242
 epoch: 77, train_loss: 0.9251, test_loss: 1.0747, test_f1: 0.5328
 epoch: 78, train_loss: 0.9208, test_loss: 1.0695, test_f1: 0.5370
 epoch: 79, train_loss: 0.9240, test_loss: 1.0686, test_f1: 0.5346
 epoch: 80, train_loss: 0.9125, test_loss: 1.0689, test_f1: 0.5298
 epoch: 81, train_loss: 0.9219, test_loss: 1.0700, test_f1: 0.5276
 epoch: 82, train_loss: 0.9164, test_loss: 1.0759, test_f1: 0.5300
 epoch: 83, train_loss: 0.9167, test_loss: 1.0775, test_f1: 0.5277
 epoch: 84, train_loss: 0.9110, test_loss: 1.0718, test_f1: 0.5254
 epoch: 85, train_loss: 0.9128, test_loss: 1.0709, test_f1: 0.5215
 epoch: 86, train_loss: 0.9208, test_loss: 1.0702, test_f1: 0.5281
 epoch: 87, train_loss: 0.9122, test_loss: 1.0770, test_f1: 0.5282
 epoch: 88, train_loss: 0.9004, test_loss: 1.0782, test_f1: 0.5304
 epoch: 89, train_loss: 0.9065, test_loss: 1.0727, test_f1: 0.5254
 epoch: 90, train_loss: 0.9158, test_loss: 1.0745, test_f1: 0.5307
 epoch: 91, train_loss: 0.9043, test_loss: 1.0668, test_f1: 0.5230
 epoch: 92, train_loss: 0.9077, test_loss: 1.0650, test_f1: 0.5233
 epoch: 93, train_loss: 0.9011, test_loss: 1.0722, test_f1: 0.5291
 epoch: 94, train_loss: 0.8959, test_loss: 1.0802, test_f1: 0.5296
 epoch: 95, train_loss: 0.8949, test_loss: 1.0787, test_f1: 0.5343
 epoch: 96, train_loss: 0.9005, test_loss: 1.0745, test_f1: 0.5284
 epoch: 97, train_loss: 0.9014, test_loss: 1.0756, test_f1: 0.5315
 epoch: 98, train_loss: 0.8983, test_loss: 1.0807, test_f1: 0.5339
 epoch: 99, train_loss: 0.8955, test_loss: 1.0812, test_f1: 0.5338
##################ITERATION #9 ****************************************
 epoch: 0, train_loss: 1.2778, test_loss: 1.3344, test_f1: 0.2281
 epoch: 1, train_loss: 1.2334, test_loss: 1.3191, test_f1: 0.2281
 epoch: 2, train_loss: 1.2171, test_loss: 1.3042, test_f1: 0.2281
 epoch: 3, train_loss: 1.1953, test_loss: 1.2900, test_f1: 0.2281
 epoch: 4, train_loss: 1.1891, test_loss: 1.2829, test_f1: 0.2281
 epoch: 5, train_loss: 1.1713, test_loss: 1.2747, test_f1: 0.2281
 epoch: 6, train_loss: 1.1638, test_loss: 1.2591, test_f1: 0.2390
 epoch: 7, train_loss: 1.1536, test_loss: 1.2425, test_f1: 0.2524
 epoch: 8, train_loss: 1.1486, test_loss: 1.2299, test_f1: 0.2631
 epoch: 9, train_loss: 1.1389, test_loss: 1.2214, test_f1: 0.2930
 epoch: 10, train_loss: 1.1289, test_loss: 1.2141, test_f1: 0.3185
 epoch: 11, train_loss: 1.1238, test_loss: 1.2105, test_f1: 0.3652
 epoch: 12, train_loss: 1.1226, test_loss: 1.2039, test_f1: 0.3897
 epoch: 13, train_loss: 1.1125, test_loss: 1.1987, test_f1: 0.3894
 epoch: 14, train_loss: 1.1022, test_loss: 1.1894, test_f1: 0.4079
 epoch: 15, train_loss: 1.0974, test_loss: 1.1815, test_f1: 0.4068
 epoch: 16, train_loss: 1.0950, test_loss: 1.1747, test_f1: 0.4021
 epoch: 17, train_loss: 1.0818, test_loss: 1.1714, test_f1: 0.4143
 epoch: 18, train_loss: 1.0822, test_loss: 1.1675, test_f1: 0.4299
 epoch: 19, train_loss: 1.0775, test_loss: 1.1618, test_f1: 0.4347
 epoch: 20, train_loss: 1.0685, test_loss: 1.1566, test_f1: 0.4284
 epoch: 21, train_loss: 1.0675, test_loss: 1.1559, test_f1: 0.4395
 epoch: 22, train_loss: 1.0622, test_loss: 1.1500, test_f1: 0.4379
 epoch: 23, train_loss: 1.0531, test_loss: 1.1441, test_f1: 0.4408
 epoch: 24, train_loss: 1.0486, test_loss: 1.1385, test_f1: 0.4463
 epoch: 25, train_loss: 1.0495, test_loss: 1.1390, test_f1: 0.4546
 epoch: 26, train_loss: 1.0390, test_loss: 1.1375, test_f1: 0.4419
 epoch: 27, train_loss: 1.0403, test_loss: 1.1343, test_f1: 0.4425
 epoch: 28, train_loss: 1.0370, test_loss: 1.1275, test_f1: 0.4467
 epoch: 29, train_loss: 1.0207, test_loss: 1.1233, test_f1: 0.4518
 epoch: 30, train_loss: 1.0272, test_loss: 1.1234, test_f1: 0.4566
 epoch: 31, train_loss: 1.0168, test_loss: 1.1297, test_f1: 0.4529
 epoch: 32, train_loss: 1.0171, test_loss: 1.1271, test_f1: 0.4559
 epoch: 33, train_loss: 1.0263, test_loss: 1.1210, test_f1: 0.4415
 epoch: 34, train_loss: 1.0144, test_loss: 1.1186, test_f1: 0.4350
 epoch: 35, train_loss: 1.0076, test_loss: 1.1230, test_f1: 0.4279
 epoch: 36, train_loss: 1.0016, test_loss: 1.1209, test_f1: 0.4434
 epoch: 37, train_loss: 1.0013, test_loss: 1.1191, test_f1: 0.4438
 epoch: 38, train_loss: 0.9938, test_loss: 1.1168, test_f1: 0.4417
 epoch: 39, train_loss: 0.9888, test_loss: 1.1086, test_f1: 0.4423
 epoch: 40, train_loss: 0.9806, test_loss: 1.1106, test_f1: 0.4479
 epoch: 41, train_loss: 0.9827, test_loss: 1.1163, test_f1: 0.4443
 epoch: 42, train_loss: 0.9788, test_loss: 1.1132, test_f1: 0.4488
 epoch: 43, train_loss: 0.9800, test_loss: 1.1088, test_f1: 0.4548
 epoch: 44, train_loss: 0.9681, test_loss: 1.1137, test_f1: 0.4574
 epoch: 45, train_loss: 0.9766, test_loss: 1.1153, test_f1: 0.4562
 epoch: 46, train_loss: 0.9682, test_loss: 1.1113, test_f1: 0.4551
 epoch: 47, train_loss: 0.9574, test_loss: 1.1137, test_f1: 0.4601
 epoch: 48, train_loss: 0.9568, test_loss: 1.1175, test_f1: 0.4514
 epoch: 49, train_loss: 0.9544, test_loss: 1.1259, test_f1: 0.4689
 epoch: 50, train_loss: 0.9532, test_loss: 1.1326, test_f1: 0.4649
 epoch: 51, train_loss: 0.9519, test_loss: 1.1231, test_f1: 0.4575
 epoch: 52, train_loss: 0.9505, test_loss: 1.1153, test_f1: 0.4671
 epoch: 53, train_loss: 0.9444, test_loss: 1.1210, test_f1: 0.4671
 epoch: 54, train_loss: 0.9486, test_loss: 1.1176, test_f1: 0.4764
 epoch: 55, train_loss: 0.9480, test_loss: 1.1137, test_f1: 0.4684
 epoch: 56, train_loss: 0.9411, test_loss: 1.1090, test_f1: 0.4786
 epoch: 57, train_loss: 0.9409, test_loss: 1.1129, test_f1: 0.4809
 epoch: 58, train_loss: 0.9473, test_loss: 1.1123, test_f1: 0.4807
 epoch: 59, train_loss: 0.9455, test_loss: 1.1061, test_f1: 0.4826
 epoch: 60, train_loss: 0.9463, test_loss: 1.1037, test_f1: 0.4784
 epoch: 61, train_loss: 0.9318, test_loss: 1.1137, test_f1: 0.4742
 epoch: 62, train_loss: 0.9366, test_loss: 1.1187, test_f1: 0.4693
 epoch: 63, train_loss: 0.9307, test_loss: 1.1302, test_f1: 0.4721
 epoch: 64, train_loss: 0.9304, test_loss: 1.1309, test_f1: 0.4813
 epoch: 65, train_loss: 0.9273, test_loss: 1.1262, test_f1: 0.4767
 epoch: 66, train_loss: 0.9167, test_loss: 1.1260, test_f1: 0.4690
 epoch: 67, train_loss: 0.9240, test_loss: 1.1315, test_f1: 0.4696
 epoch: 68, train_loss: 0.9276, test_loss: 1.1333, test_f1: 0.4696
 epoch: 69, train_loss: 0.9292, test_loss: 1.1376, test_f1: 0.4766
 epoch: 70, train_loss: 0.9195, test_loss: 1.1323, test_f1: 0.4769
 epoch: 71, train_loss: 0.9248, test_loss: 1.1409, test_f1: 0.4840
 epoch: 72, train_loss: 0.9123, test_loss: 1.1412, test_f1: 0.4858
 epoch: 73, train_loss: 0.9183, test_loss: 1.1394, test_f1: 0.4858
 epoch: 74, train_loss: 0.9175, test_loss: 1.1431, test_f1: 0.4866
 epoch: 75, train_loss: 0.9255, test_loss: 1.1447, test_f1: 0.4818
 epoch: 76, train_loss: 0.9138, test_loss: 1.1258, test_f1: 0.4900
 epoch: 77, train_loss: 0.9071, test_loss: 1.1385, test_f1: 0.4764
 epoch: 78, train_loss: 0.9107, test_loss: 1.1418, test_f1: 0.4831
 epoch: 79, train_loss: 0.9084, test_loss: 1.1436, test_f1: 0.4810
 epoch: 80, train_loss: 0.8995, test_loss: 1.1562, test_f1: 0.4786
 epoch: 81, train_loss: 0.9077, test_loss: 1.1475, test_f1: 0.4899
 epoch: 82, train_loss: 0.9115, test_loss: 1.1411, test_f1: 0.4926
 epoch: 83, train_loss: 0.9108, test_loss: 1.1378, test_f1: 0.4926
 epoch: 84, train_loss: 0.9068, test_loss: 1.1390, test_f1: 0.4907
 epoch: 85, train_loss: 0.9095, test_loss: 1.1463, test_f1: 0.4930
 epoch: 86, train_loss: 0.9004, test_loss: 1.1430, test_f1: 0.4972
 epoch: 87, train_loss: 0.8931, test_loss: 1.1342, test_f1: 0.4925
 epoch: 88, train_loss: 0.8973, test_loss: 1.1337, test_f1: 0.4964
 epoch: 89, train_loss: 0.8947, test_loss: 1.1408, test_f1: 0.4966
 epoch: 90, train_loss: 0.8992, test_loss: 1.1526, test_f1: 0.4943
 epoch: 91, train_loss: 0.8961, test_loss: 1.1654, test_f1: 0.4948
 epoch: 92, train_loss: 0.8869, test_loss: 1.1543, test_f1: 0.4926
 epoch: 93, train_loss: 0.8933, test_loss: 1.1408, test_f1: 0.4949
 epoch: 94, train_loss: 0.8904, test_loss: 1.1398, test_f1: 0.5073
 epoch: 95, train_loss: 0.8898, test_loss: 1.1463, test_f1: 0.5056
 epoch: 96, train_loss: 0.8879, test_loss: 1.1461, test_f1: 0.4974
 epoch: 97, train_loss: 0.8837, test_loss: 1.1486, test_f1: 0.4992
 epoch: 98, train_loss: 0.8835, test_loss: 1.1516, test_f1: 0.5163
 epoch: 99, train_loss: 0.8866, test_loss: 1.1569, test_f1: 0.5013

Training completed in 301.89 seconds
Best F1: 0.5378 at epoch 98
Mean F1 across iterations: 0.4853  0.0462
========================FINAL RESULTS================================
FEGIN weighted F1: 0.5378  0.0462
python main.py --data ltspice_demos --representation component_net --model FEGIN --layers 4 --hiddens 64 --batch_size 256 --lr 0.0001 --emb_size 250 --epochs 100 --save_appendix component_net_L4_H64_BS256_LR0.0001_E250 --no_val
-----



STDERR:
  File "main.py", line 370, in <module>
    main()
  File "main.py", line 254, in main
    dataset = dataset_class(
  File "/home/philip/projects/ltspice_examples_code_repo/Circuit-Completion-Using-GNNs/component_classification_with_link_prediction_head/evaluation/FEGIN/kernel/circuit_datasets.py", line 15, in __init__
    self.data, self.slices = torch.load(self.processed_paths[0])
  File "/home/philip/.local/lib/python3.8/site-packages/torch/serialization.py", line 1040, in load
    warnings.warn(
  File "/usr/lib/python3.8/warnings.py", line 109, in _showwarnmsg
    sw(msg.message, msg.category, msg.filename, msg.lineno,
  File "main.py", line 47, in warn_with_traceback
    traceback.print_stack(file=log)
/home/philip/projects/ltspice_examples_code_repo/Circuit-Completion-Using-GNNs/component_classification_with_link_prediction_head/evaluation/FEGIN/kernel/circuit_datasets.py:15: FutureWarning: You are using `torch.load` with `weights_only=False` (the current default value), which uses the default pickle module implicitly. It is possible to construct malicious pickle data which will execute arbitrary code during unpickling (See https://github.com/pytorch/pytorch/blob/main/SECURITY.md#untrusted-models for more details). In a future release, the default value for `weights_only` will be flipped to `True`. This limits the functions that could be executed during unpickling. Arbitrary objects will no longer be allowed to be loaded via this mode unless they are explicitly allowlisted by the user via `torch.serialization.add_safe_globals`. We recommend you start setting `weights_only=True` for any use case where you don't have full control of the loaded file. Please open an issue on GitHub for any issues related to this experimental feature.
  self.data, self.slices = torch.load(self.processed_paths[0])
