STDOUT:
Results will be saved in /home/philip/projects/ltspice_examples_code_repo/Circuit-Completion-Using-GNNs/component_classification_with_link_prediction_head/evaluation/FEGIN/results/model_FEGIN_dataset_ltspice_examples
Command line input: python main.py --data ltspice_examples --representation component_pin --model FEGIN --layers 4 --hiddens 32 --batch_size 256 --lr 0.001 --emb_size 128 --epochs 100 --save_appendix component_pin_L4_H32_BS256_LR0.001_E128 --no_val
 is saved.
-----
ltspice_examples - FEGIN
Using 4 layers, 32 hidden units, h = 2
Loading component_pin representation dataset
ENTERED
Training FEGIN on component_pin representation
Train: 3560, Test: 848
##################ITERATION #0 ****************************************
 epoch: 0, train_loss: 1.3457, test_loss: 1.3400, test_f1: 0.2260
 epoch: 1, train_loss: 1.3089, test_loss: 1.3233, test_f1: 0.2260
 epoch: 2, train_loss: 1.2632, test_loss: 1.2994, test_f1: 0.2260
 epoch: 3, train_loss: 1.2074, test_loss: 1.2723, test_f1: 0.2260
 epoch: 4, train_loss: 1.1495, test_loss: 1.3072, test_f1: 0.2260
 epoch: 5, train_loss: 1.0887, test_loss: 1.1318, test_f1: 0.3186
 epoch: 6, train_loss: 1.0459, test_loss: 1.0322, test_f1: 0.3412
 epoch: 7, train_loss: 1.0161, test_loss: 1.0095, test_f1: 0.3801
 epoch: 8, train_loss: 1.0019, test_loss: 1.0254, test_f1: 0.3407
 epoch: 9, train_loss: 0.9908, test_loss: 1.0176, test_f1: 0.3521
 epoch: 10, train_loss: 0.9744, test_loss: 1.0698, test_f1: 0.3796
 epoch: 11, train_loss: 0.9636, test_loss: 1.0443, test_f1: 0.3999
 epoch: 12, train_loss: 0.9564, test_loss: 0.9836, test_f1: 0.4426
 epoch: 13, train_loss: 0.9408, test_loss: 1.0803, test_f1: 0.3944
 epoch: 14, train_loss: 0.9251, test_loss: 0.9454, test_f1: 0.4624
 epoch: 15, train_loss: 0.9295, test_loss: 0.9726, test_f1: 0.4582
 epoch: 16, train_loss: 0.9085, test_loss: 0.9419, test_f1: 0.4749
 epoch: 17, train_loss: 0.8929, test_loss: 0.9633, test_f1: 0.4718
 epoch: 18, train_loss: 0.8913, test_loss: 0.9561, test_f1: 0.4678
 epoch: 19, train_loss: 0.8777, test_loss: 0.9601, test_f1: 0.4755
 epoch: 20, train_loss: 0.8683, test_loss: 0.9708, test_f1: 0.4883
 epoch: 21, train_loss: 0.8546, test_loss: 0.9374, test_f1: 0.5020
 epoch: 22, train_loss: 0.8420, test_loss: 0.9910, test_f1: 0.4935
 epoch: 23, train_loss: 0.8390, test_loss: 1.0059, test_f1: 0.5077
 epoch: 24, train_loss: 0.8257, test_loss: 0.9907, test_f1: 0.4647
 epoch: 25, train_loss: 0.8308, test_loss: 0.9978, test_f1: 0.4790
 epoch: 26, train_loss: 0.8166, test_loss: 0.9938, test_f1: 0.4877
 epoch: 27, train_loss: 0.8098, test_loss: 1.0063, test_f1: 0.4769
 epoch: 28, train_loss: 0.8069, test_loss: 1.0142, test_f1: 0.4931
 epoch: 29, train_loss: 0.8039, test_loss: 1.0957, test_f1: 0.4647
 epoch: 30, train_loss: 0.7987, test_loss: 0.9736, test_f1: 0.4859
 epoch: 31, train_loss: 0.7913, test_loss: 0.9414, test_f1: 0.5067
 epoch: 32, train_loss: 0.7751, test_loss: 0.9538, test_f1: 0.4994
 epoch: 33, train_loss: 0.7785, test_loss: 0.9531, test_f1: 0.4996
 epoch: 34, train_loss: 0.7698, test_loss: 1.0602, test_f1: 0.4988
 epoch: 35, train_loss: 0.7649, test_loss: 0.9641, test_f1: 0.5174
 epoch: 36, train_loss: 0.7571, test_loss: 1.0222, test_f1: 0.5085
 epoch: 37, train_loss: 0.7448, test_loss: 0.9988, test_f1: 0.4973
 epoch: 38, train_loss: 0.7544, test_loss: 0.9950, test_f1: 0.5210
 epoch: 39, train_loss: 0.7271, test_loss: 1.0436, test_f1: 0.4991
 epoch: 40, train_loss: 0.7250, test_loss: 1.0032, test_f1: 0.5167
 epoch: 41, train_loss: 0.7273, test_loss: 1.0002, test_f1: 0.5174
 epoch: 42, train_loss: 0.7194, test_loss: 1.1586, test_f1: 0.4911
 epoch: 43, train_loss: 0.7182, test_loss: 1.0331, test_f1: 0.5277
 epoch: 44, train_loss: 0.7130, test_loss: 1.0411, test_f1: 0.5142
 epoch: 45, train_loss: 0.7111, test_loss: 1.0959, test_f1: 0.5010
 epoch: 46, train_loss: 0.7080, test_loss: 1.0290, test_f1: 0.5082
 epoch: 47, train_loss: 0.7040, test_loss: 1.0571, test_f1: 0.4973
 epoch: 48, train_loss: 0.6952, test_loss: 1.0418, test_f1: 0.5286
 epoch: 49, train_loss: 0.6778, test_loss: 1.0438, test_f1: 0.5059
 epoch: 50, train_loss: 0.6883, test_loss: 1.0806, test_f1: 0.5197
 epoch: 51, train_loss: 0.6709, test_loss: 1.1123, test_f1: 0.5242
 epoch: 52, train_loss: 0.6541, test_loss: 1.1184, test_f1: 0.5227
 epoch: 53, train_loss: 0.6382, test_loss: 1.0581, test_f1: 0.5368
 epoch: 54, train_loss: 0.6469, test_loss: 1.0983, test_f1: 0.5245
 epoch: 55, train_loss: 0.6297, test_loss: 1.1232, test_f1: 0.5345
 epoch: 56, train_loss: 0.6433, test_loss: 1.1663, test_f1: 0.5150
 epoch: 57, train_loss: 0.6261, test_loss: 1.0701, test_f1: 0.5348
 epoch: 58, train_loss: 0.6316, test_loss: 1.1364, test_f1: 0.5207
 epoch: 59, train_loss: 0.6280, test_loss: 1.1374, test_f1: 0.5357
 epoch: 60, train_loss: 0.6288, test_loss: 1.1654, test_f1: 0.5373
 epoch: 61, train_loss: 0.6157, test_loss: 1.1255, test_f1: 0.5360
 epoch: 62, train_loss: 0.6197, test_loss: 1.1452, test_f1: 0.5389
 epoch: 63, train_loss: 0.6134, test_loss: 1.1440, test_f1: 0.5424
 epoch: 64, train_loss: 0.6157, test_loss: 1.1387, test_f1: 0.5417
 epoch: 65, train_loss: 0.6077, test_loss: 1.1109, test_f1: 0.5357
 epoch: 66, train_loss: 0.5975, test_loss: 1.1801, test_f1: 0.5426
 epoch: 67, train_loss: 0.6018, test_loss: 1.2125, test_f1: 0.5365
 epoch: 68, train_loss: 0.6117, test_loss: 1.1707, test_f1: 0.5418
 epoch: 69, train_loss: 0.6119, test_loss: 1.1962, test_f1: 0.5369
 epoch: 70, train_loss: 0.6066, test_loss: 1.2058, test_f1: 0.5269
 epoch: 71, train_loss: 0.5953, test_loss: 1.1653, test_f1: 0.5382
 epoch: 72, train_loss: 0.6008, test_loss: 1.2029, test_f1: 0.5440
 epoch: 73, train_loss: 0.5896, test_loss: 1.1994, test_f1: 0.5317
 epoch: 74, train_loss: 0.5804, test_loss: 1.2253, test_f1: 0.5484
 epoch: 75, train_loss: 0.5704, test_loss: 1.2380, test_f1: 0.5564
 epoch: 76, train_loss: 0.5926, test_loss: 1.2810, test_f1: 0.5333
 epoch: 77, train_loss: 0.6005, test_loss: 1.2513, test_f1: 0.5375
 epoch: 78, train_loss: 0.5901, test_loss: 1.2504, test_f1: 0.5244
 epoch: 79, train_loss: 0.5866, test_loss: 1.3143, test_f1: 0.5325
 epoch: 80, train_loss: 0.5823, test_loss: 1.2296, test_f1: 0.5484
 epoch: 81, train_loss: 0.5759, test_loss: 1.2416, test_f1: 0.5624
 epoch: 82, train_loss: 0.5763, test_loss: 1.2012, test_f1: 0.5545
 epoch: 83, train_loss: 0.5741, test_loss: 1.2741, test_f1: 0.5437
 epoch: 84, train_loss: 0.5662, test_loss: 1.2909, test_f1: 0.5522
 epoch: 85, train_loss: 0.5718, test_loss: 1.2499, test_f1: 0.5387
 epoch: 86, train_loss: 0.5576, test_loss: 1.3472, test_f1: 0.5477
 epoch: 87, train_loss: 0.5566, test_loss: 1.2632, test_f1: 0.5555
 epoch: 88, train_loss: 0.5698, test_loss: 1.2286, test_f1: 0.5537
 epoch: 89, train_loss: 0.5552, test_loss: 1.3208, test_f1: 0.5488
 epoch: 90, train_loss: 0.5624, test_loss: 1.2648, test_f1: 0.5580
 epoch: 91, train_loss: 0.5540, test_loss: 1.2666, test_f1: 0.5476
 epoch: 92, train_loss: 0.5513, test_loss: 1.3727, test_f1: 0.5352
 epoch: 93, train_loss: 0.5545, test_loss: 1.2756, test_f1: 0.5476
 epoch: 94, train_loss: 0.5466, test_loss: 1.3038, test_f1: 0.5393
 epoch: 95, train_loss: 0.5544, test_loss: 1.3662, test_f1: 0.5620
 epoch: 96, train_loss: 0.5591, test_loss: 1.2727, test_f1: 0.5447
 epoch: 97, train_loss: 0.5390, test_loss: 1.3022, test_f1: 0.5609
 epoch: 98, train_loss: 0.5328, test_loss: 1.3528, test_f1: 0.5707
 epoch: 99, train_loss: 0.5360, test_loss: 1.2649, test_f1: 0.5570
##################ITERATION #1 ****************************************
 epoch: 0, train_loss: 1.2847, test_loss: 1.3000, test_f1: 0.2260
 epoch: 1, train_loss: 1.1738, test_loss: 1.2311, test_f1: 0.2260
 epoch: 2, train_loss: 1.1122, test_loss: 1.1200, test_f1: 0.3361
 epoch: 3, train_loss: 1.0662, test_loss: 1.0644, test_f1: 0.3454
 epoch: 4, train_loss: 1.0386, test_loss: 1.0379, test_f1: 0.4189
 epoch: 5, train_loss: 1.0058, test_loss: 1.0291, test_f1: 0.4573
 epoch: 6, train_loss: 0.9822, test_loss: 1.0160, test_f1: 0.4603
 epoch: 7, train_loss: 0.9629, test_loss: 0.9952, test_f1: 0.4875
 epoch: 8, train_loss: 0.9554, test_loss: 0.9892, test_f1: 0.4643
 epoch: 9, train_loss: 0.9322, test_loss: 1.1123, test_f1: 0.4156
 epoch: 10, train_loss: 0.9115, test_loss: 0.9812, test_f1: 0.4910
 epoch: 11, train_loss: 0.9045, test_loss: 0.9826, test_f1: 0.4819
 epoch: 12, train_loss: 0.8974, test_loss: 1.0004, test_f1: 0.5095
 epoch: 13, train_loss: 0.8810, test_loss: 0.9469, test_f1: 0.5030
 epoch: 14, train_loss: 0.8774, test_loss: 0.9274, test_f1: 0.5051
 epoch: 15, train_loss: 0.8561, test_loss: 0.9725, test_f1: 0.5068
 epoch: 16, train_loss: 0.8438, test_loss: 0.9686, test_f1: 0.5075
 epoch: 17, train_loss: 0.8353, test_loss: 0.9291, test_f1: 0.5306
 epoch: 18, train_loss: 0.8242, test_loss: 0.9603, test_f1: 0.5150
 epoch: 19, train_loss: 0.8179, test_loss: 0.9850, test_f1: 0.4809
 epoch: 20, train_loss: 0.8087, test_loss: 0.9715, test_f1: 0.5057
 epoch: 21, train_loss: 0.8021, test_loss: 0.9115, test_f1: 0.5265
 epoch: 22, train_loss: 0.8003, test_loss: 0.8964, test_f1: 0.5497
 epoch: 23, train_loss: 0.7958, test_loss: 1.1260, test_f1: 0.4350
 epoch: 24, train_loss: 0.7848, test_loss: 0.9209, test_f1: 0.5307
 epoch: 25, train_loss: 0.7800, test_loss: 0.9395, test_f1: 0.5195
 epoch: 26, train_loss: 0.7635, test_loss: 0.9839, test_f1: 0.5111
 epoch: 27, train_loss: 0.7672, test_loss: 0.9924, test_f1: 0.5234
 epoch: 28, train_loss: 0.7688, test_loss: 0.9105, test_f1: 0.5336
 epoch: 29, train_loss: 0.7563, test_loss: 0.9303, test_f1: 0.5509
 epoch: 30, train_loss: 0.7509, test_loss: 0.9748, test_f1: 0.5195
 epoch: 31, train_loss: 0.7564, test_loss: 0.9546, test_f1: 0.5330
 epoch: 32, train_loss: 0.7375, test_loss: 0.9044, test_f1: 0.5290
 epoch: 33, train_loss: 0.7295, test_loss: 0.9356, test_f1: 0.5475
 epoch: 34, train_loss: 0.7259, test_loss: 0.9284, test_f1: 0.5113
 epoch: 35, train_loss: 0.7257, test_loss: 0.8903, test_f1: 0.5751
 epoch: 36, train_loss: 0.6945, test_loss: 1.0087, test_f1: 0.5197
 epoch: 37, train_loss: 0.6977, test_loss: 0.9345, test_f1: 0.5467
 epoch: 38, train_loss: 0.7008, test_loss: 0.9842, test_f1: 0.5569
 epoch: 39, train_loss: 0.6979, test_loss: 0.9781, test_f1: 0.5219
 epoch: 40, train_loss: 0.6950, test_loss: 0.9655, test_f1: 0.5497
 epoch: 41, train_loss: 0.6890, test_loss: 1.0337, test_f1: 0.5003
 epoch: 42, train_loss: 0.6818, test_loss: 0.9171, test_f1: 0.5602
 epoch: 43, train_loss: 0.6879, test_loss: 0.9729, test_f1: 0.5311
 epoch: 44, train_loss: 0.6922, test_loss: 0.9532, test_f1: 0.5292
 epoch: 45, train_loss: 0.6869, test_loss: 0.9521, test_f1: 0.5408
 epoch: 46, train_loss: 0.6647, test_loss: 0.9926, test_f1: 0.5424
 epoch: 47, train_loss: 0.6574, test_loss: 0.9629, test_f1: 0.5349
 epoch: 48, train_loss: 0.6709, test_loss: 1.0109, test_f1: 0.5417
 epoch: 49, train_loss: 0.6696, test_loss: 0.9548, test_f1: 0.5621
 epoch: 50, train_loss: 0.6629, test_loss: 0.9453, test_f1: 0.5624
 epoch: 51, train_loss: 0.6376, test_loss: 0.9383, test_f1: 0.5606
 epoch: 52, train_loss: 0.6307, test_loss: 0.9559, test_f1: 0.5515
 epoch: 53, train_loss: 0.6271, test_loss: 0.9477, test_f1: 0.5606
 epoch: 54, train_loss: 0.6189, test_loss: 0.9712, test_f1: 0.5362
 epoch: 55, train_loss: 0.6238, test_loss: 0.9593, test_f1: 0.5408
 epoch: 56, train_loss: 0.6164, test_loss: 0.9749, test_f1: 0.5463
 epoch: 57, train_loss: 0.6028, test_loss: 0.9550, test_f1: 0.5525
 epoch: 58, train_loss: 0.6009, test_loss: 0.9374, test_f1: 0.5696
 epoch: 59, train_loss: 0.6208, test_loss: 0.9646, test_f1: 0.5609
 epoch: 60, train_loss: 0.6033, test_loss: 0.9847, test_f1: 0.5690
 epoch: 61, train_loss: 0.6042, test_loss: 0.9518, test_f1: 0.5849
 epoch: 62, train_loss: 0.5970, test_loss: 0.9774, test_f1: 0.5544
 epoch: 63, train_loss: 0.6080, test_loss: 0.9796, test_f1: 0.5626
 epoch: 64, train_loss: 0.6068, test_loss: 0.9773, test_f1: 0.5463
 epoch: 65, train_loss: 0.5935, test_loss: 1.0281, test_f1: 0.5539
 epoch: 66, train_loss: 0.5904, test_loss: 0.9498, test_f1: 0.5789
 epoch: 67, train_loss: 0.5936, test_loss: 0.9709, test_f1: 0.5938
 epoch: 68, train_loss: 0.5987, test_loss: 1.0075, test_f1: 0.5600
 epoch: 69, train_loss: 0.6004, test_loss: 1.0019, test_f1: 0.5519
 epoch: 70, train_loss: 0.5798, test_loss: 0.9886, test_f1: 0.5575
 epoch: 71, train_loss: 0.5763, test_loss: 0.9860, test_f1: 0.5683
 epoch: 72, train_loss: 0.5844, test_loss: 0.9756, test_f1: 0.5646
 epoch: 73, train_loss: 0.5794, test_loss: 0.9680, test_f1: 0.5707
 epoch: 74, train_loss: 0.5758, test_loss: 0.9633, test_f1: 0.5805
 epoch: 75, train_loss: 0.5791, test_loss: 0.9478, test_f1: 0.5867
 epoch: 76, train_loss: 0.5771, test_loss: 1.0150, test_f1: 0.5601
 epoch: 77, train_loss: 0.5899, test_loss: 0.9842, test_f1: 0.5894
 epoch: 78, train_loss: 0.5733, test_loss: 0.9412, test_f1: 0.6042
 epoch: 79, train_loss: 0.5682, test_loss: 0.9667, test_f1: 0.5730
 epoch: 80, train_loss: 0.5644, test_loss: 0.9935, test_f1: 0.5581
 epoch: 81, train_loss: 0.5623, test_loss: 1.0118, test_f1: 0.5935
 epoch: 82, train_loss: 0.5583, test_loss: 1.0268, test_f1: 0.5952
 epoch: 83, train_loss: 0.5680, test_loss: 1.0347, test_f1: 0.5911
 epoch: 84, train_loss: 0.5586, test_loss: 1.0388, test_f1: 0.5812
 epoch: 85, train_loss: 0.5667, test_loss: 1.0042, test_f1: 0.5705
 epoch: 86, train_loss: 0.5495, test_loss: 0.9738, test_f1: 0.5913
 epoch: 87, train_loss: 0.5523, test_loss: 1.0217, test_f1: 0.5937
 epoch: 88, train_loss: 0.5493, test_loss: 0.9742, test_f1: 0.5996
 epoch: 89, train_loss: 0.5597, test_loss: 1.0826, test_f1: 0.5885
 epoch: 90, train_loss: 0.5793, test_loss: 1.0783, test_f1: 0.5777
 epoch: 91, train_loss: 0.5586, test_loss: 0.9848, test_f1: 0.6045
 epoch: 92, train_loss: 0.5494, test_loss: 1.0060, test_f1: 0.5974
 epoch: 93, train_loss: 0.5351, test_loss: 1.0253, test_f1: 0.5837
 epoch: 94, train_loss: 0.5527, test_loss: 1.0028, test_f1: 0.5850
 epoch: 95, train_loss: 0.5406, test_loss: 0.9642, test_f1: 0.5991
 epoch: 96, train_loss: 0.5401, test_loss: 1.0235, test_f1: 0.5587
 epoch: 97, train_loss: 0.5515, test_loss: 1.0356, test_f1: 0.5890
 epoch: 98, train_loss: 0.5356, test_loss: 1.0431, test_f1: 0.5825
 epoch: 99, train_loss: 0.5302, test_loss: 1.0389, test_f1: 0.5853
##################ITERATION #2 ****************************************
 epoch: 0, train_loss: 1.2568, test_loss: 1.2881, test_f1: 0.2260
 epoch: 1, train_loss: 1.1438, test_loss: 1.2405, test_f1: 0.2260
 epoch: 2, train_loss: 1.0801, test_loss: 1.1622, test_f1: 0.3003
 epoch: 3, train_loss: 1.0344, test_loss: 1.0550, test_f1: 0.4347
 epoch: 4, train_loss: 1.0027, test_loss: 0.9815, test_f1: 0.4644
 epoch: 5, train_loss: 0.9764, test_loss: 0.9720, test_f1: 0.4840
 epoch: 6, train_loss: 0.9618, test_loss: 0.9429, test_f1: 0.4882
 epoch: 7, train_loss: 0.9471, test_loss: 0.9448, test_f1: 0.5059
 epoch: 8, train_loss: 0.9305, test_loss: 0.9774, test_f1: 0.5067
 epoch: 9, train_loss: 0.9071, test_loss: 0.9358, test_f1: 0.5248
 epoch: 10, train_loss: 0.8995, test_loss: 0.9708, test_f1: 0.5010
 epoch: 11, train_loss: 0.8846, test_loss: 0.9389, test_f1: 0.4772
 epoch: 12, train_loss: 0.8697, test_loss: 0.9074, test_f1: 0.5197
 epoch: 13, train_loss: 0.8573, test_loss: 0.9176, test_f1: 0.5245
 epoch: 14, train_loss: 0.8475, test_loss: 0.8960, test_f1: 0.5350
 epoch: 15, train_loss: 0.8318, test_loss: 0.9045, test_f1: 0.5438
 epoch: 16, train_loss: 0.8193, test_loss: 0.8981, test_f1: 0.5272
 epoch: 17, train_loss: 0.8117, test_loss: 0.9979, test_f1: 0.5209
 epoch: 18, train_loss: 0.8113, test_loss: 0.9107, test_f1: 0.5252
 epoch: 19, train_loss: 0.7923, test_loss: 0.9625, test_f1: 0.5285
 epoch: 20, train_loss: 0.7830, test_loss: 0.8740, test_f1: 0.5479
 epoch: 21, train_loss: 0.7725, test_loss: 0.8808, test_f1: 0.5514
 epoch: 22, train_loss: 0.7674, test_loss: 0.8489, test_f1: 0.5740
 epoch: 23, train_loss: 0.7593, test_loss: 0.9456, test_f1: 0.5426
 epoch: 24, train_loss: 0.7646, test_loss: 0.8841, test_f1: 0.5813
 epoch: 25, train_loss: 0.7556, test_loss: 0.9038, test_f1: 0.5740
 epoch: 26, train_loss: 0.7410, test_loss: 0.9508, test_f1: 0.5411
 epoch: 27, train_loss: 0.7230, test_loss: 0.9015, test_f1: 0.5500
 epoch: 28, train_loss: 0.7245, test_loss: 0.9736, test_f1: 0.5515
 epoch: 29, train_loss: 0.7285, test_loss: 0.9385, test_f1: 0.5427
 epoch: 30, train_loss: 0.7168, test_loss: 0.9091, test_f1: 0.5622
 epoch: 31, train_loss: 0.7103, test_loss: 0.9260, test_f1: 0.5522
 epoch: 32, train_loss: 0.7206, test_loss: 0.8790, test_f1: 0.5547
 epoch: 33, train_loss: 0.6861, test_loss: 0.8860, test_f1: 0.5726
 epoch: 34, train_loss: 0.6731, test_loss: 0.9070, test_f1: 0.5801
 epoch: 35, train_loss: 0.6741, test_loss: 0.9355, test_f1: 0.5986
 epoch: 36, train_loss: 0.6821, test_loss: 0.9208, test_f1: 0.5923
 epoch: 37, train_loss: 0.7042, test_loss: 0.9052, test_f1: 0.5914
 epoch: 38, train_loss: 0.6878, test_loss: 0.9583, test_f1: 0.5793
 epoch: 39, train_loss: 0.6660, test_loss: 0.9031, test_f1: 0.5964
 epoch: 40, train_loss: 0.6691, test_loss: 0.9226, test_f1: 0.5836
 epoch: 41, train_loss: 0.6529, test_loss: 1.0175, test_f1: 0.5359
 epoch: 42, train_loss: 0.6449, test_loss: 0.9415, test_f1: 0.5867
 epoch: 43, train_loss: 0.6405, test_loss: 0.9882, test_f1: 0.5910
 epoch: 44, train_loss: 0.6357, test_loss: 0.9572, test_f1: 0.6002
 epoch: 45, train_loss: 0.6408, test_loss: 0.9603, test_f1: 0.5967
 epoch: 46, train_loss: 0.6297, test_loss: 0.9772, test_f1: 0.5725
 epoch: 47, train_loss: 0.6169, test_loss: 0.9267, test_f1: 0.5955
 epoch: 48, train_loss: 0.6160, test_loss: 0.9671, test_f1: 0.6083
 epoch: 49, train_loss: 0.6279, test_loss: 1.0129, test_f1: 0.5903
 epoch: 50, train_loss: 0.6043, test_loss: 1.0880, test_f1: 0.5694
 epoch: 51, train_loss: 0.6094, test_loss: 0.9921, test_f1: 0.5995
 epoch: 52, train_loss: 0.6040, test_loss: 0.9367, test_f1: 0.5985
 epoch: 53, train_loss: 0.5909, test_loss: 0.9823, test_f1: 0.6063
 epoch: 54, train_loss: 0.5775, test_loss: 1.0379, test_f1: 0.5940
 epoch: 55, train_loss: 0.5779, test_loss: 1.0289, test_f1: 0.6006
 epoch: 56, train_loss: 0.5855, test_loss: 1.0324, test_f1: 0.6058
 epoch: 57, train_loss: 0.5863, test_loss: 1.0286, test_f1: 0.5962
 epoch: 58, train_loss: 0.5611, test_loss: 1.0838, test_f1: 0.6012
 epoch: 59, train_loss: 0.5648, test_loss: 1.0358, test_f1: 0.6019
 epoch: 60, train_loss: 0.5599, test_loss: 1.0938, test_f1: 0.5873
 epoch: 61, train_loss: 0.5695, test_loss: 1.0038, test_f1: 0.6187
 epoch: 62, train_loss: 0.5660, test_loss: 1.0309, test_f1: 0.5841
 epoch: 63, train_loss: 0.5531, test_loss: 1.0655, test_f1: 0.5971
 epoch: 64, train_loss: 0.5490, test_loss: 1.0871, test_f1: 0.6165
 epoch: 65, train_loss: 0.5590, test_loss: 1.0752, test_f1: 0.6008
 epoch: 66, train_loss: 0.5518, test_loss: 1.0653, test_f1: 0.5932
 epoch: 67, train_loss: 0.5511, test_loss: 1.1284, test_f1: 0.5961
 epoch: 68, train_loss: 0.5596, test_loss: 1.1768, test_f1: 0.6043
 epoch: 69, train_loss: 0.5494, test_loss: 1.0549, test_f1: 0.5873
 epoch: 70, train_loss: 0.5450, test_loss: 1.1395, test_f1: 0.6020
 epoch: 71, train_loss: 0.5352, test_loss: 1.1756, test_f1: 0.5993
 epoch: 72, train_loss: 0.5285, test_loss: 1.1591, test_f1: 0.5890
 epoch: 73, train_loss: 0.5395, test_loss: 1.0585, test_f1: 0.5979
 epoch: 74, train_loss: 0.5458, test_loss: 1.0969, test_f1: 0.5860
 epoch: 75, train_loss: 0.5459, test_loss: 1.1183, test_f1: 0.6145
 epoch: 76, train_loss: 0.5374, test_loss: 1.1656, test_f1: 0.5919
 epoch: 77, train_loss: 0.5195, test_loss: 1.1631, test_f1: 0.5942
 epoch: 78, train_loss: 0.5263, test_loss: 1.1618, test_f1: 0.5847
 epoch: 79, train_loss: 0.5468, test_loss: 1.2114, test_f1: 0.5783
 epoch: 80, train_loss: 0.5261, test_loss: 1.1675, test_f1: 0.5892
 epoch: 81, train_loss: 0.5225, test_loss: 1.2301, test_f1: 0.5828
 epoch: 82, train_loss: 0.5141, test_loss: 1.1415, test_f1: 0.6143
 epoch: 83, train_loss: 0.5293, test_loss: 1.1404, test_f1: 0.5760
 epoch: 84, train_loss: 0.5293, test_loss: 1.2041, test_f1: 0.5766
 epoch: 85, train_loss: 0.5259, test_loss: 1.1150, test_f1: 0.5929
 epoch: 86, train_loss: 0.5245, test_loss: 1.1740, test_f1: 0.6081
 epoch: 87, train_loss: 0.5209, test_loss: 1.1962, test_f1: 0.5675
 epoch: 88, train_loss: 0.5114, test_loss: 1.2411, test_f1: 0.6004
 epoch: 89, train_loss: 0.5138, test_loss: 1.2580, test_f1: 0.5772
 epoch: 90, train_loss: 0.5173, test_loss: 1.1312, test_f1: 0.6040
 epoch: 91, train_loss: 0.5070, test_loss: 1.1732, test_f1: 0.5921
 epoch: 92, train_loss: 0.5109, test_loss: 1.2422, test_f1: 0.5865
 epoch: 93, train_loss: 0.4957, test_loss: 1.2046, test_f1: 0.5875
 epoch: 94, train_loss: 0.4969, test_loss: 1.3299, test_f1: 0.6060
 epoch: 95, train_loss: 0.4947, test_loss: 1.2170, test_f1: 0.5972
 epoch: 96, train_loss: 0.4883, test_loss: 1.3485, test_f1: 0.5768
 epoch: 97, train_loss: 0.5132, test_loss: 1.1730, test_f1: 0.5936
 epoch: 98, train_loss: 0.5069, test_loss: 1.2000, test_f1: 0.5985
 epoch: 99, train_loss: 0.5009, test_loss: 1.1717, test_f1: 0.6014
##################ITERATION #3 ****************************************
 epoch: 0, train_loss: 1.2583, test_loss: 1.2996, test_f1: 0.2260
 epoch: 1, train_loss: 1.1109, test_loss: 1.2830, test_f1: 0.2311
 epoch: 2, train_loss: 1.0597, test_loss: 1.1937, test_f1: 0.2909
 epoch: 3, train_loss: 1.0273, test_loss: 1.0634, test_f1: 0.3445
 epoch: 4, train_loss: 0.9894, test_loss: 1.0023, test_f1: 0.4166
 epoch: 5, train_loss: 0.9628, test_loss: 0.9366, test_f1: 0.4913
 epoch: 6, train_loss: 0.9381, test_loss: 0.9150, test_f1: 0.5120
 epoch: 7, train_loss: 0.9233, test_loss: 0.8997, test_f1: 0.4962
 epoch: 8, train_loss: 0.8980, test_loss: 0.9019, test_f1: 0.5151
 epoch: 9, train_loss: 0.8928, test_loss: 0.8942, test_f1: 0.5222
 epoch: 10, train_loss: 0.8802, test_loss: 0.9140, test_f1: 0.5060
 epoch: 11, train_loss: 0.8703, test_loss: 0.9215, test_f1: 0.5399
 epoch: 12, train_loss: 0.8450, test_loss: 0.9193, test_f1: 0.5084
 epoch: 13, train_loss: 0.8325, test_loss: 0.8368, test_f1: 0.5493
 epoch: 14, train_loss: 0.8239, test_loss: 0.8774, test_f1: 0.5559
 epoch: 15, train_loss: 0.8100, test_loss: 0.8404, test_f1: 0.5640
 epoch: 16, train_loss: 0.7998, test_loss: 0.9096, test_f1: 0.5438
 epoch: 17, train_loss: 0.7917, test_loss: 0.8469, test_f1: 0.5522
 epoch: 18, train_loss: 0.7947, test_loss: 1.0683, test_f1: 0.5020
 epoch: 19, train_loss: 0.7846, test_loss: 0.9448, test_f1: 0.5162
 epoch: 20, train_loss: 0.7692, test_loss: 0.8298, test_f1: 0.5645
 epoch: 21, train_loss: 0.7686, test_loss: 0.8651, test_f1: 0.5553
 epoch: 22, train_loss: 0.7697, test_loss: 0.8702, test_f1: 0.5511
 epoch: 23, train_loss: 0.7470, test_loss: 0.8734, test_f1: 0.5486
 epoch: 24, train_loss: 0.7349, test_loss: 0.8883, test_f1: 0.5475
 epoch: 25, train_loss: 0.7357, test_loss: 0.9089, test_f1: 0.5354
 epoch: 26, train_loss: 0.7409, test_loss: 0.8804, test_f1: 0.5443
 epoch: 27, train_loss: 0.7266, test_loss: 0.9132, test_f1: 0.5428
 epoch: 28, train_loss: 0.7156, test_loss: 0.8639, test_f1: 0.5392
 epoch: 29, train_loss: 0.7205, test_loss: 0.8433, test_f1: 0.5618
 epoch: 30, train_loss: 0.7070, test_loss: 0.9066, test_f1: 0.5474
 epoch: 31, train_loss: 0.7075, test_loss: 0.8718, test_f1: 0.5502
 epoch: 32, train_loss: 0.6942, test_loss: 0.8773, test_f1: 0.5280
 epoch: 33, train_loss: 0.6855, test_loss: 0.8663, test_f1: 0.5628
 epoch: 34, train_loss: 0.6867, test_loss: 0.8971, test_f1: 0.5520
 epoch: 35, train_loss: 0.6800, test_loss: 0.9071, test_f1: 0.5420
 epoch: 36, train_loss: 0.6754, test_loss: 0.8759, test_f1: 0.5649
 epoch: 37, train_loss: 0.6691, test_loss: 0.9368, test_f1: 0.5418
 epoch: 38, train_loss: 0.6911, test_loss: 0.9567, test_f1: 0.5485
 epoch: 39, train_loss: 0.6863, test_loss: 0.9371, test_f1: 0.5502
 epoch: 40, train_loss: 0.6707, test_loss: 0.9215, test_f1: 0.5561
 epoch: 41, train_loss: 0.6652, test_loss: 0.8960, test_f1: 0.5611
 epoch: 42, train_loss: 0.6511, test_loss: 0.9429, test_f1: 0.5385
 epoch: 43, train_loss: 0.6396, test_loss: 0.9206, test_f1: 0.5435
 epoch: 44, train_loss: 0.6430, test_loss: 0.8855, test_f1: 0.5565
 epoch: 45, train_loss: 0.6326, test_loss: 0.9135, test_f1: 0.5511
 epoch: 46, train_loss: 0.6361, test_loss: 0.9484, test_f1: 0.5477
 epoch: 47, train_loss: 0.6319, test_loss: 0.9126, test_f1: 0.5516
 epoch: 48, train_loss: 0.6182, test_loss: 0.9588, test_f1: 0.5584
 epoch: 49, train_loss: 0.6257, test_loss: 0.9140, test_f1: 0.5525
 epoch: 50, train_loss: 0.6339, test_loss: 0.8894, test_f1: 0.5541
 epoch: 51, train_loss: 0.6155, test_loss: 0.9202, test_f1: 0.5544
 epoch: 52, train_loss: 0.6072, test_loss: 0.9111, test_f1: 0.5423
 epoch: 53, train_loss: 0.6004, test_loss: 0.9476, test_f1: 0.5459
 epoch: 54, train_loss: 0.5957, test_loss: 0.9747, test_f1: 0.5454
 epoch: 55, train_loss: 0.5878, test_loss: 0.9479, test_f1: 0.5562
 epoch: 56, train_loss: 0.5781, test_loss: 0.9587, test_f1: 0.5578
 epoch: 57, train_loss: 0.5725, test_loss: 0.9509, test_f1: 0.5707
 epoch: 58, train_loss: 0.5725, test_loss: 0.9784, test_f1: 0.5682
 epoch: 59, train_loss: 0.5721, test_loss: 0.9660, test_f1: 0.5695
 epoch: 60, train_loss: 0.5730, test_loss: 0.9468, test_f1: 0.5571
 epoch: 61, train_loss: 0.5760, test_loss: 0.9545, test_f1: 0.5621
 epoch: 62, train_loss: 0.5701, test_loss: 0.9303, test_f1: 0.5664
 epoch: 63, train_loss: 0.5601, test_loss: 0.9297, test_f1: 0.5670
 epoch: 64, train_loss: 0.5705, test_loss: 0.9630, test_f1: 0.5641
 epoch: 65, train_loss: 0.5585, test_loss: 0.9437, test_f1: 0.5647
 epoch: 66, train_loss: 0.5651, test_loss: 0.9528, test_f1: 0.5792
 epoch: 67, train_loss: 0.5646, test_loss: 0.9901, test_f1: 0.5641
 epoch: 68, train_loss: 0.5644, test_loss: 1.0294, test_f1: 0.5635
 epoch: 69, train_loss: 0.5643, test_loss: 0.9690, test_f1: 0.5661
 epoch: 70, train_loss: 0.5610, test_loss: 1.0157, test_f1: 0.5586
 epoch: 71, train_loss: 0.5428, test_loss: 1.0071, test_f1: 0.5697
 epoch: 72, train_loss: 0.5525, test_loss: 0.9454, test_f1: 0.5692
 epoch: 73, train_loss: 0.5550, test_loss: 1.0035, test_f1: 0.5578
 epoch: 74, train_loss: 0.5612, test_loss: 0.9811, test_f1: 0.5521
 epoch: 75, train_loss: 0.5621, test_loss: 0.9861, test_f1: 0.5690
 epoch: 76, train_loss: 0.5391, test_loss: 1.0120, test_f1: 0.5752
 epoch: 77, train_loss: 0.5507, test_loss: 0.9928, test_f1: 0.5535
 epoch: 78, train_loss: 0.5364, test_loss: 1.0458, test_f1: 0.5579
 epoch: 79, train_loss: 0.5414, test_loss: 0.9955, test_f1: 0.5805
 epoch: 80, train_loss: 0.5333, test_loss: 1.0380, test_f1: 0.5649
 epoch: 81, train_loss: 0.5374, test_loss: 1.0627, test_f1: 0.5700
 epoch: 82, train_loss: 0.5341, test_loss: 1.0328, test_f1: 0.5675
 epoch: 83, train_loss: 0.5186, test_loss: 0.9840, test_f1: 0.5843
 epoch: 84, train_loss: 0.5347, test_loss: 0.9660, test_f1: 0.5835
 epoch: 85, train_loss: 0.5479, test_loss: 0.9482, test_f1: 0.5820
 epoch: 86, train_loss: 0.5388, test_loss: 0.9251, test_f1: 0.5967
 epoch: 87, train_loss: 0.5181, test_loss: 0.9559, test_f1: 0.5907
 epoch: 88, train_loss: 0.5335, test_loss: 0.9857, test_f1: 0.5779
 epoch: 89, train_loss: 0.5280, test_loss: 0.9825, test_f1: 0.5734
 epoch: 90, train_loss: 0.5229, test_loss: 0.9516, test_f1: 0.5792
 epoch: 91, train_loss: 0.5244, test_loss: 0.9686, test_f1: 0.5901
 epoch: 92, train_loss: 0.5228, test_loss: 0.9849, test_f1: 0.5826
 epoch: 93, train_loss: 0.5288, test_loss: 0.9907, test_f1: 0.6047
 epoch: 94, train_loss: 0.5208, test_loss: 1.0031, test_f1: 0.5824
 epoch: 95, train_loss: 0.5193, test_loss: 1.0004, test_f1: 0.5917
 epoch: 96, train_loss: 0.5080, test_loss: 0.9394, test_f1: 0.5939
 epoch: 97, train_loss: 0.5050, test_loss: 0.9981, test_f1: 0.5859
 epoch: 98, train_loss: 0.5144, test_loss: 1.0086, test_f1: 0.5765
 epoch: 99, train_loss: 0.5069, test_loss: 0.9941, test_f1: 0.5973
##################ITERATION #4 ****************************************
 epoch: 0, train_loss: 1.2394, test_loss: 1.3494, test_f1: 0.2260
 epoch: 1, train_loss: 1.1040, test_loss: 1.3147, test_f1: 0.2260
 epoch: 2, train_loss: 1.0696, test_loss: 1.1327, test_f1: 0.3345
 epoch: 3, train_loss: 1.0485, test_loss: 1.1418, test_f1: 0.3483
 epoch: 4, train_loss: 1.0191, test_loss: 1.0847, test_f1: 0.4398
 epoch: 5, train_loss: 0.9937, test_loss: 1.0272, test_f1: 0.4914
 epoch: 6, train_loss: 0.9779, test_loss: 1.0086, test_f1: 0.4847
 epoch: 7, train_loss: 0.9567, test_loss: 1.0111, test_f1: 0.5193
 epoch: 8, train_loss: 0.9498, test_loss: 0.9549, test_f1: 0.5390
 epoch: 9, train_loss: 0.9287, test_loss: 0.9744, test_f1: 0.5426
 epoch: 10, train_loss: 0.9230, test_loss: 0.9763, test_f1: 0.5350
 epoch: 11, train_loss: 0.9065, test_loss: 0.9693, test_f1: 0.5102
 epoch: 12, train_loss: 0.9005, test_loss: 0.9625, test_f1: 0.5356
 epoch: 13, train_loss: 0.8792, test_loss: 0.9736, test_f1: 0.5377
 epoch: 14, train_loss: 0.8818, test_loss: 0.9693, test_f1: 0.5287
 epoch: 15, train_loss: 0.8840, test_loss: 0.9829, test_f1: 0.5403
 epoch: 16, train_loss: 0.8579, test_loss: 1.0180, test_f1: 0.5363
 epoch: 17, train_loss: 0.8509, test_loss: 0.9100, test_f1: 0.5446
 epoch: 18, train_loss: 0.8419, test_loss: 0.8924, test_f1: 0.5502
 epoch: 19, train_loss: 0.8250, test_loss: 0.9295, test_f1: 0.5489
 epoch: 20, train_loss: 0.8190, test_loss: 0.9159, test_f1: 0.5689
 epoch: 21, train_loss: 0.8133, test_loss: 0.9428, test_f1: 0.5361
 epoch: 22, train_loss: 0.8207, test_loss: 0.9474, test_f1: 0.5646
 epoch: 23, train_loss: 0.8046, test_loss: 0.9426, test_f1: 0.5516
 epoch: 24, train_loss: 0.8020, test_loss: 0.9884, test_f1: 0.5420
 epoch: 25, train_loss: 0.7949, test_loss: 0.9311, test_f1: 0.5574
 epoch: 26, train_loss: 0.7771, test_loss: 0.9456, test_f1: 0.5630
 epoch: 27, train_loss: 0.7633, test_loss: 0.9194, test_f1: 0.5791
 epoch: 28, train_loss: 0.7846, test_loss: 0.9176, test_f1: 0.5723
 epoch: 29, train_loss: 0.7736, test_loss: 0.9681, test_f1: 0.5450
 epoch: 30, train_loss: 0.7600, test_loss: 0.9312, test_f1: 0.5596
 epoch: 31, train_loss: 0.7479, test_loss: 0.9692, test_f1: 0.5712
 epoch: 32, train_loss: 0.7493, test_loss: 0.9284, test_f1: 0.5698
 epoch: 33, train_loss: 0.7518, test_loss: 0.9187, test_f1: 0.5804
 epoch: 34, train_loss: 0.7505, test_loss: 0.9553, test_f1: 0.5611
 epoch: 35, train_loss: 0.7352, test_loss: 0.9123, test_f1: 0.5822
 epoch: 36, train_loss: 0.7378, test_loss: 0.9655, test_f1: 0.5957
 epoch: 37, train_loss: 0.7236, test_loss: 0.9383, test_f1: 0.5682
 epoch: 38, train_loss: 0.7229, test_loss: 0.9443, test_f1: 0.5868
 epoch: 39, train_loss: 0.7015, test_loss: 0.9367, test_f1: 0.5866
 epoch: 40, train_loss: 0.7017, test_loss: 0.9443, test_f1: 0.5740
 epoch: 41, train_loss: 0.7021, test_loss: 0.9582, test_f1: 0.5580
 epoch: 42, train_loss: 0.6999, test_loss: 0.9577, test_f1: 0.5885
 epoch: 43, train_loss: 0.7020, test_loss: 0.9673, test_f1: 0.5738
 epoch: 44, train_loss: 0.6950, test_loss: 0.9637, test_f1: 0.5703
 epoch: 45, train_loss: 0.6849, test_loss: 0.9333, test_f1: 0.5799
 epoch: 46, train_loss: 0.6840, test_loss: 1.0115, test_f1: 0.5591
 epoch: 47, train_loss: 0.6722, test_loss: 0.9640, test_f1: 0.5975
 epoch: 48, train_loss: 0.6728, test_loss: 0.9412, test_f1: 0.5844
 epoch: 49, train_loss: 0.6649, test_loss: 0.9731, test_f1: 0.5728
 epoch: 50, train_loss: 0.6646, test_loss: 0.9392, test_f1: 0.6166
 epoch: 51, train_loss: 0.6525, test_loss: 0.9408, test_f1: 0.5748
 epoch: 52, train_loss: 0.6396, test_loss: 0.9666, test_f1: 0.5867
 epoch: 53, train_loss: 0.6469, test_loss: 0.9750, test_f1: 0.5774
 epoch: 54, train_loss: 0.6396, test_loss: 0.9836, test_f1: 0.5878
 epoch: 55, train_loss: 0.6282, test_loss: 0.9645, test_f1: 0.5818
 epoch: 56, train_loss: 0.6278, test_loss: 0.9619, test_f1: 0.5975
 epoch: 57, train_loss: 0.6258, test_loss: 0.9892, test_f1: 0.5904
 epoch: 58, train_loss: 0.6335, test_loss: 0.9509, test_f1: 0.6117
 epoch: 59, train_loss: 0.6253, test_loss: 0.9606, test_f1: 0.5782
 epoch: 60, train_loss: 0.6255, test_loss: 0.9783, test_f1: 0.5942
 epoch: 61, train_loss: 0.6259, test_loss: 0.9801, test_f1: 0.5697
 epoch: 62, train_loss: 0.6232, test_loss: 0.9685, test_f1: 0.5928
 epoch: 63, train_loss: 0.6125, test_loss: 0.9892, test_f1: 0.5792
 epoch: 64, train_loss: 0.6166, test_loss: 0.9839, test_f1: 0.5925
 epoch: 65, train_loss: 0.6253, test_loss: 1.0179, test_f1: 0.5855
 epoch: 66, train_loss: 0.6076, test_loss: 1.0218, test_f1: 0.5879
 epoch: 67, train_loss: 0.6029, test_loss: 1.0012, test_f1: 0.5719
 epoch: 68, train_loss: 0.6194, test_loss: 1.0238, test_f1: 0.6123
 epoch: 69, train_loss: 0.6043, test_loss: 0.9930, test_f1: 0.5669
 epoch: 70, train_loss: 0.6282, test_loss: 1.0018, test_f1: 0.5766
 epoch: 71, train_loss: 0.6090, test_loss: 0.9874, test_f1: 0.6116
 epoch: 72, train_loss: 0.6078, test_loss: 1.0125, test_f1: 0.5789
 epoch: 73, train_loss: 0.5964, test_loss: 0.9953, test_f1: 0.5855
 epoch: 74, train_loss: 0.6076, test_loss: 0.9927, test_f1: 0.5876
 epoch: 75, train_loss: 0.5960, test_loss: 0.9819, test_f1: 0.5988
 epoch: 76, train_loss: 0.5843, test_loss: 1.0114, test_f1: 0.5999
 epoch: 77, train_loss: 0.5916, test_loss: 0.9750, test_f1: 0.5990
 epoch: 78, train_loss: 0.5962, test_loss: 0.9902, test_f1: 0.6149
 epoch: 79, train_loss: 0.5914, test_loss: 1.0066, test_f1: 0.5951
 epoch: 80, train_loss: 0.5914, test_loss: 1.0344, test_f1: 0.5989
 epoch: 81, train_loss: 0.5854, test_loss: 0.9817, test_f1: 0.6147
 epoch: 82, train_loss: 0.5730, test_loss: 0.9990, test_f1: 0.6362
 epoch: 83, train_loss: 0.5860, test_loss: 1.0130, test_f1: 0.5823
 epoch: 84, train_loss: 0.5744, test_loss: 0.9946, test_f1: 0.6184
 epoch: 85, train_loss: 0.5715, test_loss: 0.9828, test_f1: 0.5944
 epoch: 86, train_loss: 0.5920, test_loss: 0.9971, test_f1: 0.5761
 epoch: 87, train_loss: 0.6039, test_loss: 1.0113, test_f1: 0.6025
 epoch: 88, train_loss: 0.5998, test_loss: 0.9824, test_f1: 0.5872
 epoch: 89, train_loss: 0.5750, test_loss: 1.0204, test_f1: 0.6123
 epoch: 90, train_loss: 0.5757, test_loss: 0.9900, test_f1: 0.5946
 epoch: 91, train_loss: 0.5776, test_loss: 1.0220, test_f1: 0.5940
 epoch: 92, train_loss: 0.5712, test_loss: 1.0336, test_f1: 0.6115
 epoch: 93, train_loss: 0.5686, test_loss: 1.0473, test_f1: 0.6047
 epoch: 94, train_loss: 0.5645, test_loss: 1.0138, test_f1: 0.6211
 epoch: 95, train_loss: 0.5625, test_loss: 0.9838, test_f1: 0.6288
 epoch: 96, train_loss: 0.5682, test_loss: 1.0388, test_f1: 0.5909
 epoch: 97, train_loss: 0.5647, test_loss: 0.9833, test_f1: 0.6008
 epoch: 98, train_loss: 0.5614, test_loss: 1.0311, test_f1: 0.6033
 epoch: 99, train_loss: 0.5600, test_loss: 1.0578, test_f1: 0.5796
##################ITERATION #5 ****************************************
 epoch: 0, train_loss: 1.2497, test_loss: 1.3159, test_f1: 0.2260
 epoch: 1, train_loss: 1.1025, test_loss: 1.2796, test_f1: 0.3108
 epoch: 2, train_loss: 1.0520, test_loss: 1.4116, test_f1: 0.2805
 epoch: 3, train_loss: 1.0109, test_loss: 1.1342, test_f1: 0.3570
 epoch: 4, train_loss: 0.9889, test_loss: 1.0434, test_f1: 0.4029
 epoch: 5, train_loss: 0.9587, test_loss: 0.9568, test_f1: 0.4495
 epoch: 6, train_loss: 0.9428, test_loss: 0.9394, test_f1: 0.4878
 epoch: 7, train_loss: 0.9190, test_loss: 0.9682, test_f1: 0.5024
 epoch: 8, train_loss: 0.9121, test_loss: 0.9597, test_f1: 0.5067
 epoch: 9, train_loss: 0.9012, test_loss: 0.9416, test_f1: 0.5112
 epoch: 10, train_loss: 0.8791, test_loss: 0.9737, test_f1: 0.5195
 epoch: 11, train_loss: 0.8649, test_loss: 0.9503, test_f1: 0.4969
 epoch: 12, train_loss: 0.8539, test_loss: 0.9422, test_f1: 0.5114
 epoch: 13, train_loss: 0.8496, test_loss: 0.9162, test_f1: 0.5311
 epoch: 14, train_loss: 0.8427, test_loss: 0.9390, test_f1: 0.5157
 epoch: 15, train_loss: 0.8203, test_loss: 0.9760, test_f1: 0.5242
 epoch: 16, train_loss: 0.8175, test_loss: 0.9386, test_f1: 0.5101
 epoch: 17, train_loss: 0.8155, test_loss: 0.9439, test_f1: 0.5104
 epoch: 18, train_loss: 0.8065, test_loss: 0.9454, test_f1: 0.5333
 epoch: 19, train_loss: 0.8039, test_loss: 0.9369, test_f1: 0.5297
 epoch: 20, train_loss: 0.7957, test_loss: 0.9600, test_f1: 0.4938
 epoch: 21, train_loss: 0.7876, test_loss: 0.9709, test_f1: 0.5276
 epoch: 22, train_loss: 0.7717, test_loss: 0.9961, test_f1: 0.5142
 epoch: 23, train_loss: 0.7812, test_loss: 0.9846, test_f1: 0.5238
 epoch: 24, train_loss: 0.7643, test_loss: 0.9560, test_f1: 0.5476
 epoch: 25, train_loss: 0.7539, test_loss: 0.8845, test_f1: 0.5544
 epoch: 26, train_loss: 0.7517, test_loss: 0.9274, test_f1: 0.5350
 epoch: 27, train_loss: 0.7575, test_loss: 0.9813, test_f1: 0.5055
 epoch: 28, train_loss: 0.7350, test_loss: 0.8932, test_f1: 0.5506
 epoch: 29, train_loss: 0.7187, test_loss: 0.9727, test_f1: 0.5439
 epoch: 30, train_loss: 0.7226, test_loss: 0.9019, test_f1: 0.5438
 epoch: 31, train_loss: 0.7216, test_loss: 0.8699, test_f1: 0.5365
 epoch: 32, train_loss: 0.7176, test_loss: 0.9916, test_f1: 0.5369
 epoch: 33, train_loss: 0.7159, test_loss: 0.9463, test_f1: 0.5379
 epoch: 34, train_loss: 0.7041, test_loss: 0.9438, test_f1: 0.5682
 epoch: 35, train_loss: 0.6937, test_loss: 0.9434, test_f1: 0.5356
 epoch: 36, train_loss: 0.7050, test_loss: 0.8974, test_f1: 0.5784
 epoch: 37, train_loss: 0.6926, test_loss: 0.9554, test_f1: 0.5577
 epoch: 38, train_loss: 0.7101, test_loss: 1.1514, test_f1: 0.5433
 epoch: 39, train_loss: 0.6895, test_loss: 0.9463, test_f1: 0.5678
 epoch: 40, train_loss: 0.6803, test_loss: 0.9340, test_f1: 0.5523
 epoch: 41, train_loss: 0.6719, test_loss: 0.8797, test_f1: 0.5665
 epoch: 42, train_loss: 0.6556, test_loss: 0.9542, test_f1: 0.5466
 epoch: 43, train_loss: 0.6579, test_loss: 0.9012, test_f1: 0.5713
 epoch: 44, train_loss: 0.6607, test_loss: 0.9261, test_f1: 0.5593
 epoch: 45, train_loss: 0.6631, test_loss: 0.9866, test_f1: 0.5476
 epoch: 46, train_loss: 0.6534, test_loss: 0.9010, test_f1: 0.5813
 epoch: 47, train_loss: 0.6482, test_loss: 0.9071, test_f1: 0.5713
 epoch: 48, train_loss: 0.6468, test_loss: 0.8708, test_f1: 0.5991
 epoch: 49, train_loss: 0.6508, test_loss: 0.9910, test_f1: 0.5390
 epoch: 50, train_loss: 0.6560, test_loss: 0.9277, test_f1: 0.5811
 epoch: 51, train_loss: 0.6159, test_loss: 0.9077, test_f1: 0.5799
 epoch: 52, train_loss: 0.6182, test_loss: 1.0055, test_f1: 0.5803
 epoch: 53, train_loss: 0.5990, test_loss: 0.9338, test_f1: 0.5836
 epoch: 54, train_loss: 0.6050, test_loss: 0.9301, test_f1: 0.5771
 epoch: 55, train_loss: 0.5998, test_loss: 0.9409, test_f1: 0.5959
 epoch: 56, train_loss: 0.5940, test_loss: 0.9351, test_f1: 0.5934
 epoch: 57, train_loss: 0.5901, test_loss: 0.9764, test_f1: 0.5848
 epoch: 58, train_loss: 0.5777, test_loss: 0.9433, test_f1: 0.5886
 epoch: 59, train_loss: 0.5868, test_loss: 0.9384, test_f1: 0.5915
 epoch: 60, train_loss: 0.5860, test_loss: 0.9720, test_f1: 0.6032
 epoch: 61, train_loss: 0.5739, test_loss: 0.9117, test_f1: 0.5745
 epoch: 62, train_loss: 0.5703, test_loss: 0.8966, test_f1: 0.6179
 epoch: 63, train_loss: 0.5608, test_loss: 0.9597, test_f1: 0.6095
 epoch: 64, train_loss: 0.5666, test_loss: 0.9534, test_f1: 0.6105
 epoch: 65, train_loss: 0.5602, test_loss: 0.9303, test_f1: 0.6228
 epoch: 66, train_loss: 0.5721, test_loss: 0.9051, test_f1: 0.6276
 epoch: 67, train_loss: 0.5644, test_loss: 0.9835, test_f1: 0.5900
 epoch: 68, train_loss: 0.5670, test_loss: 0.9337, test_f1: 0.6025
 epoch: 69, train_loss: 0.5539, test_loss: 0.9402, test_f1: 0.6014
 epoch: 70, train_loss: 0.5572, test_loss: 0.9508, test_f1: 0.5972
 epoch: 71, train_loss: 0.5591, test_loss: 0.9544, test_f1: 0.6124
 epoch: 72, train_loss: 0.5550, test_loss: 0.9496, test_f1: 0.6040
 epoch: 73, train_loss: 0.5397, test_loss: 0.9282, test_f1: 0.6443
 epoch: 74, train_loss: 0.5483, test_loss: 0.9857, test_f1: 0.5965
 epoch: 75, train_loss: 0.5400, test_loss: 0.9377, test_f1: 0.5965
 epoch: 76, train_loss: 0.5445, test_loss: 1.0102, test_f1: 0.6017
 epoch: 77, train_loss: 0.5458, test_loss: 0.9418, test_f1: 0.6097
 epoch: 78, train_loss: 0.5425, test_loss: 0.9523, test_f1: 0.5929
 epoch: 79, train_loss: 0.5320, test_loss: 0.9267, test_f1: 0.6067
 epoch: 80, train_loss: 0.5279, test_loss: 0.9867, test_f1: 0.5930
 epoch: 81, train_loss: 0.5318, test_loss: 0.9583, test_f1: 0.5989
 epoch: 82, train_loss: 0.5332, test_loss: 1.0482, test_f1: 0.5884
 epoch: 83, train_loss: 0.5197, test_loss: 0.9616, test_f1: 0.6026
 epoch: 84, train_loss: 0.5209, test_loss: 0.9437, test_f1: 0.6391
 epoch: 85, train_loss: 0.5301, test_loss: 0.9776, test_f1: 0.6255
 epoch: 86, train_loss: 0.5386, test_loss: 0.9498, test_f1: 0.6092
 epoch: 87, train_loss: 0.5215, test_loss: 0.9953, test_f1: 0.6141
 epoch: 88, train_loss: 0.5172, test_loss: 0.9236, test_f1: 0.6279
 epoch: 89, train_loss: 0.5077, test_loss: 0.9766, test_f1: 0.5991
 epoch: 90, train_loss: 0.5092, test_loss: 0.9287, test_f1: 0.6336
 epoch: 91, train_loss: 0.5114, test_loss: 0.9335, test_f1: 0.6325
 epoch: 92, train_loss: 0.5154, test_loss: 0.9397, test_f1: 0.6094
 epoch: 93, train_loss: 0.5123, test_loss: 0.9627, test_f1: 0.6154
 epoch: 94, train_loss: 0.5079, test_loss: 0.9773, test_f1: 0.6237
 epoch: 95, train_loss: 0.4934, test_loss: 0.9882, test_f1: 0.6108
 epoch: 96, train_loss: 0.4980, test_loss: 0.9730, test_f1: 0.6251
 epoch: 97, train_loss: 0.4907, test_loss: 1.0075, test_f1: 0.5922
 epoch: 98, train_loss: 0.5130, test_loss: 1.0727, test_f1: 0.5849
 epoch: 99, train_loss: 0.5002, test_loss: 0.9241, test_f1: 0.6332
##################ITERATION #6 ****************************************
 epoch: 0, train_loss: 1.4132, test_loss: 1.3869, test_f1: 0.2260
 epoch: 1, train_loss: 1.1574, test_loss: 1.3351, test_f1: 0.2796
 epoch: 2, train_loss: 1.0922, test_loss: 1.3129, test_f1: 0.2719
 epoch: 3, train_loss: 1.0550, test_loss: 1.0774, test_f1: 0.4429
 epoch: 4, train_loss: 1.0300, test_loss: 0.9932, test_f1: 0.4685
 epoch: 5, train_loss: 1.0172, test_loss: 0.9594, test_f1: 0.4966
 epoch: 6, train_loss: 0.9923, test_loss: 0.9399, test_f1: 0.5141
 epoch: 7, train_loss: 0.9775, test_loss: 0.9373, test_f1: 0.5218
 epoch: 8, train_loss: 0.9669, test_loss: 0.9222, test_f1: 0.5164
 epoch: 9, train_loss: 0.9464, test_loss: 0.9480, test_f1: 0.5169
 epoch: 10, train_loss: 0.9253, test_loss: 0.9115, test_f1: 0.5301
 epoch: 11, train_loss: 0.9183, test_loss: 0.9052, test_f1: 0.5219
 epoch: 12, train_loss: 0.9150, test_loss: 0.8894, test_f1: 0.5364
 epoch: 13, train_loss: 0.8990, test_loss: 0.8842, test_f1: 0.5325
 epoch: 14, train_loss: 0.8897, test_loss: 0.8634, test_f1: 0.5253
 epoch: 15, train_loss: 0.8797, test_loss: 0.9010, test_f1: 0.5269
 epoch: 16, train_loss: 0.8771, test_loss: 0.9182, test_f1: 0.5562
 epoch: 17, train_loss: 0.8556, test_loss: 0.8934, test_f1: 0.5404
 epoch: 18, train_loss: 0.8596, test_loss: 0.8846, test_f1: 0.5525
 epoch: 19, train_loss: 0.8500, test_loss: 0.8701, test_f1: 0.5429
 epoch: 20, train_loss: 0.8404, test_loss: 0.8310, test_f1: 0.5632
 epoch: 21, train_loss: 0.8361, test_loss: 0.8284, test_f1: 0.5826
 epoch: 22, train_loss: 0.8187, test_loss: 0.8094, test_f1: 0.5747
 epoch: 23, train_loss: 0.8127, test_loss: 0.8806, test_f1: 0.5541
 epoch: 24, train_loss: 0.8225, test_loss: 0.8916, test_f1: 0.5623
 epoch: 25, train_loss: 0.8156, test_loss: 0.8254, test_f1: 0.5632
 epoch: 26, train_loss: 0.7959, test_loss: 0.8736, test_f1: 0.5751
 epoch: 27, train_loss: 0.7881, test_loss: 0.8295, test_f1: 0.5465
 epoch: 28, train_loss: 0.7892, test_loss: 0.9539, test_f1: 0.5592
 epoch: 29, train_loss: 0.7882, test_loss: 0.8253, test_f1: 0.5797
 epoch: 30, train_loss: 0.7697, test_loss: 0.8560, test_f1: 0.5708
 epoch: 31, train_loss: 0.7620, test_loss: 0.8977, test_f1: 0.5499
 epoch: 32, train_loss: 0.7645, test_loss: 0.8451, test_f1: 0.5531
 epoch: 33, train_loss: 0.7568, test_loss: 0.8959, test_f1: 0.5623
 epoch: 34, train_loss: 0.7495, test_loss: 0.8569, test_f1: 0.5762
 epoch: 35, train_loss: 0.7410, test_loss: 0.8986, test_f1: 0.5673
 epoch: 36, train_loss: 0.7298, test_loss: 0.8933, test_f1: 0.5620
 epoch: 37, train_loss: 0.7323, test_loss: 0.8964, test_f1: 0.5646
 epoch: 38, train_loss: 0.7181, test_loss: 0.8783, test_f1: 0.5761
 epoch: 39, train_loss: 0.7157, test_loss: 0.9016, test_f1: 0.5581
 epoch: 40, train_loss: 0.7084, test_loss: 0.9505, test_f1: 0.5585
 epoch: 41, train_loss: 0.7083, test_loss: 0.9232, test_f1: 0.5250
 epoch: 42, train_loss: 0.7191, test_loss: 0.9313, test_f1: 0.5752
 epoch: 43, train_loss: 0.7164, test_loss: 0.8800, test_f1: 0.5544
 epoch: 44, train_loss: 0.7039, test_loss: 0.9185, test_f1: 0.5703
 epoch: 45, train_loss: 0.6947, test_loss: 0.8998, test_f1: 0.5769
 epoch: 46, train_loss: 0.6752, test_loss: 0.9182, test_f1: 0.5914
 epoch: 47, train_loss: 0.6899, test_loss: 0.9031, test_f1: 0.5641
 epoch: 48, train_loss: 0.6912, test_loss: 0.9064, test_f1: 0.5731
 epoch: 49, train_loss: 0.6742, test_loss: 0.9285, test_f1: 0.5653
 epoch: 50, train_loss: 0.6866, test_loss: 0.9377, test_f1: 0.5832
 epoch: 51, train_loss: 0.6548, test_loss: 0.8913, test_f1: 0.5866
 epoch: 52, train_loss: 0.6495, test_loss: 0.9394, test_f1: 0.5701
 epoch: 53, train_loss: 0.6354, test_loss: 0.9140, test_f1: 0.5735
 epoch: 54, train_loss: 0.6422, test_loss: 0.9455, test_f1: 0.5741
 epoch: 55, train_loss: 0.6376, test_loss: 0.8991, test_f1: 0.5802
 epoch: 56, train_loss: 0.6218, test_loss: 0.9116, test_f1: 0.5752
 epoch: 57, train_loss: 0.6333, test_loss: 0.8731, test_f1: 0.5817
 epoch: 58, train_loss: 0.6319, test_loss: 0.9141, test_f1: 0.5765
 epoch: 59, train_loss: 0.6266, test_loss: 0.9439, test_f1: 0.5761
 epoch: 60, train_loss: 0.6378, test_loss: 0.9032, test_f1: 0.5877
 epoch: 61, train_loss: 0.6141, test_loss: 0.9545, test_f1: 0.5689
 epoch: 62, train_loss: 0.6056, test_loss: 0.9826, test_f1: 0.5760
 epoch: 63, train_loss: 0.6217, test_loss: 0.8991, test_f1: 0.5763
 epoch: 64, train_loss: 0.6155, test_loss: 0.9596, test_f1: 0.5576
 epoch: 65, train_loss: 0.6105, test_loss: 0.9571, test_f1: 0.5775
 epoch: 66, train_loss: 0.6068, test_loss: 0.9782, test_f1: 0.5861
 epoch: 67, train_loss: 0.6032, test_loss: 0.9689, test_f1: 0.5865
 epoch: 68, train_loss: 0.6141, test_loss: 0.9306, test_f1: 0.5761
 epoch: 69, train_loss: 0.6070, test_loss: 0.9340, test_f1: 0.5763
 epoch: 70, train_loss: 0.5919, test_loss: 0.8993, test_f1: 0.5826
 epoch: 71, train_loss: 0.5932, test_loss: 0.9117, test_f1: 0.5730
 epoch: 72, train_loss: 0.6081, test_loss: 0.9049, test_f1: 0.5805
 epoch: 73, train_loss: 0.5840, test_loss: 0.9079, test_f1: 0.5888
 epoch: 74, train_loss: 0.5901, test_loss: 0.9410, test_f1: 0.5794
 epoch: 75, train_loss: 0.5991, test_loss: 0.9432, test_f1: 0.5804
 epoch: 76, train_loss: 0.5767, test_loss: 0.9121, test_f1: 0.5915
 epoch: 77, train_loss: 0.5825, test_loss: 0.9313, test_f1: 0.5682
 epoch: 78, train_loss: 0.5931, test_loss: 0.9953, test_f1: 0.5841
 epoch: 79, train_loss: 0.5776, test_loss: 0.9218, test_f1: 0.5803
 epoch: 80, train_loss: 0.5797, test_loss: 0.9662, test_f1: 0.5475
 epoch: 81, train_loss: 0.5823, test_loss: 0.9030, test_f1: 0.5941
 epoch: 82, train_loss: 0.5594, test_loss: 0.9556, test_f1: 0.5848
 epoch: 83, train_loss: 0.5773, test_loss: 0.8694, test_f1: 0.5896
 epoch: 84, train_loss: 0.5668, test_loss: 0.9682, test_f1: 0.5650
 epoch: 85, train_loss: 0.5648, test_loss: 0.9996, test_f1: 0.5726
 epoch: 86, train_loss: 0.5584, test_loss: 1.0156, test_f1: 0.5841
 epoch: 87, train_loss: 0.5748, test_loss: 0.9413, test_f1: 0.6097
 epoch: 88, train_loss: 0.5550, test_loss: 0.9783, test_f1: 0.5960
 epoch: 89, train_loss: 0.5744, test_loss: 1.0015, test_f1: 0.5684
 epoch: 90, train_loss: 0.5537, test_loss: 0.9462, test_f1: 0.5902
 epoch: 91, train_loss: 0.5687, test_loss: 0.9611, test_f1: 0.6120
 epoch: 92, train_loss: 0.5474, test_loss: 0.9725, test_f1: 0.5889
 epoch: 93, train_loss: 0.5358, test_loss: 0.9842, test_f1: 0.5840
 epoch: 94, train_loss: 0.5419, test_loss: 0.9579, test_f1: 0.6049
 epoch: 95, train_loss: 0.5463, test_loss: 0.9377, test_f1: 0.5849
 epoch: 96, train_loss: 0.5408, test_loss: 0.9826, test_f1: 0.5978
 epoch: 97, train_loss: 0.5353, test_loss: 0.9768, test_f1: 0.6137
 epoch: 98, train_loss: 0.5503, test_loss: 0.9653, test_f1: 0.5868
 epoch: 99, train_loss: 0.5461, test_loss: 0.9808, test_f1: 0.6124
##################ITERATION #7 ****************************************
 epoch: 0, train_loss: 1.3860, test_loss: 1.4044, test_f1: 0.2260
 epoch: 1, train_loss: 1.1953, test_loss: 1.3402, test_f1: 0.2260
 epoch: 2, train_loss: 1.1235, test_loss: 1.2082, test_f1: 0.2688
 epoch: 3, train_loss: 1.0538, test_loss: 1.0673, test_f1: 0.3879
 epoch: 4, train_loss: 1.0415, test_loss: 1.0119, test_f1: 0.4581
 epoch: 5, train_loss: 1.0205, test_loss: 1.0094, test_f1: 0.4518
 epoch: 6, train_loss: 0.9891, test_loss: 0.9989, test_f1: 0.4791
 epoch: 7, train_loss: 0.9551, test_loss: 0.9708, test_f1: 0.4912
 epoch: 8, train_loss: 0.9496, test_loss: 0.9705, test_f1: 0.4899
 epoch: 9, train_loss: 0.9317, test_loss: 0.9243, test_f1: 0.5122
 epoch: 10, train_loss: 0.9249, test_loss: 0.9804, test_f1: 0.5064
 epoch: 11, train_loss: 0.9057, test_loss: 0.9745, test_f1: 0.5028
 epoch: 12, train_loss: 0.8946, test_loss: 1.0019, test_f1: 0.5001
 epoch: 13, train_loss: 0.8893, test_loss: 0.9711, test_f1: 0.5066
 epoch: 14, train_loss: 0.8778, test_loss: 0.9766, test_f1: 0.5118
 epoch: 15, train_loss: 0.8564, test_loss: 0.9583, test_f1: 0.5259
 epoch: 16, train_loss: 0.8420, test_loss: 0.9798, test_f1: 0.5340
 epoch: 17, train_loss: 0.8435, test_loss: 0.9456, test_f1: 0.5119
 epoch: 18, train_loss: 0.8301, test_loss: 0.9980, test_f1: 0.5165
 epoch: 19, train_loss: 0.8243, test_loss: 0.9682, test_f1: 0.5147
 epoch: 20, train_loss: 0.8103, test_loss: 0.9360, test_f1: 0.5433
 epoch: 21, train_loss: 0.7946, test_loss: 1.0261, test_f1: 0.5008
 epoch: 22, train_loss: 0.7930, test_loss: 0.9537, test_f1: 0.5159
 epoch: 23, train_loss: 0.7850, test_loss: 1.0168, test_f1: 0.5350
 epoch: 24, train_loss: 0.7862, test_loss: 0.9260, test_f1: 0.5301
 epoch: 25, train_loss: 0.7807, test_loss: 1.0222, test_f1: 0.5472
 epoch: 26, train_loss: 0.7779, test_loss: 0.9225, test_f1: 0.5510
 epoch: 27, train_loss: 0.7759, test_loss: 1.0257, test_f1: 0.5271
 epoch: 28, train_loss: 0.7679, test_loss: 0.9227, test_f1: 0.5495
 epoch: 29, train_loss: 0.7531, test_loss: 0.9745, test_f1: 0.5306
 epoch: 30, train_loss: 0.7678, test_loss: 0.9085, test_f1: 0.5554
 epoch: 31, train_loss: 0.7426, test_loss: 0.9632, test_f1: 0.5292
 epoch: 32, train_loss: 0.7444, test_loss: 0.9933, test_f1: 0.5275
 epoch: 33, train_loss: 0.7345, test_loss: 0.9718, test_f1: 0.5195
 epoch: 34, train_loss: 0.7243, test_loss: 0.9581, test_f1: 0.5563
 epoch: 35, train_loss: 0.7346, test_loss: 0.9446, test_f1: 0.5234
 epoch: 36, train_loss: 0.7201, test_loss: 0.9405, test_f1: 0.5461
 epoch: 37, train_loss: 0.7192, test_loss: 0.9208, test_f1: 0.5480
 epoch: 38, train_loss: 0.7003, test_loss: 0.9411, test_f1: 0.5520
 epoch: 39, train_loss: 0.7138, test_loss: 0.9771, test_f1: 0.5429
 epoch: 40, train_loss: 0.7027, test_loss: 0.9999, test_f1: 0.5142
 epoch: 41, train_loss: 0.7138, test_loss: 0.9960, test_f1: 0.5462
 epoch: 42, train_loss: 0.7094, test_loss: 0.9983, test_f1: 0.5443
 epoch: 43, train_loss: 0.7002, test_loss: 0.9346, test_f1: 0.5503
 epoch: 44, train_loss: 0.6737, test_loss: 0.9670, test_f1: 0.5432
 epoch: 45, train_loss: 0.6802, test_loss: 1.0053, test_f1: 0.5466
 epoch: 46, train_loss: 0.6767, test_loss: 0.9621, test_f1: 0.5689
 epoch: 47, train_loss: 0.6680, test_loss: 0.9023, test_f1: 0.6012
 epoch: 48, train_loss: 0.6747, test_loss: 0.9214, test_f1: 0.5666
 epoch: 49, train_loss: 0.6699, test_loss: 0.9554, test_f1: 0.5792
 epoch: 50, train_loss: 0.6592, test_loss: 0.9321, test_f1: 0.5772
 epoch: 51, train_loss: 0.6552, test_loss: 0.9575, test_f1: 0.5559
 epoch: 52, train_loss: 0.6487, test_loss: 0.9651, test_f1: 0.5585
 epoch: 53, train_loss: 0.6394, test_loss: 0.9341, test_f1: 0.5794
 epoch: 54, train_loss: 0.6261, test_loss: 0.9593, test_f1: 0.5671
 epoch: 55, train_loss: 0.6364, test_loss: 0.9445, test_f1: 0.5860
 epoch: 56, train_loss: 0.6255, test_loss: 0.9684, test_f1: 0.5560
 epoch: 57, train_loss: 0.6339, test_loss: 0.9258, test_f1: 0.5820
 epoch: 58, train_loss: 0.6198, test_loss: 0.9559, test_f1: 0.5807
 epoch: 59, train_loss: 0.6106, test_loss: 0.9148, test_f1: 0.5841
 epoch: 60, train_loss: 0.6192, test_loss: 0.9462, test_f1: 0.5481
 epoch: 61, train_loss: 0.5970, test_loss: 0.9652, test_f1: 0.5842
 epoch: 62, train_loss: 0.6100, test_loss: 0.9513, test_f1: 0.5913
 epoch: 63, train_loss: 0.6141, test_loss: 0.9841, test_f1: 0.5644
 epoch: 64, train_loss: 0.6248, test_loss: 0.9606, test_f1: 0.5735
 epoch: 65, train_loss: 0.6086, test_loss: 0.9621, test_f1: 0.5706
 epoch: 66, train_loss: 0.6096, test_loss: 0.9882, test_f1: 0.5488
 epoch: 67, train_loss: 0.5920, test_loss: 0.9555, test_f1: 0.5832
 epoch: 68, train_loss: 0.5996, test_loss: 1.0129, test_f1: 0.5654
 epoch: 69, train_loss: 0.6081, test_loss: 0.9809, test_f1: 0.5919
 epoch: 70, train_loss: 0.5878, test_loss: 0.9693, test_f1: 0.5957
 epoch: 71, train_loss: 0.5904, test_loss: 0.9936, test_f1: 0.6139
 epoch: 72, train_loss: 0.5904, test_loss: 0.9747, test_f1: 0.6015
 epoch: 73, train_loss: 0.5882, test_loss: 0.9654, test_f1: 0.5733
 epoch: 74, train_loss: 0.6014, test_loss: 1.0223, test_f1: 0.5779
 epoch: 75, train_loss: 0.5888, test_loss: 0.9920, test_f1: 0.5886
 epoch: 76, train_loss: 0.5780, test_loss: 0.9581, test_f1: 0.5942
 epoch: 77, train_loss: 0.5991, test_loss: 1.0140, test_f1: 0.6145
 epoch: 78, train_loss: 0.5869, test_loss: 0.9600, test_f1: 0.5810
 epoch: 79, train_loss: 0.5819, test_loss: 1.0442, test_f1: 0.5626
 epoch: 80, train_loss: 0.5696, test_loss: 0.9809, test_f1: 0.5949
 epoch: 81, train_loss: 0.5636, test_loss: 0.9807, test_f1: 0.6077
 epoch: 82, train_loss: 0.5774, test_loss: 1.0036, test_f1: 0.5786
 epoch: 83, train_loss: 0.5687, test_loss: 0.9602, test_f1: 0.6126
 epoch: 84, train_loss: 0.5644, test_loss: 1.0243, test_f1: 0.6000
 epoch: 85, train_loss: 0.5712, test_loss: 0.9535, test_f1: 0.5861
 epoch: 86, train_loss: 0.5529, test_loss: 0.9710, test_f1: 0.6194
 epoch: 87, train_loss: 0.5553, test_loss: 1.0026, test_f1: 0.6034
 epoch: 88, train_loss: 0.5671, test_loss: 0.9568, test_f1: 0.6148
 epoch: 89, train_loss: 0.5596, test_loss: 1.0326, test_f1: 0.6093
 epoch: 90, train_loss: 0.5543, test_loss: 0.9810, test_f1: 0.6140
 epoch: 91, train_loss: 0.5621, test_loss: 1.0416, test_f1: 0.6097
 epoch: 92, train_loss: 0.5621, test_loss: 1.0196, test_f1: 0.5777
 epoch: 93, train_loss: 0.5673, test_loss: 1.0443, test_f1: 0.5994
 epoch: 94, train_loss: 0.5601, test_loss: 0.9827, test_f1: 0.6010
 epoch: 95, train_loss: 0.5602, test_loss: 1.1461, test_f1: 0.5814
 epoch: 96, train_loss: 0.5571, test_loss: 1.0117, test_f1: 0.6010
 epoch: 97, train_loss: 0.5483, test_loss: 1.0066, test_f1: 0.6174
 epoch: 98, train_loss: 0.5451, test_loss: 0.9830, test_f1: 0.6243
 epoch: 99, train_loss: 0.5417, test_loss: 0.9714, test_f1: 0.6075
##################ITERATION #8 ****************************************
 epoch: 0, train_loss: 1.2819, test_loss: 1.4581, test_f1: 0.2260
 epoch: 1, train_loss: 1.1078, test_loss: 1.2909, test_f1: 0.2260
 epoch: 2, train_loss: 1.0405, test_loss: 1.1640, test_f1: 0.3201
 epoch: 3, train_loss: 0.9978, test_loss: 1.0458, test_f1: 0.3506
 epoch: 4, train_loss: 0.9711, test_loss: 0.9892, test_f1: 0.4546
 epoch: 5, train_loss: 0.9634, test_loss: 0.9758, test_f1: 0.4779
 epoch: 6, train_loss: 0.9466, test_loss: 0.9598, test_f1: 0.5118
 epoch: 7, train_loss: 0.9231, test_loss: 0.9357, test_f1: 0.4784
 epoch: 8, train_loss: 0.9089, test_loss: 0.9736, test_f1: 0.4603
 epoch: 9, train_loss: 0.8913, test_loss: 0.9374, test_f1: 0.5013
 epoch: 10, train_loss: 0.8795, test_loss: 0.9202, test_f1: 0.4993
 epoch: 11, train_loss: 0.8684, test_loss: 0.9292, test_f1: 0.5166
 epoch: 12, train_loss: 0.8585, test_loss: 0.9364, test_f1: 0.5149
 epoch: 13, train_loss: 0.8484, test_loss: 0.9058, test_f1: 0.5156
 epoch: 14, train_loss: 0.8476, test_loss: 0.9571, test_f1: 0.5197
 epoch: 15, train_loss: 0.8321, test_loss: 0.8846, test_f1: 0.5218
 epoch: 16, train_loss: 0.8302, test_loss: 0.8946, test_f1: 0.5345
 epoch: 17, train_loss: 0.8182, test_loss: 0.8915, test_f1: 0.5225
 epoch: 18, train_loss: 0.8169, test_loss: 0.8893, test_f1: 0.5351
 epoch: 19, train_loss: 0.8090, test_loss: 0.9141, test_f1: 0.5052
 epoch: 20, train_loss: 0.8012, test_loss: 0.9018, test_f1: 0.5251
 epoch: 21, train_loss: 0.7808, test_loss: 0.9029, test_f1: 0.5383
 epoch: 22, train_loss: 0.7706, test_loss: 0.9358, test_f1: 0.5352
 epoch: 23, train_loss: 0.7892, test_loss: 0.9045, test_f1: 0.5594
 epoch: 24, train_loss: 0.7727, test_loss: 0.9180, test_f1: 0.5297
 epoch: 25, train_loss: 0.7636, test_loss: 0.9362, test_f1: 0.4944
 epoch: 26, train_loss: 0.7633, test_loss: 0.9011, test_f1: 0.5516
 epoch: 27, train_loss: 0.7691, test_loss: 0.8973, test_f1: 0.5479
 epoch: 28, train_loss: 0.7643, test_loss: 0.9304, test_f1: 0.5664
 epoch: 29, train_loss: 0.7476, test_loss: 0.8933, test_f1: 0.5316
 epoch: 30, train_loss: 0.7383, test_loss: 0.8963, test_f1: 0.5480
 epoch: 31, train_loss: 0.7332, test_loss: 0.8607, test_f1: 0.5465
 epoch: 32, train_loss: 0.7290, test_loss: 0.8961, test_f1: 0.5616
 epoch: 33, train_loss: 0.7205, test_loss: 0.9289, test_f1: 0.5241
 epoch: 34, train_loss: 0.7107, test_loss: 0.9334, test_f1: 0.5450
 epoch: 35, train_loss: 0.7141, test_loss: 0.9003, test_f1: 0.5393
 epoch: 36, train_loss: 0.7145, test_loss: 0.9144, test_f1: 0.5436
 epoch: 37, train_loss: 0.6925, test_loss: 0.9415, test_f1: 0.5260
 epoch: 38, train_loss: 0.6940, test_loss: 0.9111, test_f1: 0.5713
 epoch: 39, train_loss: 0.6884, test_loss: 0.9010, test_f1: 0.5679
 epoch: 40, train_loss: 0.6885, test_loss: 0.9920, test_f1: 0.5351
 epoch: 41, train_loss: 0.6796, test_loss: 0.8957, test_f1: 0.5792
 epoch: 42, train_loss: 0.6879, test_loss: 0.9314, test_f1: 0.5579
 epoch: 43, train_loss: 0.6847, test_loss: 0.9372, test_f1: 0.5605
 epoch: 44, train_loss: 0.6871, test_loss: 0.9087, test_f1: 0.5377
 epoch: 45, train_loss: 0.6809, test_loss: 0.9300, test_f1: 0.5853
 epoch: 46, train_loss: 0.6625, test_loss: 0.9325, test_f1: 0.5576
 epoch: 47, train_loss: 0.6689, test_loss: 0.9050, test_f1: 0.5781
 epoch: 48, train_loss: 0.6604, test_loss: 0.9955, test_f1: 0.5303
 epoch: 49, train_loss: 0.6662, test_loss: 0.9273, test_f1: 0.5527
 epoch: 50, train_loss: 0.6533, test_loss: 0.8755, test_f1: 0.5720
 epoch: 51, train_loss: 0.6403, test_loss: 0.9434, test_f1: 0.5747
 epoch: 52, train_loss: 0.6364, test_loss: 0.9165, test_f1: 0.5667
 epoch: 53, train_loss: 0.6345, test_loss: 0.9352, test_f1: 0.5914
 epoch: 54, train_loss: 0.6169, test_loss: 0.9083, test_f1: 0.5915
 epoch: 55, train_loss: 0.6235, test_loss: 0.9129, test_f1: 0.5858
 epoch: 56, train_loss: 0.6111, test_loss: 0.9558, test_f1: 0.5717
 epoch: 57, train_loss: 0.6149, test_loss: 0.9092, test_f1: 0.5804
 epoch: 58, train_loss: 0.6152, test_loss: 0.9552, test_f1: 0.5631
 epoch: 59, train_loss: 0.6120, test_loss: 0.9090, test_f1: 0.5511
 epoch: 60, train_loss: 0.6153, test_loss: 0.9584, test_f1: 0.5701
 epoch: 61, train_loss: 0.6008, test_loss: 0.8928, test_f1: 0.6101
 epoch: 62, train_loss: 0.5989, test_loss: 0.9253, test_f1: 0.5765
 epoch: 63, train_loss: 0.6031, test_loss: 0.9061, test_f1: 0.5911
 epoch: 64, train_loss: 0.6034, test_loss: 0.9343, test_f1: 0.5852
 epoch: 65, train_loss: 0.5957, test_loss: 0.9788, test_f1: 0.5658
 epoch: 66, train_loss: 0.6091, test_loss: 0.9105, test_f1: 0.6099
 epoch: 67, train_loss: 0.5941, test_loss: 0.9347, test_f1: 0.6106
 epoch: 68, train_loss: 0.5901, test_loss: 0.9305, test_f1: 0.6051
 epoch: 69, train_loss: 0.5896, test_loss: 0.9332, test_f1: 0.5911
 epoch: 70, train_loss: 0.6017, test_loss: 0.9721, test_f1: 0.5879
 epoch: 71, train_loss: 0.5837, test_loss: 0.9479, test_f1: 0.5983
 epoch: 72, train_loss: 0.5947, test_loss: 0.9154, test_f1: 0.5848
 epoch: 73, train_loss: 0.5790, test_loss: 0.9261, test_f1: 0.5800
 epoch: 74, train_loss: 0.5860, test_loss: 0.9162, test_f1: 0.6012
 epoch: 75, train_loss: 0.5824, test_loss: 0.8935, test_f1: 0.5972
 epoch: 76, train_loss: 0.5798, test_loss: 0.9134, test_f1: 0.5938
 epoch: 77, train_loss: 0.5780, test_loss: 1.0026, test_f1: 0.5474
 epoch: 78, train_loss: 0.5752, test_loss: 0.9805, test_f1: 0.5432
 epoch: 79, train_loss: 0.5706, test_loss: 0.8466, test_f1: 0.6222
 epoch: 80, train_loss: 0.5715, test_loss: 0.9125, test_f1: 0.5936
 epoch: 81, train_loss: 0.5754, test_loss: 0.9017, test_f1: 0.5920
 epoch: 82, train_loss: 0.5745, test_loss: 0.9426, test_f1: 0.5778
 epoch: 83, train_loss: 0.5675, test_loss: 0.8952, test_f1: 0.5930
 epoch: 84, train_loss: 0.5669, test_loss: 0.9188, test_f1: 0.5956
 epoch: 85, train_loss: 0.5606, test_loss: 0.9100, test_f1: 0.6035
 epoch: 86, train_loss: 0.5683, test_loss: 0.8693, test_f1: 0.6062
 epoch: 87, train_loss: 0.5608, test_loss: 0.9491, test_f1: 0.5839
 epoch: 88, train_loss: 0.5556, test_loss: 0.9262, test_f1: 0.6088
 epoch: 89, train_loss: 0.5487, test_loss: 0.9264, test_f1: 0.5792
 epoch: 90, train_loss: 0.5534, test_loss: 1.0225, test_f1: 0.5539
 epoch: 91, train_loss: 0.5575, test_loss: 0.9573, test_f1: 0.5886
 epoch: 92, train_loss: 0.5519, test_loss: 0.9228, test_f1: 0.5894
 epoch: 93, train_loss: 0.5510, test_loss: 0.9996, test_f1: 0.5694
 epoch: 94, train_loss: 0.5494, test_loss: 0.9340, test_f1: 0.5816
 epoch: 95, train_loss: 0.5437, test_loss: 0.9675, test_f1: 0.5857
 epoch: 96, train_loss: 0.5334, test_loss: 0.9270, test_f1: 0.5849
 epoch: 97, train_loss: 0.5240, test_loss: 0.9425, test_f1: 0.6081
 epoch: 98, train_loss: 0.5457, test_loss: 0.9891, test_f1: 0.5888
 epoch: 99, train_loss: 0.5478, test_loss: 1.0134, test_f1: 0.5741
##################ITERATION #9 ****************************************
 epoch: 0, train_loss: 1.4382, test_loss: 1.3907, test_f1: 0.2585
 epoch: 1, train_loss: 1.1385, test_loss: 1.3578, test_f1: 0.2604
 epoch: 2, train_loss: 1.0814, test_loss: 1.2826, test_f1: 0.3454
 epoch: 3, train_loss: 1.0576, test_loss: 1.1937, test_f1: 0.3649
 epoch: 4, train_loss: 1.0291, test_loss: 1.0443, test_f1: 0.4684
 epoch: 5, train_loss: 1.0017, test_loss: 0.9588, test_f1: 0.4863
 epoch: 6, train_loss: 0.9922, test_loss: 0.9490, test_f1: 0.4759
 epoch: 7, train_loss: 0.9685, test_loss: 0.9280, test_f1: 0.5005
 epoch: 8, train_loss: 0.9471, test_loss: 0.9838, test_f1: 0.5207
 epoch: 9, train_loss: 0.9322, test_loss: 0.9762, test_f1: 0.4916
 epoch: 10, train_loss: 0.9125, test_loss: 0.9312, test_f1: 0.5307
 epoch: 11, train_loss: 0.9004, test_loss: 0.8652, test_f1: 0.5373
 epoch: 12, train_loss: 0.8906, test_loss: 0.8638, test_f1: 0.5436
 epoch: 13, train_loss: 0.8728, test_loss: 0.9030, test_f1: 0.5304
 epoch: 14, train_loss: 0.8638, test_loss: 0.9595, test_f1: 0.5374
 epoch: 15, train_loss: 0.8604, test_loss: 0.8697, test_f1: 0.5535
 epoch: 16, train_loss: 0.8330, test_loss: 0.8553, test_f1: 0.5629
 epoch: 17, train_loss: 0.8389, test_loss: 0.9434, test_f1: 0.5450
 epoch: 18, train_loss: 0.8250, test_loss: 0.8773, test_f1: 0.5531
 epoch: 19, train_loss: 0.8230, test_loss: 0.8103, test_f1: 0.5603
 epoch: 20, train_loss: 0.8109, test_loss: 0.8351, test_f1: 0.5686
 epoch: 21, train_loss: 0.8019, test_loss: 0.8053, test_f1: 0.5719
 epoch: 22, train_loss: 0.8011, test_loss: 0.8539, test_f1: 0.5857
 epoch: 23, train_loss: 0.7978, test_loss: 0.7957, test_f1: 0.5959
 epoch: 24, train_loss: 0.7831, test_loss: 0.7810, test_f1: 0.5880
 epoch: 25, train_loss: 0.7805, test_loss: 0.8437, test_f1: 0.5561
 epoch: 26, train_loss: 0.7722, test_loss: 0.8545, test_f1: 0.5575
 epoch: 27, train_loss: 0.7624, test_loss: 0.7598, test_f1: 0.5889
 epoch: 28, train_loss: 0.7673, test_loss: 0.7801, test_f1: 0.5890
 epoch: 29, train_loss: 0.7605, test_loss: 0.7592, test_f1: 0.6097
 epoch: 30, train_loss: 0.7574, test_loss: 0.7702, test_f1: 0.5982
 epoch: 31, train_loss: 0.7546, test_loss: 0.7855, test_f1: 0.5873
 epoch: 32, train_loss: 0.7425, test_loss: 0.7703, test_f1: 0.5870
 epoch: 33, train_loss: 0.7281, test_loss: 0.7826, test_f1: 0.5729
 epoch: 34, train_loss: 0.7239, test_loss: 0.7646, test_f1: 0.5984
 epoch: 35, train_loss: 0.7092, test_loss: 0.7773, test_f1: 0.5998
 epoch: 36, train_loss: 0.7018, test_loss: 0.7706, test_f1: 0.5853
 epoch: 37, train_loss: 0.7080, test_loss: 0.7719, test_f1: 0.5928
 epoch: 38, train_loss: 0.7048, test_loss: 0.7633, test_f1: 0.6033
 epoch: 39, train_loss: 0.6906, test_loss: 0.7569, test_f1: 0.5941
 epoch: 40, train_loss: 0.6854, test_loss: 0.9154, test_f1: 0.5483
 epoch: 41, train_loss: 0.6738, test_loss: 0.9359, test_f1: 0.5504
 epoch: 42, train_loss: 0.6767, test_loss: 0.7598, test_f1: 0.6017
 epoch: 43, train_loss: 0.6672, test_loss: 0.8962, test_f1: 0.5709
 epoch: 44, train_loss: 0.6545, test_loss: 0.7980, test_f1: 0.5903
 epoch: 45, train_loss: 0.6592, test_loss: 0.8367, test_f1: 0.5868
 epoch: 46, train_loss: 0.6658, test_loss: 0.7546, test_f1: 0.6194
 epoch: 47, train_loss: 0.6686, test_loss: 1.0218, test_f1: 0.5597
 epoch: 48, train_loss: 0.6759, test_loss: 0.7522, test_f1: 0.6203
 epoch: 49, train_loss: 0.6478, test_loss: 0.7824, test_f1: 0.5989
 epoch: 50, train_loss: 0.6481, test_loss: 0.7524, test_f1: 0.6013
 epoch: 51, train_loss: 0.6248, test_loss: 0.8140, test_f1: 0.6023
 epoch: 52, train_loss: 0.6064, test_loss: 0.8010, test_f1: 0.5930
 epoch: 53, train_loss: 0.6111, test_loss: 0.8344, test_f1: 0.5887
 epoch: 54, train_loss: 0.6034, test_loss: 0.8583, test_f1: 0.5799
 epoch: 55, train_loss: 0.5911, test_loss: 0.7919, test_f1: 0.5907
 epoch: 56, train_loss: 0.5974, test_loss: 0.7904, test_f1: 0.6245
 epoch: 57, train_loss: 0.5983, test_loss: 0.8778, test_f1: 0.6057
 epoch: 58, train_loss: 0.5866, test_loss: 0.7702, test_f1: 0.6100
 epoch: 59, train_loss: 0.5897, test_loss: 0.8077, test_f1: 0.6118
 epoch: 60, train_loss: 0.5833, test_loss: 0.8379, test_f1: 0.5997
 epoch: 61, train_loss: 0.5753, test_loss: 0.7948, test_f1: 0.6179
 epoch: 62, train_loss: 0.5852, test_loss: 0.8398, test_f1: 0.6008
 epoch: 63, train_loss: 0.5830, test_loss: 0.8770, test_f1: 0.5830
 epoch: 64, train_loss: 0.5761, test_loss: 0.7898, test_f1: 0.6042
 epoch: 65, train_loss: 0.5707, test_loss: 0.7611, test_f1: 0.6363
 epoch: 66, train_loss: 0.5778, test_loss: 0.8720, test_f1: 0.6132
 epoch: 67, train_loss: 0.5750, test_loss: 0.8373, test_f1: 0.6081
 epoch: 68, train_loss: 0.5548, test_loss: 0.7692, test_f1: 0.6187
 epoch: 69, train_loss: 0.5673, test_loss: 0.8541, test_f1: 0.6123
 epoch: 70, train_loss: 0.5612, test_loss: 0.8522, test_f1: 0.6132
 epoch: 71, train_loss: 0.5508, test_loss: 0.8629, test_f1: 0.6332
 epoch: 72, train_loss: 0.5621, test_loss: 0.8162, test_f1: 0.6316
 epoch: 73, train_loss: 0.5570, test_loss: 0.7919, test_f1: 0.6371
 epoch: 74, train_loss: 0.5568, test_loss: 0.8079, test_f1: 0.6211
 epoch: 75, train_loss: 0.5564, test_loss: 0.9957, test_f1: 0.6211
 epoch: 76, train_loss: 0.5435, test_loss: 0.8648, test_f1: 0.6467
 epoch: 77, train_loss: 0.5444, test_loss: 0.8022, test_f1: 0.6391
 epoch: 78, train_loss: 0.5423, test_loss: 0.7987, test_f1: 0.6255
 epoch: 79, train_loss: 0.5460, test_loss: 0.7528, test_f1: 0.6484
 epoch: 80, train_loss: 0.5500, test_loss: 0.8898, test_f1: 0.6142
 epoch: 81, train_loss: 0.5213, test_loss: 0.8076, test_f1: 0.6384
 epoch: 82, train_loss: 0.5402, test_loss: 0.8123, test_f1: 0.6376
 epoch: 83, train_loss: 0.5269, test_loss: 0.7967, test_f1: 0.6439
 epoch: 84, train_loss: 0.5378, test_loss: 0.7969, test_f1: 0.6395
 epoch: 85, train_loss: 0.5273, test_loss: 0.7734, test_f1: 0.6489
 epoch: 86, train_loss: 0.5168, test_loss: 0.8750, test_f1: 0.6230
 epoch: 87, train_loss: 0.5242, test_loss: 0.8467, test_f1: 0.6260
 epoch: 88, train_loss: 0.5296, test_loss: 0.8531, test_f1: 0.6496
 epoch: 89, train_loss: 0.5133, test_loss: 0.8191, test_f1: 0.6382
 epoch: 90, train_loss: 0.5184, test_loss: 0.8115, test_f1: 0.6456
 epoch: 91, train_loss: 0.5068, test_loss: 0.8309, test_f1: 0.6352
 epoch: 92, train_loss: 0.5110, test_loss: 0.7858, test_f1: 0.6560
 epoch: 93, train_loss: 0.5196, test_loss: 0.7497, test_f1: 0.6628
 epoch: 94, train_loss: 0.5361, test_loss: 0.9272, test_f1: 0.6445
 epoch: 95, train_loss: 0.5374, test_loss: 0.9083, test_f1: 0.6177
 epoch: 96, train_loss: 0.5048, test_loss: 0.8324, test_f1: 0.6451
 epoch: 97, train_loss: 0.4964, test_loss: 0.9656, test_f1: 0.6433
 epoch: 98, train_loss: 0.5068, test_loss: 0.8301, test_f1: 0.6443
 epoch: 99, train_loss: 0.4965, test_loss: 0.8428, test_f1: 0.6552

Training completed in 425.14 seconds
Best F1: 0.6628 at epoch 93
Mean F1 across iterations: 0.6202  0.0238
========================FINAL RESULTS================================
FEGIN weighted F1: 0.6628  0.0238
python main.py --data ltspice_examples --representation component_pin --model FEGIN --layers 4 --hiddens 32 --batch_size 256 --lr 0.001 --emb_size 128 --epochs 100 --save_appendix component_pin_L4_H32_BS256_LR0.001_E128 --no_val
-----



STDERR:
  File "main.py", line 370, in <module>
    main()
  File "main.py", line 254, in main
    dataset = dataset_class(
  File "/home/philip/projects/ltspice_examples_code_repo/Circuit-Completion-Using-GNNs/component_classification_with_link_prediction_head/evaluation/FEGIN/kernel/circuit_datasets.py", line 15, in __init__
    self.data, self.slices = torch.load(self.processed_paths[0])
  File "/home/philip/.local/lib/python3.8/site-packages/torch/serialization.py", line 1040, in load
    warnings.warn(
  File "/usr/lib/python3.8/warnings.py", line 109, in _showwarnmsg
    sw(msg.message, msg.category, msg.filename, msg.lineno,
  File "main.py", line 47, in warn_with_traceback
    traceback.print_stack(file=log)
/home/philip/projects/ltspice_examples_code_repo/Circuit-Completion-Using-GNNs/component_classification_with_link_prediction_head/evaluation/FEGIN/kernel/circuit_datasets.py:15: FutureWarning: You are using `torch.load` with `weights_only=False` (the current default value), which uses the default pickle module implicitly. It is possible to construct malicious pickle data which will execute arbitrary code during unpickling (See https://github.com/pytorch/pytorch/blob/main/SECURITY.md#untrusted-models for more details). In a future release, the default value for `weights_only` will be flipped to `True`. This limits the functions that could be executed during unpickling. Arbitrary objects will no longer be allowed to be loaded via this mode unless they are explicitly allowlisted by the user via `torch.serialization.add_safe_globals`. We recommend you start setting `weights_only=True` for any use case where you don't have full control of the loaded file. Please open an issue on GitHub for any issues related to this experimental feature.
  self.data, self.slices = torch.load(self.processed_paths[0])
