STDOUT:
Results will be saved in /home/philip/projects/ltspice_examples_code_repo/Circuit-Completion-Using-GNNs/component_classification_with_link_prediction_head/evaluation/FEGIN/results/model_FEGIN_dataset_ltspice_demos
Command line input: python main.py --data ltspice_demos --representation component_net --model FEGIN --layers 4 --hiddens 128 --batch_size 64 --lr 0.001 --emb_size 128 --epochs 100 --save_appendix component_net_L4_H128_BS64_LR0.001_E128 --no_val
 is saved.
-----
ltspice_demos - FEGIN
Using 4 layers, 128 hidden units, h = 2
Loading component_net representation dataset
Loading component_net representation data...
Loaded 1948 examples (component_net)
saving path: data/processed/ltspice_demos_component_net_processed.pt
ENTERED
Training FEGIN on component_net representation
Train: 1565, Test: 383
##################ITERATION #0 ****************************************
 epoch: 0, train_loss: 1.2169, test_loss: 1.2783, test_f1: 0.2281
 epoch: 1, train_loss: 1.0938, test_loss: 1.1558, test_f1: 0.4519
 epoch: 2, train_loss: 1.0305, test_loss: 1.1065, test_f1: 0.5005
 epoch: 3, train_loss: 0.9739, test_loss: 1.0094, test_f1: 0.5509
 epoch: 4, train_loss: 0.9304, test_loss: 1.0232, test_f1: 0.5531
 epoch: 5, train_loss: 0.8985, test_loss: 0.9711, test_f1: 0.5368
 epoch: 6, train_loss: 0.9216, test_loss: 1.0299, test_f1: 0.4752
 epoch: 7, train_loss: 0.8639, test_loss: 1.0060, test_f1: 0.5849
 epoch: 8, train_loss: 0.8295, test_loss: 1.0627, test_f1: 0.6039
 epoch: 9, train_loss: 0.8358, test_loss: 1.0881, test_f1: 0.5740
 epoch: 10, train_loss: 0.7890, test_loss: 1.1788, test_f1: 0.5604
 epoch: 11, train_loss: 0.8199, test_loss: 1.0965, test_f1: 0.5389
 epoch: 12, train_loss: 0.7741, test_loss: 1.1710, test_f1: 0.5641
 epoch: 13, train_loss: 0.7529, test_loss: 1.1617, test_f1: 0.6055
 epoch: 14, train_loss: 0.7201, test_loss: 1.2739, test_f1: 0.5744
 epoch: 15, train_loss: 0.6893, test_loss: 1.2868, test_f1: 0.5683
 epoch: 16, train_loss: 0.6794, test_loss: 1.2112, test_f1: 0.6146
 epoch: 17, train_loss: 0.6806, test_loss: 1.2833, test_f1: 0.5493
 epoch: 18, train_loss: 0.6489, test_loss: 1.3271, test_f1: 0.5919
 epoch: 19, train_loss: 0.6209, test_loss: 1.8304, test_f1: 0.5626
 epoch: 20, train_loss: 0.6232, test_loss: 1.7236, test_f1: 0.4912
 epoch: 21, train_loss: 0.6882, test_loss: 1.2950, test_f1: 0.5772
 epoch: 22, train_loss: 0.6086, test_loss: 1.5688, test_f1: 0.5610
 epoch: 23, train_loss: 0.5718, test_loss: 1.5451, test_f1: 0.5409
 epoch: 24, train_loss: 0.5796, test_loss: 1.5290, test_f1: 0.6032
 epoch: 25, train_loss: 0.5595, test_loss: 1.7799, test_f1: 0.5541
 epoch: 26, train_loss: 0.5194, test_loss: 1.7085, test_f1: 0.5769
 epoch: 27, train_loss: 0.5206, test_loss: 1.6717, test_f1: 0.5959
 epoch: 28, train_loss: 0.5303, test_loss: 1.6118, test_f1: 0.6007
 epoch: 29, train_loss: 0.4930, test_loss: 1.9482, test_f1: 0.5745
 epoch: 30, train_loss: 0.5212, test_loss: 1.7581, test_f1: 0.5794
 epoch: 31, train_loss: 0.4935, test_loss: 1.6895, test_f1: 0.6401
 epoch: 32, train_loss: 0.4800, test_loss: 1.8183, test_f1: 0.5873
 epoch: 33, train_loss: 0.4947, test_loss: 2.0687, test_f1: 0.5616
 epoch: 34, train_loss: 0.4588, test_loss: 1.9698, test_f1: 0.5522
 epoch: 35, train_loss: 0.4206, test_loss: 2.0738, test_f1: 0.5917
 epoch: 36, train_loss: 0.4030, test_loss: 2.4077, test_f1: 0.5725
 epoch: 37, train_loss: 0.4489, test_loss: 2.1532, test_f1: 0.5460
 epoch: 38, train_loss: 0.4279, test_loss: 2.1506, test_f1: 0.5595
 epoch: 39, train_loss: 0.4009, test_loss: 2.2276, test_f1: 0.5682
 epoch: 40, train_loss: 0.4463, test_loss: 2.0813, test_f1: 0.5663
 epoch: 41, train_loss: 0.3804, test_loss: 2.2565, test_f1: 0.5823
 epoch: 42, train_loss: 0.3417, test_loss: 2.5557, test_f1: 0.5803
 epoch: 43, train_loss: 0.3658, test_loss: 2.6249, test_f1: 0.5824
 epoch: 44, train_loss: 0.3972, test_loss: 2.6405, test_f1: 0.5967
 epoch: 45, train_loss: 0.3735, test_loss: 2.3759, test_f1: 0.5654
 epoch: 46, train_loss: 0.3707, test_loss: 2.2746, test_f1: 0.5774
 epoch: 47, train_loss: 0.3530, test_loss: 2.4664, test_f1: 0.6063
 epoch: 48, train_loss: 0.3458, test_loss: 2.4604, test_f1: 0.5772
 epoch: 49, train_loss: 0.3288, test_loss: 2.4266, test_f1: 0.6214
 epoch: 50, train_loss: 0.3114, test_loss: 2.7905, test_f1: 0.5671
 epoch: 51, train_loss: 0.2687, test_loss: 2.6254, test_f1: 0.6029
 epoch: 52, train_loss: 0.2409, test_loss: 2.7980, test_f1: 0.5875
 epoch: 53, train_loss: 0.2301, test_loss: 2.7838, test_f1: 0.6031
 epoch: 54, train_loss: 0.2215, test_loss: 2.7944, test_f1: 0.6039
 epoch: 55, train_loss: 0.2313, test_loss: 2.8198, test_f1: 0.5876
 epoch: 56, train_loss: 0.2202, test_loss: 2.9762, test_f1: 0.5963
 epoch: 57, train_loss: 0.2046, test_loss: 3.2857, test_f1: 0.5830
 epoch: 58, train_loss: 0.1927, test_loss: 3.0829, test_f1: 0.6112
 epoch: 59, train_loss: 0.2021, test_loss: 2.8379, test_f1: 0.6294
 epoch: 60, train_loss: 0.1994, test_loss: 3.2887, test_f1: 0.5631
 epoch: 61, train_loss: 0.1916, test_loss: 3.1208, test_f1: 0.6291
 epoch: 62, train_loss: 0.1995, test_loss: 3.0850, test_f1: 0.6000
 epoch: 63, train_loss: 0.1790, test_loss: 3.2907, test_f1: 0.5948
 epoch: 64, train_loss: 0.1740, test_loss: 3.0690, test_f1: 0.5813
 epoch: 65, train_loss: 0.1691, test_loss: 3.4030, test_f1: 0.5800
 epoch: 66, train_loss: 0.2015, test_loss: 3.2212, test_f1: 0.6202
 epoch: 67, train_loss: 0.1901, test_loss: 3.6341, test_f1: 0.5845
 epoch: 68, train_loss: 0.1877, test_loss: 3.2408, test_f1: 0.5967
 epoch: 69, train_loss: 0.1765, test_loss: 3.0640, test_f1: 0.6357
 epoch: 70, train_loss: 0.1929, test_loss: 3.2423, test_f1: 0.6184
 epoch: 71, train_loss: 0.1768, test_loss: 3.5300, test_f1: 0.5620
 epoch: 72, train_loss: 0.1760, test_loss: 3.5815, test_f1: 0.6042
 epoch: 73, train_loss: 0.1666, test_loss: 3.3305, test_f1: 0.5921
 epoch: 74, train_loss: 0.1426, test_loss: 3.3718, test_f1: 0.6055
 epoch: 75, train_loss: 0.1640, test_loss: 3.7314, test_f1: 0.5376
 epoch: 76, train_loss: 0.1653, test_loss: 3.4685, test_f1: 0.5879
 epoch: 77, train_loss: 0.1759, test_loss: 3.4620, test_f1: 0.6045
 epoch: 78, train_loss: 0.1554, test_loss: 3.9576, test_f1: 0.5851
 epoch: 79, train_loss: 0.1525, test_loss: 3.4386, test_f1: 0.5929
 epoch: 80, train_loss: 0.1395, test_loss: 3.7158, test_f1: 0.5859
 epoch: 81, train_loss: 0.1826, test_loss: 3.7602, test_f1: 0.5752
 epoch: 82, train_loss: 0.1527, test_loss: 3.6290, test_f1: 0.6103
 epoch: 83, train_loss: 0.1622, test_loss: 3.9218, test_f1: 0.5531
 epoch: 84, train_loss: 0.1507, test_loss: 3.9242, test_f1: 0.5834
 epoch: 85, train_loss: 0.1312, test_loss: 3.7148, test_f1: 0.6033
 epoch: 86, train_loss: 0.1580, test_loss: 3.8807, test_f1: 0.6047
 epoch: 87, train_loss: 0.1505, test_loss: 3.6355, test_f1: 0.6071
 epoch: 88, train_loss: 0.1281, test_loss: 3.7629, test_f1: 0.5770
 epoch: 89, train_loss: 0.1154, test_loss: 3.6645, test_f1: 0.6098
 epoch: 90, train_loss: 0.1391, test_loss: 3.9725, test_f1: 0.6056
 epoch: 91, train_loss: 0.1445, test_loss: 3.7708, test_f1: 0.6016
 epoch: 92, train_loss: 0.1228, test_loss: 3.8461, test_f1: 0.5875
 epoch: 93, train_loss: 0.1428, test_loss: 3.7610, test_f1: 0.5626
 epoch: 94, train_loss: 0.1333, test_loss: 4.1750, test_f1: 0.5820
 epoch: 95, train_loss: 0.1232, test_loss: 3.6983, test_f1: 0.6026
 epoch: 96, train_loss: 0.1114, test_loss: 3.9039, test_f1: 0.5761
 epoch: 97, train_loss: 0.1027, test_loss: 4.2340, test_f1: 0.6182
 epoch: 98, train_loss: 0.1346, test_loss: 3.8633, test_f1: 0.5899
 epoch: 99, train_loss: 0.1209, test_loss: 4.1702, test_f1: 0.6137
##################ITERATION #1 ****************************************
 epoch: 0, train_loss: 1.1607, test_loss: 1.2210, test_f1: 0.3076
 epoch: 1, train_loss: 1.0149, test_loss: 1.0936, test_f1: 0.4849
 epoch: 2, train_loss: 0.9476, test_loss: 1.0328, test_f1: 0.5324
 epoch: 3, train_loss: 0.9091, test_loss: 1.0488, test_f1: 0.5223
 epoch: 4, train_loss: 0.9008, test_loss: 1.0494, test_f1: 0.5723
 epoch: 5, train_loss: 0.8660, test_loss: 1.0288, test_f1: 0.5066
 epoch: 6, train_loss: 0.8629, test_loss: 1.0018, test_f1: 0.5690
 epoch: 7, train_loss: 0.8403, test_loss: 1.0534, test_f1: 0.5583
 epoch: 8, train_loss: 0.8156, test_loss: 0.9823, test_f1: 0.5657
 epoch: 9, train_loss: 0.8249, test_loss: 1.0687, test_f1: 0.5955
 epoch: 10, train_loss: 0.8193, test_loss: 0.9248, test_f1: 0.6152
 epoch: 11, train_loss: 0.7648, test_loss: 1.1347, test_f1: 0.5761
 epoch: 12, train_loss: 0.7636, test_loss: 1.0197, test_f1: 0.6225
 epoch: 13, train_loss: 0.7331, test_loss: 1.1004, test_f1: 0.5687
 epoch: 14, train_loss: 0.7106, test_loss: 1.0902, test_f1: 0.5971
 epoch: 15, train_loss: 0.7002, test_loss: 1.2718, test_f1: 0.6053
 epoch: 16, train_loss: 0.6985, test_loss: 1.0556, test_f1: 0.5869
 epoch: 17, train_loss: 0.6919, test_loss: 1.3484, test_f1: 0.5837
 epoch: 18, train_loss: 0.6466, test_loss: 1.2959, test_f1: 0.5628
 epoch: 19, train_loss: 0.6486, test_loss: 1.2446, test_f1: 0.5926
 epoch: 20, train_loss: 0.6383, test_loss: 1.4141, test_f1: 0.5239
 epoch: 21, train_loss: 0.6141, test_loss: 1.2706, test_f1: 0.6183
 epoch: 22, train_loss: 0.6222, test_loss: 1.4645, test_f1: 0.5341
 epoch: 23, train_loss: 0.5913, test_loss: 1.3887, test_f1: 0.5921
 epoch: 24, train_loss: 0.5668, test_loss: 1.5938, test_f1: 0.5540
 epoch: 25, train_loss: 0.5375, test_loss: 1.3959, test_f1: 0.6074
 epoch: 26, train_loss: 0.6016, test_loss: 1.5384, test_f1: 0.5961
 epoch: 27, train_loss: 0.5810, test_loss: 1.5393, test_f1: 0.5832
 epoch: 28, train_loss: 0.5529, test_loss: 1.4603, test_f1: 0.5743
 epoch: 29, train_loss: 0.5181, test_loss: 1.4367, test_f1: 0.6018
 epoch: 30, train_loss: 0.4852, test_loss: 1.6208, test_f1: 0.5656
 epoch: 31, train_loss: 0.4907, test_loss: 1.6774, test_f1: 0.6034
 epoch: 32, train_loss: 0.5078, test_loss: 1.7296, test_f1: 0.6029
 epoch: 33, train_loss: 0.4602, test_loss: 1.5955, test_f1: 0.5735
 epoch: 34, train_loss: 0.4582, test_loss: 1.6824, test_f1: 0.6022
 epoch: 35, train_loss: 0.4311, test_loss: 1.7798, test_f1: 0.5544
 epoch: 36, train_loss: 0.4299, test_loss: 1.8327, test_f1: 0.6040
 epoch: 37, train_loss: 0.4581, test_loss: 1.8326, test_f1: 0.5918
 epoch: 38, train_loss: 0.4501, test_loss: 1.8393, test_f1: 0.5785
 epoch: 39, train_loss: 0.4048, test_loss: 1.9169, test_f1: 0.6163
 epoch: 40, train_loss: 0.3872, test_loss: 2.1830, test_f1: 0.5755
 epoch: 41, train_loss: 0.3749, test_loss: 2.2057, test_f1: 0.5475
 epoch: 42, train_loss: 0.3864, test_loss: 1.8509, test_f1: 0.6294
 epoch: 43, train_loss: 0.3530, test_loss: 2.1141, test_f1: 0.5962
 epoch: 44, train_loss: 0.3534, test_loss: 2.0103, test_f1: 0.5955
 epoch: 45, train_loss: 0.3596, test_loss: 2.2411, test_f1: 0.5316
 epoch: 46, train_loss: 0.3985, test_loss: 1.9919, test_f1: 0.6046
 epoch: 47, train_loss: 0.3463, test_loss: 1.9217, test_f1: 0.5737
 epoch: 48, train_loss: 0.3235, test_loss: 1.9119, test_f1: 0.6386
 epoch: 49, train_loss: 0.3007, test_loss: 2.3566, test_f1: 0.6265
 epoch: 50, train_loss: 0.3006, test_loss: 2.1943, test_f1: 0.6377
 epoch: 51, train_loss: 0.3002, test_loss: 2.2683, test_f1: 0.6011
 epoch: 52, train_loss: 0.2358, test_loss: 2.2591, test_f1: 0.6241
 epoch: 53, train_loss: 0.2194, test_loss: 2.4669, test_f1: 0.6280
 epoch: 54, train_loss: 0.2227, test_loss: 2.5044, test_f1: 0.6212
 epoch: 55, train_loss: 0.2179, test_loss: 2.7541, test_f1: 0.6063
 epoch: 56, train_loss: 0.2261, test_loss: 2.8656, test_f1: 0.5727
 epoch: 57, train_loss: 0.2087, test_loss: 2.7279, test_f1: 0.6070
 epoch: 58, train_loss: 0.2016, test_loss: 2.8766, test_f1: 0.5773
 epoch: 59, train_loss: 0.1869, test_loss: 2.7993, test_f1: 0.6018
 epoch: 60, train_loss: 0.1942, test_loss: 2.9640, test_f1: 0.6212
 epoch: 61, train_loss: 0.1952, test_loss: 2.8345, test_f1: 0.5676
 epoch: 62, train_loss: 0.1832, test_loss: 2.8579, test_f1: 0.6080
 epoch: 63, train_loss: 0.1988, test_loss: 3.0629, test_f1: 0.6248
 epoch: 64, train_loss: 0.2016, test_loss: 2.7158, test_f1: 0.5922
 epoch: 65, train_loss: 0.1728, test_loss: 2.7509, test_f1: 0.6019
 epoch: 66, train_loss: 0.1631, test_loss: 2.8872, test_f1: 0.6249
 epoch: 67, train_loss: 0.1657, test_loss: 3.2714, test_f1: 0.6106
 epoch: 68, train_loss: 0.1752, test_loss: 2.9201, test_f1: 0.6194
 epoch: 69, train_loss: 0.1948, test_loss: 3.1409, test_f1: 0.5775
 epoch: 70, train_loss: 0.1684, test_loss: 2.9757, test_f1: 0.6001
 epoch: 71, train_loss: 0.1700, test_loss: 3.1725, test_f1: 0.6078
 epoch: 72, train_loss: 0.1539, test_loss: 3.4937, test_f1: 0.5617
 epoch: 73, train_loss: 0.1663, test_loss: 3.5216, test_f1: 0.5671
 epoch: 74, train_loss: 0.1648, test_loss: 3.0409, test_f1: 0.6060
 epoch: 75, train_loss: 0.1722, test_loss: 3.3396, test_f1: 0.5826
 epoch: 76, train_loss: 0.1421, test_loss: 3.4374, test_f1: 0.6294
 epoch: 77, train_loss: 0.1334, test_loss: 3.2555, test_f1: 0.6103
 epoch: 78, train_loss: 0.1347, test_loss: 3.6778, test_f1: 0.5694
 epoch: 79, train_loss: 0.1187, test_loss: 3.4942, test_f1: 0.6010
 epoch: 80, train_loss: 0.1517, test_loss: 3.8241, test_f1: 0.5344
 epoch: 81, train_loss: 0.1450, test_loss: 3.4069, test_f1: 0.6043
 epoch: 82, train_loss: 0.1508, test_loss: 3.7466, test_f1: 0.6144
 epoch: 83, train_loss: 0.1471, test_loss: 3.4013, test_f1: 0.5987
 epoch: 84, train_loss: 0.1878, test_loss: 3.4446, test_f1: 0.6110
 epoch: 85, train_loss: 0.1391, test_loss: 3.7245, test_f1: 0.5992
 epoch: 86, train_loss: 0.1400, test_loss: 3.7030, test_f1: 0.5958
 epoch: 87, train_loss: 0.1256, test_loss: 3.8111, test_f1: 0.5985
 epoch: 88, train_loss: 0.1482, test_loss: 3.5729, test_f1: 0.6225
 epoch: 89, train_loss: 0.1353, test_loss: 3.7530, test_f1: 0.6122
 epoch: 90, train_loss: 0.1643, test_loss: 3.7989, test_f1: 0.5866
 epoch: 91, train_loss: 0.1559, test_loss: 3.3642, test_f1: 0.5923
 epoch: 92, train_loss: 0.1298, test_loss: 3.5914, test_f1: 0.6037
 epoch: 93, train_loss: 0.1485, test_loss: 4.0174, test_f1: 0.6171
 epoch: 94, train_loss: 0.1718, test_loss: 3.6471, test_f1: 0.6189
 epoch: 95, train_loss: 0.1511, test_loss: 3.5229, test_f1: 0.6205
 epoch: 96, train_loss: 0.1415, test_loss: 3.9465, test_f1: 0.5899
 epoch: 97, train_loss: 0.1313, test_loss: 3.5728, test_f1: 0.5862
 epoch: 98, train_loss: 0.1358, test_loss: 4.1578, test_f1: 0.6089
 epoch: 99, train_loss: 0.1585, test_loss: 3.8428, test_f1: 0.5983
##################ITERATION #2 ****************************************
 epoch: 0, train_loss: 1.1499, test_loss: 1.2982, test_f1: 0.1368
 epoch: 1, train_loss: 1.0180, test_loss: 1.1205, test_f1: 0.4310
 epoch: 2, train_loss: 0.9646, test_loss: 1.0914, test_f1: 0.4749
 epoch: 3, train_loss: 0.9261, test_loss: 0.9996, test_f1: 0.5428
 epoch: 4, train_loss: 0.9009, test_loss: 1.0591, test_f1: 0.5385
 epoch: 5, train_loss: 0.8671, test_loss: 1.0729, test_f1: 0.5524
 epoch: 6, train_loss: 0.8333, test_loss: 1.0808, test_f1: 0.5434
 epoch: 7, train_loss: 0.8251, test_loss: 1.0815, test_f1: 0.6077
 epoch: 8, train_loss: 0.8463, test_loss: 1.1670, test_f1: 0.5051
 epoch: 9, train_loss: 0.8190, test_loss: 1.1301, test_f1: 0.5705
 epoch: 10, train_loss: 0.7993, test_loss: 1.1473, test_f1: 0.5476
 epoch: 11, train_loss: 0.7695, test_loss: 1.1241, test_f1: 0.5937
 epoch: 12, train_loss: 0.7628, test_loss: 1.2944, test_f1: 0.5767
 epoch: 13, train_loss: 0.7322, test_loss: 1.1270, test_f1: 0.5844
 epoch: 14, train_loss: 0.7159, test_loss: 1.1999, test_f1: 0.5337
 epoch: 15, train_loss: 0.7227, test_loss: 1.2020, test_f1: 0.5186
 epoch: 16, train_loss: 0.6942, test_loss: 1.3448, test_f1: 0.5675
 epoch: 17, train_loss: 0.6802, test_loss: 1.2023, test_f1: 0.5866
 epoch: 18, train_loss: 0.6696, test_loss: 1.1901, test_f1: 0.6140
 epoch: 19, train_loss: 0.6807, test_loss: 1.3920, test_f1: 0.5818
 epoch: 20, train_loss: 0.6215, test_loss: 1.3352, test_f1: 0.5447
 epoch: 21, train_loss: 0.6396, test_loss: 1.7852, test_f1: 0.4303
 epoch: 22, train_loss: 0.6315, test_loss: 1.3381, test_f1: 0.5761
 epoch: 23, train_loss: 0.5908, test_loss: 1.3355, test_f1: 0.6083
 epoch: 24, train_loss: 0.5875, test_loss: 1.4303, test_f1: 0.5576
 epoch: 25, train_loss: 0.5401, test_loss: 1.5771, test_f1: 0.5842
 epoch: 26, train_loss: 0.5581, test_loss: 1.5605, test_f1: 0.5851
 epoch: 27, train_loss: 0.5655, test_loss: 1.4947, test_f1: 0.5845
 epoch: 28, train_loss: 0.5137, test_loss: 1.6848, test_f1: 0.4995
 epoch: 29, train_loss: 0.5158, test_loss: 1.6263, test_f1: 0.5795
 epoch: 30, train_loss: 0.5129, test_loss: 1.5849, test_f1: 0.5999
 epoch: 31, train_loss: 0.5133, test_loss: 1.7882, test_f1: 0.5805
 epoch: 32, train_loss: 0.5077, test_loss: 1.3906, test_f1: 0.6067
 epoch: 33, train_loss: 0.4731, test_loss: 1.6059, test_f1: 0.5616
 epoch: 34, train_loss: 0.4649, test_loss: 1.6457, test_f1: 0.5519
 epoch: 35, train_loss: 0.4665, test_loss: 1.7985, test_f1: 0.6078
 epoch: 36, train_loss: 0.4049, test_loss: 1.7250, test_f1: 0.6072
 epoch: 37, train_loss: 0.4235, test_loss: 1.8747, test_f1: 0.5854
 epoch: 38, train_loss: 0.4047, test_loss: 1.9275, test_f1: 0.5673
 epoch: 39, train_loss: 0.4056, test_loss: 2.1238, test_f1: 0.5824
 epoch: 40, train_loss: 0.4133, test_loss: 2.0402, test_f1: 0.5695
 epoch: 41, train_loss: 0.4028, test_loss: 1.8623, test_f1: 0.5489
 epoch: 42, train_loss: 0.4239, test_loss: 1.9927, test_f1: 0.5790
 epoch: 43, train_loss: 0.3870, test_loss: 1.8952, test_f1: 0.6100
 epoch: 44, train_loss: 0.3625, test_loss: 1.9719, test_f1: 0.5597
 epoch: 45, train_loss: 0.3857, test_loss: 2.2670, test_f1: 0.5289
 epoch: 46, train_loss: 0.4155, test_loss: 1.9229, test_f1: 0.5946
 epoch: 47, train_loss: 0.4232, test_loss: 2.1336, test_f1: 0.6065
 epoch: 48, train_loss: 0.3517, test_loss: 2.0819, test_f1: 0.6151
 epoch: 49, train_loss: 0.3902, test_loss: 2.1107, test_f1: 0.5660
 epoch: 50, train_loss: 0.4085, test_loss: 1.7102, test_f1: 0.6086
 epoch: 51, train_loss: 0.3675, test_loss: 2.0092, test_f1: 0.5798
 epoch: 52, train_loss: 0.2997, test_loss: 1.9502, test_f1: 0.5924
 epoch: 53, train_loss: 0.2679, test_loss: 2.1948, test_f1: 0.5795
 epoch: 54, train_loss: 0.2662, test_loss: 2.2671, test_f1: 0.5625
 epoch: 55, train_loss: 0.2528, test_loss: 2.4270, test_f1: 0.5882
 epoch: 56, train_loss: 0.2457, test_loss: 2.4216, test_f1: 0.6221
 epoch: 57, train_loss: 0.2233, test_loss: 2.4249, test_f1: 0.6108
 epoch: 58, train_loss: 0.2576, test_loss: 2.3615, test_f1: 0.5727
 epoch: 59, train_loss: 0.2300, test_loss: 2.7881, test_f1: 0.6258
 epoch: 60, train_loss: 0.2097, test_loss: 2.5846, test_f1: 0.6072
 epoch: 61, train_loss: 0.2283, test_loss: 2.8332, test_f1: 0.6059
 epoch: 62, train_loss: 0.2307, test_loss: 2.7264, test_f1: 0.5358
 epoch: 63, train_loss: 0.2122, test_loss: 2.8586, test_f1: 0.6191
 epoch: 64, train_loss: 0.2378, test_loss: 2.8297, test_f1: 0.6089
 epoch: 65, train_loss: 0.2161, test_loss: 2.6226, test_f1: 0.5869
 epoch: 66, train_loss: 0.2070, test_loss: 3.0702, test_f1: 0.5504
 epoch: 67, train_loss: 0.2048, test_loss: 3.0689, test_f1: 0.5713
 epoch: 68, train_loss: 0.2194, test_loss: 2.8779, test_f1: 0.5832
 epoch: 69, train_loss: 0.1989, test_loss: 3.2069, test_f1: 0.6120
 epoch: 70, train_loss: 0.1927, test_loss: 2.7666, test_f1: 0.5958
 epoch: 71, train_loss: 0.2008, test_loss: 3.0743, test_f1: 0.5770
 epoch: 72, train_loss: 0.1772, test_loss: 3.0075, test_f1: 0.5900
 epoch: 73, train_loss: 0.1650, test_loss: 3.2909, test_f1: 0.5584
 epoch: 74, train_loss: 0.1676, test_loss: 3.0281, test_f1: 0.6069
 epoch: 75, train_loss: 0.1804, test_loss: 3.1874, test_f1: 0.5747
 epoch: 76, train_loss: 0.1944, test_loss: 3.2717, test_f1: 0.6139
 epoch: 77, train_loss: 0.1885, test_loss: 3.3051, test_f1: 0.6205
 epoch: 78, train_loss: 0.1997, test_loss: 2.8403, test_f1: 0.6048
 epoch: 79, train_loss: 0.1618, test_loss: 3.1251, test_f1: 0.5943
 epoch: 80, train_loss: 0.1815, test_loss: 3.2754, test_f1: 0.5749
 epoch: 81, train_loss: 0.1514, test_loss: 3.2171, test_f1: 0.5936
 epoch: 82, train_loss: 0.1684, test_loss: 3.3800, test_f1: 0.5908
 epoch: 83, train_loss: 0.1553, test_loss: 3.5027, test_f1: 0.5918
 epoch: 84, train_loss: 0.1763, test_loss: 3.1064, test_f1: 0.6046
 epoch: 85, train_loss: 0.1841, test_loss: 3.2552, test_f1: 0.5828
 epoch: 86, train_loss: 0.1904, test_loss: 3.4883, test_f1: 0.5814
 epoch: 87, train_loss: 0.1623, test_loss: 3.3311, test_f1: 0.5608
 epoch: 88, train_loss: 0.1541, test_loss: 3.5241, test_f1: 0.5920
 epoch: 89, train_loss: 0.1474, test_loss: 3.3973, test_f1: 0.6045
 epoch: 90, train_loss: 0.1333, test_loss: 3.6001, test_f1: 0.5945
 epoch: 91, train_loss: 0.1677, test_loss: 3.6264, test_f1: 0.5958
 epoch: 92, train_loss: 0.1551, test_loss: 3.3121, test_f1: 0.6031
 epoch: 93, train_loss: 0.1414, test_loss: 3.3393, test_f1: 0.6269
 epoch: 94, train_loss: 0.1180, test_loss: 3.5767, test_f1: 0.6011
 epoch: 95, train_loss: 0.1497, test_loss: 3.6726, test_f1: 0.5847
 epoch: 96, train_loss: 0.1719, test_loss: 3.3612, test_f1: 0.6184
 epoch: 97, train_loss: 0.1408, test_loss: 3.3318, test_f1: 0.5744
 epoch: 98, train_loss: 0.1612, test_loss: 3.5349, test_f1: 0.6281
 epoch: 99, train_loss: 0.1819, test_loss: 3.6598, test_f1: 0.6235
##################ITERATION #3 ****************************************
 epoch: 0, train_loss: 1.2194, test_loss: 1.1989, test_f1: 0.4307
 epoch: 1, train_loss: 1.0374, test_loss: 1.0865, test_f1: 0.4813
 epoch: 2, train_loss: 0.9462, test_loss: 1.0184, test_f1: 0.5764
 epoch: 3, train_loss: 0.9010, test_loss: 1.0839, test_f1: 0.4934
 epoch: 4, train_loss: 0.9116, test_loss: 1.0213, test_f1: 0.5658
 epoch: 5, train_loss: 0.8586, test_loss: 0.9915, test_f1: 0.5834
 epoch: 6, train_loss: 0.8412, test_loss: 0.9956, test_f1: 0.6137
 epoch: 7, train_loss: 0.8086, test_loss: 1.1226, test_f1: 0.5353
 epoch: 8, train_loss: 0.8075, test_loss: 0.9703, test_f1: 0.6282
 epoch: 9, train_loss: 0.7820, test_loss: 1.1124, test_f1: 0.5413
 epoch: 10, train_loss: 0.7953, test_loss: 1.0079, test_f1: 0.6170
 epoch: 11, train_loss: 0.7652, test_loss: 1.2594, test_f1: 0.5270
 epoch: 12, train_loss: 0.7444, test_loss: 1.0759, test_f1: 0.5771
 epoch: 13, train_loss: 0.7102, test_loss: 1.0898, test_f1: 0.5872
 epoch: 14, train_loss: 0.7059, test_loss: 1.0529, test_f1: 0.6081
 epoch: 15, train_loss: 0.6610, test_loss: 1.1492, test_f1: 0.5682
 epoch: 16, train_loss: 0.6750, test_loss: 1.2637, test_f1: 0.5831
 epoch: 17, train_loss: 0.6472, test_loss: 1.1494, test_f1: 0.6294
 epoch: 18, train_loss: 0.6479, test_loss: 1.1848, test_f1: 0.6290
 epoch: 19, train_loss: 0.6192, test_loss: 1.2214, test_f1: 0.5884
 epoch: 20, train_loss: 0.6132, test_loss: 1.2484, test_f1: 0.6158
 epoch: 21, train_loss: 0.5991, test_loss: 1.4136, test_f1: 0.6014
 epoch: 22, train_loss: 0.5748, test_loss: 1.3907, test_f1: 0.5751
 epoch: 23, train_loss: 0.5379, test_loss: 1.3919, test_f1: 0.5935
 epoch: 24, train_loss: 0.5611, test_loss: 1.4707, test_f1: 0.5942
 epoch: 25, train_loss: 0.5747, test_loss: 1.3050, test_f1: 0.6296
 epoch: 26, train_loss: 0.5513, test_loss: 1.5886, test_f1: 0.6306
 epoch: 27, train_loss: 0.5240, test_loss: 1.4442, test_f1: 0.5734
 epoch: 28, train_loss: 0.5305, test_loss: 1.4437, test_f1: 0.6210
 epoch: 29, train_loss: 0.4826, test_loss: 1.4568, test_f1: 0.5927
 epoch: 30, train_loss: 0.4938, test_loss: 1.6779, test_f1: 0.5980
 epoch: 31, train_loss: 0.5109, test_loss: 1.5058, test_f1: 0.6148
 epoch: 32, train_loss: 0.5061, test_loss: 1.5845, test_f1: 0.6018
 epoch: 33, train_loss: 0.5070, test_loss: 1.6472, test_f1: 0.6100
 epoch: 34, train_loss: 0.4886, test_loss: 1.7231, test_f1: 0.5813
 epoch: 35, train_loss: 0.4736, test_loss: 1.5218, test_f1: 0.5883
 epoch: 36, train_loss: 0.4399, test_loss: 1.6731, test_f1: 0.5473
 epoch: 37, train_loss: 0.4195, test_loss: 1.6567, test_f1: 0.6186
 epoch: 38, train_loss: 0.4508, test_loss: 1.6419, test_f1: 0.5935
 epoch: 39, train_loss: 0.4413, test_loss: 1.9531, test_f1: 0.5694
 epoch: 40, train_loss: 0.4312, test_loss: 1.9492, test_f1: 0.5811
 epoch: 41, train_loss: 0.4302, test_loss: 2.2591, test_f1: 0.5204
 epoch: 42, train_loss: 0.4110, test_loss: 1.9094, test_f1: 0.5923
 epoch: 43, train_loss: 0.3756, test_loss: 2.0354, test_f1: 0.5888
 epoch: 44, train_loss: 0.3605, test_loss: 1.9262, test_f1: 0.5993
 epoch: 45, train_loss: 0.3681, test_loss: 2.0407, test_f1: 0.6254
 epoch: 46, train_loss: 0.3684, test_loss: 2.1342, test_f1: 0.6210
 epoch: 47, train_loss: 0.3862, test_loss: 2.0031, test_f1: 0.5904
 epoch: 48, train_loss: 0.3689, test_loss: 2.3952, test_f1: 0.5732
 epoch: 49, train_loss: 0.3295, test_loss: 1.9733, test_f1: 0.5871
 epoch: 50, train_loss: 0.3802, test_loss: 1.9224, test_f1: 0.5702
 epoch: 51, train_loss: 0.2987, test_loss: 2.1482, test_f1: 0.6177
 epoch: 52, train_loss: 0.2709, test_loss: 2.1597, test_f1: 0.6154
 epoch: 53, train_loss: 0.2771, test_loss: 2.2572, test_f1: 0.6181
 epoch: 54, train_loss: 0.2768, test_loss: 2.1962, test_f1: 0.6151
 epoch: 55, train_loss: 0.2798, test_loss: 2.2787, test_f1: 0.5714
 epoch: 56, train_loss: 0.2515, test_loss: 2.3994, test_f1: 0.6273
 epoch: 57, train_loss: 0.2456, test_loss: 2.3389, test_f1: 0.6177
 epoch: 58, train_loss: 0.2358, test_loss: 2.3684, test_f1: 0.6146
 epoch: 59, train_loss: 0.2212, test_loss: 2.4976, test_f1: 0.5926
 epoch: 60, train_loss: 0.2664, test_loss: 2.6118, test_f1: 0.5939
 epoch: 61, train_loss: 0.2429, test_loss: 2.4778, test_f1: 0.6073
 epoch: 62, train_loss: 0.2305, test_loss: 2.5937, test_f1: 0.6058
 epoch: 63, train_loss: 0.2237, test_loss: 2.6259, test_f1: 0.6134
 epoch: 64, train_loss: 0.2010, test_loss: 2.5842, test_f1: 0.6095
 epoch: 65, train_loss: 0.2083, test_loss: 2.7656, test_f1: 0.6062
 epoch: 66, train_loss: 0.2362, test_loss: 2.8218, test_f1: 0.6087
 epoch: 67, train_loss: 0.2348, test_loss: 2.9135, test_f1: 0.6056
 epoch: 68, train_loss: 0.2194, test_loss: 2.9931, test_f1: 0.6205
 epoch: 69, train_loss: 0.2122, test_loss: 2.5737, test_f1: 0.5934
 epoch: 70, train_loss: 0.2009, test_loss: 2.6286, test_f1: 0.5858
 epoch: 71, train_loss: 0.2070, test_loss: 2.7877, test_f1: 0.5913
 epoch: 72, train_loss: 0.1897, test_loss: 3.1050, test_f1: 0.5981
 epoch: 73, train_loss: 0.1926, test_loss: 3.0372, test_f1: 0.6191
 epoch: 74, train_loss: 0.1893, test_loss: 3.0194, test_f1: 0.6061
 epoch: 75, train_loss: 0.1978, test_loss: 2.8417, test_f1: 0.6083
 epoch: 76, train_loss: 0.1916, test_loss: 2.9374, test_f1: 0.6227
 epoch: 77, train_loss: 0.1998, test_loss: 3.4812, test_f1: 0.5890
 epoch: 78, train_loss: 0.2106, test_loss: 3.0276, test_f1: 0.6173
 epoch: 79, train_loss: 0.1855, test_loss: 2.9983, test_f1: 0.5825
 epoch: 80, train_loss: 0.1710, test_loss: 3.0874, test_f1: 0.6381
 epoch: 81, train_loss: 0.1594, test_loss: 3.3144, test_f1: 0.6242
 epoch: 82, train_loss: 0.1526, test_loss: 3.1653, test_f1: 0.5890
 epoch: 83, train_loss: 0.1600, test_loss: 3.1576, test_f1: 0.6088
 epoch: 84, train_loss: 0.1981, test_loss: 3.6758, test_f1: 0.5789
 epoch: 85, train_loss: 0.1896, test_loss: 3.2895, test_f1: 0.6289
 epoch: 86, train_loss: 0.1550, test_loss: 3.3348, test_f1: 0.6154
 epoch: 87, train_loss: 0.1524, test_loss: 3.1037, test_f1: 0.6045
 epoch: 88, train_loss: 0.1642, test_loss: 3.4406, test_f1: 0.6082
 epoch: 89, train_loss: 0.1538, test_loss: 3.6606, test_f1: 0.5973
 epoch: 90, train_loss: 0.1803, test_loss: 3.2509, test_f1: 0.6102
 epoch: 91, train_loss: 0.1406, test_loss: 3.4195, test_f1: 0.6078
 epoch: 92, train_loss: 0.1369, test_loss: 3.5006, test_f1: 0.6238
 epoch: 93, train_loss: 0.1502, test_loss: 3.7717, test_f1: 0.5808
 epoch: 94, train_loss: 0.1241, test_loss: 3.6477, test_f1: 0.6076
 epoch: 95, train_loss: 0.1505, test_loss: 3.6804, test_f1: 0.6001
 epoch: 96, train_loss: 0.1437, test_loss: 3.6137, test_f1: 0.5762
 epoch: 97, train_loss: 0.1591, test_loss: 3.7631, test_f1: 0.5805
 epoch: 98, train_loss: 0.1639, test_loss: 3.5455, test_f1: 0.5513
 epoch: 99, train_loss: 0.1642, test_loss: 3.7632, test_f1: 0.5927
##################ITERATION #4 ****************************************
 epoch: 0, train_loss: 1.2794, test_loss: 1.2692, test_f1: 0.2512
 epoch: 1, train_loss: 1.0889, test_loss: 1.1146, test_f1: 0.4486
 epoch: 2, train_loss: 0.9691, test_loss: 1.0978, test_f1: 0.5354
 epoch: 3, train_loss: 0.9331, test_loss: 1.0924, test_f1: 0.5147
 epoch: 4, train_loss: 0.9220, test_loss: 1.0753, test_f1: 0.5208
 epoch: 5, train_loss: 0.8837, test_loss: 1.0821, test_f1: 0.5574
 epoch: 6, train_loss: 0.8522, test_loss: 1.0336, test_f1: 0.5474
 epoch: 7, train_loss: 0.8414, test_loss: 1.0361, test_f1: 0.5297
 epoch: 8, train_loss: 0.8249, test_loss: 1.0481, test_f1: 0.5842
 epoch: 9, train_loss: 0.8357, test_loss: 1.1250, test_f1: 0.5622
 epoch: 10, train_loss: 0.7892, test_loss: 1.2096, test_f1: 0.4920
 epoch: 11, train_loss: 0.8013, test_loss: 1.1172, test_f1: 0.5843
 epoch: 12, train_loss: 0.7675, test_loss: 1.0553, test_f1: 0.6257
 epoch: 13, train_loss: 0.7550, test_loss: 1.1639, test_f1: 0.6525
 epoch: 14, train_loss: 0.7306, test_loss: 1.1186, test_f1: 0.5890
 epoch: 15, train_loss: 0.7273, test_loss: 1.2411, test_f1: 0.5565
 epoch: 16, train_loss: 0.6898, test_loss: 1.2411, test_f1: 0.6130
 epoch: 17, train_loss: 0.6801, test_loss: 1.1629, test_f1: 0.6167
 epoch: 18, train_loss: 0.6824, test_loss: 1.3678, test_f1: 0.6168
 epoch: 19, train_loss: 0.6498, test_loss: 1.3384, test_f1: 0.5803
 epoch: 20, train_loss: 0.6471, test_loss: 1.2823, test_f1: 0.5586
 epoch: 21, train_loss: 0.6421, test_loss: 1.3284, test_f1: 0.5659
 epoch: 22, train_loss: 0.6243, test_loss: 1.4135, test_f1: 0.5271
 epoch: 23, train_loss: 0.6168, test_loss: 1.1990, test_f1: 0.5943
 epoch: 24, train_loss: 0.6200, test_loss: 1.3426, test_f1: 0.5953
 epoch: 25, train_loss: 0.5875, test_loss: 1.4559, test_f1: 0.5704
 epoch: 26, train_loss: 0.5616, test_loss: 1.4044, test_f1: 0.5885
 epoch: 27, train_loss: 0.5942, test_loss: 1.5463, test_f1: 0.5556
 epoch: 28, train_loss: 0.5522, test_loss: 1.4476, test_f1: 0.5687
 epoch: 29, train_loss: 0.5351, test_loss: 1.5654, test_f1: 0.5695
 epoch: 30, train_loss: 0.5166, test_loss: 1.5862, test_f1: 0.6152
 epoch: 31, train_loss: 0.5109, test_loss: 1.5201, test_f1: 0.5722
 epoch: 32, train_loss: 0.5283, test_loss: 1.6490, test_f1: 0.5752
 epoch: 33, train_loss: 0.4952, test_loss: 1.7170, test_f1: 0.5859
 epoch: 34, train_loss: 0.5137, test_loss: 1.4463, test_f1: 0.5941
 epoch: 35, train_loss: 0.5250, test_loss: 1.7768, test_f1: 0.5836
 epoch: 36, train_loss: 0.4554, test_loss: 1.5929, test_f1: 0.5662
 epoch: 37, train_loss: 0.4651, test_loss: 1.7635, test_f1: 0.5576
 epoch: 38, train_loss: 0.4448, test_loss: 1.8485, test_f1: 0.5737
 epoch: 39, train_loss: 0.4877, test_loss: 1.6639, test_f1: 0.5667
 epoch: 40, train_loss: 0.4285, test_loss: 1.9393, test_f1: 0.5763
 epoch: 41, train_loss: 0.4137, test_loss: 1.9254, test_f1: 0.5726
 epoch: 42, train_loss: 0.4086, test_loss: 2.1569, test_f1: 0.5751
 epoch: 43, train_loss: 0.4496, test_loss: 1.9823, test_f1: 0.6077
 epoch: 44, train_loss: 0.4436, test_loss: 2.0622, test_f1: 0.5841
 epoch: 45, train_loss: 0.4129, test_loss: 1.9350, test_f1: 0.6214
 epoch: 46, train_loss: 0.3823, test_loss: 1.8301, test_f1: 0.6257
 epoch: 47, train_loss: 0.3695, test_loss: 2.2672, test_f1: 0.5736
 epoch: 48, train_loss: 0.3579, test_loss: 2.3774, test_f1: 0.5861
 epoch: 49, train_loss: 0.3856, test_loss: 2.3266, test_f1: 0.6152
 epoch: 50, train_loss: 0.3921, test_loss: 2.0488, test_f1: 0.5971
 epoch: 51, train_loss: 0.3454, test_loss: 2.0666, test_f1: 0.5781
 epoch: 52, train_loss: 0.3073, test_loss: 2.2927, test_f1: 0.5656
 epoch: 53, train_loss: 0.2930, test_loss: 2.4170, test_f1: 0.5715
 epoch: 54, train_loss: 0.2900, test_loss: 2.3120, test_f1: 0.5866
 epoch: 55, train_loss: 0.2582, test_loss: 2.3112, test_f1: 0.5946
 epoch: 56, train_loss: 0.2622, test_loss: 2.4731, test_f1: 0.6020
 epoch: 57, train_loss: 0.2655, test_loss: 2.3856, test_f1: 0.6214
 epoch: 58, train_loss: 0.2556, test_loss: 2.5658, test_f1: 0.5716
 epoch: 59, train_loss: 0.2421, test_loss: 2.7926, test_f1: 0.5591
 epoch: 60, train_loss: 0.2625, test_loss: 2.7565, test_f1: 0.5776
 epoch: 61, train_loss: 0.2612, test_loss: 2.8372, test_f1: 0.5513
 epoch: 62, train_loss: 0.2603, test_loss: 2.5024, test_f1: 0.5923
 epoch: 63, train_loss: 0.2215, test_loss: 2.7953, test_f1: 0.5838
 epoch: 64, train_loss: 0.2160, test_loss: 2.9321, test_f1: 0.6011
 epoch: 65, train_loss: 0.2139, test_loss: 2.7211, test_f1: 0.5968
 epoch: 66, train_loss: 0.2348, test_loss: 2.8745, test_f1: 0.5770
 epoch: 67, train_loss: 0.2265, test_loss: 2.6879, test_f1: 0.5936
 epoch: 68, train_loss: 0.2163, test_loss: 2.6468, test_f1: 0.5943
 epoch: 69, train_loss: 0.2394, test_loss: 2.8523, test_f1: 0.5942
 epoch: 70, train_loss: 0.2165, test_loss: 3.2453, test_f1: 0.5792
 epoch: 71, train_loss: 0.2097, test_loss: 3.2513, test_f1: 0.5833
 epoch: 72, train_loss: 0.2076, test_loss: 3.0098, test_f1: 0.6008
 epoch: 73, train_loss: 0.1730, test_loss: 3.3048, test_f1: 0.5880
 epoch: 74, train_loss: 0.1785, test_loss: 3.1712, test_f1: 0.5812
 epoch: 75, train_loss: 0.1690, test_loss: 3.3151, test_f1: 0.6060
 epoch: 76, train_loss: 0.1745, test_loss: 3.2924, test_f1: 0.5999
 epoch: 77, train_loss: 0.1850, test_loss: 3.1661, test_f1: 0.6142
 epoch: 78, train_loss: 0.1857, test_loss: 3.6595, test_f1: 0.5783
 epoch: 79, train_loss: 0.1974, test_loss: 3.2987, test_f1: 0.5889
 epoch: 80, train_loss: 0.2122, test_loss: 3.3632, test_f1: 0.5914
 epoch: 81, train_loss: 0.1897, test_loss: 3.4631, test_f1: 0.5934
 epoch: 82, train_loss: 0.1779, test_loss: 3.1352, test_f1: 0.6139
 epoch: 83, train_loss: 0.1784, test_loss: 3.1581, test_f1: 0.5953
 epoch: 84, train_loss: 0.1711, test_loss: 3.4078, test_f1: 0.5816
 epoch: 85, train_loss: 0.1643, test_loss: 3.3525, test_f1: 0.6123
 epoch: 86, train_loss: 0.1590, test_loss: 3.2282, test_f1: 0.5840
 epoch: 87, train_loss: 0.1648, test_loss: 3.6039, test_f1: 0.6167
 epoch: 88, train_loss: 0.1677, test_loss: 3.4573, test_f1: 0.5780
 epoch: 89, train_loss: 0.1707, test_loss: 3.0982, test_f1: 0.6285
 epoch: 90, train_loss: 0.1617, test_loss: 3.5270, test_f1: 0.5852
 epoch: 91, train_loss: 0.1757, test_loss: 3.3109, test_f1: 0.5837
 epoch: 92, train_loss: 0.1966, test_loss: 3.5514, test_f1: 0.5873
 epoch: 93, train_loss: 0.1699, test_loss: 3.2558, test_f1: 0.5870
 epoch: 94, train_loss: 0.1857, test_loss: 3.3445, test_f1: 0.5996
 epoch: 95, train_loss: 0.1343, test_loss: 3.5144, test_f1: 0.6046
 epoch: 96, train_loss: 0.1545, test_loss: 3.3715, test_f1: 0.6216
 epoch: 97, train_loss: 0.1479, test_loss: 3.4581, test_f1: 0.5972
 epoch: 98, train_loss: 0.1779, test_loss: 3.6344, test_f1: 0.5942
 epoch: 99, train_loss: 0.2136, test_loss: 3.9891, test_f1: 0.5537
##################ITERATION #5 ****************************************
 epoch: 0, train_loss: 1.3072, test_loss: 1.1980, test_f1: 0.3729
 epoch: 1, train_loss: 1.1180, test_loss: 1.1293, test_f1: 0.4347
 epoch: 2, train_loss: 0.9867, test_loss: 1.1298, test_f1: 0.4190
 epoch: 3, train_loss: 0.9674, test_loss: 1.1322, test_f1: 0.4608
 epoch: 4, train_loss: 0.9191, test_loss: 1.0717, test_f1: 0.5433
 epoch: 5, train_loss: 0.8926, test_loss: 1.1147, test_f1: 0.5188
 epoch: 6, train_loss: 0.8744, test_loss: 1.0105, test_f1: 0.6122
 epoch: 7, train_loss: 0.8483, test_loss: 1.0626, test_f1: 0.5077
 epoch: 8, train_loss: 0.8225, test_loss: 1.1780, test_f1: 0.4963
 epoch: 9, train_loss: 0.8071, test_loss: 1.1187, test_f1: 0.5825
 epoch: 10, train_loss: 0.7980, test_loss: 1.1057, test_f1: 0.5488
 epoch: 11, train_loss: 0.7827, test_loss: 1.1313, test_f1: 0.5728
 epoch: 12, train_loss: 0.7662, test_loss: 1.0920, test_f1: 0.5760
 epoch: 13, train_loss: 0.7481, test_loss: 1.1672, test_f1: 0.5740
 epoch: 14, train_loss: 0.7416, test_loss: 1.1482, test_f1: 0.5270
 epoch: 15, train_loss: 0.7082, test_loss: 1.1863, test_f1: 0.5104
 epoch: 16, train_loss: 0.6986, test_loss: 1.1787, test_f1: 0.6166
 epoch: 17, train_loss: 0.6730, test_loss: 1.1665, test_f1: 0.6026
 epoch: 18, train_loss: 0.6587, test_loss: 1.0982, test_f1: 0.6264
 epoch: 19, train_loss: 0.6853, test_loss: 1.0536, test_f1: 0.6444
 epoch: 20, train_loss: 0.6682, test_loss: 1.2356, test_f1: 0.5817
 epoch: 21, train_loss: 0.6474, test_loss: 1.2060, test_f1: 0.6252
 epoch: 22, train_loss: 0.6114, test_loss: 1.2067, test_f1: 0.5801
 epoch: 23, train_loss: 0.6250, test_loss: 1.2633, test_f1: 0.5704
 epoch: 24, train_loss: 0.6074, test_loss: 1.2220, test_f1: 0.5622
 epoch: 25, train_loss: 0.6090, test_loss: 1.2689, test_f1: 0.5882
 epoch: 26, train_loss: 0.5633, test_loss: 1.3087, test_f1: 0.5725
 epoch: 27, train_loss: 0.5576, test_loss: 1.3531, test_f1: 0.6099
 epoch: 28, train_loss: 0.5639, test_loss: 1.2850, test_f1: 0.6128
 epoch: 29, train_loss: 0.5659, test_loss: 1.3331, test_f1: 0.5912
 epoch: 30, train_loss: 0.5449, test_loss: 1.3634, test_f1: 0.5929
 epoch: 31, train_loss: 0.4820, test_loss: 1.3735, test_f1: 0.6182
 epoch: 32, train_loss: 0.4965, test_loss: 1.3198, test_f1: 0.5952
 epoch: 33, train_loss: 0.5067, test_loss: 1.5017, test_f1: 0.5685
 epoch: 34, train_loss: 0.4680, test_loss: 1.3333, test_f1: 0.5875
 epoch: 35, train_loss: 0.4682, test_loss: 1.5046, test_f1: 0.5951
 epoch: 36, train_loss: 0.4804, test_loss: 1.3892, test_f1: 0.6020
 epoch: 37, train_loss: 0.4761, test_loss: 1.4269, test_f1: 0.5869
 epoch: 38, train_loss: 0.4493, test_loss: 1.3464, test_f1: 0.5978
 epoch: 39, train_loss: 0.4401, test_loss: 1.7304, test_f1: 0.6043
 epoch: 40, train_loss: 0.4733, test_loss: 1.4672, test_f1: 0.6023
 epoch: 41, train_loss: 0.4493, test_loss: 1.5862, test_f1: 0.5965
 epoch: 42, train_loss: 0.4387, test_loss: 1.5941, test_f1: 0.5802
 epoch: 43, train_loss: 0.4554, test_loss: 1.3347, test_f1: 0.6274
 epoch: 44, train_loss: 0.3976, test_loss: 1.5949, test_f1: 0.6049
 epoch: 45, train_loss: 0.4006, test_loss: 1.7020, test_f1: 0.5841
 epoch: 46, train_loss: 0.3901, test_loss: 1.6755, test_f1: 0.6264
 epoch: 47, train_loss: 0.4012, test_loss: 1.8329, test_f1: 0.5648
 epoch: 48, train_loss: 0.4006, test_loss: 1.8336, test_f1: 0.5881
 epoch: 49, train_loss: 0.3646, test_loss: 1.8430, test_f1: 0.6184
 epoch: 50, train_loss: 0.3831, test_loss: 1.8021, test_f1: 0.5814
 epoch: 51, train_loss: 0.3342, test_loss: 1.9502, test_f1: 0.6031
 epoch: 52, train_loss: 0.2809, test_loss: 2.0288, test_f1: 0.5871
 epoch: 53, train_loss: 0.2845, test_loss: 2.0210, test_f1: 0.5745
 epoch: 54, train_loss: 0.2742, test_loss: 2.2628, test_f1: 0.6037
 epoch: 55, train_loss: 0.2615, test_loss: 2.3126, test_f1: 0.5674
 epoch: 56, train_loss: 0.2489, test_loss: 2.2118, test_f1: 0.5963
 epoch: 57, train_loss: 0.2542, test_loss: 2.4640, test_f1: 0.5730
 epoch: 58, train_loss: 0.2367, test_loss: 2.4659, test_f1: 0.5954
 epoch: 59, train_loss: 0.2460, test_loss: 2.2333, test_f1: 0.5733
 epoch: 60, train_loss: 0.2406, test_loss: 2.5059, test_f1: 0.5969
 epoch: 61, train_loss: 0.2584, test_loss: 2.5241, test_f1: 0.5868
 epoch: 62, train_loss: 0.2228, test_loss: 2.2918, test_f1: 0.6044
 epoch: 63, train_loss: 0.1989, test_loss: 2.4499, test_f1: 0.5940
 epoch: 64, train_loss: 0.2380, test_loss: 2.5783, test_f1: 0.5966
 epoch: 65, train_loss: 0.2374, test_loss: 2.6687, test_f1: 0.5871
 epoch: 66, train_loss: 0.2340, test_loss: 2.6135, test_f1: 0.6183
 epoch: 67, train_loss: 0.2095, test_loss: 2.6411, test_f1: 0.5757
 epoch: 68, train_loss: 0.2036, test_loss: 2.7108, test_f1: 0.5929
 epoch: 69, train_loss: 0.2093, test_loss: 2.6175, test_f1: 0.6244
 epoch: 70, train_loss: 0.1968, test_loss: 2.6871, test_f1: 0.5867
 epoch: 71, train_loss: 0.2134, test_loss: 2.9330, test_f1: 0.5781
 epoch: 72, train_loss: 0.2240, test_loss: 2.3228, test_f1: 0.5907
 epoch: 73, train_loss: 0.1965, test_loss: 2.6284, test_f1: 0.6019
 epoch: 74, train_loss: 0.1945, test_loss: 2.7762, test_f1: 0.5728
 epoch: 75, train_loss: 0.1874, test_loss: 2.9554, test_f1: 0.5823
 epoch: 76, train_loss: 0.1799, test_loss: 2.7246, test_f1: 0.5904
 epoch: 77, train_loss: 0.1713, test_loss: 3.0673, test_f1: 0.5708
 epoch: 78, train_loss: 0.1829, test_loss: 2.8318, test_f1: 0.6065
 epoch: 79, train_loss: 0.1930, test_loss: 3.3312, test_f1: 0.5740
 epoch: 80, train_loss: 0.1996, test_loss: 2.8109, test_f1: 0.6309
 epoch: 81, train_loss: 0.1817, test_loss: 2.7850, test_f1: 0.6240
 epoch: 82, train_loss: 0.1680, test_loss: 2.7574, test_f1: 0.5951
 epoch: 83, train_loss: 0.2061, test_loss: 2.7735, test_f1: 0.5997
 epoch: 84, train_loss: 0.1936, test_loss: 3.0577, test_f1: 0.5695
 epoch: 85, train_loss: 0.1779, test_loss: 2.8993, test_f1: 0.6039
 epoch: 86, train_loss: 0.1646, test_loss: 2.9218, test_f1: 0.5889
 epoch: 87, train_loss: 0.1596, test_loss: 2.8891, test_f1: 0.5995
 epoch: 88, train_loss: 0.1706, test_loss: 3.1268, test_f1: 0.5722
 epoch: 89, train_loss: 0.1603, test_loss: 3.0508, test_f1: 0.5787
 epoch: 90, train_loss: 0.1570, test_loss: 2.9162, test_f1: 0.5900
 epoch: 91, train_loss: 0.1757, test_loss: 3.1147, test_f1: 0.5851
 epoch: 92, train_loss: 0.1974, test_loss: 3.0374, test_f1: 0.5840
 epoch: 93, train_loss: 0.1585, test_loss: 3.0407, test_f1: 0.5946
 epoch: 94, train_loss: 0.1491, test_loss: 3.3890, test_f1: 0.5883
 epoch: 95, train_loss: 0.1509, test_loss: 3.2152, test_f1: 0.5852
 epoch: 96, train_loss: 0.1346, test_loss: 3.1767, test_f1: 0.6115
 epoch: 97, train_loss: 0.1661, test_loss: 3.2375, test_f1: 0.5944
 epoch: 98, train_loss: 0.2003, test_loss: 3.1192, test_f1: 0.5949
 epoch: 99, train_loss: 0.1620, test_loss: 3.2877, test_f1: 0.5842
##################ITERATION #6 ****************************************
 epoch: 0, train_loss: 1.3146, test_loss: 1.3302, test_f1: 0.1701
 epoch: 1, train_loss: 1.0934, test_loss: 1.1658, test_f1: 0.3994
 epoch: 2, train_loss: 0.9675, test_loss: 1.1365, test_f1: 0.5182
 epoch: 3, train_loss: 0.9384, test_loss: 1.0948, test_f1: 0.4639
 epoch: 4, train_loss: 0.9002, test_loss: 1.0409, test_f1: 0.5611
 epoch: 5, train_loss: 0.8901, test_loss: 1.0995, test_f1: 0.5446
 epoch: 6, train_loss: 0.8348, test_loss: 1.0218, test_f1: 0.5652
 epoch: 7, train_loss: 0.8376, test_loss: 1.0407, test_f1: 0.5820
 epoch: 8, train_loss: 0.8252, test_loss: 1.0809, test_f1: 0.5623
 epoch: 9, train_loss: 0.8087, test_loss: 1.0735, test_f1: 0.5827
 epoch: 10, train_loss: 0.7975, test_loss: 1.0395, test_f1: 0.5965
 epoch: 11, train_loss: 0.7619, test_loss: 1.1989, test_f1: 0.5795
 epoch: 12, train_loss: 0.7680, test_loss: 1.1485, test_f1: 0.5454
 epoch: 13, train_loss: 0.7353, test_loss: 1.0531, test_f1: 0.6270
 epoch: 14, train_loss: 0.7284, test_loss: 1.1792, test_f1: 0.5642
 epoch: 15, train_loss: 0.6986, test_loss: 1.2274, test_f1: 0.5500
 epoch: 16, train_loss: 0.6776, test_loss: 1.2346, test_f1: 0.5871
 epoch: 17, train_loss: 0.6735, test_loss: 1.1787, test_f1: 0.6208
 epoch: 18, train_loss: 0.6729, test_loss: 1.2282, test_f1: 0.5769
 epoch: 19, train_loss: 0.6481, test_loss: 1.2235, test_f1: 0.6000
 epoch: 20, train_loss: 0.6024, test_loss: 1.1781, test_f1: 0.6056
 epoch: 21, train_loss: 0.5873, test_loss: 1.1729, test_f1: 0.5686
 epoch: 22, train_loss: 0.5991, test_loss: 1.3156, test_f1: 0.5883
 epoch: 23, train_loss: 0.5994, test_loss: 1.3129, test_f1: 0.5749
 epoch: 24, train_loss: 0.5519, test_loss: 1.2306, test_f1: 0.5682
 epoch: 25, train_loss: 0.5549, test_loss: 1.2836, test_f1: 0.6260
 epoch: 26, train_loss: 0.5559, test_loss: 1.3739, test_f1: 0.5663
 epoch: 27, train_loss: 0.5239, test_loss: 1.7028, test_f1: 0.5323
 epoch: 28, train_loss: 0.5108, test_loss: 1.4810, test_f1: 0.5715
 epoch: 29, train_loss: 0.4993, test_loss: 1.5630, test_f1: 0.5875
 epoch: 30, train_loss: 0.4916, test_loss: 1.4195, test_f1: 0.6015
 epoch: 31, train_loss: 0.5056, test_loss: 1.5801, test_f1: 0.5508
 epoch: 32, train_loss: 0.4879, test_loss: 1.7503, test_f1: 0.5490
 epoch: 33, train_loss: 0.4792, test_loss: 1.4884, test_f1: 0.6324
 epoch: 34, train_loss: 0.4562, test_loss: 1.7829, test_f1: 0.5912
 epoch: 35, train_loss: 0.4552, test_loss: 1.5938, test_f1: 0.5953
 epoch: 36, train_loss: 0.4494, test_loss: 1.7889, test_f1: 0.6041
 epoch: 37, train_loss: 0.4555, test_loss: 2.0051, test_f1: 0.5670
 epoch: 38, train_loss: 0.4237, test_loss: 1.4499, test_f1: 0.5948
 epoch: 39, train_loss: 0.4447, test_loss: 2.1822, test_f1: 0.5586
 epoch: 40, train_loss: 0.4290, test_loss: 1.8498, test_f1: 0.5765
 epoch: 41, train_loss: 0.4064, test_loss: 1.9372, test_f1: 0.5662
 epoch: 42, train_loss: 0.3891, test_loss: 1.5272, test_f1: 0.6207
 epoch: 43, train_loss: 0.4001, test_loss: 2.0292, test_f1: 0.5560
 epoch: 44, train_loss: 0.4043, test_loss: 1.6972, test_f1: 0.6181
 epoch: 45, train_loss: 0.3668, test_loss: 2.0012, test_f1: 0.5951
 epoch: 46, train_loss: 0.3822, test_loss: 1.6312, test_f1: 0.5933
 epoch: 47, train_loss: 0.3685, test_loss: 1.9584, test_f1: 0.5817
 epoch: 48, train_loss: 0.3478, test_loss: 2.0014, test_f1: 0.5707
 epoch: 49, train_loss: 0.3601, test_loss: 2.1945, test_f1: 0.5884
 epoch: 50, train_loss: 0.3562, test_loss: 2.1777, test_f1: 0.5571
 epoch: 51, train_loss: 0.3123, test_loss: 2.2134, test_f1: 0.5779
 epoch: 52, train_loss: 0.2905, test_loss: 2.3023, test_f1: 0.5677
 epoch: 53, train_loss: 0.2596, test_loss: 2.4976, test_f1: 0.5739
 epoch: 54, train_loss: 0.2502, test_loss: 2.5249, test_f1: 0.5695
 epoch: 55, train_loss: 0.2516, test_loss: 2.5233, test_f1: 0.5590
 epoch: 56, train_loss: 0.2576, test_loss: 2.5378, test_f1: 0.5465
 epoch: 57, train_loss: 0.2385, test_loss: 2.6813, test_f1: 0.5775
 epoch: 58, train_loss: 0.2179, test_loss: 2.5917, test_f1: 0.5683
 epoch: 59, train_loss: 0.2153, test_loss: 2.7273, test_f1: 0.5749
 epoch: 60, train_loss: 0.2075, test_loss: 2.4734, test_f1: 0.5831
 epoch: 61, train_loss: 0.2186, test_loss: 2.8068, test_f1: 0.5947
 epoch: 62, train_loss: 0.2089, test_loss: 2.9968, test_f1: 0.5775
 epoch: 63, train_loss: 0.2152, test_loss: 3.1012, test_f1: 0.5773
 epoch: 64, train_loss: 0.1993, test_loss: 3.1562, test_f1: 0.5809
 epoch: 65, train_loss: 0.2221, test_loss: 2.8483, test_f1: 0.5606
 epoch: 66, train_loss: 0.2614, test_loss: 2.7484, test_f1: 0.5883
 epoch: 67, train_loss: 0.2109, test_loss: 2.7562, test_f1: 0.6028
 epoch: 68, train_loss: 0.2127, test_loss: 3.0013, test_f1: 0.5673
 epoch: 69, train_loss: 0.1906, test_loss: 3.0851, test_f1: 0.5698
 epoch: 70, train_loss: 0.1771, test_loss: 3.0413, test_f1: 0.5843
 epoch: 71, train_loss: 0.1633, test_loss: 2.9853, test_f1: 0.5943
 epoch: 72, train_loss: 0.1775, test_loss: 3.1408, test_f1: 0.5778
 epoch: 73, train_loss: 0.1593, test_loss: 3.0290, test_f1: 0.5864
 epoch: 74, train_loss: 0.1830, test_loss: 3.0907, test_f1: 0.5656
 epoch: 75, train_loss: 0.1913, test_loss: 3.1742, test_f1: 0.5871
 epoch: 76, train_loss: 0.1868, test_loss: 3.1026, test_f1: 0.5866
 epoch: 77, train_loss: 0.1857, test_loss: 3.2621, test_f1: 0.5755
 epoch: 78, train_loss: 0.1845, test_loss: 3.1005, test_f1: 0.5986
 epoch: 79, train_loss: 0.1478, test_loss: 3.1996, test_f1: 0.5816
 epoch: 80, train_loss: 0.1674, test_loss: 3.3159, test_f1: 0.5828
 epoch: 81, train_loss: 0.1686, test_loss: 3.3537, test_f1: 0.5877
 epoch: 82, train_loss: 0.1606, test_loss: 3.3956, test_f1: 0.5685
 epoch: 83, train_loss: 0.2176, test_loss: 3.1493, test_f1: 0.5963
 epoch: 84, train_loss: 0.1568, test_loss: 3.1474, test_f1: 0.5777
 epoch: 85, train_loss: 0.1558, test_loss: 3.3740, test_f1: 0.5924
 epoch: 86, train_loss: 0.1430, test_loss: 3.0754, test_f1: 0.5923
 epoch: 87, train_loss: 0.1936, test_loss: 3.4604, test_f1: 0.5782
 epoch: 88, train_loss: 0.1716, test_loss: 3.4074, test_f1: 0.5822
 epoch: 89, train_loss: 0.1771, test_loss: 3.0646, test_f1: 0.5785
 epoch: 90, train_loss: 0.1687, test_loss: 3.2644, test_f1: 0.5872
 epoch: 91, train_loss: 0.1714, test_loss: 3.7140, test_f1: 0.5613
 epoch: 92, train_loss: 0.1428, test_loss: 3.2773, test_f1: 0.5718
 epoch: 93, train_loss: 0.1416, test_loss: 3.2160, test_f1: 0.6020
 epoch: 94, train_loss: 0.1523, test_loss: 3.5623, test_f1: 0.5574
 epoch: 95, train_loss: 0.1419, test_loss: 3.6271, test_f1: 0.5696
 epoch: 96, train_loss: 0.1261, test_loss: 3.7805, test_f1: 0.5735
 epoch: 97, train_loss: 0.1255, test_loss: 3.2757, test_f1: 0.5600
 epoch: 98, train_loss: 0.1626, test_loss: 3.4828, test_f1: 0.5875
 epoch: 99, train_loss: 0.1358, test_loss: 3.5366, test_f1: 0.5688
##################ITERATION #7 ****************************************
 epoch: 0, train_loss: 1.3977, test_loss: 1.2356, test_f1: 0.3769
 epoch: 1, train_loss: 1.0824, test_loss: 1.1417, test_f1: 0.4945
 epoch: 2, train_loss: 0.9787, test_loss: 1.0733, test_f1: 0.5119
 epoch: 3, train_loss: 0.9850, test_loss: 1.1176, test_f1: 0.4747
 epoch: 4, train_loss: 0.9414, test_loss: 1.0352, test_f1: 0.5324
 epoch: 5, train_loss: 0.8976, test_loss: 1.0404, test_f1: 0.5449
 epoch: 6, train_loss: 0.8997, test_loss: 1.0484, test_f1: 0.5165
 epoch: 7, train_loss: 0.8841, test_loss: 1.0591, test_f1: 0.5258
 epoch: 8, train_loss: 0.8366, test_loss: 1.0419, test_f1: 0.5550
 epoch: 9, train_loss: 0.8308, test_loss: 1.0759, test_f1: 0.5245
 epoch: 10, train_loss: 0.8237, test_loss: 1.0207, test_f1: 0.5428
 epoch: 11, train_loss: 0.8242, test_loss: 0.9981, test_f1: 0.6378
 epoch: 12, train_loss: 0.7870, test_loss: 1.0919, test_f1: 0.5273
 epoch: 13, train_loss: 0.7845, test_loss: 0.9498, test_f1: 0.6187
 epoch: 14, train_loss: 0.8058, test_loss: 1.0384, test_f1: 0.5731
 epoch: 15, train_loss: 0.7844, test_loss: 1.1196, test_f1: 0.5585
 epoch: 16, train_loss: 0.7552, test_loss: 1.0398, test_f1: 0.5607
 epoch: 17, train_loss: 0.7694, test_loss: 1.1289, test_f1: 0.6253
 epoch: 18, train_loss: 0.7170, test_loss: 1.0708, test_f1: 0.5832
 epoch: 19, train_loss: 0.7073, test_loss: 1.1324, test_f1: 0.5421
 epoch: 20, train_loss: 0.7136, test_loss: 1.0640, test_f1: 0.6160
 epoch: 21, train_loss: 0.6923, test_loss: 1.2201, test_f1: 0.5473
 epoch: 22, train_loss: 0.6792, test_loss: 1.1312, test_f1: 0.5635
 epoch: 23, train_loss: 0.6622, test_loss: 1.2742, test_f1: 0.6026
 epoch: 24, train_loss: 0.6552, test_loss: 1.1100, test_f1: 0.6189
 epoch: 25, train_loss: 0.6545, test_loss: 1.1620, test_f1: 0.6004
 epoch: 26, train_loss: 0.6132, test_loss: 1.2080, test_f1: 0.5983
 epoch: 27, train_loss: 0.6217, test_loss: 1.2107, test_f1: 0.6383
 epoch: 28, train_loss: 0.6148, test_loss: 1.1687, test_f1: 0.5483
 epoch: 29, train_loss: 0.5927, test_loss: 1.2035, test_f1: 0.5938
 epoch: 30, train_loss: 0.6173, test_loss: 1.1083, test_f1: 0.5737
 epoch: 31, train_loss: 0.5645, test_loss: 1.1474, test_f1: 0.6295
 epoch: 32, train_loss: 0.5664, test_loss: 1.3795, test_f1: 0.6075
 epoch: 33, train_loss: 0.5384, test_loss: 1.1228, test_f1: 0.6449
 epoch: 34, train_loss: 0.5726, test_loss: 1.3887, test_f1: 0.5871
 epoch: 35, train_loss: 0.5405, test_loss: 1.3626, test_f1: 0.5877
 epoch: 36, train_loss: 0.5404, test_loss: 1.2973, test_f1: 0.6022
 epoch: 37, train_loss: 0.5110, test_loss: 1.3060, test_f1: 0.6038
 epoch: 38, train_loss: 0.4839, test_loss: 1.3659, test_f1: 0.6418
 epoch: 39, train_loss: 0.4794, test_loss: 1.5920, test_f1: 0.6131
 epoch: 40, train_loss: 0.4843, test_loss: 1.3410, test_f1: 0.6104
 epoch: 41, train_loss: 0.4808, test_loss: 1.5184, test_f1: 0.5936
 epoch: 42, train_loss: 0.4923, test_loss: 1.5734, test_f1: 0.5781
 epoch: 43, train_loss: 0.4605, test_loss: 1.5127, test_f1: 0.5474
 epoch: 44, train_loss: 0.4855, test_loss: 1.7519, test_f1: 0.6027
 epoch: 45, train_loss: 0.4220, test_loss: 1.6601, test_f1: 0.5921
 epoch: 46, train_loss: 0.4111, test_loss: 1.4744, test_f1: 0.6298
 epoch: 47, train_loss: 0.4130, test_loss: 1.6259, test_f1: 0.5775
 epoch: 48, train_loss: 0.4225, test_loss: 1.7902, test_f1: 0.5777
 epoch: 49, train_loss: 0.4087, test_loss: 1.6876, test_f1: 0.6221
 epoch: 50, train_loss: 0.3918, test_loss: 1.4719, test_f1: 0.6265
 epoch: 51, train_loss: 0.3493, test_loss: 1.6807, test_f1: 0.6189
 epoch: 52, train_loss: 0.3333, test_loss: 1.6268, test_f1: 0.6109
 epoch: 53, train_loss: 0.3438, test_loss: 1.7814, test_f1: 0.5947
 epoch: 54, train_loss: 0.2984, test_loss: 1.7831, test_f1: 0.5946
 epoch: 55, train_loss: 0.2992, test_loss: 1.9243, test_f1: 0.6164
 epoch: 56, train_loss: 0.2897, test_loss: 1.7761, test_f1: 0.6256
 epoch: 57, train_loss: 0.2873, test_loss: 1.8565, test_f1: 0.6423
 epoch: 58, train_loss: 0.2891, test_loss: 1.8983, test_f1: 0.6026
 epoch: 59, train_loss: 0.2791, test_loss: 1.8406, test_f1: 0.6508
 epoch: 60, train_loss: 0.2946, test_loss: 2.0735, test_f1: 0.6221
 epoch: 61, train_loss: 0.2455, test_loss: 2.0256, test_f1: 0.6220
 epoch: 62, train_loss: 0.2636, test_loss: 2.0360, test_f1: 0.6121
 epoch: 63, train_loss: 0.2652, test_loss: 2.2316, test_f1: 0.6133
 epoch: 64, train_loss: 0.2542, test_loss: 2.2503, test_f1: 0.5962
 epoch: 65, train_loss: 0.2466, test_loss: 2.2216, test_f1: 0.6025
 epoch: 66, train_loss: 0.2631, test_loss: 2.4742, test_f1: 0.5838
 epoch: 67, train_loss: 0.2536, test_loss: 2.2549, test_f1: 0.6037
 epoch: 68, train_loss: 0.2601, test_loss: 2.0975, test_f1: 0.6356
 epoch: 69, train_loss: 0.2729, test_loss: 2.2828, test_f1: 0.5941
 epoch: 70, train_loss: 0.2569, test_loss: 2.2048, test_f1: 0.5980
 epoch: 71, train_loss: 0.2313, test_loss: 1.9839, test_f1: 0.6299
 epoch: 72, train_loss: 0.2284, test_loss: 2.3053, test_f1: 0.6123
 epoch: 73, train_loss: 0.2359, test_loss: 2.4076, test_f1: 0.6068
 epoch: 74, train_loss: 0.2348, test_loss: 2.3057, test_f1: 0.6249
 epoch: 75, train_loss: 0.2636, test_loss: 2.3213, test_f1: 0.6327
 epoch: 76, train_loss: 0.2051, test_loss: 2.4085, test_f1: 0.5995
 epoch: 77, train_loss: 0.2092, test_loss: 2.7769, test_f1: 0.5487
 epoch: 78, train_loss: 0.2320, test_loss: 2.3758, test_f1: 0.6299
 epoch: 79, train_loss: 0.2317, test_loss: 2.3628, test_f1: 0.6204
 epoch: 80, train_loss: 0.2329, test_loss: 2.4025, test_f1: 0.5892
 epoch: 81, train_loss: 0.2185, test_loss: 2.3933, test_f1: 0.6058
 epoch: 82, train_loss: 0.1838, test_loss: 2.3397, test_f1: 0.5904
 epoch: 83, train_loss: 0.1927, test_loss: 2.4402, test_f1: 0.6231
 epoch: 84, train_loss: 0.2068, test_loss: 2.6267, test_f1: 0.6119
 epoch: 85, train_loss: 0.2091, test_loss: 2.6298, test_f1: 0.6104
 epoch: 86, train_loss: 0.2041, test_loss: 2.3019, test_f1: 0.6101
 epoch: 87, train_loss: 0.1835, test_loss: 2.4874, test_f1: 0.6172
 epoch: 88, train_loss: 0.2061, test_loss: 2.5227, test_f1: 0.6258
 epoch: 89, train_loss: 0.1928, test_loss: 2.8419, test_f1: 0.6063
 epoch: 90, train_loss: 0.2082, test_loss: 2.6182, test_f1: 0.6269
 epoch: 91, train_loss: 0.1971, test_loss: 2.9131, test_f1: 0.6064
 epoch: 92, train_loss: 0.1948, test_loss: 2.6516, test_f1: 0.6204
 epoch: 93, train_loss: 0.2016, test_loss: 2.7166, test_f1: 0.6085
 epoch: 94, train_loss: 0.2041, test_loss: 2.4445, test_f1: 0.6095
 epoch: 95, train_loss: 0.1763, test_loss: 2.6053, test_f1: 0.6001
 epoch: 96, train_loss: 0.1755, test_loss: 2.4938, test_f1: 0.6430
 epoch: 97, train_loss: 0.1915, test_loss: 2.7636, test_f1: 0.6069
 epoch: 98, train_loss: 0.1652, test_loss: 2.5984, test_f1: 0.6246
 epoch: 99, train_loss: 0.1646, test_loss: 2.7819, test_f1: 0.6003
##################ITERATION #8 ****************************************
 epoch: 0, train_loss: 1.3892, test_loss: 1.3904, test_f1: 0.1365
 epoch: 1, train_loss: 1.0905, test_loss: 1.1931, test_f1: 0.3907
 epoch: 2, train_loss: 0.9919, test_loss: 1.1174, test_f1: 0.4232
 epoch: 3, train_loss: 0.9426, test_loss: 1.0503, test_f1: 0.5584
 epoch: 4, train_loss: 0.9125, test_loss: 1.0654, test_f1: 0.5645
 epoch: 5, train_loss: 0.8893, test_loss: 1.0123, test_f1: 0.5947
 epoch: 6, train_loss: 0.8818, test_loss: 1.0733, test_f1: 0.5216
 epoch: 7, train_loss: 0.8664, test_loss: 1.0004, test_f1: 0.5681
 epoch: 8, train_loss: 0.8533, test_loss: 1.0581, test_f1: 0.5459
 epoch: 9, train_loss: 0.8314, test_loss: 0.9952, test_f1: 0.5834
 epoch: 10, train_loss: 0.8310, test_loss: 1.0829, test_f1: 0.5369
 epoch: 11, train_loss: 0.8051, test_loss: 1.0290, test_f1: 0.5598
 epoch: 12, train_loss: 0.7811, test_loss: 1.0402, test_f1: 0.5740
 epoch: 13, train_loss: 0.7780, test_loss: 1.0932, test_f1: 0.6041
 epoch: 14, train_loss: 0.7632, test_loss: 1.1127, test_f1: 0.5655
 epoch: 15, train_loss: 0.7424, test_loss: 1.1602, test_f1: 0.6064
 epoch: 16, train_loss: 0.7260, test_loss: 1.0552, test_f1: 0.6128
 epoch: 17, train_loss: 0.7351, test_loss: 1.1512, test_f1: 0.6176
 epoch: 18, train_loss: 0.7075, test_loss: 1.1624, test_f1: 0.5694
 epoch: 19, train_loss: 0.6824, test_loss: 1.3364, test_f1: 0.5153
 epoch: 20, train_loss: 0.6570, test_loss: 1.2032, test_f1: 0.6162
 epoch: 21, train_loss: 0.6666, test_loss: 1.1961, test_f1: 0.6167
 epoch: 22, train_loss: 0.6703, test_loss: 1.3334, test_f1: 0.6007
 epoch: 23, train_loss: 0.6550, test_loss: 1.2449, test_f1: 0.5729
 epoch: 24, train_loss: 0.6435, test_loss: 1.3884, test_f1: 0.5488
 epoch: 25, train_loss: 0.6020, test_loss: 1.5018, test_f1: 0.5513
 epoch: 26, train_loss: 0.6216, test_loss: 1.3272, test_f1: 0.5830
 epoch: 27, train_loss: 0.5650, test_loss: 1.3256, test_f1: 0.6047
 epoch: 28, train_loss: 0.5542, test_loss: 1.2818, test_f1: 0.6009
 epoch: 29, train_loss: 0.5650, test_loss: 1.4011, test_f1: 0.5813
 epoch: 30, train_loss: 0.5242, test_loss: 1.3952, test_f1: 0.6033
 epoch: 31, train_loss: 0.5501, test_loss: 1.3755, test_f1: 0.5969
 epoch: 32, train_loss: 0.5410, test_loss: 1.5763, test_f1: 0.5839
 epoch: 33, train_loss: 0.5246, test_loss: 1.5536, test_f1: 0.6071
 epoch: 34, train_loss: 0.5319, test_loss: 1.4471, test_f1: 0.5964
 epoch: 35, train_loss: 0.5229, test_loss: 1.5679, test_f1: 0.5487
 epoch: 36, train_loss: 0.4740, test_loss: 1.5509, test_f1: 0.6006
 epoch: 37, train_loss: 0.4847, test_loss: 1.6650, test_f1: 0.5852
 epoch: 38, train_loss: 0.4935, test_loss: 1.4855, test_f1: 0.5881
 epoch: 39, train_loss: 0.4670, test_loss: 1.5547, test_f1: 0.6033
 epoch: 40, train_loss: 0.4748, test_loss: 1.6421, test_f1: 0.5546
 epoch: 41, train_loss: 0.4278, test_loss: 1.5667, test_f1: 0.5886
 epoch: 42, train_loss: 0.4383, test_loss: 1.6712, test_f1: 0.6148
 epoch: 43, train_loss: 0.4290, test_loss: 1.6478, test_f1: 0.6177
 epoch: 44, train_loss: 0.4269, test_loss: 1.9401, test_f1: 0.5627
 epoch: 45, train_loss: 0.4079, test_loss: 1.8026, test_f1: 0.6117
 epoch: 46, train_loss: 0.4475, test_loss: 1.9072, test_f1: 0.5844
 epoch: 47, train_loss: 0.4108, test_loss: 2.1814, test_f1: 0.5735
 epoch: 48, train_loss: 0.4274, test_loss: 1.7234, test_f1: 0.6193
 epoch: 49, train_loss: 0.4090, test_loss: 1.8044, test_f1: 0.6043
 epoch: 50, train_loss: 0.3726, test_loss: 1.7757, test_f1: 0.5996
 epoch: 51, train_loss: 0.3530, test_loss: 1.7713, test_f1: 0.6207
 epoch: 52, train_loss: 0.3087, test_loss: 1.8707, test_f1: 0.6154
 epoch: 53, train_loss: 0.3008, test_loss: 2.0935, test_f1: 0.6121
 epoch: 54, train_loss: 0.2689, test_loss: 2.1738, test_f1: 0.5863
 epoch: 55, train_loss: 0.2853, test_loss: 2.1189, test_f1: 0.6022
 epoch: 56, train_loss: 0.2686, test_loss: 2.2292, test_f1: 0.6133
 epoch: 57, train_loss: 0.2710, test_loss: 2.3581, test_f1: 0.5727
 epoch: 58, train_loss: 0.2620, test_loss: 2.4740, test_f1: 0.5965
 epoch: 59, train_loss: 0.2447, test_loss: 2.5114, test_f1: 0.5769
 epoch: 60, train_loss: 0.2391, test_loss: 2.5537, test_f1: 0.6132
 epoch: 61, train_loss: 0.2579, test_loss: 2.5777, test_f1: 0.5830
 epoch: 62, train_loss: 0.2479, test_loss: 2.7225, test_f1: 0.5766
 epoch: 63, train_loss: 0.2553, test_loss: 2.5672, test_f1: 0.6021
 epoch: 64, train_loss: 0.2347, test_loss: 2.3847, test_f1: 0.6314
 epoch: 65, train_loss: 0.2261, test_loss: 2.5657, test_f1: 0.6098
 epoch: 66, train_loss: 0.2259, test_loss: 2.6843, test_f1: 0.5988
 epoch: 67, train_loss: 0.2474, test_loss: 2.6808, test_f1: 0.5983
 epoch: 68, train_loss: 0.2208, test_loss: 2.5063, test_f1: 0.5987
 epoch: 69, train_loss: 0.2265, test_loss: 2.7061, test_f1: 0.5708
 epoch: 70, train_loss: 0.2029, test_loss: 2.9706, test_f1: 0.5631
 epoch: 71, train_loss: 0.2456, test_loss: 2.5899, test_f1: 0.6117
 epoch: 72, train_loss: 0.1935, test_loss: 2.7836, test_f1: 0.6093
 epoch: 73, train_loss: 0.2247, test_loss: 2.6268, test_f1: 0.5950
 epoch: 74, train_loss: 0.2196, test_loss: 2.8015, test_f1: 0.6062
 epoch: 75, train_loss: 0.2088, test_loss: 3.0606, test_f1: 0.5802
 epoch: 76, train_loss: 0.1857, test_loss: 2.9305, test_f1: 0.5774
 epoch: 77, train_loss: 0.1759, test_loss: 2.9232, test_f1: 0.5752
 epoch: 78, train_loss: 0.1848, test_loss: 2.8936, test_f1: 0.5879
 epoch: 79, train_loss: 0.2256, test_loss: 2.8973, test_f1: 0.6131
 epoch: 80, train_loss: 0.1994, test_loss: 2.9661, test_f1: 0.6060
 epoch: 81, train_loss: 0.1901, test_loss: 2.7439, test_f1: 0.6366
 epoch: 82, train_loss: 0.1709, test_loss: 3.0302, test_f1: 0.6181
 epoch: 83, train_loss: 0.1970, test_loss: 3.1134, test_f1: 0.5909
 epoch: 84, train_loss: 0.2168, test_loss: 3.1225, test_f1: 0.5926
 epoch: 85, train_loss: 0.1803, test_loss: 3.0925, test_f1: 0.5874
 epoch: 86, train_loss: 0.1747, test_loss: 3.1095, test_f1: 0.6018
 epoch: 87, train_loss: 0.1810, test_loss: 3.4292, test_f1: 0.5976
 epoch: 88, train_loss: 0.2201, test_loss: 2.8780, test_f1: 0.6193
 epoch: 89, train_loss: 0.1914, test_loss: 3.2061, test_f1: 0.6078
 epoch: 90, train_loss: 0.1719, test_loss: 3.1627, test_f1: 0.5672
 epoch: 91, train_loss: 0.1706, test_loss: 3.3639, test_f1: 0.5692
 epoch: 92, train_loss: 0.1746, test_loss: 3.3284, test_f1: 0.6016
 epoch: 93, train_loss: 0.1610, test_loss: 3.2889, test_f1: 0.6009
 epoch: 94, train_loss: 0.1455, test_loss: 3.2651, test_f1: 0.6049
 epoch: 95, train_loss: 0.1645, test_loss: 3.2212, test_f1: 0.6172
 epoch: 96, train_loss: 0.1745, test_loss: 3.1934, test_f1: 0.5787
 epoch: 97, train_loss: 0.1817, test_loss: 3.3025, test_f1: 0.6027
 epoch: 98, train_loss: 0.1608, test_loss: 3.3613, test_f1: 0.6087
 epoch: 99, train_loss: 0.1612, test_loss: 3.3859, test_f1: 0.5794
##################ITERATION #9 ****************************************
 epoch: 0, train_loss: 1.4268, test_loss: 1.3959, test_f1: 0.1365
 epoch: 1, train_loss: 1.1219, test_loss: 1.1833, test_f1: 0.3607
 epoch: 2, train_loss: 0.9786, test_loss: 1.0672, test_f1: 0.5428
 epoch: 3, train_loss: 0.9493, test_loss: 1.0397, test_f1: 0.5428
 epoch: 4, train_loss: 0.9446, test_loss: 1.0546, test_f1: 0.5280
 epoch: 5, train_loss: 0.8852, test_loss: 1.0643, test_f1: 0.5476
 epoch: 6, train_loss: 0.9019, test_loss: 1.0637, test_f1: 0.5100
 epoch: 7, train_loss: 0.8570, test_loss: 1.0775, test_f1: 0.5329
 epoch: 8, train_loss: 0.8441, test_loss: 1.0187, test_f1: 0.5898
 epoch: 9, train_loss: 0.8385, test_loss: 1.1437, test_f1: 0.5978
 epoch: 10, train_loss: 0.8176, test_loss: 1.0009, test_f1: 0.6040
 epoch: 11, train_loss: 0.7955, test_loss: 1.1168, test_f1: 0.5654
 epoch: 12, train_loss: 0.7919, test_loss: 0.9969, test_f1: 0.6192
 epoch: 13, train_loss: 0.7594, test_loss: 1.0505, test_f1: 0.6042
 epoch: 14, train_loss: 0.7494, test_loss: 1.1362, test_f1: 0.6138
 epoch: 15, train_loss: 0.7621, test_loss: 1.0240, test_f1: 0.5875
 epoch: 16, train_loss: 0.7173, test_loss: 1.0619, test_f1: 0.5968
 epoch: 17, train_loss: 0.7060, test_loss: 1.4074, test_f1: 0.5558
 epoch: 18, train_loss: 0.6837, test_loss: 1.0857, test_f1: 0.6206
 epoch: 19, train_loss: 0.6671, test_loss: 1.1669, test_f1: 0.5770
 epoch: 20, train_loss: 0.6478, test_loss: 1.2941, test_f1: 0.5550
 epoch: 21, train_loss: 0.6461, test_loss: 1.1532, test_f1: 0.5678
 epoch: 22, train_loss: 0.6088, test_loss: 1.1180, test_f1: 0.6539
 epoch: 23, train_loss: 0.6131, test_loss: 1.0304, test_f1: 0.5994
 epoch: 24, train_loss: 0.5884, test_loss: 1.3720, test_f1: 0.6029
 epoch: 25, train_loss: 0.6304, test_loss: 1.2905, test_f1: 0.4898
 epoch: 26, train_loss: 0.6095, test_loss: 1.3200, test_f1: 0.5683
 epoch: 27, train_loss: 0.5581, test_loss: 1.2659, test_f1: 0.6010
 epoch: 28, train_loss: 0.5338, test_loss: 1.2333, test_f1: 0.5980
 epoch: 29, train_loss: 0.5164, test_loss: 1.2227, test_f1: 0.5941
 epoch: 30, train_loss: 0.5191, test_loss: 1.2417, test_f1: 0.6432
 epoch: 31, train_loss: 0.5030, test_loss: 1.3293, test_f1: 0.6226
 epoch: 32, train_loss: 0.4911, test_loss: 1.5214, test_f1: 0.6068
 epoch: 33, train_loss: 0.4860, test_loss: 1.3751, test_f1: 0.6128
 epoch: 34, train_loss: 0.5261, test_loss: 1.1997, test_f1: 0.6261
 epoch: 35, train_loss: 0.5090, test_loss: 1.2076, test_f1: 0.6162
 epoch: 36, train_loss: 0.4726, test_loss: 1.5644, test_f1: 0.5707
 epoch: 37, train_loss: 0.4631, test_loss: 1.5124, test_f1: 0.5676
 epoch: 38, train_loss: 0.4402, test_loss: 1.4119, test_f1: 0.6112
 epoch: 39, train_loss: 0.4365, test_loss: 1.6154, test_f1: 0.5842
 epoch: 40, train_loss: 0.4291, test_loss: 1.9195, test_f1: 0.5657
 epoch: 41, train_loss: 0.4744, test_loss: 1.5511, test_f1: 0.5699
 epoch: 42, train_loss: 0.4525, test_loss: 1.3873, test_f1: 0.6077
 epoch: 43, train_loss: 0.4771, test_loss: 1.2778, test_f1: 0.6169
 epoch: 44, train_loss: 0.4545, test_loss: 1.4852, test_f1: 0.6269
 epoch: 45, train_loss: 0.4442, test_loss: 1.4809, test_f1: 0.6365
 epoch: 46, train_loss: 0.3855, test_loss: 1.6138, test_f1: 0.6328
 epoch: 47, train_loss: 0.3817, test_loss: 1.5754, test_f1: 0.6078
 epoch: 48, train_loss: 0.3741, test_loss: 1.7436, test_f1: 0.5655
 epoch: 49, train_loss: 0.3675, test_loss: 1.7859, test_f1: 0.5664
 epoch: 50, train_loss: 0.3894, test_loss: 1.8671, test_f1: 0.5594
 epoch: 51, train_loss: 0.3189, test_loss: 1.7277, test_f1: 0.6177
 epoch: 52, train_loss: 0.2868, test_loss: 1.7032, test_f1: 0.6001
 epoch: 53, train_loss: 0.2795, test_loss: 1.8290, test_f1: 0.6215
 epoch: 54, train_loss: 0.2660, test_loss: 2.0192, test_f1: 0.6201
 epoch: 55, train_loss: 0.2617, test_loss: 2.1089, test_f1: 0.5935
 epoch: 56, train_loss: 0.2644, test_loss: 1.8833, test_f1: 0.6093
 epoch: 57, train_loss: 0.2796, test_loss: 1.8872, test_f1: 0.5961
 epoch: 58, train_loss: 0.2727, test_loss: 1.8939, test_f1: 0.6150
 epoch: 59, train_loss: 0.2524, test_loss: 1.8845, test_f1: 0.6411
 epoch: 60, train_loss: 0.2293, test_loss: 1.9752, test_f1: 0.6262
 epoch: 61, train_loss: 0.2306, test_loss: 1.8697, test_f1: 0.6352
 epoch: 62, train_loss: 0.2712, test_loss: 2.1349, test_f1: 0.6250
 epoch: 63, train_loss: 0.2241, test_loss: 1.9710, test_f1: 0.6034
 epoch: 64, train_loss: 0.2261, test_loss: 2.0760, test_f1: 0.6079
 epoch: 65, train_loss: 0.2472, test_loss: 2.2339, test_f1: 0.6125
 epoch: 66, train_loss: 0.2485, test_loss: 1.9576, test_f1: 0.6448
 epoch: 67, train_loss: 0.2217, test_loss: 1.9049, test_f1: 0.6103
 epoch: 68, train_loss: 0.2027, test_loss: 2.3209, test_f1: 0.6035
 epoch: 69, train_loss: 0.2438, test_loss: 2.1322, test_f1: 0.5741
 epoch: 70, train_loss: 0.1944, test_loss: 2.2986, test_f1: 0.6404
 epoch: 71, train_loss: 0.1952, test_loss: 2.1792, test_f1: 0.6470
 epoch: 72, train_loss: 0.2088, test_loss: 2.2010, test_f1: 0.6068
 epoch: 73, train_loss: 0.2085, test_loss: 2.1203, test_f1: 0.6364
 epoch: 74, train_loss: 0.1998, test_loss: 2.2641, test_f1: 0.6179
 epoch: 75, train_loss: 0.1728, test_loss: 2.4560, test_f1: 0.6262
 epoch: 76, train_loss: 0.1921, test_loss: 2.4525, test_f1: 0.5932
 epoch: 77, train_loss: 0.1845, test_loss: 2.5929, test_f1: 0.5828
 epoch: 78, train_loss: 0.1855, test_loss: 2.3073, test_f1: 0.6114
 epoch: 79, train_loss: 0.1748, test_loss: 2.6513, test_f1: 0.5838
 epoch: 80, train_loss: 0.1897, test_loss: 2.6522, test_f1: 0.6050
 epoch: 81, train_loss: 0.2471, test_loss: 2.5287, test_f1: 0.6008
 epoch: 82, train_loss: 0.2137, test_loss: 2.2677, test_f1: 0.6397
 epoch: 83, train_loss: 0.1934, test_loss: 2.3683, test_f1: 0.6229
 epoch: 84, train_loss: 0.2070, test_loss: 2.4233, test_f1: 0.5874
 epoch: 85, train_loss: 0.2021, test_loss: 2.4550, test_f1: 0.6262
 epoch: 86, train_loss: 0.1925, test_loss: 2.7425, test_f1: 0.5875
 epoch: 87, train_loss: 0.1690, test_loss: 2.6043, test_f1: 0.6005
 epoch: 88, train_loss: 0.1729, test_loss: 2.5090, test_f1: 0.6138
 epoch: 89, train_loss: 0.1857, test_loss: 2.3791, test_f1: 0.5998
 epoch: 90, train_loss: 0.1926, test_loss: 2.5423, test_f1: 0.6099
 epoch: 91, train_loss: 0.1847, test_loss: 2.6038, test_f1: 0.5883
 epoch: 92, train_loss: 0.1718, test_loss: 2.7149, test_f1: 0.5899
 epoch: 93, train_loss: 0.1853, test_loss: 2.6760, test_f1: 0.6276
 epoch: 94, train_loss: 0.1615, test_loss: 2.5769, test_f1: 0.6020
 epoch: 95, train_loss: 0.1554, test_loss: 2.8892, test_f1: 0.5812
 epoch: 96, train_loss: 0.1440, test_loss: 2.7476, test_f1: 0.6034
 epoch: 97, train_loss: 0.1483, test_loss: 2.5096, test_f1: 0.6312
 epoch: 98, train_loss: 0.1570, test_loss: 2.5744, test_f1: 0.6032
 epoch: 99, train_loss: 0.1530, test_loss: 3.1398, test_f1: 0.6442

Training completed in 460.66 seconds
Best F1: 0.6539 at epoch 22
Mean F1 across iterations: 0.6416  0.0082
========================FINAL RESULTS================================
FEGIN weighted F1: 0.6539  0.0082
python main.py --data ltspice_demos --representation component_net --model FEGIN --layers 4 --hiddens 128 --batch_size 64 --lr 0.001 --emb_size 128 --epochs 100 --save_appendix component_net_L4_H128_BS64_LR0.001_E128 --no_val
-----



STDERR:
Processing...
Done!
  File "main.py", line 370, in <module>
    main()
  File "main.py", line 254, in main
    dataset = dataset_class(
  File "/home/philip/projects/ltspice_examples_code_repo/Circuit-Completion-Using-GNNs/component_classification_with_link_prediction_head/evaluation/FEGIN/kernel/circuit_datasets.py", line 15, in __init__
    self.data, self.slices = torch.load(self.processed_paths[0])
  File "/home/philip/.local/lib/python3.8/site-packages/torch/serialization.py", line 1040, in load
    warnings.warn(
  File "/usr/lib/python3.8/warnings.py", line 109, in _showwarnmsg
    sw(msg.message, msg.category, msg.filename, msg.lineno,
  File "main.py", line 47, in warn_with_traceback
    traceback.print_stack(file=log)
/home/philip/projects/ltspice_examples_code_repo/Circuit-Completion-Using-GNNs/component_classification_with_link_prediction_head/evaluation/FEGIN/kernel/circuit_datasets.py:15: FutureWarning: You are using `torch.load` with `weights_only=False` (the current default value), which uses the default pickle module implicitly. It is possible to construct malicious pickle data which will execute arbitrary code during unpickling (See https://github.com/pytorch/pytorch/blob/main/SECURITY.md#untrusted-models for more details). In a future release, the default value for `weights_only` will be flipped to `True`. This limits the functions that could be executed during unpickling. Arbitrary objects will no longer be allowed to be loaded via this mode unless they are explicitly allowlisted by the user via `torch.serialization.add_safe_globals`. We recommend you start setting `weights_only=True` for any use case where you don't have full control of the loaded file. Please open an issue on GitHub for any issues related to this experimental feature.
  self.data, self.slices = torch.load(self.processed_paths[0])
