STDOUT:
Results will be saved in /home/philip/projects/ltspice_examples_code_repo/Circuit-Completion-Using-GNNs/component_classification_with_link_prediction_head/evaluation/FEGIN/results/model_FEGIN_dataset_ltspice_examples
Command line input: python main.py --data ltspice_examples --representation component_pin --model FEGIN --layers 3 --hiddens 128 --batch_size 128 --lr 0.001 --emb_size 250 --epochs 100 --save_appendix component_pin_L3_H128_BS128_LR0.001_E250 --no_val
 is saved.
-----
ltspice_examples - FEGIN
Using 3 layers, 128 hidden units, h = 2
Loading component_pin representation dataset
ENTERED
Training FEGIN on component_pin representation
Train: 3560, Test: 848
##################ITERATION #0 ****************************************
 epoch: 0, train_loss: 1.2419, test_loss: 1.2275, test_f1: 0.2260
 epoch: 1, train_loss: 1.0233, test_loss: 1.0042, test_f1: 0.4021
 epoch: 2, train_loss: 0.9340, test_loss: 0.9782, test_f1: 0.4622
 epoch: 3, train_loss: 0.8835, test_loss: 0.9546, test_f1: 0.5028
 epoch: 4, train_loss: 0.8446, test_loss: 1.0101, test_f1: 0.5223
 epoch: 5, train_loss: 0.8137, test_loss: 0.9137, test_f1: 0.5177
 epoch: 6, train_loss: 0.7971, test_loss: 0.9666, test_f1: 0.4913
 epoch: 7, train_loss: 0.7725, test_loss: 0.8578, test_f1: 0.5758
 epoch: 8, train_loss: 0.7376, test_loss: 0.8872, test_f1: 0.5417
 epoch: 9, train_loss: 0.7269, test_loss: 0.8939, test_f1: 0.5707
 epoch: 10, train_loss: 0.7187, test_loss: 0.9363, test_f1: 0.5232
 epoch: 11, train_loss: 0.6969, test_loss: 0.9294, test_f1: 0.5161
 epoch: 12, train_loss: 0.6840, test_loss: 1.0882, test_f1: 0.4975
 epoch: 13, train_loss: 0.6758, test_loss: 0.9073, test_f1: 0.5469
 epoch: 14, train_loss: 0.6672, test_loss: 0.9240, test_f1: 0.5766
 epoch: 15, train_loss: 0.6380, test_loss: 1.0220, test_f1: 0.5864
 epoch: 16, train_loss: 0.6103, test_loss: 0.9269, test_f1: 0.5836
 epoch: 17, train_loss: 0.6034, test_loss: 1.0915, test_f1: 0.5619
 epoch: 18, train_loss: 0.5990, test_loss: 0.9523, test_f1: 0.5951
 epoch: 19, train_loss: 0.6029, test_loss: 1.0052, test_f1: 0.5992
 epoch: 20, train_loss: 0.5646, test_loss: 0.9328, test_f1: 0.6160
 epoch: 21, train_loss: 0.5649, test_loss: 0.9048, test_f1: 0.6041
 epoch: 22, train_loss: 0.5643, test_loss: 0.9850, test_f1: 0.6018
 epoch: 23, train_loss: 0.5428, test_loss: 0.9203, test_f1: 0.6292
 epoch: 24, train_loss: 0.5247, test_loss: 0.9774, test_f1: 0.5874
 epoch: 25, train_loss: 0.5211, test_loss: 1.0053, test_f1: 0.6083
 epoch: 26, train_loss: 0.5131, test_loss: 0.9418, test_f1: 0.6146
 epoch: 27, train_loss: 0.5016, test_loss: 1.0190, test_f1: 0.6148
 epoch: 28, train_loss: 0.5034, test_loss: 1.1027, test_f1: 0.6228
 epoch: 29, train_loss: 0.5048, test_loss: 0.9313, test_f1: 0.6399
 epoch: 30, train_loss: 0.4856, test_loss: 1.0893, test_f1: 0.6206
 epoch: 31, train_loss: 0.4681, test_loss: 1.0341, test_f1: 0.6372
 epoch: 32, train_loss: 0.4519, test_loss: 1.1578, test_f1: 0.6212
 epoch: 33, train_loss: 0.4373, test_loss: 1.2242, test_f1: 0.5774
 epoch: 34, train_loss: 0.4375, test_loss: 1.5824, test_f1: 0.5949
 epoch: 35, train_loss: 0.4347, test_loss: 1.1490, test_f1: 0.6312
 epoch: 36, train_loss: 0.4201, test_loss: 1.2322, test_f1: 0.6055
 epoch: 37, train_loss: 0.4153, test_loss: 1.1916, test_f1: 0.5987
 epoch: 38, train_loss: 0.3984, test_loss: 1.4230, test_f1: 0.6176
 epoch: 39, train_loss: 0.4149, test_loss: 1.3495, test_f1: 0.5817
 epoch: 40, train_loss: 0.4025, test_loss: 1.4308, test_f1: 0.6349
 epoch: 41, train_loss: 0.3923, test_loss: 1.2844, test_f1: 0.6275
 epoch: 42, train_loss: 0.3813, test_loss: 1.2687, test_f1: 0.6309
 epoch: 43, train_loss: 0.3653, test_loss: 1.4428, test_f1: 0.6478
 epoch: 44, train_loss: 0.3467, test_loss: 1.3665, test_f1: 0.6297
 epoch: 45, train_loss: 0.3271, test_loss: 1.4185, test_f1: 0.6320
 epoch: 46, train_loss: 0.3450, test_loss: 1.7444, test_f1: 0.5922
 epoch: 47, train_loss: 0.3241, test_loss: 1.6820, test_f1: 0.5969
 epoch: 48, train_loss: 0.3193, test_loss: 1.6839, test_f1: 0.6158
 epoch: 49, train_loss: 0.2949, test_loss: 1.1917, test_f1: 0.6571
 epoch: 50, train_loss: 0.3213, test_loss: 1.3928, test_f1: 0.6117
 epoch: 51, train_loss: 0.2701, test_loss: 1.5139, test_f1: 0.6453
 epoch: 52, train_loss: 0.2482, test_loss: 1.4695, test_f1: 0.6160
 epoch: 53, train_loss: 0.2255, test_loss: 1.4380, test_f1: 0.6382
 epoch: 54, train_loss: 0.2158, test_loss: 1.5513, test_f1: 0.6468
 epoch: 55, train_loss: 0.2110, test_loss: 1.6075, test_f1: 0.6506
 epoch: 56, train_loss: 0.2177, test_loss: 1.6018, test_f1: 0.6081
 epoch: 57, train_loss: 0.1995, test_loss: 1.6610, test_f1: 0.6577
 epoch: 58, train_loss: 0.1955, test_loss: 1.7110, test_f1: 0.6432
 epoch: 59, train_loss: 0.2063, test_loss: 1.9352, test_f1: 0.6320
 epoch: 60, train_loss: 0.1944, test_loss: 1.7819, test_f1: 0.6251
 epoch: 61, train_loss: 0.1863, test_loss: 1.6775, test_f1: 0.6411
 epoch: 62, train_loss: 0.1912, test_loss: 2.0523, test_f1: 0.5961
 epoch: 63, train_loss: 0.1931, test_loss: 1.8071, test_f1: 0.6322
 epoch: 64, train_loss: 0.1857, test_loss: 1.7411, test_f1: 0.6241
 epoch: 65, train_loss: 0.1845, test_loss: 1.7826, test_f1: 0.6373
 epoch: 66, train_loss: 0.1877, test_loss: 1.6192, test_f1: 0.6699
 epoch: 67, train_loss: 0.1791, test_loss: 1.6360, test_f1: 0.6846
 epoch: 68, train_loss: 0.1604, test_loss: 1.7342, test_f1: 0.6517
 epoch: 69, train_loss: 0.1785, test_loss: 1.6314, test_f1: 0.6807
 epoch: 70, train_loss: 0.1623, test_loss: 1.9585, test_f1: 0.6080
 epoch: 71, train_loss: 0.1577, test_loss: 1.8470, test_f1: 0.6457
 epoch: 72, train_loss: 0.1646, test_loss: 1.9601, test_f1: 0.5916
 epoch: 73, train_loss: 0.1644, test_loss: 1.7743, test_f1: 0.6673
 epoch: 74, train_loss: 0.1597, test_loss: 1.8836, test_f1: 0.6274
 epoch: 75, train_loss: 0.1516, test_loss: 1.9072, test_f1: 0.6206
 epoch: 76, train_loss: 0.1417, test_loss: 2.0819, test_f1: 0.6537
 epoch: 77, train_loss: 0.1581, test_loss: 2.0838, test_f1: 0.6104
 epoch: 78, train_loss: 0.1618, test_loss: 1.9496, test_f1: 0.6355
 epoch: 79, train_loss: 0.1440, test_loss: 2.0121, test_f1: 0.6105
 epoch: 80, train_loss: 0.1421, test_loss: 2.0963, test_f1: 0.6039
 epoch: 81, train_loss: 0.1504, test_loss: 1.9962, test_f1: 0.6597
 epoch: 82, train_loss: 0.1256, test_loss: 2.0905, test_f1: 0.6330
 epoch: 83, train_loss: 0.1220, test_loss: 2.2421, test_f1: 0.6417
 epoch: 84, train_loss: 0.1464, test_loss: 2.1791, test_f1: 0.6109
 epoch: 85, train_loss: 0.1198, test_loss: 2.2160, test_f1: 0.6098
 epoch: 86, train_loss: 0.1271, test_loss: 2.4101, test_f1: 0.6217
 epoch: 87, train_loss: 0.1383, test_loss: 2.0335, test_f1: 0.6488
 epoch: 88, train_loss: 0.1580, test_loss: 2.0934, test_f1: 0.6317
 epoch: 89, train_loss: 0.1439, test_loss: 2.8513, test_f1: 0.5744
 epoch: 90, train_loss: 0.1260, test_loss: 2.2075, test_f1: 0.6349
 epoch: 91, train_loss: 0.1115, test_loss: 2.5071, test_f1: 0.6069
 epoch: 92, train_loss: 0.1199, test_loss: 2.2385, test_f1: 0.6406
 epoch: 93, train_loss: 0.1147, test_loss: 2.3292, test_f1: 0.6164
 epoch: 94, train_loss: 0.1286, test_loss: 2.5677, test_f1: 0.5975
 epoch: 95, train_loss: 0.1189, test_loss: 2.2437, test_f1: 0.6604
 epoch: 96, train_loss: 0.1380, test_loss: 2.2005, test_f1: 0.6099
 epoch: 97, train_loss: 0.1089, test_loss: 2.3547, test_f1: 0.6670
 epoch: 98, train_loss: 0.1135, test_loss: 2.4049, test_f1: 0.5996
 epoch: 99, train_loss: 0.1083, test_loss: 2.3558, test_f1: 0.6238
##################ITERATION #1 ****************************************
 epoch: 0, train_loss: 1.1078, test_loss: 1.1442, test_f1: 0.3077
 epoch: 1, train_loss: 0.9668, test_loss: 1.0139, test_f1: 0.4430
 epoch: 2, train_loss: 0.8998, test_loss: 0.9671, test_f1: 0.4848
 epoch: 3, train_loss: 0.8600, test_loss: 0.9530, test_f1: 0.5752
 epoch: 4, train_loss: 0.8328, test_loss: 0.9609, test_f1: 0.4798
 epoch: 5, train_loss: 0.8094, test_loss: 0.9033, test_f1: 0.5562
 epoch: 6, train_loss: 0.7672, test_loss: 0.8807, test_f1: 0.5579
 epoch: 7, train_loss: 0.7489, test_loss: 1.1806, test_f1: 0.5117
 epoch: 8, train_loss: 0.7339, test_loss: 1.0348, test_f1: 0.5292
 epoch: 9, train_loss: 0.7163, test_loss: 0.8948, test_f1: 0.5965
 epoch: 10, train_loss: 0.6968, test_loss: 0.8980, test_f1: 0.5730
 epoch: 11, train_loss: 0.6947, test_loss: 1.0027, test_f1: 0.5388
 epoch: 12, train_loss: 0.6617, test_loss: 0.8882, test_f1: 0.5797
 epoch: 13, train_loss: 0.6701, test_loss: 0.8452, test_f1: 0.6128
 epoch: 14, train_loss: 0.6465, test_loss: 0.8875, test_f1: 0.5775
 epoch: 15, train_loss: 0.6177, test_loss: 0.9459, test_f1: 0.6110
 epoch: 16, train_loss: 0.6166, test_loss: 1.1003, test_f1: 0.5880
 epoch: 17, train_loss: 0.5887, test_loss: 0.9125, test_f1: 0.6155
 epoch: 18, train_loss: 0.5852, test_loss: 0.8724, test_f1: 0.6315
 epoch: 19, train_loss: 0.5900, test_loss: 0.9422, test_f1: 0.6357
 epoch: 20, train_loss: 0.5512, test_loss: 0.9483, test_f1: 0.6305
 epoch: 21, train_loss: 0.5333, test_loss: 0.9307, test_f1: 0.6234
 epoch: 22, train_loss: 0.5331, test_loss: 0.9152, test_f1: 0.6089
 epoch: 23, train_loss: 0.5163, test_loss: 1.2597, test_f1: 0.5676
 epoch: 24, train_loss: 0.5257, test_loss: 1.0508, test_f1: 0.6208
 epoch: 25, train_loss: 0.5144, test_loss: 0.9345, test_f1: 0.6492
 epoch: 26, train_loss: 0.4809, test_loss: 1.0244, test_f1: 0.6115
 epoch: 27, train_loss: 0.4718, test_loss: 1.0406, test_f1: 0.6388
 epoch: 28, train_loss: 0.4506, test_loss: 1.1509, test_f1: 0.5997
 epoch: 29, train_loss: 0.4541, test_loss: 1.2400, test_f1: 0.5851
 epoch: 30, train_loss: 0.4330, test_loss: 1.0449, test_f1: 0.6231
 epoch: 31, train_loss: 0.4246, test_loss: 1.0459, test_f1: 0.6610
 epoch: 32, train_loss: 0.4156, test_loss: 1.0920, test_f1: 0.6411
 epoch: 33, train_loss: 0.4166, test_loss: 1.1754, test_f1: 0.6346
 epoch: 34, train_loss: 0.3800, test_loss: 1.1108, test_f1: 0.6422
 epoch: 35, train_loss: 0.3921, test_loss: 1.0672, test_f1: 0.6624
 epoch: 36, train_loss: 0.3878, test_loss: 1.0005, test_f1: 0.6805
 epoch: 37, train_loss: 0.3968, test_loss: 1.2580, test_f1: 0.6321
 epoch: 38, train_loss: 0.3915, test_loss: 0.9169, test_f1: 0.6779
 epoch: 39, train_loss: 0.3656, test_loss: 1.0931, test_f1: 0.6269
 epoch: 40, train_loss: 0.3431, test_loss: 1.1491, test_f1: 0.6613
 epoch: 41, train_loss: 0.3322, test_loss: 1.1508, test_f1: 0.6510
 epoch: 42, train_loss: 0.3403, test_loss: 1.2695, test_f1: 0.6518
 epoch: 43, train_loss: 0.3315, test_loss: 1.3487, test_f1: 0.6408
 epoch: 44, train_loss: 0.3367, test_loss: 1.1815, test_f1: 0.6295
 epoch: 45, train_loss: 0.3092, test_loss: 1.1758, test_f1: 0.6460
 epoch: 46, train_loss: 0.2943, test_loss: 1.1833, test_f1: 0.6355
 epoch: 47, train_loss: 0.3291, test_loss: 1.1407, test_f1: 0.6470
 epoch: 48, train_loss: 0.3211, test_loss: 1.4104, test_f1: 0.6383
 epoch: 49, train_loss: 0.3042, test_loss: 1.3070, test_f1: 0.6534
 epoch: 50, train_loss: 0.2994, test_loss: 1.1386, test_f1: 0.6569
 epoch: 51, train_loss: 0.2676, test_loss: 1.2202, test_f1: 0.6736
 epoch: 52, train_loss: 0.2293, test_loss: 1.1904, test_f1: 0.6673
 epoch: 53, train_loss: 0.2124, test_loss: 1.4040, test_f1: 0.6073
 epoch: 54, train_loss: 0.2283, test_loss: 1.2470, test_f1: 0.6675
 epoch: 55, train_loss: 0.2078, test_loss: 1.2662, test_f1: 0.6673
 epoch: 56, train_loss: 0.1980, test_loss: 1.3061, test_f1: 0.6618
 epoch: 57, train_loss: 0.1918, test_loss: 1.2729, test_f1: 0.6833
 epoch: 58, train_loss: 0.1891, test_loss: 1.5673, test_f1: 0.6142
 epoch: 59, train_loss: 0.1843, test_loss: 1.3346, test_f1: 0.6723
 epoch: 60, train_loss: 0.1930, test_loss: 1.5026, test_f1: 0.6417
 epoch: 61, train_loss: 0.1876, test_loss: 1.4099, test_f1: 0.6660
 epoch: 62, train_loss: 0.1725, test_loss: 1.5350, test_f1: 0.6447
 epoch: 63, train_loss: 0.1699, test_loss: 1.4502, test_f1: 0.6682
 epoch: 64, train_loss: 0.1665, test_loss: 1.5610, test_f1: 0.6595
 epoch: 65, train_loss: 0.1576, test_loss: 1.6706, test_f1: 0.6479
 epoch: 66, train_loss: 0.1495, test_loss: 1.5050, test_f1: 0.6862
 epoch: 67, train_loss: 0.1613, test_loss: 1.5669, test_f1: 0.6683
 epoch: 68, train_loss: 0.1578, test_loss: 1.7510, test_f1: 0.6265
 epoch: 69, train_loss: 0.1454, test_loss: 1.7169, test_f1: 0.6730
 epoch: 70, train_loss: 0.1514, test_loss: 1.8387, test_f1: 0.6323
 epoch: 71, train_loss: 0.1597, test_loss: 1.6936, test_f1: 0.6545
 epoch: 72, train_loss: 0.1454, test_loss: 1.7569, test_f1: 0.6400
 epoch: 73, train_loss: 0.1443, test_loss: 1.7081, test_f1: 0.6451
 epoch: 74, train_loss: 0.1462, test_loss: 1.6850, test_f1: 0.6810
 epoch: 75, train_loss: 0.1480, test_loss: 1.7568, test_f1: 0.6657
 epoch: 76, train_loss: 0.1329, test_loss: 1.8722, test_f1: 0.6452
 epoch: 77, train_loss: 0.1293, test_loss: 1.9401, test_f1: 0.6719
 epoch: 78, train_loss: 0.1364, test_loss: 1.8252, test_f1: 0.6761
 epoch: 79, train_loss: 0.1278, test_loss: 2.0727, test_f1: 0.6260
 epoch: 80, train_loss: 0.1159, test_loss: 1.9968, test_f1: 0.6530
 epoch: 81, train_loss: 0.1221, test_loss: 2.0441, test_f1: 0.6238
 epoch: 82, train_loss: 0.1337, test_loss: 1.9460, test_f1: 0.6201
 epoch: 83, train_loss: 0.1226, test_loss: 2.0806, test_f1: 0.6607
 epoch: 84, train_loss: 0.1351, test_loss: 1.9410, test_f1: 0.6467
 epoch: 85, train_loss: 0.1315, test_loss: 1.9440, test_f1: 0.6574
 epoch: 86, train_loss: 0.1260, test_loss: 1.9315, test_f1: 0.6559
 epoch: 87, train_loss: 0.1249, test_loss: 2.0581, test_f1: 0.6469
 epoch: 88, train_loss: 0.1335, test_loss: 2.1931, test_f1: 0.6408
 epoch: 89, train_loss: 0.1303, test_loss: 1.9642, test_f1: 0.6349
 epoch: 90, train_loss: 0.1226, test_loss: 2.3109, test_f1: 0.6364
 epoch: 91, train_loss: 0.1193, test_loss: 2.1125, test_f1: 0.6344
 epoch: 92, train_loss: 0.1227, test_loss: 2.0157, test_f1: 0.6761
 epoch: 93, train_loss: 0.1270, test_loss: 2.2106, test_f1: 0.6760
 epoch: 94, train_loss: 0.1141, test_loss: 2.2994, test_f1: 0.6583
 epoch: 95, train_loss: 0.1122, test_loss: 2.3074, test_f1: 0.6618
 epoch: 96, train_loss: 0.1077, test_loss: 2.3252, test_f1: 0.6692
 epoch: 97, train_loss: 0.1151, test_loss: 2.2309, test_f1: 0.6479
 epoch: 98, train_loss: 0.1081, test_loss: 2.0662, test_f1: 0.6322
 epoch: 99, train_loss: 0.0980, test_loss: 2.0554, test_f1: 0.6529
##################ITERATION #2 ****************************************
 epoch: 0, train_loss: 1.0907, test_loss: 1.2261, test_f1: 0.2674
 epoch: 1, train_loss: 0.9374, test_loss: 0.9357, test_f1: 0.5429
 epoch: 2, train_loss: 0.8850, test_loss: 0.8981, test_f1: 0.5259
 epoch: 3, train_loss: 0.8367, test_loss: 0.9039, test_f1: 0.5426
 epoch: 4, train_loss: 0.8065, test_loss: 1.0149, test_f1: 0.5447
 epoch: 5, train_loss: 0.7919, test_loss: 0.8929, test_f1: 0.5714
 epoch: 6, train_loss: 0.7743, test_loss: 0.8746, test_f1: 0.5726
 epoch: 7, train_loss: 0.7453, test_loss: 0.9253, test_f1: 0.5582
 epoch: 8, train_loss: 0.7225, test_loss: 0.9319, test_f1: 0.5717
 epoch: 9, train_loss: 0.7027, test_loss: 0.8520, test_f1: 0.6222
 epoch: 10, train_loss: 0.6846, test_loss: 0.7764, test_f1: 0.6174
 epoch: 11, train_loss: 0.6769, test_loss: 0.8210, test_f1: 0.6130
 epoch: 12, train_loss: 0.6891, test_loss: 0.8417, test_f1: 0.6292
 epoch: 13, train_loss: 0.6531, test_loss: 0.7945, test_f1: 0.6133
 epoch: 14, train_loss: 0.6193, test_loss: 0.7877, test_f1: 0.6427
 epoch: 15, train_loss: 0.6097, test_loss: 0.8221, test_f1: 0.6104
 epoch: 16, train_loss: 0.6185, test_loss: 0.7394, test_f1: 0.6277
 epoch: 17, train_loss: 0.6076, test_loss: 1.0468, test_f1: 0.5815
 epoch: 18, train_loss: 0.5837, test_loss: 0.8187, test_f1: 0.6253
 epoch: 19, train_loss: 0.5497, test_loss: 0.8602, test_f1: 0.6323
 epoch: 20, train_loss: 0.5272, test_loss: 0.8832, test_f1: 0.6396
 epoch: 21, train_loss: 0.5248, test_loss: 0.8513, test_f1: 0.6326
 epoch: 22, train_loss: 0.5452, test_loss: 1.1567, test_f1: 0.5121
 epoch: 23, train_loss: 0.5453, test_loss: 1.1170, test_f1: 0.5732
 epoch: 24, train_loss: 0.5065, test_loss: 0.9330, test_f1: 0.6450
 epoch: 25, train_loss: 0.5051, test_loss: 0.9602, test_f1: 0.6343
 epoch: 26, train_loss: 0.4790, test_loss: 0.8260, test_f1: 0.6683
 epoch: 27, train_loss: 0.4793, test_loss: 0.9479, test_f1: 0.6267
 epoch: 28, train_loss: 0.4624, test_loss: 1.1258, test_f1: 0.6201
 epoch: 29, train_loss: 0.4538, test_loss: 0.8701, test_f1: 0.6545
 epoch: 30, train_loss: 0.4551, test_loss: 0.8548, test_f1: 0.6387
 epoch: 31, train_loss: 0.4347, test_loss: 1.1575, test_f1: 0.5965
 epoch: 32, train_loss: 0.4017, test_loss: 1.0077, test_f1: 0.6204
 epoch: 33, train_loss: 0.4077, test_loss: 1.0137, test_f1: 0.6529
 epoch: 34, train_loss: 0.3951, test_loss: 0.9338, test_f1: 0.6658
 epoch: 35, train_loss: 0.3957, test_loss: 1.0371, test_f1: 0.6540
 epoch: 36, train_loss: 0.3970, test_loss: 0.9657, test_f1: 0.6759
 epoch: 37, train_loss: 0.3727, test_loss: 1.0032, test_f1: 0.6443
 epoch: 38, train_loss: 0.3582, test_loss: 1.1848, test_f1: 0.6308
 epoch: 39, train_loss: 0.3549, test_loss: 1.2700, test_f1: 0.6088
 epoch: 40, train_loss: 0.3470, test_loss: 1.1522, test_f1: 0.6300
 epoch: 41, train_loss: 0.3550, test_loss: 1.1924, test_f1: 0.5863
 epoch: 42, train_loss: 0.3399, test_loss: 1.0742, test_f1: 0.6717
 epoch: 43, train_loss: 0.3258, test_loss: 1.0880, test_f1: 0.6306
 epoch: 44, train_loss: 0.3002, test_loss: 1.0738, test_f1: 0.6515
 epoch: 45, train_loss: 0.2949, test_loss: 1.1808, test_f1: 0.6780
 epoch: 46, train_loss: 0.2952, test_loss: 1.0808, test_f1: 0.6815
 epoch: 47, train_loss: 0.3028, test_loss: 1.4800, test_f1: 0.6356
 epoch: 48, train_loss: 0.3009, test_loss: 1.2077, test_f1: 0.6558
 epoch: 49, train_loss: 0.2893, test_loss: 1.2358, test_f1: 0.6458
 epoch: 50, train_loss: 0.2775, test_loss: 1.3042, test_f1: 0.6452
 epoch: 51, train_loss: 0.2413, test_loss: 1.2116, test_f1: 0.6891
 epoch: 52, train_loss: 0.2093, test_loss: 1.2678, test_f1: 0.6722
 epoch: 53, train_loss: 0.2081, test_loss: 1.1854, test_f1: 0.6745
 epoch: 54, train_loss: 0.2004, test_loss: 1.2575, test_f1: 0.6888
 epoch: 55, train_loss: 0.1971, test_loss: 1.3370, test_f1: 0.6579
 epoch: 56, train_loss: 0.1966, test_loss: 1.3634, test_f1: 0.6524
 epoch: 57, train_loss: 0.1901, test_loss: 1.3885, test_f1: 0.6770
 epoch: 58, train_loss: 0.1863, test_loss: 1.5111, test_f1: 0.6647
 epoch: 59, train_loss: 0.1692, test_loss: 1.5326, test_f1: 0.6469
 epoch: 60, train_loss: 0.1653, test_loss: 1.4968, test_f1: 0.6514
 epoch: 61, train_loss: 0.1695, test_loss: 1.4953, test_f1: 0.6519
 epoch: 62, train_loss: 0.1594, test_loss: 1.5317, test_f1: 0.6649
 epoch: 63, train_loss: 0.1638, test_loss: 1.5429, test_f1: 0.6419
 epoch: 64, train_loss: 0.1751, test_loss: 1.6315, test_f1: 0.6498
 epoch: 65, train_loss: 0.1567, test_loss: 1.5775, test_f1: 0.6822
 epoch: 66, train_loss: 0.1750, test_loss: 1.6197, test_f1: 0.6608
 epoch: 67, train_loss: 0.1552, test_loss: 1.5382, test_f1: 0.6563
 epoch: 68, train_loss: 0.1450, test_loss: 1.5910, test_f1: 0.6437
 epoch: 69, train_loss: 0.1521, test_loss: 1.5523, test_f1: 0.6557
 epoch: 70, train_loss: 0.1640, test_loss: 1.6960, test_f1: 0.6511
 epoch: 71, train_loss: 0.1393, test_loss: 1.7849, test_f1: 0.6609
 epoch: 72, train_loss: 0.1557, test_loss: 1.7994, test_f1: 0.6213
 epoch: 73, train_loss: 0.1389, test_loss: 1.8351, test_f1: 0.6606
 epoch: 74, train_loss: 0.1386, test_loss: 1.5967, test_f1: 0.6606
 epoch: 75, train_loss: 0.1439, test_loss: 1.7264, test_f1: 0.6640
 epoch: 76, train_loss: 0.1363, test_loss: 1.7646, test_f1: 0.6528
 epoch: 77, train_loss: 0.1480, test_loss: 1.7376, test_f1: 0.6640
 epoch: 78, train_loss: 0.1404, test_loss: 1.6234, test_f1: 0.6862
 epoch: 79, train_loss: 0.1224, test_loss: 1.6843, test_f1: 0.6953
 epoch: 80, train_loss: 0.1175, test_loss: 1.9486, test_f1: 0.6498
 epoch: 81, train_loss: 0.1266, test_loss: 1.8496, test_f1: 0.6552
 epoch: 82, train_loss: 0.1104, test_loss: 1.7380, test_f1: 0.6701
 epoch: 83, train_loss: 0.1025, test_loss: 1.9724, test_f1: 0.6331
 epoch: 84, train_loss: 0.1157, test_loss: 1.7191, test_f1: 0.6652
 epoch: 85, train_loss: 0.1413, test_loss: 1.9488, test_f1: 0.6364
 epoch: 86, train_loss: 0.1337, test_loss: 1.9429, test_f1: 0.6552
 epoch: 87, train_loss: 0.1208, test_loss: 1.9995, test_f1: 0.6472
 epoch: 88, train_loss: 0.1135, test_loss: 2.0264, test_f1: 0.6565
 epoch: 89, train_loss: 0.1154, test_loss: 1.9305, test_f1: 0.6683
 epoch: 90, train_loss: 0.1015, test_loss: 1.9885, test_f1: 0.6731
 epoch: 91, train_loss: 0.1077, test_loss: 2.0431, test_f1: 0.6578
 epoch: 92, train_loss: 0.1017, test_loss: 2.0543, test_f1: 0.6772
 epoch: 93, train_loss: 0.1062, test_loss: 2.0412, test_f1: 0.6564
 epoch: 94, train_loss: 0.1053, test_loss: 2.0608, test_f1: 0.6073
 epoch: 95, train_loss: 0.0976, test_loss: 1.9379, test_f1: 0.6666
 epoch: 96, train_loss: 0.0954, test_loss: 1.9635, test_f1: 0.6454
 epoch: 97, train_loss: 0.1057, test_loss: 2.0242, test_f1: 0.6703
 epoch: 98, train_loss: 0.0985, test_loss: 2.0409, test_f1: 0.6474
 epoch: 99, train_loss: 0.1123, test_loss: 2.0074, test_f1: 0.6513
##################ITERATION #3 ****************************************
 epoch: 0, train_loss: 1.2149, test_loss: 1.4168, test_f1: 0.2262
 epoch: 1, train_loss: 0.9783, test_loss: 1.2150, test_f1: 0.3518
 epoch: 2, train_loss: 0.9050, test_loss: 0.9149, test_f1: 0.5265
 epoch: 3, train_loss: 0.8479, test_loss: 0.9063, test_f1: 0.5630
 epoch: 4, train_loss: 0.8338, test_loss: 0.8589, test_f1: 0.5657
 epoch: 5, train_loss: 0.7981, test_loss: 0.9087, test_f1: 0.5638
 epoch: 6, train_loss: 0.7821, test_loss: 0.8136, test_f1: 0.6009
 epoch: 7, train_loss: 0.7536, test_loss: 1.0314, test_f1: 0.5733
 epoch: 8, train_loss: 0.7430, test_loss: 0.8542, test_f1: 0.5644
 epoch: 9, train_loss: 0.7369, test_loss: 0.8277, test_f1: 0.6067
 epoch: 10, train_loss: 0.7033, test_loss: 0.8936, test_f1: 0.6020
 epoch: 11, train_loss: 0.7037, test_loss: 0.8326, test_f1: 0.6199
 epoch: 12, train_loss: 0.6881, test_loss: 0.7733, test_f1: 0.6462
 epoch: 13, train_loss: 0.6739, test_loss: 0.8823, test_f1: 0.6066
 epoch: 14, train_loss: 0.6581, test_loss: 0.8068, test_f1: 0.6221
 epoch: 15, train_loss: 0.6460, test_loss: 0.8229, test_f1: 0.6085
 epoch: 16, train_loss: 0.6354, test_loss: 0.8337, test_f1: 0.6244
 epoch: 17, train_loss: 0.6310, test_loss: 0.8436, test_f1: 0.6111
 epoch: 18, train_loss: 0.5948, test_loss: 0.8273, test_f1: 0.6346
 epoch: 19, train_loss: 0.5761, test_loss: 0.8939, test_f1: 0.5778
 epoch: 20, train_loss: 0.5809, test_loss: 0.8321, test_f1: 0.6176
 epoch: 21, train_loss: 0.5731, test_loss: 1.0344, test_f1: 0.5815
 epoch: 22, train_loss: 0.5586, test_loss: 0.7710, test_f1: 0.6576
 epoch: 23, train_loss: 0.5364, test_loss: 0.7843, test_f1: 0.6486
 epoch: 24, train_loss: 0.5497, test_loss: 0.8675, test_f1: 0.6590
 epoch: 25, train_loss: 0.5218, test_loss: 0.8354, test_f1: 0.6535
 epoch: 26, train_loss: 0.4888, test_loss: 0.9499, test_f1: 0.6132
 epoch: 27, train_loss: 0.4701, test_loss: 0.9591, test_f1: 0.6185
 epoch: 28, train_loss: 0.4713, test_loss: 0.8829, test_f1: 0.6252
 epoch: 29, train_loss: 0.4696, test_loss: 0.9991, test_f1: 0.6046
 epoch: 30, train_loss: 0.4574, test_loss: 0.8513, test_f1: 0.6261
 epoch: 31, train_loss: 0.4441, test_loss: 0.9192, test_f1: 0.6478
 epoch: 32, train_loss: 0.4378, test_loss: 0.9272, test_f1: 0.6471
 epoch: 33, train_loss: 0.4524, test_loss: 0.9204, test_f1: 0.6555
 epoch: 34, train_loss: 0.4296, test_loss: 0.8744, test_f1: 0.6608
 epoch: 35, train_loss: 0.4364, test_loss: 0.9742, test_f1: 0.6195
 epoch: 36, train_loss: 0.4099, test_loss: 0.9101, test_f1: 0.6536
 epoch: 37, train_loss: 0.3964, test_loss: 1.0939, test_f1: 0.6132
 epoch: 38, train_loss: 0.4158, test_loss: 1.2004, test_f1: 0.6113
 epoch: 39, train_loss: 0.4062, test_loss: 1.3005, test_f1: 0.5929
 epoch: 40, train_loss: 0.3960, test_loss: 0.9990, test_f1: 0.6593
 epoch: 41, train_loss: 0.3822, test_loss: 1.0031, test_f1: 0.6596
 epoch: 42, train_loss: 0.3799, test_loss: 0.9850, test_f1: 0.6497
 epoch: 43, train_loss: 0.3527, test_loss: 0.9315, test_f1: 0.6760
 epoch: 44, train_loss: 0.3696, test_loss: 0.9630, test_f1: 0.6769
 epoch: 45, train_loss: 0.3547, test_loss: 1.0808, test_f1: 0.6160
 epoch: 46, train_loss: 0.3411, test_loss: 0.9548, test_f1: 0.6634
 epoch: 47, train_loss: 0.3234, test_loss: 1.0149, test_f1: 0.6853
 epoch: 48, train_loss: 0.3322, test_loss: 1.0496, test_f1: 0.6820
 epoch: 49, train_loss: 0.3175, test_loss: 1.0404, test_f1: 0.6588
 epoch: 50, train_loss: 0.3120, test_loss: 1.1417, test_f1: 0.6468
 epoch: 51, train_loss: 0.2693, test_loss: 1.0668, test_f1: 0.6839
 epoch: 52, train_loss: 0.2450, test_loss: 1.0439, test_f1: 0.6960
 epoch: 53, train_loss: 0.2367, test_loss: 1.0996, test_f1: 0.6540
 epoch: 54, train_loss: 0.2450, test_loss: 1.0826, test_f1: 0.7039
 epoch: 55, train_loss: 0.2283, test_loss: 1.0545, test_f1: 0.6885
 epoch: 56, train_loss: 0.2207, test_loss: 1.1213, test_f1: 0.7082
 epoch: 57, train_loss: 0.2183, test_loss: 1.1432, test_f1: 0.6597
 epoch: 58, train_loss: 0.2139, test_loss: 1.1787, test_f1: 0.6615
 epoch: 59, train_loss: 0.1953, test_loss: 1.1872, test_f1: 0.6734
 epoch: 60, train_loss: 0.2053, test_loss: 1.1802, test_f1: 0.6678
 epoch: 61, train_loss: 0.1959, test_loss: 1.2182, test_f1: 0.6763
 epoch: 62, train_loss: 0.2152, test_loss: 1.1245, test_f1: 0.6792
 epoch: 63, train_loss: 0.1923, test_loss: 1.2747, test_f1: 0.6640
 epoch: 64, train_loss: 0.2005, test_loss: 1.2210, test_f1: 0.6904
 epoch: 65, train_loss: 0.1876, test_loss: 1.3088, test_f1: 0.6946
 epoch: 66, train_loss: 0.1846, test_loss: 1.3412, test_f1: 0.6710
 epoch: 67, train_loss: 0.1946, test_loss: 1.2522, test_f1: 0.6726
 epoch: 68, train_loss: 0.1805, test_loss: 1.3838, test_f1: 0.6837
 epoch: 69, train_loss: 0.2149, test_loss: 1.2868, test_f1: 0.6857
 epoch: 70, train_loss: 0.1869, test_loss: 1.2791, test_f1: 0.6575
 epoch: 71, train_loss: 0.1679, test_loss: 1.3078, test_f1: 0.6793
 epoch: 72, train_loss: 0.1826, test_loss: 1.3082, test_f1: 0.6724
 epoch: 73, train_loss: 0.1666, test_loss: 1.2955, test_f1: 0.6670
 epoch: 74, train_loss: 0.1763, test_loss: 1.3307, test_f1: 0.6684
 epoch: 75, train_loss: 0.1863, test_loss: 1.2877, test_f1: 0.6728
 epoch: 76, train_loss: 0.1691, test_loss: 1.3918, test_f1: 0.6711
 epoch: 77, train_loss: 0.1742, test_loss: 1.3266, test_f1: 0.6702
 epoch: 78, train_loss: 0.1594, test_loss: 1.5214, test_f1: 0.6350
 epoch: 79, train_loss: 0.1649, test_loss: 1.3098, test_f1: 0.6808
 epoch: 80, train_loss: 0.1737, test_loss: 1.4558, test_f1: 0.6647
 epoch: 81, train_loss: 0.1643, test_loss: 1.4349, test_f1: 0.6779
 epoch: 82, train_loss: 0.1606, test_loss: 1.4164, test_f1: 0.6743
 epoch: 83, train_loss: 0.1457, test_loss: 1.4911, test_f1: 0.6595
 epoch: 84, train_loss: 0.1587, test_loss: 1.4866, test_f1: 0.6597
 epoch: 85, train_loss: 0.1658, test_loss: 1.5691, test_f1: 0.6495
 epoch: 86, train_loss: 0.1583, test_loss: 1.4094, test_f1: 0.6690
 epoch: 87, train_loss: 0.1507, test_loss: 1.4625, test_f1: 0.6711
 epoch: 88, train_loss: 0.1455, test_loss: 1.4503, test_f1: 0.6690
 epoch: 89, train_loss: 0.1400, test_loss: 1.3903, test_f1: 0.6983
 epoch: 90, train_loss: 0.1412, test_loss: 1.6487, test_f1: 0.6409
 epoch: 91, train_loss: 0.1284, test_loss: 1.4792, test_f1: 0.6744
 epoch: 92, train_loss: 0.1307, test_loss: 1.5269, test_f1: 0.6644
 epoch: 93, train_loss: 0.1230, test_loss: 1.4297, test_f1: 0.6757
 epoch: 94, train_loss: 0.1299, test_loss: 1.4707, test_f1: 0.6980
 epoch: 95, train_loss: 0.1470, test_loss: 1.4622, test_f1: 0.6776
 epoch: 96, train_loss: 0.1541, test_loss: 1.5859, test_f1: 0.6830
 epoch: 97, train_loss: 0.1460, test_loss: 1.5168, test_f1: 0.6689
 epoch: 98, train_loss: 0.1141, test_loss: 1.5696, test_f1: 0.6649
 epoch: 99, train_loss: 0.1244, test_loss: 1.5457, test_f1: 0.6805
##################ITERATION #4 ****************************************
 epoch: 0, train_loss: 1.2492, test_loss: 1.3268, test_f1: 0.2786
 epoch: 1, train_loss: 0.9934, test_loss: 0.9932, test_f1: 0.4885
 epoch: 2, train_loss: 0.9192, test_loss: 0.9366, test_f1: 0.6113
 epoch: 3, train_loss: 0.8669, test_loss: 0.9155, test_f1: 0.6027
 epoch: 4, train_loss: 0.8335, test_loss: 0.8926, test_f1: 0.5533
 epoch: 5, train_loss: 0.8044, test_loss: 0.8718, test_f1: 0.5936
 epoch: 6, train_loss: 0.7620, test_loss: 0.9119, test_f1: 0.6136
 epoch: 7, train_loss: 0.7651, test_loss: 0.8749, test_f1: 0.5900
 epoch: 8, train_loss: 0.7242, test_loss: 0.8576, test_f1: 0.6426
 epoch: 9, train_loss: 0.6916, test_loss: 0.8359, test_f1: 0.5954
 epoch: 10, train_loss: 0.6935, test_loss: 1.0338, test_f1: 0.5766
 epoch: 11, train_loss: 0.6857, test_loss: 0.8420, test_f1: 0.6358
 epoch: 12, train_loss: 0.6623, test_loss: 0.8104, test_f1: 0.6423
 epoch: 13, train_loss: 0.6374, test_loss: 0.8890, test_f1: 0.6162
 epoch: 14, train_loss: 0.6092, test_loss: 0.8504, test_f1: 0.6433
 epoch: 15, train_loss: 0.5987, test_loss: 0.8480, test_f1: 0.6403
 epoch: 16, train_loss: 0.5956, test_loss: 0.9555, test_f1: 0.6102
 epoch: 17, train_loss: 0.5883, test_loss: 0.9313, test_f1: 0.6094
 epoch: 18, train_loss: 0.5745, test_loss: 0.8585, test_f1: 0.6825
 epoch: 19, train_loss: 0.5668, test_loss: 0.8908, test_f1: 0.6209
 epoch: 20, train_loss: 0.5376, test_loss: 0.9687, test_f1: 0.6180
 epoch: 21, train_loss: 0.5575, test_loss: 0.8676, test_f1: 0.6582
 epoch: 22, train_loss: 0.5190, test_loss: 0.9947, test_f1: 0.6083
 epoch: 23, train_loss: 0.5173, test_loss: 0.9282, test_f1: 0.6634
 epoch: 24, train_loss: 0.5032, test_loss: 0.8579, test_f1: 0.6723
 epoch: 25, train_loss: 0.4869, test_loss: 0.8923, test_f1: 0.6639
 epoch: 26, train_loss: 0.4849, test_loss: 0.9365, test_f1: 0.6596
 epoch: 27, train_loss: 0.4794, test_loss: 0.9819, test_f1: 0.6275
 epoch: 28, train_loss: 0.4646, test_loss: 0.8982, test_f1: 0.6698
 epoch: 29, train_loss: 0.4362, test_loss: 0.9651, test_f1: 0.6469
 epoch: 30, train_loss: 0.4321, test_loss: 0.9486, test_f1: 0.6563
 epoch: 31, train_loss: 0.4242, test_loss: 0.8978, test_f1: 0.6915
 epoch: 32, train_loss: 0.4045, test_loss: 0.9332, test_f1: 0.6662
 epoch: 33, train_loss: 0.3953, test_loss: 0.9362, test_f1: 0.6395
 epoch: 34, train_loss: 0.3830, test_loss: 1.0723, test_f1: 0.6760
 epoch: 35, train_loss: 0.4007, test_loss: 0.9692, test_f1: 0.6669
 epoch: 36, train_loss: 0.3928, test_loss: 1.1217, test_f1: 0.6235
 epoch: 37, train_loss: 0.3789, test_loss: 1.0439, test_f1: 0.6576
 epoch: 38, train_loss: 0.3724, test_loss: 1.2328, test_f1: 0.6137
 epoch: 39, train_loss: 0.3811, test_loss: 0.9832, test_f1: 0.6817
 epoch: 40, train_loss: 0.3373, test_loss: 1.0709, test_f1: 0.6429
 epoch: 41, train_loss: 0.3592, test_loss: 1.1586, test_f1: 0.6313
 epoch: 42, train_loss: 0.3528, test_loss: 1.1070, test_f1: 0.6486
 epoch: 43, train_loss: 0.3273, test_loss: 1.3222, test_f1: 0.6062
 epoch: 44, train_loss: 0.3261, test_loss: 1.1308, test_f1: 0.6297
 epoch: 45, train_loss: 0.3227, test_loss: 1.1866, test_f1: 0.6493
 epoch: 46, train_loss: 0.3341, test_loss: 1.1067, test_f1: 0.6647
 epoch: 47, train_loss: 0.3252, test_loss: 1.1810, test_f1: 0.6432
 epoch: 48, train_loss: 0.2950, test_loss: 1.1213, test_f1: 0.6568
 epoch: 49, train_loss: 0.2956, test_loss: 1.2600, test_f1: 0.6371
 epoch: 50, train_loss: 0.2976, test_loss: 1.2167, test_f1: 0.6388
 epoch: 51, train_loss: 0.2480, test_loss: 1.1959, test_f1: 0.6646
 epoch: 52, train_loss: 0.2262, test_loss: 1.2761, test_f1: 0.6539
 epoch: 53, train_loss: 0.2146, test_loss: 1.2656, test_f1: 0.6820
 epoch: 54, train_loss: 0.1973, test_loss: 1.2554, test_f1: 0.6924
 epoch: 55, train_loss: 0.1995, test_loss: 1.3106, test_f1: 0.6797
 epoch: 56, train_loss: 0.1926, test_loss: 1.3421, test_f1: 0.6500
 epoch: 57, train_loss: 0.1717, test_loss: 1.3661, test_f1: 0.6682
 epoch: 58, train_loss: 0.1829, test_loss: 1.3673, test_f1: 0.6782
 epoch: 59, train_loss: 0.1770, test_loss: 1.3363, test_f1: 0.6941
 epoch: 60, train_loss: 0.1877, test_loss: 1.4761, test_f1: 0.6520
 epoch: 61, train_loss: 0.1907, test_loss: 1.4238, test_f1: 0.6724
 epoch: 62, train_loss: 0.1856, test_loss: 1.3986, test_f1: 0.6659
 epoch: 63, train_loss: 0.1600, test_loss: 1.4756, test_f1: 0.6697
 epoch: 64, train_loss: 0.1673, test_loss: 1.5802, test_f1: 0.6764
 epoch: 65, train_loss: 0.1675, test_loss: 1.5204, test_f1: 0.6588
 epoch: 66, train_loss: 0.1705, test_loss: 1.6896, test_f1: 0.6172
 epoch: 67, train_loss: 0.1749, test_loss: 1.5098, test_f1: 0.6753
 epoch: 68, train_loss: 0.1621, test_loss: 1.5293, test_f1: 0.6600
 epoch: 69, train_loss: 0.1608, test_loss: 1.5443, test_f1: 0.6626
 epoch: 70, train_loss: 0.1508, test_loss: 1.6183, test_f1: 0.6602
 epoch: 71, train_loss: 0.1581, test_loss: 1.5461, test_f1: 0.6693
 epoch: 72, train_loss: 0.1560, test_loss: 1.5768, test_f1: 0.6791
 epoch: 73, train_loss: 0.1701, test_loss: 1.5677, test_f1: 0.6793
 epoch: 74, train_loss: 0.1569, test_loss: 1.5784, test_f1: 0.6793
 epoch: 75, train_loss: 0.1430, test_loss: 1.5506, test_f1: 0.6828
 epoch: 76, train_loss: 0.1444, test_loss: 1.6727, test_f1: 0.6626
 epoch: 77, train_loss: 0.1321, test_loss: 1.6950, test_f1: 0.6745
 epoch: 78, train_loss: 0.1238, test_loss: 1.6369, test_f1: 0.6705
 epoch: 79, train_loss: 0.1286, test_loss: 1.6994, test_f1: 0.6672
 epoch: 80, train_loss: 0.1356, test_loss: 1.6243, test_f1: 0.6803
 epoch: 81, train_loss: 0.1271, test_loss: 1.7021, test_f1: 0.6833
 epoch: 82, train_loss: 0.1211, test_loss: 1.6440, test_f1: 0.6778
 epoch: 83, train_loss: 0.1217, test_loss: 1.9517, test_f1: 0.6451
 epoch: 84, train_loss: 0.1249, test_loss: 1.9384, test_f1: 0.6363
 epoch: 85, train_loss: 0.1162, test_loss: 1.9824, test_f1: 0.6526
 epoch: 86, train_loss: 0.1140, test_loss: 1.9303, test_f1: 0.6419
 epoch: 87, train_loss: 0.1149, test_loss: 1.8622, test_f1: 0.6721
 epoch: 88, train_loss: 0.1257, test_loss: 1.6839, test_f1: 0.6723
 epoch: 89, train_loss: 0.1236, test_loss: 1.8470, test_f1: 0.6848
 epoch: 90, train_loss: 0.1265, test_loss: 1.8075, test_f1: 0.6501
 epoch: 91, train_loss: 0.1246, test_loss: 1.8925, test_f1: 0.6386
 epoch: 92, train_loss: 0.1117, test_loss: 1.8151, test_f1: 0.6553
 epoch: 93, train_loss: 0.1201, test_loss: 1.8666, test_f1: 0.6543
 epoch: 94, train_loss: 0.1358, test_loss: 1.6644, test_f1: 0.6840
 epoch: 95, train_loss: 0.1293, test_loss: 1.8817, test_f1: 0.6696
 epoch: 96, train_loss: 0.1188, test_loss: 1.9932, test_f1: 0.6392
 epoch: 97, train_loss: 0.1157, test_loss: 1.9345, test_f1: 0.6455
 epoch: 98, train_loss: 0.0986, test_loss: 1.8912, test_f1: 0.6848
 epoch: 99, train_loss: 0.1040, test_loss: 1.9789, test_f1: 0.6668
##################ITERATION #5 ****************************************
 epoch: 0, train_loss: 1.3136, test_loss: 1.2449, test_f1: 0.3789
 epoch: 1, train_loss: 1.0073, test_loss: 1.0421, test_f1: 0.4342
 epoch: 2, train_loss: 0.9308, test_loss: 0.9346, test_f1: 0.5548
 epoch: 3, train_loss: 0.8763, test_loss: 0.9362, test_f1: 0.6052
 epoch: 4, train_loss: 0.8507, test_loss: 0.9437, test_f1: 0.5653
 epoch: 5, train_loss: 0.8278, test_loss: 0.9051, test_f1: 0.6000
 epoch: 6, train_loss: 0.7970, test_loss: 0.8928, test_f1: 0.5855
 epoch: 7, train_loss: 0.7569, test_loss: 0.8656, test_f1: 0.6000
 epoch: 8, train_loss: 0.7411, test_loss: 0.9056, test_f1: 0.5719
 epoch: 9, train_loss: 0.7195, test_loss: 0.8543, test_f1: 0.6158
 epoch: 10, train_loss: 0.7055, test_loss: 0.8769, test_f1: 0.6214
 epoch: 11, train_loss: 0.6883, test_loss: 0.9160, test_f1: 0.6281
 epoch: 12, train_loss: 0.6718, test_loss: 0.8641, test_f1: 0.6019
 epoch: 13, train_loss: 0.6361, test_loss: 0.8014, test_f1: 0.6400
 epoch: 14, train_loss: 0.6541, test_loss: 0.8599, test_f1: 0.6295
 epoch: 15, train_loss: 0.6425, test_loss: 0.8815, test_f1: 0.6133
 epoch: 16, train_loss: 0.6083, test_loss: 0.8040, test_f1: 0.6333
 epoch: 17, train_loss: 0.5870, test_loss: 0.8443, test_f1: 0.6223
 epoch: 18, train_loss: 0.5966, test_loss: 0.8684, test_f1: 0.6032
 epoch: 19, train_loss: 0.5924, test_loss: 0.7628, test_f1: 0.6295
 epoch: 20, train_loss: 0.5653, test_loss: 0.9277, test_f1: 0.5844
 epoch: 21, train_loss: 0.5560, test_loss: 0.8104, test_f1: 0.6237
 epoch: 22, train_loss: 0.5362, test_loss: 0.8740, test_f1: 0.5954
 epoch: 23, train_loss: 0.5417, test_loss: 0.7945, test_f1: 0.6330
 epoch: 24, train_loss: 0.5176, test_loss: 0.9470, test_f1: 0.5965
 epoch: 25, train_loss: 0.4916, test_loss: 0.9019, test_f1: 0.6168
 epoch: 26, train_loss: 0.5122, test_loss: 0.8890, test_f1: 0.6285
 epoch: 27, train_loss: 0.5122, test_loss: 0.8401, test_f1: 0.6167
 epoch: 28, train_loss: 0.4994, test_loss: 0.8430, test_f1: 0.6478
 epoch: 29, train_loss: 0.4712, test_loss: 0.8783, test_f1: 0.6557
 epoch: 30, train_loss: 0.4331, test_loss: 0.8402, test_f1: 0.6533
 epoch: 31, train_loss: 0.4399, test_loss: 0.9382, test_f1: 0.6305
 epoch: 32, train_loss: 0.4442, test_loss: 0.9120, test_f1: 0.6488
 epoch: 33, train_loss: 0.4111, test_loss: 0.8468, test_f1: 0.6699
 epoch: 34, train_loss: 0.4267, test_loss: 1.0646, test_f1: 0.6122
 epoch: 35, train_loss: 0.3987, test_loss: 0.9816, test_f1: 0.6295
 epoch: 36, train_loss: 0.3941, test_loss: 0.9571, test_f1: 0.6636
 epoch: 37, train_loss: 0.3958, test_loss: 0.9756, test_f1: 0.6301
 epoch: 38, train_loss: 0.3854, test_loss: 1.0606, test_f1: 0.6308
 epoch: 39, train_loss: 0.3789, test_loss: 0.9319, test_f1: 0.6724
 epoch: 40, train_loss: 0.3718, test_loss: 1.0367, test_f1: 0.6505
 epoch: 41, train_loss: 0.3583, test_loss: 1.0682, test_f1: 0.6409
 epoch: 42, train_loss: 0.3588, test_loss: 1.0376, test_f1: 0.6427
 epoch: 43, train_loss: 0.3621, test_loss: 1.1489, test_f1: 0.5662
 epoch: 44, train_loss: 0.3420, test_loss: 1.0209, test_f1: 0.6639
 epoch: 45, train_loss: 0.3166, test_loss: 1.1700, test_f1: 0.6464
 epoch: 46, train_loss: 0.3187, test_loss: 1.0541, test_f1: 0.6506
 epoch: 47, train_loss: 0.3446, test_loss: 1.1253, test_f1: 0.6503
 epoch: 48, train_loss: 0.3271, test_loss: 1.0458, test_f1: 0.6495
 epoch: 49, train_loss: 0.3146, test_loss: 1.0712, test_f1: 0.6695
 epoch: 50, train_loss: 0.2849, test_loss: 1.0377, test_f1: 0.6533
 epoch: 51, train_loss: 0.2685, test_loss: 1.0708, test_f1: 0.6612
 epoch: 52, train_loss: 0.2466, test_loss: 0.9643, test_f1: 0.6849
 epoch: 53, train_loss: 0.2206, test_loss: 1.2387, test_f1: 0.6566
 epoch: 54, train_loss: 0.2323, test_loss: 1.1808, test_f1: 0.6489
 epoch: 55, train_loss: 0.2072, test_loss: 1.1680, test_f1: 0.6460
 epoch: 56, train_loss: 0.2053, test_loss: 1.1256, test_f1: 0.6412
 epoch: 57, train_loss: 0.2132, test_loss: 1.0823, test_f1: 0.6905
 epoch: 58, train_loss: 0.1991, test_loss: 1.1366, test_f1: 0.6668
 epoch: 59, train_loss: 0.1878, test_loss: 1.2490, test_f1: 0.6578
 epoch: 60, train_loss: 0.1941, test_loss: 1.1339, test_f1: 0.6851
 epoch: 61, train_loss: 0.1966, test_loss: 1.3905, test_f1: 0.6437
 epoch: 62, train_loss: 0.1880, test_loss: 1.2294, test_f1: 0.6677
 epoch: 63, train_loss: 0.1770, test_loss: 1.2760, test_f1: 0.6538
 epoch: 64, train_loss: 0.1855, test_loss: 1.3243, test_f1: 0.6684
 epoch: 65, train_loss: 0.2012, test_loss: 1.2888, test_f1: 0.6751
 epoch: 66, train_loss: 0.1782, test_loss: 1.2096, test_f1: 0.6653
 epoch: 67, train_loss: 0.1862, test_loss: 1.4511, test_f1: 0.6312
 epoch: 68, train_loss: 0.1826, test_loss: 1.4058, test_f1: 0.6609
 epoch: 69, train_loss: 0.1743, test_loss: 1.3468, test_f1: 0.6218
 epoch: 70, train_loss: 0.1658, test_loss: 1.3243, test_f1: 0.6552
 epoch: 71, train_loss: 0.1799, test_loss: 1.3135, test_f1: 0.6532
 epoch: 72, train_loss: 0.1767, test_loss: 1.3472, test_f1: 0.6701
 epoch: 73, train_loss: 0.1592, test_loss: 1.2661, test_f1: 0.6866
 epoch: 74, train_loss: 0.1557, test_loss: 1.3989, test_f1: 0.6439
 epoch: 75, train_loss: 0.1693, test_loss: 1.4556, test_f1: 0.6655
 epoch: 76, train_loss: 0.1473, test_loss: 1.4978, test_f1: 0.6525
 epoch: 77, train_loss: 0.1570, test_loss: 1.3157, test_f1: 0.6875
 epoch: 78, train_loss: 0.1811, test_loss: 1.3933, test_f1: 0.6516
 epoch: 79, train_loss: 0.1414, test_loss: 1.3023, test_f1: 0.6660
 epoch: 80, train_loss: 0.1580, test_loss: 1.4846, test_f1: 0.6519
 epoch: 81, train_loss: 0.1597, test_loss: 1.5098, test_f1: 0.6651
 epoch: 82, train_loss: 0.1469, test_loss: 1.5502, test_f1: 0.6532
 epoch: 83, train_loss: 0.1592, test_loss: 1.5023, test_f1: 0.6451
 epoch: 84, train_loss: 0.1555, test_loss: 1.4468, test_f1: 0.6828
 epoch: 85, train_loss: 0.1393, test_loss: 1.6102, test_f1: 0.6375
 epoch: 86, train_loss: 0.1400, test_loss: 1.5957, test_f1: 0.6479
 epoch: 87, train_loss: 0.1383, test_loss: 1.6395, test_f1: 0.6250
 epoch: 88, train_loss: 0.1226, test_loss: 1.7095, test_f1: 0.6409
 epoch: 89, train_loss: 0.1531, test_loss: 1.7042, test_f1: 0.6341
 epoch: 90, train_loss: 0.1339, test_loss: 1.3996, test_f1: 0.6807
 epoch: 91, train_loss: 0.1582, test_loss: 1.4594, test_f1: 0.6361
 epoch: 92, train_loss: 0.1321, test_loss: 1.5165, test_f1: 0.6525
 epoch: 93, train_loss: 0.1331, test_loss: 1.5568, test_f1: 0.6316
 epoch: 94, train_loss: 0.1306, test_loss: 1.5465, test_f1: 0.6356
 epoch: 95, train_loss: 0.1257, test_loss: 1.5467, test_f1: 0.6563
 epoch: 96, train_loss: 0.1336, test_loss: 1.8304, test_f1: 0.6222
 epoch: 97, train_loss: 0.1130, test_loss: 1.5653, test_f1: 0.6789
 epoch: 98, train_loss: 0.1125, test_loss: 1.6793, test_f1: 0.6459
 epoch: 99, train_loss: 0.1094, test_loss: 1.7735, test_f1: 0.6519
##################ITERATION #6 ****************************************
 epoch: 0, train_loss: 1.3680, test_loss: 1.2826, test_f1: 0.2792
 epoch: 1, train_loss: 1.0131, test_loss: 0.9910, test_f1: 0.4488
 epoch: 2, train_loss: 0.9347, test_loss: 0.9184, test_f1: 0.5481
 epoch: 3, train_loss: 0.8831, test_loss: 0.9177, test_f1: 0.5594
 epoch: 4, train_loss: 0.8560, test_loss: 0.8955, test_f1: 0.5839
 epoch: 5, train_loss: 0.8063, test_loss: 0.8712, test_f1: 0.5909
 epoch: 6, train_loss: 0.7935, test_loss: 0.8537, test_f1: 0.5334
 epoch: 7, train_loss: 0.7851, test_loss: 0.9550, test_f1: 0.5456
 epoch: 8, train_loss: 0.7648, test_loss: 0.8942, test_f1: 0.5499
 epoch: 9, train_loss: 0.7269, test_loss: 0.8939, test_f1: 0.6113
 epoch: 10, train_loss: 0.7361, test_loss: 0.8379, test_f1: 0.6206
 epoch: 11, train_loss: 0.7162, test_loss: 0.8752, test_f1: 0.5896
 epoch: 12, train_loss: 0.6899, test_loss: 0.8470, test_f1: 0.6220
 epoch: 13, train_loss: 0.6705, test_loss: 0.8252, test_f1: 0.6297
 epoch: 14, train_loss: 0.6570, test_loss: 0.8006, test_f1: 0.6511
 epoch: 15, train_loss: 0.6534, test_loss: 0.8339, test_f1: 0.6381
 epoch: 16, train_loss: 0.6295, test_loss: 0.7944, test_f1: 0.6263
 epoch: 17, train_loss: 0.6412, test_loss: 0.9157, test_f1: 0.5840
 epoch: 18, train_loss: 0.5932, test_loss: 0.8309, test_f1: 0.6300
 epoch: 19, train_loss: 0.5626, test_loss: 0.8325, test_f1: 0.6549
 epoch: 20, train_loss: 0.5712, test_loss: 0.8578, test_f1: 0.6517
 epoch: 21, train_loss: 0.5599, test_loss: 0.9110, test_f1: 0.6340
 epoch: 22, train_loss: 0.5420, test_loss: 0.7989, test_f1: 0.6473
 epoch: 23, train_loss: 0.5449, test_loss: 0.8555, test_f1: 0.6247
 epoch: 24, train_loss: 0.5320, test_loss: 0.8831, test_f1: 0.6468
 epoch: 25, train_loss: 0.5168, test_loss: 0.9625, test_f1: 0.6031
 epoch: 26, train_loss: 0.5130, test_loss: 0.8324, test_f1: 0.6570
 epoch: 27, train_loss: 0.4902, test_loss: 0.9203, test_f1: 0.6478
 epoch: 28, train_loss: 0.4836, test_loss: 0.8993, test_f1: 0.6450
 epoch: 29, train_loss: 0.4731, test_loss: 0.8927, test_f1: 0.6441
 epoch: 30, train_loss: 0.4916, test_loss: 0.9854, test_f1: 0.5872
 epoch: 31, train_loss: 0.4616, test_loss: 0.9043, test_f1: 0.6493
 epoch: 32, train_loss: 0.4404, test_loss: 1.0211, test_f1: 0.6205
 epoch: 33, train_loss: 0.4399, test_loss: 1.1196, test_f1: 0.6185
 epoch: 34, train_loss: 0.4019, test_loss: 0.9121, test_f1: 0.6502
 epoch: 35, train_loss: 0.3999, test_loss: 0.9290, test_f1: 0.6474
 epoch: 36, train_loss: 0.4025, test_loss: 1.0199, test_f1: 0.6230
 epoch: 37, train_loss: 0.4111, test_loss: 0.9773, test_f1: 0.6232
 epoch: 38, train_loss: 0.3861, test_loss: 0.9232, test_f1: 0.6312
 epoch: 39, train_loss: 0.3614, test_loss: 0.9525, test_f1: 0.6814
 epoch: 40, train_loss: 0.3879, test_loss: 0.9561, test_f1: 0.6725
 epoch: 41, train_loss: 0.3838, test_loss: 1.0101, test_f1: 0.6284
 epoch: 42, train_loss: 0.3445, test_loss: 1.3136, test_f1: 0.5984
 epoch: 43, train_loss: 0.3282, test_loss: 0.9668, test_f1: 0.6645
 epoch: 44, train_loss: 0.3156, test_loss: 1.0788, test_f1: 0.6144
 epoch: 45, train_loss: 0.3222, test_loss: 1.0274, test_f1: 0.6513
 epoch: 46, train_loss: 0.3382, test_loss: 0.9245, test_f1: 0.6707
 epoch: 47, train_loss: 0.3378, test_loss: 1.0242, test_f1: 0.6549
 epoch: 48, train_loss: 0.3084, test_loss: 1.3428, test_f1: 0.6187
 epoch: 49, train_loss: 0.3229, test_loss: 1.2239, test_f1: 0.6107
 epoch: 50, train_loss: 0.3312, test_loss: 1.1737, test_f1: 0.6302
 epoch: 51, train_loss: 0.2831, test_loss: 1.0282, test_f1: 0.6846
 epoch: 52, train_loss: 0.2460, test_loss: 1.1136, test_f1: 0.6740
 epoch: 53, train_loss: 0.2215, test_loss: 1.1798, test_f1: 0.6579
 epoch: 54, train_loss: 0.2056, test_loss: 1.1895, test_f1: 0.6759
 epoch: 55, train_loss: 0.2125, test_loss: 1.2086, test_f1: 0.6739
 epoch: 56, train_loss: 0.2101, test_loss: 1.1605, test_f1: 0.6637
 epoch: 57, train_loss: 0.2033, test_loss: 1.2179, test_f1: 0.6674
 epoch: 58, train_loss: 0.1930, test_loss: 1.2264, test_f1: 0.6787
 epoch: 59, train_loss: 0.2023, test_loss: 1.2609, test_f1: 0.6685
 epoch: 60, train_loss: 0.1809, test_loss: 1.3744, test_f1: 0.6626
 epoch: 61, train_loss: 0.1912, test_loss: 1.2493, test_f1: 0.6597
 epoch: 62, train_loss: 0.1876, test_loss: 1.3163, test_f1: 0.6595
 epoch: 63, train_loss: 0.1822, test_loss: 1.3423, test_f1: 0.6709
 epoch: 64, train_loss: 0.1640, test_loss: 1.3135, test_f1: 0.6610
 epoch: 65, train_loss: 0.1838, test_loss: 1.4274, test_f1: 0.6514
 epoch: 66, train_loss: 0.1688, test_loss: 1.4273, test_f1: 0.6785
 epoch: 67, train_loss: 0.1705, test_loss: 1.3985, test_f1: 0.6541
 epoch: 68, train_loss: 0.1528, test_loss: 1.3890, test_f1: 0.6785
 epoch: 69, train_loss: 0.1653, test_loss: 1.3170, test_f1: 0.6807
 epoch: 70, train_loss: 0.1560, test_loss: 1.3562, test_f1: 0.6739
 epoch: 71, train_loss: 0.1760, test_loss: 1.4433, test_f1: 0.6434
 epoch: 72, train_loss: 0.1603, test_loss: 1.5402, test_f1: 0.6565
 epoch: 73, train_loss: 0.1599, test_loss: 1.4010, test_f1: 0.6964
 epoch: 74, train_loss: 0.1440, test_loss: 1.4303, test_f1: 0.6632
 epoch: 75, train_loss: 0.1420, test_loss: 1.5801, test_f1: 0.6606
 epoch: 76, train_loss: 0.1391, test_loss: 1.6493, test_f1: 0.6593
 epoch: 77, train_loss: 0.1494, test_loss: 1.4916, test_f1: 0.6614
 epoch: 78, train_loss: 0.1220, test_loss: 1.4215, test_f1: 0.6705
 epoch: 79, train_loss: 0.1598, test_loss: 1.6315, test_f1: 0.6503
 epoch: 80, train_loss: 0.1508, test_loss: 1.6546, test_f1: 0.6631
 epoch: 81, train_loss: 0.1429, test_loss: 1.5419, test_f1: 0.6406
 epoch: 82, train_loss: 0.1348, test_loss: 1.6421, test_f1: 0.6551
 epoch: 83, train_loss: 0.1480, test_loss: 1.5361, test_f1: 0.6694
 epoch: 84, train_loss: 0.1384, test_loss: 1.5901, test_f1: 0.6156
 epoch: 85, train_loss: 0.1353, test_loss: 1.7255, test_f1: 0.6519
 epoch: 86, train_loss: 0.1354, test_loss: 1.5673, test_f1: 0.6734
 epoch: 87, train_loss: 0.1257, test_loss: 1.4878, test_f1: 0.6704
 epoch: 88, train_loss: 0.1225, test_loss: 1.6619, test_f1: 0.6395
 epoch: 89, train_loss: 0.1065, test_loss: 1.6548, test_f1: 0.6580
 epoch: 90, train_loss: 0.1227, test_loss: 1.7343, test_f1: 0.6218
 epoch: 91, train_loss: 0.1231, test_loss: 1.7090, test_f1: 0.6624
 epoch: 92, train_loss: 0.1339, test_loss: 1.6494, test_f1: 0.6494
 epoch: 93, train_loss: 0.1186, test_loss: 1.8082, test_f1: 0.6497
 epoch: 94, train_loss: 0.1185, test_loss: 1.6774, test_f1: 0.6502
 epoch: 95, train_loss: 0.1185, test_loss: 1.9109, test_f1: 0.6464
 epoch: 96, train_loss: 0.1184, test_loss: 1.5706, test_f1: 0.6611
 epoch: 97, train_loss: 0.1233, test_loss: 1.7982, test_f1: 0.6297
 epoch: 98, train_loss: 0.1145, test_loss: 1.8834, test_f1: 0.6442
 epoch: 99, train_loss: 0.1196, test_loss: 1.6532, test_f1: 0.6467
##################ITERATION #7 ****************************************
 epoch: 0, train_loss: 1.3917, test_loss: 1.4625, test_f1: 0.2894
 epoch: 1, train_loss: 0.9690, test_loss: 1.0508, test_f1: 0.4330
 epoch: 2, train_loss: 0.9088, test_loss: 0.9807, test_f1: 0.5419
 epoch: 3, train_loss: 0.8759, test_loss: 0.8977, test_f1: 0.5911
 epoch: 4, train_loss: 0.8491, test_loss: 0.8892, test_f1: 0.5720
 epoch: 5, train_loss: 0.8170, test_loss: 0.9084, test_f1: 0.5555
 epoch: 6, train_loss: 0.8151, test_loss: 0.9009, test_f1: 0.5310
 epoch: 7, train_loss: 0.7974, test_loss: 0.8897, test_f1: 0.5957
 epoch: 8, train_loss: 0.7770, test_loss: 0.9060, test_f1: 0.5610
 epoch: 9, train_loss: 0.7672, test_loss: 0.9125, test_f1: 0.5723
 epoch: 10, train_loss: 0.7500, test_loss: 0.8382, test_f1: 0.6158
 epoch: 11, train_loss: 0.7428, test_loss: 0.9528, test_f1: 0.5652
 epoch: 12, train_loss: 0.7308, test_loss: 0.8500, test_f1: 0.6009
 epoch: 13, train_loss: 0.6937, test_loss: 0.9273, test_f1: 0.5647
 epoch: 14, train_loss: 0.6817, test_loss: 0.8507, test_f1: 0.6093
 epoch: 15, train_loss: 0.6673, test_loss: 0.9138, test_f1: 0.6078
 epoch: 16, train_loss: 0.6569, test_loss: 0.7988, test_f1: 0.6388
 epoch: 17, train_loss: 0.6225, test_loss: 0.8046, test_f1: 0.6384
 epoch: 18, train_loss: 0.6222, test_loss: 0.8248, test_f1: 0.6160
 epoch: 19, train_loss: 0.6020, test_loss: 0.8530, test_f1: 0.6227
 epoch: 20, train_loss: 0.5791, test_loss: 0.8517, test_f1: 0.6246
 epoch: 21, train_loss: 0.6100, test_loss: 0.8741, test_f1: 0.5931
 epoch: 22, train_loss: 0.5655, test_loss: 0.8867, test_f1: 0.6145
 epoch: 23, train_loss: 0.5521, test_loss: 0.9506, test_f1: 0.5670
 epoch: 24, train_loss: 0.5537, test_loss: 0.9704, test_f1: 0.6037
 epoch: 25, train_loss: 0.5297, test_loss: 0.9086, test_f1: 0.6383
 epoch: 26, train_loss: 0.5507, test_loss: 0.8374, test_f1: 0.6503
 epoch: 27, train_loss: 0.5168, test_loss: 0.8578, test_f1: 0.6352
 epoch: 28, train_loss: 0.5168, test_loss: 0.8795, test_f1: 0.6388
 epoch: 29, train_loss: 0.4927, test_loss: 0.8907, test_f1: 0.6543
 epoch: 30, train_loss: 0.4876, test_loss: 0.9018, test_f1: 0.6615
 epoch: 31, train_loss: 0.4872, test_loss: 0.9550, test_f1: 0.6263
 epoch: 32, train_loss: 0.4746, test_loss: 0.8859, test_f1: 0.6685
 epoch: 33, train_loss: 0.4808, test_loss: 0.8747, test_f1: 0.6523
 epoch: 34, train_loss: 0.4629, test_loss: 1.0232, test_f1: 0.6435
 epoch: 35, train_loss: 0.4447, test_loss: 0.9147, test_f1: 0.6326
 epoch: 36, train_loss: 0.4369, test_loss: 1.0029, test_f1: 0.6331
 epoch: 37, train_loss: 0.4203, test_loss: 1.0420, test_f1: 0.6437
 epoch: 38, train_loss: 0.4197, test_loss: 0.9458, test_f1: 0.6547
 epoch: 39, train_loss: 0.4104, test_loss: 1.0233, test_f1: 0.6275
 epoch: 40, train_loss: 0.3902, test_loss: 1.0600, test_f1: 0.6605
 epoch: 41, train_loss: 0.4014, test_loss: 1.0711, test_f1: 0.6405
 epoch: 42, train_loss: 0.3776, test_loss: 1.1723, test_f1: 0.6370
 epoch: 43, train_loss: 0.3687, test_loss: 1.0559, test_f1: 0.6584
 epoch: 44, train_loss: 0.3727, test_loss: 1.0058, test_f1: 0.7004
 epoch: 45, train_loss: 0.3553, test_loss: 1.0682, test_f1: 0.6626
 epoch: 46, train_loss: 0.3481, test_loss: 1.0944, test_f1: 0.6571
 epoch: 47, train_loss: 0.3670, test_loss: 0.9547, test_f1: 0.6597
 epoch: 48, train_loss: 0.3611, test_loss: 1.0757, test_f1: 0.6487
 epoch: 49, train_loss: 0.3248, test_loss: 1.2755, test_f1: 0.6510
 epoch: 50, train_loss: 0.3243, test_loss: 1.2449, test_f1: 0.6494
 epoch: 51, train_loss: 0.2960, test_loss: 1.1799, test_f1: 0.6705
 epoch: 52, train_loss: 0.2413, test_loss: 1.2181, test_f1: 0.6501
 epoch: 53, train_loss: 0.2513, test_loss: 1.4466, test_f1: 0.6612
 epoch: 54, train_loss: 0.2423, test_loss: 1.2685, test_f1: 0.6303
 epoch: 55, train_loss: 0.2414, test_loss: 1.3510, test_f1: 0.6564
 epoch: 56, train_loss: 0.2353, test_loss: 1.2979, test_f1: 0.6563
 epoch: 57, train_loss: 0.2304, test_loss: 1.4526, test_f1: 0.6455
 epoch: 58, train_loss: 0.2141, test_loss: 1.4837, test_f1: 0.6661
 epoch: 59, train_loss: 0.2060, test_loss: 1.4324, test_f1: 0.6601
 epoch: 60, train_loss: 0.2328, test_loss: 1.4331, test_f1: 0.6420
 epoch: 61, train_loss: 0.2229, test_loss: 1.4224, test_f1: 0.6617
 epoch: 62, train_loss: 0.2113, test_loss: 1.6375, test_f1: 0.6284
 epoch: 63, train_loss: 0.2348, test_loss: 1.5331, test_f1: 0.6434
 epoch: 64, train_loss: 0.2097, test_loss: 1.5085, test_f1: 0.6739
 epoch: 65, train_loss: 0.2116, test_loss: 1.4235, test_f1: 0.6310
 epoch: 66, train_loss: 0.2050, test_loss: 1.4530, test_f1: 0.6274
 epoch: 67, train_loss: 0.1931, test_loss: 1.3415, test_f1: 0.6559
 epoch: 68, train_loss: 0.1776, test_loss: 1.7785, test_f1: 0.6166
 epoch: 69, train_loss: 0.1874, test_loss: 1.5969, test_f1: 0.6458
 epoch: 70, train_loss: 0.1814, test_loss: 1.6184, test_f1: 0.6314
 epoch: 71, train_loss: 0.1923, test_loss: 1.6946, test_f1: 0.6596
 epoch: 72, train_loss: 0.1773, test_loss: 1.5231, test_f1: 0.6606
 epoch: 73, train_loss: 0.1898, test_loss: 1.5793, test_f1: 0.6684
 epoch: 74, train_loss: 0.1683, test_loss: 1.6325, test_f1: 0.6356
 epoch: 75, train_loss: 0.1793, test_loss: 1.5395, test_f1: 0.6845
 epoch: 76, train_loss: 0.2060, test_loss: 1.7351, test_f1: 0.6410
 epoch: 77, train_loss: 0.1635, test_loss: 1.7294, test_f1: 0.6747
 epoch: 78, train_loss: 0.1731, test_loss: 1.5125, test_f1: 0.6952
 epoch: 79, train_loss: 0.1497, test_loss: 1.8690, test_f1: 0.6588
 epoch: 80, train_loss: 0.1503, test_loss: 1.7052, test_f1: 0.6630
 epoch: 81, train_loss: 0.1443, test_loss: 1.7378, test_f1: 0.6281
 epoch: 82, train_loss: 0.1700, test_loss: 1.7507, test_f1: 0.6219
 epoch: 83, train_loss: 0.1528, test_loss: 1.7277, test_f1: 0.6604
 epoch: 84, train_loss: 0.1603, test_loss: 1.7885, test_f1: 0.6211
 epoch: 85, train_loss: 0.1513, test_loss: 1.6698, test_f1: 0.6365
 epoch: 86, train_loss: 0.1633, test_loss: 1.9083, test_f1: 0.6642
 epoch: 87, train_loss: 0.1542, test_loss: 1.9360, test_f1: 0.6419
 epoch: 88, train_loss: 0.1487, test_loss: 1.9128, test_f1: 0.6356
 epoch: 89, train_loss: 0.1474, test_loss: 1.8436, test_f1: 0.6404
 epoch: 90, train_loss: 0.1457, test_loss: 2.1219, test_f1: 0.6412
 epoch: 91, train_loss: 0.1622, test_loss: 1.7584, test_f1: 0.6551
 epoch: 92, train_loss: 0.1364, test_loss: 1.9603, test_f1: 0.6511
 epoch: 93, train_loss: 0.1401, test_loss: 1.6975, test_f1: 0.6683
 epoch: 94, train_loss: 0.1407, test_loss: 1.8852, test_f1: 0.6661
 epoch: 95, train_loss: 0.1560, test_loss: 2.0790, test_f1: 0.6182
 epoch: 96, train_loss: 0.1336, test_loss: 1.7816, test_f1: 0.6581
 epoch: 97, train_loss: 0.1315, test_loss: 1.9304, test_f1: 0.6346
 epoch: 98, train_loss: 0.1371, test_loss: 1.9224, test_f1: 0.6702
 epoch: 99, train_loss: 0.1428, test_loss: 2.0305, test_f1: 0.6496
##################ITERATION #8 ****************************************
 epoch: 0, train_loss: 1.3376, test_loss: 1.1422, test_f1: 0.2991
 epoch: 1, train_loss: 1.0000, test_loss: 1.0038, test_f1: 0.4679
 epoch: 2, train_loss: 0.9279, test_loss: 0.9334, test_f1: 0.5499
 epoch: 3, train_loss: 0.8931, test_loss: 0.9057, test_f1: 0.5168
 epoch: 4, train_loss: 0.8829, test_loss: 0.8775, test_f1: 0.5961
 epoch: 5, train_loss: 0.8517, test_loss: 0.9147, test_f1: 0.5799
 epoch: 6, train_loss: 0.8086, test_loss: 0.9235, test_f1: 0.5474
 epoch: 7, train_loss: 0.8003, test_loss: 0.8647, test_f1: 0.6026
 epoch: 8, train_loss: 0.7595, test_loss: 0.8283, test_f1: 0.5888
 epoch: 9, train_loss: 0.7690, test_loss: 0.8555, test_f1: 0.6264
 epoch: 10, train_loss: 0.7290, test_loss: 0.8859, test_f1: 0.6283
 epoch: 11, train_loss: 0.7185, test_loss: 0.7904, test_f1: 0.6032
 epoch: 12, train_loss: 0.7023, test_loss: 0.8365, test_f1: 0.6174
 epoch: 13, train_loss: 0.6895, test_loss: 0.9512, test_f1: 0.5944
 epoch: 14, train_loss: 0.6861, test_loss: 0.8247, test_f1: 0.6171
 epoch: 15, train_loss: 0.6761, test_loss: 0.8602, test_f1: 0.6218
 epoch: 16, train_loss: 0.6430, test_loss: 0.8019, test_f1: 0.6314
 epoch: 17, train_loss: 0.6326, test_loss: 0.8691, test_f1: 0.6083
 epoch: 18, train_loss: 0.6135, test_loss: 1.0127, test_f1: 0.5572
 epoch: 19, train_loss: 0.6030, test_loss: 0.8647, test_f1: 0.6295
 epoch: 20, train_loss: 0.6018, test_loss: 0.8613, test_f1: 0.6142
 epoch: 21, train_loss: 0.5862, test_loss: 0.8645, test_f1: 0.6109
 epoch: 22, train_loss: 0.5818, test_loss: 0.9104, test_f1: 0.6279
 epoch: 23, train_loss: 0.5744, test_loss: 0.9070, test_f1: 0.6374
 epoch: 24, train_loss: 0.5453, test_loss: 1.0388, test_f1: 0.6256
 epoch: 25, train_loss: 0.5422, test_loss: 0.9714, test_f1: 0.6364
 epoch: 26, train_loss: 0.5051, test_loss: 1.0106, test_f1: 0.6122
 epoch: 27, train_loss: 0.5196, test_loss: 1.0522, test_f1: 0.5913
 epoch: 28, train_loss: 0.5197, test_loss: 1.0251, test_f1: 0.6393
 epoch: 29, train_loss: 0.4746, test_loss: 0.9725, test_f1: 0.6438
 epoch: 30, train_loss: 0.4693, test_loss: 1.0675, test_f1: 0.6217
 epoch: 31, train_loss: 0.4455, test_loss: 0.9746, test_f1: 0.6358
 epoch: 32, train_loss: 0.4455, test_loss: 1.0022, test_f1: 0.6501
 epoch: 33, train_loss: 0.4509, test_loss: 1.0514, test_f1: 0.6402
 epoch: 34, train_loss: 0.4475, test_loss: 1.0621, test_f1: 0.6093
 epoch: 35, train_loss: 0.4493, test_loss: 1.0684, test_f1: 0.6129
 epoch: 36, train_loss: 0.4289, test_loss: 1.0597, test_f1: 0.6420
 epoch: 37, train_loss: 0.4271, test_loss: 0.9864, test_f1: 0.6382
 epoch: 38, train_loss: 0.3926, test_loss: 1.1148, test_f1: 0.6442
 epoch: 39, train_loss: 0.3781, test_loss: 1.1793, test_f1: 0.6260
 epoch: 40, train_loss: 0.3884, test_loss: 0.9987, test_f1: 0.6657
 epoch: 41, train_loss: 0.3726, test_loss: 1.1655, test_f1: 0.6008
 epoch: 42, train_loss: 0.3812, test_loss: 1.2951, test_f1: 0.5904
 epoch: 43, train_loss: 0.4026, test_loss: 1.1678, test_f1: 0.6295
 epoch: 44, train_loss: 0.3573, test_loss: 1.0699, test_f1: 0.6763
 epoch: 45, train_loss: 0.3702, test_loss: 1.3006, test_f1: 0.6479
 epoch: 46, train_loss: 0.3433, test_loss: 1.4057, test_f1: 0.5993
 epoch: 47, train_loss: 0.3122, test_loss: 1.1823, test_f1: 0.6568
 epoch: 48, train_loss: 0.3240, test_loss: 1.1648, test_f1: 0.6371
 epoch: 49, train_loss: 0.3190, test_loss: 1.2241, test_f1: 0.6447
 epoch: 50, train_loss: 0.3086, test_loss: 1.2643, test_f1: 0.6483
 epoch: 51, train_loss: 0.2743, test_loss: 1.2945, test_f1: 0.6438
 epoch: 52, train_loss: 0.2457, test_loss: 1.3744, test_f1: 0.6581
 epoch: 53, train_loss: 0.2272, test_loss: 1.4223, test_f1: 0.6449
 epoch: 54, train_loss: 0.2245, test_loss: 1.3870, test_f1: 0.6613
 epoch: 55, train_loss: 0.2109, test_loss: 1.4712, test_f1: 0.6656
 epoch: 56, train_loss: 0.2106, test_loss: 1.5002, test_f1: 0.6610
 epoch: 57, train_loss: 0.2253, test_loss: 1.3868, test_f1: 0.6629
 epoch: 58, train_loss: 0.2241, test_loss: 1.4297, test_f1: 0.6509
 epoch: 59, train_loss: 0.2139, test_loss: 1.5621, test_f1: 0.6626
 epoch: 60, train_loss: 0.2042, test_loss: 1.5219, test_f1: 0.6565
 epoch: 61, train_loss: 0.2075, test_loss: 1.4269, test_f1: 0.6667
 epoch: 62, train_loss: 0.1999, test_loss: 1.7019, test_f1: 0.6407
 epoch: 63, train_loss: 0.1963, test_loss: 1.5307, test_f1: 0.6682
 epoch: 64, train_loss: 0.2025, test_loss: 1.5742, test_f1: 0.6448
 epoch: 65, train_loss: 0.1900, test_loss: 1.6469, test_f1: 0.6513
 epoch: 66, train_loss: 0.1939, test_loss: 1.6439, test_f1: 0.6474
 epoch: 67, train_loss: 0.1861, test_loss: 1.5413, test_f1: 0.6816
 epoch: 68, train_loss: 0.1846, test_loss: 1.5764, test_f1: 0.6641
 epoch: 69, train_loss: 0.1812, test_loss: 1.6316, test_f1: 0.6635
 epoch: 70, train_loss: 0.1661, test_loss: 1.6180, test_f1: 0.6615
 epoch: 71, train_loss: 0.1688, test_loss: 1.8276, test_f1: 0.6524
 epoch: 72, train_loss: 0.1799, test_loss: 2.0137, test_f1: 0.6489
 epoch: 73, train_loss: 0.1742, test_loss: 1.6797, test_f1: 0.6644
 epoch: 74, train_loss: 0.1669, test_loss: 1.7047, test_f1: 0.6424
 epoch: 75, train_loss: 0.1585, test_loss: 1.6877, test_f1: 0.6408
 epoch: 76, train_loss: 0.1629, test_loss: 1.8037, test_f1: 0.6426
 epoch: 77, train_loss: 0.1524, test_loss: 1.7377, test_f1: 0.6561
 epoch: 78, train_loss: 0.1468, test_loss: 1.7740, test_f1: 0.6488
 epoch: 79, train_loss: 0.1651, test_loss: 1.8142, test_f1: 0.6451
 epoch: 80, train_loss: 0.1608, test_loss: 1.7716, test_f1: 0.6498
 epoch: 81, train_loss: 0.1659, test_loss: 1.7406, test_f1: 0.6454
 epoch: 82, train_loss: 0.1574, test_loss: 1.7834, test_f1: 0.6652
 epoch: 83, train_loss: 0.1549, test_loss: 1.6282, test_f1: 0.6616
 epoch: 84, train_loss: 0.1356, test_loss: 1.7873, test_f1: 0.6285
 epoch: 85, train_loss: 0.1477, test_loss: 1.9404, test_f1: 0.6693
 epoch: 86, train_loss: 0.1448, test_loss: 2.0711, test_f1: 0.6124
 epoch: 87, train_loss: 0.1420, test_loss: 1.8708, test_f1: 0.6221
 epoch: 88, train_loss: 0.1379, test_loss: 1.8310, test_f1: 0.6453
 epoch: 89, train_loss: 0.1332, test_loss: 1.9957, test_f1: 0.6337
 epoch: 90, train_loss: 0.1347, test_loss: 1.8789, test_f1: 0.6318
 epoch: 91, train_loss: 0.1316, test_loss: 1.9245, test_f1: 0.6528
 epoch: 92, train_loss: 0.1280, test_loss: 2.0085, test_f1: 0.6311
 epoch: 93, train_loss: 0.1248, test_loss: 1.9519, test_f1: 0.6448
 epoch: 94, train_loss: 0.1374, test_loss: 2.1498, test_f1: 0.6381
 epoch: 95, train_loss: 0.1354, test_loss: 2.1133, test_f1: 0.6230
 epoch: 96, train_loss: 0.1342, test_loss: 1.9170, test_f1: 0.6382
 epoch: 97, train_loss: 0.1280, test_loss: 1.9273, test_f1: 0.6784
 epoch: 98, train_loss: 0.1167, test_loss: 2.3314, test_f1: 0.6345
 epoch: 99, train_loss: 0.1399, test_loss: 2.1715, test_f1: 0.6536
##################ITERATION #9 ****************************************
 epoch: 0, train_loss: 1.5701, test_loss: 1.2679, test_f1: 0.2641
 epoch: 1, train_loss: 0.9862, test_loss: 1.0796, test_f1: 0.4847
 epoch: 2, train_loss: 0.9239, test_loss: 0.9607, test_f1: 0.5520
 epoch: 3, train_loss: 0.8878, test_loss: 1.0061, test_f1: 0.5548
 epoch: 4, train_loss: 0.8660, test_loss: 0.9243, test_f1: 0.5912
 epoch: 5, train_loss: 0.8178, test_loss: 0.9257, test_f1: 0.5866
 epoch: 6, train_loss: 0.8017, test_loss: 0.9259, test_f1: 0.5630
 epoch: 7, train_loss: 0.7958, test_loss: 1.0060, test_f1: 0.5455
 epoch: 8, train_loss: 0.7659, test_loss: 1.0129, test_f1: 0.6039
 epoch: 9, train_loss: 0.7646, test_loss: 0.9589, test_f1: 0.5758
 epoch: 10, train_loss: 0.7464, test_loss: 0.9145, test_f1: 0.6208
 epoch: 11, train_loss: 0.7165, test_loss: 0.8403, test_f1: 0.6349
 epoch: 12, train_loss: 0.7051, test_loss: 1.1367, test_f1: 0.5766
 epoch: 13, train_loss: 0.6837, test_loss: 0.8233, test_f1: 0.6115
 epoch: 14, train_loss: 0.6769, test_loss: 0.9317, test_f1: 0.5799
 epoch: 15, train_loss: 0.6801, test_loss: 0.8977, test_f1: 0.5998
 epoch: 16, train_loss: 0.6593, test_loss: 0.9406, test_f1: 0.6483
 epoch: 17, train_loss: 0.6472, test_loss: 0.9375, test_f1: 0.6343
 epoch: 18, train_loss: 0.6200, test_loss: 0.9400, test_f1: 0.5969
 epoch: 19, train_loss: 0.6081, test_loss: 1.1587, test_f1: 0.5311
 epoch: 20, train_loss: 0.5906, test_loss: 1.0000, test_f1: 0.5851
 epoch: 21, train_loss: 0.5996, test_loss: 0.9312, test_f1: 0.5944
 epoch: 22, train_loss: 0.5812, test_loss: 0.9846, test_f1: 0.5898
 epoch: 23, train_loss: 0.5737, test_loss: 0.8715, test_f1: 0.5949
 epoch: 24, train_loss: 0.5667, test_loss: 0.9026, test_f1: 0.6381
 epoch: 25, train_loss: 0.5543, test_loss: 0.8874, test_f1: 0.6486
 epoch: 26, train_loss: 0.5405, test_loss: 0.9335, test_f1: 0.6357
 epoch: 27, train_loss: 0.5166, test_loss: 0.8299, test_f1: 0.6631
 epoch: 28, train_loss: 0.5086, test_loss: 0.8485, test_f1: 0.6729
 epoch: 29, train_loss: 0.5267, test_loss: 1.0251, test_f1: 0.6244
 epoch: 30, train_loss: 0.5135, test_loss: 0.8272, test_f1: 0.6598
 epoch: 31, train_loss: 0.5020, test_loss: 1.1654, test_f1: 0.5811
 epoch: 32, train_loss: 0.4995, test_loss: 0.9686, test_f1: 0.6204
 epoch: 33, train_loss: 0.4612, test_loss: 0.9986, test_f1: 0.6048
 epoch: 34, train_loss: 0.4669, test_loss: 1.1728, test_f1: 0.5909
 epoch: 35, train_loss: 0.4458, test_loss: 0.8669, test_f1: 0.6940
 epoch: 36, train_loss: 0.4604, test_loss: 1.0396, test_f1: 0.6299
 epoch: 37, train_loss: 0.4646, test_loss: 0.9206, test_f1: 0.6348
 epoch: 38, train_loss: 0.4562, test_loss: 1.1973, test_f1: 0.6260
 epoch: 39, train_loss: 0.4215, test_loss: 1.0445, test_f1: 0.6515
 epoch: 40, train_loss: 0.4248, test_loss: 1.1004, test_f1: 0.6219
 epoch: 41, train_loss: 0.4194, test_loss: 1.0571, test_f1: 0.6436
 epoch: 42, train_loss: 0.4182, test_loss: 0.9481, test_f1: 0.6818
 epoch: 43, train_loss: 0.4044, test_loss: 1.0691, test_f1: 0.6273
 epoch: 44, train_loss: 0.3833, test_loss: 1.0352, test_f1: 0.6526
 epoch: 45, train_loss: 0.3793, test_loss: 1.0377, test_f1: 0.6109
 epoch: 46, train_loss: 0.3674, test_loss: 1.1297, test_f1: 0.6346
 epoch: 47, train_loss: 0.3643, test_loss: 1.2418, test_f1: 0.5808
 epoch: 48, train_loss: 0.3808, test_loss: 1.2275, test_f1: 0.6556
 epoch: 49, train_loss: 0.3665, test_loss: 1.0548, test_f1: 0.6399
 epoch: 50, train_loss: 0.3682, test_loss: 1.1525, test_f1: 0.6626
 epoch: 51, train_loss: 0.3231, test_loss: 1.1498, test_f1: 0.6637
 epoch: 52, train_loss: 0.2902, test_loss: 1.2190, test_f1: 0.6494
 epoch: 53, train_loss: 0.2739, test_loss: 1.1011, test_f1: 0.6727
 epoch: 54, train_loss: 0.2591, test_loss: 1.2543, test_f1: 0.6335
 epoch: 55, train_loss: 0.2679, test_loss: 1.1409, test_f1: 0.6643
 epoch: 56, train_loss: 0.2514, test_loss: 1.2813, test_f1: 0.6866
 epoch: 57, train_loss: 0.2539, test_loss: 1.2587, test_f1: 0.6665
 epoch: 58, train_loss: 0.2640, test_loss: 1.2665, test_f1: 0.6646
 epoch: 59, train_loss: 0.2491, test_loss: 1.2132, test_f1: 0.6676
 epoch: 60, train_loss: 0.2470, test_loss: 1.2818, test_f1: 0.6606
 epoch: 61, train_loss: 0.2316, test_loss: 1.2400, test_f1: 0.6772
 epoch: 62, train_loss: 0.2466, test_loss: 1.4896, test_f1: 0.6378
 epoch: 63, train_loss: 0.2287, test_loss: 1.2488, test_f1: 0.6399
 epoch: 64, train_loss: 0.2487, test_loss: 1.2116, test_f1: 0.6761
 epoch: 65, train_loss: 0.2332, test_loss: 1.3297, test_f1: 0.6674
 epoch: 66, train_loss: 0.2275, test_loss: 1.2707, test_f1: 0.6671
 epoch: 67, train_loss: 0.2119, test_loss: 1.2902, test_f1: 0.6958
 epoch: 68, train_loss: 0.2195, test_loss: 1.3057, test_f1: 0.6625
 epoch: 69, train_loss: 0.2140, test_loss: 1.3066, test_f1: 0.6555
 epoch: 70, train_loss: 0.2061, test_loss: 1.3500, test_f1: 0.6636
 epoch: 71, train_loss: 0.2058, test_loss: 1.3417, test_f1: 0.6587
 epoch: 72, train_loss: 0.2104, test_loss: 1.5271, test_f1: 0.6413
 epoch: 73, train_loss: 0.2344, test_loss: 1.4132, test_f1: 0.6546
 epoch: 74, train_loss: 0.2008, test_loss: 1.3084, test_f1: 0.6872
 epoch: 75, train_loss: 0.2034, test_loss: 1.4157, test_f1: 0.6476
 epoch: 76, train_loss: 0.2087, test_loss: 1.6486, test_f1: 0.6433
 epoch: 77, train_loss: 0.1951, test_loss: 1.4125, test_f1: 0.6627
 epoch: 78, train_loss: 0.2085, test_loss: 1.4964, test_f1: 0.6253
 epoch: 79, train_loss: 0.1896, test_loss: 1.4648, test_f1: 0.6705
 epoch: 80, train_loss: 0.1875, test_loss: 1.4393, test_f1: 0.6460
 epoch: 81, train_loss: 0.1874, test_loss: 1.4157, test_f1: 0.6664
 epoch: 82, train_loss: 0.1730, test_loss: 1.5972, test_f1: 0.6537
 epoch: 83, train_loss: 0.1706, test_loss: 1.4588, test_f1: 0.6913
 epoch: 84, train_loss: 0.1876, test_loss: 1.5254, test_f1: 0.6672
 epoch: 85, train_loss: 0.1787, test_loss: 1.5071, test_f1: 0.6586
 epoch: 86, train_loss: 0.1766, test_loss: 1.5340, test_f1: 0.6458
 epoch: 87, train_loss: 0.1846, test_loss: 1.4000, test_f1: 0.6756
 epoch: 88, train_loss: 0.1796, test_loss: 1.3667, test_f1: 0.6553
 epoch: 89, train_loss: 0.1728, test_loss: 1.5433, test_f1: 0.6469
 epoch: 90, train_loss: 0.1657, test_loss: 1.5145, test_f1: 0.6693
 epoch: 91, train_loss: 0.1784, test_loss: 1.5952, test_f1: 0.6893
 epoch: 92, train_loss: 0.1674, test_loss: 1.6356, test_f1: 0.6258
 epoch: 93, train_loss: 0.1693, test_loss: 1.5692, test_f1: 0.6484
 epoch: 94, train_loss: 0.1645, test_loss: 1.7169, test_f1: 0.6444
 epoch: 95, train_loss: 0.1641, test_loss: 1.6103, test_f1: 0.6591
 epoch: 96, train_loss: 0.1629, test_loss: 1.5306, test_f1: 0.6710
 epoch: 97, train_loss: 0.1767, test_loss: 1.6581, test_f1: 0.6463
 epoch: 98, train_loss: 0.1582, test_loss: 1.6452, test_f1: 0.6532
 epoch: 99, train_loss: 0.1474, test_loss: 1.6173, test_f1: 0.6517

Training completed in 504.87 seconds
Best F1: 0.7082 at epoch 56
Mean F1 across iterations: 0.6933  0.0075
========================FINAL RESULTS================================
FEGIN weighted F1: 0.7082  0.0075
python main.py --data ltspice_examples --representation component_pin --model FEGIN --layers 3 --hiddens 128 --batch_size 128 --lr 0.001 --emb_size 250 --epochs 100 --save_appendix component_pin_L3_H128_BS128_LR0.001_E250 --no_val
-----



STDERR:
  File "main.py", line 370, in <module>
    main()
  File "main.py", line 254, in main
    dataset = dataset_class(
  File "/home/philip/projects/ltspice_examples_code_repo/Circuit-Completion-Using-GNNs/component_classification_with_link_prediction_head/evaluation/FEGIN/kernel/circuit_datasets.py", line 15, in __init__
    self.data, self.slices = torch.load(self.processed_paths[0])
  File "/home/philip/.local/lib/python3.8/site-packages/torch/serialization.py", line 1040, in load
    warnings.warn(
  File "/usr/lib/python3.8/warnings.py", line 109, in _showwarnmsg
    sw(msg.message, msg.category, msg.filename, msg.lineno,
  File "main.py", line 47, in warn_with_traceback
    traceback.print_stack(file=log)
/home/philip/projects/ltspice_examples_code_repo/Circuit-Completion-Using-GNNs/component_classification_with_link_prediction_head/evaluation/FEGIN/kernel/circuit_datasets.py:15: FutureWarning: You are using `torch.load` with `weights_only=False` (the current default value), which uses the default pickle module implicitly. It is possible to construct malicious pickle data which will execute arbitrary code during unpickling (See https://github.com/pytorch/pytorch/blob/main/SECURITY.md#untrusted-models for more details). In a future release, the default value for `weights_only` will be flipped to `True`. This limits the functions that could be executed during unpickling. Arbitrary objects will no longer be allowed to be loaded via this mode unless they are explicitly allowlisted by the user via `torch.serialization.add_safe_globals`. We recommend you start setting `weights_only=True` for any use case where you don't have full control of the loaded file. Please open an issue on GitHub for any issues related to this experimental feature.
  self.data, self.slices = torch.load(self.processed_paths[0])
