STDOUT:
Results will be saved in /home/philip/projects/ltspice_examples_code_repo/Circuit-Completion-Using-GNNs/component_classification_with_link_prediction_head/evaluation/FEGIN/results/model_FEGIN_dataset_ltspice_demos
Command line input: python main.py --data ltspice_demos --representation component_component --model FEGIN --layers 2 --hiddens 64 --batch_size 32 --lr 0.0001 --emb_size 128 --epochs 100 --save_appendix component_component_L2_H64_BS32_LR0.0001_E128 --no_val
 is saved.
-----
ltspice_demos - FEGIN
Using 2 layers, 64 hidden units, h = 2
Loading component_component representation dataset
ENTERED
Training FEGIN on component_component representation
Train: 1565, Test: 383
##################ITERATION #0 ****************************************
 epoch: 0, train_loss: 1.3972, test_loss: 1.3833, test_f1: 0.1533
 epoch: 1, train_loss: 1.3734, test_loss: 1.3657, test_f1: 0.2281
 epoch: 2, train_loss: 1.3497, test_loss: 1.3453, test_f1: 0.2281
 epoch: 3, train_loss: 1.3192, test_loss: 1.3228, test_f1: 0.2697
 epoch: 4, train_loss: 1.2834, test_loss: 1.3036, test_f1: 0.2602
 epoch: 5, train_loss: 1.2514, test_loss: 1.2882, test_f1: 0.2600
 epoch: 6, train_loss: 1.2194, test_loss: 1.2796, test_f1: 0.2587
 epoch: 7, train_loss: 1.1994, test_loss: 1.2666, test_f1: 0.2600
 epoch: 8, train_loss: 1.1820, test_loss: 1.2612, test_f1: 0.2628
 epoch: 9, train_loss: 1.1766, test_loss: 1.2587, test_f1: 0.2582
 epoch: 10, train_loss: 1.1654, test_loss: 1.2531, test_f1: 0.2858
 epoch: 11, train_loss: 1.1541, test_loss: 1.2451, test_f1: 0.3805
 epoch: 12, train_loss: 1.1385, test_loss: 1.2441, test_f1: 0.4118
 epoch: 13, train_loss: 1.1324, test_loss: 1.2400, test_f1: 0.3982
 epoch: 14, train_loss: 1.1287, test_loss: 1.2282, test_f1: 0.3927
 epoch: 15, train_loss: 1.1089, test_loss: 1.2195, test_f1: 0.3944
 epoch: 16, train_loss: 1.1010, test_loss: 1.2191, test_f1: 0.3890
 epoch: 17, train_loss: 1.0866, test_loss: 1.2090, test_f1: 0.3852
 epoch: 18, train_loss: 1.0788, test_loss: 1.2012, test_f1: 0.4215
 epoch: 19, train_loss: 1.0669, test_loss: 1.2045, test_f1: 0.4215
 epoch: 20, train_loss: 1.0607, test_loss: 1.1864, test_f1: 0.3984
 epoch: 21, train_loss: 1.0535, test_loss: 1.1827, test_f1: 0.3948
 epoch: 22, train_loss: 1.0365, test_loss: 1.1852, test_f1: 0.4102
 epoch: 23, train_loss: 1.0319, test_loss: 1.1845, test_f1: 0.4006
 epoch: 24, train_loss: 1.0233, test_loss: 1.1821, test_f1: 0.4361
 epoch: 25, train_loss: 1.0166, test_loss: 1.1839, test_f1: 0.4318
 epoch: 26, train_loss: 1.0085, test_loss: 1.1754, test_f1: 0.4279
 epoch: 27, train_loss: 1.0014, test_loss: 1.2006, test_f1: 0.4343
 epoch: 28, train_loss: 0.9916, test_loss: 1.1896, test_f1: 0.4580
 epoch: 29, train_loss: 0.9913, test_loss: 1.1924, test_f1: 0.4449
 epoch: 30, train_loss: 0.9832, test_loss: 1.1953, test_f1: 0.4535
 epoch: 31, train_loss: 0.9780, test_loss: 1.2025, test_f1: 0.4774
 epoch: 32, train_loss: 0.9708, test_loss: 1.1753, test_f1: 0.4403
 epoch: 33, train_loss: 0.9724, test_loss: 1.1804, test_f1: 0.4762
 epoch: 34, train_loss: 0.9562, test_loss: 1.2108, test_f1: 0.4712
 epoch: 35, train_loss: 0.9519, test_loss: 1.1939, test_f1: 0.4764
 epoch: 36, train_loss: 0.9302, test_loss: 1.2117, test_f1: 0.4682
 epoch: 37, train_loss: 0.9386, test_loss: 1.2010, test_f1: 0.5097
 epoch: 38, train_loss: 0.9440, test_loss: 1.1883, test_f1: 0.4859
 epoch: 39, train_loss: 0.9359, test_loss: 1.1981, test_f1: 0.5188
 epoch: 40, train_loss: 0.9104, test_loss: 1.2157, test_f1: 0.5055
 epoch: 41, train_loss: 0.9138, test_loss: 1.2313, test_f1: 0.4890
 epoch: 42, train_loss: 0.9322, test_loss: 1.2265, test_f1: 0.5254
 epoch: 43, train_loss: 0.9259, test_loss: 1.2080, test_f1: 0.5174
 epoch: 44, train_loss: 0.9099, test_loss: 1.2151, test_f1: 0.4997
 epoch: 45, train_loss: 0.9063, test_loss: 1.2267, test_f1: 0.5244
 epoch: 46, train_loss: 0.8964, test_loss: 1.2418, test_f1: 0.5062
 epoch: 47, train_loss: 0.8930, test_loss: 1.2963, test_f1: 0.5226
 epoch: 48, train_loss: 0.8854, test_loss: 1.2677, test_f1: 0.4915
 epoch: 49, train_loss: 0.8855, test_loss: 1.2535, test_f1: 0.5195
 epoch: 50, train_loss: 0.8768, test_loss: 1.2562, test_f1: 0.4979
 epoch: 51, train_loss: 0.8710, test_loss: 1.3025, test_f1: 0.5108
 epoch: 52, train_loss: 0.8623, test_loss: 1.2875, test_f1: 0.4890
 epoch: 53, train_loss: 0.8610, test_loss: 1.3035, test_f1: 0.4999
 epoch: 54, train_loss: 0.8585, test_loss: 1.2705, test_f1: 0.4997
 epoch: 55, train_loss: 0.8482, test_loss: 1.3048, test_f1: 0.4947
 epoch: 56, train_loss: 0.8721, test_loss: 1.2963, test_f1: 0.4909
 epoch: 57, train_loss: 0.8363, test_loss: 1.3088, test_f1: 0.4832
 epoch: 58, train_loss: 0.8455, test_loss: 1.3172, test_f1: 0.4903
 epoch: 59, train_loss: 0.8475, test_loss: 1.2813, test_f1: 0.5050
 epoch: 60, train_loss: 0.8405, test_loss: 1.3082, test_f1: 0.4964
 epoch: 61, train_loss: 0.8436, test_loss: 1.3237, test_f1: 0.5075
 epoch: 62, train_loss: 0.8288, test_loss: 1.3387, test_f1: 0.5005
 epoch: 63, train_loss: 0.8322, test_loss: 1.3507, test_f1: 0.5157
 epoch: 64, train_loss: 0.8276, test_loss: 1.3122, test_f1: 0.5050
 epoch: 65, train_loss: 0.8339, test_loss: 1.3608, test_f1: 0.5059
 epoch: 66, train_loss: 0.8261, test_loss: 1.3560, test_f1: 0.5341
 epoch: 67, train_loss: 0.8279, test_loss: 1.3191, test_f1: 0.5037
 epoch: 68, train_loss: 0.8238, test_loss: 1.3771, test_f1: 0.5031
 epoch: 69, train_loss: 0.8319, test_loss: 1.3454, test_f1: 0.5258
 epoch: 70, train_loss: 0.8232, test_loss: 1.3618, test_f1: 0.5141
 epoch: 71, train_loss: 0.8139, test_loss: 1.3489, test_f1: 0.5015
 epoch: 72, train_loss: 0.8065, test_loss: 1.3877, test_f1: 0.5092
 epoch: 73, train_loss: 0.8173, test_loss: 1.3901, test_f1: 0.5066
 epoch: 74, train_loss: 0.8198, test_loss: 1.3984, test_f1: 0.5070
 epoch: 75, train_loss: 0.8210, test_loss: 1.3926, test_f1: 0.5282
 epoch: 76, train_loss: 0.8156, test_loss: 1.3794, test_f1: 0.5086
 epoch: 77, train_loss: 0.8070, test_loss: 1.3870, test_f1: 0.5228
 epoch: 78, train_loss: 0.8126, test_loss: 1.4081, test_f1: 0.5145
 epoch: 79, train_loss: 0.7978, test_loss: 1.3845, test_f1: 0.5095
 epoch: 80, train_loss: 0.8147, test_loss: 1.4087, test_f1: 0.5125
 epoch: 81, train_loss: 0.8111, test_loss: 1.3717, test_f1: 0.5068
 epoch: 82, train_loss: 0.7898, test_loss: 1.3776, test_f1: 0.5118
 epoch: 83, train_loss: 0.7911, test_loss: 1.3740, test_f1: 0.4997
 epoch: 84, train_loss: 0.7948, test_loss: 1.4951, test_f1: 0.5136
 epoch: 85, train_loss: 0.7939, test_loss: 1.5136, test_f1: 0.5172
 epoch: 86, train_loss: 0.7950, test_loss: 1.4818, test_f1: 0.5018
 epoch: 87, train_loss: 0.7928, test_loss: 1.5408, test_f1: 0.5123
 epoch: 88, train_loss: 0.7872, test_loss: 1.4733, test_f1: 0.5143
 epoch: 89, train_loss: 0.7806, test_loss: 1.4624, test_f1: 0.5421
 epoch: 90, train_loss: 0.7738, test_loss: 1.4949, test_f1: 0.5452
 epoch: 91, train_loss: 0.7879, test_loss: 1.5565, test_f1: 0.5174
 epoch: 92, train_loss: 0.7845, test_loss: 1.5686, test_f1: 0.5526
 epoch: 93, train_loss: 0.7803, test_loss: 1.5710, test_f1: 0.5447
 epoch: 94, train_loss: 0.7835, test_loss: 1.5584, test_f1: 0.5416
 epoch: 95, train_loss: 0.7843, test_loss: 1.5627, test_f1: 0.5448
 epoch: 96, train_loss: 0.7713, test_loss: 1.5073, test_f1: 0.5341
 epoch: 97, train_loss: 0.7728, test_loss: 1.4993, test_f1: 0.5372
 epoch: 98, train_loss: 0.7687, test_loss: 1.5502, test_f1: 0.5634
 epoch: 99, train_loss: 0.7687, test_loss: 1.5989, test_f1: 0.5522
##################ITERATION #1 ****************************************
 epoch: 0, train_loss: 1.3576, test_loss: 1.3484, test_f1: 0.2405
 epoch: 1, train_loss: 1.2789, test_loss: 1.3199, test_f1: 0.2281
 epoch: 2, train_loss: 1.2480, test_loss: 1.3086, test_f1: 0.2281
 epoch: 3, train_loss: 1.2202, test_loss: 1.2889, test_f1: 0.2281
 epoch: 4, train_loss: 1.2030, test_loss: 1.2830, test_f1: 0.2508
 epoch: 5, train_loss: 1.1878, test_loss: 1.2708, test_f1: 0.3132
 epoch: 6, train_loss: 1.1673, test_loss: 1.2555, test_f1: 0.3132
 epoch: 7, train_loss: 1.1517, test_loss: 1.2421, test_f1: 0.3636
 epoch: 8, train_loss: 1.1377, test_loss: 1.2248, test_f1: 0.3724
 epoch: 9, train_loss: 1.1207, test_loss: 1.2115, test_f1: 0.4193
 epoch: 10, train_loss: 1.1111, test_loss: 1.2063, test_f1: 0.4442
 epoch: 11, train_loss: 1.0919, test_loss: 1.1931, test_f1: 0.4603
 epoch: 12, train_loss: 1.0777, test_loss: 1.1869, test_f1: 0.4765
 epoch: 13, train_loss: 1.0622, test_loss: 1.1759, test_f1: 0.4772
 epoch: 14, train_loss: 1.0562, test_loss: 1.1689, test_f1: 0.4711
 epoch: 15, train_loss: 1.0297, test_loss: 1.1678, test_f1: 0.4950
 epoch: 16, train_loss: 1.0272, test_loss: 1.1736, test_f1: 0.5098
 epoch: 17, train_loss: 1.0206, test_loss: 1.1602, test_f1: 0.5149
 epoch: 18, train_loss: 1.0110, test_loss: 1.1652, test_f1: 0.5119
 epoch: 19, train_loss: 1.0062, test_loss: 1.1597, test_f1: 0.5473
 epoch: 20, train_loss: 0.9886, test_loss: 1.1501, test_f1: 0.5378
 epoch: 21, train_loss: 0.9814, test_loss: 1.1644, test_f1: 0.5317
 epoch: 22, train_loss: 0.9639, test_loss: 1.1504, test_f1: 0.5307
 epoch: 23, train_loss: 0.9541, test_loss: 1.1448, test_f1: 0.5340
 epoch: 24, train_loss: 0.9556, test_loss: 1.1488, test_f1: 0.5430
 epoch: 25, train_loss: 0.9490, test_loss: 1.1387, test_f1: 0.5605
 epoch: 26, train_loss: 0.9465, test_loss: 1.1321, test_f1: 0.5697
 epoch: 27, train_loss: 0.9383, test_loss: 1.1575, test_f1: 0.5069
 epoch: 28, train_loss: 0.9294, test_loss: 1.1419, test_f1: 0.5263
 epoch: 29, train_loss: 0.9321, test_loss: 1.1259, test_f1: 0.5310
 epoch: 30, train_loss: 0.9154, test_loss: 1.1309, test_f1: 0.5458
 epoch: 31, train_loss: 0.9039, test_loss: 1.1263, test_f1: 0.5457
 epoch: 32, train_loss: 0.9012, test_loss: 1.1302, test_f1: 0.5426
 epoch: 33, train_loss: 0.8963, test_loss: 1.1359, test_f1: 0.5643
 epoch: 34, train_loss: 0.8833, test_loss: 1.1118, test_f1: 0.5668
 epoch: 35, train_loss: 0.8853, test_loss: 1.1129, test_f1: 0.5259
 epoch: 36, train_loss: 0.8821, test_loss: 1.1135, test_f1: 0.5515
 epoch: 37, train_loss: 0.8741, test_loss: 1.1053, test_f1: 0.5743
 epoch: 38, train_loss: 0.8719, test_loss: 1.1206, test_f1: 0.5647
 epoch: 39, train_loss: 0.8624, test_loss: 1.1200, test_f1: 0.5737
 epoch: 40, train_loss: 0.8603, test_loss: 1.1335, test_f1: 0.5521
 epoch: 41, train_loss: 0.8416, test_loss: 1.1588, test_f1: 0.5705
 epoch: 42, train_loss: 0.8403, test_loss: 1.1411, test_f1: 0.5619
 epoch: 43, train_loss: 0.8429, test_loss: 1.1510, test_f1: 0.5793
 epoch: 44, train_loss: 0.8382, test_loss: 1.1307, test_f1: 0.5779
 epoch: 45, train_loss: 0.8362, test_loss: 1.1516, test_f1: 0.5773
 epoch: 46, train_loss: 0.8164, test_loss: 1.1573, test_f1: 0.5611
 epoch: 47, train_loss: 0.8314, test_loss: 1.1327, test_f1: 0.5673
 epoch: 48, train_loss: 0.8361, test_loss: 1.1439, test_f1: 0.5784
 epoch: 49, train_loss: 0.8029, test_loss: 1.1548, test_f1: 0.5760
 epoch: 50, train_loss: 0.8107, test_loss: 1.1532, test_f1: 0.5684
 epoch: 51, train_loss: 0.8013, test_loss: 1.1668, test_f1: 0.5872
 epoch: 52, train_loss: 0.7861, test_loss: 1.1722, test_f1: 0.5815
 epoch: 53, train_loss: 0.8001, test_loss: 1.1676, test_f1: 0.5845
 epoch: 54, train_loss: 0.7918, test_loss: 1.1630, test_f1: 0.5892
 epoch: 55, train_loss: 0.7960, test_loss: 1.1730, test_f1: 0.5767
 epoch: 56, train_loss: 0.7920, test_loss: 1.1674, test_f1: 0.5867
 epoch: 57, train_loss: 0.7741, test_loss: 1.1712, test_f1: 0.5848
 epoch: 58, train_loss: 0.7945, test_loss: 1.1751, test_f1: 0.5763
 epoch: 59, train_loss: 0.7909, test_loss: 1.1902, test_f1: 0.5893
 epoch: 60, train_loss: 0.7777, test_loss: 1.1783, test_f1: 0.5818
 epoch: 61, train_loss: 0.7838, test_loss: 1.1777, test_f1: 0.5766
 epoch: 62, train_loss: 0.7755, test_loss: 1.1801, test_f1: 0.5683
 epoch: 63, train_loss: 0.7707, test_loss: 1.1902, test_f1: 0.5740
 epoch: 64, train_loss: 0.7569, test_loss: 1.1953, test_f1: 0.5898
 epoch: 65, train_loss: 0.7733, test_loss: 1.2155, test_f1: 0.5761
 epoch: 66, train_loss: 0.7664, test_loss: 1.1933, test_f1: 0.5787
 epoch: 67, train_loss: 0.7578, test_loss: 1.2151, test_f1: 0.5739
 epoch: 68, train_loss: 0.7796, test_loss: 1.2263, test_f1: 0.5799
 epoch: 69, train_loss: 0.7671, test_loss: 1.2079, test_f1: 0.5736
 epoch: 70, train_loss: 0.7663, test_loss: 1.2049, test_f1: 0.5680
 epoch: 71, train_loss: 0.7622, test_loss: 1.2308, test_f1: 0.5716
 epoch: 72, train_loss: 0.7459, test_loss: 1.1975, test_f1: 0.5765
 epoch: 73, train_loss: 0.7697, test_loss: 1.2010, test_f1: 0.5756
 epoch: 74, train_loss: 0.7481, test_loss: 1.1919, test_f1: 0.5608
 epoch: 75, train_loss: 0.7460, test_loss: 1.1971, test_f1: 0.5816
 epoch: 76, train_loss: 0.7436, test_loss: 1.2116, test_f1: 0.5683
 epoch: 77, train_loss: 0.7532, test_loss: 1.2203, test_f1: 0.5837
 epoch: 78, train_loss: 0.7460, test_loss: 1.2235, test_f1: 0.5735
 epoch: 79, train_loss: 0.7428, test_loss: 1.2321, test_f1: 0.5657
 epoch: 80, train_loss: 0.7341, test_loss: 1.2371, test_f1: 0.5709
 epoch: 81, train_loss: 0.7442, test_loss: 1.2374, test_f1: 0.5578
 epoch: 82, train_loss: 0.7352, test_loss: 1.2469, test_f1: 0.5608
 epoch: 83, train_loss: 0.7420, test_loss: 1.2687, test_f1: 0.5578
 epoch: 84, train_loss: 0.7310, test_loss: 1.2544, test_f1: 0.5631
 epoch: 85, train_loss: 0.7426, test_loss: 1.2673, test_f1: 0.5608
 epoch: 86, train_loss: 0.7391, test_loss: 1.2577, test_f1: 0.5604
 epoch: 87, train_loss: 0.7354, test_loss: 1.2474, test_f1: 0.5683
 epoch: 88, train_loss: 0.7424, test_loss: 1.2729, test_f1: 0.5629
 epoch: 89, train_loss: 0.7278, test_loss: 1.2706, test_f1: 0.5530
 epoch: 90, train_loss: 0.7349, test_loss: 1.2555, test_f1: 0.5526
 epoch: 91, train_loss: 0.7318, test_loss: 1.2596, test_f1: 0.5653
 epoch: 92, train_loss: 0.7253, test_loss: 1.2683, test_f1: 0.5578
 epoch: 93, train_loss: 0.7117, test_loss: 1.2824, test_f1: 0.5447
 epoch: 94, train_loss: 0.7198, test_loss: 1.2712, test_f1: 0.5525
 epoch: 95, train_loss: 0.7283, test_loss: 1.2962, test_f1: 0.5479
 epoch: 96, train_loss: 0.7132, test_loss: 1.2922, test_f1: 0.5630
 epoch: 97, train_loss: 0.7176, test_loss: 1.3076, test_f1: 0.5684
 epoch: 98, train_loss: 0.7042, test_loss: 1.2935, test_f1: 0.5501
 epoch: 99, train_loss: 0.7266, test_loss: 1.2681, test_f1: 0.5653
##################ITERATION #2 ****************************************
 epoch: 0, train_loss: 1.2993, test_loss: 1.3244, test_f1: 0.2639
 epoch: 1, train_loss: 1.2331, test_loss: 1.2957, test_f1: 0.2766
 epoch: 2, train_loss: 1.2112, test_loss: 1.2824, test_f1: 0.2496
 epoch: 3, train_loss: 1.1952, test_loss: 1.2863, test_f1: 0.2853
 epoch: 4, train_loss: 1.1722, test_loss: 1.2722, test_f1: 0.2996
 epoch: 5, train_loss: 1.1610, test_loss: 1.2544, test_f1: 0.3024
 epoch: 6, train_loss: 1.1570, test_loss: 1.2428, test_f1: 0.3310
 epoch: 7, train_loss: 1.1301, test_loss: 1.2390, test_f1: 0.3778
 epoch: 8, train_loss: 1.1142, test_loss: 1.2276, test_f1: 0.4064
 epoch: 9, train_loss: 1.1053, test_loss: 1.2101, test_f1: 0.4037
 epoch: 10, train_loss: 1.0906, test_loss: 1.2052, test_f1: 0.4280
 epoch: 11, train_loss: 1.0833, test_loss: 1.1890, test_f1: 0.4509
 epoch: 12, train_loss: 1.0754, test_loss: 1.1793, test_f1: 0.4774
 epoch: 13, train_loss: 1.0528, test_loss: 1.1801, test_f1: 0.4766
 epoch: 14, train_loss: 1.0516, test_loss: 1.1760, test_f1: 0.4682
 epoch: 15, train_loss: 1.0372, test_loss: 1.1714, test_f1: 0.4862
 epoch: 16, train_loss: 1.0339, test_loss: 1.1594, test_f1: 0.4997
 epoch: 17, train_loss: 1.0126, test_loss: 1.1574, test_f1: 0.5155
 epoch: 18, train_loss: 1.0071, test_loss: 1.1639, test_f1: 0.5025
 epoch: 19, train_loss: 0.9989, test_loss: 1.1585, test_f1: 0.4937
 epoch: 20, train_loss: 0.9836, test_loss: 1.1564, test_f1: 0.5074
 epoch: 21, train_loss: 0.9916, test_loss: 1.1465, test_f1: 0.5125
 epoch: 22, train_loss: 0.9899, test_loss: 1.1528, test_f1: 0.5160
 epoch: 23, train_loss: 0.9657, test_loss: 1.1389, test_f1: 0.5408
 epoch: 24, train_loss: 0.9594, test_loss: 1.1481, test_f1: 0.5253
 epoch: 25, train_loss: 0.9561, test_loss: 1.1518, test_f1: 0.5141
 epoch: 26, train_loss: 0.9524, test_loss: 1.1529, test_f1: 0.5148
 epoch: 27, train_loss: 0.9527, test_loss: 1.1541, test_f1: 0.5159
 epoch: 28, train_loss: 0.9430, test_loss: 1.1604, test_f1: 0.4988
 epoch: 29, train_loss: 0.9266, test_loss: 1.1293, test_f1: 0.5276
 epoch: 30, train_loss: 0.9175, test_loss: 1.1516, test_f1: 0.5309
 epoch: 31, train_loss: 0.9269, test_loss: 1.1531, test_f1: 0.5194
 epoch: 32, train_loss: 0.9180, test_loss: 1.1823, test_f1: 0.5188
 epoch: 33, train_loss: 0.9143, test_loss: 1.1767, test_f1: 0.5090
 epoch: 34, train_loss: 0.8922, test_loss: 1.2074, test_f1: 0.5122
 epoch: 35, train_loss: 0.9026, test_loss: 1.1941, test_f1: 0.5164
 epoch: 36, train_loss: 0.8701, test_loss: 1.1936, test_f1: 0.5248
 epoch: 37, train_loss: 0.8891, test_loss: 1.2068, test_f1: 0.5265
 epoch: 38, train_loss: 0.8779, test_loss: 1.2641, test_f1: 0.5062
 epoch: 39, train_loss: 0.8771, test_loss: 1.2619, test_f1: 0.5055
 epoch: 40, train_loss: 0.8698, test_loss: 1.2332, test_f1: 0.5202
 epoch: 41, train_loss: 0.8699, test_loss: 1.2575, test_f1: 0.5379
 epoch: 42, train_loss: 0.8644, test_loss: 1.2790, test_f1: 0.5220
 epoch: 43, train_loss: 0.8409, test_loss: 1.3049, test_f1: 0.5041
 epoch: 44, train_loss: 0.8495, test_loss: 1.3067, test_f1: 0.5096
 epoch: 45, train_loss: 0.8387, test_loss: 1.2643, test_f1: 0.5171
 epoch: 46, train_loss: 0.8340, test_loss: 1.3799, test_f1: 0.5127
 epoch: 47, train_loss: 0.8343, test_loss: 1.3461, test_f1: 0.5240
 epoch: 48, train_loss: 0.8264, test_loss: 1.3573, test_f1: 0.5112
 epoch: 49, train_loss: 0.8352, test_loss: 1.4648, test_f1: 0.5184
 epoch: 50, train_loss: 0.8135, test_loss: 1.4417, test_f1: 0.5284
 epoch: 51, train_loss: 0.8146, test_loss: 1.4382, test_f1: 0.5208
 epoch: 52, train_loss: 0.7925, test_loss: 1.4935, test_f1: 0.5087
 epoch: 53, train_loss: 0.8053, test_loss: 1.3980, test_f1: 0.5066
 epoch: 54, train_loss: 0.8006, test_loss: 1.3782, test_f1: 0.5219
 epoch: 55, train_loss: 0.8103, test_loss: 1.3918, test_f1: 0.5133
 epoch: 56, train_loss: 0.8091, test_loss: 1.4848, test_f1: 0.5109
 epoch: 57, train_loss: 0.8077, test_loss: 1.3786, test_f1: 0.5214
 epoch: 58, train_loss: 0.8082, test_loss: 1.4158, test_f1: 0.5317
 epoch: 59, train_loss: 0.7844, test_loss: 1.4705, test_f1: 0.5331
 epoch: 60, train_loss: 0.7915, test_loss: 1.4455, test_f1: 0.5339
 epoch: 61, train_loss: 0.8047, test_loss: 1.4540, test_f1: 0.5260
 epoch: 62, train_loss: 0.7951, test_loss: 1.5954, test_f1: 0.5187
 epoch: 63, train_loss: 0.7791, test_loss: 1.4210, test_f1: 0.5262
 epoch: 64, train_loss: 0.8015, test_loss: 1.5776, test_f1: 0.5080
 epoch: 65, train_loss: 0.7889, test_loss: 1.4744, test_f1: 0.5343
 epoch: 66, train_loss: 0.7683, test_loss: 1.5097, test_f1: 0.5371
 epoch: 67, train_loss: 0.7815, test_loss: 1.6863, test_f1: 0.5301
 epoch: 68, train_loss: 0.7831, test_loss: 1.5654, test_f1: 0.5449
 epoch: 69, train_loss: 0.7709, test_loss: 1.6628, test_f1: 0.5137
 epoch: 70, train_loss: 0.7680, test_loss: 1.6729, test_f1: 0.5484
 epoch: 71, train_loss: 0.7721, test_loss: 1.6718, test_f1: 0.5445
 epoch: 72, train_loss: 0.7747, test_loss: 1.7754, test_f1: 0.5322
 epoch: 73, train_loss: 0.7824, test_loss: 1.6310, test_f1: 0.5245
 epoch: 74, train_loss: 0.7787, test_loss: 1.7562, test_f1: 0.5227
 epoch: 75, train_loss: 0.7598, test_loss: 1.5178, test_f1: 0.5370
 epoch: 76, train_loss: 0.7675, test_loss: 1.6444, test_f1: 0.5277
 epoch: 77, train_loss: 0.7722, test_loss: 1.6399, test_f1: 0.5291
 epoch: 78, train_loss: 0.7576, test_loss: 1.6642, test_f1: 0.5301
 epoch: 79, train_loss: 0.7731, test_loss: 1.6975, test_f1: 0.5377
 epoch: 80, train_loss: 0.7598, test_loss: 1.7633, test_f1: 0.5391
 epoch: 81, train_loss: 0.7404, test_loss: 1.7217, test_f1: 0.5459
 epoch: 82, train_loss: 0.7447, test_loss: 1.8560, test_f1: 0.5474
 epoch: 83, train_loss: 0.7488, test_loss: 1.6814, test_f1: 0.5523
 epoch: 84, train_loss: 0.7473, test_loss: 1.8146, test_f1: 0.5507
 epoch: 85, train_loss: 0.7478, test_loss: 1.8223, test_f1: 0.5360
 epoch: 86, train_loss: 0.7346, test_loss: 1.7346, test_f1: 0.5366
 epoch: 87, train_loss: 0.7449, test_loss: 1.7749, test_f1: 0.5335
 epoch: 88, train_loss: 0.7381, test_loss: 1.8377, test_f1: 0.5382
 epoch: 89, train_loss: 0.7360, test_loss: 1.5970, test_f1: 0.5479
 epoch: 90, train_loss: 0.7413, test_loss: 1.9176, test_f1: 0.5274
 epoch: 91, train_loss: 0.7616, test_loss: 1.9486, test_f1: 0.5339
 epoch: 92, train_loss: 0.7416, test_loss: 1.9641, test_f1: 0.5437
 epoch: 93, train_loss: 0.7437, test_loss: 1.9280, test_f1: 0.5245
 epoch: 94, train_loss: 0.7203, test_loss: 1.9461, test_f1: 0.5352
 epoch: 95, train_loss: 0.7408, test_loss: 1.8787, test_f1: 0.5520
 epoch: 96, train_loss: 0.7245, test_loss: 1.7801, test_f1: 0.5305
 epoch: 97, train_loss: 0.7185, test_loss: 1.7406, test_f1: 0.5573
 epoch: 98, train_loss: 0.7204, test_loss: 1.7774, test_f1: 0.5566
 epoch: 99, train_loss: 0.7244, test_loss: 1.8426, test_f1: 0.5322
##################ITERATION #3 ****************************************
 epoch: 0, train_loss: 1.2920, test_loss: 1.2970, test_f1: 0.2597
 epoch: 1, train_loss: 1.2039, test_loss: 1.2585, test_f1: 0.3633
 epoch: 2, train_loss: 1.1733, test_loss: 1.2310, test_f1: 0.3796
 epoch: 3, train_loss: 1.1547, test_loss: 1.2142, test_f1: 0.3846
 epoch: 4, train_loss: 1.1458, test_loss: 1.2083, test_f1: 0.4192
 epoch: 5, train_loss: 1.1254, test_loss: 1.2059, test_f1: 0.4190
 epoch: 6, train_loss: 1.1102, test_loss: 1.1980, test_f1: 0.4363
 epoch: 7, train_loss: 1.0897, test_loss: 1.1832, test_f1: 0.4509
 epoch: 8, train_loss: 1.0938, test_loss: 1.1939, test_f1: 0.4569
 epoch: 9, train_loss: 1.0724, test_loss: 1.1843, test_f1: 0.4621
 epoch: 10, train_loss: 1.0746, test_loss: 1.1781, test_f1: 0.4640
 epoch: 11, train_loss: 1.0608, test_loss: 1.1688, test_f1: 0.4738
 epoch: 12, train_loss: 1.0516, test_loss: 1.1713, test_f1: 0.4839
 epoch: 13, train_loss: 1.0272, test_loss: 1.1745, test_f1: 0.5062
 epoch: 14, train_loss: 1.0339, test_loss: 1.1678, test_f1: 0.5044
 epoch: 15, train_loss: 1.0191, test_loss: 1.1742, test_f1: 0.5106
 epoch: 16, train_loss: 1.0214, test_loss: 1.1680, test_f1: 0.5129
 epoch: 17, train_loss: 1.0187, test_loss: 1.1654, test_f1: 0.5160
 epoch: 18, train_loss: 1.0052, test_loss: 1.1526, test_f1: 0.5241
 epoch: 19, train_loss: 0.9872, test_loss: 1.1655, test_f1: 0.5133
 epoch: 20, train_loss: 0.9916, test_loss: 1.1580, test_f1: 0.5457
 epoch: 21, train_loss: 0.9832, test_loss: 1.1598, test_f1: 0.5046
 epoch: 22, train_loss: 0.9580, test_loss: 1.1622, test_f1: 0.4994
 epoch: 23, train_loss: 0.9623, test_loss: 1.1557, test_f1: 0.5046
 epoch: 24, train_loss: 0.9575, test_loss: 1.1493, test_f1: 0.5423
 epoch: 25, train_loss: 0.9493, test_loss: 1.1572, test_f1: 0.5251
 epoch: 26, train_loss: 0.9494, test_loss: 1.1544, test_f1: 0.5417
 epoch: 27, train_loss: 0.9379, test_loss: 1.1563, test_f1: 0.5337
 epoch: 28, train_loss: 0.9347, test_loss: 1.1721, test_f1: 0.5320
 epoch: 29, train_loss: 0.9304, test_loss: 1.1667, test_f1: 0.5369
 epoch: 30, train_loss: 0.9132, test_loss: 1.1531, test_f1: 0.5503
 epoch: 31, train_loss: 0.9179, test_loss: 1.1721, test_f1: 0.5567
 epoch: 32, train_loss: 0.9132, test_loss: 1.1565, test_f1: 0.5511
 epoch: 33, train_loss: 0.8901, test_loss: 1.1745, test_f1: 0.5508
 epoch: 34, train_loss: 0.8975, test_loss: 1.1608, test_f1: 0.5591
 epoch: 35, train_loss: 0.8875, test_loss: 1.1929, test_f1: 0.5489
 epoch: 36, train_loss: 0.8859, test_loss: 1.1675, test_f1: 0.5418
 epoch: 37, train_loss: 0.8853, test_loss: 1.1708, test_f1: 0.5517
 epoch: 38, train_loss: 0.8849, test_loss: 1.1704, test_f1: 0.5646
 epoch: 39, train_loss: 0.8679, test_loss: 1.2088, test_f1: 0.5573
 epoch: 40, train_loss: 0.8692, test_loss: 1.2009, test_f1: 0.5515
 epoch: 41, train_loss: 0.8428, test_loss: 1.1925, test_f1: 0.5604
 epoch: 42, train_loss: 0.8613, test_loss: 1.1844, test_f1: 0.5569
 epoch: 43, train_loss: 0.8558, test_loss: 1.1995, test_f1: 0.5760
 epoch: 44, train_loss: 0.8632, test_loss: 1.2035, test_f1: 0.5701
 epoch: 45, train_loss: 0.8514, test_loss: 1.2043, test_f1: 0.5761
 epoch: 46, train_loss: 0.8505, test_loss: 1.2587, test_f1: 0.5233
 epoch: 47, train_loss: 0.8349, test_loss: 1.2560, test_f1: 0.5467
 epoch: 48, train_loss: 0.8246, test_loss: 1.2130, test_f1: 0.5591
 epoch: 49, train_loss: 0.8382, test_loss: 1.1966, test_f1: 0.5510
 epoch: 50, train_loss: 0.8268, test_loss: 1.2428, test_f1: 0.5513
 epoch: 51, train_loss: 0.8366, test_loss: 1.1731, test_f1: 0.5591
 epoch: 52, train_loss: 0.8070, test_loss: 1.2040, test_f1: 0.5511
 epoch: 53, train_loss: 0.8150, test_loss: 1.2144, test_f1: 0.5676
 epoch: 54, train_loss: 0.8022, test_loss: 1.2098, test_f1: 0.5590
 epoch: 55, train_loss: 0.8150, test_loss: 1.2266, test_f1: 0.5750
 epoch: 56, train_loss: 0.7937, test_loss: 1.2173, test_f1: 0.5614
 epoch: 57, train_loss: 0.7923, test_loss: 1.2322, test_f1: 0.5570
 epoch: 58, train_loss: 0.8034, test_loss: 1.2544, test_f1: 0.5604
 epoch: 59, train_loss: 0.7978, test_loss: 1.2273, test_f1: 0.5645
 epoch: 60, train_loss: 0.7937, test_loss: 1.2424, test_f1: 0.5802
 epoch: 61, train_loss: 0.7963, test_loss: 1.2509, test_f1: 0.5650
 epoch: 62, train_loss: 0.7783, test_loss: 1.2439, test_f1: 0.5774
 epoch: 63, train_loss: 0.7895, test_loss: 1.2226, test_f1: 0.5804
 epoch: 64, train_loss: 0.7953, test_loss: 1.2584, test_f1: 0.5602
 epoch: 65, train_loss: 0.7867, test_loss: 1.2403, test_f1: 0.5886
 epoch: 66, train_loss: 0.7771, test_loss: 1.2583, test_f1: 0.5777
 epoch: 67, train_loss: 0.7819, test_loss: 1.2533, test_f1: 0.5773
 epoch: 68, train_loss: 0.7783, test_loss: 1.2579, test_f1: 0.5672
 epoch: 69, train_loss: 0.7764, test_loss: 1.2914, test_f1: 0.5532
 epoch: 70, train_loss: 0.7791, test_loss: 1.2140, test_f1: 0.5698
 epoch: 71, train_loss: 0.7874, test_loss: 1.2490, test_f1: 0.5803
 epoch: 72, train_loss: 0.7824, test_loss: 1.2332, test_f1: 0.5756
 epoch: 73, train_loss: 0.7858, test_loss: 1.3117, test_f1: 0.5673
 epoch: 74, train_loss: 0.7741, test_loss: 1.2521, test_f1: 0.5600
 epoch: 75, train_loss: 0.7642, test_loss: 1.3052, test_f1: 0.5417
 epoch: 76, train_loss: 0.7700, test_loss: 1.2857, test_f1: 0.5654
 epoch: 77, train_loss: 0.7815, test_loss: 1.2557, test_f1: 0.5829
 epoch: 78, train_loss: 0.7697, test_loss: 1.2714, test_f1: 0.5512
 epoch: 79, train_loss: 0.7569, test_loss: 1.2824, test_f1: 0.5646
 epoch: 80, train_loss: 0.7697, test_loss: 1.2673, test_f1: 0.5883
 epoch: 81, train_loss: 0.7433, test_loss: 1.3118, test_f1: 0.5570
 epoch: 82, train_loss: 0.7558, test_loss: 1.3034, test_f1: 0.5512
 epoch: 83, train_loss: 0.7543, test_loss: 1.2893, test_f1: 0.5603
 epoch: 84, train_loss: 0.7515, test_loss: 1.2701, test_f1: 0.5704
 epoch: 85, train_loss: 0.7524, test_loss: 1.2932, test_f1: 0.5830
 epoch: 86, train_loss: 0.7499, test_loss: 1.3210, test_f1: 0.5677
 epoch: 87, train_loss: 0.7415, test_loss: 1.2548, test_f1: 0.5726
 epoch: 88, train_loss: 0.7438, test_loss: 1.3117, test_f1: 0.5714
 epoch: 89, train_loss: 0.7631, test_loss: 1.3254, test_f1: 0.5754
 epoch: 90, train_loss: 0.7504, test_loss: 1.2807, test_f1: 0.5762
 epoch: 91, train_loss: 0.7518, test_loss: 1.2929, test_f1: 0.5628
 epoch: 92, train_loss: 0.7356, test_loss: 1.2822, test_f1: 0.5829
 epoch: 93, train_loss: 0.7399, test_loss: 1.2883, test_f1: 0.5853
 epoch: 94, train_loss: 0.7318, test_loss: 1.3424, test_f1: 0.5535
 epoch: 95, train_loss: 0.7451, test_loss: 1.2961, test_f1: 0.5752
 epoch: 96, train_loss: 0.7434, test_loss: 1.2670, test_f1: 0.5749
 epoch: 97, train_loss: 0.7411, test_loss: 1.3463, test_f1: 0.5638
 epoch: 98, train_loss: 0.7336, test_loss: 1.3190, test_f1: 0.5611
 epoch: 99, train_loss: 0.7404, test_loss: 1.3202, test_f1: 0.5750
##################ITERATION #4 ****************************************
 epoch: 0, train_loss: 1.2979, test_loss: 1.3758, test_f1: 0.3143
 epoch: 1, train_loss: 1.2322, test_loss: 1.3851, test_f1: 0.3425
 epoch: 2, train_loss: 1.2054, test_loss: 1.3472, test_f1: 0.3846
 epoch: 3, train_loss: 1.1796, test_loss: 1.3210, test_f1: 0.4229
 epoch: 4, train_loss: 1.1792, test_loss: 1.2951, test_f1: 0.4648
 epoch: 5, train_loss: 1.1487, test_loss: 1.3023, test_f1: 0.4881
 epoch: 6, train_loss: 1.1361, test_loss: 1.2747, test_f1: 0.5019
 epoch: 7, train_loss: 1.1161, test_loss: 1.2793, test_f1: 0.4888
 epoch: 8, train_loss: 1.1009, test_loss: 1.2571, test_f1: 0.4964
 epoch: 9, train_loss: 1.0916, test_loss: 1.2541, test_f1: 0.4971
 epoch: 10, train_loss: 1.0770, test_loss: 1.2116, test_f1: 0.5136
 epoch: 11, train_loss: 1.0535, test_loss: 1.2129, test_f1: 0.5134
 epoch: 12, train_loss: 1.0367, test_loss: 1.1890, test_f1: 0.5223
 epoch: 13, train_loss: 1.0314, test_loss: 1.1740, test_f1: 0.5278
 epoch: 14, train_loss: 1.0195, test_loss: 1.1585, test_f1: 0.5324
 epoch: 15, train_loss: 1.0016, test_loss: 1.1547, test_f1: 0.5205
 epoch: 16, train_loss: 1.0115, test_loss: 1.1471, test_f1: 0.5206
 epoch: 17, train_loss: 0.9929, test_loss: 1.1618, test_f1: 0.5115
 epoch: 18, train_loss: 0.9836, test_loss: 1.1610, test_f1: 0.5029
 epoch: 19, train_loss: 0.9722, test_loss: 1.1469, test_f1: 0.5337
 epoch: 20, train_loss: 0.9632, test_loss: 1.1355, test_f1: 0.5288
 epoch: 21, train_loss: 0.9737, test_loss: 1.1348, test_f1: 0.5282
 epoch: 22, train_loss: 0.9547, test_loss: 1.1347, test_f1: 0.4988
 epoch: 23, train_loss: 0.9512, test_loss: 1.1517, test_f1: 0.4970
 epoch: 24, train_loss: 0.9437, test_loss: 1.1300, test_f1: 0.5127
 epoch: 25, train_loss: 0.9294, test_loss: 1.0998, test_f1: 0.5417
 epoch: 26, train_loss: 0.9212, test_loss: 1.1525, test_f1: 0.5240
 epoch: 27, train_loss: 0.9141, test_loss: 1.1488, test_f1: 0.5278
 epoch: 28, train_loss: 0.9190, test_loss: 1.1281, test_f1: 0.5290
 epoch: 29, train_loss: 0.9050, test_loss: 1.1078, test_f1: 0.5373
 epoch: 30, train_loss: 0.8990, test_loss: 1.1239, test_f1: 0.5244
 epoch: 31, train_loss: 0.9039, test_loss: 1.1076, test_f1: 0.5345
 epoch: 32, train_loss: 0.9032, test_loss: 1.1610, test_f1: 0.5099
 epoch: 33, train_loss: 0.9032, test_loss: 1.1074, test_f1: 0.5288
 epoch: 34, train_loss: 0.8703, test_loss: 1.1301, test_f1: 0.5222
 epoch: 35, train_loss: 0.8648, test_loss: 1.1695, test_f1: 0.4975
 epoch: 36, train_loss: 0.8566, test_loss: 1.1164, test_f1: 0.5566
 epoch: 37, train_loss: 0.8714, test_loss: 1.1568, test_f1: 0.5172
 epoch: 38, train_loss: 0.8438, test_loss: 1.1088, test_f1: 0.5285
 epoch: 39, train_loss: 0.8594, test_loss: 1.1675, test_f1: 0.5468
 epoch: 40, train_loss: 0.8499, test_loss: 1.1566, test_f1: 0.5117
 epoch: 41, train_loss: 0.8524, test_loss: 1.2198, test_f1: 0.5292
 epoch: 42, train_loss: 0.8426, test_loss: 1.1484, test_f1: 0.5357
 epoch: 43, train_loss: 0.8388, test_loss: 1.1962, test_f1: 0.5467
 epoch: 44, train_loss: 0.8396, test_loss: 1.1210, test_f1: 0.5497
 epoch: 45, train_loss: 0.8380, test_loss: 1.1497, test_f1: 0.5215
 epoch: 46, train_loss: 0.8181, test_loss: 1.2093, test_f1: 0.5509
 epoch: 47, train_loss: 0.8232, test_loss: 1.1855, test_f1: 0.5675
 epoch: 48, train_loss: 0.8193, test_loss: 1.2180, test_f1: 0.5430
 epoch: 49, train_loss: 0.8232, test_loss: 1.2530, test_f1: 0.5440
 epoch: 50, train_loss: 0.8099, test_loss: 1.2792, test_f1: 0.5533
 epoch: 51, train_loss: 0.7885, test_loss: 1.2582, test_f1: 0.5634
 epoch: 52, train_loss: 0.8100, test_loss: 1.3524, test_f1: 0.5515
 epoch: 53, train_loss: 0.7882, test_loss: 1.2264, test_f1: 0.5774
 epoch: 54, train_loss: 0.7884, test_loss: 1.2739, test_f1: 0.5458
 epoch: 55, train_loss: 0.7902, test_loss: 1.2526, test_f1: 0.5636
 epoch: 56, train_loss: 0.7981, test_loss: 1.2419, test_f1: 0.5819
 epoch: 57, train_loss: 0.7983, test_loss: 1.2800, test_f1: 0.5756
 epoch: 58, train_loss: 0.7697, test_loss: 1.2837, test_f1: 0.5780
 epoch: 59, train_loss: 0.7868, test_loss: 1.2975, test_f1: 0.5751
 epoch: 60, train_loss: 0.7780, test_loss: 1.2720, test_f1: 0.5636
 epoch: 61, train_loss: 0.7889, test_loss: 1.2863, test_f1: 0.5871
 epoch: 62, train_loss: 0.7914, test_loss: 1.3132, test_f1: 0.5738
 epoch: 63, train_loss: 0.7927, test_loss: 1.3468, test_f1: 0.5708
 epoch: 64, train_loss: 0.7742, test_loss: 1.3219, test_f1: 0.5670
 epoch: 65, train_loss: 0.7777, test_loss: 1.4317, test_f1: 0.5772
 epoch: 66, train_loss: 0.7762, test_loss: 1.3420, test_f1: 0.5782
 epoch: 67, train_loss: 0.7690, test_loss: 1.3468, test_f1: 0.5676
 epoch: 68, train_loss: 0.7718, test_loss: 1.3328, test_f1: 0.5716
 epoch: 69, train_loss: 0.7588, test_loss: 1.3608, test_f1: 0.5632
 epoch: 70, train_loss: 0.7688, test_loss: 1.3137, test_f1: 0.5741
 epoch: 71, train_loss: 0.7644, test_loss: 1.3349, test_f1: 0.5616
 epoch: 72, train_loss: 0.7791, test_loss: 1.3609, test_f1: 0.5676
 epoch: 73, train_loss: 0.7649, test_loss: 1.3040, test_f1: 0.5688
 epoch: 74, train_loss: 0.7555, test_loss: 1.3418, test_f1: 0.5739
 epoch: 75, train_loss: 0.7385, test_loss: 1.4580, test_f1: 0.5678
 epoch: 76, train_loss: 0.7466, test_loss: 1.3806, test_f1: 0.5688
 epoch: 77, train_loss: 0.7571, test_loss: 1.4299, test_f1: 0.5801
 epoch: 78, train_loss: 0.7630, test_loss: 1.3760, test_f1: 0.5731
 epoch: 79, train_loss: 0.7492, test_loss: 1.4551, test_f1: 0.5726
 epoch: 80, train_loss: 0.7540, test_loss: 1.4015, test_f1: 0.5862
 epoch: 81, train_loss: 0.7596, test_loss: 1.4593, test_f1: 0.5697
 epoch: 82, train_loss: 0.7357, test_loss: 1.4040, test_f1: 0.5624
 epoch: 83, train_loss: 0.7629, test_loss: 1.5010, test_f1: 0.5765
 epoch: 84, train_loss: 0.7393, test_loss: 1.3815, test_f1: 0.5692
 epoch: 85, train_loss: 0.7311, test_loss: 1.5055, test_f1: 0.5809
 epoch: 86, train_loss: 0.7274, test_loss: 1.5294, test_f1: 0.5859
 epoch: 87, train_loss: 0.7261, test_loss: 1.3777, test_f1: 0.5915
 epoch: 88, train_loss: 0.7400, test_loss: 1.5603, test_f1: 0.5884
 epoch: 89, train_loss: 0.7316, test_loss: 1.4138, test_f1: 0.5836
 epoch: 90, train_loss: 0.7392, test_loss: 1.5515, test_f1: 0.5677
 epoch: 91, train_loss: 0.7596, test_loss: 1.4362, test_f1: 0.5706
 epoch: 92, train_loss: 0.7384, test_loss: 1.4487, test_f1: 0.5790
 epoch: 93, train_loss: 0.7274, test_loss: 1.3703, test_f1: 0.5793
 epoch: 94, train_loss: 0.7226, test_loss: 1.4553, test_f1: 0.5763
 epoch: 95, train_loss: 0.7245, test_loss: 1.5310, test_f1: 0.5781
 epoch: 96, train_loss: 0.7231, test_loss: 1.4244, test_f1: 0.5915
 epoch: 97, train_loss: 0.7352, test_loss: 1.4080, test_f1: 0.5808
 epoch: 98, train_loss: 0.7366, test_loss: 1.4181, test_f1: 0.5810
 epoch: 99, train_loss: 0.7363, test_loss: 1.4815, test_f1: 0.5591
##################ITERATION #5 ****************************************
 epoch: 0, train_loss: 1.2838, test_loss: 1.3015, test_f1: 0.3284
 epoch: 1, train_loss: 1.2356, test_loss: 1.2766, test_f1: 0.4103
 epoch: 2, train_loss: 1.1865, test_loss: 1.2656, test_f1: 0.4094
 epoch: 3, train_loss: 1.1768, test_loss: 1.2547, test_f1: 0.4482
 epoch: 4, train_loss: 1.1685, test_loss: 1.2435, test_f1: 0.4611
 epoch: 5, train_loss: 1.1401, test_loss: 1.2289, test_f1: 0.4641
 epoch: 6, train_loss: 1.1413, test_loss: 1.2365, test_f1: 0.4717
 epoch: 7, train_loss: 1.1096, test_loss: 1.2313, test_f1: 0.4912
 epoch: 8, train_loss: 1.0998, test_loss: 1.2079, test_f1: 0.4796
 epoch: 9, train_loss: 1.1025, test_loss: 1.2120, test_f1: 0.4667
 epoch: 10, train_loss: 1.0877, test_loss: 1.1978, test_f1: 0.5034
 epoch: 11, train_loss: 1.0561, test_loss: 1.1954, test_f1: 0.4969
 epoch: 12, train_loss: 1.0610, test_loss: 1.1835, test_f1: 0.5010
 epoch: 13, train_loss: 1.0560, test_loss: 1.2047, test_f1: 0.5335
 epoch: 14, train_loss: 1.0270, test_loss: 1.1807, test_f1: 0.5417
 epoch: 15, train_loss: 1.0268, test_loss: 1.2191, test_f1: 0.5197
 epoch: 16, train_loss: 1.0352, test_loss: 1.1807, test_f1: 0.5133
 epoch: 17, train_loss: 1.0089, test_loss: 1.1836, test_f1: 0.5270
 epoch: 18, train_loss: 1.0074, test_loss: 1.1827, test_f1: 0.5210
 epoch: 19, train_loss: 0.9979, test_loss: 1.1910, test_f1: 0.5131
 epoch: 20, train_loss: 0.9778, test_loss: 1.1736, test_f1: 0.5355
 epoch: 21, train_loss: 0.9972, test_loss: 1.2099, test_f1: 0.5018
 epoch: 22, train_loss: 0.9720, test_loss: 1.1651, test_f1: 0.5405
 epoch: 23, train_loss: 0.9771, test_loss: 1.1866, test_f1: 0.5101
 epoch: 24, train_loss: 0.9775, test_loss: 1.1691, test_f1: 0.5221
 epoch: 25, train_loss: 0.9590, test_loss: 1.1622, test_f1: 0.5223
 epoch: 26, train_loss: 0.9666, test_loss: 1.1882, test_f1: 0.5164
 epoch: 27, train_loss: 0.9559, test_loss: 1.1624, test_f1: 0.5264
 epoch: 28, train_loss: 0.9410, test_loss: 1.1810, test_f1: 0.5275
 epoch: 29, train_loss: 0.9256, test_loss: 1.1748, test_f1: 0.5213
 epoch: 30, train_loss: 0.9522, test_loss: 1.1794, test_f1: 0.5340
 epoch: 31, train_loss: 0.9280, test_loss: 1.2342, test_f1: 0.5210
 epoch: 32, train_loss: 0.9115, test_loss: 1.1876, test_f1: 0.5269
 epoch: 33, train_loss: 0.9162, test_loss: 1.1510, test_f1: 0.5446
 epoch: 34, train_loss: 0.9129, test_loss: 1.2119, test_f1: 0.5115
 epoch: 35, train_loss: 0.9117, test_loss: 1.1898, test_f1: 0.5308
 epoch: 36, train_loss: 0.9073, test_loss: 1.1722, test_f1: 0.5147
 epoch: 37, train_loss: 0.9019, test_loss: 1.1597, test_f1: 0.5301
 epoch: 38, train_loss: 0.8958, test_loss: 1.1672, test_f1: 0.5278
 epoch: 39, train_loss: 0.8888, test_loss: 1.2067, test_f1: 0.5238
 epoch: 40, train_loss: 0.8886, test_loss: 1.1681, test_f1: 0.5294
 epoch: 41, train_loss: 0.8666, test_loss: 1.2004, test_f1: 0.5004
 epoch: 42, train_loss: 0.8758, test_loss: 1.2056, test_f1: 0.5376
 epoch: 43, train_loss: 0.8618, test_loss: 1.2493, test_f1: 0.4827
 epoch: 44, train_loss: 0.8753, test_loss: 1.2040, test_f1: 0.5257
 epoch: 45, train_loss: 0.8617, test_loss: 1.2036, test_f1: 0.5208
 epoch: 46, train_loss: 0.8499, test_loss: 1.2200, test_f1: 0.5214
 epoch: 47, train_loss: 0.8487, test_loss: 1.2478, test_f1: 0.5399
 epoch: 48, train_loss: 0.8524, test_loss: 1.2295, test_f1: 0.5311
 epoch: 49, train_loss: 0.8365, test_loss: 1.2387, test_f1: 0.4904
 epoch: 50, train_loss: 0.8470, test_loss: 1.2115, test_f1: 0.5191
 epoch: 51, train_loss: 0.8340, test_loss: 1.2206, test_f1: 0.5224
 epoch: 52, train_loss: 0.8360, test_loss: 1.2408, test_f1: 0.5337
 epoch: 53, train_loss: 0.8243, test_loss: 1.2387, test_f1: 0.5284
 epoch: 54, train_loss: 0.8132, test_loss: 1.2590, test_f1: 0.5248
 epoch: 55, train_loss: 0.8307, test_loss: 1.2502, test_f1: 0.5130
 epoch: 56, train_loss: 0.8407, test_loss: 1.2667, test_f1: 0.5137
 epoch: 57, train_loss: 0.8179, test_loss: 1.2661, test_f1: 0.5331
 epoch: 58, train_loss: 0.7967, test_loss: 1.2956, test_f1: 0.4960
 epoch: 59, train_loss: 0.8367, test_loss: 1.2562, test_f1: 0.5253
 epoch: 60, train_loss: 0.8240, test_loss: 1.2519, test_f1: 0.5381
 epoch: 61, train_loss: 0.8156, test_loss: 1.2562, test_f1: 0.5319
 epoch: 62, train_loss: 0.7911, test_loss: 1.2588, test_f1: 0.5065
 epoch: 63, train_loss: 0.8055, test_loss: 1.2786, test_f1: 0.5106
 epoch: 64, train_loss: 0.8151, test_loss: 1.2998, test_f1: 0.5237
 epoch: 65, train_loss: 0.8191, test_loss: 1.2880, test_f1: 0.5178
 epoch: 66, train_loss: 0.8068, test_loss: 1.2912, test_f1: 0.5110
 epoch: 67, train_loss: 0.8101, test_loss: 1.2555, test_f1: 0.5206
 epoch: 68, train_loss: 0.7966, test_loss: 1.2729, test_f1: 0.5140
 epoch: 69, train_loss: 0.7984, test_loss: 1.2779, test_f1: 0.5280
 epoch: 70, train_loss: 0.7899, test_loss: 1.2583, test_f1: 0.5394
 epoch: 71, train_loss: 0.8028, test_loss: 1.2700, test_f1: 0.5304
 epoch: 72, train_loss: 0.7871, test_loss: 1.2929, test_f1: 0.5218
 epoch: 73, train_loss: 0.7855, test_loss: 1.2881, test_f1: 0.5140
 epoch: 74, train_loss: 0.8014, test_loss: 1.2823, test_f1: 0.5205
 epoch: 75, train_loss: 0.7782, test_loss: 1.2846, test_f1: 0.5261
 epoch: 76, train_loss: 0.7814, test_loss: 1.2423, test_f1: 0.5347
 epoch: 77, train_loss: 0.7714, test_loss: 1.2819, test_f1: 0.5121
 epoch: 78, train_loss: 0.7950, test_loss: 1.2814, test_f1: 0.5412
 epoch: 79, train_loss: 0.7892, test_loss: 1.2761, test_f1: 0.5159
 epoch: 80, train_loss: 0.7789, test_loss: 1.2851, test_f1: 0.5486
 epoch: 81, train_loss: 0.7726, test_loss: 1.3176, test_f1: 0.5062
 epoch: 82, train_loss: 0.7511, test_loss: 1.2749, test_f1: 0.5350
 epoch: 83, train_loss: 0.7744, test_loss: 1.2624, test_f1: 0.5394
 epoch: 84, train_loss: 0.7711, test_loss: 1.3097, test_f1: 0.5268
 epoch: 85, train_loss: 0.7787, test_loss: 1.2649, test_f1: 0.5270
 epoch: 86, train_loss: 0.7669, test_loss: 1.3048, test_f1: 0.5321
 epoch: 87, train_loss: 0.7669, test_loss: 1.3561, test_f1: 0.5104
 epoch: 88, train_loss: 0.7736, test_loss: 1.3099, test_f1: 0.5134
 epoch: 89, train_loss: 0.7737, test_loss: 1.3364, test_f1: 0.4865
 epoch: 90, train_loss: 0.7664, test_loss: 1.2885, test_f1: 0.5202
 epoch: 91, train_loss: 0.7564, test_loss: 1.2927, test_f1: 0.5298
 epoch: 92, train_loss: 0.7468, test_loss: 1.3143, test_f1: 0.5146
 epoch: 93, train_loss: 0.7513, test_loss: 1.3060, test_f1: 0.5317
 epoch: 94, train_loss: 0.7521, test_loss: 1.3136, test_f1: 0.5341
 epoch: 95, train_loss: 0.7791, test_loss: 1.3662, test_f1: 0.5047
 epoch: 96, train_loss: 0.7532, test_loss: 1.3344, test_f1: 0.5555
 epoch: 97, train_loss: 0.7784, test_loss: 1.2983, test_f1: 0.5210
 epoch: 98, train_loss: 0.7409, test_loss: 1.2991, test_f1: 0.5364
 epoch: 99, train_loss: 0.7435, test_loss: 1.3797, test_f1: 0.5107
##################ITERATION #6 ****************************************
 epoch: 0, train_loss: 1.2811, test_loss: 1.3203, test_f1: 0.3475
 epoch: 1, train_loss: 1.2143, test_loss: 1.2996, test_f1: 0.3834
 epoch: 2, train_loss: 1.1861, test_loss: 1.2827, test_f1: 0.4042
 epoch: 3, train_loss: 1.1552, test_loss: 1.2568, test_f1: 0.4471
 epoch: 4, train_loss: 1.1326, test_loss: 1.2387, test_f1: 0.4623
 epoch: 5, train_loss: 1.1106, test_loss: 1.2183, test_f1: 0.4685
 epoch: 6, train_loss: 1.1018, test_loss: 1.2214, test_f1: 0.4801
 epoch: 7, train_loss: 1.0909, test_loss: 1.1969, test_f1: 0.4693
 epoch: 8, train_loss: 1.0794, test_loss: 1.1837, test_f1: 0.4870
 epoch: 9, train_loss: 1.0565, test_loss: 1.1861, test_f1: 0.4984
 epoch: 10, train_loss: 1.0526, test_loss: 1.1922, test_f1: 0.4750
 epoch: 11, train_loss: 1.0361, test_loss: 1.1961, test_f1: 0.5175
 epoch: 12, train_loss: 1.0322, test_loss: 1.2154, test_f1: 0.5374
 epoch: 13, train_loss: 1.0276, test_loss: 1.1917, test_f1: 0.5109
 epoch: 14, train_loss: 1.0208, test_loss: 1.1884, test_f1: 0.5267
 epoch: 15, train_loss: 1.0199, test_loss: 1.1835, test_f1: 0.5009
 epoch: 16, train_loss: 1.0110, test_loss: 1.1757, test_f1: 0.4926
 epoch: 17, train_loss: 0.9880, test_loss: 1.2093, test_f1: 0.5024
 epoch: 18, train_loss: 0.9907, test_loss: 1.1650, test_f1: 0.4869
 epoch: 19, train_loss: 0.9705, test_loss: 1.1451, test_f1: 0.5311
 epoch: 20, train_loss: 0.9717, test_loss: 1.1332, test_f1: 0.5539
 epoch: 21, train_loss: 0.9759, test_loss: 1.1470, test_f1: 0.5212
 epoch: 22, train_loss: 0.9752, test_loss: 1.1430, test_f1: 0.5216
 epoch: 23, train_loss: 0.9645, test_loss: 1.1217, test_f1: 0.5597
 epoch: 24, train_loss: 0.9679, test_loss: 1.1511, test_f1: 0.5155
 epoch: 25, train_loss: 0.9560, test_loss: 1.1318, test_f1: 0.5274
 epoch: 26, train_loss: 0.9539, test_loss: 1.1241, test_f1: 0.5409
 epoch: 27, train_loss: 0.9283, test_loss: 1.1181, test_f1: 0.5527
 epoch: 28, train_loss: 0.9290, test_loss: 1.1067, test_f1: 0.5558
 epoch: 29, train_loss: 0.9118, test_loss: 1.1140, test_f1: 0.5232
 epoch: 30, train_loss: 0.9098, test_loss: 1.0937, test_f1: 0.5299
 epoch: 31, train_loss: 0.9201, test_loss: 1.0944, test_f1: 0.5238
 epoch: 32, train_loss: 0.9056, test_loss: 1.1276, test_f1: 0.5777
 epoch: 33, train_loss: 0.8952, test_loss: 1.1091, test_f1: 0.5680
 epoch: 34, train_loss: 0.9086, test_loss: 1.1185, test_f1: 0.5513
 epoch: 35, train_loss: 0.8851, test_loss: 1.0950, test_f1: 0.5701
 epoch: 36, train_loss: 0.9058, test_loss: 1.2054, test_f1: 0.5380
 epoch: 37, train_loss: 0.8733, test_loss: 1.1001, test_f1: 0.5621
 epoch: 38, train_loss: 0.8847, test_loss: 1.0968, test_f1: 0.5558
 epoch: 39, train_loss: 0.8912, test_loss: 1.0965, test_f1: 0.5735
 epoch: 40, train_loss: 0.8562, test_loss: 1.1254, test_f1: 0.5536
 epoch: 41, train_loss: 0.8685, test_loss: 1.1012, test_f1: 0.5908
 epoch: 42, train_loss: 0.8604, test_loss: 1.1587, test_f1: 0.5503
 epoch: 43, train_loss: 0.8530, test_loss: 1.2356, test_f1: 0.5295
 epoch: 44, train_loss: 0.8563, test_loss: 1.2019, test_f1: 0.5574
 epoch: 45, train_loss: 0.8431, test_loss: 1.1938, test_f1: 0.5629
 epoch: 46, train_loss: 0.8294, test_loss: 1.1222, test_f1: 0.5599
 epoch: 47, train_loss: 0.8503, test_loss: 1.1601, test_f1: 0.5630
 epoch: 48, train_loss: 0.8408, test_loss: 1.1152, test_f1: 0.5735
 epoch: 49, train_loss: 0.8422, test_loss: 1.1338, test_f1: 0.5595
 epoch: 50, train_loss: 0.8355, test_loss: 1.1815, test_f1: 0.5537
 epoch: 51, train_loss: 0.8315, test_loss: 1.2184, test_f1: 0.5612
 epoch: 52, train_loss: 0.8240, test_loss: 1.1062, test_f1: 0.6101
 epoch: 53, train_loss: 0.8224, test_loss: 1.1202, test_f1: 0.5910
 epoch: 54, train_loss: 0.8242, test_loss: 1.1068, test_f1: 0.6043
 epoch: 55, train_loss: 0.8140, test_loss: 1.0942, test_f1: 0.5972
 epoch: 56, train_loss: 0.8144, test_loss: 1.1344, test_f1: 0.6162
 epoch: 57, train_loss: 0.7958, test_loss: 1.1160, test_f1: 0.5918
 epoch: 58, train_loss: 0.8188, test_loss: 1.1499, test_f1: 0.5767
 epoch: 59, train_loss: 0.8196, test_loss: 1.2471, test_f1: 0.5765
 epoch: 60, train_loss: 0.8091, test_loss: 1.1641, test_f1: 0.5897
 epoch: 61, train_loss: 0.8024, test_loss: 1.1539, test_f1: 0.6005
 epoch: 62, train_loss: 0.8082, test_loss: 1.1303, test_f1: 0.6064
 epoch: 63, train_loss: 0.8020, test_loss: 1.1366, test_f1: 0.5933
 epoch: 64, train_loss: 0.8052, test_loss: 1.1259, test_f1: 0.6042
 epoch: 65, train_loss: 0.8021, test_loss: 1.1341, test_f1: 0.5872
 epoch: 66, train_loss: 0.7995, test_loss: 1.1217, test_f1: 0.6191
 epoch: 67, train_loss: 0.7971, test_loss: 1.1809, test_f1: 0.5899
 epoch: 68, train_loss: 0.7857, test_loss: 1.1325, test_f1: 0.6251
 epoch: 69, train_loss: 0.7910, test_loss: 1.1103, test_f1: 0.6252
 epoch: 70, train_loss: 0.8018, test_loss: 1.1377, test_f1: 0.6144
 epoch: 71, train_loss: 0.7862, test_loss: 1.1475, test_f1: 0.6242
 epoch: 72, train_loss: 0.7852, test_loss: 1.2460, test_f1: 0.5975
 epoch: 73, train_loss: 0.7793, test_loss: 1.1768, test_f1: 0.5935
 epoch: 74, train_loss: 0.7723, test_loss: 1.2373, test_f1: 0.5846
 epoch: 75, train_loss: 0.7779, test_loss: 1.1388, test_f1: 0.5847
 epoch: 76, train_loss: 0.7631, test_loss: 1.2124, test_f1: 0.5855
 epoch: 77, train_loss: 0.7847, test_loss: 1.2121, test_f1: 0.5897
 epoch: 78, train_loss: 0.7814, test_loss: 1.2175, test_f1: 0.5849
 epoch: 79, train_loss: 0.7943, test_loss: 1.1996, test_f1: 0.5888
 epoch: 80, train_loss: 0.7738, test_loss: 1.2079, test_f1: 0.5855
 epoch: 81, train_loss: 0.7767, test_loss: 1.2152, test_f1: 0.5963
 epoch: 82, train_loss: 0.7697, test_loss: 1.2321, test_f1: 0.5881
 epoch: 83, train_loss: 0.7762, test_loss: 1.1882, test_f1: 0.5854
 epoch: 84, train_loss: 0.7758, test_loss: 1.1294, test_f1: 0.6078
 epoch: 85, train_loss: 0.7503, test_loss: 1.2279, test_f1: 0.5775
 epoch: 86, train_loss: 0.7496, test_loss: 1.2246, test_f1: 0.5905
 epoch: 87, train_loss: 0.7681, test_loss: 1.2655, test_f1: 0.5866
 epoch: 88, train_loss: 0.7528, test_loss: 1.1976, test_f1: 0.6215
 epoch: 89, train_loss: 0.7591, test_loss: 1.1926, test_f1: 0.6350
 epoch: 90, train_loss: 0.7655, test_loss: 1.2967, test_f1: 0.5982
 epoch: 91, train_loss: 0.7681, test_loss: 1.2702, test_f1: 0.5934
 epoch: 92, train_loss: 0.7614, test_loss: 1.1923, test_f1: 0.6010
 epoch: 93, train_loss: 0.7605, test_loss: 1.2692, test_f1: 0.5875
 epoch: 94, train_loss: 0.7631, test_loss: 1.1890, test_f1: 0.5973
 epoch: 95, train_loss: 0.7503, test_loss: 1.2052, test_f1: 0.5939
 epoch: 96, train_loss: 0.7438, test_loss: 1.2328, test_f1: 0.6028
 epoch: 97, train_loss: 0.7474, test_loss: 1.2454, test_f1: 0.5951
 epoch: 98, train_loss: 0.7417, test_loss: 1.3361, test_f1: 0.5984
 epoch: 99, train_loss: 0.7498, test_loss: 1.2983, test_f1: 0.5860
##################ITERATION #7 ****************************************
 epoch: 0, train_loss: 1.3110, test_loss: 1.3227, test_f1: 0.3470
 epoch: 1, train_loss: 1.2193, test_loss: 1.2830, test_f1: 0.3868
 epoch: 2, train_loss: 1.2033, test_loss: 1.2959, test_f1: 0.4142
 epoch: 3, train_loss: 1.1856, test_loss: 1.2474, test_f1: 0.4511
 epoch: 4, train_loss: 1.1653, test_loss: 1.2235, test_f1: 0.4654
 epoch: 5, train_loss: 1.1425, test_loss: 1.2304, test_f1: 0.4848
 epoch: 6, train_loss: 1.1168, test_loss: 1.1996, test_f1: 0.5090
 epoch: 7, train_loss: 1.1120, test_loss: 1.1952, test_f1: 0.5080
 epoch: 8, train_loss: 1.0878, test_loss: 1.1797, test_f1: 0.5322
 epoch: 9, train_loss: 1.0781, test_loss: 1.1808, test_f1: 0.5117
 epoch: 10, train_loss: 1.0476, test_loss: 1.1632, test_f1: 0.5300
 epoch: 11, train_loss: 1.0465, test_loss: 1.1406, test_f1: 0.5559
 epoch: 12, train_loss: 1.0514, test_loss: 1.1557, test_f1: 0.5413
 epoch: 13, train_loss: 1.0403, test_loss: 1.1478, test_f1: 0.5391
 epoch: 14, train_loss: 1.0276, test_loss: 1.1322, test_f1: 0.5370
 epoch: 15, train_loss: 1.0121, test_loss: 1.1165, test_f1: 0.5423
 epoch: 16, train_loss: 0.9948, test_loss: 1.1236, test_f1: 0.5500
 epoch: 17, train_loss: 1.0096, test_loss: 1.1077, test_f1: 0.5510
 epoch: 18, train_loss: 0.9992, test_loss: 1.1082, test_f1: 0.5480
 epoch: 19, train_loss: 0.9786, test_loss: 1.1025, test_f1: 0.5486
 epoch: 20, train_loss: 0.9592, test_loss: 1.1101, test_f1: 0.5302
 epoch: 21, train_loss: 0.9577, test_loss: 1.1010, test_f1: 0.5614
 epoch: 22, train_loss: 0.9670, test_loss: 1.0871, test_f1: 0.5626
 epoch: 23, train_loss: 0.9554, test_loss: 1.0721, test_f1: 0.5587
 epoch: 24, train_loss: 0.9281, test_loss: 1.0866, test_f1: 0.5745
 epoch: 25, train_loss: 0.9530, test_loss: 1.0819, test_f1: 0.5772
 epoch: 26, train_loss: 0.9270, test_loss: 1.0932, test_f1: 0.5692
 epoch: 27, train_loss: 0.9217, test_loss: 1.0704, test_f1: 0.5823
 epoch: 28, train_loss: 0.9185, test_loss: 1.0790, test_f1: 0.5662
 epoch: 29, train_loss: 0.9096, test_loss: 1.0800, test_f1: 0.5500
 epoch: 30, train_loss: 0.9034, test_loss: 1.0583, test_f1: 0.5769
 epoch: 31, train_loss: 0.9110, test_loss: 1.0790, test_f1: 0.5602
 epoch: 32, train_loss: 0.8852, test_loss: 1.0602, test_f1: 0.5741
 epoch: 33, train_loss: 0.8791, test_loss: 1.0586, test_f1: 0.5817
 epoch: 34, train_loss: 0.8802, test_loss: 1.0684, test_f1: 0.5450
 epoch: 35, train_loss: 0.8720, test_loss: 1.0772, test_f1: 0.5681
 epoch: 36, train_loss: 0.8686, test_loss: 1.0708, test_f1: 0.5655
 epoch: 37, train_loss: 0.8680, test_loss: 1.0508, test_f1: 0.5967
 epoch: 38, train_loss: 0.8470, test_loss: 1.0440, test_f1: 0.5928
 epoch: 39, train_loss: 0.8611, test_loss: 1.0787, test_f1: 0.6035
 epoch: 40, train_loss: 0.8598, test_loss: 1.0477, test_f1: 0.6144
 epoch: 41, train_loss: 0.8587, test_loss: 1.0645, test_f1: 0.6192
 epoch: 42, train_loss: 0.8418, test_loss: 1.0588, test_f1: 0.5993
 epoch: 43, train_loss: 0.8322, test_loss: 1.0818, test_f1: 0.5924
 epoch: 44, train_loss: 0.8243, test_loss: 1.0744, test_f1: 0.5860
 epoch: 45, train_loss: 0.8146, test_loss: 1.0848, test_f1: 0.6173
 epoch: 46, train_loss: 0.8186, test_loss: 1.0472, test_f1: 0.6067
 epoch: 47, train_loss: 0.8220, test_loss: 1.1076, test_f1: 0.6139
 epoch: 48, train_loss: 0.8080, test_loss: 1.0655, test_f1: 0.5939
 epoch: 49, train_loss: 0.7878, test_loss: 1.0977, test_f1: 0.5969
 epoch: 50, train_loss: 0.8016, test_loss: 1.0964, test_f1: 0.5890
 epoch: 51, train_loss: 0.7868, test_loss: 1.0829, test_f1: 0.5919
 epoch: 52, train_loss: 0.7924, test_loss: 1.0713, test_f1: 0.5838
 epoch: 53, train_loss: 0.7896, test_loss: 1.0845, test_f1: 0.5997
 epoch: 54, train_loss: 0.7930, test_loss: 1.0787, test_f1: 0.5965
 epoch: 55, train_loss: 0.7841, test_loss: 1.0698, test_f1: 0.6158
 epoch: 56, train_loss: 0.7875, test_loss: 1.1206, test_f1: 0.5973
 epoch: 57, train_loss: 0.7775, test_loss: 1.1120, test_f1: 0.6049
 epoch: 58, train_loss: 0.7856, test_loss: 1.0745, test_f1: 0.5760
 epoch: 59, train_loss: 0.7732, test_loss: 1.1075, test_f1: 0.6001
 epoch: 60, train_loss: 0.7898, test_loss: 1.0904, test_f1: 0.5867
 epoch: 61, train_loss: 0.7739, test_loss: 1.1218, test_f1: 0.6121
 epoch: 62, train_loss: 0.7673, test_loss: 1.1302, test_f1: 0.6029
 epoch: 63, train_loss: 0.7674, test_loss: 1.0990, test_f1: 0.5915
 epoch: 64, train_loss: 0.7577, test_loss: 1.1240, test_f1: 0.6004
 epoch: 65, train_loss: 0.7805, test_loss: 1.1473, test_f1: 0.5836
 epoch: 66, train_loss: 0.7564, test_loss: 1.1179, test_f1: 0.5843
 epoch: 67, train_loss: 0.7622, test_loss: 1.1122, test_f1: 0.5923
 epoch: 68, train_loss: 0.7556, test_loss: 1.1199, test_f1: 0.5923
 epoch: 69, train_loss: 0.7502, test_loss: 1.1268, test_f1: 0.5794
 epoch: 70, train_loss: 0.7389, test_loss: 1.1416, test_f1: 0.5957
 epoch: 71, train_loss: 0.7564, test_loss: 1.1417, test_f1: 0.5852
 epoch: 72, train_loss: 0.7458, test_loss: 1.1309, test_f1: 0.6010
 epoch: 73, train_loss: 0.7590, test_loss: 1.1300, test_f1: 0.5856
 epoch: 74, train_loss: 0.7504, test_loss: 1.1444, test_f1: 0.5830
 epoch: 75, train_loss: 0.7312, test_loss: 1.1224, test_f1: 0.5719
 epoch: 76, train_loss: 0.7584, test_loss: 1.1369, test_f1: 0.5690
 epoch: 77, train_loss: 0.7295, test_loss: 1.1282, test_f1: 0.5825
 epoch: 78, train_loss: 0.7454, test_loss: 1.1923, test_f1: 0.5896
 epoch: 79, train_loss: 0.7408, test_loss: 1.1841, test_f1: 0.5553
 epoch: 80, train_loss: 0.7330, test_loss: 1.1838, test_f1: 0.5623
 epoch: 81, train_loss: 0.7307, test_loss: 1.1789, test_f1: 0.5859
 epoch: 82, train_loss: 0.7289, test_loss: 1.1537, test_f1: 0.5623
 epoch: 83, train_loss: 0.7299, test_loss: 1.1438, test_f1: 0.5730
 epoch: 84, train_loss: 0.7198, test_loss: 1.1415, test_f1: 0.5778
 epoch: 85, train_loss: 0.7382, test_loss: 1.1799, test_f1: 0.5577
 epoch: 86, train_loss: 0.7215, test_loss: 1.1538, test_f1: 0.5779
 epoch: 87, train_loss: 0.7131, test_loss: 1.2018, test_f1: 0.5914
 epoch: 88, train_loss: 0.7312, test_loss: 1.1926, test_f1: 0.5657
 epoch: 89, train_loss: 0.7135, test_loss: 1.2078, test_f1: 0.5748
 epoch: 90, train_loss: 0.7163, test_loss: 1.2057, test_f1: 0.5756
 epoch: 91, train_loss: 0.7112, test_loss: 1.2026, test_f1: 0.5803
 epoch: 92, train_loss: 0.7040, test_loss: 1.2615, test_f1: 0.5835
 epoch: 93, train_loss: 0.7054, test_loss: 1.2278, test_f1: 0.5757
 epoch: 94, train_loss: 0.7255, test_loss: 1.2118, test_f1: 0.5649
 epoch: 95, train_loss: 0.7059, test_loss: 1.2174, test_f1: 0.5980
 epoch: 96, train_loss: 0.7095, test_loss: 1.2323, test_f1: 0.5722
 epoch: 97, train_loss: 0.7098, test_loss: 1.2554, test_f1: 0.5838
 epoch: 98, train_loss: 0.7026, test_loss: 1.2588, test_f1: 0.5888
 epoch: 99, train_loss: 0.6823, test_loss: 1.2265, test_f1: 0.5859
##################ITERATION #8 ****************************************
 epoch: 0, train_loss: 1.3015, test_loss: 1.3068, test_f1: 0.3349
 epoch: 1, train_loss: 1.2254, test_loss: 1.2664, test_f1: 0.4171
 epoch: 2, train_loss: 1.2040, test_loss: 1.2638, test_f1: 0.4367
 epoch: 3, train_loss: 1.1702, test_loss: 1.2531, test_f1: 0.4553
 epoch: 4, train_loss: 1.1470, test_loss: 1.2442, test_f1: 0.4438
 epoch: 5, train_loss: 1.1352, test_loss: 1.2074, test_f1: 0.4664
 epoch: 6, train_loss: 1.1189, test_loss: 1.1977, test_f1: 0.4741
 epoch: 7, train_loss: 1.1147, test_loss: 1.2007, test_f1: 0.4760
 epoch: 8, train_loss: 1.1024, test_loss: 1.1899, test_f1: 0.4896
 epoch: 9, train_loss: 1.0758, test_loss: 1.2053, test_f1: 0.5094
 epoch: 10, train_loss: 1.0714, test_loss: 1.1793, test_f1: 0.5034
 epoch: 11, train_loss: 1.0510, test_loss: 1.2002, test_f1: 0.5086
 epoch: 12, train_loss: 1.0618, test_loss: 1.2089, test_f1: 0.5148
 epoch: 13, train_loss: 1.0419, test_loss: 1.2258, test_f1: 0.5072
 epoch: 14, train_loss: 1.0412, test_loss: 1.2070, test_f1: 0.5153
 epoch: 15, train_loss: 1.0383, test_loss: 1.2196, test_f1: 0.5263
 epoch: 16, train_loss: 1.0448, test_loss: 1.2303, test_f1: 0.5233
 epoch: 17, train_loss: 1.0072, test_loss: 1.2328, test_f1: 0.5214
 epoch: 18, train_loss: 1.0254, test_loss: 1.2091, test_f1: 0.5551
 epoch: 19, train_loss: 1.0071, test_loss: 1.2246, test_f1: 0.5210
 epoch: 20, train_loss: 0.9950, test_loss: 1.2224, test_f1: 0.5404
 epoch: 21, train_loss: 0.9949, test_loss: 1.2499, test_f1: 0.5327
 epoch: 22, train_loss: 0.9682, test_loss: 1.2578, test_f1: 0.5153
 epoch: 23, train_loss: 0.9665, test_loss: 1.2102, test_f1: 0.5426
 epoch: 24, train_loss: 0.9921, test_loss: 1.2237, test_f1: 0.5376
 epoch: 25, train_loss: 0.9479, test_loss: 1.2353, test_f1: 0.5459
 epoch: 26, train_loss: 0.9641, test_loss: 1.2415, test_f1: 0.5075
 epoch: 27, train_loss: 0.9628, test_loss: 1.2234, test_f1: 0.5165
 epoch: 28, train_loss: 0.9534, test_loss: 1.2659, test_f1: 0.4815
 epoch: 29, train_loss: 0.9451, test_loss: 1.2131, test_f1: 0.5309
 epoch: 30, train_loss: 0.9485, test_loss: 1.2444, test_f1: 0.5170
 epoch: 31, train_loss: 0.9405, test_loss: 1.2516, test_f1: 0.5327
 epoch: 32, train_loss: 0.9435, test_loss: 1.2535, test_f1: 0.5162
 epoch: 33, train_loss: 0.9279, test_loss: 1.2477, test_f1: 0.5347
 epoch: 34, train_loss: 0.9229, test_loss: 1.2415, test_f1: 0.5211
 epoch: 35, train_loss: 0.9238, test_loss: 1.2831, test_f1: 0.5150
 epoch: 36, train_loss: 0.9086, test_loss: 1.2791, test_f1: 0.5284
 epoch: 37, train_loss: 0.9074, test_loss: 1.2946, test_f1: 0.5197
 epoch: 38, train_loss: 0.9003, test_loss: 1.2717, test_f1: 0.5189
 epoch: 39, train_loss: 0.8988, test_loss: 1.2752, test_f1: 0.5283
 epoch: 40, train_loss: 0.9007, test_loss: 1.2952, test_f1: 0.5006
 epoch: 41, train_loss: 0.8862, test_loss: 1.3308, test_f1: 0.5057
 epoch: 42, train_loss: 0.9049, test_loss: 1.3261, test_f1: 0.4885
 epoch: 43, train_loss: 0.8944, test_loss: 1.3359, test_f1: 0.5250
 epoch: 44, train_loss: 0.8670, test_loss: 1.3306, test_f1: 0.5234
 epoch: 45, train_loss: 0.8707, test_loss: 1.3292, test_f1: 0.5255
 epoch: 46, train_loss: 0.8648, test_loss: 1.3172, test_f1: 0.5177
 epoch: 47, train_loss: 0.8750, test_loss: 1.3207, test_f1: 0.5057
 epoch: 48, train_loss: 0.8544, test_loss: 1.3075, test_f1: 0.5466
 epoch: 49, train_loss: 0.8747, test_loss: 1.3100, test_f1: 0.5362
 epoch: 50, train_loss: 0.8468, test_loss: 1.3795, test_f1: 0.5197
 epoch: 51, train_loss: 0.8495, test_loss: 1.3745, test_f1: 0.5307
 epoch: 52, train_loss: 0.8599, test_loss: 1.3560, test_f1: 0.5423
 epoch: 53, train_loss: 0.8404, test_loss: 1.3815, test_f1: 0.5470
 epoch: 54, train_loss: 0.8482, test_loss: 1.3819, test_f1: 0.5527
 epoch: 55, train_loss: 0.8535, test_loss: 1.3814, test_f1: 0.5243
 epoch: 56, train_loss: 0.8436, test_loss: 1.3506, test_f1: 0.5220
 epoch: 57, train_loss: 0.8473, test_loss: 1.4112, test_f1: 0.5149
 epoch: 58, train_loss: 0.8547, test_loss: 1.3802, test_f1: 0.5444
 epoch: 59, train_loss: 0.8442, test_loss: 1.4074, test_f1: 0.5482
 epoch: 60, train_loss: 0.8447, test_loss: 1.4212, test_f1: 0.5478
 epoch: 61, train_loss: 0.8244, test_loss: 1.4248, test_f1: 0.5297
 epoch: 62, train_loss: 0.8214, test_loss: 1.4204, test_f1: 0.5609
 epoch: 63, train_loss: 0.8218, test_loss: 1.3582, test_f1: 0.5553
 epoch: 64, train_loss: 0.8409, test_loss: 1.3990, test_f1: 0.5445
 epoch: 65, train_loss: 0.8184, test_loss: 1.3937, test_f1: 0.5344
 epoch: 66, train_loss: 0.8109, test_loss: 1.3936, test_f1: 0.5398
 epoch: 67, train_loss: 0.8273, test_loss: 1.3980, test_f1: 0.5089
 epoch: 68, train_loss: 0.8230, test_loss: 1.3908, test_f1: 0.5292
 epoch: 69, train_loss: 0.8414, test_loss: 1.4151, test_f1: 0.5450
 epoch: 70, train_loss: 0.8145, test_loss: 1.3591, test_f1: 0.5234
 epoch: 71, train_loss: 0.8290, test_loss: 1.4604, test_f1: 0.5507
 epoch: 72, train_loss: 0.8085, test_loss: 1.3986, test_f1: 0.5372
 epoch: 73, train_loss: 0.8129, test_loss: 1.4315, test_f1: 0.5478
 epoch: 74, train_loss: 0.8207, test_loss: 1.4270, test_f1: 0.5372
 epoch: 75, train_loss: 0.8231, test_loss: 1.4166, test_f1: 0.5471
 epoch: 76, train_loss: 0.8106, test_loss: 1.4273, test_f1: 0.5340
 epoch: 77, train_loss: 0.7987, test_loss: 1.4402, test_f1: 0.5187
 epoch: 78, train_loss: 0.8175, test_loss: 1.4255, test_f1: 0.5297
 epoch: 79, train_loss: 0.8056, test_loss: 1.4083, test_f1: 0.5173
 epoch: 80, train_loss: 0.8011, test_loss: 1.4564, test_f1: 0.5559
 epoch: 81, train_loss: 0.7968, test_loss: 1.4982, test_f1: 0.5580
 epoch: 82, train_loss: 0.7949, test_loss: 1.5397, test_f1: 0.5000
 epoch: 83, train_loss: 0.8022, test_loss: 1.5050, test_f1: 0.5549
 epoch: 84, train_loss: 0.8107, test_loss: 1.4743, test_f1: 0.5521
 epoch: 85, train_loss: 0.8043, test_loss: 1.4649, test_f1: 0.5253
 epoch: 86, train_loss: 0.8010, test_loss: 1.4291, test_f1: 0.5298
 epoch: 87, train_loss: 0.7889, test_loss: 1.5285, test_f1: 0.5242
 epoch: 88, train_loss: 0.7788, test_loss: 1.4665, test_f1: 0.5353
 epoch: 89, train_loss: 0.7900, test_loss: 1.5167, test_f1: 0.5092
 epoch: 90, train_loss: 0.7777, test_loss: 1.5351, test_f1: 0.5127
 epoch: 91, train_loss: 0.7844, test_loss: 1.5572, test_f1: 0.5269
 epoch: 92, train_loss: 0.7769, test_loss: 1.5581, test_f1: 0.5171
 epoch: 93, train_loss: 0.7763, test_loss: 1.5349, test_f1: 0.5362
 epoch: 94, train_loss: 0.7985, test_loss: 1.5270, test_f1: 0.5173
 epoch: 95, train_loss: 0.7776, test_loss: 1.5667, test_f1: 0.5230
 epoch: 96, train_loss: 0.7862, test_loss: 1.5190, test_f1: 0.5309
 epoch: 97, train_loss: 0.7658, test_loss: 1.4896, test_f1: 0.5412
 epoch: 98, train_loss: 0.7885, test_loss: 1.5063, test_f1: 0.5274
 epoch: 99, train_loss: 0.7780, test_loss: 1.5493, test_f1: 0.5293
##################ITERATION #9 ****************************************
 epoch: 0, train_loss: 1.3204, test_loss: 1.3125, test_f1: 0.3432
 epoch: 1, train_loss: 1.2300, test_loss: 1.2763, test_f1: 0.3853
 epoch: 2, train_loss: 1.1950, test_loss: 1.2661, test_f1: 0.3974
 epoch: 3, train_loss: 1.1773, test_loss: 1.2255, test_f1: 0.4459
 epoch: 4, train_loss: 1.1505, test_loss: 1.5532, test_f1: 0.4677
 epoch: 5, train_loss: 1.1323, test_loss: 1.6070, test_f1: 0.4878
 epoch: 6, train_loss: 1.1006, test_loss: 1.1808, test_f1: 0.5191
 epoch: 7, train_loss: 1.1015, test_loss: 1.3559, test_f1: 0.5143
 epoch: 8, train_loss: 1.0793, test_loss: 1.7784, test_f1: 0.5231
 epoch: 9, train_loss: 1.0638, test_loss: 1.2399, test_f1: 0.5346
 epoch: 10, train_loss: 1.0521, test_loss: 1.7482, test_f1: 0.5355
 epoch: 11, train_loss: 1.0621, test_loss: 1.1706, test_f1: 0.5544
 epoch: 12, train_loss: 1.0508, test_loss: 1.3603, test_f1: 0.5140
 epoch: 13, train_loss: 1.0531, test_loss: 1.1990, test_f1: 0.5355
 epoch: 14, train_loss: 1.0135, test_loss: 1.2592, test_f1: 0.5333
 epoch: 15, train_loss: 0.9963, test_loss: 1.3093, test_f1: 0.5599
 epoch: 16, train_loss: 0.9958, test_loss: 1.1835, test_f1: 0.5342
 epoch: 17, train_loss: 0.9971, test_loss: 1.1581, test_f1: 0.5440
 epoch: 18, train_loss: 0.9959, test_loss: 1.2430, test_f1: 0.5390
 epoch: 19, train_loss: 0.9854, test_loss: 1.5606, test_f1: 0.5381
 epoch: 20, train_loss: 0.9822, test_loss: 1.2720, test_f1: 0.5416
 epoch: 21, train_loss: 0.9767, test_loss: 1.1938, test_f1: 0.5016
 epoch: 22, train_loss: 0.9706, test_loss: 1.2989, test_f1: 0.5484
 epoch: 23, train_loss: 0.9551, test_loss: 1.3363, test_f1: 0.5510
 epoch: 24, train_loss: 0.9486, test_loss: 1.5789, test_f1: 0.5519
 epoch: 25, train_loss: 0.9461, test_loss: 1.6241, test_f1: 0.5521
 epoch: 26, train_loss: 0.9306, test_loss: 1.4594, test_f1: 0.5490
 epoch: 27, train_loss: 0.9190, test_loss: 1.6468, test_f1: 0.5525
 epoch: 28, train_loss: 0.9148, test_loss: 1.4302, test_f1: 0.5415
 epoch: 29, train_loss: 0.9149, test_loss: 1.6063, test_f1: 0.5614
 epoch: 30, train_loss: 0.9310, test_loss: 1.3838, test_f1: 0.5526
 epoch: 31, train_loss: 0.9186, test_loss: 1.3380, test_f1: 0.5321
 epoch: 32, train_loss: 0.9064, test_loss: 2.3999, test_f1: 0.5052
 epoch: 33, train_loss: 0.8897, test_loss: 1.3628, test_f1: 0.5516
 epoch: 34, train_loss: 0.8619, test_loss: 1.5447, test_f1: 0.5487
 epoch: 35, train_loss: 0.8857, test_loss: 1.6092, test_f1: 0.5432
 epoch: 36, train_loss: 0.8871, test_loss: 1.2164, test_f1: 0.5439
 epoch: 37, train_loss: 0.8858, test_loss: 1.2972, test_f1: 0.5429
 epoch: 38, train_loss: 0.8802, test_loss: 1.2873, test_f1: 0.5606
 epoch: 39, train_loss: 0.8682, test_loss: 1.6267, test_f1: 0.5226
 epoch: 40, train_loss: 0.8683, test_loss: 1.6693, test_f1: 0.5006
 epoch: 41, train_loss: 0.8675, test_loss: 2.0735, test_f1: 0.4936
 epoch: 42, train_loss: 0.8464, test_loss: 1.7475, test_f1: 0.5204
 epoch: 43, train_loss: 0.8634, test_loss: 1.7681, test_f1: 0.5411
 epoch: 44, train_loss: 0.8547, test_loss: 1.2930, test_f1: 0.5108
 epoch: 45, train_loss: 0.8469, test_loss: 1.4707, test_f1: 0.5205
 epoch: 46, train_loss: 0.8189, test_loss: 1.6581, test_f1: 0.5307
 epoch: 47, train_loss: 0.8409, test_loss: 1.7593, test_f1: 0.5433
 epoch: 48, train_loss: 0.8383, test_loss: 1.5404, test_f1: 0.5652
 epoch: 49, train_loss: 0.8173, test_loss: 1.7865, test_f1: 0.5343
 epoch: 50, train_loss: 0.8337, test_loss: 1.2655, test_f1: 0.5465
 epoch: 51, train_loss: 0.8083, test_loss: 1.9008, test_f1: 0.5361
 epoch: 52, train_loss: 0.8098, test_loss: 1.4939, test_f1: 0.5649
 epoch: 53, train_loss: 0.7941, test_loss: 1.7883, test_f1: 0.5518
 epoch: 54, train_loss: 0.8161, test_loss: 1.4139, test_f1: 0.5273
 epoch: 55, train_loss: 0.8123, test_loss: 1.3855, test_f1: 0.5423
 epoch: 56, train_loss: 0.7904, test_loss: 1.6480, test_f1: 0.5547
 epoch: 57, train_loss: 0.7919, test_loss: 1.8534, test_f1: 0.5472
 epoch: 58, train_loss: 0.7786, test_loss: 1.9913, test_f1: 0.5289
 epoch: 59, train_loss: 0.7976, test_loss: 1.4369, test_f1: 0.5405
 epoch: 60, train_loss: 0.8061, test_loss: 1.4890, test_f1: 0.5461
 epoch: 61, train_loss: 0.7943, test_loss: 1.5419, test_f1: 0.5440
 epoch: 62, train_loss: 0.7823, test_loss: 2.0095, test_f1: 0.5452
 epoch: 63, train_loss: 0.7971, test_loss: 1.3207, test_f1: 0.5723
 epoch: 64, train_loss: 0.7894, test_loss: 1.4265, test_f1: 0.5181
 epoch: 65, train_loss: 0.7839, test_loss: 1.7264, test_f1: 0.5512
 epoch: 66, train_loss: 0.7774, test_loss: 1.5279, test_f1: 0.5566
 epoch: 67, train_loss: 0.7583, test_loss: 1.8715, test_f1: 0.5456
 epoch: 68, train_loss: 0.7960, test_loss: 1.5006, test_f1: 0.5424
 epoch: 69, train_loss: 0.7896, test_loss: 1.3874, test_f1: 0.5425
 epoch: 70, train_loss: 0.7792, test_loss: 2.1665, test_f1: 0.5474
 epoch: 71, train_loss: 0.7690, test_loss: 1.4957, test_f1: 0.5601
 epoch: 72, train_loss: 0.7874, test_loss: 2.0159, test_f1: 0.5520
 epoch: 73, train_loss: 0.7819, test_loss: 1.7499, test_f1: 0.5441
 epoch: 74, train_loss: 0.7688, test_loss: 1.6790, test_f1: 0.5381
 epoch: 75, train_loss: 0.7664, test_loss: 2.6428, test_f1: 0.5182
 epoch: 76, train_loss: 0.7706, test_loss: 2.4530, test_f1: 0.5211
 epoch: 77, train_loss: 0.7694, test_loss: 1.6812, test_f1: 0.5454
 epoch: 78, train_loss: 0.7546, test_loss: 1.7011, test_f1: 0.5463
 epoch: 79, train_loss: 0.7506, test_loss: 2.6746, test_f1: 0.5371
 epoch: 80, train_loss: 0.7606, test_loss: 1.7388, test_f1: 0.5374
 epoch: 81, train_loss: 0.7592, test_loss: 2.1707, test_f1: 0.5260
 epoch: 82, train_loss: 0.7584, test_loss: 1.6443, test_f1: 0.5682
 epoch: 83, train_loss: 0.7643, test_loss: 2.2331, test_f1: 0.5350
 epoch: 84, train_loss: 0.7537, test_loss: 1.9115, test_f1: 0.5555
 epoch: 85, train_loss: 0.7560, test_loss: 2.1191, test_f1: 0.5489
 epoch: 86, train_loss: 0.7700, test_loss: 1.6657, test_f1: 0.5255
 epoch: 87, train_loss: 0.7509, test_loss: 1.8431, test_f1: 0.5732
 epoch: 88, train_loss: 0.7497, test_loss: 2.2811, test_f1: 0.5453
 epoch: 89, train_loss: 0.7496, test_loss: 1.9725, test_f1: 0.5492
 epoch: 90, train_loss: 0.7506, test_loss: 1.6865, test_f1: 0.5532
 epoch: 91, train_loss: 0.7408, test_loss: 2.0971, test_f1: 0.5382
 epoch: 92, train_loss: 0.7551, test_loss: 2.1745, test_f1: 0.5421
 epoch: 93, train_loss: 0.7329, test_loss: 1.7240, test_f1: 0.5700
 epoch: 94, train_loss: 0.7418, test_loss: 1.5989, test_f1: 0.5621
 epoch: 95, train_loss: 0.7321, test_loss: 1.9046, test_f1: 0.5569
 epoch: 96, train_loss: 0.7417, test_loss: 1.3911, test_f1: 0.5383
 epoch: 97, train_loss: 0.7423, test_loss: 1.9038, test_f1: 0.5349
 epoch: 98, train_loss: 0.7438, test_loss: 2.1608, test_f1: 0.5385
 epoch: 99, train_loss: 0.7175, test_loss: 1.5155, test_f1: 0.5407

Training completed in 496.84 seconds
Best F1: 0.6350 at epoch 89
Mean F1 across iterations: 0.5835  0.0256
========================FINAL RESULTS================================
FEGIN weighted F1: 0.6350  0.0256
python main.py --data ltspice_demos --representation component_component --model FEGIN --layers 2 --hiddens 64 --batch_size 32 --lr 0.0001 --emb_size 128 --epochs 100 --save_appendix component_component_L2_H64_BS32_LR0.0001_E128 --no_val
-----



STDERR:
  File "main.py", line 370, in <module>
    main()
  File "main.py", line 254, in main
    dataset = dataset_class(
  File "/home/philip/projects/ltspice_examples_code_repo/Circuit-Completion-Using-GNNs/component_classification_with_link_prediction_head/evaluation/FEGIN/kernel/circuit_datasets.py", line 15, in __init__
    self.data, self.slices = torch.load(self.processed_paths[0])
  File "/home/philip/.local/lib/python3.8/site-packages/torch/serialization.py", line 1040, in load
    warnings.warn(
  File "/usr/lib/python3.8/warnings.py", line 109, in _showwarnmsg
    sw(msg.message, msg.category, msg.filename, msg.lineno,
  File "main.py", line 47, in warn_with_traceback
    traceback.print_stack(file=log)
/home/philip/projects/ltspice_examples_code_repo/Circuit-Completion-Using-GNNs/component_classification_with_link_prediction_head/evaluation/FEGIN/kernel/circuit_datasets.py:15: FutureWarning: You are using `torch.load` with `weights_only=False` (the current default value), which uses the default pickle module implicitly. It is possible to construct malicious pickle data which will execute arbitrary code during unpickling (See https://github.com/pytorch/pytorch/blob/main/SECURITY.md#untrusted-models for more details). In a future release, the default value for `weights_only` will be flipped to `True`. This limits the functions that could be executed during unpickling. Arbitrary objects will no longer be allowed to be loaded via this mode unless they are explicitly allowlisted by the user via `torch.serialization.add_safe_globals`. We recommend you start setting `weights_only=True` for any use case where you don't have full control of the loaded file. Please open an issue on GitHub for any issues related to this experimental feature.
  self.data, self.slices = torch.load(self.processed_paths[0])
