STDOUT:
Results will be saved in /home/philip/projects/ltspice_examples_code_repo/Circuit-Completion-Using-GNNs/component_classification_with_link_prediction_head/evaluation/FEGIN/results/model_FEGIN_dataset_ltspice_demos
Command line input: python main.py --data ltspice_demos --representation component_net --model FEGIN --layers 2 --hiddens 64 --batch_size 64 --lr 0.0001 --emb_size 128 --epochs 100 --save_appendix component_net_L2_H64_BS64_LR0.0001_E128 --no_val
 is saved.
-----
ltspice_demos - FEGIN
Using 2 layers, 64 hidden units, h = 2
Loading component_net representation dataset
ENTERED
Training FEGIN on component_net representation
Train: 1565, Test: 383
##################ITERATION #0 ****************************************
 epoch: 0, train_loss: 1.3706, test_loss: 1.3641, test_f1: 0.2281
 epoch: 1, train_loss: 1.3594, test_loss: 1.3595, test_f1: 0.2281
 epoch: 2, train_loss: 1.3531, test_loss: 1.3543, test_f1: 0.2281
 epoch: 3, train_loss: 1.3457, test_loss: 1.3491, test_f1: 0.2281
 epoch: 4, train_loss: 1.3373, test_loss: 1.3428, test_f1: 0.2281
 epoch: 5, train_loss: 1.3277, test_loss: 1.3358, test_f1: 0.2281
 epoch: 6, train_loss: 1.3146, test_loss: 1.3270, test_f1: 0.2281
 epoch: 7, train_loss: 1.2989, test_loss: 1.3169, test_f1: 0.2281
 epoch: 8, train_loss: 1.2836, test_loss: 1.3045, test_f1: 0.2674
 epoch: 9, train_loss: 1.2626, test_loss: 1.2913, test_f1: 0.2720
 epoch: 10, train_loss: 1.2430, test_loss: 1.2775, test_f1: 0.2720
 epoch: 11, train_loss: 1.2220, test_loss: 1.2629, test_f1: 0.2720
 epoch: 12, train_loss: 1.2066, test_loss: 1.2506, test_f1: 0.2912
 epoch: 13, train_loss: 1.1854, test_loss: 1.2395, test_f1: 0.3258
 epoch: 14, train_loss: 1.1736, test_loss: 1.2286, test_f1: 0.3256
 epoch: 15, train_loss: 1.1602, test_loss: 1.2198, test_f1: 0.3309
 epoch: 16, train_loss: 1.1470, test_loss: 1.2117, test_f1: 0.3368
 epoch: 17, train_loss: 1.1368, test_loss: 1.2048, test_f1: 0.3436
 epoch: 18, train_loss: 1.1251, test_loss: 1.1964, test_f1: 0.3494
 epoch: 19, train_loss: 1.1135, test_loss: 1.1885, test_f1: 0.3546
 epoch: 20, train_loss: 1.0985, test_loss: 1.1843, test_f1: 0.3686
 epoch: 21, train_loss: 1.0934, test_loss: 1.1791, test_f1: 0.3783
 epoch: 22, train_loss: 1.0840, test_loss: 1.1735, test_f1: 0.3825
 epoch: 23, train_loss: 1.0766, test_loss: 1.1645, test_f1: 0.3860
 epoch: 24, train_loss: 1.0645, test_loss: 1.1640, test_f1: 0.3913
 epoch: 25, train_loss: 1.0664, test_loss: 1.1544, test_f1: 0.3948
 epoch: 26, train_loss: 1.0490, test_loss: 1.1556, test_f1: 0.3991
 epoch: 27, train_loss: 1.0483, test_loss: 1.1416, test_f1: 0.3928
 epoch: 28, train_loss: 1.0350, test_loss: 1.1443, test_f1: 0.4026
 epoch: 29, train_loss: 1.0339, test_loss: 1.1425, test_f1: 0.4100
 epoch: 30, train_loss: 1.0286, test_loss: 1.1328, test_f1: 0.4266
 epoch: 31, train_loss: 1.0209, test_loss: 1.1298, test_f1: 0.4186
 epoch: 32, train_loss: 1.0114, test_loss: 1.1277, test_f1: 0.4184
 epoch: 33, train_loss: 1.0039, test_loss: 1.1244, test_f1: 0.4354
 epoch: 34, train_loss: 1.0074, test_loss: 1.1162, test_f1: 0.4282
 epoch: 35, train_loss: 1.0002, test_loss: 1.1132, test_f1: 0.4597
 epoch: 36, train_loss: 0.9943, test_loss: 1.1152, test_f1: 0.4534
 epoch: 37, train_loss: 0.9844, test_loss: 1.1048, test_f1: 0.4522
 epoch: 38, train_loss: 0.9869, test_loss: 1.1055, test_f1: 0.4664
 epoch: 39, train_loss: 0.9725, test_loss: 1.1191, test_f1: 0.4603
 epoch: 40, train_loss: 0.9700, test_loss: 1.1018, test_f1: 0.4593
 epoch: 41, train_loss: 0.9656, test_loss: 1.1002, test_f1: 0.4625
 epoch: 42, train_loss: 0.9653, test_loss: 1.0913, test_f1: 0.4674
 epoch: 43, train_loss: 0.9517, test_loss: 1.1071, test_f1: 0.4673
 epoch: 44, train_loss: 0.9589, test_loss: 1.0958, test_f1: 0.4605
 epoch: 45, train_loss: 0.9526, test_loss: 1.0819, test_f1: 0.4645
 epoch: 46, train_loss: 0.9421, test_loss: 1.0952, test_f1: 0.4662
 epoch: 47, train_loss: 0.9423, test_loss: 1.0928, test_f1: 0.4792
 epoch: 48, train_loss: 0.9356, test_loss: 1.0899, test_f1: 0.4779
 epoch: 49, train_loss: 0.9340, test_loss: 1.0912, test_f1: 0.4645
 epoch: 50, train_loss: 0.9263, test_loss: 1.0906, test_f1: 0.4787
 epoch: 51, train_loss: 0.9236, test_loss: 1.0803, test_f1: 0.4752
 epoch: 52, train_loss: 0.9203, test_loss: 1.0854, test_f1: 0.4783
 epoch: 53, train_loss: 0.9315, test_loss: 1.0936, test_f1: 0.4771
 epoch: 54, train_loss: 0.9206, test_loss: 1.0768, test_f1: 0.4806
 epoch: 55, train_loss: 0.9197, test_loss: 1.0817, test_f1: 0.4831
 epoch: 56, train_loss: 0.9166, test_loss: 1.0722, test_f1: 0.4780
 epoch: 57, train_loss: 0.9207, test_loss: 1.0731, test_f1: 0.4811
 epoch: 58, train_loss: 0.9082, test_loss: 1.0840, test_f1: 0.4790
 epoch: 59, train_loss: 0.9050, test_loss: 1.0793, test_f1: 0.4911
 epoch: 60, train_loss: 0.9114, test_loss: 1.0655, test_f1: 0.4997
 epoch: 61, train_loss: 0.9041, test_loss: 1.0759, test_f1: 0.5000
 epoch: 62, train_loss: 0.9163, test_loss: 1.0749, test_f1: 0.4948
 epoch: 63, train_loss: 0.8960, test_loss: 1.0819, test_f1: 0.4957
 epoch: 64, train_loss: 0.9022, test_loss: 1.0808, test_f1: 0.4908
 epoch: 65, train_loss: 0.9011, test_loss: 1.0815, test_f1: 0.4901
 epoch: 66, train_loss: 0.8937, test_loss: 1.0894, test_f1: 0.5021
 epoch: 67, train_loss: 0.8990, test_loss: 1.0968, test_f1: 0.4897
 epoch: 68, train_loss: 0.8980, test_loss: 1.0847, test_f1: 0.4951
 epoch: 69, train_loss: 0.8933, test_loss: 1.0832, test_f1: 0.5000
 epoch: 70, train_loss: 0.8949, test_loss: 1.0751, test_f1: 0.5072
 epoch: 71, train_loss: 0.8973, test_loss: 1.0841, test_f1: 0.5028
 epoch: 72, train_loss: 0.8911, test_loss: 1.0990, test_f1: 0.4959
 epoch: 73, train_loss: 0.8910, test_loss: 1.0982, test_f1: 0.4930
 epoch: 74, train_loss: 0.8833, test_loss: 1.0835, test_f1: 0.5008
 epoch: 75, train_loss: 0.8900, test_loss: 1.0908, test_f1: 0.4986
 epoch: 76, train_loss: 0.8898, test_loss: 1.0842, test_f1: 0.4965
 epoch: 77, train_loss: 0.8923, test_loss: 1.0790, test_f1: 0.5072
 epoch: 78, train_loss: 0.8907, test_loss: 1.0902, test_f1: 0.5102
 epoch: 79, train_loss: 0.8914, test_loss: 1.0843, test_f1: 0.5077
 epoch: 80, train_loss: 0.8797, test_loss: 1.1030, test_f1: 0.5224
 epoch: 81, train_loss: 0.8806, test_loss: 1.0890, test_f1: 0.4990
 epoch: 82, train_loss: 0.8804, test_loss: 1.0971, test_f1: 0.5027
 epoch: 83, train_loss: 0.8733, test_loss: 1.0909, test_f1: 0.5124
 epoch: 84, train_loss: 0.8718, test_loss: 1.0961, test_f1: 0.5037
 epoch: 85, train_loss: 0.8687, test_loss: 1.0811, test_f1: 0.5043
 epoch: 86, train_loss: 0.8720, test_loss: 1.0946, test_f1: 0.5056
 epoch: 87, train_loss: 0.8760, test_loss: 1.0923, test_f1: 0.5128
 epoch: 88, train_loss: 0.8789, test_loss: 1.0940, test_f1: 0.5099
 epoch: 89, train_loss: 0.8688, test_loss: 1.0988, test_f1: 0.5073
 epoch: 90, train_loss: 0.8762, test_loss: 1.1030, test_f1: 0.5110
 epoch: 91, train_loss: 0.8571, test_loss: 1.0911, test_f1: 0.5214
 epoch: 92, train_loss: 0.8600, test_loss: 1.1024, test_f1: 0.5078
 epoch: 93, train_loss: 0.8745, test_loss: 1.1057, test_f1: 0.5100
 epoch: 94, train_loss: 0.8561, test_loss: 1.1127, test_f1: 0.5076
 epoch: 95, train_loss: 0.8705, test_loss: 1.1073, test_f1: 0.5076
 epoch: 96, train_loss: 0.8624, test_loss: 1.1067, test_f1: 0.5272
 epoch: 97, train_loss: 0.8569, test_loss: 1.0921, test_f1: 0.5135
 epoch: 98, train_loss: 0.8542, test_loss: 1.0893, test_f1: 0.5244
 epoch: 99, train_loss: 0.8486, test_loss: 1.1008, test_f1: 0.5314
##################ITERATION #1 ****************************************
 epoch: 0, train_loss: 1.3116, test_loss: 1.3316, test_f1: 0.2281
 epoch: 1, train_loss: 1.2715, test_loss: 1.3150, test_f1: 0.2281
 epoch: 2, train_loss: 1.2510, test_loss: 1.2921, test_f1: 0.2281
 epoch: 3, train_loss: 1.2263, test_loss: 1.2741, test_f1: 0.2639
 epoch: 4, train_loss: 1.2039, test_loss: 1.2608, test_f1: 0.2744
 epoch: 5, train_loss: 1.1881, test_loss: 1.2476, test_f1: 0.2796
 epoch: 6, train_loss: 1.1736, test_loss: 1.2386, test_f1: 0.2784
 epoch: 7, train_loss: 1.1593, test_loss: 1.2263, test_f1: 0.2861
 epoch: 8, train_loss: 1.1416, test_loss: 1.2146, test_f1: 0.3102
 epoch: 9, train_loss: 1.1231, test_loss: 1.2026, test_f1: 0.3631
 epoch: 10, train_loss: 1.1162, test_loss: 1.1926, test_f1: 0.3788
 epoch: 11, train_loss: 1.1001, test_loss: 1.1803, test_f1: 0.3790
 epoch: 12, train_loss: 1.0918, test_loss: 1.1698, test_f1: 0.3861
 epoch: 13, train_loss: 1.0829, test_loss: 1.1651, test_f1: 0.3937
 epoch: 14, train_loss: 1.0752, test_loss: 1.1605, test_f1: 0.4166
 epoch: 15, train_loss: 1.0644, test_loss: 1.1528, test_f1: 0.4033
 epoch: 16, train_loss: 1.0517, test_loss: 1.1444, test_f1: 0.4109
 epoch: 17, train_loss: 1.0428, test_loss: 1.1386, test_f1: 0.4218
 epoch: 18, train_loss: 1.0326, test_loss: 1.1305, test_f1: 0.4142
 epoch: 19, train_loss: 1.0274, test_loss: 1.1228, test_f1: 0.4144
 epoch: 20, train_loss: 1.0224, test_loss: 1.1235, test_f1: 0.4197
 epoch: 21, train_loss: 1.0111, test_loss: 1.1083, test_f1: 0.4172
 epoch: 22, train_loss: 1.0131, test_loss: 1.1058, test_f1: 0.4190
 epoch: 23, train_loss: 0.9931, test_loss: 1.1107, test_f1: 0.4267
 epoch: 24, train_loss: 0.9992, test_loss: 1.0915, test_f1: 0.4195
 epoch: 25, train_loss: 0.9898, test_loss: 1.0932, test_f1: 0.4392
 epoch: 26, train_loss: 0.9811, test_loss: 1.0914, test_f1: 0.4337
 epoch: 27, train_loss: 0.9674, test_loss: 1.0818, test_f1: 0.4562
 epoch: 28, train_loss: 0.9660, test_loss: 1.0757, test_f1: 0.4604
 epoch: 29, train_loss: 0.9609, test_loss: 1.0814, test_f1: 0.4645
 epoch: 30, train_loss: 0.9623, test_loss: 1.0715, test_f1: 0.4808
 epoch: 31, train_loss: 0.9547, test_loss: 1.0601, test_f1: 0.4893
 epoch: 32, train_loss: 0.9517, test_loss: 1.0581, test_f1: 0.4873
 epoch: 33, train_loss: 0.9418, test_loss: 1.0667, test_f1: 0.5099
 epoch: 34, train_loss: 0.9413, test_loss: 1.0508, test_f1: 0.4886
 epoch: 35, train_loss: 0.9335, test_loss: 1.0674, test_f1: 0.4953
 epoch: 36, train_loss: 0.9292, test_loss: 1.0445, test_f1: 0.4938
 epoch: 37, train_loss: 0.9251, test_loss: 1.0658, test_f1: 0.5151
 epoch: 38, train_loss: 0.9229, test_loss: 1.0570, test_f1: 0.5123
 epoch: 39, train_loss: 0.9192, test_loss: 1.0554, test_f1: 0.4936
 epoch: 40, train_loss: 0.9223, test_loss: 1.0496, test_f1: 0.5022
 epoch: 41, train_loss: 0.9135, test_loss: 1.0513, test_f1: 0.4986
 epoch: 42, train_loss: 0.9036, test_loss: 1.0550, test_f1: 0.5002
 epoch: 43, train_loss: 0.9033, test_loss: 1.0465, test_f1: 0.5263
 epoch: 44, train_loss: 0.9021, test_loss: 1.0649, test_f1: 0.5059
 epoch: 45, train_loss: 0.8983, test_loss: 1.0528, test_f1: 0.5219
 epoch: 46, train_loss: 0.8954, test_loss: 1.0525, test_f1: 0.5222
 epoch: 47, train_loss: 0.8882, test_loss: 1.0420, test_f1: 0.5218
 epoch: 48, train_loss: 0.8816, test_loss: 1.0462, test_f1: 0.5343
 epoch: 49, train_loss: 0.8962, test_loss: 1.0537, test_f1: 0.5183
 epoch: 50, train_loss: 0.8872, test_loss: 1.0671, test_f1: 0.5429
 epoch: 51, train_loss: 0.8853, test_loss: 1.0571, test_f1: 0.5415
 epoch: 52, train_loss: 0.8786, test_loss: 1.0610, test_f1: 0.5487
 epoch: 53, train_loss: 0.8706, test_loss: 1.0563, test_f1: 0.5503
 epoch: 54, train_loss: 0.8856, test_loss: 1.0606, test_f1: 0.5447
 epoch: 55, train_loss: 0.8778, test_loss: 1.0655, test_f1: 0.5438
 epoch: 56, train_loss: 0.8800, test_loss: 1.0670, test_f1: 0.5434
 epoch: 57, train_loss: 0.8730, test_loss: 1.0629, test_f1: 0.5397
 epoch: 58, train_loss: 0.8666, test_loss: 1.0577, test_f1: 0.5480
 epoch: 59, train_loss: 0.8640, test_loss: 1.0704, test_f1: 0.5530
 epoch: 60, train_loss: 0.8723, test_loss: 1.0587, test_f1: 0.5451
 epoch: 61, train_loss: 0.8657, test_loss: 1.0545, test_f1: 0.5535
 epoch: 62, train_loss: 0.8604, test_loss: 1.0646, test_f1: 0.5480
 epoch: 63, train_loss: 0.8544, test_loss: 1.0598, test_f1: 0.5403
 epoch: 64, train_loss: 0.8733, test_loss: 1.0687, test_f1: 0.5496
 epoch: 65, train_loss: 0.8601, test_loss: 1.0648, test_f1: 0.5479
 epoch: 66, train_loss: 0.8661, test_loss: 1.0644, test_f1: 0.5592
 epoch: 67, train_loss: 0.8702, test_loss: 1.0589, test_f1: 0.5511
 epoch: 68, train_loss: 0.8604, test_loss: 1.0589, test_f1: 0.5572
 epoch: 69, train_loss: 0.8634, test_loss: 1.0565, test_f1: 0.5468
 epoch: 70, train_loss: 0.8611, test_loss: 1.0657, test_f1: 0.5543
 epoch: 71, train_loss: 0.8583, test_loss: 1.0592, test_f1: 0.5456
 epoch: 72, train_loss: 0.8562, test_loss: 1.0650, test_f1: 0.5479
 epoch: 73, train_loss: 0.8557, test_loss: 1.0828, test_f1: 0.5568
 epoch: 74, train_loss: 0.8580, test_loss: 1.0485, test_f1: 0.5487
 epoch: 75, train_loss: 0.8534, test_loss: 1.0675, test_f1: 0.5533
 epoch: 76, train_loss: 0.8663, test_loss: 1.0761, test_f1: 0.5566
 epoch: 77, train_loss: 0.8589, test_loss: 1.0830, test_f1: 0.5523
 epoch: 78, train_loss: 0.8497, test_loss: 1.0708, test_f1: 0.5430
 epoch: 79, train_loss: 0.8465, test_loss: 1.0679, test_f1: 0.5656
 epoch: 80, train_loss: 0.8574, test_loss: 1.0674, test_f1: 0.5457
 epoch: 81, train_loss: 0.8493, test_loss: 1.0774, test_f1: 0.5725
 epoch: 82, train_loss: 0.8514, test_loss: 1.0589, test_f1: 0.5656
 epoch: 83, train_loss: 0.8417, test_loss: 1.0665, test_f1: 0.5639
 epoch: 84, train_loss: 0.8467, test_loss: 1.0787, test_f1: 0.5463
 epoch: 85, train_loss: 0.8412, test_loss: 1.0740, test_f1: 0.5630
 epoch: 86, train_loss: 0.8467, test_loss: 1.0572, test_f1: 0.5656
 epoch: 87, train_loss: 0.8392, test_loss: 1.0748, test_f1: 0.5570
 epoch: 88, train_loss: 0.8451, test_loss: 1.0783, test_f1: 0.5567
 epoch: 89, train_loss: 0.8442, test_loss: 1.0806, test_f1: 0.5552
 epoch: 90, train_loss: 0.8379, test_loss: 1.0723, test_f1: 0.5469
 epoch: 91, train_loss: 0.8330, test_loss: 1.0765, test_f1: 0.5553
 epoch: 92, train_loss: 0.8358, test_loss: 1.0814, test_f1: 0.5594
 epoch: 93, train_loss: 0.8435, test_loss: 1.0744, test_f1: 0.5718
 epoch: 94, train_loss: 0.8320, test_loss: 1.0829, test_f1: 0.5615
 epoch: 95, train_loss: 0.8367, test_loss: 1.0740, test_f1: 0.5546
 epoch: 96, train_loss: 0.8272, test_loss: 1.0697, test_f1: 0.5644
 epoch: 97, train_loss: 0.8303, test_loss: 1.0916, test_f1: 0.5609
 epoch: 98, train_loss: 0.8198, test_loss: 1.0754, test_f1: 0.5665
 epoch: 99, train_loss: 0.8234, test_loss: 1.0679, test_f1: 0.5616
##################ITERATION #2 ****************************************
 epoch: 0, train_loss: 1.3063, test_loss: 1.3207, test_f1: 0.2281
 epoch: 1, train_loss: 1.2415, test_loss: 1.2868, test_f1: 0.2281
 epoch: 2, train_loss: 1.2151, test_loss: 1.2571, test_f1: 0.2336
 epoch: 3, train_loss: 1.1915, test_loss: 1.2361, test_f1: 0.2390
 epoch: 4, train_loss: 1.1654, test_loss: 1.2200, test_f1: 0.2857
 epoch: 5, train_loss: 1.1454, test_loss: 1.2042, test_f1: 0.3063
 epoch: 6, train_loss: 1.1267, test_loss: 1.1904, test_f1: 0.3495
 epoch: 7, train_loss: 1.1096, test_loss: 1.1817, test_f1: 0.3396
 epoch: 8, train_loss: 1.0959, test_loss: 1.1704, test_f1: 0.3508
 epoch: 9, train_loss: 1.0847, test_loss: 1.1636, test_f1: 0.3535
 epoch: 10, train_loss: 1.0693, test_loss: 1.1591, test_f1: 0.3517
 epoch: 11, train_loss: 1.0697, test_loss: 1.1523, test_f1: 0.3539
 epoch: 12, train_loss: 1.0588, test_loss: 1.1496, test_f1: 0.3522
 epoch: 13, train_loss: 1.0453, test_loss: 1.1437, test_f1: 0.3519
 epoch: 14, train_loss: 1.0355, test_loss: 1.1349, test_f1: 0.3521
 epoch: 15, train_loss: 1.0385, test_loss: 1.1283, test_f1: 0.3600
 epoch: 16, train_loss: 1.0367, test_loss: 1.1279, test_f1: 0.3579
 epoch: 17, train_loss: 1.0168, test_loss: 1.1274, test_f1: 0.3712
 epoch: 18, train_loss: 1.0140, test_loss: 1.1263, test_f1: 0.4299
 epoch: 19, train_loss: 1.0152, test_loss: 1.1174, test_f1: 0.4306
 epoch: 20, train_loss: 1.0174, test_loss: 1.1129, test_f1: 0.4345
 epoch: 21, train_loss: 1.0018, test_loss: 1.1073, test_f1: 0.4296
 epoch: 22, train_loss: 1.0020, test_loss: 1.1125, test_f1: 0.3887
 epoch: 23, train_loss: 0.9875, test_loss: 1.0976, test_f1: 0.4428
 epoch: 24, train_loss: 0.9820, test_loss: 1.1039, test_f1: 0.4563
 epoch: 25, train_loss: 0.9830, test_loss: 1.0894, test_f1: 0.4587
 epoch: 26, train_loss: 0.9699, test_loss: 1.0842, test_f1: 0.4608
 epoch: 27, train_loss: 0.9614, test_loss: 1.0889, test_f1: 0.4594
 epoch: 28, train_loss: 0.9658, test_loss: 1.0820, test_f1: 0.4906
 epoch: 29, train_loss: 0.9653, test_loss: 1.0785, test_f1: 0.4912
 epoch: 30, train_loss: 0.9521, test_loss: 1.0752, test_f1: 0.4851
 epoch: 31, train_loss: 0.9538, test_loss: 1.0714, test_f1: 0.4699
 epoch: 32, train_loss: 0.9489, test_loss: 1.0655, test_f1: 0.4722
 epoch: 33, train_loss: 0.9499, test_loss: 1.0620, test_f1: 0.4868
 epoch: 34, train_loss: 0.9350, test_loss: 1.0667, test_f1: 0.4803
 epoch: 35, train_loss: 0.9292, test_loss: 1.0724, test_f1: 0.4966
 epoch: 36, train_loss: 0.9301, test_loss: 1.0602, test_f1: 0.4891
 epoch: 37, train_loss: 0.9094, test_loss: 1.0653, test_f1: 0.5002
 epoch: 38, train_loss: 0.9239, test_loss: 1.0593, test_f1: 0.5136
 epoch: 39, train_loss: 0.9205, test_loss: 1.0738, test_f1: 0.4979
 epoch: 40, train_loss: 0.9141, test_loss: 1.0637, test_f1: 0.5141
 epoch: 41, train_loss: 0.9116, test_loss: 1.0840, test_f1: 0.5322
 epoch: 42, train_loss: 0.9085, test_loss: 1.0659, test_f1: 0.5177
 epoch: 43, train_loss: 0.9037, test_loss: 1.0734, test_f1: 0.5319
 epoch: 44, train_loss: 0.9037, test_loss: 1.0852, test_f1: 0.5279
 epoch: 45, train_loss: 0.8860, test_loss: 1.0699, test_f1: 0.5310
 epoch: 46, train_loss: 0.8947, test_loss: 1.0699, test_f1: 0.5188
 epoch: 47, train_loss: 0.8851, test_loss: 1.0739, test_f1: 0.5237
 epoch: 48, train_loss: 0.8973, test_loss: 1.0756, test_f1: 0.5065
 epoch: 49, train_loss: 0.8849, test_loss: 1.0872, test_f1: 0.5278
 epoch: 50, train_loss: 0.8821, test_loss: 1.0988, test_f1: 0.5167
 epoch: 51, train_loss: 0.8811, test_loss: 1.0805, test_f1: 0.5000
 epoch: 52, train_loss: 0.8764, test_loss: 1.0835, test_f1: 0.5113
 epoch: 53, train_loss: 0.8770, test_loss: 1.0830, test_f1: 0.5105
 epoch: 54, train_loss: 0.8688, test_loss: 1.0987, test_f1: 0.5030
 epoch: 55, train_loss: 0.8638, test_loss: 1.0946, test_f1: 0.5053
 epoch: 56, train_loss: 0.8642, test_loss: 1.0852, test_f1: 0.5083
 epoch: 57, train_loss: 0.8642, test_loss: 1.0923, test_f1: 0.5029
 epoch: 58, train_loss: 0.8643, test_loss: 1.0976, test_f1: 0.5104
 epoch: 59, train_loss: 0.8634, test_loss: 1.1057, test_f1: 0.5145
 epoch: 60, train_loss: 0.8655, test_loss: 1.0932, test_f1: 0.5160
 epoch: 61, train_loss: 0.8703, test_loss: 1.1005, test_f1: 0.5066
 epoch: 62, train_loss: 0.8587, test_loss: 1.0985, test_f1: 0.5090
 epoch: 63, train_loss: 0.8630, test_loss: 1.1085, test_f1: 0.5035
 epoch: 64, train_loss: 0.8498, test_loss: 1.1181, test_f1: 0.5254
 epoch: 65, train_loss: 0.8636, test_loss: 1.1057, test_f1: 0.5015
 epoch: 66, train_loss: 0.8642, test_loss: 1.1120, test_f1: 0.5018
 epoch: 67, train_loss: 0.8515, test_loss: 1.1138, test_f1: 0.5168
 epoch: 68, train_loss: 0.8597, test_loss: 1.1127, test_f1: 0.5258
 epoch: 69, train_loss: 0.8466, test_loss: 1.1175, test_f1: 0.5155
 epoch: 70, train_loss: 0.8614, test_loss: 1.1192, test_f1: 0.5145
 epoch: 71, train_loss: 0.8422, test_loss: 1.1152, test_f1: 0.5404
 epoch: 72, train_loss: 0.8446, test_loss: 1.1109, test_f1: 0.5230
 epoch: 73, train_loss: 0.8465, test_loss: 1.1087, test_f1: 0.5285
 epoch: 74, train_loss: 0.8394, test_loss: 1.1149, test_f1: 0.5336
 epoch: 75, train_loss: 0.8458, test_loss: 1.1317, test_f1: 0.5284
 epoch: 76, train_loss: 0.8417, test_loss: 1.1325, test_f1: 0.5349
 epoch: 77, train_loss: 0.8362, test_loss: 1.1082, test_f1: 0.5390
 epoch: 78, train_loss: 0.8377, test_loss: 1.1128, test_f1: 0.5342
 epoch: 79, train_loss: 0.8420, test_loss: 1.1131, test_f1: 0.5285
 epoch: 80, train_loss: 0.8479, test_loss: 1.1182, test_f1: 0.5377
 epoch: 81, train_loss: 0.8467, test_loss: 1.1429, test_f1: 0.5202
 epoch: 82, train_loss: 0.8381, test_loss: 1.1349, test_f1: 0.5281
 epoch: 83, train_loss: 0.8411, test_loss: 1.1465, test_f1: 0.5433
 epoch: 84, train_loss: 0.8257, test_loss: 1.1443, test_f1: 0.5203
 epoch: 85, train_loss: 0.8299, test_loss: 1.1308, test_f1: 0.5303
 epoch: 86, train_loss: 0.8372, test_loss: 1.1238, test_f1: 0.5471
 epoch: 87, train_loss: 0.8303, test_loss: 1.1212, test_f1: 0.5279
 epoch: 88, train_loss: 0.8282, test_loss: 1.1324, test_f1: 0.5438
 epoch: 89, train_loss: 0.8273, test_loss: 1.1369, test_f1: 0.5438
 epoch: 90, train_loss: 0.8381, test_loss: 1.1365, test_f1: 0.5272
 epoch: 91, train_loss: 0.8256, test_loss: 1.1427, test_f1: 0.5414
 epoch: 92, train_loss: 0.8213, test_loss: 1.1276, test_f1: 0.5419
 epoch: 93, train_loss: 0.8299, test_loss: 1.1553, test_f1: 0.5312
 epoch: 94, train_loss: 0.8286, test_loss: 1.1317, test_f1: 0.5387
 epoch: 95, train_loss: 0.8181, test_loss: 1.1325, test_f1: 0.5317
 epoch: 96, train_loss: 0.8298, test_loss: 1.1507, test_f1: 0.5384
 epoch: 97, train_loss: 0.8225, test_loss: 1.1472, test_f1: 0.5354
 epoch: 98, train_loss: 0.8219, test_loss: 1.1597, test_f1: 0.5317
 epoch: 99, train_loss: 0.8169, test_loss: 1.1427, test_f1: 0.5332
##################ITERATION #3 ****************************************
 epoch: 0, train_loss: 1.2541, test_loss: 1.3012, test_f1: 0.2281
 epoch: 1, train_loss: 1.1983, test_loss: 1.2798, test_f1: 0.2281
 epoch: 2, train_loss: 1.1703, test_loss: 1.2514, test_f1: 0.2744
 epoch: 3, train_loss: 1.1505, test_loss: 1.2241, test_f1: 0.3117
 epoch: 4, train_loss: 1.1287, test_loss: 1.2107, test_f1: 0.3339
 epoch: 5, train_loss: 1.1220, test_loss: 1.2009, test_f1: 0.3414
 epoch: 6, train_loss: 1.1105, test_loss: 1.1913, test_f1: 0.3948
 epoch: 7, train_loss: 1.0956, test_loss: 1.1831, test_f1: 0.4087
 epoch: 8, train_loss: 1.0867, test_loss: 1.1770, test_f1: 0.4164
 epoch: 9, train_loss: 1.0826, test_loss: 1.1686, test_f1: 0.4104
 epoch: 10, train_loss: 1.0729, test_loss: 1.1624, test_f1: 0.4126
 epoch: 11, train_loss: 1.0650, test_loss: 1.1579, test_f1: 0.4125
 epoch: 12, train_loss: 1.0572, test_loss: 1.1487, test_f1: 0.4183
 epoch: 13, train_loss: 1.0552, test_loss: 1.1460, test_f1: 0.4132
 epoch: 14, train_loss: 1.0411, test_loss: 1.1409, test_f1: 0.4260
 epoch: 15, train_loss: 1.0299, test_loss: 1.1352, test_f1: 0.4411
 epoch: 16, train_loss: 1.0334, test_loss: 1.1247, test_f1: 0.4300
 epoch: 17, train_loss: 1.0269, test_loss: 1.1287, test_f1: 0.4688
 epoch: 18, train_loss: 1.0132, test_loss: 1.1212, test_f1: 0.4724
 epoch: 19, train_loss: 1.0183, test_loss: 1.1208, test_f1: 0.4755
 epoch: 20, train_loss: 1.0000, test_loss: 1.1116, test_f1: 0.4806
 epoch: 21, train_loss: 0.9935, test_loss: 1.1165, test_f1: 0.4870
 epoch: 22, train_loss: 0.9986, test_loss: 1.1031, test_f1: 0.4822
 epoch: 23, train_loss: 0.9908, test_loss: 1.1040, test_f1: 0.4851
 epoch: 24, train_loss: 0.9789, test_loss: 1.0997, test_f1: 0.4687
 epoch: 25, train_loss: 0.9769, test_loss: 1.0971, test_f1: 0.4892
 epoch: 26, train_loss: 0.9779, test_loss: 1.0808, test_f1: 0.4882
 epoch: 27, train_loss: 0.9792, test_loss: 1.0810, test_f1: 0.5003
 epoch: 28, train_loss: 0.9674, test_loss: 1.0730, test_f1: 0.4898
 epoch: 29, train_loss: 0.9637, test_loss: 1.0759, test_f1: 0.4910
 epoch: 30, train_loss: 0.9508, test_loss: 1.0799, test_f1: 0.4778
 epoch: 31, train_loss: 0.9477, test_loss: 1.0694, test_f1: 0.4986
 epoch: 32, train_loss: 0.9499, test_loss: 1.0700, test_f1: 0.4986
 epoch: 33, train_loss: 0.9385, test_loss: 1.0718, test_f1: 0.5127
 epoch: 34, train_loss: 0.9329, test_loss: 1.0706, test_f1: 0.5057
 epoch: 35, train_loss: 0.9278, test_loss: 1.0633, test_f1: 0.5121
 epoch: 36, train_loss: 0.9344, test_loss: 1.0700, test_f1: 0.5013
 epoch: 37, train_loss: 0.9204, test_loss: 1.0633, test_f1: 0.5134
 epoch: 38, train_loss: 0.9226, test_loss: 1.0474, test_f1: 0.5083
 epoch: 39, train_loss: 0.9157, test_loss: 1.0602, test_f1: 0.5066
 epoch: 40, train_loss: 0.9163, test_loss: 1.0622, test_f1: 0.5255
 epoch: 41, train_loss: 0.9118, test_loss: 1.0532, test_f1: 0.5068
 epoch: 42, train_loss: 0.8991, test_loss: 1.0635, test_f1: 0.5060
 epoch: 43, train_loss: 0.8971, test_loss: 1.0452, test_f1: 0.5045
 epoch: 44, train_loss: 0.9060, test_loss: 1.0391, test_f1: 0.5282
 epoch: 45, train_loss: 0.8964, test_loss: 1.0387, test_f1: 0.5229
 epoch: 46, train_loss: 0.8886, test_loss: 1.0359, test_f1: 0.5174
 epoch: 47, train_loss: 0.8822, test_loss: 1.0343, test_f1: 0.5295
 epoch: 48, train_loss: 0.8815, test_loss: 1.0497, test_f1: 0.5408
 epoch: 49, train_loss: 0.8793, test_loss: 1.0487, test_f1: 0.5182
 epoch: 50, train_loss: 0.8803, test_loss: 1.0254, test_f1: 0.5325
 epoch: 51, train_loss: 0.8651, test_loss: 1.0250, test_f1: 0.5420
 epoch: 52, train_loss: 0.8679, test_loss: 1.0341, test_f1: 0.5400
 epoch: 53, train_loss: 0.8729, test_loss: 1.0319, test_f1: 0.5243
 epoch: 54, train_loss: 0.8608, test_loss: 1.0443, test_f1: 0.5446
 epoch: 55, train_loss: 0.8683, test_loss: 1.0274, test_f1: 0.5316
 epoch: 56, train_loss: 0.8648, test_loss: 1.0322, test_f1: 0.5279
 epoch: 57, train_loss: 0.8571, test_loss: 1.0484, test_f1: 0.5378
 epoch: 58, train_loss: 0.8629, test_loss: 1.0359, test_f1: 0.5437
 epoch: 59, train_loss: 0.8646, test_loss: 1.0374, test_f1: 0.5346
 epoch: 60, train_loss: 0.8521, test_loss: 1.0465, test_f1: 0.5392
 epoch: 61, train_loss: 0.8588, test_loss: 1.0398, test_f1: 0.5490
 epoch: 62, train_loss: 0.8582, test_loss: 1.0445, test_f1: 0.5424
 epoch: 63, train_loss: 0.8531, test_loss: 1.0397, test_f1: 0.5445
 epoch: 64, train_loss: 0.8504, test_loss: 1.0292, test_f1: 0.5442
 epoch: 65, train_loss: 0.8586, test_loss: 1.0358, test_f1: 0.5386
 epoch: 66, train_loss: 0.8528, test_loss: 1.0394, test_f1: 0.5500
 epoch: 67, train_loss: 0.8491, test_loss: 1.0319, test_f1: 0.5384
 epoch: 68, train_loss: 0.8448, test_loss: 1.0347, test_f1: 0.5368
 epoch: 69, train_loss: 0.8455, test_loss: 1.0415, test_f1: 0.5379
 epoch: 70, train_loss: 0.8386, test_loss: 1.0413, test_f1: 0.5470
 epoch: 71, train_loss: 0.8383, test_loss: 1.0327, test_f1: 0.5375
 epoch: 72, train_loss: 0.8517, test_loss: 1.0243, test_f1: 0.5440
 epoch: 73, train_loss: 0.8353, test_loss: 1.0391, test_f1: 0.5426
 epoch: 74, train_loss: 0.8350, test_loss: 1.0350, test_f1: 0.5480
 epoch: 75, train_loss: 0.8378, test_loss: 1.0310, test_f1: 0.5520
 epoch: 76, train_loss: 0.8391, test_loss: 1.0415, test_f1: 0.5464
 epoch: 77, train_loss: 0.8369, test_loss: 1.0306, test_f1: 0.5407
 epoch: 78, train_loss: 0.8280, test_loss: 1.0377, test_f1: 0.5522
 epoch: 79, train_loss: 0.8368, test_loss: 1.0384, test_f1: 0.5503
 epoch: 80, train_loss: 0.8338, test_loss: 1.0364, test_f1: 0.5544
 epoch: 81, train_loss: 0.8264, test_loss: 1.0365, test_f1: 0.5526
 epoch: 82, train_loss: 0.8404, test_loss: 1.0495, test_f1: 0.5457
 epoch: 83, train_loss: 0.8359, test_loss: 1.0226, test_f1: 0.5554
 epoch: 84, train_loss: 0.8258, test_loss: 1.0583, test_f1: 0.5516
 epoch: 85, train_loss: 0.8285, test_loss: 1.0204, test_f1: 0.5560
 epoch: 86, train_loss: 0.8263, test_loss: 1.0293, test_f1: 0.5474
 epoch: 87, train_loss: 0.8212, test_loss: 1.0348, test_f1: 0.5563
 epoch: 88, train_loss: 0.8294, test_loss: 1.0434, test_f1: 0.5554
 epoch: 89, train_loss: 0.8212, test_loss: 1.0206, test_f1: 0.5531
 epoch: 90, train_loss: 0.8181, test_loss: 1.0211, test_f1: 0.5534
 epoch: 91, train_loss: 0.8242, test_loss: 1.0317, test_f1: 0.5605
 epoch: 92, train_loss: 0.8236, test_loss: 1.0238, test_f1: 0.5547
 epoch: 93, train_loss: 0.8092, test_loss: 1.0348, test_f1: 0.5643
 epoch: 94, train_loss: 0.8206, test_loss: 1.0307, test_f1: 0.5702
 epoch: 95, train_loss: 0.8143, test_loss: 1.0408, test_f1: 0.5531
 epoch: 96, train_loss: 0.8135, test_loss: 1.0124, test_f1: 0.5558
 epoch: 97, train_loss: 0.8173, test_loss: 1.0328, test_f1: 0.5655
 epoch: 98, train_loss: 0.8154, test_loss: 1.0220, test_f1: 0.5720
 epoch: 99, train_loss: 0.8139, test_loss: 1.0030, test_f1: 0.5556
##################ITERATION #4 ****************************************
 epoch: 0, train_loss: 1.2667, test_loss: 1.2815, test_f1: 0.2281
 epoch: 1, train_loss: 1.1818, test_loss: 1.2411, test_f1: 0.2336
 epoch: 2, train_loss: 1.1532, test_loss: 1.2067, test_f1: 0.2977
 epoch: 3, train_loss: 1.1276, test_loss: 1.1820, test_f1: 0.3246
 epoch: 4, train_loss: 1.1127, test_loss: 1.1676, test_f1: 0.3434
 epoch: 5, train_loss: 1.0931, test_loss: 1.1569, test_f1: 0.3574
 epoch: 6, train_loss: 1.0789, test_loss: 1.1445, test_f1: 0.3641
 epoch: 7, train_loss: 1.0728, test_loss: 1.1385, test_f1: 0.4163
 epoch: 8, train_loss: 1.0583, test_loss: 1.1291, test_f1: 0.4358
 epoch: 9, train_loss: 1.0473, test_loss: 1.1229, test_f1: 0.4425
 epoch: 10, train_loss: 1.0408, test_loss: 1.1218, test_f1: 0.4631
 epoch: 11, train_loss: 1.0204, test_loss: 1.1140, test_f1: 0.4609
 epoch: 12, train_loss: 1.0151, test_loss: 1.1058, test_f1: 0.4628
 epoch: 13, train_loss: 1.0199, test_loss: 1.1052, test_f1: 0.4694
 epoch: 14, train_loss: 1.0040, test_loss: 1.1098, test_f1: 0.4653
 epoch: 15, train_loss: 0.9949, test_loss: 1.0958, test_f1: 0.4770
 epoch: 16, train_loss: 0.9954, test_loss: 1.0911, test_f1: 0.4847
 epoch: 17, train_loss: 0.9892, test_loss: 1.0852, test_f1: 0.4860
 epoch: 18, train_loss: 0.9783, test_loss: 1.0807, test_f1: 0.4884
 epoch: 19, train_loss: 0.9604, test_loss: 1.0801, test_f1: 0.4970
 epoch: 20, train_loss: 0.9536, test_loss: 1.0815, test_f1: 0.5021
 epoch: 21, train_loss: 0.9627, test_loss: 1.0676, test_f1: 0.5049
 epoch: 22, train_loss: 0.9574, test_loss: 1.0770, test_f1: 0.5058
 epoch: 23, train_loss: 0.9469, test_loss: 1.0738, test_f1: 0.5073
 epoch: 24, train_loss: 0.9435, test_loss: 1.0666, test_f1: 0.5296
 epoch: 25, train_loss: 0.9294, test_loss: 1.0793, test_f1: 0.5101
 epoch: 26, train_loss: 0.9430, test_loss: 1.0647, test_f1: 0.5070
 epoch: 27, train_loss: 0.9357, test_loss: 1.0670, test_f1: 0.5164
 epoch: 28, train_loss: 0.9329, test_loss: 1.0638, test_f1: 0.5229
 epoch: 29, train_loss: 0.9164, test_loss: 1.0637, test_f1: 0.5057
 epoch: 30, train_loss: 0.9227, test_loss: 1.0541, test_f1: 0.5109
 epoch: 31, train_loss: 0.9152, test_loss: 1.0589, test_f1: 0.5080
 epoch: 32, train_loss: 0.9258, test_loss: 1.0577, test_f1: 0.5206
 epoch: 33, train_loss: 0.9096, test_loss: 1.0530, test_f1: 0.5051
 epoch: 34, train_loss: 0.9006, test_loss: 1.0533, test_f1: 0.5201
 epoch: 35, train_loss: 0.9145, test_loss: 1.0621, test_f1: 0.5036
 epoch: 36, train_loss: 0.8903, test_loss: 1.0601, test_f1: 0.5067
 epoch: 37, train_loss: 0.8943, test_loss: 1.0539, test_f1: 0.5206
 epoch: 38, train_loss: 0.9020, test_loss: 1.0733, test_f1: 0.5151
 epoch: 39, train_loss: 0.8966, test_loss: 1.0584, test_f1: 0.5044
 epoch: 40, train_loss: 0.8827, test_loss: 1.0627, test_f1: 0.5069
 epoch: 41, train_loss: 0.8802, test_loss: 1.0529, test_f1: 0.5135
 epoch: 42, train_loss: 0.8741, test_loss: 1.0686, test_f1: 0.5198
 epoch: 43, train_loss: 0.8757, test_loss: 1.0582, test_f1: 0.5166
 epoch: 44, train_loss: 0.8727, test_loss: 1.0637, test_f1: 0.5381
 epoch: 45, train_loss: 0.8701, test_loss: 1.0546, test_f1: 0.5196
 epoch: 46, train_loss: 0.8702, test_loss: 1.0627, test_f1: 0.5257
 epoch: 47, train_loss: 0.8596, test_loss: 1.0644, test_f1: 0.5213
 epoch: 48, train_loss: 0.8599, test_loss: 1.0620, test_f1: 0.5266
 epoch: 49, train_loss: 0.8604, test_loss: 1.0654, test_f1: 0.5421
 epoch: 50, train_loss: 0.8547, test_loss: 1.0672, test_f1: 0.5159
 epoch: 51, train_loss: 0.8583, test_loss: 1.0548, test_f1: 0.5228
 epoch: 52, train_loss: 0.8488, test_loss: 1.0551, test_f1: 0.5282
 epoch: 53, train_loss: 0.8446, test_loss: 1.0535, test_f1: 0.5089
 epoch: 54, train_loss: 0.8528, test_loss: 1.0507, test_f1: 0.5258
 epoch: 55, train_loss: 0.8489, test_loss: 1.0482, test_f1: 0.5262
 epoch: 56, train_loss: 0.8463, test_loss: 1.0628, test_f1: 0.5353
 epoch: 57, train_loss: 0.8399, test_loss: 1.0533, test_f1: 0.5277
 epoch: 58, train_loss: 0.8528, test_loss: 1.0547, test_f1: 0.5236
 epoch: 59, train_loss: 0.8359, test_loss: 1.0604, test_f1: 0.5273
 epoch: 60, train_loss: 0.8434, test_loss: 1.0568, test_f1: 0.5330
 epoch: 61, train_loss: 0.8505, test_loss: 1.0529, test_f1: 0.5193
 epoch: 62, train_loss: 0.8400, test_loss: 1.0494, test_f1: 0.5299
 epoch: 63, train_loss: 0.8455, test_loss: 1.0544, test_f1: 0.5169
 epoch: 64, train_loss: 0.8369, test_loss: 1.0570, test_f1: 0.5470
 epoch: 65, train_loss: 0.8331, test_loss: 1.0469, test_f1: 0.5263
 epoch: 66, train_loss: 0.8323, test_loss: 1.0540, test_f1: 0.5366
 epoch: 67, train_loss: 0.8326, test_loss: 1.0531, test_f1: 0.5336
 epoch: 68, train_loss: 0.8211, test_loss: 1.0564, test_f1: 0.5329
 epoch: 69, train_loss: 0.8314, test_loss: 1.0565, test_f1: 0.5351
 epoch: 70, train_loss: 0.8177, test_loss: 1.0517, test_f1: 0.5315
 epoch: 71, train_loss: 0.8280, test_loss: 1.0482, test_f1: 0.5308
 epoch: 72, train_loss: 0.8184, test_loss: 1.0552, test_f1: 0.5363
 epoch: 73, train_loss: 0.8260, test_loss: 1.0450, test_f1: 0.5393
 epoch: 74, train_loss: 0.8236, test_loss: 1.0609, test_f1: 0.5392
 epoch: 75, train_loss: 0.8320, test_loss: 1.0489, test_f1: 0.5467
 epoch: 76, train_loss: 0.8152, test_loss: 1.0459, test_f1: 0.5417
 epoch: 77, train_loss: 0.8233, test_loss: 1.0479, test_f1: 0.5345
 epoch: 78, train_loss: 0.8195, test_loss: 1.0419, test_f1: 0.5242
 epoch: 79, train_loss: 0.8165, test_loss: 1.0464, test_f1: 0.5442
 epoch: 80, train_loss: 0.8187, test_loss: 1.0468, test_f1: 0.5278
 epoch: 81, train_loss: 0.8153, test_loss: 1.0378, test_f1: 0.5301
 epoch: 82, train_loss: 0.8038, test_loss: 1.0421, test_f1: 0.5450
 epoch: 83, train_loss: 0.8092, test_loss: 1.0556, test_f1: 0.5222
 epoch: 84, train_loss: 0.8239, test_loss: 1.0362, test_f1: 0.5445
 epoch: 85, train_loss: 0.8202, test_loss: 1.0541, test_f1: 0.5202
 epoch: 86, train_loss: 0.8044, test_loss: 1.0433, test_f1: 0.5388
 epoch: 87, train_loss: 0.8060, test_loss: 1.0421, test_f1: 0.5403
 epoch: 88, train_loss: 0.8098, test_loss: 1.0472, test_f1: 0.5235
 epoch: 89, train_loss: 0.8175, test_loss: 1.0551, test_f1: 0.5314
 epoch: 90, train_loss: 0.8001, test_loss: 1.0525, test_f1: 0.5393
 epoch: 91, train_loss: 0.8130, test_loss: 1.0550, test_f1: 0.5444
 epoch: 92, train_loss: 0.8127, test_loss: 1.0506, test_f1: 0.5391
 epoch: 93, train_loss: 0.7970, test_loss: 1.0658, test_f1: 0.5347
 epoch: 94, train_loss: 0.8047, test_loss: 1.0488, test_f1: 0.5319
 epoch: 95, train_loss: 0.8077, test_loss: 1.0526, test_f1: 0.5355
 epoch: 96, train_loss: 0.7990, test_loss: 1.0325, test_f1: 0.5418
 epoch: 97, train_loss: 0.7919, test_loss: 1.0460, test_f1: 0.5326
 epoch: 98, train_loss: 0.8017, test_loss: 1.0375, test_f1: 0.5344
 epoch: 99, train_loss: 0.7967, test_loss: 1.0528, test_f1: 0.5352
##################ITERATION #5 ****************************************
 epoch: 0, train_loss: 1.2390, test_loss: 1.2935, test_f1: 0.2281
 epoch: 1, train_loss: 1.1717, test_loss: 1.2499, test_f1: 0.2667
 epoch: 2, train_loss: 1.1536, test_loss: 1.2116, test_f1: 0.3347
 epoch: 3, train_loss: 1.1351, test_loss: 1.1948, test_f1: 0.3402
 epoch: 4, train_loss: 1.1107, test_loss: 1.1792, test_f1: 0.3496
 epoch: 5, train_loss: 1.0997, test_loss: 1.1652, test_f1: 0.3541
 epoch: 6, train_loss: 1.0773, test_loss: 1.1570, test_f1: 0.3562
 epoch: 7, train_loss: 1.0555, test_loss: 1.1499, test_f1: 0.3544
 epoch: 8, train_loss: 1.0461, test_loss: 1.1378, test_f1: 0.3565
 epoch: 9, train_loss: 1.0440, test_loss: 1.1349, test_f1: 0.3546
 epoch: 10, train_loss: 1.0331, test_loss: 1.1217, test_f1: 0.3586
 epoch: 11, train_loss: 1.0183, test_loss: 1.1245, test_f1: 0.3665
 epoch: 12, train_loss: 1.0142, test_loss: 1.1151, test_f1: 0.3748
 epoch: 13, train_loss: 1.0076, test_loss: 1.1064, test_f1: 0.3750
 epoch: 14, train_loss: 0.9919, test_loss: 1.1027, test_f1: 0.3752
 epoch: 15, train_loss: 0.9868, test_loss: 1.1028, test_f1: 0.3831
 epoch: 16, train_loss: 0.9784, test_loss: 1.1079, test_f1: 0.4009
 epoch: 17, train_loss: 0.9785, test_loss: 1.0937, test_f1: 0.4081
 epoch: 18, train_loss: 0.9680, test_loss: 1.0960, test_f1: 0.4062
 epoch: 19, train_loss: 0.9710, test_loss: 1.0944, test_f1: 0.4088
 epoch: 20, train_loss: 0.9577, test_loss: 1.1047, test_f1: 0.4150
 epoch: 21, train_loss: 0.9618, test_loss: 1.1080, test_f1: 0.4125
 epoch: 22, train_loss: 0.9418, test_loss: 1.0919, test_f1: 0.4171
 epoch: 23, train_loss: 0.9505, test_loss: 1.0961, test_f1: 0.4134
 epoch: 24, train_loss: 0.9440, test_loss: 1.0953, test_f1: 0.4299
 epoch: 25, train_loss: 0.9287, test_loss: 1.1104, test_f1: 0.4282
 epoch: 26, train_loss: 0.9246, test_loss: 1.1038, test_f1: 0.4210
 epoch: 27, train_loss: 0.9329, test_loss: 1.1184, test_f1: 0.4192
 epoch: 28, train_loss: 0.9140, test_loss: 1.1152, test_f1: 0.4244
 epoch: 29, train_loss: 0.9159, test_loss: 1.1012, test_f1: 0.4278
 epoch: 30, train_loss: 0.9271, test_loss: 1.1104, test_f1: 0.4410
 epoch: 31, train_loss: 0.9084, test_loss: 1.1178, test_f1: 0.4863
 epoch: 32, train_loss: 0.9141, test_loss: 1.1281, test_f1: 0.4475
 epoch: 33, train_loss: 0.9033, test_loss: 1.1393, test_f1: 0.4973
 epoch: 34, train_loss: 0.8999, test_loss: 1.1455, test_f1: 0.4916
 epoch: 35, train_loss: 0.8974, test_loss: 1.1395, test_f1: 0.4965
 epoch: 36, train_loss: 0.8910, test_loss: 1.1601, test_f1: 0.4902
 epoch: 37, train_loss: 0.8967, test_loss: 1.1500, test_f1: 0.4916
 epoch: 38, train_loss: 0.9049, test_loss: 1.1705, test_f1: 0.4971
 epoch: 39, train_loss: 0.8857, test_loss: 1.1620, test_f1: 0.4986
 epoch: 40, train_loss: 0.8858, test_loss: 1.1548, test_f1: 0.5158
 epoch: 41, train_loss: 0.8843, test_loss: 1.1704, test_f1: 0.5011
 epoch: 42, train_loss: 0.8803, test_loss: 1.1505, test_f1: 0.5018
 epoch: 43, train_loss: 0.8831, test_loss: 1.1747, test_f1: 0.4938
 epoch: 44, train_loss: 0.8789, test_loss: 1.1650, test_f1: 0.4977
 epoch: 45, train_loss: 0.8754, test_loss: 1.1896, test_f1: 0.5004
 epoch: 46, train_loss: 0.8701, test_loss: 1.1873, test_f1: 0.5137
 epoch: 47, train_loss: 0.8784, test_loss: 1.1802, test_f1: 0.5185
 epoch: 48, train_loss: 0.8729, test_loss: 1.1778, test_f1: 0.5046
 epoch: 49, train_loss: 0.8628, test_loss: 1.1718, test_f1: 0.5076
 epoch: 50, train_loss: 0.8642, test_loss: 1.1591, test_f1: 0.5084
 epoch: 51, train_loss: 0.8614, test_loss: 1.1783, test_f1: 0.5177
 epoch: 52, train_loss: 0.8579, test_loss: 1.1732, test_f1: 0.5106
 epoch: 53, train_loss: 0.8609, test_loss: 1.1637, test_f1: 0.5126
 epoch: 54, train_loss: 0.8573, test_loss: 1.1645, test_f1: 0.5114
 epoch: 55, train_loss: 0.8627, test_loss: 1.1670, test_f1: 0.5044
 epoch: 56, train_loss: 0.8530, test_loss: 1.1744, test_f1: 0.5082
 epoch: 57, train_loss: 0.8539, test_loss: 1.1725, test_f1: 0.5077
 epoch: 58, train_loss: 0.8582, test_loss: 1.1799, test_f1: 0.5018
 epoch: 59, train_loss: 0.8599, test_loss: 1.1722, test_f1: 0.5014
 epoch: 60, train_loss: 0.8497, test_loss: 1.1773, test_f1: 0.5072
 epoch: 61, train_loss: 0.8423, test_loss: 1.1825, test_f1: 0.5056
 epoch: 62, train_loss: 0.8413, test_loss: 1.1740, test_f1: 0.5030
 epoch: 63, train_loss: 0.8488, test_loss: 1.1766, test_f1: 0.5026
 epoch: 64, train_loss: 0.8553, test_loss: 1.1636, test_f1: 0.5050
 epoch: 65, train_loss: 0.8472, test_loss: 1.1515, test_f1: 0.5004
 epoch: 66, train_loss: 0.8434, test_loss: 1.1668, test_f1: 0.5081
 epoch: 67, train_loss: 0.8320, test_loss: 1.1565, test_f1: 0.5037
 epoch: 68, train_loss: 0.8456, test_loss: 1.1684, test_f1: 0.5040
 epoch: 69, train_loss: 0.8407, test_loss: 1.1709, test_f1: 0.5012
 epoch: 70, train_loss: 0.8390, test_loss: 1.1633, test_f1: 0.4975
 epoch: 71, train_loss: 0.8302, test_loss: 1.1661, test_f1: 0.5006
 epoch: 72, train_loss: 0.8524, test_loss: 1.1666, test_f1: 0.5036
 epoch: 73, train_loss: 0.8291, test_loss: 1.1751, test_f1: 0.5026
 epoch: 74, train_loss: 0.8272, test_loss: 1.1728, test_f1: 0.5053
 epoch: 75, train_loss: 0.8308, test_loss: 1.1588, test_f1: 0.5022
 epoch: 76, train_loss: 0.8338, test_loss: 1.1615, test_f1: 0.5066
 epoch: 77, train_loss: 0.8318, test_loss: 1.1648, test_f1: 0.5010
 epoch: 78, train_loss: 0.8365, test_loss: 1.1672, test_f1: 0.5016
 epoch: 79, train_loss: 0.8380, test_loss: 1.1675, test_f1: 0.5069
 epoch: 80, train_loss: 0.8251, test_loss: 1.1921, test_f1: 0.4988
 epoch: 81, train_loss: 0.8236, test_loss: 1.1836, test_f1: 0.4924
 epoch: 82, train_loss: 0.8294, test_loss: 1.1758, test_f1: 0.4993
 epoch: 83, train_loss: 0.8277, test_loss: 1.1571, test_f1: 0.5035
 epoch: 84, train_loss: 0.8274, test_loss: 1.1744, test_f1: 0.5167
 epoch: 85, train_loss: 0.8194, test_loss: 1.1598, test_f1: 0.5075
 epoch: 86, train_loss: 0.8142, test_loss: 1.1722, test_f1: 0.5030
 epoch: 87, train_loss: 0.8254, test_loss: 1.1777, test_f1: 0.5137
 epoch: 88, train_loss: 0.8199, test_loss: 1.1747, test_f1: 0.5141
 epoch: 89, train_loss: 0.8183, test_loss: 1.1653, test_f1: 0.5182
 epoch: 90, train_loss: 0.8329, test_loss: 1.1503, test_f1: 0.5007
 epoch: 91, train_loss: 0.8128, test_loss: 1.1512, test_f1: 0.4940
 epoch: 92, train_loss: 0.8178, test_loss: 1.1695, test_f1: 0.5050
 epoch: 93, train_loss: 0.8041, test_loss: 1.1699, test_f1: 0.5062
 epoch: 94, train_loss: 0.8149, test_loss: 1.1727, test_f1: 0.5017
 epoch: 95, train_loss: 0.8127, test_loss: 1.1734, test_f1: 0.5158
 epoch: 96, train_loss: 0.8162, test_loss: 1.1536, test_f1: 0.5075
 epoch: 97, train_loss: 0.8121, test_loss: 1.1551, test_f1: 0.5030
 epoch: 98, train_loss: 0.8104, test_loss: 1.1573, test_f1: 0.5159
 epoch: 99, train_loss: 0.8120, test_loss: 1.1573, test_f1: 0.4975
##################ITERATION #6 ****************************************
 epoch: 0, train_loss: 1.2607, test_loss: 1.2860, test_f1: 0.2281
 epoch: 1, train_loss: 1.1791, test_loss: 1.2488, test_f1: 0.3156
 epoch: 2, train_loss: 1.1609, test_loss: 1.2158, test_f1: 0.3559
 epoch: 3, train_loss: 1.1277, test_loss: 1.1971, test_f1: 0.3606
 epoch: 4, train_loss: 1.1141, test_loss: 1.1876, test_f1: 0.3591
 epoch: 5, train_loss: 1.0984, test_loss: 1.1779, test_f1: 0.3630
 epoch: 6, train_loss: 1.0776, test_loss: 1.1687, test_f1: 0.3652
 epoch: 7, train_loss: 1.0819, test_loss: 1.1611, test_f1: 0.3697
 epoch: 8, train_loss: 1.0636, test_loss: 1.1588, test_f1: 0.3536
 epoch: 9, train_loss: 1.0431, test_loss: 1.1484, test_f1: 0.3786
 epoch: 10, train_loss: 1.0437, test_loss: 1.1394, test_f1: 0.3816
 epoch: 11, train_loss: 1.0369, test_loss: 1.1273, test_f1: 0.4143
 epoch: 12, train_loss: 1.0182, test_loss: 1.1234, test_f1: 0.4170
 epoch: 13, train_loss: 1.0317, test_loss: 1.1199, test_f1: 0.4141
 epoch: 14, train_loss: 1.0170, test_loss: 1.1166, test_f1: 0.4327
 epoch: 15, train_loss: 1.0029, test_loss: 1.1097, test_f1: 0.4455
 epoch: 16, train_loss: 0.9916, test_loss: 1.1007, test_f1: 0.4829
 epoch: 17, train_loss: 0.9960, test_loss: 1.1017, test_f1: 0.4737
 epoch: 18, train_loss: 0.9790, test_loss: 1.0915, test_f1: 0.4868
 epoch: 19, train_loss: 0.9803, test_loss: 1.0912, test_f1: 0.4870
 epoch: 20, train_loss: 0.9765, test_loss: 1.0822, test_f1: 0.4902
 epoch: 21, train_loss: 0.9755, test_loss: 1.0726, test_f1: 0.4875
 epoch: 22, train_loss: 0.9723, test_loss: 1.0787, test_f1: 0.4938
 epoch: 23, train_loss: 0.9611, test_loss: 1.0711, test_f1: 0.5160
 epoch: 24, train_loss: 0.9477, test_loss: 1.0678, test_f1: 0.4984
 epoch: 25, train_loss: 0.9523, test_loss: 1.0666, test_f1: 0.4859
 epoch: 26, train_loss: 0.9424, test_loss: 1.0581, test_f1: 0.5037
 epoch: 27, train_loss: 0.9366, test_loss: 1.0578, test_f1: 0.5286
 epoch: 28, train_loss: 0.9370, test_loss: 1.0537, test_f1: 0.5079
 epoch: 29, train_loss: 0.9224, test_loss: 1.0577, test_f1: 0.5257
 epoch: 30, train_loss: 0.9257, test_loss: 1.0554, test_f1: 0.5278
 epoch: 31, train_loss: 0.9057, test_loss: 1.0506, test_f1: 0.5201
 epoch: 32, train_loss: 0.9139, test_loss: 1.0374, test_f1: 0.5228
 epoch: 33, train_loss: 0.9099, test_loss: 1.0498, test_f1: 0.5353
 epoch: 34, train_loss: 0.9148, test_loss: 1.0511, test_f1: 0.5118
 epoch: 35, train_loss: 0.9068, test_loss: 1.0402, test_f1: 0.5296
 epoch: 36, train_loss: 0.8945, test_loss: 1.0435, test_f1: 0.5464
 epoch: 37, train_loss: 0.8973, test_loss: 1.0478, test_f1: 0.5444
 epoch: 38, train_loss: 0.8907, test_loss: 1.0423, test_f1: 0.5527
 epoch: 39, train_loss: 0.8829, test_loss: 1.0446, test_f1: 0.5462
 epoch: 40, train_loss: 0.8854, test_loss: 1.0437, test_f1: 0.5468
 epoch: 41, train_loss: 0.8807, test_loss: 1.0429, test_f1: 0.5371
 epoch: 42, train_loss: 0.8775, test_loss: 1.0354, test_f1: 0.5555
 epoch: 43, train_loss: 0.8738, test_loss: 1.0442, test_f1: 0.5500
 epoch: 44, train_loss: 0.8653, test_loss: 1.0272, test_f1: 0.5563
 epoch: 45, train_loss: 0.8654, test_loss: 1.0465, test_f1: 0.5457
 epoch: 46, train_loss: 0.8627, test_loss: 1.0399, test_f1: 0.5549
 epoch: 47, train_loss: 0.8654, test_loss: 1.0497, test_f1: 0.5423
 epoch: 48, train_loss: 0.8622, test_loss: 1.0408, test_f1: 0.5535
 epoch: 49, train_loss: 0.8631, test_loss: 1.0295, test_f1: 0.5443
 epoch: 50, train_loss: 0.8504, test_loss: 1.0298, test_f1: 0.5580
 epoch: 51, train_loss: 0.8477, test_loss: 1.0403, test_f1: 0.5600
 epoch: 52, train_loss: 0.8423, test_loss: 1.0421, test_f1: 0.5449
 epoch: 53, train_loss: 0.8550, test_loss: 1.0311, test_f1: 0.5617
 epoch: 54, train_loss: 0.8441, test_loss: 1.0361, test_f1: 0.5506
 epoch: 55, train_loss: 0.8552, test_loss: 1.0308, test_f1: 0.5521
 epoch: 56, train_loss: 0.8521, test_loss: 1.0266, test_f1: 0.5678
 epoch: 57, train_loss: 0.8362, test_loss: 1.0412, test_f1: 0.5499
 epoch: 58, train_loss: 0.8346, test_loss: 1.0314, test_f1: 0.5514
 epoch: 59, train_loss: 0.8377, test_loss: 1.0392, test_f1: 0.5494
 epoch: 60, train_loss: 0.8343, test_loss: 1.0425, test_f1: 0.5564
 epoch: 61, train_loss: 0.8417, test_loss: 1.0322, test_f1: 0.5563
 epoch: 62, train_loss: 0.8392, test_loss: 1.0212, test_f1: 0.5653
 epoch: 63, train_loss: 0.8344, test_loss: 1.0202, test_f1: 0.5643
 epoch: 64, train_loss: 0.8336, test_loss: 1.0326, test_f1: 0.5684
 epoch: 65, train_loss: 0.8380, test_loss: 1.0304, test_f1: 0.5628
 epoch: 66, train_loss: 0.8292, test_loss: 1.0258, test_f1: 0.5649
 epoch: 67, train_loss: 0.8354, test_loss: 1.0338, test_f1: 0.5663
 epoch: 68, train_loss: 0.8317, test_loss: 1.0359, test_f1: 0.5582
 epoch: 69, train_loss: 0.8195, test_loss: 1.0205, test_f1: 0.5660
 epoch: 70, train_loss: 0.8256, test_loss: 1.0341, test_f1: 0.5591
 epoch: 71, train_loss: 0.8157, test_loss: 1.0333, test_f1: 0.5641
 epoch: 72, train_loss: 0.8249, test_loss: 1.0386, test_f1: 0.5588
 epoch: 73, train_loss: 0.8187, test_loss: 1.0340, test_f1: 0.5614
 epoch: 74, train_loss: 0.8146, test_loss: 1.0231, test_f1: 0.5689
 epoch: 75, train_loss: 0.8194, test_loss: 1.0297, test_f1: 0.5534
 epoch: 76, train_loss: 0.8205, test_loss: 1.0375, test_f1: 0.5542
 epoch: 77, train_loss: 0.8189, test_loss: 1.0272, test_f1: 0.5637
 epoch: 78, train_loss: 0.8054, test_loss: 1.0281, test_f1: 0.5652
 epoch: 79, train_loss: 0.8368, test_loss: 1.0281, test_f1: 0.5548
 epoch: 80, train_loss: 0.8133, test_loss: 1.0333, test_f1: 0.5678
 epoch: 81, train_loss: 0.8195, test_loss: 1.0385, test_f1: 0.5591
 epoch: 82, train_loss: 0.8048, test_loss: 1.0349, test_f1: 0.5632
 epoch: 83, train_loss: 0.8084, test_loss: 1.0444, test_f1: 0.5580
 epoch: 84, train_loss: 0.8106, test_loss: 1.0158, test_f1: 0.5651
 epoch: 85, train_loss: 0.8074, test_loss: 1.0376, test_f1: 0.5548
 epoch: 86, train_loss: 0.8090, test_loss: 1.0349, test_f1: 0.5601
 epoch: 87, train_loss: 0.8026, test_loss: 1.0436, test_f1: 0.5621
 epoch: 88, train_loss: 0.8158, test_loss: 1.0324, test_f1: 0.5554
 epoch: 89, train_loss: 0.7958, test_loss: 1.0363, test_f1: 0.5636
 epoch: 90, train_loss: 0.7936, test_loss: 1.0322, test_f1: 0.5688
 epoch: 91, train_loss: 0.8016, test_loss: 1.0349, test_f1: 0.5588
 epoch: 92, train_loss: 0.7989, test_loss: 1.0376, test_f1: 0.5555
 epoch: 93, train_loss: 0.7962, test_loss: 1.0341, test_f1: 0.5534
 epoch: 94, train_loss: 0.7919, test_loss: 1.0297, test_f1: 0.5684
 epoch: 95, train_loss: 0.7985, test_loss: 1.0212, test_f1: 0.5628
 epoch: 96, train_loss: 0.7944, test_loss: 1.0232, test_f1: 0.5655
 epoch: 97, train_loss: 0.7947, test_loss: 1.0446, test_f1: 0.5567
 epoch: 98, train_loss: 0.7911, test_loss: 1.0273, test_f1: 0.5628
 epoch: 99, train_loss: 0.7977, test_loss: 1.0296, test_f1: 0.5627
##################ITERATION #7 ****************************************
 epoch: 0, train_loss: 1.2496, test_loss: 1.3081, test_f1: 0.2281
 epoch: 1, train_loss: 1.1641, test_loss: 1.2591, test_f1: 0.2575
 epoch: 2, train_loss: 1.1491, test_loss: 1.2134, test_f1: 0.3238
 epoch: 3, train_loss: 1.1259, test_loss: 1.1940, test_f1: 0.4414
 epoch: 4, train_loss: 1.1133, test_loss: 1.1821, test_f1: 0.4376
 epoch: 5, train_loss: 1.1123, test_loss: 1.1677, test_f1: 0.4554
 epoch: 6, train_loss: 1.0914, test_loss: 1.1531, test_f1: 0.4678
 epoch: 7, train_loss: 1.0814, test_loss: 1.1421, test_f1: 0.4700
 epoch: 8, train_loss: 1.0718, test_loss: 1.1312, test_f1: 0.4844
 epoch: 9, train_loss: 1.0573, test_loss: 1.1263, test_f1: 0.4737
 epoch: 10, train_loss: 1.0409, test_loss: 1.1205, test_f1: 0.4957
 epoch: 11, train_loss: 1.0451, test_loss: 1.1072, test_f1: 0.4837
 epoch: 12, train_loss: 1.0150, test_loss: 1.0977, test_f1: 0.4921
 epoch: 13, train_loss: 1.0245, test_loss: 1.0938, test_f1: 0.4945
 epoch: 14, train_loss: 1.0077, test_loss: 1.0857, test_f1: 0.5144
 epoch: 15, train_loss: 0.9998, test_loss: 1.0845, test_f1: 0.5182
 epoch: 16, train_loss: 0.9934, test_loss: 1.0832, test_f1: 0.5116
 epoch: 17, train_loss: 0.9880, test_loss: 1.0712, test_f1: 0.4985
 epoch: 18, train_loss: 0.9833, test_loss: 1.0710, test_f1: 0.5242
 epoch: 19, train_loss: 0.9750, test_loss: 1.0748, test_f1: 0.5146
 epoch: 20, train_loss: 0.9692, test_loss: 1.0661, test_f1: 0.5153
 epoch: 21, train_loss: 0.9642, test_loss: 1.0692, test_f1: 0.5269
 epoch: 22, train_loss: 0.9599, test_loss: 1.0671, test_f1: 0.4988
 epoch: 23, train_loss: 0.9508, test_loss: 1.0635, test_f1: 0.5049
 epoch: 24, train_loss: 0.9468, test_loss: 1.0623, test_f1: 0.5005
 epoch: 25, train_loss: 0.9401, test_loss: 1.0658, test_f1: 0.5239
 epoch: 26, train_loss: 0.9368, test_loss: 1.0587, test_f1: 0.5205
 epoch: 27, train_loss: 0.9377, test_loss: 1.0543, test_f1: 0.5006
 epoch: 28, train_loss: 0.9200, test_loss: 1.0466, test_f1: 0.5065
 epoch: 29, train_loss: 0.9233, test_loss: 1.0481, test_f1: 0.4965
 epoch: 30, train_loss: 0.9287, test_loss: 1.0459, test_f1: 0.4889
 epoch: 31, train_loss: 0.9146, test_loss: 1.0438, test_f1: 0.5115
 epoch: 32, train_loss: 0.9167, test_loss: 1.0595, test_f1: 0.5266
 epoch: 33, train_loss: 0.9177, test_loss: 1.0398, test_f1: 0.5131
 epoch: 34, train_loss: 0.9130, test_loss: 1.0417, test_f1: 0.5250
 epoch: 35, train_loss: 0.9017, test_loss: 1.0431, test_f1: 0.5126
 epoch: 36, train_loss: 0.9001, test_loss: 1.0383, test_f1: 0.5384
 epoch: 37, train_loss: 0.9037, test_loss: 1.0352, test_f1: 0.5215
 epoch: 38, train_loss: 0.8925, test_loss: 1.0282, test_f1: 0.5165
 epoch: 39, train_loss: 0.8967, test_loss: 1.0339, test_f1: 0.5390
 epoch: 40, train_loss: 0.8976, test_loss: 1.0373, test_f1: 0.5248
 epoch: 41, train_loss: 0.8951, test_loss: 1.0363, test_f1: 0.5152
 epoch: 42, train_loss: 0.8707, test_loss: 1.0402, test_f1: 0.5213
 epoch: 43, train_loss: 0.8719, test_loss: 1.0289, test_f1: 0.5206
 epoch: 44, train_loss: 0.8755, test_loss: 1.0191, test_f1: 0.5276
 epoch: 45, train_loss: 0.8743, test_loss: 1.0274, test_f1: 0.5676
 epoch: 46, train_loss: 0.8715, test_loss: 1.0248, test_f1: 0.5382
 epoch: 47, train_loss: 0.8722, test_loss: 1.0249, test_f1: 0.5495
 epoch: 48, train_loss: 0.8737, test_loss: 1.0302, test_f1: 0.5374
 epoch: 49, train_loss: 0.8690, test_loss: 1.0171, test_f1: 0.5486
 epoch: 50, train_loss: 0.8666, test_loss: 1.0214, test_f1: 0.5720
 epoch: 51, train_loss: 0.8589, test_loss: 1.0235, test_f1: 0.5495
 epoch: 52, train_loss: 0.8641, test_loss: 1.0246, test_f1: 0.5633
 epoch: 53, train_loss: 0.8503, test_loss: 1.0284, test_f1: 0.5892
 epoch: 54, train_loss: 0.8535, test_loss: 1.0242, test_f1: 0.5674
 epoch: 55, train_loss: 0.8336, test_loss: 1.0280, test_f1: 0.5861
 epoch: 56, train_loss: 0.8420, test_loss: 1.0285, test_f1: 0.5791
 epoch: 57, train_loss: 0.8387, test_loss: 1.0288, test_f1: 0.5721
 epoch: 58, train_loss: 0.8512, test_loss: 1.0295, test_f1: 0.5807
 epoch: 59, train_loss: 0.8443, test_loss: 1.0293, test_f1: 0.5817
 epoch: 60, train_loss: 0.8366, test_loss: 1.0260, test_f1: 0.5605
 epoch: 61, train_loss: 0.8399, test_loss: 1.0264, test_f1: 0.5804
 epoch: 62, train_loss: 0.8351, test_loss: 1.0285, test_f1: 0.5780
 epoch: 63, train_loss: 0.8483, test_loss: 1.0244, test_f1: 0.5676
 epoch: 64, train_loss: 0.8421, test_loss: 1.0243, test_f1: 0.5787
 epoch: 65, train_loss: 0.8406, test_loss: 1.0171, test_f1: 0.5754
 epoch: 66, train_loss: 0.8375, test_loss: 1.0183, test_f1: 0.5905
 epoch: 67, train_loss: 0.8331, test_loss: 1.0168, test_f1: 0.5804
 epoch: 68, train_loss: 0.8321, test_loss: 1.0087, test_f1: 0.5791
 epoch: 69, train_loss: 0.8321, test_loss: 1.0090, test_f1: 0.5830
 epoch: 70, train_loss: 0.8167, test_loss: 1.0092, test_f1: 0.5824
 epoch: 71, train_loss: 0.8345, test_loss: 1.0067, test_f1: 0.5915
 epoch: 72, train_loss: 0.8307, test_loss: 1.0113, test_f1: 0.5979
 epoch: 73, train_loss: 0.8310, test_loss: 1.0095, test_f1: 0.5837
 epoch: 74, train_loss: 0.8303, test_loss: 1.0204, test_f1: 0.5962
 epoch: 75, train_loss: 0.8302, test_loss: 1.0144, test_f1: 0.5836
 epoch: 76, train_loss: 0.8146, test_loss: 1.0133, test_f1: 0.6013
 epoch: 77, train_loss: 0.8165, test_loss: 1.0207, test_f1: 0.6103
 epoch: 78, train_loss: 0.8219, test_loss: 1.0208, test_f1: 0.5920
 epoch: 79, train_loss: 0.8178, test_loss: 1.0166, test_f1: 0.5811
 epoch: 80, train_loss: 0.8240, test_loss: 1.0239, test_f1: 0.5807
 epoch: 81, train_loss: 0.8168, test_loss: 1.0205, test_f1: 0.5914
 epoch: 82, train_loss: 0.8131, test_loss: 1.0211, test_f1: 0.5930
 epoch: 83, train_loss: 0.7987, test_loss: 1.0267, test_f1: 0.5923
 epoch: 84, train_loss: 0.8047, test_loss: 1.0304, test_f1: 0.5872
 epoch: 85, train_loss: 0.8103, test_loss: 1.0259, test_f1: 0.5860
 epoch: 86, train_loss: 0.8083, test_loss: 1.0289, test_f1: 0.5877
 epoch: 87, train_loss: 0.8078, test_loss: 1.0363, test_f1: 0.5719
 epoch: 88, train_loss: 0.8104, test_loss: 1.0291, test_f1: 0.5851
 epoch: 89, train_loss: 0.8157, test_loss: 1.0332, test_f1: 0.5810
 epoch: 90, train_loss: 0.8008, test_loss: 1.0290, test_f1: 0.5846
 epoch: 91, train_loss: 0.8136, test_loss: 1.0292, test_f1: 0.5921
 epoch: 92, train_loss: 0.8091, test_loss: 1.0274, test_f1: 0.5948
 epoch: 93, train_loss: 0.8060, test_loss: 1.0358, test_f1: 0.5821
 epoch: 94, train_loss: 0.7942, test_loss: 1.0333, test_f1: 0.5779
 epoch: 95, train_loss: 0.7969, test_loss: 1.0280, test_f1: 0.5897
 epoch: 96, train_loss: 0.8067, test_loss: 1.0226, test_f1: 0.5813
 epoch: 97, train_loss: 0.8009, test_loss: 1.0222, test_f1: 0.5923
 epoch: 98, train_loss: 0.7935, test_loss: 1.0363, test_f1: 0.5790
 epoch: 99, train_loss: 0.7999, test_loss: 1.0392, test_f1: 0.5919
##################ITERATION #8 ****************************************
 epoch: 0, train_loss: 1.2267, test_loss: 1.2687, test_f1: 0.2281
 epoch: 1, train_loss: 1.1501, test_loss: 1.2231, test_f1: 0.3155
 epoch: 2, train_loss: 1.1356, test_loss: 1.1878, test_f1: 0.3597
 epoch: 3, train_loss: 1.1206, test_loss: 1.1762, test_f1: 0.3444
 epoch: 4, train_loss: 1.1016, test_loss: 1.1694, test_f1: 0.3583
 epoch: 5, train_loss: 1.0774, test_loss: 1.1557, test_f1: 0.3750
 epoch: 6, train_loss: 1.0670, test_loss: 1.1517, test_f1: 0.3672
 epoch: 7, train_loss: 1.0492, test_loss: 1.1445, test_f1: 0.3910
 epoch: 8, train_loss: 1.0562, test_loss: 1.1379, test_f1: 0.4330
 epoch: 9, train_loss: 1.0315, test_loss: 1.1331, test_f1: 0.4606
 epoch: 10, train_loss: 1.0237, test_loss: 1.1186, test_f1: 0.4689
 epoch: 11, train_loss: 1.0196, test_loss: 1.1080, test_f1: 0.4740
 epoch: 12, train_loss: 1.0072, test_loss: 1.1016, test_f1: 0.4799
 epoch: 13, train_loss: 0.9908, test_loss: 1.0954, test_f1: 0.4939
 epoch: 14, train_loss: 0.9950, test_loss: 1.0917, test_f1: 0.4979
 epoch: 15, train_loss: 0.9863, test_loss: 1.0784, test_f1: 0.5007
 epoch: 16, train_loss: 0.9753, test_loss: 1.0763, test_f1: 0.5027
 epoch: 17, train_loss: 0.9690, test_loss: 1.0768, test_f1: 0.5239
 epoch: 18, train_loss: 0.9696, test_loss: 1.0762, test_f1: 0.5297
 epoch: 19, train_loss: 0.9748, test_loss: 1.0674, test_f1: 0.5322
 epoch: 20, train_loss: 0.9453, test_loss: 1.0651, test_f1: 0.5250
 epoch: 21, train_loss: 0.9552, test_loss: 1.0703, test_f1: 0.5200
 epoch: 22, train_loss: 0.9498, test_loss: 1.0601, test_f1: 0.5395
 epoch: 23, train_loss: 0.9492, test_loss: 1.0629, test_f1: 0.5348
 epoch: 24, train_loss: 0.9411, test_loss: 1.0471, test_f1: 0.5529
 epoch: 25, train_loss: 0.9301, test_loss: 1.0473, test_f1: 0.5530
 epoch: 26, train_loss: 0.9176, test_loss: 1.0463, test_f1: 0.5395
 epoch: 27, train_loss: 0.9335, test_loss: 1.0572, test_f1: 0.5424
 epoch: 28, train_loss: 0.9202, test_loss: 1.0594, test_f1: 0.5392
 epoch: 29, train_loss: 0.9125, test_loss: 1.0374, test_f1: 0.5512
 epoch: 30, train_loss: 0.9208, test_loss: 1.0498, test_f1: 0.5492
 epoch: 31, train_loss: 0.9126, test_loss: 1.0462, test_f1: 0.5625
 epoch: 32, train_loss: 0.9056, test_loss: 1.0468, test_f1: 0.5524
 epoch: 33, train_loss: 0.8972, test_loss: 1.0499, test_f1: 0.5606
 epoch: 34, train_loss: 0.9079, test_loss: 1.0439, test_f1: 0.5674
 epoch: 35, train_loss: 0.8880, test_loss: 1.0399, test_f1: 0.5698
 epoch: 36, train_loss: 0.8881, test_loss: 1.0414, test_f1: 0.5702
 epoch: 37, train_loss: 0.8837, test_loss: 1.0477, test_f1: 0.5546
 epoch: 38, train_loss: 0.8698, test_loss: 1.0389, test_f1: 0.5661
 epoch: 39, train_loss: 0.8737, test_loss: 1.0331, test_f1: 0.5751
 epoch: 40, train_loss: 0.8795, test_loss: 1.0463, test_f1: 0.5616
 epoch: 41, train_loss: 0.8580, test_loss: 1.0556, test_f1: 0.5502
 epoch: 42, train_loss: 0.8718, test_loss: 1.0442, test_f1: 0.5680
 epoch: 43, train_loss: 0.8665, test_loss: 1.0424, test_f1: 0.5556
 epoch: 44, train_loss: 0.8604, test_loss: 1.0447, test_f1: 0.5635
 epoch: 45, train_loss: 0.8570, test_loss: 1.0570, test_f1: 0.5498
 epoch: 46, train_loss: 0.8527, test_loss: 1.0591, test_f1: 0.5414
 epoch: 47, train_loss: 0.8525, test_loss: 1.0598, test_f1: 0.5540
 epoch: 48, train_loss: 0.8494, test_loss: 1.0662, test_f1: 0.5397
 epoch: 49, train_loss: 0.8456, test_loss: 1.0630, test_f1: 0.5335
 epoch: 50, train_loss: 0.8410, test_loss: 1.0608, test_f1: 0.5395
 epoch: 51, train_loss: 0.8343, test_loss: 1.0621, test_f1: 0.5506
 epoch: 52, train_loss: 0.8234, test_loss: 1.0578, test_f1: 0.5439
 epoch: 53, train_loss: 0.8484, test_loss: 1.0614, test_f1: 0.5435
 epoch: 54, train_loss: 0.8268, test_loss: 1.0656, test_f1: 0.5422
 epoch: 55, train_loss: 0.8403, test_loss: 1.0691, test_f1: 0.5414
 epoch: 56, train_loss: 0.8290, test_loss: 1.0678, test_f1: 0.5445
 epoch: 57, train_loss: 0.8262, test_loss: 1.0689, test_f1: 0.5464
 epoch: 58, train_loss: 0.8306, test_loss: 1.0717, test_f1: 0.5489
 epoch: 59, train_loss: 0.8214, test_loss: 1.0657, test_f1: 0.5454
 epoch: 60, train_loss: 0.8230, test_loss: 1.0600, test_f1: 0.5448
 epoch: 61, train_loss: 0.8275, test_loss: 1.0611, test_f1: 0.5417
 epoch: 62, train_loss: 0.8223, test_loss: 1.0775, test_f1: 0.5447
 epoch: 63, train_loss: 0.8123, test_loss: 1.0758, test_f1: 0.5391
 epoch: 64, train_loss: 0.8206, test_loss: 1.0771, test_f1: 0.5343
 epoch: 65, train_loss: 0.8220, test_loss: 1.0948, test_f1: 0.5396
 epoch: 66, train_loss: 0.8258, test_loss: 1.0850, test_f1: 0.5439
 epoch: 67, train_loss: 0.8140, test_loss: 1.0790, test_f1: 0.5282
 epoch: 68, train_loss: 0.8157, test_loss: 1.0816, test_f1: 0.5297
 epoch: 69, train_loss: 0.8102, test_loss: 1.0943, test_f1: 0.5422
 epoch: 70, train_loss: 0.8129, test_loss: 1.0866, test_f1: 0.5414
 epoch: 71, train_loss: 0.8227, test_loss: 1.0977, test_f1: 0.5433
 epoch: 72, train_loss: 0.8069, test_loss: 1.0799, test_f1: 0.5465
 epoch: 73, train_loss: 0.7922, test_loss: 1.0977, test_f1: 0.5434
 epoch: 74, train_loss: 0.7961, test_loss: 1.1065, test_f1: 0.5427
 epoch: 75, train_loss: 0.8064, test_loss: 1.0953, test_f1: 0.5374
 epoch: 76, train_loss: 0.8101, test_loss: 1.0932, test_f1: 0.5424
 epoch: 77, train_loss: 0.8016, test_loss: 1.0982, test_f1: 0.5407
 epoch: 78, train_loss: 0.7947, test_loss: 1.1076, test_f1: 0.5307
 epoch: 79, train_loss: 0.8062, test_loss: 1.0895, test_f1: 0.5286
 epoch: 80, train_loss: 0.7967, test_loss: 1.1122, test_f1: 0.5321
 epoch: 81, train_loss: 0.7956, test_loss: 1.1043, test_f1: 0.5318
 epoch: 82, train_loss: 0.8043, test_loss: 1.1085, test_f1: 0.5360
 epoch: 83, train_loss: 0.7891, test_loss: 1.1043, test_f1: 0.5322
 epoch: 84, train_loss: 0.7821, test_loss: 1.1353, test_f1: 0.5313
 epoch: 85, train_loss: 0.7773, test_loss: 1.1250, test_f1: 0.5340
 epoch: 86, train_loss: 0.7839, test_loss: 1.1193, test_f1: 0.5478
 epoch: 87, train_loss: 0.7859, test_loss: 1.1087, test_f1: 0.5308
 epoch: 88, train_loss: 0.7841, test_loss: 1.1140, test_f1: 0.5221
 epoch: 89, train_loss: 0.7897, test_loss: 1.1198, test_f1: 0.5357
 epoch: 90, train_loss: 0.7704, test_loss: 1.1031, test_f1: 0.5379
 epoch: 91, train_loss: 0.7506, test_loss: 1.1022, test_f1: 0.5427
 epoch: 92, train_loss: 0.7851, test_loss: 1.1243, test_f1: 0.5337
 epoch: 93, train_loss: 0.7720, test_loss: 1.1349, test_f1: 0.5372
 epoch: 94, train_loss: 0.7791, test_loss: 1.1336, test_f1: 0.5445
 epoch: 95, train_loss: 0.7725, test_loss: 1.1421, test_f1: 0.5466
 epoch: 96, train_loss: 0.7661, test_loss: 1.1388, test_f1: 0.5370
 epoch: 97, train_loss: 0.7683, test_loss: 1.1414, test_f1: 0.5512
 epoch: 98, train_loss: 0.7713, test_loss: 1.1110, test_f1: 0.5337
 epoch: 99, train_loss: 0.7686, test_loss: 1.1362, test_f1: 0.5290
##################ITERATION #9 ****************************************
 epoch: 0, train_loss: 1.2677, test_loss: 1.2755, test_f1: 0.2281
 epoch: 1, train_loss: 1.1714, test_loss: 1.2322, test_f1: 0.2598
 epoch: 2, train_loss: 1.1501, test_loss: 1.1910, test_f1: 0.3388
 epoch: 3, train_loss: 1.1222, test_loss: 1.1696, test_f1: 0.3687
 epoch: 4, train_loss: 1.1176, test_loss: 1.1551, test_f1: 0.3662
 epoch: 5, train_loss: 1.0988, test_loss: 1.1394, test_f1: 0.3662
 epoch: 6, train_loss: 1.0774, test_loss: 1.1279, test_f1: 0.3716
 epoch: 7, train_loss: 1.0737, test_loss: 1.1223, test_f1: 0.3796
 epoch: 8, train_loss: 1.0775, test_loss: 1.1168, test_f1: 0.3708
 epoch: 9, train_loss: 1.0484, test_loss: 1.1138, test_f1: 0.3745
 epoch: 10, train_loss: 1.0387, test_loss: 1.1015, test_f1: 0.3789
 epoch: 11, train_loss: 1.0461, test_loss: 1.0938, test_f1: 0.3875
 epoch: 12, train_loss: 1.0373, test_loss: 1.0873, test_f1: 0.3931
 epoch: 13, train_loss: 1.0227, test_loss: 1.0867, test_f1: 0.4455
 epoch: 14, train_loss: 1.0072, test_loss: 1.0733, test_f1: 0.4635
 epoch: 15, train_loss: 1.0142, test_loss: 1.0864, test_f1: 0.4575
 epoch: 16, train_loss: 1.0020, test_loss: 1.0715, test_f1: 0.4451
 epoch: 17, train_loss: 0.9880, test_loss: 1.0672, test_f1: 0.4586
 epoch: 18, train_loss: 0.9736, test_loss: 1.0618, test_f1: 0.4649
 epoch: 19, train_loss: 0.9791, test_loss: 1.0637, test_f1: 0.4666
 epoch: 20, train_loss: 0.9789, test_loss: 1.0627, test_f1: 0.4739
 epoch: 21, train_loss: 0.9656, test_loss: 1.0510, test_f1: 0.4719
 epoch: 22, train_loss: 0.9523, test_loss: 1.0349, test_f1: 0.4923
 epoch: 23, train_loss: 0.9514, test_loss: 1.0430, test_f1: 0.4867
 epoch: 24, train_loss: 0.9505, test_loss: 1.0379, test_f1: 0.4969
 epoch: 25, train_loss: 0.9510, test_loss: 1.0434, test_f1: 0.4898
 epoch: 26, train_loss: 0.9389, test_loss: 1.0389, test_f1: 0.4791
 epoch: 27, train_loss: 0.9357, test_loss: 1.0378, test_f1: 0.4950
 epoch: 28, train_loss: 0.9449, test_loss: 1.0364, test_f1: 0.4935
 epoch: 29, train_loss: 0.9237, test_loss: 1.0382, test_f1: 0.5053
 epoch: 30, train_loss: 0.9294, test_loss: 1.0424, test_f1: 0.5000
 epoch: 31, train_loss: 0.9198, test_loss: 1.0470, test_f1: 0.4851
 epoch: 32, train_loss: 0.9102, test_loss: 1.0385, test_f1: 0.4787
 epoch: 33, train_loss: 0.9136, test_loss: 1.0419, test_f1: 0.4961
 epoch: 34, train_loss: 0.8980, test_loss: 1.0349, test_f1: 0.5061
 epoch: 35, train_loss: 0.9119, test_loss: 1.0437, test_f1: 0.5106
 epoch: 36, train_loss: 0.8936, test_loss: 1.0475, test_f1: 0.4932
 epoch: 37, train_loss: 0.9066, test_loss: 1.0352, test_f1: 0.5081
 epoch: 38, train_loss: 0.8890, test_loss: 1.0397, test_f1: 0.5095
 epoch: 39, train_loss: 0.8877, test_loss: 1.0452, test_f1: 0.5263
 epoch: 40, train_loss: 0.8981, test_loss: 1.0430, test_f1: 0.5015
 epoch: 41, train_loss: 0.8837, test_loss: 1.0666, test_f1: 0.5046
 epoch: 42, train_loss: 0.8848, test_loss: 1.0622, test_f1: 0.5175
 epoch: 43, train_loss: 0.8859, test_loss: 1.0410, test_f1: 0.5190
 epoch: 44, train_loss: 0.8835, test_loss: 1.0462, test_f1: 0.5175
 epoch: 45, train_loss: 0.8764, test_loss: 1.0547, test_f1: 0.5227
 epoch: 46, train_loss: 0.8835, test_loss: 1.0528, test_f1: 0.5051
 epoch: 47, train_loss: 0.8637, test_loss: 1.0590, test_f1: 0.5163
 epoch: 48, train_loss: 0.8736, test_loss: 1.0581, test_f1: 0.5196
 epoch: 49, train_loss: 0.8650, test_loss: 1.0504, test_f1: 0.5316
 epoch: 50, train_loss: 0.8570, test_loss: 1.0519, test_f1: 0.5213
 epoch: 51, train_loss: 0.8719, test_loss: 1.0564, test_f1: 0.5359
 epoch: 52, train_loss: 0.8557, test_loss: 1.0603, test_f1: 0.5344
 epoch: 53, train_loss: 0.8515, test_loss: 1.0569, test_f1: 0.5274
 epoch: 54, train_loss: 0.8593, test_loss: 1.0603, test_f1: 0.5203
 epoch: 55, train_loss: 0.8504, test_loss: 1.0456, test_f1: 0.5397
 epoch: 56, train_loss: 0.8488, test_loss: 1.0485, test_f1: 0.5304
 epoch: 57, train_loss: 0.8531, test_loss: 1.0510, test_f1: 0.5328
 epoch: 58, train_loss: 0.8655, test_loss: 1.0570, test_f1: 0.5319
 epoch: 59, train_loss: 0.8516, test_loss: 1.0602, test_f1: 0.5480
 epoch: 60, train_loss: 0.8477, test_loss: 1.0450, test_f1: 0.5239
 epoch: 61, train_loss: 0.8547, test_loss: 1.0568, test_f1: 0.5308
 epoch: 62, train_loss: 0.8408, test_loss: 1.0457, test_f1: 0.5391
 epoch: 63, train_loss: 0.8430, test_loss: 1.0611, test_f1: 0.5329
 epoch: 64, train_loss: 0.8480, test_loss: 1.0659, test_f1: 0.5312
 epoch: 65, train_loss: 0.8298, test_loss: 1.0589, test_f1: 0.5516
 epoch: 66, train_loss: 0.8432, test_loss: 1.0597, test_f1: 0.5352
 epoch: 67, train_loss: 0.8342, test_loss: 1.0545, test_f1: 0.5370
 epoch: 68, train_loss: 0.8283, test_loss: 1.0538, test_f1: 0.5443
 epoch: 69, train_loss: 0.8376, test_loss: 1.0529, test_f1: 0.5483
 epoch: 70, train_loss: 0.8318, test_loss: 1.0589, test_f1: 0.5469
 epoch: 71, train_loss: 0.8418, test_loss: 1.0564, test_f1: 0.5363
 epoch: 72, train_loss: 0.8276, test_loss: 1.0601, test_f1: 0.5350
 epoch: 73, train_loss: 0.8233, test_loss: 1.0581, test_f1: 0.5395
 epoch: 74, train_loss: 0.8308, test_loss: 1.0557, test_f1: 0.5564
 epoch: 75, train_loss: 0.8317, test_loss: 1.0641, test_f1: 0.5324
 epoch: 76, train_loss: 0.8323, test_loss: 1.0614, test_f1: 0.5381
 epoch: 77, train_loss: 0.8302, test_loss: 1.0546, test_f1: 0.5456
 epoch: 78, train_loss: 0.8336, test_loss: 1.0452, test_f1: 0.5519
 epoch: 79, train_loss: 0.8257, test_loss: 1.0424, test_f1: 0.5471
 epoch: 80, train_loss: 0.8355, test_loss: 1.0449, test_f1: 0.5420
 epoch: 81, train_loss: 0.8280, test_loss: 1.0550, test_f1: 0.5484
 epoch: 82, train_loss: 0.8253, test_loss: 1.0484, test_f1: 0.5614
 epoch: 83, train_loss: 0.8220, test_loss: 1.0576, test_f1: 0.5402
 epoch: 84, train_loss: 0.8177, test_loss: 1.0409, test_f1: 0.5485
 epoch: 85, train_loss: 0.8134, test_loss: 1.0464, test_f1: 0.5512
 epoch: 86, train_loss: 0.8127, test_loss: 1.0453, test_f1: 0.5623
 epoch: 87, train_loss: 0.8203, test_loss: 1.0486, test_f1: 0.5659
 epoch: 88, train_loss: 0.8198, test_loss: 1.0428, test_f1: 0.5605
 epoch: 89, train_loss: 0.8213, test_loss: 1.0525, test_f1: 0.5498
 epoch: 90, train_loss: 0.8260, test_loss: 1.0628, test_f1: 0.5492
 epoch: 91, train_loss: 0.8104, test_loss: 1.0442, test_f1: 0.5789
 epoch: 92, train_loss: 0.8240, test_loss: 1.0460, test_f1: 0.5583
 epoch: 93, train_loss: 0.8204, test_loss: 1.0534, test_f1: 0.5641
 epoch: 94, train_loss: 0.8149, test_loss: 1.0532, test_f1: 0.5652
 epoch: 95, train_loss: 0.8056, test_loss: 1.0437, test_f1: 0.5573
 epoch: 96, train_loss: 0.8104, test_loss: 1.0480, test_f1: 0.5732
 epoch: 97, train_loss: 0.8026, test_loss: 1.0507, test_f1: 0.5769
 epoch: 98, train_loss: 0.8086, test_loss: 1.0515, test_f1: 0.5669
 epoch: 99, train_loss: 0.8140, test_loss: 1.0508, test_f1: 0.5615

Training completed in 374.02 seconds
Best F1: 0.6103 at epoch 77
Mean F1 across iterations: 0.5622  0.0252
========================FINAL RESULTS================================
FEGIN weighted F1: 0.6103  0.0252
python main.py --data ltspice_demos --representation component_net --model FEGIN --layers 2 --hiddens 64 --batch_size 64 --lr 0.0001 --emb_size 128 --epochs 100 --save_appendix component_net_L2_H64_BS64_LR0.0001_E128 --no_val
-----



STDERR:
  File "main.py", line 370, in <module>
    main()
  File "main.py", line 254, in main
    dataset = dataset_class(
  File "/home/philip/projects/ltspice_examples_code_repo/Circuit-Completion-Using-GNNs/component_classification_with_link_prediction_head/evaluation/FEGIN/kernel/circuit_datasets.py", line 15, in __init__
    self.data, self.slices = torch.load(self.processed_paths[0])
  File "/home/philip/.local/lib/python3.8/site-packages/torch/serialization.py", line 1040, in load
    warnings.warn(
  File "/usr/lib/python3.8/warnings.py", line 109, in _showwarnmsg
    sw(msg.message, msg.category, msg.filename, msg.lineno,
  File "main.py", line 47, in warn_with_traceback
    traceback.print_stack(file=log)
/home/philip/projects/ltspice_examples_code_repo/Circuit-Completion-Using-GNNs/component_classification_with_link_prediction_head/evaluation/FEGIN/kernel/circuit_datasets.py:15: FutureWarning: You are using `torch.load` with `weights_only=False` (the current default value), which uses the default pickle module implicitly. It is possible to construct malicious pickle data which will execute arbitrary code during unpickling (See https://github.com/pytorch/pytorch/blob/main/SECURITY.md#untrusted-models for more details). In a future release, the default value for `weights_only` will be flipped to `True`. This limits the functions that could be executed during unpickling. Arbitrary objects will no longer be allowed to be loaded via this mode unless they are explicitly allowlisted by the user via `torch.serialization.add_safe_globals`. We recommend you start setting `weights_only=True` for any use case where you don't have full control of the loaded file. Please open an issue on GitHub for any issues related to this experimental feature.
  self.data, self.slices = torch.load(self.processed_paths[0])
