STDOUT:
Results will be saved in /home/philip/projects/ltspice_examples_code_repo/Circuit-Completion-Using-GNNs/component_classification_with_link_prediction_head/evaluation/FEGIN/results/model_FEGIN_dataset_ltspice_demos
Command line input: python main.py --data ltspice_demos --representation component_component --model FEGIN --layers 5 --hiddens 16 --batch_size 128 --lr 0.001 --emb_size 128 --epochs 100 --save_appendix component_component_L5_H16_BS128_LR0.001_E128 --no_val
 is saved.
-----
ltspice_demos - FEGIN
Using 5 layers, 16 hidden units, h = 2
Loading component_component representation dataset
Loading component_component representation data...
Loaded 1948 examples (component_component)
saving path: data/processed/ltspice_demos_component_component_processed.pt
ENTERED
Training FEGIN on component_component representation
Train: 1565, Test: 383
##################ITERATION #0 ****************************************
 epoch: 0, train_loss: 1.4038, test_loss: 1.3953, test_f1: 0.0301
 epoch: 1, train_loss: 1.3765, test_loss: 1.3776, test_f1: 0.1945
 epoch: 2, train_loss: 1.3569, test_loss: 1.3588, test_f1: 0.2314
 epoch: 3, train_loss: 1.3361, test_loss: 1.3405, test_f1: 0.2374
 epoch: 4, train_loss: 1.3133, test_loss: 1.3211, test_f1: 0.2281
 epoch: 5, train_loss: 1.2874, test_loss: 1.3054, test_f1: 0.2281
 epoch: 6, train_loss: 1.2698, test_loss: 1.2913, test_f1: 0.2281
 epoch: 7, train_loss: 1.2525, test_loss: 1.2815, test_f1: 0.2281
 epoch: 8, train_loss: 1.2381, test_loss: 1.2760, test_f1: 0.2809
 epoch: 9, train_loss: 1.2251, test_loss: 1.2706, test_f1: 0.2836
 epoch: 10, train_loss: 1.2165, test_loss: 1.2681, test_f1: 0.2981
 epoch: 11, train_loss: 1.2037, test_loss: 1.2973, test_f1: 0.2858
 epoch: 12, train_loss: 1.2023, test_loss: 1.3154, test_f1: 0.3301
 epoch: 13, train_loss: 1.1946, test_loss: 1.3641, test_f1: 0.3565
 epoch: 14, train_loss: 1.1838, test_loss: 1.3888, test_f1: 0.3449
 epoch: 15, train_loss: 1.1761, test_loss: 1.3598, test_f1: 0.3371
 epoch: 16, train_loss: 1.1758, test_loss: 1.3260, test_f1: 0.3504
 epoch: 17, train_loss: 1.1627, test_loss: 1.3790, test_f1: 0.3669
 epoch: 18, train_loss: 1.1594, test_loss: 1.4194, test_f1: 0.3605
 epoch: 19, train_loss: 1.1587, test_loss: 1.3762, test_f1: 0.3687
 epoch: 20, train_loss: 1.1377, test_loss: 1.3518, test_f1: 0.3698
 epoch: 21, train_loss: 1.1381, test_loss: 1.3764, test_f1: 0.3678
 epoch: 22, train_loss: 1.1356, test_loss: 1.4007, test_f1: 0.3514
 epoch: 23, train_loss: 1.1252, test_loss: 1.4704, test_f1: 0.4077
 epoch: 24, train_loss: 1.1154, test_loss: 1.4835, test_f1: 0.4190
 epoch: 25, train_loss: 1.0991, test_loss: 1.5740, test_f1: 0.4401
 epoch: 26, train_loss: 1.1038, test_loss: 1.5666, test_f1: 0.4575
 epoch: 27, train_loss: 1.0797, test_loss: 1.6010, test_f1: 0.4451
 epoch: 28, train_loss: 1.0684, test_loss: 1.6821, test_f1: 0.4503
 epoch: 29, train_loss: 1.0692, test_loss: 1.6278, test_f1: 0.4704
 epoch: 30, train_loss: 1.0501, test_loss: 1.7039, test_f1: 0.4842
 epoch: 31, train_loss: 1.0513, test_loss: 1.5860, test_f1: 0.4384
 epoch: 32, train_loss: 1.0331, test_loss: 1.8732, test_f1: 0.4727
 epoch: 33, train_loss: 1.0325, test_loss: 1.9862, test_f1: 0.4523
 epoch: 34, train_loss: 1.0298, test_loss: 2.1063, test_f1: 0.4670
 epoch: 35, train_loss: 1.0363, test_loss: 2.0401, test_f1: 0.4529
 epoch: 36, train_loss: 1.0130, test_loss: 2.1834, test_f1: 0.4628
 epoch: 37, train_loss: 1.0100, test_loss: 1.9059, test_f1: 0.4640
 epoch: 38, train_loss: 1.0017, test_loss: 1.9793, test_f1: 0.4679
 epoch: 39, train_loss: 0.9875, test_loss: 2.0869, test_f1: 0.4919
 epoch: 40, train_loss: 0.9891, test_loss: 2.0392, test_f1: 0.4917
 epoch: 41, train_loss: 0.9921, test_loss: 1.8943, test_f1: 0.4884
 epoch: 42, train_loss: 0.9838, test_loss: 2.0732, test_f1: 0.5035
 epoch: 43, train_loss: 0.9785, test_loss: 2.1083, test_f1: 0.5112
 epoch: 44, train_loss: 0.9470, test_loss: 2.3549, test_f1: 0.5280
 epoch: 45, train_loss: 0.9464, test_loss: 2.2268, test_f1: 0.5219
 epoch: 46, train_loss: 0.9807, test_loss: 2.3792, test_f1: 0.5180
 epoch: 47, train_loss: 0.9697, test_loss: 2.1809, test_f1: 0.4870
 epoch: 48, train_loss: 0.9643, test_loss: 2.6333, test_f1: 0.4997
 epoch: 49, train_loss: 0.9358, test_loss: 2.6247, test_f1: 0.5140
 epoch: 50, train_loss: 0.9247, test_loss: 2.7415, test_f1: 0.5001
 epoch: 51, train_loss: 0.9477, test_loss: 2.8212, test_f1: 0.5103
 epoch: 52, train_loss: 0.9324, test_loss: 2.8719, test_f1: 0.5338
 epoch: 53, train_loss: 0.9160, test_loss: 2.8364, test_f1: 0.5276
 epoch: 54, train_loss: 0.9028, test_loss: 2.9202, test_f1: 0.5278
 epoch: 55, train_loss: 0.9151, test_loss: 2.9311, test_f1: 0.5463
 epoch: 56, train_loss: 0.8964, test_loss: 2.7932, test_f1: 0.5412
 epoch: 57, train_loss: 0.8985, test_loss: 2.9975, test_f1: 0.5447
 epoch: 58, train_loss: 0.9167, test_loss: 2.7946, test_f1: 0.5396
 epoch: 59, train_loss: 0.8873, test_loss: 2.7044, test_f1: 0.5397
 epoch: 60, train_loss: 0.9060, test_loss: 2.9583, test_f1: 0.5388
 epoch: 61, train_loss: 0.9015, test_loss: 2.9468, test_f1: 0.5368
 epoch: 62, train_loss: 0.9043, test_loss: 2.8240, test_f1: 0.5282
 epoch: 63, train_loss: 0.8920, test_loss: 2.8277, test_f1: 0.5510
 epoch: 64, train_loss: 0.8876, test_loss: 2.8055, test_f1: 0.5611
 epoch: 65, train_loss: 0.9022, test_loss: 3.0021, test_f1: 0.5432
 epoch: 66, train_loss: 0.8804, test_loss: 3.0431, test_f1: 0.5505
 epoch: 67, train_loss: 0.8692, test_loss: 3.1591, test_f1: 0.5557
 epoch: 68, train_loss: 0.8890, test_loss: 3.0178, test_f1: 0.5525
 epoch: 69, train_loss: 0.8747, test_loss: 3.1226, test_f1: 0.5520
 epoch: 70, train_loss: 0.8801, test_loss: 3.1112, test_f1: 0.5623
 epoch: 71, train_loss: 0.8785, test_loss: 3.0838, test_f1: 0.5448
 epoch: 72, train_loss: 0.8870, test_loss: 3.2427, test_f1: 0.5437
 epoch: 73, train_loss: 0.8768, test_loss: 3.1917, test_f1: 0.5480
 epoch: 74, train_loss: 0.8711, test_loss: 3.1911, test_f1: 0.5563
 epoch: 75, train_loss: 0.8860, test_loss: 3.2364, test_f1: 0.5463
 epoch: 76, train_loss: 0.8634, test_loss: 3.2047, test_f1: 0.5507
 epoch: 77, train_loss: 0.8755, test_loss: 3.2096, test_f1: 0.5485
 epoch: 78, train_loss: 0.8715, test_loss: 3.0155, test_f1: 0.5361
 epoch: 79, train_loss: 0.8824, test_loss: 3.3256, test_f1: 0.5328
 epoch: 80, train_loss: 0.8643, test_loss: 3.4379, test_f1: 0.5406
 epoch: 81, train_loss: 0.8691, test_loss: 3.7762, test_f1: 0.5602
 epoch: 82, train_loss: 0.8694, test_loss: 3.5485, test_f1: 0.5498
 epoch: 83, train_loss: 0.8628, test_loss: 3.4244, test_f1: 0.5574
 epoch: 84, train_loss: 0.8529, test_loss: 3.5963, test_f1: 0.5545
 epoch: 85, train_loss: 0.8553, test_loss: 3.7074, test_f1: 0.5495
 epoch: 86, train_loss: 0.8358, test_loss: 3.5782, test_f1: 0.5415
 epoch: 87, train_loss: 0.8374, test_loss: 3.5892, test_f1: 0.5650
 epoch: 88, train_loss: 0.8536, test_loss: 3.5353, test_f1: 0.5638
 epoch: 89, train_loss: 0.8536, test_loss: 3.6378, test_f1: 0.5595
 epoch: 90, train_loss: 0.8378, test_loss: 3.7048, test_f1: 0.5547
 epoch: 91, train_loss: 0.8596, test_loss: 3.4855, test_f1: 0.5518
 epoch: 92, train_loss: 0.8517, test_loss: 3.3435, test_f1: 0.5472
 epoch: 93, train_loss: 0.8540, test_loss: 3.3455, test_f1: 0.5559
 epoch: 94, train_loss: 0.8388, test_loss: 3.7454, test_f1: 0.5447
 epoch: 95, train_loss: 0.8373, test_loss: 3.6682, test_f1: 0.5401
 epoch: 96, train_loss: 0.8353, test_loss: 4.0243, test_f1: 0.5583
 epoch: 97, train_loss: 0.8386, test_loss: 3.9415, test_f1: 0.5448
 epoch: 98, train_loss: 0.8334, test_loss: 3.8844, test_f1: 0.5453
 epoch: 99, train_loss: 0.8255, test_loss: 4.0436, test_f1: 0.5574
##################ITERATION #1 ****************************************
 epoch: 0, train_loss: 1.2859, test_loss: 1.3091, test_f1: 0.2471
 epoch: 1, train_loss: 1.2385, test_loss: 1.3090, test_f1: 0.3299
 epoch: 2, train_loss: 1.2145, test_loss: 1.3052, test_f1: 0.3252
 epoch: 3, train_loss: 1.2035, test_loss: 1.2912, test_f1: 0.3301
 epoch: 4, train_loss: 1.1920, test_loss: 1.2953, test_f1: 0.3460
 epoch: 5, train_loss: 1.1804, test_loss: 1.2959, test_f1: 0.3782
 epoch: 6, train_loss: 1.1738, test_loss: 1.2787, test_f1: 0.4172
 epoch: 7, train_loss: 1.1640, test_loss: 1.2761, test_f1: 0.4183
 epoch: 8, train_loss: 1.1492, test_loss: 1.2768, test_f1: 0.4319
 epoch: 9, train_loss: 1.1313, test_loss: 1.2632, test_f1: 0.4218
 epoch: 10, train_loss: 1.1296, test_loss: 1.2537, test_f1: 0.4259
 epoch: 11, train_loss: 1.1180, test_loss: 1.2272, test_f1: 0.4390
 epoch: 12, train_loss: 1.1189, test_loss: 1.2252, test_f1: 0.4377
 epoch: 13, train_loss: 1.1021, test_loss: 1.2039, test_f1: 0.4580
 epoch: 14, train_loss: 1.0883, test_loss: 1.2279, test_f1: 0.4643
 epoch: 15, train_loss: 1.0907, test_loss: 1.2399, test_f1: 0.4487
 epoch: 16, train_loss: 1.0746, test_loss: 1.2357, test_f1: 0.4612
 epoch: 17, train_loss: 1.0719, test_loss: 1.2145, test_f1: 0.4744
 epoch: 18, train_loss: 1.0676, test_loss: 1.1995, test_f1: 0.4848
 epoch: 19, train_loss: 1.0585, test_loss: 1.2157, test_f1: 0.4948
 epoch: 20, train_loss: 1.0401, test_loss: 1.2077, test_f1: 0.4653
 epoch: 21, train_loss: 1.0309, test_loss: 1.2004, test_f1: 0.4846
 epoch: 22, train_loss: 1.0191, test_loss: 1.2005, test_f1: 0.4951
 epoch: 23, train_loss: 1.0274, test_loss: 1.2005, test_f1: 0.4783
 epoch: 24, train_loss: 1.0067, test_loss: 1.1996, test_f1: 0.4485
 epoch: 25, train_loss: 1.0035, test_loss: 1.1539, test_f1: 0.4968
 epoch: 26, train_loss: 1.0018, test_loss: 1.1742, test_f1: 0.4555
 epoch: 27, train_loss: 1.0035, test_loss: 1.1275, test_f1: 0.5159
 epoch: 28, train_loss: 0.9842, test_loss: 1.1775, test_f1: 0.4925
 epoch: 29, train_loss: 0.9860, test_loss: 1.1875, test_f1: 0.5266
 epoch: 30, train_loss: 0.9757, test_loss: 1.1681, test_f1: 0.5234
 epoch: 31, train_loss: 0.9649, test_loss: 1.1541, test_f1: 0.5356
 epoch: 32, train_loss: 0.9447, test_loss: 1.1628, test_f1: 0.5061
 epoch: 33, train_loss: 0.9633, test_loss: 1.2043, test_f1: 0.4817
 epoch: 34, train_loss: 0.9590, test_loss: 1.1695, test_f1: 0.5047
 epoch: 35, train_loss: 0.9547, test_loss: 1.1264, test_f1: 0.5344
 epoch: 36, train_loss: 0.9469, test_loss: 1.1342, test_f1: 0.5355
 epoch: 37, train_loss: 0.9371, test_loss: 1.1398, test_f1: 0.5142
 epoch: 38, train_loss: 0.9498, test_loss: 1.1437, test_f1: 0.5152
 epoch: 39, train_loss: 0.9293, test_loss: 1.1769, test_f1: 0.4836
 epoch: 40, train_loss: 0.9278, test_loss: 1.1860, test_f1: 0.4893
 epoch: 41, train_loss: 0.9242, test_loss: 1.1407, test_f1: 0.5410
 epoch: 42, train_loss: 0.9250, test_loss: 1.1805, test_f1: 0.4858
 epoch: 43, train_loss: 0.9219, test_loss: 1.2134, test_f1: 0.4902
 epoch: 44, train_loss: 0.9274, test_loss: 1.1551, test_f1: 0.5341
 epoch: 45, train_loss: 0.9074, test_loss: 1.1576, test_f1: 0.5365
 epoch: 46, train_loss: 0.9059, test_loss: 1.1808, test_f1: 0.5046
 epoch: 47, train_loss: 0.8966, test_loss: 1.2114, test_f1: 0.5037
 epoch: 48, train_loss: 0.8894, test_loss: 1.2019, test_f1: 0.4946
 epoch: 49, train_loss: 0.8761, test_loss: 1.1966, test_f1: 0.5069
 epoch: 50, train_loss: 0.8829, test_loss: 1.2071, test_f1: 0.5135
 epoch: 51, train_loss: 0.8689, test_loss: 1.1947, test_f1: 0.5237
 epoch: 52, train_loss: 0.8662, test_loss: 1.2012, test_f1: 0.5164
 epoch: 53, train_loss: 0.8612, test_loss: 1.1877, test_f1: 0.5133
 epoch: 54, train_loss: 0.8556, test_loss: 1.1855, test_f1: 0.5161
 epoch: 55, train_loss: 0.8630, test_loss: 1.1805, test_f1: 0.5339
 epoch: 56, train_loss: 0.8737, test_loss: 1.1894, test_f1: 0.5439
 epoch: 57, train_loss: 0.8571, test_loss: 1.2663, test_f1: 0.4790
 epoch: 58, train_loss: 0.8483, test_loss: 1.2353, test_f1: 0.5361
 epoch: 59, train_loss: 0.8272, test_loss: 1.2302, test_f1: 0.5333
 epoch: 60, train_loss: 0.8386, test_loss: 1.2559, test_f1: 0.5014
 epoch: 61, train_loss: 0.8541, test_loss: 1.2317, test_f1: 0.5206
 epoch: 62, train_loss: 0.8340, test_loss: 1.2717, test_f1: 0.5137
 epoch: 63, train_loss: 0.8250, test_loss: 1.2682, test_f1: 0.5187
 epoch: 64, train_loss: 0.8357, test_loss: 1.2775, test_f1: 0.5218
 epoch: 65, train_loss: 0.8321, test_loss: 1.2308, test_f1: 0.5365
 epoch: 66, train_loss: 0.8135, test_loss: 1.2571, test_f1: 0.5464
 epoch: 67, train_loss: 0.8364, test_loss: 1.2696, test_f1: 0.5409
 epoch: 68, train_loss: 0.8340, test_loss: 1.2569, test_f1: 0.5296
 epoch: 69, train_loss: 0.8322, test_loss: 1.3145, test_f1: 0.4806
 epoch: 70, train_loss: 0.8342, test_loss: 1.3037, test_f1: 0.4940
 epoch: 71, train_loss: 0.8250, test_loss: 1.2995, test_f1: 0.5380
 epoch: 72, train_loss: 0.8278, test_loss: 1.2668, test_f1: 0.5445
 epoch: 73, train_loss: 0.8242, test_loss: 1.2526, test_f1: 0.5485
 epoch: 74, train_loss: 0.8148, test_loss: 1.2579, test_f1: 0.5521
 epoch: 75, train_loss: 0.8146, test_loss: 1.2876, test_f1: 0.5236
 epoch: 76, train_loss: 0.8137, test_loss: 1.2970, test_f1: 0.5480
 epoch: 77, train_loss: 0.8249, test_loss: 1.2685, test_f1: 0.5430
 epoch: 78, train_loss: 0.8234, test_loss: 1.2340, test_f1: 0.5315
 epoch: 79, train_loss: 0.8127, test_loss: 1.2601, test_f1: 0.5459
 epoch: 80, train_loss: 0.8182, test_loss: 1.2891, test_f1: 0.5428
 epoch: 81, train_loss: 0.8152, test_loss: 1.2815, test_f1: 0.5382
 epoch: 82, train_loss: 0.8181, test_loss: 1.2699, test_f1: 0.5381
 epoch: 83, train_loss: 0.8056, test_loss: 1.2674, test_f1: 0.5393
 epoch: 84, train_loss: 0.8035, test_loss: 1.2465, test_f1: 0.5471
 epoch: 85, train_loss: 0.8053, test_loss: 1.2614, test_f1: 0.5379
 epoch: 86, train_loss: 0.8164, test_loss: 1.2721, test_f1: 0.5459
 epoch: 87, train_loss: 0.7967, test_loss: 1.2875, test_f1: 0.5438
 epoch: 88, train_loss: 0.8051, test_loss: 1.2947, test_f1: 0.5436
 epoch: 89, train_loss: 0.8032, test_loss: 1.3147, test_f1: 0.5408
 epoch: 90, train_loss: 0.7856, test_loss: 1.2758, test_f1: 0.5587
 epoch: 91, train_loss: 0.7841, test_loss: 1.2846, test_f1: 0.5567
 epoch: 92, train_loss: 0.7900, test_loss: 1.2916, test_f1: 0.5350
 epoch: 93, train_loss: 0.7888, test_loss: 1.3196, test_f1: 0.5564
 epoch: 94, train_loss: 0.7804, test_loss: 1.3364, test_f1: 0.5426
 epoch: 95, train_loss: 0.7867, test_loss: 1.2915, test_f1: 0.5666
 epoch: 96, train_loss: 0.7883, test_loss: 1.3276, test_f1: 0.5327
 epoch: 97, train_loss: 0.7841, test_loss: 1.2835, test_f1: 0.5326
 epoch: 98, train_loss: 0.7809, test_loss: 1.3014, test_f1: 0.5722
 epoch: 99, train_loss: 0.7722, test_loss: 1.3012, test_f1: 0.5590
##################ITERATION #2 ****************************************
 epoch: 0, train_loss: 1.3678, test_loss: 1.3547, test_f1: 0.1636
 epoch: 1, train_loss: 1.2643, test_loss: 1.3179, test_f1: 0.1882
 epoch: 2, train_loss: 1.2361, test_loss: 1.3052, test_f1: 0.3580
 epoch: 3, train_loss: 1.2234, test_loss: 1.3023, test_f1: 0.3073
 epoch: 4, train_loss: 1.2068, test_loss: 1.3002, test_f1: 0.3368
 epoch: 5, train_loss: 1.2050, test_loss: 1.2921, test_f1: 0.3867
 epoch: 6, train_loss: 1.1855, test_loss: 1.2808, test_f1: 0.3816
 epoch: 7, train_loss: 1.1752, test_loss: 1.2637, test_f1: 0.4046
 epoch: 8, train_loss: 1.1705, test_loss: 1.2513, test_f1: 0.4280
 epoch: 9, train_loss: 1.1549, test_loss: 1.2394, test_f1: 0.4194
 epoch: 10, train_loss: 1.1519, test_loss: 1.2273, test_f1: 0.4235
 epoch: 11, train_loss: 1.1414, test_loss: 1.2220, test_f1: 0.4040
 epoch: 12, train_loss: 1.1244, test_loss: 1.2230, test_f1: 0.4278
 epoch: 13, train_loss: 1.1194, test_loss: 1.2120, test_f1: 0.4431
 epoch: 14, train_loss: 1.1002, test_loss: 1.2082, test_f1: 0.4571
 epoch: 15, train_loss: 1.0951, test_loss: 1.1846, test_f1: 0.4728
 epoch: 16, train_loss: 1.0802, test_loss: 1.1831, test_f1: 0.4992
 epoch: 17, train_loss: 1.0582, test_loss: 1.1664, test_f1: 0.4882
 epoch: 18, train_loss: 1.0614, test_loss: 1.1670, test_f1: 0.4762
 epoch: 19, train_loss: 1.0517, test_loss: 1.1564, test_f1: 0.4968
 epoch: 20, train_loss: 1.0512, test_loss: 1.1489, test_f1: 0.5322
 epoch: 21, train_loss: 1.0346, test_loss: 1.1534, test_f1: 0.5312
 epoch: 22, train_loss: 1.0373, test_loss: 1.1258, test_f1: 0.5035
 epoch: 23, train_loss: 1.0243, test_loss: 1.1462, test_f1: 0.5170
 epoch: 24, train_loss: 1.0110, test_loss: 1.1462, test_f1: 0.5236
 epoch: 25, train_loss: 0.9996, test_loss: 1.1391, test_f1: 0.5117
 epoch: 26, train_loss: 1.0028, test_loss: 1.1146, test_f1: 0.5189
 epoch: 27, train_loss: 0.9942, test_loss: 1.0936, test_f1: 0.5279
 epoch: 28, train_loss: 0.9709, test_loss: 1.1121, test_f1: 0.5354
 epoch: 29, train_loss: 0.9776, test_loss: 1.1016, test_f1: 0.5165
 epoch: 30, train_loss: 0.9708, test_loss: 1.1206, test_f1: 0.5302
 epoch: 31, train_loss: 0.9691, test_loss: 1.1143, test_f1: 0.5289
 epoch: 32, train_loss: 0.9525, test_loss: 1.0982, test_f1: 0.5264
 epoch: 33, train_loss: 0.9513, test_loss: 1.1012, test_f1: 0.5280
 epoch: 34, train_loss: 0.9384, test_loss: 1.0973, test_f1: 0.5332
 epoch: 35, train_loss: 0.9381, test_loss: 1.1225, test_f1: 0.5337
 epoch: 36, train_loss: 0.9267, test_loss: 1.0977, test_f1: 0.5350
 epoch: 37, train_loss: 0.9212, test_loss: 1.1256, test_f1: 0.4936
 epoch: 38, train_loss: 0.9140, test_loss: 1.1029, test_f1: 0.5433
 epoch: 39, train_loss: 0.9110, test_loss: 1.0896, test_f1: 0.5297
 epoch: 40, train_loss: 0.9007, test_loss: 1.0778, test_f1: 0.5166
 epoch: 41, train_loss: 0.8892, test_loss: 1.0984, test_f1: 0.5342
 epoch: 42, train_loss: 0.8965, test_loss: 1.0781, test_f1: 0.5173
 epoch: 43, train_loss: 0.8994, test_loss: 1.1775, test_f1: 0.5091
 epoch: 44, train_loss: 0.8838, test_loss: 1.1107, test_f1: 0.5214
 epoch: 45, train_loss: 0.8772, test_loss: 1.1124, test_f1: 0.4861
 epoch: 46, train_loss: 0.8747, test_loss: 1.1355, test_f1: 0.4822
 epoch: 47, train_loss: 0.8696, test_loss: 1.1198, test_f1: 0.4919
 epoch: 48, train_loss: 0.8653, test_loss: 1.0805, test_f1: 0.4974
 epoch: 49, train_loss: 0.8739, test_loss: 1.1131, test_f1: 0.5057
 epoch: 50, train_loss: 0.8575, test_loss: 1.1488, test_f1: 0.4888
 epoch: 51, train_loss: 0.8379, test_loss: 1.1354, test_f1: 0.4630
 epoch: 52, train_loss: 0.8374, test_loss: 1.0988, test_f1: 0.4943
 epoch: 53, train_loss: 0.8315, test_loss: 1.0863, test_f1: 0.4930
 epoch: 54, train_loss: 0.8705, test_loss: 1.1094, test_f1: 0.4787
 epoch: 55, train_loss: 0.8468, test_loss: 1.1153, test_f1: 0.4853
 epoch: 56, train_loss: 0.8493, test_loss: 1.1192, test_f1: 0.4686
 epoch: 57, train_loss: 0.8239, test_loss: 1.1154, test_f1: 0.4833
 epoch: 58, train_loss: 0.8524, test_loss: 1.1295, test_f1: 0.5017
 epoch: 59, train_loss: 0.8241, test_loss: 1.1391, test_f1: 0.4889
 epoch: 60, train_loss: 0.8053, test_loss: 1.1262, test_f1: 0.4971
 epoch: 61, train_loss: 0.8023, test_loss: 1.1235, test_f1: 0.4946
 epoch: 62, train_loss: 0.8101, test_loss: 1.1540, test_f1: 0.4770
 epoch: 63, train_loss: 0.8139, test_loss: 1.1753, test_f1: 0.4695
 epoch: 64, train_loss: 0.8175, test_loss: 1.1581, test_f1: 0.4680
 epoch: 65, train_loss: 0.8008, test_loss: 1.1321, test_f1: 0.4837
 epoch: 66, train_loss: 0.7905, test_loss: 1.1475, test_f1: 0.4856
 epoch: 67, train_loss: 0.8108, test_loss: 1.1535, test_f1: 0.4931
 epoch: 68, train_loss: 0.8156, test_loss: 1.1417, test_f1: 0.4780
 epoch: 69, train_loss: 0.8195, test_loss: 1.1559, test_f1: 0.4800
 epoch: 70, train_loss: 0.8120, test_loss: 1.1840, test_f1: 0.4973
 epoch: 71, train_loss: 0.7981, test_loss: 1.1316, test_f1: 0.5017
 epoch: 72, train_loss: 0.7971, test_loss: 1.1358, test_f1: 0.4983
 epoch: 73, train_loss: 0.7900, test_loss: 1.1623, test_f1: 0.4619
 epoch: 74, train_loss: 0.7855, test_loss: 1.1665, test_f1: 0.4729
 epoch: 75, train_loss: 0.7865, test_loss: 1.1776, test_f1: 0.4955
 epoch: 76, train_loss: 0.7832, test_loss: 1.1920, test_f1: 0.4842
 epoch: 77, train_loss: 0.8083, test_loss: 1.2064, test_f1: 0.4928
 epoch: 78, train_loss: 0.7831, test_loss: 1.1909, test_f1: 0.4884
 epoch: 79, train_loss: 0.7794, test_loss: 1.2134, test_f1: 0.4764
 epoch: 80, train_loss: 0.7847, test_loss: 1.2455, test_f1: 0.4740
 epoch: 81, train_loss: 0.8100, test_loss: 1.2479, test_f1: 0.5023
 epoch: 82, train_loss: 0.7848, test_loss: 1.2548, test_f1: 0.5053
 epoch: 83, train_loss: 0.7793, test_loss: 1.2448, test_f1: 0.5016
 epoch: 84, train_loss: 0.7976, test_loss: 1.2851, test_f1: 0.4827
 epoch: 85, train_loss: 0.7916, test_loss: 1.2505, test_f1: 0.5073
 epoch: 86, train_loss: 0.7635, test_loss: 1.2539, test_f1: 0.5020
 epoch: 87, train_loss: 0.7762, test_loss: 1.2739, test_f1: 0.4988
 epoch: 88, train_loss: 0.7669, test_loss: 1.3273, test_f1: 0.5096
 epoch: 89, train_loss: 0.7823, test_loss: 1.2953, test_f1: 0.5063
 epoch: 90, train_loss: 0.7635, test_loss: 1.2687, test_f1: 0.4855
 epoch: 91, train_loss: 0.7929, test_loss: 1.3096, test_f1: 0.5196
 epoch: 92, train_loss: 0.7713, test_loss: 1.3261, test_f1: 0.4893
 epoch: 93, train_loss: 0.7663, test_loss: 1.3208, test_f1: 0.4907
 epoch: 94, train_loss: 0.7790, test_loss: 1.2506, test_f1: 0.5136
 epoch: 95, train_loss: 0.7738, test_loss: 1.2539, test_f1: 0.5206
 epoch: 96, train_loss: 0.7736, test_loss: 1.3082, test_f1: 0.4867
 epoch: 97, train_loss: 0.7600, test_loss: 1.2689, test_f1: 0.4899
 epoch: 98, train_loss: 0.7702, test_loss: 1.3085, test_f1: 0.4734
 epoch: 99, train_loss: 0.7580, test_loss: 1.3396, test_f1: 0.4949
##################ITERATION #3 ****************************************
 epoch: 0, train_loss: 1.2736, test_loss: 1.3219, test_f1: 0.3066
 epoch: 1, train_loss: 1.2296, test_loss: 1.3189, test_f1: 0.3539
 epoch: 2, train_loss: 1.2020, test_loss: 1.2983, test_f1: 0.3213
 epoch: 3, train_loss: 1.1889, test_loss: 1.2864, test_f1: 0.3454
 epoch: 4, train_loss: 1.1778, test_loss: 1.2792, test_f1: 0.3505
 epoch: 5, train_loss: 1.1582, test_loss: 1.2723, test_f1: 0.3899
 epoch: 6, train_loss: 1.1443, test_loss: 1.2693, test_f1: 0.3792
 epoch: 7, train_loss: 1.1376, test_loss: 1.2576, test_f1: 0.4025
 epoch: 8, train_loss: 1.1196, test_loss: 1.2817, test_f1: 0.3982
 epoch: 9, train_loss: 1.1043, test_loss: 1.2735, test_f1: 0.4277
 epoch: 10, train_loss: 1.1045, test_loss: 1.2314, test_f1: 0.4206
 epoch: 11, train_loss: 1.0955, test_loss: 1.2466, test_f1: 0.4244
 epoch: 12, train_loss: 1.0957, test_loss: 1.2685, test_f1: 0.4363
 epoch: 13, train_loss: 1.0778, test_loss: 1.3035, test_f1: 0.4375
 epoch: 14, train_loss: 1.0908, test_loss: 1.3091, test_f1: 0.4368
 epoch: 15, train_loss: 1.0784, test_loss: 1.3184, test_f1: 0.4400
 epoch: 16, train_loss: 1.0608, test_loss: 1.3274, test_f1: 0.4343
 epoch: 17, train_loss: 1.0677, test_loss: 1.3252, test_f1: 0.4094
 epoch: 18, train_loss: 1.0568, test_loss: 1.3449, test_f1: 0.4277
 epoch: 19, train_loss: 1.0513, test_loss: 1.3139, test_f1: 0.4320
 epoch: 20, train_loss: 1.0549, test_loss: 1.2764, test_f1: 0.4432
 epoch: 21, train_loss: 1.0431, test_loss: 1.3368, test_f1: 0.4334
 epoch: 22, train_loss: 1.0327, test_loss: 1.3339, test_f1: 0.4688
 epoch: 23, train_loss: 1.0177, test_loss: 1.2992, test_f1: 0.4284
 epoch: 24, train_loss: 1.0226, test_loss: 1.3419, test_f1: 0.4434
 epoch: 25, train_loss: 1.0205, test_loss: 1.4340, test_f1: 0.4410
 epoch: 26, train_loss: 1.0111, test_loss: 1.4678, test_f1: 0.4463
 epoch: 27, train_loss: 1.0197, test_loss: 1.4609, test_f1: 0.4715
 epoch: 28, train_loss: 1.0167, test_loss: 1.4804, test_f1: 0.4471
 epoch: 29, train_loss: 0.9917, test_loss: 1.4622, test_f1: 0.4591
 epoch: 30, train_loss: 0.9979, test_loss: 1.3867, test_f1: 0.4148
 epoch: 31, train_loss: 0.9872, test_loss: 1.3609, test_f1: 0.4046
 epoch: 32, train_loss: 0.9770, test_loss: 1.3731, test_f1: 0.4653
 epoch: 33, train_loss: 0.9543, test_loss: 1.3074, test_f1: 0.4501
 epoch: 34, train_loss: 0.9732, test_loss: 1.2284, test_f1: 0.4410
 epoch: 35, train_loss: 0.9677, test_loss: 1.2813, test_f1: 0.4208
 epoch: 36, train_loss: 0.9729, test_loss: 1.3098, test_f1: 0.4293
 epoch: 37, train_loss: 0.9735, test_loss: 1.3012, test_f1: 0.4504
 epoch: 38, train_loss: 0.9604, test_loss: 1.3183, test_f1: 0.4229
 epoch: 39, train_loss: 0.9433, test_loss: 1.2390, test_f1: 0.4615
 epoch: 40, train_loss: 0.9455, test_loss: 1.2466, test_f1: 0.4877
 epoch: 41, train_loss: 0.9299, test_loss: 1.2946, test_f1: 0.4724
 epoch: 42, train_loss: 0.9367, test_loss: 1.2676, test_f1: 0.4931
 epoch: 43, train_loss: 0.9279, test_loss: 1.3180, test_f1: 0.4716
 epoch: 44, train_loss: 0.9150, test_loss: 1.7776, test_f1: 0.4686
 epoch: 45, train_loss: 0.9124, test_loss: 1.5855, test_f1: 0.4750
 epoch: 46, train_loss: 0.9016, test_loss: 1.3909, test_f1: 0.4955
 epoch: 47, train_loss: 0.9084, test_loss: 1.3466, test_f1: 0.4913
 epoch: 48, train_loss: 0.8962, test_loss: 1.4731, test_f1: 0.4148
 epoch: 49, train_loss: 0.9061, test_loss: 1.4800, test_f1: 0.4287
 epoch: 50, train_loss: 0.9057, test_loss: 1.5397, test_f1: 0.4485
 epoch: 51, train_loss: 0.8800, test_loss: 1.4624, test_f1: 0.4609
 epoch: 52, train_loss: 0.8830, test_loss: 1.4385, test_f1: 0.4827
 epoch: 53, train_loss: 0.8854, test_loss: 1.4131, test_f1: 0.4900
 epoch: 54, train_loss: 0.8886, test_loss: 1.3985, test_f1: 0.4902
 epoch: 55, train_loss: 0.8770, test_loss: 1.4318, test_f1: 0.4923
 epoch: 56, train_loss: 0.8810, test_loss: 1.6185, test_f1: 0.4525
 epoch: 57, train_loss: 0.8745, test_loss: 1.5449, test_f1: 0.5007
 epoch: 58, train_loss: 0.8732, test_loss: 1.5415, test_f1: 0.4837
 epoch: 59, train_loss: 0.8713, test_loss: 1.3832, test_f1: 0.4896
 epoch: 60, train_loss: 0.8577, test_loss: 1.4074, test_f1: 0.4779
 epoch: 61, train_loss: 0.8591, test_loss: 1.3897, test_f1: 0.4538
 epoch: 62, train_loss: 0.8714, test_loss: 1.3607, test_f1: 0.4746
 epoch: 63, train_loss: 0.8585, test_loss: 1.3291, test_f1: 0.4838
 epoch: 64, train_loss: 0.8623, test_loss: 1.3448, test_f1: 0.4565
 epoch: 65, train_loss: 0.8686, test_loss: 1.3396, test_f1: 0.4927
 epoch: 66, train_loss: 0.8681, test_loss: 1.3439, test_f1: 0.4690
 epoch: 67, train_loss: 0.8527, test_loss: 1.3902, test_f1: 0.4891
 epoch: 68, train_loss: 0.8545, test_loss: 1.4194, test_f1: 0.4781
 epoch: 69, train_loss: 0.8676, test_loss: 1.4451, test_f1: 0.4776
 epoch: 70, train_loss: 0.8589, test_loss: 1.4202, test_f1: 0.4829
 epoch: 71, train_loss: 0.8374, test_loss: 1.3333, test_f1: 0.4832
 epoch: 72, train_loss: 0.8442, test_loss: 1.4280, test_f1: 0.4578
 epoch: 73, train_loss: 0.8537, test_loss: 1.3691, test_f1: 0.4875
 epoch: 74, train_loss: 0.8487, test_loss: 1.3722, test_f1: 0.4948
 epoch: 75, train_loss: 0.8480, test_loss: 1.3769, test_f1: 0.4788
 epoch: 76, train_loss: 0.8507, test_loss: 1.4425, test_f1: 0.4637
 epoch: 77, train_loss: 0.8341, test_loss: 1.4080, test_f1: 0.4910
 epoch: 78, train_loss: 0.8414, test_loss: 1.4479, test_f1: 0.4801
 epoch: 79, train_loss: 0.8575, test_loss: 1.4042, test_f1: 0.4776
 epoch: 80, train_loss: 0.8509, test_loss: 1.4127, test_f1: 0.4863
 epoch: 81, train_loss: 0.8398, test_loss: 1.4284, test_f1: 0.4964
 epoch: 82, train_loss: 0.8543, test_loss: 1.4247, test_f1: 0.4812
 epoch: 83, train_loss: 0.8460, test_loss: 1.4277, test_f1: 0.4940
 epoch: 84, train_loss: 0.8434, test_loss: 1.4531, test_f1: 0.4836
 epoch: 85, train_loss: 0.8605, test_loss: 1.5294, test_f1: 0.4714
 epoch: 86, train_loss: 0.8440, test_loss: 1.6190, test_f1: 0.4715
 epoch: 87, train_loss: 0.8369, test_loss: 1.5328, test_f1: 0.4796
 epoch: 88, train_loss: 0.8301, test_loss: 1.6733, test_f1: 0.4936
 epoch: 89, train_loss: 0.8302, test_loss: 1.6232, test_f1: 0.4982
 epoch: 90, train_loss: 0.8354, test_loss: 1.6192, test_f1: 0.4968
 epoch: 91, train_loss: 0.8233, test_loss: 1.5969, test_f1: 0.4915
 epoch: 92, train_loss: 0.8392, test_loss: 1.5612, test_f1: 0.4897
 epoch: 93, train_loss: 0.8091, test_loss: 1.4236, test_f1: 0.4832
 epoch: 94, train_loss: 0.8231, test_loss: 1.3950, test_f1: 0.5118
 epoch: 95, train_loss: 0.8124, test_loss: 1.4304, test_f1: 0.4932
 epoch: 96, train_loss: 0.8285, test_loss: 1.3777, test_f1: 0.4813
 epoch: 97, train_loss: 0.8350, test_loss: 1.2451, test_f1: 0.4916
 epoch: 98, train_loss: 0.8143, test_loss: 1.3322, test_f1: 0.4999
 epoch: 99, train_loss: 0.8382, test_loss: 1.3321, test_f1: 0.4751
##################ITERATION #4 ****************************************
 epoch: 0, train_loss: 1.2994, test_loss: 1.3248, test_f1: 0.2429
 epoch: 1, train_loss: 1.2223, test_loss: 1.2820, test_f1: 0.2357
 epoch: 2, train_loss: 1.2067, test_loss: 1.2621, test_f1: 0.2630
 epoch: 3, train_loss: 1.1859, test_loss: 1.2479, test_f1: 0.2639
 epoch: 4, train_loss: 1.1828, test_loss: 1.2243, test_f1: 0.3337
 epoch: 5, train_loss: 1.1739, test_loss: 1.2154, test_f1: 0.3613
 epoch: 6, train_loss: 1.1500, test_loss: 1.2186, test_f1: 0.3952
 epoch: 7, train_loss: 1.1287, test_loss: 1.2228, test_f1: 0.4046
 epoch: 8, train_loss: 1.1220, test_loss: 1.2284, test_f1: 0.3888
 epoch: 9, train_loss: 1.1171, test_loss: 1.2219, test_f1: 0.4135
 epoch: 10, train_loss: 1.1146, test_loss: 1.2047, test_f1: 0.3959
 epoch: 11, train_loss: 1.1115, test_loss: 1.2029, test_f1: 0.4042
 epoch: 12, train_loss: 1.0854, test_loss: 1.2058, test_f1: 0.4143
 epoch: 13, train_loss: 1.0831, test_loss: 1.2072, test_f1: 0.4305
 epoch: 14, train_loss: 1.0542, test_loss: 1.1862, test_f1: 0.3870
 epoch: 15, train_loss: 1.0452, test_loss: 1.2108, test_f1: 0.4046
 epoch: 16, train_loss: 1.0707, test_loss: 1.2478, test_f1: 0.4224
 epoch: 17, train_loss: 1.0572, test_loss: 1.2296, test_f1: 0.4004
 epoch: 18, train_loss: 1.0403, test_loss: 1.1817, test_f1: 0.4108
 epoch: 19, train_loss: 1.0426, test_loss: 1.1945, test_f1: 0.4356
 epoch: 20, train_loss: 1.0264, test_loss: 1.2258, test_f1: 0.4431
 epoch: 21, train_loss: 1.0054, test_loss: 1.2150, test_f1: 0.4885
 epoch: 22, train_loss: 1.0093, test_loss: 1.2706, test_f1: 0.4813
 epoch: 23, train_loss: 1.0185, test_loss: 1.2185, test_f1: 0.4888
 epoch: 24, train_loss: 0.9922, test_loss: 1.2097, test_f1: 0.4611
 epoch: 25, train_loss: 0.9892, test_loss: 1.1816, test_f1: 0.5122
 epoch: 26, train_loss: 0.9857, test_loss: 1.2685, test_f1: 0.4978
 epoch: 27, train_loss: 0.9720, test_loss: 1.1988, test_f1: 0.5048
 epoch: 28, train_loss: 0.9726, test_loss: 1.3380, test_f1: 0.5010
 epoch: 29, train_loss: 0.9705, test_loss: 1.2565, test_f1: 0.5115
 epoch: 30, train_loss: 0.9448, test_loss: 1.3345, test_f1: 0.4851
 epoch: 31, train_loss: 0.9435, test_loss: 1.2078, test_f1: 0.5268
 epoch: 32, train_loss: 0.9478, test_loss: 1.2224, test_f1: 0.5231
 epoch: 33, train_loss: 0.9346, test_loss: 1.2044, test_f1: 0.5188
 epoch: 34, train_loss: 0.9264, test_loss: 1.2427, test_f1: 0.5035
 epoch: 35, train_loss: 0.9289, test_loss: 1.2481, test_f1: 0.5180
 epoch: 36, train_loss: 0.9202, test_loss: 1.2651, test_f1: 0.5183
 epoch: 37, train_loss: 0.9309, test_loss: 1.2953, test_f1: 0.5006
 epoch: 38, train_loss: 0.9250, test_loss: 1.2561, test_f1: 0.5081
 epoch: 39, train_loss: 0.9027, test_loss: 1.2891, test_f1: 0.5260
 epoch: 40, train_loss: 0.9169, test_loss: 1.2750, test_f1: 0.5280
 epoch: 41, train_loss: 0.8993, test_loss: 1.2878, test_f1: 0.5223
 epoch: 42, train_loss: 0.9063, test_loss: 1.3354, test_f1: 0.4995
 epoch: 43, train_loss: 0.8985, test_loss: 1.3372, test_f1: 0.4902
 epoch: 44, train_loss: 0.8959, test_loss: 1.2233, test_f1: 0.5115
 epoch: 45, train_loss: 0.8943, test_loss: 1.4464, test_f1: 0.4754
 epoch: 46, train_loss: 0.8980, test_loss: 1.3594, test_f1: 0.5571
 epoch: 47, train_loss: 0.8939, test_loss: 1.2555, test_f1: 0.5419
 epoch: 48, train_loss: 0.8786, test_loss: 1.1686, test_f1: 0.5274
 epoch: 49, train_loss: 0.8772, test_loss: 1.2142, test_f1: 0.5170
 epoch: 50, train_loss: 0.8850, test_loss: 1.2423, test_f1: 0.5603
 epoch: 51, train_loss: 0.8705, test_loss: 1.2010, test_f1: 0.5618
 epoch: 52, train_loss: 0.8695, test_loss: 1.1781, test_f1: 0.5295
 epoch: 53, train_loss: 0.8762, test_loss: 1.1847, test_f1: 0.5510
 epoch: 54, train_loss: 0.8676, test_loss: 1.2419, test_f1: 0.5170
 epoch: 55, train_loss: 0.8623, test_loss: 1.2107, test_f1: 0.5224
 epoch: 56, train_loss: 0.8575, test_loss: 1.2185, test_f1: 0.5125
 epoch: 57, train_loss: 0.8546, test_loss: 1.2040, test_f1: 0.5249
 epoch: 58, train_loss: 0.8491, test_loss: 1.1787, test_f1: 0.5635
 epoch: 59, train_loss: 0.8666, test_loss: 1.2044, test_f1: 0.5248
 epoch: 60, train_loss: 0.8470, test_loss: 1.2683, test_f1: 0.5231
 epoch: 61, train_loss: 0.8513, test_loss: 1.2572, test_f1: 0.5301
 epoch: 62, train_loss: 0.8612, test_loss: 1.2057, test_f1: 0.5588
 epoch: 63, train_loss: 0.8444, test_loss: 1.2679, test_f1: 0.5128
 epoch: 64, train_loss: 0.8390, test_loss: 1.2520, test_f1: 0.5208
 epoch: 65, train_loss: 0.8250, test_loss: 1.2967, test_f1: 0.5080
 epoch: 66, train_loss: 0.8552, test_loss: 1.3043, test_f1: 0.5162
 epoch: 67, train_loss: 0.8319, test_loss: 1.2846, test_f1: 0.5316
 epoch: 68, train_loss: 0.8249, test_loss: 1.2755, test_f1: 0.5150
 epoch: 69, train_loss: 0.8291, test_loss: 1.2636, test_f1: 0.5212
 epoch: 70, train_loss: 0.8380, test_loss: 1.3758, test_f1: 0.5118
 epoch: 71, train_loss: 0.8189, test_loss: 1.3220, test_f1: 0.5247
 epoch: 72, train_loss: 0.8234, test_loss: 1.3111, test_f1: 0.5154
 epoch: 73, train_loss: 0.8100, test_loss: 1.3250, test_f1: 0.5278
 epoch: 74, train_loss: 0.8255, test_loss: 1.3521, test_f1: 0.4932
 epoch: 75, train_loss: 0.8313, test_loss: 1.3370, test_f1: 0.5218
 epoch: 76, train_loss: 0.8134, test_loss: 1.3210, test_f1: 0.5257
 epoch: 77, train_loss: 0.8223, test_loss: 1.3628, test_f1: 0.5166
 epoch: 78, train_loss: 0.8245, test_loss: 1.3480, test_f1: 0.5120
 epoch: 79, train_loss: 0.8132, test_loss: 1.3692, test_f1: 0.5158
 epoch: 80, train_loss: 0.8125, test_loss: 1.4060, test_f1: 0.5014
 epoch: 81, train_loss: 0.8095, test_loss: 1.3827, test_f1: 0.5203
 epoch: 82, train_loss: 0.7949, test_loss: 1.3802, test_f1: 0.5091
 epoch: 83, train_loss: 0.8209, test_loss: 1.3409, test_f1: 0.5217
 epoch: 84, train_loss: 0.7975, test_loss: 1.4176, test_f1: 0.5049
 epoch: 85, train_loss: 0.8007, test_loss: 1.4686, test_f1: 0.5048
 epoch: 86, train_loss: 0.8060, test_loss: 1.4282, test_f1: 0.5162
 epoch: 87, train_loss: 0.8132, test_loss: 1.3684, test_f1: 0.5292
 epoch: 88, train_loss: 0.7964, test_loss: 1.5025, test_f1: 0.4944
 epoch: 89, train_loss: 0.8021, test_loss: 1.4631, test_f1: 0.5256
 epoch: 90, train_loss: 0.7904, test_loss: 1.4006, test_f1: 0.5289
 epoch: 91, train_loss: 0.8178, test_loss: 1.6280, test_f1: 0.4983
 epoch: 92, train_loss: 0.8193, test_loss: 1.4812, test_f1: 0.5347
 epoch: 93, train_loss: 0.8093, test_loss: 1.4902, test_f1: 0.5058
 epoch: 94, train_loss: 0.8046, test_loss: 1.4875, test_f1: 0.5146
 epoch: 95, train_loss: 0.7951, test_loss: 1.4078, test_f1: 0.5293
 epoch: 96, train_loss: 0.8104, test_loss: 1.4689, test_f1: 0.5130
 epoch: 97, train_loss: 0.8151, test_loss: 1.5005, test_f1: 0.5027
 epoch: 98, train_loss: 0.7801, test_loss: 1.5073, test_f1: 0.5134
 epoch: 99, train_loss: 0.7767, test_loss: 1.4534, test_f1: 0.5113
##################ITERATION #5 ****************************************
 epoch: 0, train_loss: 1.3501, test_loss: 1.3760, test_f1: 0.2404
 epoch: 1, train_loss: 1.2614, test_loss: 1.3306, test_f1: 0.2310
 epoch: 2, train_loss: 1.2459, test_loss: 1.3346, test_f1: 0.2366
 epoch: 3, train_loss: 1.2301, test_loss: 1.3688, test_f1: 0.2443
 epoch: 4, train_loss: 1.2159, test_loss: 1.3790, test_f1: 0.3165
 epoch: 5, train_loss: 1.2006, test_loss: 1.4341, test_f1: 0.3428
 epoch: 6, train_loss: 1.2042, test_loss: 1.3304, test_f1: 0.3557
 epoch: 7, train_loss: 1.1961, test_loss: 1.2610, test_f1: 0.3755
 epoch: 8, train_loss: 1.1802, test_loss: 1.3012, test_f1: 0.4113
 epoch: 9, train_loss: 1.1682, test_loss: 1.3387, test_f1: 0.4240
 epoch: 10, train_loss: 1.1771, test_loss: 1.3885, test_f1: 0.4006
 epoch: 11, train_loss: 1.1599, test_loss: 1.3856, test_f1: 0.4262
 epoch: 12, train_loss: 1.1486, test_loss: 1.4124, test_f1: 0.4424
 epoch: 13, train_loss: 1.1459, test_loss: 1.4055, test_f1: 0.4586
 epoch: 14, train_loss: 1.1382, test_loss: 1.3885, test_f1: 0.4586
 epoch: 15, train_loss: 1.1185, test_loss: 1.3623, test_f1: 0.4628
 epoch: 16, train_loss: 1.1131, test_loss: 1.2371, test_f1: 0.4639
 epoch: 17, train_loss: 1.0986, test_loss: 1.3087, test_f1: 0.4703
 epoch: 18, train_loss: 1.0779, test_loss: 1.3175, test_f1: 0.4777
 epoch: 19, train_loss: 1.0848, test_loss: 1.2397, test_f1: 0.4729
 epoch: 20, train_loss: 1.0893, test_loss: 1.2123, test_f1: 0.4730
 epoch: 21, train_loss: 1.0828, test_loss: 1.2109, test_f1: 0.4765
 epoch: 22, train_loss: 1.0614, test_loss: 1.2958, test_f1: 0.4963
 epoch: 23, train_loss: 1.0587, test_loss: 1.2989, test_f1: 0.5182
 epoch: 24, train_loss: 1.0587, test_loss: 1.2814, test_f1: 0.5120
 epoch: 25, train_loss: 1.0399, test_loss: 1.3536, test_f1: 0.5276
 epoch: 26, train_loss: 1.0438, test_loss: 1.2741, test_f1: 0.5191
 epoch: 27, train_loss: 1.0259, test_loss: 1.4042, test_f1: 0.5244
 epoch: 28, train_loss: 1.0423, test_loss: 1.4304, test_f1: 0.5265
 epoch: 29, train_loss: 1.0208, test_loss: 1.2746, test_f1: 0.5162
 epoch: 30, train_loss: 1.0213, test_loss: 1.2377, test_f1: 0.5124
 epoch: 31, train_loss: 0.9897, test_loss: 1.3065, test_f1: 0.5142
 epoch: 32, train_loss: 1.0024, test_loss: 1.3057, test_f1: 0.4930
 epoch: 33, train_loss: 1.0025, test_loss: 1.1688, test_f1: 0.5359
 epoch: 34, train_loss: 0.9853, test_loss: 1.1542, test_f1: 0.5292
 epoch: 35, train_loss: 0.9912, test_loss: 1.2111, test_f1: 0.5213
 epoch: 36, train_loss: 0.9671, test_loss: 1.2178, test_f1: 0.5134
 epoch: 37, train_loss: 0.9808, test_loss: 1.2900, test_f1: 0.5170
 epoch: 38, train_loss: 0.9660, test_loss: 1.3014, test_f1: 0.5099
 epoch: 39, train_loss: 0.9504, test_loss: 1.2558, test_f1: 0.5243
 epoch: 40, train_loss: 0.9462, test_loss: 1.2423, test_f1: 0.5148
 epoch: 41, train_loss: 0.9539, test_loss: 1.3116, test_f1: 0.5144
 epoch: 42, train_loss: 0.9612, test_loss: 1.3076, test_f1: 0.5244
 epoch: 43, train_loss: 0.9538, test_loss: 1.3138, test_f1: 0.5051
 epoch: 44, train_loss: 0.9490, test_loss: 1.2750, test_f1: 0.5391
 epoch: 45, train_loss: 0.9316, test_loss: 1.2715, test_f1: 0.5422
 epoch: 46, train_loss: 0.9349, test_loss: 1.2658, test_f1: 0.5252
 epoch: 47, train_loss: 0.9413, test_loss: 1.2362, test_f1: 0.5299
 epoch: 48, train_loss: 0.9218, test_loss: 1.2624, test_f1: 0.5361
 epoch: 49, train_loss: 0.9271, test_loss: 1.2738, test_f1: 0.5030
 epoch: 50, train_loss: 0.9282, test_loss: 1.2988, test_f1: 0.5245
 epoch: 51, train_loss: 0.9149, test_loss: 1.2951, test_f1: 0.5184
 epoch: 52, train_loss: 0.9057, test_loss: 1.2571, test_f1: 0.5237
 epoch: 53, train_loss: 0.8954, test_loss: 1.2606, test_f1: 0.5090
 epoch: 54, train_loss: 0.9104, test_loss: 1.2414, test_f1: 0.5176
 epoch: 55, train_loss: 0.9048, test_loss: 1.2159, test_f1: 0.5208
 epoch: 56, train_loss: 0.8937, test_loss: 1.2444, test_f1: 0.5167
 epoch: 57, train_loss: 0.8937, test_loss: 1.2304, test_f1: 0.5218
 epoch: 58, train_loss: 0.9000, test_loss: 1.2043, test_f1: 0.5117
 epoch: 59, train_loss: 0.8864, test_loss: 1.1840, test_f1: 0.5155
 epoch: 60, train_loss: 0.8887, test_loss: 1.2184, test_f1: 0.5266
 epoch: 61, train_loss: 0.8724, test_loss: 1.2420, test_f1: 0.5055
 epoch: 62, train_loss: 0.8946, test_loss: 1.2580, test_f1: 0.5243
 epoch: 63, train_loss: 0.8712, test_loss: 1.2659, test_f1: 0.5053
 epoch: 64, train_loss: 0.8823, test_loss: 1.2817, test_f1: 0.5104
 epoch: 65, train_loss: 0.8744, test_loss: 1.2518, test_f1: 0.5159
 epoch: 66, train_loss: 0.8739, test_loss: 1.2301, test_f1: 0.5486
 epoch: 67, train_loss: 0.8913, test_loss: 1.2582, test_f1: 0.5254
 epoch: 68, train_loss: 0.8859, test_loss: 1.2937, test_f1: 0.5057
 epoch: 69, train_loss: 0.8740, test_loss: 1.3286, test_f1: 0.5027
 epoch: 70, train_loss: 0.8588, test_loss: 1.2670, test_f1: 0.5088
 epoch: 71, train_loss: 0.8686, test_loss: 1.2955, test_f1: 0.5180
 epoch: 72, train_loss: 0.8765, test_loss: 1.3773, test_f1: 0.5138
 epoch: 73, train_loss: 0.8785, test_loss: 1.4892, test_f1: 0.5194
 epoch: 74, train_loss: 0.8640, test_loss: 1.4119, test_f1: 0.5215
 epoch: 75, train_loss: 0.8556, test_loss: 1.3532, test_f1: 0.5396
 epoch: 76, train_loss: 0.8690, test_loss: 1.3480, test_f1: 0.5243
 epoch: 77, train_loss: 0.8620, test_loss: 1.3522, test_f1: 0.5331
 epoch: 78, train_loss: 0.8589, test_loss: 1.3940, test_f1: 0.5258
 epoch: 79, train_loss: 0.8610, test_loss: 1.3062, test_f1: 0.5245
 epoch: 80, train_loss: 0.8404, test_loss: 1.2587, test_f1: 0.5251
 epoch: 81, train_loss: 0.8414, test_loss: 1.2823, test_f1: 0.5207
 epoch: 82, train_loss: 0.8636, test_loss: 1.3641, test_f1: 0.4957
 epoch: 83, train_loss: 0.8354, test_loss: 1.3671, test_f1: 0.5326
 epoch: 84, train_loss: 0.8487, test_loss: 1.3710, test_f1: 0.5061
 epoch: 85, train_loss: 0.8553, test_loss: 1.4021, test_f1: 0.5094
 epoch: 86, train_loss: 0.8465, test_loss: 1.3497, test_f1: 0.5098
 epoch: 87, train_loss: 0.8439, test_loss: 1.4050, test_f1: 0.5130
 epoch: 88, train_loss: 0.8418, test_loss: 1.3959, test_f1: 0.5172
 epoch: 89, train_loss: 0.8322, test_loss: 1.5050, test_f1: 0.5101
 epoch: 90, train_loss: 0.8334, test_loss: 1.5408, test_f1: 0.4988
 epoch: 91, train_loss: 0.8325, test_loss: 1.4533, test_f1: 0.5093
 epoch: 92, train_loss: 0.8426, test_loss: 1.3948, test_f1: 0.5061
 epoch: 93, train_loss: 0.8484, test_loss: 1.3815, test_f1: 0.4961
 epoch: 94, train_loss: 0.8277, test_loss: 1.4189, test_f1: 0.5177
 epoch: 95, train_loss: 0.8483, test_loss: 1.4472, test_f1: 0.5051
 epoch: 96, train_loss: 0.8418, test_loss: 1.3972, test_f1: 0.4980
 epoch: 97, train_loss: 0.8379, test_loss: 1.4621, test_f1: 0.4928
 epoch: 98, train_loss: 0.8370, test_loss: 1.5535, test_f1: 0.4899
 epoch: 99, train_loss: 0.8376, test_loss: 1.5378, test_f1: 0.5052
##################ITERATION #6 ****************************************
 epoch: 0, train_loss: 1.4247, test_loss: 1.3166, test_f1: 0.2194
 epoch: 1, train_loss: 1.2718, test_loss: 1.3426, test_f1: 0.2343
 epoch: 2, train_loss: 1.2512, test_loss: 1.3504, test_f1: 0.2827
 epoch: 3, train_loss: 1.2631, test_loss: 1.3214, test_f1: 0.3214
 epoch: 4, train_loss: 1.2326, test_loss: 1.3348, test_f1: 0.2773
 epoch: 5, train_loss: 1.2287, test_loss: 1.3123, test_f1: 0.2683
 epoch: 6, train_loss: 1.2168, test_loss: 1.3068, test_f1: 0.2886
 epoch: 7, train_loss: 1.2121, test_loss: 1.2966, test_f1: 0.3074
 epoch: 8, train_loss: 1.1878, test_loss: 1.3000, test_f1: 0.3150
 epoch: 9, train_loss: 1.2044, test_loss: 1.2943, test_f1: 0.3117
 epoch: 10, train_loss: 1.1917, test_loss: 1.3010, test_f1: 0.2790
 epoch: 11, train_loss: 1.1935, test_loss: 1.3083, test_f1: 0.2803
 epoch: 12, train_loss: 1.1757, test_loss: 1.3013, test_f1: 0.2820
 epoch: 13, train_loss: 1.1849, test_loss: 1.3079, test_f1: 0.3290
 epoch: 14, train_loss: 1.1778, test_loss: 1.2974, test_f1: 0.3042
 epoch: 15, train_loss: 1.1680, test_loss: 1.2943, test_f1: 0.2894
 epoch: 16, train_loss: 1.1456, test_loss: 1.3005, test_f1: 0.2842
 epoch: 17, train_loss: 1.1429, test_loss: 1.2991, test_f1: 0.3185
 epoch: 18, train_loss: 1.1417, test_loss: 1.3276, test_f1: 0.3655
 epoch: 19, train_loss: 1.1343, test_loss: 1.3369, test_f1: 0.3518
 epoch: 20, train_loss: 1.1427, test_loss: 1.3215, test_f1: 0.3269
 epoch: 21, train_loss: 1.1388, test_loss: 1.2817, test_f1: 0.3229
 epoch: 22, train_loss: 1.1167, test_loss: 1.2868, test_f1: 0.3422
 epoch: 23, train_loss: 1.1183, test_loss: 1.2519, test_f1: 0.3515
 epoch: 24, train_loss: 1.1165, test_loss: 1.2429, test_f1: 0.3903
 epoch: 25, train_loss: 1.1150, test_loss: 1.2555, test_f1: 0.4017
 epoch: 26, train_loss: 1.0996, test_loss: 1.2370, test_f1: 0.3466
 epoch: 27, train_loss: 1.0831, test_loss: 1.2764, test_f1: 0.3335
 epoch: 28, train_loss: 1.0916, test_loss: 1.2464, test_f1: 0.3418
 epoch: 29, train_loss: 1.0835, test_loss: 1.2161, test_f1: 0.3750
 epoch: 30, train_loss: 1.0652, test_loss: 1.2105, test_f1: 0.3894
 epoch: 31, train_loss: 1.0710, test_loss: 1.2137, test_f1: 0.4416
 epoch: 32, train_loss: 1.0556, test_loss: 1.2088, test_f1: 0.4144
 epoch: 33, train_loss: 1.0725, test_loss: 1.2285, test_f1: 0.4154
 epoch: 34, train_loss: 1.0539, test_loss: 1.2152, test_f1: 0.4286
 epoch: 35, train_loss: 1.0492, test_loss: 1.2044, test_f1: 0.3960
 epoch: 36, train_loss: 1.0414, test_loss: 1.2153, test_f1: 0.4512
 epoch: 37, train_loss: 1.0331, test_loss: 1.2408, test_f1: 0.4565
 epoch: 38, train_loss: 1.0170, test_loss: 1.2676, test_f1: 0.4539
 epoch: 39, train_loss: 1.0018, test_loss: 1.2084, test_f1: 0.4701
 epoch: 40, train_loss: 1.0064, test_loss: 1.2599, test_f1: 0.4456
 epoch: 41, train_loss: 1.0146, test_loss: 1.2275, test_f1: 0.4106
 epoch: 42, train_loss: 1.0031, test_loss: 1.2812, test_f1: 0.4140
 epoch: 43, train_loss: 0.9912, test_loss: 1.2377, test_f1: 0.4536
 epoch: 44, train_loss: 0.9874, test_loss: 1.1701, test_f1: 0.4865
 epoch: 45, train_loss: 0.9745, test_loss: 1.3585, test_f1: 0.3932
 epoch: 46, train_loss: 0.9777, test_loss: 1.2386, test_f1: 0.4974
 epoch: 47, train_loss: 0.9619, test_loss: 1.2731, test_f1: 0.4532
 epoch: 48, train_loss: 0.9541, test_loss: 1.2993, test_f1: 0.4204
 epoch: 49, train_loss: 0.9710, test_loss: 1.2111, test_f1: 0.4749
 epoch: 50, train_loss: 0.9548, test_loss: 1.2591, test_f1: 0.4377
 epoch: 51, train_loss: 0.9418, test_loss: 1.1862, test_f1: 0.4728
 epoch: 52, train_loss: 0.9293, test_loss: 1.2093, test_f1: 0.4796
 epoch: 53, train_loss: 0.9240, test_loss: 1.2039, test_f1: 0.4682
 epoch: 54, train_loss: 0.9335, test_loss: 1.2182, test_f1: 0.4879
 epoch: 55, train_loss: 0.9250, test_loss: 1.1893, test_f1: 0.5154
 epoch: 56, train_loss: 0.9149, test_loss: 1.1822, test_f1: 0.4765
 epoch: 57, train_loss: 0.9123, test_loss: 1.1708, test_f1: 0.4817
 epoch: 58, train_loss: 0.9273, test_loss: 1.1820, test_f1: 0.4791
 epoch: 59, train_loss: 0.9348, test_loss: 1.1935, test_f1: 0.4994
 epoch: 60, train_loss: 0.9138, test_loss: 1.2251, test_f1: 0.4580
 epoch: 61, train_loss: 0.9187, test_loss: 1.2589, test_f1: 0.4724
 epoch: 62, train_loss: 0.9045, test_loss: 1.2203, test_f1: 0.4765
 epoch: 63, train_loss: 0.9149, test_loss: 1.2275, test_f1: 0.4829
 epoch: 64, train_loss: 0.9062, test_loss: 1.2276, test_f1: 0.4829
 epoch: 65, train_loss: 0.9052, test_loss: 1.1994, test_f1: 0.4920
 epoch: 66, train_loss: 0.9036, test_loss: 1.1897, test_f1: 0.4897
 epoch: 67, train_loss: 0.9104, test_loss: 1.1938, test_f1: 0.4716
 epoch: 68, train_loss: 0.9058, test_loss: 1.1700, test_f1: 0.5108
 epoch: 69, train_loss: 0.9012, test_loss: 1.2565, test_f1: 0.4456
 epoch: 70, train_loss: 0.8978, test_loss: 1.2368, test_f1: 0.4789
 epoch: 71, train_loss: 0.9023, test_loss: 1.2143, test_f1: 0.5178
 epoch: 72, train_loss: 0.8937, test_loss: 1.2272, test_f1: 0.5017
 epoch: 73, train_loss: 0.8830, test_loss: 1.2216, test_f1: 0.4883
 epoch: 74, train_loss: 0.8920, test_loss: 1.2631, test_f1: 0.4707
 epoch: 75, train_loss: 0.8729, test_loss: 1.2506, test_f1: 0.4948
 epoch: 76, train_loss: 0.8814, test_loss: 1.2966, test_f1: 0.4946
 epoch: 77, train_loss: 0.8851, test_loss: 1.2120, test_f1: 0.5147
 epoch: 78, train_loss: 0.8733, test_loss: 1.2618, test_f1: 0.5101
 epoch: 79, train_loss: 0.8765, test_loss: 1.3035, test_f1: 0.4887
 epoch: 80, train_loss: 0.8798, test_loss: 1.2771, test_f1: 0.5019
 epoch: 81, train_loss: 0.8720, test_loss: 1.2579, test_f1: 0.5131
 epoch: 82, train_loss: 0.8717, test_loss: 1.2843, test_f1: 0.4652
 epoch: 83, train_loss: 0.8736, test_loss: 1.2295, test_f1: 0.5044
 epoch: 84, train_loss: 0.8760, test_loss: 1.2856, test_f1: 0.4726
 epoch: 85, train_loss: 0.8624, test_loss: 1.2979, test_f1: 0.4893
 epoch: 86, train_loss: 0.8629, test_loss: 1.3363, test_f1: 0.4994
 epoch: 87, train_loss: 0.8486, test_loss: 1.3558, test_f1: 0.4813
 epoch: 88, train_loss: 0.8709, test_loss: 1.3594, test_f1: 0.5048
 epoch: 89, train_loss: 0.8602, test_loss: 1.3618, test_f1: 0.4898
 epoch: 90, train_loss: 0.8505, test_loss: 1.3129, test_f1: 0.4883
 epoch: 91, train_loss: 0.8630, test_loss: 1.4258, test_f1: 0.4849
 epoch: 92, train_loss: 0.8653, test_loss: 1.3955, test_f1: 0.4900
 epoch: 93, train_loss: 0.8536, test_loss: 1.4253, test_f1: 0.4613
 epoch: 94, train_loss: 0.8688, test_loss: 1.3542, test_f1: 0.4597
 epoch: 95, train_loss: 0.8522, test_loss: 1.4001, test_f1: 0.4889
 epoch: 96, train_loss: 0.8465, test_loss: 1.4788, test_f1: 0.4363
 epoch: 97, train_loss: 0.8522, test_loss: 1.4048, test_f1: 0.4744
 epoch: 98, train_loss: 0.8471, test_loss: 1.4289, test_f1: 0.5055
 epoch: 99, train_loss: 0.8467, test_loss: 1.4567, test_f1: 0.4662
##################ITERATION #7 ****************************************
 epoch: 0, train_loss: 1.2813, test_loss: 1.3205, test_f1: 0.2281
 epoch: 1, train_loss: 1.2424, test_loss: 1.3021, test_f1: 0.2281
 epoch: 2, train_loss: 1.2398, test_loss: 1.2917, test_f1: 0.2337
 epoch: 3, train_loss: 1.2187, test_loss: 1.2821, test_f1: 0.2962
 epoch: 4, train_loss: 1.2156, test_loss: 1.2853, test_f1: 0.3590
 epoch: 5, train_loss: 1.2057, test_loss: 1.2933, test_f1: 0.3746
 epoch: 6, train_loss: 1.2067, test_loss: 1.2923, test_f1: 0.3594
 epoch: 7, train_loss: 1.2020, test_loss: 1.2734, test_f1: 0.3844
 epoch: 8, train_loss: 1.2001, test_loss: 1.2658, test_f1: 0.3910
 epoch: 9, train_loss: 1.1932, test_loss: 1.2605, test_f1: 0.3741
 epoch: 10, train_loss: 1.1807, test_loss: 1.2505, test_f1: 0.3734
 epoch: 11, train_loss: 1.1781, test_loss: 1.2516, test_f1: 0.3864
 epoch: 12, train_loss: 1.1717, test_loss: 1.2409, test_f1: 0.3861
 epoch: 13, train_loss: 1.1639, test_loss: 1.2489, test_f1: 0.4019
 epoch: 14, train_loss: 1.1593, test_loss: 1.2463, test_f1: 0.4008
 epoch: 15, train_loss: 1.1653, test_loss: 1.2439, test_f1: 0.4083
 epoch: 16, train_loss: 1.1657, test_loss: 1.2528, test_f1: 0.3984
 epoch: 17, train_loss: 1.1520, test_loss: 1.2704, test_f1: 0.3790
 epoch: 18, train_loss: 1.1639, test_loss: 1.2533, test_f1: 0.3954
 epoch: 19, train_loss: 1.1540, test_loss: 1.2483, test_f1: 0.3841
 epoch: 20, train_loss: 1.1430, test_loss: 1.2315, test_f1: 0.3844
 epoch: 21, train_loss: 1.1452, test_loss: 1.2237, test_f1: 0.4336
 epoch: 22, train_loss: 1.1303, test_loss: 1.2253, test_f1: 0.4651
 epoch: 23, train_loss: 1.1227, test_loss: 1.2172, test_f1: 0.4602
 epoch: 24, train_loss: 1.1290, test_loss: 1.2114, test_f1: 0.4506
 epoch: 25, train_loss: 1.1248, test_loss: 1.2108, test_f1: 0.4680
 epoch: 26, train_loss: 1.1169, test_loss: 1.2045, test_f1: 0.4640
 epoch: 27, train_loss: 1.1171, test_loss: 1.1790, test_f1: 0.4534
 epoch: 28, train_loss: 1.1107, test_loss: 1.1807, test_f1: 0.4723
 epoch: 29, train_loss: 1.0831, test_loss: 1.1783, test_f1: 0.4744
 epoch: 30, train_loss: 1.0905, test_loss: 1.2003, test_f1: 0.4334
 epoch: 31, train_loss: 1.0925, test_loss: 1.1632, test_f1: 0.4612
 epoch: 32, train_loss: 1.0841, test_loss: 1.1719, test_f1: 0.4574
 epoch: 33, train_loss: 1.0926, test_loss: 1.1750, test_f1: 0.4709
 epoch: 34, train_loss: 1.0828, test_loss: 1.1836, test_f1: 0.4659
 epoch: 35, train_loss: 1.0753, test_loss: 1.2135, test_f1: 0.4391
 epoch: 36, train_loss: 1.0546, test_loss: 1.1835, test_f1: 0.4600
 epoch: 37, train_loss: 1.0564, test_loss: 1.1602, test_f1: 0.4781
 epoch: 38, train_loss: 1.0559, test_loss: 1.1753, test_f1: 0.4810
 epoch: 39, train_loss: 1.0586, test_loss: 1.1692, test_f1: 0.4618
 epoch: 40, train_loss: 1.0363, test_loss: 1.1833, test_f1: 0.4649
 epoch: 41, train_loss: 1.0284, test_loss: 1.1560, test_f1: 0.4698
 epoch: 42, train_loss: 1.0199, test_loss: 1.1436, test_f1: 0.5108
 epoch: 43, train_loss: 1.0138, test_loss: 1.1579, test_f1: 0.4787
 epoch: 44, train_loss: 1.0123, test_loss: 1.1462, test_f1: 0.5022
 epoch: 45, train_loss: 0.9990, test_loss: 1.1984, test_f1: 0.4705
 epoch: 46, train_loss: 1.0074, test_loss: 1.1309, test_f1: 0.4998
 epoch: 47, train_loss: 0.9875, test_loss: 1.1353, test_f1: 0.5196
 epoch: 48, train_loss: 0.9799, test_loss: 1.1806, test_f1: 0.4597
 epoch: 49, train_loss: 0.9775, test_loss: 1.1581, test_f1: 0.5081
 epoch: 50, train_loss: 0.9740, test_loss: 1.2384, test_f1: 0.4794
 epoch: 51, train_loss: 0.9764, test_loss: 1.1446, test_f1: 0.5218
 epoch: 52, train_loss: 0.9634, test_loss: 1.1488, test_f1: 0.5192
 epoch: 53, train_loss: 0.9559, test_loss: 1.1258, test_f1: 0.5240
 epoch: 54, train_loss: 0.9544, test_loss: 1.1230, test_f1: 0.5024
 epoch: 55, train_loss: 0.9492, test_loss: 1.1352, test_f1: 0.5097
 epoch: 56, train_loss: 0.9541, test_loss: 1.1494, test_f1: 0.5221
 epoch: 57, train_loss: 0.9475, test_loss: 1.1342, test_f1: 0.5196
 epoch: 58, train_loss: 0.9307, test_loss: 1.1306, test_f1: 0.5165
 epoch: 59, train_loss: 0.9183, test_loss: 1.1231, test_f1: 0.5299
 epoch: 60, train_loss: 0.9423, test_loss: 1.1125, test_f1: 0.5351
 epoch: 61, train_loss: 0.9176, test_loss: 1.1519, test_f1: 0.5085
 epoch: 62, train_loss: 0.9182, test_loss: 1.1775, test_f1: 0.4980
 epoch: 63, train_loss: 0.9234, test_loss: 1.1345, test_f1: 0.5255
 epoch: 64, train_loss: 0.9449, test_loss: 1.1665, test_f1: 0.4780
 epoch: 65, train_loss: 0.9373, test_loss: 1.2396, test_f1: 0.4674
 epoch: 66, train_loss: 0.9132, test_loss: 1.1288, test_f1: 0.5485
 epoch: 67, train_loss: 0.9262, test_loss: 1.1599, test_f1: 0.5065
 epoch: 68, train_loss: 0.9136, test_loss: 1.2230, test_f1: 0.4693
 epoch: 69, train_loss: 0.9290, test_loss: 1.1486, test_f1: 0.5101
 epoch: 70, train_loss: 0.9098, test_loss: 1.1989, test_f1: 0.4880
 epoch: 71, train_loss: 0.9029, test_loss: 1.1743, test_f1: 0.5052
 epoch: 72, train_loss: 0.9042, test_loss: 1.1563, test_f1: 0.5362
 epoch: 73, train_loss: 0.9070, test_loss: 1.1659, test_f1: 0.5177
 epoch: 74, train_loss: 0.9160, test_loss: 1.1373, test_f1: 0.5413
 epoch: 75, train_loss: 0.9018, test_loss: 1.1378, test_f1: 0.5235
 epoch: 76, train_loss: 0.8945, test_loss: 1.2422, test_f1: 0.4729
 epoch: 77, train_loss: 0.9015, test_loss: 1.1347, test_f1: 0.5440
 epoch: 78, train_loss: 0.8994, test_loss: 1.1404, test_f1: 0.5326
 epoch: 79, train_loss: 0.9088, test_loss: 1.1893, test_f1: 0.5009
 epoch: 80, train_loss: 0.9085, test_loss: 1.1619, test_f1: 0.5370
 epoch: 81, train_loss: 0.8945, test_loss: 1.2176, test_f1: 0.4939
 epoch: 82, train_loss: 0.8928, test_loss: 1.1191, test_f1: 0.5440
 epoch: 83, train_loss: 0.9042, test_loss: 1.1637, test_f1: 0.5351
 epoch: 84, train_loss: 0.8948, test_loss: 1.2472, test_f1: 0.4905
 epoch: 85, train_loss: 0.8828, test_loss: 1.1793, test_f1: 0.5099
 epoch: 86, train_loss: 0.8791, test_loss: 1.2418, test_f1: 0.4791
 epoch: 87, train_loss: 0.8792, test_loss: 1.1641, test_f1: 0.5288
 epoch: 88, train_loss: 0.8834, test_loss: 1.1616, test_f1: 0.5334
 epoch: 89, train_loss: 0.8762, test_loss: 1.2881, test_f1: 0.4904
 epoch: 90, train_loss: 0.8941, test_loss: 1.2006, test_f1: 0.5306
 epoch: 91, train_loss: 0.8800, test_loss: 1.1416, test_f1: 0.5461
 epoch: 92, train_loss: 0.8697, test_loss: 1.1475, test_f1: 0.5368
 epoch: 93, train_loss: 0.8887, test_loss: 1.1757, test_f1: 0.5230
 epoch: 94, train_loss: 0.8753, test_loss: 1.1662, test_f1: 0.5179
 epoch: 95, train_loss: 0.8740, test_loss: 1.1272, test_f1: 0.5323
 epoch: 96, train_loss: 0.8777, test_loss: 1.1455, test_f1: 0.5063
 epoch: 97, train_loss: 0.8752, test_loss: 1.1582, test_f1: 0.5235
 epoch: 98, train_loss: 0.8755, test_loss: 1.1787, test_f1: 0.5208
 epoch: 99, train_loss: 0.8578, test_loss: 1.1523, test_f1: 0.5197
##################ITERATION #8 ****************************************
 epoch: 0, train_loss: 1.3916, test_loss: 1.3695, test_f1: 0.2628
 epoch: 1, train_loss: 1.2410, test_loss: 1.3989, test_f1: 0.2706
 epoch: 2, train_loss: 1.2285, test_loss: 1.4355, test_f1: 0.2630
 epoch: 3, train_loss: 1.2221, test_loss: 1.3512, test_f1: 0.2761
 epoch: 4, train_loss: 1.1873, test_loss: 1.3032, test_f1: 0.3293
 epoch: 5, train_loss: 1.1801, test_loss: 1.2760, test_f1: 0.3621
 epoch: 6, train_loss: 1.1688, test_loss: 1.2678, test_f1: 0.3756
 epoch: 7, train_loss: 1.1462, test_loss: 1.2597, test_f1: 0.3895
 epoch: 8, train_loss: 1.1309, test_loss: 1.2594, test_f1: 0.3748
 epoch: 9, train_loss: 1.1250, test_loss: 1.2846, test_f1: 0.4004
 epoch: 10, train_loss: 1.1134, test_loss: 1.3272, test_f1: 0.4209
 epoch: 11, train_loss: 1.0974, test_loss: 1.2962, test_f1: 0.3742
 epoch: 12, train_loss: 1.0807, test_loss: 1.2637, test_f1: 0.4075
 epoch: 13, train_loss: 1.0676, test_loss: 1.2531, test_f1: 0.4215
 epoch: 14, train_loss: 1.0602, test_loss: 1.2314, test_f1: 0.4127
 epoch: 15, train_loss: 1.0484, test_loss: 1.2433, test_f1: 0.3998
 epoch: 16, train_loss: 1.0425, test_loss: 1.2745, test_f1: 0.4019
 epoch: 17, train_loss: 1.0123, test_loss: 1.2294, test_f1: 0.4237
 epoch: 18, train_loss: 1.0075, test_loss: 1.2168, test_f1: 0.4306
 epoch: 19, train_loss: 1.0004, test_loss: 1.2424, test_f1: 0.4269
 epoch: 20, train_loss: 0.9925, test_loss: 1.2470, test_f1: 0.4361
 epoch: 21, train_loss: 0.9929, test_loss: 1.2529, test_f1: 0.4469
 epoch: 22, train_loss: 0.9985, test_loss: 1.2303, test_f1: 0.4262
 epoch: 23, train_loss: 0.9825, test_loss: 1.2216, test_f1: 0.4500
 epoch: 24, train_loss: 0.9840, test_loss: 1.2432, test_f1: 0.4553
 epoch: 25, train_loss: 0.9684, test_loss: 1.1937, test_f1: 0.4575
 epoch: 26, train_loss: 0.9685, test_loss: 1.1897, test_f1: 0.4642
 epoch: 27, train_loss: 0.9584, test_loss: 1.1886, test_f1: 0.4629
 epoch: 28, train_loss: 0.9606, test_loss: 1.2106, test_f1: 0.4409
 epoch: 29, train_loss: 0.9382, test_loss: 1.2114, test_f1: 0.4513
 epoch: 30, train_loss: 0.9670, test_loss: 1.2114, test_f1: 0.4421
 epoch: 31, train_loss: 0.9511, test_loss: 1.1882, test_f1: 0.4649
 epoch: 32, train_loss: 0.9553, test_loss: 1.1747, test_f1: 0.4529
 epoch: 33, train_loss: 0.9423, test_loss: 1.1821, test_f1: 0.4427
 epoch: 34, train_loss: 0.9548, test_loss: 1.1854, test_f1: 0.4322
 epoch: 35, train_loss: 0.9202, test_loss: 1.1605, test_f1: 0.4551
 epoch: 36, train_loss: 0.9345, test_loss: 1.1765, test_f1: 0.4740
 epoch: 37, train_loss: 0.9192, test_loss: 1.1838, test_f1: 0.4716
 epoch: 38, train_loss: 0.9280, test_loss: 1.1446, test_f1: 0.4784
 epoch: 39, train_loss: 0.9048, test_loss: 1.1495, test_f1: 0.4875
 epoch: 40, train_loss: 0.9162, test_loss: 1.1755, test_f1: 0.4551
 epoch: 41, train_loss: 0.9128, test_loss: 1.1850, test_f1: 0.4666
 epoch: 42, train_loss: 0.9080, test_loss: 1.1446, test_f1: 0.4885
 epoch: 43, train_loss: 0.8924, test_loss: 1.1599, test_f1: 0.4950
 epoch: 44, train_loss: 0.9027, test_loss: 1.1683, test_f1: 0.4732
 epoch: 45, train_loss: 0.9090, test_loss: 1.1801, test_f1: 0.4832
 epoch: 46, train_loss: 0.8979, test_loss: 1.1628, test_f1: 0.4900
 epoch: 47, train_loss: 0.9095, test_loss: 1.1937, test_f1: 0.4689
 epoch: 48, train_loss: 0.8856, test_loss: 1.1991, test_f1: 0.4684
 epoch: 49, train_loss: 0.9000, test_loss: 1.1494, test_f1: 0.4871
 epoch: 50, train_loss: 0.8680, test_loss: 1.1707, test_f1: 0.4691
 epoch: 51, train_loss: 0.8730, test_loss: 1.1636, test_f1: 0.4732
 epoch: 52, train_loss: 0.8804, test_loss: 1.1422, test_f1: 0.4881
 epoch: 53, train_loss: 0.8875, test_loss: 1.1322, test_f1: 0.5015
 epoch: 54, train_loss: 0.8790, test_loss: 1.1532, test_f1: 0.5009
 epoch: 55, train_loss: 0.8653, test_loss: 1.1749, test_f1: 0.4908
 epoch: 56, train_loss: 0.8650, test_loss: 1.1850, test_f1: 0.4986
 epoch: 57, train_loss: 0.8598, test_loss: 1.1844, test_f1: 0.4965
 epoch: 58, train_loss: 0.8616, test_loss: 1.1733, test_f1: 0.4797
 epoch: 59, train_loss: 0.8811, test_loss: 1.1703, test_f1: 0.4887
 epoch: 60, train_loss: 0.8619, test_loss: 1.1821, test_f1: 0.4997
 epoch: 61, train_loss: 0.8617, test_loss: 1.2033, test_f1: 0.4830
 epoch: 62, train_loss: 0.8651, test_loss: 1.1905, test_f1: 0.4804
 epoch: 63, train_loss: 0.8439, test_loss: 1.1675, test_f1: 0.4995
 epoch: 64, train_loss: 0.8553, test_loss: 1.1707, test_f1: 0.4889
 epoch: 65, train_loss: 0.8499, test_loss: 1.2281, test_f1: 0.4760
 epoch: 66, train_loss: 0.8396, test_loss: 1.2184, test_f1: 0.4682
 epoch: 67, train_loss: 0.8405, test_loss: 1.1880, test_f1: 0.4955
 epoch: 68, train_loss: 0.8432, test_loss: 1.2023, test_f1: 0.5117
 epoch: 69, train_loss: 0.8486, test_loss: 1.2283, test_f1: 0.4738
 epoch: 70, train_loss: 0.8451, test_loss: 1.2121, test_f1: 0.5062
 epoch: 71, train_loss: 0.8493, test_loss: 1.1676, test_f1: 0.5232
 epoch: 72, train_loss: 0.8654, test_loss: 1.1751, test_f1: 0.5261
 epoch: 73, train_loss: 0.8401, test_loss: 1.2173, test_f1: 0.5209
 epoch: 74, train_loss: 0.8443, test_loss: 1.2647, test_f1: 0.4839
 epoch: 75, train_loss: 0.8253, test_loss: 1.2242, test_f1: 0.5029
 epoch: 76, train_loss: 0.8341, test_loss: 1.2315, test_f1: 0.4749
 epoch: 77, train_loss: 0.8234, test_loss: 1.2296, test_f1: 0.5304
 epoch: 78, train_loss: 0.8147, test_loss: 1.2532, test_f1: 0.4965
 epoch: 79, train_loss: 0.8375, test_loss: 1.2416, test_f1: 0.5208
 epoch: 80, train_loss: 0.8460, test_loss: 1.2449, test_f1: 0.5231
 epoch: 81, train_loss: 0.8301, test_loss: 1.2710, test_f1: 0.5207
 epoch: 82, train_loss: 0.8304, test_loss: 1.2969, test_f1: 0.5042
 epoch: 83, train_loss: 0.8148, test_loss: 1.2476, test_f1: 0.5188
 epoch: 84, train_loss: 0.8167, test_loss: 1.2488, test_f1: 0.5021
 epoch: 85, train_loss: 0.8297, test_loss: 1.2702, test_f1: 0.4787
 epoch: 86, train_loss: 0.8264, test_loss: 1.2354, test_f1: 0.5132
 epoch: 87, train_loss: 0.8159, test_loss: 1.2633, test_f1: 0.4980
 epoch: 88, train_loss: 0.8143, test_loss: 1.2593, test_f1: 0.4972
 epoch: 89, train_loss: 0.8261, test_loss: 1.2107, test_f1: 0.5081
 epoch: 90, train_loss: 0.8232, test_loss: 1.2277, test_f1: 0.5108
 epoch: 91, train_loss: 0.8270, test_loss: 1.2297, test_f1: 0.5067
 epoch: 92, train_loss: 0.8302, test_loss: 1.2341, test_f1: 0.5064
 epoch: 93, train_loss: 0.8077, test_loss: 1.2537, test_f1: 0.4995
 epoch: 94, train_loss: 0.7952, test_loss: 1.2985, test_f1: 0.5358
 epoch: 95, train_loss: 0.8179, test_loss: 1.2400, test_f1: 0.5057
 epoch: 96, train_loss: 0.8242, test_loss: 1.2459, test_f1: 0.5070
 epoch: 97, train_loss: 0.8290, test_loss: 1.2265, test_f1: 0.5370
 epoch: 98, train_loss: 0.8011, test_loss: 1.2940, test_f1: 0.5367
 epoch: 99, train_loss: 0.8041, test_loss: 1.2830, test_f1: 0.4973
##################ITERATION #9 ****************************************
 epoch: 0, train_loss: 1.4668, test_loss: 1.3262, test_f1: 0.2281
 epoch: 1, train_loss: 1.2828, test_loss: 1.3030, test_f1: 0.2281
 epoch: 2, train_loss: 1.2620, test_loss: 1.2890, test_f1: 0.2238
 epoch: 3, train_loss: 1.2285, test_loss: 1.2850, test_f1: 0.2438
 epoch: 4, train_loss: 1.2155, test_loss: 1.2601, test_f1: 0.2395
 epoch: 5, train_loss: 1.2050, test_loss: 1.2635, test_f1: 0.2456
 epoch: 6, train_loss: 1.1955, test_loss: 1.2482, test_f1: 0.2518
 epoch: 7, train_loss: 1.1880, test_loss: 1.2850, test_f1: 0.2611
 epoch: 8, train_loss: 1.1753, test_loss: 1.3204, test_f1: 0.3016
 epoch: 9, train_loss: 1.1670, test_loss: 1.3001, test_f1: 0.3827
 epoch: 10, train_loss: 1.1674, test_loss: 1.3107, test_f1: 0.3858
 epoch: 11, train_loss: 1.1663, test_loss: 1.2943, test_f1: 0.4109
 epoch: 12, train_loss: 1.1502, test_loss: 1.2656, test_f1: 0.3838
 epoch: 13, train_loss: 1.1552, test_loss: 1.2469, test_f1: 0.4203
 epoch: 14, train_loss: 1.1315, test_loss: 1.2351, test_f1: 0.4313
 epoch: 15, train_loss: 1.1408, test_loss: 1.2030, test_f1: 0.4208
 epoch: 16, train_loss: 1.1191, test_loss: 1.2099, test_f1: 0.4353
 epoch: 17, train_loss: 1.1052, test_loss: 1.1956, test_f1: 0.4516
 epoch: 18, train_loss: 1.1218, test_loss: 1.2157, test_f1: 0.4119
 epoch: 19, train_loss: 1.1126, test_loss: 1.1809, test_f1: 0.4452
 epoch: 20, train_loss: 1.0869, test_loss: 1.1844, test_f1: 0.4085
 epoch: 21, train_loss: 1.0901, test_loss: 1.1683, test_f1: 0.4352
 epoch: 22, train_loss: 1.1024, test_loss: 1.1781, test_f1: 0.3886
 epoch: 23, train_loss: 1.0839, test_loss: 1.1687, test_f1: 0.4169
 epoch: 24, train_loss: 1.0704, test_loss: 1.1825, test_f1: 0.4593
 epoch: 25, train_loss: 1.0713, test_loss: 1.2210, test_f1: 0.4204
 epoch: 26, train_loss: 1.0754, test_loss: 1.2147, test_f1: 0.4534
 epoch: 27, train_loss: 1.0587, test_loss: 1.2018, test_f1: 0.4550
 epoch: 28, train_loss: 1.0553, test_loss: 1.1723, test_f1: 0.4510
 epoch: 29, train_loss: 1.0492, test_loss: 1.1716, test_f1: 0.4776
 epoch: 30, train_loss: 1.0479, test_loss: 1.1726, test_f1: 0.4468
 epoch: 31, train_loss: 1.0369, test_loss: 1.1853, test_f1: 0.4364
 epoch: 32, train_loss: 1.0406, test_loss: 1.1844, test_f1: 0.4577
 epoch: 33, train_loss: 1.0258, test_loss: 1.2438, test_f1: 0.4474
 epoch: 34, train_loss: 1.0148, test_loss: 1.2063, test_f1: 0.4969
 epoch: 35, train_loss: 1.0227, test_loss: 1.2753, test_f1: 0.4622
 epoch: 36, train_loss: 1.0257, test_loss: 1.2320, test_f1: 0.4795
 epoch: 37, train_loss: 0.9917, test_loss: 1.2048, test_f1: 0.4548
 epoch: 38, train_loss: 0.9828, test_loss: 1.2059, test_f1: 0.4561
 epoch: 39, train_loss: 0.9809, test_loss: 1.2393, test_f1: 0.4697
 epoch: 40, train_loss: 0.9854, test_loss: 1.2464, test_f1: 0.4634
 epoch: 41, train_loss: 0.9916, test_loss: 1.3464, test_f1: 0.4824
 epoch: 42, train_loss: 0.9879, test_loss: 1.5332, test_f1: 0.5179
 epoch: 43, train_loss: 0.9597, test_loss: 1.4864, test_f1: 0.5003
 epoch: 44, train_loss: 0.9661, test_loss: 1.2998, test_f1: 0.5119
 epoch: 45, train_loss: 0.9613, test_loss: 1.3493, test_f1: 0.4906
 epoch: 46, train_loss: 0.9521, test_loss: 1.3370, test_f1: 0.4806
 epoch: 47, train_loss: 0.9459, test_loss: 1.2570, test_f1: 0.4549
 epoch: 48, train_loss: 0.9439, test_loss: 1.1562, test_f1: 0.4644
 epoch: 49, train_loss: 0.9554, test_loss: 1.1378, test_f1: 0.4565
 epoch: 50, train_loss: 0.9187, test_loss: 1.1951, test_f1: 0.5060
 epoch: 51, train_loss: 0.9303, test_loss: 1.2316, test_f1: 0.5287
 epoch: 52, train_loss: 0.9261, test_loss: 1.2724, test_f1: 0.5004
 epoch: 53, train_loss: 0.9326, test_loss: 1.3393, test_f1: 0.5161
 epoch: 54, train_loss: 0.9220, test_loss: 1.3258, test_f1: 0.5080
 epoch: 55, train_loss: 0.9273, test_loss: 1.2778, test_f1: 0.4980
 epoch: 56, train_loss: 0.9359, test_loss: 1.2988, test_f1: 0.4969
 epoch: 57, train_loss: 0.9213, test_loss: 1.3674, test_f1: 0.5141
 epoch: 58, train_loss: 0.9182, test_loss: 1.2659, test_f1: 0.5041
 epoch: 59, train_loss: 0.9057, test_loss: 1.3758, test_f1: 0.4943
 epoch: 60, train_loss: 0.9001, test_loss: 1.3460, test_f1: 0.5014
 epoch: 61, train_loss: 0.9098, test_loss: 1.1948, test_f1: 0.5205
 epoch: 62, train_loss: 0.9074, test_loss: 1.2256, test_f1: 0.4997
 epoch: 63, train_loss: 0.9117, test_loss: 1.2475, test_f1: 0.5014
 epoch: 64, train_loss: 0.8894, test_loss: 1.2746, test_f1: 0.5111
 epoch: 65, train_loss: 0.8915, test_loss: 1.2253, test_f1: 0.5170
 epoch: 66, train_loss: 0.9025, test_loss: 1.2042, test_f1: 0.5302
 epoch: 67, train_loss: 0.8919, test_loss: 1.2817, test_f1: 0.5081
 epoch: 68, train_loss: 0.8778, test_loss: 1.2606, test_f1: 0.5205
 epoch: 69, train_loss: 0.8894, test_loss: 1.2016, test_f1: 0.5375
 epoch: 70, train_loss: 0.8792, test_loss: 1.2536, test_f1: 0.5258
 epoch: 71, train_loss: 0.8818, test_loss: 1.2752, test_f1: 0.5285
 epoch: 72, train_loss: 0.9044, test_loss: 1.2515, test_f1: 0.5420
 epoch: 73, train_loss: 0.8850, test_loss: 1.2185, test_f1: 0.5220
 epoch: 74, train_loss: 0.8801, test_loss: 1.1830, test_f1: 0.5018
 epoch: 75, train_loss: 0.8590, test_loss: 1.2053, test_f1: 0.5275
 epoch: 76, train_loss: 0.8693, test_loss: 1.2272, test_f1: 0.5142
 epoch: 77, train_loss: 0.9284, test_loss: 1.1987, test_f1: 0.4959
 epoch: 78, train_loss: 0.8996, test_loss: 1.1649, test_f1: 0.4903
 epoch: 79, train_loss: 0.8960, test_loss: 1.1980, test_f1: 0.4860
 epoch: 80, train_loss: 0.8744, test_loss: 1.2196, test_f1: 0.5177
 epoch: 81, train_loss: 0.8867, test_loss: 1.2827, test_f1: 0.4924
 epoch: 82, train_loss: 0.8711, test_loss: 1.3361, test_f1: 0.4909
 epoch: 83, train_loss: 0.8693, test_loss: 1.3768, test_f1: 0.5083
 epoch: 84, train_loss: 0.8657, test_loss: 1.3858, test_f1: 0.5072
 epoch: 85, train_loss: 0.8501, test_loss: 1.3827, test_f1: 0.5053
 epoch: 86, train_loss: 0.8688, test_loss: 1.3462, test_f1: 0.5084
 epoch: 87, train_loss: 0.8665, test_loss: 1.2844, test_f1: 0.4909
 epoch: 88, train_loss: 0.8645, test_loss: 1.3283, test_f1: 0.5141
 epoch: 89, train_loss: 0.8623, test_loss: 1.2258, test_f1: 0.5127
 epoch: 90, train_loss: 0.8577, test_loss: 1.2527, test_f1: 0.5245
 epoch: 91, train_loss: 0.8421, test_loss: 1.2450, test_f1: 0.5085
 epoch: 92, train_loss: 0.8634, test_loss: 1.2803, test_f1: 0.5198
 epoch: 93, train_loss: 0.8503, test_loss: 1.2241, test_f1: 0.5265
 epoch: 94, train_loss: 0.8480, test_loss: 1.2366, test_f1: 0.5269
 epoch: 95, train_loss: 0.8637, test_loss: 1.2043, test_f1: 0.5388
 epoch: 96, train_loss: 0.8471, test_loss: 1.2742, test_f1: 0.5392
 epoch: 97, train_loss: 0.8482, test_loss: 1.2514, test_f1: 0.5198
 epoch: 98, train_loss: 0.8679, test_loss: 1.2685, test_f1: 0.5006
 epoch: 99, train_loss: 0.8371, test_loss: 1.3646, test_f1: 0.5326

Training completed in 327.94 seconds
Best F1: 0.5722 at epoch 98
Mean F1 across iterations: 0.5450  0.0185
========================FINAL RESULTS================================
FEGIN weighted F1: 0.5722  0.0185
python main.py --data ltspice_demos --representation component_component --model FEGIN --layers 5 --hiddens 16 --batch_size 128 --lr 0.001 --emb_size 128 --epochs 100 --save_appendix component_component_L5_H16_BS128_LR0.001_E128 --no_val
-----



STDERR:
Processing...
Done!
  File "main.py", line 370, in <module>
    main()
  File "main.py", line 254, in main
    dataset = dataset_class(
  File "/home/philip/projects/ltspice_examples_code_repo/Circuit-Completion-Using-GNNs/component_classification_with_link_prediction_head/evaluation/FEGIN/kernel/circuit_datasets.py", line 15, in __init__
    self.data, self.slices = torch.load(self.processed_paths[0])
  File "/home/philip/.local/lib/python3.8/site-packages/torch/serialization.py", line 1040, in load
    warnings.warn(
  File "/usr/lib/python3.8/warnings.py", line 109, in _showwarnmsg
    sw(msg.message, msg.category, msg.filename, msg.lineno,
  File "main.py", line 47, in warn_with_traceback
    traceback.print_stack(file=log)
/home/philip/projects/ltspice_examples_code_repo/Circuit-Completion-Using-GNNs/component_classification_with_link_prediction_head/evaluation/FEGIN/kernel/circuit_datasets.py:15: FutureWarning: You are using `torch.load` with `weights_only=False` (the current default value), which uses the default pickle module implicitly. It is possible to construct malicious pickle data which will execute arbitrary code during unpickling (See https://github.com/pytorch/pytorch/blob/main/SECURITY.md#untrusted-models for more details). In a future release, the default value for `weights_only` will be flipped to `True`. This limits the functions that could be executed during unpickling. Arbitrary objects will no longer be allowed to be loaded via this mode unless they are explicitly allowlisted by the user via `torch.serialization.add_safe_globals`. We recommend you start setting `weights_only=True` for any use case where you don't have full control of the loaded file. Please open an issue on GitHub for any issues related to this experimental feature.
  self.data, self.slices = torch.load(self.processed_paths[0])
