STDOUT:
Results will be saved in /home/philip/projects/ltspice_examples_code_repo/Circuit-Completion-Using-GNNs/component_classification_with_link_prediction_head/evaluation/FEGIN/results/model_FEGIN_dataset_ltspice_examples
Command line input: python main.py --data ltspice_examples --representation component_pin --model FEGIN --layers 3 --hiddens 64 --batch_size 64 --lr 0.001 --emb_size 250 --epochs 100 --save_appendix component_pin_L3_H64_BS64_LR0.001_E250 --no_val
 is saved.
-----
ltspice_examples - FEGIN
Using 3 layers, 64 hidden units, h = 2
Loading component_pin representation dataset
ENTERED
Training FEGIN on component_pin representation
Train: 3560, Test: 848
##################ITERATION #0 ****************************************
 epoch: 0, train_loss: 1.2399, test_loss: 1.1576, test_f1: 0.3428
 epoch: 1, train_loss: 1.0423, test_loss: 1.0483, test_f1: 0.3630
 epoch: 2, train_loss: 1.0255, test_loss: 1.0531, test_f1: 0.4825
 epoch: 3, train_loss: 0.9872, test_loss: 1.0634, test_f1: 0.4702
 epoch: 4, train_loss: 0.9566, test_loss: 1.0260, test_f1: 0.5074
 epoch: 5, train_loss: 0.9136, test_loss: 1.0274, test_f1: 0.5041
 epoch: 6, train_loss: 0.8891, test_loss: 1.0081, test_f1: 0.5044
 epoch: 7, train_loss: 0.8605, test_loss: 0.9646, test_f1: 0.5332
 epoch: 8, train_loss: 0.8509, test_loss: 0.9025, test_f1: 0.5501
 epoch: 9, train_loss: 0.8132, test_loss: 0.9884, test_f1: 0.5224
 epoch: 10, train_loss: 0.7993, test_loss: 0.9272, test_f1: 0.5413
 epoch: 11, train_loss: 0.7818, test_loss: 0.9606, test_f1: 0.5483
 epoch: 12, train_loss: 0.7675, test_loss: 0.9253, test_f1: 0.5916
 epoch: 13, train_loss: 0.7518, test_loss: 0.9899, test_f1: 0.5572
 epoch: 14, train_loss: 0.7416, test_loss: 0.9567, test_f1: 0.5718
 epoch: 15, train_loss: 0.7431, test_loss: 0.9386, test_f1: 0.5888
 epoch: 16, train_loss: 0.7250, test_loss: 0.9407, test_f1: 0.5727
 epoch: 17, train_loss: 0.7041, test_loss: 0.9312, test_f1: 0.5743
 epoch: 18, train_loss: 0.7035, test_loss: 0.9131, test_f1: 0.6162
 epoch: 19, train_loss: 0.6910, test_loss: 0.9790, test_f1: 0.5576
 epoch: 20, train_loss: 0.6812, test_loss: 0.9790, test_f1: 0.6134
 epoch: 21, train_loss: 0.6709, test_loss: 0.9986, test_f1: 0.6116
 epoch: 22, train_loss: 0.6675, test_loss: 1.0871, test_f1: 0.6160
 epoch: 23, train_loss: 0.6595, test_loss: 0.9052, test_f1: 0.6249
 epoch: 24, train_loss: 0.6496, test_loss: 0.9476, test_f1: 0.5745
 epoch: 25, train_loss: 0.6353, test_loss: 0.9915, test_f1: 0.5969
 epoch: 26, train_loss: 0.6568, test_loss: 0.9520, test_f1: 0.5670
 epoch: 27, train_loss: 0.6366, test_loss: 0.9294, test_f1: 0.5978
 epoch: 28, train_loss: 0.6256, test_loss: 0.8848, test_f1: 0.6157
 epoch: 29, train_loss: 0.6006, test_loss: 0.9356, test_f1: 0.6362
 epoch: 30, train_loss: 0.5949, test_loss: 0.9264, test_f1: 0.6184
 epoch: 31, train_loss: 0.5998, test_loss: 0.8787, test_f1: 0.6245
 epoch: 32, train_loss: 0.6003, test_loss: 0.8539, test_f1: 0.6121
 epoch: 33, train_loss: 0.5769, test_loss: 0.9432, test_f1: 0.6187
 epoch: 34, train_loss: 0.6035, test_loss: 1.0300, test_f1: 0.5888
 epoch: 35, train_loss: 0.5638, test_loss: 1.0261, test_f1: 0.6185
 epoch: 36, train_loss: 0.5565, test_loss: 1.0167, test_f1: 0.6032
 epoch: 37, train_loss: 0.5667, test_loss: 0.9205, test_f1: 0.6114
 epoch: 38, train_loss: 0.5561, test_loss: 1.0285, test_f1: 0.6243
 epoch: 39, train_loss: 0.5371, test_loss: 0.9579, test_f1: 0.6334
 epoch: 40, train_loss: 0.5304, test_loss: 0.9361, test_f1: 0.6218
 epoch: 41, train_loss: 0.5401, test_loss: 0.9655, test_f1: 0.6045
 epoch: 42, train_loss: 0.5193, test_loss: 1.0057, test_f1: 0.5923
 epoch: 43, train_loss: 0.5197, test_loss: 1.0048, test_f1: 0.6207
 epoch: 44, train_loss: 0.5100, test_loss: 0.8996, test_f1: 0.6220
 epoch: 45, train_loss: 0.4913, test_loss: 1.0310, test_f1: 0.6543
 epoch: 46, train_loss: 0.4926, test_loss: 0.8960, test_f1: 0.6082
 epoch: 47, train_loss: 0.4813, test_loss: 1.0885, test_f1: 0.6333
 epoch: 48, train_loss: 0.4749, test_loss: 1.0587, test_f1: 0.6190
 epoch: 49, train_loss: 0.4878, test_loss: 1.0702, test_f1: 0.6287
 epoch: 50, train_loss: 0.4701, test_loss: 1.1481, test_f1: 0.6353
 epoch: 51, train_loss: 0.4301, test_loss: 1.0658, test_f1: 0.6434
 epoch: 52, train_loss: 0.4165, test_loss: 1.1101, test_f1: 0.6332
 epoch: 53, train_loss: 0.3967, test_loss: 1.1242, test_f1: 0.6243
 epoch: 54, train_loss: 0.4072, test_loss: 1.1236, test_f1: 0.6464
 epoch: 55, train_loss: 0.3974, test_loss: 1.0575, test_f1: 0.6421
 epoch: 56, train_loss: 0.3983, test_loss: 1.2158, test_f1: 0.6107
 epoch: 57, train_loss: 0.3818, test_loss: 1.2669, test_f1: 0.6328
 epoch: 58, train_loss: 0.3899, test_loss: 1.1774, test_f1: 0.6255
 epoch: 59, train_loss: 0.3827, test_loss: 1.3248, test_f1: 0.6232
 epoch: 60, train_loss: 0.3983, test_loss: 1.2380, test_f1: 0.6433
 epoch: 61, train_loss: 0.3819, test_loss: 1.1709, test_f1: 0.6325
 epoch: 62, train_loss: 0.3815, test_loss: 1.2285, test_f1: 0.6218
 epoch: 63, train_loss: 0.3663, test_loss: 1.1203, test_f1: 0.6368
 epoch: 64, train_loss: 0.3591, test_loss: 1.1319, test_f1: 0.6194
 epoch: 65, train_loss: 0.3729, test_loss: 1.1485, test_f1: 0.6598
 epoch: 66, train_loss: 0.3693, test_loss: 1.3046, test_f1: 0.6408
 epoch: 67, train_loss: 0.3744, test_loss: 1.1075, test_f1: 0.6378
 epoch: 68, train_loss: 0.3559, test_loss: 1.2374, test_f1: 0.6674
 epoch: 69, train_loss: 0.3432, test_loss: 1.1973, test_f1: 0.6632
 epoch: 70, train_loss: 0.3453, test_loss: 1.3356, test_f1: 0.6302
 epoch: 71, train_loss: 0.3378, test_loss: 1.1354, test_f1: 0.6213
 epoch: 72, train_loss: 0.3375, test_loss: 1.2679, test_f1: 0.6485
 epoch: 73, train_loss: 0.3307, test_loss: 1.3210, test_f1: 0.6297
 epoch: 74, train_loss: 0.3312, test_loss: 1.2993, test_f1: 0.6594
 epoch: 75, train_loss: 0.3202, test_loss: 1.3697, test_f1: 0.6207
 epoch: 76, train_loss: 0.3282, test_loss: 1.3558, test_f1: 0.6350
 epoch: 77, train_loss: 0.3269, test_loss: 1.3345, test_f1: 0.6441
 epoch: 78, train_loss: 0.3270, test_loss: 1.3994, test_f1: 0.6535
 epoch: 79, train_loss: 0.3054, test_loss: 1.3101, test_f1: 0.6391
 epoch: 80, train_loss: 0.3128, test_loss: 1.4011, test_f1: 0.6612
 epoch: 81, train_loss: 0.3004, test_loss: 1.3616, test_f1: 0.6341
 epoch: 82, train_loss: 0.3083, test_loss: 1.4652, test_f1: 0.6211
 epoch: 83, train_loss: 0.3083, test_loss: 1.3350, test_f1: 0.6430
 epoch: 84, train_loss: 0.3066, test_loss: 1.4784, test_f1: 0.6343
 epoch: 85, train_loss: 0.3102, test_loss: 1.3912, test_f1: 0.6744
 epoch: 86, train_loss: 0.3152, test_loss: 1.3970, test_f1: 0.6525
 epoch: 87, train_loss: 0.3072, test_loss: 1.6039, test_f1: 0.5981
 epoch: 88, train_loss: 0.3082, test_loss: 1.3739, test_f1: 0.6551
 epoch: 89, train_loss: 0.2865, test_loss: 1.5466, test_f1: 0.6321
 epoch: 90, train_loss: 0.2854, test_loss: 1.5306, test_f1: 0.6642
 epoch: 91, train_loss: 0.2751, test_loss: 1.4845, test_f1: 0.6142
 epoch: 92, train_loss: 0.2871, test_loss: 1.6137, test_f1: 0.6820
 epoch: 93, train_loss: 0.2679, test_loss: 1.6911, test_f1: 0.6261
 epoch: 94, train_loss: 0.2925, test_loss: 1.6306, test_f1: 0.5805
 epoch: 95, train_loss: 0.2983, test_loss: 1.5124, test_f1: 0.5920
 epoch: 96, train_loss: 0.2711, test_loss: 1.6919, test_f1: 0.6041
 epoch: 97, train_loss: 0.2644, test_loss: 1.6372, test_f1: 0.6423
 epoch: 98, train_loss: 0.2770, test_loss: 1.5540, test_f1: 0.6251
 epoch: 99, train_loss: 0.2554, test_loss: 1.5922, test_f1: 0.6458
##################ITERATION #1 ****************************************
 epoch: 0, train_loss: 1.1463, test_loss: 1.0304, test_f1: 0.4035
 epoch: 1, train_loss: 0.9867, test_loss: 1.0491, test_f1: 0.4782
 epoch: 2, train_loss: 0.9529, test_loss: 0.9812, test_f1: 0.5211
 epoch: 3, train_loss: 0.9181, test_loss: 0.9737, test_f1: 0.5014
 epoch: 4, train_loss: 0.8897, test_loss: 0.9433, test_f1: 0.5358
 epoch: 5, train_loss: 0.8730, test_loss: 0.9195, test_f1: 0.5312
 epoch: 6, train_loss: 0.8499, test_loss: 0.8556, test_f1: 0.5397
 epoch: 7, train_loss: 0.8225, test_loss: 0.9602, test_f1: 0.5498
 epoch: 8, train_loss: 0.8062, test_loss: 0.9422, test_f1: 0.5665
 epoch: 9, train_loss: 0.7948, test_loss: 1.1298, test_f1: 0.5084
 epoch: 10, train_loss: 0.7787, test_loss: 0.8931, test_f1: 0.5742
 epoch: 11, train_loss: 0.7463, test_loss: 0.8983, test_f1: 0.5927
 epoch: 12, train_loss: 0.7459, test_loss: 0.8840, test_f1: 0.6058
 epoch: 13, train_loss: 0.7506, test_loss: 0.8669, test_f1: 0.6245
 epoch: 14, train_loss: 0.7249, test_loss: 0.8389, test_f1: 0.6110
 epoch: 15, train_loss: 0.6973, test_loss: 0.8506, test_f1: 0.6141
 epoch: 16, train_loss: 0.6961, test_loss: 0.9212, test_f1: 0.5420
 epoch: 17, train_loss: 0.6889, test_loss: 0.9044, test_f1: 0.5940
 epoch: 18, train_loss: 0.6854, test_loss: 0.8826, test_f1: 0.5844
 epoch: 19, train_loss: 0.6665, test_loss: 1.0578, test_f1: 0.5818
 epoch: 20, train_loss: 0.6424, test_loss: 1.0170, test_f1: 0.5850
 epoch: 21, train_loss: 0.6534, test_loss: 1.0039, test_f1: 0.5672
 epoch: 22, train_loss: 0.6325, test_loss: 0.9352, test_f1: 0.6057
 epoch: 23, train_loss: 0.6248, test_loss: 0.8857, test_f1: 0.6128
 epoch: 24, train_loss: 0.6108, test_loss: 0.9799, test_f1: 0.5926
 epoch: 25, train_loss: 0.6337, test_loss: 0.9017, test_f1: 0.6174
 epoch: 26, train_loss: 0.6090, test_loss: 0.9273, test_f1: 0.6052
 epoch: 27, train_loss: 0.5934, test_loss: 0.8771, test_f1: 0.6493
 epoch: 28, train_loss: 0.6061, test_loss: 0.8834, test_f1: 0.6282
 epoch: 29, train_loss: 0.5950, test_loss: 0.8444, test_f1: 0.6481
 epoch: 30, train_loss: 0.5634, test_loss: 0.9044, test_f1: 0.6182
 epoch: 31, train_loss: 0.5616, test_loss: 0.9233, test_f1: 0.6424
 epoch: 32, train_loss: 0.5637, test_loss: 0.8567, test_f1: 0.6343
 epoch: 33, train_loss: 0.5599, test_loss: 1.0852, test_f1: 0.5974
 epoch: 34, train_loss: 0.5575, test_loss: 0.9068, test_f1: 0.6320
 epoch: 35, train_loss: 0.5357, test_loss: 1.1185, test_f1: 0.6130
 epoch: 36, train_loss: 0.5349, test_loss: 1.0012, test_f1: 0.6008
 epoch: 37, train_loss: 0.5097, test_loss: 1.0683, test_f1: 0.6215
 epoch: 38, train_loss: 0.5267, test_loss: 1.0662, test_f1: 0.6167
 epoch: 39, train_loss: 0.5177, test_loss: 0.9112, test_f1: 0.6381
 epoch: 40, train_loss: 0.5017, test_loss: 0.8545, test_f1: 0.6641
 epoch: 41, train_loss: 0.5167, test_loss: 0.8870, test_f1: 0.6636
 epoch: 42, train_loss: 0.5036, test_loss: 1.0191, test_f1: 0.6399
 epoch: 43, train_loss: 0.4967, test_loss: 1.0789, test_f1: 0.6287
 epoch: 44, train_loss: 0.4881, test_loss: 0.8458, test_f1: 0.6592
 epoch: 45, train_loss: 0.4715, test_loss: 1.0488, test_f1: 0.6020
 epoch: 46, train_loss: 0.4836, test_loss: 1.0773, test_f1: 0.6079
 epoch: 47, train_loss: 0.4725, test_loss: 1.0310, test_f1: 0.6371
 epoch: 48, train_loss: 0.4721, test_loss: 0.9539, test_f1: 0.6499
 epoch: 49, train_loss: 0.4587, test_loss: 0.8962, test_f1: 0.6386
 epoch: 50, train_loss: 0.4548, test_loss: 1.0179, test_f1: 0.6386
 epoch: 51, train_loss: 0.4134, test_loss: 0.9497, test_f1: 0.6712
 epoch: 52, train_loss: 0.3814, test_loss: 0.9645, test_f1: 0.6652
 epoch: 53, train_loss: 0.3817, test_loss: 1.0315, test_f1: 0.6340
 epoch: 54, train_loss: 0.3695, test_loss: 0.9895, test_f1: 0.6754
 epoch: 55, train_loss: 0.3688, test_loss: 1.0801, test_f1: 0.6500
 epoch: 56, train_loss: 0.3833, test_loss: 1.0618, test_f1: 0.6764
 epoch: 57, train_loss: 0.3662, test_loss: 0.9811, test_f1: 0.6350
 epoch: 58, train_loss: 0.3625, test_loss: 0.9876, test_f1: 0.6867
 epoch: 59, train_loss: 0.3629, test_loss: 1.0834, test_f1: 0.6490
 epoch: 60, train_loss: 0.3374, test_loss: 1.0939, test_f1: 0.6798
 epoch: 61, train_loss: 0.3551, test_loss: 1.0925, test_f1: 0.6622
 epoch: 62, train_loss: 0.3349, test_loss: 1.1008, test_f1: 0.6859
 epoch: 63, train_loss: 0.3577, test_loss: 1.0707, test_f1: 0.6456
 epoch: 64, train_loss: 0.3518, test_loss: 1.1357, test_f1: 0.6454
 epoch: 65, train_loss: 0.3424, test_loss: 1.0704, test_f1: 0.6637
 epoch: 66, train_loss: 0.3436, test_loss: 1.2439, test_f1: 0.6508
 epoch: 67, train_loss: 0.3328, test_loss: 1.0759, test_f1: 0.6710
 epoch: 68, train_loss: 0.3144, test_loss: 1.1709, test_f1: 0.6521
 epoch: 69, train_loss: 0.3070, test_loss: 1.1504, test_f1: 0.6763
 epoch: 70, train_loss: 0.3142, test_loss: 1.1002, test_f1: 0.6747
 epoch: 71, train_loss: 0.3210, test_loss: 1.3107, test_f1: 0.6095
 epoch: 72, train_loss: 0.3164, test_loss: 1.2222, test_f1: 0.6796
 epoch: 73, train_loss: 0.3118, test_loss: 1.1075, test_f1: 0.6743
 epoch: 74, train_loss: 0.3231, test_loss: 1.3232, test_f1: 0.6604
 epoch: 75, train_loss: 0.3050, test_loss: 1.1875, test_f1: 0.6827
 epoch: 76, train_loss: 0.2914, test_loss: 1.2041, test_f1: 0.6786
 epoch: 77, train_loss: 0.3082, test_loss: 1.3714, test_f1: 0.6401
 epoch: 78, train_loss: 0.3002, test_loss: 1.4117, test_f1: 0.6617
 epoch: 79, train_loss: 0.2988, test_loss: 1.3087, test_f1: 0.6609
 epoch: 80, train_loss: 0.2944, test_loss: 1.2721, test_f1: 0.6524
 epoch: 81, train_loss: 0.3118, test_loss: 1.2121, test_f1: 0.6742
 epoch: 82, train_loss: 0.2860, test_loss: 1.2968, test_f1: 0.6535
 epoch: 83, train_loss: 0.3037, test_loss: 1.4142, test_f1: 0.6310
 epoch: 84, train_loss: 0.2708, test_loss: 1.2691, test_f1: 0.6691
 epoch: 85, train_loss: 0.2892, test_loss: 1.2556, test_f1: 0.6831
 epoch: 86, train_loss: 0.2778, test_loss: 1.2706, test_f1: 0.6809
 epoch: 87, train_loss: 0.2510, test_loss: 1.3779, test_f1: 0.6528
 epoch: 88, train_loss: 0.2638, test_loss: 1.3764, test_f1: 0.6520
 epoch: 89, train_loss: 0.2838, test_loss: 1.4040, test_f1: 0.6566
 epoch: 90, train_loss: 0.2687, test_loss: 1.3526, test_f1: 0.6678
 epoch: 91, train_loss: 0.2646, test_loss: 1.4250, test_f1: 0.6492
 epoch: 92, train_loss: 0.2748, test_loss: 1.4562, test_f1: 0.6585
 epoch: 93, train_loss: 0.2538, test_loss: 1.3566, test_f1: 0.6636
 epoch: 94, train_loss: 0.2562, test_loss: 1.4259, test_f1: 0.6591
 epoch: 95, train_loss: 0.2654, test_loss: 1.4709, test_f1: 0.6440
 epoch: 96, train_loss: 0.2634, test_loss: 1.4487, test_f1: 0.6691
 epoch: 97, train_loss: 0.2470, test_loss: 1.4449, test_f1: 0.6630
 epoch: 98, train_loss: 0.2554, test_loss: 1.4124, test_f1: 0.6600
 epoch: 99, train_loss: 0.2559, test_loss: 1.4418, test_f1: 0.6687
##################ITERATION #2 ****************************************
 epoch: 0, train_loss: 1.1093, test_loss: 1.1227, test_f1: 0.3585
 epoch: 1, train_loss: 0.9768, test_loss: 0.9790, test_f1: 0.4905
 epoch: 2, train_loss: 0.9308, test_loss: 0.9491, test_f1: 0.5236
 epoch: 3, train_loss: 0.9040, test_loss: 0.9081, test_f1: 0.5558
 epoch: 4, train_loss: 0.8973, test_loss: 0.9358, test_f1: 0.5412
 epoch: 5, train_loss: 0.8648, test_loss: 0.9506, test_f1: 0.5261
 epoch: 6, train_loss: 0.8440, test_loss: 0.8744, test_f1: 0.5438
 epoch: 7, train_loss: 0.8334, test_loss: 0.8607, test_f1: 0.5743
 epoch: 8, train_loss: 0.8179, test_loss: 0.9313, test_f1: 0.5369
 epoch: 9, train_loss: 0.7915, test_loss: 0.8941, test_f1: 0.5808
 epoch: 10, train_loss: 0.7802, test_loss: 0.8810, test_f1: 0.5984
 epoch: 11, train_loss: 0.7710, test_loss: 0.8957, test_f1: 0.5857
 epoch: 12, train_loss: 0.7481, test_loss: 0.8262, test_f1: 0.6220
 epoch: 13, train_loss: 0.7448, test_loss: 0.8685, test_f1: 0.5779
 epoch: 14, train_loss: 0.7240, test_loss: 0.9227, test_f1: 0.5754
 epoch: 15, train_loss: 0.7215, test_loss: 0.8398, test_f1: 0.6208
 epoch: 16, train_loss: 0.7151, test_loss: 0.8538, test_f1: 0.6432
 epoch: 17, train_loss: 0.6871, test_loss: 0.8550, test_f1: 0.6069
 epoch: 18, train_loss: 0.6746, test_loss: 0.8645, test_f1: 0.6278
 epoch: 19, train_loss: 0.6738, test_loss: 0.8243, test_f1: 0.6040
 epoch: 20, train_loss: 0.6600, test_loss: 0.8503, test_f1: 0.6370
 epoch: 21, train_loss: 0.6458, test_loss: 0.9355, test_f1: 0.5863
 epoch: 22, train_loss: 0.6524, test_loss: 0.9810, test_f1: 0.5827
 epoch: 23, train_loss: 0.6531, test_loss: 0.8316, test_f1: 0.6239
 epoch: 24, train_loss: 0.6315, test_loss: 1.0321, test_f1: 0.5562
 epoch: 25, train_loss: 0.6289, test_loss: 0.8594, test_f1: 0.6195
 epoch: 26, train_loss: 0.6129, test_loss: 0.8795, test_f1: 0.6562
 epoch: 27, train_loss: 0.6028, test_loss: 1.0104, test_f1: 0.5886
 epoch: 28, train_loss: 0.6003, test_loss: 0.8461, test_f1: 0.6318
 epoch: 29, train_loss: 0.5932, test_loss: 0.8774, test_f1: 0.6213
 epoch: 30, train_loss: 0.5763, test_loss: 0.8686, test_f1: 0.6176
 epoch: 31, train_loss: 0.5791, test_loss: 0.8299, test_f1: 0.6478
 epoch: 32, train_loss: 0.5782, test_loss: 0.7708, test_f1: 0.6534
 epoch: 33, train_loss: 0.5616, test_loss: 0.9602, test_f1: 0.6212
 epoch: 34, train_loss: 0.5664, test_loss: 0.8374, test_f1: 0.6488
 epoch: 35, train_loss: 0.5586, test_loss: 0.8479, test_f1: 0.6410
 epoch: 36, train_loss: 0.5316, test_loss: 1.0027, test_f1: 0.6426
 epoch: 37, train_loss: 0.5551, test_loss: 0.8412, test_f1: 0.6453
 epoch: 38, train_loss: 0.5376, test_loss: 0.9036, test_f1: 0.6288
 epoch: 39, train_loss: 0.5295, test_loss: 0.9292, test_f1: 0.6347
 epoch: 40, train_loss: 0.5122, test_loss: 0.8510, test_f1: 0.6485
 epoch: 41, train_loss: 0.5264, test_loss: 0.8202, test_f1: 0.6588
 epoch: 42, train_loss: 0.4958, test_loss: 0.8992, test_f1: 0.6201
 epoch: 43, train_loss: 0.4835, test_loss: 0.9128, test_f1: 0.6305
 epoch: 44, train_loss: 0.5046, test_loss: 0.8277, test_f1: 0.6433
 epoch: 45, train_loss: 0.4853, test_loss: 0.9320, test_f1: 0.6404
 epoch: 46, train_loss: 0.4668, test_loss: 0.9319, test_f1: 0.6063
 epoch: 47, train_loss: 0.4821, test_loss: 0.8923, test_f1: 0.6186
 epoch: 48, train_loss: 0.4704, test_loss: 1.0218, test_f1: 0.6178
 epoch: 49, train_loss: 0.4555, test_loss: 0.8743, test_f1: 0.6548
 epoch: 50, train_loss: 0.4406, test_loss: 1.0536, test_f1: 0.5989
 epoch: 51, train_loss: 0.4230, test_loss: 0.9206, test_f1: 0.6703
 epoch: 52, train_loss: 0.3887, test_loss: 0.9300, test_f1: 0.6414
 epoch: 53, train_loss: 0.3909, test_loss: 0.9225, test_f1: 0.6595
 epoch: 54, train_loss: 0.3684, test_loss: 0.9883, test_f1: 0.6425
 epoch: 55, train_loss: 0.3873, test_loss: 0.8939, test_f1: 0.6633
 epoch: 56, train_loss: 0.3702, test_loss: 0.9035, test_f1: 0.6660
 epoch: 57, train_loss: 0.3805, test_loss: 1.0324, test_f1: 0.6330
 epoch: 58, train_loss: 0.3623, test_loss: 1.0645, test_f1: 0.6455
 epoch: 59, train_loss: 0.3581, test_loss: 1.0565, test_f1: 0.6081
 epoch: 60, train_loss: 0.3584, test_loss: 1.0769, test_f1: 0.6337
 epoch: 61, train_loss: 0.3432, test_loss: 1.0357, test_f1: 0.6566
 epoch: 62, train_loss: 0.3533, test_loss: 1.1046, test_f1: 0.6411
 epoch: 63, train_loss: 0.3508, test_loss: 1.0321, test_f1: 0.6426
 epoch: 64, train_loss: 0.3479, test_loss: 1.0690, test_f1: 0.6530
 epoch: 65, train_loss: 0.3497, test_loss: 1.1367, test_f1: 0.6327
 epoch: 66, train_loss: 0.3342, test_loss: 1.1144, test_f1: 0.6473
 epoch: 67, train_loss: 0.3332, test_loss: 1.1759, test_f1: 0.6512
 epoch: 68, train_loss: 0.3158, test_loss: 1.0445, test_f1: 0.6645
 epoch: 69, train_loss: 0.3210, test_loss: 1.2397, test_f1: 0.6503
 epoch: 70, train_loss: 0.3143, test_loss: 1.2406, test_f1: 0.6557
 epoch: 71, train_loss: 0.3100, test_loss: 1.1657, test_f1: 0.6490
 epoch: 72, train_loss: 0.3118, test_loss: 1.2202, test_f1: 0.6507
 epoch: 73, train_loss: 0.3165, test_loss: 1.2231, test_f1: 0.6285
 epoch: 74, train_loss: 0.3185, test_loss: 1.1534, test_f1: 0.6638
 epoch: 75, train_loss: 0.3027, test_loss: 1.1959, test_f1: 0.6576
 epoch: 76, train_loss: 0.2965, test_loss: 1.2442, test_f1: 0.6661
 epoch: 77, train_loss: 0.2872, test_loss: 1.2584, test_f1: 0.6424
 epoch: 78, train_loss: 0.2947, test_loss: 1.1232, test_f1: 0.6626
 epoch: 79, train_loss: 0.3098, test_loss: 1.1730, test_f1: 0.6623
 epoch: 80, train_loss: 0.3060, test_loss: 1.2220, test_f1: 0.6548
 epoch: 81, train_loss: 0.2999, test_loss: 1.1915, test_f1: 0.6489
 epoch: 82, train_loss: 0.2906, test_loss: 1.2135, test_f1: 0.6492
 epoch: 83, train_loss: 0.2897, test_loss: 1.2724, test_f1: 0.6599
 epoch: 84, train_loss: 0.2762, test_loss: 1.2554, test_f1: 0.6604
 epoch: 85, train_loss: 0.2797, test_loss: 1.1954, test_f1: 0.6660
 epoch: 86, train_loss: 0.2766, test_loss: 1.2413, test_f1: 0.6528
 epoch: 87, train_loss: 0.2651, test_loss: 1.3113, test_f1: 0.6672
 epoch: 88, train_loss: 0.2702, test_loss: 1.2859, test_f1: 0.6793
 epoch: 89, train_loss: 0.2808, test_loss: 1.1905, test_f1: 0.6446
 epoch: 90, train_loss: 0.2699, test_loss: 1.2605, test_f1: 0.6579
 epoch: 91, train_loss: 0.2633, test_loss: 1.3757, test_f1: 0.6329
 epoch: 92, train_loss: 0.2796, test_loss: 1.3275, test_f1: 0.6614
 epoch: 93, train_loss: 0.2803, test_loss: 1.3707, test_f1: 0.6291
 epoch: 94, train_loss: 0.2634, test_loss: 1.3832, test_f1: 0.6392
 epoch: 95, train_loss: 0.2630, test_loss: 1.2291, test_f1: 0.6793
 epoch: 96, train_loss: 0.2702, test_loss: 1.3363, test_f1: 0.6461
 epoch: 97, train_loss: 0.2505, test_loss: 1.3623, test_f1: 0.6544
 epoch: 98, train_loss: 0.2470, test_loss: 1.3004, test_f1: 0.6415
 epoch: 99, train_loss: 0.2480, test_loss: 1.3220, test_f1: 0.6585
##################ITERATION #3 ****************************************
 epoch: 0, train_loss: 1.1764, test_loss: 1.0209, test_f1: 0.4631
 epoch: 1, train_loss: 0.9984, test_loss: 0.9343, test_f1: 0.4930
 epoch: 2, train_loss: 0.9565, test_loss: 0.9745, test_f1: 0.4718
 epoch: 3, train_loss: 0.9243, test_loss: 0.8918, test_f1: 0.5596
 epoch: 4, train_loss: 0.8972, test_loss: 0.8854, test_f1: 0.5908
 epoch: 5, train_loss: 0.8814, test_loss: 0.9142, test_f1: 0.5820
 epoch: 6, train_loss: 0.8609, test_loss: 0.9085, test_f1: 0.5805
 epoch: 7, train_loss: 0.8407, test_loss: 0.9858, test_f1: 0.5227
 epoch: 8, train_loss: 0.8048, test_loss: 0.9324, test_f1: 0.5492
 epoch: 9, train_loss: 0.8115, test_loss: 0.9402, test_f1: 0.5580
 epoch: 10, train_loss: 0.7896, test_loss: 0.8908, test_f1: 0.5911
 epoch: 11, train_loss: 0.7800, test_loss: 0.9520, test_f1: 0.5829
 epoch: 12, train_loss: 0.7664, test_loss: 0.8951, test_f1: 0.5593
 epoch: 13, train_loss: 0.7539, test_loss: 0.9191, test_f1: 0.5736
 epoch: 14, train_loss: 0.7464, test_loss: 0.8935, test_f1: 0.5898
 epoch: 15, train_loss: 0.7411, test_loss: 1.0445, test_f1: 0.4936
 epoch: 16, train_loss: 0.7281, test_loss: 0.9609, test_f1: 0.5665
 epoch: 17, train_loss: 0.7203, test_loss: 0.9952, test_f1: 0.5229
 epoch: 18, train_loss: 0.7123, test_loss: 0.8551, test_f1: 0.6063
 epoch: 19, train_loss: 0.7023, test_loss: 1.0221, test_f1: 0.5481
 epoch: 20, train_loss: 0.6854, test_loss: 0.8570, test_f1: 0.6082
 epoch: 21, train_loss: 0.6923, test_loss: 0.8236, test_f1: 0.5909
 epoch: 22, train_loss: 0.6764, test_loss: 0.8672, test_f1: 0.6116
 epoch: 23, train_loss: 0.6730, test_loss: 0.9646, test_f1: 0.5696
 epoch: 24, train_loss: 0.6747, test_loss: 0.8414, test_f1: 0.6012
 epoch: 25, train_loss: 0.6613, test_loss: 0.8570, test_f1: 0.5929
 epoch: 26, train_loss: 0.6547, test_loss: 0.8907, test_f1: 0.5771
 epoch: 27, train_loss: 0.6516, test_loss: 0.9904, test_f1: 0.5914
 epoch: 28, train_loss: 0.6482, test_loss: 0.7814, test_f1: 0.6689
 epoch: 29, train_loss: 0.6477, test_loss: 1.3493, test_f1: 0.4675
 epoch: 30, train_loss: 0.6448, test_loss: 0.8762, test_f1: 0.6297
 epoch: 31, train_loss: 0.6195, test_loss: 0.8243, test_f1: 0.6378
 epoch: 32, train_loss: 0.6261, test_loss: 0.8676, test_f1: 0.6014
 epoch: 33, train_loss: 0.6006, test_loss: 0.8929, test_f1: 0.6051
 epoch: 34, train_loss: 0.5921, test_loss: 0.8741, test_f1: 0.6285
 epoch: 35, train_loss: 0.5789, test_loss: 0.8758, test_f1: 0.6196
 epoch: 36, train_loss: 0.5741, test_loss: 1.0179, test_f1: 0.5686
 epoch: 37, train_loss: 0.5708, test_loss: 0.9906, test_f1: 0.6140
 epoch: 38, train_loss: 0.5661, test_loss: 0.8573, test_f1: 0.6068
 epoch: 39, train_loss: 0.5585, test_loss: 0.8972, test_f1: 0.5993
 epoch: 40, train_loss: 0.5579, test_loss: 0.9630, test_f1: 0.5981
 epoch: 41, train_loss: 0.5533, test_loss: 0.9111, test_f1: 0.6335
 epoch: 42, train_loss: 0.5397, test_loss: 0.8303, test_f1: 0.6214
 epoch: 43, train_loss: 0.5381, test_loss: 0.8785, test_f1: 0.6330
 epoch: 44, train_loss: 0.5204, test_loss: 0.9338, test_f1: 0.6308
 epoch: 45, train_loss: 0.5231, test_loss: 0.9027, test_f1: 0.6015
 epoch: 46, train_loss: 0.5088, test_loss: 1.0056, test_f1: 0.5734
 epoch: 47, train_loss: 0.5254, test_loss: 0.8814, test_f1: 0.6189
 epoch: 48, train_loss: 0.5095, test_loss: 0.9422, test_f1: 0.6081
 epoch: 49, train_loss: 0.5101, test_loss: 1.0432, test_f1: 0.5888
 epoch: 50, train_loss: 0.5072, test_loss: 0.9188, test_f1: 0.6166
 epoch: 51, train_loss: 0.4659, test_loss: 0.9207, test_f1: 0.6085
 epoch: 52, train_loss: 0.4423, test_loss: 0.9539, test_f1: 0.6363
 epoch: 53, train_loss: 0.4261, test_loss: 0.9484, test_f1: 0.6548
 epoch: 54, train_loss: 0.4303, test_loss: 0.9357, test_f1: 0.6334
 epoch: 55, train_loss: 0.4221, test_loss: 1.0365, test_f1: 0.6241
 epoch: 56, train_loss: 0.4145, test_loss: 1.0305, test_f1: 0.6201
 epoch: 57, train_loss: 0.3982, test_loss: 0.9408, test_f1: 0.6115
 epoch: 58, train_loss: 0.4141, test_loss: 0.9827, test_f1: 0.6404
 epoch: 59, train_loss: 0.4117, test_loss: 1.0461, test_f1: 0.6282
 epoch: 60, train_loss: 0.4140, test_loss: 1.0451, test_f1: 0.6337
 epoch: 61, train_loss: 0.3945, test_loss: 0.9552, test_f1: 0.6391
 epoch: 62, train_loss: 0.3922, test_loss: 1.0624, test_f1: 0.6291
 epoch: 63, train_loss: 0.3777, test_loss: 0.8752, test_f1: 0.6579
 epoch: 64, train_loss: 0.3836, test_loss: 0.9809, test_f1: 0.6438
 epoch: 65, train_loss: 0.3870, test_loss: 1.0943, test_f1: 0.6216
 epoch: 66, train_loss: 0.3657, test_loss: 1.0001, test_f1: 0.6473
 epoch: 67, train_loss: 0.3865, test_loss: 0.9781, test_f1: 0.6405
 epoch: 68, train_loss: 0.3786, test_loss: 1.0260, test_f1: 0.6264
 epoch: 69, train_loss: 0.3849, test_loss: 1.0341, test_f1: 0.6613
 epoch: 70, train_loss: 0.3579, test_loss: 0.9820, test_f1: 0.6453
 epoch: 71, train_loss: 0.3585, test_loss: 1.0450, test_f1: 0.6440
 epoch: 72, train_loss: 0.3577, test_loss: 1.1269, test_f1: 0.6337
 epoch: 73, train_loss: 0.3447, test_loss: 1.0854, test_f1: 0.6688
 epoch: 74, train_loss: 0.3600, test_loss: 1.1775, test_f1: 0.6392
 epoch: 75, train_loss: 0.3632, test_loss: 0.9992, test_f1: 0.6437
 epoch: 76, train_loss: 0.3467, test_loss: 1.1186, test_f1: 0.6307
 epoch: 77, train_loss: 0.3361, test_loss: 1.0871, test_f1: 0.6520
 epoch: 78, train_loss: 0.3299, test_loss: 1.0680, test_f1: 0.6422
 epoch: 79, train_loss: 0.3263, test_loss: 1.1109, test_f1: 0.6584
 epoch: 80, train_loss: 0.3370, test_loss: 1.1367, test_f1: 0.6502
 epoch: 81, train_loss: 0.3381, test_loss: 1.2030, test_f1: 0.6349
 epoch: 82, train_loss: 0.3240, test_loss: 1.0520, test_f1: 0.6715
 epoch: 83, train_loss: 0.3191, test_loss: 1.0563, test_f1: 0.6413
 epoch: 84, train_loss: 0.3153, test_loss: 1.1258, test_f1: 0.6385
 epoch: 85, train_loss: 0.3087, test_loss: 1.1438, test_f1: 0.6318
 epoch: 86, train_loss: 0.3135, test_loss: 1.1625, test_f1: 0.6565
 epoch: 87, train_loss: 0.3181, test_loss: 1.2603, test_f1: 0.6311
 epoch: 88, train_loss: 0.3002, test_loss: 1.1762, test_f1: 0.6608
 epoch: 89, train_loss: 0.2956, test_loss: 1.2814, test_f1: 0.6381
 epoch: 90, train_loss: 0.3021, test_loss: 1.2506, test_f1: 0.6332
 epoch: 91, train_loss: 0.3069, test_loss: 1.2559, test_f1: 0.6224
 epoch: 92, train_loss: 0.3112, test_loss: 1.2749, test_f1: 0.6368
 epoch: 93, train_loss: 0.2817, test_loss: 1.3132, test_f1: 0.6439
 epoch: 94, train_loss: 0.2801, test_loss: 1.2973, test_f1: 0.6336
 epoch: 95, train_loss: 0.3123, test_loss: 1.3753, test_f1: 0.6452
 epoch: 96, train_loss: 0.2900, test_loss: 1.2511, test_f1: 0.6401
 epoch: 97, train_loss: 0.2866, test_loss: 1.2969, test_f1: 0.6402
 epoch: 98, train_loss: 0.3038, test_loss: 1.3965, test_f1: 0.6192
 epoch: 99, train_loss: 0.2935, test_loss: 1.2430, test_f1: 0.6650
##################ITERATION #4 ****************************************
 epoch: 0, train_loss: 1.1986, test_loss: 1.0453, test_f1: 0.5100
 epoch: 1, train_loss: 0.9859, test_loss: 0.9746, test_f1: 0.5206
 epoch: 2, train_loss: 0.9393, test_loss: 0.9822, test_f1: 0.5407
 epoch: 3, train_loss: 0.9120, test_loss: 0.9573, test_f1: 0.5467
 epoch: 4, train_loss: 0.8813, test_loss: 0.9258, test_f1: 0.5812
 epoch: 5, train_loss: 0.8666, test_loss: 0.8972, test_f1: 0.5469
 epoch: 6, train_loss: 0.8500, test_loss: 0.8588, test_f1: 0.5567
 epoch: 7, train_loss: 0.8265, test_loss: 0.8589, test_f1: 0.6065
 epoch: 8, train_loss: 0.8110, test_loss: 0.8720, test_f1: 0.5690
 epoch: 9, train_loss: 0.8009, test_loss: 0.8799, test_f1: 0.5836
 epoch: 10, train_loss: 0.7822, test_loss: 0.8682, test_f1: 0.5452
 epoch: 11, train_loss: 0.7700, test_loss: 0.8907, test_f1: 0.6132
 epoch: 12, train_loss: 0.7631, test_loss: 0.8999, test_f1: 0.5688
 epoch: 13, train_loss: 0.7534, test_loss: 0.8294, test_f1: 0.5803
 epoch: 14, train_loss: 0.7297, test_loss: 0.8154, test_f1: 0.6030
 epoch: 15, train_loss: 0.7182, test_loss: 0.8911, test_f1: 0.5696
 epoch: 16, train_loss: 0.7106, test_loss: 0.7936, test_f1: 0.6086
 epoch: 17, train_loss: 0.6990, test_loss: 0.9029, test_f1: 0.5630
 epoch: 18, train_loss: 0.6868, test_loss: 0.9811, test_f1: 0.5538
 epoch: 19, train_loss: 0.6782, test_loss: 0.8311, test_f1: 0.6050
 epoch: 20, train_loss: 0.6776, test_loss: 0.8203, test_f1: 0.6308
 epoch: 21, train_loss: 0.6480, test_loss: 0.8118, test_f1: 0.6375
 epoch: 22, train_loss: 0.6568, test_loss: 0.8264, test_f1: 0.5965
 epoch: 23, train_loss: 0.6495, test_loss: 0.8470, test_f1: 0.6060
 epoch: 24, train_loss: 0.6396, test_loss: 0.9337, test_f1: 0.5552
 epoch: 25, train_loss: 0.6372, test_loss: 0.8426, test_f1: 0.6172
 epoch: 26, train_loss: 0.6344, test_loss: 0.8465, test_f1: 0.6270
 epoch: 27, train_loss: 0.6213, test_loss: 0.8355, test_f1: 0.6524
 epoch: 28, train_loss: 0.6075, test_loss: 0.8942, test_f1: 0.6035
 epoch: 29, train_loss: 0.5899, test_loss: 0.8448, test_f1: 0.6403
 epoch: 30, train_loss: 0.5697, test_loss: 0.9087, test_f1: 0.6301
 epoch: 31, train_loss: 0.5836, test_loss: 0.8374, test_f1: 0.6160
 epoch: 32, train_loss: 0.5798, test_loss: 0.8289, test_f1: 0.6451
 epoch: 33, train_loss: 0.5607, test_loss: 0.8074, test_f1: 0.6609
 epoch: 34, train_loss: 0.5626, test_loss: 0.8279, test_f1: 0.6424
 epoch: 35, train_loss: 0.5555, test_loss: 0.7904, test_f1: 0.6706
 epoch: 36, train_loss: 0.5420, test_loss: 0.8454, test_f1: 0.6572
 epoch: 37, train_loss: 0.5573, test_loss: 0.7806, test_f1: 0.6566
 epoch: 38, train_loss: 0.5349, test_loss: 0.7755, test_f1: 0.6635
 epoch: 39, train_loss: 0.5105, test_loss: 0.8640, test_f1: 0.6640
 epoch: 40, train_loss: 0.5232, test_loss: 0.8433, test_f1: 0.6313
 epoch: 41, train_loss: 0.5054, test_loss: 0.8973, test_f1: 0.6393
 epoch: 42, train_loss: 0.5003, test_loss: 0.9377, test_f1: 0.5979
 epoch: 43, train_loss: 0.5093, test_loss: 0.7901, test_f1: 0.6552
 epoch: 44, train_loss: 0.4993, test_loss: 0.8760, test_f1: 0.6379
 epoch: 45, train_loss: 0.5002, test_loss: 1.2300, test_f1: 0.5862
 epoch: 46, train_loss: 0.4992, test_loss: 0.8860, test_f1: 0.6057
 epoch: 47, train_loss: 0.4855, test_loss: 0.9008, test_f1: 0.6288
 epoch: 48, train_loss: 0.4645, test_loss: 0.9036, test_f1: 0.6294
 epoch: 49, train_loss: 0.4540, test_loss: 0.8963, test_f1: 0.6728
 epoch: 50, train_loss: 0.4604, test_loss: 0.9831, test_f1: 0.6152
 epoch: 51, train_loss: 0.4258, test_loss: 0.8155, test_f1: 0.6853
 epoch: 52, train_loss: 0.4189, test_loss: 0.8571, test_f1: 0.6656
 epoch: 53, train_loss: 0.3980, test_loss: 0.8941, test_f1: 0.6867
 epoch: 54, train_loss: 0.4039, test_loss: 0.9065, test_f1: 0.6750
 epoch: 55, train_loss: 0.3933, test_loss: 0.9444, test_f1: 0.6481
 epoch: 56, train_loss: 0.3653, test_loss: 0.9474, test_f1: 0.6601
 epoch: 57, train_loss: 0.3708, test_loss: 0.9099, test_f1: 0.6732
 epoch: 58, train_loss: 0.3693, test_loss: 0.9448, test_f1: 0.6673
 epoch: 59, train_loss: 0.3607, test_loss: 0.9024, test_f1: 0.6816
 epoch: 60, train_loss: 0.3703, test_loss: 0.9403, test_f1: 0.6704
 epoch: 61, train_loss: 0.3659, test_loss: 0.9138, test_f1: 0.6580
 epoch: 62, train_loss: 0.3597, test_loss: 1.0360, test_f1: 0.6579
 epoch: 63, train_loss: 0.3502, test_loss: 0.9973, test_f1: 0.6632
 epoch: 64, train_loss: 0.3505, test_loss: 0.9584, test_f1: 0.6822
 epoch: 65, train_loss: 0.3585, test_loss: 1.0573, test_f1: 0.6655
 epoch: 66, train_loss: 0.3360, test_loss: 1.1127, test_f1: 0.6658
 epoch: 67, train_loss: 0.3203, test_loss: 0.9470, test_f1: 0.6978
 epoch: 68, train_loss: 0.3396, test_loss: 1.0223, test_f1: 0.6685
 epoch: 69, train_loss: 0.3413, test_loss: 0.9268, test_f1: 0.6780
 epoch: 70, train_loss: 0.3136, test_loss: 0.9939, test_f1: 0.6687
 epoch: 71, train_loss: 0.3174, test_loss: 1.0654, test_f1: 0.6674
 epoch: 72, train_loss: 0.3455, test_loss: 1.0073, test_f1: 0.6632
 epoch: 73, train_loss: 0.3320, test_loss: 0.8825, test_f1: 0.7056
 epoch: 74, train_loss: 0.3233, test_loss: 0.9873, test_f1: 0.6792
 epoch: 75, train_loss: 0.3222, test_loss: 0.9965, test_f1: 0.6777
 epoch: 76, train_loss: 0.3002, test_loss: 1.0612, test_f1: 0.6781
 epoch: 77, train_loss: 0.2958, test_loss: 1.0518, test_f1: 0.6773
 epoch: 78, train_loss: 0.3128, test_loss: 1.0951, test_f1: 0.6592
 epoch: 79, train_loss: 0.2927, test_loss: 1.1178, test_f1: 0.6656
 epoch: 80, train_loss: 0.3045, test_loss: 1.0256, test_f1: 0.6858
 epoch: 81, train_loss: 0.3065, test_loss: 1.0483, test_f1: 0.7017
 epoch: 82, train_loss: 0.3097, test_loss: 0.9909, test_f1: 0.6693
 epoch: 83, train_loss: 0.2986, test_loss: 1.1063, test_f1: 0.6653
 epoch: 84, train_loss: 0.2966, test_loss: 1.0982, test_f1: 0.6905
 epoch: 85, train_loss: 0.2713, test_loss: 1.1408, test_f1: 0.6924
 epoch: 86, train_loss: 0.2890, test_loss: 1.2265, test_f1: 0.6471
 epoch: 87, train_loss: 0.3032, test_loss: 1.0881, test_f1: 0.6851
 epoch: 88, train_loss: 0.2937, test_loss: 1.3091, test_f1: 0.6688
 epoch: 89, train_loss: 0.2921, test_loss: 1.0718, test_f1: 0.6816
 epoch: 90, train_loss: 0.2685, test_loss: 1.1120, test_f1: 0.6734
 epoch: 91, train_loss: 0.2590, test_loss: 1.1692, test_f1: 0.6668
 epoch: 92, train_loss: 0.2699, test_loss: 1.1562, test_f1: 0.6905
 epoch: 93, train_loss: 0.2532, test_loss: 1.2322, test_f1: 0.6636
 epoch: 94, train_loss: 0.2645, test_loss: 1.2077, test_f1: 0.6712
 epoch: 95, train_loss: 0.2804, test_loss: 1.2800, test_f1: 0.6354
 epoch: 96, train_loss: 0.2495, test_loss: 1.2377, test_f1: 0.6742
 epoch: 97, train_loss: 0.2598, test_loss: 1.2651, test_f1: 0.6393
 epoch: 98, train_loss: 0.2715, test_loss: 1.5155, test_f1: 0.6414
 epoch: 99, train_loss: 0.2691, test_loss: 1.2738, test_f1: 0.6451
##################ITERATION #5 ****************************************
 epoch: 0, train_loss: 1.2470, test_loss: 1.0379, test_f1: 0.4936
 epoch: 1, train_loss: 1.0147, test_loss: 0.9727, test_f1: 0.5059
 epoch: 2, train_loss: 0.9397, test_loss: 0.9541, test_f1: 0.5487
 epoch: 3, train_loss: 0.9150, test_loss: 1.0159, test_f1: 0.5251
 epoch: 4, train_loss: 0.8979, test_loss: 0.9045, test_f1: 0.6070
 epoch: 5, train_loss: 0.8613, test_loss: 0.9170, test_f1: 0.5890
 epoch: 6, train_loss: 0.8395, test_loss: 0.9337, test_f1: 0.5974
 epoch: 7, train_loss: 0.8303, test_loss: 0.9024, test_f1: 0.5692
 epoch: 8, train_loss: 0.8021, test_loss: 0.9140, test_f1: 0.5574
 epoch: 9, train_loss: 0.7817, test_loss: 0.9117, test_f1: 0.5948
 epoch: 10, train_loss: 0.7775, test_loss: 0.8670, test_f1: 0.5815
 epoch: 11, train_loss: 0.7598, test_loss: 0.9203, test_f1: 0.5861
 epoch: 12, train_loss: 0.7510, test_loss: 0.9537, test_f1: 0.5782
 epoch: 13, train_loss: 0.7311, test_loss: 0.8307, test_f1: 0.6228
 epoch: 14, train_loss: 0.7171, test_loss: 0.9350, test_f1: 0.5858
 epoch: 15, train_loss: 0.7323, test_loss: 0.8488, test_f1: 0.5918
 epoch: 16, train_loss: 0.7100, test_loss: 0.7901, test_f1: 0.6066
 epoch: 17, train_loss: 0.6856, test_loss: 0.8442, test_f1: 0.6220
 epoch: 18, train_loss: 0.6665, test_loss: 0.8246, test_f1: 0.6456
 epoch: 19, train_loss: 0.6673, test_loss: 0.7903, test_f1: 0.6300
 epoch: 20, train_loss: 0.6734, test_loss: 0.8615, test_f1: 0.6037
 epoch: 21, train_loss: 0.6639, test_loss: 0.8181, test_f1: 0.6264
 epoch: 22, train_loss: 0.6547, test_loss: 0.8200, test_f1: 0.6155
 epoch: 23, train_loss: 0.6411, test_loss: 0.8897, test_f1: 0.6345
 epoch: 24, train_loss: 0.6441, test_loss: 0.8460, test_f1: 0.6213
 epoch: 25, train_loss: 0.6111, test_loss: 0.7818, test_f1: 0.6508
 epoch: 26, train_loss: 0.6083, test_loss: 0.8230, test_f1: 0.6502
 epoch: 27, train_loss: 0.5996, test_loss: 0.8454, test_f1: 0.6308
 epoch: 28, train_loss: 0.5974, test_loss: 0.8696, test_f1: 0.6174
 epoch: 29, train_loss: 0.5955, test_loss: 0.8261, test_f1: 0.6476
 epoch: 30, train_loss: 0.5810, test_loss: 0.8486, test_f1: 0.6419
 epoch: 31, train_loss: 0.5761, test_loss: 0.8275, test_f1: 0.6412
 epoch: 32, train_loss: 0.5596, test_loss: 0.8841, test_f1: 0.6291
 epoch: 33, train_loss: 0.5618, test_loss: 0.8485, test_f1: 0.6613
 epoch: 34, train_loss: 0.5481, test_loss: 0.8186, test_f1: 0.6427
 epoch: 35, train_loss: 0.5578, test_loss: 0.8211, test_f1: 0.6422
 epoch: 36, train_loss: 0.5436, test_loss: 0.8245, test_f1: 0.6631
 epoch: 37, train_loss: 0.5410, test_loss: 0.8285, test_f1: 0.6405
 epoch: 38, train_loss: 0.5433, test_loss: 0.8501, test_f1: 0.6568
 epoch: 39, train_loss: 0.5300, test_loss: 0.8992, test_f1: 0.6349
 epoch: 40, train_loss: 0.5208, test_loss: 0.8852, test_f1: 0.6432
 epoch: 41, train_loss: 0.5143, test_loss: 0.9047, test_f1: 0.6512
 epoch: 42, train_loss: 0.5018, test_loss: 0.8971, test_f1: 0.6464
 epoch: 43, train_loss: 0.5138, test_loss: 0.8437, test_f1: 0.6395
 epoch: 44, train_loss: 0.4968, test_loss: 0.9013, test_f1: 0.6404
 epoch: 45, train_loss: 0.4813, test_loss: 0.9475, test_f1: 0.6512
 epoch: 46, train_loss: 0.4777, test_loss: 0.9769, test_f1: 0.6518
 epoch: 47, train_loss: 0.4606, test_loss: 0.9083, test_f1: 0.6461
 epoch: 48, train_loss: 0.4671, test_loss: 1.1149, test_f1: 0.6375
 epoch: 49, train_loss: 0.4696, test_loss: 1.0748, test_f1: 0.6254
 epoch: 50, train_loss: 0.4496, test_loss: 1.1729, test_f1: 0.5817
 epoch: 51, train_loss: 0.4380, test_loss: 0.9650, test_f1: 0.6614
 epoch: 52, train_loss: 0.4157, test_loss: 0.9506, test_f1: 0.6594
 epoch: 53, train_loss: 0.3923, test_loss: 1.0015, test_f1: 0.6776
 epoch: 54, train_loss: 0.3925, test_loss: 1.0689, test_f1: 0.6535
 epoch: 55, train_loss: 0.3807, test_loss: 1.0018, test_f1: 0.6591
 epoch: 56, train_loss: 0.3789, test_loss: 1.0145, test_f1: 0.6618
 epoch: 57, train_loss: 0.3730, test_loss: 1.0372, test_f1: 0.6553
 epoch: 58, train_loss: 0.3856, test_loss: 1.0498, test_f1: 0.6537
 epoch: 59, train_loss: 0.3754, test_loss: 1.0157, test_f1: 0.6666
 epoch: 60, train_loss: 0.3666, test_loss: 1.0270, test_f1: 0.6735
 epoch: 61, train_loss: 0.3577, test_loss: 1.0243, test_f1: 0.6641
 epoch: 62, train_loss: 0.3532, test_loss: 0.9913, test_f1: 0.6728
 epoch: 63, train_loss: 0.3534, test_loss: 1.0156, test_f1: 0.6536
 epoch: 64, train_loss: 0.3679, test_loss: 1.0789, test_f1: 0.6749
 epoch: 65, train_loss: 0.3677, test_loss: 1.1868, test_f1: 0.6351
 epoch: 66, train_loss: 0.3465, test_loss: 1.0874, test_f1: 0.6716
 epoch: 67, train_loss: 0.3472, test_loss: 1.0439, test_f1: 0.6846
 epoch: 68, train_loss: 0.3421, test_loss: 1.2010, test_f1: 0.6674
 epoch: 69, train_loss: 0.3336, test_loss: 1.0913, test_f1: 0.6825
 epoch: 70, train_loss: 0.3331, test_loss: 1.0486, test_f1: 0.6657
 epoch: 71, train_loss: 0.3311, test_loss: 1.1579, test_f1: 0.6750
 epoch: 72, train_loss: 0.3410, test_loss: 1.0697, test_f1: 0.6521
 epoch: 73, train_loss: 0.3117, test_loss: 1.1522, test_f1: 0.6843
 epoch: 74, train_loss: 0.3335, test_loss: 1.2608, test_f1: 0.6586
 epoch: 75, train_loss: 0.3254, test_loss: 1.2695, test_f1: 0.6474
 epoch: 76, train_loss: 0.3304, test_loss: 1.0566, test_f1: 0.6434
 epoch: 77, train_loss: 0.3183, test_loss: 1.2313, test_f1: 0.6644
 epoch: 78, train_loss: 0.3336, test_loss: 1.1792, test_f1: 0.6721
 epoch: 79, train_loss: 0.3097, test_loss: 1.2745, test_f1: 0.6868
 epoch: 80, train_loss: 0.3127, test_loss: 1.1802, test_f1: 0.6708
 epoch: 81, train_loss: 0.3176, test_loss: 1.2016, test_f1: 0.6799
 epoch: 82, train_loss: 0.3147, test_loss: 1.1349, test_f1: 0.6932
 epoch: 83, train_loss: 0.3058, test_loss: 1.1723, test_f1: 0.6667
 epoch: 84, train_loss: 0.2939, test_loss: 1.1892, test_f1: 0.6627
 epoch: 85, train_loss: 0.3086, test_loss: 1.3442, test_f1: 0.6355
 epoch: 86, train_loss: 0.3001, test_loss: 1.2635, test_f1: 0.6588
 epoch: 87, train_loss: 0.2913, test_loss: 1.2385, test_f1: 0.6738
 epoch: 88, train_loss: 0.2930, test_loss: 1.2561, test_f1: 0.6606
 epoch: 89, train_loss: 0.2807, test_loss: 1.2100, test_f1: 0.6516
 epoch: 90, train_loss: 0.2790, test_loss: 1.1885, test_f1: 0.6684
 epoch: 91, train_loss: 0.2769, test_loss: 1.2402, test_f1: 0.6741
 epoch: 92, train_loss: 0.2778, test_loss: 1.2890, test_f1: 0.6885
 epoch: 93, train_loss: 0.2741, test_loss: 1.3462, test_f1: 0.6661
 epoch: 94, train_loss: 0.2864, test_loss: 1.2940, test_f1: 0.6511
 epoch: 95, train_loss: 0.2852, test_loss: 1.3437, test_f1: 0.6857
 epoch: 96, train_loss: 0.2848, test_loss: 1.2620, test_f1: 0.6649
 epoch: 97, train_loss: 0.2849, test_loss: 1.1517, test_f1: 0.6754
 epoch: 98, train_loss: 0.2560, test_loss: 1.2300, test_f1: 0.6662
 epoch: 99, train_loss: 0.2584, test_loss: 1.1961, test_f1: 0.6700
##################ITERATION #6 ****************************************
 epoch: 0, train_loss: 1.3554, test_loss: 1.1008, test_f1: 0.3734
 epoch: 1, train_loss: 1.0049, test_loss: 0.9527, test_f1: 0.5154
 epoch: 2, train_loss: 0.9502, test_loss: 0.9458, test_f1: 0.4956
 epoch: 3, train_loss: 0.9275, test_loss: 0.8846, test_f1: 0.4986
 epoch: 4, train_loss: 0.9040, test_loss: 0.9220, test_f1: 0.5267
 epoch: 5, train_loss: 0.9081, test_loss: 0.9312, test_f1: 0.5323
 epoch: 6, train_loss: 0.8789, test_loss: 0.9449, test_f1: 0.5414
 epoch: 7, train_loss: 0.8518, test_loss: 0.9204, test_f1: 0.5760
 epoch: 8, train_loss: 0.8285, test_loss: 0.9310, test_f1: 0.5563
 epoch: 9, train_loss: 0.8347, test_loss: 0.9121, test_f1: 0.5651
 epoch: 10, train_loss: 0.8178, test_loss: 0.9545, test_f1: 0.5940
 epoch: 11, train_loss: 0.8044, test_loss: 1.0421, test_f1: 0.5440
 epoch: 12, train_loss: 0.7963, test_loss: 0.8817, test_f1: 0.5539
 epoch: 13, train_loss: 0.7670, test_loss: 0.9124, test_f1: 0.5875
 epoch: 14, train_loss: 0.7655, test_loss: 0.8981, test_f1: 0.5663
 epoch: 15, train_loss: 0.7820, test_loss: 0.8883, test_f1: 0.6120
 epoch: 16, train_loss: 0.7364, test_loss: 0.9863, test_f1: 0.5941
 epoch: 17, train_loss: 0.7408, test_loss: 0.9505, test_f1: 0.5874
 epoch: 18, train_loss: 0.7063, test_loss: 0.9102, test_f1: 0.5991
 epoch: 19, train_loss: 0.7033, test_loss: 0.9533, test_f1: 0.6007
 epoch: 20, train_loss: 0.7109, test_loss: 0.9625, test_f1: 0.5888
 epoch: 21, train_loss: 0.6801, test_loss: 0.8687, test_f1: 0.6219
 epoch: 22, train_loss: 0.6813, test_loss: 0.9367, test_f1: 0.5924
 epoch: 23, train_loss: 0.6813, test_loss: 0.9016, test_f1: 0.6027
 epoch: 24, train_loss: 0.6670, test_loss: 0.8967, test_f1: 0.6170
 epoch: 25, train_loss: 0.6605, test_loss: 0.8839, test_f1: 0.6292
 epoch: 26, train_loss: 0.6558, test_loss: 0.9420, test_f1: 0.6222
 epoch: 27, train_loss: 0.6560, test_loss: 0.9713, test_f1: 0.5929
 epoch: 28, train_loss: 0.6447, test_loss: 0.9426, test_f1: 0.6112
 epoch: 29, train_loss: 0.6329, test_loss: 0.9544, test_f1: 0.6213
 epoch: 30, train_loss: 0.6149, test_loss: 0.9232, test_f1: 0.6251
 epoch: 31, train_loss: 0.6230, test_loss: 0.9871, test_f1: 0.6071
 epoch: 32, train_loss: 0.6235, test_loss: 0.9012, test_f1: 0.6351
 epoch: 33, train_loss: 0.5938, test_loss: 0.9650, test_f1: 0.6324
 epoch: 34, train_loss: 0.5888, test_loss: 0.9106, test_f1: 0.6467
 epoch: 35, train_loss: 0.5831, test_loss: 0.8656, test_f1: 0.6314
 epoch: 36, train_loss: 0.5755, test_loss: 0.9565, test_f1: 0.6126
 epoch: 37, train_loss: 0.5588, test_loss: 0.9630, test_f1: 0.6288
 epoch: 38, train_loss: 0.5534, test_loss: 0.9153, test_f1: 0.6365
 epoch: 39, train_loss: 0.5612, test_loss: 0.9333, test_f1: 0.6369
 epoch: 40, train_loss: 0.5539, test_loss: 0.8717, test_f1: 0.6679
 epoch: 41, train_loss: 0.5557, test_loss: 0.9276, test_f1: 0.6320
 epoch: 42, train_loss: 0.5389, test_loss: 0.9825, test_f1: 0.6372
 epoch: 43, train_loss: 0.5389, test_loss: 1.0160, test_f1: 0.5803
 epoch: 44, train_loss: 0.5370, test_loss: 1.0039, test_f1: 0.6380
 epoch: 45, train_loss: 0.5309, test_loss: 1.1017, test_f1: 0.6002
 epoch: 46, train_loss: 0.5116, test_loss: 0.9632, test_f1: 0.6519
 epoch: 47, train_loss: 0.5107, test_loss: 1.1017, test_f1: 0.5994
 epoch: 48, train_loss: 0.5180, test_loss: 1.0181, test_f1: 0.5940
 epoch: 49, train_loss: 0.5140, test_loss: 0.9693, test_f1: 0.6236
 epoch: 50, train_loss: 0.5153, test_loss: 0.9850, test_f1: 0.6174
 epoch: 51, train_loss: 0.4566, test_loss: 0.9876, test_f1: 0.6629
 epoch: 52, train_loss: 0.4460, test_loss: 0.9949, test_f1: 0.6557
 epoch: 53, train_loss: 0.4341, test_loss: 1.0047, test_f1: 0.6462
 epoch: 54, train_loss: 0.4146, test_loss: 1.0455, test_f1: 0.6709
 epoch: 55, train_loss: 0.4153, test_loss: 1.0443, test_f1: 0.6584
 epoch: 56, train_loss: 0.4082, test_loss: 1.0501, test_f1: 0.6570
 epoch: 57, train_loss: 0.3878, test_loss: 1.0624, test_f1: 0.6481
 epoch: 58, train_loss: 0.3926, test_loss: 1.0619, test_f1: 0.6378
 epoch: 59, train_loss: 0.3988, test_loss: 1.0895, test_f1: 0.6345
 epoch: 60, train_loss: 0.3920, test_loss: 1.0513, test_f1: 0.6680
 epoch: 61, train_loss: 0.3914, test_loss: 1.1248, test_f1: 0.6601
 epoch: 62, train_loss: 0.3741, test_loss: 1.0536, test_f1: 0.6553
 epoch: 63, train_loss: 0.3882, test_loss: 1.1252, test_f1: 0.6434
 epoch: 64, train_loss: 0.3876, test_loss: 1.1870, test_f1: 0.6118
 epoch: 65, train_loss: 0.3663, test_loss: 1.0557, test_f1: 0.6585
 epoch: 66, train_loss: 0.3767, test_loss: 1.1199, test_f1: 0.6521
 epoch: 67, train_loss: 0.3710, test_loss: 1.1192, test_f1: 0.6497
 epoch: 68, train_loss: 0.3627, test_loss: 1.3924, test_f1: 0.6458
 epoch: 69, train_loss: 0.3518, test_loss: 1.1372, test_f1: 0.6668
 epoch: 70, train_loss: 0.3537, test_loss: 1.1318, test_f1: 0.6665
 epoch: 71, train_loss: 0.3526, test_loss: 1.2132, test_f1: 0.6756
 epoch: 72, train_loss: 0.3539, test_loss: 1.0875, test_f1: 0.6670
 epoch: 73, train_loss: 0.3474, test_loss: 1.2549, test_f1: 0.6619
 epoch: 74, train_loss: 0.3408, test_loss: 1.1629, test_f1: 0.6798
 epoch: 75, train_loss: 0.3420, test_loss: 1.1812, test_f1: 0.6848
 epoch: 76, train_loss: 0.3280, test_loss: 1.2109, test_f1: 0.6556
 epoch: 77, train_loss: 0.3403, test_loss: 1.1780, test_f1: 0.6740
 epoch: 78, train_loss: 0.3226, test_loss: 1.4320, test_f1: 0.6112
 epoch: 79, train_loss: 0.3437, test_loss: 1.1377, test_f1: 0.6662
 epoch: 80, train_loss: 0.3304, test_loss: 1.1666, test_f1: 0.6849
 epoch: 81, train_loss: 0.3248, test_loss: 1.2010, test_f1: 0.6731
 epoch: 82, train_loss: 0.3241, test_loss: 1.1712, test_f1: 0.6755
 epoch: 83, train_loss: 0.3061, test_loss: 1.4152, test_f1: 0.6332
 epoch: 84, train_loss: 0.3384, test_loss: 1.1317, test_f1: 0.6742
 epoch: 85, train_loss: 0.3355, test_loss: 1.2364, test_f1: 0.6541
 epoch: 86, train_loss: 0.3282, test_loss: 1.2301, test_f1: 0.6704
 epoch: 87, train_loss: 0.3251, test_loss: 1.2056, test_f1: 0.6703
 epoch: 88, train_loss: 0.3172, test_loss: 1.1670, test_f1: 0.6686
 epoch: 89, train_loss: 0.3074, test_loss: 1.1738, test_f1: 0.6862
 epoch: 90, train_loss: 0.3024, test_loss: 1.3616, test_f1: 0.6027
 epoch: 91, train_loss: 0.3012, test_loss: 1.3658, test_f1: 0.6317
 epoch: 92, train_loss: 0.3088, test_loss: 1.3303, test_f1: 0.6375
 epoch: 93, train_loss: 0.2980, test_loss: 1.3603, test_f1: 0.6452
 epoch: 94, train_loss: 0.3115, test_loss: 1.2532, test_f1: 0.6721
 epoch: 95, train_loss: 0.2826, test_loss: 1.3038, test_f1: 0.6757
 epoch: 96, train_loss: 0.3023, test_loss: 1.2665, test_f1: 0.6560
 epoch: 97, train_loss: 0.2858, test_loss: 1.2513, test_f1: 0.6737
 epoch: 98, train_loss: 0.2801, test_loss: 1.2552, test_f1: 0.6426
 epoch: 99, train_loss: 0.3009, test_loss: 1.2389, test_f1: 0.6524
##################ITERATION #7 ****************************************
 epoch: 0, train_loss: 1.2317, test_loss: 1.0244, test_f1: 0.3752
 epoch: 1, train_loss: 0.9937, test_loss: 0.9695, test_f1: 0.5355
 epoch: 2, train_loss: 0.9535, test_loss: 0.9341, test_f1: 0.5125
 epoch: 3, train_loss: 0.9270, test_loss: 0.9825, test_f1: 0.5104
 epoch: 4, train_loss: 0.9046, test_loss: 0.9542, test_f1: 0.5065
 epoch: 5, train_loss: 0.8788, test_loss: 0.8974, test_f1: 0.5343
 epoch: 6, train_loss: 0.8570, test_loss: 0.9528, test_f1: 0.5435
 epoch: 7, train_loss: 0.8508, test_loss: 1.0345, test_f1: 0.4898
 epoch: 8, train_loss: 0.8359, test_loss: 0.8995, test_f1: 0.5663
 epoch: 9, train_loss: 0.8044, test_loss: 0.9719, test_f1: 0.5685
 epoch: 10, train_loss: 0.7976, test_loss: 0.9062, test_f1: 0.5400
 epoch: 11, train_loss: 0.7915, test_loss: 0.8885, test_f1: 0.6049
 epoch: 12, train_loss: 0.7612, test_loss: 0.8409, test_f1: 0.5895
 epoch: 13, train_loss: 0.7513, test_loss: 0.8752, test_f1: 0.5555
 epoch: 14, train_loss: 0.7412, test_loss: 0.8594, test_f1: 0.6287
 epoch: 15, train_loss: 0.7123, test_loss: 0.8846, test_f1: 0.5897
 epoch: 16, train_loss: 0.7074, test_loss: 0.8577, test_f1: 0.6414
 epoch: 17, train_loss: 0.7166, test_loss: 0.9068, test_f1: 0.5717
 epoch: 18, train_loss: 0.6848, test_loss: 0.9400, test_f1: 0.5845
 epoch: 19, train_loss: 0.6801, test_loss: 0.8788, test_f1: 0.6132
 epoch: 20, train_loss: 0.6543, test_loss: 0.9206, test_f1: 0.5974
 epoch: 21, train_loss: 0.6601, test_loss: 1.1085, test_f1: 0.5451
 epoch: 22, train_loss: 0.6530, test_loss: 0.9518, test_f1: 0.5885
 epoch: 23, train_loss: 0.6406, test_loss: 0.9387, test_f1: 0.5644
 epoch: 24, train_loss: 0.6345, test_loss: 0.9013, test_f1: 0.5979
 epoch: 25, train_loss: 0.6147, test_loss: 0.9013, test_f1: 0.6119
 epoch: 26, train_loss: 0.6088, test_loss: 0.8679, test_f1: 0.6325
 epoch: 27, train_loss: 0.6038, test_loss: 0.8775, test_f1: 0.6014
 epoch: 28, train_loss: 0.5858, test_loss: 0.9081, test_f1: 0.6008
 epoch: 29, train_loss: 0.5987, test_loss: 0.9182, test_f1: 0.5933
 epoch: 30, train_loss: 0.5795, test_loss: 0.9573, test_f1: 0.6087
 epoch: 31, train_loss: 0.5659, test_loss: 0.9555, test_f1: 0.6080
 epoch: 32, train_loss: 0.5763, test_loss: 0.9365, test_f1: 0.6186
 epoch: 33, train_loss: 0.5628, test_loss: 1.0571, test_f1: 0.5762
 epoch: 34, train_loss: 0.5561, test_loss: 0.9957, test_f1: 0.5940
 epoch: 35, train_loss: 0.5312, test_loss: 0.9438, test_f1: 0.5987
 epoch: 36, train_loss: 0.5223, test_loss: 0.9667, test_f1: 0.5654
 epoch: 37, train_loss: 0.5170, test_loss: 0.9366, test_f1: 0.5987
 epoch: 38, train_loss: 0.5169, test_loss: 0.9427, test_f1: 0.6148
 epoch: 39, train_loss: 0.5296, test_loss: 0.9806, test_f1: 0.6054
 epoch: 40, train_loss: 0.5079, test_loss: 0.9634, test_f1: 0.6167
 epoch: 41, train_loss: 0.4991, test_loss: 0.9709, test_f1: 0.6060
 epoch: 42, train_loss: 0.5085, test_loss: 0.9730, test_f1: 0.6330
 epoch: 43, train_loss: 0.4958, test_loss: 1.0137, test_f1: 0.6110
 epoch: 44, train_loss: 0.4826, test_loss: 0.9709, test_f1: 0.6207
 epoch: 45, train_loss: 0.4784, test_loss: 0.9432, test_f1: 0.6583
 epoch: 46, train_loss: 0.4642, test_loss: 1.0632, test_f1: 0.6027
 epoch: 47, train_loss: 0.4511, test_loss: 1.1311, test_f1: 0.5805
 epoch: 48, train_loss: 0.4866, test_loss: 0.8631, test_f1: 0.6814
 epoch: 49, train_loss: 0.4638, test_loss: 1.0086, test_f1: 0.6313
 epoch: 50, train_loss: 0.4360, test_loss: 0.9797, test_f1: 0.6432
 epoch: 51, train_loss: 0.3901, test_loss: 1.0487, test_f1: 0.6337
 epoch: 52, train_loss: 0.3801, test_loss: 1.0143, test_f1: 0.6533
 epoch: 53, train_loss: 0.3661, test_loss: 1.0894, test_f1: 0.6320
 epoch: 54, train_loss: 0.3679, test_loss: 1.1268, test_f1: 0.6193
 epoch: 55, train_loss: 0.3749, test_loss: 1.0846, test_f1: 0.6275
 epoch: 56, train_loss: 0.3694, test_loss: 1.1091, test_f1: 0.6440
 epoch: 57, train_loss: 0.3413, test_loss: 1.1043, test_f1: 0.6579
 epoch: 58, train_loss: 0.3551, test_loss: 1.0518, test_f1: 0.6651
 epoch: 59, train_loss: 0.3361, test_loss: 1.1246, test_f1: 0.6554
 epoch: 60, train_loss: 0.3418, test_loss: 1.0674, test_f1: 0.6484
 epoch: 61, train_loss: 0.3354, test_loss: 1.0837, test_f1: 0.6540
 epoch: 62, train_loss: 0.3238, test_loss: 1.0874, test_f1: 0.6490
 epoch: 63, train_loss: 0.3128, test_loss: 1.1279, test_f1: 0.6398
 epoch: 64, train_loss: 0.3315, test_loss: 1.1006, test_f1: 0.6654
 epoch: 65, train_loss: 0.3357, test_loss: 1.1023, test_f1: 0.6591
 epoch: 66, train_loss: 0.3191, test_loss: 1.0508, test_f1: 0.6766
 epoch: 67, train_loss: 0.3134, test_loss: 1.1401, test_f1: 0.6519
 epoch: 68, train_loss: 0.3047, test_loss: 1.1800, test_f1: 0.6847
 epoch: 69, train_loss: 0.3025, test_loss: 1.1959, test_f1: 0.6407
 epoch: 70, train_loss: 0.3223, test_loss: 1.1649, test_f1: 0.6449
 epoch: 71, train_loss: 0.2952, test_loss: 1.1423, test_f1: 0.6506
 epoch: 72, train_loss: 0.3081, test_loss: 1.2360, test_f1: 0.6429
 epoch: 73, train_loss: 0.2850, test_loss: 1.1797, test_f1: 0.6416
 epoch: 74, train_loss: 0.2995, test_loss: 1.2488, test_f1: 0.6284
 epoch: 75, train_loss: 0.2887, test_loss: 1.1539, test_f1: 0.6707
 epoch: 76, train_loss: 0.3002, test_loss: 1.2223, test_f1: 0.6423
 epoch: 77, train_loss: 0.3044, test_loss: 1.2718, test_f1: 0.6266
 epoch: 78, train_loss: 0.2807, test_loss: 1.1781, test_f1: 0.6483
 epoch: 79, train_loss: 0.2895, test_loss: 1.2463, test_f1: 0.6418
 epoch: 80, train_loss: 0.2929, test_loss: 1.3164, test_f1: 0.6226
 epoch: 81, train_loss: 0.2871, test_loss: 1.3384, test_f1: 0.6291
 epoch: 82, train_loss: 0.2810, test_loss: 1.2703, test_f1: 0.6284
 epoch: 83, train_loss: 0.2785, test_loss: 1.1855, test_f1: 0.6532
 epoch: 84, train_loss: 0.2802, test_loss: 1.2270, test_f1: 0.6339
 epoch: 85, train_loss: 0.2660, test_loss: 1.2636, test_f1: 0.6329
 epoch: 86, train_loss: 0.2614, test_loss: 1.3121, test_f1: 0.6420
 epoch: 87, train_loss: 0.2592, test_loss: 1.1908, test_f1: 0.6625
 epoch: 88, train_loss: 0.2712, test_loss: 1.2026, test_f1: 0.6759
 epoch: 89, train_loss: 0.2635, test_loss: 1.2599, test_f1: 0.6500
 epoch: 90, train_loss: 0.2508, test_loss: 1.3336, test_f1: 0.6408
 epoch: 91, train_loss: 0.2524, test_loss: 1.2838, test_f1: 0.6664
 epoch: 92, train_loss: 0.2486, test_loss: 1.2456, test_f1: 0.6522
 epoch: 93, train_loss: 0.2462, test_loss: 1.3106, test_f1: 0.6472
 epoch: 94, train_loss: 0.2849, test_loss: 1.2395, test_f1: 0.6685
 epoch: 95, train_loss: 0.2527, test_loss: 1.2194, test_f1: 0.6663
 epoch: 96, train_loss: 0.2366, test_loss: 1.3018, test_f1: 0.6374
 epoch: 97, train_loss: 0.2518, test_loss: 1.2250, test_f1: 0.6799
 epoch: 98, train_loss: 0.2417, test_loss: 1.3275, test_f1: 0.6543
 epoch: 99, train_loss: 0.2340, test_loss: 1.3868, test_f1: 0.6462
##################ITERATION #8 ****************************************
 epoch: 0, train_loss: 1.2848, test_loss: 0.9831, test_f1: 0.4766
 epoch: 1, train_loss: 0.9920, test_loss: 0.9829, test_f1: 0.4930
 epoch: 2, train_loss: 0.9398, test_loss: 0.9260, test_f1: 0.5208
 epoch: 3, train_loss: 0.9052, test_loss: 0.9197, test_f1: 0.5115
 epoch: 4, train_loss: 0.9005, test_loss: 0.9427, test_f1: 0.5267
 epoch: 5, train_loss: 0.8691, test_loss: 0.9285, test_f1: 0.5041
 epoch: 6, train_loss: 0.8611, test_loss: 0.8709, test_f1: 0.5367
 epoch: 7, train_loss: 0.8343, test_loss: 0.9001, test_f1: 0.5698
 epoch: 8, train_loss: 0.8145, test_loss: 0.9601, test_f1: 0.5107
 epoch: 9, train_loss: 0.8016, test_loss: 0.9107, test_f1: 0.5260
 epoch: 10, train_loss: 0.7987, test_loss: 0.9199, test_f1: 0.5391
 epoch: 11, train_loss: 0.7621, test_loss: 1.0177, test_f1: 0.5006
 epoch: 12, train_loss: 0.7802, test_loss: 0.8906, test_f1: 0.5644
 epoch: 13, train_loss: 0.7463, test_loss: 0.8759, test_f1: 0.5593
 epoch: 14, train_loss: 0.7473, test_loss: 0.9179, test_f1: 0.5482
 epoch: 15, train_loss: 0.7224, test_loss: 1.0075, test_f1: 0.5547
 epoch: 16, train_loss: 0.7247, test_loss: 0.9574, test_f1: 0.5501
 epoch: 17, train_loss: 0.7160, test_loss: 0.9109, test_f1: 0.5774
 epoch: 18, train_loss: 0.6828, test_loss: 0.8300, test_f1: 0.6515
 epoch: 19, train_loss: 0.6933, test_loss: 0.8528, test_f1: 0.5748
 epoch: 20, train_loss: 0.6775, test_loss: 0.8265, test_f1: 0.6320
 epoch: 21, train_loss: 0.6548, test_loss: 0.8390, test_f1: 0.6022
 epoch: 22, train_loss: 0.6530, test_loss: 0.8776, test_f1: 0.6120
 epoch: 23, train_loss: 0.6439, test_loss: 0.9918, test_f1: 0.5592
 epoch: 24, train_loss: 0.6439, test_loss: 0.8290, test_f1: 0.5950
 epoch: 25, train_loss: 0.6214, test_loss: 0.8661, test_f1: 0.6267
 epoch: 26, train_loss: 0.6393, test_loss: 0.8421, test_f1: 0.6179
 epoch: 27, train_loss: 0.6169, test_loss: 1.0398, test_f1: 0.5353
 epoch: 28, train_loss: 0.5913, test_loss: 0.8500, test_f1: 0.6348
 epoch: 29, train_loss: 0.5864, test_loss: 0.9889, test_f1: 0.5807
 epoch: 30, train_loss: 0.5891, test_loss: 0.9072, test_f1: 0.6247
 epoch: 31, train_loss: 0.5732, test_loss: 0.9446, test_f1: 0.6266
 epoch: 32, train_loss: 0.5742, test_loss: 0.8752, test_f1: 0.6696
 epoch: 33, train_loss: 0.5658, test_loss: 0.9291, test_f1: 0.6187
 epoch: 34, train_loss: 0.5525, test_loss: 0.9833, test_f1: 0.6058
 epoch: 35, train_loss: 0.5459, test_loss: 1.0750, test_f1: 0.5965
 epoch: 36, train_loss: 0.5375, test_loss: 0.9495, test_f1: 0.6030
 epoch: 37, train_loss: 0.5380, test_loss: 1.0561, test_f1: 0.5948
 epoch: 38, train_loss: 0.5402, test_loss: 0.9353, test_f1: 0.6214
 epoch: 39, train_loss: 0.5250, test_loss: 0.8910, test_f1: 0.6615
 epoch: 40, train_loss: 0.5315, test_loss: 0.9469, test_f1: 0.6380
 epoch: 41, train_loss: 0.5245, test_loss: 0.9447, test_f1: 0.6261
 epoch: 42, train_loss: 0.5268, test_loss: 1.0811, test_f1: 0.5907
 epoch: 43, train_loss: 0.5040, test_loss: 0.9313, test_f1: 0.6520
 epoch: 44, train_loss: 0.4987, test_loss: 1.0003, test_f1: 0.6279
 epoch: 45, train_loss: 0.5094, test_loss: 1.0544, test_f1: 0.6197
 epoch: 46, train_loss: 0.4966, test_loss: 0.9998, test_f1: 0.6147
 epoch: 47, train_loss: 0.4977, test_loss: 0.9565, test_f1: 0.6340
 epoch: 48, train_loss: 0.5004, test_loss: 0.9828, test_f1: 0.6520
 epoch: 49, train_loss: 0.4637, test_loss: 0.9657, test_f1: 0.6303
 epoch: 50, train_loss: 0.4618, test_loss: 0.9357, test_f1: 0.6515
 epoch: 51, train_loss: 0.4392, test_loss: 0.9855, test_f1: 0.6378
 epoch: 52, train_loss: 0.3937, test_loss: 1.0119, test_f1: 0.6596
 epoch: 53, train_loss: 0.3860, test_loss: 1.0431, test_f1: 0.6601
 epoch: 54, train_loss: 0.3847, test_loss: 1.0896, test_f1: 0.6399
 epoch: 55, train_loss: 0.3958, test_loss: 1.0919, test_f1: 0.6361
 epoch: 56, train_loss: 0.3875, test_loss: 1.0350, test_f1: 0.6629
 epoch: 57, train_loss: 0.3811, test_loss: 0.9886, test_f1: 0.6801
 epoch: 58, train_loss: 0.3791, test_loss: 1.0411, test_f1: 0.6431
 epoch: 59, train_loss: 0.3779, test_loss: 1.1024, test_f1: 0.6474
 epoch: 60, train_loss: 0.4000, test_loss: 1.0601, test_f1: 0.6603
 epoch: 61, train_loss: 0.3593, test_loss: 1.3241, test_f1: 0.6226
 epoch: 62, train_loss: 0.3529, test_loss: 1.1507, test_f1: 0.6576
 epoch: 63, train_loss: 0.3529, test_loss: 1.1715, test_f1: 0.6514
 epoch: 64, train_loss: 0.3544, test_loss: 1.1502, test_f1: 0.6719
 epoch: 65, train_loss: 0.3535, test_loss: 1.2042, test_f1: 0.6443
 epoch: 66, train_loss: 0.3367, test_loss: 1.1979, test_f1: 0.6371
 epoch: 67, train_loss: 0.3463, test_loss: 1.2345, test_f1: 0.6383
 epoch: 68, train_loss: 0.3541, test_loss: 1.2260, test_f1: 0.6326
 epoch: 69, train_loss: 0.3592, test_loss: 1.2078, test_f1: 0.6356
 epoch: 70, train_loss: 0.3504, test_loss: 1.1934, test_f1: 0.6367
 epoch: 71, train_loss: 0.3476, test_loss: 1.2353, test_f1: 0.6420
 epoch: 72, train_loss: 0.3349, test_loss: 1.1742, test_f1: 0.6481
 epoch: 73, train_loss: 0.3488, test_loss: 1.1170, test_f1: 0.6633
 epoch: 74, train_loss: 0.3088, test_loss: 1.2039, test_f1: 0.6420
 epoch: 75, train_loss: 0.3221, test_loss: 1.2193, test_f1: 0.6571
 epoch: 76, train_loss: 0.3226, test_loss: 1.2506, test_f1: 0.6356
 epoch: 77, train_loss: 0.3341, test_loss: 1.1872, test_f1: 0.6609
 epoch: 78, train_loss: 0.3204, test_loss: 1.2439, test_f1: 0.6511
 epoch: 79, train_loss: 0.3142, test_loss: 1.3406, test_f1: 0.6251
 epoch: 80, train_loss: 0.3032, test_loss: 1.3345, test_f1: 0.6322
 epoch: 81, train_loss: 0.3216, test_loss: 1.1694, test_f1: 0.6505
 epoch: 82, train_loss: 0.3024, test_loss: 1.2662, test_f1: 0.6635
 epoch: 83, train_loss: 0.3149, test_loss: 1.2747, test_f1: 0.6780
 epoch: 84, train_loss: 0.3071, test_loss: 1.2608, test_f1: 0.6494
 epoch: 85, train_loss: 0.3033, test_loss: 1.3137, test_f1: 0.6485
 epoch: 86, train_loss: 0.2931, test_loss: 1.3132, test_f1: 0.6247
 epoch: 87, train_loss: 0.3034, test_loss: 1.2575, test_f1: 0.6533
 epoch: 88, train_loss: 0.3228, test_loss: 1.3694, test_f1: 0.6319
 epoch: 89, train_loss: 0.2920, test_loss: 1.4205, test_f1: 0.6229
 epoch: 90, train_loss: 0.3028, test_loss: 1.3462, test_f1: 0.6160
 epoch: 91, train_loss: 0.2923, test_loss: 1.3318, test_f1: 0.6624
 epoch: 92, train_loss: 0.2906, test_loss: 1.3524, test_f1: 0.6396
 epoch: 93, train_loss: 0.2743, test_loss: 1.3838, test_f1: 0.6420
 epoch: 94, train_loss: 0.2608, test_loss: 1.3874, test_f1: 0.6332
 epoch: 95, train_loss: 0.2822, test_loss: 1.6038, test_f1: 0.6136
 epoch: 96, train_loss: 0.2750, test_loss: 1.4082, test_f1: 0.6647
 epoch: 97, train_loss: 0.2908, test_loss: 1.3340, test_f1: 0.6526
 epoch: 98, train_loss: 0.2838, test_loss: 1.3175, test_f1: 0.6971
 epoch: 99, train_loss: 0.2656, test_loss: 1.3669, test_f1: 0.6653
##################ITERATION #9 ****************************************
 epoch: 0, train_loss: 1.3184, test_loss: 1.1172, test_f1: 0.3919
 epoch: 1, train_loss: 1.0176, test_loss: 0.9976, test_f1: 0.4642
 epoch: 2, train_loss: 0.9718, test_loss: 0.9791, test_f1: 0.4820
 epoch: 3, train_loss: 0.9601, test_loss: 0.9943, test_f1: 0.4673
 epoch: 4, train_loss: 0.9087, test_loss: 0.9579, test_f1: 0.4796
 epoch: 5, train_loss: 0.8729, test_loss: 0.9950, test_f1: 0.5047
 epoch: 6, train_loss: 0.8659, test_loss: 0.9064, test_f1: 0.5485
 epoch: 7, train_loss: 0.8411, test_loss: 0.8978, test_f1: 0.5555
 epoch: 8, train_loss: 0.8226, test_loss: 0.8846, test_f1: 0.5635
 epoch: 9, train_loss: 0.8234, test_loss: 0.8959, test_f1: 0.5997
 epoch: 10, train_loss: 0.8003, test_loss: 0.8730, test_f1: 0.5525
 epoch: 11, train_loss: 0.7793, test_loss: 0.8416, test_f1: 0.5663
 epoch: 12, train_loss: 0.7787, test_loss: 0.8913, test_f1: 0.6014
 epoch: 13, train_loss: 0.7641, test_loss: 0.9663, test_f1: 0.5576
 epoch: 14, train_loss: 0.7535, test_loss: 0.9101, test_f1: 0.5735
 epoch: 15, train_loss: 0.7375, test_loss: 0.9517, test_f1: 0.5281
 epoch: 16, train_loss: 0.7403, test_loss: 0.8356, test_f1: 0.5884
 epoch: 17, train_loss: 0.7259, test_loss: 0.8435, test_f1: 0.5727
 epoch: 18, train_loss: 0.7202, test_loss: 0.8591, test_f1: 0.5946
 epoch: 19, train_loss: 0.7113, test_loss: 0.8826, test_f1: 0.5727
 epoch: 20, train_loss: 0.6927, test_loss: 0.8706, test_f1: 0.6139
 epoch: 21, train_loss: 0.6893, test_loss: 0.8858, test_f1: 0.5504
 epoch: 22, train_loss: 0.6959, test_loss: 0.9058, test_f1: 0.5903
 epoch: 23, train_loss: 0.6943, test_loss: 0.8640, test_f1: 0.6026
 epoch: 24, train_loss: 0.6854, test_loss: 0.8719, test_f1: 0.5772
 epoch: 25, train_loss: 0.6678, test_loss: 0.7743, test_f1: 0.6278
 epoch: 26, train_loss: 0.6570, test_loss: 0.8630, test_f1: 0.5949
 epoch: 27, train_loss: 0.6361, test_loss: 0.8933, test_f1: 0.5975
 epoch: 28, train_loss: 0.6380, test_loss: 0.8649, test_f1: 0.5817
 epoch: 29, train_loss: 0.6380, test_loss: 0.8173, test_f1: 0.6038
 epoch: 30, train_loss: 0.6290, test_loss: 0.7791, test_f1: 0.6374
 epoch: 31, train_loss: 0.6254, test_loss: 0.8835, test_f1: 0.6043
 epoch: 32, train_loss: 0.6170, test_loss: 0.9120, test_f1: 0.6109
 epoch: 33, train_loss: 0.6196, test_loss: 0.7156, test_f1: 0.6356
 epoch: 34, train_loss: 0.6060, test_loss: 0.7937, test_f1: 0.6241
 epoch: 35, train_loss: 0.6022, test_loss: 0.7689, test_f1: 0.6428
 epoch: 36, train_loss: 0.5849, test_loss: 0.8368, test_f1: 0.6182
 epoch: 37, train_loss: 0.5788, test_loss: 0.8068, test_f1: 0.6553
 epoch: 38, train_loss: 0.5723, test_loss: 0.8522, test_f1: 0.6148
 epoch: 39, train_loss: 0.5681, test_loss: 0.8235, test_f1: 0.6234
 epoch: 40, train_loss: 0.5629, test_loss: 0.7958, test_f1: 0.6511
 epoch: 41, train_loss: 0.5496, test_loss: 0.8015, test_f1: 0.6514
 epoch: 42, train_loss: 0.5410, test_loss: 0.8468, test_f1: 0.6364
 epoch: 43, train_loss: 0.5815, test_loss: 0.8756, test_f1: 0.6420
 epoch: 44, train_loss: 0.5520, test_loss: 0.8024, test_f1: 0.6459
 epoch: 45, train_loss: 0.5318, test_loss: 0.7691, test_f1: 0.6717
 epoch: 46, train_loss: 0.5364, test_loss: 0.8879, test_f1: 0.6400
 epoch: 47, train_loss: 0.5298, test_loss: 0.8126, test_f1: 0.6547
 epoch: 48, train_loss: 0.5083, test_loss: 0.8680, test_f1: 0.6466
 epoch: 49, train_loss: 0.5237, test_loss: 0.8037, test_f1: 0.6531
 epoch: 50, train_loss: 0.5102, test_loss: 0.8892, test_f1: 0.6084
 epoch: 51, train_loss: 0.4692, test_loss: 0.7961, test_f1: 0.6659
 epoch: 52, train_loss: 0.4586, test_loss: 0.8178, test_f1: 0.6592
 epoch: 53, train_loss: 0.4319, test_loss: 0.8462, test_f1: 0.6689
 epoch: 54, train_loss: 0.4294, test_loss: 0.8228, test_f1: 0.6587
 epoch: 55, train_loss: 0.4232, test_loss: 0.8991, test_f1: 0.6533
 epoch: 56, train_loss: 0.4274, test_loss: 0.8345, test_f1: 0.6657
 epoch: 57, train_loss: 0.4193, test_loss: 0.8196, test_f1: 0.6614
 epoch: 58, train_loss: 0.4290, test_loss: 0.9342, test_f1: 0.6822
 epoch: 59, train_loss: 0.4090, test_loss: 0.9061, test_f1: 0.6720
 epoch: 60, train_loss: 0.4187, test_loss: 0.9156, test_f1: 0.6630
 epoch: 61, train_loss: 0.3994, test_loss: 0.8273, test_f1: 0.6665
 epoch: 62, train_loss: 0.4009, test_loss: 0.8102, test_f1: 0.6939
 epoch: 63, train_loss: 0.3927, test_loss: 0.8660, test_f1: 0.6667
 epoch: 64, train_loss: 0.4014, test_loss: 0.8378, test_f1: 0.6735
 epoch: 65, train_loss: 0.3833, test_loss: 0.8967, test_f1: 0.6772
 epoch: 66, train_loss: 0.3948, test_loss: 0.8981, test_f1: 0.6810
 epoch: 67, train_loss: 0.3664, test_loss: 0.9370, test_f1: 0.6805
 epoch: 68, train_loss: 0.3906, test_loss: 0.9923, test_f1: 0.6559
 epoch: 69, train_loss: 0.3854, test_loss: 0.8554, test_f1: 0.6896
 epoch: 70, train_loss: 0.3703, test_loss: 0.9495, test_f1: 0.6775
 epoch: 71, train_loss: 0.3848, test_loss: 0.9312, test_f1: 0.6579
 epoch: 72, train_loss: 0.3700, test_loss: 0.8879, test_f1: 0.6626
 epoch: 73, train_loss: 0.4138, test_loss: 1.0012, test_f1: 0.6519
 epoch: 74, train_loss: 0.3626, test_loss: 0.9896, test_f1: 0.6630
 epoch: 75, train_loss: 0.3674, test_loss: 0.9830, test_f1: 0.6684
 epoch: 76, train_loss: 0.3585, test_loss: 0.9176, test_f1: 0.6843
 epoch: 77, train_loss: 0.3559, test_loss: 0.9280, test_f1: 0.6686
 epoch: 78, train_loss: 0.3640, test_loss: 0.9936, test_f1: 0.6649
 epoch: 79, train_loss: 0.3578, test_loss: 1.0140, test_f1: 0.6575
 epoch: 80, train_loss: 0.3502, test_loss: 1.0369, test_f1: 0.6802
 epoch: 81, train_loss: 0.3315, test_loss: 1.0228, test_f1: 0.6736
 epoch: 82, train_loss: 0.3567, test_loss: 1.1031, test_f1: 0.6602
 epoch: 83, train_loss: 0.3628, test_loss: 1.0660, test_f1: 0.6658
 epoch: 84, train_loss: 0.3384, test_loss: 1.1110, test_f1: 0.6577
 epoch: 85, train_loss: 0.3459, test_loss: 0.9483, test_f1: 0.6693
 epoch: 86, train_loss: 0.3483, test_loss: 1.0321, test_f1: 0.6565
 epoch: 87, train_loss: 0.3351, test_loss: 1.1517, test_f1: 0.6507
 epoch: 88, train_loss: 0.3279, test_loss: 0.9859, test_f1: 0.6822
 epoch: 89, train_loss: 0.3451, test_loss: 0.9997, test_f1: 0.6702
 epoch: 90, train_loss: 0.3424, test_loss: 1.0762, test_f1: 0.6608
 epoch: 91, train_loss: 0.3190, test_loss: 0.9974, test_f1: 0.6837
 epoch: 92, train_loss: 0.3194, test_loss: 1.1196, test_f1: 0.6804
 epoch: 93, train_loss: 0.3145, test_loss: 1.0506, test_f1: 0.6759
 epoch: 94, train_loss: 0.3137, test_loss: 0.9986, test_f1: 0.6848
 epoch: 95, train_loss: 0.3091, test_loss: 1.0491, test_f1: 0.6749
 epoch: 96, train_loss: 0.2890, test_loss: 1.0840, test_f1: 0.6937
 epoch: 97, train_loss: 0.3088, test_loss: 1.0470, test_f1: 0.6803
 epoch: 98, train_loss: 0.2923, test_loss: 1.2207, test_f1: 0.6564
 epoch: 99, train_loss: 0.3152, test_loss: 1.1375, test_f1: 0.6691

Training completed in 642.51 seconds
Best F1: 0.7056 at epoch 73
Mean F1 across iterations: 0.6880  0.0092
========================FINAL RESULTS================================
FEGIN weighted F1: 0.7056  0.0092
python main.py --data ltspice_examples --representation component_pin --model FEGIN --layers 3 --hiddens 64 --batch_size 64 --lr 0.001 --emb_size 250 --epochs 100 --save_appendix component_pin_L3_H64_BS64_LR0.001_E250 --no_val
-----



STDERR:
  File "main.py", line 370, in <module>
    main()
  File "main.py", line 254, in main
    dataset = dataset_class(
  File "/home/philip/projects/ltspice_examples_code_repo/Circuit-Completion-Using-GNNs/component_classification_with_link_prediction_head/evaluation/FEGIN/kernel/circuit_datasets.py", line 15, in __init__
    self.data, self.slices = torch.load(self.processed_paths[0])
  File "/home/philip/.local/lib/python3.8/site-packages/torch/serialization.py", line 1040, in load
    warnings.warn(
  File "/usr/lib/python3.8/warnings.py", line 109, in _showwarnmsg
    sw(msg.message, msg.category, msg.filename, msg.lineno,
  File "main.py", line 47, in warn_with_traceback
    traceback.print_stack(file=log)
/home/philip/projects/ltspice_examples_code_repo/Circuit-Completion-Using-GNNs/component_classification_with_link_prediction_head/evaluation/FEGIN/kernel/circuit_datasets.py:15: FutureWarning: You are using `torch.load` with `weights_only=False` (the current default value), which uses the default pickle module implicitly. It is possible to construct malicious pickle data which will execute arbitrary code during unpickling (See https://github.com/pytorch/pytorch/blob/main/SECURITY.md#untrusted-models for more details). In a future release, the default value for `weights_only` will be flipped to `True`. This limits the functions that could be executed during unpickling. Arbitrary objects will no longer be allowed to be loaded via this mode unless they are explicitly allowlisted by the user via `torch.serialization.add_safe_globals`. We recommend you start setting `weights_only=True` for any use case where you don't have full control of the loaded file. Please open an issue on GitHub for any issues related to this experimental feature.
  self.data, self.slices = torch.load(self.processed_paths[0])
