STDOUT:
Results will be saved in /home/philip/projects/ltspice_examples_code_repo/Circuit-Completion-Using-GNNs/component_classification_with_link_prediction_head/evaluation/FEGIN/results/model_FEGIN_dataset_ltspice_examples
Command line input: python main.py --data ltspice_examples --representation component_pin --model FEGIN --layers 5 --hiddens 64 --batch_size 128 --lr 0.001 --emb_size 250 --epochs 100 --save_appendix component_pin_L5_H64_BS128_LR0.001_E250 --no_val
 is saved.
-----
ltspice_examples - FEGIN
Using 5 layers, 64 hidden units, h = 2
Loading component_pin representation dataset
ENTERED
Training FEGIN on component_pin representation
Train: 3560, Test: 848
##################ITERATION #0 ****************************************
 epoch: 0, train_loss: 1.2979, test_loss: 1.2850, test_f1: 0.2557
 epoch: 1, train_loss: 1.1570, test_loss: 1.2307, test_f1: 0.2996
 epoch: 2, train_loss: 1.0578, test_loss: 1.0857, test_f1: 0.4138
 epoch: 3, train_loss: 1.0065, test_loss: 1.0657, test_f1: 0.4767
 epoch: 4, train_loss: 0.9731, test_loss: 0.9675, test_f1: 0.5011
 epoch: 5, train_loss: 0.9411, test_loss: 1.0027, test_f1: 0.5241
 epoch: 6, train_loss: 0.9211, test_loss: 0.9478, test_f1: 0.5100
 epoch: 7, train_loss: 0.8878, test_loss: 0.9618, test_f1: 0.5136
 epoch: 8, train_loss: 0.8583, test_loss: 1.0107, test_f1: 0.4653
 epoch: 9, train_loss: 0.8524, test_loss: 0.9920, test_f1: 0.5105
 epoch: 10, train_loss: 0.8300, test_loss: 0.9393, test_f1: 0.5131
 epoch: 11, train_loss: 0.8109, test_loss: 0.9708, test_f1: 0.5308
 epoch: 12, train_loss: 0.7880, test_loss: 0.9443, test_f1: 0.5607
 epoch: 13, train_loss: 0.7785, test_loss: 0.8817, test_f1: 0.5637
 epoch: 14, train_loss: 0.7651, test_loss: 1.0345, test_f1: 0.5478
 epoch: 15, train_loss: 0.7592, test_loss: 0.9109, test_f1: 0.5879
 epoch: 16, train_loss: 0.7297, test_loss: 0.8667, test_f1: 0.5953
 epoch: 17, train_loss: 0.7384, test_loss: 1.0841, test_f1: 0.5668
 epoch: 18, train_loss: 0.7329, test_loss: 0.8251, test_f1: 0.5745
 epoch: 19, train_loss: 0.7240, test_loss: 0.9168, test_f1: 0.5945
 epoch: 20, train_loss: 0.6958, test_loss: 0.9831, test_f1: 0.5272
 epoch: 21, train_loss: 0.7050, test_loss: 0.8857, test_f1: 0.5690
 epoch: 22, train_loss: 0.6689, test_loss: 1.0425, test_f1: 0.5225
 epoch: 23, train_loss: 0.6608, test_loss: 0.9829, test_f1: 0.5963
 epoch: 24, train_loss: 0.6580, test_loss: 1.0025, test_f1: 0.5897
 epoch: 25, train_loss: 0.6339, test_loss: 0.8824, test_f1: 0.5897
 epoch: 26, train_loss: 0.6249, test_loss: 1.0159, test_f1: 0.5484
 epoch: 27, train_loss: 0.6164, test_loss: 0.9072, test_f1: 0.6109
 epoch: 28, train_loss: 0.6274, test_loss: 0.9529, test_f1: 0.5847
 epoch: 29, train_loss: 0.6222, test_loss: 1.0263, test_f1: 0.5768
 epoch: 30, train_loss: 0.6019, test_loss: 0.8673, test_f1: 0.6144
 epoch: 31, train_loss: 0.6032, test_loss: 0.8117, test_f1: 0.6433
 epoch: 32, train_loss: 0.6151, test_loss: 1.1027, test_f1: 0.5303
 epoch: 33, train_loss: 0.5894, test_loss: 0.8968, test_f1: 0.6189
 epoch: 34, train_loss: 0.5852, test_loss: 0.9426, test_f1: 0.6083
 epoch: 35, train_loss: 0.5630, test_loss: 0.8995, test_f1: 0.6006
 epoch: 36, train_loss: 0.5742, test_loss: 0.8270, test_f1: 0.6096
 epoch: 37, train_loss: 0.5522, test_loss: 1.0017, test_f1: 0.5602
 epoch: 38, train_loss: 0.5702, test_loss: 0.9385, test_f1: 0.6328
 epoch: 39, train_loss: 0.5381, test_loss: 0.9562, test_f1: 0.6226
 epoch: 40, train_loss: 0.5152, test_loss: 1.0263, test_f1: 0.6028
 epoch: 41, train_loss: 0.5094, test_loss: 0.9639, test_f1: 0.5934
 epoch: 42, train_loss: 0.5190, test_loss: 0.9880, test_f1: 0.6428
 epoch: 43, train_loss: 0.5202, test_loss: 0.9710, test_f1: 0.6390
 epoch: 44, train_loss: 0.4965, test_loss: 1.1149, test_f1: 0.5837
 epoch: 45, train_loss: 0.4914, test_loss: 0.9422, test_f1: 0.6234
 epoch: 46, train_loss: 0.4794, test_loss: 1.1842, test_f1: 0.5956
 epoch: 47, train_loss: 0.5000, test_loss: 1.0185, test_f1: 0.6016
 epoch: 48, train_loss: 0.4750, test_loss: 0.9025, test_f1: 0.6165
 epoch: 49, train_loss: 0.4809, test_loss: 1.0297, test_f1: 0.6167
 epoch: 50, train_loss: 0.4654, test_loss: 1.1263, test_f1: 0.5944
 epoch: 51, train_loss: 0.4224, test_loss: 1.0066, test_f1: 0.6382
 epoch: 52, train_loss: 0.4107, test_loss: 0.9775, test_f1: 0.6325
 epoch: 53, train_loss: 0.3896, test_loss: 0.9841, test_f1: 0.6531
 epoch: 54, train_loss: 0.4020, test_loss: 1.1473, test_f1: 0.6513
 epoch: 55, train_loss: 0.3865, test_loss: 1.0538, test_f1: 0.6409
 epoch: 56, train_loss: 0.3637, test_loss: 1.0653, test_f1: 0.6518
 epoch: 57, train_loss: 0.3741, test_loss: 1.0646, test_f1: 0.6496
 epoch: 58, train_loss: 0.3753, test_loss: 1.1498, test_f1: 0.6590
 epoch: 59, train_loss: 0.3709, test_loss: 1.1876, test_f1: 0.6129
 epoch: 60, train_loss: 0.3623, test_loss: 1.1365, test_f1: 0.6186
 epoch: 61, train_loss: 0.3503, test_loss: 1.2086, test_f1: 0.6338
 epoch: 62, train_loss: 0.3479, test_loss: 1.1147, test_f1: 0.6567
 epoch: 63, train_loss: 0.3464, test_loss: 1.2291, test_f1: 0.6419
 epoch: 64, train_loss: 0.3481, test_loss: 1.1888, test_f1: 0.6471
 epoch: 65, train_loss: 0.3344, test_loss: 1.2301, test_f1: 0.6311
 epoch: 66, train_loss: 0.3473, test_loss: 1.3474, test_f1: 0.6308
 epoch: 67, train_loss: 0.3232, test_loss: 1.2955, test_f1: 0.6434
 epoch: 68, train_loss: 0.3421, test_loss: 1.2376, test_f1: 0.6558
 epoch: 69, train_loss: 0.3200, test_loss: 1.3614, test_f1: 0.6577
 epoch: 70, train_loss: 0.3166, test_loss: 1.3166, test_f1: 0.6613
 epoch: 71, train_loss: 0.3131, test_loss: 1.3256, test_f1: 0.6495
 epoch: 72, train_loss: 0.3190, test_loss: 1.1720, test_f1: 0.6546
 epoch: 73, train_loss: 0.3075, test_loss: 1.4072, test_f1: 0.6156
 epoch: 74, train_loss: 0.3018, test_loss: 1.2568, test_f1: 0.6256
 epoch: 75, train_loss: 0.3123, test_loss: 1.4128, test_f1: 0.6495
 epoch: 76, train_loss: 0.3093, test_loss: 1.3657, test_f1: 0.6652
 epoch: 77, train_loss: 0.3053, test_loss: 1.3938, test_f1: 0.6458
 epoch: 78, train_loss: 0.2779, test_loss: 1.4585, test_f1: 0.6141
 epoch: 79, train_loss: 0.2713, test_loss: 1.4389, test_f1: 0.6573
 epoch: 80, train_loss: 0.2765, test_loss: 1.4432, test_f1: 0.6637
 epoch: 81, train_loss: 0.2672, test_loss: 1.4232, test_f1: 0.6500
 epoch: 82, train_loss: 0.2878, test_loss: 1.3770, test_f1: 0.6504
 epoch: 83, train_loss: 0.2829, test_loss: 1.4436, test_f1: 0.6589
 epoch: 84, train_loss: 0.2698, test_loss: 1.4687, test_f1: 0.6367
 epoch: 85, train_loss: 0.2622, test_loss: 1.4028, test_f1: 0.6686
 epoch: 86, train_loss: 0.2740, test_loss: 1.6099, test_f1: 0.6054
 epoch: 87, train_loss: 0.2659, test_loss: 1.5177, test_f1: 0.6377
 epoch: 88, train_loss: 0.2692, test_loss: 1.5122, test_f1: 0.6647
 epoch: 89, train_loss: 0.2628, test_loss: 1.4177, test_f1: 0.6422
 epoch: 90, train_loss: 0.2471, test_loss: 1.5748, test_f1: 0.6451
 epoch: 91, train_loss: 0.2539, test_loss: 1.4510, test_f1: 0.6803
 epoch: 92, train_loss: 0.2522, test_loss: 1.5742, test_f1: 0.6580
 epoch: 93, train_loss: 0.2544, test_loss: 1.5718, test_f1: 0.6438
 epoch: 94, train_loss: 0.2592, test_loss: 1.6634, test_f1: 0.6201
 epoch: 95, train_loss: 0.2590, test_loss: 1.4699, test_f1: 0.6622
 epoch: 96, train_loss: 0.2552, test_loss: 1.3948, test_f1: 0.6404
 epoch: 97, train_loss: 0.2317, test_loss: 1.6402, test_f1: 0.6513
 epoch: 98, train_loss: 0.2270, test_loss: 1.7561, test_f1: 0.6098
 epoch: 99, train_loss: 0.2283, test_loss: 1.7118, test_f1: 0.6440
##################ITERATION #1 ****************************************
 epoch: 0, train_loss: 1.1964, test_loss: 1.2217, test_f1: 0.3371
 epoch: 1, train_loss: 1.0331, test_loss: 1.0321, test_f1: 0.4604
 epoch: 2, train_loss: 0.9670, test_loss: 0.9731, test_f1: 0.5001
 epoch: 3, train_loss: 0.9264, test_loss: 0.9529, test_f1: 0.5234
 epoch: 4, train_loss: 0.9013, test_loss: 0.8883, test_f1: 0.5575
 epoch: 5, train_loss: 0.8635, test_loss: 0.9651, test_f1: 0.5231
 epoch: 6, train_loss: 0.8588, test_loss: 0.9691, test_f1: 0.4972
 epoch: 7, train_loss: 0.8322, test_loss: 0.9133, test_f1: 0.5532
 epoch: 8, train_loss: 0.8265, test_loss: 0.8851, test_f1: 0.5644
 epoch: 9, train_loss: 0.7996, test_loss: 0.9151, test_f1: 0.5430
 epoch: 10, train_loss: 0.7834, test_loss: 1.0787, test_f1: 0.5111
 epoch: 11, train_loss: 0.7513, test_loss: 0.8927, test_f1: 0.5967
 epoch: 12, train_loss: 0.7480, test_loss: 0.8933, test_f1: 0.6003
 epoch: 13, train_loss: 0.7582, test_loss: 0.9333, test_f1: 0.5543
 epoch: 14, train_loss: 0.7401, test_loss: 0.9992, test_f1: 0.5545
 epoch: 15, train_loss: 0.7239, test_loss: 0.9023, test_f1: 0.5808
 epoch: 16, train_loss: 0.6937, test_loss: 0.9317, test_f1: 0.6077
 epoch: 17, train_loss: 0.6929, test_loss: 0.8752, test_f1: 0.6164
 epoch: 18, train_loss: 0.6808, test_loss: 0.9303, test_f1: 0.5838
 epoch: 19, train_loss: 0.6802, test_loss: 0.8694, test_f1: 0.5843
 epoch: 20, train_loss: 0.6559, test_loss: 0.9195, test_f1: 0.6051
 epoch: 21, train_loss: 0.6772, test_loss: 0.9145, test_f1: 0.5802
 epoch: 22, train_loss: 0.6552, test_loss: 1.0634, test_f1: 0.5253
 epoch: 23, train_loss: 0.6606, test_loss: 0.9610, test_f1: 0.5996
 epoch: 24, train_loss: 0.6486, test_loss: 1.0563, test_f1: 0.5693
 epoch: 25, train_loss: 0.6246, test_loss: 0.8998, test_f1: 0.6006
 epoch: 26, train_loss: 0.6122, test_loss: 1.0899, test_f1: 0.5527
 epoch: 27, train_loss: 0.6140, test_loss: 0.8684, test_f1: 0.6547
 epoch: 28, train_loss: 0.5943, test_loss: 0.7507, test_f1: 0.6199
 epoch: 29, train_loss: 0.5921, test_loss: 1.0616, test_f1: 0.5442
 epoch: 30, train_loss: 0.6118, test_loss: 0.8846, test_f1: 0.5912
 epoch: 31, train_loss: 0.6047, test_loss: 0.8296, test_f1: 0.6529
 epoch: 32, train_loss: 0.5870, test_loss: 1.0246, test_f1: 0.5761
 epoch: 33, train_loss: 0.5736, test_loss: 0.8655, test_f1: 0.5855
 epoch: 34, train_loss: 0.5620, test_loss: 0.9774, test_f1: 0.5765
 epoch: 35, train_loss: 0.5431, test_loss: 0.8641, test_f1: 0.6327
 epoch: 36, train_loss: 0.5539, test_loss: 0.9010, test_f1: 0.6180
 epoch: 37, train_loss: 0.5445, test_loss: 0.9563, test_f1: 0.6196
 epoch: 38, train_loss: 0.5199, test_loss: 0.8627, test_f1: 0.5994
 epoch: 39, train_loss: 0.5392, test_loss: 0.9023, test_f1: 0.6247
 epoch: 40, train_loss: 0.5343, test_loss: 0.9025, test_f1: 0.6184
 epoch: 41, train_loss: 0.5223, test_loss: 0.7630, test_f1: 0.6519
 epoch: 42, train_loss: 0.5074, test_loss: 1.1280, test_f1: 0.5720
 epoch: 43, train_loss: 0.5166, test_loss: 0.8700, test_f1: 0.5950
 epoch: 44, train_loss: 0.5167, test_loss: 1.0139, test_f1: 0.6205
 epoch: 45, train_loss: 0.5169, test_loss: 0.8116, test_f1: 0.6110
 epoch: 46, train_loss: 0.4965, test_loss: 1.2413, test_f1: 0.5354
 epoch: 47, train_loss: 0.4843, test_loss: 0.9072, test_f1: 0.5986
 epoch: 48, train_loss: 0.4736, test_loss: 0.9073, test_f1: 0.6411
 epoch: 49, train_loss: 0.4785, test_loss: 1.0667, test_f1: 0.5681
 epoch: 50, train_loss: 0.4590, test_loss: 1.0296, test_f1: 0.6295
 epoch: 51, train_loss: 0.4260, test_loss: 0.8692, test_f1: 0.6542
 epoch: 52, train_loss: 0.3975, test_loss: 0.8856, test_f1: 0.6817
 epoch: 53, train_loss: 0.3962, test_loss: 1.0059, test_f1: 0.6289
 epoch: 54, train_loss: 0.3984, test_loss: 0.9818, test_f1: 0.6262
 epoch: 55, train_loss: 0.3900, test_loss: 0.9550, test_f1: 0.6405
 epoch: 56, train_loss: 0.3876, test_loss: 0.9519, test_f1: 0.6723
 epoch: 57, train_loss: 0.3632, test_loss: 1.0543, test_f1: 0.6145
 epoch: 58, train_loss: 0.3449, test_loss: 0.9538, test_f1: 0.6801
 epoch: 59, train_loss: 0.3655, test_loss: 0.9939, test_f1: 0.6535
 epoch: 60, train_loss: 0.3751, test_loss: 1.0497, test_f1: 0.6376
 epoch: 61, train_loss: 0.3526, test_loss: 0.9621, test_f1: 0.6759
 epoch: 62, train_loss: 0.3418, test_loss: 1.1187, test_f1: 0.6457
 epoch: 63, train_loss: 0.3335, test_loss: 1.0837, test_f1: 0.6330
 epoch: 64, train_loss: 0.3497, test_loss: 1.1565, test_f1: 0.6626
 epoch: 65, train_loss: 0.3512, test_loss: 1.0758, test_f1: 0.6471
 epoch: 66, train_loss: 0.3332, test_loss: 1.1177, test_f1: 0.6724
 epoch: 67, train_loss: 0.3329, test_loss: 1.1328, test_f1: 0.6481
 epoch: 68, train_loss: 0.3136, test_loss: 0.9894, test_f1: 0.6632
 epoch: 69, train_loss: 0.3144, test_loss: 1.1857, test_f1: 0.6512
 epoch: 70, train_loss: 0.3251, test_loss: 1.2577, test_f1: 0.6101
 epoch: 71, train_loss: 0.3143, test_loss: 1.1457, test_f1: 0.6542
 epoch: 72, train_loss: 0.3202, test_loss: 1.2472, test_f1: 0.6364
 epoch: 73, train_loss: 0.3269, test_loss: 1.3998, test_f1: 0.5909
 epoch: 74, train_loss: 0.3194, test_loss: 1.1193, test_f1: 0.6280
 epoch: 75, train_loss: 0.3218, test_loss: 1.1055, test_f1: 0.6515
 epoch: 76, train_loss: 0.3037, test_loss: 1.1012, test_f1: 0.6371
 epoch: 77, train_loss: 0.2835, test_loss: 1.1891, test_f1: 0.6454
 epoch: 78, train_loss: 0.2861, test_loss: 1.0893, test_f1: 0.6507
 epoch: 79, train_loss: 0.3083, test_loss: 1.2059, test_f1: 0.6144
 epoch: 80, train_loss: 0.3020, test_loss: 1.1274, test_f1: 0.6660
 epoch: 81, train_loss: 0.2877, test_loss: 1.3292, test_f1: 0.6043
 epoch: 82, train_loss: 0.2939, test_loss: 1.5137, test_f1: 0.5894
 epoch: 83, train_loss: 0.2702, test_loss: 1.0839, test_f1: 0.6631
 epoch: 84, train_loss: 0.2752, test_loss: 1.4523, test_f1: 0.5910
 epoch: 85, train_loss: 0.2722, test_loss: 1.1974, test_f1: 0.6634
 epoch: 86, train_loss: 0.2629, test_loss: 1.3557, test_f1: 0.6367
 epoch: 87, train_loss: 0.2578, test_loss: 1.3007, test_f1: 0.6222
 epoch: 88, train_loss: 0.2658, test_loss: 1.1714, test_f1: 0.6477
 epoch: 89, train_loss: 0.3033, test_loss: 1.3783, test_f1: 0.6196
 epoch: 90, train_loss: 0.2539, test_loss: 1.2211, test_f1: 0.6552
 epoch: 91, train_loss: 0.2566, test_loss: 1.3213, test_f1: 0.6312
 epoch: 92, train_loss: 0.2372, test_loss: 1.5062, test_f1: 0.6325
 epoch: 93, train_loss: 0.2580, test_loss: 1.2343, test_f1: 0.6377
 epoch: 94, train_loss: 0.2450, test_loss: 1.3499, test_f1: 0.6553
 epoch: 95, train_loss: 0.2503, test_loss: 1.5181, test_f1: 0.6453
 epoch: 96, train_loss: 0.2591, test_loss: 1.3557, test_f1: 0.6416
 epoch: 97, train_loss: 0.2451, test_loss: 1.4092, test_f1: 0.6043
 epoch: 98, train_loss: 0.2576, test_loss: 1.4887, test_f1: 0.6204
 epoch: 99, train_loss: 0.2407, test_loss: 1.3166, test_f1: 0.6668
##################ITERATION #2 ****************************************
 epoch: 0, train_loss: 1.1603, test_loss: 1.2922, test_f1: 0.2260
 epoch: 1, train_loss: 0.9974, test_loss: 1.1892, test_f1: 0.3171
 epoch: 2, train_loss: 0.9352, test_loss: 0.9582, test_f1: 0.4680
 epoch: 3, train_loss: 0.8860, test_loss: 0.9369, test_f1: 0.5142
 epoch: 4, train_loss: 0.8745, test_loss: 1.0229, test_f1: 0.5431
 epoch: 5, train_loss: 0.8455, test_loss: 1.0970, test_f1: 0.5274
 epoch: 6, train_loss: 0.8197, test_loss: 0.9085, test_f1: 0.5402
 epoch: 7, train_loss: 0.7983, test_loss: 0.9518, test_f1: 0.5588
 epoch: 8, train_loss: 0.7781, test_loss: 0.9030, test_f1: 0.5646
 epoch: 9, train_loss: 0.7650, test_loss: 0.8319, test_f1: 0.6035
 epoch: 10, train_loss: 0.7546, test_loss: 0.9058, test_f1: 0.5550
 epoch: 11, train_loss: 0.7373, test_loss: 0.9086, test_f1: 0.5764
 epoch: 12, train_loss: 0.7227, test_loss: 0.8524, test_f1: 0.5731
 epoch: 13, train_loss: 0.6953, test_loss: 0.8919, test_f1: 0.5949
 epoch: 14, train_loss: 0.6969, test_loss: 0.9987, test_f1: 0.5667
 epoch: 15, train_loss: 0.6864, test_loss: 0.9394, test_f1: 0.5658
 epoch: 16, train_loss: 0.6904, test_loss: 0.9755, test_f1: 0.5633
 epoch: 17, train_loss: 0.6643, test_loss: 0.8772, test_f1: 0.5904
 epoch: 18, train_loss: 0.6507, test_loss: 0.8445, test_f1: 0.6195
 epoch: 19, train_loss: 0.6448, test_loss: 0.8744, test_f1: 0.5648
 epoch: 20, train_loss: 0.6344, test_loss: 0.9741, test_f1: 0.5968
 epoch: 21, train_loss: 0.6220, test_loss: 0.9946, test_f1: 0.6004
 epoch: 22, train_loss: 0.6191, test_loss: 0.8707, test_f1: 0.6202
 epoch: 23, train_loss: 0.5965, test_loss: 0.8966, test_f1: 0.6175
 epoch: 24, train_loss: 0.5930, test_loss: 0.8771, test_f1: 0.6208
 epoch: 25, train_loss: 0.5859, test_loss: 0.8660, test_f1: 0.6160
 epoch: 26, train_loss: 0.5947, test_loss: 0.9299, test_f1: 0.6216
 epoch: 27, train_loss: 0.5813, test_loss: 0.9331, test_f1: 0.6204
 epoch: 28, train_loss: 0.5613, test_loss: 1.0670, test_f1: 0.5738
 epoch: 29, train_loss: 0.5513, test_loss: 0.8963, test_f1: 0.6389
 epoch: 30, train_loss: 0.5555, test_loss: 0.9917, test_f1: 0.5777
 epoch: 31, train_loss: 0.5308, test_loss: 0.9942, test_f1: 0.6220
 epoch: 32, train_loss: 0.5335, test_loss: 0.9496, test_f1: 0.6307
 epoch: 33, train_loss: 0.5445, test_loss: 0.8911, test_f1: 0.6504
 epoch: 34, train_loss: 0.5377, test_loss: 1.0444, test_f1: 0.5915
 epoch: 35, train_loss: 0.5151, test_loss: 0.9163, test_f1: 0.6269
 epoch: 36, train_loss: 0.5077, test_loss: 1.0850, test_f1: 0.6121
 epoch: 37, train_loss: 0.5152, test_loss: 0.9332, test_f1: 0.6390
 epoch: 38, train_loss: 0.4931, test_loss: 1.0627, test_f1: 0.6083
 epoch: 39, train_loss: 0.4740, test_loss: 0.9532, test_f1: 0.6387
 epoch: 40, train_loss: 0.4736, test_loss: 0.9798, test_f1: 0.6400
 epoch: 41, train_loss: 0.4565, test_loss: 0.9446, test_f1: 0.6443
 epoch: 42, train_loss: 0.4545, test_loss: 1.0555, test_f1: 0.6271
 epoch: 43, train_loss: 0.4589, test_loss: 1.0742, test_f1: 0.6526
 epoch: 44, train_loss: 0.4448, test_loss: 0.9665, test_f1: 0.6681
 epoch: 45, train_loss: 0.4356, test_loss: 0.9454, test_f1: 0.6546
 epoch: 46, train_loss: 0.4113, test_loss: 1.0698, test_f1: 0.6515
 epoch: 47, train_loss: 0.4290, test_loss: 0.9662, test_f1: 0.6533
 epoch: 48, train_loss: 0.4132, test_loss: 1.2046, test_f1: 0.6125
 epoch: 49, train_loss: 0.4289, test_loss: 1.0789, test_f1: 0.6460
 epoch: 50, train_loss: 0.4108, test_loss: 1.0672, test_f1: 0.6660
 epoch: 51, train_loss: 0.3773, test_loss: 1.0225, test_f1: 0.6787
 epoch: 52, train_loss: 0.3372, test_loss: 1.0803, test_f1: 0.6783
 epoch: 53, train_loss: 0.3493, test_loss: 1.1215, test_f1: 0.6554
 epoch: 54, train_loss: 0.3218, test_loss: 1.0650, test_f1: 0.6579
 epoch: 55, train_loss: 0.3148, test_loss: 1.1637, test_f1: 0.6680
 epoch: 56, train_loss: 0.3115, test_loss: 1.1520, test_f1: 0.6490
 epoch: 57, train_loss: 0.3090, test_loss: 1.1734, test_f1: 0.6660
 epoch: 58, train_loss: 0.3040, test_loss: 1.0872, test_f1: 0.6596
 epoch: 59, train_loss: 0.3092, test_loss: 1.1826, test_f1: 0.6395
 epoch: 60, train_loss: 0.3022, test_loss: 1.1881, test_f1: 0.6747
 epoch: 61, train_loss: 0.2894, test_loss: 1.1991, test_f1: 0.6631
 epoch: 62, train_loss: 0.2924, test_loss: 1.2191, test_f1: 0.6796
 epoch: 63, train_loss: 0.2838, test_loss: 1.2745, test_f1: 0.6565
 epoch: 64, train_loss: 0.2769, test_loss: 1.2573, test_f1: 0.6552
 epoch: 65, train_loss: 0.2771, test_loss: 1.1748, test_f1: 0.6814
 epoch: 66, train_loss: 0.2712, test_loss: 1.2804, test_f1: 0.6703
 epoch: 67, train_loss: 0.2735, test_loss: 1.3181, test_f1: 0.6462
 epoch: 68, train_loss: 0.2587, test_loss: 1.3481, test_f1: 0.6744
 epoch: 69, train_loss: 0.2687, test_loss: 1.3303, test_f1: 0.6848
 epoch: 70, train_loss: 0.2771, test_loss: 1.2795, test_f1: 0.6898
 epoch: 71, train_loss: 0.2668, test_loss: 1.3876, test_f1: 0.6747
 epoch: 72, train_loss: 0.2585, test_loss: 1.3116, test_f1: 0.6737
 epoch: 73, train_loss: 0.2516, test_loss: 1.3267, test_f1: 0.6769
 epoch: 74, train_loss: 0.2415, test_loss: 1.4199, test_f1: 0.6555
 epoch: 75, train_loss: 0.2445, test_loss: 1.3286, test_f1: 0.6773
 epoch: 76, train_loss: 0.2469, test_loss: 1.3835, test_f1: 0.6705
 epoch: 77, train_loss: 0.2360, test_loss: 1.5089, test_f1: 0.6380
 epoch: 78, train_loss: 0.2384, test_loss: 1.5553, test_f1: 0.6562
 epoch: 79, train_loss: 0.2403, test_loss: 1.4836, test_f1: 0.6589
 epoch: 80, train_loss: 0.2366, test_loss: 1.3780, test_f1: 0.6502
 epoch: 81, train_loss: 0.2258, test_loss: 1.5492, test_f1: 0.6850
 epoch: 82, train_loss: 0.2268, test_loss: 1.4658, test_f1: 0.6601
 epoch: 83, train_loss: 0.2252, test_loss: 1.5469, test_f1: 0.6610
 epoch: 84, train_loss: 0.2243, test_loss: 1.4063, test_f1: 0.6785
 epoch: 85, train_loss: 0.2183, test_loss: 1.5272, test_f1: 0.6954
 epoch: 86, train_loss: 0.2129, test_loss: 1.5577, test_f1: 0.6450
 epoch: 87, train_loss: 0.2240, test_loss: 1.4872, test_f1: 0.6873
 epoch: 88, train_loss: 0.2128, test_loss: 1.5977, test_f1: 0.6915
 epoch: 89, train_loss: 0.2135, test_loss: 1.4665, test_f1: 0.6687
 epoch: 90, train_loss: 0.2106, test_loss: 1.4841, test_f1: 0.6950
 epoch: 91, train_loss: 0.2105, test_loss: 1.5347, test_f1: 0.6870
 epoch: 92, train_loss: 0.2202, test_loss: 1.5191, test_f1: 0.6635
 epoch: 93, train_loss: 0.2092, test_loss: 1.4805, test_f1: 0.6738
 epoch: 94, train_loss: 0.2263, test_loss: 1.5591, test_f1: 0.6447
 epoch: 95, train_loss: 0.2155, test_loss: 1.5645, test_f1: 0.6725
 epoch: 96, train_loss: 0.2076, test_loss: 1.4949, test_f1: 0.6829
 epoch: 97, train_loss: 0.2092, test_loss: 1.5453, test_f1: 0.6909
 epoch: 98, train_loss: 0.2072, test_loss: 1.5274, test_f1: 0.7077
 epoch: 99, train_loss: 0.2137, test_loss: 1.4969, test_f1: 0.6636
##################ITERATION #3 ****************************************
 epoch: 0, train_loss: 1.2186, test_loss: 1.2766, test_f1: 0.2443
 epoch: 1, train_loss: 1.0324, test_loss: 1.0013, test_f1: 0.4744
 epoch: 2, train_loss: 0.9816, test_loss: 0.9926, test_f1: 0.4925
 epoch: 3, train_loss: 0.9308, test_loss: 0.9215, test_f1: 0.5543
 epoch: 4, train_loss: 0.9103, test_loss: 0.9733, test_f1: 0.5132
 epoch: 5, train_loss: 0.8971, test_loss: 0.9035, test_f1: 0.5200
 epoch: 6, train_loss: 0.8561, test_loss: 0.9250, test_f1: 0.5374
 epoch: 7, train_loss: 0.8376, test_loss: 0.8994, test_f1: 0.5728
 epoch: 8, train_loss: 0.8160, test_loss: 1.0153, test_f1: 0.5316
 epoch: 9, train_loss: 0.8051, test_loss: 0.9179, test_f1: 0.5668
 epoch: 10, train_loss: 0.7946, test_loss: 0.8741, test_f1: 0.5964
 epoch: 11, train_loss: 0.7690, test_loss: 0.9948, test_f1: 0.5509
 epoch: 12, train_loss: 0.7532, test_loss: 0.8976, test_f1: 0.5636
 epoch: 13, train_loss: 0.7585, test_loss: 0.9234, test_f1: 0.5911
 epoch: 14, train_loss: 0.7361, test_loss: 0.9087, test_f1: 0.5858
 epoch: 15, train_loss: 0.7111, test_loss: 0.8974, test_f1: 0.5818
 epoch: 16, train_loss: 0.7200, test_loss: 0.8969, test_f1: 0.6142
 epoch: 17, train_loss: 0.7167, test_loss: 0.8928, test_f1: 0.5998
 epoch: 18, train_loss: 0.6982, test_loss: 0.8913, test_f1: 0.5952
 epoch: 19, train_loss: 0.6726, test_loss: 0.9316, test_f1: 0.5913
 epoch: 20, train_loss: 0.6663, test_loss: 0.9136, test_f1: 0.6056
 epoch: 21, train_loss: 0.6754, test_loss: 0.9355, test_f1: 0.6116
 epoch: 22, train_loss: 0.6553, test_loss: 0.8678, test_f1: 0.6452
 epoch: 23, train_loss: 0.6362, test_loss: 0.8762, test_f1: 0.6389
 epoch: 24, train_loss: 0.6506, test_loss: 0.9952, test_f1: 0.5691
 epoch: 25, train_loss: 0.6288, test_loss: 0.9062, test_f1: 0.6346
 epoch: 26, train_loss: 0.6155, test_loss: 0.8967, test_f1: 0.6376
 epoch: 27, train_loss: 0.6006, test_loss: 0.8992, test_f1: 0.6108
 epoch: 28, train_loss: 0.5933, test_loss: 0.9910, test_f1: 0.5957
 epoch: 29, train_loss: 0.6039, test_loss: 0.9329, test_f1: 0.6079
 epoch: 30, train_loss: 0.5680, test_loss: 0.8434, test_f1: 0.6573
 epoch: 31, train_loss: 0.5885, test_loss: 0.9470, test_f1: 0.6142
 epoch: 32, train_loss: 0.5737, test_loss: 0.9540, test_f1: 0.6245
 epoch: 33, train_loss: 0.5555, test_loss: 0.8638, test_f1: 0.6250
 epoch: 34, train_loss: 0.5505, test_loss: 0.8977, test_f1: 0.6118
 epoch: 35, train_loss: 0.5392, test_loss: 0.9291, test_f1: 0.6236
 epoch: 36, train_loss: 0.5231, test_loss: 1.0715, test_f1: 0.6138
 epoch: 37, train_loss: 0.5301, test_loss: 0.9034, test_f1: 0.6228
 epoch: 38, train_loss: 0.5096, test_loss: 0.9136, test_f1: 0.6256
 epoch: 39, train_loss: 0.5182, test_loss: 1.1035, test_f1: 0.6222
 epoch: 40, train_loss: 0.5431, test_loss: 1.0612, test_f1: 0.5977
 epoch: 41, train_loss: 0.5097, test_loss: 0.9293, test_f1: 0.6412
 epoch: 42, train_loss: 0.4990, test_loss: 0.9485, test_f1: 0.6277
 epoch: 43, train_loss: 0.4896, test_loss: 0.9431, test_f1: 0.6268
 epoch: 44, train_loss: 0.4833, test_loss: 1.0965, test_f1: 0.6355
 epoch: 45, train_loss: 0.4874, test_loss: 0.9927, test_f1: 0.6360
 epoch: 46, train_loss: 0.4587, test_loss: 1.0120, test_f1: 0.5984
 epoch: 47, train_loss: 0.4826, test_loss: 0.9050, test_f1: 0.6477
 epoch: 48, train_loss: 0.4678, test_loss: 1.0618, test_f1: 0.6332
 epoch: 49, train_loss: 0.4617, test_loss: 1.0903, test_f1: 0.6042
 epoch: 50, train_loss: 0.4405, test_loss: 1.0326, test_f1: 0.6202
 epoch: 51, train_loss: 0.4187, test_loss: 0.9973, test_f1: 0.6306
 epoch: 52, train_loss: 0.3919, test_loss: 1.0956, test_f1: 0.6378
 epoch: 53, train_loss: 0.3662, test_loss: 1.0467, test_f1: 0.6373
 epoch: 54, train_loss: 0.3702, test_loss: 1.1089, test_f1: 0.6301
 epoch: 55, train_loss: 0.3629, test_loss: 1.1163, test_f1: 0.6193
 epoch: 56, train_loss: 0.3626, test_loss: 1.0765, test_f1: 0.6578
 epoch: 57, train_loss: 0.3428, test_loss: 1.2480, test_f1: 0.6137
 epoch: 58, train_loss: 0.3606, test_loss: 1.1770, test_f1: 0.6654
 epoch: 59, train_loss: 0.3496, test_loss: 1.2020, test_f1: 0.6193
 epoch: 60, train_loss: 0.3340, test_loss: 1.1464, test_f1: 0.6325
 epoch: 61, train_loss: 0.3409, test_loss: 1.2270, test_f1: 0.6320
 epoch: 62, train_loss: 0.3375, test_loss: 1.1912, test_f1: 0.6441
 epoch: 63, train_loss: 0.3426, test_loss: 1.1723, test_f1: 0.6292
 epoch: 64, train_loss: 0.3340, test_loss: 1.1813, test_f1: 0.6261
 epoch: 65, train_loss: 0.3284, test_loss: 1.2352, test_f1: 0.6289
 epoch: 66, train_loss: 0.3288, test_loss: 1.1858, test_f1: 0.6333
 epoch: 67, train_loss: 0.3063, test_loss: 1.1732, test_f1: 0.6548
 epoch: 68, train_loss: 0.3121, test_loss: 1.2579, test_f1: 0.6290
 epoch: 69, train_loss: 0.3093, test_loss: 1.2594, test_f1: 0.6450
 epoch: 70, train_loss: 0.3099, test_loss: 1.3163, test_f1: 0.6256
 epoch: 71, train_loss: 0.3226, test_loss: 1.2996, test_f1: 0.6177
 epoch: 72, train_loss: 0.3072, test_loss: 1.4354, test_f1: 0.6189
 epoch: 73, train_loss: 0.2916, test_loss: 1.3047, test_f1: 0.6216
 epoch: 74, train_loss: 0.2812, test_loss: 1.2951, test_f1: 0.6200
 epoch: 75, train_loss: 0.2929, test_loss: 1.2788, test_f1: 0.6253
 epoch: 76, train_loss: 0.3109, test_loss: 1.3287, test_f1: 0.6392
 epoch: 77, train_loss: 0.2972, test_loss: 1.3004, test_f1: 0.6269
 epoch: 78, train_loss: 0.2917, test_loss: 1.4103, test_f1: 0.6320
 epoch: 79, train_loss: 0.2954, test_loss: 1.4755, test_f1: 0.6214
 epoch: 80, train_loss: 0.2713, test_loss: 1.3743, test_f1: 0.6277
 epoch: 81, train_loss: 0.2771, test_loss: 1.3749, test_f1: 0.6448
 epoch: 82, train_loss: 0.2788, test_loss: 1.3617, test_f1: 0.6505
 epoch: 83, train_loss: 0.2733, test_loss: 1.4138, test_f1: 0.6460
 epoch: 84, train_loss: 0.2794, test_loss: 1.3063, test_f1: 0.6491
 epoch: 85, train_loss: 0.2636, test_loss: 1.4832, test_f1: 0.6184
 epoch: 86, train_loss: 0.2545, test_loss: 1.4710, test_f1: 0.6438
 epoch: 87, train_loss: 0.2567, test_loss: 1.4651, test_f1: 0.6405
 epoch: 88, train_loss: 0.2635, test_loss: 1.4257, test_f1: 0.6477
 epoch: 89, train_loss: 0.2720, test_loss: 1.4932, test_f1: 0.6119
 epoch: 90, train_loss: 0.2704, test_loss: 1.3918, test_f1: 0.6388
 epoch: 91, train_loss: 0.2414, test_loss: 1.4383, test_f1: 0.6555
 epoch: 92, train_loss: 0.2394, test_loss: 1.4316, test_f1: 0.6172
 epoch: 93, train_loss: 0.2590, test_loss: 1.5646, test_f1: 0.6090
 epoch: 94, train_loss: 0.2462, test_loss: 1.4538, test_f1: 0.6391
 epoch: 95, train_loss: 0.2330, test_loss: 1.4499, test_f1: 0.6357
 epoch: 96, train_loss: 0.2227, test_loss: 1.4005, test_f1: 0.6490
 epoch: 97, train_loss: 0.2448, test_loss: 1.4845, test_f1: 0.6186
 epoch: 98, train_loss: 0.2397, test_loss: 1.6865, test_f1: 0.6261
 epoch: 99, train_loss: 0.2350, test_loss: 1.4266, test_f1: 0.6500
##################ITERATION #4 ****************************************
 epoch: 0, train_loss: 1.2713, test_loss: 1.3460, test_f1: 0.2262
 epoch: 1, train_loss: 1.0571, test_loss: 0.9928, test_f1: 0.4822
 epoch: 2, train_loss: 0.9848, test_loss: 0.9829, test_f1: 0.4735
 epoch: 3, train_loss: 0.9489, test_loss: 0.9458, test_f1: 0.5109
 epoch: 4, train_loss: 0.8935, test_loss: 0.9294, test_f1: 0.5059
 epoch: 5, train_loss: 0.8649, test_loss: 0.8797, test_f1: 0.5460
 epoch: 6, train_loss: 0.8413, test_loss: 0.8348, test_f1: 0.5422
 epoch: 7, train_loss: 0.8263, test_loss: 0.8613, test_f1: 0.5668
 epoch: 8, train_loss: 0.8087, test_loss: 0.8758, test_f1: 0.5442
 epoch: 9, train_loss: 0.8080, test_loss: 0.8730, test_f1: 0.5425
 epoch: 10, train_loss: 0.7733, test_loss: 0.8672, test_f1: 0.5767
 epoch: 11, train_loss: 0.7624, test_loss: 0.8074, test_f1: 0.6080
 epoch: 12, train_loss: 0.7383, test_loss: 0.8091, test_f1: 0.5900
 epoch: 13, train_loss: 0.7339, test_loss: 0.9122, test_f1: 0.5636
 epoch: 14, train_loss: 0.7316, test_loss: 0.8208, test_f1: 0.6092
 epoch: 15, train_loss: 0.7178, test_loss: 0.7943, test_f1: 0.5967
 epoch: 16, train_loss: 0.6976, test_loss: 0.8435, test_f1: 0.5948
 epoch: 17, train_loss: 0.6739, test_loss: 0.8012, test_f1: 0.5844
 epoch: 18, train_loss: 0.6800, test_loss: 0.8321, test_f1: 0.6288
 epoch: 19, train_loss: 0.6746, test_loss: 0.8097, test_f1: 0.6439
 epoch: 20, train_loss: 0.6572, test_loss: 0.7930, test_f1: 0.6417
 epoch: 21, train_loss: 0.6496, test_loss: 0.8307, test_f1: 0.6229
 epoch: 22, train_loss: 0.6497, test_loss: 0.7916, test_f1: 0.6181
 epoch: 23, train_loss: 0.6172, test_loss: 0.8080, test_f1: 0.6164
 epoch: 24, train_loss: 0.6064, test_loss: 0.8345, test_f1: 0.5947
 epoch: 25, train_loss: 0.6104, test_loss: 0.8077, test_f1: 0.6447
 epoch: 26, train_loss: 0.6059, test_loss: 0.8120, test_f1: 0.6447
 epoch: 27, train_loss: 0.5964, test_loss: 0.7679, test_f1: 0.6409
 epoch: 28, train_loss: 0.5743, test_loss: 0.8110, test_f1: 0.6488
 epoch: 29, train_loss: 0.5592, test_loss: 0.8709, test_f1: 0.6066
 epoch: 30, train_loss: 0.5566, test_loss: 0.7917, test_f1: 0.6497
 epoch: 31, train_loss: 0.5589, test_loss: 0.7754, test_f1: 0.6527
 epoch: 32, train_loss: 0.5400, test_loss: 0.7906, test_f1: 0.6500
 epoch: 33, train_loss: 0.5231, test_loss: 0.8195, test_f1: 0.6266
 epoch: 34, train_loss: 0.5272, test_loss: 0.8024, test_f1: 0.6398
 epoch: 35, train_loss: 0.5220, test_loss: 0.7822, test_f1: 0.6618
 epoch: 36, train_loss: 0.5130, test_loss: 0.8666, test_f1: 0.6189
 epoch: 37, train_loss: 0.5010, test_loss: 0.8301, test_f1: 0.6319
 epoch: 38, train_loss: 0.4899, test_loss: 0.7955, test_f1: 0.6855
 epoch: 39, train_loss: 0.4886, test_loss: 0.8449, test_f1: 0.6840
 epoch: 40, train_loss: 0.4651, test_loss: 0.7610, test_f1: 0.6904
 epoch: 41, train_loss: 0.4896, test_loss: 0.7739, test_f1: 0.6910
 epoch: 42, train_loss: 0.4597, test_loss: 0.8482, test_f1: 0.6665
 epoch: 43, train_loss: 0.4367, test_loss: 0.9009, test_f1: 0.6400
 epoch: 44, train_loss: 0.4551, test_loss: 0.8757, test_f1: 0.6575
 epoch: 45, train_loss: 0.4459, test_loss: 0.9271, test_f1: 0.6577
 epoch: 46, train_loss: 0.4573, test_loss: 0.8774, test_f1: 0.6722
 epoch: 47, train_loss: 0.4294, test_loss: 0.9476, test_f1: 0.6776
 epoch: 48, train_loss: 0.4335, test_loss: 0.8814, test_f1: 0.6613
 epoch: 49, train_loss: 0.4234, test_loss: 0.8278, test_f1: 0.6810
 epoch: 50, train_loss: 0.3973, test_loss: 0.8326, test_f1: 0.6994
 epoch: 51, train_loss: 0.3796, test_loss: 0.8388, test_f1: 0.6836
 epoch: 52, train_loss: 0.3548, test_loss: 0.9012, test_f1: 0.6867
 epoch: 53, train_loss: 0.3413, test_loss: 0.8606, test_f1: 0.6897
 epoch: 54, train_loss: 0.3244, test_loss: 0.9978, test_f1: 0.6711
 epoch: 55, train_loss: 0.3058, test_loss: 1.0432, test_f1: 0.6830
 epoch: 56, train_loss: 0.3234, test_loss: 0.8738, test_f1: 0.6962
 epoch: 57, train_loss: 0.3052, test_loss: 0.9278, test_f1: 0.7015
 epoch: 58, train_loss: 0.2955, test_loss: 0.9717, test_f1: 0.6934
 epoch: 59, train_loss: 0.3115, test_loss: 0.9789, test_f1: 0.6676
 epoch: 60, train_loss: 0.3117, test_loss: 0.9590, test_f1: 0.6880
 epoch: 61, train_loss: 0.2879, test_loss: 1.0299, test_f1: 0.6824
 epoch: 62, train_loss: 0.2964, test_loss: 1.0388, test_f1: 0.6668
 epoch: 63, train_loss: 0.2920, test_loss: 1.0534, test_f1: 0.6850
 epoch: 64, train_loss: 0.2918, test_loss: 1.0121, test_f1: 0.6870
 epoch: 65, train_loss: 0.2945, test_loss: 1.0740, test_f1: 0.6819
 epoch: 66, train_loss: 0.2890, test_loss: 1.0105, test_f1: 0.6791
 epoch: 67, train_loss: 0.2812, test_loss: 1.1275, test_f1: 0.6854
 epoch: 68, train_loss: 0.2879, test_loss: 1.0173, test_f1: 0.6840
 epoch: 69, train_loss: 0.2871, test_loss: 1.0702, test_f1: 0.6607
 epoch: 70, train_loss: 0.2687, test_loss: 1.1406, test_f1: 0.6867
 epoch: 71, train_loss: 0.2638, test_loss: 1.1757, test_f1: 0.6888
 epoch: 72, train_loss: 0.2699, test_loss: 1.1330, test_f1: 0.6813
 epoch: 73, train_loss: 0.2740, test_loss: 1.1657, test_f1: 0.6796
 epoch: 74, train_loss: 0.2605, test_loss: 1.1763, test_f1: 0.6957
 epoch: 75, train_loss: 0.2555, test_loss: 1.1036, test_f1: 0.6705
 epoch: 76, train_loss: 0.2485, test_loss: 1.1830, test_f1: 0.6657
 epoch: 77, train_loss: 0.2540, test_loss: 1.2074, test_f1: 0.6568
 epoch: 78, train_loss: 0.2643, test_loss: 1.1667, test_f1: 0.6872
 epoch: 79, train_loss: 0.2361, test_loss: 1.2779, test_f1: 0.6587
 epoch: 80, train_loss: 0.2417, test_loss: 1.2261, test_f1: 0.6833
 epoch: 81, train_loss: 0.2458, test_loss: 1.2886, test_f1: 0.6519
 epoch: 82, train_loss: 0.2314, test_loss: 1.1646, test_f1: 0.6738
 epoch: 83, train_loss: 0.2363, test_loss: 1.3225, test_f1: 0.6837
 epoch: 84, train_loss: 0.2235, test_loss: 1.2227, test_f1: 0.6614
 epoch: 85, train_loss: 0.2338, test_loss: 1.2073, test_f1: 0.6498
 epoch: 86, train_loss: 0.2431, test_loss: 1.3197, test_f1: 0.6619
 epoch: 87, train_loss: 0.2193, test_loss: 1.2552, test_f1: 0.6757
 epoch: 88, train_loss: 0.2357, test_loss: 1.2412, test_f1: 0.6686
 epoch: 89, train_loss: 0.2260, test_loss: 1.1770, test_f1: 0.6853
 epoch: 90, train_loss: 0.2330, test_loss: 1.3276, test_f1: 0.6925
 epoch: 91, train_loss: 0.2265, test_loss: 1.2576, test_f1: 0.6824
 epoch: 92, train_loss: 0.2060, test_loss: 1.3302, test_f1: 0.6698
 epoch: 93, train_loss: 0.2025, test_loss: 1.3099, test_f1: 0.6586
 epoch: 94, train_loss: 0.2002, test_loss: 1.3595, test_f1: 0.6613
 epoch: 95, train_loss: 0.2056, test_loss: 1.3000, test_f1: 0.6586
 epoch: 96, train_loss: 0.2121, test_loss: 1.3436, test_f1: 0.6599
 epoch: 97, train_loss: 0.1923, test_loss: 1.3788, test_f1: 0.6593
 epoch: 98, train_loss: 0.2070, test_loss: 1.3299, test_f1: 0.6570
 epoch: 99, train_loss: 0.1893, test_loss: 1.4300, test_f1: 0.6821
##################ITERATION #5 ****************************************
 epoch: 0, train_loss: 1.2863, test_loss: 1.2266, test_f1: 0.2496
 epoch: 1, train_loss: 1.0502, test_loss: 1.0196, test_f1: 0.4216
 epoch: 2, train_loss: 0.9759, test_loss: 0.8999, test_f1: 0.4974
 epoch: 3, train_loss: 0.9287, test_loss: 0.9264, test_f1: 0.5495
 epoch: 4, train_loss: 0.8844, test_loss: 0.8596, test_f1: 0.5326
 epoch: 5, train_loss: 0.8660, test_loss: 0.9022, test_f1: 0.5360
 epoch: 6, train_loss: 0.8483, test_loss: 0.8369, test_f1: 0.5645
 epoch: 7, train_loss: 0.8387, test_loss: 0.8601, test_f1: 0.5637
 epoch: 8, train_loss: 0.8017, test_loss: 0.8409, test_f1: 0.5690
 epoch: 9, train_loss: 0.7970, test_loss: 0.8454, test_f1: 0.5928
 epoch: 10, train_loss: 0.7789, test_loss: 0.8178, test_f1: 0.5793
 epoch: 11, train_loss: 0.7609, test_loss: 0.8320, test_f1: 0.5844
 epoch: 12, train_loss: 0.7375, test_loss: 0.8465, test_f1: 0.6124
 epoch: 13, train_loss: 0.7286, test_loss: 0.8468, test_f1: 0.6213
 epoch: 14, train_loss: 0.6957, test_loss: 0.8275, test_f1: 0.6009
 epoch: 15, train_loss: 0.7055, test_loss: 0.8627, test_f1: 0.6001
 epoch: 16, train_loss: 0.6967, test_loss: 0.8042, test_f1: 0.6082
 epoch: 17, train_loss: 0.6816, test_loss: 0.7897, test_f1: 0.6229
 epoch: 18, train_loss: 0.6602, test_loss: 0.8341, test_f1: 0.6050
 epoch: 19, train_loss: 0.6669, test_loss: 0.7936, test_f1: 0.6301
 epoch: 20, train_loss: 0.6490, test_loss: 0.8293, test_f1: 0.6283
 epoch: 21, train_loss: 0.6272, test_loss: 0.8041, test_f1: 0.6405
 epoch: 22, train_loss: 0.6055, test_loss: 0.8250, test_f1: 0.6508
 epoch: 23, train_loss: 0.5962, test_loss: 0.8112, test_f1: 0.6438
 epoch: 24, train_loss: 0.5890, test_loss: 0.9286, test_f1: 0.5898
 epoch: 25, train_loss: 0.5979, test_loss: 0.8420, test_f1: 0.6065
 epoch: 26, train_loss: 0.5927, test_loss: 0.7778, test_f1: 0.6434
 epoch: 27, train_loss: 0.5761, test_loss: 0.8435, test_f1: 0.6365
 epoch: 28, train_loss: 0.5492, test_loss: 0.8696, test_f1: 0.6460
 epoch: 29, train_loss: 0.5428, test_loss: 0.8850, test_f1: 0.6202
 epoch: 30, train_loss: 0.5320, test_loss: 0.8171, test_f1: 0.6441
 epoch: 31, train_loss: 0.5301, test_loss: 0.9501, test_f1: 0.6222
 epoch: 32, train_loss: 0.5246, test_loss: 0.7790, test_f1: 0.6489
 epoch: 33, train_loss: 0.5236, test_loss: 0.8367, test_f1: 0.6374
 epoch: 34, train_loss: 0.5028, test_loss: 0.8262, test_f1: 0.6591
 epoch: 35, train_loss: 0.5150, test_loss: 0.9632, test_f1: 0.5976
 epoch: 36, train_loss: 0.5135, test_loss: 0.7942, test_f1: 0.6652
 epoch: 37, train_loss: 0.4880, test_loss: 0.8935, test_f1: 0.6186
 epoch: 38, train_loss: 0.4735, test_loss: 0.8903, test_f1: 0.6592
 epoch: 39, train_loss: 0.4569, test_loss: 0.8859, test_f1: 0.6268
 epoch: 40, train_loss: 0.4711, test_loss: 0.9768, test_f1: 0.6199
 epoch: 41, train_loss: 0.4837, test_loss: 0.8625, test_f1: 0.6512
 epoch: 42, train_loss: 0.4572, test_loss: 1.0736, test_f1: 0.6389
 epoch: 43, train_loss: 0.4653, test_loss: 0.9057, test_f1: 0.6335
 epoch: 44, train_loss: 0.4464, test_loss: 0.9031, test_f1: 0.6484
 epoch: 45, train_loss: 0.4484, test_loss: 0.9007, test_f1: 0.6424
 epoch: 46, train_loss: 0.4345, test_loss: 0.8396, test_f1: 0.6485
 epoch: 47, train_loss: 0.4057, test_loss: 0.9028, test_f1: 0.6439
 epoch: 48, train_loss: 0.3985, test_loss: 0.9430, test_f1: 0.6511
 epoch: 49, train_loss: 0.4102, test_loss: 0.9108, test_f1: 0.6327
 epoch: 50, train_loss: 0.4016, test_loss: 1.0522, test_f1: 0.6265
 epoch: 51, train_loss: 0.3801, test_loss: 0.9248, test_f1: 0.6511
 epoch: 52, train_loss: 0.3439, test_loss: 0.9502, test_f1: 0.6804
 epoch: 53, train_loss: 0.3367, test_loss: 0.9739, test_f1: 0.6618
 epoch: 54, train_loss: 0.3181, test_loss: 1.0161, test_f1: 0.6482
 epoch: 55, train_loss: 0.3311, test_loss: 1.0069, test_f1: 0.6840
 epoch: 56, train_loss: 0.3278, test_loss: 1.1257, test_f1: 0.6498
 epoch: 57, train_loss: 0.3015, test_loss: 1.0550, test_f1: 0.6447
 epoch: 58, train_loss: 0.3010, test_loss: 1.1298, test_f1: 0.6593
 epoch: 59, train_loss: 0.3136, test_loss: 1.1305, test_f1: 0.6353
 epoch: 60, train_loss: 0.2987, test_loss: 1.0799, test_f1: 0.6542
 epoch: 61, train_loss: 0.3091, test_loss: 1.0974, test_f1: 0.6546
 epoch: 62, train_loss: 0.2920, test_loss: 1.0586, test_f1: 0.6696
 epoch: 63, train_loss: 0.2848, test_loss: 1.1554, test_f1: 0.6413
 epoch: 64, train_loss: 0.2958, test_loss: 1.1724, test_f1: 0.6380
 epoch: 65, train_loss: 0.2844, test_loss: 1.1231, test_f1: 0.6566
 epoch: 66, train_loss: 0.2787, test_loss: 1.1474, test_f1: 0.6401
 epoch: 67, train_loss: 0.2905, test_loss: 1.1910, test_f1: 0.6458
 epoch: 68, train_loss: 0.2862, test_loss: 1.1177, test_f1: 0.6522
 epoch: 69, train_loss: 0.2790, test_loss: 1.2386, test_f1: 0.6304
 epoch: 70, train_loss: 0.2754, test_loss: 1.2062, test_f1: 0.6319
 epoch: 71, train_loss: 0.2621, test_loss: 1.1249, test_f1: 0.6422
 epoch: 72, train_loss: 0.2512, test_loss: 1.1945, test_f1: 0.6638
 epoch: 73, train_loss: 0.2629, test_loss: 1.1392, test_f1: 0.6549
 epoch: 74, train_loss: 0.2838, test_loss: 1.2340, test_f1: 0.6402
 epoch: 75, train_loss: 0.2556, test_loss: 1.2634, test_f1: 0.6544
 epoch: 76, train_loss: 0.2550, test_loss: 1.2107, test_f1: 0.6487
 epoch: 77, train_loss: 0.2501, test_loss: 1.2265, test_f1: 0.6474
 epoch: 78, train_loss: 0.2497, test_loss: 1.2633, test_f1: 0.6558
 epoch: 79, train_loss: 0.2421, test_loss: 1.4349, test_f1: 0.6266
 epoch: 80, train_loss: 0.2544, test_loss: 1.2063, test_f1: 0.6700
 epoch: 81, train_loss: 0.2430, test_loss: 1.2720, test_f1: 0.6375
 epoch: 82, train_loss: 0.2364, test_loss: 1.4042, test_f1: 0.6242
 epoch: 83, train_loss: 0.2302, test_loss: 1.3103, test_f1: 0.6364
 epoch: 84, train_loss: 0.2545, test_loss: 1.2732, test_f1: 0.6344
 epoch: 85, train_loss: 0.2394, test_loss: 1.1557, test_f1: 0.6688
 epoch: 86, train_loss: 0.2341, test_loss: 1.3463, test_f1: 0.6500
 epoch: 87, train_loss: 0.2289, test_loss: 1.3185, test_f1: 0.6449
 epoch: 88, train_loss: 0.2330, test_loss: 1.3113, test_f1: 0.6406
 epoch: 89, train_loss: 0.2305, test_loss: 1.3848, test_f1: 0.6285
 epoch: 90, train_loss: 0.2157, test_loss: 1.3562, test_f1: 0.6398
 epoch: 91, train_loss: 0.2089, test_loss: 1.4469, test_f1: 0.6329
 epoch: 92, train_loss: 0.2092, test_loss: 1.4679, test_f1: 0.6430
 epoch: 93, train_loss: 0.2258, test_loss: 1.3063, test_f1: 0.6577
 epoch: 94, train_loss: 0.2193, test_loss: 1.3800, test_f1: 0.6512
 epoch: 95, train_loss: 0.2414, test_loss: 1.4562, test_f1: 0.6425
 epoch: 96, train_loss: 0.2221, test_loss: 1.3211, test_f1: 0.6627
 epoch: 97, train_loss: 0.1998, test_loss: 1.3897, test_f1: 0.6519
 epoch: 98, train_loss: 0.1917, test_loss: 1.2663, test_f1: 0.6922
 epoch: 99, train_loss: 0.2026, test_loss: 1.4905, test_f1: 0.6347
##################ITERATION #6 ****************************************
 epoch: 0, train_loss: 1.2938, test_loss: 1.3025, test_f1: 0.2260
 epoch: 1, train_loss: 1.0687, test_loss: 1.0307, test_f1: 0.4017
 epoch: 2, train_loss: 1.0086, test_loss: 0.9874, test_f1: 0.5134
 epoch: 3, train_loss: 0.9676, test_loss: 1.0008, test_f1: 0.4972
 epoch: 4, train_loss: 0.9272, test_loss: 0.9380, test_f1: 0.5009
 epoch: 5, train_loss: 0.9059, test_loss: 0.9385, test_f1: 0.5397
 epoch: 6, train_loss: 0.8893, test_loss: 0.9614, test_f1: 0.5163
 epoch: 7, train_loss: 0.8803, test_loss: 0.9681, test_f1: 0.5496
 epoch: 8, train_loss: 0.8611, test_loss: 0.8492, test_f1: 0.5750
 epoch: 9, train_loss: 0.8440, test_loss: 0.9649, test_f1: 0.5270
 epoch: 10, train_loss: 0.8195, test_loss: 0.8907, test_f1: 0.5951
 epoch: 11, train_loss: 0.8019, test_loss: 0.9210, test_f1: 0.5732
 epoch: 12, train_loss: 0.7852, test_loss: 0.9424, test_f1: 0.5854
 epoch: 13, train_loss: 0.7956, test_loss: 1.0031, test_f1: 0.5481
 epoch: 14, train_loss: 0.7568, test_loss: 1.0015, test_f1: 0.5618
 epoch: 15, train_loss: 0.7552, test_loss: 0.9201, test_f1: 0.6030
 epoch: 16, train_loss: 0.7383, test_loss: 0.8714, test_f1: 0.5772
 epoch: 17, train_loss: 0.7219, test_loss: 0.8340, test_f1: 0.6094
 epoch: 18, train_loss: 0.7205, test_loss: 0.9292, test_f1: 0.5921
 epoch: 19, train_loss: 0.7187, test_loss: 0.9229, test_f1: 0.6124
 epoch: 20, train_loss: 0.6994, test_loss: 0.9192, test_f1: 0.6015
 epoch: 21, train_loss: 0.6933, test_loss: 0.8415, test_f1: 0.6081
 epoch: 22, train_loss: 0.6705, test_loss: 0.9503, test_f1: 0.5934
 epoch: 23, train_loss: 0.6597, test_loss: 0.9697, test_f1: 0.5777
 epoch: 24, train_loss: 0.6623, test_loss: 0.8216, test_f1: 0.6304
 epoch: 25, train_loss: 0.6517, test_loss: 0.8353, test_f1: 0.6188
 epoch: 26, train_loss: 0.6513, test_loss: 0.9206, test_f1: 0.6016
 epoch: 27, train_loss: 0.6437, test_loss: 0.8907, test_f1: 0.6174
 epoch: 28, train_loss: 0.6238, test_loss: 0.9850, test_f1: 0.6122
 epoch: 29, train_loss: 0.6420, test_loss: 0.8658, test_f1: 0.6115
 epoch: 30, train_loss: 0.6117, test_loss: 0.8802, test_f1: 0.6412
 epoch: 31, train_loss: 0.6067, test_loss: 0.9902, test_f1: 0.6094
 epoch: 32, train_loss: 0.6019, test_loss: 0.8458, test_f1: 0.6206
 epoch: 33, train_loss: 0.5884, test_loss: 0.8401, test_f1: 0.6280
 epoch: 34, train_loss: 0.5767, test_loss: 0.8830, test_f1: 0.6429
 epoch: 35, train_loss: 0.5788, test_loss: 0.8615, test_f1: 0.6444
 epoch: 36, train_loss: 0.5959, test_loss: 1.0451, test_f1: 0.5912
 epoch: 37, train_loss: 0.5643, test_loss: 0.9200, test_f1: 0.5985
 epoch: 38, train_loss: 0.5782, test_loss: 0.8861, test_f1: 0.6554
 epoch: 39, train_loss: 0.5542, test_loss: 0.8755, test_f1: 0.6479
 epoch: 40, train_loss: 0.5577, test_loss: 0.9320, test_f1: 0.6287
 epoch: 41, train_loss: 0.5360, test_loss: 0.8605, test_f1: 0.6456
 epoch: 42, train_loss: 0.5565, test_loss: 0.8146, test_f1: 0.6387
 epoch: 43, train_loss: 0.5347, test_loss: 0.9974, test_f1: 0.5965
 epoch: 44, train_loss: 0.5274, test_loss: 0.8982, test_f1: 0.6259
 epoch: 45, train_loss: 0.5083, test_loss: 0.8219, test_f1: 0.6768
 epoch: 46, train_loss: 0.5029, test_loss: 0.9300, test_f1: 0.6165
 epoch: 47, train_loss: 0.5157, test_loss: 0.8770, test_f1: 0.6494
 epoch: 48, train_loss: 0.5126, test_loss: 0.9465, test_f1: 0.6284
 epoch: 49, train_loss: 0.4700, test_loss: 0.9710, test_f1: 0.6281
 epoch: 50, train_loss: 0.4846, test_loss: 0.9522, test_f1: 0.6367
 epoch: 51, train_loss: 0.4610, test_loss: 0.8622, test_f1: 0.6733
 epoch: 52, train_loss: 0.4249, test_loss: 0.9378, test_f1: 0.6395
 epoch: 53, train_loss: 0.4123, test_loss: 0.9236, test_f1: 0.6611
 epoch: 54, train_loss: 0.4182, test_loss: 0.9647, test_f1: 0.6361
 epoch: 55, train_loss: 0.4132, test_loss: 0.9444, test_f1: 0.6531
 epoch: 56, train_loss: 0.4109, test_loss: 0.9443, test_f1: 0.6477
 epoch: 57, train_loss: 0.3914, test_loss: 0.9528, test_f1: 0.6496
 epoch: 58, train_loss: 0.3852, test_loss: 1.0242, test_f1: 0.6370
 epoch: 59, train_loss: 0.4113, test_loss: 0.9333, test_f1: 0.6676
 epoch: 60, train_loss: 0.4032, test_loss: 0.9847, test_f1: 0.6341
 epoch: 61, train_loss: 0.3892, test_loss: 0.9233, test_f1: 0.6557
 epoch: 62, train_loss: 0.3878, test_loss: 0.9873, test_f1: 0.6677
 epoch: 63, train_loss: 0.3749, test_loss: 0.9744, test_f1: 0.6760
 epoch: 64, train_loss: 0.3876, test_loss: 1.0633, test_f1: 0.6471
 epoch: 65, train_loss: 0.3591, test_loss: 0.9475, test_f1: 0.6613
 epoch: 66, train_loss: 0.3633, test_loss: 1.0220, test_f1: 0.6298
 epoch: 67, train_loss: 0.3581, test_loss: 0.9816, test_f1: 0.6625
 epoch: 68, train_loss: 0.3831, test_loss: 0.9452, test_f1: 0.6643
 epoch: 69, train_loss: 0.3482, test_loss: 1.0574, test_f1: 0.6616
 epoch: 70, train_loss: 0.3618, test_loss: 0.9740, test_f1: 0.6661
 epoch: 71, train_loss: 0.3656, test_loss: 1.1414, test_f1: 0.6287
 epoch: 72, train_loss: 0.3658, test_loss: 1.0166, test_f1: 0.6399
 epoch: 73, train_loss: 0.3462, test_loss: 0.9592, test_f1: 0.6785
 epoch: 74, train_loss: 0.3217, test_loss: 1.0298, test_f1: 0.6657
 epoch: 75, train_loss: 0.3332, test_loss: 1.0378, test_f1: 0.6551
 epoch: 76, train_loss: 0.3337, test_loss: 1.0357, test_f1: 0.6469
 epoch: 77, train_loss: 0.3534, test_loss: 1.0659, test_f1: 0.6490
 epoch: 78, train_loss: 0.3251, test_loss: 0.9722, test_f1: 0.6752
 epoch: 79, train_loss: 0.3534, test_loss: 1.0016, test_f1: 0.6614
 epoch: 80, train_loss: 0.3436, test_loss: 1.0244, test_f1: 0.6576
 epoch: 81, train_loss: 0.3219, test_loss: 1.0998, test_f1: 0.6511
 epoch: 82, train_loss: 0.3301, test_loss: 1.0904, test_f1: 0.6530
 epoch: 83, train_loss: 0.3249, test_loss: 1.1218, test_f1: 0.6259
 epoch: 84, train_loss: 0.3312, test_loss: 0.9610, test_f1: 0.6520
 epoch: 85, train_loss: 0.3094, test_loss: 1.1772, test_f1: 0.6031
 epoch: 86, train_loss: 0.3057, test_loss: 1.0015, test_f1: 0.6715
 epoch: 87, train_loss: 0.3047, test_loss: 1.0539, test_f1: 0.6580
 epoch: 88, train_loss: 0.3168, test_loss: 0.9738, test_f1: 0.6752
 epoch: 89, train_loss: 0.3045, test_loss: 1.1228, test_f1: 0.6330
 epoch: 90, train_loss: 0.3080, test_loss: 1.1040, test_f1: 0.6762
 epoch: 91, train_loss: 0.3084, test_loss: 1.1217, test_f1: 0.6281
 epoch: 92, train_loss: 0.3082, test_loss: 1.1245, test_f1: 0.6679
 epoch: 93, train_loss: 0.2831, test_loss: 1.2164, test_f1: 0.6262
 epoch: 94, train_loss: 0.2997, test_loss: 1.1697, test_f1: 0.6573
 epoch: 95, train_loss: 0.2998, test_loss: 1.2163, test_f1: 0.6529
 epoch: 96, train_loss: 0.2878, test_loss: 1.1144, test_f1: 0.6623
 epoch: 97, train_loss: 0.2811, test_loss: 1.1748, test_f1: 0.6331
 epoch: 98, train_loss: 0.2672, test_loss: 1.1428, test_f1: 0.6626
 epoch: 99, train_loss: 0.2775, test_loss: 1.2443, test_f1: 0.6242
##################ITERATION #7 ****************************************
 epoch: 0, train_loss: 1.3782, test_loss: 1.2250, test_f1: 0.2584
 epoch: 1, train_loss: 1.0947, test_loss: 0.9985, test_f1: 0.4773
 epoch: 2, train_loss: 1.0281, test_loss: 0.9955, test_f1: 0.4849
 epoch: 3, train_loss: 0.9800, test_loss: 1.0238, test_f1: 0.5371
 epoch: 4, train_loss: 0.9663, test_loss: 0.9779, test_f1: 0.5350
 epoch: 5, train_loss: 0.9408, test_loss: 0.9409, test_f1: 0.5581
 epoch: 6, train_loss: 0.9095, test_loss: 0.9506, test_f1: 0.5866
 epoch: 7, train_loss: 0.8865, test_loss: 0.9374, test_f1: 0.5875
 epoch: 8, train_loss: 0.8604, test_loss: 0.9544, test_f1: 0.5632
 epoch: 9, train_loss: 0.8432, test_loss: 0.8822, test_f1: 0.5849
 epoch: 10, train_loss: 0.8297, test_loss: 0.9336, test_f1: 0.5607
 epoch: 11, train_loss: 0.8094, test_loss: 0.9059, test_f1: 0.5662
 epoch: 12, train_loss: 0.8079, test_loss: 0.9471, test_f1: 0.5791
 epoch: 13, train_loss: 0.7899, test_loss: 0.9240, test_f1: 0.5565
 epoch: 14, train_loss: 0.7803, test_loss: 0.9132, test_f1: 0.5699
 epoch: 15, train_loss: 0.7810, test_loss: 0.8858, test_f1: 0.6167
 epoch: 16, train_loss: 0.7649, test_loss: 0.9130, test_f1: 0.5958
 epoch: 17, train_loss: 0.7412, test_loss: 0.9046, test_f1: 0.5926
 epoch: 18, train_loss: 0.7209, test_loss: 0.9040, test_f1: 0.5981
 epoch: 19, train_loss: 0.7012, test_loss: 0.9206, test_f1: 0.5909
 epoch: 20, train_loss: 0.6916, test_loss: 0.8854, test_f1: 0.5756
 epoch: 21, train_loss: 0.6932, test_loss: 0.8947, test_f1: 0.6070
 epoch: 22, train_loss: 0.6875, test_loss: 0.9018, test_f1: 0.6161
 epoch: 23, train_loss: 0.6765, test_loss: 0.8010, test_f1: 0.6241
 epoch: 24, train_loss: 0.6491, test_loss: 0.8609, test_f1: 0.6368
 epoch: 25, train_loss: 0.6579, test_loss: 1.0094, test_f1: 0.5885
 epoch: 26, train_loss: 0.6375, test_loss: 0.8745, test_f1: 0.6113
 epoch: 27, train_loss: 0.6292, test_loss: 0.9461, test_f1: 0.6038
 epoch: 28, train_loss: 0.6243, test_loss: 0.8404, test_f1: 0.6533
 epoch: 29, train_loss: 0.5977, test_loss: 0.8994, test_f1: 0.6304
 epoch: 30, train_loss: 0.6050, test_loss: 0.8989, test_f1: 0.6009
 epoch: 31, train_loss: 0.6117, test_loss: 0.9029, test_f1: 0.6155
 epoch: 32, train_loss: 0.5600, test_loss: 0.8403, test_f1: 0.6398
 epoch: 33, train_loss: 0.5895, test_loss: 0.9805, test_f1: 0.5919
 epoch: 34, train_loss: 0.5540, test_loss: 0.8660, test_f1: 0.6360
 epoch: 35, train_loss: 0.5344, test_loss: 0.9986, test_f1: 0.6069
 epoch: 36, train_loss: 0.5388, test_loss: 0.8940, test_f1: 0.6141
 epoch: 37, train_loss: 0.5444, test_loss: 0.9285, test_f1: 0.6074
 epoch: 38, train_loss: 0.5479, test_loss: 0.9766, test_f1: 0.6217
 epoch: 39, train_loss: 0.5225, test_loss: 0.9535, test_f1: 0.6486
 epoch: 40, train_loss: 0.5110, test_loss: 0.9650, test_f1: 0.6347
 epoch: 41, train_loss: 0.5208, test_loss: 0.8775, test_f1: 0.6166
 epoch: 42, train_loss: 0.5131, test_loss: 0.8519, test_f1: 0.6531
 epoch: 43, train_loss: 0.5063, test_loss: 0.8958, test_f1: 0.6357
 epoch: 44, train_loss: 0.5149, test_loss: 0.8512, test_f1: 0.6298
 epoch: 45, train_loss: 0.4912, test_loss: 0.9275, test_f1: 0.6319
 epoch: 46, train_loss: 0.4623, test_loss: 1.1021, test_f1: 0.5819
 epoch: 47, train_loss: 0.4719, test_loss: 1.0224, test_f1: 0.6395
 epoch: 48, train_loss: 0.4627, test_loss: 0.8950, test_f1: 0.6360
 epoch: 49, train_loss: 0.4748, test_loss: 0.9718, test_f1: 0.6491
 epoch: 50, train_loss: 0.4864, test_loss: 0.9182, test_f1: 0.6517
 epoch: 51, train_loss: 0.4143, test_loss: 0.9632, test_f1: 0.6524
 epoch: 52, train_loss: 0.3946, test_loss: 0.9092, test_f1: 0.6537
 epoch: 53, train_loss: 0.3956, test_loss: 0.9549, test_f1: 0.6331
 epoch: 54, train_loss: 0.3792, test_loss: 0.9032, test_f1: 0.6701
 epoch: 55, train_loss: 0.3696, test_loss: 0.9809, test_f1: 0.6377
 epoch: 56, train_loss: 0.3565, test_loss: 0.8911, test_f1: 0.6624
 epoch: 57, train_loss: 0.3765, test_loss: 0.9591, test_f1: 0.6549
 epoch: 58, train_loss: 0.3556, test_loss: 0.9613, test_f1: 0.6326
 epoch: 59, train_loss: 0.3619, test_loss: 0.9309, test_f1: 0.6801
 epoch: 60, train_loss: 0.3539, test_loss: 0.9147, test_f1: 0.6781
 epoch: 61, train_loss: 0.3489, test_loss: 0.9778, test_f1: 0.6418
 epoch: 62, train_loss: 0.3317, test_loss: 0.9956, test_f1: 0.6547
 epoch: 63, train_loss: 0.3466, test_loss: 1.0184, test_f1: 0.6448
 epoch: 64, train_loss: 0.3416, test_loss: 1.0347, test_f1: 0.6349
 epoch: 65, train_loss: 0.3466, test_loss: 1.1327, test_f1: 0.6375
 epoch: 66, train_loss: 0.3246, test_loss: 1.1281, test_f1: 0.6391
 epoch: 67, train_loss: 0.3213, test_loss: 0.9921, test_f1: 0.6396
 epoch: 68, train_loss: 0.3094, test_loss: 1.0417, test_f1: 0.6595
 epoch: 69, train_loss: 0.3282, test_loss: 1.0134, test_f1: 0.6474
 epoch: 70, train_loss: 0.3197, test_loss: 1.0023, test_f1: 0.6656
 epoch: 71, train_loss: 0.3248, test_loss: 1.0453, test_f1: 0.6610
 epoch: 72, train_loss: 0.3186, test_loss: 1.1053, test_f1: 0.6360
 epoch: 73, train_loss: 0.2990, test_loss: 1.0887, test_f1: 0.6490
 epoch: 74, train_loss: 0.3013, test_loss: 1.0325, test_f1: 0.6619
 epoch: 75, train_loss: 0.3115, test_loss: 1.1306, test_f1: 0.6139
 epoch: 76, train_loss: 0.2930, test_loss: 1.0396, test_f1: 0.6573
 epoch: 77, train_loss: 0.2967, test_loss: 1.0569, test_f1: 0.6813
 epoch: 78, train_loss: 0.2799, test_loss: 1.1398, test_f1: 0.6559
 epoch: 79, train_loss: 0.2941, test_loss: 1.2215, test_f1: 0.6462
 epoch: 80, train_loss: 0.2939, test_loss: 1.0620, test_f1: 0.6644
 epoch: 81, train_loss: 0.3047, test_loss: 1.1439, test_f1: 0.6529
 epoch: 82, train_loss: 0.2940, test_loss: 1.1422, test_f1: 0.6350
 epoch: 83, train_loss: 0.2719, test_loss: 1.1957, test_f1: 0.6313
 epoch: 84, train_loss: 0.2653, test_loss: 1.1285, test_f1: 0.6592
 epoch: 85, train_loss: 0.2773, test_loss: 1.1239, test_f1: 0.6620
 epoch: 86, train_loss: 0.2768, test_loss: 1.1471, test_f1: 0.6802
 epoch: 87, train_loss: 0.2773, test_loss: 1.0902, test_f1: 0.6449
 epoch: 88, train_loss: 0.2511, test_loss: 1.1525, test_f1: 0.6698
 epoch: 89, train_loss: 0.2637, test_loss: 1.1263, test_f1: 0.6338
 epoch: 90, train_loss: 0.2643, test_loss: 1.2198, test_f1: 0.6602
 epoch: 91, train_loss: 0.2674, test_loss: 1.2002, test_f1: 0.6214
 epoch: 92, train_loss: 0.2562, test_loss: 1.0737, test_f1: 0.6688
 epoch: 93, train_loss: 0.2489, test_loss: 1.1951, test_f1: 0.6389
 epoch: 94, train_loss: 0.2326, test_loss: 1.2164, test_f1: 0.6432
 epoch: 95, train_loss: 0.2482, test_loss: 1.1474, test_f1: 0.6412
 epoch: 96, train_loss: 0.2458, test_loss: 1.2917, test_f1: 0.6430
 epoch: 97, train_loss: 0.2461, test_loss: 1.1928, test_f1: 0.6827
 epoch: 98, train_loss: 0.2418, test_loss: 1.1956, test_f1: 0.6301
 epoch: 99, train_loss: 0.2733, test_loss: 1.1719, test_f1: 0.6365
##################ITERATION #8 ****************************************
 epoch: 0, train_loss: 1.3396, test_loss: 1.2278, test_f1: 0.3030
 epoch: 1, train_loss: 1.0290, test_loss: 1.0039, test_f1: 0.4185
 epoch: 2, train_loss: 0.9920, test_loss: 0.9807, test_f1: 0.4874
 epoch: 3, train_loss: 0.9492, test_loss: 0.9740, test_f1: 0.4894
 epoch: 4, train_loss: 0.9182, test_loss: 1.0641, test_f1: 0.5225
 epoch: 5, train_loss: 0.9058, test_loss: 0.9553, test_f1: 0.5347
 epoch: 6, train_loss: 0.8820, test_loss: 1.0016, test_f1: 0.4938
 epoch: 7, train_loss: 0.8553, test_loss: 0.9688, test_f1: 0.5457
 epoch: 8, train_loss: 0.8500, test_loss: 0.9239, test_f1: 0.5531
 epoch: 9, train_loss: 0.8472, test_loss: 0.9478, test_f1: 0.5311
 epoch: 10, train_loss: 0.8259, test_loss: 0.9062, test_f1: 0.5649
 epoch: 11, train_loss: 0.8123, test_loss: 0.8929, test_f1: 0.5680
 epoch: 12, train_loss: 0.8018, test_loss: 0.9117, test_f1: 0.5985
 epoch: 13, train_loss: 0.7985, test_loss: 0.9410, test_f1: 0.5573
 epoch: 14, train_loss: 0.7817, test_loss: 0.8825, test_f1: 0.5636
 epoch: 15, train_loss: 0.7697, test_loss: 0.9035, test_f1: 0.5808
 epoch: 16, train_loss: 0.7507, test_loss: 0.8584, test_f1: 0.5939
 epoch: 17, train_loss: 0.7395, test_loss: 0.9174, test_f1: 0.5634
 epoch: 18, train_loss: 0.7426, test_loss: 0.8874, test_f1: 0.5837
 epoch: 19, train_loss: 0.7440, test_loss: 0.8893, test_f1: 0.5710
 epoch: 20, train_loss: 0.7226, test_loss: 0.8662, test_f1: 0.5987
 epoch: 21, train_loss: 0.7061, test_loss: 0.8531, test_f1: 0.6247
 epoch: 22, train_loss: 0.6959, test_loss: 0.8364, test_f1: 0.6368
 epoch: 23, train_loss: 0.6976, test_loss: 0.9265, test_f1: 0.5747
 epoch: 24, train_loss: 0.6881, test_loss: 0.8657, test_f1: 0.5857
 epoch: 25, train_loss: 0.6741, test_loss: 0.8888, test_f1: 0.6061
 epoch: 26, train_loss: 0.6475, test_loss: 0.8260, test_f1: 0.6007
 epoch: 27, train_loss: 0.6660, test_loss: 0.8870, test_f1: 0.6145
 epoch: 28, train_loss: 0.6631, test_loss: 0.8588, test_f1: 0.6080
 epoch: 29, train_loss: 0.6565, test_loss: 0.8715, test_f1: 0.6338
 epoch: 30, train_loss: 0.6338, test_loss: 0.8153, test_f1: 0.6295
 epoch: 31, train_loss: 0.6452, test_loss: 0.8464, test_f1: 0.6290
 epoch: 32, train_loss: 0.6099, test_loss: 0.8465, test_f1: 0.6183
 epoch: 33, train_loss: 0.6091, test_loss: 0.9030, test_f1: 0.6201
 epoch: 34, train_loss: 0.6008, test_loss: 0.8545, test_f1: 0.6218
 epoch: 35, train_loss: 0.5971, test_loss: 0.8620, test_f1: 0.6216
 epoch: 36, train_loss: 0.5789, test_loss: 0.9070, test_f1: 0.6268
 epoch: 37, train_loss: 0.5676, test_loss: 0.7807, test_f1: 0.6465
 epoch: 38, train_loss: 0.5700, test_loss: 0.8491, test_f1: 0.6232
 epoch: 39, train_loss: 0.5630, test_loss: 0.8307, test_f1: 0.6329
 epoch: 40, train_loss: 0.5267, test_loss: 0.8741, test_f1: 0.6345
 epoch: 41, train_loss: 0.5669, test_loss: 0.8763, test_f1: 0.6454
 epoch: 42, train_loss: 0.5464, test_loss: 0.8307, test_f1: 0.6472
 epoch: 43, train_loss: 0.5319, test_loss: 0.8744, test_f1: 0.6248
 epoch: 44, train_loss: 0.5662, test_loss: 0.9938, test_f1: 0.6240
 epoch: 45, train_loss: 0.5207, test_loss: 0.8943, test_f1: 0.6357
 epoch: 46, train_loss: 0.5258, test_loss: 0.8286, test_f1: 0.6576
 epoch: 47, train_loss: 0.5210, test_loss: 0.8313, test_f1: 0.6258
 epoch: 48, train_loss: 0.5073, test_loss: 0.8187, test_f1: 0.6474
 epoch: 49, train_loss: 0.5057, test_loss: 0.8668, test_f1: 0.6454
 epoch: 50, train_loss: 0.5316, test_loss: 0.8643, test_f1: 0.6385
 epoch: 51, train_loss: 0.4770, test_loss: 0.7890, test_f1: 0.6750
 epoch: 52, train_loss: 0.4330, test_loss: 0.8216, test_f1: 0.6681
 epoch: 53, train_loss: 0.4311, test_loss: 0.8133, test_f1: 0.6710
 epoch: 54, train_loss: 0.4144, test_loss: 0.8343, test_f1: 0.6457
 epoch: 55, train_loss: 0.4007, test_loss: 0.8148, test_f1: 0.6594
 epoch: 56, train_loss: 0.4160, test_loss: 0.8304, test_f1: 0.6678
 epoch: 57, train_loss: 0.4133, test_loss: 0.9460, test_f1: 0.6552
 epoch: 58, train_loss: 0.4145, test_loss: 0.8540, test_f1: 0.6499
 epoch: 59, train_loss: 0.4048, test_loss: 0.9086, test_f1: 0.6491
 epoch: 60, train_loss: 0.3816, test_loss: 0.9157, test_f1: 0.6499
 epoch: 61, train_loss: 0.3809, test_loss: 0.9018, test_f1: 0.6737
 epoch: 62, train_loss: 0.3976, test_loss: 0.9339, test_f1: 0.6590
 epoch: 63, train_loss: 0.3883, test_loss: 0.8821, test_f1: 0.6695
 epoch: 64, train_loss: 0.3746, test_loss: 0.9993, test_f1: 0.6491
 epoch: 65, train_loss: 0.3897, test_loss: 0.9503, test_f1: 0.6795
 epoch: 66, train_loss: 0.3611, test_loss: 0.9574, test_f1: 0.6660
 epoch: 67, train_loss: 0.3639, test_loss: 0.9830, test_f1: 0.6560
 epoch: 68, train_loss: 0.3486, test_loss: 0.9568, test_f1: 0.6606
 epoch: 69, train_loss: 0.3559, test_loss: 0.9282, test_f1: 0.6806
 epoch: 70, train_loss: 0.3535, test_loss: 0.9872, test_f1: 0.6417
 epoch: 71, train_loss: 0.3535, test_loss: 0.9805, test_f1: 0.6437
 epoch: 72, train_loss: 0.3425, test_loss: 1.0035, test_f1: 0.6510
 epoch: 73, train_loss: 0.3500, test_loss: 0.9731, test_f1: 0.6767
 epoch: 74, train_loss: 0.3409, test_loss: 0.9403, test_f1: 0.6605
 epoch: 75, train_loss: 0.3446, test_loss: 1.0057, test_f1: 0.6301
 epoch: 76, train_loss: 0.3433, test_loss: 1.0667, test_f1: 0.6239
 epoch: 77, train_loss: 0.3333, test_loss: 0.9912, test_f1: 0.6627
 epoch: 78, train_loss: 0.3328, test_loss: 0.9581, test_f1: 0.6566
 epoch: 79, train_loss: 0.3362, test_loss: 1.0540, test_f1: 0.6649
 epoch: 80, train_loss: 0.3168, test_loss: 1.0509, test_f1: 0.6497
 epoch: 81, train_loss: 0.3336, test_loss: 1.0223, test_f1: 0.6673
 epoch: 82, train_loss: 0.3197, test_loss: 1.0489, test_f1: 0.6523
 epoch: 83, train_loss: 0.3059, test_loss: 1.1123, test_f1: 0.6214
 epoch: 84, train_loss: 0.3291, test_loss: 1.0965, test_f1: 0.6691
 epoch: 85, train_loss: 0.3236, test_loss: 1.0120, test_f1: 0.6252
 epoch: 86, train_loss: 0.3059, test_loss: 1.0907, test_f1: 0.6736
 epoch: 87, train_loss: 0.3170, test_loss: 1.0906, test_f1: 0.6654
 epoch: 88, train_loss: 0.2947, test_loss: 1.1294, test_f1: 0.6407
 epoch: 89, train_loss: 0.3118, test_loss: 1.0511, test_f1: 0.6561
 epoch: 90, train_loss: 0.2901, test_loss: 1.2161, test_f1: 0.6427
 epoch: 91, train_loss: 0.2887, test_loss: 1.1261, test_f1: 0.6357
 epoch: 92, train_loss: 0.2754, test_loss: 1.0875, test_f1: 0.6793
 epoch: 93, train_loss: 0.2822, test_loss: 1.1171, test_f1: 0.6882
 epoch: 94, train_loss: 0.2878, test_loss: 1.1014, test_f1: 0.6320
 epoch: 95, train_loss: 0.2798, test_loss: 1.1827, test_f1: 0.6622
 epoch: 96, train_loss: 0.2632, test_loss: 1.1941, test_f1: 0.6352
 epoch: 97, train_loss: 0.2658, test_loss: 1.1492, test_f1: 0.6432
 epoch: 98, train_loss: 0.2689, test_loss: 1.2348, test_f1: 0.6339
 epoch: 99, train_loss: 0.2852, test_loss: 1.0911, test_f1: 0.6635
##################ITERATION #9 ****************************************
 epoch: 0, train_loss: 1.6485, test_loss: 1.6244, test_f1: 0.2388
 epoch: 1, train_loss: 1.1290, test_loss: 1.5215, test_f1: 0.3295
 epoch: 2, train_loss: 1.0487, test_loss: 0.9563, test_f1: 0.4789
 epoch: 3, train_loss: 0.9914, test_loss: 0.9222, test_f1: 0.4953
 epoch: 4, train_loss: 0.9616, test_loss: 0.9221, test_f1: 0.4899
 epoch: 5, train_loss: 0.9458, test_loss: 0.9587, test_f1: 0.4807
 epoch: 6, train_loss: 0.9009, test_loss: 0.8556, test_f1: 0.5232
 epoch: 7, train_loss: 0.9038, test_loss: 0.8806, test_f1: 0.5274
 epoch: 8, train_loss: 0.8611, test_loss: 0.9033, test_f1: 0.5298
 epoch: 9, train_loss: 0.8564, test_loss: 0.8934, test_f1: 0.4960
 epoch: 10, train_loss: 0.8429, test_loss: 0.8566, test_f1: 0.5622
 epoch: 11, train_loss: 0.8274, test_loss: 0.8696, test_f1: 0.5334
 epoch: 12, train_loss: 0.8319, test_loss: 0.8868, test_f1: 0.5386
 epoch: 13, train_loss: 0.8013, test_loss: 0.8682, test_f1: 0.5562
 epoch: 14, train_loss: 0.7794, test_loss: 0.9028, test_f1: 0.5693
 epoch: 15, train_loss: 0.7723, test_loss: 0.8935, test_f1: 0.5369
 epoch: 16, train_loss: 0.7576, test_loss: 0.9815, test_f1: 0.5163
 epoch: 17, train_loss: 0.7376, test_loss: 0.8990, test_f1: 0.5697
 epoch: 18, train_loss: 0.7380, test_loss: 0.8898, test_f1: 0.5743
 epoch: 19, train_loss: 0.7242, test_loss: 0.8800, test_f1: 0.5777
 epoch: 20, train_loss: 0.7239, test_loss: 0.9580, test_f1: 0.5304
 epoch: 21, train_loss: 0.7126, test_loss: 0.9308, test_f1: 0.5170
 epoch: 22, train_loss: 0.7020, test_loss: 0.8939, test_f1: 0.5490
 epoch: 23, train_loss: 0.6944, test_loss: 0.9267, test_f1: 0.5804
 epoch: 24, train_loss: 0.6905, test_loss: 0.8628, test_f1: 0.6121
 epoch: 25, train_loss: 0.6735, test_loss: 0.8916, test_f1: 0.5937
 epoch: 26, train_loss: 0.6652, test_loss: 0.9002, test_f1: 0.6062
 epoch: 27, train_loss: 0.6387, test_loss: 0.8596, test_f1: 0.5942
 epoch: 28, train_loss: 0.6484, test_loss: 0.8891, test_f1: 0.5611
 epoch: 29, train_loss: 0.6172, test_loss: 0.9141, test_f1: 0.5853
 epoch: 30, train_loss: 0.6370, test_loss: 1.0325, test_f1: 0.5447
 epoch: 31, train_loss: 0.6115, test_loss: 0.9328, test_f1: 0.5926
 epoch: 32, train_loss: 0.6023, test_loss: 0.9836, test_f1: 0.5946
 epoch: 33, train_loss: 0.6150, test_loss: 0.8874, test_f1: 0.5812
 epoch: 34, train_loss: 0.6041, test_loss: 0.9026, test_f1: 0.5931
 epoch: 35, train_loss: 0.5805, test_loss: 1.0241, test_f1: 0.5844
 epoch: 36, train_loss: 0.5992, test_loss: 0.9711, test_f1: 0.6155
 epoch: 37, train_loss: 0.5769, test_loss: 0.9523, test_f1: 0.5998
 epoch: 38, train_loss: 0.5927, test_loss: 0.9978, test_f1: 0.5906
 epoch: 39, train_loss: 0.5583, test_loss: 0.9622, test_f1: 0.6130
 epoch: 40, train_loss: 0.5750, test_loss: 0.9801, test_f1: 0.5925
 epoch: 41, train_loss: 0.5532, test_loss: 0.9628, test_f1: 0.6135
 epoch: 42, train_loss: 0.5557, test_loss: 0.9857, test_f1: 0.6043
 epoch: 43, train_loss: 0.5266, test_loss: 1.0630, test_f1: 0.5912
 epoch: 44, train_loss: 0.5092, test_loss: 0.9853, test_f1: 0.6202
 epoch: 45, train_loss: 0.5190, test_loss: 0.9387, test_f1: 0.6306
 epoch: 46, train_loss: 0.5080, test_loss: 0.9342, test_f1: 0.6245
 epoch: 47, train_loss: 0.5150, test_loss: 0.9645, test_f1: 0.6171
 epoch: 48, train_loss: 0.5099, test_loss: 0.9436, test_f1: 0.6512
 epoch: 49, train_loss: 0.4770, test_loss: 1.0254, test_f1: 0.6168
 epoch: 50, train_loss: 0.4887, test_loss: 1.0255, test_f1: 0.6081
 epoch: 51, train_loss: 0.4605, test_loss: 0.9746, test_f1: 0.6306
 epoch: 52, train_loss: 0.4122, test_loss: 1.0278, test_f1: 0.6291
 epoch: 53, train_loss: 0.4146, test_loss: 1.0338, test_f1: 0.6164
 epoch: 54, train_loss: 0.4153, test_loss: 1.0603, test_f1: 0.6275
 epoch: 55, train_loss: 0.3880, test_loss: 1.1090, test_f1: 0.6246
 epoch: 56, train_loss: 0.4119, test_loss: 1.0434, test_f1: 0.6357
 epoch: 57, train_loss: 0.4109, test_loss: 1.0291, test_f1: 0.6407
 epoch: 58, train_loss: 0.4138, test_loss: 1.0768, test_f1: 0.6187
 epoch: 59, train_loss: 0.3895, test_loss: 1.1094, test_f1: 0.6222
 epoch: 60, train_loss: 0.3829, test_loss: 1.1228, test_f1: 0.6222
 epoch: 61, train_loss: 0.3846, test_loss: 1.2082, test_f1: 0.6183
 epoch: 62, train_loss: 0.3857, test_loss: 1.1094, test_f1: 0.6367
 epoch: 63, train_loss: 0.3850, test_loss: 1.1330, test_f1: 0.6160
 epoch: 64, train_loss: 0.3921, test_loss: 1.1199, test_f1: 0.6354
 epoch: 65, train_loss: 0.3719, test_loss: 1.1344, test_f1: 0.6148
 epoch: 66, train_loss: 0.3822, test_loss: 1.1861, test_f1: 0.6383
 epoch: 67, train_loss: 0.3755, test_loss: 1.3097, test_f1: 0.6234
 epoch: 68, train_loss: 0.3521, test_loss: 1.1431, test_f1: 0.6249
 epoch: 69, train_loss: 0.3628, test_loss: 1.2546, test_f1: 0.6109
 epoch: 70, train_loss: 0.3675, test_loss: 1.1806, test_f1: 0.6048
 epoch: 71, train_loss: 0.3386, test_loss: 1.2028, test_f1: 0.6286
 epoch: 72, train_loss: 0.3399, test_loss: 1.1917, test_f1: 0.6449
 epoch: 73, train_loss: 0.3437, test_loss: 1.1835, test_f1: 0.6236
 epoch: 74, train_loss: 0.3607, test_loss: 1.2004, test_f1: 0.6332
 epoch: 75, train_loss: 0.3424, test_loss: 1.1891, test_f1: 0.6490
 epoch: 76, train_loss: 0.3257, test_loss: 1.1550, test_f1: 0.6546
 epoch: 77, train_loss: 0.3428, test_loss: 1.2397, test_f1: 0.6290
 epoch: 78, train_loss: 0.3370, test_loss: 1.1490, test_f1: 0.6388
 epoch: 79, train_loss: 0.3300, test_loss: 1.1919, test_f1: 0.6527
 epoch: 80, train_loss: 0.3273, test_loss: 1.1794, test_f1: 0.6402
 epoch: 81, train_loss: 0.3369, test_loss: 1.3721, test_f1: 0.6208
 epoch: 82, train_loss: 0.3152, test_loss: 1.3298, test_f1: 0.6489
 epoch: 83, train_loss: 0.3209, test_loss: 1.2992, test_f1: 0.6403
 epoch: 84, train_loss: 0.3043, test_loss: 1.2878, test_f1: 0.6389
 epoch: 85, train_loss: 0.3110, test_loss: 1.2503, test_f1: 0.6409
 epoch: 86, train_loss: 0.3068, test_loss: 1.2782, test_f1: 0.6312
 epoch: 87, train_loss: 0.3014, test_loss: 1.2314, test_f1: 0.6650
 epoch: 88, train_loss: 0.3031, test_loss: 1.3617, test_f1: 0.6237
 epoch: 89, train_loss: 0.3032, test_loss: 1.2450, test_f1: 0.6697
 epoch: 90, train_loss: 0.2936, test_loss: 1.2296, test_f1: 0.6449
 epoch: 91, train_loss: 0.2846, test_loss: 1.2926, test_f1: 0.6605
 epoch: 92, train_loss: 0.3043, test_loss: 1.4018, test_f1: 0.6320
 epoch: 93, train_loss: 0.2961, test_loss: 1.3350, test_f1: 0.6333
 epoch: 94, train_loss: 0.2819, test_loss: 1.3235, test_f1: 0.6745
 epoch: 95, train_loss: 0.2765, test_loss: 1.2793, test_f1: 0.6352
 epoch: 96, train_loss: 0.2741, test_loss: 1.3936, test_f1: 0.6486
 epoch: 97, train_loss: 0.2917, test_loss: 1.4128, test_f1: 0.6428
 epoch: 98, train_loss: 0.2617, test_loss: 1.4360, test_f1: 0.6340
 epoch: 99, train_loss: 0.2587, test_loss: 1.4125, test_f1: 0.6334

Training completed in 546.27 seconds
Best F1: 0.7077 at epoch 98
Mean F1 across iterations: 0.6853  0.0119
========================FINAL RESULTS================================
FEGIN weighted F1: 0.7077  0.0119
python main.py --data ltspice_examples --representation component_pin --model FEGIN --layers 5 --hiddens 64 --batch_size 128 --lr 0.001 --emb_size 250 --epochs 100 --save_appendix component_pin_L5_H64_BS128_LR0.001_E250 --no_val
-----



STDERR:
  File "main.py", line 370, in <module>
    main()
  File "main.py", line 254, in main
    dataset = dataset_class(
  File "/home/philip/projects/ltspice_examples_code_repo/Circuit-Completion-Using-GNNs/component_classification_with_link_prediction_head/evaluation/FEGIN/kernel/circuit_datasets.py", line 15, in __init__
    self.data, self.slices = torch.load(self.processed_paths[0])
  File "/home/philip/.local/lib/python3.8/site-packages/torch/serialization.py", line 1040, in load
    warnings.warn(
  File "/usr/lib/python3.8/warnings.py", line 109, in _showwarnmsg
    sw(msg.message, msg.category, msg.filename, msg.lineno,
  File "main.py", line 47, in warn_with_traceback
    traceback.print_stack(file=log)
/home/philip/projects/ltspice_examples_code_repo/Circuit-Completion-Using-GNNs/component_classification_with_link_prediction_head/evaluation/FEGIN/kernel/circuit_datasets.py:15: FutureWarning: You are using `torch.load` with `weights_only=False` (the current default value), which uses the default pickle module implicitly. It is possible to construct malicious pickle data which will execute arbitrary code during unpickling (See https://github.com/pytorch/pytorch/blob/main/SECURITY.md#untrusted-models for more details). In a future release, the default value for `weights_only` will be flipped to `True`. This limits the functions that could be executed during unpickling. Arbitrary objects will no longer be allowed to be loaded via this mode unless they are explicitly allowlisted by the user via `torch.serialization.add_safe_globals`. We recommend you start setting `weights_only=True` for any use case where you don't have full control of the loaded file. Please open an issue on GitHub for any issues related to this experimental feature.
  self.data, self.slices = torch.load(self.processed_paths[0])
