STDOUT:
Results will be saved in /home/philip/projects/ltspice_examples_code_repo/Circuit-Completion-Using-GNNs/component_classification_with_link_prediction_head/evaluation/FEGIN/results/model_FEGIN_dataset_ltspice_demos
Command line input: python main.py --data ltspice_demos --representation component_net --model FEGIN --layers 5 --hiddens 32 --batch_size 64 --lr 0.01 --emb_size 512 --epochs 100 --save_appendix component_net_L5_H32_BS64_LR0.01_E512 --no_val
 is saved.
-----
ltspice_demos - FEGIN
Using 5 layers, 32 hidden units, h = 2
Loading component_net representation dataset
ENTERED
Training FEGIN on component_net representation
Train: 1565, Test: 383
##################ITERATION #0 ****************************************
 epoch: 0, train_loss: 1.2309, test_loss: 1.5917, test_f1: 0.1491
 epoch: 1, train_loss: 1.1064, test_loss: 1.2252, test_f1: 0.4051
 epoch: 2, train_loss: 1.0470, test_loss: 1.1370, test_f1: 0.4354
 epoch: 3, train_loss: 1.0029, test_loss: 1.2150, test_f1: 0.4095
 epoch: 4, train_loss: 1.0304, test_loss: 1.1715, test_f1: 0.5070
 epoch: 5, train_loss: 0.9742, test_loss: 1.0232, test_f1: 0.5218
 epoch: 6, train_loss: 0.9805, test_loss: 1.0526, test_f1: 0.4564
 epoch: 7, train_loss: 0.9497, test_loss: 1.0256, test_f1: 0.4889
 epoch: 8, train_loss: 0.9366, test_loss: 1.0743, test_f1: 0.4257
 epoch: 9, train_loss: 0.9289, test_loss: 1.0301, test_f1: 0.3946
 epoch: 10, train_loss: 0.9237, test_loss: 1.0231, test_f1: 0.5243
 epoch: 11, train_loss: 0.9233, test_loss: 1.1276, test_f1: 0.5204
 epoch: 12, train_loss: 0.9150, test_loss: 0.9972, test_f1: 0.5276
 epoch: 13, train_loss: 0.8989, test_loss: 1.1013, test_f1: 0.5391
 epoch: 14, train_loss: 0.9053, test_loss: 1.0510, test_f1: 0.5052
 epoch: 15, train_loss: 0.8995, test_loss: 1.0234, test_f1: 0.4165
 epoch: 16, train_loss: 0.9016, test_loss: 1.1085, test_f1: 0.4395
 epoch: 17, train_loss: 0.8643, test_loss: 1.0093, test_f1: 0.5429
 epoch: 18, train_loss: 0.8629, test_loss: 1.0422, test_f1: 0.5678
 epoch: 19, train_loss: 0.8606, test_loss: 1.1604, test_f1: 0.4471
 epoch: 20, train_loss: 0.8549, test_loss: 1.1928, test_f1: 0.5279
 epoch: 21, train_loss: 0.8807, test_loss: 1.0891, test_f1: 0.4892
 epoch: 22, train_loss: 0.8728, test_loss: 1.1043, test_f1: 0.5246
 epoch: 23, train_loss: 0.8552, test_loss: 1.1512, test_f1: 0.5326
 epoch: 24, train_loss: 0.8446, test_loss: 1.2602, test_f1: 0.5501
 epoch: 25, train_loss: 0.8287, test_loss: 1.1329, test_f1: 0.5689
 epoch: 26, train_loss: 0.8181, test_loss: 1.1864, test_f1: 0.5781
 epoch: 27, train_loss: 0.8095, test_loss: 1.2116, test_f1: 0.5370
 epoch: 28, train_loss: 0.7937, test_loss: 1.1742, test_f1: 0.5578
 epoch: 29, train_loss: 0.8499, test_loss: 1.3894, test_f1: 0.4801
 epoch: 30, train_loss: 0.8506, test_loss: 1.0385, test_f1: 0.6107
 epoch: 31, train_loss: 0.7824, test_loss: 1.3568, test_f1: 0.4387
 epoch: 32, train_loss: 0.8064, test_loss: 1.1640, test_f1: 0.4675
 epoch: 33, train_loss: 0.8099, test_loss: 1.1529, test_f1: 0.5792
 epoch: 34, train_loss: 0.7785, test_loss: 1.2452, test_f1: 0.5552
 epoch: 35, train_loss: 0.7501, test_loss: 1.5204, test_f1: 0.5274
 epoch: 36, train_loss: 0.8003, test_loss: 1.3711, test_f1: 0.4362
 epoch: 37, train_loss: 0.8009, test_loss: 1.0738, test_f1: 0.5510
 epoch: 38, train_loss: 0.7743, test_loss: 1.1079, test_f1: 0.5382
 epoch: 39, train_loss: 0.7632, test_loss: 1.1423, test_f1: 0.5033
 epoch: 40, train_loss: 0.7230, test_loss: 1.3021, test_f1: 0.5509
 epoch: 41, train_loss: 0.7690, test_loss: 1.3248, test_f1: 0.4969
 epoch: 42, train_loss: 0.7407, test_loss: 1.3158, test_f1: 0.5246
 epoch: 43, train_loss: 0.7458, test_loss: 1.3050, test_f1: 0.5383
 epoch: 44, train_loss: 0.7396, test_loss: 1.1516, test_f1: 0.5472
 epoch: 45, train_loss: 0.7352, test_loss: 1.9783, test_f1: 0.4560
 epoch: 46, train_loss: 0.7501, test_loss: 1.1236, test_f1: 0.4935
 epoch: 47, train_loss: 0.7757, test_loss: 1.2035, test_f1: 0.5748
 epoch: 48, train_loss: 0.7101, test_loss: 1.2437, test_f1: 0.5800
 epoch: 49, train_loss: 0.7065, test_loss: 1.3257, test_f1: 0.5619
 epoch: 50, train_loss: 0.6943, test_loss: 1.3307, test_f1: 0.5538
 epoch: 51, train_loss: 0.6905, test_loss: 1.2018, test_f1: 0.5727
 epoch: 52, train_loss: 0.6611, test_loss: 1.2547, test_f1: 0.5789
 epoch: 53, train_loss: 0.6190, test_loss: 1.2642, test_f1: 0.5856
 epoch: 54, train_loss: 0.6340, test_loss: 1.3050, test_f1: 0.5415
 epoch: 55, train_loss: 0.6317, test_loss: 1.3746, test_f1: 0.5755
 epoch: 56, train_loss: 0.6285, test_loss: 1.2768, test_f1: 0.5913
 epoch: 57, train_loss: 0.6052, test_loss: 1.5390, test_f1: 0.5168
 epoch: 58, train_loss: 0.6051, test_loss: 1.4123, test_f1: 0.5687
 epoch: 59, train_loss: 0.6088, test_loss: 1.3122, test_f1: 0.5783
 epoch: 60, train_loss: 0.6033, test_loss: 1.4672, test_f1: 0.5687
 epoch: 61, train_loss: 0.6018, test_loss: 1.5250, test_f1: 0.5920
 epoch: 62, train_loss: 0.6282, test_loss: 1.4312, test_f1: 0.5585
 epoch: 63, train_loss: 0.6067, test_loss: 1.3193, test_f1: 0.5568
 epoch: 64, train_loss: 0.5977, test_loss: 1.4682, test_f1: 0.5707
 epoch: 65, train_loss: 0.5922, test_loss: 1.5247, test_f1: 0.5331
 epoch: 66, train_loss: 0.5756, test_loss: 1.4934, test_f1: 0.5554
 epoch: 67, train_loss: 0.5995, test_loss: 1.5227, test_f1: 0.5361
 epoch: 68, train_loss: 0.6349, test_loss: 1.3271, test_f1: 0.5657
 epoch: 69, train_loss: 0.5715, test_loss: 1.5451, test_f1: 0.5313
 epoch: 70, train_loss: 0.5828, test_loss: 1.5586, test_f1: 0.5265
 epoch: 71, train_loss: 0.5926, test_loss: 1.5732, test_f1: 0.5671
 epoch: 72, train_loss: 0.6170, test_loss: 1.5296, test_f1: 0.5264
 epoch: 73, train_loss: 0.5837, test_loss: 1.6206, test_f1: 0.5333
 epoch: 74, train_loss: 0.5948, test_loss: 1.5927, test_f1: 0.5712
 epoch: 75, train_loss: 0.5543, test_loss: 1.6656, test_f1: 0.5411
 epoch: 76, train_loss: 0.5544, test_loss: 1.6084, test_f1: 0.5257
 epoch: 77, train_loss: 0.5727, test_loss: 1.4522, test_f1: 0.5284
 epoch: 78, train_loss: 0.5642, test_loss: 1.6097, test_f1: 0.5640
 epoch: 79, train_loss: 0.5642, test_loss: 1.5419, test_f1: 0.5311
 epoch: 80, train_loss: 0.5360, test_loss: 1.5918, test_f1: 0.5785
 epoch: 81, train_loss: 0.5374, test_loss: 1.7977, test_f1: 0.5262
 epoch: 82, train_loss: 0.5595, test_loss: 1.5931, test_f1: 0.5748
 epoch: 83, train_loss: 0.5567, test_loss: 1.8522, test_f1: 0.5705
 epoch: 84, train_loss: 0.5491, test_loss: 1.6453, test_f1: 0.5506
 epoch: 85, train_loss: 0.5518, test_loss: 1.9188, test_f1: 0.5552
 epoch: 86, train_loss: 0.5266, test_loss: 1.6014, test_f1: 0.5400
 epoch: 87, train_loss: 0.5333, test_loss: 1.7397, test_f1: 0.5572
 epoch: 88, train_loss: 0.5426, test_loss: 1.7998, test_f1: 0.5609
 epoch: 89, train_loss: 0.5470, test_loss: 1.7623, test_f1: 0.5705
 epoch: 90, train_loss: 0.5425, test_loss: 1.6040, test_f1: 0.5531
 epoch: 91, train_loss: 0.5583, test_loss: 1.7116, test_f1: 0.5563
 epoch: 92, train_loss: 0.5406, test_loss: 1.7303, test_f1: 0.5585
 epoch: 93, train_loss: 0.5254, test_loss: 1.6593, test_f1: 0.5339
 epoch: 94, train_loss: 0.5111, test_loss: 1.7936, test_f1: 0.5507
 epoch: 95, train_loss: 0.5320, test_loss: 1.9805, test_f1: 0.5353
 epoch: 96, train_loss: 0.5202, test_loss: 1.6716, test_f1: 0.5466
 epoch: 97, train_loss: 0.5543, test_loss: 1.7097, test_f1: 0.5492
 epoch: 98, train_loss: 0.4840, test_loss: 1.8184, test_f1: 0.5515
 epoch: 99, train_loss: 0.4958, test_loss: 1.9190, test_f1: 0.5332
##################ITERATION #1 ****************************************
 epoch: 0, train_loss: 1.1993, test_loss: 1.2551, test_f1: 0.2281
 epoch: 1, train_loss: 1.0638, test_loss: 1.1225, test_f1: 0.5020
 epoch: 2, train_loss: 1.0076, test_loss: 1.0731, test_f1: 0.4798
 epoch: 3, train_loss: 0.9893, test_loss: 1.0610, test_f1: 0.5099
 epoch: 4, train_loss: 0.9507, test_loss: 1.0783, test_f1: 0.5012
 epoch: 5, train_loss: 0.9549, test_loss: 1.0955, test_f1: 0.5351
 epoch: 6, train_loss: 0.9231, test_loss: 1.2023, test_f1: 0.4635
 epoch: 7, train_loss: 0.9245, test_loss: 1.0932, test_f1: 0.4375
 epoch: 8, train_loss: 0.9091, test_loss: 1.1496, test_f1: 0.4915
 epoch: 9, train_loss: 0.9010, test_loss: 1.1057, test_f1: 0.5499
 epoch: 10, train_loss: 0.9066, test_loss: 1.0876, test_f1: 0.4998
 epoch: 11, train_loss: 0.8746, test_loss: 1.1436, test_f1: 0.5520
 epoch: 12, train_loss: 0.8600, test_loss: 1.4374, test_f1: 0.4241
 epoch: 13, train_loss: 0.8751, test_loss: 1.0704, test_f1: 0.6058
 epoch: 14, train_loss: 0.8472, test_loss: 1.0346, test_f1: 0.5738
 epoch: 15, train_loss: 0.8209, test_loss: 1.1759, test_f1: 0.5121
 epoch: 16, train_loss: 0.8427, test_loss: 1.1644, test_f1: 0.5230
 epoch: 17, train_loss: 0.8225, test_loss: 1.1152, test_f1: 0.5170
 epoch: 18, train_loss: 0.8251, test_loss: 1.3206, test_f1: 0.4963
 epoch: 19, train_loss: 0.8113, test_loss: 1.1549, test_f1: 0.5457
 epoch: 20, train_loss: 0.7823, test_loss: 1.0099, test_f1: 0.5337
 epoch: 21, train_loss: 0.7985, test_loss: 1.1700, test_f1: 0.5372
 epoch: 22, train_loss: 0.8138, test_loss: 1.1519, test_f1: 0.5626
 epoch: 23, train_loss: 0.8098, test_loss: 1.0403, test_f1: 0.6008
 epoch: 24, train_loss: 0.7598, test_loss: 1.2382, test_f1: 0.5379
 epoch: 25, train_loss: 0.7850, test_loss: 1.0511, test_f1: 0.5931
 epoch: 26, train_loss: 0.7363, test_loss: 1.1176, test_f1: 0.5927
 epoch: 27, train_loss: 0.7390, test_loss: 1.2570, test_f1: 0.6050
 epoch: 28, train_loss: 0.7351, test_loss: 1.0496, test_f1: 0.5511
 epoch: 29, train_loss: 0.7429, test_loss: 1.1085, test_f1: 0.5643
 epoch: 30, train_loss: 0.7476, test_loss: 1.2266, test_f1: 0.4703
 epoch: 31, train_loss: 0.7424, test_loss: 1.1036, test_f1: 0.5618
 epoch: 32, train_loss: 0.7323, test_loss: 1.1974, test_f1: 0.5853
 epoch: 33, train_loss: 0.7229, test_loss: 1.2078, test_f1: 0.5079
 epoch: 34, train_loss: 0.7511, test_loss: 1.1540, test_f1: 0.5387
 epoch: 35, train_loss: 0.7192, test_loss: 1.2095, test_f1: 0.5940
 epoch: 36, train_loss: 0.6893, test_loss: 1.3965, test_f1: 0.4819
 epoch: 37, train_loss: 0.7148, test_loss: 1.1080, test_f1: 0.5656
 epoch: 38, train_loss: 0.7257, test_loss: 1.1162, test_f1: 0.5734
 epoch: 39, train_loss: 0.7180, test_loss: 1.2359, test_f1: 0.5161
 epoch: 40, train_loss: 0.6888, test_loss: 1.0780, test_f1: 0.5993
 epoch: 41, train_loss: 0.7027, test_loss: 1.3006, test_f1: 0.5114
 epoch: 42, train_loss: 0.6878, test_loss: 1.3924, test_f1: 0.5658
 epoch: 43, train_loss: 0.6800, test_loss: 1.1480, test_f1: 0.6081
 epoch: 44, train_loss: 0.6631, test_loss: 1.3744, test_f1: 0.5638
 epoch: 45, train_loss: 0.6829, test_loss: 1.3984, test_f1: 0.5384
 epoch: 46, train_loss: 0.6873, test_loss: 1.1852, test_f1: 0.5814
 epoch: 47, train_loss: 0.6849, test_loss: 1.5110, test_f1: 0.5875
 epoch: 48, train_loss: 0.6911, test_loss: 1.2519, test_f1: 0.5562
 epoch: 49, train_loss: 0.6458, test_loss: 1.3288, test_f1: 0.5439
 epoch: 50, train_loss: 0.6375, test_loss: 1.4295, test_f1: 0.5668
 epoch: 51, train_loss: 0.6344, test_loss: 1.1701, test_f1: 0.6339
 epoch: 52, train_loss: 0.5883, test_loss: 1.2729, test_f1: 0.5944
 epoch: 53, train_loss: 0.5921, test_loss: 1.4556, test_f1: 0.5762
 epoch: 54, train_loss: 0.5721, test_loss: 1.4873, test_f1: 0.5753
 epoch: 55, train_loss: 0.5876, test_loss: 1.3975, test_f1: 0.6002
 epoch: 56, train_loss: 0.5847, test_loss: 1.2742, test_f1: 0.6157
 epoch: 57, train_loss: 0.5603, test_loss: 1.4826, test_f1: 0.5896
 epoch: 58, train_loss: 0.5355, test_loss: 1.4794, test_f1: 0.6286
 epoch: 59, train_loss: 0.5502, test_loss: 1.6056, test_f1: 0.5454
 epoch: 60, train_loss: 0.5571, test_loss: 1.6401, test_f1: 0.5497
 epoch: 61, train_loss: 0.5641, test_loss: 1.3667, test_f1: 0.6083
 epoch: 62, train_loss: 0.5330, test_loss: 1.4837, test_f1: 0.5850
 epoch: 63, train_loss: 0.5170, test_loss: 1.5425, test_f1: 0.5614
 epoch: 64, train_loss: 0.5338, test_loss: 1.5057, test_f1: 0.6025
 epoch: 65, train_loss: 0.5283, test_loss: 1.4202, test_f1: 0.5829
 epoch: 66, train_loss: 0.5611, test_loss: 1.4834, test_f1: 0.5573
 epoch: 67, train_loss: 0.5564, test_loss: 1.5772, test_f1: 0.6082
 epoch: 68, train_loss: 0.5433, test_loss: 1.2875, test_f1: 0.5986
 epoch: 69, train_loss: 0.5186, test_loss: 1.4590, test_f1: 0.6153
 epoch: 70, train_loss: 0.5123, test_loss: 1.5058, test_f1: 0.5853
 epoch: 71, train_loss: 0.5311, test_loss: 1.3357, test_f1: 0.6272
 epoch: 72, train_loss: 0.5263, test_loss: 1.5248, test_f1: 0.6079
 epoch: 73, train_loss: 0.5136, test_loss: 1.5782, test_f1: 0.5643
 epoch: 74, train_loss: 0.4956, test_loss: 1.3472, test_f1: 0.6256
 epoch: 75, train_loss: 0.4951, test_loss: 1.6499, test_f1: 0.5534
 epoch: 76, train_loss: 0.4909, test_loss: 1.3285, test_f1: 0.6175
 epoch: 77, train_loss: 0.4961, test_loss: 1.5077, test_f1: 0.6167
 epoch: 78, train_loss: 0.5023, test_loss: 1.6789, test_f1: 0.5794
 epoch: 79, train_loss: 0.5127, test_loss: 1.4458, test_f1: 0.5572
 epoch: 80, train_loss: 0.4856, test_loss: 1.7742, test_f1: 0.5869
 epoch: 81, train_loss: 0.4985, test_loss: 1.7790, test_f1: 0.5761
 epoch: 82, train_loss: 0.5182, test_loss: 1.8771, test_f1: 0.5601
 epoch: 83, train_loss: 0.5391, test_loss: 1.4818, test_f1: 0.5858
 epoch: 84, train_loss: 0.4730, test_loss: 1.7280, test_f1: 0.5553
 epoch: 85, train_loss: 0.4659, test_loss: 2.2123, test_f1: 0.5562
 epoch: 86, train_loss: 0.4881, test_loss: 1.9294, test_f1: 0.5469
 epoch: 87, train_loss: 0.4824, test_loss: 1.7593, test_f1: 0.5959
 epoch: 88, train_loss: 0.4747, test_loss: 2.3473, test_f1: 0.5562
 epoch: 89, train_loss: 0.4660, test_loss: 2.6438, test_f1: 0.6150
 epoch: 90, train_loss: 0.4514, test_loss: 1.7472, test_f1: 0.5703
 epoch: 91, train_loss: 0.4746, test_loss: 1.6847, test_f1: 0.5963
 epoch: 92, train_loss: 0.4508, test_loss: 2.0778, test_f1: 0.5370
 epoch: 93, train_loss: 0.4850, test_loss: 1.8482, test_f1: 0.5903
 epoch: 94, train_loss: 0.4532, test_loss: 1.8574, test_f1: 0.5699
 epoch: 95, train_loss: 0.4408, test_loss: 1.9716, test_f1: 0.5886
 epoch: 96, train_loss: 0.4327, test_loss: 1.8019, test_f1: 0.5374
 epoch: 97, train_loss: 0.4369, test_loss: 1.9275, test_f1: 0.5872
 epoch: 98, train_loss: 0.4291, test_loss: 2.1481, test_f1: 0.5915
 epoch: 99, train_loss: 0.4480, test_loss: 2.1907, test_f1: 0.6019
##################ITERATION #2 ****************************************
 epoch: 0, train_loss: 1.2305, test_loss: 1.3764, test_f1: 0.3022
 epoch: 1, train_loss: 1.0938, test_loss: 1.1529, test_f1: 0.4913
 epoch: 2, train_loss: 1.0475, test_loss: 1.1209, test_f1: 0.4526
 epoch: 3, train_loss: 1.0058, test_loss: 1.1122, test_f1: 0.4527
 epoch: 4, train_loss: 0.9855, test_loss: 1.0487, test_f1: 0.4876
 epoch: 5, train_loss: 0.9781, test_loss: 1.1472, test_f1: 0.4433
 epoch: 6, train_loss: 0.9565, test_loss: 1.0321, test_f1: 0.5182
 epoch: 7, train_loss: 0.9695, test_loss: 1.0567, test_f1: 0.4317
 epoch: 8, train_loss: 0.9730, test_loss: 1.1297, test_f1: 0.4651
 epoch: 9, train_loss: 0.9428, test_loss: 1.1242, test_f1: 0.4583
 epoch: 10, train_loss: 0.9267, test_loss: 1.0082, test_f1: 0.5327
 epoch: 11, train_loss: 0.9128, test_loss: 1.0831, test_f1: 0.4959
 epoch: 12, train_loss: 0.9022, test_loss: 1.0536, test_f1: 0.5354
 epoch: 13, train_loss: 0.8938, test_loss: 1.0669, test_f1: 0.5257
 epoch: 14, train_loss: 0.8653, test_loss: 1.1211, test_f1: 0.4692
 epoch: 15, train_loss: 0.8732, test_loss: 0.9811, test_f1: 0.5760
 epoch: 16, train_loss: 0.8950, test_loss: 1.1076, test_f1: 0.5089
 epoch: 17, train_loss: 0.8669, test_loss: 1.0651, test_f1: 0.5452
 epoch: 18, train_loss: 0.8644, test_loss: 1.1190, test_f1: 0.5668
 epoch: 19, train_loss: 0.8450, test_loss: 1.0644, test_f1: 0.5899
 epoch: 20, train_loss: 0.8285, test_loss: 1.1807, test_f1: 0.5083
 epoch: 21, train_loss: 0.8278, test_loss: 1.4758, test_f1: 0.4308
 epoch: 22, train_loss: 0.8320, test_loss: 1.0420, test_f1: 0.5120
 epoch: 23, train_loss: 0.7905, test_loss: 1.1669, test_f1: 0.5606
 epoch: 24, train_loss: 0.8165, test_loss: 0.9976, test_f1: 0.5542
 epoch: 25, train_loss: 0.8007, test_loss: 1.1864, test_f1: 0.5514
 epoch: 26, train_loss: 0.7737, test_loss: 1.0550, test_f1: 0.5660
 epoch: 27, train_loss: 0.7832, test_loss: 1.0453, test_f1: 0.5673
 epoch: 28, train_loss: 0.7790, test_loss: 1.0553, test_f1: 0.5921
 epoch: 29, train_loss: 0.7657, test_loss: 1.1125, test_f1: 0.5704
 epoch: 30, train_loss: 0.7535, test_loss: 1.2558, test_f1: 0.5462
 epoch: 31, train_loss: 0.7547, test_loss: 1.1703, test_f1: 0.5274
 epoch: 32, train_loss: 0.7719, test_loss: 1.0820, test_f1: 0.5601
 epoch: 33, train_loss: 0.7454, test_loss: 1.2687, test_f1: 0.5348
 epoch: 34, train_loss: 0.7427, test_loss: 1.1384, test_f1: 0.5475
 epoch: 35, train_loss: 0.7375, test_loss: 1.2541, test_f1: 0.5559
 epoch: 36, train_loss: 0.7763, test_loss: 1.0966, test_f1: 0.5559
 epoch: 37, train_loss: 0.7664, test_loss: 1.1471, test_f1: 0.5518
 epoch: 38, train_loss: 0.7394, test_loss: 1.1036, test_f1: 0.5816
 epoch: 39, train_loss: 0.7537, test_loss: 1.1162, test_f1: 0.5420
 epoch: 40, train_loss: 0.7205, test_loss: 1.2052, test_f1: 0.5690
 epoch: 41, train_loss: 0.6914, test_loss: 1.0947, test_f1: 0.5436
 epoch: 42, train_loss: 0.7143, test_loss: 1.2743, test_f1: 0.5613
 epoch: 43, train_loss: 0.6936, test_loss: 1.1751, test_f1: 0.5388
 epoch: 44, train_loss: 0.6974, test_loss: 1.1691, test_f1: 0.5463
 epoch: 45, train_loss: 0.6873, test_loss: 1.2020, test_f1: 0.5580
 epoch: 46, train_loss: 0.6826, test_loss: 1.2273, test_f1: 0.5493
 epoch: 47, train_loss: 0.6764, test_loss: 1.2127, test_f1: 0.5527
 epoch: 48, train_loss: 0.6998, test_loss: 1.1321, test_f1: 0.5807
 epoch: 49, train_loss: 0.6423, test_loss: 1.2275, test_f1: 0.6011
 epoch: 50, train_loss: 0.6797, test_loss: 1.1857, test_f1: 0.5959
 epoch: 51, train_loss: 0.6478, test_loss: 1.2007, test_f1: 0.5590
 epoch: 52, train_loss: 0.6123, test_loss: 1.4108, test_f1: 0.5679
 epoch: 53, train_loss: 0.6057, test_loss: 1.2359, test_f1: 0.6097
 epoch: 54, train_loss: 0.6112, test_loss: 1.2634, test_f1: 0.6062
 epoch: 55, train_loss: 0.5894, test_loss: 1.4656, test_f1: 0.5186
 epoch: 56, train_loss: 0.6252, test_loss: 1.2131, test_f1: 0.6029
 epoch: 57, train_loss: 0.5749, test_loss: 1.3450, test_f1: 0.5762
 epoch: 58, train_loss: 0.5687, test_loss: 1.3425, test_f1: 0.6111
 epoch: 59, train_loss: 0.5706, test_loss: 1.4077, test_f1: 0.6153
 epoch: 60, train_loss: 0.5595, test_loss: 1.4377, test_f1: 0.6197
 epoch: 61, train_loss: 0.5745, test_loss: 1.4372, test_f1: 0.6143
 epoch: 62, train_loss: 0.5660, test_loss: 1.4759, test_f1: 0.5755
 epoch: 63, train_loss: 0.5969, test_loss: 1.3812, test_f1: 0.5675
 epoch: 64, train_loss: 0.5755, test_loss: 1.3493, test_f1: 0.6279
 epoch: 65, train_loss: 0.5442, test_loss: 1.4692, test_f1: 0.6303
 epoch: 66, train_loss: 0.5464, test_loss: 1.3013, test_f1: 0.5885
 epoch: 67, train_loss: 0.5588, test_loss: 1.4978, test_f1: 0.6422
 epoch: 68, train_loss: 0.5510, test_loss: 1.5283, test_f1: 0.6309
 epoch: 69, train_loss: 0.5616, test_loss: 1.4596, test_f1: 0.6173
 epoch: 70, train_loss: 0.5306, test_loss: 1.4969, test_f1: 0.5977
 epoch: 71, train_loss: 0.5354, test_loss: 1.5349, test_f1: 0.6125
 epoch: 72, train_loss: 0.5270, test_loss: 1.5426, test_f1: 0.6105
 epoch: 73, train_loss: 0.5531, test_loss: 1.4899, test_f1: 0.6516
 epoch: 74, train_loss: 0.5520, test_loss: 1.4955, test_f1: 0.6241
 epoch: 75, train_loss: 0.5092, test_loss: 1.5207, test_f1: 0.6282
 epoch: 76, train_loss: 0.5018, test_loss: 1.6953, test_f1: 0.5889
 epoch: 77, train_loss: 0.5119, test_loss: 1.6131, test_f1: 0.6105
 epoch: 78, train_loss: 0.5427, test_loss: 1.5106, test_f1: 0.6179
 epoch: 79, train_loss: 0.5363, test_loss: 1.4692, test_f1: 0.6165
 epoch: 80, train_loss: 0.5115, test_loss: 1.5202, test_f1: 0.6046
 epoch: 81, train_loss: 0.5052, test_loss: 1.5806, test_f1: 0.6249
 epoch: 82, train_loss: 0.5204, test_loss: 1.5903, test_f1: 0.6079
 epoch: 83, train_loss: 0.5321, test_loss: 1.4633, test_f1: 0.6186
 epoch: 84, train_loss: 0.4995, test_loss: 1.5586, test_f1: 0.6181
 epoch: 85, train_loss: 0.5117, test_loss: 1.5323, test_f1: 0.6059
 epoch: 86, train_loss: 0.4756, test_loss: 1.5541, test_f1: 0.5880
 epoch: 87, train_loss: 0.5234, test_loss: 1.6090, test_f1: 0.5919
 epoch: 88, train_loss: 0.4958, test_loss: 1.6823, test_f1: 0.6483
 epoch: 89, train_loss: 0.4712, test_loss: 1.6317, test_f1: 0.6186
 epoch: 90, train_loss: 0.4920, test_loss: 1.5559, test_f1: 0.6152
 epoch: 91, train_loss: 0.5238, test_loss: 1.6898, test_f1: 0.6166
 epoch: 92, train_loss: 0.5194, test_loss: 1.6905, test_f1: 0.5729
 epoch: 93, train_loss: 0.4988, test_loss: 1.6009, test_f1: 0.6448
 epoch: 94, train_loss: 0.4748, test_loss: 1.5391, test_f1: 0.6214
 epoch: 95, train_loss: 0.4753, test_loss: 1.6539, test_f1: 0.5893
 epoch: 96, train_loss: 0.4661, test_loss: 1.5844, test_f1: 0.6327
 epoch: 97, train_loss: 0.4486, test_loss: 1.7993, test_f1: 0.5772
 epoch: 98, train_loss: 0.4456, test_loss: 1.9040, test_f1: 0.6303
 epoch: 99, train_loss: 0.4935, test_loss: 1.8615, test_f1: 0.5983
##################ITERATION #3 ****************************************
 epoch: 0, train_loss: 1.2687, test_loss: 1.2235, test_f1: 0.3027
 epoch: 1, train_loss: 1.1243, test_loss: 1.1440, test_f1: 0.3803
 epoch: 2, train_loss: 1.0928, test_loss: 1.2050, test_f1: 0.4001
 epoch: 3, train_loss: 1.0519, test_loss: 1.0960, test_f1: 0.4102
 epoch: 4, train_loss: 1.0151, test_loss: 1.1133, test_f1: 0.5198
 epoch: 5, train_loss: 0.9861, test_loss: 1.0946, test_f1: 0.4560
 epoch: 6, train_loss: 0.9843, test_loss: 1.1157, test_f1: 0.4660
 epoch: 7, train_loss: 0.9663, test_loss: 1.1065, test_f1: 0.5240
 epoch: 8, train_loss: 0.9460, test_loss: 1.1317, test_f1: 0.4806
 epoch: 9, train_loss: 0.9645, test_loss: 1.0157, test_f1: 0.5434
 epoch: 10, train_loss: 0.9363, test_loss: 1.1656, test_f1: 0.4974
 epoch: 11, train_loss: 0.9548, test_loss: 1.1103, test_f1: 0.4668
 epoch: 12, train_loss: 0.9381, test_loss: 1.0476, test_f1: 0.4972
 epoch: 13, train_loss: 0.9244, test_loss: 1.1200, test_f1: 0.4865
 epoch: 14, train_loss: 0.9176, test_loss: 1.2018, test_f1: 0.5177
 epoch: 15, train_loss: 0.9172, test_loss: 1.1614, test_f1: 0.5306
 epoch: 16, train_loss: 0.9071, test_loss: 1.0109, test_f1: 0.5442
 epoch: 17, train_loss: 0.8921, test_loss: 1.1173, test_f1: 0.5538
 epoch: 18, train_loss: 0.8687, test_loss: 1.1057, test_f1: 0.5356
 epoch: 19, train_loss: 0.8889, test_loss: 1.0822, test_f1: 0.5354
 epoch: 20, train_loss: 0.8778, test_loss: 1.1989, test_f1: 0.5051
 epoch: 21, train_loss: 0.8576, test_loss: 1.1163, test_f1: 0.4850
 epoch: 22, train_loss: 0.8415, test_loss: 1.2779, test_f1: 0.5207
 epoch: 23, train_loss: 0.8495, test_loss: 1.2426, test_f1: 0.4718
 epoch: 24, train_loss: 0.8433, test_loss: 1.1475, test_f1: 0.5671
 epoch: 25, train_loss: 0.8190, test_loss: 1.0917, test_f1: 0.5748
 epoch: 26, train_loss: 0.8051, test_loss: 1.1232, test_f1: 0.4883
 epoch: 27, train_loss: 0.8204, test_loss: 1.3105, test_f1: 0.4774
 epoch: 28, train_loss: 0.8189, test_loss: 1.1016, test_f1: 0.5500
 epoch: 29, train_loss: 0.8158, test_loss: 0.9792, test_f1: 0.5335
 epoch: 30, train_loss: 0.8091, test_loss: 1.0778, test_f1: 0.5721
 epoch: 31, train_loss: 0.7676, test_loss: 1.1946, test_f1: 0.5052
 epoch: 32, train_loss: 0.7759, test_loss: 0.9959, test_f1: 0.5960
 epoch: 33, train_loss: 0.7612, test_loss: 1.0471, test_f1: 0.5357
 epoch: 34, train_loss: 0.7659, test_loss: 1.1998, test_f1: 0.4412
 epoch: 35, train_loss: 0.7662, test_loss: 1.1917, test_f1: 0.4834
 epoch: 36, train_loss: 0.7826, test_loss: 1.0713, test_f1: 0.5503
 epoch: 37, train_loss: 0.7470, test_loss: 1.1485, test_f1: 0.5692
 epoch: 38, train_loss: 0.7178, test_loss: 1.1987, test_f1: 0.5790
 epoch: 39, train_loss: 0.7226, test_loss: 1.0578, test_f1: 0.5464
 epoch: 40, train_loss: 0.7032, test_loss: 1.5070, test_f1: 0.4642
 epoch: 41, train_loss: 0.7366, test_loss: 1.1291, test_f1: 0.5625
 epoch: 42, train_loss: 0.7259, test_loss: 1.3092, test_f1: 0.5335
 epoch: 43, train_loss: 0.7404, test_loss: 1.0876, test_f1: 0.5182
 epoch: 44, train_loss: 0.6866, test_loss: 1.1950, test_f1: 0.5161
 epoch: 45, train_loss: 0.7302, test_loss: 1.0321, test_f1: 0.5916
 epoch: 46, train_loss: 0.6993, test_loss: 1.1538, test_f1: 0.5710
 epoch: 47, train_loss: 0.7172, test_loss: 1.1961, test_f1: 0.5377
 epoch: 48, train_loss: 0.6948, test_loss: 1.0704, test_f1: 0.5831
 epoch: 49, train_loss: 0.6951, test_loss: 1.0589, test_f1: 0.5475
 epoch: 50, train_loss: 0.7029, test_loss: 1.2765, test_f1: 0.4996
 epoch: 51, train_loss: 0.6728, test_loss: 1.0856, test_f1: 0.6055
 epoch: 52, train_loss: 0.6511, test_loss: 1.1044, test_f1: 0.5786
 epoch: 53, train_loss: 0.6187, test_loss: 1.1740, test_f1: 0.5941
 epoch: 54, train_loss: 0.6136, test_loss: 1.1161, test_f1: 0.5981
 epoch: 55, train_loss: 0.6150, test_loss: 1.2707, test_f1: 0.5494
 epoch: 56, train_loss: 0.5987, test_loss: 1.2686, test_f1: 0.5914
 epoch: 57, train_loss: 0.6099, test_loss: 1.2228, test_f1: 0.6134
 epoch: 58, train_loss: 0.5934, test_loss: 1.0729, test_f1: 0.5935
 epoch: 59, train_loss: 0.5921, test_loss: 1.3704, test_f1: 0.5610
 epoch: 60, train_loss: 0.5972, test_loss: 1.2001, test_f1: 0.5930
 epoch: 61, train_loss: 0.5772, test_loss: 1.2404, test_f1: 0.5941
 epoch: 62, train_loss: 0.5823, test_loss: 1.3505, test_f1: 0.5798
 epoch: 63, train_loss: 0.5709, test_loss: 1.2267, test_f1: 0.5877
 epoch: 64, train_loss: 0.5795, test_loss: 1.3077, test_f1: 0.5907
 epoch: 65, train_loss: 0.5596, test_loss: 1.3477, test_f1: 0.5661
 epoch: 66, train_loss: 0.5540, test_loss: 1.2161, test_f1: 0.6008
 epoch: 67, train_loss: 0.5662, test_loss: 1.1327, test_f1: 0.5534
 epoch: 68, train_loss: 0.5889, test_loss: 1.1902, test_f1: 0.6062
 epoch: 69, train_loss: 0.6034, test_loss: 1.2121, test_f1: 0.6254
 epoch: 70, train_loss: 0.5723, test_loss: 1.2814, test_f1: 0.5718
 epoch: 71, train_loss: 0.5779, test_loss: 1.2189, test_f1: 0.6164
 epoch: 72, train_loss: 0.5687, test_loss: 1.3252, test_f1: 0.5563
 epoch: 73, train_loss: 0.5572, test_loss: 1.3960, test_f1: 0.5708
 epoch: 74, train_loss: 0.5529, test_loss: 1.2439, test_f1: 0.6184
 epoch: 75, train_loss: 0.5244, test_loss: 1.3452, test_f1: 0.5847
 epoch: 76, train_loss: 0.5345, test_loss: 1.2770, test_f1: 0.6481
 epoch: 77, train_loss: 0.5373, test_loss: 1.2954, test_f1: 0.6062
 epoch: 78, train_loss: 0.5429, test_loss: 1.2626, test_f1: 0.6428
 epoch: 79, train_loss: 0.5250, test_loss: 1.2816, test_f1: 0.6186
 epoch: 80, train_loss: 0.5145, test_loss: 1.2134, test_f1: 0.5937
 epoch: 81, train_loss: 0.5262, test_loss: 1.2857, test_f1: 0.5996
 epoch: 82, train_loss: 0.5255, test_loss: 1.4325, test_f1: 0.6166
 epoch: 83, train_loss: 0.5015, test_loss: 1.4624, test_f1: 0.5496
 epoch: 84, train_loss: 0.5236, test_loss: 1.1628, test_f1: 0.6376
 epoch: 85, train_loss: 0.5222, test_loss: 1.4708, test_f1: 0.5370
 epoch: 86, train_loss: 0.5407, test_loss: 1.2314, test_f1: 0.6330
 epoch: 87, train_loss: 0.5223, test_loss: 1.2327, test_f1: 0.6119
 epoch: 88, train_loss: 0.5113, test_loss: 1.2684, test_f1: 0.6327
 epoch: 89, train_loss: 0.5194, test_loss: 1.4742, test_f1: 0.5585
 epoch: 90, train_loss: 0.5186, test_loss: 1.4034, test_f1: 0.6226
 epoch: 91, train_loss: 0.4837, test_loss: 1.4116, test_f1: 0.6174
 epoch: 92, train_loss: 0.4793, test_loss: 1.4699, test_f1: 0.5881
 epoch: 93, train_loss: 0.4916, test_loss: 1.5589, test_f1: 0.5585
 epoch: 94, train_loss: 0.4862, test_loss: 1.4370, test_f1: 0.5748
 epoch: 95, train_loss: 0.4995, test_loss: 1.7010, test_f1: 0.6049
 epoch: 96, train_loss: 0.4824, test_loss: 1.4057, test_f1: 0.5932
 epoch: 97, train_loss: 0.4837, test_loss: 1.4680, test_f1: 0.5979
 epoch: 98, train_loss: 0.4846, test_loss: 1.3646, test_f1: 0.6078
 epoch: 99, train_loss: 0.4970, test_loss: 1.3434, test_f1: 0.6163
##################ITERATION #4 ****************************************
 epoch: 0, train_loss: 1.2298, test_loss: 1.3558, test_f1: 0.2504
 epoch: 1, train_loss: 1.0837, test_loss: 1.1262, test_f1: 0.4639
 epoch: 2, train_loss: 1.0236, test_loss: 1.1861, test_f1: 0.3899
 epoch: 3, train_loss: 1.0164, test_loss: 1.1102, test_f1: 0.4376
 epoch: 4, train_loss: 0.9892, test_loss: 1.0986, test_f1: 0.4735
 epoch: 5, train_loss: 0.9836, test_loss: 1.0711, test_f1: 0.4960
 epoch: 6, train_loss: 0.9497, test_loss: 1.0959, test_f1: 0.5240
 epoch: 7, train_loss: 0.9430, test_loss: 1.0348, test_f1: 0.4688
 epoch: 8, train_loss: 0.9542, test_loss: 1.0922, test_f1: 0.4558
 epoch: 9, train_loss: 0.9484, test_loss: 1.1298, test_f1: 0.4981
 epoch: 10, train_loss: 0.9280, test_loss: 1.0416, test_f1: 0.5135
 epoch: 11, train_loss: 0.9158, test_loss: 1.0338, test_f1: 0.5307
 epoch: 12, train_loss: 0.9042, test_loss: 1.1256, test_f1: 0.5114
 epoch: 13, train_loss: 0.9101, test_loss: 1.0188, test_f1: 0.5222
 epoch: 14, train_loss: 0.8951, test_loss: 1.1489, test_f1: 0.5464
 epoch: 15, train_loss: 0.8794, test_loss: 1.0225, test_f1: 0.5699
 epoch: 16, train_loss: 0.8862, test_loss: 1.0848, test_f1: 0.5331
 epoch: 17, train_loss: 0.8655, test_loss: 1.0563, test_f1: 0.5577
 epoch: 18, train_loss: 0.8803, test_loss: 0.9805, test_f1: 0.5693
 epoch: 19, train_loss: 0.8685, test_loss: 1.0391, test_f1: 0.5537
 epoch: 20, train_loss: 0.8432, test_loss: 1.0818, test_f1: 0.5559
 epoch: 21, train_loss: 0.8589, test_loss: 0.9804, test_f1: 0.5797
 epoch: 22, train_loss: 0.8511, test_loss: 1.0542, test_f1: 0.5640
 epoch: 23, train_loss: 0.8283, test_loss: 1.1384, test_f1: 0.5293
 epoch: 24, train_loss: 0.8169, test_loss: 1.1093, test_f1: 0.5784
 epoch: 25, train_loss: 0.8186, test_loss: 1.0873, test_f1: 0.5741
 epoch: 26, train_loss: 0.8145, test_loss: 1.1620, test_f1: 0.5562
 epoch: 27, train_loss: 0.8107, test_loss: 1.0308, test_f1: 0.6047
 epoch: 28, train_loss: 0.7839, test_loss: 1.0534, test_f1: 0.5796
 epoch: 29, train_loss: 0.7712, test_loss: 1.1387, test_f1: 0.5854
 epoch: 30, train_loss: 0.7653, test_loss: 1.0342, test_f1: 0.6014
 epoch: 31, train_loss: 0.7625, test_loss: 1.0863, test_f1: 0.5832
 epoch: 32, train_loss: 0.7294, test_loss: 1.1226, test_f1: 0.5959
 epoch: 33, train_loss: 0.7571, test_loss: 1.1626, test_f1: 0.5611
 epoch: 34, train_loss: 0.7584, test_loss: 1.0160, test_f1: 0.6264
 epoch: 35, train_loss: 0.7128, test_loss: 1.1314, test_f1: 0.6108
 epoch: 36, train_loss: 0.7179, test_loss: 1.0909, test_f1: 0.5800
 epoch: 37, train_loss: 0.7155, test_loss: 1.2468, test_f1: 0.5891
 epoch: 38, train_loss: 0.7105, test_loss: 1.1326, test_f1: 0.5620
 epoch: 39, train_loss: 0.7168, test_loss: 1.1070, test_f1: 0.6015
 epoch: 40, train_loss: 0.7132, test_loss: 1.0576, test_f1: 0.6292
 epoch: 41, train_loss: 0.7020, test_loss: 1.1236, test_f1: 0.5705
 epoch: 42, train_loss: 0.6885, test_loss: 1.0844, test_f1: 0.5960
 epoch: 43, train_loss: 0.6715, test_loss: 1.1638, test_f1: 0.5726
 epoch: 44, train_loss: 0.6820, test_loss: 1.2236, test_f1: 0.6195
 epoch: 45, train_loss: 0.7043, test_loss: 1.1106, test_f1: 0.6076
 epoch: 46, train_loss: 0.7271, test_loss: 1.0788, test_f1: 0.5378
 epoch: 47, train_loss: 0.6881, test_loss: 1.1322, test_f1: 0.5786
 epoch: 48, train_loss: 0.6839, test_loss: 1.1466, test_f1: 0.6054
 epoch: 49, train_loss: 0.6356, test_loss: 1.1134, test_f1: 0.5978
 epoch: 50, train_loss: 0.6663, test_loss: 1.1044, test_f1: 0.6364
 epoch: 51, train_loss: 0.6536, test_loss: 1.1882, test_f1: 0.6038
 epoch: 52, train_loss: 0.6166, test_loss: 1.1029, test_f1: 0.5753
 epoch: 53, train_loss: 0.5949, test_loss: 1.0467, test_f1: 0.6118
 epoch: 54, train_loss: 0.5970, test_loss: 1.2345, test_f1: 0.5797
 epoch: 55, train_loss: 0.5835, test_loss: 1.1070, test_f1: 0.5985
 epoch: 56, train_loss: 0.5549, test_loss: 1.2951, test_f1: 0.5934
 epoch: 57, train_loss: 0.5653, test_loss: 1.0633, test_f1: 0.6457
 epoch: 58, train_loss: 0.5625, test_loss: 1.1229, test_f1: 0.6149
 epoch: 59, train_loss: 0.5692, test_loss: 1.1978, test_f1: 0.6375
 epoch: 60, train_loss: 0.5445, test_loss: 1.2111, test_f1: 0.6240
 epoch: 61, train_loss: 0.5207, test_loss: 1.1933, test_f1: 0.6160
 epoch: 62, train_loss: 0.5604, test_loss: 1.2891, test_f1: 0.5934
 epoch: 63, train_loss: 0.5409, test_loss: 1.2429, test_f1: 0.6128
 epoch: 64, train_loss: 0.5397, test_loss: 1.2924, test_f1: 0.6216
 epoch: 65, train_loss: 0.5411, test_loss: 1.3570, test_f1: 0.5956
 epoch: 66, train_loss: 0.5501, test_loss: 1.2297, test_f1: 0.6077
 epoch: 67, train_loss: 0.5208, test_loss: 1.3608, test_f1: 0.6042
 epoch: 68, train_loss: 0.5018, test_loss: 1.4285, test_f1: 0.5901
 epoch: 69, train_loss: 0.4973, test_loss: 1.3755, test_f1: 0.5971
 epoch: 70, train_loss: 0.5226, test_loss: 1.4677, test_f1: 0.6133
 epoch: 71, train_loss: 0.4997, test_loss: 1.3319, test_f1: 0.6257
 epoch: 72, train_loss: 0.5367, test_loss: 1.2268, test_f1: 0.6458
 epoch: 73, train_loss: 0.5147, test_loss: 1.3906, test_f1: 0.5926
 epoch: 74, train_loss: 0.4995, test_loss: 1.2253, test_f1: 0.5988
 epoch: 75, train_loss: 0.4898, test_loss: 1.2579, test_f1: 0.6255
 epoch: 76, train_loss: 0.5105, test_loss: 1.4474, test_f1: 0.6096
 epoch: 77, train_loss: 0.4734, test_loss: 1.4039, test_f1: 0.6209
 epoch: 78, train_loss: 0.4699, test_loss: 1.4019, test_f1: 0.6043
 epoch: 79, train_loss: 0.4810, test_loss: 1.4155, test_f1: 0.6253
 epoch: 80, train_loss: 0.4735, test_loss: 1.2777, test_f1: 0.6332
 epoch: 81, train_loss: 0.4792, test_loss: 1.4428, test_f1: 0.6049
 epoch: 82, train_loss: 0.4847, test_loss: 1.5064, test_f1: 0.6147
 epoch: 83, train_loss: 0.4746, test_loss: 1.3103, test_f1: 0.6240
 epoch: 84, train_loss: 0.4667, test_loss: 1.3839, test_f1: 0.6060
 epoch: 85, train_loss: 0.4567, test_loss: 1.6024, test_f1: 0.5964
 epoch: 86, train_loss: 0.4616, test_loss: 1.3567, test_f1: 0.6389
 epoch: 87, train_loss: 0.4657, test_loss: 1.8237, test_f1: 0.6108
 epoch: 88, train_loss: 0.4615, test_loss: 1.7309, test_f1: 0.6024
 epoch: 89, train_loss: 0.4767, test_loss: 1.3970, test_f1: 0.6243
 epoch: 90, train_loss: 0.4660, test_loss: 1.3519, test_f1: 0.6204
 epoch: 91, train_loss: 0.4597, test_loss: 1.4037, test_f1: 0.6489
 epoch: 92, train_loss: 0.4430, test_loss: 1.6220, test_f1: 0.5930
 epoch: 93, train_loss: 0.4385, test_loss: 1.3200, test_f1: 0.6471
 epoch: 94, train_loss: 0.4321, test_loss: 1.6647, test_f1: 0.5809
 epoch: 95, train_loss: 0.4411, test_loss: 1.3684, test_f1: 0.6533
 epoch: 96, train_loss: 0.4091, test_loss: 1.7122, test_f1: 0.5867
 epoch: 97, train_loss: 0.4317, test_loss: 1.3623, test_f1: 0.5968
 epoch: 98, train_loss: 0.4300, test_loss: 1.7015, test_f1: 0.6128
 epoch: 99, train_loss: 0.4333, test_loss: 1.5299, test_f1: 0.6086
##################ITERATION #5 ****************************************
 epoch: 0, train_loss: 1.2874, test_loss: 1.2585, test_f1: 0.3213
 epoch: 1, train_loss: 1.0986, test_loss: 1.1556, test_f1: 0.4802
 epoch: 2, train_loss: 1.0342, test_loss: 1.1521, test_f1: 0.4669
 epoch: 3, train_loss: 1.0076, test_loss: 1.1480, test_f1: 0.4865
 epoch: 4, train_loss: 0.9893, test_loss: 1.1058, test_f1: 0.5029
 epoch: 5, train_loss: 0.9877, test_loss: 1.1127, test_f1: 0.5300
 epoch: 6, train_loss: 0.9743, test_loss: 1.0726, test_f1: 0.4977
 epoch: 7, train_loss: 0.9537, test_loss: 1.0253, test_f1: 0.5144
 epoch: 8, train_loss: 0.9409, test_loss: 1.0563, test_f1: 0.4891
 epoch: 9, train_loss: 0.9027, test_loss: 1.1872, test_f1: 0.4109
 epoch: 10, train_loss: 0.9124, test_loss: 1.0329, test_f1: 0.5137
 epoch: 11, train_loss: 0.9179, test_loss: 1.0285, test_f1: 0.5295
 epoch: 12, train_loss: 0.9045, test_loss: 1.0934, test_f1: 0.5101
 epoch: 13, train_loss: 0.8988, test_loss: 0.9694, test_f1: 0.5553
 epoch: 14, train_loss: 0.8947, test_loss: 1.0055, test_f1: 0.5081
 epoch: 15, train_loss: 0.8704, test_loss: 0.9766, test_f1: 0.5816
 epoch: 16, train_loss: 0.8613, test_loss: 1.1134, test_f1: 0.5184
 epoch: 17, train_loss: 0.8861, test_loss: 1.1689, test_f1: 0.5319
 epoch: 18, train_loss: 0.8693, test_loss: 1.0131, test_f1: 0.5780
 epoch: 19, train_loss: 0.8551, test_loss: 1.0931, test_f1: 0.5394
 epoch: 20, train_loss: 0.8224, test_loss: 1.0340, test_f1: 0.5521
 epoch: 21, train_loss: 0.8352, test_loss: 0.9863, test_f1: 0.5860
 epoch: 22, train_loss: 0.8332, test_loss: 1.0774, test_f1: 0.6070
 epoch: 23, train_loss: 0.8140, test_loss: 1.1337, test_f1: 0.5616
 epoch: 24, train_loss: 0.8160, test_loss: 1.0301, test_f1: 0.5932
 epoch: 25, train_loss: 0.7775, test_loss: 1.0636, test_f1: 0.5597
 epoch: 26, train_loss: 0.8069, test_loss: 1.2173, test_f1: 0.5544
 epoch: 27, train_loss: 0.8431, test_loss: 1.0581, test_f1: 0.5854
 epoch: 28, train_loss: 0.8066, test_loss: 1.1026, test_f1: 0.5649
 epoch: 29, train_loss: 0.7831, test_loss: 1.0869, test_f1: 0.5988
 epoch: 30, train_loss: 0.7741, test_loss: 1.1020, test_f1: 0.5925
 epoch: 31, train_loss: 0.7518, test_loss: 1.2114, test_f1: 0.5186
 epoch: 32, train_loss: 0.7920, test_loss: 1.0208, test_f1: 0.5761
 epoch: 33, train_loss: 0.8025, test_loss: 1.1662, test_f1: 0.5177
 epoch: 34, train_loss: 0.7868, test_loss: 1.3547, test_f1: 0.5279
 epoch: 35, train_loss: 0.7896, test_loss: 1.0295, test_f1: 0.5473
 epoch: 36, train_loss: 0.7814, test_loss: 1.2921, test_f1: 0.5128
 epoch: 37, train_loss: 0.7472, test_loss: 0.9827, test_f1: 0.5930
 epoch: 38, train_loss: 0.7439, test_loss: 1.0123, test_f1: 0.6011
 epoch: 39, train_loss: 0.7382, test_loss: 1.0566, test_f1: 0.6084
 epoch: 40, train_loss: 0.7141, test_loss: 1.0299, test_f1: 0.6532
 epoch: 41, train_loss: 0.6847, test_loss: 1.2481, test_f1: 0.6108
 epoch: 42, train_loss: 0.6973, test_loss: 1.0700, test_f1: 0.6038
 epoch: 43, train_loss: 0.7151, test_loss: 1.0057, test_f1: 0.6092
 epoch: 44, train_loss: 0.6868, test_loss: 1.5046, test_f1: 0.5989
 epoch: 45, train_loss: 0.6873, test_loss: 1.1381, test_f1: 0.5372
 epoch: 46, train_loss: 0.6493, test_loss: 1.3189, test_f1: 0.5941
 epoch: 47, train_loss: 0.6870, test_loss: 1.2838, test_f1: 0.5651
 epoch: 48, train_loss: 0.6980, test_loss: 1.1179, test_f1: 0.5871
 epoch: 49, train_loss: 0.6600, test_loss: 1.3459, test_f1: 0.5296
 epoch: 50, train_loss: 0.6435, test_loss: 1.2803, test_f1: 0.6030
 epoch: 51, train_loss: 0.6171, test_loss: 1.1761, test_f1: 0.6492
 epoch: 52, train_loss: 0.5987, test_loss: 1.2219, test_f1: 0.6005
 epoch: 53, train_loss: 0.6108, test_loss: 1.3068, test_f1: 0.6097
 epoch: 54, train_loss: 0.5972, test_loss: 1.1928, test_f1: 0.6119
 epoch: 55, train_loss: 0.5884, test_loss: 1.2325, test_f1: 0.6412
 epoch: 56, train_loss: 0.5888, test_loss: 1.3166, test_f1: 0.6192
 epoch: 57, train_loss: 0.5667, test_loss: 1.4448, test_f1: 0.6130
 epoch: 58, train_loss: 0.5605, test_loss: 1.1893, test_f1: 0.6206
 epoch: 59, train_loss: 0.5658, test_loss: 1.4596, test_f1: 0.6428
 epoch: 60, train_loss: 0.5468, test_loss: 1.2876, test_f1: 0.6124
 epoch: 61, train_loss: 0.5433, test_loss: 1.4000, test_f1: 0.6341
 epoch: 62, train_loss: 0.5532, test_loss: 1.2123, test_f1: 0.5929
 epoch: 63, train_loss: 0.5460, test_loss: 1.5926, test_f1: 0.5984
 epoch: 64, train_loss: 0.5308, test_loss: 1.6493, test_f1: 0.5320
 epoch: 65, train_loss: 0.5433, test_loss: 1.5138, test_f1: 0.6297
 epoch: 66, train_loss: 0.5470, test_loss: 1.3672, test_f1: 0.5679
 epoch: 67, train_loss: 0.5515, test_loss: 1.4233, test_f1: 0.6169
 epoch: 68, train_loss: 0.5422, test_loss: 1.3001, test_f1: 0.5996
 epoch: 69, train_loss: 0.5621, test_loss: 1.8358, test_f1: 0.6255
 epoch: 70, train_loss: 0.5577, test_loss: 1.4593, test_f1: 0.6000
 epoch: 71, train_loss: 0.4893, test_loss: 1.5618, test_f1: 0.6580
 epoch: 72, train_loss: 0.5332, test_loss: 1.3373, test_f1: 0.5917
 epoch: 73, train_loss: 0.5213, test_loss: 1.3498, test_f1: 0.5968
 epoch: 74, train_loss: 0.5113, test_loss: 1.6323, test_f1: 0.5785
 epoch: 75, train_loss: 0.5419, test_loss: 1.2851, test_f1: 0.6098
 epoch: 76, train_loss: 0.5249, test_loss: 1.6001, test_f1: 0.6208
 epoch: 77, train_loss: 0.4885, test_loss: 1.4347, test_f1: 0.6162
 epoch: 78, train_loss: 0.5112, test_loss: 1.6170, test_f1: 0.6089
 epoch: 79, train_loss: 0.5508, test_loss: 1.7474, test_f1: 0.5830
 epoch: 80, train_loss: 0.6105, test_loss: 1.4115, test_f1: 0.6036
 epoch: 81, train_loss: 0.5422, test_loss: 1.6420, test_f1: 0.5755
 epoch: 82, train_loss: 0.5391, test_loss: 1.8321, test_f1: 0.5788
 epoch: 83, train_loss: 0.5116, test_loss: 1.6022, test_f1: 0.6034
 epoch: 84, train_loss: 0.5197, test_loss: 1.4468, test_f1: 0.6466
 epoch: 85, train_loss: 0.5536, test_loss: 1.4614, test_f1: 0.6164
 epoch: 86, train_loss: 0.5084, test_loss: 1.3480, test_f1: 0.6367
 epoch: 87, train_loss: 0.4777, test_loss: 1.4960, test_f1: 0.5808
 epoch: 88, train_loss: 0.5285, test_loss: 1.6744, test_f1: 0.6367
 epoch: 89, train_loss: 0.4578, test_loss: 1.7611, test_f1: 0.6338
 epoch: 90, train_loss: 0.4527, test_loss: 1.8040, test_f1: 0.5974
 epoch: 91, train_loss: 0.4540, test_loss: 1.5205, test_f1: 0.5757
 epoch: 92, train_loss: 0.4441, test_loss: 2.3701, test_f1: 0.5964
 epoch: 93, train_loss: 0.4839, test_loss: 1.4628, test_f1: 0.5827
 epoch: 94, train_loss: 0.4532, test_loss: 1.7690, test_f1: 0.6015
 epoch: 95, train_loss: 0.4755, test_loss: 1.7208, test_f1: 0.6147
 epoch: 96, train_loss: 0.4600, test_loss: 1.4790, test_f1: 0.6599
 epoch: 97, train_loss: 0.4876, test_loss: 1.7378, test_f1: 0.6364
 epoch: 98, train_loss: 0.4491, test_loss: 1.6428, test_f1: 0.6293
 epoch: 99, train_loss: 0.4511, test_loss: 1.5436, test_f1: 0.6528
##################ITERATION #6 ****************************************
 epoch: 0, train_loss: 1.2508, test_loss: 1.2028, test_f1: 0.3166
 epoch: 1, train_loss: 1.0946, test_loss: 1.2173, test_f1: 0.3827
 epoch: 2, train_loss: 1.0544, test_loss: 1.1904, test_f1: 0.4261
 epoch: 3, train_loss: 1.0363, test_loss: 1.1458, test_f1: 0.3846
 epoch: 4, train_loss: 0.9952, test_loss: 1.0847, test_f1: 0.5266
 epoch: 5, train_loss: 0.9862, test_loss: 1.0569, test_f1: 0.4248
 epoch: 6, train_loss: 0.9863, test_loss: 1.0595, test_f1: 0.5140
 epoch: 7, train_loss: 0.9689, test_loss: 1.0546, test_f1: 0.5240
 epoch: 8, train_loss: 0.9512, test_loss: 1.0166, test_f1: 0.5499
 epoch: 9, train_loss: 0.9584, test_loss: 1.0559, test_f1: 0.5349
 epoch: 10, train_loss: 0.9522, test_loss: 1.0715, test_f1: 0.4717
 epoch: 11, train_loss: 0.9435, test_loss: 1.1828, test_f1: 0.5370
 epoch: 12, train_loss: 0.9384, test_loss: 1.0656, test_f1: 0.5513
 epoch: 13, train_loss: 0.9353, test_loss: 1.1443, test_f1: 0.4402
 epoch: 14, train_loss: 0.9295, test_loss: 1.0306, test_f1: 0.4849
 epoch: 15, train_loss: 0.9043, test_loss: 1.0601, test_f1: 0.4934
 epoch: 16, train_loss: 0.9240, test_loss: 1.0714, test_f1: 0.5338
 epoch: 17, train_loss: 0.9020, test_loss: 1.1528, test_f1: 0.5113
 epoch: 18, train_loss: 0.9072, test_loss: 1.0987, test_f1: 0.5230
 epoch: 19, train_loss: 0.9051, test_loss: 1.0292, test_f1: 0.5235
 epoch: 20, train_loss: 0.8903, test_loss: 1.0382, test_f1: 0.5241
 epoch: 21, train_loss: 0.8836, test_loss: 1.1807, test_f1: 0.4996
 epoch: 22, train_loss: 0.8938, test_loss: 1.0628, test_f1: 0.5406
 epoch: 23, train_loss: 0.8848, test_loss: 1.0392, test_f1: 0.5453
 epoch: 24, train_loss: 0.8744, test_loss: 1.1260, test_f1: 0.5410
 epoch: 25, train_loss: 0.8634, test_loss: 1.0478, test_f1: 0.5616
 epoch: 26, train_loss: 0.8618, test_loss: 1.1110, test_f1: 0.5513
 epoch: 27, train_loss: 0.8959, test_loss: 1.0918, test_f1: 0.5417
 epoch: 28, train_loss: 0.8465, test_loss: 1.0327, test_f1: 0.5925
 epoch: 29, train_loss: 0.8532, test_loss: 1.0712, test_f1: 0.5933
 epoch: 30, train_loss: 0.8560, test_loss: 1.1931, test_f1: 0.5377
 epoch: 31, train_loss: 0.8445, test_loss: 1.0896, test_f1: 0.5759
 epoch: 32, train_loss: 0.8420, test_loss: 1.0612, test_f1: 0.5344
 epoch: 33, train_loss: 0.8425, test_loss: 1.0208, test_f1: 0.5887
 epoch: 34, train_loss: 0.8379, test_loss: 1.1977, test_f1: 0.5580
 epoch: 35, train_loss: 0.8142, test_loss: 1.1183, test_f1: 0.5624
 epoch: 36, train_loss: 0.8004, test_loss: 1.1653, test_f1: 0.5497
 epoch: 37, train_loss: 0.8213, test_loss: 1.1208, test_f1: 0.5526
 epoch: 38, train_loss: 0.8213, test_loss: 1.1865, test_f1: 0.5391
 epoch: 39, train_loss: 0.7763, test_loss: 1.2061, test_f1: 0.4824
 epoch: 40, train_loss: 0.7731, test_loss: 1.1707, test_f1: 0.5683
 epoch: 41, train_loss: 0.7459, test_loss: 1.0777, test_f1: 0.5481
 epoch: 42, train_loss: 0.7693, test_loss: 1.2326, test_f1: 0.5329
 epoch: 43, train_loss: 0.7700, test_loss: 1.0954, test_f1: 0.5662
 epoch: 44, train_loss: 0.7678, test_loss: 1.2814, test_f1: 0.4482
 epoch: 45, train_loss: 0.7729, test_loss: 1.1700, test_f1: 0.6080
 epoch: 46, train_loss: 0.7451, test_loss: 1.1610, test_f1: 0.5805
 epoch: 47, train_loss: 0.7447, test_loss: 1.1440, test_f1: 0.5954
 epoch: 48, train_loss: 0.7459, test_loss: 1.1910, test_f1: 0.5840
 epoch: 49, train_loss: 0.7315, test_loss: 1.1062, test_f1: 0.6217
 epoch: 50, train_loss: 0.7294, test_loss: 1.0137, test_f1: 0.6024
 epoch: 51, train_loss: 0.7029, test_loss: 1.1712, test_f1: 0.5832
 epoch: 52, train_loss: 0.6629, test_loss: 1.1949, test_f1: 0.5868
 epoch: 53, train_loss: 0.6514, test_loss: 1.2373, test_f1: 0.5780
 epoch: 54, train_loss: 0.6299, test_loss: 1.1763, test_f1: 0.6170
 epoch: 55, train_loss: 0.6472, test_loss: 1.3433, test_f1: 0.5849
 epoch: 56, train_loss: 0.6228, test_loss: 1.3263, test_f1: 0.6041
 epoch: 57, train_loss: 0.6479, test_loss: 1.2907, test_f1: 0.5820
 epoch: 58, train_loss: 0.6141, test_loss: 1.3362, test_f1: 0.5504
 epoch: 59, train_loss: 0.6186, test_loss: 1.4446, test_f1: 0.5499
 epoch: 60, train_loss: 0.6055, test_loss: 1.3664, test_f1: 0.5519
 epoch: 61, train_loss: 0.6158, test_loss: 1.3906, test_f1: 0.5399
 epoch: 62, train_loss: 0.5985, test_loss: 1.5010, test_f1: 0.5442
 epoch: 63, train_loss: 0.6117, test_loss: 1.5768, test_f1: 0.5584
 epoch: 64, train_loss: 0.5957, test_loss: 1.4034, test_f1: 0.5374
 epoch: 65, train_loss: 0.5916, test_loss: 1.4108, test_f1: 0.5667
 epoch: 66, train_loss: 0.5880, test_loss: 1.4028, test_f1: 0.5371
 epoch: 67, train_loss: 0.6056, test_loss: 1.3262, test_f1: 0.5783
 epoch: 68, train_loss: 0.5643, test_loss: 1.6108, test_f1: 0.5497
 epoch: 69, train_loss: 0.5676, test_loss: 1.3801, test_f1: 0.5688
 epoch: 70, train_loss: 0.5607, test_loss: 1.4668, test_f1: 0.6009
 epoch: 71, train_loss: 0.5540, test_loss: 1.5561, test_f1: 0.5760
 epoch: 72, train_loss: 0.5991, test_loss: 1.4505, test_f1: 0.5513
 epoch: 73, train_loss: 0.5670, test_loss: 1.4260, test_f1: 0.5563
 epoch: 74, train_loss: 0.5810, test_loss: 1.4609, test_f1: 0.5587
 epoch: 75, train_loss: 0.5454, test_loss: 1.6375, test_f1: 0.5493
 epoch: 76, train_loss: 0.5611, test_loss: 1.4128, test_f1: 0.5912
 epoch: 77, train_loss: 0.5856, test_loss: 1.6098, test_f1: 0.5304
 epoch: 78, train_loss: 0.5294, test_loss: 1.4788, test_f1: 0.5580
 epoch: 79, train_loss: 0.5489, test_loss: 1.5917, test_f1: 0.5387
 epoch: 80, train_loss: 0.5673, test_loss: 1.4236, test_f1: 0.5473
 epoch: 81, train_loss: 0.5495, test_loss: 1.5214, test_f1: 0.5842
 epoch: 82, train_loss: 0.5473, test_loss: 1.8127, test_f1: 0.5372
 epoch: 83, train_loss: 0.5344, test_loss: 1.4089, test_f1: 0.5765
 epoch: 84, train_loss: 0.5571, test_loss: 1.5170, test_f1: 0.5509
 epoch: 85, train_loss: 0.5414, test_loss: 1.5825, test_f1: 0.5711
 epoch: 86, train_loss: 0.5265, test_loss: 1.7043, test_f1: 0.5740
 epoch: 87, train_loss: 0.5238, test_loss: 1.6123, test_f1: 0.5740
 epoch: 88, train_loss: 0.4994, test_loss: 1.7940, test_f1: 0.5750
 epoch: 89, train_loss: 0.5223, test_loss: 1.6603, test_f1: 0.5312
 epoch: 90, train_loss: 0.4894, test_loss: 2.0518, test_f1: 0.5105
 epoch: 91, train_loss: 0.5237, test_loss: 2.0962, test_f1: 0.5507
 epoch: 92, train_loss: 0.4761, test_loss: 1.9339, test_f1: 0.5429
 epoch: 93, train_loss: 0.4976, test_loss: 1.6462, test_f1: 0.5931
 epoch: 94, train_loss: 0.4949, test_loss: 1.9605, test_f1: 0.5262
 epoch: 95, train_loss: 0.4878, test_loss: 1.6201, test_f1: 0.5329
 epoch: 96, train_loss: 0.5113, test_loss: 1.7355, test_f1: 0.5753
 epoch: 97, train_loss: 0.4708, test_loss: 1.6133, test_f1: 0.5444
 epoch: 98, train_loss: 0.5057, test_loss: 1.6853, test_f1: 0.5674
 epoch: 99, train_loss: 0.4733, test_loss: 1.7923, test_f1: 0.5582
##################ITERATION #7 ****************************************
 epoch: 0, train_loss: 1.2910, test_loss: 1.3724, test_f1: 0.2281
 epoch: 1, train_loss: 1.1213, test_loss: 1.2303, test_f1: 0.3350
 epoch: 2, train_loss: 1.0925, test_loss: 1.2117, test_f1: 0.3712
 epoch: 3, train_loss: 1.0409, test_loss: 1.1014, test_f1: 0.4703
 epoch: 4, train_loss: 1.0121, test_loss: 1.1071, test_f1: 0.4818
 epoch: 5, train_loss: 0.9916, test_loss: 1.1227, test_f1: 0.4423
 epoch: 6, train_loss: 0.9745, test_loss: 1.1228, test_f1: 0.5322
 epoch: 7, train_loss: 0.9841, test_loss: 1.2046, test_f1: 0.4548
 epoch: 8, train_loss: 0.9542, test_loss: 1.0820, test_f1: 0.4447
 epoch: 9, train_loss: 0.9497, test_loss: 1.0753, test_f1: 0.4679
 epoch: 10, train_loss: 0.9414, test_loss: 1.0596, test_f1: 0.5185
 epoch: 11, train_loss: 0.9086, test_loss: 1.1245, test_f1: 0.5264
 epoch: 12, train_loss: 0.8907, test_loss: 1.1312, test_f1: 0.5152
 epoch: 13, train_loss: 0.8964, test_loss: 1.0580, test_f1: 0.5525
 epoch: 14, train_loss: 0.9374, test_loss: 1.0923, test_f1: 0.4717
 epoch: 15, train_loss: 0.9068, test_loss: 1.2221, test_f1: 0.4883
 epoch: 16, train_loss: 0.8849, test_loss: 1.2240, test_f1: 0.4988
 epoch: 17, train_loss: 0.8794, test_loss: 1.0666, test_f1: 0.5125
 epoch: 18, train_loss: 0.8627, test_loss: 1.2108, test_f1: 0.4831
 epoch: 19, train_loss: 0.8456, test_loss: 1.1953, test_f1: 0.5259
 epoch: 20, train_loss: 0.8342, test_loss: 1.0068, test_f1: 0.5873
 epoch: 21, train_loss: 0.8351, test_loss: 0.9789, test_f1: 0.5831
 epoch: 22, train_loss: 0.8284, test_loss: 1.1189, test_f1: 0.5613
 epoch: 23, train_loss: 0.8042, test_loss: 1.1224, test_f1: 0.5863
 epoch: 24, train_loss: 0.8194, test_loss: 1.1018, test_f1: 0.5474
 epoch: 25, train_loss: 0.8300, test_loss: 1.1285, test_f1: 0.5560
 epoch: 26, train_loss: 0.7924, test_loss: 1.2368, test_f1: 0.4745
 epoch: 27, train_loss: 0.8012, test_loss: 1.0975, test_f1: 0.5683
 epoch: 28, train_loss: 0.7988, test_loss: 1.2235, test_f1: 0.4279
 epoch: 29, train_loss: 0.7805, test_loss: 1.1779, test_f1: 0.5596
 epoch: 30, train_loss: 0.7500, test_loss: 1.1691, test_f1: 0.5588
 epoch: 31, train_loss: 0.7656, test_loss: 1.0767, test_f1: 0.5617
 epoch: 32, train_loss: 0.7495, test_loss: 1.0039, test_f1: 0.5963
 epoch: 33, train_loss: 0.7558, test_loss: 1.1670, test_f1: 0.5853
 epoch: 34, train_loss: 0.7786, test_loss: 1.1532, test_f1: 0.5644
 epoch: 35, train_loss: 0.7547, test_loss: 1.3799, test_f1: 0.5822
 epoch: 36, train_loss: 0.7426, test_loss: 1.2125, test_f1: 0.4778
 epoch: 37, train_loss: 0.7588, test_loss: 1.5005, test_f1: 0.5069
 epoch: 38, train_loss: 0.7694, test_loss: 1.0476, test_f1: 0.5638
 epoch: 39, train_loss: 0.7339, test_loss: 1.1048, test_f1: 0.5676
 epoch: 40, train_loss: 0.7193, test_loss: 1.1980, test_f1: 0.5730
 epoch: 41, train_loss: 0.7052, test_loss: 1.3972, test_f1: 0.5017
 epoch: 42, train_loss: 0.7246, test_loss: 1.2425, test_f1: 0.5748
 epoch: 43, train_loss: 0.7291, test_loss: 1.2000, test_f1: 0.5765
 epoch: 44, train_loss: 0.7253, test_loss: 1.1043, test_f1: 0.5769
 epoch: 45, train_loss: 0.6886, test_loss: 1.2717, test_f1: 0.5890
 epoch: 46, train_loss: 0.7201, test_loss: 1.2678, test_f1: 0.5817
 epoch: 47, train_loss: 0.7472, test_loss: 1.6626, test_f1: 0.4570
 epoch: 48, train_loss: 0.7393, test_loss: 1.4509, test_f1: 0.5584
 epoch: 49, train_loss: 0.7196, test_loss: 1.1628, test_f1: 0.5764
 epoch: 50, train_loss: 0.7018, test_loss: 1.2570, test_f1: 0.5182
 epoch: 51, train_loss: 0.6769, test_loss: 1.1698, test_f1: 0.5822
 epoch: 52, train_loss: 0.6444, test_loss: 1.2293, test_f1: 0.5667
 epoch: 53, train_loss: 0.6306, test_loss: 1.2667, test_f1: 0.5775
 epoch: 54, train_loss: 0.6577, test_loss: 1.2802, test_f1: 0.5751
 epoch: 55, train_loss: 0.6274, test_loss: 1.1894, test_f1: 0.5894
 epoch: 56, train_loss: 0.6499, test_loss: 1.2847, test_f1: 0.5770
 epoch: 57, train_loss: 0.6306, test_loss: 1.2900, test_f1: 0.5850
 epoch: 58, train_loss: 0.6282, test_loss: 1.2676, test_f1: 0.5628
 epoch: 59, train_loss: 0.6102, test_loss: 1.4340, test_f1: 0.5827
 epoch: 60, train_loss: 0.6238, test_loss: 1.2229, test_f1: 0.5756
 epoch: 61, train_loss: 0.6114, test_loss: 1.3265, test_f1: 0.5641
 epoch: 62, train_loss: 0.6174, test_loss: 1.3603, test_f1: 0.5917
 epoch: 63, train_loss: 0.6014, test_loss: 1.3852, test_f1: 0.5832
 epoch: 64, train_loss: 0.6004, test_loss: 1.3665, test_f1: 0.5735
 epoch: 65, train_loss: 0.6086, test_loss: 1.3206, test_f1: 0.5659
 epoch: 66, train_loss: 0.6093, test_loss: 1.3010, test_f1: 0.5631
 epoch: 67, train_loss: 0.5737, test_loss: 1.4678, test_f1: 0.5625
 epoch: 68, train_loss: 0.6121, test_loss: 1.6114, test_f1: 0.5578
 epoch: 69, train_loss: 0.6498, test_loss: 1.2176, test_f1: 0.5901
 epoch: 70, train_loss: 0.6111, test_loss: 1.2364, test_f1: 0.5879
 epoch: 71, train_loss: 0.5803, test_loss: 1.2277, test_f1: 0.5741
 epoch: 72, train_loss: 0.5822, test_loss: 1.5309, test_f1: 0.5379
 epoch: 73, train_loss: 0.5871, test_loss: 1.3438, test_f1: 0.6092
 epoch: 74, train_loss: 0.6090, test_loss: 1.2923, test_f1: 0.5723
 epoch: 75, train_loss: 0.5870, test_loss: 1.3564, test_f1: 0.5953
 epoch: 76, train_loss: 0.5638, test_loss: 1.2615, test_f1: 0.5346
 epoch: 77, train_loss: 0.5490, test_loss: 1.5097, test_f1: 0.5760
 epoch: 78, train_loss: 0.5515, test_loss: 1.2967, test_f1: 0.5788
 epoch: 79, train_loss: 0.5574, test_loss: 1.3489, test_f1: 0.6253
 epoch: 80, train_loss: 0.5507, test_loss: 1.4740, test_f1: 0.5716
 epoch: 81, train_loss: 0.5545, test_loss: 1.3667, test_f1: 0.5550
 epoch: 82, train_loss: 0.5703, test_loss: 1.2562, test_f1: 0.5906
 epoch: 83, train_loss: 0.5582, test_loss: 1.4349, test_f1: 0.5884
 epoch: 84, train_loss: 0.5595, test_loss: 1.2238, test_f1: 0.6190
 epoch: 85, train_loss: 0.5724, test_loss: 1.2844, test_f1: 0.5993
 epoch: 86, train_loss: 0.5454, test_loss: 1.4111, test_f1: 0.6014
 epoch: 87, train_loss: 0.5361, test_loss: 1.4081, test_f1: 0.5802
 epoch: 88, train_loss: 0.5416, test_loss: 1.4670, test_f1: 0.5567
 epoch: 89, train_loss: 0.5215, test_loss: 1.4036, test_f1: 0.5736
 epoch: 90, train_loss: 0.5587, test_loss: 1.3344, test_f1: 0.5747
 epoch: 91, train_loss: 0.5088, test_loss: 1.4354, test_f1: 0.5788
 epoch: 92, train_loss: 0.5274, test_loss: 1.3726, test_f1: 0.6171
 epoch: 93, train_loss: 0.5286, test_loss: 1.5410, test_f1: 0.6165
 epoch: 94, train_loss: 0.5193, test_loss: 1.4438, test_f1: 0.6220
 epoch: 95, train_loss: 0.5302, test_loss: 1.3003, test_f1: 0.5895
 epoch: 96, train_loss: 0.5148, test_loss: 1.3887, test_f1: 0.5702
 epoch: 97, train_loss: 0.4952, test_loss: 1.3108, test_f1: 0.6397
 epoch: 98, train_loss: 0.5236, test_loss: 1.5981, test_f1: 0.5874
 epoch: 99, train_loss: 0.5024, test_loss: 1.4422, test_f1: 0.5957
##################ITERATION #8 ****************************************
 epoch: 0, train_loss: 1.2730, test_loss: 1.3879, test_f1: 0.2724
 epoch: 1, train_loss: 1.0691, test_loss: 1.1327, test_f1: 0.5127
 epoch: 2, train_loss: 1.0035, test_loss: 1.1666, test_f1: 0.4795
 epoch: 3, train_loss: 0.9929, test_loss: 1.0902, test_f1: 0.4990
 epoch: 4, train_loss: 0.9585, test_loss: 1.1323, test_f1: 0.5041
 epoch: 5, train_loss: 0.9442, test_loss: 1.0751, test_f1: 0.5224
 epoch: 6, train_loss: 0.9357, test_loss: 1.0714, test_f1: 0.5078
 epoch: 7, train_loss: 0.9462, test_loss: 1.0400, test_f1: 0.5354
 epoch: 8, train_loss: 0.9063, test_loss: 1.1371, test_f1: 0.5399
 epoch: 9, train_loss: 0.9051, test_loss: 1.0883, test_f1: 0.5400
 epoch: 10, train_loss: 0.8971, test_loss: 1.1789, test_f1: 0.4845
 epoch: 11, train_loss: 0.8885, test_loss: 1.0883, test_f1: 0.5418
 epoch: 12, train_loss: 0.9003, test_loss: 1.1054, test_f1: 0.5550
 epoch: 13, train_loss: 0.8728, test_loss: 1.0095, test_f1: 0.5950
 epoch: 14, train_loss: 0.8435, test_loss: 1.0627, test_f1: 0.5318
 epoch: 15, train_loss: 0.8437, test_loss: 1.1623, test_f1: 0.5288
 epoch: 16, train_loss: 0.8368, test_loss: 1.1124, test_f1: 0.5202
 epoch: 17, train_loss: 0.8329, test_loss: 1.1428, test_f1: 0.4928
 epoch: 18, train_loss: 0.8092, test_loss: 1.1963, test_f1: 0.5555
 epoch: 19, train_loss: 0.8002, test_loss: 1.2813, test_f1: 0.5289
 epoch: 20, train_loss: 0.7806, test_loss: 1.0792, test_f1: 0.5215
 epoch: 21, train_loss: 0.8065, test_loss: 1.1198, test_f1: 0.5647
 epoch: 22, train_loss: 0.7897, test_loss: 1.0950, test_f1: 0.5308
 epoch: 23, train_loss: 0.7752, test_loss: 1.2002, test_f1: 0.6051
 epoch: 24, train_loss: 0.7734, test_loss: 1.3393, test_f1: 0.5240
 epoch: 25, train_loss: 0.7559, test_loss: 1.0597, test_f1: 0.5544
 epoch: 26, train_loss: 0.7318, test_loss: 1.0984, test_f1: 0.5640
 epoch: 27, train_loss: 0.7307, test_loss: 1.2279, test_f1: 0.5931
 epoch: 28, train_loss: 0.7265, test_loss: 1.0585, test_f1: 0.6263
 epoch: 29, train_loss: 0.7306, test_loss: 1.6362, test_f1: 0.5304
 epoch: 30, train_loss: 0.7868, test_loss: 1.2097, test_f1: 0.4606
 epoch: 31, train_loss: 0.7716, test_loss: 1.0881, test_f1: 0.5279
 epoch: 32, train_loss: 0.7815, test_loss: 1.2608, test_f1: 0.5105
 epoch: 33, train_loss: 0.7568, test_loss: 1.0445, test_f1: 0.5605
 epoch: 34, train_loss: 0.7298, test_loss: 1.7840, test_f1: 0.5670
 epoch: 35, train_loss: 0.7148, test_loss: 1.6558, test_f1: 0.5655
 epoch: 36, train_loss: 0.7552, test_loss: 1.2104, test_f1: 0.5873
 epoch: 37, train_loss: 0.7113, test_loss: 1.1872, test_f1: 0.5864
 epoch: 38, train_loss: 0.6914, test_loss: 1.2789, test_f1: 0.5951
 epoch: 39, train_loss: 0.7109, test_loss: 1.1288, test_f1: 0.5519
 epoch: 40, train_loss: 0.6785, test_loss: 1.1232, test_f1: 0.5657
 epoch: 41, train_loss: 0.7234, test_loss: 1.1255, test_f1: 0.5696
 epoch: 42, train_loss: 0.7278, test_loss: 1.2360, test_f1: 0.5684
 epoch: 43, train_loss: 0.6849, test_loss: 1.2242, test_f1: 0.5661
 epoch: 44, train_loss: 0.7503, test_loss: 1.0346, test_f1: 0.5514
 epoch: 45, train_loss: 0.6952, test_loss: 1.2416, test_f1: 0.5815
 epoch: 46, train_loss: 0.6845, test_loss: 1.3754, test_f1: 0.5969
 epoch: 47, train_loss: 0.6633, test_loss: 1.8153, test_f1: 0.5527
 epoch: 48, train_loss: 0.6805, test_loss: 1.2220, test_f1: 0.6105
 epoch: 49, train_loss: 0.6853, test_loss: 1.1710, test_f1: 0.5779
 epoch: 50, train_loss: 0.6689, test_loss: 1.3811, test_f1: 0.5141
 epoch: 51, train_loss: 0.6408, test_loss: 1.7717, test_f1: 0.6070
 epoch: 52, train_loss: 0.6136, test_loss: 1.4952, test_f1: 0.6070
 epoch: 53, train_loss: 0.6028, test_loss: 1.3054, test_f1: 0.5857
 epoch: 54, train_loss: 0.6142, test_loss: 1.4596, test_f1: 0.6108
 epoch: 55, train_loss: 0.6151, test_loss: 1.5495, test_f1: 0.6110
 epoch: 56, train_loss: 0.6090, test_loss: 1.5714, test_f1: 0.5938
 epoch: 57, train_loss: 0.5842, test_loss: 1.4262, test_f1: 0.6093
 epoch: 58, train_loss: 0.5954, test_loss: 1.4033, test_f1: 0.6094
 epoch: 59, train_loss: 0.6105, test_loss: 1.9835, test_f1: 0.6276
 epoch: 60, train_loss: 0.5879, test_loss: 1.5101, test_f1: 0.6265
 epoch: 61, train_loss: 0.6360, test_loss: 1.8554, test_f1: 0.5756
 epoch: 62, train_loss: 0.5915, test_loss: 1.3903, test_f1: 0.6361
 epoch: 63, train_loss: 0.5910, test_loss: 1.5190, test_f1: 0.6004
 epoch: 64, train_loss: 0.5816, test_loss: 1.5882, test_f1: 0.6493
 epoch: 65, train_loss: 0.5913, test_loss: 1.3461, test_f1: 0.5968
 epoch: 66, train_loss: 0.5692, test_loss: 1.5893, test_f1: 0.6452
 epoch: 67, train_loss: 0.5852, test_loss: 1.4250, test_f1: 0.6269
 epoch: 68, train_loss: 0.5738, test_loss: 1.8116, test_f1: 0.5711
 epoch: 69, train_loss: 0.5786, test_loss: 1.5477, test_f1: 0.5887
 epoch: 70, train_loss: 0.5650, test_loss: 1.5758, test_f1: 0.6243
 epoch: 71, train_loss: 0.5623, test_loss: 1.6123, test_f1: 0.5930
 epoch: 72, train_loss: 0.5458, test_loss: 2.3885, test_f1: 0.5944
 epoch: 73, train_loss: 0.5589, test_loss: 1.8001, test_f1: 0.6200
 epoch: 74, train_loss: 0.5526, test_loss: 1.5977, test_f1: 0.6038
 epoch: 75, train_loss: 0.5689, test_loss: 1.5770, test_f1: 0.6284
 epoch: 76, train_loss: 0.5415, test_loss: 1.9029, test_f1: 0.6121
 epoch: 77, train_loss: 0.5380, test_loss: 1.3771, test_f1: 0.6411
 epoch: 78, train_loss: 0.5383, test_loss: 1.7401, test_f1: 0.6042
 epoch: 79, train_loss: 0.5326, test_loss: 1.6067, test_f1: 0.5758
 epoch: 80, train_loss: 0.5031, test_loss: 1.6454, test_f1: 0.6021
 epoch: 81, train_loss: 0.5233, test_loss: 1.5599, test_f1: 0.5491
 epoch: 82, train_loss: 0.5321, test_loss: 2.0038, test_f1: 0.6065
 epoch: 83, train_loss: 0.5101, test_loss: 1.6318, test_f1: 0.6152
 epoch: 84, train_loss: 0.4873, test_loss: 1.9366, test_f1: 0.6604
 epoch: 85, train_loss: 0.5190, test_loss: 1.9338, test_f1: 0.6066
 epoch: 86, train_loss: 0.5330, test_loss: 1.6468, test_f1: 0.5325
 epoch: 87, train_loss: 0.5088, test_loss: 1.3728, test_f1: 0.6400
 epoch: 88, train_loss: 0.5073, test_loss: 1.8542, test_f1: 0.5762
 epoch: 89, train_loss: 0.5030, test_loss: 2.0082, test_f1: 0.5804
 epoch: 90, train_loss: 0.5167, test_loss: 1.6919, test_f1: 0.5379
 epoch: 91, train_loss: 0.5130, test_loss: 1.6473, test_f1: 0.6389
 epoch: 92, train_loss: 0.4960, test_loss: 2.1071, test_f1: 0.6011
 epoch: 93, train_loss: 0.5096, test_loss: 2.4353, test_f1: 0.6033
 epoch: 94, train_loss: 0.5109, test_loss: 1.6126, test_f1: 0.6086
 epoch: 95, train_loss: 0.5289, test_loss: 2.0566, test_f1: 0.6130
 epoch: 96, train_loss: 0.5054, test_loss: 2.0409, test_f1: 0.5932
 epoch: 97, train_loss: 0.5121, test_loss: 1.6555, test_f1: 0.5328
 epoch: 98, train_loss: 0.5013, test_loss: 1.7192, test_f1: 0.5413
 epoch: 99, train_loss: 0.4812, test_loss: 1.6452, test_f1: 0.5900
##################ITERATION #9 ****************************************
 epoch: 0, train_loss: 1.2745, test_loss: 1.4947, test_f1: 0.2057
 epoch: 1, train_loss: 1.0711, test_loss: 1.1805, test_f1: 0.4455
 epoch: 2, train_loss: 1.0160, test_loss: 1.0709, test_f1: 0.4977
 epoch: 3, train_loss: 0.9842, test_loss: 1.0696, test_f1: 0.5277
 epoch: 4, train_loss: 0.9686, test_loss: 1.1245, test_f1: 0.4669
 epoch: 5, train_loss: 0.9619, test_loss: 1.0886, test_f1: 0.5176
 epoch: 6, train_loss: 0.9440, test_loss: 1.0618, test_f1: 0.5368
 epoch: 7, train_loss: 0.9353, test_loss: 1.2025, test_f1: 0.5039
 epoch: 8, train_loss: 0.9373, test_loss: 1.1969, test_f1: 0.5156
 epoch: 9, train_loss: 0.9470, test_loss: 1.1392, test_f1: 0.5145
 epoch: 10, train_loss: 0.9270, test_loss: 1.1330, test_f1: 0.5315
 epoch: 11, train_loss: 0.9368, test_loss: 1.0860, test_f1: 0.5507
 epoch: 12, train_loss: 0.9291, test_loss: 1.1157, test_f1: 0.5275
 epoch: 13, train_loss: 0.9448, test_loss: 1.1135, test_f1: 0.5593
 epoch: 14, train_loss: 0.9190, test_loss: 1.1525, test_f1: 0.5398
 epoch: 15, train_loss: 0.9146, test_loss: 1.1804, test_f1: 0.5299
 epoch: 16, train_loss: 0.9063, test_loss: 1.0477, test_f1: 0.5497
 epoch: 17, train_loss: 0.9084, test_loss: 1.0813, test_f1: 0.5697
 epoch: 18, train_loss: 0.8837, test_loss: 1.1510, test_f1: 0.5316
 epoch: 19, train_loss: 0.8753, test_loss: 1.1176, test_f1: 0.5364
 epoch: 20, train_loss: 0.8631, test_loss: 1.2590, test_f1: 0.4715
 epoch: 21, train_loss: 0.8831, test_loss: 1.1266, test_f1: 0.5097
 epoch: 22, train_loss: 0.8798, test_loss: 1.0389, test_f1: 0.5760
 epoch: 23, train_loss: 0.8589, test_loss: 1.1391, test_f1: 0.5695
 epoch: 24, train_loss: 0.8486, test_loss: 1.1701, test_f1: 0.5293
 epoch: 25, train_loss: 0.8098, test_loss: 1.0951, test_f1: 0.5485
 epoch: 26, train_loss: 0.8226, test_loss: 1.0799, test_f1: 0.5225
 epoch: 27, train_loss: 0.8416, test_loss: 1.1782, test_f1: 0.5346
 epoch: 28, train_loss: 0.8328, test_loss: 1.0828, test_f1: 0.5353
 epoch: 29, train_loss: 0.8243, test_loss: 1.1607, test_f1: 0.5591
 epoch: 30, train_loss: 0.7998, test_loss: 1.0560, test_f1: 0.5774
 epoch: 31, train_loss: 0.7723, test_loss: 1.3420, test_f1: 0.5306
 epoch: 32, train_loss: 0.7968, test_loss: 1.1547, test_f1: 0.5163
 epoch: 33, train_loss: 0.7866, test_loss: 1.2347, test_f1: 0.5295
 epoch: 34, train_loss: 0.7690, test_loss: 1.1464, test_f1: 0.5480
 epoch: 35, train_loss: 0.7962, test_loss: 1.2712, test_f1: 0.5944
 epoch: 36, train_loss: 0.7636, test_loss: 1.3032, test_f1: 0.5144
 epoch: 37, train_loss: 0.7479, test_loss: 1.3162, test_f1: 0.5458
 epoch: 38, train_loss: 0.7586, test_loss: 1.2488, test_f1: 0.5175
 epoch: 39, train_loss: 0.7395, test_loss: 1.2463, test_f1: 0.5612
 epoch: 40, train_loss: 0.7278, test_loss: 1.2637, test_f1: 0.5310
 epoch: 41, train_loss: 0.7419, test_loss: 1.4170, test_f1: 0.5311
 epoch: 42, train_loss: 0.7119, test_loss: 1.3630, test_f1: 0.4616
 epoch: 43, train_loss: 0.7431, test_loss: 1.3461, test_f1: 0.5330
 epoch: 44, train_loss: 0.7732, test_loss: 1.2990, test_f1: 0.5539
 epoch: 45, train_loss: 0.7194, test_loss: 1.4099, test_f1: 0.5115
 epoch: 46, train_loss: 0.7198, test_loss: 1.4006, test_f1: 0.5148
 epoch: 47, train_loss: 0.6860, test_loss: 1.2636, test_f1: 0.5624
 epoch: 48, train_loss: 0.6733, test_loss: 1.3464, test_f1: 0.5625
 epoch: 49, train_loss: 0.6832, test_loss: 1.3735, test_f1: 0.5518
 epoch: 50, train_loss: 0.6917, test_loss: 1.2978, test_f1: 0.4835
 epoch: 51, train_loss: 0.6720, test_loss: 1.2238, test_f1: 0.5709
 epoch: 52, train_loss: 0.6472, test_loss: 1.3311, test_f1: 0.5631
 epoch: 53, train_loss: 0.6261, test_loss: 1.3237, test_f1: 0.5538
 epoch: 54, train_loss: 0.6152, test_loss: 1.3843, test_f1: 0.5795
 epoch: 55, train_loss: 0.6146, test_loss: 1.4521, test_f1: 0.5713
 epoch: 56, train_loss: 0.6091, test_loss: 1.4308, test_f1: 0.6235
 epoch: 57, train_loss: 0.5871, test_loss: 1.4383, test_f1: 0.5972
 epoch: 58, train_loss: 0.6014, test_loss: 1.5031, test_f1: 0.5487
 epoch: 59, train_loss: 0.5977, test_loss: 1.3410, test_f1: 0.5743
 epoch: 60, train_loss: 0.5841, test_loss: 1.4748, test_f1: 0.5912
 epoch: 61, train_loss: 0.5878, test_loss: 1.3711, test_f1: 0.5771
 epoch: 62, train_loss: 0.5717, test_loss: 1.4968, test_f1: 0.5675
 epoch: 63, train_loss: 0.5990, test_loss: 1.4568, test_f1: 0.5968
 epoch: 64, train_loss: 0.5680, test_loss: 1.4420, test_f1: 0.5739
 epoch: 65, train_loss: 0.5557, test_loss: 1.5163, test_f1: 0.5459
 epoch: 66, train_loss: 0.5807, test_loss: 1.5491, test_f1: 0.5943
 epoch: 67, train_loss: 0.5658, test_loss: 1.5109, test_f1: 0.6046
 epoch: 68, train_loss: 0.5668, test_loss: 1.5695, test_f1: 0.6033
 epoch: 69, train_loss: 0.5428, test_loss: 1.5031, test_f1: 0.5778
 epoch: 70, train_loss: 0.5556, test_loss: 1.5206, test_f1: 0.5832
 epoch: 71, train_loss: 0.5281, test_loss: 1.6645, test_f1: 0.5771
 epoch: 72, train_loss: 0.5555, test_loss: 1.6041, test_f1: 0.5907
 epoch: 73, train_loss: 0.5478, test_loss: 1.5728, test_f1: 0.5906
 epoch: 74, train_loss: 0.5460, test_loss: 1.5615, test_f1: 0.5884
 epoch: 75, train_loss: 0.5678, test_loss: 1.6008, test_f1: 0.5479
 epoch: 76, train_loss: 0.5501, test_loss: 1.7335, test_f1: 0.6102
 epoch: 77, train_loss: 0.5336, test_loss: 1.5979, test_f1: 0.5259
 epoch: 78, train_loss: 0.5564, test_loss: 1.6982, test_f1: 0.5643
 epoch: 79, train_loss: 0.5148, test_loss: 1.6586, test_f1: 0.5501
 epoch: 80, train_loss: 0.5221, test_loss: 1.4974, test_f1: 0.6011
 epoch: 81, train_loss: 0.5394, test_loss: 1.7746, test_f1: 0.5807
 epoch: 82, train_loss: 0.5303, test_loss: 1.5619, test_f1: 0.5226
 epoch: 83, train_loss: 0.5178, test_loss: 1.6178, test_f1: 0.6095
 epoch: 84, train_loss: 0.5224, test_loss: 1.8783, test_f1: 0.5759
 epoch: 85, train_loss: 0.5250, test_loss: 1.7771, test_f1: 0.5732
 epoch: 86, train_loss: 0.5084, test_loss: 1.6852, test_f1: 0.5933
 epoch: 87, train_loss: 0.5198, test_loss: 1.6174, test_f1: 0.5939
 epoch: 88, train_loss: 0.4983, test_loss: 1.6677, test_f1: 0.5699
 epoch: 89, train_loss: 0.5026, test_loss: 1.8431, test_f1: 0.5685
 epoch: 90, train_loss: 0.4797, test_loss: 1.6716, test_f1: 0.5930
 epoch: 91, train_loss: 0.4793, test_loss: 2.0164, test_f1: 0.5794
 epoch: 92, train_loss: 0.5142, test_loss: 1.6747, test_f1: 0.6173
 epoch: 93, train_loss: 0.4720, test_loss: 1.7053, test_f1: 0.5728
 epoch: 94, train_loss: 0.4740, test_loss: 1.6630, test_f1: 0.6086
 epoch: 95, train_loss: 0.4755, test_loss: 1.7389, test_f1: 0.5823
 epoch: 96, train_loss: 0.4860, test_loss: 1.5897, test_f1: 0.5905
 epoch: 97, train_loss: 0.5071, test_loss: 1.6147, test_f1: 0.5937
 epoch: 98, train_loss: 0.4657, test_loss: 1.8061, test_f1: 0.5318
 epoch: 99, train_loss: 0.4654, test_loss: 1.8678, test_f1: 0.5543

Training completed in 487.85 seconds
Best F1: 0.6604 at epoch 84
Mean F1 across iterations: 0.6403  0.0164
========================FINAL RESULTS================================
FEGIN weighted F1: 0.6604  0.0164
python main.py --data ltspice_demos --representation component_net --model FEGIN --layers 5 --hiddens 32 --batch_size 64 --lr 0.01 --emb_size 512 --epochs 100 --save_appendix component_net_L5_H32_BS64_LR0.01_E512 --no_val
-----



STDERR:
  File "main.py", line 370, in <module>
    main()
  File "main.py", line 254, in main
    dataset = dataset_class(
  File "/home/philip/projects/ltspice_examples_code_repo/Circuit-Completion-Using-GNNs/component_classification_with_link_prediction_head/evaluation/FEGIN/kernel/circuit_datasets.py", line 15, in __init__
    self.data, self.slices = torch.load(self.processed_paths[0])
  File "/home/philip/.local/lib/python3.8/site-packages/torch/serialization.py", line 1040, in load
    warnings.warn(
  File "/usr/lib/python3.8/warnings.py", line 109, in _showwarnmsg
    sw(msg.message, msg.category, msg.filename, msg.lineno,
  File "main.py", line 47, in warn_with_traceback
    traceback.print_stack(file=log)
/home/philip/projects/ltspice_examples_code_repo/Circuit-Completion-Using-GNNs/component_classification_with_link_prediction_head/evaluation/FEGIN/kernel/circuit_datasets.py:15: FutureWarning: You are using `torch.load` with `weights_only=False` (the current default value), which uses the default pickle module implicitly. It is possible to construct malicious pickle data which will execute arbitrary code during unpickling (See https://github.com/pytorch/pytorch/blob/main/SECURITY.md#untrusted-models for more details). In a future release, the default value for `weights_only` will be flipped to `True`. This limits the functions that could be executed during unpickling. Arbitrary objects will no longer be allowed to be loaded via this mode unless they are explicitly allowlisted by the user via `torch.serialization.add_safe_globals`. We recommend you start setting `weights_only=True` for any use case where you don't have full control of the loaded file. Please open an issue on GitHub for any issues related to this experimental feature.
  self.data, self.slices = torch.load(self.processed_paths[0])
