STDOUT:
Results will be saved in /home/philip/projects/ltspice_examples_code_repo/Circuit-Completion-Using-GNNs/component_classification_with_link_prediction_head/evaluation/FEGIN/results/model_FEGIN_dataset_ltspice_examples
Command line input: python main.py --data ltspice_examples --representation component_pin --model FEGIN --layers 5 --hiddens 32 --batch_size 32 --lr 0.0001 --emb_size 250 --epochs 100 --save_appendix component_pin_L5_H32_BS32_LR0.0001_E250 --no_val
 is saved.
-----
ltspice_examples - FEGIN
Using 5 layers, 32 hidden units, h = 2
Loading component_pin representation dataset
ENTERED
Training FEGIN on component_pin representation
Train: 3560, Test: 848
##################ITERATION #0 ****************************************
 epoch: 0, train_loss: 1.3900, test_loss: 1.3750, test_f1: 0.1431
 epoch: 1, train_loss: 1.3616, test_loss: 1.3505, test_f1: 0.2252
 epoch: 2, train_loss: 1.3294, test_loss: 1.3172, test_f1: 0.2315
 epoch: 3, train_loss: 1.2944, test_loss: 1.2856, test_f1: 0.2260
 epoch: 4, train_loss: 1.2675, test_loss: 1.2614, test_f1: 0.2262
 epoch: 5, train_loss: 1.2499, test_loss: 1.2402, test_f1: 0.2285
 epoch: 6, train_loss: 1.2381, test_loss: 1.2246, test_f1: 0.2303
 epoch: 7, train_loss: 1.2251, test_loss: 1.2117, test_f1: 0.2342
 epoch: 8, train_loss: 1.2108, test_loss: 1.1965, test_f1: 0.2353
 epoch: 9, train_loss: 1.2006, test_loss: 1.1833, test_f1: 0.2303
 epoch: 10, train_loss: 1.1886, test_loss: 1.1707, test_f1: 0.3153
 epoch: 11, train_loss: 1.1744, test_loss: 1.1599, test_f1: 0.3280
 epoch: 12, train_loss: 1.1643, test_loss: 1.1473, test_f1: 0.3342
 epoch: 13, train_loss: 1.1523, test_loss: 1.1237, test_f1: 0.3523
 epoch: 14, train_loss: 1.1265, test_loss: 1.1012, test_f1: 0.3532
 epoch: 15, train_loss: 1.1071, test_loss: 1.0734, test_f1: 0.3568
 epoch: 16, train_loss: 1.0885, test_loss: 1.0537, test_f1: 0.3559
 epoch: 17, train_loss: 1.0682, test_loss: 1.0392, test_f1: 0.3587
 epoch: 18, train_loss: 1.0459, test_loss: 1.0282, test_f1: 0.3561
 epoch: 19, train_loss: 1.0397, test_loss: 1.0195, test_f1: 0.3875
 epoch: 20, train_loss: 1.0251, test_loss: 1.0121, test_f1: 0.3726
 epoch: 21, train_loss: 1.0173, test_loss: 1.0121, test_f1: 0.4264
 epoch: 22, train_loss: 1.0085, test_loss: 1.0019, test_f1: 0.3933
 epoch: 23, train_loss: 1.0004, test_loss: 1.0070, test_f1: 0.4375
 epoch: 24, train_loss: 0.9955, test_loss: 0.9968, test_f1: 0.4453
 epoch: 25, train_loss: 0.9805, test_loss: 0.9941, test_f1: 0.4752
 epoch: 26, train_loss: 0.9738, test_loss: 0.9967, test_f1: 0.4563
 epoch: 27, train_loss: 0.9798, test_loss: 0.9919, test_f1: 0.4756
 epoch: 28, train_loss: 0.9717, test_loss: 0.9890, test_f1: 0.4648
 epoch: 29, train_loss: 0.9558, test_loss: 0.9965, test_f1: 0.4629
 epoch: 30, train_loss: 0.9610, test_loss: 0.9855, test_f1: 0.4586
 epoch: 31, train_loss: 0.9467, test_loss: 0.9817, test_f1: 0.4935
 epoch: 32, train_loss: 0.9465, test_loss: 0.9787, test_f1: 0.4762
 epoch: 33, train_loss: 0.9460, test_loss: 0.9907, test_f1: 0.4877
 epoch: 34, train_loss: 0.9326, test_loss: 0.9723, test_f1: 0.4717
 epoch: 35, train_loss: 0.9387, test_loss: 0.9727, test_f1: 0.4932
 epoch: 36, train_loss: 0.9240, test_loss: 0.9791, test_f1: 0.4796
 epoch: 37, train_loss: 0.9336, test_loss: 0.9882, test_f1: 0.4697
 epoch: 38, train_loss: 0.9166, test_loss: 0.9816, test_f1: 0.4704
 epoch: 39, train_loss: 0.9299, test_loss: 0.9687, test_f1: 0.4921
 epoch: 40, train_loss: 0.9193, test_loss: 0.9771, test_f1: 0.4810
 epoch: 41, train_loss: 0.9190, test_loss: 0.9845, test_f1: 0.4776
 epoch: 42, train_loss: 0.9108, test_loss: 0.9727, test_f1: 0.4830
 epoch: 43, train_loss: 0.9038, test_loss: 0.9690, test_f1: 0.4720
 epoch: 44, train_loss: 0.8941, test_loss: 0.9722, test_f1: 0.4888
 epoch: 45, train_loss: 0.9104, test_loss: 0.9654, test_f1: 0.4787
 epoch: 46, train_loss: 0.8962, test_loss: 0.9655, test_f1: 0.4801
 epoch: 47, train_loss: 0.8929, test_loss: 0.9947, test_f1: 0.4827
 epoch: 48, train_loss: 0.8997, test_loss: 0.9734, test_f1: 0.4837
 epoch: 49, train_loss: 0.8933, test_loss: 0.9758, test_f1: 0.4716
 epoch: 50, train_loss: 0.8928, test_loss: 0.9668, test_f1: 0.4856
 epoch: 51, train_loss: 0.8840, test_loss: 0.9996, test_f1: 0.4715
 epoch: 52, train_loss: 0.8823, test_loss: 0.9828, test_f1: 0.4844
 epoch: 53, train_loss: 0.8805, test_loss: 0.9615, test_f1: 0.4848
 epoch: 54, train_loss: 0.8810, test_loss: 0.9619, test_f1: 0.4887
 epoch: 55, train_loss: 0.8751, test_loss: 0.9660, test_f1: 0.4923
 epoch: 56, train_loss: 0.8792, test_loss: 0.9672, test_f1: 0.4904
 epoch: 57, train_loss: 0.8798, test_loss: 0.9714, test_f1: 0.4812
 epoch: 58, train_loss: 0.8763, test_loss: 0.9597, test_f1: 0.4858
 epoch: 59, train_loss: 0.8713, test_loss: 0.9598, test_f1: 0.4790
 epoch: 60, train_loss: 0.8725, test_loss: 0.9717, test_f1: 0.4766
 epoch: 61, train_loss: 0.8677, test_loss: 0.9595, test_f1: 0.4942
 epoch: 62, train_loss: 0.8666, test_loss: 0.9622, test_f1: 0.4811
 epoch: 63, train_loss: 0.8667, test_loss: 0.9478, test_f1: 0.4850
 epoch: 64, train_loss: 0.8724, test_loss: 0.9714, test_f1: 0.4804
 epoch: 65, train_loss: 0.8747, test_loss: 0.9552, test_f1: 0.4916
 epoch: 66, train_loss: 0.8777, test_loss: 0.9548, test_f1: 0.5000
 epoch: 67, train_loss: 0.8629, test_loss: 0.9610, test_f1: 0.4839
 epoch: 68, train_loss: 0.8745, test_loss: 0.9404, test_f1: 0.4903
 epoch: 69, train_loss: 0.8638, test_loss: 0.9633, test_f1: 0.4860
 epoch: 70, train_loss: 0.8600, test_loss: 0.9428, test_f1: 0.4922
 epoch: 71, train_loss: 0.8589, test_loss: 0.9401, test_f1: 0.4970
 epoch: 72, train_loss: 0.8661, test_loss: 0.9508, test_f1: 0.4988
 epoch: 73, train_loss: 0.8617, test_loss: 0.9489, test_f1: 0.4994
 epoch: 74, train_loss: 0.8654, test_loss: 0.9522, test_f1: 0.4962
 epoch: 75, train_loss: 0.8635, test_loss: 0.9616, test_f1: 0.4894
 epoch: 76, train_loss: 0.8690, test_loss: 0.9604, test_f1: 0.4966
 epoch: 77, train_loss: 0.8551, test_loss: 0.9375, test_f1: 0.4959
 epoch: 78, train_loss: 0.8472, test_loss: 0.9621, test_f1: 0.4902
 epoch: 79, train_loss: 0.8594, test_loss: 0.9449, test_f1: 0.4983
 epoch: 80, train_loss: 0.8559, test_loss: 0.9436, test_f1: 0.4913
 epoch: 81, train_loss: 0.8472, test_loss: 0.9554, test_f1: 0.4971
 epoch: 82, train_loss: 0.8503, test_loss: 0.9340, test_f1: 0.5067
 epoch: 83, train_loss: 0.8531, test_loss: 0.9698, test_f1: 0.4839
 epoch: 84, train_loss: 0.8398, test_loss: 0.9521, test_f1: 0.4969
 epoch: 85, train_loss: 0.8419, test_loss: 0.9418, test_f1: 0.5066
 epoch: 86, train_loss: 0.8471, test_loss: 0.9476, test_f1: 0.5008
 epoch: 87, train_loss: 0.8513, test_loss: 0.9457, test_f1: 0.4951
 epoch: 88, train_loss: 0.8364, test_loss: 0.9565, test_f1: 0.5007
 epoch: 89, train_loss: 0.8422, test_loss: 0.9469, test_f1: 0.4973
 epoch: 90, train_loss: 0.8424, test_loss: 0.9388, test_f1: 0.5106
 epoch: 91, train_loss: 0.8464, test_loss: 0.9339, test_f1: 0.5112
 epoch: 92, train_loss: 0.8343, test_loss: 0.9527, test_f1: 0.4931
 epoch: 93, train_loss: 0.8360, test_loss: 0.9464, test_f1: 0.5013
 epoch: 94, train_loss: 0.8349, test_loss: 0.9413, test_f1: 0.5035
 epoch: 95, train_loss: 0.8314, test_loss: 0.9751, test_f1: 0.5012
 epoch: 96, train_loss: 0.8369, test_loss: 0.9446, test_f1: 0.5097
 epoch: 97, train_loss: 0.8327, test_loss: 0.9645, test_f1: 0.4965
 epoch: 98, train_loss: 0.8191, test_loss: 0.9217, test_f1: 0.5009
 epoch: 99, train_loss: 0.8341, test_loss: 0.9533, test_f1: 0.5081
##################ITERATION #1 ****************************************
 epoch: 0, train_loss: 1.3275, test_loss: 1.2861, test_f1: 0.2260
 epoch: 1, train_loss: 1.2677, test_loss: 1.2325, test_f1: 0.2680
 epoch: 2, train_loss: 1.2309, test_loss: 1.1889, test_f1: 0.3392
 epoch: 3, train_loss: 1.1960, test_loss: 1.1530, test_f1: 0.3381
 epoch: 4, train_loss: 1.1628, test_loss: 1.1182, test_f1: 0.3388
 epoch: 5, train_loss: 1.1340, test_loss: 1.0940, test_f1: 0.3410
 epoch: 6, train_loss: 1.1130, test_loss: 1.0744, test_f1: 0.3403
 epoch: 7, train_loss: 1.0974, test_loss: 1.0607, test_f1: 0.3415
 epoch: 8, train_loss: 1.0778, test_loss: 1.0558, test_f1: 0.3429
 epoch: 9, train_loss: 1.0654, test_loss: 1.0470, test_f1: 0.3405
 epoch: 10, train_loss: 1.0551, test_loss: 1.0374, test_f1: 0.3457
 epoch: 11, train_loss: 1.0485, test_loss: 1.0407, test_f1: 0.3489
 epoch: 12, train_loss: 1.0377, test_loss: 1.0200, test_f1: 0.3635
 epoch: 13, train_loss: 1.0290, test_loss: 1.0183, test_f1: 0.3859
 epoch: 14, train_loss: 1.0289, test_loss: 1.0264, test_f1: 0.3873
 epoch: 15, train_loss: 1.0211, test_loss: 1.0169, test_f1: 0.4158
 epoch: 16, train_loss: 1.0013, test_loss: 1.0207, test_f1: 0.4477
 epoch: 17, train_loss: 1.0038, test_loss: 1.0160, test_f1: 0.4653
 epoch: 18, train_loss: 0.9967, test_loss: 1.0078, test_f1: 0.4711
 epoch: 19, train_loss: 0.9913, test_loss: 1.0160, test_f1: 0.4567
 epoch: 20, train_loss: 0.9869, test_loss: 1.0067, test_f1: 0.4599
 epoch: 21, train_loss: 0.9826, test_loss: 1.0042, test_f1: 0.4630
 epoch: 22, train_loss: 0.9784, test_loss: 1.0003, test_f1: 0.4680
 epoch: 23, train_loss: 0.9795, test_loss: 1.0090, test_f1: 0.4572
 epoch: 24, train_loss: 0.9706, test_loss: 1.0023, test_f1: 0.4770
 epoch: 25, train_loss: 0.9653, test_loss: 1.0017, test_f1: 0.4707
 epoch: 26, train_loss: 0.9674, test_loss: 1.0038, test_f1: 0.4881
 epoch: 27, train_loss: 0.9572, test_loss: 1.0166, test_f1: 0.4741
 epoch: 28, train_loss: 0.9551, test_loss: 1.0113, test_f1: 0.4733
 epoch: 29, train_loss: 0.9473, test_loss: 0.9881, test_f1: 0.4880
 epoch: 30, train_loss: 0.9469, test_loss: 0.9801, test_f1: 0.4882
 epoch: 31, train_loss: 0.9397, test_loss: 0.9956, test_f1: 0.4995
 epoch: 32, train_loss: 0.9401, test_loss: 0.9796, test_f1: 0.4998
 epoch: 33, train_loss: 0.9365, test_loss: 0.9711, test_f1: 0.5037
 epoch: 34, train_loss: 0.9237, test_loss: 0.9432, test_f1: 0.4991
 epoch: 35, train_loss: 0.9233, test_loss: 0.9620, test_f1: 0.5161
 epoch: 36, train_loss: 0.9152, test_loss: 0.9567, test_f1: 0.5144
 epoch: 37, train_loss: 0.9169, test_loss: 0.9531, test_f1: 0.5343
 epoch: 38, train_loss: 0.9173, test_loss: 0.9460, test_f1: 0.5214
 epoch: 39, train_loss: 0.9122, test_loss: 0.9785, test_f1: 0.4966
 epoch: 40, train_loss: 0.9119, test_loss: 0.9568, test_f1: 0.5172
 epoch: 41, train_loss: 0.8927, test_loss: 0.9516, test_f1: 0.5161
 epoch: 42, train_loss: 0.8981, test_loss: 0.9300, test_f1: 0.5364
 epoch: 43, train_loss: 0.8940, test_loss: 0.9524, test_f1: 0.5075
 epoch: 44, train_loss: 0.8940, test_loss: 0.9117, test_f1: 0.5159
 epoch: 45, train_loss: 0.8979, test_loss: 0.9493, test_f1: 0.5039
 epoch: 46, train_loss: 0.8861, test_loss: 0.9334, test_f1: 0.5172
 epoch: 47, train_loss: 0.8837, test_loss: 0.9804, test_f1: 0.4798
 epoch: 48, train_loss: 0.8774, test_loss: 0.9673, test_f1: 0.5035
 epoch: 49, train_loss: 0.8804, test_loss: 0.9421, test_f1: 0.5025
 epoch: 50, train_loss: 0.8709, test_loss: 0.9229, test_f1: 0.5171
 epoch: 51, train_loss: 0.8677, test_loss: 0.9360, test_f1: 0.5239
 epoch: 52, train_loss: 0.8649, test_loss: 0.9334, test_f1: 0.5220
 epoch: 53, train_loss: 0.8616, test_loss: 0.9250, test_f1: 0.5129
 epoch: 54, train_loss: 0.8614, test_loss: 0.9453, test_f1: 0.5039
 epoch: 55, train_loss: 0.8660, test_loss: 0.9140, test_f1: 0.5145
 epoch: 56, train_loss: 0.8579, test_loss: 0.9267, test_f1: 0.5283
 epoch: 57, train_loss: 0.8514, test_loss: 0.9221, test_f1: 0.5067
 epoch: 58, train_loss: 0.8540, test_loss: 0.9190, test_f1: 0.5193
 epoch: 59, train_loss: 0.8534, test_loss: 0.9342, test_f1: 0.5134
 epoch: 60, train_loss: 0.8574, test_loss: 0.9474, test_f1: 0.5127
 epoch: 61, train_loss: 0.8588, test_loss: 0.9318, test_f1: 0.5146
 epoch: 62, train_loss: 0.8566, test_loss: 0.9032, test_f1: 0.5240
 epoch: 63, train_loss: 0.8569, test_loss: 0.9127, test_f1: 0.5327
 epoch: 64, train_loss: 0.8526, test_loss: 0.9461, test_f1: 0.5226
 epoch: 65, train_loss: 0.8432, test_loss: 0.8978, test_f1: 0.5435
 epoch: 66, train_loss: 0.8500, test_loss: 0.9012, test_f1: 0.5218
 epoch: 67, train_loss: 0.8408, test_loss: 0.9206, test_f1: 0.5172
 epoch: 68, train_loss: 0.8400, test_loss: 0.9305, test_f1: 0.5247
 epoch: 69, train_loss: 0.8419, test_loss: 0.9155, test_f1: 0.5113
 epoch: 70, train_loss: 0.8488, test_loss: 0.9094, test_f1: 0.5244
 epoch: 71, train_loss: 0.8477, test_loss: 0.9018, test_f1: 0.5281
 epoch: 72, train_loss: 0.8478, test_loss: 0.9442, test_f1: 0.5169
 epoch: 73, train_loss: 0.8303, test_loss: 0.9301, test_f1: 0.5230
 epoch: 74, train_loss: 0.8383, test_loss: 0.8698, test_f1: 0.5117
 epoch: 75, train_loss: 0.8339, test_loss: 0.9087, test_f1: 0.5046
 epoch: 76, train_loss: 0.8341, test_loss: 0.9213, test_f1: 0.5174
 epoch: 77, train_loss: 0.8268, test_loss: 0.9293, test_f1: 0.5264
 epoch: 78, train_loss: 0.8342, test_loss: 0.9168, test_f1: 0.5242
 epoch: 79, train_loss: 0.8386, test_loss: 0.9399, test_f1: 0.5221
 epoch: 80, train_loss: 0.8341, test_loss: 0.9043, test_f1: 0.5235
 epoch: 81, train_loss: 0.8350, test_loss: 0.8980, test_f1: 0.5313
 epoch: 82, train_loss: 0.8337, test_loss: 0.9172, test_f1: 0.5232
 epoch: 83, train_loss: 0.8322, test_loss: 0.8990, test_f1: 0.5228
 epoch: 84, train_loss: 0.8275, test_loss: 0.9081, test_f1: 0.5263
 epoch: 85, train_loss: 0.8280, test_loss: 0.8992, test_f1: 0.5247
 epoch: 86, train_loss: 0.8279, test_loss: 0.9151, test_f1: 0.5172
 epoch: 87, train_loss: 0.8237, test_loss: 0.8984, test_f1: 0.5232
 epoch: 88, train_loss: 0.8292, test_loss: 0.9307, test_f1: 0.5216
 epoch: 89, train_loss: 0.8207, test_loss: 0.9115, test_f1: 0.5173
 epoch: 90, train_loss: 0.8174, test_loss: 0.9198, test_f1: 0.5132
 epoch: 91, train_loss: 0.8044, test_loss: 0.9068, test_f1: 0.5255
 epoch: 92, train_loss: 0.8140, test_loss: 0.8858, test_f1: 0.5328
 epoch: 93, train_loss: 0.8180, test_loss: 0.9040, test_f1: 0.5177
 epoch: 94, train_loss: 0.8178, test_loss: 0.8682, test_f1: 0.5305
 epoch: 95, train_loss: 0.8100, test_loss: 0.9361, test_f1: 0.5256
 epoch: 96, train_loss: 0.8163, test_loss: 0.9038, test_f1: 0.5205
 epoch: 97, train_loss: 0.8111, test_loss: 0.8944, test_f1: 0.5195
 epoch: 98, train_loss: 0.8174, test_loss: 0.9504, test_f1: 0.5130
 epoch: 99, train_loss: 0.8107, test_loss: 0.9500, test_f1: 0.5165
##################ITERATION #2 ****************************************
 epoch: 0, train_loss: 1.2913, test_loss: 1.2485, test_f1: 0.2260
 epoch: 1, train_loss: 1.2460, test_loss: 1.2035, test_f1: 0.3160
 epoch: 2, train_loss: 1.2073, test_loss: 1.1657, test_f1: 0.3324
 epoch: 3, train_loss: 1.1732, test_loss: 1.1229, test_f1: 0.3354
 epoch: 4, train_loss: 1.1467, test_loss: 1.0933, test_f1: 0.3454
 epoch: 5, train_loss: 1.1164, test_loss: 1.0669, test_f1: 0.3884
 epoch: 6, train_loss: 1.0997, test_loss: 1.0497, test_f1: 0.4178
 epoch: 7, train_loss: 1.0826, test_loss: 1.0466, test_f1: 0.4097
 epoch: 8, train_loss: 1.0671, test_loss: 1.0395, test_f1: 0.4323
 epoch: 9, train_loss: 1.0594, test_loss: 1.0427, test_f1: 0.4306
 epoch: 10, train_loss: 1.0520, test_loss: 1.0337, test_f1: 0.4451
 epoch: 11, train_loss: 1.0355, test_loss: 1.0353, test_f1: 0.4464
 epoch: 12, train_loss: 1.0353, test_loss: 1.0354, test_f1: 0.4488
 epoch: 13, train_loss: 1.0323, test_loss: 1.0379, test_f1: 0.4688
 epoch: 14, train_loss: 1.0272, test_loss: 1.0263, test_f1: 0.4629
 epoch: 15, train_loss: 1.0138, test_loss: 1.0367, test_f1: 0.4674
 epoch: 16, train_loss: 1.0122, test_loss: 1.0321, test_f1: 0.4630
 epoch: 17, train_loss: 1.0125, test_loss: 1.0367, test_f1: 0.4761
 epoch: 18, train_loss: 1.0009, test_loss: 1.0280, test_f1: 0.4685
 epoch: 19, train_loss: 1.0079, test_loss: 1.0230, test_f1: 0.4691
 epoch: 20, train_loss: 0.9991, test_loss: 1.0381, test_f1: 0.4794
 epoch: 21, train_loss: 0.9928, test_loss: 1.0324, test_f1: 0.4885
 epoch: 22, train_loss: 0.9907, test_loss: 1.0251, test_f1: 0.4944
 epoch: 23, train_loss: 0.9782, test_loss: 1.0230, test_f1: 0.4927
 epoch: 24, train_loss: 0.9821, test_loss: 1.0224, test_f1: 0.4919
 epoch: 25, train_loss: 0.9765, test_loss: 1.0245, test_f1: 0.4971
 epoch: 26, train_loss: 0.9779, test_loss: 1.0167, test_f1: 0.5056
 epoch: 27, train_loss: 0.9694, test_loss: 1.0104, test_f1: 0.4885
 epoch: 28, train_loss: 0.9664, test_loss: 1.0130, test_f1: 0.5022
 epoch: 29, train_loss: 0.9578, test_loss: 1.0155, test_f1: 0.5031
 epoch: 30, train_loss: 0.9604, test_loss: 0.9950, test_f1: 0.5123
 epoch: 31, train_loss: 0.9562, test_loss: 0.9945, test_f1: 0.5049
 epoch: 32, train_loss: 0.9484, test_loss: 1.0034, test_f1: 0.4941
 epoch: 33, train_loss: 0.9573, test_loss: 1.0071, test_f1: 0.5058
 epoch: 34, train_loss: 0.9520, test_loss: 0.9852, test_f1: 0.5067
 epoch: 35, train_loss: 0.9535, test_loss: 0.9885, test_f1: 0.4817
 epoch: 36, train_loss: 0.9336, test_loss: 0.9798, test_f1: 0.5003
 epoch: 37, train_loss: 0.9371, test_loss: 0.9911, test_f1: 0.4854
 epoch: 38, train_loss: 0.9369, test_loss: 0.9673, test_f1: 0.5136
 epoch: 39, train_loss: 0.9293, test_loss: 0.9727, test_f1: 0.5053
 epoch: 40, train_loss: 0.9370, test_loss: 0.9820, test_f1: 0.4952
 epoch: 41, train_loss: 0.9228, test_loss: 0.9728, test_f1: 0.5043
 epoch: 42, train_loss: 0.9302, test_loss: 0.9808, test_f1: 0.5180
 epoch: 43, train_loss: 0.9111, test_loss: 0.9842, test_f1: 0.4852
 epoch: 44, train_loss: 0.9119, test_loss: 0.9720, test_f1: 0.5189
 epoch: 45, train_loss: 0.9171, test_loss: 0.9773, test_f1: 0.5234
 epoch: 46, train_loss: 0.9092, test_loss: 0.9694, test_f1: 0.5039
 epoch: 47, train_loss: 0.9100, test_loss: 0.9761, test_f1: 0.5125
 epoch: 48, train_loss: 0.9127, test_loss: 0.9998, test_f1: 0.4836
 epoch: 49, train_loss: 0.8959, test_loss: 0.9691, test_f1: 0.5101
 epoch: 50, train_loss: 0.9011, test_loss: 0.9740, test_f1: 0.4980
 epoch: 51, train_loss: 0.8939, test_loss: 0.9629, test_f1: 0.5176
 epoch: 52, train_loss: 0.8873, test_loss: 0.9616, test_f1: 0.5105
 epoch: 53, train_loss: 0.9035, test_loss: 0.9659, test_f1: 0.5023
 epoch: 54, train_loss: 0.8932, test_loss: 0.9651, test_f1: 0.5057
 epoch: 55, train_loss: 0.8935, test_loss: 0.9640, test_f1: 0.5114
 epoch: 56, train_loss: 0.8852, test_loss: 0.9798, test_f1: 0.5078
 epoch: 57, train_loss: 0.8870, test_loss: 0.9494, test_f1: 0.4882
 epoch: 58, train_loss: 0.8843, test_loss: 0.9698, test_f1: 0.5000
 epoch: 59, train_loss: 0.8900, test_loss: 0.9700, test_f1: 0.5166
 epoch: 60, train_loss: 0.8779, test_loss: 0.9895, test_f1: 0.5155
 epoch: 61, train_loss: 0.8879, test_loss: 0.9623, test_f1: 0.5057
 epoch: 62, train_loss: 0.8840, test_loss: 0.9641, test_f1: 0.5132
 epoch: 63, train_loss: 0.8750, test_loss: 0.9542, test_f1: 0.5063
 epoch: 64, train_loss: 0.8728, test_loss: 0.9725, test_f1: 0.5063
 epoch: 65, train_loss: 0.8762, test_loss: 0.9674, test_f1: 0.5026
 epoch: 66, train_loss: 0.8824, test_loss: 0.9751, test_f1: 0.5069
 epoch: 67, train_loss: 0.8813, test_loss: 0.9533, test_f1: 0.5150
 epoch: 68, train_loss: 0.8742, test_loss: 0.9546, test_f1: 0.5273
 epoch: 69, train_loss: 0.8706, test_loss: 0.9628, test_f1: 0.5323
 epoch: 70, train_loss: 0.8707, test_loss: 0.9587, test_f1: 0.5162
 epoch: 71, train_loss: 0.8690, test_loss: 0.9607, test_f1: 0.5108
 epoch: 72, train_loss: 0.8715, test_loss: 0.9602, test_f1: 0.5065
 epoch: 73, train_loss: 0.8711, test_loss: 0.9554, test_f1: 0.5121
 epoch: 74, train_loss: 0.8697, test_loss: 0.9570, test_f1: 0.5211
 epoch: 75, train_loss: 0.8626, test_loss: 0.9513, test_f1: 0.5068
 epoch: 76, train_loss: 0.8688, test_loss: 0.9614, test_f1: 0.5356
 epoch: 77, train_loss: 0.8628, test_loss: 0.9590, test_f1: 0.5045
 epoch: 78, train_loss: 0.8558, test_loss: 0.9790, test_f1: 0.5326
 epoch: 79, train_loss: 0.8628, test_loss: 0.9607, test_f1: 0.5196
 epoch: 80, train_loss: 0.8648, test_loss: 0.9605, test_f1: 0.5163
 epoch: 81, train_loss: 0.8610, test_loss: 0.9450, test_f1: 0.5049
 epoch: 82, train_loss: 0.8599, test_loss: 0.9644, test_f1: 0.4952
 epoch: 83, train_loss: 0.8581, test_loss: 0.9653, test_f1: 0.5191
 epoch: 84, train_loss: 0.8554, test_loss: 0.9592, test_f1: 0.5225
 epoch: 85, train_loss: 0.8595, test_loss: 0.9609, test_f1: 0.5238
 epoch: 86, train_loss: 0.8678, test_loss: 0.9703, test_f1: 0.5206
 epoch: 87, train_loss: 0.8622, test_loss: 0.9517, test_f1: 0.5078
 epoch: 88, train_loss: 0.8636, test_loss: 0.9548, test_f1: 0.5242
 epoch: 89, train_loss: 0.8502, test_loss: 0.9602, test_f1: 0.5151
 epoch: 90, train_loss: 0.8519, test_loss: 0.9577, test_f1: 0.5236
 epoch: 91, train_loss: 0.8513, test_loss: 0.9465, test_f1: 0.5243
 epoch: 92, train_loss: 0.8531, test_loss: 0.9751, test_f1: 0.5018
 epoch: 93, train_loss: 0.8547, test_loss: 0.9573, test_f1: 0.5281
 epoch: 94, train_loss: 0.8495, test_loss: 0.9475, test_f1: 0.5301
 epoch: 95, train_loss: 0.8542, test_loss: 0.9611, test_f1: 0.5198
 epoch: 96, train_loss: 0.8380, test_loss: 0.9533, test_f1: 0.5194
 epoch: 97, train_loss: 0.8501, test_loss: 0.9516, test_f1: 0.5184
 epoch: 98, train_loss: 0.8428, test_loss: 0.9576, test_f1: 0.5202
 epoch: 99, train_loss: 0.8396, test_loss: 0.9661, test_f1: 0.5151
##################ITERATION #3 ****************************************
 epoch: 0, train_loss: 1.2718, test_loss: 1.2093, test_f1: 0.2564
 epoch: 1, train_loss: 1.2197, test_loss: 1.1721, test_f1: 0.3270
 epoch: 2, train_loss: 1.1880, test_loss: 1.1306, test_f1: 0.3367
 epoch: 3, train_loss: 1.1537, test_loss: 1.0991, test_f1: 0.3747
 epoch: 4, train_loss: 1.1281, test_loss: 1.0879, test_f1: 0.3967
 epoch: 5, train_loss: 1.1103, test_loss: 1.0658, test_f1: 0.4307
 epoch: 6, train_loss: 1.0890, test_loss: 1.0579, test_f1: 0.4098
 epoch: 7, train_loss: 1.0746, test_loss: 1.0431, test_f1: 0.4557
 epoch: 8, train_loss: 1.0549, test_loss: 1.0365, test_f1: 0.4677
 epoch: 9, train_loss: 1.0464, test_loss: 1.0268, test_f1: 0.4750
 epoch: 10, train_loss: 1.0286, test_loss: 1.0268, test_f1: 0.4568
 epoch: 11, train_loss: 1.0275, test_loss: 1.0030, test_f1: 0.4776
 epoch: 12, train_loss: 1.0135, test_loss: 1.0093, test_f1: 0.4808
 epoch: 13, train_loss: 1.0047, test_loss: 0.9923, test_f1: 0.4854
 epoch: 14, train_loss: 0.9999, test_loss: 0.9892, test_f1: 0.4765
 epoch: 15, train_loss: 0.9928, test_loss: 1.0000, test_f1: 0.4584
 epoch: 16, train_loss: 0.9846, test_loss: 0.9992, test_f1: 0.4693
 epoch: 17, train_loss: 0.9846, test_loss: 1.0063, test_f1: 0.4664
 epoch: 18, train_loss: 0.9734, test_loss: 0.9968, test_f1: 0.4694
 epoch: 19, train_loss: 0.9770, test_loss: 1.0004, test_f1: 0.4732
 epoch: 20, train_loss: 0.9655, test_loss: 0.9954, test_f1: 0.4781
 epoch: 21, train_loss: 0.9630, test_loss: 0.9912, test_f1: 0.4815
 epoch: 22, train_loss: 0.9619, test_loss: 0.9755, test_f1: 0.4733
 epoch: 23, train_loss: 0.9654, test_loss: 0.9761, test_f1: 0.4973
 epoch: 24, train_loss: 0.9453, test_loss: 0.9756, test_f1: 0.4844
 epoch: 25, train_loss: 0.9498, test_loss: 1.0040, test_f1: 0.4794
 epoch: 26, train_loss: 0.9491, test_loss: 0.9866, test_f1: 0.4812
 epoch: 27, train_loss: 0.9337, test_loss: 0.9705, test_f1: 0.4864
 epoch: 28, train_loss: 0.9372, test_loss: 0.9726, test_f1: 0.4883
 epoch: 29, train_loss: 0.9361, test_loss: 1.0253, test_f1: 0.4701
 epoch: 30, train_loss: 0.9277, test_loss: 0.9821, test_f1: 0.4984
 epoch: 31, train_loss: 0.9311, test_loss: 0.9861, test_f1: 0.4764
 epoch: 32, train_loss: 0.9245, test_loss: 0.9419, test_f1: 0.4986
 epoch: 33, train_loss: 0.9214, test_loss: 0.9973, test_f1: 0.4839
 epoch: 34, train_loss: 0.9150, test_loss: 0.9821, test_f1: 0.5061
 epoch: 35, train_loss: 0.9120, test_loss: 0.9619, test_f1: 0.4927
 epoch: 36, train_loss: 0.9129, test_loss: 0.9794, test_f1: 0.4887
 epoch: 37, train_loss: 0.9095, test_loss: 0.9628, test_f1: 0.5112
 epoch: 38, train_loss: 0.9087, test_loss: 0.9785, test_f1: 0.4938
 epoch: 39, train_loss: 0.9099, test_loss: 0.9344, test_f1: 0.5105
 epoch: 40, train_loss: 0.8988, test_loss: 0.9727, test_f1: 0.4942
 epoch: 41, train_loss: 0.8961, test_loss: 0.9957, test_f1: 0.5085
 epoch: 42, train_loss: 0.8957, test_loss: 0.9576, test_f1: 0.5281
 epoch: 43, train_loss: 0.8984, test_loss: 0.9508, test_f1: 0.5152
 epoch: 44, train_loss: 0.8905, test_loss: 0.9633, test_f1: 0.5310
 epoch: 45, train_loss: 0.8920, test_loss: 0.9482, test_f1: 0.5119
 epoch: 46, train_loss: 0.8929, test_loss: 0.9365, test_f1: 0.5304
 epoch: 47, train_loss: 0.8913, test_loss: 0.9507, test_f1: 0.5224
 epoch: 48, train_loss: 0.8819, test_loss: 0.9422, test_f1: 0.5246
 epoch: 49, train_loss: 0.8812, test_loss: 1.0079, test_f1: 0.4922
 epoch: 50, train_loss: 0.8837, test_loss: 0.9552, test_f1: 0.5122
 epoch: 51, train_loss: 0.8712, test_loss: 0.9746, test_f1: 0.4960
 epoch: 52, train_loss: 0.8722, test_loss: 0.9839, test_f1: 0.5143
 epoch: 53, train_loss: 0.8710, test_loss: 0.9126, test_f1: 0.5097
 epoch: 54, train_loss: 0.8732, test_loss: 0.9422, test_f1: 0.5338
 epoch: 55, train_loss: 0.8696, test_loss: 0.9768, test_f1: 0.4932
 epoch: 56, train_loss: 0.8715, test_loss: 0.9606, test_f1: 0.5507
 epoch: 57, train_loss: 0.8691, test_loss: 0.9538, test_f1: 0.5266
 epoch: 58, train_loss: 0.8577, test_loss: 0.9707, test_f1: 0.5048
 epoch: 59, train_loss: 0.8738, test_loss: 0.9690, test_f1: 0.4991
 epoch: 60, train_loss: 0.8600, test_loss: 0.9404, test_f1: 0.5393
 epoch: 61, train_loss: 0.8638, test_loss: 0.9493, test_f1: 0.5332
 epoch: 62, train_loss: 0.8650, test_loss: 0.9208, test_f1: 0.5304
 epoch: 63, train_loss: 0.8697, test_loss: 0.9418, test_f1: 0.5193
 epoch: 64, train_loss: 0.8626, test_loss: 0.9127, test_f1: 0.5193
 epoch: 65, train_loss: 0.8625, test_loss: 0.9506, test_f1: 0.5444
 epoch: 66, train_loss: 0.8493, test_loss: 0.9364, test_f1: 0.5106
 epoch: 67, train_loss: 0.8571, test_loss: 0.9315, test_f1: 0.5446
 epoch: 68, train_loss: 0.8579, test_loss: 0.9403, test_f1: 0.5162
 epoch: 69, train_loss: 0.8564, test_loss: 0.9094, test_f1: 0.5141
 epoch: 70, train_loss: 0.8564, test_loss: 0.9475, test_f1: 0.5019
 epoch: 71, train_loss: 0.8563, test_loss: 0.9755, test_f1: 0.5204
 epoch: 72, train_loss: 0.8511, test_loss: 0.9331, test_f1: 0.5385
 epoch: 73, train_loss: 0.8425, test_loss: 0.9188, test_f1: 0.5316
 epoch: 74, train_loss: 0.8425, test_loss: 0.9466, test_f1: 0.5275
 epoch: 75, train_loss: 0.8599, test_loss: 0.9688, test_f1: 0.4971
 epoch: 76, train_loss: 0.8479, test_loss: 0.9314, test_f1: 0.5363
 epoch: 77, train_loss: 0.8481, test_loss: 0.9241, test_f1: 0.5148
 epoch: 78, train_loss: 0.8504, test_loss: 0.9445, test_f1: 0.5173
 epoch: 79, train_loss: 0.8479, test_loss: 0.9280, test_f1: 0.5314
 epoch: 80, train_loss: 0.8492, test_loss: 0.8988, test_f1: 0.5340
 epoch: 81, train_loss: 0.8395, test_loss: 0.9332, test_f1: 0.5298
 epoch: 82, train_loss: 0.8371, test_loss: 0.9120, test_f1: 0.5276
 epoch: 83, train_loss: 0.8467, test_loss: 0.9621, test_f1: 0.5379
 epoch: 84, train_loss: 0.8435, test_loss: 0.9201, test_f1: 0.5171
 epoch: 85, train_loss: 0.8327, test_loss: 0.9690, test_f1: 0.5239
 epoch: 86, train_loss: 0.8333, test_loss: 0.9527, test_f1: 0.5105
 epoch: 87, train_loss: 0.8391, test_loss: 0.9376, test_f1: 0.5224
 epoch: 88, train_loss: 0.8438, test_loss: 0.9151, test_f1: 0.5454
 epoch: 89, train_loss: 0.8374, test_loss: 0.9161, test_f1: 0.5037
 epoch: 90, train_loss: 0.8333, test_loss: 0.9776, test_f1: 0.5022
 epoch: 91, train_loss: 0.8297, test_loss: 0.9170, test_f1: 0.5129
 epoch: 92, train_loss: 0.8366, test_loss: 0.9271, test_f1: 0.5268
 epoch: 93, train_loss: 0.8289, test_loss: 0.9619, test_f1: 0.5266
 epoch: 94, train_loss: 0.8337, test_loss: 0.9403, test_f1: 0.5217
 epoch: 95, train_loss: 0.8294, test_loss: 0.9297, test_f1: 0.5418
 epoch: 96, train_loss: 0.8328, test_loss: 0.9337, test_f1: 0.5436
 epoch: 97, train_loss: 0.8332, test_loss: 0.9080, test_f1: 0.5428
 epoch: 98, train_loss: 0.8289, test_loss: 0.8720, test_f1: 0.5274
 epoch: 99, train_loss: 0.8325, test_loss: 0.9729, test_f1: 0.5064
##################ITERATION #4 ****************************************
 epoch: 0, train_loss: 1.2847, test_loss: 1.2557, test_f1: 0.2260
 epoch: 1, train_loss: 1.2496, test_loss: 1.2292, test_f1: 0.2260
 epoch: 2, train_loss: 1.2329, test_loss: 1.2115, test_f1: 0.2365
 epoch: 3, train_loss: 1.2148, test_loss: 1.1801, test_f1: 0.3477
 epoch: 4, train_loss: 1.1934, test_loss: 1.1537, test_f1: 0.4137
 epoch: 5, train_loss: 1.1706, test_loss: 1.1219, test_f1: 0.4011
 epoch: 6, train_loss: 1.1416, test_loss: 1.0974, test_f1: 0.4328
 epoch: 7, train_loss: 1.1244, test_loss: 1.0805, test_f1: 0.4290
 epoch: 8, train_loss: 1.1044, test_loss: 1.0712, test_f1: 0.4441
 epoch: 9, train_loss: 1.0891, test_loss: 1.0620, test_f1: 0.4366
 epoch: 10, train_loss: 1.0735, test_loss: 1.0498, test_f1: 0.4504
 epoch: 11, train_loss: 1.0659, test_loss: 1.0438, test_f1: 0.4508
 epoch: 12, train_loss: 1.0535, test_loss: 1.0383, test_f1: 0.4591
 epoch: 13, train_loss: 1.0540, test_loss: 1.0339, test_f1: 0.4580
 epoch: 14, train_loss: 1.0399, test_loss: 1.0275, test_f1: 0.4707
 epoch: 15, train_loss: 1.0383, test_loss: 1.0210, test_f1: 0.4785
 epoch: 16, train_loss: 1.0253, test_loss: 1.0150, test_f1: 0.4847
 epoch: 17, train_loss: 1.0232, test_loss: 1.0179, test_f1: 0.4674
 epoch: 18, train_loss: 1.0180, test_loss: 1.0190, test_f1: 0.4628
 epoch: 19, train_loss: 1.0159, test_loss: 1.0130, test_f1: 0.4808
 epoch: 20, train_loss: 1.0112, test_loss: 1.0119, test_f1: 0.4709
 epoch: 21, train_loss: 1.0064, test_loss: 1.0075, test_f1: 0.4791
 epoch: 22, train_loss: 0.9993, test_loss: 1.0070, test_f1: 0.4684
 epoch: 23, train_loss: 0.9883, test_loss: 1.0121, test_f1: 0.4652
 epoch: 24, train_loss: 0.9917, test_loss: 1.0032, test_f1: 0.4726
 epoch: 25, train_loss: 0.9847, test_loss: 0.9941, test_f1: 0.4841
 epoch: 26, train_loss: 0.9869, test_loss: 1.0003, test_f1: 0.4756
 epoch: 27, train_loss: 0.9733, test_loss: 0.9923, test_f1: 0.4954
 epoch: 28, train_loss: 0.9782, test_loss: 0.9817, test_f1: 0.4872
 epoch: 29, train_loss: 0.9714, test_loss: 0.9813, test_f1: 0.4961
 epoch: 30, train_loss: 0.9668, test_loss: 0.9872, test_f1: 0.4940
 epoch: 31, train_loss: 0.9681, test_loss: 0.9864, test_f1: 0.4942
 epoch: 32, train_loss: 0.9531, test_loss: 0.9800, test_f1: 0.5032
 epoch: 33, train_loss: 0.9603, test_loss: 0.9689, test_f1: 0.4827
 epoch: 34, train_loss: 0.9486, test_loss: 0.9662, test_f1: 0.5028
 epoch: 35, train_loss: 0.9578, test_loss: 0.9993, test_f1: 0.4678
 epoch: 36, train_loss: 0.9464, test_loss: 0.9715, test_f1: 0.4895
 epoch: 37, train_loss: 0.9451, test_loss: 0.9655, test_f1: 0.4942
 epoch: 38, train_loss: 0.9347, test_loss: 0.9558, test_f1: 0.4964
 epoch: 39, train_loss: 0.9352, test_loss: 0.9522, test_f1: 0.4979
 epoch: 40, train_loss: 0.9299, test_loss: 0.9500, test_f1: 0.5078
 epoch: 41, train_loss: 0.9289, test_loss: 0.9413, test_f1: 0.5101
 epoch: 42, train_loss: 0.9272, test_loss: 0.9344, test_f1: 0.5065
 epoch: 43, train_loss: 0.9199, test_loss: 0.9492, test_f1: 0.5097
 epoch: 44, train_loss: 0.9163, test_loss: 0.9647, test_f1: 0.5068
 epoch: 45, train_loss: 0.9143, test_loss: 0.9412, test_f1: 0.5027
 epoch: 46, train_loss: 0.9199, test_loss: 0.9420, test_f1: 0.5180
 epoch: 47, train_loss: 0.9139, test_loss: 0.9284, test_f1: 0.5252
 epoch: 48, train_loss: 0.9063, test_loss: 0.9404, test_f1: 0.5150
 epoch: 49, train_loss: 0.9070, test_loss: 0.9332, test_f1: 0.5221
 epoch: 50, train_loss: 0.9169, test_loss: 0.9474, test_f1: 0.5204
 epoch: 51, train_loss: 0.9059, test_loss: 0.9512, test_f1: 0.5037
 epoch: 52, train_loss: 0.8926, test_loss: 0.9483, test_f1: 0.5094
 epoch: 53, train_loss: 0.9025, test_loss: 0.9275, test_f1: 0.5264
 epoch: 54, train_loss: 0.9016, test_loss: 0.9299, test_f1: 0.5193
 epoch: 55, train_loss: 0.8904, test_loss: 0.9284, test_f1: 0.5194
 epoch: 56, train_loss: 0.8960, test_loss: 0.9487, test_f1: 0.5143
 epoch: 57, train_loss: 0.8961, test_loss: 0.9425, test_f1: 0.5200
 epoch: 58, train_loss: 0.8932, test_loss: 0.9376, test_f1: 0.5012
 epoch: 59, train_loss: 0.8913, test_loss: 0.9108, test_f1: 0.5217
 epoch: 60, train_loss: 0.8910, test_loss: 0.9306, test_f1: 0.5076
 epoch: 61, train_loss: 0.8902, test_loss: 0.9328, test_f1: 0.5110
 epoch: 62, train_loss: 0.8874, test_loss: 0.9342, test_f1: 0.5160
 epoch: 63, train_loss: 0.8939, test_loss: 0.9292, test_f1: 0.5183
 epoch: 64, train_loss: 0.8862, test_loss: 0.9385, test_f1: 0.5063
 epoch: 65, train_loss: 0.8845, test_loss: 0.9413, test_f1: 0.4929
 epoch: 66, train_loss: 0.8816, test_loss: 0.9396, test_f1: 0.5057
 epoch: 67, train_loss: 0.8880, test_loss: 0.9379, test_f1: 0.5050
 epoch: 68, train_loss: 0.8820, test_loss: 0.9316, test_f1: 0.5111
 epoch: 69, train_loss: 0.8842, test_loss: 0.9234, test_f1: 0.5144
 epoch: 70, train_loss: 0.8748, test_loss: 0.9265, test_f1: 0.5295
 epoch: 71, train_loss: 0.8780, test_loss: 0.9176, test_f1: 0.5096
 epoch: 72, train_loss: 0.8895, test_loss: 0.9427, test_f1: 0.4955
 epoch: 73, train_loss: 0.8710, test_loss: 0.9237, test_f1: 0.5088
 epoch: 74, train_loss: 0.8774, test_loss: 0.9282, test_f1: 0.5226
 epoch: 75, train_loss: 0.8763, test_loss: 0.9234, test_f1: 0.5226
 epoch: 76, train_loss: 0.8792, test_loss: 0.9481, test_f1: 0.5080
 epoch: 77, train_loss: 0.8861, test_loss: 0.9425, test_f1: 0.5080
 epoch: 78, train_loss: 0.8725, test_loss: 0.9447, test_f1: 0.4900
 epoch: 79, train_loss: 0.8712, test_loss: 0.9511, test_f1: 0.5252
 epoch: 80, train_loss: 0.8780, test_loss: 0.9206, test_f1: 0.5187
 epoch: 81, train_loss: 0.8668, test_loss: 0.9330, test_f1: 0.5136
 epoch: 82, train_loss: 0.8641, test_loss: 0.9302, test_f1: 0.5093
 epoch: 83, train_loss: 0.8587, test_loss: 0.9152, test_f1: 0.5077
 epoch: 84, train_loss: 0.8765, test_loss: 0.9326, test_f1: 0.5119
 epoch: 85, train_loss: 0.8725, test_loss: 0.9535, test_f1: 0.5056
 epoch: 86, train_loss: 0.8617, test_loss: 0.9359, test_f1: 0.4981
 epoch: 87, train_loss: 0.8633, test_loss: 0.9361, test_f1: 0.5030
 epoch: 88, train_loss: 0.8628, test_loss: 0.9346, test_f1: 0.5043
 epoch: 89, train_loss: 0.8548, test_loss: 0.9541, test_f1: 0.5028
 epoch: 90, train_loss: 0.8521, test_loss: 0.9361, test_f1: 0.5041
 epoch: 91, train_loss: 0.8708, test_loss: 0.9615, test_f1: 0.5087
 epoch: 92, train_loss: 0.8674, test_loss: 0.9526, test_f1: 0.5099
 epoch: 93, train_loss: 0.8520, test_loss: 0.9441, test_f1: 0.5077
 epoch: 94, train_loss: 0.8565, test_loss: 0.9514, test_f1: 0.5170
 epoch: 95, train_loss: 0.8581, test_loss: 0.9361, test_f1: 0.5284
 epoch: 96, train_loss: 0.8602, test_loss: 0.9421, test_f1: 0.4988
 epoch: 97, train_loss: 0.8528, test_loss: 0.9687, test_f1: 0.4990
 epoch: 98, train_loss: 0.8581, test_loss: 0.9574, test_f1: 0.5191
 epoch: 99, train_loss: 0.8554, test_loss: 0.9543, test_f1: 0.5263
##################ITERATION #5 ****************************************
 epoch: 0, train_loss: 1.2870, test_loss: 1.2139, test_f1: 0.2771
 epoch: 1, train_loss: 1.2100, test_loss: 1.1698, test_f1: 0.4097
 epoch: 2, train_loss: 1.1715, test_loss: 1.1298, test_f1: 0.4069
 epoch: 3, train_loss: 1.1479, test_loss: 1.1115, test_f1: 0.4010
 epoch: 4, train_loss: 1.1209, test_loss: 1.1114, test_f1: 0.3873
 epoch: 5, train_loss: 1.1050, test_loss: 1.0717, test_f1: 0.4431
 epoch: 6, train_loss: 1.0797, test_loss: 1.0602, test_f1: 0.4675
 epoch: 7, train_loss: 1.0718, test_loss: 1.0682, test_f1: 0.4489
 epoch: 8, train_loss: 1.0590, test_loss: 1.0528, test_f1: 0.4583
 epoch: 9, train_loss: 1.0428, test_loss: 1.0480, test_f1: 0.4568
 epoch: 10, train_loss: 1.0344, test_loss: 1.0237, test_f1: 0.4854
 epoch: 11, train_loss: 1.0262, test_loss: 1.0399, test_f1: 0.4589
 epoch: 12, train_loss: 1.0208, test_loss: 1.0246, test_f1: 0.4727
 epoch: 13, train_loss: 1.0048, test_loss: 0.9939, test_f1: 0.5005
 epoch: 14, train_loss: 0.9955, test_loss: 1.0011, test_f1: 0.4809
 epoch: 15, train_loss: 0.9960, test_loss: 1.0069, test_f1: 0.4767
 epoch: 16, train_loss: 0.9806, test_loss: 1.0322, test_f1: 0.5083
 epoch: 17, train_loss: 0.9854, test_loss: 0.9937, test_f1: 0.4921
 epoch: 18, train_loss: 0.9775, test_loss: 0.9981, test_f1: 0.4851
 epoch: 19, train_loss: 0.9683, test_loss: 1.0185, test_f1: 0.5175
 epoch: 20, train_loss: 0.9731, test_loss: 0.9869, test_f1: 0.4982
 epoch: 21, train_loss: 0.9600, test_loss: 0.9977, test_f1: 0.5025
 epoch: 22, train_loss: 0.9586, test_loss: 0.9917, test_f1: 0.5059
 epoch: 23, train_loss: 0.9494, test_loss: 0.9791, test_f1: 0.5063
 epoch: 24, train_loss: 0.9500, test_loss: 0.9993, test_f1: 0.5040
 epoch: 25, train_loss: 0.9455, test_loss: 0.9668, test_f1: 0.5028
 epoch: 26, train_loss: 0.9386, test_loss: 1.0031, test_f1: 0.5022
 epoch: 27, train_loss: 0.9330, test_loss: 0.9980, test_f1: 0.5245
 epoch: 28, train_loss: 0.9365, test_loss: 1.0118, test_f1: 0.5330
 epoch: 29, train_loss: 0.9353, test_loss: 0.9839, test_f1: 0.5418
 epoch: 30, train_loss: 0.9224, test_loss: 0.9473, test_f1: 0.5213
 epoch: 31, train_loss: 0.9273, test_loss: 1.0215, test_f1: 0.5113
 epoch: 32, train_loss: 0.9209, test_loss: 0.9529, test_f1: 0.5271
 epoch: 33, train_loss: 0.9107, test_loss: 0.9677, test_f1: 0.5279
 epoch: 34, train_loss: 0.9074, test_loss: 0.9992, test_f1: 0.5280
 epoch: 35, train_loss: 0.9131, test_loss: 1.0006, test_f1: 0.5183
 epoch: 36, train_loss: 0.9105, test_loss: 1.0188, test_f1: 0.5302
 epoch: 37, train_loss: 0.9074, test_loss: 1.0439, test_f1: 0.5308
 epoch: 38, train_loss: 0.9081, test_loss: 1.0081, test_f1: 0.5353
 epoch: 39, train_loss: 0.9025, test_loss: 1.0520, test_f1: 0.5095
 epoch: 40, train_loss: 0.8948, test_loss: 0.9746, test_f1: 0.5501
 epoch: 41, train_loss: 0.8958, test_loss: 1.0441, test_f1: 0.5389
 epoch: 42, train_loss: 0.8858, test_loss: 1.0020, test_f1: 0.5249
 epoch: 43, train_loss: 0.8813, test_loss: 1.0194, test_f1: 0.5181
 epoch: 44, train_loss: 0.8888, test_loss: 1.0798, test_f1: 0.5147
 epoch: 45, train_loss: 0.8819, test_loss: 1.0524, test_f1: 0.5166
 epoch: 46, train_loss: 0.8775, test_loss: 1.0214, test_f1: 0.5243
 epoch: 47, train_loss: 0.8749, test_loss: 1.0383, test_f1: 0.5288
 epoch: 48, train_loss: 0.8794, test_loss: 0.9811, test_f1: 0.5212
 epoch: 49, train_loss: 0.8738, test_loss: 1.0425, test_f1: 0.5276
 epoch: 50, train_loss: 0.8744, test_loss: 1.0347, test_f1: 0.5325
 epoch: 51, train_loss: 0.8625, test_loss: 1.0037, test_f1: 0.5260
 epoch: 52, train_loss: 0.8611, test_loss: 1.0240, test_f1: 0.5406
 epoch: 53, train_loss: 0.8554, test_loss: 1.0031, test_f1: 0.5313
 epoch: 54, train_loss: 0.8588, test_loss: 1.0407, test_f1: 0.5386
 epoch: 55, train_loss: 0.8545, test_loss: 1.0162, test_f1: 0.5431
 epoch: 56, train_loss: 0.8586, test_loss: 1.0008, test_f1: 0.5299
 epoch: 57, train_loss: 0.8530, test_loss: 0.9962, test_f1: 0.5395
 epoch: 58, train_loss: 0.8535, test_loss: 0.9836, test_f1: 0.5308
 epoch: 59, train_loss: 0.8601, test_loss: 0.9932, test_f1: 0.5424
 epoch: 60, train_loss: 0.8542, test_loss: 0.9765, test_f1: 0.5424
 epoch: 61, train_loss: 0.8597, test_loss: 1.0297, test_f1: 0.5234
 epoch: 62, train_loss: 0.8513, test_loss: 1.0074, test_f1: 0.5429
 epoch: 63, train_loss: 0.8450, test_loss: 1.0032, test_f1: 0.5363
 epoch: 64, train_loss: 0.8380, test_loss: 1.0066, test_f1: 0.5321
 epoch: 65, train_loss: 0.8478, test_loss: 0.9946, test_f1: 0.5393
 epoch: 66, train_loss: 0.8459, test_loss: 1.0057, test_f1: 0.5344
 epoch: 67, train_loss: 0.8620, test_loss: 0.9654, test_f1: 0.5426
 epoch: 68, train_loss: 0.8511, test_loss: 1.0127, test_f1: 0.5392
 epoch: 69, train_loss: 0.8429, test_loss: 0.9769, test_f1: 0.5536
 epoch: 70, train_loss: 0.8521, test_loss: 1.0303, test_f1: 0.5421
 epoch: 71, train_loss: 0.8492, test_loss: 0.9839, test_f1: 0.5542
 epoch: 72, train_loss: 0.8414, test_loss: 1.0366, test_f1: 0.5308
 epoch: 73, train_loss: 0.8493, test_loss: 0.9994, test_f1: 0.5438
 epoch: 74, train_loss: 0.8352, test_loss: 0.9959, test_f1: 0.5437
 epoch: 75, train_loss: 0.8327, test_loss: 1.0444, test_f1: 0.5364
 epoch: 76, train_loss: 0.8351, test_loss: 0.9810, test_f1: 0.5388
 epoch: 77, train_loss: 0.8385, test_loss: 1.0079, test_f1: 0.5417
 epoch: 78, train_loss: 0.8321, test_loss: 0.9897, test_f1: 0.5522
 epoch: 79, train_loss: 0.8508, test_loss: 1.0161, test_f1: 0.5410
 epoch: 80, train_loss: 0.8316, test_loss: 0.9685, test_f1: 0.5526
 epoch: 81, train_loss: 0.8400, test_loss: 1.0244, test_f1: 0.5402
 epoch: 82, train_loss: 0.8272, test_loss: 0.9856, test_f1: 0.5533
 epoch: 83, train_loss: 0.8249, test_loss: 0.9767, test_f1: 0.5463
 epoch: 84, train_loss: 0.8311, test_loss: 1.0081, test_f1: 0.5362
 epoch: 85, train_loss: 0.8291, test_loss: 1.0027, test_f1: 0.5534
 epoch: 86, train_loss: 0.8307, test_loss: 0.9850, test_f1: 0.5588
 epoch: 87, train_loss: 0.8360, test_loss: 1.0095, test_f1: 0.5458
 epoch: 88, train_loss: 0.8267, test_loss: 1.0726, test_f1: 0.5367
 epoch: 89, train_loss: 0.8318, test_loss: 1.0409, test_f1: 0.5389
 epoch: 90, train_loss: 0.8239, test_loss: 1.0107, test_f1: 0.5426
 epoch: 91, train_loss: 0.8350, test_loss: 1.0804, test_f1: 0.5374
 epoch: 92, train_loss: 0.8277, test_loss: 0.9706, test_f1: 0.5473
 epoch: 93, train_loss: 0.8284, test_loss: 0.9857, test_f1: 0.5475
 epoch: 94, train_loss: 0.8157, test_loss: 1.0066, test_f1: 0.5586
 epoch: 95, train_loss: 0.8198, test_loss: 0.9751, test_f1: 0.5520
 epoch: 96, train_loss: 0.8217, test_loss: 0.9774, test_f1: 0.5448
 epoch: 97, train_loss: 0.8121, test_loss: 1.0670, test_f1: 0.5303
 epoch: 98, train_loss: 0.8208, test_loss: 1.0203, test_f1: 0.5448
 epoch: 99, train_loss: 0.8227, test_loss: 0.9965, test_f1: 0.5512
##################ITERATION #6 ****************************************
 epoch: 0, train_loss: 1.3220, test_loss: 1.1915, test_f1: 0.3267
 epoch: 1, train_loss: 1.2099, test_loss: 1.1265, test_f1: 0.4093
 epoch: 2, train_loss: 1.1648, test_loss: 1.0927, test_f1: 0.4048
 epoch: 3, train_loss: 1.1390, test_loss: 1.0782, test_f1: 0.4161
 epoch: 4, train_loss: 1.1113, test_loss: 1.0586, test_f1: 0.4128
 epoch: 5, train_loss: 1.0926, test_loss: 1.0374, test_f1: 0.4195
 epoch: 6, train_loss: 1.0730, test_loss: 1.0172, test_f1: 0.4499
 epoch: 7, train_loss: 1.0616, test_loss: 1.0177, test_f1: 0.4553
 epoch: 8, train_loss: 1.0470, test_loss: 1.0046, test_f1: 0.4454
 epoch: 9, train_loss: 1.0382, test_loss: 1.0070, test_f1: 0.4763
 epoch: 10, train_loss: 1.0295, test_loss: 1.0056, test_f1: 0.4684
 epoch: 11, train_loss: 1.0200, test_loss: 0.9764, test_f1: 0.4746
 epoch: 12, train_loss: 1.0019, test_loss: 1.0074, test_f1: 0.4667
 epoch: 13, train_loss: 0.9989, test_loss: 0.9790, test_f1: 0.4889
 epoch: 14, train_loss: 0.9852, test_loss: 0.9796, test_f1: 0.4774
 epoch: 15, train_loss: 0.9834, test_loss: 0.9715, test_f1: 0.4809
 epoch: 16, train_loss: 0.9748, test_loss: 0.9656, test_f1: 0.4834
 epoch: 17, train_loss: 0.9742, test_loss: 0.9631, test_f1: 0.4962
 epoch: 18, train_loss: 0.9751, test_loss: 0.9451, test_f1: 0.4933
 epoch: 19, train_loss: 0.9614, test_loss: 0.9500, test_f1: 0.4932
 epoch: 20, train_loss: 0.9495, test_loss: 0.9586, test_f1: 0.4966
 epoch: 21, train_loss: 0.9481, test_loss: 0.9440, test_f1: 0.5027
 epoch: 22, train_loss: 0.9393, test_loss: 0.9468, test_f1: 0.5019
 epoch: 23, train_loss: 0.9382, test_loss: 0.9513, test_f1: 0.5077
 epoch: 24, train_loss: 0.9271, test_loss: 0.9348, test_f1: 0.5029
 epoch: 25, train_loss: 0.9274, test_loss: 0.9600, test_f1: 0.5064
 epoch: 26, train_loss: 0.9205, test_loss: 0.9424, test_f1: 0.5048
 epoch: 27, train_loss: 0.9192, test_loss: 0.9222, test_f1: 0.5144
 epoch: 28, train_loss: 0.9075, test_loss: 0.9370, test_f1: 0.5040
 epoch: 29, train_loss: 0.9058, test_loss: 0.9499, test_f1: 0.5005
 epoch: 30, train_loss: 0.8977, test_loss: 0.9736, test_f1: 0.5064
 epoch: 31, train_loss: 0.8923, test_loss: 0.9173, test_f1: 0.5090
 epoch: 32, train_loss: 0.8885, test_loss: 0.9328, test_f1: 0.5105
 epoch: 33, train_loss: 0.8914, test_loss: 0.9500, test_f1: 0.5129
 epoch: 34, train_loss: 0.8802, test_loss: 0.9321, test_f1: 0.5085
 epoch: 35, train_loss: 0.8929, test_loss: 0.9590, test_f1: 0.5111
 epoch: 36, train_loss: 0.8763, test_loss: 0.9516, test_f1: 0.5103
 epoch: 37, train_loss: 0.8863, test_loss: 0.9391, test_f1: 0.5281
 epoch: 38, train_loss: 0.8699, test_loss: 0.9485, test_f1: 0.5067
 epoch: 39, train_loss: 0.8619, test_loss: 0.9417, test_f1: 0.5184
 epoch: 40, train_loss: 0.8690, test_loss: 0.9534, test_f1: 0.5129
 epoch: 41, train_loss: 0.8655, test_loss: 0.9743, test_f1: 0.5198
 epoch: 42, train_loss: 0.8630, test_loss: 0.9579, test_f1: 0.5178
 epoch: 43, train_loss: 0.8637, test_loss: 0.9425, test_f1: 0.5175
 epoch: 44, train_loss: 0.8613, test_loss: 0.9322, test_f1: 0.5251
 epoch: 45, train_loss: 0.8539, test_loss: 0.9409, test_f1: 0.5147
 epoch: 46, train_loss: 0.8622, test_loss: 0.9404, test_f1: 0.5198
 epoch: 47, train_loss: 0.8504, test_loss: 0.9426, test_f1: 0.5188
 epoch: 48, train_loss: 0.8399, test_loss: 0.9431, test_f1: 0.5163
 epoch: 49, train_loss: 0.8400, test_loss: 0.9391, test_f1: 0.5195
 epoch: 50, train_loss: 0.8396, test_loss: 0.9622, test_f1: 0.5148
 epoch: 51, train_loss: 0.8340, test_loss: 0.9485, test_f1: 0.5238
 epoch: 52, train_loss: 0.8291, test_loss: 0.9330, test_f1: 0.5138
 epoch: 53, train_loss: 0.8306, test_loss: 0.9451, test_f1: 0.5325
 epoch: 54, train_loss: 0.8346, test_loss: 0.9311, test_f1: 0.5275
 epoch: 55, train_loss: 0.8335, test_loss: 0.9381, test_f1: 0.5360
 epoch: 56, train_loss: 0.8235, test_loss: 0.9404, test_f1: 0.5350
 epoch: 57, train_loss: 0.8189, test_loss: 0.9379, test_f1: 0.5351
 epoch: 58, train_loss: 0.8058, test_loss: 0.9364, test_f1: 0.5358
 epoch: 59, train_loss: 0.8169, test_loss: 0.9327, test_f1: 0.5411
 epoch: 60, train_loss: 0.8200, test_loss: 0.9381, test_f1: 0.5385
 epoch: 61, train_loss: 0.8248, test_loss: 0.9422, test_f1: 0.5292
 epoch: 62, train_loss: 0.8050, test_loss: 0.9572, test_f1: 0.5330
 epoch: 63, train_loss: 0.8183, test_loss: 0.9602, test_f1: 0.5362
 epoch: 64, train_loss: 0.8153, test_loss: 0.9550, test_f1: 0.5403
 epoch: 65, train_loss: 0.8051, test_loss: 0.9308, test_f1: 0.5300
 epoch: 66, train_loss: 0.8134, test_loss: 0.9444, test_f1: 0.5318
 epoch: 67, train_loss: 0.8069, test_loss: 0.9727, test_f1: 0.5428
 epoch: 68, train_loss: 0.8059, test_loss: 0.9576, test_f1: 0.5392
 epoch: 69, train_loss: 0.8078, test_loss: 0.9999, test_f1: 0.5138
 epoch: 70, train_loss: 0.7989, test_loss: 0.9350, test_f1: 0.5457
 epoch: 71, train_loss: 0.8069, test_loss: 0.9169, test_f1: 0.5552
 epoch: 72, train_loss: 0.7971, test_loss: 0.9452, test_f1: 0.5358
 epoch: 73, train_loss: 0.8086, test_loss: 0.9439, test_f1: 0.5486
 epoch: 74, train_loss: 0.8023, test_loss: 0.9517, test_f1: 0.5292
 epoch: 75, train_loss: 0.8127, test_loss: 0.9554, test_f1: 0.5367
 epoch: 76, train_loss: 0.7921, test_loss: 0.9563, test_f1: 0.5294
 epoch: 77, train_loss: 0.7996, test_loss: 0.9770, test_f1: 0.5276
 epoch: 78, train_loss: 0.8066, test_loss: 0.9792, test_f1: 0.5426
 epoch: 79, train_loss: 0.7921, test_loss: 0.9575, test_f1: 0.5372
 epoch: 80, train_loss: 0.7898, test_loss: 0.9643, test_f1: 0.5419
 epoch: 81, train_loss: 0.7916, test_loss: 0.9555, test_f1: 0.5409
 epoch: 82, train_loss: 0.7880, test_loss: 0.9781, test_f1: 0.5411
 epoch: 83, train_loss: 0.7913, test_loss: 0.9474, test_f1: 0.5443
 epoch: 84, train_loss: 0.7866, test_loss: 0.9782, test_f1: 0.5361
 epoch: 85, train_loss: 0.7858, test_loss: 0.9716, test_f1: 0.5368
 epoch: 86, train_loss: 0.7853, test_loss: 0.9764, test_f1: 0.5465
 epoch: 87, train_loss: 0.7742, test_loss: 0.9481, test_f1: 0.5523
 epoch: 88, train_loss: 0.7751, test_loss: 0.9568, test_f1: 0.5549
 epoch: 89, train_loss: 0.7885, test_loss: 0.9677, test_f1: 0.5479
 epoch: 90, train_loss: 0.7834, test_loss: 0.9411, test_f1: 0.5542
 epoch: 91, train_loss: 0.7792, test_loss: 0.9544, test_f1: 0.5474
 epoch: 92, train_loss: 0.7909, test_loss: 0.9578, test_f1: 0.5304
 epoch: 93, train_loss: 0.7811, test_loss: 0.9661, test_f1: 0.5382
 epoch: 94, train_loss: 0.7787, test_loss: 0.9501, test_f1: 0.5514
 epoch: 95, train_loss: 0.7830, test_loss: 0.9642, test_f1: 0.5388
 epoch: 96, train_loss: 0.7843, test_loss: 0.9552, test_f1: 0.5299
 epoch: 97, train_loss: 0.7805, test_loss: 0.9471, test_f1: 0.5501
 epoch: 98, train_loss: 0.7765, test_loss: 0.9723, test_f1: 0.5391
 epoch: 99, train_loss: 0.7905, test_loss: 0.9553, test_f1: 0.5396
##################ITERATION #7 ****************************************
 epoch: 0, train_loss: 1.2793, test_loss: 1.2108, test_f1: 0.2964
 epoch: 1, train_loss: 1.2143, test_loss: 1.1693, test_f1: 0.3898
 epoch: 2, train_loss: 1.1860, test_loss: 1.1424, test_f1: 0.3829
 epoch: 3, train_loss: 1.1666, test_loss: 1.1182, test_f1: 0.4395
 epoch: 4, train_loss: 1.1366, test_loss: 1.0927, test_f1: 0.4385
 epoch: 5, train_loss: 1.1126, test_loss: 1.0695, test_f1: 0.4648
 epoch: 6, train_loss: 1.0931, test_loss: 1.0590, test_f1: 0.4477
 epoch: 7, train_loss: 1.0780, test_loss: 1.0424, test_f1: 0.4521
 epoch: 8, train_loss: 1.0668, test_loss: 1.0342, test_f1: 0.4530
 epoch: 9, train_loss: 1.0595, test_loss: 1.0320, test_f1: 0.4555
 epoch: 10, train_loss: 1.0442, test_loss: 1.0208, test_f1: 0.4655
 epoch: 11, train_loss: 1.0322, test_loss: 1.0219, test_f1: 0.4732
 epoch: 12, train_loss: 1.0291, test_loss: 1.0218, test_f1: 0.4762
 epoch: 13, train_loss: 1.0264, test_loss: 1.0007, test_f1: 0.4959
 epoch: 14, train_loss: 1.0062, test_loss: 1.0077, test_f1: 0.4875
 epoch: 15, train_loss: 0.9989, test_loss: 1.0093, test_f1: 0.4827
 epoch: 16, train_loss: 1.0037, test_loss: 1.0221, test_f1: 0.4678
 epoch: 17, train_loss: 0.9924, test_loss: 0.9815, test_f1: 0.4873
 epoch: 18, train_loss: 0.9863, test_loss: 0.9868, test_f1: 0.4905
 epoch: 19, train_loss: 0.9876, test_loss: 1.0009, test_f1: 0.4831
 epoch: 20, train_loss: 0.9774, test_loss: 0.9870, test_f1: 0.4843
 epoch: 21, train_loss: 0.9771, test_loss: 0.9864, test_f1: 0.4990
 epoch: 22, train_loss: 0.9744, test_loss: 0.9778, test_f1: 0.4765
 epoch: 23, train_loss: 0.9641, test_loss: 0.9703, test_f1: 0.4909
 epoch: 24, train_loss: 0.9517, test_loss: 0.9617, test_f1: 0.4979
 epoch: 25, train_loss: 0.9528, test_loss: 0.9883, test_f1: 0.4909
 epoch: 26, train_loss: 0.9514, test_loss: 0.9848, test_f1: 0.4838
 epoch: 27, train_loss: 0.9494, test_loss: 0.9650, test_f1: 0.4749
 epoch: 28, train_loss: 0.9496, test_loss: 0.9607, test_f1: 0.4977
 epoch: 29, train_loss: 0.9407, test_loss: 0.9494, test_f1: 0.5083
 epoch: 30, train_loss: 0.9245, test_loss: 0.9544, test_f1: 0.4912
 epoch: 31, train_loss: 0.9271, test_loss: 0.9653, test_f1: 0.4878
 epoch: 32, train_loss: 0.9206, test_loss: 0.9420, test_f1: 0.5237
 epoch: 33, train_loss: 0.9239, test_loss: 0.9549, test_f1: 0.5017
 epoch: 34, train_loss: 0.9185, test_loss: 0.9215, test_f1: 0.5189
 epoch: 35, train_loss: 0.9144, test_loss: 0.9343, test_f1: 0.5046
 epoch: 36, train_loss: 0.9119, test_loss: 0.9253, test_f1: 0.4974
 epoch: 37, train_loss: 0.9084, test_loss: 0.9324, test_f1: 0.5135
 epoch: 38, train_loss: 0.9061, test_loss: 0.9444, test_f1: 0.4991
 epoch: 39, train_loss: 0.8983, test_loss: 0.9389, test_f1: 0.4963
 epoch: 40, train_loss: 0.9012, test_loss: 0.9368, test_f1: 0.5099
 epoch: 41, train_loss: 0.8965, test_loss: 0.9551, test_f1: 0.5073
 epoch: 42, train_loss: 0.8921, test_loss: 0.9369, test_f1: 0.5175
 epoch: 43, train_loss: 0.8870, test_loss: 0.9301, test_f1: 0.5054
 epoch: 44, train_loss: 0.8816, test_loss: 0.9148, test_f1: 0.5028
 epoch: 45, train_loss: 0.8920, test_loss: 0.9467, test_f1: 0.4902
 epoch: 46, train_loss: 0.8888, test_loss: 0.9198, test_f1: 0.5052
 epoch: 47, train_loss: 0.8757, test_loss: 0.9292, test_f1: 0.5120
 epoch: 48, train_loss: 0.8721, test_loss: 0.9241, test_f1: 0.5145
 epoch: 49, train_loss: 0.8751, test_loss: 0.9361, test_f1: 0.5155
 epoch: 50, train_loss: 0.8754, test_loss: 0.9356, test_f1: 0.5159
 epoch: 51, train_loss: 0.8714, test_loss: 0.9180, test_f1: 0.5103
 epoch: 52, train_loss: 0.8599, test_loss: 0.9488, test_f1: 0.5063
 epoch: 53, train_loss: 0.8646, test_loss: 0.9086, test_f1: 0.5196
 epoch: 54, train_loss: 0.8688, test_loss: 0.9397, test_f1: 0.5036
 epoch: 55, train_loss: 0.8568, test_loss: 0.9328, test_f1: 0.5065
 epoch: 56, train_loss: 0.8593, test_loss: 0.9148, test_f1: 0.4919
 epoch: 57, train_loss: 0.8724, test_loss: 0.9154, test_f1: 0.5320
 epoch: 58, train_loss: 0.8667, test_loss: 0.9345, test_f1: 0.5063
 epoch: 59, train_loss: 0.8742, test_loss: 0.9315, test_f1: 0.5195
 epoch: 60, train_loss: 0.8539, test_loss: 0.9202, test_f1: 0.5201
 epoch: 61, train_loss: 0.8434, test_loss: 0.9179, test_f1: 0.5083
 epoch: 62, train_loss: 0.8482, test_loss: 0.9329, test_f1: 0.5084
 epoch: 63, train_loss: 0.8469, test_loss: 0.9221, test_f1: 0.5189
 epoch: 64, train_loss: 0.8628, test_loss: 0.9296, test_f1: 0.5144
 epoch: 65, train_loss: 0.8449, test_loss: 0.9333, test_f1: 0.4912
 epoch: 66, train_loss: 0.8460, test_loss: 0.9189, test_f1: 0.5187
 epoch: 67, train_loss: 0.8615, test_loss: 0.9197, test_f1: 0.5243
 epoch: 68, train_loss: 0.8422, test_loss: 0.9439, test_f1: 0.5200
 epoch: 69, train_loss: 0.8432, test_loss: 0.9198, test_f1: 0.5182
 epoch: 70, train_loss: 0.8406, test_loss: 0.9241, test_f1: 0.5248
 epoch: 71, train_loss: 0.8523, test_loss: 0.9284, test_f1: 0.5193
 epoch: 72, train_loss: 0.8371, test_loss: 0.9080, test_f1: 0.5110
 epoch: 73, train_loss: 0.8358, test_loss: 0.9317, test_f1: 0.5218
 epoch: 74, train_loss: 0.8465, test_loss: 0.9463, test_f1: 0.5056
 epoch: 75, train_loss: 0.8412, test_loss: 0.9306, test_f1: 0.5256
 epoch: 76, train_loss: 0.8418, test_loss: 0.9370, test_f1: 0.5235
 epoch: 77, train_loss: 0.8313, test_loss: 0.9186, test_f1: 0.5147
 epoch: 78, train_loss: 0.8368, test_loss: 0.9473, test_f1: 0.5117
 epoch: 79, train_loss: 0.8344, test_loss: 0.9310, test_f1: 0.5227
 epoch: 80, train_loss: 0.8342, test_loss: 0.9565, test_f1: 0.5059
 epoch: 81, train_loss: 0.8252, test_loss: 0.9464, test_f1: 0.5042
 epoch: 82, train_loss: 0.8402, test_loss: 0.9365, test_f1: 0.5144
 epoch: 83, train_loss: 0.8319, test_loss: 0.9494, test_f1: 0.5017
 epoch: 84, train_loss: 0.8347, test_loss: 0.9318, test_f1: 0.5169
 epoch: 85, train_loss: 0.8254, test_loss: 0.9228, test_f1: 0.5224
 epoch: 86, train_loss: 0.8116, test_loss: 0.9424, test_f1: 0.5171
 epoch: 87, train_loss: 0.8261, test_loss: 0.9071, test_f1: 0.5089
 epoch: 88, train_loss: 0.8339, test_loss: 0.9284, test_f1: 0.5126
 epoch: 89, train_loss: 0.8190, test_loss: 0.9369, test_f1: 0.5064
 epoch: 90, train_loss: 0.8223, test_loss: 0.9601, test_f1: 0.5103
 epoch: 91, train_loss: 0.8205, test_loss: 0.9254, test_f1: 0.5173
 epoch: 92, train_loss: 0.8273, test_loss: 0.9193, test_f1: 0.5351
 epoch: 93, train_loss: 0.8201, test_loss: 0.9239, test_f1: 0.5250
 epoch: 94, train_loss: 0.8239, test_loss: 0.9428, test_f1: 0.5114
 epoch: 95, train_loss: 0.8125, test_loss: 0.9179, test_f1: 0.5292
 epoch: 96, train_loss: 0.8128, test_loss: 0.9364, test_f1: 0.5227
 epoch: 97, train_loss: 0.8170, test_loss: 0.9324, test_f1: 0.5208
 epoch: 98, train_loss: 0.8137, test_loss: 0.9250, test_f1: 0.5295
 epoch: 99, train_loss: 0.8134, test_loss: 0.9313, test_f1: 0.5065
##################ITERATION #8 ****************************************
 epoch: 0, train_loss: 1.3484, test_loss: 1.2099, test_f1: 0.2738
 epoch: 1, train_loss: 1.2298, test_loss: 1.1663, test_f1: 0.2914
 epoch: 2, train_loss: 1.2083, test_loss: 1.1382, test_f1: 0.3802
 epoch: 3, train_loss: 1.1663, test_loss: 1.0941, test_f1: 0.4043
 epoch: 4, train_loss: 1.1441, test_loss: 1.0869, test_f1: 0.4113
 epoch: 5, train_loss: 1.1307, test_loss: 1.0650, test_f1: 0.4362
 epoch: 6, train_loss: 1.1028, test_loss: 1.0442, test_f1: 0.4480
 epoch: 7, train_loss: 1.0893, test_loss: 1.0346, test_f1: 0.4497
 epoch: 8, train_loss: 1.0703, test_loss: 1.0198, test_f1: 0.4675
 epoch: 9, train_loss: 1.0675, test_loss: 1.0177, test_f1: 0.4663
 epoch: 10, train_loss: 1.0532, test_loss: 1.0058, test_f1: 0.4752
 epoch: 11, train_loss: 1.0546, test_loss: 1.0200, test_f1: 0.4654
 epoch: 12, train_loss: 1.0410, test_loss: 1.0031, test_f1: 0.4678
 epoch: 13, train_loss: 1.0260, test_loss: 0.9966, test_f1: 0.4832
 epoch: 14, train_loss: 1.0186, test_loss: 0.9865, test_f1: 0.4793
 epoch: 15, train_loss: 1.0088, test_loss: 0.9995, test_f1: 0.4595
 epoch: 16, train_loss: 1.0040, test_loss: 1.0002, test_f1: 0.4716
 epoch: 17, train_loss: 0.9947, test_loss: 1.0497, test_f1: 0.4360
 epoch: 18, train_loss: 0.9965, test_loss: 1.0037, test_f1: 0.4674
 epoch: 19, train_loss: 0.9976, test_loss: 0.9986, test_f1: 0.4775
 epoch: 20, train_loss: 0.9828, test_loss: 0.9891, test_f1: 0.4781
 epoch: 21, train_loss: 0.9861, test_loss: 0.9746, test_f1: 0.4814
 epoch: 22, train_loss: 0.9844, test_loss: 0.9714, test_f1: 0.4857
 epoch: 23, train_loss: 0.9845, test_loss: 0.9686, test_f1: 0.4892
 epoch: 24, train_loss: 0.9671, test_loss: 0.9927, test_f1: 0.4937
 epoch: 25, train_loss: 0.9687, test_loss: 0.9842, test_f1: 0.4842
 epoch: 26, train_loss: 0.9616, test_loss: 0.9791, test_f1: 0.4787
 epoch: 27, train_loss: 0.9562, test_loss: 0.9962, test_f1: 0.4824
 epoch: 28, train_loss: 0.9489, test_loss: 0.9906, test_f1: 0.4765
 epoch: 29, train_loss: 0.9484, test_loss: 0.9820, test_f1: 0.4889
 epoch: 30, train_loss: 0.9461, test_loss: 0.9612, test_f1: 0.5053
 epoch: 31, train_loss: 0.9417, test_loss: 0.9772, test_f1: 0.4875
 epoch: 32, train_loss: 0.9355, test_loss: 0.9565, test_f1: 0.5015
 epoch: 33, train_loss: 0.9270, test_loss: 0.9786, test_f1: 0.5007
 epoch: 34, train_loss: 0.9324, test_loss: 0.9872, test_f1: 0.5094
 epoch: 35, train_loss: 0.9208, test_loss: 0.9709, test_f1: 0.5111
 epoch: 36, train_loss: 0.9223, test_loss: 0.9575, test_f1: 0.5119
 epoch: 37, train_loss: 0.9165, test_loss: 0.9666, test_f1: 0.5110
 epoch: 38, train_loss: 0.9137, test_loss: 0.9662, test_f1: 0.5157
 epoch: 39, train_loss: 0.9088, test_loss: 0.9499, test_f1: 0.5340
 epoch: 40, train_loss: 0.9041, test_loss: 0.9610, test_f1: 0.5013
 epoch: 41, train_loss: 0.8981, test_loss: 0.9373, test_f1: 0.5240
 epoch: 42, train_loss: 0.8856, test_loss: 0.9382, test_f1: 0.5174
 epoch: 43, train_loss: 0.9032, test_loss: 0.9337, test_f1: 0.5238
 epoch: 44, train_loss: 0.9011, test_loss: 0.9531, test_f1: 0.5074
 epoch: 45, train_loss: 0.8866, test_loss: 0.9451, test_f1: 0.5026
 epoch: 46, train_loss: 0.8760, test_loss: 0.9522, test_f1: 0.5202
 epoch: 47, train_loss: 0.8738, test_loss: 0.9442, test_f1: 0.5329
 epoch: 48, train_loss: 0.8880, test_loss: 0.9376, test_f1: 0.5073
 epoch: 49, train_loss: 0.8761, test_loss: 0.9370, test_f1: 0.5288
 epoch: 50, train_loss: 0.8737, test_loss: 0.9264, test_f1: 0.5205
 epoch: 51, train_loss: 0.8660, test_loss: 0.9472, test_f1: 0.5187
 epoch: 52, train_loss: 0.8668, test_loss: 0.9410, test_f1: 0.5246
 epoch: 53, train_loss: 0.8633, test_loss: 0.9250, test_f1: 0.5298
 epoch: 54, train_loss: 0.8588, test_loss: 0.9404, test_f1: 0.5142
 epoch: 55, train_loss: 0.8718, test_loss: 0.9248, test_f1: 0.5305
 epoch: 56, train_loss: 0.8526, test_loss: 0.9407, test_f1: 0.5138
 epoch: 57, train_loss: 0.8646, test_loss: 0.9450, test_f1: 0.5093
 epoch: 58, train_loss: 0.8604, test_loss: 0.9377, test_f1: 0.5300
 epoch: 59, train_loss: 0.8481, test_loss: 0.9412, test_f1: 0.5329
 epoch: 60, train_loss: 0.8525, test_loss: 0.9222, test_f1: 0.5332
 epoch: 61, train_loss: 0.8506, test_loss: 0.9285, test_f1: 0.5368
 epoch: 62, train_loss: 0.8551, test_loss: 0.9176, test_f1: 0.5412
 epoch: 63, train_loss: 0.8523, test_loss: 0.9212, test_f1: 0.5379
 epoch: 64, train_loss: 0.8497, test_loss: 0.9281, test_f1: 0.5406
 epoch: 65, train_loss: 0.8519, test_loss: 0.9105, test_f1: 0.5470
 epoch: 66, train_loss: 0.8562, test_loss: 0.9449, test_f1: 0.5319
 epoch: 67, train_loss: 0.8629, test_loss: 0.9170, test_f1: 0.5415
 epoch: 68, train_loss: 0.8404, test_loss: 0.9158, test_f1: 0.5547
 epoch: 69, train_loss: 0.8415, test_loss: 0.9212, test_f1: 0.5328
 epoch: 70, train_loss: 0.8492, test_loss: 0.9255, test_f1: 0.5300
 epoch: 71, train_loss: 0.8436, test_loss: 0.9252, test_f1: 0.5427
 epoch: 72, train_loss: 0.8411, test_loss: 0.9545, test_f1: 0.5355
 epoch: 73, train_loss: 0.8409, test_loss: 0.9302, test_f1: 0.5307
 epoch: 74, train_loss: 0.8413, test_loss: 0.9342, test_f1: 0.5309
 epoch: 75, train_loss: 0.8333, test_loss: 0.9245, test_f1: 0.5528
 epoch: 76, train_loss: 0.8469, test_loss: 0.9257, test_f1: 0.5499
 epoch: 77, train_loss: 0.8384, test_loss: 0.9240, test_f1: 0.5485
 epoch: 78, train_loss: 0.8299, test_loss: 0.9246, test_f1: 0.5411
 epoch: 79, train_loss: 0.8149, test_loss: 0.9229, test_f1: 0.5358
 epoch: 80, train_loss: 0.8252, test_loss: 0.9264, test_f1: 0.5345
 epoch: 81, train_loss: 0.8361, test_loss: 0.9272, test_f1: 0.5435
 epoch: 82, train_loss: 0.8315, test_loss: 0.9172, test_f1: 0.5402
 epoch: 83, train_loss: 0.8158, test_loss: 0.9179, test_f1: 0.5351
 epoch: 84, train_loss: 0.8250, test_loss: 0.9104, test_f1: 0.5525
 epoch: 85, train_loss: 0.8313, test_loss: 0.9225, test_f1: 0.5496
 epoch: 86, train_loss: 0.8261, test_loss: 0.9454, test_f1: 0.5407
 epoch: 87, train_loss: 0.8173, test_loss: 0.9426, test_f1: 0.5429
 epoch: 88, train_loss: 0.8285, test_loss: 0.9137, test_f1: 0.5495
 epoch: 89, train_loss: 0.8116, test_loss: 0.9159, test_f1: 0.5514
 epoch: 90, train_loss: 0.8242, test_loss: 0.9047, test_f1: 0.5502
 epoch: 91, train_loss: 0.8098, test_loss: 0.9195, test_f1: 0.5528
 epoch: 92, train_loss: 0.8088, test_loss: 0.9406, test_f1: 0.5173
 epoch: 93, train_loss: 0.8115, test_loss: 0.9162, test_f1: 0.5350
 epoch: 94, train_loss: 0.8158, test_loss: 0.9234, test_f1: 0.5450
 epoch: 95, train_loss: 0.8179, test_loss: 0.9077, test_f1: 0.5495
 epoch: 96, train_loss: 0.8130, test_loss: 0.9277, test_f1: 0.5276
 epoch: 97, train_loss: 0.8086, test_loss: 0.9379, test_f1: 0.5326
 epoch: 98, train_loss: 0.8180, test_loss: 0.9517, test_f1: 0.5288
 epoch: 99, train_loss: 0.8130, test_loss: 0.9491, test_f1: 0.5321
##################ITERATION #9 ****************************************
 epoch: 0, train_loss: 1.2876, test_loss: 1.1733, test_f1: 0.3362
 epoch: 1, train_loss: 1.2117, test_loss: 1.1485, test_f1: 0.3679
 epoch: 2, train_loss: 1.1948, test_loss: 1.1216, test_f1: 0.3772
 epoch: 3, train_loss: 1.1593, test_loss: 1.0962, test_f1: 0.4061
 epoch: 4, train_loss: 1.1480, test_loss: 1.0776, test_f1: 0.4293
 epoch: 5, train_loss: 1.1298, test_loss: 1.0766, test_f1: 0.3908
 epoch: 6, train_loss: 1.1175, test_loss: 1.0509, test_f1: 0.4262
 epoch: 7, train_loss: 1.1004, test_loss: 1.0344, test_f1: 0.4312
 epoch: 8, train_loss: 1.0904, test_loss: 1.0380, test_f1: 0.4067
 epoch: 9, train_loss: 1.0753, test_loss: 1.0130, test_f1: 0.4369
 epoch: 10, train_loss: 1.0585, test_loss: 1.0165, test_f1: 0.4180
 epoch: 11, train_loss: 1.0588, test_loss: 1.0063, test_f1: 0.4314
 epoch: 12, train_loss: 1.0353, test_loss: 1.0004, test_f1: 0.4199
 epoch: 13, train_loss: 1.0413, test_loss: 0.9951, test_f1: 0.4342
 epoch: 14, train_loss: 1.0317, test_loss: 1.0074, test_f1: 0.4582
 epoch: 15, train_loss: 1.0193, test_loss: 1.0102, test_f1: 0.4489
 epoch: 16, train_loss: 1.0113, test_loss: 1.0066, test_f1: 0.4348
 epoch: 17, train_loss: 1.0116, test_loss: 1.0127, test_f1: 0.4279
 epoch: 18, train_loss: 0.9925, test_loss: 1.0154, test_f1: 0.4564
 epoch: 19, train_loss: 0.9927, test_loss: 1.0032, test_f1: 0.4489
 epoch: 20, train_loss: 0.9874, test_loss: 1.0124, test_f1: 0.4234
 epoch: 21, train_loss: 0.9785, test_loss: 1.0029, test_f1: 0.4682
 epoch: 22, train_loss: 0.9799, test_loss: 0.9999, test_f1: 0.4809
 epoch: 23, train_loss: 0.9674, test_loss: 1.0261, test_f1: 0.4348
 epoch: 24, train_loss: 0.9710, test_loss: 1.0028, test_f1: 0.4935
 epoch: 25, train_loss: 0.9578, test_loss: 1.0296, test_f1: 0.4409
 epoch: 26, train_loss: 0.9568, test_loss: 1.0149, test_f1: 0.4804
 epoch: 27, train_loss: 0.9536, test_loss: 1.0094, test_f1: 0.4594
 epoch: 28, train_loss: 0.9482, test_loss: 1.0081, test_f1: 0.4750
 epoch: 29, train_loss: 0.9348, test_loss: 0.9957, test_f1: 0.4785
 epoch: 30, train_loss: 0.9525, test_loss: 1.0002, test_f1: 0.4799
 epoch: 31, train_loss: 0.9222, test_loss: 0.9962, test_f1: 0.4859
 epoch: 32, train_loss: 0.9354, test_loss: 0.9906, test_f1: 0.4783
 epoch: 33, train_loss: 0.9231, test_loss: 0.9806, test_f1: 0.4829
 epoch: 34, train_loss: 0.9226, test_loss: 1.0016, test_f1: 0.4868
 epoch: 35, train_loss: 0.9225, test_loss: 0.9847, test_f1: 0.4988
 epoch: 36, train_loss: 0.9293, test_loss: 0.9946, test_f1: 0.5068
 epoch: 37, train_loss: 0.9165, test_loss: 0.9854, test_f1: 0.4897
 epoch: 38, train_loss: 0.9099, test_loss: 0.9810, test_f1: 0.5017
 epoch: 39, train_loss: 0.9200, test_loss: 0.9737, test_f1: 0.4955
 epoch: 40, train_loss: 0.9190, test_loss: 0.9819, test_f1: 0.4909
 epoch: 41, train_loss: 0.9100, test_loss: 0.9913, test_f1: 0.4920
 epoch: 42, train_loss: 0.8975, test_loss: 0.9842, test_f1: 0.5102
 epoch: 43, train_loss: 0.9037, test_loss: 0.9768, test_f1: 0.5189
 epoch: 44, train_loss: 0.8989, test_loss: 0.9803, test_f1: 0.4913
 epoch: 45, train_loss: 0.8912, test_loss: 0.9738, test_f1: 0.5067
 epoch: 46, train_loss: 0.8860, test_loss: 0.9913, test_f1: 0.4819
 epoch: 47, train_loss: 0.8850, test_loss: 0.9611, test_f1: 0.5167
 epoch: 48, train_loss: 0.8891, test_loss: 0.9695, test_f1: 0.5096
 epoch: 49, train_loss: 0.8798, test_loss: 0.9558, test_f1: 0.5203
 epoch: 50, train_loss: 0.8785, test_loss: 0.9558, test_f1: 0.5098
 epoch: 51, train_loss: 0.8717, test_loss: 0.9523, test_f1: 0.5183
 epoch: 52, train_loss: 0.8685, test_loss: 0.9694, test_f1: 0.5125
 epoch: 53, train_loss: 0.8683, test_loss: 0.9498, test_f1: 0.5173
 epoch: 54, train_loss: 0.8639, test_loss: 0.9457, test_f1: 0.5197
 epoch: 55, train_loss: 0.8671, test_loss: 0.9483, test_f1: 0.5185
 epoch: 56, train_loss: 0.8653, test_loss: 0.9733, test_f1: 0.5109
 epoch: 57, train_loss: 0.8647, test_loss: 0.9438, test_f1: 0.5190
 epoch: 58, train_loss: 0.8630, test_loss: 0.9485, test_f1: 0.5160
 epoch: 59, train_loss: 0.8668, test_loss: 0.9616, test_f1: 0.5140
 epoch: 60, train_loss: 0.8643, test_loss: 0.9440, test_f1: 0.5186
 epoch: 61, train_loss: 0.8549, test_loss: 0.9394, test_f1: 0.5163
 epoch: 62, train_loss: 0.8605, test_loss: 0.9418, test_f1: 0.5132
 epoch: 63, train_loss: 0.8505, test_loss: 0.9355, test_f1: 0.5228
 epoch: 64, train_loss: 0.8564, test_loss: 0.9393, test_f1: 0.5163
 epoch: 65, train_loss: 0.8529, test_loss: 0.9538, test_f1: 0.5081
 epoch: 66, train_loss: 0.8462, test_loss: 0.9334, test_f1: 0.5259
 epoch: 67, train_loss: 0.8497, test_loss: 0.9616, test_f1: 0.5082
 epoch: 68, train_loss: 0.8501, test_loss: 0.9538, test_f1: 0.5253
 epoch: 69, train_loss: 0.8485, test_loss: 0.9604, test_f1: 0.5152
 epoch: 70, train_loss: 0.8345, test_loss: 0.9511, test_f1: 0.5164
 epoch: 71, train_loss: 0.8397, test_loss: 0.9538, test_f1: 0.5178
 epoch: 72, train_loss: 0.8514, test_loss: 0.9638, test_f1: 0.5137
 epoch: 73, train_loss: 0.8434, test_loss: 0.9492, test_f1: 0.5170
 epoch: 74, train_loss: 0.8497, test_loss: 0.9284, test_f1: 0.5135
 epoch: 75, train_loss: 0.8332, test_loss: 0.9456, test_f1: 0.5138
 epoch: 76, train_loss: 0.8414, test_loss: 0.9738, test_f1: 0.4959
 epoch: 77, train_loss: 0.8361, test_loss: 0.9519, test_f1: 0.5154
 epoch: 78, train_loss: 0.8394, test_loss: 0.9490, test_f1: 0.5170
 epoch: 79, train_loss: 0.8419, test_loss: 0.9594, test_f1: 0.5061
 epoch: 80, train_loss: 0.8352, test_loss: 0.9494, test_f1: 0.5024
 epoch: 81, train_loss: 0.8285, test_loss: 0.9506, test_f1: 0.5084
 epoch: 82, train_loss: 0.8290, test_loss: 0.9480, test_f1: 0.5111
 epoch: 83, train_loss: 0.8309, test_loss: 0.9484, test_f1: 0.5183
 epoch: 84, train_loss: 0.8390, test_loss: 0.9630, test_f1: 0.5175
 epoch: 85, train_loss: 0.8252, test_loss: 0.9614, test_f1: 0.5124
 epoch: 86, train_loss: 0.8112, test_loss: 0.9759, test_f1: 0.4972
 epoch: 87, train_loss: 0.8245, test_loss: 0.9677, test_f1: 0.5113
 epoch: 88, train_loss: 0.8259, test_loss: 0.9593, test_f1: 0.5212
 epoch: 89, train_loss: 0.8256, test_loss: 0.9396, test_f1: 0.5106
 epoch: 90, train_loss: 0.8241, test_loss: 0.9396, test_f1: 0.5163
 epoch: 91, train_loss: 0.8273, test_loss: 0.9509, test_f1: 0.5229
 epoch: 92, train_loss: 0.8149, test_loss: 0.9544, test_f1: 0.5114
 epoch: 93, train_loss: 0.8240, test_loss: 0.9429, test_f1: 0.5224
 epoch: 94, train_loss: 0.8348, test_loss: 0.9651, test_f1: 0.5032
 epoch: 95, train_loss: 0.8161, test_loss: 0.9525, test_f1: 0.5050
 epoch: 96, train_loss: 0.8206, test_loss: 0.9467, test_f1: 0.5118
 epoch: 97, train_loss: 0.8046, test_loss: 0.9540, test_f1: 0.5124
 epoch: 98, train_loss: 0.8220, test_loss: 0.9642, test_f1: 0.5122
 epoch: 99, train_loss: 0.8232, test_loss: 0.9388, test_f1: 0.5249

Training completed in 1295.05 seconds
Best F1: 0.5588 at epoch 86
Mean F1 across iterations: 0.5400  0.0145
========================FINAL RESULTS================================
FEGIN weighted F1: 0.5588  0.0145
python main.py --data ltspice_examples --representation component_pin --model FEGIN --layers 5 --hiddens 32 --batch_size 32 --lr 0.0001 --emb_size 250 --epochs 100 --save_appendix component_pin_L5_H32_BS32_LR0.0001_E250 --no_val
-----



STDERR:
  File "main.py", line 370, in <module>
    main()
  File "main.py", line 254, in main
    dataset = dataset_class(
  File "/home/philip/projects/ltspice_examples_code_repo/Circuit-Completion-Using-GNNs/component_classification_with_link_prediction_head/evaluation/FEGIN/kernel/circuit_datasets.py", line 15, in __init__
    self.data, self.slices = torch.load(self.processed_paths[0])
  File "/home/philip/.local/lib/python3.8/site-packages/torch/serialization.py", line 1040, in load
    warnings.warn(
  File "/usr/lib/python3.8/warnings.py", line 109, in _showwarnmsg
    sw(msg.message, msg.category, msg.filename, msg.lineno,
  File "main.py", line 47, in warn_with_traceback
    traceback.print_stack(file=log)
/home/philip/projects/ltspice_examples_code_repo/Circuit-Completion-Using-GNNs/component_classification_with_link_prediction_head/evaluation/FEGIN/kernel/circuit_datasets.py:15: FutureWarning: You are using `torch.load` with `weights_only=False` (the current default value), which uses the default pickle module implicitly. It is possible to construct malicious pickle data which will execute arbitrary code during unpickling (See https://github.com/pytorch/pytorch/blob/main/SECURITY.md#untrusted-models for more details). In a future release, the default value for `weights_only` will be flipped to `True`. This limits the functions that could be executed during unpickling. Arbitrary objects will no longer be allowed to be loaded via this mode unless they are explicitly allowlisted by the user via `torch.serialization.add_safe_globals`. We recommend you start setting `weights_only=True` for any use case where you don't have full control of the loaded file. Please open an issue on GitHub for any issues related to this experimental feature.
  self.data, self.slices = torch.load(self.processed_paths[0])
