STDOUT:
Results will be saved in /home/philip/projects/ltspice_examples_code_repo/Circuit-Completion-Using-GNNs/component_classification_with_link_prediction_head/evaluation/FEGIN/results/model_FEGIN_dataset_ltspice_examples
Command line input: python main.py --data ltspice_examples --representation component_net --model FEGIN --layers 4 --hiddens 16 --batch_size 64 --lr 0.01 --emb_size 250 --epochs 100 --save_appendix component_net_L4_H16_BS64_LR0.01_E250 --no_val
 is saved.
-----
ltspice_examples - FEGIN
Using 4 layers, 16 hidden units, h = 2
Loading component_net representation dataset
ENTERED
Training FEGIN on component_net representation
Train: 3558, Test: 846
##################ITERATION #0 ****************************************
 epoch: 0, train_loss: 1.2922, test_loss: 1.1288, test_f1: 0.3880
 epoch: 1, train_loss: 1.1113, test_loss: 1.0706, test_f1: 0.3432
 epoch: 2, train_loss: 1.0587, test_loss: 1.1125, test_f1: 0.4428
 epoch: 3, train_loss: 1.0590, test_loss: 1.0754, test_f1: 0.4901
 epoch: 4, train_loss: 1.0192, test_loss: 1.0584, test_f1: 0.4379
 epoch: 5, train_loss: 1.0081, test_loss: 1.0395, test_f1: 0.5275
 epoch: 6, train_loss: 0.9976, test_loss: 1.0918, test_f1: 0.4474
 epoch: 7, train_loss: 0.9875, test_loss: 1.0927, test_f1: 0.5237
 epoch: 8, train_loss: 0.9833, test_loss: 1.0830, test_f1: 0.4467
 epoch: 9, train_loss: 0.9744, test_loss: 1.0380, test_f1: 0.5071
 epoch: 10, train_loss: 0.9827, test_loss: 1.0612, test_f1: 0.4813
 epoch: 11, train_loss: 0.9545, test_loss: 0.9803, test_f1: 0.4863
 epoch: 12, train_loss: 0.9555, test_loss: 1.0469, test_f1: 0.4981
 epoch: 13, train_loss: 0.9387, test_loss: 1.0217, test_f1: 0.4663
 epoch: 14, train_loss: 0.9485, test_loss: 1.0287, test_f1: 0.4833
 epoch: 15, train_loss: 0.9400, test_loss: 0.9603, test_f1: 0.5087
 epoch: 16, train_loss: 0.9301, test_loss: 0.9975, test_f1: 0.5038
 epoch: 17, train_loss: 0.9325, test_loss: 0.9519, test_f1: 0.5148
 epoch: 18, train_loss: 0.9195, test_loss: 1.0308, test_f1: 0.4766
 epoch: 19, train_loss: 0.9235, test_loss: 0.9467, test_f1: 0.4814
 epoch: 20, train_loss: 0.9286, test_loss: 1.0272, test_f1: 0.4687
 epoch: 21, train_loss: 0.9208, test_loss: 1.0040, test_f1: 0.4961
 epoch: 22, train_loss: 0.9026, test_loss: 1.0002, test_f1: 0.4823
 epoch: 23, train_loss: 0.9195, test_loss: 1.0275, test_f1: 0.4917
 epoch: 24, train_loss: 0.9053, test_loss: 1.0246, test_f1: 0.4937
 epoch: 25, train_loss: 0.9156, test_loss: 1.0264, test_f1: 0.4804
 epoch: 26, train_loss: 0.9244, test_loss: 0.9658, test_f1: 0.4923
 epoch: 27, train_loss: 0.9122, test_loss: 0.9825, test_f1: 0.5129
 epoch: 28, train_loss: 0.9081, test_loss: 0.9785, test_f1: 0.5475
 epoch: 29, train_loss: 0.9018, test_loss: 1.0588, test_f1: 0.4856
 epoch: 30, train_loss: 0.9105, test_loss: 1.0197, test_f1: 0.4969
 epoch: 31, train_loss: 0.8877, test_loss: 0.9815, test_f1: 0.4955
 epoch: 32, train_loss: 0.9012, test_loss: 0.9177, test_f1: 0.4963
 epoch: 33, train_loss: 0.9058, test_loss: 0.9908, test_f1: 0.5646
 epoch: 34, train_loss: 0.8960, test_loss: 0.9675, test_f1: 0.5121
 epoch: 35, train_loss: 0.8866, test_loss: 1.0137, test_f1: 0.5340
 epoch: 36, train_loss: 0.8853, test_loss: 0.9673, test_f1: 0.5762
 epoch: 37, train_loss: 0.8735, test_loss: 1.0068, test_f1: 0.5032
 epoch: 38, train_loss: 0.8973, test_loss: 1.0003, test_f1: 0.5151
 epoch: 39, train_loss: 0.8861, test_loss: 1.0513, test_f1: 0.4845
 epoch: 40, train_loss: 0.8897, test_loss: 1.0325, test_f1: 0.4871
 epoch: 41, train_loss: 0.8801, test_loss: 1.0492, test_f1: 0.5288
 epoch: 42, train_loss: 0.8901, test_loss: 1.0193, test_f1: 0.4951
 epoch: 43, train_loss: 0.8923, test_loss: 1.0008, test_f1: 0.4980
 epoch: 44, train_loss: 0.8827, test_loss: 0.9795, test_f1: 0.5311
 epoch: 45, train_loss: 0.8735, test_loss: 0.9996, test_f1: 0.5343
 epoch: 46, train_loss: 0.8711, test_loss: 1.0127, test_f1: 0.5230
 epoch: 47, train_loss: 0.8761, test_loss: 0.9921, test_f1: 0.5296
 epoch: 48, train_loss: 0.8746, test_loss: 1.0026, test_f1: 0.5529
 epoch: 49, train_loss: 0.8715, test_loss: 0.9797, test_f1: 0.5251
 epoch: 50, train_loss: 0.8660, test_loss: 0.9783, test_f1: 0.5101
 epoch: 51, train_loss: 0.8546, test_loss: 1.0131, test_f1: 0.5383
 epoch: 52, train_loss: 0.8343, test_loss: 1.0582, test_f1: 0.5609
 epoch: 53, train_loss: 0.8418, test_loss: 1.0248, test_f1: 0.5375
 epoch: 54, train_loss: 0.8453, test_loss: 1.0015, test_f1: 0.5686
 epoch: 55, train_loss: 0.8350, test_loss: 1.0170, test_f1: 0.5733
 epoch: 56, train_loss: 0.8399, test_loss: 1.0079, test_f1: 0.5478
 epoch: 57, train_loss: 0.8343, test_loss: 1.0149, test_f1: 0.5749
 epoch: 58, train_loss: 0.8354, test_loss: 0.9893, test_f1: 0.5615
 epoch: 59, train_loss: 0.8333, test_loss: 1.0089, test_f1: 0.5934
 epoch: 60, train_loss: 0.8177, test_loss: 1.0226, test_f1: 0.5513
 epoch: 61, train_loss: 0.8221, test_loss: 1.0194, test_f1: 0.5719
 epoch: 62, train_loss: 0.8272, test_loss: 1.0156, test_f1: 0.5601
 epoch: 63, train_loss: 0.8180, test_loss: 1.0178, test_f1: 0.5759
 epoch: 64, train_loss: 0.8134, test_loss: 1.0154, test_f1: 0.5397
 epoch: 65, train_loss: 0.8171, test_loss: 0.9882, test_f1: 0.5327
 epoch: 66, train_loss: 0.8213, test_loss: 1.0203, test_f1: 0.5533
 epoch: 67, train_loss: 0.8180, test_loss: 1.0086, test_f1: 0.5497
 epoch: 68, train_loss: 0.8125, test_loss: 1.0243, test_f1: 0.5627
 epoch: 69, train_loss: 0.8174, test_loss: 1.0283, test_f1: 0.5593
 epoch: 70, train_loss: 0.8230, test_loss: 1.0079, test_f1: 0.5565
 epoch: 71, train_loss: 0.8155, test_loss: 1.0445, test_f1: 0.5474
 epoch: 72, train_loss: 0.8058, test_loss: 0.9997, test_f1: 0.5659
 epoch: 73, train_loss: 0.8133, test_loss: 1.0587, test_f1: 0.5579
 epoch: 74, train_loss: 0.8191, test_loss: 1.0189, test_f1: 0.5605
 epoch: 75, train_loss: 0.8130, test_loss: 1.0560, test_f1: 0.5650
 epoch: 76, train_loss: 0.8029, test_loss: 1.0384, test_f1: 0.5645
 epoch: 77, train_loss: 0.8126, test_loss: 1.0242, test_f1: 0.5703
 epoch: 78, train_loss: 0.8107, test_loss: 1.0552, test_f1: 0.5585
 epoch: 79, train_loss: 0.8077, test_loss: 1.0761, test_f1: 0.5405
 epoch: 80, train_loss: 0.8070, test_loss: 1.0831, test_f1: 0.5546
 epoch: 81, train_loss: 0.8078, test_loss: 1.0554, test_f1: 0.5740
 epoch: 82, train_loss: 0.8006, test_loss: 1.0648, test_f1: 0.5578
 epoch: 83, train_loss: 0.8003, test_loss: 1.0239, test_f1: 0.5576
 epoch: 84, train_loss: 0.8061, test_loss: 1.0485, test_f1: 0.5743
 epoch: 85, train_loss: 0.7995, test_loss: 1.0656, test_f1: 0.5931
 epoch: 86, train_loss: 0.8095, test_loss: 1.0152, test_f1: 0.5987
 epoch: 87, train_loss: 0.7964, test_loss: 1.0394, test_f1: 0.5719
 epoch: 88, train_loss: 0.7935, test_loss: 1.0938, test_f1: 0.5558
 epoch: 89, train_loss: 0.7986, test_loss: 1.0730, test_f1: 0.5355
 epoch: 90, train_loss: 0.7963, test_loss: 1.0354, test_f1: 0.5621
 epoch: 91, train_loss: 0.7989, test_loss: 1.0765, test_f1: 0.5806
 epoch: 92, train_loss: 0.7909, test_loss: 1.0694, test_f1: 0.5662
 epoch: 93, train_loss: 0.7861, test_loss: 1.0949, test_f1: 0.5739
 epoch: 94, train_loss: 0.7904, test_loss: 1.1168, test_f1: 0.5680
 epoch: 95, train_loss: 0.7875, test_loss: 1.0973, test_f1: 0.5552
 epoch: 96, train_loss: 0.7879, test_loss: 1.1029, test_f1: 0.5548
 epoch: 97, train_loss: 0.7907, test_loss: 1.0442, test_f1: 0.5636
 epoch: 98, train_loss: 0.7823, test_loss: 1.0666, test_f1: 0.5741
 epoch: 99, train_loss: 0.7837, test_loss: 1.0104, test_f1: 0.5649
##################ITERATION #1 ****************************************
 epoch: 0, train_loss: 1.1731, test_loss: 1.0708, test_f1: 0.3803
 epoch: 1, train_loss: 1.0589, test_loss: 1.1057, test_f1: 0.3432
 epoch: 2, train_loss: 1.0493, test_loss: 1.0728, test_f1: 0.3422
 epoch: 3, train_loss: 1.0370, test_loss: 1.1090, test_f1: 0.3749
 epoch: 4, train_loss: 1.0343, test_loss: 1.0792, test_f1: 0.4328
 epoch: 5, train_loss: 1.0155, test_loss: 1.0006, test_f1: 0.4135
 epoch: 6, train_loss: 0.9950, test_loss: 1.0131, test_f1: 0.4564
 epoch: 7, train_loss: 0.9924, test_loss: 0.9971, test_f1: 0.4751
 epoch: 8, train_loss: 0.9795, test_loss: 1.0803, test_f1: 0.4488
 epoch: 9, train_loss: 0.9722, test_loss: 0.9578, test_f1: 0.4666
 epoch: 10, train_loss: 0.9642, test_loss: 1.1219, test_f1: 0.3623
 epoch: 11, train_loss: 0.9631, test_loss: 0.9654, test_f1: 0.4745
 epoch: 12, train_loss: 0.9586, test_loss: 0.9521, test_f1: 0.4838
 epoch: 13, train_loss: 0.9350, test_loss: 0.9671, test_f1: 0.4801
 epoch: 14, train_loss: 0.9462, test_loss: 0.9567, test_f1: 0.4996
 epoch: 15, train_loss: 0.9255, test_loss: 0.9316, test_f1: 0.4747
 epoch: 16, train_loss: 0.9493, test_loss: 0.9350, test_f1: 0.4692
 epoch: 17, train_loss: 0.9110, test_loss: 0.9175, test_f1: 0.4905
 epoch: 18, train_loss: 0.9213, test_loss: 0.9237, test_f1: 0.5063
 epoch: 19, train_loss: 0.9154, test_loss: 1.0180, test_f1: 0.4487
 epoch: 20, train_loss: 0.9122, test_loss: 0.9328, test_f1: 0.5003
 epoch: 21, train_loss: 0.9043, test_loss: 0.9629, test_f1: 0.4888
 epoch: 22, train_loss: 0.9033, test_loss: 0.9430, test_f1: 0.5003
 epoch: 23, train_loss: 0.9007, test_loss: 0.9513, test_f1: 0.4916
 epoch: 24, train_loss: 0.8940, test_loss: 0.9667, test_f1: 0.4886
 epoch: 25, train_loss: 0.8936, test_loss: 0.9685, test_f1: 0.5037
 epoch: 26, train_loss: 0.8887, test_loss: 0.9864, test_f1: 0.4985
 epoch: 27, train_loss: 0.8839, test_loss: 0.9523, test_f1: 0.5075
 epoch: 28, train_loss: 0.8794, test_loss: 0.9410, test_f1: 0.5073
 epoch: 29, train_loss: 0.8697, test_loss: 0.9255, test_f1: 0.4996
 epoch: 30, train_loss: 0.8757, test_loss: 0.9407, test_f1: 0.5659
 epoch: 31, train_loss: 0.8819, test_loss: 0.9488, test_f1: 0.4840
 epoch: 32, train_loss: 0.8695, test_loss: 0.9396, test_f1: 0.5135
 epoch: 33, train_loss: 0.8784, test_loss: 0.9749, test_f1: 0.5177
 epoch: 34, train_loss: 0.8782, test_loss: 0.9328, test_f1: 0.5124
 epoch: 35, train_loss: 0.8740, test_loss: 0.9253, test_f1: 0.5006
 epoch: 36, train_loss: 0.8680, test_loss: 0.9699, test_f1: 0.5226
 epoch: 37, train_loss: 0.8676, test_loss: 0.9699, test_f1: 0.4961
 epoch: 38, train_loss: 0.8564, test_loss: 0.9648, test_f1: 0.5053
 epoch: 39, train_loss: 0.8574, test_loss: 0.9340, test_f1: 0.5454
 epoch: 40, train_loss: 0.8483, test_loss: 0.9707, test_f1: 0.5792
 epoch: 41, train_loss: 0.8634, test_loss: 1.0337, test_f1: 0.5088
 epoch: 42, train_loss: 0.8748, test_loss: 0.9286, test_f1: 0.5284
 epoch: 43, train_loss: 0.8485, test_loss: 0.9582, test_f1: 0.5970
 epoch: 44, train_loss: 0.8563, test_loss: 1.0159, test_f1: 0.5187
 epoch: 45, train_loss: 0.8432, test_loss: 1.0662, test_f1: 0.4764
 epoch: 46, train_loss: 0.8447, test_loss: 0.9439, test_f1: 0.5831
 epoch: 47, train_loss: 0.8373, test_loss: 0.9476, test_f1: 0.5335
 epoch: 48, train_loss: 0.8538, test_loss: 1.0139, test_f1: 0.5546
 epoch: 49, train_loss: 0.8380, test_loss: 1.0224, test_f1: 0.5216
 epoch: 50, train_loss: 0.8351, test_loss: 0.9722, test_f1: 0.5733
 epoch: 51, train_loss: 0.8204, test_loss: 0.9613, test_f1: 0.5519
 epoch: 52, train_loss: 0.8041, test_loss: 0.9564, test_f1: 0.5827
 epoch: 53, train_loss: 0.8021, test_loss: 0.9473, test_f1: 0.5891
 epoch: 54, train_loss: 0.8016, test_loss: 0.9598, test_f1: 0.5795
 epoch: 55, train_loss: 0.8102, test_loss: 0.9276, test_f1: 0.5921
 epoch: 56, train_loss: 0.8058, test_loss: 0.9374, test_f1: 0.5820
 epoch: 57, train_loss: 0.8026, test_loss: 0.9281, test_f1: 0.5693
 epoch: 58, train_loss: 0.7940, test_loss: 0.9951, test_f1: 0.5608
 epoch: 59, train_loss: 0.7970, test_loss: 0.9519, test_f1: 0.5962
 epoch: 60, train_loss: 0.7858, test_loss: 0.9896, test_f1: 0.5364
 epoch: 61, train_loss: 0.7973, test_loss: 1.0415, test_f1: 0.5610
 epoch: 62, train_loss: 0.8009, test_loss: 0.9544, test_f1: 0.5915
 epoch: 63, train_loss: 0.7982, test_loss: 0.9589, test_f1: 0.5865
 epoch: 64, train_loss: 0.7901, test_loss: 0.9923, test_f1: 0.5699
 epoch: 65, train_loss: 0.7981, test_loss: 0.9537, test_f1: 0.5772
 epoch: 66, train_loss: 0.7982, test_loss: 0.9928, test_f1: 0.5639
 epoch: 67, train_loss: 0.7818, test_loss: 0.9645, test_f1: 0.6030
 epoch: 68, train_loss: 0.7714, test_loss: 0.9111, test_f1: 0.5973
 epoch: 69, train_loss: 0.7952, test_loss: 0.9061, test_f1: 0.5967
 epoch: 70, train_loss: 0.7698, test_loss: 0.9583, test_f1: 0.5925
 epoch: 71, train_loss: 0.7755, test_loss: 0.9314, test_f1: 0.5555
 epoch: 72, train_loss: 0.7709, test_loss: 0.9807, test_f1: 0.5792
 epoch: 73, train_loss: 0.7816, test_loss: 0.9408, test_f1: 0.5592
 epoch: 74, train_loss: 0.7781, test_loss: 0.9457, test_f1: 0.5525
 epoch: 75, train_loss: 0.7778, test_loss: 0.9128, test_f1: 0.5638
 epoch: 76, train_loss: 0.7935, test_loss: 0.9392, test_f1: 0.5581
 epoch: 77, train_loss: 0.7808, test_loss: 0.9645, test_f1: 0.5703
 epoch: 78, train_loss: 0.7644, test_loss: 0.9449, test_f1: 0.5921
 epoch: 79, train_loss: 0.7690, test_loss: 0.9483, test_f1: 0.5626
 epoch: 80, train_loss: 0.7637, test_loss: 0.9647, test_f1: 0.5966
 epoch: 81, train_loss: 0.7661, test_loss: 0.9821, test_f1: 0.5387
 epoch: 82, train_loss: 0.7672, test_loss: 0.9530, test_f1: 0.5718
 epoch: 83, train_loss: 0.7679, test_loss: 0.9788, test_f1: 0.5710
 epoch: 84, train_loss: 0.7786, test_loss: 0.9459, test_f1: 0.5959
 epoch: 85, train_loss: 0.7631, test_loss: 0.9577, test_f1: 0.5933
 epoch: 86, train_loss: 0.7767, test_loss: 0.9622, test_f1: 0.6202
 epoch: 87, train_loss: 0.7684, test_loss: 0.9726, test_f1: 0.5879
 epoch: 88, train_loss: 0.7639, test_loss: 0.9525, test_f1: 0.5974
 epoch: 89, train_loss: 0.7537, test_loss: 1.1018, test_f1: 0.5769
 epoch: 90, train_loss: 0.7686, test_loss: 0.9252, test_f1: 0.5984
 epoch: 91, train_loss: 0.7535, test_loss: 0.9731, test_f1: 0.6068
 epoch: 92, train_loss: 0.7410, test_loss: 0.9652, test_f1: 0.5849
 epoch: 93, train_loss: 0.7601, test_loss: 0.9938, test_f1: 0.5573
 epoch: 94, train_loss: 0.7577, test_loss: 0.9817, test_f1: 0.5818
 epoch: 95, train_loss: 0.7683, test_loss: 0.9697, test_f1: 0.5874
 epoch: 96, train_loss: 0.7535, test_loss: 0.9796, test_f1: 0.5528
 epoch: 97, train_loss: 0.7539, test_loss: 0.9499, test_f1: 0.5888
 epoch: 98, train_loss: 0.7640, test_loss: 0.9379, test_f1: 0.6224
 epoch: 99, train_loss: 0.7512, test_loss: 0.9404, test_f1: 0.6012
##################ITERATION #2 ****************************************
 epoch: 0, train_loss: 1.2150, test_loss: 1.0864, test_f1: 0.3737
 epoch: 1, train_loss: 1.0779, test_loss: 1.0463, test_f1: 0.4465
 epoch: 2, train_loss: 1.0396, test_loss: 1.0331, test_f1: 0.4904
 epoch: 3, train_loss: 1.0176, test_loss: 1.1335, test_f1: 0.4358
 epoch: 4, train_loss: 0.9983, test_loss: 1.0866, test_f1: 0.4527
 epoch: 5, train_loss: 0.9745, test_loss: 0.9596, test_f1: 0.4987
 epoch: 6, train_loss: 0.9719, test_loss: 1.0109, test_f1: 0.4710
 epoch: 7, train_loss: 0.9611, test_loss: 1.0171, test_f1: 0.4913
 epoch: 8, train_loss: 0.9497, test_loss: 1.0192, test_f1: 0.4831
 epoch: 9, train_loss: 0.9544, test_loss: 0.9534, test_f1: 0.5144
 epoch: 10, train_loss: 0.9634, test_loss: 1.0058, test_f1: 0.4865
 epoch: 11, train_loss: 0.9484, test_loss: 1.0369, test_f1: 0.4792
 epoch: 12, train_loss: 0.9410, test_loss: 0.9526, test_f1: 0.4745
 epoch: 13, train_loss: 0.9337, test_loss: 0.9714, test_f1: 0.4812
 epoch: 14, train_loss: 0.9305, test_loss: 1.0592, test_f1: 0.4826
 epoch: 15, train_loss: 0.9379, test_loss: 0.9565, test_f1: 0.5164
 epoch: 16, train_loss: 0.9318, test_loss: 0.8929, test_f1: 0.5038
 epoch: 17, train_loss: 0.9229, test_loss: 0.9702, test_f1: 0.5155
 epoch: 18, train_loss: 0.9172, test_loss: 0.8919, test_f1: 0.5491
 epoch: 19, train_loss: 0.9270, test_loss: 0.9392, test_f1: 0.5050
 epoch: 20, train_loss: 0.9185, test_loss: 0.9436, test_f1: 0.4952
 epoch: 21, train_loss: 0.9235, test_loss: 0.8838, test_f1: 0.5115
 epoch: 22, train_loss: 0.9186, test_loss: 1.0173, test_f1: 0.4881
 epoch: 23, train_loss: 0.9040, test_loss: 0.8697, test_f1: 0.5295
 epoch: 24, train_loss: 0.9103, test_loss: 0.9606, test_f1: 0.4719
 epoch: 25, train_loss: 0.8916, test_loss: 0.9103, test_f1: 0.4963
 epoch: 26, train_loss: 0.8967, test_loss: 0.9208, test_f1: 0.5300
 epoch: 27, train_loss: 0.9002, test_loss: 0.9161, test_f1: 0.4980
 epoch: 28, train_loss: 0.8911, test_loss: 0.9037, test_f1: 0.5220
 epoch: 29, train_loss: 0.8987, test_loss: 0.9440, test_f1: 0.5319
 epoch: 30, train_loss: 0.8731, test_loss: 0.8810, test_f1: 0.4870
 epoch: 31, train_loss: 0.8889, test_loss: 0.9223, test_f1: 0.5036
 epoch: 32, train_loss: 0.8711, test_loss: 0.9517, test_f1: 0.5236
 epoch: 33, train_loss: 0.9124, test_loss: 1.0202, test_f1: 0.4716
 epoch: 34, train_loss: 0.8996, test_loss: 1.0152, test_f1: 0.5194
 epoch: 35, train_loss: 0.8943, test_loss: 0.9517, test_f1: 0.5568
 epoch: 36, train_loss: 0.8809, test_loss: 1.0056, test_f1: 0.4975
 epoch: 37, train_loss: 0.8888, test_loss: 1.0566, test_f1: 0.4730
 epoch: 38, train_loss: 0.8692, test_loss: 0.9251, test_f1: 0.5527
 epoch: 39, train_loss: 0.8599, test_loss: 0.8949, test_f1: 0.5209
 epoch: 40, train_loss: 0.8566, test_loss: 0.9339, test_f1: 0.5298
 epoch: 41, train_loss: 0.8484, test_loss: 0.9287, test_f1: 0.5493
 epoch: 42, train_loss: 0.8654, test_loss: 0.9470, test_f1: 0.5561
 epoch: 43, train_loss: 0.8483, test_loss: 0.9067, test_f1: 0.5470
 epoch: 44, train_loss: 0.8623, test_loss: 0.8749, test_f1: 0.5181
 epoch: 45, train_loss: 0.8415, test_loss: 0.9002, test_f1: 0.5180
 epoch: 46, train_loss: 0.8405, test_loss: 0.9092, test_f1: 0.5221
 epoch: 47, train_loss: 0.8436, test_loss: 0.9425, test_f1: 0.5105
 epoch: 48, train_loss: 0.8473, test_loss: 0.8899, test_f1: 0.5776
 epoch: 49, train_loss: 0.8625, test_loss: 1.0461, test_f1: 0.4827
 epoch: 50, train_loss: 0.8515, test_loss: 0.9573, test_f1: 0.4877
 epoch: 51, train_loss: 0.8461, test_loss: 0.8950, test_f1: 0.5889
 epoch: 52, train_loss: 0.8211, test_loss: 0.9077, test_f1: 0.5461
 epoch: 53, train_loss: 0.8057, test_loss: 0.9196, test_f1: 0.5765
 epoch: 54, train_loss: 0.8152, test_loss: 0.8771, test_f1: 0.5517
 epoch: 55, train_loss: 0.7977, test_loss: 0.8848, test_f1: 0.5759
 epoch: 56, train_loss: 0.8027, test_loss: 0.9001, test_f1: 0.5621
 epoch: 57, train_loss: 0.8039, test_loss: 0.9190, test_f1: 0.5646
 epoch: 58, train_loss: 0.8054, test_loss: 0.8926, test_f1: 0.5848
 epoch: 59, train_loss: 0.7984, test_loss: 0.8858, test_f1: 0.5524
 epoch: 60, train_loss: 0.8019, test_loss: 0.9069, test_f1: 0.5566
 epoch: 61, train_loss: 0.8092, test_loss: 0.8782, test_f1: 0.5748
 epoch: 62, train_loss: 0.8016, test_loss: 0.8651, test_f1: 0.5715
 epoch: 63, train_loss: 0.7925, test_loss: 0.8972, test_f1: 0.5701
 epoch: 64, train_loss: 0.7994, test_loss: 0.8807, test_f1: 0.5693
 epoch: 65, train_loss: 0.8086, test_loss: 0.8959, test_f1: 0.5721
 epoch: 66, train_loss: 0.8050, test_loss: 0.8734, test_f1: 0.5697
 epoch: 67, train_loss: 0.7789, test_loss: 0.8964, test_f1: 0.5495
 epoch: 68, train_loss: 0.7869, test_loss: 0.8903, test_f1: 0.5652
 epoch: 69, train_loss: 0.7903, test_loss: 0.9260, test_f1: 0.5408
 epoch: 70, train_loss: 0.7764, test_loss: 0.8956, test_f1: 0.6005
 epoch: 71, train_loss: 0.7872, test_loss: 0.8911, test_f1: 0.5809
 epoch: 72, train_loss: 0.7815, test_loss: 0.8987, test_f1: 0.6212
 epoch: 73, train_loss: 0.7904, test_loss: 0.8810, test_f1: 0.6037
 epoch: 74, train_loss: 0.7927, test_loss: 0.8965, test_f1: 0.5754
 epoch: 75, train_loss: 0.7841, test_loss: 0.9178, test_f1: 0.5695
 epoch: 76, train_loss: 0.7913, test_loss: 0.9091, test_f1: 0.5996
 epoch: 77, train_loss: 0.7660, test_loss: 0.8812, test_f1: 0.6309
 epoch: 78, train_loss: 0.7779, test_loss: 0.8890, test_f1: 0.5861
 epoch: 79, train_loss: 0.7774, test_loss: 0.9014, test_f1: 0.5584
 epoch: 80, train_loss: 0.7767, test_loss: 0.8716, test_f1: 0.6325
 epoch: 81, train_loss: 0.7750, test_loss: 0.8620, test_f1: 0.6051
 epoch: 82, train_loss: 0.7807, test_loss: 0.8765, test_f1: 0.5735
 epoch: 83, train_loss: 0.7592, test_loss: 0.8915, test_f1: 0.6194
 epoch: 84, train_loss: 0.7844, test_loss: 0.8829, test_f1: 0.5813
 epoch: 85, train_loss: 0.7698, test_loss: 0.9010, test_f1: 0.5835
 epoch: 86, train_loss: 0.7680, test_loss: 0.9249, test_f1: 0.5873
 epoch: 87, train_loss: 0.7818, test_loss: 0.9118, test_f1: 0.5723
 epoch: 88, train_loss: 0.7685, test_loss: 0.9043, test_f1: 0.6257
 epoch: 89, train_loss: 0.7623, test_loss: 0.9376, test_f1: 0.5478
 epoch: 90, train_loss: 0.7636, test_loss: 0.9156, test_f1: 0.5692
 epoch: 91, train_loss: 0.7614, test_loss: 0.8797, test_f1: 0.6041
 epoch: 92, train_loss: 0.7758, test_loss: 0.9211, test_f1: 0.5875
 epoch: 93, train_loss: 0.7635, test_loss: 0.8840, test_f1: 0.5957
 epoch: 94, train_loss: 0.7740, test_loss: 0.8901, test_f1: 0.5897
 epoch: 95, train_loss: 0.7527, test_loss: 0.8939, test_f1: 0.6165
 epoch: 96, train_loss: 0.7725, test_loss: 0.8907, test_f1: 0.6054
 epoch: 97, train_loss: 0.7598, test_loss: 0.9268, test_f1: 0.5815
 epoch: 98, train_loss: 0.7436, test_loss: 0.9025, test_f1: 0.6091
 epoch: 99, train_loss: 0.7653, test_loss: 0.9106, test_f1: 0.6206
##################ITERATION #3 ****************************************
 epoch: 0, train_loss: 1.1560, test_loss: 1.0565, test_f1: 0.3640
 epoch: 1, train_loss: 1.0176, test_loss: 0.9454, test_f1: 0.4687
 epoch: 2, train_loss: 0.9892, test_loss: 0.9812, test_f1: 0.4782
 epoch: 3, train_loss: 0.9827, test_loss: 1.0686, test_f1: 0.3796
 epoch: 4, train_loss: 0.9685, test_loss: 1.0280, test_f1: 0.4743
 epoch: 5, train_loss: 0.9591, test_loss: 0.9962, test_f1: 0.4808
 epoch: 6, train_loss: 0.9490, test_loss: 0.9635, test_f1: 0.5135
 epoch: 7, train_loss: 0.9441, test_loss: 0.8892, test_f1: 0.5224
 epoch: 8, train_loss: 0.9526, test_loss: 0.9940, test_f1: 0.5091
 epoch: 9, train_loss: 0.9404, test_loss: 0.9513, test_f1: 0.5230
 epoch: 10, train_loss: 0.9418, test_loss: 1.0060, test_f1: 0.4954
 epoch: 11, train_loss: 0.9301, test_loss: 0.9996, test_f1: 0.4842
 epoch: 12, train_loss: 0.9370, test_loss: 0.9382, test_f1: 0.5495
 epoch: 13, train_loss: 0.9112, test_loss: 0.8730, test_f1: 0.5771
 epoch: 14, train_loss: 0.9364, test_loss: 1.0488, test_f1: 0.4973
 epoch: 15, train_loss: 0.9160, test_loss: 0.9235, test_f1: 0.5345
 epoch: 16, train_loss: 0.9336, test_loss: 1.0481, test_f1: 0.4834
 epoch: 17, train_loss: 0.9021, test_loss: 0.9411, test_f1: 0.5696
 epoch: 18, train_loss: 0.9148, test_loss: 0.9687, test_f1: 0.4970
 epoch: 19, train_loss: 0.8952, test_loss: 0.8857, test_f1: 0.5370
 epoch: 20, train_loss: 0.9029, test_loss: 0.9321, test_f1: 0.5505
 epoch: 21, train_loss: 0.8855, test_loss: 1.0012, test_f1: 0.5030
 epoch: 22, train_loss: 0.8947, test_loss: 1.0072, test_f1: 0.5245
 epoch: 23, train_loss: 0.8970, test_loss: 0.9856, test_f1: 0.5185
 epoch: 24, train_loss: 0.9114, test_loss: 0.9568, test_f1: 0.4951
 epoch: 25, train_loss: 0.8989, test_loss: 0.9840, test_f1: 0.5233
 epoch: 26, train_loss: 0.8707, test_loss: 0.9529, test_f1: 0.5201
 epoch: 27, train_loss: 0.8710, test_loss: 0.9508, test_f1: 0.4999
 epoch: 28, train_loss: 0.8752, test_loss: 0.9490, test_f1: 0.5065
 epoch: 29, train_loss: 0.8733, test_loss: 0.8958, test_f1: 0.5433
 epoch: 30, train_loss: 0.8645, test_loss: 0.9248, test_f1: 0.5573
 epoch: 31, train_loss: 0.8677, test_loss: 0.9786, test_f1: 0.5182
 epoch: 32, train_loss: 0.8596, test_loss: 0.9468, test_f1: 0.5054
 epoch: 33, train_loss: 0.8639, test_loss: 0.9015, test_f1: 0.5480
 epoch: 34, train_loss: 0.8634, test_loss: 0.8944, test_f1: 0.5395
 epoch: 35, train_loss: 0.8638, test_loss: 0.9483, test_f1: 0.5601
 epoch: 36, train_loss: 0.8600, test_loss: 0.9262, test_f1: 0.5463
 epoch: 37, train_loss: 0.8671, test_loss: 0.9465, test_f1: 0.5799
 epoch: 38, train_loss: 0.8454, test_loss: 0.8877, test_f1: 0.5592
 epoch: 39, train_loss: 0.8535, test_loss: 0.9267, test_f1: 0.5551
 epoch: 40, train_loss: 0.8594, test_loss: 0.9920, test_f1: 0.5839
 epoch: 41, train_loss: 0.8523, test_loss: 0.9412, test_f1: 0.5506
 epoch: 42, train_loss: 0.8341, test_loss: 1.1952, test_f1: 0.4806
 epoch: 43, train_loss: 0.8289, test_loss: 1.0108, test_f1: 0.5304
 epoch: 44, train_loss: 0.8503, test_loss: 1.0028, test_f1: 0.5634
 epoch: 45, train_loss: 0.8534, test_loss: 0.9352, test_f1: 0.5599
 epoch: 46, train_loss: 0.8452, test_loss: 0.9173, test_f1: 0.5717
 epoch: 47, train_loss: 0.8591, test_loss: 1.0414, test_f1: 0.5035
 epoch: 48, train_loss: 0.8440, test_loss: 0.9764, test_f1: 0.5534
 epoch: 49, train_loss: 0.8309, test_loss: 0.9651, test_f1: 0.5130
 epoch: 50, train_loss: 0.8439, test_loss: 0.9669, test_f1: 0.5105
 epoch: 51, train_loss: 0.8144, test_loss: 1.0011, test_f1: 0.5430
 epoch: 52, train_loss: 0.8056, test_loss: 0.9719, test_f1: 0.5628
 epoch: 53, train_loss: 0.8114, test_loss: 1.0031, test_f1: 0.5578
 epoch: 54, train_loss: 0.7990, test_loss: 0.9781, test_f1: 0.5640
 epoch: 55, train_loss: 0.7960, test_loss: 0.9463, test_f1: 0.5702
 epoch: 56, train_loss: 0.7899, test_loss: 0.9520, test_f1: 0.5582
 epoch: 57, train_loss: 0.7969, test_loss: 0.9552, test_f1: 0.5709
 epoch: 58, train_loss: 0.7896, test_loss: 0.9945, test_f1: 0.5598
 epoch: 59, train_loss: 0.8036, test_loss: 0.9015, test_f1: 0.6123
 epoch: 60, train_loss: 0.7920, test_loss: 0.9428, test_f1: 0.6060
 epoch: 61, train_loss: 0.7767, test_loss: 0.9134, test_f1: 0.5588
 epoch: 62, train_loss: 0.7876, test_loss: 0.9176, test_f1: 0.5986
 epoch: 63, train_loss: 0.7856, test_loss: 0.9384, test_f1: 0.5764
 epoch: 64, train_loss: 0.7813, test_loss: 0.9459, test_f1: 0.5885
 epoch: 65, train_loss: 0.7775, test_loss: 0.9757, test_f1: 0.5823
 epoch: 66, train_loss: 0.7716, test_loss: 0.8897, test_f1: 0.6188
 epoch: 67, train_loss: 0.7745, test_loss: 0.9678, test_f1: 0.5926
 epoch: 68, train_loss: 0.7683, test_loss: 0.9558, test_f1: 0.5964
 epoch: 69, train_loss: 0.7864, test_loss: 0.9551, test_f1: 0.5621
 epoch: 70, train_loss: 0.7881, test_loss: 0.9775, test_f1: 0.5672
 epoch: 71, train_loss: 0.7724, test_loss: 0.9638, test_f1: 0.5947
 epoch: 72, train_loss: 0.7687, test_loss: 0.9506, test_f1: 0.6068
 epoch: 73, train_loss: 0.7587, test_loss: 0.9465, test_f1: 0.5520
 epoch: 74, train_loss: 0.7655, test_loss: 0.9126, test_f1: 0.6215
 epoch: 75, train_loss: 0.7840, test_loss: 0.9583, test_f1: 0.6094
 epoch: 76, train_loss: 0.7688, test_loss: 0.9202, test_f1: 0.5822
 epoch: 77, train_loss: 0.7612, test_loss: 0.9268, test_f1: 0.6108
 epoch: 78, train_loss: 0.7699, test_loss: 0.9496, test_f1: 0.6077
 epoch: 79, train_loss: 0.7585, test_loss: 0.9345, test_f1: 0.6205
 epoch: 80, train_loss: 0.7910, test_loss: 0.9138, test_f1: 0.6092
 epoch: 81, train_loss: 0.7748, test_loss: 0.9551, test_f1: 0.5796
 epoch: 82, train_loss: 0.7697, test_loss: 0.9814, test_f1: 0.6077
 epoch: 83, train_loss: 0.7672, test_loss: 0.9289, test_f1: 0.5549
 epoch: 84, train_loss: 0.7799, test_loss: 0.9112, test_f1: 0.5953
 epoch: 85, train_loss: 0.7773, test_loss: 0.9886, test_f1: 0.5977
 epoch: 86, train_loss: 0.7769, test_loss: 0.8897, test_f1: 0.6310
 epoch: 87, train_loss: 0.7631, test_loss: 0.9336, test_f1: 0.6019
 epoch: 88, train_loss: 0.7666, test_loss: 1.2822, test_f1: 0.5237
 epoch: 89, train_loss: 0.7562, test_loss: 0.9432, test_f1: 0.6318
 epoch: 90, train_loss: 0.7483, test_loss: 0.9098, test_f1: 0.6549
 epoch: 91, train_loss: 0.7609, test_loss: 0.9423, test_f1: 0.6195
 epoch: 92, train_loss: 0.7475, test_loss: 0.9439, test_f1: 0.5769
 epoch: 93, train_loss: 0.7482, test_loss: 0.9353, test_f1: 0.6149
 epoch: 94, train_loss: 0.7535, test_loss: 0.9579, test_f1: 0.6191
 epoch: 95, train_loss: 0.7576, test_loss: 0.9655, test_f1: 0.6076
 epoch: 96, train_loss: 0.7450, test_loss: 0.9319, test_f1: 0.6156
 epoch: 97, train_loss: 0.7587, test_loss: 0.9190, test_f1: 0.5971
 epoch: 98, train_loss: 0.7553, test_loss: 0.9519, test_f1: 0.6158
 epoch: 99, train_loss: 0.7630, test_loss: 0.9569, test_f1: 0.6370
##################ITERATION #4 ****************************************
 epoch: 0, train_loss: 1.2025, test_loss: 1.0797, test_f1: 0.3543
 epoch: 1, train_loss: 1.0512, test_loss: 1.0673, test_f1: 0.3783
 epoch: 2, train_loss: 1.0338, test_loss: 1.0506, test_f1: 0.4426
 epoch: 3, train_loss: 1.0188, test_loss: 1.0583, test_f1: 0.4382
 epoch: 4, train_loss: 0.9880, test_loss: 1.0346, test_f1: 0.4403
 epoch: 5, train_loss: 0.9887, test_loss: 1.0076, test_f1: 0.4745
 epoch: 6, train_loss: 0.9831, test_loss: 1.0166, test_f1: 0.4479
 epoch: 7, train_loss: 0.9751, test_loss: 0.9812, test_f1: 0.4645
 epoch: 8, train_loss: 0.9520, test_loss: 1.0062, test_f1: 0.4924
 epoch: 9, train_loss: 0.9429, test_loss: 0.9986, test_f1: 0.4956
 epoch: 10, train_loss: 0.9452, test_loss: 0.9814, test_f1: 0.4747
 epoch: 11, train_loss: 0.9443, test_loss: 0.9935, test_f1: 0.4835
 epoch: 12, train_loss: 0.9362, test_loss: 1.0638, test_f1: 0.4630
 epoch: 13, train_loss: 0.9336, test_loss: 1.0193, test_f1: 0.4856
 epoch: 14, train_loss: 0.9302, test_loss: 1.0584, test_f1: 0.4648
 epoch: 15, train_loss: 0.9291, test_loss: 1.0067, test_f1: 0.4754
 epoch: 16, train_loss: 0.9301, test_loss: 1.0297, test_f1: 0.5076
 epoch: 17, train_loss: 0.9293, test_loss: 1.0081, test_f1: 0.4883
 epoch: 18, train_loss: 0.9308, test_loss: 0.9895, test_f1: 0.5288
 epoch: 19, train_loss: 0.9096, test_loss: 1.0442, test_f1: 0.4953
 epoch: 20, train_loss: 0.9087, test_loss: 1.0128, test_f1: 0.5295
 epoch: 21, train_loss: 0.8990, test_loss: 1.0226, test_f1: 0.4881
 epoch: 22, train_loss: 0.9216, test_loss: 1.0249, test_f1: 0.4994
 epoch: 23, train_loss: 0.9321, test_loss: 1.0991, test_f1: 0.4971
 epoch: 24, train_loss: 0.9357, test_loss: 1.0199, test_f1: 0.5178
 epoch: 25, train_loss: 0.9196, test_loss: 1.0087, test_f1: 0.4725
 epoch: 26, train_loss: 0.9126, test_loss: 1.0205, test_f1: 0.4775
 epoch: 27, train_loss: 0.9035, test_loss: 0.9962, test_f1: 0.5313
 epoch: 28, train_loss: 0.9034, test_loss: 0.9778, test_f1: 0.5147
 epoch: 29, train_loss: 0.8971, test_loss: 0.9409, test_f1: 0.5350
 epoch: 30, train_loss: 0.9007, test_loss: 0.9181, test_f1: 0.5288
 epoch: 31, train_loss: 0.8958, test_loss: 0.9869, test_f1: 0.5052
 epoch: 32, train_loss: 0.9115, test_loss: 0.9503, test_f1: 0.4890
 epoch: 33, train_loss: 0.9082, test_loss: 1.0327, test_f1: 0.5217
 epoch: 34, train_loss: 0.9101, test_loss: 0.9318, test_f1: 0.4867
 epoch: 35, train_loss: 0.8842, test_loss: 0.9801, test_f1: 0.5001
 epoch: 36, train_loss: 0.9029, test_loss: 1.0232, test_f1: 0.5562
 epoch: 37, train_loss: 0.8852, test_loss: 0.9554, test_f1: 0.5119
 epoch: 38, train_loss: 0.8759, test_loss: 0.9574, test_f1: 0.5504
 epoch: 39, train_loss: 0.8952, test_loss: 0.9358, test_f1: 0.5016
 epoch: 40, train_loss: 0.8915, test_loss: 0.9591, test_f1: 0.5419
 epoch: 41, train_loss: 0.8707, test_loss: 0.9719, test_f1: 0.5611
 epoch: 42, train_loss: 0.8680, test_loss: 1.1092, test_f1: 0.4492
 epoch: 43, train_loss: 0.8736, test_loss: 1.0302, test_f1: 0.5010
 epoch: 44, train_loss: 0.8638, test_loss: 0.9987, test_f1: 0.5434
 epoch: 45, train_loss: 0.8658, test_loss: 0.9265, test_f1: 0.5332
 epoch: 46, train_loss: 0.8728, test_loss: 0.9700, test_f1: 0.5467
 epoch: 47, train_loss: 0.8716, test_loss: 0.8973, test_f1: 0.5886
 epoch: 48, train_loss: 0.8567, test_loss: 0.8846, test_f1: 0.5279
 epoch: 49, train_loss: 0.8521, test_loss: 0.9581, test_f1: 0.5369
 epoch: 50, train_loss: 0.8494, test_loss: 0.9556, test_f1: 0.5718
 epoch: 51, train_loss: 0.8312, test_loss: 0.9490, test_f1: 0.5197
 epoch: 52, train_loss: 0.8551, test_loss: 0.9714, test_f1: 0.4795
 epoch: 53, train_loss: 0.8468, test_loss: 0.9236, test_f1: 0.5576
 epoch: 54, train_loss: 0.8340, test_loss: 0.9081, test_f1: 0.5872
 epoch: 55, train_loss: 0.8259, test_loss: 0.9402, test_f1: 0.5571
 epoch: 56, train_loss: 0.8243, test_loss: 0.9047, test_f1: 0.5538
 epoch: 57, train_loss: 0.8289, test_loss: 0.9035, test_f1: 0.5427
 epoch: 58, train_loss: 0.8203, test_loss: 0.8958, test_f1: 0.5424
 epoch: 59, train_loss: 0.8220, test_loss: 0.9266, test_f1: 0.5751
 epoch: 60, train_loss: 0.8174, test_loss: 0.9160, test_f1: 0.5957
 epoch: 61, train_loss: 0.8127, test_loss: 0.9023, test_f1: 0.5959
 epoch: 62, train_loss: 0.8149, test_loss: 0.9409, test_f1: 0.5714
 epoch: 63, train_loss: 0.8127, test_loss: 0.9169, test_f1: 0.5890
 epoch: 64, train_loss: 0.8117, test_loss: 0.9227, test_f1: 0.5997
 epoch: 65, train_loss: 0.7958, test_loss: 0.9194, test_f1: 0.5872
 epoch: 66, train_loss: 0.7956, test_loss: 0.9767, test_f1: 0.5428
 epoch: 67, train_loss: 0.7914, test_loss: 0.9246, test_f1: 0.6171
 epoch: 68, train_loss: 0.8113, test_loss: 0.8906, test_f1: 0.5805
 epoch: 69, train_loss: 0.8013, test_loss: 0.9051, test_f1: 0.5946
 epoch: 70, train_loss: 0.7974, test_loss: 0.9071, test_f1: 0.6041
 epoch: 71, train_loss: 0.8028, test_loss: 0.8959, test_f1: 0.5974
 epoch: 72, train_loss: 0.7902, test_loss: 0.9267, test_f1: 0.5994
 epoch: 73, train_loss: 0.7861, test_loss: 0.9390, test_f1: 0.5791
 epoch: 74, train_loss: 0.8178, test_loss: 0.9117, test_f1: 0.6065
 epoch: 75, train_loss: 0.7974, test_loss: 0.8788, test_f1: 0.5891
 epoch: 76, train_loss: 0.7867, test_loss: 0.9499, test_f1: 0.5881
 epoch: 77, train_loss: 0.7912, test_loss: 0.8899, test_f1: 0.5859
 epoch: 78, train_loss: 0.7871, test_loss: 0.9204, test_f1: 0.5894
 epoch: 79, train_loss: 0.7941, test_loss: 0.8977, test_f1: 0.5969
 epoch: 80, train_loss: 0.7846, test_loss: 0.8943, test_f1: 0.6056
 epoch: 81, train_loss: 0.7885, test_loss: 0.9063, test_f1: 0.5968
 epoch: 82, train_loss: 0.7914, test_loss: 0.9584, test_f1: 0.5846
 epoch: 83, train_loss: 0.7787, test_loss: 0.9342, test_f1: 0.5930
 epoch: 84, train_loss: 0.7978, test_loss: 0.9148, test_f1: 0.5872
 epoch: 85, train_loss: 0.7792, test_loss: 0.9180, test_f1: 0.5943
 epoch: 86, train_loss: 0.7728, test_loss: 0.9503, test_f1: 0.5957
 epoch: 87, train_loss: 0.7862, test_loss: 0.9201, test_f1: 0.5873
 epoch: 88, train_loss: 0.7729, test_loss: 0.9091, test_f1: 0.6053
 epoch: 89, train_loss: 0.7717, test_loss: 0.9629, test_f1: 0.5664
 epoch: 90, train_loss: 0.7754, test_loss: 0.8995, test_f1: 0.6135
 epoch: 91, train_loss: 0.7679, test_loss: 0.8762, test_f1: 0.6140
 epoch: 92, train_loss: 0.7712, test_loss: 0.8927, test_f1: 0.5901
 epoch: 93, train_loss: 0.7883, test_loss: 0.8829, test_f1: 0.6112
 epoch: 94, train_loss: 0.7662, test_loss: 0.9279, test_f1: 0.5848
 epoch: 95, train_loss: 0.7676, test_loss: 0.9242, test_f1: 0.5954
 epoch: 96, train_loss: 0.7762, test_loss: 0.9021, test_f1: 0.5973
 epoch: 97, train_loss: 0.7715, test_loss: 0.9218, test_f1: 0.5979
 epoch: 98, train_loss: 0.7787, test_loss: 0.8840, test_f1: 0.6361
 epoch: 99, train_loss: 0.7655, test_loss: 0.9373, test_f1: 0.5997
##################ITERATION #5 ****************************************
 epoch: 0, train_loss: 1.2205, test_loss: 1.0759, test_f1: 0.3695
 epoch: 1, train_loss: 1.0613, test_loss: 1.0162, test_f1: 0.4398
 epoch: 2, train_loss: 1.0483, test_loss: 1.0405, test_f1: 0.4449
 epoch: 3, train_loss: 1.0126, test_loss: 1.1001, test_f1: 0.4308
 epoch: 4, train_loss: 1.0195, test_loss: 0.9823, test_f1: 0.4874
 epoch: 5, train_loss: 0.9999, test_loss: 0.9578, test_f1: 0.5181
 epoch: 6, train_loss: 0.9910, test_loss: 1.0203, test_f1: 0.4997
 epoch: 7, train_loss: 0.9844, test_loss: 1.0191, test_f1: 0.4579
 epoch: 8, train_loss: 0.9745, test_loss: 1.0358, test_f1: 0.5179
 epoch: 9, train_loss: 0.9614, test_loss: 1.0551, test_f1: 0.4797
 epoch: 10, train_loss: 0.9736, test_loss: 0.9788, test_f1: 0.5190
 epoch: 11, train_loss: 0.9705, test_loss: 1.1882, test_f1: 0.4290
 epoch: 12, train_loss: 0.9618, test_loss: 0.9770, test_f1: 0.4780
 epoch: 13, train_loss: 0.9534, test_loss: 0.9723, test_f1: 0.4936
 epoch: 14, train_loss: 0.9480, test_loss: 1.0636, test_f1: 0.5007
 epoch: 15, train_loss: 0.9486, test_loss: 0.9874, test_f1: 0.5318
 epoch: 16, train_loss: 0.9419, test_loss: 0.9637, test_f1: 0.5170
 epoch: 17, train_loss: 0.9508, test_loss: 1.0203, test_f1: 0.4668
 epoch: 18, train_loss: 0.9530, test_loss: 0.9454, test_f1: 0.4956
 epoch: 19, train_loss: 0.9298, test_loss: 0.9649, test_f1: 0.4996
 epoch: 20, train_loss: 0.9364, test_loss: 0.9918, test_f1: 0.4878
 epoch: 21, train_loss: 0.9172, test_loss: 0.9785, test_f1: 0.4815
 epoch: 22, train_loss: 0.9268, test_loss: 0.9981, test_f1: 0.4942
 epoch: 23, train_loss: 0.9245, test_loss: 1.0383, test_f1: 0.4772
 epoch: 24, train_loss: 0.9133, test_loss: 0.9495, test_f1: 0.5546
 epoch: 25, train_loss: 0.9221, test_loss: 1.0800, test_f1: 0.4087
 epoch: 26, train_loss: 0.9163, test_loss: 0.9243, test_f1: 0.5360
 epoch: 27, train_loss: 0.9195, test_loss: 0.9651, test_f1: 0.4990
 epoch: 28, train_loss: 0.9175, test_loss: 0.9344, test_f1: 0.5162
 epoch: 29, train_loss: 0.9137, test_loss: 0.9508, test_f1: 0.5153
 epoch: 30, train_loss: 0.8982, test_loss: 0.9742, test_f1: 0.5060
 epoch: 31, train_loss: 0.8916, test_loss: 0.9577, test_f1: 0.5328
 epoch: 32, train_loss: 0.8978, test_loss: 0.9549, test_f1: 0.5381
 epoch: 33, train_loss: 0.8880, test_loss: 0.9815, test_f1: 0.5157
 epoch: 34, train_loss: 0.8968, test_loss: 0.9641, test_f1: 0.5209
 epoch: 35, train_loss: 0.8866, test_loss: 1.0310, test_f1: 0.4696
 epoch: 36, train_loss: 0.8842, test_loss: 0.9403, test_f1: 0.5002
 epoch: 37, train_loss: 0.8874, test_loss: 0.9392, test_f1: 0.5449
 epoch: 38, train_loss: 0.8687, test_loss: 0.9567, test_f1: 0.5259
 epoch: 39, train_loss: 0.8643, test_loss: 1.1597, test_f1: 0.4621
 epoch: 40, train_loss: 0.8771, test_loss: 0.9814, test_f1: 0.5458
 epoch: 41, train_loss: 0.8805, test_loss: 0.9308, test_f1: 0.5334
 epoch: 42, train_loss: 0.8666, test_loss: 1.0294, test_f1: 0.5328
 epoch: 43, train_loss: 0.8715, test_loss: 0.9706, test_f1: 0.5312
 epoch: 44, train_loss: 0.8668, test_loss: 0.9475, test_f1: 0.5610
 epoch: 45, train_loss: 0.8774, test_loss: 0.9182, test_f1: 0.5829
 epoch: 46, train_loss: 0.8855, test_loss: 0.9160, test_f1: 0.5768
 epoch: 47, train_loss: 0.8644, test_loss: 0.9603, test_f1: 0.5778
 epoch: 48, train_loss: 0.8603, test_loss: 0.8969, test_f1: 0.6090
 epoch: 49, train_loss: 0.8604, test_loss: 0.9976, test_f1: 0.4797
 epoch: 50, train_loss: 0.8570, test_loss: 0.9279, test_f1: 0.5213
 epoch: 51, train_loss: 0.8255, test_loss: 0.8877, test_f1: 0.6099
 epoch: 52, train_loss: 0.8228, test_loss: 0.9027, test_f1: 0.5473
 epoch: 53, train_loss: 0.8168, test_loss: 0.9125, test_f1: 0.5820
 epoch: 54, train_loss: 0.8192, test_loss: 0.8915, test_f1: 0.6321
 epoch: 55, train_loss: 0.8291, test_loss: 0.8824, test_f1: 0.5843
 epoch: 56, train_loss: 0.8166, test_loss: 0.8976, test_f1: 0.5871
 epoch: 57, train_loss: 0.8216, test_loss: 0.8688, test_f1: 0.5891
 epoch: 58, train_loss: 0.8162, test_loss: 0.8921, test_f1: 0.5883
 epoch: 59, train_loss: 0.8052, test_loss: 0.9143, test_f1: 0.5768
 epoch: 60, train_loss: 0.8159, test_loss: 0.8917, test_f1: 0.6165
 epoch: 61, train_loss: 0.8039, test_loss: 0.8733, test_f1: 0.6152
 epoch: 62, train_loss: 0.7984, test_loss: 0.8803, test_f1: 0.6186
 epoch: 63, train_loss: 0.7996, test_loss: 0.9204, test_f1: 0.6114
 epoch: 64, train_loss: 0.7981, test_loss: 0.9093, test_f1: 0.5628
 epoch: 65, train_loss: 0.7917, test_loss: 0.8914, test_f1: 0.5870
 epoch: 66, train_loss: 0.7894, test_loss: 0.8715, test_f1: 0.6497
 epoch: 67, train_loss: 0.7963, test_loss: 0.8935, test_f1: 0.6288
 epoch: 68, train_loss: 0.7853, test_loss: 0.8699, test_f1: 0.6117
 epoch: 69, train_loss: 0.7774, test_loss: 0.8745, test_f1: 0.6277
 epoch: 70, train_loss: 0.7817, test_loss: 0.8604, test_f1: 0.6315
 epoch: 71, train_loss: 0.7835, test_loss: 0.8915, test_f1: 0.5876
 epoch: 72, train_loss: 0.7659, test_loss: 0.8730, test_f1: 0.6052
 epoch: 73, train_loss: 0.7894, test_loss: 0.9008, test_f1: 0.6124
 epoch: 74, train_loss: 0.7612, test_loss: 0.9312, test_f1: 0.6066
 epoch: 75, train_loss: 0.7819, test_loss: 0.8955, test_f1: 0.6319
 epoch: 76, train_loss: 0.7862, test_loss: 0.9393, test_f1: 0.5915
 epoch: 77, train_loss: 0.7766, test_loss: 0.9132, test_f1: 0.6061
 epoch: 78, train_loss: 0.7722, test_loss: 0.9000, test_f1: 0.6271
 epoch: 79, train_loss: 0.7661, test_loss: 0.9232, test_f1: 0.6211
 epoch: 80, train_loss: 0.7944, test_loss: 0.9078, test_f1: 0.6187
 epoch: 81, train_loss: 0.7646, test_loss: 0.8639, test_f1: 0.6338
 epoch: 82, train_loss: 0.7706, test_loss: 0.8970, test_f1: 0.6030
 epoch: 83, train_loss: 0.7686, test_loss: 0.8776, test_f1: 0.6299
 epoch: 84, train_loss: 0.7583, test_loss: 0.9113, test_f1: 0.6197
 epoch: 85, train_loss: 0.7745, test_loss: 0.9417, test_f1: 0.5637
 epoch: 86, train_loss: 0.7675, test_loss: 0.9110, test_f1: 0.6282
 epoch: 87, train_loss: 0.7633, test_loss: 0.9300, test_f1: 0.6120
 epoch: 88, train_loss: 0.7628, test_loss: 0.9308, test_f1: 0.6064
 epoch: 89, train_loss: 0.7628, test_loss: 0.9111, test_f1: 0.6000
 epoch: 90, train_loss: 0.7629, test_loss: 0.8917, test_f1: 0.6151
 epoch: 91, train_loss: 0.7622, test_loss: 0.9077, test_f1: 0.6091
 epoch: 92, train_loss: 0.7632, test_loss: 0.8876, test_f1: 0.6169
 epoch: 93, train_loss: 0.7633, test_loss: 0.8907, test_f1: 0.6203
 epoch: 94, train_loss: 0.7568, test_loss: 0.8744, test_f1: 0.5983
 epoch: 95, train_loss: 0.7619, test_loss: 0.8851, test_f1: 0.6289
 epoch: 96, train_loss: 0.7576, test_loss: 0.8847, test_f1: 0.6467
 epoch: 97, train_loss: 0.7388, test_loss: 0.8827, test_f1: 0.6329
 epoch: 98, train_loss: 0.7523, test_loss: 0.8865, test_f1: 0.6356
 epoch: 99, train_loss: 0.7677, test_loss: 0.9376, test_f1: 0.5966
##################ITERATION #6 ****************************************
 epoch: 0, train_loss: 1.1903, test_loss: 1.0515, test_f1: 0.3918
 epoch: 1, train_loss: 1.0428, test_loss: 1.0888, test_f1: 0.4129
 epoch: 2, train_loss: 1.0013, test_loss: 1.0406, test_f1: 0.4439
 epoch: 3, train_loss: 0.9860, test_loss: 1.0091, test_f1: 0.4688
 epoch: 4, train_loss: 0.9795, test_loss: 0.9637, test_f1: 0.4500
 epoch: 5, train_loss: 0.9612, test_loss: 1.0087, test_f1: 0.4706
 epoch: 6, train_loss: 0.9663, test_loss: 0.9789, test_f1: 0.5488
 epoch: 7, train_loss: 0.9445, test_loss: 1.0676, test_f1: 0.4549
 epoch: 8, train_loss: 0.9478, test_loss: 1.0150, test_f1: 0.4814
 epoch: 9, train_loss: 0.9365, test_loss: 0.9413, test_f1: 0.4938
 epoch: 10, train_loss: 0.9402, test_loss: 0.9823, test_f1: 0.5378
 epoch: 11, train_loss: 0.9338, test_loss: 0.9834, test_f1: 0.5158
 epoch: 12, train_loss: 0.9318, test_loss: 0.9908, test_f1: 0.4903
 epoch: 13, train_loss: 0.9222, test_loss: 1.2073, test_f1: 0.4352
 epoch: 14, train_loss: 0.9253, test_loss: 0.9795, test_f1: 0.5163
 epoch: 15, train_loss: 0.9151, test_loss: 0.9688, test_f1: 0.5039
 epoch: 16, train_loss: 0.9057, test_loss: 0.9710, test_f1: 0.4907
 epoch: 17, train_loss: 0.9133, test_loss: 1.0029, test_f1: 0.4898
 epoch: 18, train_loss: 0.9172, test_loss: 0.9385, test_f1: 0.5001
 epoch: 19, train_loss: 0.9009, test_loss: 1.0240, test_f1: 0.4938
 epoch: 20, train_loss: 0.9037, test_loss: 1.0971, test_f1: 0.4379
 epoch: 21, train_loss: 0.9087, test_loss: 0.9893, test_f1: 0.5092
 epoch: 22, train_loss: 0.9159, test_loss: 1.0001, test_f1: 0.5073
 epoch: 23, train_loss: 0.9131, test_loss: 0.9555, test_f1: 0.4986
 epoch: 24, train_loss: 0.9016, test_loss: 0.9644, test_f1: 0.5108
 epoch: 25, train_loss: 0.8958, test_loss: 0.9882, test_f1: 0.4959
 epoch: 26, train_loss: 0.8828, test_loss: 0.9617, test_f1: 0.5417
 epoch: 27, train_loss: 0.9018, test_loss: 0.9454, test_f1: 0.5093
 epoch: 28, train_loss: 0.8888, test_loss: 0.9569, test_f1: 0.5128
 epoch: 29, train_loss: 0.8799, test_loss: 1.0388, test_f1: 0.4931
 epoch: 30, train_loss: 0.8646, test_loss: 0.9784, test_f1: 0.5097
 epoch: 31, train_loss: 0.8699, test_loss: 0.9966, test_f1: 0.4965
 epoch: 32, train_loss: 0.8697, test_loss: 0.9835, test_f1: 0.5090
 epoch: 33, train_loss: 0.8658, test_loss: 0.9562, test_f1: 0.5064
 epoch: 34, train_loss: 0.8563, test_loss: 1.0180, test_f1: 0.4942
 epoch: 35, train_loss: 0.8757, test_loss: 1.0009, test_f1: 0.5573
 epoch: 36, train_loss: 0.8528, test_loss: 0.9665, test_f1: 0.5744
 epoch: 37, train_loss: 0.8740, test_loss: 1.0678, test_f1: 0.4996
 epoch: 38, train_loss: 0.8458, test_loss: 0.9701, test_f1: 0.5600
 epoch: 39, train_loss: 0.8566, test_loss: 0.9600, test_f1: 0.5699
 epoch: 40, train_loss: 0.8621, test_loss: 0.9784, test_f1: 0.5364
 epoch: 41, train_loss: 0.8291, test_loss: 0.9954, test_f1: 0.5825
 epoch: 42, train_loss: 0.8435, test_loss: 1.0092, test_f1: 0.5589
 epoch: 43, train_loss: 0.8453, test_loss: 0.9590, test_f1: 0.5698
 epoch: 44, train_loss: 0.8397, test_loss: 0.9738, test_f1: 0.5532
 epoch: 45, train_loss: 0.8290, test_loss: 0.9539, test_f1: 0.5637
 epoch: 46, train_loss: 0.8385, test_loss: 0.9775, test_f1: 0.5366
 epoch: 47, train_loss: 0.8231, test_loss: 0.9623, test_f1: 0.5461
 epoch: 48, train_loss: 0.8450, test_loss: 0.9443, test_f1: 0.5470
 epoch: 49, train_loss: 0.8181, test_loss: 0.9096, test_f1: 0.6226
 epoch: 50, train_loss: 0.8125, test_loss: 0.9027, test_f1: 0.6175
 epoch: 51, train_loss: 0.8000, test_loss: 0.9447, test_f1: 0.5432
 epoch: 52, train_loss: 0.7972, test_loss: 0.9312, test_f1: 0.5805
 epoch: 53, train_loss: 0.7932, test_loss: 0.9337, test_f1: 0.5852
 epoch: 54, train_loss: 0.7876, test_loss: 0.9120, test_f1: 0.5944
 epoch: 55, train_loss: 0.7897, test_loss: 0.9355, test_f1: 0.5763
 epoch: 56, train_loss: 0.7823, test_loss: 0.9255, test_f1: 0.5970
 epoch: 57, train_loss: 0.7692, test_loss: 0.9257, test_f1: 0.5859
 epoch: 58, train_loss: 0.7881, test_loss: 0.9374, test_f1: 0.6005
 epoch: 59, train_loss: 0.7844, test_loss: 0.9125, test_f1: 0.6103
 epoch: 60, train_loss: 0.7862, test_loss: 0.9680, test_f1: 0.6151
 epoch: 61, train_loss: 0.7933, test_loss: 0.9615, test_f1: 0.5907
 epoch: 62, train_loss: 0.7727, test_loss: 0.9342, test_f1: 0.6305
 epoch: 63, train_loss: 0.7695, test_loss: 0.9339, test_f1: 0.5891
 epoch: 64, train_loss: 0.7769, test_loss: 0.9324, test_f1: 0.5981
 epoch: 65, train_loss: 0.7740, test_loss: 0.9364, test_f1: 0.5952
 epoch: 66, train_loss: 0.7793, test_loss: 0.9374, test_f1: 0.5866
 epoch: 67, train_loss: 0.7538, test_loss: 0.9444, test_f1: 0.5954
 epoch: 68, train_loss: 0.7641, test_loss: 0.9446, test_f1: 0.6044
 epoch: 69, train_loss: 0.7704, test_loss: 0.9348, test_f1: 0.5904
 epoch: 70, train_loss: 0.7643, test_loss: 0.9300, test_f1: 0.6016
 epoch: 71, train_loss: 0.7666, test_loss: 0.9271, test_f1: 0.6089
 epoch: 72, train_loss: 0.7524, test_loss: 0.9529, test_f1: 0.6021
 epoch: 73, train_loss: 0.7568, test_loss: 0.9602, test_f1: 0.5903
 epoch: 74, train_loss: 0.7621, test_loss: 0.9469, test_f1: 0.5846
 epoch: 75, train_loss: 0.7649, test_loss: 0.9245, test_f1: 0.5959
 epoch: 76, train_loss: 0.7497, test_loss: 0.9100, test_f1: 0.6155
 epoch: 77, train_loss: 0.7661, test_loss: 0.9338, test_f1: 0.6047
 epoch: 78, train_loss: 0.7678, test_loss: 0.9087, test_f1: 0.6092
 epoch: 79, train_loss: 0.7604, test_loss: 0.9316, test_f1: 0.6013
 epoch: 80, train_loss: 0.7571, test_loss: 0.9112, test_f1: 0.6048
 epoch: 81, train_loss: 0.7675, test_loss: 0.8886, test_f1: 0.6070
 epoch: 82, train_loss: 0.7568, test_loss: 0.9219, test_f1: 0.5896
 epoch: 83, train_loss: 0.7585, test_loss: 0.8938, test_f1: 0.6041
 epoch: 84, train_loss: 0.7558, test_loss: 0.9264, test_f1: 0.6194
 epoch: 85, train_loss: 0.7563, test_loss: 0.9038, test_f1: 0.5962
 epoch: 86, train_loss: 0.7497, test_loss: 0.9082, test_f1: 0.6113
 epoch: 87, train_loss: 0.7516, test_loss: 0.9104, test_f1: 0.6236
 epoch: 88, train_loss: 0.7486, test_loss: 0.9224, test_f1: 0.6150
 epoch: 89, train_loss: 0.7443, test_loss: 0.9360, test_f1: 0.6073
 epoch: 90, train_loss: 0.7386, test_loss: 0.9332, test_f1: 0.6060
 epoch: 91, train_loss: 0.7565, test_loss: 0.9262, test_f1: 0.6021
 epoch: 92, train_loss: 0.7350, test_loss: 0.9201, test_f1: 0.6017
 epoch: 93, train_loss: 0.7487, test_loss: 0.8893, test_f1: 0.6310
 epoch: 94, train_loss: 0.7500, test_loss: 0.8787, test_f1: 0.6103
 epoch: 95, train_loss: 0.7425, test_loss: 0.8988, test_f1: 0.6050
 epoch: 96, train_loss: 0.7439, test_loss: 0.9043, test_f1: 0.6005
 epoch: 97, train_loss: 0.7282, test_loss: 0.8897, test_f1: 0.6210
 epoch: 98, train_loss: 0.7426, test_loss: 0.9096, test_f1: 0.6043
 epoch: 99, train_loss: 0.7291, test_loss: 0.8827, test_f1: 0.6173
##################ITERATION #7 ****************************************
 epoch: 0, train_loss: 1.1901, test_loss: 1.0883, test_f1: 0.4263
 epoch: 1, train_loss: 1.0377, test_loss: 1.0910, test_f1: 0.4803
 epoch: 2, train_loss: 1.0182, test_loss: 1.0925, test_f1: 0.4901
 epoch: 3, train_loss: 0.9871, test_loss: 1.0153, test_f1: 0.4950
 epoch: 4, train_loss: 0.9841, test_loss: 0.9768, test_f1: 0.4904
 epoch: 5, train_loss: 0.9631, test_loss: 0.9830, test_f1: 0.5144
 epoch: 6, train_loss: 0.9620, test_loss: 1.0388, test_f1: 0.4899
 epoch: 7, train_loss: 0.9564, test_loss: 0.9874, test_f1: 0.4905
 epoch: 8, train_loss: 0.9370, test_loss: 1.1371, test_f1: 0.4666
 epoch: 9, train_loss: 0.9295, test_loss: 0.9896, test_f1: 0.4803
 epoch: 10, train_loss: 0.9226, test_loss: 1.0068, test_f1: 0.4589
 epoch: 11, train_loss: 0.9111, test_loss: 1.0061, test_f1: 0.4997
 epoch: 12, train_loss: 0.9171, test_loss: 1.0214, test_f1: 0.4883
 epoch: 13, train_loss: 0.9208, test_loss: 1.0088, test_f1: 0.5044
 epoch: 14, train_loss: 0.9209, test_loss: 1.0037, test_f1: 0.5127
 epoch: 15, train_loss: 0.9224, test_loss: 1.0187, test_f1: 0.5123
 epoch: 16, train_loss: 0.9104, test_loss: 0.9786, test_f1: 0.4974
 epoch: 17, train_loss: 0.8961, test_loss: 0.9822, test_f1: 0.4959
 epoch: 18, train_loss: 0.8987, test_loss: 0.9713, test_f1: 0.4852
 epoch: 19, train_loss: 0.8796, test_loss: 0.9843, test_f1: 0.5027
 epoch: 20, train_loss: 0.9079, test_loss: 0.9617, test_f1: 0.5024
 epoch: 21, train_loss: 0.9052, test_loss: 0.9737, test_f1: 0.5178
 epoch: 22, train_loss: 0.8965, test_loss: 1.0086, test_f1: 0.5174
 epoch: 23, train_loss: 0.8989, test_loss: 1.0194, test_f1: 0.5035
 epoch: 24, train_loss: 0.9036, test_loss: 0.9839, test_f1: 0.5046
 epoch: 25, train_loss: 0.8886, test_loss: 0.9408, test_f1: 0.5056
 epoch: 26, train_loss: 0.8906, test_loss: 0.8911, test_f1: 0.5194
 epoch: 27, train_loss: 0.8974, test_loss: 0.9844, test_f1: 0.5080
 epoch: 28, train_loss: 0.8857, test_loss: 1.0328, test_f1: 0.4683
 epoch: 29, train_loss: 0.8866, test_loss: 1.0317, test_f1: 0.5116
 epoch: 30, train_loss: 0.8742, test_loss: 1.0077, test_f1: 0.5226
 epoch: 31, train_loss: 0.8794, test_loss: 1.1798, test_f1: 0.4654
 epoch: 32, train_loss: 0.9185, test_loss: 0.9699, test_f1: 0.5163
 epoch: 33, train_loss: 0.8760, test_loss: 0.9835, test_f1: 0.5087
 epoch: 34, train_loss: 0.8845, test_loss: 1.0086, test_f1: 0.5105
 epoch: 35, train_loss: 0.8809, test_loss: 0.9735, test_f1: 0.5145
 epoch: 36, train_loss: 0.8715, test_loss: 0.9857, test_f1: 0.5044
 epoch: 37, train_loss: 0.8623, test_loss: 0.9665, test_f1: 0.5507
 epoch: 38, train_loss: 0.8553, test_loss: 0.9763, test_f1: 0.5362
 epoch: 39, train_loss: 0.8613, test_loss: 0.9846, test_f1: 0.4959
 epoch: 40, train_loss: 0.8489, test_loss: 1.0281, test_f1: 0.5145
 epoch: 41, train_loss: 0.8464, test_loss: 1.0021, test_f1: 0.5150
 epoch: 42, train_loss: 0.8548, test_loss: 0.9791, test_f1: 0.5255
 epoch: 43, train_loss: 0.8527, test_loss: 0.9700, test_f1: 0.5187
 epoch: 44, train_loss: 0.8645, test_loss: 0.9778, test_f1: 0.5189
 epoch: 45, train_loss: 0.8480, test_loss: 0.9772, test_f1: 0.4980
 epoch: 46, train_loss: 0.8536, test_loss: 0.9550, test_f1: 0.4840
 epoch: 47, train_loss: 0.8362, test_loss: 0.9968, test_f1: 0.5109
 epoch: 48, train_loss: 0.8442, test_loss: 1.0096, test_f1: 0.5415
 epoch: 49, train_loss: 0.8329, test_loss: 1.0080, test_f1: 0.5105
 epoch: 50, train_loss: 0.8583, test_loss: 0.9755, test_f1: 0.5453
 epoch: 51, train_loss: 0.8194, test_loss: 0.9499, test_f1: 0.5341
 epoch: 52, train_loss: 0.8094, test_loss: 0.9372, test_f1: 0.5226
 epoch: 53, train_loss: 0.8144, test_loss: 0.9448, test_f1: 0.5410
 epoch: 54, train_loss: 0.8032, test_loss: 0.9493, test_f1: 0.5275
 epoch: 55, train_loss: 0.8171, test_loss: 0.9451, test_f1: 0.5385
 epoch: 56, train_loss: 0.8058, test_loss: 0.9587, test_f1: 0.5503
 epoch: 57, train_loss: 0.7892, test_loss: 0.9607, test_f1: 0.5353
 epoch: 58, train_loss: 0.7942, test_loss: 0.9606, test_f1: 0.5444
 epoch: 59, train_loss: 0.7943, test_loss: 0.9429, test_f1: 0.5410
 epoch: 60, train_loss: 0.7852, test_loss: 0.9292, test_f1: 0.5532
 epoch: 61, train_loss: 0.7966, test_loss: 0.9464, test_f1: 0.5564
 epoch: 62, train_loss: 0.7924, test_loss: 0.9466, test_f1: 0.5433
 epoch: 63, train_loss: 0.7819, test_loss: 0.9719, test_f1: 0.5654
 epoch: 64, train_loss: 0.7918, test_loss: 0.9698, test_f1: 0.5684
 epoch: 65, train_loss: 0.7989, test_loss: 0.9572, test_f1: 0.5908
 epoch: 66, train_loss: 0.7877, test_loss: 0.9616, test_f1: 0.5887
 epoch: 67, train_loss: 0.7774, test_loss: 0.9284, test_f1: 0.5662
 epoch: 68, train_loss: 0.7639, test_loss: 0.9862, test_f1: 0.5689
 epoch: 69, train_loss: 0.7704, test_loss: 0.9305, test_f1: 0.5826
 epoch: 70, train_loss: 0.7814, test_loss: 0.9500, test_f1: 0.5781
 epoch: 71, train_loss: 0.7738, test_loss: 0.9306, test_f1: 0.5916
 epoch: 72, train_loss: 0.7824, test_loss: 0.9357, test_f1: 0.5692
 epoch: 73, train_loss: 0.7793, test_loss: 0.9744, test_f1: 0.5637
 epoch: 74, train_loss: 0.7721, test_loss: 0.9264, test_f1: 0.6135
 epoch: 75, train_loss: 0.7678, test_loss: 0.9611, test_f1: 0.5192
 epoch: 76, train_loss: 0.7827, test_loss: 0.9397, test_f1: 0.5740
 epoch: 77, train_loss: 0.7472, test_loss: 0.9201, test_f1: 0.5969
 epoch: 78, train_loss: 0.7558, test_loss: 0.9163, test_f1: 0.6046
 epoch: 79, train_loss: 0.7622, test_loss: 0.9429, test_f1: 0.5722
 epoch: 80, train_loss: 0.7547, test_loss: 0.9359, test_f1: 0.5796
 epoch: 81, train_loss: 0.7642, test_loss: 0.9285, test_f1: 0.5885
 epoch: 82, train_loss: 0.7739, test_loss: 0.9238, test_f1: 0.5802
 epoch: 83, train_loss: 0.7516, test_loss: 0.8979, test_f1: 0.6041
 epoch: 84, train_loss: 0.7513, test_loss: 0.9172, test_f1: 0.6049
 epoch: 85, train_loss: 0.7346, test_loss: 0.9121, test_f1: 0.6129
 epoch: 86, train_loss: 0.7638, test_loss: 0.9486, test_f1: 0.6179
 epoch: 87, train_loss: 0.7595, test_loss: 0.9235, test_f1: 0.6020
 epoch: 88, train_loss: 0.7451, test_loss: 0.9149, test_f1: 0.6243
 epoch: 89, train_loss: 0.7562, test_loss: 0.8753, test_f1: 0.5973
 epoch: 90, train_loss: 0.7417, test_loss: 0.9258, test_f1: 0.5714
 epoch: 91, train_loss: 0.7364, test_loss: 0.9352, test_f1: 0.6158
 epoch: 92, train_loss: 0.7530, test_loss: 0.9041, test_f1: 0.6118
 epoch: 93, train_loss: 0.7557, test_loss: 0.8903, test_f1: 0.5800
 epoch: 94, train_loss: 0.7276, test_loss: 0.9295, test_f1: 0.6340
 epoch: 95, train_loss: 0.7393, test_loss: 0.8938, test_f1: 0.5810
 epoch: 96, train_loss: 0.7336, test_loss: 0.9848, test_f1: 0.5516
 epoch: 97, train_loss: 0.7331, test_loss: 0.9854, test_f1: 0.5934
 epoch: 98, train_loss: 0.7399, test_loss: 0.9959, test_f1: 0.5811
 epoch: 99, train_loss: 0.7257, test_loss: 0.9346, test_f1: 0.5991
##################ITERATION #8 ****************************************
 epoch: 0, train_loss: 1.2196, test_loss: 1.0611, test_f1: 0.4356
 epoch: 1, train_loss: 1.0563, test_loss: 1.0542, test_f1: 0.4433
 epoch: 2, train_loss: 1.0250, test_loss: 1.0236, test_f1: 0.4529
 epoch: 3, train_loss: 0.9923, test_loss: 0.9412, test_f1: 0.5193
 epoch: 4, train_loss: 0.9836, test_loss: 1.1030, test_f1: 0.4370
 epoch: 5, train_loss: 0.9870, test_loss: 1.0304, test_f1: 0.4990
 epoch: 6, train_loss: 0.9687, test_loss: 0.9747, test_f1: 0.4945
 epoch: 7, train_loss: 0.9742, test_loss: 1.0020, test_f1: 0.4691
 epoch: 8, train_loss: 0.9634, test_loss: 0.9778, test_f1: 0.4958
 epoch: 9, train_loss: 0.9617, test_loss: 0.9754, test_f1: 0.4686
 epoch: 10, train_loss: 0.9440, test_loss: 0.9091, test_f1: 0.5431
 epoch: 11, train_loss: 0.9282, test_loss: 0.9469, test_f1: 0.5433
 epoch: 12, train_loss: 0.9434, test_loss: 0.9217, test_f1: 0.4959
 epoch: 13, train_loss: 0.9301, test_loss: 0.9678, test_f1: 0.5320
 epoch: 14, train_loss: 0.9207, test_loss: 0.9297, test_f1: 0.5249
 epoch: 15, train_loss: 0.9284, test_loss: 0.9603, test_f1: 0.4993
 epoch: 16, train_loss: 0.9179, test_loss: 0.9661, test_f1: 0.5147
 epoch: 17, train_loss: 0.9299, test_loss: 1.1238, test_f1: 0.4684
 epoch: 18, train_loss: 0.9137, test_loss: 0.8857, test_f1: 0.5211
 epoch: 19, train_loss: 0.9196, test_loss: 0.9156, test_f1: 0.5369
 epoch: 20, train_loss: 0.9000, test_loss: 0.9581, test_f1: 0.5088
 epoch: 21, train_loss: 0.9034, test_loss: 0.9314, test_f1: 0.5130
 epoch: 22, train_loss: 0.9031, test_loss: 0.8731, test_f1: 0.5073
 epoch: 23, train_loss: 0.9063, test_loss: 0.9176, test_f1: 0.5410
 epoch: 24, train_loss: 0.8893, test_loss: 0.9261, test_f1: 0.5357
 epoch: 25, train_loss: 0.8899, test_loss: 0.8534, test_f1: 0.5638
 epoch: 26, train_loss: 0.8840, test_loss: 0.9111, test_f1: 0.5367
 epoch: 27, train_loss: 0.8890, test_loss: 0.9358, test_f1: 0.5204
 epoch: 28, train_loss: 0.8784, test_loss: 0.9396, test_f1: 0.5423
 epoch: 29, train_loss: 0.8720, test_loss: 0.9677, test_f1: 0.5122
 epoch: 30, train_loss: 0.8756, test_loss: 0.9706, test_f1: 0.5122
 epoch: 31, train_loss: 0.8745, test_loss: 0.9262, test_f1: 0.5292
 epoch: 32, train_loss: 0.8707, test_loss: 0.8865, test_f1: 0.5408
 epoch: 33, train_loss: 0.8884, test_loss: 0.9877, test_f1: 0.5251
 epoch: 34, train_loss: 0.8571, test_loss: 0.9499, test_f1: 0.5196
 epoch: 35, train_loss: 0.8538, test_loss: 0.9465, test_f1: 0.5386
 epoch: 36, train_loss: 0.8674, test_loss: 0.9453, test_f1: 0.5410
 epoch: 37, train_loss: 0.8370, test_loss: 0.9015, test_f1: 0.5478
 epoch: 38, train_loss: 0.8586, test_loss: 0.9318, test_f1: 0.5343
 epoch: 39, train_loss: 0.8462, test_loss: 0.8717, test_f1: 0.5622
 epoch: 40, train_loss: 0.8250, test_loss: 0.9356, test_f1: 0.5573
 epoch: 41, train_loss: 0.8587, test_loss: 0.8948, test_f1: 0.5264
 epoch: 42, train_loss: 0.8342, test_loss: 0.9659, test_f1: 0.4770
 epoch: 43, train_loss: 0.8434, test_loss: 0.9229, test_f1: 0.5141
 epoch: 44, train_loss: 0.8380, test_loss: 0.8736, test_f1: 0.5326
 epoch: 45, train_loss: 0.8272, test_loss: 0.8933, test_f1: 0.5642
 epoch: 46, train_loss: 0.8346, test_loss: 0.8959, test_f1: 0.5301
 epoch: 47, train_loss: 0.8262, test_loss: 0.9421, test_f1: 0.5320
 epoch: 48, train_loss: 0.8386, test_loss: 0.9275, test_f1: 0.5653
 epoch: 49, train_loss: 0.8173, test_loss: 0.8822, test_f1: 0.5337
 epoch: 50, train_loss: 0.8248, test_loss: 0.8786, test_f1: 0.6168
 epoch: 51, train_loss: 0.7969, test_loss: 0.8492, test_f1: 0.5769
 epoch: 52, train_loss: 0.7834, test_loss: 0.8436, test_f1: 0.5745
 epoch: 53, train_loss: 0.7866, test_loss: 0.8580, test_f1: 0.5812
 epoch: 54, train_loss: 0.7746, test_loss: 0.8453, test_f1: 0.5872
 epoch: 55, train_loss: 0.7878, test_loss: 0.8556, test_f1: 0.5933
 epoch: 56, train_loss: 0.7636, test_loss: 0.8363, test_f1: 0.5968
 epoch: 57, train_loss: 0.7564, test_loss: 0.8560, test_f1: 0.5955
 epoch: 58, train_loss: 0.7741, test_loss: 0.8582, test_f1: 0.5904
 epoch: 59, train_loss: 0.7700, test_loss: 0.8634, test_f1: 0.5759
 epoch: 60, train_loss: 0.7694, test_loss: 0.8828, test_f1: 0.6013
 epoch: 61, train_loss: 0.7779, test_loss: 0.8424, test_f1: 0.6043
 epoch: 62, train_loss: 0.7597, test_loss: 0.8455, test_f1: 0.6018
 epoch: 63, train_loss: 0.7804, test_loss: 0.8513, test_f1: 0.6150
 epoch: 64, train_loss: 0.7674, test_loss: 0.8487, test_f1: 0.6150
 epoch: 65, train_loss: 0.7558, test_loss: 0.8379, test_f1: 0.6429
 epoch: 66, train_loss: 0.7604, test_loss: 0.8634, test_f1: 0.6177
 epoch: 67, train_loss: 0.7458, test_loss: 0.8496, test_f1: 0.6271
 epoch: 68, train_loss: 0.7527, test_loss: 0.8522, test_f1: 0.6311
 epoch: 69, train_loss: 0.7529, test_loss: 0.8545, test_f1: 0.5963
 epoch: 70, train_loss: 0.7554, test_loss: 0.8637, test_f1: 0.6104
 epoch: 71, train_loss: 0.7569, test_loss: 0.8723, test_f1: 0.6027
 epoch: 72, train_loss: 0.7613, test_loss: 0.8482, test_f1: 0.6216
 epoch: 73, train_loss: 0.7470, test_loss: 0.8959, test_f1: 0.6007
 epoch: 74, train_loss: 0.7559, test_loss: 0.8694, test_f1: 0.6100
 epoch: 75, train_loss: 0.7461, test_loss: 0.8805, test_f1: 0.6145
 epoch: 76, train_loss: 0.7514, test_loss: 0.8555, test_f1: 0.6278
 epoch: 77, train_loss: 0.7605, test_loss: 0.8598, test_f1: 0.6165
 epoch: 78, train_loss: 0.7571, test_loss: 0.8492, test_f1: 0.6220
 epoch: 79, train_loss: 0.7369, test_loss: 0.8542, test_f1: 0.6154
 epoch: 80, train_loss: 0.7340, test_loss: 0.8614, test_f1: 0.6232
 epoch: 81, train_loss: 0.7440, test_loss: 0.8981, test_f1: 0.6352
 epoch: 82, train_loss: 0.7421, test_loss: 0.8685, test_f1: 0.6178
 epoch: 83, train_loss: 0.7355, test_loss: 0.8642, test_f1: 0.6346
 epoch: 84, train_loss: 0.7241, test_loss: 0.8651, test_f1: 0.6122
 epoch: 85, train_loss: 0.7406, test_loss: 0.8778, test_f1: 0.6222
 epoch: 86, train_loss: 0.7394, test_loss: 0.8455, test_f1: 0.6315
 epoch: 87, train_loss: 0.7381, test_loss: 0.8493, test_f1: 0.6225
 epoch: 88, train_loss: 0.7311, test_loss: 0.8382, test_f1: 0.6558
 epoch: 89, train_loss: 0.7437, test_loss: 0.8547, test_f1: 0.6344
 epoch: 90, train_loss: 0.7524, test_loss: 0.9190, test_f1: 0.5904
 epoch: 91, train_loss: 0.7305, test_loss: 0.8434, test_f1: 0.6310
 epoch: 92, train_loss: 0.7396, test_loss: 0.8808, test_f1: 0.5896
 epoch: 93, train_loss: 0.7327, test_loss: 0.8522, test_f1: 0.6288
 epoch: 94, train_loss: 0.7395, test_loss: 0.8570, test_f1: 0.6202
 epoch: 95, train_loss: 0.7254, test_loss: 0.8520, test_f1: 0.6483
 epoch: 96, train_loss: 0.7184, test_loss: 0.8358, test_f1: 0.6487
 epoch: 97, train_loss: 0.7368, test_loss: 0.8674, test_f1: 0.6304
 epoch: 98, train_loss: 0.7275, test_loss: 0.8915, test_f1: 0.6112
 epoch: 99, train_loss: 0.7308, test_loss: 0.8398, test_f1: 0.6099
##################ITERATION #9 ****************************************
 epoch: 0, train_loss: 1.2656, test_loss: 1.1209, test_f1: 0.3791
 epoch: 1, train_loss: 1.0861, test_loss: 1.0319, test_f1: 0.4059
 epoch: 2, train_loss: 1.0303, test_loss: 1.0386, test_f1: 0.4710
 epoch: 3, train_loss: 1.0032, test_loss: 0.9893, test_f1: 0.4542
 epoch: 4, train_loss: 1.0030, test_loss: 0.9984, test_f1: 0.4738
 epoch: 5, train_loss: 0.9859, test_loss: 1.0507, test_f1: 0.5128
 epoch: 6, train_loss: 1.0061, test_loss: 1.0639, test_f1: 0.4762
 epoch: 7, train_loss: 0.9759, test_loss: 1.0222, test_f1: 0.5544
 epoch: 8, train_loss: 0.9674, test_loss: 1.0266, test_f1: 0.4869
 epoch: 9, train_loss: 0.9487, test_loss: 1.0227, test_f1: 0.5252
 epoch: 10, train_loss: 0.9506, test_loss: 1.0220, test_f1: 0.4796
 epoch: 11, train_loss: 0.9324, test_loss: 0.9800, test_f1: 0.4785
 epoch: 12, train_loss: 0.9343, test_loss: 0.9563, test_f1: 0.5103
 epoch: 13, train_loss: 0.9390, test_loss: 1.0456, test_f1: 0.4829
 epoch: 14, train_loss: 0.9332, test_loss: 0.9859, test_f1: 0.5063
 epoch: 15, train_loss: 0.9302, test_loss: 0.9219, test_f1: 0.5352
 epoch: 16, train_loss: 0.9249, test_loss: 1.0407, test_f1: 0.4654
 epoch: 17, train_loss: 0.9488, test_loss: 1.0112, test_f1: 0.5098
 epoch: 18, train_loss: 0.9118, test_loss: 0.9724, test_f1: 0.5012
 epoch: 19, train_loss: 0.9120, test_loss: 0.8881, test_f1: 0.5238
 epoch: 20, train_loss: 0.9151, test_loss: 1.0070, test_f1: 0.5089
 epoch: 21, train_loss: 0.9000, test_loss: 0.9923, test_f1: 0.5548
 epoch: 22, train_loss: 0.9035, test_loss: 0.9859, test_f1: 0.5020
 epoch: 23, train_loss: 0.9019, test_loss: 1.0055, test_f1: 0.4977
 epoch: 24, train_loss: 0.9174, test_loss: 0.9635, test_f1: 0.5422
 epoch: 25, train_loss: 0.8924, test_loss: 0.9433, test_f1: 0.5316
 epoch: 26, train_loss: 0.9015, test_loss: 1.0023, test_f1: 0.4982
 epoch: 27, train_loss: 0.9023, test_loss: 0.9504, test_f1: 0.5281
 epoch: 28, train_loss: 0.8880, test_loss: 0.9740, test_f1: 0.5489
 epoch: 29, train_loss: 0.8834, test_loss: 0.9711, test_f1: 0.5261
 epoch: 30, train_loss: 0.9039, test_loss: 0.9269, test_f1: 0.5099
 epoch: 31, train_loss: 0.8968, test_loss: 0.9698, test_f1: 0.5029
 epoch: 32, train_loss: 0.8976, test_loss: 0.9361, test_f1: 0.5491
 epoch: 33, train_loss: 0.8865, test_loss: 0.9716, test_f1: 0.5525
 epoch: 34, train_loss: 0.8759, test_loss: 0.8585, test_f1: 0.5453
 epoch: 35, train_loss: 0.9021, test_loss: 0.9971, test_f1: 0.5355
 epoch: 36, train_loss: 0.8876, test_loss: 0.9378, test_f1: 0.5329
 epoch: 37, train_loss: 0.8838, test_loss: 0.9529, test_f1: 0.4993
 epoch: 38, train_loss: 0.8860, test_loss: 0.9135, test_f1: 0.5496
 epoch: 39, train_loss: 0.8730, test_loss: 0.9367, test_f1: 0.5310
 epoch: 40, train_loss: 0.8560, test_loss: 0.8777, test_f1: 0.5331
 epoch: 41, train_loss: 0.8551, test_loss: 0.9342, test_f1: 0.5622
 epoch: 42, train_loss: 0.8674, test_loss: 0.8749, test_f1: 0.5709
 epoch: 43, train_loss: 0.8757, test_loss: 0.9321, test_f1: 0.5340
 epoch: 44, train_loss: 0.8589, test_loss: 0.8975, test_f1: 0.5434
 epoch: 45, train_loss: 0.8650, test_loss: 0.8619, test_f1: 0.5358
 epoch: 46, train_loss: 0.8762, test_loss: 0.9336, test_f1: 0.5865
 epoch: 47, train_loss: 0.8621, test_loss: 0.9545, test_f1: 0.5140
 epoch: 48, train_loss: 0.8606, test_loss: 0.9067, test_f1: 0.5425
 epoch: 49, train_loss: 0.8554, test_loss: 1.0390, test_f1: 0.4956
 epoch: 50, train_loss: 0.8613, test_loss: 0.8642, test_f1: 0.5618
 epoch: 51, train_loss: 0.8346, test_loss: 0.9149, test_f1: 0.5640
 epoch: 52, train_loss: 0.8404, test_loss: 0.9007, test_f1: 0.5564
 epoch: 53, train_loss: 0.8259, test_loss: 0.8668, test_f1: 0.5551
 epoch: 54, train_loss: 0.8119, test_loss: 0.8965, test_f1: 0.5595
 epoch: 55, train_loss: 0.8100, test_loss: 0.8882, test_f1: 0.5718
 epoch: 56, train_loss: 0.8172, test_loss: 0.9089, test_f1: 0.5402
 epoch: 57, train_loss: 0.8117, test_loss: 0.8800, test_f1: 0.5489
 epoch: 58, train_loss: 0.8132, test_loss: 0.8651, test_f1: 0.5626
 epoch: 59, train_loss: 0.8078, test_loss: 0.9116, test_f1: 0.5395
 epoch: 60, train_loss: 0.8097, test_loss: 0.8984, test_f1: 0.5559
 epoch: 61, train_loss: 0.8104, test_loss: 0.9270, test_f1: 0.5526
 epoch: 62, train_loss: 0.7929, test_loss: 0.9113, test_f1: 0.5754
 epoch: 63, train_loss: 0.8065, test_loss: 0.9077, test_f1: 0.5546
 epoch: 64, train_loss: 0.8044, test_loss: 0.9581, test_f1: 0.5506
 epoch: 65, train_loss: 0.8120, test_loss: 0.9192, test_f1: 0.5681
 epoch: 66, train_loss: 0.7994, test_loss: 0.8998, test_f1: 0.5800
 epoch: 67, train_loss: 0.7916, test_loss: 0.9339, test_f1: 0.6050
 epoch: 68, train_loss: 0.8029, test_loss: 0.9213, test_f1: 0.5196
 epoch: 69, train_loss: 0.7870, test_loss: 0.8955, test_f1: 0.5868
 epoch: 70, train_loss: 0.7925, test_loss: 0.8994, test_f1: 0.6203
 epoch: 71, train_loss: 0.7827, test_loss: 0.8820, test_f1: 0.5621
 epoch: 72, train_loss: 0.7856, test_loss: 0.8933, test_f1: 0.5904
 epoch: 73, train_loss: 0.7957, test_loss: 0.8733, test_f1: 0.5567
 epoch: 74, train_loss: 0.7697, test_loss: 0.9276, test_f1: 0.5412
 epoch: 75, train_loss: 0.7792, test_loss: 0.9451, test_f1: 0.5941
 epoch: 76, train_loss: 0.7801, test_loss: 0.9166, test_f1: 0.5524
 epoch: 77, train_loss: 0.7811, test_loss: 0.8866, test_f1: 0.6076
 epoch: 78, train_loss: 0.7920, test_loss: 0.9041, test_f1: 0.5436
 epoch: 79, train_loss: 0.7708, test_loss: 0.9065, test_f1: 0.6207
 epoch: 80, train_loss: 0.7884, test_loss: 0.8993, test_f1: 0.5443
 epoch: 81, train_loss: 0.7796, test_loss: 0.9164, test_f1: 0.5446
 epoch: 82, train_loss: 0.7701, test_loss: 0.9437, test_f1: 0.6079
 epoch: 83, train_loss: 0.7749, test_loss: 0.9058, test_f1: 0.6088
 epoch: 84, train_loss: 0.7733, test_loss: 0.9003, test_f1: 0.6150
 epoch: 85, train_loss: 0.7794, test_loss: 0.9281, test_f1: 0.5631
 epoch: 86, train_loss: 0.7739, test_loss: 0.8799, test_f1: 0.5861
 epoch: 87, train_loss: 0.7676, test_loss: 0.8821, test_f1: 0.5968
 epoch: 88, train_loss: 0.7533, test_loss: 0.9194, test_f1: 0.5959
 epoch: 89, train_loss: 0.7847, test_loss: 0.9650, test_f1: 0.6194
 epoch: 90, train_loss: 0.7681, test_loss: 0.9567, test_f1: 0.5587
 epoch: 91, train_loss: 0.7630, test_loss: 0.9350, test_f1: 0.5826
 epoch: 92, train_loss: 0.7614, test_loss: 0.9284, test_f1: 0.5945
 epoch: 93, train_loss: 0.7610, test_loss: 0.9221, test_f1: 0.5813
 epoch: 94, train_loss: 0.7683, test_loss: 0.9766, test_f1: 0.5461
 epoch: 95, train_loss: 0.7487, test_loss: 0.8618, test_f1: 0.6300
 epoch: 96, train_loss: 0.7749, test_loss: 0.8941, test_f1: 0.5911
 epoch: 97, train_loss: 0.7627, test_loss: 0.8922, test_f1: 0.6277
 epoch: 98, train_loss: 0.7589, test_loss: 0.9204, test_f1: 0.6009
 epoch: 99, train_loss: 0.7554, test_loss: 0.8815, test_f1: 0.5791

Training completed in 664.19 seconds
Best F1: 0.6558 at epoch 88
Mean F1 across iterations: 0.6345  0.0160
========================FINAL RESULTS================================
FEGIN weighted F1: 0.6558  0.0160
python main.py --data ltspice_examples --representation component_net --model FEGIN --layers 4 --hiddens 16 --batch_size 64 --lr 0.01 --emb_size 250 --epochs 100 --save_appendix component_net_L4_H16_BS64_LR0.01_E250 --no_val
-----



STDERR:
  File "main.py", line 370, in <module>
    main()
  File "main.py", line 254, in main
    dataset = dataset_class(
  File "/home/philip/projects/ltspice_examples_code_repo/Circuit-Completion-Using-GNNs/component_classification_with_link_prediction_head/evaluation/FEGIN/kernel/circuit_datasets.py", line 15, in __init__
    self.data, self.slices = torch.load(self.processed_paths[0])
  File "/home/philip/.local/lib/python3.8/site-packages/torch/serialization.py", line 1040, in load
    warnings.warn(
  File "/usr/lib/python3.8/warnings.py", line 109, in _showwarnmsg
    sw(msg.message, msg.category, msg.filename, msg.lineno,
  File "main.py", line 47, in warn_with_traceback
    traceback.print_stack(file=log)
/home/philip/projects/ltspice_examples_code_repo/Circuit-Completion-Using-GNNs/component_classification_with_link_prediction_head/evaluation/FEGIN/kernel/circuit_datasets.py:15: FutureWarning: You are using `torch.load` with `weights_only=False` (the current default value), which uses the default pickle module implicitly. It is possible to construct malicious pickle data which will execute arbitrary code during unpickling (See https://github.com/pytorch/pytorch/blob/main/SECURITY.md#untrusted-models for more details). In a future release, the default value for `weights_only` will be flipped to `True`. This limits the functions that could be executed during unpickling. Arbitrary objects will no longer be allowed to be loaded via this mode unless they are explicitly allowlisted by the user via `torch.serialization.add_safe_globals`. We recommend you start setting `weights_only=True` for any use case where you don't have full control of the loaded file. Please open an issue on GitHub for any issues related to this experimental feature.
  self.data, self.slices = torch.load(self.processed_paths[0])
