STDOUT:
Results will be saved in /home/philip/projects/ltspice_examples_code_repo/Circuit-Completion-Using-GNNs/component_classification_with_link_prediction_head/evaluation/FEGIN/results/model_FEGIN_dataset_ltspice_demos
Command line input: python main.py --data ltspice_demos --representation component_pin_net --model FEGIN --layers 2 --hiddens 128 --batch_size 64 --lr 0.001 --emb_size 128 --epochs 100 --save_appendix component_pin_net_L2_H128_BS64_LR0.001_E128 --no_val
 is saved.
-----
ltspice_demos - FEGIN
Using 2 layers, 128 hidden units, h = 2
Loading component_pin_net representation dataset
ENTERED
Training FEGIN on component_pin_net representation
Train: 1565, Test: 383
##################ITERATION #0 ****************************************
 epoch: 0, train_loss: 1.2126, test_loss: 1.3798, test_f1: 0.1365
 epoch: 1, train_loss: 1.0387, test_loss: 1.1168, test_f1: 0.4253
 epoch: 2, train_loss: 0.9930, test_loss: 1.0597, test_f1: 0.4610
 epoch: 3, train_loss: 0.9552, test_loss: 1.0234, test_f1: 0.5364
 epoch: 4, train_loss: 0.9350, test_loss: 1.0091, test_f1: 0.5409
 epoch: 5, train_loss: 0.9111, test_loss: 0.9791, test_f1: 0.5616
 epoch: 6, train_loss: 0.8770, test_loss: 1.0003, test_f1: 0.5679
 epoch: 7, train_loss: 0.8551, test_loss: 0.9531, test_f1: 0.5659
 epoch: 8, train_loss: 0.8225, test_loss: 0.9539, test_f1: 0.6026
 epoch: 9, train_loss: 0.8255, test_loss: 0.9582, test_f1: 0.6233
 epoch: 10, train_loss: 0.7716, test_loss: 0.9234, test_f1: 0.5995
 epoch: 11, train_loss: 0.7638, test_loss: 0.8924, test_f1: 0.6031
 epoch: 12, train_loss: 0.7298, test_loss: 1.0247, test_f1: 0.5793
 epoch: 13, train_loss: 0.7029, test_loss: 0.9474, test_f1: 0.6224
 epoch: 14, train_loss: 0.6993, test_loss: 0.9263, test_f1: 0.6316
 epoch: 15, train_loss: 0.6777, test_loss: 0.9533, test_f1: 0.6324
 epoch: 16, train_loss: 0.6874, test_loss: 0.9403, test_f1: 0.6119
 epoch: 17, train_loss: 0.6488, test_loss: 0.9053, test_f1: 0.6247
 epoch: 18, train_loss: 0.6386, test_loss: 1.0021, test_f1: 0.6046
 epoch: 19, train_loss: 0.6013, test_loss: 0.9030, test_f1: 0.6644
 epoch: 20, train_loss: 0.5802, test_loss: 1.0465, test_f1: 0.6015
 epoch: 21, train_loss: 0.5591, test_loss: 0.9668, test_f1: 0.6463
 epoch: 22, train_loss: 0.5605, test_loss: 0.9347, test_f1: 0.6679
 epoch: 23, train_loss: 0.5325, test_loss: 1.0869, test_f1: 0.6321
 epoch: 24, train_loss: 0.5446, test_loss: 1.0019, test_f1: 0.6290
 epoch: 25, train_loss: 0.5097, test_loss: 1.0434, test_f1: 0.6465
 epoch: 26, train_loss: 0.5380, test_loss: 1.1130, test_f1: 0.6433
 epoch: 27, train_loss: 0.4940, test_loss: 1.1565, test_f1: 0.5985
 epoch: 28, train_loss: 0.5192, test_loss: 1.0486, test_f1: 0.6342
 epoch: 29, train_loss: 0.4859, test_loss: 1.0493, test_f1: 0.6821
 epoch: 30, train_loss: 0.4675, test_loss: 1.1852, test_f1: 0.5800
 epoch: 31, train_loss: 0.4571, test_loss: 1.2296, test_f1: 0.6410
 epoch: 32, train_loss: 0.4164, test_loss: 1.2274, test_f1: 0.6192
 epoch: 33, train_loss: 0.4605, test_loss: 1.2847, test_f1: 0.6128
 epoch: 34, train_loss: 0.4868, test_loss: 1.1456, test_f1: 0.6433
 epoch: 35, train_loss: 0.3981, test_loss: 1.2457, test_f1: 0.5971
 epoch: 36, train_loss: 0.4115, test_loss: 1.3969, test_f1: 0.6334
 epoch: 37, train_loss: 0.4061, test_loss: 1.1939, test_f1: 0.6492
 epoch: 38, train_loss: 0.3800, test_loss: 1.3059, test_f1: 0.6328
 epoch: 39, train_loss: 0.3886, test_loss: 1.2824, test_f1: 0.6097
 epoch: 40, train_loss: 0.3861, test_loss: 1.3312, test_f1: 0.5881
 epoch: 41, train_loss: 0.3651, test_loss: 1.4158, test_f1: 0.6095
 epoch: 42, train_loss: 0.3285, test_loss: 1.4778, test_f1: 0.6468
 epoch: 43, train_loss: 0.3818, test_loss: 1.3766, test_f1: 0.6446
 epoch: 44, train_loss: 0.3262, test_loss: 1.3277, test_f1: 0.6395
 epoch: 45, train_loss: 0.3484, test_loss: 1.4273, test_f1: 0.6535
 epoch: 46, train_loss: 0.3395, test_loss: 1.6990, test_f1: 0.6223
 epoch: 47, train_loss: 0.3603, test_loss: 1.3397, test_f1: 0.6368
 epoch: 48, train_loss: 0.3116, test_loss: 1.5307, test_f1: 0.6136
 epoch: 49, train_loss: 0.3374, test_loss: 1.6288, test_f1: 0.6007
 epoch: 50, train_loss: 0.3199, test_loss: 1.5926, test_f1: 0.6105
 epoch: 51, train_loss: 0.2798, test_loss: 1.5076, test_f1: 0.6347
 epoch: 52, train_loss: 0.2379, test_loss: 1.4805, test_f1: 0.6435
 epoch: 53, train_loss: 0.2365, test_loss: 1.5748, test_f1: 0.6451
 epoch: 54, train_loss: 0.2425, test_loss: 1.5610, test_f1: 0.6377
 epoch: 55, train_loss: 0.2291, test_loss: 1.6288, test_f1: 0.6498
 epoch: 56, train_loss: 0.1972, test_loss: 1.7998, test_f1: 0.6627
 epoch: 57, train_loss: 0.2009, test_loss: 1.6321, test_f1: 0.6346
 epoch: 58, train_loss: 0.2039, test_loss: 1.8015, test_f1: 0.6550
 epoch: 59, train_loss: 0.2322, test_loss: 1.7699, test_f1: 0.6434
 epoch: 60, train_loss: 0.2430, test_loss: 1.7744, test_f1: 0.6475
 epoch: 61, train_loss: 0.2159, test_loss: 1.7500, test_f1: 0.6231
 epoch: 62, train_loss: 0.1852, test_loss: 1.6870, test_f1: 0.6558
 epoch: 63, train_loss: 0.1776, test_loss: 1.7579, test_f1: 0.6572
 epoch: 64, train_loss: 0.1785, test_loss: 1.8905, test_f1: 0.6452
 epoch: 65, train_loss: 0.2084, test_loss: 1.8170, test_f1: 0.6327
 epoch: 66, train_loss: 0.1814, test_loss: 2.0495, test_f1: 0.6462
 epoch: 67, train_loss: 0.1834, test_loss: 1.8812, test_f1: 0.6487
 epoch: 68, train_loss: 0.1798, test_loss: 1.9322, test_f1: 0.6526
 epoch: 69, train_loss: 0.1844, test_loss: 1.7453, test_f1: 0.6746
 epoch: 70, train_loss: 0.1847, test_loss: 1.7968, test_f1: 0.6471
 epoch: 71, train_loss: 0.1700, test_loss: 2.0741, test_f1: 0.6346
 epoch: 72, train_loss: 0.1708, test_loss: 1.8529, test_f1: 0.6419
 epoch: 73, train_loss: 0.1739, test_loss: 1.9532, test_f1: 0.6684
 epoch: 74, train_loss: 0.1419, test_loss: 1.9362, test_f1: 0.6582
 epoch: 75, train_loss: 0.1623, test_loss: 2.2685, test_f1: 0.6431
 epoch: 76, train_loss: 0.1295, test_loss: 2.1105, test_f1: 0.6537
 epoch: 77, train_loss: 0.1639, test_loss: 2.1157, test_f1: 0.6629
 epoch: 78, train_loss: 0.1553, test_loss: 1.9487, test_f1: 0.6485
 epoch: 79, train_loss: 0.1517, test_loss: 2.0935, test_f1: 0.6463
 epoch: 80, train_loss: 0.1505, test_loss: 2.1736, test_f1: 0.6456
 epoch: 81, train_loss: 0.1330, test_loss: 2.1563, test_f1: 0.6465
 epoch: 82, train_loss: 0.1179, test_loss: 2.0901, test_f1: 0.6603
 epoch: 83, train_loss: 0.1610, test_loss: 2.2049, test_f1: 0.6393
 epoch: 84, train_loss: 0.1770, test_loss: 2.0628, test_f1: 0.6641
 epoch: 85, train_loss: 0.1498, test_loss: 2.0574, test_f1: 0.6543
 epoch: 86, train_loss: 0.1276, test_loss: 2.2940, test_f1: 0.6620
 epoch: 87, train_loss: 0.1456, test_loss: 2.0203, test_f1: 0.6615
 epoch: 88, train_loss: 0.1509, test_loss: 2.3284, test_f1: 0.6392
 epoch: 89, train_loss: 0.1546, test_loss: 2.0622, test_f1: 0.6430
 epoch: 90, train_loss: 0.1489, test_loss: 2.2347, test_f1: 0.6351
 epoch: 91, train_loss: 0.1250, test_loss: 2.3688, test_f1: 0.6600
 epoch: 92, train_loss: 0.1433, test_loss: 2.2787, test_f1: 0.6342
 epoch: 93, train_loss: 0.1627, test_loss: 2.1683, test_f1: 0.6488
 epoch: 94, train_loss: 0.1270, test_loss: 2.2908, test_f1: 0.6559
 epoch: 95, train_loss: 0.1144, test_loss: 2.3515, test_f1: 0.6502
 epoch: 96, train_loss: 0.1324, test_loss: 2.5942, test_f1: 0.6290
 epoch: 97, train_loss: 0.0989, test_loss: 2.6589, test_f1: 0.6426
 epoch: 98, train_loss: 0.1332, test_loss: 2.5622, test_f1: 0.6153
 epoch: 99, train_loss: 0.1303, test_loss: 2.4232, test_f1: 0.6599
##################ITERATION #1 ****************************************
 epoch: 0, train_loss: 1.0785, test_loss: 1.4358, test_f1: 0.2281
 epoch: 1, train_loss: 0.9339, test_loss: 1.2823, test_f1: 0.3248
 epoch: 2, train_loss: 0.8818, test_loss: 1.0094, test_f1: 0.4936
 epoch: 3, train_loss: 0.8419, test_loss: 1.0190, test_f1: 0.5598
 epoch: 4, train_loss: 0.8021, test_loss: 1.0192, test_f1: 0.5301
 epoch: 5, train_loss: 0.7696, test_loss: 1.0532, test_f1: 0.5299
 epoch: 6, train_loss: 0.7420, test_loss: 1.0259, test_f1: 0.5844
 epoch: 7, train_loss: 0.6969, test_loss: 1.0207, test_f1: 0.6045
 epoch: 8, train_loss: 0.7034, test_loss: 1.0676, test_f1: 0.6120
 epoch: 9, train_loss: 0.6819, test_loss: 1.0130, test_f1: 0.5921
 epoch: 10, train_loss: 0.6737, test_loss: 1.1178, test_f1: 0.5725
 epoch: 11, train_loss: 0.6521, test_loss: 1.0508, test_f1: 0.6575
 epoch: 12, train_loss: 0.6228, test_loss: 1.0718, test_f1: 0.5985
 epoch: 13, train_loss: 0.5954, test_loss: 1.1207, test_f1: 0.5587
 epoch: 14, train_loss: 0.6041, test_loss: 1.0644, test_f1: 0.6100
 epoch: 15, train_loss: 0.5765, test_loss: 1.1411, test_f1: 0.5749
 epoch: 16, train_loss: 0.5567, test_loss: 1.0772, test_f1: 0.6413
 epoch: 17, train_loss: 0.5513, test_loss: 1.2414, test_f1: 0.6000
 epoch: 18, train_loss: 0.5314, test_loss: 1.0380, test_f1: 0.6414
 epoch: 19, train_loss: 0.5246, test_loss: 1.2806, test_f1: 0.5572
 epoch: 20, train_loss: 0.5503, test_loss: 1.1421, test_f1: 0.6317
 epoch: 21, train_loss: 0.5249, test_loss: 1.3564, test_f1: 0.5992
 epoch: 22, train_loss: 0.4956, test_loss: 1.1951, test_f1: 0.6479
 epoch: 23, train_loss: 0.4945, test_loss: 1.2352, test_f1: 0.5790
 epoch: 24, train_loss: 0.4685, test_loss: 1.2409, test_f1: 0.6013
 epoch: 25, train_loss: 0.4404, test_loss: 1.3662, test_f1: 0.6035
 epoch: 26, train_loss: 0.4246, test_loss: 1.3907, test_f1: 0.5685
 epoch: 27, train_loss: 0.4439, test_loss: 1.2707, test_f1: 0.6348
 epoch: 28, train_loss: 0.4348, test_loss: 1.4768, test_f1: 0.6554
 epoch: 29, train_loss: 0.4318, test_loss: 1.3745, test_f1: 0.5864
 epoch: 30, train_loss: 0.4268, test_loss: 1.2991, test_f1: 0.6361
 epoch: 31, train_loss: 0.3998, test_loss: 1.4547, test_f1: 0.5805
 epoch: 32, train_loss: 0.4044, test_loss: 1.4135, test_f1: 0.6142
 epoch: 33, train_loss: 0.4133, test_loss: 1.4965, test_f1: 0.5812
 epoch: 34, train_loss: 0.4014, test_loss: 1.3660, test_f1: 0.6405
 epoch: 35, train_loss: 0.3454, test_loss: 1.4648, test_f1: 0.6281
 epoch: 36, train_loss: 0.3527, test_loss: 1.4673, test_f1: 0.5752
 epoch: 37, train_loss: 0.3637, test_loss: 1.4453, test_f1: 0.6351
 epoch: 38, train_loss: 0.3367, test_loss: 1.4967, test_f1: 0.6199
 epoch: 39, train_loss: 0.3255, test_loss: 1.6466, test_f1: 0.5956
 epoch: 40, train_loss: 0.3079, test_loss: 1.6866, test_f1: 0.5799
 epoch: 41, train_loss: 0.3295, test_loss: 1.8041, test_f1: 0.5910
 epoch: 42, train_loss: 0.2827, test_loss: 1.5956, test_f1: 0.6448
 epoch: 43, train_loss: 0.3211, test_loss: 1.9175, test_f1: 0.6280
 epoch: 44, train_loss: 0.3145, test_loss: 1.7205, test_f1: 0.6027
 epoch: 45, train_loss: 0.3087, test_loss: 1.7495, test_f1: 0.6033
 epoch: 46, train_loss: 0.3002, test_loss: 1.7975, test_f1: 0.6299
 epoch: 47, train_loss: 0.3098, test_loss: 1.7461, test_f1: 0.6299
 epoch: 48, train_loss: 0.2544, test_loss: 1.8942, test_f1: 0.6380
 epoch: 49, train_loss: 0.2782, test_loss: 1.8743, test_f1: 0.6435
 epoch: 50, train_loss: 0.2603, test_loss: 1.8043, test_f1: 0.6191
 epoch: 51, train_loss: 0.2147, test_loss: 2.0224, test_f1: 0.6216
 epoch: 52, train_loss: 0.1923, test_loss: 1.8880, test_f1: 0.6236
 epoch: 53, train_loss: 0.2030, test_loss: 1.9774, test_f1: 0.6555
 epoch: 54, train_loss: 0.1975, test_loss: 2.0070, test_f1: 0.6472
 epoch: 55, train_loss: 0.2044, test_loss: 1.9584, test_f1: 0.6544
 epoch: 56, train_loss: 0.1792, test_loss: 2.1542, test_f1: 0.6289
 epoch: 57, train_loss: 0.2093, test_loss: 2.0571, test_f1: 0.6425
 epoch: 58, train_loss: 0.1938, test_loss: 2.0193, test_f1: 0.6392
 epoch: 59, train_loss: 0.1700, test_loss: 2.0761, test_f1: 0.6531
 epoch: 60, train_loss: 0.1506, test_loss: 2.2143, test_f1: 0.6409
 epoch: 61, train_loss: 0.1630, test_loss: 2.2884, test_f1: 0.6550
 epoch: 62, train_loss: 0.1495, test_loss: 2.4748, test_f1: 0.6443
 epoch: 63, train_loss: 0.1712, test_loss: 2.0610, test_f1: 0.6345
 epoch: 64, train_loss: 0.1638, test_loss: 2.1963, test_f1: 0.6339
 epoch: 65, train_loss: 0.1515, test_loss: 2.2977, test_f1: 0.6331
 epoch: 66, train_loss: 0.1342, test_loss: 2.4186, test_f1: 0.6401
 epoch: 67, train_loss: 0.1610, test_loss: 2.3771, test_f1: 0.6383
 epoch: 68, train_loss: 0.1421, test_loss: 2.2809, test_f1: 0.6374
 epoch: 69, train_loss: 0.1370, test_loss: 2.4581, test_f1: 0.6275
 epoch: 70, train_loss: 0.1571, test_loss: 2.3114, test_f1: 0.6191
 epoch: 71, train_loss: 0.1424, test_loss: 2.2835, test_f1: 0.6401
 epoch: 72, train_loss: 0.1365, test_loss: 2.3726, test_f1: 0.6302
 epoch: 73, train_loss: 0.1368, test_loss: 2.4503, test_f1: 0.6535
 epoch: 74, train_loss: 0.1403, test_loss: 2.4105, test_f1: 0.6233
 epoch: 75, train_loss: 0.1432, test_loss: 2.4424, test_f1: 0.6652
 epoch: 76, train_loss: 0.1329, test_loss: 2.5901, test_f1: 0.6473
 epoch: 77, train_loss: 0.1399, test_loss: 2.6193, test_f1: 0.6255
 epoch: 78, train_loss: 0.1500, test_loss: 2.5345, test_f1: 0.6441
 epoch: 79, train_loss: 0.1483, test_loss: 2.5788, test_f1: 0.6363
 epoch: 80, train_loss: 0.1318, test_loss: 2.6089, test_f1: 0.6220
 epoch: 81, train_loss: 0.1539, test_loss: 2.6032, test_f1: 0.6414
 epoch: 82, train_loss: 0.1410, test_loss: 2.8260, test_f1: 0.6398
 epoch: 83, train_loss: 0.1418, test_loss: 2.5776, test_f1: 0.6310
 epoch: 84, train_loss: 0.1164, test_loss: 2.6023, test_f1: 0.6437
 epoch: 85, train_loss: 0.1092, test_loss: 2.6580, test_f1: 0.6525
 epoch: 86, train_loss: 0.1198, test_loss: 2.7588, test_f1: 0.6544
 epoch: 87, train_loss: 0.1183, test_loss: 2.6371, test_f1: 0.6351
 epoch: 88, train_loss: 0.1253, test_loss: 2.5957, test_f1: 0.6501
 epoch: 89, train_loss: 0.1220, test_loss: 2.9994, test_f1: 0.6194
 epoch: 90, train_loss: 0.1134, test_loss: 2.8842, test_f1: 0.6342
 epoch: 91, train_loss: 0.1048, test_loss: 2.7303, test_f1: 0.6246
 epoch: 92, train_loss: 0.1074, test_loss: 2.6381, test_f1: 0.6349
 epoch: 93, train_loss: 0.1014, test_loss: 3.0176, test_f1: 0.6264
 epoch: 94, train_loss: 0.0954, test_loss: 2.7571, test_f1: 0.6279
 epoch: 95, train_loss: 0.1031, test_loss: 2.7692, test_f1: 0.6270
 epoch: 96, train_loss: 0.1080, test_loss: 3.1580, test_f1: 0.6425
 epoch: 97, train_loss: 0.1088, test_loss: 2.9268, test_f1: 0.6505
 epoch: 98, train_loss: 0.0932, test_loss: 2.8067, test_f1: 0.6421
 epoch: 99, train_loss: 0.1188, test_loss: 2.9000, test_f1: 0.6252
##################ITERATION #2 ****************************************
 epoch: 0, train_loss: 1.1065, test_loss: 1.7326, test_f1: 0.1365
 epoch: 1, train_loss: 0.9826, test_loss: 1.2503, test_f1: 0.3343
 epoch: 2, train_loss: 0.8973, test_loss: 1.0362, test_f1: 0.5382
 epoch: 3, train_loss: 0.8430, test_loss: 0.9994, test_f1: 0.5772
 epoch: 4, train_loss: 0.8211, test_loss: 1.0579, test_f1: 0.5670
 epoch: 5, train_loss: 0.8003, test_loss: 1.0122, test_f1: 0.5273
 epoch: 6, train_loss: 0.7638, test_loss: 1.0522, test_f1: 0.5514
 epoch: 7, train_loss: 0.7525, test_loss: 1.0088, test_f1: 0.5871
 epoch: 8, train_loss: 0.7284, test_loss: 1.3267, test_f1: 0.4483
 epoch: 9, train_loss: 0.7239, test_loss: 1.0933, test_f1: 0.5769
 epoch: 10, train_loss: 0.6735, test_loss: 1.1379, test_f1: 0.5864
 epoch: 11, train_loss: 0.6839, test_loss: 1.2387, test_f1: 0.5325
 epoch: 12, train_loss: 0.6572, test_loss: 1.1368, test_f1: 0.5501
 epoch: 13, train_loss: 0.6432, test_loss: 1.0821, test_f1: 0.5914
 epoch: 14, train_loss: 0.6127, test_loss: 1.0626, test_f1: 0.5915
 epoch: 15, train_loss: 0.5916, test_loss: 1.1116, test_f1: 0.6099
 epoch: 16, train_loss: 0.5861, test_loss: 1.0855, test_f1: 0.5974
 epoch: 17, train_loss: 0.5612, test_loss: 1.2479, test_f1: 0.5664
 epoch: 18, train_loss: 0.5511, test_loss: 1.2317, test_f1: 0.5453
 epoch: 19, train_loss: 0.5570, test_loss: 1.2052, test_f1: 0.5794
 epoch: 20, train_loss: 0.5380, test_loss: 1.2732, test_f1: 0.5916
 epoch: 21, train_loss: 0.5020, test_loss: 1.2141, test_f1: 0.6011
 epoch: 22, train_loss: 0.5254, test_loss: 1.4021, test_f1: 0.5553
 epoch: 23, train_loss: 0.4677, test_loss: 1.5205, test_f1: 0.5856
 epoch: 24, train_loss: 0.4676, test_loss: 1.4532, test_f1: 0.5969
 epoch: 25, train_loss: 0.4933, test_loss: 1.4007, test_f1: 0.5764
 epoch: 26, train_loss: 0.4743, test_loss: 1.6520, test_f1: 0.5123
 epoch: 27, train_loss: 0.4355, test_loss: 1.4457, test_f1: 0.6027
 epoch: 28, train_loss: 0.4350, test_loss: 1.2826, test_f1: 0.6114
 epoch: 29, train_loss: 0.4216, test_loss: 1.2727, test_f1: 0.6133
 epoch: 30, train_loss: 0.4427, test_loss: 1.4437, test_f1: 0.5949
 epoch: 31, train_loss: 0.4024, test_loss: 1.4855, test_f1: 0.6108
 epoch: 32, train_loss: 0.3847, test_loss: 1.5759, test_f1: 0.5615
 epoch: 33, train_loss: 0.4060, test_loss: 1.5708, test_f1: 0.5844
 epoch: 34, train_loss: 0.3907, test_loss: 1.6286, test_f1: 0.6321
 epoch: 35, train_loss: 0.3931, test_loss: 1.4342, test_f1: 0.5924
 epoch: 36, train_loss: 0.3862, test_loss: 1.5385, test_f1: 0.5778
 epoch: 37, train_loss: 0.3541, test_loss: 1.5257, test_f1: 0.6275
 epoch: 38, train_loss: 0.3359, test_loss: 1.6312, test_f1: 0.6310
 epoch: 39, train_loss: 0.3390, test_loss: 1.6424, test_f1: 0.5863
 epoch: 40, train_loss: 0.3629, test_loss: 1.6639, test_f1: 0.6013
 epoch: 41, train_loss: 0.3506, test_loss: 1.5322, test_f1: 0.6483
 epoch: 42, train_loss: 0.3345, test_loss: 1.5529, test_f1: 0.6380
 epoch: 43, train_loss: 0.3500, test_loss: 1.5808, test_f1: 0.6241
 epoch: 44, train_loss: 0.3353, test_loss: 1.6263, test_f1: 0.6437
 epoch: 45, train_loss: 0.2984, test_loss: 1.6652, test_f1: 0.6261
 epoch: 46, train_loss: 0.2952, test_loss: 1.6570, test_f1: 0.6146
 epoch: 47, train_loss: 0.2957, test_loss: 2.0419, test_f1: 0.5345
 epoch: 48, train_loss: 0.3280, test_loss: 1.8339, test_f1: 0.5723
 epoch: 49, train_loss: 0.2643, test_loss: 1.7524, test_f1: 0.6028
 epoch: 50, train_loss: 0.2794, test_loss: 1.6118, test_f1: 0.6257
 epoch: 51, train_loss: 0.2489, test_loss: 1.6726, test_f1: 0.6426
 epoch: 52, train_loss: 0.2134, test_loss: 1.8585, test_f1: 0.6583
 epoch: 53, train_loss: 0.2126, test_loss: 1.8679, test_f1: 0.6052
 epoch: 54, train_loss: 0.2238, test_loss: 1.9518, test_f1: 0.6240
 epoch: 55, train_loss: 0.2214, test_loss: 1.8648, test_f1: 0.6275
 epoch: 56, train_loss: 0.2161, test_loss: 1.9957, test_f1: 0.5950
 epoch: 57, train_loss: 0.1952, test_loss: 2.1386, test_f1: 0.5677
 epoch: 58, train_loss: 0.2063, test_loss: 2.0393, test_f1: 0.5918
 epoch: 59, train_loss: 0.1804, test_loss: 2.1574, test_f1: 0.5754
 epoch: 60, train_loss: 0.1995, test_loss: 2.0097, test_f1: 0.6315
 epoch: 61, train_loss: 0.1649, test_loss: 2.0941, test_f1: 0.6036
 epoch: 62, train_loss: 0.1789, test_loss: 2.0408, test_f1: 0.5844
 epoch: 63, train_loss: 0.1727, test_loss: 2.2870, test_f1: 0.5739
 epoch: 64, train_loss: 0.1428, test_loss: 2.2105, test_f1: 0.6262
 epoch: 65, train_loss: 0.1514, test_loss: 2.3289, test_f1: 0.5927
 epoch: 66, train_loss: 0.1599, test_loss: 2.2573, test_f1: 0.6357
 epoch: 67, train_loss: 0.2087, test_loss: 2.1400, test_f1: 0.6127
 epoch: 68, train_loss: 0.1656, test_loss: 2.2412, test_f1: 0.6176
 epoch: 69, train_loss: 0.1427, test_loss: 2.3296, test_f1: 0.5944
 epoch: 70, train_loss: 0.1602, test_loss: 2.1860, test_f1: 0.5871
 epoch: 71, train_loss: 0.1593, test_loss: 2.2671, test_f1: 0.6192
 epoch: 72, train_loss: 0.1602, test_loss: 2.2735, test_f1: 0.5709
 epoch: 73, train_loss: 0.1400, test_loss: 2.3991, test_f1: 0.5998
 epoch: 74, train_loss: 0.1549, test_loss: 2.3566, test_f1: 0.6049
 epoch: 75, train_loss: 0.1516, test_loss: 2.2009, test_f1: 0.6380
 epoch: 76, train_loss: 0.1593, test_loss: 2.1197, test_f1: 0.6326
 epoch: 77, train_loss: 0.1710, test_loss: 2.3973, test_f1: 0.5941
 epoch: 78, train_loss: 0.1519, test_loss: 2.2679, test_f1: 0.6593
 epoch: 79, train_loss: 0.1299, test_loss: 2.4542, test_f1: 0.6105
 epoch: 80, train_loss: 0.1491, test_loss: 2.5298, test_f1: 0.5934
 epoch: 81, train_loss: 0.1659, test_loss: 2.3164, test_f1: 0.6369
 epoch: 82, train_loss: 0.1281, test_loss: 2.2881, test_f1: 0.6290
 epoch: 83, train_loss: 0.1420, test_loss: 2.4903, test_f1: 0.6221
 epoch: 84, train_loss: 0.1395, test_loss: 2.4095, test_f1: 0.6406
 epoch: 85, train_loss: 0.1417, test_loss: 2.4873, test_f1: 0.6408
 epoch: 86, train_loss: 0.1462, test_loss: 2.4884, test_f1: 0.5755
 epoch: 87, train_loss: 0.1228, test_loss: 2.5478, test_f1: 0.6470
 epoch: 88, train_loss: 0.1114, test_loss: 2.3364, test_f1: 0.6429
 epoch: 89, train_loss: 0.1317, test_loss: 2.3646, test_f1: 0.6393
 epoch: 90, train_loss: 0.1242, test_loss: 2.4105, test_f1: 0.6282
 epoch: 91, train_loss: 0.1259, test_loss: 2.5278, test_f1: 0.6267
 epoch: 92, train_loss: 0.1250, test_loss: 2.4893, test_f1: 0.6474
 epoch: 93, train_loss: 0.1500, test_loss: 2.4910, test_f1: 0.6441
 epoch: 94, train_loss: 0.1054, test_loss: 2.4916, test_f1: 0.6438
 epoch: 95, train_loss: 0.1130, test_loss: 2.4561, test_f1: 0.6136
 epoch: 96, train_loss: 0.1087, test_loss: 2.4696, test_f1: 0.6231
 epoch: 97, train_loss: 0.1081, test_loss: 2.7972, test_f1: 0.6110
 epoch: 98, train_loss: 0.0995, test_loss: 2.4498, test_f1: 0.6119
 epoch: 99, train_loss: 0.1303, test_loss: 2.6551, test_f1: 0.6344
##################ITERATION #3 ****************************************
 epoch: 0, train_loss: 1.2193, test_loss: 1.4310, test_f1: 0.2095
 epoch: 1, train_loss: 0.9489, test_loss: 1.1304, test_f1: 0.4361
 epoch: 2, train_loss: 0.9004, test_loss: 1.0487, test_f1: 0.5407
 epoch: 3, train_loss: 0.8684, test_loss: 1.0259, test_f1: 0.5552
 epoch: 4, train_loss: 0.8276, test_loss: 0.9975, test_f1: 0.5882
 epoch: 5, train_loss: 0.7867, test_loss: 0.9777, test_f1: 0.5832
 epoch: 6, train_loss: 0.7455, test_loss: 1.0034, test_f1: 0.5649
 epoch: 7, train_loss: 0.7032, test_loss: 1.0371, test_f1: 0.6081
 epoch: 8, train_loss: 0.6971, test_loss: 1.0605, test_f1: 0.5888
 epoch: 9, train_loss: 0.6773, test_loss: 1.0949, test_f1: 0.5898
 epoch: 10, train_loss: 0.6643, test_loss: 1.1500, test_f1: 0.5603
 epoch: 11, train_loss: 0.6238, test_loss: 1.1191, test_f1: 0.6071
 epoch: 12, train_loss: 0.5983, test_loss: 1.0865, test_f1: 0.6303
 epoch: 13, train_loss: 0.6056, test_loss: 1.0729, test_f1: 0.6577
 epoch: 14, train_loss: 0.5698, test_loss: 1.1459, test_f1: 0.5573
 epoch: 15, train_loss: 0.5774, test_loss: 1.0719, test_f1: 0.6501
 epoch: 16, train_loss: 0.5640, test_loss: 1.0749, test_f1: 0.7007
 epoch: 17, train_loss: 0.5600, test_loss: 1.1444, test_f1: 0.6444
 epoch: 18, train_loss: 0.5366, test_loss: 1.2347, test_f1: 0.5684
 epoch: 19, train_loss: 0.5169, test_loss: 1.1385, test_f1: 0.6634
 epoch: 20, train_loss: 0.5040, test_loss: 1.2660, test_f1: 0.5976
 epoch: 21, train_loss: 0.5034, test_loss: 1.2205, test_f1: 0.5864
 epoch: 22, train_loss: 0.4763, test_loss: 1.2776, test_f1: 0.6341
 epoch: 23, train_loss: 0.4595, test_loss: 1.4296, test_f1: 0.5551
 epoch: 24, train_loss: 0.4622, test_loss: 1.2736, test_f1: 0.6309
 epoch: 25, train_loss: 0.4800, test_loss: 1.3085, test_f1: 0.6319
 epoch: 26, train_loss: 0.4721, test_loss: 1.3064, test_f1: 0.6115
 epoch: 27, train_loss: 0.4094, test_loss: 1.3049, test_f1: 0.6638
 epoch: 28, train_loss: 0.3966, test_loss: 1.4814, test_f1: 0.6140
 epoch: 29, train_loss: 0.3723, test_loss: 1.3849, test_f1: 0.6230
 epoch: 30, train_loss: 0.3852, test_loss: 1.6089, test_f1: 0.5796
 epoch: 31, train_loss: 0.3971, test_loss: 1.5402, test_f1: 0.5779
 epoch: 32, train_loss: 0.4034, test_loss: 1.5078, test_f1: 0.6049
 epoch: 33, train_loss: 0.3767, test_loss: 1.3498, test_f1: 0.6587
 epoch: 34, train_loss: 0.3698, test_loss: 1.5450, test_f1: 0.6409
 epoch: 35, train_loss: 0.3713, test_loss: 1.6041, test_f1: 0.5886
 epoch: 36, train_loss: 0.3633, test_loss: 1.5804, test_f1: 0.5762
 epoch: 37, train_loss: 0.3607, test_loss: 1.4583, test_f1: 0.6689
 epoch: 38, train_loss: 0.3360, test_loss: 1.5191, test_f1: 0.5984
 epoch: 39, train_loss: 0.3051, test_loss: 1.5990, test_f1: 0.6466
 epoch: 40, train_loss: 0.3309, test_loss: 1.7523, test_f1: 0.5711
 epoch: 41, train_loss: 0.3037, test_loss: 1.5492, test_f1: 0.6248
 epoch: 42, train_loss: 0.3193, test_loss: 1.4535, test_f1: 0.6485
 epoch: 43, train_loss: 0.3330, test_loss: 1.6785, test_f1: 0.5665
 epoch: 44, train_loss: 0.2905, test_loss: 1.6506, test_f1: 0.6484
 epoch: 45, train_loss: 0.3139, test_loss: 1.7034, test_f1: 0.6434
 epoch: 46, train_loss: 0.2569, test_loss: 1.7204, test_f1: 0.6399
 epoch: 47, train_loss: 0.2631, test_loss: 1.7501, test_f1: 0.6237
 epoch: 48, train_loss: 0.2518, test_loss: 1.7859, test_f1: 0.6656
 epoch: 49, train_loss: 0.2791, test_loss: 1.8347, test_f1: 0.6456
 epoch: 50, train_loss: 0.2558, test_loss: 1.6599, test_f1: 0.6487
 epoch: 51, train_loss: 0.2638, test_loss: 1.6737, test_f1: 0.6527
 epoch: 52, train_loss: 0.1949, test_loss: 1.7784, test_f1: 0.6485
 epoch: 53, train_loss: 0.2326, test_loss: 1.7293, test_f1: 0.6710
 epoch: 54, train_loss: 0.2006, test_loss: 1.8472, test_f1: 0.6486
 epoch: 55, train_loss: 0.1906, test_loss: 1.9312, test_f1: 0.6335
 epoch: 56, train_loss: 0.1901, test_loss: 1.8713, test_f1: 0.6372
 epoch: 57, train_loss: 0.2030, test_loss: 1.9294, test_f1: 0.6428
 epoch: 58, train_loss: 0.1747, test_loss: 1.9472, test_f1: 0.6458
 epoch: 59, train_loss: 0.1706, test_loss: 1.9637, test_f1: 0.6642
 epoch: 60, train_loss: 0.1739, test_loss: 2.0502, test_f1: 0.6496
 epoch: 61, train_loss: 0.1719, test_loss: 1.9452, test_f1: 0.6477
 epoch: 62, train_loss: 0.1590, test_loss: 2.0420, test_f1: 0.6374
 epoch: 63, train_loss: 0.1460, test_loss: 2.1368, test_f1: 0.6587
 epoch: 64, train_loss: 0.1779, test_loss: 2.0904, test_f1: 0.6521
 epoch: 65, train_loss: 0.1839, test_loss: 2.0136, test_f1: 0.6431
 epoch: 66, train_loss: 0.1916, test_loss: 2.1377, test_f1: 0.5856
 epoch: 67, train_loss: 0.1566, test_loss: 2.1259, test_f1: 0.6404
 epoch: 68, train_loss: 0.1632, test_loss: 2.1130, test_f1: 0.6351
 epoch: 69, train_loss: 0.1444, test_loss: 2.0292, test_f1: 0.6094
 epoch: 70, train_loss: 0.1353, test_loss: 2.0723, test_f1: 0.6244
 epoch: 71, train_loss: 0.1187, test_loss: 2.2180, test_f1: 0.6347
 epoch: 72, train_loss: 0.1393, test_loss: 2.2089, test_f1: 0.6462
 epoch: 73, train_loss: 0.1518, test_loss: 2.1579, test_f1: 0.6380
 epoch: 74, train_loss: 0.1326, test_loss: 2.1710, test_f1: 0.6587
 epoch: 75, train_loss: 0.1629, test_loss: 2.2051, test_f1: 0.6426
 epoch: 76, train_loss: 0.1516, test_loss: 2.2909, test_f1: 0.6107
 epoch: 77, train_loss: 0.1390, test_loss: 2.1132, test_f1: 0.6600
 epoch: 78, train_loss: 0.1346, test_loss: 2.1638, test_f1: 0.6312
 epoch: 79, train_loss: 0.1321, test_loss: 2.2346, test_f1: 0.6452
 epoch: 80, train_loss: 0.1346, test_loss: 2.1882, test_f1: 0.6351
 epoch: 81, train_loss: 0.1318, test_loss: 2.1791, test_f1: 0.6380
 epoch: 82, train_loss: 0.1314, test_loss: 2.3409, test_f1: 0.6234
 epoch: 83, train_loss: 0.1365, test_loss: 2.3100, test_f1: 0.6487
 epoch: 84, train_loss: 0.1394, test_loss: 2.2319, test_f1: 0.6441
 epoch: 85, train_loss: 0.1092, test_loss: 2.4538, test_f1: 0.6298
 epoch: 86, train_loss: 0.1081, test_loss: 2.3353, test_f1: 0.6459
 epoch: 87, train_loss: 0.1064, test_loss: 2.3260, test_f1: 0.6288
 epoch: 88, train_loss: 0.1170, test_loss: 2.3454, test_f1: 0.6436
 epoch: 89, train_loss: 0.1050, test_loss: 2.2593, test_f1: 0.6522
 epoch: 90, train_loss: 0.1274, test_loss: 2.5408, test_f1: 0.6133
 epoch: 91, train_loss: 0.1106, test_loss: 2.3729, test_f1: 0.6660
 epoch: 92, train_loss: 0.0957, test_loss: 2.3985, test_f1: 0.6526
 epoch: 93, train_loss: 0.1008, test_loss: 2.3782, test_f1: 0.6669
 epoch: 94, train_loss: 0.0920, test_loss: 2.3391, test_f1: 0.6468
 epoch: 95, train_loss: 0.1202, test_loss: 2.3543, test_f1: 0.6651
 epoch: 96, train_loss: 0.1558, test_loss: 2.5932, test_f1: 0.6081
 epoch: 97, train_loss: 0.1319, test_loss: 2.3965, test_f1: 0.6448
 epoch: 98, train_loss: 0.1187, test_loss: 2.3869, test_f1: 0.6451
 epoch: 99, train_loss: 0.1156, test_loss: 2.4839, test_f1: 0.6306
##################ITERATION #4 ****************************************
 epoch: 0, train_loss: 1.3492, test_loss: 1.6348, test_f1: 0.3280
 epoch: 1, train_loss: 1.0583, test_loss: 1.3626, test_f1: 0.3193
 epoch: 2, train_loss: 0.9164, test_loss: 1.0927, test_f1: 0.5324
 epoch: 3, train_loss: 0.8600, test_loss: 1.0598, test_f1: 0.5501
 epoch: 4, train_loss: 0.8271, test_loss: 1.1261, test_f1: 0.4762
 epoch: 5, train_loss: 0.7930, test_loss: 1.0848, test_f1: 0.5306
 epoch: 6, train_loss: 0.7517, test_loss: 1.2413, test_f1: 0.5361
 epoch: 7, train_loss: 0.7569, test_loss: 1.1049, test_f1: 0.5124
 epoch: 8, train_loss: 0.7351, test_loss: 1.0849, test_f1: 0.5909
 epoch: 9, train_loss: 0.7154, test_loss: 1.1187, test_f1: 0.5705
 epoch: 10, train_loss: 0.7171, test_loss: 1.1442, test_f1: 0.5382
 epoch: 11, train_loss: 0.6710, test_loss: 1.0958, test_f1: 0.5656
 epoch: 12, train_loss: 0.6408, test_loss: 1.1098, test_f1: 0.5549
 epoch: 13, train_loss: 0.6321, test_loss: 1.1950, test_f1: 0.5563
 epoch: 14, train_loss: 0.6209, test_loss: 1.1875, test_f1: 0.5928
 epoch: 15, train_loss: 0.6285, test_loss: 1.1698, test_f1: 0.5386
 epoch: 16, train_loss: 0.6021, test_loss: 1.1126, test_f1: 0.6027
 epoch: 17, train_loss: 0.5916, test_loss: 1.2891, test_f1: 0.5249
 epoch: 18, train_loss: 0.5731, test_loss: 1.1527, test_f1: 0.5787
 epoch: 19, train_loss: 0.5693, test_loss: 1.2291, test_f1: 0.5629
 epoch: 20, train_loss: 0.5246, test_loss: 1.2378, test_f1: 0.5561
 epoch: 21, train_loss: 0.5325, test_loss: 1.2756, test_f1: 0.5738
 epoch: 22, train_loss: 0.5201, test_loss: 1.2355, test_f1: 0.5905
 epoch: 23, train_loss: 0.5173, test_loss: 1.3737, test_f1: 0.5895
 epoch: 24, train_loss: 0.4767, test_loss: 1.2200, test_f1: 0.6380
 epoch: 25, train_loss: 0.4763, test_loss: 1.3199, test_f1: 0.5641
 epoch: 26, train_loss: 0.4677, test_loss: 1.5046, test_f1: 0.5144
 epoch: 27, train_loss: 0.4903, test_loss: 1.6102, test_f1: 0.5300
 epoch: 28, train_loss: 0.4803, test_loss: 1.3304, test_f1: 0.6141
 epoch: 29, train_loss: 0.4771, test_loss: 1.4574, test_f1: 0.5718
 epoch: 30, train_loss: 0.4428, test_loss: 1.4282, test_f1: 0.6385
 epoch: 31, train_loss: 0.4488, test_loss: 1.5248, test_f1: 0.5280
 epoch: 32, train_loss: 0.4490, test_loss: 1.3612, test_f1: 0.6128
 epoch: 33, train_loss: 0.4126, test_loss: 1.5148, test_f1: 0.5879
 epoch: 34, train_loss: 0.4130, test_loss: 1.5606, test_f1: 0.5877
 epoch: 35, train_loss: 0.3870, test_loss: 1.4218, test_f1: 0.5859
 epoch: 36, train_loss: 0.4101, test_loss: 1.6746, test_f1: 0.5750
 epoch: 37, train_loss: 0.4031, test_loss: 1.4198, test_f1: 0.5979
 epoch: 38, train_loss: 0.4251, test_loss: 1.6467, test_f1: 0.5886
 epoch: 39, train_loss: 0.3619, test_loss: 1.6453, test_f1: 0.5936
 epoch: 40, train_loss: 0.3542, test_loss: 1.5331, test_f1: 0.6390
 epoch: 41, train_loss: 0.3393, test_loss: 1.5644, test_f1: 0.5616
 epoch: 42, train_loss: 0.3397, test_loss: 1.7873, test_f1: 0.5970
 epoch: 43, train_loss: 0.3051, test_loss: 1.7387, test_f1: 0.5775
 epoch: 44, train_loss: 0.3015, test_loss: 2.0187, test_f1: 0.5531
 epoch: 45, train_loss: 0.3273, test_loss: 1.7090, test_f1: 0.5892
 epoch: 46, train_loss: 0.3526, test_loss: 1.8447, test_f1: 0.6045
 epoch: 47, train_loss: 0.3267, test_loss: 1.8988, test_f1: 0.5707
 epoch: 48, train_loss: 0.3335, test_loss: 1.8670, test_f1: 0.5910
 epoch: 49, train_loss: 0.2855, test_loss: 1.7863, test_f1: 0.6348
 epoch: 50, train_loss: 0.2963, test_loss: 2.0272, test_f1: 0.5659
 epoch: 51, train_loss: 0.2463, test_loss: 1.8120, test_f1: 0.6330
 epoch: 52, train_loss: 0.2376, test_loss: 1.9428, test_f1: 0.6383
 epoch: 53, train_loss: 0.2138, test_loss: 1.9565, test_f1: 0.6026
 epoch: 54, train_loss: 0.2258, test_loss: 2.1076, test_f1: 0.5792
 epoch: 55, train_loss: 0.2201, test_loss: 1.9033, test_f1: 0.6228
 epoch: 56, train_loss: 0.2019, test_loss: 1.9776, test_f1: 0.6117
 epoch: 57, train_loss: 0.2124, test_loss: 2.2114, test_f1: 0.5942
 epoch: 58, train_loss: 0.2024, test_loss: 2.2731, test_f1: 0.6007
 epoch: 59, train_loss: 0.1824, test_loss: 2.1838, test_f1: 0.6158
 epoch: 60, train_loss: 0.1957, test_loss: 2.4776, test_f1: 0.5425
 epoch: 61, train_loss: 0.2017, test_loss: 1.8808, test_f1: 0.6068
 epoch: 62, train_loss: 0.1951, test_loss: 2.1038, test_f1: 0.6025
 epoch: 63, train_loss: 0.1941, test_loss: 2.1335, test_f1: 0.6182
 epoch: 64, train_loss: 0.2062, test_loss: 2.2187, test_f1: 0.6070
 epoch: 65, train_loss: 0.1907, test_loss: 2.1009, test_f1: 0.6287
 epoch: 66, train_loss: 0.1802, test_loss: 2.1125, test_f1: 0.5913
 epoch: 67, train_loss: 0.1778, test_loss: 2.0618, test_f1: 0.6070
 epoch: 68, train_loss: 0.1755, test_loss: 2.2026, test_f1: 0.6201
 epoch: 69, train_loss: 0.1524, test_loss: 2.1967, test_f1: 0.6278
 epoch: 70, train_loss: 0.1508, test_loss: 2.2119, test_f1: 0.6181
 epoch: 71, train_loss: 0.1654, test_loss: 2.3939, test_f1: 0.5835
 epoch: 72, train_loss: 0.1691, test_loss: 2.2591, test_f1: 0.6324
 epoch: 73, train_loss: 0.1629, test_loss: 2.3787, test_f1: 0.6090
 epoch: 74, train_loss: 0.1465, test_loss: 2.2416, test_f1: 0.6341
 epoch: 75, train_loss: 0.1482, test_loss: 2.3551, test_f1: 0.6213
 epoch: 76, train_loss: 0.1660, test_loss: 2.3347, test_f1: 0.6466
 epoch: 77, train_loss: 0.1621, test_loss: 2.6067, test_f1: 0.5641
 epoch: 78, train_loss: 0.1680, test_loss: 2.2370, test_f1: 0.6475
 epoch: 79, train_loss: 0.1457, test_loss: 2.2075, test_f1: 0.6267
 epoch: 80, train_loss: 0.1424, test_loss: 2.6787, test_f1: 0.5757
 epoch: 81, train_loss: 0.1903, test_loss: 2.4743, test_f1: 0.6089
 epoch: 82, train_loss: 0.1490, test_loss: 2.2609, test_f1: 0.6267
 epoch: 83, train_loss: 0.1466, test_loss: 2.4970, test_f1: 0.6450
 epoch: 84, train_loss: 0.1240, test_loss: 2.5560, test_f1: 0.5974
 epoch: 85, train_loss: 0.1409, test_loss: 2.3341, test_f1: 0.6190
 epoch: 86, train_loss: 0.1257, test_loss: 2.6513, test_f1: 0.6167
 epoch: 87, train_loss: 0.1307, test_loss: 2.2575, test_f1: 0.6485
 epoch: 88, train_loss: 0.1119, test_loss: 2.5108, test_f1: 0.6069
 epoch: 89, train_loss: 0.1173, test_loss: 2.6462, test_f1: 0.6180
 epoch: 90, train_loss: 0.1283, test_loss: 2.8771, test_f1: 0.6073
 epoch: 91, train_loss: 0.1365, test_loss: 2.6974, test_f1: 0.6237
 epoch: 92, train_loss: 0.1470, test_loss: 2.6911, test_f1: 0.6166
 epoch: 93, train_loss: 0.1247, test_loss: 2.3736, test_f1: 0.6174
 epoch: 94, train_loss: 0.1380, test_loss: 2.8022, test_f1: 0.6068
 epoch: 95, train_loss: 0.1355, test_loss: 2.6175, test_f1: 0.6322
 epoch: 96, train_loss: 0.1256, test_loss: 2.6514, test_f1: 0.5773
 epoch: 97, train_loss: 0.1103, test_loss: 3.0146, test_f1: 0.5490
 epoch: 98, train_loss: 0.1134, test_loss: 2.7063, test_f1: 0.6117
 epoch: 99, train_loss: 0.1106, test_loss: 2.8625, test_f1: 0.5925
##################ITERATION #5 ****************************************
 epoch: 0, train_loss: 1.4685, test_loss: 1.5080, test_f1: 0.2281
 epoch: 1, train_loss: 1.0429, test_loss: 1.1804, test_f1: 0.4093
 epoch: 2, train_loss: 0.9159, test_loss: 1.1174, test_f1: 0.4363
 epoch: 3, train_loss: 0.8727, test_loss: 1.1817, test_f1: 0.5005
 epoch: 4, train_loss: 0.8456, test_loss: 1.1142, test_f1: 0.5201
 epoch: 5, train_loss: 0.8093, test_loss: 1.0950, test_f1: 0.6022
 epoch: 6, train_loss: 0.7573, test_loss: 1.1509, test_f1: 0.5222
 epoch: 7, train_loss: 0.7191, test_loss: 1.1531, test_f1: 0.5744
 epoch: 8, train_loss: 0.7254, test_loss: 1.1239, test_f1: 0.5903
 epoch: 9, train_loss: 0.6876, test_loss: 1.2033, test_f1: 0.5767
 epoch: 10, train_loss: 0.7046, test_loss: 1.2040, test_f1: 0.5777
 epoch: 11, train_loss: 0.6771, test_loss: 1.2390, test_f1: 0.6017
 epoch: 12, train_loss: 0.6099, test_loss: 1.1960, test_f1: 0.5817
 epoch: 13, train_loss: 0.6171, test_loss: 1.2366, test_f1: 0.5472
 epoch: 14, train_loss: 0.5946, test_loss: 1.2932, test_f1: 0.5759
 epoch: 15, train_loss: 0.6010, test_loss: 1.2554, test_f1: 0.6085
 epoch: 16, train_loss: 0.5775, test_loss: 1.3180, test_f1: 0.5944
 epoch: 17, train_loss: 0.5877, test_loss: 1.3946, test_f1: 0.5782
 epoch: 18, train_loss: 0.5792, test_loss: 1.2745, test_f1: 0.6055
 epoch: 19, train_loss: 0.5744, test_loss: 1.3297, test_f1: 0.5937
 epoch: 20, train_loss: 0.5539, test_loss: 1.4066, test_f1: 0.5571
 epoch: 21, train_loss: 0.5111, test_loss: 1.3450, test_f1: 0.6228
 epoch: 22, train_loss: 0.4942, test_loss: 1.4061, test_f1: 0.5995
 epoch: 23, train_loss: 0.4869, test_loss: 1.4623, test_f1: 0.5994
 epoch: 24, train_loss: 0.4709, test_loss: 1.4886, test_f1: 0.6146
 epoch: 25, train_loss: 0.4695, test_loss: 1.4445, test_f1: 0.5901
 epoch: 26, train_loss: 0.5093, test_loss: 1.4075, test_f1: 0.6112
 epoch: 27, train_loss: 0.4598, test_loss: 1.5854, test_f1: 0.5486
 epoch: 28, train_loss: 0.4619, test_loss: 1.4500, test_f1: 0.6103
 epoch: 29, train_loss: 0.4567, test_loss: 1.5771, test_f1: 0.6122
 epoch: 30, train_loss: 0.4207, test_loss: 1.5504, test_f1: 0.5459
 epoch: 31, train_loss: 0.3943, test_loss: 1.5943, test_f1: 0.6152
 epoch: 32, train_loss: 0.4010, test_loss: 1.6158, test_f1: 0.6093
 epoch: 33, train_loss: 0.3898, test_loss: 1.5884, test_f1: 0.6163
 epoch: 34, train_loss: 0.3809, test_loss: 1.6573, test_f1: 0.6006
 epoch: 35, train_loss: 0.3720, test_loss: 1.6920, test_f1: 0.6037
 epoch: 36, train_loss: 0.3678, test_loss: 1.7540, test_f1: 0.6258
 epoch: 37, train_loss: 0.3733, test_loss: 1.9522, test_f1: 0.5507
 epoch: 38, train_loss: 0.3602, test_loss: 1.8150, test_f1: 0.5784
 epoch: 39, train_loss: 0.3677, test_loss: 1.8204, test_f1: 0.6264
 epoch: 40, train_loss: 0.3441, test_loss: 1.7104, test_f1: 0.5866
 epoch: 41, train_loss: 0.3431, test_loss: 2.1314, test_f1: 0.5852
 epoch: 42, train_loss: 0.3397, test_loss: 1.7911, test_f1: 0.5827
 epoch: 43, train_loss: 0.3273, test_loss: 1.7998, test_f1: 0.6401
 epoch: 44, train_loss: 0.3184, test_loss: 1.8595, test_f1: 0.5956
 epoch: 45, train_loss: 0.3399, test_loss: 1.9038, test_f1: 0.5917
 epoch: 46, train_loss: 0.3076, test_loss: 1.9700, test_f1: 0.5674
 epoch: 47, train_loss: 0.3229, test_loss: 1.8803, test_f1: 0.5953
 epoch: 48, train_loss: 0.3177, test_loss: 2.2198, test_f1: 0.5691
 epoch: 49, train_loss: 0.2954, test_loss: 1.8408, test_f1: 0.5951
 epoch: 50, train_loss: 0.3298, test_loss: 2.4682, test_f1: 0.5577
 epoch: 51, train_loss: 0.2870, test_loss: 1.8579, test_f1: 0.5886
 epoch: 52, train_loss: 0.2527, test_loss: 2.0287, test_f1: 0.6028
 epoch: 53, train_loss: 0.2295, test_loss: 2.1099, test_f1: 0.5953
 epoch: 54, train_loss: 0.2081, test_loss: 2.1359, test_f1: 0.6017
 epoch: 55, train_loss: 0.2106, test_loss: 2.1695, test_f1: 0.5933
 epoch: 56, train_loss: 0.2126, test_loss: 2.2024, test_f1: 0.5885
 epoch: 57, train_loss: 0.1675, test_loss: 2.2234, test_f1: 0.5948
 epoch: 58, train_loss: 0.2002, test_loss: 2.0229, test_f1: 0.5886
 epoch: 59, train_loss: 0.2064, test_loss: 2.2064, test_f1: 0.5923
 epoch: 60, train_loss: 0.1986, test_loss: 2.2976, test_f1: 0.5814
 epoch: 61, train_loss: 0.1628, test_loss: 2.2869, test_f1: 0.5963
 epoch: 62, train_loss: 0.1737, test_loss: 2.2863, test_f1: 0.5852
 epoch: 63, train_loss: 0.2052, test_loss: 2.5628, test_f1: 0.5802
 epoch: 64, train_loss: 0.1764, test_loss: 2.3833, test_f1: 0.6035
 epoch: 65, train_loss: 0.2026, test_loss: 2.2331, test_f1: 0.6012
 epoch: 66, train_loss: 0.1964, test_loss: 2.2459, test_f1: 0.5996
 epoch: 67, train_loss: 0.1655, test_loss: 2.4726, test_f1: 0.5877
 epoch: 68, train_loss: 0.1673, test_loss: 2.3924, test_f1: 0.6029
 epoch: 69, train_loss: 0.1758, test_loss: 2.3098, test_f1: 0.6190
 epoch: 70, train_loss: 0.1576, test_loss: 2.3489, test_f1: 0.5996
 epoch: 71, train_loss: 0.1640, test_loss: 2.2404, test_f1: 0.5911
 epoch: 72, train_loss: 0.1509, test_loss: 2.4426, test_f1: 0.6088
 epoch: 73, train_loss: 0.1529, test_loss: 2.5745, test_f1: 0.6001
 epoch: 74, train_loss: 0.1700, test_loss: 2.4737, test_f1: 0.6030
 epoch: 75, train_loss: 0.1626, test_loss: 2.3011, test_f1: 0.6144
 epoch: 76, train_loss: 0.1434, test_loss: 2.3865, test_f1: 0.6008
 epoch: 77, train_loss: 0.1692, test_loss: 2.4630, test_f1: 0.6066
 epoch: 78, train_loss: 0.1661, test_loss: 2.3103, test_f1: 0.5976
 epoch: 79, train_loss: 0.1525, test_loss: 2.2947, test_f1: 0.5941
 epoch: 80, train_loss: 0.1474, test_loss: 2.4349, test_f1: 0.5755
 epoch: 81, train_loss: 0.1609, test_loss: 2.4839, test_f1: 0.6023
 epoch: 82, train_loss: 0.1606, test_loss: 2.3910, test_f1: 0.6074
 epoch: 83, train_loss: 0.1707, test_loss: 2.3253, test_f1: 0.5701
 epoch: 84, train_loss: 0.1597, test_loss: 2.4135, test_f1: 0.6094
 epoch: 85, train_loss: 0.1465, test_loss: 2.5253, test_f1: 0.6019
 epoch: 86, train_loss: 0.1359, test_loss: 2.5700, test_f1: 0.6154
 epoch: 87, train_loss: 0.1486, test_loss: 2.4859, test_f1: 0.6102
 epoch: 88, train_loss: 0.1238, test_loss: 2.6199, test_f1: 0.5894
 epoch: 89, train_loss: 0.1345, test_loss: 2.4675, test_f1: 0.5965
 epoch: 90, train_loss: 0.1728, test_loss: 2.3839, test_f1: 0.6210
 epoch: 91, train_loss: 0.1547, test_loss: 2.5289, test_f1: 0.6089
 epoch: 92, train_loss: 0.1355, test_loss: 2.6397, test_f1: 0.6025
 epoch: 93, train_loss: 0.1567, test_loss: 2.6072, test_f1: 0.5970
 epoch: 94, train_loss: 0.1361, test_loss: 2.6275, test_f1: 0.6065
 epoch: 95, train_loss: 0.1209, test_loss: 2.6330, test_f1: 0.5972
 epoch: 96, train_loss: 0.1322, test_loss: 2.5456, test_f1: 0.5947
 epoch: 97, train_loss: 0.1229, test_loss: 2.4272, test_f1: 0.6243
 epoch: 98, train_loss: 0.1318, test_loss: 2.5618, test_f1: 0.6115
 epoch: 99, train_loss: 0.1231, test_loss: 2.6125, test_f1: 0.6025
##################ITERATION #6 ****************************************
 epoch: 0, train_loss: 1.5051, test_loss: 1.6634, test_f1: 0.1371
 epoch: 1, train_loss: 1.0962, test_loss: 1.2630, test_f1: 0.4323
 epoch: 2, train_loss: 0.9327, test_loss: 1.0640, test_f1: 0.5369
 epoch: 3, train_loss: 0.8642, test_loss: 1.0335, test_f1: 0.5498
 epoch: 4, train_loss: 0.8238, test_loss: 1.0309, test_f1: 0.6007
 epoch: 5, train_loss: 0.7740, test_loss: 1.0604, test_f1: 0.5712
 epoch: 6, train_loss: 0.7643, test_loss: 1.0605, test_f1: 0.6023
 epoch: 7, train_loss: 0.7351, test_loss: 1.1379, test_f1: 0.5750
 epoch: 8, train_loss: 0.7172, test_loss: 1.1674, test_f1: 0.5922
 epoch: 9, train_loss: 0.6830, test_loss: 1.1189, test_f1: 0.5694
 epoch: 10, train_loss: 0.6843, test_loss: 1.0851, test_f1: 0.6011
 epoch: 11, train_loss: 0.6647, test_loss: 1.0782, test_f1: 0.5910
 epoch: 12, train_loss: 0.6352, test_loss: 1.1342, test_f1: 0.5983
 epoch: 13, train_loss: 0.6108, test_loss: 1.1882, test_f1: 0.5797
 epoch: 14, train_loss: 0.6050, test_loss: 1.1119, test_f1: 0.6197
 epoch: 15, train_loss: 0.5925, test_loss: 1.2833, test_f1: 0.5918
 epoch: 16, train_loss: 0.5679, test_loss: 1.1241, test_f1: 0.6202
 epoch: 17, train_loss: 0.5698, test_loss: 1.1917, test_f1: 0.6141
 epoch: 18, train_loss: 0.5562, test_loss: 1.2509, test_f1: 0.5683
 epoch: 19, train_loss: 0.5607, test_loss: 1.2617, test_f1: 0.5870
 epoch: 20, train_loss: 0.5230, test_loss: 1.2684, test_f1: 0.6321
 epoch: 21, train_loss: 0.4993, test_loss: 1.2907, test_f1: 0.5998
 epoch: 22, train_loss: 0.5073, test_loss: 1.3665, test_f1: 0.6084
 epoch: 23, train_loss: 0.4958, test_loss: 1.2729, test_f1: 0.6147
 epoch: 24, train_loss: 0.4803, test_loss: 1.4433, test_f1: 0.5941
 epoch: 25, train_loss: 0.4295, test_loss: 1.5105, test_f1: 0.5820
 epoch: 26, train_loss: 0.4964, test_loss: 1.3640, test_f1: 0.6259
 epoch: 27, train_loss: 0.4669, test_loss: 1.2616, test_f1: 0.6730
 epoch: 28, train_loss: 0.4350, test_loss: 1.3334, test_f1: 0.6013
 epoch: 29, train_loss: 0.4104, test_loss: 1.4458, test_f1: 0.6044
 epoch: 30, train_loss: 0.4304, test_loss: 1.4418, test_f1: 0.6176
 epoch: 31, train_loss: 0.4254, test_loss: 1.4655, test_f1: 0.6268
 epoch: 32, train_loss: 0.4030, test_loss: 1.4907, test_f1: 0.5798
 epoch: 33, train_loss: 0.3885, test_loss: 1.5209, test_f1: 0.6031
 epoch: 34, train_loss: 0.3677, test_loss: 1.4122, test_f1: 0.6421
 epoch: 35, train_loss: 0.3765, test_loss: 1.4273, test_f1: 0.6353
 epoch: 36, train_loss: 0.3872, test_loss: 1.4169, test_f1: 0.6202
 epoch: 37, train_loss: 0.3656, test_loss: 1.4552, test_f1: 0.6367
 epoch: 38, train_loss: 0.3461, test_loss: 1.5713, test_f1: 0.6053
 epoch: 39, train_loss: 0.3385, test_loss: 1.6180, test_f1: 0.5874
 epoch: 40, train_loss: 0.3389, test_loss: 1.5828, test_f1: 0.6354
 epoch: 41, train_loss: 0.3467, test_loss: 1.7107, test_f1: 0.5854
 epoch: 42, train_loss: 0.3052, test_loss: 1.6554, test_f1: 0.6445
 epoch: 43, train_loss: 0.3312, test_loss: 1.5988, test_f1: 0.6109
 epoch: 44, train_loss: 0.3183, test_loss: 1.6376, test_f1: 0.6504
 epoch: 45, train_loss: 0.3078, test_loss: 1.7362, test_f1: 0.6081
 epoch: 46, train_loss: 0.3059, test_loss: 1.6735, test_f1: 0.5923
 epoch: 47, train_loss: 0.3349, test_loss: 1.5315, test_f1: 0.6085
 epoch: 48, train_loss: 0.2867, test_loss: 1.7852, test_f1: 0.5784
 epoch: 49, train_loss: 0.3183, test_loss: 1.8023, test_f1: 0.6023
 epoch: 50, train_loss: 0.3303, test_loss: 1.7129, test_f1: 0.6748
 epoch: 51, train_loss: 0.2931, test_loss: 1.6747, test_f1: 0.6246
 epoch: 52, train_loss: 0.2458, test_loss: 1.7109, test_f1: 0.6158
 epoch: 53, train_loss: 0.2089, test_loss: 1.7366, test_f1: 0.6375
 epoch: 54, train_loss: 0.2331, test_loss: 1.7848, test_f1: 0.6257
 epoch: 55, train_loss: 0.2312, test_loss: 1.7705, test_f1: 0.6282
 epoch: 56, train_loss: 0.2046, test_loss: 1.7765, test_f1: 0.6133
 epoch: 57, train_loss: 0.2130, test_loss: 1.9247, test_f1: 0.6347
 epoch: 58, train_loss: 0.1899, test_loss: 1.9314, test_f1: 0.6200
 epoch: 59, train_loss: 0.1937, test_loss: 1.8875, test_f1: 0.6120
 epoch: 60, train_loss: 0.1998, test_loss: 1.9755, test_f1: 0.5773
 epoch: 61, train_loss: 0.1728, test_loss: 1.9270, test_f1: 0.6272
 epoch: 62, train_loss: 0.1793, test_loss: 2.0058, test_f1: 0.6126
 epoch: 63, train_loss: 0.1968, test_loss: 1.9911, test_f1: 0.6238
 epoch: 64, train_loss: 0.1979, test_loss: 1.9160, test_f1: 0.5997
 epoch: 65, train_loss: 0.1770, test_loss: 2.0450, test_f1: 0.6003
 epoch: 66, train_loss: 0.1860, test_loss: 2.0044, test_f1: 0.6272
 epoch: 67, train_loss: 0.1595, test_loss: 1.9711, test_f1: 0.6199
 epoch: 68, train_loss: 0.1561, test_loss: 2.0802, test_f1: 0.6061
 epoch: 69, train_loss: 0.1627, test_loss: 1.9488, test_f1: 0.6343
 epoch: 70, train_loss: 0.1709, test_loss: 2.1854, test_f1: 0.5964
 epoch: 71, train_loss: 0.1633, test_loss: 1.9951, test_f1: 0.6412
 epoch: 72, train_loss: 0.1715, test_loss: 2.0607, test_f1: 0.6048
 epoch: 73, train_loss: 0.1695, test_loss: 2.0729, test_f1: 0.6244
 epoch: 74, train_loss: 0.1595, test_loss: 2.1119, test_f1: 0.6310
 epoch: 75, train_loss: 0.1679, test_loss: 2.0796, test_f1: 0.6038
 epoch: 76, train_loss: 0.1503, test_loss: 2.1684, test_f1: 0.5831
 epoch: 77, train_loss: 0.1784, test_loss: 2.1167, test_f1: 0.6429
 epoch: 78, train_loss: 0.1834, test_loss: 2.1026, test_f1: 0.5752
 epoch: 79, train_loss: 0.1720, test_loss: 2.0840, test_f1: 0.6166
 epoch: 80, train_loss: 0.1610, test_loss: 2.0620, test_f1: 0.6114
 epoch: 81, train_loss: 0.1757, test_loss: 2.2095, test_f1: 0.6158
 epoch: 82, train_loss: 0.1651, test_loss: 2.3660, test_f1: 0.6261
 epoch: 83, train_loss: 0.1595, test_loss: 2.3388, test_f1: 0.6012
 epoch: 84, train_loss: 0.1578, test_loss: 2.4458, test_f1: 0.6151
 epoch: 85, train_loss: 0.1329, test_loss: 2.3152, test_f1: 0.5987
 epoch: 86, train_loss: 0.1329, test_loss: 2.2350, test_f1: 0.6179
 epoch: 87, train_loss: 0.1360, test_loss: 2.4122, test_f1: 0.5969
 epoch: 88, train_loss: 0.1325, test_loss: 2.3285, test_f1: 0.6118
 epoch: 89, train_loss: 0.1494, test_loss: 2.3670, test_f1: 0.5904
 epoch: 90, train_loss: 0.1228, test_loss: 2.3341, test_f1: 0.6195
 epoch: 91, train_loss: 0.1182, test_loss: 2.2006, test_f1: 0.6300
 epoch: 92, train_loss: 0.1290, test_loss: 2.5367, test_f1: 0.5774
 epoch: 93, train_loss: 0.1320, test_loss: 2.3796, test_f1: 0.6234
 epoch: 94, train_loss: 0.1216, test_loss: 2.4455, test_f1: 0.6456
 epoch: 95, train_loss: 0.1035, test_loss: 2.4656, test_f1: 0.6285
 epoch: 96, train_loss: 0.1246, test_loss: 2.4219, test_f1: 0.6119
 epoch: 97, train_loss: 0.1192, test_loss: 2.4268, test_f1: 0.6061
 epoch: 98, train_loss: 0.1209, test_loss: 2.4175, test_f1: 0.6269
 epoch: 99, train_loss: 0.1015, test_loss: 2.6041, test_f1: 0.6029
##################ITERATION #7 ****************************************
 epoch: 0, train_loss: 1.5155, test_loss: 1.9787, test_f1: 0.1523
 epoch: 1, train_loss: 1.0626, test_loss: 1.2998, test_f1: 0.4590
 epoch: 2, train_loss: 0.9358, test_loss: 1.1352, test_f1: 0.5612
 epoch: 3, train_loss: 0.9200, test_loss: 1.1130, test_f1: 0.5621
 epoch: 4, train_loss: 0.8568, test_loss: 1.1077, test_f1: 0.5746
 epoch: 5, train_loss: 0.8164, test_loss: 1.0857, test_f1: 0.6371
 epoch: 6, train_loss: 0.7916, test_loss: 1.1150, test_f1: 0.6303
 epoch: 7, train_loss: 0.7798, test_loss: 1.0855, test_f1: 0.5996
 epoch: 8, train_loss: 0.7397, test_loss: 1.0610, test_f1: 0.6283
 epoch: 9, train_loss: 0.7442, test_loss: 1.0738, test_f1: 0.6185
 epoch: 10, train_loss: 0.7301, test_loss: 1.0365, test_f1: 0.5945
 epoch: 11, train_loss: 0.6991, test_loss: 1.1043, test_f1: 0.5657
 epoch: 12, train_loss: 0.6845, test_loss: 1.1859, test_f1: 0.5255
 epoch: 13, train_loss: 0.6688, test_loss: 1.1277, test_f1: 0.6066
 epoch: 14, train_loss: 0.6456, test_loss: 1.1776, test_f1: 0.6045
 epoch: 15, train_loss: 0.6329, test_loss: 1.1498, test_f1: 0.5870
 epoch: 16, train_loss: 0.6096, test_loss: 1.1825, test_f1: 0.6096
 epoch: 17, train_loss: 0.5877, test_loss: 1.1962, test_f1: 0.5994
 epoch: 18, train_loss: 0.5855, test_loss: 1.2506, test_f1: 0.5987
 epoch: 19, train_loss: 0.5866, test_loss: 1.2332, test_f1: 0.6305
 epoch: 20, train_loss: 0.5866, test_loss: 1.2059, test_f1: 0.5746
 epoch: 21, train_loss: 0.5481, test_loss: 1.2389, test_f1: 0.5918
 epoch: 22, train_loss: 0.5462, test_loss: 1.2224, test_f1: 0.5593
 epoch: 23, train_loss: 0.5226, test_loss: 1.1669, test_f1: 0.6489
 epoch: 24, train_loss: 0.5273, test_loss: 1.5074, test_f1: 0.5725
 epoch: 25, train_loss: 0.5174, test_loss: 1.3354, test_f1: 0.5664
 epoch: 26, train_loss: 0.4766, test_loss: 1.2405, test_f1: 0.6407
 epoch: 27, train_loss: 0.4887, test_loss: 1.3332, test_f1: 0.5606
 epoch: 28, train_loss: 0.4999, test_loss: 1.1658, test_f1: 0.6237
 epoch: 29, train_loss: 0.4639, test_loss: 1.2667, test_f1: 0.6198
 epoch: 30, train_loss: 0.4617, test_loss: 1.3756, test_f1: 0.5822
 epoch: 31, train_loss: 0.4467, test_loss: 1.4098, test_f1: 0.6066
 epoch: 32, train_loss: 0.4400, test_loss: 1.3801, test_f1: 0.6006
 epoch: 33, train_loss: 0.3902, test_loss: 1.4266, test_f1: 0.6527
 epoch: 34, train_loss: 0.4297, test_loss: 1.3573, test_f1: 0.5873
 epoch: 35, train_loss: 0.4238, test_loss: 1.4305, test_f1: 0.6056
 epoch: 36, train_loss: 0.3789, test_loss: 1.4691, test_f1: 0.6293
 epoch: 37, train_loss: 0.4195, test_loss: 1.4012, test_f1: 0.6360
 epoch: 38, train_loss: 0.3966, test_loss: 1.5587, test_f1: 0.6121
 epoch: 39, train_loss: 0.3799, test_loss: 1.6150, test_f1: 0.6013
 epoch: 40, train_loss: 0.3665, test_loss: 1.6513, test_f1: 0.5706
 epoch: 41, train_loss: 0.3343, test_loss: 1.4491, test_f1: 0.6225
 epoch: 42, train_loss: 0.3351, test_loss: 1.7172, test_f1: 0.5744
 epoch: 43, train_loss: 0.3427, test_loss: 1.4806, test_f1: 0.6370
 epoch: 44, train_loss: 0.3765, test_loss: 1.9203, test_f1: 0.5855
 epoch: 45, train_loss: 0.3329, test_loss: 1.7152, test_f1: 0.6000
 epoch: 46, train_loss: 0.3329, test_loss: 1.6121, test_f1: 0.6082
 epoch: 47, train_loss: 0.3345, test_loss: 1.6391, test_f1: 0.6325
 epoch: 48, train_loss: 0.3529, test_loss: 1.7397, test_f1: 0.6131
 epoch: 49, train_loss: 0.3395, test_loss: 1.6786, test_f1: 0.6146
 epoch: 50, train_loss: 0.3138, test_loss: 1.7309, test_f1: 0.6068
 epoch: 51, train_loss: 0.2826, test_loss: 1.7126, test_f1: 0.6005
 epoch: 52, train_loss: 0.2560, test_loss: 1.7439, test_f1: 0.6222
 epoch: 53, train_loss: 0.2322, test_loss: 1.8072, test_f1: 0.6043
 epoch: 54, train_loss: 0.2312, test_loss: 1.6922, test_f1: 0.6461
 epoch: 55, train_loss: 0.2116, test_loss: 1.6959, test_f1: 0.6312
 epoch: 56, train_loss: 0.2394, test_loss: 1.6882, test_f1: 0.6427
 epoch: 57, train_loss: 0.2238, test_loss: 1.7600, test_f1: 0.6043
 epoch: 58, train_loss: 0.2157, test_loss: 1.6025, test_f1: 0.6318
 epoch: 59, train_loss: 0.2092, test_loss: 1.7412, test_f1: 0.6535
 epoch: 60, train_loss: 0.1913, test_loss: 1.7121, test_f1: 0.6417
 epoch: 61, train_loss: 0.1857, test_loss: 1.8470, test_f1: 0.6152
 epoch: 62, train_loss: 0.2055, test_loss: 1.7995, test_f1: 0.6643
 epoch: 63, train_loss: 0.2000, test_loss: 1.7401, test_f1: 0.6199
 epoch: 64, train_loss: 0.1854, test_loss: 1.8514, test_f1: 0.6250
 epoch: 65, train_loss: 0.1868, test_loss: 1.8107, test_f1: 0.6351
 epoch: 66, train_loss: 0.1607, test_loss: 1.7519, test_f1: 0.6441
 epoch: 67, train_loss: 0.1905, test_loss: 1.7393, test_f1: 0.6379
 epoch: 68, train_loss: 0.1533, test_loss: 1.8395, test_f1: 0.6204
 epoch: 69, train_loss: 0.2107, test_loss: 1.9074, test_f1: 0.6348
 epoch: 70, train_loss: 0.1877, test_loss: 1.9919, test_f1: 0.5834
 epoch: 71, train_loss: 0.1689, test_loss: 1.8849, test_f1: 0.6519
 epoch: 72, train_loss: 0.1880, test_loss: 1.8058, test_f1: 0.6495
 epoch: 73, train_loss: 0.1805, test_loss: 1.9230, test_f1: 0.6491
 epoch: 74, train_loss: 0.1735, test_loss: 1.9250, test_f1: 0.6148
 epoch: 75, train_loss: 0.1629, test_loss: 1.9735, test_f1: 0.6148
 epoch: 76, train_loss: 0.1507, test_loss: 1.9951, test_f1: 0.6246
 epoch: 77, train_loss: 0.1529, test_loss: 1.9101, test_f1: 0.6480
 epoch: 78, train_loss: 0.1501, test_loss: 1.9994, test_f1: 0.6198
 epoch: 79, train_loss: 0.1646, test_loss: 1.9150, test_f1: 0.6144
 epoch: 80, train_loss: 0.1422, test_loss: 2.0512, test_f1: 0.6390
 epoch: 81, train_loss: 0.1312, test_loss: 2.0966, test_f1: 0.6358
 epoch: 82, train_loss: 0.1501, test_loss: 2.0157, test_f1: 0.6349
 epoch: 83, train_loss: 0.1706, test_loss: 1.9969, test_f1: 0.6228
 epoch: 84, train_loss: 0.1462, test_loss: 1.9305, test_f1: 0.6641
 epoch: 85, train_loss: 0.1641, test_loss: 2.0040, test_f1: 0.6467
 epoch: 86, train_loss: 0.1659, test_loss: 2.0246, test_f1: 0.6379
 epoch: 87, train_loss: 0.1315, test_loss: 2.0479, test_f1: 0.6085
 epoch: 88, train_loss: 0.1624, test_loss: 1.8430, test_f1: 0.6434
 epoch: 89, train_loss: 0.1545, test_loss: 2.0692, test_f1: 0.6473
 epoch: 90, train_loss: 0.1546, test_loss: 2.1350, test_f1: 0.6348
 epoch: 91, train_loss: 0.1567, test_loss: 1.9882, test_f1: 0.6154
 epoch: 92, train_loss: 0.1585, test_loss: 2.0172, test_f1: 0.6278
 epoch: 93, train_loss: 0.1330, test_loss: 2.2306, test_f1: 0.6452
 epoch: 94, train_loss: 0.1295, test_loss: 1.9684, test_f1: 0.6251
 epoch: 95, train_loss: 0.1342, test_loss: 2.0215, test_f1: 0.6335
 epoch: 96, train_loss: 0.1682, test_loss: 2.1570, test_f1: 0.6264
 epoch: 97, train_loss: 0.1575, test_loss: 2.0685, test_f1: 0.6200
 epoch: 98, train_loss: 0.1242, test_loss: 2.1724, test_f1: 0.6299
 epoch: 99, train_loss: 0.1499, test_loss: 1.9989, test_f1: 0.6248
##################ITERATION #8 ****************************************
 epoch: 0, train_loss: 1.6716, test_loss: 1.8932, test_f1: 0.1365
 epoch: 1, train_loss: 1.1525, test_loss: 1.2126, test_f1: 0.5007
 epoch: 2, train_loss: 0.9727, test_loss: 1.1381, test_f1: 0.5801
 epoch: 3, train_loss: 0.9106, test_loss: 1.0883, test_f1: 0.5852
 epoch: 4, train_loss: 0.8546, test_loss: 1.1137, test_f1: 0.5608
 epoch: 5, train_loss: 0.8007, test_loss: 1.0970, test_f1: 0.5817
 epoch: 6, train_loss: 0.7910, test_loss: 1.0860, test_f1: 0.5783
 epoch: 7, train_loss: 0.7899, test_loss: 1.1177, test_f1: 0.5774
 epoch: 8, train_loss: 0.7526, test_loss: 1.1474, test_f1: 0.5436
 epoch: 9, train_loss: 0.6958, test_loss: 1.0917, test_f1: 0.6258
 epoch: 10, train_loss: 0.7245, test_loss: 1.1855, test_f1: 0.5474
 epoch: 11, train_loss: 0.6901, test_loss: 1.1157, test_f1: 0.6127
 epoch: 12, train_loss: 0.6670, test_loss: 1.1630, test_f1: 0.6184
 epoch: 13, train_loss: 0.6397, test_loss: 1.2059, test_f1: 0.5510
 epoch: 14, train_loss: 0.6309, test_loss: 1.1648, test_f1: 0.6254
 epoch: 15, train_loss: 0.6137, test_loss: 1.1153, test_f1: 0.6057
 epoch: 16, train_loss: 0.5956, test_loss: 1.2426, test_f1: 0.5592
 epoch: 17, train_loss: 0.6192, test_loss: 1.2980, test_f1: 0.6142
 epoch: 18, train_loss: 0.5909, test_loss: 1.3312, test_f1: 0.5775
 epoch: 19, train_loss: 0.5745, test_loss: 1.2171, test_f1: 0.6419
 epoch: 20, train_loss: 0.5681, test_loss: 1.2896, test_f1: 0.6059
 epoch: 21, train_loss: 0.5579, test_loss: 1.2412, test_f1: 0.6248
 epoch: 22, train_loss: 0.5295, test_loss: 1.2415, test_f1: 0.6351
 epoch: 23, train_loss: 0.5251, test_loss: 1.2468, test_f1: 0.6336
 epoch: 24, train_loss: 0.5211, test_loss: 1.3009, test_f1: 0.5707
 epoch: 25, train_loss: 0.5076, test_loss: 1.4400, test_f1: 0.5836
 epoch: 26, train_loss: 0.4970, test_loss: 1.3562, test_f1: 0.6141
 epoch: 27, train_loss: 0.5238, test_loss: 1.5492, test_f1: 0.5562
 epoch: 28, train_loss: 0.4941, test_loss: 1.4474, test_f1: 0.5632
 epoch: 29, train_loss: 0.5138, test_loss: 1.4134, test_f1: 0.6151
 epoch: 30, train_loss: 0.4690, test_loss: 1.4789, test_f1: 0.5673
 epoch: 31, train_loss: 0.4379, test_loss: 1.4015, test_f1: 0.6114
 epoch: 32, train_loss: 0.4633, test_loss: 1.5440, test_f1: 0.5989
 epoch: 33, train_loss: 0.4454, test_loss: 1.4881, test_f1: 0.6179
 epoch: 34, train_loss: 0.4307, test_loss: 1.4766, test_f1: 0.6572
 epoch: 35, train_loss: 0.3941, test_loss: 1.6645, test_f1: 0.6211
 epoch: 36, train_loss: 0.4187, test_loss: 1.6105, test_f1: 0.5741
 epoch: 37, train_loss: 0.3998, test_loss: 1.5904, test_f1: 0.6032
 epoch: 38, train_loss: 0.4031, test_loss: 1.5601, test_f1: 0.5973
 epoch: 39, train_loss: 0.3736, test_loss: 1.4464, test_f1: 0.6177
 epoch: 40, train_loss: 0.3787, test_loss: 1.5769, test_f1: 0.6244
 epoch: 41, train_loss: 0.3811, test_loss: 1.5147, test_f1: 0.5886
 epoch: 42, train_loss: 0.3796, test_loss: 1.7034, test_f1: 0.5834
 epoch: 43, train_loss: 0.3936, test_loss: 1.5203, test_f1: 0.6103
 epoch: 44, train_loss: 0.3613, test_loss: 1.5932, test_f1: 0.5927
 epoch: 45, train_loss: 0.3441, test_loss: 1.5458, test_f1: 0.6236
 epoch: 46, train_loss: 0.3455, test_loss: 1.7746, test_f1: 0.6217
 epoch: 47, train_loss: 0.3673, test_loss: 1.5222, test_f1: 0.6376
 epoch: 48, train_loss: 0.3445, test_loss: 1.6011, test_f1: 0.6071
 epoch: 49, train_loss: 0.3294, test_loss: 1.6454, test_f1: 0.6235
 epoch: 50, train_loss: 0.3285, test_loss: 1.7055, test_f1: 0.6418
 epoch: 51, train_loss: 0.3020, test_loss: 1.6681, test_f1: 0.6320
 epoch: 52, train_loss: 0.2672, test_loss: 1.7418, test_f1: 0.6267
 epoch: 53, train_loss: 0.2694, test_loss: 1.7409, test_f1: 0.6056
 epoch: 54, train_loss: 0.2384, test_loss: 1.7437, test_f1: 0.6175
 epoch: 55, train_loss: 0.2253, test_loss: 1.8492, test_f1: 0.6053
 epoch: 56, train_loss: 0.2361, test_loss: 1.8519, test_f1: 0.6131
 epoch: 57, train_loss: 0.2122, test_loss: 1.8355, test_f1: 0.6196
 epoch: 58, train_loss: 0.2205, test_loss: 1.7920, test_f1: 0.6423
 epoch: 59, train_loss: 0.2225, test_loss: 1.9045, test_f1: 0.6008
 epoch: 60, train_loss: 0.2284, test_loss: 1.9757, test_f1: 0.6349
 epoch: 61, train_loss: 0.2181, test_loss: 1.8807, test_f1: 0.6373
 epoch: 62, train_loss: 0.2241, test_loss: 1.9062, test_f1: 0.6220
 epoch: 63, train_loss: 0.1988, test_loss: 2.0225, test_f1: 0.5988
 epoch: 64, train_loss: 0.2014, test_loss: 1.9943, test_f1: 0.5889
 epoch: 65, train_loss: 0.2039, test_loss: 1.9600, test_f1: 0.6082
 epoch: 66, train_loss: 0.1744, test_loss: 2.1197, test_f1: 0.6084
 epoch: 67, train_loss: 0.2127, test_loss: 1.9830, test_f1: 0.6088
 epoch: 68, train_loss: 0.2097, test_loss: 2.0877, test_f1: 0.5979
 epoch: 69, train_loss: 0.1637, test_loss: 2.0367, test_f1: 0.5951
 epoch: 70, train_loss: 0.2024, test_loss: 2.1341, test_f1: 0.5900
 epoch: 71, train_loss: 0.1765, test_loss: 2.1845, test_f1: 0.6161
 epoch: 72, train_loss: 0.1949, test_loss: 2.1781, test_f1: 0.6076
 epoch: 73, train_loss: 0.1883, test_loss: 2.2175, test_f1: 0.5740
 epoch: 74, train_loss: 0.1791, test_loss: 2.0668, test_f1: 0.6138
 epoch: 75, train_loss: 0.1693, test_loss: 2.1769, test_f1: 0.6168
 epoch: 76, train_loss: 0.1655, test_loss: 2.1429, test_f1: 0.6066
 epoch: 77, train_loss: 0.1499, test_loss: 2.1387, test_f1: 0.6111
 epoch: 78, train_loss: 0.1920, test_loss: 2.2842, test_f1: 0.5871
 epoch: 79, train_loss: 0.1602, test_loss: 2.0900, test_f1: 0.6239
 epoch: 80, train_loss: 0.1520, test_loss: 2.2548, test_f1: 0.5952
 epoch: 81, train_loss: 0.1541, test_loss: 2.1900, test_f1: 0.6447
 epoch: 82, train_loss: 0.1531, test_loss: 2.4428, test_f1: 0.6085
 epoch: 83, train_loss: 0.1608, test_loss: 2.1974, test_f1: 0.5937
 epoch: 84, train_loss: 0.1396, test_loss: 2.2095, test_f1: 0.5927
 epoch: 85, train_loss: 0.1466, test_loss: 2.2231, test_f1: 0.6373
 epoch: 86, train_loss: 0.1524, test_loss: 2.1578, test_f1: 0.6354
 epoch: 87, train_loss: 0.1668, test_loss: 2.2311, test_f1: 0.6183
 epoch: 88, train_loss: 0.1864, test_loss: 2.2470, test_f1: 0.6631
 epoch: 89, train_loss: 0.1674, test_loss: 2.5128, test_f1: 0.5985
 epoch: 90, train_loss: 0.1821, test_loss: 2.1749, test_f1: 0.6005
 epoch: 91, train_loss: 0.1694, test_loss: 2.4321, test_f1: 0.5827
 epoch: 92, train_loss: 0.1699, test_loss: 2.2901, test_f1: 0.6213
 epoch: 93, train_loss: 0.1548, test_loss: 2.4879, test_f1: 0.5925
 epoch: 94, train_loss: 0.1460, test_loss: 2.3121, test_f1: 0.6212
 epoch: 95, train_loss: 0.1317, test_loss: 2.4299, test_f1: 0.6085
 epoch: 96, train_loss: 0.1326, test_loss: 2.2250, test_f1: 0.6235
 epoch: 97, train_loss: 0.1553, test_loss: 2.4612, test_f1: 0.6010
 epoch: 98, train_loss: 0.1461, test_loss: 2.4729, test_f1: 0.5929
 epoch: 99, train_loss: 0.1410, test_loss: 2.2463, test_f1: 0.6422
##################ITERATION #9 ****************************************
 epoch: 0, train_loss: 1.7895, test_loss: 1.8032, test_f1: 0.2935
 epoch: 1, train_loss: 1.1041, test_loss: 1.2518, test_f1: 0.4587
 epoch: 2, train_loss: 0.9646, test_loss: 1.1582, test_f1: 0.5151
 epoch: 3, train_loss: 0.8930, test_loss: 1.1005, test_f1: 0.6044
 epoch: 4, train_loss: 0.8293, test_loss: 1.1195, test_f1: 0.5903
 epoch: 5, train_loss: 0.8121, test_loss: 1.1076, test_f1: 0.5832
 epoch: 6, train_loss: 0.7877, test_loss: 1.1896, test_f1: 0.5171
 epoch: 7, train_loss: 0.7530, test_loss: 1.1640, test_f1: 0.5522
 epoch: 8, train_loss: 0.7551, test_loss: 1.1528, test_f1: 0.5377
 epoch: 9, train_loss: 0.7313, test_loss: 1.2644, test_f1: 0.5454
 epoch: 10, train_loss: 0.7197, test_loss: 1.1590, test_f1: 0.5875
 epoch: 11, train_loss: 0.6743, test_loss: 1.1683, test_f1: 0.5787
 epoch: 12, train_loss: 0.6509, test_loss: 1.2011, test_f1: 0.6067
 epoch: 13, train_loss: 0.6499, test_loss: 1.2303, test_f1: 0.5705
 epoch: 14, train_loss: 0.6459, test_loss: 1.2608, test_f1: 0.5313
 epoch: 15, train_loss: 0.6282, test_loss: 1.3017, test_f1: 0.5608
 epoch: 16, train_loss: 0.6137, test_loss: 1.1776, test_f1: 0.6595
 epoch: 17, train_loss: 0.6098, test_loss: 1.2815, test_f1: 0.6392
 epoch: 18, train_loss: 0.5451, test_loss: 1.3814, test_f1: 0.5979
 epoch: 19, train_loss: 0.5891, test_loss: 1.3482, test_f1: 0.5594
 epoch: 20, train_loss: 0.5694, test_loss: 1.3717, test_f1: 0.5980
 epoch: 21, train_loss: 0.5389, test_loss: 1.3587, test_f1: 0.5712
 epoch: 22, train_loss: 0.5294, test_loss: 1.4480, test_f1: 0.5557
 epoch: 23, train_loss: 0.4936, test_loss: 1.3833, test_f1: 0.5863
 epoch: 24, train_loss: 0.4937, test_loss: 1.4119, test_f1: 0.6445
 epoch: 25, train_loss: 0.5001, test_loss: 1.5109, test_f1: 0.5571
 epoch: 26, train_loss: 0.4826, test_loss: 1.5325, test_f1: 0.5668
 epoch: 27, train_loss: 0.4578, test_loss: 1.5550, test_f1: 0.5832
 epoch: 28, train_loss: 0.4679, test_loss: 1.4511, test_f1: 0.5743
 epoch: 29, train_loss: 0.4899, test_loss: 1.5155, test_f1: 0.5801
 epoch: 30, train_loss: 0.4459, test_loss: 1.5379, test_f1: 0.6325
 epoch: 31, train_loss: 0.4132, test_loss: 1.8544, test_f1: 0.5563
 epoch: 32, train_loss: 0.3844, test_loss: 1.6360, test_f1: 0.6245
 epoch: 33, train_loss: 0.4036, test_loss: 1.6885, test_f1: 0.5842
 epoch: 34, train_loss: 0.4266, test_loss: 1.8563, test_f1: 0.5656
 epoch: 35, train_loss: 0.4121, test_loss: 1.7211, test_f1: 0.6032
 epoch: 36, train_loss: 0.3780, test_loss: 1.5992, test_f1: 0.6574
 epoch: 37, train_loss: 0.3662, test_loss: 1.6391, test_f1: 0.5988
 epoch: 38, train_loss: 0.4250, test_loss: 1.7321, test_f1: 0.5677
 epoch: 39, train_loss: 0.3468, test_loss: 1.7663, test_f1: 0.6016
 epoch: 40, train_loss: 0.3529, test_loss: 1.7925, test_f1: 0.5860
 epoch: 41, train_loss: 0.3376, test_loss: 2.0480, test_f1: 0.5913
 epoch: 42, train_loss: 0.3128, test_loss: 1.8700, test_f1: 0.6090
 epoch: 43, train_loss: 0.3507, test_loss: 2.3030, test_f1: 0.5120
 epoch: 44, train_loss: 0.3871, test_loss: 1.9267, test_f1: 0.5979
 epoch: 45, train_loss: 0.3083, test_loss: 1.8555, test_f1: 0.6232
 epoch: 46, train_loss: 0.3009, test_loss: 1.9012, test_f1: 0.5948
 epoch: 47, train_loss: 0.3504, test_loss: 2.1713, test_f1: 0.5230
 epoch: 48, train_loss: 0.3310, test_loss: 2.0145, test_f1: 0.5829
 epoch: 49, train_loss: 0.3362, test_loss: 1.7985, test_f1: 0.6043
 epoch: 50, train_loss: 0.2891, test_loss: 1.9204, test_f1: 0.6052
 epoch: 51, train_loss: 0.2820, test_loss: 2.1724, test_f1: 0.5726
 epoch: 52, train_loss: 0.2584, test_loss: 2.1231, test_f1: 0.5741
 epoch: 53, train_loss: 0.2354, test_loss: 2.0185, test_f1: 0.5904
 epoch: 54, train_loss: 0.2126, test_loss: 2.0934, test_f1: 0.6168
 epoch: 55, train_loss: 0.1997, test_loss: 2.2766, test_f1: 0.5680
 epoch: 56, train_loss: 0.2373, test_loss: 2.1065, test_f1: 0.5903
 epoch: 57, train_loss: 0.2121, test_loss: 2.2199, test_f1: 0.5941
 epoch: 58, train_loss: 0.1951, test_loss: 2.1725, test_f1: 0.5796
 epoch: 59, train_loss: 0.1938, test_loss: 2.1092, test_f1: 0.6141
 epoch: 60, train_loss: 0.1867, test_loss: 2.1431, test_f1: 0.6262
 epoch: 61, train_loss: 0.1929, test_loss: 2.1988, test_f1: 0.6202
 epoch: 62, train_loss: 0.1880, test_loss: 2.0837, test_f1: 0.6333
 epoch: 63, train_loss: 0.1860, test_loss: 2.2299, test_f1: 0.6100
 epoch: 64, train_loss: 0.1907, test_loss: 2.3074, test_f1: 0.5665
 epoch: 65, train_loss: 0.1970, test_loss: 2.2899, test_f1: 0.5986
 epoch: 66, train_loss: 0.1878, test_loss: 2.4518, test_f1: 0.5803
 epoch: 67, train_loss: 0.2000, test_loss: 2.4259, test_f1: 0.6109
 epoch: 68, train_loss: 0.2016, test_loss: 2.3242, test_f1: 0.5969
 epoch: 69, train_loss: 0.1963, test_loss: 2.2075, test_f1: 0.6064
 epoch: 70, train_loss: 0.1721, test_loss: 2.2081, test_f1: 0.6287
 epoch: 71, train_loss: 0.1709, test_loss: 2.4156, test_f1: 0.5655
 epoch: 72, train_loss: 0.1727, test_loss: 2.3950, test_f1: 0.5821
 epoch: 73, train_loss: 0.1730, test_loss: 2.4828, test_f1: 0.5631
 epoch: 74, train_loss: 0.1932, test_loss: 2.3263, test_f1: 0.6019
 epoch: 75, train_loss: 0.1545, test_loss: 2.5810, test_f1: 0.5830
 epoch: 76, train_loss: 0.1668, test_loss: 2.4411, test_f1: 0.6068
 epoch: 77, train_loss: 0.1708, test_loss: 2.3818, test_f1: 0.6113
 epoch: 78, train_loss: 0.1511, test_loss: 2.2814, test_f1: 0.6291
 epoch: 79, train_loss: 0.1565, test_loss: 2.4221, test_f1: 0.6082
 epoch: 80, train_loss: 0.1765, test_loss: 2.2465, test_f1: 0.6073
 epoch: 81, train_loss: 0.1677, test_loss: 2.3993, test_f1: 0.6220
 epoch: 82, train_loss: 0.1503, test_loss: 2.5476, test_f1: 0.5826
 epoch: 83, train_loss: 0.1547, test_loss: 2.4680, test_f1: 0.5791
 epoch: 84, train_loss: 0.1468, test_loss: 2.3397, test_f1: 0.6095
 epoch: 85, train_loss: 0.1374, test_loss: 2.5045, test_f1: 0.5986
 epoch: 86, train_loss: 0.1556, test_loss: 2.3741, test_f1: 0.6082
 epoch: 87, train_loss: 0.1404, test_loss: 2.4227, test_f1: 0.5883
 epoch: 88, train_loss: 0.1287, test_loss: 2.4293, test_f1: 0.6237
 epoch: 89, train_loss: 0.1444, test_loss: 2.3903, test_f1: 0.6215
 epoch: 90, train_loss: 0.1595, test_loss: 2.4507, test_f1: 0.6441
 epoch: 91, train_loss: 0.1489, test_loss: 2.4343, test_f1: 0.6191
 epoch: 92, train_loss: 0.1354, test_loss: 2.5016, test_f1: 0.6122
 epoch: 93, train_loss: 0.1365, test_loss: 2.4895, test_f1: 0.6050
 epoch: 94, train_loss: 0.1314, test_loss: 2.5429, test_f1: 0.6366
 epoch: 95, train_loss: 0.1543, test_loss: 2.5177, test_f1: 0.6066
 epoch: 96, train_loss: 0.1363, test_loss: 2.3953, test_f1: 0.6325
 epoch: 97, train_loss: 0.1287, test_loss: 2.3816, test_f1: 0.6371
 epoch: 98, train_loss: 0.1271, test_loss: 2.6651, test_f1: 0.5845
 epoch: 99, train_loss: 0.1319, test_loss: 2.4620, test_f1: 0.6023

Training completed in 388.45 seconds
Best F1: 0.7007 at epoch 16
Mean F1 across iterations: 0.6658  0.0162
========================FINAL RESULTS================================
FEGIN weighted F1: 0.7007  0.0162
python main.py --data ltspice_demos --representation component_pin_net --model FEGIN --layers 2 --hiddens 128 --batch_size 64 --lr 0.001 --emb_size 128 --epochs 100 --save_appendix component_pin_net_L2_H128_BS64_LR0.001_E128 --no_val
-----



STDERR:
  File "main.py", line 370, in <module>
    main()
  File "main.py", line 254, in main
    dataset = dataset_class(
  File "/home/philip/projects/ltspice_examples_code_repo/Circuit-Completion-Using-GNNs/component_classification_with_link_prediction_head/evaluation/FEGIN/kernel/circuit_datasets.py", line 15, in __init__
    self.data, self.slices = torch.load(self.processed_paths[0])
  File "/home/philip/.local/lib/python3.8/site-packages/torch/serialization.py", line 1040, in load
    warnings.warn(
  File "/usr/lib/python3.8/warnings.py", line 109, in _showwarnmsg
    sw(msg.message, msg.category, msg.filename, msg.lineno,
  File "main.py", line 47, in warn_with_traceback
    traceback.print_stack(file=log)
/home/philip/projects/ltspice_examples_code_repo/Circuit-Completion-Using-GNNs/component_classification_with_link_prediction_head/evaluation/FEGIN/kernel/circuit_datasets.py:15: FutureWarning: You are using `torch.load` with `weights_only=False` (the current default value), which uses the default pickle module implicitly. It is possible to construct malicious pickle data which will execute arbitrary code during unpickling (See https://github.com/pytorch/pytorch/blob/main/SECURITY.md#untrusted-models for more details). In a future release, the default value for `weights_only` will be flipped to `True`. This limits the functions that could be executed during unpickling. Arbitrary objects will no longer be allowed to be loaded via this mode unless they are explicitly allowlisted by the user via `torch.serialization.add_safe_globals`. We recommend you start setting `weights_only=True` for any use case where you don't have full control of the loaded file. Please open an issue on GitHub for any issues related to this experimental feature.
  self.data, self.slices = torch.load(self.processed_paths[0])
