STDOUT:
Results will be saved in /home/philip/projects/ltspice_examples_code_repo/Circuit-Completion-Using-GNNs/component_classification_with_link_prediction_head/evaluation/FEGIN/results/model_FEGIN_dataset_ltspice_demos
Command line input: python main.py --data ltspice_demos --representation component_pin --model FEGIN --layers 6 --hiddens 64 --batch_size 64 --lr 0.01 --emb_size 250 --epochs 100 --save_appendix component_pin_L6_H64_BS64_LR0.01_E250 --no_val
 is saved.
-----
ltspice_demos - FEGIN
Using 6 layers, 64 hidden units, h = 2
Loading component_pin representation dataset
ENTERED
Training FEGIN on component_pin representation
Train: 1565, Test: 383
##################ITERATION #0 ****************************************
 epoch: 0, train_loss: 1.2304, test_loss: 1.4872, test_f1: 0.2904
 epoch: 1, train_loss: 1.0480, test_loss: 1.0488, test_f1: 0.5293
 epoch: 2, train_loss: 0.9658, test_loss: 1.0378, test_f1: 0.5487
 epoch: 3, train_loss: 0.9236, test_loss: 1.0344, test_f1: 0.4515
 epoch: 4, train_loss: 0.8762, test_loss: 1.1825, test_f1: 0.4850
 epoch: 5, train_loss: 0.8400, test_loss: 1.4803, test_f1: 0.4649
 epoch: 6, train_loss: 0.8531, test_loss: 0.9882, test_f1: 0.5199
 epoch: 7, train_loss: 0.8446, test_loss: 1.0583, test_f1: 0.5486
 epoch: 8, train_loss: 0.8217, test_loss: 1.0948, test_f1: 0.5021
 epoch: 9, train_loss: 0.8009, test_loss: 1.1985, test_f1: 0.4997
 epoch: 10, train_loss: 0.7735, test_loss: 1.0371, test_f1: 0.4767
 epoch: 11, train_loss: 0.7606, test_loss: 1.0907, test_f1: 0.5880
 epoch: 12, train_loss: 0.7950, test_loss: 1.1477, test_f1: 0.4363
 epoch: 13, train_loss: 0.7503, test_loss: 1.3378, test_f1: 0.5593
 epoch: 14, train_loss: 0.7834, test_loss: 1.1204, test_f1: 0.4619
 epoch: 15, train_loss: 0.7548, test_loss: 1.1408, test_f1: 0.5195
 epoch: 16, train_loss: 0.7233, test_loss: 1.3564, test_f1: 0.4525
 epoch: 17, train_loss: 0.7160, test_loss: 1.1495, test_f1: 0.5577
 epoch: 18, train_loss: 0.7225, test_loss: 1.2184, test_f1: 0.5632
 epoch: 19, train_loss: 0.6921, test_loss: 1.0118, test_f1: 0.6396
 epoch: 20, train_loss: 0.7068, test_loss: 1.0763, test_f1: 0.6133
 epoch: 21, train_loss: 0.6523, test_loss: 1.0937, test_f1: 0.6035
 epoch: 22, train_loss: 0.6819, test_loss: 1.0339, test_f1: 0.6115
 epoch: 23, train_loss: 0.6353, test_loss: 1.6011, test_f1: 0.4479
 epoch: 24, train_loss: 0.6583, test_loss: 3.7355, test_f1: 0.3167
 epoch: 25, train_loss: 0.6795, test_loss: 1.3037, test_f1: 0.5736
 epoch: 26, train_loss: 0.6876, test_loss: 1.7060, test_f1: 0.4967
 epoch: 27, train_loss: 0.6404, test_loss: 1.0682, test_f1: 0.6396
 epoch: 28, train_loss: 0.6222, test_loss: 1.0637, test_f1: 0.6469
 epoch: 29, train_loss: 0.6103, test_loss: 1.1630, test_f1: 0.5892
 epoch: 30, train_loss: 0.5956, test_loss: 1.3437, test_f1: 0.5705
 epoch: 31, train_loss: 0.5831, test_loss: 1.0827, test_f1: 0.5798
 epoch: 32, train_loss: 0.5777, test_loss: 1.6471, test_f1: 0.5943
 epoch: 33, train_loss: 0.6515, test_loss: 1.0980, test_f1: 0.5567
 epoch: 34, train_loss: 0.5901, test_loss: 1.4902, test_f1: 0.5423
 epoch: 35, train_loss: 0.5800, test_loss: 1.2528, test_f1: 0.6465
 epoch: 36, train_loss: 0.5556, test_loss: 1.4487, test_f1: 0.6188
 epoch: 37, train_loss: 0.5644, test_loss: 1.2442, test_f1: 0.6503
 epoch: 38, train_loss: 0.5683, test_loss: 1.7777, test_f1: 0.6282
 epoch: 39, train_loss: 0.5422, test_loss: 1.1401, test_f1: 0.5886
 epoch: 40, train_loss: 0.5398, test_loss: 1.6458, test_f1: 0.6347
 epoch: 41, train_loss: 0.5334, test_loss: 1.2129, test_f1: 0.6509
 epoch: 42, train_loss: 0.5471, test_loss: 1.2977, test_f1: 0.6167
 epoch: 43, train_loss: 0.5417, test_loss: 1.2180, test_f1: 0.5879
 epoch: 44, train_loss: 0.5164, test_loss: 1.2708, test_f1: 0.6316
 epoch: 45, train_loss: 0.5145, test_loss: 1.6630, test_f1: 0.5855
 epoch: 46, train_loss: 0.4960, test_loss: 1.4013, test_f1: 0.5606
 epoch: 47, train_loss: 0.5417, test_loss: 1.2199, test_f1: 0.6281
 epoch: 48, train_loss: 0.4731, test_loss: 1.6452, test_f1: 0.5830
 epoch: 49, train_loss: 0.4999, test_loss: 1.5226, test_f1: 0.5474
 epoch: 50, train_loss: 0.5154, test_loss: 1.6757, test_f1: 0.5396
 epoch: 51, train_loss: 0.4763, test_loss: 1.5820, test_f1: 0.6561
 epoch: 52, train_loss: 0.4215, test_loss: 1.7112, test_f1: 0.6114
 epoch: 53, train_loss: 0.4326, test_loss: 1.6840, test_f1: 0.5953
 epoch: 54, train_loss: 0.4279, test_loss: 1.5092, test_f1: 0.6220
 epoch: 55, train_loss: 0.3956, test_loss: 2.0172, test_f1: 0.6206
 epoch: 56, train_loss: 0.4324, test_loss: 1.8062, test_f1: 0.6060
 epoch: 57, train_loss: 0.3934, test_loss: 1.7009, test_f1: 0.6614
 epoch: 58, train_loss: 0.3783, test_loss: 1.8906, test_f1: 0.6584
 epoch: 59, train_loss: 0.3607, test_loss: 1.7706, test_f1: 0.6717
 epoch: 60, train_loss: 0.3752, test_loss: 2.6407, test_f1: 0.6313
 epoch: 61, train_loss: 0.4180, test_loss: 1.6369, test_f1: 0.6296
 epoch: 62, train_loss: 0.4092, test_loss: 2.0438, test_f1: 0.6113
 epoch: 63, train_loss: 0.3806, test_loss: 1.9684, test_f1: 0.6130
 epoch: 64, train_loss: 0.3536, test_loss: 2.0741, test_f1: 0.6424
 epoch: 65, train_loss: 0.3464, test_loss: 2.1554, test_f1: 0.6114
 epoch: 66, train_loss: 0.3466, test_loss: 1.7611, test_f1: 0.6514
 epoch: 67, train_loss: 0.3324, test_loss: 1.9433, test_f1: 0.6173
 epoch: 68, train_loss: 0.3097, test_loss: 2.2507, test_f1: 0.6271
 epoch: 69, train_loss: 0.3119, test_loss: 2.0274, test_f1: 0.6265
 epoch: 70, train_loss: 0.3522, test_loss: 2.4826, test_f1: 0.6259
 epoch: 71, train_loss: 0.3422, test_loss: 2.1361, test_f1: 0.6273
 epoch: 72, train_loss: 0.3696, test_loss: 2.3059, test_f1: 0.6136
 epoch: 73, train_loss: 0.3378, test_loss: 2.3672, test_f1: 0.5849
 epoch: 74, train_loss: 0.3439, test_loss: 2.5521, test_f1: 0.6330
 epoch: 75, train_loss: 0.3345, test_loss: 1.9966, test_f1: 0.6435
 epoch: 76, train_loss: 0.2951, test_loss: 2.4448, test_f1: 0.5767
 epoch: 77, train_loss: 0.3124, test_loss: 2.5636, test_f1: 0.6258
 epoch: 78, train_loss: 0.3056, test_loss: 2.3052, test_f1: 0.6518
 epoch: 79, train_loss: 0.3031, test_loss: 2.3371, test_f1: 0.6158
 epoch: 80, train_loss: 0.3120, test_loss: 2.6685, test_f1: 0.6314
 epoch: 81, train_loss: 0.2720, test_loss: 2.5141, test_f1: 0.6325
 epoch: 82, train_loss: 0.3000, test_loss: 2.1007, test_f1: 0.6415
 epoch: 83, train_loss: 0.2707, test_loss: 2.5999, test_f1: 0.6261
 epoch: 84, train_loss: 0.2679, test_loss: 2.7277, test_f1: 0.6242
 epoch: 85, train_loss: 0.2480, test_loss: 2.9557, test_f1: 0.5919
 epoch: 86, train_loss: 0.2857, test_loss: 2.5530, test_f1: 0.6222
 epoch: 87, train_loss: 0.2766, test_loss: 2.8495, test_f1: 0.6392
 epoch: 88, train_loss: 0.2624, test_loss: 3.1435, test_f1: 0.5580
 epoch: 89, train_loss: 0.2595, test_loss: 2.4918, test_f1: 0.6349
 epoch: 90, train_loss: 0.2574, test_loss: 2.5603, test_f1: 0.6294
 epoch: 91, train_loss: 0.2752, test_loss: 3.2001, test_f1: 0.5392
 epoch: 92, train_loss: 0.2804, test_loss: 2.6569, test_f1: 0.6274
 epoch: 93, train_loss: 0.2490, test_loss: 2.6315, test_f1: 0.6082
 epoch: 94, train_loss: 0.2424, test_loss: 3.2459, test_f1: 0.6090
 epoch: 95, train_loss: 0.2260, test_loss: 2.1758, test_f1: 0.6502
 epoch: 96, train_loss: 0.2821, test_loss: 2.3365, test_f1: 0.6772
 epoch: 97, train_loss: 0.2765, test_loss: 2.1855, test_f1: 0.6443
 epoch: 98, train_loss: 0.2455, test_loss: 2.2697, test_f1: 0.6295
 epoch: 99, train_loss: 0.2576, test_loss: 2.4122, test_f1: 0.6449
##################ITERATION #1 ****************************************
 epoch: 0, train_loss: 1.1822, test_loss: 1.3599, test_f1: 0.3235
 epoch: 1, train_loss: 0.9917, test_loss: 1.0815, test_f1: 0.4712
 epoch: 2, train_loss: 0.9259, test_loss: 0.9830, test_f1: 0.5569
 epoch: 3, train_loss: 0.9051, test_loss: 1.0895, test_f1: 0.4719
 epoch: 4, train_loss: 0.9009, test_loss: 0.9794, test_f1: 0.4788
 epoch: 5, train_loss: 0.8170, test_loss: 1.0967, test_f1: 0.5003
 epoch: 6, train_loss: 0.8189, test_loss: 0.9890, test_f1: 0.5788
 epoch: 7, train_loss: 0.7927, test_loss: 1.1785, test_f1: 0.5861
 epoch: 8, train_loss: 0.8438, test_loss: 1.0375, test_f1: 0.4567
 epoch: 9, train_loss: 0.7709, test_loss: 1.0013, test_f1: 0.5454
 epoch: 10, train_loss: 0.7656, test_loss: 1.3781, test_f1: 0.4492
 epoch: 11, train_loss: 0.7846, test_loss: 0.9972, test_f1: 0.5918
 epoch: 12, train_loss: 0.7643, test_loss: 1.0200, test_f1: 0.5907
 epoch: 13, train_loss: 0.7558, test_loss: 1.4253, test_f1: 0.4731
 epoch: 14, train_loss: 0.7571, test_loss: 1.1792, test_f1: 0.5478
 epoch: 15, train_loss: 0.7201, test_loss: 0.9237, test_f1: 0.5707
 epoch: 16, train_loss: 0.7577, test_loss: 1.1017, test_f1: 0.4764
 epoch: 17, train_loss: 0.7520, test_loss: 1.2022, test_f1: 0.5089
 epoch: 18, train_loss: 0.7231, test_loss: 1.0090, test_f1: 0.5948
 epoch: 19, train_loss: 0.7114, test_loss: 0.9686, test_f1: 0.5326
 epoch: 20, train_loss: 0.7397, test_loss: 0.9819, test_f1: 0.6046
 epoch: 21, train_loss: 0.7248, test_loss: 0.9646, test_f1: 0.6190
 epoch: 22, train_loss: 0.7063, test_loss: 1.1602, test_f1: 0.5648
 epoch: 23, train_loss: 0.6933, test_loss: 1.0017, test_f1: 0.6403
 epoch: 24, train_loss: 0.6727, test_loss: 1.2022, test_f1: 0.5373
 epoch: 25, train_loss: 0.6989, test_loss: 1.2081, test_f1: 0.4984
 epoch: 26, train_loss: 0.6929, test_loss: 1.1829, test_f1: 0.5442
 epoch: 27, train_loss: 0.6935, test_loss: 1.1401, test_f1: 0.5993
 epoch: 28, train_loss: 0.6582, test_loss: 1.2166, test_f1: 0.5706
 epoch: 29, train_loss: 0.6493, test_loss: 0.9584, test_f1: 0.6413
 epoch: 30, train_loss: 0.6373, test_loss: 1.1973, test_f1: 0.5466
 epoch: 31, train_loss: 0.6476, test_loss: 1.2325, test_f1: 0.5634
 epoch: 32, train_loss: 0.6667, test_loss: 1.1412, test_f1: 0.5615
 epoch: 33, train_loss: 0.6289, test_loss: 1.0176, test_f1: 0.6364
 epoch: 34, train_loss: 0.6128, test_loss: 0.9745, test_f1: 0.6353
 epoch: 35, train_loss: 0.5814, test_loss: 1.0469, test_f1: 0.6244
 epoch: 36, train_loss: 0.6076, test_loss: 0.9998, test_f1: 0.6060
 epoch: 37, train_loss: 0.5986, test_loss: 1.0788, test_f1: 0.6512
 epoch: 38, train_loss: 0.6023, test_loss: 1.0745, test_f1: 0.6155
 epoch: 39, train_loss: 0.6020, test_loss: 1.3817, test_f1: 0.5084
 epoch: 40, train_loss: 0.5922, test_loss: 1.0582, test_f1: 0.6335
 epoch: 41, train_loss: 0.6031, test_loss: 1.2228, test_f1: 0.5967
 epoch: 42, train_loss: 0.5796, test_loss: 1.0561, test_f1: 0.5321
 epoch: 43, train_loss: 0.5735, test_loss: 1.1164, test_f1: 0.6303
 epoch: 44, train_loss: 0.5728, test_loss: 1.2340, test_f1: 0.6548
 epoch: 45, train_loss: 0.5588, test_loss: 1.1058, test_f1: 0.6043
 epoch: 46, train_loss: 0.5445, test_loss: 1.1760, test_f1: 0.6512
 epoch: 47, train_loss: 0.5426, test_loss: 1.2599, test_f1: 0.5934
 epoch: 48, train_loss: 0.5592, test_loss: 1.2324, test_f1: 0.5604
 epoch: 49, train_loss: 0.5770, test_loss: 1.1431, test_f1: 0.6574
 epoch: 50, train_loss: 0.5449, test_loss: 1.3429, test_f1: 0.5187
 epoch: 51, train_loss: 0.4860, test_loss: 1.1585, test_f1: 0.6626
 epoch: 52, train_loss: 0.4726, test_loss: 1.3369, test_f1: 0.6061
 epoch: 53, train_loss: 0.4478, test_loss: 1.5113, test_f1: 0.6161
 epoch: 54, train_loss: 0.4613, test_loss: 1.2869, test_f1: 0.6558
 epoch: 55, train_loss: 0.4378, test_loss: 1.3106, test_f1: 0.6491
 epoch: 56, train_loss: 0.4250, test_loss: 1.4887, test_f1: 0.6505
 epoch: 57, train_loss: 0.4398, test_loss: 1.4740, test_f1: 0.6223
 epoch: 58, train_loss: 0.4377, test_loss: 1.3302, test_f1: 0.6456
 epoch: 59, train_loss: 0.4288, test_loss: 1.5283, test_f1: 0.6345
 epoch: 60, train_loss: 0.4270, test_loss: 1.4280, test_f1: 0.5946
 epoch: 61, train_loss: 0.4193, test_loss: 1.2988, test_f1: 0.6738
 epoch: 62, train_loss: 0.3919, test_loss: 1.5013, test_f1: 0.6404
 epoch: 63, train_loss: 0.3804, test_loss: 1.4235, test_f1: 0.6305
 epoch: 64, train_loss: 0.3844, test_loss: 1.5185, test_f1: 0.6567
 epoch: 65, train_loss: 0.3884, test_loss: 1.6056, test_f1: 0.6172
 epoch: 66, train_loss: 0.3987, test_loss: 1.5803, test_f1: 0.5770
 epoch: 67, train_loss: 0.3794, test_loss: 1.7161, test_f1: 0.6125
 epoch: 68, train_loss: 0.3676, test_loss: 1.5048, test_f1: 0.6409
 epoch: 69, train_loss: 0.3656, test_loss: 1.8039, test_f1: 0.6373
 epoch: 70, train_loss: 0.3639, test_loss: 1.5879, test_f1: 0.6752
 epoch: 71, train_loss: 0.4046, test_loss: 1.7094, test_f1: 0.6029
 epoch: 72, train_loss: 0.3380, test_loss: 1.5275, test_f1: 0.6259
 epoch: 73, train_loss: 0.3661, test_loss: 1.6081, test_f1: 0.6149
 epoch: 74, train_loss: 0.3346, test_loss: 1.7861, test_f1: 0.6114
 epoch: 75, train_loss: 0.3400, test_loss: 1.6157, test_f1: 0.6604
 epoch: 76, train_loss: 0.3503, test_loss: 1.5994, test_f1: 0.6127
 epoch: 77, train_loss: 0.3586, test_loss: 1.3783, test_f1: 0.6338
 epoch: 78, train_loss: 0.3598, test_loss: 1.7721, test_f1: 0.6303
 epoch: 79, train_loss: 0.3212, test_loss: 2.0123, test_f1: 0.6193
 epoch: 80, train_loss: 0.3445, test_loss: 1.5877, test_f1: 0.6519
 epoch: 81, train_loss: 0.3254, test_loss: 1.7997, test_f1: 0.6554
 epoch: 82, train_loss: 0.3719, test_loss: 1.4262, test_f1: 0.7175
 epoch: 83, train_loss: 0.3443, test_loss: 1.8101, test_f1: 0.6284
 epoch: 84, train_loss: 0.2959, test_loss: 1.6789, test_f1: 0.6823
 epoch: 85, train_loss: 0.2958, test_loss: 1.5781, test_f1: 0.6614
 epoch: 86, train_loss: 0.2887, test_loss: 2.0967, test_f1: 0.6113
 epoch: 87, train_loss: 0.3133, test_loss: 1.9406, test_f1: 0.6604
 epoch: 88, train_loss: 0.3097, test_loss: 1.6579, test_f1: 0.6545
 epoch: 89, train_loss: 0.3079, test_loss: 1.8363, test_f1: 0.6445
 epoch: 90, train_loss: 0.3013, test_loss: 1.9439, test_f1: 0.6415
 epoch: 91, train_loss: 0.3102, test_loss: 1.7328, test_f1: 0.6644
 epoch: 92, train_loss: 0.2806, test_loss: 2.1885, test_f1: 0.6337
 epoch: 93, train_loss: 0.3061, test_loss: 1.9453, test_f1: 0.6062
 epoch: 94, train_loss: 0.2998, test_loss: 1.9332, test_f1: 0.6519
 epoch: 95, train_loss: 0.2688, test_loss: 1.7602, test_f1: 0.6418
 epoch: 96, train_loss: 0.2924, test_loss: 1.7115, test_f1: 0.6524
 epoch: 97, train_loss: 0.2776, test_loss: 2.0202, test_f1: 0.6422
 epoch: 98, train_loss: 0.2720, test_loss: 1.9955, test_f1: 0.6494
 epoch: 99, train_loss: 0.2990, test_loss: 2.0174, test_f1: 0.6228
##################ITERATION #2 ****************************************
 epoch: 0, train_loss: 1.2331, test_loss: 1.3102, test_f1: 0.3593
 epoch: 1, train_loss: 1.0299, test_loss: 1.1089, test_f1: 0.5061
 epoch: 2, train_loss: 0.9597, test_loss: 1.2441, test_f1: 0.3169
 epoch: 3, train_loss: 0.9185, test_loss: 2.6332, test_f1: 0.2144
 epoch: 4, train_loss: 0.8889, test_loss: 0.9945, test_f1: 0.5077
 epoch: 5, train_loss: 0.8588, test_loss: 1.2078, test_f1: 0.4104
 epoch: 6, train_loss: 0.8507, test_loss: 1.0901, test_f1: 0.5435
 epoch: 7, train_loss: 0.8354, test_loss: 1.4258, test_f1: 0.4324
 epoch: 8, train_loss: 0.8206, test_loss: 1.0707, test_f1: 0.4654
 epoch: 9, train_loss: 0.8015, test_loss: 1.2408, test_f1: 0.5503
 epoch: 10, train_loss: 0.8195, test_loss: 1.0656, test_f1: 0.5515
 epoch: 11, train_loss: 0.8050, test_loss: 1.0515, test_f1: 0.6032
 epoch: 12, train_loss: 0.7864, test_loss: 1.0331, test_f1: 0.5695
 epoch: 13, train_loss: 0.8175, test_loss: 1.0329, test_f1: 0.5832
 epoch: 14, train_loss: 0.8048, test_loss: 1.1182, test_f1: 0.5424
 epoch: 15, train_loss: 0.7571, test_loss: 1.1438, test_f1: 0.5261
 epoch: 16, train_loss: 0.7460, test_loss: 1.1432, test_f1: 0.5547
 epoch: 17, train_loss: 0.7482, test_loss: 1.0060, test_f1: 0.5496
 epoch: 18, train_loss: 0.7519, test_loss: 1.0652, test_f1: 0.5792
 epoch: 19, train_loss: 0.7612, test_loss: 1.0495, test_f1: 0.5886
 epoch: 20, train_loss: 0.7279, test_loss: 1.7951, test_f1: 0.4641
 epoch: 21, train_loss: 0.7178, test_loss: 1.0607, test_f1: 0.5528
 epoch: 22, train_loss: 0.6911, test_loss: 1.3406, test_f1: 0.5772
 epoch: 23, train_loss: 0.7183, test_loss: 1.0809, test_f1: 0.6078
 epoch: 24, train_loss: 0.7039, test_loss: 1.7369, test_f1: 0.5324
 epoch: 25, train_loss: 0.7056, test_loss: 1.3726, test_f1: 0.6236
 epoch: 26, train_loss: 0.7068, test_loss: 1.2191, test_f1: 0.5780
 epoch: 27, train_loss: 0.6687, test_loss: 1.4653, test_f1: 0.5952
 epoch: 28, train_loss: 0.6927, test_loss: 1.4544, test_f1: 0.5830
 epoch: 29, train_loss: 0.6991, test_loss: 1.1050, test_f1: 0.5584
 epoch: 30, train_loss: 0.6726, test_loss: 1.1311, test_f1: 0.5470
 epoch: 31, train_loss: 0.6731, test_loss: 1.2311, test_f1: 0.5125
 epoch: 32, train_loss: 0.7138, test_loss: 2.2471, test_f1: 0.4471
 epoch: 33, train_loss: 0.6489, test_loss: 1.0950, test_f1: 0.6378
 epoch: 34, train_loss: 0.6460, test_loss: 1.6482, test_f1: 0.5339
 epoch: 35, train_loss: 0.6363, test_loss: 1.8841, test_f1: 0.5052
 epoch: 36, train_loss: 0.6253, test_loss: 3.2337, test_f1: 0.4225
 epoch: 37, train_loss: 0.6543, test_loss: 1.3632, test_f1: 0.5210
 epoch: 38, train_loss: 0.6530, test_loss: 1.2199, test_f1: 0.5967
 epoch: 39, train_loss: 0.6360, test_loss: 1.9696, test_f1: 0.5407
 epoch: 40, train_loss: 0.6233, test_loss: 1.5254, test_f1: 0.5821
 epoch: 41, train_loss: 0.6429, test_loss: 1.2341, test_f1: 0.5549
 epoch: 42, train_loss: 0.6153, test_loss: 2.1848, test_f1: 0.5413
 epoch: 43, train_loss: 0.6077, test_loss: 1.3514, test_f1: 0.6172
 epoch: 44, train_loss: 0.6024, test_loss: 1.4358, test_f1: 0.5679
 epoch: 45, train_loss: 0.5927, test_loss: 1.6256, test_f1: 0.5606
 epoch: 46, train_loss: 0.5957, test_loss: 1.3457, test_f1: 0.6045
 epoch: 47, train_loss: 0.6227, test_loss: 1.5173, test_f1: 0.6198
 epoch: 48, train_loss: 0.5990, test_loss: 1.2467, test_f1: 0.6297
 epoch: 49, train_loss: 0.5750, test_loss: 1.3187, test_f1: 0.6170
 epoch: 50, train_loss: 0.5696, test_loss: 1.4995, test_f1: 0.6270
 epoch: 51, train_loss: 0.5224, test_loss: 1.6384, test_f1: 0.5750
 epoch: 52, train_loss: 0.5123, test_loss: 1.2299, test_f1: 0.6282
 epoch: 53, train_loss: 0.4952, test_loss: 1.4715, test_f1: 0.6083
 epoch: 54, train_loss: 0.4844, test_loss: 1.9503, test_f1: 0.5617
 epoch: 55, train_loss: 0.4807, test_loss: 2.0256, test_f1: 0.6112
 epoch: 56, train_loss: 0.4993, test_loss: 2.2765, test_f1: 0.6075
 epoch: 57, train_loss: 0.4783, test_loss: 1.7027, test_f1: 0.6039
 epoch: 58, train_loss: 0.4781, test_loss: 1.6651, test_f1: 0.5867
 epoch: 59, train_loss: 0.4978, test_loss: 1.9175, test_f1: 0.5961
 epoch: 60, train_loss: 0.4751, test_loss: 1.6746, test_f1: 0.5665
 epoch: 61, train_loss: 0.4905, test_loss: 1.7993, test_f1: 0.5645
 epoch: 62, train_loss: 0.4614, test_loss: 2.1008, test_f1: 0.5978
 epoch: 63, train_loss: 0.4559, test_loss: 1.6311, test_f1: 0.6012
 epoch: 64, train_loss: 0.4464, test_loss: 1.8491, test_f1: 0.6162
 epoch: 65, train_loss: 0.4383, test_loss: 1.7552, test_f1: 0.6608
 epoch: 66, train_loss: 0.4459, test_loss: 2.1425, test_f1: 0.5212
 epoch: 67, train_loss: 0.4786, test_loss: 1.4985, test_f1: 0.6079
 epoch: 68, train_loss: 0.4392, test_loss: 1.6722, test_f1: 0.5877
 epoch: 69, train_loss: 0.4124, test_loss: 1.9062, test_f1: 0.6147
 epoch: 70, train_loss: 0.3919, test_loss: 1.7864, test_f1: 0.6412
 epoch: 71, train_loss: 0.4493, test_loss: 2.0166, test_f1: 0.5951
 epoch: 72, train_loss: 0.4255, test_loss: 1.9070, test_f1: 0.6119
 epoch: 73, train_loss: 0.4311, test_loss: 1.7235, test_f1: 0.6131
 epoch: 74, train_loss: 0.4055, test_loss: 1.7848, test_f1: 0.6250
 epoch: 75, train_loss: 0.3820, test_loss: 1.8775, test_f1: 0.5846
 epoch: 76, train_loss: 0.3788, test_loss: 1.8616, test_f1: 0.5829
 epoch: 77, train_loss: 0.3756, test_loss: 2.3011, test_f1: 0.6345
 epoch: 78, train_loss: 0.4106, test_loss: 2.0438, test_f1: 0.6479
 epoch: 79, train_loss: 0.4254, test_loss: 1.9832, test_f1: 0.6784
 epoch: 80, train_loss: 0.4216, test_loss: 2.1072, test_f1: 0.6343
 epoch: 81, train_loss: 0.4000, test_loss: 1.8613, test_f1: 0.5966
 epoch: 82, train_loss: 0.3827, test_loss: 1.9319, test_f1: 0.6237
 epoch: 83, train_loss: 0.3812, test_loss: 1.9978, test_f1: 0.6066
 epoch: 84, train_loss: 0.3642, test_loss: 2.5242, test_f1: 0.5943
 epoch: 85, train_loss: 0.3963, test_loss: 1.8431, test_f1: 0.6385
 epoch: 86, train_loss: 0.3633, test_loss: 1.8180, test_f1: 0.6344
 epoch: 87, train_loss: 0.3446, test_loss: 1.9898, test_f1: 0.6172
 epoch: 88, train_loss: 0.3589, test_loss: 1.9929, test_f1: 0.6653
 epoch: 89, train_loss: 0.3610, test_loss: 2.4054, test_f1: 0.6321
 epoch: 90, train_loss: 0.3452, test_loss: 2.1643, test_f1: 0.5721
 epoch: 91, train_loss: 0.3781, test_loss: 2.3423, test_f1: 0.6034
 epoch: 92, train_loss: 0.3520, test_loss: 1.9859, test_f1: 0.6447
 epoch: 93, train_loss: 0.3378, test_loss: 2.4386, test_f1: 0.6125
 epoch: 94, train_loss: 0.3676, test_loss: 2.4292, test_f1: 0.6194
 epoch: 95, train_loss: 0.3315, test_loss: 2.2727, test_f1: 0.6081
 epoch: 96, train_loss: 0.3583, test_loss: 2.2962, test_f1: 0.6231
 epoch: 97, train_loss: 0.3336, test_loss: 2.0044, test_f1: 0.6453
 epoch: 98, train_loss: 0.3187, test_loss: 2.3383, test_f1: 0.6323
 epoch: 99, train_loss: 0.3492, test_loss: 2.3582, test_f1: 0.5863
##################ITERATION #3 ****************************************
 epoch: 0, train_loss: 1.2556, test_loss: 1.2066, test_f1: 0.3856
 epoch: 1, train_loss: 1.0003, test_loss: 1.3202, test_f1: 0.2871
 epoch: 2, train_loss: 0.9389, test_loss: 1.0245, test_f1: 0.5661
 epoch: 3, train_loss: 0.9089, test_loss: 1.0329, test_f1: 0.5163
 epoch: 4, train_loss: 0.8874, test_loss: 1.0233, test_f1: 0.5575
 epoch: 5, train_loss: 0.8593, test_loss: 0.9762, test_f1: 0.5529
 epoch: 6, train_loss: 0.8204, test_loss: 1.0191, test_f1: 0.5462
 epoch: 7, train_loss: 0.8129, test_loss: 1.2039, test_f1: 0.4759
 epoch: 8, train_loss: 0.7945, test_loss: 0.9757, test_f1: 0.6055
 epoch: 9, train_loss: 0.8057, test_loss: 1.0132, test_f1: 0.5784
 epoch: 10, train_loss: 0.8318, test_loss: 1.0643, test_f1: 0.4957
 epoch: 11, train_loss: 0.7917, test_loss: 1.0980, test_f1: 0.5514
 epoch: 12, train_loss: 0.7903, test_loss: 1.2055, test_f1: 0.4149
 epoch: 13, train_loss: 0.7962, test_loss: 1.0545, test_f1: 0.5925
 epoch: 14, train_loss: 0.7688, test_loss: 1.0407, test_f1: 0.5449
 epoch: 15, train_loss: 0.7575, test_loss: 1.0588, test_f1: 0.5863
 epoch: 16, train_loss: 0.7609, test_loss: 1.0952, test_f1: 0.5421
 epoch: 17, train_loss: 0.7333, test_loss: 1.0649, test_f1: 0.5685
 epoch: 18, train_loss: 0.7225, test_loss: 1.1559, test_f1: 0.5550
 epoch: 19, train_loss: 0.7256, test_loss: 1.1868, test_f1: 0.5977
 epoch: 20, train_loss: 0.7393, test_loss: 1.0198, test_f1: 0.6016
 epoch: 21, train_loss: 0.7066, test_loss: 1.1537, test_f1: 0.5631
 epoch: 22, train_loss: 0.7195, test_loss: 1.0259, test_f1: 0.6053
 epoch: 23, train_loss: 0.7296, test_loss: 1.0581, test_f1: 0.5709
 epoch: 24, train_loss: 0.7442, test_loss: 1.0195, test_f1: 0.5619
 epoch: 25, train_loss: 0.6776, test_loss: 1.0958, test_f1: 0.5639
 epoch: 26, train_loss: 0.6743, test_loss: 1.0798, test_f1: 0.5854
 epoch: 27, train_loss: 0.6952, test_loss: 1.3176, test_f1: 0.4124
 epoch: 28, train_loss: 0.6898, test_loss: 1.3937, test_f1: 0.5966
 epoch: 29, train_loss: 0.6552, test_loss: 1.1447, test_f1: 0.5890
 epoch: 30, train_loss: 0.6613, test_loss: 1.1676, test_f1: 0.5805
 epoch: 31, train_loss: 0.6553, test_loss: 1.2945, test_f1: 0.4897
 epoch: 32, train_loss: 0.6504, test_loss: 1.2066, test_f1: 0.5452
 epoch: 33, train_loss: 0.6781, test_loss: 1.4040, test_f1: 0.5188
 epoch: 34, train_loss: 0.6366, test_loss: 1.1158, test_f1: 0.5748
 epoch: 35, train_loss: 0.6412, test_loss: 1.4008, test_f1: 0.5635
 epoch: 36, train_loss: 0.6412, test_loss: 1.1457, test_f1: 0.6205
 epoch: 37, train_loss: 0.6255, test_loss: 1.3772, test_f1: 0.5780
 epoch: 38, train_loss: 0.6010, test_loss: 1.2091, test_f1: 0.5649
 epoch: 39, train_loss: 0.6837, test_loss: 1.6123, test_f1: 0.3709
 epoch: 40, train_loss: 0.6680, test_loss: 1.0260, test_f1: 0.5412
 epoch: 41, train_loss: 0.6160, test_loss: 1.1150, test_f1: 0.5927
 epoch: 42, train_loss: 0.6167, test_loss: 1.0975, test_f1: 0.5786
 epoch: 43, train_loss: 0.6154, test_loss: 1.7420, test_f1: 0.4960
 epoch: 44, train_loss: 0.6182, test_loss: 1.1859, test_f1: 0.5915
 epoch: 45, train_loss: 0.6017, test_loss: 1.3267, test_f1: 0.5919
 epoch: 46, train_loss: 0.5909, test_loss: 1.8464, test_f1: 0.5678
 epoch: 47, train_loss: 0.6056, test_loss: 1.3268, test_f1: 0.5759
 epoch: 48, train_loss: 0.5829, test_loss: 1.0843, test_f1: 0.6134
 epoch: 49, train_loss: 0.5846, test_loss: 1.1579, test_f1: 0.6317
 epoch: 50, train_loss: 0.5544, test_loss: 1.3613, test_f1: 0.5853
 epoch: 51, train_loss: 0.5599, test_loss: 1.2689, test_f1: 0.6190
 epoch: 52, train_loss: 0.5282, test_loss: 1.4104, test_f1: 0.6038
 epoch: 53, train_loss: 0.5154, test_loss: 1.2629, test_f1: 0.5888
 epoch: 54, train_loss: 0.4978, test_loss: 1.3904, test_f1: 0.6171
 epoch: 55, train_loss: 0.4712, test_loss: 1.5192, test_f1: 0.5861
 epoch: 56, train_loss: 0.4716, test_loss: 1.6795, test_f1: 0.5869
 epoch: 57, train_loss: 0.5134, test_loss: 1.3256, test_f1: 0.6350
 epoch: 58, train_loss: 0.4772, test_loss: 1.3933, test_f1: 0.5919
 epoch: 59, train_loss: 0.5166, test_loss: 1.3572, test_f1: 0.6181
 epoch: 60, train_loss: 0.4873, test_loss: 1.3056, test_f1: 0.6398
 epoch: 61, train_loss: 0.4612, test_loss: 1.3691, test_f1: 0.5975
 epoch: 62, train_loss: 0.4512, test_loss: 1.3228, test_f1: 0.6351
 epoch: 63, train_loss: 0.4422, test_loss: 1.5334, test_f1: 0.6112
 epoch: 64, train_loss: 0.4908, test_loss: 1.5586, test_f1: 0.5865
 epoch: 65, train_loss: 0.4458, test_loss: 1.4583, test_f1: 0.6052
 epoch: 66, train_loss: 0.4263, test_loss: 1.8196, test_f1: 0.6028
 epoch: 67, train_loss: 0.4239, test_loss: 1.6402, test_f1: 0.5801
 epoch: 68, train_loss: 0.4550, test_loss: 1.5413, test_f1: 0.6454
 epoch: 69, train_loss: 0.4474, test_loss: 1.4703, test_f1: 0.6140
 epoch: 70, train_loss: 0.4397, test_loss: 1.5857, test_f1: 0.6031
 epoch: 71, train_loss: 0.4610, test_loss: 1.4821, test_f1: 0.6163
 epoch: 72, train_loss: 0.4457, test_loss: 1.4941, test_f1: 0.6307
 epoch: 73, train_loss: 0.4277, test_loss: 1.4753, test_f1: 0.5826
 epoch: 74, train_loss: 0.4001, test_loss: 1.7122, test_f1: 0.6129
 epoch: 75, train_loss: 0.3900, test_loss: 1.4953, test_f1: 0.6306
 epoch: 76, train_loss: 0.4147, test_loss: 1.5876, test_f1: 0.6112
 epoch: 77, train_loss: 0.4286, test_loss: 1.6000, test_f1: 0.5994
 epoch: 78, train_loss: 0.4068, test_loss: 1.5702, test_f1: 0.6391
 epoch: 79, train_loss: 0.3805, test_loss: 1.7752, test_f1: 0.6148
 epoch: 80, train_loss: 0.3871, test_loss: 1.7912, test_f1: 0.6225
 epoch: 81, train_loss: 0.4186, test_loss: 1.6501, test_f1: 0.6142
 epoch: 82, train_loss: 0.4160, test_loss: 1.7008, test_f1: 0.5890
 epoch: 83, train_loss: 0.3709, test_loss: 1.6423, test_f1: 0.6135
 epoch: 84, train_loss: 0.3582, test_loss: 1.8200, test_f1: 0.6121
 epoch: 85, train_loss: 0.3668, test_loss: 1.7689, test_f1: 0.5918
 epoch: 86, train_loss: 0.3381, test_loss: 1.8594, test_f1: 0.6252
 epoch: 87, train_loss: 0.3168, test_loss: 1.9191, test_f1: 0.6234
 epoch: 88, train_loss: 0.3236, test_loss: 1.7986, test_f1: 0.6330
 epoch: 89, train_loss: 0.3521, test_loss: 1.8144, test_f1: 0.6278
 epoch: 90, train_loss: 0.3349, test_loss: 1.9175, test_f1: 0.6530
 epoch: 91, train_loss: 0.3489, test_loss: 1.5373, test_f1: 0.6492
 epoch: 92, train_loss: 0.3711, test_loss: 1.6286, test_f1: 0.6216
 epoch: 93, train_loss: 0.3427, test_loss: 1.9083, test_f1: 0.6096
 epoch: 94, train_loss: 0.3746, test_loss: 1.9081, test_f1: 0.6392
 epoch: 95, train_loss: 0.3394, test_loss: 1.6847, test_f1: 0.6253
 epoch: 96, train_loss: 0.3145, test_loss: 2.0166, test_f1: 0.6140
 epoch: 97, train_loss: 0.3339, test_loss: 1.8251, test_f1: 0.6260
 epoch: 98, train_loss: 0.3119, test_loss: 2.1311, test_f1: 0.5918
 epoch: 99, train_loss: 0.3181, test_loss: 1.8628, test_f1: 0.6163
##################ITERATION #4 ****************************************
 epoch: 0, train_loss: 1.2469, test_loss: 1.4373, test_f1: 0.2936
 epoch: 1, train_loss: 0.9861, test_loss: 1.1092, test_f1: 0.4377
 epoch: 2, train_loss: 0.9117, test_loss: 1.0466, test_f1: 0.5771
 epoch: 3, train_loss: 0.8638, test_loss: 1.2751, test_f1: 0.4816
 epoch: 4, train_loss: 0.8583, test_loss: 1.1176, test_f1: 0.5217
 epoch: 5, train_loss: 0.8312, test_loss: 1.1350, test_f1: 0.5270
 epoch: 6, train_loss: 0.8564, test_loss: 0.9776, test_f1: 0.5893
 epoch: 7, train_loss: 0.8110, test_loss: 1.0173, test_f1: 0.6092
 epoch: 8, train_loss: 0.8018, test_loss: 1.0618, test_f1: 0.5759
 epoch: 9, train_loss: 0.8170, test_loss: 1.1007, test_f1: 0.5017
 epoch: 10, train_loss: 0.8207, test_loss: 1.2930, test_f1: 0.4564
 epoch: 11, train_loss: 0.7926, test_loss: 1.1228, test_f1: 0.4340
 epoch: 12, train_loss: 0.7698, test_loss: 1.5397, test_f1: 0.4901
 epoch: 13, train_loss: 0.7735, test_loss: 0.9852, test_f1: 0.5758
 epoch: 14, train_loss: 0.7880, test_loss: 1.0197, test_f1: 0.6242
 epoch: 15, train_loss: 0.7619, test_loss: 0.9697, test_f1: 0.6032
 epoch: 16, train_loss: 0.7392, test_loss: 1.1513, test_f1: 0.5396
 epoch: 17, train_loss: 0.7864, test_loss: 1.0623, test_f1: 0.5716
 epoch: 18, train_loss: 0.7796, test_loss: 1.0612, test_f1: 0.5480
 epoch: 19, train_loss: 0.7549, test_loss: 1.1045, test_f1: 0.5396
 epoch: 20, train_loss: 0.7497, test_loss: 1.0904, test_f1: 0.5165
 epoch: 21, train_loss: 0.7664, test_loss: 0.9676, test_f1: 0.5967
 epoch: 22, train_loss: 0.7358, test_loss: 1.0658, test_f1: 0.5152
 epoch: 23, train_loss: 0.7151, test_loss: 1.0739, test_f1: 0.5948
 epoch: 24, train_loss: 0.7145, test_loss: 1.0495, test_f1: 0.5767
 epoch: 25, train_loss: 0.7085, test_loss: 1.1954, test_f1: 0.5271
 epoch: 26, train_loss: 0.7262, test_loss: 1.0519, test_f1: 0.6063
 epoch: 27, train_loss: 0.7246, test_loss: 1.0145, test_f1: 0.5718
 epoch: 28, train_loss: 0.7091, test_loss: 1.1236, test_f1: 0.6103
 epoch: 29, train_loss: 0.6880, test_loss: 1.1856, test_f1: 0.5500
 epoch: 30, train_loss: 0.7129, test_loss: 1.0759, test_f1: 0.6543
 epoch: 31, train_loss: 0.6390, test_loss: 1.1104, test_f1: 0.6325
 epoch: 32, train_loss: 0.6546, test_loss: 1.0565, test_f1: 0.6004
 epoch: 33, train_loss: 0.6630, test_loss: 1.7508, test_f1: 0.5200
 epoch: 34, train_loss: 0.6745, test_loss: 1.0668, test_f1: 0.6235
 epoch: 35, train_loss: 0.6402, test_loss: 1.0656, test_f1: 0.6738
 epoch: 36, train_loss: 0.6242, test_loss: 1.5031, test_f1: 0.5111
 epoch: 37, train_loss: 0.6161, test_loss: 1.3081, test_f1: 0.6140
 epoch: 38, train_loss: 0.6289, test_loss: 1.3834, test_f1: 0.5300
 epoch: 39, train_loss: 0.6255, test_loss: 2.2311, test_f1: 0.4311
 epoch: 40, train_loss: 0.6350, test_loss: 1.2401, test_f1: 0.6469
 epoch: 41, train_loss: 0.6258, test_loss: 1.5033, test_f1: 0.5780
 epoch: 42, train_loss: 0.6123, test_loss: 1.0882, test_f1: 0.6363
 epoch: 43, train_loss: 0.5747, test_loss: 1.2290, test_f1: 0.6091
 epoch: 44, train_loss: 0.5852, test_loss: 1.2198, test_f1: 0.6023
 epoch: 45, train_loss: 0.6136, test_loss: 1.1928, test_f1: 0.6179
 epoch: 46, train_loss: 0.5814, test_loss: 1.2165, test_f1: 0.6625
 epoch: 47, train_loss: 0.5818, test_loss: 1.3310, test_f1: 0.5987
 epoch: 48, train_loss: 0.6155, test_loss: 1.3746, test_f1: 0.5523
 epoch: 49, train_loss: 0.6706, test_loss: 1.2667, test_f1: 0.5805
 epoch: 50, train_loss: 0.6057, test_loss: 1.4146, test_f1: 0.6124
 epoch: 51, train_loss: 0.5549, test_loss: 1.3104, test_f1: 0.6191
 epoch: 52, train_loss: 0.5379, test_loss: 1.3187, test_f1: 0.6044
 epoch: 53, train_loss: 0.5158, test_loss: 1.3200, test_f1: 0.6591
 epoch: 54, train_loss: 0.4847, test_loss: 1.4304, test_f1: 0.6265
 epoch: 55, train_loss: 0.4697, test_loss: 1.3531, test_f1: 0.6629
 epoch: 56, train_loss: 0.4571, test_loss: 1.3367, test_f1: 0.6629
 epoch: 57, train_loss: 0.4761, test_loss: 1.6095, test_f1: 0.6299
 epoch: 58, train_loss: 0.4858, test_loss: 1.6701, test_f1: 0.5908
 epoch: 59, train_loss: 0.4415, test_loss: 1.5584, test_f1: 0.6039
 epoch: 60, train_loss: 0.4531, test_loss: 1.6751, test_f1: 0.5865
 epoch: 61, train_loss: 0.4775, test_loss: 1.4480, test_f1: 0.5937
 epoch: 62, train_loss: 0.4863, test_loss: 1.5081, test_f1: 0.6139
 epoch: 63, train_loss: 0.4428, test_loss: 1.7353, test_f1: 0.5970
 epoch: 64, train_loss: 0.4355, test_loss: 1.6460, test_f1: 0.6220
 epoch: 65, train_loss: 0.4117, test_loss: 1.6706, test_f1: 0.6436
 epoch: 66, train_loss: 0.4161, test_loss: 1.6432, test_f1: 0.6008
 epoch: 67, train_loss: 0.4063, test_loss: 1.5021, test_f1: 0.6594
 epoch: 68, train_loss: 0.4129, test_loss: 1.5918, test_f1: 0.6552
 epoch: 69, train_loss: 0.4153, test_loss: 1.5462, test_f1: 0.6088
 epoch: 70, train_loss: 0.3909, test_loss: 1.8611, test_f1: 0.6051
 epoch: 71, train_loss: 0.4367, test_loss: 1.6145, test_f1: 0.6402
 epoch: 72, train_loss: 0.3926, test_loss: 1.4252, test_f1: 0.6659
 epoch: 73, train_loss: 0.4044, test_loss: 1.8985, test_f1: 0.5984
 epoch: 74, train_loss: 0.4150, test_loss: 1.6680, test_f1: 0.6062
 epoch: 75, train_loss: 0.3937, test_loss: 1.8144, test_f1: 0.6090
 epoch: 76, train_loss: 0.4196, test_loss: 1.4686, test_f1: 0.6276
 epoch: 77, train_loss: 0.4345, test_loss: 1.5339, test_f1: 0.6820
 epoch: 78, train_loss: 0.3786, test_loss: 1.9183, test_f1: 0.6202
 epoch: 79, train_loss: 0.3913, test_loss: 1.5815, test_f1: 0.6174
 epoch: 80, train_loss: 0.3532, test_loss: 1.6985, test_f1: 0.6262
 epoch: 81, train_loss: 0.3630, test_loss: 1.7689, test_f1: 0.6249
 epoch: 82, train_loss: 0.3645, test_loss: 1.8393, test_f1: 0.6141
 epoch: 83, train_loss: 0.3864, test_loss: 1.8986, test_f1: 0.6443
 epoch: 84, train_loss: 0.4406, test_loss: 1.5228, test_f1: 0.6072
 epoch: 85, train_loss: 0.3813, test_loss: 1.4187, test_f1: 0.6607
 epoch: 86, train_loss: 0.3746, test_loss: 1.5789, test_f1: 0.6707
 epoch: 87, train_loss: 0.3974, test_loss: 1.8966, test_f1: 0.5928
 epoch: 88, train_loss: 0.3647, test_loss: 1.4672, test_f1: 0.6754
 epoch: 89, train_loss: 0.3554, test_loss: 1.7647, test_f1: 0.6367
 epoch: 90, train_loss: 0.3060, test_loss: 1.9364, test_f1: 0.6551
 epoch: 91, train_loss: 0.3850, test_loss: 1.8151, test_f1: 0.6398
 epoch: 92, train_loss: 0.3658, test_loss: 1.7406, test_f1: 0.6114
 epoch: 93, train_loss: 0.3349, test_loss: 1.7703, test_f1: 0.6444
 epoch: 94, train_loss: 0.3075, test_loss: 1.7453, test_f1: 0.6366
 epoch: 95, train_loss: 0.3589, test_loss: 2.4183, test_f1: 0.5447
 epoch: 96, train_loss: 0.3238, test_loss: 1.5593, test_f1: 0.6852
 epoch: 97, train_loss: 0.2980, test_loss: 1.8261, test_f1: 0.6484
 epoch: 98, train_loss: 0.2804, test_loss: 2.2716, test_f1: 0.6040
 epoch: 99, train_loss: 0.3376, test_loss: 2.3210, test_f1: 0.5962
##################ITERATION #5 ****************************************
 epoch: 0, train_loss: 1.1757, test_loss: 1.6906, test_f1: 0.1404
 epoch: 1, train_loss: 0.9329, test_loss: 1.0480, test_f1: 0.4873
 epoch: 2, train_loss: 0.8779, test_loss: 1.4795, test_f1: 0.4139
 epoch: 3, train_loss: 0.8418, test_loss: 1.0852, test_f1: 0.5267
 epoch: 4, train_loss: 0.8257, test_loss: 1.0177, test_f1: 0.5898
 epoch: 5, train_loss: 0.7871, test_loss: 1.0525, test_f1: 0.5102
 epoch: 6, train_loss: 0.7885, test_loss: 0.9542, test_f1: 0.6083
 epoch: 7, train_loss: 0.7879, test_loss: 1.3927, test_f1: 0.4533
 epoch: 8, train_loss: 0.7753, test_loss: 0.9743, test_f1: 0.6318
 epoch: 9, train_loss: 0.7737, test_loss: 0.9990, test_f1: 0.6385
 epoch: 10, train_loss: 0.7762, test_loss: 1.0116, test_f1: 0.6235
 epoch: 11, train_loss: 0.7958, test_loss: 0.9457, test_f1: 0.6036
 epoch: 12, train_loss: 0.7414, test_loss: 1.0099, test_f1: 0.5912
 epoch: 13, train_loss: 0.7411, test_loss: 1.1004, test_f1: 0.5591
 epoch: 14, train_loss: 0.7420, test_loss: 1.0970, test_f1: 0.5737
 epoch: 15, train_loss: 0.6997, test_loss: 1.2188, test_f1: 0.5765
 epoch: 16, train_loss: 0.7345, test_loss: 1.0327, test_f1: 0.5917
 epoch: 17, train_loss: 0.6950, test_loss: 1.1734, test_f1: 0.5710
 epoch: 18, train_loss: 0.7230, test_loss: 0.9547, test_f1: 0.6061
 epoch: 19, train_loss: 0.6842, test_loss: 1.1129, test_f1: 0.6213
 epoch: 20, train_loss: 0.6686, test_loss: 1.2092, test_f1: 0.4795
 epoch: 21, train_loss: 0.6679, test_loss: 1.1013, test_f1: 0.4844
 epoch: 22, train_loss: 0.6697, test_loss: 1.2028, test_f1: 0.5469
 epoch: 23, train_loss: 0.7365, test_loss: 0.9438, test_f1: 0.6056
 epoch: 24, train_loss: 0.6727, test_loss: 1.3000, test_f1: 0.6298
 epoch: 25, train_loss: 0.6447, test_loss: 1.1327, test_f1: 0.5993
 epoch: 26, train_loss: 0.6302, test_loss: 1.0385, test_f1: 0.6289
 epoch: 27, train_loss: 0.6265, test_loss: 1.5778, test_f1: 0.5856
 epoch: 28, train_loss: 0.6470, test_loss: 1.1307, test_f1: 0.5820
 epoch: 29, train_loss: 0.6335, test_loss: 0.9156, test_f1: 0.6110
 epoch: 30, train_loss: 0.6299, test_loss: 1.0992, test_f1: 0.5665
 epoch: 31, train_loss: 0.6616, test_loss: 1.1538, test_f1: 0.5327
 epoch: 32, train_loss: 0.6175, test_loss: 1.2435, test_f1: 0.4941
 epoch: 33, train_loss: 0.6219, test_loss: 1.3321, test_f1: 0.5601
 epoch: 34, train_loss: 0.6414, test_loss: 1.0729, test_f1: 0.5943
 epoch: 35, train_loss: 0.6860, test_loss: 1.0067, test_f1: 0.6098
 epoch: 36, train_loss: 0.6156, test_loss: 0.9532, test_f1: 0.6474
 epoch: 37, train_loss: 0.5758, test_loss: 1.3402, test_f1: 0.6358
 epoch: 38, train_loss: 0.5610, test_loss: 1.4522, test_f1: 0.5675
 epoch: 39, train_loss: 0.5626, test_loss: 1.0736, test_f1: 0.6132
 epoch: 40, train_loss: 0.5687, test_loss: 1.2224, test_f1: 0.6369
 epoch: 41, train_loss: 0.5312, test_loss: 1.4882, test_f1: 0.6617
 epoch: 42, train_loss: 0.6113, test_loss: 1.3853, test_f1: 0.5279
 epoch: 43, train_loss: 0.6220, test_loss: 1.1995, test_f1: 0.6045
 epoch: 44, train_loss: 0.5846, test_loss: 1.2169, test_f1: 0.6491
 epoch: 45, train_loss: 0.5703, test_loss: 1.2209, test_f1: 0.5657
 epoch: 46, train_loss: 0.5520, test_loss: 1.3809, test_f1: 0.6157
 epoch: 47, train_loss: 0.5286, test_loss: 1.3193, test_f1: 0.6397
 epoch: 48, train_loss: 0.5396, test_loss: 1.1986, test_f1: 0.6491
 epoch: 49, train_loss: 0.5591, test_loss: 1.2783, test_f1: 0.6232
 epoch: 50, train_loss: 0.5305, test_loss: 1.1717, test_f1: 0.6653
 epoch: 51, train_loss: 0.4898, test_loss: 1.2054, test_f1: 0.6414
 epoch: 52, train_loss: 0.4726, test_loss: 1.3565, test_f1: 0.5801
 epoch: 53, train_loss: 0.4612, test_loss: 1.2623, test_f1: 0.6111
 epoch: 54, train_loss: 0.4818, test_loss: 1.3442, test_f1: 0.6352
 epoch: 55, train_loss: 0.4339, test_loss: 1.3054, test_f1: 0.6250
 epoch: 56, train_loss: 0.4249, test_loss: 1.4673, test_f1: 0.6504
 epoch: 57, train_loss: 0.4412, test_loss: 1.2950, test_f1: 0.6156
 epoch: 58, train_loss: 0.4447, test_loss: 1.5529, test_f1: 0.6166
 epoch: 59, train_loss: 0.4165, test_loss: 1.4562, test_f1: 0.6642
 epoch: 60, train_loss: 0.4137, test_loss: 1.4589, test_f1: 0.6032
 epoch: 61, train_loss: 0.4058, test_loss: 1.6135, test_f1: 0.5932
 epoch: 62, train_loss: 0.4211, test_loss: 1.8051, test_f1: 0.5857
 epoch: 63, train_loss: 0.4323, test_loss: 1.7913, test_f1: 0.6197
 epoch: 64, train_loss: 0.3992, test_loss: 1.4771, test_f1: 0.6292
 epoch: 65, train_loss: 0.3992, test_loss: 1.7395, test_f1: 0.6188
 epoch: 66, train_loss: 0.3858, test_loss: 1.7859, test_f1: 0.6625
 epoch: 67, train_loss: 0.3951, test_loss: 1.4756, test_f1: 0.6071
 epoch: 68, train_loss: 0.4297, test_loss: 1.5906, test_f1: 0.6195
 epoch: 69, train_loss: 0.3662, test_loss: 1.4848, test_f1: 0.6617
 epoch: 70, train_loss: 0.3931, test_loss: 2.1075, test_f1: 0.5905
 epoch: 71, train_loss: 0.3430, test_loss: 1.6788, test_f1: 0.6284
 epoch: 72, train_loss: 0.3962, test_loss: 1.6470, test_f1: 0.6247
 epoch: 73, train_loss: 0.3839, test_loss: 1.9853, test_f1: 0.6576
 epoch: 74, train_loss: 0.3371, test_loss: 1.7875, test_f1: 0.6344
 epoch: 75, train_loss: 0.3496, test_loss: 1.7085, test_f1: 0.6656
 epoch: 76, train_loss: 0.4054, test_loss: 2.0617, test_f1: 0.6422
 epoch: 77, train_loss: 0.3473, test_loss: 1.7787, test_f1: 0.6896
 epoch: 78, train_loss: 0.3377, test_loss: 1.7544, test_f1: 0.6576
 epoch: 79, train_loss: 0.3504, test_loss: 2.1812, test_f1: 0.5774
 epoch: 80, train_loss: 0.3215, test_loss: 1.7380, test_f1: 0.6526
 epoch: 81, train_loss: 0.3434, test_loss: 2.1061, test_f1: 0.6181
 epoch: 82, train_loss: 0.3432, test_loss: 2.2222, test_f1: 0.6463
 epoch: 83, train_loss: 0.3129, test_loss: 1.7124, test_f1: 0.6398
 epoch: 84, train_loss: 0.3092, test_loss: 1.6961, test_f1: 0.6682
 epoch: 85, train_loss: 0.3332, test_loss: 1.5672, test_f1: 0.6636
 epoch: 86, train_loss: 0.3188, test_loss: 2.0176, test_f1: 0.6202
 epoch: 87, train_loss: 0.2952, test_loss: 2.0621, test_f1: 0.6563
 epoch: 88, train_loss: 0.3730, test_loss: 1.5017, test_f1: 0.6266
 epoch: 89, train_loss: 0.4384, test_loss: 1.6374, test_f1: 0.6191
 epoch: 90, train_loss: 0.3418, test_loss: 1.8247, test_f1: 0.6172
 epoch: 91, train_loss: 0.2867, test_loss: 1.7185, test_f1: 0.6121
 epoch: 92, train_loss: 0.2903, test_loss: 1.9513, test_f1: 0.6342
 epoch: 93, train_loss: 0.3029, test_loss: 2.1304, test_f1: 0.6577
 epoch: 94, train_loss: 0.2901, test_loss: 1.9020, test_f1: 0.6180
 epoch: 95, train_loss: 0.2833, test_loss: 1.9066, test_f1: 0.6736
 epoch: 96, train_loss: 0.2725, test_loss: 1.8940, test_f1: 0.6106
 epoch: 97, train_loss: 0.2724, test_loss: 2.1500, test_f1: 0.6191
 epoch: 98, train_loss: 0.2820, test_loss: 1.5679, test_f1: 0.6467
 epoch: 99, train_loss: 0.2911, test_loss: 2.2818, test_f1: 0.6045
##################ITERATION #6 ****************************************
 epoch: 0, train_loss: 1.2520, test_loss: 1.3868, test_f1: 0.3339
 epoch: 1, train_loss: 0.9886, test_loss: 1.1016, test_f1: 0.4930
 epoch: 2, train_loss: 0.9211, test_loss: 1.0167, test_f1: 0.4840
 epoch: 3, train_loss: 0.8968, test_loss: 1.1246, test_f1: 0.4106
 epoch: 4, train_loss: 0.8398, test_loss: 1.0560, test_f1: 0.5467
 epoch: 5, train_loss: 0.8354, test_loss: 0.9337, test_f1: 0.5741
 epoch: 6, train_loss: 0.8225, test_loss: 2.0183, test_f1: 0.3536
 epoch: 7, train_loss: 0.8225, test_loss: 1.0401, test_f1: 0.5640
 epoch: 8, train_loss: 0.7871, test_loss: 1.2421, test_f1: 0.5450
 epoch: 9, train_loss: 0.8021, test_loss: 1.1926, test_f1: 0.5363
 epoch: 10, train_loss: 0.7704, test_loss: 1.2055, test_f1: 0.4910
 epoch: 11, train_loss: 0.7752, test_loss: 1.0442, test_f1: 0.5843
 epoch: 12, train_loss: 0.7831, test_loss: 1.3303, test_f1: 0.4740
 epoch: 13, train_loss: 0.7491, test_loss: 1.0113, test_f1: 0.6110
 epoch: 14, train_loss: 0.7397, test_loss: 1.2809, test_f1: 0.5518
 epoch: 15, train_loss: 0.7527, test_loss: 1.1798, test_f1: 0.5927
 epoch: 16, train_loss: 0.7421, test_loss: 1.4761, test_f1: 0.4524
 epoch: 17, train_loss: 0.7151, test_loss: 1.1502, test_f1: 0.5516
 epoch: 18, train_loss: 0.7563, test_loss: 1.4224, test_f1: 0.5694
 epoch: 19, train_loss: 0.7439, test_loss: 1.9909, test_f1: 0.4575
 epoch: 20, train_loss: 0.7326, test_loss: 1.0282, test_f1: 0.5897
 epoch: 21, train_loss: 0.6896, test_loss: 1.2613, test_f1: 0.5882
 epoch: 22, train_loss: 0.6939, test_loss: 1.3765, test_f1: 0.5169
 epoch: 23, train_loss: 0.6949, test_loss: 1.1689, test_f1: 0.5758
 epoch: 24, train_loss: 0.7374, test_loss: 1.0397, test_f1: 0.5777
 epoch: 25, train_loss: 0.6979, test_loss: 1.3088, test_f1: 0.5600
 epoch: 26, train_loss: 0.6854, test_loss: 1.1573, test_f1: 0.6115
 epoch: 27, train_loss: 0.6919, test_loss: 1.3937, test_f1: 0.4804
 epoch: 28, train_loss: 0.6749, test_loss: 1.0496, test_f1: 0.6539
 epoch: 29, train_loss: 0.6486, test_loss: 1.1472, test_f1: 0.6066
 epoch: 30, train_loss: 0.6460, test_loss: 1.3378, test_f1: 0.5182
 epoch: 31, train_loss: 0.6571, test_loss: 1.4717, test_f1: 0.5756
 epoch: 32, train_loss: 0.6643, test_loss: 1.2764, test_f1: 0.5755
 epoch: 33, train_loss: 0.6348, test_loss: 1.0882, test_f1: 0.6319
 epoch: 34, train_loss: 0.6353, test_loss: 1.6940, test_f1: 0.4908
 epoch: 35, train_loss: 0.6287, test_loss: 1.4210, test_f1: 0.5881
 epoch: 36, train_loss: 0.6640, test_loss: 1.1875, test_f1: 0.6203
 epoch: 37, train_loss: 0.6399, test_loss: 1.2055, test_f1: 0.5719
 epoch: 38, train_loss: 0.6370, test_loss: 1.2419, test_f1: 0.5899
 epoch: 39, train_loss: 0.5959, test_loss: 1.1885, test_f1: 0.6252
 epoch: 40, train_loss: 0.6163, test_loss: 1.2116, test_f1: 0.5584
 epoch: 41, train_loss: 0.6354, test_loss: 1.6799, test_f1: 0.5467
 epoch: 42, train_loss: 0.6162, test_loss: 1.3043, test_f1: 0.4977
 epoch: 43, train_loss: 0.6048, test_loss: 1.1047, test_f1: 0.6305
 epoch: 44, train_loss: 0.5953, test_loss: 1.1907, test_f1: 0.5935
 epoch: 45, train_loss: 0.5786, test_loss: 1.6081, test_f1: 0.5242
 epoch: 46, train_loss: 0.5927, test_loss: 1.3608, test_f1: 0.5731
 epoch: 47, train_loss: 0.5802, test_loss: 1.8034, test_f1: 0.4582
 epoch: 48, train_loss: 0.5731, test_loss: 1.2866, test_f1: 0.6155
 epoch: 49, train_loss: 0.5939, test_loss: 1.4401, test_f1: 0.5325
 epoch: 50, train_loss: 0.5485, test_loss: 1.3512, test_f1: 0.5380
 epoch: 51, train_loss: 0.5458, test_loss: 1.2746, test_f1: 0.6345
 epoch: 52, train_loss: 0.5127, test_loss: 1.3205, test_f1: 0.6020
 epoch: 53, train_loss: 0.5109, test_loss: 1.2921, test_f1: 0.5903
 epoch: 54, train_loss: 0.5000, test_loss: 1.4685, test_f1: 0.5735
 epoch: 55, train_loss: 0.5061, test_loss: 1.2379, test_f1: 0.6230
 epoch: 56, train_loss: 0.4624, test_loss: 1.4361, test_f1: 0.5655
 epoch: 57, train_loss: 0.4963, test_loss: 1.4180, test_f1: 0.5391
 epoch: 58, train_loss: 0.5144, test_loss: 1.2647, test_f1: 0.6456
 epoch: 59, train_loss: 0.4988, test_loss: 1.4989, test_f1: 0.5826
 epoch: 60, train_loss: 0.4834, test_loss: 1.2595, test_f1: 0.6553
 epoch: 61, train_loss: 0.4355, test_loss: 1.6376, test_f1: 0.5564
 epoch: 62, train_loss: 0.4519, test_loss: 1.4761, test_f1: 0.6554
 epoch: 63, train_loss: 0.4725, test_loss: 1.3121, test_f1: 0.6039
 epoch: 64, train_loss: 0.4700, test_loss: 1.4062, test_f1: 0.6139
 epoch: 65, train_loss: 0.4594, test_loss: 1.5094, test_f1: 0.5991
 epoch: 66, train_loss: 0.4360, test_loss: 1.4011, test_f1: 0.6227
 epoch: 67, train_loss: 0.4231, test_loss: 1.5286, test_f1: 0.5536
 epoch: 68, train_loss: 0.4489, test_loss: 1.5808, test_f1: 0.6412
 epoch: 69, train_loss: 0.4573, test_loss: 1.3278, test_f1: 0.6326
 epoch: 70, train_loss: 0.4316, test_loss: 1.4795, test_f1: 0.6115
 epoch: 71, train_loss: 0.4721, test_loss: 1.5311, test_f1: 0.5730
 epoch: 72, train_loss: 0.4648, test_loss: 1.4214, test_f1: 0.5945
 epoch: 73, train_loss: 0.4221, test_loss: 1.6944, test_f1: 0.5949
 epoch: 74, train_loss: 0.4209, test_loss: 1.3669, test_f1: 0.5971
 epoch: 75, train_loss: 0.4558, test_loss: 1.6238, test_f1: 0.6037
 epoch: 76, train_loss: 0.3992, test_loss: 1.4810, test_f1: 0.5828
 epoch: 77, train_loss: 0.3917, test_loss: 1.4118, test_f1: 0.5985
 epoch: 78, train_loss: 0.4336, test_loss: 1.3037, test_f1: 0.6304
 epoch: 79, train_loss: 0.4369, test_loss: 1.5331, test_f1: 0.5570
 epoch: 80, train_loss: 0.4290, test_loss: 1.5353, test_f1: 0.5917
 epoch: 81, train_loss: 0.4136, test_loss: 1.5823, test_f1: 0.6065
 epoch: 82, train_loss: 0.4118, test_loss: 1.4720, test_f1: 0.5937
 epoch: 83, train_loss: 0.3793, test_loss: 1.6625, test_f1: 0.5862
 epoch: 84, train_loss: 0.4030, test_loss: 1.5870, test_f1: 0.5992
 epoch: 85, train_loss: 0.3938, test_loss: 1.7802, test_f1: 0.5919
 epoch: 86, train_loss: 0.4043, test_loss: 1.4859, test_f1: 0.6477
 epoch: 87, train_loss: 0.3874, test_loss: 1.6709, test_f1: 0.6018
 epoch: 88, train_loss: 0.3733, test_loss: 1.7958, test_f1: 0.5820
 epoch: 89, train_loss: 0.3788, test_loss: 1.7061, test_f1: 0.6153
 epoch: 90, train_loss: 0.3856, test_loss: 1.6972, test_f1: 0.6475
 epoch: 91, train_loss: 0.3943, test_loss: 2.0726, test_f1: 0.5825
 epoch: 92, train_loss: 0.4265, test_loss: 1.5102, test_f1: 0.6701
 epoch: 93, train_loss: 0.3868, test_loss: 1.7089, test_f1: 0.5902
 epoch: 94, train_loss: 0.3695, test_loss: 1.7194, test_f1: 0.6023
 epoch: 95, train_loss: 0.3997, test_loss: 1.6839, test_f1: 0.6139
 epoch: 96, train_loss: 0.3954, test_loss: 1.9952, test_f1: 0.6075
 epoch: 97, train_loss: 0.3870, test_loss: 1.8380, test_f1: 0.5874
 epoch: 98, train_loss: 0.3836, test_loss: 1.6006, test_f1: 0.6241
 epoch: 99, train_loss: 0.3781, test_loss: 1.6425, test_f1: 0.5867
##################ITERATION #7 ****************************************
 epoch: 0, train_loss: 1.2085, test_loss: 1.3740, test_f1: 0.3405
 epoch: 1, train_loss: 0.9587, test_loss: 1.1050, test_f1: 0.4959
 epoch: 2, train_loss: 0.9291, test_loss: 1.2547, test_f1: 0.4112
 epoch: 3, train_loss: 0.8825, test_loss: 1.0693, test_f1: 0.5720
 epoch: 4, train_loss: 0.8351, test_loss: 1.1251, test_f1: 0.4708
 epoch: 5, train_loss: 0.8193, test_loss: 1.0026, test_f1: 0.5704
 epoch: 6, train_loss: 0.8191, test_loss: 1.0574, test_f1: 0.5279
 epoch: 7, train_loss: 0.7842, test_loss: 1.0968, test_f1: 0.5185
 epoch: 8, train_loss: 0.8203, test_loss: 0.9946, test_f1: 0.5623
 epoch: 9, train_loss: 0.7507, test_loss: 1.3609, test_f1: 0.5685
 epoch: 10, train_loss: 0.7684, test_loss: 1.0374, test_f1: 0.6089
 epoch: 11, train_loss: 0.7929, test_loss: 1.1499, test_f1: 0.5390
 epoch: 12, train_loss: 0.8010, test_loss: 1.0910, test_f1: 0.5565
 epoch: 13, train_loss: 0.7568, test_loss: 1.0767, test_f1: 0.5482
 epoch: 14, train_loss: 0.7186, test_loss: 0.9976, test_f1: 0.6300
 epoch: 15, train_loss: 0.7085, test_loss: 1.2776, test_f1: 0.5189
 epoch: 16, train_loss: 0.7266, test_loss: 1.2128, test_f1: 0.5633
 epoch: 17, train_loss: 0.7388, test_loss: 1.0389, test_f1: 0.5999
 epoch: 18, train_loss: 0.7062, test_loss: 1.0207, test_f1: 0.5824
 epoch: 19, train_loss: 0.7124, test_loss: 1.1251, test_f1: 0.5722
 epoch: 20, train_loss: 0.7039, test_loss: 1.2964, test_f1: 0.5917
 epoch: 21, train_loss: 0.6890, test_loss: 1.3890, test_f1: 0.5687
 epoch: 22, train_loss: 0.6554, test_loss: 1.2418, test_f1: 0.5503
 epoch: 23, train_loss: 0.7018, test_loss: 1.3820, test_f1: 0.5673
 epoch: 24, train_loss: 0.6946, test_loss: 1.1592, test_f1: 0.5896
 epoch: 25, train_loss: 0.6497, test_loss: 1.3562, test_f1: 0.6183
 epoch: 26, train_loss: 0.6694, test_loss: 1.5121, test_f1: 0.5311
 epoch: 27, train_loss: 0.6542, test_loss: 1.3867, test_f1: 0.5975
 epoch: 28, train_loss: 0.6303, test_loss: 1.1382, test_f1: 0.5975
 epoch: 29, train_loss: 0.6222, test_loss: 1.1853, test_f1: 0.5777
 epoch: 30, train_loss: 0.6603, test_loss: 1.1393, test_f1: 0.5996
 epoch: 31, train_loss: 0.6802, test_loss: 1.3700, test_f1: 0.6166
 epoch: 32, train_loss: 0.6587, test_loss: 1.1440, test_f1: 0.6394
 epoch: 33, train_loss: 0.6571, test_loss: 1.2458, test_f1: 0.6118
 epoch: 34, train_loss: 0.6103, test_loss: 1.3567, test_f1: 0.6195
 epoch: 35, train_loss: 0.6039, test_loss: 1.8783, test_f1: 0.6232
 epoch: 36, train_loss: 0.5883, test_loss: 1.9214, test_f1: 0.5938
 epoch: 37, train_loss: 0.5781, test_loss: 1.4607, test_f1: 0.6399
 epoch: 38, train_loss: 0.5858, test_loss: 1.3958, test_f1: 0.5853
 epoch: 39, train_loss: 0.5989, test_loss: 1.6082, test_f1: 0.6064
 epoch: 40, train_loss: 0.5722, test_loss: 1.2002, test_f1: 0.5375
 epoch: 41, train_loss: 0.5898, test_loss: 1.3577, test_f1: 0.6134
 epoch: 42, train_loss: 0.5937, test_loss: 1.8914, test_f1: 0.5499
 epoch: 43, train_loss: 0.5829, test_loss: 1.7390, test_f1: 0.6415
 epoch: 44, train_loss: 0.5944, test_loss: 0.9897, test_f1: 0.6509
 epoch: 45, train_loss: 0.5780, test_loss: 1.5018, test_f1: 0.6164
 epoch: 46, train_loss: 0.5454, test_loss: 1.5855, test_f1: 0.5855
 epoch: 47, train_loss: 0.5455, test_loss: 1.4192, test_f1: 0.6147
 epoch: 48, train_loss: 0.5598, test_loss: 1.3880, test_f1: 0.6601
 epoch: 49, train_loss: 0.5595, test_loss: 1.2852, test_f1: 0.6537
 epoch: 50, train_loss: 0.5753, test_loss: 1.4164, test_f1: 0.6130
 epoch: 51, train_loss: 0.5441, test_loss: 1.5600, test_f1: 0.5949
 epoch: 52, train_loss: 0.4897, test_loss: 1.5557, test_f1: 0.6143
 epoch: 53, train_loss: 0.4467, test_loss: 1.6236, test_f1: 0.6044
 epoch: 54, train_loss: 0.4245, test_loss: 1.9479, test_f1: 0.5846
 epoch: 55, train_loss: 0.4307, test_loss: 1.7874, test_f1: 0.6544
 epoch: 56, train_loss: 0.4290, test_loss: 2.1120, test_f1: 0.6418
 epoch: 57, train_loss: 0.3987, test_loss: 1.8601, test_f1: 0.5771
 epoch: 58, train_loss: 0.3974, test_loss: 1.9896, test_f1: 0.6254
 epoch: 59, train_loss: 0.3925, test_loss: 1.8573, test_f1: 0.6162
 epoch: 60, train_loss: 0.4011, test_loss: 1.7577, test_f1: 0.6420
 epoch: 61, train_loss: 0.4362, test_loss: 1.9949, test_f1: 0.5154
 epoch: 62, train_loss: 0.3966, test_loss: 2.0546, test_f1: 0.5946
 epoch: 63, train_loss: 0.3879, test_loss: 1.6546, test_f1: 0.6227
 epoch: 64, train_loss: 0.3981, test_loss: 1.8608, test_f1: 0.6193
 epoch: 65, train_loss: 0.3745, test_loss: 1.8541, test_f1: 0.6069
 epoch: 66, train_loss: 0.3617, test_loss: 2.0986, test_f1: 0.6257
 epoch: 67, train_loss: 0.3770, test_loss: 1.7590, test_f1: 0.6201
 epoch: 68, train_loss: 0.3872, test_loss: 2.0468, test_f1: 0.6202
 epoch: 69, train_loss: 0.3622, test_loss: 2.5868, test_f1: 0.5836
 epoch: 70, train_loss: 0.3974, test_loss: 1.8636, test_f1: 0.5970
 epoch: 71, train_loss: 0.3378, test_loss: 1.9918, test_f1: 0.6352
 epoch: 72, train_loss: 0.3712, test_loss: 2.0028, test_f1: 0.6115
 epoch: 73, train_loss: 0.3718, test_loss: 2.4925, test_f1: 0.5955
 epoch: 74, train_loss: 0.3762, test_loss: 1.9915, test_f1: 0.6291
 epoch: 75, train_loss: 0.3602, test_loss: 2.0143, test_f1: 0.6438
 epoch: 76, train_loss: 0.3755, test_loss: 2.0295, test_f1: 0.6230
 epoch: 77, train_loss: 0.3558, test_loss: 1.8579, test_f1: 0.6253
 epoch: 78, train_loss: 0.3523, test_loss: 2.1374, test_f1: 0.6057
 epoch: 79, train_loss: 0.3592, test_loss: 2.2512, test_f1: 0.6172
 epoch: 80, train_loss: 0.3225, test_loss: 2.0611, test_f1: 0.6135
 epoch: 81, train_loss: 0.3145, test_loss: 2.0660, test_f1: 0.6364
 epoch: 82, train_loss: 0.3385, test_loss: 1.6705, test_f1: 0.6498
 epoch: 83, train_loss: 0.3357, test_loss: 2.3399, test_f1: 0.6206
 epoch: 84, train_loss: 0.3003, test_loss: 1.9616, test_f1: 0.6272
 epoch: 85, train_loss: 0.3104, test_loss: 2.0913, test_f1: 0.6238
 epoch: 86, train_loss: 0.3053, test_loss: 2.1741, test_f1: 0.6353
 epoch: 87, train_loss: 0.3172, test_loss: 2.2401, test_f1: 0.6046
 epoch: 88, train_loss: 0.3173, test_loss: 2.3578, test_f1: 0.6190
 epoch: 89, train_loss: 0.3199, test_loss: 2.4650, test_f1: 0.6376
 epoch: 90, train_loss: 0.2966, test_loss: 2.6069, test_f1: 0.5784
 epoch: 91, train_loss: 0.2967, test_loss: 2.1168, test_f1: 0.6653
 epoch: 92, train_loss: 0.2764, test_loss: 2.2391, test_f1: 0.6379
 epoch: 93, train_loss: 0.2809, test_loss: 2.0584, test_f1: 0.6426
 epoch: 94, train_loss: 0.2862, test_loss: 2.2502, test_f1: 0.6073
 epoch: 95, train_loss: 0.2812, test_loss: 2.3870, test_f1: 0.6178
 epoch: 96, train_loss: 0.2786, test_loss: 2.6444, test_f1: 0.6432
 epoch: 97, train_loss: 0.2622, test_loss: 3.0635, test_f1: 0.5657
 epoch: 98, train_loss: 0.2936, test_loss: 2.7175, test_f1: 0.5753
 epoch: 99, train_loss: 0.2951, test_loss: 2.4566, test_f1: 0.6559
##################ITERATION #8 ****************************************
 epoch: 0, train_loss: 1.2524, test_loss: 1.2648, test_f1: 0.3507
 epoch: 1, train_loss: 0.9715, test_loss: 1.1189, test_f1: 0.4850
 epoch: 2, train_loss: 0.9322, test_loss: 0.9691, test_f1: 0.5617
 epoch: 3, train_loss: 0.8879, test_loss: 1.0750, test_f1: 0.4347
 epoch: 4, train_loss: 0.8576, test_loss: 0.9574, test_f1: 0.5585
 epoch: 5, train_loss: 0.8555, test_loss: 0.9739, test_f1: 0.5492
 epoch: 6, train_loss: 0.8383, test_loss: 0.9636, test_f1: 0.5663
 epoch: 7, train_loss: 0.8204, test_loss: 1.5287, test_f1: 0.4008
 epoch: 8, train_loss: 0.8513, test_loss: 0.9194, test_f1: 0.5882
 epoch: 9, train_loss: 0.8193, test_loss: 1.1851, test_f1: 0.4127
 epoch: 10, train_loss: 0.8211, test_loss: 0.9398, test_f1: 0.5770
 epoch: 11, train_loss: 0.8347, test_loss: 1.5142, test_f1: 0.4452
 epoch: 12, train_loss: 0.7889, test_loss: 1.0035, test_f1: 0.5848
 epoch: 13, train_loss: 0.8192, test_loss: 0.9591, test_f1: 0.5571
 epoch: 14, train_loss: 0.7844, test_loss: 1.1258, test_f1: 0.5630
 epoch: 15, train_loss: 0.7562, test_loss: 0.8854, test_f1: 0.6301
 epoch: 16, train_loss: 0.7782, test_loss: 1.1088, test_f1: 0.5345
 epoch: 17, train_loss: 0.7719, test_loss: 0.9806, test_f1: 0.6053
 epoch: 18, train_loss: 0.7261, test_loss: 1.0775, test_f1: 0.5064
 epoch: 19, train_loss: 0.7339, test_loss: 0.9095, test_f1: 0.6581
 epoch: 20, train_loss: 0.7195, test_loss: 1.0369, test_f1: 0.6186
 epoch: 21, train_loss: 0.7535, test_loss: 1.2093, test_f1: 0.5122
 epoch: 22, train_loss: 0.7578, test_loss: 1.1830, test_f1: 0.5380
 epoch: 23, train_loss: 0.7416, test_loss: 1.0242, test_f1: 0.6056
 epoch: 24, train_loss: 0.7243, test_loss: 0.9823, test_f1: 0.5885
 epoch: 25, train_loss: 0.7080, test_loss: 1.0115, test_f1: 0.5489
 epoch: 26, train_loss: 0.6800, test_loss: 1.2330, test_f1: 0.5790
 epoch: 27, train_loss: 0.6573, test_loss: 1.4309, test_f1: 0.5934
 epoch: 28, train_loss: 0.6968, test_loss: 1.5299, test_f1: 0.5314
 epoch: 29, train_loss: 0.7085, test_loss: 1.1798, test_f1: 0.6037
 epoch: 30, train_loss: 0.6598, test_loss: 1.4025, test_f1: 0.4797
 epoch: 31, train_loss: 0.6783, test_loss: 1.1064, test_f1: 0.5283
 epoch: 32, train_loss: 0.6735, test_loss: 1.1134, test_f1: 0.5316
 epoch: 33, train_loss: 0.6497, test_loss: 1.1478, test_f1: 0.5856
 epoch: 34, train_loss: 0.6594, test_loss: 1.2427, test_f1: 0.5662
 epoch: 35, train_loss: 0.6615, test_loss: 1.0925, test_f1: 0.5899
 epoch: 36, train_loss: 0.6672, test_loss: 1.1751, test_f1: 0.5497
 epoch: 37, train_loss: 0.6489, test_loss: 1.1883, test_f1: 0.5897
 epoch: 38, train_loss: 0.6204, test_loss: 1.1019, test_f1: 0.5786
 epoch: 39, train_loss: 0.6441, test_loss: 1.1034, test_f1: 0.5842
 epoch: 40, train_loss: 0.6182, test_loss: 1.1224, test_f1: 0.6124
 epoch: 41, train_loss: 0.6332, test_loss: 1.4350, test_f1: 0.6263
 epoch: 42, train_loss: 0.6261, test_loss: 1.2150, test_f1: 0.5871
 epoch: 43, train_loss: 0.6051, test_loss: 1.1686, test_f1: 0.6287
 epoch: 44, train_loss: 0.5726, test_loss: 1.4263, test_f1: 0.5643
 epoch: 45, train_loss: 0.5787, test_loss: 1.1150, test_f1: 0.5895
 epoch: 46, train_loss: 0.6059, test_loss: 1.2549, test_f1: 0.5808
 epoch: 47, train_loss: 0.6035, test_loss: 1.2966, test_f1: 0.6421
 epoch: 48, train_loss: 0.5781, test_loss: 1.1500, test_f1: 0.5894
 epoch: 49, train_loss: 0.5685, test_loss: 1.2517, test_f1: 0.6106
 epoch: 50, train_loss: 0.5791, test_loss: 1.2437, test_f1: 0.6200
 epoch: 51, train_loss: 0.5392, test_loss: 1.5174, test_f1: 0.5849
 epoch: 52, train_loss: 0.5073, test_loss: 1.3856, test_f1: 0.6481
 epoch: 53, train_loss: 0.4940, test_loss: 1.4426, test_f1: 0.6541
 epoch: 54, train_loss: 0.5119, test_loss: 1.5482, test_f1: 0.6244
 epoch: 55, train_loss: 0.4800, test_loss: 1.5460, test_f1: 0.5646
 epoch: 56, train_loss: 0.4713, test_loss: 1.5820, test_f1: 0.6414
 epoch: 57, train_loss: 0.4797, test_loss: 1.4784, test_f1: 0.6327
 epoch: 58, train_loss: 0.4813, test_loss: 1.4582, test_f1: 0.6827
 epoch: 59, train_loss: 0.4763, test_loss: 1.4989, test_f1: 0.6421
 epoch: 60, train_loss: 0.4436, test_loss: 1.5951, test_f1: 0.6147
 epoch: 61, train_loss: 0.4654, test_loss: 1.3789, test_f1: 0.6124
 epoch: 62, train_loss: 0.4510, test_loss: 1.7008, test_f1: 0.5767
 epoch: 63, train_loss: 0.4356, test_loss: 1.5301, test_f1: 0.5611
 epoch: 64, train_loss: 0.4248, test_loss: 1.6730, test_f1: 0.6091
 epoch: 65, train_loss: 0.4263, test_loss: 1.5521, test_f1: 0.5872
 epoch: 66, train_loss: 0.4271, test_loss: 1.6067, test_f1: 0.6244
 epoch: 67, train_loss: 0.4471, test_loss: 1.6715, test_f1: 0.5776
 epoch: 68, train_loss: 0.4153, test_loss: 1.8072, test_f1: 0.6556
 epoch: 69, train_loss: 0.4393, test_loss: 1.7190, test_f1: 0.4705
 epoch: 70, train_loss: 0.5393, test_loss: 1.4804, test_f1: 0.4816
 epoch: 71, train_loss: 0.4730, test_loss: 1.4964, test_f1: 0.6464
 epoch: 72, train_loss: 0.4144, test_loss: 1.4389, test_f1: 0.6318
 epoch: 73, train_loss: 0.4366, test_loss: 1.5710, test_f1: 0.6727
 epoch: 74, train_loss: 0.4099, test_loss: 1.5857, test_f1: 0.6286
 epoch: 75, train_loss: 0.4344, test_loss: 1.4425, test_f1: 0.6234
 epoch: 76, train_loss: 0.4107, test_loss: 1.4267, test_f1: 0.6616
 epoch: 77, train_loss: 0.4057, test_loss: 1.5688, test_f1: 0.6309
 epoch: 78, train_loss: 0.4304, test_loss: 1.7003, test_f1: 0.5975
 epoch: 79, train_loss: 0.4201, test_loss: 1.4438, test_f1: 0.6637
 epoch: 80, train_loss: 0.3592, test_loss: 1.9082, test_f1: 0.5519
 epoch: 81, train_loss: 0.3717, test_loss: 1.5513, test_f1: 0.6242
 epoch: 82, train_loss: 0.3900, test_loss: 1.8926, test_f1: 0.5855
 epoch: 83, train_loss: 0.3867, test_loss: 1.9282, test_f1: 0.5768
 epoch: 84, train_loss: 0.3739, test_loss: 1.6790, test_f1: 0.6165
 epoch: 85, train_loss: 0.3860, test_loss: 1.6541, test_f1: 0.6301
 epoch: 86, train_loss: 0.3771, test_loss: 2.1685, test_f1: 0.5698
 epoch: 87, train_loss: 0.3673, test_loss: 1.6906, test_f1: 0.5923
 epoch: 88, train_loss: 0.3547, test_loss: 1.7981, test_f1: 0.6522
 epoch: 89, train_loss: 0.3587, test_loss: 1.7431, test_f1: 0.6376
 epoch: 90, train_loss: 0.3553, test_loss: 1.9182, test_f1: 0.6157
 epoch: 91, train_loss: 0.3615, test_loss: 1.9143, test_f1: 0.6286
 epoch: 92, train_loss: 0.3370, test_loss: 1.8693, test_f1: 0.6518
 epoch: 93, train_loss: 0.3290, test_loss: 1.9072, test_f1: 0.5835
 epoch: 94, train_loss: 0.3520, test_loss: 1.8852, test_f1: 0.6006
 epoch: 95, train_loss: 0.3689, test_loss: 2.0377, test_f1: 0.5577
 epoch: 96, train_loss: 0.3789, test_loss: 1.6662, test_f1: 0.6418
 epoch: 97, train_loss: 0.3303, test_loss: 1.7900, test_f1: 0.6193
 epoch: 98, train_loss: 0.3403, test_loss: 1.7827, test_f1: 0.6398
 epoch: 99, train_loss: 0.3543, test_loss: 1.9010, test_f1: 0.6266
##################ITERATION #9 ****************************************
 epoch: 0, train_loss: 1.2330, test_loss: 1.6568, test_f1: 0.1814
 epoch: 1, train_loss: 0.9819, test_loss: 1.0425, test_f1: 0.5202
 epoch: 2, train_loss: 0.8988, test_loss: 1.0696, test_f1: 0.4958
 epoch: 3, train_loss: 0.8800, test_loss: 1.0017, test_f1: 0.5469
 epoch: 4, train_loss: 0.8488, test_loss: 0.9361, test_f1: 0.5222
 epoch: 5, train_loss: 0.8256, test_loss: 1.0847, test_f1: 0.5105
 epoch: 6, train_loss: 0.8384, test_loss: 0.9933, test_f1: 0.5752
 epoch: 7, train_loss: 0.8229, test_loss: 0.9641, test_f1: 0.6007
 epoch: 8, train_loss: 0.8130, test_loss: 1.2485, test_f1: 0.5318
 epoch: 9, train_loss: 0.8054, test_loss: 1.1823, test_f1: 0.5748
 epoch: 10, train_loss: 0.7864, test_loss: 1.0599, test_f1: 0.6206
 epoch: 11, train_loss: 0.7680, test_loss: 1.3292, test_f1: 0.5878
 epoch: 12, train_loss: 0.7605, test_loss: 1.0662, test_f1: 0.5689
 epoch: 13, train_loss: 0.7570, test_loss: 1.2938, test_f1: 0.5062
 epoch: 14, train_loss: 0.7462, test_loss: 1.3111, test_f1: 0.5749
 epoch: 15, train_loss: 0.7242, test_loss: 1.1639, test_f1: 0.5733
 epoch: 16, train_loss: 0.7535, test_loss: 1.0461, test_f1: 0.6058
 epoch: 17, train_loss: 0.7205, test_loss: 1.2022, test_f1: 0.5417
 epoch: 18, train_loss: 0.7055, test_loss: 1.0499, test_f1: 0.5945
 epoch: 19, train_loss: 0.7476, test_loss: 1.0812, test_f1: 0.6045
 epoch: 20, train_loss: 0.7052, test_loss: 1.0018, test_f1: 0.6286
 epoch: 21, train_loss: 0.7008, test_loss: 1.2114, test_f1: 0.5839
 epoch: 22, train_loss: 0.7143, test_loss: 1.1642, test_f1: 0.6290
 epoch: 23, train_loss: 0.6926, test_loss: 1.7407, test_f1: 0.4571
 epoch: 24, train_loss: 0.6636, test_loss: 1.4077, test_f1: 0.5171
 epoch: 25, train_loss: 0.6922, test_loss: 1.3571, test_f1: 0.5589
 epoch: 26, train_loss: 0.6664, test_loss: 1.0882, test_f1: 0.5963
 epoch: 27, train_loss: 0.6610, test_loss: 1.2734, test_f1: 0.6159
 epoch: 28, train_loss: 0.6417, test_loss: 1.0792, test_f1: 0.6365
 epoch: 29, train_loss: 0.6520, test_loss: 1.3578, test_f1: 0.5341
 epoch: 30, train_loss: 0.6379, test_loss: 1.0643, test_f1: 0.6272
 epoch: 31, train_loss: 0.6399, test_loss: 1.2461, test_f1: 0.6097
 epoch: 32, train_loss: 0.6465, test_loss: 1.3667, test_f1: 0.6427
 epoch: 33, train_loss: 0.6127, test_loss: 1.4269, test_f1: 0.6162
 epoch: 34, train_loss: 0.6394, test_loss: 1.2766, test_f1: 0.5862
 epoch: 35, train_loss: 0.6419, test_loss: 1.0697, test_f1: 0.5734
 epoch: 36, train_loss: 0.6476, test_loss: 1.1454, test_f1: 0.5658
 epoch: 37, train_loss: 0.6010, test_loss: 1.2708, test_f1: 0.6057
 epoch: 38, train_loss: 0.6149, test_loss: 1.2874, test_f1: 0.6458
 epoch: 39, train_loss: 0.6258, test_loss: 1.1601, test_f1: 0.6045
 epoch: 40, train_loss: 0.6201, test_loss: 0.9864, test_f1: 0.6397
 epoch: 41, train_loss: 0.5659, test_loss: 1.2271, test_f1: 0.6500
 epoch: 42, train_loss: 0.5538, test_loss: 1.3656, test_f1: 0.5351
 epoch: 43, train_loss: 0.5849, test_loss: 1.7199, test_f1: 0.5568
 epoch: 44, train_loss: 0.5481, test_loss: 1.5950, test_f1: 0.5597
 epoch: 45, train_loss: 0.6205, test_loss: 1.2040, test_f1: 0.5372
 epoch: 46, train_loss: 0.5911, test_loss: 1.2503, test_f1: 0.6486
 epoch: 47, train_loss: 0.6251, test_loss: 1.1040, test_f1: 0.5634
 epoch: 48, train_loss: 0.5906, test_loss: 1.3146, test_f1: 0.5809
 epoch: 49, train_loss: 0.6010, test_loss: 1.2430, test_f1: 0.5603
 epoch: 50, train_loss: 0.5553, test_loss: 1.2262, test_f1: 0.5822
 epoch: 51, train_loss: 0.5197, test_loss: 1.3970, test_f1: 0.6228
 epoch: 52, train_loss: 0.4936, test_loss: 1.5637, test_f1: 0.6093
 epoch: 53, train_loss: 0.4977, test_loss: 1.4128, test_f1: 0.6047
 epoch: 54, train_loss: 0.5273, test_loss: 1.2205, test_f1: 0.6526
 epoch: 55, train_loss: 0.4902, test_loss: 1.5069, test_f1: 0.5461
 epoch: 56, train_loss: 0.4562, test_loss: 1.5337, test_f1: 0.6108
 epoch: 57, train_loss: 0.4333, test_loss: 1.6795, test_f1: 0.6010
 epoch: 58, train_loss: 0.4633, test_loss: 1.4223, test_f1: 0.6071
 epoch: 59, train_loss: 0.4895, test_loss: 1.4211, test_f1: 0.6116
 epoch: 60, train_loss: 0.4458, test_loss: 1.7319, test_f1: 0.5967
 epoch: 61, train_loss: 0.4278, test_loss: 1.4428, test_f1: 0.6052
 epoch: 62, train_loss: 0.4465, test_loss: 1.4652, test_f1: 0.5826
 epoch: 63, train_loss: 0.4338, test_loss: 1.6526, test_f1: 0.5597
 epoch: 64, train_loss: 0.4304, test_loss: 1.7910, test_f1: 0.5727
 epoch: 65, train_loss: 0.3962, test_loss: 1.6959, test_f1: 0.5869
 epoch: 66, train_loss: 0.4435, test_loss: 2.0667, test_f1: 0.5813
 epoch: 67, train_loss: 0.4661, test_loss: 1.3474, test_f1: 0.6250
 epoch: 68, train_loss: 0.4278, test_loss: 1.6434, test_f1: 0.5504
 epoch: 69, train_loss: 0.4034, test_loss: 1.8910, test_f1: 0.5398
 epoch: 70, train_loss: 0.4348, test_loss: 1.8486, test_f1: 0.5591
 epoch: 71, train_loss: 0.3960, test_loss: 1.4036, test_f1: 0.5344
 epoch: 72, train_loss: 0.3725, test_loss: 1.5772, test_f1: 0.5845
 epoch: 73, train_loss: 0.3723, test_loss: 1.5845, test_f1: 0.5657
 epoch: 74, train_loss: 0.4234, test_loss: 1.7643, test_f1: 0.5843
 epoch: 75, train_loss: 0.3927, test_loss: 1.8463, test_f1: 0.6020
 epoch: 76, train_loss: 0.3975, test_loss: 1.6095, test_f1: 0.5579
 epoch: 77, train_loss: 0.3896, test_loss: 1.8286, test_f1: 0.5892
 epoch: 78, train_loss: 0.3917, test_loss: 1.9597, test_f1: 0.5662
 epoch: 79, train_loss: 0.3649, test_loss: 1.7090, test_f1: 0.5585
 epoch: 80, train_loss: 0.3893, test_loss: 1.8388, test_f1: 0.5834
 epoch: 81, train_loss: 0.3718, test_loss: 1.6425, test_f1: 0.6026
 epoch: 82, train_loss: 0.3758, test_loss: 1.9326, test_f1: 0.5820
 epoch: 83, train_loss: 0.3603, test_loss: 1.5379, test_f1: 0.5754
 epoch: 84, train_loss: 0.3418, test_loss: 1.5978, test_f1: 0.6677
 epoch: 85, train_loss: 0.3508, test_loss: 1.8439, test_f1: 0.5598
 epoch: 86, train_loss: 0.3856, test_loss: 1.5557, test_f1: 0.6123
 epoch: 87, train_loss: 0.3515, test_loss: 1.4988, test_f1: 0.6159
 epoch: 88, train_loss: 0.3602, test_loss: 1.6555, test_f1: 0.6023
 epoch: 89, train_loss: 0.3733, test_loss: 1.5773, test_f1: 0.5640
 epoch: 90, train_loss: 0.3713, test_loss: 1.9407, test_f1: 0.5638
 epoch: 91, train_loss: 0.3535, test_loss: 1.5736, test_f1: 0.6276
 epoch: 92, train_loss: 0.3415, test_loss: 1.9690, test_f1: 0.5756
 epoch: 93, train_loss: 0.3484, test_loss: 1.6187, test_f1: 0.6019
 epoch: 94, train_loss: 0.3124, test_loss: 1.7383, test_f1: 0.5946
 epoch: 95, train_loss: 0.3488, test_loss: 2.0246, test_f1: 0.5703
 epoch: 96, train_loss: 0.3307, test_loss: 1.7547, test_f1: 0.6023
 epoch: 97, train_loss: 0.3220, test_loss: 1.7990, test_f1: 0.5984
 epoch: 98, train_loss: 0.3584, test_loss: 2.4830, test_f1: 0.5719
 epoch: 99, train_loss: 0.4425, test_loss: 1.7171, test_f1: 0.6215

Training completed in 554.06 seconds
Best F1: 0.7175 at epoch 82
Mean F1 across iterations: 0.6787  0.0165
========================FINAL RESULTS================================
FEGIN weighted F1: 0.7175  0.0165
python main.py --data ltspice_demos --representation component_pin --model FEGIN --layers 6 --hiddens 64 --batch_size 64 --lr 0.01 --emb_size 250 --epochs 100 --save_appendix component_pin_L6_H64_BS64_LR0.01_E250 --no_val
-----



STDERR:
  File "main.py", line 370, in <module>
    main()
  File "main.py", line 254, in main
    dataset = dataset_class(
  File "/home/philip/projects/ltspice_examples_code_repo/Circuit-Completion-Using-GNNs/component_classification_with_link_prediction_head/evaluation/FEGIN/kernel/circuit_datasets.py", line 15, in __init__
    self.data, self.slices = torch.load(self.processed_paths[0])
  File "/home/philip/.local/lib/python3.8/site-packages/torch/serialization.py", line 1040, in load
    warnings.warn(
  File "/usr/lib/python3.8/warnings.py", line 109, in _showwarnmsg
    sw(msg.message, msg.category, msg.filename, msg.lineno,
  File "main.py", line 47, in warn_with_traceback
    traceback.print_stack(file=log)
/home/philip/projects/ltspice_examples_code_repo/Circuit-Completion-Using-GNNs/component_classification_with_link_prediction_head/evaluation/FEGIN/kernel/circuit_datasets.py:15: FutureWarning: You are using `torch.load` with `weights_only=False` (the current default value), which uses the default pickle module implicitly. It is possible to construct malicious pickle data which will execute arbitrary code during unpickling (See https://github.com/pytorch/pytorch/blob/main/SECURITY.md#untrusted-models for more details). In a future release, the default value for `weights_only` will be flipped to `True`. This limits the functions that could be executed during unpickling. Arbitrary objects will no longer be allowed to be loaded via this mode unless they are explicitly allowlisted by the user via `torch.serialization.add_safe_globals`. We recommend you start setting `weights_only=True` for any use case where you don't have full control of the loaded file. Please open an issue on GitHub for any issues related to this experimental feature.
  self.data, self.slices = torch.load(self.processed_paths[0])
