STDOUT:
Results will be saved in /home/philip/projects/ltspice_examples_code_repo/Circuit-Completion-Using-GNNs/component_classification_with_link_prediction_head/evaluation/FEGIN/results/model_FEGIN_dataset_ltspice_demos
Command line input: python main.py --data ltspice_demos --representation component_pin_net --model FEGIN --layers 2 --hiddens 128 --batch_size 32 --lr 0.01 --emb_size 128 --epochs 100 --save_appendix component_pin_net_L2_H128_BS32_LR0.01_E128 --no_val
 is saved.
-----
ltspice_demos - FEGIN
Using 2 layers, 128 hidden units, h = 2
Loading component_pin_net representation dataset
ENTERED
Training FEGIN on component_pin_net representation
Train: 1565, Test: 383
##################ITERATION #0 ****************************************
 epoch: 0, train_loss: 1.1172, test_loss: 1.6354, test_f1: 0.2334
 epoch: 1, train_loss: 1.0112, test_loss: 1.3906, test_f1: 0.3252
 epoch: 2, train_loss: 0.9526, test_loss: 1.0623, test_f1: 0.5492
 epoch: 3, train_loss: 0.9398, test_loss: 1.0138, test_f1: 0.5590
 epoch: 4, train_loss: 0.9165, test_loss: 1.0297, test_f1: 0.5326
 epoch: 5, train_loss: 0.8978, test_loss: 1.0034, test_f1: 0.5352
 epoch: 6, train_loss: 0.8555, test_loss: 1.0851, test_f1: 0.5848
 epoch: 7, train_loss: 0.8368, test_loss: 0.9755, test_f1: 0.5801
 epoch: 8, train_loss: 0.8501, test_loss: 1.0234, test_f1: 0.4882
 epoch: 9, train_loss: 0.8422, test_loss: 1.4411, test_f1: 0.3846
 epoch: 10, train_loss: 0.8160, test_loss: 1.1564, test_f1: 0.5910
 epoch: 11, train_loss: 0.8249, test_loss: 0.9477, test_f1: 0.5613
 epoch: 12, train_loss: 0.7808, test_loss: 1.2399, test_f1: 0.5569
 epoch: 13, train_loss: 0.7747, test_loss: 1.2902, test_f1: 0.4249
 epoch: 14, train_loss: 0.7971, test_loss: 1.1049, test_f1: 0.4922
 epoch: 15, train_loss: 0.7655, test_loss: 1.2138, test_f1: 0.3739
 epoch: 16, train_loss: 0.7694, test_loss: 1.7807, test_f1: 0.4422
 epoch: 17, train_loss: 0.7417, test_loss: 0.9526, test_f1: 0.5969
 epoch: 18, train_loss: 0.7429, test_loss: 1.0838, test_f1: 0.5721
 epoch: 19, train_loss: 0.7229, test_loss: 0.9543, test_f1: 0.5691
 epoch: 20, train_loss: 0.7192, test_loss: 1.1072, test_f1: 0.5549
 epoch: 21, train_loss: 0.6902, test_loss: 0.9481, test_f1: 0.6051
 epoch: 22, train_loss: 0.6845, test_loss: 1.1862, test_f1: 0.5962
 epoch: 23, train_loss: 0.7333, test_loss: 1.1930, test_f1: 0.5380
 epoch: 24, train_loss: 0.7096, test_loss: 1.0897, test_f1: 0.5328
 epoch: 25, train_loss: 0.6436, test_loss: 1.5597, test_f1: 0.5907
 epoch: 26, train_loss: 0.7143, test_loss: 1.4486, test_f1: 0.5184
 epoch: 27, train_loss: 0.6557, test_loss: 1.2168, test_f1: 0.5102
 epoch: 28, train_loss: 0.6582, test_loss: 1.3328, test_f1: 0.5968
 epoch: 29, train_loss: 0.6368, test_loss: 1.3400, test_f1: 0.5282
 epoch: 30, train_loss: 0.6412, test_loss: 1.1378, test_f1: 0.5949
 epoch: 31, train_loss: 0.6475, test_loss: 1.0658, test_f1: 0.5746
 epoch: 32, train_loss: 0.6340, test_loss: 1.0685, test_f1: 0.5683
 epoch: 33, train_loss: 0.6107, test_loss: 1.2402, test_f1: 0.5587
 epoch: 34, train_loss: 0.6198, test_loss: 1.6212, test_f1: 0.6109
 epoch: 35, train_loss: 0.6002, test_loss: 1.2661, test_f1: 0.5947
 epoch: 36, train_loss: 0.5827, test_loss: 1.1533, test_f1: 0.6262
 epoch: 37, train_loss: 0.5928, test_loss: 1.3257, test_f1: 0.5898
 epoch: 38, train_loss: 0.5853, test_loss: 1.0897, test_f1: 0.6136
 epoch: 39, train_loss: 0.5747, test_loss: 1.0893, test_f1: 0.6203
 epoch: 40, train_loss: 0.5854, test_loss: 1.2772, test_f1: 0.4796
 epoch: 41, train_loss: 0.5905, test_loss: 1.2318, test_f1: 0.6442
 epoch: 42, train_loss: 0.5430, test_loss: 1.3248, test_f1: 0.6113
 epoch: 43, train_loss: 0.5384, test_loss: 1.8070, test_f1: 0.5665
 epoch: 44, train_loss: 0.5507, test_loss: 1.2275, test_f1: 0.5943
 epoch: 45, train_loss: 0.5626, test_loss: 1.3639, test_f1: 0.5380
 epoch: 46, train_loss: 0.5072, test_loss: 1.5207, test_f1: 0.5087
 epoch: 47, train_loss: 0.5026, test_loss: 1.6083, test_f1: 0.6082
 epoch: 48, train_loss: 0.5477, test_loss: 1.3494, test_f1: 0.5592
 epoch: 49, train_loss: 0.5197, test_loss: 1.7602, test_f1: 0.5643
 epoch: 50, train_loss: 0.5206, test_loss: 1.4487, test_f1: 0.6189
 epoch: 51, train_loss: 0.4519, test_loss: 1.5912, test_f1: 0.6590
 epoch: 52, train_loss: 0.4309, test_loss: 1.6488, test_f1: 0.6330
 epoch: 53, train_loss: 0.4083, test_loss: 1.8194, test_f1: 0.5815
 epoch: 54, train_loss: 0.4132, test_loss: 1.6579, test_f1: 0.5957
 epoch: 55, train_loss: 0.4265, test_loss: 1.7951, test_f1: 0.6105
 epoch: 56, train_loss: 0.3849, test_loss: 1.7113, test_f1: 0.6223
 epoch: 57, train_loss: 0.3736, test_loss: 1.7668, test_f1: 0.6269
 epoch: 58, train_loss: 0.3904, test_loss: 1.8863, test_f1: 0.6254
 epoch: 59, train_loss: 0.4125, test_loss: 1.4904, test_f1: 0.6688
 epoch: 60, train_loss: 0.3931, test_loss: 1.5642, test_f1: 0.6483
 epoch: 61, train_loss: 0.3855, test_loss: 1.7496, test_f1: 0.6729
 epoch: 62, train_loss: 0.3483, test_loss: 1.8247, test_f1: 0.6274
 epoch: 63, train_loss: 0.3503, test_loss: 1.8050, test_f1: 0.6584
 epoch: 64, train_loss: 0.3363, test_loss: 1.7978, test_f1: 0.6086
 epoch: 65, train_loss: 0.3717, test_loss: 1.6711, test_f1: 0.5843
 epoch: 66, train_loss: 0.3291, test_loss: 1.8114, test_f1: 0.5846
 epoch: 67, train_loss: 0.3549, test_loss: 2.2065, test_f1: 0.5236
 epoch: 68, train_loss: 0.3403, test_loss: 2.1383, test_f1: 0.5770
 epoch: 69, train_loss: 0.3363, test_loss: 1.7867, test_f1: 0.6277
 epoch: 70, train_loss: 0.3220, test_loss: 1.9007, test_f1: 0.6267
 epoch: 71, train_loss: 0.3299, test_loss: 2.0745, test_f1: 0.6112
 epoch: 72, train_loss: 0.3219, test_loss: 1.9819, test_f1: 0.5928
 epoch: 73, train_loss: 0.3202, test_loss: 1.8897, test_f1: 0.6085
 epoch: 74, train_loss: 0.3338, test_loss: 2.0082, test_f1: 0.6241
 epoch: 75, train_loss: 0.3128, test_loss: 1.8267, test_f1: 0.6299
 epoch: 76, train_loss: 0.2978, test_loss: 1.9118, test_f1: 0.6427
 epoch: 77, train_loss: 0.3286, test_loss: 1.9045, test_f1: 0.6195
 epoch: 78, train_loss: 0.2822, test_loss: 2.1888, test_f1: 0.6164
 epoch: 79, train_loss: 0.2981, test_loss: 2.0427, test_f1: 0.6616
 epoch: 80, train_loss: 0.3191, test_loss: 2.0223, test_f1: 0.6634
 epoch: 81, train_loss: 0.3136, test_loss: 2.0051, test_f1: 0.6339
 epoch: 82, train_loss: 0.2606, test_loss: 1.9931, test_f1: 0.6112
 epoch: 83, train_loss: 0.3279, test_loss: 1.8354, test_f1: 0.5963
 epoch: 84, train_loss: 0.2672, test_loss: 2.0934, test_f1: 0.6734
 epoch: 85, train_loss: 0.3177, test_loss: 1.8536, test_f1: 0.6169
 epoch: 86, train_loss: 0.3010, test_loss: 2.0748, test_f1: 0.5712
 epoch: 87, train_loss: 0.2556, test_loss: 2.5266, test_f1: 0.6415
 epoch: 88, train_loss: 0.3093, test_loss: 1.9302, test_f1: 0.6322
 epoch: 89, train_loss: 0.2814, test_loss: 1.8030, test_f1: 0.6302
 epoch: 90, train_loss: 0.2642, test_loss: 2.0939, test_f1: 0.5843
 epoch: 91, train_loss: 0.2462, test_loss: 2.1165, test_f1: 0.6017
 epoch: 92, train_loss: 0.2756, test_loss: 1.9773, test_f1: 0.6728
 epoch: 93, train_loss: 0.2505, test_loss: 2.1263, test_f1: 0.6492
 epoch: 94, train_loss: 0.2681, test_loss: 2.2192, test_f1: 0.6345
 epoch: 95, train_loss: 0.2754, test_loss: 2.1640, test_f1: 0.6034
 epoch: 96, train_loss: 0.2798, test_loss: 2.2873, test_f1: 0.6183
 epoch: 97, train_loss: 0.2152, test_loss: 2.5022, test_f1: 0.5953
 epoch: 98, train_loss: 0.2715, test_loss: 2.1083, test_f1: 0.6144
 epoch: 99, train_loss: 0.2522, test_loss: 2.2074, test_f1: 0.5959
##################ITERATION #1 ****************************************
 epoch: 0, train_loss: 1.1343, test_loss: 1.1125, test_f1: 0.3428
 epoch: 1, train_loss: 1.0065, test_loss: 1.1166, test_f1: 0.3832
 epoch: 2, train_loss: 0.9619, test_loss: 1.0610, test_f1: 0.5089
 epoch: 3, train_loss: 0.9306, test_loss: 1.0116, test_f1: 0.4692
 epoch: 4, train_loss: 0.8917, test_loss: 1.0405, test_f1: 0.5263
 epoch: 5, train_loss: 0.8828, test_loss: 1.0501, test_f1: 0.5228
 epoch: 6, train_loss: 0.8697, test_loss: 1.0137, test_f1: 0.5470
 epoch: 7, train_loss: 0.8455, test_loss: 1.0609, test_f1: 0.4841
 epoch: 8, train_loss: 0.8293, test_loss: 1.0480, test_f1: 0.5132
 epoch: 9, train_loss: 0.8472, test_loss: 1.0143, test_f1: 0.5779
 epoch: 10, train_loss: 0.8279, test_loss: 0.9810, test_f1: 0.5779
 epoch: 11, train_loss: 0.8026, test_loss: 1.2036, test_f1: 0.4768
 epoch: 12, train_loss: 0.8171, test_loss: 1.0168, test_f1: 0.5569
 epoch: 13, train_loss: 0.7844, test_loss: 1.1444, test_f1: 0.5065
 epoch: 14, train_loss: 0.7852, test_loss: 1.0400, test_f1: 0.5323
 epoch: 15, train_loss: 0.7943, test_loss: 1.1695, test_f1: 0.5278
 epoch: 16, train_loss: 0.7610, test_loss: 1.4161, test_f1: 0.4087
 epoch: 17, train_loss: 0.7916, test_loss: 0.9371, test_f1: 0.6033
 epoch: 18, train_loss: 0.7465, test_loss: 1.0082, test_f1: 0.5399
 epoch: 19, train_loss: 0.7308, test_loss: 0.9796, test_f1: 0.5567
 epoch: 20, train_loss: 0.7187, test_loss: 1.0478, test_f1: 0.5696
 epoch: 21, train_loss: 0.7505, test_loss: 0.9269, test_f1: 0.5407
 epoch: 22, train_loss: 0.7072, test_loss: 1.1290, test_f1: 0.5380
 epoch: 23, train_loss: 0.7034, test_loss: 1.0938, test_f1: 0.5543
 epoch: 24, train_loss: 0.7111, test_loss: 1.1235, test_f1: 0.5237
 epoch: 25, train_loss: 0.6857, test_loss: 1.2425, test_f1: 0.5010
 epoch: 26, train_loss: 0.6847, test_loss: 1.0129, test_f1: 0.5954
 epoch: 27, train_loss: 0.6795, test_loss: 1.2493, test_f1: 0.5191
 epoch: 28, train_loss: 0.6830, test_loss: 1.0772, test_f1: 0.6438
 epoch: 29, train_loss: 0.6987, test_loss: 1.0812, test_f1: 0.5971
 epoch: 30, train_loss: 0.6851, test_loss: 1.3465, test_f1: 0.4772
 epoch: 31, train_loss: 0.6426, test_loss: 1.1108, test_f1: 0.5471
 epoch: 32, train_loss: 0.6598, test_loss: 1.1680, test_f1: 0.6286
 epoch: 33, train_loss: 0.6251, test_loss: 1.1588, test_f1: 0.5786
 epoch: 34, train_loss: 0.6550, test_loss: 1.2443, test_f1: 0.5418
 epoch: 35, train_loss: 0.6156, test_loss: 1.0736, test_f1: 0.5707
 epoch: 36, train_loss: 0.6166, test_loss: 1.1814, test_f1: 0.5924
 epoch: 37, train_loss: 0.6390, test_loss: 1.6682, test_f1: 0.5681
 epoch: 38, train_loss: 0.6037, test_loss: 1.3940, test_f1: 0.5572
 epoch: 39, train_loss: 0.6040, test_loss: 1.2438, test_f1: 0.5779
 epoch: 40, train_loss: 0.5740, test_loss: 1.3964, test_f1: 0.5289
 epoch: 41, train_loss: 0.5862, test_loss: 1.3594, test_f1: 0.5677
 epoch: 42, train_loss: 0.5895, test_loss: 1.1959, test_f1: 0.5707
 epoch: 43, train_loss: 0.5800, test_loss: 1.4452, test_f1: 0.5975
 epoch: 44, train_loss: 0.6010, test_loss: 1.1822, test_f1: 0.6022
 epoch: 45, train_loss: 0.5698, test_loss: 1.4654, test_f1: 0.5694
 epoch: 46, train_loss: 0.5691, test_loss: 1.4555, test_f1: 0.5422
 epoch: 47, train_loss: 0.5674, test_loss: 1.9550, test_f1: 0.5665
 epoch: 48, train_loss: 0.6157, test_loss: 1.3017, test_f1: 0.5216
 epoch: 49, train_loss: 0.5618, test_loss: 1.3962, test_f1: 0.5695
 epoch: 50, train_loss: 0.5609, test_loss: 1.3966, test_f1: 0.6101
 epoch: 51, train_loss: 0.4657, test_loss: 1.2888, test_f1: 0.6388
 epoch: 52, train_loss: 0.4727, test_loss: 1.2920, test_f1: 0.6073
 epoch: 53, train_loss: 0.4617, test_loss: 1.2992, test_f1: 0.6176
 epoch: 54, train_loss: 0.4463, test_loss: 1.3601, test_f1: 0.6061
 epoch: 55, train_loss: 0.4446, test_loss: 1.2969, test_f1: 0.6391
 epoch: 56, train_loss: 0.4449, test_loss: 1.4776, test_f1: 0.6358
 epoch: 57, train_loss: 0.4550, test_loss: 1.3117, test_f1: 0.6364
 epoch: 58, train_loss: 0.4407, test_loss: 1.4480, test_f1: 0.5890
 epoch: 59, train_loss: 0.4248, test_loss: 1.3500, test_f1: 0.6525
 epoch: 60, train_loss: 0.4138, test_loss: 1.4700, test_f1: 0.6500
 epoch: 61, train_loss: 0.4388, test_loss: 1.5240, test_f1: 0.5812
 epoch: 62, train_loss: 0.4274, test_loss: 1.4064, test_f1: 0.6724
 epoch: 63, train_loss: 0.4523, test_loss: 1.3839, test_f1: 0.6240
 epoch: 64, train_loss: 0.3776, test_loss: 1.4164, test_f1: 0.6609
 epoch: 65, train_loss: 0.3976, test_loss: 1.5053, test_f1: 0.6455
 epoch: 66, train_loss: 0.4104, test_loss: 1.4783, test_f1: 0.6444
 epoch: 67, train_loss: 0.3988, test_loss: 1.4634, test_f1: 0.6228
 epoch: 68, train_loss: 0.3737, test_loss: 1.5820, test_f1: 0.6401
 epoch: 69, train_loss: 0.3826, test_loss: 1.6828, test_f1: 0.5576
 epoch: 70, train_loss: 0.4030, test_loss: 1.6876, test_f1: 0.6237
 epoch: 71, train_loss: 0.3642, test_loss: 1.8122, test_f1: 0.6112
 epoch: 72, train_loss: 0.3949, test_loss: 1.6036, test_f1: 0.6230
 epoch: 73, train_loss: 0.3572, test_loss: 1.6145, test_f1: 0.6152
 epoch: 74, train_loss: 0.3573, test_loss: 2.4583, test_f1: 0.5599
 epoch: 75, train_loss: 0.3699, test_loss: 1.9304, test_f1: 0.5824
 epoch: 76, train_loss: 0.3685, test_loss: 1.4780, test_f1: 0.6172
 epoch: 77, train_loss: 0.3683, test_loss: 1.6919, test_f1: 0.5732
 epoch: 78, train_loss: 0.3371, test_loss: 1.9065, test_f1: 0.5913
 epoch: 79, train_loss: 0.3638, test_loss: 1.6265, test_f1: 0.6198
 epoch: 80, train_loss: 0.3574, test_loss: 1.7504, test_f1: 0.6157
 epoch: 81, train_loss: 0.3624, test_loss: 1.5120, test_f1: 0.6546
 epoch: 82, train_loss: 0.3311, test_loss: 1.7215, test_f1: 0.6423
 epoch: 83, train_loss: 0.3609, test_loss: 1.6825, test_f1: 0.5892
 epoch: 84, train_loss: 0.3399, test_loss: 2.0404, test_f1: 0.5792
 epoch: 85, train_loss: 0.3606, test_loss: 1.6393, test_f1: 0.6054
 epoch: 86, train_loss: 0.3312, test_loss: 1.6705, test_f1: 0.6378
 epoch: 87, train_loss: 0.2851, test_loss: 1.5638, test_f1: 0.6285
 epoch: 88, train_loss: 0.3535, test_loss: 1.6921, test_f1: 0.5628
 epoch: 89, train_loss: 0.3145, test_loss: 1.4854, test_f1: 0.6441
 epoch: 90, train_loss: 0.2900, test_loss: 2.2453, test_f1: 0.5954
 epoch: 91, train_loss: 0.3325, test_loss: 1.6994, test_f1: 0.6219
 epoch: 92, train_loss: 0.3111, test_loss: 2.0857, test_f1: 0.6000
 epoch: 93, train_loss: 0.3339, test_loss: 1.5635, test_f1: 0.6166
 epoch: 94, train_loss: 0.2822, test_loss: 1.6956, test_f1: 0.6530
 epoch: 95, train_loss: 0.3207, test_loss: 1.8574, test_f1: 0.6415
 epoch: 96, train_loss: 0.3018, test_loss: 1.5968, test_f1: 0.6134
 epoch: 97, train_loss: 0.2944, test_loss: 1.7006, test_f1: 0.6379
 epoch: 98, train_loss: 0.3168, test_loss: 1.6953, test_f1: 0.6505
 epoch: 99, train_loss: 0.3034, test_loss: 1.6578, test_f1: 0.6638
##################ITERATION #2 ****************************************
 epoch: 0, train_loss: 1.1361, test_loss: 1.2977, test_f1: 0.3689
 epoch: 1, train_loss: 0.9725, test_loss: 1.0898, test_f1: 0.5190
 epoch: 2, train_loss: 0.9178, test_loss: 1.0895, test_f1: 0.5248
 epoch: 3, train_loss: 0.8970, test_loss: 0.9825, test_f1: 0.4292
 epoch: 4, train_loss: 0.8934, test_loss: 1.0202, test_f1: 0.5374
 epoch: 5, train_loss: 0.8818, test_loss: 1.1284, test_f1: 0.4603
 epoch: 6, train_loss: 0.8861, test_loss: 1.0433, test_f1: 0.5600
 epoch: 7, train_loss: 0.8661, test_loss: 1.0441, test_f1: 0.4124
 epoch: 8, train_loss: 0.8522, test_loss: 1.0914, test_f1: 0.4870
 epoch: 9, train_loss: 0.8690, test_loss: 0.9940, test_f1: 0.4904
 epoch: 10, train_loss: 0.8367, test_loss: 0.9937, test_f1: 0.5621
 epoch: 11, train_loss: 0.8425, test_loss: 1.4390, test_f1: 0.4750
 epoch: 12, train_loss: 0.8527, test_loss: 0.9905, test_f1: 0.5694
 epoch: 13, train_loss: 0.8329, test_loss: 1.3695, test_f1: 0.4701
 epoch: 14, train_loss: 0.8642, test_loss: 1.0238, test_f1: 0.5740
 epoch: 15, train_loss: 0.8150, test_loss: 0.9569, test_f1: 0.6092
 epoch: 16, train_loss: 0.7925, test_loss: 1.0103, test_f1: 0.5153
 epoch: 17, train_loss: 0.7792, test_loss: 0.9604, test_f1: 0.6011
 epoch: 18, train_loss: 0.7776, test_loss: 0.9392, test_f1: 0.5662
 epoch: 19, train_loss: 0.7792, test_loss: 0.9596, test_f1: 0.5715
 epoch: 20, train_loss: 0.7958, test_loss: 1.0928, test_f1: 0.4677
 epoch: 21, train_loss: 0.7857, test_loss: 1.1704, test_f1: 0.3898
 epoch: 22, train_loss: 0.7467, test_loss: 0.9816, test_f1: 0.6205
 epoch: 23, train_loss: 0.7270, test_loss: 1.0884, test_f1: 0.5684
 epoch: 24, train_loss: 0.7121, test_loss: 1.1914, test_f1: 0.5464
 epoch: 25, train_loss: 0.7064, test_loss: 1.0944, test_f1: 0.5412
 epoch: 26, train_loss: 0.7415, test_loss: 1.0408, test_f1: 0.5780
 epoch: 27, train_loss: 0.6914, test_loss: 1.3575, test_f1: 0.5229
 epoch: 28, train_loss: 0.7646, test_loss: 0.9138, test_f1: 0.5944
 epoch: 29, train_loss: 0.7138, test_loss: 0.9573, test_f1: 0.5674
 epoch: 30, train_loss: 0.6659, test_loss: 1.1589, test_f1: 0.5864
 epoch: 31, train_loss: 0.6730, test_loss: 1.3085, test_f1: 0.5217
 epoch: 32, train_loss: 0.6581, test_loss: 1.0761, test_f1: 0.5223
 epoch: 33, train_loss: 0.6537, test_loss: 1.0203, test_f1: 0.6244
 epoch: 34, train_loss: 0.6616, test_loss: 1.0368, test_f1: 0.6057
 epoch: 35, train_loss: 0.6439, test_loss: 1.3195, test_f1: 0.5597
 epoch: 36, train_loss: 0.6729, test_loss: 1.0130, test_f1: 0.5613
 epoch: 37, train_loss: 0.6372, test_loss: 1.1481, test_f1: 0.5586
 epoch: 38, train_loss: 0.6150, test_loss: 1.1055, test_f1: 0.6444
 epoch: 39, train_loss: 0.6324, test_loss: 1.0262, test_f1: 0.6080
 epoch: 40, train_loss: 0.6300, test_loss: 1.0719, test_f1: 0.6001
 epoch: 41, train_loss: 0.6071, test_loss: 1.2343, test_f1: 0.5780
 epoch: 42, train_loss: 0.6162, test_loss: 1.1873, test_f1: 0.5574
 epoch: 43, train_loss: 0.6110, test_loss: 1.2289, test_f1: 0.6105
 epoch: 44, train_loss: 0.6226, test_loss: 1.2305, test_f1: 0.5530
 epoch: 45, train_loss: 0.5887, test_loss: 1.1368, test_f1: 0.6116
 epoch: 46, train_loss: 0.5654, test_loss: 1.2558, test_f1: 0.6200
 epoch: 47, train_loss: 0.5827, test_loss: 1.1093, test_f1: 0.6117
 epoch: 48, train_loss: 0.5762, test_loss: 1.2603, test_f1: 0.6198
 epoch: 49, train_loss: 0.5641, test_loss: 1.3768, test_f1: 0.6151
 epoch: 50, train_loss: 0.5796, test_loss: 1.1618, test_f1: 0.6074
 epoch: 51, train_loss: 0.5179, test_loss: 1.3447, test_f1: 0.6355
 epoch: 52, train_loss: 0.4881, test_loss: 1.1735, test_f1: 0.6483
 epoch: 53, train_loss: 0.4709, test_loss: 1.2498, test_f1: 0.6657
 epoch: 54, train_loss: 0.4807, test_loss: 1.3953, test_f1: 0.6350
 epoch: 55, train_loss: 0.4700, test_loss: 1.3294, test_f1: 0.6242
 epoch: 56, train_loss: 0.4422, test_loss: 1.3886, test_f1: 0.6297
 epoch: 57, train_loss: 0.4364, test_loss: 1.3440, test_f1: 0.6106
 epoch: 58, train_loss: 0.4707, test_loss: 1.6975, test_f1: 0.6220
 epoch: 59, train_loss: 0.4605, test_loss: 1.4555, test_f1: 0.5957
 epoch: 60, train_loss: 0.4122, test_loss: 1.4424, test_f1: 0.6333
 epoch: 61, train_loss: 0.4335, test_loss: 1.6363, test_f1: 0.6471
 epoch: 62, train_loss: 0.4376, test_loss: 1.5996, test_f1: 0.6311
 epoch: 63, train_loss: 0.4271, test_loss: 1.6075, test_f1: 0.6320
 epoch: 64, train_loss: 0.3997, test_loss: 1.5788, test_f1: 0.6028
 epoch: 65, train_loss: 0.4284, test_loss: 1.2203, test_f1: 0.6351
 epoch: 66, train_loss: 0.4160, test_loss: 1.4740, test_f1: 0.6308
 epoch: 67, train_loss: 0.3904, test_loss: 1.3529, test_f1: 0.6210
 epoch: 68, train_loss: 0.4110, test_loss: 1.2131, test_f1: 0.6583
 epoch: 69, train_loss: 0.3921, test_loss: 1.4871, test_f1: 0.5937
 epoch: 70, train_loss: 0.3972, test_loss: 1.3738, test_f1: 0.6176
 epoch: 71, train_loss: 0.3932, test_loss: 1.3080, test_f1: 0.6473
 epoch: 72, train_loss: 0.3676, test_loss: 1.5166, test_f1: 0.6407
 epoch: 73, train_loss: 0.3873, test_loss: 1.5810, test_f1: 0.6287
 epoch: 74, train_loss: 0.3864, test_loss: 1.5707, test_f1: 0.5825
 epoch: 75, train_loss: 0.3821, test_loss: 1.6645, test_f1: 0.6077
 epoch: 76, train_loss: 0.3688, test_loss: 1.3861, test_f1: 0.6565
 epoch: 77, train_loss: 0.3860, test_loss: 1.5694, test_f1: 0.6330
 epoch: 78, train_loss: 0.3504, test_loss: 1.8087, test_f1: 0.5970
 epoch: 79, train_loss: 0.3648, test_loss: 1.5375, test_f1: 0.5902
 epoch: 80, train_loss: 0.3540, test_loss: 1.4516, test_f1: 0.6397
 epoch: 81, train_loss: 0.3615, test_loss: 1.7960, test_f1: 0.6436
 epoch: 82, train_loss: 0.3814, test_loss: 1.6073, test_f1: 0.6106
 epoch: 83, train_loss: 0.3638, test_loss: 1.4433, test_f1: 0.6101
 epoch: 84, train_loss: 0.3593, test_loss: 1.5855, test_f1: 0.6099
 epoch: 85, train_loss: 0.3256, test_loss: 1.4700, test_f1: 0.6499
 epoch: 86, train_loss: 0.3581, test_loss: 1.4696, test_f1: 0.6264
 epoch: 87, train_loss: 0.3772, test_loss: 1.4212, test_f1: 0.6027
 epoch: 88, train_loss: 0.3218, test_loss: 1.7771, test_f1: 0.6200
 epoch: 89, train_loss: 0.3514, test_loss: 1.7048, test_f1: 0.6033
 epoch: 90, train_loss: 0.3119, test_loss: 1.4701, test_f1: 0.6768
 epoch: 91, train_loss: 0.3528, test_loss: 1.5617, test_f1: 0.6741
 epoch: 92, train_loss: 0.3279, test_loss: 1.6480, test_f1: 0.6386
 epoch: 93, train_loss: 0.3204, test_loss: 1.6063, test_f1: 0.6090
 epoch: 94, train_loss: 0.2840, test_loss: 1.6206, test_f1: 0.6627
 epoch: 95, train_loss: 0.2992, test_loss: 1.6230, test_f1: 0.6297
 epoch: 96, train_loss: 0.2932, test_loss: 1.5808, test_f1: 0.6345
 epoch: 97, train_loss: 0.3024, test_loss: 1.7238, test_f1: 0.6202
 epoch: 98, train_loss: 0.2848, test_loss: 2.0066, test_f1: 0.5929
 epoch: 99, train_loss: 0.3164, test_loss: 1.6335, test_f1: 0.6236
##################ITERATION #3 ****************************************
 epoch: 0, train_loss: 1.1316, test_loss: 2.0431, test_f1: 0.2163
 epoch: 1, train_loss: 0.9202, test_loss: 1.0063, test_f1: 0.4591
 epoch: 2, train_loss: 0.8862, test_loss: 0.9972, test_f1: 0.5122
 epoch: 3, train_loss: 0.8687, test_loss: 1.0027, test_f1: 0.4699
 epoch: 4, train_loss: 0.8714, test_loss: 0.9850, test_f1: 0.5457
 epoch: 5, train_loss: 0.8746, test_loss: 1.1918, test_f1: 0.4565
 epoch: 6, train_loss: 0.8456, test_loss: 1.0257, test_f1: 0.5805
 epoch: 7, train_loss: 0.8207, test_loss: 1.8376, test_f1: 0.3963
 epoch: 8, train_loss: 0.8721, test_loss: 1.1176, test_f1: 0.4967
 epoch: 9, train_loss: 0.8446, test_loss: 1.1949, test_f1: 0.4558
 epoch: 10, train_loss: 0.8111, test_loss: 1.1489, test_f1: 0.4804
 epoch: 11, train_loss: 0.7761, test_loss: 1.0940, test_f1: 0.4628
 epoch: 12, train_loss: 0.7906, test_loss: 1.2060, test_f1: 0.4979
 epoch: 13, train_loss: 0.7848, test_loss: 1.0113, test_f1: 0.5168
 epoch: 14, train_loss: 0.7736, test_loss: 0.9933, test_f1: 0.5528
 epoch: 15, train_loss: 0.7603, test_loss: 1.2205, test_f1: 0.5502
 epoch: 16, train_loss: 0.7731, test_loss: 1.0619, test_f1: 0.4796
 epoch: 17, train_loss: 0.7502, test_loss: 1.0000, test_f1: 0.5996
 epoch: 18, train_loss: 0.7129, test_loss: 0.9471, test_f1: 0.5940
 epoch: 19, train_loss: 0.7516, test_loss: 0.9400, test_f1: 0.6434
 epoch: 20, train_loss: 0.7430, test_loss: 0.9134, test_f1: 0.5737
 epoch: 21, train_loss: 0.7104, test_loss: 0.9951, test_f1: 0.4918
 epoch: 22, train_loss: 0.6946, test_loss: 1.3077, test_f1: 0.5668
 epoch: 23, train_loss: 0.7444, test_loss: 1.0628, test_f1: 0.5056
 epoch: 24, train_loss: 0.7157, test_loss: 1.0812, test_f1: 0.5747
 epoch: 25, train_loss: 0.6770, test_loss: 1.1891, test_f1: 0.6177
 epoch: 26, train_loss: 0.7375, test_loss: 1.0131, test_f1: 0.6413
 epoch: 27, train_loss: 0.6846, test_loss: 1.1045, test_f1: 0.5997
 epoch: 28, train_loss: 0.6569, test_loss: 1.4666, test_f1: 0.5595
 epoch: 29, train_loss: 0.6923, test_loss: 1.4460, test_f1: 0.5660
 epoch: 30, train_loss: 0.6583, test_loss: 1.0100, test_f1: 0.5998
 epoch: 31, train_loss: 0.6688, test_loss: 1.1073, test_f1: 0.6360
 epoch: 32, train_loss: 0.6361, test_loss: 1.1780, test_f1: 0.5681
 epoch: 33, train_loss: 0.6713, test_loss: 1.6141, test_f1: 0.5316
 epoch: 34, train_loss: 0.6802, test_loss: 1.2283, test_f1: 0.5346
 epoch: 35, train_loss: 0.6393, test_loss: 1.0591, test_f1: 0.6393
 epoch: 36, train_loss: 0.6325, test_loss: 1.0258, test_f1: 0.6534
 epoch: 37, train_loss: 0.6475, test_loss: 1.0906, test_f1: 0.6408
 epoch: 38, train_loss: 0.6510, test_loss: 1.0079, test_f1: 0.6339
 epoch: 39, train_loss: 0.6213, test_loss: 1.3593, test_f1: 0.5716
 epoch: 40, train_loss: 0.6208, test_loss: 2.3954, test_f1: 0.5435
 epoch: 41, train_loss: 0.6346, test_loss: 1.5327, test_f1: 0.5888
 epoch: 42, train_loss: 0.5939, test_loss: 1.0560, test_f1: 0.5914
 epoch: 43, train_loss: 0.6208, test_loss: 1.1221, test_f1: 0.6443
 epoch: 44, train_loss: 0.5687, test_loss: 1.3154, test_f1: 0.6410
 epoch: 45, train_loss: 0.5943, test_loss: 1.5931, test_f1: 0.5960
 epoch: 46, train_loss: 0.5674, test_loss: 1.6240, test_f1: 0.6383
 epoch: 47, train_loss: 0.5546, test_loss: 1.1940, test_f1: 0.6213
 epoch: 48, train_loss: 0.5891, test_loss: 1.5373, test_f1: 0.6089
 epoch: 49, train_loss: 0.6077, test_loss: 1.0906, test_f1: 0.5702
 epoch: 50, train_loss: 0.6354, test_loss: 1.0824, test_f1: 0.6381
 epoch: 51, train_loss: 0.5444, test_loss: 1.2690, test_f1: 0.5718
 epoch: 52, train_loss: 0.4955, test_loss: 1.2920, test_f1: 0.6487
 epoch: 53, train_loss: 0.5697, test_loss: 1.3473, test_f1: 0.5463
 epoch: 54, train_loss: 0.5218, test_loss: 1.3607, test_f1: 0.6401
 epoch: 55, train_loss: 0.4940, test_loss: 1.5057, test_f1: 0.6578
 epoch: 56, train_loss: 0.4632, test_loss: 1.3852, test_f1: 0.6390
 epoch: 57, train_loss: 0.4922, test_loss: 1.3010, test_f1: 0.5915
 epoch: 58, train_loss: 0.4709, test_loss: 1.8564, test_f1: 0.6270
 epoch: 59, train_loss: 0.4483, test_loss: 1.6221, test_f1: 0.6001
 epoch: 60, train_loss: 0.4430, test_loss: 1.4513, test_f1: 0.6270
 epoch: 61, train_loss: 0.4295, test_loss: 1.4738, test_f1: 0.6432
 epoch: 62, train_loss: 0.4336, test_loss: 1.5510, test_f1: 0.6093
 epoch: 63, train_loss: 0.4295, test_loss: 1.7150, test_f1: 0.5736
 epoch: 64, train_loss: 0.4220, test_loss: 1.5528, test_f1: 0.6290
 epoch: 65, train_loss: 0.4677, test_loss: 1.5585, test_f1: 0.5932
 epoch: 66, train_loss: 0.4331, test_loss: 1.5276, test_f1: 0.6363
 epoch: 67, train_loss: 0.4287, test_loss: 1.4937, test_f1: 0.5992
 epoch: 68, train_loss: 0.4011, test_loss: 1.6441, test_f1: 0.6381
 epoch: 69, train_loss: 0.4076, test_loss: 1.4515, test_f1: 0.6580
 epoch: 70, train_loss: 0.4120, test_loss: 1.6096, test_f1: 0.5987
 epoch: 71, train_loss: 0.4116, test_loss: 1.7550, test_f1: 0.5867
 epoch: 72, train_loss: 0.3713, test_loss: 1.6255, test_f1: 0.6006
 epoch: 73, train_loss: 0.4038, test_loss: 1.6776, test_f1: 0.6235
 epoch: 74, train_loss: 0.3996, test_loss: 1.9461, test_f1: 0.5917
 epoch: 75, train_loss: 0.3755, test_loss: 1.6498, test_f1: 0.6000
 epoch: 76, train_loss: 0.3750, test_loss: 2.2395, test_f1: 0.5964
 epoch: 77, train_loss: 0.3638, test_loss: 1.8262, test_f1: 0.6058
 epoch: 78, train_loss: 0.3536, test_loss: 1.7498, test_f1: 0.6125
 epoch: 79, train_loss: 0.3826, test_loss: 2.1011, test_f1: 0.5564
 epoch: 80, train_loss: 0.4320, test_loss: 1.5398, test_f1: 0.6386
 epoch: 81, train_loss: 0.3849, test_loss: 1.5504, test_f1: 0.6443
 epoch: 82, train_loss: 0.3545, test_loss: 1.6302, test_f1: 0.6023
 epoch: 83, train_loss: 0.3577, test_loss: 1.6972, test_f1: 0.6119
 epoch: 84, train_loss: 0.3743, test_loss: 2.6825, test_f1: 0.5287
 epoch: 85, train_loss: 0.3471, test_loss: 1.6510, test_f1: 0.6226
 epoch: 86, train_loss: 0.3547, test_loss: 1.8480, test_f1: 0.5745
 epoch: 87, train_loss: 0.3581, test_loss: 1.6831, test_f1: 0.6034
 epoch: 88, train_loss: 0.3395, test_loss: 1.8120, test_f1: 0.5892
 epoch: 89, train_loss: 0.3599, test_loss: 1.7107, test_f1: 0.6226
 epoch: 90, train_loss: 0.3523, test_loss: 1.6479, test_f1: 0.6379
 epoch: 91, train_loss: 0.3263, test_loss: 1.8579, test_f1: 0.6204
 epoch: 92, train_loss: 0.3642, test_loss: 1.6287, test_f1: 0.6212
 epoch: 93, train_loss: 0.2875, test_loss: 2.0548, test_f1: 0.5635
 epoch: 94, train_loss: 0.3282, test_loss: 2.0533, test_f1: 0.6373
 epoch: 95, train_loss: 0.3292, test_loss: 1.8267, test_f1: 0.6251
 epoch: 96, train_loss: 0.3086, test_loss: 1.9294, test_f1: 0.6222
 epoch: 97, train_loss: 0.3455, test_loss: 1.8767, test_f1: 0.5521
 epoch: 98, train_loss: 0.3345, test_loss: 2.2148, test_f1: 0.5987
 epoch: 99, train_loss: 0.3250, test_loss: 1.7805, test_f1: 0.6128
##################ITERATION #4 ****************************************
 epoch: 0, train_loss: 1.1538, test_loss: 1.5774, test_f1: 0.3402
 epoch: 1, train_loss: 0.9927, test_loss: 1.0461, test_f1: 0.4383
 epoch: 2, train_loss: 0.9479, test_loss: 1.0825, test_f1: 0.5022
 epoch: 3, train_loss: 0.8857, test_loss: 1.0551, test_f1: 0.4488
 epoch: 4, train_loss: 0.8874, test_loss: 2.3661, test_f1: 0.3547
 epoch: 5, train_loss: 0.8504, test_loss: 1.0026, test_f1: 0.4832
 epoch: 6, train_loss: 0.8710, test_loss: 0.9829, test_f1: 0.4959
 epoch: 7, train_loss: 0.8604, test_loss: 1.0387, test_f1: 0.4984
 epoch: 8, train_loss: 0.8367, test_loss: 1.0323, test_f1: 0.5348
 epoch: 9, train_loss: 0.8373, test_loss: 0.9951, test_f1: 0.4833
 epoch: 10, train_loss: 0.8160, test_loss: 1.6590, test_f1: 0.4015
 epoch: 11, train_loss: 0.8130, test_loss: 1.0750, test_f1: 0.5061
 epoch: 12, train_loss: 0.8306, test_loss: 0.9720, test_f1: 0.5576
 epoch: 13, train_loss: 0.8043, test_loss: 1.0053, test_f1: 0.5417
 epoch: 14, train_loss: 0.7734, test_loss: 0.9869, test_f1: 0.5701
 epoch: 15, train_loss: 0.7747, test_loss: 1.0372, test_f1: 0.5691
 epoch: 16, train_loss: 0.7582, test_loss: 1.1186, test_f1: 0.5337
 epoch: 17, train_loss: 0.7576, test_loss: 1.0302, test_f1: 0.5606
 epoch: 18, train_loss: 0.7464, test_loss: 1.0009, test_f1: 0.5639
 epoch: 19, train_loss: 0.7420, test_loss: 1.0876, test_f1: 0.4724
 epoch: 20, train_loss: 0.7430, test_loss: 1.1905, test_f1: 0.5340
 epoch: 21, train_loss: 0.7528, test_loss: 1.0391, test_f1: 0.5817
 epoch: 22, train_loss: 0.7046, test_loss: 0.9995, test_f1: 0.6083
 epoch: 23, train_loss: 0.6904, test_loss: 1.1091, test_f1: 0.5856
 epoch: 24, train_loss: 0.7395, test_loss: 1.0319, test_f1: 0.5779
 epoch: 25, train_loss: 0.6667, test_loss: 1.4309, test_f1: 0.5198
 epoch: 26, train_loss: 0.6565, test_loss: 1.0336, test_f1: 0.5769
 epoch: 27, train_loss: 0.6694, test_loss: 1.0607, test_f1: 0.6026
 epoch: 28, train_loss: 0.6738, test_loss: 1.3806, test_f1: 0.5570
 epoch: 29, train_loss: 0.6835, test_loss: 1.0889, test_f1: 0.5442
 epoch: 30, train_loss: 0.6572, test_loss: 1.1444, test_f1: 0.5307
 epoch: 31, train_loss: 0.6501, test_loss: 1.3896, test_f1: 0.4957
 epoch: 32, train_loss: 0.6651, test_loss: 1.2439, test_f1: 0.5912
 epoch: 33, train_loss: 0.6488, test_loss: 1.1031, test_f1: 0.5920
 epoch: 34, train_loss: 0.6643, test_loss: 1.1919, test_f1: 0.5090
 epoch: 35, train_loss: 0.6495, test_loss: 1.0208, test_f1: 0.6371
 epoch: 36, train_loss: 0.6378, test_loss: 2.1745, test_f1: 0.5418
 epoch: 37, train_loss: 0.6144, test_loss: 1.1514, test_f1: 0.6102
 epoch: 38, train_loss: 0.6079, test_loss: 1.2705, test_f1: 0.5321
 epoch: 39, train_loss: 0.5976, test_loss: 1.1918, test_f1: 0.6130
 epoch: 40, train_loss: 0.6155, test_loss: 2.7571, test_f1: 0.4919
 epoch: 41, train_loss: 0.5952, test_loss: 1.4009, test_f1: 0.5872
 epoch: 42, train_loss: 0.6204, test_loss: 1.1729, test_f1: 0.6299
 epoch: 43, train_loss: 0.5698, test_loss: 1.6417, test_f1: 0.5557
 epoch: 44, train_loss: 0.5563, test_loss: 1.6760, test_f1: 0.5511
 epoch: 45, train_loss: 0.5938, test_loss: 1.7730, test_f1: 0.5646
 epoch: 46, train_loss: 0.6147, test_loss: 1.6135, test_f1: 0.4468
 epoch: 47, train_loss: 0.5948, test_loss: 1.3898, test_f1: 0.5562
 epoch: 48, train_loss: 0.5756, test_loss: 1.3450, test_f1: 0.6277
 epoch: 49, train_loss: 0.5123, test_loss: 1.5780, test_f1: 0.5672
 epoch: 50, train_loss: 0.5420, test_loss: 1.1888, test_f1: 0.6632
 epoch: 51, train_loss: 0.5089, test_loss: 1.4021, test_f1: 0.5714
 epoch: 52, train_loss: 0.4506, test_loss: 1.9537, test_f1: 0.6165
 epoch: 53, train_loss: 0.4435, test_loss: 1.6344, test_f1: 0.5608
 epoch: 54, train_loss: 0.4643, test_loss: 1.5047, test_f1: 0.5969
 epoch: 55, train_loss: 0.4421, test_loss: 1.5117, test_f1: 0.6051
 epoch: 56, train_loss: 0.4433, test_loss: 1.6717, test_f1: 0.5812
 epoch: 57, train_loss: 0.4489, test_loss: 1.6777, test_f1: 0.6503
 epoch: 58, train_loss: 0.4716, test_loss: 1.5617, test_f1: 0.5582
 epoch: 59, train_loss: 0.4544, test_loss: 2.0059, test_f1: 0.6276
 epoch: 60, train_loss: 0.4239, test_loss: 1.6613, test_f1: 0.5645
 epoch: 61, train_loss: 0.4271, test_loss: 1.5980, test_f1: 0.6137
 epoch: 62, train_loss: 0.4236, test_loss: 1.6625, test_f1: 0.6151
 epoch: 63, train_loss: 0.4167, test_loss: 1.6611, test_f1: 0.6383
 epoch: 64, train_loss: 0.4175, test_loss: 1.7909, test_f1: 0.5458
 epoch: 65, train_loss: 0.4233, test_loss: 1.4980, test_f1: 0.5782
 epoch: 66, train_loss: 0.4226, test_loss: 1.4851, test_f1: 0.6117
 epoch: 67, train_loss: 0.3827, test_loss: 1.7695, test_f1: 0.5929
 epoch: 68, train_loss: 0.4158, test_loss: 1.6176, test_f1: 0.6013
 epoch: 69, train_loss: 0.3952, test_loss: 1.7037, test_f1: 0.5662
 epoch: 70, train_loss: 0.3781, test_loss: 1.8614, test_f1: 0.5822
 epoch: 71, train_loss: 0.3941, test_loss: 1.8034, test_f1: 0.5156
 epoch: 72, train_loss: 0.3867, test_loss: 1.7080, test_f1: 0.5976
 epoch: 73, train_loss: 0.3484, test_loss: 1.8324, test_f1: 0.5947
 epoch: 74, train_loss: 0.3633, test_loss: 1.9453, test_f1: 0.5753
 epoch: 75, train_loss: 0.3593, test_loss: 2.1111, test_f1: 0.5897
 epoch: 76, train_loss: 0.3703, test_loss: 2.0390, test_f1: 0.5961
 epoch: 77, train_loss: 0.3855, test_loss: 1.8599, test_f1: 0.5585
 epoch: 78, train_loss: 0.3703, test_loss: 1.8029, test_f1: 0.6139
 epoch: 79, train_loss: 0.3402, test_loss: 2.1171, test_f1: 0.5893
 epoch: 80, train_loss: 0.3646, test_loss: 1.8443, test_f1: 0.5604
 epoch: 81, train_loss: 0.3867, test_loss: 1.6902, test_f1: 0.5957
 epoch: 82, train_loss: 0.3252, test_loss: 1.7563, test_f1: 0.5948
 epoch: 83, train_loss: 0.3523, test_loss: 2.0590, test_f1: 0.5765
 epoch: 84, train_loss: 0.3405, test_loss: 1.7998, test_f1: 0.5879
 epoch: 85, train_loss: 0.3110, test_loss: 1.6660, test_f1: 0.6215
 epoch: 86, train_loss: 0.2940, test_loss: 2.0940, test_f1: 0.6007
 epoch: 87, train_loss: 0.3375, test_loss: 2.0349, test_f1: 0.6096
 epoch: 88, train_loss: 0.3391, test_loss: 2.0867, test_f1: 0.6028
 epoch: 89, train_loss: 0.3215, test_loss: 1.9779, test_f1: 0.6154
 epoch: 90, train_loss: 0.3361, test_loss: 2.0579, test_f1: 0.5630
 epoch: 91, train_loss: 0.3433, test_loss: 1.7070, test_f1: 0.5902
 epoch: 92, train_loss: 0.3592, test_loss: 1.9261, test_f1: 0.5564
 epoch: 93, train_loss: 0.3231, test_loss: 1.7418, test_f1: 0.5681
 epoch: 94, train_loss: 0.3264, test_loss: 1.6262, test_f1: 0.6028
 epoch: 95, train_loss: 0.2756, test_loss: 1.6366, test_f1: 0.6133
 epoch: 96, train_loss: 0.2962, test_loss: 1.8239, test_f1: 0.5822
 epoch: 97, train_loss: 0.3234, test_loss: 2.1426, test_f1: 0.5675
 epoch: 98, train_loss: 0.3124, test_loss: 1.9649, test_f1: 0.5572
 epoch: 99, train_loss: 0.3026, test_loss: 1.6897, test_f1: 0.6206
##################ITERATION #5 ****************************************
 epoch: 0, train_loss: 1.1374, test_loss: 1.2557, test_f1: 0.4311
 epoch: 1, train_loss: 0.9621, test_loss: 1.0808, test_f1: 0.4061
 epoch: 2, train_loss: 0.9099, test_loss: 1.0011, test_f1: 0.4422
 epoch: 3, train_loss: 0.8927, test_loss: 1.0597, test_f1: 0.5089
 epoch: 4, train_loss: 0.8690, test_loss: 1.0359, test_f1: 0.5285
 epoch: 5, train_loss: 0.8771, test_loss: 1.0620, test_f1: 0.4868
 epoch: 6, train_loss: 0.8227, test_loss: 1.0952, test_f1: 0.4777
 epoch: 7, train_loss: 0.8236, test_loss: 0.9792, test_f1: 0.5213
 epoch: 8, train_loss: 0.8013, test_loss: 1.1158, test_f1: 0.4284
 epoch: 9, train_loss: 0.7938, test_loss: 1.1580, test_f1: 0.4356
 epoch: 10, train_loss: 0.7996, test_loss: 1.1143, test_f1: 0.5373
 epoch: 11, train_loss: 0.8079, test_loss: 1.2733, test_f1: 0.5408
 epoch: 12, train_loss: 0.7676, test_loss: 1.5683, test_f1: 0.3850
 epoch: 13, train_loss: 0.7879, test_loss: 1.0893, test_f1: 0.4893
 epoch: 14, train_loss: 0.7350, test_loss: 1.3722, test_f1: 0.4939
 epoch: 15, train_loss: 0.7298, test_loss: 1.1419, test_f1: 0.4428
 epoch: 16, train_loss: 0.7260, test_loss: 1.2691, test_f1: 0.5316
 epoch: 17, train_loss: 0.7326, test_loss: 1.2127, test_f1: 0.5024
 epoch: 18, train_loss: 0.7341, test_loss: 1.1092, test_f1: 0.5469
 epoch: 19, train_loss: 0.7221, test_loss: 1.2140, test_f1: 0.4385
 epoch: 20, train_loss: 0.7031, test_loss: 1.0078, test_f1: 0.5925
 epoch: 21, train_loss: 0.6965, test_loss: 1.7018, test_f1: 0.5957
 epoch: 22, train_loss: 0.6732, test_loss: 1.2999, test_f1: 0.5604
 epoch: 23, train_loss: 0.6653, test_loss: 1.7332, test_f1: 0.5750
 epoch: 24, train_loss: 0.6862, test_loss: 1.0164, test_f1: 0.5476
 epoch: 25, train_loss: 0.6869, test_loss: 1.6144, test_f1: 0.5656
 epoch: 26, train_loss: 0.6920, test_loss: 1.0952, test_f1: 0.5584
 epoch: 27, train_loss: 0.6532, test_loss: 1.0639, test_f1: 0.6099
 epoch: 28, train_loss: 0.6510, test_loss: 1.1403, test_f1: 0.5890
 epoch: 29, train_loss: 0.6544, test_loss: 1.0527, test_f1: 0.6254
 epoch: 30, train_loss: 0.6374, test_loss: 1.2237, test_f1: 0.5705
 epoch: 31, train_loss: 0.6224, test_loss: 1.2179, test_f1: 0.5153
 epoch: 32, train_loss: 0.6204, test_loss: 1.3195, test_f1: 0.5810
 epoch: 33, train_loss: 0.5944, test_loss: 1.1639, test_f1: 0.5633
 epoch: 34, train_loss: 0.5927, test_loss: 1.3140, test_f1: 0.5831
 epoch: 35, train_loss: 0.6204, test_loss: 1.3066, test_f1: 0.6345
 epoch: 36, train_loss: 0.5998, test_loss: 1.4442, test_f1: 0.5773
 epoch: 37, train_loss: 0.5718, test_loss: 1.2389, test_f1: 0.5582
 epoch: 38, train_loss: 0.6033, test_loss: 1.1372, test_f1: 0.6331
 epoch: 39, train_loss: 0.6079, test_loss: 1.4981, test_f1: 0.5515
 epoch: 40, train_loss: 0.5766, test_loss: 1.6629, test_f1: 0.5887
 epoch: 41, train_loss: 0.5756, test_loss: 2.0676, test_f1: 0.5573
 epoch: 42, train_loss: 0.5691, test_loss: 1.3180, test_f1: 0.6454
 epoch: 43, train_loss: 0.5940, test_loss: 1.3329, test_f1: 0.6094
 epoch: 44, train_loss: 0.5475, test_loss: 1.4016, test_f1: 0.6020
 epoch: 45, train_loss: 0.5489, test_loss: 2.1084, test_f1: 0.5200
 epoch: 46, train_loss: 0.5230, test_loss: 1.4129, test_f1: 0.5957
 epoch: 47, train_loss: 0.5341, test_loss: 1.1692, test_f1: 0.6061
 epoch: 48, train_loss: 0.5533, test_loss: 1.6594, test_f1: 0.5926
 epoch: 49, train_loss: 0.5181, test_loss: 1.3560, test_f1: 0.5734
 epoch: 50, train_loss: 0.5085, test_loss: 1.5498, test_f1: 0.6130
 epoch: 51, train_loss: 0.4729, test_loss: 1.3203, test_f1: 0.6394
 epoch: 52, train_loss: 0.4498, test_loss: 1.3978, test_f1: 0.6123
 epoch: 53, train_loss: 0.4374, test_loss: 1.6290, test_f1: 0.5981
 epoch: 54, train_loss: 0.4116, test_loss: 1.9485, test_f1: 0.6174
 epoch: 55, train_loss: 0.4369, test_loss: 1.6930, test_f1: 0.6017
 epoch: 56, train_loss: 0.3949, test_loss: 1.8917, test_f1: 0.6209
 epoch: 57, train_loss: 0.4104, test_loss: 1.8352, test_f1: 0.5798
 epoch: 58, train_loss: 0.4122, test_loss: 1.9816, test_f1: 0.5698
 epoch: 59, train_loss: 0.3895, test_loss: 1.5697, test_f1: 0.5540
 epoch: 60, train_loss: 0.3661, test_loss: 1.8275, test_f1: 0.6410
 epoch: 61, train_loss: 0.3983, test_loss: 1.5211, test_f1: 0.6497
 epoch: 62, train_loss: 0.3801, test_loss: 1.8175, test_f1: 0.5924
 epoch: 63, train_loss: 0.4031, test_loss: 1.5504, test_f1: 0.5857
 epoch: 64, train_loss: 0.3726, test_loss: 1.6650, test_f1: 0.5971
 epoch: 65, train_loss: 0.3393, test_loss: 1.8351, test_f1: 0.5967
 epoch: 66, train_loss: 0.3921, test_loss: 1.5422, test_f1: 0.6540
 epoch: 67, train_loss: 0.3844, test_loss: 1.7314, test_f1: 0.5986
 epoch: 68, train_loss: 0.3704, test_loss: 1.5188, test_f1: 0.6268
 epoch: 69, train_loss: 0.4140, test_loss: 1.6432, test_f1: 0.5723
 epoch: 70, train_loss: 0.3504, test_loss: 1.5672, test_f1: 0.6398
 epoch: 71, train_loss: 0.3363, test_loss: 1.8112, test_f1: 0.6229
 epoch: 72, train_loss: 0.3172, test_loss: 1.9573, test_f1: 0.6324
 epoch: 73, train_loss: 0.3514, test_loss: 2.3810, test_f1: 0.6330
 epoch: 74, train_loss: 0.3548, test_loss: 2.0164, test_f1: 0.6253
 epoch: 75, train_loss: 0.3503, test_loss: 1.6423, test_f1: 0.6224
 epoch: 76, train_loss: 0.3277, test_loss: 1.5421, test_f1: 0.6639
 epoch: 77, train_loss: 0.3394, test_loss: 1.8055, test_f1: 0.6382
 epoch: 78, train_loss: 0.3569, test_loss: 1.9771, test_f1: 0.6335
 epoch: 79, train_loss: 0.3245, test_loss: 2.0119, test_f1: 0.5724
 epoch: 80, train_loss: 0.3310, test_loss: 1.8767, test_f1: 0.5753
 epoch: 81, train_loss: 0.3346, test_loss: 2.1076, test_f1: 0.5862
 epoch: 82, train_loss: 0.3231, test_loss: 1.6861, test_f1: 0.5732
 epoch: 83, train_loss: 0.3119, test_loss: 1.8838, test_f1: 0.5943
 epoch: 84, train_loss: 0.3128, test_loss: 1.9948, test_f1: 0.6180
 epoch: 85, train_loss: 0.3142, test_loss: 2.3542, test_f1: 0.5270
 epoch: 86, train_loss: 0.2914, test_loss: 1.7920, test_f1: 0.6064
 epoch: 87, train_loss: 0.3108, test_loss: 2.0538, test_f1: 0.5743
 epoch: 88, train_loss: 0.2965, test_loss: 1.9837, test_f1: 0.6414
 epoch: 89, train_loss: 0.3041, test_loss: 1.9036, test_f1: 0.5870
 epoch: 90, train_loss: 0.3366, test_loss: 1.8281, test_f1: 0.5726
 epoch: 91, train_loss: 0.2925, test_loss: 2.1542, test_f1: 0.5852
 epoch: 92, train_loss: 0.2748, test_loss: 2.2069, test_f1: 0.6078
 epoch: 93, train_loss: 0.3053, test_loss: 1.6574, test_f1: 0.5593
 epoch: 94, train_loss: 0.3159, test_loss: 1.9496, test_f1: 0.5716
 epoch: 95, train_loss: 0.2646, test_loss: 2.0215, test_f1: 0.6268
 epoch: 96, train_loss: 0.2983, test_loss: 2.1720, test_f1: 0.5557
 epoch: 97, train_loss: 0.2858, test_loss: 1.7720, test_f1: 0.5802
 epoch: 98, train_loss: 0.2786, test_loss: 1.7751, test_f1: 0.5732
 epoch: 99, train_loss: 0.2675, test_loss: 1.9164, test_f1: 0.5692
##################ITERATION #6 ****************************************
 epoch: 0, train_loss: 1.1391, test_loss: 1.1915, test_f1: 0.3685
 epoch: 1, train_loss: 0.9369, test_loss: 1.0588, test_f1: 0.4722
 epoch: 2, train_loss: 0.8992, test_loss: 1.0265, test_f1: 0.4866
 epoch: 3, train_loss: 0.8587, test_loss: 1.0306, test_f1: 0.5444
 epoch: 4, train_loss: 0.8654, test_loss: 1.0997, test_f1: 0.4804
 epoch: 5, train_loss: 0.8486, test_loss: 1.0170, test_f1: 0.4964
 epoch: 6, train_loss: 0.8322, test_loss: 1.0725, test_f1: 0.5381
 epoch: 7, train_loss: 0.8368, test_loss: 1.0991, test_f1: 0.3860
 epoch: 8, train_loss: 0.8291, test_loss: 1.0298, test_f1: 0.4501
 epoch: 9, train_loss: 0.8062, test_loss: 1.6235, test_f1: 0.4305
 epoch: 10, train_loss: 0.8013, test_loss: 1.2004, test_f1: 0.4607
 epoch: 11, train_loss: 0.7699, test_loss: 1.3252, test_f1: 0.4098
 epoch: 12, train_loss: 0.7736, test_loss: 1.0459, test_f1: 0.5113
 epoch: 13, train_loss: 0.7639, test_loss: 1.1164, test_f1: 0.5057
 epoch: 14, train_loss: 0.7537, test_loss: 1.0413, test_f1: 0.5680
 epoch: 15, train_loss: 0.7711, test_loss: 1.0547, test_f1: 0.5350
 epoch: 16, train_loss: 0.7310, test_loss: 1.0734, test_f1: 0.5517
 epoch: 17, train_loss: 0.7169, test_loss: 2.2593, test_f1: 0.4185
 epoch: 18, train_loss: 0.7361, test_loss: 1.0784, test_f1: 0.5728
 epoch: 19, train_loss: 0.6975, test_loss: 1.0351, test_f1: 0.6038
 epoch: 20, train_loss: 0.6953, test_loss: 1.0185, test_f1: 0.5856
 epoch: 21, train_loss: 0.6917, test_loss: 1.0863, test_f1: 0.5769
 epoch: 22, train_loss: 0.7105, test_loss: 1.0643, test_f1: 0.5557
 epoch: 23, train_loss: 0.6993, test_loss: 1.0913, test_f1: 0.5803
 epoch: 24, train_loss: 0.6580, test_loss: 1.0492, test_f1: 0.5403
 epoch: 25, train_loss: 0.6688, test_loss: 1.0993, test_f1: 0.5870
 epoch: 26, train_loss: 0.6980, test_loss: 0.9458, test_f1: 0.6198
 epoch: 27, train_loss: 0.6499, test_loss: 1.1103, test_f1: 0.5540
 epoch: 28, train_loss: 0.6654, test_loss: 1.1458, test_f1: 0.5965
 epoch: 29, train_loss: 0.6819, test_loss: 1.2694, test_f1: 0.5580
 epoch: 30, train_loss: 0.6741, test_loss: 1.1747, test_f1: 0.5142
 epoch: 31, train_loss: 0.6608, test_loss: 0.9740, test_f1: 0.6270
 epoch: 32, train_loss: 0.6819, test_loss: 1.2241, test_f1: 0.5622
 epoch: 33, train_loss: 0.6564, test_loss: 1.3238, test_f1: 0.5999
 epoch: 34, train_loss: 0.6180, test_loss: 1.4260, test_f1: 0.5707
 epoch: 35, train_loss: 0.6374, test_loss: 1.5171, test_f1: 0.5267
 epoch: 36, train_loss: 0.6149, test_loss: 1.3401, test_f1: 0.5358
 epoch: 37, train_loss: 0.5946, test_loss: 1.1156, test_f1: 0.6303
 epoch: 38, train_loss: 0.5966, test_loss: 1.0834, test_f1: 0.6140
 epoch: 39, train_loss: 0.6059, test_loss: 1.4258, test_f1: 0.5921
 epoch: 40, train_loss: 0.5950, test_loss: 1.7479, test_f1: 0.5459
 epoch: 41, train_loss: 0.6844, test_loss: 1.1495, test_f1: 0.5530
 epoch: 42, train_loss: 0.6157, test_loss: 1.1725, test_f1: 0.5473
 epoch: 43, train_loss: 0.6243, test_loss: 1.2202, test_f1: 0.6188
 epoch: 44, train_loss: 0.5874, test_loss: 1.0302, test_f1: 0.6162
 epoch: 45, train_loss: 0.5888, test_loss: 1.1821, test_f1: 0.6159
 epoch: 46, train_loss: 0.5492, test_loss: 1.8594, test_f1: 0.5549
 epoch: 47, train_loss: 0.6253, test_loss: 1.5771, test_f1: 0.5129
 epoch: 48, train_loss: 0.5986, test_loss: 1.4455, test_f1: 0.5585
 epoch: 49, train_loss: 0.6141, test_loss: 1.1023, test_f1: 0.6221
 epoch: 50, train_loss: 0.5580, test_loss: 1.3108, test_f1: 0.5625
 epoch: 51, train_loss: 0.5239, test_loss: 1.2474, test_f1: 0.6197
 epoch: 52, train_loss: 0.4911, test_loss: 1.5915, test_f1: 0.5953
 epoch: 53, train_loss: 0.4768, test_loss: 1.3766, test_f1: 0.6231
 epoch: 54, train_loss: 0.4581, test_loss: 1.3835, test_f1: 0.6417
 epoch: 55, train_loss: 0.4504, test_loss: 1.5063, test_f1: 0.5959
 epoch: 56, train_loss: 0.4695, test_loss: 2.0034, test_f1: 0.6264
 epoch: 57, train_loss: 0.4523, test_loss: 1.3411, test_f1: 0.6377
 epoch: 58, train_loss: 0.4549, test_loss: 1.6665, test_f1: 0.6236
 epoch: 59, train_loss: 0.4523, test_loss: 1.6861, test_f1: 0.6159
 epoch: 60, train_loss: 0.4400, test_loss: 1.7073, test_f1: 0.5954
 epoch: 61, train_loss: 0.4428, test_loss: 1.2333, test_f1: 0.6562
 epoch: 62, train_loss: 0.3970, test_loss: 1.4473, test_f1: 0.6271
 epoch: 63, train_loss: 0.4090, test_loss: 1.4959, test_f1: 0.6333
 epoch: 64, train_loss: 0.4318, test_loss: 1.3091, test_f1: 0.6520
 epoch: 65, train_loss: 0.4365, test_loss: 1.6663, test_f1: 0.6510
 epoch: 66, train_loss: 0.3877, test_loss: 1.3934, test_f1: 0.6586
 epoch: 67, train_loss: 0.3726, test_loss: 1.4733, test_f1: 0.6326
 epoch: 68, train_loss: 0.4029, test_loss: 1.3773, test_f1: 0.6703
 epoch: 69, train_loss: 0.4144, test_loss: 1.5372, test_f1: 0.6299
 epoch: 70, train_loss: 0.4064, test_loss: 1.3678, test_f1: 0.6468
 epoch: 71, train_loss: 0.3806, test_loss: 1.2418, test_f1: 0.6251
 epoch: 72, train_loss: 0.4062, test_loss: 1.5171, test_f1: 0.6256
 epoch: 73, train_loss: 0.3882, test_loss: 1.2923, test_f1: 0.6696
 epoch: 74, train_loss: 0.3785, test_loss: 1.3995, test_f1: 0.6418
 epoch: 75, train_loss: 0.4247, test_loss: 1.4112, test_f1: 0.6583
 epoch: 76, train_loss: 0.3953, test_loss: 2.0054, test_f1: 0.5878
 epoch: 77, train_loss: 0.3870, test_loss: 1.7148, test_f1: 0.6225
 epoch: 78, train_loss: 0.3929, test_loss: 1.5841, test_f1: 0.6719
 epoch: 79, train_loss: 0.3466, test_loss: 1.5420, test_f1: 0.6027
 epoch: 80, train_loss: 0.4115, test_loss: 1.4905, test_f1: 0.6216
 epoch: 81, train_loss: 0.3648, test_loss: 1.9353, test_f1: 0.5129
 epoch: 82, train_loss: 0.3723, test_loss: 1.6800, test_f1: 0.6284
 epoch: 83, train_loss: 0.3632, test_loss: 1.3724, test_f1: 0.6303
 epoch: 84, train_loss: 0.3947, test_loss: 1.9794, test_f1: 0.6103
 epoch: 85, train_loss: 0.3773, test_loss: 1.3660, test_f1: 0.6208
 epoch: 86, train_loss: 0.3837, test_loss: 1.3295, test_f1: 0.6548
 epoch: 87, train_loss: 0.3432, test_loss: 1.4718, test_f1: 0.6327
 epoch: 88, train_loss: 0.3310, test_loss: 1.4811, test_f1: 0.6228
 epoch: 89, train_loss: 0.3848, test_loss: 1.3027, test_f1: 0.6527
 epoch: 90, train_loss: 0.3418, test_loss: 1.4618, test_f1: 0.6308
 epoch: 91, train_loss: 0.3490, test_loss: 2.0027, test_f1: 0.5763
 epoch: 92, train_loss: 0.3559, test_loss: 1.1962, test_f1: 0.6765
 epoch: 93, train_loss: 0.3478, test_loss: 1.5571, test_f1: 0.6531
 epoch: 94, train_loss: 0.3514, test_loss: 1.6142, test_f1: 0.6242
 epoch: 95, train_loss: 0.3522, test_loss: 1.3730, test_f1: 0.6707
 epoch: 96, train_loss: 0.3121, test_loss: 1.4198, test_f1: 0.6265
 epoch: 97, train_loss: 0.3303, test_loss: 1.3614, test_f1: 0.6461
 epoch: 98, train_loss: 0.3273, test_loss: 1.3674, test_f1: 0.6360
 epoch: 99, train_loss: 0.3226, test_loss: 1.6095, test_f1: 0.6561
##################ITERATION #7 ****************************************
 epoch: 0, train_loss: 1.1616, test_loss: 1.1859, test_f1: 0.4230
 epoch: 1, train_loss: 0.9106, test_loss: 1.0692, test_f1: 0.4379
 epoch: 2, train_loss: 0.8717, test_loss: 1.0887, test_f1: 0.4169
 epoch: 3, train_loss: 0.8497, test_loss: 1.0017, test_f1: 0.5304
 epoch: 4, train_loss: 0.8431, test_loss: 0.9922, test_f1: 0.5254
 epoch: 5, train_loss: 0.8213, test_loss: 1.1692, test_f1: 0.4532
 epoch: 6, train_loss: 0.8198, test_loss: 1.3436, test_f1: 0.4300
 epoch: 7, train_loss: 0.8143, test_loss: 1.0931, test_f1: 0.4358
 epoch: 8, train_loss: 0.7929, test_loss: 1.1074, test_f1: 0.5151
 epoch: 9, train_loss: 0.7828, test_loss: 1.0950, test_f1: 0.4452
 epoch: 10, train_loss: 0.7646, test_loss: 1.3045, test_f1: 0.4884
 epoch: 11, train_loss: 0.7754, test_loss: 2.6325, test_f1: 0.4051
 epoch: 12, train_loss: 0.7910, test_loss: 1.2638, test_f1: 0.5009
 epoch: 13, train_loss: 0.7355, test_loss: 1.0375, test_f1: 0.5676
 epoch: 14, train_loss: 0.7521, test_loss: 1.0796, test_f1: 0.5469
 epoch: 15, train_loss: 0.7259, test_loss: 0.9628, test_f1: 0.6241
 epoch: 16, train_loss: 0.7237, test_loss: 1.2663, test_f1: 0.4665
 epoch: 17, train_loss: 0.6954, test_loss: 1.1476, test_f1: 0.5103
 epoch: 18, train_loss: 0.7480, test_loss: 0.9782, test_f1: 0.5716
 epoch: 19, train_loss: 0.6992, test_loss: 1.2675, test_f1: 0.4817
 epoch: 20, train_loss: 0.6849, test_loss: 1.1253, test_f1: 0.5623
 epoch: 21, train_loss: 0.6808, test_loss: 1.3532, test_f1: 0.4792
 epoch: 22, train_loss: 0.6742, test_loss: 1.1288, test_f1: 0.5338
 epoch: 23, train_loss: 0.6949, test_loss: 1.0898, test_f1: 0.5352
 epoch: 24, train_loss: 0.6943, test_loss: 1.1597, test_f1: 0.5671
 epoch: 25, train_loss: 0.7006, test_loss: 1.0820, test_f1: 0.5878
 epoch: 26, train_loss: 0.6499, test_loss: 1.2140, test_f1: 0.5888
 epoch: 27, train_loss: 0.6373, test_loss: 1.3568, test_f1: 0.6206
 epoch: 28, train_loss: 0.6389, test_loss: 1.0027, test_f1: 0.5649
 epoch: 29, train_loss: 0.6631, test_loss: 1.1361, test_f1: 0.5597
 epoch: 30, train_loss: 0.6703, test_loss: 1.2501, test_f1: 0.5923
 epoch: 31, train_loss: 0.6293, test_loss: 1.2082, test_f1: 0.5046
 epoch: 32, train_loss: 0.6545, test_loss: 1.0039, test_f1: 0.5958
 epoch: 33, train_loss: 0.6246, test_loss: 1.4251, test_f1: 0.5962
 epoch: 34, train_loss: 0.6083, test_loss: 1.1481, test_f1: 0.5928
 epoch: 35, train_loss: 0.6207, test_loss: 1.1131, test_f1: 0.6336
 epoch: 36, train_loss: 0.5947, test_loss: 1.0329, test_f1: 0.5384
 epoch: 37, train_loss: 0.6150, test_loss: 1.1486, test_f1: 0.6215
 epoch: 38, train_loss: 0.5770, test_loss: 1.1877, test_f1: 0.5547
 epoch: 39, train_loss: 0.5914, test_loss: 1.1116, test_f1: 0.6396
 epoch: 40, train_loss: 0.5994, test_loss: 1.3768, test_f1: 0.5962
 epoch: 41, train_loss: 0.5664, test_loss: 1.2168, test_f1: 0.5415
 epoch: 42, train_loss: 0.6193, test_loss: 1.3644, test_f1: 0.5157
 epoch: 43, train_loss: 0.5414, test_loss: 1.2888, test_f1: 0.5963
 epoch: 44, train_loss: 0.5473, test_loss: 1.4945, test_f1: 0.5658
 epoch: 45, train_loss: 0.5374, test_loss: 1.4536, test_f1: 0.5223
 epoch: 46, train_loss: 0.5660, test_loss: 1.3356, test_f1: 0.5829
 epoch: 47, train_loss: 0.5314, test_loss: 1.3437, test_f1: 0.6183
 epoch: 48, train_loss: 0.5579, test_loss: 1.4044, test_f1: 0.5702
 epoch: 49, train_loss: 0.5341, test_loss: 1.8261, test_f1: 0.5275
 epoch: 50, train_loss: 0.5072, test_loss: 1.5328, test_f1: 0.5992
 epoch: 51, train_loss: 0.5161, test_loss: 1.8071, test_f1: 0.5833
 epoch: 52, train_loss: 0.4615, test_loss: 1.4876, test_f1: 0.6112
 epoch: 53, train_loss: 0.4394, test_loss: 1.4676, test_f1: 0.6065
 epoch: 54, train_loss: 0.4212, test_loss: 1.2824, test_f1: 0.6491
 epoch: 55, train_loss: 0.4291, test_loss: 1.4407, test_f1: 0.6173
 epoch: 56, train_loss: 0.4238, test_loss: 1.4839, test_f1: 0.6217
 epoch: 57, train_loss: 0.3911, test_loss: 1.5486, test_f1: 0.5353
 epoch: 58, train_loss: 0.4019, test_loss: 1.4391, test_f1: 0.5976
 epoch: 59, train_loss: 0.3720, test_loss: 1.4803, test_f1: 0.5916
 epoch: 60, train_loss: 0.3968, test_loss: 2.0235, test_f1: 0.5773
 epoch: 61, train_loss: 0.4173, test_loss: 1.7414, test_f1: 0.6064
 epoch: 62, train_loss: 0.3740, test_loss: 1.8405, test_f1: 0.5861
 epoch: 63, train_loss: 0.3897, test_loss: 1.4769, test_f1: 0.6417
 epoch: 64, train_loss: 0.3778, test_loss: 1.7339, test_f1: 0.5967
 epoch: 65, train_loss: 0.3755, test_loss: 1.5385, test_f1: 0.6359
 epoch: 66, train_loss: 0.3679, test_loss: 1.6820, test_f1: 0.5834
 epoch: 67, train_loss: 0.3743, test_loss: 1.5560, test_f1: 0.5848
 epoch: 68, train_loss: 0.4025, test_loss: 1.5993, test_f1: 0.6150
 epoch: 69, train_loss: 0.3714, test_loss: 1.5872, test_f1: 0.6068
 epoch: 70, train_loss: 0.3410, test_loss: 1.5492, test_f1: 0.6051
 epoch: 71, train_loss: 0.3346, test_loss: 1.6724, test_f1: 0.5476
 epoch: 72, train_loss: 0.4184, test_loss: 1.4890, test_f1: 0.6455
 epoch: 73, train_loss: 0.4019, test_loss: 1.4843, test_f1: 0.6606
 epoch: 74, train_loss: 0.3465, test_loss: 1.5163, test_f1: 0.6146
 epoch: 75, train_loss: 0.3291, test_loss: 1.7504, test_f1: 0.6071
 epoch: 76, train_loss: 0.3513, test_loss: 1.4837, test_f1: 0.6354
 epoch: 77, train_loss: 0.3461, test_loss: 1.6094, test_f1: 0.6097
 epoch: 78, train_loss: 0.2897, test_loss: 1.9313, test_f1: 0.4924
 epoch: 79, train_loss: 0.3594, test_loss: 1.7393, test_f1: 0.5806
 epoch: 80, train_loss: 0.3195, test_loss: 1.8122, test_f1: 0.6013
 epoch: 81, train_loss: 0.2852, test_loss: 1.7596, test_f1: 0.6215
 epoch: 82, train_loss: 0.3154, test_loss: 2.2351, test_f1: 0.5892
 epoch: 83, train_loss: 0.3758, test_loss: 1.5823, test_f1: 0.6074
 epoch: 84, train_loss: 0.3064, test_loss: 1.6028, test_f1: 0.5937
 epoch: 85, train_loss: 0.3427, test_loss: 1.5467, test_f1: 0.6346
 epoch: 86, train_loss: 0.3418, test_loss: 2.0958, test_f1: 0.5923
 epoch: 87, train_loss: 0.3219, test_loss: 1.4497, test_f1: 0.6404
 epoch: 88, train_loss: 0.2934, test_loss: 1.5865, test_f1: 0.6641
 epoch: 89, train_loss: 0.3060, test_loss: 1.6312, test_f1: 0.6079
 epoch: 90, train_loss: 0.3047, test_loss: 1.6125, test_f1: 0.6544
 epoch: 91, train_loss: 0.2992, test_loss: 2.1684, test_f1: 0.5491
 epoch: 92, train_loss: 0.3505, test_loss: 1.7276, test_f1: 0.6157
 epoch: 93, train_loss: 0.3026, test_loss: 1.8415, test_f1: 0.6270
 epoch: 94, train_loss: 0.3033, test_loss: 1.6980, test_f1: 0.5576
 epoch: 95, train_loss: 0.2814, test_loss: 2.0591, test_f1: 0.5786
 epoch: 96, train_loss: 0.2877, test_loss: 1.9063, test_f1: 0.6067
 epoch: 97, train_loss: 0.3152, test_loss: 1.6560, test_f1: 0.6321
 epoch: 98, train_loss: 0.2980, test_loss: 1.6283, test_f1: 0.6390
 epoch: 99, train_loss: 0.3158, test_loss: 1.8730, test_f1: 0.5918
##################ITERATION #8 ****************************************
 epoch: 0, train_loss: 1.2259, test_loss: 1.2608, test_f1: 0.4063
 epoch: 1, train_loss: 0.9462, test_loss: 1.0461, test_f1: 0.4609
 epoch: 2, train_loss: 0.8860, test_loss: 1.0652, test_f1: 0.5259
 epoch: 3, train_loss: 0.8602, test_loss: 1.0444, test_f1: 0.4446
 epoch: 4, train_loss: 0.8508, test_loss: 1.0624, test_f1: 0.5576
 epoch: 5, train_loss: 0.8675, test_loss: 1.0066, test_f1: 0.5576
 epoch: 6, train_loss: 0.8072, test_loss: 1.1319, test_f1: 0.4482
 epoch: 7, train_loss: 0.8109, test_loss: 1.1364, test_f1: 0.5379
 epoch: 8, train_loss: 0.8180, test_loss: 1.0601, test_f1: 0.4616
 epoch: 9, train_loss: 0.8078, test_loss: 1.2221, test_f1: 0.4846
 epoch: 10, train_loss: 0.8111, test_loss: 1.0351, test_f1: 0.5857
 epoch: 11, train_loss: 0.7815, test_loss: 1.0800, test_f1: 0.4767
 epoch: 12, train_loss: 0.7662, test_loss: 1.3133, test_f1: 0.4566
 epoch: 13, train_loss: 0.7678, test_loss: 1.2724, test_f1: 0.5288
 epoch: 14, train_loss: 0.7724, test_loss: 1.1448, test_f1: 0.4831
 epoch: 15, train_loss: 0.7831, test_loss: 0.9817, test_f1: 0.5286
 epoch: 16, train_loss: 0.7380, test_loss: 1.0237, test_f1: 0.6150
 epoch: 17, train_loss: 0.7225, test_loss: 1.0857, test_f1: 0.5059
 epoch: 18, train_loss: 0.7261, test_loss: 1.2324, test_f1: 0.5587
 epoch: 19, train_loss: 0.7023, test_loss: 11.2926, test_f1: 0.0302
 epoch: 20, train_loss: 0.7385, test_loss: 1.8932, test_f1: 0.5047
 epoch: 21, train_loss: 0.7181, test_loss: 1.0500, test_f1: 0.5080
 epoch: 22, train_loss: 0.7504, test_loss: 1.0572, test_f1: 0.5753
 epoch: 23, train_loss: 0.7029, test_loss: 1.2115, test_f1: 0.5143
 epoch: 24, train_loss: 0.6874, test_loss: 1.2477, test_f1: 0.5343
 epoch: 25, train_loss: 0.6804, test_loss: 1.2976, test_f1: 0.5980
 epoch: 26, train_loss: 0.6849, test_loss: 1.2019, test_f1: 0.5069
 epoch: 27, train_loss: 0.6872, test_loss: 1.3418, test_f1: 0.5730
 epoch: 28, train_loss: 0.6723, test_loss: 1.0700, test_f1: 0.5907
 epoch: 29, train_loss: 0.6927, test_loss: 1.1443, test_f1: 0.5465
 epoch: 30, train_loss: 0.6574, test_loss: 1.2994, test_f1: 0.6195
 epoch: 31, train_loss: 0.6635, test_loss: 1.0749, test_f1: 0.5546
 epoch: 32, train_loss: 0.6326, test_loss: 1.1786, test_f1: 0.5925
 epoch: 33, train_loss: 0.6138, test_loss: 1.5803, test_f1: 0.5556
 epoch: 34, train_loss: 0.6321, test_loss: 1.1390, test_f1: 0.5621
 epoch: 35, train_loss: 0.6201, test_loss: 1.3330, test_f1: 0.4475
 epoch: 36, train_loss: 0.6234, test_loss: 1.1940, test_f1: 0.5706
 epoch: 37, train_loss: 0.6081, test_loss: 2.1927, test_f1: 0.4982
 epoch: 38, train_loss: 0.6242, test_loss: 1.7929, test_f1: 0.5524
 epoch: 39, train_loss: 0.6007, test_loss: 1.2667, test_f1: 0.6011
 epoch: 40, train_loss: 0.6265, test_loss: 1.1341, test_f1: 0.5698
 epoch: 41, train_loss: 0.6265, test_loss: 1.4891, test_f1: 0.5453
 epoch: 42, train_loss: 0.5873, test_loss: 1.2655, test_f1: 0.5912
 epoch: 43, train_loss: 0.5422, test_loss: 1.7194, test_f1: 0.5971
 epoch: 44, train_loss: 0.6029, test_loss: 1.4869, test_f1: 0.5868
 epoch: 45, train_loss: 0.5854, test_loss: 1.3438, test_f1: 0.5881
 epoch: 46, train_loss: 0.5925, test_loss: 1.2537, test_f1: 0.5703
 epoch: 47, train_loss: 0.6074, test_loss: 1.4110, test_f1: 0.5788
 epoch: 48, train_loss: 0.5792, test_loss: 1.3792, test_f1: 0.6088
 epoch: 49, train_loss: 0.5952, test_loss: 1.3337, test_f1: 0.5734
 epoch: 50, train_loss: 0.5371, test_loss: 1.7032, test_f1: 0.5872
 epoch: 51, train_loss: 0.4999, test_loss: 1.8945, test_f1: 0.5777
 epoch: 52, train_loss: 0.4671, test_loss: 1.4134, test_f1: 0.6009
 epoch: 53, train_loss: 0.4729, test_loss: 1.6811, test_f1: 0.6032
 epoch: 54, train_loss: 0.4748, test_loss: 1.5304, test_f1: 0.5974
 epoch: 55, train_loss: 0.4705, test_loss: 1.5837, test_f1: 0.5684
 epoch: 56, train_loss: 0.4534, test_loss: 1.6126, test_f1: 0.6156
 epoch: 57, train_loss: 0.4638, test_loss: 1.8428, test_f1: 0.5294
 epoch: 58, train_loss: 0.4121, test_loss: 1.5245, test_f1: 0.6011
 epoch: 59, train_loss: 0.4223, test_loss: 1.4548, test_f1: 0.5709
 epoch: 60, train_loss: 0.4357, test_loss: 1.7812, test_f1: 0.5691
 epoch: 61, train_loss: 0.3989, test_loss: 1.4666, test_f1: 0.5614
 epoch: 62, train_loss: 0.4653, test_loss: 1.3465, test_f1: 0.5868
 epoch: 63, train_loss: 0.4147, test_loss: 1.8227, test_f1: 0.6244
 epoch: 64, train_loss: 0.4268, test_loss: 1.5884, test_f1: 0.5206
 epoch: 65, train_loss: 0.4227, test_loss: 1.6567, test_f1: 0.6088
 epoch: 66, train_loss: 0.3817, test_loss: 1.8563, test_f1: 0.5803
 epoch: 67, train_loss: 0.3868, test_loss: 1.4859, test_f1: 0.5971
 epoch: 68, train_loss: 0.4251, test_loss: 1.5724, test_f1: 0.6016
 epoch: 69, train_loss: 0.4106, test_loss: 1.6495, test_f1: 0.6071
 epoch: 70, train_loss: 0.3903, test_loss: 1.6230, test_f1: 0.6012
 epoch: 71, train_loss: 0.3609, test_loss: 1.6655, test_f1: 0.6167
 epoch: 72, train_loss: 0.3630, test_loss: 1.6755, test_f1: 0.6167
 epoch: 73, train_loss: 0.3566, test_loss: 2.4102, test_f1: 0.5433
 epoch: 74, train_loss: 0.3915, test_loss: 1.7298, test_f1: 0.5605
 epoch: 75, train_loss: 0.4111, test_loss: 1.7943, test_f1: 0.5638
 epoch: 76, train_loss: 0.3682, test_loss: 1.9456, test_f1: 0.5671
 epoch: 77, train_loss: 0.3551, test_loss: 2.0660, test_f1: 0.5440
 epoch: 78, train_loss: 0.3984, test_loss: 2.1276, test_f1: 0.5615
 epoch: 79, train_loss: 0.3610, test_loss: 2.1268, test_f1: 0.5878
 epoch: 80, train_loss: 0.3684, test_loss: 1.7887, test_f1: 0.6023
 epoch: 81, train_loss: 0.3427, test_loss: 1.9924, test_f1: 0.5993
 epoch: 82, train_loss: 0.3420, test_loss: 1.8520, test_f1: 0.6205
 epoch: 83, train_loss: 0.3285, test_loss: 2.0372, test_f1: 0.5886
 epoch: 84, train_loss: 0.3630, test_loss: 2.0144, test_f1: 0.5928
 epoch: 85, train_loss: 0.3238, test_loss: 2.0756, test_f1: 0.5631
 epoch: 86, train_loss: 0.3560, test_loss: 2.4424, test_f1: 0.5278
 epoch: 87, train_loss: 0.3488, test_loss: 2.0218, test_f1: 0.5413
 epoch: 88, train_loss: 0.4075, test_loss: 1.8565, test_f1: 0.5913
 epoch: 89, train_loss: 0.3392, test_loss: 1.9292, test_f1: 0.5836
 epoch: 90, train_loss: 0.3226, test_loss: 2.2656, test_f1: 0.5778
 epoch: 91, train_loss: 0.3202, test_loss: 1.9695, test_f1: 0.6114
 epoch: 92, train_loss: 0.3383, test_loss: 2.0756, test_f1: 0.5948
 epoch: 93, train_loss: 0.3107, test_loss: 2.0729, test_f1: 0.5754
 epoch: 94, train_loss: 0.3071, test_loss: 2.5636, test_f1: 0.6177
 epoch: 95, train_loss: 0.2988, test_loss: 1.9064, test_f1: 0.6093
 epoch: 96, train_loss: 0.2613, test_loss: 2.1983, test_f1: 0.6086
 epoch: 97, train_loss: 0.2855, test_loss: 2.7839, test_f1: 0.5070
 epoch: 98, train_loss: 0.2927, test_loss: 1.7323, test_f1: 0.6198
 epoch: 99, train_loss: 0.2663, test_loss: 2.3479, test_f1: 0.5498
##################ITERATION #9 ****************************************
 epoch: 0, train_loss: 1.1671, test_loss: 1.2879, test_f1: 0.4281
 epoch: 1, train_loss: 0.9884, test_loss: 0.9911, test_f1: 0.4987
 epoch: 2, train_loss: 0.8768, test_loss: 1.1149, test_f1: 0.4072
 epoch: 3, train_loss: 0.8780, test_loss: 1.0276, test_f1: 0.4696
 epoch: 4, train_loss: 0.8664, test_loss: 1.0226, test_f1: 0.5554
 epoch: 5, train_loss: 0.8339, test_loss: 1.0391, test_f1: 0.5416
 epoch: 6, train_loss: 0.8392, test_loss: 1.0574, test_f1: 0.5806
 epoch: 7, train_loss: 0.8292, test_loss: 1.1266, test_f1: 0.5096
 epoch: 8, train_loss: 0.8156, test_loss: 1.0497, test_f1: 0.5546
 epoch: 9, train_loss: 0.8154, test_loss: 1.2301, test_f1: 0.4421
 epoch: 10, train_loss: 0.7784, test_loss: 1.4092, test_f1: 0.4191
 epoch: 11, train_loss: 0.8863, test_loss: 1.0122, test_f1: 0.5041
 epoch: 12, train_loss: 0.8028, test_loss: 1.0687, test_f1: 0.5154
 epoch: 13, train_loss: 0.8046, test_loss: 3.0383, test_f1: 0.2206
 epoch: 14, train_loss: 0.7880, test_loss: 1.0346, test_f1: 0.5560
 epoch: 15, train_loss: 0.7518, test_loss: 1.0267, test_f1: 0.5611
 epoch: 16, train_loss: 0.7693, test_loss: 1.1415, test_f1: 0.5436
 epoch: 17, train_loss: 0.7854, test_loss: 1.1464, test_f1: 0.5432
 epoch: 18, train_loss: 0.7337, test_loss: 1.2997, test_f1: 0.5000
 epoch: 19, train_loss: 0.7352, test_loss: 1.1888, test_f1: 0.4894
 epoch: 20, train_loss: 0.7096, test_loss: 1.4740, test_f1: 0.3970
 epoch: 21, train_loss: 0.7281, test_loss: 1.3261, test_f1: 0.5234
 epoch: 22, train_loss: 0.7444, test_loss: 1.0469, test_f1: 0.5023
 epoch: 23, train_loss: 0.7299, test_loss: 1.0533, test_f1: 0.5921
 epoch: 24, train_loss: 0.7193, test_loss: 1.1773, test_f1: 0.5601
 epoch: 25, train_loss: 0.6660, test_loss: 1.0656, test_f1: 0.5370
 epoch: 26, train_loss: 0.6837, test_loss: 1.1969, test_f1: 0.5734
 epoch: 27, train_loss: 0.7386, test_loss: 1.2375, test_f1: 0.5676
 epoch: 28, train_loss: 0.6730, test_loss: 1.0749, test_f1: 0.5249
 epoch: 29, train_loss: 0.7002, test_loss: 1.1625, test_f1: 0.5032
 epoch: 30, train_loss: 0.6906, test_loss: 1.1593, test_f1: 0.5364
 epoch: 31, train_loss: 0.6626, test_loss: 1.2343, test_f1: 0.5258
 epoch: 32, train_loss: 0.6679, test_loss: 1.4213, test_f1: 0.5414
 epoch: 33, train_loss: 0.6615, test_loss: 1.1046, test_f1: 0.6072
 epoch: 34, train_loss: 0.6460, test_loss: 1.9902, test_f1: 0.4372
 epoch: 35, train_loss: 0.6480, test_loss: 1.0805, test_f1: 0.5212
 epoch: 36, train_loss: 0.6664, test_loss: 1.0992, test_f1: 0.5677
 epoch: 37, train_loss: 0.6476, test_loss: 1.1325, test_f1: 0.5434
 epoch: 38, train_loss: 0.7082, test_loss: 1.0417, test_f1: 0.5610
 epoch: 39, train_loss: 0.6489, test_loss: 1.1615, test_f1: 0.5320
 epoch: 40, train_loss: 0.6412, test_loss: 1.4288, test_f1: 0.5401
 epoch: 41, train_loss: 0.6332, test_loss: 1.6196, test_f1: 0.5217
 epoch: 42, train_loss: 0.6172, test_loss: 1.1409, test_f1: 0.6083
 epoch: 43, train_loss: 0.6057, test_loss: 1.2233, test_f1: 0.5489
 epoch: 44, train_loss: 0.6284, test_loss: 1.1676, test_f1: 0.5840
 epoch: 45, train_loss: 0.5926, test_loss: 1.1520, test_f1: 0.6082
 epoch: 46, train_loss: 0.6049, test_loss: 0.9900, test_f1: 0.6475
 epoch: 47, train_loss: 0.6080, test_loss: 1.3749, test_f1: 0.4758
 epoch: 48, train_loss: 0.5875, test_loss: 1.0375, test_f1: 0.5394
 epoch: 49, train_loss: 0.6256, test_loss: 1.0485, test_f1: 0.5700
 epoch: 50, train_loss: 0.5948, test_loss: 1.1588, test_f1: 0.5704
 epoch: 51, train_loss: 0.5093, test_loss: 1.2016, test_f1: 0.5730
 epoch: 52, train_loss: 0.5233, test_loss: 1.2336, test_f1: 0.6189
 epoch: 53, train_loss: 0.4737, test_loss: 1.2055, test_f1: 0.5770
 epoch: 54, train_loss: 0.4665, test_loss: 1.2478, test_f1: 0.5801
 epoch: 55, train_loss: 0.4764, test_loss: 1.4438, test_f1: 0.5662
 epoch: 56, train_loss: 0.4508, test_loss: 1.2512, test_f1: 0.6037
 epoch: 57, train_loss: 0.4454, test_loss: 1.2807, test_f1: 0.6490
 epoch: 58, train_loss: 0.4472, test_loss: 1.2462, test_f1: 0.6317
 epoch: 59, train_loss: 0.4493, test_loss: 1.2974, test_f1: 0.6000
 epoch: 60, train_loss: 0.4332, test_loss: 1.3847, test_f1: 0.5873
 epoch: 61, train_loss: 0.4210, test_loss: 1.4785, test_f1: 0.5743
 epoch: 62, train_loss: 0.4211, test_loss: 1.4592, test_f1: 0.5942
 epoch: 63, train_loss: 0.4109, test_loss: 1.3614, test_f1: 0.6051
 epoch: 64, train_loss: 0.4203, test_loss: 1.6619, test_f1: 0.5560
 epoch: 65, train_loss: 0.3950, test_loss: 1.4785, test_f1: 0.5932
 epoch: 66, train_loss: 0.4088, test_loss: 1.5532, test_f1: 0.6140
 epoch: 67, train_loss: 0.4112, test_loss: 1.4475, test_f1: 0.6005
 epoch: 68, train_loss: 0.4026, test_loss: 1.5461, test_f1: 0.5535
 epoch: 69, train_loss: 0.3928, test_loss: 1.6543, test_f1: 0.5738
 epoch: 70, train_loss: 0.4165, test_loss: 1.4411, test_f1: 0.5855
 epoch: 71, train_loss: 0.3470, test_loss: 1.5103, test_f1: 0.6037
 epoch: 72, train_loss: 0.3584, test_loss: 1.5606, test_f1: 0.5947
 epoch: 73, train_loss: 0.3800, test_loss: 1.5099, test_f1: 0.5793
 epoch: 74, train_loss: 0.3734, test_loss: 1.6307, test_f1: 0.6114
 epoch: 75, train_loss: 0.3633, test_loss: 1.4486, test_f1: 0.6247
 epoch: 76, train_loss: 0.3464, test_loss: 1.5121, test_f1: 0.6221
 epoch: 77, train_loss: 0.3541, test_loss: 1.6936, test_f1: 0.6015
 epoch: 78, train_loss: 0.3423, test_loss: 1.7011, test_f1: 0.5632
 epoch: 79, train_loss: 0.3717, test_loss: 1.6939, test_f1: 0.5549
 epoch: 80, train_loss: 0.3411, test_loss: 1.6025, test_f1: 0.5670
 epoch: 81, train_loss: 0.3330, test_loss: 1.5381, test_f1: 0.5919
 epoch: 82, train_loss: 0.3283, test_loss: 1.6593, test_f1: 0.5648
 epoch: 83, train_loss: 0.3462, test_loss: 1.7547, test_f1: 0.5553
 epoch: 84, train_loss: 0.2863, test_loss: 1.5860, test_f1: 0.6060
 epoch: 85, train_loss: 0.3006, test_loss: 2.2290, test_f1: 0.5001
 epoch: 86, train_loss: 0.3351, test_loss: 1.5873, test_f1: 0.6035
 epoch: 87, train_loss: 0.3145, test_loss: 1.8824, test_f1: 0.5850
 epoch: 88, train_loss: 0.3336, test_loss: 1.6438, test_f1: 0.5940
 epoch: 89, train_loss: 0.3483, test_loss: 1.6804, test_f1: 0.6125
 epoch: 90, train_loss: 0.3428, test_loss: 1.7926, test_f1: 0.5932
 epoch: 91, train_loss: 0.3571, test_loss: 1.6589, test_f1: 0.5435
 epoch: 92, train_loss: 0.2979, test_loss: 1.7451, test_f1: 0.5633
 epoch: 93, train_loss: 0.2825, test_loss: 2.1711, test_f1: 0.5307
 epoch: 94, train_loss: 0.2821, test_loss: 1.7439, test_f1: 0.6232
 epoch: 95, train_loss: 0.3198, test_loss: 1.7291, test_f1: 0.5545
 epoch: 96, train_loss: 0.3141, test_loss: 1.8391, test_f1: 0.5679
 epoch: 97, train_loss: 0.2967, test_loss: 1.9075, test_f1: 0.6241
 epoch: 98, train_loss: 0.3197, test_loss: 2.0070, test_f1: 0.5368
 epoch: 99, train_loss: 0.2854, test_loss: 1.8424, test_f1: 0.5664

Training completed in 793.08 seconds
Best F1: 0.6768 at epoch 90
Mean F1 across iterations: 0.6622  0.0151
========================FINAL RESULTS================================
FEGIN weighted F1: 0.6768  0.0151
python main.py --data ltspice_demos --representation component_pin_net --model FEGIN --layers 2 --hiddens 128 --batch_size 32 --lr 0.01 --emb_size 128 --epochs 100 --save_appendix component_pin_net_L2_H128_BS32_LR0.01_E128 --no_val
-----



STDERR:
  File "main.py", line 370, in <module>
    main()
  File "main.py", line 254, in main
    dataset = dataset_class(
  File "/home/philip/projects/ltspice_examples_code_repo/Circuit-Completion-Using-GNNs/component_classification_with_link_prediction_head/evaluation/FEGIN/kernel/circuit_datasets.py", line 15, in __init__
    self.data, self.slices = torch.load(self.processed_paths[0])
  File "/home/philip/.local/lib/python3.8/site-packages/torch/serialization.py", line 1040, in load
    warnings.warn(
  File "/usr/lib/python3.8/warnings.py", line 109, in _showwarnmsg
    sw(msg.message, msg.category, msg.filename, msg.lineno,
  File "main.py", line 47, in warn_with_traceback
    traceback.print_stack(file=log)
/home/philip/projects/ltspice_examples_code_repo/Circuit-Completion-Using-GNNs/component_classification_with_link_prediction_head/evaluation/FEGIN/kernel/circuit_datasets.py:15: FutureWarning: You are using `torch.load` with `weights_only=False` (the current default value), which uses the default pickle module implicitly. It is possible to construct malicious pickle data which will execute arbitrary code during unpickling (See https://github.com/pytorch/pytorch/blob/main/SECURITY.md#untrusted-models for more details). In a future release, the default value for `weights_only` will be flipped to `True`. This limits the functions that could be executed during unpickling. Arbitrary objects will no longer be allowed to be loaded via this mode unless they are explicitly allowlisted by the user via `torch.serialization.add_safe_globals`. We recommend you start setting `weights_only=True` for any use case where you don't have full control of the loaded file. Please open an issue on GitHub for any issues related to this experimental feature.
  self.data, self.slices = torch.load(self.processed_paths[0])
