STDOUT:
Results will be saved in /home/philip/projects/ltspice_examples_code_repo/Circuit-Completion-Using-GNNs/component_classification_with_link_prediction_head/evaluation/FEGIN/results/model_FEGIN_dataset_ltspice_demos
Command line input: python main.py --data ltspice_demos --representation component_component --model FEGIN --layers 5 --hiddens 128 --batch_size 256 --lr 0.001 --emb_size 250 --epochs 100 --save_appendix component_component_L5_H128_BS256_LR0.001_E250 --no_val
 is saved.
-----
ltspice_demos - FEGIN
Using 5 layers, 128 hidden units, h = 2
Loading component_component representation dataset
ENTERED
Training FEGIN on component_component representation
Train: 1565, Test: 383
##################ITERATION #0 ****************************************
 epoch: 0, train_loss: 1.3418, test_loss: 1.3400, test_f1: 0.1432
 epoch: 1, train_loss: 1.2100, test_loss: 1.3024, test_f1: 0.3494
 epoch: 2, train_loss: 1.1696, test_loss: 1.2975, test_f1: 0.3749
 epoch: 3, train_loss: 1.1191, test_loss: 1.2821, test_f1: 0.3559
 epoch: 4, train_loss: 1.0810, test_loss: 1.2945, test_f1: 0.3522
 epoch: 5, train_loss: 1.0438, test_loss: 1.2850, test_f1: 0.3983
 epoch: 6, train_loss: 1.0171, test_loss: 1.1869, test_f1: 0.4457
 epoch: 7, train_loss: 0.9691, test_loss: 1.1974, test_f1: 0.4703
 epoch: 8, train_loss: 0.9459, test_loss: 1.2159, test_f1: 0.4638
 epoch: 9, train_loss: 0.9174, test_loss: 1.2807, test_f1: 0.5013
 epoch: 10, train_loss: 0.9131, test_loss: 1.2581, test_f1: 0.4642
 epoch: 11, train_loss: 0.8817, test_loss: 1.2331, test_f1: 0.5160
 epoch: 12, train_loss: 0.8446, test_loss: 1.2917, test_f1: 0.5270
 epoch: 13, train_loss: 0.8176, test_loss: 1.2544, test_f1: 0.5076
 epoch: 14, train_loss: 0.8200, test_loss: 1.3306, test_f1: 0.5324
 epoch: 15, train_loss: 0.8286, test_loss: 1.2256, test_f1: 0.5136
 epoch: 16, train_loss: 0.8038, test_loss: 1.3256, test_f1: 0.5248
 epoch: 17, train_loss: 0.8006, test_loss: 1.2078, test_f1: 0.5317
 epoch: 18, train_loss: 0.7876, test_loss: 1.2543, test_f1: 0.4519
 epoch: 19, train_loss: 0.7765, test_loss: 1.4367, test_f1: 0.4313
 epoch: 20, train_loss: 0.7928, test_loss: 1.2786, test_f1: 0.5206
 epoch: 21, train_loss: 0.7606, test_loss: 1.2415, test_f1: 0.5120
 epoch: 22, train_loss: 0.7355, test_loss: 1.3086, test_f1: 0.4422
 epoch: 23, train_loss: 0.7142, test_loss: 1.6190, test_f1: 0.5443
 epoch: 24, train_loss: 0.7105, test_loss: 1.5254, test_f1: 0.4471
 epoch: 25, train_loss: 0.7086, test_loss: 1.1955, test_f1: 0.5322
 epoch: 26, train_loss: 0.6682, test_loss: 1.1898, test_f1: 0.5496
 epoch: 27, train_loss: 0.6968, test_loss: 1.2767, test_f1: 0.5362
 epoch: 28, train_loss: 0.6370, test_loss: 1.3342, test_f1: 0.5431
 epoch: 29, train_loss: 0.6360, test_loss: 1.4537, test_f1: 0.5365
 epoch: 30, train_loss: 0.6466, test_loss: 1.5081, test_f1: 0.4859
 epoch: 31, train_loss: 0.6427, test_loss: 1.3922, test_f1: 0.5341
 epoch: 32, train_loss: 0.6274, test_loss: 1.4529, test_f1: 0.5117
 epoch: 33, train_loss: 0.6228, test_loss: 1.5447, test_f1: 0.4724
 epoch: 34, train_loss: 0.6336, test_loss: 1.5179, test_f1: 0.4481
 epoch: 35, train_loss: 0.6289, test_loss: 1.6491, test_f1: 0.4692
 epoch: 36, train_loss: 0.5998, test_loss: 1.7022, test_f1: 0.5382
 epoch: 37, train_loss: 0.6109, test_loss: 1.6205, test_f1: 0.5614
 epoch: 38, train_loss: 0.6002, test_loss: 1.6162, test_f1: 0.5307
 epoch: 39, train_loss: 0.5731, test_loss: 1.4555, test_f1: 0.5426
 epoch: 40, train_loss: 0.5797, test_loss: 1.4314, test_f1: 0.5249
 epoch: 41, train_loss: 0.5670, test_loss: 1.5246, test_f1: 0.5428
 epoch: 42, train_loss: 0.5682, test_loss: 1.6751, test_f1: 0.5158
 epoch: 43, train_loss: 0.5388, test_loss: 1.6111, test_f1: 0.5412
 epoch: 44, train_loss: 0.5352, test_loss: 1.3695, test_f1: 0.5496
 epoch: 45, train_loss: 0.5277, test_loss: 1.5708, test_f1: 0.5213
 epoch: 46, train_loss: 0.5515, test_loss: 2.0060, test_f1: 0.5205
 epoch: 47, train_loss: 0.5384, test_loss: 1.6536, test_f1: 0.5461
 epoch: 48, train_loss: 0.5158, test_loss: 1.6036, test_f1: 0.5336
 epoch: 49, train_loss: 0.5164, test_loss: 1.4658, test_f1: 0.5888
 epoch: 50, train_loss: 0.5122, test_loss: 1.7559, test_f1: 0.5427
 epoch: 51, train_loss: 0.4592, test_loss: 1.9381, test_f1: 0.5275
 epoch: 52, train_loss: 0.4470, test_loss: 2.0625, test_f1: 0.5231
 epoch: 53, train_loss: 0.4197, test_loss: 2.0929, test_f1: 0.5024
 epoch: 54, train_loss: 0.4374, test_loss: 2.0853, test_f1: 0.5170
 epoch: 55, train_loss: 0.4331, test_loss: 2.0563, test_f1: 0.5553
 epoch: 56, train_loss: 0.3964, test_loss: 1.9270, test_f1: 0.5263
 epoch: 57, train_loss: 0.3866, test_loss: 1.9316, test_f1: 0.5364
 epoch: 58, train_loss: 0.3951, test_loss: 2.1142, test_f1: 0.5393
 epoch: 59, train_loss: 0.3830, test_loss: 2.1966, test_f1: 0.5083
 epoch: 60, train_loss: 0.3599, test_loss: 2.0342, test_f1: 0.5278
 epoch: 61, train_loss: 0.3865, test_loss: 2.1398, test_f1: 0.4643
 epoch: 62, train_loss: 0.4020, test_loss: 2.5040, test_f1: 0.4411
 epoch: 63, train_loss: 0.3723, test_loss: 2.3720, test_f1: 0.4856
 epoch: 64, train_loss: 0.3527, test_loss: 2.3405, test_f1: 0.4792
 epoch: 65, train_loss: 0.3605, test_loss: 2.3399, test_f1: 0.4644
 epoch: 66, train_loss: 0.3720, test_loss: 2.1028, test_f1: 0.5178
 epoch: 67, train_loss: 0.3588, test_loss: 1.9563, test_f1: 0.5133
 epoch: 68, train_loss: 0.3579, test_loss: 2.0345, test_f1: 0.5017
 epoch: 69, train_loss: 0.3740, test_loss: 2.2412, test_f1: 0.5153
 epoch: 70, train_loss: 0.3564, test_loss: 2.3765, test_f1: 0.5165
 epoch: 71, train_loss: 0.3699, test_loss: 2.4164, test_f1: 0.5211
 epoch: 72, train_loss: 0.3429, test_loss: 2.4124, test_f1: 0.5063
 epoch: 73, train_loss: 0.3370, test_loss: 2.4497, test_f1: 0.4858
 epoch: 74, train_loss: 0.3358, test_loss: 2.5776, test_f1: 0.4685
 epoch: 75, train_loss: 0.3632, test_loss: 2.6640, test_f1: 0.4878
 epoch: 76, train_loss: 0.3997, test_loss: 2.5385, test_f1: 0.4845
 epoch: 77, train_loss: 0.3644, test_loss: 2.3453, test_f1: 0.5241
 epoch: 78, train_loss: 0.3623, test_loss: 2.4436, test_f1: 0.4951
 epoch: 79, train_loss: 0.3865, test_loss: 2.5411, test_f1: 0.4665
 epoch: 80, train_loss: 0.3716, test_loss: 2.5591, test_f1: 0.4719
 epoch: 81, train_loss: 0.3357, test_loss: 2.4795, test_f1: 0.4860
 epoch: 82, train_loss: 0.3593, test_loss: 2.7449, test_f1: 0.4206
 epoch: 83, train_loss: 0.3831, test_loss: 2.9152, test_f1: 0.4782
 epoch: 84, train_loss: 0.3618, test_loss: 3.0041, test_f1: 0.5234
 epoch: 85, train_loss: 0.3604, test_loss: 2.5144, test_f1: 0.4651
 epoch: 86, train_loss: 0.3680, test_loss: 2.2774, test_f1: 0.4806
 epoch: 87, train_loss: 0.3390, test_loss: 2.3082, test_f1: 0.5003
 epoch: 88, train_loss: 0.3210, test_loss: 2.5340, test_f1: 0.4768
 epoch: 89, train_loss: 0.2989, test_loss: 2.6418, test_f1: 0.5001
 epoch: 90, train_loss: 0.3259, test_loss: 2.6871, test_f1: 0.4704
 epoch: 91, train_loss: 0.3040, test_loss: 2.5679, test_f1: 0.4776
 epoch: 92, train_loss: 0.3376, test_loss: 2.4523, test_f1: 0.5261
 epoch: 93, train_loss: 0.3222, test_loss: 2.2963, test_f1: 0.5266
 epoch: 94, train_loss: 0.3099, test_loss: 2.4660, test_f1: 0.5190
 epoch: 95, train_loss: 0.2671, test_loss: 2.6292, test_f1: 0.5121
 epoch: 96, train_loss: 0.3089, test_loss: 2.9740, test_f1: 0.4693
 epoch: 97, train_loss: 0.2913, test_loss: 3.2023, test_f1: 0.4622
 epoch: 98, train_loss: 0.3056, test_loss: 3.1669, test_f1: 0.4335
 epoch: 99, train_loss: 0.2949, test_loss: 3.1541, test_f1: 0.4350
##################ITERATION #1 ****************************************
 epoch: 0, train_loss: 1.2493, test_loss: 1.3153, test_f1: 0.3543
 epoch: 1, train_loss: 1.1212, test_loss: 1.2720, test_f1: 0.3104
 epoch: 2, train_loss: 1.0703, test_loss: 1.2107, test_f1: 0.3210
 epoch: 3, train_loss: 1.0145, test_loss: 1.1905, test_f1: 0.4094
 epoch: 4, train_loss: 0.9617, test_loss: 1.1505, test_f1: 0.4094
 epoch: 5, train_loss: 0.9141, test_loss: 1.1453, test_f1: 0.4960
 epoch: 6, train_loss: 0.8773, test_loss: 1.1789, test_f1: 0.4951
 epoch: 7, train_loss: 0.8573, test_loss: 1.2384, test_f1: 0.5354
 epoch: 8, train_loss: 0.8397, test_loss: 1.2935, test_f1: 0.5144
 epoch: 9, train_loss: 0.8053, test_loss: 1.2972, test_f1: 0.5274
 epoch: 10, train_loss: 0.7745, test_loss: 1.2396, test_f1: 0.5611
 epoch: 11, train_loss: 0.7840, test_loss: 1.4256, test_f1: 0.5482
 epoch: 12, train_loss: 0.7771, test_loss: 1.3749, test_f1: 0.5624
 epoch: 13, train_loss: 0.7538, test_loss: 1.5271, test_f1: 0.5752
 epoch: 14, train_loss: 0.7114, test_loss: 1.6042, test_f1: 0.4629
 epoch: 15, train_loss: 0.7100, test_loss: 1.6011, test_f1: 0.5255
 epoch: 16, train_loss: 0.7366, test_loss: 1.5607, test_f1: 0.5639
 epoch: 17, train_loss: 0.6949, test_loss: 1.6444, test_f1: 0.5307
 epoch: 18, train_loss: 0.6703, test_loss: 1.5896, test_f1: 0.5395
 epoch: 19, train_loss: 0.6520, test_loss: 1.9491, test_f1: 0.5059
 epoch: 20, train_loss: 0.6765, test_loss: 1.9254, test_f1: 0.5387
 epoch: 21, train_loss: 0.6624, test_loss: 1.8042, test_f1: 0.5230
 epoch: 22, train_loss: 0.6505, test_loss: 1.8634, test_f1: 0.4950
 epoch: 23, train_loss: 0.6043, test_loss: 1.8135, test_f1: 0.5580
 epoch: 24, train_loss: 0.6010, test_loss: 1.8459, test_f1: 0.5334
 epoch: 25, train_loss: 0.5986, test_loss: 1.8605, test_f1: 0.5020
 epoch: 26, train_loss: 0.5908, test_loss: 1.7436, test_f1: 0.5109
 epoch: 27, train_loss: 0.5762, test_loss: 1.6232, test_f1: 0.5272
 epoch: 28, train_loss: 0.5973, test_loss: 1.7165, test_f1: 0.5391
 epoch: 29, train_loss: 0.5885, test_loss: 2.1017, test_f1: 0.4969
 epoch: 30, train_loss: 0.5627, test_loss: 1.7706, test_f1: 0.5318
 epoch: 31, train_loss: 0.5747, test_loss: 2.0559, test_f1: 0.5100
 epoch: 32, train_loss: 0.5623, test_loss: 2.3638, test_f1: 0.5021
 epoch: 33, train_loss: 0.5739, test_loss: 1.9386, test_f1: 0.5407
 epoch: 34, train_loss: 0.5302, test_loss: 1.8666, test_f1: 0.5731
 epoch: 35, train_loss: 0.4840, test_loss: 2.0457, test_f1: 0.5717
 epoch: 36, train_loss: 0.4716, test_loss: 2.2062, test_f1: 0.5539
 epoch: 37, train_loss: 0.5064, test_loss: 2.5293, test_f1: 0.4806
 epoch: 38, train_loss: 0.5033, test_loss: 3.4069, test_f1: 0.5002
 epoch: 39, train_loss: 0.5252, test_loss: 2.6553, test_f1: 0.5169
 epoch: 40, train_loss: 0.5468, test_loss: 2.2270, test_f1: 0.4945
 epoch: 41, train_loss: 0.5494, test_loss: 2.3746, test_f1: 0.5121
 epoch: 42, train_loss: 0.5201, test_loss: 2.0822, test_f1: 0.5119
 epoch: 43, train_loss: 0.5034, test_loss: 2.2741, test_f1: 0.5282
 epoch: 44, train_loss: 0.5111, test_loss: 1.8075, test_f1: 0.4932
 epoch: 45, train_loss: 0.4802, test_loss: 1.8153, test_f1: 0.5282
 epoch: 46, train_loss: 0.4631, test_loss: 1.7680, test_f1: 0.5563
 epoch: 47, train_loss: 0.4828, test_loss: 1.8622, test_f1: 0.5655
 epoch: 48, train_loss: 0.4626, test_loss: 2.0724, test_f1: 0.5623
 epoch: 49, train_loss: 0.4598, test_loss: 2.3494, test_f1: 0.5282
 epoch: 50, train_loss: 0.4572, test_loss: 2.1651, test_f1: 0.5270
 epoch: 51, train_loss: 0.4353, test_loss: 2.1308, test_f1: 0.5471
 epoch: 52, train_loss: 0.3885, test_loss: 2.3278, test_f1: 0.5528
 epoch: 53, train_loss: 0.3898, test_loss: 2.4607, test_f1: 0.5568
 epoch: 54, train_loss: 0.3832, test_loss: 2.6199, test_f1: 0.5441
 epoch: 55, train_loss: 0.3534, test_loss: 2.7084, test_f1: 0.5010
 epoch: 56, train_loss: 0.3287, test_loss: 2.4928, test_f1: 0.5521
 epoch: 57, train_loss: 0.3364, test_loss: 2.3136, test_f1: 0.5479
 epoch: 58, train_loss: 0.3383, test_loss: 2.1487, test_f1: 0.5556
 epoch: 59, train_loss: 0.3623, test_loss: 2.2848, test_f1: 0.5419
 epoch: 60, train_loss: 0.3512, test_loss: 2.4700, test_f1: 0.5161
 epoch: 61, train_loss: 0.3265, test_loss: 2.3924, test_f1: 0.5236
 epoch: 62, train_loss: 0.3382, test_loss: 2.4771, test_f1: 0.5495
 epoch: 63, train_loss: 0.3131, test_loss: 3.6436, test_f1: 0.5561
 epoch: 64, train_loss: 0.3205, test_loss: 3.4493, test_f1: 0.5643
 epoch: 65, train_loss: 0.3329, test_loss: 3.6684, test_f1: 0.5469
 epoch: 66, train_loss: 0.3435, test_loss: 3.0777, test_f1: 0.5255
 epoch: 67, train_loss: 0.3166, test_loss: 3.3697, test_f1: 0.5520
 epoch: 68, train_loss: 0.3249, test_loss: 3.0829, test_f1: 0.5160
 epoch: 69, train_loss: 0.3300, test_loss: 2.9508, test_f1: 0.5492
 epoch: 70, train_loss: 0.3422, test_loss: 2.9394, test_f1: 0.5561
 epoch: 71, train_loss: 0.3438, test_loss: 2.8151, test_f1: 0.5550
 epoch: 72, train_loss: 0.3221, test_loss: 2.6602, test_f1: 0.5872
 epoch: 73, train_loss: 0.3191, test_loss: 3.0455, test_f1: 0.5759
 epoch: 74, train_loss: 0.3302, test_loss: 3.2905, test_f1: 0.5621
 epoch: 75, train_loss: 0.3168, test_loss: 2.9113, test_f1: 0.5829
 epoch: 76, train_loss: 0.3361, test_loss: 3.0414, test_f1: 0.5670
 epoch: 77, train_loss: 0.3250, test_loss: 3.4219, test_f1: 0.5297
 epoch: 78, train_loss: 0.3570, test_loss: 3.6903, test_f1: 0.5313
 epoch: 79, train_loss: 0.3337, test_loss: 3.7095, test_f1: 0.5604
 epoch: 80, train_loss: 0.3273, test_loss: 3.5763, test_f1: 0.5455
 epoch: 81, train_loss: 0.3001, test_loss: 3.3163, test_f1: 0.5222
 epoch: 82, train_loss: 0.3133, test_loss: 3.3849, test_f1: 0.5154
 epoch: 83, train_loss: 0.3074, test_loss: 3.0928, test_f1: 0.5309
 epoch: 84, train_loss: 0.3084, test_loss: 3.4031, test_f1: 0.5655
 epoch: 85, train_loss: 0.2855, test_loss: 3.6297, test_f1: 0.5416
 epoch: 86, train_loss: 0.3100, test_loss: 3.7945, test_f1: 0.5548
 epoch: 87, train_loss: 0.3134, test_loss: 3.9880, test_f1: 0.5345
 epoch: 88, train_loss: 0.3080, test_loss: 3.8204, test_f1: 0.5274
 epoch: 89, train_loss: 0.3400, test_loss: 3.9459, test_f1: 0.5148
 epoch: 90, train_loss: 0.2972, test_loss: 3.7553, test_f1: 0.5470
 epoch: 91, train_loss: 0.2701, test_loss: 4.6111, test_f1: 0.5456
 epoch: 92, train_loss: 0.2909, test_loss: 5.7615, test_f1: 0.5295
 epoch: 93, train_loss: 0.2883, test_loss: 5.0418, test_f1: 0.5648
 epoch: 94, train_loss: 0.3157, test_loss: 5.2090, test_f1: 0.5680
 epoch: 95, train_loss: 0.2947, test_loss: 4.8682, test_f1: 0.5684
 epoch: 96, train_loss: 0.2775, test_loss: 4.8755, test_f1: 0.5582
 epoch: 97, train_loss: 0.2779, test_loss: 4.7969, test_f1: 0.5406
 epoch: 98, train_loss: 0.2818, test_loss: 3.8268, test_f1: 0.5608
 epoch: 99, train_loss: 0.2651, test_loss: 3.9012, test_f1: 0.5491
##################ITERATION #2 ****************************************
 epoch: 0, train_loss: 1.2411, test_loss: 1.3384, test_f1: 0.1365
 epoch: 1, train_loss: 1.1051, test_loss: 1.2921, test_f1: 0.1479
 epoch: 2, train_loss: 1.0420, test_loss: 1.2545, test_f1: 0.3398
 epoch: 3, train_loss: 1.0139, test_loss: 1.2587, test_f1: 0.4118
 epoch: 4, train_loss: 0.9896, test_loss: 1.2371, test_f1: 0.4232
 epoch: 5, train_loss: 0.9381, test_loss: 1.2063, test_f1: 0.4908
 epoch: 6, train_loss: 0.9227, test_loss: 1.2005, test_f1: 0.4541
 epoch: 7, train_loss: 0.8747, test_loss: 1.2060, test_f1: 0.5026
 epoch: 8, train_loss: 0.8629, test_loss: 1.1731, test_f1: 0.5248
 epoch: 9, train_loss: 0.8201, test_loss: 1.2365, test_f1: 0.5501
 epoch: 10, train_loss: 0.8014, test_loss: 1.1256, test_f1: 0.5648
 epoch: 11, train_loss: 0.7711, test_loss: 1.1987, test_f1: 0.5455
 epoch: 12, train_loss: 0.7737, test_loss: 1.2836, test_f1: 0.5835
 epoch: 13, train_loss: 0.7590, test_loss: 1.3431, test_f1: 0.5377
 epoch: 14, train_loss: 0.7783, test_loss: 1.5967, test_f1: 0.4607
 epoch: 15, train_loss: 0.7933, test_loss: 1.4316, test_f1: 0.5217
 epoch: 16, train_loss: 0.7635, test_loss: 1.5402, test_f1: 0.5405
 epoch: 17, train_loss: 0.7367, test_loss: 1.4062, test_f1: 0.5795
 epoch: 18, train_loss: 0.7097, test_loss: 1.4586, test_f1: 0.5419
 epoch: 19, train_loss: 0.7635, test_loss: 1.6859, test_f1: 0.4814
 epoch: 20, train_loss: 0.7253, test_loss: 1.5972, test_f1: 0.5253
 epoch: 21, train_loss: 0.7065, test_loss: 1.5815, test_f1: 0.5339
 epoch: 22, train_loss: 0.6895, test_loss: 1.7527, test_f1: 0.4574
 epoch: 23, train_loss: 0.7036, test_loss: 1.5484, test_f1: 0.5075
 epoch: 24, train_loss: 0.6662, test_loss: 1.3837, test_f1: 0.5768
 epoch: 25, train_loss: 0.6447, test_loss: 1.5136, test_f1: 0.5436
 epoch: 26, train_loss: 0.6182, test_loss: 1.5774, test_f1: 0.5501
 epoch: 27, train_loss: 0.6504, test_loss: 1.9436, test_f1: 0.4409
 epoch: 28, train_loss: 0.6158, test_loss: 1.6587, test_f1: 0.5585
 epoch: 29, train_loss: 0.6275, test_loss: 1.6858, test_f1: 0.5569
 epoch: 30, train_loss: 0.6134, test_loss: 1.9326, test_f1: 0.5138
 epoch: 31, train_loss: 0.5844, test_loss: 1.8097, test_f1: 0.5814
 epoch: 32, train_loss: 0.5751, test_loss: 1.8097, test_f1: 0.5707
 epoch: 33, train_loss: 0.5524, test_loss: 1.7716, test_f1: 0.5646
 epoch: 34, train_loss: 0.5544, test_loss: 2.0195, test_f1: 0.5604
 epoch: 35, train_loss: 0.5596, test_loss: 1.8839, test_f1: 0.5676
 epoch: 36, train_loss: 0.5515, test_loss: 1.8762, test_f1: 0.5473
 epoch: 37, train_loss: 0.5662, test_loss: 1.7398, test_f1: 0.5585
 epoch: 38, train_loss: 0.5211, test_loss: 2.0624, test_f1: 0.5244
 epoch: 39, train_loss: 0.5302, test_loss: 1.8169, test_f1: 0.5489
 epoch: 40, train_loss: 0.4886, test_loss: 1.9679, test_f1: 0.5723
 epoch: 41, train_loss: 0.5580, test_loss: 2.5525, test_f1: 0.5248
 epoch: 42, train_loss: 0.5924, test_loss: 2.3422, test_f1: 0.5241
 epoch: 43, train_loss: 0.5445, test_loss: 2.3131, test_f1: 0.5251
 epoch: 44, train_loss: 0.5484, test_loss: 2.0705, test_f1: 0.5295
 epoch: 45, train_loss: 0.5464, test_loss: 1.8485, test_f1: 0.5487
 epoch: 46, train_loss: 0.5490, test_loss: 1.6693, test_f1: 0.5972
 epoch: 47, train_loss: 0.5290, test_loss: 1.7144, test_f1: 0.5546
 epoch: 48, train_loss: 0.5187, test_loss: 1.7941, test_f1: 0.5734
 epoch: 49, train_loss: 0.5090, test_loss: 1.8698, test_f1: 0.5905
 epoch: 50, train_loss: 0.4611, test_loss: 1.7837, test_f1: 0.5885
 epoch: 51, train_loss: 0.4278, test_loss: 1.7804, test_f1: 0.5905
 epoch: 52, train_loss: 0.4146, test_loss: 1.8213, test_f1: 0.6044
 epoch: 53, train_loss: 0.3925, test_loss: 1.6637, test_f1: 0.6037
 epoch: 54, train_loss: 0.3822, test_loss: 1.6701, test_f1: 0.5889
 epoch: 55, train_loss: 0.3986, test_loss: 1.7711, test_f1: 0.5722
 epoch: 56, train_loss: 0.4078, test_loss: 1.7780, test_f1: 0.5986
 epoch: 57, train_loss: 0.4490, test_loss: 2.0920, test_f1: 0.6024
 epoch: 58, train_loss: 0.4381, test_loss: 1.9091, test_f1: 0.5767
 epoch: 59, train_loss: 0.4335, test_loss: 1.8599, test_f1: 0.5986
 epoch: 60, train_loss: 0.3997, test_loss: 2.0082, test_f1: 0.5874
 epoch: 61, train_loss: 0.3861, test_loss: 2.0376, test_f1: 0.5527
 epoch: 62, train_loss: 0.4063, test_loss: 2.0498, test_f1: 0.5747
 epoch: 63, train_loss: 0.4072, test_loss: 2.1538, test_f1: 0.5657
 epoch: 64, train_loss: 0.3831, test_loss: 2.1592, test_f1: 0.5698
 epoch: 65, train_loss: 0.3818, test_loss: 2.1385, test_f1: 0.5957
 epoch: 66, train_loss: 0.3694, test_loss: 2.2704, test_f1: 0.5514
 epoch: 67, train_loss: 0.3418, test_loss: 2.2561, test_f1: 0.5373
 epoch: 68, train_loss: 0.3785, test_loss: 2.2158, test_f1: 0.5521
 epoch: 69, train_loss: 0.3580, test_loss: 2.1114, test_f1: 0.5730
 epoch: 70, train_loss: 0.3354, test_loss: 2.0419, test_f1: 0.5948
 epoch: 71, train_loss: 0.3261, test_loss: 2.1593, test_f1: 0.5710
 epoch: 72, train_loss: 0.3376, test_loss: 2.1281, test_f1: 0.5794
 epoch: 73, train_loss: 0.3751, test_loss: 2.1873, test_f1: 0.5894
 epoch: 74, train_loss: 0.3384, test_loss: 2.2277, test_f1: 0.5459
 epoch: 75, train_loss: 0.3533, test_loss: 2.0138, test_f1: 0.5410
 epoch: 76, train_loss: 0.3172, test_loss: 2.4960, test_f1: 0.5209
 epoch: 77, train_loss: 0.3227, test_loss: 2.4759, test_f1: 0.5536
 epoch: 78, train_loss: 0.3089, test_loss: 2.3394, test_f1: 0.5758
 epoch: 79, train_loss: 0.3429, test_loss: 2.2175, test_f1: 0.5963
 epoch: 80, train_loss: 0.3310, test_loss: 2.2666, test_f1: 0.5793
 epoch: 81, train_loss: 0.3082, test_loss: 2.2676, test_f1: 0.6041
 epoch: 82, train_loss: 0.3196, test_loss: 2.2566, test_f1: 0.6143
 epoch: 83, train_loss: 0.2966, test_loss: 2.1703, test_f1: 0.5883
 epoch: 84, train_loss: 0.3128, test_loss: 2.2400, test_f1: 0.5968
 epoch: 85, train_loss: 0.3116, test_loss: 2.5876, test_f1: 0.6039
 epoch: 86, train_loss: 0.3145, test_loss: 2.8177, test_f1: 0.5702
 epoch: 87, train_loss: 0.2826, test_loss: 2.6790, test_f1: 0.6058
 epoch: 88, train_loss: 0.3060, test_loss: 2.4533, test_f1: 0.5855
 epoch: 89, train_loss: 0.2974, test_loss: 2.5211, test_f1: 0.5758
 epoch: 90, train_loss: 0.2984, test_loss: 2.7994, test_f1: 0.5532
 epoch: 91, train_loss: 0.3174, test_loss: 2.7984, test_f1: 0.5828
 epoch: 92, train_loss: 0.2986, test_loss: 2.4203, test_f1: 0.6265
 epoch: 93, train_loss: 0.3104, test_loss: 2.5282, test_f1: 0.5731
 epoch: 94, train_loss: 0.2762, test_loss: 2.8684, test_f1: 0.5560
 epoch: 95, train_loss: 0.2784, test_loss: 3.2564, test_f1: 0.5392
 epoch: 96, train_loss: 0.2848, test_loss: 2.9996, test_f1: 0.6071
 epoch: 97, train_loss: 0.2847, test_loss: 2.8461, test_f1: 0.6149
 epoch: 98, train_loss: 0.2546, test_loss: 2.8769, test_f1: 0.6076
 epoch: 99, train_loss: 0.2802, test_loss: 3.0059, test_f1: 0.5887
##################ITERATION #3 ****************************************
 epoch: 0, train_loss: 1.2244, test_loss: 1.3111, test_f1: 0.2101
 epoch: 1, train_loss: 1.0850, test_loss: 1.2746, test_f1: 0.2591
 epoch: 2, train_loss: 1.0413, test_loss: 1.2417, test_f1: 0.3534
 epoch: 3, train_loss: 1.0040, test_loss: 1.2132, test_f1: 0.3666
 epoch: 4, train_loss: 0.9487, test_loss: 1.1956, test_f1: 0.5353
 epoch: 5, train_loss: 0.9301, test_loss: 1.1501, test_f1: 0.5102
 epoch: 6, train_loss: 0.8922, test_loss: 1.1693, test_f1: 0.4682
 epoch: 7, train_loss: 0.8686, test_loss: 1.1897, test_f1: 0.5236
 epoch: 8, train_loss: 0.8924, test_loss: 1.1697, test_f1: 0.5712
 epoch: 9, train_loss: 0.8184, test_loss: 1.1771, test_f1: 0.5126
 epoch: 10, train_loss: 0.8085, test_loss: 1.2358, test_f1: 0.5235
 epoch: 11, train_loss: 0.7935, test_loss: 1.2461, test_f1: 0.5322
 epoch: 12, train_loss: 0.8055, test_loss: 1.2609, test_f1: 0.4737
 epoch: 13, train_loss: 0.7708, test_loss: 1.2326, test_f1: 0.5399
 epoch: 14, train_loss: 0.7689, test_loss: 1.3435, test_f1: 0.5387
 epoch: 15, train_loss: 0.7395, test_loss: 1.4523, test_f1: 0.4595
 epoch: 16, train_loss: 0.7385, test_loss: 1.4680, test_f1: 0.4991
 epoch: 17, train_loss: 0.6989, test_loss: 1.4708, test_f1: 0.5230
 epoch: 18, train_loss: 0.6980, test_loss: 1.6969, test_f1: 0.5006
 epoch: 19, train_loss: 0.7007, test_loss: 1.5863, test_f1: 0.5236
 epoch: 20, train_loss: 0.6912, test_loss: 1.4250, test_f1: 0.5716
 epoch: 21, train_loss: 0.6693, test_loss: 1.3395, test_f1: 0.5347
 epoch: 22, train_loss: 0.6729, test_loss: 1.6609, test_f1: 0.5336
 epoch: 23, train_loss: 0.6664, test_loss: 1.5125, test_f1: 0.5667
 epoch: 24, train_loss: 0.6552, test_loss: 1.7280, test_f1: 0.5598
 epoch: 25, train_loss: 0.6637, test_loss: 1.5078, test_f1: 0.5444
 epoch: 26, train_loss: 0.6476, test_loss: 2.1744, test_f1: 0.4981
 epoch: 27, train_loss: 0.5964, test_loss: 1.6875, test_f1: 0.5346
 epoch: 28, train_loss: 0.6253, test_loss: 1.6363, test_f1: 0.5058
 epoch: 29, train_loss: 0.6037, test_loss: 1.4132, test_f1: 0.5398
 epoch: 30, train_loss: 0.5843, test_loss: 1.4007, test_f1: 0.5491
 epoch: 31, train_loss: 0.6016, test_loss: 1.5164, test_f1: 0.5677
 epoch: 32, train_loss: 0.5873, test_loss: 1.5640, test_f1: 0.5720
 epoch: 33, train_loss: 0.5935, test_loss: 1.4799, test_f1: 0.5773
 epoch: 34, train_loss: 0.5701, test_loss: 1.7087, test_f1: 0.5591
 epoch: 35, train_loss: 0.5861, test_loss: 1.4206, test_f1: 0.5988
 epoch: 36, train_loss: 0.5480, test_loss: 1.4149, test_f1: 0.5193
 epoch: 37, train_loss: 0.5726, test_loss: 1.4755, test_f1: 0.5265
 epoch: 38, train_loss: 0.5988, test_loss: 1.3465, test_f1: 0.5190
 epoch: 39, train_loss: 0.5787, test_loss: 1.7527, test_f1: 0.5504
 epoch: 40, train_loss: 0.5518, test_loss: 1.7753, test_f1: 0.5285
 epoch: 41, train_loss: 0.5567, test_loss: 1.6552, test_f1: 0.5199
 epoch: 42, train_loss: 0.5819, test_loss: 1.9580, test_f1: 0.5237
 epoch: 43, train_loss: 0.5544, test_loss: 1.5153, test_f1: 0.5413
 epoch: 44, train_loss: 0.5304, test_loss: 1.4391, test_f1: 0.5524
 epoch: 45, train_loss: 0.5488, test_loss: 1.6057, test_f1: 0.5530
 epoch: 46, train_loss: 0.5250, test_loss: 1.6351, test_f1: 0.5449
 epoch: 47, train_loss: 0.4892, test_loss: 1.5935, test_f1: 0.5323
 epoch: 48, train_loss: 0.4801, test_loss: 1.5350, test_f1: 0.5285
 epoch: 49, train_loss: 0.4736, test_loss: 1.5604, test_f1: 0.5116
 epoch: 50, train_loss: 0.4575, test_loss: 1.6761, test_f1: 0.5292
 epoch: 51, train_loss: 0.4538, test_loss: 1.7113, test_f1: 0.5540
 epoch: 52, train_loss: 0.4382, test_loss: 1.6564, test_f1: 0.5733
 epoch: 53, train_loss: 0.4533, test_loss: 1.7246, test_f1: 0.5477
 epoch: 54, train_loss: 0.4161, test_loss: 1.7863, test_f1: 0.5608
 epoch: 55, train_loss: 0.4144, test_loss: 1.7386, test_f1: 0.5032
 epoch: 56, train_loss: 0.4191, test_loss: 1.8425, test_f1: 0.4997
 epoch: 57, train_loss: 0.3934, test_loss: 1.9528, test_f1: 0.5133
 epoch: 58, train_loss: 0.4078, test_loss: 2.0309, test_f1: 0.5033
 epoch: 59, train_loss: 0.4043, test_loss: 2.1145, test_f1: 0.5052
 epoch: 60, train_loss: 0.3780, test_loss: 1.9453, test_f1: 0.5431
 epoch: 61, train_loss: 0.3667, test_loss: 2.0043, test_f1: 0.4908
 epoch: 62, train_loss: 0.3481, test_loss: 1.8647, test_f1: 0.5212
 epoch: 63, train_loss: 0.3810, test_loss: 1.8363, test_f1: 0.5615
 epoch: 64, train_loss: 0.3851, test_loss: 1.9078, test_f1: 0.5203
 epoch: 65, train_loss: 0.3923, test_loss: 1.8540, test_f1: 0.5319
 epoch: 66, train_loss: 0.3639, test_loss: 1.8207, test_f1: 0.5612
 epoch: 67, train_loss: 0.3598, test_loss: 1.9115, test_f1: 0.5535
 epoch: 68, train_loss: 0.3503, test_loss: 1.9604, test_f1: 0.5189
 epoch: 69, train_loss: 0.3368, test_loss: 2.2041, test_f1: 0.5106
 epoch: 70, train_loss: 0.3209, test_loss: 2.0289, test_f1: 0.5220
 epoch: 71, train_loss: 0.3322, test_loss: 1.9291, test_f1: 0.5249
 epoch: 72, train_loss: 0.3450, test_loss: 2.1109, test_f1: 0.4890
 epoch: 73, train_loss: 0.3427, test_loss: 2.0699, test_f1: 0.5220
 epoch: 74, train_loss: 0.3365, test_loss: 2.1036, test_f1: 0.5137
 epoch: 75, train_loss: 0.3436, test_loss: 1.9650, test_f1: 0.5407
 epoch: 76, train_loss: 0.3446, test_loss: 2.0752, test_f1: 0.4984
 epoch: 77, train_loss: 0.3099, test_loss: 2.0360, test_f1: 0.5105
 epoch: 78, train_loss: 0.3086, test_loss: 1.9370, test_f1: 0.5338
 epoch: 79, train_loss: 0.3018, test_loss: 2.1738, test_f1: 0.5094
 epoch: 80, train_loss: 0.3161, test_loss: 2.1842, test_f1: 0.5190
 epoch: 81, train_loss: 0.3201, test_loss: 2.2918, test_f1: 0.5225
 epoch: 82, train_loss: 0.2929, test_loss: 2.2114, test_f1: 0.5230
 epoch: 83, train_loss: 0.2995, test_loss: 2.1421, test_f1: 0.5332
 epoch: 84, train_loss: 0.2784, test_loss: 2.2474, test_f1: 0.5316
 epoch: 85, train_loss: 0.2847, test_loss: 2.2682, test_f1: 0.5120
 epoch: 86, train_loss: 0.2920, test_loss: 2.3396, test_f1: 0.5267
 epoch: 87, train_loss: 0.3592, test_loss: 2.2931, test_f1: 0.5291
 epoch: 88, train_loss: 0.3545, test_loss: 2.4822, test_f1: 0.4934
 epoch: 89, train_loss: 0.3642, test_loss: 2.3192, test_f1: 0.4921
 epoch: 90, train_loss: 0.3701, test_loss: 2.0983, test_f1: 0.5486
 epoch: 91, train_loss: 0.3911, test_loss: 2.1758, test_f1: 0.5136
 epoch: 92, train_loss: 0.3880, test_loss: 2.0928, test_f1: 0.5216
 epoch: 93, train_loss: 0.3556, test_loss: 2.2238, test_f1: 0.5064
 epoch: 94, train_loss: 0.3590, test_loss: 2.0204, test_f1: 0.5480
 epoch: 95, train_loss: 0.3604, test_loss: 2.1554, test_f1: 0.5205
 epoch: 96, train_loss: 0.3464, test_loss: 2.0687, test_f1: 0.5420
 epoch: 97, train_loss: 0.3330, test_loss: 2.0507, test_f1: 0.5517
 epoch: 98, train_loss: 0.3382, test_loss: 2.0360, test_f1: 0.5271
 epoch: 99, train_loss: 0.3266, test_loss: 2.0012, test_f1: 0.5447
##################ITERATION #4 ****************************************
 epoch: 0, train_loss: 1.2798, test_loss: 1.3622, test_f1: 0.1527
 epoch: 1, train_loss: 1.1226, test_loss: 1.3254, test_f1: 0.1537
 epoch: 2, train_loss: 1.0643, test_loss: 1.2560, test_f1: 0.3027
 epoch: 3, train_loss: 1.0156, test_loss: 1.2449, test_f1: 0.3175
 epoch: 4, train_loss: 0.9773, test_loss: 1.1854, test_f1: 0.4296
 epoch: 5, train_loss: 0.9403, test_loss: 1.1571, test_f1: 0.4363
 epoch: 6, train_loss: 0.9161, test_loss: 1.1168, test_f1: 0.5171
 epoch: 7, train_loss: 0.8773, test_loss: 1.1621, test_f1: 0.4761
 epoch: 8, train_loss: 0.8528, test_loss: 1.0863, test_f1: 0.5461
 epoch: 9, train_loss: 0.8405, test_loss: 1.0622, test_f1: 0.5600
 epoch: 10, train_loss: 0.8229, test_loss: 1.1294, test_f1: 0.5806
 epoch: 11, train_loss: 0.8012, test_loss: 1.1837, test_f1: 0.5171
 epoch: 12, train_loss: 0.7791, test_loss: 1.2994, test_f1: 0.4996
 epoch: 13, train_loss: 0.7777, test_loss: 1.1477, test_f1: 0.5549
 epoch: 14, train_loss: 0.7631, test_loss: 1.1942, test_f1: 0.5565
 epoch: 15, train_loss: 0.7290, test_loss: 1.4098, test_f1: 0.5270
 epoch: 16, train_loss: 0.7200, test_loss: 1.2463, test_f1: 0.5118
 epoch: 17, train_loss: 0.7204, test_loss: 1.3057, test_f1: 0.5154
 epoch: 18, train_loss: 0.7000, test_loss: 1.4952, test_f1: 0.5009
 epoch: 19, train_loss: 0.7310, test_loss: 1.3777, test_f1: 0.5685
 epoch: 20, train_loss: 0.7254, test_loss: 1.3744, test_f1: 0.5407
 epoch: 21, train_loss: 0.6927, test_loss: 1.3968, test_f1: 0.5337
 epoch: 22, train_loss: 0.7215, test_loss: 1.5095, test_f1: 0.4890
 epoch: 23, train_loss: 0.7036, test_loss: 1.6876, test_f1: 0.4766
 epoch: 24, train_loss: 0.6709, test_loss: 1.4171, test_f1: 0.5224
 epoch: 25, train_loss: 0.6793, test_loss: 1.4461, test_f1: 0.5659
 epoch: 26, train_loss: 0.6572, test_loss: 1.6488, test_f1: 0.4556
 epoch: 27, train_loss: 0.6356, test_loss: 1.4085, test_f1: 0.5566
 epoch: 28, train_loss: 0.6195, test_loss: 1.3882, test_f1: 0.5604
 epoch: 29, train_loss: 0.6191, test_loss: 1.4963, test_f1: 0.5418
 epoch: 30, train_loss: 0.5998, test_loss: 1.4551, test_f1: 0.5598
 epoch: 31, train_loss: 0.6047, test_loss: 1.4635, test_f1: 0.5954
 epoch: 32, train_loss: 0.6041, test_loss: 1.4182, test_f1: 0.5533
 epoch: 33, train_loss: 0.6162, test_loss: 1.5772, test_f1: 0.4965
 epoch: 34, train_loss: 0.6473, test_loss: 1.7037, test_f1: 0.5168
 epoch: 35, train_loss: 0.6525, test_loss: 1.5029, test_f1: 0.5444
 epoch: 36, train_loss: 0.6258, test_loss: 1.7875, test_f1: 0.4986
 epoch: 37, train_loss: 0.5777, test_loss: 1.9373, test_f1: 0.5118
 epoch: 38, train_loss: 0.5748, test_loss: 2.1768, test_f1: 0.5547
 epoch: 39, train_loss: 0.5554, test_loss: 1.8265, test_f1: 0.5435
 epoch: 40, train_loss: 0.5824, test_loss: 2.0310, test_f1: 0.5139
 epoch: 41, train_loss: 0.5524, test_loss: 1.8881, test_f1: 0.4981
 epoch: 42, train_loss: 0.5456, test_loss: 2.0874, test_f1: 0.5107
 epoch: 43, train_loss: 0.5513, test_loss: 1.6475, test_f1: 0.5730
 epoch: 44, train_loss: 0.5658, test_loss: 1.7140, test_f1: 0.5486
 epoch: 45, train_loss: 0.5032, test_loss: 1.6073, test_f1: 0.5464
 epoch: 46, train_loss: 0.5096, test_loss: 1.6593, test_f1: 0.5466
 epoch: 47, train_loss: 0.5157, test_loss: 1.5662, test_f1: 0.5646
 epoch: 48, train_loss: 0.5285, test_loss: 1.5733, test_f1: 0.5686
 epoch: 49, train_loss: 0.5719, test_loss: 1.7171, test_f1: 0.5633
 epoch: 50, train_loss: 0.6047, test_loss: 1.8105, test_f1: 0.5012
 epoch: 51, train_loss: 0.5537, test_loss: 1.6610, test_f1: 0.5373
 epoch: 52, train_loss: 0.5145, test_loss: 1.4218, test_f1: 0.5550
 epoch: 53, train_loss: 0.4706, test_loss: 1.5248, test_f1: 0.5592
 epoch: 54, train_loss: 0.4518, test_loss: 1.6647, test_f1: 0.5506
 epoch: 55, train_loss: 0.4506, test_loss: 1.5305, test_f1: 0.5797
 epoch: 56, train_loss: 0.4315, test_loss: 1.5314, test_f1: 0.5775
 epoch: 57, train_loss: 0.4333, test_loss: 1.6093, test_f1: 0.5878
 epoch: 58, train_loss: 0.4185, test_loss: 1.7668, test_f1: 0.5605
 epoch: 59, train_loss: 0.4192, test_loss: 1.8807, test_f1: 0.5410
 epoch: 60, train_loss: 0.3878, test_loss: 1.8106, test_f1: 0.5645
 epoch: 61, train_loss: 0.3903, test_loss: 1.8331, test_f1: 0.5537
 epoch: 62, train_loss: 0.3682, test_loss: 1.7159, test_f1: 0.5856
 epoch: 63, train_loss: 0.3936, test_loss: 1.7152, test_f1: 0.5909
 epoch: 64, train_loss: 0.3970, test_loss: 1.7209, test_f1: 0.5825
 epoch: 65, train_loss: 0.3899, test_loss: 1.6588, test_f1: 0.5812
 epoch: 66, train_loss: 0.3922, test_loss: 1.6708, test_f1: 0.5683
 epoch: 67, train_loss: 0.3881, test_loss: 1.7150, test_f1: 0.5641
 epoch: 68, train_loss: 0.3903, test_loss: 1.7562, test_f1: 0.5825
 epoch: 69, train_loss: 0.3697, test_loss: 2.0467, test_f1: 0.5519
 epoch: 70, train_loss: 0.3738, test_loss: 2.3326, test_f1: 0.5219
 epoch: 71, train_loss: 0.3981, test_loss: 2.0643, test_f1: 0.5667
 epoch: 72, train_loss: 0.3643, test_loss: 1.8830, test_f1: 0.5684
 epoch: 73, train_loss: 0.3437, test_loss: 1.8091, test_f1: 0.5624
 epoch: 74, train_loss: 0.3405, test_loss: 1.7974, test_f1: 0.5482
 epoch: 75, train_loss: 0.3526, test_loss: 1.9103, test_f1: 0.5303
 epoch: 76, train_loss: 0.3657, test_loss: 1.9263, test_f1: 0.5587
 epoch: 77, train_loss: 0.3465, test_loss: 1.8939, test_f1: 0.5658
 epoch: 78, train_loss: 0.3472, test_loss: 1.9938, test_f1: 0.5607
 epoch: 79, train_loss: 0.3295, test_loss: 2.1987, test_f1: 0.5272
 epoch: 80, train_loss: 0.3258, test_loss: 2.0330, test_f1: 0.5369
 epoch: 81, train_loss: 0.3394, test_loss: 1.9084, test_f1: 0.5668
 epoch: 82, train_loss: 0.3625, test_loss: 1.9526, test_f1: 0.5761
 epoch: 83, train_loss: 0.3828, test_loss: 1.9623, test_f1: 0.5803
 epoch: 84, train_loss: 0.3760, test_loss: 2.1515, test_f1: 0.5854
 epoch: 85, train_loss: 0.3584, test_loss: 2.2454, test_f1: 0.5538
 epoch: 86, train_loss: 0.3395, test_loss: 2.2375, test_f1: 0.5402
 epoch: 87, train_loss: 0.3231, test_loss: 2.1806, test_f1: 0.5474
 epoch: 88, train_loss: 0.2933, test_loss: 2.2330, test_f1: 0.5366
 epoch: 89, train_loss: 0.2798, test_loss: 2.0284, test_f1: 0.5731
 epoch: 90, train_loss: 0.2912, test_loss: 2.0960, test_f1: 0.5750
 epoch: 91, train_loss: 0.3077, test_loss: 2.3409, test_f1: 0.5426
 epoch: 92, train_loss: 0.3066, test_loss: 2.3905, test_f1: 0.5574
 epoch: 93, train_loss: 0.3156, test_loss: 2.0767, test_f1: 0.5526
 epoch: 94, train_loss: 0.2944, test_loss: 2.2103, test_f1: 0.5392
 epoch: 95, train_loss: 0.2959, test_loss: 2.3544, test_f1: 0.5219
 epoch: 96, train_loss: 0.2882, test_loss: 2.3892, test_f1: 0.5164
 epoch: 97, train_loss: 0.3109, test_loss: 2.3104, test_f1: 0.5751
 epoch: 98, train_loss: 0.2832, test_loss: 2.1515, test_f1: 0.5680
 epoch: 99, train_loss: 0.2900, test_loss: 2.0501, test_f1: 0.5666
##################ITERATION #5 ****************************************
 epoch: 0, train_loss: 1.2644, test_loss: 1.3510, test_f1: 0.1365
 epoch: 1, train_loss: 1.1131, test_loss: 1.3249, test_f1: 0.2056
 epoch: 2, train_loss: 1.0566, test_loss: 1.3215, test_f1: 0.2034
 epoch: 3, train_loss: 1.0232, test_loss: 1.2725, test_f1: 0.3699
 epoch: 4, train_loss: 0.9802, test_loss: 1.1860, test_f1: 0.4920
 epoch: 5, train_loss: 0.9644, test_loss: 1.2401, test_f1: 0.3546
 epoch: 6, train_loss: 0.9308, test_loss: 1.2351, test_f1: 0.4600
 epoch: 7, train_loss: 0.8907, test_loss: 1.1518, test_f1: 0.4753
 epoch: 8, train_loss: 0.8723, test_loss: 1.1528, test_f1: 0.5080
 epoch: 9, train_loss: 0.8503, test_loss: 1.1703, test_f1: 0.5417
 epoch: 10, train_loss: 0.7934, test_loss: 1.2277, test_f1: 0.5453
 epoch: 11, train_loss: 0.8341, test_loss: 1.3580, test_f1: 0.4835
 epoch: 12, train_loss: 0.8468, test_loss: 1.3737, test_f1: 0.4929
 epoch: 13, train_loss: 0.8637, test_loss: 1.3148, test_f1: 0.4894
 epoch: 14, train_loss: 0.8563, test_loss: 1.2565, test_f1: 0.5645
 epoch: 15, train_loss: 0.8194, test_loss: 1.2526, test_f1: 0.5513
 epoch: 16, train_loss: 0.8113, test_loss: 1.2050, test_f1: 0.4759
 epoch: 17, train_loss: 0.8024, test_loss: 1.2947, test_f1: 0.5697
 epoch: 18, train_loss: 0.7785, test_loss: 1.3041, test_f1: 0.5578
 epoch: 19, train_loss: 0.7504, test_loss: 1.5336, test_f1: 0.5399
 epoch: 20, train_loss: 0.7300, test_loss: 1.8501, test_f1: 0.5550
 epoch: 21, train_loss: 0.6969, test_loss: 1.5930, test_f1: 0.5260
 epoch: 22, train_loss: 0.6758, test_loss: 1.5763, test_f1: 0.6177
 epoch: 23, train_loss: 0.6882, test_loss: 1.5319, test_f1: 0.5673
 epoch: 24, train_loss: 0.6764, test_loss: 1.5324, test_f1: 0.5441
 epoch: 25, train_loss: 0.6793, test_loss: 1.5639, test_f1: 0.5840
 epoch: 26, train_loss: 0.6868, test_loss: 2.0046, test_f1: 0.5686
 epoch: 27, train_loss: 0.6667, test_loss: 2.3966, test_f1: 0.5288
 epoch: 28, train_loss: 0.6427, test_loss: 1.9988, test_f1: 0.5416
 epoch: 29, train_loss: 0.6253, test_loss: 1.6211, test_f1: 0.5710
 epoch: 30, train_loss: 0.6637, test_loss: 1.8253, test_f1: 0.4941
 epoch: 31, train_loss: 0.6676, test_loss: 1.8288, test_f1: 0.5234
 epoch: 32, train_loss: 0.6719, test_loss: 1.6101, test_f1: 0.4765
 epoch: 33, train_loss: 0.6771, test_loss: 1.5637, test_f1: 0.5096
 epoch: 34, train_loss: 0.6727, test_loss: 1.7808, test_f1: 0.5215
 epoch: 35, train_loss: 0.6717, test_loss: 1.6064, test_f1: 0.5067
 epoch: 36, train_loss: 0.6907, test_loss: 1.4719, test_f1: 0.5530
 epoch: 37, train_loss: 0.6749, test_loss: 1.3597, test_f1: 0.5426
 epoch: 38, train_loss: 0.6498, test_loss: 1.4349, test_f1: 0.5495
 epoch: 39, train_loss: 0.6172, test_loss: 1.6047, test_f1: 0.5451
 epoch: 40, train_loss: 0.6374, test_loss: 1.5966, test_f1: 0.5543
 epoch: 41, train_loss: 0.6366, test_loss: 1.6645, test_f1: 0.5233
 epoch: 42, train_loss: 0.6115, test_loss: 1.3631, test_f1: 0.5901
 epoch: 43, train_loss: 0.6022, test_loss: 1.6651, test_f1: 0.5607
 epoch: 44, train_loss: 0.5833, test_loss: 1.9688, test_f1: 0.5601
 epoch: 45, train_loss: 0.5741, test_loss: 2.3301, test_f1: 0.5260
 epoch: 46, train_loss: 0.5902, test_loss: 2.3032, test_f1: 0.5120
 epoch: 47, train_loss: 0.5653, test_loss: 2.7434, test_f1: 0.4902
 epoch: 48, train_loss: 0.5536, test_loss: 1.9665, test_f1: 0.5306
 epoch: 49, train_loss: 0.5434, test_loss: 2.3178, test_f1: 0.5338
 epoch: 50, train_loss: 0.5306, test_loss: 2.2156, test_f1: 0.5292
 epoch: 51, train_loss: 0.4975, test_loss: 2.1813, test_f1: 0.5405
 epoch: 52, train_loss: 0.4957, test_loss: 1.9871, test_f1: 0.5526
 epoch: 53, train_loss: 0.4859, test_loss: 1.9628, test_f1: 0.5449
 epoch: 54, train_loss: 0.4664, test_loss: 2.1106, test_f1: 0.5480
 epoch: 55, train_loss: 0.4648, test_loss: 2.0002, test_f1: 0.5515
 epoch: 56, train_loss: 0.4600, test_loss: 2.0272, test_f1: 0.5716
 epoch: 57, train_loss: 0.4297, test_loss: 2.2317, test_f1: 0.5380
 epoch: 58, train_loss: 0.4536, test_loss: 1.9877, test_f1: 0.5292
 epoch: 59, train_loss: 0.4619, test_loss: 1.8359, test_f1: 0.5642
 epoch: 60, train_loss: 0.4566, test_loss: 1.8315, test_f1: 0.5817
 epoch: 61, train_loss: 0.4458, test_loss: 1.6689, test_f1: 0.5986
 epoch: 62, train_loss: 0.4432, test_loss: 1.7167, test_f1: 0.5714
 epoch: 63, train_loss: 0.4438, test_loss: 2.3489, test_f1: 0.5491
 epoch: 64, train_loss: 0.4621, test_loss: 3.2756, test_f1: 0.5368
 epoch: 65, train_loss: 0.4830, test_loss: 2.7832, test_f1: 0.5413
 epoch: 66, train_loss: 0.4711, test_loss: 2.5111, test_f1: 0.5967
 epoch: 67, train_loss: 0.4588, test_loss: 2.2025, test_f1: 0.6029
 epoch: 68, train_loss: 0.4625, test_loss: 2.3124, test_f1: 0.5765
 epoch: 69, train_loss: 0.4251, test_loss: 2.2419, test_f1: 0.5265
 epoch: 70, train_loss: 0.4229, test_loss: 2.0247, test_f1: 0.5599
 epoch: 71, train_loss: 0.4105, test_loss: 1.9165, test_f1: 0.6010
 epoch: 72, train_loss: 0.4138, test_loss: 1.9930, test_f1: 0.5726
 epoch: 73, train_loss: 0.4039, test_loss: 2.0935, test_f1: 0.5491
 epoch: 74, train_loss: 0.4037, test_loss: 2.1391, test_f1: 0.5535
 epoch: 75, train_loss: 0.4081, test_loss: 2.1831, test_f1: 0.5693
 epoch: 76, train_loss: 0.4128, test_loss: 2.0769, test_f1: 0.5884
 epoch: 77, train_loss: 0.4142, test_loss: 2.1620, test_f1: 0.6287
 epoch: 78, train_loss: 0.3985, test_loss: 2.6706, test_f1: 0.5856
 epoch: 79, train_loss: 0.3932, test_loss: 2.7358, test_f1: 0.5531
 epoch: 80, train_loss: 0.4013, test_loss: 2.6160, test_f1: 0.5518
 epoch: 81, train_loss: 0.3993, test_loss: 2.4143, test_f1: 0.5710
 epoch: 82, train_loss: 0.3633, test_loss: 1.9971, test_f1: 0.5579
 epoch: 83, train_loss: 0.3959, test_loss: 2.0323, test_f1: 0.5815
 epoch: 84, train_loss: 0.3976, test_loss: 1.9161, test_f1: 0.5857
 epoch: 85, train_loss: 0.3616, test_loss: 1.9597, test_f1: 0.5788
 epoch: 86, train_loss: 0.3512, test_loss: 2.1381, test_f1: 0.5595
 epoch: 87, train_loss: 0.3373, test_loss: 2.2866, test_f1: 0.5642
 epoch: 88, train_loss: 0.3460, test_loss: 2.0452, test_f1: 0.5674
 epoch: 89, train_loss: 0.3819, test_loss: 2.4105, test_f1: 0.5826
 epoch: 90, train_loss: 0.3678, test_loss: 2.5382, test_f1: 0.5395
 epoch: 91, train_loss: 0.3769, test_loss: 2.4133, test_f1: 0.5264
 epoch: 92, train_loss: 0.3856, test_loss: 2.3494, test_f1: 0.5583
 epoch: 93, train_loss: 0.3391, test_loss: 2.2368, test_f1: 0.5760
 epoch: 94, train_loss: 0.3238, test_loss: 2.4145, test_f1: 0.5922
 epoch: 95, train_loss: 0.3313, test_loss: 2.2563, test_f1: 0.5353
 epoch: 96, train_loss: 0.3450, test_loss: 2.1777, test_f1: 0.5348
 epoch: 97, train_loss: 0.3363, test_loss: 2.1211, test_f1: 0.5769
 epoch: 98, train_loss: 0.3245, test_loss: 1.9774, test_f1: 0.5963
 epoch: 99, train_loss: 0.3119, test_loss: 2.3382, test_f1: 0.5628
##################ITERATION #6 ****************************************
 epoch: 0, train_loss: 1.2541, test_loss: 1.3771, test_f1: 0.2110
 epoch: 1, train_loss: 1.1329, test_loss: 1.3014, test_f1: 0.1474
 epoch: 2, train_loss: 1.0727, test_loss: 1.2821, test_f1: 0.2801
 epoch: 3, train_loss: 1.0303, test_loss: 1.2076, test_f1: 0.3801
 epoch: 4, train_loss: 0.9788, test_loss: 1.2451, test_f1: 0.4086
 epoch: 5, train_loss: 0.9630, test_loss: 1.2408, test_f1: 0.3519
 epoch: 6, train_loss: 0.9150, test_loss: 1.1753, test_f1: 0.5018
 epoch: 7, train_loss: 0.8874, test_loss: 1.1751, test_f1: 0.5599
 epoch: 8, train_loss: 0.8569, test_loss: 1.1750, test_f1: 0.5159
 epoch: 9, train_loss: 0.8666, test_loss: 1.2840, test_f1: 0.5769
 epoch: 10, train_loss: 0.8230, test_loss: 1.2398, test_f1: 0.5373
 epoch: 11, train_loss: 0.8216, test_loss: 1.2563, test_f1: 0.5087
 epoch: 12, train_loss: 0.7960, test_loss: 1.2218, test_f1: 0.5569
 epoch: 13, train_loss: 0.7673, test_loss: 1.2188, test_f1: 0.5354
 epoch: 14, train_loss: 0.7623, test_loss: 1.2560, test_f1: 0.5532
 epoch: 15, train_loss: 0.7602, test_loss: 1.2559, test_f1: 0.5071
 epoch: 16, train_loss: 0.7411, test_loss: 1.1726, test_f1: 0.5435
 epoch: 17, train_loss: 0.7504, test_loss: 1.2077, test_f1: 0.5366
 epoch: 18, train_loss: 0.7208, test_loss: 1.3306, test_f1: 0.5156
 epoch: 19, train_loss: 0.6819, test_loss: 1.2911, test_f1: 0.5764
 epoch: 20, train_loss: 0.6585, test_loss: 1.2956, test_f1: 0.5564
 epoch: 21, train_loss: 0.6657, test_loss: 1.3118, test_f1: 0.5820
 epoch: 22, train_loss: 0.6808, test_loss: 1.5184, test_f1: 0.4844
 epoch: 23, train_loss: 0.6406, test_loss: 1.3497, test_f1: 0.4836
 epoch: 24, train_loss: 0.6512, test_loss: 1.2540, test_f1: 0.5893
 epoch: 25, train_loss: 0.6158, test_loss: 1.4772, test_f1: 0.5464
 epoch: 26, train_loss: 0.6518, test_loss: 1.7802, test_f1: 0.4739
 epoch: 27, train_loss: 0.6826, test_loss: 1.5438, test_f1: 0.5067
 epoch: 28, train_loss: 0.6591, test_loss: 1.3331, test_f1: 0.5647
 epoch: 29, train_loss: 0.6399, test_loss: 1.7290, test_f1: 0.5145
 epoch: 30, train_loss: 0.6512, test_loss: 1.4967, test_f1: 0.5613
 epoch: 31, train_loss: 0.6192, test_loss: 1.6341, test_f1: 0.5522
 epoch: 32, train_loss: 0.5986, test_loss: 1.5410, test_f1: 0.5665
 epoch: 33, train_loss: 0.5817, test_loss: 1.6566, test_f1: 0.5274
 epoch: 34, train_loss: 0.5835, test_loss: 1.4393, test_f1: 0.5890
 epoch: 35, train_loss: 0.5641, test_loss: 1.5376, test_f1: 0.5712
 epoch: 36, train_loss: 0.5444, test_loss: 1.5272, test_f1: 0.4891
 epoch: 37, train_loss: 0.6059, test_loss: 1.3188, test_f1: 0.5522
 epoch: 38, train_loss: 0.5937, test_loss: 1.3396, test_f1: 0.5496
 epoch: 39, train_loss: 0.5557, test_loss: 1.3433, test_f1: 0.5681
 epoch: 40, train_loss: 0.5476, test_loss: 1.6160, test_f1: 0.5273
 epoch: 41, train_loss: 0.5445, test_loss: 1.4812, test_f1: 0.5685
 epoch: 42, train_loss: 0.5420, test_loss: 1.5253, test_f1: 0.5519
 epoch: 43, train_loss: 0.5293, test_loss: 1.5998, test_f1: 0.5510
 epoch: 44, train_loss: 0.5163, test_loss: 1.4157, test_f1: 0.5819
 epoch: 45, train_loss: 0.5117, test_loss: 1.5900, test_f1: 0.5347
 epoch: 46, train_loss: 0.5413, test_loss: 1.6301, test_f1: 0.5111
 epoch: 47, train_loss: 0.5082, test_loss: 1.6000, test_f1: 0.5291
 epoch: 48, train_loss: 0.5264, test_loss: 2.0676, test_f1: 0.4725
 epoch: 49, train_loss: 0.5543, test_loss: 1.8094, test_f1: 0.5007
 epoch: 50, train_loss: 0.5450, test_loss: 1.9083, test_f1: 0.5018
 epoch: 51, train_loss: 0.5165, test_loss: 1.8069, test_f1: 0.5297
 epoch: 52, train_loss: 0.4888, test_loss: 1.6033, test_f1: 0.5592
 epoch: 53, train_loss: 0.4571, test_loss: 1.5156, test_f1: 0.5811
 epoch: 54, train_loss: 0.4073, test_loss: 1.8963, test_f1: 0.5669
 epoch: 55, train_loss: 0.4083, test_loss: 1.6275, test_f1: 0.5534
 epoch: 56, train_loss: 0.4190, test_loss: 1.7271, test_f1: 0.5642
 epoch: 57, train_loss: 0.4075, test_loss: 1.7132, test_f1: 0.5764
 epoch: 58, train_loss: 0.3943, test_loss: 1.9853, test_f1: 0.5375
 epoch: 59, train_loss: 0.4093, test_loss: 1.9386, test_f1: 0.5174
 epoch: 60, train_loss: 0.3822, test_loss: 1.8554, test_f1: 0.5484
 epoch: 61, train_loss: 0.4028, test_loss: 1.8496, test_f1: 0.5591
 epoch: 62, train_loss: 0.3877, test_loss: 1.9098, test_f1: 0.5374
 epoch: 63, train_loss: 0.3672, test_loss: 1.8641, test_f1: 0.5520
 epoch: 64, train_loss: 0.3605, test_loss: 1.7293, test_f1: 0.5934
 epoch: 65, train_loss: 0.3557, test_loss: 1.9557, test_f1: 0.5736
 epoch: 66, train_loss: 0.3745, test_loss: 2.0137, test_f1: 0.5445
 epoch: 67, train_loss: 0.4231, test_loss: 2.1372, test_f1: 0.5370
 epoch: 68, train_loss: 0.3820, test_loss: 1.9874, test_f1: 0.5438
 epoch: 69, train_loss: 0.3805, test_loss: 1.8883, test_f1: 0.5256
 epoch: 70, train_loss: 0.3979, test_loss: 1.8780, test_f1: 0.5324
 epoch: 71, train_loss: 0.3366, test_loss: 1.9238, test_f1: 0.5293
 epoch: 72, train_loss: 0.3438, test_loss: 1.7618, test_f1: 0.5834
 epoch: 73, train_loss: 0.3418, test_loss: 1.7973, test_f1: 0.5809
 epoch: 74, train_loss: 0.3411, test_loss: 1.8952, test_f1: 0.5906
 epoch: 75, train_loss: 0.3319, test_loss: 1.8405, test_f1: 0.5782
 epoch: 76, train_loss: 0.3561, test_loss: 1.8258, test_f1: 0.5884
 epoch: 77, train_loss: 0.3176, test_loss: 2.0602, test_f1: 0.5286
 epoch: 78, train_loss: 0.3033, test_loss: 1.9884, test_f1: 0.5793
 epoch: 79, train_loss: 0.3063, test_loss: 1.9097, test_f1: 0.5830
 epoch: 80, train_loss: 0.3182, test_loss: 1.8098, test_f1: 0.5709
 epoch: 81, train_loss: 0.3218, test_loss: 2.0961, test_f1: 0.5346
 epoch: 82, train_loss: 0.3197, test_loss: 1.9613, test_f1: 0.5491
 epoch: 83, train_loss: 0.3410, test_loss: 1.9390, test_f1: 0.5435
 epoch: 84, train_loss: 0.3136, test_loss: 1.8698, test_f1: 0.5656
 epoch: 85, train_loss: 0.3039, test_loss: 1.9867, test_f1: 0.5457
 epoch: 86, train_loss: 0.3343, test_loss: 2.0270, test_f1: 0.5513
 epoch: 87, train_loss: 0.3131, test_loss: 1.7738, test_f1: 0.5853
 epoch: 88, train_loss: 0.3340, test_loss: 1.7732, test_f1: 0.5699
 epoch: 89, train_loss: 0.3691, test_loss: 2.2085, test_f1: 0.5164
 epoch: 90, train_loss: 0.3554, test_loss: 2.0593, test_f1: 0.5222
 epoch: 91, train_loss: 0.3285, test_loss: 2.1736, test_f1: 0.5335
 epoch: 92, train_loss: 0.3272, test_loss: 2.1277, test_f1: 0.5425
 epoch: 93, train_loss: 0.3249, test_loss: 2.1504, test_f1: 0.5606
 epoch: 94, train_loss: 0.3314, test_loss: 2.2477, test_f1: 0.5610
 epoch: 95, train_loss: 0.3036, test_loss: 2.2459, test_f1: 0.5425
 epoch: 96, train_loss: 0.3241, test_loss: 2.2391, test_f1: 0.5197
 epoch: 97, train_loss: 0.2954, test_loss: 2.1118, test_f1: 0.5585
 epoch: 98, train_loss: 0.3062, test_loss: 1.9935, test_f1: 0.5588
 epoch: 99, train_loss: 0.3071, test_loss: 2.0370, test_f1: 0.5691
##################ITERATION #7 ****************************************
 epoch: 0, train_loss: 1.2630, test_loss: 1.3564, test_f1: 0.1365
 epoch: 1, train_loss: 1.1378, test_loss: 1.2924, test_f1: 0.2227
 epoch: 2, train_loss: 1.0720, test_loss: 1.2814, test_f1: 0.3285
 epoch: 3, train_loss: 1.0312, test_loss: 1.2344, test_f1: 0.3104
 epoch: 4, train_loss: 0.9806, test_loss: 1.1990, test_f1: 0.4573
 epoch: 5, train_loss: 0.9454, test_loss: 1.2380, test_f1: 0.3388
 epoch: 6, train_loss: 0.9103, test_loss: 1.1562, test_f1: 0.4208
 epoch: 7, train_loss: 0.8840, test_loss: 1.1213, test_f1: 0.5548
 epoch: 8, train_loss: 0.8517, test_loss: 1.1340, test_f1: 0.5222
 epoch: 9, train_loss: 0.8276, test_loss: 1.1486, test_f1: 0.5380
 epoch: 10, train_loss: 0.7990, test_loss: 1.2182, test_f1: 0.5524
 epoch: 11, train_loss: 0.8098, test_loss: 1.2114, test_f1: 0.5569
 epoch: 12, train_loss: 0.7794, test_loss: 1.3844, test_f1: 0.5501
 epoch: 13, train_loss: 0.7867, test_loss: 1.0715, test_f1: 0.5720
 epoch: 14, train_loss: 0.7293, test_loss: 1.0602, test_f1: 0.5545
 epoch: 15, train_loss: 0.7234, test_loss: 1.0928, test_f1: 0.5837
 epoch: 16, train_loss: 0.7143, test_loss: 1.1977, test_f1: 0.5544
 epoch: 17, train_loss: 0.7054, test_loss: 1.2607, test_f1: 0.5321
 epoch: 18, train_loss: 0.6708, test_loss: 1.2727, test_f1: 0.5843
 epoch: 19, train_loss: 0.6895, test_loss: 1.1856, test_f1: 0.5782
 epoch: 20, train_loss: 0.6862, test_loss: 1.2551, test_f1: 0.5566
 epoch: 21, train_loss: 0.6670, test_loss: 1.2828, test_f1: 0.5702
 epoch: 22, train_loss: 0.6321, test_loss: 1.2776, test_f1: 0.5837
 epoch: 23, train_loss: 0.6391, test_loss: 1.2464, test_f1: 0.5410
 epoch: 24, train_loss: 0.6114, test_loss: 1.4067, test_f1: 0.5577
 epoch: 25, train_loss: 0.6294, test_loss: 1.5062, test_f1: 0.5265
 epoch: 26, train_loss: 0.6042, test_loss: 1.3826, test_f1: 0.5440
 epoch: 27, train_loss: 0.6006, test_loss: 1.3886, test_f1: 0.5573
 epoch: 28, train_loss: 0.5835, test_loss: 1.5452, test_f1: 0.5236
 epoch: 29, train_loss: 0.5855, test_loss: 1.5365, test_f1: 0.5484
 epoch: 30, train_loss: 0.5677, test_loss: 1.6562, test_f1: 0.5125
 epoch: 31, train_loss: 0.5854, test_loss: 1.4615, test_f1: 0.5824
 epoch: 32, train_loss: 0.6150, test_loss: 1.4497, test_f1: 0.5435
 epoch: 33, train_loss: 0.5856, test_loss: 1.2482, test_f1: 0.5891
 epoch: 34, train_loss: 0.5487, test_loss: 1.6671, test_f1: 0.5184
 epoch: 35, train_loss: 0.5724, test_loss: 1.7773, test_f1: 0.4967
 epoch: 36, train_loss: 0.5311, test_loss: 1.8580, test_f1: 0.5227
 epoch: 37, train_loss: 0.5550, test_loss: 1.5051, test_f1: 0.5480
 epoch: 38, train_loss: 0.5237, test_loss: 1.5863, test_f1: 0.5380
 epoch: 39, train_loss: 0.5068, test_loss: 1.5498, test_f1: 0.5612
 epoch: 40, train_loss: 0.5615, test_loss: 1.7206, test_f1: 0.5424
 epoch: 41, train_loss: 0.5489, test_loss: 1.5198, test_f1: 0.5899
 epoch: 42, train_loss: 0.5624, test_loss: 1.6118, test_f1: 0.5876
 epoch: 43, train_loss: 0.5049, test_loss: 1.6347, test_f1: 0.5602
 epoch: 44, train_loss: 0.5025, test_loss: 1.5272, test_f1: 0.5908
 epoch: 45, train_loss: 0.4973, test_loss: 1.6323, test_f1: 0.5625
 epoch: 46, train_loss: 0.4928, test_loss: 1.6327, test_f1: 0.5438
 epoch: 47, train_loss: 0.5039, test_loss: 1.5733, test_f1: 0.5961
 epoch: 48, train_loss: 0.5575, test_loss: 2.1320, test_f1: 0.4764
 epoch: 49, train_loss: 0.5257, test_loss: 1.9442, test_f1: 0.5460
 epoch: 50, train_loss: 0.5129, test_loss: 1.7171, test_f1: 0.5508
 epoch: 51, train_loss: 0.4688, test_loss: 1.6943, test_f1: 0.5246
 epoch: 52, train_loss: 0.4546, test_loss: 1.7496, test_f1: 0.5080
 epoch: 53, train_loss: 0.4368, test_loss: 1.6327, test_f1: 0.5732
 epoch: 54, train_loss: 0.4200, test_loss: 1.6952, test_f1: 0.5709
 epoch: 55, train_loss: 0.4092, test_loss: 1.7122, test_f1: 0.5643
 epoch: 56, train_loss: 0.4093, test_loss: 1.6667, test_f1: 0.5828
 epoch: 57, train_loss: 0.4026, test_loss: 1.7682, test_f1: 0.5839
 epoch: 58, train_loss: 0.4008, test_loss: 1.8138, test_f1: 0.6033
 epoch: 59, train_loss: 0.3981, test_loss: 1.7361, test_f1: 0.6189
 epoch: 60, train_loss: 0.3738, test_loss: 1.7666, test_f1: 0.5968
 epoch: 61, train_loss: 0.3741, test_loss: 1.8373, test_f1: 0.5770
 epoch: 62, train_loss: 0.3473, test_loss: 1.9217, test_f1: 0.5604
 epoch: 63, train_loss: 0.3946, test_loss: 2.0910, test_f1: 0.5599
 epoch: 64, train_loss: 0.3753, test_loss: 1.9433, test_f1: 0.5769
 epoch: 65, train_loss: 0.3786, test_loss: 2.0896, test_f1: 0.5502
 epoch: 66, train_loss: 0.4064, test_loss: 2.0261, test_f1: 0.5539
 epoch: 67, train_loss: 0.3625, test_loss: 2.0523, test_f1: 0.5535
 epoch: 68, train_loss: 0.3638, test_loss: 2.1270, test_f1: 0.5548
 epoch: 69, train_loss: 0.3270, test_loss: 2.1537, test_f1: 0.5608
 epoch: 70, train_loss: 0.3130, test_loss: 2.2699, test_f1: 0.5551
 epoch: 71, train_loss: 0.3019, test_loss: 2.2755, test_f1: 0.5431
 epoch: 72, train_loss: 0.2918, test_loss: 2.2152, test_f1: 0.5663
 epoch: 73, train_loss: 0.3214, test_loss: 2.2394, test_f1: 0.5925
 epoch: 74, train_loss: 0.3282, test_loss: 2.3937, test_f1: 0.5581
 epoch: 75, train_loss: 0.3431, test_loss: 2.4981, test_f1: 0.5384
 epoch: 76, train_loss: 0.3487, test_loss: 2.3702, test_f1: 0.5631
 epoch: 77, train_loss: 0.3502, test_loss: 2.1954, test_f1: 0.5855
 epoch: 78, train_loss: 0.3173, test_loss: 2.1634, test_f1: 0.5735
 epoch: 79, train_loss: 0.3201, test_loss: 2.2752, test_f1: 0.5782
 epoch: 80, train_loss: 0.2928, test_loss: 2.1304, test_f1: 0.5868
 epoch: 81, train_loss: 0.2987, test_loss: 2.2874, test_f1: 0.5405
 epoch: 82, train_loss: 0.2722, test_loss: 2.4233, test_f1: 0.5788
 epoch: 83, train_loss: 0.3210, test_loss: 2.5045, test_f1: 0.5906
 epoch: 84, train_loss: 0.3696, test_loss: 2.2541, test_f1: 0.5954
 epoch: 85, train_loss: 0.3358, test_loss: 2.3595, test_f1: 0.6071
 epoch: 86, train_loss: 0.3252, test_loss: 2.5442, test_f1: 0.5713
 epoch: 87, train_loss: 0.3555, test_loss: 2.4244, test_f1: 0.5756
 epoch: 88, train_loss: 0.3936, test_loss: 2.2952, test_f1: 0.5312
 epoch: 89, train_loss: 0.3646, test_loss: 2.2766, test_f1: 0.5791
 epoch: 90, train_loss: 0.3716, test_loss: 2.0947, test_f1: 0.6074
 epoch: 91, train_loss: 0.3249, test_loss: 2.0629, test_f1: 0.5662
 epoch: 92, train_loss: 0.3431, test_loss: 1.9922, test_f1: 0.5772
 epoch: 93, train_loss: 0.3372, test_loss: 2.0050, test_f1: 0.5880
 epoch: 94, train_loss: 0.3526, test_loss: 2.1851, test_f1: 0.5536
 epoch: 95, train_loss: 0.3413, test_loss: 2.2300, test_f1: 0.5335
 epoch: 96, train_loss: 0.3373, test_loss: 2.0739, test_f1: 0.5489
 epoch: 97, train_loss: 0.3055, test_loss: 1.9916, test_f1: 0.5847
 epoch: 98, train_loss: 0.3316, test_loss: 2.0577, test_f1: 0.5798
 epoch: 99, train_loss: 0.3146, test_loss: 2.1184, test_f1: 0.5789
##################ITERATION #8 ****************************************
 epoch: 0, train_loss: 1.2329, test_loss: 1.3879, test_f1: 0.1970
 epoch: 1, train_loss: 1.1065, test_loss: 1.3427, test_f1: 0.1926
 epoch: 2, train_loss: 1.0567, test_loss: 1.3152, test_f1: 0.2879
 epoch: 3, train_loss: 1.0260, test_loss: 1.2428, test_f1: 0.3880
 epoch: 4, train_loss: 0.9833, test_loss: 1.1913, test_f1: 0.4490
 epoch: 5, train_loss: 0.9648, test_loss: 1.2175, test_f1: 0.4288
 epoch: 6, train_loss: 0.9305, test_loss: 1.2628, test_f1: 0.4310
 epoch: 7, train_loss: 0.8746, test_loss: 1.2101, test_f1: 0.5143
 epoch: 8, train_loss: 0.8443, test_loss: 1.2578, test_f1: 0.5286
 epoch: 9, train_loss: 0.8407, test_loss: 1.2041, test_f1: 0.5155
 epoch: 10, train_loss: 0.8208, test_loss: 1.2526, test_f1: 0.5372
 epoch: 11, train_loss: 0.8377, test_loss: 1.4455, test_f1: 0.4704
 epoch: 12, train_loss: 0.8240, test_loss: 1.3974, test_f1: 0.4824
 epoch: 13, train_loss: 0.8062, test_loss: 1.3184, test_f1: 0.5164
 epoch: 14, train_loss: 0.7837, test_loss: 1.4875, test_f1: 0.4547
 epoch: 15, train_loss: 0.7517, test_loss: 1.5350, test_f1: 0.5100
 epoch: 16, train_loss: 0.7824, test_loss: 1.4861, test_f1: 0.5149
 epoch: 17, train_loss: 0.7688, test_loss: 1.4445, test_f1: 0.4794
 epoch: 18, train_loss: 0.7391, test_loss: 1.5078, test_f1: 0.4503
 epoch: 19, train_loss: 0.7262, test_loss: 1.4642, test_f1: 0.5345
 epoch: 20, train_loss: 0.7237, test_loss: 1.5916, test_f1: 0.5318
 epoch: 21, train_loss: 0.6768, test_loss: 1.4988, test_f1: 0.5427
 epoch: 22, train_loss: 0.6626, test_loss: 1.5845, test_f1: 0.5444
 epoch: 23, train_loss: 0.6389, test_loss: 1.5319, test_f1: 0.5644
 epoch: 24, train_loss: 0.6356, test_loss: 1.6471, test_f1: 0.5368
 epoch: 25, train_loss: 0.6250, test_loss: 1.5211, test_f1: 0.5630
 epoch: 26, train_loss: 0.6172, test_loss: 1.5691, test_f1: 0.5197
 epoch: 27, train_loss: 0.6206, test_loss: 1.9414, test_f1: 0.4815
 epoch: 28, train_loss: 0.6437, test_loss: 1.7452, test_f1: 0.4787
 epoch: 29, train_loss: 0.6172, test_loss: 1.4297, test_f1: 0.6000
 epoch: 30, train_loss: 0.6180, test_loss: 1.7623, test_f1: 0.4812
 epoch: 31, train_loss: 0.6114, test_loss: 1.7902, test_f1: 0.4967
 epoch: 32, train_loss: 0.5847, test_loss: 1.8302, test_f1: 0.4850
 epoch: 33, train_loss: 0.5928, test_loss: 1.6542, test_f1: 0.5281
 epoch: 34, train_loss: 0.5391, test_loss: 1.5114, test_f1: 0.5736
 epoch: 35, train_loss: 0.5568, test_loss: 1.4367, test_f1: 0.5923
 epoch: 36, train_loss: 0.5591, test_loss: 1.5839, test_f1: 0.5231
 epoch: 37, train_loss: 0.5668, test_loss: 1.7714, test_f1: 0.4938
 epoch: 38, train_loss: 0.5239, test_loss: 1.7136, test_f1: 0.5439
 epoch: 39, train_loss: 0.5162, test_loss: 1.8193, test_f1: 0.5009
 epoch: 40, train_loss: 0.5093, test_loss: 1.7052, test_f1: 0.5653
 epoch: 41, train_loss: 0.5186, test_loss: 2.1388, test_f1: 0.4612
 epoch: 42, train_loss: 0.5101, test_loss: 1.9276, test_f1: 0.5089
 epoch: 43, train_loss: 0.5283, test_loss: 1.7127, test_f1: 0.5446
 epoch: 44, train_loss: 0.4875, test_loss: 1.7231, test_f1: 0.5539
 epoch: 45, train_loss: 0.4575, test_loss: 1.7056, test_f1: 0.5615
 epoch: 46, train_loss: 0.4497, test_loss: 1.8677, test_f1: 0.5540
 epoch: 47, train_loss: 0.4825, test_loss: 1.7800, test_f1: 0.5692
 epoch: 48, train_loss: 0.5112, test_loss: 2.0554, test_f1: 0.5094
 epoch: 49, train_loss: 0.5392, test_loss: 2.1482, test_f1: 0.4943
 epoch: 50, train_loss: 0.5607, test_loss: 1.8700, test_f1: 0.5288
 epoch: 51, train_loss: 0.4996, test_loss: 1.6908, test_f1: 0.5690
 epoch: 52, train_loss: 0.4717, test_loss: 1.6058, test_f1: 0.5747
 epoch: 53, train_loss: 0.4509, test_loss: 1.6518, test_f1: 0.5498
 epoch: 54, train_loss: 0.4198, test_loss: 1.8460, test_f1: 0.5483
 epoch: 55, train_loss: 0.4195, test_loss: 1.8853, test_f1: 0.5809
 epoch: 56, train_loss: 0.4032, test_loss: 1.9743, test_f1: 0.5780
 epoch: 57, train_loss: 0.3800, test_loss: 2.1672, test_f1: 0.5591
 epoch: 58, train_loss: 0.3742, test_loss: 2.0733, test_f1: 0.5323
 epoch: 59, train_loss: 0.3706, test_loss: 1.9120, test_f1: 0.5635
 epoch: 60, train_loss: 0.3774, test_loss: 1.8500, test_f1: 0.5593
 epoch: 61, train_loss: 0.3426, test_loss: 1.9641, test_f1: 0.5761
 epoch: 62, train_loss: 0.3513, test_loss: 2.0901, test_f1: 0.5459
 epoch: 63, train_loss: 0.3670, test_loss: 2.1291, test_f1: 0.5359
 epoch: 64, train_loss: 0.3425, test_loss: 2.2297, test_f1: 0.5138
 epoch: 65, train_loss: 0.3317, test_loss: 2.0712, test_f1: 0.5474
 epoch: 66, train_loss: 0.3573, test_loss: 2.0453, test_f1: 0.5588
 epoch: 67, train_loss: 0.3826, test_loss: 2.0712, test_f1: 0.5484
 epoch: 68, train_loss: 0.3413, test_loss: 2.1542, test_f1: 0.5462
 epoch: 69, train_loss: 0.3643, test_loss: 1.9747, test_f1: 0.5605
 epoch: 70, train_loss: 0.3673, test_loss: 2.3509, test_f1: 0.5139
 epoch: 71, train_loss: 0.3476, test_loss: 2.5932, test_f1: 0.5035
 epoch: 72, train_loss: 0.3385, test_loss: 2.3379, test_f1: 0.5377
 epoch: 73, train_loss: 0.3267, test_loss: 2.2848, test_f1: 0.5672
 epoch: 74, train_loss: 0.3052, test_loss: 2.3323, test_f1: 0.5478
 epoch: 75, train_loss: 0.3114, test_loss: 2.3711, test_f1: 0.5795
 epoch: 76, train_loss: 0.3244, test_loss: 2.4117, test_f1: 0.5814
 epoch: 77, train_loss: 0.3109, test_loss: 2.9743, test_f1: 0.5057
 epoch: 78, train_loss: 0.3047, test_loss: 3.0046, test_f1: 0.5156
 epoch: 79, train_loss: 0.3014, test_loss: 2.6058, test_f1: 0.5499
 epoch: 80, train_loss: 0.3335, test_loss: 2.3539, test_f1: 0.5854
 epoch: 81, train_loss: 0.3041, test_loss: 2.4759, test_f1: 0.5463
 epoch: 82, train_loss: 0.3233, test_loss: 2.4847, test_f1: 0.5401
 epoch: 83, train_loss: 0.3206, test_loss: 2.2841, test_f1: 0.5598
 epoch: 84, train_loss: 0.3284, test_loss: 2.2250, test_f1: 0.5458
 epoch: 85, train_loss: 0.3020, test_loss: 2.5329, test_f1: 0.5466
 epoch: 86, train_loss: 0.2938, test_loss: 2.8803, test_f1: 0.4917
 epoch: 87, train_loss: 0.3382, test_loss: 7.8929, test_f1: 0.4085
 epoch: 88, train_loss: 0.3640, test_loss: 3.3055, test_f1: 0.4480
 epoch: 89, train_loss: 0.3351, test_loss: 2.3899, test_f1: 0.5539
 epoch: 90, train_loss: 0.3265, test_loss: 2.5209, test_f1: 0.5702
 epoch: 91, train_loss: 0.3314, test_loss: 2.5633, test_f1: 0.5496
 epoch: 92, train_loss: 0.3282, test_loss: 2.6299, test_f1: 0.5209
 epoch: 93, train_loss: 0.3445, test_loss: 2.7506, test_f1: 0.4907
 epoch: 94, train_loss: 0.3318, test_loss: 2.6069, test_f1: 0.5446
 epoch: 95, train_loss: 0.3146, test_loss: 2.3864, test_f1: 0.5387
 epoch: 96, train_loss: 0.3217, test_loss: 2.1247, test_f1: 0.5509
 epoch: 97, train_loss: 0.3100, test_loss: 2.0716, test_f1: 0.5485
 epoch: 98, train_loss: 0.3071, test_loss: 2.1288, test_f1: 0.5054
 epoch: 99, train_loss: 0.2805, test_loss: 2.2312, test_f1: 0.5388
##################ITERATION #9 ****************************************
 epoch: 0, train_loss: 1.2497, test_loss: 1.3355, test_f1: 0.1881
 epoch: 1, train_loss: 1.1091, test_loss: 1.3251, test_f1: 0.1420
 epoch: 2, train_loss: 1.0409, test_loss: 1.3013, test_f1: 0.2034
 epoch: 3, train_loss: 0.9923, test_loss: 1.2235, test_f1: 0.3497
 epoch: 4, train_loss: 0.9361, test_loss: 1.1617, test_f1: 0.3904
 epoch: 5, train_loss: 0.9006, test_loss: 1.1564, test_f1: 0.4846
 epoch: 6, train_loss: 0.8671, test_loss: 1.1592, test_f1: 0.4904
 epoch: 7, train_loss: 0.8556, test_loss: 1.1520, test_f1: 0.5587
 epoch: 8, train_loss: 0.8388, test_loss: 1.2000, test_f1: 0.5407
 epoch: 9, train_loss: 0.8024, test_loss: 1.4109, test_f1: 0.4447
 epoch: 10, train_loss: 0.8141, test_loss: 1.2090, test_f1: 0.5203
 epoch: 11, train_loss: 0.8199, test_loss: 1.1746, test_f1: 0.5100
 epoch: 12, train_loss: 0.7757, test_loss: 1.2262, test_f1: 0.5379
 epoch: 13, train_loss: 0.7577, test_loss: 1.2878, test_f1: 0.5603
 epoch: 14, train_loss: 0.7530, test_loss: 1.4102, test_f1: 0.5409
 epoch: 15, train_loss: 0.7248, test_loss: 1.4422, test_f1: 0.5480
 epoch: 16, train_loss: 0.7199, test_loss: 1.2618, test_f1: 0.5711
 epoch: 17, train_loss: 0.7278, test_loss: 1.4078, test_f1: 0.5448
 epoch: 18, train_loss: 0.7069, test_loss: 1.3784, test_f1: 0.5376
 epoch: 19, train_loss: 0.6915, test_loss: 1.3227, test_f1: 0.5666
 epoch: 20, train_loss: 0.6764, test_loss: 1.2681, test_f1: 0.5454
 epoch: 21, train_loss: 0.6782, test_loss: 1.3218, test_f1: 0.5319
 epoch: 22, train_loss: 0.6852, test_loss: 1.3110, test_f1: 0.5654
 epoch: 23, train_loss: 0.6682, test_loss: 1.3487, test_f1: 0.5668
 epoch: 24, train_loss: 0.6801, test_loss: 1.2007, test_f1: 0.5640
 epoch: 25, train_loss: 0.6556, test_loss: 1.3691, test_f1: 0.5431
 epoch: 26, train_loss: 0.6626, test_loss: 1.5174, test_f1: 0.5236
 epoch: 27, train_loss: 0.6684, test_loss: 1.6160, test_f1: 0.5709
 epoch: 28, train_loss: 0.6436, test_loss: 1.7453, test_f1: 0.5861
 epoch: 29, train_loss: 0.6442, test_loss: 1.7658, test_f1: 0.5498
 epoch: 30, train_loss: 0.6320, test_loss: 1.8153, test_f1: 0.5266
 epoch: 31, train_loss: 0.5931, test_loss: 1.4619, test_f1: 0.5638
 epoch: 32, train_loss: 0.6006, test_loss: 1.4397, test_f1: 0.5866
 epoch: 33, train_loss: 0.5481, test_loss: 1.6803, test_f1: 0.5750
 epoch: 34, train_loss: 0.5648, test_loss: 1.9716, test_f1: 0.4823
 epoch: 35, train_loss: 0.5875, test_loss: 2.0548, test_f1: 0.4950
 epoch: 36, train_loss: 0.5706, test_loss: 1.5337, test_f1: 0.5621
 epoch: 37, train_loss: 0.5292, test_loss: 1.5767, test_f1: 0.5435
 epoch: 38, train_loss: 0.5292, test_loss: 1.5870, test_f1: 0.5674
 epoch: 39, train_loss: 0.5510, test_loss: 1.7021, test_f1: 0.5163
 epoch: 40, train_loss: 0.5402, test_loss: 1.9257, test_f1: 0.4786
 epoch: 41, train_loss: 0.5615, test_loss: 1.7539, test_f1: 0.5433
 epoch: 42, train_loss: 0.5241, test_loss: 1.4301, test_f1: 0.6131
 epoch: 43, train_loss: 0.5133, test_loss: 1.4249, test_f1: 0.5919
 epoch: 44, train_loss: 0.4834, test_loss: 1.6122, test_f1: 0.5876
 epoch: 45, train_loss: 0.6235, test_loss: 2.6081, test_f1: 0.4437
 epoch: 46, train_loss: 0.7011, test_loss: 1.9364, test_f1: 0.4667
 epoch: 47, train_loss: 0.6566, test_loss: 1.7344, test_f1: 0.5177
 epoch: 48, train_loss: 0.6466, test_loss: 2.0449, test_f1: 0.5820
 epoch: 49, train_loss: 0.6050, test_loss: 1.9526, test_f1: 0.5888
 epoch: 50, train_loss: 0.5625, test_loss: 1.6741, test_f1: 0.5879
 epoch: 51, train_loss: 0.5537, test_loss: 1.6213, test_f1: 0.5819
 epoch: 52, train_loss: 0.5452, test_loss: 1.5141, test_f1: 0.6147
 epoch: 53, train_loss: 0.5373, test_loss: 1.4189, test_f1: 0.6424
 epoch: 54, train_loss: 0.5179, test_loss: 1.5345, test_f1: 0.6020
 epoch: 55, train_loss: 0.5066, test_loss: 1.4994, test_f1: 0.5871
 epoch: 56, train_loss: 0.4728, test_loss: 1.3933, test_f1: 0.5931
 epoch: 57, train_loss: 0.4659, test_loss: 1.4582, test_f1: 0.5949
 epoch: 58, train_loss: 0.4277, test_loss: 1.6141, test_f1: 0.5903
 epoch: 59, train_loss: 0.4541, test_loss: 1.7766, test_f1: 0.5966
 epoch: 60, train_loss: 0.4675, test_loss: 1.9927, test_f1: 0.5534
 epoch: 61, train_loss: 0.4428, test_loss: 1.9847, test_f1: 0.5699
 epoch: 62, train_loss: 0.4370, test_loss: 1.7614, test_f1: 0.5557
 epoch: 63, train_loss: 0.4367, test_loss: 1.5626, test_f1: 0.5553
 epoch: 64, train_loss: 0.4276, test_loss: 1.7037, test_f1: 0.5616
 epoch: 65, train_loss: 0.4195, test_loss: 2.4031, test_f1: 0.5077
 epoch: 66, train_loss: 0.4333, test_loss: 2.1991, test_f1: 0.5374
 epoch: 67, train_loss: 0.3880, test_loss: 2.1251, test_f1: 0.5797
 epoch: 68, train_loss: 0.3999, test_loss: 2.1077, test_f1: 0.5820
 epoch: 69, train_loss: 0.3700, test_loss: 1.8714, test_f1: 0.6141
 epoch: 70, train_loss: 0.3978, test_loss: 2.3346, test_f1: 0.5733
 epoch: 71, train_loss: 0.4207, test_loss: 2.3637, test_f1: 0.5172
 epoch: 72, train_loss: 0.4287, test_loss: 2.0689, test_f1: 0.5716
 epoch: 73, train_loss: 0.3969, test_loss: 2.2455, test_f1: 0.6089
 epoch: 74, train_loss: 0.3769, test_loss: 2.1529, test_f1: 0.5903
 epoch: 75, train_loss: 0.4191, test_loss: 2.1247, test_f1: 0.5436
 epoch: 76, train_loss: 0.4036, test_loss: 2.2453, test_f1: 0.6089
 epoch: 77, train_loss: 0.4075, test_loss: 2.3548, test_f1: 0.5933
 epoch: 78, train_loss: 0.3724, test_loss: 2.7669, test_f1: 0.5847
 epoch: 79, train_loss: 0.3714, test_loss: 2.8740, test_f1: 0.5868
 epoch: 80, train_loss: 0.3981, test_loss: 2.3824, test_f1: 0.5711
 epoch: 81, train_loss: 0.3902, test_loss: 2.2117, test_f1: 0.5402
 epoch: 82, train_loss: 0.3968, test_loss: 2.4943, test_f1: 0.5389
 epoch: 83, train_loss: 0.3923, test_loss: 2.1909, test_f1: 0.5798
 epoch: 84, train_loss: 0.3684, test_loss: 2.2722, test_f1: 0.5722
 epoch: 85, train_loss: 0.3598, test_loss: 2.9503, test_f1: 0.5934
 epoch: 86, train_loss: 0.3379, test_loss: 3.2450, test_f1: 0.6190
 epoch: 87, train_loss: 0.3791, test_loss: 3.4495, test_f1: 0.5851
 epoch: 88, train_loss: 0.3847, test_loss: 3.2146, test_f1: 0.5767
 epoch: 89, train_loss: 0.3474, test_loss: 2.4044, test_f1: 0.5675
 epoch: 90, train_loss: 0.3659, test_loss: 1.9479, test_f1: 0.5765
 epoch: 91, train_loss: 0.3355, test_loss: 1.8446, test_f1: 0.6110
 epoch: 92, train_loss: 0.3278, test_loss: 1.8154, test_f1: 0.6288
 epoch: 93, train_loss: 0.3337, test_loss: 1.8161, test_f1: 0.6013
 epoch: 94, train_loss: 0.3369, test_loss: 2.0824, test_f1: 0.6134
 epoch: 95, train_loss: 0.3343, test_loss: 2.3304, test_f1: 0.6109
 epoch: 96, train_loss: 0.3564, test_loss: 2.0136, test_f1: 0.5872
 epoch: 97, train_loss: 0.3432, test_loss: 2.0318, test_f1: 0.5536
 epoch: 98, train_loss: 0.3399, test_loss: 1.9823, test_f1: 0.5973
 epoch: 99, train_loss: 0.3560, test_loss: 1.9274, test_f1: 0.5923

Training completed in 370.85 seconds
Best F1: 0.6424 at epoch 53
Mean F1 across iterations: 0.6080  0.0184
========================FINAL RESULTS================================
FEGIN weighted F1: 0.6424  0.0184
python main.py --data ltspice_demos --representation component_component --model FEGIN --layers 5 --hiddens 128 --batch_size 256 --lr 0.001 --emb_size 250 --epochs 100 --save_appendix component_component_L5_H128_BS256_LR0.001_E250 --no_val
-----



STDERR:
  File "main.py", line 370, in <module>
    main()
  File "main.py", line 254, in main
    dataset = dataset_class(
  File "/home/philip/projects/ltspice_examples_code_repo/Circuit-Completion-Using-GNNs/component_classification_with_link_prediction_head/evaluation/FEGIN/kernel/circuit_datasets.py", line 15, in __init__
    self.data, self.slices = torch.load(self.processed_paths[0])
  File "/home/philip/.local/lib/python3.8/site-packages/torch/serialization.py", line 1040, in load
    warnings.warn(
  File "/usr/lib/python3.8/warnings.py", line 109, in _showwarnmsg
    sw(msg.message, msg.category, msg.filename, msg.lineno,
  File "main.py", line 47, in warn_with_traceback
    traceback.print_stack(file=log)
/home/philip/projects/ltspice_examples_code_repo/Circuit-Completion-Using-GNNs/component_classification_with_link_prediction_head/evaluation/FEGIN/kernel/circuit_datasets.py:15: FutureWarning: You are using `torch.load` with `weights_only=False` (the current default value), which uses the default pickle module implicitly. It is possible to construct malicious pickle data which will execute arbitrary code during unpickling (See https://github.com/pytorch/pytorch/blob/main/SECURITY.md#untrusted-models for more details). In a future release, the default value for `weights_only` will be flipped to `True`. This limits the functions that could be executed during unpickling. Arbitrary objects will no longer be allowed to be loaded via this mode unless they are explicitly allowlisted by the user via `torch.serialization.add_safe_globals`. We recommend you start setting `weights_only=True` for any use case where you don't have full control of the loaded file. Please open an issue on GitHub for any issues related to this experimental feature.
  self.data, self.slices = torch.load(self.processed_paths[0])
