STDOUT:
Results will be saved in /home/philip/projects/ltspice_examples_code_repo/Circuit-Completion-Using-GNNs/component_classification_with_link_prediction_head/evaluation/FEGIN/results/model_FEGIN_dataset_ltspice_examples
Command line input: python main.py --data ltspice_examples --representation component_pin --model FEGIN --layers 6 --hiddens 32 --batch_size 64 --lr 0.01 --emb_size 250 --epochs 100 --save_appendix component_pin_L6_H32_BS64_LR0.01_E250 --no_val
 is saved.
-----
ltspice_examples - FEGIN
Using 6 layers, 32 hidden units, h = 2
Loading component_pin representation dataset
ENTERED
Training FEGIN on component_pin representation
Train: 3560, Test: 848
##################ITERATION #0 ****************************************
 epoch: 0, train_loss: 1.1886, test_loss: 1.6380, test_f1: 0.3048
 epoch: 1, train_loss: 1.0505, test_loss: 1.0434, test_f1: 0.3804
 epoch: 2, train_loss: 1.0154, test_loss: 1.1480, test_f1: 0.4806
 epoch: 3, train_loss: 1.0014, test_loss: 1.0967, test_f1: 0.4078
 epoch: 4, train_loss: 0.9805, test_loss: 0.9789, test_f1: 0.5422
 epoch: 5, train_loss: 0.9287, test_loss: 1.0214, test_f1: 0.4326
 epoch: 6, train_loss: 0.9287, test_loss: 0.8461, test_f1: 0.5228
 epoch: 7, train_loss: 0.8886, test_loss: 0.9102, test_f1: 0.5112
 epoch: 8, train_loss: 0.8854, test_loss: 0.9020, test_f1: 0.5002
 epoch: 9, train_loss: 0.8772, test_loss: 0.8911, test_f1: 0.4972
 epoch: 10, train_loss: 0.8826, test_loss: 0.9089, test_f1: 0.5100
 epoch: 11, train_loss: 0.8659, test_loss: 0.9847, test_f1: 0.4799
 epoch: 12, train_loss: 0.8541, test_loss: 0.9444, test_f1: 0.5970
 epoch: 13, train_loss: 0.8309, test_loss: 0.8342, test_f1: 0.5531
 epoch: 14, train_loss: 0.8098, test_loss: 0.8623, test_f1: 0.5068
 epoch: 15, train_loss: 0.8040, test_loss: 0.8876, test_f1: 0.5185
 epoch: 16, train_loss: 0.8085, test_loss: 0.8826, test_f1: 0.5604
 epoch: 17, train_loss: 0.8071, test_loss: 0.8879, test_f1: 0.5162
 epoch: 18, train_loss: 0.8081, test_loss: 0.8566, test_f1: 0.5795
 epoch: 19, train_loss: 0.8000, test_loss: 0.7945, test_f1: 0.5609
 epoch: 20, train_loss: 0.7915, test_loss: 0.8403, test_f1: 0.5381
 epoch: 21, train_loss: 0.7764, test_loss: 0.8315, test_f1: 0.5572
 epoch: 22, train_loss: 0.7735, test_loss: 0.8940, test_f1: 0.5458
 epoch: 23, train_loss: 0.7595, test_loss: 0.8979, test_f1: 0.5235
 epoch: 24, train_loss: 0.7743, test_loss: 0.8421, test_f1: 0.5151
 epoch: 25, train_loss: 0.7712, test_loss: 0.8279, test_f1: 0.6272
 epoch: 26, train_loss: 0.7566, test_loss: 0.7976, test_f1: 0.5206
 epoch: 27, train_loss: 0.7519, test_loss: 0.9281, test_f1: 0.5689
 epoch: 28, train_loss: 0.7637, test_loss: 0.8190, test_f1: 0.5245
 epoch: 29, train_loss: 0.7428, test_loss: 0.8393, test_f1: 0.5554
 epoch: 30, train_loss: 0.7207, test_loss: 0.9472, test_f1: 0.5348
 epoch: 31, train_loss: 0.7284, test_loss: 0.8631, test_f1: 0.6173
 epoch: 32, train_loss: 0.7374, test_loss: 0.7659, test_f1: 0.5602
 epoch: 33, train_loss: 0.7224, test_loss: 0.7813, test_f1: 0.6150
 epoch: 34, train_loss: 0.7165, test_loss: 0.8435, test_f1: 0.5079
 epoch: 35, train_loss: 0.7375, test_loss: 0.7555, test_f1: 0.6059
 epoch: 36, train_loss: 0.7029, test_loss: 0.8601, test_f1: 0.5670
 epoch: 37, train_loss: 0.7233, test_loss: 0.8463, test_f1: 0.5794
 epoch: 38, train_loss: 0.7070, test_loss: 0.8237, test_f1: 0.5686
 epoch: 39, train_loss: 0.7112, test_loss: 0.7898, test_f1: 0.5545
 epoch: 40, train_loss: 0.7075, test_loss: 0.7467, test_f1: 0.5584
 epoch: 41, train_loss: 0.6918, test_loss: 0.7786, test_f1: 0.5735
 epoch: 42, train_loss: 0.6837, test_loss: 0.7658, test_f1: 0.6280
 epoch: 43, train_loss: 0.6961, test_loss: 0.7849, test_f1: 0.6328
 epoch: 44, train_loss: 0.6921, test_loss: 0.8098, test_f1: 0.6184
 epoch: 45, train_loss: 0.6791, test_loss: 0.8680, test_f1: 0.5692
 epoch: 46, train_loss: 0.6993, test_loss: 0.9118, test_f1: 0.6210
 epoch: 47, train_loss: 0.6755, test_loss: 1.0240, test_f1: 0.5682
 epoch: 48, train_loss: 0.6966, test_loss: 0.8487, test_f1: 0.6431
 epoch: 49, train_loss: 0.6996, test_loss: 0.8180, test_f1: 0.6143
 epoch: 50, train_loss: 0.6683, test_loss: 0.8737, test_f1: 0.6419
 epoch: 51, train_loss: 0.6591, test_loss: 0.8336, test_f1: 0.6371
 epoch: 52, train_loss: 0.6386, test_loss: 0.8235, test_f1: 0.6635
 epoch: 53, train_loss: 0.6266, test_loss: 0.8236, test_f1: 0.6453
 epoch: 54, train_loss: 0.6234, test_loss: 0.8494, test_f1: 0.6630
 epoch: 55, train_loss: 0.6159, test_loss: 0.9707, test_f1: 0.5880
 epoch: 56, train_loss: 0.6113, test_loss: 0.8601, test_f1: 0.6371
 epoch: 57, train_loss: 0.6025, test_loss: 0.9043, test_f1: 0.6341
 epoch: 58, train_loss: 0.6023, test_loss: 0.8182, test_f1: 0.6345
 epoch: 59, train_loss: 0.6045, test_loss: 0.8649, test_f1: 0.6592
 epoch: 60, train_loss: 0.6069, test_loss: 0.8536, test_f1: 0.6502
 epoch: 61, train_loss: 0.6089, test_loss: 0.8785, test_f1: 0.6307
 epoch: 62, train_loss: 0.5966, test_loss: 0.8774, test_f1: 0.6556
 epoch: 63, train_loss: 0.5963, test_loss: 0.8152, test_f1: 0.6603
 epoch: 64, train_loss: 0.5942, test_loss: 0.9030, test_f1: 0.6403
 epoch: 65, train_loss: 0.5968, test_loss: 0.8993, test_f1: 0.6478
 epoch: 66, train_loss: 0.5894, test_loss: 0.9062, test_f1: 0.6190
 epoch: 67, train_loss: 0.5862, test_loss: 0.9041, test_f1: 0.6302
 epoch: 68, train_loss: 0.5922, test_loss: 0.9191, test_f1: 0.6460
 epoch: 69, train_loss: 0.5731, test_loss: 0.9404, test_f1: 0.6418
 epoch: 70, train_loss: 0.5972, test_loss: 0.9145, test_f1: 0.6165
 epoch: 71, train_loss: 0.5916, test_loss: 0.9024, test_f1: 0.6144
 epoch: 72, train_loss: 0.5903, test_loss: 0.9460, test_f1: 0.6320
 epoch: 73, train_loss: 0.5789, test_loss: 0.9049, test_f1: 0.6530
 epoch: 74, train_loss: 0.5894, test_loss: 0.8537, test_f1: 0.6637
 epoch: 75, train_loss: 0.5784, test_loss: 0.8828, test_f1: 0.6400
 epoch: 76, train_loss: 0.5631, test_loss: 0.9092, test_f1: 0.6565
 epoch: 77, train_loss: 0.5635, test_loss: 0.8497, test_f1: 0.6512
 epoch: 78, train_loss: 0.5637, test_loss: 0.9267, test_f1: 0.6522
 epoch: 79, train_loss: 0.5622, test_loss: 0.9101, test_f1: 0.6428
 epoch: 80, train_loss: 0.5757, test_loss: 0.9244, test_f1: 0.6330
 epoch: 81, train_loss: 0.5755, test_loss: 0.8272, test_f1: 0.6821
 epoch: 82, train_loss: 0.5642, test_loss: 0.9418, test_f1: 0.6385
 epoch: 83, train_loss: 0.5710, test_loss: 0.8703, test_f1: 0.6599
 epoch: 84, train_loss: 0.5996, test_loss: 0.8990, test_f1: 0.5928
 epoch: 85, train_loss: 0.6095, test_loss: 0.8141, test_f1: 0.6482
 epoch: 86, train_loss: 0.5653, test_loss: 0.9058, test_f1: 0.6472
 epoch: 87, train_loss: 0.5651, test_loss: 0.9621, test_f1: 0.6316
 epoch: 88, train_loss: 0.5618, test_loss: 0.9424, test_f1: 0.6309
 epoch: 89, train_loss: 0.5498, test_loss: 0.9130, test_f1: 0.6429
 epoch: 90, train_loss: 0.5410, test_loss: 1.0165, test_f1: 0.6459
 epoch: 91, train_loss: 0.5526, test_loss: 0.9291, test_f1: 0.6177
 epoch: 92, train_loss: 0.5453, test_loss: 0.9028, test_f1: 0.6522
 epoch: 93, train_loss: 0.5552, test_loss: 0.8535, test_f1: 0.6494
 epoch: 94, train_loss: 0.5676, test_loss: 0.8747, test_f1: 0.6645
 epoch: 95, train_loss: 0.5291, test_loss: 0.8967, test_f1: 0.6566
 epoch: 96, train_loss: 0.5432, test_loss: 0.9410, test_f1: 0.6426
 epoch: 97, train_loss: 0.5343, test_loss: 0.8562, test_f1: 0.6532
 epoch: 98, train_loss: 0.5316, test_loss: 0.8524, test_f1: 0.6523
 epoch: 99, train_loss: 0.5588, test_loss: 0.9205, test_f1: 0.6197
##################ITERATION #1 ****************************************
 epoch: 0, train_loss: 1.1314, test_loss: 1.0984, test_f1: 0.4339
 epoch: 1, train_loss: 1.0146, test_loss: 0.9756, test_f1: 0.4326
 epoch: 2, train_loss: 0.9685, test_loss: 1.2041, test_f1: 0.4478
 epoch: 3, train_loss: 0.9704, test_loss: 0.9520, test_f1: 0.4720
 epoch: 4, train_loss: 0.9374, test_loss: 1.0114, test_f1: 0.4988
 epoch: 5, train_loss: 0.9282, test_loss: 0.9515, test_f1: 0.4843
 epoch: 6, train_loss: 0.9020, test_loss: 0.8597, test_f1: 0.4988
 epoch: 7, train_loss: 0.8956, test_loss: 0.9640, test_f1: 0.5332
 epoch: 8, train_loss: 0.8828, test_loss: 1.2332, test_f1: 0.4194
 epoch: 9, train_loss: 0.8700, test_loss: 0.9708, test_f1: 0.5515
 epoch: 10, train_loss: 0.8530, test_loss: 0.8846, test_f1: 0.5210
 epoch: 11, train_loss: 0.8750, test_loss: 0.9540, test_f1: 0.5024
 epoch: 12, train_loss: 0.8679, test_loss: 1.1647, test_f1: 0.3991
 epoch: 13, train_loss: 0.8760, test_loss: 0.8524, test_f1: 0.5394
 epoch: 14, train_loss: 0.8642, test_loss: 0.9236, test_f1: 0.5193
 epoch: 15, train_loss: 0.8673, test_loss: 0.8249, test_f1: 0.5220
 epoch: 16, train_loss: 0.8325, test_loss: 0.8403, test_f1: 0.6010
 epoch: 17, train_loss: 0.8288, test_loss: 0.9481, test_f1: 0.5407
 epoch: 18, train_loss: 0.8365, test_loss: 0.8742, test_f1: 0.5481
 epoch: 19, train_loss: 0.8352, test_loss: 0.8560, test_f1: 0.5679
 epoch: 20, train_loss: 0.8085, test_loss: 0.9343, test_f1: 0.5153
 epoch: 21, train_loss: 0.7952, test_loss: 1.0512, test_f1: 0.5049
 epoch: 22, train_loss: 0.8221, test_loss: 0.9130, test_f1: 0.5438
 epoch: 23, train_loss: 0.7986, test_loss: 0.8049, test_f1: 0.6081
 epoch: 24, train_loss: 0.7688, test_loss: 0.8793, test_f1: 0.5765
 epoch: 25, train_loss: 0.8005, test_loss: 0.8576, test_f1: 0.5519
 epoch: 26, train_loss: 0.7806, test_loss: 0.7859, test_f1: 0.6203
 epoch: 27, train_loss: 0.7777, test_loss: 0.9217, test_f1: 0.5303
 epoch: 28, train_loss: 0.7689, test_loss: 0.8878, test_f1: 0.5551
 epoch: 29, train_loss: 0.7688, test_loss: 0.8892, test_f1: 0.6029
 epoch: 30, train_loss: 0.7893, test_loss: 0.9257, test_f1: 0.5025
 epoch: 31, train_loss: 0.7416, test_loss: 0.9092, test_f1: 0.5596
 epoch: 32, train_loss: 0.7430, test_loss: 0.9103, test_f1: 0.5970
 epoch: 33, train_loss: 0.7393, test_loss: 1.1573, test_f1: 0.5670
 epoch: 34, train_loss: 0.7559, test_loss: 0.9169, test_f1: 0.5812
 epoch: 35, train_loss: 0.7362, test_loss: 1.0814, test_f1: 0.5267
 epoch: 36, train_loss: 0.7309, test_loss: 0.8371, test_f1: 0.5749
 epoch: 37, train_loss: 0.7332, test_loss: 0.9016, test_f1: 0.6184
 epoch: 38, train_loss: 0.7352, test_loss: 0.8396, test_f1: 0.6312
 epoch: 39, train_loss: 0.7433, test_loss: 0.8048, test_f1: 0.5762
 epoch: 40, train_loss: 0.7260, test_loss: 0.9381, test_f1: 0.5830
 epoch: 41, train_loss: 0.7262, test_loss: 0.8858, test_f1: 0.5789
 epoch: 42, train_loss: 0.7239, test_loss: 0.9284, test_f1: 0.5411
 epoch: 43, train_loss: 0.7177, test_loss: 0.8824, test_f1: 0.6178
 epoch: 44, train_loss: 0.7139, test_loss: 0.9446, test_f1: 0.5544
 epoch: 45, train_loss: 0.7265, test_loss: 0.9410, test_f1: 0.5446
 epoch: 46, train_loss: 0.7316, test_loss: 0.8874, test_f1: 0.5479
 epoch: 47, train_loss: 0.6998, test_loss: 0.9111, test_f1: 0.5405
 epoch: 48, train_loss: 0.6877, test_loss: 0.9680, test_f1: 0.5664
 epoch: 49, train_loss: 0.6953, test_loss: 1.0091, test_f1: 0.5892
 epoch: 50, train_loss: 0.7170, test_loss: 0.8994, test_f1: 0.5443
 epoch: 51, train_loss: 0.6759, test_loss: 0.8636, test_f1: 0.5828
 epoch: 52, train_loss: 0.6636, test_loss: 0.8928, test_f1: 0.5878
 epoch: 53, train_loss: 0.6501, test_loss: 0.9060, test_f1: 0.6421
 epoch: 54, train_loss: 0.6389, test_loss: 0.9128, test_f1: 0.6095
 epoch: 55, train_loss: 0.6371, test_loss: 0.8597, test_f1: 0.6290
 epoch: 56, train_loss: 0.6289, test_loss: 0.8625, test_f1: 0.6088
 epoch: 57, train_loss: 0.6494, test_loss: 0.9812, test_f1: 0.5791
 epoch: 58, train_loss: 0.6255, test_loss: 0.8711, test_f1: 0.6214
 epoch: 59, train_loss: 0.6345, test_loss: 0.8905, test_f1: 0.6165
 epoch: 60, train_loss: 0.6216, test_loss: 0.9213, test_f1: 0.6322
 epoch: 61, train_loss: 0.6238, test_loss: 0.8324, test_f1: 0.6515
 epoch: 62, train_loss: 0.6323, test_loss: 1.0068, test_f1: 0.6091
 epoch: 63, train_loss: 0.6093, test_loss: 0.8919, test_f1: 0.6411
 epoch: 64, train_loss: 0.6043, test_loss: 0.8803, test_f1: 0.6386
 epoch: 65, train_loss: 0.6080, test_loss: 0.9027, test_f1: 0.6345
 epoch: 66, train_loss: 0.6015, test_loss: 0.9998, test_f1: 0.5961
 epoch: 67, train_loss: 0.6121, test_loss: 0.9585, test_f1: 0.6184
 epoch: 68, train_loss: 0.6151, test_loss: 0.8991, test_f1: 0.6237
 epoch: 69, train_loss: 0.6117, test_loss: 0.9625, test_f1: 0.6058
 epoch: 70, train_loss: 0.6083, test_loss: 1.0474, test_f1: 0.6079
 epoch: 71, train_loss: 0.6341, test_loss: 1.0347, test_f1: 0.5811
 epoch: 72, train_loss: 0.6059, test_loss: 0.9368, test_f1: 0.6211
 epoch: 73, train_loss: 0.6022, test_loss: 0.9012, test_f1: 0.6147
 epoch: 74, train_loss: 0.5975, test_loss: 1.0329, test_f1: 0.6301
 epoch: 75, train_loss: 0.6093, test_loss: 0.9149, test_f1: 0.6393
 epoch: 76, train_loss: 0.6005, test_loss: 0.9369, test_f1: 0.6196
 epoch: 77, train_loss: 0.6038, test_loss: 0.9571, test_f1: 0.6243
 epoch: 78, train_loss: 0.5901, test_loss: 1.0540, test_f1: 0.6004
 epoch: 79, train_loss: 0.5942, test_loss: 0.9594, test_f1: 0.6340
 epoch: 80, train_loss: 0.5868, test_loss: 0.9624, test_f1: 0.6340
 epoch: 81, train_loss: 0.5988, test_loss: 1.0653, test_f1: 0.5777
 epoch: 82, train_loss: 0.5885, test_loss: 0.9668, test_f1: 0.6357
 epoch: 83, train_loss: 0.6004, test_loss: 0.9983, test_f1: 0.6101
 epoch: 84, train_loss: 0.5880, test_loss: 0.9849, test_f1: 0.6267
 epoch: 85, train_loss: 0.5693, test_loss: 0.9608, test_f1: 0.6450
 epoch: 86, train_loss: 0.5818, test_loss: 1.0299, test_f1: 0.6403
 epoch: 87, train_loss: 0.5663, test_loss: 1.0190, test_f1: 0.6227
 epoch: 88, train_loss: 0.5706, test_loss: 1.0037, test_f1: 0.6455
 epoch: 89, train_loss: 0.5905, test_loss: 1.0141, test_f1: 0.6057
 epoch: 90, train_loss: 0.5619, test_loss: 1.0492, test_f1: 0.6339
 epoch: 91, train_loss: 0.5633, test_loss: 1.0756, test_f1: 0.6169
 epoch: 92, train_loss: 0.5668, test_loss: 1.0431, test_f1: 0.6157
 epoch: 93, train_loss: 0.5743, test_loss: 0.9310, test_f1: 0.6428
 epoch: 94, train_loss: 0.5627, test_loss: 1.0479, test_f1: 0.6221
 epoch: 95, train_loss: 0.5750, test_loss: 1.0233, test_f1: 0.6250
 epoch: 96, train_loss: 0.5650, test_loss: 0.9644, test_f1: 0.6463
 epoch: 97, train_loss: 0.5559, test_loss: 0.9810, test_f1: 0.6443
 epoch: 98, train_loss: 0.5590, test_loss: 0.9879, test_f1: 0.6398
 epoch: 99, train_loss: 0.5539, test_loss: 0.9987, test_f1: 0.6030
##################ITERATION #2 ****************************************
 epoch: 0, train_loss: 1.1348, test_loss: 1.1741, test_f1: 0.4842
 epoch: 1, train_loss: 1.0017, test_loss: 1.0594, test_f1: 0.4816
 epoch: 2, train_loss: 0.9724, test_loss: 1.0595, test_f1: 0.5121
 epoch: 3, train_loss: 0.9755, test_loss: 0.9807, test_f1: 0.5226
 epoch: 4, train_loss: 0.9481, test_loss: 0.9671, test_f1: 0.5515
 epoch: 5, train_loss: 0.9335, test_loss: 0.9810, test_f1: 0.5221
 epoch: 6, train_loss: 0.9390, test_loss: 0.9443, test_f1: 0.5129
 epoch: 7, train_loss: 0.9066, test_loss: 0.9271, test_f1: 0.4811
 epoch: 8, train_loss: 0.8949, test_loss: 1.0021, test_f1: 0.5030
 epoch: 9, train_loss: 0.9084, test_loss: 0.9578, test_f1: 0.4804
 epoch: 10, train_loss: 0.8801, test_loss: 1.0812, test_f1: 0.4507
 epoch: 11, train_loss: 0.8738, test_loss: 0.8967, test_f1: 0.4905
 epoch: 12, train_loss: 0.8620, test_loss: 0.9038, test_f1: 0.5053
 epoch: 13, train_loss: 0.8683, test_loss: 0.8931, test_f1: 0.4871
 epoch: 14, train_loss: 0.8588, test_loss: 0.8705, test_f1: 0.5422
 epoch: 15, train_loss: 0.8485, test_loss: 0.8613, test_f1: 0.5323
 epoch: 16, train_loss: 0.8376, test_loss: 0.8819, test_f1: 0.5056
 epoch: 17, train_loss: 0.8336, test_loss: 1.0033, test_f1: 0.4744
 epoch: 18, train_loss: 0.8115, test_loss: 0.9279, test_f1: 0.5321
 epoch: 19, train_loss: 0.8107, test_loss: 0.8151, test_f1: 0.5744
 epoch: 20, train_loss: 0.8011, test_loss: 0.7875, test_f1: 0.5807
 epoch: 21, train_loss: 0.8029, test_loss: 0.8240, test_f1: 0.5615
 epoch: 22, train_loss: 0.7983, test_loss: 0.9150, test_f1: 0.5188
 epoch: 23, train_loss: 0.7934, test_loss: 0.8980, test_f1: 0.5409
 epoch: 24, train_loss: 0.7989, test_loss: 0.8609, test_f1: 0.5986
 epoch: 25, train_loss: 0.8048, test_loss: 0.9256, test_f1: 0.5054
 epoch: 26, train_loss: 0.7883, test_loss: 0.9253, test_f1: 0.5368
 epoch: 27, train_loss: 0.7992, test_loss: 0.8690, test_f1: 0.5306
 epoch: 28, train_loss: 0.7902, test_loss: 0.8943, test_f1: 0.5477
 epoch: 29, train_loss: 0.7722, test_loss: 0.9899, test_f1: 0.4986
 epoch: 30, train_loss: 0.7938, test_loss: 0.9846, test_f1: 0.4536
 epoch: 31, train_loss: 0.7681, test_loss: 0.9065, test_f1: 0.5361
 epoch: 32, train_loss: 0.7640, test_loss: 0.8555, test_f1: 0.5561
 epoch: 33, train_loss: 0.7637, test_loss: 0.9218, test_f1: 0.5373
 epoch: 34, train_loss: 0.7866, test_loss: 0.9046, test_f1: 0.5473
 epoch: 35, train_loss: 0.7638, test_loss: 0.9815, test_f1: 0.5693
 epoch: 36, train_loss: 0.7597, test_loss: 0.7981, test_f1: 0.5546
 epoch: 37, train_loss: 0.7717, test_loss: 0.9398, test_f1: 0.5913
 epoch: 38, train_loss: 0.7377, test_loss: 0.8223, test_f1: 0.5730
 epoch: 39, train_loss: 0.7526, test_loss: 0.9561, test_f1: 0.5243
 epoch: 40, train_loss: 0.7605, test_loss: 0.9406, test_f1: 0.5727
 epoch: 41, train_loss: 0.7624, test_loss: 0.8696, test_f1: 0.5171
 epoch: 42, train_loss: 0.7559, test_loss: 0.9453, test_f1: 0.5490
 epoch: 43, train_loss: 0.7478, test_loss: 0.9327, test_f1: 0.5539
 epoch: 44, train_loss: 0.7321, test_loss: 0.8830, test_f1: 0.5536
 epoch: 45, train_loss: 0.7281, test_loss: 0.9616, test_f1: 0.5459
 epoch: 46, train_loss: 0.7385, test_loss: 0.9187, test_f1: 0.5393
 epoch: 47, train_loss: 0.7344, test_loss: 0.9728, test_f1: 0.5498
 epoch: 48, train_loss: 0.7225, test_loss: 0.8957, test_f1: 0.5515
 epoch: 49, train_loss: 0.7094, test_loss: 0.9415, test_f1: 0.5272
 epoch: 50, train_loss: 0.7269, test_loss: 0.9934, test_f1: 0.5597
 epoch: 51, train_loss: 0.7042, test_loss: 0.9270, test_f1: 0.5582
 epoch: 52, train_loss: 0.6736, test_loss: 0.9640, test_f1: 0.5493
 epoch: 53, train_loss: 0.6709, test_loss: 1.0245, test_f1: 0.5640
 epoch: 54, train_loss: 0.6768, test_loss: 0.9209, test_f1: 0.5867
 epoch: 55, train_loss: 0.6924, test_loss: 0.9831, test_f1: 0.5554
 epoch: 56, train_loss: 0.6626, test_loss: 0.9883, test_f1: 0.5688
 epoch: 57, train_loss: 0.6558, test_loss: 0.9534, test_f1: 0.5801
 epoch: 58, train_loss: 0.6485, test_loss: 0.9698, test_f1: 0.5600
 epoch: 59, train_loss: 0.6570, test_loss: 1.0091, test_f1: 0.5591
 epoch: 60, train_loss: 0.6613, test_loss: 1.0200, test_f1: 0.5477
 epoch: 61, train_loss: 0.6544, test_loss: 0.9345, test_f1: 0.5424
 epoch: 62, train_loss: 0.6496, test_loss: 0.9189, test_f1: 0.5614
 epoch: 63, train_loss: 0.6377, test_loss: 0.8854, test_f1: 0.5835
 epoch: 64, train_loss: 0.6476, test_loss: 0.9057, test_f1: 0.5973
 epoch: 65, train_loss: 0.6393, test_loss: 0.9694, test_f1: 0.5489
 epoch: 66, train_loss: 0.6480, test_loss: 0.9722, test_f1: 0.5783
 epoch: 67, train_loss: 0.6473, test_loss: 1.0197, test_f1: 0.5429
 epoch: 68, train_loss: 0.6358, test_loss: 1.0137, test_f1: 0.5319
 epoch: 69, train_loss: 0.6276, test_loss: 0.9847, test_f1: 0.5773
 epoch: 70, train_loss: 0.6306, test_loss: 0.9664, test_f1: 0.5407
 epoch: 71, train_loss: 0.6351, test_loss: 0.8982, test_f1: 0.5985
 epoch: 72, train_loss: 0.6279, test_loss: 0.8609, test_f1: 0.5757
 epoch: 73, train_loss: 0.6176, test_loss: 1.0966, test_f1: 0.5440
 epoch: 74, train_loss: 0.6189, test_loss: 0.8663, test_f1: 0.6011
 epoch: 75, train_loss: 0.6131, test_loss: 1.0028, test_f1: 0.5611
 epoch: 76, train_loss: 0.6206, test_loss: 1.0054, test_f1: 0.5978
 epoch: 77, train_loss: 0.6298, test_loss: 0.9232, test_f1: 0.5956
 epoch: 78, train_loss: 0.6140, test_loss: 0.9341, test_f1: 0.6259
 epoch: 79, train_loss: 0.6260, test_loss: 0.9043, test_f1: 0.5692
 epoch: 80, train_loss: 0.6245, test_loss: 0.9547, test_f1: 0.5547
 epoch: 81, train_loss: 0.6126, test_loss: 0.9075, test_f1: 0.5815
 epoch: 82, train_loss: 0.6130, test_loss: 0.9010, test_f1: 0.6098
 epoch: 83, train_loss: 0.6189, test_loss: 0.8900, test_f1: 0.5956
 epoch: 84, train_loss: 0.6089, test_loss: 0.9029, test_f1: 0.5794
 epoch: 85, train_loss: 0.6083, test_loss: 0.8605, test_f1: 0.5854
 epoch: 86, train_loss: 0.6067, test_loss: 0.8518, test_f1: 0.6052
 epoch: 87, train_loss: 0.6084, test_loss: 0.9643, test_f1: 0.5552
 epoch: 88, train_loss: 0.5975, test_loss: 0.9115, test_f1: 0.6187
 epoch: 89, train_loss: 0.6190, test_loss: 0.8386, test_f1: 0.5989
 epoch: 90, train_loss: 0.6095, test_loss: 1.0323, test_f1: 0.5642
 epoch: 91, train_loss: 0.6072, test_loss: 0.9492, test_f1: 0.5973
 epoch: 92, train_loss: 0.6048, test_loss: 0.9403, test_f1: 0.5766
 epoch: 93, train_loss: 0.6024, test_loss: 0.9423, test_f1: 0.6077
 epoch: 94, train_loss: 0.5940, test_loss: 0.9830, test_f1: 0.5721
 epoch: 95, train_loss: 0.5834, test_loss: 0.8978, test_f1: 0.5940
 epoch: 96, train_loss: 0.6043, test_loss: 0.9020, test_f1: 0.5956
 epoch: 97, train_loss: 0.5863, test_loss: 0.9826, test_f1: 0.5973
 epoch: 98, train_loss: 0.5735, test_loss: 1.0132, test_f1: 0.5861
 epoch: 99, train_loss: 0.5792, test_loss: 0.9603, test_f1: 0.5744
##################ITERATION #3 ****************************************
 epoch: 0, train_loss: 1.1689, test_loss: 1.1071, test_f1: 0.4446
 epoch: 1, train_loss: 1.0484, test_loss: 1.0972, test_f1: 0.4894
 epoch: 2, train_loss: 0.9926, test_loss: 1.0942, test_f1: 0.3780
 epoch: 3, train_loss: 0.9926, test_loss: 1.1892, test_f1: 0.4447
 epoch: 4, train_loss: 0.9870, test_loss: 0.9724, test_f1: 0.5015
 epoch: 5, train_loss: 0.9590, test_loss: 1.1589, test_f1: 0.4562
 epoch: 6, train_loss: 0.9519, test_loss: 0.9035, test_f1: 0.5005
 epoch: 7, train_loss: 0.9288, test_loss: 0.9485, test_f1: 0.4893
 epoch: 8, train_loss: 0.9094, test_loss: 1.0014, test_f1: 0.4826
 epoch: 9, train_loss: 0.9045, test_loss: 1.5035, test_f1: 0.3812
 epoch: 10, train_loss: 0.8904, test_loss: 1.6742, test_f1: 0.3818
 epoch: 11, train_loss: 0.8831, test_loss: 0.9842, test_f1: 0.4604
 epoch: 12, train_loss: 0.8930, test_loss: 0.9088, test_f1: 0.5212
 epoch: 13, train_loss: 0.8664, test_loss: 0.9360, test_f1: 0.4658
 epoch: 14, train_loss: 0.8666, test_loss: 0.9299, test_f1: 0.5087
 epoch: 15, train_loss: 0.8627, test_loss: 0.9801, test_f1: 0.4890
 epoch: 16, train_loss: 0.8553, test_loss: 0.9577, test_f1: 0.5029
 epoch: 17, train_loss: 0.8704, test_loss: 0.9187, test_f1: 0.5698
 epoch: 18, train_loss: 0.8260, test_loss: 0.8893, test_f1: 0.5420
 epoch: 19, train_loss: 0.8363, test_loss: 0.9420, test_f1: 0.5251
 epoch: 20, train_loss: 0.8264, test_loss: 0.8221, test_f1: 0.5397
 epoch: 21, train_loss: 0.8160, test_loss: 0.9542, test_f1: 0.5199
 epoch: 22, train_loss: 0.8209, test_loss: 0.9045, test_f1: 0.5126
 epoch: 23, train_loss: 0.8230, test_loss: 0.9049, test_f1: 0.5383
 epoch: 24, train_loss: 0.8094, test_loss: 0.9525, test_f1: 0.5230
 epoch: 25, train_loss: 0.8128, test_loss: 0.9385, test_f1: 0.5820
 epoch: 26, train_loss: 0.8009, test_loss: 0.9632, test_f1: 0.4819
 epoch: 27, train_loss: 0.8086, test_loss: 0.9385, test_f1: 0.5222
 epoch: 28, train_loss: 0.7874, test_loss: 0.8686, test_f1: 0.5414
 epoch: 29, train_loss: 0.7920, test_loss: 0.9276, test_f1: 0.5286
 epoch: 30, train_loss: 0.7816, test_loss: 0.8475, test_f1: 0.5554
 epoch: 31, train_loss: 0.7677, test_loss: 0.9604, test_f1: 0.5472
 epoch: 32, train_loss: 0.7738, test_loss: 0.8718, test_f1: 0.4825
 epoch: 33, train_loss: 0.7998, test_loss: 0.8220, test_f1: 0.5565
 epoch: 34, train_loss: 0.7708, test_loss: 0.8573, test_f1: 0.5784
 epoch: 35, train_loss: 0.7622, test_loss: 0.9343, test_f1: 0.5692
 epoch: 36, train_loss: 0.7575, test_loss: 0.8554, test_f1: 0.6263
 epoch: 37, train_loss: 0.7600, test_loss: 0.8410, test_f1: 0.5929
 epoch: 38, train_loss: 0.7686, test_loss: 0.9030, test_f1: 0.5267
 epoch: 39, train_loss: 0.7475, test_loss: 0.8607, test_f1: 0.5385
 epoch: 40, train_loss: 0.7554, test_loss: 0.9155, test_f1: 0.5163
 epoch: 41, train_loss: 0.7703, test_loss: 0.9076, test_f1: 0.5500
 epoch: 42, train_loss: 0.7777, test_loss: 0.8878, test_f1: 0.5372
 epoch: 43, train_loss: 0.7343, test_loss: 0.9263, test_f1: 0.5807
 epoch: 44, train_loss: 0.7277, test_loss: 1.0327, test_f1: 0.5843
 epoch: 45, train_loss: 0.7533, test_loss: 0.9064, test_f1: 0.5761
 epoch: 46, train_loss: 0.7428, test_loss: 0.8949, test_f1: 0.5958
 epoch: 47, train_loss: 0.7384, test_loss: 0.8568, test_f1: 0.5754
 epoch: 48, train_loss: 0.7307, test_loss: 0.9198, test_f1: 0.5821
 epoch: 49, train_loss: 0.7665, test_loss: 0.8750, test_f1: 0.5996
 epoch: 50, train_loss: 0.7283, test_loss: 0.9030, test_f1: 0.5848
 epoch: 51, train_loss: 0.7231, test_loss: 0.8458, test_f1: 0.5967
 epoch: 52, train_loss: 0.6883, test_loss: 0.7969, test_f1: 0.6201
 epoch: 53, train_loss: 0.6817, test_loss: 0.7992, test_f1: 0.6095
 epoch: 54, train_loss: 0.6795, test_loss: 0.8776, test_f1: 0.5605
 epoch: 55, train_loss: 0.6849, test_loss: 0.8460, test_f1: 0.6031
 epoch: 56, train_loss: 0.6702, test_loss: 0.9108, test_f1: 0.6000
 epoch: 57, train_loss: 0.6785, test_loss: 0.8759, test_f1: 0.5538
 epoch: 58, train_loss: 0.6739, test_loss: 0.8555, test_f1: 0.5485
 epoch: 59, train_loss: 0.6567, test_loss: 0.8545, test_f1: 0.6295
 epoch: 60, train_loss: 0.6600, test_loss: 0.8248, test_f1: 0.5963
 epoch: 61, train_loss: 0.6754, test_loss: 0.9460, test_f1: 0.5758
 epoch: 62, train_loss: 0.6633, test_loss: 0.8916, test_f1: 0.6010
 epoch: 63, train_loss: 0.6622, test_loss: 0.8480, test_f1: 0.6139
 epoch: 64, train_loss: 0.6669, test_loss: 0.8350, test_f1: 0.6089
 epoch: 65, train_loss: 0.6632, test_loss: 0.9503, test_f1: 0.5517
 epoch: 66, train_loss: 0.6513, test_loss: 0.8439, test_f1: 0.5620
 epoch: 67, train_loss: 0.6494, test_loss: 0.8342, test_f1: 0.5837
 epoch: 68, train_loss: 0.6464, test_loss: 0.8081, test_f1: 0.6165
 epoch: 69, train_loss: 0.6362, test_loss: 0.9270, test_f1: 0.5681
 epoch: 70, train_loss: 0.6349, test_loss: 0.8309, test_f1: 0.6271
 epoch: 71, train_loss: 0.6359, test_loss: 0.8091, test_f1: 0.6039
 epoch: 72, train_loss: 0.6222, test_loss: 0.9068, test_f1: 0.5647
 epoch: 73, train_loss: 0.6473, test_loss: 0.9327, test_f1: 0.5993
 epoch: 74, train_loss: 0.6324, test_loss: 0.9005, test_f1: 0.6192
 epoch: 75, train_loss: 0.6178, test_loss: 0.9161, test_f1: 0.6098
 epoch: 76, train_loss: 0.6327, test_loss: 0.8163, test_f1: 0.6083
 epoch: 77, train_loss: 0.6430, test_loss: 0.8301, test_f1: 0.6172
 epoch: 78, train_loss: 0.6423, test_loss: 0.8502, test_f1: 0.6092
 epoch: 79, train_loss: 0.6096, test_loss: 0.8319, test_f1: 0.6503
 epoch: 80, train_loss: 0.6388, test_loss: 1.0663, test_f1: 0.5643
 epoch: 81, train_loss: 0.6399, test_loss: 0.8636, test_f1: 0.6255
 epoch: 82, train_loss: 0.6128, test_loss: 0.8607, test_f1: 0.5884
 epoch: 83, train_loss: 0.6233, test_loss: 0.8878, test_f1: 0.6168
 epoch: 84, train_loss: 0.6367, test_loss: 0.8080, test_f1: 0.6512
 epoch: 85, train_loss: 0.6124, test_loss: 0.9032, test_f1: 0.6203
 epoch: 86, train_loss: 0.6031, test_loss: 1.0047, test_f1: 0.6109
 epoch: 87, train_loss: 0.6132, test_loss: 0.9267, test_f1: 0.6128
 epoch: 88, train_loss: 0.6082, test_loss: 0.8996, test_f1: 0.6273
 epoch: 89, train_loss: 0.5978, test_loss: 0.8212, test_f1: 0.6277
 epoch: 90, train_loss: 0.6072, test_loss: 0.9820, test_f1: 0.5874
 epoch: 91, train_loss: 0.6160, test_loss: 0.8722, test_f1: 0.6363
 epoch: 92, train_loss: 0.6096, test_loss: 0.7962, test_f1: 0.6158
 epoch: 93, train_loss: 0.5974, test_loss: 0.9306, test_f1: 0.6399
 epoch: 94, train_loss: 0.6039, test_loss: 0.9143, test_f1: 0.6257
 epoch: 95, train_loss: 0.5952, test_loss: 0.9428, test_f1: 0.6265
 epoch: 96, train_loss: 0.5988, test_loss: 0.9158, test_f1: 0.6310
 epoch: 97, train_loss: 0.5859, test_loss: 0.9778, test_f1: 0.6252
 epoch: 98, train_loss: 0.5952, test_loss: 0.9867, test_f1: 0.6038
 epoch: 99, train_loss: 0.6012, test_loss: 1.1134, test_f1: 0.6001
##################ITERATION #4 ****************************************
 epoch: 0, train_loss: 1.1217, test_loss: 1.0685, test_f1: 0.4804
 epoch: 1, train_loss: 1.0247, test_loss: 1.0243, test_f1: 0.4873
 epoch: 2, train_loss: 0.9900, test_loss: 0.9766, test_f1: 0.4467
 epoch: 3, train_loss: 0.9693, test_loss: 0.9232, test_f1: 0.5083
 epoch: 4, train_loss: 0.9749, test_loss: 0.9769, test_f1: 0.5038
 epoch: 5, train_loss: 0.9384, test_loss: 0.9722, test_f1: 0.5147
 epoch: 6, train_loss: 0.9051, test_loss: 0.9145, test_f1: 0.5396
 epoch: 7, train_loss: 0.9024, test_loss: 0.9192, test_f1: 0.5541
 epoch: 8, train_loss: 0.8933, test_loss: 0.9318, test_f1: 0.5066
 epoch: 9, train_loss: 0.8721, test_loss: 0.9766, test_f1: 0.4873
 epoch: 10, train_loss: 0.9024, test_loss: 1.1037, test_f1: 0.4228
 epoch: 11, train_loss: 0.8956, test_loss: 0.9901, test_f1: 0.4733
 epoch: 12, train_loss: 0.8669, test_loss: 0.8513, test_f1: 0.5138
 epoch: 13, train_loss: 0.8701, test_loss: 0.8857, test_f1: 0.5147
 epoch: 14, train_loss: 0.8713, test_loss: 0.8997, test_f1: 0.5261
 epoch: 15, train_loss: 0.8759, test_loss: 0.9509, test_f1: 0.5271
 epoch: 16, train_loss: 0.8585, test_loss: 0.9917, test_f1: 0.5021
 epoch: 17, train_loss: 0.8406, test_loss: 0.8979, test_f1: 0.5189
 epoch: 18, train_loss: 0.8522, test_loss: 0.9096, test_f1: 0.5187
 epoch: 19, train_loss: 0.8403, test_loss: 1.0844, test_f1: 0.4573
 epoch: 20, train_loss: 0.8451, test_loss: 0.8870, test_f1: 0.5342
 epoch: 21, train_loss: 0.8407, test_loss: 0.9542, test_f1: 0.5410
 epoch: 22, train_loss: 0.8411, test_loss: 0.9952, test_f1: 0.4828
 epoch: 23, train_loss: 0.8324, test_loss: 1.0044, test_f1: 0.5113
 epoch: 24, train_loss: 0.8340, test_loss: 1.0185, test_f1: 0.4950
 epoch: 25, train_loss: 0.8217, test_loss: 0.8794, test_f1: 0.5656
 epoch: 26, train_loss: 0.8105, test_loss: 1.0276, test_f1: 0.5352
 epoch: 27, train_loss: 0.8295, test_loss: 0.9888, test_f1: 0.5269
 epoch: 28, train_loss: 0.8249, test_loss: 0.9974, test_f1: 0.4777
 epoch: 29, train_loss: 0.8208, test_loss: 0.9171, test_f1: 0.5587
 epoch: 30, train_loss: 0.7935, test_loss: 0.8989, test_f1: 0.5774
 epoch: 31, train_loss: 0.8094, test_loss: 0.9188, test_f1: 0.5295
 epoch: 32, train_loss: 0.8102, test_loss: 0.9050, test_f1: 0.5446
 epoch: 33, train_loss: 0.7923, test_loss: 0.8996, test_f1: 0.5603
 epoch: 34, train_loss: 0.7772, test_loss: 0.9368, test_f1: 0.5388
 epoch: 35, train_loss: 0.7770, test_loss: 1.0081, test_f1: 0.5493
 epoch: 36, train_loss: 0.7865, test_loss: 0.9294, test_f1: 0.4947
 epoch: 37, train_loss: 0.7882, test_loss: 0.9764, test_f1: 0.5306
 epoch: 38, train_loss: 0.7766, test_loss: 0.9629, test_f1: 0.5323
 epoch: 39, train_loss: 0.7514, test_loss: 0.9204, test_f1: 0.5952
 epoch: 40, train_loss: 0.7608, test_loss: 0.9311, test_f1: 0.5328
 epoch: 41, train_loss: 0.7474, test_loss: 1.1390, test_f1: 0.4984
 epoch: 42, train_loss: 0.7668, test_loss: 0.9274, test_f1: 0.6171
 epoch: 43, train_loss: 0.7421, test_loss: 0.8913, test_f1: 0.5778
 epoch: 44, train_loss: 0.7342, test_loss: 0.9425, test_f1: 0.5368
 epoch: 45, train_loss: 0.7540, test_loss: 1.0629, test_f1: 0.5192
 epoch: 46, train_loss: 0.7534, test_loss: 1.0508, test_f1: 0.5300
 epoch: 47, train_loss: 0.7272, test_loss: 0.9684, test_f1: 0.5697
 epoch: 48, train_loss: 0.7252, test_loss: 0.9111, test_f1: 0.6397
 epoch: 49, train_loss: 0.7339, test_loss: 0.8600, test_f1: 0.5772
 epoch: 50, train_loss: 0.7301, test_loss: 0.8889, test_f1: 0.5738
 epoch: 51, train_loss: 0.7130, test_loss: 0.9149, test_f1: 0.5725
 epoch: 52, train_loss: 0.6933, test_loss: 0.9148, test_f1: 0.6330
 epoch: 53, train_loss: 0.6694, test_loss: 0.9062, test_f1: 0.5884
 epoch: 54, train_loss: 0.6729, test_loss: 0.9220, test_f1: 0.6291
 epoch: 55, train_loss: 0.6718, test_loss: 0.9155, test_f1: 0.6096
 epoch: 56, train_loss: 0.6697, test_loss: 0.9760, test_f1: 0.6200
 epoch: 57, train_loss: 0.6581, test_loss: 0.8941, test_f1: 0.6279
 epoch: 58, train_loss: 0.6730, test_loss: 0.8808, test_f1: 0.6174
 epoch: 59, train_loss: 0.6614, test_loss: 0.9500, test_f1: 0.6057
 epoch: 60, train_loss: 0.6453, test_loss: 0.9293, test_f1: 0.6213
 epoch: 61, train_loss: 0.6555, test_loss: 0.9408, test_f1: 0.5937
 epoch: 62, train_loss: 0.6621, test_loss: 0.8494, test_f1: 0.6333
 epoch: 63, train_loss: 0.6593, test_loss: 0.9551, test_f1: 0.5744
 epoch: 64, train_loss: 0.6553, test_loss: 0.9541, test_f1: 0.6247
 epoch: 65, train_loss: 0.6361, test_loss: 1.0083, test_f1: 0.6046
 epoch: 66, train_loss: 0.6561, test_loss: 0.9369, test_f1: 0.6512
 epoch: 67, train_loss: 0.6488, test_loss: 0.9573, test_f1: 0.5651
 epoch: 68, train_loss: 0.6327, test_loss: 0.9508, test_f1: 0.6037
 epoch: 69, train_loss: 0.6430, test_loss: 0.9696, test_f1: 0.5858
 epoch: 70, train_loss: 0.6446, test_loss: 0.9873, test_f1: 0.5848
 epoch: 71, train_loss: 0.6324, test_loss: 1.1587, test_f1: 0.5693
 epoch: 72, train_loss: 0.6228, test_loss: 0.9364, test_f1: 0.6139
 epoch: 73, train_loss: 0.6279, test_loss: 0.9314, test_f1: 0.6196
 epoch: 74, train_loss: 0.6279, test_loss: 0.9609, test_f1: 0.6513
 epoch: 75, train_loss: 0.6184, test_loss: 0.9168, test_f1: 0.5936
 epoch: 76, train_loss: 0.6181, test_loss: 0.9385, test_f1: 0.5996
 epoch: 77, train_loss: 0.6247, test_loss: 0.9328, test_f1: 0.6337
 epoch: 78, train_loss: 0.6264, test_loss: 0.9666, test_f1: 0.6118
 epoch: 79, train_loss: 0.6330, test_loss: 1.0072, test_f1: 0.6100
 epoch: 80, train_loss: 0.6207, test_loss: 1.0078, test_f1: 0.6278
 epoch: 81, train_loss: 0.6136, test_loss: 1.0528, test_f1: 0.5817
 epoch: 82, train_loss: 0.6187, test_loss: 0.9682, test_f1: 0.6275
 epoch: 83, train_loss: 0.6393, test_loss: 0.9899, test_f1: 0.6268
 epoch: 84, train_loss: 0.6143, test_loss: 0.9381, test_f1: 0.6394
 epoch: 85, train_loss: 0.6117, test_loss: 0.9411, test_f1: 0.6334
 epoch: 86, train_loss: 0.6037, test_loss: 0.9334, test_f1: 0.6466
 epoch: 87, train_loss: 0.5921, test_loss: 1.0147, test_f1: 0.6190
 epoch: 88, train_loss: 0.6088, test_loss: 1.0146, test_f1: 0.6226
 epoch: 89, train_loss: 0.6059, test_loss: 0.9940, test_f1: 0.5943
 epoch: 90, train_loss: 0.6169, test_loss: 1.0288, test_f1: 0.6039
 epoch: 91, train_loss: 0.6034, test_loss: 0.9351, test_f1: 0.6199
 epoch: 92, train_loss: 0.6070, test_loss: 1.0435, test_f1: 0.6340
 epoch: 93, train_loss: 0.5899, test_loss: 0.9191, test_f1: 0.6284
 epoch: 94, train_loss: 0.5786, test_loss: 1.0370, test_f1: 0.6114
 epoch: 95, train_loss: 0.6126, test_loss: 1.0290, test_f1: 0.6051
 epoch: 96, train_loss: 0.6034, test_loss: 0.9763, test_f1: 0.6092
 epoch: 97, train_loss: 0.5932, test_loss: 1.0744, test_f1: 0.6267
 epoch: 98, train_loss: 0.5540, test_loss: 1.1629, test_f1: 0.5841
 epoch: 99, train_loss: 0.6016, test_loss: 0.9174, test_f1: 0.6253
##################ITERATION #5 ****************************************
 epoch: 0, train_loss: 1.1613, test_loss: 1.1505, test_f1: 0.4451
 epoch: 1, train_loss: 1.0658, test_loss: 1.0999, test_f1: 0.4176
 epoch: 2, train_loss: 1.0250, test_loss: 1.0294, test_f1: 0.5164
 epoch: 3, train_loss: 1.0027, test_loss: 1.0803, test_f1: 0.4902
 epoch: 4, train_loss: 0.9608, test_loss: 1.0419, test_f1: 0.5156
 epoch: 5, train_loss: 0.9339, test_loss: 0.9999, test_f1: 0.4576
 epoch: 6, train_loss: 0.9386, test_loss: 1.0336, test_f1: 0.5296
 epoch: 7, train_loss: 0.9238, test_loss: 1.0304, test_f1: 0.5205
 epoch: 8, train_loss: 0.9189, test_loss: 0.9607, test_f1: 0.5702
 epoch: 9, train_loss: 0.9008, test_loss: 1.0674, test_f1: 0.5220
 epoch: 10, train_loss: 0.9101, test_loss: 1.0343, test_f1: 0.4994
 epoch: 11, train_loss: 0.8822, test_loss: 0.9448, test_f1: 0.5309
 epoch: 12, train_loss: 0.8736, test_loss: 1.1337, test_f1: 0.4620
 epoch: 13, train_loss: 0.8759, test_loss: 0.9606, test_f1: 0.5227
 epoch: 14, train_loss: 0.8623, test_loss: 0.8648, test_f1: 0.5593
 epoch: 15, train_loss: 0.8549, test_loss: 0.9689, test_f1: 0.5412
 epoch: 16, train_loss: 0.8449, test_loss: 0.9411, test_f1: 0.5659
 epoch: 17, train_loss: 0.8466, test_loss: 0.9189, test_f1: 0.5335
 epoch: 18, train_loss: 0.8464, test_loss: 1.0754, test_f1: 0.5560
 epoch: 19, train_loss: 0.8237, test_loss: 0.9002, test_f1: 0.5871
 epoch: 20, train_loss: 0.8277, test_loss: 0.9668, test_f1: 0.5673
 epoch: 21, train_loss: 0.8133, test_loss: 0.9170, test_f1: 0.5703
 epoch: 22, train_loss: 0.7940, test_loss: 0.9879, test_f1: 0.5339
 epoch: 23, train_loss: 0.8067, test_loss: 0.9821, test_f1: 0.5374
 epoch: 24, train_loss: 0.8285, test_loss: 0.8702, test_f1: 0.5793
 epoch: 25, train_loss: 0.8005, test_loss: 0.9512, test_f1: 0.5848
 epoch: 26, train_loss: 0.7954, test_loss: 1.0191, test_f1: 0.6091
 epoch: 27, train_loss: 0.7910, test_loss: 0.9574, test_f1: 0.6250
 epoch: 28, train_loss: 0.7954, test_loss: 1.0136, test_f1: 0.5394
 epoch: 29, train_loss: 0.8013, test_loss: 1.0510, test_f1: 0.5447
 epoch: 30, train_loss: 0.7897, test_loss: 0.9279, test_f1: 0.5747
 epoch: 31, train_loss: 0.7869, test_loss: 0.8762, test_f1: 0.5632
 epoch: 32, train_loss: 0.8270, test_loss: 0.9235, test_f1: 0.5423
 epoch: 33, train_loss: 0.7716, test_loss: 0.9554, test_f1: 0.5909
 epoch: 34, train_loss: 0.7777, test_loss: 1.0103, test_f1: 0.5774
 epoch: 35, train_loss: 0.7706, test_loss: 0.9485, test_f1: 0.6089
 epoch: 36, train_loss: 0.7640, test_loss: 1.1066, test_f1: 0.6128
 epoch: 37, train_loss: 0.7579, test_loss: 0.9156, test_f1: 0.6025
 epoch: 38, train_loss: 0.7495, test_loss: 1.0757, test_f1: 0.5531
 epoch: 39, train_loss: 0.7534, test_loss: 0.9486, test_f1: 0.6405
 epoch: 40, train_loss: 0.7597, test_loss: 1.0141, test_f1: 0.5756
 epoch: 41, train_loss: 0.7327, test_loss: 1.0045, test_f1: 0.6147
 epoch: 42, train_loss: 0.7353, test_loss: 0.8882, test_f1: 0.6068
 epoch: 43, train_loss: 0.7427, test_loss: 0.9539, test_f1: 0.6164
 epoch: 44, train_loss: 0.7699, test_loss: 0.9305, test_f1: 0.5709
 epoch: 45, train_loss: 0.7429, test_loss: 0.9636, test_f1: 0.6246
 epoch: 46, train_loss: 0.7441, test_loss: 0.9442, test_f1: 0.5983
 epoch: 47, train_loss: 0.7271, test_loss: 0.8972, test_f1: 0.6505
 epoch: 48, train_loss: 0.7263, test_loss: 1.0611, test_f1: 0.5951
 epoch: 49, train_loss: 0.7700, test_loss: 1.0366, test_f1: 0.5637
 epoch: 50, train_loss: 0.7443, test_loss: 1.0238, test_f1: 0.6116
 epoch: 51, train_loss: 0.7025, test_loss: 1.0143, test_f1: 0.6219
 epoch: 52, train_loss: 0.6812, test_loss: 0.9577, test_f1: 0.6067
 epoch: 53, train_loss: 0.6836, test_loss: 1.0801, test_f1: 0.5915
 epoch: 54, train_loss: 0.6683, test_loss: 1.0487, test_f1: 0.5863
 epoch: 55, train_loss: 0.6604, test_loss: 1.0321, test_f1: 0.6196
 epoch: 56, train_loss: 0.6739, test_loss: 1.0554, test_f1: 0.6179
 epoch: 57, train_loss: 0.6737, test_loss: 1.1039, test_f1: 0.5619
 epoch: 58, train_loss: 0.6537, test_loss: 1.1159, test_f1: 0.6178
 epoch: 59, train_loss: 0.6544, test_loss: 1.2005, test_f1: 0.6115
 epoch: 60, train_loss: 0.6700, test_loss: 1.0615, test_f1: 0.6120
 epoch: 61, train_loss: 0.6513, test_loss: 1.0581, test_f1: 0.6173
 epoch: 62, train_loss: 0.6491, test_loss: 1.1119, test_f1: 0.6102
 epoch: 63, train_loss: 0.6497, test_loss: 1.1057, test_f1: 0.6038
 epoch: 64, train_loss: 0.6383, test_loss: 1.0818, test_f1: 0.6427
 epoch: 65, train_loss: 0.6148, test_loss: 1.1719, test_f1: 0.5783
 epoch: 66, train_loss: 0.6381, test_loss: 1.0665, test_f1: 0.6294
 epoch: 67, train_loss: 0.6330, test_loss: 1.1417, test_f1: 0.5890
 epoch: 68, train_loss: 0.6409, test_loss: 0.9844, test_f1: 0.6106
 epoch: 69, train_loss: 0.6308, test_loss: 1.1328, test_f1: 0.6005
 epoch: 70, train_loss: 0.6263, test_loss: 1.1720, test_f1: 0.6113
 epoch: 71, train_loss: 0.6166, test_loss: 1.1576, test_f1: 0.6134
 epoch: 72, train_loss: 0.6240, test_loss: 1.1115, test_f1: 0.6298
 epoch: 73, train_loss: 0.6172, test_loss: 1.1905, test_f1: 0.6242
 epoch: 74, train_loss: 0.6221, test_loss: 1.2040, test_f1: 0.6185
 epoch: 75, train_loss: 0.6307, test_loss: 1.1741, test_f1: 0.6035
 epoch: 76, train_loss: 0.6150, test_loss: 1.1724, test_f1: 0.6127
 epoch: 77, train_loss: 0.6241, test_loss: 0.9863, test_f1: 0.6332
 epoch: 78, train_loss: 0.6105, test_loss: 1.1545, test_f1: 0.6107
 epoch: 79, train_loss: 0.6113, test_loss: 1.1734, test_f1: 0.6462
 epoch: 80, train_loss: 0.6080, test_loss: 1.1085, test_f1: 0.6476
 epoch: 81, train_loss: 0.5922, test_loss: 1.0502, test_f1: 0.6328
 epoch: 82, train_loss: 0.5979, test_loss: 1.1149, test_f1: 0.6522
 epoch: 83, train_loss: 0.6097, test_loss: 1.0345, test_f1: 0.6392
 epoch: 84, train_loss: 0.5984, test_loss: 1.0708, test_f1: 0.6486
 epoch: 85, train_loss: 0.5868, test_loss: 1.0940, test_f1: 0.6181
 epoch: 86, train_loss: 0.5855, test_loss: 1.2835, test_f1: 0.6172
 epoch: 87, train_loss: 0.5732, test_loss: 1.0365, test_f1: 0.6291
 epoch: 88, train_loss: 0.5801, test_loss: 1.1413, test_f1: 0.6314
 epoch: 89, train_loss: 0.5698, test_loss: 1.1292, test_f1: 0.6462
 epoch: 90, train_loss: 0.5775, test_loss: 1.1739, test_f1: 0.6442
 epoch: 91, train_loss: 0.5652, test_loss: 1.1435, test_f1: 0.6408
 epoch: 92, train_loss: 0.5510, test_loss: 1.3225, test_f1: 0.6437
 epoch: 93, train_loss: 0.5718, test_loss: 1.1465, test_f1: 0.6316
 epoch: 94, train_loss: 0.5878, test_loss: 1.2037, test_f1: 0.6502
 epoch: 95, train_loss: 0.5589, test_loss: 1.1922, test_f1: 0.6399
 epoch: 96, train_loss: 0.5653, test_loss: 1.1397, test_f1: 0.6322
 epoch: 97, train_loss: 0.5620, test_loss: 1.2727, test_f1: 0.6258
 epoch: 98, train_loss: 0.5474, test_loss: 1.1549, test_f1: 0.6069
 epoch: 99, train_loss: 0.5569, test_loss: 1.2188, test_f1: 0.6408
##################ITERATION #6 ****************************************
 epoch: 0, train_loss: 1.1333, test_loss: 1.0421, test_f1: 0.4605
 epoch: 1, train_loss: 1.0239, test_loss: 1.0779, test_f1: 0.4627
 epoch: 2, train_loss: 0.9774, test_loss: 1.0056, test_f1: 0.5421
 epoch: 3, train_loss: 0.9610, test_loss: 1.0081, test_f1: 0.5077
 epoch: 4, train_loss: 0.9454, test_loss: 1.5605, test_f1: 0.4192
 epoch: 5, train_loss: 0.9367, test_loss: 1.0058, test_f1: 0.4523
 epoch: 6, train_loss: 0.9107, test_loss: 0.9214, test_f1: 0.5210
 epoch: 7, train_loss: 0.8988, test_loss: 0.9306, test_f1: 0.5377
 epoch: 8, train_loss: 0.8995, test_loss: 0.9720, test_f1: 0.5234
 epoch: 9, train_loss: 0.9003, test_loss: 0.8976, test_f1: 0.5072
 epoch: 10, train_loss: 0.8812, test_loss: 1.0320, test_f1: 0.5037
 epoch: 11, train_loss: 0.8567, test_loss: 0.9313, test_f1: 0.5405
 epoch: 12, train_loss: 0.8464, test_loss: 0.9849, test_f1: 0.4950
 epoch: 13, train_loss: 0.8584, test_loss: 0.9024, test_f1: 0.5738
 epoch: 14, train_loss: 0.8223, test_loss: 0.9919, test_f1: 0.4880
 epoch: 15, train_loss: 0.8530, test_loss: 0.8567, test_f1: 0.5524
 epoch: 16, train_loss: 0.8297, test_loss: 0.9122, test_f1: 0.5150
 epoch: 17, train_loss: 0.8236, test_loss: 0.8905, test_f1: 0.5939
 epoch: 18, train_loss: 0.8228, test_loss: 0.9423, test_f1: 0.5424
 epoch: 19, train_loss: 0.8158, test_loss: 0.9148, test_f1: 0.5713
 epoch: 20, train_loss: 0.8188, test_loss: 1.0439, test_f1: 0.4812
 epoch: 21, train_loss: 0.8081, test_loss: 0.9557, test_f1: 0.5382
 epoch: 22, train_loss: 0.8011, test_loss: 0.8543, test_f1: 0.6143
 epoch: 23, train_loss: 0.7931, test_loss: 0.8758, test_f1: 0.6000
 epoch: 24, train_loss: 0.7776, test_loss: 0.8512, test_f1: 0.6017
 epoch: 25, train_loss: 0.7839, test_loss: 0.8877, test_f1: 0.5449
 epoch: 26, train_loss: 0.7898, test_loss: 0.9163, test_f1: 0.5560
 epoch: 27, train_loss: 0.7891, test_loss: 0.8696, test_f1: 0.5493
 epoch: 28, train_loss: 0.7870, test_loss: 0.9316, test_f1: 0.5400
 epoch: 29, train_loss: 0.7609, test_loss: 0.8987, test_f1: 0.5236
 epoch: 30, train_loss: 0.7692, test_loss: 0.9226, test_f1: 0.5434
 epoch: 31, train_loss: 0.7561, test_loss: 0.8953, test_f1: 0.5766
 epoch: 32, train_loss: 0.7770, test_loss: 0.8768, test_f1: 0.5881
 epoch: 33, train_loss: 0.7586, test_loss: 0.8899, test_f1: 0.5989
 epoch: 34, train_loss: 0.7566, test_loss: 0.8515, test_f1: 0.5412
 epoch: 35, train_loss: 0.7654, test_loss: 0.9512, test_f1: 0.5358
 epoch: 36, train_loss: 0.7335, test_loss: 0.9107, test_f1: 0.5785
 epoch: 37, train_loss: 0.7522, test_loss: 0.8834, test_f1: 0.5732
 epoch: 38, train_loss: 0.7352, test_loss: 0.9276, test_f1: 0.5641
 epoch: 39, train_loss: 0.7527, test_loss: 0.8936, test_f1: 0.5892
 epoch: 40, train_loss: 0.7271, test_loss: 0.8461, test_f1: 0.6203
 epoch: 41, train_loss: 0.7329, test_loss: 0.8679, test_f1: 0.5851
 epoch: 42, train_loss: 0.7326, test_loss: 0.9786, test_f1: 0.5720
 epoch: 43, train_loss: 0.7327, test_loss: 1.1470, test_f1: 0.5460
 epoch: 44, train_loss: 0.7229, test_loss: 0.9881, test_f1: 0.5320
 epoch: 45, train_loss: 0.7237, test_loss: 1.1589, test_f1: 0.4534
 epoch: 46, train_loss: 0.7215, test_loss: 0.8949, test_f1: 0.5877
 epoch: 47, train_loss: 0.6858, test_loss: 0.8874, test_f1: 0.5855
 epoch: 48, train_loss: 0.7018, test_loss: 0.9937, test_f1: 0.5720
 epoch: 49, train_loss: 0.6964, test_loss: 1.0075, test_f1: 0.5665
 epoch: 50, train_loss: 0.7096, test_loss: 0.9602, test_f1: 0.5921
 epoch: 51, train_loss: 0.6790, test_loss: 0.8734, test_f1: 0.6061
 epoch: 52, train_loss: 0.6580, test_loss: 0.9803, test_f1: 0.5991
 epoch: 53, train_loss: 0.6563, test_loss: 0.9053, test_f1: 0.5854
 epoch: 54, train_loss: 0.6480, test_loss: 0.9123, test_f1: 0.6194
 epoch: 55, train_loss: 0.6381, test_loss: 0.8964, test_f1: 0.6214
 epoch: 56, train_loss: 0.6238, test_loss: 0.9285, test_f1: 0.6220
 epoch: 57, train_loss: 0.6449, test_loss: 0.9299, test_f1: 0.6240
 epoch: 58, train_loss: 0.6268, test_loss: 0.8807, test_f1: 0.6266
 epoch: 59, train_loss: 0.6410, test_loss: 0.8842, test_f1: 0.6376
 epoch: 60, train_loss: 0.6264, test_loss: 0.8919, test_f1: 0.6116
 epoch: 61, train_loss: 0.6357, test_loss: 0.9383, test_f1: 0.6528
 epoch: 62, train_loss: 0.6369, test_loss: 0.9476, test_f1: 0.6022
 epoch: 63, train_loss: 0.6313, test_loss: 0.9613, test_f1: 0.5916
 epoch: 64, train_loss: 0.6093, test_loss: 1.0150, test_f1: 0.5919
 epoch: 65, train_loss: 0.6180, test_loss: 0.9655, test_f1: 0.6345
 epoch: 66, train_loss: 0.6145, test_loss: 0.9019, test_f1: 0.6450
 epoch: 67, train_loss: 0.6211, test_loss: 0.9545, test_f1: 0.6283
 epoch: 68, train_loss: 0.6019, test_loss: 0.9568, test_f1: 0.6077
 epoch: 69, train_loss: 0.6036, test_loss: 1.0280, test_f1: 0.6128
 epoch: 70, train_loss: 0.6091, test_loss: 0.9097, test_f1: 0.6270
 epoch: 71, train_loss: 0.5987, test_loss: 1.0443, test_f1: 0.6134
 epoch: 72, train_loss: 0.6022, test_loss: 0.9351, test_f1: 0.6349
 epoch: 73, train_loss: 0.5942, test_loss: 0.9426, test_f1: 0.6358
 epoch: 74, train_loss: 0.5915, test_loss: 0.9894, test_f1: 0.6275
 epoch: 75, train_loss: 0.6014, test_loss: 0.9776, test_f1: 0.6298
 epoch: 76, train_loss: 0.5893, test_loss: 0.8622, test_f1: 0.6538
 epoch: 77, train_loss: 0.5901, test_loss: 1.0242, test_f1: 0.6040
 epoch: 78, train_loss: 0.6014, test_loss: 1.0325, test_f1: 0.6285
 epoch: 79, train_loss: 0.5866, test_loss: 1.0033, test_f1: 0.6167
 epoch: 80, train_loss: 0.5915, test_loss: 1.0773, test_f1: 0.6145
 epoch: 81, train_loss: 0.5830, test_loss: 0.9693, test_f1: 0.6208
 epoch: 82, train_loss: 0.6022, test_loss: 1.1253, test_f1: 0.5894
 epoch: 83, train_loss: 0.5879, test_loss: 0.9182, test_f1: 0.6283
 epoch: 84, train_loss: 0.5874, test_loss: 1.0911, test_f1: 0.6266
 epoch: 85, train_loss: 0.5724, test_loss: 0.9198, test_f1: 0.6494
 epoch: 86, train_loss: 0.5863, test_loss: 1.1413, test_f1: 0.6341
 epoch: 87, train_loss: 0.5844, test_loss: 1.0061, test_f1: 0.6441
 epoch: 88, train_loss: 0.5814, test_loss: 1.0621, test_f1: 0.6307
 epoch: 89, train_loss: 0.5864, test_loss: 1.0259, test_f1: 0.6374
 epoch: 90, train_loss: 0.5632, test_loss: 0.9722, test_f1: 0.6486
 epoch: 91, train_loss: 0.5660, test_loss: 1.0454, test_f1: 0.6294
 epoch: 92, train_loss: 0.5551, test_loss: 0.9891, test_f1: 0.6407
 epoch: 93, train_loss: 0.5541, test_loss: 1.0375, test_f1: 0.6170
 epoch: 94, train_loss: 0.5688, test_loss: 1.0897, test_f1: 0.6337
 epoch: 95, train_loss: 0.5643, test_loss: 1.0490, test_f1: 0.6543
 epoch: 96, train_loss: 0.5833, test_loss: 1.2046, test_f1: 0.6054
 epoch: 97, train_loss: 0.5489, test_loss: 1.0353, test_f1: 0.6200
 epoch: 98, train_loss: 0.5504, test_loss: 1.1127, test_f1: 0.6409
 epoch: 99, train_loss: 0.5549, test_loss: 1.0986, test_f1: 0.6292
##################ITERATION #7 ****************************************
 epoch: 0, train_loss: 1.1593, test_loss: 1.1800, test_f1: 0.4191
 epoch: 1, train_loss: 1.0314, test_loss: 1.0816, test_f1: 0.4764
 epoch: 2, train_loss: 1.0036, test_loss: 0.9819, test_f1: 0.5304
 epoch: 3, train_loss: 0.9621, test_loss: 1.0398, test_f1: 0.4822
 epoch: 4, train_loss: 0.9612, test_loss: 1.0075, test_f1: 0.5080
 epoch: 5, train_loss: 0.9578, test_loss: 1.0253, test_f1: 0.4476
 epoch: 6, train_loss: 0.9191, test_loss: 0.9935, test_f1: 0.5268
 epoch: 7, train_loss: 0.9162, test_loss: 0.9643, test_f1: 0.5569
 epoch: 8, train_loss: 0.9030, test_loss: 0.9371, test_f1: 0.5171
 epoch: 9, train_loss: 0.8845, test_loss: 1.0057, test_f1: 0.5103
 epoch: 10, train_loss: 0.8902, test_loss: 0.9654, test_f1: 0.5594
 epoch: 11, train_loss: 0.8507, test_loss: 0.9504, test_f1: 0.5742
 epoch: 12, train_loss: 0.8560, test_loss: 0.9128, test_f1: 0.5267
 epoch: 13, train_loss: 0.8401, test_loss: 0.9871, test_f1: 0.5055
 epoch: 14, train_loss: 0.8482, test_loss: 0.9818, test_f1: 0.5724
 epoch: 15, train_loss: 0.8113, test_loss: 0.9101, test_f1: 0.5477
 epoch: 16, train_loss: 0.8377, test_loss: 0.9222, test_f1: 0.5598
 epoch: 17, train_loss: 0.8267, test_loss: 0.9361, test_f1: 0.5293
 epoch: 18, train_loss: 0.8017, test_loss: 0.8336, test_f1: 0.6185
 epoch: 19, train_loss: 0.8161, test_loss: 0.9710, test_f1: 0.5527
 epoch: 20, train_loss: 0.7855, test_loss: 0.9151, test_f1: 0.5598
 epoch: 21, train_loss: 0.7734, test_loss: 0.9957, test_f1: 0.5744
 epoch: 22, train_loss: 0.8026, test_loss: 0.8866, test_f1: 0.5509
 epoch: 23, train_loss: 0.7852, test_loss: 0.9798, test_f1: 0.5641
 epoch: 24, train_loss: 0.7825, test_loss: 0.9459, test_f1: 0.5760
 epoch: 25, train_loss: 0.7904, test_loss: 0.9221, test_f1: 0.5437
 epoch: 26, train_loss: 0.8027, test_loss: 0.8714, test_f1: 0.5746
 epoch: 27, train_loss: 0.7766, test_loss: 0.9430, test_f1: 0.5316
 epoch: 28, train_loss: 0.7559, test_loss: 0.9061, test_f1: 0.5449
 epoch: 29, train_loss: 0.7632, test_loss: 0.8370, test_f1: 0.6331
 epoch: 30, train_loss: 0.7569, test_loss: 0.8936, test_f1: 0.5593
 epoch: 31, train_loss: 0.7748, test_loss: 0.9958, test_f1: 0.5197
 epoch: 32, train_loss: 0.7635, test_loss: 0.8636, test_f1: 0.6091
 epoch: 33, train_loss: 0.7550, test_loss: 0.8632, test_f1: 0.5917
 epoch: 34, train_loss: 0.7408, test_loss: 0.8350, test_f1: 0.6006
 epoch: 35, train_loss: 0.7428, test_loss: 0.8594, test_f1: 0.5694
 epoch: 36, train_loss: 0.7491, test_loss: 0.8584, test_f1: 0.5728
 epoch: 37, train_loss: 0.7513, test_loss: 0.8403, test_f1: 0.6429
 epoch: 38, train_loss: 0.7253, test_loss: 0.8537, test_f1: 0.5946
 epoch: 39, train_loss: 0.7412, test_loss: 1.0410, test_f1: 0.5190
 epoch: 40, train_loss: 0.7423, test_loss: 0.8709, test_f1: 0.6341
 epoch: 41, train_loss: 0.7213, test_loss: 0.8485, test_f1: 0.6095
 epoch: 42, train_loss: 0.7214, test_loss: 0.8324, test_f1: 0.5591
 epoch: 43, train_loss: 0.7159, test_loss: 0.8631, test_f1: 0.5658
 epoch: 44, train_loss: 0.7225, test_loss: 0.8483, test_f1: 0.6520
 epoch: 45, train_loss: 0.7093, test_loss: 0.8235, test_f1: 0.6422
 epoch: 46, train_loss: 0.7189, test_loss: 0.7802, test_f1: 0.6441
 epoch: 47, train_loss: 0.7234, test_loss: 0.8800, test_f1: 0.5615
 epoch: 48, train_loss: 0.7003, test_loss: 0.8967, test_f1: 0.5617
 epoch: 49, train_loss: 0.6942, test_loss: 0.8192, test_f1: 0.5710
 epoch: 50, train_loss: 0.7124, test_loss: 0.8216, test_f1: 0.6337
 epoch: 51, train_loss: 0.6733, test_loss: 0.8051, test_f1: 0.6372
 epoch: 52, train_loss: 0.6543, test_loss: 0.8437, test_f1: 0.6334
 epoch: 53, train_loss: 0.6492, test_loss: 0.7877, test_f1: 0.6578
 epoch: 54, train_loss: 0.6441, test_loss: 0.8142, test_f1: 0.6462
 epoch: 55, train_loss: 0.6420, test_loss: 0.8544, test_f1: 0.6306
 epoch: 56, train_loss: 0.6345, test_loss: 0.8337, test_f1: 0.6210
 epoch: 57, train_loss: 0.6565, test_loss: 0.8468, test_f1: 0.6057
 epoch: 58, train_loss: 0.6544, test_loss: 0.9099, test_f1: 0.6444
 epoch: 59, train_loss: 0.6322, test_loss: 0.8361, test_f1: 0.6281
 epoch: 60, train_loss: 0.6323, test_loss: 0.8301, test_f1: 0.6372
 epoch: 61, train_loss: 0.6135, test_loss: 0.8301, test_f1: 0.6348
 epoch: 62, train_loss: 0.6305, test_loss: 0.8787, test_f1: 0.6286
 epoch: 63, train_loss: 0.6164, test_loss: 0.9040, test_f1: 0.6155
 epoch: 64, train_loss: 0.6257, test_loss: 0.8488, test_f1: 0.6662
 epoch: 65, train_loss: 0.6283, test_loss: 0.8698, test_f1: 0.6136
 epoch: 66, train_loss: 0.6096, test_loss: 0.8594, test_f1: 0.6486
 epoch: 67, train_loss: 0.6048, test_loss: 0.8384, test_f1: 0.6854
 epoch: 68, train_loss: 0.6217, test_loss: 0.9116, test_f1: 0.6360
 epoch: 69, train_loss: 0.6205, test_loss: 0.9320, test_f1: 0.6393
 epoch: 70, train_loss: 0.6021, test_loss: 0.8492, test_f1: 0.6522
 epoch: 71, train_loss: 0.6105, test_loss: 0.9625, test_f1: 0.6367
 epoch: 72, train_loss: 0.6224, test_loss: 0.8240, test_f1: 0.6602
 epoch: 73, train_loss: 0.6069, test_loss: 0.9032, test_f1: 0.6361
 epoch: 74, train_loss: 0.5961, test_loss: 0.8592, test_f1: 0.6486
 epoch: 75, train_loss: 0.6105, test_loss: 0.8928, test_f1: 0.5810
 epoch: 76, train_loss: 0.6050, test_loss: 0.9506, test_f1: 0.6330
 epoch: 77, train_loss: 0.5949, test_loss: 0.8818, test_f1: 0.6365
 epoch: 78, train_loss: 0.5839, test_loss: 0.9106, test_f1: 0.6719
 epoch: 79, train_loss: 0.6042, test_loss: 0.8588, test_f1: 0.6185
 epoch: 80, train_loss: 0.5966, test_loss: 1.0045, test_f1: 0.6245
 epoch: 81, train_loss: 0.5825, test_loss: 0.8958, test_f1: 0.6695
 epoch: 82, train_loss: 0.5941, test_loss: 1.0416, test_f1: 0.6249
 epoch: 83, train_loss: 0.6046, test_loss: 0.9604, test_f1: 0.6461
 epoch: 84, train_loss: 0.5873, test_loss: 0.9915, test_f1: 0.6239
 epoch: 85, train_loss: 0.5937, test_loss: 0.8531, test_f1: 0.6295
 epoch: 86, train_loss: 0.5942, test_loss: 1.5345, test_f1: 0.5097
 epoch: 87, train_loss: 0.5953, test_loss: 0.8398, test_f1: 0.6616
 epoch: 88, train_loss: 0.5789, test_loss: 0.9446, test_f1: 0.6369
 epoch: 89, train_loss: 0.5955, test_loss: 0.9260, test_f1: 0.6572
 epoch: 90, train_loss: 0.5726, test_loss: 0.8897, test_f1: 0.6621
 epoch: 91, train_loss: 0.5901, test_loss: 0.9303, test_f1: 0.6537
 epoch: 92, train_loss: 0.5778, test_loss: 0.9006, test_f1: 0.6505
 epoch: 93, train_loss: 0.5726, test_loss: 0.9393, test_f1: 0.6847
 epoch: 94, train_loss: 0.5696, test_loss: 0.9313, test_f1: 0.6258
 epoch: 95, train_loss: 0.5768, test_loss: 1.0215, test_f1: 0.6544
 epoch: 96, train_loss: 0.5701, test_loss: 0.9339, test_f1: 0.6309
 epoch: 97, train_loss: 0.5733, test_loss: 1.0359, test_f1: 0.6266
 epoch: 98, train_loss: 0.5785, test_loss: 0.9985, test_f1: 0.6352
 epoch: 99, train_loss: 0.5728, test_loss: 0.9188, test_f1: 0.6651
##################ITERATION #8 ****************************************
 epoch: 0, train_loss: 1.1648, test_loss: 1.0790, test_f1: 0.4136
 epoch: 1, train_loss: 1.0485, test_loss: 1.2051, test_f1: 0.3921
 epoch: 2, train_loss: 1.0198, test_loss: 0.9812, test_f1: 0.4800
 epoch: 3, train_loss: 0.9840, test_loss: 1.0120, test_f1: 0.4542
 epoch: 4, train_loss: 0.9699, test_loss: 0.9524, test_f1: 0.4997
 epoch: 5, train_loss: 0.9504, test_loss: 1.0272, test_f1: 0.4600
 epoch: 6, train_loss: 0.9271, test_loss: 1.0071, test_f1: 0.4612
 epoch: 7, train_loss: 0.9104, test_loss: 0.9500, test_f1: 0.4948
 epoch: 8, train_loss: 0.8920, test_loss: 0.8868, test_f1: 0.5003
 epoch: 9, train_loss: 0.8814, test_loss: 0.8922, test_f1: 0.5619
 epoch: 10, train_loss: 0.8637, test_loss: 0.8601, test_f1: 0.5314
 epoch: 11, train_loss: 0.8781, test_loss: 0.8777, test_f1: 0.5818
 epoch: 12, train_loss: 0.8708, test_loss: 0.8370, test_f1: 0.5352
 epoch: 13, train_loss: 0.8476, test_loss: 0.9929, test_f1: 0.4816
 epoch: 14, train_loss: 0.8475, test_loss: 0.9437, test_f1: 0.5192
 epoch: 15, train_loss: 0.8372, test_loss: 0.8820, test_f1: 0.5434
 epoch: 16, train_loss: 0.8205, test_loss: 0.8351, test_f1: 0.5306
 epoch: 17, train_loss: 0.8310, test_loss: 0.8480, test_f1: 0.5925
 epoch: 18, train_loss: 0.8371, test_loss: 0.8379, test_f1: 0.5471
 epoch: 19, train_loss: 0.8129, test_loss: 0.9461, test_f1: 0.5253
 epoch: 20, train_loss: 0.7996, test_loss: 0.8764, test_f1: 0.5055
 epoch: 21, train_loss: 0.7956, test_loss: 0.8939, test_f1: 0.5563
 epoch: 22, train_loss: 0.8052, test_loss: 0.8942, test_f1: 0.5324
 epoch: 23, train_loss: 0.7941, test_loss: 0.8595, test_f1: 0.5291
 epoch: 24, train_loss: 0.7878, test_loss: 0.8117, test_f1: 0.5513
 epoch: 25, train_loss: 0.8062, test_loss: 0.9146, test_f1: 0.4873
 epoch: 26, train_loss: 0.7863, test_loss: 0.8486, test_f1: 0.5268
 epoch: 27, train_loss: 0.7576, test_loss: 0.8551, test_f1: 0.5893
 epoch: 28, train_loss: 0.7829, test_loss: 0.8249, test_f1: 0.5979
 epoch: 29, train_loss: 0.7913, test_loss: 0.8239, test_f1: 0.6196
 epoch: 30, train_loss: 0.7584, test_loss: 0.9504, test_f1: 0.5213
 epoch: 31, train_loss: 0.7655, test_loss: 0.8449, test_f1: 0.5782
 epoch: 32, train_loss: 0.7589, test_loss: 0.9159, test_f1: 0.5022
 epoch: 33, train_loss: 0.7561, test_loss: 0.8594, test_f1: 0.5806
 epoch: 34, train_loss: 0.7539, test_loss: 0.8298, test_f1: 0.6257
 epoch: 35, train_loss: 0.7481, test_loss: 0.8498, test_f1: 0.5456
 epoch: 36, train_loss: 0.7439, test_loss: 0.8905, test_f1: 0.6148
 epoch: 37, train_loss: 0.7376, test_loss: 0.9486, test_f1: 0.5424
 epoch: 38, train_loss: 0.7536, test_loss: 0.8127, test_f1: 0.6002
 epoch: 39, train_loss: 0.7286, test_loss: 0.9604, test_f1: 0.5560
 epoch: 40, train_loss: 0.7315, test_loss: 0.8914, test_f1: 0.6007
 epoch: 41, train_loss: 0.7302, test_loss: 0.9035, test_f1: 0.5719
 epoch: 42, train_loss: 0.7261, test_loss: 0.8587, test_f1: 0.6056
 epoch: 43, train_loss: 0.7140, test_loss: 0.9316, test_f1: 0.5606
 epoch: 44, train_loss: 0.7187, test_loss: 0.8258, test_f1: 0.5912
 epoch: 45, train_loss: 0.7189, test_loss: 0.7916, test_f1: 0.6294
 epoch: 46, train_loss: 0.7089, test_loss: 0.8818, test_f1: 0.5465
 epoch: 47, train_loss: 0.7021, test_loss: 0.8156, test_f1: 0.6203
 epoch: 48, train_loss: 0.7116, test_loss: 0.8745, test_f1: 0.5839
 epoch: 49, train_loss: 0.7125, test_loss: 0.9282, test_f1: 0.5748
 epoch: 50, train_loss: 0.7004, test_loss: 0.8952, test_f1: 0.6083
 epoch: 51, train_loss: 0.6554, test_loss: 0.8619, test_f1: 0.6240
 epoch: 52, train_loss: 0.6563, test_loss: 0.8087, test_f1: 0.6417
 epoch: 53, train_loss: 0.6498, test_loss: 0.8353, test_f1: 0.6022
 epoch: 54, train_loss: 0.6388, test_loss: 0.8024, test_f1: 0.6476
 epoch: 55, train_loss: 0.6433, test_loss: 0.8199, test_f1: 0.6172
 epoch: 56, train_loss: 0.6373, test_loss: 0.8340, test_f1: 0.6269
 epoch: 57, train_loss: 0.6261, test_loss: 0.8177, test_f1: 0.6449
 epoch: 58, train_loss: 0.6150, test_loss: 0.8798, test_f1: 0.6063
 epoch: 59, train_loss: 0.6188, test_loss: 0.8591, test_f1: 0.6085
 epoch: 60, train_loss: 0.5986, test_loss: 0.8581, test_f1: 0.6300
 epoch: 61, train_loss: 0.6251, test_loss: 0.9618, test_f1: 0.6116
 epoch: 62, train_loss: 0.6210, test_loss: 0.8606, test_f1: 0.6371
 epoch: 63, train_loss: 0.6277, test_loss: 0.8828, test_f1: 0.6456
 epoch: 64, train_loss: 0.6050, test_loss: 0.8974, test_f1: 0.6242
 epoch: 65, train_loss: 0.6146, test_loss: 0.8223, test_f1: 0.6175
 epoch: 66, train_loss: 0.6145, test_loss: 0.8589, test_f1: 0.6323
 epoch: 67, train_loss: 0.6011, test_loss: 0.7814, test_f1: 0.6452
 epoch: 68, train_loss: 0.6176, test_loss: 0.8914, test_f1: 0.6203
 epoch: 69, train_loss: 0.5964, test_loss: 0.8865, test_f1: 0.6188
 epoch: 70, train_loss: 0.5849, test_loss: 0.8968, test_f1: 0.6090
 epoch: 71, train_loss: 0.5960, test_loss: 0.9193, test_f1: 0.6127
 epoch: 72, train_loss: 0.5850, test_loss: 0.8363, test_f1: 0.6281
 epoch: 73, train_loss: 0.6001, test_loss: 0.8683, test_f1: 0.6006
 epoch: 74, train_loss: 0.5799, test_loss: 0.8091, test_f1: 0.6449
 epoch: 75, train_loss: 0.5700, test_loss: 0.8568, test_f1: 0.6375
 epoch: 76, train_loss: 0.5822, test_loss: 0.8852, test_f1: 0.6239
 epoch: 77, train_loss: 0.5686, test_loss: 0.8672, test_f1: 0.6098
 epoch: 78, train_loss: 0.5791, test_loss: 0.8517, test_f1: 0.6518
 epoch: 79, train_loss: 0.5722, test_loss: 0.9734, test_f1: 0.6101
 epoch: 80, train_loss: 0.5813, test_loss: 0.8966, test_f1: 0.6123
 epoch: 81, train_loss: 0.6174, test_loss: 0.9549, test_f1: 0.6178
 epoch: 82, train_loss: 0.6268, test_loss: 0.8820, test_f1: 0.5984
 epoch: 83, train_loss: 0.6065, test_loss: 0.9257, test_f1: 0.6187
 epoch: 84, train_loss: 0.5953, test_loss: 0.9211, test_f1: 0.6429
 epoch: 85, train_loss: 0.5796, test_loss: 0.9077, test_f1: 0.6093
 epoch: 86, train_loss: 0.5675, test_loss: 0.9603, test_f1: 0.6248
 epoch: 87, train_loss: 0.5834, test_loss: 0.9686, test_f1: 0.6181
 epoch: 88, train_loss: 0.5858, test_loss: 0.9530, test_f1: 0.6313
 epoch: 89, train_loss: 0.5692, test_loss: 0.9090, test_f1: 0.6400
 epoch: 90, train_loss: 0.5698, test_loss: 0.9309, test_f1: 0.6107
 epoch: 91, train_loss: 0.5620, test_loss: 0.9893, test_f1: 0.6207
 epoch: 92, train_loss: 0.5514, test_loss: 1.0627, test_f1: 0.6071
 epoch: 93, train_loss: 0.5644, test_loss: 1.0743, test_f1: 0.6198
 epoch: 94, train_loss: 0.5823, test_loss: 0.9150, test_f1: 0.6117
 epoch: 95, train_loss: 0.5386, test_loss: 0.9997, test_f1: 0.6157
 epoch: 96, train_loss: 0.5352, test_loss: 0.9410, test_f1: 0.6231
 epoch: 97, train_loss: 0.5487, test_loss: 0.9624, test_f1: 0.6441
 epoch: 98, train_loss: 0.5505, test_loss: 0.9079, test_f1: 0.6307
 epoch: 99, train_loss: 0.5493, test_loss: 0.9816, test_f1: 0.6276
##################ITERATION #9 ****************************************
 epoch: 0, train_loss: 1.1743, test_loss: 1.1067, test_f1: 0.3823
 epoch: 1, train_loss: 1.0584, test_loss: 1.0351, test_f1: 0.4929
 epoch: 2, train_loss: 1.0157, test_loss: 1.1045, test_f1: 0.4795
 epoch: 3, train_loss: 1.0005, test_loss: 1.0215, test_f1: 0.5178
 epoch: 4, train_loss: 0.9779, test_loss: 0.9799, test_f1: 0.5198
 epoch: 5, train_loss: 0.9476, test_loss: 1.0546, test_f1: 0.4635
 epoch: 6, train_loss: 0.9597, test_loss: 1.0298, test_f1: 0.4743
 epoch: 7, train_loss: 0.9271, test_loss: 0.9156, test_f1: 0.5711
 epoch: 8, train_loss: 0.8938, test_loss: 1.0033, test_f1: 0.5327
 epoch: 9, train_loss: 0.8909, test_loss: 1.0011, test_f1: 0.5256
 epoch: 10, train_loss: 0.9059, test_loss: 0.9755, test_f1: 0.5085
 epoch: 11, train_loss: 0.8642, test_loss: 1.0695, test_f1: 0.5055
 epoch: 12, train_loss: 0.8550, test_loss: 0.9325, test_f1: 0.5396
 epoch: 13, train_loss: 0.8607, test_loss: 0.9543, test_f1: 0.5808
 epoch: 14, train_loss: 0.8399, test_loss: 1.0092, test_f1: 0.5461
 epoch: 15, train_loss: 0.8437, test_loss: 0.9131, test_f1: 0.5603
 epoch: 16, train_loss: 0.8361, test_loss: 0.8920, test_f1: 0.5476
 epoch: 17, train_loss: 0.8451, test_loss: 0.9662, test_f1: 0.5089
 epoch: 18, train_loss: 0.8412, test_loss: 0.9318, test_f1: 0.5357
 epoch: 19, train_loss: 0.7971, test_loss: 1.0170, test_f1: 0.5249
 epoch: 20, train_loss: 0.8368, test_loss: 0.9160, test_f1: 0.5709
 epoch: 21, train_loss: 0.8063, test_loss: 0.8997, test_f1: 0.5841
 epoch: 22, train_loss: 0.8004, test_loss: 0.9294, test_f1: 0.5583
 epoch: 23, train_loss: 0.8003, test_loss: 0.9417, test_f1: 0.5069
 epoch: 24, train_loss: 0.7836, test_loss: 0.8924, test_f1: 0.5332
 epoch: 25, train_loss: 0.7878, test_loss: 0.9840, test_f1: 0.5738
 epoch: 26, train_loss: 0.7764, test_loss: 1.0367, test_f1: 0.5714
 epoch: 27, train_loss: 0.7683, test_loss: 1.0994, test_f1: 0.5001
 epoch: 28, train_loss: 0.7565, test_loss: 0.9551, test_f1: 0.5291
 epoch: 29, train_loss: 0.7644, test_loss: 0.9211, test_f1: 0.6065
 epoch: 30, train_loss: 0.7521, test_loss: 0.9626, test_f1: 0.5807
 epoch: 31, train_loss: 0.7729, test_loss: 1.0377, test_f1: 0.4859
 epoch: 32, train_loss: 0.7466, test_loss: 0.8357, test_f1: 0.5579
 epoch: 33, train_loss: 0.7399, test_loss: 0.9479, test_f1: 0.5645
 epoch: 34, train_loss: 0.7459, test_loss: 0.9887, test_f1: 0.5975
 epoch: 35, train_loss: 0.7501, test_loss: 1.0253, test_f1: 0.5183
 epoch: 36, train_loss: 0.7442, test_loss: 0.9230, test_f1: 0.5850
 epoch: 37, train_loss: 0.7334, test_loss: 0.9559, test_f1: 0.5834
 epoch: 38, train_loss: 0.7365, test_loss: 0.9766, test_f1: 0.5939
 epoch: 39, train_loss: 0.7382, test_loss: 1.0082, test_f1: 0.5606
 epoch: 40, train_loss: 0.7089, test_loss: 0.9261, test_f1: 0.5763
 epoch: 41, train_loss: 0.7339, test_loss: 0.9255, test_f1: 0.5225
 epoch: 42, train_loss: 0.7228, test_loss: 0.9556, test_f1: 0.5468
 epoch: 43, train_loss: 0.7137, test_loss: 0.9490, test_f1: 0.5804
 epoch: 44, train_loss: 0.7293, test_loss: 0.9926, test_f1: 0.5180
 epoch: 45, train_loss: 0.7161, test_loss: 0.9216, test_f1: 0.5619
 epoch: 46, train_loss: 0.7037, test_loss: 0.9666, test_f1: 0.5765
 epoch: 47, train_loss: 0.7070, test_loss: 0.9066, test_f1: 0.6183
 epoch: 48, train_loss: 0.7206, test_loss: 0.9384, test_f1: 0.5775
 epoch: 49, train_loss: 0.7104, test_loss: 0.9825, test_f1: 0.5242
 epoch: 50, train_loss: 0.7116, test_loss: 1.0200, test_f1: 0.5227
 epoch: 51, train_loss: 0.6704, test_loss: 0.9060, test_f1: 0.5563
 epoch: 52, train_loss: 0.6526, test_loss: 0.8885, test_f1: 0.6194
 epoch: 53, train_loss: 0.6566, test_loss: 1.1298, test_f1: 0.5618
 epoch: 54, train_loss: 0.6457, test_loss: 1.0179, test_f1: 0.5731
 epoch: 55, train_loss: 0.6478, test_loss: 0.9209, test_f1: 0.5971
 epoch: 56, train_loss: 0.6398, test_loss: 0.9975, test_f1: 0.5734
 epoch: 57, train_loss: 0.6422, test_loss: 0.9021, test_f1: 0.6062
 epoch: 58, train_loss: 0.6392, test_loss: 0.9347, test_f1: 0.5948
 epoch: 59, train_loss: 0.6300, test_loss: 0.9734, test_f1: 0.6094
 epoch: 60, train_loss: 0.6378, test_loss: 0.9599, test_f1: 0.6195
 epoch: 61, train_loss: 0.6171, test_loss: 0.9546, test_f1: 0.6313
 epoch: 62, train_loss: 0.6279, test_loss: 1.0042, test_f1: 0.5834
 epoch: 63, train_loss: 0.6392, test_loss: 0.9220, test_f1: 0.6211
 epoch: 64, train_loss: 0.6219, test_loss: 1.0338, test_f1: 0.5982
 epoch: 65, train_loss: 0.6218, test_loss: 0.8902, test_f1: 0.6185
 epoch: 66, train_loss: 0.6075, test_loss: 0.9369, test_f1: 0.6062
 epoch: 67, train_loss: 0.6064, test_loss: 0.9481, test_f1: 0.6049
 epoch: 68, train_loss: 0.6107, test_loss: 1.0447, test_f1: 0.6154
 epoch: 69, train_loss: 0.6144, test_loss: 0.9177, test_f1: 0.6178
 epoch: 70, train_loss: 0.6214, test_loss: 0.9687, test_f1: 0.5738
 epoch: 71, train_loss: 0.6185, test_loss: 0.9442, test_f1: 0.6451
 epoch: 72, train_loss: 0.5972, test_loss: 0.9616, test_f1: 0.6059
 epoch: 73, train_loss: 0.6064, test_loss: 0.9926, test_f1: 0.6036
 epoch: 74, train_loss: 0.5947, test_loss: 1.0123, test_f1: 0.6019
 epoch: 75, train_loss: 0.6041, test_loss: 1.0252, test_f1: 0.5665
 epoch: 76, train_loss: 0.6201, test_loss: 0.9546, test_f1: 0.6047
 epoch: 77, train_loss: 0.5915, test_loss: 0.9911, test_f1: 0.6317
 epoch: 78, train_loss: 0.5936, test_loss: 0.9393, test_f1: 0.6108
 epoch: 79, train_loss: 0.5898, test_loss: 0.9402, test_f1: 0.5929
 epoch: 80, train_loss: 0.5974, test_loss: 0.9394, test_f1: 0.6185
 epoch: 81, train_loss: 0.6056, test_loss: 1.4589, test_f1: 0.4673
 epoch: 82, train_loss: 0.5867, test_loss: 0.9978, test_f1: 0.5948
 epoch: 83, train_loss: 0.5922, test_loss: 0.9352, test_f1: 0.6171
 epoch: 84, train_loss: 0.5960, test_loss: 1.0471, test_f1: 0.6131
 epoch: 85, train_loss: 0.5964, test_loss: 0.9274, test_f1: 0.6085
 epoch: 86, train_loss: 0.5722, test_loss: 0.9812, test_f1: 0.6107
 epoch: 87, train_loss: 0.5886, test_loss: 1.0842, test_f1: 0.6044
 epoch: 88, train_loss: 0.5847, test_loss: 0.9227, test_f1: 0.6242
 epoch: 89, train_loss: 0.5898, test_loss: 0.9667, test_f1: 0.6275
 epoch: 90, train_loss: 0.5773, test_loss: 0.9614, test_f1: 0.6167
 epoch: 91, train_loss: 0.5701, test_loss: 1.0324, test_f1: 0.6111
 epoch: 92, train_loss: 0.5740, test_loss: 1.1096, test_f1: 0.6099
 epoch: 93, train_loss: 0.5834, test_loss: 1.0123, test_f1: 0.6108
 epoch: 94, train_loss: 0.5725, test_loss: 1.0112, test_f1: 0.6226
 epoch: 95, train_loss: 0.5819, test_loss: 0.9689, test_f1: 0.6043
 epoch: 96, train_loss: 0.5747, test_loss: 0.9914, test_f1: 0.6343
 epoch: 97, train_loss: 0.5706, test_loss: 0.9601, test_f1: 0.6485
 epoch: 98, train_loss: 0.5671, test_loss: 1.0120, test_f1: 0.6057
 epoch: 99, train_loss: 0.5645, test_loss: 1.1124, test_f1: 0.6019

Training completed in 829.39 seconds
Best F1: 0.6854 at epoch 67
Mean F1 across iterations: 0.6554  0.0161
========================FINAL RESULTS================================
FEGIN weighted F1: 0.6854  0.0161
python main.py --data ltspice_examples --representation component_pin --model FEGIN --layers 6 --hiddens 32 --batch_size 64 --lr 0.01 --emb_size 250 --epochs 100 --save_appendix component_pin_L6_H32_BS64_LR0.01_E250 --no_val
-----



STDERR:
  File "main.py", line 370, in <module>
    main()
  File "main.py", line 254, in main
    dataset = dataset_class(
  File "/home/philip/projects/ltspice_examples_code_repo/Circuit-Completion-Using-GNNs/component_classification_with_link_prediction_head/evaluation/FEGIN/kernel/circuit_datasets.py", line 15, in __init__
    self.data, self.slices = torch.load(self.processed_paths[0])
  File "/home/philip/.local/lib/python3.8/site-packages/torch/serialization.py", line 1040, in load
    warnings.warn(
  File "/usr/lib/python3.8/warnings.py", line 109, in _showwarnmsg
    sw(msg.message, msg.category, msg.filename, msg.lineno,
  File "main.py", line 47, in warn_with_traceback
    traceback.print_stack(file=log)
/home/philip/projects/ltspice_examples_code_repo/Circuit-Completion-Using-GNNs/component_classification_with_link_prediction_head/evaluation/FEGIN/kernel/circuit_datasets.py:15: FutureWarning: You are using `torch.load` with `weights_only=False` (the current default value), which uses the default pickle module implicitly. It is possible to construct malicious pickle data which will execute arbitrary code during unpickling (See https://github.com/pytorch/pytorch/blob/main/SECURITY.md#untrusted-models for more details). In a future release, the default value for `weights_only` will be flipped to `True`. This limits the functions that could be executed during unpickling. Arbitrary objects will no longer be allowed to be loaded via this mode unless they are explicitly allowlisted by the user via `torch.serialization.add_safe_globals`. We recommend you start setting `weights_only=True` for any use case where you don't have full control of the loaded file. Please open an issue on GitHub for any issues related to this experimental feature.
  self.data, self.slices = torch.load(self.processed_paths[0])
