STDOUT:
Results will be saved in /home/philip/projects/ltspice_examples_code_repo/Circuit-Completion-Using-GNNs/component_classification_with_link_prediction_head/evaluation/FEGIN/results/model_FEGIN_dataset_ltspice_demos
Command line input: python main.py --data ltspice_demos --representation component_net --model FEGIN --layers 5 --hiddens 64 --batch_size 128 --lr 0.0001 --emb_size 512 --epochs 100 --save_appendix component_net_L5_H64_BS128_LR0.0001_E512 --no_val
 is saved.
-----
ltspice_demos - FEGIN
Using 5 layers, 64 hidden units, h = 2
Loading component_net representation dataset
ENTERED
Training FEGIN on component_net representation
Train: 1565, Test: 383
##################ITERATION #0 ****************************************
 epoch: 0, train_loss: 1.3944, test_loss: 1.3975, test_f1: 0.1365
 epoch: 1, train_loss: 1.3826, test_loss: 1.3923, test_f1: 0.1365
 epoch: 2, train_loss: 1.3729, test_loss: 1.3846, test_f1: 0.1365
 epoch: 3, train_loss: 1.3639, test_loss: 1.3794, test_f1: 0.1423
 epoch: 4, train_loss: 1.3525, test_loss: 1.3718, test_f1: 0.1876
 epoch: 5, train_loss: 1.3397, test_loss: 1.3593, test_f1: 0.2208
 epoch: 6, train_loss: 1.3256, test_loss: 1.3423, test_f1: 0.2753
 epoch: 7, train_loss: 1.3101, test_loss: 1.3245, test_f1: 0.3091
 epoch: 8, train_loss: 1.2905, test_loss: 1.3098, test_f1: 0.2793
 epoch: 9, train_loss: 1.2716, test_loss: 1.2946, test_f1: 0.2789
 epoch: 10, train_loss: 1.2498, test_loss: 1.2775, test_f1: 0.2799
 epoch: 11, train_loss: 1.2335, test_loss: 1.2647, test_f1: 0.2799
 epoch: 12, train_loss: 1.2154, test_loss: 1.2536, test_f1: 0.2813
 epoch: 13, train_loss: 1.1944, test_loss: 1.2426, test_f1: 0.2825
 epoch: 14, train_loss: 1.1832, test_loss: 1.2306, test_f1: 0.2869
 epoch: 15, train_loss: 1.1741, test_loss: 1.2235, test_f1: 0.2806
 epoch: 16, train_loss: 1.1708, test_loss: 1.2160, test_f1: 0.2920
 epoch: 17, train_loss: 1.1579, test_loss: 1.2093, test_f1: 0.2815
 epoch: 18, train_loss: 1.1529, test_loss: 1.2015, test_f1: 0.2923
 epoch: 19, train_loss: 1.1430, test_loss: 1.1941, test_f1: 0.2995
 epoch: 20, train_loss: 1.1360, test_loss: 1.1894, test_f1: 0.3028
 epoch: 21, train_loss: 1.1286, test_loss: 1.1829, test_f1: 0.3061
 epoch: 22, train_loss: 1.1222, test_loss: 1.1781, test_f1: 0.3413
 epoch: 23, train_loss: 1.1152, test_loss: 1.1754, test_f1: 0.3304
 epoch: 24, train_loss: 1.1150, test_loss: 1.1687, test_f1: 0.3607
 epoch: 25, train_loss: 1.1069, test_loss: 1.1659, test_f1: 0.3531
 epoch: 26, train_loss: 1.1067, test_loss: 1.1584, test_f1: 0.3492
 epoch: 27, train_loss: 1.0948, test_loss: 1.1569, test_f1: 0.3526
 epoch: 28, train_loss: 1.1006, test_loss: 1.1520, test_f1: 0.3647
 epoch: 29, train_loss: 1.0933, test_loss: 1.1455, test_f1: 0.3843
 epoch: 30, train_loss: 1.0855, test_loss: 1.1385, test_f1: 0.3884
 epoch: 31, train_loss: 1.0825, test_loss: 1.1406, test_f1: 0.3907
 epoch: 32, train_loss: 1.0778, test_loss: 1.1312, test_f1: 0.4169
 epoch: 33, train_loss: 1.0719, test_loss: 1.1282, test_f1: 0.4471
 epoch: 34, train_loss: 1.0668, test_loss: 1.1243, test_f1: 0.4495
 epoch: 35, train_loss: 1.0641, test_loss: 1.1224, test_f1: 0.4726
 epoch: 36, train_loss: 1.0650, test_loss: 1.1192, test_f1: 0.4835
 epoch: 37, train_loss: 1.0497, test_loss: 1.1143, test_f1: 0.4654
 epoch: 38, train_loss: 1.0472, test_loss: 1.1120, test_f1: 0.4710
 epoch: 39, train_loss: 1.0451, test_loss: 1.1077, test_f1: 0.4833
 epoch: 40, train_loss: 1.0383, test_loss: 1.1015, test_f1: 0.4852
 epoch: 41, train_loss: 1.0343, test_loss: 1.0966, test_f1: 0.4664
 epoch: 42, train_loss: 1.0265, test_loss: 1.0945, test_f1: 0.4861
 epoch: 43, train_loss: 1.0304, test_loss: 1.0884, test_f1: 0.4707
 epoch: 44, train_loss: 1.0173, test_loss: 1.0823, test_f1: 0.4650
 epoch: 45, train_loss: 1.0059, test_loss: 1.0891, test_f1: 0.4919
 epoch: 46, train_loss: 1.0079, test_loss: 1.0927, test_f1: 0.4922
 epoch: 47, train_loss: 1.0039, test_loss: 1.0847, test_f1: 0.4829
 epoch: 48, train_loss: 0.9930, test_loss: 1.0718, test_f1: 0.4929
 epoch: 49, train_loss: 0.9952, test_loss: 1.0804, test_f1: 0.4913
 epoch: 50, train_loss: 0.9872, test_loss: 1.0835, test_f1: 0.5139
 epoch: 51, train_loss: 0.9801, test_loss: 1.0615, test_f1: 0.5135
 epoch: 52, train_loss: 0.9797, test_loss: 1.0545, test_f1: 0.5152
 epoch: 53, train_loss: 0.9683, test_loss: 1.0588, test_f1: 0.5150
 epoch: 54, train_loss: 0.9727, test_loss: 1.0573, test_f1: 0.5123
 epoch: 55, train_loss: 0.9665, test_loss: 1.0565, test_f1: 0.5183
 epoch: 56, train_loss: 0.9626, test_loss: 1.0503, test_f1: 0.5121
 epoch: 57, train_loss: 0.9599, test_loss: 1.0475, test_f1: 0.5181
 epoch: 58, train_loss: 0.9594, test_loss: 1.0465, test_f1: 0.5200
 epoch: 59, train_loss: 0.9515, test_loss: 1.0454, test_f1: 0.5231
 epoch: 60, train_loss: 0.9471, test_loss: 1.0438, test_f1: 0.5126
 epoch: 61, train_loss: 0.9486, test_loss: 1.0444, test_f1: 0.5194
 epoch: 62, train_loss: 0.9482, test_loss: 1.0430, test_f1: 0.5181
 epoch: 63, train_loss: 0.9468, test_loss: 1.0456, test_f1: 0.5189
 epoch: 64, train_loss: 0.9379, test_loss: 1.0356, test_f1: 0.5297
 epoch: 65, train_loss: 0.9344, test_loss: 1.0341, test_f1: 0.5240
 epoch: 66, train_loss: 0.9317, test_loss: 1.0378, test_f1: 0.5305
 epoch: 67, train_loss: 0.9208, test_loss: 1.0357, test_f1: 0.5235
 epoch: 68, train_loss: 0.9240, test_loss: 1.0323, test_f1: 0.5183
 epoch: 69, train_loss: 0.9230, test_loss: 1.0447, test_f1: 0.5299
 epoch: 70, train_loss: 0.9301, test_loss: 1.0392, test_f1: 0.5250
 epoch: 71, train_loss: 0.9183, test_loss: 1.0369, test_f1: 0.5256
 epoch: 72, train_loss: 0.9132, test_loss: 1.0257, test_f1: 0.5430
 epoch: 73, train_loss: 0.9181, test_loss: 1.0353, test_f1: 0.5355
 epoch: 74, train_loss: 0.9133, test_loss: 1.0238, test_f1: 0.5483
 epoch: 75, train_loss: 0.9108, test_loss: 1.0346, test_f1: 0.5286
 epoch: 76, train_loss: 0.9063, test_loss: 1.0395, test_f1: 0.5247
 epoch: 77, train_loss: 0.9139, test_loss: 1.0558, test_f1: 0.5216
 epoch: 78, train_loss: 0.9048, test_loss: 1.0440, test_f1: 0.5230
 epoch: 79, train_loss: 0.9014, test_loss: 1.0321, test_f1: 0.5314
 epoch: 80, train_loss: 0.9033, test_loss: 1.0346, test_f1: 0.5293
 epoch: 81, train_loss: 0.8916, test_loss: 1.0364, test_f1: 0.5312
 epoch: 82, train_loss: 0.8882, test_loss: 1.0171, test_f1: 0.5459
 epoch: 83, train_loss: 0.8878, test_loss: 1.0199, test_f1: 0.5434
 epoch: 84, train_loss: 0.8875, test_loss: 1.0213, test_f1: 0.5355
 epoch: 85, train_loss: 0.8760, test_loss: 1.0385, test_f1: 0.5303
 epoch: 86, train_loss: 0.8807, test_loss: 1.0330, test_f1: 0.5262
 epoch: 87, train_loss: 0.8748, test_loss: 1.0399, test_f1: 0.5366
 epoch: 88, train_loss: 0.8745, test_loss: 1.0280, test_f1: 0.5393
 epoch: 89, train_loss: 0.8759, test_loss: 1.0370, test_f1: 0.5310
 epoch: 90, train_loss: 0.8798, test_loss: 1.0276, test_f1: 0.5422
 epoch: 91, train_loss: 0.8838, test_loss: 1.0461, test_f1: 0.5404
 epoch: 92, train_loss: 0.8824, test_loss: 1.0352, test_f1: 0.5488
 epoch: 93, train_loss: 0.8786, test_loss: 1.0209, test_f1: 0.5443
 epoch: 94, train_loss: 0.8671, test_loss: 1.0479, test_f1: 0.5454
 epoch: 95, train_loss: 0.8669, test_loss: 1.0420, test_f1: 0.5464
 epoch: 96, train_loss: 0.8645, test_loss: 1.0342, test_f1: 0.5417
 epoch: 97, train_loss: 0.8551, test_loss: 1.0258, test_f1: 0.5422
 epoch: 98, train_loss: 0.8565, test_loss: 1.0624, test_f1: 0.5390
 epoch: 99, train_loss: 0.8573, test_loss: 1.0438, test_f1: 0.5384
##################ITERATION #1 ****************************************
 epoch: 0, train_loss: 1.3286, test_loss: 1.3667, test_f1: 0.1365
 epoch: 1, train_loss: 1.2916, test_loss: 1.3616, test_f1: 0.1365
 epoch: 2, train_loss: 1.2704, test_loss: 1.3547, test_f1: 0.1365
 epoch: 3, train_loss: 1.2487, test_loss: 1.3373, test_f1: 0.2154
 epoch: 4, train_loss: 1.2282, test_loss: 1.2974, test_f1: 0.3132
 epoch: 5, train_loss: 1.2095, test_loss: 1.2621, test_f1: 0.3238
 epoch: 6, train_loss: 1.1969, test_loss: 1.2434, test_f1: 0.3215
 epoch: 7, train_loss: 1.1823, test_loss: 1.2310, test_f1: 0.3340
 epoch: 8, train_loss: 1.1677, test_loss: 1.2208, test_f1: 0.3037
 epoch: 9, train_loss: 1.1525, test_loss: 1.2133, test_f1: 0.3101
 epoch: 10, train_loss: 1.1442, test_loss: 1.2066, test_f1: 0.3010
 epoch: 11, train_loss: 1.1333, test_loss: 1.2021, test_f1: 0.3083
 epoch: 12, train_loss: 1.1238, test_loss: 1.1964, test_f1: 0.2871
 epoch: 13, train_loss: 1.1169, test_loss: 1.1895, test_f1: 0.2952
 epoch: 14, train_loss: 1.1084, test_loss: 1.1943, test_f1: 0.2980
 epoch: 15, train_loss: 1.0963, test_loss: 1.1852, test_f1: 0.3410
 epoch: 16, train_loss: 1.0927, test_loss: 1.1829, test_f1: 0.3577
 epoch: 17, train_loss: 1.0810, test_loss: 1.1799, test_f1: 0.3387
 epoch: 18, train_loss: 1.0745, test_loss: 1.1724, test_f1: 0.3431
 epoch: 19, train_loss: 1.0648, test_loss: 1.1699, test_f1: 0.3727
 epoch: 20, train_loss: 1.0606, test_loss: 1.1692, test_f1: 0.3779
 epoch: 21, train_loss: 1.0559, test_loss: 1.1727, test_f1: 0.4127
 epoch: 22, train_loss: 1.0428, test_loss: 1.1739, test_f1: 0.4271
 epoch: 23, train_loss: 1.0357, test_loss: 1.1648, test_f1: 0.4439
 epoch: 24, train_loss: 1.0331, test_loss: 1.1410, test_f1: 0.4564
 epoch: 25, train_loss: 1.0316, test_loss: 1.1529, test_f1: 0.4588
 epoch: 26, train_loss: 1.0162, test_loss: 1.1645, test_f1: 0.4587
 epoch: 27, train_loss: 1.0092, test_loss: 1.1781, test_f1: 0.4775
 epoch: 28, train_loss: 1.0010, test_loss: 1.1592, test_f1: 0.4772
 epoch: 29, train_loss: 0.9950, test_loss: 1.1573, test_f1: 0.4807
 epoch: 30, train_loss: 0.9926, test_loss: 1.1388, test_f1: 0.4889
 epoch: 31, train_loss: 0.9915, test_loss: 1.1299, test_f1: 0.4824
 epoch: 32, train_loss: 0.9691, test_loss: 1.1348, test_f1: 0.5108
 epoch: 33, train_loss: 0.9618, test_loss: 1.1422, test_f1: 0.5136
 epoch: 34, train_loss: 0.9551, test_loss: 1.1216, test_f1: 0.4980
 epoch: 35, train_loss: 0.9507, test_loss: 1.1239, test_f1: 0.5021
 epoch: 36, train_loss: 0.9467, test_loss: 1.1197, test_f1: 0.5105
 epoch: 37, train_loss: 0.9463, test_loss: 1.1194, test_f1: 0.5018
 epoch: 38, train_loss: 0.9421, test_loss: 1.1160, test_f1: 0.5077
 epoch: 39, train_loss: 0.9167, test_loss: 1.1104, test_f1: 0.5115
 epoch: 40, train_loss: 0.9320, test_loss: 1.0916, test_f1: 0.5248
 epoch: 41, train_loss: 0.9209, test_loss: 1.1312, test_f1: 0.5245
 epoch: 42, train_loss: 0.9154, test_loss: 1.1191, test_f1: 0.5198
 epoch: 43, train_loss: 0.8992, test_loss: 1.0974, test_f1: 0.5197
 epoch: 44, train_loss: 0.9021, test_loss: 1.1255, test_f1: 0.5367
 epoch: 45, train_loss: 0.9080, test_loss: 1.1133, test_f1: 0.5302
 epoch: 46, train_loss: 0.8872, test_loss: 1.1453, test_f1: 0.5292
 epoch: 47, train_loss: 0.8825, test_loss: 1.1279, test_f1: 0.5444
 epoch: 48, train_loss: 0.8727, test_loss: 1.1496, test_f1: 0.5341
 epoch: 49, train_loss: 0.8769, test_loss: 1.0972, test_f1: 0.5527
 epoch: 50, train_loss: 0.8695, test_loss: 1.1418, test_f1: 0.5300
 epoch: 51, train_loss: 0.8706, test_loss: 1.1171, test_f1: 0.5555
 epoch: 52, train_loss: 0.8734, test_loss: 1.1473, test_f1: 0.5454
 epoch: 53, train_loss: 0.8623, test_loss: 1.1336, test_f1: 0.5483
 epoch: 54, train_loss: 0.8612, test_loss: 1.1261, test_f1: 0.5549
 epoch: 55, train_loss: 0.8497, test_loss: 1.1052, test_f1: 0.5565
 epoch: 56, train_loss: 0.8595, test_loss: 1.1104, test_f1: 0.5542
 epoch: 57, train_loss: 0.8509, test_loss: 1.1248, test_f1: 0.5665
 epoch: 58, train_loss: 0.8441, test_loss: 1.1467, test_f1: 0.5617
 epoch: 59, train_loss: 0.8468, test_loss: 1.1442, test_f1: 0.5497
 epoch: 60, train_loss: 0.8352, test_loss: 1.1342, test_f1: 0.5592
 epoch: 61, train_loss: 0.8476, test_loss: 1.1474, test_f1: 0.5642
 epoch: 62, train_loss: 0.8481, test_loss: 1.1703, test_f1: 0.5542
 epoch: 63, train_loss: 0.8398, test_loss: 1.1330, test_f1: 0.5637
 epoch: 64, train_loss: 0.8502, test_loss: 1.1177, test_f1: 0.5555
 epoch: 65, train_loss: 0.8368, test_loss: 1.1099, test_f1: 0.5677
 epoch: 66, train_loss: 0.8270, test_loss: 1.1189, test_f1: 0.5659
 epoch: 67, train_loss: 0.8327, test_loss: 1.1555, test_f1: 0.5614
 epoch: 68, train_loss: 0.8293, test_loss: 1.1278, test_f1: 0.5720
 epoch: 69, train_loss: 0.8326, test_loss: 1.1572, test_f1: 0.5517
 epoch: 70, train_loss: 0.8189, test_loss: 1.1452, test_f1: 0.5660
 epoch: 71, train_loss: 0.8255, test_loss: 1.1333, test_f1: 0.5746
 epoch: 72, train_loss: 0.8308, test_loss: 1.1748, test_f1: 0.5386
 epoch: 73, train_loss: 0.8257, test_loss: 1.1928, test_f1: 0.5448
 epoch: 74, train_loss: 0.8230, test_loss: 1.1180, test_f1: 0.5619
 epoch: 75, train_loss: 0.8203, test_loss: 1.1590, test_f1: 0.5559
 epoch: 76, train_loss: 0.8200, test_loss: 1.1602, test_f1: 0.5667
 epoch: 77, train_loss: 0.8035, test_loss: 1.1695, test_f1: 0.5632
 epoch: 78, train_loss: 0.8123, test_loss: 1.1460, test_f1: 0.5630
 epoch: 79, train_loss: 0.8142, test_loss: 1.1837, test_f1: 0.5544
 epoch: 80, train_loss: 0.8057, test_loss: 1.1542, test_f1: 0.5487
 epoch: 81, train_loss: 0.8105, test_loss: 1.1515, test_f1: 0.5701
 epoch: 82, train_loss: 0.8084, test_loss: 1.1448, test_f1: 0.5713
 epoch: 83, train_loss: 0.7984, test_loss: 1.1242, test_f1: 0.5546
 epoch: 84, train_loss: 0.8036, test_loss: 1.1396, test_f1: 0.5543
 epoch: 85, train_loss: 0.7937, test_loss: 1.1473, test_f1: 0.5627
 epoch: 86, train_loss: 0.7997, test_loss: 1.1660, test_f1: 0.5509
 epoch: 87, train_loss: 0.7982, test_loss: 1.1489, test_f1: 0.5582
 epoch: 88, train_loss: 0.7918, test_loss: 1.1920, test_f1: 0.5699
 epoch: 89, train_loss: 0.7984, test_loss: 1.2025, test_f1: 0.5605
 epoch: 90, train_loss: 0.7914, test_loss: 1.1939, test_f1: 0.5689
 epoch: 91, train_loss: 0.7866, test_loss: 1.1461, test_f1: 0.5723
 epoch: 92, train_loss: 0.8045, test_loss: 1.2363, test_f1: 0.5700
 epoch: 93, train_loss: 0.8024, test_loss: 1.2055, test_f1: 0.5693
 epoch: 94, train_loss: 0.7898, test_loss: 1.1406, test_f1: 0.5641
 epoch: 95, train_loss: 0.7918, test_loss: 1.1794, test_f1: 0.5563
 epoch: 96, train_loss: 0.7894, test_loss: 1.1422, test_f1: 0.5692
 epoch: 97, train_loss: 0.7860, test_loss: 1.1986, test_f1: 0.5672
 epoch: 98, train_loss: 0.7892, test_loss: 1.1864, test_f1: 0.5594
 epoch: 99, train_loss: 0.7807, test_loss: 1.1723, test_f1: 0.5529
##################ITERATION #2 ****************************************
 epoch: 0, train_loss: 1.2984, test_loss: 1.3618, test_f1: 0.1365
 epoch: 1, train_loss: 1.2591, test_loss: 1.3387, test_f1: 0.3009
 epoch: 2, train_loss: 1.2375, test_loss: 1.3235, test_f1: 0.2701
 epoch: 3, train_loss: 1.2168, test_loss: 1.3129, test_f1: 0.2974
 epoch: 4, train_loss: 1.1983, test_loss: 1.2880, test_f1: 0.3403
 epoch: 5, train_loss: 1.1809, test_loss: 1.2615, test_f1: 0.3559
 epoch: 6, train_loss: 1.1697, test_loss: 1.2419, test_f1: 0.3513
 epoch: 7, train_loss: 1.1554, test_loss: 1.2238, test_f1: 0.3628
 epoch: 8, train_loss: 1.1494, test_loss: 1.2120, test_f1: 0.3288
 epoch: 9, train_loss: 1.1321, test_loss: 1.1999, test_f1: 0.3530
 epoch: 10, train_loss: 1.1237, test_loss: 1.1901, test_f1: 0.3519
 epoch: 11, train_loss: 1.1196, test_loss: 1.1799, test_f1: 0.3558
 epoch: 12, train_loss: 1.1121, test_loss: 1.1723, test_f1: 0.3708
 epoch: 13, train_loss: 1.0949, test_loss: 1.1648, test_f1: 0.3719
 epoch: 14, train_loss: 1.0861, test_loss: 1.1619, test_f1: 0.3817
 epoch: 15, train_loss: 1.0831, test_loss: 1.1577, test_f1: 0.3845
 epoch: 16, train_loss: 1.0714, test_loss: 1.1484, test_f1: 0.3908
 epoch: 17, train_loss: 1.0684, test_loss: 1.1441, test_f1: 0.4150
 epoch: 18, train_loss: 1.0632, test_loss: 1.1340, test_f1: 0.4414
 epoch: 19, train_loss: 1.0501, test_loss: 1.1203, test_f1: 0.4536
 epoch: 20, train_loss: 1.0448, test_loss: 1.1203, test_f1: 0.4659
 epoch: 21, train_loss: 1.0335, test_loss: 1.1140, test_f1: 0.4602
 epoch: 22, train_loss: 1.0221, test_loss: 1.1118, test_f1: 0.4796
 epoch: 23, train_loss: 1.0212, test_loss: 1.1000, test_f1: 0.4822
 epoch: 24, train_loss: 1.0135, test_loss: 1.0903, test_f1: 0.4924
 epoch: 25, train_loss: 1.0044, test_loss: 1.0891, test_f1: 0.4846
 epoch: 26, train_loss: 0.9954, test_loss: 1.0836, test_f1: 0.4938
 epoch: 27, train_loss: 0.9892, test_loss: 1.0761, test_f1: 0.4800
 epoch: 28, train_loss: 0.9803, test_loss: 1.0743, test_f1: 0.4971
 epoch: 29, train_loss: 0.9719, test_loss: 1.0694, test_f1: 0.5059
 epoch: 30, train_loss: 0.9636, test_loss: 1.0662, test_f1: 0.5071
 epoch: 31, train_loss: 0.9631, test_loss: 1.0693, test_f1: 0.5119
 epoch: 32, train_loss: 0.9465, test_loss: 1.0810, test_f1: 0.4967
 epoch: 33, train_loss: 0.9415, test_loss: 1.0639, test_f1: 0.4993
 epoch: 34, train_loss: 0.9395, test_loss: 1.0620, test_f1: 0.5169
 epoch: 35, train_loss: 0.9328, test_loss: 1.0574, test_f1: 0.5240
 epoch: 36, train_loss: 0.9273, test_loss: 1.0786, test_f1: 0.5268
 epoch: 37, train_loss: 0.9195, test_loss: 1.0566, test_f1: 0.5166
 epoch: 38, train_loss: 0.9209, test_loss: 1.0568, test_f1: 0.5212
 epoch: 39, train_loss: 0.9071, test_loss: 1.0458, test_f1: 0.5398
 epoch: 40, train_loss: 0.9002, test_loss: 1.0637, test_f1: 0.5366
 epoch: 41, train_loss: 0.8969, test_loss: 1.0575, test_f1: 0.5269
 epoch: 42, train_loss: 0.8963, test_loss: 1.0551, test_f1: 0.5387
 epoch: 43, train_loss: 0.8828, test_loss: 1.0608, test_f1: 0.5417
 epoch: 44, train_loss: 0.8850, test_loss: 1.0355, test_f1: 0.5434
 epoch: 45, train_loss: 0.8828, test_loss: 1.0451, test_f1: 0.5562
 epoch: 46, train_loss: 0.8805, test_loss: 1.0643, test_f1: 0.5607
 epoch: 47, train_loss: 0.8798, test_loss: 1.0789, test_f1: 0.5685
 epoch: 48, train_loss: 0.8655, test_loss: 1.0776, test_f1: 0.5466
 epoch: 49, train_loss: 0.8551, test_loss: 1.0590, test_f1: 0.5484
 epoch: 50, train_loss: 0.8594, test_loss: 1.0660, test_f1: 0.5409
 epoch: 51, train_loss: 0.8537, test_loss: 1.0577, test_f1: 0.5447
 epoch: 52, train_loss: 0.8612, test_loss: 1.0667, test_f1: 0.5544
 epoch: 53, train_loss: 0.8428, test_loss: 1.0586, test_f1: 0.5548
 epoch: 54, train_loss: 0.8574, test_loss: 1.0677, test_f1: 0.5532
 epoch: 55, train_loss: 0.8426, test_loss: 1.0867, test_f1: 0.5554
 epoch: 56, train_loss: 0.8390, test_loss: 1.0841, test_f1: 0.5558
 epoch: 57, train_loss: 0.8445, test_loss: 1.0909, test_f1: 0.5523
 epoch: 58, train_loss: 0.8367, test_loss: 1.0818, test_f1: 0.5473
 epoch: 59, train_loss: 0.8265, test_loss: 1.0798, test_f1: 0.5592
 epoch: 60, train_loss: 0.8355, test_loss: 1.0838, test_f1: 0.5647
 epoch: 61, train_loss: 0.8277, test_loss: 1.0696, test_f1: 0.5603
 epoch: 62, train_loss: 0.8436, test_loss: 1.0844, test_f1: 0.5606
 epoch: 63, train_loss: 0.8276, test_loss: 1.0864, test_f1: 0.5660
 epoch: 64, train_loss: 0.8379, test_loss: 1.0808, test_f1: 0.5432
 epoch: 65, train_loss: 0.8277, test_loss: 1.0924, test_f1: 0.5524
 epoch: 66, train_loss: 0.8119, test_loss: 1.0811, test_f1: 0.5650
 epoch: 67, train_loss: 0.8225, test_loss: 1.0860, test_f1: 0.5701
 epoch: 68, train_loss: 0.8291, test_loss: 1.1071, test_f1: 0.5603
 epoch: 69, train_loss: 0.8246, test_loss: 1.0982, test_f1: 0.5751
 epoch: 70, train_loss: 0.8100, test_loss: 1.1079, test_f1: 0.5594
 epoch: 71, train_loss: 0.8062, test_loss: 1.0806, test_f1: 0.5800
 epoch: 72, train_loss: 0.8194, test_loss: 1.0809, test_f1: 0.5665
 epoch: 73, train_loss: 0.8147, test_loss: 1.0754, test_f1: 0.5769
 epoch: 74, train_loss: 0.8168, test_loss: 1.0740, test_f1: 0.5677
 epoch: 75, train_loss: 0.8251, test_loss: 1.0962, test_f1: 0.5663
 epoch: 76, train_loss: 0.8110, test_loss: 1.0921, test_f1: 0.5743
 epoch: 77, train_loss: 0.8035, test_loss: 1.0641, test_f1: 0.5614
 epoch: 78, train_loss: 0.8178, test_loss: 1.0796, test_f1: 0.5780
 epoch: 79, train_loss: 0.8048, test_loss: 1.0816, test_f1: 0.5560
 epoch: 80, train_loss: 0.8082, test_loss: 1.0922, test_f1: 0.5647
 epoch: 81, train_loss: 0.8002, test_loss: 1.0884, test_f1: 0.5590
 epoch: 82, train_loss: 0.8024, test_loss: 1.0767, test_f1: 0.5618
 epoch: 83, train_loss: 0.8009, test_loss: 1.0934, test_f1: 0.5752
 epoch: 84, train_loss: 0.8145, test_loss: 1.1238, test_f1: 0.5707
 epoch: 85, train_loss: 0.8059, test_loss: 1.1377, test_f1: 0.5706
 epoch: 86, train_loss: 0.8072, test_loss: 1.1071, test_f1: 0.5734
 epoch: 87, train_loss: 0.8018, test_loss: 1.1111, test_f1: 0.5693
 epoch: 88, train_loss: 0.8096, test_loss: 1.1154, test_f1: 0.5721
 epoch: 89, train_loss: 0.8022, test_loss: 1.1155, test_f1: 0.5695
 epoch: 90, train_loss: 0.8032, test_loss: 1.1046, test_f1: 0.5641
 epoch: 91, train_loss: 0.7906, test_loss: 1.1100, test_f1: 0.5706
 epoch: 92, train_loss: 0.7847, test_loss: 1.0997, test_f1: 0.5645
 epoch: 93, train_loss: 0.7898, test_loss: 1.1140, test_f1: 0.5623
 epoch: 94, train_loss: 0.7839, test_loss: 1.1135, test_f1: 0.5726
 epoch: 95, train_loss: 0.7866, test_loss: 1.1007, test_f1: 0.5568
 epoch: 96, train_loss: 0.7693, test_loss: 1.1382, test_f1: 0.5490
 epoch: 97, train_loss: 0.7878, test_loss: 1.1483, test_f1: 0.5545
 epoch: 98, train_loss: 0.7878, test_loss: 1.1076, test_f1: 0.5828
 epoch: 99, train_loss: 0.7763, test_loss: 1.1128, test_f1: 0.5696
##################ITERATION #3 ****************************************
 epoch: 0, train_loss: 1.3035, test_loss: 1.3622, test_f1: 0.1496
 epoch: 1, train_loss: 1.2399, test_loss: 1.3567, test_f1: 0.2529
 epoch: 2, train_loss: 1.2196, test_loss: 1.3383, test_f1: 0.3210
 epoch: 3, train_loss: 1.1870, test_loss: 1.3119, test_f1: 0.3527
 epoch: 4, train_loss: 1.1741, test_loss: 1.2899, test_f1: 0.3605
 epoch: 5, train_loss: 1.1579, test_loss: 1.2503, test_f1: 0.4017
 epoch: 6, train_loss: 1.1417, test_loss: 1.2185, test_f1: 0.4204
 epoch: 7, train_loss: 1.1327, test_loss: 1.2013, test_f1: 0.3692
 epoch: 8, train_loss: 1.1263, test_loss: 1.1903, test_f1: 0.3961
 epoch: 9, train_loss: 1.1135, test_loss: 1.1852, test_f1: 0.4280
 epoch: 10, train_loss: 1.0897, test_loss: 1.1767, test_f1: 0.4062
 epoch: 11, train_loss: 1.0908, test_loss: 1.1672, test_f1: 0.4084
 epoch: 12, train_loss: 1.0843, test_loss: 1.1588, test_f1: 0.4282
 epoch: 13, train_loss: 1.0709, test_loss: 1.1470, test_f1: 0.4578
 epoch: 14, train_loss: 1.0675, test_loss: 1.1358, test_f1: 0.4691
 epoch: 15, train_loss: 1.0540, test_loss: 1.1312, test_f1: 0.4611
 epoch: 16, train_loss: 1.0452, test_loss: 1.1215, test_f1: 0.4597
 epoch: 17, train_loss: 1.0328, test_loss: 1.1117, test_f1: 0.4773
 epoch: 18, train_loss: 1.0197, test_loss: 1.1101, test_f1: 0.4992
 epoch: 19, train_loss: 1.0149, test_loss: 1.1017, test_f1: 0.4922
 epoch: 20, train_loss: 1.0104, test_loss: 1.1027, test_f1: 0.4773
 epoch: 21, train_loss: 0.9990, test_loss: 1.0995, test_f1: 0.4931
 epoch: 22, train_loss: 1.0112, test_loss: 1.0951, test_f1: 0.4882
 epoch: 23, train_loss: 0.9982, test_loss: 1.0901, test_f1: 0.4805
 epoch: 24, train_loss: 0.9888, test_loss: 1.0890, test_f1: 0.4874
 epoch: 25, train_loss: 0.9770, test_loss: 1.0784, test_f1: 0.4862
 epoch: 26, train_loss: 0.9629, test_loss: 1.0786, test_f1: 0.4908
 epoch: 27, train_loss: 0.9716, test_loss: 1.0687, test_f1: 0.4984
 epoch: 28, train_loss: 0.9573, test_loss: 1.0551, test_f1: 0.4977
 epoch: 29, train_loss: 0.9569, test_loss: 1.0515, test_f1: 0.4982
 epoch: 30, train_loss: 0.9498, test_loss: 1.0531, test_f1: 0.4943
 epoch: 31, train_loss: 0.9349, test_loss: 1.0639, test_f1: 0.5058
 epoch: 32, train_loss: 0.9378, test_loss: 1.0531, test_f1: 0.5221
 epoch: 33, train_loss: 0.9353, test_loss: 1.0605, test_f1: 0.5321
 epoch: 34, train_loss: 0.9315, test_loss: 1.0598, test_f1: 0.4792
 epoch: 35, train_loss: 0.9326, test_loss: 1.0587, test_f1: 0.5121
 epoch: 36, train_loss: 0.9246, test_loss: 1.0639, test_f1: 0.5146
 epoch: 37, train_loss: 0.9130, test_loss: 1.0713, test_f1: 0.5059
 epoch: 38, train_loss: 0.9039, test_loss: 1.0648, test_f1: 0.5134
 epoch: 39, train_loss: 0.9038, test_loss: 1.0483, test_f1: 0.5163
 epoch: 40, train_loss: 0.8986, test_loss: 1.0590, test_f1: 0.5291
 epoch: 41, train_loss: 0.9089, test_loss: 1.0552, test_f1: 0.5217
 epoch: 42, train_loss: 0.8956, test_loss: 1.0542, test_f1: 0.5433
 epoch: 43, train_loss: 0.8977, test_loss: 1.0245, test_f1: 0.5384
 epoch: 44, train_loss: 0.8781, test_loss: 1.0350, test_f1: 0.5210
 epoch: 45, train_loss: 0.8771, test_loss: 1.0422, test_f1: 0.5290
 epoch: 46, train_loss: 0.8812, test_loss: 1.0913, test_f1: 0.5332
 epoch: 47, train_loss: 0.8802, test_loss: 1.0755, test_f1: 0.5392
 epoch: 48, train_loss: 0.8761, test_loss: 1.0562, test_f1: 0.5223
 epoch: 49, train_loss: 0.8667, test_loss: 1.0442, test_f1: 0.5271
 epoch: 50, train_loss: 0.8653, test_loss: 1.0558, test_f1: 0.5445
 epoch: 51, train_loss: 0.8644, test_loss: 1.0694, test_f1: 0.5530
 epoch: 52, train_loss: 0.8584, test_loss: 1.0910, test_f1: 0.5551
 epoch: 53, train_loss: 0.8594, test_loss: 1.0817, test_f1: 0.5358
 epoch: 54, train_loss: 0.8561, test_loss: 1.0915, test_f1: 0.5478
 epoch: 55, train_loss: 0.8510, test_loss: 1.0940, test_f1: 0.5599
 epoch: 56, train_loss: 0.8510, test_loss: 1.0982, test_f1: 0.5748
 epoch: 57, train_loss: 0.8495, test_loss: 1.0960, test_f1: 0.5533
 epoch: 58, train_loss: 0.8489, test_loss: 1.0974, test_f1: 0.5386
 epoch: 59, train_loss: 0.8322, test_loss: 1.1016, test_f1: 0.5552
 epoch: 60, train_loss: 0.8447, test_loss: 1.0780, test_f1: 0.5478
 epoch: 61, train_loss: 0.8417, test_loss: 1.0947, test_f1: 0.5421
 epoch: 62, train_loss: 0.8357, test_loss: 1.0593, test_f1: 0.5573
 epoch: 63, train_loss: 0.8350, test_loss: 1.0709, test_f1: 0.5352
 epoch: 64, train_loss: 0.8397, test_loss: 1.0783, test_f1: 0.5458
 epoch: 65, train_loss: 0.8370, test_loss: 1.0612, test_f1: 0.5569
 epoch: 66, train_loss: 0.8222, test_loss: 1.0809, test_f1: 0.5527
 epoch: 67, train_loss: 0.8250, test_loss: 1.0841, test_f1: 0.5660
 epoch: 68, train_loss: 0.8372, test_loss: 1.1042, test_f1: 0.5555
 epoch: 69, train_loss: 0.8321, test_loss: 1.0946, test_f1: 0.5562
 epoch: 70, train_loss: 0.8265, test_loss: 1.0767, test_f1: 0.5609
 epoch: 71, train_loss: 0.8304, test_loss: 1.0991, test_f1: 0.5635
 epoch: 72, train_loss: 0.8250, test_loss: 1.0979, test_f1: 0.5664
 epoch: 73, train_loss: 0.8123, test_loss: 1.1047, test_f1: 0.5488
 epoch: 74, train_loss: 0.8182, test_loss: 1.1152, test_f1: 0.5653
 epoch: 75, train_loss: 0.8245, test_loss: 1.1005, test_f1: 0.5621
 epoch: 76, train_loss: 0.8212, test_loss: 1.1073, test_f1: 0.5565
 epoch: 77, train_loss: 0.8119, test_loss: 1.1019, test_f1: 0.5647
 epoch: 78, train_loss: 0.8183, test_loss: 1.1016, test_f1: 0.5677
 epoch: 79, train_loss: 0.8193, test_loss: 1.1216, test_f1: 0.5731
 epoch: 80, train_loss: 0.8172, test_loss: 1.1047, test_f1: 0.5648
 epoch: 81, train_loss: 0.8158, test_loss: 1.1290, test_f1: 0.5586
 epoch: 82, train_loss: 0.8167, test_loss: 1.1300, test_f1: 0.5803
 epoch: 83, train_loss: 0.7975, test_loss: 1.1093, test_f1: 0.5768
 epoch: 84, train_loss: 0.8137, test_loss: 1.0915, test_f1: 0.5691
 epoch: 85, train_loss: 0.8052, test_loss: 1.1084, test_f1: 0.5748
 epoch: 86, train_loss: 0.7914, test_loss: 1.1134, test_f1: 0.5609
 epoch: 87, train_loss: 0.8039, test_loss: 1.1134, test_f1: 0.5645
 epoch: 88, train_loss: 0.7964, test_loss: 1.1038, test_f1: 0.5643
 epoch: 89, train_loss: 0.8111, test_loss: 1.1068, test_f1: 0.5680
 epoch: 90, train_loss: 0.7938, test_loss: 1.1137, test_f1: 0.5593
 epoch: 91, train_loss: 0.8032, test_loss: 1.1352, test_f1: 0.5674
 epoch: 92, train_loss: 0.8011, test_loss: 1.1133, test_f1: 0.5592
 epoch: 93, train_loss: 0.7970, test_loss: 1.1125, test_f1: 0.5612
 epoch: 94, train_loss: 0.7951, test_loss: 1.1218, test_f1: 0.5620
 epoch: 95, train_loss: 0.7896, test_loss: 1.1402, test_f1: 0.5594
 epoch: 96, train_loss: 0.7922, test_loss: 1.1410, test_f1: 0.5754
 epoch: 97, train_loss: 0.7881, test_loss: 1.1509, test_f1: 0.5629
 epoch: 98, train_loss: 0.7924, test_loss: 1.1697, test_f1: 0.5591
 epoch: 99, train_loss: 0.7850, test_loss: 1.1690, test_f1: 0.5636
##################ITERATION #4 ****************************************
 epoch: 0, train_loss: 1.2695, test_loss: 1.3511, test_f1: 0.2281
 epoch: 1, train_loss: 1.2112, test_loss: 1.3309, test_f1: 0.2281
 epoch: 2, train_loss: 1.1962, test_loss: 1.3003, test_f1: 0.2613
 epoch: 3, train_loss: 1.1720, test_loss: 1.2898, test_f1: 0.2747
 epoch: 4, train_loss: 1.1631, test_loss: 1.2606, test_f1: 0.3319
 epoch: 5, train_loss: 1.1392, test_loss: 1.2538, test_f1: 0.3341
 epoch: 6, train_loss: 1.1235, test_loss: 1.2295, test_f1: 0.4033
 epoch: 7, train_loss: 1.1184, test_loss: 1.1936, test_f1: 0.4004
 epoch: 8, train_loss: 1.1043, test_loss: 1.1781, test_f1: 0.4280
 epoch: 9, train_loss: 1.0938, test_loss: 1.1809, test_f1: 0.4485
 epoch: 10, train_loss: 1.0853, test_loss: 1.1768, test_f1: 0.4367
 epoch: 11, train_loss: 1.0762, test_loss: 1.1711, test_f1: 0.4532
 epoch: 12, train_loss: 1.0630, test_loss: 1.1667, test_f1: 0.4599
 epoch: 13, train_loss: 1.0677, test_loss: 1.1681, test_f1: 0.4608
 epoch: 14, train_loss: 1.0616, test_loss: 1.1589, test_f1: 0.4791
 epoch: 15, train_loss: 1.0444, test_loss: 1.1486, test_f1: 0.4928
 epoch: 16, train_loss: 1.0438, test_loss: 1.1347, test_f1: 0.5027
 epoch: 17, train_loss: 1.0369, test_loss: 1.1372, test_f1: 0.5168
 epoch: 18, train_loss: 1.0304, test_loss: 1.1447, test_f1: 0.5100
 epoch: 19, train_loss: 1.0154, test_loss: 1.1368, test_f1: 0.5098
 epoch: 20, train_loss: 1.0177, test_loss: 1.1304, test_f1: 0.5169
 epoch: 21, train_loss: 1.0099, test_loss: 1.1114, test_f1: 0.5042
 epoch: 22, train_loss: 0.9967, test_loss: 1.1215, test_f1: 0.5246
 epoch: 23, train_loss: 0.9893, test_loss: 1.1161, test_f1: 0.5134
 epoch: 24, train_loss: 0.9950, test_loss: 1.1056, test_f1: 0.4973
 epoch: 25, train_loss: 0.9802, test_loss: 1.1035, test_f1: 0.5197
 epoch: 26, train_loss: 0.9700, test_loss: 1.1113, test_f1: 0.5152
 epoch: 27, train_loss: 0.9741, test_loss: 1.0966, test_f1: 0.5246
 epoch: 28, train_loss: 0.9667, test_loss: 1.0996, test_f1: 0.5323
 epoch: 29, train_loss: 0.9518, test_loss: 1.1060, test_f1: 0.5398
 epoch: 30, train_loss: 0.9474, test_loss: 1.0975, test_f1: 0.5330
 epoch: 31, train_loss: 0.9425, test_loss: 1.0789, test_f1: 0.5293
 epoch: 32, train_loss: 0.9447, test_loss: 1.0701, test_f1: 0.5337
 epoch: 33, train_loss: 0.9489, test_loss: 1.0869, test_f1: 0.5219
 epoch: 34, train_loss: 0.9342, test_loss: 1.0849, test_f1: 0.5222
 epoch: 35, train_loss: 0.9244, test_loss: 1.0724, test_f1: 0.5137
 epoch: 36, train_loss: 0.9332, test_loss: 1.0761, test_f1: 0.5246
 epoch: 37, train_loss: 0.9268, test_loss: 1.0818, test_f1: 0.5393
 epoch: 38, train_loss: 0.9196, test_loss: 1.0830, test_f1: 0.5192
 epoch: 39, train_loss: 0.9172, test_loss: 1.0788, test_f1: 0.5379
 epoch: 40, train_loss: 0.9080, test_loss: 1.0643, test_f1: 0.5423
 epoch: 41, train_loss: 0.9060, test_loss: 1.0987, test_f1: 0.5404
 epoch: 42, train_loss: 0.8958, test_loss: 1.1041, test_f1: 0.5087
 epoch: 43, train_loss: 0.9196, test_loss: 1.0958, test_f1: 0.5328
 epoch: 44, train_loss: 0.8942, test_loss: 1.1160, test_f1: 0.5480
 epoch: 45, train_loss: 0.8971, test_loss: 1.0896, test_f1: 0.5483
 epoch: 46, train_loss: 0.8817, test_loss: 1.0912, test_f1: 0.5641
 epoch: 47, train_loss: 0.8724, test_loss: 1.0910, test_f1: 0.5441
 epoch: 48, train_loss: 0.8868, test_loss: 1.1143, test_f1: 0.5330
 epoch: 49, train_loss: 0.8839, test_loss: 1.0719, test_f1: 0.5535
 epoch: 50, train_loss: 0.8703, test_loss: 1.0977, test_f1: 0.5491
 epoch: 51, train_loss: 0.8794, test_loss: 1.0970, test_f1: 0.5600
 epoch: 52, train_loss: 0.8733, test_loss: 1.0985, test_f1: 0.5447
 epoch: 53, train_loss: 0.8627, test_loss: 1.1100, test_f1: 0.5593
 epoch: 54, train_loss: 0.8558, test_loss: 1.0967, test_f1: 0.5619
 epoch: 55, train_loss: 0.8743, test_loss: 1.1033, test_f1: 0.5667
 epoch: 56, train_loss: 0.8572, test_loss: 1.0988, test_f1: 0.5504
 epoch: 57, train_loss: 0.8500, test_loss: 1.0966, test_f1: 0.5587
 epoch: 58, train_loss: 0.8451, test_loss: 1.1233, test_f1: 0.5461
 epoch: 59, train_loss: 0.8518, test_loss: 1.1075, test_f1: 0.5585
 epoch: 60, train_loss: 0.8544, test_loss: 1.0989, test_f1: 0.5518
 epoch: 61, train_loss: 0.8443, test_loss: 1.0999, test_f1: 0.5637
 epoch: 62, train_loss: 0.8536, test_loss: 1.1002, test_f1: 0.5685
 epoch: 63, train_loss: 0.8552, test_loss: 1.1112, test_f1: 0.5612
 epoch: 64, train_loss: 0.8413, test_loss: 1.1140, test_f1: 0.5580
 epoch: 65, train_loss: 0.8474, test_loss: 1.1375, test_f1: 0.5764
 epoch: 66, train_loss: 0.8551, test_loss: 1.1214, test_f1: 0.5542
 epoch: 67, train_loss: 0.8406, test_loss: 1.1068, test_f1: 0.5655
 epoch: 68, train_loss: 0.8330, test_loss: 1.1025, test_f1: 0.5678
 epoch: 69, train_loss: 0.8417, test_loss: 1.0978, test_f1: 0.5764
 epoch: 70, train_loss: 0.8331, test_loss: 1.0986, test_f1: 0.5623
 epoch: 71, train_loss: 0.8268, test_loss: 1.1111, test_f1: 0.5655
 epoch: 72, train_loss: 0.8322, test_loss: 1.1177, test_f1: 0.5784
 epoch: 73, train_loss: 0.8282, test_loss: 1.1109, test_f1: 0.5850
 epoch: 74, train_loss: 0.8493, test_loss: 1.1497, test_f1: 0.5620
 epoch: 75, train_loss: 0.8374, test_loss: 1.1527, test_f1: 0.5644
 epoch: 76, train_loss: 0.8386, test_loss: 1.1286, test_f1: 0.5603
 epoch: 77, train_loss: 0.8498, test_loss: 1.1429, test_f1: 0.5629
 epoch: 78, train_loss: 0.8399, test_loss: 1.1451, test_f1: 0.5695
 epoch: 79, train_loss: 0.8300, test_loss: 1.1212, test_f1: 0.5721
 epoch: 80, train_loss: 0.8345, test_loss: 1.1274, test_f1: 0.5643
 epoch: 81, train_loss: 0.8330, test_loss: 1.1313, test_f1: 0.5760
 epoch: 82, train_loss: 0.8177, test_loss: 1.1394, test_f1: 0.5577
 epoch: 83, train_loss: 0.8137, test_loss: 1.1357, test_f1: 0.5715
 epoch: 84, train_loss: 0.8254, test_loss: 1.1191, test_f1: 0.5708
 epoch: 85, train_loss: 0.8233, test_loss: 1.1283, test_f1: 0.5639
 epoch: 86, train_loss: 0.8148, test_loss: 1.1477, test_f1: 0.5731
 epoch: 87, train_loss: 0.8119, test_loss: 1.1267, test_f1: 0.5671
 epoch: 88, train_loss: 0.8199, test_loss: 1.1340, test_f1: 0.5628
 epoch: 89, train_loss: 0.8237, test_loss: 1.1471, test_f1: 0.5684
 epoch: 90, train_loss: 0.8085, test_loss: 1.1346, test_f1: 0.5722
 epoch: 91, train_loss: 0.8174, test_loss: 1.1399, test_f1: 0.5732
 epoch: 92, train_loss: 0.8002, test_loss: 1.1358, test_f1: 0.5767
 epoch: 93, train_loss: 0.8009, test_loss: 1.1378, test_f1: 0.5812
 epoch: 94, train_loss: 0.8116, test_loss: 1.1293, test_f1: 0.5723
 epoch: 95, train_loss: 0.8018, test_loss: 1.1344, test_f1: 0.5699
 epoch: 96, train_loss: 0.8101, test_loss: 1.1456, test_f1: 0.5634
 epoch: 97, train_loss: 0.7995, test_loss: 1.1606, test_f1: 0.5599
 epoch: 98, train_loss: 0.7972, test_loss: 1.1812, test_f1: 0.5542
 epoch: 99, train_loss: 0.7966, test_loss: 1.1680, test_f1: 0.5657
##################ITERATION #5 ****************************************
 epoch: 0, train_loss: 1.2366, test_loss: 1.3244, test_f1: 0.2281
 epoch: 1, train_loss: 1.1825, test_loss: 1.3421, test_f1: 0.2281
 epoch: 2, train_loss: 1.1610, test_loss: 1.3197, test_f1: 0.2730
 epoch: 3, train_loss: 1.1476, test_loss: 1.2792, test_f1: 0.2807
 epoch: 4, train_loss: 1.1215, test_loss: 1.2408, test_f1: 0.3505
 epoch: 5, train_loss: 1.1061, test_loss: 1.1974, test_f1: 0.3815
 epoch: 6, train_loss: 1.0938, test_loss: 1.1609, test_f1: 0.4213
 epoch: 7, train_loss: 1.0858, test_loss: 1.1511, test_f1: 0.4131
 epoch: 8, train_loss: 1.0755, test_loss: 1.1448, test_f1: 0.4094
 epoch: 9, train_loss: 1.0709, test_loss: 1.1452, test_f1: 0.4152
 epoch: 10, train_loss: 1.0653, test_loss: 1.1391, test_f1: 0.4079
 epoch: 11, train_loss: 1.0586, test_loss: 1.1367, test_f1: 0.4075
 epoch: 12, train_loss: 1.0411, test_loss: 1.1241, test_f1: 0.4187
 epoch: 13, train_loss: 1.0434, test_loss: 1.1287, test_f1: 0.4202
 epoch: 14, train_loss: 1.0259, test_loss: 1.1290, test_f1: 0.4114
 epoch: 15, train_loss: 1.0225, test_loss: 1.1216, test_f1: 0.4203
 epoch: 16, train_loss: 1.0151, test_loss: 1.1116, test_f1: 0.4413
 epoch: 17, train_loss: 1.0146, test_loss: 1.1126, test_f1: 0.4514
 epoch: 18, train_loss: 1.0098, test_loss: 1.1161, test_f1: 0.4585
 epoch: 19, train_loss: 0.9929, test_loss: 1.0977, test_f1: 0.4686
 epoch: 20, train_loss: 0.9944, test_loss: 1.1024, test_f1: 0.4724
 epoch: 21, train_loss: 0.9817, test_loss: 1.0900, test_f1: 0.4820
 epoch: 22, train_loss: 0.9772, test_loss: 1.0969, test_f1: 0.5021
 epoch: 23, train_loss: 0.9720, test_loss: 1.0959, test_f1: 0.4872
 epoch: 24, train_loss: 0.9765, test_loss: 1.0815, test_f1: 0.4900
 epoch: 25, train_loss: 0.9752, test_loss: 1.0857, test_f1: 0.4941
 epoch: 26, train_loss: 0.9495, test_loss: 1.0802, test_f1: 0.5110
 epoch: 27, train_loss: 0.9543, test_loss: 1.0840, test_f1: 0.5114
 epoch: 28, train_loss: 0.9491, test_loss: 1.0814, test_f1: 0.5119
 epoch: 29, train_loss: 0.9431, test_loss: 1.0758, test_f1: 0.5221
 epoch: 30, train_loss: 0.9457, test_loss: 1.0609, test_f1: 0.5274
 epoch: 31, train_loss: 0.9413, test_loss: 1.0810, test_f1: 0.5268
 epoch: 32, train_loss: 0.9271, test_loss: 1.0748, test_f1: 0.5282
 epoch: 33, train_loss: 0.9254, test_loss: 1.0673, test_f1: 0.5297
 epoch: 34, train_loss: 0.9153, test_loss: 1.0613, test_f1: 0.5285
 epoch: 35, train_loss: 0.9212, test_loss: 1.0439, test_f1: 0.5483
 epoch: 36, train_loss: 0.9089, test_loss: 1.1022, test_f1: 0.5288
 epoch: 37, train_loss: 0.9107, test_loss: 1.0869, test_f1: 0.5475
 epoch: 38, train_loss: 0.9002, test_loss: 1.0781, test_f1: 0.5412
 epoch: 39, train_loss: 0.9041, test_loss: 1.0768, test_f1: 0.5390
 epoch: 40, train_loss: 0.9070, test_loss: 1.1056, test_f1: 0.5412
 epoch: 41, train_loss: 0.9025, test_loss: 1.0735, test_f1: 0.5443
 epoch: 42, train_loss: 0.8855, test_loss: 1.0956, test_f1: 0.5467
 epoch: 43, train_loss: 0.8925, test_loss: 1.0694, test_f1: 0.5539
 epoch: 44, train_loss: 0.8779, test_loss: 1.0862, test_f1: 0.5593
 epoch: 45, train_loss: 0.8795, test_loss: 1.0704, test_f1: 0.5594
 epoch: 46, train_loss: 0.8789, test_loss: 1.0714, test_f1: 0.5523
 epoch: 47, train_loss: 0.8705, test_loss: 1.1124, test_f1: 0.5387
 epoch: 48, train_loss: 0.8748, test_loss: 1.0569, test_f1: 0.5569
 epoch: 49, train_loss: 0.8662, test_loss: 1.0546, test_f1: 0.5586
 epoch: 50, train_loss: 0.8570, test_loss: 1.0713, test_f1: 0.5493
 epoch: 51, train_loss: 0.8504, test_loss: 1.0813, test_f1: 0.5599
 epoch: 52, train_loss: 0.8543, test_loss: 1.0848, test_f1: 0.5410
 epoch: 53, train_loss: 0.8442, test_loss: 1.0790, test_f1: 0.5422
 epoch: 54, train_loss: 0.8501, test_loss: 1.0806, test_f1: 0.5398
 epoch: 55, train_loss: 0.8495, test_loss: 1.0680, test_f1: 0.5411
 epoch: 56, train_loss: 0.8451, test_loss: 1.0746, test_f1: 0.5564
 epoch: 57, train_loss: 0.8489, test_loss: 1.0891, test_f1: 0.5569
 epoch: 58, train_loss: 0.8512, test_loss: 1.0965, test_f1: 0.5595
 epoch: 59, train_loss: 0.8421, test_loss: 1.0909, test_f1: 0.5546
 epoch: 60, train_loss: 0.8486, test_loss: 1.0837, test_f1: 0.5629
 epoch: 61, train_loss: 0.8337, test_loss: 1.0817, test_f1: 0.5560
 epoch: 62, train_loss: 0.8377, test_loss: 1.0883, test_f1: 0.5524
 epoch: 63, train_loss: 0.8378, test_loss: 1.0854, test_f1: 0.5475
 epoch: 64, train_loss: 0.8280, test_loss: 1.0958, test_f1: 0.5549
 epoch: 65, train_loss: 0.8362, test_loss: 1.0959, test_f1: 0.5578
 epoch: 66, train_loss: 0.8248, test_loss: 1.0878, test_f1: 0.5580
 epoch: 67, train_loss: 0.8339, test_loss: 1.0978, test_f1: 0.5469
 epoch: 68, train_loss: 0.8385, test_loss: 1.0924, test_f1: 0.5487
 epoch: 69, train_loss: 0.8207, test_loss: 1.0671, test_f1: 0.5524
 epoch: 70, train_loss: 0.8264, test_loss: 1.0982, test_f1: 0.5461
 epoch: 71, train_loss: 0.8277, test_loss: 1.0666, test_f1: 0.5649
 epoch: 72, train_loss: 0.8316, test_loss: 1.0858, test_f1: 0.5524
 epoch: 73, train_loss: 0.8193, test_loss: 1.0937, test_f1: 0.5470
 epoch: 74, train_loss: 0.8155, test_loss: 1.1275, test_f1: 0.5543
 epoch: 75, train_loss: 0.8160, test_loss: 1.1145, test_f1: 0.5458
 epoch: 76, train_loss: 0.8196, test_loss: 1.0861, test_f1: 0.5421
 epoch: 77, train_loss: 0.8109, test_loss: 1.1025, test_f1: 0.5339
 epoch: 78, train_loss: 0.8109, test_loss: 1.1040, test_f1: 0.5366
 epoch: 79, train_loss: 0.8115, test_loss: 1.1207, test_f1: 0.5531
 epoch: 80, train_loss: 0.8016, test_loss: 1.1273, test_f1: 0.5477
 epoch: 81, train_loss: 0.8108, test_loss: 1.1185, test_f1: 0.5447
 epoch: 82, train_loss: 0.8062, test_loss: 1.1286, test_f1: 0.5393
 epoch: 83, train_loss: 0.8090, test_loss: 1.1036, test_f1: 0.5570
 epoch: 84, train_loss: 0.8010, test_loss: 1.0893, test_f1: 0.5523
 epoch: 85, train_loss: 0.8070, test_loss: 1.1164, test_f1: 0.5397
 epoch: 86, train_loss: 0.8080, test_loss: 1.1243, test_f1: 0.5360
 epoch: 87, train_loss: 0.7924, test_loss: 1.0769, test_f1: 0.5630
 epoch: 88, train_loss: 0.7993, test_loss: 1.0966, test_f1: 0.5587
 epoch: 89, train_loss: 0.7937, test_loss: 1.1299, test_f1: 0.5423
 epoch: 90, train_loss: 0.8016, test_loss: 1.1110, test_f1: 0.5517
 epoch: 91, train_loss: 0.7943, test_loss: 1.1076, test_f1: 0.5500
 epoch: 92, train_loss: 0.7905, test_loss: 1.0902, test_f1: 0.5561
 epoch: 93, train_loss: 0.7827, test_loss: 1.1210, test_f1: 0.5522
 epoch: 94, train_loss: 0.8031, test_loss: 1.0720, test_f1: 0.5613
 epoch: 95, train_loss: 0.7895, test_loss: 1.1058, test_f1: 0.5560
 epoch: 96, train_loss: 0.7829, test_loss: 1.0825, test_f1: 0.5487
 epoch: 97, train_loss: 0.7853, test_loss: 1.1182, test_f1: 0.5396
 epoch: 98, train_loss: 0.7923, test_loss: 1.1218, test_f1: 0.5426
 epoch: 99, train_loss: 0.7866, test_loss: 1.1249, test_f1: 0.5429
##################ITERATION #6 ****************************************
 epoch: 0, train_loss: 1.2562, test_loss: 1.3159, test_f1: 0.2281
 epoch: 1, train_loss: 1.1902, test_loss: 1.3140, test_f1: 0.2281
 epoch: 2, train_loss: 1.1595, test_loss: 1.2849, test_f1: 0.2413
 epoch: 3, train_loss: 1.1460, test_loss: 1.2572, test_f1: 0.2665
 epoch: 4, train_loss: 1.1251, test_loss: 1.2241, test_f1: 0.3016
 epoch: 5, train_loss: 1.1055, test_loss: 1.1957, test_f1: 0.3243
 epoch: 6, train_loss: 1.0959, test_loss: 1.1747, test_f1: 0.3670
 epoch: 7, train_loss: 1.0888, test_loss: 1.1577, test_f1: 0.3772
 epoch: 8, train_loss: 1.0754, test_loss: 1.1419, test_f1: 0.3862
 epoch: 9, train_loss: 1.0621, test_loss: 1.1239, test_f1: 0.3966
 epoch: 10, train_loss: 1.0574, test_loss: 1.1268, test_f1: 0.4197
 epoch: 11, train_loss: 1.0498, test_loss: 1.1104, test_f1: 0.4590
 epoch: 12, train_loss: 1.0489, test_loss: 1.1023, test_f1: 0.4562
 epoch: 13, train_loss: 1.0300, test_loss: 1.0935, test_f1: 0.4752
 epoch: 14, train_loss: 1.0249, test_loss: 1.0854, test_f1: 0.4769
 epoch: 15, train_loss: 1.0128, test_loss: 1.0781, test_f1: 0.4733
 epoch: 16, train_loss: 1.0062, test_loss: 1.0719, test_f1: 0.4869
 epoch: 17, train_loss: 1.0075, test_loss: 1.0679, test_f1: 0.4783
 epoch: 18, train_loss: 0.9955, test_loss: 1.0653, test_f1: 0.4709
 epoch: 19, train_loss: 0.9857, test_loss: 1.0623, test_f1: 0.4720
 epoch: 20, train_loss: 0.9806, test_loss: 1.0499, test_f1: 0.5062
 epoch: 21, train_loss: 0.9685, test_loss: 1.0503, test_f1: 0.4925
 epoch: 22, train_loss: 0.9750, test_loss: 1.0443, test_f1: 0.4995
 epoch: 23, train_loss: 0.9574, test_loss: 1.0464, test_f1: 0.4979
 epoch: 24, train_loss: 0.9649, test_loss: 1.0492, test_f1: 0.5006
 epoch: 25, train_loss: 0.9590, test_loss: 1.0351, test_f1: 0.5130
 epoch: 26, train_loss: 0.9463, test_loss: 1.0242, test_f1: 0.5130
 epoch: 27, train_loss: 0.9351, test_loss: 1.0239, test_f1: 0.5168
 epoch: 28, train_loss: 0.9401, test_loss: 1.0310, test_f1: 0.5177
 epoch: 29, train_loss: 0.9327, test_loss: 1.0339, test_f1: 0.5074
 epoch: 30, train_loss: 0.9398, test_loss: 1.0352, test_f1: 0.5224
 epoch: 31, train_loss: 0.9219, test_loss: 1.0257, test_f1: 0.5383
 epoch: 32, train_loss: 0.9223, test_loss: 1.0302, test_f1: 0.5250
 epoch: 33, train_loss: 0.9174, test_loss: 1.0117, test_f1: 0.5258
 epoch: 34, train_loss: 0.9016, test_loss: 1.0130, test_f1: 0.5405
 epoch: 35, train_loss: 0.9128, test_loss: 1.0228, test_f1: 0.5409
 epoch: 36, train_loss: 0.9081, test_loss: 1.0143, test_f1: 0.5375
 epoch: 37, train_loss: 0.8936, test_loss: 1.0164, test_f1: 0.5490
 epoch: 38, train_loss: 0.8936, test_loss: 1.0072, test_f1: 0.5360
 epoch: 39, train_loss: 0.8909, test_loss: 1.0088, test_f1: 0.5586
 epoch: 40, train_loss: 0.8946, test_loss: 1.0137, test_f1: 0.5563
 epoch: 41, train_loss: 0.8900, test_loss: 1.0183, test_f1: 0.5421
 epoch: 42, train_loss: 0.8929, test_loss: 1.0117, test_f1: 0.5608
 epoch: 43, train_loss: 0.8713, test_loss: 1.0050, test_f1: 0.5717
 epoch: 44, train_loss: 0.8825, test_loss: 1.0073, test_f1: 0.5708
 epoch: 45, train_loss: 0.8776, test_loss: 1.0026, test_f1: 0.5622
 epoch: 46, train_loss: 0.8785, test_loss: 0.9940, test_f1: 0.5773
 epoch: 47, train_loss: 0.8673, test_loss: 1.0125, test_f1: 0.5499
 epoch: 48, train_loss: 0.8596, test_loss: 1.0002, test_f1: 0.5708
 epoch: 49, train_loss: 0.8714, test_loss: 0.9821, test_f1: 0.5688
 epoch: 50, train_loss: 0.8656, test_loss: 0.9755, test_f1: 0.5527
 epoch: 51, train_loss: 0.8579, test_loss: 0.9851, test_f1: 0.5546
 epoch: 52, train_loss: 0.8596, test_loss: 1.0015, test_f1: 0.5557
 epoch: 53, train_loss: 0.8446, test_loss: 1.0124, test_f1: 0.5603
 epoch: 54, train_loss: 0.8476, test_loss: 1.0103, test_f1: 0.5544
 epoch: 55, train_loss: 0.8486, test_loss: 1.0102, test_f1: 0.5590
 epoch: 56, train_loss: 0.8451, test_loss: 1.0073, test_f1: 0.5534
 epoch: 57, train_loss: 0.8448, test_loss: 1.0030, test_f1: 0.5524
 epoch: 58, train_loss: 0.8387, test_loss: 0.9992, test_f1: 0.5591
 epoch: 59, train_loss: 0.8367, test_loss: 0.9903, test_f1: 0.5646
 epoch: 60, train_loss: 0.8260, test_loss: 1.0003, test_f1: 0.5702
 epoch: 61, train_loss: 0.8267, test_loss: 1.0141, test_f1: 0.5764
 epoch: 62, train_loss: 0.8378, test_loss: 0.9975, test_f1: 0.5701
 epoch: 63, train_loss: 0.8275, test_loss: 0.9958, test_f1: 0.5675
 epoch: 64, train_loss: 0.8264, test_loss: 0.9924, test_f1: 0.5774
 epoch: 65, train_loss: 0.8229, test_loss: 1.0095, test_f1: 0.5660
 epoch: 66, train_loss: 0.8201, test_loss: 0.9902, test_f1: 0.5745
 epoch: 67, train_loss: 0.8189, test_loss: 1.0104, test_f1: 0.5558
 epoch: 68, train_loss: 0.8260, test_loss: 0.9990, test_f1: 0.5648
 epoch: 69, train_loss: 0.8143, test_loss: 1.0055, test_f1: 0.5573
 epoch: 70, train_loss: 0.8290, test_loss: 0.9976, test_f1: 0.5626
 epoch: 71, train_loss: 0.8229, test_loss: 0.9993, test_f1: 0.5654
 epoch: 72, train_loss: 0.8126, test_loss: 0.9970, test_f1: 0.5662
 epoch: 73, train_loss: 0.8225, test_loss: 0.9944, test_f1: 0.5665
 epoch: 74, train_loss: 0.8147, test_loss: 1.0080, test_f1: 0.5658
 epoch: 75, train_loss: 0.8265, test_loss: 1.0056, test_f1: 0.5672
 epoch: 76, train_loss: 0.8152, test_loss: 1.0106, test_f1: 0.5581
 epoch: 77, train_loss: 0.8155, test_loss: 0.9967, test_f1: 0.5630
 epoch: 78, train_loss: 0.7993, test_loss: 0.9986, test_f1: 0.5619
 epoch: 79, train_loss: 0.8014, test_loss: 1.0135, test_f1: 0.5698
 epoch: 80, train_loss: 0.8086, test_loss: 1.0067, test_f1: 0.5696
 epoch: 81, train_loss: 0.8124, test_loss: 1.0206, test_f1: 0.5780
 epoch: 82, train_loss: 0.8013, test_loss: 0.9973, test_f1: 0.5696
 epoch: 83, train_loss: 0.8074, test_loss: 1.0058, test_f1: 0.5658
 epoch: 84, train_loss: 0.8124, test_loss: 1.0036, test_f1: 0.5565
 epoch: 85, train_loss: 0.7984, test_loss: 1.0050, test_f1: 0.5655
 epoch: 86, train_loss: 0.7909, test_loss: 1.0104, test_f1: 0.5473
 epoch: 87, train_loss: 0.8028, test_loss: 1.0193, test_f1: 0.5648
 epoch: 88, train_loss: 0.7883, test_loss: 1.0086, test_f1: 0.5611
 epoch: 89, train_loss: 0.7923, test_loss: 1.0299, test_f1: 0.5587
 epoch: 90, train_loss: 0.7871, test_loss: 1.0184, test_f1: 0.5595
 epoch: 91, train_loss: 0.7985, test_loss: 1.0212, test_f1: 0.5605
 epoch: 92, train_loss: 0.7823, test_loss: 1.0214, test_f1: 0.5713
 epoch: 93, train_loss: 0.7888, test_loss: 1.0351, test_f1: 0.5695
 epoch: 94, train_loss: 0.7827, test_loss: 1.0075, test_f1: 0.5635
 epoch: 95, train_loss: 0.7787, test_loss: 1.0052, test_f1: 0.5560
 epoch: 96, train_loss: 0.7891, test_loss: 0.9947, test_f1: 0.5518
 epoch: 97, train_loss: 0.7862, test_loss: 1.0152, test_f1: 0.5613
 epoch: 98, train_loss: 0.7750, test_loss: 1.0320, test_f1: 0.5745
 epoch: 99, train_loss: 0.7889, test_loss: 1.0040, test_f1: 0.5786
##################ITERATION #7 ****************************************
 epoch: 0, train_loss: 1.2605, test_loss: 1.3564, test_f1: 0.2281
 epoch: 1, train_loss: 1.1858, test_loss: 1.3206, test_f1: 0.2281
 epoch: 2, train_loss: 1.1666, test_loss: 1.2785, test_f1: 0.2444
 epoch: 3, train_loss: 1.1422, test_loss: 1.2545, test_f1: 0.2638
 epoch: 4, train_loss: 1.1302, test_loss: 1.2145, test_f1: 0.2627
 epoch: 5, train_loss: 1.1072, test_loss: 1.1900, test_f1: 0.3078
 epoch: 6, train_loss: 1.1051, test_loss: 1.1562, test_f1: 0.3910
 epoch: 7, train_loss: 1.0931, test_loss: 1.1305, test_f1: 0.4368
 epoch: 8, train_loss: 1.0664, test_loss: 1.1203, test_f1: 0.4564
 epoch: 9, train_loss: 1.0647, test_loss: 1.1053, test_f1: 0.4712
 epoch: 10, train_loss: 1.0551, test_loss: 1.0979, test_f1: 0.4747
 epoch: 11, train_loss: 1.0440, test_loss: 1.0888, test_f1: 0.4856
 epoch: 12, train_loss: 1.0372, test_loss: 1.0881, test_f1: 0.5010
 epoch: 13, train_loss: 1.0293, test_loss: 1.0796, test_f1: 0.5145
 epoch: 14, train_loss: 1.0211, test_loss: 1.0745, test_f1: 0.4977
 epoch: 15, train_loss: 1.0091, test_loss: 1.0645, test_f1: 0.4991
 epoch: 16, train_loss: 1.0029, test_loss: 1.0692, test_f1: 0.5023
 epoch: 17, train_loss: 1.0041, test_loss: 1.0501, test_f1: 0.5137
 epoch: 18, train_loss: 0.9926, test_loss: 1.0518, test_f1: 0.5147
 epoch: 19, train_loss: 0.9876, test_loss: 1.0570, test_f1: 0.5242
 epoch: 20, train_loss: 0.9749, test_loss: 1.0418, test_f1: 0.5096
 epoch: 21, train_loss: 0.9696, test_loss: 1.0357, test_f1: 0.5117
 epoch: 22, train_loss: 0.9683, test_loss: 1.0331, test_f1: 0.5232
 epoch: 23, train_loss: 0.9663, test_loss: 1.0444, test_f1: 0.5211
 epoch: 24, train_loss: 0.9604, test_loss: 1.0318, test_f1: 0.5177
 epoch: 25, train_loss: 0.9570, test_loss: 1.0284, test_f1: 0.5232
 epoch: 26, train_loss: 0.9499, test_loss: 1.0239, test_f1: 0.5135
 epoch: 27, train_loss: 0.9449, test_loss: 1.0223, test_f1: 0.5164
 epoch: 28, train_loss: 0.9402, test_loss: 1.0207, test_f1: 0.5212
 epoch: 29, train_loss: 0.9278, test_loss: 1.0161, test_f1: 0.5313
 epoch: 30, train_loss: 0.9359, test_loss: 1.0077, test_f1: 0.5243
 epoch: 31, train_loss: 0.9174, test_loss: 1.0038, test_f1: 0.5322
 epoch: 32, train_loss: 0.9351, test_loss: 1.0141, test_f1: 0.5284
 epoch: 33, train_loss: 0.9240, test_loss: 1.0074, test_f1: 0.5301
 epoch: 34, train_loss: 0.9033, test_loss: 1.0151, test_f1: 0.5263
 epoch: 35, train_loss: 0.9084, test_loss: 1.0238, test_f1: 0.5416
 epoch: 36, train_loss: 0.9161, test_loss: 1.0295, test_f1: 0.5300
 epoch: 37, train_loss: 0.9170, test_loss: 1.0098, test_f1: 0.5317
 epoch: 38, train_loss: 0.9067, test_loss: 1.0199, test_f1: 0.5358
 epoch: 39, train_loss: 0.9012, test_loss: 1.0126, test_f1: 0.5379
 epoch: 40, train_loss: 0.8954, test_loss: 1.0082, test_f1: 0.5300
 epoch: 41, train_loss: 0.8927, test_loss: 1.0192, test_f1: 0.5250
 epoch: 42, train_loss: 0.8900, test_loss: 0.9985, test_f1: 0.5329
 epoch: 43, train_loss: 0.8934, test_loss: 0.9834, test_f1: 0.5330
 epoch: 44, train_loss: 0.8894, test_loss: 0.9917, test_f1: 0.5336
 epoch: 45, train_loss: 0.8904, test_loss: 0.9937, test_f1: 0.5357
 epoch: 46, train_loss: 0.8777, test_loss: 0.9835, test_f1: 0.5399
 epoch: 47, train_loss: 0.8744, test_loss: 1.0080, test_f1: 0.5476
 epoch: 48, train_loss: 0.8628, test_loss: 1.0135, test_f1: 0.5349
 epoch: 49, train_loss: 0.8790, test_loss: 0.9839, test_f1: 0.5472
 epoch: 50, train_loss: 0.8697, test_loss: 0.9952, test_f1: 0.5424
 epoch: 51, train_loss: 0.8516, test_loss: 1.0047, test_f1: 0.5525
 epoch: 52, train_loss: 0.8555, test_loss: 0.9757, test_f1: 0.5486
 epoch: 53, train_loss: 0.8630, test_loss: 0.9972, test_f1: 0.5541
 epoch: 54, train_loss: 0.8565, test_loss: 1.0000, test_f1: 0.5403
 epoch: 55, train_loss: 0.8501, test_loss: 0.9996, test_f1: 0.5489
 epoch: 56, train_loss: 0.8443, test_loss: 1.0025, test_f1: 0.5598
 epoch: 57, train_loss: 0.8355, test_loss: 0.9950, test_f1: 0.5417
 epoch: 58, train_loss: 0.8484, test_loss: 0.9949, test_f1: 0.5381
 epoch: 59, train_loss: 0.8373, test_loss: 0.9957, test_f1: 0.5542
 epoch: 60, train_loss: 0.8355, test_loss: 0.9840, test_f1: 0.5629
 epoch: 61, train_loss: 0.8400, test_loss: 0.9936, test_f1: 0.5655
 epoch: 62, train_loss: 0.8327, test_loss: 0.9919, test_f1: 0.5539
 epoch: 63, train_loss: 0.8276, test_loss: 1.0027, test_f1: 0.5482
 epoch: 64, train_loss: 0.8336, test_loss: 0.9975, test_f1: 0.5520
 epoch: 65, train_loss: 0.8397, test_loss: 1.0062, test_f1: 0.5558
 epoch: 66, train_loss: 0.8356, test_loss: 1.0002, test_f1: 0.5569
 epoch: 67, train_loss: 0.8283, test_loss: 0.9930, test_f1: 0.5522
 epoch: 68, train_loss: 0.8453, test_loss: 1.0045, test_f1: 0.5575
 epoch: 69, train_loss: 0.8421, test_loss: 0.9978, test_f1: 0.5639
 epoch: 70, train_loss: 0.8222, test_loss: 0.9869, test_f1: 0.5627
 epoch: 71, train_loss: 0.8188, test_loss: 0.9858, test_f1: 0.5609
 epoch: 72, train_loss: 0.8111, test_loss: 0.9880, test_f1: 0.5517
 epoch: 73, train_loss: 0.8124, test_loss: 0.9901, test_f1: 0.5551
 epoch: 74, train_loss: 0.8217, test_loss: 0.9909, test_f1: 0.5557
 epoch: 75, train_loss: 0.8122, test_loss: 0.9904, test_f1: 0.5607
 epoch: 76, train_loss: 0.8220, test_loss: 0.9765, test_f1: 0.5599
 epoch: 77, train_loss: 0.8201, test_loss: 0.9738, test_f1: 0.5702
 epoch: 78, train_loss: 0.8136, test_loss: 0.9878, test_f1: 0.5726
 epoch: 79, train_loss: 0.8121, test_loss: 0.9999, test_f1: 0.5694
 epoch: 80, train_loss: 0.8192, test_loss: 0.9832, test_f1: 0.5711
 epoch: 81, train_loss: 0.8023, test_loss: 0.9876, test_f1: 0.5682
 epoch: 82, train_loss: 0.8214, test_loss: 0.9917, test_f1: 0.5678
 epoch: 83, train_loss: 0.8056, test_loss: 0.9940, test_f1: 0.5609
 epoch: 84, train_loss: 0.8117, test_loss: 0.9994, test_f1: 0.5704
 epoch: 85, train_loss: 0.8066, test_loss: 0.9931, test_f1: 0.5613
 epoch: 86, train_loss: 0.8073, test_loss: 0.9901, test_f1: 0.5745
 epoch: 87, train_loss: 0.8060, test_loss: 0.9894, test_f1: 0.5634
 epoch: 88, train_loss: 0.7951, test_loss: 0.9965, test_f1: 0.5622
 epoch: 89, train_loss: 0.8033, test_loss: 1.0006, test_f1: 0.5631
 epoch: 90, train_loss: 0.8091, test_loss: 0.9987, test_f1: 0.5556
 epoch: 91, train_loss: 0.7918, test_loss: 0.9872, test_f1: 0.5801
 epoch: 92, train_loss: 0.7910, test_loss: 0.9876, test_f1: 0.5689
 epoch: 93, train_loss: 0.8104, test_loss: 0.9936, test_f1: 0.5849
 epoch: 94, train_loss: 0.7941, test_loss: 1.0027, test_f1: 0.5848
 epoch: 95, train_loss: 0.7919, test_loss: 1.0087, test_f1: 0.5821
 epoch: 96, train_loss: 0.7910, test_loss: 0.9904, test_f1: 0.5730
 epoch: 97, train_loss: 0.7959, test_loss: 0.9888, test_f1: 0.5819
 epoch: 98, train_loss: 0.8018, test_loss: 0.9928, test_f1: 0.5830
 epoch: 99, train_loss: 0.7865, test_loss: 0.9922, test_f1: 0.5908
##################ITERATION #8 ****************************************
 epoch: 0, train_loss: 1.2968, test_loss: 1.3396, test_f1: 0.2416
 epoch: 1, train_loss: 1.2017, test_loss: 1.3060, test_f1: 0.2571
 epoch: 2, train_loss: 1.1574, test_loss: 1.2789, test_f1: 0.3506
 epoch: 3, train_loss: 1.1310, test_loss: 1.2372, test_f1: 0.4145
 epoch: 4, train_loss: 1.1229, test_loss: 1.2043, test_f1: 0.4104
 epoch: 5, train_loss: 1.0998, test_loss: 1.1787, test_f1: 0.4181
 epoch: 6, train_loss: 1.0932, test_loss: 1.1595, test_f1: 0.4485
 epoch: 7, train_loss: 1.0764, test_loss: 1.1319, test_f1: 0.4628
 epoch: 8, train_loss: 1.0615, test_loss: 1.1154, test_f1: 0.4719
 epoch: 9, train_loss: 1.0563, test_loss: 1.1158, test_f1: 0.4837
 epoch: 10, train_loss: 1.0377, test_loss: 1.1203, test_f1: 0.4596
 epoch: 11, train_loss: 1.0375, test_loss: 1.1098, test_f1: 0.4734
 epoch: 12, train_loss: 1.0148, test_loss: 1.0953, test_f1: 0.4776
 epoch: 13, train_loss: 1.0252, test_loss: 1.1039, test_f1: 0.4831
 epoch: 14, train_loss: 1.0124, test_loss: 1.0929, test_f1: 0.4828
 epoch: 15, train_loss: 0.9978, test_loss: 1.0752, test_f1: 0.4884
 epoch: 16, train_loss: 0.9964, test_loss: 1.0687, test_f1: 0.4786
 epoch: 17, train_loss: 0.9929, test_loss: 1.0687, test_f1: 0.5076
 epoch: 18, train_loss: 0.9887, test_loss: 1.0762, test_f1: 0.5100
 epoch: 19, train_loss: 0.9694, test_loss: 1.0695, test_f1: 0.5131
 epoch: 20, train_loss: 0.9694, test_loss: 1.0699, test_f1: 0.5107
 epoch: 21, train_loss: 0.9549, test_loss: 1.0644, test_f1: 0.5220
 epoch: 22, train_loss: 0.9626, test_loss: 1.0631, test_f1: 0.5246
 epoch: 23, train_loss: 0.9517, test_loss: 1.0733, test_f1: 0.5141
 epoch: 24, train_loss: 0.9358, test_loss: 1.0681, test_f1: 0.5324
 epoch: 25, train_loss: 0.9468, test_loss: 1.0717, test_f1: 0.5275
 epoch: 26, train_loss: 0.9459, test_loss: 1.0550, test_f1: 0.5355
 epoch: 27, train_loss: 0.9329, test_loss: 1.0431, test_f1: 0.5364
 epoch: 28, train_loss: 0.9206, test_loss: 1.0457, test_f1: 0.5386
 epoch: 29, train_loss: 0.9171, test_loss: 1.0561, test_f1: 0.5418
 epoch: 30, train_loss: 0.9163, test_loss: 1.0523, test_f1: 0.5434
 epoch: 31, train_loss: 0.9097, test_loss: 1.0555, test_f1: 0.5433
 epoch: 32, train_loss: 0.9085, test_loss: 1.0445, test_f1: 0.5438
 epoch: 33, train_loss: 0.8936, test_loss: 1.0678, test_f1: 0.5446
 epoch: 34, train_loss: 0.8933, test_loss: 1.0366, test_f1: 0.5522
 epoch: 35, train_loss: 0.8920, test_loss: 1.0512, test_f1: 0.5437
 epoch: 36, train_loss: 0.8938, test_loss: 1.0656, test_f1: 0.5429
 epoch: 37, train_loss: 0.8804, test_loss: 1.0417, test_f1: 0.5554
 epoch: 38, train_loss: 0.8830, test_loss: 1.0456, test_f1: 0.5464
 epoch: 39, train_loss: 0.8806, test_loss: 1.0556, test_f1: 0.5466
 epoch: 40, train_loss: 0.8745, test_loss: 1.0499, test_f1: 0.5382
 epoch: 41, train_loss: 0.8644, test_loss: 1.0928, test_f1: 0.5601
 epoch: 42, train_loss: 0.8511, test_loss: 1.0772, test_f1: 0.5661
 epoch: 43, train_loss: 0.8608, test_loss: 1.0710, test_f1: 0.5691
 epoch: 44, train_loss: 0.8549, test_loss: 1.0937, test_f1: 0.5640
 epoch: 45, train_loss: 0.8599, test_loss: 1.0757, test_f1: 0.5601
 epoch: 46, train_loss: 0.8380, test_loss: 1.0874, test_f1: 0.5631
 epoch: 47, train_loss: 0.8518, test_loss: 1.0805, test_f1: 0.5784
 epoch: 48, train_loss: 0.8402, test_loss: 1.1065, test_f1: 0.5718
 epoch: 49, train_loss: 0.8316, test_loss: 1.0803, test_f1: 0.5737
 epoch: 50, train_loss: 0.8209, test_loss: 1.0933, test_f1: 0.5755
 epoch: 51, train_loss: 0.8146, test_loss: 1.0811, test_f1: 0.5769
 epoch: 52, train_loss: 0.8279, test_loss: 1.0759, test_f1: 0.5671
 epoch: 53, train_loss: 0.8161, test_loss: 1.1046, test_f1: 0.5681
 epoch: 54, train_loss: 0.8244, test_loss: 1.0875, test_f1: 0.5643
 epoch: 55, train_loss: 0.8111, test_loss: 1.0915, test_f1: 0.5618
 epoch: 56, train_loss: 0.8049, test_loss: 1.0970, test_f1: 0.5696
 epoch: 57, train_loss: 0.8182, test_loss: 1.0955, test_f1: 0.5712
 epoch: 58, train_loss: 0.8151, test_loss: 1.1240, test_f1: 0.5664
 epoch: 59, train_loss: 0.8073, test_loss: 1.1002, test_f1: 0.5748
 epoch: 60, train_loss: 0.8267, test_loss: 1.0965, test_f1: 0.5715
 epoch: 61, train_loss: 0.8306, test_loss: 1.1157, test_f1: 0.5748
 epoch: 62, train_loss: 0.8060, test_loss: 1.1121, test_f1: 0.5753
 epoch: 63, train_loss: 0.8040, test_loss: 1.1146, test_f1: 0.5679
 epoch: 64, train_loss: 0.7845, test_loss: 1.1204, test_f1: 0.5705
 epoch: 65, train_loss: 0.7897, test_loss: 1.1175, test_f1: 0.5751
 epoch: 66, train_loss: 0.8024, test_loss: 1.1218, test_f1: 0.5747
 epoch: 67, train_loss: 0.7784, test_loss: 1.1459, test_f1: 0.5539
 epoch: 68, train_loss: 0.7974, test_loss: 1.1394, test_f1: 0.5645
 epoch: 69, train_loss: 0.7929, test_loss: 1.1236, test_f1: 0.5674
 epoch: 70, train_loss: 0.7955, test_loss: 1.1302, test_f1: 0.5705
 epoch: 71, train_loss: 0.7964, test_loss: 1.1218, test_f1: 0.5596
 epoch: 72, train_loss: 0.7804, test_loss: 1.1092, test_f1: 0.5691
 epoch: 73, train_loss: 0.8023, test_loss: 1.1034, test_f1: 0.5799
 epoch: 74, train_loss: 0.7852, test_loss: 1.0938, test_f1: 0.5689
 epoch: 75, train_loss: 0.7880, test_loss: 1.1027, test_f1: 0.5680
 epoch: 76, train_loss: 0.7846, test_loss: 1.1222, test_f1: 0.5745
 epoch: 77, train_loss: 0.7849, test_loss: 1.1426, test_f1: 0.5639
 epoch: 78, train_loss: 0.7734, test_loss: 1.1205, test_f1: 0.5796
 epoch: 79, train_loss: 0.7793, test_loss: 1.1230, test_f1: 0.5710
 epoch: 80, train_loss: 0.7806, test_loss: 1.1416, test_f1: 0.5746
 epoch: 81, train_loss: 0.7811, test_loss: 1.1478, test_f1: 0.5706
 epoch: 82, train_loss: 0.7749, test_loss: 1.1436, test_f1: 0.5824
 epoch: 83, train_loss: 0.7678, test_loss: 1.1382, test_f1: 0.5717
 epoch: 84, train_loss: 0.7713, test_loss: 1.1717, test_f1: 0.5682
 epoch: 85, train_loss: 0.7779, test_loss: 1.1589, test_f1: 0.5731
 epoch: 86, train_loss: 0.7759, test_loss: 1.1703, test_f1: 0.5688
 epoch: 87, train_loss: 0.7676, test_loss: 1.1737, test_f1: 0.5766
 epoch: 88, train_loss: 0.7681, test_loss: 1.1654, test_f1: 0.5581
 epoch: 89, train_loss: 0.7787, test_loss: 1.1666, test_f1: 0.5783
 epoch: 90, train_loss: 0.7688, test_loss: 1.1558, test_f1: 0.5829
 epoch: 91, train_loss: 0.7709, test_loss: 1.1680, test_f1: 0.5714
 epoch: 92, train_loss: 0.7620, test_loss: 1.1841, test_f1: 0.5669
 epoch: 93, train_loss: 0.7754, test_loss: 1.1598, test_f1: 0.5696
 epoch: 94, train_loss: 0.7673, test_loss: 1.1568, test_f1: 0.5811
 epoch: 95, train_loss: 0.7520, test_loss: 1.1908, test_f1: 0.5851
 epoch: 96, train_loss: 0.7609, test_loss: 1.2083, test_f1: 0.5679
 epoch: 97, train_loss: 0.7532, test_loss: 1.1585, test_f1: 0.5761
 epoch: 98, train_loss: 0.7658, test_loss: 1.2045, test_f1: 0.5682
 epoch: 99, train_loss: 0.7576, test_loss: 1.1730, test_f1: 0.5832
##################ITERATION #9 ****************************************
 epoch: 0, train_loss: 1.2886, test_loss: 1.3627, test_f1: 0.2281
 epoch: 1, train_loss: 1.1883, test_loss: 1.4665, test_f1: 0.0727
 epoch: 2, train_loss: 1.1711, test_loss: 1.4332, test_f1: 0.1173
 epoch: 3, train_loss: 1.1407, test_loss: 1.3381, test_f1: 0.2829
 epoch: 4, train_loss: 1.1198, test_loss: 1.2354, test_f1: 0.3621
 epoch: 5, train_loss: 1.1041, test_loss: 1.1897, test_f1: 0.3795
 epoch: 6, train_loss: 1.0870, test_loss: 1.1591, test_f1: 0.4366
 epoch: 7, train_loss: 1.0762, test_loss: 1.1396, test_f1: 0.4586
 epoch: 8, train_loss: 1.0634, test_loss: 1.1324, test_f1: 0.4831
 epoch: 9, train_loss: 1.0583, test_loss: 1.1277, test_f1: 0.5099
 epoch: 10, train_loss: 1.0313, test_loss: 1.1181, test_f1: 0.5086
 epoch: 11, train_loss: 1.0332, test_loss: 1.1045, test_f1: 0.5100
 epoch: 12, train_loss: 1.0219, test_loss: 1.1010, test_f1: 0.5031
 epoch: 13, train_loss: 1.0233, test_loss: 1.0910, test_f1: 0.5231
 epoch: 14, train_loss: 1.0069, test_loss: 1.0823, test_f1: 0.5246
 epoch: 15, train_loss: 0.9913, test_loss: 1.0824, test_f1: 0.5118
 epoch: 16, train_loss: 1.0006, test_loss: 1.0767, test_f1: 0.5180
 epoch: 17, train_loss: 0.9815, test_loss: 1.0655, test_f1: 0.5290
 epoch: 18, train_loss: 0.9813, test_loss: 1.0611, test_f1: 0.5368
 epoch: 19, train_loss: 0.9789, test_loss: 1.0571, test_f1: 0.5299
 epoch: 20, train_loss: 0.9756, test_loss: 1.0585, test_f1: 0.5267
 epoch: 21, train_loss: 0.9736, test_loss: 1.0603, test_f1: 0.5385
 epoch: 22, train_loss: 0.9558, test_loss: 1.0608, test_f1: 0.5291
 epoch: 23, train_loss: 0.9539, test_loss: 1.0505, test_f1: 0.5408
 epoch: 24, train_loss: 0.9362, test_loss: 1.0368, test_f1: 0.5339
 epoch: 25, train_loss: 0.9338, test_loss: 1.0293, test_f1: 0.5322
 epoch: 26, train_loss: 0.9328, test_loss: 1.0375, test_f1: 0.5393
 epoch: 27, train_loss: 0.9380, test_loss: 1.0393, test_f1: 0.5340
 epoch: 28, train_loss: 0.9261, test_loss: 1.0662, test_f1: 0.5447
 epoch: 29, train_loss: 0.9240, test_loss: 1.0504, test_f1: 0.5397
 epoch: 30, train_loss: 0.9144, test_loss: 1.0371, test_f1: 0.5488
 epoch: 31, train_loss: 0.9157, test_loss: 1.0354, test_f1: 0.5572
 epoch: 32, train_loss: 0.9111, test_loss: 1.0264, test_f1: 0.5528
 epoch: 33, train_loss: 0.9025, test_loss: 1.0322, test_f1: 0.5598
 epoch: 34, train_loss: 0.9005, test_loss: 1.0430, test_f1: 0.5619
 epoch: 35, train_loss: 0.8954, test_loss: 1.0328, test_f1: 0.5534
 epoch: 36, train_loss: 0.8904, test_loss: 1.0558, test_f1: 0.5561
 epoch: 37, train_loss: 0.8971, test_loss: 1.0459, test_f1: 0.5544
 epoch: 38, train_loss: 0.8749, test_loss: 1.0224, test_f1: 0.5696
 epoch: 39, train_loss: 0.8889, test_loss: 1.0204, test_f1: 0.5569
 epoch: 40, train_loss: 0.8678, test_loss: 1.0193, test_f1: 0.5423
 epoch: 41, train_loss: 0.8572, test_loss: 1.0234, test_f1: 0.5651
 epoch: 42, train_loss: 0.8635, test_loss: 1.0437, test_f1: 0.5670
 epoch: 43, train_loss: 0.8680, test_loss: 1.0340, test_f1: 0.5703
 epoch: 44, train_loss: 0.8568, test_loss: 1.0189, test_f1: 0.5716
 epoch: 45, train_loss: 0.8580, test_loss: 1.0217, test_f1: 0.5547
 epoch: 46, train_loss: 0.8533, test_loss: 1.0211, test_f1: 0.5635
 epoch: 47, train_loss: 0.8546, test_loss: 1.0199, test_f1: 0.5539
 epoch: 48, train_loss: 0.8534, test_loss: 1.0290, test_f1: 0.5685
 epoch: 49, train_loss: 0.8410, test_loss: 1.0280, test_f1: 0.5697
 epoch: 50, train_loss: 0.8321, test_loss: 1.0361, test_f1: 0.5793
 epoch: 51, train_loss: 0.8363, test_loss: 1.0425, test_f1: 0.5919
 epoch: 52, train_loss: 0.8401, test_loss: 1.0490, test_f1: 0.5675
 epoch: 53, train_loss: 0.8327, test_loss: 1.0396, test_f1: 0.5729
 epoch: 54, train_loss: 0.8328, test_loss: 1.0411, test_f1: 0.5613
 epoch: 55, train_loss: 0.8339, test_loss: 1.0379, test_f1: 0.5774
 epoch: 56, train_loss: 0.8148, test_loss: 1.0252, test_f1: 0.5645
 epoch: 57, train_loss: 0.8348, test_loss: 1.0336, test_f1: 0.5721
 epoch: 58, train_loss: 0.8247, test_loss: 1.0392, test_f1: 0.5795
 epoch: 59, train_loss: 0.8209, test_loss: 1.0390, test_f1: 0.5872
 epoch: 60, train_loss: 0.8273, test_loss: 1.0451, test_f1: 0.5859
 epoch: 61, train_loss: 0.8333, test_loss: 1.0498, test_f1: 0.5830
 epoch: 62, train_loss: 0.8170, test_loss: 1.0470, test_f1: 0.5809
 epoch: 63, train_loss: 0.8217, test_loss: 1.0481, test_f1: 0.5875
 epoch: 64, train_loss: 0.8043, test_loss: 1.0324, test_f1: 0.5772
 epoch: 65, train_loss: 0.8086, test_loss: 1.0409, test_f1: 0.5855
 epoch: 66, train_loss: 0.8154, test_loss: 1.0321, test_f1: 0.5804
 epoch: 67, train_loss: 0.8142, test_loss: 1.0362, test_f1: 0.5844
 epoch: 68, train_loss: 0.8016, test_loss: 1.0504, test_f1: 0.5640
 epoch: 69, train_loss: 0.8121, test_loss: 1.0577, test_f1: 0.5765
 epoch: 70, train_loss: 0.8009, test_loss: 1.0552, test_f1: 0.5684
 epoch: 71, train_loss: 0.8072, test_loss: 1.0463, test_f1: 0.5807
 epoch: 72, train_loss: 0.8046, test_loss: 1.0660, test_f1: 0.5555
 epoch: 73, train_loss: 0.8063, test_loss: 1.0632, test_f1: 0.5809
 epoch: 74, train_loss: 0.8077, test_loss: 1.0578, test_f1: 0.5856
 epoch: 75, train_loss: 0.8002, test_loss: 1.0644, test_f1: 0.5746
 epoch: 76, train_loss: 0.7869, test_loss: 1.0588, test_f1: 0.5754
 epoch: 77, train_loss: 0.7831, test_loss: 1.0505, test_f1: 0.5835
 epoch: 78, train_loss: 0.8029, test_loss: 1.0637, test_f1: 0.5842
 epoch: 79, train_loss: 0.7847, test_loss: 1.0740, test_f1: 0.5726
 epoch: 80, train_loss: 0.8030, test_loss: 1.0676, test_f1: 0.5889
 epoch: 81, train_loss: 0.7860, test_loss: 1.0550, test_f1: 0.5785
 epoch: 82, train_loss: 0.7921, test_loss: 1.0623, test_f1: 0.5938
 epoch: 83, train_loss: 0.7977, test_loss: 1.0589, test_f1: 0.5876
 epoch: 84, train_loss: 0.7853, test_loss: 1.0490, test_f1: 0.5970
 epoch: 85, train_loss: 0.7879, test_loss: 1.0513, test_f1: 0.5891
 epoch: 86, train_loss: 0.7864, test_loss: 1.0523, test_f1: 0.5965
 epoch: 87, train_loss: 0.7812, test_loss: 1.0710, test_f1: 0.5734
 epoch: 88, train_loss: 0.7786, test_loss: 1.0725, test_f1: 0.5854
 epoch: 89, train_loss: 0.7799, test_loss: 1.0750, test_f1: 0.5917
 epoch: 90, train_loss: 0.7789, test_loss: 1.0721, test_f1: 0.5814
 epoch: 91, train_loss: 0.7741, test_loss: 1.0738, test_f1: 0.5831
 epoch: 92, train_loss: 0.7747, test_loss: 1.0926, test_f1: 0.5758
 epoch: 93, train_loss: 0.7716, test_loss: 1.0693, test_f1: 0.5905
 epoch: 94, train_loss: 0.7733, test_loss: 1.0632, test_f1: 0.5816
 epoch: 95, train_loss: 0.7665, test_loss: 1.0786, test_f1: 0.5763
 epoch: 96, train_loss: 0.7639, test_loss: 1.0714, test_f1: 0.5863
 epoch: 97, train_loss: 0.7697, test_loss: 1.0683, test_f1: 0.5875
 epoch: 98, train_loss: 0.7710, test_loss: 1.0624, test_f1: 0.5904
 epoch: 99, train_loss: 0.7755, test_loss: 1.0644, test_f1: 0.5878

Training completed in 371.55 seconds
Best F1: 0.5970 at epoch 84
Mean F1 across iterations: 0.5788  0.0130
========================FINAL RESULTS================================
FEGIN weighted F1: 0.5970  0.0130
python main.py --data ltspice_demos --representation component_net --model FEGIN --layers 5 --hiddens 64 --batch_size 128 --lr 0.0001 --emb_size 512 --epochs 100 --save_appendix component_net_L5_H64_BS128_LR0.0001_E512 --no_val
-----



STDERR:
  File "main.py", line 370, in <module>
    main()
  File "main.py", line 254, in main
    dataset = dataset_class(
  File "/home/philip/projects/ltspice_examples_code_repo/Circuit-Completion-Using-GNNs/component_classification_with_link_prediction_head/evaluation/FEGIN/kernel/circuit_datasets.py", line 15, in __init__
    self.data, self.slices = torch.load(self.processed_paths[0])
  File "/home/philip/.local/lib/python3.8/site-packages/torch/serialization.py", line 1040, in load
    warnings.warn(
  File "/usr/lib/python3.8/warnings.py", line 109, in _showwarnmsg
    sw(msg.message, msg.category, msg.filename, msg.lineno,
  File "main.py", line 47, in warn_with_traceback
    traceback.print_stack(file=log)
/home/philip/projects/ltspice_examples_code_repo/Circuit-Completion-Using-GNNs/component_classification_with_link_prediction_head/evaluation/FEGIN/kernel/circuit_datasets.py:15: FutureWarning: You are using `torch.load` with `weights_only=False` (the current default value), which uses the default pickle module implicitly. It is possible to construct malicious pickle data which will execute arbitrary code during unpickling (See https://github.com/pytorch/pytorch/blob/main/SECURITY.md#untrusted-models for more details). In a future release, the default value for `weights_only` will be flipped to `True`. This limits the functions that could be executed during unpickling. Arbitrary objects will no longer be allowed to be loaded via this mode unless they are explicitly allowlisted by the user via `torch.serialization.add_safe_globals`. We recommend you start setting `weights_only=True` for any use case where you don't have full control of the loaded file. Please open an issue on GitHub for any issues related to this experimental feature.
  self.data, self.slices = torch.load(self.processed_paths[0])
