STDOUT:
Results will be saved in /home/philip/projects/ltspice_examples_code_repo/Circuit-Completion-Using-GNNs/component_classification_with_link_prediction_head/evaluation/FEGIN/results/model_FEGIN_dataset_ltspice_demos
Command line input: python main.py --data ltspice_demos --representation component_pin_net --model FEGIN --layers 3 --hiddens 16 --batch_size 128 --lr 0.001 --emb_size 128 --epochs 100 --save_appendix component_pin_net_L3_H16_BS128_LR0.001_E128 --no_val
 is saved.
-----
ltspice_demos - FEGIN
Using 3 layers, 16 hidden units, h = 2
Loading component_pin_net representation dataset
ENTERED
Training FEGIN on component_pin_net representation
Train: 1565, Test: 383
##################ITERATION #0 ****************************************
 epoch: 0, train_loss: 1.3673, test_loss: 1.3598, test_f1: 0.2281
 epoch: 1, train_loss: 1.3508, test_loss: 1.3531, test_f1: 0.2281
 epoch: 2, train_loss: 1.3393, test_loss: 1.3460, test_f1: 0.2281
 epoch: 3, train_loss: 1.3249, test_loss: 1.3370, test_f1: 0.2281
 epoch: 4, train_loss: 1.3094, test_loss: 1.3161, test_f1: 0.2281
 epoch: 5, train_loss: 1.2879, test_loss: 1.2917, test_f1: 0.2285
 epoch: 6, train_loss: 1.2618, test_loss: 1.2681, test_f1: 0.2306
 epoch: 7, train_loss: 1.2314, test_loss: 1.2455, test_f1: 0.2360
 epoch: 8, train_loss: 1.1971, test_loss: 1.2225, test_f1: 0.2644
 epoch: 9, train_loss: 1.1662, test_loss: 1.1953, test_f1: 0.3150
 epoch: 10, train_loss: 1.1320, test_loss: 1.1595, test_f1: 0.3503
 epoch: 11, train_loss: 1.1004, test_loss: 1.1377, test_f1: 0.3772
 epoch: 12, train_loss: 1.0663, test_loss: 1.1184, test_f1: 0.4063
 epoch: 13, train_loss: 1.0574, test_loss: 1.1021, test_f1: 0.3850
 epoch: 14, train_loss: 1.0328, test_loss: 1.0918, test_f1: 0.3506
 epoch: 15, train_loss: 1.0274, test_loss: 1.1025, test_f1: 0.3506
 epoch: 16, train_loss: 1.0264, test_loss: 1.0835, test_f1: 0.3574
 epoch: 17, train_loss: 1.0069, test_loss: 1.0791, test_f1: 0.3562
 epoch: 18, train_loss: 0.9919, test_loss: 1.0812, test_f1: 0.4149
 epoch: 19, train_loss: 0.9923, test_loss: 1.0688, test_f1: 0.4200
 epoch: 20, train_loss: 0.9922, test_loss: 1.0880, test_f1: 0.4291
 epoch: 21, train_loss: 0.9859, test_loss: 1.0848, test_f1: 0.3891
 epoch: 22, train_loss: 0.9852, test_loss: 1.0741, test_f1: 0.4175
 epoch: 23, train_loss: 0.9746, test_loss: 1.0623, test_f1: 0.3644
 epoch: 24, train_loss: 0.9731, test_loss: 1.0885, test_f1: 0.4481
 epoch: 25, train_loss: 0.9674, test_loss: 1.0720, test_f1: 0.3997
 epoch: 26, train_loss: 0.9658, test_loss: 1.0657, test_f1: 0.3928
 epoch: 27, train_loss: 0.9574, test_loss: 1.0657, test_f1: 0.4526
 epoch: 28, train_loss: 0.9583, test_loss: 1.1020, test_f1: 0.4434
 epoch: 29, train_loss: 0.9544, test_loss: 1.0572, test_f1: 0.4476
 epoch: 30, train_loss: 0.9496, test_loss: 1.0607, test_f1: 0.4524
 epoch: 31, train_loss: 0.9532, test_loss: 1.0809, test_f1: 0.4484
 epoch: 32, train_loss: 0.9474, test_loss: 1.0855, test_f1: 0.4588
 epoch: 33, train_loss: 0.9390, test_loss: 1.0600, test_f1: 0.4699
 epoch: 34, train_loss: 0.9502, test_loss: 1.0629, test_f1: 0.4647
 epoch: 35, train_loss: 0.9350, test_loss: 1.0602, test_f1: 0.4461
 epoch: 36, train_loss: 0.9261, test_loss: 1.0940, test_f1: 0.4487
 epoch: 37, train_loss: 0.9319, test_loss: 1.0437, test_f1: 0.4294
 epoch: 38, train_loss: 0.9262, test_loss: 1.0599, test_f1: 0.3304
 epoch: 39, train_loss: 0.9301, test_loss: 1.0535, test_f1: 0.4793
 epoch: 40, train_loss: 0.9422, test_loss: 1.0668, test_f1: 0.4078
 epoch: 41, train_loss: 0.9205, test_loss: 1.0853, test_f1: 0.4626
 epoch: 42, train_loss: 0.9224, test_loss: 1.1086, test_f1: 0.4664
 epoch: 43, train_loss: 0.9113, test_loss: 1.0695, test_f1: 0.5225
 epoch: 44, train_loss: 0.9170, test_loss: 1.0890, test_f1: 0.5159
 epoch: 45, train_loss: 0.9037, test_loss: 1.0731, test_f1: 0.5117
 epoch: 46, train_loss: 0.8979, test_loss: 1.1057, test_f1: 0.5133
 epoch: 47, train_loss: 0.9221, test_loss: 1.0577, test_f1: 0.5158
 epoch: 48, train_loss: 0.9014, test_loss: 1.1234, test_f1: 0.4720
 epoch: 49, train_loss: 0.9031, test_loss: 1.0890, test_f1: 0.5550
 epoch: 50, train_loss: 0.8965, test_loss: 1.0695, test_f1: 0.5472
 epoch: 51, train_loss: 0.8957, test_loss: 1.0965, test_f1: 0.5050
 epoch: 52, train_loss: 0.8836, test_loss: 1.1224, test_f1: 0.5125
 epoch: 53, train_loss: 0.8940, test_loss: 1.0874, test_f1: 0.5523
 epoch: 54, train_loss: 0.8900, test_loss: 1.0724, test_f1: 0.5638
 epoch: 55, train_loss: 0.8915, test_loss: 1.0812, test_f1: 0.5561
 epoch: 56, train_loss: 0.8822, test_loss: 1.0666, test_f1: 0.5575
 epoch: 57, train_loss: 0.8858, test_loss: 1.0770, test_f1: 0.5342
 epoch: 58, train_loss: 0.8865, test_loss: 1.0748, test_f1: 0.5311
 epoch: 59, train_loss: 0.8788, test_loss: 1.1088, test_f1: 0.5320
 epoch: 60, train_loss: 0.8838, test_loss: 1.0912, test_f1: 0.5391
 epoch: 61, train_loss: 0.8837, test_loss: 1.1040, test_f1: 0.5412
 epoch: 62, train_loss: 0.8708, test_loss: 1.0779, test_f1: 0.5266
 epoch: 63, train_loss: 0.8775, test_loss: 1.0638, test_f1: 0.4987
 epoch: 64, train_loss: 0.8713, test_loss: 1.1166, test_f1: 0.5482
 epoch: 65, train_loss: 0.8743, test_loss: 1.1001, test_f1: 0.5471
 epoch: 66, train_loss: 0.8711, test_loss: 1.1080, test_f1: 0.5857
 epoch: 67, train_loss: 0.8763, test_loss: 1.0835, test_f1: 0.5528
 epoch: 68, train_loss: 0.8633, test_loss: 1.1010, test_f1: 0.5560
 epoch: 69, train_loss: 0.8707, test_loss: 1.0636, test_f1: 0.5421
 epoch: 70, train_loss: 0.8749, test_loss: 1.0594, test_f1: 0.5790
 epoch: 71, train_loss: 0.8558, test_loss: 1.0946, test_f1: 0.5512
 epoch: 72, train_loss: 0.8446, test_loss: 1.1316, test_f1: 0.5688
 epoch: 73, train_loss: 0.8635, test_loss: 1.0834, test_f1: 0.5416
 epoch: 74, train_loss: 0.8559, test_loss: 1.0862, test_f1: 0.5390
 epoch: 75, train_loss: 0.8626, test_loss: 1.1123, test_f1: 0.5805
 epoch: 76, train_loss: 0.8589, test_loss: 1.1109, test_f1: 0.5409
 epoch: 77, train_loss: 0.8603, test_loss: 1.1675, test_f1: 0.5706
 epoch: 78, train_loss: 0.8531, test_loss: 1.0768, test_f1: 0.5591
 epoch: 79, train_loss: 0.8570, test_loss: 1.1006, test_f1: 0.5389
 epoch: 80, train_loss: 0.8543, test_loss: 1.1186, test_f1: 0.5696
 epoch: 81, train_loss: 0.8540, test_loss: 1.1172, test_f1: 0.5744
 epoch: 82, train_loss: 0.8402, test_loss: 1.0887, test_f1: 0.5483
 epoch: 83, train_loss: 0.8410, test_loss: 1.0753, test_f1: 0.5366
 epoch: 84, train_loss: 0.8408, test_loss: 1.1035, test_f1: 0.5741
 epoch: 85, train_loss: 0.8555, test_loss: 1.0844, test_f1: 0.5403
 epoch: 86, train_loss: 0.8380, test_loss: 1.1384, test_f1: 0.5755
 epoch: 87, train_loss: 0.8428, test_loss: 1.1123, test_f1: 0.5523
 epoch: 88, train_loss: 0.8487, test_loss: 1.1028, test_f1: 0.5372
 epoch: 89, train_loss: 0.8566, test_loss: 1.1268, test_f1: 0.5478
 epoch: 90, train_loss: 0.8472, test_loss: 1.0971, test_f1: 0.5729
 epoch: 91, train_loss: 0.8366, test_loss: 1.0776, test_f1: 0.5452
 epoch: 92, train_loss: 0.8368, test_loss: 1.1181, test_f1: 0.5637
 epoch: 93, train_loss: 0.8397, test_loss: 1.1063, test_f1: 0.5573
 epoch: 94, train_loss: 0.8298, test_loss: 1.1251, test_f1: 0.5584
 epoch: 95, train_loss: 0.8299, test_loss: 1.1777, test_f1: 0.5616
 epoch: 96, train_loss: 0.8229, test_loss: 1.1365, test_f1: 0.5488
 epoch: 97, train_loss: 0.8377, test_loss: 1.1382, test_f1: 0.5523
 epoch: 98, train_loss: 0.8234, test_loss: 1.1167, test_f1: 0.5591
 epoch: 99, train_loss: 0.8363, test_loss: 1.0972, test_f1: 0.5455
##################ITERATION #1 ****************************************
 epoch: 0, train_loss: 1.3709, test_loss: 1.3575, test_f1: 0.0507
 epoch: 1, train_loss: 1.3014, test_loss: 1.3351, test_f1: 0.2281
 epoch: 2, train_loss: 1.2594, test_loss: 1.3038, test_f1: 0.2281
 epoch: 3, train_loss: 1.2270, test_loss: 1.2785, test_f1: 0.2281
 epoch: 4, train_loss: 1.1978, test_loss: 1.2486, test_f1: 0.2720
 epoch: 5, train_loss: 1.1676, test_loss: 1.2144, test_f1: 0.3196
 epoch: 6, train_loss: 1.1325, test_loss: 1.1885, test_f1: 0.3676
 epoch: 7, train_loss: 1.1139, test_loss: 1.1733, test_f1: 0.3739
 epoch: 8, train_loss: 1.0965, test_loss: 1.1587, test_f1: 0.3712
 epoch: 9, train_loss: 1.0851, test_loss: 1.1499, test_f1: 0.3625
 epoch: 10, train_loss: 1.0675, test_loss: 1.1538, test_f1: 0.4381
 epoch: 11, train_loss: 1.0596, test_loss: 1.1321, test_f1: 0.4076
 epoch: 12, train_loss: 1.0477, test_loss: 1.1284, test_f1: 0.4258
 epoch: 13, train_loss: 1.0351, test_loss: 1.1212, test_f1: 0.4224
 epoch: 14, train_loss: 1.0226, test_loss: 1.1003, test_f1: 0.4200
 epoch: 15, train_loss: 1.0176, test_loss: 1.1041, test_f1: 0.4158
 epoch: 16, train_loss: 1.0157, test_loss: 1.0895, test_f1: 0.4173
 epoch: 17, train_loss: 1.0099, test_loss: 1.0895, test_f1: 0.4210
 epoch: 18, train_loss: 1.0075, test_loss: 1.0831, test_f1: 0.4172
 epoch: 19, train_loss: 1.0022, test_loss: 1.0849, test_f1: 0.4241
 epoch: 20, train_loss: 0.9847, test_loss: 1.0831, test_f1: 0.4215
 epoch: 21, train_loss: 0.9860, test_loss: 1.0729, test_f1: 0.4286
 epoch: 22, train_loss: 0.9820, test_loss: 1.0706, test_f1: 0.4241
 epoch: 23, train_loss: 0.9781, test_loss: 1.0616, test_f1: 0.4236
 epoch: 24, train_loss: 0.9780, test_loss: 1.0557, test_f1: 0.4259
 epoch: 25, train_loss: 0.9645, test_loss: 1.0855, test_f1: 0.4539
 epoch: 26, train_loss: 0.9705, test_loss: 1.0593, test_f1: 0.4350
 epoch: 27, train_loss: 0.9666, test_loss: 1.0652, test_f1: 0.4415
 epoch: 28, train_loss: 0.9577, test_loss: 1.0560, test_f1: 0.4306
 epoch: 29, train_loss: 0.9507, test_loss: 1.0562, test_f1: 0.4390
 epoch: 30, train_loss: 0.9511, test_loss: 1.0625, test_f1: 0.4710
 epoch: 31, train_loss: 0.9575, test_loss: 1.0804, test_f1: 0.4584
 epoch: 32, train_loss: 0.9449, test_loss: 1.0856, test_f1: 0.4572
 epoch: 33, train_loss: 0.9400, test_loss: 1.1043, test_f1: 0.4498
 epoch: 34, train_loss: 0.9416, test_loss: 1.0737, test_f1: 0.5182
 epoch: 35, train_loss: 0.9343, test_loss: 1.0517, test_f1: 0.5447
 epoch: 36, train_loss: 0.9364, test_loss: 1.0573, test_f1: 0.5240
 epoch: 37, train_loss: 0.9295, test_loss: 1.0424, test_f1: 0.5396
 epoch: 38, train_loss: 0.9238, test_loss: 1.0744, test_f1: 0.5453
 epoch: 39, train_loss: 0.9280, test_loss: 1.0542, test_f1: 0.5396
 epoch: 40, train_loss: 0.9212, test_loss: 1.0511, test_f1: 0.5299
 epoch: 41, train_loss: 0.9210, test_loss: 1.0667, test_f1: 0.5595
 epoch: 42, train_loss: 0.9097, test_loss: 1.0718, test_f1: 0.5762
 epoch: 43, train_loss: 0.9155, test_loss: 1.0575, test_f1: 0.5770
 epoch: 44, train_loss: 0.9062, test_loss: 1.0612, test_f1: 0.5556
 epoch: 45, train_loss: 0.9001, test_loss: 1.0454, test_f1: 0.5559
 epoch: 46, train_loss: 0.8929, test_loss: 1.0738, test_f1: 0.5763
 epoch: 47, train_loss: 0.8932, test_loss: 1.0882, test_f1: 0.5708
 epoch: 48, train_loss: 0.8950, test_loss: 1.0635, test_f1: 0.5761
 epoch: 49, train_loss: 0.8854, test_loss: 1.0735, test_f1: 0.5732
 epoch: 50, train_loss: 0.8784, test_loss: 1.0862, test_f1: 0.5582
 epoch: 51, train_loss: 0.8866, test_loss: 1.0648, test_f1: 0.5659
 epoch: 52, train_loss: 0.8693, test_loss: 1.0627, test_f1: 0.5739
 epoch: 53, train_loss: 0.8679, test_loss: 1.0861, test_f1: 0.5807
 epoch: 54, train_loss: 0.8719, test_loss: 1.0846, test_f1: 0.5809
 epoch: 55, train_loss: 0.8741, test_loss: 1.0793, test_f1: 0.5682
 epoch: 56, train_loss: 0.8701, test_loss: 1.0693, test_f1: 0.5891
 epoch: 57, train_loss: 0.8524, test_loss: 1.0893, test_f1: 0.5710
 epoch: 58, train_loss: 0.8549, test_loss: 1.0715, test_f1: 0.5856
 epoch: 59, train_loss: 0.8638, test_loss: 1.0827, test_f1: 0.5831
 epoch: 60, train_loss: 0.8617, test_loss: 1.0641, test_f1: 0.5694
 epoch: 61, train_loss: 0.8399, test_loss: 1.0747, test_f1: 0.5825
 epoch: 62, train_loss: 0.8497, test_loss: 1.1086, test_f1: 0.5674
 epoch: 63, train_loss: 0.8517, test_loss: 1.0870, test_f1: 0.5718
 epoch: 64, train_loss: 0.8541, test_loss: 1.0847, test_f1: 0.5893
 epoch: 65, train_loss: 0.8451, test_loss: 1.0690, test_f1: 0.5719
 epoch: 66, train_loss: 0.8521, test_loss: 1.0771, test_f1: 0.5915
 epoch: 67, train_loss: 0.8488, test_loss: 1.0863, test_f1: 0.5724
 epoch: 68, train_loss: 0.8405, test_loss: 1.0682, test_f1: 0.5818
 epoch: 69, train_loss: 0.8482, test_loss: 1.0582, test_f1: 0.5737
 epoch: 70, train_loss: 0.8419, test_loss: 1.0822, test_f1: 0.5766
 epoch: 71, train_loss: 0.8303, test_loss: 1.0821, test_f1: 0.5861
 epoch: 72, train_loss: 0.8215, test_loss: 1.0676, test_f1: 0.5668
 epoch: 73, train_loss: 0.8330, test_loss: 1.0858, test_f1: 0.5786
 epoch: 74, train_loss: 0.8196, test_loss: 1.0878, test_f1: 0.5931
 epoch: 75, train_loss: 0.8362, test_loss: 1.0807, test_f1: 0.5918
 epoch: 76, train_loss: 0.8328, test_loss: 1.0815, test_f1: 0.5951
 epoch: 77, train_loss: 0.8326, test_loss: 1.0827, test_f1: 0.5821
 epoch: 78, train_loss: 0.8200, test_loss: 1.0683, test_f1: 0.5955
 epoch: 79, train_loss: 0.8302, test_loss: 1.0596, test_f1: 0.5895
 epoch: 80, train_loss: 0.8192, test_loss: 1.0886, test_f1: 0.5778
 epoch: 81, train_loss: 0.8147, test_loss: 1.0762, test_f1: 0.5762
 epoch: 82, train_loss: 0.8211, test_loss: 1.0660, test_f1: 0.5851
 epoch: 83, train_loss: 0.8206, test_loss: 1.0694, test_f1: 0.5944
 epoch: 84, train_loss: 0.8117, test_loss: 1.0732, test_f1: 0.5808
 epoch: 85, train_loss: 0.8158, test_loss: 1.1003, test_f1: 0.5876
 epoch: 86, train_loss: 0.8141, test_loss: 1.0629, test_f1: 0.5853
 epoch: 87, train_loss: 0.8247, test_loss: 1.0743, test_f1: 0.5925
 epoch: 88, train_loss: 0.8225, test_loss: 1.0651, test_f1: 0.5736
 epoch: 89, train_loss: 0.8149, test_loss: 1.0743, test_f1: 0.5900
 epoch: 90, train_loss: 0.8096, test_loss: 1.0611, test_f1: 0.5880
 epoch: 91, train_loss: 0.7967, test_loss: 1.0617, test_f1: 0.5878
 epoch: 92, train_loss: 0.8041, test_loss: 1.0775, test_f1: 0.5934
 epoch: 93, train_loss: 0.8084, test_loss: 1.0940, test_f1: 0.5922
 epoch: 94, train_loss: 0.7752, test_loss: 1.0599, test_f1: 0.5969
 epoch: 95, train_loss: 0.7874, test_loss: 1.0914, test_f1: 0.5816
 epoch: 96, train_loss: 0.7972, test_loss: 1.0861, test_f1: 0.5895
 epoch: 97, train_loss: 0.7935, test_loss: 1.0811, test_f1: 0.5867
 epoch: 98, train_loss: 0.8194, test_loss: 1.0806, test_f1: 0.5711
 epoch: 99, train_loss: 0.7993, test_loss: 1.0898, test_f1: 0.5669
##################ITERATION #2 ****************************************
 epoch: 0, train_loss: 1.3989, test_loss: 1.3879, test_f1: 0.0507
 epoch: 1, train_loss: 1.2654, test_loss: 1.3346, test_f1: 0.2281
 epoch: 2, train_loss: 1.2184, test_loss: 1.3243, test_f1: 0.2281
 epoch: 3, train_loss: 1.1652, test_loss: 1.3106, test_f1: 0.2281
 epoch: 4, train_loss: 1.1317, test_loss: 1.2198, test_f1: 0.2491
 epoch: 5, train_loss: 1.0919, test_loss: 1.1250, test_f1: 0.3317
 epoch: 6, train_loss: 1.0689, test_loss: 1.0988, test_f1: 0.3346
 epoch: 7, train_loss: 1.0416, test_loss: 1.0893, test_f1: 0.3370
 epoch: 8, train_loss: 1.0335, test_loss: 1.0834, test_f1: 0.3616
 epoch: 9, train_loss: 1.0212, test_loss: 1.0599, test_f1: 0.3735
 epoch: 10, train_loss: 1.0072, test_loss: 1.0686, test_f1: 0.4468
 epoch: 11, train_loss: 0.9858, test_loss: 1.0846, test_f1: 0.4726
 epoch: 12, train_loss: 0.9762, test_loss: 1.0672, test_f1: 0.5002
 epoch: 13, train_loss: 0.9739, test_loss: 1.0516, test_f1: 0.5038
 epoch: 14, train_loss: 0.9724, test_loss: 1.0611, test_f1: 0.5012
 epoch: 15, train_loss: 0.9623, test_loss: 1.0545, test_f1: 0.5102
 epoch: 16, train_loss: 0.9543, test_loss: 1.0483, test_f1: 0.5014
 epoch: 17, train_loss: 0.9491, test_loss: 1.0546, test_f1: 0.5168
 epoch: 18, train_loss: 0.9493, test_loss: 1.0594, test_f1: 0.5274
 epoch: 19, train_loss: 0.9397, test_loss: 1.0534, test_f1: 0.5241
 epoch: 20, train_loss: 0.9327, test_loss: 1.0405, test_f1: 0.5380
 epoch: 21, train_loss: 0.9368, test_loss: 1.0336, test_f1: 0.5017
 epoch: 22, train_loss: 0.9219, test_loss: 1.0363, test_f1: 0.5134
 epoch: 23, train_loss: 0.9219, test_loss: 1.0536, test_f1: 0.5314
 epoch: 24, train_loss: 0.9179, test_loss: 1.0381, test_f1: 0.5280
 epoch: 25, train_loss: 0.9230, test_loss: 1.0243, test_f1: 0.5190
 epoch: 26, train_loss: 0.9128, test_loss: 1.0236, test_f1: 0.5500
 epoch: 27, train_loss: 0.9037, test_loss: 1.0443, test_f1: 0.5331
 epoch: 28, train_loss: 0.8973, test_loss: 1.0197, test_f1: 0.5377
 epoch: 29, train_loss: 0.8918, test_loss: 1.0440, test_f1: 0.5402
 epoch: 30, train_loss: 0.8998, test_loss: 1.0442, test_f1: 0.5554
 epoch: 31, train_loss: 0.8912, test_loss: 1.0440, test_f1: 0.5622
 epoch: 32, train_loss: 0.8860, test_loss: 1.0159, test_f1: 0.5407
 epoch: 33, train_loss: 0.8697, test_loss: 1.0124, test_f1: 0.5578
 epoch: 34, train_loss: 0.8781, test_loss: 1.0203, test_f1: 0.5690
 epoch: 35, train_loss: 0.8707, test_loss: 1.0418, test_f1: 0.5785
 epoch: 36, train_loss: 0.8881, test_loss: 1.0357, test_f1: 0.5643
 epoch: 37, train_loss: 0.8604, test_loss: 1.0248, test_f1: 0.5784
 epoch: 38, train_loss: 0.8623, test_loss: 1.0189, test_f1: 0.5603
 epoch: 39, train_loss: 0.8571, test_loss: 1.0337, test_f1: 0.5849
 epoch: 40, train_loss: 0.8650, test_loss: 1.0327, test_f1: 0.5802
 epoch: 41, train_loss: 0.8423, test_loss: 1.0112, test_f1: 0.5624
 epoch: 42, train_loss: 0.8521, test_loss: 1.0252, test_f1: 0.5895
 epoch: 43, train_loss: 0.8351, test_loss: 1.0230, test_f1: 0.6007
 epoch: 44, train_loss: 0.8452, test_loss: 1.0094, test_f1: 0.5911
 epoch: 45, train_loss: 0.8276, test_loss: 0.9956, test_f1: 0.5902
 epoch: 46, train_loss: 0.8264, test_loss: 1.0090, test_f1: 0.5816
 epoch: 47, train_loss: 0.8323, test_loss: 1.0308, test_f1: 0.6002
 epoch: 48, train_loss: 0.8267, test_loss: 1.0055, test_f1: 0.5824
 epoch: 49, train_loss: 0.8293, test_loss: 1.0513, test_f1: 0.5600
 epoch: 50, train_loss: 0.8320, test_loss: 1.0242, test_f1: 0.5690
 epoch: 51, train_loss: 0.8021, test_loss: 1.0038, test_f1: 0.5671
 epoch: 52, train_loss: 0.8068, test_loss: 1.0097, test_f1: 0.5798
 epoch: 53, train_loss: 0.8078, test_loss: 1.0203, test_f1: 0.5803
 epoch: 54, train_loss: 0.8012, test_loss: 1.0334, test_f1: 0.5914
 epoch: 55, train_loss: 0.8057, test_loss: 1.0225, test_f1: 0.6099
 epoch: 56, train_loss: 0.7985, test_loss: 1.0143, test_f1: 0.5827
 epoch: 57, train_loss: 0.7943, test_loss: 1.0157, test_f1: 0.5810
 epoch: 58, train_loss: 0.7806, test_loss: 1.0192, test_f1: 0.5845
 epoch: 59, train_loss: 0.8051, test_loss: 1.0194, test_f1: 0.5837
 epoch: 60, train_loss: 0.7981, test_loss: 1.0231, test_f1: 0.5928
 epoch: 61, train_loss: 0.7915, test_loss: 1.0227, test_f1: 0.6197
 epoch: 62, train_loss: 0.7732, test_loss: 1.0153, test_f1: 0.5914
 epoch: 63, train_loss: 0.7706, test_loss: 1.0232, test_f1: 0.5691
 epoch: 64, train_loss: 0.7888, test_loss: 1.0401, test_f1: 0.6024
 epoch: 65, train_loss: 0.7783, test_loss: 1.0280, test_f1: 0.5963
 epoch: 66, train_loss: 0.7763, test_loss: 1.0178, test_f1: 0.5831
 epoch: 67, train_loss: 0.7637, test_loss: 1.0236, test_f1: 0.5845
 epoch: 68, train_loss: 0.7793, test_loss: 1.0307, test_f1: 0.6058
 epoch: 69, train_loss: 0.7657, test_loss: 1.0366, test_f1: 0.6054
 epoch: 70, train_loss: 0.7679, test_loss: 1.0381, test_f1: 0.6199
 epoch: 71, train_loss: 0.7636, test_loss: 1.0289, test_f1: 0.6215
 epoch: 72, train_loss: 0.7658, test_loss: 1.0356, test_f1: 0.6206
 epoch: 73, train_loss: 0.7646, test_loss: 1.0198, test_f1: 0.6037
 epoch: 74, train_loss: 0.7698, test_loss: 1.0268, test_f1: 0.5940
 epoch: 75, train_loss: 0.7559, test_loss: 1.0340, test_f1: 0.6065
 epoch: 76, train_loss: 0.7549, test_loss: 1.0235, test_f1: 0.6170
 epoch: 77, train_loss: 0.7482, test_loss: 1.0297, test_f1: 0.5723
 epoch: 78, train_loss: 0.7591, test_loss: 1.0587, test_f1: 0.6201
 epoch: 79, train_loss: 0.7463, test_loss: 1.0488, test_f1: 0.6099
 epoch: 80, train_loss: 0.7534, test_loss: 1.0547, test_f1: 0.6150
 epoch: 81, train_loss: 0.7571, test_loss: 1.0444, test_f1: 0.6163
 epoch: 82, train_loss: 0.7365, test_loss: 1.0455, test_f1: 0.5985
 epoch: 83, train_loss: 0.7370, test_loss: 1.0383, test_f1: 0.6066
 epoch: 84, train_loss: 0.7479, test_loss: 1.0834, test_f1: 0.6163
 epoch: 85, train_loss: 0.7428, test_loss: 1.0778, test_f1: 0.5970
 epoch: 86, train_loss: 0.7476, test_loss: 1.0483, test_f1: 0.5981
 epoch: 87, train_loss: 0.7362, test_loss: 1.0736, test_f1: 0.6065
 epoch: 88, train_loss: 0.7284, test_loss: 1.0515, test_f1: 0.6285
 epoch: 89, train_loss: 0.7587, test_loss: 1.0687, test_f1: 0.6174
 epoch: 90, train_loss: 0.7460, test_loss: 1.0636, test_f1: 0.6156
 epoch: 91, train_loss: 0.7332, test_loss: 1.0483, test_f1: 0.5938
 epoch: 92, train_loss: 0.7349, test_loss: 1.0329, test_f1: 0.6208
 epoch: 93, train_loss: 0.7254, test_loss: 1.0637, test_f1: 0.5619
 epoch: 94, train_loss: 0.7376, test_loss: 1.0163, test_f1: 0.6007
 epoch: 95, train_loss: 0.7299, test_loss: 1.1039, test_f1: 0.5958
 epoch: 96, train_loss: 0.7389, test_loss: 1.0604, test_f1: 0.6241
 epoch: 97, train_loss: 0.7369, test_loss: 1.0481, test_f1: 0.6385
 epoch: 98, train_loss: 0.7326, test_loss: 1.0419, test_f1: 0.6244
 epoch: 99, train_loss: 0.7314, test_loss: 1.0336, test_f1: 0.6313
##################ITERATION #3 ****************************************
 epoch: 0, train_loss: 1.3655, test_loss: 1.2999, test_f1: 0.2281
 epoch: 1, train_loss: 1.2069, test_loss: 1.3066, test_f1: 0.2281
 epoch: 2, train_loss: 1.1673, test_loss: 1.3348, test_f1: 0.2281
 epoch: 3, train_loss: 1.1586, test_loss: 1.2830, test_f1: 0.2451
 epoch: 4, train_loss: 1.1165, test_loss: 1.2284, test_f1: 0.3596
 epoch: 5, train_loss: 1.1109, test_loss: 1.1853, test_f1: 0.4243
 epoch: 6, train_loss: 1.0870, test_loss: 1.1359, test_f1: 0.4563
 epoch: 7, train_loss: 1.0864, test_loss: 1.1169, test_f1: 0.4698
 epoch: 8, train_loss: 1.0548, test_loss: 1.1044, test_f1: 0.4885
 epoch: 9, train_loss: 1.0558, test_loss: 1.0951, test_f1: 0.4859
 epoch: 10, train_loss: 1.0415, test_loss: 1.0821, test_f1: 0.5061
 epoch: 11, train_loss: 1.0259, test_loss: 1.0797, test_f1: 0.5037
 epoch: 12, train_loss: 0.9982, test_loss: 1.0681, test_f1: 0.5075
 epoch: 13, train_loss: 0.9943, test_loss: 1.0718, test_f1: 0.5057
 epoch: 14, train_loss: 0.9977, test_loss: 1.0773, test_f1: 0.4939
 epoch: 15, train_loss: 0.9877, test_loss: 1.0629, test_f1: 0.5308
 epoch: 16, train_loss: 0.9773, test_loss: 1.0696, test_f1: 0.5262
 epoch: 17, train_loss: 0.9838, test_loss: 1.0596, test_f1: 0.5203
 epoch: 18, train_loss: 0.9699, test_loss: 1.0555, test_f1: 0.5487
 epoch: 19, train_loss: 0.9540, test_loss: 1.0645, test_f1: 0.5267
 epoch: 20, train_loss: 0.9591, test_loss: 1.0523, test_f1: 0.5455
 epoch: 21, train_loss: 0.9422, test_loss: 1.0441, test_f1: 0.5389
 epoch: 22, train_loss: 0.9430, test_loss: 1.0377, test_f1: 0.5488
 epoch: 23, train_loss: 0.9334, test_loss: 1.0355, test_f1: 0.5358
 epoch: 24, train_loss: 0.9377, test_loss: 1.0378, test_f1: 0.5465
 epoch: 25, train_loss: 0.9341, test_loss: 1.0432, test_f1: 0.5489
 epoch: 26, train_loss: 0.9203, test_loss: 1.0325, test_f1: 0.5619
 epoch: 27, train_loss: 0.9121, test_loss: 1.0523, test_f1: 0.5578
 epoch: 28, train_loss: 0.9180, test_loss: 1.0429, test_f1: 0.5477
 epoch: 29, train_loss: 0.9139, test_loss: 1.0515, test_f1: 0.5482
 epoch: 30, train_loss: 0.9130, test_loss: 1.0461, test_f1: 0.5554
 epoch: 31, train_loss: 0.8961, test_loss: 1.0246, test_f1: 0.5530
 epoch: 32, train_loss: 0.8948, test_loss: 1.0308, test_f1: 0.5551
 epoch: 33, train_loss: 0.9007, test_loss: 1.0350, test_f1: 0.5619
 epoch: 34, train_loss: 0.8848, test_loss: 1.0305, test_f1: 0.5652
 epoch: 35, train_loss: 0.8927, test_loss: 1.0403, test_f1: 0.5108
 epoch: 36, train_loss: 0.8891, test_loss: 1.0241, test_f1: 0.5219
 epoch: 37, train_loss: 0.8827, test_loss: 1.0292, test_f1: 0.5745
 epoch: 38, train_loss: 0.8925, test_loss: 1.0197, test_f1: 0.5758
 epoch: 39, train_loss: 0.8806, test_loss: 1.0179, test_f1: 0.5728
 epoch: 40, train_loss: 0.8773, test_loss: 1.0240, test_f1: 0.5601
 epoch: 41, train_loss: 0.8751, test_loss: 1.0059, test_f1: 0.5657
 epoch: 42, train_loss: 0.8607, test_loss: 1.0175, test_f1: 0.5636
 epoch: 43, train_loss: 0.8593, test_loss: 1.0156, test_f1: 0.5497
 epoch: 44, train_loss: 0.8611, test_loss: 1.0146, test_f1: 0.5663
 epoch: 45, train_loss: 0.8733, test_loss: 1.0241, test_f1: 0.5631
 epoch: 46, train_loss: 0.8580, test_loss: 1.0048, test_f1: 0.5589
 epoch: 47, train_loss: 0.8458, test_loss: 1.0081, test_f1: 0.5797
 epoch: 48, train_loss: 0.8492, test_loss: 1.0291, test_f1: 0.5773
 epoch: 49, train_loss: 0.8471, test_loss: 1.0081, test_f1: 0.5583
 epoch: 50, train_loss: 0.8365, test_loss: 1.0243, test_f1: 0.5837
 epoch: 51, train_loss: 0.8317, test_loss: 1.0352, test_f1: 0.5943
 epoch: 52, train_loss: 0.8299, test_loss: 1.0035, test_f1: 0.5849
 epoch: 53, train_loss: 0.8250, test_loss: 1.0090, test_f1: 0.5856
 epoch: 54, train_loss: 0.8087, test_loss: 1.0167, test_f1: 0.5968
 epoch: 55, train_loss: 0.8100, test_loss: 1.0078, test_f1: 0.5974
 epoch: 56, train_loss: 0.8277, test_loss: 1.0387, test_f1: 0.5985
 epoch: 57, train_loss: 0.8138, test_loss: 1.0202, test_f1: 0.5720
 epoch: 58, train_loss: 0.8178, test_loss: 1.0229, test_f1: 0.5712
 epoch: 59, train_loss: 0.8222, test_loss: 1.0310, test_f1: 0.6065
 epoch: 60, train_loss: 0.8045, test_loss: 1.0246, test_f1: 0.6005
 epoch: 61, train_loss: 0.8134, test_loss: 1.0162, test_f1: 0.5849
 epoch: 62, train_loss: 0.8199, test_loss: 1.0175, test_f1: 0.5660
 epoch: 63, train_loss: 0.8179, test_loss: 1.0375, test_f1: 0.5791
 epoch: 64, train_loss: 0.8162, test_loss: 1.0141, test_f1: 0.5922
 epoch: 65, train_loss: 0.8093, test_loss: 1.0537, test_f1: 0.5965
 epoch: 66, train_loss: 0.8265, test_loss: 1.0230, test_f1: 0.5980
 epoch: 67, train_loss: 0.8040, test_loss: 1.0327, test_f1: 0.6050
 epoch: 68, train_loss: 0.8046, test_loss: 1.0137, test_f1: 0.5879
 epoch: 69, train_loss: 0.7985, test_loss: 1.0362, test_f1: 0.5991
 epoch: 70, train_loss: 0.7905, test_loss: 1.0335, test_f1: 0.6067
 epoch: 71, train_loss: 0.7880, test_loss: 1.0194, test_f1: 0.6042
 epoch: 72, train_loss: 0.7968, test_loss: 1.0301, test_f1: 0.6080
 epoch: 73, train_loss: 0.7953, test_loss: 1.0261, test_f1: 0.5944
 epoch: 74, train_loss: 0.7929, test_loss: 1.0216, test_f1: 0.5406
 epoch: 75, train_loss: 0.7813, test_loss: 1.0326, test_f1: 0.5885
 epoch: 76, train_loss: 0.7820, test_loss: 1.0181, test_f1: 0.6010
 epoch: 77, train_loss: 0.7805, test_loss: 1.0311, test_f1: 0.5706
 epoch: 78, train_loss: 0.7848, test_loss: 1.0108, test_f1: 0.5767
 epoch: 79, train_loss: 0.7850, test_loss: 1.0347, test_f1: 0.5969
 epoch: 80, train_loss: 0.7716, test_loss: 1.0347, test_f1: 0.5845
 epoch: 81, train_loss: 0.7830, test_loss: 1.0351, test_f1: 0.5969
 epoch: 82, train_loss: 0.7693, test_loss: 1.0279, test_f1: 0.5757
 epoch: 83, train_loss: 0.7612, test_loss: 1.0440, test_f1: 0.5899
 epoch: 84, train_loss: 0.7778, test_loss: 1.0530, test_f1: 0.5773
 epoch: 85, train_loss: 0.7746, test_loss: 1.0405, test_f1: 0.5991
 epoch: 86, train_loss: 0.7642, test_loss: 1.0408, test_f1: 0.5978
 epoch: 87, train_loss: 0.7768, test_loss: 1.0465, test_f1: 0.6005
 epoch: 88, train_loss: 0.7719, test_loss: 1.0343, test_f1: 0.6214
 epoch: 89, train_loss: 0.7671, test_loss: 1.0421, test_f1: 0.5806
 epoch: 90, train_loss: 0.7603, test_loss: 1.0504, test_f1: 0.5854
 epoch: 91, train_loss: 0.7506, test_loss: 1.0401, test_f1: 0.5959
 epoch: 92, train_loss: 0.7655, test_loss: 1.0382, test_f1: 0.5980
 epoch: 93, train_loss: 0.7648, test_loss: 1.0231, test_f1: 0.5977
 epoch: 94, train_loss: 0.7522, test_loss: 1.0546, test_f1: 0.5746
 epoch: 95, train_loss: 0.7646, test_loss: 1.0325, test_f1: 0.5572
 epoch: 96, train_loss: 0.7598, test_loss: 1.0414, test_f1: 0.5885
 epoch: 97, train_loss: 0.7770, test_loss: 1.0290, test_f1: 0.5683
 epoch: 98, train_loss: 0.7508, test_loss: 1.0642, test_f1: 0.6145
 epoch: 99, train_loss: 0.7610, test_loss: 1.0642, test_f1: 0.6105
##################ITERATION #4 ****************************************
 epoch: 0, train_loss: 1.2353, test_loss: 1.3114, test_f1: 0.2281
 epoch: 1, train_loss: 1.1476, test_loss: 1.3191, test_f1: 0.2281
 epoch: 2, train_loss: 1.1096, test_loss: 1.2572, test_f1: 0.2281
 epoch: 3, train_loss: 1.0904, test_loss: 1.1943, test_f1: 0.2718
 epoch: 4, train_loss: 1.0631, test_loss: 1.1734, test_f1: 0.3648
 epoch: 5, train_loss: 1.0516, test_loss: 1.1577, test_f1: 0.3667
 epoch: 6, train_loss: 1.0466, test_loss: 1.1422, test_f1: 0.3804
 epoch: 7, train_loss: 1.0353, test_loss: 1.1145, test_f1: 0.4096
 epoch: 8, train_loss: 1.0184, test_loss: 1.1016, test_f1: 0.4437
 epoch: 9, train_loss: 1.0146, test_loss: 1.1066, test_f1: 0.4371
 epoch: 10, train_loss: 1.0166, test_loss: 1.1034, test_f1: 0.4269
 epoch: 11, train_loss: 0.9939, test_loss: 1.0788, test_f1: 0.4776
 epoch: 12, train_loss: 0.9911, test_loss: 1.0767, test_f1: 0.4703
 epoch: 13, train_loss: 0.9840, test_loss: 1.0729, test_f1: 0.4736
 epoch: 14, train_loss: 0.9677, test_loss: 1.0655, test_f1: 0.4932
 epoch: 15, train_loss: 0.9678, test_loss: 1.0581, test_f1: 0.5020
 epoch: 16, train_loss: 0.9709, test_loss: 1.0535, test_f1: 0.5092
 epoch: 17, train_loss: 0.9581, test_loss: 1.0436, test_f1: 0.5204
 epoch: 18, train_loss: 0.9552, test_loss: 1.0604, test_f1: 0.5109
 epoch: 19, train_loss: 0.9604, test_loss: 1.0513, test_f1: 0.5054
 epoch: 20, train_loss: 0.9550, test_loss: 1.0533, test_f1: 0.5188
 epoch: 21, train_loss: 0.9454, test_loss: 1.0383, test_f1: 0.5276
 epoch: 22, train_loss: 0.9327, test_loss: 1.0495, test_f1: 0.5082
 epoch: 23, train_loss: 0.9361, test_loss: 1.0360, test_f1: 0.5259
 epoch: 24, train_loss: 0.9274, test_loss: 1.0448, test_f1: 0.5063
 epoch: 25, train_loss: 0.9382, test_loss: 1.0334, test_f1: 0.5256
 epoch: 26, train_loss: 0.9320, test_loss: 1.0333, test_f1: 0.5422
 epoch: 27, train_loss: 0.9322, test_loss: 1.0456, test_f1: 0.5299
 epoch: 28, train_loss: 0.9220, test_loss: 1.0358, test_f1: 0.5359
 epoch: 29, train_loss: 0.9218, test_loss: 1.0375, test_f1: 0.5184
 epoch: 30, train_loss: 0.9060, test_loss: 1.0368, test_f1: 0.5432
 epoch: 31, train_loss: 0.9087, test_loss: 1.0359, test_f1: 0.5228
 epoch: 32, train_loss: 0.9026, test_loss: 1.0274, test_f1: 0.5339
 epoch: 33, train_loss: 0.9217, test_loss: 1.0301, test_f1: 0.5318
 epoch: 34, train_loss: 0.9071, test_loss: 1.0273, test_f1: 0.5309
 epoch: 35, train_loss: 0.9061, test_loss: 1.0323, test_f1: 0.5396
 epoch: 36, train_loss: 0.9110, test_loss: 1.0355, test_f1: 0.5256
 epoch: 37, train_loss: 0.9069, test_loss: 1.0337, test_f1: 0.4844
 epoch: 38, train_loss: 0.9046, test_loss: 1.0215, test_f1: 0.5372
 epoch: 39, train_loss: 0.8999, test_loss: 1.0402, test_f1: 0.5342
 epoch: 40, train_loss: 0.8902, test_loss: 1.0270, test_f1: 0.5400
 epoch: 41, train_loss: 0.8888, test_loss: 1.0324, test_f1: 0.5320
 epoch: 42, train_loss: 0.8833, test_loss: 1.0483, test_f1: 0.5428
 epoch: 43, train_loss: 0.8741, test_loss: 1.0346, test_f1: 0.5563
 epoch: 44, train_loss: 0.8720, test_loss: 1.0257, test_f1: 0.5384
 epoch: 45, train_loss: 0.8760, test_loss: 1.0160, test_f1: 0.5408
 epoch: 46, train_loss: 0.8670, test_loss: 1.0082, test_f1: 0.5816
 epoch: 47, train_loss: 0.8746, test_loss: 1.0161, test_f1: 0.5641
 epoch: 48, train_loss: 0.8600, test_loss: 1.0421, test_f1: 0.5311
 epoch: 49, train_loss: 0.8785, test_loss: 1.0286, test_f1: 0.5294
 epoch: 50, train_loss: 0.8951, test_loss: 1.0595, test_f1: 0.5447
 epoch: 51, train_loss: 0.8626, test_loss: 1.0311, test_f1: 0.5337
 epoch: 52, train_loss: 0.8592, test_loss: 1.0127, test_f1: 0.5309
 epoch: 53, train_loss: 0.8571, test_loss: 1.0186, test_f1: 0.5589
 epoch: 54, train_loss: 0.8506, test_loss: 1.0126, test_f1: 0.5410
 epoch: 55, train_loss: 0.8382, test_loss: 1.0152, test_f1: 0.5540
 epoch: 56, train_loss: 0.8398, test_loss: 1.0185, test_f1: 0.5660
 epoch: 57, train_loss: 0.8433, test_loss: 1.0053, test_f1: 0.5481
 epoch: 58, train_loss: 0.8415, test_loss: 1.0145, test_f1: 0.5496
 epoch: 59, train_loss: 0.8347, test_loss: 1.0069, test_f1: 0.5229
 epoch: 60, train_loss: 0.8332, test_loss: 1.0063, test_f1: 0.5414
 epoch: 61, train_loss: 0.8538, test_loss: 1.0052, test_f1: 0.5283
 epoch: 62, train_loss: 0.8446, test_loss: 1.0116, test_f1: 0.5595
 epoch: 63, train_loss: 0.8402, test_loss: 1.0298, test_f1: 0.4939
 epoch: 64, train_loss: 0.8321, test_loss: 1.0365, test_f1: 0.5171
 epoch: 65, train_loss: 0.8350, test_loss: 1.0088, test_f1: 0.5469
 epoch: 66, train_loss: 0.8249, test_loss: 1.0043, test_f1: 0.5072
 epoch: 67, train_loss: 0.8328, test_loss: 1.0096, test_f1: 0.5012
 epoch: 68, train_loss: 0.8131, test_loss: 1.0361, test_f1: 0.4978
 epoch: 69, train_loss: 0.8211, test_loss: 1.0447, test_f1: 0.5310
 epoch: 70, train_loss: 0.8170, test_loss: 1.0369, test_f1: 0.5413
 epoch: 71, train_loss: 0.8236, test_loss: 1.0165, test_f1: 0.5282
 epoch: 72, train_loss: 0.8092, test_loss: 1.0140, test_f1: 0.5334
 epoch: 73, train_loss: 0.8243, test_loss: 0.9864, test_f1: 0.5461
 epoch: 74, train_loss: 0.7998, test_loss: 1.0133, test_f1: 0.5085
 epoch: 75, train_loss: 0.8328, test_loss: 1.0438, test_f1: 0.5265
 epoch: 76, train_loss: 0.8120, test_loss: 1.0469, test_f1: 0.4856
 epoch: 77, train_loss: 0.8081, test_loss: 1.0163, test_f1: 0.5452
 epoch: 78, train_loss: 0.7968, test_loss: 1.0031, test_f1: 0.5307
 epoch: 79, train_loss: 0.8093, test_loss: 1.0172, test_f1: 0.5479
 epoch: 80, train_loss: 0.8048, test_loss: 1.0095, test_f1: 0.4896
 epoch: 81, train_loss: 0.8103, test_loss: 1.0160, test_f1: 0.5195
 epoch: 82, train_loss: 0.8181, test_loss: 1.0101, test_f1: 0.5474
 epoch: 83, train_loss: 0.8101, test_loss: 1.0339, test_f1: 0.5272
 epoch: 84, train_loss: 0.7936, test_loss: 1.0148, test_f1: 0.5324
 epoch: 85, train_loss: 0.7935, test_loss: 1.0317, test_f1: 0.5338
 epoch: 86, train_loss: 0.7823, test_loss: 1.0398, test_f1: 0.5071
 epoch: 87, train_loss: 0.7882, test_loss: 1.0380, test_f1: 0.5445
 epoch: 88, train_loss: 0.7915, test_loss: 1.0071, test_f1: 0.5254
 epoch: 89, train_loss: 0.7931, test_loss: 0.9958, test_f1: 0.5310
 epoch: 90, train_loss: 0.7813, test_loss: 0.9978, test_f1: 0.4826
 epoch: 91, train_loss: 0.7904, test_loss: 1.0232, test_f1: 0.5342
 epoch: 92, train_loss: 0.7826, test_loss: 1.0033, test_f1: 0.5244
 epoch: 93, train_loss: 0.7902, test_loss: 1.0025, test_f1: 0.5415
 epoch: 94, train_loss: 0.7868, test_loss: 1.0209, test_f1: 0.5310
 epoch: 95, train_loss: 0.7802, test_loss: 0.9978, test_f1: 0.5348
 epoch: 96, train_loss: 0.7729, test_loss: 0.9963, test_f1: 0.5040
 epoch: 97, train_loss: 0.7696, test_loss: 1.0095, test_f1: 0.5303
 epoch: 98, train_loss: 0.7845, test_loss: 0.9954, test_f1: 0.5103
 epoch: 99, train_loss: 0.7746, test_loss: 1.0298, test_f1: 0.5170
##################ITERATION #5 ****************************************
 epoch: 0, train_loss: 1.4724, test_loss: 1.5952, test_f1: 0.0507
 epoch: 1, train_loss: 1.2508, test_loss: 1.4953, test_f1: 0.0507
 epoch: 2, train_loss: 1.1784, test_loss: 1.3895, test_f1: 0.2375
 epoch: 3, train_loss: 1.1433, test_loss: 1.3247, test_f1: 0.2371
 epoch: 4, train_loss: 1.0952, test_loss: 1.2420, test_f1: 0.2614
 epoch: 5, train_loss: 1.0899, test_loss: 1.1576, test_f1: 0.3751
 epoch: 6, train_loss: 1.0577, test_loss: 1.1080, test_f1: 0.3843
 epoch: 7, train_loss: 1.0410, test_loss: 1.1030, test_f1: 0.3816
 epoch: 8, train_loss: 1.0317, test_loss: 1.0938, test_f1: 0.4307
 epoch: 9, train_loss: 1.0188, test_loss: 1.0875, test_f1: 0.4335
 epoch: 10, train_loss: 1.0050, test_loss: 1.0742, test_f1: 0.4444
 epoch: 11, train_loss: 1.0114, test_loss: 1.0703, test_f1: 0.4642
 epoch: 12, train_loss: 1.0016, test_loss: 1.0763, test_f1: 0.4662
 epoch: 13, train_loss: 0.9909, test_loss: 1.0688, test_f1: 0.4725
 epoch: 14, train_loss: 0.9855, test_loss: 1.0638, test_f1: 0.4457
 epoch: 15, train_loss: 0.9768, test_loss: 1.0591, test_f1: 0.4666
 epoch: 16, train_loss: 0.9859, test_loss: 1.0733, test_f1: 0.4751
 epoch: 17, train_loss: 0.9726, test_loss: 1.0591, test_f1: 0.4693
 epoch: 18, train_loss: 0.9703, test_loss: 1.0602, test_f1: 0.4695
 epoch: 19, train_loss: 0.9632, test_loss: 1.0560, test_f1: 0.4787
 epoch: 20, train_loss: 0.9589, test_loss: 1.0541, test_f1: 0.4869
 epoch: 21, train_loss: 0.9436, test_loss: 1.0581, test_f1: 0.4890
 epoch: 22, train_loss: 0.9604, test_loss: 1.0424, test_f1: 0.5182
 epoch: 23, train_loss: 0.9434, test_loss: 1.0497, test_f1: 0.5093
 epoch: 24, train_loss: 0.9303, test_loss: 1.0505, test_f1: 0.5269
 epoch: 25, train_loss: 0.9340, test_loss: 1.0428, test_f1: 0.5217
 epoch: 26, train_loss: 0.9246, test_loss: 1.0527, test_f1: 0.5185
 epoch: 27, train_loss: 0.9128, test_loss: 1.0582, test_f1: 0.5117
 epoch: 28, train_loss: 0.9063, test_loss: 1.0405, test_f1: 0.5140
 epoch: 29, train_loss: 0.9135, test_loss: 1.0403, test_f1: 0.5223
 epoch: 30, train_loss: 0.8959, test_loss: 1.0495, test_f1: 0.5321
 epoch: 31, train_loss: 0.9076, test_loss: 1.0395, test_f1: 0.5295
 epoch: 32, train_loss: 0.9101, test_loss: 1.0288, test_f1: 0.5183
 epoch: 33, train_loss: 0.9106, test_loss: 1.0242, test_f1: 0.5275
 epoch: 34, train_loss: 0.9123, test_loss: 1.0434, test_f1: 0.5228
 epoch: 35, train_loss: 0.8849, test_loss: 1.0207, test_f1: 0.5234
 epoch: 36, train_loss: 0.8803, test_loss: 1.0274, test_f1: 0.5322
 epoch: 37, train_loss: 0.8918, test_loss: 1.0204, test_f1: 0.5236
 epoch: 38, train_loss: 0.8893, test_loss: 1.0330, test_f1: 0.5453
 epoch: 39, train_loss: 0.8810, test_loss: 1.0038, test_f1: 0.5509
 epoch: 40, train_loss: 0.8730, test_loss: 1.0218, test_f1: 0.5223
 epoch: 41, train_loss: 0.8698, test_loss: 1.0637, test_f1: 0.5259
 epoch: 42, train_loss: 0.8809, test_loss: 1.0250, test_f1: 0.5519
 epoch: 43, train_loss: 0.8693, test_loss: 1.0239, test_f1: 0.5381
 epoch: 44, train_loss: 0.8483, test_loss: 1.0421, test_f1: 0.5607
 epoch: 45, train_loss: 0.8552, test_loss: 1.0212, test_f1: 0.5530
 epoch: 46, train_loss: 0.8439, test_loss: 1.0411, test_f1: 0.5362
 epoch: 47, train_loss: 0.8605, test_loss: 1.0283, test_f1: 0.5325
 epoch: 48, train_loss: 0.8387, test_loss: 1.0020, test_f1: 0.5502
 epoch: 49, train_loss: 0.8326, test_loss: 1.0197, test_f1: 0.5234
 epoch: 50, train_loss: 0.8356, test_loss: 1.0179, test_f1: 0.5455
 epoch: 51, train_loss: 0.8368, test_loss: 1.0026, test_f1: 0.5456
 epoch: 52, train_loss: 0.8261, test_loss: 1.0206, test_f1: 0.5656
 epoch: 53, train_loss: 0.8240, test_loss: 1.0115, test_f1: 0.5516
 epoch: 54, train_loss: 0.8199, test_loss: 1.0129, test_f1: 0.5449
 epoch: 55, train_loss: 0.8250, test_loss: 1.0075, test_f1: 0.5422
 epoch: 56, train_loss: 0.8203, test_loss: 1.0002, test_f1: 0.5498
 epoch: 57, train_loss: 0.8221, test_loss: 1.0256, test_f1: 0.5532
 epoch: 58, train_loss: 0.8264, test_loss: 1.0081, test_f1: 0.5600
 epoch: 59, train_loss: 0.8150, test_loss: 1.0083, test_f1: 0.5517
 epoch: 60, train_loss: 0.8124, test_loss: 1.0098, test_f1: 0.5385
 epoch: 61, train_loss: 0.8022, test_loss: 1.0156, test_f1: 0.5477
 epoch: 62, train_loss: 0.8061, test_loss: 1.0093, test_f1: 0.5555
 epoch: 63, train_loss: 0.7951, test_loss: 1.0264, test_f1: 0.5437
 epoch: 64, train_loss: 0.8014, test_loss: 0.9954, test_f1: 0.5575
 epoch: 65, train_loss: 0.8048, test_loss: 0.9898, test_f1: 0.5608
 epoch: 66, train_loss: 0.7986, test_loss: 0.9935, test_f1: 0.5541
 epoch: 67, train_loss: 0.7978, test_loss: 0.9921, test_f1: 0.5638
 epoch: 68, train_loss: 0.7833, test_loss: 0.9876, test_f1: 0.5550
 epoch: 69, train_loss: 0.7901, test_loss: 0.9983, test_f1: 0.5604
 epoch: 70, train_loss: 0.7937, test_loss: 1.0181, test_f1: 0.5514
 epoch: 71, train_loss: 0.7863, test_loss: 1.0151, test_f1: 0.5480
 epoch: 72, train_loss: 0.7808, test_loss: 1.0311, test_f1: 0.5481
 epoch: 73, train_loss: 0.7742, test_loss: 1.0181, test_f1: 0.5492
 epoch: 74, train_loss: 0.7757, test_loss: 1.0140, test_f1: 0.5528
 epoch: 75, train_loss: 0.7772, test_loss: 1.0008, test_f1: 0.5605
 epoch: 76, train_loss: 0.7850, test_loss: 1.0265, test_f1: 0.5519
 epoch: 77, train_loss: 0.7672, test_loss: 1.0169, test_f1: 0.5520
 epoch: 78, train_loss: 0.7648, test_loss: 1.0059, test_f1: 0.5667
 epoch: 79, train_loss: 0.7684, test_loss: 1.0051, test_f1: 0.5513
 epoch: 80, train_loss: 0.7661, test_loss: 0.9969, test_f1: 0.5818
 epoch: 81, train_loss: 0.7675, test_loss: 0.9932, test_f1: 0.5569
 epoch: 82, train_loss: 0.7641, test_loss: 0.9883, test_f1: 0.5450
 epoch: 83, train_loss: 0.7729, test_loss: 1.0235, test_f1: 0.5436
 epoch: 84, train_loss: 0.7585, test_loss: 1.0253, test_f1: 0.5612
 epoch: 85, train_loss: 0.7576, test_loss: 1.0019, test_f1: 0.5654
 epoch: 86, train_loss: 0.7789, test_loss: 1.0403, test_f1: 0.5603
 epoch: 87, train_loss: 0.7599, test_loss: 1.0437, test_f1: 0.5277
 epoch: 88, train_loss: 0.7574, test_loss: 1.0035, test_f1: 0.5506
 epoch: 89, train_loss: 0.7598, test_loss: 0.9729, test_f1: 0.5813
 epoch: 90, train_loss: 0.7469, test_loss: 1.0077, test_f1: 0.5494
 epoch: 91, train_loss: 0.7477, test_loss: 1.0139, test_f1: 0.5521
 epoch: 92, train_loss: 0.7656, test_loss: 1.0116, test_f1: 0.5566
 epoch: 93, train_loss: 0.7638, test_loss: 1.0071, test_f1: 0.5436
 epoch: 94, train_loss: 0.7512, test_loss: 1.0020, test_f1: 0.5509
 epoch: 95, train_loss: 0.7461, test_loss: 1.0045, test_f1: 0.5470
 epoch: 96, train_loss: 0.7456, test_loss: 1.0374, test_f1: 0.5439
 epoch: 97, train_loss: 0.7346, test_loss: 1.0287, test_f1: 0.5428
 epoch: 98, train_loss: 0.7453, test_loss: 1.0192, test_f1: 0.5724
 epoch: 99, train_loss: 0.7292, test_loss: 1.0132, test_f1: 0.5572
##################ITERATION #6 ****************************************
 epoch: 0, train_loss: 1.2937, test_loss: 1.3221, test_f1: 0.2281
 epoch: 1, train_loss: 1.1820, test_loss: 1.3335, test_f1: 0.2281
 epoch: 2, train_loss: 1.1370, test_loss: 1.3710, test_f1: 0.2829
 epoch: 3, train_loss: 1.1161, test_loss: 1.3240, test_f1: 0.2349
 epoch: 4, train_loss: 1.0923, test_loss: 1.2139, test_f1: 0.3337
 epoch: 5, train_loss: 1.0731, test_loss: 1.1549, test_f1: 0.4566
 epoch: 6, train_loss: 1.0633, test_loss: 1.1220, test_f1: 0.4621
 epoch: 7, train_loss: 1.0377, test_loss: 1.1077, test_f1: 0.4625
 epoch: 8, train_loss: 1.0530, test_loss: 1.0930, test_f1: 0.4777
 epoch: 9, train_loss: 1.0210, test_loss: 1.0939, test_f1: 0.4920
 epoch: 10, train_loss: 1.0129, test_loss: 1.0797, test_f1: 0.4869
 epoch: 11, train_loss: 1.0020, test_loss: 1.0759, test_f1: 0.4814
 epoch: 12, train_loss: 0.9948, test_loss: 1.0758, test_f1: 0.4909
 epoch: 13, train_loss: 0.9889, test_loss: 1.0596, test_f1: 0.4919
 epoch: 14, train_loss: 0.9861, test_loss: 1.0468, test_f1: 0.5179
 epoch: 15, train_loss: 0.9791, test_loss: 1.0524, test_f1: 0.5095
 epoch: 16, train_loss: 0.9785, test_loss: 1.0446, test_f1: 0.5090
 epoch: 17, train_loss: 0.9615, test_loss: 1.0459, test_f1: 0.5313
 epoch: 18, train_loss: 0.9730, test_loss: 1.0458, test_f1: 0.5137
 epoch: 19, train_loss: 0.9711, test_loss: 1.0346, test_f1: 0.5223
 epoch: 20, train_loss: 0.9683, test_loss: 1.0331, test_f1: 0.5274
 epoch: 21, train_loss: 0.9526, test_loss: 1.0292, test_f1: 0.5059
 epoch: 22, train_loss: 0.9551, test_loss: 1.0231, test_f1: 0.5255
 epoch: 23, train_loss: 0.9403, test_loss: 1.0223, test_f1: 0.5334
 epoch: 24, train_loss: 0.9421, test_loss: 1.0249, test_f1: 0.5199
 epoch: 25, train_loss: 0.9396, test_loss: 1.0266, test_f1: 0.5143
 epoch: 26, train_loss: 0.9330, test_loss: 1.0236, test_f1: 0.5192
 epoch: 27, train_loss: 0.9355, test_loss: 1.0126, test_f1: 0.5364
 epoch: 28, train_loss: 0.9382, test_loss: 1.0078, test_f1: 0.5212
 epoch: 29, train_loss: 0.9362, test_loss: 1.0165, test_f1: 0.5291
 epoch: 30, train_loss: 0.9083, test_loss: 1.0229, test_f1: 0.5619
 epoch: 31, train_loss: 0.9220, test_loss: 1.0149, test_f1: 0.5584
 epoch: 32, train_loss: 0.9278, test_loss: 1.0032, test_f1: 0.5408
 epoch: 33, train_loss: 0.9174, test_loss: 1.0081, test_f1: 0.5370
 epoch: 34, train_loss: 0.9040, test_loss: 0.9984, test_f1: 0.5425
 epoch: 35, train_loss: 0.9172, test_loss: 1.0058, test_f1: 0.5563
 epoch: 36, train_loss: 0.8933, test_loss: 1.0142, test_f1: 0.5389
 epoch: 37, train_loss: 0.9027, test_loss: 0.9959, test_f1: 0.5596
 epoch: 38, train_loss: 0.8931, test_loss: 0.9909, test_f1: 0.5713
 epoch: 39, train_loss: 0.9071, test_loss: 1.0128, test_f1: 0.5306
 epoch: 40, train_loss: 0.8888, test_loss: 1.0139, test_f1: 0.5577
 epoch: 41, train_loss: 0.8902, test_loss: 0.9858, test_f1: 0.5541
 epoch: 42, train_loss: 0.8883, test_loss: 0.9821, test_f1: 0.5490
 epoch: 43, train_loss: 0.8826, test_loss: 0.9806, test_f1: 0.5670
 epoch: 44, train_loss: 0.8701, test_loss: 1.0072, test_f1: 0.5416
 epoch: 45, train_loss: 0.8643, test_loss: 0.9839, test_f1: 0.5843
 epoch: 46, train_loss: 0.8671, test_loss: 0.9990, test_f1: 0.5731
 epoch: 47, train_loss: 0.8649, test_loss: 0.9935, test_f1: 0.5621
 epoch: 48, train_loss: 0.8615, test_loss: 0.9953, test_f1: 0.5833
 epoch: 49, train_loss: 0.8560, test_loss: 0.9921, test_f1: 0.5729
 epoch: 50, train_loss: 0.8474, test_loss: 1.0041, test_f1: 0.5575
 epoch: 51, train_loss: 0.8500, test_loss: 0.9810, test_f1: 0.5745
 epoch: 52, train_loss: 0.8311, test_loss: 0.9808, test_f1: 0.5817
 epoch: 53, train_loss: 0.8305, test_loss: 0.9768, test_f1: 0.5808
 epoch: 54, train_loss: 0.8307, test_loss: 0.9856, test_f1: 0.5691
 epoch: 55, train_loss: 0.8236, test_loss: 0.9808, test_f1: 0.5770
 epoch: 56, train_loss: 0.8327, test_loss: 0.9773, test_f1: 0.5829
 epoch: 57, train_loss: 0.8293, test_loss: 0.9719, test_f1: 0.5849
 epoch: 58, train_loss: 0.8202, test_loss: 0.9711, test_f1: 0.5864
 epoch: 59, train_loss: 0.8143, test_loss: 0.9778, test_f1: 0.5916
 epoch: 60, train_loss: 0.8208, test_loss: 0.9748, test_f1: 0.5914
 epoch: 61, train_loss: 0.8083, test_loss: 0.9747, test_f1: 0.5953
 epoch: 62, train_loss: 0.8119, test_loss: 0.9761, test_f1: 0.5853
 epoch: 63, train_loss: 0.8208, test_loss: 0.9779, test_f1: 0.5718
 epoch: 64, train_loss: 0.8241, test_loss: 0.9826, test_f1: 0.5809
 epoch: 65, train_loss: 0.8238, test_loss: 0.9898, test_f1: 0.5532
 epoch: 66, train_loss: 0.8075, test_loss: 0.9694, test_f1: 0.5914
 epoch: 67, train_loss: 0.8159, test_loss: 0.9632, test_f1: 0.5954
 epoch: 68, train_loss: 0.8095, test_loss: 0.9544, test_f1: 0.5855
 epoch: 69, train_loss: 0.7982, test_loss: 0.9755, test_f1: 0.5942
 epoch: 70, train_loss: 0.8083, test_loss: 0.9748, test_f1: 0.5819
 epoch: 71, train_loss: 0.7962, test_loss: 0.9719, test_f1: 0.5634
 epoch: 72, train_loss: 0.8009, test_loss: 0.9703, test_f1: 0.5696
 epoch: 73, train_loss: 0.8144, test_loss: 0.9684, test_f1: 0.5704
 epoch: 74, train_loss: 0.7880, test_loss: 0.9727, test_f1: 0.5793
 epoch: 75, train_loss: 0.7887, test_loss: 0.9735, test_f1: 0.5703
 epoch: 76, train_loss: 0.7902, test_loss: 0.9740, test_f1: 0.5848
 epoch: 77, train_loss: 0.8056, test_loss: 0.9739, test_f1: 0.5596
 epoch: 78, train_loss: 0.7743, test_loss: 0.9823, test_f1: 0.5723
 epoch: 79, train_loss: 0.7804, test_loss: 0.9793, test_f1: 0.5613
 epoch: 80, train_loss: 0.7890, test_loss: 0.9815, test_f1: 0.5700
 epoch: 81, train_loss: 0.7725, test_loss: 0.9863, test_f1: 0.5676
 epoch: 82, train_loss: 0.7925, test_loss: 0.9784, test_f1: 0.5816
 epoch: 83, train_loss: 0.7830, test_loss: 0.9767, test_f1: 0.5745
 epoch: 84, train_loss: 0.7730, test_loss: 0.9768, test_f1: 0.5795
 epoch: 85, train_loss: 0.7695, test_loss: 0.9741, test_f1: 0.5852
 epoch: 86, train_loss: 0.7853, test_loss: 0.9798, test_f1: 0.5701
 epoch: 87, train_loss: 0.7839, test_loss: 0.9837, test_f1: 0.5787
 epoch: 88, train_loss: 0.7712, test_loss: 0.9769, test_f1: 0.5813
 epoch: 89, train_loss: 0.7722, test_loss: 0.9802, test_f1: 0.5781
 epoch: 90, train_loss: 0.7604, test_loss: 0.9805, test_f1: 0.5874
 epoch: 91, train_loss: 0.7738, test_loss: 0.9940, test_f1: 0.5837
 epoch: 92, train_loss: 0.7689, test_loss: 0.9718, test_f1: 0.5948
 epoch: 93, train_loss: 0.7646, test_loss: 0.9810, test_f1: 0.5872
 epoch: 94, train_loss: 0.7583, test_loss: 0.9850, test_f1: 0.5859
 epoch: 95, train_loss: 0.7571, test_loss: 0.9927, test_f1: 0.5981
 epoch: 96, train_loss: 0.7620, test_loss: 0.9712, test_f1: 0.5825
 epoch: 97, train_loss: 0.7659, test_loss: 0.9785, test_f1: 0.5886
 epoch: 98, train_loss: 0.7608, test_loss: 0.9664, test_f1: 0.5976
 epoch: 99, train_loss: 0.7440, test_loss: 0.9727, test_f1: 0.5943
##################ITERATION #7 ****************************************
 epoch: 0, train_loss: 1.3180, test_loss: 1.3245, test_f1: 0.2281
 epoch: 1, train_loss: 1.1760, test_loss: 1.3405, test_f1: 0.2281
 epoch: 2, train_loss: 1.1358, test_loss: 1.2903, test_f1: 0.3252
 epoch: 3, train_loss: 1.1213, test_loss: 1.2107, test_f1: 0.3513
 epoch: 4, train_loss: 1.0864, test_loss: 1.1771, test_f1: 0.4450
 epoch: 5, train_loss: 1.0804, test_loss: 1.1487, test_f1: 0.4282
 epoch: 6, train_loss: 1.0636, test_loss: 1.1526, test_f1: 0.4266
 epoch: 7, train_loss: 1.0543, test_loss: 1.1373, test_f1: 0.4169
 epoch: 8, train_loss: 1.0432, test_loss: 1.1381, test_f1: 0.4269
 epoch: 9, train_loss: 1.0374, test_loss: 1.1331, test_f1: 0.4275
 epoch: 10, train_loss: 1.0293, test_loss: 1.1174, test_f1: 0.4311
 epoch: 11, train_loss: 1.0318, test_loss: 1.1250, test_f1: 0.4249
 epoch: 12, train_loss: 1.0259, test_loss: 1.1236, test_f1: 0.4329
 epoch: 13, train_loss: 1.0006, test_loss: 1.1080, test_f1: 0.4244
 epoch: 14, train_loss: 0.9979, test_loss: 1.1265, test_f1: 0.4269
 epoch: 15, train_loss: 0.9973, test_loss: 1.0972, test_f1: 0.4331
 epoch: 16, train_loss: 0.9912, test_loss: 1.0955, test_f1: 0.4371
 epoch: 17, train_loss: 0.9879, test_loss: 1.0828, test_f1: 0.4599
 epoch: 18, train_loss: 0.9712, test_loss: 1.0757, test_f1: 0.4789
 epoch: 19, train_loss: 0.9585, test_loss: 1.0837, test_f1: 0.4691
 epoch: 20, train_loss: 0.9575, test_loss: 1.0702, test_f1: 0.4837
 epoch: 21, train_loss: 0.9403, test_loss: 1.0609, test_f1: 0.4802
 epoch: 22, train_loss: 0.9417, test_loss: 1.0639, test_f1: 0.4897
 epoch: 23, train_loss: 0.9236, test_loss: 1.0446, test_f1: 0.5001
 epoch: 24, train_loss: 0.9310, test_loss: 1.0673, test_f1: 0.5002
 epoch: 25, train_loss: 0.9185, test_loss: 1.0481, test_f1: 0.5184
 epoch: 26, train_loss: 0.8961, test_loss: 1.0308, test_f1: 0.5102
 epoch: 27, train_loss: 0.9042, test_loss: 1.0168, test_f1: 0.5290
 epoch: 28, train_loss: 0.8883, test_loss: 1.0370, test_f1: 0.5225
 epoch: 29, train_loss: 0.8975, test_loss: 1.0246, test_f1: 0.5330
 epoch: 30, train_loss: 0.8776, test_loss: 1.0375, test_f1: 0.5220
 epoch: 31, train_loss: 0.8804, test_loss: 1.0384, test_f1: 0.5346
 epoch: 32, train_loss: 0.8722, test_loss: 1.0499, test_f1: 0.5250
 epoch: 33, train_loss: 0.8737, test_loss: 1.0436, test_f1: 0.5430
 epoch: 34, train_loss: 0.8712, test_loss: 1.0544, test_f1: 0.5225
 epoch: 35, train_loss: 0.8680, test_loss: 1.0568, test_f1: 0.5196
 epoch: 36, train_loss: 0.8590, test_loss: 1.0408, test_f1: 0.5326
 epoch: 37, train_loss: 0.8566, test_loss: 1.0164, test_f1: 0.5532
 epoch: 38, train_loss: 0.8386, test_loss: 1.0067, test_f1: 0.5648
 epoch: 39, train_loss: 0.8571, test_loss: 0.9938, test_f1: 0.5652
 epoch: 40, train_loss: 0.8430, test_loss: 1.0297, test_f1: 0.5398
 epoch: 41, train_loss: 0.8340, test_loss: 1.0085, test_f1: 0.5628
 epoch: 42, train_loss: 0.8201, test_loss: 0.9998, test_f1: 0.5760
 epoch: 43, train_loss: 0.8181, test_loss: 0.9956, test_f1: 0.5723
 epoch: 44, train_loss: 0.8151, test_loss: 1.0278, test_f1: 0.5432
 epoch: 45, train_loss: 0.8109, test_loss: 1.0308, test_f1: 0.5541
 epoch: 46, train_loss: 0.8165, test_loss: 1.0880, test_f1: 0.5519
 epoch: 47, train_loss: 0.8078, test_loss: 1.0314, test_f1: 0.5601
 epoch: 48, train_loss: 0.8032, test_loss: 1.0142, test_f1: 0.5690
 epoch: 49, train_loss: 0.7804, test_loss: 1.0293, test_f1: 0.5371
 epoch: 50, train_loss: 0.8092, test_loss: 1.0387, test_f1: 0.5468
 epoch: 51, train_loss: 0.7939, test_loss: 1.0081, test_f1: 0.5738
 epoch: 52, train_loss: 0.7848, test_loss: 1.0009, test_f1: 0.5744
 epoch: 53, train_loss: 0.7735, test_loss: 0.9984, test_f1: 0.5764
 epoch: 54, train_loss: 0.7937, test_loss: 1.0036, test_f1: 0.5759
 epoch: 55, train_loss: 0.7796, test_loss: 1.0163, test_f1: 0.5729
 epoch: 56, train_loss: 0.7694, test_loss: 1.0070, test_f1: 0.5759
 epoch: 57, train_loss: 0.7810, test_loss: 1.0096, test_f1: 0.5823
 epoch: 58, train_loss: 0.7676, test_loss: 1.0052, test_f1: 0.5827
 epoch: 59, train_loss: 0.7646, test_loss: 1.0180, test_f1: 0.5625
 epoch: 60, train_loss: 0.7656, test_loss: 1.0073, test_f1: 0.5662
 epoch: 61, train_loss: 0.7620, test_loss: 1.0284, test_f1: 0.5695
 epoch: 62, train_loss: 0.7570, test_loss: 1.0183, test_f1: 0.5795
 epoch: 63, train_loss: 0.7602, test_loss: 1.0083, test_f1: 0.5896
 epoch: 64, train_loss: 0.7584, test_loss: 1.0145, test_f1: 0.5674
 epoch: 65, train_loss: 0.7476, test_loss: 0.9886, test_f1: 0.5956
 epoch: 66, train_loss: 0.7737, test_loss: 0.9971, test_f1: 0.5794
 epoch: 67, train_loss: 0.7578, test_loss: 1.0309, test_f1: 0.5611
 epoch: 68, train_loss: 0.7591, test_loss: 1.0207, test_f1: 0.6002
 epoch: 69, train_loss: 0.7533, test_loss: 1.0157, test_f1: 0.5980
 epoch: 70, train_loss: 0.7394, test_loss: 0.9996, test_f1: 0.5856
 epoch: 71, train_loss: 0.7446, test_loss: 1.0075, test_f1: 0.6138
 epoch: 72, train_loss: 0.7272, test_loss: 1.0113, test_f1: 0.5893
 epoch: 73, train_loss: 0.7360, test_loss: 1.0175, test_f1: 0.5898
 epoch: 74, train_loss: 0.7295, test_loss: 1.0077, test_f1: 0.6044
 epoch: 75, train_loss: 0.7430, test_loss: 1.0103, test_f1: 0.5835
 epoch: 76, train_loss: 0.7443, test_loss: 1.0042, test_f1: 0.5895
 epoch: 77, train_loss: 0.7443, test_loss: 1.0335, test_f1: 0.6095
 epoch: 78, train_loss: 0.7408, test_loss: 1.0353, test_f1: 0.5746
 epoch: 79, train_loss: 0.7099, test_loss: 1.0101, test_f1: 0.5905
 epoch: 80, train_loss: 0.7147, test_loss: 1.0115, test_f1: 0.5922
 epoch: 81, train_loss: 0.7278, test_loss: 1.0119, test_f1: 0.6160
 epoch: 82, train_loss: 0.7273, test_loss: 1.0025, test_f1: 0.6117
 epoch: 83, train_loss: 0.7386, test_loss: 0.9974, test_f1: 0.5842
 epoch: 84, train_loss: 0.7263, test_loss: 1.0090, test_f1: 0.6226
 epoch: 85, train_loss: 0.7070, test_loss: 1.0231, test_f1: 0.6225
 epoch: 86, train_loss: 0.7096, test_loss: 1.0176, test_f1: 0.6126
 epoch: 87, train_loss: 0.7290, test_loss: 1.0183, test_f1: 0.6120
 epoch: 88, train_loss: 0.6921, test_loss: 1.0048, test_f1: 0.6049
 epoch: 89, train_loss: 0.7059, test_loss: 1.0043, test_f1: 0.6105
 epoch: 90, train_loss: 0.6949, test_loss: 1.0142, test_f1: 0.6263
 epoch: 91, train_loss: 0.7337, test_loss: 1.0273, test_f1: 0.6194
 epoch: 92, train_loss: 0.7115, test_loss: 1.0527, test_f1: 0.5932
 epoch: 93, train_loss: 0.7147, test_loss: 1.0386, test_f1: 0.6098
 epoch: 94, train_loss: 0.6834, test_loss: 1.0402, test_f1: 0.6000
 epoch: 95, train_loss: 0.7030, test_loss: 1.0382, test_f1: 0.6192
 epoch: 96, train_loss: 0.7011, test_loss: 1.0551, test_f1: 0.5967
 epoch: 97, train_loss: 0.7102, test_loss: 1.0462, test_f1: 0.6071
 epoch: 98, train_loss: 0.7187, test_loss: 1.0305, test_f1: 0.6111
 epoch: 99, train_loss: 0.7136, test_loss: 1.0451, test_f1: 0.6031
##################ITERATION #8 ****************************************
 epoch: 0, train_loss: 1.4302, test_loss: 1.4396, test_f1: 0.3232
 epoch: 1, train_loss: 1.2296, test_loss: 1.4412, test_f1: 0.2627
 epoch: 2, train_loss: 1.1828, test_loss: 1.4115, test_f1: 0.3114
 epoch: 3, train_loss: 1.1303, test_loss: 1.3779, test_f1: 0.3098
 epoch: 4, train_loss: 1.1180, test_loss: 1.3093, test_f1: 0.3229
 epoch: 5, train_loss: 1.1016, test_loss: 1.2169, test_f1: 0.3704
 epoch: 6, train_loss: 1.0830, test_loss: 1.1448, test_f1: 0.4190
 epoch: 7, train_loss: 1.0661, test_loss: 1.1415, test_f1: 0.4359
 epoch: 8, train_loss: 1.0477, test_loss: 1.1386, test_f1: 0.4624
 epoch: 9, train_loss: 1.0291, test_loss: 1.1230, test_f1: 0.4806
 epoch: 10, train_loss: 1.0280, test_loss: 1.1269, test_f1: 0.4777
 epoch: 11, train_loss: 1.0030, test_loss: 1.1116, test_f1: 0.4730
 epoch: 12, train_loss: 1.0174, test_loss: 1.1101, test_f1: 0.4851
 epoch: 13, train_loss: 1.0215, test_loss: 1.1024, test_f1: 0.4745
 epoch: 14, train_loss: 0.9964, test_loss: 1.0907, test_f1: 0.4617
 epoch: 15, train_loss: 0.9913, test_loss: 1.0957, test_f1: 0.4736
 epoch: 16, train_loss: 0.9855, test_loss: 1.0808, test_f1: 0.4649
 epoch: 17, train_loss: 0.9833, test_loss: 1.0881, test_f1: 0.4628
 epoch: 18, train_loss: 0.9827, test_loss: 1.0889, test_f1: 0.4658
 epoch: 19, train_loss: 0.9830, test_loss: 1.0749, test_f1: 0.4959
 epoch: 20, train_loss: 0.9566, test_loss: 1.0643, test_f1: 0.4920
 epoch: 21, train_loss: 0.9610, test_loss: 1.0687, test_f1: 0.4723
 epoch: 22, train_loss: 0.9544, test_loss: 1.0694, test_f1: 0.4786
 epoch: 23, train_loss: 0.9468, test_loss: 1.0545, test_f1: 0.5001
 epoch: 24, train_loss: 0.9486, test_loss: 1.0603, test_f1: 0.5150
 epoch: 25, train_loss: 0.9362, test_loss: 1.0502, test_f1: 0.5145
 epoch: 26, train_loss: 0.9488, test_loss: 1.0624, test_f1: 0.5131
 epoch: 27, train_loss: 0.9358, test_loss: 1.0451, test_f1: 0.5246
 epoch: 28, train_loss: 0.9306, test_loss: 1.0373, test_f1: 0.5205
 epoch: 29, train_loss: 0.9220, test_loss: 1.0323, test_f1: 0.5213
 epoch: 30, train_loss: 0.9329, test_loss: 1.0459, test_f1: 0.5324
 epoch: 31, train_loss: 0.9295, test_loss: 1.0348, test_f1: 0.5287
 epoch: 32, train_loss: 0.9180, test_loss: 1.0255, test_f1: 0.5276
 epoch: 33, train_loss: 0.9058, test_loss: 1.0347, test_f1: 0.5369
 epoch: 34, train_loss: 0.9148, test_loss: 1.0139, test_f1: 0.5442
 epoch: 35, train_loss: 0.8939, test_loss: 1.0110, test_f1: 0.5411
 epoch: 36, train_loss: 0.9015, test_loss: 1.0014, test_f1: 0.5743
 epoch: 37, train_loss: 0.8983, test_loss: 1.0400, test_f1: 0.5351
 epoch: 38, train_loss: 0.8994, test_loss: 1.0210, test_f1: 0.5463
 epoch: 39, train_loss: 0.8953, test_loss: 1.0103, test_f1: 0.5566
 epoch: 40, train_loss: 0.8698, test_loss: 1.0056, test_f1: 0.5504
 epoch: 41, train_loss: 0.8776, test_loss: 1.0102, test_f1: 0.5475
 epoch: 42, train_loss: 0.8722, test_loss: 1.0194, test_f1: 0.5257
 epoch: 43, train_loss: 0.8696, test_loss: 1.0072, test_f1: 0.5553
 epoch: 44, train_loss: 0.8630, test_loss: 1.0047, test_f1: 0.5373
 epoch: 45, train_loss: 0.8689, test_loss: 0.9949, test_f1: 0.5618
 epoch: 46, train_loss: 0.8723, test_loss: 1.0075, test_f1: 0.5690
 epoch: 47, train_loss: 0.8592, test_loss: 1.0312, test_f1: 0.5351
 epoch: 48, train_loss: 0.8388, test_loss: 1.0407, test_f1: 0.5243
 epoch: 49, train_loss: 0.8449, test_loss: 1.0211, test_f1: 0.5568
 epoch: 50, train_loss: 0.8189, test_loss: 1.0147, test_f1: 0.5526
 epoch: 51, train_loss: 0.8438, test_loss: 0.9974, test_f1: 0.5683
 epoch: 52, train_loss: 0.8312, test_loss: 0.9956, test_f1: 0.5867
 epoch: 53, train_loss: 0.8317, test_loss: 1.0323, test_f1: 0.5445
 epoch: 54, train_loss: 0.8290, test_loss: 1.0075, test_f1: 0.5549
 epoch: 55, train_loss: 0.8448, test_loss: 1.0168, test_f1: 0.5510
 epoch: 56, train_loss: 0.8236, test_loss: 1.0172, test_f1: 0.5453
 epoch: 57, train_loss: 0.8267, test_loss: 1.0032, test_f1: 0.5591
 epoch: 58, train_loss: 0.8128, test_loss: 0.9881, test_f1: 0.5933
 epoch: 59, train_loss: 0.8135, test_loss: 1.0139, test_f1: 0.5486
 epoch: 60, train_loss: 0.8110, test_loss: 1.0056, test_f1: 0.5652
 epoch: 61, train_loss: 0.8042, test_loss: 0.9990, test_f1: 0.5689
 epoch: 62, train_loss: 0.8128, test_loss: 1.0232, test_f1: 0.5645
 epoch: 63, train_loss: 0.7967, test_loss: 1.0208, test_f1: 0.5616
 epoch: 64, train_loss: 0.8051, test_loss: 1.0064, test_f1: 0.5657
 epoch: 65, train_loss: 0.8135, test_loss: 1.0089, test_f1: 0.5786
 epoch: 66, train_loss: 0.8040, test_loss: 0.9985, test_f1: 0.5720
 epoch: 67, train_loss: 0.7982, test_loss: 1.0036, test_f1: 0.5645
 epoch: 68, train_loss: 0.7911, test_loss: 1.0003, test_f1: 0.5689
 epoch: 69, train_loss: 0.7871, test_loss: 1.0340, test_f1: 0.5419
 epoch: 70, train_loss: 0.7957, test_loss: 1.0039, test_f1: 0.5681
 epoch: 71, train_loss: 0.8035, test_loss: 0.9961, test_f1: 0.5638
 epoch: 72, train_loss: 0.7947, test_loss: 0.9900, test_f1: 0.5871
 epoch: 73, train_loss: 0.7788, test_loss: 1.0104, test_f1: 0.5888
 epoch: 74, train_loss: 0.7857, test_loss: 0.9969, test_f1: 0.5746
 epoch: 75, train_loss: 0.7669, test_loss: 0.9750, test_f1: 0.5740
 epoch: 76, train_loss: 0.7985, test_loss: 0.9976, test_f1: 0.5645
 epoch: 77, train_loss: 0.7715, test_loss: 0.9898, test_f1: 0.5875
 epoch: 78, train_loss: 0.7799, test_loss: 1.0124, test_f1: 0.5748
 epoch: 79, train_loss: 0.7664, test_loss: 0.9901, test_f1: 0.5558
 epoch: 80, train_loss: 0.7606, test_loss: 0.9968, test_f1: 0.5824
 epoch: 81, train_loss: 0.7823, test_loss: 0.9942, test_f1: 0.5669
 epoch: 82, train_loss: 0.7768, test_loss: 0.9879, test_f1: 0.5743
 epoch: 83, train_loss: 0.7868, test_loss: 0.9982, test_f1: 0.5837
 epoch: 84, train_loss: 0.7741, test_loss: 0.9855, test_f1: 0.5735
 epoch: 85, train_loss: 0.7652, test_loss: 0.9866, test_f1: 0.5768
 epoch: 86, train_loss: 0.7740, test_loss: 0.9723, test_f1: 0.5685
 epoch: 87, train_loss: 0.7554, test_loss: 1.0169, test_f1: 0.5712
 epoch: 88, train_loss: 0.7578, test_loss: 1.0053, test_f1: 0.5814
 epoch: 89, train_loss: 0.7727, test_loss: 0.9673, test_f1: 0.5963
 epoch: 90, train_loss: 0.7776, test_loss: 0.9788, test_f1: 0.6203
 epoch: 91, train_loss: 0.7406, test_loss: 0.9888, test_f1: 0.5927
 epoch: 92, train_loss: 0.7581, test_loss: 0.9914, test_f1: 0.5713
 epoch: 93, train_loss: 0.7498, test_loss: 0.9849, test_f1: 0.5929
 epoch: 94, train_loss: 0.7482, test_loss: 1.0072, test_f1: 0.5653
 epoch: 95, train_loss: 0.7417, test_loss: 0.9944, test_f1: 0.5745
 epoch: 96, train_loss: 0.7403, test_loss: 0.9710, test_f1: 0.5627
 epoch: 97, train_loss: 0.7436, test_loss: 1.0015, test_f1: 0.5756
 epoch: 98, train_loss: 0.7429, test_loss: 0.9780, test_f1: 0.5599
 epoch: 99, train_loss: 0.7380, test_loss: 1.0202, test_f1: 0.5605
##################ITERATION #9 ****************************************
 epoch: 0, train_loss: 1.2781, test_loss: 1.4274, test_f1: 0.2281
 epoch: 1, train_loss: 1.1360, test_loss: 1.2893, test_f1: 0.2281
 epoch: 2, train_loss: 1.0880, test_loss: 1.1911, test_f1: 0.2992
 epoch: 3, train_loss: 1.0713, test_loss: 1.1707, test_f1: 0.4058
 epoch: 4, train_loss: 1.0414, test_loss: 1.1629, test_f1: 0.4392
 epoch: 5, train_loss: 1.0328, test_loss: 1.1260, test_f1: 0.4486
 epoch: 6, train_loss: 1.0225, test_loss: 1.0771, test_f1: 0.4678
 epoch: 7, train_loss: 1.0055, test_loss: 1.0627, test_f1: 0.5001
 epoch: 8, train_loss: 1.0073, test_loss: 1.0553, test_f1: 0.5157
 epoch: 9, train_loss: 0.9772, test_loss: 1.0707, test_f1: 0.5074
 epoch: 10, train_loss: 0.9707, test_loss: 1.0559, test_f1: 0.5216
 epoch: 11, train_loss: 0.9737, test_loss: 1.0338, test_f1: 0.5446
 epoch: 12, train_loss: 0.9708, test_loss: 1.0437, test_f1: 0.5372
 epoch: 13, train_loss: 0.9393, test_loss: 1.0231, test_f1: 0.5453
 epoch: 14, train_loss: 0.9383, test_loss: 1.0399, test_f1: 0.5486
 epoch: 15, train_loss: 0.9309, test_loss: 1.0428, test_f1: 0.5063
 epoch: 16, train_loss: 0.9129, test_loss: 1.0260, test_f1: 0.5533
 epoch: 17, train_loss: 0.9162, test_loss: 1.0294, test_f1: 0.5494
 epoch: 18, train_loss: 0.9057, test_loss: 1.0342, test_f1: 0.5579
 epoch: 19, train_loss: 0.9071, test_loss: 1.0214, test_f1: 0.5557
 epoch: 20, train_loss: 0.8883, test_loss: 1.0428, test_f1: 0.5425
 epoch: 21, train_loss: 0.8943, test_loss: 1.0353, test_f1: 0.5417
 epoch: 22, train_loss: 0.8838, test_loss: 1.0117, test_f1: 0.5754
 epoch: 23, train_loss: 0.8808, test_loss: 1.0283, test_f1: 0.5346
 epoch: 24, train_loss: 0.8725, test_loss: 1.0178, test_f1: 0.5562
 epoch: 25, train_loss: 0.8682, test_loss: 1.0244, test_f1: 0.5539
 epoch: 26, train_loss: 0.8583, test_loss: 1.0163, test_f1: 0.5648
 epoch: 27, train_loss: 0.8527, test_loss: 1.0145, test_f1: 0.5519
 epoch: 28, train_loss: 0.8484, test_loss: 1.0082, test_f1: 0.5769
 epoch: 29, train_loss: 0.8387, test_loss: 0.9902, test_f1: 0.5806
 epoch: 30, train_loss: 0.8495, test_loss: 1.0215, test_f1: 0.5526
 epoch: 31, train_loss: 0.8290, test_loss: 1.0122, test_f1: 0.5646
 epoch: 32, train_loss: 0.8365, test_loss: 1.0028, test_f1: 0.5622
 epoch: 33, train_loss: 0.8313, test_loss: 1.0349, test_f1: 0.5384
 epoch: 34, train_loss: 0.8373, test_loss: 1.0037, test_f1: 0.5786
 epoch: 35, train_loss: 0.8376, test_loss: 1.0165, test_f1: 0.5613
 epoch: 36, train_loss: 0.8128, test_loss: 0.9896, test_f1: 0.5768
 epoch: 37, train_loss: 0.8184, test_loss: 1.0097, test_f1: 0.5611
 epoch: 38, train_loss: 0.8140, test_loss: 1.0031, test_f1: 0.5472
 epoch: 39, train_loss: 0.8249, test_loss: 1.0238, test_f1: 0.5240
 epoch: 40, train_loss: 0.8182, test_loss: 0.9640, test_f1: 0.5527
 epoch: 41, train_loss: 0.8082, test_loss: 0.9828, test_f1: 0.5997
 epoch: 42, train_loss: 0.8071, test_loss: 1.0133, test_f1: 0.5570
 epoch: 43, train_loss: 0.8062, test_loss: 1.0103, test_f1: 0.5317
 epoch: 44, train_loss: 0.7947, test_loss: 0.9866, test_f1: 0.5602
 epoch: 45, train_loss: 0.7871, test_loss: 1.0364, test_f1: 0.4888
 epoch: 46, train_loss: 0.7857, test_loss: 0.9735, test_f1: 0.6048
 epoch: 47, train_loss: 0.7966, test_loss: 1.0484, test_f1: 0.5016
 epoch: 48, train_loss: 0.7882, test_loss: 0.9682, test_f1: 0.5641
 epoch: 49, train_loss: 0.7763, test_loss: 1.0305, test_f1: 0.5327
 epoch: 50, train_loss: 0.7619, test_loss: 0.9904, test_f1: 0.5774
 epoch: 51, train_loss: 0.7783, test_loss: 1.0017, test_f1: 0.5720
 epoch: 52, train_loss: 0.7568, test_loss: 0.9968, test_f1: 0.5770
 epoch: 53, train_loss: 0.7448, test_loss: 0.9606, test_f1: 0.5857
 epoch: 54, train_loss: 0.7517, test_loss: 0.9813, test_f1: 0.5635
 epoch: 55, train_loss: 0.7457, test_loss: 0.9653, test_f1: 0.6006
 epoch: 56, train_loss: 0.7532, test_loss: 0.9902, test_f1: 0.5646
 epoch: 57, train_loss: 0.7527, test_loss: 0.9755, test_f1: 0.5657
 epoch: 58, train_loss: 0.7508, test_loss: 1.0119, test_f1: 0.5580
 epoch: 59, train_loss: 0.7503, test_loss: 0.9865, test_f1: 0.5751
 epoch: 60, train_loss: 0.7602, test_loss: 0.9738, test_f1: 0.5659
 epoch: 61, train_loss: 0.7454, test_loss: 0.9754, test_f1: 0.5864
 epoch: 62, train_loss: 0.7395, test_loss: 0.9789, test_f1: 0.5815
 epoch: 63, train_loss: 0.7316, test_loss: 0.9723, test_f1: 0.5764
 epoch: 64, train_loss: 0.7289, test_loss: 0.9771, test_f1: 0.5850
 epoch: 65, train_loss: 0.7300, test_loss: 0.9739, test_f1: 0.5760
 epoch: 66, train_loss: 0.7315, test_loss: 0.9844, test_f1: 0.5745
 epoch: 67, train_loss: 0.7227, test_loss: 0.9666, test_f1: 0.5913
 epoch: 68, train_loss: 0.7343, test_loss: 0.9670, test_f1: 0.5896
 epoch: 69, train_loss: 0.7250, test_loss: 0.9673, test_f1: 0.5700
 epoch: 70, train_loss: 0.7215, test_loss: 0.9490, test_f1: 0.5751
 epoch: 71, train_loss: 0.7193, test_loss: 0.9381, test_f1: 0.6107
 epoch: 72, train_loss: 0.7287, test_loss: 0.9835, test_f1: 0.5416
 epoch: 73, train_loss: 0.7301, test_loss: 0.9866, test_f1: 0.5499
 epoch: 74, train_loss: 0.7066, test_loss: 0.9697, test_f1: 0.5998
 epoch: 75, train_loss: 0.7122, test_loss: 0.9457, test_f1: 0.5876
 epoch: 76, train_loss: 0.7113, test_loss: 0.9498, test_f1: 0.6168
 epoch: 77, train_loss: 0.7233, test_loss: 0.9739, test_f1: 0.5492
 epoch: 78, train_loss: 0.7001, test_loss: 0.9976, test_f1: 0.5748
 epoch: 79, train_loss: 0.6979, test_loss: 0.9645, test_f1: 0.5766
 epoch: 80, train_loss: 0.6914, test_loss: 0.9451, test_f1: 0.5940
 epoch: 81, train_loss: 0.7011, test_loss: 0.9500, test_f1: 0.5815
 epoch: 82, train_loss: 0.7011, test_loss: 0.9860, test_f1: 0.5931
 epoch: 83, train_loss: 0.7198, test_loss: 0.9414, test_f1: 0.6037
 epoch: 84, train_loss: 0.6948, test_loss: 0.9240, test_f1: 0.6170
 epoch: 85, train_loss: 0.7022, test_loss: 0.9683, test_f1: 0.5965
 epoch: 86, train_loss: 0.6933, test_loss: 0.9760, test_f1: 0.5776
 epoch: 87, train_loss: 0.6992, test_loss: 0.9208, test_f1: 0.6125
 epoch: 88, train_loss: 0.7030, test_loss: 0.9345, test_f1: 0.5823
 epoch: 89, train_loss: 0.6877, test_loss: 0.9393, test_f1: 0.6079
 epoch: 90, train_loss: 0.6981, test_loss: 0.9677, test_f1: 0.5623
 epoch: 91, train_loss: 0.6920, test_loss: 0.9541, test_f1: 0.5994
 epoch: 92, train_loss: 0.6793, test_loss: 0.9305, test_f1: 0.5987
 epoch: 93, train_loss: 0.6751, test_loss: 0.9586, test_f1: 0.5944
 epoch: 94, train_loss: 0.6808, test_loss: 0.9700, test_f1: 0.5818
 epoch: 95, train_loss: 0.6746, test_loss: 0.9626, test_f1: 0.5833
 epoch: 96, train_loss: 0.6818, test_loss: 0.9237, test_f1: 0.6028
 epoch: 97, train_loss: 0.6763, test_loss: 0.9340, test_f1: 0.6111
 epoch: 98, train_loss: 0.6859, test_loss: 0.9604, test_f1: 0.6074
 epoch: 99, train_loss: 0.6731, test_loss: 0.9417, test_f1: 0.5967

Training completed in 442.43 seconds
Best F1: 0.6385 at epoch 97
Mean F1 across iterations: 0.6068  0.0194
========================FINAL RESULTS================================
FEGIN weighted F1: 0.6385  0.0194
python main.py --data ltspice_demos --representation component_pin_net --model FEGIN --layers 3 --hiddens 16 --batch_size 128 --lr 0.001 --emb_size 128 --epochs 100 --save_appendix component_pin_net_L3_H16_BS128_LR0.001_E128 --no_val
-----



STDERR:
  File "main.py", line 370, in <module>
    main()
  File "main.py", line 254, in main
    dataset = dataset_class(
  File "/home/philip/projects/ltspice_examples_code_repo/Circuit-Completion-Using-GNNs/component_classification_with_link_prediction_head/evaluation/FEGIN/kernel/circuit_datasets.py", line 15, in __init__
    self.data, self.slices = torch.load(self.processed_paths[0])
  File "/home/philip/.local/lib/python3.8/site-packages/torch/serialization.py", line 1040, in load
    warnings.warn(
  File "/usr/lib/python3.8/warnings.py", line 109, in _showwarnmsg
    sw(msg.message, msg.category, msg.filename, msg.lineno,
  File "main.py", line 47, in warn_with_traceback
    traceback.print_stack(file=log)
/home/philip/projects/ltspice_examples_code_repo/Circuit-Completion-Using-GNNs/component_classification_with_link_prediction_head/evaluation/FEGIN/kernel/circuit_datasets.py:15: FutureWarning: You are using `torch.load` with `weights_only=False` (the current default value), which uses the default pickle module implicitly. It is possible to construct malicious pickle data which will execute arbitrary code during unpickling (See https://github.com/pytorch/pytorch/blob/main/SECURITY.md#untrusted-models for more details). In a future release, the default value for `weights_only` will be flipped to `True`. This limits the functions that could be executed during unpickling. Arbitrary objects will no longer be allowed to be loaded via this mode unless they are explicitly allowlisted by the user via `torch.serialization.add_safe_globals`. We recommend you start setting `weights_only=True` for any use case where you don't have full control of the loaded file. Please open an issue on GitHub for any issues related to this experimental feature.
  self.data, self.slices = torch.load(self.processed_paths[0])
