STDOUT:
Results will be saved in /home/philip/projects/ltspice_examples_code_repo/Circuit-Completion-Using-GNNs/component_classification_with_link_prediction_head/evaluation/FEGIN/results/model_FEGIN_dataset_ltspice_examples
Command line input: python main.py --data ltspice_examples --representation component_pin_net --model FEGIN --layers 5 --hiddens 32 --batch_size 128 --lr 0.0001 --emb_size 512 --epochs 100 --save_appendix component_pin_net_L5_H32_BS128_LR0.0001_E512 --no_val
 is saved.
-----
ltspice_examples - FEGIN
Using 5 layers, 32 hidden units, h = 2
Loading component_pin_net representation dataset
ENTERED
Training FEGIN on component_pin_net representation
Train: 3558, Test: 846
##################ITERATION #0 ****************************************
 epoch: 0, train_loss: 1.3972, test_loss: 1.3959, test_f1: 0.1004
 epoch: 1, train_loss: 1.3879, test_loss: 1.3915, test_f1: 0.1004
 epoch: 2, train_loss: 1.3809, test_loss: 1.3796, test_f1: 0.1004
 epoch: 3, train_loss: 1.3713, test_loss: 1.3673, test_f1: 0.1296
 epoch: 4, train_loss: 1.3599, test_loss: 1.3545, test_f1: 0.1799
 epoch: 5, train_loss: 1.3460, test_loss: 1.3390, test_f1: 0.2630
 epoch: 6, train_loss: 1.3293, test_loss: 1.3209, test_f1: 0.3050
 epoch: 7, train_loss: 1.3107, test_loss: 1.3026, test_f1: 0.2720
 epoch: 8, train_loss: 1.2914, test_loss: 1.2806, test_f1: 0.2419
 epoch: 9, train_loss: 1.2736, test_loss: 1.2628, test_f1: 0.2359
 epoch: 10, train_loss: 1.2585, test_loss: 1.2461, test_f1: 0.2310
 epoch: 11, train_loss: 1.2499, test_loss: 1.2337, test_f1: 0.2299
 epoch: 12, train_loss: 1.2355, test_loss: 1.2219, test_f1: 0.2295
 epoch: 13, train_loss: 1.2279, test_loss: 1.2128, test_f1: 0.2270
 epoch: 14, train_loss: 1.2155, test_loss: 1.2038, test_f1: 0.2270
 epoch: 15, train_loss: 1.2101, test_loss: 1.1944, test_f1: 0.2270
 epoch: 16, train_loss: 1.2071, test_loss: 1.1876, test_f1: 0.2344
 epoch: 17, train_loss: 1.1958, test_loss: 1.1821, test_f1: 0.2885
 epoch: 18, train_loss: 1.1908, test_loss: 1.1739, test_f1: 0.3155
 epoch: 19, train_loss: 1.1866, test_loss: 1.1693, test_f1: 0.3362
 epoch: 20, train_loss: 1.1811, test_loss: 1.1608, test_f1: 0.3364
 epoch: 21, train_loss: 1.1679, test_loss: 1.1537, test_f1: 0.3393
 epoch: 22, train_loss: 1.1680, test_loss: 1.1469, test_f1: 0.3403
 epoch: 23, train_loss: 1.1606, test_loss: 1.1409, test_f1: 0.3405
 epoch: 24, train_loss: 1.1504, test_loss: 1.1317, test_f1: 0.3523
 epoch: 25, train_loss: 1.1429, test_loss: 1.1252, test_f1: 0.3629
 epoch: 26, train_loss: 1.1373, test_loss: 1.1159, test_f1: 0.3807
 epoch: 27, train_loss: 1.1289, test_loss: 1.1110, test_f1: 0.3821
 epoch: 28, train_loss: 1.1173, test_loss: 1.0987, test_f1: 0.4015
 epoch: 29, train_loss: 1.1063, test_loss: 1.0945, test_f1: 0.4088
 epoch: 30, train_loss: 1.1013, test_loss: 1.0844, test_f1: 0.4091
 epoch: 31, train_loss: 1.0963, test_loss: 1.0785, test_f1: 0.4091
 epoch: 32, train_loss: 1.0881, test_loss: 1.0710, test_f1: 0.4104
 epoch: 33, train_loss: 1.0766, test_loss: 1.0663, test_f1: 0.4000
 epoch: 34, train_loss: 1.0797, test_loss: 1.0612, test_f1: 0.4038
 epoch: 35, train_loss: 1.0633, test_loss: 1.0558, test_f1: 0.4007
 epoch: 36, train_loss: 1.0563, test_loss: 1.0507, test_f1: 0.4060
 epoch: 37, train_loss: 1.0486, test_loss: 1.0521, test_f1: 0.4247
 epoch: 38, train_loss: 1.0472, test_loss: 1.0445, test_f1: 0.4322
 epoch: 39, train_loss: 1.0412, test_loss: 1.0449, test_f1: 0.4383
 epoch: 40, train_loss: 1.0344, test_loss: 1.0398, test_f1: 0.4346
 epoch: 41, train_loss: 1.0323, test_loss: 1.0372, test_f1: 0.4463
 epoch: 42, train_loss: 1.0238, test_loss: 1.0303, test_f1: 0.4528
 epoch: 43, train_loss: 1.0161, test_loss: 1.0276, test_f1: 0.4622
 epoch: 44, train_loss: 1.0145, test_loss: 1.0249, test_f1: 0.4528
 epoch: 45, train_loss: 1.0146, test_loss: 1.0293, test_f1: 0.4577
 epoch: 46, train_loss: 1.0082, test_loss: 1.0161, test_f1: 0.4917
 epoch: 47, train_loss: 0.9980, test_loss: 1.0171, test_f1: 0.4857
 epoch: 48, train_loss: 0.9906, test_loss: 1.0153, test_f1: 0.4919
 epoch: 49, train_loss: 0.9911, test_loss: 1.0290, test_f1: 0.4970
 epoch: 50, train_loss: 0.9846, test_loss: 1.0085, test_f1: 0.5138
 epoch: 51, train_loss: 0.9848, test_loss: 1.0099, test_f1: 0.5137
 epoch: 52, train_loss: 0.9828, test_loss: 1.0203, test_f1: 0.4882
 epoch: 53, train_loss: 0.9741, test_loss: 1.0046, test_f1: 0.5096
 epoch: 54, train_loss: 0.9747, test_loss: 1.0037, test_f1: 0.5095
 epoch: 55, train_loss: 0.9752, test_loss: 1.0073, test_f1: 0.5213
 epoch: 56, train_loss: 0.9704, test_loss: 1.0050, test_f1: 0.5191
 epoch: 57, train_loss: 0.9681, test_loss: 1.0012, test_f1: 0.5159
 epoch: 58, train_loss: 0.9672, test_loss: 1.0007, test_f1: 0.5136
 epoch: 59, train_loss: 0.9616, test_loss: 1.0040, test_f1: 0.5195
 epoch: 60, train_loss: 0.9581, test_loss: 1.0011, test_f1: 0.5197
 epoch: 61, train_loss: 0.9713, test_loss: 1.0030, test_f1: 0.5190
 epoch: 62, train_loss: 0.9568, test_loss: 1.0009, test_f1: 0.5318
 epoch: 63, train_loss: 0.9703, test_loss: 0.9988, test_f1: 0.5288
 epoch: 64, train_loss: 0.9563, test_loss: 0.9939, test_f1: 0.5260
 epoch: 65, train_loss: 0.9559, test_loss: 0.9954, test_f1: 0.5195
 epoch: 66, train_loss: 0.9558, test_loss: 0.9919, test_f1: 0.5392
 epoch: 67, train_loss: 0.9489, test_loss: 0.9933, test_f1: 0.5404
 epoch: 68, train_loss: 0.9472, test_loss: 0.9908, test_f1: 0.5299
 epoch: 69, train_loss: 0.9506, test_loss: 0.9881, test_f1: 0.5418
 epoch: 70, train_loss: 0.9502, test_loss: 0.9900, test_f1: 0.5448
 epoch: 71, train_loss: 0.9440, test_loss: 0.9891, test_f1: 0.5331
 epoch: 72, train_loss: 0.9491, test_loss: 0.9862, test_f1: 0.5247
 epoch: 73, train_loss: 0.9426, test_loss: 0.9842, test_f1: 0.5361
 epoch: 74, train_loss: 0.9415, test_loss: 0.9855, test_f1: 0.5361
 epoch: 75, train_loss: 0.9458, test_loss: 0.9875, test_f1: 0.5286
 epoch: 76, train_loss: 0.9449, test_loss: 0.9831, test_f1: 0.5320
 epoch: 77, train_loss: 0.9368, test_loss: 0.9843, test_f1: 0.5284
 epoch: 78, train_loss: 0.9387, test_loss: 0.9819, test_f1: 0.5312
 epoch: 79, train_loss: 0.9318, test_loss: 0.9828, test_f1: 0.5288
 epoch: 80, train_loss: 0.9321, test_loss: 0.9794, test_f1: 0.5426
 epoch: 81, train_loss: 0.9287, test_loss: 0.9749, test_f1: 0.5411
 epoch: 82, train_loss: 0.9275, test_loss: 0.9741, test_f1: 0.5353
 epoch: 83, train_loss: 0.9301, test_loss: 0.9797, test_f1: 0.5314
 epoch: 84, train_loss: 0.9340, test_loss: 0.9737, test_f1: 0.5335
 epoch: 85, train_loss: 0.9343, test_loss: 0.9747, test_f1: 0.5339
 epoch: 86, train_loss: 0.9317, test_loss: 0.9716, test_f1: 0.5368
 epoch: 87, train_loss: 0.9245, test_loss: 0.9741, test_f1: 0.5369
 epoch: 88, train_loss: 0.9212, test_loss: 0.9735, test_f1: 0.5425
 epoch: 89, train_loss: 0.9289, test_loss: 0.9696, test_f1: 0.5369
 epoch: 90, train_loss: 0.9205, test_loss: 0.9697, test_f1: 0.5422
 epoch: 91, train_loss: 0.9279, test_loss: 0.9676, test_f1: 0.5382
 epoch: 92, train_loss: 0.9178, test_loss: 0.9682, test_f1: 0.5386
 epoch: 93, train_loss: 0.9145, test_loss: 0.9661, test_f1: 0.5434
 epoch: 94, train_loss: 0.9107, test_loss: 0.9697, test_f1: 0.5427
 epoch: 95, train_loss: 0.9204, test_loss: 0.9735, test_f1: 0.5312
 epoch: 96, train_loss: 0.9203, test_loss: 0.9654, test_f1: 0.5432
 epoch: 97, train_loss: 0.9238, test_loss: 0.9637, test_f1: 0.5263
 epoch: 98, train_loss: 0.9164, test_loss: 0.9687, test_f1: 0.5366
 epoch: 99, train_loss: 0.9084, test_loss: 0.9639, test_f1: 0.5343
##################ITERATION #1 ****************************************
 epoch: 0, train_loss: 1.3663, test_loss: 1.3742, test_f1: 0.1004
 epoch: 1, train_loss: 1.3411, test_loss: 1.3627, test_f1: 0.1053
 epoch: 2, train_loss: 1.3236, test_loss: 1.3197, test_f1: 0.3235
 epoch: 3, train_loss: 1.3051, test_loss: 1.2955, test_f1: 0.3990
 epoch: 4, train_loss: 1.2851, test_loss: 1.2713, test_f1: 0.3848
 epoch: 5, train_loss: 1.2662, test_loss: 1.2494, test_f1: 0.3438
 epoch: 6, train_loss: 1.2440, test_loss: 1.2296, test_f1: 0.3451
 epoch: 7, train_loss: 1.2245, test_loss: 1.2086, test_f1: 0.3451
 epoch: 8, train_loss: 1.2059, test_loss: 1.1869, test_f1: 0.3460
 epoch: 9, train_loss: 1.1907, test_loss: 1.1721, test_f1: 0.3460
 epoch: 10, train_loss: 1.1736, test_loss: 1.1533, test_f1: 0.3460
 epoch: 11, train_loss: 1.1607, test_loss: 1.1418, test_f1: 0.3411
 epoch: 12, train_loss: 1.1465, test_loss: 1.1257, test_f1: 0.3441
 epoch: 13, train_loss: 1.1360, test_loss: 1.1130, test_f1: 0.3441
 epoch: 14, train_loss: 1.1264, test_loss: 1.1066, test_f1: 0.3382
 epoch: 15, train_loss: 1.1138, test_loss: 1.0949, test_f1: 0.3421
 epoch: 16, train_loss: 1.1043, test_loss: 1.0858, test_f1: 0.3421
 epoch: 17, train_loss: 1.0895, test_loss: 1.0785, test_f1: 0.3392
 epoch: 18, train_loss: 1.0821, test_loss: 1.0727, test_f1: 0.3344
 epoch: 19, train_loss: 1.0770, test_loss: 1.0668, test_f1: 0.3392
 epoch: 20, train_loss: 1.0749, test_loss: 1.0612, test_f1: 0.3387
 epoch: 21, train_loss: 1.0635, test_loss: 1.0559, test_f1: 0.3401
 epoch: 22, train_loss: 1.0583, test_loss: 1.0546, test_f1: 0.3433
 epoch: 23, train_loss: 1.0471, test_loss: 1.0513, test_f1: 0.3634
 epoch: 24, train_loss: 1.0402, test_loss: 1.0482, test_f1: 0.3690
 epoch: 25, train_loss: 1.0386, test_loss: 1.0520, test_f1: 0.3834
 epoch: 26, train_loss: 1.0356, test_loss: 1.0462, test_f1: 0.4065
 epoch: 27, train_loss: 1.0313, test_loss: 1.0376, test_f1: 0.4187
 epoch: 28, train_loss: 1.0288, test_loss: 1.0384, test_f1: 0.4316
 epoch: 29, train_loss: 1.0197, test_loss: 1.0396, test_f1: 0.4311
 epoch: 30, train_loss: 1.0199, test_loss: 1.0285, test_f1: 0.4458
 epoch: 31, train_loss: 1.0134, test_loss: 1.0326, test_f1: 0.4324
 epoch: 32, train_loss: 1.0094, test_loss: 1.0387, test_f1: 0.4365
 epoch: 33, train_loss: 1.0070, test_loss: 1.0261, test_f1: 0.4440
 epoch: 34, train_loss: 1.0036, test_loss: 1.0273, test_f1: 0.4502
 epoch: 35, train_loss: 0.9942, test_loss: 1.0074, test_f1: 0.4655
 epoch: 36, train_loss: 0.9937, test_loss: 1.0125, test_f1: 0.4621
 epoch: 37, train_loss: 0.9882, test_loss: 1.0127, test_f1: 0.4531
 epoch: 38, train_loss: 0.9871, test_loss: 1.0117, test_f1: 0.4739
 epoch: 39, train_loss: 0.9791, test_loss: 1.0218, test_f1: 0.4700
 epoch: 40, train_loss: 0.9733, test_loss: 1.0029, test_f1: 0.4770
 epoch: 41, train_loss: 0.9698, test_loss: 0.9890, test_f1: 0.5000
 epoch: 42, train_loss: 0.9689, test_loss: 0.9957, test_f1: 0.4876
 epoch: 43, train_loss: 0.9650, test_loss: 0.9889, test_f1: 0.4893
 epoch: 44, train_loss: 0.9645, test_loss: 0.9775, test_f1: 0.5013
 epoch: 45, train_loss: 0.9600, test_loss: 0.9754, test_f1: 0.5061
 epoch: 46, train_loss: 0.9512, test_loss: 0.9694, test_f1: 0.4963
 epoch: 47, train_loss: 0.9505, test_loss: 0.9730, test_f1: 0.5156
 epoch: 48, train_loss: 0.9494, test_loss: 0.9748, test_f1: 0.5051
 epoch: 49, train_loss: 0.9422, test_loss: 0.9786, test_f1: 0.5218
 epoch: 50, train_loss: 0.9320, test_loss: 0.9621, test_f1: 0.5173
 epoch: 51, train_loss: 0.9441, test_loss: 0.9694, test_f1: 0.5056
 epoch: 52, train_loss: 0.9355, test_loss: 0.9672, test_f1: 0.5204
 epoch: 53, train_loss: 0.9319, test_loss: 0.9659, test_f1: 0.5117
 epoch: 54, train_loss: 0.9316, test_loss: 0.9591, test_f1: 0.5239
 epoch: 55, train_loss: 0.9232, test_loss: 0.9561, test_f1: 0.5231
 epoch: 56, train_loss: 0.9301, test_loss: 0.9501, test_f1: 0.5242
 epoch: 57, train_loss: 0.9261, test_loss: 0.9630, test_f1: 0.5149
 epoch: 58, train_loss: 0.9256, test_loss: 0.9455, test_f1: 0.5054
 epoch: 59, train_loss: 0.9256, test_loss: 0.9398, test_f1: 0.5191
 epoch: 60, train_loss: 0.9220, test_loss: 0.9430, test_f1: 0.5254
 epoch: 61, train_loss: 0.9195, test_loss: 0.9428, test_f1: 0.5150
 epoch: 62, train_loss: 0.9158, test_loss: 0.9446, test_f1: 0.5084
 epoch: 63, train_loss: 0.9262, test_loss: 0.9400, test_f1: 0.5170
 epoch: 64, train_loss: 0.9189, test_loss: 0.9448, test_f1: 0.5049
 epoch: 65, train_loss: 0.9160, test_loss: 0.9398, test_f1: 0.5308
 epoch: 66, train_loss: 0.9184, test_loss: 0.9457, test_f1: 0.5149
 epoch: 67, train_loss: 0.9119, test_loss: 0.9394, test_f1: 0.5075
 epoch: 68, train_loss: 0.9092, test_loss: 0.9431, test_f1: 0.5147
 epoch: 69, train_loss: 0.9186, test_loss: 0.9297, test_f1: 0.5263
 epoch: 70, train_loss: 0.9136, test_loss: 0.9385, test_f1: 0.5036
 epoch: 71, train_loss: 0.9099, test_loss: 0.9474, test_f1: 0.5271
 epoch: 72, train_loss: 0.9133, test_loss: 0.9439, test_f1: 0.5223
 epoch: 73, train_loss: 0.9055, test_loss: 0.9351, test_f1: 0.5247
 epoch: 74, train_loss: 0.9049, test_loss: 0.9338, test_f1: 0.5332
 epoch: 75, train_loss: 0.9001, test_loss: 0.9304, test_f1: 0.5108
 epoch: 76, train_loss: 0.9033, test_loss: 0.9283, test_f1: 0.5357
 epoch: 77, train_loss: 0.9052, test_loss: 0.9441, test_f1: 0.5061
 epoch: 78, train_loss: 0.9042, test_loss: 0.9323, test_f1: 0.5208
 epoch: 79, train_loss: 0.8997, test_loss: 0.9359, test_f1: 0.5255
 epoch: 80, train_loss: 0.9085, test_loss: 0.9418, test_f1: 0.5236
 epoch: 81, train_loss: 0.8936, test_loss: 0.9426, test_f1: 0.5092
 epoch: 82, train_loss: 0.8967, test_loss: 0.9391, test_f1: 0.5090
 epoch: 83, train_loss: 0.8985, test_loss: 0.9345, test_f1: 0.5295
 epoch: 84, train_loss: 0.8958, test_loss: 0.9349, test_f1: 0.5111
 epoch: 85, train_loss: 0.8924, test_loss: 0.9326, test_f1: 0.5169
 epoch: 86, train_loss: 0.8926, test_loss: 0.9263, test_f1: 0.5211
 epoch: 87, train_loss: 0.8964, test_loss: 0.9356, test_f1: 0.5359
 epoch: 88, train_loss: 0.8962, test_loss: 0.9214, test_f1: 0.5181
 epoch: 89, train_loss: 0.8936, test_loss: 0.9218, test_f1: 0.5320
 epoch: 90, train_loss: 0.8933, test_loss: 0.9329, test_f1: 0.5079
 epoch: 91, train_loss: 0.8864, test_loss: 0.9196, test_f1: 0.5325
 epoch: 92, train_loss: 0.8967, test_loss: 0.9298, test_f1: 0.5343
 epoch: 93, train_loss: 0.8939, test_loss: 0.9223, test_f1: 0.5362
 epoch: 94, train_loss: 0.8881, test_loss: 0.9255, test_f1: 0.5358
 epoch: 95, train_loss: 0.8883, test_loss: 0.9359, test_f1: 0.5208
 epoch: 96, train_loss: 0.8785, test_loss: 0.9288, test_f1: 0.5082
 epoch: 97, train_loss: 0.8906, test_loss: 0.9322, test_f1: 0.5347
 epoch: 98, train_loss: 0.8947, test_loss: 0.9135, test_f1: 0.5194
 epoch: 99, train_loss: 0.8887, test_loss: 0.9359, test_f1: 0.5105
##################ITERATION #2 ****************************************
 epoch: 0, train_loss: 1.3176, test_loss: 1.3390, test_f1: 0.1125
 epoch: 1, train_loss: 1.2849, test_loss: 1.3092, test_f1: 0.2538
 epoch: 2, train_loss: 1.2653, test_loss: 1.2663, test_f1: 0.2976
 epoch: 3, train_loss: 1.2436, test_loss: 1.2320, test_f1: 0.3434
 epoch: 4, train_loss: 1.2232, test_loss: 1.2068, test_f1: 0.3589
 epoch: 5, train_loss: 1.2014, test_loss: 1.1855, test_f1: 0.3307
 epoch: 6, train_loss: 1.1790, test_loss: 1.1644, test_f1: 0.3313
 epoch: 7, train_loss: 1.1629, test_loss: 1.1475, test_f1: 0.3297
 epoch: 8, train_loss: 1.1453, test_loss: 1.1318, test_f1: 0.3231
 epoch: 9, train_loss: 1.1314, test_loss: 1.1206, test_f1: 0.3212
 epoch: 10, train_loss: 1.1140, test_loss: 1.1046, test_f1: 0.3323
 epoch: 11, train_loss: 1.1057, test_loss: 1.0943, test_f1: 0.3532
 epoch: 12, train_loss: 1.0879, test_loss: 1.0908, test_f1: 0.3601
 epoch: 13, train_loss: 1.0792, test_loss: 1.0765, test_f1: 0.3912
 epoch: 14, train_loss: 1.0680, test_loss: 1.0673, test_f1: 0.4067
 epoch: 15, train_loss: 1.0564, test_loss: 1.0631, test_f1: 0.4382
 epoch: 16, train_loss: 1.0427, test_loss: 1.0703, test_f1: 0.3956
 epoch: 17, train_loss: 1.0400, test_loss: 1.0456, test_f1: 0.4349
 epoch: 18, train_loss: 1.0294, test_loss: 1.0580, test_f1: 0.4250
 epoch: 19, train_loss: 1.0194, test_loss: 1.0326, test_f1: 0.4512
 epoch: 20, train_loss: 1.0137, test_loss: 1.0370, test_f1: 0.4492
 epoch: 21, train_loss: 1.0106, test_loss: 1.0424, test_f1: 0.4443
 epoch: 22, train_loss: 1.0069, test_loss: 1.0301, test_f1: 0.4594
 epoch: 23, train_loss: 1.0020, test_loss: 1.0168, test_f1: 0.4711
 epoch: 24, train_loss: 0.9924, test_loss: 1.0179, test_f1: 0.4653
 epoch: 25, train_loss: 0.9865, test_loss: 1.0275, test_f1: 0.4632
 epoch: 26, train_loss: 0.9784, test_loss: 1.0116, test_f1: 0.4582
 epoch: 27, train_loss: 0.9791, test_loss: 1.0081, test_f1: 0.4693
 epoch: 28, train_loss: 0.9715, test_loss: 1.0031, test_f1: 0.4778
 epoch: 29, train_loss: 0.9615, test_loss: 0.9989, test_f1: 0.4738
 epoch: 30, train_loss: 0.9611, test_loss: 1.0106, test_f1: 0.4686
 epoch: 31, train_loss: 0.9598, test_loss: 0.9941, test_f1: 0.4707
 epoch: 32, train_loss: 0.9552, test_loss: 0.9984, test_f1: 0.4673
 epoch: 33, train_loss: 0.9504, test_loss: 0.9982, test_f1: 0.4807
 epoch: 34, train_loss: 0.9534, test_loss: 0.9901, test_f1: 0.4804
 epoch: 35, train_loss: 0.9445, test_loss: 0.9925, test_f1: 0.4882
 epoch: 36, train_loss: 0.9444, test_loss: 0.9965, test_f1: 0.4787
 epoch: 37, train_loss: 0.9387, test_loss: 0.9736, test_f1: 0.4973
 epoch: 38, train_loss: 0.9356, test_loss: 0.9857, test_f1: 0.4939
 epoch: 39, train_loss: 0.9326, test_loss: 0.9814, test_f1: 0.4919
 epoch: 40, train_loss: 0.9243, test_loss: 0.9691, test_f1: 0.4998
 epoch: 41, train_loss: 0.9233, test_loss: 0.9651, test_f1: 0.5034
 epoch: 42, train_loss: 0.9199, test_loss: 0.9613, test_f1: 0.5048
 epoch: 43, train_loss: 0.9215, test_loss: 0.9666, test_f1: 0.4962
 epoch: 44, train_loss: 0.9259, test_loss: 0.9670, test_f1: 0.5112
 epoch: 45, train_loss: 0.9138, test_loss: 0.9637, test_f1: 0.4949
 epoch: 46, train_loss: 0.9211, test_loss: 0.9637, test_f1: 0.5070
 epoch: 47, train_loss: 0.9072, test_loss: 0.9401, test_f1: 0.4895
 epoch: 48, train_loss: 0.9135, test_loss: 0.9948, test_f1: 0.5006
 epoch: 49, train_loss: 0.9187, test_loss: 0.9429, test_f1: 0.5029
 epoch: 50, train_loss: 0.9100, test_loss: 0.9590, test_f1: 0.5086
 epoch: 51, train_loss: 0.9049, test_loss: 0.9302, test_f1: 0.5063
 epoch: 52, train_loss: 0.9027, test_loss: 0.9497, test_f1: 0.5055
 epoch: 53, train_loss: 0.8963, test_loss: 0.9407, test_f1: 0.5134
 epoch: 54, train_loss: 0.8964, test_loss: 0.9675, test_f1: 0.5005
 epoch: 55, train_loss: 0.8995, test_loss: 0.9286, test_f1: 0.5168
 epoch: 56, train_loss: 0.8905, test_loss: 0.9325, test_f1: 0.5071
 epoch: 57, train_loss: 0.8967, test_loss: 0.9190, test_f1: 0.5132
 epoch: 58, train_loss: 0.8879, test_loss: 0.9481, test_f1: 0.5037
 epoch: 59, train_loss: 0.8882, test_loss: 0.9370, test_f1: 0.5107
 epoch: 60, train_loss: 0.8925, test_loss: 0.9682, test_f1: 0.4966
 epoch: 61, train_loss: 0.8874, test_loss: 0.9090, test_f1: 0.5181
 epoch: 62, train_loss: 0.8841, test_loss: 0.9263, test_f1: 0.5190
 epoch: 63, train_loss: 0.8889, test_loss: 0.9499, test_f1: 0.5101
 epoch: 64, train_loss: 0.8862, test_loss: 0.9491, test_f1: 0.4999
 epoch: 65, train_loss: 0.8825, test_loss: 0.9235, test_f1: 0.5207
 epoch: 66, train_loss: 0.8831, test_loss: 0.9321, test_f1: 0.5120
 epoch: 67, train_loss: 0.8783, test_loss: 0.9260, test_f1: 0.5211
 epoch: 68, train_loss: 0.8740, test_loss: 0.9261, test_f1: 0.5220
 epoch: 69, train_loss: 0.8801, test_loss: 0.9090, test_f1: 0.5313
 epoch: 70, train_loss: 0.8804, test_loss: 0.9591, test_f1: 0.4956
 epoch: 71, train_loss: 0.8769, test_loss: 0.9119, test_f1: 0.5213
 epoch: 72, train_loss: 0.8714, test_loss: 0.9175, test_f1: 0.5268
 epoch: 73, train_loss: 0.8871, test_loss: 0.9214, test_f1: 0.5199
 epoch: 74, train_loss: 0.8743, test_loss: 0.9199, test_f1: 0.5175
 epoch: 75, train_loss: 0.8706, test_loss: 0.9177, test_f1: 0.5200
 epoch: 76, train_loss: 0.8661, test_loss: 0.9075, test_f1: 0.5187
 epoch: 77, train_loss: 0.8704, test_loss: 0.9842, test_f1: 0.4862
 epoch: 78, train_loss: 0.8740, test_loss: 0.9289, test_f1: 0.5110
 epoch: 79, train_loss: 0.8642, test_loss: 0.9228, test_f1: 0.5148
 epoch: 80, train_loss: 0.8735, test_loss: 0.9193, test_f1: 0.5171
 epoch: 81, train_loss: 0.8689, test_loss: 0.9173, test_f1: 0.5177
 epoch: 82, train_loss: 0.8698, test_loss: 0.9158, test_f1: 0.5207
 epoch: 83, train_loss: 0.8588, test_loss: 0.9224, test_f1: 0.5129
 epoch: 84, train_loss: 0.8645, test_loss: 0.9235, test_f1: 0.5222
 epoch: 85, train_loss: 0.8649, test_loss: 0.9123, test_f1: 0.5258
 epoch: 86, train_loss: 0.8595, test_loss: 0.9019, test_f1: 0.5245
 epoch: 87, train_loss: 0.8570, test_loss: 0.9379, test_f1: 0.5096
 epoch: 88, train_loss: 0.8656, test_loss: 0.9078, test_f1: 0.5174
 epoch: 89, train_loss: 0.8747, test_loss: 0.8971, test_f1: 0.5246
 epoch: 90, train_loss: 0.8622, test_loss: 0.9076, test_f1: 0.5253
 epoch: 91, train_loss: 0.8576, test_loss: 0.9146, test_f1: 0.5194
 epoch: 92, train_loss: 0.8496, test_loss: 0.9068, test_f1: 0.5138
 epoch: 93, train_loss: 0.8518, test_loss: 0.9133, test_f1: 0.5248
 epoch: 94, train_loss: 0.8538, test_loss: 0.9063, test_f1: 0.5235
 epoch: 95, train_loss: 0.8578, test_loss: 0.8981, test_f1: 0.5247
 epoch: 96, train_loss: 0.8560, test_loss: 0.9072, test_f1: 0.5258
 epoch: 97, train_loss: 0.8558, test_loss: 0.9452, test_f1: 0.5031
 epoch: 98, train_loss: 0.8495, test_loss: 0.9115, test_f1: 0.5177
 epoch: 99, train_loss: 0.8483, test_loss: 0.9044, test_f1: 0.5207
##################ITERATION #3 ****************************************
 epoch: 0, train_loss: 1.3166, test_loss: 1.3189, test_f1: 0.2270
 epoch: 1, train_loss: 1.2694, test_loss: 1.2700, test_f1: 0.2270
 epoch: 2, train_loss: 1.2428, test_loss: 1.2299, test_f1: 0.3095
 epoch: 3, train_loss: 1.2208, test_loss: 1.1949, test_f1: 0.3500
 epoch: 4, train_loss: 1.2006, test_loss: 1.1688, test_f1: 0.3430
 epoch: 5, train_loss: 1.1794, test_loss: 1.1461, test_f1: 0.3520
 epoch: 6, train_loss: 1.1615, test_loss: 1.1256, test_f1: 0.3748
 epoch: 7, train_loss: 1.1419, test_loss: 1.1070, test_f1: 0.3902
 epoch: 8, train_loss: 1.1296, test_loss: 1.0909, test_f1: 0.4022
 epoch: 9, train_loss: 1.1068, test_loss: 1.0765, test_f1: 0.4111
 epoch: 10, train_loss: 1.0919, test_loss: 1.0695, test_f1: 0.4109
 epoch: 11, train_loss: 1.0800, test_loss: 1.0575, test_f1: 0.4266
 epoch: 12, train_loss: 1.0676, test_loss: 1.0520, test_f1: 0.4237
 epoch: 13, train_loss: 1.0571, test_loss: 1.0455, test_f1: 0.4297
 epoch: 14, train_loss: 1.0451, test_loss: 1.0372, test_f1: 0.4303
 epoch: 15, train_loss: 1.0377, test_loss: 1.0318, test_f1: 0.4477
 epoch: 16, train_loss: 1.0298, test_loss: 1.0252, test_f1: 0.4570
 epoch: 17, train_loss: 1.0252, test_loss: 1.0202, test_f1: 0.4540
 epoch: 18, train_loss: 1.0145, test_loss: 1.0173, test_f1: 0.4618
 epoch: 19, train_loss: 1.0047, test_loss: 1.0067, test_f1: 0.4623
 epoch: 20, train_loss: 1.0072, test_loss: 1.0069, test_f1: 0.4740
 epoch: 21, train_loss: 0.9945, test_loss: 1.0051, test_f1: 0.4663
 epoch: 22, train_loss: 0.9844, test_loss: 0.9980, test_f1: 0.4754
 epoch: 23, train_loss: 0.9835, test_loss: 0.9941, test_f1: 0.4672
 epoch: 24, train_loss: 0.9803, test_loss: 0.9979, test_f1: 0.4659
 epoch: 25, train_loss: 0.9648, test_loss: 0.9915, test_f1: 0.4748
 epoch: 26, train_loss: 0.9671, test_loss: 0.9811, test_f1: 0.4865
 epoch: 27, train_loss: 0.9625, test_loss: 0.9774, test_f1: 0.4961
 epoch: 28, train_loss: 0.9584, test_loss: 0.9735, test_f1: 0.4980
 epoch: 29, train_loss: 0.9478, test_loss: 0.9969, test_f1: 0.4812
 epoch: 30, train_loss: 0.9437, test_loss: 0.9720, test_f1: 0.5021
 epoch: 31, train_loss: 0.9448, test_loss: 0.9704, test_f1: 0.5013
 epoch: 32, train_loss: 0.9343, test_loss: 0.9608, test_f1: 0.5082
 epoch: 33, train_loss: 0.9286, test_loss: 0.9614, test_f1: 0.5139
 epoch: 34, train_loss: 0.9295, test_loss: 0.9598, test_f1: 0.5132
 epoch: 35, train_loss: 0.9279, test_loss: 0.9557, test_f1: 0.5075
 epoch: 36, train_loss: 0.9116, test_loss: 0.9650, test_f1: 0.5076
 epoch: 37, train_loss: 0.9190, test_loss: 0.9572, test_f1: 0.5137
 epoch: 38, train_loss: 0.9171, test_loss: 0.9476, test_f1: 0.5143
 epoch: 39, train_loss: 0.9106, test_loss: 0.9692, test_f1: 0.5119
 epoch: 40, train_loss: 0.9110, test_loss: 0.9493, test_f1: 0.5132
 epoch: 41, train_loss: 0.9084, test_loss: 0.9556, test_f1: 0.5163
 epoch: 42, train_loss: 0.8982, test_loss: 0.9396, test_f1: 0.5263
 epoch: 43, train_loss: 0.9044, test_loss: 0.9421, test_f1: 0.5209
 epoch: 44, train_loss: 0.8946, test_loss: 0.9454, test_f1: 0.5289
 epoch: 45, train_loss: 0.8994, test_loss: 0.9525, test_f1: 0.5100
 epoch: 46, train_loss: 0.8970, test_loss: 0.9240, test_f1: 0.5388
 epoch: 47, train_loss: 0.8773, test_loss: 0.9396, test_f1: 0.5180
 epoch: 48, train_loss: 0.8887, test_loss: 0.9322, test_f1: 0.5313
 epoch: 49, train_loss: 0.8954, test_loss: 0.9372, test_f1: 0.5247
 epoch: 50, train_loss: 0.8784, test_loss: 0.9386, test_f1: 0.5420
 epoch: 51, train_loss: 0.8793, test_loss: 0.9456, test_f1: 0.5389
 epoch: 52, train_loss: 0.8701, test_loss: 0.9387, test_f1: 0.5311
 epoch: 53, train_loss: 0.8786, test_loss: 0.9374, test_f1: 0.5358
 epoch: 54, train_loss: 0.8664, test_loss: 0.9389, test_f1: 0.5308
 epoch: 55, train_loss: 0.8744, test_loss: 0.9275, test_f1: 0.5216
 epoch: 56, train_loss: 0.8722, test_loss: 0.9308, test_f1: 0.5461
 epoch: 57, train_loss: 0.8685, test_loss: 0.9291, test_f1: 0.5389
 epoch: 58, train_loss: 0.8642, test_loss: 0.9360, test_f1: 0.5185
 epoch: 59, train_loss: 0.8631, test_loss: 0.9307, test_f1: 0.5357
 epoch: 60, train_loss: 0.8654, test_loss: 0.9234, test_f1: 0.5273
 epoch: 61, train_loss: 0.8598, test_loss: 0.9235, test_f1: 0.5491
 epoch: 62, train_loss: 0.8552, test_loss: 0.9305, test_f1: 0.5313
 epoch: 63, train_loss: 0.8593, test_loss: 0.9228, test_f1: 0.5352
 epoch: 64, train_loss: 0.8660, test_loss: 0.9315, test_f1: 0.5280
 epoch: 65, train_loss: 0.8614, test_loss: 0.9272, test_f1: 0.5410
 epoch: 66, train_loss: 0.8612, test_loss: 0.9301, test_f1: 0.5269
 epoch: 67, train_loss: 0.8514, test_loss: 0.9235, test_f1: 0.5390
 epoch: 68, train_loss: 0.8620, test_loss: 0.9292, test_f1: 0.5319
 epoch: 69, train_loss: 0.8580, test_loss: 0.9222, test_f1: 0.5324
 epoch: 70, train_loss: 0.8544, test_loss: 0.9264, test_f1: 0.5494
 epoch: 71, train_loss: 0.8501, test_loss: 0.9356, test_f1: 0.5378
 epoch: 72, train_loss: 0.8495, test_loss: 0.9189, test_f1: 0.5262
 epoch: 73, train_loss: 0.8565, test_loss: 0.9189, test_f1: 0.5462
 epoch: 74, train_loss: 0.8541, test_loss: 0.9255, test_f1: 0.5370
 epoch: 75, train_loss: 0.8445, test_loss: 0.9183, test_f1: 0.5398
 epoch: 76, train_loss: 0.8457, test_loss: 0.9119, test_f1: 0.5365
 epoch: 77, train_loss: 0.8531, test_loss: 0.9325, test_f1: 0.5200
 epoch: 78, train_loss: 0.8372, test_loss: 0.9248, test_f1: 0.5364
 epoch: 79, train_loss: 0.8428, test_loss: 0.9252, test_f1: 0.5406
 epoch: 80, train_loss: 0.8489, test_loss: 0.9190, test_f1: 0.5331
 epoch: 81, train_loss: 0.8479, test_loss: 0.9219, test_f1: 0.5288
 epoch: 82, train_loss: 0.8406, test_loss: 0.9240, test_f1: 0.5320
 epoch: 83, train_loss: 0.8417, test_loss: 0.9197, test_f1: 0.5492
 epoch: 84, train_loss: 0.8329, test_loss: 0.9297, test_f1: 0.5238
 epoch: 85, train_loss: 0.8406, test_loss: 0.9335, test_f1: 0.5249
 epoch: 86, train_loss: 0.8340, test_loss: 0.9183, test_f1: 0.5352
 epoch: 87, train_loss: 0.8346, test_loss: 0.9239, test_f1: 0.5359
 epoch: 88, train_loss: 0.8367, test_loss: 0.9131, test_f1: 0.5338
 epoch: 89, train_loss: 0.8330, test_loss: 0.9244, test_f1: 0.5287
 epoch: 90, train_loss: 0.8340, test_loss: 0.9229, test_f1: 0.5434
 epoch: 91, train_loss: 0.8269, test_loss: 0.9360, test_f1: 0.5315
 epoch: 92, train_loss: 0.8304, test_loss: 0.9324, test_f1: 0.5270
 epoch: 93, train_loss: 0.8345, test_loss: 0.9053, test_f1: 0.5444
 epoch: 94, train_loss: 0.8347, test_loss: 0.9108, test_f1: 0.5318
 epoch: 95, train_loss: 0.8252, test_loss: 0.9049, test_f1: 0.5315
 epoch: 96, train_loss: 0.8240, test_loss: 0.9196, test_f1: 0.5279
 epoch: 97, train_loss: 0.8189, test_loss: 0.9088, test_f1: 0.5305
 epoch: 98, train_loss: 0.8268, test_loss: 0.9139, test_f1: 0.5289
 epoch: 99, train_loss: 0.8249, test_loss: 0.9122, test_f1: 0.5297
##################ITERATION #4 ****************************************
 epoch: 0, train_loss: 1.2855, test_loss: 1.3117, test_f1: 0.2270
 epoch: 1, train_loss: 1.2487, test_loss: 1.2761, test_f1: 0.2356
 epoch: 2, train_loss: 1.2315, test_loss: 1.2104, test_f1: 0.2747
 epoch: 3, train_loss: 1.2059, test_loss: 1.1759, test_f1: 0.3675
 epoch: 4, train_loss: 1.1837, test_loss: 1.1465, test_f1: 0.4289
 epoch: 5, train_loss: 1.1586, test_loss: 1.1214, test_f1: 0.4259
 epoch: 6, train_loss: 1.1343, test_loss: 1.0980, test_f1: 0.4441
 epoch: 7, train_loss: 1.1136, test_loss: 1.0793, test_f1: 0.4539
 epoch: 8, train_loss: 1.0970, test_loss: 1.0663, test_f1: 0.4423
 epoch: 9, train_loss: 1.0813, test_loss: 1.0514, test_f1: 0.4576
 epoch: 10, train_loss: 1.0685, test_loss: 1.0392, test_f1: 0.4596
 epoch: 11, train_loss: 1.0664, test_loss: 1.0364, test_f1: 0.4691
 epoch: 12, train_loss: 1.0484, test_loss: 1.0244, test_f1: 0.4743
 epoch: 13, train_loss: 1.0367, test_loss: 1.0181, test_f1: 0.4687
 epoch: 14, train_loss: 1.0334, test_loss: 1.0077, test_f1: 0.4802
 epoch: 15, train_loss: 1.0268, test_loss: 1.0099, test_f1: 0.4787
 epoch: 16, train_loss: 1.0155, test_loss: 0.9952, test_f1: 0.4860
 epoch: 17, train_loss: 1.0195, test_loss: 0.9903, test_f1: 0.4964
 epoch: 18, train_loss: 1.0050, test_loss: 0.9857, test_f1: 0.4827
 epoch: 19, train_loss: 1.0021, test_loss: 0.9875, test_f1: 0.4888
 epoch: 20, train_loss: 0.9914, test_loss: 0.9891, test_f1: 0.4791
 epoch: 21, train_loss: 0.9924, test_loss: 0.9780, test_f1: 0.4903
 epoch: 22, train_loss: 0.9918, test_loss: 0.9789, test_f1: 0.4987
 epoch: 23, train_loss: 0.9808, test_loss: 0.9717, test_f1: 0.4958
 epoch: 24, train_loss: 0.9785, test_loss: 0.9623, test_f1: 0.5020
 epoch: 25, train_loss: 0.9744, test_loss: 0.9661, test_f1: 0.4937
 epoch: 26, train_loss: 0.9729, test_loss: 0.9520, test_f1: 0.5089
 epoch: 27, train_loss: 0.9663, test_loss: 0.9455, test_f1: 0.5074
 epoch: 28, train_loss: 0.9676, test_loss: 0.9442, test_f1: 0.5166
 epoch: 29, train_loss: 0.9551, test_loss: 0.9628, test_f1: 0.4941
 epoch: 30, train_loss: 0.9610, test_loss: 0.9464, test_f1: 0.5199
 epoch: 31, train_loss: 0.9547, test_loss: 0.9437, test_f1: 0.5050
 epoch: 32, train_loss: 0.9498, test_loss: 0.9329, test_f1: 0.5170
 epoch: 33, train_loss: 0.9525, test_loss: 0.9362, test_f1: 0.5097
 epoch: 34, train_loss: 0.9432, test_loss: 0.9355, test_f1: 0.5187
 epoch: 35, train_loss: 0.9391, test_loss: 0.9282, test_f1: 0.5175
 epoch: 36, train_loss: 0.9429, test_loss: 0.9271, test_f1: 0.5143
 epoch: 37, train_loss: 0.9412, test_loss: 0.9118, test_f1: 0.5166
 epoch: 38, train_loss: 0.9328, test_loss: 0.9217, test_f1: 0.5160
 epoch: 39, train_loss: 0.9368, test_loss: 0.9343, test_f1: 0.5196
 epoch: 40, train_loss: 0.9240, test_loss: 0.9220, test_f1: 0.5174
 epoch: 41, train_loss: 0.9311, test_loss: 0.9162, test_f1: 0.5216
 epoch: 42, train_loss: 0.9275, test_loss: 0.9114, test_f1: 0.5189
 epoch: 43, train_loss: 0.9178, test_loss: 0.9202, test_f1: 0.5194
 epoch: 44, train_loss: 0.9225, test_loss: 0.9069, test_f1: 0.5184
 epoch: 45, train_loss: 0.9173, test_loss: 0.8962, test_f1: 0.5284
 epoch: 46, train_loss: 0.9195, test_loss: 0.9044, test_f1: 0.5203
 epoch: 47, train_loss: 0.9168, test_loss: 0.8972, test_f1: 0.5188
 epoch: 48, train_loss: 0.9111, test_loss: 0.8910, test_f1: 0.5300
 epoch: 49, train_loss: 0.8995, test_loss: 0.9068, test_f1: 0.5152
 epoch: 50, train_loss: 0.8979, test_loss: 0.8963, test_f1: 0.5222
 epoch: 51, train_loss: 0.8975, test_loss: 0.8945, test_f1: 0.5248
 epoch: 52, train_loss: 0.8983, test_loss: 0.8991, test_f1: 0.5148
 epoch: 53, train_loss: 0.9024, test_loss: 0.8898, test_f1: 0.5195
 epoch: 54, train_loss: 0.8908, test_loss: 0.8949, test_f1: 0.5206
 epoch: 55, train_loss: 0.8908, test_loss: 0.8808, test_f1: 0.5313
 epoch: 56, train_loss: 0.8915, test_loss: 0.8924, test_f1: 0.5233
 epoch: 57, train_loss: 0.8834, test_loss: 0.8834, test_f1: 0.5241
 epoch: 58, train_loss: 0.8816, test_loss: 0.8801, test_f1: 0.5242
 epoch: 59, train_loss: 0.8932, test_loss: 0.8804, test_f1: 0.5196
 epoch: 60, train_loss: 0.8928, test_loss: 0.8873, test_f1: 0.5181
 epoch: 61, train_loss: 0.8858, test_loss: 0.8813, test_f1: 0.5217
 epoch: 62, train_loss: 0.8872, test_loss: 0.8922, test_f1: 0.5170
 epoch: 63, train_loss: 0.8894, test_loss: 0.8848, test_f1: 0.5204
 epoch: 64, train_loss: 0.8830, test_loss: 0.8913, test_f1: 0.5193
 epoch: 65, train_loss: 0.8903, test_loss: 0.8793, test_f1: 0.5259
 epoch: 66, train_loss: 0.8784, test_loss: 0.8717, test_f1: 0.5216
 epoch: 67, train_loss: 0.8817, test_loss: 0.8803, test_f1: 0.5225
 epoch: 68, train_loss: 0.8745, test_loss: 0.8845, test_f1: 0.5166
 epoch: 69, train_loss: 0.8745, test_loss: 0.8754, test_f1: 0.5207
 epoch: 70, train_loss: 0.8697, test_loss: 0.8689, test_f1: 0.5245
 epoch: 71, train_loss: 0.8707, test_loss: 0.8760, test_f1: 0.5236
 epoch: 72, train_loss: 0.8729, test_loss: 0.8815, test_f1: 0.5253
 epoch: 73, train_loss: 0.8714, test_loss: 0.8707, test_f1: 0.5334
 epoch: 74, train_loss: 0.8703, test_loss: 0.8732, test_f1: 0.5233
 epoch: 75, train_loss: 0.8727, test_loss: 0.8809, test_f1: 0.5228
 epoch: 76, train_loss: 0.8632, test_loss: 0.8827, test_f1: 0.5279
 epoch: 77, train_loss: 0.8685, test_loss: 0.8719, test_f1: 0.5276
 epoch: 78, train_loss: 0.8655, test_loss: 0.8722, test_f1: 0.5406
 epoch: 79, train_loss: 0.8677, test_loss: 0.8623, test_f1: 0.5372
 epoch: 80, train_loss: 0.8644, test_loss: 0.8625, test_f1: 0.5372
 epoch: 81, train_loss: 0.8647, test_loss: 0.8613, test_f1: 0.5331
 epoch: 82, train_loss: 0.8722, test_loss: 0.8622, test_f1: 0.5459
 epoch: 83, train_loss: 0.8685, test_loss: 0.8641, test_f1: 0.5424
 epoch: 84, train_loss: 0.8645, test_loss: 0.8726, test_f1: 0.5200
 epoch: 85, train_loss: 0.8595, test_loss: 0.8702, test_f1: 0.5252
 epoch: 86, train_loss: 0.8630, test_loss: 0.8592, test_f1: 0.5344
 epoch: 87, train_loss: 0.8702, test_loss: 0.8636, test_f1: 0.5290
 epoch: 88, train_loss: 0.8601, test_loss: 0.8743, test_f1: 0.5311
 epoch: 89, train_loss: 0.8532, test_loss: 0.8590, test_f1: 0.5440
 epoch: 90, train_loss: 0.8574, test_loss: 0.8504, test_f1: 0.5387
 epoch: 91, train_loss: 0.8573, test_loss: 0.8571, test_f1: 0.5416
 epoch: 92, train_loss: 0.8577, test_loss: 0.8571, test_f1: 0.5357
 epoch: 93, train_loss: 0.8567, test_loss: 0.8724, test_f1: 0.5404
 epoch: 94, train_loss: 0.8585, test_loss: 0.8545, test_f1: 0.5429
 epoch: 95, train_loss: 0.8529, test_loss: 0.8532, test_f1: 0.5355
 epoch: 96, train_loss: 0.8510, test_loss: 0.8542, test_f1: 0.5455
 epoch: 97, train_loss: 0.8540, test_loss: 0.8656, test_f1: 0.5267
 epoch: 98, train_loss: 0.8561, test_loss: 0.8564, test_f1: 0.5263
 epoch: 99, train_loss: 0.8477, test_loss: 0.8592, test_f1: 0.5267
##################ITERATION #5 ****************************************
 epoch: 0, train_loss: 1.2813, test_loss: 1.3210, test_f1: 0.2270
 epoch: 1, train_loss: 1.2316, test_loss: 1.2826, test_f1: 0.2270
 epoch: 2, train_loss: 1.2053, test_loss: 1.1798, test_f1: 0.3347
 epoch: 3, train_loss: 1.1793, test_loss: 1.1407, test_f1: 0.4020
 epoch: 4, train_loss: 1.1491, test_loss: 1.1091, test_f1: 0.4084
 epoch: 5, train_loss: 1.1268, test_loss: 1.0898, test_f1: 0.4283
 epoch: 6, train_loss: 1.1068, test_loss: 1.0758, test_f1: 0.4377
 epoch: 7, train_loss: 1.0921, test_loss: 1.0650, test_f1: 0.4416
 epoch: 8, train_loss: 1.0773, test_loss: 1.0599, test_f1: 0.4589
 epoch: 9, train_loss: 1.0604, test_loss: 1.0527, test_f1: 0.4506
 epoch: 10, train_loss: 1.0552, test_loss: 1.0447, test_f1: 0.4570
 epoch: 11, train_loss: 1.0374, test_loss: 1.0401, test_f1: 0.4601
 epoch: 12, train_loss: 1.0325, test_loss: 1.0293, test_f1: 0.4638
 epoch: 13, train_loss: 1.0242, test_loss: 1.0251, test_f1: 0.4575
 epoch: 14, train_loss: 1.0101, test_loss: 1.0171, test_f1: 0.4956
 epoch: 15, train_loss: 1.0043, test_loss: 1.0083, test_f1: 0.4880
 epoch: 16, train_loss: 0.9945, test_loss: 1.0031, test_f1: 0.4911
 epoch: 17, train_loss: 0.9954, test_loss: 1.0184, test_f1: 0.4608
 epoch: 18, train_loss: 0.9934, test_loss: 1.0067, test_f1: 0.4747
 epoch: 19, train_loss: 0.9785, test_loss: 0.9917, test_f1: 0.4938
 epoch: 20, train_loss: 0.9759, test_loss: 0.9794, test_f1: 0.5029
 epoch: 21, train_loss: 0.9715, test_loss: 0.9820, test_f1: 0.5084
 epoch: 22, train_loss: 0.9612, test_loss: 0.9850, test_f1: 0.5031
 epoch: 23, train_loss: 0.9625, test_loss: 0.9790, test_f1: 0.5075
 epoch: 24, train_loss: 0.9519, test_loss: 0.9752, test_f1: 0.5115
 epoch: 25, train_loss: 0.9482, test_loss: 0.9700, test_f1: 0.5018
 epoch: 26, train_loss: 0.9383, test_loss: 0.9677, test_f1: 0.5145
 epoch: 27, train_loss: 0.9393, test_loss: 0.9624, test_f1: 0.5189
 epoch: 28, train_loss: 0.9386, test_loss: 0.9671, test_f1: 0.5194
 epoch: 29, train_loss: 0.9293, test_loss: 0.9707, test_f1: 0.5118
 epoch: 30, train_loss: 0.9291, test_loss: 0.9551, test_f1: 0.5177
 epoch: 31, train_loss: 0.9321, test_loss: 0.9610, test_f1: 0.5155
 epoch: 32, train_loss: 0.9260, test_loss: 0.9632, test_f1: 0.5101
 epoch: 33, train_loss: 0.9156, test_loss: 0.9480, test_f1: 0.5179
 epoch: 34, train_loss: 0.9153, test_loss: 0.9447, test_f1: 0.5224
 epoch: 35, train_loss: 0.9115, test_loss: 0.9475, test_f1: 0.5269
 epoch: 36, train_loss: 0.9200, test_loss: 0.9505, test_f1: 0.5231
 epoch: 37, train_loss: 0.9140, test_loss: 0.9476, test_f1: 0.5198
 epoch: 38, train_loss: 0.9030, test_loss: 0.9438, test_f1: 0.5134
 epoch: 39, train_loss: 0.9015, test_loss: 0.9372, test_f1: 0.5317
 epoch: 40, train_loss: 0.9039, test_loss: 0.9653, test_f1: 0.5146
 epoch: 41, train_loss: 0.8921, test_loss: 0.9303, test_f1: 0.5309
 epoch: 42, train_loss: 0.8915, test_loss: 0.9404, test_f1: 0.5240
 epoch: 43, train_loss: 0.8959, test_loss: 0.9350, test_f1: 0.5146
 epoch: 44, train_loss: 0.8930, test_loss: 0.9215, test_f1: 0.5222
 epoch: 45, train_loss: 0.8928, test_loss: 0.9280, test_f1: 0.5274
 epoch: 46, train_loss: 0.8793, test_loss: 0.9340, test_f1: 0.5256
 epoch: 47, train_loss: 0.8793, test_loss: 0.9339, test_f1: 0.5168
 epoch: 48, train_loss: 0.8771, test_loss: 0.9195, test_f1: 0.5160
 epoch: 49, train_loss: 0.8808, test_loss: 0.9312, test_f1: 0.5221
 epoch: 50, train_loss: 0.8773, test_loss: 0.9281, test_f1: 0.5247
 epoch: 51, train_loss: 0.8703, test_loss: 0.9231, test_f1: 0.5251
 epoch: 52, train_loss: 0.8756, test_loss: 0.9301, test_f1: 0.5327
 epoch: 53, train_loss: 0.8713, test_loss: 0.9378, test_f1: 0.5319
 epoch: 54, train_loss: 0.8690, test_loss: 0.9396, test_f1: 0.5186
 epoch: 55, train_loss: 0.8683, test_loss: 0.9142, test_f1: 0.5325
 epoch: 56, train_loss: 0.8705, test_loss: 0.9215, test_f1: 0.5273
 epoch: 57, train_loss: 0.8599, test_loss: 0.9263, test_f1: 0.5216
 epoch: 58, train_loss: 0.8633, test_loss: 0.9118, test_f1: 0.5262
 epoch: 59, train_loss: 0.8650, test_loss: 0.9116, test_f1: 0.5291
 epoch: 60, train_loss: 0.8599, test_loss: 0.9174, test_f1: 0.5195
 epoch: 61, train_loss: 0.8564, test_loss: 0.9205, test_f1: 0.5282
 epoch: 62, train_loss: 0.8515, test_loss: 0.9145, test_f1: 0.5174
 epoch: 63, train_loss: 0.8599, test_loss: 0.9185, test_f1: 0.5275
 epoch: 64, train_loss: 0.8585, test_loss: 0.9189, test_f1: 0.5232
 epoch: 65, train_loss: 0.8581, test_loss: 0.9124, test_f1: 0.5280
 epoch: 66, train_loss: 0.8485, test_loss: 0.9164, test_f1: 0.5249
 epoch: 67, train_loss: 0.8510, test_loss: 0.9076, test_f1: 0.5367
 epoch: 68, train_loss: 0.8578, test_loss: 0.9094, test_f1: 0.5298
 epoch: 69, train_loss: 0.8449, test_loss: 0.9012, test_f1: 0.5269
 epoch: 70, train_loss: 0.8569, test_loss: 0.9173, test_f1: 0.5271
 epoch: 71, train_loss: 0.8486, test_loss: 0.9097, test_f1: 0.5260
 epoch: 72, train_loss: 0.8493, test_loss: 0.9028, test_f1: 0.5329
 epoch: 73, train_loss: 0.8445, test_loss: 0.9120, test_f1: 0.5219
 epoch: 74, train_loss: 0.8500, test_loss: 0.9069, test_f1: 0.5203
 epoch: 75, train_loss: 0.8452, test_loss: 0.9139, test_f1: 0.5288
 epoch: 76, train_loss: 0.8420, test_loss: 0.9014, test_f1: 0.5290
 epoch: 77, train_loss: 0.8526, test_loss: 0.9036, test_f1: 0.5296
 epoch: 78, train_loss: 0.8428, test_loss: 0.9131, test_f1: 0.5293
 epoch: 79, train_loss: 0.8475, test_loss: 0.9024, test_f1: 0.5230
 epoch: 80, train_loss: 0.8493, test_loss: 0.9099, test_f1: 0.5222
 epoch: 81, train_loss: 0.8493, test_loss: 0.9059, test_f1: 0.5242
 epoch: 82, train_loss: 0.8424, test_loss: 0.9136, test_f1: 0.5249
 epoch: 83, train_loss: 0.8382, test_loss: 0.9035, test_f1: 0.5326
 epoch: 84, train_loss: 0.8319, test_loss: 0.9032, test_f1: 0.5390
 epoch: 85, train_loss: 0.8326, test_loss: 0.9125, test_f1: 0.5289
 epoch: 86, train_loss: 0.8342, test_loss: 0.9055, test_f1: 0.5250
 epoch: 87, train_loss: 0.8416, test_loss: 0.9279, test_f1: 0.5176
 epoch: 88, train_loss: 0.8387, test_loss: 0.9187, test_f1: 0.5300
 epoch: 89, train_loss: 0.8383, test_loss: 0.9290, test_f1: 0.5287
 epoch: 90, train_loss: 0.8320, test_loss: 0.9200, test_f1: 0.5374
 epoch: 91, train_loss: 0.8330, test_loss: 0.9215, test_f1: 0.5245
 epoch: 92, train_loss: 0.8320, test_loss: 0.9124, test_f1: 0.5380
 epoch: 93, train_loss: 0.8298, test_loss: 0.9005, test_f1: 0.5305
 epoch: 94, train_loss: 0.8280, test_loss: 0.9128, test_f1: 0.5320
 epoch: 95, train_loss: 0.8268, test_loss: 0.8990, test_f1: 0.5354
 epoch: 96, train_loss: 0.8336, test_loss: 0.9008, test_f1: 0.5340
 epoch: 97, train_loss: 0.8282, test_loss: 0.8948, test_f1: 0.5314
 epoch: 98, train_loss: 0.8185, test_loss: 0.9160, test_f1: 0.5388
 epoch: 99, train_loss: 0.8279, test_loss: 0.9203, test_f1: 0.5350
##################ITERATION #6 ****************************************
 epoch: 0, train_loss: 1.3132, test_loss: 1.3455, test_f1: 0.2270
 epoch: 1, train_loss: 1.2615, test_loss: 1.2675, test_f1: 0.2270
 epoch: 2, train_loss: 1.2411, test_loss: 1.1969, test_f1: 0.2320
 epoch: 3, train_loss: 1.2094, test_loss: 1.1602, test_f1: 0.3040
 epoch: 4, train_loss: 1.1839, test_loss: 1.1251, test_f1: 0.3373
 epoch: 5, train_loss: 1.1483, test_loss: 1.0990, test_f1: 0.3638
 epoch: 6, train_loss: 1.1256, test_loss: 1.0766, test_f1: 0.3978
 epoch: 7, train_loss: 1.1074, test_loss: 1.0615, test_f1: 0.4030
 epoch: 8, train_loss: 1.0940, test_loss: 1.0521, test_f1: 0.3968
 epoch: 9, train_loss: 1.0711, test_loss: 1.0408, test_f1: 0.4190
 epoch: 10, train_loss: 1.0653, test_loss: 1.0339, test_f1: 0.4274
 epoch: 11, train_loss: 1.0521, test_loss: 1.0324, test_f1: 0.4231
 epoch: 12, train_loss: 1.0449, test_loss: 1.0237, test_f1: 0.4350
 epoch: 13, train_loss: 1.0308, test_loss: 1.0213, test_f1: 0.4468
 epoch: 14, train_loss: 1.0304, test_loss: 1.0219, test_f1: 0.4333
 epoch: 15, train_loss: 1.0260, test_loss: 1.0136, test_f1: 0.4463
 epoch: 16, train_loss: 1.0202, test_loss: 1.0056, test_f1: 0.4644
 epoch: 17, train_loss: 1.0125, test_loss: 1.0047, test_f1: 0.4560
 epoch: 18, train_loss: 1.0039, test_loss: 0.9960, test_f1: 0.4665
 epoch: 19, train_loss: 1.0056, test_loss: 0.9877, test_f1: 0.4818
 epoch: 20, train_loss: 1.0009, test_loss: 0.9904, test_f1: 0.4849
 epoch: 21, train_loss: 0.9971, test_loss: 1.0075, test_f1: 0.4729
 epoch: 22, train_loss: 0.9859, test_loss: 0.9850, test_f1: 0.4840
 epoch: 23, train_loss: 0.9834, test_loss: 0.9852, test_f1: 0.4900
 epoch: 24, train_loss: 0.9758, test_loss: 0.9835, test_f1: 0.4892
 epoch: 25, train_loss: 0.9777, test_loss: 0.9746, test_f1: 0.4876
 epoch: 26, train_loss: 0.9663, test_loss: 0.9727, test_f1: 0.4960
 epoch: 27, train_loss: 0.9626, test_loss: 0.9621, test_f1: 0.4871
 epoch: 28, train_loss: 0.9577, test_loss: 0.9542, test_f1: 0.4967
 epoch: 29, train_loss: 0.9510, test_loss: 0.9635, test_f1: 0.4876
 epoch: 30, train_loss: 0.9469, test_loss: 0.9536, test_f1: 0.4864
 epoch: 31, train_loss: 0.9413, test_loss: 0.9608, test_f1: 0.4960
 epoch: 32, train_loss: 0.9486, test_loss: 0.9565, test_f1: 0.4928
 epoch: 33, train_loss: 0.9295, test_loss: 0.9494, test_f1: 0.4939
 epoch: 34, train_loss: 0.9347, test_loss: 0.9473, test_f1: 0.5019
 epoch: 35, train_loss: 0.9245, test_loss: 0.9396, test_f1: 0.5013
 epoch: 36, train_loss: 0.9283, test_loss: 0.9318, test_f1: 0.5074
 epoch: 37, train_loss: 0.9185, test_loss: 0.9315, test_f1: 0.5110
 epoch: 38, train_loss: 0.9152, test_loss: 0.9316, test_f1: 0.5063
 epoch: 39, train_loss: 0.9141, test_loss: 0.9309, test_f1: 0.5047
 epoch: 40, train_loss: 0.9110, test_loss: 0.9260, test_f1: 0.5093
 epoch: 41, train_loss: 0.9086, test_loss: 0.9140, test_f1: 0.5136
 epoch: 42, train_loss: 0.9163, test_loss: 0.9816, test_f1: 0.4909
 epoch: 43, train_loss: 0.9161, test_loss: 0.9243, test_f1: 0.5123
 epoch: 44, train_loss: 0.9061, test_loss: 0.9192, test_f1: 0.5169
 epoch: 45, train_loss: 0.8990, test_loss: 0.9119, test_f1: 0.5226
 epoch: 46, train_loss: 0.9019, test_loss: 0.9029, test_f1: 0.5202
 epoch: 47, train_loss: 0.8938, test_loss: 0.9088, test_f1: 0.5432
 epoch: 48, train_loss: 0.9023, test_loss: 0.9174, test_f1: 0.5065
 epoch: 49, train_loss: 0.8901, test_loss: 0.8988, test_f1: 0.5286
 epoch: 50, train_loss: 0.8871, test_loss: 0.8978, test_f1: 0.5404
 epoch: 51, train_loss: 0.8824, test_loss: 0.8977, test_f1: 0.5403
 epoch: 52, train_loss: 0.8852, test_loss: 0.9024, test_f1: 0.5312
 epoch: 53, train_loss: 0.8828, test_loss: 0.9018, test_f1: 0.5339
 epoch: 54, train_loss: 0.8821, test_loss: 0.8963, test_f1: 0.5293
 epoch: 55, train_loss: 0.8864, test_loss: 0.8975, test_f1: 0.5313
 epoch: 56, train_loss: 0.8731, test_loss: 0.8985, test_f1: 0.5272
 epoch: 57, train_loss: 0.8800, test_loss: 0.8934, test_f1: 0.5349
 epoch: 58, train_loss: 0.8747, test_loss: 0.9032, test_f1: 0.5384
 epoch: 59, train_loss: 0.8653, test_loss: 0.8955, test_f1: 0.5372
 epoch: 60, train_loss: 0.8688, test_loss: 0.8934, test_f1: 0.5368
 epoch: 61, train_loss: 0.8735, test_loss: 0.8928, test_f1: 0.5312
 epoch: 62, train_loss: 0.8707, test_loss: 0.8993, test_f1: 0.5278
 epoch: 63, train_loss: 0.8677, test_loss: 0.8895, test_f1: 0.5263
 epoch: 64, train_loss: 0.8710, test_loss: 0.8861, test_f1: 0.5237
 epoch: 65, train_loss: 0.8756, test_loss: 0.8963, test_f1: 0.5328
 epoch: 66, train_loss: 0.8642, test_loss: 0.8925, test_f1: 0.5318
 epoch: 67, train_loss: 0.8750, test_loss: 0.8888, test_f1: 0.5318
 epoch: 68, train_loss: 0.8581, test_loss: 0.8909, test_f1: 0.5311
 epoch: 69, train_loss: 0.8620, test_loss: 0.8894, test_f1: 0.5291
 epoch: 70, train_loss: 0.8679, test_loss: 0.8898, test_f1: 0.5404
 epoch: 71, train_loss: 0.8677, test_loss: 0.8845, test_f1: 0.5281
 epoch: 72, train_loss: 0.8625, test_loss: 0.8876, test_f1: 0.5275
 epoch: 73, train_loss: 0.8614, test_loss: 0.8861, test_f1: 0.5321
 epoch: 74, train_loss: 0.8640, test_loss: 0.8987, test_f1: 0.5325
 epoch: 75, train_loss: 0.8512, test_loss: 0.8860, test_f1: 0.5255
 epoch: 76, train_loss: 0.8600, test_loss: 0.8840, test_f1: 0.5347
 epoch: 77, train_loss: 0.8557, test_loss: 0.8839, test_f1: 0.5350
 epoch: 78, train_loss: 0.8566, test_loss: 0.8865, test_f1: 0.5267
 epoch: 79, train_loss: 0.8529, test_loss: 0.8960, test_f1: 0.5288
 epoch: 80, train_loss: 0.8488, test_loss: 0.8902, test_f1: 0.5337
 epoch: 81, train_loss: 0.8471, test_loss: 0.8828, test_f1: 0.5326
 epoch: 82, train_loss: 0.8556, test_loss: 0.8802, test_f1: 0.5282
 epoch: 83, train_loss: 0.8456, test_loss: 0.8831, test_f1: 0.5277
 epoch: 84, train_loss: 0.8539, test_loss: 0.8817, test_f1: 0.5265
 epoch: 85, train_loss: 0.8488, test_loss: 0.8927, test_f1: 0.5338
 epoch: 86, train_loss: 0.8503, test_loss: 0.8834, test_f1: 0.5270
 epoch: 87, train_loss: 0.8557, test_loss: 0.8829, test_f1: 0.5321
 epoch: 88, train_loss: 0.8540, test_loss: 0.8836, test_f1: 0.5298
 epoch: 89, train_loss: 0.8488, test_loss: 0.8877, test_f1: 0.5243
 epoch: 90, train_loss: 0.8507, test_loss: 0.8785, test_f1: 0.5360
 epoch: 91, train_loss: 0.8464, test_loss: 0.8863, test_f1: 0.5346
 epoch: 92, train_loss: 0.8427, test_loss: 0.8859, test_f1: 0.5270
 epoch: 93, train_loss: 0.8426, test_loss: 0.8838, test_f1: 0.5327
 epoch: 94, train_loss: 0.8436, test_loss: 0.8824, test_f1: 0.5352
 epoch: 95, train_loss: 0.8494, test_loss: 0.8879, test_f1: 0.5266
 epoch: 96, train_loss: 0.8413, test_loss: 0.8859, test_f1: 0.5295
 epoch: 97, train_loss: 0.8421, test_loss: 0.8856, test_f1: 0.5298
 epoch: 98, train_loss: 0.8372, test_loss: 0.8752, test_f1: 0.5296
 epoch: 99, train_loss: 0.8397, test_loss: 0.8770, test_f1: 0.5297
##################ITERATION #7 ****************************************
 epoch: 0, train_loss: 1.2943, test_loss: 1.3166, test_f1: 0.2270
 epoch: 1, train_loss: 1.2246, test_loss: 1.3002, test_f1: 0.2527
 epoch: 2, train_loss: 1.1816, test_loss: 1.1872, test_f1: 0.3473
 epoch: 3, train_loss: 1.1531, test_loss: 1.1057, test_f1: 0.4195
 epoch: 4, train_loss: 1.1270, test_loss: 1.0823, test_f1: 0.4378
 epoch: 5, train_loss: 1.0992, test_loss: 1.0701, test_f1: 0.4334
 epoch: 6, train_loss: 1.0867, test_loss: 1.0574, test_f1: 0.4437
 epoch: 7, train_loss: 1.0732, test_loss: 1.0493, test_f1: 0.4474
 epoch: 8, train_loss: 1.0566, test_loss: 1.0449, test_f1: 0.4457
 epoch: 9, train_loss: 1.0411, test_loss: 1.0356, test_f1: 0.4640
 epoch: 10, train_loss: 1.0338, test_loss: 1.0349, test_f1: 0.4693
 epoch: 11, train_loss: 1.0340, test_loss: 1.0349, test_f1: 0.4703
 epoch: 12, train_loss: 1.0186, test_loss: 1.0271, test_f1: 0.4700
 epoch: 13, train_loss: 1.0116, test_loss: 1.0244, test_f1: 0.4818
 epoch: 14, train_loss: 1.0112, test_loss: 1.0211, test_f1: 0.4877
 epoch: 15, train_loss: 1.0062, test_loss: 1.0144, test_f1: 0.4865
 epoch: 16, train_loss: 0.9982, test_loss: 1.0130, test_f1: 0.4834
 epoch: 17, train_loss: 0.9969, test_loss: 1.0117, test_f1: 0.4814
 epoch: 18, train_loss: 0.9860, test_loss: 1.0045, test_f1: 0.4804
 epoch: 19, train_loss: 0.9848, test_loss: 1.0108, test_f1: 0.4772
 epoch: 20, train_loss: 0.9714, test_loss: 1.0001, test_f1: 0.4818
 epoch: 21, train_loss: 0.9790, test_loss: 1.0037, test_f1: 0.4831
 epoch: 22, train_loss: 0.9726, test_loss: 0.9935, test_f1: 0.4934
 epoch: 23, train_loss: 0.9683, test_loss: 0.9888, test_f1: 0.4939
 epoch: 24, train_loss: 0.9624, test_loss: 0.9992, test_f1: 0.4919
 epoch: 25, train_loss: 0.9629, test_loss: 0.9970, test_f1: 0.4904
 epoch: 26, train_loss: 0.9575, test_loss: 0.9985, test_f1: 0.4909
 epoch: 27, train_loss: 0.9627, test_loss: 0.9912, test_f1: 0.4892
 epoch: 28, train_loss: 0.9556, test_loss: 0.9951, test_f1: 0.4937
 epoch: 29, train_loss: 0.9521, test_loss: 0.9808, test_f1: 0.5004
 epoch: 30, train_loss: 0.9502, test_loss: 0.9852, test_f1: 0.4936
 epoch: 31, train_loss: 0.9433, test_loss: 0.9828, test_f1: 0.4863
 epoch: 32, train_loss: 0.9319, test_loss: 0.9821, test_f1: 0.4973
 epoch: 33, train_loss: 0.9366, test_loss: 0.9876, test_f1: 0.4884
 epoch: 34, train_loss: 0.9466, test_loss: 0.9803, test_f1: 0.5004
 epoch: 35, train_loss: 0.9332, test_loss: 0.9869, test_f1: 0.4989
 epoch: 36, train_loss: 0.9240, test_loss: 0.9689, test_f1: 0.5011
 epoch: 37, train_loss: 0.9283, test_loss: 0.9845, test_f1: 0.4957
 epoch: 38, train_loss: 0.9294, test_loss: 0.9738, test_f1: 0.5026
 epoch: 39, train_loss: 0.9272, test_loss: 0.9779, test_f1: 0.5052
 epoch: 40, train_loss: 0.9182, test_loss: 0.9826, test_f1: 0.4978
 epoch: 41, train_loss: 0.9104, test_loss: 0.9842, test_f1: 0.5178
 epoch: 42, train_loss: 0.9153, test_loss: 0.9707, test_f1: 0.5078
 epoch: 43, train_loss: 0.9153, test_loss: 0.9740, test_f1: 0.5124
 epoch: 44, train_loss: 0.9139, test_loss: 0.9744, test_f1: 0.5049
 epoch: 45, train_loss: 0.9127, test_loss: 0.9666, test_f1: 0.5139
 epoch: 46, train_loss: 0.9160, test_loss: 0.9612, test_f1: 0.5169
 epoch: 47, train_loss: 0.9082, test_loss: 0.9598, test_f1: 0.5104
 epoch: 48, train_loss: 0.9029, test_loss: 0.9646, test_f1: 0.5144
 epoch: 49, train_loss: 0.9005, test_loss: 0.9452, test_f1: 0.5133
 epoch: 50, train_loss: 0.9034, test_loss: 0.9693, test_f1: 0.5117
 epoch: 51, train_loss: 0.8935, test_loss: 0.9668, test_f1: 0.5128
 epoch: 52, train_loss: 0.8943, test_loss: 0.9662, test_f1: 0.5250
 epoch: 53, train_loss: 0.8939, test_loss: 0.9557, test_f1: 0.5118
 epoch: 54, train_loss: 0.8973, test_loss: 0.9622, test_f1: 0.5138
 epoch: 55, train_loss: 0.8918, test_loss: 0.9660, test_f1: 0.5282
 epoch: 56, train_loss: 0.8950, test_loss: 0.9586, test_f1: 0.5170
 epoch: 57, train_loss: 0.8823, test_loss: 0.9646, test_f1: 0.5143
 epoch: 58, train_loss: 0.8821, test_loss: 0.9666, test_f1: 0.5101
 epoch: 59, train_loss: 0.8788, test_loss: 0.9698, test_f1: 0.5175
 epoch: 60, train_loss: 0.8852, test_loss: 0.9722, test_f1: 0.5139
 epoch: 61, train_loss: 0.8760, test_loss: 0.9743, test_f1: 0.5131
 epoch: 62, train_loss: 0.8833, test_loss: 0.9664, test_f1: 0.5144
 epoch: 63, train_loss: 0.8867, test_loss: 0.9623, test_f1: 0.5122
 epoch: 64, train_loss: 0.8797, test_loss: 0.9715, test_f1: 0.5108
 epoch: 65, train_loss: 0.8780, test_loss: 0.9677, test_f1: 0.5164
 epoch: 66, train_loss: 0.8790, test_loss: 0.9779, test_f1: 0.5095
 epoch: 67, train_loss: 0.8757, test_loss: 0.9738, test_f1: 0.5136
 epoch: 68, train_loss: 0.8705, test_loss: 0.9617, test_f1: 0.5152
 epoch: 69, train_loss: 0.8706, test_loss: 0.9731, test_f1: 0.5147
 epoch: 70, train_loss: 0.8762, test_loss: 0.9647, test_f1: 0.5170
 epoch: 71, train_loss: 0.8802, test_loss: 0.9626, test_f1: 0.5138
 epoch: 72, train_loss: 0.8716, test_loss: 0.9649, test_f1: 0.5118
 epoch: 73, train_loss: 0.8749, test_loss: 0.9673, test_f1: 0.5163
 epoch: 74, train_loss: 0.8789, test_loss: 0.9636, test_f1: 0.5138
 epoch: 75, train_loss: 0.8846, test_loss: 0.9747, test_f1: 0.5137
 epoch: 76, train_loss: 0.8710, test_loss: 0.9680, test_f1: 0.5162
 epoch: 77, train_loss: 0.8674, test_loss: 0.9652, test_f1: 0.5151
 epoch: 78, train_loss: 0.8815, test_loss: 0.9628, test_f1: 0.5155
 epoch: 79, train_loss: 0.8699, test_loss: 0.9670, test_f1: 0.5180
 epoch: 80, train_loss: 0.8557, test_loss: 0.9706, test_f1: 0.5176
 epoch: 81, train_loss: 0.8533, test_loss: 0.9651, test_f1: 0.5182
 epoch: 82, train_loss: 0.8648, test_loss: 0.9709, test_f1: 0.5147
 epoch: 83, train_loss: 0.8666, test_loss: 0.9732, test_f1: 0.5175
 epoch: 84, train_loss: 0.8625, test_loss: 0.9550, test_f1: 0.5241
 epoch: 85, train_loss: 0.8605, test_loss: 0.9724, test_f1: 0.5235
 epoch: 86, train_loss: 0.8665, test_loss: 0.9689, test_f1: 0.5151
 epoch: 87, train_loss: 0.8646, test_loss: 0.9686, test_f1: 0.5184
 epoch: 88, train_loss: 0.8721, test_loss: 0.9691, test_f1: 0.5145
 epoch: 89, train_loss: 0.8602, test_loss: 0.9694, test_f1: 0.5146
 epoch: 90, train_loss: 0.8642, test_loss: 0.9780, test_f1: 0.5168
 epoch: 91, train_loss: 0.8615, test_loss: 0.9656, test_f1: 0.5231
 epoch: 92, train_loss: 0.8738, test_loss: 0.9732, test_f1: 0.5182
 epoch: 93, train_loss: 0.8681, test_loss: 0.9732, test_f1: 0.5191
 epoch: 94, train_loss: 0.8589, test_loss: 0.9777, test_f1: 0.5227
 epoch: 95, train_loss: 0.8567, test_loss: 0.9726, test_f1: 0.5169
 epoch: 96, train_loss: 0.8589, test_loss: 0.9660, test_f1: 0.5208
 epoch: 97, train_loss: 0.8565, test_loss: 0.9680, test_f1: 0.5163
 epoch: 98, train_loss: 0.8542, test_loss: 0.9634, test_f1: 0.5110
 epoch: 99, train_loss: 0.8582, test_loss: 0.9752, test_f1: 0.5165
##################ITERATION #8 ****************************************
 epoch: 0, train_loss: 1.2831, test_loss: 1.3322, test_f1: 0.2270
 epoch: 1, train_loss: 1.2051, test_loss: 1.2896, test_f1: 0.2270
 epoch: 2, train_loss: 1.1898, test_loss: 1.1697, test_f1: 0.2566
 epoch: 3, train_loss: 1.1614, test_loss: 1.1045, test_f1: 0.3797
 epoch: 4, train_loss: 1.1460, test_loss: 1.0902, test_f1: 0.3936
 epoch: 5, train_loss: 1.1299, test_loss: 1.0827, test_f1: 0.3876
 epoch: 6, train_loss: 1.1052, test_loss: 1.0765, test_f1: 0.4149
 epoch: 7, train_loss: 1.0958, test_loss: 1.0661, test_f1: 0.4381
 epoch: 8, train_loss: 1.0838, test_loss: 1.0577, test_f1: 0.4327
 epoch: 9, train_loss: 1.0703, test_loss: 1.0479, test_f1: 0.4384
 epoch: 10, train_loss: 1.0536, test_loss: 1.0453, test_f1: 0.4541
 epoch: 11, train_loss: 1.0463, test_loss: 1.0350, test_f1: 0.4587
 epoch: 12, train_loss: 1.0385, test_loss: 1.0433, test_f1: 0.4608
 epoch: 13, train_loss: 1.0349, test_loss: 1.0304, test_f1: 0.4629
 epoch: 14, train_loss: 1.0221, test_loss: 1.0201, test_f1: 0.4709
 epoch: 15, train_loss: 1.0130, test_loss: 1.0087, test_f1: 0.4811
 epoch: 16, train_loss: 1.0084, test_loss: 1.0207, test_f1: 0.4774
 epoch: 17, train_loss: 1.0002, test_loss: 1.0044, test_f1: 0.4850
 epoch: 18, train_loss: 0.9999, test_loss: 1.0015, test_f1: 0.4716
 epoch: 19, train_loss: 0.9927, test_loss: 0.9938, test_f1: 0.4806
 epoch: 20, train_loss: 0.9823, test_loss: 0.9869, test_f1: 0.4870
 epoch: 21, train_loss: 0.9730, test_loss: 0.9768, test_f1: 0.4827
 epoch: 22, train_loss: 0.9854, test_loss: 0.9782, test_f1: 0.4667
 epoch: 23, train_loss: 0.9718, test_loss: 0.9763, test_f1: 0.4957
 epoch: 24, train_loss: 0.9792, test_loss: 0.9651, test_f1: 0.4938
 epoch: 25, train_loss: 0.9720, test_loss: 0.9649, test_f1: 0.4938
 epoch: 26, train_loss: 0.9646, test_loss: 0.9700, test_f1: 0.4987
 epoch: 27, train_loss: 0.9577, test_loss: 0.9602, test_f1: 0.4969
 epoch: 28, train_loss: 0.9558, test_loss: 0.9585, test_f1: 0.4983
 epoch: 29, train_loss: 0.9545, test_loss: 0.9566, test_f1: 0.5092
 epoch: 30, train_loss: 0.9540, test_loss: 0.9572, test_f1: 0.5077
 epoch: 31, train_loss: 0.9403, test_loss: 0.9486, test_f1: 0.5041
 epoch: 32, train_loss: 0.9366, test_loss: 0.9542, test_f1: 0.5067
 epoch: 33, train_loss: 0.9415, test_loss: 0.9346, test_f1: 0.5153
 epoch: 34, train_loss: 0.9381, test_loss: 0.9472, test_f1: 0.5157
 epoch: 35, train_loss: 0.9354, test_loss: 0.9457, test_f1: 0.5107
 epoch: 36, train_loss: 0.9363, test_loss: 0.9368, test_f1: 0.5113
 epoch: 37, train_loss: 0.9360, test_loss: 0.9322, test_f1: 0.5142
 epoch: 38, train_loss: 0.9208, test_loss: 0.9453, test_f1: 0.5031
 epoch: 39, train_loss: 0.9177, test_loss: 0.9176, test_f1: 0.5140
 epoch: 40, train_loss: 0.9135, test_loss: 0.9350, test_f1: 0.5193
 epoch: 41, train_loss: 0.9202, test_loss: 0.9216, test_f1: 0.5092
 epoch: 42, train_loss: 0.9165, test_loss: 0.9363, test_f1: 0.5158
 epoch: 43, train_loss: 0.9098, test_loss: 0.9185, test_f1: 0.5275
 epoch: 44, train_loss: 0.9141, test_loss: 0.9068, test_f1: 0.5051
 epoch: 45, train_loss: 0.9058, test_loss: 0.9083, test_f1: 0.5235
 epoch: 46, train_loss: 0.9038, test_loss: 0.9219, test_f1: 0.5234
 epoch: 47, train_loss: 0.8993, test_loss: 0.9080, test_f1: 0.5093
 epoch: 48, train_loss: 0.8934, test_loss: 0.9339, test_f1: 0.5150
 epoch: 49, train_loss: 0.9006, test_loss: 0.9019, test_f1: 0.5237
 epoch: 50, train_loss: 0.8968, test_loss: 0.8843, test_f1: 0.5227
 epoch: 51, train_loss: 0.8936, test_loss: 0.8977, test_f1: 0.5252
 epoch: 52, train_loss: 0.8836, test_loss: 0.8968, test_f1: 0.5198
 epoch: 53, train_loss: 0.8781, test_loss: 0.8976, test_f1: 0.5227
 epoch: 54, train_loss: 0.8793, test_loss: 0.8965, test_f1: 0.5118
 epoch: 55, train_loss: 0.8840, test_loss: 0.9046, test_f1: 0.5105
 epoch: 56, train_loss: 0.8734, test_loss: 0.8957, test_f1: 0.5267
 epoch: 57, train_loss: 0.8876, test_loss: 0.8904, test_f1: 0.5154
 epoch: 58, train_loss: 0.8752, test_loss: 0.8918, test_f1: 0.5088
 epoch: 59, train_loss: 0.8704, test_loss: 0.9019, test_f1: 0.5327
 epoch: 60, train_loss: 0.8754, test_loss: 0.8944, test_f1: 0.5255
 epoch: 61, train_loss: 0.8754, test_loss: 0.8957, test_f1: 0.5287
 epoch: 62, train_loss: 0.8678, test_loss: 0.8940, test_f1: 0.5304
 epoch: 63, train_loss: 0.8658, test_loss: 0.8911, test_f1: 0.5200
 epoch: 64, train_loss: 0.8693, test_loss: 0.8856, test_f1: 0.5235
 epoch: 65, train_loss: 0.8704, test_loss: 0.8797, test_f1: 0.5208
 epoch: 66, train_loss: 0.8712, test_loss: 0.8797, test_f1: 0.5205
 epoch: 67, train_loss: 0.8661, test_loss: 0.8793, test_f1: 0.5094
 epoch: 68, train_loss: 0.8716, test_loss: 0.8820, test_f1: 0.5244
 epoch: 69, train_loss: 0.8652, test_loss: 0.8798, test_f1: 0.5354
 epoch: 70, train_loss: 0.8636, test_loss: 0.8897, test_f1: 0.5133
 epoch: 71, train_loss: 0.8619, test_loss: 0.8835, test_f1: 0.5166
 epoch: 72, train_loss: 0.8546, test_loss: 0.8803, test_f1: 0.5201
 epoch: 73, train_loss: 0.8600, test_loss: 0.8944, test_f1: 0.5158
 epoch: 74, train_loss: 0.8604, test_loss: 0.8813, test_f1: 0.5162
 epoch: 75, train_loss: 0.8552, test_loss: 0.8834, test_f1: 0.5211
 epoch: 76, train_loss: 0.8557, test_loss: 0.8837, test_f1: 0.5180
 epoch: 77, train_loss: 0.8557, test_loss: 0.8873, test_f1: 0.5197
 epoch: 78, train_loss: 0.8568, test_loss: 0.8865, test_f1: 0.5182
 epoch: 79, train_loss: 0.8468, test_loss: 0.8867, test_f1: 0.5182
 epoch: 80, train_loss: 0.8466, test_loss: 0.8710, test_f1: 0.5312
 epoch: 81, train_loss: 0.8503, test_loss: 0.8814, test_f1: 0.5188
 epoch: 82, train_loss: 0.8507, test_loss: 0.8671, test_f1: 0.5357
 epoch: 83, train_loss: 0.8565, test_loss: 0.8797, test_f1: 0.5223
 epoch: 84, train_loss: 0.8496, test_loss: 0.8821, test_f1: 0.5430
 epoch: 85, train_loss: 0.8540, test_loss: 0.8749, test_f1: 0.5255
 epoch: 86, train_loss: 0.8590, test_loss: 0.8715, test_f1: 0.5222
 epoch: 87, train_loss: 0.8515, test_loss: 0.8736, test_f1: 0.5381
 epoch: 88, train_loss: 0.8468, test_loss: 0.8752, test_f1: 0.5289
 epoch: 89, train_loss: 0.8387, test_loss: 0.8846, test_f1: 0.5408
 epoch: 90, train_loss: 0.8461, test_loss: 0.8696, test_f1: 0.5470
 epoch: 91, train_loss: 0.8460, test_loss: 0.8736, test_f1: 0.5465
 epoch: 92, train_loss: 0.8411, test_loss: 0.8744, test_f1: 0.5410
 epoch: 93, train_loss: 0.8427, test_loss: 0.8728, test_f1: 0.5410
 epoch: 94, train_loss: 0.8360, test_loss: 0.8787, test_f1: 0.5249
 epoch: 95, train_loss: 0.8333, test_loss: 0.8760, test_f1: 0.5314
 epoch: 96, train_loss: 0.8407, test_loss: 0.8752, test_f1: 0.5348
 epoch: 97, train_loss: 0.8401, test_loss: 0.8940, test_f1: 0.5420
 epoch: 98, train_loss: 0.8235, test_loss: 0.8826, test_f1: 0.5313
 epoch: 99, train_loss: 0.8296, test_loss: 0.8749, test_f1: 0.5365
##################ITERATION #9 ****************************************
 epoch: 0, train_loss: 1.3019, test_loss: 1.3301, test_f1: 0.2270
 epoch: 1, train_loss: 1.2038, test_loss: 1.2414, test_f1: 0.2345
 epoch: 2, train_loss: 1.1663, test_loss: 1.1356, test_f1: 0.3748
 epoch: 3, train_loss: 1.1528, test_loss: 1.0972, test_f1: 0.3946
 epoch: 4, train_loss: 1.1223, test_loss: 1.0802, test_f1: 0.4128
 epoch: 5, train_loss: 1.1006, test_loss: 1.0678, test_f1: 0.4147
 epoch: 6, train_loss: 1.0865, test_loss: 1.0558, test_f1: 0.4424
 epoch: 7, train_loss: 1.0690, test_loss: 1.0558, test_f1: 0.4243
 epoch: 8, train_loss: 1.0580, test_loss: 1.0452, test_f1: 0.4392
 epoch: 9, train_loss: 1.0504, test_loss: 1.0355, test_f1: 0.4509
 epoch: 10, train_loss: 1.0347, test_loss: 1.0364, test_f1: 0.4554
 epoch: 11, train_loss: 1.0304, test_loss: 1.0305, test_f1: 0.4635
 epoch: 12, train_loss: 1.0293, test_loss: 1.0282, test_f1: 0.4679
 epoch: 13, train_loss: 1.0199, test_loss: 1.0303, test_f1: 0.4692
 epoch: 14, train_loss: 1.0084, test_loss: 1.0203, test_f1: 0.4728
 epoch: 15, train_loss: 1.0046, test_loss: 1.0142, test_f1: 0.4676
 epoch: 16, train_loss: 1.0000, test_loss: 1.0153, test_f1: 0.4708
 epoch: 17, train_loss: 0.9968, test_loss: 1.0098, test_f1: 0.4705
 epoch: 18, train_loss: 0.9900, test_loss: 1.0088, test_f1: 0.4716
 epoch: 19, train_loss: 0.9860, test_loss: 0.9978, test_f1: 0.4916
 epoch: 20, train_loss: 0.9766, test_loss: 0.9970, test_f1: 0.4839
 epoch: 21, train_loss: 0.9816, test_loss: 0.9991, test_f1: 0.4892
 epoch: 22, train_loss: 0.9724, test_loss: 0.9951, test_f1: 0.4786
 epoch: 23, train_loss: 0.9699, test_loss: 0.9858, test_f1: 0.4824
 epoch: 24, train_loss: 0.9659, test_loss: 0.9806, test_f1: 0.4798
 epoch: 25, train_loss: 0.9606, test_loss: 0.9787, test_f1: 0.5008
 epoch: 26, train_loss: 0.9558, test_loss: 0.9864, test_f1: 0.4943
 epoch: 27, train_loss: 0.9478, test_loss: 0.9771, test_f1: 0.5061
 epoch: 28, train_loss: 0.9491, test_loss: 0.9726, test_f1: 0.4999
 epoch: 29, train_loss: 0.9507, test_loss: 0.9669, test_f1: 0.4959
 epoch: 30, train_loss: 0.9425, test_loss: 0.9643, test_f1: 0.4988
 epoch: 31, train_loss: 0.9368, test_loss: 0.9745, test_f1: 0.5006
 epoch: 32, train_loss: 0.9377, test_loss: 0.9576, test_f1: 0.5226
 epoch: 33, train_loss: 0.9371, test_loss: 0.9722, test_f1: 0.4896
 epoch: 34, train_loss: 0.9321, test_loss: 0.9621, test_f1: 0.5111
 epoch: 35, train_loss: 0.9198, test_loss: 0.9521, test_f1: 0.5156
 epoch: 36, train_loss: 0.9253, test_loss: 0.9499, test_f1: 0.5217
 epoch: 37, train_loss: 0.9235, test_loss: 0.9421, test_f1: 0.5096
 epoch: 38, train_loss: 0.9162, test_loss: 0.9542, test_f1: 0.4950
 epoch: 39, train_loss: 0.9158, test_loss: 0.9636, test_f1: 0.4881
 epoch: 40, train_loss: 0.9062, test_loss: 0.9458, test_f1: 0.5188
 epoch: 41, train_loss: 0.9040, test_loss: 0.9486, test_f1: 0.5233
 epoch: 42, train_loss: 0.9074, test_loss: 0.9538, test_f1: 0.5116
 epoch: 43, train_loss: 0.9116, test_loss: 0.9439, test_f1: 0.5232
 epoch: 44, train_loss: 0.8989, test_loss: 0.9351, test_f1: 0.5178
 epoch: 45, train_loss: 0.8918, test_loss: 0.9418, test_f1: 0.5112
 epoch: 46, train_loss: 0.8906, test_loss: 0.9379, test_f1: 0.5167
 epoch: 47, train_loss: 0.8855, test_loss: 0.9266, test_f1: 0.5197
 epoch: 48, train_loss: 0.8877, test_loss: 0.9268, test_f1: 0.5019
 epoch: 49, train_loss: 0.8883, test_loss: 0.9393, test_f1: 0.5152
 epoch: 50, train_loss: 0.8766, test_loss: 0.9247, test_f1: 0.5205
 epoch: 51, train_loss: 0.8829, test_loss: 0.9233, test_f1: 0.5193
 epoch: 52, train_loss: 0.8903, test_loss: 0.9211, test_f1: 0.5196
 epoch: 53, train_loss: 0.8785, test_loss: 0.9230, test_f1: 0.5165
 epoch: 54, train_loss: 0.8718, test_loss: 0.9150, test_f1: 0.5195
 epoch: 55, train_loss: 0.8782, test_loss: 0.9260, test_f1: 0.5182
 epoch: 56, train_loss: 0.8775, test_loss: 0.9247, test_f1: 0.5161
 epoch: 57, train_loss: 0.8706, test_loss: 0.9180, test_f1: 0.5171
 epoch: 58, train_loss: 0.8829, test_loss: 0.9164, test_f1: 0.5190
 epoch: 59, train_loss: 0.8644, test_loss: 0.9147, test_f1: 0.5190
 epoch: 60, train_loss: 0.8738, test_loss: 0.9165, test_f1: 0.5138
 epoch: 61, train_loss: 0.8623, test_loss: 0.9254, test_f1: 0.5207
 epoch: 62, train_loss: 0.8690, test_loss: 0.9185, test_f1: 0.5172
 epoch: 63, train_loss: 0.8707, test_loss: 0.9257, test_f1: 0.5254
 epoch: 64, train_loss: 0.8650, test_loss: 0.9246, test_f1: 0.5191
 epoch: 65, train_loss: 0.8555, test_loss: 0.9168, test_f1: 0.5151
 epoch: 66, train_loss: 0.8557, test_loss: 0.9261, test_f1: 0.5172
 epoch: 67, train_loss: 0.8560, test_loss: 0.9181, test_f1: 0.5179
 epoch: 68, train_loss: 0.8676, test_loss: 0.9170, test_f1: 0.5155
 epoch: 69, train_loss: 0.8607, test_loss: 0.9121, test_f1: 0.5123
 epoch: 70, train_loss: 0.8665, test_loss: 0.9056, test_f1: 0.5180
 epoch: 71, train_loss: 0.8514, test_loss: 0.9203, test_f1: 0.5216
 epoch: 72, train_loss: 0.8564, test_loss: 0.9173, test_f1: 0.5151
 epoch: 73, train_loss: 0.8465, test_loss: 0.9159, test_f1: 0.5216
 epoch: 74, train_loss: 0.8378, test_loss: 0.9259, test_f1: 0.5165
 epoch: 75, train_loss: 0.8548, test_loss: 0.9211, test_f1: 0.5148
 epoch: 76, train_loss: 0.8530, test_loss: 0.9200, test_f1: 0.5212
 epoch: 77, train_loss: 0.8484, test_loss: 0.9128, test_f1: 0.5216
 epoch: 78, train_loss: 0.8574, test_loss: 0.9091, test_f1: 0.5130
 epoch: 79, train_loss: 0.8464, test_loss: 0.9174, test_f1: 0.5196
 epoch: 80, train_loss: 0.8448, test_loss: 0.9196, test_f1: 0.5184
 epoch: 81, train_loss: 0.8431, test_loss: 0.9088, test_f1: 0.5184
 epoch: 82, train_loss: 0.8389, test_loss: 0.9296, test_f1: 0.5166
 epoch: 83, train_loss: 0.8354, test_loss: 0.9114, test_f1: 0.5149
 epoch: 84, train_loss: 0.8432, test_loss: 0.9187, test_f1: 0.5188
 epoch: 85, train_loss: 0.8406, test_loss: 0.9222, test_f1: 0.5293
 epoch: 86, train_loss: 0.8328, test_loss: 0.9062, test_f1: 0.5210
 epoch: 87, train_loss: 0.8419, test_loss: 0.9122, test_f1: 0.5167
 epoch: 88, train_loss: 0.8256, test_loss: 0.9146, test_f1: 0.5248
 epoch: 89, train_loss: 0.8307, test_loss: 0.9150, test_f1: 0.5228
 epoch: 90, train_loss: 0.8267, test_loss: 0.9163, test_f1: 0.5273
 epoch: 91, train_loss: 0.8310, test_loss: 0.9157, test_f1: 0.5187
 epoch: 92, train_loss: 0.8343, test_loss: 0.9251, test_f1: 0.5240
 epoch: 93, train_loss: 0.8308, test_loss: 0.9268, test_f1: 0.5278
 epoch: 94, train_loss: 0.8281, test_loss: 0.9252, test_f1: 0.5212
 epoch: 95, train_loss: 0.8311, test_loss: 0.9232, test_f1: 0.5226
 epoch: 96, train_loss: 0.8232, test_loss: 0.9152, test_f1: 0.5297
 epoch: 97, train_loss: 0.8221, test_loss: 0.9169, test_f1: 0.5341
 epoch: 98, train_loss: 0.8213, test_loss: 0.9116, test_f1: 0.5333
 epoch: 99, train_loss: 0.8166, test_loss: 0.9147, test_f1: 0.5267

Training completed in 555.99 seconds
Best F1: 0.5494 at epoch 70
Mean F1 across iterations: 0.5399  0.0069
========================FINAL RESULTS================================
FEGIN weighted F1: 0.5494  0.0069
python main.py --data ltspice_examples --representation component_pin_net --model FEGIN --layers 5 --hiddens 32 --batch_size 128 --lr 0.0001 --emb_size 512 --epochs 100 --save_appendix component_pin_net_L5_H32_BS128_LR0.0001_E512 --no_val
-----



STDERR:
  File "main.py", line 370, in <module>
    main()
  File "main.py", line 254, in main
    dataset = dataset_class(
  File "/home/philip/projects/ltspice_examples_code_repo/Circuit-Completion-Using-GNNs/component_classification_with_link_prediction_head/evaluation/FEGIN/kernel/circuit_datasets.py", line 15, in __init__
    self.data, self.slices = torch.load(self.processed_paths[0])
  File "/home/philip/.local/lib/python3.8/site-packages/torch/serialization.py", line 1040, in load
    warnings.warn(
  File "/usr/lib/python3.8/warnings.py", line 109, in _showwarnmsg
    sw(msg.message, msg.category, msg.filename, msg.lineno,
  File "main.py", line 47, in warn_with_traceback
    traceback.print_stack(file=log)
/home/philip/projects/ltspice_examples_code_repo/Circuit-Completion-Using-GNNs/component_classification_with_link_prediction_head/evaluation/FEGIN/kernel/circuit_datasets.py:15: FutureWarning: You are using `torch.load` with `weights_only=False` (the current default value), which uses the default pickle module implicitly. It is possible to construct malicious pickle data which will execute arbitrary code during unpickling (See https://github.com/pytorch/pytorch/blob/main/SECURITY.md#untrusted-models for more details). In a future release, the default value for `weights_only` will be flipped to `True`. This limits the functions that could be executed during unpickling. Arbitrary objects will no longer be allowed to be loaded via this mode unless they are explicitly allowlisted by the user via `torch.serialization.add_safe_globals`. We recommend you start setting `weights_only=True` for any use case where you don't have full control of the loaded file. Please open an issue on GitHub for any issues related to this experimental feature.
  self.data, self.slices = torch.load(self.processed_paths[0])
