STDOUT:
Results will be saved in /home/philip/projects/ltspice_examples_code_repo/Circuit-Completion-Using-GNNs/component_classification_with_link_prediction_head/evaluation/FEGIN/results/model_FEGIN_dataset_ltspice_examples
Command line input: python main.py --data ltspice_examples --representation component_net --model FEGIN --layers 4 --hiddens 16 --batch_size 256 --lr 0.1 --emb_size 512 --epochs 100 --save_appendix component_net_L4_H16_BS256_LR0.1_E512 --no_val
 is saved.
-----
ltspice_examples - FEGIN
Using 4 layers, 16 hidden units, h = 2
Loading component_net representation dataset
ENTERED
Training FEGIN on component_net representation
Train: 3558, Test: 846
##################ITERATION #0 ****************************************
 epoch: 0, train_loss: 1.4206, test_loss: 2.3114, test_f1: 0.1916
 epoch: 1, train_loss: 1.1905, test_loss: 1.3033, test_f1: 0.3153
 epoch: 2, train_loss: 1.1238, test_loss: 1.2045, test_f1: 0.3375
 epoch: 3, train_loss: 1.1337, test_loss: 1.0763, test_f1: 0.3637
 epoch: 4, train_loss: 1.0963, test_loss: 1.1073, test_f1: 0.3590
 epoch: 5, train_loss: 1.0789, test_loss: 1.0894, test_f1: 0.3441
 epoch: 6, train_loss: 1.0814, test_loss: 1.0608, test_f1: 0.3848
 epoch: 7, train_loss: 1.0721, test_loss: 1.1107, test_f1: 0.3673
 epoch: 8, train_loss: 1.0781, test_loss: 1.0644, test_f1: 0.3582
 epoch: 9, train_loss: 1.0713, test_loss: 1.0597, test_f1: 0.3982
 epoch: 10, train_loss: 1.0782, test_loss: 1.0649, test_f1: 0.3579
 epoch: 11, train_loss: 1.0813, test_loss: 1.1667, test_f1: 0.3317
 epoch: 12, train_loss: 1.0794, test_loss: 1.0573, test_f1: 0.3637
 epoch: 13, train_loss: 1.0717, test_loss: 1.0459, test_f1: 0.3422
 epoch: 14, train_loss: 1.0714, test_loss: 1.0644, test_f1: 0.3883
 epoch: 15, train_loss: 1.0658, test_loss: 1.0497, test_f1: 0.3989
 epoch: 16, train_loss: 1.0784, test_loss: 1.0637, test_f1: 0.3573
 epoch: 17, train_loss: 1.0770, test_loss: 1.0471, test_f1: 0.3924
 epoch: 18, train_loss: 1.0474, test_loss: 1.0423, test_f1: 0.3580
 epoch: 19, train_loss: 1.0543, test_loss: 1.0441, test_f1: 0.3511
 epoch: 20, train_loss: 1.0553, test_loss: 1.1080, test_f1: 0.3473
 epoch: 21, train_loss: 1.0554, test_loss: 1.0492, test_f1: 0.3441
 epoch: 22, train_loss: 1.0565, test_loss: 1.0196, test_f1: 0.3584
 epoch: 23, train_loss: 1.0506, test_loss: 1.0698, test_f1: 0.4561
 epoch: 24, train_loss: 1.0406, test_loss: 1.0555, test_f1: 0.3649
 epoch: 25, train_loss: 1.0495, test_loss: 1.0386, test_f1: 0.4313
 epoch: 26, train_loss: 1.0397, test_loss: 1.0541, test_f1: 0.3962
 epoch: 27, train_loss: 1.0428, test_loss: 1.0291, test_f1: 0.4358
 epoch: 28, train_loss: 1.0291, test_loss: 1.0552, test_f1: 0.4366
 epoch: 29, train_loss: 1.0452, test_loss: 1.2079, test_f1: 0.2997
 epoch: 30, train_loss: 1.0442, test_loss: 1.0929, test_f1: 0.4546
 epoch: 31, train_loss: 1.0470, test_loss: 1.0280, test_f1: 0.4379
 epoch: 32, train_loss: 1.0376, test_loss: 1.0149, test_f1: 0.4897
 epoch: 33, train_loss: 1.0383, test_loss: 1.0691, test_f1: 0.4023
 epoch: 34, train_loss: 1.0659, test_loss: 1.0412, test_f1: 0.4003
 epoch: 35, train_loss: 1.0522, test_loss: 1.0279, test_f1: 0.4031
 epoch: 36, train_loss: 1.0474, test_loss: 1.0890, test_f1: 0.4280
 epoch: 37, train_loss: 1.0522, test_loss: 1.0468, test_f1: 0.3543
 epoch: 38, train_loss: 1.0471, test_loss: 1.0414, test_f1: 0.3555
 epoch: 39, train_loss: 1.0238, test_loss: 1.0137, test_f1: 0.3429
 epoch: 40, train_loss: 1.0556, test_loss: 1.1009, test_f1: 0.3422
 epoch: 41, train_loss: 1.0393, test_loss: 1.0915, test_f1: 0.4435
 epoch: 42, train_loss: 1.0219, test_loss: 1.0211, test_f1: 0.4591
 epoch: 43, train_loss: 1.0179, test_loss: 1.2408, test_f1: 0.4557
 epoch: 44, train_loss: 1.0155, test_loss: 1.0806, test_f1: 0.4339
 epoch: 45, train_loss: 1.0081, test_loss: 1.0624, test_f1: 0.4588
 epoch: 46, train_loss: 1.0189, test_loss: 1.0753, test_f1: 0.4349
 epoch: 47, train_loss: 1.0191, test_loss: 1.1394, test_f1: 0.4486
 epoch: 48, train_loss: 1.0276, test_loss: 1.0101, test_f1: 0.4796
 epoch: 49, train_loss: 1.0185, test_loss: 0.9918, test_f1: 0.4632
 epoch: 50, train_loss: 1.0094, test_loss: 1.2238, test_f1: 0.4500
 epoch: 51, train_loss: 0.9999, test_loss: 1.1382, test_f1: 0.4609
 epoch: 52, train_loss: 0.9916, test_loss: 1.1198, test_f1: 0.4338
 epoch: 53, train_loss: 0.9919, test_loss: 1.0752, test_f1: 0.4392
 epoch: 54, train_loss: 0.9926, test_loss: 1.0720, test_f1: 0.4548
 epoch: 55, train_loss: 0.9956, test_loss: 1.0088, test_f1: 0.4739
 epoch: 56, train_loss: 1.0030, test_loss: 1.0505, test_f1: 0.4680
 epoch: 57, train_loss: 0.9865, test_loss: 1.0390, test_f1: 0.4660
 epoch: 58, train_loss: 0.9828, test_loss: 1.0994, test_f1: 0.4660
 epoch: 59, train_loss: 0.9801, test_loss: 1.0668, test_f1: 0.4621
 epoch: 60, train_loss: 0.9920, test_loss: 1.0269, test_f1: 0.4625
 epoch: 61, train_loss: 0.9905, test_loss: 1.1542, test_f1: 0.4801
 epoch: 62, train_loss: 0.9926, test_loss: 1.0881, test_f1: 0.4272
 epoch: 63, train_loss: 1.0050, test_loss: 1.1171, test_f1: 0.4796
 epoch: 64, train_loss: 0.9835, test_loss: 1.0855, test_f1: 0.4831
 epoch: 65, train_loss: 0.9873, test_loss: 1.0186, test_f1: 0.4412
 epoch: 66, train_loss: 0.9784, test_loss: 1.1117, test_f1: 0.4388
 epoch: 67, train_loss: 0.9845, test_loss: 1.2314, test_f1: 0.4455
 epoch: 68, train_loss: 0.9825, test_loss: 1.0010, test_f1: 0.4320
 epoch: 69, train_loss: 0.9719, test_loss: 0.9715, test_f1: 0.5079
 epoch: 70, train_loss: 0.9773, test_loss: 1.0024, test_f1: 0.4495
 epoch: 71, train_loss: 0.9873, test_loss: 1.0669, test_f1: 0.4526
 epoch: 72, train_loss: 0.9913, test_loss: 1.0174, test_f1: 0.4429
 epoch: 73, train_loss: 0.9804, test_loss: 1.0585, test_f1: 0.4487
 epoch: 74, train_loss: 0.9800, test_loss: 1.0608, test_f1: 0.4318
 epoch: 75, train_loss: 0.9969, test_loss: 1.0145, test_f1: 0.4348
 epoch: 76, train_loss: 0.9817, test_loss: 1.0321, test_f1: 0.4618
 epoch: 77, train_loss: 0.9731, test_loss: 0.9853, test_f1: 0.4562
 epoch: 78, train_loss: 0.9723, test_loss: 1.0471, test_f1: 0.4645
 epoch: 79, train_loss: 0.9767, test_loss: 1.0625, test_f1: 0.4681
 epoch: 80, train_loss: 0.9695, test_loss: 0.9871, test_f1: 0.4865
 epoch: 81, train_loss: 0.9663, test_loss: 1.0002, test_f1: 0.4612
 epoch: 82, train_loss: 0.9818, test_loss: 0.9907, test_f1: 0.4779
 epoch: 83, train_loss: 0.9957, test_loss: 1.0710, test_f1: 0.4296
 epoch: 84, train_loss: 0.9965, test_loss: 0.9857, test_f1: 0.4667
 epoch: 85, train_loss: 0.9849, test_loss: 1.0414, test_f1: 0.4637
 epoch: 86, train_loss: 0.9847, test_loss: 1.0106, test_f1: 0.4644
 epoch: 87, train_loss: 0.9862, test_loss: 1.2050, test_f1: 0.4408
 epoch: 88, train_loss: 0.9911, test_loss: 1.0040, test_f1: 0.4285
 epoch: 89, train_loss: 0.9779, test_loss: 0.9737, test_f1: 0.4838
 epoch: 90, train_loss: 0.9817, test_loss: 1.0066, test_f1: 0.4751
 epoch: 91, train_loss: 0.9713, test_loss: 1.0106, test_f1: 0.4794
 epoch: 92, train_loss: 0.9758, test_loss: 1.1409, test_f1: 0.4140
 epoch: 93, train_loss: 0.9976, test_loss: 1.0101, test_f1: 0.5005
 epoch: 94, train_loss: 0.9889, test_loss: 0.9698, test_f1: 0.4743
 epoch: 95, train_loss: 1.0153, test_loss: 1.0896, test_f1: 0.4758
 epoch: 96, train_loss: 1.0145, test_loss: 1.0776, test_f1: 0.4755
 epoch: 97, train_loss: 0.9728, test_loss: 0.9803, test_f1: 0.4638
 epoch: 98, train_loss: 0.9686, test_loss: 1.0265, test_f1: 0.4712
 epoch: 99, train_loss: 0.9704, test_loss: 1.1136, test_f1: 0.3728
##################ITERATION #1 ****************************************
 epoch: 0, train_loss: 1.3212, test_loss: 2.0942, test_f1: 0.2499
 epoch: 1, train_loss: 1.2533, test_loss: 1.4110, test_f1: 0.2270
 epoch: 2, train_loss: 1.2486, test_loss: 1.2348, test_f1: 0.2270
 epoch: 3, train_loss: 1.2238, test_loss: 1.1930, test_f1: 0.2405
 epoch: 4, train_loss: 1.2047, test_loss: 1.1679, test_f1: 0.3116
 epoch: 5, train_loss: 1.1845, test_loss: 1.1484, test_f1: 0.3422
 epoch: 6, train_loss: 1.1310, test_loss: 1.0968, test_f1: 0.3502
 epoch: 7, train_loss: 1.1104, test_loss: 1.0823, test_f1: 0.3571
 epoch: 8, train_loss: 1.1057, test_loss: 1.0993, test_f1: 0.3422
 epoch: 9, train_loss: 1.0976, test_loss: 1.0947, test_f1: 0.3432
 epoch: 10, train_loss: 1.0921, test_loss: 1.1252, test_f1: 0.3324
 epoch: 11, train_loss: 1.0872, test_loss: 1.1133, test_f1: 0.3299
 epoch: 12, train_loss: 1.0740, test_loss: 1.0980, test_f1: 0.3403
 epoch: 13, train_loss: 1.0707, test_loss: 1.1292, test_f1: 0.3759
 epoch: 14, train_loss: 1.0704, test_loss: 1.1016, test_f1: 0.3817
 epoch: 15, train_loss: 1.0691, test_loss: 1.0810, test_f1: 0.3688
 epoch: 16, train_loss: 1.0780, test_loss: 1.1123, test_f1: 0.3545
 epoch: 17, train_loss: 1.0600, test_loss: 1.1118, test_f1: 0.3904
 epoch: 18, train_loss: 1.0563, test_loss: 1.0982, test_f1: 0.3592
 epoch: 19, train_loss: 1.0746, test_loss: 1.0962, test_f1: 0.3911
 epoch: 20, train_loss: 1.0691, test_loss: 1.0415, test_f1: 0.4060
 epoch: 21, train_loss: 1.0517, test_loss: 1.1299, test_f1: 0.3497
 epoch: 22, train_loss: 1.0671, test_loss: 1.1048, test_f1: 0.3414
 epoch: 23, train_loss: 1.0586, test_loss: 1.3534, test_f1: 0.3025
 epoch: 24, train_loss: 1.0631, test_loss: 1.0932, test_f1: 0.3469
 epoch: 25, train_loss: 1.0614, test_loss: 1.2352, test_f1: 0.2420
 epoch: 26, train_loss: 1.0605, test_loss: 1.1948, test_f1: 0.3943
 epoch: 27, train_loss: 1.0625, test_loss: 1.0876, test_f1: 0.4118
 epoch: 28, train_loss: 1.0566, test_loss: 1.1740, test_f1: 0.3805
 epoch: 29, train_loss: 1.0593, test_loss: 1.7099, test_f1: 0.3263
 epoch: 30, train_loss: 1.0593, test_loss: 1.1008, test_f1: 0.4468
 epoch: 31, train_loss: 1.0460, test_loss: 1.1002, test_f1: 0.3929
 epoch: 32, train_loss: 1.0396, test_loss: 1.0947, test_f1: 0.4297
 epoch: 33, train_loss: 1.0446, test_loss: 1.1079, test_f1: 0.4277
 epoch: 34, train_loss: 1.0449, test_loss: 1.1536, test_f1: 0.3569
 epoch: 35, train_loss: 1.0366, test_loss: 1.0838, test_f1: 0.3606
 epoch: 36, train_loss: 1.0315, test_loss: 1.1091, test_f1: 0.4177
 epoch: 37, train_loss: 1.0186, test_loss: 1.1901, test_f1: 0.4268
 epoch: 38, train_loss: 1.0286, test_loss: 1.1416, test_f1: 0.4138
 epoch: 39, train_loss: 1.0420, test_loss: 1.1317, test_f1: 0.4143
 epoch: 40, train_loss: 1.0501, test_loss: 1.3333, test_f1: 0.3822
 epoch: 41, train_loss: 1.0531, test_loss: 1.2475, test_f1: 0.3463
 epoch: 42, train_loss: 1.0544, test_loss: 1.1412, test_f1: 0.3403
 epoch: 43, train_loss: 1.0474, test_loss: 1.1053, test_f1: 0.4377
 epoch: 44, train_loss: 1.0288, test_loss: 1.0848, test_f1: 0.3501
 epoch: 45, train_loss: 1.0275, test_loss: 1.0978, test_f1: 0.4652
 epoch: 46, train_loss: 1.0206, test_loss: 1.1211, test_f1: 0.3413
 epoch: 47, train_loss: 1.0373, test_loss: 1.1313, test_f1: 0.3413
 epoch: 48, train_loss: 1.0174, test_loss: 1.0822, test_f1: 0.4487
 epoch: 49, train_loss: 1.0214, test_loss: 1.1132, test_f1: 0.4622
 epoch: 50, train_loss: 1.0321, test_loss: 1.1465, test_f1: 0.4402
 epoch: 51, train_loss: 1.0119, test_loss: 1.0744, test_f1: 0.4335
 epoch: 52, train_loss: 1.0108, test_loss: 1.0862, test_f1: 0.4956
 epoch: 53, train_loss: 0.9999, test_loss: 1.0511, test_f1: 0.5093
 epoch: 54, train_loss: 0.9935, test_loss: 1.1594, test_f1: 0.4431
 epoch: 55, train_loss: 1.0046, test_loss: 1.0749, test_f1: 0.4631
 epoch: 56, train_loss: 0.9857, test_loss: 1.0615, test_f1: 0.4670
 epoch: 57, train_loss: 0.9893, test_loss: 1.0586, test_f1: 0.4867
 epoch: 58, train_loss: 0.9840, test_loss: 1.0992, test_f1: 0.4546
 epoch: 59, train_loss: 0.9875, test_loss: 1.0795, test_f1: 0.4780
 epoch: 60, train_loss: 0.9966, test_loss: 1.0767, test_f1: 0.4712
 epoch: 61, train_loss: 0.9968, test_loss: 1.0686, test_f1: 0.4755
 epoch: 62, train_loss: 1.0045, test_loss: 1.0885, test_f1: 0.4987
 epoch: 63, train_loss: 0.9957, test_loss: 1.0669, test_f1: 0.4714
 epoch: 64, train_loss: 0.9949, test_loss: 1.0636, test_f1: 0.4909
 epoch: 65, train_loss: 0.9787, test_loss: 1.0570, test_f1: 0.4847
 epoch: 66, train_loss: 0.9845, test_loss: 1.1044, test_f1: 0.4862
 epoch: 67, train_loss: 0.9959, test_loss: 1.0809, test_f1: 0.4611
 epoch: 68, train_loss: 0.9817, test_loss: 1.0668, test_f1: 0.4799
 epoch: 69, train_loss: 0.9824, test_loss: 1.0828, test_f1: 0.4863
 epoch: 70, train_loss: 0.9849, test_loss: 1.0810, test_f1: 0.4931
 epoch: 71, train_loss: 0.9719, test_loss: 1.0864, test_f1: 0.4821
 epoch: 72, train_loss: 0.9883, test_loss: 1.0810, test_f1: 0.4736
 epoch: 73, train_loss: 0.9741, test_loss: 1.0803, test_f1: 0.4726
 epoch: 74, train_loss: 0.9697, test_loss: 1.0940, test_f1: 0.4729
 epoch: 75, train_loss: 0.9705, test_loss: 1.0702, test_f1: 0.4862
 epoch: 76, train_loss: 0.9919, test_loss: 1.0794, test_f1: 0.4879
 epoch: 77, train_loss: 0.9906, test_loss: 1.0820, test_f1: 0.4740
 epoch: 78, train_loss: 0.9823, test_loss: 1.0794, test_f1: 0.5091
 epoch: 79, train_loss: 0.9807, test_loss: 1.0902, test_f1: 0.4643
 epoch: 80, train_loss: 0.9703, test_loss: 1.0724, test_f1: 0.4758
 epoch: 81, train_loss: 0.9763, test_loss: 1.0491, test_f1: 0.4899
 epoch: 82, train_loss: 0.9737, test_loss: 1.0839, test_f1: 0.4786
 epoch: 83, train_loss: 0.9670, test_loss: 1.0758, test_f1: 0.4788
 epoch: 84, train_loss: 0.9835, test_loss: 1.1311, test_f1: 0.4516
 epoch: 85, train_loss: 0.9662, test_loss: 1.0584, test_f1: 0.4933
 epoch: 86, train_loss: 0.9716, test_loss: 1.0437, test_f1: 0.4853
 epoch: 87, train_loss: 0.9673, test_loss: 1.0748, test_f1: 0.4812
 epoch: 88, train_loss: 0.9790, test_loss: 1.0817, test_f1: 0.4769
 epoch: 89, train_loss: 0.9575, test_loss: 1.0691, test_f1: 0.4926
 epoch: 90, train_loss: 0.9610, test_loss: 1.0785, test_f1: 0.4781
 epoch: 91, train_loss: 0.9637, test_loss: 1.0909, test_f1: 0.4861
 epoch: 92, train_loss: 0.9583, test_loss: 1.0599, test_f1: 0.4907
 epoch: 93, train_loss: 0.9605, test_loss: 1.0655, test_f1: 0.4753
 epoch: 94, train_loss: 0.9509, test_loss: 1.0484, test_f1: 0.4849
 epoch: 95, train_loss: 0.9525, test_loss: 1.0320, test_f1: 0.4927
 epoch: 96, train_loss: 0.9623, test_loss: 1.0954, test_f1: 0.4623
 epoch: 97, train_loss: 0.9590, test_loss: 1.0753, test_f1: 0.4901
 epoch: 98, train_loss: 0.9712, test_loss: 1.0457, test_f1: 0.4975
 epoch: 99, train_loss: 0.9672, test_loss: 1.0489, test_f1: 0.4950
##################ITERATION #2 ****************************************
 epoch: 0, train_loss: 1.5117, test_loss: 4.7807, test_f1: 0.2755
 epoch: 1, train_loss: 1.2380, test_loss: 1.4747, test_f1: 0.2747
 epoch: 2, train_loss: 1.1776, test_loss: 1.1371, test_f1: 0.3494
 epoch: 3, train_loss: 1.1437, test_loss: 1.1430, test_f1: 0.4004
 epoch: 4, train_loss: 1.1425, test_loss: 1.1200, test_f1: 0.3396
 epoch: 5, train_loss: 1.1135, test_loss: 1.0779, test_f1: 0.3581
 epoch: 6, train_loss: 1.1097, test_loss: 1.1091, test_f1: 0.4125
 epoch: 7, train_loss: 1.0972, test_loss: 1.0892, test_f1: 0.3534
 epoch: 8, train_loss: 1.1063, test_loss: 1.0788, test_f1: 0.3609
 epoch: 9, train_loss: 1.0925, test_loss: 1.0865, test_f1: 0.3469
 epoch: 10, train_loss: 1.1064, test_loss: 1.2027, test_f1: 0.2971
 epoch: 11, train_loss: 1.0862, test_loss: 1.1397, test_f1: 0.3536
 epoch: 12, train_loss: 1.0868, test_loss: 1.1209, test_f1: 0.3383
 epoch: 13, train_loss: 1.0657, test_loss: 1.0872, test_f1: 0.3432
 epoch: 14, train_loss: 1.0659, test_loss: 1.0602, test_f1: 0.3427
 epoch: 15, train_loss: 1.1059, test_loss: 1.0981, test_f1: 0.3802
 epoch: 16, train_loss: 1.0721, test_loss: 1.0703, test_f1: 0.3848
 epoch: 17, train_loss: 1.0728, test_loss: 1.1599, test_f1: 0.3621
 epoch: 18, train_loss: 1.0642, test_loss: 1.0972, test_f1: 0.3946
 epoch: 19, train_loss: 1.0680, test_loss: 1.1167, test_f1: 0.3638
 epoch: 20, train_loss: 1.0656, test_loss: 1.1063, test_f1: 0.3740
 epoch: 21, train_loss: 1.0459, test_loss: 1.1446, test_f1: 0.3517
 epoch: 22, train_loss: 1.0471, test_loss: 1.1385, test_f1: 0.3422
 epoch: 23, train_loss: 1.0627, test_loss: 1.0567, test_f1: 0.3864
 epoch: 24, train_loss: 1.0569, test_loss: 1.1583, test_f1: 0.3430
 epoch: 25, train_loss: 1.0669, test_loss: 1.0661, test_f1: 0.3416
 epoch: 26, train_loss: 1.0687, test_loss: 1.1058, test_f1: 0.4075
 epoch: 27, train_loss: 1.0684, test_loss: 1.1076, test_f1: 0.3890
 epoch: 28, train_loss: 1.0666, test_loss: 1.1033, test_f1: 0.3545
 epoch: 29, train_loss: 1.0559, test_loss: 1.1174, test_f1: 0.3413
 epoch: 30, train_loss: 1.0613, test_loss: 1.0716, test_f1: 0.3413
 epoch: 31, train_loss: 1.0524, test_loss: 1.0608, test_f1: 0.3393
 epoch: 32, train_loss: 1.0417, test_loss: 1.1262, test_f1: 0.3413
 epoch: 33, train_loss: 1.0466, test_loss: 1.0297, test_f1: 0.3958
 epoch: 34, train_loss: 1.0457, test_loss: 1.1346, test_f1: 0.3582
 epoch: 35, train_loss: 1.0646, test_loss: 1.1344, test_f1: 0.4020
 epoch: 36, train_loss: 1.0595, test_loss: 1.1038, test_f1: 0.3613
 epoch: 37, train_loss: 1.0410, test_loss: 1.0877, test_f1: 0.3814
 epoch: 38, train_loss: 1.0385, test_loss: 1.1121, test_f1: 0.3515
 epoch: 39, train_loss: 1.0355, test_loss: 1.0204, test_f1: 0.3680
 epoch: 40, train_loss: 1.0509, test_loss: 1.1190, test_f1: 0.3432
 epoch: 41, train_loss: 1.0468, test_loss: 1.1262, test_f1: 0.3937
 epoch: 42, train_loss: 1.0561, test_loss: 1.2084, test_f1: 0.3244
 epoch: 43, train_loss: 1.0541, test_loss: 1.1122, test_f1: 0.3647
 epoch: 44, train_loss: 1.0454, test_loss: 1.1010, test_f1: 0.3740
 epoch: 45, train_loss: 1.0420, test_loss: 1.1006, test_f1: 0.3768
 epoch: 46, train_loss: 1.0473, test_loss: 1.1111, test_f1: 0.4145
 epoch: 47, train_loss: 1.0458, test_loss: 1.1205, test_f1: 0.3463
 epoch: 48, train_loss: 1.0501, test_loss: 1.0931, test_f1: 0.3476
 epoch: 49, train_loss: 1.0380, test_loss: 1.1235, test_f1: 0.3441
 epoch: 50, train_loss: 1.0413, test_loss: 1.0515, test_f1: 0.3685
 epoch: 51, train_loss: 1.0307, test_loss: 1.0096, test_f1: 0.3930
 epoch: 52, train_loss: 1.0217, test_loss: 1.0194, test_f1: 0.4054
 epoch: 53, train_loss: 1.0181, test_loss: 1.0922, test_f1: 0.3998
 epoch: 54, train_loss: 1.0236, test_loss: 1.0982, test_f1: 0.3881
 epoch: 55, train_loss: 1.0213, test_loss: 1.0952, test_f1: 0.3544
 epoch: 56, train_loss: 1.0244, test_loss: 1.1106, test_f1: 0.3465
 epoch: 57, train_loss: 1.0334, test_loss: 1.0127, test_f1: 0.3582
 epoch: 58, train_loss: 1.0251, test_loss: 1.0835, test_f1: 0.3983
 epoch: 59, train_loss: 1.0088, test_loss: 1.1195, test_f1: 0.3441
 epoch: 60, train_loss: 1.0223, test_loss: 1.1042, test_f1: 0.3475
 epoch: 61, train_loss: 1.0131, test_loss: 1.1501, test_f1: 0.3864
 epoch: 62, train_loss: 1.0499, test_loss: 1.1679, test_f1: 0.3915
 epoch: 63, train_loss: 1.0452, test_loss: 1.0366, test_f1: 0.4177
 epoch: 64, train_loss: 1.0413, test_loss: 1.0135, test_f1: 0.3693
 epoch: 65, train_loss: 1.0282, test_loss: 1.1016, test_f1: 0.3558
 epoch: 66, train_loss: 1.0177, test_loss: 1.1707, test_f1: 0.3457
 epoch: 67, train_loss: 1.0276, test_loss: 1.1003, test_f1: 0.3620
 epoch: 68, train_loss: 1.0151, test_loss: 1.0941, test_f1: 0.3762
 epoch: 69, train_loss: 1.0084, test_loss: 1.0981, test_f1: 0.3610
 epoch: 70, train_loss: 1.0219, test_loss: 1.0941, test_f1: 0.3935
 epoch: 71, train_loss: 1.0071, test_loss: 1.0912, test_f1: 0.3566
 epoch: 72, train_loss: 1.0069, test_loss: 1.0944, test_f1: 0.3959
 epoch: 73, train_loss: 1.0067, test_loss: 1.0862, test_f1: 0.3935
 epoch: 74, train_loss: 1.0047, test_loss: 1.1085, test_f1: 0.3955
 epoch: 75, train_loss: 1.0129, test_loss: 1.1033, test_f1: 0.3479
 epoch: 76, train_loss: 1.0208, test_loss: 1.1132, test_f1: 0.3555
 epoch: 77, train_loss: 1.0141, test_loss: 1.1282, test_f1: 0.3991
 epoch: 78, train_loss: 1.0254, test_loss: 1.0878, test_f1: 0.3643
 epoch: 79, train_loss: 1.0352, test_loss: 1.1126, test_f1: 0.3616
 epoch: 80, train_loss: 1.0326, test_loss: 1.1059, test_f1: 0.3821
 epoch: 81, train_loss: 1.0168, test_loss: 1.1216, test_f1: 0.3580
 epoch: 82, train_loss: 1.0324, test_loss: 1.1127, test_f1: 0.3453
 epoch: 83, train_loss: 1.0171, test_loss: 1.1206, test_f1: 0.3425
 epoch: 84, train_loss: 1.0051, test_loss: 1.0939, test_f1: 0.3647
 epoch: 85, train_loss: 0.9956, test_loss: 1.1038, test_f1: 0.3884
 epoch: 86, train_loss: 1.0031, test_loss: 1.0927, test_f1: 0.4124
 epoch: 87, train_loss: 1.0120, test_loss: 1.1221, test_f1: 0.3594
 epoch: 88, train_loss: 1.0198, test_loss: 1.0903, test_f1: 0.3730
 epoch: 89, train_loss: 1.0096, test_loss: 1.0963, test_f1: 0.3491
 epoch: 90, train_loss: 1.0071, test_loss: 1.0944, test_f1: 0.3930
 epoch: 91, train_loss: 1.0046, test_loss: 1.1221, test_f1: 0.3938
 epoch: 92, train_loss: 0.9987, test_loss: 1.1135, test_f1: 0.3479
 epoch: 93, train_loss: 1.0088, test_loss: 1.0880, test_f1: 0.3494
 epoch: 94, train_loss: 1.0064, test_loss: 1.0917, test_f1: 0.3828
 epoch: 95, train_loss: 0.9915, test_loss: 1.0896, test_f1: 0.3991
 epoch: 96, train_loss: 0.9882, test_loss: 1.0913, test_f1: 0.3833
 epoch: 97, train_loss: 0.9969, test_loss: 1.0844, test_f1: 0.3540
 epoch: 98, train_loss: 0.9920, test_loss: 1.0805, test_f1: 0.3542
 epoch: 99, train_loss: 0.9925, test_loss: 1.0771, test_f1: 0.3577
##################ITERATION #3 ****************************************
 epoch: 0, train_loss: 1.3582, test_loss: 1.2897, test_f1: 0.2270
 epoch: 1, train_loss: 1.2318, test_loss: 1.4423, test_f1: 0.2368
 epoch: 2, train_loss: 1.1211, test_loss: 1.3210, test_f1: 0.2730
 epoch: 3, train_loss: 1.0908, test_loss: 1.2312, test_f1: 0.3768
 epoch: 4, train_loss: 1.1066, test_loss: 1.0886, test_f1: 0.3731
 epoch: 5, train_loss: 1.0961, test_loss: 1.1540, test_f1: 0.3370
 epoch: 6, train_loss: 1.0501, test_loss: 1.1054, test_f1: 0.3682
 epoch: 7, train_loss: 1.0462, test_loss: 1.0282, test_f1: 0.3670
 epoch: 8, train_loss: 1.0367, test_loss: 1.1211, test_f1: 0.3380
 epoch: 9, train_loss: 1.0788, test_loss: 1.1534, test_f1: 0.3732
 epoch: 10, train_loss: 1.0698, test_loss: 1.0561, test_f1: 0.3679
 epoch: 11, train_loss: 1.0562, test_loss: 1.0860, test_f1: 0.3932
 epoch: 12, train_loss: 1.0464, test_loss: 1.0386, test_f1: 0.4101
 epoch: 13, train_loss: 1.0332, test_loss: 1.1063, test_f1: 0.3536
 epoch: 14, train_loss: 1.0329, test_loss: 1.0740, test_f1: 0.3930
 epoch: 15, train_loss: 1.0330, test_loss: 1.0856, test_f1: 0.3364
 epoch: 16, train_loss: 1.0417, test_loss: 1.1133, test_f1: 0.3422
 epoch: 17, train_loss: 1.0248, test_loss: 1.1041, test_f1: 0.3920
 epoch: 18, train_loss: 1.0357, test_loss: 1.0275, test_f1: 0.3711
 epoch: 19, train_loss: 1.0337, test_loss: 1.0997, test_f1: 0.3907
 epoch: 20, train_loss: 1.0277, test_loss: 1.0166, test_f1: 0.3914
 epoch: 21, train_loss: 1.0136, test_loss: 1.0929, test_f1: 0.3453
 epoch: 22, train_loss: 1.0128, test_loss: 1.1093, test_f1: 0.3425
 epoch: 23, train_loss: 1.0312, test_loss: 1.0317, test_f1: 0.3668
 epoch: 24, train_loss: 1.0093, test_loss: 1.0189, test_f1: 0.3596
 epoch: 25, train_loss: 1.0530, test_loss: 1.0251, test_f1: 0.3897
 epoch: 26, train_loss: 1.0237, test_loss: 1.0481, test_f1: 0.3486
 epoch: 27, train_loss: 1.0056, test_loss: 1.0992, test_f1: 0.3953
 epoch: 28, train_loss: 1.0100, test_loss: 1.1276, test_f1: 0.3653
 epoch: 29, train_loss: 1.0061, test_loss: 0.9855, test_f1: 0.3600
 epoch: 30, train_loss: 0.9930, test_loss: 1.0923, test_f1: 0.3574
 epoch: 31, train_loss: 1.0023, test_loss: 0.9961, test_f1: 0.3788
 epoch: 32, train_loss: 0.9913, test_loss: 1.0880, test_f1: 0.4345
 epoch: 33, train_loss: 0.9837, test_loss: 1.0887, test_f1: 0.3677
 epoch: 34, train_loss: 1.0205, test_loss: 1.0033, test_f1: 0.3600
 epoch: 35, train_loss: 0.9972, test_loss: 1.0956, test_f1: 0.3637
 epoch: 36, train_loss: 0.9912, test_loss: 1.0864, test_f1: 0.3897
 epoch: 37, train_loss: 0.9976, test_loss: 0.9922, test_f1: 0.4051
 epoch: 38, train_loss: 1.0019, test_loss: 1.0856, test_f1: 0.3594
 epoch: 39, train_loss: 0.9884, test_loss: 1.0743, test_f1: 0.3991
 epoch: 40, train_loss: 1.0130, test_loss: 1.1577, test_f1: 0.3742
 epoch: 41, train_loss: 1.0092, test_loss: 1.1178, test_f1: 0.3545
 epoch: 42, train_loss: 1.0130, test_loss: 1.0913, test_f1: 0.4126
 epoch: 43, train_loss: 1.0006, test_loss: 1.1070, test_f1: 0.3460
 epoch: 44, train_loss: 0.9952, test_loss: 1.1127, test_f1: 0.3990
 epoch: 45, train_loss: 0.9985, test_loss: 1.0617, test_f1: 0.3655
 epoch: 46, train_loss: 0.9825, test_loss: 1.0712, test_f1: 0.4328
 epoch: 47, train_loss: 1.0236, test_loss: 1.0170, test_f1: 0.3572
 epoch: 48, train_loss: 0.9971, test_loss: 1.0832, test_f1: 0.4590
 epoch: 49, train_loss: 0.9883, test_loss: 0.9901, test_f1: 0.3924
 epoch: 50, train_loss: 0.9860, test_loss: 1.0842, test_f1: 0.3639
 epoch: 51, train_loss: 0.9777, test_loss: 1.0758, test_f1: 0.4000
 epoch: 52, train_loss: 0.9632, test_loss: 1.0630, test_f1: 0.3986
 epoch: 53, train_loss: 0.9620, test_loss: 1.0657, test_f1: 0.3568
 epoch: 54, train_loss: 0.9533, test_loss: 1.0679, test_f1: 0.3941
 epoch: 55, train_loss: 0.9651, test_loss: 1.0865, test_f1: 0.3794
 epoch: 56, train_loss: 0.9630, test_loss: 1.0845, test_f1: 0.3649
 epoch: 57, train_loss: 0.9690, test_loss: 1.0676, test_f1: 0.3751
 epoch: 58, train_loss: 0.9582, test_loss: 1.0594, test_f1: 0.3998
 epoch: 59, train_loss: 0.9568, test_loss: 1.0778, test_f1: 0.4615
 epoch: 60, train_loss: 0.9679, test_loss: 1.0945, test_f1: 0.4891
 epoch: 61, train_loss: 0.9546, test_loss: 1.0857, test_f1: 0.5154
 epoch: 62, train_loss: 0.9436, test_loss: 1.0858, test_f1: 0.5167
 epoch: 63, train_loss: 0.9641, test_loss: 1.0532, test_f1: 0.4627
 epoch: 64, train_loss: 0.9465, test_loss: 1.1003, test_f1: 0.4685
 epoch: 65, train_loss: 0.9437, test_loss: 1.0815, test_f1: 0.4993
 epoch: 66, train_loss: 0.9469, test_loss: 1.0888, test_f1: 0.4716
 epoch: 67, train_loss: 0.9560, test_loss: 1.0706, test_f1: 0.5025
 epoch: 68, train_loss: 0.9541, test_loss: 1.1128, test_f1: 0.5097
 epoch: 69, train_loss: 0.9378, test_loss: 1.0688, test_f1: 0.4963
 epoch: 70, train_loss: 0.9330, test_loss: 1.1100, test_f1: 0.4630
 epoch: 71, train_loss: 0.9288, test_loss: 1.1328, test_f1: 0.4735
 epoch: 72, train_loss: 0.9490, test_loss: 1.1526, test_f1: 0.5043
 epoch: 73, train_loss: 0.9372, test_loss: 1.0612, test_f1: 0.4760
 epoch: 74, train_loss: 0.9375, test_loss: 1.0956, test_f1: 0.4605
 epoch: 75, train_loss: 0.9362, test_loss: 1.0582, test_f1: 0.5032
 epoch: 76, train_loss: 0.9377, test_loss: 1.1249, test_f1: 0.3940
 epoch: 77, train_loss: 0.9516, test_loss: 1.0861, test_f1: 0.3808
 epoch: 78, train_loss: 0.9528, test_loss: 1.0654, test_f1: 0.4374
 epoch: 79, train_loss: 0.9376, test_loss: 1.0627, test_f1: 0.4768
 epoch: 80, train_loss: 0.9323, test_loss: 1.0213, test_f1: 0.5143
 epoch: 81, train_loss: 0.9214, test_loss: 1.1747, test_f1: 0.4836
 epoch: 82, train_loss: 0.9459, test_loss: 1.0930, test_f1: 0.4880
 epoch: 83, train_loss: 0.9459, test_loss: 1.0584, test_f1: 0.4232
 epoch: 84, train_loss: 0.9384, test_loss: 1.1156, test_f1: 0.3790
 epoch: 85, train_loss: 0.9339, test_loss: 1.0516, test_f1: 0.4946
 epoch: 86, train_loss: 0.9294, test_loss: 1.1522, test_f1: 0.5072
 epoch: 87, train_loss: 0.9206, test_loss: 1.0914, test_f1: 0.4881
 epoch: 88, train_loss: 0.9200, test_loss: 1.0552, test_f1: 0.4925
 epoch: 89, train_loss: 0.9292, test_loss: 1.0368, test_f1: 0.5229
 epoch: 90, train_loss: 0.9204, test_loss: 1.0577, test_f1: 0.5022
 epoch: 91, train_loss: 0.9372, test_loss: 1.1728, test_f1: 0.3990
 epoch: 92, train_loss: 0.9186, test_loss: 1.1198, test_f1: 0.4641
 epoch: 93, train_loss: 0.9267, test_loss: 1.1091, test_f1: 0.4825
 epoch: 94, train_loss: 0.9156, test_loss: 1.0970, test_f1: 0.4763
 epoch: 95, train_loss: 0.9369, test_loss: 1.0716, test_f1: 0.5040
 epoch: 96, train_loss: 0.9192, test_loss: 1.1029, test_f1: 0.4880
 epoch: 97, train_loss: 0.9234, test_loss: 1.0829, test_f1: 0.4862
 epoch: 98, train_loss: 0.9232, test_loss: 1.2058, test_f1: 0.4574
 epoch: 99, train_loss: 0.9224, test_loss: 1.1683, test_f1: 0.4847
##################ITERATION #4 ****************************************
 epoch: 0, train_loss: 1.3450, test_loss: 2.8975, test_f1: 0.2711
 epoch: 1, train_loss: 1.2406, test_loss: 1.5669, test_f1: 0.2758
 epoch: 2, train_loss: 1.1785, test_loss: 1.2099, test_f1: 0.3003
 epoch: 3, train_loss: 1.1499, test_loss: 1.0879, test_f1: 0.3877
 epoch: 4, train_loss: 1.1557, test_loss: 1.0754, test_f1: 0.3445
 epoch: 5, train_loss: 1.1033, test_loss: 1.1387, test_f1: 0.3362
 epoch: 6, train_loss: 1.1076, test_loss: 1.0905, test_f1: 0.3583
 epoch: 7, train_loss: 1.1040, test_loss: 1.1493, test_f1: 0.3442
 epoch: 8, train_loss: 1.0978, test_loss: 1.3036, test_f1: 0.3073
 epoch: 9, train_loss: 1.0860, test_loss: 1.4254, test_f1: 0.2456
 epoch: 10, train_loss: 1.0839, test_loss: 1.3700, test_f1: 0.3278
 epoch: 11, train_loss: 1.0894, test_loss: 1.0561, test_f1: 0.3461
 epoch: 12, train_loss: 1.0818, test_loss: 1.0718, test_f1: 0.3375
 epoch: 13, train_loss: 1.0651, test_loss: 1.1342, test_f1: 0.4161
 epoch: 14, train_loss: 1.0847, test_loss: 1.0719, test_f1: 0.3534
 epoch: 15, train_loss: 1.0726, test_loss: 1.0396, test_f1: 0.3481
 epoch: 16, train_loss: 1.0590, test_loss: 1.0528, test_f1: 0.4013
 epoch: 17, train_loss: 1.0773, test_loss: 1.0916, test_f1: 0.3362
 epoch: 18, train_loss: 1.0808, test_loss: 1.0992, test_f1: 0.3345
 epoch: 19, train_loss: 1.0632, test_loss: 1.0761, test_f1: 0.3535
 epoch: 20, train_loss: 1.0791, test_loss: 1.0245, test_f1: 0.3750
 epoch: 21, train_loss: 1.0643, test_loss: 1.0830, test_f1: 0.3526
 epoch: 22, train_loss: 1.0573, test_loss: 1.1618, test_f1: 0.3446
 epoch: 23, train_loss: 1.0516, test_loss: 1.2927, test_f1: 0.3265
 epoch: 24, train_loss: 1.0557, test_loss: 1.0092, test_f1: 0.3757
 epoch: 25, train_loss: 1.0907, test_loss: 1.3441, test_f1: 0.2952
 epoch: 26, train_loss: 1.1058, test_loss: 1.4673, test_f1: 0.3933
 epoch: 27, train_loss: 1.0672, test_loss: 1.1070, test_f1: 0.3450
 epoch: 28, train_loss: 1.0697, test_loss: 1.0871, test_f1: 0.3432
 epoch: 29, train_loss: 1.0561, test_loss: 1.1311, test_f1: 0.3792
 epoch: 30, train_loss: 1.0530, test_loss: 1.1480, test_f1: 0.3445
 epoch: 31, train_loss: 1.0456, test_loss: 1.0362, test_f1: 0.3498
 epoch: 32, train_loss: 1.0478, test_loss: 1.1526, test_f1: 0.3376
 epoch: 33, train_loss: 1.0532, test_loss: 1.0977, test_f1: 0.3604
 epoch: 34, train_loss: 1.0502, test_loss: 1.1984, test_f1: 0.3153
 epoch: 35, train_loss: 1.0598, test_loss: 1.1028, test_f1: 0.3601
 epoch: 36, train_loss: 1.0439, test_loss: 1.1723, test_f1: 0.3561
 epoch: 37, train_loss: 1.0416, test_loss: 1.0467, test_f1: 0.3475
 epoch: 38, train_loss: 1.0317, test_loss: 1.0812, test_f1: 0.3524
 epoch: 39, train_loss: 1.0289, test_loss: 1.0386, test_f1: 0.3477
 epoch: 40, train_loss: 1.0363, test_loss: 1.1538, test_f1: 0.3689
 epoch: 41, train_loss: 1.0325, test_loss: 1.1719, test_f1: 0.3904
 epoch: 42, train_loss: 1.0319, test_loss: 1.0132, test_f1: 0.3699
 epoch: 43, train_loss: 1.0287, test_loss: 1.0457, test_f1: 0.3514
 epoch: 44, train_loss: 1.0400, test_loss: 1.1305, test_f1: 0.3357
 epoch: 45, train_loss: 1.0240, test_loss: 1.0747, test_f1: 0.3497
 epoch: 46, train_loss: 1.0200, test_loss: 0.9957, test_f1: 0.3702
 epoch: 47, train_loss: 1.0216, test_loss: 1.1270, test_f1: 0.3399
 epoch: 48, train_loss: 1.0158, test_loss: 1.1738, test_f1: 0.3449
 epoch: 49, train_loss: 1.0257, test_loss: 1.0949, test_f1: 0.3509
 epoch: 50, train_loss: 1.0141, test_loss: 1.1493, test_f1: 0.3328
 epoch: 51, train_loss: 1.0162, test_loss: 1.0721, test_f1: 0.3417
 epoch: 52, train_loss: 0.9940, test_loss: 1.1293, test_f1: 0.3444
 epoch: 53, train_loss: 0.9875, test_loss: 1.0652, test_f1: 0.3620
 epoch: 54, train_loss: 0.9952, test_loss: 1.1739, test_f1: 0.3261
 epoch: 55, train_loss: 0.9975, test_loss: 1.0307, test_f1: 0.3637
 epoch: 56, train_loss: 0.9961, test_loss: 1.1000, test_f1: 0.3477
 epoch: 57, train_loss: 0.9821, test_loss: 1.1442, test_f1: 0.3390
 epoch: 58, train_loss: 0.9868, test_loss: 1.1295, test_f1: 0.3413
 epoch: 59, train_loss: 1.0104, test_loss: 1.1163, test_f1: 0.3423
 epoch: 60, train_loss: 1.0002, test_loss: 1.1317, test_f1: 0.3634
 epoch: 61, train_loss: 0.9907, test_loss: 1.1090, test_f1: 0.3491
 epoch: 62, train_loss: 0.9898, test_loss: 1.0890, test_f1: 0.3979
 epoch: 63, train_loss: 0.9900, test_loss: 1.0569, test_f1: 0.3732
 epoch: 64, train_loss: 0.9823, test_loss: 1.0764, test_f1: 0.3583
 epoch: 65, train_loss: 0.9781, test_loss: 1.0686, test_f1: 0.4011
 epoch: 66, train_loss: 0.9866, test_loss: 1.1249, test_f1: 0.3451
 epoch: 67, train_loss: 0.9895, test_loss: 1.0840, test_f1: 0.3798
 epoch: 68, train_loss: 0.9788, test_loss: 1.0831, test_f1: 0.3510
 epoch: 69, train_loss: 0.9875, test_loss: 1.1611, test_f1: 0.3292
 epoch: 70, train_loss: 0.9783, test_loss: 1.2039, test_f1: 0.3090
 epoch: 71, train_loss: 0.9811, test_loss: 1.1157, test_f1: 0.3491
 epoch: 72, train_loss: 1.0045, test_loss: 1.0221, test_f1: 0.3485
 epoch: 73, train_loss: 0.9730, test_loss: 1.1677, test_f1: 0.3241
 epoch: 74, train_loss: 0.9817, test_loss: 1.1948, test_f1: 0.3205
 epoch: 75, train_loss: 0.9762, test_loss: 1.1035, test_f1: 0.3780
 epoch: 76, train_loss: 0.9654, test_loss: 1.0708, test_f1: 0.3802
 epoch: 77, train_loss: 0.9904, test_loss: 1.0756, test_f1: 0.3199
 epoch: 78, train_loss: 0.9802, test_loss: 1.0307, test_f1: 0.3923
 epoch: 79, train_loss: 0.9730, test_loss: 1.1831, test_f1: 0.3281
 epoch: 80, train_loss: 0.9649, test_loss: 1.0579, test_f1: 0.3857
 epoch: 81, train_loss: 0.9845, test_loss: 1.1316, test_f1: 0.3786
 epoch: 82, train_loss: 0.9757, test_loss: 1.1112, test_f1: 0.3378
 epoch: 83, train_loss: 0.9798, test_loss: 1.1981, test_f1: 0.3565
 epoch: 84, train_loss: 0.9591, test_loss: 1.0718, test_f1: 0.3701
 epoch: 85, train_loss: 0.9680, test_loss: 1.2108, test_f1: 0.3063
 epoch: 86, train_loss: 0.9830, test_loss: 1.1466, test_f1: 0.3416
 epoch: 87, train_loss: 0.9837, test_loss: 1.0471, test_f1: 0.3529
 epoch: 88, train_loss: 0.9669, test_loss: 1.1058, test_f1: 0.3461
 epoch: 89, train_loss: 0.9748, test_loss: 1.1342, test_f1: 0.3667
 epoch: 90, train_loss: 0.9785, test_loss: 1.0676, test_f1: 0.3396
 epoch: 91, train_loss: 0.9614, test_loss: 1.0503, test_f1: 0.3446
 epoch: 92, train_loss: 0.9690, test_loss: 1.1871, test_f1: 0.3316
 epoch: 93, train_loss: 0.9752, test_loss: 1.0691, test_f1: 0.3978
 epoch: 94, train_loss: 0.9755, test_loss: 1.1251, test_f1: 0.3517
 epoch: 95, train_loss: 0.9829, test_loss: 1.1018, test_f1: 0.3232
 epoch: 96, train_loss: 0.9798, test_loss: 1.1148, test_f1: 0.3308
 epoch: 97, train_loss: 0.9764, test_loss: 1.1186, test_f1: 0.3123
 epoch: 98, train_loss: 0.9806, test_loss: 1.2251, test_f1: 0.3112
 epoch: 99, train_loss: 0.9773, test_loss: 1.1364, test_f1: 0.3101
##################ITERATION #5 ****************************************
 epoch: 0, train_loss: 1.4506, test_loss: 3.7044, test_f1: 0.1236
 epoch: 1, train_loss: 1.2450, test_loss: 1.4588, test_f1: 0.2779
 epoch: 2, train_loss: 1.2091, test_loss: 1.1315, test_f1: 0.3609
 epoch: 3, train_loss: 1.1707, test_loss: 1.1027, test_f1: 0.3757
 epoch: 4, train_loss: 1.1359, test_loss: 1.1210, test_f1: 0.3801
 epoch: 5, train_loss: 1.1005, test_loss: 1.3594, test_f1: 0.3250
 epoch: 6, train_loss: 1.1411, test_loss: 1.2171, test_f1: 0.3712
 epoch: 7, train_loss: 1.1051, test_loss: 1.0691, test_f1: 0.3551
 epoch: 8, train_loss: 1.0932, test_loss: 1.1295, test_f1: 0.3958
 epoch: 9, train_loss: 1.0802, test_loss: 1.1764, test_f1: 0.3361
 epoch: 10, train_loss: 1.0735, test_loss: 1.1038, test_f1: 0.3545
 epoch: 11, train_loss: 1.0747, test_loss: 1.1192, test_f1: 0.3432
 epoch: 12, train_loss: 1.0684, test_loss: 1.0649, test_f1: 0.4149
 epoch: 13, train_loss: 1.0741, test_loss: 1.1245, test_f1: 0.3637
 epoch: 14, train_loss: 1.0735, test_loss: 1.1163, test_f1: 0.3786
 epoch: 15, train_loss: 1.0665, test_loss: 1.1119, test_f1: 0.3637
 epoch: 16, train_loss: 1.0699, test_loss: 1.0338, test_f1: 0.3873
 epoch: 17, train_loss: 1.0641, test_loss: 1.1029, test_f1: 0.3749
 epoch: 18, train_loss: 1.0491, test_loss: 1.1343, test_f1: 0.3864
 epoch: 19, train_loss: 1.0603, test_loss: 1.1474, test_f1: 0.3449
 epoch: 20, train_loss: 1.0769, test_loss: 1.1243, test_f1: 0.3595
 epoch: 21, train_loss: 1.0743, test_loss: 1.1593, test_f1: 0.3301
 epoch: 22, train_loss: 1.0706, test_loss: 1.0883, test_f1: 0.3926
 epoch: 23, train_loss: 1.0735, test_loss: 1.1546, test_f1: 0.3828
 epoch: 24, train_loss: 1.0714, test_loss: 1.0491, test_f1: 0.3766
 epoch: 25, train_loss: 1.0699, test_loss: 1.1196, test_f1: 0.3669
 epoch: 26, train_loss: 1.0577, test_loss: 1.0976, test_f1: 0.3864
 epoch: 27, train_loss: 1.0556, test_loss: 1.1253, test_f1: 0.3970
 epoch: 28, train_loss: 1.0682, test_loss: 1.1141, test_f1: 0.3875
 epoch: 29, train_loss: 1.0512, test_loss: 1.0592, test_f1: 0.3778
 epoch: 30, train_loss: 1.0519, test_loss: 1.1122, test_f1: 0.3413
 epoch: 31, train_loss: 1.0569, test_loss: 1.1031, test_f1: 0.3432
 epoch: 32, train_loss: 1.0432, test_loss: 1.0949, test_f1: 0.4001
 epoch: 33, train_loss: 1.0386, test_loss: 1.0960, test_f1: 0.3877
 epoch: 34, train_loss: 1.0465, test_loss: 1.1024, test_f1: 0.3471
 epoch: 35, train_loss: 1.0602, test_loss: 1.1044, test_f1: 0.3432
 epoch: 36, train_loss: 1.0455, test_loss: 1.1204, test_f1: 0.3432
 epoch: 37, train_loss: 1.0555, test_loss: 1.2341, test_f1: 0.2887
 epoch: 38, train_loss: 1.0750, test_loss: 1.0970, test_f1: 0.3422
 epoch: 39, train_loss: 1.0551, test_loss: 1.0708, test_f1: 0.3640
 epoch: 40, train_loss: 1.0733, test_loss: 1.0981, test_f1: 0.3477
 epoch: 41, train_loss: 1.0848, test_loss: 1.1369, test_f1: 0.3384
 epoch: 42, train_loss: 1.0644, test_loss: 1.0992, test_f1: 0.3451
 epoch: 43, train_loss: 1.0467, test_loss: 1.0683, test_f1: 0.3533
 epoch: 44, train_loss: 1.0608, test_loss: 1.0303, test_f1: 0.3513
 epoch: 45, train_loss: 1.0513, test_loss: 1.0864, test_f1: 0.3271
 epoch: 46, train_loss: 1.0740, test_loss: 1.1288, test_f1: 0.3813
 epoch: 47, train_loss: 1.0513, test_loss: 1.0999, test_f1: 0.3741
 epoch: 48, train_loss: 1.0507, test_loss: 1.1334, test_f1: 0.3405
 epoch: 49, train_loss: 1.0474, test_loss: 1.0384, test_f1: 0.3553
 epoch: 50, train_loss: 1.0431, test_loss: 1.1032, test_f1: 0.3877
 epoch: 51, train_loss: 1.0360, test_loss: 1.0947, test_f1: 0.3894
 epoch: 52, train_loss: 1.0193, test_loss: 1.0954, test_f1: 0.3862
 epoch: 53, train_loss: 1.0248, test_loss: 1.0843, test_f1: 0.3845
 epoch: 54, train_loss: 1.0239, test_loss: 1.0879, test_f1: 0.3900
 epoch: 55, train_loss: 1.0253, test_loss: 1.1095, test_f1: 0.3371
 epoch: 56, train_loss: 1.0223, test_loss: 1.0866, test_f1: 0.3506
 epoch: 57, train_loss: 1.0168, test_loss: 1.0855, test_f1: 0.3452
 epoch: 58, train_loss: 1.0216, test_loss: 1.0852, test_f1: 0.3473
 epoch: 59, train_loss: 1.0260, test_loss: 1.1058, test_f1: 0.3432
 epoch: 60, train_loss: 1.0161, test_loss: 1.1019, test_f1: 0.3460
 epoch: 61, train_loss: 1.0161, test_loss: 1.0396, test_f1: 0.3570
 epoch: 62, train_loss: 1.0158, test_loss: 1.0384, test_f1: 0.3819
 epoch: 63, train_loss: 1.0046, test_loss: 1.0803, test_f1: 0.3673
 epoch: 64, train_loss: 1.0091, test_loss: 1.0864, test_f1: 0.3443
 epoch: 65, train_loss: 1.0137, test_loss: 1.0765, test_f1: 0.3468
 epoch: 66, train_loss: 1.0619, test_loss: 1.0310, test_f1: 0.3692
 epoch: 67, train_loss: 1.0366, test_loss: 1.0813, test_f1: 0.3631
 epoch: 68, train_loss: 1.0217, test_loss: 1.0562, test_f1: 0.3531
 epoch: 69, train_loss: 1.0396, test_loss: 1.0197, test_f1: 0.3720
 epoch: 70, train_loss: 1.0238, test_loss: 1.0373, test_f1: 0.3724
 epoch: 71, train_loss: 1.0273, test_loss: 1.0888, test_f1: 0.3626
 epoch: 72, train_loss: 1.0278, test_loss: 1.0895, test_f1: 0.3567
 epoch: 73, train_loss: 1.0263, test_loss: 1.0714, test_f1: 0.4004
 epoch: 74, train_loss: 1.0191, test_loss: 1.0177, test_f1: 0.4026
 epoch: 75, train_loss: 1.0226, test_loss: 1.0869, test_f1: 0.3684
 epoch: 76, train_loss: 1.0146, test_loss: 1.0795, test_f1: 0.3675
 epoch: 77, train_loss: 1.0065, test_loss: 1.0748, test_f1: 0.3887
 epoch: 78, train_loss: 1.0108, test_loss: 1.0853, test_f1: 0.3902
 epoch: 79, train_loss: 1.0091, test_loss: 1.0033, test_f1: 0.4020
 epoch: 80, train_loss: 1.0302, test_loss: 1.0957, test_f1: 0.3866
 epoch: 81, train_loss: 1.0206, test_loss: 1.0769, test_f1: 0.3588
 epoch: 82, train_loss: 1.0132, test_loss: 1.0767, test_f1: 0.3931
 epoch: 83, train_loss: 1.0074, test_loss: 1.0215, test_f1: 0.4181
 epoch: 84, train_loss: 1.0098, test_loss: 1.0183, test_f1: 0.3572
 epoch: 85, train_loss: 1.0172, test_loss: 1.0876, test_f1: 0.3497
 epoch: 86, train_loss: 1.0126, test_loss: 1.0840, test_f1: 0.3449
 epoch: 87, train_loss: 1.0060, test_loss: 1.0863, test_f1: 0.3494
 epoch: 88, train_loss: 1.0250, test_loss: 1.1082, test_f1: 0.3485
 epoch: 89, train_loss: 1.0142, test_loss: 1.5425, test_f1: 0.2506
 epoch: 90, train_loss: 1.0231, test_loss: 1.0799, test_f1: 0.3479
 epoch: 91, train_loss: 1.0136, test_loss: 1.0668, test_f1: 0.3458
 epoch: 92, train_loss: 1.0190, test_loss: 1.0325, test_f1: 0.3851
 epoch: 93, train_loss: 1.0155, test_loss: 1.0105, test_f1: 0.3847
 epoch: 94, train_loss: 1.0148, test_loss: 1.0901, test_f1: 0.3432
 epoch: 95, train_loss: 1.0152, test_loss: 1.0732, test_f1: 0.3484
 epoch: 96, train_loss: 1.0187, test_loss: 1.0936, test_f1: 0.3437
 epoch: 97, train_loss: 1.0311, test_loss: 1.0467, test_f1: 0.3722
 epoch: 98, train_loss: 1.0258, test_loss: 1.0656, test_f1: 0.3428
 epoch: 99, train_loss: 1.0119, test_loss: 1.0772, test_f1: 0.3492
##################ITERATION #6 ****************************************
 epoch: 0, train_loss: 1.3452, test_loss: 1.3212, test_f1: 0.2270
 epoch: 1, train_loss: 1.2902, test_loss: 1.2950, test_f1: 0.2270
 epoch: 2, train_loss: 1.2551, test_loss: 1.2304, test_f1: 0.2344
 epoch: 3, train_loss: 1.2097, test_loss: 1.1143, test_f1: 0.3237
 epoch: 4, train_loss: 1.1489, test_loss: 1.2329, test_f1: 0.3064
 epoch: 5, train_loss: 1.1316, test_loss: 1.1740, test_f1: 0.3317
 epoch: 6, train_loss: 1.1175, test_loss: 1.1299, test_f1: 0.3422
 epoch: 7, train_loss: 1.1035, test_loss: 1.1348, test_f1: 0.3479
 epoch: 8, train_loss: 1.0981, test_loss: 1.1382, test_f1: 0.3421
 epoch: 9, train_loss: 1.0869, test_loss: 1.0813, test_f1: 0.3536
 epoch: 10, train_loss: 1.1006, test_loss: 1.1163, test_f1: 0.3871
 epoch: 11, train_loss: 1.0925, test_loss: 1.1187, test_f1: 0.3469
 epoch: 12, train_loss: 1.0973, test_loss: 1.2849, test_f1: 0.2930
 epoch: 13, train_loss: 1.1036, test_loss: 1.0991, test_f1: 0.3605
 epoch: 14, train_loss: 1.0940, test_loss: 1.0525, test_f1: 0.3613
 epoch: 15, train_loss: 1.0948, test_loss: 1.1232, test_f1: 0.3510
 epoch: 16, train_loss: 1.0839, test_loss: 1.1128, test_f1: 0.3434
 epoch: 17, train_loss: 1.0813, test_loss: 1.1336, test_f1: 0.3399
 epoch: 18, train_loss: 1.0644, test_loss: 1.1204, test_f1: 0.3515
 epoch: 19, train_loss: 1.0607, test_loss: 1.1196, test_f1: 0.3494
 epoch: 20, train_loss: 1.0767, test_loss: 1.1089, test_f1: 0.3432
 epoch: 21, train_loss: 1.0731, test_loss: 1.1094, test_f1: 0.3468
 epoch: 22, train_loss: 1.0744, test_loss: 1.0761, test_f1: 0.3585
 epoch: 23, train_loss: 1.0702, test_loss: 1.1153, test_f1: 0.3730
 epoch: 24, train_loss: 1.0588, test_loss: 1.1625, test_f1: 0.3271
 epoch: 25, train_loss: 1.0694, test_loss: 1.1261, test_f1: 0.3450
 epoch: 26, train_loss: 1.0743, test_loss: 1.1168, test_f1: 0.3514
 epoch: 27, train_loss: 1.0790, test_loss: 1.0890, test_f1: 0.3801
 epoch: 28, train_loss: 1.0507, test_loss: 1.0488, test_f1: 0.3830
 epoch: 29, train_loss: 1.0623, test_loss: 1.1187, test_f1: 0.3460
 epoch: 30, train_loss: 1.0649, test_loss: 1.3390, test_f1: 0.3087
 epoch: 31, train_loss: 1.0645, test_loss: 1.2550, test_f1: 0.3189
 epoch: 32, train_loss: 1.0560, test_loss: 1.1307, test_f1: 0.3403
 epoch: 33, train_loss: 1.0635, test_loss: 1.1275, test_f1: 0.3890
 epoch: 34, train_loss: 1.0689, test_loss: 1.0781, test_f1: 0.3422
 epoch: 35, train_loss: 1.0593, test_loss: 1.1098, test_f1: 0.3890
 epoch: 36, train_loss: 1.0510, test_loss: 1.1310, test_f1: 0.3472
 epoch: 37, train_loss: 1.0614, test_loss: 1.1364, test_f1: 0.3472
 epoch: 38, train_loss: 1.0504, test_loss: 1.1360, test_f1: 0.3420
 epoch: 39, train_loss: 1.0455, test_loss: 1.1154, test_f1: 0.3445
 epoch: 40, train_loss: 1.0599, test_loss: 1.0325, test_f1: 0.3593
 epoch: 41, train_loss: 1.0707, test_loss: 1.1293, test_f1: 0.3677
 epoch: 42, train_loss: 1.0584, test_loss: 1.0582, test_f1: 0.3627
 epoch: 43, train_loss: 1.0487, test_loss: 1.0910, test_f1: 0.3476
 epoch: 44, train_loss: 1.0601, test_loss: 1.1179, test_f1: 0.3517
 epoch: 45, train_loss: 1.0635, test_loss: 1.1263, test_f1: 0.3880
 epoch: 46, train_loss: 1.0478, test_loss: 1.1215, test_f1: 0.3351
 epoch: 47, train_loss: 1.0592, test_loss: 1.1247, test_f1: 0.3469
 epoch: 48, train_loss: 1.0584, test_loss: 1.1005, test_f1: 0.3515
 epoch: 49, train_loss: 1.0487, test_loss: 1.1130, test_f1: 0.3443
 epoch: 50, train_loss: 1.0756, test_loss: 1.1508, test_f1: 0.3691
 epoch: 51, train_loss: 1.0526, test_loss: 1.1428, test_f1: 0.3448
 epoch: 52, train_loss: 1.0521, test_loss: 1.1036, test_f1: 0.4005
 epoch: 53, train_loss: 1.0361, test_loss: 1.0989, test_f1: 0.3524
 epoch: 54, train_loss: 1.0359, test_loss: 1.1027, test_f1: 0.3495
 epoch: 55, train_loss: 1.0321, test_loss: 1.1223, test_f1: 0.3403
 epoch: 56, train_loss: 1.0290, test_loss: 1.1200, test_f1: 0.3366
 epoch: 57, train_loss: 1.0162, test_loss: 1.1127, test_f1: 0.3600
 epoch: 58, train_loss: 1.0260, test_loss: 1.1151, test_f1: 0.3535
 epoch: 59, train_loss: 1.0163, test_loss: 1.1304, test_f1: 0.3449
 epoch: 60, train_loss: 1.0214, test_loss: 1.1181, test_f1: 0.3862
 epoch: 61, train_loss: 1.0187, test_loss: 1.1178, test_f1: 0.3483
 epoch: 62, train_loss: 1.0096, test_loss: 1.1096, test_f1: 0.3556
 epoch: 63, train_loss: 1.0136, test_loss: 1.1172, test_f1: 0.3466
 epoch: 64, train_loss: 1.0152, test_loss: 1.1102, test_f1: 0.3912
 epoch: 65, train_loss: 1.0145, test_loss: 1.0750, test_f1: 0.3980
 epoch: 66, train_loss: 1.0123, test_loss: 1.1118, test_f1: 0.3938
 epoch: 67, train_loss: 1.0168, test_loss: 1.1104, test_f1: 0.3893
 epoch: 68, train_loss: 1.0193, test_loss: 1.1166, test_f1: 0.3542
 epoch: 69, train_loss: 1.0138, test_loss: 1.1050, test_f1: 0.3480
 epoch: 70, train_loss: 1.0022, test_loss: 1.1134, test_f1: 0.3940
 epoch: 71, train_loss: 1.0026, test_loss: 1.1239, test_f1: 0.3504
 epoch: 72, train_loss: 1.0069, test_loss: 1.0674, test_f1: 0.3735
 epoch: 73, train_loss: 1.0021, test_loss: 1.1066, test_f1: 0.3456
 epoch: 74, train_loss: 1.0103, test_loss: 1.1199, test_f1: 0.3458
 epoch: 75, train_loss: 1.0192, test_loss: 1.1113, test_f1: 0.3678
 epoch: 76, train_loss: 1.0132, test_loss: 1.1130, test_f1: 0.4063
 epoch: 77, train_loss: 1.0229, test_loss: 1.1772, test_f1: 0.4024
 epoch: 78, train_loss: 1.0130, test_loss: 1.1149, test_f1: 0.3887
 epoch: 79, train_loss: 1.0040, test_loss: 1.1346, test_f1: 0.3463
 epoch: 80, train_loss: 1.0096, test_loss: 1.1297, test_f1: 0.3636
 epoch: 81, train_loss: 1.0122, test_loss: 1.2167, test_f1: 0.3277
 epoch: 82, train_loss: 1.0277, test_loss: 1.0084, test_f1: 0.4144
 epoch: 83, train_loss: 1.0101, test_loss: 1.0679, test_f1: 0.3424
 epoch: 84, train_loss: 1.0076, test_loss: 1.1132, test_f1: 0.3439
 epoch: 85, train_loss: 1.0098, test_loss: 1.1186, test_f1: 0.3463
 epoch: 86, train_loss: 1.0040, test_loss: 1.1111, test_f1: 0.3934
 epoch: 87, train_loss: 0.9924, test_loss: 1.1053, test_f1: 0.3518
 epoch: 88, train_loss: 1.0088, test_loss: 1.1460, test_f1: 0.3615
 epoch: 89, train_loss: 1.0213, test_loss: 1.0609, test_f1: 0.3655
 epoch: 90, train_loss: 1.0071, test_loss: 1.1216, test_f1: 0.3436
 epoch: 91, train_loss: 1.0092, test_loss: 1.0515, test_f1: 0.3816
 epoch: 92, train_loss: 0.9969, test_loss: 1.1116, test_f1: 0.4094
 epoch: 93, train_loss: 1.0068, test_loss: 1.1254, test_f1: 0.3852
 epoch: 94, train_loss: 1.0027, test_loss: 1.0786, test_f1: 0.3781
 epoch: 95, train_loss: 1.0117, test_loss: 1.0321, test_f1: 0.3893
 epoch: 96, train_loss: 1.0067, test_loss: 1.1286, test_f1: 0.3532
 epoch: 97, train_loss: 1.0089, test_loss: 1.1272, test_f1: 0.3575
 epoch: 98, train_loss: 1.0077, test_loss: 1.1412, test_f1: 0.3796
 epoch: 99, train_loss: 1.0085, test_loss: 1.1043, test_f1: 0.3549
##################ITERATION #7 ****************************************
 epoch: 0, train_loss: 1.4101, test_loss: 1.3912, test_f1: 0.2795
 epoch: 1, train_loss: 1.2432, test_loss: 1.2267, test_f1: 0.2628
 epoch: 2, train_loss: 1.1746, test_loss: 1.0797, test_f1: 0.3563
 epoch: 3, train_loss: 1.1300, test_loss: 1.0793, test_f1: 0.3884
 epoch: 4, train_loss: 1.1473, test_loss: 1.0825, test_f1: 0.3653
 epoch: 5, train_loss: 1.1064, test_loss: 1.1284, test_f1: 0.3662
 epoch: 6, train_loss: 1.0771, test_loss: 1.1275, test_f1: 0.3714
 epoch: 7, train_loss: 1.0691, test_loss: 1.1332, test_f1: 0.3549
 epoch: 8, train_loss: 1.0701, test_loss: 1.1462, test_f1: 0.3571
 epoch: 9, train_loss: 1.0713, test_loss: 1.1610, test_f1: 0.3396
 epoch: 10, train_loss: 1.0612, test_loss: 1.0908, test_f1: 0.3413
 epoch: 11, train_loss: 1.0683, test_loss: 1.1407, test_f1: 0.3432
 epoch: 12, train_loss: 1.0529, test_loss: 1.1274, test_f1: 0.3487
 epoch: 13, train_loss: 1.0570, test_loss: 1.1188, test_f1: 0.3482
 epoch: 14, train_loss: 1.0608, test_loss: 1.1555, test_f1: 0.3499
 epoch: 15, train_loss: 1.0570, test_loss: 1.2441, test_f1: 0.3325
 epoch: 16, train_loss: 1.0455, test_loss: 1.1324, test_f1: 0.3559
 epoch: 17, train_loss: 1.0447, test_loss: 1.1528, test_f1: 0.3499
 epoch: 18, train_loss: 1.0474, test_loss: 1.1316, test_f1: 0.4081
 epoch: 19, train_loss: 1.0451, test_loss: 1.1481, test_f1: 0.3459
 epoch: 20, train_loss: 1.0417, test_loss: 1.1268, test_f1: 0.3455
 epoch: 21, train_loss: 1.0476, test_loss: 1.2359, test_f1: 0.3315
 epoch: 22, train_loss: 1.0427, test_loss: 1.1351, test_f1: 0.3422
 epoch: 23, train_loss: 1.0482, test_loss: 1.3107, test_f1: 0.3110
 epoch: 24, train_loss: 1.0671, test_loss: 1.2814, test_f1: 0.3298
 epoch: 25, train_loss: 1.0674, test_loss: 1.1545, test_f1: 0.3492
 epoch: 26, train_loss: 1.0587, test_loss: 1.1142, test_f1: 0.3796
 epoch: 27, train_loss: 1.0613, test_loss: 1.2933, test_f1: 0.3210
 epoch: 28, train_loss: 1.0589, test_loss: 1.1287, test_f1: 0.3510
 epoch: 29, train_loss: 1.0460, test_loss: 1.1221, test_f1: 0.3908
 epoch: 30, train_loss: 1.0443, test_loss: 1.1395, test_f1: 0.3258
 epoch: 31, train_loss: 1.0502, test_loss: 1.0681, test_f1: 0.3432
 epoch: 32, train_loss: 1.0599, test_loss: 1.0771, test_f1: 0.3407
 epoch: 33, train_loss: 1.0480, test_loss: 1.1239, test_f1: 0.3556
 epoch: 34, train_loss: 1.0468, test_loss: 1.0094, test_f1: 0.3599
 epoch: 35, train_loss: 1.0484, test_loss: 1.1375, test_f1: 0.3359
 epoch: 36, train_loss: 1.0308, test_loss: 1.1046, test_f1: 0.3504
 epoch: 37, train_loss: 1.0175, test_loss: 1.1159, test_f1: 0.3942
 epoch: 38, train_loss: 1.0432, test_loss: 1.1115, test_f1: 0.3856
 epoch: 39, train_loss: 1.0421, test_loss: 1.1331, test_f1: 0.3432
 epoch: 40, train_loss: 1.0260, test_loss: 1.1035, test_f1: 0.3594
 epoch: 41, train_loss: 1.0334, test_loss: 1.5563, test_f1: 0.3478
 epoch: 42, train_loss: 1.0570, test_loss: 1.1403, test_f1: 0.3379
 epoch: 43, train_loss: 1.0565, test_loss: 1.0276, test_f1: 0.3580
 epoch: 44, train_loss: 1.0483, test_loss: 1.0293, test_f1: 0.4043
 epoch: 45, train_loss: 1.0422, test_loss: 1.0664, test_f1: 0.3555
 epoch: 46, train_loss: 1.0398, test_loss: 1.0397, test_f1: 0.3576
 epoch: 47, train_loss: 1.0441, test_loss: 1.0748, test_f1: 0.3780
 epoch: 48, train_loss: 1.0365, test_loss: 1.0440, test_f1: 0.4163
 epoch: 49, train_loss: 1.0384, test_loss: 1.1542, test_f1: 0.3494
 epoch: 50, train_loss: 1.0278, test_loss: 1.0452, test_f1: 0.3685
 epoch: 51, train_loss: 1.0187, test_loss: 1.1162, test_f1: 0.3543
 epoch: 52, train_loss: 1.0188, test_loss: 1.1102, test_f1: 0.3566
 epoch: 53, train_loss: 1.0245, test_loss: 1.1249, test_f1: 0.3477
 epoch: 54, train_loss: 1.0108, test_loss: 1.0934, test_f1: 0.3564
 epoch: 55, train_loss: 1.0087, test_loss: 1.1115, test_f1: 0.3445
 epoch: 56, train_loss: 1.0114, test_loss: 1.1109, test_f1: 0.3413
 epoch: 57, train_loss: 1.0134, test_loss: 1.1294, test_f1: 0.3879
 epoch: 58, train_loss: 1.0129, test_loss: 1.1360, test_f1: 0.3844
 epoch: 59, train_loss: 1.0091, test_loss: 1.1085, test_f1: 0.3538
 epoch: 60, train_loss: 1.0184, test_loss: 1.1074, test_f1: 0.3869
 epoch: 61, train_loss: 1.0180, test_loss: 1.1080, test_f1: 0.3773
 epoch: 62, train_loss: 1.0146, test_loss: 1.1403, test_f1: 0.3872
 epoch: 63, train_loss: 1.0147, test_loss: 1.1069, test_f1: 0.3578
 epoch: 64, train_loss: 1.0008, test_loss: 1.0977, test_f1: 0.3838
 epoch: 65, train_loss: 1.0015, test_loss: 1.1259, test_f1: 0.3923
 epoch: 66, train_loss: 0.9992, test_loss: 1.1085, test_f1: 0.3616
 epoch: 67, train_loss: 1.0007, test_loss: 1.1031, test_f1: 0.3429
 epoch: 68, train_loss: 1.0086, test_loss: 1.1228, test_f1: 0.3425
 epoch: 69, train_loss: 1.0347, test_loss: 1.1313, test_f1: 0.3945
 epoch: 70, train_loss: 1.0095, test_loss: 1.1157, test_f1: 0.3839
 epoch: 71, train_loss: 1.0046, test_loss: 1.1174, test_f1: 0.3868
 epoch: 72, train_loss: 1.0044, test_loss: 1.0672, test_f1: 0.3686
 epoch: 73, train_loss: 1.0038, test_loss: 1.1011, test_f1: 0.3491
 epoch: 74, train_loss: 1.0012, test_loss: 1.1011, test_f1: 0.3435
 epoch: 75, train_loss: 0.9996, test_loss: 1.0986, test_f1: 0.3787
 epoch: 76, train_loss: 0.9945, test_loss: 1.1060, test_f1: 0.3837
 epoch: 77, train_loss: 0.9925, test_loss: 1.1115, test_f1: 0.3674
 epoch: 78, train_loss: 0.9891, test_loss: 1.1240, test_f1: 0.3701
 epoch: 79, train_loss: 0.9978, test_loss: 1.1105, test_f1: 0.3441
 epoch: 80, train_loss: 0.9957, test_loss: 1.1074, test_f1: 0.4063
 epoch: 81, train_loss: 0.9889, test_loss: 1.1325, test_f1: 0.3425
 epoch: 82, train_loss: 0.9981, test_loss: 1.1253, test_f1: 0.3471
 epoch: 83, train_loss: 0.9839, test_loss: 1.1358, test_f1: 0.4070
 epoch: 84, train_loss: 0.9838, test_loss: 1.1261, test_f1: 0.4087
 epoch: 85, train_loss: 0.9825, test_loss: 1.1295, test_f1: 0.3983
 epoch: 86, train_loss: 0.9952, test_loss: 1.1134, test_f1: 0.4873
 epoch: 87, train_loss: 0.9955, test_loss: 1.1320, test_f1: 0.3395
 epoch: 88, train_loss: 0.9759, test_loss: 1.1727, test_f1: 0.3712
 epoch: 89, train_loss: 0.9844, test_loss: 1.1272, test_f1: 0.4163
 epoch: 90, train_loss: 0.9835, test_loss: 1.1344, test_f1: 0.3846
 epoch: 91, train_loss: 0.9767, test_loss: 1.1066, test_f1: 0.3581
 epoch: 92, train_loss: 0.9737, test_loss: 1.1421, test_f1: 0.4118
 epoch: 93, train_loss: 0.9772, test_loss: 1.1455, test_f1: 0.3829
 epoch: 94, train_loss: 0.9767, test_loss: 1.1681, test_f1: 0.3534
 epoch: 95, train_loss: 0.9726, test_loss: 1.1339, test_f1: 0.3913
 epoch: 96, train_loss: 0.9727, test_loss: 1.1268, test_f1: 0.3803
 epoch: 97, train_loss: 0.9749, test_loss: 1.1094, test_f1: 0.4685
 epoch: 98, train_loss: 0.9865, test_loss: 1.1495, test_f1: 0.3810
 epoch: 99, train_loss: 0.9837, test_loss: 1.1217, test_f1: 0.3758
##################ITERATION #8 ****************************************
 epoch: 0, train_loss: 1.4727, test_loss: 1.3422, test_f1: 0.2270
 epoch: 1, train_loss: 1.2712, test_loss: 1.2804, test_f1: 0.2270
 epoch: 2, train_loss: 1.2327, test_loss: 1.2902, test_f1: 0.2423
 epoch: 3, train_loss: 1.1762, test_loss: 1.3607, test_f1: 0.2836
 epoch: 4, train_loss: 1.1152, test_loss: 1.2701, test_f1: 0.2690
 epoch: 5, train_loss: 1.1125, test_loss: 1.1313, test_f1: 0.3413
 epoch: 6, train_loss: 1.0980, test_loss: 1.2380, test_f1: 0.3315
 epoch: 7, train_loss: 1.0897, test_loss: 1.0551, test_f1: 0.3616
 epoch: 8, train_loss: 1.0907, test_loss: 1.1722, test_f1: 0.3403
 epoch: 9, train_loss: 1.0830, test_loss: 1.1367, test_f1: 0.3432
 epoch: 10, train_loss: 1.0775, test_loss: 1.0474, test_f1: 0.3476
 epoch: 11, train_loss: 1.0771, test_loss: 1.0858, test_f1: 0.3908
 epoch: 12, train_loss: 1.0854, test_loss: 1.1237, test_f1: 0.3579
 epoch: 13, train_loss: 1.0867, test_loss: 1.0552, test_f1: 0.3553
 epoch: 14, train_loss: 1.0762, test_loss: 1.0928, test_f1: 0.3750
 epoch: 15, train_loss: 1.0694, test_loss: 1.0631, test_f1: 0.3924
 epoch: 16, train_loss: 1.0664, test_loss: 1.1586, test_f1: 0.3719
 epoch: 17, train_loss: 1.0549, test_loss: 1.1424, test_f1: 0.3682
 epoch: 18, train_loss: 1.0560, test_loss: 1.1354, test_f1: 0.3516
 epoch: 19, train_loss: 1.0612, test_loss: 1.1120, test_f1: 0.3897
 epoch: 20, train_loss: 1.0593, test_loss: 1.0415, test_f1: 0.3652
 epoch: 21, train_loss: 1.0448, test_loss: 1.1147, test_f1: 0.3480
 epoch: 22, train_loss: 1.0505, test_loss: 1.1218, test_f1: 0.3490
 epoch: 23, train_loss: 1.0423, test_loss: 1.0246, test_f1: 0.3573
 epoch: 24, train_loss: 1.0444, test_loss: 1.1270, test_f1: 0.3472
 epoch: 25, train_loss: 1.0342, test_loss: 1.1281, test_f1: 0.3550
 epoch: 26, train_loss: 1.0649, test_loss: 1.1860, test_f1: 0.4008
 epoch: 27, train_loss: 1.0591, test_loss: 1.1440, test_f1: 0.3738
 epoch: 28, train_loss: 1.0451, test_loss: 1.0777, test_f1: 0.3847
 epoch: 29, train_loss: 1.0529, test_loss: 1.1327, test_f1: 0.3889
 epoch: 30, train_loss: 1.0417, test_loss: 1.1261, test_f1: 0.3523
 epoch: 31, train_loss: 1.0380, test_loss: 1.1809, test_f1: 0.3548
 epoch: 32, train_loss: 1.0551, test_loss: 1.1364, test_f1: 0.3415
 epoch: 33, train_loss: 1.0517, test_loss: 1.0650, test_f1: 0.3449
 epoch: 34, train_loss: 1.0327, test_loss: 1.1165, test_f1: 0.3616
 epoch: 35, train_loss: 1.0367, test_loss: 1.0875, test_f1: 0.3926
 epoch: 36, train_loss: 1.0463, test_loss: 1.1044, test_f1: 0.3828
 epoch: 37, train_loss: 1.0198, test_loss: 1.1111, test_f1: 0.3608
 epoch: 38, train_loss: 1.0331, test_loss: 1.1717, test_f1: 0.4004
 epoch: 39, train_loss: 1.0382, test_loss: 1.1091, test_f1: 0.4193
 epoch: 40, train_loss: 1.0413, test_loss: 1.0430, test_f1: 0.3639
 epoch: 41, train_loss: 1.0474, test_loss: 1.0613, test_f1: 0.3641
 epoch: 42, train_loss: 1.0312, test_loss: 1.1338, test_f1: 0.3505
 epoch: 43, train_loss: 1.0400, test_loss: 1.1361, test_f1: 0.3448
 epoch: 44, train_loss: 1.0253, test_loss: 1.1203, test_f1: 0.3429
 epoch: 45, train_loss: 1.0177, test_loss: 1.1290, test_f1: 0.3460
 epoch: 46, train_loss: 1.0377, test_loss: 1.1940, test_f1: 0.3326
 epoch: 47, train_loss: 1.0414, test_loss: 1.0516, test_f1: 0.3507
 epoch: 48, train_loss: 1.0532, test_loss: 1.0428, test_f1: 0.3658
 epoch: 49, train_loss: 1.0314, test_loss: 1.0946, test_f1: 0.3425
 epoch: 50, train_loss: 1.0285, test_loss: 1.1068, test_f1: 0.3844
 epoch: 51, train_loss: 1.0138, test_loss: 1.1088, test_f1: 0.3477
 epoch: 52, train_loss: 1.0130, test_loss: 1.1069, test_f1: 0.3704
 epoch: 53, train_loss: 1.0120, test_loss: 1.1057, test_f1: 0.3603
 epoch: 54, train_loss: 1.0065, test_loss: 1.1058, test_f1: 0.3816
 epoch: 55, train_loss: 1.0083, test_loss: 1.0859, test_f1: 0.3633
 epoch: 56, train_loss: 0.9994, test_loss: 1.0888, test_f1: 0.3666
 epoch: 57, train_loss: 0.9958, test_loss: 1.0854, test_f1: 0.3624
 epoch: 58, train_loss: 0.9913, test_loss: 1.0815, test_f1: 0.3631
 epoch: 59, train_loss: 1.0079, test_loss: 1.1255, test_f1: 0.3594
 epoch: 60, train_loss: 1.0176, test_loss: 1.1028, test_f1: 0.3558
 epoch: 61, train_loss: 1.0018, test_loss: 1.0926, test_f1: 0.3793
 epoch: 62, train_loss: 0.9960, test_loss: 1.0914, test_f1: 0.3837
 epoch: 63, train_loss: 0.9978, test_loss: 1.0846, test_f1: 0.3854
 epoch: 64, train_loss: 1.0011, test_loss: 1.0782, test_f1: 0.3685
 epoch: 65, train_loss: 0.9888, test_loss: 1.0806, test_f1: 0.3553
 epoch: 66, train_loss: 0.9942, test_loss: 1.0894, test_f1: 0.3651
 epoch: 67, train_loss: 0.9942, test_loss: 1.1021, test_f1: 0.3921
 epoch: 68, train_loss: 0.9899, test_loss: 1.0908, test_f1: 0.4051
 epoch: 69, train_loss: 0.9935, test_loss: 1.0814, test_f1: 0.3493
 epoch: 70, train_loss: 0.9968, test_loss: 1.0757, test_f1: 0.4093
 epoch: 71, train_loss: 0.9859, test_loss: 1.0938, test_f1: 0.4002
 epoch: 72, train_loss: 0.9850, test_loss: 1.0762, test_f1: 0.3793
 epoch: 73, train_loss: 0.9907, test_loss: 1.0974, test_f1: 0.3510
 epoch: 74, train_loss: 0.9899, test_loss: 1.1139, test_f1: 0.3577
 epoch: 75, train_loss: 0.9892, test_loss: 1.1013, test_f1: 0.3867
 epoch: 76, train_loss: 0.9916, test_loss: 1.0845, test_f1: 0.3789
 epoch: 77, train_loss: 0.9891, test_loss: 1.0830, test_f1: 0.3675
 epoch: 78, train_loss: 0.9796, test_loss: 1.0869, test_f1: 0.3605
 epoch: 79, train_loss: 0.9784, test_loss: 1.0909, test_f1: 0.3995
 epoch: 80, train_loss: 0.9810, test_loss: 1.0828, test_f1: 0.3989
 epoch: 81, train_loss: 0.9759, test_loss: 1.0739, test_f1: 0.3812
 epoch: 82, train_loss: 0.9846, test_loss: 1.0863, test_f1: 0.3497
 epoch: 83, train_loss: 0.9870, test_loss: 1.1030, test_f1: 0.3733
 epoch: 84, train_loss: 0.9910, test_loss: 1.2202, test_f1: 0.4249
 epoch: 85, train_loss: 0.9963, test_loss: 1.1039, test_f1: 0.3839
 epoch: 86, train_loss: 0.9797, test_loss: 1.0947, test_f1: 0.3819
 epoch: 87, train_loss: 0.9783, test_loss: 1.0750, test_f1: 0.3548
 epoch: 88, train_loss: 0.9798, test_loss: 1.0741, test_f1: 0.3884
 epoch: 89, train_loss: 0.9750, test_loss: 1.0892, test_f1: 0.3723
 epoch: 90, train_loss: 0.9786, test_loss: 1.1056, test_f1: 0.4002
 epoch: 91, train_loss: 0.9749, test_loss: 1.0954, test_f1: 0.3810
 epoch: 92, train_loss: 0.9747, test_loss: 1.1224, test_f1: 0.3647
 epoch: 93, train_loss: 0.9844, test_loss: 1.0848, test_f1: 0.4241
 epoch: 94, train_loss: 0.9867, test_loss: 1.0900, test_f1: 0.3510
 epoch: 95, train_loss: 0.9723, test_loss: 1.1007, test_f1: 0.3962
 epoch: 96, train_loss: 0.9751, test_loss: 1.0967, test_f1: 0.3578
 epoch: 97, train_loss: 0.9657, test_loss: 1.1003, test_f1: 0.3684
 epoch: 98, train_loss: 0.9775, test_loss: 1.1166, test_f1: 0.3698
 epoch: 99, train_loss: 0.9771, test_loss: 1.0970, test_f1: 0.3928
##################ITERATION #9 ****************************************
 epoch: 0, train_loss: 1.4517, test_loss: 3.1551, test_f1: 0.2791
 epoch: 1, train_loss: 1.1649, test_loss: 1.4208, test_f1: 0.2967
 epoch: 2, train_loss: 1.1474, test_loss: 1.1599, test_f1: 0.3565
 epoch: 3, train_loss: 1.1095, test_loss: 1.0997, test_f1: 0.3940
 epoch: 4, train_loss: 1.0833, test_loss: 1.0815, test_f1: 0.3559
 epoch: 5, train_loss: 1.0955, test_loss: 1.1662, test_f1: 0.3047
 epoch: 6, train_loss: 1.0976, test_loss: 1.0689, test_f1: 0.3533
 epoch: 7, train_loss: 1.0864, test_loss: 1.0601, test_f1: 0.3757
 epoch: 8, train_loss: 1.0766, test_loss: 1.0688, test_f1: 0.3560
 epoch: 9, train_loss: 1.0732, test_loss: 1.1064, test_f1: 0.3416
 epoch: 10, train_loss: 1.0596, test_loss: 1.0888, test_f1: 0.3451
 epoch: 11, train_loss: 1.0479, test_loss: 1.0492, test_f1: 0.3427
 epoch: 12, train_loss: 1.0544, test_loss: 1.0482, test_f1: 0.3422
 epoch: 13, train_loss: 1.0389, test_loss: 1.0588, test_f1: 0.3411
 epoch: 14, train_loss: 1.0369, test_loss: 1.1455, test_f1: 0.3716
 epoch: 15, train_loss: 1.0468, test_loss: 1.0557, test_f1: 0.3393
 epoch: 16, train_loss: 1.0357, test_loss: 1.0999, test_f1: 0.3413
 epoch: 17, train_loss: 1.0410, test_loss: 1.1758, test_f1: 0.3760
 epoch: 18, train_loss: 1.0495, test_loss: 1.1025, test_f1: 0.3366
 epoch: 19, train_loss: 1.0652, test_loss: 1.0901, test_f1: 0.3483
 epoch: 20, train_loss: 1.0519, test_loss: 1.0758, test_f1: 0.3417
 epoch: 21, train_loss: 1.0466, test_loss: 1.1307, test_f1: 0.3730
 epoch: 22, train_loss: 1.0520, test_loss: 1.7353, test_f1: 0.3049
 epoch: 23, train_loss: 1.0544, test_loss: 1.0724, test_f1: 0.3847
 epoch: 24, train_loss: 1.0469, test_loss: 1.0407, test_f1: 0.3726
 epoch: 25, train_loss: 1.0298, test_loss: 1.0421, test_f1: 0.3448
 epoch: 26, train_loss: 1.0414, test_loss: 1.0568, test_f1: 0.3451
 epoch: 27, train_loss: 1.0284, test_loss: 1.0612, test_f1: 0.3487
 epoch: 28, train_loss: 1.0432, test_loss: 1.0334, test_f1: 0.3585
 epoch: 29, train_loss: 1.0228, test_loss: 1.0954, test_f1: 0.3422
 epoch: 30, train_loss: 1.0438, test_loss: 1.0582, test_f1: 0.3987
 epoch: 31, train_loss: 1.0493, test_loss: 1.1027, test_f1: 0.3463
 epoch: 32, train_loss: 1.0392, test_loss: 1.0873, test_f1: 0.3600
 epoch: 33, train_loss: 1.0333, test_loss: 1.0765, test_f1: 0.3964
 epoch: 34, train_loss: 1.0282, test_loss: 1.0033, test_f1: 0.3638
 epoch: 35, train_loss: 1.0189, test_loss: 1.0764, test_f1: 0.4404
 epoch: 36, train_loss: 1.0253, test_loss: 1.0840, test_f1: 0.3413
 epoch: 37, train_loss: 1.0214, test_loss: 1.0461, test_f1: 0.3991
 epoch: 38, train_loss: 1.0108, test_loss: 1.0682, test_f1: 0.3447
 epoch: 39, train_loss: 1.0073, test_loss: 1.0087, test_f1: 0.3572
 epoch: 40, train_loss: 1.0194, test_loss: 1.0608, test_f1: 0.3455
 epoch: 41, train_loss: 1.0104, test_loss: 1.0244, test_f1: 0.3717
 epoch: 42, train_loss: 1.0179, test_loss: 1.0624, test_f1: 0.3875
 epoch: 43, train_loss: 1.0171, test_loss: 1.0920, test_f1: 0.3970
 epoch: 44, train_loss: 1.0149, test_loss: 1.1404, test_f1: 0.3478
 epoch: 45, train_loss: 1.0105, test_loss: 1.0910, test_f1: 0.3432
 epoch: 46, train_loss: 0.9958, test_loss: 2.4979, test_f1: 0.3981
 epoch: 47, train_loss: 0.9968, test_loss: 1.0973, test_f1: 0.3698
 epoch: 48, train_loss: 1.0110, test_loss: 1.1197, test_f1: 0.3585
 epoch: 49, train_loss: 1.0272, test_loss: 1.1891, test_f1: 0.3207
 epoch: 50, train_loss: 1.0464, test_loss: 1.1046, test_f1: 0.3440
 epoch: 51, train_loss: 1.0121, test_loss: 1.0199, test_f1: 0.3998
 epoch: 52, train_loss: 1.0160, test_loss: 1.3468, test_f1: 0.3234
 epoch: 53, train_loss: 1.0176, test_loss: 1.1141, test_f1: 0.3846
 epoch: 54, train_loss: 1.0066, test_loss: 1.0513, test_f1: 0.3874
 epoch: 55, train_loss: 1.0090, test_loss: 1.0130, test_f1: 0.3686
 epoch: 56, train_loss: 1.0036, test_loss: 1.0741, test_f1: 0.3503
 epoch: 57, train_loss: 1.0062, test_loss: 1.0384, test_f1: 0.3477
 epoch: 58, train_loss: 0.9925, test_loss: 1.0311, test_f1: 0.3757
 epoch: 59, train_loss: 0.9886, test_loss: 1.0741, test_f1: 0.3614
 epoch: 60, train_loss: 0.9921, test_loss: 1.1073, test_f1: 0.3681
 epoch: 61, train_loss: 1.0034, test_loss: 1.0808, test_f1: 0.3590
 epoch: 62, train_loss: 0.9869, test_loss: 1.0704, test_f1: 0.3486
 epoch: 63, train_loss: 0.9837, test_loss: 1.0757, test_f1: 0.3646
 epoch: 64, train_loss: 1.0053, test_loss: 1.0545, test_f1: 0.4166
 epoch: 65, train_loss: 1.0130, test_loss: 1.0766, test_f1: 0.3858
 epoch: 66, train_loss: 0.9959, test_loss: 1.0886, test_f1: 0.3938
 epoch: 67, train_loss: 0.9843, test_loss: 1.0924, test_f1: 0.3928
 epoch: 68, train_loss: 0.9775, test_loss: 1.0423, test_f1: 0.3504
 epoch: 69, train_loss: 0.9894, test_loss: 1.0815, test_f1: 0.3475
 epoch: 70, train_loss: 1.0004, test_loss: 1.0890, test_f1: 0.4074
 epoch: 71, train_loss: 1.0044, test_loss: 1.0908, test_f1: 0.3512
 epoch: 72, train_loss: 0.9858, test_loss: 1.0927, test_f1: 0.3523
 epoch: 73, train_loss: 0.9823, test_loss: 1.0695, test_f1: 0.3633
 epoch: 74, train_loss: 0.9775, test_loss: 1.0861, test_f1: 0.3965
 epoch: 75, train_loss: 0.9932, test_loss: 1.0737, test_f1: 0.3492
 epoch: 76, train_loss: 0.9850, test_loss: 1.0649, test_f1: 0.3598
 epoch: 77, train_loss: 0.9718, test_loss: 1.0627, test_f1: 0.4133
 epoch: 78, train_loss: 0.9832, test_loss: 1.0720, test_f1: 0.3497
 epoch: 79, train_loss: 0.9664, test_loss: 1.0584, test_f1: 0.3579
 epoch: 80, train_loss: 0.9630, test_loss: 1.0591, test_f1: 0.3876
 epoch: 81, train_loss: 0.9816, test_loss: 1.0638, test_f1: 0.3688
 epoch: 82, train_loss: 0.9849, test_loss: 1.0668, test_f1: 0.4758
 epoch: 83, train_loss: 0.9957, test_loss: 1.1473, test_f1: 0.3185
 epoch: 84, train_loss: 0.9837, test_loss: 1.0664, test_f1: 0.3490
 epoch: 85, train_loss: 0.9879, test_loss: 1.0821, test_f1: 0.3453
 epoch: 86, train_loss: 0.9807, test_loss: 1.0811, test_f1: 0.3412
 epoch: 87, train_loss: 0.9771, test_loss: 1.0744, test_f1: 0.3798
 epoch: 88, train_loss: 0.9758, test_loss: 1.0737, test_f1: 0.3658
 epoch: 89, train_loss: 0.9731, test_loss: 1.0684, test_f1: 0.3933
 epoch: 90, train_loss: 0.9687, test_loss: 1.0697, test_f1: 0.3587
 epoch: 91, train_loss: 0.9747, test_loss: 1.0678, test_f1: 0.3504
 epoch: 92, train_loss: 0.9690, test_loss: 1.0611, test_f1: 0.3857
 epoch: 93, train_loss: 0.9629, test_loss: 1.0510, test_f1: 0.4134
 epoch: 94, train_loss: 0.9761, test_loss: 1.0578, test_f1: 0.4091
 epoch: 95, train_loss: 0.9677, test_loss: 1.0764, test_f1: 0.4022
 epoch: 96, train_loss: 0.9696, test_loss: 1.0627, test_f1: 0.3639
 epoch: 97, train_loss: 0.9674, test_loss: 1.0683, test_f1: 0.3866
 epoch: 98, train_loss: 0.9596, test_loss: 1.0615, test_f1: 0.3717
 epoch: 99, train_loss: 0.9572, test_loss: 1.0527, test_f1: 0.3927

Training completed in 410.83 seconds
Best F1: 0.5229 at epoch 89
Mean F1 across iterations: 0.4594  0.0430
========================FINAL RESULTS================================
FEGIN weighted F1: 0.5229  0.0430
python main.py --data ltspice_examples --representation component_net --model FEGIN --layers 4 --hiddens 16 --batch_size 256 --lr 0.1 --emb_size 512 --epochs 100 --save_appendix component_net_L4_H16_BS256_LR0.1_E512 --no_val
-----



STDERR:
  File "main.py", line 370, in <module>
    main()
  File "main.py", line 254, in main
    dataset = dataset_class(
  File "/home/philip/projects/ltspice_examples_code_repo/Circuit-Completion-Using-GNNs/component_classification_with_link_prediction_head/evaluation/FEGIN/kernel/circuit_datasets.py", line 15, in __init__
    self.data, self.slices = torch.load(self.processed_paths[0])
  File "/home/philip/.local/lib/python3.8/site-packages/torch/serialization.py", line 1040, in load
    warnings.warn(
  File "/usr/lib/python3.8/warnings.py", line 109, in _showwarnmsg
    sw(msg.message, msg.category, msg.filename, msg.lineno,
  File "main.py", line 47, in warn_with_traceback
    traceback.print_stack(file=log)
/home/philip/projects/ltspice_examples_code_repo/Circuit-Completion-Using-GNNs/component_classification_with_link_prediction_head/evaluation/FEGIN/kernel/circuit_datasets.py:15: FutureWarning: You are using `torch.load` with `weights_only=False` (the current default value), which uses the default pickle module implicitly. It is possible to construct malicious pickle data which will execute arbitrary code during unpickling (See https://github.com/pytorch/pytorch/blob/main/SECURITY.md#untrusted-models for more details). In a future release, the default value for `weights_only` will be flipped to `True`. This limits the functions that could be executed during unpickling. Arbitrary objects will no longer be allowed to be loaded via this mode unless they are explicitly allowlisted by the user via `torch.serialization.add_safe_globals`. We recommend you start setting `weights_only=True` for any use case where you don't have full control of the loaded file. Please open an issue on GitHub for any issues related to this experimental feature.
  self.data, self.slices = torch.load(self.processed_paths[0])
