STDOUT:
Results will be saved in /home/philip/projects/ltspice_examples_code_repo/Circuit-Completion-Using-GNNs/component_classification_with_link_prediction_head/evaluation/FEGIN/results/model_FEGIN_dataset_ltspice_examples
Command line input: python main.py --data ltspice_examples --representation component_net --model FEGIN --layers 3 --hiddens 64 --batch_size 128 --lr 0.01 --emb_size 250 --epochs 100 --save_appendix component_net_L3_H64_BS128_LR0.01_E250 --no_val
 is saved.
-----
ltspice_examples - FEGIN
Using 3 layers, 64 hidden units, h = 2
Loading component_net representation dataset
ENTERED
Training FEGIN on component_net representation
Train: 3558, Test: 846
##################ITERATION #0 ****************************************
 epoch: 0, train_loss: 1.2453, test_loss: 1.2193, test_f1: 0.2801
 epoch: 1, train_loss: 1.0889, test_loss: 1.2138, test_f1: 0.3261
 epoch: 2, train_loss: 1.0450, test_loss: 1.1321, test_f1: 0.3514
 epoch: 3, train_loss: 1.0039, test_loss: 1.1913, test_f1: 0.4118
 epoch: 4, train_loss: 0.9776, test_loss: 0.9995, test_f1: 0.4524
 epoch: 5, train_loss: 0.9671, test_loss: 1.0735, test_f1: 0.4692
 epoch: 6, train_loss: 0.9497, test_loss: 1.2826, test_f1: 0.3968
 epoch: 7, train_loss: 0.9462, test_loss: 1.0077, test_f1: 0.4889
 epoch: 8, train_loss: 0.9217, test_loss: 0.9456, test_f1: 0.4794
 epoch: 9, train_loss: 0.9165, test_loss: 0.9367, test_f1: 0.5339
 epoch: 10, train_loss: 0.8887, test_loss: 0.9695, test_f1: 0.4980
 epoch: 11, train_loss: 0.8910, test_loss: 0.9110, test_f1: 0.5495
 epoch: 12, train_loss: 0.8752, test_loss: 0.9493, test_f1: 0.5321
 epoch: 13, train_loss: 0.8648, test_loss: 0.9086, test_f1: 0.5198
 epoch: 14, train_loss: 0.8600, test_loss: 0.9030, test_f1: 0.5431
 epoch: 15, train_loss: 0.8587, test_loss: 0.9809, test_f1: 0.5467
 epoch: 16, train_loss: 0.8377, test_loss: 0.9323, test_f1: 0.5572
 epoch: 17, train_loss: 0.8179, test_loss: 0.9814, test_f1: 0.5333
 epoch: 18, train_loss: 0.8149, test_loss: 0.8687, test_f1: 0.5617
 epoch: 19, train_loss: 0.8102, test_loss: 1.0116, test_f1: 0.5446
 epoch: 20, train_loss: 0.7889, test_loss: 0.9728, test_f1: 0.6046
 epoch: 21, train_loss: 0.7941, test_loss: 0.8400, test_f1: 0.6104
 epoch: 22, train_loss: 0.8031, test_loss: 1.0462, test_f1: 0.4916
 epoch: 23, train_loss: 0.7999, test_loss: 0.9660, test_f1: 0.5520
 epoch: 24, train_loss: 0.7636, test_loss: 1.0060, test_f1: 0.5720
 epoch: 25, train_loss: 0.7668, test_loss: 1.0266, test_f1: 0.5512
 epoch: 26, train_loss: 0.7704, test_loss: 1.0885, test_f1: 0.6053
 epoch: 27, train_loss: 0.7671, test_loss: 0.9913, test_f1: 0.4947
 epoch: 28, train_loss: 0.7601, test_loss: 1.0306, test_f1: 0.5876
 epoch: 29, train_loss: 0.7440, test_loss: 1.0504, test_f1: 0.5727
 epoch: 30, train_loss: 0.7430, test_loss: 1.1184, test_f1: 0.6008
 epoch: 31, train_loss: 0.7568, test_loss: 1.2036, test_f1: 0.5711
 epoch: 32, train_loss: 0.7241, test_loss: 0.9830, test_f1: 0.5992
 epoch: 33, train_loss: 0.7097, test_loss: 1.1072, test_f1: 0.5484
 epoch: 34, train_loss: 0.7382, test_loss: 1.1037, test_f1: 0.5041
 epoch: 35, train_loss: 0.7407, test_loss: 0.9887, test_f1: 0.5613
 epoch: 36, train_loss: 0.7134, test_loss: 1.1137, test_f1: 0.5460
 epoch: 37, train_loss: 0.7012, test_loss: 1.1684, test_f1: 0.5829
 epoch: 38, train_loss: 0.7214, test_loss: 1.0074, test_f1: 0.5617
 epoch: 39, train_loss: 0.7209, test_loss: 0.9574, test_f1: 0.5991
 epoch: 40, train_loss: 0.7008, test_loss: 1.1432, test_f1: 0.5972
 epoch: 41, train_loss: 0.6997, test_loss: 0.9693, test_f1: 0.5905
 epoch: 42, train_loss: 0.6968, test_loss: 1.0443, test_f1: 0.6306
 epoch: 43, train_loss: 0.6816, test_loss: 0.9700, test_f1: 0.6267
 epoch: 44, train_loss: 0.6803, test_loss: 1.1380, test_f1: 0.5974
 epoch: 45, train_loss: 0.6623, test_loss: 1.1482, test_f1: 0.6042
 epoch: 46, train_loss: 0.6617, test_loss: 1.0680, test_f1: 0.6312
 epoch: 47, train_loss: 0.6584, test_loss: 1.1250, test_f1: 0.5966
 epoch: 48, train_loss: 0.6634, test_loss: 1.0691, test_f1: 0.6382
 epoch: 49, train_loss: 0.6509, test_loss: 1.1717, test_f1: 0.5721
 epoch: 50, train_loss: 0.6480, test_loss: 1.0078, test_f1: 0.6214
 epoch: 51, train_loss: 0.6083, test_loss: 1.0739, test_f1: 0.6340
 epoch: 52, train_loss: 0.5939, test_loss: 1.2755, test_f1: 0.6204
 epoch: 53, train_loss: 0.5854, test_loss: 1.2087, test_f1: 0.6202
 epoch: 54, train_loss: 0.5885, test_loss: 1.0659, test_f1: 0.6142
 epoch: 55, train_loss: 0.5708, test_loss: 1.2125, test_f1: 0.6498
 epoch: 56, train_loss: 0.5580, test_loss: 1.1955, test_f1: 0.6246
 epoch: 57, train_loss: 0.5711, test_loss: 1.1831, test_f1: 0.6617
 epoch: 58, train_loss: 0.5676, test_loss: 1.2159, test_f1: 0.6334
 epoch: 59, train_loss: 0.5617, test_loss: 1.1858, test_f1: 0.6523
 epoch: 60, train_loss: 0.5458, test_loss: 1.2688, test_f1: 0.6080
 epoch: 61, train_loss: 0.5520, test_loss: 1.3416, test_f1: 0.6227
 epoch: 62, train_loss: 0.5614, test_loss: 1.3514, test_f1: 0.6260
 epoch: 63, train_loss: 0.5529, test_loss: 1.2779, test_f1: 0.6158
 epoch: 64, train_loss: 0.5461, test_loss: 1.4093, test_f1: 0.6249
 epoch: 65, train_loss: 0.5431, test_loss: 1.2957, test_f1: 0.6378
 epoch: 66, train_loss: 0.5414, test_loss: 1.2461, test_f1: 0.6244
 epoch: 67, train_loss: 0.5307, test_loss: 1.5405, test_f1: 0.6010
 epoch: 68, train_loss: 0.5345, test_loss: 1.2684, test_f1: 0.6464
 epoch: 69, train_loss: 0.5222, test_loss: 1.3537, test_f1: 0.6259
 epoch: 70, train_loss: 0.5339, test_loss: 1.3573, test_f1: 0.6055
 epoch: 71, train_loss: 0.5368, test_loss: 1.2785, test_f1: 0.6227
 epoch: 72, train_loss: 0.5221, test_loss: 1.2560, test_f1: 0.6328
 epoch: 73, train_loss: 0.5112, test_loss: 1.3338, test_f1: 0.6296
 epoch: 74, train_loss: 0.5209, test_loss: 1.2810, test_f1: 0.6240
 epoch: 75, train_loss: 0.5209, test_loss: 1.3087, test_f1: 0.6448
 epoch: 76, train_loss: 0.5134, test_loss: 1.4188, test_f1: 0.6069
 epoch: 77, train_loss: 0.5054, test_loss: 1.3228, test_f1: 0.6426
 epoch: 78, train_loss: 0.5091, test_loss: 1.5050, test_f1: 0.6362
 epoch: 79, train_loss: 0.5080, test_loss: 1.2450, test_f1: 0.6283
 epoch: 80, train_loss: 0.4904, test_loss: 1.4477, test_f1: 0.6353
 epoch: 81, train_loss: 0.5050, test_loss: 1.2227, test_f1: 0.6390
 epoch: 82, train_loss: 0.4993, test_loss: 1.3865, test_f1: 0.6547
 epoch: 83, train_loss: 0.4956, test_loss: 1.3183, test_f1: 0.6173
 epoch: 84, train_loss: 0.4718, test_loss: 1.5124, test_f1: 0.6348
 epoch: 85, train_loss: 0.4801, test_loss: 1.4594, test_f1: 0.6357
 epoch: 86, train_loss: 0.4925, test_loss: 1.5124, test_f1: 0.6137
 epoch: 87, train_loss: 0.4871, test_loss: 1.4652, test_f1: 0.6190
 epoch: 88, train_loss: 0.4745, test_loss: 1.3889, test_f1: 0.6543
 epoch: 89, train_loss: 0.4586, test_loss: 1.5757, test_f1: 0.6483
 epoch: 90, train_loss: 0.4704, test_loss: 1.5421, test_f1: 0.6258
 epoch: 91, train_loss: 0.4701, test_loss: 1.3095, test_f1: 0.6522
 epoch: 92, train_loss: 0.4612, test_loss: 1.4419, test_f1: 0.6256
 epoch: 93, train_loss: 0.4696, test_loss: 1.5758, test_f1: 0.6481
 epoch: 94, train_loss: 0.4818, test_loss: 1.6108, test_f1: 0.6312
 epoch: 95, train_loss: 0.4589, test_loss: 1.5208, test_f1: 0.6429
 epoch: 96, train_loss: 0.4533, test_loss: 1.3938, test_f1: 0.6147
 epoch: 97, train_loss: 0.4632, test_loss: 1.3581, test_f1: 0.6051
 epoch: 98, train_loss: 0.4571, test_loss: 1.4563, test_f1: 0.6462
 epoch: 99, train_loss: 0.4604, test_loss: 1.3899, test_f1: 0.6537
##################ITERATION #1 ****************************************
 epoch: 0, train_loss: 1.1814, test_loss: 1.0894, test_f1: 0.3795
 epoch: 1, train_loss: 1.0032, test_loss: 1.0217, test_f1: 0.4315
 epoch: 2, train_loss: 0.9549, test_loss: 0.9666, test_f1: 0.5157
 epoch: 3, train_loss: 0.9153, test_loss: 0.9685, test_f1: 0.4999
 epoch: 4, train_loss: 0.9341, test_loss: 0.9119, test_f1: 0.5202
 epoch: 5, train_loss: 0.9006, test_loss: 0.9284, test_f1: 0.5069
 epoch: 6, train_loss: 0.8928, test_loss: 0.8921, test_f1: 0.5717
 epoch: 7, train_loss: 0.8776, test_loss: 0.9242, test_f1: 0.5747
 epoch: 8, train_loss: 0.8565, test_loss: 0.9993, test_f1: 0.5272
 epoch: 9, train_loss: 0.8487, test_loss: 0.8938, test_f1: 0.5804
 epoch: 10, train_loss: 0.8520, test_loss: 1.0832, test_f1: 0.5046
 epoch: 11, train_loss: 0.8266, test_loss: 1.0029, test_f1: 0.5240
 epoch: 12, train_loss: 0.8120, test_loss: 0.9738, test_f1: 0.5537
 epoch: 13, train_loss: 0.8096, test_loss: 1.0030, test_f1: 0.5595
 epoch: 14, train_loss: 0.7996, test_loss: 1.0063, test_f1: 0.5613
 epoch: 15, train_loss: 0.7983, test_loss: 0.9297, test_f1: 0.5740
 epoch: 16, train_loss: 0.7759, test_loss: 0.9369, test_f1: 0.5757
 epoch: 17, train_loss: 0.7654, test_loss: 1.0620, test_f1: 0.5236
 epoch: 18, train_loss: 0.7569, test_loss: 1.0202, test_f1: 0.5299
 epoch: 19, train_loss: 0.7547, test_loss: 0.8417, test_f1: 0.5541
 epoch: 20, train_loss: 0.7608, test_loss: 1.1543, test_f1: 0.5712
 epoch: 21, train_loss: 0.7459, test_loss: 1.0718, test_f1: 0.5670
 epoch: 22, train_loss: 0.7402, test_loss: 0.9745, test_f1: 0.5590
 epoch: 23, train_loss: 0.7216, test_loss: 1.0137, test_f1: 0.5757
 epoch: 24, train_loss: 0.7322, test_loss: 1.1847, test_f1: 0.5863
 epoch: 25, train_loss: 0.7303, test_loss: 0.9623, test_f1: 0.5807
 epoch: 26, train_loss: 0.7290, test_loss: 1.0154, test_f1: 0.5849
 epoch: 27, train_loss: 0.7142, test_loss: 1.0429, test_f1: 0.5880
 epoch: 28, train_loss: 0.6923, test_loss: 1.1084, test_f1: 0.6083
 epoch: 29, train_loss: 0.6787, test_loss: 1.0732, test_f1: 0.6095
 epoch: 30, train_loss: 0.6712, test_loss: 1.4833, test_f1: 0.5249
 epoch: 31, train_loss: 0.6868, test_loss: 1.0338, test_f1: 0.5918
 epoch: 32, train_loss: 0.6736, test_loss: 1.0039, test_f1: 0.6109
 epoch: 33, train_loss: 0.6716, test_loss: 0.9540, test_f1: 0.6034
 epoch: 34, train_loss: 0.6761, test_loss: 1.1642, test_f1: 0.6105
 epoch: 35, train_loss: 0.6617, test_loss: 1.1679, test_f1: 0.6095
 epoch: 36, train_loss: 0.6712, test_loss: 1.0175, test_f1: 0.6155
 epoch: 37, train_loss: 0.6833, test_loss: 1.0914, test_f1: 0.6121
 epoch: 38, train_loss: 0.6517, test_loss: 1.0976, test_f1: 0.5493
 epoch: 39, train_loss: 0.6457, test_loss: 1.1973, test_f1: 0.6014
 epoch: 40, train_loss: 0.6271, test_loss: 1.0893, test_f1: 0.6434
 epoch: 41, train_loss: 0.6300, test_loss: 1.2449, test_f1: 0.6307
 epoch: 42, train_loss: 0.6135, test_loss: 1.5251, test_f1: 0.4722
 epoch: 43, train_loss: 0.6400, test_loss: 1.2756, test_f1: 0.6324
 epoch: 44, train_loss: 0.6289, test_loss: 1.0902, test_f1: 0.6399
 epoch: 45, train_loss: 0.6084, test_loss: 1.2377, test_f1: 0.5873
 epoch: 46, train_loss: 0.5966, test_loss: 1.1793, test_f1: 0.5950
 epoch: 47, train_loss: 0.5988, test_loss: 1.2972, test_f1: 0.6228
 epoch: 48, train_loss: 0.5924, test_loss: 1.1425, test_f1: 0.6219
 epoch: 49, train_loss: 0.6041, test_loss: 1.3080, test_f1: 0.5790
 epoch: 50, train_loss: 0.6138, test_loss: 1.3657, test_f1: 0.6334
 epoch: 51, train_loss: 0.5715, test_loss: 1.1850, test_f1: 0.6116
 epoch: 52, train_loss: 0.5329, test_loss: 1.2172, test_f1: 0.6420
 epoch: 53, train_loss: 0.5202, test_loss: 1.2452, test_f1: 0.6341
 epoch: 54, train_loss: 0.4924, test_loss: 1.4692, test_f1: 0.6518
 epoch: 55, train_loss: 0.4908, test_loss: 1.4158, test_f1: 0.6491
 epoch: 56, train_loss: 0.5168, test_loss: 1.2375, test_f1: 0.6012
 epoch: 57, train_loss: 0.5037, test_loss: 1.4648, test_f1: 0.6312
 epoch: 58, train_loss: 0.4823, test_loss: 1.4217, test_f1: 0.6416
 epoch: 59, train_loss: 0.4868, test_loss: 1.3797, test_f1: 0.6311
 epoch: 60, train_loss: 0.4876, test_loss: 1.5110, test_f1: 0.6118
 epoch: 61, train_loss: 0.4642, test_loss: 1.3782, test_f1: 0.6371
 epoch: 62, train_loss: 0.4927, test_loss: 1.4253, test_f1: 0.6206
 epoch: 63, train_loss: 0.4558, test_loss: 1.5059, test_f1: 0.6263
 epoch: 64, train_loss: 0.4530, test_loss: 1.5289, test_f1: 0.6673
 epoch: 65, train_loss: 0.4423, test_loss: 1.5064, test_f1: 0.6226
 epoch: 66, train_loss: 0.4523, test_loss: 1.6195, test_f1: 0.6636
 epoch: 67, train_loss: 0.4497, test_loss: 1.4707, test_f1: 0.6237
 epoch: 68, train_loss: 0.4436, test_loss: 1.6261, test_f1: 0.6364
 epoch: 69, train_loss: 0.4670, test_loss: 1.7755, test_f1: 0.6239
 epoch: 70, train_loss: 0.4466, test_loss: 1.4215, test_f1: 0.6071
 epoch: 71, train_loss: 0.4398, test_loss: 1.5305, test_f1: 0.6224
 epoch: 72, train_loss: 0.4463, test_loss: 1.4895, test_f1: 0.6544
 epoch: 73, train_loss: 0.4386, test_loss: 1.7650, test_f1: 0.6007
 epoch: 74, train_loss: 0.4306, test_loss: 1.4438, test_f1: 0.6286
 epoch: 75, train_loss: 0.4410, test_loss: 1.4008, test_f1: 0.6437
 epoch: 76, train_loss: 0.4300, test_loss: 1.6223, test_f1: 0.6501
 epoch: 77, train_loss: 0.4227, test_loss: 1.3605, test_f1: 0.6597
 epoch: 78, train_loss: 0.4262, test_loss: 1.4946, test_f1: 0.6247
 epoch: 79, train_loss: 0.4025, test_loss: 1.6517, test_f1: 0.6531
 epoch: 80, train_loss: 0.3975, test_loss: 1.6735, test_f1: 0.6174
 epoch: 81, train_loss: 0.4251, test_loss: 1.5656, test_f1: 0.6303
 epoch: 82, train_loss: 0.4222, test_loss: 1.7217, test_f1: 0.6119
 epoch: 83, train_loss: 0.4248, test_loss: 1.6962, test_f1: 0.6265
 epoch: 84, train_loss: 0.4283, test_loss: 1.6056, test_f1: 0.6168
 epoch: 85, train_loss: 0.4332, test_loss: 1.5846, test_f1: 0.6400
 epoch: 86, train_loss: 0.3943, test_loss: 1.6530, test_f1: 0.6381
 epoch: 87, train_loss: 0.3944, test_loss: 1.5772, test_f1: 0.6475
 epoch: 88, train_loss: 0.3836, test_loss: 1.6157, test_f1: 0.6349
 epoch: 89, train_loss: 0.3838, test_loss: 1.6196, test_f1: 0.6299
 epoch: 90, train_loss: 0.3923, test_loss: 1.6792, test_f1: 0.6201
 epoch: 91, train_loss: 0.3721, test_loss: 1.6651, test_f1: 0.6667
 epoch: 92, train_loss: 0.4183, test_loss: 1.5031, test_f1: 0.6734
 epoch: 93, train_loss: 0.3930, test_loss: 1.9390, test_f1: 0.6471
 epoch: 94, train_loss: 0.3939, test_loss: 1.6539, test_f1: 0.6310
 epoch: 95, train_loss: 0.3738, test_loss: 1.6659, test_f1: 0.6440
 epoch: 96, train_loss: 0.3741, test_loss: 1.4830, test_f1: 0.6373
 epoch: 97, train_loss: 0.3784, test_loss: 1.7035, test_f1: 0.6288
 epoch: 98, train_loss: 0.3738, test_loss: 1.3915, test_f1: 0.6467
 epoch: 99, train_loss: 0.3678, test_loss: 1.6642, test_f1: 0.6298
##################ITERATION #2 ****************************************
 epoch: 0, train_loss: 1.3175, test_loss: 1.2244, test_f1: 0.3172
 epoch: 1, train_loss: 1.0302, test_loss: 0.9741, test_f1: 0.4637
 epoch: 2, train_loss: 0.9825, test_loss: 1.0578, test_f1: 0.4614
 epoch: 3, train_loss: 0.9622, test_loss: 0.9534, test_f1: 0.4773
 epoch: 4, train_loss: 0.9412, test_loss: 1.0331, test_f1: 0.4731
 epoch: 5, train_loss: 0.9256, test_loss: 1.0994, test_f1: 0.4593
 epoch: 6, train_loss: 0.9090, test_loss: 0.9814, test_f1: 0.4950
 epoch: 7, train_loss: 0.9038, test_loss: 0.9319, test_f1: 0.5157
 epoch: 8, train_loss: 0.8880, test_loss: 0.9165, test_f1: 0.5489
 epoch: 9, train_loss: 0.8914, test_loss: 1.0735, test_f1: 0.4509
 epoch: 10, train_loss: 0.8704, test_loss: 0.8493, test_f1: 0.5415
 epoch: 11, train_loss: 0.8588, test_loss: 0.9190, test_f1: 0.5559
 epoch: 12, train_loss: 0.8356, test_loss: 0.9250, test_f1: 0.5889
 epoch: 13, train_loss: 0.8180, test_loss: 0.9885, test_f1: 0.5371
 epoch: 14, train_loss: 0.8234, test_loss: 0.9007, test_f1: 0.5476
 epoch: 15, train_loss: 0.8374, test_loss: 0.8481, test_f1: 0.5652
 epoch: 16, train_loss: 0.8133, test_loss: 0.9180, test_f1: 0.5842
 epoch: 17, train_loss: 0.7960, test_loss: 0.9846, test_f1: 0.5226
 epoch: 18, train_loss: 0.8035, test_loss: 0.9024, test_f1: 0.5851
 epoch: 19, train_loss: 0.8118, test_loss: 0.9199, test_f1: 0.5657
 epoch: 20, train_loss: 0.8018, test_loss: 0.9301, test_f1: 0.5788
 epoch: 21, train_loss: 0.7891, test_loss: 0.8532, test_f1: 0.5935
 epoch: 22, train_loss: 0.7958, test_loss: 1.0071, test_f1: 0.5141
 epoch: 23, train_loss: 0.7799, test_loss: 0.9436, test_f1: 0.6151
 epoch: 24, train_loss: 0.7785, test_loss: 0.8872, test_f1: 0.5810
 epoch: 25, train_loss: 0.7631, test_loss: 0.8582, test_f1: 0.6195
 epoch: 26, train_loss: 0.7378, test_loss: 0.9146, test_f1: 0.5873
 epoch: 27, train_loss: 0.7313, test_loss: 0.9427, test_f1: 0.6110
 epoch: 28, train_loss: 0.7374, test_loss: 0.9555, test_f1: 0.6073
 epoch: 29, train_loss: 0.7225, test_loss: 1.0007, test_f1: 0.5866
 epoch: 30, train_loss: 0.7325, test_loss: 0.8600, test_f1: 0.5909
 epoch: 31, train_loss: 0.7055, test_loss: 0.9397, test_f1: 0.6228
 epoch: 32, train_loss: 0.6995, test_loss: 0.8654, test_f1: 0.6352
 epoch: 33, train_loss: 0.7010, test_loss: 0.8995, test_f1: 0.5776
 epoch: 34, train_loss: 0.6985, test_loss: 0.9304, test_f1: 0.6203
 epoch: 35, train_loss: 0.7058, test_loss: 0.9532, test_f1: 0.6164
 epoch: 36, train_loss: 0.6958, test_loss: 0.9242, test_f1: 0.6516
 epoch: 37, train_loss: 0.7026, test_loss: 0.9307, test_f1: 0.5978
 epoch: 38, train_loss: 0.7012, test_loss: 1.0307, test_f1: 0.5556
 epoch: 39, train_loss: 0.6623, test_loss: 0.9483, test_f1: 0.6137
 epoch: 40, train_loss: 0.6881, test_loss: 0.9144, test_f1: 0.6300
 epoch: 41, train_loss: 0.6661, test_loss: 1.0374, test_f1: 0.5776
 epoch: 42, train_loss: 0.6695, test_loss: 1.0112, test_f1: 0.6140
 epoch: 43, train_loss: 0.6761, test_loss: 1.0438, test_f1: 0.6127
 epoch: 44, train_loss: 0.6441, test_loss: 1.0585, test_f1: 0.6135
 epoch: 45, train_loss: 0.6574, test_loss: 1.0099, test_f1: 0.6230
 epoch: 46, train_loss: 0.6498, test_loss: 1.0355, test_f1: 0.5933
 epoch: 47, train_loss: 0.6388, test_loss: 0.9116, test_f1: 0.6517
 epoch: 48, train_loss: 0.6197, test_loss: 0.9284, test_f1: 0.6096
 epoch: 49, train_loss: 0.6325, test_loss: 1.1276, test_f1: 0.6100
 epoch: 50, train_loss: 0.6271, test_loss: 0.9739, test_f1: 0.6656
 epoch: 51, train_loss: 0.5908, test_loss: 0.9865, test_f1: 0.6330
 epoch: 52, train_loss: 0.5834, test_loss: 1.0232, test_f1: 0.6473
 epoch: 53, train_loss: 0.5628, test_loss: 0.9863, test_f1: 0.6333
 epoch: 54, train_loss: 0.5574, test_loss: 1.0515, test_f1: 0.6492
 epoch: 55, train_loss: 0.5339, test_loss: 1.0302, test_f1: 0.6500
 epoch: 56, train_loss: 0.5463, test_loss: 0.9911, test_f1: 0.6651
 epoch: 57, train_loss: 0.5262, test_loss: 1.0177, test_f1: 0.6618
 epoch: 58, train_loss: 0.5209, test_loss: 1.0223, test_f1: 0.6686
 epoch: 59, train_loss: 0.5310, test_loss: 1.0516, test_f1: 0.6126
 epoch: 60, train_loss: 0.5368, test_loss: 1.0977, test_f1: 0.6357
 epoch: 61, train_loss: 0.5127, test_loss: 1.0716, test_f1: 0.6419
 epoch: 62, train_loss: 0.5363, test_loss: 0.9657, test_f1: 0.6739
 epoch: 63, train_loss: 0.5165, test_loss: 1.0750, test_f1: 0.6191
 epoch: 64, train_loss: 0.5257, test_loss: 1.0604, test_f1: 0.6361
 epoch: 65, train_loss: 0.5179, test_loss: 1.1529, test_f1: 0.6679
 epoch: 66, train_loss: 0.5096, test_loss: 0.8912, test_f1: 0.6534
 epoch: 67, train_loss: 0.5190, test_loss: 1.1181, test_f1: 0.6492
 epoch: 68, train_loss: 0.5062, test_loss: 1.0227, test_f1: 0.6520
 epoch: 69, train_loss: 0.4916, test_loss: 1.1019, test_f1: 0.6556
 epoch: 70, train_loss: 0.4959, test_loss: 1.0558, test_f1: 0.6347
 epoch: 71, train_loss: 0.5317, test_loss: 0.9666, test_f1: 0.6215
 epoch: 72, train_loss: 0.5007, test_loss: 1.1475, test_f1: 0.6464
 epoch: 73, train_loss: 0.4893, test_loss: 1.0512, test_f1: 0.6527
 epoch: 74, train_loss: 0.4850, test_loss: 1.1219, test_f1: 0.6610
 epoch: 75, train_loss: 0.4794, test_loss: 0.9833, test_f1: 0.6395
 epoch: 76, train_loss: 0.4850, test_loss: 1.1711, test_f1: 0.6460
 epoch: 77, train_loss: 0.4743, test_loss: 1.0747, test_f1: 0.6393
 epoch: 78, train_loss: 0.4930, test_loss: 1.2677, test_f1: 0.6495
 epoch: 79, train_loss: 0.4780, test_loss: 1.0658, test_f1: 0.6366
 epoch: 80, train_loss: 0.5066, test_loss: 0.9506, test_f1: 0.6485
 epoch: 81, train_loss: 0.4651, test_loss: 1.1351, test_f1: 0.6597
 epoch: 82, train_loss: 0.4759, test_loss: 1.0682, test_f1: 0.6447
 epoch: 83, train_loss: 0.4723, test_loss: 1.2375, test_f1: 0.6567
 epoch: 84, train_loss: 0.4537, test_loss: 1.1108, test_f1: 0.6666
 epoch: 85, train_loss: 0.4794, test_loss: 1.0522, test_f1: 0.6439
 epoch: 86, train_loss: 0.4494, test_loss: 1.2403, test_f1: 0.6541
 epoch: 87, train_loss: 0.4728, test_loss: 1.1194, test_f1: 0.6396
 epoch: 88, train_loss: 0.4602, test_loss: 1.1975, test_f1: 0.6404
 epoch: 89, train_loss: 0.4611, test_loss: 1.2654, test_f1: 0.6146
 epoch: 90, train_loss: 0.4407, test_loss: 1.1953, test_f1: 0.6540
 epoch: 91, train_loss: 0.4611, test_loss: 1.1432, test_f1: 0.6400
 epoch: 92, train_loss: 0.4338, test_loss: 1.2264, test_f1: 0.6195
 epoch: 93, train_loss: 0.4413, test_loss: 1.1918, test_f1: 0.6646
 epoch: 94, train_loss: 0.4498, test_loss: 1.1695, test_f1: 0.6530
 epoch: 95, train_loss: 0.4617, test_loss: 1.3798, test_f1: 0.6065
 epoch: 96, train_loss: 0.4206, test_loss: 1.1941, test_f1: 0.6487
 epoch: 97, train_loss: 0.4376, test_loss: 1.1905, test_f1: 0.6544
 epoch: 98, train_loss: 0.4510, test_loss: 1.0913, test_f1: 0.6688
 epoch: 99, train_loss: 0.4539, test_loss: 1.2078, test_f1: 0.6576
##################ITERATION #3 ****************************************
 epoch: 0, train_loss: 1.2679, test_loss: 1.2424, test_f1: 0.2367
 epoch: 1, train_loss: 1.0100, test_loss: 1.0802, test_f1: 0.4088
 epoch: 2, train_loss: 0.9760, test_loss: 0.9642, test_f1: 0.4917
 epoch: 3, train_loss: 0.9549, test_loss: 0.9507, test_f1: 0.4849
 epoch: 4, train_loss: 0.9377, test_loss: 0.9518, test_f1: 0.5012
 epoch: 5, train_loss: 0.9192, test_loss: 0.9336, test_f1: 0.5457
 epoch: 6, train_loss: 0.9048, test_loss: 0.9444, test_f1: 0.5203
 epoch: 7, train_loss: 0.9007, test_loss: 0.9633, test_f1: 0.5019
 epoch: 8, train_loss: 0.8737, test_loss: 0.8717, test_f1: 0.5413
 epoch: 9, train_loss: 0.8518, test_loss: 0.9217, test_f1: 0.5344
 epoch: 10, train_loss: 0.8457, test_loss: 0.9558, test_f1: 0.5696
 epoch: 11, train_loss: 0.8473, test_loss: 0.9740, test_f1: 0.4840
 epoch: 12, train_loss: 0.8167, test_loss: 0.9344, test_f1: 0.5615
 epoch: 13, train_loss: 0.8352, test_loss: 0.8417, test_f1: 0.5509
 epoch: 14, train_loss: 0.7935, test_loss: 0.8850, test_f1: 0.6026
 epoch: 15, train_loss: 0.7918, test_loss: 0.8936, test_f1: 0.5738
 epoch: 16, train_loss: 0.7952, test_loss: 0.9175, test_f1: 0.5552
 epoch: 17, train_loss: 0.7947, test_loss: 0.9347, test_f1: 0.5487
 epoch: 18, train_loss: 0.8028, test_loss: 1.0624, test_f1: 0.4968
 epoch: 19, train_loss: 0.7921, test_loss: 0.9517, test_f1: 0.5926
 epoch: 20, train_loss: 0.7731, test_loss: 0.8788, test_f1: 0.5884
 epoch: 21, train_loss: 0.7576, test_loss: 1.0211, test_f1: 0.6078
 epoch: 22, train_loss: 0.7434, test_loss: 0.8460, test_f1: 0.5989
 epoch: 23, train_loss: 0.7354, test_loss: 0.9572, test_f1: 0.6036
 epoch: 24, train_loss: 0.7529, test_loss: 0.9557, test_f1: 0.5875
 epoch: 25, train_loss: 0.7382, test_loss: 0.9914, test_f1: 0.5715
 epoch: 26, train_loss: 0.7306, test_loss: 0.9451, test_f1: 0.5939
 epoch: 27, train_loss: 0.7094, test_loss: 0.8883, test_f1: 0.5968
 epoch: 28, train_loss: 0.7048, test_loss: 1.3445, test_f1: 0.5484
 epoch: 29, train_loss: 0.7135, test_loss: 0.9609, test_f1: 0.5847
 epoch: 30, train_loss: 0.7328, test_loss: 0.9797, test_f1: 0.5644
 epoch: 31, train_loss: 0.6928, test_loss: 1.0896, test_f1: 0.6148
 epoch: 32, train_loss: 0.6923, test_loss: 0.9165, test_f1: 0.5853
 epoch: 33, train_loss: 0.6858, test_loss: 1.0407, test_f1: 0.5864
 epoch: 34, train_loss: 0.6890, test_loss: 1.1323, test_f1: 0.6081
 epoch: 35, train_loss: 0.6815, test_loss: 0.9171, test_f1: 0.6455
 epoch: 36, train_loss: 0.6679, test_loss: 1.0641, test_f1: 0.5479
 epoch: 37, train_loss: 0.6581, test_loss: 0.8343, test_f1: 0.5888
 epoch: 38, train_loss: 0.6672, test_loss: 0.9733, test_f1: 0.6373
 epoch: 39, train_loss: 0.6220, test_loss: 1.1393, test_f1: 0.5934
 epoch: 40, train_loss: 0.6557, test_loss: 0.9827, test_f1: 0.6454
 epoch: 41, train_loss: 0.6707, test_loss: 0.9438, test_f1: 0.6156
 epoch: 42, train_loss: 0.6356, test_loss: 1.0361, test_f1: 0.6513
 epoch: 43, train_loss: 0.6230, test_loss: 1.0274, test_f1: 0.6561
 epoch: 44, train_loss: 0.6290, test_loss: 1.1031, test_f1: 0.6567
 epoch: 45, train_loss: 0.6224, test_loss: 0.9645, test_f1: 0.6393
 epoch: 46, train_loss: 0.6294, test_loss: 1.1468, test_f1: 0.5811
 epoch: 47, train_loss: 0.6100, test_loss: 1.1785, test_f1: 0.6305
 epoch: 48, train_loss: 0.5951, test_loss: 1.2173, test_f1: 0.6526
 epoch: 49, train_loss: 0.6184, test_loss: 1.2417, test_f1: 0.6598
 epoch: 50, train_loss: 0.6109, test_loss: 0.9604, test_f1: 0.5966
 epoch: 51, train_loss: 0.5873, test_loss: 1.1707, test_f1: 0.6795
 epoch: 52, train_loss: 0.5407, test_loss: 1.3005, test_f1: 0.6600
 epoch: 53, train_loss: 0.5440, test_loss: 1.1535, test_f1: 0.6184
 epoch: 54, train_loss: 0.5163, test_loss: 1.2393, test_f1: 0.6719
 epoch: 55, train_loss: 0.5095, test_loss: 1.1165, test_f1: 0.6794
 epoch: 56, train_loss: 0.4979, test_loss: 1.1545, test_f1: 0.6551
 epoch: 57, train_loss: 0.4986, test_loss: 1.1578, test_f1: 0.6682
 epoch: 58, train_loss: 0.5072, test_loss: 1.1775, test_f1: 0.6690
 epoch: 59, train_loss: 0.4954, test_loss: 1.2144, test_f1: 0.6406
 epoch: 60, train_loss: 0.4788, test_loss: 1.2352, test_f1: 0.6486
 epoch: 61, train_loss: 0.4826, test_loss: 1.2944, test_f1: 0.6498
 epoch: 62, train_loss: 0.4817, test_loss: 1.1845, test_f1: 0.6688
 epoch: 63, train_loss: 0.4871, test_loss: 1.2050, test_f1: 0.6878
 epoch: 64, train_loss: 0.4830, test_loss: 1.2855, test_f1: 0.6592
 epoch: 65, train_loss: 0.4741, test_loss: 1.2414, test_f1: 0.6476
 epoch: 66, train_loss: 0.4628, test_loss: 1.2302, test_f1: 0.6521
 epoch: 67, train_loss: 0.4560, test_loss: 1.1426, test_f1: 0.6693
 epoch: 68, train_loss: 0.4533, test_loss: 1.3970, test_f1: 0.6379
 epoch: 69, train_loss: 0.4640, test_loss: 1.1382, test_f1: 0.6628
 epoch: 70, train_loss: 0.4540, test_loss: 1.1327, test_f1: 0.6871
 epoch: 71, train_loss: 0.4573, test_loss: 1.1463, test_f1: 0.6484
 epoch: 72, train_loss: 0.4425, test_loss: 1.3353, test_f1: 0.6582
 epoch: 73, train_loss: 0.4608, test_loss: 1.1897, test_f1: 0.6752
 epoch: 74, train_loss: 0.4447, test_loss: 1.2824, test_f1: 0.6534
 epoch: 75, train_loss: 0.4462, test_loss: 1.1063, test_f1: 0.6826
 epoch: 76, train_loss: 0.4299, test_loss: 1.3952, test_f1: 0.6647
 epoch: 77, train_loss: 0.4388, test_loss: 1.4637, test_f1: 0.6545
 epoch: 78, train_loss: 0.4270, test_loss: 1.2515, test_f1: 0.6777
 epoch: 79, train_loss: 0.4141, test_loss: 1.4248, test_f1: 0.6659
 epoch: 80, train_loss: 0.4221, test_loss: 1.2869, test_f1: 0.6620
 epoch: 81, train_loss: 0.4175, test_loss: 1.3962, test_f1: 0.6529
 epoch: 82, train_loss: 0.4263, test_loss: 1.3864, test_f1: 0.6633
 epoch: 83, train_loss: 0.4323, test_loss: 1.3992, test_f1: 0.6472
 epoch: 84, train_loss: 0.3916, test_loss: 1.3590, test_f1: 0.6464
 epoch: 85, train_loss: 0.4254, test_loss: 1.5406, test_f1: 0.6612
 epoch: 86, train_loss: 0.4275, test_loss: 1.3189, test_f1: 0.6609
 epoch: 87, train_loss: 0.4065, test_loss: 1.3267, test_f1: 0.6672
 epoch: 88, train_loss: 0.3975, test_loss: 1.4427, test_f1: 0.6652
 epoch: 89, train_loss: 0.3946, test_loss: 1.4645, test_f1: 0.6734
 epoch: 90, train_loss: 0.3954, test_loss: 1.2875, test_f1: 0.6714
 epoch: 91, train_loss: 0.3966, test_loss: 1.7331, test_f1: 0.6386
 epoch: 92, train_loss: 0.3942, test_loss: 1.5232, test_f1: 0.6558
 epoch: 93, train_loss: 0.3841, test_loss: 1.4867, test_f1: 0.6452
 epoch: 94, train_loss: 0.3808, test_loss: 1.6172, test_f1: 0.6726
 epoch: 95, train_loss: 0.3826, test_loss: 1.4755, test_f1: 0.6652
 epoch: 96, train_loss: 0.3763, test_loss: 1.4586, test_f1: 0.6689
 epoch: 97, train_loss: 0.4036, test_loss: 1.4118, test_f1: 0.6712
 epoch: 98, train_loss: 0.3955, test_loss: 1.3307, test_f1: 0.6459
 epoch: 99, train_loss: 0.3675, test_loss: 1.5194, test_f1: 0.6569
##################ITERATION #4 ****************************************
 epoch: 0, train_loss: 1.2426, test_loss: 1.1325, test_f1: 0.4051
 epoch: 1, train_loss: 1.0336, test_loss: 0.9868, test_f1: 0.4659
 epoch: 2, train_loss: 0.9764, test_loss: 0.9638, test_f1: 0.4925
 epoch: 3, train_loss: 0.9506, test_loss: 0.9766, test_f1: 0.4890
 epoch: 4, train_loss: 0.9529, test_loss: 0.9470, test_f1: 0.5025
 epoch: 5, train_loss: 0.9246, test_loss: 0.9919, test_f1: 0.4949
 epoch: 6, train_loss: 0.9086, test_loss: 0.9903, test_f1: 0.5017
 epoch: 7, train_loss: 0.8863, test_loss: 0.9953, test_f1: 0.5722
 epoch: 8, train_loss: 0.8842, test_loss: 1.0434, test_f1: 0.4739
 epoch: 9, train_loss: 0.8849, test_loss: 0.9211, test_f1: 0.5211
 epoch: 10, train_loss: 0.8758, test_loss: 0.9156, test_f1: 0.5266
 epoch: 11, train_loss: 0.8596, test_loss: 0.9563, test_f1: 0.5537
 epoch: 12, train_loss: 0.8563, test_loss: 0.9046, test_f1: 0.5698
 epoch: 13, train_loss: 0.8489, test_loss: 0.9709, test_f1: 0.5600
 epoch: 14, train_loss: 0.8291, test_loss: 0.8812, test_f1: 0.5947
 epoch: 15, train_loss: 0.8299, test_loss: 1.0085, test_f1: 0.5405
 epoch: 16, train_loss: 0.8175, test_loss: 0.9507, test_f1: 0.5596
 epoch: 17, train_loss: 0.8080, test_loss: 0.9029, test_f1: 0.6063
 epoch: 18, train_loss: 0.8030, test_loss: 0.9025, test_f1: 0.5506
 epoch: 19, train_loss: 0.8056, test_loss: 0.9311, test_f1: 0.5775
 epoch: 20, train_loss: 0.7800, test_loss: 0.9318, test_f1: 0.5741
 epoch: 21, train_loss: 0.8014, test_loss: 0.8189, test_f1: 0.5935
 epoch: 22, train_loss: 0.7589, test_loss: 0.8952, test_f1: 0.6094
 epoch: 23, train_loss: 0.7527, test_loss: 0.9364, test_f1: 0.5474
 epoch: 24, train_loss: 0.7549, test_loss: 0.8671, test_f1: 0.5708
 epoch: 25, train_loss: 0.7416, test_loss: 1.0418, test_f1: 0.5281
 epoch: 26, train_loss: 0.7395, test_loss: 0.9450, test_f1: 0.6036
 epoch: 27, train_loss: 0.7439, test_loss: 0.9097, test_f1: 0.5862
 epoch: 28, train_loss: 0.7204, test_loss: 0.9821, test_f1: 0.5784
 epoch: 29, train_loss: 0.7137, test_loss: 0.9063, test_f1: 0.5701
 epoch: 30, train_loss: 0.7074, test_loss: 0.8664, test_f1: 0.6067
 epoch: 31, train_loss: 0.7383, test_loss: 0.8479, test_f1: 0.5888
 epoch: 32, train_loss: 0.7102, test_loss: 0.8586, test_f1: 0.6318
 epoch: 33, train_loss: 0.7113, test_loss: 0.8486, test_f1: 0.5925
 epoch: 34, train_loss: 0.6829, test_loss: 0.8527, test_f1: 0.5975
 epoch: 35, train_loss: 0.6917, test_loss: 0.9911, test_f1: 0.5921
 epoch: 36, train_loss: 0.6849, test_loss: 0.7898, test_f1: 0.6030
 epoch: 37, train_loss: 0.6642, test_loss: 1.0017, test_f1: 0.6409
 epoch: 38, train_loss: 0.6549, test_loss: 0.9639, test_f1: 0.6584
 epoch: 39, train_loss: 0.6462, test_loss: 1.0261, test_f1: 0.6018
 epoch: 40, train_loss: 0.6405, test_loss: 0.9057, test_f1: 0.6117
 epoch: 41, train_loss: 0.6629, test_loss: 0.9250, test_f1: 0.6439
 epoch: 42, train_loss: 0.6855, test_loss: 0.9078, test_f1: 0.6079
 epoch: 43, train_loss: 0.6770, test_loss: 1.0052, test_f1: 0.6185
 epoch: 44, train_loss: 0.6391, test_loss: 0.8129, test_f1: 0.6534
 epoch: 45, train_loss: 0.6518, test_loss: 0.8070, test_f1: 0.6107
 epoch: 46, train_loss: 0.6337, test_loss: 0.8788, test_f1: 0.6530
 epoch: 47, train_loss: 0.6200, test_loss: 0.8724, test_f1: 0.6448
 epoch: 48, train_loss: 0.6088, test_loss: 0.9836, test_f1: 0.6649
 epoch: 49, train_loss: 0.6180, test_loss: 1.1928, test_f1: 0.5390
 epoch: 50, train_loss: 0.6477, test_loss: 0.9419, test_f1: 0.6534
 epoch: 51, train_loss: 0.5809, test_loss: 0.8573, test_f1: 0.6670
 epoch: 52, train_loss: 0.5587, test_loss: 0.9136, test_f1: 0.6732
 epoch: 53, train_loss: 0.5471, test_loss: 0.8806, test_f1: 0.6771
 epoch: 54, train_loss: 0.5420, test_loss: 0.8641, test_f1: 0.6752
 epoch: 55, train_loss: 0.5252, test_loss: 0.9290, test_f1: 0.6676
 epoch: 56, train_loss: 0.5510, test_loss: 0.7743, test_f1: 0.6638
 epoch: 57, train_loss: 0.5227, test_loss: 1.0147, test_f1: 0.6310
 epoch: 58, train_loss: 0.5240, test_loss: 0.8344, test_f1: 0.6481
 epoch: 59, train_loss: 0.5241, test_loss: 0.8925, test_f1: 0.6729
 epoch: 60, train_loss: 0.5301, test_loss: 0.9100, test_f1: 0.6326
 epoch: 61, train_loss: 0.5140, test_loss: 0.9420, test_f1: 0.6790
 epoch: 62, train_loss: 0.5081, test_loss: 0.7841, test_f1: 0.6558
 epoch: 63, train_loss: 0.5068, test_loss: 0.8390, test_f1: 0.6631
 epoch: 64, train_loss: 0.5161, test_loss: 0.9453, test_f1: 0.6541
 epoch: 65, train_loss: 0.5250, test_loss: 0.9260, test_f1: 0.6501
 epoch: 66, train_loss: 0.4958, test_loss: 0.8039, test_f1: 0.6771
 epoch: 67, train_loss: 0.4888, test_loss: 0.8322, test_f1: 0.7018
 epoch: 68, train_loss: 0.4907, test_loss: 0.8475, test_f1: 0.6607
 epoch: 69, train_loss: 0.4946, test_loss: 0.9525, test_f1: 0.6898
 epoch: 70, train_loss: 0.5017, test_loss: 0.8707, test_f1: 0.6573
 epoch: 71, train_loss: 0.5028, test_loss: 0.8430, test_f1: 0.6770
 epoch: 72, train_loss: 0.4669, test_loss: 0.8811, test_f1: 0.6868
 epoch: 73, train_loss: 0.4760, test_loss: 0.9943, test_f1: 0.6855
 epoch: 74, train_loss: 0.4775, test_loss: 0.9108, test_f1: 0.6748
 epoch: 75, train_loss: 0.4533, test_loss: 0.8850, test_f1: 0.6683
 epoch: 76, train_loss: 0.4823, test_loss: 1.0588, test_f1: 0.6664
 epoch: 77, train_loss: 0.4575, test_loss: 0.8337, test_f1: 0.7025
 epoch: 78, train_loss: 0.4695, test_loss: 0.9248, test_f1: 0.6745
 epoch: 79, train_loss: 0.4569, test_loss: 1.0599, test_f1: 0.6669
 epoch: 80, train_loss: 0.4473, test_loss: 0.9398, test_f1: 0.6559
 epoch: 81, train_loss: 0.4506, test_loss: 0.9280, test_f1: 0.6651
 epoch: 82, train_loss: 0.4420, test_loss: 1.0081, test_f1: 0.6859
 epoch: 83, train_loss: 0.4513, test_loss: 1.2142, test_f1: 0.6729
 epoch: 84, train_loss: 0.4470, test_loss: 0.8499, test_f1: 0.7055
 epoch: 85, train_loss: 0.4377, test_loss: 1.1132, test_f1: 0.6722
 epoch: 86, train_loss: 0.4387, test_loss: 1.1722, test_f1: 0.6522
 epoch: 87, train_loss: 0.4376, test_loss: 0.9455, test_f1: 0.6799
 epoch: 88, train_loss: 0.4342, test_loss: 1.2023, test_f1: 0.6694
 epoch: 89, train_loss: 0.4447, test_loss: 0.8803, test_f1: 0.6906
 epoch: 90, train_loss: 0.4382, test_loss: 1.0033, test_f1: 0.6672
 epoch: 91, train_loss: 0.4337, test_loss: 0.9102, test_f1: 0.6931
 epoch: 92, train_loss: 0.4396, test_loss: 0.8731, test_f1: 0.7032
 epoch: 93, train_loss: 0.4106, test_loss: 0.8975, test_f1: 0.6648
 epoch: 94, train_loss: 0.4410, test_loss: 0.8472, test_f1: 0.6947
 epoch: 95, train_loss: 0.4360, test_loss: 0.8320, test_f1: 0.6673
 epoch: 96, train_loss: 0.4318, test_loss: 1.0219, test_f1: 0.6808
 epoch: 97, train_loss: 0.4092, test_loss: 0.8600, test_f1: 0.7014
 epoch: 98, train_loss: 0.4158, test_loss: 1.0604, test_f1: 0.6467
 epoch: 99, train_loss: 0.4190, test_loss: 0.9637, test_f1: 0.6555
##################ITERATION #5 ****************************************
 epoch: 0, train_loss: 1.2415, test_loss: 1.4481, test_f1: 0.2859
 epoch: 1, train_loss: 0.9988, test_loss: 0.9746, test_f1: 0.4754
 epoch: 2, train_loss: 0.9545, test_loss: 0.9982, test_f1: 0.4811
 epoch: 3, train_loss: 0.9459, test_loss: 0.9852, test_f1: 0.4982
 epoch: 4, train_loss: 0.9559, test_loss: 1.0186, test_f1: 0.5028
 epoch: 5, train_loss: 0.9231, test_loss: 0.9888, test_f1: 0.4906
 epoch: 6, train_loss: 0.8989, test_loss: 0.9116, test_f1: 0.5569
 epoch: 7, train_loss: 0.8778, test_loss: 0.9638, test_f1: 0.5289
 epoch: 8, train_loss: 0.8726, test_loss: 0.9606, test_f1: 0.5028
 epoch: 9, train_loss: 0.8622, test_loss: 0.9927, test_f1: 0.4879
 epoch: 10, train_loss: 0.8651, test_loss: 1.0204, test_f1: 0.5285
 epoch: 11, train_loss: 0.8670, test_loss: 0.9614, test_f1: 0.5172
 epoch: 12, train_loss: 0.8464, test_loss: 0.9070, test_f1: 0.5580
 epoch: 13, train_loss: 0.8269, test_loss: 1.0291, test_f1: 0.5641
 epoch: 14, train_loss: 0.8296, test_loss: 0.9458, test_f1: 0.5588
 epoch: 15, train_loss: 0.8231, test_loss: 1.0502, test_f1: 0.5277
 epoch: 16, train_loss: 0.8284, test_loss: 0.9589, test_f1: 0.5619
 epoch: 17, train_loss: 0.8170, test_loss: 1.0577, test_f1: 0.6180
 epoch: 18, train_loss: 0.8245, test_loss: 0.9887, test_f1: 0.5807
 epoch: 19, train_loss: 0.7901, test_loss: 1.0025, test_f1: 0.5810
 epoch: 20, train_loss: 0.7824, test_loss: 1.1253, test_f1: 0.5418
 epoch: 21, train_loss: 0.8071, test_loss: 1.0408, test_f1: 0.5395
 epoch: 22, train_loss: 0.7795, test_loss: 1.0730, test_f1: 0.5829
 epoch: 23, train_loss: 0.7588, test_loss: 0.9820, test_f1: 0.5694
 epoch: 24, train_loss: 0.7635, test_loss: 1.0919, test_f1: 0.5744
 epoch: 25, train_loss: 0.7647, test_loss: 1.0075, test_f1: 0.5763
 epoch: 26, train_loss: 0.7457, test_loss: 1.0049, test_f1: 0.6058
 epoch: 27, train_loss: 0.7217, test_loss: 0.9535, test_f1: 0.5657
 epoch: 28, train_loss: 0.7275, test_loss: 0.9597, test_f1: 0.5990
 epoch: 29, train_loss: 0.7264, test_loss: 1.0093, test_f1: 0.5760
 epoch: 30, train_loss: 0.7103, test_loss: 0.9561, test_f1: 0.5857
 epoch: 31, train_loss: 0.7357, test_loss: 1.0909, test_f1: 0.5986
 epoch: 32, train_loss: 0.7125, test_loss: 0.8911, test_f1: 0.6083
 epoch: 33, train_loss: 0.7018, test_loss: 0.9909, test_f1: 0.6002
 epoch: 34, train_loss: 0.6795, test_loss: 1.0216, test_f1: 0.6043
 epoch: 35, train_loss: 0.6705, test_loss: 1.1542, test_f1: 0.5934
 epoch: 36, train_loss: 0.6763, test_loss: 0.9662, test_f1: 0.6188
 epoch: 37, train_loss: 0.6710, test_loss: 0.9880, test_f1: 0.6431
 epoch: 38, train_loss: 0.6840, test_loss: 0.9937, test_f1: 0.6038
 epoch: 39, train_loss: 0.6590, test_loss: 1.3634, test_f1: 0.5016
 epoch: 40, train_loss: 0.6445, test_loss: 1.0853, test_f1: 0.5998
 epoch: 41, train_loss: 0.6539, test_loss: 0.9781, test_f1: 0.5939
 epoch: 42, train_loss: 0.6575, test_loss: 0.9528, test_f1: 0.6146
 epoch: 43, train_loss: 0.6524, test_loss: 0.9889, test_f1: 0.6577
 epoch: 44, train_loss: 0.6274, test_loss: 1.0242, test_f1: 0.6157
 epoch: 45, train_loss: 0.6518, test_loss: 1.0435, test_f1: 0.5909
 epoch: 46, train_loss: 0.6422, test_loss: 0.9620, test_f1: 0.5934
 epoch: 47, train_loss: 0.6368, test_loss: 1.0824, test_f1: 0.6067
 epoch: 48, train_loss: 0.6304, test_loss: 1.0221, test_f1: 0.6452
 epoch: 49, train_loss: 0.6279, test_loss: 1.1961, test_f1: 0.6296
 epoch: 50, train_loss: 0.6304, test_loss: 1.1267, test_f1: 0.6264
 epoch: 51, train_loss: 0.5966, test_loss: 1.0967, test_f1: 0.6421
 epoch: 52, train_loss: 0.5638, test_loss: 1.0941, test_f1: 0.6773
 epoch: 53, train_loss: 0.5437, test_loss: 1.1190, test_f1: 0.6386
 epoch: 54, train_loss: 0.5453, test_loss: 1.1389, test_f1: 0.6806
 epoch: 55, train_loss: 0.5265, test_loss: 1.0716, test_f1: 0.6143
 epoch: 56, train_loss: 0.5403, test_loss: 1.1667, test_f1: 0.6447
 epoch: 57, train_loss: 0.5193, test_loss: 1.1422, test_f1: 0.6542
 epoch: 58, train_loss: 0.5086, test_loss: 1.1547, test_f1: 0.6107
 epoch: 59, train_loss: 0.5277, test_loss: 1.1473, test_f1: 0.6482
 epoch: 60, train_loss: 0.4980, test_loss: 1.2204, test_f1: 0.6348
 epoch: 61, train_loss: 0.5194, test_loss: 1.1321, test_f1: 0.6312
 epoch: 62, train_loss: 0.5135, test_loss: 1.1606, test_f1: 0.6252
 epoch: 63, train_loss: 0.4939, test_loss: 1.1818, test_f1: 0.6258
 epoch: 64, train_loss: 0.4909, test_loss: 1.2300, test_f1: 0.6478
 epoch: 65, train_loss: 0.4858, test_loss: 1.2137, test_f1: 0.6729
 epoch: 66, train_loss: 0.4862, test_loss: 1.1650, test_f1: 0.6341
 epoch: 67, train_loss: 0.5004, test_loss: 1.1425, test_f1: 0.6360
 epoch: 68, train_loss: 0.4734, test_loss: 1.2459, test_f1: 0.6444
 epoch: 69, train_loss: 0.4776, test_loss: 1.2457, test_f1: 0.6439
 epoch: 70, train_loss: 0.4867, test_loss: 1.2202, test_f1: 0.6664
 epoch: 71, train_loss: 0.4869, test_loss: 1.2809, test_f1: 0.6500
 epoch: 72, train_loss: 0.4886, test_loss: 1.2624, test_f1: 0.6701
 epoch: 73, train_loss: 0.4720, test_loss: 1.3434, test_f1: 0.6436
 epoch: 74, train_loss: 0.4742, test_loss: 1.4713, test_f1: 0.6308
 epoch: 75, train_loss: 0.4623, test_loss: 1.5298, test_f1: 0.6126
 epoch: 76, train_loss: 0.4694, test_loss: 1.3132, test_f1: 0.6709
 epoch: 77, train_loss: 0.4483, test_loss: 1.3904, test_f1: 0.6551
 epoch: 78, train_loss: 0.4578, test_loss: 1.3872, test_f1: 0.6284
 epoch: 79, train_loss: 0.4484, test_loss: 1.4284, test_f1: 0.6414
 epoch: 80, train_loss: 0.4598, test_loss: 1.4056, test_f1: 0.6450
 epoch: 81, train_loss: 0.4468, test_loss: 1.3368, test_f1: 0.6299
 epoch: 82, train_loss: 0.4566, test_loss: 1.4279, test_f1: 0.6606
 epoch: 83, train_loss: 0.4433, test_loss: 1.4700, test_f1: 0.6523
 epoch: 84, train_loss: 0.4229, test_loss: 1.2864, test_f1: 0.6604
 epoch: 85, train_loss: 0.4412, test_loss: 1.4775, test_f1: 0.6396
 epoch: 86, train_loss: 0.4564, test_loss: 1.5113, test_f1: 0.6461
 epoch: 87, train_loss: 0.4469, test_loss: 1.5937, test_f1: 0.6405
 epoch: 88, train_loss: 0.4352, test_loss: 1.4918, test_f1: 0.6392
 epoch: 89, train_loss: 0.4327, test_loss: 1.3625, test_f1: 0.6250
 epoch: 90, train_loss: 0.4277, test_loss: 1.4394, test_f1: 0.6432
 epoch: 91, train_loss: 0.4443, test_loss: 1.3368, test_f1: 0.6535
 epoch: 92, train_loss: 0.4305, test_loss: 1.6079, test_f1: 0.6491
 epoch: 93, train_loss: 0.4324, test_loss: 1.3900, test_f1: 0.6433
 epoch: 94, train_loss: 0.4322, test_loss: 1.6121, test_f1: 0.6575
 epoch: 95, train_loss: 0.4056, test_loss: 1.6357, test_f1: 0.6576
 epoch: 96, train_loss: 0.4092, test_loss: 1.5852, test_f1: 0.6283
 epoch: 97, train_loss: 0.4000, test_loss: 1.6775, test_f1: 0.6091
 epoch: 98, train_loss: 0.4433, test_loss: 1.4159, test_f1: 0.6146
 epoch: 99, train_loss: 0.4111, test_loss: 1.4393, test_f1: 0.6584
##################ITERATION #6 ****************************************
 epoch: 0, train_loss: 1.3643, test_loss: 1.1187, test_f1: 0.3866
 epoch: 1, train_loss: 1.0435, test_loss: 0.9796, test_f1: 0.4607
 epoch: 2, train_loss: 0.9789, test_loss: 1.0088, test_f1: 0.4532
 epoch: 3, train_loss: 0.9712, test_loss: 0.9852, test_f1: 0.4905
 epoch: 4, train_loss: 0.9438, test_loss: 0.9413, test_f1: 0.5026
 epoch: 5, train_loss: 0.9374, test_loss: 0.9306, test_f1: 0.5188
 epoch: 6, train_loss: 0.9143, test_loss: 0.9513, test_f1: 0.5176
 epoch: 7, train_loss: 0.9009, test_loss: 0.9611, test_f1: 0.5520
 epoch: 8, train_loss: 0.8675, test_loss: 0.8947, test_f1: 0.5791
 epoch: 9, train_loss: 0.8761, test_loss: 0.9463, test_f1: 0.5184
 epoch: 10, train_loss: 0.8635, test_loss: 0.9248, test_f1: 0.5639
 epoch: 11, train_loss: 0.8657, test_loss: 0.9604, test_f1: 0.5581
 epoch: 12, train_loss: 0.8536, test_loss: 0.9450, test_f1: 0.5537
 epoch: 13, train_loss: 0.8444, test_loss: 0.9402, test_f1: 0.5011
 epoch: 14, train_loss: 0.8266, test_loss: 0.8986, test_f1: 0.5486
 epoch: 15, train_loss: 0.8220, test_loss: 0.9231, test_f1: 0.5649
 epoch: 16, train_loss: 0.8001, test_loss: 0.9214, test_f1: 0.6142
 epoch: 17, train_loss: 0.7845, test_loss: 1.8794, test_f1: 0.2163
 epoch: 18, train_loss: 0.8018, test_loss: 1.5788, test_f1: 0.2337
 epoch: 19, train_loss: 0.7993, test_loss: 0.9341, test_f1: 0.5743
 epoch: 20, train_loss: 0.7796, test_loss: 1.0096, test_f1: 0.5207
 epoch: 21, train_loss: 0.7741, test_loss: 0.8542, test_f1: 0.6023
 epoch: 22, train_loss: 0.7707, test_loss: 0.9621, test_f1: 0.5618
 epoch: 23, train_loss: 0.7589, test_loss: 0.9917, test_f1: 0.6055
 epoch: 24, train_loss: 0.7460, test_loss: 1.0507, test_f1: 0.5622
 epoch: 25, train_loss: 0.7522, test_loss: 0.9957, test_f1: 0.5978
 epoch: 26, train_loss: 0.7541, test_loss: 0.8582, test_f1: 0.6155
 epoch: 27, train_loss: 0.7579, test_loss: 0.9117, test_f1: 0.5715
 epoch: 28, train_loss: 0.7492, test_loss: 0.8326, test_f1: 0.5954
 epoch: 29, train_loss: 0.7287, test_loss: 1.2783, test_f1: 0.5030
 epoch: 30, train_loss: 0.7265, test_loss: 0.8651, test_f1: 0.5691
 epoch: 31, train_loss: 0.7353, test_loss: 0.9957, test_f1: 0.5585
 epoch: 32, train_loss: 0.7241, test_loss: 1.1911, test_f1: 0.5282
 epoch: 33, train_loss: 0.7040, test_loss: 0.8940, test_f1: 0.5801
 epoch: 34, train_loss: 0.7073, test_loss: 1.0150, test_f1: 0.5611
 epoch: 35, train_loss: 0.6987, test_loss: 0.8345, test_f1: 0.6235
 epoch: 36, train_loss: 0.6933, test_loss: 0.9449, test_f1: 0.6256
 epoch: 37, train_loss: 0.6887, test_loss: 0.9358, test_f1: 0.6003
 epoch: 38, train_loss: 0.6778, test_loss: 1.0675, test_f1: 0.5419
 epoch: 39, train_loss: 0.7043, test_loss: 0.9386, test_f1: 0.6384
 epoch: 40, train_loss: 0.6717, test_loss: 1.0929, test_f1: 0.6071
 epoch: 41, train_loss: 0.6541, test_loss: 1.0709, test_f1: 0.6269
 epoch: 42, train_loss: 0.6476, test_loss: 1.0439, test_f1: 0.5821
 epoch: 43, train_loss: 0.6456, test_loss: 1.0435, test_f1: 0.6205
 epoch: 44, train_loss: 0.6505, test_loss: 1.0374, test_f1: 0.5991
 epoch: 45, train_loss: 0.6427, test_loss: 0.9876, test_f1: 0.6100
 epoch: 46, train_loss: 0.6204, test_loss: 1.0204, test_f1: 0.6231
 epoch: 47, train_loss: 0.6422, test_loss: 1.0157, test_f1: 0.6220
 epoch: 48, train_loss: 0.6305, test_loss: 1.0252, test_f1: 0.6127
 epoch: 49, train_loss: 0.6497, test_loss: 0.9354, test_f1: 0.6484
 epoch: 50, train_loss: 0.6364, test_loss: 1.0500, test_f1: 0.6362
 epoch: 51, train_loss: 0.5905, test_loss: 1.0478, test_f1: 0.6448
 epoch: 52, train_loss: 0.5599, test_loss: 1.0058, test_f1: 0.6400
 epoch: 53, train_loss: 0.5630, test_loss: 1.0362, test_f1: 0.6306
 epoch: 54, train_loss: 0.5537, test_loss: 1.1272, test_f1: 0.6485
 epoch: 55, train_loss: 0.5237, test_loss: 1.1524, test_f1: 0.6443
 epoch: 56, train_loss: 0.5380, test_loss: 1.1020, test_f1: 0.6503
 epoch: 57, train_loss: 0.5340, test_loss: 1.1699, test_f1: 0.6443
 epoch: 58, train_loss: 0.5140, test_loss: 1.1984, test_f1: 0.6355
 epoch: 59, train_loss: 0.5010, test_loss: 1.2381, test_f1: 0.6383
 epoch: 60, train_loss: 0.5052, test_loss: 1.2228, test_f1: 0.6223
 epoch: 61, train_loss: 0.5196, test_loss: 1.3266, test_f1: 0.5319
 epoch: 62, train_loss: 0.5226, test_loss: 1.2244, test_f1: 0.6468
 epoch: 63, train_loss: 0.5063, test_loss: 1.2986, test_f1: 0.6098
 epoch: 64, train_loss: 0.4893, test_loss: 1.1988, test_f1: 0.6569
 epoch: 65, train_loss: 0.5120, test_loss: 1.1489, test_f1: 0.6656
 epoch: 66, train_loss: 0.4869, test_loss: 1.3026, test_f1: 0.6365
 epoch: 67, train_loss: 0.4878, test_loss: 1.3925, test_f1: 0.6254
 epoch: 68, train_loss: 0.5052, test_loss: 1.2046, test_f1: 0.6249
 epoch: 69, train_loss: 0.4848, test_loss: 1.2584, test_f1: 0.6134
 epoch: 70, train_loss: 0.4793, test_loss: 1.2244, test_f1: 0.6389
 epoch: 71, train_loss: 0.4731, test_loss: 1.3789, test_f1: 0.6310
 epoch: 72, train_loss: 0.4775, test_loss: 1.3243, test_f1: 0.6327
 epoch: 73, train_loss: 0.4634, test_loss: 1.3471, test_f1: 0.6557
 epoch: 74, train_loss: 0.4625, test_loss: 1.4353, test_f1: 0.6221
 epoch: 75, train_loss: 0.4691, test_loss: 1.3404, test_f1: 0.6428
 epoch: 76, train_loss: 0.4804, test_loss: 1.2368, test_f1: 0.6496
 epoch: 77, train_loss: 0.4769, test_loss: 1.3069, test_f1: 0.6349
 epoch: 78, train_loss: 0.4525, test_loss: 1.4035, test_f1: 0.6425
 epoch: 79, train_loss: 0.4493, test_loss: 1.3437, test_f1: 0.6149
 epoch: 80, train_loss: 0.4528, test_loss: 1.7139, test_f1: 0.6269
 epoch: 81, train_loss: 0.4497, test_loss: 1.3905, test_f1: 0.6147
 epoch: 82, train_loss: 0.4473, test_loss: 1.2118, test_f1: 0.6221
 epoch: 83, train_loss: 0.4493, test_loss: 1.5499, test_f1: 0.6567
 epoch: 84, train_loss: 0.4427, test_loss: 1.4773, test_f1: 0.5988
 epoch: 85, train_loss: 0.4499, test_loss: 1.5031, test_f1: 0.6187
 epoch: 86, train_loss: 0.4480, test_loss: 1.2942, test_f1: 0.6293
 epoch: 87, train_loss: 0.4467, test_loss: 1.4011, test_f1: 0.6156
 epoch: 88, train_loss: 0.4345, test_loss: 1.4846, test_f1: 0.6058
 epoch: 89, train_loss: 0.4123, test_loss: 1.5889, test_f1: 0.6339
 epoch: 90, train_loss: 0.4271, test_loss: 1.5214, test_f1: 0.6449
 epoch: 91, train_loss: 0.4309, test_loss: 1.4322, test_f1: 0.6325
 epoch: 92, train_loss: 0.4198, test_loss: 1.3887, test_f1: 0.6426
 epoch: 93, train_loss: 0.4144, test_loss: 1.2506, test_f1: 0.6177
 epoch: 94, train_loss: 0.4092, test_loss: 1.4449, test_f1: 0.6190
 epoch: 95, train_loss: 0.4283, test_loss: 1.6065, test_f1: 0.6221
 epoch: 96, train_loss: 0.4259, test_loss: 1.4422, test_f1: 0.6056
 epoch: 97, train_loss: 0.4081, test_loss: 1.4091, test_f1: 0.6313
 epoch: 98, train_loss: 0.4006, test_loss: 1.4925, test_f1: 0.6592
 epoch: 99, train_loss: 0.3963, test_loss: 1.5471, test_f1: 0.6362
##################ITERATION #7 ****************************************
 epoch: 0, train_loss: 1.3144, test_loss: 1.2285, test_f1: 0.3259
 epoch: 1, train_loss: 1.0395, test_loss: 1.0039, test_f1: 0.4482
 epoch: 2, train_loss: 0.9938, test_loss: 0.9652, test_f1: 0.4756
 epoch: 3, train_loss: 0.9678, test_loss: 0.9474, test_f1: 0.4558
 epoch: 4, train_loss: 0.9419, test_loss: 0.9944, test_f1: 0.5137
 epoch: 5, train_loss: 0.9253, test_loss: 0.9741, test_f1: 0.4855
 epoch: 6, train_loss: 0.9291, test_loss: 0.9663, test_f1: 0.4771
 epoch: 7, train_loss: 0.9055, test_loss: 0.9290, test_f1: 0.5060
 epoch: 8, train_loss: 0.9026, test_loss: 0.9543, test_f1: 0.5768
 epoch: 9, train_loss: 0.8966, test_loss: 0.9481, test_f1: 0.5546
 epoch: 10, train_loss: 0.8703, test_loss: 1.0598, test_f1: 0.4996
 epoch: 11, train_loss: 0.8737, test_loss: 0.9797, test_f1: 0.5630
 epoch: 12, train_loss: 0.8521, test_loss: 0.9977, test_f1: 0.5087
 epoch: 13, train_loss: 0.8458, test_loss: 1.0003, test_f1: 0.5442
 epoch: 14, train_loss: 0.8309, test_loss: 0.9793, test_f1: 0.5642
 epoch: 15, train_loss: 0.8336, test_loss: 0.9413, test_f1: 0.5739
 epoch: 16, train_loss: 0.8296, test_loss: 0.9490, test_f1: 0.5471
 epoch: 17, train_loss: 0.8200, test_loss: 0.9257, test_f1: 0.5506
 epoch: 18, train_loss: 0.8114, test_loss: 1.0177, test_f1: 0.5598
 epoch: 19, train_loss: 0.8211, test_loss: 1.0179, test_f1: 0.4964
 epoch: 20, train_loss: 0.8221, test_loss: 0.9410, test_f1: 0.5620
 epoch: 21, train_loss: 0.7957, test_loss: 0.8900, test_f1: 0.5818
 epoch: 22, train_loss: 0.7909, test_loss: 0.9249, test_f1: 0.5680
 epoch: 23, train_loss: 0.7849, test_loss: 0.9152, test_f1: 0.5696
 epoch: 24, train_loss: 0.7729, test_loss: 0.9175, test_f1: 0.5653
 epoch: 25, train_loss: 0.7754, test_loss: 1.0923, test_f1: 0.5395
 epoch: 26, train_loss: 0.7546, test_loss: 0.8761, test_f1: 0.5663
 epoch: 27, train_loss: 0.7462, test_loss: 1.0300, test_f1: 0.5620
 epoch: 28, train_loss: 0.7507, test_loss: 0.9533, test_f1: 0.5716
 epoch: 29, train_loss: 0.7463, test_loss: 0.8975, test_f1: 0.6099
 epoch: 30, train_loss: 0.7466, test_loss: 0.9213, test_f1: 0.5922
 epoch: 31, train_loss: 0.7191, test_loss: 0.9107, test_f1: 0.6280
 epoch: 32, train_loss: 0.7270, test_loss: 1.0867, test_f1: 0.5893
 epoch: 33, train_loss: 0.7312, test_loss: 1.0359, test_f1: 0.5509
 epoch: 34, train_loss: 0.7239, test_loss: 0.9458, test_f1: 0.6106
 epoch: 35, train_loss: 0.7054, test_loss: 1.1294, test_f1: 0.5307
 epoch: 36, train_loss: 0.7102, test_loss: 0.8879, test_f1: 0.6041
 epoch: 37, train_loss: 0.7047, test_loss: 0.9397, test_f1: 0.6130
 epoch: 38, train_loss: 0.7074, test_loss: 0.9190, test_f1: 0.6144
 epoch: 39, train_loss: 0.6804, test_loss: 0.9916, test_f1: 0.6305
 epoch: 40, train_loss: 0.6709, test_loss: 1.0224, test_f1: 0.5817
 epoch: 41, train_loss: 0.6930, test_loss: 0.8995, test_f1: 0.6213
 epoch: 42, train_loss: 0.6797, test_loss: 1.1138, test_f1: 0.5671
 epoch: 43, train_loss: 0.6499, test_loss: 0.9669, test_f1: 0.5884
 epoch: 44, train_loss: 0.6642, test_loss: 1.0483, test_f1: 0.5852
 epoch: 45, train_loss: 0.6555, test_loss: 1.0446, test_f1: 0.5859
 epoch: 46, train_loss: 0.6754, test_loss: 0.9067, test_f1: 0.6298
 epoch: 47, train_loss: 0.6444, test_loss: 0.9434, test_f1: 0.6334
 epoch: 48, train_loss: 0.6700, test_loss: 1.1016, test_f1: 0.6043
 epoch: 49, train_loss: 0.6548, test_loss: 0.9479, test_f1: 0.6428
 epoch: 50, train_loss: 0.6478, test_loss: 1.0823, test_f1: 0.5993
 epoch: 51, train_loss: 0.6145, test_loss: 0.9545, test_f1: 0.6205
 epoch: 52, train_loss: 0.5832, test_loss: 0.9991, test_f1: 0.6526
 epoch: 53, train_loss: 0.5769, test_loss: 0.9304, test_f1: 0.6460
 epoch: 54, train_loss: 0.5516, test_loss: 0.9926, test_f1: 0.6311
 epoch: 55, train_loss: 0.5612, test_loss: 0.9675, test_f1: 0.6382
 epoch: 56, train_loss: 0.5667, test_loss: 1.0109, test_f1: 0.6336
 epoch: 57, train_loss: 0.5442, test_loss: 1.0184, test_f1: 0.6327
 epoch: 58, train_loss: 0.5389, test_loss: 0.9947, test_f1: 0.6290
 epoch: 59, train_loss: 0.5475, test_loss: 1.0119, test_f1: 0.6506
 epoch: 60, train_loss: 0.5288, test_loss: 0.9877, test_f1: 0.6383
 epoch: 61, train_loss: 0.5359, test_loss: 1.0386, test_f1: 0.6444
 epoch: 62, train_loss: 0.5286, test_loss: 1.0242, test_f1: 0.6381
 epoch: 63, train_loss: 0.5345, test_loss: 1.0232, test_f1: 0.6505
 epoch: 64, train_loss: 0.5185, test_loss: 1.0249, test_f1: 0.6277
 epoch: 65, train_loss: 0.5066, test_loss: 1.1253, test_f1: 0.6099
 epoch: 66, train_loss: 0.5206, test_loss: 1.0902, test_f1: 0.6342
 epoch: 67, train_loss: 0.5135, test_loss: 1.0508, test_f1: 0.6436
 epoch: 68, train_loss: 0.5220, test_loss: 1.1110, test_f1: 0.6338
 epoch: 69, train_loss: 0.4905, test_loss: 1.0285, test_f1: 0.6361
 epoch: 70, train_loss: 0.4930, test_loss: 1.0555, test_f1: 0.6358
 epoch: 71, train_loss: 0.5369, test_loss: 1.1113, test_f1: 0.6365
 epoch: 72, train_loss: 0.5012, test_loss: 1.0636, test_f1: 0.6335
 epoch: 73, train_loss: 0.5120, test_loss: 1.1352, test_f1: 0.6235
 epoch: 74, train_loss: 0.4937, test_loss: 1.0759, test_f1: 0.6403
 epoch: 75, train_loss: 0.5038, test_loss: 1.0984, test_f1: 0.6236
 epoch: 76, train_loss: 0.4984, test_loss: 1.0929, test_f1: 0.6100
 epoch: 77, train_loss: 0.4723, test_loss: 1.0829, test_f1: 0.6473
 epoch: 78, train_loss: 0.4835, test_loss: 1.0699, test_f1: 0.6469
 epoch: 79, train_loss: 0.4713, test_loss: 1.1861, test_f1: 0.6281
 epoch: 80, train_loss: 0.4950, test_loss: 1.1319, test_f1: 0.6763
 epoch: 81, train_loss: 0.4585, test_loss: 1.1275, test_f1: 0.6441
 epoch: 82, train_loss: 0.4727, test_loss: 1.1065, test_f1: 0.6741
 epoch: 83, train_loss: 0.4540, test_loss: 1.2020, test_f1: 0.6497
 epoch: 84, train_loss: 0.4632, test_loss: 1.0912, test_f1: 0.6288
 epoch: 85, train_loss: 0.4718, test_loss: 1.2301, test_f1: 0.6363
 epoch: 86, train_loss: 0.4629, test_loss: 1.1785, test_f1: 0.6376
 epoch: 87, train_loss: 0.4622, test_loss: 1.1576, test_f1: 0.6570
 epoch: 88, train_loss: 0.4713, test_loss: 1.1366, test_f1: 0.6183
 epoch: 89, train_loss: 0.4597, test_loss: 1.1118, test_f1: 0.6652
 epoch: 90, train_loss: 0.4269, test_loss: 1.0760, test_f1: 0.6512
 epoch: 91, train_loss: 0.4531, test_loss: 1.2324, test_f1: 0.6395
 epoch: 92, train_loss: 0.4461, test_loss: 1.1405, test_f1: 0.6553
 epoch: 93, train_loss: 0.4374, test_loss: 1.2074, test_f1: 0.6380
 epoch: 94, train_loss: 0.4361, test_loss: 1.1945, test_f1: 0.6675
 epoch: 95, train_loss: 0.4465, test_loss: 1.1981, test_f1: 0.6528
 epoch: 96, train_loss: 0.4145, test_loss: 1.2402, test_f1: 0.6330
 epoch: 97, train_loss: 0.4312, test_loss: 1.1379, test_f1: 0.6306
 epoch: 98, train_loss: 0.4448, test_loss: 1.2798, test_f1: 0.6317
 epoch: 99, train_loss: 0.4310, test_loss: 1.1631, test_f1: 0.6416
##################ITERATION #8 ****************************************
 epoch: 0, train_loss: 1.3777, test_loss: 1.2753, test_f1: 0.2374
 epoch: 1, train_loss: 1.0985, test_loss: 1.0589, test_f1: 0.4084
 epoch: 2, train_loss: 1.0279, test_loss: 1.0038, test_f1: 0.4571
 epoch: 3, train_loss: 0.9879, test_loss: 1.0233, test_f1: 0.4784
 epoch: 4, train_loss: 0.9543, test_loss: 0.9997, test_f1: 0.5298
 epoch: 5, train_loss: 0.9461, test_loss: 0.9341, test_f1: 0.5134
 epoch: 6, train_loss: 0.9430, test_loss: 0.9440, test_f1: 0.5148
 epoch: 7, train_loss: 0.9276, test_loss: 0.9260, test_f1: 0.5666
 epoch: 8, train_loss: 0.9270, test_loss: 0.9593, test_f1: 0.5482
 epoch: 9, train_loss: 0.9024, test_loss: 1.0028, test_f1: 0.5474
 epoch: 10, train_loss: 0.8908, test_loss: 0.9117, test_f1: 0.5306
 epoch: 11, train_loss: 0.8775, test_loss: 0.8603, test_f1: 0.5593
 epoch: 12, train_loss: 0.8481, test_loss: 0.9486, test_f1: 0.5104
 epoch: 13, train_loss: 0.8603, test_loss: 0.8963, test_f1: 0.5472
 epoch: 14, train_loss: 0.8470, test_loss: 1.0333, test_f1: 0.4600
 epoch: 15, train_loss: 0.8397, test_loss: 0.8459, test_f1: 0.5912
 epoch: 16, train_loss: 0.8258, test_loss: 0.8714, test_f1: 0.5752
 epoch: 17, train_loss: 0.8109, test_loss: 0.9091, test_f1: 0.5663
 epoch: 18, train_loss: 0.8035, test_loss: 0.9073, test_f1: 0.5900
 epoch: 19, train_loss: 0.8033, test_loss: 0.8540, test_f1: 0.5669
 epoch: 20, train_loss: 0.8171, test_loss: 0.8382, test_f1: 0.5703
 epoch: 21, train_loss: 0.7935, test_loss: 0.9024, test_f1: 0.5660
 epoch: 22, train_loss: 0.8018, test_loss: 0.9597, test_f1: 0.5424
 epoch: 23, train_loss: 0.7858, test_loss: 1.0195, test_f1: 0.4923
 epoch: 24, train_loss: 0.8336, test_loss: 0.9062, test_f1: 0.5482
 epoch: 25, train_loss: 0.7956, test_loss: 0.9608, test_f1: 0.5345
 epoch: 26, train_loss: 0.7795, test_loss: 0.8662, test_f1: 0.5729
 epoch: 27, train_loss: 0.7483, test_loss: 1.0001, test_f1: 0.5320
 epoch: 28, train_loss: 0.7495, test_loss: 0.9760, test_f1: 0.5531
 epoch: 29, train_loss: 0.7310, test_loss: 0.8795, test_f1: 0.6031
 epoch: 30, train_loss: 0.7345, test_loss: 0.8999, test_f1: 0.6171
 epoch: 31, train_loss: 0.7342, test_loss: 1.0112, test_f1: 0.5740
 epoch: 32, train_loss: 0.7247, test_loss: 0.8626, test_f1: 0.6336
 epoch: 33, train_loss: 0.7139, test_loss: 0.9214, test_f1: 0.6111
 epoch: 34, train_loss: 0.6884, test_loss: 1.0230, test_f1: 0.5877
 epoch: 35, train_loss: 0.6994, test_loss: 0.9932, test_f1: 0.6039
 epoch: 36, train_loss: 0.6964, test_loss: 1.0500, test_f1: 0.5895
 epoch: 37, train_loss: 0.7073, test_loss: 0.9897, test_f1: 0.5989
 epoch: 38, train_loss: 0.6910, test_loss: 1.0463, test_f1: 0.6070
 epoch: 39, train_loss: 0.6682, test_loss: 0.9497, test_f1: 0.6013
 epoch: 40, train_loss: 0.7035, test_loss: 1.0626, test_f1: 0.5994
 epoch: 41, train_loss: 0.6679, test_loss: 1.0594, test_f1: 0.5710
 epoch: 42, train_loss: 0.6682, test_loss: 0.9819, test_f1: 0.6167
 epoch: 43, train_loss: 0.6685, test_loss: 1.1190, test_f1: 0.5981
 epoch: 44, train_loss: 0.6455, test_loss: 0.9422, test_f1: 0.6315
 epoch: 45, train_loss: 0.6274, test_loss: 1.0925, test_f1: 0.6195
 epoch: 46, train_loss: 0.6537, test_loss: 0.9995, test_f1: 0.6299
 epoch: 47, train_loss: 0.6253, test_loss: 1.0423, test_f1: 0.6137
 epoch: 48, train_loss: 0.6265, test_loss: 1.0362, test_f1: 0.5912
 epoch: 49, train_loss: 0.6280, test_loss: 1.0198, test_f1: 0.6060
 epoch: 50, train_loss: 0.6445, test_loss: 0.9587, test_f1: 0.6171
 epoch: 51, train_loss: 0.6077, test_loss: 1.0297, test_f1: 0.6276
 epoch: 52, train_loss: 0.5798, test_loss: 1.0535, test_f1: 0.5909
 epoch: 53, train_loss: 0.5612, test_loss: 1.0401, test_f1: 0.6411
 epoch: 54, train_loss: 0.5528, test_loss: 1.0057, test_f1: 0.6377
 epoch: 55, train_loss: 0.5400, test_loss: 0.9932, test_f1: 0.6524
 epoch: 56, train_loss: 0.5254, test_loss: 0.9957, test_f1: 0.6557
 epoch: 57, train_loss: 0.5511, test_loss: 1.0526, test_f1: 0.6013
 epoch: 58, train_loss: 0.5173, test_loss: 1.0174, test_f1: 0.6292
 epoch: 59, train_loss: 0.5290, test_loss: 1.1076, test_f1: 0.6135
 epoch: 60, train_loss: 0.5325, test_loss: 1.0927, test_f1: 0.6589
 epoch: 61, train_loss: 0.5243, test_loss: 1.1251, test_f1: 0.6398
 epoch: 62, train_loss: 0.5131, test_loss: 1.0620, test_f1: 0.6539
 epoch: 63, train_loss: 0.5132, test_loss: 1.0820, test_f1: 0.6335
 epoch: 64, train_loss: 0.5274, test_loss: 1.0218, test_f1: 0.6248
 epoch: 65, train_loss: 0.5165, test_loss: 1.1151, test_f1: 0.6417
 epoch: 66, train_loss: 0.5348, test_loss: 1.2620, test_f1: 0.6347
 epoch: 67, train_loss: 0.5059, test_loss: 1.1978, test_f1: 0.6267
 epoch: 68, train_loss: 0.4835, test_loss: 1.1876, test_f1: 0.6847
 epoch: 69, train_loss: 0.5055, test_loss: 1.1576, test_f1: 0.6260
 epoch: 70, train_loss: 0.4928, test_loss: 1.2091, test_f1: 0.6498
 epoch: 71, train_loss: 0.4807, test_loss: 0.9332, test_f1: 0.6546
 epoch: 72, train_loss: 0.4923, test_loss: 1.2612, test_f1: 0.6557
 epoch: 73, train_loss: 0.5261, test_loss: 1.0759, test_f1: 0.6377
 epoch: 74, train_loss: 0.4937, test_loss: 1.1514, test_f1: 0.6253
 epoch: 75, train_loss: 0.5044, test_loss: 1.1375, test_f1: 0.6025
 epoch: 76, train_loss: 0.4976, test_loss: 1.2977, test_f1: 0.6526
 epoch: 77, train_loss: 0.4999, test_loss: 1.2802, test_f1: 0.6240
 epoch: 78, train_loss: 0.4793, test_loss: 1.2747, test_f1: 0.6442
 epoch: 79, train_loss: 0.4805, test_loss: 1.2773, test_f1: 0.6306
 epoch: 80, train_loss: 0.4721, test_loss: 1.2134, test_f1: 0.6522
 epoch: 81, train_loss: 0.4999, test_loss: 1.1108, test_f1: 0.6593
 epoch: 82, train_loss: 0.4589, test_loss: 1.1196, test_f1: 0.6713
 epoch: 83, train_loss: 0.4482, test_loss: 1.1384, test_f1: 0.6485
 epoch: 84, train_loss: 0.4396, test_loss: 1.2333, test_f1: 0.6536
 epoch: 85, train_loss: 0.4548, test_loss: 1.2465, test_f1: 0.6022
 epoch: 86, train_loss: 0.4845, test_loss: 1.1367, test_f1: 0.6483
 epoch: 87, train_loss: 0.4463, test_loss: 1.2128, test_f1: 0.6092
 epoch: 88, train_loss: 0.4616, test_loss: 1.0362, test_f1: 0.6262
 epoch: 89, train_loss: 0.4520, test_loss: 1.2580, test_f1: 0.6274
 epoch: 90, train_loss: 0.4378, test_loss: 1.2202, test_f1: 0.6454
 epoch: 91, train_loss: 0.4336, test_loss: 1.2999, test_f1: 0.6439
 epoch: 92, train_loss: 0.4371, test_loss: 1.1931, test_f1: 0.6292
 epoch: 93, train_loss: 0.4297, test_loss: 1.1802, test_f1: 0.6523
 epoch: 94, train_loss: 0.4399, test_loss: 1.2595, test_f1: 0.6312
 epoch: 95, train_loss: 0.4456, test_loss: 1.2263, test_f1: 0.6276
 epoch: 96, train_loss: 0.4539, test_loss: 1.2642, test_f1: 0.6160
 epoch: 97, train_loss: 0.4443, test_loss: 1.2869, test_f1: 0.6210
 epoch: 98, train_loss: 0.4435, test_loss: 1.2017, test_f1: 0.6407
 epoch: 99, train_loss: 0.4268, test_loss: 1.3329, test_f1: 0.6088
##################ITERATION #9 ****************************************
 epoch: 0, train_loss: 1.2301, test_loss: 1.3365, test_f1: 0.2649
 epoch: 1, train_loss: 1.0195, test_loss: 1.0381, test_f1: 0.4421
 epoch: 2, train_loss: 0.9663, test_loss: 1.0541, test_f1: 0.4770
 epoch: 3, train_loss: 0.9376, test_loss: 0.9795, test_f1: 0.5123
 epoch: 4, train_loss: 0.9076, test_loss: 1.0242, test_f1: 0.5157
 epoch: 5, train_loss: 0.9027, test_loss: 0.9637, test_f1: 0.4953
 epoch: 6, train_loss: 0.9047, test_loss: 0.9100, test_f1: 0.5157
 epoch: 7, train_loss: 0.8938, test_loss: 0.9726, test_f1: 0.5412
 epoch: 8, train_loss: 0.8600, test_loss: 0.9627, test_f1: 0.5210
 epoch: 9, train_loss: 0.8680, test_loss: 0.9427, test_f1: 0.5519
 epoch: 10, train_loss: 0.8551, test_loss: 0.9639, test_f1: 0.4808
 epoch: 11, train_loss: 0.8478, test_loss: 0.9712, test_f1: 0.5522
 epoch: 12, train_loss: 0.8337, test_loss: 0.8865, test_f1: 0.5686
 epoch: 13, train_loss: 0.8460, test_loss: 1.2197, test_f1: 0.4236
 epoch: 14, train_loss: 0.8509, test_loss: 0.9623, test_f1: 0.5321
 epoch: 15, train_loss: 0.8371, test_loss: 0.9546, test_f1: 0.5710
 epoch: 16, train_loss: 0.8056, test_loss: 0.9830, test_f1: 0.5544
 epoch: 17, train_loss: 0.8212, test_loss: 0.8685, test_f1: 0.5654
 epoch: 18, train_loss: 0.8162, test_loss: 0.9468, test_f1: 0.5251
 epoch: 19, train_loss: 0.8080, test_loss: 0.9007, test_f1: 0.5563
 epoch: 20, train_loss: 0.7795, test_loss: 0.9207, test_f1: 0.5672
 epoch: 21, train_loss: 0.7871, test_loss: 1.0553, test_f1: 0.5308
 epoch: 22, train_loss: 0.7886, test_loss: 0.9730, test_f1: 0.5361
 epoch: 23, train_loss: 0.7846, test_loss: 0.9609, test_f1: 0.5618
 epoch: 24, train_loss: 0.7878, test_loss: 1.0054, test_f1: 0.5963
 epoch: 25, train_loss: 0.7722, test_loss: 1.0861, test_f1: 0.5612
 epoch: 26, train_loss: 0.7445, test_loss: 0.9843, test_f1: 0.6003
 epoch: 27, train_loss: 0.7444, test_loss: 0.9224, test_f1: 0.5815
 epoch: 28, train_loss: 0.7438, test_loss: 0.9164, test_f1: 0.5861
 epoch: 29, train_loss: 0.7475, test_loss: 1.1914, test_f1: 0.5497
 epoch: 30, train_loss: 0.7290, test_loss: 0.9518, test_f1: 0.5842
 epoch: 31, train_loss: 0.7296, test_loss: 0.8993, test_f1: 0.5466
 epoch: 32, train_loss: 0.7288, test_loss: 1.0209, test_f1: 0.6188
 epoch: 33, train_loss: 0.7223, test_loss: 1.0720, test_f1: 0.5175
 epoch: 34, train_loss: 0.7148, test_loss: 0.9815, test_f1: 0.5728
 epoch: 35, train_loss: 0.7117, test_loss: 1.1225, test_f1: 0.5589
 epoch: 36, train_loss: 0.7012, test_loss: 1.1561, test_f1: 0.5661
 epoch: 37, train_loss: 0.7090, test_loss: 1.0163, test_f1: 0.5837
 epoch: 38, train_loss: 0.6873, test_loss: 1.0601, test_f1: 0.5938
 epoch: 39, train_loss: 0.6943, test_loss: 1.0475, test_f1: 0.6030
 epoch: 40, train_loss: 0.6694, test_loss: 0.8348, test_f1: 0.5897
 epoch: 41, train_loss: 0.6610, test_loss: 1.0431, test_f1: 0.5886
 epoch: 42, train_loss: 0.6747, test_loss: 0.9702, test_f1: 0.6127
 epoch: 43, train_loss: 0.6669, test_loss: 0.9203, test_f1: 0.6262
 epoch: 44, train_loss: 0.6749, test_loss: 1.0555, test_f1: 0.5865
 epoch: 45, train_loss: 0.6723, test_loss: 0.9637, test_f1: 0.6373
 epoch: 46, train_loss: 0.6636, test_loss: 1.0143, test_f1: 0.6209
 epoch: 47, train_loss: 0.6528, test_loss: 1.0491, test_f1: 0.6458
 epoch: 48, train_loss: 0.6316, test_loss: 1.0774, test_f1: 0.6315
 epoch: 49, train_loss: 0.6364, test_loss: 1.3221, test_f1: 0.5857
 epoch: 50, train_loss: 0.6579, test_loss: 0.9098, test_f1: 0.5773
 epoch: 51, train_loss: 0.6213, test_loss: 1.0586, test_f1: 0.6269
 epoch: 52, train_loss: 0.5805, test_loss: 1.0182, test_f1: 0.6345
 epoch: 53, train_loss: 0.5581, test_loss: 1.0182, test_f1: 0.6357
 epoch: 54, train_loss: 0.5601, test_loss: 1.2128, test_f1: 0.6384
 epoch: 55, train_loss: 0.5477, test_loss: 0.9360, test_f1: 0.6160
 epoch: 56, train_loss: 0.5474, test_loss: 1.0203, test_f1: 0.6248
 epoch: 57, train_loss: 0.5361, test_loss: 1.0398, test_f1: 0.6327
 epoch: 58, train_loss: 0.5539, test_loss: 1.1638, test_f1: 0.6391
 epoch: 59, train_loss: 0.5365, test_loss: 1.1277, test_f1: 0.6259
 epoch: 60, train_loss: 0.5179, test_loss: 1.0399, test_f1: 0.6505
 epoch: 61, train_loss: 0.5267, test_loss: 1.0237, test_f1: 0.6389
 epoch: 62, train_loss: 0.5202, test_loss: 1.3469, test_f1: 0.5969
 epoch: 63, train_loss: 0.5216, test_loss: 1.2469, test_f1: 0.6294
 epoch: 64, train_loss: 0.5126, test_loss: 1.1740, test_f1: 0.6462
 epoch: 65, train_loss: 0.5188, test_loss: 1.1613, test_f1: 0.6298
 epoch: 66, train_loss: 0.4988, test_loss: 1.2516, test_f1: 0.6524
 epoch: 67, train_loss: 0.5070, test_loss: 1.1601, test_f1: 0.6573
 epoch: 68, train_loss: 0.4982, test_loss: 1.2454, test_f1: 0.6518
 epoch: 69, train_loss: 0.5158, test_loss: 1.1634, test_f1: 0.6343
 epoch: 70, train_loss: 0.5156, test_loss: 1.1107, test_f1: 0.6429
 epoch: 71, train_loss: 0.5107, test_loss: 1.2546, test_f1: 0.6277
 epoch: 72, train_loss: 0.5050, test_loss: 1.1399, test_f1: 0.6314
 epoch: 73, train_loss: 0.4920, test_loss: 1.2432, test_f1: 0.6515
 epoch: 74, train_loss: 0.4758, test_loss: 1.2929, test_f1: 0.6468
 epoch: 75, train_loss: 0.4698, test_loss: 1.2228, test_f1: 0.6554
 epoch: 76, train_loss: 0.5018, test_loss: 1.3461, test_f1: 0.6057
 epoch: 77, train_loss: 0.4954, test_loss: 1.2267, test_f1: 0.6219
 epoch: 78, train_loss: 0.4677, test_loss: 1.2090, test_f1: 0.6305
 epoch: 79, train_loss: 0.4598, test_loss: 1.2940, test_f1: 0.6325
 epoch: 80, train_loss: 0.4847, test_loss: 1.2111, test_f1: 0.6238
 epoch: 81, train_loss: 0.4629, test_loss: 1.3233, test_f1: 0.6390
 epoch: 82, train_loss: 0.4697, test_loss: 1.2459, test_f1: 0.6462
 epoch: 83, train_loss: 0.4740, test_loss: 1.2233, test_f1: 0.6510
 epoch: 84, train_loss: 0.4643, test_loss: 1.2950, test_f1: 0.6236
 epoch: 85, train_loss: 0.4426, test_loss: 1.1374, test_f1: 0.6542
 epoch: 86, train_loss: 0.4477, test_loss: 1.1605, test_f1: 0.6700
 epoch: 87, train_loss: 0.4476, test_loss: 1.2572, test_f1: 0.6330
 epoch: 88, train_loss: 0.4299, test_loss: 1.1963, test_f1: 0.6883
 epoch: 89, train_loss: 0.4141, test_loss: 1.2113, test_f1: 0.6649
 epoch: 90, train_loss: 0.4285, test_loss: 1.1949, test_f1: 0.6554
 epoch: 91, train_loss: 0.4649, test_loss: 1.2074, test_f1: 0.6508
 epoch: 92, train_loss: 0.4339, test_loss: 1.4236, test_f1: 0.6277
 epoch: 93, train_loss: 0.4330, test_loss: 1.2959, test_f1: 0.6394
 epoch: 94, train_loss: 0.4246, test_loss: 1.1689, test_f1: 0.6455
 epoch: 95, train_loss: 0.4216, test_loss: 1.2222, test_f1: 0.6647
 epoch: 96, train_loss: 0.4274, test_loss: 1.3069, test_f1: 0.6496
 epoch: 97, train_loss: 0.4373, test_loss: 1.1809, test_f1: 0.6501
 epoch: 98, train_loss: 0.4235, test_loss: 1.2223, test_f1: 0.6478
 epoch: 99, train_loss: 0.4250, test_loss: 1.2201, test_f1: 0.6707

Training completed in 459.24 seconds
Best F1: 0.7055 at epoch 84
Mean F1 across iterations: 0.6798  0.0120
========================FINAL RESULTS================================
FEGIN weighted F1: 0.7055  0.0120
python main.py --data ltspice_examples --representation component_net --model FEGIN --layers 3 --hiddens 64 --batch_size 128 --lr 0.01 --emb_size 250 --epochs 100 --save_appendix component_net_L3_H64_BS128_LR0.01_E250 --no_val
-----



STDERR:
  File "main.py", line 370, in <module>
    main()
  File "main.py", line 254, in main
    dataset = dataset_class(
  File "/home/philip/projects/ltspice_examples_code_repo/Circuit-Completion-Using-GNNs/component_classification_with_link_prediction_head/evaluation/FEGIN/kernel/circuit_datasets.py", line 15, in __init__
    self.data, self.slices = torch.load(self.processed_paths[0])
  File "/home/philip/.local/lib/python3.8/site-packages/torch/serialization.py", line 1040, in load
    warnings.warn(
  File "/usr/lib/python3.8/warnings.py", line 109, in _showwarnmsg
    sw(msg.message, msg.category, msg.filename, msg.lineno,
  File "main.py", line 47, in warn_with_traceback
    traceback.print_stack(file=log)
/home/philip/projects/ltspice_examples_code_repo/Circuit-Completion-Using-GNNs/component_classification_with_link_prediction_head/evaluation/FEGIN/kernel/circuit_datasets.py:15: FutureWarning: You are using `torch.load` with `weights_only=False` (the current default value), which uses the default pickle module implicitly. It is possible to construct malicious pickle data which will execute arbitrary code during unpickling (See https://github.com/pytorch/pytorch/blob/main/SECURITY.md#untrusted-models for more details). In a future release, the default value for `weights_only` will be flipped to `True`. This limits the functions that could be executed during unpickling. Arbitrary objects will no longer be allowed to be loaded via this mode unless they are explicitly allowlisted by the user via `torch.serialization.add_safe_globals`. We recommend you start setting `weights_only=True` for any use case where you don't have full control of the loaded file. Please open an issue on GitHub for any issues related to this experimental feature.
  self.data, self.slices = torch.load(self.processed_paths[0])
