STDOUT:
Results will be saved in /home/philip/projects/ltspice_examples_code_repo/Circuit-Completion-Using-GNNs/component_classification_with_link_prediction_head/evaluation/FEGIN/results/model_FEGIN_dataset_ltspice_demos
Command line input: python main.py --data ltspice_demos --representation component_component --model FEGIN --layers 5 --hiddens 32 --batch_size 64 --lr 0.01 --emb_size 128 --epochs 100 --save_appendix component_component_L5_H32_BS64_LR0.01_E128 --no_val
 is saved.
-----
ltspice_demos - FEGIN
Using 5 layers, 32 hidden units, h = 2
Loading component_component representation dataset
ENTERED
Training FEGIN on component_component representation
Train: 1565, Test: 383
##################ITERATION #0 ****************************************
 epoch: 0, train_loss: 1.2570, test_loss: 1.3317, test_f1: 0.3110
 epoch: 1, train_loss: 1.1964, test_loss: 1.2550, test_f1: 0.2281
 epoch: 2, train_loss: 1.1324, test_loss: 1.2555, test_f1: 0.3560
 epoch: 3, train_loss: 1.1078, test_loss: 1.2639, test_f1: 0.3532
 epoch: 4, train_loss: 1.0691, test_loss: 1.2741, test_f1: 0.3629
 epoch: 5, train_loss: 1.0169, test_loss: 1.3085, test_f1: 0.4922
 epoch: 6, train_loss: 0.9574, test_loss: 1.3068, test_f1: 0.4952
 epoch: 7, train_loss: 0.9873, test_loss: 1.5074, test_f1: 0.3437
 epoch: 8, train_loss: 0.9546, test_loss: 1.2702, test_f1: 0.5309
 epoch: 9, train_loss: 0.9118, test_loss: 1.2380, test_f1: 0.5221
 epoch: 10, train_loss: 0.9001, test_loss: 1.3718, test_f1: 0.4278
 epoch: 11, train_loss: 0.9034, test_loss: 1.2089, test_f1: 0.4404
 epoch: 12, train_loss: 0.9031, test_loss: 1.0189, test_f1: 0.5374
 epoch: 13, train_loss: 0.8759, test_loss: 1.0892, test_f1: 0.5275
 epoch: 14, train_loss: 0.8579, test_loss: 1.0673, test_f1: 0.5389
 epoch: 15, train_loss: 0.8693, test_loss: 1.4093, test_f1: 0.5228
 epoch: 16, train_loss: 0.8791, test_loss: 1.1163, test_f1: 0.4812
 epoch: 17, train_loss: 0.8474, test_loss: 1.5375, test_f1: 0.5917
 epoch: 18, train_loss: 0.8204, test_loss: 1.2203, test_f1: 0.5656
 epoch: 19, train_loss: 0.8361, test_loss: 1.1642, test_f1: 0.4998
 epoch: 20, train_loss: 0.8167, test_loss: 1.1019, test_f1: 0.5950
 epoch: 21, train_loss: 0.8393, test_loss: 1.0361, test_f1: 0.5457
 epoch: 22, train_loss: 0.8068, test_loss: 2.9901, test_f1: 0.3240
 epoch: 23, train_loss: 0.8109, test_loss: 1.1778, test_f1: 0.5010
 epoch: 24, train_loss: 0.8059, test_loss: 1.0075, test_f1: 0.5078
 epoch: 25, train_loss: 0.8133, test_loss: 1.5866, test_f1: 0.3538
 epoch: 26, train_loss: 0.8073, test_loss: 1.0468, test_f1: 0.5936
 epoch: 27, train_loss: 0.7862, test_loss: 1.3383, test_f1: 0.5902
 epoch: 28, train_loss: 0.7903, test_loss: 1.1510, test_f1: 0.5520
 epoch: 29, train_loss: 0.7711, test_loss: 1.2325, test_f1: 0.5285
 epoch: 30, train_loss: 0.7451, test_loss: 1.1937, test_f1: 0.5716
 epoch: 31, train_loss: 0.7333, test_loss: 1.4226, test_f1: 0.4490
 epoch: 32, train_loss: 0.8924, test_loss: 1.4714, test_f1: 0.4891
 epoch: 33, train_loss: 0.8454, test_loss: 1.1538, test_f1: 0.5729
 epoch: 34, train_loss: 0.7958, test_loss: 1.3893, test_f1: 0.5481
 epoch: 35, train_loss: 0.7770, test_loss: 1.4175, test_f1: 0.5191
 epoch: 36, train_loss: 0.7596, test_loss: 1.1143, test_f1: 0.5769
 epoch: 37, train_loss: 0.7483, test_loss: 1.0769, test_f1: 0.5726
 epoch: 38, train_loss: 0.7661, test_loss: 1.4478, test_f1: 0.5541
 epoch: 39, train_loss: 0.7445, test_loss: 1.2462, test_f1: 0.5678
 epoch: 40, train_loss: 0.7394, test_loss: 1.3160, test_f1: 0.5670
 epoch: 41, train_loss: 0.7280, test_loss: 1.1573, test_f1: 0.6030
 epoch: 42, train_loss: 0.7582, test_loss: 1.1637, test_f1: 0.5061
 epoch: 43, train_loss: 0.7189, test_loss: 1.3462, test_f1: 0.5982
 epoch: 44, train_loss: 0.7105, test_loss: 1.3895, test_f1: 0.5475
 epoch: 45, train_loss: 0.7207, test_loss: 1.3085, test_f1: 0.5871
 epoch: 46, train_loss: 0.7072, test_loss: 1.1710, test_f1: 0.5490
 epoch: 47, train_loss: 0.6645, test_loss: 1.1978, test_f1: 0.5525
 epoch: 48, train_loss: 0.7222, test_loss: 1.5062, test_f1: 0.5255
 epoch: 49, train_loss: 0.7535, test_loss: 1.3338, test_f1: 0.5750
 epoch: 50, train_loss: 0.7042, test_loss: 1.2416, test_f1: 0.5574
 epoch: 51, train_loss: 0.6742, test_loss: 1.2693, test_f1: 0.5384
 epoch: 52, train_loss: 0.6371, test_loss: 1.4181, test_f1: 0.5608
 epoch: 53, train_loss: 0.6501, test_loss: 1.5230, test_f1: 0.5532
 epoch: 54, train_loss: 0.6124, test_loss: 1.4729, test_f1: 0.5747
 epoch: 55, train_loss: 0.6039, test_loss: 1.4516, test_f1: 0.5775
 epoch: 56, train_loss: 0.6078, test_loss: 1.5830, test_f1: 0.5779
 epoch: 57, train_loss: 0.6238, test_loss: 1.5518, test_f1: 0.5309
 epoch: 58, train_loss: 0.5877, test_loss: 1.5867, test_f1: 0.5730
 epoch: 59, train_loss: 0.5620, test_loss: 1.6801, test_f1: 0.5841
 epoch: 60, train_loss: 0.5915, test_loss: 1.6052, test_f1: 0.5861
 epoch: 61, train_loss: 0.5743, test_loss: 1.7633, test_f1: 0.5848
 epoch: 62, train_loss: 0.5819, test_loss: 1.7651, test_f1: 0.6047
 epoch: 63, train_loss: 0.5406, test_loss: 2.1310, test_f1: 0.4982
 epoch: 64, train_loss: 0.6164, test_loss: 2.0624, test_f1: 0.5633
 epoch: 65, train_loss: 0.6094, test_loss: 1.6150, test_f1: 0.5672
 epoch: 66, train_loss: 0.5828, test_loss: 1.7694, test_f1: 0.5576
 epoch: 67, train_loss: 0.5802, test_loss: 1.8902, test_f1: 0.5947
 epoch: 68, train_loss: 0.5666, test_loss: 1.5683, test_f1: 0.5390
 epoch: 69, train_loss: 0.5600, test_loss: 1.9826, test_f1: 0.5373
 epoch: 70, train_loss: 0.5552, test_loss: 2.3038, test_f1: 0.5501
 epoch: 71, train_loss: 0.5456, test_loss: 1.9817, test_f1: 0.5373
 epoch: 72, train_loss: 0.5617, test_loss: 1.7806, test_f1: 0.5516
 epoch: 73, train_loss: 0.5673, test_loss: 1.9420, test_f1: 0.5046
 epoch: 74, train_loss: 0.5647, test_loss: 1.8038, test_f1: 0.5603
 epoch: 75, train_loss: 0.5378, test_loss: 2.1509, test_f1: 0.5037
 epoch: 76, train_loss: 0.5277, test_loss: 1.8041, test_f1: 0.5240
 epoch: 77, train_loss: 0.5162, test_loss: 2.0241, test_f1: 0.5489
 epoch: 78, train_loss: 0.5479, test_loss: 2.2545, test_f1: 0.5374
 epoch: 79, train_loss: 0.5265, test_loss: 1.6571, test_f1: 0.5810
 epoch: 80, train_loss: 0.5331, test_loss: 1.9155, test_f1: 0.5596
 epoch: 81, train_loss: 0.4892, test_loss: 2.1241, test_f1: 0.5368
 epoch: 82, train_loss: 0.5370, test_loss: 2.0025, test_f1: 0.5113
 epoch: 83, train_loss: 0.4934, test_loss: 2.0583, test_f1: 0.5999
 epoch: 84, train_loss: 0.5003, test_loss: 2.2258, test_f1: 0.5453
 epoch: 85, train_loss: 0.5257, test_loss: 2.5126, test_f1: 0.5523
 epoch: 86, train_loss: 0.5031, test_loss: 2.4998, test_f1: 0.5629
 epoch: 87, train_loss: 0.4873, test_loss: 2.6495, test_f1: 0.5195
 epoch: 88, train_loss: 0.5209, test_loss: 2.1973, test_f1: 0.5348
 epoch: 89, train_loss: 0.4901, test_loss: 2.5012, test_f1: 0.4975
 epoch: 90, train_loss: 0.5101, test_loss: 2.0849, test_f1: 0.5580
 epoch: 91, train_loss: 0.5122, test_loss: 2.3732, test_f1: 0.5561
 epoch: 92, train_loss: 0.4956, test_loss: 2.5952, test_f1: 0.5151
 epoch: 93, train_loss: 0.4692, test_loss: 2.2783, test_f1: 0.5487
 epoch: 94, train_loss: 0.5145, test_loss: 2.8289, test_f1: 0.5182
 epoch: 95, train_loss: 0.5121, test_loss: 2.2753, test_f1: 0.5004
 epoch: 96, train_loss: 0.5041, test_loss: 2.5789, test_f1: 0.5639
 epoch: 97, train_loss: 0.4740, test_loss: 2.7135, test_f1: 0.5644
 epoch: 98, train_loss: 0.4879, test_loss: 2.3402, test_f1: 0.5679
 epoch: 99, train_loss: 0.4841, test_loss: 2.2093, test_f1: 0.5567
##################ITERATION #1 ****************************************
 epoch: 0, train_loss: 1.2332, test_loss: 1.6524, test_f1: 0.1909
 epoch: 1, train_loss: 1.1850, test_loss: 1.2647, test_f1: 0.3663
 epoch: 2, train_loss: 1.0976, test_loss: 1.3024, test_f1: 0.3988
 epoch: 3, train_loss: 1.0613, test_loss: 1.2235, test_f1: 0.4953
 epoch: 4, train_loss: 1.0224, test_loss: 1.2241, test_f1: 0.4912
 epoch: 5, train_loss: 0.9965, test_loss: 1.1422, test_f1: 0.5166
 epoch: 6, train_loss: 0.9807, test_loss: 1.2954, test_f1: 0.3936
 epoch: 7, train_loss: 0.9623, test_loss: 1.1735, test_f1: 0.4809
 epoch: 8, train_loss: 0.9551, test_loss: 1.1174, test_f1: 0.4410
 epoch: 9, train_loss: 0.9441, test_loss: 1.0818, test_f1: 0.4821
 epoch: 10, train_loss: 0.9380, test_loss: 1.1643, test_f1: 0.5097
 epoch: 11, train_loss: 0.9306, test_loss: 1.2352, test_f1: 0.4893
 epoch: 12, train_loss: 0.9182, test_loss: 1.1476, test_f1: 0.4624
 epoch: 13, train_loss: 0.9068, test_loss: 1.0988, test_f1: 0.4649
 epoch: 14, train_loss: 0.8922, test_loss: 1.2116, test_f1: 0.4895
 epoch: 15, train_loss: 0.9141, test_loss: 1.1274, test_f1: 0.5614
 epoch: 16, train_loss: 0.9211, test_loss: 1.2521, test_f1: 0.5024
 epoch: 17, train_loss: 0.8735, test_loss: 1.0781, test_f1: 0.5328
 epoch: 18, train_loss: 0.8766, test_loss: 1.1020, test_f1: 0.5002
 epoch: 19, train_loss: 0.8887, test_loss: 1.0297, test_f1: 0.5552
 epoch: 20, train_loss: 0.8649, test_loss: 1.1346, test_f1: 0.5661
 epoch: 21, train_loss: 0.8680, test_loss: 1.1183, test_f1: 0.5755
 epoch: 22, train_loss: 0.8683, test_loss: 1.1656, test_f1: 0.5533
 epoch: 23, train_loss: 0.8757, test_loss: 1.2255, test_f1: 0.5447
 epoch: 24, train_loss: 0.8818, test_loss: 2.2012, test_f1: 0.3551
 epoch: 25, train_loss: 0.8960, test_loss: 1.1024, test_f1: 0.5333
 epoch: 26, train_loss: 0.8765, test_loss: 1.0858, test_f1: 0.5250
 epoch: 27, train_loss: 0.8700, test_loss: 1.0587, test_f1: 0.5656
 epoch: 28, train_loss: 0.8646, test_loss: 1.1136, test_f1: 0.4727
 epoch: 29, train_loss: 0.8652, test_loss: 1.1725, test_f1: 0.5177
 epoch: 30, train_loss: 0.8566, test_loss: 1.0700, test_f1: 0.5338
 epoch: 31, train_loss: 0.8459, test_loss: 1.1264, test_f1: 0.5457
 epoch: 32, train_loss: 0.8604, test_loss: 1.0837, test_f1: 0.4873
 epoch: 33, train_loss: 0.8407, test_loss: 1.0931, test_f1: 0.5667
 epoch: 34, train_loss: 0.8478, test_loss: 1.1295, test_f1: 0.5610
 epoch: 35, train_loss: 0.8492, test_loss: 1.1068, test_f1: 0.6094
 epoch: 36, train_loss: 0.8354, test_loss: 1.0339, test_f1: 0.5722
 epoch: 37, train_loss: 0.8244, test_loss: 1.0484, test_f1: 0.5342
 epoch: 38, train_loss: 0.8468, test_loss: 1.1076, test_f1: 0.6228
 epoch: 39, train_loss: 0.8060, test_loss: 1.0413, test_f1: 0.5794
 epoch: 40, train_loss: 0.7986, test_loss: 1.1137, test_f1: 0.6064
 epoch: 41, train_loss: 0.7929, test_loss: 1.0763, test_f1: 0.5969
 epoch: 42, train_loss: 0.7930, test_loss: 1.1179, test_f1: 0.5464
 epoch: 43, train_loss: 0.7952, test_loss: 1.0026, test_f1: 0.6352
 epoch: 44, train_loss: 0.7833, test_loss: 1.1495, test_f1: 0.6179
 epoch: 45, train_loss: 0.7657, test_loss: 1.2133, test_f1: 0.5855
 epoch: 46, train_loss: 0.7807, test_loss: 1.2269, test_f1: 0.5457
 epoch: 47, train_loss: 0.7790, test_loss: 1.0775, test_f1: 0.5915
 epoch: 48, train_loss: 0.7867, test_loss: 1.1175, test_f1: 0.5526
 epoch: 49, train_loss: 0.7689, test_loss: 1.2364, test_f1: 0.5830
 epoch: 50, train_loss: 0.7445, test_loss: 1.2233, test_f1: 0.5828
 epoch: 51, train_loss: 0.7447, test_loss: 1.1554, test_f1: 0.5961
 epoch: 52, train_loss: 0.7235, test_loss: 1.1394, test_f1: 0.6047
 epoch: 53, train_loss: 0.7169, test_loss: 1.1356, test_f1: 0.5890
 epoch: 54, train_loss: 0.7186, test_loss: 1.1683, test_f1: 0.5737
 epoch: 55, train_loss: 0.7182, test_loss: 1.3205, test_f1: 0.5971
 epoch: 56, train_loss: 0.6849, test_loss: 1.1927, test_f1: 0.6268
 epoch: 57, train_loss: 0.6834, test_loss: 1.2387, test_f1: 0.5884
 epoch: 58, train_loss: 0.6915, test_loss: 1.4315, test_f1: 0.5982
 epoch: 59, train_loss: 0.6801, test_loss: 1.3390, test_f1: 0.5897
 epoch: 60, train_loss: 0.6922, test_loss: 1.1953, test_f1: 0.5890
 epoch: 61, train_loss: 0.7212, test_loss: 1.1833, test_f1: 0.6195
 epoch: 62, train_loss: 0.6934, test_loss: 1.2598, test_f1: 0.5943
 epoch: 63, train_loss: 0.6782, test_loss: 1.2648, test_f1: 0.6005
 epoch: 64, train_loss: 0.6735, test_loss: 1.1882, test_f1: 0.6021
 epoch: 65, train_loss: 0.6861, test_loss: 1.2478, test_f1: 0.6006
 epoch: 66, train_loss: 0.6550, test_loss: 1.3617, test_f1: 0.5935
 epoch: 67, train_loss: 0.6508, test_loss: 1.3410, test_f1: 0.5975
 epoch: 68, train_loss: 0.6447, test_loss: 1.4841, test_f1: 0.6002
 epoch: 69, train_loss: 0.6523, test_loss: 1.5309, test_f1: 0.5754
 epoch: 70, train_loss: 0.6693, test_loss: 1.7525, test_f1: 0.5575
 epoch: 71, train_loss: 0.6469, test_loss: 1.6882, test_f1: 0.5652
 epoch: 72, train_loss: 0.6408, test_loss: 1.2312, test_f1: 0.5678
 epoch: 73, train_loss: 0.6522, test_loss: 1.4361, test_f1: 0.5911
 epoch: 74, train_loss: 0.6576, test_loss: 1.3190, test_f1: 0.5445
 epoch: 75, train_loss: 0.6295, test_loss: 1.5027, test_f1: 0.5882
 epoch: 76, train_loss: 0.6102, test_loss: 1.4625, test_f1: 0.5672
 epoch: 77, train_loss: 0.6362, test_loss: 1.4727, test_f1: 0.5745
 epoch: 78, train_loss: 0.6151, test_loss: 1.5311, test_f1: 0.5947
 epoch: 79, train_loss: 0.6030, test_loss: 1.4408, test_f1: 0.5640
 epoch: 80, train_loss: 0.5967, test_loss: 1.4839, test_f1: 0.5612
 epoch: 81, train_loss: 0.6306, test_loss: 1.3413, test_f1: 0.5207
 epoch: 82, train_loss: 0.6079, test_loss: 1.5064, test_f1: 0.5319
 epoch: 83, train_loss: 0.6229, test_loss: 1.2035, test_f1: 0.6069
 epoch: 84, train_loss: 0.6094, test_loss: 1.3604, test_f1: 0.5735
 epoch: 85, train_loss: 0.6193, test_loss: 1.4145, test_f1: 0.5517
 epoch: 86, train_loss: 0.5882, test_loss: 1.3054, test_f1: 0.5769
 epoch: 87, train_loss: 0.6075, test_loss: 1.3189, test_f1: 0.5462
 epoch: 88, train_loss: 0.5901, test_loss: 1.4274, test_f1: 0.5852
 epoch: 89, train_loss: 0.6022, test_loss: 1.1679, test_f1: 0.5944
 epoch: 90, train_loss: 0.5800, test_loss: 1.3673, test_f1: 0.5466
 epoch: 91, train_loss: 0.5966, test_loss: 1.5666, test_f1: 0.5318
 epoch: 92, train_loss: 0.5901, test_loss: 1.2599, test_f1: 0.5815
 epoch: 93, train_loss: 0.5475, test_loss: 1.3817, test_f1: 0.5943
 epoch: 94, train_loss: 0.5899, test_loss: 1.5177, test_f1: 0.5703
 epoch: 95, train_loss: 0.5713, test_loss: 1.5532, test_f1: 0.5756
 epoch: 96, train_loss: 0.5714, test_loss: 1.3006, test_f1: 0.5508
 epoch: 97, train_loss: 0.5585, test_loss: 2.3553, test_f1: 0.5827
 epoch: 98, train_loss: 0.5783, test_loss: 1.3935, test_f1: 0.5778
 epoch: 99, train_loss: 0.5656, test_loss: 1.2690, test_f1: 0.5896
##################ITERATION #2 ****************************************
 epoch: 0, train_loss: 1.3325, test_loss: 1.4193, test_f1: 0.2754
 epoch: 1, train_loss: 1.2176, test_loss: 1.2467, test_f1: 0.3407
 epoch: 2, train_loss: 1.1453, test_loss: 1.3399, test_f1: 0.3671
 epoch: 3, train_loss: 1.1018, test_loss: 1.2538, test_f1: 0.4578
 epoch: 4, train_loss: 1.0315, test_loss: 1.2186, test_f1: 0.5228
 epoch: 5, train_loss: 0.9739, test_loss: 1.1119, test_f1: 0.5151
 epoch: 6, train_loss: 0.9630, test_loss: 1.0865, test_f1: 0.4453
 epoch: 7, train_loss: 0.9473, test_loss: 1.3486, test_f1: 0.3870
 epoch: 8, train_loss: 0.9543, test_loss: 1.1305, test_f1: 0.4659
 epoch: 9, train_loss: 0.9241, test_loss: 1.5970, test_f1: 0.3664
 epoch: 10, train_loss: 0.8746, test_loss: 1.0627, test_f1: 0.4722
 epoch: 11, train_loss: 0.9075, test_loss: 1.0857, test_f1: 0.5071
 epoch: 12, train_loss: 0.8924, test_loss: 1.0417, test_f1: 0.5591
 epoch: 13, train_loss: 0.8815, test_loss: 1.0428, test_f1: 0.5406
 epoch: 14, train_loss: 0.8686, test_loss: 0.9892, test_f1: 0.5632
 epoch: 15, train_loss: 0.8784, test_loss: 1.0879, test_f1: 0.5024
 epoch: 16, train_loss: 0.8607, test_loss: 1.0172, test_f1: 0.6034
 epoch: 17, train_loss: 0.8321, test_loss: 1.1345, test_f1: 0.5350
 epoch: 18, train_loss: 0.8549, test_loss: 1.1399, test_f1: 0.5171
 epoch: 19, train_loss: 0.8360, test_loss: 1.0265, test_f1: 0.5821
 epoch: 20, train_loss: 0.8355, test_loss: 2.4273, test_f1: 0.5767
 epoch: 21, train_loss: 0.8319, test_loss: 1.1611, test_f1: 0.5680
 epoch: 22, train_loss: 0.8148, test_loss: 1.1344, test_f1: 0.6105
 epoch: 23, train_loss: 0.8272, test_loss: 1.4277, test_f1: 0.5012
 epoch: 24, train_loss: 0.8121, test_loss: 0.9822, test_f1: 0.6021
 epoch: 25, train_loss: 0.7970, test_loss: 1.0986, test_f1: 0.5136
 epoch: 26, train_loss: 0.7950, test_loss: 1.2119, test_f1: 0.5415
 epoch: 27, train_loss: 0.7917, test_loss: 1.0088, test_f1: 0.5993
 epoch: 28, train_loss: 0.8042, test_loss: 0.9859, test_f1: 0.5834
 epoch: 29, train_loss: 0.7908, test_loss: 0.9615, test_f1: 0.5839
 epoch: 30, train_loss: 0.7702, test_loss: 1.2431, test_f1: 0.4920
 epoch: 31, train_loss: 0.7827, test_loss: 1.0417, test_f1: 0.5773
 epoch: 32, train_loss: 0.7746, test_loss: 1.0236, test_f1: 0.6219
 epoch: 33, train_loss: 0.7685, test_loss: 1.0379, test_f1: 0.5945
 epoch: 34, train_loss: 0.7627, test_loss: 1.1128, test_f1: 0.5086
 epoch: 35, train_loss: 0.7493, test_loss: 1.1222, test_f1: 0.5087
 epoch: 36, train_loss: 0.7546, test_loss: 1.3074, test_f1: 0.5606
 epoch: 37, train_loss: 0.7445, test_loss: 1.1193, test_f1: 0.5652
 epoch: 38, train_loss: 0.7639, test_loss: 1.0994, test_f1: 0.5282
 epoch: 39, train_loss: 0.7419, test_loss: 1.2014, test_f1: 0.5694
 epoch: 40, train_loss: 0.7332, test_loss: 1.2545, test_f1: 0.5675
 epoch: 41, train_loss: 0.7376, test_loss: 1.5718, test_f1: 0.5578
 epoch: 42, train_loss: 0.7430, test_loss: 1.2494, test_f1: 0.5905
 epoch: 43, train_loss: 0.7392, test_loss: 1.6375, test_f1: 0.5796
 epoch: 44, train_loss: 0.7257, test_loss: 1.0815, test_f1: 0.5958
 epoch: 45, train_loss: 0.7138, test_loss: 1.1574, test_f1: 0.5801
 epoch: 46, train_loss: 0.7278, test_loss: 1.1473, test_f1: 0.5711
 epoch: 47, train_loss: 0.7004, test_loss: 1.3031, test_f1: 0.5629
 epoch: 48, train_loss: 0.6927, test_loss: 1.1539, test_f1: 0.5747
 epoch: 49, train_loss: 0.7347, test_loss: 1.1394, test_f1: 0.5998
 epoch: 50, train_loss: 0.7049, test_loss: 1.4008, test_f1: 0.5609
 epoch: 51, train_loss: 0.6682, test_loss: 1.0991, test_f1: 0.6160
 epoch: 52, train_loss: 0.6401, test_loss: 1.2465, test_f1: 0.5946
 epoch: 53, train_loss: 0.6151, test_loss: 1.4554, test_f1: 0.5999
 epoch: 54, train_loss: 0.6452, test_loss: 1.2215, test_f1: 0.5847
 epoch: 55, train_loss: 0.6425, test_loss: 1.4218, test_f1: 0.6063
 epoch: 56, train_loss: 0.6306, test_loss: 1.4599, test_f1: 0.5920
 epoch: 57, train_loss: 0.6285, test_loss: 1.3968, test_f1: 0.6344
 epoch: 58, train_loss: 0.6312, test_loss: 1.3028, test_f1: 0.6242
 epoch: 59, train_loss: 0.6155, test_loss: 1.4468, test_f1: 0.5949
 epoch: 60, train_loss: 0.6185, test_loss: 1.5930, test_f1: 0.5634
 epoch: 61, train_loss: 0.6180, test_loss: 1.2763, test_f1: 0.5823
 epoch: 62, train_loss: 0.6044, test_loss: 1.7544, test_f1: 0.5900
 epoch: 63, train_loss: 0.6170, test_loss: 1.7182, test_f1: 0.5369
 epoch: 64, train_loss: 0.5865, test_loss: 1.2304, test_f1: 0.5919
 epoch: 65, train_loss: 0.5924, test_loss: 1.5256, test_f1: 0.5804
 epoch: 66, train_loss: 0.5879, test_loss: 1.7379, test_f1: 0.5535
 epoch: 67, train_loss: 0.5816, test_loss: 1.4921, test_f1: 0.6221
 epoch: 68, train_loss: 0.6232, test_loss: 1.3965, test_f1: 0.6005
 epoch: 69, train_loss: 0.5744, test_loss: 1.5074, test_f1: 0.5991
 epoch: 70, train_loss: 0.5717, test_loss: 1.5790, test_f1: 0.5580
 epoch: 71, train_loss: 0.6089, test_loss: 1.5961, test_f1: 0.5239
 epoch: 72, train_loss: 0.5687, test_loss: 1.6667, test_f1: 0.5619
 epoch: 73, train_loss: 0.5778, test_loss: 1.4978, test_f1: 0.5476
 epoch: 74, train_loss: 0.5526, test_loss: 1.4995, test_f1: 0.5853
 epoch: 75, train_loss: 0.5512, test_loss: 1.6199, test_f1: 0.6018
 epoch: 76, train_loss: 0.5340, test_loss: 1.7539, test_f1: 0.5557
 epoch: 77, train_loss: 0.5692, test_loss: 1.6209, test_f1: 0.6084
 epoch: 78, train_loss: 0.6021, test_loss: 1.5159, test_f1: 0.5611
 epoch: 79, train_loss: 0.5939, test_loss: 1.4517, test_f1: 0.6033
 epoch: 80, train_loss: 0.5871, test_loss: 1.2248, test_f1: 0.5966
 epoch: 81, train_loss: 0.5599, test_loss: 1.8477, test_f1: 0.5297
 epoch: 82, train_loss: 0.5639, test_loss: 1.7864, test_f1: 0.5772
 epoch: 83, train_loss: 0.5374, test_loss: 1.4512, test_f1: 0.5818
 epoch: 84, train_loss: 0.5658, test_loss: 1.8368, test_f1: 0.5009
 epoch: 85, train_loss: 0.5677, test_loss: 1.5027, test_f1: 0.5852
 epoch: 86, train_loss: 0.5456, test_loss: 1.5919, test_f1: 0.6166
 epoch: 87, train_loss: 0.5204, test_loss: 1.4945, test_f1: 0.5676
 epoch: 88, train_loss: 0.5251, test_loss: 1.5195, test_f1: 0.5878
 epoch: 89, train_loss: 0.5448, test_loss: 1.5159, test_f1: 0.6269
 epoch: 90, train_loss: 0.5356, test_loss: 1.4383, test_f1: 0.6028
 epoch: 91, train_loss: 0.5509, test_loss: 1.4745, test_f1: 0.5950
 epoch: 92, train_loss: 0.5388, test_loss: 1.7082, test_f1: 0.5939
 epoch: 93, train_loss: 0.5267, test_loss: 1.5261, test_f1: 0.6093
 epoch: 94, train_loss: 0.5299, test_loss: 1.7661, test_f1: 0.5826
 epoch: 95, train_loss: 0.5219, test_loss: 1.7896, test_f1: 0.5409
 epoch: 96, train_loss: 0.5088, test_loss: 1.4903, test_f1: 0.5612
 epoch: 97, train_loss: 0.5384, test_loss: 1.6017, test_f1: 0.5773
 epoch: 98, train_loss: 0.5269, test_loss: 1.5173, test_f1: 0.5624
 epoch: 99, train_loss: 0.5198, test_loss: 1.6740, test_f1: 0.5747
##################ITERATION #3 ****************************************
 epoch: 0, train_loss: 1.2970, test_loss: 1.2628, test_f1: 0.3372
 epoch: 1, train_loss: 1.1681, test_loss: 1.2628, test_f1: 0.4024
 epoch: 2, train_loss: 1.1271, test_loss: 1.3424, test_f1: 0.3955
 epoch: 3, train_loss: 1.0713, test_loss: 1.2095, test_f1: 0.3852
 epoch: 4, train_loss: 1.0444, test_loss: 1.2446, test_f1: 0.4666
 epoch: 5, train_loss: 1.0349, test_loss: 1.2361, test_f1: 0.5002
 epoch: 6, train_loss: 0.9930, test_loss: 1.2013, test_f1: 0.4572
 epoch: 7, train_loss: 0.9802, test_loss: 1.1493, test_f1: 0.5186
 epoch: 8, train_loss: 0.9366, test_loss: 1.3344, test_f1: 0.3717
 epoch: 9, train_loss: 0.9337, test_loss: 1.0977, test_f1: 0.5579
 epoch: 10, train_loss: 0.9173, test_loss: 1.3598, test_f1: 0.4754
 epoch: 11, train_loss: 0.8875, test_loss: 1.0724, test_f1: 0.4996
 epoch: 12, train_loss: 0.8919, test_loss: 1.1582, test_f1: 0.4437
 epoch: 13, train_loss: 0.8820, test_loss: 1.1084, test_f1: 0.4622
 epoch: 14, train_loss: 0.8671, test_loss: 1.1174, test_f1: 0.5478
 epoch: 15, train_loss: 0.8647, test_loss: 1.1120, test_f1: 0.5278
 epoch: 16, train_loss: 0.8574, test_loss: 1.3316, test_f1: 0.5380
 epoch: 17, train_loss: 0.8505, test_loss: 1.2121, test_f1: 0.5104
 epoch: 18, train_loss: 0.8582, test_loss: 1.4442, test_f1: 0.5372
 epoch: 19, train_loss: 0.8274, test_loss: 1.0744, test_f1: 0.5393
 epoch: 20, train_loss: 0.8286, test_loss: 1.1756, test_f1: 0.4956
 epoch: 21, train_loss: 0.8321, test_loss: 1.2749, test_f1: 0.5202
 epoch: 22, train_loss: 0.8027, test_loss: 1.1486, test_f1: 0.5030
 epoch: 23, train_loss: 0.7895, test_loss: 1.2412, test_f1: 0.5184
 epoch: 24, train_loss: 0.8073, test_loss: 1.3633, test_f1: 0.5077
 epoch: 25, train_loss: 0.8040, test_loss: 1.4043, test_f1: 0.4377
 epoch: 26, train_loss: 0.8266, test_loss: 5.8022, test_f1: 0.4450
 epoch: 27, train_loss: 0.7981, test_loss: 1.1695, test_f1: 0.5251
 epoch: 28, train_loss: 0.7956, test_loss: 1.1072, test_f1: 0.5374
 epoch: 29, train_loss: 0.8105, test_loss: 1.3468, test_f1: 0.5337
 epoch: 30, train_loss: 0.7963, test_loss: 1.0266, test_f1: 0.5788
 epoch: 31, train_loss: 0.7663, test_loss: 1.2005, test_f1: 0.5838
 epoch: 32, train_loss: 0.7517, test_loss: 1.0261, test_f1: 0.5729
 epoch: 33, train_loss: 0.7589, test_loss: 1.1627, test_f1: 0.5110
 epoch: 34, train_loss: 0.7883, test_loss: 1.0797, test_f1: 0.5688
 epoch: 35, train_loss: 0.7365, test_loss: 1.6072, test_f1: 0.5212
 epoch: 36, train_loss: 0.7519, test_loss: 1.1645, test_f1: 0.5730
 epoch: 37, train_loss: 0.7102, test_loss: 1.1325, test_f1: 0.5349
 epoch: 38, train_loss: 0.7370, test_loss: 1.2174, test_f1: 0.5294
 epoch: 39, train_loss: 0.8026, test_loss: 1.2319, test_f1: 0.5745
 epoch: 40, train_loss: 0.7296, test_loss: 1.2265, test_f1: 0.5661
 epoch: 41, train_loss: 0.7316, test_loss: 1.2365, test_f1: 0.5243
 epoch: 42, train_loss: 0.6902, test_loss: 1.4186, test_f1: 0.5169
 epoch: 43, train_loss: 0.7073, test_loss: 1.2287, test_f1: 0.5638
 epoch: 44, train_loss: 0.6682, test_loss: 1.1535, test_f1: 0.5764
 epoch: 45, train_loss: 0.6932, test_loss: 1.6786, test_f1: 0.5473
 epoch: 46, train_loss: 0.7424, test_loss: 1.0927, test_f1: 0.5774
 epoch: 47, train_loss: 0.6970, test_loss: 1.0986, test_f1: 0.6157
 epoch: 48, train_loss: 0.6898, test_loss: 1.5136, test_f1: 0.5594
 epoch: 49, train_loss: 0.6763, test_loss: 1.1695, test_f1: 0.5962
 epoch: 50, train_loss: 0.6997, test_loss: 1.1963, test_f1: 0.5911
 epoch: 51, train_loss: 0.6572, test_loss: 1.1787, test_f1: 0.5743
 epoch: 52, train_loss: 0.6200, test_loss: 1.2772, test_f1: 0.6095
 epoch: 53, train_loss: 0.6302, test_loss: 1.1632, test_f1: 0.5621
 epoch: 54, train_loss: 0.6090, test_loss: 1.3557, test_f1: 0.5117
 epoch: 55, train_loss: 0.6094, test_loss: 1.3576, test_f1: 0.5393
 epoch: 56, train_loss: 0.6050, test_loss: 1.2324, test_f1: 0.5683
 epoch: 57, train_loss: 0.5803, test_loss: 1.4012, test_f1: 0.5376
 epoch: 58, train_loss: 0.5640, test_loss: 1.4571, test_f1: 0.5578
 epoch: 59, train_loss: 0.5642, test_loss: 1.3358, test_f1: 0.5246
 epoch: 60, train_loss: 0.5648, test_loss: 1.5675, test_f1: 0.5264
 epoch: 61, train_loss: 0.5430, test_loss: 2.0617, test_f1: 0.5013
 epoch: 62, train_loss: 0.5543, test_loss: 1.7399, test_f1: 0.5206
 epoch: 63, train_loss: 0.5641, test_loss: 1.4255, test_f1: 0.5192
 epoch: 64, train_loss: 0.5591, test_loss: 1.6865, test_f1: 0.5756
 epoch: 65, train_loss: 0.5542, test_loss: 1.4183, test_f1: 0.5413
 epoch: 66, train_loss: 0.5561, test_loss: 1.3264, test_f1: 0.5900
 epoch: 67, train_loss: 0.5419, test_loss: 1.5302, test_f1: 0.5113
 epoch: 68, train_loss: 0.5097, test_loss: 1.5011, test_f1: 0.5487
 epoch: 69, train_loss: 0.4999, test_loss: 1.5899, test_f1: 0.5247
 epoch: 70, train_loss: 0.5131, test_loss: 1.6057, test_f1: 0.5454
 epoch: 71, train_loss: 0.5276, test_loss: 1.9672, test_f1: 0.5233
 epoch: 72, train_loss: 0.5322, test_loss: 2.1632, test_f1: 0.5456
 epoch: 73, train_loss: 0.5255, test_loss: 1.5157, test_f1: 0.5408
 epoch: 74, train_loss: 0.5101, test_loss: 1.6498, test_f1: 0.5479
 epoch: 75, train_loss: 0.5257, test_loss: 1.7716, test_f1: 0.5462
 epoch: 76, train_loss: 0.4979, test_loss: 2.1802, test_f1: 0.5101
 epoch: 77, train_loss: 0.4881, test_loss: 1.8747, test_f1: 0.5628
 epoch: 78, train_loss: 0.5061, test_loss: 1.4475, test_f1: 0.5313
 epoch: 79, train_loss: 0.5167, test_loss: 1.6613, test_f1: 0.5533
 epoch: 80, train_loss: 0.5054, test_loss: 1.6331, test_f1: 0.5623
 epoch: 81, train_loss: 0.5328, test_loss: 1.4948, test_f1: 0.5523
 epoch: 82, train_loss: 0.5016, test_loss: 1.8837, test_f1: 0.5048
 epoch: 83, train_loss: 0.5010, test_loss: 2.1955, test_f1: 0.5067
 epoch: 84, train_loss: 0.4791, test_loss: 1.4245, test_f1: 0.5600
 epoch: 85, train_loss: 0.4929, test_loss: 1.7547, test_f1: 0.5342
 epoch: 86, train_loss: 0.4868, test_loss: 1.8344, test_f1: 0.5009
 epoch: 87, train_loss: 0.4957, test_loss: 1.8552, test_f1: 0.5126
 epoch: 88, train_loss: 0.4962, test_loss: 1.7632, test_f1: 0.5098
 epoch: 89, train_loss: 0.5180, test_loss: 1.5583, test_f1: 0.5207
 epoch: 90, train_loss: 0.4678, test_loss: 1.6491, test_f1: 0.5781
 epoch: 91, train_loss: 0.4474, test_loss: 1.7476, test_f1: 0.5647
 epoch: 92, train_loss: 0.4616, test_loss: 1.6789, test_f1: 0.5329
 epoch: 93, train_loss: 0.4196, test_loss: 1.6419, test_f1: 0.5614
 epoch: 94, train_loss: 0.4739, test_loss: 1.5698, test_f1: 0.5522
 epoch: 95, train_loss: 0.4586, test_loss: 1.6475, test_f1: 0.5201
 epoch: 96, train_loss: 0.4597, test_loss: 1.7110, test_f1: 0.5483
 epoch: 97, train_loss: 0.5436, test_loss: 1.7054, test_f1: 0.5130
 epoch: 98, train_loss: 0.4597, test_loss: 1.6994, test_f1: 0.5325
 epoch: 99, train_loss: 0.4364, test_loss: 1.8064, test_f1: 0.5156
##################ITERATION #4 ****************************************
 epoch: 0, train_loss: 1.3255, test_loss: 1.3446, test_f1: 0.2817
 epoch: 1, train_loss: 1.2008, test_loss: 1.3428, test_f1: 0.2962
 epoch: 2, train_loss: 1.1812, test_loss: 1.2469, test_f1: 0.3434
 epoch: 3, train_loss: 1.1038, test_loss: 1.2829, test_f1: 0.4356
 epoch: 4, train_loss: 1.0755, test_loss: 1.2243, test_f1: 0.4415
 epoch: 5, train_loss: 1.0210, test_loss: 1.2186, test_f1: 0.4407
 epoch: 6, train_loss: 1.0085, test_loss: 1.1643, test_f1: 0.4566
 epoch: 7, train_loss: 0.9850, test_loss: 1.1130, test_f1: 0.4097
 epoch: 8, train_loss: 0.9544, test_loss: 1.1595, test_f1: 0.5277
 epoch: 9, train_loss: 0.9406, test_loss: 1.1905, test_f1: 0.4437
 epoch: 10, train_loss: 0.9350, test_loss: 1.2924, test_f1: 0.4327
 epoch: 11, train_loss: 0.9254, test_loss: 1.5443, test_f1: 0.4085
 epoch: 12, train_loss: 0.9229, test_loss: 1.2110, test_f1: 0.4678
 epoch: 13, train_loss: 0.9024, test_loss: 1.0960, test_f1: 0.4306
 epoch: 14, train_loss: 0.8974, test_loss: 1.1617, test_f1: 0.4374
 epoch: 15, train_loss: 0.9062, test_loss: 1.2139, test_f1: 0.4863
 epoch: 16, train_loss: 0.9057, test_loss: 1.0762, test_f1: 0.5374
 epoch: 17, train_loss: 0.9012, test_loss: 1.0956, test_f1: 0.4432
 epoch: 18, train_loss: 0.8881, test_loss: 1.4963, test_f1: 0.3994
 epoch: 19, train_loss: 0.8767, test_loss: 1.1137, test_f1: 0.5125
 epoch: 20, train_loss: 0.8703, test_loss: 1.0603, test_f1: 0.5097
 epoch: 21, train_loss: 0.8657, test_loss: 1.1450, test_f1: 0.4748
 epoch: 22, train_loss: 0.8471, test_loss: 1.0371, test_f1: 0.5744
 epoch: 23, train_loss: 0.8367, test_loss: 1.1816, test_f1: 0.4456
 epoch: 24, train_loss: 0.8383, test_loss: 1.1074, test_f1: 0.4925
 epoch: 25, train_loss: 0.8218, test_loss: 1.0556, test_f1: 0.5117
 epoch: 26, train_loss: 0.8472, test_loss: 1.4564, test_f1: 0.5297
 epoch: 27, train_loss: 0.8578, test_loss: 1.1113, test_f1: 0.5176
 epoch: 28, train_loss: 0.8364, test_loss: 1.4086, test_f1: 0.4677
 epoch: 29, train_loss: 0.8207, test_loss: 1.1638, test_f1: 0.5365
 epoch: 30, train_loss: 0.8200, test_loss: 1.1786, test_f1: 0.5680
 epoch: 31, train_loss: 0.8092, test_loss: 1.2349, test_f1: 0.5082
 epoch: 32, train_loss: 0.8090, test_loss: 1.0477, test_f1: 0.5689
 epoch: 33, train_loss: 0.7923, test_loss: 1.0951, test_f1: 0.5936
 epoch: 34, train_loss: 0.7865, test_loss: 1.2516, test_f1: 0.5365
 epoch: 35, train_loss: 0.7841, test_loss: 1.3676, test_f1: 0.4968
 epoch: 36, train_loss: 0.7967, test_loss: 1.1775, test_f1: 0.5526
 epoch: 37, train_loss: 0.7910, test_loss: 1.3665, test_f1: 0.5287
 epoch: 38, train_loss: 0.7751, test_loss: 1.2209, test_f1: 0.6044
 epoch: 39, train_loss: 0.7732, test_loss: 1.2169, test_f1: 0.5521
 epoch: 40, train_loss: 0.7820, test_loss: 1.1019, test_f1: 0.5090
 epoch: 41, train_loss: 0.7721, test_loss: 1.3548, test_f1: 0.5609
 epoch: 42, train_loss: 0.7938, test_loss: 1.1059, test_f1: 0.5745
 epoch: 43, train_loss: 0.8192, test_loss: 1.0285, test_f1: 0.5369
 epoch: 44, train_loss: 0.7818, test_loss: 1.0596, test_f1: 0.5782
 epoch: 45, train_loss: 0.7967, test_loss: 1.0210, test_f1: 0.5926
 epoch: 46, train_loss: 0.7498, test_loss: 1.0876, test_f1: 0.5462
 epoch: 47, train_loss: 0.7503, test_loss: 0.9911, test_f1: 0.6091
 epoch: 48, train_loss: 0.7371, test_loss: 0.9671, test_f1: 0.6249
 epoch: 49, train_loss: 0.7437, test_loss: 1.1367, test_f1: 0.5943
 epoch: 50, train_loss: 0.7121, test_loss: 1.1295, test_f1: 0.5842
 epoch: 51, train_loss: 0.7140, test_loss: 1.0766, test_f1: 0.6030
 epoch: 52, train_loss: 0.7087, test_loss: 1.2059, test_f1: 0.5582
 epoch: 53, train_loss: 0.6876, test_loss: 1.1727, test_f1: 0.5817
 epoch: 54, train_loss: 0.6908, test_loss: 1.0793, test_f1: 0.6148
 epoch: 55, train_loss: 0.6979, test_loss: 1.2885, test_f1: 0.5500
 epoch: 56, train_loss: 0.6823, test_loss: 1.0865, test_f1: 0.6235
 epoch: 57, train_loss: 0.6692, test_loss: 1.1183, test_f1: 0.6360
 epoch: 58, train_loss: 0.6387, test_loss: 1.0965, test_f1: 0.6106
 epoch: 59, train_loss: 0.6547, test_loss: 1.1528, test_f1: 0.5536
 epoch: 60, train_loss: 0.6446, test_loss: 1.1614, test_f1: 0.6169
 epoch: 61, train_loss: 0.6792, test_loss: 1.0724, test_f1: 0.6028
 epoch: 62, train_loss: 0.6584, test_loss: 1.1355, test_f1: 0.6264
 epoch: 63, train_loss: 0.6396, test_loss: 1.1605, test_f1: 0.5773
 epoch: 64, train_loss: 0.6606, test_loss: 1.1471, test_f1: 0.6173
 epoch: 65, train_loss: 0.6459, test_loss: 1.1804, test_f1: 0.6243
 epoch: 66, train_loss: 0.6590, test_loss: 1.1200, test_f1: 0.6031
 epoch: 67, train_loss: 0.6300, test_loss: 1.1388, test_f1: 0.6210
 epoch: 68, train_loss: 0.6429, test_loss: 1.3525, test_f1: 0.5910
 epoch: 69, train_loss: 0.6474, test_loss: 1.2212, test_f1: 0.5932
 epoch: 70, train_loss: 0.6365, test_loss: 1.2644, test_f1: 0.6274
 epoch: 71, train_loss: 0.6286, test_loss: 1.2060, test_f1: 0.5953
 epoch: 72, train_loss: 0.6027, test_loss: 1.1412, test_f1: 0.6047
 epoch: 73, train_loss: 0.6085, test_loss: 1.3668, test_f1: 0.5735
 epoch: 74, train_loss: 0.6229, test_loss: 1.4597, test_f1: 0.5897
 epoch: 75, train_loss: 0.6170, test_loss: 1.1355, test_f1: 0.6288
 epoch: 76, train_loss: 0.6328, test_loss: 1.1509, test_f1: 0.5966
 epoch: 77, train_loss: 0.6350, test_loss: 1.3103, test_f1: 0.5687
 epoch: 78, train_loss: 0.6060, test_loss: 1.2297, test_f1: 0.5805
 epoch: 79, train_loss: 0.6098, test_loss: 1.2657, test_f1: 0.6032
 epoch: 80, train_loss: 0.5839, test_loss: 1.4152, test_f1: 0.5757
 epoch: 81, train_loss: 0.6268, test_loss: 1.1551, test_f1: 0.6035
 epoch: 82, train_loss: 0.5958, test_loss: 1.3665, test_f1: 0.5555
 epoch: 83, train_loss: 0.5971, test_loss: 1.4941, test_f1: 0.5905
 epoch: 84, train_loss: 0.6009, test_loss: 1.2405, test_f1: 0.5952
 epoch: 85, train_loss: 0.5818, test_loss: 1.1321, test_f1: 0.6240
 epoch: 86, train_loss: 0.5857, test_loss: 1.3646, test_f1: 0.5748
 epoch: 87, train_loss: 0.6128, test_loss: 1.1355, test_f1: 0.6299
 epoch: 88, train_loss: 0.5947, test_loss: 1.1929, test_f1: 0.6166
 epoch: 89, train_loss: 0.5864, test_loss: 1.3643, test_f1: 0.5793
 epoch: 90, train_loss: 0.5854, test_loss: 1.4897, test_f1: 0.5815
 epoch: 91, train_loss: 0.5927, test_loss: 1.1967, test_f1: 0.6531
 epoch: 92, train_loss: 0.5595, test_loss: 1.2248, test_f1: 0.6106
 epoch: 93, train_loss: 0.5860, test_loss: 1.4336, test_f1: 0.6012
 epoch: 94, train_loss: 0.5714, test_loss: 1.2634, test_f1: 0.6133
 epoch: 95, train_loss: 0.5698, test_loss: 1.1478, test_f1: 0.6186
 epoch: 96, train_loss: 0.5534, test_loss: 1.2730, test_f1: 0.5942
 epoch: 97, train_loss: 0.5684, test_loss: 1.2786, test_f1: 0.6273
 epoch: 98, train_loss: 0.6609, test_loss: 1.4226, test_f1: 0.5765
 epoch: 99, train_loss: 0.6303, test_loss: 1.2445, test_f1: 0.6035
##################ITERATION #5 ****************************************
 epoch: 0, train_loss: 1.3314, test_loss: 1.4771, test_f1: 0.3030
 epoch: 1, train_loss: 1.1847, test_loss: 1.2649, test_f1: 0.3565
 epoch: 2, train_loss: 1.1257, test_loss: 1.2614, test_f1: 0.3908
 epoch: 3, train_loss: 1.0732, test_loss: 1.1098, test_f1: 0.3993
 epoch: 4, train_loss: 1.0524, test_loss: 1.2099, test_f1: 0.3846
 epoch: 5, train_loss: 1.0039, test_loss: 1.2452, test_f1: 0.4356
 epoch: 6, train_loss: 1.0157, test_loss: 1.1985, test_f1: 0.4699
 epoch: 7, train_loss: 0.9611, test_loss: 1.1590, test_f1: 0.4847
 epoch: 8, train_loss: 0.9507, test_loss: 1.1632, test_f1: 0.4581
 epoch: 9, train_loss: 0.9348, test_loss: 1.1246, test_f1: 0.5187
 epoch: 10, train_loss: 0.9161, test_loss: 1.1465, test_f1: 0.3843
 epoch: 11, train_loss: 0.9072, test_loss: 1.0961, test_f1: 0.5204
 epoch: 12, train_loss: 0.9171, test_loss: 1.5889, test_f1: 0.5350
 epoch: 13, train_loss: 0.9170, test_loss: 1.1119, test_f1: 0.5520
 epoch: 14, train_loss: 0.9153, test_loss: 1.0427, test_f1: 0.5414
 epoch: 15, train_loss: 0.8725, test_loss: 1.0943, test_f1: 0.5147
 epoch: 16, train_loss: 0.8596, test_loss: 1.1703, test_f1: 0.5203
 epoch: 17, train_loss: 0.8498, test_loss: 1.0556, test_f1: 0.5138
 epoch: 18, train_loss: 0.8529, test_loss: 1.0406, test_f1: 0.5578
 epoch: 19, train_loss: 0.8569, test_loss: 1.0756, test_f1: 0.5606
 epoch: 20, train_loss: 0.8360, test_loss: 1.8437, test_f1: 0.4815
 epoch: 21, train_loss: 0.9163, test_loss: 1.1297, test_f1: 0.5379
 epoch: 22, train_loss: 0.8469, test_loss: 1.0830, test_f1: 0.5462
 epoch: 23, train_loss: 0.8297, test_loss: 1.0398, test_f1: 0.5698
 epoch: 24, train_loss: 0.8232, test_loss: 1.0691, test_f1: 0.5101
 epoch: 25, train_loss: 0.8034, test_loss: 0.9735, test_f1: 0.5955
 epoch: 26, train_loss: 0.8082, test_loss: 1.1925, test_f1: 0.5264
 epoch: 27, train_loss: 0.7927, test_loss: 1.0614, test_f1: 0.5820
 epoch: 28, train_loss: 0.8167, test_loss: 1.1302, test_f1: 0.5871
 epoch: 29, train_loss: 0.8035, test_loss: 1.0656, test_f1: 0.5034
 epoch: 30, train_loss: 0.7971, test_loss: 1.0862, test_f1: 0.5015
 epoch: 31, train_loss: 0.7664, test_loss: 1.2101, test_f1: 0.5153
 epoch: 32, train_loss: 0.7688, test_loss: 1.0263, test_f1: 0.5803
 epoch: 33, train_loss: 0.7404, test_loss: 1.2690, test_f1: 0.5662
 epoch: 34, train_loss: 0.7580, test_loss: 1.1950, test_f1: 0.5265
 epoch: 35, train_loss: 0.7611, test_loss: 1.3039, test_f1: 0.4880
 epoch: 36, train_loss: 0.7467, test_loss: 1.2211, test_f1: 0.6207
 epoch: 37, train_loss: 0.7244, test_loss: 2.1231, test_f1: 0.3544
 epoch: 38, train_loss: 0.7770, test_loss: 1.1041, test_f1: 0.6091
 epoch: 39, train_loss: 0.7404, test_loss: 1.2212, test_f1: 0.5548
 epoch: 40, train_loss: 0.7188, test_loss: 1.0830, test_f1: 0.5855
 epoch: 41, train_loss: 0.7192, test_loss: 1.2044, test_f1: 0.5350
 epoch: 42, train_loss: 0.7057, test_loss: 1.1353, test_f1: 0.5808
 epoch: 43, train_loss: 0.7049, test_loss: 1.6475, test_f1: 0.5511
 epoch: 44, train_loss: 0.6992, test_loss: 1.3927, test_f1: 0.5354
 epoch: 45, train_loss: 0.7239, test_loss: 1.2872, test_f1: 0.5765
 epoch: 46, train_loss: 0.6677, test_loss: 1.3978, test_f1: 0.5472
 epoch: 47, train_loss: 0.6894, test_loss: 1.9877, test_f1: 0.4551
 epoch: 48, train_loss: 0.7731, test_loss: 1.1788, test_f1: 0.5526
 epoch: 49, train_loss: 0.6882, test_loss: 1.4439, test_f1: 0.4904
 epoch: 50, train_loss: 0.7109, test_loss: 1.2382, test_f1: 0.5346
 epoch: 51, train_loss: 0.6591, test_loss: 1.1253, test_f1: 0.6059
 epoch: 52, train_loss: 0.6480, test_loss: 1.2615, test_f1: 0.5417
 epoch: 53, train_loss: 0.6439, test_loss: 1.2201, test_f1: 0.5690
 epoch: 54, train_loss: 0.6323, test_loss: 1.2780, test_f1: 0.5779
 epoch: 55, train_loss: 0.6101, test_loss: 1.3547, test_f1: 0.5488
 epoch: 56, train_loss: 0.5908, test_loss: 1.4373, test_f1: 0.5263
 epoch: 57, train_loss: 0.5991, test_loss: 1.3031, test_f1: 0.5981
 epoch: 58, train_loss: 0.5982, test_loss: 1.5973, test_f1: 0.5482
 epoch: 59, train_loss: 0.5993, test_loss: 1.4702, test_f1: 0.5791
 epoch: 60, train_loss: 0.5869, test_loss: 1.4667, test_f1: 0.5673
 epoch: 61, train_loss: 0.5726, test_loss: 1.4355, test_f1: 0.5621
 epoch: 62, train_loss: 0.6224, test_loss: 1.7710, test_f1: 0.5316
 epoch: 63, train_loss: 0.6195, test_loss: 1.3710, test_f1: 0.5570
 epoch: 64, train_loss: 0.6227, test_loss: 1.5162, test_f1: 0.5953
 epoch: 65, train_loss: 0.6146, test_loss: 1.9421, test_f1: 0.5478
 epoch: 66, train_loss: 0.5829, test_loss: 1.4443, test_f1: 0.5788
 epoch: 67, train_loss: 0.5933, test_loss: 1.4141, test_f1: 0.5653
 epoch: 68, train_loss: 0.5795, test_loss: 1.6432, test_f1: 0.5839
 epoch: 69, train_loss: 0.6084, test_loss: 1.5680, test_f1: 0.5848
 epoch: 70, train_loss: 0.5850, test_loss: 1.6231, test_f1: 0.5465
 epoch: 71, train_loss: 0.5411, test_loss: 1.6732, test_f1: 0.5623
 epoch: 72, train_loss: 0.5931, test_loss: 1.7139, test_f1: 0.5884
 epoch: 73, train_loss: 0.5610, test_loss: 1.4308, test_f1: 0.5724
 epoch: 74, train_loss: 0.5440, test_loss: 1.6103, test_f1: 0.5882
 epoch: 75, train_loss: 0.5655, test_loss: 1.4432, test_f1: 0.6132
 epoch: 76, train_loss: 0.5422, test_loss: 1.6547, test_f1: 0.5911
 epoch: 77, train_loss: 0.5499, test_loss: 1.5098, test_f1: 0.5637
 epoch: 78, train_loss: 0.5365, test_loss: 2.1240, test_f1: 0.5726
 epoch: 79, train_loss: 0.5250, test_loss: 1.7126, test_f1: 0.5649
 epoch: 80, train_loss: 0.5227, test_loss: 1.6135, test_f1: 0.5656
 epoch: 81, train_loss: 0.5353, test_loss: 1.8098, test_f1: 0.6070
 epoch: 82, train_loss: 0.5379, test_loss: 1.9117, test_f1: 0.5804
 epoch: 83, train_loss: 0.5416, test_loss: 1.6277, test_f1: 0.5547
 epoch: 84, train_loss: 0.5421, test_loss: 2.1761, test_f1: 0.5876
 epoch: 85, train_loss: 0.5240, test_loss: 1.4646, test_f1: 0.5728
 epoch: 86, train_loss: 0.5218, test_loss: 1.7137, test_f1: 0.5532
 epoch: 87, train_loss: 0.5226, test_loss: 1.4874, test_f1: 0.5702
 epoch: 88, train_loss: 0.5065, test_loss: 1.8420, test_f1: 0.5428
 epoch: 89, train_loss: 0.5175, test_loss: 1.6103, test_f1: 0.5607
 epoch: 90, train_loss: 0.5067, test_loss: 1.5627, test_f1: 0.5733
 epoch: 91, train_loss: 0.5205, test_loss: 1.5631, test_f1: 0.5895
 epoch: 92, train_loss: 0.5055, test_loss: 1.5920, test_f1: 0.5661
 epoch: 93, train_loss: 0.5038, test_loss: 1.6334, test_f1: 0.5634
 epoch: 94, train_loss: 0.5119, test_loss: 1.5907, test_f1: 0.5479
 epoch: 95, train_loss: 0.5246, test_loss: 1.6242, test_f1: 0.5539
 epoch: 96, train_loss: 0.5204, test_loss: 1.4476, test_f1: 0.5803
 epoch: 97, train_loss: 0.4796, test_loss: 2.4257, test_f1: 0.5468
 epoch: 98, train_loss: 0.5013, test_loss: 1.9635, test_f1: 0.5764
 epoch: 99, train_loss: 0.4734, test_loss: 1.6241, test_f1: 0.5592
##################ITERATION #6 ****************************************
 epoch: 0, train_loss: 1.2956, test_loss: 1.3027, test_f1: 0.3611
 epoch: 1, train_loss: 1.1808, test_loss: 1.2835, test_f1: 0.3831
 epoch: 2, train_loss: 1.1359, test_loss: 1.2644, test_f1: 0.4263
 epoch: 3, train_loss: 1.1012, test_loss: 1.2023, test_f1: 0.4072
 epoch: 4, train_loss: 1.0641, test_loss: 1.1249, test_f1: 0.5066
 epoch: 5, train_loss: 1.0276, test_loss: 1.1602, test_f1: 0.5275
 epoch: 6, train_loss: 0.9837, test_loss: 1.1802, test_f1: 0.4709
 epoch: 7, train_loss: 1.0038, test_loss: 1.2709, test_f1: 0.5641
 epoch: 8, train_loss: 0.9912, test_loss: 1.1128, test_f1: 0.4905
 epoch: 9, train_loss: 0.9605, test_loss: 1.0545, test_f1: 0.5455
 epoch: 10, train_loss: 0.9445, test_loss: 1.1834, test_f1: 0.4747
 epoch: 11, train_loss: 0.9510, test_loss: 1.0763, test_f1: 0.5536
 epoch: 12, train_loss: 0.9349, test_loss: 1.1100, test_f1: 0.5341
 epoch: 13, train_loss: 0.9332, test_loss: 1.1470, test_f1: 0.5068
 epoch: 14, train_loss: 0.9094, test_loss: 1.1790, test_f1: 0.4795
 epoch: 15, train_loss: 0.8971, test_loss: 1.0437, test_f1: 0.6063
 epoch: 16, train_loss: 0.8891, test_loss: 1.1486, test_f1: 0.5169
 epoch: 17, train_loss: 0.8824, test_loss: 1.0735, test_f1: 0.5306
 epoch: 18, train_loss: 0.8845, test_loss: 1.1013, test_f1: 0.5440
 epoch: 19, train_loss: 0.9338, test_loss: 1.0501, test_f1: 0.5570
 epoch: 20, train_loss: 0.9077, test_loss: 1.0317, test_f1: 0.5366
 epoch: 21, train_loss: 0.8821, test_loss: 1.0041, test_f1: 0.5373
 epoch: 22, train_loss: 0.8837, test_loss: 1.0990, test_f1: 0.5019
 epoch: 23, train_loss: 0.8603, test_loss: 1.0042, test_f1: 0.5747
 epoch: 24, train_loss: 0.8419, test_loss: 1.0366, test_f1: 0.5763
 epoch: 25, train_loss: 0.8531, test_loss: 1.1102, test_f1: 0.5647
 epoch: 26, train_loss: 0.8494, test_loss: 1.0883, test_f1: 0.5672
 epoch: 27, train_loss: 0.8364, test_loss: 1.0044, test_f1: 0.5973
 epoch: 28, train_loss: 0.8059, test_loss: 1.0323, test_f1: 0.5910
 epoch: 29, train_loss: 0.8358, test_loss: 1.1301, test_f1: 0.5222
 epoch: 30, train_loss: 0.8088, test_loss: 1.0136, test_f1: 0.5668
 epoch: 31, train_loss: 0.8281, test_loss: 1.1434, test_f1: 0.5486
 epoch: 32, train_loss: 0.8624, test_loss: 1.0629, test_f1: 0.5633
 epoch: 33, train_loss: 0.8233, test_loss: 1.1557, test_f1: 0.5619
 epoch: 34, train_loss: 0.8086, test_loss: 1.1241, test_f1: 0.5662
 epoch: 35, train_loss: 0.7869, test_loss: 1.0790, test_f1: 0.5467
 epoch: 36, train_loss: 0.7748, test_loss: 1.0519, test_f1: 0.5946
 epoch: 37, train_loss: 0.7718, test_loss: 1.1468, test_f1: 0.5653
 epoch: 38, train_loss: 0.7675, test_loss: 1.0959, test_f1: 0.5916
 epoch: 39, train_loss: 0.7621, test_loss: 1.1492, test_f1: 0.5932
 epoch: 40, train_loss: 0.7740, test_loss: 1.0784, test_f1: 0.5871
 epoch: 41, train_loss: 0.7863, test_loss: 1.0880, test_f1: 0.5649
 epoch: 42, train_loss: 0.7857, test_loss: 1.1574, test_f1: 0.5831
 epoch: 43, train_loss: 0.7579, test_loss: 1.1204, test_f1: 0.5623
 epoch: 44, train_loss: 0.7463, test_loss: 1.1440, test_f1: 0.5787
 epoch: 45, train_loss: 0.7494, test_loss: 1.9946, test_f1: 0.4552
 epoch: 46, train_loss: 0.7638, test_loss: 1.1196, test_f1: 0.6300
 epoch: 47, train_loss: 0.7261, test_loss: 1.1370, test_f1: 0.5765
 epoch: 48, train_loss: 0.7630, test_loss: 1.1236, test_f1: 0.6500
 epoch: 49, train_loss: 0.7520, test_loss: 1.1143, test_f1: 0.6088
 epoch: 50, train_loss: 0.7399, test_loss: 1.0875, test_f1: 0.6079
 epoch: 51, train_loss: 0.6948, test_loss: 1.1180, test_f1: 0.6111
 epoch: 52, train_loss: 0.6931, test_loss: 1.1254, test_f1: 0.6067
 epoch: 53, train_loss: 0.6855, test_loss: 1.1102, test_f1: 0.6414
 epoch: 54, train_loss: 0.6681, test_loss: 1.1277, test_f1: 0.6083
 epoch: 55, train_loss: 0.6522, test_loss: 1.0875, test_f1: 0.5815
 epoch: 56, train_loss: 0.6679, test_loss: 1.1412, test_f1: 0.6177
 epoch: 57, train_loss: 0.6364, test_loss: 1.2085, test_f1: 0.6096
 epoch: 58, train_loss: 0.6476, test_loss: 1.1950, test_f1: 0.5731
 epoch: 59, train_loss: 0.6569, test_loss: 1.2388, test_f1: 0.5871
 epoch: 60, train_loss: 0.6869, test_loss: 1.1434, test_f1: 0.5917
 epoch: 61, train_loss: 0.6595, test_loss: 1.2185, test_f1: 0.5930
 epoch: 62, train_loss: 0.6561, test_loss: 1.1620, test_f1: 0.6203
 epoch: 63, train_loss: 0.6449, test_loss: 1.2193, test_f1: 0.6087
 epoch: 64, train_loss: 0.6558, test_loss: 1.2175, test_f1: 0.6148
 epoch: 65, train_loss: 0.6480, test_loss: 1.2638, test_f1: 0.5949
 epoch: 66, train_loss: 0.6123, test_loss: 1.1936, test_f1: 0.6041
 epoch: 67, train_loss: 0.6234, test_loss: 1.1931, test_f1: 0.5860
 epoch: 68, train_loss: 0.6182, test_loss: 1.3519, test_f1: 0.5842
 epoch: 69, train_loss: 0.6343, test_loss: 1.2329, test_f1: 0.5766
 epoch: 70, train_loss: 0.6160, test_loss: 1.2616, test_f1: 0.6284
 epoch: 71, train_loss: 0.6262, test_loss: 1.2100, test_f1: 0.6252
 epoch: 72, train_loss: 0.5913, test_loss: 1.1131, test_f1: 0.6344
 epoch: 73, train_loss: 0.5928, test_loss: 1.3005, test_f1: 0.6113
 epoch: 74, train_loss: 0.6008, test_loss: 1.3706, test_f1: 0.5595
 epoch: 75, train_loss: 0.6174, test_loss: 1.1365, test_f1: 0.5918
 epoch: 76, train_loss: 0.5995, test_loss: 1.3807, test_f1: 0.6136
 epoch: 77, train_loss: 0.5983, test_loss: 1.2862, test_f1: 0.6140
 epoch: 78, train_loss: 0.6188, test_loss: 1.2209, test_f1: 0.5638
 epoch: 79, train_loss: 0.6069, test_loss: 1.2422, test_f1: 0.5963
 epoch: 80, train_loss: 0.5928, test_loss: 1.2078, test_f1: 0.6005
 epoch: 81, train_loss: 0.5859, test_loss: 1.2491, test_f1: 0.5937
 epoch: 82, train_loss: 0.6023, test_loss: 1.3120, test_f1: 0.6056
 epoch: 83, train_loss: 0.5759, test_loss: 1.3777, test_f1: 0.5984
 epoch: 84, train_loss: 0.5753, test_loss: 1.4989, test_f1: 0.5985
 epoch: 85, train_loss: 0.5553, test_loss: 1.2662, test_f1: 0.6030
 epoch: 86, train_loss: 0.5824, test_loss: 1.3576, test_f1: 0.5677
 epoch: 87, train_loss: 0.5676, test_loss: 1.2537, test_f1: 0.6144
 epoch: 88, train_loss: 0.5503, test_loss: 1.3678, test_f1: 0.5924
 epoch: 89, train_loss: 0.5530, test_loss: 1.3027, test_f1: 0.6415
 epoch: 90, train_loss: 0.5883, test_loss: 1.2946, test_f1: 0.6031
 epoch: 91, train_loss: 0.5618, test_loss: 1.3138, test_f1: 0.6144
 epoch: 92, train_loss: 0.5417, test_loss: 1.2046, test_f1: 0.6336
 epoch: 93, train_loss: 0.5786, test_loss: 1.3307, test_f1: 0.6289
 epoch: 94, train_loss: 0.5878, test_loss: 1.3413, test_f1: 0.5917
 epoch: 95, train_loss: 0.5381, test_loss: 1.3082, test_f1: 0.6025
 epoch: 96, train_loss: 0.5224, test_loss: 1.3061, test_f1: 0.5994
 epoch: 97, train_loss: 0.5474, test_loss: 1.2430, test_f1: 0.6246
 epoch: 98, train_loss: 0.5910, test_loss: 1.1886, test_f1: 0.6255
 epoch: 99, train_loss: 0.5663, test_loss: 1.3663, test_f1: 0.5909
##################ITERATION #7 ****************************************
 epoch: 0, train_loss: 1.3008, test_loss: 1.3785, test_f1: 0.3276
 epoch: 1, train_loss: 1.1822, test_loss: 1.3300, test_f1: 0.2307
 epoch: 2, train_loss: 1.1524, test_loss: 1.2431, test_f1: 0.3064
 epoch: 3, train_loss: 1.1138, test_loss: 1.2267, test_f1: 0.4469
 epoch: 4, train_loss: 1.0839, test_loss: 1.2605, test_f1: 0.3853
 epoch: 5, train_loss: 1.0827, test_loss: 1.2182, test_f1: 0.4180
 epoch: 6, train_loss: 1.0684, test_loss: 1.2038, test_f1: 0.4427
 epoch: 7, train_loss: 1.0394, test_loss: 1.2012, test_f1: 0.5036
 epoch: 8, train_loss: 0.9733, test_loss: 1.2022, test_f1: 0.4428
 epoch: 9, train_loss: 0.9725, test_loss: 1.2155, test_f1: 0.4082
 epoch: 10, train_loss: 0.9570, test_loss: 1.1701, test_f1: 0.4915
 epoch: 11, train_loss: 0.9537, test_loss: 1.0580, test_f1: 0.5390
 epoch: 12, train_loss: 0.9190, test_loss: 1.1661, test_f1: 0.4896
 epoch: 13, train_loss: 0.9189, test_loss: 1.0483, test_f1: 0.5017
 epoch: 14, train_loss: 0.8960, test_loss: 1.0490, test_f1: 0.4962
 epoch: 15, train_loss: 0.9181, test_loss: 1.0012, test_f1: 0.5950
 epoch: 16, train_loss: 0.8621, test_loss: 1.0730, test_f1: 0.4640
 epoch: 17, train_loss: 0.8650, test_loss: 1.0966, test_f1: 0.5230
 epoch: 18, train_loss: 0.8653, test_loss: 1.0049, test_f1: 0.5571
 epoch: 19, train_loss: 0.8550, test_loss: 1.5697, test_f1: 0.4474
 epoch: 20, train_loss: 0.8350, test_loss: 1.2255, test_f1: 0.5269
 epoch: 21, train_loss: 0.8364, test_loss: 1.4390, test_f1: 0.4927
 epoch: 22, train_loss: 0.8403, test_loss: 1.1366, test_f1: 0.5563
 epoch: 23, train_loss: 0.8188, test_loss: 1.0646, test_f1: 0.5349
 epoch: 24, train_loss: 0.8259, test_loss: 1.0410, test_f1: 0.5759
 epoch: 25, train_loss: 0.7945, test_loss: 0.9870, test_f1: 0.5631
 epoch: 26, train_loss: 0.7972, test_loss: 1.1264, test_f1: 0.5230
 epoch: 27, train_loss: 0.8056, test_loss: 1.0599, test_f1: 0.5464
 epoch: 28, train_loss: 0.8388, test_loss: 1.0803, test_f1: 0.5163
 epoch: 29, train_loss: 0.8379, test_loss: 1.1089, test_f1: 0.5743
 epoch: 30, train_loss: 0.8055, test_loss: 1.1365, test_f1: 0.5094
 epoch: 31, train_loss: 0.8060, test_loss: 1.1268, test_f1: 0.5701
 epoch: 32, train_loss: 0.7872, test_loss: 1.0804, test_f1: 0.6105
 epoch: 33, train_loss: 0.7832, test_loss: 1.1815, test_f1: 0.5952
 epoch: 34, train_loss: 0.7789, test_loss: 1.1381, test_f1: 0.5697
 epoch: 35, train_loss: 0.7633, test_loss: 1.1824, test_f1: 0.4787
 epoch: 36, train_loss: 0.7841, test_loss: 1.4017, test_f1: 0.5672
 epoch: 37, train_loss: 0.7738, test_loss: 1.1051, test_f1: 0.6035
 epoch: 38, train_loss: 0.7673, test_loss: 1.0944, test_f1: 0.5581
 epoch: 39, train_loss: 0.7928, test_loss: 1.0249, test_f1: 0.5323
 epoch: 40, train_loss: 0.7881, test_loss: 1.0623, test_f1: 0.5149
 epoch: 41, train_loss: 0.7588, test_loss: 1.0073, test_f1: 0.5805
 epoch: 42, train_loss: 0.7464, test_loss: 1.2098, test_f1: 0.5842
 epoch: 43, train_loss: 0.7311, test_loss: 1.1343, test_f1: 0.5051
 epoch: 44, train_loss: 0.7364, test_loss: 1.2558, test_f1: 0.5751
 epoch: 45, train_loss: 0.7626, test_loss: 1.0639, test_f1: 0.4762
 epoch: 46, train_loss: 0.7319, test_loss: 1.2959, test_f1: 0.5128
 epoch: 47, train_loss: 0.7512, test_loss: 1.2038, test_f1: 0.4946
 epoch: 48, train_loss: 0.7595, test_loss: 1.0675, test_f1: 0.5981
 epoch: 49, train_loss: 0.7746, test_loss: 1.2119, test_f1: 0.4750
 epoch: 50, train_loss: 0.7637, test_loss: 1.1116, test_f1: 0.5398
 epoch: 51, train_loss: 0.7291, test_loss: 1.0438, test_f1: 0.5683
 epoch: 52, train_loss: 0.6923, test_loss: 1.0799, test_f1: 0.5605
 epoch: 53, train_loss: 0.6955, test_loss: 1.2691, test_f1: 0.5864
 epoch: 54, train_loss: 0.6879, test_loss: 1.1763, test_f1: 0.5737
 epoch: 55, train_loss: 0.6909, test_loss: 1.2122, test_f1: 0.5670
 epoch: 56, train_loss: 0.6761, test_loss: 1.3063, test_f1: 0.5907
 epoch: 57, train_loss: 0.6843, test_loss: 1.2224, test_f1: 0.5957
 epoch: 58, train_loss: 0.6611, test_loss: 1.2447, test_f1: 0.5607
 epoch: 59, train_loss: 0.6583, test_loss: 1.2794, test_f1: 0.5343
 epoch: 60, train_loss: 0.6617, test_loss: 1.2590, test_f1: 0.5890
 epoch: 61, train_loss: 0.6389, test_loss: 1.2382, test_f1: 0.6116
 epoch: 62, train_loss: 0.6635, test_loss: 1.1783, test_f1: 0.5586
 epoch: 63, train_loss: 0.6506, test_loss: 1.3022, test_f1: 0.6289
 epoch: 64, train_loss: 0.6270, test_loss: 1.2647, test_f1: 0.6006
 epoch: 65, train_loss: 0.6570, test_loss: 1.3578, test_f1: 0.5566
 epoch: 66, train_loss: 0.6348, test_loss: 1.3399, test_f1: 0.5621
 epoch: 67, train_loss: 0.6268, test_loss: 1.4635, test_f1: 0.5567
 epoch: 68, train_loss: 0.6386, test_loss: 1.2094, test_f1: 0.5914
 epoch: 69, train_loss: 0.6340, test_loss: 1.3374, test_f1: 0.6209
 epoch: 70, train_loss: 0.6377, test_loss: 1.1899, test_f1: 0.5488
 epoch: 71, train_loss: 0.6335, test_loss: 1.2942, test_f1: 0.5506
 epoch: 72, train_loss: 0.6183, test_loss: 1.2297, test_f1: 0.5981
 epoch: 73, train_loss: 0.5969, test_loss: 1.3032, test_f1: 0.5811
 epoch: 74, train_loss: 0.6287, test_loss: 1.3175, test_f1: 0.5491
 epoch: 75, train_loss: 0.6268, test_loss: 1.7503, test_f1: 0.5260
 epoch: 76, train_loss: 0.6273, test_loss: 1.3279, test_f1: 0.5850
 epoch: 77, train_loss: 0.6053, test_loss: 1.3944, test_f1: 0.5592
 epoch: 78, train_loss: 0.6295, test_loss: 1.4591, test_f1: 0.5329
 epoch: 79, train_loss: 0.6084, test_loss: 1.2340, test_f1: 0.5791
 epoch: 80, train_loss: 0.6182, test_loss: 1.6900, test_f1: 0.5828
 epoch: 81, train_loss: 0.5977, test_loss: 1.5126, test_f1: 0.5748
 epoch: 82, train_loss: 0.5972, test_loss: 1.4344, test_f1: 0.5931
 epoch: 83, train_loss: 0.6077, test_loss: 1.4707, test_f1: 0.5707
 epoch: 84, train_loss: 0.5812, test_loss: 1.5204, test_f1: 0.5682
 epoch: 85, train_loss: 0.5681, test_loss: 1.4133, test_f1: 0.5973
 epoch: 86, train_loss: 0.5811, test_loss: 1.4443, test_f1: 0.5397
 epoch: 87, train_loss: 0.6388, test_loss: 1.4956, test_f1: 0.5773
 epoch: 88, train_loss: 0.5812, test_loss: 1.3719, test_f1: 0.5925
 epoch: 89, train_loss: 0.6027, test_loss: 1.3654, test_f1: 0.5803
 epoch: 90, train_loss: 0.5822, test_loss: 1.5707, test_f1: 0.5678
 epoch: 91, train_loss: 0.5702, test_loss: 1.5766, test_f1: 0.5669
 epoch: 92, train_loss: 0.5909, test_loss: 1.5858, test_f1: 0.5880
 epoch: 93, train_loss: 0.5327, test_loss: 1.6115, test_f1: 0.5925
 epoch: 94, train_loss: 0.5551, test_loss: 1.4923, test_f1: 0.6210
 epoch: 95, train_loss: 0.5441, test_loss: 1.8270, test_f1: 0.5512
 epoch: 96, train_loss: 0.5553, test_loss: 1.6933, test_f1: 0.5481
 epoch: 97, train_loss: 0.5659, test_loss: 1.7718, test_f1: 0.5290
 epoch: 98, train_loss: 0.5738, test_loss: 1.5984, test_f1: 0.5958
 epoch: 99, train_loss: 0.5605, test_loss: 1.4601, test_f1: 0.6019
##################ITERATION #8 ****************************************
 epoch: 0, train_loss: 1.2867, test_loss: 1.4609, test_f1: 0.2233
 epoch: 1, train_loss: 1.2163, test_loss: 1.2499, test_f1: 0.3052
 epoch: 2, train_loss: 1.1383, test_loss: 1.2749, test_f1: 0.3263
 epoch: 3, train_loss: 1.0962, test_loss: 1.2580, test_f1: 0.3891
 epoch: 4, train_loss: 1.0921, test_loss: 1.2224, test_f1: 0.3687
 epoch: 5, train_loss: 1.0469, test_loss: 1.1964, test_f1: 0.3494
 epoch: 6, train_loss: 1.0274, test_loss: 1.2785, test_f1: 0.4167
 epoch: 7, train_loss: 0.9903, test_loss: 1.1607, test_f1: 0.4604
 epoch: 8, train_loss: 0.9685, test_loss: 1.1391, test_f1: 0.4801
 epoch: 9, train_loss: 0.9756, test_loss: 1.4590, test_f1: 0.3597
 epoch: 10, train_loss: 0.9414, test_loss: 1.1027, test_f1: 0.4615
 epoch: 11, train_loss: 0.9136, test_loss: 1.1220, test_f1: 0.5203
 epoch: 12, train_loss: 0.9030, test_loss: 1.1712, test_f1: 0.5260
 epoch: 13, train_loss: 0.9065, test_loss: 1.1656, test_f1: 0.4874
 epoch: 14, train_loss: 0.8969, test_loss: 1.0771, test_f1: 0.5023
 epoch: 15, train_loss: 0.9320, test_loss: 1.3079, test_f1: 0.4361
 epoch: 16, train_loss: 0.8931, test_loss: 1.1456, test_f1: 0.5258
 epoch: 17, train_loss: 0.8752, test_loss: 1.0872, test_f1: 0.5683
 epoch: 18, train_loss: 0.8648, test_loss: 1.1390, test_f1: 0.5076
 epoch: 19, train_loss: 0.8581, test_loss: 1.1796, test_f1: 0.5451
 epoch: 20, train_loss: 0.8860, test_loss: 1.3721, test_f1: 0.5037
 epoch: 21, train_loss: 0.8672, test_loss: 1.1491, test_f1: 0.5743
 epoch: 22, train_loss: 0.8439, test_loss: 1.6250, test_f1: 0.4434
 epoch: 23, train_loss: 0.8321, test_loss: 1.0988, test_f1: 0.5498
 epoch: 24, train_loss: 0.8212, test_loss: 1.1925, test_f1: 0.5194
 epoch: 25, train_loss: 0.8066, test_loss: 1.4798, test_f1: 0.4821
 epoch: 26, train_loss: 0.8291, test_loss: 1.1864, test_f1: 0.5036
 epoch: 27, train_loss: 0.8052, test_loss: 1.3088, test_f1: 0.5206
 epoch: 28, train_loss: 0.7943, test_loss: 1.0971, test_f1: 0.5410
 epoch: 29, train_loss: 0.7876, test_loss: 4.3835, test_f1: 0.5128
 epoch: 30, train_loss: 0.7984, test_loss: 1.0602, test_f1: 0.5169
 epoch: 31, train_loss: 0.8548, test_loss: 1.1694, test_f1: 0.5275
 epoch: 32, train_loss: 0.8248, test_loss: 1.1185, test_f1: 0.5310
 epoch: 33, train_loss: 0.8073, test_loss: 1.1922, test_f1: 0.5355
 epoch: 34, train_loss: 0.8115, test_loss: 1.1020, test_f1: 0.5584
 epoch: 35, train_loss: 0.7901, test_loss: 1.0855, test_f1: 0.5533
 epoch: 36, train_loss: 0.7945, test_loss: 1.2533, test_f1: 0.5232
 epoch: 37, train_loss: 0.8102, test_loss: 1.2394, test_f1: 0.5273
 epoch: 38, train_loss: 0.7930, test_loss: 1.1982, test_f1: 0.5658
 epoch: 39, train_loss: 0.7678, test_loss: 1.0909, test_f1: 0.5716
 epoch: 40, train_loss: 0.8093, test_loss: 1.5070, test_f1: 0.4399
 epoch: 41, train_loss: 0.8127, test_loss: 1.2920, test_f1: 0.4961
 epoch: 42, train_loss: 0.8024, test_loss: 1.0987, test_f1: 0.5609
 epoch: 43, train_loss: 0.7893, test_loss: 1.0806, test_f1: 0.5607
 epoch: 44, train_loss: 0.7414, test_loss: 1.2376, test_f1: 0.5182
 epoch: 45, train_loss: 0.7682, test_loss: 1.5898, test_f1: 0.5305
 epoch: 46, train_loss: 0.7679, test_loss: 1.0638, test_f1: 0.5290
 epoch: 47, train_loss: 0.7630, test_loss: 1.3882, test_f1: 0.4813
 epoch: 48, train_loss: 0.7362, test_loss: 1.2002, test_f1: 0.5559
 epoch: 49, train_loss: 0.7430, test_loss: 1.2082, test_f1: 0.5676
 epoch: 50, train_loss: 0.7240, test_loss: 1.4031, test_f1: 0.5726
 epoch: 51, train_loss: 0.7180, test_loss: 1.2613, test_f1: 0.5579
 epoch: 52, train_loss: 0.7015, test_loss: 1.2499, test_f1: 0.5534
 epoch: 53, train_loss: 0.6836, test_loss: 1.1510, test_f1: 0.5696
 epoch: 54, train_loss: 0.7111, test_loss: 1.3621, test_f1: 0.5707
 epoch: 55, train_loss: 0.6812, test_loss: 1.2980, test_f1: 0.5822
 epoch: 56, train_loss: 0.6810, test_loss: 1.1664, test_f1: 0.5883
 epoch: 57, train_loss: 0.6904, test_loss: 1.0821, test_f1: 0.6338
 epoch: 58, train_loss: 0.6975, test_loss: 1.3917, test_f1: 0.5338
 epoch: 59, train_loss: 0.6896, test_loss: 1.7928, test_f1: 0.5638
 epoch: 60, train_loss: 0.6987, test_loss: 1.2939, test_f1: 0.5854
 epoch: 61, train_loss: 0.6610, test_loss: 1.3257, test_f1: 0.5496
 epoch: 62, train_loss: 0.6452, test_loss: 1.3160, test_f1: 0.5702
 epoch: 63, train_loss: 0.6688, test_loss: 1.3303, test_f1: 0.5564
 epoch: 64, train_loss: 0.6717, test_loss: 1.2441, test_f1: 0.5747
 epoch: 65, train_loss: 0.6752, test_loss: 1.2760, test_f1: 0.5632
 epoch: 66, train_loss: 0.6516, test_loss: 1.1352, test_f1: 0.6133
 epoch: 67, train_loss: 0.6715, test_loss: 1.3828, test_f1: 0.5425
 epoch: 68, train_loss: 0.6575, test_loss: 1.1469, test_f1: 0.5672
 epoch: 69, train_loss: 0.6347, test_loss: 1.6334, test_f1: 0.5241
 epoch: 70, train_loss: 0.6546, test_loss: 1.7025, test_f1: 0.5122
 epoch: 71, train_loss: 0.6586, test_loss: 1.2787, test_f1: 0.5763
 epoch: 72, train_loss: 0.6507, test_loss: 1.3701, test_f1: 0.5723
 epoch: 73, train_loss: 0.6690, test_loss: 1.2269, test_f1: 0.5916
 epoch: 74, train_loss: 0.6644, test_loss: 1.1320, test_f1: 0.6234
 epoch: 75, train_loss: 0.6842, test_loss: 1.2897, test_f1: 0.5623
 epoch: 76, train_loss: 0.6769, test_loss: 1.1805, test_f1: 0.5803
 epoch: 77, train_loss: 0.6624, test_loss: 1.2135, test_f1: 0.5713
 epoch: 78, train_loss: 0.6532, test_loss: 1.1939, test_f1: 0.5462
 epoch: 79, train_loss: 0.6222, test_loss: 1.2429, test_f1: 0.5803
 epoch: 80, train_loss: 0.6274, test_loss: 1.1329, test_f1: 0.6370
 epoch: 81, train_loss: 0.6443, test_loss: 1.4261, test_f1: 0.5608
 epoch: 82, train_loss: 0.6625, test_loss: 1.1309, test_f1: 0.5929
 epoch: 83, train_loss: 0.6307, test_loss: 1.5282, test_f1: 0.5567
 epoch: 84, train_loss: 0.6208, test_loss: 1.3779, test_f1: 0.5904
 epoch: 85, train_loss: 0.6062, test_loss: 1.3330, test_f1: 0.5868
 epoch: 86, train_loss: 0.5951, test_loss: 1.4006, test_f1: 0.5505
 epoch: 87, train_loss: 0.6283, test_loss: 1.1507, test_f1: 0.6115
 epoch: 88, train_loss: 0.6387, test_loss: 1.2021, test_f1: 0.5690
 epoch: 89, train_loss: 0.6113, test_loss: 1.2369, test_f1: 0.5631
 epoch: 90, train_loss: 0.6100, test_loss: 1.4307, test_f1: 0.5376
 epoch: 91, train_loss: 0.6123, test_loss: 1.5417, test_f1: 0.5490
 epoch: 92, train_loss: 0.6086, test_loss: 1.2613, test_f1: 0.5640
 epoch: 93, train_loss: 0.6221, test_loss: 1.2606, test_f1: 0.5945
 epoch: 94, train_loss: 0.5875, test_loss: 1.2637, test_f1: 0.5683
 epoch: 95, train_loss: 0.5655, test_loss: 1.4041, test_f1: 0.5532
 epoch: 96, train_loss: 0.5954, test_loss: 1.3553, test_f1: 0.5470
 epoch: 97, train_loss: 0.5973, test_loss: 1.5385, test_f1: 0.5786
 epoch: 98, train_loss: 0.5798, test_loss: 1.4468, test_f1: 0.5596
 epoch: 99, train_loss: 0.5983, test_loss: 1.4707, test_f1: 0.5808
##################ITERATION #9 ****************************************
 epoch: 0, train_loss: 1.3420, test_loss: 1.3220, test_f1: 0.3390
 epoch: 1, train_loss: 1.2106, test_loss: 1.2856, test_f1: 0.3203
 epoch: 2, train_loss: 1.1569, test_loss: 1.2628, test_f1: 0.3972
 epoch: 3, train_loss: 1.0958, test_loss: 1.3348, test_f1: 0.3774
 epoch: 4, train_loss: 1.0810, test_loss: 1.1628, test_f1: 0.4628
 epoch: 5, train_loss: 1.0295, test_loss: 1.2831, test_f1: 0.4278
 epoch: 6, train_loss: 0.9884, test_loss: 1.1061, test_f1: 0.5101
 epoch: 7, train_loss: 1.0336, test_loss: 1.1435, test_f1: 0.4315
 epoch: 8, train_loss: 0.9855, test_loss: 1.0856, test_f1: 0.5335
 epoch: 9, train_loss: 0.9591, test_loss: 0.9986, test_f1: 0.5250
 epoch: 10, train_loss: 0.9569, test_loss: 1.0725, test_f1: 0.4038
 epoch: 11, train_loss: 0.9196, test_loss: 1.0463, test_f1: 0.4838
 epoch: 12, train_loss: 0.9531, test_loss: 1.1132, test_f1: 0.4179
 epoch: 13, train_loss: 0.9335, test_loss: 1.0938, test_f1: 0.4714
 epoch: 14, train_loss: 0.8754, test_loss: 1.0882, test_f1: 0.5451
 epoch: 15, train_loss: 0.8759, test_loss: 1.2888, test_f1: 0.4779
 epoch: 16, train_loss: 0.8727, test_loss: 1.1212, test_f1: 0.4816
 epoch: 17, train_loss: 0.8772, test_loss: 1.1240, test_f1: 0.4874
 epoch: 18, train_loss: 0.8477, test_loss: 1.3702, test_f1: 0.4635
 epoch: 19, train_loss: 0.8507, test_loss: 1.0564, test_f1: 0.5296
 epoch: 20, train_loss: 0.8696, test_loss: 1.2279, test_f1: 0.4682
 epoch: 21, train_loss: 0.8943, test_loss: 1.1067, test_f1: 0.4774
 epoch: 22, train_loss: 0.8534, test_loss: 1.0438, test_f1: 0.5496
 epoch: 23, train_loss: 0.8532, test_loss: 1.1163, test_f1: 0.4350
 epoch: 24, train_loss: 0.8705, test_loss: 1.1669, test_f1: 0.5406
 epoch: 25, train_loss: 0.8509, test_loss: 1.2319, test_f1: 0.3962
 epoch: 26, train_loss: 0.8244, test_loss: 1.2078, test_f1: 0.4433
 epoch: 27, train_loss: 0.8407, test_loss: 1.2560, test_f1: 0.4860
 epoch: 28, train_loss: 0.8069, test_loss: 1.1355, test_f1: 0.4844
 epoch: 29, train_loss: 0.8117, test_loss: 1.3203, test_f1: 0.4631
 epoch: 30, train_loss: 0.8290, test_loss: 1.1932, test_f1: 0.4688
 epoch: 31, train_loss: 0.8033, test_loss: 1.1770, test_f1: 0.4725
 epoch: 32, train_loss: 0.8034, test_loss: 1.1214, test_f1: 0.4783
 epoch: 33, train_loss: 0.8207, test_loss: 1.3530, test_f1: 0.4893
 epoch: 34, train_loss: 0.7959, test_loss: 1.1247, test_f1: 0.5010
 epoch: 35, train_loss: 0.7686, test_loss: 1.6960, test_f1: 0.3927
 epoch: 36, train_loss: 0.7962, test_loss: 1.3421, test_f1: 0.4994
 epoch: 37, train_loss: 0.7905, test_loss: 1.1528, test_f1: 0.4769
 epoch: 38, train_loss: 0.7792, test_loss: 1.5801, test_f1: 0.4132
 epoch: 39, train_loss: 0.7956, test_loss: 1.0927, test_f1: 0.5206
 epoch: 40, train_loss: 0.7931, test_loss: 1.2521, test_f1: 0.4884
 epoch: 41, train_loss: 0.7993, test_loss: 1.1320, test_f1: 0.5301
 epoch: 42, train_loss: 0.7781, test_loss: 1.1466, test_f1: 0.5536
 epoch: 43, train_loss: 0.7784, test_loss: 1.2471, test_f1: 0.4832
 epoch: 44, train_loss: 0.7615, test_loss: 1.2213, test_f1: 0.5365
 epoch: 45, train_loss: 0.7556, test_loss: 1.3329, test_f1: 0.5164
 epoch: 46, train_loss: 0.7578, test_loss: 1.1227, test_f1: 0.5601
 epoch: 47, train_loss: 0.7301, test_loss: 1.1359, test_f1: 0.5216
 epoch: 48, train_loss: 0.7521, test_loss: 1.1357, test_f1: 0.4438
 epoch: 49, train_loss: 0.7999, test_loss: 1.1382, test_f1: 0.5400
 epoch: 50, train_loss: 0.7632, test_loss: 1.1349, test_f1: 0.5523
 epoch: 51, train_loss: 0.7410, test_loss: 1.0843, test_f1: 0.5259
 epoch: 52, train_loss: 0.7225, test_loss: 1.1363, test_f1: 0.5291
 epoch: 53, train_loss: 0.7153, test_loss: 1.1783, test_f1: 0.5354
 epoch: 54, train_loss: 0.7004, test_loss: 1.2091, test_f1: 0.5176
 epoch: 55, train_loss: 0.7040, test_loss: 1.2210, test_f1: 0.5165
 epoch: 56, train_loss: 0.7097, test_loss: 1.2794, test_f1: 0.5591
 epoch: 57, train_loss: 0.6928, test_loss: 1.2226, test_f1: 0.5554
 epoch: 58, train_loss: 0.6951, test_loss: 1.1961, test_f1: 0.5577
 epoch: 59, train_loss: 0.6874, test_loss: 1.4013, test_f1: 0.5170
 epoch: 60, train_loss: 0.6755, test_loss: 1.3482, test_f1: 0.5314
 epoch: 61, train_loss: 0.6611, test_loss: 1.3051, test_f1: 0.5114
 epoch: 62, train_loss: 0.6921, test_loss: 1.3479, test_f1: 0.5553
 epoch: 63, train_loss: 0.6775, test_loss: 1.1947, test_f1: 0.5672
 epoch: 64, train_loss: 0.6711, test_loss: 1.3932, test_f1: 0.5199
 epoch: 65, train_loss: 0.6636, test_loss: 1.3515, test_f1: 0.5549
 epoch: 66, train_loss: 0.6754, test_loss: 1.3772, test_f1: 0.5545
 epoch: 67, train_loss: 0.6567, test_loss: 1.2154, test_f1: 0.5632
 epoch: 68, train_loss: 0.6748, test_loss: 1.2884, test_f1: 0.5710
 epoch: 69, train_loss: 0.6849, test_loss: 1.2924, test_f1: 0.5922
 epoch: 70, train_loss: 0.6725, test_loss: 1.4809, test_f1: 0.5774
 epoch: 71, train_loss: 0.6628, test_loss: 1.3246, test_f1: 0.5631
 epoch: 72, train_loss: 0.6650, test_loss: 1.2192, test_f1: 0.6160
 epoch: 73, train_loss: 0.6244, test_loss: 1.3224, test_f1: 0.5410
 epoch: 74, train_loss: 0.6496, test_loss: 1.5646, test_f1: 0.5197
 epoch: 75, train_loss: 0.6597, test_loss: 1.2675, test_f1: 0.5761
 epoch: 76, train_loss: 0.6623, test_loss: 1.3342, test_f1: 0.5269
 epoch: 77, train_loss: 0.6449, test_loss: 1.2559, test_f1: 0.5745
 epoch: 78, train_loss: 0.6389, test_loss: 1.3261, test_f1: 0.5786
 epoch: 79, train_loss: 0.6071, test_loss: 1.4164, test_f1: 0.5711
 epoch: 80, train_loss: 0.6170, test_loss: 1.4617, test_f1: 0.5363
 epoch: 81, train_loss: 0.6395, test_loss: 1.2986, test_f1: 0.5834
 epoch: 82, train_loss: 0.6222, test_loss: 1.2223, test_f1: 0.6126
 epoch: 83, train_loss: 0.6215, test_loss: 1.4007, test_f1: 0.5694
 epoch: 84, train_loss: 0.6528, test_loss: 1.3662, test_f1: 0.5632
 epoch: 85, train_loss: 0.6427, test_loss: 1.4267, test_f1: 0.5393
 epoch: 86, train_loss: 0.6272, test_loss: 1.4792, test_f1: 0.5541
 epoch: 87, train_loss: 0.6822, test_loss: 1.2222, test_f1: 0.5595
 epoch: 88, train_loss: 0.6324, test_loss: 1.2041, test_f1: 0.5793
 epoch: 89, train_loss: 0.6376, test_loss: 1.3665, test_f1: 0.6010
 epoch: 90, train_loss: 0.6311, test_loss: 1.3357, test_f1: 0.5591
 epoch: 91, train_loss: 0.6250, test_loss: 1.4052, test_f1: 0.5476
 epoch: 92, train_loss: 0.6289, test_loss: 1.2591, test_f1: 0.5720
 epoch: 93, train_loss: 0.6349, test_loss: 1.3436, test_f1: 0.5371
 epoch: 94, train_loss: 0.6304, test_loss: 1.2980, test_f1: 0.5934
 epoch: 95, train_loss: 0.6213, test_loss: 1.2492, test_f1: 0.6031
 epoch: 96, train_loss: 0.5950, test_loss: 1.2987, test_f1: 0.5815
 epoch: 97, train_loss: 0.6153, test_loss: 1.4268, test_f1: 0.5351
 epoch: 98, train_loss: 0.5896, test_loss: 1.4778, test_f1: 0.5827
 epoch: 99, train_loss: 0.6126, test_loss: 1.3720, test_f1: 0.5784

Training completed in 486.08 seconds
Best F1: 0.6531 at epoch 91
Mean F1 across iterations: 0.6296  0.0147
========================FINAL RESULTS================================
FEGIN weighted F1: 0.6531  0.0147
python main.py --data ltspice_demos --representation component_component --model FEGIN --layers 5 --hiddens 32 --batch_size 64 --lr 0.01 --emb_size 128 --epochs 100 --save_appendix component_component_L5_H32_BS64_LR0.01_E128 --no_val
-----



STDERR:
  File "main.py", line 370, in <module>
    main()
  File "main.py", line 254, in main
    dataset = dataset_class(
  File "/home/philip/projects/ltspice_examples_code_repo/Circuit-Completion-Using-GNNs/component_classification_with_link_prediction_head/evaluation/FEGIN/kernel/circuit_datasets.py", line 15, in __init__
    self.data, self.slices = torch.load(self.processed_paths[0])
  File "/home/philip/.local/lib/python3.8/site-packages/torch/serialization.py", line 1040, in load
    warnings.warn(
  File "/usr/lib/python3.8/warnings.py", line 109, in _showwarnmsg
    sw(msg.message, msg.category, msg.filename, msg.lineno,
  File "main.py", line 47, in warn_with_traceback
    traceback.print_stack(file=log)
/home/philip/projects/ltspice_examples_code_repo/Circuit-Completion-Using-GNNs/component_classification_with_link_prediction_head/evaluation/FEGIN/kernel/circuit_datasets.py:15: FutureWarning: You are using `torch.load` with `weights_only=False` (the current default value), which uses the default pickle module implicitly. It is possible to construct malicious pickle data which will execute arbitrary code during unpickling (See https://github.com/pytorch/pytorch/blob/main/SECURITY.md#untrusted-models for more details). In a future release, the default value for `weights_only` will be flipped to `True`. This limits the functions that could be executed during unpickling. Arbitrary objects will no longer be allowed to be loaded via this mode unless they are explicitly allowlisted by the user via `torch.serialization.add_safe_globals`. We recommend you start setting `weights_only=True` for any use case where you don't have full control of the loaded file. Please open an issue on GitHub for any issues related to this experimental feature.
  self.data, self.slices = torch.load(self.processed_paths[0])
