STDOUT:
Results will be saved in /home/philip/projects/ltspice_examples_code_repo/Circuit-Completion-Using-GNNs/component_classification_with_link_prediction_head/evaluation/FEGIN/results/model_FEGIN_dataset_ltspice_examples
Command line input: python main.py --data ltspice_examples --representation component_pin --model FEGIN --layers 6 --hiddens 16 --batch_size 256 --lr 0.0001 --emb_size 512 --epochs 100 --save_appendix component_pin_L6_H16_BS256_LR0.0001_E512 --no_val
 is saved.
-----
ltspice_examples - FEGIN
Using 6 layers, 16 hidden units, h = 2
Loading component_pin representation dataset
ENTERED
Training FEGIN on component_pin representation
Train: 3560, Test: 848
##################ITERATION #0 ****************************************
 epoch: 0, train_loss: 1.4665, test_loss: 1.4547, test_f1: 0.0789
 epoch: 1, train_loss: 1.4638, test_loss: 1.4529, test_f1: 0.0789
 epoch: 2, train_loss: 1.4622, test_loss: 1.4514, test_f1: 0.0789
 epoch: 3, train_loss: 1.4605, test_loss: 1.4498, test_f1: 0.0789
 epoch: 4, train_loss: 1.4590, test_loss: 1.4484, test_f1: 0.0789
 epoch: 5, train_loss: 1.4575, test_loss: 1.4469, test_f1: 0.0789
 epoch: 6, train_loss: 1.4557, test_loss: 1.4452, test_f1: 0.0789
 epoch: 7, train_loss: 1.4541, test_loss: 1.4437, test_f1: 0.0789
 epoch: 8, train_loss: 1.4527, test_loss: 1.4422, test_f1: 0.0789
 epoch: 9, train_loss: 1.4508, test_loss: 1.4408, test_f1: 0.0789
 epoch: 10, train_loss: 1.4493, test_loss: 1.4395, test_f1: 0.0789
 epoch: 11, train_loss: 1.4478, test_loss: 1.4380, test_f1: 0.0789
 epoch: 12, train_loss: 1.4465, test_loss: 1.4365, test_f1: 0.0789
 epoch: 13, train_loss: 1.4449, test_loss: 1.4353, test_f1: 0.0789
 epoch: 14, train_loss: 1.4431, test_loss: 1.4337, test_f1: 0.0789
 epoch: 15, train_loss: 1.4413, test_loss: 1.4321, test_f1: 0.0789
 epoch: 16, train_loss: 1.4399, test_loss: 1.4306, test_f1: 0.0789
 epoch: 17, train_loss: 1.4381, test_loss: 1.4291, test_f1: 0.0789
 epoch: 18, train_loss: 1.4366, test_loss: 1.4276, test_f1: 0.0789
 epoch: 19, train_loss: 1.4350, test_loss: 1.4260, test_f1: 0.0789
 epoch: 20, train_loss: 1.4329, test_loss: 1.4244, test_f1: 0.0789
 epoch: 21, train_loss: 1.4315, test_loss: 1.4229, test_f1: 0.0789
 epoch: 22, train_loss: 1.4296, test_loss: 1.4213, test_f1: 0.0791
 epoch: 23, train_loss: 1.4283, test_loss: 1.4195, test_f1: 0.0794
 epoch: 24, train_loss: 1.4268, test_loss: 1.4182, test_f1: 0.0794
 epoch: 25, train_loss: 1.4247, test_loss: 1.4163, test_f1: 0.0939
 epoch: 26, train_loss: 1.4237, test_loss: 1.4147, test_f1: 0.1017
 epoch: 27, train_loss: 1.4213, test_loss: 1.4129, test_f1: 0.1144
 epoch: 28, train_loss: 1.4191, test_loss: 1.4111, test_f1: 0.1482
 epoch: 29, train_loss: 1.4170, test_loss: 1.4090, test_f1: 0.1603
 epoch: 30, train_loss: 1.4152, test_loss: 1.4070, test_f1: 0.1677
 epoch: 31, train_loss: 1.4125, test_loss: 1.4045, test_f1: 0.1677
 epoch: 32, train_loss: 1.4104, test_loss: 1.4019, test_f1: 0.1713
 epoch: 33, train_loss: 1.4075, test_loss: 1.3992, test_f1: 0.1874
 epoch: 34, train_loss: 1.4053, test_loss: 1.3961, test_f1: 0.1948
 epoch: 35, train_loss: 1.4003, test_loss: 1.3927, test_f1: 0.2026
 epoch: 36, train_loss: 1.3975, test_loss: 1.3891, test_f1: 0.2058
 epoch: 37, train_loss: 1.3925, test_loss: 1.3850, test_f1: 0.2019
 epoch: 38, train_loss: 1.3906, test_loss: 1.3810, test_f1: 0.1958
 epoch: 39, train_loss: 1.3852, test_loss: 1.3767, test_f1: 0.1958
 epoch: 40, train_loss: 1.3818, test_loss: 1.3723, test_f1: 0.1990
 epoch: 41, train_loss: 1.3763, test_loss: 1.3664, test_f1: 0.1984
 epoch: 42, train_loss: 1.3707, test_loss: 1.3618, test_f1: 0.1980
 epoch: 43, train_loss: 1.3647, test_loss: 1.3565, test_f1: 0.1965
 epoch: 44, train_loss: 1.3611, test_loss: 1.3510, test_f1: 0.2115
 epoch: 45, train_loss: 1.3536, test_loss: 1.3451, test_f1: 0.2494
 epoch: 46, train_loss: 1.3487, test_loss: 1.3388, test_f1: 0.2849
 epoch: 47, train_loss: 1.3436, test_loss: 1.3319, test_f1: 0.3019
 epoch: 48, train_loss: 1.3350, test_loss: 1.3254, test_f1: 0.2972
 epoch: 49, train_loss: 1.3325, test_loss: 1.3188, test_f1: 0.3135
 epoch: 50, train_loss: 1.3233, test_loss: 1.3125, test_f1: 0.3156
 epoch: 51, train_loss: 1.3194, test_loss: 1.3091, test_f1: 0.3124
 epoch: 52, train_loss: 1.3136, test_loss: 1.3065, test_f1: 0.3053
 epoch: 53, train_loss: 1.3167, test_loss: 1.3029, test_f1: 0.3187
 epoch: 54, train_loss: 1.3133, test_loss: 1.2992, test_f1: 0.3131
 epoch: 55, train_loss: 1.3124, test_loss: 1.2958, test_f1: 0.3074
 epoch: 56, train_loss: 1.3081, test_loss: 1.2929, test_f1: 0.3010
 epoch: 57, train_loss: 1.3028, test_loss: 1.2903, test_f1: 0.2959
 epoch: 58, train_loss: 1.3042, test_loss: 1.2878, test_f1: 0.2970
 epoch: 59, train_loss: 1.3006, test_loss: 1.2853, test_f1: 0.2981
 epoch: 60, train_loss: 1.2974, test_loss: 1.2825, test_f1: 0.2975
 epoch: 61, train_loss: 1.2954, test_loss: 1.2798, test_f1: 0.2888
 epoch: 62, train_loss: 1.2948, test_loss: 1.2776, test_f1: 0.2859
 epoch: 63, train_loss: 1.2942, test_loss: 1.2751, test_f1: 0.2737
 epoch: 64, train_loss: 1.2889, test_loss: 1.2725, test_f1: 0.2751
 epoch: 65, train_loss: 1.2864, test_loss: 1.2699, test_f1: 0.2714
 epoch: 66, train_loss: 1.2869, test_loss: 1.2679, test_f1: 0.2752
 epoch: 67, train_loss: 1.2823, test_loss: 1.2653, test_f1: 0.2702
 epoch: 68, train_loss: 1.2838, test_loss: 1.2635, test_f1: 0.2709
 epoch: 69, train_loss: 1.2839, test_loss: 1.2621, test_f1: 0.2630
 epoch: 70, train_loss: 1.2818, test_loss: 1.2600, test_f1: 0.2636
 epoch: 71, train_loss: 1.2783, test_loss: 1.2577, test_f1: 0.2631
 epoch: 72, train_loss: 1.2753, test_loss: 1.2563, test_f1: 0.2621
 epoch: 73, train_loss: 1.2754, test_loss: 1.2540, test_f1: 0.2637
 epoch: 74, train_loss: 1.2706, test_loss: 1.2517, test_f1: 0.2643
 epoch: 75, train_loss: 1.2717, test_loss: 1.2507, test_f1: 0.2627
 epoch: 76, train_loss: 1.2718, test_loss: 1.2493, test_f1: 0.2657
 epoch: 77, train_loss: 1.2692, test_loss: 1.2470, test_f1: 0.2452
 epoch: 78, train_loss: 1.2659, test_loss: 1.2454, test_f1: 0.2424
 epoch: 79, train_loss: 1.2662, test_loss: 1.2435, test_f1: 0.2426
 epoch: 80, train_loss: 1.2651, test_loss: 1.2432, test_f1: 0.2365
 epoch: 81, train_loss: 1.2580, test_loss: 1.2398, test_f1: 0.2399
 epoch: 82, train_loss: 1.2653, test_loss: 1.2394, test_f1: 0.2388
 epoch: 83, train_loss: 1.2632, test_loss: 1.2379, test_f1: 0.2436
 epoch: 84, train_loss: 1.2603, test_loss: 1.2368, test_f1: 0.2436
 epoch: 85, train_loss: 1.2618, test_loss: 1.2352, test_f1: 0.2423
 epoch: 86, train_loss: 1.2558, test_loss: 1.2345, test_f1: 0.2533
 epoch: 87, train_loss: 1.2550, test_loss: 1.2321, test_f1: 0.2502
 epoch: 88, train_loss: 1.2537, test_loss: 1.2313, test_f1: 0.2516
 epoch: 89, train_loss: 1.2479, test_loss: 1.2285, test_f1: 0.2588
 epoch: 90, train_loss: 1.2543, test_loss: 1.2279, test_f1: 0.2618
 epoch: 91, train_loss: 1.2501, test_loss: 1.2262, test_f1: 0.2623
 epoch: 92, train_loss: 1.2483, test_loss: 1.2248, test_f1: 0.2623
 epoch: 93, train_loss: 1.2494, test_loss: 1.2233, test_f1: 0.2721
 epoch: 94, train_loss: 1.2501, test_loss: 1.2223, test_f1: 0.2765
 epoch: 95, train_loss: 1.2481, test_loss: 1.2204, test_f1: 0.2795
 epoch: 96, train_loss: 1.2464, test_loss: 1.2194, test_f1: 0.2840
 epoch: 97, train_loss: 1.2389, test_loss: 1.2177, test_f1: 0.2895
 epoch: 98, train_loss: 1.2449, test_loss: 1.2164, test_f1: 0.2912
 epoch: 99, train_loss: 1.2416, test_loss: 1.2150, test_f1: 0.2952
##################ITERATION #1 ****************************************
 epoch: 0, train_loss: 1.4189, test_loss: 1.4121, test_f1: 0.0789
 epoch: 1, train_loss: 1.4163, test_loss: 1.4104, test_f1: 0.0789
 epoch: 2, train_loss: 1.4144, test_loss: 1.4083, test_f1: 0.0789
 epoch: 3, train_loss: 1.4129, test_loss: 1.4067, test_f1: 0.0789
 epoch: 4, train_loss: 1.4109, test_loss: 1.4048, test_f1: 0.0789
 epoch: 5, train_loss: 1.4086, test_loss: 1.4033, test_f1: 0.0789
 epoch: 6, train_loss: 1.4061, test_loss: 1.4015, test_f1: 0.0789
 epoch: 7, train_loss: 1.4024, test_loss: 1.3990, test_f1: 0.0789
 epoch: 8, train_loss: 1.3990, test_loss: 1.3962, test_f1: 0.0789
 epoch: 9, train_loss: 1.3956, test_loss: 1.3934, test_f1: 0.0789
 epoch: 10, train_loss: 1.3912, test_loss: 1.3894, test_f1: 0.0789
 epoch: 11, train_loss: 1.3881, test_loss: 1.3849, test_f1: 0.0789
 epoch: 12, train_loss: 1.3836, test_loss: 1.3802, test_f1: 0.0789
 epoch: 13, train_loss: 1.3780, test_loss: 1.3757, test_f1: 0.1319
 epoch: 14, train_loss: 1.3745, test_loss: 1.3713, test_f1: 0.1869
 epoch: 15, train_loss: 1.3675, test_loss: 1.3671, test_f1: 0.2544
 epoch: 16, train_loss: 1.3644, test_loss: 1.3629, test_f1: 0.2634
 epoch: 17, train_loss: 1.3600, test_loss: 1.3586, test_f1: 0.2687
 epoch: 18, train_loss: 1.3558, test_loss: 1.3543, test_f1: 0.2661
 epoch: 19, train_loss: 1.3511, test_loss: 1.3502, test_f1: 0.2734
 epoch: 20, train_loss: 1.3427, test_loss: 1.3458, test_f1: 0.2687
 epoch: 21, train_loss: 1.3376, test_loss: 1.3416, test_f1: 0.2732
 epoch: 22, train_loss: 1.3339, test_loss: 1.3373, test_f1: 0.2720
 epoch: 23, train_loss: 1.3309, test_loss: 1.3329, test_f1: 0.2728
 epoch: 24, train_loss: 1.3277, test_loss: 1.3281, test_f1: 0.2749
 epoch: 25, train_loss: 1.3217, test_loss: 1.3234, test_f1: 0.2775
 epoch: 26, train_loss: 1.3162, test_loss: 1.3189, test_f1: 0.2702
 epoch: 27, train_loss: 1.3087, test_loss: 1.3144, test_f1: 0.2702
 epoch: 28, train_loss: 1.3059, test_loss: 1.3100, test_f1: 0.2654
 epoch: 29, train_loss: 1.3040, test_loss: 1.3061, test_f1: 0.2647
 epoch: 30, train_loss: 1.2990, test_loss: 1.3023, test_f1: 0.2663
 epoch: 31, train_loss: 1.2942, test_loss: 1.2984, test_f1: 0.2557
 epoch: 32, train_loss: 1.2920, test_loss: 1.2954, test_f1: 0.2524
 epoch: 33, train_loss: 1.2885, test_loss: 1.2919, test_f1: 0.2519
 epoch: 34, train_loss: 1.2844, test_loss: 1.2881, test_f1: 0.2578
 epoch: 35, train_loss: 1.2809, test_loss: 1.2845, test_f1: 0.2469
 epoch: 36, train_loss: 1.2775, test_loss: 1.2827, test_f1: 0.2481
 epoch: 37, train_loss: 1.2747, test_loss: 1.2800, test_f1: 0.2453
 epoch: 38, train_loss: 1.2732, test_loss: 1.2774, test_f1: 0.2478
 epoch: 39, train_loss: 1.2682, test_loss: 1.2745, test_f1: 0.2435
 epoch: 40, train_loss: 1.2678, test_loss: 1.2710, test_f1: 0.2437
 epoch: 41, train_loss: 1.2670, test_loss: 1.2683, test_f1: 0.2529
 epoch: 42, train_loss: 1.2643, test_loss: 1.2655, test_f1: 0.2293
 epoch: 43, train_loss: 1.2620, test_loss: 1.2627, test_f1: 0.2517
 epoch: 44, train_loss: 1.2602, test_loss: 1.2608, test_f1: 0.2583
 epoch: 45, train_loss: 1.2536, test_loss: 1.2587, test_f1: 0.2500
 epoch: 46, train_loss: 1.2568, test_loss: 1.2562, test_f1: 0.2493
 epoch: 47, train_loss: 1.2537, test_loss: 1.2521, test_f1: 0.2613
 epoch: 48, train_loss: 1.2493, test_loss: 1.2489, test_f1: 0.2528
 epoch: 49, train_loss: 1.2497, test_loss: 1.2470, test_f1: 0.2620
 epoch: 50, train_loss: 1.2478, test_loss: 1.2446, test_f1: 0.2586
 epoch: 51, train_loss: 1.2452, test_loss: 1.2439, test_f1: 0.2647
 epoch: 52, train_loss: 1.2450, test_loss: 1.2427, test_f1: 0.2648
 epoch: 53, train_loss: 1.2401, test_loss: 1.2418, test_f1: 0.2642
 epoch: 54, train_loss: 1.2401, test_loss: 1.2411, test_f1: 0.2656
 epoch: 55, train_loss: 1.2395, test_loss: 1.2401, test_f1: 0.2645
 epoch: 56, train_loss: 1.2383, test_loss: 1.2397, test_f1: 0.2633
 epoch: 57, train_loss: 1.2375, test_loss: 1.2385, test_f1: 0.2620
 epoch: 58, train_loss: 1.2411, test_loss: 1.2368, test_f1: 0.2647
 epoch: 59, train_loss: 1.2361, test_loss: 1.2370, test_f1: 0.2654
 epoch: 60, train_loss: 1.2326, test_loss: 1.2348, test_f1: 0.2643
 epoch: 61, train_loss: 1.2340, test_loss: 1.2341, test_f1: 0.2611
 epoch: 62, train_loss: 1.2351, test_loss: 1.2343, test_f1: 0.2632
 epoch: 63, train_loss: 1.2328, test_loss: 1.2314, test_f1: 0.2611
 epoch: 64, train_loss: 1.2332, test_loss: 1.2308, test_f1: 0.2630
 epoch: 65, train_loss: 1.2311, test_loss: 1.2291, test_f1: 0.2630
 epoch: 66, train_loss: 1.2310, test_loss: 1.2291, test_f1: 0.2631
 epoch: 67, train_loss: 1.2316, test_loss: 1.2285, test_f1: 0.2624
 epoch: 68, train_loss: 1.2365, test_loss: 1.2270, test_f1: 0.2624
 epoch: 69, train_loss: 1.2249, test_loss: 1.2262, test_f1: 0.2635
 epoch: 70, train_loss: 1.2296, test_loss: 1.2250, test_f1: 0.2631
 epoch: 71, train_loss: 1.2284, test_loss: 1.2240, test_f1: 0.2654
 epoch: 72, train_loss: 1.2297, test_loss: 1.2237, test_f1: 0.2655
 epoch: 73, train_loss: 1.2268, test_loss: 1.2224, test_f1: 0.2673
 epoch: 74, train_loss: 1.2275, test_loss: 1.2220, test_f1: 0.2678
 epoch: 75, train_loss: 1.2253, test_loss: 1.2214, test_f1: 0.2683
 epoch: 76, train_loss: 1.2260, test_loss: 1.2197, test_f1: 0.2669
 epoch: 77, train_loss: 1.2181, test_loss: 1.2186, test_f1: 0.2692
 epoch: 78, train_loss: 1.2182, test_loss: 1.2185, test_f1: 0.2663
 epoch: 79, train_loss: 1.2243, test_loss: 1.2184, test_f1: 0.2676
 epoch: 80, train_loss: 1.2204, test_loss: 1.2177, test_f1: 0.2709
 epoch: 81, train_loss: 1.2184, test_loss: 1.2156, test_f1: 0.2758
 epoch: 82, train_loss: 1.2180, test_loss: 1.2151, test_f1: 0.2710
 epoch: 83, train_loss: 1.2182, test_loss: 1.2142, test_f1: 0.2744
 epoch: 84, train_loss: 1.2181, test_loss: 1.2137, test_f1: 0.2734
 epoch: 85, train_loss: 1.2158, test_loss: 1.2130, test_f1: 0.2765
 epoch: 86, train_loss: 1.2146, test_loss: 1.2131, test_f1: 0.2750
 epoch: 87, train_loss: 1.2178, test_loss: 1.2118, test_f1: 0.2759
 epoch: 88, train_loss: 1.2148, test_loss: 1.2114, test_f1: 0.2780
 epoch: 89, train_loss: 1.2165, test_loss: 1.2104, test_f1: 0.2770
 epoch: 90, train_loss: 1.2138, test_loss: 1.2084, test_f1: 0.2770
 epoch: 91, train_loss: 1.2139, test_loss: 1.2089, test_f1: 0.2825
 epoch: 92, train_loss: 1.2122, test_loss: 1.2082, test_f1: 0.2820
 epoch: 93, train_loss: 1.2124, test_loss: 1.2084, test_f1: 0.2792
 epoch: 94, train_loss: 1.2158, test_loss: 1.2083, test_f1: 0.2806
 epoch: 95, train_loss: 1.2134, test_loss: 1.2066, test_f1: 0.2802
 epoch: 96, train_loss: 1.2093, test_loss: 1.2062, test_f1: 0.2799
 epoch: 97, train_loss: 1.2047, test_loss: 1.2055, test_f1: 0.2805
 epoch: 98, train_loss: 1.2123, test_loss: 1.2056, test_f1: 0.2839
 epoch: 99, train_loss: 1.2031, test_loss: 1.2036, test_f1: 0.2801
##################ITERATION #2 ****************************************
 epoch: 0, train_loss: 1.3774, test_loss: 1.3778, test_f1: 0.0789
 epoch: 1, train_loss: 1.3738, test_loss: 1.3754, test_f1: 0.0789
 epoch: 2, train_loss: 1.3700, test_loss: 1.3724, test_f1: 0.1452
 epoch: 3, train_loss: 1.3676, test_loss: 1.3724, test_f1: 0.1933
 epoch: 4, train_loss: 1.3648, test_loss: 1.3691, test_f1: 0.2666
 epoch: 5, train_loss: 1.3625, test_loss: 1.3646, test_f1: 0.2659
 epoch: 6, train_loss: 1.3591, test_loss: 1.3594, test_f1: 0.2311
 epoch: 7, train_loss: 1.3554, test_loss: 1.3556, test_f1: 0.2270
 epoch: 8, train_loss: 1.3521, test_loss: 1.3526, test_f1: 0.2266
 epoch: 9, train_loss: 1.3489, test_loss: 1.3500, test_f1: 0.2262
 epoch: 10, train_loss: 1.3467, test_loss: 1.3473, test_f1: 0.2262
 epoch: 11, train_loss: 1.3440, test_loss: 1.3437, test_f1: 0.2262
 epoch: 12, train_loss: 1.3405, test_loss: 1.3408, test_f1: 0.2262
 epoch: 13, train_loss: 1.3364, test_loss: 1.3375, test_f1: 0.2260
 epoch: 14, train_loss: 1.3321, test_loss: 1.3342, test_f1: 0.2260
 epoch: 15, train_loss: 1.3307, test_loss: 1.3299, test_f1: 0.2260
 epoch: 16, train_loss: 1.3243, test_loss: 1.3265, test_f1: 0.2260
 epoch: 17, train_loss: 1.3203, test_loss: 1.3233, test_f1: 0.2260
 epoch: 18, train_loss: 1.3179, test_loss: 1.3190, test_f1: 0.2260
 epoch: 19, train_loss: 1.3129, test_loss: 1.3146, test_f1: 0.2260
 epoch: 20, train_loss: 1.3091, test_loss: 1.3099, test_f1: 0.2260
 epoch: 21, train_loss: 1.3040, test_loss: 1.3055, test_f1: 0.2260
 epoch: 22, train_loss: 1.2982, test_loss: 1.3009, test_f1: 0.2260
 epoch: 23, train_loss: 1.2922, test_loss: 1.2973, test_f1: 0.2260
 epoch: 24, train_loss: 1.2885, test_loss: 1.2910, test_f1: 0.2260
 epoch: 25, train_loss: 1.2824, test_loss: 1.2861, test_f1: 0.2260
 epoch: 26, train_loss: 1.2775, test_loss: 1.2809, test_f1: 0.2260
 epoch: 27, train_loss: 1.2731, test_loss: 1.2754, test_f1: 0.2260
 epoch: 28, train_loss: 1.2704, test_loss: 1.2717, test_f1: 0.2260
 epoch: 29, train_loss: 1.2651, test_loss: 1.2675, test_f1: 0.2260
 epoch: 30, train_loss: 1.2613, test_loss: 1.2628, test_f1: 0.2260
 epoch: 31, train_loss: 1.2592, test_loss: 1.2579, test_f1: 0.2260
 epoch: 32, train_loss: 1.2580, test_loss: 1.2548, test_f1: 0.2260
 epoch: 33, train_loss: 1.2522, test_loss: 1.2527, test_f1: 0.2260
 epoch: 34, train_loss: 1.2523, test_loss: 1.2491, test_f1: 0.2260
 epoch: 35, train_loss: 1.2484, test_loss: 1.2475, test_f1: 0.2262
 epoch: 36, train_loss: 1.2447, test_loss: 1.2444, test_f1: 0.2260
 epoch: 37, train_loss: 1.2412, test_loss: 1.2418, test_f1: 0.2260
 epoch: 38, train_loss: 1.2394, test_loss: 1.2388, test_f1: 0.2264
 epoch: 39, train_loss: 1.2384, test_loss: 1.2345, test_f1: 0.2264
 epoch: 40, train_loss: 1.2337, test_loss: 1.2325, test_f1: 0.2264
 epoch: 41, train_loss: 1.2309, test_loss: 1.2307, test_f1: 0.2280
 epoch: 42, train_loss: 1.2273, test_loss: 1.2294, test_f1: 0.2283
 epoch: 43, train_loss: 1.2256, test_loss: 1.2270, test_f1: 0.2291
 epoch: 44, train_loss: 1.2208, test_loss: 1.2259, test_f1: 0.2313
 epoch: 45, train_loss: 1.2186, test_loss: 1.2219, test_f1: 0.2309
 epoch: 46, train_loss: 1.2194, test_loss: 1.2207, test_f1: 0.2319
 epoch: 47, train_loss: 1.2187, test_loss: 1.2183, test_f1: 0.2329
 epoch: 48, train_loss: 1.2152, test_loss: 1.2151, test_f1: 0.2325
 epoch: 49, train_loss: 1.2127, test_loss: 1.2142, test_f1: 0.2341
 epoch: 50, train_loss: 1.2137, test_loss: 1.2128, test_f1: 0.2321
 epoch: 51, train_loss: 1.2100, test_loss: 1.2103, test_f1: 0.2339
 epoch: 52, train_loss: 1.2115, test_loss: 1.2101, test_f1: 0.2350
 epoch: 53, train_loss: 1.2066, test_loss: 1.2088, test_f1: 0.2345
 epoch: 54, train_loss: 1.2068, test_loss: 1.2078, test_f1: 0.2350
 epoch: 55, train_loss: 1.2091, test_loss: 1.2074, test_f1: 0.2341
 epoch: 56, train_loss: 1.2044, test_loss: 1.2076, test_f1: 0.2358
 epoch: 57, train_loss: 1.2019, test_loss: 1.2046, test_f1: 0.2350
 epoch: 58, train_loss: 1.2014, test_loss: 1.2035, test_f1: 0.2360
 epoch: 59, train_loss: 1.2068, test_loss: 1.2031, test_f1: 0.2362
 epoch: 60, train_loss: 1.2040, test_loss: 1.2023, test_f1: 0.2364
 epoch: 61, train_loss: 1.1999, test_loss: 1.2021, test_f1: 0.2366
 epoch: 62, train_loss: 1.2016, test_loss: 1.2020, test_f1: 0.2368
 epoch: 63, train_loss: 1.2019, test_loss: 1.2013, test_f1: 0.2377
 epoch: 64, train_loss: 1.1986, test_loss: 1.1998, test_f1: 0.2368
 epoch: 65, train_loss: 1.1983, test_loss: 1.1990, test_f1: 0.2362
 epoch: 66, train_loss: 1.1966, test_loss: 1.1978, test_f1: 0.2366
 epoch: 67, train_loss: 1.1969, test_loss: 1.1973, test_f1: 0.2377
 epoch: 68, train_loss: 1.1925, test_loss: 1.1962, test_f1: 0.2381
 epoch: 69, train_loss: 1.1909, test_loss: 1.1972, test_f1: 0.2452
 epoch: 70, train_loss: 1.2016, test_loss: 1.1962, test_f1: 0.2506
 epoch: 71, train_loss: 1.1915, test_loss: 1.1957, test_f1: 0.2381
 epoch: 72, train_loss: 1.1944, test_loss: 1.1941, test_f1: 0.2375
 epoch: 73, train_loss: 1.1932, test_loss: 1.1930, test_f1: 0.2381
 epoch: 74, train_loss: 1.1869, test_loss: 1.1921, test_f1: 0.2379
 epoch: 75, train_loss: 1.1875, test_loss: 1.1916, test_f1: 0.2446
 epoch: 76, train_loss: 1.1895, test_loss: 1.1908, test_f1: 0.2401
 epoch: 77, train_loss: 1.1881, test_loss: 1.1903, test_f1: 0.2432
 epoch: 78, train_loss: 1.1890, test_loss: 1.1892, test_f1: 0.2614
 epoch: 79, train_loss: 1.1844, test_loss: 1.1901, test_f1: 0.2603
 epoch: 80, train_loss: 1.1875, test_loss: 1.1883, test_f1: 0.2636
 epoch: 81, train_loss: 1.1842, test_loss: 1.1863, test_f1: 0.2542
 epoch: 82, train_loss: 1.1847, test_loss: 1.1853, test_f1: 0.2587
 epoch: 83, train_loss: 1.1813, test_loss: 1.1849, test_f1: 0.2587
 epoch: 84, train_loss: 1.1831, test_loss: 1.1842, test_f1: 0.2633
 epoch: 85, train_loss: 1.1810, test_loss: 1.1838, test_f1: 0.2677
 epoch: 86, train_loss: 1.1822, test_loss: 1.1828, test_f1: 0.2755
 epoch: 87, train_loss: 1.1823, test_loss: 1.1833, test_f1: 0.2757
 epoch: 88, train_loss: 1.1780, test_loss: 1.1817, test_f1: 0.2793
 epoch: 89, train_loss: 1.1781, test_loss: 1.1814, test_f1: 0.2813
 epoch: 90, train_loss: 1.1748, test_loss: 1.1808, test_f1: 0.2872
 epoch: 91, train_loss: 1.1790, test_loss: 1.1796, test_f1: 0.2893
 epoch: 92, train_loss: 1.1728, test_loss: 1.1807, test_f1: 0.2975
 epoch: 93, train_loss: 1.1746, test_loss: 1.1768, test_f1: 0.2960
 epoch: 94, train_loss: 1.1704, test_loss: 1.1774, test_f1: 0.2995
 epoch: 95, train_loss: 1.1753, test_loss: 1.1778, test_f1: 0.3114
 epoch: 96, train_loss: 1.1713, test_loss: 1.1759, test_f1: 0.3056
 epoch: 97, train_loss: 1.1730, test_loss: 1.1750, test_f1: 0.3077
 epoch: 98, train_loss: 1.1747, test_loss: 1.1747, test_f1: 0.3144
 epoch: 99, train_loss: 1.1719, test_loss: 1.1755, test_f1: 0.3232
##################ITERATION #3 ****************************************
 epoch: 0, train_loss: 1.3696, test_loss: 1.3707, test_f1: 0.2260
 epoch: 1, train_loss: 1.3655, test_loss: 1.3678, test_f1: 0.2260
 epoch: 2, train_loss: 1.3619, test_loss: 1.3663, test_f1: 0.2260
 epoch: 3, train_loss: 1.3594, test_loss: 1.3622, test_f1: 0.2260
 epoch: 4, train_loss: 1.3568, test_loss: 1.3599, test_f1: 0.2260
 epoch: 5, train_loss: 1.3538, test_loss: 1.3566, test_f1: 0.2260
 epoch: 6, train_loss: 1.3488, test_loss: 1.3518, test_f1: 0.2260
 epoch: 7, train_loss: 1.3456, test_loss: 1.3473, test_f1: 0.2260
 epoch: 8, train_loss: 1.3420, test_loss: 1.3428, test_f1: 0.2260
 epoch: 9, train_loss: 1.3381, test_loss: 1.3392, test_f1: 0.2260
 epoch: 10, train_loss: 1.3350, test_loss: 1.3346, test_f1: 0.2260
 epoch: 11, train_loss: 1.3298, test_loss: 1.3302, test_f1: 0.2260
 epoch: 12, train_loss: 1.3271, test_loss: 1.3255, test_f1: 0.2260
 epoch: 13, train_loss: 1.3212, test_loss: 1.3218, test_f1: 0.2260
 epoch: 14, train_loss: 1.3167, test_loss: 1.3174, test_f1: 0.2260
 epoch: 15, train_loss: 1.3127, test_loss: 1.3122, test_f1: 0.2260
 epoch: 16, train_loss: 1.3084, test_loss: 1.3079, test_f1: 0.2260
 epoch: 17, train_loss: 1.3035, test_loss: 1.3038, test_f1: 0.2260
 epoch: 18, train_loss: 1.3001, test_loss: 1.2986, test_f1: 0.2260
 epoch: 19, train_loss: 1.2942, test_loss: 1.2943, test_f1: 0.2260
 epoch: 20, train_loss: 1.2903, test_loss: 1.2896, test_f1: 0.2260
 epoch: 21, train_loss: 1.2861, test_loss: 1.2849, test_f1: 0.2260
 epoch: 22, train_loss: 1.2819, test_loss: 1.2804, test_f1: 0.2260
 epoch: 23, train_loss: 1.2806, test_loss: 1.2760, test_f1: 0.2260
 epoch: 24, train_loss: 1.2763, test_loss: 1.2726, test_f1: 0.2260
 epoch: 25, train_loss: 1.2744, test_loss: 1.2687, test_f1: 0.2260
 epoch: 26, train_loss: 1.2698, test_loss: 1.2647, test_f1: 0.2260
 epoch: 27, train_loss: 1.2679, test_loss: 1.2609, test_f1: 0.2260
 epoch: 28, train_loss: 1.2625, test_loss: 1.2570, test_f1: 0.2260
 epoch: 29, train_loss: 1.2628, test_loss: 1.2523, test_f1: 0.2260
 epoch: 30, train_loss: 1.2559, test_loss: 1.2493, test_f1: 0.2260
 epoch: 31, train_loss: 1.2547, test_loss: 1.2452, test_f1: 0.2260
 epoch: 32, train_loss: 1.2536, test_loss: 1.2426, test_f1: 0.2260
 epoch: 33, train_loss: 1.2538, test_loss: 1.2402, test_f1: 0.2260
 epoch: 34, train_loss: 1.2475, test_loss: 1.2363, test_f1: 0.2260
 epoch: 35, train_loss: 1.2450, test_loss: 1.2343, test_f1: 0.2260
 epoch: 36, train_loss: 1.2464, test_loss: 1.2318, test_f1: 0.2260
 epoch: 37, train_loss: 1.2428, test_loss: 1.2278, test_f1: 0.2260
 epoch: 38, train_loss: 1.2452, test_loss: 1.2255, test_f1: 0.2260
 epoch: 39, train_loss: 1.2359, test_loss: 1.2234, test_f1: 0.2260
 epoch: 40, train_loss: 1.2371, test_loss: 1.2220, test_f1: 0.2260
 epoch: 41, train_loss: 1.2352, test_loss: 1.2197, test_f1: 0.2260
 epoch: 42, train_loss: 1.2317, test_loss: 1.2177, test_f1: 0.2260
 epoch: 43, train_loss: 1.2336, test_loss: 1.2161, test_f1: 0.2260
 epoch: 44, train_loss: 1.2332, test_loss: 1.2128, test_f1: 0.2260
 epoch: 45, train_loss: 1.2315, test_loss: 1.2120, test_f1: 0.2260
 epoch: 46, train_loss: 1.2272, test_loss: 1.2098, test_f1: 0.2260
 epoch: 47, train_loss: 1.2294, test_loss: 1.2084, test_f1: 0.2260
 epoch: 48, train_loss: 1.2262, test_loss: 1.2066, test_f1: 0.2260
 epoch: 49, train_loss: 1.2236, test_loss: 1.2032, test_f1: 0.2260
 epoch: 50, train_loss: 1.2241, test_loss: 1.2030, test_f1: 0.2260
 epoch: 51, train_loss: 1.2226, test_loss: 1.2026, test_f1: 0.2260
 epoch: 52, train_loss: 1.2207, test_loss: 1.2017, test_f1: 0.2260
 epoch: 53, train_loss: 1.2187, test_loss: 1.1995, test_f1: 0.2260
 epoch: 54, train_loss: 1.2157, test_loss: 1.1985, test_f1: 0.2260
 epoch: 55, train_loss: 1.2176, test_loss: 1.1986, test_f1: 0.2260
 epoch: 56, train_loss: 1.2167, test_loss: 1.1970, test_f1: 0.2260
 epoch: 57, train_loss: 1.2154, test_loss: 1.1968, test_f1: 0.2260
 epoch: 58, train_loss: 1.2158, test_loss: 1.1953, test_f1: 0.2260
 epoch: 59, train_loss: 1.2118, test_loss: 1.1942, test_f1: 0.2260
 epoch: 60, train_loss: 1.2166, test_loss: 1.1931, test_f1: 0.2260
 epoch: 61, train_loss: 1.2158, test_loss: 1.1931, test_f1: 0.2286
 epoch: 62, train_loss: 1.2123, test_loss: 1.1930, test_f1: 0.2286
 epoch: 63, train_loss: 1.2141, test_loss: 1.1918, test_f1: 0.2286
 epoch: 64, train_loss: 1.2122, test_loss: 1.1908, test_f1: 0.2286
 epoch: 65, train_loss: 1.2098, test_loss: 1.1902, test_f1: 0.2286
 epoch: 66, train_loss: 1.2114, test_loss: 1.1896, test_f1: 0.2286
 epoch: 67, train_loss: 1.2107, test_loss: 1.1880, test_f1: 0.2311
 epoch: 68, train_loss: 1.2115, test_loss: 1.1869, test_f1: 0.2359
 epoch: 69, train_loss: 1.2092, test_loss: 1.1873, test_f1: 0.2429
 epoch: 70, train_loss: 1.2076, test_loss: 1.1859, test_f1: 0.2429
 epoch: 71, train_loss: 1.2091, test_loss: 1.1856, test_f1: 0.2518
 epoch: 72, train_loss: 1.2078, test_loss: 1.1850, test_f1: 0.2560
 epoch: 73, train_loss: 1.2087, test_loss: 1.1838, test_f1: 0.2601
 epoch: 74, train_loss: 1.2072, test_loss: 1.1837, test_f1: 0.2699
 epoch: 75, train_loss: 1.2045, test_loss: 1.1824, test_f1: 0.2772
 epoch: 76, train_loss: 1.2047, test_loss: 1.1814, test_f1: 0.2842
 epoch: 77, train_loss: 1.2035, test_loss: 1.1803, test_f1: 0.2876
 epoch: 78, train_loss: 1.2033, test_loss: 1.1796, test_f1: 0.2893
 epoch: 79, train_loss: 1.2028, test_loss: 1.1801, test_f1: 0.3048
 epoch: 80, train_loss: 1.2026, test_loss: 1.1798, test_f1: 0.3033
 epoch: 81, train_loss: 1.2007, test_loss: 1.1782, test_f1: 0.3062
 epoch: 82, train_loss: 1.1958, test_loss: 1.1774, test_f1: 0.3091
 epoch: 83, train_loss: 1.1985, test_loss: 1.1768, test_f1: 0.3173
 epoch: 84, train_loss: 1.1982, test_loss: 1.1760, test_f1: 0.3173
 epoch: 85, train_loss: 1.2002, test_loss: 1.1753, test_f1: 0.3199
 epoch: 86, train_loss: 1.1977, test_loss: 1.1743, test_f1: 0.3199
 epoch: 87, train_loss: 1.1995, test_loss: 1.1741, test_f1: 0.3225
 epoch: 88, train_loss: 1.1961, test_loss: 1.1737, test_f1: 0.3238
 epoch: 89, train_loss: 1.1928, test_loss: 1.1724, test_f1: 0.3238
 epoch: 90, train_loss: 1.1994, test_loss: 1.1707, test_f1: 0.3250
 epoch: 91, train_loss: 1.1942, test_loss: 1.1705, test_f1: 0.3250
 epoch: 92, train_loss: 1.1954, test_loss: 1.1700, test_f1: 0.3263
 epoch: 93, train_loss: 1.1969, test_loss: 1.1689, test_f1: 0.3275
 epoch: 94, train_loss: 1.1957, test_loss: 1.1689, test_f1: 0.3275
 epoch: 95, train_loss: 1.1926, test_loss: 1.1680, test_f1: 0.3287
 epoch: 96, train_loss: 1.1907, test_loss: 1.1676, test_f1: 0.3299
 epoch: 97, train_loss: 1.1914, test_loss: 1.1666, test_f1: 0.3287
 epoch: 98, train_loss: 1.1916, test_loss: 1.1662, test_f1: 0.3299
 epoch: 99, train_loss: 1.1884, test_loss: 1.1655, test_f1: 0.3311
##################ITERATION #4 ****************************************
 epoch: 0, train_loss: 1.3469, test_loss: 1.3603, test_f1: 0.2260
 epoch: 1, train_loss: 1.3413, test_loss: 1.3591, test_f1: 0.2260
 epoch: 2, train_loss: 1.3394, test_loss: 1.3557, test_f1: 0.2260
 epoch: 3, train_loss: 1.3345, test_loss: 1.3439, test_f1: 0.2260
 epoch: 4, train_loss: 1.3297, test_loss: 1.3342, test_f1: 0.2260
 epoch: 5, train_loss: 1.3270, test_loss: 1.3275, test_f1: 0.2260
 epoch: 6, train_loss: 1.3241, test_loss: 1.3239, test_f1: 0.2260
 epoch: 7, train_loss: 1.3200, test_loss: 1.3187, test_f1: 0.2260
 epoch: 8, train_loss: 1.3162, test_loss: 1.3141, test_f1: 0.2260
 epoch: 9, train_loss: 1.3111, test_loss: 1.3088, test_f1: 0.2260
 epoch: 10, train_loss: 1.3066, test_loss: 1.3041, test_f1: 0.2260
 epoch: 11, train_loss: 1.3037, test_loss: 1.3000, test_f1: 0.2260
 epoch: 12, train_loss: 1.2989, test_loss: 1.2966, test_f1: 0.2260
 epoch: 13, train_loss: 1.2959, test_loss: 1.2935, test_f1: 0.2260
 epoch: 14, train_loss: 1.2918, test_loss: 1.2889, test_f1: 0.2260
 epoch: 15, train_loss: 1.2868, test_loss: 1.2851, test_f1: 0.2260
 epoch: 16, train_loss: 1.2850, test_loss: 1.2806, test_f1: 0.2260
 epoch: 17, train_loss: 1.2804, test_loss: 1.2767, test_f1: 0.2260
 epoch: 18, train_loss: 1.2779, test_loss: 1.2727, test_f1: 0.2260
 epoch: 19, train_loss: 1.2752, test_loss: 1.2690, test_f1: 0.2260
 epoch: 20, train_loss: 1.2708, test_loss: 1.2642, test_f1: 0.2260
 epoch: 21, train_loss: 1.2669, test_loss: 1.2593, test_f1: 0.2260
 epoch: 22, train_loss: 1.2627, test_loss: 1.2549, test_f1: 0.2260
 epoch: 23, train_loss: 1.2550, test_loss: 1.2516, test_f1: 0.2260
 epoch: 24, train_loss: 1.2518, test_loss: 1.2458, test_f1: 0.2260
 epoch: 25, train_loss: 1.2517, test_loss: 1.2411, test_f1: 0.2260
 epoch: 26, train_loss: 1.2442, test_loss: 1.2359, test_f1: 0.2260
 epoch: 27, train_loss: 1.2424, test_loss: 1.2319, test_f1: 0.2260
 epoch: 28, train_loss: 1.2396, test_loss: 1.2276, test_f1: 0.2260
 epoch: 29, train_loss: 1.2359, test_loss: 1.2247, test_f1: 0.2260
 epoch: 30, train_loss: 1.2303, test_loss: 1.2200, test_f1: 0.2260
 epoch: 31, train_loss: 1.2310, test_loss: 1.2160, test_f1: 0.2260
 epoch: 32, train_loss: 1.2263, test_loss: 1.2141, test_f1: 0.2260
 epoch: 33, train_loss: 1.2224, test_loss: 1.2102, test_f1: 0.2260
 epoch: 34, train_loss: 1.2195, test_loss: 1.2064, test_f1: 0.2260
 epoch: 35, train_loss: 1.2223, test_loss: 1.2057, test_f1: 0.2260
 epoch: 36, train_loss: 1.2169, test_loss: 1.2031, test_f1: 0.2260
 epoch: 37, train_loss: 1.2155, test_loss: 1.2015, test_f1: 0.2260
 epoch: 38, train_loss: 1.2157, test_loss: 1.1981, test_f1: 0.2260
 epoch: 39, train_loss: 1.2125, test_loss: 1.1967, test_f1: 0.2260
 epoch: 40, train_loss: 1.2120, test_loss: 1.1949, test_f1: 0.2260
 epoch: 41, train_loss: 1.2087, test_loss: 1.1934, test_f1: 0.2260
 epoch: 42, train_loss: 1.2091, test_loss: 1.1917, test_f1: 0.2260
 epoch: 43, train_loss: 1.2082, test_loss: 1.1912, test_f1: 0.2260
 epoch: 44, train_loss: 1.2058, test_loss: 1.1905, test_f1: 0.2260
 epoch: 45, train_loss: 1.2026, test_loss: 1.1890, test_f1: 0.2260
 epoch: 46, train_loss: 1.2059, test_loss: 1.1878, test_f1: 0.2260
 epoch: 47, train_loss: 1.2049, test_loss: 1.1867, test_f1: 0.2260
 epoch: 48, train_loss: 1.2008, test_loss: 1.1844, test_f1: 0.2260
 epoch: 49, train_loss: 1.1966, test_loss: 1.1832, test_f1: 0.2260
 epoch: 50, train_loss: 1.2003, test_loss: 1.1824, test_f1: 0.2260
 epoch: 51, train_loss: 1.1979, test_loss: 1.1815, test_f1: 0.2260
 epoch: 52, train_loss: 1.1946, test_loss: 1.1810, test_f1: 0.2260
 epoch: 53, train_loss: 1.1954, test_loss: 1.1803, test_f1: 0.2260
 epoch: 54, train_loss: 1.1982, test_loss: 1.1803, test_f1: 0.2260
 epoch: 55, train_loss: 1.1941, test_loss: 1.1794, test_f1: 0.2260
 epoch: 56, train_loss: 1.1936, test_loss: 1.1784, test_f1: 0.2260
 epoch: 57, train_loss: 1.1932, test_loss: 1.1775, test_f1: 0.2260
 epoch: 58, train_loss: 1.1925, test_loss: 1.1768, test_f1: 0.2260
 epoch: 59, train_loss: 1.1904, test_loss: 1.1763, test_f1: 0.2260
 epoch: 60, train_loss: 1.1941, test_loss: 1.1760, test_f1: 0.2260
 epoch: 61, train_loss: 1.1897, test_loss: 1.1760, test_f1: 0.2260
 epoch: 62, train_loss: 1.1927, test_loss: 1.1756, test_f1: 0.2260
 epoch: 63, train_loss: 1.1942, test_loss: 1.1744, test_f1: 0.2260
 epoch: 64, train_loss: 1.1914, test_loss: 1.1742, test_f1: 0.2260
 epoch: 65, train_loss: 1.1885, test_loss: 1.1734, test_f1: 0.2260
 epoch: 66, train_loss: 1.1857, test_loss: 1.1734, test_f1: 0.2260
 epoch: 67, train_loss: 1.1890, test_loss: 1.1723, test_f1: 0.2260
 epoch: 68, train_loss: 1.1854, test_loss: 1.1722, test_f1: 0.2260
 epoch: 69, train_loss: 1.1868, test_loss: 1.1715, test_f1: 0.2260
 epoch: 70, train_loss: 1.1888, test_loss: 1.1707, test_f1: 0.2260
 epoch: 71, train_loss: 1.1851, test_loss: 1.1708, test_f1: 0.2260
 epoch: 72, train_loss: 1.1857, test_loss: 1.1697, test_f1: 0.2260
 epoch: 73, train_loss: 1.1878, test_loss: 1.1688, test_f1: 0.2260
 epoch: 74, train_loss: 1.1869, test_loss: 1.1684, test_f1: 0.2260
 epoch: 75, train_loss: 1.1858, test_loss: 1.1692, test_f1: 0.2260
 epoch: 76, train_loss: 1.1892, test_loss: 1.1691, test_f1: 0.2260
 epoch: 77, train_loss: 1.1879, test_loss: 1.1679, test_f1: 0.2260
 epoch: 78, train_loss: 1.1854, test_loss: 1.1680, test_f1: 0.2286
 epoch: 79, train_loss: 1.1856, test_loss: 1.1677, test_f1: 0.2359
 epoch: 80, train_loss: 1.1826, test_loss: 1.1673, test_f1: 0.2474
 epoch: 81, train_loss: 1.1871, test_loss: 1.1670, test_f1: 0.2754
 epoch: 82, train_loss: 1.1794, test_loss: 1.1663, test_f1: 0.3003
 epoch: 83, train_loss: 1.1810, test_loss: 1.1649, test_f1: 0.3048
 epoch: 84, train_loss: 1.1790, test_loss: 1.1645, test_f1: 0.3212
 epoch: 85, train_loss: 1.1845, test_loss: 1.1640, test_f1: 0.3299
 epoch: 86, train_loss: 1.1788, test_loss: 1.1643, test_f1: 0.3347
 epoch: 87, train_loss: 1.1769, test_loss: 1.1639, test_f1: 0.3381
 epoch: 88, train_loss: 1.1793, test_loss: 1.1632, test_f1: 0.3392
 epoch: 89, train_loss: 1.1765, test_loss: 1.1632, test_f1: 0.3392
 epoch: 90, train_loss: 1.1794, test_loss: 1.1621, test_f1: 0.3415
 epoch: 91, train_loss: 1.1755, test_loss: 1.1613, test_f1: 0.3447
 epoch: 92, train_loss: 1.1790, test_loss: 1.1608, test_f1: 0.3469
 epoch: 93, train_loss: 1.1774, test_loss: 1.1596, test_f1: 0.3479
 epoch: 94, train_loss: 1.1751, test_loss: 1.1593, test_f1: 0.3469
 epoch: 95, train_loss: 1.1763, test_loss: 1.1590, test_f1: 0.3490
 epoch: 96, train_loss: 1.1753, test_loss: 1.1585, test_f1: 0.3500
 epoch: 97, train_loss: 1.1743, test_loss: 1.1586, test_f1: 0.3490
 epoch: 98, train_loss: 1.1711, test_loss: 1.1579, test_f1: 0.3500
 epoch: 99, train_loss: 1.1720, test_loss: 1.1577, test_f1: 0.3500
##################ITERATION #5 ****************************************
 epoch: 0, train_loss: 1.3136, test_loss: 1.3314, test_f1: 0.2260
 epoch: 1, train_loss: 1.3095, test_loss: 1.3270, test_f1: 0.2260
 epoch: 2, train_loss: 1.3041, test_loss: 1.3221, test_f1: 0.2260
 epoch: 3, train_loss: 1.2986, test_loss: 1.3145, test_f1: 0.2260
 epoch: 4, train_loss: 1.2950, test_loss: 1.3057, test_f1: 0.2260
 epoch: 5, train_loss: 1.2903, test_loss: 1.2978, test_f1: 0.2260
 epoch: 6, train_loss: 1.2876, test_loss: 1.2913, test_f1: 0.2260
 epoch: 7, train_loss: 1.2833, test_loss: 1.2858, test_f1: 0.2260
 epoch: 8, train_loss: 1.2801, test_loss: 1.2814, test_f1: 0.2260
 epoch: 9, train_loss: 1.2769, test_loss: 1.2767, test_f1: 0.2260
 epoch: 10, train_loss: 1.2728, test_loss: 1.2715, test_f1: 0.2260
 epoch: 11, train_loss: 1.2699, test_loss: 1.2669, test_f1: 0.2260
 epoch: 12, train_loss: 1.2672, test_loss: 1.2630, test_f1: 0.2260
 epoch: 13, train_loss: 1.2601, test_loss: 1.2579, test_f1: 0.2260
 epoch: 14, train_loss: 1.2591, test_loss: 1.2525, test_f1: 0.2260
 epoch: 15, train_loss: 1.2539, test_loss: 1.2470, test_f1: 0.2260
 epoch: 16, train_loss: 1.2532, test_loss: 1.2429, test_f1: 0.2260
 epoch: 17, train_loss: 1.2463, test_loss: 1.2379, test_f1: 0.2260
 epoch: 18, train_loss: 1.2488, test_loss: 1.2340, test_f1: 0.2260
 epoch: 19, train_loss: 1.2430, test_loss: 1.2303, test_f1: 0.2260
 epoch: 20, train_loss: 1.2388, test_loss: 1.2269, test_f1: 0.2260
 epoch: 21, train_loss: 1.2325, test_loss: 1.2231, test_f1: 0.2260
 epoch: 22, train_loss: 1.2352, test_loss: 1.2194, test_f1: 0.2260
 epoch: 23, train_loss: 1.2355, test_loss: 1.2174, test_f1: 0.2260
 epoch: 24, train_loss: 1.2314, test_loss: 1.2147, test_f1: 0.2260
 epoch: 25, train_loss: 1.2263, test_loss: 1.2115, test_f1: 0.2260
 epoch: 26, train_loss: 1.2298, test_loss: 1.2090, test_f1: 0.2260
 epoch: 27, train_loss: 1.2212, test_loss: 1.2068, test_f1: 0.2260
 epoch: 28, train_loss: 1.2185, test_loss: 1.2035, test_f1: 0.2260
 epoch: 29, train_loss: 1.2219, test_loss: 1.2002, test_f1: 0.2260
 epoch: 30, train_loss: 1.2158, test_loss: 1.1979, test_f1: 0.2260
 epoch: 31, train_loss: 1.2116, test_loss: 1.1951, test_f1: 0.2260
 epoch: 32, train_loss: 1.2154, test_loss: 1.1927, test_f1: 0.2260
 epoch: 33, train_loss: 1.2134, test_loss: 1.1904, test_f1: 0.2260
 epoch: 34, train_loss: 1.2098, test_loss: 1.1882, test_f1: 0.2260
 epoch: 35, train_loss: 1.2079, test_loss: 1.1864, test_f1: 0.2260
 epoch: 36, train_loss: 1.2067, test_loss: 1.1843, test_f1: 0.2260
 epoch: 37, train_loss: 1.2001, test_loss: 1.1818, test_f1: 0.2260
 epoch: 38, train_loss: 1.1967, test_loss: 1.1792, test_f1: 0.2286
 epoch: 39, train_loss: 1.2004, test_loss: 1.1773, test_f1: 0.2539
 epoch: 40, train_loss: 1.1973, test_loss: 1.1760, test_f1: 0.2772
 epoch: 41, train_loss: 1.1978, test_loss: 1.1738, test_f1: 0.2988
 epoch: 42, train_loss: 1.1966, test_loss: 1.1705, test_f1: 0.3091
 epoch: 43, train_loss: 1.1894, test_loss: 1.1689, test_f1: 0.3275
 epoch: 44, train_loss: 1.1848, test_loss: 1.1671, test_f1: 0.3347
 epoch: 45, train_loss: 1.1891, test_loss: 1.1658, test_f1: 0.3358
 epoch: 46, train_loss: 1.1832, test_loss: 1.1630, test_f1: 0.3415
 epoch: 47, train_loss: 1.1849, test_loss: 1.1616, test_f1: 0.3415
 epoch: 48, train_loss: 1.1825, test_loss: 1.1600, test_f1: 0.3426
 epoch: 49, train_loss: 1.1798, test_loss: 1.1578, test_f1: 0.3420
 epoch: 50, train_loss: 1.1750, test_loss: 1.1560, test_f1: 0.3435
 epoch: 51, train_loss: 1.1787, test_loss: 1.1551, test_f1: 0.3424
 epoch: 52, train_loss: 1.1818, test_loss: 1.1543, test_f1: 0.3414
 epoch: 53, train_loss: 1.1742, test_loss: 1.1540, test_f1: 0.3373
 epoch: 54, train_loss: 1.1745, test_loss: 1.1531, test_f1: 0.3371
 epoch: 55, train_loss: 1.1716, test_loss: 1.1520, test_f1: 0.3371
 epoch: 56, train_loss: 1.1771, test_loss: 1.1510, test_f1: 0.3361
 epoch: 57, train_loss: 1.1687, test_loss: 1.1501, test_f1: 0.3371
 epoch: 58, train_loss: 1.1691, test_loss: 1.1492, test_f1: 0.3371
 epoch: 59, train_loss: 1.1666, test_loss: 1.1488, test_f1: 0.3381
 epoch: 60, train_loss: 1.1690, test_loss: 1.1481, test_f1: 0.3421
 epoch: 61, train_loss: 1.1703, test_loss: 1.1477, test_f1: 0.3411
 epoch: 62, train_loss: 1.1658, test_loss: 1.1466, test_f1: 0.3381
 epoch: 63, train_loss: 1.1661, test_loss: 1.1461, test_f1: 0.3381
 epoch: 64, train_loss: 1.1661, test_loss: 1.1446, test_f1: 0.3381
 epoch: 65, train_loss: 1.1699, test_loss: 1.1439, test_f1: 0.3381
 epoch: 66, train_loss: 1.1636, test_loss: 1.1427, test_f1: 0.3381
 epoch: 67, train_loss: 1.1638, test_loss: 1.1421, test_f1: 0.3381
 epoch: 68, train_loss: 1.1608, test_loss: 1.1413, test_f1: 0.3381
 epoch: 69, train_loss: 1.1653, test_loss: 1.1407, test_f1: 0.3381
 epoch: 70, train_loss: 1.1617, test_loss: 1.1402, test_f1: 0.3381
 epoch: 71, train_loss: 1.1589, test_loss: 1.1392, test_f1: 0.3381
 epoch: 72, train_loss: 1.1576, test_loss: 1.1381, test_f1: 0.3381
 epoch: 73, train_loss: 1.1578, test_loss: 1.1378, test_f1: 0.3381
 epoch: 74, train_loss: 1.1624, test_loss: 1.1377, test_f1: 0.3391
 epoch: 75, train_loss: 1.1524, test_loss: 1.1367, test_f1: 0.3391
 epoch: 76, train_loss: 1.1559, test_loss: 1.1360, test_f1: 0.3391
 epoch: 77, train_loss: 1.1521, test_loss: 1.1350, test_f1: 0.3391
 epoch: 78, train_loss: 1.1555, test_loss: 1.1344, test_f1: 0.3381
 epoch: 79, train_loss: 1.1538, test_loss: 1.1342, test_f1: 0.3391
 epoch: 80, train_loss: 1.1537, test_loss: 1.1338, test_f1: 0.3391
 epoch: 81, train_loss: 1.1509, test_loss: 1.1322, test_f1: 0.3391
 epoch: 82, train_loss: 1.1514, test_loss: 1.1312, test_f1: 0.3391
 epoch: 83, train_loss: 1.1478, test_loss: 1.1304, test_f1: 0.3391
 epoch: 84, train_loss: 1.1570, test_loss: 1.1304, test_f1: 0.3391
 epoch: 85, train_loss: 1.1478, test_loss: 1.1295, test_f1: 0.3391
 epoch: 86, train_loss: 1.1497, test_loss: 1.1290, test_f1: 0.3391
 epoch: 87, train_loss: 1.1464, test_loss: 1.1282, test_f1: 0.3391
 epoch: 88, train_loss: 1.1424, test_loss: 1.1283, test_f1: 0.3410
 epoch: 89, train_loss: 1.1469, test_loss: 1.1277, test_f1: 0.3410
 epoch: 90, train_loss: 1.1426, test_loss: 1.1268, test_f1: 0.3410
 epoch: 91, train_loss: 1.1452, test_loss: 1.1258, test_f1: 0.3410
 epoch: 92, train_loss: 1.1444, test_loss: 1.1256, test_f1: 0.3419
 epoch: 93, train_loss: 1.1429, test_loss: 1.1261, test_f1: 0.3419
 epoch: 94, train_loss: 1.1440, test_loss: 1.1242, test_f1: 0.3419
 epoch: 95, train_loss: 1.1376, test_loss: 1.1232, test_f1: 0.3419
 epoch: 96, train_loss: 1.1402, test_loss: 1.1228, test_f1: 0.3419
 epoch: 97, train_loss: 1.1358, test_loss: 1.1215, test_f1: 0.3419
 epoch: 98, train_loss: 1.1408, test_loss: 1.1213, test_f1: 0.3419
 epoch: 99, train_loss: 1.1369, test_loss: 1.1208, test_f1: 0.3419
##################ITERATION #6 ****************************************
 epoch: 0, train_loss: 1.3212, test_loss: 1.3253, test_f1: 0.2260
 epoch: 1, train_loss: 1.3157, test_loss: 1.3237, test_f1: 0.2260
 epoch: 2, train_loss: 1.3115, test_loss: 1.3252, test_f1: 0.2260
 epoch: 3, train_loss: 1.3084, test_loss: 1.3191, test_f1: 0.2260
 epoch: 4, train_loss: 1.3035, test_loss: 1.3109, test_f1: 0.2260
 epoch: 5, train_loss: 1.3003, test_loss: 1.3059, test_f1: 0.2260
 epoch: 6, train_loss: 1.2966, test_loss: 1.3025, test_f1: 0.2260
 epoch: 7, train_loss: 1.2935, test_loss: 1.2992, test_f1: 0.2260
 epoch: 8, train_loss: 1.2889, test_loss: 1.2958, test_f1: 0.2260
 epoch: 9, train_loss: 1.2868, test_loss: 1.2933, test_f1: 0.2260
 epoch: 10, train_loss: 1.2845, test_loss: 1.2902, test_f1: 0.2260
 epoch: 11, train_loss: 1.2827, test_loss: 1.2876, test_f1: 0.2260
 epoch: 12, train_loss: 1.2775, test_loss: 1.2846, test_f1: 0.2260
 epoch: 13, train_loss: 1.2745, test_loss: 1.2814, test_f1: 0.2260
 epoch: 14, train_loss: 1.2699, test_loss: 1.2777, test_f1: 0.2260
 epoch: 15, train_loss: 1.2682, test_loss: 1.2751, test_f1: 0.2260
 epoch: 16, train_loss: 1.2660, test_loss: 1.2719, test_f1: 0.2260
 epoch: 17, train_loss: 1.2615, test_loss: 1.2682, test_f1: 0.2260
 epoch: 18, train_loss: 1.2601, test_loss: 1.2646, test_f1: 0.2260
 epoch: 19, train_loss: 1.2561, test_loss: 1.2599, test_f1: 0.2260
 epoch: 20, train_loss: 1.2537, test_loss: 1.2569, test_f1: 0.2260
 epoch: 21, train_loss: 1.2501, test_loss: 1.2534, test_f1: 0.2260
 epoch: 22, train_loss: 1.2462, test_loss: 1.2490, test_f1: 0.2260
 epoch: 23, train_loss: 1.2453, test_loss: 1.2446, test_f1: 0.2260
 epoch: 24, train_loss: 1.2406, test_loss: 1.2407, test_f1: 0.2260
 epoch: 25, train_loss: 1.2401, test_loss: 1.2366, test_f1: 0.2260
 epoch: 26, train_loss: 1.2349, test_loss: 1.2338, test_f1: 0.2260
 epoch: 27, train_loss: 1.2366, test_loss: 1.2299, test_f1: 0.2260
 epoch: 28, train_loss: 1.2307, test_loss: 1.2264, test_f1: 0.2260
 epoch: 29, train_loss: 1.2271, test_loss: 1.2222, test_f1: 0.2260
 epoch: 30, train_loss: 1.2267, test_loss: 1.2188, test_f1: 0.2260
 epoch: 31, train_loss: 1.2245, test_loss: 1.2159, test_f1: 0.2260
 epoch: 32, train_loss: 1.2201, test_loss: 1.2139, test_f1: 0.2260
 epoch: 33, train_loss: 1.2220, test_loss: 1.2111, test_f1: 0.2260
 epoch: 34, train_loss: 1.2151, test_loss: 1.2083, test_f1: 0.2260
 epoch: 35, train_loss: 1.2148, test_loss: 1.2056, test_f1: 0.2260
 epoch: 36, train_loss: 1.2112, test_loss: 1.2035, test_f1: 0.2260
 epoch: 37, train_loss: 1.2121, test_loss: 1.2006, test_f1: 0.2260
 epoch: 38, train_loss: 1.2096, test_loss: 1.1998, test_f1: 0.2260
 epoch: 39, train_loss: 1.2056, test_loss: 1.1963, test_f1: 0.2260
 epoch: 40, train_loss: 1.2037, test_loss: 1.1923, test_f1: 0.2260
 epoch: 41, train_loss: 1.2046, test_loss: 1.1894, test_f1: 0.2260
 epoch: 42, train_loss: 1.2014, test_loss: 1.1886, test_f1: 0.2286
 epoch: 43, train_loss: 1.1956, test_loss: 1.1866, test_f1: 0.2335
 epoch: 44, train_loss: 1.1929, test_loss: 1.1850, test_f1: 0.2406
 epoch: 45, train_loss: 1.1952, test_loss: 1.1824, test_f1: 0.2601
 epoch: 46, train_loss: 1.1932, test_loss: 1.1793, test_f1: 0.2736
 epoch: 47, train_loss: 1.1913, test_loss: 1.1767, test_f1: 0.2790
 epoch: 48, train_loss: 1.1938, test_loss: 1.1759, test_f1: 0.2893
 epoch: 49, train_loss: 1.1865, test_loss: 1.1754, test_f1: 0.3033
 epoch: 50, train_loss: 1.1838, test_loss: 1.1712, test_f1: 0.3048
 epoch: 51, train_loss: 1.1820, test_loss: 1.1720, test_f1: 0.3119
 epoch: 52, train_loss: 1.1788, test_loss: 1.1705, test_f1: 0.3160
 epoch: 53, train_loss: 1.1799, test_loss: 1.1702, test_f1: 0.3160
 epoch: 54, train_loss: 1.1775, test_loss: 1.1693, test_f1: 0.3212
 epoch: 55, train_loss: 1.1765, test_loss: 1.1677, test_f1: 0.3212
 epoch: 56, train_loss: 1.1776, test_loss: 1.1660, test_f1: 0.3212
 epoch: 57, train_loss: 1.1793, test_loss: 1.1636, test_f1: 0.3238
 epoch: 58, train_loss: 1.1823, test_loss: 1.1653, test_f1: 0.3250
 epoch: 59, train_loss: 1.1745, test_loss: 1.1634, test_f1: 0.3250
 epoch: 60, train_loss: 1.1751, test_loss: 1.1625, test_f1: 0.3287
 epoch: 61, train_loss: 1.1748, test_loss: 1.1626, test_f1: 0.3347
 epoch: 62, train_loss: 1.1687, test_loss: 1.1615, test_f1: 0.3347
 epoch: 63, train_loss: 1.1717, test_loss: 1.1607, test_f1: 0.3381
 epoch: 64, train_loss: 1.1715, test_loss: 1.1587, test_f1: 0.3358
 epoch: 65, train_loss: 1.1697, test_loss: 1.1580, test_f1: 0.3347
 epoch: 66, train_loss: 1.1707, test_loss: 1.1581, test_f1: 0.3381
 epoch: 67, train_loss: 1.1689, test_loss: 1.1599, test_f1: 0.3404
 epoch: 68, train_loss: 1.1663, test_loss: 1.1568, test_f1: 0.3392
 epoch: 69, train_loss: 1.1622, test_loss: 1.1543, test_f1: 0.3404
 epoch: 70, train_loss: 1.1699, test_loss: 1.1534, test_f1: 0.3404
 epoch: 71, train_loss: 1.1629, test_loss: 1.1523, test_f1: 0.3426
 epoch: 72, train_loss: 1.1653, test_loss: 1.1498, test_f1: 0.3437
 epoch: 73, train_loss: 1.1609, test_loss: 1.1492, test_f1: 0.3415
 epoch: 74, train_loss: 1.1588, test_loss: 1.1475, test_f1: 0.3426
 epoch: 75, train_loss: 1.1622, test_loss: 1.1483, test_f1: 0.3437
 epoch: 76, train_loss: 1.1628, test_loss: 1.1485, test_f1: 0.3426
 epoch: 77, train_loss: 1.1601, test_loss: 1.1478, test_f1: 0.3437
 epoch: 78, train_loss: 1.1558, test_loss: 1.1453, test_f1: 0.3437
 epoch: 79, train_loss: 1.1539, test_loss: 1.1443, test_f1: 0.3447
 epoch: 80, train_loss: 1.1534, test_loss: 1.1444, test_f1: 0.3458
 epoch: 81, train_loss: 1.1540, test_loss: 1.1435, test_f1: 0.3447
 epoch: 82, train_loss: 1.1515, test_loss: 1.1417, test_f1: 0.3437
 epoch: 83, train_loss: 1.1523, test_loss: 1.1401, test_f1: 0.3469
 epoch: 84, train_loss: 1.1574, test_loss: 1.1412, test_f1: 0.3479
 epoch: 85, train_loss: 1.1491, test_loss: 1.1405, test_f1: 0.3395
 epoch: 86, train_loss: 1.1521, test_loss: 1.1381, test_f1: 0.3395
 epoch: 87, train_loss: 1.1448, test_loss: 1.1394, test_f1: 0.3423
 epoch: 88, train_loss: 1.1481, test_loss: 1.1403, test_f1: 0.3405
 epoch: 89, train_loss: 1.1495, test_loss: 1.1383, test_f1: 0.3434
 epoch: 90, train_loss: 1.1475, test_loss: 1.1358, test_f1: 0.3416
 epoch: 91, train_loss: 1.1475, test_loss: 1.1348, test_f1: 0.3416
 epoch: 92, train_loss: 1.1423, test_loss: 1.1353, test_f1: 0.3414
 epoch: 93, train_loss: 1.1424, test_loss: 1.1354, test_f1: 0.3414
 epoch: 94, train_loss: 1.1412, test_loss: 1.1327, test_f1: 0.3489
 epoch: 95, train_loss: 1.1448, test_loss: 1.1327, test_f1: 0.3383
 epoch: 96, train_loss: 1.1403, test_loss: 1.1322, test_f1: 0.3414
 epoch: 97, train_loss: 1.1451, test_loss: 1.1328, test_f1: 0.3414
 epoch: 98, train_loss: 1.1396, test_loss: 1.1331, test_f1: 0.3403
 epoch: 99, train_loss: 1.1394, test_loss: 1.1326, test_f1: 0.3405
##################ITERATION #7 ****************************************
 epoch: 0, train_loss: 1.3827, test_loss: 1.4150, test_f1: 0.0303
 epoch: 1, train_loss: 1.3725, test_loss: 1.4145, test_f1: 0.0303
 epoch: 2, train_loss: 1.3645, test_loss: 1.4121, test_f1: 0.0298
 epoch: 3, train_loss: 1.3583, test_loss: 1.4040, test_f1: 0.1250
 epoch: 4, train_loss: 1.3500, test_loss: 1.3896, test_f1: 0.1876
 epoch: 5, train_loss: 1.3436, test_loss: 1.3749, test_f1: 0.2081
 epoch: 6, train_loss: 1.3338, test_loss: 1.3632, test_f1: 0.2202
 epoch: 7, train_loss: 1.3284, test_loss: 1.3522, test_f1: 0.2385
 epoch: 8, train_loss: 1.3195, test_loss: 1.3392, test_f1: 0.2333
 epoch: 9, train_loss: 1.3085, test_loss: 1.3307, test_f1: 0.2279
 epoch: 10, train_loss: 1.3021, test_loss: 1.3176, test_f1: 0.2282
 epoch: 11, train_loss: 1.2929, test_loss: 1.3079, test_f1: 0.2287
 epoch: 12, train_loss: 1.2842, test_loss: 1.2982, test_f1: 0.2287
 epoch: 13, train_loss: 1.2826, test_loss: 1.2892, test_f1: 0.2286
 epoch: 14, train_loss: 1.2719, test_loss: 1.2800, test_f1: 0.2286
 epoch: 15, train_loss: 1.2654, test_loss: 1.2701, test_f1: 0.2286
 epoch: 16, train_loss: 1.2668, test_loss: 1.2637, test_f1: 0.2335
 epoch: 17, train_loss: 1.2595, test_loss: 1.2589, test_f1: 0.2383
 epoch: 18, train_loss: 1.2542, test_loss: 1.2517, test_f1: 0.2474
 epoch: 19, train_loss: 1.2438, test_loss: 1.2424, test_f1: 0.2496
 epoch: 20, train_loss: 1.2444, test_loss: 1.2384, test_f1: 0.2581
 epoch: 21, train_loss: 1.2404, test_loss: 1.2318, test_f1: 0.2699
 epoch: 22, train_loss: 1.2312, test_loss: 1.2209, test_f1: 0.2661
 epoch: 23, train_loss: 1.2286, test_loss: 1.2220, test_f1: 0.3033
 epoch: 24, train_loss: 1.2208, test_loss: 1.2151, test_f1: 0.3076
 epoch: 25, train_loss: 1.2161, test_loss: 1.2063, test_f1: 0.3062
 epoch: 26, train_loss: 1.2137, test_loss: 1.1998, test_f1: 0.3105
 epoch: 27, train_loss: 1.2097, test_loss: 1.1925, test_f1: 0.3132
 epoch: 28, train_loss: 1.2056, test_loss: 1.1925, test_f1: 0.3186
 epoch: 29, train_loss: 1.2048, test_loss: 1.1843, test_f1: 0.2972
 epoch: 30, train_loss: 1.1996, test_loss: 1.1856, test_f1: 0.3323
 epoch: 31, train_loss: 1.1937, test_loss: 1.1767, test_f1: 0.3323
 epoch: 32, train_loss: 1.1900, test_loss: 1.1823, test_f1: 0.3415
 epoch: 33, train_loss: 1.1870, test_loss: 1.1605, test_f1: 0.3199
 epoch: 34, train_loss: 1.1879, test_loss: 1.1607, test_f1: 0.3335
 epoch: 35, train_loss: 1.1845, test_loss: 1.1623, test_f1: 0.3381
 epoch: 36, train_loss: 1.1794, test_loss: 1.1561, test_f1: 0.3347
 epoch: 37, train_loss: 1.1778, test_loss: 1.1591, test_f1: 0.3415
 epoch: 38, train_loss: 1.1697, test_loss: 1.1427, test_f1: 0.3381
 epoch: 39, train_loss: 1.1691, test_loss: 1.1399, test_f1: 0.3392
 epoch: 40, train_loss: 1.1695, test_loss: 1.1420, test_f1: 0.3426
 epoch: 41, train_loss: 1.1625, test_loss: 1.1339, test_f1: 0.3415
 epoch: 42, train_loss: 1.1607, test_loss: 1.1304, test_f1: 0.3404
 epoch: 43, train_loss: 1.1607, test_loss: 1.1314, test_f1: 0.3479
 epoch: 44, train_loss: 1.1581, test_loss: 1.1250, test_f1: 0.3415
 epoch: 45, train_loss: 1.1592, test_loss: 1.1226, test_f1: 0.3437
 epoch: 46, train_loss: 1.1503, test_loss: 1.1223, test_f1: 0.3479
 epoch: 47, train_loss: 1.1478, test_loss: 1.1215, test_f1: 0.3521
 epoch: 48, train_loss: 1.1496, test_loss: 1.1141, test_f1: 0.3490
 epoch: 49, train_loss: 1.1384, test_loss: 1.1151, test_f1: 0.3561
 epoch: 50, train_loss: 1.1444, test_loss: 1.1121, test_f1: 0.3541
 epoch: 51, train_loss: 1.1375, test_loss: 1.1077, test_f1: 0.3521
 epoch: 52, train_loss: 1.1415, test_loss: 1.1065, test_f1: 0.3531
 epoch: 53, train_loss: 1.1396, test_loss: 1.1059, test_f1: 0.3531
 epoch: 54, train_loss: 1.1358, test_loss: 1.1045, test_f1: 0.3551
 epoch: 55, train_loss: 1.1300, test_loss: 1.1039, test_f1: 0.3531
 epoch: 56, train_loss: 1.1317, test_loss: 1.1053, test_f1: 0.3561
 epoch: 57, train_loss: 1.1387, test_loss: 1.1045, test_f1: 0.3561
 epoch: 58, train_loss: 1.1291, test_loss: 1.0998, test_f1: 0.3541
 epoch: 59, train_loss: 1.1331, test_loss: 1.0993, test_f1: 0.3521
 epoch: 60, train_loss: 1.1298, test_loss: 1.0984, test_f1: 0.3541
 epoch: 61, train_loss: 1.1272, test_loss: 1.0969, test_f1: 0.3521
 epoch: 62, train_loss: 1.1308, test_loss: 1.0962, test_f1: 0.3551
 epoch: 63, train_loss: 1.1235, test_loss: 1.0964, test_f1: 0.3570
 epoch: 64, train_loss: 1.1284, test_loss: 1.0948, test_f1: 0.3570
 epoch: 65, train_loss: 1.1284, test_loss: 1.0952, test_f1: 0.3580
 epoch: 66, train_loss: 1.1248, test_loss: 1.0922, test_f1: 0.3541
 epoch: 67, train_loss: 1.1244, test_loss: 1.0933, test_f1: 0.3633
 epoch: 68, train_loss: 1.1243, test_loss: 1.0911, test_f1: 0.3609
 epoch: 69, train_loss: 1.1213, test_loss: 1.0890, test_f1: 0.3580
 epoch: 70, train_loss: 1.1176, test_loss: 1.0885, test_f1: 0.3637
 epoch: 71, train_loss: 1.1221, test_loss: 1.0887, test_f1: 0.3723
 epoch: 72, train_loss: 1.1191, test_loss: 1.0878, test_f1: 0.3723
 epoch: 73, train_loss: 1.1144, test_loss: 1.0861, test_f1: 0.3748
 epoch: 74, train_loss: 1.1175, test_loss: 1.0846, test_f1: 0.3720
 epoch: 75, train_loss: 1.1166, test_loss: 1.0827, test_f1: 0.3706
 epoch: 76, train_loss: 1.1140, test_loss: 1.0836, test_f1: 0.3757
 epoch: 77, train_loss: 1.1132, test_loss: 1.0826, test_f1: 0.3757
 epoch: 78, train_loss: 1.1110, test_loss: 1.0843, test_f1: 0.3732
 epoch: 79, train_loss: 1.1093, test_loss: 1.0811, test_f1: 0.3766
 epoch: 80, train_loss: 1.1148, test_loss: 1.0787, test_f1: 0.3757
 epoch: 81, train_loss: 1.1113, test_loss: 1.0786, test_f1: 0.3729
 epoch: 82, train_loss: 1.1097, test_loss: 1.0785, test_f1: 0.3757
 epoch: 83, train_loss: 1.1137, test_loss: 1.0762, test_f1: 0.3779
 epoch: 84, train_loss: 1.1072, test_loss: 1.0772, test_f1: 0.3816
 epoch: 85, train_loss: 1.1055, test_loss: 1.0751, test_f1: 0.3816
 epoch: 86, train_loss: 1.1091, test_loss: 1.0738, test_f1: 0.3819
 epoch: 87, train_loss: 1.1058, test_loss: 1.0719, test_f1: 0.3808
 epoch: 88, train_loss: 1.1070, test_loss: 1.0750, test_f1: 0.3852
 epoch: 89, train_loss: 1.1036, test_loss: 1.0727, test_f1: 0.3819
 epoch: 90, train_loss: 1.1084, test_loss: 1.0716, test_f1: 0.3782
 epoch: 91, train_loss: 1.1023, test_loss: 1.0721, test_f1: 0.3773
 epoch: 92, train_loss: 1.1005, test_loss: 1.0723, test_f1: 0.3850
 epoch: 93, train_loss: 1.0978, test_loss: 1.0680, test_f1: 0.3837
 epoch: 94, train_loss: 1.1006, test_loss: 1.0676, test_f1: 0.3837
 epoch: 95, train_loss: 1.1015, test_loss: 1.0686, test_f1: 0.3868
 epoch: 96, train_loss: 1.0995, test_loss: 1.0669, test_f1: 0.3846
 epoch: 97, train_loss: 1.1027, test_loss: 1.0679, test_f1: 0.3868
 epoch: 98, train_loss: 1.0975, test_loss: 1.0684, test_f1: 0.3868
 epoch: 99, train_loss: 1.0975, test_loss: 1.0645, test_f1: 0.3877
##################ITERATION #8 ****************************************
 epoch: 0, train_loss: 1.3124, test_loss: 1.3247, test_f1: 0.2260
 epoch: 1, train_loss: 1.3027, test_loss: 1.3208, test_f1: 0.2260
 epoch: 2, train_loss: 1.2977, test_loss: 1.3157, test_f1: 0.2260
 epoch: 3, train_loss: 1.2915, test_loss: 1.3051, test_f1: 0.2260
 epoch: 4, train_loss: 1.2887, test_loss: 1.2975, test_f1: 0.2260
 epoch: 5, train_loss: 1.2838, test_loss: 1.2911, test_f1: 0.2260
 epoch: 6, train_loss: 1.2796, test_loss: 1.2860, test_f1: 0.2260
 epoch: 7, train_loss: 1.2754, test_loss: 1.2805, test_f1: 0.2260
 epoch: 8, train_loss: 1.2703, test_loss: 1.2745, test_f1: 0.2260
 epoch: 9, train_loss: 1.2657, test_loss: 1.2705, test_f1: 0.2260
 epoch: 10, train_loss: 1.2629, test_loss: 1.2655, test_f1: 0.2260
 epoch: 11, train_loss: 1.2599, test_loss: 1.2613, test_f1: 0.2260
 epoch: 12, train_loss: 1.2530, test_loss: 1.2560, test_f1: 0.2260
 epoch: 13, train_loss: 1.2474, test_loss: 1.2507, test_f1: 0.2260
 epoch: 14, train_loss: 1.2487, test_loss: 1.2461, test_f1: 0.2260
 epoch: 15, train_loss: 1.2455, test_loss: 1.2428, test_f1: 0.2260
 epoch: 16, train_loss: 1.2452, test_loss: 1.2391, test_f1: 0.2260
 epoch: 17, train_loss: 1.2359, test_loss: 1.2334, test_f1: 0.2260
 epoch: 18, train_loss: 1.2335, test_loss: 1.2297, test_f1: 0.2260
 epoch: 19, train_loss: 1.2300, test_loss: 1.2259, test_f1: 0.2260
 epoch: 20, train_loss: 1.2292, test_loss: 1.2190, test_f1: 0.2260
 epoch: 21, train_loss: 1.2240, test_loss: 1.2161, test_f1: 0.2311
 epoch: 22, train_loss: 1.2197, test_loss: 1.2114, test_f1: 0.2335
 epoch: 23, train_loss: 1.2159, test_loss: 1.2063, test_f1: 0.2383
 epoch: 24, train_loss: 1.2108, test_loss: 1.1998, test_f1: 0.2539
 epoch: 25, train_loss: 1.2117, test_loss: 1.1961, test_f1: 0.2581
 epoch: 26, train_loss: 1.2095, test_loss: 1.1933, test_f1: 0.2925
 epoch: 27, train_loss: 1.2019, test_loss: 1.1884, test_f1: 0.3048
 epoch: 28, train_loss: 1.2022, test_loss: 1.1849, test_f1: 0.3146
 epoch: 29, train_loss: 1.2043, test_loss: 1.1843, test_f1: 0.3250
 epoch: 30, train_loss: 1.1893, test_loss: 1.1788, test_f1: 0.3323
 epoch: 31, train_loss: 1.1932, test_loss: 1.1750, test_f1: 0.3358
 epoch: 32, train_loss: 1.1910, test_loss: 1.1704, test_f1: 0.3370
 epoch: 33, train_loss: 1.1860, test_loss: 1.1664, test_f1: 0.3392
 epoch: 34, train_loss: 1.1807, test_loss: 1.1624, test_f1: 0.3422
 epoch: 35, train_loss: 1.1797, test_loss: 1.1595, test_f1: 0.3444
 epoch: 36, train_loss: 1.1770, test_loss: 1.1568, test_f1: 0.3476
 epoch: 37, train_loss: 1.1744, test_loss: 1.1563, test_f1: 0.3427
 epoch: 38, train_loss: 1.1685, test_loss: 1.1522, test_f1: 0.3431
 epoch: 39, train_loss: 1.1723, test_loss: 1.1489, test_f1: 0.3400
 epoch: 40, train_loss: 1.1647, test_loss: 1.1458, test_f1: 0.3400
 epoch: 41, train_loss: 1.1658, test_loss: 1.1447, test_f1: 0.3391
 epoch: 42, train_loss: 1.1621, test_loss: 1.1428, test_f1: 0.3391
 epoch: 43, train_loss: 1.1600, test_loss: 1.1424, test_f1: 0.3400
 epoch: 44, train_loss: 1.1601, test_loss: 1.1404, test_f1: 0.3390
 epoch: 45, train_loss: 1.1532, test_loss: 1.1344, test_f1: 0.3400
 epoch: 46, train_loss: 1.1573, test_loss: 1.1345, test_f1: 0.3390
 epoch: 47, train_loss: 1.1515, test_loss: 1.1341, test_f1: 0.3388
 epoch: 48, train_loss: 1.1446, test_loss: 1.1284, test_f1: 0.3376
 epoch: 49, train_loss: 1.1433, test_loss: 1.1286, test_f1: 0.3367
 epoch: 50, train_loss: 1.1433, test_loss: 1.1242, test_f1: 0.3390
 epoch: 51, train_loss: 1.1392, test_loss: 1.1245, test_f1: 0.3386
 epoch: 52, train_loss: 1.1456, test_loss: 1.1233, test_f1: 0.3367
 epoch: 53, train_loss: 1.1379, test_loss: 1.1231, test_f1: 0.3357
 epoch: 54, train_loss: 1.1390, test_loss: 1.1218, test_f1: 0.3367
 epoch: 55, train_loss: 1.1357, test_loss: 1.1214, test_f1: 0.3367
 epoch: 56, train_loss: 1.1370, test_loss: 1.1195, test_f1: 0.3355
 epoch: 57, train_loss: 1.1391, test_loss: 1.1211, test_f1: 0.3355
 epoch: 58, train_loss: 1.1364, test_loss: 1.1199, test_f1: 0.3367
 epoch: 59, train_loss: 1.1351, test_loss: 1.1188, test_f1: 0.3367
 epoch: 60, train_loss: 1.1334, test_loss: 1.1161, test_f1: 0.3357
 epoch: 61, train_loss: 1.1321, test_loss: 1.1154, test_f1: 0.3355
 epoch: 62, train_loss: 1.1325, test_loss: 1.1142, test_f1: 0.3365
 epoch: 63, train_loss: 1.1290, test_loss: 1.1132, test_f1: 0.3365
 epoch: 64, train_loss: 1.1273, test_loss: 1.1120, test_f1: 0.3365
 epoch: 65, train_loss: 1.1304, test_loss: 1.1111, test_f1: 0.3365
 epoch: 66, train_loss: 1.1300, test_loss: 1.1110, test_f1: 0.3365
 epoch: 67, train_loss: 1.1257, test_loss: 1.1100, test_f1: 0.3374
 epoch: 68, train_loss: 1.1263, test_loss: 1.1087, test_f1: 0.3383
 epoch: 69, train_loss: 1.1227, test_loss: 1.1067, test_f1: 0.3376
 epoch: 70, train_loss: 1.1234, test_loss: 1.1084, test_f1: 0.3363
 epoch: 71, train_loss: 1.1260, test_loss: 1.1095, test_f1: 0.3363
 epoch: 72, train_loss: 1.1185, test_loss: 1.1073, test_f1: 0.3372
 epoch: 73, train_loss: 1.1188, test_loss: 1.1060, test_f1: 0.3372
 epoch: 74, train_loss: 1.1188, test_loss: 1.1050, test_f1: 0.3397
 epoch: 75, train_loss: 1.1228, test_loss: 1.1039, test_f1: 0.3400
 epoch: 76, train_loss: 1.1203, test_loss: 1.1019, test_f1: 0.3402
 epoch: 77, train_loss: 1.1194, test_loss: 1.1013, test_f1: 0.3444
 epoch: 78, train_loss: 1.1116, test_loss: 1.1008, test_f1: 0.3430
 epoch: 79, train_loss: 1.1137, test_loss: 1.0989, test_f1: 0.3400
 epoch: 80, train_loss: 1.1147, test_loss: 1.0992, test_f1: 0.3409
 epoch: 81, train_loss: 1.1108, test_loss: 1.0972, test_f1: 0.3440
 epoch: 82, train_loss: 1.1131, test_loss: 1.0956, test_f1: 0.3430
 epoch: 83, train_loss: 1.1168, test_loss: 1.0965, test_f1: 0.3408
 epoch: 84, train_loss: 1.1126, test_loss: 1.0975, test_f1: 0.3409
 epoch: 85, train_loss: 1.1126, test_loss: 1.0962, test_f1: 0.3409
 epoch: 86, train_loss: 1.1070, test_loss: 1.0934, test_f1: 0.3409
 epoch: 87, train_loss: 1.1071, test_loss: 1.0924, test_f1: 0.3409
 epoch: 88, train_loss: 1.1030, test_loss: 1.0915, test_f1: 0.3449
 epoch: 89, train_loss: 1.1058, test_loss: 1.0910, test_f1: 0.3398
 epoch: 90, train_loss: 1.1092, test_loss: 1.0916, test_f1: 0.3409
 epoch: 91, train_loss: 1.1018, test_loss: 1.0901, test_f1: 0.3449
 epoch: 92, train_loss: 1.1055, test_loss: 1.0878, test_f1: 0.3409
 epoch: 93, train_loss: 1.1096, test_loss: 1.0887, test_f1: 0.3409
 epoch: 94, train_loss: 1.1021, test_loss: 1.0883, test_f1: 0.3409
 epoch: 95, train_loss: 1.1017, test_loss: 1.0885, test_f1: 0.3409
 epoch: 96, train_loss: 1.1020, test_loss: 1.0876, test_f1: 0.3409
 epoch: 97, train_loss: 1.1019, test_loss: 1.0871, test_f1: 0.3409
 epoch: 98, train_loss: 1.1057, test_loss: 1.0852, test_f1: 0.3409
 epoch: 99, train_loss: 1.0962, test_loss: 1.0856, test_f1: 0.3409
##################ITERATION #9 ****************************************
 epoch: 0, train_loss: 1.3309, test_loss: 1.3475, test_f1: 0.2260
 epoch: 1, train_loss: 1.3168, test_loss: 1.3487, test_f1: 0.2260
 epoch: 2, train_loss: 1.3092, test_loss: 1.3544, test_f1: 0.2260
 epoch: 3, train_loss: 1.3001, test_loss: 1.3503, test_f1: 0.2260
 epoch: 4, train_loss: 1.2947, test_loss: 1.3327, test_f1: 0.2260
 epoch: 5, train_loss: 1.2881, test_loss: 1.3031, test_f1: 0.2260
 epoch: 6, train_loss: 1.2779, test_loss: 1.2893, test_f1: 0.2260
 epoch: 7, train_loss: 1.2736, test_loss: 1.2800, test_f1: 0.2260
 epoch: 8, train_loss: 1.2703, test_loss: 1.2729, test_f1: 0.2260
 epoch: 9, train_loss: 1.2631, test_loss: 1.2661, test_f1: 0.2260
 epoch: 10, train_loss: 1.2559, test_loss: 1.2588, test_f1: 0.2260
 epoch: 11, train_loss: 1.2536, test_loss: 1.2534, test_f1: 0.2260
 epoch: 12, train_loss: 1.2482, test_loss: 1.2477, test_f1: 0.2260
 epoch: 13, train_loss: 1.2417, test_loss: 1.2416, test_f1: 0.2260
 epoch: 14, train_loss: 1.2360, test_loss: 1.2353, test_f1: 0.2260
 epoch: 15, train_loss: 1.2347, test_loss: 1.2300, test_f1: 0.2260
 epoch: 16, train_loss: 1.2311, test_loss: 1.2263, test_f1: 0.2260
 epoch: 17, train_loss: 1.2292, test_loss: 1.2227, test_f1: 0.2260
 epoch: 18, train_loss: 1.2228, test_loss: 1.2168, test_f1: 0.2260
 epoch: 19, train_loss: 1.2240, test_loss: 1.2120, test_f1: 0.2260
 epoch: 20, train_loss: 1.2165, test_loss: 1.2071, test_f1: 0.2260
 epoch: 21, train_loss: 1.2152, test_loss: 1.2034, test_f1: 0.2260
 epoch: 22, train_loss: 1.2136, test_loss: 1.1993, test_f1: 0.2260
 epoch: 23, train_loss: 1.2118, test_loss: 1.1953, test_f1: 0.2286
 epoch: 24, train_loss: 1.2066, test_loss: 1.1923, test_f1: 0.2452
 epoch: 25, train_loss: 1.2037, test_loss: 1.1886, test_f1: 0.2754
 epoch: 26, train_loss: 1.1991, test_loss: 1.1835, test_f1: 0.3003
 epoch: 27, train_loss: 1.1960, test_loss: 1.1803, test_f1: 0.3287
 epoch: 28, train_loss: 1.1929, test_loss: 1.1775, test_f1: 0.3358
 epoch: 29, train_loss: 1.1916, test_loss: 1.1730, test_f1: 0.3426
 epoch: 30, train_loss: 1.1899, test_loss: 1.1696, test_f1: 0.3447
 epoch: 31, train_loss: 1.1871, test_loss: 1.1657, test_f1: 0.3458
 epoch: 32, train_loss: 1.1814, test_loss: 1.1626, test_f1: 0.3458
 epoch: 33, train_loss: 1.1779, test_loss: 1.1590, test_f1: 0.3494
 epoch: 34, train_loss: 1.1774, test_loss: 1.1557, test_f1: 0.3505
 epoch: 35, train_loss: 1.1733, test_loss: 1.1524, test_f1: 0.3522
 epoch: 36, train_loss: 1.1702, test_loss: 1.1480, test_f1: 0.3526
 epoch: 37, train_loss: 1.1692, test_loss: 1.1458, test_f1: 0.3494
 epoch: 38, train_loss: 1.1675, test_loss: 1.1447, test_f1: 0.3494
 epoch: 39, train_loss: 1.1649, test_loss: 1.1410, test_f1: 0.3548
 epoch: 40, train_loss: 1.1632, test_loss: 1.1380, test_f1: 0.3548
 epoch: 41, train_loss: 1.1596, test_loss: 1.1340, test_f1: 0.3534
 epoch: 42, train_loss: 1.1528, test_loss: 1.1310, test_f1: 0.3561
 epoch: 43, train_loss: 1.1526, test_loss: 1.1283, test_f1: 0.3580
 epoch: 44, train_loss: 1.1483, test_loss: 1.1261, test_f1: 0.3595
 epoch: 45, train_loss: 1.1492, test_loss: 1.1251, test_f1: 0.3641
 epoch: 46, train_loss: 1.1463, test_loss: 1.1237, test_f1: 0.3666
 epoch: 47, train_loss: 1.1424, test_loss: 1.1211, test_f1: 0.3660
 epoch: 48, train_loss: 1.1381, test_loss: 1.1174, test_f1: 0.3660
 epoch: 49, train_loss: 1.1405, test_loss: 1.1152, test_f1: 0.3671
 epoch: 50, train_loss: 1.1405, test_loss: 1.1121, test_f1: 0.3685
 epoch: 51, train_loss: 1.1334, test_loss: 1.1106, test_f1: 0.3675
 epoch: 52, train_loss: 1.1316, test_loss: 1.1080, test_f1: 0.3685
 epoch: 53, train_loss: 1.1269, test_loss: 1.1071, test_f1: 0.3695
 epoch: 54, train_loss: 1.1285, test_loss: 1.1050, test_f1: 0.3676
 epoch: 55, train_loss: 1.1297, test_loss: 1.1071, test_f1: 0.3943
 epoch: 56, train_loss: 1.1252, test_loss: 1.1043, test_f1: 0.3972
 epoch: 57, train_loss: 1.1253, test_loss: 1.1041, test_f1: 0.3962
 epoch: 58, train_loss: 1.1275, test_loss: 1.1033, test_f1: 0.3995
 epoch: 59, train_loss: 1.1285, test_loss: 1.1011, test_f1: 0.3967
 epoch: 60, train_loss: 1.1250, test_loss: 1.1005, test_f1: 0.3973
 epoch: 61, train_loss: 1.1238, test_loss: 1.1006, test_f1: 0.3692
 epoch: 62, train_loss: 1.1160, test_loss: 1.1008, test_f1: 0.3693
 epoch: 63, train_loss: 1.1227, test_loss: 1.1003, test_f1: 0.3633
 epoch: 64, train_loss: 1.1146, test_loss: 1.0987, test_f1: 0.3695
 epoch: 65, train_loss: 1.1154, test_loss: 1.0994, test_f1: 0.3695
 epoch: 66, train_loss: 1.1153, test_loss: 1.0995, test_f1: 0.3603
 epoch: 67, train_loss: 1.1173, test_loss: 1.0973, test_f1: 0.3598
 epoch: 68, train_loss: 1.1207, test_loss: 1.0975, test_f1: 0.3638
 epoch: 69, train_loss: 1.1117, test_loss: 1.0971, test_f1: 0.3628
 epoch: 70, train_loss: 1.1133, test_loss: 1.0957, test_f1: 0.3662
 epoch: 71, train_loss: 1.1118, test_loss: 1.0939, test_f1: 0.3632
 epoch: 72, train_loss: 1.1142, test_loss: 1.0918, test_f1: 0.3676
 epoch: 73, train_loss: 1.1092, test_loss: 1.0911, test_f1: 0.3654
 epoch: 74, train_loss: 1.1099, test_loss: 1.0901, test_f1: 0.3668
 epoch: 75, train_loss: 1.1073, test_loss: 1.0891, test_f1: 0.3670
 epoch: 76, train_loss: 1.1072, test_loss: 1.0885, test_f1: 0.3749
 epoch: 77, train_loss: 1.1134, test_loss: 1.0856, test_f1: 0.3832
 epoch: 78, train_loss: 1.1035, test_loss: 1.0869, test_f1: 0.3803
 epoch: 79, train_loss: 1.1012, test_loss: 1.0865, test_f1: 0.3785
 epoch: 80, train_loss: 1.1063, test_loss: 1.0856, test_f1: 0.3784
 epoch: 81, train_loss: 1.1048, test_loss: 1.0848, test_f1: 0.3803
 epoch: 82, train_loss: 1.1026, test_loss: 1.0841, test_f1: 0.3764
 epoch: 83, train_loss: 1.0994, test_loss: 1.0856, test_f1: 0.3753
 epoch: 84, train_loss: 1.0986, test_loss: 1.0832, test_f1: 0.3783
 epoch: 85, train_loss: 1.1002, test_loss: 1.0840, test_f1: 0.3725
 epoch: 86, train_loss: 1.1002, test_loss: 1.0816, test_f1: 0.3753
 epoch: 87, train_loss: 1.0996, test_loss: 1.0816, test_f1: 0.3779
 epoch: 88, train_loss: 1.0937, test_loss: 1.0822, test_f1: 0.3882
 epoch: 89, train_loss: 1.0924, test_loss: 1.0797, test_f1: 0.4025
 epoch: 90, train_loss: 1.0882, test_loss: 1.0788, test_f1: 0.4025
 epoch: 91, train_loss: 1.0916, test_loss: 1.0790, test_f1: 0.3761
 epoch: 92, train_loss: 1.0963, test_loss: 1.0794, test_f1: 0.3750
 epoch: 93, train_loss: 1.0918, test_loss: 1.0791, test_f1: 0.3721
 epoch: 94, train_loss: 1.0909, test_loss: 1.0777, test_f1: 0.3747
 epoch: 95, train_loss: 1.0904, test_loss: 1.0756, test_f1: 0.3784
 epoch: 96, train_loss: 1.0785, test_loss: 1.0757, test_f1: 0.4039
 epoch: 97, train_loss: 1.0926, test_loss: 1.0740, test_f1: 0.4057
 epoch: 98, train_loss: 1.0893, test_loss: 1.0729, test_f1: 0.4063
 epoch: 99, train_loss: 1.0894, test_loss: 1.0723, test_f1: 0.3859

Training completed in 443.92 seconds
Best F1: 0.4063 at epoch 98
Mean F1 across iterations: 0.3441  0.0327
========================FINAL RESULTS================================
FEGIN weighted F1: 0.4063  0.0327
python main.py --data ltspice_examples --representation component_pin --model FEGIN --layers 6 --hiddens 16 --batch_size 256 --lr 0.0001 --emb_size 512 --epochs 100 --save_appendix component_pin_L6_H16_BS256_LR0.0001_E512 --no_val
-----



STDERR:
  File "main.py", line 370, in <module>
    main()
  File "main.py", line 254, in main
    dataset = dataset_class(
  File "/home/philip/projects/ltspice_examples_code_repo/Circuit-Completion-Using-GNNs/component_classification_with_link_prediction_head/evaluation/FEGIN/kernel/circuit_datasets.py", line 15, in __init__
    self.data, self.slices = torch.load(self.processed_paths[0])
  File "/home/philip/.local/lib/python3.8/site-packages/torch/serialization.py", line 1040, in load
    warnings.warn(
  File "/usr/lib/python3.8/warnings.py", line 109, in _showwarnmsg
    sw(msg.message, msg.category, msg.filename, msg.lineno,
  File "main.py", line 47, in warn_with_traceback
    traceback.print_stack(file=log)
/home/philip/projects/ltspice_examples_code_repo/Circuit-Completion-Using-GNNs/component_classification_with_link_prediction_head/evaluation/FEGIN/kernel/circuit_datasets.py:15: FutureWarning: You are using `torch.load` with `weights_only=False` (the current default value), which uses the default pickle module implicitly. It is possible to construct malicious pickle data which will execute arbitrary code during unpickling (See https://github.com/pytorch/pytorch/blob/main/SECURITY.md#untrusted-models for more details). In a future release, the default value for `weights_only` will be flipped to `True`. This limits the functions that could be executed during unpickling. Arbitrary objects will no longer be allowed to be loaded via this mode unless they are explicitly allowlisted by the user via `torch.serialization.add_safe_globals`. We recommend you start setting `weights_only=True` for any use case where you don't have full control of the loaded file. Please open an issue on GitHub for any issues related to this experimental feature.
  self.data, self.slices = torch.load(self.processed_paths[0])
