STDOUT:
Results will be saved in /home/philip/projects/ltspice_examples_code_repo/Circuit-Completion-Using-GNNs/component_classification_with_link_prediction_head/evaluation/FEGIN/results/model_FEGIN_dataset_ltspice_demos
Command line input: python main.py --data ltspice_demos --representation component_pin --model FEGIN --layers 4 --hiddens 32 --batch_size 256 --lr 0.001 --emb_size 128 --epochs 100 --save_appendix component_pin_L4_H32_BS256_LR0.001_E128 --no_val
 is saved.
-----
ltspice_demos - FEGIN
Using 4 layers, 32 hidden units, h = 2
Loading component_pin representation dataset
ENTERED
Training FEGIN on component_pin representation
Train: 1565, Test: 383
##################ITERATION #0 ****************************************
 epoch: 0, train_loss: 1.3097, test_loss: 1.3263, test_f1: 0.2628
 epoch: 1, train_loss: 1.2973, test_loss: 1.3224, test_f1: 0.2628
 epoch: 2, train_loss: 1.2880, test_loss: 1.3184, test_f1: 0.2628
 epoch: 3, train_loss: 1.2761, test_loss: 1.3139, test_f1: 0.2630
 epoch: 4, train_loss: 1.2626, test_loss: 1.3087, test_f1: 0.2630
 epoch: 5, train_loss: 1.2437, test_loss: 1.3023, test_f1: 0.2630
 epoch: 6, train_loss: 1.2238, test_loss: 1.2934, test_f1: 0.2884
 epoch: 7, train_loss: 1.2018, test_loss: 1.2785, test_f1: 0.3260
 epoch: 8, train_loss: 1.1787, test_loss: 1.2778, test_f1: 0.3328
 epoch: 9, train_loss: 1.1541, test_loss: 1.2702, test_f1: 0.3384
 epoch: 10, train_loss: 1.1258, test_loss: 1.2399, test_f1: 0.3423
 epoch: 11, train_loss: 1.1008, test_loss: 1.2105, test_f1: 0.3944
 epoch: 12, train_loss: 1.0789, test_loss: 1.1970, test_f1: 0.4157
 epoch: 13, train_loss: 1.0595, test_loss: 1.1501, test_f1: 0.4329
 epoch: 14, train_loss: 1.0298, test_loss: 1.1998, test_f1: 0.4083
 epoch: 15, train_loss: 1.0009, test_loss: 1.1227, test_f1: 0.4404
 epoch: 16, train_loss: 0.9954, test_loss: 1.1076, test_f1: 0.4470
 epoch: 17, train_loss: 1.0044, test_loss: 1.4938, test_f1: 0.3404
 epoch: 18, train_loss: 0.9810, test_loss: 1.1267, test_f1: 0.4235
 epoch: 19, train_loss: 0.9793, test_loss: 1.1338, test_f1: 0.4347
 epoch: 20, train_loss: 0.9759, test_loss: 1.1255, test_f1: 0.4419
 epoch: 21, train_loss: 0.9602, test_loss: 1.1328, test_f1: 0.4296
 epoch: 22, train_loss: 0.9518, test_loss: 1.0610, test_f1: 0.4521
 epoch: 23, train_loss: 0.9421, test_loss: 1.0434, test_f1: 0.4673
 epoch: 24, train_loss: 0.9256, test_loss: 1.0487, test_f1: 0.4696
 epoch: 25, train_loss: 0.9280, test_loss: 1.1261, test_f1: 0.4140
 epoch: 26, train_loss: 0.9110, test_loss: 1.0200, test_f1: 0.4592
 epoch: 27, train_loss: 0.9117, test_loss: 1.1135, test_f1: 0.4800
 epoch: 28, train_loss: 0.9026, test_loss: 1.0981, test_f1: 0.4530
 epoch: 29, train_loss: 0.8947, test_loss: 1.0350, test_f1: 0.4841
 epoch: 30, train_loss: 0.8860, test_loss: 1.1228, test_f1: 0.4539
 epoch: 31, train_loss: 0.8815, test_loss: 0.9970, test_f1: 0.4694
 epoch: 32, train_loss: 0.8781, test_loss: 1.1546, test_f1: 0.4328
 epoch: 33, train_loss: 0.8611, test_loss: 1.0185, test_f1: 0.5114
 epoch: 34, train_loss: 0.8627, test_loss: 1.0036, test_f1: 0.4893
 epoch: 35, train_loss: 0.8551, test_loss: 0.9846, test_f1: 0.5243
 epoch: 36, train_loss: 0.8390, test_loss: 1.0442, test_f1: 0.5143
 epoch: 37, train_loss: 0.8301, test_loss: 1.0093, test_f1: 0.5343
 epoch: 38, train_loss: 0.8220, test_loss: 1.1511, test_f1: 0.4924
 epoch: 39, train_loss: 0.8423, test_loss: 1.4435, test_f1: 0.3964
 epoch: 40, train_loss: 0.8348, test_loss: 0.9524, test_f1: 0.5444
 epoch: 41, train_loss: 0.8351, test_loss: 1.0127, test_f1: 0.5448
 epoch: 42, train_loss: 0.8155, test_loss: 0.9331, test_f1: 0.5652
 epoch: 43, train_loss: 0.7861, test_loss: 1.0648, test_f1: 0.5200
 epoch: 44, train_loss: 0.7886, test_loss: 0.9619, test_f1: 0.5744
 epoch: 45, train_loss: 0.7788, test_loss: 0.9287, test_f1: 0.5684
 epoch: 46, train_loss: 0.7647, test_loss: 0.9255, test_f1: 0.5885
 epoch: 47, train_loss: 0.7669, test_loss: 0.9889, test_f1: 0.5440
 epoch: 48, train_loss: 0.7616, test_loss: 0.9380, test_f1: 0.5568
 epoch: 49, train_loss: 0.7400, test_loss: 0.9256, test_f1: 0.5548
 epoch: 50, train_loss: 0.7337, test_loss: 0.9394, test_f1: 0.5620
 epoch: 51, train_loss: 0.7282, test_loss: 0.9175, test_f1: 0.5613
 epoch: 52, train_loss: 0.7103, test_loss: 0.9599, test_f1: 0.5852
 epoch: 53, train_loss: 0.7115, test_loss: 0.9209, test_f1: 0.5676
 epoch: 54, train_loss: 0.7175, test_loss: 0.9496, test_f1: 0.5729
 epoch: 55, train_loss: 0.7032, test_loss: 0.9461, test_f1: 0.5679
 epoch: 56, train_loss: 0.7029, test_loss: 0.9260, test_f1: 0.5686
 epoch: 57, train_loss: 0.7130, test_loss: 0.9301, test_f1: 0.5582
 epoch: 58, train_loss: 0.6935, test_loss: 0.9368, test_f1: 0.5522
 epoch: 59, train_loss: 0.6908, test_loss: 0.9564, test_f1: 0.5452
 epoch: 60, train_loss: 0.6783, test_loss: 0.9554, test_f1: 0.5475
 epoch: 61, train_loss: 0.6766, test_loss: 0.9252, test_f1: 0.5671
 epoch: 62, train_loss: 0.6746, test_loss: 0.9214, test_f1: 0.5785
 epoch: 63, train_loss: 0.6663, test_loss: 0.9264, test_f1: 0.5875
 epoch: 64, train_loss: 0.6826, test_loss: 1.0248, test_f1: 0.5614
 epoch: 65, train_loss: 0.6793, test_loss: 1.0063, test_f1: 0.5310
 epoch: 66, train_loss: 0.6614, test_loss: 0.9276, test_f1: 0.5649
 epoch: 67, train_loss: 0.6618, test_loss: 0.9681, test_f1: 0.5286
 epoch: 68, train_loss: 0.6521, test_loss: 0.9568, test_f1: 0.5588
 epoch: 69, train_loss: 0.6614, test_loss: 0.9795, test_f1: 0.5659
 epoch: 70, train_loss: 0.6537, test_loss: 1.0917, test_f1: 0.5667
 epoch: 71, train_loss: 0.6406, test_loss: 0.9633, test_f1: 0.5522
 epoch: 72, train_loss: 0.6542, test_loss: 1.0023, test_f1: 0.5523
 epoch: 73, train_loss: 0.6503, test_loss: 0.9694, test_f1: 0.5786
 epoch: 74, train_loss: 0.6428, test_loss: 1.0487, test_f1: 0.5708
 epoch: 75, train_loss: 0.6378, test_loss: 1.0469, test_f1: 0.5808
 epoch: 76, train_loss: 0.6523, test_loss: 1.0046, test_f1: 0.5620
 epoch: 77, train_loss: 0.6614, test_loss: 0.9825, test_f1: 0.5610
 epoch: 78, train_loss: 0.6580, test_loss: 1.0032, test_f1: 0.5585
 epoch: 79, train_loss: 0.6635, test_loss: 1.0281, test_f1: 0.5505
 epoch: 80, train_loss: 0.6482, test_loss: 1.1623, test_f1: 0.5040
 epoch: 81, train_loss: 0.6448, test_loss: 1.0887, test_f1: 0.5464
 epoch: 82, train_loss: 0.6290, test_loss: 1.0696, test_f1: 0.5673
 epoch: 83, train_loss: 0.6201, test_loss: 1.0935, test_f1: 0.5596
 epoch: 84, train_loss: 0.6531, test_loss: 1.1006, test_f1: 0.5771
 epoch: 85, train_loss: 0.6607, test_loss: 1.2273, test_f1: 0.5411
 epoch: 86, train_loss: 0.6713, test_loss: 1.2206, test_f1: 0.5752
 epoch: 87, train_loss: 0.6583, test_loss: 1.0626, test_f1: 0.5654
 epoch: 88, train_loss: 0.6429, test_loss: 1.0999, test_f1: 0.5435
 epoch: 89, train_loss: 0.6301, test_loss: 1.0590, test_f1: 0.6022
 epoch: 90, train_loss: 0.6392, test_loss: 1.1409, test_f1: 0.6082
 epoch: 91, train_loss: 0.6225, test_loss: 1.1220, test_f1: 0.5962
 epoch: 92, train_loss: 0.6158, test_loss: 1.1645, test_f1: 0.5894
 epoch: 93, train_loss: 0.6233, test_loss: 1.0835, test_f1: 0.5903
 epoch: 94, train_loss: 0.6090, test_loss: 1.2164, test_f1: 0.4744
 epoch: 95, train_loss: 0.6357, test_loss: 1.0843, test_f1: 0.5661
 epoch: 96, train_loss: 0.6261, test_loss: 1.0777, test_f1: 0.5745
 epoch: 97, train_loss: 0.6562, test_loss: 1.0972, test_f1: 0.5505
 epoch: 98, train_loss: 0.6185, test_loss: 1.0790, test_f1: 0.5678
 epoch: 99, train_loss: 0.6103, test_loss: 1.1342, test_f1: 0.5499
##################ITERATION #1 ****************************************
 epoch: 0, train_loss: 1.2594, test_loss: 1.2978, test_f1: 0.2281
 epoch: 1, train_loss: 1.2124, test_loss: 1.2975, test_f1: 0.2281
 epoch: 2, train_loss: 1.1841, test_loss: 1.3011, test_f1: 0.2281
 epoch: 3, train_loss: 1.1536, test_loss: 1.3121, test_f1: 0.2281
 epoch: 4, train_loss: 1.1249, test_loss: 1.3224, test_f1: 0.2281
 epoch: 5, train_loss: 1.0965, test_loss: 1.3208, test_f1: 0.2601
 epoch: 6, train_loss: 1.0723, test_loss: 1.3052, test_f1: 0.2614
 epoch: 7, train_loss: 1.0473, test_loss: 1.2448, test_f1: 0.2765
 epoch: 8, train_loss: 1.0212, test_loss: 1.1533, test_f1: 0.4267
 epoch: 9, train_loss: 1.0040, test_loss: 1.1239, test_f1: 0.4269
 epoch: 10, train_loss: 0.9757, test_loss: 1.0764, test_f1: 0.4687
 epoch: 11, train_loss: 0.9547, test_loss: 1.0878, test_f1: 0.4746
 epoch: 12, train_loss: 0.9389, test_loss: 1.0713, test_f1: 0.4908
 epoch: 13, train_loss: 0.9181, test_loss: 1.0316, test_f1: 0.5125
 epoch: 14, train_loss: 0.8993, test_loss: 1.0955, test_f1: 0.5133
 epoch: 15, train_loss: 0.8986, test_loss: 1.0181, test_f1: 0.5414
 epoch: 16, train_loss: 0.8813, test_loss: 1.0809, test_f1: 0.4533
 epoch: 17, train_loss: 0.8705, test_loss: 1.0039, test_f1: 0.5502
 epoch: 18, train_loss: 0.8567, test_loss: 1.1718, test_f1: 0.5200
 epoch: 19, train_loss: 0.8453, test_loss: 1.0933, test_f1: 0.5357
 epoch: 20, train_loss: 0.8300, test_loss: 0.9985, test_f1: 0.5582
 epoch: 21, train_loss: 0.8416, test_loss: 1.0244, test_f1: 0.5415
 epoch: 22, train_loss: 0.8113, test_loss: 1.2463, test_f1: 0.5490
 epoch: 23, train_loss: 0.8093, test_loss: 1.2010, test_f1: 0.5387
 epoch: 24, train_loss: 0.7969, test_loss: 1.0189, test_f1: 0.5773
 epoch: 25, train_loss: 0.8065, test_loss: 1.0995, test_f1: 0.5344
 epoch: 26, train_loss: 0.7883, test_loss: 1.0236, test_f1: 0.5606
 epoch: 27, train_loss: 0.7659, test_loss: 1.2186, test_f1: 0.5875
 epoch: 28, train_loss: 0.7559, test_loss: 1.1010, test_f1: 0.5692
 epoch: 29, train_loss: 0.7530, test_loss: 1.0663, test_f1: 0.5041
 epoch: 30, train_loss: 0.7516, test_loss: 1.1125, test_f1: 0.5232
 epoch: 31, train_loss: 0.7530, test_loss: 1.0369, test_f1: 0.5419
 epoch: 32, train_loss: 0.7277, test_loss: 0.9904, test_f1: 0.5831
 epoch: 33, train_loss: 0.7257, test_loss: 1.1024, test_f1: 0.5855
 epoch: 34, train_loss: 0.7589, test_loss: 1.1476, test_f1: 0.5591
 epoch: 35, train_loss: 0.7306, test_loss: 1.1771, test_f1: 0.5723
 epoch: 36, train_loss: 0.7407, test_loss: 1.1026, test_f1: 0.5736
 epoch: 37, train_loss: 0.7267, test_loss: 1.1456, test_f1: 0.5492
 epoch: 38, train_loss: 0.7089, test_loss: 1.1681, test_f1: 0.5692
 epoch: 39, train_loss: 0.6925, test_loss: 1.1474, test_f1: 0.5926
 epoch: 40, train_loss: 0.6843, test_loss: 1.0492, test_f1: 0.5807
 epoch: 41, train_loss: 0.6747, test_loss: 1.0366, test_f1: 0.5991
 epoch: 42, train_loss: 0.6821, test_loss: 1.0301, test_f1: 0.6008
 epoch: 43, train_loss: 0.6681, test_loss: 1.0013, test_f1: 0.5577
 epoch: 44, train_loss: 0.6633, test_loss: 1.0114, test_f1: 0.5813
 epoch: 45, train_loss: 0.6710, test_loss: 1.2140, test_f1: 0.5655
 epoch: 46, train_loss: 0.6740, test_loss: 1.8247, test_f1: 0.5237
 epoch: 47, train_loss: 0.6771, test_loss: 1.6811, test_f1: 0.5147
 epoch: 48, train_loss: 0.6792, test_loss: 1.4763, test_f1: 0.5661
 epoch: 49, train_loss: 0.6624, test_loss: 1.2515, test_f1: 0.5948
 epoch: 50, train_loss: 0.6675, test_loss: 1.2565, test_f1: 0.6047
 epoch: 51, train_loss: 0.6583, test_loss: 1.4644, test_f1: 0.5969
 epoch: 52, train_loss: 0.6656, test_loss: 1.2422, test_f1: 0.5841
 epoch: 53, train_loss: 0.6405, test_loss: 1.1213, test_f1: 0.5966
 epoch: 54, train_loss: 0.6369, test_loss: 1.1516, test_f1: 0.5917
 epoch: 55, train_loss: 0.6410, test_loss: 1.2986, test_f1: 0.5843
 epoch: 56, train_loss: 0.6292, test_loss: 1.1367, test_f1: 0.6203
 epoch: 57, train_loss: 0.6296, test_loss: 1.1592, test_f1: 0.6131
 epoch: 58, train_loss: 0.6331, test_loss: 1.2209, test_f1: 0.5940
 epoch: 59, train_loss: 0.6256, test_loss: 1.1740, test_f1: 0.6100
 epoch: 60, train_loss: 0.6327, test_loss: 1.2542, test_f1: 0.5831
 epoch: 61, train_loss: 0.6222, test_loss: 1.1496, test_f1: 0.5962
 epoch: 62, train_loss: 0.6292, test_loss: 1.3770, test_f1: 0.5500
 epoch: 63, train_loss: 0.6327, test_loss: 1.1954, test_f1: 0.6064
 epoch: 64, train_loss: 0.6297, test_loss: 1.1456, test_f1: 0.6006
 epoch: 65, train_loss: 0.6184, test_loss: 1.1140, test_f1: 0.5910
 epoch: 66, train_loss: 0.6136, test_loss: 1.1303, test_f1: 0.6077
 epoch: 67, train_loss: 0.6122, test_loss: 1.2819, test_f1: 0.6249
 epoch: 68, train_loss: 0.6036, test_loss: 1.2997, test_f1: 0.6037
 epoch: 69, train_loss: 0.6091, test_loss: 1.3413, test_f1: 0.5586
 epoch: 70, train_loss: 0.6047, test_loss: 1.3325, test_f1: 0.5836
 epoch: 71, train_loss: 0.6162, test_loss: 1.3994, test_f1: 0.5910
 epoch: 72, train_loss: 0.6091, test_loss: 1.4596, test_f1: 0.6208
 epoch: 73, train_loss: 0.6072, test_loss: 1.3801, test_f1: 0.5952
 epoch: 74, train_loss: 0.6045, test_loss: 1.5050, test_f1: 0.6247
 epoch: 75, train_loss: 0.6028, test_loss: 1.6185, test_f1: 0.6069
 epoch: 76, train_loss: 0.5946, test_loss: 1.6535, test_f1: 0.6017
 epoch: 77, train_loss: 0.5951, test_loss: 1.8928, test_f1: 0.5877
 epoch: 78, train_loss: 0.5980, test_loss: 1.7566, test_f1: 0.5974
 epoch: 79, train_loss: 0.6090, test_loss: 1.9481, test_f1: 0.5737
 epoch: 80, train_loss: 0.6099, test_loss: 1.6774, test_f1: 0.5841
 epoch: 81, train_loss: 0.5953, test_loss: 1.3578, test_f1: 0.6188
 epoch: 82, train_loss: 0.5891, test_loss: 1.4659, test_f1: 0.6057
 epoch: 83, train_loss: 0.5997, test_loss: 1.5445, test_f1: 0.5912
 epoch: 84, train_loss: 0.5877, test_loss: 1.7391, test_f1: 0.6032
 epoch: 85, train_loss: 0.6007, test_loss: 1.3533, test_f1: 0.6059
 epoch: 86, train_loss: 0.5984, test_loss: 1.2798, test_f1: 0.6070
 epoch: 87, train_loss: 0.5907, test_loss: 1.3241, test_f1: 0.5925
 epoch: 88, train_loss: 0.5884, test_loss: 1.4006, test_f1: 0.5681
 epoch: 89, train_loss: 0.5992, test_loss: 1.3510, test_f1: 0.5703
 epoch: 90, train_loss: 0.5896, test_loss: 1.3299, test_f1: 0.5925
 epoch: 91, train_loss: 0.5926, test_loss: 1.4776, test_f1: 0.5930
 epoch: 92, train_loss: 0.5758, test_loss: 1.4083, test_f1: 0.5589
 epoch: 93, train_loss: 0.5869, test_loss: 1.5877, test_f1: 0.5425
 epoch: 94, train_loss: 0.5842, test_loss: 1.5555, test_f1: 0.5853
 epoch: 95, train_loss: 0.5704, test_loss: 1.6338, test_f1: 0.5872
 epoch: 96, train_loss: 0.5788, test_loss: 1.4633, test_f1: 0.5843
 epoch: 97, train_loss: 0.5626, test_loss: 1.5400, test_f1: 0.5966
 epoch: 98, train_loss: 0.5688, test_loss: 1.3619, test_f1: 0.6076
 epoch: 99, train_loss: 0.5722, test_loss: 1.2259, test_f1: 0.5818
##################ITERATION #2 ****************************************
 epoch: 0, train_loss: 1.2456, test_loss: 1.3140, test_f1: 0.2281
 epoch: 1, train_loss: 1.1906, test_loss: 1.3029, test_f1: 0.2281
 epoch: 2, train_loss: 1.1678, test_loss: 1.2881, test_f1: 0.2281
 epoch: 3, train_loss: 1.1436, test_loss: 1.2780, test_f1: 0.2253
 epoch: 4, train_loss: 1.1071, test_loss: 1.2629, test_f1: 0.2404
 epoch: 5, train_loss: 1.0835, test_loss: 1.2393, test_f1: 0.3389
 epoch: 6, train_loss: 1.0392, test_loss: 1.2103, test_f1: 0.3462
 epoch: 7, train_loss: 1.0213, test_loss: 1.1326, test_f1: 0.3926
 epoch: 8, train_loss: 0.9956, test_loss: 1.0752, test_f1: 0.4071
 epoch: 9, train_loss: 0.9669, test_loss: 1.0768, test_f1: 0.4529
 epoch: 10, train_loss: 0.9507, test_loss: 1.0668, test_f1: 0.4862
 epoch: 11, train_loss: 0.9309, test_loss: 1.0621, test_f1: 0.4552
 epoch: 12, train_loss: 0.9150, test_loss: 1.0645, test_f1: 0.4990
 epoch: 13, train_loss: 0.9002, test_loss: 1.0528, test_f1: 0.5239
 epoch: 14, train_loss: 0.8924, test_loss: 0.9853, test_f1: 0.5367
 epoch: 15, train_loss: 0.8751, test_loss: 0.9775, test_f1: 0.5357
 epoch: 16, train_loss: 0.8670, test_loss: 0.9637, test_f1: 0.5594
 epoch: 17, train_loss: 0.8513, test_loss: 0.9742, test_f1: 0.5342
 epoch: 18, train_loss: 0.8240, test_loss: 0.9677, test_f1: 0.5344
 epoch: 19, train_loss: 0.8219, test_loss: 1.0015, test_f1: 0.5424
 epoch: 20, train_loss: 0.8143, test_loss: 1.0088, test_f1: 0.5634
 epoch: 21, train_loss: 0.8253, test_loss: 1.0248, test_f1: 0.5156
 epoch: 22, train_loss: 0.7958, test_loss: 0.9695, test_f1: 0.5581
 epoch: 23, train_loss: 0.8130, test_loss: 0.9728, test_f1: 0.5350
 epoch: 24, train_loss: 0.8033, test_loss: 1.0095, test_f1: 0.5926
 epoch: 25, train_loss: 0.8211, test_loss: 1.0652, test_f1: 0.5743
 epoch: 26, train_loss: 0.8096, test_loss: 1.0059, test_f1: 0.5510
 epoch: 27, train_loss: 0.7789, test_loss: 1.0134, test_f1: 0.5445
 epoch: 28, train_loss: 0.7740, test_loss: 1.0214, test_f1: 0.5320
 epoch: 29, train_loss: 0.7693, test_loss: 1.0375, test_f1: 0.5596
 epoch: 30, train_loss: 0.7620, test_loss: 0.9952, test_f1: 0.5354
 epoch: 31, train_loss: 0.7584, test_loss: 0.9399, test_f1: 0.5269
 epoch: 32, train_loss: 0.7657, test_loss: 0.9287, test_f1: 0.6217
 epoch: 33, train_loss: 0.7478, test_loss: 0.9590, test_f1: 0.6084
 epoch: 34, train_loss: 0.7595, test_loss: 1.0035, test_f1: 0.5176
 epoch: 35, train_loss: 0.7407, test_loss: 1.0491, test_f1: 0.5576
 epoch: 36, train_loss: 0.7407, test_loss: 0.9703, test_f1: 0.5776
 epoch: 37, train_loss: 0.7410, test_loss: 0.9468, test_f1: 0.5882
 epoch: 38, train_loss: 0.7183, test_loss: 0.9626, test_f1: 0.5761
 epoch: 39, train_loss: 0.7324, test_loss: 0.9475, test_f1: 0.6092
 epoch: 40, train_loss: 0.7307, test_loss: 0.9982, test_f1: 0.5677
 epoch: 41, train_loss: 0.7551, test_loss: 0.9883, test_f1: 0.5574
 epoch: 42, train_loss: 0.7105, test_loss: 1.1874, test_f1: 0.5512
 epoch: 43, train_loss: 0.7145, test_loss: 0.9442, test_f1: 0.6009
 epoch: 44, train_loss: 0.7108, test_loss: 0.9047, test_f1: 0.6511
 epoch: 45, train_loss: 0.6984, test_loss: 0.9184, test_f1: 0.6133
 epoch: 46, train_loss: 0.7087, test_loss: 0.9486, test_f1: 0.5833
 epoch: 47, train_loss: 0.7143, test_loss: 1.1556, test_f1: 0.5299
 epoch: 48, train_loss: 0.7073, test_loss: 1.2663, test_f1: 0.4889
 epoch: 49, train_loss: 0.6935, test_loss: 1.0496, test_f1: 0.5635
 epoch: 50, train_loss: 0.6981, test_loss: 0.9492, test_f1: 0.5401
 epoch: 51, train_loss: 0.6822, test_loss: 0.9339, test_f1: 0.5768
 epoch: 52, train_loss: 0.6705, test_loss: 0.9412, test_f1: 0.5857
 epoch: 53, train_loss: 0.6666, test_loss: 0.9411, test_f1: 0.6022
 epoch: 54, train_loss: 0.6861, test_loss: 0.9212, test_f1: 0.6048
 epoch: 55, train_loss: 0.6787, test_loss: 0.9932, test_f1: 0.5831
 epoch: 56, train_loss: 0.6774, test_loss: 1.0772, test_f1: 0.5749
 epoch: 57, train_loss: 0.6717, test_loss: 0.9717, test_f1: 0.5685
 epoch: 58, train_loss: 0.6694, test_loss: 0.9208, test_f1: 0.6283
 epoch: 59, train_loss: 0.6609, test_loss: 0.9284, test_f1: 0.6295
 epoch: 60, train_loss: 0.6751, test_loss: 0.9496, test_f1: 0.6051
 epoch: 61, train_loss: 0.6668, test_loss: 1.0252, test_f1: 0.6036
 epoch: 62, train_loss: 0.6644, test_loss: 1.1177, test_f1: 0.5664
 epoch: 63, train_loss: 0.6590, test_loss: 1.0779, test_f1: 0.5787
 epoch: 64, train_loss: 0.6687, test_loss: 0.9591, test_f1: 0.6074
 epoch: 65, train_loss: 0.6597, test_loss: 0.9816, test_f1: 0.6118
 epoch: 66, train_loss: 0.6571, test_loss: 1.0667, test_f1: 0.5655
 epoch: 67, train_loss: 0.6440, test_loss: 1.0253, test_f1: 0.5761
 epoch: 68, train_loss: 0.6340, test_loss: 1.0709, test_f1: 0.5754
 epoch: 69, train_loss: 0.6317, test_loss: 1.0843, test_f1: 0.5901
 epoch: 70, train_loss: 0.6511, test_loss: 1.0705, test_f1: 0.5863
 epoch: 71, train_loss: 0.6334, test_loss: 1.0792, test_f1: 0.5832
 epoch: 72, train_loss: 0.6378, test_loss: 1.0580, test_f1: 0.5919
 epoch: 73, train_loss: 0.6442, test_loss: 1.0471, test_f1: 0.5776
 epoch: 74, train_loss: 0.6381, test_loss: 0.9795, test_f1: 0.6336
 epoch: 75, train_loss: 0.6539, test_loss: 0.9667, test_f1: 0.6377
 epoch: 76, train_loss: 0.6297, test_loss: 0.9731, test_f1: 0.5915
 epoch: 77, train_loss: 0.6343, test_loss: 1.0075, test_f1: 0.5923
 epoch: 78, train_loss: 0.6315, test_loss: 1.0878, test_f1: 0.5690
 epoch: 79, train_loss: 0.6410, test_loss: 1.0097, test_f1: 0.6064
 epoch: 80, train_loss: 0.6347, test_loss: 1.0120, test_f1: 0.6101
 epoch: 81, train_loss: 0.6243, test_loss: 1.0243, test_f1: 0.5899
 epoch: 82, train_loss: 0.6200, test_loss: 1.0534, test_f1: 0.5771
 epoch: 83, train_loss: 0.6329, test_loss: 1.1154, test_f1: 0.5863
 epoch: 84, train_loss: 0.6220, test_loss: 1.1106, test_f1: 0.5694
 epoch: 85, train_loss: 0.6277, test_loss: 1.0013, test_f1: 0.5901
 epoch: 86, train_loss: 0.6189, test_loss: 1.0422, test_f1: 0.6116
 epoch: 87, train_loss: 0.6157, test_loss: 1.0235, test_f1: 0.6159
 epoch: 88, train_loss: 0.6253, test_loss: 0.9622, test_f1: 0.6064
 epoch: 89, train_loss: 0.6238, test_loss: 0.9627, test_f1: 0.6353
 epoch: 90, train_loss: 0.6189, test_loss: 1.0013, test_f1: 0.6147
 epoch: 91, train_loss: 0.6265, test_loss: 1.0207, test_f1: 0.5983
 epoch: 92, train_loss: 0.6255, test_loss: 1.2510, test_f1: 0.5246
 epoch: 93, train_loss: 0.6234, test_loss: 1.1708, test_f1: 0.5580
 epoch: 94, train_loss: 0.6147, test_loss: 1.0306, test_f1: 0.6127
 epoch: 95, train_loss: 0.6249, test_loss: 0.9758, test_f1: 0.6267
 epoch: 96, train_loss: 0.6233, test_loss: 0.9580, test_f1: 0.6386
 epoch: 97, train_loss: 0.6327, test_loss: 0.9981, test_f1: 0.6117
 epoch: 98, train_loss: 0.6253, test_loss: 0.9774, test_f1: 0.6351
 epoch: 99, train_loss: 0.6040, test_loss: 1.0052, test_f1: 0.6423
##################ITERATION #3 ****************************************
 epoch: 0, train_loss: 1.2064, test_loss: 1.3289, test_f1: 0.2281
 epoch: 1, train_loss: 1.1240, test_loss: 1.3314, test_f1: 0.2281
 epoch: 2, train_loss: 1.0977, test_loss: 1.3438, test_f1: 0.2248
 epoch: 3, train_loss: 1.0583, test_loss: 1.3386, test_f1: 0.2404
 epoch: 4, train_loss: 1.0371, test_loss: 1.3222, test_f1: 0.2386
 epoch: 5, train_loss: 0.9976, test_loss: 1.2767, test_f1: 0.2513
 epoch: 6, train_loss: 0.9830, test_loss: 1.2162, test_f1: 0.3457
 epoch: 7, train_loss: 0.9451, test_loss: 1.1668, test_f1: 0.4531
 epoch: 8, train_loss: 0.9342, test_loss: 1.0854, test_f1: 0.5176
 epoch: 9, train_loss: 0.9001, test_loss: 1.0485, test_f1: 0.5162
 epoch: 10, train_loss: 0.8944, test_loss: 1.0150, test_f1: 0.5087
 epoch: 11, train_loss: 0.8791, test_loss: 1.0004, test_f1: 0.5361
 epoch: 12, train_loss: 0.8696, test_loss: 0.9748, test_f1: 0.5524
 epoch: 13, train_loss: 0.8637, test_loss: 0.9692, test_f1: 0.5510
 epoch: 14, train_loss: 0.8431, test_loss: 0.9566, test_f1: 0.5646
 epoch: 15, train_loss: 0.8517, test_loss: 0.9642, test_f1: 0.5553
 epoch: 16, train_loss: 0.8255, test_loss: 1.0001, test_f1: 0.5179
 epoch: 17, train_loss: 0.8107, test_loss: 1.0595, test_f1: 0.4710
 epoch: 18, train_loss: 0.8211, test_loss: 1.0199, test_f1: 0.5187
 epoch: 19, train_loss: 0.8098, test_loss: 1.0356, test_f1: 0.5404
 epoch: 20, train_loss: 0.7943, test_loss: 1.0654, test_f1: 0.5068
 epoch: 21, train_loss: 0.7822, test_loss: 0.9709, test_f1: 0.5816
 epoch: 22, train_loss: 0.7719, test_loss: 0.9506, test_f1: 0.6157
 epoch: 23, train_loss: 0.7746, test_loss: 0.9519, test_f1: 0.6158
 epoch: 24, train_loss: 0.7518, test_loss: 0.9423, test_f1: 0.6070
 epoch: 25, train_loss: 0.7605, test_loss: 1.0027, test_f1: 0.5929
 epoch: 26, train_loss: 0.7558, test_loss: 0.9947, test_f1: 0.5639
 epoch: 27, train_loss: 0.7522, test_loss: 1.0058, test_f1: 0.5789
 epoch: 28, train_loss: 0.7454, test_loss: 0.9439, test_f1: 0.6170
 epoch: 29, train_loss: 0.7304, test_loss: 0.9332, test_f1: 0.6174
 epoch: 30, train_loss: 0.7215, test_loss: 0.9111, test_f1: 0.5799
 epoch: 31, train_loss: 0.7411, test_loss: 0.9637, test_f1: 0.5457
 epoch: 32, train_loss: 0.7222, test_loss: 0.9647, test_f1: 0.6006
 epoch: 33, train_loss: 0.7187, test_loss: 0.9417, test_f1: 0.5983
 epoch: 34, train_loss: 0.7202, test_loss: 0.9729, test_f1: 0.5370
 epoch: 35, train_loss: 0.7227, test_loss: 0.9780, test_f1: 0.5833
 epoch: 36, train_loss: 0.7167, test_loss: 0.9618, test_f1: 0.5979
 epoch: 37, train_loss: 0.7352, test_loss: 0.9312, test_f1: 0.5979
 epoch: 38, train_loss: 0.7104, test_loss: 0.9714, test_f1: 0.6011
 epoch: 39, train_loss: 0.7117, test_loss: 1.0208, test_f1: 0.5668
 epoch: 40, train_loss: 0.7036, test_loss: 0.9814, test_f1: 0.5274
 epoch: 41, train_loss: 0.6911, test_loss: 0.9882, test_f1: 0.5602
 epoch: 42, train_loss: 0.6771, test_loss: 1.0190, test_f1: 0.5530
 epoch: 43, train_loss: 0.6953, test_loss: 0.9756, test_f1: 0.5596
 epoch: 44, train_loss: 0.6959, test_loss: 1.1200, test_f1: 0.5584
 epoch: 45, train_loss: 0.7021, test_loss: 1.0152, test_f1: 0.6185
 epoch: 46, train_loss: 0.7005, test_loss: 1.0030, test_f1: 0.6292
 epoch: 47, train_loss: 0.7053, test_loss: 1.0017, test_f1: 0.6011
 epoch: 48, train_loss: 0.6969, test_loss: 0.9852, test_f1: 0.6063
 epoch: 49, train_loss: 0.6878, test_loss: 1.0189, test_f1: 0.5935
 epoch: 50, train_loss: 0.6693, test_loss: 1.1321, test_f1: 0.5699
 epoch: 51, train_loss: 0.6644, test_loss: 1.1027, test_f1: 0.5642
 epoch: 52, train_loss: 0.6780, test_loss: 1.1464, test_f1: 0.5521
 epoch: 53, train_loss: 0.6647, test_loss: 1.1901, test_f1: 0.5139
 epoch: 54, train_loss: 0.6562, test_loss: 1.1480, test_f1: 0.5223
 epoch: 55, train_loss: 0.6483, test_loss: 1.0843, test_f1: 0.5348
 epoch: 56, train_loss: 0.6445, test_loss: 1.0760, test_f1: 0.5480
 epoch: 57, train_loss: 0.6412, test_loss: 1.0605, test_f1: 0.5610
 epoch: 58, train_loss: 0.6321, test_loss: 1.0718, test_f1: 0.5748
 epoch: 59, train_loss: 0.6313, test_loss: 1.0545, test_f1: 0.5947
 epoch: 60, train_loss: 0.6371, test_loss: 1.1156, test_f1: 0.5464
 epoch: 61, train_loss: 0.6327, test_loss: 1.1149, test_f1: 0.5615
 epoch: 62, train_loss: 0.6266, test_loss: 1.1155, test_f1: 0.5713
 epoch: 63, train_loss: 0.6396, test_loss: 1.1343, test_f1: 0.5717
 epoch: 64, train_loss: 0.6325, test_loss: 1.1231, test_f1: 0.5605
 epoch: 65, train_loss: 0.6172, test_loss: 1.1499, test_f1: 0.5727
 epoch: 66, train_loss: 0.6154, test_loss: 1.1209, test_f1: 0.6021
 epoch: 67, train_loss: 0.6173, test_loss: 1.1278, test_f1: 0.6269
 epoch: 68, train_loss: 0.6212, test_loss: 1.1411, test_f1: 0.5819
 epoch: 69, train_loss: 0.6166, test_loss: 1.1585, test_f1: 0.5642
 epoch: 70, train_loss: 0.6291, test_loss: 1.1515, test_f1: 0.5444
 epoch: 71, train_loss: 0.6236, test_loss: 1.0686, test_f1: 0.6033
 epoch: 72, train_loss: 0.6153, test_loss: 1.0842, test_f1: 0.6000
 epoch: 73, train_loss: 0.6192, test_loss: 1.0648, test_f1: 0.5608
 epoch: 74, train_loss: 0.6035, test_loss: 1.1496, test_f1: 0.5454
 epoch: 75, train_loss: 0.6033, test_loss: 1.1304, test_f1: 0.5573
 epoch: 76, train_loss: 0.5944, test_loss: 1.1432, test_f1: 0.5406
 epoch: 77, train_loss: 0.6055, test_loss: 1.1700, test_f1: 0.5740
 epoch: 78, train_loss: 0.6041, test_loss: 1.2208, test_f1: 0.5796
 epoch: 79, train_loss: 0.5977, test_loss: 1.2339, test_f1: 0.5441
 epoch: 80, train_loss: 0.5929, test_loss: 1.2361, test_f1: 0.5354
 epoch: 81, train_loss: 0.5946, test_loss: 1.2487, test_f1: 0.5478
 epoch: 82, train_loss: 0.5965, test_loss: 1.1670, test_f1: 0.5442
 epoch: 83, train_loss: 0.5970, test_loss: 1.1734, test_f1: 0.5774
 epoch: 84, train_loss: 0.5825, test_loss: 1.2390, test_f1: 0.5605
 epoch: 85, train_loss: 0.5900, test_loss: 1.2098, test_f1: 0.5638
 epoch: 86, train_loss: 0.5820, test_loss: 1.2086, test_f1: 0.5709
 epoch: 87, train_loss: 0.5879, test_loss: 1.1924, test_f1: 0.5671
 epoch: 88, train_loss: 0.5845, test_loss: 1.2345, test_f1: 0.5611
 epoch: 89, train_loss: 0.5770, test_loss: 1.3357, test_f1: 0.5365
 epoch: 90, train_loss: 0.5782, test_loss: 1.3025, test_f1: 0.5761
 epoch: 91, train_loss: 0.5724, test_loss: 1.3027, test_f1: 0.5654
 epoch: 92, train_loss: 0.5771, test_loss: 1.3010, test_f1: 0.5655
 epoch: 93, train_loss: 0.5583, test_loss: 1.3257, test_f1: 0.5333
 epoch: 94, train_loss: 0.5633, test_loss: 1.3927, test_f1: 0.5592
 epoch: 95, train_loss: 0.5655, test_loss: 1.3743, test_f1: 0.5746
 epoch: 96, train_loss: 0.5598, test_loss: 1.4454, test_f1: 0.5588
 epoch: 97, train_loss: 0.5591, test_loss: 1.4031, test_f1: 0.5433
 epoch: 98, train_loss: 0.5646, test_loss: 1.4234, test_f1: 0.5461
 epoch: 99, train_loss: 0.5523, test_loss: 1.5271, test_f1: 0.5447
##################ITERATION #4 ****************************************
 epoch: 0, train_loss: 1.2331, test_loss: 1.3081, test_f1: 0.2281
 epoch: 1, train_loss: 1.1220, test_loss: 1.2996, test_f1: 0.2281
 epoch: 2, train_loss: 1.0696, test_loss: 1.3051, test_f1: 0.2248
 epoch: 3, train_loss: 1.0506, test_loss: 1.3317, test_f1: 0.2292
 epoch: 4, train_loss: 1.0215, test_loss: 1.3689, test_f1: 0.2656
 epoch: 5, train_loss: 0.9902, test_loss: 1.4069, test_f1: 0.1438
 epoch: 6, train_loss: 0.9592, test_loss: 1.4710, test_f1: 0.1310
 epoch: 7, train_loss: 0.9471, test_loss: 1.4584, test_f1: 0.1488
 epoch: 8, train_loss: 0.9259, test_loss: 1.2663, test_f1: 0.3832
 epoch: 9, train_loss: 0.8981, test_loss: 1.1299, test_f1: 0.4840
 epoch: 10, train_loss: 0.8752, test_loss: 1.0709, test_f1: 0.5359
 epoch: 11, train_loss: 0.8566, test_loss: 1.0196, test_f1: 0.5713
 epoch: 12, train_loss: 0.8625, test_loss: 1.0576, test_f1: 0.5392
 epoch: 13, train_loss: 0.8473, test_loss: 1.0289, test_f1: 0.5381
 epoch: 14, train_loss: 0.8262, test_loss: 1.0211, test_f1: 0.5715
 epoch: 15, train_loss: 0.8193, test_loss: 1.0099, test_f1: 0.5665
 epoch: 16, train_loss: 0.8078, test_loss: 1.0459, test_f1: 0.5229
 epoch: 17, train_loss: 0.8120, test_loss: 1.0327, test_f1: 0.5143
 epoch: 18, train_loss: 0.7939, test_loss: 1.0443, test_f1: 0.5389
 epoch: 19, train_loss: 0.8007, test_loss: 0.9941, test_f1: 0.5466
 epoch: 20, train_loss: 0.7743, test_loss: 1.0102, test_f1: 0.5648
 epoch: 21, train_loss: 0.7637, test_loss: 1.0404, test_f1: 0.5505
 epoch: 22, train_loss: 0.7592, test_loss: 1.0404, test_f1: 0.5588
 epoch: 23, train_loss: 0.7436, test_loss: 1.0370, test_f1: 0.5870
 epoch: 24, train_loss: 0.7462, test_loss: 1.0575, test_f1: 0.5763
 epoch: 25, train_loss: 0.7431, test_loss: 1.0504, test_f1: 0.5785
 epoch: 26, train_loss: 0.7437, test_loss: 1.0430, test_f1: 0.5667
 epoch: 27, train_loss: 0.7369, test_loss: 1.0592, test_f1: 0.5503
 epoch: 28, train_loss: 0.7230, test_loss: 1.0831, test_f1: 0.5510
 epoch: 29, train_loss: 0.7210, test_loss: 1.0940, test_f1: 0.5859
 epoch: 30, train_loss: 0.7122, test_loss: 1.0825, test_f1: 0.5350
 epoch: 31, train_loss: 0.7149, test_loss: 1.0605, test_f1: 0.5771
 epoch: 32, train_loss: 0.7159, test_loss: 1.0531, test_f1: 0.5810
 epoch: 33, train_loss: 0.7065, test_loss: 1.0585, test_f1: 0.5660
 epoch: 34, train_loss: 0.7068, test_loss: 1.0828, test_f1: 0.5441
 epoch: 35, train_loss: 0.7026, test_loss: 1.1022, test_f1: 0.5735
 epoch: 36, train_loss: 0.7023, test_loss: 1.0166, test_f1: 0.6051
 epoch: 37, train_loss: 0.6939, test_loss: 1.0498, test_f1: 0.5940
 epoch: 38, train_loss: 0.6914, test_loss: 1.0379, test_f1: 0.6091
 epoch: 39, train_loss: 0.6760, test_loss: 1.1096, test_f1: 0.5582
 epoch: 40, train_loss: 0.6881, test_loss: 1.1654, test_f1: 0.5510
 epoch: 41, train_loss: 0.6772, test_loss: 1.1621, test_f1: 0.5494
 epoch: 42, train_loss: 0.6701, test_loss: 1.1623, test_f1: 0.5612
 epoch: 43, train_loss: 0.6673, test_loss: 1.1713, test_f1: 0.6175
 epoch: 44, train_loss: 0.6699, test_loss: 1.1742, test_f1: 0.6082
 epoch: 45, train_loss: 0.6631, test_loss: 1.2616, test_f1: 0.5828
 epoch: 46, train_loss: 0.6564, test_loss: 1.1654, test_f1: 0.5852
 epoch: 47, train_loss: 0.6609, test_loss: 1.1645, test_f1: 0.5698
 epoch: 48, train_loss: 0.6557, test_loss: 1.1795, test_f1: 0.5794
 epoch: 49, train_loss: 0.6553, test_loss: 1.2294, test_f1: 0.5881
 epoch: 50, train_loss: 0.6534, test_loss: 1.2247, test_f1: 0.5880
 epoch: 51, train_loss: 0.6596, test_loss: 1.1816, test_f1: 0.5966
 epoch: 52, train_loss: 0.6427, test_loss: 1.1836, test_f1: 0.5810
 epoch: 53, train_loss: 0.6295, test_loss: 1.1566, test_f1: 0.5778
 epoch: 54, train_loss: 0.6177, test_loss: 1.1406, test_f1: 0.5827
 epoch: 55, train_loss: 0.6258, test_loss: 1.1333, test_f1: 0.5791
 epoch: 56, train_loss: 0.6152, test_loss: 1.1678, test_f1: 0.5867
 epoch: 57, train_loss: 0.6106, test_loss: 1.1696, test_f1: 0.5944
 epoch: 58, train_loss: 0.6121, test_loss: 1.2045, test_f1: 0.5606
 epoch: 59, train_loss: 0.5950, test_loss: 1.2161, test_f1: 0.5420
 epoch: 60, train_loss: 0.5927, test_loss: 1.2268, test_f1: 0.5420
 epoch: 61, train_loss: 0.6115, test_loss: 1.2673, test_f1: 0.5436
 epoch: 62, train_loss: 0.6036, test_loss: 1.2927, test_f1: 0.5373
 epoch: 63, train_loss: 0.6021, test_loss: 1.3499, test_f1: 0.5456
 epoch: 64, train_loss: 0.5972, test_loss: 1.3422, test_f1: 0.5445
 epoch: 65, train_loss: 0.5951, test_loss: 1.2976, test_f1: 0.5458
 epoch: 66, train_loss: 0.5961, test_loss: 1.2965, test_f1: 0.5632
 epoch: 67, train_loss: 0.5910, test_loss: 1.2580, test_f1: 0.5563
 epoch: 68, train_loss: 0.5916, test_loss: 1.2884, test_f1: 0.5546
 epoch: 69, train_loss: 0.5882, test_loss: 1.3378, test_f1: 0.5398
 epoch: 70, train_loss: 0.5837, test_loss: 1.4086, test_f1: 0.5249
 epoch: 71, train_loss: 0.5879, test_loss: 1.3861, test_f1: 0.5487
 epoch: 72, train_loss: 0.5998, test_loss: 1.2883, test_f1: 0.5623
 epoch: 73, train_loss: 0.5881, test_loss: 1.2659, test_f1: 0.6192
 epoch: 74, train_loss: 0.5770, test_loss: 1.2868, test_f1: 0.6065
 epoch: 75, train_loss: 0.5796, test_loss: 1.2787, test_f1: 0.5652
 epoch: 76, train_loss: 0.5746, test_loss: 1.2609, test_f1: 0.5735
 epoch: 77, train_loss: 0.5817, test_loss: 1.3484, test_f1: 0.5605
 epoch: 78, train_loss: 0.5715, test_loss: 1.4113, test_f1: 0.5432
 epoch: 79, train_loss: 0.5814, test_loss: 1.4830, test_f1: 0.5243
 epoch: 80, train_loss: 0.5701, test_loss: 1.3948, test_f1: 0.5491
 epoch: 81, train_loss: 0.5720, test_loss: 1.2789, test_f1: 0.5275
 epoch: 82, train_loss: 0.5721, test_loss: 1.2686, test_f1: 0.5214
 epoch: 83, train_loss: 0.5883, test_loss: 1.2268, test_f1: 0.5574
 epoch: 84, train_loss: 0.5786, test_loss: 1.3527, test_f1: 0.5736
 epoch: 85, train_loss: 0.5734, test_loss: 1.3800, test_f1: 0.5683
 epoch: 86, train_loss: 0.5695, test_loss: 1.4138, test_f1: 0.5491
 epoch: 87, train_loss: 0.5451, test_loss: 1.4476, test_f1: 0.5431
 epoch: 88, train_loss: 0.5772, test_loss: 1.3825, test_f1: 0.5416
 epoch: 89, train_loss: 0.5702, test_loss: 1.4019, test_f1: 0.5165
 epoch: 90, train_loss: 0.5517, test_loss: 1.3605, test_f1: 0.5088
 epoch: 91, train_loss: 0.5618, test_loss: 1.3323, test_f1: 0.5407
 epoch: 92, train_loss: 0.5766, test_loss: 1.2845, test_f1: 0.5528
 epoch: 93, train_loss: 0.5527, test_loss: 1.3924, test_f1: 0.5868
 epoch: 94, train_loss: 0.5611, test_loss: 1.4015, test_f1: 0.5770
 epoch: 95, train_loss: 0.5471, test_loss: 1.4328, test_f1: 0.5366
 epoch: 96, train_loss: 0.5485, test_loss: 1.3771, test_f1: 0.5247
 epoch: 97, train_loss: 0.5587, test_loss: 1.4093, test_f1: 0.5279
 epoch: 98, train_loss: 0.5505, test_loss: 1.5083, test_f1: 0.5119
 epoch: 99, train_loss: 0.5566, test_loss: 1.4489, test_f1: 0.5128
##################ITERATION #5 ****************************************
 epoch: 0, train_loss: 1.2721, test_loss: 1.3269, test_f1: 0.2281
 epoch: 1, train_loss: 1.1503, test_loss: 1.3176, test_f1: 0.2281
 epoch: 2, train_loss: 1.0911, test_loss: 1.2950, test_f1: 0.2281
 epoch: 3, train_loss: 1.0592, test_loss: 1.2769, test_f1: 0.2281
 epoch: 4, train_loss: 1.0320, test_loss: 1.2393, test_f1: 0.2289
 epoch: 5, train_loss: 1.0025, test_loss: 1.1859, test_f1: 0.3546
 epoch: 6, train_loss: 0.9960, test_loss: 1.1130, test_f1: 0.4584
 epoch: 7, train_loss: 0.9700, test_loss: 1.0748, test_f1: 0.5134
 epoch: 8, train_loss: 0.9380, test_loss: 1.0519, test_f1: 0.5299
 epoch: 9, train_loss: 0.9269, test_loss: 1.0588, test_f1: 0.5308
 epoch: 10, train_loss: 0.9224, test_loss: 1.0338, test_f1: 0.5517
 epoch: 11, train_loss: 0.9003, test_loss: 1.0208, test_f1: 0.5535
 epoch: 12, train_loss: 0.8864, test_loss: 1.0530, test_f1: 0.5148
 epoch: 13, train_loss: 0.8876, test_loss: 1.0254, test_f1: 0.5320
 epoch: 14, train_loss: 0.8725, test_loss: 1.0750, test_f1: 0.4742
 epoch: 15, train_loss: 0.8523, test_loss: 1.0110, test_f1: 0.5251
 epoch: 16, train_loss: 0.8372, test_loss: 1.0491, test_f1: 0.5196
 epoch: 17, train_loss: 0.8494, test_loss: 1.0773, test_f1: 0.5324
 epoch: 18, train_loss: 0.8164, test_loss: 1.0304, test_f1: 0.5548
 epoch: 19, train_loss: 0.8280, test_loss: 1.0202, test_f1: 0.5431
 epoch: 20, train_loss: 0.8236, test_loss: 0.9946, test_f1: 0.5453
 epoch: 21, train_loss: 0.8197, test_loss: 1.0147, test_f1: 0.5271
 epoch: 22, train_loss: 0.8026, test_loss: 1.0285, test_f1: 0.4997
 epoch: 23, train_loss: 0.7862, test_loss: 1.2025, test_f1: 0.4310
 epoch: 24, train_loss: 0.7656, test_loss: 1.0998, test_f1: 0.5396
 epoch: 25, train_loss: 0.7644, test_loss: 1.1327, test_f1: 0.5602
 epoch: 26, train_loss: 0.7549, test_loss: 1.1017, test_f1: 0.5463
 epoch: 27, train_loss: 0.7493, test_loss: 1.0742, test_f1: 0.5572
 epoch: 28, train_loss: 0.7374, test_loss: 0.9705, test_f1: 0.5810
 epoch: 29, train_loss: 0.7416, test_loss: 1.0075, test_f1: 0.5831
 epoch: 30, train_loss: 0.7360, test_loss: 1.1676, test_f1: 0.5147
 epoch: 31, train_loss: 0.7493, test_loss: 1.0780, test_f1: 0.5826
 epoch: 32, train_loss: 0.7256, test_loss: 1.1042, test_f1: 0.5803
 epoch: 33, train_loss: 0.6981, test_loss: 1.1202, test_f1: 0.5753
 epoch: 34, train_loss: 0.7097, test_loss: 1.2439, test_f1: 0.5572
 epoch: 35, train_loss: 0.7158, test_loss: 1.1246, test_f1: 0.6089
 epoch: 36, train_loss: 0.7324, test_loss: 1.1370, test_f1: 0.5759
 epoch: 37, train_loss: 0.7301, test_loss: 1.1746, test_f1: 0.5397
 epoch: 38, train_loss: 0.7134, test_loss: 1.1564, test_f1: 0.5774
 epoch: 39, train_loss: 0.7123, test_loss: 1.0580, test_f1: 0.5886
 epoch: 40, train_loss: 0.6933, test_loss: 1.0505, test_f1: 0.6092
 epoch: 41, train_loss: 0.7031, test_loss: 1.1167, test_f1: 0.6118
 epoch: 42, train_loss: 0.6825, test_loss: 1.0922, test_f1: 0.5777
 epoch: 43, train_loss: 0.6909, test_loss: 1.1849, test_f1: 0.5221
 epoch: 44, train_loss: 0.6895, test_loss: 1.1553, test_f1: 0.5498
 epoch: 45, train_loss: 0.6796, test_loss: 1.1144, test_f1: 0.5580
 epoch: 46, train_loss: 0.6911, test_loss: 0.9975, test_f1: 0.6281
 epoch: 47, train_loss: 0.6726, test_loss: 1.0337, test_f1: 0.5841
 epoch: 48, train_loss: 0.6536, test_loss: 1.0961, test_f1: 0.5750
 epoch: 49, train_loss: 0.6606, test_loss: 1.1238, test_f1: 0.6004
 epoch: 50, train_loss: 0.6481, test_loss: 1.2186, test_f1: 0.5875
 epoch: 51, train_loss: 0.6528, test_loss: 1.2377, test_f1: 0.5790
 epoch: 52, train_loss: 0.6373, test_loss: 1.2194, test_f1: 0.5728
 epoch: 53, train_loss: 0.6284, test_loss: 1.1761, test_f1: 0.6002
 epoch: 54, train_loss: 0.6327, test_loss: 1.1405, test_f1: 0.5926
 epoch: 55, train_loss: 0.6227, test_loss: 1.0785, test_f1: 0.5856
 epoch: 56, train_loss: 0.6200, test_loss: 1.1146, test_f1: 0.5777
 epoch: 57, train_loss: 0.6323, test_loss: 1.1118, test_f1: 0.5835
 epoch: 58, train_loss: 0.6463, test_loss: 1.0988, test_f1: 0.5578
 epoch: 59, train_loss: 0.6484, test_loss: 1.2179, test_f1: 0.5939
 epoch: 60, train_loss: 0.6618, test_loss: 1.2146, test_f1: 0.5848
 epoch: 61, train_loss: 0.6507, test_loss: 1.1898, test_f1: 0.5847
 epoch: 62, train_loss: 0.6413, test_loss: 1.1546, test_f1: 0.6122
 epoch: 63, train_loss: 0.6285, test_loss: 1.0982, test_f1: 0.6086
 epoch: 64, train_loss: 0.6249, test_loss: 1.1896, test_f1: 0.5905
 epoch: 65, train_loss: 0.6327, test_loss: 1.3177, test_f1: 0.5842
 epoch: 66, train_loss: 0.6317, test_loss: 1.1738, test_f1: 0.5872
 epoch: 67, train_loss: 0.6284, test_loss: 1.1305, test_f1: 0.5890
 epoch: 68, train_loss: 0.6173, test_loss: 1.1877, test_f1: 0.5836
 epoch: 69, train_loss: 0.6198, test_loss: 1.1132, test_f1: 0.5780
 epoch: 70, train_loss: 0.6190, test_loss: 1.1326, test_f1: 0.5885
 epoch: 71, train_loss: 0.6180, test_loss: 1.1746, test_f1: 0.5854
 epoch: 72, train_loss: 0.6257, test_loss: 1.1165, test_f1: 0.5646
 epoch: 73, train_loss: 0.6304, test_loss: 1.0789, test_f1: 0.6128
 epoch: 74, train_loss: 0.6499, test_loss: 1.0912, test_f1: 0.5685
 epoch: 75, train_loss: 0.6131, test_loss: 1.1859, test_f1: 0.6003
 epoch: 76, train_loss: 0.6271, test_loss: 1.1665, test_f1: 0.6159
 epoch: 77, train_loss: 0.6136, test_loss: 1.1834, test_f1: 0.5921
 epoch: 78, train_loss: 0.6264, test_loss: 1.1259, test_f1: 0.5791
 epoch: 79, train_loss: 0.5937, test_loss: 1.1036, test_f1: 0.6047
 epoch: 80, train_loss: 0.5870, test_loss: 1.1406, test_f1: 0.5723
 epoch: 81, train_loss: 0.5873, test_loss: 1.1589, test_f1: 0.5788
 epoch: 82, train_loss: 0.5894, test_loss: 1.1881, test_f1: 0.5899
 epoch: 83, train_loss: 0.5907, test_loss: 1.1487, test_f1: 0.5994
 epoch: 84, train_loss: 0.5998, test_loss: 1.1261, test_f1: 0.5830
 epoch: 85, train_loss: 0.5893, test_loss: 1.1788, test_f1: 0.5813
 epoch: 86, train_loss: 0.5919, test_loss: 1.1853, test_f1: 0.5998
 epoch: 87, train_loss: 0.5829, test_loss: 1.1693, test_f1: 0.6056
 epoch: 88, train_loss: 0.5750, test_loss: 1.2317, test_f1: 0.5830
 epoch: 89, train_loss: 0.5825, test_loss: 1.2115, test_f1: 0.5678
 epoch: 90, train_loss: 0.5731, test_loss: 1.2013, test_f1: 0.5797
 epoch: 91, train_loss: 0.5977, test_loss: 1.1725, test_f1: 0.5593
 epoch: 92, train_loss: 0.5880, test_loss: 1.3077, test_f1: 0.5472
 epoch: 93, train_loss: 0.5970, test_loss: 1.3002, test_f1: 0.5418
 epoch: 94, train_loss: 0.5886, test_loss: 1.2162, test_f1: 0.5670
 epoch: 95, train_loss: 0.5832, test_loss: 1.2685, test_f1: 0.5862
 epoch: 96, train_loss: 0.5776, test_loss: 1.3043, test_f1: 0.5846
 epoch: 97, train_loss: 0.6002, test_loss: 1.3011, test_f1: 0.5940
 epoch: 98, train_loss: 0.5898, test_loss: 1.1732, test_f1: 0.5577
 epoch: 99, train_loss: 0.5762, test_loss: 1.1971, test_f1: 0.5357
##################ITERATION #6 ****************************************
 epoch: 0, train_loss: 1.2603, test_loss: 1.4688, test_f1: 0.3051
 epoch: 1, train_loss: 1.1020, test_loss: 1.4403, test_f1: 0.3048
 epoch: 2, train_loss: 1.0670, test_loss: 1.3656, test_f1: 0.3051
 epoch: 3, train_loss: 1.0411, test_loss: 1.3003, test_f1: 0.2744
 epoch: 4, train_loss: 1.0290, test_loss: 1.2719, test_f1: 0.3289
 epoch: 5, train_loss: 1.0100, test_loss: 1.2944, test_f1: 0.3402
 epoch: 6, train_loss: 1.0015, test_loss: 1.2523, test_f1: 0.3406
 epoch: 7, train_loss: 0.9801, test_loss: 1.1547, test_f1: 0.3836
 epoch: 8, train_loss: 0.9577, test_loss: 1.0957, test_f1: 0.3971
 epoch: 9, train_loss: 0.9524, test_loss: 1.0459, test_f1: 0.4443
 epoch: 10, train_loss: 0.9462, test_loss: 1.0154, test_f1: 0.5039
 epoch: 11, train_loss: 0.9318, test_loss: 1.0090, test_f1: 0.5042
 epoch: 12, train_loss: 0.9037, test_loss: 0.9933, test_f1: 0.5284
 epoch: 13, train_loss: 0.9074, test_loss: 0.9843, test_f1: 0.5333
 epoch: 14, train_loss: 0.9052, test_loss: 0.9994, test_f1: 0.5507
 epoch: 15, train_loss: 0.8870, test_loss: 0.9693, test_f1: 0.5478
 epoch: 16, train_loss: 0.8701, test_loss: 1.0826, test_f1: 0.5517
 epoch: 17, train_loss: 0.8684, test_loss: 0.9939, test_f1: 0.5409
 epoch: 18, train_loss: 0.8456, test_loss: 1.1283, test_f1: 0.5674
 epoch: 19, train_loss: 0.8751, test_loss: 1.1188, test_f1: 0.5532
 epoch: 20, train_loss: 0.8308, test_loss: 0.9577, test_f1: 0.5708
 epoch: 21, train_loss: 0.8306, test_loss: 1.1818, test_f1: 0.5485
 epoch: 22, train_loss: 0.8060, test_loss: 1.2879, test_f1: 0.5612
 epoch: 23, train_loss: 0.7926, test_loss: 1.0370, test_f1: 0.5818
 epoch: 24, train_loss: 0.7896, test_loss: 1.0126, test_f1: 0.6067
 epoch: 25, train_loss: 0.7883, test_loss: 1.0635, test_f1: 0.5673
 epoch: 26, train_loss: 0.7810, test_loss: 1.0318, test_f1: 0.5472
 epoch: 27, train_loss: 0.7772, test_loss: 1.1022, test_f1: 0.6004
 epoch: 28, train_loss: 0.7709, test_loss: 0.9468, test_f1: 0.5913
 epoch: 29, train_loss: 0.7753, test_loss: 0.9362, test_f1: 0.5563
 epoch: 30, train_loss: 0.7811, test_loss: 0.9075, test_f1: 0.5698
 epoch: 31, train_loss: 0.7460, test_loss: 0.9302, test_f1: 0.6082
 epoch: 32, train_loss: 0.7370, test_loss: 0.9501, test_f1: 0.5791
 epoch: 33, train_loss: 0.7240, test_loss: 0.9506, test_f1: 0.6277
 epoch: 34, train_loss: 0.7273, test_loss: 0.9965, test_f1: 0.5910
 epoch: 35, train_loss: 0.7276, test_loss: 1.0096, test_f1: 0.5862
 epoch: 36, train_loss: 0.7254, test_loss: 1.0331, test_f1: 0.5684
 epoch: 37, train_loss: 0.7189, test_loss: 1.0225, test_f1: 0.5873
 epoch: 38, train_loss: 0.7319, test_loss: 1.0338, test_f1: 0.5753
 epoch: 39, train_loss: 0.7342, test_loss: 1.0165, test_f1: 0.5830
 epoch: 40, train_loss: 0.7267, test_loss: 0.9631, test_f1: 0.5986
 epoch: 41, train_loss: 0.6986, test_loss: 1.0729, test_f1: 0.5957
 epoch: 42, train_loss: 0.7049, test_loss: 0.9655, test_f1: 0.6260
 epoch: 43, train_loss: 0.6965, test_loss: 0.9978, test_f1: 0.6162
 epoch: 44, train_loss: 0.6875, test_loss: 1.0351, test_f1: 0.5971
 epoch: 45, train_loss: 0.7060, test_loss: 1.2558, test_f1: 0.5476
 epoch: 46, train_loss: 0.7008, test_loss: 1.0657, test_f1: 0.5831
 epoch: 47, train_loss: 0.7140, test_loss: 0.9961, test_f1: 0.5753
 epoch: 48, train_loss: 0.7020, test_loss: 1.0388, test_f1: 0.5573
 epoch: 49, train_loss: 0.6785, test_loss: 1.0604, test_f1: 0.5510
 epoch: 50, train_loss: 0.6940, test_loss: 0.9528, test_f1: 0.5984
 epoch: 51, train_loss: 0.6745, test_loss: 0.9549, test_f1: 0.6034
 epoch: 52, train_loss: 0.6569, test_loss: 0.9777, test_f1: 0.5766
 epoch: 53, train_loss: 0.6526, test_loss: 0.9344, test_f1: 0.5988
 epoch: 54, train_loss: 0.6494, test_loss: 0.9694, test_f1: 0.5873
 epoch: 55, train_loss: 0.6451, test_loss: 1.0091, test_f1: 0.5802
 epoch: 56, train_loss: 0.6440, test_loss: 0.9962, test_f1: 0.5639
 epoch: 57, train_loss: 0.6430, test_loss: 1.0059, test_f1: 0.5831
 epoch: 58, train_loss: 0.6468, test_loss: 0.9913, test_f1: 0.5985
 epoch: 59, train_loss: 0.6447, test_loss: 1.0081, test_f1: 0.5568
 epoch: 60, train_loss: 0.6576, test_loss: 1.0011, test_f1: 0.5909
 epoch: 61, train_loss: 0.6532, test_loss: 1.0138, test_f1: 0.5823
 epoch: 62, train_loss: 0.6382, test_loss: 1.0305, test_f1: 0.5804
 epoch: 63, train_loss: 0.6422, test_loss: 1.0228, test_f1: 0.5860
 epoch: 64, train_loss: 0.6257, test_loss: 0.9798, test_f1: 0.6204
 epoch: 65, train_loss: 0.6303, test_loss: 0.9767, test_f1: 0.6242
 epoch: 66, train_loss: 0.6220, test_loss: 1.0019, test_f1: 0.6090
 epoch: 67, train_loss: 0.6167, test_loss: 0.9822, test_f1: 0.6224
 epoch: 68, train_loss: 0.6287, test_loss: 1.0021, test_f1: 0.6037
 epoch: 69, train_loss: 0.6231, test_loss: 1.0123, test_f1: 0.5711
 epoch: 70, train_loss: 0.6190, test_loss: 1.0309, test_f1: 0.5559
 epoch: 71, train_loss: 0.6180, test_loss: 1.0365, test_f1: 0.5611
 epoch: 72, train_loss: 0.6054, test_loss: 1.0448, test_f1: 0.5624
 epoch: 73, train_loss: 0.6087, test_loss: 1.0431, test_f1: 0.5670
 epoch: 74, train_loss: 0.6045, test_loss: 1.0741, test_f1: 0.5486
 epoch: 75, train_loss: 0.6036, test_loss: 1.0776, test_f1: 0.5638
 epoch: 76, train_loss: 0.5901, test_loss: 1.0482, test_f1: 0.5722
 epoch: 77, train_loss: 0.5882, test_loss: 1.0397, test_f1: 0.5588
 epoch: 78, train_loss: 0.5939, test_loss: 1.0994, test_f1: 0.5703
 epoch: 79, train_loss: 0.6041, test_loss: 1.0722, test_f1: 0.5772
 epoch: 80, train_loss: 0.5954, test_loss: 1.0285, test_f1: 0.5976
 epoch: 81, train_loss: 0.6031, test_loss: 1.0977, test_f1: 0.5912
 epoch: 82, train_loss: 0.5947, test_loss: 1.1731, test_f1: 0.5954
 epoch: 83, train_loss: 0.6063, test_loss: 1.1686, test_f1: 0.5290
 epoch: 84, train_loss: 0.6032, test_loss: 1.1034, test_f1: 0.5544
 epoch: 85, train_loss: 0.6007, test_loss: 1.1320, test_f1: 0.5559
 epoch: 86, train_loss: 0.5773, test_loss: 1.1585, test_f1: 0.5984
 epoch: 87, train_loss: 0.6043, test_loss: 1.1166, test_f1: 0.5781
 epoch: 88, train_loss: 0.5875, test_loss: 1.0941, test_f1: 0.5781
 epoch: 89, train_loss: 0.5861, test_loss: 1.1197, test_f1: 0.5545
 epoch: 90, train_loss: 0.6113, test_loss: 1.1194, test_f1: 0.5459
 epoch: 91, train_loss: 0.5950, test_loss: 1.0265, test_f1: 0.5580
 epoch: 92, train_loss: 0.5964, test_loss: 0.9894, test_f1: 0.6114
 epoch: 93, train_loss: 0.5703, test_loss: 1.0474, test_f1: 0.5776
 epoch: 94, train_loss: 0.5757, test_loss: 1.0513, test_f1: 0.5734
 epoch: 95, train_loss: 0.5652, test_loss: 1.0741, test_f1: 0.5670
 epoch: 96, train_loss: 0.5802, test_loss: 1.1315, test_f1: 0.5332
 epoch: 97, train_loss: 0.5823, test_loss: 1.1237, test_f1: 0.5750
 epoch: 98, train_loss: 0.5954, test_loss: 1.0235, test_f1: 0.5920
 epoch: 99, train_loss: 0.5791, test_loss: 1.1085, test_f1: 0.5684
##################ITERATION #7 ****************************************
 epoch: 0, train_loss: 1.2941, test_loss: 1.3569, test_f1: 0.2281
 epoch: 1, train_loss: 1.1777, test_loss: 1.3400, test_f1: 0.2281
 epoch: 2, train_loss: 1.1311, test_loss: 1.3253, test_f1: 0.2281
 epoch: 3, train_loss: 1.1234, test_loss: 1.3041, test_f1: 0.2465
 epoch: 4, train_loss: 1.0768, test_loss: 1.2911, test_f1: 0.2900
 epoch: 5, train_loss: 1.0540, test_loss: 1.2623, test_f1: 0.2943
 epoch: 6, train_loss: 1.0330, test_loss: 1.2431, test_f1: 0.3138
 epoch: 7, train_loss: 1.0156, test_loss: 1.1787, test_f1: 0.3853
 epoch: 8, train_loss: 1.0106, test_loss: 1.1139, test_f1: 0.5017
 epoch: 9, train_loss: 0.9938, test_loss: 1.0602, test_f1: 0.5254
 epoch: 10, train_loss: 0.9948, test_loss: 1.0362, test_f1: 0.5355
 epoch: 11, train_loss: 0.9523, test_loss: 1.0489, test_f1: 0.5208
 epoch: 12, train_loss: 0.9432, test_loss: 1.0390, test_f1: 0.5265
 epoch: 13, train_loss: 0.9221, test_loss: 1.0481, test_f1: 0.5247
 epoch: 14, train_loss: 0.9139, test_loss: 1.0592, test_f1: 0.4748
 epoch: 15, train_loss: 0.9189, test_loss: 1.0242, test_f1: 0.5196
 epoch: 16, train_loss: 0.8849, test_loss: 0.9917, test_f1: 0.5569
 epoch: 17, train_loss: 0.8786, test_loss: 0.9933, test_f1: 0.5698
 epoch: 18, train_loss: 0.8634, test_loss: 0.9915, test_f1: 0.5873
 epoch: 19, train_loss: 0.8462, test_loss: 0.9776, test_f1: 0.5751
 epoch: 20, train_loss: 0.8278, test_loss: 0.9858, test_f1: 0.5593
 epoch: 21, train_loss: 0.8220, test_loss: 0.9873, test_f1: 0.5704
 epoch: 22, train_loss: 0.8018, test_loss: 0.9900, test_f1: 0.5529
 epoch: 23, train_loss: 0.7896, test_loss: 0.9888, test_f1: 0.5603
 epoch: 24, train_loss: 0.7880, test_loss: 0.9843, test_f1: 0.5340
 epoch: 25, train_loss: 0.7784, test_loss: 1.0817, test_f1: 0.5053
 epoch: 26, train_loss: 0.7920, test_loss: 1.0211, test_f1: 0.5007
 epoch: 27, train_loss: 0.7782, test_loss: 1.1774, test_f1: 0.5213
 epoch: 28, train_loss: 0.7946, test_loss: 1.1037, test_f1: 0.5179
 epoch: 29, train_loss: 0.7731, test_loss: 1.0594, test_f1: 0.5458
 epoch: 30, train_loss: 0.7721, test_loss: 1.0426, test_f1: 0.5549
 epoch: 31, train_loss: 0.7351, test_loss: 1.0146, test_f1: 0.5351
 epoch: 32, train_loss: 0.7529, test_loss: 1.0483, test_f1: 0.5268
 epoch: 33, train_loss: 0.7475, test_loss: 1.0166, test_f1: 0.5748
 epoch: 34, train_loss: 0.7601, test_loss: 1.0850, test_f1: 0.5912
 epoch: 35, train_loss: 0.7444, test_loss: 1.1227, test_f1: 0.5218
 epoch: 36, train_loss: 0.7463, test_loss: 1.1488, test_f1: 0.5152
 epoch: 37, train_loss: 0.7608, test_loss: 1.2359, test_f1: 0.4926
 epoch: 38, train_loss: 0.7485, test_loss: 1.0909, test_f1: 0.5331
 epoch: 39, train_loss: 0.7459, test_loss: 1.0415, test_f1: 0.5709
 epoch: 40, train_loss: 0.7460, test_loss: 1.1103, test_f1: 0.5785
 epoch: 41, train_loss: 0.7403, test_loss: 1.1992, test_f1: 0.5600
 epoch: 42, train_loss: 0.7278, test_loss: 1.0343, test_f1: 0.5989
 epoch: 43, train_loss: 0.7167, test_loss: 1.0806, test_f1: 0.5748
 epoch: 44, train_loss: 0.7235, test_loss: 1.1004, test_f1: 0.5918
 epoch: 45, train_loss: 0.7253, test_loss: 1.1902, test_f1: 0.5446
 epoch: 46, train_loss: 0.6997, test_loss: 1.2105, test_f1: 0.5789
 epoch: 47, train_loss: 0.7051, test_loss: 1.2226, test_f1: 0.5707
 epoch: 48, train_loss: 0.7126, test_loss: 1.1319, test_f1: 0.5952
 epoch: 49, train_loss: 0.7050, test_loss: 1.1779, test_f1: 0.6065
 epoch: 50, train_loss: 0.6803, test_loss: 1.3612, test_f1: 0.5913
 epoch: 51, train_loss: 0.6666, test_loss: 1.3664, test_f1: 0.5726
 epoch: 52, train_loss: 0.6653, test_loss: 1.1838, test_f1: 0.5879
 epoch: 53, train_loss: 0.6555, test_loss: 1.1281, test_f1: 0.5893
 epoch: 54, train_loss: 0.6549, test_loss: 1.0947, test_f1: 0.5924
 epoch: 55, train_loss: 0.6580, test_loss: 1.1131, test_f1: 0.6044
 epoch: 56, train_loss: 0.6623, test_loss: 1.1636, test_f1: 0.5926
 epoch: 57, train_loss: 0.6506, test_loss: 1.2422, test_f1: 0.5636
 epoch: 58, train_loss: 0.6390, test_loss: 1.2028, test_f1: 0.5816
 epoch: 59, train_loss: 0.6379, test_loss: 1.1986, test_f1: 0.5772
 epoch: 60, train_loss: 0.6460, test_loss: 1.1559, test_f1: 0.5825
 epoch: 61, train_loss: 0.6354, test_loss: 1.2178, test_f1: 0.5777
 epoch: 62, train_loss: 0.6504, test_loss: 1.2107, test_f1: 0.5953
 epoch: 63, train_loss: 0.6345, test_loss: 1.2235, test_f1: 0.5533
 epoch: 64, train_loss: 0.6298, test_loss: 1.2373, test_f1: 0.5600
 epoch: 65, train_loss: 0.6366, test_loss: 1.1449, test_f1: 0.5960
 epoch: 66, train_loss: 0.6448, test_loss: 1.1933, test_f1: 0.5857
 epoch: 67, train_loss: 0.6234, test_loss: 1.2523, test_f1: 0.6015
 epoch: 68, train_loss: 0.6288, test_loss: 1.2832, test_f1: 0.5862
 epoch: 69, train_loss: 0.6250, test_loss: 1.2839, test_f1: 0.5577
 epoch: 70, train_loss: 0.6148, test_loss: 1.1613, test_f1: 0.5841
 epoch: 71, train_loss: 0.6323, test_loss: 1.2336, test_f1: 0.5984
 epoch: 72, train_loss: 0.6204, test_loss: 1.3672, test_f1: 0.5664
 epoch: 73, train_loss: 0.6248, test_loss: 1.3097, test_f1: 0.5552
 epoch: 74, train_loss: 0.6164, test_loss: 1.5811, test_f1: 0.5389
 epoch: 75, train_loss: 0.6236, test_loss: 1.3861, test_f1: 0.5347
 epoch: 76, train_loss: 0.6211, test_loss: 1.2453, test_f1: 0.5690
 epoch: 77, train_loss: 0.6244, test_loss: 1.2225, test_f1: 0.5665
 epoch: 78, train_loss: 0.6176, test_loss: 1.2421, test_f1: 0.5666
 epoch: 79, train_loss: 0.6187, test_loss: 1.2252, test_f1: 0.5604
 epoch: 80, train_loss: 0.6182, test_loss: 1.2285, test_f1: 0.5646
 epoch: 81, train_loss: 0.6052, test_loss: 1.1838, test_f1: 0.6025
 epoch: 82, train_loss: 0.6238, test_loss: 1.2032, test_f1: 0.6092
 epoch: 83, train_loss: 0.6167, test_loss: 1.1729, test_f1: 0.5999
 epoch: 84, train_loss: 0.6152, test_loss: 1.2141, test_f1: 0.6029
 epoch: 85, train_loss: 0.6156, test_loss: 1.3849, test_f1: 0.5633
 epoch: 86, train_loss: 0.5931, test_loss: 1.5261, test_f1: 0.5637
 epoch: 87, train_loss: 0.5963, test_loss: 1.4508, test_f1: 0.5774
 epoch: 88, train_loss: 0.5982, test_loss: 1.2666, test_f1: 0.5816
 epoch: 89, train_loss: 0.6066, test_loss: 1.2385, test_f1: 0.5685
 epoch: 90, train_loss: 0.5950, test_loss: 1.2249, test_f1: 0.5802
 epoch: 91, train_loss: 0.5859, test_loss: 1.2255, test_f1: 0.5681
 epoch: 92, train_loss: 0.5961, test_loss: 1.2813, test_f1: 0.6013
 epoch: 93, train_loss: 0.6184, test_loss: 1.2164, test_f1: 0.6146
 epoch: 94, train_loss: 0.5979, test_loss: 1.2514, test_f1: 0.5894
 epoch: 95, train_loss: 0.5920, test_loss: 1.2938, test_f1: 0.6105
 epoch: 96, train_loss: 0.5833, test_loss: 1.6597, test_f1: 0.5933
 epoch: 97, train_loss: 0.5869, test_loss: 1.4975, test_f1: 0.5938
 epoch: 98, train_loss: 0.6033, test_loss: 1.3748, test_f1: 0.5624
 epoch: 99, train_loss: 0.5900, test_loss: 1.2316, test_f1: 0.6148
##################ITERATION #8 ****************************************
 epoch: 0, train_loss: 1.4210, test_loss: 1.4175, test_f1: 0.3102
 epoch: 1, train_loss: 1.1860, test_loss: 1.3818, test_f1: 0.3365
 epoch: 2, train_loss: 1.1260, test_loss: 1.3696, test_f1: 0.3378
 epoch: 3, train_loss: 1.0966, test_loss: 1.3687, test_f1: 0.3258
 epoch: 4, train_loss: 1.0719, test_loss: 1.3831, test_f1: 0.2679
 epoch: 5, train_loss: 1.0256, test_loss: 1.3662, test_f1: 0.1576
 epoch: 6, train_loss: 1.0199, test_loss: 1.3044, test_f1: 0.2190
 epoch: 7, train_loss: 0.9899, test_loss: 1.2332, test_f1: 0.3451
 epoch: 8, train_loss: 0.9584, test_loss: 1.1536, test_f1: 0.5144
 epoch: 9, train_loss: 0.9443, test_loss: 1.1120, test_f1: 0.5397
 epoch: 10, train_loss: 0.9378, test_loss: 1.0612, test_f1: 0.5426
 epoch: 11, train_loss: 0.9133, test_loss: 1.0410, test_f1: 0.5264
 epoch: 12, train_loss: 0.8994, test_loss: 1.0301, test_f1: 0.5538
 epoch: 13, train_loss: 0.8874, test_loss: 1.0372, test_f1: 0.5498
 epoch: 14, train_loss: 0.8774, test_loss: 1.0071, test_f1: 0.5779
 epoch: 15, train_loss: 0.8712, test_loss: 1.0043, test_f1: 0.5901
 epoch: 16, train_loss: 0.8657, test_loss: 1.0064, test_f1: 0.5646
 epoch: 17, train_loss: 0.8644, test_loss: 1.0196, test_f1: 0.5609
 epoch: 18, train_loss: 0.8282, test_loss: 1.0148, test_f1: 0.5610
 epoch: 19, train_loss: 0.8434, test_loss: 1.0053, test_f1: 0.5556
 epoch: 20, train_loss: 0.8165, test_loss: 1.0087, test_f1: 0.5543
 epoch: 21, train_loss: 0.8087, test_loss: 1.0032, test_f1: 0.5660
 epoch: 22, train_loss: 0.8017, test_loss: 0.9925, test_f1: 0.5567
 epoch: 23, train_loss: 0.7877, test_loss: 1.0029, test_f1: 0.5466
 epoch: 24, train_loss: 0.7980, test_loss: 1.0114, test_f1: 0.5448
 epoch: 25, train_loss: 0.7688, test_loss: 1.0211, test_f1: 0.5368
 epoch: 26, train_loss: 0.7812, test_loss: 1.0402, test_f1: 0.5261
 epoch: 27, train_loss: 0.7630, test_loss: 1.0078, test_f1: 0.5667
 epoch: 28, train_loss: 0.7604, test_loss: 1.0766, test_f1: 0.5440
 epoch: 29, train_loss: 0.7516, test_loss: 1.0856, test_f1: 0.5369
 epoch: 30, train_loss: 0.7445, test_loss: 1.0769, test_f1: 0.5284
 epoch: 31, train_loss: 0.7445, test_loss: 0.9869, test_f1: 0.5690
 epoch: 32, train_loss: 0.7439, test_loss: 1.0318, test_f1: 0.5359
 epoch: 33, train_loss: 0.7248, test_loss: 1.0252, test_f1: 0.5426
 epoch: 34, train_loss: 0.7186, test_loss: 1.0021, test_f1: 0.5754
 epoch: 35, train_loss: 0.7084, test_loss: 1.0164, test_f1: 0.5558
 epoch: 36, train_loss: 0.7132, test_loss: 1.0619, test_f1: 0.5507
 epoch: 37, train_loss: 0.7005, test_loss: 1.0075, test_f1: 0.5630
 epoch: 38, train_loss: 0.6926, test_loss: 0.9664, test_f1: 0.5930
 epoch: 39, train_loss: 0.6954, test_loss: 1.0269, test_f1: 0.5840
 epoch: 40, train_loss: 0.7009, test_loss: 1.0385, test_f1: 0.5788
 epoch: 41, train_loss: 0.6862, test_loss: 1.0571, test_f1: 0.5856
 epoch: 42, train_loss: 0.6661, test_loss: 0.9987, test_f1: 0.5729
 epoch: 43, train_loss: 0.6934, test_loss: 0.9689, test_f1: 0.5729
 epoch: 44, train_loss: 0.6673, test_loss: 1.0280, test_f1: 0.5711
 epoch: 45, train_loss: 0.6663, test_loss: 1.0064, test_f1: 0.5937
 epoch: 46, train_loss: 0.6739, test_loss: 1.0420, test_f1: 0.5776
 epoch: 47, train_loss: 0.6640, test_loss: 1.1165, test_f1: 0.5437
 epoch: 48, train_loss: 0.6659, test_loss: 1.0671, test_f1: 0.5314
 epoch: 49, train_loss: 0.6802, test_loss: 1.0553, test_f1: 0.5518
 epoch: 50, train_loss: 0.6686, test_loss: 1.0936, test_f1: 0.5770
 epoch: 51, train_loss: 0.6539, test_loss: 1.1034, test_f1: 0.5467
 epoch: 52, train_loss: 0.6385, test_loss: 1.0373, test_f1: 0.5679
 epoch: 53, train_loss: 0.6360, test_loss: 1.0077, test_f1: 0.5851
 epoch: 54, train_loss: 0.6409, test_loss: 1.0400, test_f1: 0.5856
 epoch: 55, train_loss: 0.6335, test_loss: 1.0833, test_f1: 0.5590
 epoch: 56, train_loss: 0.6188, test_loss: 1.0699, test_f1: 0.5573
 epoch: 57, train_loss: 0.6329, test_loss: 1.0285, test_f1: 0.5654
 epoch: 58, train_loss: 0.6266, test_loss: 1.0333, test_f1: 0.5612
 epoch: 59, train_loss: 0.6212, test_loss: 1.1197, test_f1: 0.5429
 epoch: 60, train_loss: 0.6288, test_loss: 1.1249, test_f1: 0.5413
 epoch: 61, train_loss: 0.6211, test_loss: 1.0718, test_f1: 0.5631
 epoch: 62, train_loss: 0.6145, test_loss: 1.0630, test_f1: 0.5698
 epoch: 63, train_loss: 0.6149, test_loss: 1.0983, test_f1: 0.5477
 epoch: 64, train_loss: 0.6099, test_loss: 1.1311, test_f1: 0.5429
 epoch: 65, train_loss: 0.5991, test_loss: 1.1603, test_f1: 0.5222
 epoch: 66, train_loss: 0.5876, test_loss: 1.1870, test_f1: 0.5240
 epoch: 67, train_loss: 0.6014, test_loss: 1.1148, test_f1: 0.5649
 epoch: 68, train_loss: 0.5834, test_loss: 1.0569, test_f1: 0.5602
 epoch: 69, train_loss: 0.5962, test_loss: 1.1269, test_f1: 0.5519
 epoch: 70, train_loss: 0.5894, test_loss: 1.1595, test_f1: 0.5507
 epoch: 71, train_loss: 0.5850, test_loss: 1.1943, test_f1: 0.5414
 epoch: 72, train_loss: 0.5858, test_loss: 1.1739, test_f1: 0.5553
 epoch: 73, train_loss: 0.5933, test_loss: 1.0919, test_f1: 0.5905
 epoch: 74, train_loss: 0.5724, test_loss: 1.1330, test_f1: 0.5842
 epoch: 75, train_loss: 0.5896, test_loss: 1.2021, test_f1: 0.5528
 epoch: 76, train_loss: 0.5820, test_loss: 1.2131, test_f1: 0.5267
 epoch: 77, train_loss: 0.5793, test_loss: 1.2135, test_f1: 0.5387
 epoch: 78, train_loss: 0.5752, test_loss: 1.1787, test_f1: 0.5511
 epoch: 79, train_loss: 0.5798, test_loss: 1.1401, test_f1: 0.5759
 epoch: 80, train_loss: 0.5678, test_loss: 1.0914, test_f1: 0.5816
 epoch: 81, train_loss: 0.5798, test_loss: 1.1357, test_f1: 0.5804
 epoch: 82, train_loss: 0.6050, test_loss: 1.1062, test_f1: 0.5762
 epoch: 83, train_loss: 0.5736, test_loss: 1.1138, test_f1: 0.5772
 epoch: 84, train_loss: 0.5665, test_loss: 1.1968, test_f1: 0.5379
 epoch: 85, train_loss: 0.5731, test_loss: 1.1804, test_f1: 0.5629
 epoch: 86, train_loss: 0.5700, test_loss: 1.1599, test_f1: 0.5793
 epoch: 87, train_loss: 0.5539, test_loss: 1.1446, test_f1: 0.5707
 epoch: 88, train_loss: 0.5516, test_loss: 1.2238, test_f1: 0.5496
 epoch: 89, train_loss: 0.5496, test_loss: 1.2290, test_f1: 0.5264
 epoch: 90, train_loss: 0.5359, test_loss: 1.1897, test_f1: 0.5723
 epoch: 91, train_loss: 0.5450, test_loss: 1.1858, test_f1: 0.5668
 epoch: 92, train_loss: 0.5471, test_loss: 1.2297, test_f1: 0.5650
 epoch: 93, train_loss: 0.5704, test_loss: 1.1750, test_f1: 0.5636
 epoch: 94, train_loss: 0.5631, test_loss: 1.1631, test_f1: 0.5489
 epoch: 95, train_loss: 0.5563, test_loss: 1.2121, test_f1: 0.5569
 epoch: 96, train_loss: 0.5520, test_loss: 1.1710, test_f1: 0.5967
 epoch: 97, train_loss: 0.5358, test_loss: 1.1899, test_f1: 0.6030
 epoch: 98, train_loss: 0.5383, test_loss: 1.1953, test_f1: 0.5931
 epoch: 99, train_loss: 0.5315, test_loss: 1.1922, test_f1: 0.6004
##################ITERATION #9 ****************************************
 epoch: 0, train_loss: 1.3959, test_loss: 1.5334, test_f1: 0.2660
 epoch: 1, train_loss: 1.1813, test_loss: 1.5177, test_f1: 0.2158
 epoch: 2, train_loss: 1.0974, test_loss: 1.4280, test_f1: 0.2896
 epoch: 3, train_loss: 1.0743, test_loss: 1.3246, test_f1: 0.2285
 epoch: 4, train_loss: 1.0450, test_loss: 1.3439, test_f1: 0.2636
 epoch: 5, train_loss: 0.9999, test_loss: 1.4580, test_f1: 0.2370
 epoch: 6, train_loss: 0.9746, test_loss: 1.6510, test_f1: 0.2168
 epoch: 7, train_loss: 0.9514, test_loss: 1.5326, test_f1: 0.2447
 epoch: 8, train_loss: 0.9348, test_loss: 1.3645, test_f1: 0.3276
 epoch: 9, train_loss: 0.9089, test_loss: 1.1766, test_f1: 0.4459
 epoch: 10, train_loss: 0.9038, test_loss: 1.0651, test_f1: 0.5076
 epoch: 11, train_loss: 0.8853, test_loss: 1.0649, test_f1: 0.5204
 epoch: 12, train_loss: 0.8658, test_loss: 1.0385, test_f1: 0.5726
 epoch: 13, train_loss: 0.8615, test_loss: 1.0256, test_f1: 0.5723
 epoch: 14, train_loss: 0.8401, test_loss: 1.0239, test_f1: 0.5705
 epoch: 15, train_loss: 0.8452, test_loss: 1.0753, test_f1: 0.5749
 epoch: 16, train_loss: 0.8427, test_loss: 1.0536, test_f1: 0.5991
 epoch: 17, train_loss: 0.8257, test_loss: 1.0456, test_f1: 0.5934
 epoch: 18, train_loss: 0.8297, test_loss: 1.0357, test_f1: 0.6049
 epoch: 19, train_loss: 0.8129, test_loss: 1.0401, test_f1: 0.5360
 epoch: 20, train_loss: 0.7964, test_loss: 1.0406, test_f1: 0.5499
 epoch: 21, train_loss: 0.7929, test_loss: 1.0328, test_f1: 0.5433
 epoch: 22, train_loss: 0.7721, test_loss: 1.0165, test_f1: 0.5680
 epoch: 23, train_loss: 0.7656, test_loss: 1.0284, test_f1: 0.5762
 epoch: 24, train_loss: 0.7529, test_loss: 1.0307, test_f1: 0.5611
 epoch: 25, train_loss: 0.7522, test_loss: 1.0359, test_f1: 0.5511
 epoch: 26, train_loss: 0.7608, test_loss: 1.1795, test_f1: 0.5635
 epoch: 27, train_loss: 0.7405, test_loss: 1.1232, test_f1: 0.5348
 epoch: 28, train_loss: 0.7268, test_loss: 1.0213, test_f1: 0.5899
 epoch: 29, train_loss: 0.7327, test_loss: 1.0430, test_f1: 0.5756
 epoch: 30, train_loss: 0.7125, test_loss: 1.1195, test_f1: 0.5734
 epoch: 31, train_loss: 0.7071, test_loss: 1.0369, test_f1: 0.5810
 epoch: 32, train_loss: 0.6962, test_loss: 1.0418, test_f1: 0.5876
 epoch: 33, train_loss: 0.7085, test_loss: 1.0800, test_f1: 0.5699
 epoch: 34, train_loss: 0.7019, test_loss: 1.0430, test_f1: 0.5889
 epoch: 35, train_loss: 0.7120, test_loss: 1.0047, test_f1: 0.5714
 epoch: 36, train_loss: 0.7040, test_loss: 1.0432, test_f1: 0.6110
 epoch: 37, train_loss: 0.6874, test_loss: 0.9981, test_f1: 0.5693
 epoch: 38, train_loss: 0.6808, test_loss: 1.0193, test_f1: 0.5748
 epoch: 39, train_loss: 0.6836, test_loss: 1.2391, test_f1: 0.5730
 epoch: 40, train_loss: 0.6495, test_loss: 1.1152, test_f1: 0.5545
 epoch: 41, train_loss: 0.6555, test_loss: 1.0927, test_f1: 0.5505
 epoch: 42, train_loss: 0.6729, test_loss: 1.0491, test_f1: 0.5569
 epoch: 43, train_loss: 0.6968, test_loss: 1.1130, test_f1: 0.5668
 epoch: 44, train_loss: 0.6491, test_loss: 1.0153, test_f1: 0.6101
 epoch: 45, train_loss: 0.6611, test_loss: 0.9926, test_f1: 0.6298
 epoch: 46, train_loss: 0.6584, test_loss: 1.0207, test_f1: 0.6112
 epoch: 47, train_loss: 0.6539, test_loss: 1.1541, test_f1: 0.5988
 epoch: 48, train_loss: 0.6435, test_loss: 1.0371, test_f1: 0.6305
 epoch: 49, train_loss: 0.6509, test_loss: 1.1460, test_f1: 0.5880
 epoch: 50, train_loss: 0.6364, test_loss: 1.0651, test_f1: 0.6243
 epoch: 51, train_loss: 0.6391, test_loss: 1.0341, test_f1: 0.6003
 epoch: 52, train_loss: 0.6363, test_loss: 1.0227, test_f1: 0.6254
 epoch: 53, train_loss: 0.6287, test_loss: 1.0459, test_f1: 0.6209
 epoch: 54, train_loss: 0.6210, test_loss: 1.1223, test_f1: 0.6068
 epoch: 55, train_loss: 0.6117, test_loss: 1.0591, test_f1: 0.6042
 epoch: 56, train_loss: 0.6085, test_loss: 1.0172, test_f1: 0.5977
 epoch: 57, train_loss: 0.6077, test_loss: 1.1524, test_f1: 0.6106
 epoch: 58, train_loss: 0.6040, test_loss: 1.1602, test_f1: 0.6296
 epoch: 59, train_loss: 0.6109, test_loss: 1.0540, test_f1: 0.6441
 epoch: 60, train_loss: 0.5956, test_loss: 1.0600, test_f1: 0.6144
 epoch: 61, train_loss: 0.6142, test_loss: 1.5204, test_f1: 0.6168
 epoch: 62, train_loss: 0.5930, test_loss: 1.1339, test_f1: 0.6149
 epoch: 63, train_loss: 0.6011, test_loss: 1.0878, test_f1: 0.5894
 epoch: 64, train_loss: 0.5992, test_loss: 1.0791, test_f1: 0.5756
 epoch: 65, train_loss: 0.5936, test_loss: 1.0681, test_f1: 0.6094
 epoch: 66, train_loss: 0.5931, test_loss: 1.1095, test_f1: 0.6338
 epoch: 67, train_loss: 0.5819, test_loss: 1.2829, test_f1: 0.6063
 epoch: 68, train_loss: 0.5898, test_loss: 1.2030, test_f1: 0.6147
 epoch: 69, train_loss: 0.5927, test_loss: 1.1539, test_f1: 0.6114
 epoch: 70, train_loss: 0.5902, test_loss: 1.0710, test_f1: 0.5954
 epoch: 71, train_loss: 0.5964, test_loss: 1.0550, test_f1: 0.6252
 epoch: 72, train_loss: 0.6019, test_loss: 1.0927, test_f1: 0.5797
 epoch: 73, train_loss: 0.5899, test_loss: 1.0662, test_f1: 0.5961
 epoch: 74, train_loss: 0.5892, test_loss: 1.0707, test_f1: 0.5984
 epoch: 75, train_loss: 0.5825, test_loss: 1.0854, test_f1: 0.6091
 epoch: 76, train_loss: 0.5815, test_loss: 1.2339, test_f1: 0.5630
 epoch: 77, train_loss: 0.5983, test_loss: 1.1264, test_f1: 0.5531
 epoch: 78, train_loss: 0.5957, test_loss: 1.1375, test_f1: 0.5869
 epoch: 79, train_loss: 0.5704, test_loss: 1.2281, test_f1: 0.5856
 epoch: 80, train_loss: 0.5706, test_loss: 1.0997, test_f1: 0.6001
 epoch: 81, train_loss: 0.5587, test_loss: 1.0782, test_f1: 0.5872
 epoch: 82, train_loss: 0.5659, test_loss: 1.0659, test_f1: 0.6020
 epoch: 83, train_loss: 0.5649, test_loss: 1.0750, test_f1: 0.6256
 epoch: 84, train_loss: 0.5530, test_loss: 1.1308, test_f1: 0.6185
 epoch: 85, train_loss: 0.5602, test_loss: 1.1369, test_f1: 0.6058
 epoch: 86, train_loss: 0.5807, test_loss: 1.0606, test_f1: 0.6168
 epoch: 87, train_loss: 0.5711, test_loss: 1.3501, test_f1: 0.5929
 epoch: 88, train_loss: 0.5859, test_loss: 1.6334, test_f1: 0.5789
 epoch: 89, train_loss: 0.5827, test_loss: 1.1780, test_f1: 0.5601
 epoch: 90, train_loss: 0.5818, test_loss: 1.0947, test_f1: 0.5729
 epoch: 91, train_loss: 0.5721, test_loss: 1.0960, test_f1: 0.5867
 epoch: 92, train_loss: 0.5563, test_loss: 1.1296, test_f1: 0.5853
 epoch: 93, train_loss: 0.5529, test_loss: 1.3044, test_f1: 0.5694
 epoch: 94, train_loss: 0.5576, test_loss: 1.1355, test_f1: 0.5703
 epoch: 95, train_loss: 0.5456, test_loss: 1.0665, test_f1: 0.5856
 epoch: 96, train_loss: 0.5409, test_loss: 1.0950, test_f1: 0.5865
 epoch: 97, train_loss: 0.5388, test_loss: 1.2021, test_f1: 0.5899
 epoch: 98, train_loss: 0.5336, test_loss: 1.1295, test_f1: 0.5883
 epoch: 99, train_loss: 0.5314, test_loss: 1.1198, test_f1: 0.5939

Training completed in 309.70 seconds
Best F1: 0.6511 at epoch 44
Mean F1 across iterations: 0.6250  0.0141
========================FINAL RESULTS================================
FEGIN weighted F1: 0.6511  0.0141
python main.py --data ltspice_demos --representation component_pin --model FEGIN --layers 4 --hiddens 32 --batch_size 256 --lr 0.001 --emb_size 128 --epochs 100 --save_appendix component_pin_L4_H32_BS256_LR0.001_E128 --no_val
-----



STDERR:
  File "main.py", line 370, in <module>
    main()
  File "main.py", line 254, in main
    dataset = dataset_class(
  File "/home/philip/projects/ltspice_examples_code_repo/Circuit-Completion-Using-GNNs/component_classification_with_link_prediction_head/evaluation/FEGIN/kernel/circuit_datasets.py", line 15, in __init__
    self.data, self.slices = torch.load(self.processed_paths[0])
  File "/home/philip/.local/lib/python3.8/site-packages/torch/serialization.py", line 1040, in load
    warnings.warn(
  File "/usr/lib/python3.8/warnings.py", line 109, in _showwarnmsg
    sw(msg.message, msg.category, msg.filename, msg.lineno,
  File "main.py", line 47, in warn_with_traceback
    traceback.print_stack(file=log)
/home/philip/projects/ltspice_examples_code_repo/Circuit-Completion-Using-GNNs/component_classification_with_link_prediction_head/evaluation/FEGIN/kernel/circuit_datasets.py:15: FutureWarning: You are using `torch.load` with `weights_only=False` (the current default value), which uses the default pickle module implicitly. It is possible to construct malicious pickle data which will execute arbitrary code during unpickling (See https://github.com/pytorch/pytorch/blob/main/SECURITY.md#untrusted-models for more details). In a future release, the default value for `weights_only` will be flipped to `True`. This limits the functions that could be executed during unpickling. Arbitrary objects will no longer be allowed to be loaded via this mode unless they are explicitly allowlisted by the user via `torch.serialization.add_safe_globals`. We recommend you start setting `weights_only=True` for any use case where you don't have full control of the loaded file. Please open an issue on GitHub for any issues related to this experimental feature.
  self.data, self.slices = torch.load(self.processed_paths[0])
