STDOUT:
Results will be saved in /home/philip/projects/ltspice_examples_code_repo/Circuit-Completion-Using-GNNs/component_classification_with_link_prediction_head/evaluation/FEGIN/results/model_FEGIN_dataset_ltspice_examples
Command line input: python main.py --data ltspice_examples --representation component_pin_net --model FEGIN --layers 4 --hiddens 64 --batch_size 64 --lr 0.001 --emb_size 128 --epochs 100 --save_appendix component_pin_net_L4_H64_BS64_LR0.001_E128 --no_val
 is saved.
-----
ltspice_examples - FEGIN
Using 4 layers, 64 hidden units, h = 2
Loading component_pin_net representation dataset
ENTERED
Training FEGIN on component_pin_net representation
Train: 3558, Test: 846
##################ITERATION #0 ****************************************
 epoch: 0, train_loss: 1.1860, test_loss: 1.0773, test_f1: 0.3558
 epoch: 1, train_loss: 1.0044, test_loss: 1.0441, test_f1: 0.4739
 epoch: 2, train_loss: 0.9755, test_loss: 0.9376, test_f1: 0.4959
 epoch: 3, train_loss: 0.9519, test_loss: 0.9617, test_f1: 0.5073
 epoch: 4, train_loss: 0.9191, test_loss: 0.9042, test_f1: 0.4940
 epoch: 5, train_loss: 0.9148, test_loss: 0.8917, test_f1: 0.5230
 epoch: 6, train_loss: 0.8876, test_loss: 0.8552, test_f1: 0.5412
 epoch: 7, train_loss: 0.8732, test_loss: 0.9106, test_f1: 0.5595
 epoch: 8, train_loss: 0.8545, test_loss: 0.8797, test_f1: 0.5249
 epoch: 9, train_loss: 0.8389, test_loss: 0.8264, test_f1: 0.5507
 epoch: 10, train_loss: 0.8194, test_loss: 0.9020, test_f1: 0.5591
 epoch: 11, train_loss: 0.8062, test_loss: 0.8817, test_f1: 0.5433
 epoch: 12, train_loss: 0.7905, test_loss: 0.8150, test_f1: 0.5916
 epoch: 13, train_loss: 0.7866, test_loss: 0.8594, test_f1: 0.5534
 epoch: 14, train_loss: 0.7753, test_loss: 0.8513, test_f1: 0.5831
 epoch: 15, train_loss: 0.7529, test_loss: 0.8014, test_f1: 0.5777
 epoch: 16, train_loss: 0.7353, test_loss: 0.8536, test_f1: 0.6217
 epoch: 17, train_loss: 0.7157, test_loss: 0.8139, test_f1: 0.5930
 epoch: 18, train_loss: 0.6919, test_loss: 0.8250, test_f1: 0.6338
 epoch: 19, train_loss: 0.6991, test_loss: 0.8576, test_f1: 0.5805
 epoch: 20, train_loss: 0.6863, test_loss: 0.8342, test_f1: 0.6052
 epoch: 21, train_loss: 0.6599, test_loss: 0.8316, test_f1: 0.5795
 epoch: 22, train_loss: 0.6631, test_loss: 0.8478, test_f1: 0.6229
 epoch: 23, train_loss: 0.6368, test_loss: 0.8277, test_f1: 0.6377
 epoch: 24, train_loss: 0.6392, test_loss: 0.7812, test_f1: 0.6580
 epoch: 25, train_loss: 0.6140, test_loss: 0.7844, test_f1: 0.6454
 epoch: 26, train_loss: 0.6025, test_loss: 0.8654, test_f1: 0.6198
 epoch: 27, train_loss: 0.5991, test_loss: 0.7664, test_f1: 0.6302
 epoch: 28, train_loss: 0.5955, test_loss: 0.8864, test_f1: 0.6287
 epoch: 29, train_loss: 0.5985, test_loss: 0.7627, test_f1: 0.6801
 epoch: 30, train_loss: 0.5890, test_loss: 0.8740, test_f1: 0.6360
 epoch: 31, train_loss: 0.5681, test_loss: 0.8803, test_f1: 0.6379
 epoch: 32, train_loss: 0.5632, test_loss: 0.8574, test_f1: 0.6297
 epoch: 33, train_loss: 0.5636, test_loss: 0.8178, test_f1: 0.6383
 epoch: 34, train_loss: 0.5339, test_loss: 0.8873, test_f1: 0.6598
 epoch: 35, train_loss: 0.5439, test_loss: 0.7425, test_f1: 0.6761
 epoch: 36, train_loss: 0.5155, test_loss: 0.7345, test_f1: 0.6687
 epoch: 37, train_loss: 0.5275, test_loss: 0.8839, test_f1: 0.6525
 epoch: 38, train_loss: 0.5102, test_loss: 0.7943, test_f1: 0.6521
 epoch: 39, train_loss: 0.5048, test_loss: 0.8939, test_f1: 0.6336
 epoch: 40, train_loss: 0.5115, test_loss: 0.7638, test_f1: 0.6575
 epoch: 41, train_loss: 0.4890, test_loss: 0.9491, test_f1: 0.6607
 epoch: 42, train_loss: 0.4847, test_loss: 0.9238, test_f1: 0.6564
 epoch: 43, train_loss: 0.4721, test_loss: 0.8686, test_f1: 0.6443
 epoch: 44, train_loss: 0.4765, test_loss: 1.0520, test_f1: 0.6404
 epoch: 45, train_loss: 0.4766, test_loss: 0.9418, test_f1: 0.6647
 epoch: 46, train_loss: 0.4703, test_loss: 1.0268, test_f1: 0.6641
 epoch: 47, train_loss: 0.4734, test_loss: 0.9280, test_f1: 0.6604
 epoch: 48, train_loss: 0.4461, test_loss: 0.9304, test_f1: 0.6568
 epoch: 49, train_loss: 0.4348, test_loss: 1.1491, test_f1: 0.6593
 epoch: 50, train_loss: 0.4432, test_loss: 0.8688, test_f1: 0.6724
 epoch: 51, train_loss: 0.4131, test_loss: 0.9997, test_f1: 0.6733
 epoch: 52, train_loss: 0.3867, test_loss: 1.0382, test_f1: 0.6650
 epoch: 53, train_loss: 0.3843, test_loss: 1.0147, test_f1: 0.6655
 epoch: 54, train_loss: 0.3845, test_loss: 1.0225, test_f1: 0.6803
 epoch: 55, train_loss: 0.3750, test_loss: 0.9794, test_f1: 0.6690
 epoch: 56, train_loss: 0.3644, test_loss: 1.1029, test_f1: 0.6645
 epoch: 57, train_loss: 0.3511, test_loss: 1.0876, test_f1: 0.6743
 epoch: 58, train_loss: 0.3582, test_loss: 1.0710, test_f1: 0.6575
 epoch: 59, train_loss: 0.3570, test_loss: 1.0399, test_f1: 0.7152
 epoch: 60, train_loss: 0.3357, test_loss: 1.1446, test_f1: 0.6856
 epoch: 61, train_loss: 0.3444, test_loss: 1.1236, test_f1: 0.6706
 epoch: 62, train_loss: 0.3428, test_loss: 1.2581, test_f1: 0.6757
 epoch: 63, train_loss: 0.3242, test_loss: 1.1556, test_f1: 0.6872
 epoch: 64, train_loss: 0.3268, test_loss: 1.1868, test_f1: 0.6666
 epoch: 65, train_loss: 0.3340, test_loss: 1.2444, test_f1: 0.6567
 epoch: 66, train_loss: 0.3211, test_loss: 1.3290, test_f1: 0.6554
 epoch: 67, train_loss: 0.3389, test_loss: 1.3264, test_f1: 0.6472
 epoch: 68, train_loss: 0.3248, test_loss: 1.2149, test_f1: 0.6794
 epoch: 69, train_loss: 0.3080, test_loss: 1.2671, test_f1: 0.6555
 epoch: 70, train_loss: 0.3087, test_loss: 1.2530, test_f1: 0.6681
 epoch: 71, train_loss: 0.2993, test_loss: 1.3448, test_f1: 0.6606
 epoch: 72, train_loss: 0.2964, test_loss: 1.4702, test_f1: 0.6667
 epoch: 73, train_loss: 0.3032, test_loss: 1.4125, test_f1: 0.6682
 epoch: 74, train_loss: 0.2967, test_loss: 1.2949, test_f1: 0.6498
 epoch: 75, train_loss: 0.2970, test_loss: 1.3126, test_f1: 0.6617
 epoch: 76, train_loss: 0.3004, test_loss: 1.2733, test_f1: 0.6772
 epoch: 77, train_loss: 0.2805, test_loss: 1.3234, test_f1: 0.6571
 epoch: 78, train_loss: 0.2895, test_loss: 1.2828, test_f1: 0.6569
 epoch: 79, train_loss: 0.2785, test_loss: 1.3639, test_f1: 0.6678
 epoch: 80, train_loss: 0.2763, test_loss: 1.4023, test_f1: 0.6489
 epoch: 81, train_loss: 0.2902, test_loss: 1.4792, test_f1: 0.6701
 epoch: 82, train_loss: 0.2783, test_loss: 1.4619, test_f1: 0.6583
 epoch: 83, train_loss: 0.2724, test_loss: 1.3423, test_f1: 0.6757
 epoch: 84, train_loss: 0.2720, test_loss: 1.4678, test_f1: 0.6723
 epoch: 85, train_loss: 0.2695, test_loss: 1.4301, test_f1: 0.6682
 epoch: 86, train_loss: 0.2666, test_loss: 1.4403, test_f1: 0.6586
 epoch: 87, train_loss: 0.2673, test_loss: 1.6154, test_f1: 0.6581
 epoch: 88, train_loss: 0.2701, test_loss: 1.5658, test_f1: 0.6592
 epoch: 89, train_loss: 0.2534, test_loss: 1.5577, test_f1: 0.6571
 epoch: 90, train_loss: 0.2521, test_loss: 1.5091, test_f1: 0.6472
 epoch: 91, train_loss: 0.2588, test_loss: 1.3682, test_f1: 0.6693
 epoch: 92, train_loss: 0.2524, test_loss: 1.5790, test_f1: 0.6516
 epoch: 93, train_loss: 0.2461, test_loss: 1.5313, test_f1: 0.6595
 epoch: 94, train_loss: 0.2426, test_loss: 1.4805, test_f1: 0.6699
 epoch: 95, train_loss: 0.2506, test_loss: 1.5024, test_f1: 0.6755
 epoch: 96, train_loss: 0.2379, test_loss: 1.6480, test_f1: 0.6645
 epoch: 97, train_loss: 0.2432, test_loss: 1.6993, test_f1: 0.6538
 epoch: 98, train_loss: 0.2356, test_loss: 1.7466, test_f1: 0.6649
 epoch: 99, train_loss: 0.2250, test_loss: 1.7150, test_f1: 0.6850
##################ITERATION #1 ****************************************
 epoch: 0, train_loss: 1.0660, test_loss: 1.0779, test_f1: 0.3688
 epoch: 1, train_loss: 0.9551, test_loss: 0.9048, test_f1: 0.5398
 epoch: 2, train_loss: 0.9166, test_loss: 0.8847, test_f1: 0.5784
 epoch: 3, train_loss: 0.8918, test_loss: 0.8458, test_f1: 0.5360
 epoch: 4, train_loss: 0.8756, test_loss: 0.8207, test_f1: 0.6001
 epoch: 5, train_loss: 0.8521, test_loss: 0.8112, test_f1: 0.5833
 epoch: 6, train_loss: 0.8326, test_loss: 0.8074, test_f1: 0.5891
 epoch: 7, train_loss: 0.8227, test_loss: 0.8393, test_f1: 0.5711
 epoch: 8, train_loss: 0.8170, test_loss: 0.8176, test_f1: 0.5950
 epoch: 9, train_loss: 0.7959, test_loss: 0.8186, test_f1: 0.6110
 epoch: 10, train_loss: 0.7672, test_loss: 0.9209, test_f1: 0.5551
 epoch: 11, train_loss: 0.7598, test_loss: 0.8391, test_f1: 0.6031
 epoch: 12, train_loss: 0.7297, test_loss: 0.7308, test_f1: 0.6388
 epoch: 13, train_loss: 0.7134, test_loss: 0.8336, test_f1: 0.6145
 epoch: 14, train_loss: 0.7276, test_loss: 0.7554, test_f1: 0.6415
 epoch: 15, train_loss: 0.7290, test_loss: 0.7863, test_f1: 0.6517
 epoch: 16, train_loss: 0.6963, test_loss: 0.7245, test_f1: 0.6525
 epoch: 17, train_loss: 0.6888, test_loss: 0.7983, test_f1: 0.6442
 epoch: 18, train_loss: 0.6718, test_loss: 0.7499, test_f1: 0.6388
 epoch: 19, train_loss: 0.6564, test_loss: 0.7005, test_f1: 0.6727
 epoch: 20, train_loss: 0.6443, test_loss: 0.7954, test_f1: 0.6915
 epoch: 21, train_loss: 0.6566, test_loss: 0.6991, test_f1: 0.6468
 epoch: 22, train_loss: 0.6313, test_loss: 0.7864, test_f1: 0.6244
 epoch: 23, train_loss: 0.6351, test_loss: 0.7521, test_f1: 0.6555
 epoch: 24, train_loss: 0.6319, test_loss: 0.8005, test_f1: 0.6597
 epoch: 25, train_loss: 0.6086, test_loss: 0.8357, test_f1: 0.6603
 epoch: 26, train_loss: 0.5965, test_loss: 0.7295, test_f1: 0.6732
 epoch: 27, train_loss: 0.5761, test_loss: 0.7623, test_f1: 0.6513
 epoch: 28, train_loss: 0.5744, test_loss: 0.8833, test_f1: 0.6552
 epoch: 29, train_loss: 0.5775, test_loss: 0.7805, test_f1: 0.6568
 epoch: 30, train_loss: 0.5537, test_loss: 0.9359, test_f1: 0.6403
 epoch: 31, train_loss: 0.5528, test_loss: 0.9482, test_f1: 0.6117
 epoch: 32, train_loss: 0.5445, test_loss: 0.8854, test_f1: 0.6716
 epoch: 33, train_loss: 0.5440, test_loss: 0.8352, test_f1: 0.6541
 epoch: 34, train_loss: 0.5290, test_loss: 0.9604, test_f1: 0.6197
 epoch: 35, train_loss: 0.5183, test_loss: 0.9025, test_f1: 0.6717
 epoch: 36, train_loss: 0.5007, test_loss: 0.8399, test_f1: 0.6521
 epoch: 37, train_loss: 0.5281, test_loss: 0.8258, test_f1: 0.6482
 epoch: 38, train_loss: 0.5376, test_loss: 0.9333, test_f1: 0.6535
 epoch: 39, train_loss: 0.5006, test_loss: 1.0170, test_f1: 0.6400
 epoch: 40, train_loss: 0.5129, test_loss: 1.0665, test_f1: 0.6451
 epoch: 41, train_loss: 0.4816, test_loss: 0.7872, test_f1: 0.6619
 epoch: 42, train_loss: 0.4829, test_loss: 0.8766, test_f1: 0.6655
 epoch: 43, train_loss: 0.4745, test_loss: 1.0271, test_f1: 0.6436
 epoch: 44, train_loss: 0.4623, test_loss: 1.0999, test_f1: 0.6327
 epoch: 45, train_loss: 0.4670, test_loss: 1.1221, test_f1: 0.6297
 epoch: 46, train_loss: 0.4556, test_loss: 0.9488, test_f1: 0.6612
 epoch: 47, train_loss: 0.4489, test_loss: 1.0840, test_f1: 0.6567
 epoch: 48, train_loss: 0.4432, test_loss: 1.0022, test_f1: 0.6182
 epoch: 49, train_loss: 0.4406, test_loss: 1.2688, test_f1: 0.6355
 epoch: 50, train_loss: 0.4417, test_loss: 0.9985, test_f1: 0.6625
 epoch: 51, train_loss: 0.4017, test_loss: 1.0514, test_f1: 0.6511
 epoch: 52, train_loss: 0.3862, test_loss: 1.1199, test_f1: 0.6477
 epoch: 53, train_loss: 0.3700, test_loss: 1.0958, test_f1: 0.6538
 epoch: 54, train_loss: 0.3828, test_loss: 1.1067, test_f1: 0.6600
 epoch: 55, train_loss: 0.3520, test_loss: 1.0806, test_f1: 0.6457
 epoch: 56, train_loss: 0.3483, test_loss: 1.2089, test_f1: 0.6470
 epoch: 57, train_loss: 0.3543, test_loss: 1.2156, test_f1: 0.6728
 epoch: 58, train_loss: 0.3350, test_loss: 1.1907, test_f1: 0.6469
 epoch: 59, train_loss: 0.3430, test_loss: 1.1134, test_f1: 0.6463
 epoch: 60, train_loss: 0.3423, test_loss: 1.3220, test_f1: 0.6539
 epoch: 61, train_loss: 0.3490, test_loss: 1.1383, test_f1: 0.6586
 epoch: 62, train_loss: 0.3275, test_loss: 1.2264, test_f1: 0.6526
 epoch: 63, train_loss: 0.3091, test_loss: 1.4474, test_f1: 0.6386
 epoch: 64, train_loss: 0.3105, test_loss: 1.0635, test_f1: 0.6789
 epoch: 65, train_loss: 0.3040, test_loss: 1.2258, test_f1: 0.6630
 epoch: 66, train_loss: 0.3205, test_loss: 1.0691, test_f1: 0.6685
 epoch: 67, train_loss: 0.3184, test_loss: 1.2147, test_f1: 0.6568
 epoch: 68, train_loss: 0.3065, test_loss: 1.4575, test_f1: 0.6460
 epoch: 69, train_loss: 0.3002, test_loss: 1.3789, test_f1: 0.6616
 epoch: 70, train_loss: 0.2898, test_loss: 1.3824, test_f1: 0.6574
 epoch: 71, train_loss: 0.3115, test_loss: 1.1877, test_f1: 0.6455
 epoch: 72, train_loss: 0.3096, test_loss: 1.2784, test_f1: 0.6493
 epoch: 73, train_loss: 0.3073, test_loss: 1.3739, test_f1: 0.6574
 epoch: 74, train_loss: 0.3075, test_loss: 1.2377, test_f1: 0.6543
 epoch: 75, train_loss: 0.2789, test_loss: 1.2872, test_f1: 0.6739
 epoch: 76, train_loss: 0.2885, test_loss: 1.3737, test_f1: 0.6536
 epoch: 77, train_loss: 0.2881, test_loss: 1.3517, test_f1: 0.6703
 epoch: 78, train_loss: 0.2945, test_loss: 1.4481, test_f1: 0.6417
 epoch: 79, train_loss: 0.2833, test_loss: 1.3079, test_f1: 0.6604
 epoch: 80, train_loss: 0.2811, test_loss: 1.4762, test_f1: 0.6465
 epoch: 81, train_loss: 0.2849, test_loss: 1.4081, test_f1: 0.6526
 epoch: 82, train_loss: 0.2769, test_loss: 1.3862, test_f1: 0.6644
 epoch: 83, train_loss: 0.2794, test_loss: 1.4033, test_f1: 0.6528
 epoch: 84, train_loss: 0.2773, test_loss: 1.5924, test_f1: 0.6395
 epoch: 85, train_loss: 0.2621, test_loss: 1.7439, test_f1: 0.6333
 epoch: 86, train_loss: 0.2592, test_loss: 1.4725, test_f1: 0.6300
 epoch: 87, train_loss: 0.2493, test_loss: 1.4413, test_f1: 0.6546
 epoch: 88, train_loss: 0.2651, test_loss: 1.4522, test_f1: 0.6671
 epoch: 89, train_loss: 0.2594, test_loss: 1.5309, test_f1: 0.6739
 epoch: 90, train_loss: 0.2420, test_loss: 1.6195, test_f1: 0.6506
 epoch: 91, train_loss: 0.2341, test_loss: 1.4580, test_f1: 0.6662
 epoch: 92, train_loss: 0.2453, test_loss: 1.7123, test_f1: 0.6611
 epoch: 93, train_loss: 0.2425, test_loss: 1.6940, test_f1: 0.6453
 epoch: 94, train_loss: 0.2358, test_loss: 1.6798, test_f1: 0.6665
 epoch: 95, train_loss: 0.2490, test_loss: 1.4661, test_f1: 0.6565
 epoch: 96, train_loss: 0.2319, test_loss: 1.6971, test_f1: 0.6549
 epoch: 97, train_loss: 0.2384, test_loss: 1.7299, test_f1: 0.6736
 epoch: 98, train_loss: 0.2265, test_loss: 1.7233, test_f1: 0.6172
 epoch: 99, train_loss: 0.2185, test_loss: 1.5811, test_f1: 0.6676
##################ITERATION #2 ****************************************
 epoch: 0, train_loss: 1.1203, test_loss: 1.2469, test_f1: 0.2905
 epoch: 1, train_loss: 0.9751, test_loss: 0.9408, test_f1: 0.4998
 epoch: 2, train_loss: 0.9284, test_loss: 0.9135, test_f1: 0.5162
 epoch: 3, train_loss: 0.9076, test_loss: 0.8743, test_f1: 0.5062
 epoch: 4, train_loss: 0.8814, test_loss: 0.8642, test_f1: 0.5868
 epoch: 5, train_loss: 0.8600, test_loss: 0.8288, test_f1: 0.5550
 epoch: 6, train_loss: 0.8544, test_loss: 0.8197, test_f1: 0.5799
 epoch: 7, train_loss: 0.8228, test_loss: 0.8292, test_f1: 0.6068
 epoch: 8, train_loss: 0.7934, test_loss: 0.8063, test_f1: 0.5872
 epoch: 9, train_loss: 0.7826, test_loss: 0.7837, test_f1: 0.6271
 epoch: 10, train_loss: 0.7856, test_loss: 0.8600, test_f1: 0.5943
 epoch: 11, train_loss: 0.7618, test_loss: 0.7738, test_f1: 0.6363
 epoch: 12, train_loss: 0.7405, test_loss: 0.8031, test_f1: 0.6436
 epoch: 13, train_loss: 0.7318, test_loss: 0.7395, test_f1: 0.6488
 epoch: 14, train_loss: 0.7119, test_loss: 0.7025, test_f1: 0.6525
 epoch: 15, train_loss: 0.6994, test_loss: 0.8071, test_f1: 0.6177
 epoch: 16, train_loss: 0.6914, test_loss: 0.7674, test_f1: 0.6612
 epoch: 17, train_loss: 0.6869, test_loss: 0.7550, test_f1: 0.6380
 epoch: 18, train_loss: 0.6627, test_loss: 0.7322, test_f1: 0.6359
 epoch: 19, train_loss: 0.6451, test_loss: 0.6868, test_f1: 0.6637
 epoch: 20, train_loss: 0.6476, test_loss: 0.7536, test_f1: 0.6781
 epoch: 21, train_loss: 0.6449, test_loss: 0.7617, test_f1: 0.6628
 epoch: 22, train_loss: 0.6212, test_loss: 0.7130, test_f1: 0.6372
 epoch: 23, train_loss: 0.6052, test_loss: 0.6901, test_f1: 0.6548
 epoch: 24, train_loss: 0.6149, test_loss: 0.8162, test_f1: 0.6680
 epoch: 25, train_loss: 0.6019, test_loss: 0.7354, test_f1: 0.6550
 epoch: 26, train_loss: 0.5703, test_loss: 0.7449, test_f1: 0.6689
 epoch: 27, train_loss: 0.5823, test_loss: 0.7829, test_f1: 0.6582
 epoch: 28, train_loss: 0.5571, test_loss: 0.8531, test_f1: 0.6560
 epoch: 29, train_loss: 0.5671, test_loss: 0.7993, test_f1: 0.6300
 epoch: 30, train_loss: 0.5740, test_loss: 0.7531, test_f1: 0.6693
 epoch: 31, train_loss: 0.5528, test_loss: 0.7544, test_f1: 0.6983
 epoch: 32, train_loss: 0.5401, test_loss: 0.8238, test_f1: 0.6879
 epoch: 33, train_loss: 0.5253, test_loss: 0.9333, test_f1: 0.6404
 epoch: 34, train_loss: 0.5356, test_loss: 0.8789, test_f1: 0.6712
 epoch: 35, train_loss: 0.5147, test_loss: 0.8485, test_f1: 0.6688
 epoch: 36, train_loss: 0.5099, test_loss: 0.8447, test_f1: 0.6681
 epoch: 37, train_loss: 0.5098, test_loss: 0.9674, test_f1: 0.6447
 epoch: 38, train_loss: 0.4962, test_loss: 1.0788, test_f1: 0.6315
 epoch: 39, train_loss: 0.4949, test_loss: 0.7960, test_f1: 0.6771
 epoch: 40, train_loss: 0.4713, test_loss: 0.8611, test_f1: 0.6764
 epoch: 41, train_loss: 0.4902, test_loss: 0.9289, test_f1: 0.6604
 epoch: 42, train_loss: 0.4760, test_loss: 0.9132, test_f1: 0.6670
 epoch: 43, train_loss: 0.4622, test_loss: 0.8738, test_f1: 0.7031
 epoch: 44, train_loss: 0.4593, test_loss: 0.9655, test_f1: 0.6634
 epoch: 45, train_loss: 0.4642, test_loss: 0.8273, test_f1: 0.7072
 epoch: 46, train_loss: 0.4420, test_loss: 1.0327, test_f1: 0.6581
 epoch: 47, train_loss: 0.4208, test_loss: 0.9771, test_f1: 0.6656
 epoch: 48, train_loss: 0.4390, test_loss: 0.9421, test_f1: 0.6487
 epoch: 49, train_loss: 0.4309, test_loss: 0.9073, test_f1: 0.6828
 epoch: 50, train_loss: 0.4348, test_loss: 0.9694, test_f1: 0.6469
 epoch: 51, train_loss: 0.3922, test_loss: 0.9669, test_f1: 0.6760
 epoch: 52, train_loss: 0.3544, test_loss: 1.0063, test_f1: 0.6857
 epoch: 53, train_loss: 0.3557, test_loss: 1.1140, test_f1: 0.6714
 epoch: 54, train_loss: 0.3415, test_loss: 1.0945, test_f1: 0.6724
 epoch: 55, train_loss: 0.3501, test_loss: 1.1125, test_f1: 0.6562
 epoch: 56, train_loss: 0.3293, test_loss: 1.1080, test_f1: 0.6835
 epoch: 57, train_loss: 0.3351, test_loss: 1.1349, test_f1: 0.6612
 epoch: 58, train_loss: 0.3116, test_loss: 0.9688, test_f1: 0.6868
 epoch: 59, train_loss: 0.3253, test_loss: 1.1852, test_f1: 0.6725
 epoch: 60, train_loss: 0.3271, test_loss: 1.2120, test_f1: 0.6713
 epoch: 61, train_loss: 0.3278, test_loss: 1.2006, test_f1: 0.6592
 epoch: 62, train_loss: 0.3239, test_loss: 1.1952, test_f1: 0.6610
 epoch: 63, train_loss: 0.3196, test_loss: 1.2925, test_f1: 0.6550
 epoch: 64, train_loss: 0.3013, test_loss: 1.2449, test_f1: 0.6797
 epoch: 65, train_loss: 0.3054, test_loss: 1.2139, test_f1: 0.6660
 epoch: 66, train_loss: 0.3044, test_loss: 1.2348, test_f1: 0.6768
 epoch: 67, train_loss: 0.2886, test_loss: 1.3344, test_f1: 0.6763
 epoch: 68, train_loss: 0.2771, test_loss: 1.2860, test_f1: 0.6645
 epoch: 69, train_loss: 0.2946, test_loss: 1.4118, test_f1: 0.6569
 epoch: 70, train_loss: 0.3027, test_loss: 1.2178, test_f1: 0.6723
 epoch: 71, train_loss: 0.2882, test_loss: 1.2184, test_f1: 0.6817
 epoch: 72, train_loss: 0.2874, test_loss: 1.3809, test_f1: 0.6813
 epoch: 73, train_loss: 0.2885, test_loss: 1.1618, test_f1: 0.6843
 epoch: 74, train_loss: 0.2872, test_loss: 1.2092, test_f1: 0.7156
 epoch: 75, train_loss: 0.2583, test_loss: 1.3829, test_f1: 0.6743
 epoch: 76, train_loss: 0.2772, test_loss: 1.5546, test_f1: 0.6404
 epoch: 77, train_loss: 0.2719, test_loss: 1.4208, test_f1: 0.6730
 epoch: 78, train_loss: 0.2651, test_loss: 1.3794, test_f1: 0.6942
 epoch: 79, train_loss: 0.2637, test_loss: 1.3752, test_f1: 0.6653
 epoch: 80, train_loss: 0.2657, test_loss: 1.3516, test_f1: 0.6852
 epoch: 81, train_loss: 0.2573, test_loss: 1.5664, test_f1: 0.6587
 epoch: 82, train_loss: 0.2515, test_loss: 1.3277, test_f1: 0.6896
 epoch: 83, train_loss: 0.2719, test_loss: 1.4351, test_f1: 0.6711
 epoch: 84, train_loss: 0.2575, test_loss: 1.4124, test_f1: 0.6809
 epoch: 85, train_loss: 0.2540, test_loss: 1.3606, test_f1: 0.6898
 epoch: 86, train_loss: 0.2501, test_loss: 1.4519, test_f1: 0.6692
 epoch: 87, train_loss: 0.2513, test_loss: 1.4765, test_f1: 0.6803
 epoch: 88, train_loss: 0.2428, test_loss: 1.5703, test_f1: 0.6728
 epoch: 89, train_loss: 0.2429, test_loss: 1.4900, test_f1: 0.6692
 epoch: 90, train_loss: 0.2293, test_loss: 1.3716, test_f1: 0.6900
 epoch: 91, train_loss: 0.2311, test_loss: 1.4591, test_f1: 0.6922
 epoch: 92, train_loss: 0.2298, test_loss: 1.5438, test_f1: 0.6853
 epoch: 93, train_loss: 0.2332, test_loss: 1.4653, test_f1: 0.6956
 epoch: 94, train_loss: 0.2247, test_loss: 1.4216, test_f1: 0.6810
 epoch: 95, train_loss: 0.2361, test_loss: 1.5542, test_f1: 0.6671
 epoch: 96, train_loss: 0.2406, test_loss: 1.5062, test_f1: 0.6735
 epoch: 97, train_loss: 0.2477, test_loss: 1.6256, test_f1: 0.6873
 epoch: 98, train_loss: 0.2050, test_loss: 1.5902, test_f1: 0.6537
 epoch: 99, train_loss: 0.2254, test_loss: 1.5189, test_f1: 0.6631
##################ITERATION #3 ****************************************
 epoch: 0, train_loss: 1.1588, test_loss: 1.1056, test_f1: 0.4636
 epoch: 1, train_loss: 0.9651, test_loss: 0.9596, test_f1: 0.5670
 epoch: 2, train_loss: 0.9275, test_loss: 0.8658, test_f1: 0.5401
 epoch: 3, train_loss: 0.9016, test_loss: 0.8428, test_f1: 0.5458
 epoch: 4, train_loss: 0.8746, test_loss: 0.8593, test_f1: 0.5179
 epoch: 5, train_loss: 0.8600, test_loss: 0.8251, test_f1: 0.5588
 epoch: 6, train_loss: 0.8248, test_loss: 0.8264, test_f1: 0.5520
 epoch: 7, train_loss: 0.8244, test_loss: 0.8097, test_f1: 0.5840
 epoch: 8, train_loss: 0.8121, test_loss: 0.7821, test_f1: 0.5697
 epoch: 9, train_loss: 0.8010, test_loss: 0.8347, test_f1: 0.6203
 epoch: 10, train_loss: 0.7674, test_loss: 0.8189, test_f1: 0.5832
 epoch: 11, train_loss: 0.7615, test_loss: 0.7802, test_f1: 0.6077
 epoch: 12, train_loss: 0.7420, test_loss: 0.7519, test_f1: 0.6147
 epoch: 13, train_loss: 0.7388, test_loss: 0.8086, test_f1: 0.5821
 epoch: 14, train_loss: 0.7065, test_loss: 0.7991, test_f1: 0.5815
 epoch: 15, train_loss: 0.7137, test_loss: 0.7162, test_f1: 0.6438
 epoch: 16, train_loss: 0.6894, test_loss: 0.7856, test_f1: 0.6047
 epoch: 17, train_loss: 0.6833, test_loss: 0.7643, test_f1: 0.6417
 epoch: 18, train_loss: 0.6574, test_loss: 0.7220, test_f1: 0.6420
 epoch: 19, train_loss: 0.6556, test_loss: 0.7800, test_f1: 0.6305
 epoch: 20, train_loss: 0.6601, test_loss: 0.8048, test_f1: 0.6431
 epoch: 21, train_loss: 0.6397, test_loss: 0.7244, test_f1: 0.6537
 epoch: 22, train_loss: 0.6330, test_loss: 0.8288, test_f1: 0.6318
 epoch: 23, train_loss: 0.6300, test_loss: 0.8093, test_f1: 0.6651
 epoch: 24, train_loss: 0.6262, test_loss: 0.8183, test_f1: 0.6439
 epoch: 25, train_loss: 0.6001, test_loss: 0.8141, test_f1: 0.6584
 epoch: 26, train_loss: 0.5896, test_loss: 0.8226, test_f1: 0.6542
 epoch: 27, train_loss: 0.5826, test_loss: 0.8077, test_f1: 0.6435
 epoch: 28, train_loss: 0.5799, test_loss: 0.8832, test_f1: 0.6310
 epoch: 29, train_loss: 0.5819, test_loss: 0.8730, test_f1: 0.6414
 epoch: 30, train_loss: 0.5541, test_loss: 0.9561, test_f1: 0.6397
 epoch: 31, train_loss: 0.5582, test_loss: 0.7979, test_f1: 0.6687
 epoch: 32, train_loss: 0.5567, test_loss: 0.8512, test_f1: 0.6456
 epoch: 33, train_loss: 0.5353, test_loss: 0.8466, test_f1: 0.6677
 epoch: 34, train_loss: 0.5264, test_loss: 0.8919, test_f1: 0.6551
 epoch: 35, train_loss: 0.5126, test_loss: 0.8269, test_f1: 0.6524
 epoch: 36, train_loss: 0.5173, test_loss: 0.9355, test_f1: 0.6473
 epoch: 37, train_loss: 0.5097, test_loss: 0.8646, test_f1: 0.6429
 epoch: 38, train_loss: 0.4821, test_loss: 0.8867, test_f1: 0.6636
 epoch: 39, train_loss: 0.4843, test_loss: 0.9583, test_f1: 0.6338
 epoch: 40, train_loss: 0.4898, test_loss: 0.9049, test_f1: 0.6612
 epoch: 41, train_loss: 0.4911, test_loss: 0.8923, test_f1: 0.6474
 epoch: 42, train_loss: 0.4594, test_loss: 0.9125, test_f1: 0.6568
 epoch: 43, train_loss: 0.4600, test_loss: 0.8748, test_f1: 0.6576
 epoch: 44, train_loss: 0.4579, test_loss: 0.9221, test_f1: 0.6591
 epoch: 45, train_loss: 0.4739, test_loss: 0.9176, test_f1: 0.6553
 epoch: 46, train_loss: 0.4562, test_loss: 0.9783, test_f1: 0.6612
 epoch: 47, train_loss: 0.4339, test_loss: 0.8889, test_f1: 0.6729
 epoch: 48, train_loss: 0.4200, test_loss: 1.0636, test_f1: 0.6517
 epoch: 49, train_loss: 0.4204, test_loss: 0.9851, test_f1: 0.6644
 epoch: 50, train_loss: 0.4187, test_loss: 1.0441, test_f1: 0.6419
 epoch: 51, train_loss: 0.3993, test_loss: 1.0116, test_f1: 0.6649
 epoch: 52, train_loss: 0.3749, test_loss: 0.9567, test_f1: 0.6732
 epoch: 53, train_loss: 0.3636, test_loss: 1.0392, test_f1: 0.6746
 epoch: 54, train_loss: 0.3591, test_loss: 1.0957, test_f1: 0.6595
 epoch: 55, train_loss: 0.3676, test_loss: 1.0133, test_f1: 0.6694
 epoch: 56, train_loss: 0.3530, test_loss: 1.1151, test_f1: 0.6433
 epoch: 57, train_loss: 0.3457, test_loss: 1.1090, test_f1: 0.6526
 epoch: 58, train_loss: 0.3526, test_loss: 1.0849, test_f1: 0.6656
 epoch: 59, train_loss: 0.3297, test_loss: 1.1811, test_f1: 0.6496
 epoch: 60, train_loss: 0.3296, test_loss: 1.1502, test_f1: 0.6672
 epoch: 61, train_loss: 0.3205, test_loss: 1.1782, test_f1: 0.6707
 epoch: 62, train_loss: 0.3463, test_loss: 1.1856, test_f1: 0.6662
 epoch: 63, train_loss: 0.3050, test_loss: 1.2019, test_f1: 0.6482
 epoch: 64, train_loss: 0.3101, test_loss: 1.1738, test_f1: 0.6752
 epoch: 65, train_loss: 0.2992, test_loss: 1.2598, test_f1: 0.6589
 epoch: 66, train_loss: 0.3217, test_loss: 1.1943, test_f1: 0.6637
 epoch: 67, train_loss: 0.3082, test_loss: 1.2736, test_f1: 0.6642
 epoch: 68, train_loss: 0.3234, test_loss: 1.1819, test_f1: 0.6540
 epoch: 69, train_loss: 0.3285, test_loss: 1.3068, test_f1: 0.6515
 epoch: 70, train_loss: 0.2981, test_loss: 1.3172, test_f1: 0.6620
 epoch: 71, train_loss: 0.3081, test_loss: 1.2765, test_f1: 0.6616
 epoch: 72, train_loss: 0.2912, test_loss: 1.3706, test_f1: 0.6594
 epoch: 73, train_loss: 0.2716, test_loss: 1.2916, test_f1: 0.6825
 epoch: 74, train_loss: 0.2923, test_loss: 1.2606, test_f1: 0.6686
 epoch: 75, train_loss: 0.2819, test_loss: 1.3788, test_f1: 0.6618
 epoch: 76, train_loss: 0.2981, test_loss: 1.3189, test_f1: 0.6649
 epoch: 77, train_loss: 0.2974, test_loss: 1.2826, test_f1: 0.6525
 epoch: 78, train_loss: 0.3023, test_loss: 1.3437, test_f1: 0.6665
 epoch: 79, train_loss: 0.2912, test_loss: 1.3476, test_f1: 0.6505
 epoch: 80, train_loss: 0.2767, test_loss: 1.2598, test_f1: 0.6656
 epoch: 81, train_loss: 0.2706, test_loss: 1.4204, test_f1: 0.6630
 epoch: 82, train_loss: 0.2633, test_loss: 1.3136, test_f1: 0.6616
 epoch: 83, train_loss: 0.2650, test_loss: 1.4159, test_f1: 0.6523
 epoch: 84, train_loss: 0.2669, test_loss: 1.4513, test_f1: 0.6585
 epoch: 85, train_loss: 0.2538, test_loss: 1.4770, test_f1: 0.6565
 epoch: 86, train_loss: 0.2759, test_loss: 1.5706, test_f1: 0.6560
 epoch: 87, train_loss: 0.2621, test_loss: 1.5063, test_f1: 0.6632
 epoch: 88, train_loss: 0.2614, test_loss: 1.4274, test_f1: 0.6801
 epoch: 89, train_loss: 0.2681, test_loss: 1.3947, test_f1: 0.6625
 epoch: 90, train_loss: 0.2437, test_loss: 1.5281, test_f1: 0.6540
 epoch: 91, train_loss: 0.2465, test_loss: 1.6033, test_f1: 0.6630
 epoch: 92, train_loss: 0.2638, test_loss: 1.5222, test_f1: 0.6598
 epoch: 93, train_loss: 0.2491, test_loss: 1.6450, test_f1: 0.6491
 epoch: 94, train_loss: 0.2575, test_loss: 1.4682, test_f1: 0.6636
 epoch: 95, train_loss: 0.2533, test_loss: 1.4461, test_f1: 0.6554
 epoch: 96, train_loss: 0.2406, test_loss: 1.5570, test_f1: 0.6569
 epoch: 97, train_loss: 0.2335, test_loss: 1.5627, test_f1: 0.6665
 epoch: 98, train_loss: 0.2349, test_loss: 1.5249, test_f1: 0.6771
 epoch: 99, train_loss: 0.2408, test_loss: 1.4796, test_f1: 0.6703
##################ITERATION #4 ****************************************
 epoch: 0, train_loss: 1.2553, test_loss: 1.0538, test_f1: 0.4102
 epoch: 1, train_loss: 1.0136, test_loss: 0.9534, test_f1: 0.4918
 epoch: 2, train_loss: 0.9466, test_loss: 0.9555, test_f1: 0.5046
 epoch: 3, train_loss: 0.9104, test_loss: 0.9386, test_f1: 0.5231
 epoch: 4, train_loss: 0.8871, test_loss: 0.9484, test_f1: 0.5208
 epoch: 5, train_loss: 0.8611, test_loss: 0.8369, test_f1: 0.5574
 epoch: 6, train_loss: 0.8552, test_loss: 0.8272, test_f1: 0.5390
 epoch: 7, train_loss: 0.8416, test_loss: 0.8194, test_f1: 0.5953
 epoch: 8, train_loss: 0.8081, test_loss: 0.8261, test_f1: 0.5711
 epoch: 9, train_loss: 0.7963, test_loss: 0.7606, test_f1: 0.6444
 epoch: 10, train_loss: 0.7667, test_loss: 0.8013, test_f1: 0.5965
 epoch: 11, train_loss: 0.7566, test_loss: 0.7774, test_f1: 0.6013
 epoch: 12, train_loss: 0.7390, test_loss: 0.8004, test_f1: 0.5774
 epoch: 13, train_loss: 0.7397, test_loss: 0.8028, test_f1: 0.6082
 epoch: 14, train_loss: 0.7493, test_loss: 0.8079, test_f1: 0.6200
 epoch: 15, train_loss: 0.7243, test_loss: 0.7681, test_f1: 0.5853
 epoch: 16, train_loss: 0.7047, test_loss: 0.7326, test_f1: 0.6460
 epoch: 17, train_loss: 0.6906, test_loss: 0.7847, test_f1: 0.6469
 epoch: 18, train_loss: 0.6899, test_loss: 0.7618, test_f1: 0.6311
 epoch: 19, train_loss: 0.6641, test_loss: 0.7576, test_f1: 0.6109
 epoch: 20, train_loss: 0.6624, test_loss: 0.7891, test_f1: 0.6279
 epoch: 21, train_loss: 0.6611, test_loss: 0.7551, test_f1: 0.6421
 epoch: 22, train_loss: 0.6294, test_loss: 0.7278, test_f1: 0.6872
 epoch: 23, train_loss: 0.6264, test_loss: 0.8192, test_f1: 0.6546
 epoch: 24, train_loss: 0.6361, test_loss: 0.8833, test_f1: 0.6134
 epoch: 25, train_loss: 0.6274, test_loss: 0.7808, test_f1: 0.6394
 epoch: 26, train_loss: 0.6084, test_loss: 0.7669, test_f1: 0.6262
 epoch: 27, train_loss: 0.6107, test_loss: 0.7980, test_f1: 0.6710
 epoch: 28, train_loss: 0.5994, test_loss: 0.8353, test_f1: 0.6521
 epoch: 29, train_loss: 0.5848, test_loss: 0.7153, test_f1: 0.6645
 epoch: 30, train_loss: 0.5551, test_loss: 0.8175, test_f1: 0.6480
 epoch: 31, train_loss: 0.5819, test_loss: 0.7687, test_f1: 0.6544
 epoch: 32, train_loss: 0.5908, test_loss: 0.7599, test_f1: 0.6854
 epoch: 33, train_loss: 0.5721, test_loss: 0.6740, test_f1: 0.6738
 epoch: 34, train_loss: 0.5468, test_loss: 0.8223, test_f1: 0.6750
 epoch: 35, train_loss: 0.5464, test_loss: 0.7040, test_f1: 0.6505
 epoch: 36, train_loss: 0.5452, test_loss: 0.6728, test_f1: 0.6767
 epoch: 37, train_loss: 0.5402, test_loss: 0.8695, test_f1: 0.6613
 epoch: 38, train_loss: 0.5333, test_loss: 0.7891, test_f1: 0.6852
 epoch: 39, train_loss: 0.5171, test_loss: 0.8470, test_f1: 0.6626
 epoch: 40, train_loss: 0.5229, test_loss: 0.8140, test_f1: 0.6893
 epoch: 41, train_loss: 0.5111, test_loss: 0.9045, test_f1: 0.6708
 epoch: 42, train_loss: 0.5199, test_loss: 0.8067, test_f1: 0.6702
 epoch: 43, train_loss: 0.4946, test_loss: 0.8673, test_f1: 0.6614
 epoch: 44, train_loss: 0.4984, test_loss: 0.8286, test_f1: 0.6722
 epoch: 45, train_loss: 0.4845, test_loss: 0.8885, test_f1: 0.6631
 epoch: 46, train_loss: 0.5021, test_loss: 0.9133, test_f1: 0.6700
 epoch: 47, train_loss: 0.4878, test_loss: 0.8814, test_f1: 0.6496
 epoch: 48, train_loss: 0.4816, test_loss: 0.9593, test_f1: 0.6459
 epoch: 49, train_loss: 0.4660, test_loss: 0.9129, test_f1: 0.6583
 epoch: 50, train_loss: 0.4615, test_loss: 0.8749, test_f1: 0.7012
 epoch: 51, train_loss: 0.4093, test_loss: 0.9376, test_f1: 0.6822
 epoch: 52, train_loss: 0.3949, test_loss: 0.9598, test_f1: 0.6663
 epoch: 53, train_loss: 0.3907, test_loss: 0.9973, test_f1: 0.6674
 epoch: 54, train_loss: 0.3936, test_loss: 0.9644, test_f1: 0.6575
 epoch: 55, train_loss: 0.3853, test_loss: 0.9533, test_f1: 0.6991
 epoch: 56, train_loss: 0.3716, test_loss: 0.9223, test_f1: 0.6825
 epoch: 57, train_loss: 0.3569, test_loss: 0.8855, test_f1: 0.6815
 epoch: 58, train_loss: 0.3747, test_loss: 1.0057, test_f1: 0.6757
 epoch: 59, train_loss: 0.3528, test_loss: 0.9681, test_f1: 0.6785
 epoch: 60, train_loss: 0.3500, test_loss: 1.0224, test_f1: 0.6830
 epoch: 61, train_loss: 0.3491, test_loss: 1.0550, test_f1: 0.6799
 epoch: 62, train_loss: 0.3498, test_loss: 1.1230, test_f1: 0.6736
 epoch: 63, train_loss: 0.3579, test_loss: 1.0215, test_f1: 0.6536
 epoch: 64, train_loss: 0.3479, test_loss: 1.1108, test_f1: 0.6788
 epoch: 65, train_loss: 0.3433, test_loss: 1.0312, test_f1: 0.6865
 epoch: 66, train_loss: 0.3326, test_loss: 1.0876, test_f1: 0.6826
 epoch: 67, train_loss: 0.3370, test_loss: 1.0845, test_f1: 0.6737
 epoch: 68, train_loss: 0.3395, test_loss: 1.1060, test_f1: 0.6870
 epoch: 69, train_loss: 0.3432, test_loss: 1.1852, test_f1: 0.6625
 epoch: 70, train_loss: 0.3265, test_loss: 1.1702, test_f1: 0.6851
 epoch: 71, train_loss: 0.3290, test_loss: 1.1336, test_f1: 0.6834
 epoch: 72, train_loss: 0.3239, test_loss: 1.1313, test_f1: 0.6771
 epoch: 73, train_loss: 0.3255, test_loss: 1.1996, test_f1: 0.6701
 epoch: 74, train_loss: 0.3027, test_loss: 1.1145, test_f1: 0.6824
 epoch: 75, train_loss: 0.3140, test_loss: 1.1750, test_f1: 0.6828
 epoch: 76, train_loss: 0.2927, test_loss: 1.1595, test_f1: 0.6895
 epoch: 77, train_loss: 0.3192, test_loss: 1.1593, test_f1: 0.6822
 epoch: 78, train_loss: 0.2931, test_loss: 1.1394, test_f1: 0.6737
 epoch: 79, train_loss: 0.2891, test_loss: 1.1813, test_f1: 0.6758
 epoch: 80, train_loss: 0.3060, test_loss: 1.1439, test_f1: 0.6828
 epoch: 81, train_loss: 0.3066, test_loss: 1.1919, test_f1: 0.6832
 epoch: 82, train_loss: 0.2864, test_loss: 1.2985, test_f1: 0.6798
 epoch: 83, train_loss: 0.2925, test_loss: 1.2241, test_f1: 0.6656
 epoch: 84, train_loss: 0.2886, test_loss: 1.2482, test_f1: 0.6953
 epoch: 85, train_loss: 0.3028, test_loss: 1.2097, test_f1: 0.6800
 epoch: 86, train_loss: 0.2815, test_loss: 1.2261, test_f1: 0.6988
 epoch: 87, train_loss: 0.2899, test_loss: 1.2280, test_f1: 0.6859
 epoch: 88, train_loss: 0.2701, test_loss: 1.2104, test_f1: 0.6874
 epoch: 89, train_loss: 0.2879, test_loss: 1.3124, test_f1: 0.6724
 epoch: 90, train_loss: 0.2697, test_loss: 1.2658, test_f1: 0.6810
 epoch: 91, train_loss: 0.2835, test_loss: 1.3491, test_f1: 0.6738
 epoch: 92, train_loss: 0.3094, test_loss: 1.2924, test_f1: 0.6733
 epoch: 93, train_loss: 0.2675, test_loss: 1.2478, test_f1: 0.6825
 epoch: 94, train_loss: 0.2632, test_loss: 1.3283, test_f1: 0.6698
 epoch: 95, train_loss: 0.2583, test_loss: 1.3674, test_f1: 0.6762
 epoch: 96, train_loss: 0.2645, test_loss: 1.3577, test_f1: 0.6726
 epoch: 97, train_loss: 0.2767, test_loss: 1.3911, test_f1: 0.6586
 epoch: 98, train_loss: 0.2428, test_loss: 1.3827, test_f1: 0.6777
 epoch: 99, train_loss: 0.2638, test_loss: 1.4155, test_f1: 0.6607
##################ITERATION #5 ****************************************
 epoch: 0, train_loss: 1.2523, test_loss: 1.0853, test_f1: 0.4660
 epoch: 1, train_loss: 1.0203, test_loss: 0.9693, test_f1: 0.5569
 epoch: 2, train_loss: 0.9705, test_loss: 0.9425, test_f1: 0.4868
 epoch: 3, train_loss: 0.9258, test_loss: 0.9113, test_f1: 0.5549
 epoch: 4, train_loss: 0.9052, test_loss: 0.9259, test_f1: 0.5545
 epoch: 5, train_loss: 0.8738, test_loss: 0.8730, test_f1: 0.5899
 epoch: 6, train_loss: 0.8724, test_loss: 0.8192, test_f1: 0.5698
 epoch: 7, train_loss: 0.8354, test_loss: 0.8365, test_f1: 0.5814
 epoch: 8, train_loss: 0.8239, test_loss: 0.8089, test_f1: 0.5924
 epoch: 9, train_loss: 0.7999, test_loss: 0.7862, test_f1: 0.6018
 epoch: 10, train_loss: 0.7917, test_loss: 0.7870, test_f1: 0.5709
 epoch: 11, train_loss: 0.7714, test_loss: 0.7709, test_f1: 0.6138
 epoch: 12, train_loss: 0.7525, test_loss: 0.7513, test_f1: 0.6195
 epoch: 13, train_loss: 0.7468, test_loss: 0.7686, test_f1: 0.6523
 epoch: 14, train_loss: 0.7417, test_loss: 0.7417, test_f1: 0.6760
 epoch: 15, train_loss: 0.7314, test_loss: 0.7227, test_f1: 0.6628
 epoch: 16, train_loss: 0.7154, test_loss: 0.7905, test_f1: 0.6004
 epoch: 17, train_loss: 0.7035, test_loss: 0.7503, test_f1: 0.6431
 epoch: 18, train_loss: 0.6911, test_loss: 0.7810, test_f1: 0.6316
 epoch: 19, train_loss: 0.6509, test_loss: 0.7496, test_f1: 0.6581
 epoch: 20, train_loss: 0.6741, test_loss: 0.7436, test_f1: 0.6685
 epoch: 21, train_loss: 0.6547, test_loss: 0.7420, test_f1: 0.6593
 epoch: 22, train_loss: 0.6440, test_loss: 0.7672, test_f1: 0.6465
 epoch: 23, train_loss: 0.6455, test_loss: 0.6980, test_f1: 0.6669
 epoch: 24, train_loss: 0.6319, test_loss: 0.7497, test_f1: 0.6775
 epoch: 25, train_loss: 0.6194, test_loss: 0.7300, test_f1: 0.6914
 epoch: 26, train_loss: 0.6082, test_loss: 0.7127, test_f1: 0.6688
 epoch: 27, train_loss: 0.6110, test_loss: 0.7435, test_f1: 0.6687
 epoch: 28, train_loss: 0.5844, test_loss: 0.7427, test_f1: 0.6846
 epoch: 29, train_loss: 0.5911, test_loss: 0.7139, test_f1: 0.6950
 epoch: 30, train_loss: 0.5769, test_loss: 0.8270, test_f1: 0.6426
 epoch: 31, train_loss: 0.5641, test_loss: 0.7818, test_f1: 0.6941
 epoch: 32, train_loss: 0.5615, test_loss: 0.7544, test_f1: 0.6755
 epoch: 33, train_loss: 0.5603, test_loss: 0.7691, test_f1: 0.6630
 epoch: 34, train_loss: 0.5379, test_loss: 0.8298, test_f1: 0.6734
 epoch: 35, train_loss: 0.5386, test_loss: 0.8190, test_f1: 0.6765
 epoch: 36, train_loss: 0.5297, test_loss: 0.8068, test_f1: 0.6441
 epoch: 37, train_loss: 0.5276, test_loss: 0.7303, test_f1: 0.6885
 epoch: 38, train_loss: 0.5132, test_loss: 0.7446, test_f1: 0.6888
 epoch: 39, train_loss: 0.4952, test_loss: 0.8406, test_f1: 0.6684
 epoch: 40, train_loss: 0.4897, test_loss: 1.0322, test_f1: 0.6385
 epoch: 41, train_loss: 0.5029, test_loss: 0.8447, test_f1: 0.6788
 epoch: 42, train_loss: 0.5003, test_loss: 0.8139, test_f1: 0.6909
 epoch: 43, train_loss: 0.4795, test_loss: 0.8778, test_f1: 0.6807
 epoch: 44, train_loss: 0.4892, test_loss: 0.8049, test_f1: 0.6840
 epoch: 45, train_loss: 0.4793, test_loss: 0.8735, test_f1: 0.6725
 epoch: 46, train_loss: 0.4763, test_loss: 0.8930, test_f1: 0.6630
 epoch: 47, train_loss: 0.4583, test_loss: 0.9208, test_f1: 0.6860
 epoch: 48, train_loss: 0.4473, test_loss: 0.8463, test_f1: 0.6998
 epoch: 49, train_loss: 0.4692, test_loss: 0.9399, test_f1: 0.6561
 epoch: 50, train_loss: 0.4369, test_loss: 0.9102, test_f1: 0.6886
 epoch: 51, train_loss: 0.4188, test_loss: 0.9016, test_f1: 0.7015
 epoch: 52, train_loss: 0.4150, test_loss: 0.9416, test_f1: 0.6693
 epoch: 53, train_loss: 0.3728, test_loss: 0.9094, test_f1: 0.6834
 epoch: 54, train_loss: 0.3804, test_loss: 0.9294, test_f1: 0.7068
 epoch: 55, train_loss: 0.3599, test_loss: 1.0050, test_f1: 0.6673
 epoch: 56, train_loss: 0.3585, test_loss: 0.9425, test_f1: 0.7067
 epoch: 57, train_loss: 0.3692, test_loss: 0.9517, test_f1: 0.6751
 epoch: 58, train_loss: 0.3635, test_loss: 0.9757, test_f1: 0.6663
 epoch: 59, train_loss: 0.3708, test_loss: 0.9591, test_f1: 0.6625
 epoch: 60, train_loss: 0.3502, test_loss: 1.0420, test_f1: 0.6714
 epoch: 61, train_loss: 0.3442, test_loss: 0.9395, test_f1: 0.6839
 epoch: 62, train_loss: 0.3286, test_loss: 1.0264, test_f1: 0.6739
 epoch: 63, train_loss: 0.3382, test_loss: 1.0530, test_f1: 0.6838
 epoch: 64, train_loss: 0.3386, test_loss: 1.0053, test_f1: 0.6722
 epoch: 65, train_loss: 0.3301, test_loss: 1.1279, test_f1: 0.6644
 epoch: 66, train_loss: 0.3492, test_loss: 1.0531, test_f1: 0.6718
 epoch: 67, train_loss: 0.3395, test_loss: 1.0668, test_f1: 0.6830
 epoch: 68, train_loss: 0.3212, test_loss: 1.0430, test_f1: 0.6820
 epoch: 69, train_loss: 0.3220, test_loss: 1.0270, test_f1: 0.6923
 epoch: 70, train_loss: 0.3294, test_loss: 1.0506, test_f1: 0.6697
 epoch: 71, train_loss: 0.3132, test_loss: 1.0224, test_f1: 0.6990
 epoch: 72, train_loss: 0.3075, test_loss: 1.0237, test_f1: 0.6937
 epoch: 73, train_loss: 0.3014, test_loss: 1.0819, test_f1: 0.6664
 epoch: 74, train_loss: 0.3084, test_loss: 1.1369, test_f1: 0.6777
 epoch: 75, train_loss: 0.2934, test_loss: 1.0638, test_f1: 0.6978
 epoch: 76, train_loss: 0.3057, test_loss: 1.1248, test_f1: 0.6654
 epoch: 77, train_loss: 0.3022, test_loss: 1.1963, test_f1: 0.6739
 epoch: 78, train_loss: 0.2983, test_loss: 1.2181, test_f1: 0.6524
 epoch: 79, train_loss: 0.2952, test_loss: 1.1461, test_f1: 0.6593
 epoch: 80, train_loss: 0.3024, test_loss: 1.1427, test_f1: 0.6667
 epoch: 81, train_loss: 0.3007, test_loss: 1.1521, test_f1: 0.6784
 epoch: 82, train_loss: 0.2930, test_loss: 1.0875, test_f1: 0.6726
 epoch: 83, train_loss: 0.2884, test_loss: 1.2558, test_f1: 0.6509
 epoch: 84, train_loss: 0.2759, test_loss: 1.2170, test_f1: 0.6815
 epoch: 85, train_loss: 0.2804, test_loss: 1.1770, test_f1: 0.6688
 epoch: 86, train_loss: 0.2712, test_loss: 1.1163, test_f1: 0.6810
 epoch: 87, train_loss: 0.2809, test_loss: 1.1078, test_f1: 0.6800
 epoch: 88, train_loss: 0.3036, test_loss: 1.1860, test_f1: 0.6595
 epoch: 89, train_loss: 0.2876, test_loss: 1.1712, test_f1: 0.6850
 epoch: 90, train_loss: 0.2768, test_loss: 1.1807, test_f1: 0.6708
 epoch: 91, train_loss: 0.2662, test_loss: 1.2919, test_f1: 0.6787
 epoch: 92, train_loss: 0.2479, test_loss: 1.2061, test_f1: 0.6678
 epoch: 93, train_loss: 0.2527, test_loss: 1.3001, test_f1: 0.6702
 epoch: 94, train_loss: 0.2908, test_loss: 1.2314, test_f1: 0.6850
 epoch: 95, train_loss: 0.2674, test_loss: 1.2485, test_f1: 0.6763
 epoch: 96, train_loss: 0.2548, test_loss: 1.3153, test_f1: 0.6636
 epoch: 97, train_loss: 0.2456, test_loss: 1.3916, test_f1: 0.6657
 epoch: 98, train_loss: 0.2821, test_loss: 1.2395, test_f1: 0.7019
 epoch: 99, train_loss: 0.2553, test_loss: 1.2486, test_f1: 0.6779
##################ITERATION #6 ****************************************
 epoch: 0, train_loss: 1.2910, test_loss: 1.2533, test_f1: 0.4212
 epoch: 1, train_loss: 1.0111, test_loss: 0.9618, test_f1: 0.5448
 epoch: 2, train_loss: 0.9547, test_loss: 0.8877, test_f1: 0.5291
 epoch: 3, train_loss: 0.9315, test_loss: 0.9621, test_f1: 0.5356
 epoch: 4, train_loss: 0.8909, test_loss: 0.8908, test_f1: 0.5595
 epoch: 5, train_loss: 0.8653, test_loss: 0.8356, test_f1: 0.5834
 epoch: 6, train_loss: 0.8511, test_loss: 0.8776, test_f1: 0.5873
 epoch: 7, train_loss: 0.8433, test_loss: 0.8619, test_f1: 0.5846
 epoch: 8, train_loss: 0.8269, test_loss: 0.8285, test_f1: 0.5576
 epoch: 9, train_loss: 0.7914, test_loss: 0.8434, test_f1: 0.5944
 epoch: 10, train_loss: 0.7810, test_loss: 0.8180, test_f1: 0.6049
 epoch: 11, train_loss: 0.7839, test_loss: 0.8330, test_f1: 0.5843
 epoch: 12, train_loss: 0.7755, test_loss: 0.8173, test_f1: 0.6002
 epoch: 13, train_loss: 0.7478, test_loss: 0.7878, test_f1: 0.6156
 epoch: 14, train_loss: 0.7307, test_loss: 0.8605, test_f1: 0.6089
 epoch: 15, train_loss: 0.7253, test_loss: 0.8517, test_f1: 0.6027
 epoch: 16, train_loss: 0.7168, test_loss: 0.7620, test_f1: 0.6086
 epoch: 17, train_loss: 0.7085, test_loss: 0.6987, test_f1: 0.6842
 epoch: 18, train_loss: 0.6945, test_loss: 0.7239, test_f1: 0.6454
 epoch: 19, train_loss: 0.6778, test_loss: 0.7613, test_f1: 0.6215
 epoch: 20, train_loss: 0.6666, test_loss: 0.7383, test_f1: 0.6593
 epoch: 21, train_loss: 0.6616, test_loss: 0.8053, test_f1: 0.6667
 epoch: 22, train_loss: 0.6484, test_loss: 0.8146, test_f1: 0.6501
 epoch: 23, train_loss: 0.6357, test_loss: 0.7736, test_f1: 0.6572
 epoch: 24, train_loss: 0.6296, test_loss: 0.7726, test_f1: 0.6481
 epoch: 25, train_loss: 0.6221, test_loss: 0.7606, test_f1: 0.6320
 epoch: 26, train_loss: 0.6068, test_loss: 0.7726, test_f1: 0.6452
 epoch: 27, train_loss: 0.5832, test_loss: 0.8326, test_f1: 0.6374
 epoch: 28, train_loss: 0.5908, test_loss: 0.9099, test_f1: 0.6352
 epoch: 29, train_loss: 0.6123, test_loss: 0.7982, test_f1: 0.6508
 epoch: 30, train_loss: 0.5751, test_loss: 0.8149, test_f1: 0.6371
 epoch: 31, train_loss: 0.5672, test_loss: 0.9117, test_f1: 0.6233
 epoch: 32, train_loss: 0.5548, test_loss: 0.8756, test_f1: 0.6247
 epoch: 33, train_loss: 0.5695, test_loss: 0.8907, test_f1: 0.6436
 epoch: 34, train_loss: 0.5430, test_loss: 0.9358, test_f1: 0.6361
 epoch: 35, train_loss: 0.5268, test_loss: 0.9633, test_f1: 0.6514
 epoch: 36, train_loss: 0.5459, test_loss: 0.9182, test_f1: 0.6478
 epoch: 37, train_loss: 0.5204, test_loss: 0.8341, test_f1: 0.6742
 epoch: 38, train_loss: 0.5201, test_loss: 0.8976, test_f1: 0.6433
 epoch: 39, train_loss: 0.5192, test_loss: 0.7995, test_f1: 0.6541
 epoch: 40, train_loss: 0.5227, test_loss: 0.8533, test_f1: 0.6635
 epoch: 41, train_loss: 0.5050, test_loss: 0.9106, test_f1: 0.6472
 epoch: 42, train_loss: 0.4954, test_loss: 0.9558, test_f1: 0.6628
 epoch: 43, train_loss: 0.4788, test_loss: 0.8857, test_f1: 0.6639
 epoch: 44, train_loss: 0.4925, test_loss: 0.8854, test_f1: 0.6565
 epoch: 45, train_loss: 0.4654, test_loss: 1.1055, test_f1: 0.6333
 epoch: 46, train_loss: 0.4856, test_loss: 0.9248, test_f1: 0.6543
 epoch: 47, train_loss: 0.4837, test_loss: 0.9445, test_f1: 0.6543
 epoch: 48, train_loss: 0.4676, test_loss: 0.9758, test_f1: 0.6743
 epoch: 49, train_loss: 0.4643, test_loss: 0.9754, test_f1: 0.6567
 epoch: 50, train_loss: 0.4585, test_loss: 0.9358, test_f1: 0.6877
 epoch: 51, train_loss: 0.4244, test_loss: 0.9264, test_f1: 0.6840
 epoch: 52, train_loss: 0.3893, test_loss: 1.0095, test_f1: 0.6608
 epoch: 53, train_loss: 0.3884, test_loss: 0.9354, test_f1: 0.6862
 epoch: 54, train_loss: 0.3849, test_loss: 1.0167, test_f1: 0.6655
 epoch: 55, train_loss: 0.3652, test_loss: 1.1070, test_f1: 0.6504
 epoch: 56, train_loss: 0.3470, test_loss: 1.1070, test_f1: 0.6648
 epoch: 57, train_loss: 0.3516, test_loss: 1.1226, test_f1: 0.6552
 epoch: 58, train_loss: 0.3457, test_loss: 1.2017, test_f1: 0.6741
 epoch: 59, train_loss: 0.3539, test_loss: 1.1045, test_f1: 0.6643
 epoch: 60, train_loss: 0.3404, test_loss: 1.0733, test_f1: 0.6688
 epoch: 61, train_loss: 0.3396, test_loss: 1.1562, test_f1: 0.6698
 epoch: 62, train_loss: 0.3476, test_loss: 1.1727, test_f1: 0.6681
 epoch: 63, train_loss: 0.3387, test_loss: 1.2068, test_f1: 0.6546
 epoch: 64, train_loss: 0.3393, test_loss: 1.1602, test_f1: 0.6696
 epoch: 65, train_loss: 0.3403, test_loss: 1.1833, test_f1: 0.6776
 epoch: 66, train_loss: 0.3273, test_loss: 1.1806, test_f1: 0.6696
 epoch: 67, train_loss: 0.3366, test_loss: 1.2080, test_f1: 0.6573
 epoch: 68, train_loss: 0.3330, test_loss: 1.1247, test_f1: 0.6600
 epoch: 69, train_loss: 0.3205, test_loss: 1.1889, test_f1: 0.6472
 epoch: 70, train_loss: 0.3168, test_loss: 1.2189, test_f1: 0.6696
 epoch: 71, train_loss: 0.2929, test_loss: 1.3235, test_f1: 0.6563
 epoch: 72, train_loss: 0.2991, test_loss: 1.2827, test_f1: 0.6662
 epoch: 73, train_loss: 0.3131, test_loss: 1.3371, test_f1: 0.6722
 epoch: 74, train_loss: 0.3095, test_loss: 1.2557, test_f1: 0.6617
 epoch: 75, train_loss: 0.3111, test_loss: 1.3199, test_f1: 0.6715
 epoch: 76, train_loss: 0.3039, test_loss: 1.3135, test_f1: 0.6677
 epoch: 77, train_loss: 0.2953, test_loss: 1.2741, test_f1: 0.6737
 epoch: 78, train_loss: 0.2949, test_loss: 1.2881, test_f1: 0.6780
 epoch: 79, train_loss: 0.2939, test_loss: 1.3342, test_f1: 0.6601
 epoch: 80, train_loss: 0.2930, test_loss: 1.2669, test_f1: 0.6625
 epoch: 81, train_loss: 0.2771, test_loss: 1.3111, test_f1: 0.6690
 epoch: 82, train_loss: 0.2801, test_loss: 1.4508, test_f1: 0.6570
 epoch: 83, train_loss: 0.3012, test_loss: 1.2968, test_f1: 0.6872
 epoch: 84, train_loss: 0.2806, test_loss: 1.2808, test_f1: 0.6620
 epoch: 85, train_loss: 0.2729, test_loss: 1.5052, test_f1: 0.6611
 epoch: 86, train_loss: 0.2890, test_loss: 1.3930, test_f1: 0.6681
 epoch: 87, train_loss: 0.2887, test_loss: 1.4125, test_f1: 0.6603
 epoch: 88, train_loss: 0.2754, test_loss: 1.5729, test_f1: 0.6672
 epoch: 89, train_loss: 0.2618, test_loss: 1.4267, test_f1: 0.6749
 epoch: 90, train_loss: 0.2814, test_loss: 1.4443, test_f1: 0.6734
 epoch: 91, train_loss: 0.2503, test_loss: 1.5335, test_f1: 0.6651
 epoch: 92, train_loss: 0.2809, test_loss: 1.4950, test_f1: 0.6546
 epoch: 93, train_loss: 0.2542, test_loss: 1.4485, test_f1: 0.6657
 epoch: 94, train_loss: 0.2776, test_loss: 1.5379, test_f1: 0.6546
 epoch: 95, train_loss: 0.2705, test_loss: 1.4693, test_f1: 0.6464
 epoch: 96, train_loss: 0.2575, test_loss: 1.4260, test_f1: 0.6605
 epoch: 97, train_loss: 0.2521, test_loss: 1.4725, test_f1: 0.6536
 epoch: 98, train_loss: 0.2600, test_loss: 1.5430, test_f1: 0.6666
 epoch: 99, train_loss: 0.2521, test_loss: 1.5505, test_f1: 0.6542
##################ITERATION #7 ****************************************
 epoch: 0, train_loss: 1.3216, test_loss: 1.1397, test_f1: 0.3751
 epoch: 1, train_loss: 1.0011, test_loss: 0.9279, test_f1: 0.5305
 epoch: 2, train_loss: 0.9721, test_loss: 0.9068, test_f1: 0.5276
 epoch: 3, train_loss: 0.9432, test_loss: 0.9073, test_f1: 0.5411
 epoch: 4, train_loss: 0.9085, test_loss: 0.8774, test_f1: 0.5441
 epoch: 5, train_loss: 0.8717, test_loss: 0.8921, test_f1: 0.5280
 epoch: 6, train_loss: 0.8753, test_loss: 0.9004, test_f1: 0.5503
 epoch: 7, train_loss: 0.8593, test_loss: 0.8049, test_f1: 0.5896
 epoch: 8, train_loss: 0.8424, test_loss: 0.8427, test_f1: 0.5823
 epoch: 9, train_loss: 0.8060, test_loss: 0.8426, test_f1: 0.5787
 epoch: 10, train_loss: 0.8077, test_loss: 0.8181, test_f1: 0.5729
 epoch: 11, train_loss: 0.7910, test_loss: 0.8094, test_f1: 0.5927
 epoch: 12, train_loss: 0.7858, test_loss: 0.7808, test_f1: 0.6152
 epoch: 13, train_loss: 0.7630, test_loss: 0.8257, test_f1: 0.5988
 epoch: 14, train_loss: 0.7638, test_loss: 0.7593, test_f1: 0.6200
 epoch: 15, train_loss: 0.7515, test_loss: 0.7838, test_f1: 0.6423
 epoch: 16, train_loss: 0.7256, test_loss: 0.8017, test_f1: 0.6024
 epoch: 17, train_loss: 0.7167, test_loss: 0.8055, test_f1: 0.5913
 epoch: 18, train_loss: 0.7305, test_loss: 0.8344, test_f1: 0.6419
 epoch: 19, train_loss: 0.7063, test_loss: 0.8231, test_f1: 0.6114
 epoch: 20, train_loss: 0.6796, test_loss: 0.7614, test_f1: 0.6409
 epoch: 21, train_loss: 0.6912, test_loss: 0.8234, test_f1: 0.6191
 epoch: 22, train_loss: 0.6875, test_loss: 0.8211, test_f1: 0.6131
 epoch: 23, train_loss: 0.6779, test_loss: 0.7942, test_f1: 0.6451
 epoch: 24, train_loss: 0.6605, test_loss: 0.7383, test_f1: 0.6216
 epoch: 25, train_loss: 0.6564, test_loss: 0.7935, test_f1: 0.6257
 epoch: 26, train_loss: 0.6419, test_loss: 0.8386, test_f1: 0.6402
 epoch: 27, train_loss: 0.6329, test_loss: 0.7699, test_f1: 0.6482
 epoch: 28, train_loss: 0.6108, test_loss: 0.8585, test_f1: 0.6171
 epoch: 29, train_loss: 0.6195, test_loss: 0.8041, test_f1: 0.6440
 epoch: 30, train_loss: 0.5961, test_loss: 0.7880, test_f1: 0.6291
 epoch: 31, train_loss: 0.5824, test_loss: 0.8505, test_f1: 0.6078
 epoch: 32, train_loss: 0.5955, test_loss: 0.8023, test_f1: 0.6334
 epoch: 33, train_loss: 0.5798, test_loss: 0.8398, test_f1: 0.6116
 epoch: 34, train_loss: 0.5833, test_loss: 0.8371, test_f1: 0.6310
 epoch: 35, train_loss: 0.5678, test_loss: 0.7670, test_f1: 0.6667
 epoch: 36, train_loss: 0.5564, test_loss: 0.8414, test_f1: 0.6518
 epoch: 37, train_loss: 0.5594, test_loss: 0.7955, test_f1: 0.6576
 epoch: 38, train_loss: 0.5474, test_loss: 0.8885, test_f1: 0.6362
 epoch: 39, train_loss: 0.5407, test_loss: 0.8289, test_f1: 0.6489
 epoch: 40, train_loss: 0.5329, test_loss: 0.9515, test_f1: 0.6317
 epoch: 41, train_loss: 0.5292, test_loss: 0.9555, test_f1: 0.6076
 epoch: 42, train_loss: 0.5268, test_loss: 0.8238, test_f1: 0.6746
 epoch: 43, train_loss: 0.5453, test_loss: 0.8461, test_f1: 0.6397
 epoch: 44, train_loss: 0.5362, test_loss: 0.8848, test_f1: 0.6596
 epoch: 45, train_loss: 0.5143, test_loss: 0.8470, test_f1: 0.6555
 epoch: 46, train_loss: 0.4904, test_loss: 0.9513, test_f1: 0.6617
 epoch: 47, train_loss: 0.5020, test_loss: 0.9692, test_f1: 0.6585
 epoch: 48, train_loss: 0.5032, test_loss: 0.9245, test_f1: 0.6433
 epoch: 49, train_loss: 0.5140, test_loss: 0.8909, test_f1: 0.6675
 epoch: 50, train_loss: 0.4924, test_loss: 0.9440, test_f1: 0.6654
 epoch: 51, train_loss: 0.4667, test_loss: 0.9448, test_f1: 0.6691
 epoch: 52, train_loss: 0.4357, test_loss: 0.9359, test_f1: 0.6564
 epoch: 53, train_loss: 0.4272, test_loss: 0.9664, test_f1: 0.6736
 epoch: 54, train_loss: 0.4250, test_loss: 1.0084, test_f1: 0.6745
 epoch: 55, train_loss: 0.3982, test_loss: 0.9799, test_f1: 0.6824
 epoch: 56, train_loss: 0.4074, test_loss: 1.0121, test_f1: 0.6611
 epoch: 57, train_loss: 0.3995, test_loss: 1.0678, test_f1: 0.6515
 epoch: 58, train_loss: 0.4005, test_loss: 0.9887, test_f1: 0.6629
 epoch: 59, train_loss: 0.3866, test_loss: 1.0586, test_f1: 0.6727
 epoch: 60, train_loss: 0.3800, test_loss: 1.0256, test_f1: 0.6709
 epoch: 61, train_loss: 0.3836, test_loss: 1.0580, test_f1: 0.6651
 epoch: 62, train_loss: 0.3955, test_loss: 1.1073, test_f1: 0.6607
 epoch: 63, train_loss: 0.3780, test_loss: 1.0588, test_f1: 0.6712
 epoch: 64, train_loss: 0.3676, test_loss: 1.0787, test_f1: 0.6557
 epoch: 65, train_loss: 0.3713, test_loss: 1.2028, test_f1: 0.6752
 epoch: 66, train_loss: 0.3617, test_loss: 1.1772, test_f1: 0.6554
 epoch: 67, train_loss: 0.3534, test_loss: 1.1383, test_f1: 0.6668
 epoch: 68, train_loss: 0.3628, test_loss: 1.1078, test_f1: 0.6585
 epoch: 69, train_loss: 0.3724, test_loss: 1.1344, test_f1: 0.6550
 epoch: 70, train_loss: 0.3702, test_loss: 1.1161, test_f1: 0.6674
 epoch: 71, train_loss: 0.3593, test_loss: 1.0723, test_f1: 0.6574
 epoch: 72, train_loss: 0.3444, test_loss: 1.1486, test_f1: 0.6624
 epoch: 73, train_loss: 0.3459, test_loss: 1.2545, test_f1: 0.6592
 epoch: 74, train_loss: 0.3236, test_loss: 1.2603, test_f1: 0.6484
 epoch: 75, train_loss: 0.3454, test_loss: 1.3029, test_f1: 0.6397
 epoch: 76, train_loss: 0.3251, test_loss: 1.3213, test_f1: 0.6562
 epoch: 77, train_loss: 0.3360, test_loss: 1.3932, test_f1: 0.6717
 epoch: 78, train_loss: 0.3157, test_loss: 1.3202, test_f1: 0.6892
 epoch: 79, train_loss: 0.3281, test_loss: 1.2855, test_f1: 0.6754
 epoch: 80, train_loss: 0.3145, test_loss: 1.2683, test_f1: 0.6749
 epoch: 81, train_loss: 0.3416, test_loss: 1.3129, test_f1: 0.6715
 epoch: 82, train_loss: 0.3128, test_loss: 1.1696, test_f1: 0.6823
 epoch: 83, train_loss: 0.3015, test_loss: 1.3310, test_f1: 0.6554
 epoch: 84, train_loss: 0.3144, test_loss: 1.2685, test_f1: 0.6697
 epoch: 85, train_loss: 0.3020, test_loss: 1.3626, test_f1: 0.6634
 epoch: 86, train_loss: 0.3337, test_loss: 1.2776, test_f1: 0.6494
 epoch: 87, train_loss: 0.3097, test_loss: 1.3428, test_f1: 0.6754
 epoch: 88, train_loss: 0.3238, test_loss: 1.3695, test_f1: 0.6444
 epoch: 89, train_loss: 0.2967, test_loss: 1.3585, test_f1: 0.6691
 epoch: 90, train_loss: 0.2887, test_loss: 1.3833, test_f1: 0.6529
 epoch: 91, train_loss: 0.3021, test_loss: 1.3866, test_f1: 0.6724
 epoch: 92, train_loss: 0.2872, test_loss: 1.3733, test_f1: 0.6718
 epoch: 93, train_loss: 0.2978, test_loss: 1.4212, test_f1: 0.6661
 epoch: 94, train_loss: 0.2997, test_loss: 1.4175, test_f1: 0.6520
 epoch: 95, train_loss: 0.2636, test_loss: 1.4450, test_f1: 0.6816
 epoch: 96, train_loss: 0.2715, test_loss: 1.4457, test_f1: 0.6800
 epoch: 97, train_loss: 0.2862, test_loss: 1.4150, test_f1: 0.6756
 epoch: 98, train_loss: 0.2748, test_loss: 1.5126, test_f1: 0.6501
 epoch: 99, train_loss: 0.2702, test_loss: 1.5229, test_f1: 0.6648
##################ITERATION #8 ****************************************
 epoch: 0, train_loss: 1.3112, test_loss: 1.1257, test_f1: 0.3706
 epoch: 1, train_loss: 0.9846, test_loss: 1.0067, test_f1: 0.4832
 epoch: 2, train_loss: 0.9646, test_loss: 0.9743, test_f1: 0.5081
 epoch: 3, train_loss: 0.9377, test_loss: 0.9741, test_f1: 0.4938
 epoch: 4, train_loss: 0.9053, test_loss: 0.9515, test_f1: 0.5101
 epoch: 5, train_loss: 0.8768, test_loss: 0.8812, test_f1: 0.5407
 epoch: 6, train_loss: 0.8625, test_loss: 0.8622, test_f1: 0.5503
 epoch: 7, train_loss: 0.8560, test_loss: 0.8214, test_f1: 0.5726
 epoch: 8, train_loss: 0.8342, test_loss: 0.8844, test_f1: 0.5817
 epoch: 9, train_loss: 0.8176, test_loss: 0.8233, test_f1: 0.5517
 epoch: 10, train_loss: 0.8088, test_loss: 0.8184, test_f1: 0.5992
 epoch: 11, train_loss: 0.7863, test_loss: 0.7812, test_f1: 0.6152
 epoch: 12, train_loss: 0.7697, test_loss: 0.8823, test_f1: 0.5996
 epoch: 13, train_loss: 0.7742, test_loss: 0.8339, test_f1: 0.5854
 epoch: 14, train_loss: 0.7473, test_loss: 0.7949, test_f1: 0.6346
 epoch: 15, train_loss: 0.7384, test_loss: 0.7890, test_f1: 0.6291
 epoch: 16, train_loss: 0.7325, test_loss: 0.8658, test_f1: 0.6072
 epoch: 17, train_loss: 0.7056, test_loss: 0.7815, test_f1: 0.5970
 epoch: 18, train_loss: 0.7104, test_loss: 0.7819, test_f1: 0.6371
 epoch: 19, train_loss: 0.7013, test_loss: 0.7586, test_f1: 0.6272
 epoch: 20, train_loss: 0.7064, test_loss: 0.7782, test_f1: 0.6588
 epoch: 21, train_loss: 0.6846, test_loss: 0.8098, test_f1: 0.6165
 epoch: 22, train_loss: 0.6666, test_loss: 0.7777, test_f1: 0.6361
 epoch: 23, train_loss: 0.6406, test_loss: 0.7989, test_f1: 0.6346
 epoch: 24, train_loss: 0.6734, test_loss: 0.8433, test_f1: 0.6209
 epoch: 25, train_loss: 0.6367, test_loss: 0.8137, test_f1: 0.6192
 epoch: 26, train_loss: 0.6335, test_loss: 0.7575, test_f1: 0.6431
 epoch: 27, train_loss: 0.6354, test_loss: 0.7704, test_f1: 0.6549
 epoch: 28, train_loss: 0.6098, test_loss: 0.8348, test_f1: 0.6229
 epoch: 29, train_loss: 0.6130, test_loss: 0.7570, test_f1: 0.6383
 epoch: 30, train_loss: 0.6114, test_loss: 0.8511, test_f1: 0.6157
 epoch: 31, train_loss: 0.5927, test_loss: 0.7805, test_f1: 0.6437
 epoch: 32, train_loss: 0.5983, test_loss: 0.7928, test_f1: 0.6559
 epoch: 33, train_loss: 0.5820, test_loss: 0.8024, test_f1: 0.6532
 epoch: 34, train_loss: 0.5731, test_loss: 0.8119, test_f1: 0.6619
 epoch: 35, train_loss: 0.5525, test_loss: 0.9397, test_f1: 0.5931
 epoch: 36, train_loss: 0.5659, test_loss: 0.9077, test_f1: 0.6410
 epoch: 37, train_loss: 0.5565, test_loss: 1.0043, test_f1: 0.6269
 epoch: 38, train_loss: 0.5490, test_loss: 0.9031, test_f1: 0.6436
 epoch: 39, train_loss: 0.5421, test_loss: 0.9492, test_f1: 0.6231
 epoch: 40, train_loss: 0.5164, test_loss: 0.9212, test_f1: 0.6242
 epoch: 41, train_loss: 0.5395, test_loss: 0.9239, test_f1: 0.6667
 epoch: 42, train_loss: 0.5291, test_loss: 0.9329, test_f1: 0.6617
 epoch: 43, train_loss: 0.5264, test_loss: 0.9740, test_f1: 0.6284
 epoch: 44, train_loss: 0.5331, test_loss: 0.9836, test_f1: 0.6351
 epoch: 45, train_loss: 0.5090, test_loss: 0.9884, test_f1: 0.6628
 epoch: 46, train_loss: 0.5082, test_loss: 0.9987, test_f1: 0.6501
 epoch: 47, train_loss: 0.5007, test_loss: 1.0758, test_f1: 0.6494
 epoch: 48, train_loss: 0.4757, test_loss: 0.9394, test_f1: 0.6597
 epoch: 49, train_loss: 0.4916, test_loss: 0.9380, test_f1: 0.6718
 epoch: 50, train_loss: 0.4718, test_loss: 0.9419, test_f1: 0.6577
 epoch: 51, train_loss: 0.4317, test_loss: 1.0160, test_f1: 0.6768
 epoch: 52, train_loss: 0.4349, test_loss: 1.0280, test_f1: 0.6614
 epoch: 53, train_loss: 0.4085, test_loss: 1.1048, test_f1: 0.6553
 epoch: 54, train_loss: 0.4008, test_loss: 1.1198, test_f1: 0.6469
 epoch: 55, train_loss: 0.3785, test_loss: 1.1969, test_f1: 0.6575
 epoch: 56, train_loss: 0.3884, test_loss: 1.1934, test_f1: 0.6416
 epoch: 57, train_loss: 0.3938, test_loss: 1.2554, test_f1: 0.6401
 epoch: 58, train_loss: 0.4119, test_loss: 1.1571, test_f1: 0.6499
 epoch: 59, train_loss: 0.3804, test_loss: 1.2377, test_f1: 0.6673
 epoch: 60, train_loss: 0.3841, test_loss: 1.2247, test_f1: 0.6573
 epoch: 61, train_loss: 0.3682, test_loss: 1.2132, test_f1: 0.6630
 epoch: 62, train_loss: 0.3642, test_loss: 1.2755, test_f1: 0.6678
 epoch: 63, train_loss: 0.3666, test_loss: 1.2235, test_f1: 0.6794
 epoch: 64, train_loss: 0.3503, test_loss: 1.3470, test_f1: 0.6589
 epoch: 65, train_loss: 0.3671, test_loss: 1.2686, test_f1: 0.6578
 epoch: 66, train_loss: 0.3502, test_loss: 1.3160, test_f1: 0.6687
 epoch: 67, train_loss: 0.3628, test_loss: 1.2753, test_f1: 0.6666
 epoch: 68, train_loss: 0.3406, test_loss: 1.2323, test_f1: 0.6631
 epoch: 69, train_loss: 0.3466, test_loss: 1.2230, test_f1: 0.6700
 epoch: 70, train_loss: 0.3311, test_loss: 1.2208, test_f1: 0.6687
 epoch: 71, train_loss: 0.3263, test_loss: 1.3502, test_f1: 0.6453
 epoch: 72, train_loss: 0.3121, test_loss: 1.3357, test_f1: 0.6693
 epoch: 73, train_loss: 0.3448, test_loss: 1.4232, test_f1: 0.6646
 epoch: 74, train_loss: 0.3343, test_loss: 1.2824, test_f1: 0.6880
 epoch: 75, train_loss: 0.3360, test_loss: 1.3570, test_f1: 0.6851
 epoch: 76, train_loss: 0.3363, test_loss: 1.4444, test_f1: 0.6621
 epoch: 77, train_loss: 0.3219, test_loss: 1.4799, test_f1: 0.6543
 epoch: 78, train_loss: 0.3207, test_loss: 1.4359, test_f1: 0.6654
 epoch: 79, train_loss: 0.3214, test_loss: 1.3486, test_f1: 0.6851
 epoch: 80, train_loss: 0.3089, test_loss: 1.3642, test_f1: 0.6578
 epoch: 81, train_loss: 0.3035, test_loss: 1.4673, test_f1: 0.6738
 epoch: 82, train_loss: 0.2997, test_loss: 1.4275, test_f1: 0.6691
 epoch: 83, train_loss: 0.3033, test_loss: 1.5183, test_f1: 0.6811
 epoch: 84, train_loss: 0.2939, test_loss: 1.5332, test_f1: 0.6597
 epoch: 85, train_loss: 0.2839, test_loss: 1.5540, test_f1: 0.6608
 epoch: 86, train_loss: 0.3058, test_loss: 1.4930, test_f1: 0.6579
 epoch: 87, train_loss: 0.2912, test_loss: 1.5899, test_f1: 0.6711
 epoch: 88, train_loss: 0.3094, test_loss: 1.5045, test_f1: 0.6648
 epoch: 89, train_loss: 0.3031, test_loss: 1.5083, test_f1: 0.6768
 epoch: 90, train_loss: 0.2903, test_loss: 1.5808, test_f1: 0.6631
 epoch: 91, train_loss: 0.2777, test_loss: 1.5878, test_f1: 0.6641
 epoch: 92, train_loss: 0.2759, test_loss: 1.6632, test_f1: 0.6568
 epoch: 93, train_loss: 0.2942, test_loss: 1.5780, test_f1: 0.6555
 epoch: 94, train_loss: 0.2770, test_loss: 1.6680, test_f1: 0.6763
 epoch: 95, train_loss: 0.2800, test_loss: 1.5810, test_f1: 0.6660
 epoch: 96, train_loss: 0.2691, test_loss: 1.5508, test_f1: 0.6660
 epoch: 97, train_loss: 0.2721, test_loss: 1.4919, test_f1: 0.6841
 epoch: 98, train_loss: 0.2792, test_loss: 1.4542, test_f1: 0.6548
 epoch: 99, train_loss: 0.2822, test_loss: 1.6171, test_f1: 0.6721
##################ITERATION #9 ****************************************
 epoch: 0, train_loss: 1.3822, test_loss: 1.0806, test_f1: 0.3885
 epoch: 1, train_loss: 1.0031, test_loss: 0.9529, test_f1: 0.4946
 epoch: 2, train_loss: 0.9633, test_loss: 0.9459, test_f1: 0.4882
 epoch: 3, train_loss: 0.9284, test_loss: 0.9128, test_f1: 0.5108
 epoch: 4, train_loss: 0.9055, test_loss: 0.9507, test_f1: 0.5246
 epoch: 5, train_loss: 0.8926, test_loss: 0.9406, test_f1: 0.4962
 epoch: 6, train_loss: 0.8676, test_loss: 0.8701, test_f1: 0.5282
 epoch: 7, train_loss: 0.8524, test_loss: 0.8660, test_f1: 0.5557
 epoch: 8, train_loss: 0.8369, test_loss: 0.8184, test_f1: 0.5912
 epoch: 9, train_loss: 0.7946, test_loss: 0.8426, test_f1: 0.5935
 epoch: 10, train_loss: 0.7966, test_loss: 0.7773, test_f1: 0.6103
 epoch: 11, train_loss: 0.7869, test_loss: 0.7997, test_f1: 0.5834
 epoch: 12, train_loss: 0.7699, test_loss: 0.8126, test_f1: 0.6141
 epoch: 13, train_loss: 0.7540, test_loss: 0.8577, test_f1: 0.6107
 epoch: 14, train_loss: 0.7598, test_loss: 0.8067, test_f1: 0.5986
 epoch: 15, train_loss: 0.7383, test_loss: 0.7305, test_f1: 0.6428
 epoch: 16, train_loss: 0.7152, test_loss: 0.7243, test_f1: 0.6319
 epoch: 17, train_loss: 0.7236, test_loss: 0.7666, test_f1: 0.6017
 epoch: 18, train_loss: 0.7112, test_loss: 0.7210, test_f1: 0.6593
 epoch: 19, train_loss: 0.7041, test_loss: 0.7540, test_f1: 0.6268
 epoch: 20, train_loss: 0.6734, test_loss: 0.7785, test_f1: 0.6208
 epoch: 21, train_loss: 0.6868, test_loss: 0.7308, test_f1: 0.6416
 epoch: 22, train_loss: 0.6700, test_loss: 0.7714, test_f1: 0.6233
 epoch: 23, train_loss: 0.6721, test_loss: 0.6942, test_f1: 0.6653
 epoch: 24, train_loss: 0.6361, test_loss: 0.7276, test_f1: 0.6237
 epoch: 25, train_loss: 0.6484, test_loss: 0.7460, test_f1: 0.6413
 epoch: 26, train_loss: 0.6252, test_loss: 0.7097, test_f1: 0.6613
 epoch: 27, train_loss: 0.6194, test_loss: 0.8332, test_f1: 0.6533
 epoch: 28, train_loss: 0.6049, test_loss: 0.8315, test_f1: 0.6309
 epoch: 29, train_loss: 0.5943, test_loss: 0.8401, test_f1: 0.6356
 epoch: 30, train_loss: 0.6063, test_loss: 0.8281, test_f1: 0.6027
 epoch: 31, train_loss: 0.6074, test_loss: 0.8318, test_f1: 0.6608
 epoch: 32, train_loss: 0.6013, test_loss: 0.8689, test_f1: 0.6451
 epoch: 33, train_loss: 0.5654, test_loss: 0.7998, test_f1: 0.6527
 epoch: 34, train_loss: 0.5737, test_loss: 0.8630, test_f1: 0.6254
 epoch: 35, train_loss: 0.5443, test_loss: 0.8699, test_f1: 0.6383
 epoch: 36, train_loss: 0.5599, test_loss: 0.8894, test_f1: 0.6314
 epoch: 37, train_loss: 0.5535, test_loss: 0.8067, test_f1: 0.6381
 epoch: 38, train_loss: 0.5452, test_loss: 0.8240, test_f1: 0.6542
 epoch: 39, train_loss: 0.5335, test_loss: 0.8353, test_f1: 0.6482
 epoch: 40, train_loss: 0.5393, test_loss: 0.8649, test_f1: 0.6672
 epoch: 41, train_loss: 0.5330, test_loss: 0.8880, test_f1: 0.6605
 epoch: 42, train_loss: 0.5187, test_loss: 0.9166, test_f1: 0.6508
 epoch: 43, train_loss: 0.5310, test_loss: 0.9409, test_f1: 0.6330
 epoch: 44, train_loss: 0.5307, test_loss: 0.8461, test_f1: 0.6730
 epoch: 45, train_loss: 0.5079, test_loss: 0.8441, test_f1: 0.6539
 epoch: 46, train_loss: 0.4943, test_loss: 0.7997, test_f1: 0.6979
 epoch: 47, train_loss: 0.4894, test_loss: 0.8670, test_f1: 0.6591
 epoch: 48, train_loss: 0.5019, test_loss: 0.9102, test_f1: 0.6701
 epoch: 49, train_loss: 0.4821, test_loss: 1.0045, test_f1: 0.6281
 epoch: 50, train_loss: 0.5103, test_loss: 0.9015, test_f1: 0.6627
 epoch: 51, train_loss: 0.4487, test_loss: 0.8979, test_f1: 0.6590
 epoch: 52, train_loss: 0.4308, test_loss: 0.9394, test_f1: 0.6508
 epoch: 53, train_loss: 0.4254, test_loss: 0.8844, test_f1: 0.6984
 epoch: 54, train_loss: 0.4111, test_loss: 0.9371, test_f1: 0.6836
 epoch: 55, train_loss: 0.4061, test_loss: 0.9818, test_f1: 0.6660
 epoch: 56, train_loss: 0.4029, test_loss: 1.0292, test_f1: 0.6715
 epoch: 57, train_loss: 0.3857, test_loss: 1.0026, test_f1: 0.6653
 epoch: 58, train_loss: 0.3673, test_loss: 1.0126, test_f1: 0.6659
 epoch: 59, train_loss: 0.3890, test_loss: 1.0569, test_f1: 0.6654
 epoch: 60, train_loss: 0.3942, test_loss: 1.0371, test_f1: 0.6664
 epoch: 61, train_loss: 0.3817, test_loss: 1.1173, test_f1: 0.6609
 epoch: 62, train_loss: 0.3861, test_loss: 1.0812, test_f1: 0.6466
 epoch: 63, train_loss: 0.3745, test_loss: 1.1905, test_f1: 0.6688
 epoch: 64, train_loss: 0.3665, test_loss: 1.1087, test_f1: 0.6589
 epoch: 65, train_loss: 0.3642, test_loss: 1.1242, test_f1: 0.6652
 epoch: 66, train_loss: 0.3715, test_loss: 1.1552, test_f1: 0.6608
 epoch: 67, train_loss: 0.3585, test_loss: 1.1683, test_f1: 0.6741
 epoch: 68, train_loss: 0.3485, test_loss: 1.0931, test_f1: 0.6766
 epoch: 69, train_loss: 0.3506, test_loss: 1.1048, test_f1: 0.6632
 epoch: 70, train_loss: 0.3717, test_loss: 1.1312, test_f1: 0.6614
 epoch: 71, train_loss: 0.3486, test_loss: 1.1845, test_f1: 0.6693
 epoch: 72, train_loss: 0.3491, test_loss: 1.2400, test_f1: 0.6580
 epoch: 73, train_loss: 0.3470, test_loss: 1.2617, test_f1: 0.6449
 epoch: 74, train_loss: 0.3480, test_loss: 1.0401, test_f1: 0.6846
 epoch: 75, train_loss: 0.3400, test_loss: 1.1987, test_f1: 0.6709
 epoch: 76, train_loss: 0.3220, test_loss: 1.1507, test_f1: 0.6615
 epoch: 77, train_loss: 0.3395, test_loss: 1.2639, test_f1: 0.6717
 epoch: 78, train_loss: 0.3269, test_loss: 1.2675, test_f1: 0.6590
 epoch: 79, train_loss: 0.3325, test_loss: 1.1758, test_f1: 0.6637
 epoch: 80, train_loss: 0.3260, test_loss: 1.1624, test_f1: 0.6710
 epoch: 81, train_loss: 0.3223, test_loss: 1.2195, test_f1: 0.6575
 epoch: 82, train_loss: 0.3133, test_loss: 1.2267, test_f1: 0.6561
 epoch: 83, train_loss: 0.3100, test_loss: 1.2450, test_f1: 0.6685
 epoch: 84, train_loss: 0.3103, test_loss: 1.3200, test_f1: 0.6647
 epoch: 85, train_loss: 0.2942, test_loss: 1.2897, test_f1: 0.6752
 epoch: 86, train_loss: 0.3295, test_loss: 1.3420, test_f1: 0.6599
 epoch: 87, train_loss: 0.3059, test_loss: 1.2961, test_f1: 0.6678
 epoch: 88, train_loss: 0.3162, test_loss: 1.3043, test_f1: 0.6753
 epoch: 89, train_loss: 0.2989, test_loss: 1.2736, test_f1: 0.6638
 epoch: 90, train_loss: 0.3011, test_loss: 1.2563, test_f1: 0.6604
 epoch: 91, train_loss: 0.2834, test_loss: 1.3170, test_f1: 0.6615
 epoch: 92, train_loss: 0.2948, test_loss: 1.3515, test_f1: 0.6684
 epoch: 93, train_loss: 0.2886, test_loss: 1.3309, test_f1: 0.6578
 epoch: 94, train_loss: 0.2899, test_loss: 1.3134, test_f1: 0.6640
 epoch: 95, train_loss: 0.3047, test_loss: 1.3239, test_f1: 0.6594
 epoch: 96, train_loss: 0.2865, test_loss: 1.2571, test_f1: 0.6666
 epoch: 97, train_loss: 0.2666, test_loss: 1.3811, test_f1: 0.6542
 epoch: 98, train_loss: 0.2799, test_loss: 1.5356, test_f1: 0.6569
 epoch: 99, train_loss: 0.2909, test_loss: 1.4613, test_f1: 0.6543

Training completed in 1297.09 seconds
Best F1: 0.7156 at epoch 74
Mean F1 across iterations: 0.6976  0.0112
========================FINAL RESULTS================================
FEGIN weighted F1: 0.7156  0.0112
python main.py --data ltspice_examples --representation component_pin_net --model FEGIN --layers 4 --hiddens 64 --batch_size 64 --lr 0.001 --emb_size 128 --epochs 100 --save_appendix component_pin_net_L4_H64_BS64_LR0.001_E128 --no_val
-----



STDERR:
  File "main.py", line 370, in <module>
    main()
  File "main.py", line 254, in main
    dataset = dataset_class(
  File "/home/philip/projects/ltspice_examples_code_repo/Circuit-Completion-Using-GNNs/component_classification_with_link_prediction_head/evaluation/FEGIN/kernel/circuit_datasets.py", line 15, in __init__
    self.data, self.slices = torch.load(self.processed_paths[0])
  File "/home/philip/.local/lib/python3.8/site-packages/torch/serialization.py", line 1040, in load
    warnings.warn(
  File "/usr/lib/python3.8/warnings.py", line 109, in _showwarnmsg
    sw(msg.message, msg.category, msg.filename, msg.lineno,
  File "main.py", line 47, in warn_with_traceback
    traceback.print_stack(file=log)
/home/philip/projects/ltspice_examples_code_repo/Circuit-Completion-Using-GNNs/component_classification_with_link_prediction_head/evaluation/FEGIN/kernel/circuit_datasets.py:15: FutureWarning: You are using `torch.load` with `weights_only=False` (the current default value), which uses the default pickle module implicitly. It is possible to construct malicious pickle data which will execute arbitrary code during unpickling (See https://github.com/pytorch/pytorch/blob/main/SECURITY.md#untrusted-models for more details). In a future release, the default value for `weights_only` will be flipped to `True`. This limits the functions that could be executed during unpickling. Arbitrary objects will no longer be allowed to be loaded via this mode unless they are explicitly allowlisted by the user via `torch.serialization.add_safe_globals`. We recommend you start setting `weights_only=True` for any use case where you don't have full control of the loaded file. Please open an issue on GitHub for any issues related to this experimental feature.
  self.data, self.slices = torch.load(self.processed_paths[0])
