STDOUT:
Results will be saved in /home/philip/projects/ltspice_examples_code_repo/Circuit-Completion-Using-GNNs/component_classification_with_link_prediction_head/evaluation/FEGIN/results/model_FEGIN_dataset_ltspice_examples
Command line input: python main.py --data ltspice_examples --representation component_pin --model FEGIN --layers 2 --hiddens 128 --batch_size 32 --lr 0.0001 --emb_size 128 --epochs 100 --save_appendix component_pin_L2_H128_BS32_LR0.0001_E128 --no_val
 is saved.
-----
ltspice_examples - FEGIN
Using 2 layers, 128 hidden units, h = 2
Loading component_pin representation dataset
ENTERED
Training FEGIN on component_pin representation
Train: 3560, Test: 848
##################ITERATION #0 ****************************************
 epoch: 0, train_loss: 1.3326, test_loss: 1.2084, test_f1: 0.3361
 epoch: 1, train_loss: 1.1555, test_loss: 1.0861, test_f1: 0.3445
 epoch: 2, train_loss: 1.0706, test_loss: 1.0581, test_f1: 0.3406
 epoch: 3, train_loss: 1.0378, test_loss: 1.0414, test_f1: 0.3703
 epoch: 4, train_loss: 1.0168, test_loss: 1.0133, test_f1: 0.4296
 epoch: 5, train_loss: 0.9924, test_loss: 1.0080, test_f1: 0.4336
 epoch: 6, train_loss: 0.9762, test_loss: 1.0067, test_f1: 0.4834
 epoch: 7, train_loss: 0.9610, test_loss: 0.9945, test_f1: 0.4848
 epoch: 8, train_loss: 0.9542, test_loss: 0.9951, test_f1: 0.4748
 epoch: 9, train_loss: 0.9298, test_loss: 0.9778, test_f1: 0.4871
 epoch: 10, train_loss: 0.9194, test_loss: 0.9717, test_f1: 0.5036
 epoch: 11, train_loss: 0.8963, test_loss: 0.9810, test_f1: 0.5059
 epoch: 12, train_loss: 0.8875, test_loss: 0.9367, test_f1: 0.5278
 epoch: 13, train_loss: 0.8731, test_loss: 0.9475, test_f1: 0.5199
 epoch: 14, train_loss: 0.8563, test_loss: 0.9199, test_f1: 0.5145
 epoch: 15, train_loss: 0.8433, test_loss: 0.9237, test_f1: 0.5195
 epoch: 16, train_loss: 0.8365, test_loss: 0.9037, test_f1: 0.5374
 epoch: 17, train_loss: 0.8251, test_loss: 0.8925, test_f1: 0.5383
 epoch: 18, train_loss: 0.8187, test_loss: 0.8964, test_f1: 0.5280
 epoch: 19, train_loss: 0.7964, test_loss: 0.8997, test_f1: 0.5422
 epoch: 20, train_loss: 0.7872, test_loss: 0.9013, test_f1: 0.5362
 epoch: 21, train_loss: 0.7852, test_loss: 0.9209, test_f1: 0.5254
 epoch: 22, train_loss: 0.7817, test_loss: 0.8861, test_f1: 0.5396
 epoch: 23, train_loss: 0.7648, test_loss: 0.8768, test_f1: 0.5360
 epoch: 24, train_loss: 0.7521, test_loss: 0.9051, test_f1: 0.5468
 epoch: 25, train_loss: 0.7512, test_loss: 0.9017, test_f1: 0.5336
 epoch: 26, train_loss: 0.7403, test_loss: 0.8930, test_f1: 0.5590
 epoch: 27, train_loss: 0.7300, test_loss: 0.9063, test_f1: 0.5237
 epoch: 28, train_loss: 0.7246, test_loss: 0.8966, test_f1: 0.5622
 epoch: 29, train_loss: 0.7155, test_loss: 0.8666, test_f1: 0.5666
 epoch: 30, train_loss: 0.7120, test_loss: 0.8970, test_f1: 0.5654
 epoch: 31, train_loss: 0.7071, test_loss: 0.9020, test_f1: 0.5698
 epoch: 32, train_loss: 0.7026, test_loss: 0.9074, test_f1: 0.5693
 epoch: 33, train_loss: 0.6891, test_loss: 0.9177, test_f1: 0.5836
 epoch: 34, train_loss: 0.6877, test_loss: 0.9302, test_f1: 0.5728
 epoch: 35, train_loss: 0.6821, test_loss: 0.8779, test_f1: 0.5730
 epoch: 36, train_loss: 0.6759, test_loss: 0.9143, test_f1: 0.5707
 epoch: 37, train_loss: 0.6762, test_loss: 0.9129, test_f1: 0.6010
 epoch: 38, train_loss: 0.6532, test_loss: 0.9252, test_f1: 0.6012
 epoch: 39, train_loss: 0.6599, test_loss: 0.9415, test_f1: 0.5695
 epoch: 40, train_loss: 0.6409, test_loss: 0.8859, test_f1: 0.5835
 epoch: 41, train_loss: 0.6380, test_loss: 0.9423, test_f1: 0.5800
 epoch: 42, train_loss: 0.6396, test_loss: 0.9334, test_f1: 0.5945
 epoch: 43, train_loss: 0.6549, test_loss: 0.9650, test_f1: 0.6009
 epoch: 44, train_loss: 0.6350, test_loss: 0.9923, test_f1: 0.6005
 epoch: 45, train_loss: 0.6189, test_loss: 0.9748, test_f1: 0.6115
 epoch: 46, train_loss: 0.6323, test_loss: 0.9735, test_f1: 0.5895
 epoch: 47, train_loss: 0.6224, test_loss: 1.0061, test_f1: 0.5962
 epoch: 48, train_loss: 0.6110, test_loss: 0.9779, test_f1: 0.6082
 epoch: 49, train_loss: 0.6100, test_loss: 0.9085, test_f1: 0.6056
 epoch: 50, train_loss: 0.6095, test_loss: 0.9862, test_f1: 0.6022
 epoch: 51, train_loss: 0.6054, test_loss: 0.9704, test_f1: 0.6127
 epoch: 52, train_loss: 0.5988, test_loss: 1.0032, test_f1: 0.6045
 epoch: 53, train_loss: 0.5921, test_loss: 0.9629, test_f1: 0.6190
 epoch: 54, train_loss: 0.5826, test_loss: 1.0032, test_f1: 0.6063
 epoch: 55, train_loss: 0.5868, test_loss: 0.9960, test_f1: 0.6070
 epoch: 56, train_loss: 0.5794, test_loss: 1.0201, test_f1: 0.5997
 epoch: 57, train_loss: 0.5667, test_loss: 0.9950, test_f1: 0.6092
 epoch: 58, train_loss: 0.5822, test_loss: 0.9646, test_f1: 0.6103
 epoch: 59, train_loss: 0.5810, test_loss: 1.0351, test_f1: 0.6025
 epoch: 60, train_loss: 0.5716, test_loss: 1.0036, test_f1: 0.5966
 epoch: 61, train_loss: 0.5684, test_loss: 1.0053, test_f1: 0.6078
 epoch: 62, train_loss: 0.5731, test_loss: 0.9830, test_f1: 0.6052
 epoch: 63, train_loss: 0.5655, test_loss: 0.9808, test_f1: 0.6225
 epoch: 64, train_loss: 0.5669, test_loss: 1.0241, test_f1: 0.6180
 epoch: 65, train_loss: 0.5600, test_loss: 1.0394, test_f1: 0.6070
 epoch: 66, train_loss: 0.5533, test_loss: 1.0226, test_f1: 0.6069
 epoch: 67, train_loss: 0.5553, test_loss: 0.9977, test_f1: 0.6134
 epoch: 68, train_loss: 0.5557, test_loss: 1.0237, test_f1: 0.6190
 epoch: 69, train_loss: 0.5368, test_loss: 1.0546, test_f1: 0.6096
 epoch: 70, train_loss: 0.5520, test_loss: 1.0299, test_f1: 0.6072
 epoch: 71, train_loss: 0.5398, test_loss: 1.0220, test_f1: 0.6007
 epoch: 72, train_loss: 0.5473, test_loss: 1.0163, test_f1: 0.5986
 epoch: 73, train_loss: 0.5457, test_loss: 1.0219, test_f1: 0.6216
 epoch: 74, train_loss: 0.5332, test_loss: 1.0692, test_f1: 0.6165
 epoch: 75, train_loss: 0.5443, test_loss: 1.0091, test_f1: 0.6198
 epoch: 76, train_loss: 0.5307, test_loss: 1.0746, test_f1: 0.6134
 epoch: 77, train_loss: 0.5305, test_loss: 1.0789, test_f1: 0.6086
 epoch: 78, train_loss: 0.5401, test_loss: 1.0246, test_f1: 0.6290
 epoch: 79, train_loss: 0.5190, test_loss: 1.0964, test_f1: 0.6138
 epoch: 80, train_loss: 0.5210, test_loss: 1.0435, test_f1: 0.6247
 epoch: 81, train_loss: 0.5198, test_loss: 1.1110, test_f1: 0.6140
 epoch: 82, train_loss: 0.5213, test_loss: 1.0830, test_f1: 0.6160
 epoch: 83, train_loss: 0.5239, test_loss: 1.1120, test_f1: 0.6285
 epoch: 84, train_loss: 0.5257, test_loss: 1.1003, test_f1: 0.6192
 epoch: 85, train_loss: 0.5207, test_loss: 1.1384, test_f1: 0.6207
 epoch: 86, train_loss: 0.5170, test_loss: 1.0389, test_f1: 0.6271
 epoch: 87, train_loss: 0.5212, test_loss: 1.0555, test_f1: 0.6275
 epoch: 88, train_loss: 0.5124, test_loss: 1.0933, test_f1: 0.6221
 epoch: 89, train_loss: 0.5140, test_loss: 1.0447, test_f1: 0.6447
 epoch: 90, train_loss: 0.5120, test_loss: 1.1389, test_f1: 0.6378
 epoch: 91, train_loss: 0.5017, test_loss: 1.1415, test_f1: 0.6186
 epoch: 92, train_loss: 0.5082, test_loss: 1.1333, test_f1: 0.6020
 epoch: 93, train_loss: 0.5106, test_loss: 1.0915, test_f1: 0.6109
 epoch: 94, train_loss: 0.5025, test_loss: 1.1093, test_f1: 0.6314
 epoch: 95, train_loss: 0.5038, test_loss: 1.0700, test_f1: 0.6219
 epoch: 96, train_loss: 0.5055, test_loss: 1.1508, test_f1: 0.6271
 epoch: 97, train_loss: 0.5031, test_loss: 1.0508, test_f1: 0.6376
 epoch: 98, train_loss: 0.4846, test_loss: 1.1462, test_f1: 0.6153
 epoch: 99, train_loss: 0.5025, test_loss: 1.1329, test_f1: 0.6338
##################ITERATION #1 ****************************************
 epoch: 0, train_loss: 1.2215, test_loss: 1.0715, test_f1: 0.3940
 epoch: 1, train_loss: 1.0542, test_loss: 0.9987, test_f1: 0.4643
 epoch: 2, train_loss: 1.0035, test_loss: 0.9819, test_f1: 0.5227
 epoch: 3, train_loss: 0.9684, test_loss: 0.9532, test_f1: 0.5093
 epoch: 4, train_loss: 0.9438, test_loss: 0.9187, test_f1: 0.4978
 epoch: 5, train_loss: 0.9111, test_loss: 0.8864, test_f1: 0.5429
 epoch: 6, train_loss: 0.8955, test_loss: 0.9031, test_f1: 0.5382
 epoch: 7, train_loss: 0.8736, test_loss: 0.8798, test_f1: 0.5289
 epoch: 8, train_loss: 0.8573, test_loss: 0.8486, test_f1: 0.5494
 epoch: 9, train_loss: 0.8437, test_loss: 0.8862, test_f1: 0.5352
 epoch: 10, train_loss: 0.8384, test_loss: 0.8753, test_f1: 0.5665
 epoch: 11, train_loss: 0.8182, test_loss: 0.8432, test_f1: 0.5605
 epoch: 12, train_loss: 0.7935, test_loss: 0.8481, test_f1: 0.5585
 epoch: 13, train_loss: 0.7944, test_loss: 0.8153, test_f1: 0.5547
 epoch: 14, train_loss: 0.7855, test_loss: 0.8010, test_f1: 0.5685
 epoch: 15, train_loss: 0.7658, test_loss: 0.8528, test_f1: 0.5690
 epoch: 16, train_loss: 0.7724, test_loss: 0.8165, test_f1: 0.5659
 epoch: 17, train_loss: 0.7644, test_loss: 0.8341, test_f1: 0.5588
 epoch: 18, train_loss: 0.7511, test_loss: 0.8602, test_f1: 0.5676
 epoch: 19, train_loss: 0.7328, test_loss: 0.8074, test_f1: 0.5690
 epoch: 20, train_loss: 0.7303, test_loss: 0.8426, test_f1: 0.5768
 epoch: 21, train_loss: 0.7248, test_loss: 0.8229, test_f1: 0.5783
 epoch: 22, train_loss: 0.7152, test_loss: 0.8377, test_f1: 0.5692
 epoch: 23, train_loss: 0.7183, test_loss: 0.8509, test_f1: 0.5713
 epoch: 24, train_loss: 0.7087, test_loss: 0.8393, test_f1: 0.5967
 epoch: 25, train_loss: 0.6971, test_loss: 0.7919, test_f1: 0.5954
 epoch: 26, train_loss: 0.6906, test_loss: 0.8286, test_f1: 0.5633
 epoch: 27, train_loss: 0.6889, test_loss: 0.7911, test_f1: 0.6055
 epoch: 28, train_loss: 0.6800, test_loss: 0.8185, test_f1: 0.6038
 epoch: 29, train_loss: 0.6910, test_loss: 0.8345, test_f1: 0.5976
 epoch: 30, train_loss: 0.6810, test_loss: 0.7976, test_f1: 0.5922
 epoch: 31, train_loss: 0.6686, test_loss: 0.7996, test_f1: 0.6100
 epoch: 32, train_loss: 0.6515, test_loss: 0.8236, test_f1: 0.6003
 epoch: 33, train_loss: 0.6585, test_loss: 0.8689, test_f1: 0.6046
 epoch: 34, train_loss: 0.6602, test_loss: 0.8160, test_f1: 0.5810
 epoch: 35, train_loss: 0.6511, test_loss: 0.8180, test_f1: 0.6278
 epoch: 36, train_loss: 0.6390, test_loss: 0.8286, test_f1: 0.6170
 epoch: 37, train_loss: 0.6342, test_loss: 0.8288, test_f1: 0.6146
 epoch: 38, train_loss: 0.6324, test_loss: 0.8054, test_f1: 0.6193
 epoch: 39, train_loss: 0.6240, test_loss: 0.8549, test_f1: 0.6146
 epoch: 40, train_loss: 0.6390, test_loss: 0.8068, test_f1: 0.6285
 epoch: 41, train_loss: 0.6155, test_loss: 0.8045, test_f1: 0.6279
 epoch: 42, train_loss: 0.6124, test_loss: 0.7919, test_f1: 0.6480
 epoch: 43, train_loss: 0.6062, test_loss: 0.8059, test_f1: 0.6385
 epoch: 44, train_loss: 0.6019, test_loss: 0.8409, test_f1: 0.6167
 epoch: 45, train_loss: 0.6062, test_loss: 0.8453, test_f1: 0.6115
 epoch: 46, train_loss: 0.6096, test_loss: 0.8455, test_f1: 0.6338
 epoch: 47, train_loss: 0.5933, test_loss: 0.8862, test_f1: 0.6213
 epoch: 48, train_loss: 0.6013, test_loss: 0.8760, test_f1: 0.6520
 epoch: 49, train_loss: 0.5983, test_loss: 0.8459, test_f1: 0.6566
 epoch: 50, train_loss: 0.5780, test_loss: 0.8278, test_f1: 0.6187
 epoch: 51, train_loss: 0.5793, test_loss: 0.8020, test_f1: 0.6514
 epoch: 52, train_loss: 0.5618, test_loss: 0.8281, test_f1: 0.6433
 epoch: 53, train_loss: 0.5696, test_loss: 0.8406, test_f1: 0.6472
 epoch: 54, train_loss: 0.5605, test_loss: 0.8106, test_f1: 0.6507
 epoch: 55, train_loss: 0.5526, test_loss: 0.8578, test_f1: 0.6609
 epoch: 56, train_loss: 0.5596, test_loss: 0.8425, test_f1: 0.6458
 epoch: 57, train_loss: 0.5446, test_loss: 0.8349, test_f1: 0.6504
 epoch: 58, train_loss: 0.5553, test_loss: 0.7989, test_f1: 0.6325
 epoch: 59, train_loss: 0.5380, test_loss: 0.8628, test_f1: 0.6423
 epoch: 60, train_loss: 0.5535, test_loss: 0.8565, test_f1: 0.6397
 epoch: 61, train_loss: 0.5505, test_loss: 0.8005, test_f1: 0.6506
 epoch: 62, train_loss: 0.5513, test_loss: 0.8743, test_f1: 0.6545
 epoch: 63, train_loss: 0.5332, test_loss: 0.8486, test_f1: 0.6451
 epoch: 64, train_loss: 0.5289, test_loss: 0.8455, test_f1: 0.6541
 epoch: 65, train_loss: 0.5294, test_loss: 0.8175, test_f1: 0.6508
 epoch: 66, train_loss: 0.5334, test_loss: 0.8571, test_f1: 0.6348
 epoch: 67, train_loss: 0.5304, test_loss: 0.8984, test_f1: 0.6468
 epoch: 68, train_loss: 0.5367, test_loss: 0.7777, test_f1: 0.6510
 epoch: 69, train_loss: 0.5357, test_loss: 0.8374, test_f1: 0.6576
 epoch: 70, train_loss: 0.5353, test_loss: 0.8383, test_f1: 0.6589
 epoch: 71, train_loss: 0.5272, test_loss: 0.8473, test_f1: 0.6672
 epoch: 72, train_loss: 0.5217, test_loss: 0.8837, test_f1: 0.6574
 epoch: 73, train_loss: 0.5256, test_loss: 0.8359, test_f1: 0.6482
 epoch: 74, train_loss: 0.5209, test_loss: 0.8584, test_f1: 0.6523
 epoch: 75, train_loss: 0.5255, test_loss: 0.7887, test_f1: 0.6667
 epoch: 76, train_loss: 0.5037, test_loss: 0.8539, test_f1: 0.6565
 epoch: 77, train_loss: 0.5156, test_loss: 0.8304, test_f1: 0.6549
 epoch: 78, train_loss: 0.5080, test_loss: 0.8881, test_f1: 0.6604
 epoch: 79, train_loss: 0.5143, test_loss: 0.8724, test_f1: 0.6593
 epoch: 80, train_loss: 0.5131, test_loss: 0.8461, test_f1: 0.6601
 epoch: 81, train_loss: 0.4953, test_loss: 0.8633, test_f1: 0.6570
 epoch: 82, train_loss: 0.5062, test_loss: 0.8815, test_f1: 0.6599
 epoch: 83, train_loss: 0.4895, test_loss: 0.8728, test_f1: 0.6582
 epoch: 84, train_loss: 0.5116, test_loss: 0.9219, test_f1: 0.6680
 epoch: 85, train_loss: 0.4904, test_loss: 0.9003, test_f1: 0.6515
 epoch: 86, train_loss: 0.4992, test_loss: 0.9590, test_f1: 0.6578
 epoch: 87, train_loss: 0.4983, test_loss: 0.9159, test_f1: 0.6495
 epoch: 88, train_loss: 0.4969, test_loss: 0.9383, test_f1: 0.6662
 epoch: 89, train_loss: 0.4942, test_loss: 0.8748, test_f1: 0.6717
 epoch: 90, train_loss: 0.4910, test_loss: 0.9115, test_f1: 0.6816
 epoch: 91, train_loss: 0.4698, test_loss: 0.9143, test_f1: 0.6609
 epoch: 92, train_loss: 0.4790, test_loss: 0.8650, test_f1: 0.6744
 epoch: 93, train_loss: 0.4911, test_loss: 0.8897, test_f1: 0.6772
 epoch: 94, train_loss: 0.4795, test_loss: 0.8702, test_f1: 0.6672
 epoch: 95, train_loss: 0.4761, test_loss: 0.8779, test_f1: 0.6724
 epoch: 96, train_loss: 0.4886, test_loss: 0.8678, test_f1: 0.6800
 epoch: 97, train_loss: 0.4807, test_loss: 0.9179, test_f1: 0.6721
 epoch: 98, train_loss: 0.4770, test_loss: 0.8658, test_f1: 0.6750
 epoch: 99, train_loss: 0.4776, test_loss: 0.8883, test_f1: 0.6708
##################ITERATION #2 ****************************************
 epoch: 0, train_loss: 1.1652, test_loss: 1.0191, test_f1: 0.4144
 epoch: 1, train_loss: 1.0269, test_loss: 0.9745, test_f1: 0.4923
 epoch: 2, train_loss: 0.9907, test_loss: 0.9699, test_f1: 0.4942
 epoch: 3, train_loss: 0.9565, test_loss: 0.9584, test_f1: 0.5283
 epoch: 4, train_loss: 0.9330, test_loss: 0.9288, test_f1: 0.5259
 epoch: 5, train_loss: 0.9158, test_loss: 0.9254, test_f1: 0.5524
 epoch: 6, train_loss: 0.9006, test_loss: 0.9236, test_f1: 0.5578
 epoch: 7, train_loss: 0.8785, test_loss: 0.9238, test_f1: 0.5449
 epoch: 8, train_loss: 0.8693, test_loss: 0.9177, test_f1: 0.5570
 epoch: 9, train_loss: 0.8501, test_loss: 0.8949, test_f1: 0.5605
 epoch: 10, train_loss: 0.8364, test_loss: 0.8778, test_f1: 0.5511
 epoch: 11, train_loss: 0.8233, test_loss: 0.8677, test_f1: 0.5884
 epoch: 12, train_loss: 0.8092, test_loss: 0.8635, test_f1: 0.5762
 epoch: 13, train_loss: 0.8015, test_loss: 0.8828, test_f1: 0.5510
 epoch: 14, train_loss: 0.7988, test_loss: 0.8486, test_f1: 0.5792
 epoch: 15, train_loss: 0.7716, test_loss: 0.8760, test_f1: 0.5558
 epoch: 16, train_loss: 0.7785, test_loss: 0.8254, test_f1: 0.5729
 epoch: 17, train_loss: 0.7710, test_loss: 0.8436, test_f1: 0.5565
 epoch: 18, train_loss: 0.7613, test_loss: 0.8541, test_f1: 0.5818
 epoch: 19, train_loss: 0.7452, test_loss: 0.8252, test_f1: 0.6055
 epoch: 20, train_loss: 0.7332, test_loss: 0.8382, test_f1: 0.5901
 epoch: 21, train_loss: 0.7348, test_loss: 0.8466, test_f1: 0.6015
 epoch: 22, train_loss: 0.7235, test_loss: 0.8188, test_f1: 0.5841
 epoch: 23, train_loss: 0.7154, test_loss: 0.8530, test_f1: 0.5901
 epoch: 24, train_loss: 0.7151, test_loss: 0.8545, test_f1: 0.5848
 epoch: 25, train_loss: 0.7082, test_loss: 0.8175, test_f1: 0.5986
 epoch: 26, train_loss: 0.7070, test_loss: 0.8774, test_f1: 0.5720
 epoch: 27, train_loss: 0.6929, test_loss: 0.8381, test_f1: 0.6253
 epoch: 28, train_loss: 0.6887, test_loss: 0.8300, test_f1: 0.5997
 epoch: 29, train_loss: 0.6757, test_loss: 0.8083, test_f1: 0.6076
 epoch: 30, train_loss: 0.6703, test_loss: 0.8095, test_f1: 0.6090
 epoch: 31, train_loss: 0.6726, test_loss: 0.8015, test_f1: 0.6085
 epoch: 32, train_loss: 0.6638, test_loss: 0.7507, test_f1: 0.6240
 epoch: 33, train_loss: 0.6590, test_loss: 0.8172, test_f1: 0.6046
 epoch: 34, train_loss: 0.6399, test_loss: 0.7938, test_f1: 0.6272
 epoch: 35, train_loss: 0.6370, test_loss: 0.7811, test_f1: 0.6230
 epoch: 36, train_loss: 0.6430, test_loss: 0.8060, test_f1: 0.6323
 epoch: 37, train_loss: 0.6358, test_loss: 0.7751, test_f1: 0.6307
 epoch: 38, train_loss: 0.6296, test_loss: 0.7911, test_f1: 0.6201
 epoch: 39, train_loss: 0.6264, test_loss: 0.8109, test_f1: 0.6230
 epoch: 40, train_loss: 0.6255, test_loss: 0.7630, test_f1: 0.6442
 epoch: 41, train_loss: 0.6158, test_loss: 0.8018, test_f1: 0.6302
 epoch: 42, train_loss: 0.6166, test_loss: 0.8257, test_f1: 0.6340
 epoch: 43, train_loss: 0.6054, test_loss: 0.8370, test_f1: 0.6537
 epoch: 44, train_loss: 0.6011, test_loss: 0.8212, test_f1: 0.6401
 epoch: 45, train_loss: 0.6090, test_loss: 0.8446, test_f1: 0.6511
 epoch: 46, train_loss: 0.6037, test_loss: 0.8246, test_f1: 0.6261
 epoch: 47, train_loss: 0.5724, test_loss: 0.8564, test_f1: 0.6432
 epoch: 48, train_loss: 0.5804, test_loss: 0.8515, test_f1: 0.6509
 epoch: 49, train_loss: 0.5810, test_loss: 0.8642, test_f1: 0.6226
 epoch: 50, train_loss: 0.5771, test_loss: 0.8814, test_f1: 0.6135
 epoch: 51, train_loss: 0.5611, test_loss: 0.8916, test_f1: 0.6217
 epoch: 52, train_loss: 0.5566, test_loss: 0.8545, test_f1: 0.6527
 epoch: 53, train_loss: 0.5469, test_loss: 0.8927, test_f1: 0.6368
 epoch: 54, train_loss: 0.5418, test_loss: 0.8903, test_f1: 0.6279
 epoch: 55, train_loss: 0.5398, test_loss: 0.8793, test_f1: 0.6330
 epoch: 56, train_loss: 0.5357, test_loss: 0.8733, test_f1: 0.6411
 epoch: 57, train_loss: 0.5394, test_loss: 0.8784, test_f1: 0.6221
 epoch: 58, train_loss: 0.5252, test_loss: 0.8822, test_f1: 0.6349
 epoch: 59, train_loss: 0.5394, test_loss: 0.8997, test_f1: 0.6417
 epoch: 60, train_loss: 0.5277, test_loss: 0.9128, test_f1: 0.6384
 epoch: 61, train_loss: 0.5418, test_loss: 0.8931, test_f1: 0.6353
 epoch: 62, train_loss: 0.5234, test_loss: 0.9134, test_f1: 0.6236
 epoch: 63, train_loss: 0.5367, test_loss: 0.8921, test_f1: 0.6506
 epoch: 64, train_loss: 0.5231, test_loss: 0.9318, test_f1: 0.6555
 epoch: 65, train_loss: 0.5195, test_loss: 0.8884, test_f1: 0.6525
 epoch: 66, train_loss: 0.5266, test_loss: 0.8886, test_f1: 0.6469
 epoch: 67, train_loss: 0.5096, test_loss: 0.9403, test_f1: 0.6485
 epoch: 68, train_loss: 0.5179, test_loss: 0.8876, test_f1: 0.6493
 epoch: 69, train_loss: 0.5036, test_loss: 0.9255, test_f1: 0.6491
 epoch: 70, train_loss: 0.5174, test_loss: 0.9137, test_f1: 0.6239
 epoch: 71, train_loss: 0.5142, test_loss: 0.9405, test_f1: 0.6515
 epoch: 72, train_loss: 0.5171, test_loss: 0.9755, test_f1: 0.6165
 epoch: 73, train_loss: 0.5021, test_loss: 0.9124, test_f1: 0.6201
 epoch: 74, train_loss: 0.5019, test_loss: 0.9266, test_f1: 0.6469
 epoch: 75, train_loss: 0.4925, test_loss: 0.9366, test_f1: 0.6485
 epoch: 76, train_loss: 0.4828, test_loss: 0.9195, test_f1: 0.6570
 epoch: 77, train_loss: 0.4863, test_loss: 0.9085, test_f1: 0.6330
 epoch: 78, train_loss: 0.4921, test_loss: 0.9275, test_f1: 0.6511
 epoch: 79, train_loss: 0.4931, test_loss: 0.9768, test_f1: 0.6605
 epoch: 80, train_loss: 0.4907, test_loss: 0.9776, test_f1: 0.6510
 epoch: 81, train_loss: 0.4897, test_loss: 0.9648, test_f1: 0.6499
 epoch: 82, train_loss: 0.4838, test_loss: 0.9552, test_f1: 0.6444
 epoch: 83, train_loss: 0.4784, test_loss: 0.9244, test_f1: 0.6731
 epoch: 84, train_loss: 0.4770, test_loss: 0.9834, test_f1: 0.6695
 epoch: 85, train_loss: 0.4660, test_loss: 0.9627, test_f1: 0.6391
 epoch: 86, train_loss: 0.4753, test_loss: 1.0058, test_f1: 0.6388
 epoch: 87, train_loss: 0.4753, test_loss: 0.9694, test_f1: 0.6589
 epoch: 88, train_loss: 0.4726, test_loss: 0.9972, test_f1: 0.6309
 epoch: 89, train_loss: 0.4571, test_loss: 0.9739, test_f1: 0.6533
 epoch: 90, train_loss: 0.4712, test_loss: 0.9174, test_f1: 0.6628
 epoch: 91, train_loss: 0.4626, test_loss: 0.9974, test_f1: 0.6581
 epoch: 92, train_loss: 0.4607, test_loss: 0.9692, test_f1: 0.6412
 epoch: 93, train_loss: 0.4493, test_loss: 1.0329, test_f1: 0.6406
 epoch: 94, train_loss: 0.4540, test_loss: 1.0035, test_f1: 0.6604
 epoch: 95, train_loss: 0.4629, test_loss: 1.0290, test_f1: 0.6671
 epoch: 96, train_loss: 0.4724, test_loss: 1.0337, test_f1: 0.6520
 epoch: 97, train_loss: 0.4659, test_loss: 1.0046, test_f1: 0.6437
 epoch: 98, train_loss: 0.4499, test_loss: 1.0507, test_f1: 0.6435
 epoch: 99, train_loss: 0.4574, test_loss: 1.0389, test_f1: 0.6650
##################ITERATION #3 ****************************************
 epoch: 0, train_loss: 1.1406, test_loss: 0.9707, test_f1: 0.5236
 epoch: 1, train_loss: 1.0200, test_loss: 0.9469, test_f1: 0.5336
 epoch: 2, train_loss: 0.9842, test_loss: 0.9248, test_f1: 0.5275
 epoch: 3, train_loss: 0.9599, test_loss: 0.9234, test_f1: 0.5566
 epoch: 4, train_loss: 0.9317, test_loss: 0.9094, test_f1: 0.5556
 epoch: 5, train_loss: 0.9179, test_loss: 0.9110, test_f1: 0.5537
 epoch: 6, train_loss: 0.8990, test_loss: 0.8835, test_f1: 0.5844
 epoch: 7, train_loss: 0.8821, test_loss: 0.8830, test_f1: 0.5832
 epoch: 8, train_loss: 0.8795, test_loss: 0.8517, test_f1: 0.5804
 epoch: 9, train_loss: 0.8689, test_loss: 0.8393, test_f1: 0.6021
 epoch: 10, train_loss: 0.8509, test_loss: 0.8539, test_f1: 0.5855
 epoch: 11, train_loss: 0.8319, test_loss: 0.8412, test_f1: 0.5998
 epoch: 12, train_loss: 0.8331, test_loss: 0.8396, test_f1: 0.5903
 epoch: 13, train_loss: 0.8045, test_loss: 0.8322, test_f1: 0.6178
 epoch: 14, train_loss: 0.8041, test_loss: 0.8357, test_f1: 0.6128
 epoch: 15, train_loss: 0.7911, test_loss: 0.8301, test_f1: 0.5928
 epoch: 16, train_loss: 0.7781, test_loss: 0.8260, test_f1: 0.6238
 epoch: 17, train_loss: 0.7692, test_loss: 0.8173, test_f1: 0.5975
 epoch: 18, train_loss: 0.7670, test_loss: 0.7888, test_f1: 0.6057
 epoch: 19, train_loss: 0.7539, test_loss: 0.8215, test_f1: 0.5806
 epoch: 20, train_loss: 0.7559, test_loss: 0.8230, test_f1: 0.6080
 epoch: 21, train_loss: 0.7335, test_loss: 0.8182, test_f1: 0.6186
 epoch: 22, train_loss: 0.7283, test_loss: 0.8145, test_f1: 0.6073
 epoch: 23, train_loss: 0.7332, test_loss: 0.8186, test_f1: 0.6029
 epoch: 24, train_loss: 0.7121, test_loss: 0.8455, test_f1: 0.5928
 epoch: 25, train_loss: 0.7196, test_loss: 0.8115, test_f1: 0.6223
 epoch: 26, train_loss: 0.6961, test_loss: 0.8166, test_f1: 0.5988
 epoch: 27, train_loss: 0.6891, test_loss: 0.7899, test_f1: 0.6183
 epoch: 28, train_loss: 0.6956, test_loss: 0.8064, test_f1: 0.6296
 epoch: 29, train_loss: 0.6901, test_loss: 0.7793, test_f1: 0.6395
 epoch: 30, train_loss: 0.6868, test_loss: 0.8019, test_f1: 0.6433
 epoch: 31, train_loss: 0.6876, test_loss: 0.8532, test_f1: 0.6357
 epoch: 32, train_loss: 0.6713, test_loss: 0.8471, test_f1: 0.6078
 epoch: 33, train_loss: 0.6654, test_loss: 0.7817, test_f1: 0.6312
 epoch: 34, train_loss: 0.6604, test_loss: 0.8170, test_f1: 0.6090
 epoch: 35, train_loss: 0.6689, test_loss: 0.7929, test_f1: 0.6355
 epoch: 36, train_loss: 0.6632, test_loss: 0.8428, test_f1: 0.6242
 epoch: 37, train_loss: 0.6505, test_loss: 0.8024, test_f1: 0.6293
 epoch: 38, train_loss: 0.6265, test_loss: 0.8031, test_f1: 0.6436
 epoch: 39, train_loss: 0.6368, test_loss: 0.8297, test_f1: 0.6200
 epoch: 40, train_loss: 0.6330, test_loss: 0.8059, test_f1: 0.6428
 epoch: 41, train_loss: 0.6373, test_loss: 0.7739, test_f1: 0.6462
 epoch: 42, train_loss: 0.6207, test_loss: 0.8167, test_f1: 0.6331
 epoch: 43, train_loss: 0.6154, test_loss: 0.8737, test_f1: 0.6326
 epoch: 44, train_loss: 0.6066, test_loss: 0.8437, test_f1: 0.6354
 epoch: 45, train_loss: 0.6146, test_loss: 0.8896, test_f1: 0.6261
 epoch: 46, train_loss: 0.6027, test_loss: 0.9019, test_f1: 0.6252
 epoch: 47, train_loss: 0.6068, test_loss: 0.8746, test_f1: 0.6245
 epoch: 48, train_loss: 0.6095, test_loss: 0.9086, test_f1: 0.6205
 epoch: 49, train_loss: 0.5920, test_loss: 0.8839, test_f1: 0.6538
 epoch: 50, train_loss: 0.6055, test_loss: 0.8526, test_f1: 0.6309
 epoch: 51, train_loss: 0.5788, test_loss: 0.8805, test_f1: 0.6293
 epoch: 52, train_loss: 0.5692, test_loss: 0.8934, test_f1: 0.6390
 epoch: 53, train_loss: 0.5592, test_loss: 0.8564, test_f1: 0.6358
 epoch: 54, train_loss: 0.5595, test_loss: 0.8477, test_f1: 0.6318
 epoch: 55, train_loss: 0.5665, test_loss: 0.9121, test_f1: 0.6261
 epoch: 56, train_loss: 0.5502, test_loss: 0.8862, test_f1: 0.6369
 epoch: 57, train_loss: 0.5554, test_loss: 0.8690, test_f1: 0.6423
 epoch: 58, train_loss: 0.5634, test_loss: 0.8584, test_f1: 0.6401
 epoch: 59, train_loss: 0.5504, test_loss: 0.8571, test_f1: 0.6378
 epoch: 60, train_loss: 0.5448, test_loss: 0.9280, test_f1: 0.6351
 epoch: 61, train_loss: 0.5459, test_loss: 0.9632, test_f1: 0.6347
 epoch: 62, train_loss: 0.5386, test_loss: 0.8653, test_f1: 0.6472
 epoch: 63, train_loss: 0.5373, test_loss: 0.9143, test_f1: 0.6414
 epoch: 64, train_loss: 0.5368, test_loss: 0.9003, test_f1: 0.6356
 epoch: 65, train_loss: 0.5314, test_loss: 0.9767, test_f1: 0.6258
 epoch: 66, train_loss: 0.5302, test_loss: 0.9154, test_f1: 0.6344
 epoch: 67, train_loss: 0.5343, test_loss: 0.9292, test_f1: 0.6373
 epoch: 68, train_loss: 0.5237, test_loss: 0.9310, test_f1: 0.6337
 epoch: 69, train_loss: 0.5241, test_loss: 0.8685, test_f1: 0.6360
 epoch: 70, train_loss: 0.5289, test_loss: 0.9121, test_f1: 0.6346
 epoch: 71, train_loss: 0.5258, test_loss: 0.8735, test_f1: 0.6375
 epoch: 72, train_loss: 0.5196, test_loss: 0.9288, test_f1: 0.6398
 epoch: 73, train_loss: 0.5131, test_loss: 0.9570, test_f1: 0.6440
 epoch: 74, train_loss: 0.5275, test_loss: 0.8995, test_f1: 0.6338
 epoch: 75, train_loss: 0.5159, test_loss: 0.8861, test_f1: 0.6493
 epoch: 76, train_loss: 0.5134, test_loss: 0.9589, test_f1: 0.6325
 epoch: 77, train_loss: 0.5136, test_loss: 0.9892, test_f1: 0.6465
 epoch: 78, train_loss: 0.5038, test_loss: 0.8880, test_f1: 0.6394
 epoch: 79, train_loss: 0.5014, test_loss: 0.9648, test_f1: 0.6425
 epoch: 80, train_loss: 0.4957, test_loss: 0.9655, test_f1: 0.6390
 epoch: 81, train_loss: 0.4938, test_loss: 0.9936, test_f1: 0.6406
 epoch: 82, train_loss: 0.4955, test_loss: 1.0170, test_f1: 0.6426
 epoch: 83, train_loss: 0.4983, test_loss: 0.9472, test_f1: 0.6487
 epoch: 84, train_loss: 0.4971, test_loss: 1.0475, test_f1: 0.6245
 epoch: 85, train_loss: 0.4944, test_loss: 1.0077, test_f1: 0.6375
 epoch: 86, train_loss: 0.4862, test_loss: 0.9597, test_f1: 0.6407
 epoch: 87, train_loss: 0.4891, test_loss: 0.9708, test_f1: 0.6399
 epoch: 88, train_loss: 0.4858, test_loss: 0.9873, test_f1: 0.6420
 epoch: 89, train_loss: 0.4863, test_loss: 0.9020, test_f1: 0.6618
 epoch: 90, train_loss: 0.4911, test_loss: 1.0059, test_f1: 0.6406
 epoch: 91, train_loss: 0.4839, test_loss: 1.0128, test_f1: 0.6447
 epoch: 92, train_loss: 0.4775, test_loss: 1.0339, test_f1: 0.6405
 epoch: 93, train_loss: 0.4751, test_loss: 0.9681, test_f1: 0.6442
 epoch: 94, train_loss: 0.4830, test_loss: 0.9864, test_f1: 0.6340
 epoch: 95, train_loss: 0.4807, test_loss: 0.9888, test_f1: 0.6481
 epoch: 96, train_loss: 0.4728, test_loss: 1.0206, test_f1: 0.6498
 epoch: 97, train_loss: 0.4759, test_loss: 0.9285, test_f1: 0.6517
 epoch: 98, train_loss: 0.4749, test_loss: 1.0055, test_f1: 0.6532
 epoch: 99, train_loss: 0.4643, test_loss: 1.0068, test_f1: 0.6463
##################ITERATION #4 ****************************************
 epoch: 0, train_loss: 1.1746, test_loss: 1.0049, test_f1: 0.5061
 epoch: 1, train_loss: 1.0406, test_loss: 0.9777, test_f1: 0.5198
 epoch: 2, train_loss: 0.9973, test_loss: 0.9495, test_f1: 0.5244
 epoch: 3, train_loss: 0.9731, test_loss: 0.9304, test_f1: 0.5474
 epoch: 4, train_loss: 0.9392, test_loss: 0.9201, test_f1: 0.5315
 epoch: 5, train_loss: 0.9344, test_loss: 0.9297, test_f1: 0.5568
 epoch: 6, train_loss: 0.9043, test_loss: 0.9237, test_f1: 0.5402
 epoch: 7, train_loss: 0.8791, test_loss: 0.9029, test_f1: 0.5622
 epoch: 8, train_loss: 0.8793, test_loss: 0.8974, test_f1: 0.5581
 epoch: 9, train_loss: 0.8652, test_loss: 0.8885, test_f1: 0.5723
 epoch: 10, train_loss: 0.8395, test_loss: 0.8780, test_f1: 0.5829
 epoch: 11, train_loss: 0.8397, test_loss: 0.9056, test_f1: 0.5567
 epoch: 12, train_loss: 0.8080, test_loss: 0.9093, test_f1: 0.5853
 epoch: 13, train_loss: 0.8027, test_loss: 0.8978, test_f1: 0.6020
 epoch: 14, train_loss: 0.8019, test_loss: 0.8594, test_f1: 0.6231
 epoch: 15, train_loss: 0.7878, test_loss: 0.8499, test_f1: 0.6161
 epoch: 16, train_loss: 0.7708, test_loss: 0.8499, test_f1: 0.6119
 epoch: 17, train_loss: 0.7633, test_loss: 0.8203, test_f1: 0.5773
 epoch: 18, train_loss: 0.7570, test_loss: 0.8739, test_f1: 0.6080
 epoch: 19, train_loss: 0.7488, test_loss: 0.8530, test_f1: 0.6119
 epoch: 20, train_loss: 0.7406, test_loss: 0.8179, test_f1: 0.6180
 epoch: 21, train_loss: 0.7319, test_loss: 0.8177, test_f1: 0.6468
 epoch: 22, train_loss: 0.7268, test_loss: 0.8044, test_f1: 0.6385
 epoch: 23, train_loss: 0.7075, test_loss: 0.8211, test_f1: 0.6180
 epoch: 24, train_loss: 0.7129, test_loss: 0.8385, test_f1: 0.6356
 epoch: 25, train_loss: 0.6935, test_loss: 0.8285, test_f1: 0.6415
 epoch: 26, train_loss: 0.6931, test_loss: 0.8365, test_f1: 0.6159
 epoch: 27, train_loss: 0.6857, test_loss: 0.8273, test_f1: 0.6340
 epoch: 28, train_loss: 0.6784, test_loss: 0.7984, test_f1: 0.6586
 epoch: 29, train_loss: 0.6672, test_loss: 0.8130, test_f1: 0.6533
 epoch: 30, train_loss: 0.6715, test_loss: 0.8374, test_f1: 0.6393
 epoch: 31, train_loss: 0.6634, test_loss: 0.8112, test_f1: 0.6492
 epoch: 32, train_loss: 0.6674, test_loss: 0.7611, test_f1: 0.6261
 epoch: 33, train_loss: 0.6514, test_loss: 0.7917, test_f1: 0.6593
 epoch: 34, train_loss: 0.6460, test_loss: 0.7672, test_f1: 0.6919
 epoch: 35, train_loss: 0.6435, test_loss: 0.8280, test_f1: 0.6543
 epoch: 36, train_loss: 0.6363, test_loss: 0.7876, test_f1: 0.6379
 epoch: 37, train_loss: 0.6290, test_loss: 0.8018, test_f1: 0.6469
 epoch: 38, train_loss: 0.6401, test_loss: 0.7842, test_f1: 0.6449
 epoch: 39, train_loss: 0.6203, test_loss: 0.7995, test_f1: 0.6489
 epoch: 40, train_loss: 0.6050, test_loss: 0.8018, test_f1: 0.6490
 epoch: 41, train_loss: 0.6036, test_loss: 0.7869, test_f1: 0.6405
 epoch: 42, train_loss: 0.6057, test_loss: 0.7683, test_f1: 0.6408
 epoch: 43, train_loss: 0.6121, test_loss: 0.8658, test_f1: 0.6418
 epoch: 44, train_loss: 0.5970, test_loss: 0.7983, test_f1: 0.6628
 epoch: 45, train_loss: 0.5855, test_loss: 0.8099, test_f1: 0.6603
 epoch: 46, train_loss: 0.5780, test_loss: 0.8392, test_f1: 0.6346
 epoch: 47, train_loss: 0.5785, test_loss: 0.7941, test_f1: 0.6495
 epoch: 48, train_loss: 0.5879, test_loss: 0.7891, test_f1: 0.6374
 epoch: 49, train_loss: 0.5737, test_loss: 0.7954, test_f1: 0.6485
 epoch: 50, train_loss: 0.5627, test_loss: 0.8286, test_f1: 0.6591
 epoch: 51, train_loss: 0.5556, test_loss: 0.8112, test_f1: 0.6622
 epoch: 52, train_loss: 0.5437, test_loss: 0.8309, test_f1: 0.6626
 epoch: 53, train_loss: 0.5388, test_loss: 0.8082, test_f1: 0.6496
 epoch: 54, train_loss: 0.5463, test_loss: 0.8050, test_f1: 0.6764
 epoch: 55, train_loss: 0.5427, test_loss: 0.7913, test_f1: 0.6730
 epoch: 56, train_loss: 0.5307, test_loss: 0.8284, test_f1: 0.6766
 epoch: 57, train_loss: 0.5301, test_loss: 0.8034, test_f1: 0.6542
 epoch: 58, train_loss: 0.5292, test_loss: 0.8508, test_f1: 0.6700
 epoch: 59, train_loss: 0.5234, test_loss: 0.8253, test_f1: 0.6377
 epoch: 60, train_loss: 0.5198, test_loss: 0.8684, test_f1: 0.6518
 epoch: 61, train_loss: 0.5326, test_loss: 0.8787, test_f1: 0.6604
 epoch: 62, train_loss: 0.5170, test_loss: 0.8330, test_f1: 0.6649
 epoch: 63, train_loss: 0.5314, test_loss: 0.8484, test_f1: 0.6670
 epoch: 64, train_loss: 0.5199, test_loss: 0.8736, test_f1: 0.6652
 epoch: 65, train_loss: 0.5213, test_loss: 0.8634, test_f1: 0.6548
 epoch: 66, train_loss: 0.5022, test_loss: 0.7864, test_f1: 0.6612
 epoch: 67, train_loss: 0.5014, test_loss: 0.8256, test_f1: 0.6504
 epoch: 68, train_loss: 0.4991, test_loss: 0.7830, test_f1: 0.6580
 epoch: 69, train_loss: 0.4858, test_loss: 0.8557, test_f1: 0.6562
 epoch: 70, train_loss: 0.5228, test_loss: 0.8032, test_f1: 0.6539
 epoch: 71, train_loss: 0.5028, test_loss: 0.8437, test_f1: 0.6656
 epoch: 72, train_loss: 0.4951, test_loss: 0.8236, test_f1: 0.6625
 epoch: 73, train_loss: 0.5111, test_loss: 0.8285, test_f1: 0.6773
 epoch: 74, train_loss: 0.4967, test_loss: 0.8478, test_f1: 0.6569
 epoch: 75, train_loss: 0.4867, test_loss: 0.8944, test_f1: 0.6518
 epoch: 76, train_loss: 0.4797, test_loss: 0.8449, test_f1: 0.6652
 epoch: 77, train_loss: 0.4857, test_loss: 0.8763, test_f1: 0.6638
 epoch: 78, train_loss: 0.4803, test_loss: 0.8906, test_f1: 0.6640
 epoch: 79, train_loss: 0.4692, test_loss: 0.9138, test_f1: 0.6494
 epoch: 80, train_loss: 0.4804, test_loss: 0.8564, test_f1: 0.6792
 epoch: 81, train_loss: 0.4802, test_loss: 0.8779, test_f1: 0.6677
 epoch: 82, train_loss: 0.4805, test_loss: 0.8746, test_f1: 0.6603
 epoch: 83, train_loss: 0.4576, test_loss: 0.8904, test_f1: 0.6492
 epoch: 84, train_loss: 0.4692, test_loss: 0.8604, test_f1: 0.6550
 epoch: 85, train_loss: 0.4705, test_loss: 0.9037, test_f1: 0.6536
 epoch: 86, train_loss: 0.4754, test_loss: 0.8680, test_f1: 0.6640
 epoch: 87, train_loss: 0.4777, test_loss: 0.8597, test_f1: 0.6573
 epoch: 88, train_loss: 0.4712, test_loss: 0.8704, test_f1: 0.6645
 epoch: 89, train_loss: 0.4504, test_loss: 0.8547, test_f1: 0.6479
 epoch: 90, train_loss: 0.4595, test_loss: 0.8885, test_f1: 0.6733
 epoch: 91, train_loss: 0.4548, test_loss: 0.9101, test_f1: 0.6599
 epoch: 92, train_loss: 0.4645, test_loss: 0.9049, test_f1: 0.6484
 epoch: 93, train_loss: 0.4414, test_loss: 0.8750, test_f1: 0.6576
 epoch: 94, train_loss: 0.4585, test_loss: 0.9522, test_f1: 0.6605
 epoch: 95, train_loss: 0.4536, test_loss: 0.9291, test_f1: 0.6471
 epoch: 96, train_loss: 0.4363, test_loss: 0.9082, test_f1: 0.6704
 epoch: 97, train_loss: 0.4496, test_loss: 0.9139, test_f1: 0.6757
 epoch: 98, train_loss: 0.4483, test_loss: 0.9005, test_f1: 0.6602
 epoch: 99, train_loss: 0.4395, test_loss: 0.9214, test_f1: 0.6800
##################ITERATION #5 ****************************************
 epoch: 0, train_loss: 1.1640, test_loss: 0.9638, test_f1: 0.4930
 epoch: 1, train_loss: 1.0267, test_loss: 0.9592, test_f1: 0.4865
 epoch: 2, train_loss: 0.9862, test_loss: 0.9356, test_f1: 0.5469
 epoch: 3, train_loss: 0.9653, test_loss: 0.9434, test_f1: 0.5342
 epoch: 4, train_loss: 0.9356, test_loss: 0.9214, test_f1: 0.5502
 epoch: 5, train_loss: 0.9238, test_loss: 0.8995, test_f1: 0.5506
 epoch: 6, train_loss: 0.8921, test_loss: 0.8860, test_f1: 0.5621
 epoch: 7, train_loss: 0.8789, test_loss: 0.8786, test_f1: 0.5733
 epoch: 8, train_loss: 0.8680, test_loss: 0.9214, test_f1: 0.5329
 epoch: 9, train_loss: 0.8457, test_loss: 0.9132, test_f1: 0.5607
 epoch: 10, train_loss: 0.8349, test_loss: 0.8779, test_f1: 0.5939
 epoch: 11, train_loss: 0.8388, test_loss: 0.8715, test_f1: 0.6077
 epoch: 12, train_loss: 0.8079, test_loss: 0.8730, test_f1: 0.6120
 epoch: 13, train_loss: 0.7999, test_loss: 0.8684, test_f1: 0.6262
 epoch: 14, train_loss: 0.7904, test_loss: 0.8723, test_f1: 0.6052
 epoch: 15, train_loss: 0.7954, test_loss: 0.8558, test_f1: 0.6263
 epoch: 16, train_loss: 0.7749, test_loss: 0.8595, test_f1: 0.6176
 epoch: 17, train_loss: 0.7661, test_loss: 0.8481, test_f1: 0.6231
 epoch: 18, train_loss: 0.7593, test_loss: 0.8805, test_f1: 0.6246
 epoch: 19, train_loss: 0.7534, test_loss: 0.8678, test_f1: 0.6305
 epoch: 20, train_loss: 0.7261, test_loss: 0.8675, test_f1: 0.6386
 epoch: 21, train_loss: 0.7279, test_loss: 0.8439, test_f1: 0.6348
 epoch: 22, train_loss: 0.7229, test_loss: 0.8527, test_f1: 0.6373
 epoch: 23, train_loss: 0.7118, test_loss: 0.8635, test_f1: 0.6374
 epoch: 24, train_loss: 0.7017, test_loss: 0.8535, test_f1: 0.6369
 epoch: 25, train_loss: 0.6983, test_loss: 0.8535, test_f1: 0.6453
 epoch: 26, train_loss: 0.6940, test_loss: 0.8690, test_f1: 0.6312
 epoch: 27, train_loss: 0.6977, test_loss: 0.8959, test_f1: 0.6184
 epoch: 28, train_loss: 0.6737, test_loss: 0.8775, test_f1: 0.6375
 epoch: 29, train_loss: 0.6734, test_loss: 0.8582, test_f1: 0.6410
 epoch: 30, train_loss: 0.6659, test_loss: 0.8448, test_f1: 0.6492
 epoch: 31, train_loss: 0.6591, test_loss: 0.8683, test_f1: 0.6394
 epoch: 32, train_loss: 0.6518, test_loss: 0.8575, test_f1: 0.6525
 epoch: 33, train_loss: 0.6611, test_loss: 0.9001, test_f1: 0.6111
 epoch: 34, train_loss: 0.6471, test_loss: 0.8678, test_f1: 0.6428
 epoch: 35, train_loss: 0.6460, test_loss: 0.8820, test_f1: 0.6345
 epoch: 36, train_loss: 0.6371, test_loss: 0.8424, test_f1: 0.6634
 epoch: 37, train_loss: 0.6441, test_loss: 0.8478, test_f1: 0.6355
 epoch: 38, train_loss: 0.6275, test_loss: 0.8618, test_f1: 0.6497
 epoch: 39, train_loss: 0.6263, test_loss: 0.8544, test_f1: 0.6350
 epoch: 40, train_loss: 0.6149, test_loss: 0.8334, test_f1: 0.6467
 epoch: 41, train_loss: 0.5996, test_loss: 0.8932, test_f1: 0.6359
 epoch: 42, train_loss: 0.6060, test_loss: 0.8473, test_f1: 0.6437
 epoch: 43, train_loss: 0.5949, test_loss: 0.9211, test_f1: 0.6364
 epoch: 44, train_loss: 0.5970, test_loss: 0.9389, test_f1: 0.6511
 epoch: 45, train_loss: 0.5959, test_loss: 0.8714, test_f1: 0.6661
 epoch: 46, train_loss: 0.5829, test_loss: 0.8680, test_f1: 0.6457
 epoch: 47, train_loss: 0.5822, test_loss: 0.8799, test_f1: 0.6549
 epoch: 48, train_loss: 0.5740, test_loss: 0.8815, test_f1: 0.6703
 epoch: 49, train_loss: 0.5769, test_loss: 0.8497, test_f1: 0.6461
 epoch: 50, train_loss: 0.5633, test_loss: 0.8911, test_f1: 0.6386
 epoch: 51, train_loss: 0.5545, test_loss: 0.8963, test_f1: 0.6453
 epoch: 52, train_loss: 0.5605, test_loss: 0.8459, test_f1: 0.6523
 epoch: 53, train_loss: 0.5451, test_loss: 0.8651, test_f1: 0.6624
 epoch: 54, train_loss: 0.5552, test_loss: 0.8839, test_f1: 0.6559
 epoch: 55, train_loss: 0.5470, test_loss: 0.8616, test_f1: 0.6458
 epoch: 56, train_loss: 0.5489, test_loss: 0.8501, test_f1: 0.6809
 epoch: 57, train_loss: 0.5329, test_loss: 0.9320, test_f1: 0.6497
 epoch: 58, train_loss: 0.5305, test_loss: 0.8953, test_f1: 0.6619
 epoch: 59, train_loss: 0.5292, test_loss: 0.8911, test_f1: 0.6392
 epoch: 60, train_loss: 0.5256, test_loss: 0.9071, test_f1: 0.6312
 epoch: 61, train_loss: 0.5259, test_loss: 0.8955, test_f1: 0.6511
 epoch: 62, train_loss: 0.5305, test_loss: 0.8947, test_f1: 0.6579
 epoch: 63, train_loss: 0.5165, test_loss: 0.8796, test_f1: 0.6409
 epoch: 64, train_loss: 0.5248, test_loss: 0.9068, test_f1: 0.6692
 epoch: 65, train_loss: 0.5159, test_loss: 0.9187, test_f1: 0.6596
 epoch: 66, train_loss: 0.5128, test_loss: 0.9284, test_f1: 0.6393
 epoch: 67, train_loss: 0.5266, test_loss: 0.9558, test_f1: 0.6367
 epoch: 68, train_loss: 0.5118, test_loss: 0.9094, test_f1: 0.6525
 epoch: 69, train_loss: 0.5090, test_loss: 0.9094, test_f1: 0.6598
 epoch: 70, train_loss: 0.5037, test_loss: 0.9748, test_f1: 0.6344
 epoch: 71, train_loss: 0.5001, test_loss: 0.9261, test_f1: 0.6321
 epoch: 72, train_loss: 0.5001, test_loss: 0.9506, test_f1: 0.6586
 epoch: 73, train_loss: 0.5146, test_loss: 0.9436, test_f1: 0.6411
 epoch: 74, train_loss: 0.5047, test_loss: 0.9531, test_f1: 0.6347
 epoch: 75, train_loss: 0.5054, test_loss: 0.9778, test_f1: 0.6382
 epoch: 76, train_loss: 0.4995, test_loss: 0.9251, test_f1: 0.6711
 epoch: 77, train_loss: 0.4942, test_loss: 0.9396, test_f1: 0.6272
 epoch: 78, train_loss: 0.4907, test_loss: 0.9276, test_f1: 0.6547
 epoch: 79, train_loss: 0.4783, test_loss: 0.9616, test_f1: 0.6357
 epoch: 80, train_loss: 0.4937, test_loss: 0.9776, test_f1: 0.6402
 epoch: 81, train_loss: 0.4780, test_loss: 0.9723, test_f1: 0.6468
 epoch: 82, train_loss: 0.4825, test_loss: 0.8994, test_f1: 0.6435
 epoch: 83, train_loss: 0.4770, test_loss: 0.9555, test_f1: 0.6615
 epoch: 84, train_loss: 0.4843, test_loss: 0.9070, test_f1: 0.6424
 epoch: 85, train_loss: 0.4687, test_loss: 0.9356, test_f1: 0.6734
 epoch: 86, train_loss: 0.4782, test_loss: 1.0554, test_f1: 0.6589
 epoch: 87, train_loss: 0.4792, test_loss: 0.9511, test_f1: 0.6389
 epoch: 88, train_loss: 0.4612, test_loss: 0.9886, test_f1: 0.6392
 epoch: 89, train_loss: 0.4631, test_loss: 0.9347, test_f1: 0.6428
 epoch: 90, train_loss: 0.4637, test_loss: 0.9671, test_f1: 0.6572
 epoch: 91, train_loss: 0.4707, test_loss: 0.9877, test_f1: 0.6355
 epoch: 92, train_loss: 0.4668, test_loss: 0.9635, test_f1: 0.6625
 epoch: 93, train_loss: 0.4676, test_loss: 1.0271, test_f1: 0.6282
 epoch: 94, train_loss: 0.4667, test_loss: 1.0489, test_f1: 0.6364
 epoch: 95, train_loss: 0.4587, test_loss: 0.9953, test_f1: 0.6454
 epoch: 96, train_loss: 0.4621, test_loss: 0.9833, test_f1: 0.6429
 epoch: 97, train_loss: 0.4598, test_loss: 1.0598, test_f1: 0.6386
 epoch: 98, train_loss: 0.4437, test_loss: 0.9832, test_f1: 0.6666
 epoch: 99, train_loss: 0.4464, test_loss: 0.9636, test_f1: 0.6432
##################ITERATION #6 ****************************************
 epoch: 0, train_loss: 1.2026, test_loss: 1.0108, test_f1: 0.4922
 epoch: 1, train_loss: 1.0583, test_loss: 0.9796, test_f1: 0.5196
 epoch: 2, train_loss: 1.0147, test_loss: 0.9609, test_f1: 0.5290
 epoch: 3, train_loss: 0.9762, test_loss: 0.9614, test_f1: 0.5175
 epoch: 4, train_loss: 0.9569, test_loss: 0.9526, test_f1: 0.5542
 epoch: 5, train_loss: 0.9465, test_loss: 0.9292, test_f1: 0.5354
 epoch: 6, train_loss: 0.9170, test_loss: 0.9084, test_f1: 0.5378
 epoch: 7, train_loss: 0.9052, test_loss: 0.9530, test_f1: 0.5521
 epoch: 8, train_loss: 0.8815, test_loss: 0.9071, test_f1: 0.5375
 epoch: 9, train_loss: 0.8662, test_loss: 0.8738, test_f1: 0.5747
 epoch: 10, train_loss: 0.8538, test_loss: 0.8831, test_f1: 0.6141
 epoch: 11, train_loss: 0.8413, test_loss: 0.8690, test_f1: 0.6180
 epoch: 12, train_loss: 0.8220, test_loss: 0.8462, test_f1: 0.6068
 epoch: 13, train_loss: 0.8177, test_loss: 0.8596, test_f1: 0.5871
 epoch: 14, train_loss: 0.8180, test_loss: 0.8364, test_f1: 0.6241
 epoch: 15, train_loss: 0.7992, test_loss: 0.8472, test_f1: 0.6191
 epoch: 16, train_loss: 0.7739, test_loss: 0.8114, test_f1: 0.6158
 epoch: 17, train_loss: 0.7765, test_loss: 0.8418, test_f1: 0.6189
 epoch: 18, train_loss: 0.7656, test_loss: 0.7947, test_f1: 0.6266
 epoch: 19, train_loss: 0.7563, test_loss: 0.7992, test_f1: 0.6332
 epoch: 20, train_loss: 0.7544, test_loss: 0.7925, test_f1: 0.6186
 epoch: 21, train_loss: 0.7400, test_loss: 0.8276, test_f1: 0.6247
 epoch: 22, train_loss: 0.7356, test_loss: 0.8092, test_f1: 0.6319
 epoch: 23, train_loss: 0.7211, test_loss: 0.7850, test_f1: 0.6270
 epoch: 24, train_loss: 0.7227, test_loss: 0.7741, test_f1: 0.6342
 epoch: 25, train_loss: 0.7101, test_loss: 0.7770, test_f1: 0.6412
 epoch: 26, train_loss: 0.7181, test_loss: 0.7386, test_f1: 0.6499
 epoch: 27, train_loss: 0.6889, test_loss: 0.7588, test_f1: 0.6351
 epoch: 28, train_loss: 0.6976, test_loss: 0.7658, test_f1: 0.6453
 epoch: 29, train_loss: 0.6693, test_loss: 0.7749, test_f1: 0.6370
 epoch: 30, train_loss: 0.6960, test_loss: 0.7393, test_f1: 0.6606
 epoch: 31, train_loss: 0.6769, test_loss: 0.7494, test_f1: 0.6371
 epoch: 32, train_loss: 0.6607, test_loss: 0.7306, test_f1: 0.6329
 epoch: 33, train_loss: 0.6652, test_loss: 0.7449, test_f1: 0.6605
 epoch: 34, train_loss: 0.6551, test_loss: 0.7608, test_f1: 0.6565
 epoch: 35, train_loss: 0.6588, test_loss: 0.7747, test_f1: 0.6286
 epoch: 36, train_loss: 0.6569, test_loss: 0.7880, test_f1: 0.6362
 epoch: 37, train_loss: 0.6434, test_loss: 0.7642, test_f1: 0.6616
 epoch: 38, train_loss: 0.6343, test_loss: 0.7861, test_f1: 0.6485
 epoch: 39, train_loss: 0.6253, test_loss: 0.7459, test_f1: 0.6484
 epoch: 40, train_loss: 0.6348, test_loss: 0.7476, test_f1: 0.6631
 epoch: 41, train_loss: 0.6312, test_loss: 0.7438, test_f1: 0.6433
 epoch: 42, train_loss: 0.6181, test_loss: 0.7637, test_f1: 0.6388
 epoch: 43, train_loss: 0.6090, test_loss: 0.7438, test_f1: 0.6525
 epoch: 44, train_loss: 0.6204, test_loss: 0.8384, test_f1: 0.6281
 epoch: 45, train_loss: 0.6072, test_loss: 0.8006, test_f1: 0.6361
 epoch: 46, train_loss: 0.5974, test_loss: 0.7588, test_f1: 0.6488
 epoch: 47, train_loss: 0.5990, test_loss: 0.7381, test_f1: 0.6566
 epoch: 48, train_loss: 0.5981, test_loss: 0.7746, test_f1: 0.6545
 epoch: 49, train_loss: 0.5979, test_loss: 0.7907, test_f1: 0.6414
 epoch: 50, train_loss: 0.5906, test_loss: 0.7707, test_f1: 0.6268
 epoch: 51, train_loss: 0.5644, test_loss: 0.7258, test_f1: 0.6727
 epoch: 52, train_loss: 0.5580, test_loss: 0.7449, test_f1: 0.6669
 epoch: 53, train_loss: 0.5696, test_loss: 0.7308, test_f1: 0.6727
 epoch: 54, train_loss: 0.5635, test_loss: 0.7672, test_f1: 0.6516
 epoch: 55, train_loss: 0.5590, test_loss: 0.7478, test_f1: 0.6628
 epoch: 56, train_loss: 0.5476, test_loss: 0.7483, test_f1: 0.6545
 epoch: 57, train_loss: 0.5661, test_loss: 0.7336, test_f1: 0.6486
 epoch: 58, train_loss: 0.5460, test_loss: 0.7147, test_f1: 0.6696
 epoch: 59, train_loss: 0.5375, test_loss: 0.7278, test_f1: 0.6744
 epoch: 60, train_loss: 0.5366, test_loss: 0.7688, test_f1: 0.6620
 epoch: 61, train_loss: 0.5356, test_loss: 0.7452, test_f1: 0.6760
 epoch: 62, train_loss: 0.5302, test_loss: 0.7285, test_f1: 0.6770
 epoch: 63, train_loss: 0.5476, test_loss: 0.7655, test_f1: 0.6489
 epoch: 64, train_loss: 0.5348, test_loss: 0.7635, test_f1: 0.6500
 epoch: 65, train_loss: 0.5361, test_loss: 0.7753, test_f1: 0.6551
 epoch: 66, train_loss: 0.5250, test_loss: 0.7315, test_f1: 0.6893
 epoch: 67, train_loss: 0.5370, test_loss: 0.7992, test_f1: 0.6451
 epoch: 68, train_loss: 0.5267, test_loss: 0.7827, test_f1: 0.6336
 epoch: 69, train_loss: 0.5188, test_loss: 0.7434, test_f1: 0.6886
 epoch: 70, train_loss: 0.5161, test_loss: 0.7461, test_f1: 0.6686
 epoch: 71, train_loss: 0.5284, test_loss: 0.7583, test_f1: 0.6585
 epoch: 72, train_loss: 0.5114, test_loss: 0.7269, test_f1: 0.6807
 epoch: 73, train_loss: 0.5085, test_loss: 0.7240, test_f1: 0.6810
 epoch: 74, train_loss: 0.5035, test_loss: 0.7581, test_f1: 0.6752
 epoch: 75, train_loss: 0.5128, test_loss: 0.7613, test_f1: 0.6642
 epoch: 76, train_loss: 0.5177, test_loss: 0.7218, test_f1: 0.6743
 epoch: 77, train_loss: 0.5066, test_loss: 0.7815, test_f1: 0.6522
 epoch: 78, train_loss: 0.5048, test_loss: 0.7678, test_f1: 0.6746
 epoch: 79, train_loss: 0.5219, test_loss: 0.7545, test_f1: 0.6703
 epoch: 80, train_loss: 0.4977, test_loss: 0.8014, test_f1: 0.6585
 epoch: 81, train_loss: 0.4824, test_loss: 0.8225, test_f1: 0.6280
 epoch: 82, train_loss: 0.4877, test_loss: 0.7424, test_f1: 0.6852
 epoch: 83, train_loss: 0.4886, test_loss: 0.7958, test_f1: 0.6651
 epoch: 84, train_loss: 0.4956, test_loss: 0.7338, test_f1: 0.6657
 epoch: 85, train_loss: 0.4903, test_loss: 0.7461, test_f1: 0.6830
 epoch: 86, train_loss: 0.4867, test_loss: 0.7859, test_f1: 0.6600
 epoch: 87, train_loss: 0.4836, test_loss: 0.7937, test_f1: 0.6684
 epoch: 88, train_loss: 0.4897, test_loss: 0.8321, test_f1: 0.6693
 epoch: 89, train_loss: 0.4787, test_loss: 0.7899, test_f1: 0.6557
 epoch: 90, train_loss: 0.4762, test_loss: 0.7812, test_f1: 0.6563
 epoch: 91, train_loss: 0.4785, test_loss: 0.8190, test_f1: 0.6441
 epoch: 92, train_loss: 0.4757, test_loss: 0.8237, test_f1: 0.6456
 epoch: 93, train_loss: 0.4792, test_loss: 0.8051, test_f1: 0.6657
 epoch: 94, train_loss: 0.4752, test_loss: 0.8571, test_f1: 0.6585
 epoch: 95, train_loss: 0.4741, test_loss: 0.8119, test_f1: 0.6463
 epoch: 96, train_loss: 0.4576, test_loss: 0.8915, test_f1: 0.6373
 epoch: 97, train_loss: 0.4645, test_loss: 0.8345, test_f1: 0.6540
 epoch: 98, train_loss: 0.4522, test_loss: 0.7857, test_f1: 0.6673
 epoch: 99, train_loss: 0.4758, test_loss: 0.7937, test_f1: 0.6569
##################ITERATION #7 ****************************************
 epoch: 0, train_loss: 1.1500, test_loss: 0.9720, test_f1: 0.4817
 epoch: 1, train_loss: 1.0350, test_loss: 0.9516, test_f1: 0.5191
 epoch: 2, train_loss: 0.9756, test_loss: 0.9519, test_f1: 0.4963
 epoch: 3, train_loss: 0.9568, test_loss: 0.9214, test_f1: 0.5465
 epoch: 4, train_loss: 0.9304, test_loss: 0.9243, test_f1: 0.5300
 epoch: 5, train_loss: 0.9088, test_loss: 0.9289, test_f1: 0.5499
 epoch: 6, train_loss: 0.8999, test_loss: 0.9172, test_f1: 0.5436
 epoch: 7, train_loss: 0.8732, test_loss: 0.9108, test_f1: 0.5603
 epoch: 8, train_loss: 0.8710, test_loss: 0.9185, test_f1: 0.5363
 epoch: 9, train_loss: 0.8528, test_loss: 0.8906, test_f1: 0.5505
 epoch: 10, train_loss: 0.8370, test_loss: 0.8999, test_f1: 0.5675
 epoch: 11, train_loss: 0.8234, test_loss: 0.9244, test_f1: 0.5719
 epoch: 12, train_loss: 0.8198, test_loss: 0.8840, test_f1: 0.5746
 epoch: 13, train_loss: 0.8147, test_loss: 0.8570, test_f1: 0.5793
 epoch: 14, train_loss: 0.8069, test_loss: 0.9053, test_f1: 0.5727
 epoch: 15, train_loss: 0.8059, test_loss: 0.8875, test_f1: 0.5850
 epoch: 16, train_loss: 0.7812, test_loss: 0.8966, test_f1: 0.5841
 epoch: 17, train_loss: 0.7665, test_loss: 0.9027, test_f1: 0.5947
 epoch: 18, train_loss: 0.7628, test_loss: 0.8600, test_f1: 0.5904
 epoch: 19, train_loss: 0.7541, test_loss: 0.8922, test_f1: 0.5757
 epoch: 20, train_loss: 0.7500, test_loss: 0.8860, test_f1: 0.5988
 epoch: 21, train_loss: 0.7415, test_loss: 0.8800, test_f1: 0.6070
 epoch: 22, train_loss: 0.7279, test_loss: 0.9242, test_f1: 0.5899
 epoch: 23, train_loss: 0.7316, test_loss: 0.8660, test_f1: 0.6184
 epoch: 24, train_loss: 0.7167, test_loss: 0.9048, test_f1: 0.6004
 epoch: 25, train_loss: 0.7127, test_loss: 0.8419, test_f1: 0.6189
 epoch: 26, train_loss: 0.7035, test_loss: 0.8558, test_f1: 0.5879
 epoch: 27, train_loss: 0.6968, test_loss: 0.8149, test_f1: 0.6149
 epoch: 28, train_loss: 0.6871, test_loss: 0.8494, test_f1: 0.6218
 epoch: 29, train_loss: 0.6747, test_loss: 0.8100, test_f1: 0.6368
 epoch: 30, train_loss: 0.6880, test_loss: 0.9011, test_f1: 0.6133
 epoch: 31, train_loss: 0.6770, test_loss: 0.8275, test_f1: 0.6293
 epoch: 32, train_loss: 0.6678, test_loss: 0.8576, test_f1: 0.6182
 epoch: 33, train_loss: 0.6538, test_loss: 0.8844, test_f1: 0.6279
 epoch: 34, train_loss: 0.6547, test_loss: 0.8151, test_f1: 0.6300
 epoch: 35, train_loss: 0.6376, test_loss: 0.8779, test_f1: 0.6293
 epoch: 36, train_loss: 0.6273, test_loss: 0.8582, test_f1: 0.6184
 epoch: 37, train_loss: 0.6322, test_loss: 0.8593, test_f1: 0.6241
 epoch: 38, train_loss: 0.6397, test_loss: 0.8788, test_f1: 0.6055
 epoch: 39, train_loss: 0.6168, test_loss: 0.8259, test_f1: 0.6259
 epoch: 40, train_loss: 0.6229, test_loss: 0.8286, test_f1: 0.6518
 epoch: 41, train_loss: 0.6232, test_loss: 0.8671, test_f1: 0.6424
 epoch: 42, train_loss: 0.6162, test_loss: 0.8499, test_f1: 0.6424
 epoch: 43, train_loss: 0.6109, test_loss: 0.9418, test_f1: 0.5994
 epoch: 44, train_loss: 0.6021, test_loss: 0.8301, test_f1: 0.6536
 epoch: 45, train_loss: 0.6001, test_loss: 0.8453, test_f1: 0.6315
 epoch: 46, train_loss: 0.5859, test_loss: 0.8107, test_f1: 0.6387
 epoch: 47, train_loss: 0.5902, test_loss: 0.8859, test_f1: 0.6108
 epoch: 48, train_loss: 0.5799, test_loss: 0.8498, test_f1: 0.6234
 epoch: 49, train_loss: 0.5861, test_loss: 0.8504, test_f1: 0.6204
 epoch: 50, train_loss: 0.5651, test_loss: 0.9081, test_f1: 0.6130
 epoch: 51, train_loss: 0.5526, test_loss: 0.8633, test_f1: 0.6241
 epoch: 52, train_loss: 0.5550, test_loss: 0.8287, test_f1: 0.6218
 epoch: 53, train_loss: 0.5506, test_loss: 0.8514, test_f1: 0.6476
 epoch: 54, train_loss: 0.5437, test_loss: 0.8526, test_f1: 0.6325
 epoch: 55, train_loss: 0.5369, test_loss: 0.8737, test_f1: 0.6305
 epoch: 56, train_loss: 0.5410, test_loss: 0.8407, test_f1: 0.6430
 epoch: 57, train_loss: 0.5402, test_loss: 0.8438, test_f1: 0.6294
 epoch: 58, train_loss: 0.5438, test_loss: 0.8727, test_f1: 0.6293
 epoch: 59, train_loss: 0.5362, test_loss: 0.8365, test_f1: 0.6172
 epoch: 60, train_loss: 0.5373, test_loss: 0.8578, test_f1: 0.6310
 epoch: 61, train_loss: 0.5215, test_loss: 0.8538, test_f1: 0.6324
 epoch: 62, train_loss: 0.5100, test_loss: 0.9354, test_f1: 0.6271
 epoch: 63, train_loss: 0.5232, test_loss: 0.8804, test_f1: 0.6219
 epoch: 64, train_loss: 0.5188, test_loss: 0.8586, test_f1: 0.6391
 epoch: 65, train_loss: 0.5145, test_loss: 0.8900, test_f1: 0.6227
 epoch: 66, train_loss: 0.5168, test_loss: 0.8899, test_f1: 0.6399
 epoch: 67, train_loss: 0.5124, test_loss: 0.8924, test_f1: 0.6258
 epoch: 68, train_loss: 0.5184, test_loss: 0.8660, test_f1: 0.6335
 epoch: 69, train_loss: 0.4953, test_loss: 0.8805, test_f1: 0.6513
 epoch: 70, train_loss: 0.5124, test_loss: 0.8974, test_f1: 0.6363
 epoch: 71, train_loss: 0.4965, test_loss: 0.8885, test_f1: 0.6247
 epoch: 72, train_loss: 0.4945, test_loss: 0.9256, test_f1: 0.6211
 epoch: 73, train_loss: 0.5023, test_loss: 0.8823, test_f1: 0.6386
 epoch: 74, train_loss: 0.4992, test_loss: 0.9177, test_f1: 0.6261
 epoch: 75, train_loss: 0.5008, test_loss: 0.9490, test_f1: 0.6391
 epoch: 76, train_loss: 0.4980, test_loss: 0.9392, test_f1: 0.6275
 epoch: 77, train_loss: 0.4939, test_loss: 0.9125, test_f1: 0.6338
 epoch: 78, train_loss: 0.4832, test_loss: 1.0211, test_f1: 0.5986
 epoch: 79, train_loss: 0.5037, test_loss: 0.9193, test_f1: 0.6518
 epoch: 80, train_loss: 0.4919, test_loss: 0.9615, test_f1: 0.6176
 epoch: 81, train_loss: 0.4999, test_loss: 0.9081, test_f1: 0.6325
 epoch: 82, train_loss: 0.4765, test_loss: 0.9367, test_f1: 0.6452
 epoch: 83, train_loss: 0.4881, test_loss: 1.0144, test_f1: 0.6171
 epoch: 84, train_loss: 0.4747, test_loss: 0.9281, test_f1: 0.6484
 epoch: 85, train_loss: 0.4741, test_loss: 0.9004, test_f1: 0.6564
 epoch: 86, train_loss: 0.4713, test_loss: 0.9765, test_f1: 0.6379
 epoch: 87, train_loss: 0.4739, test_loss: 0.9789, test_f1: 0.6301
 epoch: 88, train_loss: 0.4670, test_loss: 0.9977, test_f1: 0.6313
 epoch: 89, train_loss: 0.4654, test_loss: 0.9785, test_f1: 0.6360
 epoch: 90, train_loss: 0.4721, test_loss: 0.9470, test_f1: 0.6249
 epoch: 91, train_loss: 0.4568, test_loss: 0.9769, test_f1: 0.6379
 epoch: 92, train_loss: 0.4689, test_loss: 0.9498, test_f1: 0.6418
 epoch: 93, train_loss: 0.4634, test_loss: 0.9121, test_f1: 0.6397
 epoch: 94, train_loss: 0.4571, test_loss: 0.9284, test_f1: 0.6257
 epoch: 95, train_loss: 0.4474, test_loss: 0.9638, test_f1: 0.6396
 epoch: 96, train_loss: 0.4463, test_loss: 0.9912, test_f1: 0.6291
 epoch: 97, train_loss: 0.4583, test_loss: 1.0740, test_f1: 0.6222
 epoch: 98, train_loss: 0.4527, test_loss: 0.9998, test_f1: 0.6357
 epoch: 99, train_loss: 0.4454, test_loss: 1.0295, test_f1: 0.6176
##################ITERATION #8 ****************************************
 epoch: 0, train_loss: 1.2057, test_loss: 1.0181, test_f1: 0.4364
 epoch: 1, train_loss: 1.0658, test_loss: 0.9792, test_f1: 0.4722
 epoch: 2, train_loss: 1.0162, test_loss: 0.9563, test_f1: 0.4915
 epoch: 3, train_loss: 0.9983, test_loss: 0.9304, test_f1: 0.5379
 epoch: 4, train_loss: 0.9507, test_loss: 0.9336, test_f1: 0.5123
 epoch: 5, train_loss: 0.9454, test_loss: 0.9264, test_f1: 0.5279
 epoch: 6, train_loss: 0.9279, test_loss: 0.8984, test_f1: 0.5323
 epoch: 7, train_loss: 0.9023, test_loss: 0.8843, test_f1: 0.5393
 epoch: 8, train_loss: 0.8977, test_loss: 0.8962, test_f1: 0.5645
 epoch: 9, train_loss: 0.8664, test_loss: 0.8885, test_f1: 0.5858
 epoch: 10, train_loss: 0.8604, test_loss: 0.9088, test_f1: 0.5540
 epoch: 11, train_loss: 0.8519, test_loss: 0.8988, test_f1: 0.5559
 epoch: 12, train_loss: 0.8413, test_loss: 0.9120, test_f1: 0.5499
 epoch: 13, train_loss: 0.8286, test_loss: 0.8404, test_f1: 0.5909
 epoch: 14, train_loss: 0.8153, test_loss: 0.8822, test_f1: 0.5975
 epoch: 15, train_loss: 0.7985, test_loss: 0.9039, test_f1: 0.5853
 epoch: 16, train_loss: 0.7920, test_loss: 0.8916, test_f1: 0.5803
 epoch: 17, train_loss: 0.7902, test_loss: 0.8768, test_f1: 0.5688
 epoch: 18, train_loss: 0.7722, test_loss: 0.8387, test_f1: 0.5759
 epoch: 19, train_loss: 0.7724, test_loss: 0.8747, test_f1: 0.5805
 epoch: 20, train_loss: 0.7708, test_loss: 0.8693, test_f1: 0.5944
 epoch: 21, train_loss: 0.7609, test_loss: 0.9286, test_f1: 0.5802
 epoch: 22, train_loss: 0.7564, test_loss: 0.8159, test_f1: 0.6182
 epoch: 23, train_loss: 0.7456, test_loss: 0.8447, test_f1: 0.6004
 epoch: 24, train_loss: 0.7446, test_loss: 0.8732, test_f1: 0.5858
 epoch: 25, train_loss: 0.7260, test_loss: 0.8589, test_f1: 0.6173
 epoch: 26, train_loss: 0.7290, test_loss: 0.8548, test_f1: 0.5981
 epoch: 27, train_loss: 0.7244, test_loss: 0.8780, test_f1: 0.5987
 epoch: 28, train_loss: 0.7176, test_loss: 0.8572, test_f1: 0.5854
 epoch: 29, train_loss: 0.7007, test_loss: 0.8623, test_f1: 0.6050
 epoch: 30, train_loss: 0.7098, test_loss: 0.8188, test_f1: 0.6258
 epoch: 31, train_loss: 0.6921, test_loss: 0.8305, test_f1: 0.5999
 epoch: 32, train_loss: 0.6923, test_loss: 0.7955, test_f1: 0.6043
 epoch: 33, train_loss: 0.6756, test_loss: 0.8448, test_f1: 0.6060
 epoch: 34, train_loss: 0.6850, test_loss: 0.8273, test_f1: 0.6238
 epoch: 35, train_loss: 0.6588, test_loss: 0.8228, test_f1: 0.5895
 epoch: 36, train_loss: 0.6707, test_loss: 0.7847, test_f1: 0.6234
 epoch: 37, train_loss: 0.6632, test_loss: 0.8157, test_f1: 0.6299
 epoch: 38, train_loss: 0.6687, test_loss: 0.8420, test_f1: 0.5902
 epoch: 39, train_loss: 0.6613, test_loss: 0.8403, test_f1: 0.6148
 epoch: 40, train_loss: 0.6409, test_loss: 0.7988, test_f1: 0.6285
 epoch: 41, train_loss: 0.6367, test_loss: 0.8513, test_f1: 0.6153
 epoch: 42, train_loss: 0.6331, test_loss: 0.7980, test_f1: 0.6277
 epoch: 43, train_loss: 0.6369, test_loss: 0.7744, test_f1: 0.6214
 epoch: 44, train_loss: 0.6356, test_loss: 0.7785, test_f1: 0.6279
 epoch: 45, train_loss: 0.6136, test_loss: 0.7858, test_f1: 0.6408
 epoch: 46, train_loss: 0.6086, test_loss: 0.8418, test_f1: 0.6174
 epoch: 47, train_loss: 0.6152, test_loss: 0.8205, test_f1: 0.6151
 epoch: 48, train_loss: 0.6167, test_loss: 0.8195, test_f1: 0.6018
 epoch: 49, train_loss: 0.6059, test_loss: 0.7819, test_f1: 0.6245
 epoch: 50, train_loss: 0.6096, test_loss: 0.9324, test_f1: 0.6067
 epoch: 51, train_loss: 0.5900, test_loss: 0.7705, test_f1: 0.6600
 epoch: 52, train_loss: 0.5865, test_loss: 0.8103, test_f1: 0.6344
 epoch: 53, train_loss: 0.5898, test_loss: 0.8266, test_f1: 0.6217
 epoch: 54, train_loss: 0.5899, test_loss: 0.8051, test_f1: 0.6412
 epoch: 55, train_loss: 0.5736, test_loss: 0.7995, test_f1: 0.6480
 epoch: 56, train_loss: 0.5769, test_loss: 0.7671, test_f1: 0.6376
 epoch: 57, train_loss: 0.5660, test_loss: 0.8477, test_f1: 0.6349
 epoch: 58, train_loss: 0.5655, test_loss: 0.8259, test_f1: 0.6381
 epoch: 59, train_loss: 0.5793, test_loss: 0.8106, test_f1: 0.6330
 epoch: 60, train_loss: 0.5666, test_loss: 0.8573, test_f1: 0.6194
 epoch: 61, train_loss: 0.5696, test_loss: 0.7970, test_f1: 0.6287
 epoch: 62, train_loss: 0.5545, test_loss: 0.7893, test_f1: 0.6357
 epoch: 63, train_loss: 0.5419, test_loss: 0.8093, test_f1: 0.6383
 epoch: 64, train_loss: 0.5514, test_loss: 0.8065, test_f1: 0.6471
 epoch: 65, train_loss: 0.5572, test_loss: 0.8162, test_f1: 0.6448
 epoch: 66, train_loss: 0.5519, test_loss: 0.8765, test_f1: 0.6403
 epoch: 67, train_loss: 0.5374, test_loss: 0.8795, test_f1: 0.6247
 epoch: 68, train_loss: 0.5516, test_loss: 0.8170, test_f1: 0.6469
 epoch: 69, train_loss: 0.5413, test_loss: 0.8226, test_f1: 0.6583
 epoch: 70, train_loss: 0.5334, test_loss: 0.8190, test_f1: 0.6603
 epoch: 71, train_loss: 0.5370, test_loss: 0.8242, test_f1: 0.6651
 epoch: 72, train_loss: 0.5373, test_loss: 0.8957, test_f1: 0.6627
 epoch: 73, train_loss: 0.5300, test_loss: 0.9575, test_f1: 0.6547
 epoch: 74, train_loss: 0.5294, test_loss: 0.8375, test_f1: 0.6635
 epoch: 75, train_loss: 0.5297, test_loss: 0.9314, test_f1: 0.6643
 epoch: 76, train_loss: 0.5374, test_loss: 0.8761, test_f1: 0.6519
 epoch: 77, train_loss: 0.5248, test_loss: 0.8317, test_f1: 0.6557
 epoch: 78, train_loss: 0.5160, test_loss: 0.8739, test_f1: 0.6529
 epoch: 79, train_loss: 0.5167, test_loss: 0.9097, test_f1: 0.6358
 epoch: 80, train_loss: 0.5006, test_loss: 0.8397, test_f1: 0.6453
 epoch: 81, train_loss: 0.5292, test_loss: 0.8395, test_f1: 0.6440
 epoch: 82, train_loss: 0.5109, test_loss: 0.8822, test_f1: 0.6489
 epoch: 83, train_loss: 0.5132, test_loss: 0.8719, test_f1: 0.6506
 epoch: 84, train_loss: 0.5200, test_loss: 0.8622, test_f1: 0.6488
 epoch: 85, train_loss: 0.4965, test_loss: 0.8476, test_f1: 0.6697
 epoch: 86, train_loss: 0.5110, test_loss: 0.8074, test_f1: 0.6736
 epoch: 87, train_loss: 0.5147, test_loss: 0.8486, test_f1: 0.6585
 epoch: 88, train_loss: 0.5001, test_loss: 0.8879, test_f1: 0.6424
 epoch: 89, train_loss: 0.5072, test_loss: 0.8384, test_f1: 0.6721
 epoch: 90, train_loss: 0.5082, test_loss: 0.8974, test_f1: 0.6396
 epoch: 91, train_loss: 0.5065, test_loss: 0.9199, test_f1: 0.6590
 epoch: 92, train_loss: 0.4922, test_loss: 0.8667, test_f1: 0.6518
 epoch: 93, train_loss: 0.5001, test_loss: 0.8703, test_f1: 0.6761
 epoch: 94, train_loss: 0.4951, test_loss: 0.8438, test_f1: 0.6708
 epoch: 95, train_loss: 0.4854, test_loss: 0.8880, test_f1: 0.6495
 epoch: 96, train_loss: 0.4899, test_loss: 0.8870, test_f1: 0.6460
 epoch: 97, train_loss: 0.5003, test_loss: 0.8164, test_f1: 0.6646
 epoch: 98, train_loss: 0.4871, test_loss: 0.8585, test_f1: 0.6593
 epoch: 99, train_loss: 0.4901, test_loss: 0.9246, test_f1: 0.6601
##################ITERATION #9 ****************************************
 epoch: 0, train_loss: 1.2556, test_loss: 1.0254, test_f1: 0.4610
 epoch: 1, train_loss: 1.0762, test_loss: 0.9854, test_f1: 0.4998
 epoch: 2, train_loss: 1.0155, test_loss: 0.9511, test_f1: 0.5189
 epoch: 3, train_loss: 0.9834, test_loss: 0.9239, test_f1: 0.5443
 epoch: 4, train_loss: 0.9684, test_loss: 0.9399, test_f1: 0.5461
 epoch: 5, train_loss: 0.9579, test_loss: 0.9015, test_f1: 0.5746
 epoch: 6, train_loss: 0.9329, test_loss: 0.9133, test_f1: 0.5635
 epoch: 7, train_loss: 0.9063, test_loss: 0.9035, test_f1: 0.5649
 epoch: 8, train_loss: 0.8866, test_loss: 0.9193, test_f1: 0.5585
 epoch: 9, train_loss: 0.8866, test_loss: 0.8877, test_f1: 0.5964
 epoch: 10, train_loss: 0.8619, test_loss: 0.8590, test_f1: 0.5666
 epoch: 11, train_loss: 0.8537, test_loss: 0.8879, test_f1: 0.5888
 epoch: 12, train_loss: 0.8338, test_loss: 0.8288, test_f1: 0.6115
 epoch: 13, train_loss: 0.8313, test_loss: 0.8801, test_f1: 0.6059
 epoch: 14, train_loss: 0.8212, test_loss: 0.8473, test_f1: 0.6223
 epoch: 15, train_loss: 0.8026, test_loss: 0.8522, test_f1: 0.5704
 epoch: 16, train_loss: 0.7978, test_loss: 0.8185, test_f1: 0.6242
 epoch: 17, train_loss: 0.7976, test_loss: 0.8515, test_f1: 0.5889
 epoch: 18, train_loss: 0.7897, test_loss: 0.8173, test_f1: 0.6315
 epoch: 19, train_loss: 0.7711, test_loss: 0.8307, test_f1: 0.6072
 epoch: 20, train_loss: 0.7711, test_loss: 0.8181, test_f1: 0.6518
 epoch: 21, train_loss: 0.7589, test_loss: 0.8111, test_f1: 0.6392
 epoch: 22, train_loss: 0.7461, test_loss: 0.8190, test_f1: 0.6506
 epoch: 23, train_loss: 0.7475, test_loss: 0.8138, test_f1: 0.6484
 epoch: 24, train_loss: 0.7317, test_loss: 0.7992, test_f1: 0.6465
 epoch: 25, train_loss: 0.7337, test_loss: 0.8088, test_f1: 0.6255
 epoch: 26, train_loss: 0.7205, test_loss: 0.8114, test_f1: 0.6630
 epoch: 27, train_loss: 0.7283, test_loss: 0.8169, test_f1: 0.6537
 epoch: 28, train_loss: 0.7191, test_loss: 0.8393, test_f1: 0.6462
 epoch: 29, train_loss: 0.7139, test_loss: 0.8462, test_f1: 0.6368
 epoch: 30, train_loss: 0.6935, test_loss: 0.8078, test_f1: 0.6572
 epoch: 31, train_loss: 0.6840, test_loss: 0.8412, test_f1: 0.6655
 epoch: 32, train_loss: 0.6799, test_loss: 0.8031, test_f1: 0.6277
 epoch: 33, train_loss: 0.6907, test_loss: 0.8072, test_f1: 0.6506
 epoch: 34, train_loss: 0.6770, test_loss: 0.8241, test_f1: 0.6534
 epoch: 35, train_loss: 0.6668, test_loss: 0.8147, test_f1: 0.6474
 epoch: 36, train_loss: 0.6718, test_loss: 0.7862, test_f1: 0.6486
 epoch: 37, train_loss: 0.6630, test_loss: 0.8207, test_f1: 0.6411
 epoch: 38, train_loss: 0.6597, test_loss: 0.8112, test_f1: 0.6583
 epoch: 39, train_loss: 0.6457, test_loss: 0.8101, test_f1: 0.6490
 epoch: 40, train_loss: 0.6385, test_loss: 0.8450, test_f1: 0.6618
 epoch: 41, train_loss: 0.6424, test_loss: 0.8157, test_f1: 0.6565
 epoch: 42, train_loss: 0.6344, test_loss: 0.8106, test_f1: 0.6532
 epoch: 43, train_loss: 0.6323, test_loss: 0.8331, test_f1: 0.6762
 epoch: 44, train_loss: 0.6205, test_loss: 0.8387, test_f1: 0.6368
 epoch: 45, train_loss: 0.6103, test_loss: 0.8519, test_f1: 0.6444
 epoch: 46, train_loss: 0.6144, test_loss: 0.8460, test_f1: 0.6463
 epoch: 47, train_loss: 0.6052, test_loss: 0.8541, test_f1: 0.6523
 epoch: 48, train_loss: 0.6042, test_loss: 0.8338, test_f1: 0.6483
 epoch: 49, train_loss: 0.5958, test_loss: 0.8286, test_f1: 0.6467
 epoch: 50, train_loss: 0.5926, test_loss: 0.8469, test_f1: 0.6638
 epoch: 51, train_loss: 0.5720, test_loss: 0.8505, test_f1: 0.6613
 epoch: 52, train_loss: 0.5771, test_loss: 0.8276, test_f1: 0.6597
 epoch: 53, train_loss: 0.5556, test_loss: 0.8455, test_f1: 0.6612
 epoch: 54, train_loss: 0.5721, test_loss: 0.8446, test_f1: 0.6809
 epoch: 55, train_loss: 0.5681, test_loss: 0.8777, test_f1: 0.6710
 epoch: 56, train_loss: 0.5657, test_loss: 0.8508, test_f1: 0.6551
 epoch: 57, train_loss: 0.5571, test_loss: 0.8294, test_f1: 0.6644
 epoch: 58, train_loss: 0.5564, test_loss: 0.8371, test_f1: 0.6587
 epoch: 59, train_loss: 0.5628, test_loss: 0.8622, test_f1: 0.6473
 epoch: 60, train_loss: 0.5632, test_loss: 0.8624, test_f1: 0.6678
 epoch: 61, train_loss: 0.5417, test_loss: 0.8773, test_f1: 0.6747
 epoch: 62, train_loss: 0.5417, test_loss: 0.8704, test_f1: 0.6507
 epoch: 63, train_loss: 0.5438, test_loss: 0.8420, test_f1: 0.6574
 epoch: 64, train_loss: 0.5355, test_loss: 0.8588, test_f1: 0.6777
 epoch: 65, train_loss: 0.5527, test_loss: 0.8845, test_f1: 0.6701
 epoch: 66, train_loss: 0.5397, test_loss: 0.8671, test_f1: 0.6712
 epoch: 67, train_loss: 0.5381, test_loss: 0.8813, test_f1: 0.6552
 epoch: 68, train_loss: 0.5292, test_loss: 0.8828, test_f1: 0.6613
 epoch: 69, train_loss: 0.5324, test_loss: 0.8689, test_f1: 0.6688
 epoch: 70, train_loss: 0.5178, test_loss: 0.8814, test_f1: 0.6703
 epoch: 71, train_loss: 0.5235, test_loss: 0.8928, test_f1: 0.6612
 epoch: 72, train_loss: 0.5116, test_loss: 0.8913, test_f1: 0.6575
 epoch: 73, train_loss: 0.5232, test_loss: 0.8548, test_f1: 0.6725
 epoch: 74, train_loss: 0.5243, test_loss: 0.8804, test_f1: 0.6622
 epoch: 75, train_loss: 0.5188, test_loss: 0.8703, test_f1: 0.6574
 epoch: 76, train_loss: 0.5263, test_loss: 0.8986, test_f1: 0.6507
 epoch: 77, train_loss: 0.5051, test_loss: 0.8998, test_f1: 0.6579
 epoch: 78, train_loss: 0.5085, test_loss: 0.9093, test_f1: 0.6604
 epoch: 79, train_loss: 0.5092, test_loss: 0.8771, test_f1: 0.6482
 epoch: 80, train_loss: 0.4971, test_loss: 0.8569, test_f1: 0.6529
 epoch: 81, train_loss: 0.4976, test_loss: 0.9135, test_f1: 0.6671
 epoch: 82, train_loss: 0.4984, test_loss: 0.8828, test_f1: 0.6552
 epoch: 83, train_loss: 0.4906, test_loss: 0.9225, test_f1: 0.6470
 epoch: 84, train_loss: 0.5019, test_loss: 0.9058, test_f1: 0.6515
 epoch: 85, train_loss: 0.4870, test_loss: 0.8908, test_f1: 0.6560
 epoch: 86, train_loss: 0.4979, test_loss: 0.9116, test_f1: 0.6771
 epoch: 87, train_loss: 0.4998, test_loss: 0.8870, test_f1: 0.6750
 epoch: 88, train_loss: 0.4951, test_loss: 0.9304, test_f1: 0.6684
 epoch: 89, train_loss: 0.5034, test_loss: 0.9194, test_f1: 0.6517
 epoch: 90, train_loss: 0.4752, test_loss: 0.8846, test_f1: 0.6698
 epoch: 91, train_loss: 0.4800, test_loss: 0.9137, test_f1: 0.6311
 epoch: 92, train_loss: 0.4737, test_loss: 0.8751, test_f1: 0.6735
 epoch: 93, train_loss: 0.4866, test_loss: 0.9363, test_f1: 0.6524
 epoch: 94, train_loss: 0.4908, test_loss: 0.9246, test_f1: 0.6634
 epoch: 95, train_loss: 0.4755, test_loss: 0.9094, test_f1: 0.6540
 epoch: 96, train_loss: 0.4580, test_loss: 0.9160, test_f1: 0.6499
 epoch: 97, train_loss: 0.4626, test_loss: 0.9393, test_f1: 0.6465
 epoch: 98, train_loss: 0.4717, test_loss: 0.8973, test_f1: 0.6812
 epoch: 99, train_loss: 0.4674, test_loss: 0.9313, test_f1: 0.6726

Training completed in 829.68 seconds
Best F1: 0.6919 at epoch 34
Mean F1 across iterations: 0.6737  0.0143
========================FINAL RESULTS================================
FEGIN weighted F1: 0.6919  0.0143
python main.py --data ltspice_examples --representation component_pin --model FEGIN --layers 2 --hiddens 128 --batch_size 32 --lr 0.0001 --emb_size 128 --epochs 100 --save_appendix component_pin_L2_H128_BS32_LR0.0001_E128 --no_val
-----



STDERR:
  File "main.py", line 370, in <module>
    main()
  File "main.py", line 254, in main
    dataset = dataset_class(
  File "/home/philip/projects/ltspice_examples_code_repo/Circuit-Completion-Using-GNNs/component_classification_with_link_prediction_head/evaluation/FEGIN/kernel/circuit_datasets.py", line 15, in __init__
    self.data, self.slices = torch.load(self.processed_paths[0])
  File "/home/philip/.local/lib/python3.8/site-packages/torch/serialization.py", line 1040, in load
    warnings.warn(
  File "/usr/lib/python3.8/warnings.py", line 109, in _showwarnmsg
    sw(msg.message, msg.category, msg.filename, msg.lineno,
  File "main.py", line 47, in warn_with_traceback
    traceback.print_stack(file=log)
/home/philip/projects/ltspice_examples_code_repo/Circuit-Completion-Using-GNNs/component_classification_with_link_prediction_head/evaluation/FEGIN/kernel/circuit_datasets.py:15: FutureWarning: You are using `torch.load` with `weights_only=False` (the current default value), which uses the default pickle module implicitly. It is possible to construct malicious pickle data which will execute arbitrary code during unpickling (See https://github.com/pytorch/pytorch/blob/main/SECURITY.md#untrusted-models for more details). In a future release, the default value for `weights_only` will be flipped to `True`. This limits the functions that could be executed during unpickling. Arbitrary objects will no longer be allowed to be loaded via this mode unless they are explicitly allowlisted by the user via `torch.serialization.add_safe_globals`. We recommend you start setting `weights_only=True` for any use case where you don't have full control of the loaded file. Please open an issue on GitHub for any issues related to this experimental feature.
  self.data, self.slices = torch.load(self.processed_paths[0])
