STDOUT:
Results will be saved in /home/philip/projects/ltspice_examples_code_repo/Circuit-Completion-Using-GNNs/component_classification_with_link_prediction_head/evaluation/FEGIN/results/model_FEGIN_dataset_ltspice_examples
Command line input: python main.py --data ltspice_examples --representation component_pin --model FEGIN --layers 3 --hiddens 128 --batch_size 32 --lr 0.001 --emb_size 128 --epochs 100 --save_appendix component_pin_L3_H128_BS32_LR0.001_E128 --no_val
 is saved.
-----
ltspice_examples - FEGIN
Using 3 layers, 128 hidden units, h = 2
Loading component_pin representation dataset
ENTERED
Training FEGIN on component_pin representation
Train: 3560, Test: 848
##################ITERATION #0 ****************************************
 epoch: 0, train_loss: 1.1192, test_loss: 1.0664, test_f1: 0.4420
 epoch: 1, train_loss: 0.9613, test_loss: 0.9620, test_f1: 0.5008
 epoch: 2, train_loss: 0.8915, test_loss: 0.8584, test_f1: 0.5330
 epoch: 3, train_loss: 0.8731, test_loss: 0.9215, test_f1: 0.5035
 epoch: 4, train_loss: 0.8436, test_loss: 0.9113, test_f1: 0.4807
 epoch: 5, train_loss: 0.8109, test_loss: 0.8137, test_f1: 0.5936
 epoch: 6, train_loss: 0.7970, test_loss: 0.7919, test_f1: 0.5854
 epoch: 7, train_loss: 0.7873, test_loss: 0.8453, test_f1: 0.5969
 epoch: 8, train_loss: 0.7657, test_loss: 0.8602, test_f1: 0.5641
 epoch: 9, train_loss: 0.7510, test_loss: 0.8825, test_f1: 0.6041
 epoch: 10, train_loss: 0.7223, test_loss: 0.8749, test_f1: 0.6304
 epoch: 11, train_loss: 0.7211, test_loss: 0.7946, test_f1: 0.6162
 epoch: 12, train_loss: 0.7276, test_loss: 0.8378, test_f1: 0.5683
 epoch: 13, train_loss: 0.7101, test_loss: 0.8677, test_f1: 0.6393
 epoch: 14, train_loss: 0.7087, test_loss: 0.8501, test_f1: 0.5985
 epoch: 15, train_loss: 0.6800, test_loss: 0.8969, test_f1: 0.6036
 epoch: 16, train_loss: 0.6783, test_loss: 0.8032, test_f1: 0.6660
 epoch: 17, train_loss: 0.6479, test_loss: 0.8793, test_f1: 0.6072
 epoch: 18, train_loss: 0.6361, test_loss: 0.9919, test_f1: 0.5885
 epoch: 19, train_loss: 0.6349, test_loss: 0.8304, test_f1: 0.6675
 epoch: 20, train_loss: 0.6168, test_loss: 0.9718, test_f1: 0.6158
 epoch: 21, train_loss: 0.6238, test_loss: 0.8688, test_f1: 0.6461
 epoch: 22, train_loss: 0.6215, test_loss: 0.9105, test_f1: 0.6477
 epoch: 23, train_loss: 0.6160, test_loss: 0.9579, test_f1: 0.6617
 epoch: 24, train_loss: 0.5798, test_loss: 0.9613, test_f1: 0.6519
 epoch: 25, train_loss: 0.5738, test_loss: 0.9903, test_f1: 0.6730
 epoch: 26, train_loss: 0.5596, test_loss: 0.9811, test_f1: 0.6555
 epoch: 27, train_loss: 0.5595, test_loss: 0.9899, test_f1: 0.6771
 epoch: 28, train_loss: 0.5518, test_loss: 0.9845, test_f1: 0.6711
 epoch: 29, train_loss: 0.5280, test_loss: 1.0224, test_f1: 0.6746
 epoch: 30, train_loss: 0.5148, test_loss: 1.0845, test_f1: 0.6497
 epoch: 31, train_loss: 0.5167, test_loss: 1.1460, test_f1: 0.6088
 epoch: 32, train_loss: 0.5319, test_loss: 1.1397, test_f1: 0.6410
 epoch: 33, train_loss: 0.4832, test_loss: 1.0567, test_f1: 0.6613
 epoch: 34, train_loss: 0.4741, test_loss: 1.2042, test_f1: 0.6371
 epoch: 35, train_loss: 0.4939, test_loss: 1.0454, test_f1: 0.6720
 epoch: 36, train_loss: 0.4631, test_loss: 1.0762, test_f1: 0.6537
 epoch: 37, train_loss: 0.4734, test_loss: 1.1784, test_f1: 0.6602
 epoch: 38, train_loss: 0.4636, test_loss: 1.2440, test_f1: 0.6416
 epoch: 39, train_loss: 0.4691, test_loss: 1.2671, test_f1: 0.6728
 epoch: 40, train_loss: 0.4323, test_loss: 1.1275, test_f1: 0.6751
 epoch: 41, train_loss: 0.4335, test_loss: 1.2858, test_f1: 0.6498
 epoch: 42, train_loss: 0.4223, test_loss: 1.2102, test_f1: 0.6619
 epoch: 43, train_loss: 0.3981, test_loss: 1.1833, test_f1: 0.6676
 epoch: 44, train_loss: 0.3997, test_loss: 1.1632, test_f1: 0.6813
 epoch: 45, train_loss: 0.3999, test_loss: 1.6345, test_f1: 0.6513
 epoch: 46, train_loss: 0.4163, test_loss: 1.4008, test_f1: 0.6610
 epoch: 47, train_loss: 0.4045, test_loss: 1.3246, test_f1: 0.6638
 epoch: 48, train_loss: 0.3994, test_loss: 1.2625, test_f1: 0.6735
 epoch: 49, train_loss: 0.3670, test_loss: 1.4083, test_f1: 0.6549
 epoch: 50, train_loss: 0.3727, test_loss: 1.2327, test_f1: 0.6865
 epoch: 51, train_loss: 0.3410, test_loss: 1.2654, test_f1: 0.6855
 epoch: 52, train_loss: 0.3077, test_loss: 1.3340, test_f1: 0.7033
 epoch: 53, train_loss: 0.2836, test_loss: 1.3721, test_f1: 0.6610
 epoch: 54, train_loss: 0.2755, test_loss: 1.3874, test_f1: 0.6745
 epoch: 55, train_loss: 0.2847, test_loss: 1.4544, test_f1: 0.6834
 epoch: 56, train_loss: 0.2892, test_loss: 1.5104, test_f1: 0.6835
 epoch: 57, train_loss: 0.2749, test_loss: 1.4740, test_f1: 0.6811
 epoch: 58, train_loss: 0.2849, test_loss: 1.4473, test_f1: 0.6918
 epoch: 59, train_loss: 0.2757, test_loss: 1.4189, test_f1: 0.6732
 epoch: 60, train_loss: 0.2538, test_loss: 1.7164, test_f1: 0.6807
 epoch: 61, train_loss: 0.2573, test_loss: 1.5577, test_f1: 0.6376
 epoch: 62, train_loss: 0.2586, test_loss: 1.5561, test_f1: 0.6795
 epoch: 63, train_loss: 0.2394, test_loss: 1.7567, test_f1: 0.6879
 epoch: 64, train_loss: 0.2437, test_loss: 1.8251, test_f1: 0.6592
 epoch: 65, train_loss: 0.2232, test_loss: 1.8027, test_f1: 0.6538
 epoch: 66, train_loss: 0.2238, test_loss: 1.6718, test_f1: 0.6959
 epoch: 67, train_loss: 0.2201, test_loss: 1.8904, test_f1: 0.6568
 epoch: 68, train_loss: 0.2339, test_loss: 1.5536, test_f1: 0.6876
 epoch: 69, train_loss: 0.2326, test_loss: 1.6509, test_f1: 0.6700
 epoch: 70, train_loss: 0.2257, test_loss: 1.8761, test_f1: 0.6706
 epoch: 71, train_loss: 0.2119, test_loss: 1.8618, test_f1: 0.6833
 epoch: 72, train_loss: 0.2031, test_loss: 1.8853, test_f1: 0.6312
 epoch: 73, train_loss: 0.2207, test_loss: 1.8477, test_f1: 0.6605
 epoch: 74, train_loss: 0.2012, test_loss: 1.8713, test_f1: 0.6678
 epoch: 75, train_loss: 0.2080, test_loss: 1.9611, test_f1: 0.6610
 epoch: 76, train_loss: 0.2208, test_loss: 1.7139, test_f1: 0.7062
 epoch: 77, train_loss: 0.2009, test_loss: 1.7169, test_f1: 0.6647
 epoch: 78, train_loss: 0.2203, test_loss: 1.7939, test_f1: 0.6748
 epoch: 79, train_loss: 0.2135, test_loss: 1.8310, test_f1: 0.6526
 epoch: 80, train_loss: 0.2059, test_loss: 1.9380, test_f1: 0.6357
 epoch: 81, train_loss: 0.2061, test_loss: 1.8072, test_f1: 0.6839
 epoch: 82, train_loss: 0.2082, test_loss: 1.7120, test_f1: 0.6855
 epoch: 83, train_loss: 0.2000, test_loss: 1.9697, test_f1: 0.6367
 epoch: 84, train_loss: 0.1862, test_loss: 1.8849, test_f1: 0.6688
 epoch: 85, train_loss: 0.1815, test_loss: 1.8711, test_f1: 0.6730
 epoch: 86, train_loss: 0.1849, test_loss: 1.9817, test_f1: 0.6574
 epoch: 87, train_loss: 0.1798, test_loss: 1.9238, test_f1: 0.6673
 epoch: 88, train_loss: 0.1860, test_loss: 1.9000, test_f1: 0.6588
 epoch: 89, train_loss: 0.1997, test_loss: 1.7958, test_f1: 0.6930
 epoch: 90, train_loss: 0.1892, test_loss: 1.7545, test_f1: 0.6846
 epoch: 91, train_loss: 0.1657, test_loss: 2.0733, test_f1: 0.6593
 epoch: 92, train_loss: 0.1814, test_loss: 1.8934, test_f1: 0.6493
 epoch: 93, train_loss: 0.1582, test_loss: 2.0395, test_f1: 0.6554
 epoch: 94, train_loss: 0.1931, test_loss: 1.9855, test_f1: 0.6563
 epoch: 95, train_loss: 0.1701, test_loss: 1.8512, test_f1: 0.6949
 epoch: 96, train_loss: 0.1559, test_loss: 2.0745, test_f1: 0.6800
 epoch: 97, train_loss: 0.1528, test_loss: 2.0012, test_f1: 0.6724
 epoch: 98, train_loss: 0.1715, test_loss: 1.9457, test_f1: 0.6767
 epoch: 99, train_loss: 0.1632, test_loss: 2.0777, test_f1: 0.6688
##################ITERATION #1 ****************************************
 epoch: 0, train_loss: 1.0935, test_loss: 1.0437, test_f1: 0.4797
 epoch: 1, train_loss: 0.9445, test_loss: 0.9055, test_f1: 0.5730
 epoch: 2, train_loss: 0.9153, test_loss: 0.8606, test_f1: 0.5304
 epoch: 3, train_loss: 0.8660, test_loss: 0.8799, test_f1: 0.5704
 epoch: 4, train_loss: 0.8466, test_loss: 0.8127, test_f1: 0.5553
 epoch: 5, train_loss: 0.8390, test_loss: 0.8107, test_f1: 0.5784
 epoch: 6, train_loss: 0.8124, test_loss: 0.7897, test_f1: 0.5871
 epoch: 7, train_loss: 0.7797, test_loss: 0.8274, test_f1: 0.5782
 epoch: 8, train_loss: 0.7652, test_loss: 0.8186, test_f1: 0.5835
 epoch: 9, train_loss: 0.7556, test_loss: 0.7627, test_f1: 0.6160
 epoch: 10, train_loss: 0.7367, test_loss: 0.8815, test_f1: 0.5650
 epoch: 11, train_loss: 0.7199, test_loss: 0.8019, test_f1: 0.6195
 epoch: 12, train_loss: 0.7069, test_loss: 0.7993, test_f1: 0.6365
 epoch: 13, train_loss: 0.6973, test_loss: 0.7031, test_f1: 0.6586
 epoch: 14, train_loss: 0.6792, test_loss: 0.7933, test_f1: 0.5883
 epoch: 15, train_loss: 0.6675, test_loss: 0.7718, test_f1: 0.6309
 epoch: 16, train_loss: 0.6515, test_loss: 0.7670, test_f1: 0.6282
 epoch: 17, train_loss: 0.6212, test_loss: 0.8808, test_f1: 0.6370
 epoch: 18, train_loss: 0.6259, test_loss: 0.9180, test_f1: 0.6175
 epoch: 19, train_loss: 0.6205, test_loss: 0.7973, test_f1: 0.6336
 epoch: 20, train_loss: 0.6260, test_loss: 0.7405, test_f1: 0.6606
 epoch: 21, train_loss: 0.5987, test_loss: 0.7196, test_f1: 0.6467
 epoch: 22, train_loss: 0.5761, test_loss: 0.7377, test_f1: 0.6726
 epoch: 23, train_loss: 0.5697, test_loss: 0.7536, test_f1: 0.6585
 epoch: 24, train_loss: 0.5553, test_loss: 0.8589, test_f1: 0.6140
 epoch: 25, train_loss: 0.5345, test_loss: 0.8291, test_f1: 0.6481
 epoch: 26, train_loss: 0.5355, test_loss: 0.9533, test_f1: 0.6348
 epoch: 27, train_loss: 0.5173, test_loss: 0.9489, test_f1: 0.6693
 epoch: 28, train_loss: 0.5071, test_loss: 0.9005, test_f1: 0.6576
 epoch: 29, train_loss: 0.5122, test_loss: 0.9181, test_f1: 0.6477
 epoch: 30, train_loss: 0.4992, test_loss: 0.8934, test_f1: 0.6533
 epoch: 31, train_loss: 0.5115, test_loss: 0.8125, test_f1: 0.6528
 epoch: 32, train_loss: 0.4926, test_loss: 0.9179, test_f1: 0.6495
 epoch: 33, train_loss: 0.4682, test_loss: 0.8794, test_f1: 0.6480
 epoch: 34, train_loss: 0.4693, test_loss: 0.9115, test_f1: 0.6573
 epoch: 35, train_loss: 0.4649, test_loss: 0.7815, test_f1: 0.6661
 epoch: 36, train_loss: 0.4482, test_loss: 0.8435, test_f1: 0.6971
 epoch: 37, train_loss: 0.4482, test_loss: 0.7807, test_f1: 0.6911
 epoch: 38, train_loss: 0.4508, test_loss: 0.9887, test_f1: 0.6747
 epoch: 39, train_loss: 0.4329, test_loss: 0.8618, test_f1: 0.6729
 epoch: 40, train_loss: 0.3981, test_loss: 0.9505, test_f1: 0.6462
 epoch: 41, train_loss: 0.4206, test_loss: 0.8490, test_f1: 0.6821
 epoch: 42, train_loss: 0.4151, test_loss: 0.9173, test_f1: 0.6651
 epoch: 43, train_loss: 0.3864, test_loss: 0.9272, test_f1: 0.6679
 epoch: 44, train_loss: 0.3787, test_loss: 0.9600, test_f1: 0.6680
 epoch: 45, train_loss: 0.4025, test_loss: 0.8785, test_f1: 0.7044
 epoch: 46, train_loss: 0.3941, test_loss: 1.0641, test_f1: 0.6634
 epoch: 47, train_loss: 0.3844, test_loss: 0.9940, test_f1: 0.6699
 epoch: 48, train_loss: 0.3697, test_loss: 1.1036, test_f1: 0.6660
 epoch: 49, train_loss: 0.3637, test_loss: 1.1363, test_f1: 0.6574
 epoch: 50, train_loss: 0.3478, test_loss: 1.0594, test_f1: 0.6834
 epoch: 51, train_loss: 0.2982, test_loss: 1.0422, test_f1: 0.6647
 epoch: 52, train_loss: 0.2821, test_loss: 1.0140, test_f1: 0.7030
 epoch: 53, train_loss: 0.2916, test_loss: 1.0874, test_f1: 0.6724
 epoch: 54, train_loss: 0.2752, test_loss: 1.1590, test_f1: 0.6791
 epoch: 55, train_loss: 0.2575, test_loss: 1.1949, test_f1: 0.6584
 epoch: 56, train_loss: 0.2601, test_loss: 1.1996, test_f1: 0.6911
 epoch: 57, train_loss: 0.2440, test_loss: 1.1893, test_f1: 0.6474
 epoch: 58, train_loss: 0.2524, test_loss: 1.1627, test_f1: 0.6908
 epoch: 59, train_loss: 0.2614, test_loss: 1.3416, test_f1: 0.6745
 epoch: 60, train_loss: 0.2478, test_loss: 1.3279, test_f1: 0.6521
 epoch: 61, train_loss: 0.2407, test_loss: 1.3418, test_f1: 0.6643
 epoch: 62, train_loss: 0.2354, test_loss: 1.2711, test_f1: 0.6690
 epoch: 63, train_loss: 0.2258, test_loss: 1.3467, test_f1: 0.6540
 epoch: 64, train_loss: 0.2448, test_loss: 1.4653, test_f1: 0.6646
 epoch: 65, train_loss: 0.2274, test_loss: 1.3886, test_f1: 0.6666
 epoch: 66, train_loss: 0.2139, test_loss: 1.4126, test_f1: 0.7020
 epoch: 67, train_loss: 0.2433, test_loss: 1.3741, test_f1: 0.6762
 epoch: 68, train_loss: 0.2576, test_loss: 1.2199, test_f1: 0.6731
 epoch: 69, train_loss: 0.2151, test_loss: 1.3010, test_f1: 0.6773
 epoch: 70, train_loss: 0.2155, test_loss: 1.3785, test_f1: 0.6635
 epoch: 71, train_loss: 0.2139, test_loss: 1.3991, test_f1: 0.6554
 epoch: 72, train_loss: 0.2271, test_loss: 1.2757, test_f1: 0.6587
 epoch: 73, train_loss: 0.2033, test_loss: 1.2047, test_f1: 0.6867
 epoch: 74, train_loss: 0.2139, test_loss: 1.3442, test_f1: 0.6553
 epoch: 75, train_loss: 0.2076, test_loss: 1.3870, test_f1: 0.6767
 epoch: 76, train_loss: 0.2041, test_loss: 1.3645, test_f1: 0.6724
 epoch: 77, train_loss: 0.1926, test_loss: 1.4779, test_f1: 0.6646
 epoch: 78, train_loss: 0.2004, test_loss: 1.3939, test_f1: 0.6785
 epoch: 79, train_loss: 0.2024, test_loss: 1.2082, test_f1: 0.7098
 epoch: 80, train_loss: 0.1741, test_loss: 1.3717, test_f1: 0.6482
 epoch: 81, train_loss: 0.1799, test_loss: 1.4482, test_f1: 0.6510
 epoch: 82, train_loss: 0.1973, test_loss: 1.2172, test_f1: 0.6947
 epoch: 83, train_loss: 0.2067, test_loss: 1.3657, test_f1: 0.6508
 epoch: 84, train_loss: 0.1895, test_loss: 1.5093, test_f1: 0.6666
 epoch: 85, train_loss: 0.1753, test_loss: 1.2232, test_f1: 0.6860
 epoch: 86, train_loss: 0.1836, test_loss: 1.4086, test_f1: 0.6939
 epoch: 87, train_loss: 0.1680, test_loss: 1.6000, test_f1: 0.6296
 epoch: 88, train_loss: 0.1828, test_loss: 1.5193, test_f1: 0.6666
 epoch: 89, train_loss: 0.1581, test_loss: 1.5436, test_f1: 0.6615
 epoch: 90, train_loss: 0.1614, test_loss: 1.5373, test_f1: 0.6537
 epoch: 91, train_loss: 0.1413, test_loss: 1.4905, test_f1: 0.6742
 epoch: 92, train_loss: 0.1774, test_loss: 1.4324, test_f1: 0.6957
 epoch: 93, train_loss: 0.1652, test_loss: 1.4503, test_f1: 0.6470
 epoch: 94, train_loss: 0.1669, test_loss: 1.5456, test_f1: 0.6612
 epoch: 95, train_loss: 0.1644, test_loss: 1.4285, test_f1: 0.6756
 epoch: 96, train_loss: 0.1557, test_loss: 1.5450, test_f1: 0.6533
 epoch: 97, train_loss: 0.1513, test_loss: 1.5698, test_f1: 0.6965
 epoch: 98, train_loss: 0.1462, test_loss: 1.3600, test_f1: 0.6604
 epoch: 99, train_loss: 0.1546, test_loss: 1.6558, test_f1: 0.6561
##################ITERATION #2 ****************************************
 epoch: 0, train_loss: 1.1237, test_loss: 1.0096, test_f1: 0.5033
 epoch: 1, train_loss: 0.9559, test_loss: 1.0542, test_f1: 0.4800
 epoch: 2, train_loss: 0.9136, test_loss: 0.9443, test_f1: 0.5024
 epoch: 3, train_loss: 0.8932, test_loss: 0.8882, test_f1: 0.5386
 epoch: 4, train_loss: 0.8578, test_loss: 0.9994, test_f1: 0.5074
 epoch: 5, train_loss: 0.8542, test_loss: 0.9260, test_f1: 0.5621
 epoch: 6, train_loss: 0.8034, test_loss: 0.9006, test_f1: 0.5879
 epoch: 7, train_loss: 0.7965, test_loss: 0.8745, test_f1: 0.5537
 epoch: 8, train_loss: 0.7959, test_loss: 0.9469, test_f1: 0.5394
 epoch: 9, train_loss: 0.7751, test_loss: 0.8735, test_f1: 0.5887
 epoch: 10, train_loss: 0.7470, test_loss: 0.8034, test_f1: 0.6061
 epoch: 11, train_loss: 0.7286, test_loss: 0.8435, test_f1: 0.6487
 epoch: 12, train_loss: 0.7029, test_loss: 0.8780, test_f1: 0.6221
 epoch: 13, train_loss: 0.7146, test_loss: 0.9047, test_f1: 0.6264
 epoch: 14, train_loss: 0.6824, test_loss: 0.9088, test_f1: 0.6214
 epoch: 15, train_loss: 0.6838, test_loss: 0.8862, test_f1: 0.6004
 epoch: 16, train_loss: 0.6876, test_loss: 1.0331, test_f1: 0.5704
 epoch: 17, train_loss: 0.6634, test_loss: 0.8574, test_f1: 0.6002
 epoch: 18, train_loss: 0.6419, test_loss: 0.9408, test_f1: 0.6667
 epoch: 19, train_loss: 0.6404, test_loss: 0.9342, test_f1: 0.6110
 epoch: 20, train_loss: 0.6171, test_loss: 0.8578, test_f1: 0.6407
 epoch: 21, train_loss: 0.6055, test_loss: 0.9315, test_f1: 0.6499
 epoch: 22, train_loss: 0.5933, test_loss: 0.9203, test_f1: 0.6417
 epoch: 23, train_loss: 0.5866, test_loss: 0.9247, test_f1: 0.6596
 epoch: 24, train_loss: 0.5802, test_loss: 0.8735, test_f1: 0.6392
 epoch: 25, train_loss: 0.5612, test_loss: 0.9169, test_f1: 0.5975
 epoch: 26, train_loss: 0.5481, test_loss: 0.9765, test_f1: 0.6544
 epoch: 27, train_loss: 0.5310, test_loss: 1.0443, test_f1: 0.6404
 epoch: 28, train_loss: 0.5505, test_loss: 0.9482, test_f1: 0.6282
 epoch: 29, train_loss: 0.5228, test_loss: 0.7899, test_f1: 0.6607
 epoch: 30, train_loss: 0.5140, test_loss: 1.0211, test_f1: 0.6465
 epoch: 31, train_loss: 0.5284, test_loss: 0.8841, test_f1: 0.6755
 epoch: 32, train_loss: 0.4926, test_loss: 0.9344, test_f1: 0.6661
 epoch: 33, train_loss: 0.4901, test_loss: 0.9068, test_f1: 0.6648
 epoch: 34, train_loss: 0.4924, test_loss: 1.0053, test_f1: 0.6559
 epoch: 35, train_loss: 0.4600, test_loss: 1.0208, test_f1: 0.6615
 epoch: 36, train_loss: 0.4680, test_loss: 1.0119, test_f1: 0.6531
 epoch: 37, train_loss: 0.4513, test_loss: 1.0148, test_f1: 0.6826
 epoch: 38, train_loss: 0.4275, test_loss: 1.0517, test_f1: 0.6722
 epoch: 39, train_loss: 0.4284, test_loss: 1.2713, test_f1: 0.6383
 epoch: 40, train_loss: 0.4345, test_loss: 1.0318, test_f1: 0.6529
 epoch: 41, train_loss: 0.4196, test_loss: 1.1749, test_f1: 0.6661
 epoch: 42, train_loss: 0.4351, test_loss: 1.0142, test_f1: 0.6938
 epoch: 43, train_loss: 0.4063, test_loss: 0.9874, test_f1: 0.6726
 epoch: 44, train_loss: 0.3935, test_loss: 0.9919, test_f1: 0.6714
 epoch: 45, train_loss: 0.3899, test_loss: 1.0047, test_f1: 0.6521
 epoch: 46, train_loss: 0.3806, test_loss: 1.1317, test_f1: 0.6473
 epoch: 47, train_loss: 0.3925, test_loss: 1.0814, test_f1: 0.6923
 epoch: 48, train_loss: 0.3771, test_loss: 1.0218, test_f1: 0.6759
 epoch: 49, train_loss: 0.3561, test_loss: 1.1333, test_f1: 0.6219
 epoch: 50, train_loss: 0.3502, test_loss: 1.0574, test_f1: 0.6835
 epoch: 51, train_loss: 0.3389, test_loss: 1.0181, test_f1: 0.6899
 epoch: 52, train_loss: 0.3008, test_loss: 1.1270, test_f1: 0.6549
 epoch: 53, train_loss: 0.3077, test_loss: 1.0797, test_f1: 0.7124
 epoch: 54, train_loss: 0.2786, test_loss: 1.1625, test_f1: 0.6832
 epoch: 55, train_loss: 0.2805, test_loss: 1.1262, test_f1: 0.6819
 epoch: 56, train_loss: 0.2609, test_loss: 1.2869, test_f1: 0.6630
 epoch: 57, train_loss: 0.2703, test_loss: 1.3220, test_f1: 0.6556
 epoch: 58, train_loss: 0.2694, test_loss: 1.2682, test_f1: 0.6619
 epoch: 59, train_loss: 0.2532, test_loss: 1.2318, test_f1: 0.6583
 epoch: 60, train_loss: 0.2479, test_loss: 1.1779, test_f1: 0.6653
 epoch: 61, train_loss: 0.2405, test_loss: 1.4039, test_f1: 0.6691
 epoch: 62, train_loss: 0.2676, test_loss: 1.2789, test_f1: 0.6724
 epoch: 63, train_loss: 0.2494, test_loss: 1.2647, test_f1: 0.6759
 epoch: 64, train_loss: 0.2390, test_loss: 1.4243, test_f1: 0.6704
 epoch: 65, train_loss: 0.2329, test_loss: 1.3866, test_f1: 0.6667
 epoch: 66, train_loss: 0.2495, test_loss: 1.4740, test_f1: 0.6785
 epoch: 67, train_loss: 0.2300, test_loss: 1.3710, test_f1: 0.6870
 epoch: 68, train_loss: 0.2359, test_loss: 1.3194, test_f1: 0.6759
 epoch: 69, train_loss: 0.2227, test_loss: 1.3688, test_f1: 0.6844
 epoch: 70, train_loss: 0.2371, test_loss: 1.4269, test_f1: 0.6497
 epoch: 71, train_loss: 0.2215, test_loss: 1.4733, test_f1: 0.6547
 epoch: 72, train_loss: 0.2138, test_loss: 1.5096, test_f1: 0.6741
 epoch: 73, train_loss: 0.2031, test_loss: 1.4419, test_f1: 0.6990
 epoch: 74, train_loss: 0.2193, test_loss: 1.3960, test_f1: 0.6933
 epoch: 75, train_loss: 0.2093, test_loss: 1.4742, test_f1: 0.7056
 epoch: 76, train_loss: 0.1970, test_loss: 1.5187, test_f1: 0.6957
 epoch: 77, train_loss: 0.1991, test_loss: 1.5031, test_f1: 0.6547
 epoch: 78, train_loss: 0.2101, test_loss: 1.4631, test_f1: 0.6667
 epoch: 79, train_loss: 0.2113, test_loss: 1.5144, test_f1: 0.6633
 epoch: 80, train_loss: 0.2106, test_loss: 1.4517, test_f1: 0.6759
 epoch: 81, train_loss: 0.2034, test_loss: 1.5150, test_f1: 0.6571
 epoch: 82, train_loss: 0.2039, test_loss: 1.4882, test_f1: 0.6834
 epoch: 83, train_loss: 0.1864, test_loss: 1.4516, test_f1: 0.6750
 epoch: 84, train_loss: 0.1851, test_loss: 1.4743, test_f1: 0.6855
 epoch: 85, train_loss: 0.1888, test_loss: 1.7545, test_f1: 0.6468
 epoch: 86, train_loss: 0.1919, test_loss: 1.4835, test_f1: 0.6830
 epoch: 87, train_loss: 0.1671, test_loss: 1.6293, test_f1: 0.6661
 epoch: 88, train_loss: 0.1757, test_loss: 1.5360, test_f1: 0.6780
 epoch: 89, train_loss: 0.1748, test_loss: 1.5916, test_f1: 0.6506
 epoch: 90, train_loss: 0.1806, test_loss: 1.5597, test_f1: 0.6827
 epoch: 91, train_loss: 0.1645, test_loss: 1.7098, test_f1: 0.6813
 epoch: 92, train_loss: 0.1806, test_loss: 1.6622, test_f1: 0.6873
 epoch: 93, train_loss: 0.2090, test_loss: 1.6355, test_f1: 0.6350
 epoch: 94, train_loss: 0.1797, test_loss: 1.5478, test_f1: 0.6403
 epoch: 95, train_loss: 0.1760, test_loss: 1.3221, test_f1: 0.6933
 epoch: 96, train_loss: 0.1698, test_loss: 1.2759, test_f1: 0.6996
 epoch: 97, train_loss: 0.1636, test_loss: 1.4687, test_f1: 0.6711
 epoch: 98, train_loss: 0.1595, test_loss: 1.4541, test_f1: 0.6976
 epoch: 99, train_loss: 0.1769, test_loss: 1.6787, test_f1: 0.6454
##################ITERATION #3 ****************************************
 epoch: 0, train_loss: 1.1708, test_loss: 1.0897, test_f1: 0.4567
 epoch: 1, train_loss: 0.9655, test_loss: 0.9377, test_f1: 0.5583
 epoch: 2, train_loss: 0.9203, test_loss: 0.9263, test_f1: 0.5220
 epoch: 3, train_loss: 0.8792, test_loss: 0.8509, test_f1: 0.5265
 epoch: 4, train_loss: 0.8432, test_loss: 0.8554, test_f1: 0.5300
 epoch: 5, train_loss: 0.8392, test_loss: 0.9918, test_f1: 0.5314
 epoch: 6, train_loss: 0.8147, test_loss: 0.9783, test_f1: 0.5204
 epoch: 7, train_loss: 0.8106, test_loss: 1.0800, test_f1: 0.5165
 epoch: 8, train_loss: 0.7794, test_loss: 0.8368, test_f1: 0.5865
 epoch: 9, train_loss: 0.7826, test_loss: 0.8631, test_f1: 0.5710
 epoch: 10, train_loss: 0.7482, test_loss: 0.8573, test_f1: 0.5885
 epoch: 11, train_loss: 0.7509, test_loss: 0.8382, test_f1: 0.6040
 epoch: 12, train_loss: 0.7316, test_loss: 0.7818, test_f1: 0.6250
 epoch: 13, train_loss: 0.7136, test_loss: 0.8479, test_f1: 0.5683
 epoch: 14, train_loss: 0.7043, test_loss: 0.7985, test_f1: 0.6120
 epoch: 15, train_loss: 0.6792, test_loss: 0.8082, test_f1: 0.6202
 epoch: 16, train_loss: 0.6873, test_loss: 0.8088, test_f1: 0.6145
 epoch: 17, train_loss: 0.6608, test_loss: 0.8166, test_f1: 0.5912
 epoch: 18, train_loss: 0.6602, test_loss: 0.8311, test_f1: 0.6232
 epoch: 19, train_loss: 0.6336, test_loss: 0.8018, test_f1: 0.6211
 epoch: 20, train_loss: 0.6393, test_loss: 0.8538, test_f1: 0.6163
 epoch: 21, train_loss: 0.6260, test_loss: 0.8390, test_f1: 0.6645
 epoch: 22, train_loss: 0.6184, test_loss: 0.7829, test_f1: 0.6404
 epoch: 23, train_loss: 0.6093, test_loss: 0.8493, test_f1: 0.6175
 epoch: 24, train_loss: 0.5980, test_loss: 0.8561, test_f1: 0.6072
 epoch: 25, train_loss: 0.5900, test_loss: 0.9191, test_f1: 0.6127
 epoch: 26, train_loss: 0.5610, test_loss: 0.7468, test_f1: 0.6590
 epoch: 27, train_loss: 0.5672, test_loss: 0.8240, test_f1: 0.6660
 epoch: 28, train_loss: 0.5560, test_loss: 0.7534, test_f1: 0.6672
 epoch: 29, train_loss: 0.5430, test_loss: 0.9707, test_f1: 0.6420
 epoch: 30, train_loss: 0.5214, test_loss: 0.8570, test_f1: 0.6525
 epoch: 31, train_loss: 0.5161, test_loss: 0.8395, test_f1: 0.6716
 epoch: 32, train_loss: 0.5287, test_loss: 0.8738, test_f1: 0.6518
 epoch: 33, train_loss: 0.5025, test_loss: 1.0626, test_f1: 0.6289
 epoch: 34, train_loss: 0.4976, test_loss: 0.8789, test_f1: 0.6389
 epoch: 35, train_loss: 0.4802, test_loss: 0.8494, test_f1: 0.6579
 epoch: 36, train_loss: 0.4764, test_loss: 0.8798, test_f1: 0.6781
 epoch: 37, train_loss: 0.4483, test_loss: 0.8503, test_f1: 0.6912
 epoch: 38, train_loss: 0.4559, test_loss: 0.8489, test_f1: 0.6630
 epoch: 39, train_loss: 0.4548, test_loss: 0.8991, test_f1: 0.6818
 epoch: 40, train_loss: 0.4542, test_loss: 0.8800, test_f1: 0.6865
 epoch: 41, train_loss: 0.4424, test_loss: 0.7706, test_f1: 0.6879
 epoch: 42, train_loss: 0.4370, test_loss: 0.9070, test_f1: 0.6668
 epoch: 43, train_loss: 0.4103, test_loss: 0.8424, test_f1: 0.6666
 epoch: 44, train_loss: 0.4297, test_loss: 0.9357, test_f1: 0.6708
 epoch: 45, train_loss: 0.4087, test_loss: 0.9170, test_f1: 0.6969
 epoch: 46, train_loss: 0.4239, test_loss: 1.0191, test_f1: 0.6584
 epoch: 47, train_loss: 0.4101, test_loss: 0.8559, test_f1: 0.6703
 epoch: 48, train_loss: 0.3758, test_loss: 1.0001, test_f1: 0.6525
 epoch: 49, train_loss: 0.3782, test_loss: 0.9708, test_f1: 0.6663
 epoch: 50, train_loss: 0.3909, test_loss: 0.9189, test_f1: 0.6418
 epoch: 51, train_loss: 0.3541, test_loss: 0.9656, test_f1: 0.6738
 epoch: 52, train_loss: 0.3259, test_loss: 1.0193, test_f1: 0.6686
 epoch: 53, train_loss: 0.2889, test_loss: 1.0898, test_f1: 0.6597
 epoch: 54, train_loss: 0.3011, test_loss: 1.0648, test_f1: 0.6714
 epoch: 55, train_loss: 0.2852, test_loss: 1.0560, test_f1: 0.6460
 epoch: 56, train_loss: 0.2781, test_loss: 1.0509, test_f1: 0.6663
 epoch: 57, train_loss: 0.2844, test_loss: 1.1486, test_f1: 0.6534
 epoch: 58, train_loss: 0.2750, test_loss: 1.1510, test_f1: 0.6685
 epoch: 59, train_loss: 0.2791, test_loss: 1.2098, test_f1: 0.6685
 epoch: 60, train_loss: 0.2834, test_loss: 1.1342, test_f1: 0.6696
 epoch: 61, train_loss: 0.2731, test_loss: 1.1842, test_f1: 0.6583
 epoch: 62, train_loss: 0.2641, test_loss: 1.1582, test_f1: 0.6710
 epoch: 63, train_loss: 0.2617, test_loss: 1.1957, test_f1: 0.6447
 epoch: 64, train_loss: 0.2537, test_loss: 1.2855, test_f1: 0.6600
 epoch: 65, train_loss: 0.2471, test_loss: 1.2515, test_f1: 0.6731
 epoch: 66, train_loss: 0.2488, test_loss: 1.1539, test_f1: 0.7039
 epoch: 67, train_loss: 0.2547, test_loss: 1.2520, test_f1: 0.6756
 epoch: 68, train_loss: 0.2473, test_loss: 1.2981, test_f1: 0.6925
 epoch: 69, train_loss: 0.2455, test_loss: 1.2647, test_f1: 0.6911
 epoch: 70, train_loss: 0.2274, test_loss: 1.2806, test_f1: 0.6645
 epoch: 71, train_loss: 0.2324, test_loss: 1.2889, test_f1: 0.6596
 epoch: 72, train_loss: 0.2381, test_loss: 1.3980, test_f1: 0.6725
 epoch: 73, train_loss: 0.2219, test_loss: 1.3508, test_f1: 0.6675
 epoch: 74, train_loss: 0.2284, test_loss: 1.4219, test_f1: 0.6697
 epoch: 75, train_loss: 0.2278, test_loss: 1.3175, test_f1: 0.6555
 epoch: 76, train_loss: 0.2092, test_loss: 1.3566, test_f1: 0.6999
 epoch: 77, train_loss: 0.2275, test_loss: 1.2671, test_f1: 0.6796
 epoch: 78, train_loss: 0.1901, test_loss: 1.3585, test_f1: 0.6709
 epoch: 79, train_loss: 0.2000, test_loss: 1.4703, test_f1: 0.6738
 epoch: 80, train_loss: 0.2271, test_loss: 1.3863, test_f1: 0.6509
 epoch: 81, train_loss: 0.2166, test_loss: 1.4059, test_f1: 0.6402
 epoch: 82, train_loss: 0.2081, test_loss: 1.2846, test_f1: 0.7103
 epoch: 83, train_loss: 0.1883, test_loss: 1.4118, test_f1: 0.6603
 epoch: 84, train_loss: 0.2034, test_loss: 1.3840, test_f1: 0.6865
 epoch: 85, train_loss: 0.1983, test_loss: 1.3887, test_f1: 0.6602
 epoch: 86, train_loss: 0.2065, test_loss: 1.4736, test_f1: 0.6566
 epoch: 87, train_loss: 0.1869, test_loss: 1.5112, test_f1: 0.6562
 epoch: 88, train_loss: 0.1761, test_loss: 1.4012, test_f1: 0.6680
 epoch: 89, train_loss: 0.1976, test_loss: 1.3732, test_f1: 0.6714
 epoch: 90, train_loss: 0.2016, test_loss: 1.4011, test_f1: 0.6656
 epoch: 91, train_loss: 0.1856, test_loss: 1.4643, test_f1: 0.6547
 epoch: 92, train_loss: 0.1808, test_loss: 1.4780, test_f1: 0.6847
 epoch: 93, train_loss: 0.1675, test_loss: 1.5695, test_f1: 0.6828
 epoch: 94, train_loss: 0.1730, test_loss: 1.5597, test_f1: 0.6846
 epoch: 95, train_loss: 0.1632, test_loss: 1.6071, test_f1: 0.6939
 epoch: 96, train_loss: 0.1807, test_loss: 1.5808, test_f1: 0.6673
 epoch: 97, train_loss: 0.1948, test_loss: 1.4995, test_f1: 0.6674
 epoch: 98, train_loss: 0.1750, test_loss: 1.5579, test_f1: 0.6801
 epoch: 99, train_loss: 0.1639, test_loss: 1.5958, test_f1: 0.6662
##################ITERATION #4 ****************************************
 epoch: 0, train_loss: 1.2080, test_loss: 1.0400, test_f1: 0.4330
 epoch: 1, train_loss: 0.9755, test_loss: 0.9299, test_f1: 0.5030
 epoch: 2, train_loss: 0.9310, test_loss: 0.9678, test_f1: 0.5424
 epoch: 3, train_loss: 0.9153, test_loss: 0.9167, test_f1: 0.5635
 epoch: 4, train_loss: 0.8728, test_loss: 0.9227, test_f1: 0.5338
 epoch: 5, train_loss: 0.8527, test_loss: 0.9730, test_f1: 0.5238
 epoch: 6, train_loss: 0.8471, test_loss: 0.9350, test_f1: 0.5141
 epoch: 7, train_loss: 0.8352, test_loss: 0.8214, test_f1: 0.5663
 epoch: 8, train_loss: 0.8132, test_loss: 0.8005, test_f1: 0.5718
 epoch: 9, train_loss: 0.7881, test_loss: 0.8462, test_f1: 0.5710
 epoch: 10, train_loss: 0.7890, test_loss: 0.7855, test_f1: 0.6354
 epoch: 11, train_loss: 0.7652, test_loss: 0.8894, test_f1: 0.5982
 epoch: 12, train_loss: 0.7536, test_loss: 0.8628, test_f1: 0.6073
 epoch: 13, train_loss: 0.7300, test_loss: 0.7770, test_f1: 0.6403
 epoch: 14, train_loss: 0.7180, test_loss: 0.8969, test_f1: 0.6137
 epoch: 15, train_loss: 0.6945, test_loss: 0.7758, test_f1: 0.6113
 epoch: 16, train_loss: 0.6836, test_loss: 0.8459, test_f1: 0.6106
 epoch: 17, train_loss: 0.6862, test_loss: 0.8460, test_f1: 0.6321
 epoch: 18, train_loss: 0.6507, test_loss: 0.7520, test_f1: 0.6640
 epoch: 19, train_loss: 0.6594, test_loss: 0.7697, test_f1: 0.6427
 epoch: 20, train_loss: 0.6554, test_loss: 0.7341, test_f1: 0.6437
 epoch: 21, train_loss: 0.6365, test_loss: 0.8096, test_f1: 0.6226
 epoch: 22, train_loss: 0.6230, test_loss: 0.8249, test_f1: 0.6186
 epoch: 23, train_loss: 0.6143, test_loss: 0.7625, test_f1: 0.6494
 epoch: 24, train_loss: 0.5910, test_loss: 0.7144, test_f1: 0.6748
 epoch: 25, train_loss: 0.5886, test_loss: 0.7974, test_f1: 0.6571
 epoch: 26, train_loss: 0.5872, test_loss: 0.7811, test_f1: 0.6359
 epoch: 27, train_loss: 0.5737, test_loss: 0.8185, test_f1: 0.6784
 epoch: 28, train_loss: 0.5376, test_loss: 0.8143, test_f1: 0.6852
 epoch: 29, train_loss: 0.5470, test_loss: 0.8341, test_f1: 0.6651
 epoch: 30, train_loss: 0.5328, test_loss: 0.8666, test_f1: 0.6557
 epoch: 31, train_loss: 0.5321, test_loss: 0.8535, test_f1: 0.6790
 epoch: 32, train_loss: 0.5165, test_loss: 0.8741, test_f1: 0.6553
 epoch: 33, train_loss: 0.4994, test_loss: 0.8846, test_f1: 0.6854
 epoch: 34, train_loss: 0.5014, test_loss: 0.9289, test_f1: 0.6696
 epoch: 35, train_loss: 0.5026, test_loss: 0.8832, test_f1: 0.6796
 epoch: 36, train_loss: 0.4849, test_loss: 0.7817, test_f1: 0.7152
 epoch: 37, train_loss: 0.4997, test_loss: 0.8331, test_f1: 0.6587
 epoch: 38, train_loss: 0.4734, test_loss: 0.8189, test_f1: 0.6848
 epoch: 39, train_loss: 0.4619, test_loss: 0.9001, test_f1: 0.6794
 epoch: 40, train_loss: 0.4764, test_loss: 0.9138, test_f1: 0.6492
 epoch: 41, train_loss: 0.4485, test_loss: 0.8484, test_f1: 0.6796
 epoch: 42, train_loss: 0.4413, test_loss: 0.9108, test_f1: 0.6379
 epoch: 43, train_loss: 0.4572, test_loss: 0.8890, test_f1: 0.6626
 epoch: 44, train_loss: 0.4444, test_loss: 0.8659, test_f1: 0.6640
 epoch: 45, train_loss: 0.4267, test_loss: 0.8364, test_f1: 0.6834
 epoch: 46, train_loss: 0.4076, test_loss: 0.9612, test_f1: 0.6819
 epoch: 47, train_loss: 0.4228, test_loss: 1.0304, test_f1: 0.6619
 epoch: 48, train_loss: 0.4055, test_loss: 0.9302, test_f1: 0.6945
 epoch: 49, train_loss: 0.4305, test_loss: 0.9316, test_f1: 0.6659
 epoch: 50, train_loss: 0.4042, test_loss: 0.8730, test_f1: 0.7108
 epoch: 51, train_loss: 0.3644, test_loss: 0.9290, test_f1: 0.6863
 epoch: 52, train_loss: 0.3270, test_loss: 0.9702, test_f1: 0.6969
 epoch: 53, train_loss: 0.3265, test_loss: 0.9685, test_f1: 0.6832
 epoch: 54, train_loss: 0.3183, test_loss: 1.0208, test_f1: 0.6881
 epoch: 55, train_loss: 0.3014, test_loss: 1.0520, test_f1: 0.6773
 epoch: 56, train_loss: 0.2758, test_loss: 0.9792, test_f1: 0.6772
 epoch: 57, train_loss: 0.3002, test_loss: 1.1048, test_f1: 0.6757
 epoch: 58, train_loss: 0.2842, test_loss: 1.0900, test_f1: 0.6892
 epoch: 59, train_loss: 0.2781, test_loss: 1.1118, test_f1: 0.6643
 epoch: 60, train_loss: 0.2790, test_loss: 1.1184, test_f1: 0.6801
 epoch: 61, train_loss: 0.2753, test_loss: 1.1863, test_f1: 0.6413
 epoch: 62, train_loss: 0.2759, test_loss: 1.0841, test_f1: 0.6803
 epoch: 63, train_loss: 0.2614, test_loss: 1.1547, test_f1: 0.6544
 epoch: 64, train_loss: 0.2864, test_loss: 1.0580, test_f1: 0.7054
 epoch: 65, train_loss: 0.2839, test_loss: 1.0849, test_f1: 0.6788
 epoch: 66, train_loss: 0.2678, test_loss: 1.1478, test_f1: 0.6847
 epoch: 67, train_loss: 0.2738, test_loss: 1.1922, test_f1: 0.6851
 epoch: 68, train_loss: 0.2579, test_loss: 1.2056, test_f1: 0.6789
 epoch: 69, train_loss: 0.2397, test_loss: 1.2660, test_f1: 0.6572
 epoch: 70, train_loss: 0.2446, test_loss: 1.1465, test_f1: 0.7088
 epoch: 71, train_loss: 0.2442, test_loss: 1.2021, test_f1: 0.6856
 epoch: 72, train_loss: 0.2426, test_loss: 1.3410, test_f1: 0.6772
 epoch: 73, train_loss: 0.2290, test_loss: 1.2575, test_f1: 0.7026
 epoch: 74, train_loss: 0.2350, test_loss: 1.2194, test_f1: 0.6863
 epoch: 75, train_loss: 0.2121, test_loss: 1.2964, test_f1: 0.6790
 epoch: 76, train_loss: 0.2249, test_loss: 1.2672, test_f1: 0.6872
 epoch: 77, train_loss: 0.2341, test_loss: 1.2930, test_f1: 0.6941
 epoch: 78, train_loss: 0.2148, test_loss: 1.3358, test_f1: 0.6773
 epoch: 79, train_loss: 0.2254, test_loss: 1.2419, test_f1: 0.6939
 epoch: 80, train_loss: 0.2173, test_loss: 1.4053, test_f1: 0.6762
 epoch: 81, train_loss: 0.2307, test_loss: 1.2566, test_f1: 0.6874
 epoch: 82, train_loss: 0.2048, test_loss: 1.3864, test_f1: 0.6833
 epoch: 83, train_loss: 0.1978, test_loss: 1.3304, test_f1: 0.6954
 epoch: 84, train_loss: 0.2083, test_loss: 1.4468, test_f1: 0.6634
 epoch: 85, train_loss: 0.2227, test_loss: 1.2328, test_f1: 0.6762
 epoch: 86, train_loss: 0.2101, test_loss: 1.3658, test_f1: 0.6804
 epoch: 87, train_loss: 0.1872, test_loss: 1.2904, test_f1: 0.6829
 epoch: 88, train_loss: 0.2061, test_loss: 1.2698, test_f1: 0.6953
 epoch: 89, train_loss: 0.2161, test_loss: 1.2733, test_f1: 0.6857
 epoch: 90, train_loss: 0.1891, test_loss: 1.4247, test_f1: 0.6834
 epoch: 91, train_loss: 0.1996, test_loss: 1.3649, test_f1: 0.6699
 epoch: 92, train_loss: 0.1826, test_loss: 1.3973, test_f1: 0.6822
 epoch: 93, train_loss: 0.2057, test_loss: 1.3642, test_f1: 0.7047
 epoch: 94, train_loss: 0.1852, test_loss: 1.4034, test_f1: 0.6593
 epoch: 95, train_loss: 0.1963, test_loss: 1.3204, test_f1: 0.6963
 epoch: 96, train_loss: 0.1930, test_loss: 1.4596, test_f1: 0.6935
 epoch: 97, train_loss: 0.1808, test_loss: 1.3432, test_f1: 0.6714
 epoch: 98, train_loss: 0.1876, test_loss: 1.5420, test_f1: 0.6728
 epoch: 99, train_loss: 0.1879, test_loss: 1.4791, test_f1: 0.6733
##################ITERATION #5 ****************************************
 epoch: 0, train_loss: 1.1864, test_loss: 0.9733, test_f1: 0.5157
 epoch: 1, train_loss: 0.9508, test_loss: 0.8930, test_f1: 0.5166
 epoch: 2, train_loss: 0.9130, test_loss: 0.9003, test_f1: 0.5022
 epoch: 3, train_loss: 0.8765, test_loss: 0.9360, test_f1: 0.5180
 epoch: 4, train_loss: 0.8560, test_loss: 0.8740, test_f1: 0.5519
 epoch: 5, train_loss: 0.8370, test_loss: 0.8468, test_f1: 0.5690
 epoch: 6, train_loss: 0.8164, test_loss: 0.8521, test_f1: 0.5861
 epoch: 7, train_loss: 0.7699, test_loss: 0.8615, test_f1: 0.5687
 epoch: 8, train_loss: 0.7553, test_loss: 0.8234, test_f1: 0.6148
 epoch: 9, train_loss: 0.7398, test_loss: 0.7735, test_f1: 0.6570
 epoch: 10, train_loss: 0.7323, test_loss: 0.8780, test_f1: 0.5701
 epoch: 11, train_loss: 0.7281, test_loss: 0.9379, test_f1: 0.5741
 epoch: 12, train_loss: 0.7236, test_loss: 0.8848, test_f1: 0.5978
 epoch: 13, train_loss: 0.7167, test_loss: 0.8265, test_f1: 0.6036
 epoch: 14, train_loss: 0.6872, test_loss: 0.9614, test_f1: 0.5937
 epoch: 15, train_loss: 0.6745, test_loss: 0.9217, test_f1: 0.6419
 epoch: 16, train_loss: 0.6840, test_loss: 0.8568, test_f1: 0.5951
 epoch: 17, train_loss: 0.6462, test_loss: 0.8750, test_f1: 0.6492
 epoch: 18, train_loss: 0.6475, test_loss: 0.8786, test_f1: 0.6279
 epoch: 19, train_loss: 0.6250, test_loss: 0.8110, test_f1: 0.6332
 epoch: 20, train_loss: 0.6222, test_loss: 0.8898, test_f1: 0.6522
 epoch: 21, train_loss: 0.5926, test_loss: 0.8651, test_f1: 0.6039
 epoch: 22, train_loss: 0.6012, test_loss: 0.8865, test_f1: 0.6210
 epoch: 23, train_loss: 0.6052, test_loss: 0.8544, test_f1: 0.6415
 epoch: 24, train_loss: 0.5584, test_loss: 0.8184, test_f1: 0.6957
 epoch: 25, train_loss: 0.5487, test_loss: 0.9335, test_f1: 0.6581
 epoch: 26, train_loss: 0.5575, test_loss: 0.7924, test_f1: 0.6983
 epoch: 27, train_loss: 0.5562, test_loss: 0.9032, test_f1: 0.6700
 epoch: 28, train_loss: 0.5292, test_loss: 0.8495, test_f1: 0.6710
 epoch: 29, train_loss: 0.5532, test_loss: 0.8455, test_f1: 0.6731
 epoch: 30, train_loss: 0.4932, test_loss: 0.8200, test_f1: 0.6883
 epoch: 31, train_loss: 0.5075, test_loss: 0.8504, test_f1: 0.6784
 epoch: 32, train_loss: 0.4869, test_loss: 0.8437, test_f1: 0.6736
 epoch: 33, train_loss: 0.4746, test_loss: 0.8562, test_f1: 0.6851
 epoch: 34, train_loss: 0.5031, test_loss: 0.8604, test_f1: 0.6761
 epoch: 35, train_loss: 0.4763, test_loss: 0.9190, test_f1: 0.6840
 epoch: 36, train_loss: 0.4583, test_loss: 0.9282, test_f1: 0.6786
 epoch: 37, train_loss: 0.4594, test_loss: 0.8605, test_f1: 0.7067
 epoch: 38, train_loss: 0.4507, test_loss: 1.0671, test_f1: 0.6666
 epoch: 39, train_loss: 0.4350, test_loss: 0.8826, test_f1: 0.6574
 epoch: 40, train_loss: 0.4435, test_loss: 0.9867, test_f1: 0.6665
 epoch: 41, train_loss: 0.4332, test_loss: 0.9604, test_f1: 0.6775
 epoch: 42, train_loss: 0.4449, test_loss: 0.8909, test_f1: 0.6869
 epoch: 43, train_loss: 0.4406, test_loss: 1.0606, test_f1: 0.6746
 epoch: 44, train_loss: 0.4137, test_loss: 0.9343, test_f1: 0.6846
 epoch: 45, train_loss: 0.4059, test_loss: 0.8771, test_f1: 0.6577
 epoch: 46, train_loss: 0.3984, test_loss: 1.0214, test_f1: 0.6793
 epoch: 47, train_loss: 0.4030, test_loss: 0.9537, test_f1: 0.6824
 epoch: 48, train_loss: 0.3560, test_loss: 1.1615, test_f1: 0.6747
 epoch: 49, train_loss: 0.3790, test_loss: 1.1238, test_f1: 0.6833
 epoch: 50, train_loss: 0.3590, test_loss: 0.9958, test_f1: 0.6870
 epoch: 51, train_loss: 0.3201, test_loss: 0.9928, test_f1: 0.6797
 epoch: 52, train_loss: 0.2944, test_loss: 1.0810, test_f1: 0.6895
 epoch: 53, train_loss: 0.2754, test_loss: 0.9637, test_f1: 0.7000
 epoch: 54, train_loss: 0.2684, test_loss: 1.1717, test_f1: 0.6752
 epoch: 55, train_loss: 0.2826, test_loss: 1.1353, test_f1: 0.6898
 epoch: 56, train_loss: 0.2672, test_loss: 1.0647, test_f1: 0.6935
 epoch: 57, train_loss: 0.2694, test_loss: 1.1810, test_f1: 0.6962
 epoch: 58, train_loss: 0.2622, test_loss: 1.1121, test_f1: 0.7094
 epoch: 59, train_loss: 0.2573, test_loss: 1.1929, test_f1: 0.7097
 epoch: 60, train_loss: 0.2532, test_loss: 1.2086, test_f1: 0.6979
 epoch: 61, train_loss: 0.2639, test_loss: 1.1481, test_f1: 0.6899
 epoch: 62, train_loss: 0.2407, test_loss: 1.0672, test_f1: 0.6830
 epoch: 63, train_loss: 0.2468, test_loss: 1.2289, test_f1: 0.6868
 epoch: 64, train_loss: 0.2297, test_loss: 1.3234, test_f1: 0.6933
 epoch: 65, train_loss: 0.2427, test_loss: 1.3921, test_f1: 0.6666
 epoch: 66, train_loss: 0.2399, test_loss: 1.3502, test_f1: 0.6843
 epoch: 67, train_loss: 0.2485, test_loss: 1.4127, test_f1: 0.6902
 epoch: 68, train_loss: 0.2430, test_loss: 1.4312, test_f1: 0.6943
 epoch: 69, train_loss: 0.2154, test_loss: 1.3674, test_f1: 0.6756
 epoch: 70, train_loss: 0.2416, test_loss: 1.2647, test_f1: 0.6917
 epoch: 71, train_loss: 0.2166, test_loss: 1.4083, test_f1: 0.6870
 epoch: 72, train_loss: 0.2224, test_loss: 1.3645, test_f1: 0.7040
 epoch: 73, train_loss: 0.1955, test_loss: 1.5409, test_f1: 0.6866
 epoch: 74, train_loss: 0.2220, test_loss: 1.3296, test_f1: 0.7176
 epoch: 75, train_loss: 0.2143, test_loss: 1.4565, test_f1: 0.7015
 epoch: 76, train_loss: 0.2175, test_loss: 1.3100, test_f1: 0.7011
 epoch: 77, train_loss: 0.2058, test_loss: 1.4482, test_f1: 0.6716
 epoch: 78, train_loss: 0.2105, test_loss: 1.3107, test_f1: 0.6857
 epoch: 79, train_loss: 0.2017, test_loss: 1.3145, test_f1: 0.6918
 epoch: 80, train_loss: 0.2017, test_loss: 1.2877, test_f1: 0.6833
 epoch: 81, train_loss: 0.1976, test_loss: 1.4754, test_f1: 0.6736
 epoch: 82, train_loss: 0.1929, test_loss: 1.4152, test_f1: 0.7006
 epoch: 83, train_loss: 0.2012, test_loss: 1.5779, test_f1: 0.6656
 epoch: 84, train_loss: 0.2084, test_loss: 1.5547, test_f1: 0.6583
 epoch: 85, train_loss: 0.2108, test_loss: 1.4361, test_f1: 0.6791
 epoch: 86, train_loss: 0.2062, test_loss: 1.5123, test_f1: 0.6894
 epoch: 87, train_loss: 0.1727, test_loss: 1.5989, test_f1: 0.6627
 epoch: 88, train_loss: 0.1788, test_loss: 1.4322, test_f1: 0.6771
 epoch: 89, train_loss: 0.1941, test_loss: 1.4470, test_f1: 0.6830
 epoch: 90, train_loss: 0.1661, test_loss: 1.5735, test_f1: 0.6967
 epoch: 91, train_loss: 0.1806, test_loss: 1.4875, test_f1: 0.6833
 epoch: 92, train_loss: 0.1746, test_loss: 1.5958, test_f1: 0.6951
 epoch: 93, train_loss: 0.1680, test_loss: 1.5656, test_f1: 0.6965
 epoch: 94, train_loss: 0.1818, test_loss: 1.5600, test_f1: 0.6470
 epoch: 95, train_loss: 0.1870, test_loss: 1.5961, test_f1: 0.6634
 epoch: 96, train_loss: 0.1898, test_loss: 1.7420, test_f1: 0.6428
 epoch: 97, train_loss: 0.1710, test_loss: 1.8288, test_f1: 0.6819
 epoch: 98, train_loss: 0.1678, test_loss: 1.7381, test_f1: 0.6629
 epoch: 99, train_loss: 0.1839, test_loss: 1.5681, test_f1: 0.6665
##################ITERATION #6 ****************************************
 epoch: 0, train_loss: 1.1609, test_loss: 1.0267, test_f1: 0.5021
 epoch: 1, train_loss: 0.9692, test_loss: 0.9525, test_f1: 0.5092
 epoch: 2, train_loss: 0.9089, test_loss: 0.9104, test_f1: 0.5239
 epoch: 3, train_loss: 0.8815, test_loss: 0.8787, test_f1: 0.5094
 epoch: 4, train_loss: 0.8649, test_loss: 0.9500, test_f1: 0.4744
 epoch: 5, train_loss: 0.8449, test_loss: 0.9144, test_f1: 0.5732
 epoch: 6, train_loss: 0.8157, test_loss: 0.8129, test_f1: 0.5450
 epoch: 7, train_loss: 0.8098, test_loss: 0.7999, test_f1: 0.5321
 epoch: 8, train_loss: 0.7806, test_loss: 0.8302, test_f1: 0.4978
 epoch: 9, train_loss: 0.7758, test_loss: 0.8102, test_f1: 0.5845
 epoch: 10, train_loss: 0.7326, test_loss: 0.8325, test_f1: 0.5705
 epoch: 11, train_loss: 0.7453, test_loss: 0.8700, test_f1: 0.5746
 epoch: 12, train_loss: 0.7452, test_loss: 0.8393, test_f1: 0.5980
 epoch: 13, train_loss: 0.7314, test_loss: 0.7927, test_f1: 0.6201
 epoch: 14, train_loss: 0.7094, test_loss: 0.7338, test_f1: 0.6502
 epoch: 15, train_loss: 0.6866, test_loss: 0.7814, test_f1: 0.6135
 epoch: 16, train_loss: 0.6619, test_loss: 0.7633, test_f1: 0.6477
 epoch: 17, train_loss: 0.6690, test_loss: 0.9137, test_f1: 0.5937
 epoch: 18, train_loss: 0.6465, test_loss: 0.7231, test_f1: 0.6543
 epoch: 19, train_loss: 0.6543, test_loss: 0.8387, test_f1: 0.5801
 epoch: 20, train_loss: 0.6173, test_loss: 0.7743, test_f1: 0.6272
 epoch: 21, train_loss: 0.6130, test_loss: 0.7786, test_f1: 0.6447
 epoch: 22, train_loss: 0.6449, test_loss: 0.8011, test_f1: 0.6499
 epoch: 23, train_loss: 0.5961, test_loss: 0.7829, test_f1: 0.6397
 epoch: 24, train_loss: 0.5958, test_loss: 0.8864, test_f1: 0.6381
 epoch: 25, train_loss: 0.6048, test_loss: 0.7998, test_f1: 0.6405
 epoch: 26, train_loss: 0.5790, test_loss: 0.7474, test_f1: 0.6306
 epoch: 27, train_loss: 0.5564, test_loss: 0.8667, test_f1: 0.6409
 epoch: 28, train_loss: 0.5481, test_loss: 0.7948, test_f1: 0.6361
 epoch: 29, train_loss: 0.5421, test_loss: 0.7585, test_f1: 0.6423
 epoch: 30, train_loss: 0.5352, test_loss: 0.7771, test_f1: 0.6650
 epoch: 31, train_loss: 0.5250, test_loss: 0.7205, test_f1: 0.6803
 epoch: 32, train_loss: 0.5000, test_loss: 0.8989, test_f1: 0.6696
 epoch: 33, train_loss: 0.5155, test_loss: 0.7837, test_f1: 0.6593
 epoch: 34, train_loss: 0.4921, test_loss: 0.7403, test_f1: 0.6524
 epoch: 35, train_loss: 0.5078, test_loss: 0.8372, test_f1: 0.6404
 epoch: 36, train_loss: 0.4671, test_loss: 0.8359, test_f1: 0.6645
 epoch: 37, train_loss: 0.4474, test_loss: 0.8070, test_f1: 0.6710
 epoch: 38, train_loss: 0.4689, test_loss: 0.8001, test_f1: 0.6512
 epoch: 39, train_loss: 0.4702, test_loss: 0.8625, test_f1: 0.6546
 epoch: 40, train_loss: 0.4554, test_loss: 0.7182, test_f1: 0.6673
 epoch: 41, train_loss: 0.4547, test_loss: 0.8451, test_f1: 0.6528
 epoch: 42, train_loss: 0.4314, test_loss: 0.8923, test_f1: 0.6576
 epoch: 43, train_loss: 0.4423, test_loss: 0.7551, test_f1: 0.6721
 epoch: 44, train_loss: 0.4401, test_loss: 0.8509, test_f1: 0.6677
 epoch: 45, train_loss: 0.4211, test_loss: 0.7946, test_f1: 0.6940
 epoch: 46, train_loss: 0.4201, test_loss: 0.7912, test_f1: 0.6695
 epoch: 47, train_loss: 0.3967, test_loss: 0.7911, test_f1: 0.6827
 epoch: 48, train_loss: 0.3965, test_loss: 0.8721, test_f1: 0.6639
 epoch: 49, train_loss: 0.3942, test_loss: 0.8447, test_f1: 0.6538
 epoch: 50, train_loss: 0.3940, test_loss: 0.9726, test_f1: 0.6474
 epoch: 51, train_loss: 0.3230, test_loss: 0.9526, test_f1: 0.6800
 epoch: 52, train_loss: 0.3163, test_loss: 0.9087, test_f1: 0.6999
 epoch: 53, train_loss: 0.3122, test_loss: 1.0304, test_f1: 0.6543
 epoch: 54, train_loss: 0.3057, test_loss: 0.9250, test_f1: 0.6916
 epoch: 55, train_loss: 0.3027, test_loss: 0.9399, test_f1: 0.6673
 epoch: 56, train_loss: 0.2826, test_loss: 0.9855, test_f1: 0.6680
 epoch: 57, train_loss: 0.3060, test_loss: 1.0372, test_f1: 0.6748
 epoch: 58, train_loss: 0.2707, test_loss: 1.1551, test_f1: 0.6499
 epoch: 59, train_loss: 0.2911, test_loss: 1.0111, test_f1: 0.6867
 epoch: 60, train_loss: 0.2771, test_loss: 1.0069, test_f1: 0.6712
 epoch: 61, train_loss: 0.2771, test_loss: 1.1114, test_f1: 0.6875
 epoch: 62, train_loss: 0.2759, test_loss: 1.0758, test_f1: 0.6754
 epoch: 63, train_loss: 0.2616, test_loss: 1.1448, test_f1: 0.6862
 epoch: 64, train_loss: 0.2428, test_loss: 1.1176, test_f1: 0.6920
 epoch: 65, train_loss: 0.2504, test_loss: 1.1553, test_f1: 0.6857
 epoch: 66, train_loss: 0.2601, test_loss: 1.1439, test_f1: 0.6684
 epoch: 67, train_loss: 0.2488, test_loss: 1.3128, test_f1: 0.6677
 epoch: 68, train_loss: 0.2542, test_loss: 1.2181, test_f1: 0.6614
 epoch: 69, train_loss: 0.2486, test_loss: 1.1732, test_f1: 0.6606
 epoch: 70, train_loss: 0.2598, test_loss: 1.1428, test_f1: 0.6750
 epoch: 71, train_loss: 0.2553, test_loss: 1.1782, test_f1: 0.6620
 epoch: 72, train_loss: 0.2483, test_loss: 1.0644, test_f1: 0.6734
 epoch: 73, train_loss: 0.2250, test_loss: 1.1901, test_f1: 0.6805
 epoch: 74, train_loss: 0.2294, test_loss: 1.2228, test_f1: 0.6638
 epoch: 75, train_loss: 0.2129, test_loss: 1.3939, test_f1: 0.6618
 epoch: 76, train_loss: 0.2478, test_loss: 1.3716, test_f1: 0.6741
 epoch: 77, train_loss: 0.2204, test_loss: 1.2120, test_f1: 0.6849
 epoch: 78, train_loss: 0.2235, test_loss: 1.4291, test_f1: 0.6601
 epoch: 79, train_loss: 0.2205, test_loss: 1.3853, test_f1: 0.6708
 epoch: 80, train_loss: 0.2205, test_loss: 1.2254, test_f1: 0.6841
 epoch: 81, train_loss: 0.2180, test_loss: 1.3382, test_f1: 0.6896
 epoch: 82, train_loss: 0.2141, test_loss: 1.1953, test_f1: 0.6993
 epoch: 83, train_loss: 0.2005, test_loss: 1.4221, test_f1: 0.6767
 epoch: 84, train_loss: 0.2014, test_loss: 1.4845, test_f1: 0.6596
 epoch: 85, train_loss: 0.1993, test_loss: 1.6180, test_f1: 0.6640
 epoch: 86, train_loss: 0.1978, test_loss: 1.5252, test_f1: 0.6452
 epoch: 87, train_loss: 0.1931, test_loss: 1.4661, test_f1: 0.6627
 epoch: 88, train_loss: 0.1809, test_loss: 1.3553, test_f1: 0.6906
 epoch: 89, train_loss: 0.1837, test_loss: 1.4599, test_f1: 0.6748
 epoch: 90, train_loss: 0.1998, test_loss: 1.5062, test_f1: 0.6803
 epoch: 91, train_loss: 0.2087, test_loss: 1.2844, test_f1: 0.6761
 epoch: 92, train_loss: 0.2025, test_loss: 1.4572, test_f1: 0.6796
 epoch: 93, train_loss: 0.1743, test_loss: 1.5691, test_f1: 0.6785
 epoch: 94, train_loss: 0.1829, test_loss: 1.4895, test_f1: 0.6832
 epoch: 95, train_loss: 0.1908, test_loss: 1.4659, test_f1: 0.6799
 epoch: 96, train_loss: 0.2018, test_loss: 1.4300, test_f1: 0.6769
 epoch: 97, train_loss: 0.1744, test_loss: 1.4958, test_f1: 0.6769
 epoch: 98, train_loss: 0.1834, test_loss: 1.4112, test_f1: 0.6820
 epoch: 99, train_loss: 0.2066, test_loss: 1.3369, test_f1: 0.6664
##################ITERATION #7 ****************************************
 epoch: 0, train_loss: 1.2216, test_loss: 1.0403, test_f1: 0.4290
 epoch: 1, train_loss: 0.9631, test_loss: 0.9420, test_f1: 0.5260
 epoch: 2, train_loss: 0.9331, test_loss: 1.1601, test_f1: 0.4453
 epoch: 3, train_loss: 0.8962, test_loss: 0.8907, test_f1: 0.5554
 epoch: 4, train_loss: 0.8710, test_loss: 0.8351, test_f1: 0.5511
 epoch: 5, train_loss: 0.8396, test_loss: 0.8917, test_f1: 0.5710
 epoch: 6, train_loss: 0.8283, test_loss: 0.8623, test_f1: 0.5585
 epoch: 7, train_loss: 0.7979, test_loss: 0.8376, test_f1: 0.6388
 epoch: 8, train_loss: 0.8075, test_loss: 0.9493, test_f1: 0.5524
 epoch: 9, train_loss: 0.7873, test_loss: 0.8665, test_f1: 0.5995
 epoch: 10, train_loss: 0.7623, test_loss: 0.9565, test_f1: 0.5211
 epoch: 11, train_loss: 0.7407, test_loss: 0.7926, test_f1: 0.6182
 epoch: 12, train_loss: 0.7403, test_loss: 0.7794, test_f1: 0.6098
 epoch: 13, train_loss: 0.7168, test_loss: 0.7571, test_f1: 0.6139
 epoch: 14, train_loss: 0.7178, test_loss: 0.8399, test_f1: 0.6391
 epoch: 15, train_loss: 0.6898, test_loss: 0.7879, test_f1: 0.6314
 epoch: 16, train_loss: 0.6770, test_loss: 0.7996, test_f1: 0.6382
 epoch: 17, train_loss: 0.6709, test_loss: 0.7988, test_f1: 0.6528
 epoch: 18, train_loss: 0.6491, test_loss: 0.8222, test_f1: 0.6500
 epoch: 19, train_loss: 0.6530, test_loss: 0.7743, test_f1: 0.6259
 epoch: 20, train_loss: 0.6362, test_loss: 0.7984, test_f1: 0.6245
 epoch: 21, train_loss: 0.6324, test_loss: 0.8241, test_f1: 0.6413
 epoch: 22, train_loss: 0.6079, test_loss: 0.8896, test_f1: 0.6427
 epoch: 23, train_loss: 0.5832, test_loss: 0.7975, test_f1: 0.6372
 epoch: 24, train_loss: 0.5898, test_loss: 0.7705, test_f1: 0.6708
 epoch: 25, train_loss: 0.5807, test_loss: 0.8658, test_f1: 0.6488
 epoch: 26, train_loss: 0.5678, test_loss: 0.7710, test_f1: 0.6808
 epoch: 27, train_loss: 0.5479, test_loss: 0.8407, test_f1: 0.6531
 epoch: 28, train_loss: 0.5636, test_loss: 0.8298, test_f1: 0.6705
 epoch: 29, train_loss: 0.5236, test_loss: 0.8369, test_f1: 0.6589
 epoch: 30, train_loss: 0.5417, test_loss: 0.7915, test_f1: 0.6455
 epoch: 31, train_loss: 0.5288, test_loss: 0.8041, test_f1: 0.6768
 epoch: 32, train_loss: 0.5142, test_loss: 1.0549, test_f1: 0.6080
 epoch: 33, train_loss: 0.4816, test_loss: 0.8940, test_f1: 0.6751
 epoch: 34, train_loss: 0.5043, test_loss: 0.9200, test_f1: 0.6568
 epoch: 35, train_loss: 0.4912, test_loss: 0.8819, test_f1: 0.6585
 epoch: 36, train_loss: 0.4985, test_loss: 0.8554, test_f1: 0.7144
 epoch: 37, train_loss: 0.4831, test_loss: 0.8583, test_f1: 0.6856
 epoch: 38, train_loss: 0.4669, test_loss: 0.9607, test_f1: 0.6652
 epoch: 39, train_loss: 0.4446, test_loss: 0.8727, test_f1: 0.6654
 epoch: 40, train_loss: 0.4422, test_loss: 0.9116, test_f1: 0.6885
 epoch: 41, train_loss: 0.4572, test_loss: 0.8339, test_f1: 0.6676
 epoch: 42, train_loss: 0.4186, test_loss: 0.9001, test_f1: 0.6860
 epoch: 43, train_loss: 0.4238, test_loss: 0.9248, test_f1: 0.6762
 epoch: 44, train_loss: 0.4107, test_loss: 1.0073, test_f1: 0.6474
 epoch: 45, train_loss: 0.4235, test_loss: 0.9689, test_f1: 0.6805
 epoch: 46, train_loss: 0.4113, test_loss: 1.0407, test_f1: 0.6840
 epoch: 47, train_loss: 0.3863, test_loss: 0.9994, test_f1: 0.7017
 epoch: 48, train_loss: 0.4112, test_loss: 0.9444, test_f1: 0.6580
 epoch: 49, train_loss: 0.3932, test_loss: 0.9633, test_f1: 0.6695
 epoch: 50, train_loss: 0.4061, test_loss: 1.0225, test_f1: 0.6918
 epoch: 51, train_loss: 0.3570, test_loss: 1.0063, test_f1: 0.6983
 epoch: 52, train_loss: 0.3032, test_loss: 0.9481, test_f1: 0.6849
 epoch: 53, train_loss: 0.3030, test_loss: 0.9937, test_f1: 0.6811
 epoch: 54, train_loss: 0.3094, test_loss: 1.0046, test_f1: 0.7066
 epoch: 55, train_loss: 0.2946, test_loss: 1.0296, test_f1: 0.6901
 epoch: 56, train_loss: 0.2906, test_loss: 1.0755, test_f1: 0.7125
 epoch: 57, train_loss: 0.2854, test_loss: 1.1581, test_f1: 0.6806
 epoch: 58, train_loss: 0.2726, test_loss: 1.1490, test_f1: 0.6595
 epoch: 59, train_loss: 0.2931, test_loss: 1.0521, test_f1: 0.6754
 epoch: 60, train_loss: 0.2883, test_loss: 1.0161, test_f1: 0.7119
 epoch: 61, train_loss: 0.2705, test_loss: 1.0524, test_f1: 0.6878
 epoch: 62, train_loss: 0.2808, test_loss: 1.0449, test_f1: 0.6846
 epoch: 63, train_loss: 0.2673, test_loss: 1.1367, test_f1: 0.6860
 epoch: 64, train_loss: 0.2450, test_loss: 1.2195, test_f1: 0.6663
 epoch: 65, train_loss: 0.2446, test_loss: 1.2482, test_f1: 0.6900
 epoch: 66, train_loss: 0.2465, test_loss: 1.2100, test_f1: 0.6976
 epoch: 67, train_loss: 0.2509, test_loss: 1.3229, test_f1: 0.6621
 epoch: 68, train_loss: 0.2394, test_loss: 1.1460, test_f1: 0.6826
 epoch: 69, train_loss: 0.2464, test_loss: 1.2931, test_f1: 0.6776
 epoch: 70, train_loss: 0.2300, test_loss: 1.3413, test_f1: 0.6805
 epoch: 71, train_loss: 0.2355, test_loss: 1.2766, test_f1: 0.6977
 epoch: 72, train_loss: 0.2367, test_loss: 1.2578, test_f1: 0.6682
 epoch: 73, train_loss: 0.2358, test_loss: 1.1209, test_f1: 0.6924
 epoch: 74, train_loss: 0.2082, test_loss: 1.2677, test_f1: 0.6938
 epoch: 75, train_loss: 0.2391, test_loss: 1.1538, test_f1: 0.6808
 epoch: 76, train_loss: 0.2213, test_loss: 1.2012, test_f1: 0.6947
 epoch: 77, train_loss: 0.2150, test_loss: 1.3129, test_f1: 0.6995
 epoch: 78, train_loss: 0.2190, test_loss: 1.3731, test_f1: 0.6805
 epoch: 79, train_loss: 0.2445, test_loss: 1.3570, test_f1: 0.6487
 epoch: 80, train_loss: 0.2074, test_loss: 1.2972, test_f1: 0.6867
 epoch: 81, train_loss: 0.1949, test_loss: 1.4298, test_f1: 0.6833
 epoch: 82, train_loss: 0.2196, test_loss: 1.4367, test_f1: 0.6562
 epoch: 83, train_loss: 0.2083, test_loss: 1.3223, test_f1: 0.6865
 epoch: 84, train_loss: 0.2101, test_loss: 1.3449, test_f1: 0.6800
 epoch: 85, train_loss: 0.2030, test_loss: 1.4240, test_f1: 0.6836
 epoch: 86, train_loss: 0.1849, test_loss: 1.5032, test_f1: 0.6802
 epoch: 87, train_loss: 0.2023, test_loss: 1.4345, test_f1: 0.6662
 epoch: 88, train_loss: 0.1912, test_loss: 1.4303, test_f1: 0.6888
 epoch: 89, train_loss: 0.1968, test_loss: 1.4120, test_f1: 0.6732
 epoch: 90, train_loss: 0.1936, test_loss: 1.3056, test_f1: 0.6922
 epoch: 91, train_loss: 0.1994, test_loss: 1.4301, test_f1: 0.6804
 epoch: 92, train_loss: 0.1906, test_loss: 1.2921, test_f1: 0.7002
 epoch: 93, train_loss: 0.1845, test_loss: 1.3694, test_f1: 0.6809
 epoch: 94, train_loss: 0.1947, test_loss: 1.3755, test_f1: 0.6870
 epoch: 95, train_loss: 0.2039, test_loss: 1.5087, test_f1: 0.6748
 epoch: 96, train_loss: 0.1878, test_loss: 1.5028, test_f1: 0.6868
 epoch: 97, train_loss: 0.1769, test_loss: 1.5206, test_f1: 0.7064
 epoch: 98, train_loss: 0.1754, test_loss: 1.4723, test_f1: 0.7093
 epoch: 99, train_loss: 0.1903, test_loss: 1.4940, test_f1: 0.7103
##################ITERATION #8 ****************************************
 epoch: 0, train_loss: 1.1653, test_loss: 0.9430, test_f1: 0.5354
 epoch: 1, train_loss: 0.9492, test_loss: 0.9405, test_f1: 0.5167
 epoch: 2, train_loss: 0.9032, test_loss: 0.9073, test_f1: 0.4908
 epoch: 3, train_loss: 0.8730, test_loss: 0.8077, test_f1: 0.5352
 epoch: 4, train_loss: 0.8585, test_loss: 0.8180, test_f1: 0.5993
 epoch: 5, train_loss: 0.8202, test_loss: 0.9434, test_f1: 0.5257
 epoch: 6, train_loss: 0.8183, test_loss: 0.8401, test_f1: 0.5723
 epoch: 7, train_loss: 0.7769, test_loss: 0.7751, test_f1: 0.6375
 epoch: 8, train_loss: 0.7791, test_loss: 0.8110, test_f1: 0.6014
 epoch: 9, train_loss: 0.7649, test_loss: 0.9192, test_f1: 0.5613
 epoch: 10, train_loss: 0.7514, test_loss: 0.8573, test_f1: 0.5562
 epoch: 11, train_loss: 0.7140, test_loss: 0.7349, test_f1: 0.6182
 epoch: 12, train_loss: 0.7263, test_loss: 0.8808, test_f1: 0.5683
 epoch: 13, train_loss: 0.7018, test_loss: 0.7836, test_f1: 0.5971
 epoch: 14, train_loss: 0.6819, test_loss: 0.8295, test_f1: 0.6157
 epoch: 15, train_loss: 0.6780, test_loss: 0.8931, test_f1: 0.6194
 epoch: 16, train_loss: 0.6727, test_loss: 0.7870, test_f1: 0.6082
 epoch: 17, train_loss: 0.6573, test_loss: 0.8544, test_f1: 0.5823
 epoch: 18, train_loss: 0.6560, test_loss: 0.7780, test_f1: 0.6238
 epoch: 19, train_loss: 0.6334, test_loss: 0.8064, test_f1: 0.6407
 epoch: 20, train_loss: 0.6240, test_loss: 0.7917, test_f1: 0.6286
 epoch: 21, train_loss: 0.6055, test_loss: 0.7994, test_f1: 0.6385
 epoch: 22, train_loss: 0.5964, test_loss: 0.7686, test_f1: 0.6364
 epoch: 23, train_loss: 0.5863, test_loss: 0.8056, test_f1: 0.6446
 epoch: 24, train_loss: 0.5948, test_loss: 0.9320, test_f1: 0.6119
 epoch: 25, train_loss: 0.5988, test_loss: 0.8376, test_f1: 0.5900
 epoch: 26, train_loss: 0.5709, test_loss: 0.8132, test_f1: 0.6389
 epoch: 27, train_loss: 0.5683, test_loss: 0.8319, test_f1: 0.6603
 epoch: 28, train_loss: 0.5630, test_loss: 0.7904, test_f1: 0.6697
 epoch: 29, train_loss: 0.5294, test_loss: 0.7707, test_f1: 0.7082
 epoch: 30, train_loss: 0.5381, test_loss: 0.8143, test_f1: 0.6900
 epoch: 31, train_loss: 0.5164, test_loss: 0.7535, test_f1: 0.6863
 epoch: 32, train_loss: 0.5026, test_loss: 0.8307, test_f1: 0.6388
 epoch: 33, train_loss: 0.4977, test_loss: 0.8818, test_f1: 0.6395
 epoch: 34, train_loss: 0.5091, test_loss: 0.7922, test_f1: 0.6962
 epoch: 35, train_loss: 0.4847, test_loss: 0.8550, test_f1: 0.7176
 epoch: 36, train_loss: 0.4875, test_loss: 0.8159, test_f1: 0.6580
 epoch: 37, train_loss: 0.5063, test_loss: 0.8196, test_f1: 0.6803
 epoch: 38, train_loss: 0.4899, test_loss: 0.8322, test_f1: 0.6929
 epoch: 39, train_loss: 0.4543, test_loss: 0.8274, test_f1: 0.6773
 epoch: 40, train_loss: 0.4496, test_loss: 0.8357, test_f1: 0.6524
 epoch: 41, train_loss: 0.4562, test_loss: 0.8392, test_f1: 0.6799
 epoch: 42, train_loss: 0.4376, test_loss: 0.8781, test_f1: 0.7054
 epoch: 43, train_loss: 0.4470, test_loss: 0.8362, test_f1: 0.6892
 epoch: 44, train_loss: 0.4311, test_loss: 0.8622, test_f1: 0.6830
 epoch: 45, train_loss: 0.4418, test_loss: 1.0068, test_f1: 0.6549
 epoch: 46, train_loss: 0.4138, test_loss: 0.8397, test_f1: 0.7110
 epoch: 47, train_loss: 0.4297, test_loss: 0.8163, test_f1: 0.7126
 epoch: 48, train_loss: 0.3870, test_loss: 0.9472, test_f1: 0.6795
 epoch: 49, train_loss: 0.3897, test_loss: 0.8545, test_f1: 0.6832
 epoch: 50, train_loss: 0.4164, test_loss: 0.9670, test_f1: 0.7189
 epoch: 51, train_loss: 0.3539, test_loss: 0.9110, test_f1: 0.7112
 epoch: 52, train_loss: 0.3347, test_loss: 0.9271, test_f1: 0.6829
 epoch: 53, train_loss: 0.3231, test_loss: 0.9668, test_f1: 0.6941
 epoch: 54, train_loss: 0.3104, test_loss: 0.9318, test_f1: 0.7311
 epoch: 55, train_loss: 0.2920, test_loss: 1.0163, test_f1: 0.6948
 epoch: 56, train_loss: 0.3047, test_loss: 0.9685, test_f1: 0.7152
 epoch: 57, train_loss: 0.2846, test_loss: 1.0037, test_f1: 0.6940
 epoch: 58, train_loss: 0.2996, test_loss: 1.0188, test_f1: 0.6970
 epoch: 59, train_loss: 0.2755, test_loss: 1.0139, test_f1: 0.7182
 epoch: 60, train_loss: 0.2744, test_loss: 1.1131, test_f1: 0.6993
 epoch: 61, train_loss: 0.2906, test_loss: 1.1531, test_f1: 0.6858
 epoch: 62, train_loss: 0.2622, test_loss: 1.0814, test_f1: 0.6957
 epoch: 63, train_loss: 0.2638, test_loss: 1.0555, test_f1: 0.7032
 epoch: 64, train_loss: 0.2559, test_loss: 1.0619, test_f1: 0.7008
 epoch: 65, train_loss: 0.2679, test_loss: 1.1023, test_f1: 0.6906
 epoch: 66, train_loss: 0.2460, test_loss: 1.1063, test_f1: 0.6917
 epoch: 67, train_loss: 0.2586, test_loss: 1.1025, test_f1: 0.6851
 epoch: 68, train_loss: 0.2691, test_loss: 1.0627, test_f1: 0.7086
 epoch: 69, train_loss: 0.2477, test_loss: 1.0640, test_f1: 0.7063
 epoch: 70, train_loss: 0.2325, test_loss: 1.0896, test_f1: 0.6930
 epoch: 71, train_loss: 0.2385, test_loss: 1.0733, test_f1: 0.7002
 epoch: 72, train_loss: 0.2326, test_loss: 1.0927, test_f1: 0.6962
 epoch: 73, train_loss: 0.2356, test_loss: 1.1896, test_f1: 0.6885
 epoch: 74, train_loss: 0.2288, test_loss: 1.1164, test_f1: 0.7058
 epoch: 75, train_loss: 0.2208, test_loss: 1.1471, test_f1: 0.7188
 epoch: 76, train_loss: 0.2340, test_loss: 1.1678, test_f1: 0.6952
 epoch: 77, train_loss: 0.2329, test_loss: 1.1130, test_f1: 0.7192
 epoch: 78, train_loss: 0.2130, test_loss: 1.1860, test_f1: 0.6894
 epoch: 79, train_loss: 0.2144, test_loss: 1.1371, test_f1: 0.6975
 epoch: 80, train_loss: 0.2154, test_loss: 1.2592, test_f1: 0.6806
 epoch: 81, train_loss: 0.2380, test_loss: 1.2471, test_f1: 0.6900
 epoch: 82, train_loss: 0.2308, test_loss: 1.1750, test_f1: 0.7004
 epoch: 83, train_loss: 0.1928, test_loss: 1.2338, test_f1: 0.6954
 epoch: 84, train_loss: 0.2072, test_loss: 1.2385, test_f1: 0.7202
 epoch: 85, train_loss: 0.2045, test_loss: 1.2737, test_f1: 0.6938
 epoch: 86, train_loss: 0.2073, test_loss: 1.1013, test_f1: 0.6880
 epoch: 87, train_loss: 0.2052, test_loss: 1.2537, test_f1: 0.6965
 epoch: 88, train_loss: 0.2120, test_loss: 1.2652, test_f1: 0.6856
 epoch: 89, train_loss: 0.1776, test_loss: 1.2899, test_f1: 0.6908
 epoch: 90, train_loss: 0.1994, test_loss: 1.3260, test_f1: 0.6954
 epoch: 91, train_loss: 0.1855, test_loss: 1.4026, test_f1: 0.6778
 epoch: 92, train_loss: 0.1803, test_loss: 1.3272, test_f1: 0.7081
 epoch: 93, train_loss: 0.2003, test_loss: 1.2322, test_f1: 0.6917
 epoch: 94, train_loss: 0.1953, test_loss: 1.3245, test_f1: 0.7196
 epoch: 95, train_loss: 0.1851, test_loss: 1.2876, test_f1: 0.7021
 epoch: 96, train_loss: 0.1990, test_loss: 1.2340, test_f1: 0.7085
 epoch: 97, train_loss: 0.1879, test_loss: 1.3027, test_f1: 0.7199
 epoch: 98, train_loss: 0.2110, test_loss: 1.3515, test_f1: 0.6873
 epoch: 99, train_loss: 0.1902, test_loss: 1.3467, test_f1: 0.6830
##################ITERATION #9 ****************************************
 epoch: 0, train_loss: 1.1705, test_loss: 1.0978, test_f1: 0.3863
 epoch: 1, train_loss: 0.9636, test_loss: 0.9079, test_f1: 0.4690
 epoch: 2, train_loss: 0.9086, test_loss: 0.8906, test_f1: 0.5160
 epoch: 3, train_loss: 0.8928, test_loss: 0.8618, test_f1: 0.5412
 epoch: 4, train_loss: 0.8736, test_loss: 0.9201, test_f1: 0.5030
 epoch: 5, train_loss: 0.8389, test_loss: 0.8710, test_f1: 0.5120
 epoch: 6, train_loss: 0.8094, test_loss: 0.8882, test_f1: 0.5454
 epoch: 7, train_loss: 0.7967, test_loss: 0.8867, test_f1: 0.5687
 epoch: 8, train_loss: 0.7799, test_loss: 0.8602, test_f1: 0.5629
 epoch: 9, train_loss: 0.7559, test_loss: 0.7497, test_f1: 0.6180
 epoch: 10, train_loss: 0.7309, test_loss: 0.8472, test_f1: 0.5769
 epoch: 11, train_loss: 0.7391, test_loss: 0.8080, test_f1: 0.5900
 epoch: 12, train_loss: 0.7134, test_loss: 0.8377, test_f1: 0.5841
 epoch: 13, train_loss: 0.7057, test_loss: 0.8043, test_f1: 0.6373
 epoch: 14, train_loss: 0.6972, test_loss: 0.8034, test_f1: 0.6462
 epoch: 15, train_loss: 0.6630, test_loss: 0.8035, test_f1: 0.6658
 epoch: 16, train_loss: 0.6828, test_loss: 0.8042, test_f1: 0.6056
 epoch: 17, train_loss: 0.6635, test_loss: 0.8567, test_f1: 0.6210
 epoch: 18, train_loss: 0.6340, test_loss: 0.7843, test_f1: 0.6433
 epoch: 19, train_loss: 0.6235, test_loss: 0.8284, test_f1: 0.6470
 epoch: 20, train_loss: 0.6382, test_loss: 0.7905, test_f1: 0.6434
 epoch: 21, train_loss: 0.6088, test_loss: 0.8070, test_f1: 0.6454
 epoch: 22, train_loss: 0.6045, test_loss: 0.8492, test_f1: 0.6675
 epoch: 23, train_loss: 0.5802, test_loss: 0.7971, test_f1: 0.6746
 epoch: 24, train_loss: 0.5761, test_loss: 0.8403, test_f1: 0.6308
 epoch: 25, train_loss: 0.5726, test_loss: 0.8486, test_f1: 0.6774
 epoch: 26, train_loss: 0.5661, test_loss: 0.7958, test_f1: 0.7035
 epoch: 27, train_loss: 0.5467, test_loss: 0.8337, test_f1: 0.6721
 epoch: 28, train_loss: 0.5454, test_loss: 0.9212, test_f1: 0.6016
 epoch: 29, train_loss: 0.5345, test_loss: 0.8962, test_f1: 0.6571
 epoch: 30, train_loss: 0.5272, test_loss: 0.8679, test_f1: 0.6672
 epoch: 31, train_loss: 0.5250, test_loss: 0.8762, test_f1: 0.6863
 epoch: 32, train_loss: 0.5243, test_loss: 0.8994, test_f1: 0.6436
 epoch: 33, train_loss: 0.4996, test_loss: 0.8962, test_f1: 0.6751
 epoch: 34, train_loss: 0.5028, test_loss: 0.9067, test_f1: 0.6682
 epoch: 35, train_loss: 0.4874, test_loss: 0.9183, test_f1: 0.6581
 epoch: 36, train_loss: 0.4767, test_loss: 0.8921, test_f1: 0.6764
 epoch: 37, train_loss: 0.4710, test_loss: 0.8396, test_f1: 0.6616
 epoch: 38, train_loss: 0.4639, test_loss: 0.9667, test_f1: 0.6724
 epoch: 39, train_loss: 0.4442, test_loss: 1.0551, test_f1: 0.6488
 epoch: 40, train_loss: 0.4639, test_loss: 0.8853, test_f1: 0.6976
 epoch: 41, train_loss: 0.4520, test_loss: 0.9321, test_f1: 0.6726
 epoch: 42, train_loss: 0.4459, test_loss: 0.9165, test_f1: 0.6782
 epoch: 43, train_loss: 0.4166, test_loss: 1.0014, test_f1: 0.6814
 epoch: 44, train_loss: 0.4114, test_loss: 0.9960, test_f1: 0.6709
 epoch: 45, train_loss: 0.3957, test_loss: 0.9469, test_f1: 0.6841
 epoch: 46, train_loss: 0.4075, test_loss: 0.9829, test_f1: 0.6732
 epoch: 47, train_loss: 0.3855, test_loss: 1.1024, test_f1: 0.6671
 epoch: 48, train_loss: 0.4412, test_loss: 1.1020, test_f1: 0.6339
 epoch: 49, train_loss: 0.3817, test_loss: 1.0665, test_f1: 0.6552
 epoch: 50, train_loss: 0.4007, test_loss: 1.0717, test_f1: 0.6802
 epoch: 51, train_loss: 0.3646, test_loss: 1.0253, test_f1: 0.7008
 epoch: 52, train_loss: 0.3009, test_loss: 1.1082, test_f1: 0.6706
 epoch: 53, train_loss: 0.3119, test_loss: 1.1109, test_f1: 0.7028
 epoch: 54, train_loss: 0.3053, test_loss: 1.1827, test_f1: 0.6753
 epoch: 55, train_loss: 0.3318, test_loss: 1.2029, test_f1: 0.6862
 epoch: 56, train_loss: 0.3180, test_loss: 1.1844, test_f1: 0.6684
 epoch: 57, train_loss: 0.3117, test_loss: 1.2615, test_f1: 0.6717
 epoch: 58, train_loss: 0.2945, test_loss: 1.2389, test_f1: 0.6732
 epoch: 59, train_loss: 0.2798, test_loss: 1.1615, test_f1: 0.6791
 epoch: 60, train_loss: 0.2678, test_loss: 1.2322, test_f1: 0.6552
 epoch: 61, train_loss: 0.2843, test_loss: 1.2157, test_f1: 0.6834
 epoch: 62, train_loss: 0.2631, test_loss: 1.2409, test_f1: 0.6824
 epoch: 63, train_loss: 0.2792, test_loss: 1.2170, test_f1: 0.6573
 epoch: 64, train_loss: 0.2650, test_loss: 1.2603, test_f1: 0.6787
 epoch: 65, train_loss: 0.2568, test_loss: 1.2752, test_f1: 0.6688
 epoch: 66, train_loss: 0.2573, test_loss: 1.2558, test_f1: 0.6565
 epoch: 67, train_loss: 0.2720, test_loss: 1.2121, test_f1: 0.6770
 epoch: 68, train_loss: 0.2616, test_loss: 1.2445, test_f1: 0.6656
 epoch: 69, train_loss: 0.2375, test_loss: 1.3779, test_f1: 0.6557
 epoch: 70, train_loss: 0.2379, test_loss: 1.4531, test_f1: 0.6532
 epoch: 71, train_loss: 0.2579, test_loss: 1.3034, test_f1: 0.6601
 epoch: 72, train_loss: 0.2491, test_loss: 1.3413, test_f1: 0.6573
 epoch: 73, train_loss: 0.2383, test_loss: 1.3466, test_f1: 0.6794
 epoch: 74, train_loss: 0.2218, test_loss: 1.4177, test_f1: 0.6603
 epoch: 75, train_loss: 0.2203, test_loss: 1.3813, test_f1: 0.6577
 epoch: 76, train_loss: 0.2399, test_loss: 1.3574, test_f1: 0.6674
 epoch: 77, train_loss: 0.2189, test_loss: 1.3854, test_f1: 0.6608
 epoch: 78, train_loss: 0.2300, test_loss: 1.3466, test_f1: 0.6453
 epoch: 79, train_loss: 0.2242, test_loss: 1.3708, test_f1: 0.6487
 epoch: 80, train_loss: 0.2102, test_loss: 1.4506, test_f1: 0.6562
 epoch: 81, train_loss: 0.2269, test_loss: 1.4982, test_f1: 0.6604
 epoch: 82, train_loss: 0.2148, test_loss: 1.4556, test_f1: 0.6860
 epoch: 83, train_loss: 0.2315, test_loss: 1.4775, test_f1: 0.6540
 epoch: 84, train_loss: 0.2310, test_loss: 1.4719, test_f1: 0.6612
 epoch: 85, train_loss: 0.2109, test_loss: 1.5653, test_f1: 0.6641
 epoch: 86, train_loss: 0.2017, test_loss: 1.5217, test_f1: 0.6500
 epoch: 87, train_loss: 0.1974, test_loss: 1.5508, test_f1: 0.6642
 epoch: 88, train_loss: 0.2093, test_loss: 1.5619, test_f1: 0.6626
 epoch: 89, train_loss: 0.2004, test_loss: 1.4643, test_f1: 0.6441
 epoch: 90, train_loss: 0.2062, test_loss: 1.4489, test_f1: 0.6587
 epoch: 91, train_loss: 0.1908, test_loss: 1.6845, test_f1: 0.6318
 epoch: 92, train_loss: 0.1878, test_loss: 1.7168, test_f1: 0.6413
 epoch: 93, train_loss: 0.2024, test_loss: 1.5648, test_f1: 0.6523
 epoch: 94, train_loss: 0.1828, test_loss: 1.5931, test_f1: 0.6561
 epoch: 95, train_loss: 0.1996, test_loss: 1.5639, test_f1: 0.6403
 epoch: 96, train_loss: 0.1927, test_loss: 1.5657, test_f1: 0.6367
 epoch: 97, train_loss: 0.1976, test_loss: 1.5507, test_f1: 0.6475
 epoch: 98, train_loss: 0.1712, test_loss: 1.6673, test_f1: 0.6562
 epoch: 99, train_loss: 0.1713, test_loss: 1.6481, test_f1: 0.6315

Training completed in 972.81 seconds
Best F1: 0.7311 at epoch 54
Mean F1 across iterations: 0.7121  0.0082
========================FINAL RESULTS================================
FEGIN weighted F1: 0.7311  0.0082
python main.py --data ltspice_examples --representation component_pin --model FEGIN --layers 3 --hiddens 128 --batch_size 32 --lr 0.001 --emb_size 128 --epochs 100 --save_appendix component_pin_L3_H128_BS32_LR0.001_E128 --no_val
-----



STDERR:
  File "main.py", line 370, in <module>
    main()
  File "main.py", line 254, in main
    dataset = dataset_class(
  File "/home/philip/projects/ltspice_examples_code_repo/Circuit-Completion-Using-GNNs/component_classification_with_link_prediction_head/evaluation/FEGIN/kernel/circuit_datasets.py", line 15, in __init__
    self.data, self.slices = torch.load(self.processed_paths[0])
  File "/home/philip/.local/lib/python3.8/site-packages/torch/serialization.py", line 1040, in load
    warnings.warn(
  File "/usr/lib/python3.8/warnings.py", line 109, in _showwarnmsg
    sw(msg.message, msg.category, msg.filename, msg.lineno,
  File "main.py", line 47, in warn_with_traceback
    traceback.print_stack(file=log)
/home/philip/projects/ltspice_examples_code_repo/Circuit-Completion-Using-GNNs/component_classification_with_link_prediction_head/evaluation/FEGIN/kernel/circuit_datasets.py:15: FutureWarning: You are using `torch.load` with `weights_only=False` (the current default value), which uses the default pickle module implicitly. It is possible to construct malicious pickle data which will execute arbitrary code during unpickling (See https://github.com/pytorch/pytorch/blob/main/SECURITY.md#untrusted-models for more details). In a future release, the default value for `weights_only` will be flipped to `True`. This limits the functions that could be executed during unpickling. Arbitrary objects will no longer be allowed to be loaded via this mode unless they are explicitly allowlisted by the user via `torch.serialization.add_safe_globals`. We recommend you start setting `weights_only=True` for any use case where you don't have full control of the loaded file. Please open an issue on GitHub for any issues related to this experimental feature.
  self.data, self.slices = torch.load(self.processed_paths[0])
