STDOUT:
Results will be saved in /home/philip/projects/ltspice_examples_code_repo/Circuit-Completion-Using-GNNs/component_classification_with_link_prediction_head/evaluation/FEGIN/results/model_FEGIN_dataset_ltspice_examples
Command line input: python main.py --data ltspice_examples --representation component_pin_net --model FEGIN --layers 2 --hiddens 64 --batch_size 32 --lr 0.01 --emb_size 128 --epochs 100 --save_appendix component_pin_net_L2_H64_BS32_LR0.01_E128 --no_val
 is saved.
-----
ltspice_examples - FEGIN
Using 2 layers, 64 hidden units, h = 2
Loading component_pin_net representation dataset
ENTERED
Training FEGIN on component_pin_net representation
Train: 3558, Test: 846
##################ITERATION #0 ****************************************
 epoch: 0, train_loss: 1.1123, test_loss: 1.2393, test_f1: 0.3190
 epoch: 1, train_loss: 1.0131, test_loss: 1.1207, test_f1: 0.4408
 epoch: 2, train_loss: 0.9990, test_loss: 1.0448, test_f1: 0.4552
 epoch: 3, train_loss: 0.9708, test_loss: 1.0164, test_f1: 0.5003
 epoch: 4, train_loss: 0.9585, test_loss: 1.1104, test_f1: 0.4603
 epoch: 5, train_loss: 0.9462, test_loss: 1.0545, test_f1: 0.4780
 epoch: 6, train_loss: 0.9361, test_loss: 0.9406, test_f1: 0.5055
 epoch: 7, train_loss: 0.9404, test_loss: 0.9600, test_f1: 0.4856
 epoch: 8, train_loss: 0.9127, test_loss: 0.9429, test_f1: 0.5236
 epoch: 9, train_loss: 0.8988, test_loss: 0.9722, test_f1: 0.5080
 epoch: 10, train_loss: 0.8740, test_loss: 1.0207, test_f1: 0.4715
 epoch: 11, train_loss: 0.8887, test_loss: 0.8802, test_f1: 0.5314
 epoch: 12, train_loss: 0.8519, test_loss: 0.9002, test_f1: 0.5254
 epoch: 13, train_loss: 0.8502, test_loss: 1.0017, test_f1: 0.4917
 epoch: 14, train_loss: 0.8562, test_loss: 0.8312, test_f1: 0.5713
 epoch: 15, train_loss: 0.8314, test_loss: 0.8927, test_f1: 0.6041
 epoch: 16, train_loss: 0.8176, test_loss: 0.8136, test_f1: 0.5621
 epoch: 17, train_loss: 0.8204, test_loss: 0.8835, test_f1: 0.6127
 epoch: 18, train_loss: 0.8201, test_loss: 1.0751, test_f1: 0.5016
 epoch: 19, train_loss: 0.8087, test_loss: 0.7786, test_f1: 0.5717
 epoch: 20, train_loss: 0.8017, test_loss: 0.8890, test_f1: 0.5517
 epoch: 21, train_loss: 0.7955, test_loss: 0.9022, test_f1: 0.5448
 epoch: 22, train_loss: 0.7937, test_loss: 0.9248, test_f1: 0.6033
 epoch: 23, train_loss: 0.7869, test_loss: 0.8632, test_f1: 0.6230
 epoch: 24, train_loss: 0.7811, test_loss: 0.9158, test_f1: 0.5594
 epoch: 25, train_loss: 0.7537, test_loss: 0.9052, test_f1: 0.6242
 epoch: 26, train_loss: 0.7521, test_loss: 0.9493, test_f1: 0.5738
 epoch: 27, train_loss: 0.7627, test_loss: 0.8771, test_f1: 0.5502
 epoch: 28, train_loss: 0.7696, test_loss: 0.8790, test_f1: 0.6188
 epoch: 29, train_loss: 0.7565, test_loss: 0.8550, test_f1: 0.5794
 epoch: 30, train_loss: 0.7609, test_loss: 0.8582, test_f1: 0.6301
 epoch: 31, train_loss: 0.7581, test_loss: 0.8329, test_f1: 0.6248
 epoch: 32, train_loss: 0.7510, test_loss: 0.8581, test_f1: 0.6148
 epoch: 33, train_loss: 0.7643, test_loss: 1.1252, test_f1: 0.5273
 epoch: 34, train_loss: 0.7455, test_loss: 0.9546, test_f1: 0.5874
 epoch: 35, train_loss: 0.7464, test_loss: 0.8601, test_f1: 0.6193
 epoch: 36, train_loss: 0.7325, test_loss: 0.9018, test_f1: 0.5703
 epoch: 37, train_loss: 0.7308, test_loss: 0.9490, test_f1: 0.6034
 epoch: 38, train_loss: 0.7222, test_loss: 0.8506, test_f1: 0.6226
 epoch: 39, train_loss: 0.7232, test_loss: 0.8621, test_f1: 0.5926
 epoch: 40, train_loss: 0.7219, test_loss: 0.8295, test_f1: 0.6478
 epoch: 41, train_loss: 0.7229, test_loss: 0.7595, test_f1: 0.6271
 epoch: 42, train_loss: 0.7235, test_loss: 0.9411, test_f1: 0.5994
 epoch: 43, train_loss: 0.6990, test_loss: 0.9623, test_f1: 0.6017
 epoch: 44, train_loss: 0.7275, test_loss: 0.8574, test_f1: 0.6079
 epoch: 45, train_loss: 0.6993, test_loss: 0.8559, test_f1: 0.6302
 epoch: 46, train_loss: 0.7202, test_loss: 0.9304, test_f1: 0.6303
 epoch: 47, train_loss: 0.6998, test_loss: 0.8563, test_f1: 0.6211
 epoch: 48, train_loss: 0.6856, test_loss: 0.8789, test_f1: 0.6106
 epoch: 49, train_loss: 0.7108, test_loss: 0.9812, test_f1: 0.6030
 epoch: 50, train_loss: 0.7198, test_loss: 1.0406, test_f1: 0.5714
 epoch: 51, train_loss: 0.6567, test_loss: 0.9367, test_f1: 0.6176
 epoch: 52, train_loss: 0.6378, test_loss: 0.9845, test_f1: 0.6441
 epoch: 53, train_loss: 0.6312, test_loss: 0.9364, test_f1: 0.6385
 epoch: 54, train_loss: 0.6378, test_loss: 1.0506, test_f1: 0.6045
 epoch: 55, train_loss: 0.6139, test_loss: 0.9138, test_f1: 0.6350
 epoch: 56, train_loss: 0.6176, test_loss: 0.9117, test_f1: 0.6294
 epoch: 57, train_loss: 0.6293, test_loss: 0.8487, test_f1: 0.6394
 epoch: 58, train_loss: 0.6123, test_loss: 0.9423, test_f1: 0.6246
 epoch: 59, train_loss: 0.6235, test_loss: 1.0081, test_f1: 0.6195
 epoch: 60, train_loss: 0.6194, test_loss: 0.9659, test_f1: 0.6512
 epoch: 61, train_loss: 0.6008, test_loss: 0.9437, test_f1: 0.6402
 epoch: 62, train_loss: 0.6033, test_loss: 0.9864, test_f1: 0.6193
 epoch: 63, train_loss: 0.6183, test_loss: 0.8066, test_f1: 0.6260
 epoch: 64, train_loss: 0.6067, test_loss: 0.8787, test_f1: 0.6373
 epoch: 65, train_loss: 0.5949, test_loss: 1.0016, test_f1: 0.6516
 epoch: 66, train_loss: 0.5907, test_loss: 0.9188, test_f1: 0.6578
 epoch: 67, train_loss: 0.5950, test_loss: 0.9680, test_f1: 0.6599
 epoch: 68, train_loss: 0.5898, test_loss: 0.9177, test_f1: 0.6513
 epoch: 69, train_loss: 0.5929, test_loss: 0.8755, test_f1: 0.6535
 epoch: 70, train_loss: 0.5631, test_loss: 0.8688, test_f1: 0.6549
 epoch: 71, train_loss: 0.5887, test_loss: 0.8192, test_f1: 0.6441
 epoch: 72, train_loss: 0.5812, test_loss: 0.8657, test_f1: 0.6387
 epoch: 73, train_loss: 0.5716, test_loss: 1.1072, test_f1: 0.6044
 epoch: 74, train_loss: 0.5696, test_loss: 0.8535, test_f1: 0.6500
 epoch: 75, train_loss: 0.5674, test_loss: 0.8886, test_f1: 0.6665
 epoch: 76, train_loss: 0.5695, test_loss: 0.9489, test_f1: 0.6318
 epoch: 77, train_loss: 0.5612, test_loss: 0.9803, test_f1: 0.6423
 epoch: 78, train_loss: 0.5757, test_loss: 0.9829, test_f1: 0.6473
 epoch: 79, train_loss: 0.5680, test_loss: 0.9109, test_f1: 0.6516
 epoch: 80, train_loss: 0.5702, test_loss: 0.9472, test_f1: 0.6558
 epoch: 81, train_loss: 0.5553, test_loss: 0.9062, test_f1: 0.6682
 epoch: 82, train_loss: 0.5719, test_loss: 0.9330, test_f1: 0.6508
 epoch: 83, train_loss: 0.5672, test_loss: 0.9251, test_f1: 0.6316
 epoch: 84, train_loss: 0.5575, test_loss: 0.8640, test_f1: 0.6654
 epoch: 85, train_loss: 0.5485, test_loss: 0.8944, test_f1: 0.6493
 epoch: 86, train_loss: 0.5556, test_loss: 0.9667, test_f1: 0.6455
 epoch: 87, train_loss: 0.5556, test_loss: 0.9473, test_f1: 0.6612
 epoch: 88, train_loss: 0.5553, test_loss: 0.9712, test_f1: 0.6669
 epoch: 89, train_loss: 0.5493, test_loss: 0.9330, test_f1: 0.6491
 epoch: 90, train_loss: 0.5531, test_loss: 0.9736, test_f1: 0.6706
 epoch: 91, train_loss: 0.5387, test_loss: 0.9254, test_f1: 0.6414
 epoch: 92, train_loss: 0.5454, test_loss: 0.9088, test_f1: 0.6765
 epoch: 93, train_loss: 0.5369, test_loss: 1.0440, test_f1: 0.6180
 epoch: 94, train_loss: 0.5437, test_loss: 0.8950, test_f1: 0.6436
 epoch: 95, train_loss: 0.5214, test_loss: 0.9136, test_f1: 0.6573
 epoch: 96, train_loss: 0.5491, test_loss: 1.0173, test_f1: 0.6741
 epoch: 97, train_loss: 0.5316, test_loss: 0.9110, test_f1: 0.6521
 epoch: 98, train_loss: 0.5589, test_loss: 0.9507, test_f1: 0.6379
 epoch: 99, train_loss: 0.5426, test_loss: 0.9858, test_f1: 0.6611
##################ITERATION #1 ****************************************
 epoch: 0, train_loss: 1.0890, test_loss: 1.2038, test_f1: 0.4263
 epoch: 1, train_loss: 0.9976, test_loss: 1.1013, test_f1: 0.4543
 epoch: 2, train_loss: 0.9751, test_loss: 1.0576, test_f1: 0.4705
 epoch: 3, train_loss: 0.9631, test_loss: 1.0566, test_f1: 0.4420
 epoch: 4, train_loss: 0.9539, test_loss: 0.9824, test_f1: 0.5451
 epoch: 5, train_loss: 0.9357, test_loss: 0.9152, test_f1: 0.5381
 epoch: 6, train_loss: 0.9474, test_loss: 1.0048, test_f1: 0.4949
 epoch: 7, train_loss: 0.9246, test_loss: 0.9184, test_f1: 0.5597
 epoch: 8, train_loss: 0.9025, test_loss: 0.8809, test_f1: 0.5611
 epoch: 9, train_loss: 0.8951, test_loss: 0.8645, test_f1: 0.5509
 epoch: 10, train_loss: 0.8826, test_loss: 0.8854, test_f1: 0.5096
 epoch: 11, train_loss: 0.8723, test_loss: 1.1034, test_f1: 0.5054
 epoch: 12, train_loss: 0.8700, test_loss: 0.8965, test_f1: 0.5744
 epoch: 13, train_loss: 0.8454, test_loss: 0.9892, test_f1: 0.5293
 epoch: 14, train_loss: 0.8525, test_loss: 0.8833, test_f1: 0.5863
 epoch: 15, train_loss: 0.8482, test_loss: 0.8824, test_f1: 0.5101
 epoch: 16, train_loss: 0.8556, test_loss: 0.8526, test_f1: 0.5950
 epoch: 17, train_loss: 0.8571, test_loss: 0.9679, test_f1: 0.4958
 epoch: 18, train_loss: 0.8296, test_loss: 0.8244, test_f1: 0.5437
 epoch: 19, train_loss: 0.8244, test_loss: 0.8377, test_f1: 0.6013
 epoch: 20, train_loss: 0.8297, test_loss: 0.7914, test_f1: 0.5741
 epoch: 21, train_loss: 0.8183, test_loss: 0.7922, test_f1: 0.6329
 epoch: 22, train_loss: 0.8002, test_loss: 0.8537, test_f1: 0.6264
 epoch: 23, train_loss: 0.7974, test_loss: 0.7932, test_f1: 0.6237
 epoch: 24, train_loss: 0.7849, test_loss: 0.7985, test_f1: 0.5794
 epoch: 25, train_loss: 0.7749, test_loss: 0.7893, test_f1: 0.6411
 epoch: 26, train_loss: 0.7963, test_loss: 0.7899, test_f1: 0.6483
 epoch: 27, train_loss: 0.7609, test_loss: 0.8810, test_f1: 0.5978
 epoch: 28, train_loss: 0.7535, test_loss: 0.8336, test_f1: 0.6167
 epoch: 29, train_loss: 0.7593, test_loss: 0.8475, test_f1: 0.6321
 epoch: 30, train_loss: 0.7581, test_loss: 0.8478, test_f1: 0.6134
 epoch: 31, train_loss: 0.7509, test_loss: 0.7950, test_f1: 0.6250
 epoch: 32, train_loss: 0.7555, test_loss: 0.8182, test_f1: 0.6379
 epoch: 33, train_loss: 0.7437, test_loss: 0.8595, test_f1: 0.6408
 epoch: 34, train_loss: 0.7540, test_loss: 0.8198, test_f1: 0.6007
 epoch: 35, train_loss: 0.7481, test_loss: 0.8043, test_f1: 0.6167
 epoch: 36, train_loss: 0.7196, test_loss: 0.8318, test_f1: 0.6550
 epoch: 37, train_loss: 0.7346, test_loss: 0.8726, test_f1: 0.6242
 epoch: 38, train_loss: 0.7408, test_loss: 0.8759, test_f1: 0.6056
 epoch: 39, train_loss: 0.7236, test_loss: 0.7509, test_f1: 0.6395
 epoch: 40, train_loss: 0.7169, test_loss: 0.7862, test_f1: 0.6227
 epoch: 41, train_loss: 0.6959, test_loss: 0.8952, test_f1: 0.5770
 epoch: 42, train_loss: 0.6966, test_loss: 0.8728, test_f1: 0.6106
 epoch: 43, train_loss: 0.7068, test_loss: 0.7971, test_f1: 0.6828
 epoch: 44, train_loss: 0.6912, test_loss: 0.9062, test_f1: 0.6333
 epoch: 45, train_loss: 0.6943, test_loss: 0.9210, test_f1: 0.6220
 epoch: 46, train_loss: 0.7100, test_loss: 0.8201, test_f1: 0.6469
 epoch: 47, train_loss: 0.7162, test_loss: 0.7662, test_f1: 0.6705
 epoch: 48, train_loss: 0.6917, test_loss: 0.8278, test_f1: 0.6327
 epoch: 49, train_loss: 0.6948, test_loss: 0.9050, test_f1: 0.6007
 epoch: 50, train_loss: 0.6972, test_loss: 0.9408, test_f1: 0.6114
 epoch: 51, train_loss: 0.6523, test_loss: 0.8515, test_f1: 0.6809
 epoch: 52, train_loss: 0.6320, test_loss: 0.8852, test_f1: 0.6442
 epoch: 53, train_loss: 0.6231, test_loss: 0.8631, test_f1: 0.6604
 epoch: 54, train_loss: 0.6434, test_loss: 0.8504, test_f1: 0.6351
 epoch: 55, train_loss: 0.6187, test_loss: 0.9407, test_f1: 0.6902
 epoch: 56, train_loss: 0.6191, test_loss: 0.9430, test_f1: 0.6957
 epoch: 57, train_loss: 0.6095, test_loss: 0.8649, test_f1: 0.6598
 epoch: 58, train_loss: 0.6073, test_loss: 0.8364, test_f1: 0.6869
 epoch: 59, train_loss: 0.6195, test_loss: 0.7843, test_f1: 0.6641
 epoch: 60, train_loss: 0.6069, test_loss: 0.9193, test_f1: 0.6762
 epoch: 61, train_loss: 0.6103, test_loss: 0.9664, test_f1: 0.6342
 epoch: 62, train_loss: 0.5956, test_loss: 0.8733, test_f1: 0.6880
 epoch: 63, train_loss: 0.5920, test_loss: 0.9426, test_f1: 0.6386
 epoch: 64, train_loss: 0.5916, test_loss: 0.9072, test_f1: 0.6662
 epoch: 65, train_loss: 0.5953, test_loss: 1.0286, test_f1: 0.6908
 epoch: 66, train_loss: 0.5906, test_loss: 1.0001, test_f1: 0.6366
 epoch: 67, train_loss: 0.5834, test_loss: 1.0999, test_f1: 0.6632
 epoch: 68, train_loss: 0.5799, test_loss: 1.0930, test_f1: 0.6558
 epoch: 69, train_loss: 0.5808, test_loss: 1.1311, test_f1: 0.6640
 epoch: 70, train_loss: 0.5788, test_loss: 1.0386, test_f1: 0.6580
 epoch: 71, train_loss: 0.5663, test_loss: 1.0000, test_f1: 0.6486
 epoch: 72, train_loss: 0.6052, test_loss: 1.0705, test_f1: 0.6597
 epoch: 73, train_loss: 0.5757, test_loss: 1.2361, test_f1: 0.6669
 epoch: 74, train_loss: 0.5681, test_loss: 1.1757, test_f1: 0.6440
 epoch: 75, train_loss: 0.5815, test_loss: 1.0263, test_f1: 0.6659
 epoch: 76, train_loss: 0.5667, test_loss: 1.0056, test_f1: 0.6659
 epoch: 77, train_loss: 0.5644, test_loss: 1.0618, test_f1: 0.6400
 epoch: 78, train_loss: 0.5449, test_loss: 0.9762, test_f1: 0.6791
 epoch: 79, train_loss: 0.5708, test_loss: 0.9862, test_f1: 0.6637
 epoch: 80, train_loss: 0.5560, test_loss: 0.9092, test_f1: 0.6823
 epoch: 81, train_loss: 0.5574, test_loss: 0.9494, test_f1: 0.6636
 epoch: 82, train_loss: 0.5507, test_loss: 1.0030, test_f1: 0.6575
 epoch: 83, train_loss: 0.5432, test_loss: 1.2100, test_f1: 0.6262
 epoch: 84, train_loss: 0.5538, test_loss: 1.0987, test_f1: 0.6576
 epoch: 85, train_loss: 0.5417, test_loss: 0.9872, test_f1: 0.6522
 epoch: 86, train_loss: 0.5512, test_loss: 1.1354, test_f1: 0.6568
 epoch: 87, train_loss: 0.5414, test_loss: 1.1712, test_f1: 0.6949
 epoch: 88, train_loss: 0.5432, test_loss: 1.0615, test_f1: 0.6401
 epoch: 89, train_loss: 0.5496, test_loss: 1.1348, test_f1: 0.6605
 epoch: 90, train_loss: 0.5238, test_loss: 1.0593, test_f1: 0.6659
 epoch: 91, train_loss: 0.5359, test_loss: 1.1069, test_f1: 0.6562
 epoch: 92, train_loss: 0.5391, test_loss: 1.2186, test_f1: 0.6699
 epoch: 93, train_loss: 0.5280, test_loss: 1.3595, test_f1: 0.6691
 epoch: 94, train_loss: 0.5282, test_loss: 1.1441, test_f1: 0.6564
 epoch: 95, train_loss: 0.5351, test_loss: 1.0970, test_f1: 0.6870
 epoch: 96, train_loss: 0.5341, test_loss: 1.1422, test_f1: 0.6433
 epoch: 97, train_loss: 0.5269, test_loss: 1.2057, test_f1: 0.6650
 epoch: 98, train_loss: 0.5236, test_loss: 1.1148, test_f1: 0.6596
 epoch: 99, train_loss: 0.5319, test_loss: 1.2481, test_f1: 0.6725
##################ITERATION #2 ****************************************
 epoch: 0, train_loss: 1.1065, test_loss: 1.0378, test_f1: 0.4675
 epoch: 1, train_loss: 1.0059, test_loss: 1.0136, test_f1: 0.4255
 epoch: 2, train_loss: 0.9648, test_loss: 0.9396, test_f1: 0.4823
 epoch: 3, train_loss: 0.9588, test_loss: 0.9499, test_f1: 0.5497
 epoch: 4, train_loss: 0.9274, test_loss: 0.9243, test_f1: 0.4948
 epoch: 5, train_loss: 0.9331, test_loss: 0.8585, test_f1: 0.5394
 epoch: 6, train_loss: 0.9257, test_loss: 0.8944, test_f1: 0.5287
 epoch: 7, train_loss: 0.8906, test_loss: 0.9011, test_f1: 0.5412
 epoch: 8, train_loss: 0.8954, test_loss: 0.8499, test_f1: 0.5592
 epoch: 9, train_loss: 0.8590, test_loss: 0.9029, test_f1: 0.5538
 epoch: 10, train_loss: 0.8722, test_loss: 0.9194, test_f1: 0.5608
 epoch: 11, train_loss: 0.8750, test_loss: 0.8326, test_f1: 0.5405
 epoch: 12, train_loss: 0.8459, test_loss: 0.9161, test_f1: 0.5578
 epoch: 13, train_loss: 0.8449, test_loss: 0.8672, test_f1: 0.5397
 epoch: 14, train_loss: 0.8412, test_loss: 0.8501, test_f1: 0.6179
 epoch: 15, train_loss: 0.8428, test_loss: 0.8934, test_f1: 0.5890
 epoch: 16, train_loss: 0.8061, test_loss: 0.8983, test_f1: 0.5596
 epoch: 17, train_loss: 0.8185, test_loss: 0.8334, test_f1: 0.5577
 epoch: 18, train_loss: 0.8163, test_loss: 0.8006, test_f1: 0.6176
 epoch: 19, train_loss: 0.8033, test_loss: 0.8671, test_f1: 0.5385
 epoch: 20, train_loss: 0.7853, test_loss: 0.8494, test_f1: 0.5529
 epoch: 21, train_loss: 0.8015, test_loss: 0.9470, test_f1: 0.5997
 epoch: 22, train_loss: 0.8084, test_loss: 0.8705, test_f1: 0.6174
 epoch: 23, train_loss: 0.8087, test_loss: 0.8464, test_f1: 0.6121
 epoch: 24, train_loss: 0.8085, test_loss: 0.9489, test_f1: 0.5690
 epoch: 25, train_loss: 0.7868, test_loss: 0.8601, test_f1: 0.6081
 epoch: 26, train_loss: 0.7805, test_loss: 0.7976, test_f1: 0.6149
 epoch: 27, train_loss: 0.7823, test_loss: 0.8080, test_f1: 0.6121
 epoch: 28, train_loss: 0.7826, test_loss: 0.8083, test_f1: 0.5804
 epoch: 29, train_loss: 0.7759, test_loss: 0.7453, test_f1: 0.6408
 epoch: 30, train_loss: 0.7780, test_loss: 0.8074, test_f1: 0.6331
 epoch: 31, train_loss: 0.7711, test_loss: 0.8306, test_f1: 0.6069
 epoch: 32, train_loss: 0.7642, test_loss: 0.8375, test_f1: 0.6316
 epoch: 33, train_loss: 0.7711, test_loss: 0.8895, test_f1: 0.6204
 epoch: 34, train_loss: 0.7632, test_loss: 0.7682, test_f1: 0.6429
 epoch: 35, train_loss: 0.7594, test_loss: 0.9159, test_f1: 0.6368
 epoch: 36, train_loss: 0.7516, test_loss: 1.0122, test_f1: 0.5143
 epoch: 37, train_loss: 0.7654, test_loss: 0.8244, test_f1: 0.6400
 epoch: 38, train_loss: 0.7548, test_loss: 0.9018, test_f1: 0.5906
 epoch: 39, train_loss: 0.7545, test_loss: 0.8408, test_f1: 0.6129
 epoch: 40, train_loss: 0.7526, test_loss: 0.7771, test_f1: 0.6279
 epoch: 41, train_loss: 0.7326, test_loss: 0.9548, test_f1: 0.5937
 epoch: 42, train_loss: 0.7455, test_loss: 0.8006, test_f1: 0.6696
 epoch: 43, train_loss: 0.7455, test_loss: 0.8582, test_f1: 0.6119
 epoch: 44, train_loss: 0.7346, test_loss: 0.7620, test_f1: 0.6100
 epoch: 45, train_loss: 0.7274, test_loss: 0.8432, test_f1: 0.6198
 epoch: 46, train_loss: 0.7356, test_loss: 0.9054, test_f1: 0.6270
 epoch: 47, train_loss: 0.7290, test_loss: 0.8848, test_f1: 0.6364
 epoch: 48, train_loss: 0.7268, test_loss: 0.9420, test_f1: 0.6097
 epoch: 49, train_loss: 0.7106, test_loss: 0.8245, test_f1: 0.6425
 epoch: 50, train_loss: 0.7118, test_loss: 0.9915, test_f1: 0.5953
 epoch: 51, train_loss: 0.6716, test_loss: 0.8393, test_f1: 0.6432
 epoch: 52, train_loss: 0.6762, test_loss: 0.9692, test_f1: 0.6493
 epoch: 53, train_loss: 0.6518, test_loss: 0.9570, test_f1: 0.6422
 epoch: 54, train_loss: 0.6519, test_loss: 0.9209, test_f1: 0.6319
 epoch: 55, train_loss: 0.6636, test_loss: 0.7915, test_f1: 0.6396
 epoch: 56, train_loss: 0.6514, test_loss: 0.8924, test_f1: 0.6338
 epoch: 57, train_loss: 0.6399, test_loss: 0.8954, test_f1: 0.6471
 epoch: 58, train_loss: 0.6524, test_loss: 0.9593, test_f1: 0.6504
 epoch: 59, train_loss: 0.6427, test_loss: 0.9199, test_f1: 0.6328
 epoch: 60, train_loss: 0.6200, test_loss: 0.8788, test_f1: 0.6334
 epoch: 61, train_loss: 0.6240, test_loss: 1.0538, test_f1: 0.6311
 epoch: 62, train_loss: 0.6368, test_loss: 0.8856, test_f1: 0.6358
 epoch: 63, train_loss: 0.6188, test_loss: 0.8889, test_f1: 0.6619
 epoch: 64, train_loss: 0.6165, test_loss: 0.9359, test_f1: 0.6528
 epoch: 65, train_loss: 0.6319, test_loss: 0.9391, test_f1: 0.6544
 epoch: 66, train_loss: 0.6174, test_loss: 0.8745, test_f1: 0.6396
 epoch: 67, train_loss: 0.6179, test_loss: 0.9509, test_f1: 0.6579
 epoch: 68, train_loss: 0.6230, test_loss: 1.0891, test_f1: 0.6427
 epoch: 69, train_loss: 0.6051, test_loss: 1.0748, test_f1: 0.6493
 epoch: 70, train_loss: 0.6137, test_loss: 0.9041, test_f1: 0.6690
 epoch: 71, train_loss: 0.6066, test_loss: 0.9098, test_f1: 0.6460
 epoch: 72, train_loss: 0.6048, test_loss: 1.0096, test_f1: 0.6522
 epoch: 73, train_loss: 0.5827, test_loss: 1.0536, test_f1: 0.6243
 epoch: 74, train_loss: 0.6073, test_loss: 1.0453, test_f1: 0.6220
 epoch: 75, train_loss: 0.5735, test_loss: 1.0784, test_f1: 0.6417
 epoch: 76, train_loss: 0.5875, test_loss: 0.9461, test_f1: 0.6502
 epoch: 77, train_loss: 0.5951, test_loss: 1.0751, test_f1: 0.6516
 epoch: 78, train_loss: 0.5940, test_loss: 0.9175, test_f1: 0.6525
 epoch: 79, train_loss: 0.5696, test_loss: 1.0021, test_f1: 0.6386
 epoch: 80, train_loss: 0.5942, test_loss: 1.1317, test_f1: 0.6635
 epoch: 81, train_loss: 0.5766, test_loss: 1.0998, test_f1: 0.6461
 epoch: 82, train_loss: 0.5721, test_loss: 1.1513, test_f1: 0.6440
 epoch: 83, train_loss: 0.5879, test_loss: 1.0452, test_f1: 0.6522
 epoch: 84, train_loss: 0.6032, test_loss: 0.9278, test_f1: 0.6531
 epoch: 85, train_loss: 0.5706, test_loss: 0.7429, test_f1: 0.6530
 epoch: 86, train_loss: 0.5658, test_loss: 0.9098, test_f1: 0.6733
 epoch: 87, train_loss: 0.5610, test_loss: 1.1094, test_f1: 0.6263
 epoch: 88, train_loss: 0.5710, test_loss: 1.1584, test_f1: 0.6298
 epoch: 89, train_loss: 0.5644, test_loss: 1.1398, test_f1: 0.6475
 epoch: 90, train_loss: 0.5528, test_loss: 1.0584, test_f1: 0.6549
 epoch: 91, train_loss: 0.5499, test_loss: 1.2408, test_f1: 0.6426
 epoch: 92, train_loss: 0.5676, test_loss: 0.9796, test_f1: 0.6553
 epoch: 93, train_loss: 0.5638, test_loss: 0.8979, test_f1: 0.6403
 epoch: 94, train_loss: 0.5546, test_loss: 0.9196, test_f1: 0.6575
 epoch: 95, train_loss: 0.5482, test_loss: 1.0592, test_f1: 0.6664
 epoch: 96, train_loss: 0.5533, test_loss: 1.0188, test_f1: 0.6626
 epoch: 97, train_loss: 0.5653, test_loss: 0.9889, test_f1: 0.6632
 epoch: 98, train_loss: 0.5607, test_loss: 1.1140, test_f1: 0.6606
 epoch: 99, train_loss: 0.5359, test_loss: 0.9815, test_f1: 0.6547
##################ITERATION #3 ****************************************
 epoch: 0, train_loss: 1.1031, test_loss: 1.0337, test_f1: 0.4456
 epoch: 1, train_loss: 1.0071, test_loss: 1.0749, test_f1: 0.4476
 epoch: 2, train_loss: 0.9863, test_loss: 0.9892, test_f1: 0.4888
 epoch: 3, train_loss: 0.9679, test_loss: 0.9242, test_f1: 0.5205
 epoch: 4, train_loss: 0.9522, test_loss: 0.9510, test_f1: 0.5017
 epoch: 5, train_loss: 0.9412, test_loss: 0.9263, test_f1: 0.4792
 epoch: 6, train_loss: 0.9167, test_loss: 0.9371, test_f1: 0.5050
 epoch: 7, train_loss: 0.9095, test_loss: 0.9258, test_f1: 0.5065
 epoch: 8, train_loss: 0.9221, test_loss: 0.8500, test_f1: 0.5710
 epoch: 9, train_loss: 0.9063, test_loss: 0.9976, test_f1: 0.4883
 epoch: 10, train_loss: 0.8964, test_loss: 0.9194, test_f1: 0.5148
 epoch: 11, train_loss: 0.8752, test_loss: 0.8841, test_f1: 0.5091
 epoch: 12, train_loss: 0.8676, test_loss: 0.8784, test_f1: 0.5395
 epoch: 13, train_loss: 0.8796, test_loss: 0.8485, test_f1: 0.5304
 epoch: 14, train_loss: 0.8598, test_loss: 0.8691, test_f1: 0.5322
 epoch: 15, train_loss: 0.8542, test_loss: 0.8778, test_f1: 0.5183
 epoch: 16, train_loss: 0.8549, test_loss: 0.8560, test_f1: 0.5515
 epoch: 17, train_loss: 0.8498, test_loss: 0.8560, test_f1: 0.5916
 epoch: 18, train_loss: 0.8242, test_loss: 0.9086, test_f1: 0.5226
 epoch: 19, train_loss: 0.8314, test_loss: 0.8630, test_f1: 0.5157
 epoch: 20, train_loss: 0.8209, test_loss: 0.8992, test_f1: 0.5164
 epoch: 21, train_loss: 0.8234, test_loss: 0.8544, test_f1: 0.5618
 epoch: 22, train_loss: 0.8167, test_loss: 0.9918, test_f1: 0.4998
 epoch: 23, train_loss: 0.8034, test_loss: 0.8104, test_f1: 0.5417
 epoch: 24, train_loss: 0.8151, test_loss: 0.8620, test_f1: 0.5489
 epoch: 25, train_loss: 0.8136, test_loss: 0.8763, test_f1: 0.5081
 epoch: 26, train_loss: 0.7952, test_loss: 0.7919, test_f1: 0.5511
 epoch: 27, train_loss: 0.8073, test_loss: 0.8183, test_f1: 0.5518
 epoch: 28, train_loss: 0.7788, test_loss: 0.9535, test_f1: 0.5353
 epoch: 29, train_loss: 0.7875, test_loss: 0.9705, test_f1: 0.5109
 epoch: 30, train_loss: 0.7936, test_loss: 0.8187, test_f1: 0.5689
 epoch: 31, train_loss: 0.7715, test_loss: 0.8325, test_f1: 0.5685
 epoch: 32, train_loss: 0.7851, test_loss: 0.8897, test_f1: 0.5978
 epoch: 33, train_loss: 0.7725, test_loss: 0.8238, test_f1: 0.6203
 epoch: 34, train_loss: 0.7533, test_loss: 0.8965, test_f1: 0.5819
 epoch: 35, train_loss: 0.7853, test_loss: 0.9611, test_f1: 0.5381
 epoch: 36, train_loss: 0.7732, test_loss: 0.9570, test_f1: 0.5605
 epoch: 37, train_loss: 0.7619, test_loss: 0.8601, test_f1: 0.5351
 epoch: 38, train_loss: 0.7682, test_loss: 0.8280, test_f1: 0.5953
 epoch: 39, train_loss: 0.7516, test_loss: 0.8263, test_f1: 0.5982
 epoch: 40, train_loss: 0.7407, test_loss: 0.8622, test_f1: 0.5655
 epoch: 41, train_loss: 0.7523, test_loss: 0.8204, test_f1: 0.5989
 epoch: 42, train_loss: 0.7260, test_loss: 0.8504, test_f1: 0.5988
 epoch: 43, train_loss: 0.7269, test_loss: 0.9425, test_f1: 0.6060
 epoch: 44, train_loss: 0.7370, test_loss: 0.8220, test_f1: 0.6227
 epoch: 45, train_loss: 0.7262, test_loss: 0.8405, test_f1: 0.6139
 epoch: 46, train_loss: 0.6871, test_loss: 0.8615, test_f1: 0.6349
 epoch: 47, train_loss: 0.6979, test_loss: 0.8696, test_f1: 0.5743
 epoch: 48, train_loss: 0.7227, test_loss: 0.8739, test_f1: 0.6279
 epoch: 49, train_loss: 0.7079, test_loss: 1.0140, test_f1: 0.5743
 epoch: 50, train_loss: 0.7127, test_loss: 1.0205, test_f1: 0.6305
 epoch: 51, train_loss: 0.6599, test_loss: 0.8410, test_f1: 0.6665
 epoch: 52, train_loss: 0.6601, test_loss: 0.8304, test_f1: 0.6641
 epoch: 53, train_loss: 0.6472, test_loss: 0.8812, test_f1: 0.6807
 epoch: 54, train_loss: 0.6354, test_loss: 0.8568, test_f1: 0.6800
 epoch: 55, train_loss: 0.6276, test_loss: 0.9439, test_f1: 0.6415
 epoch: 56, train_loss: 0.6289, test_loss: 0.9269, test_f1: 0.6454
 epoch: 57, train_loss: 0.6539, test_loss: 0.9037, test_f1: 0.6435
 epoch: 58, train_loss: 0.6266, test_loss: 0.8480, test_f1: 0.6881
 epoch: 59, train_loss: 0.6297, test_loss: 0.8793, test_f1: 0.6193
 epoch: 60, train_loss: 0.6077, test_loss: 0.8341, test_f1: 0.6939
 epoch: 61, train_loss: 0.6308, test_loss: 0.8591, test_f1: 0.7022
 epoch: 62, train_loss: 0.6110, test_loss: 0.8966, test_f1: 0.6272
 epoch: 63, train_loss: 0.6222, test_loss: 0.8221, test_f1: 0.7038
 epoch: 64, train_loss: 0.6130, test_loss: 0.8644, test_f1: 0.6822
 epoch: 65, train_loss: 0.5953, test_loss: 0.8433, test_f1: 0.6618
 epoch: 66, train_loss: 0.5946, test_loss: 0.8746, test_f1: 0.6674
 epoch: 67, train_loss: 0.5911, test_loss: 0.9966, test_f1: 0.6703
 epoch: 68, train_loss: 0.6045, test_loss: 0.9779, test_f1: 0.6517
 epoch: 69, train_loss: 0.5908, test_loss: 0.8771, test_f1: 0.6709
 epoch: 70, train_loss: 0.5953, test_loss: 0.9425, test_f1: 0.6539
 epoch: 71, train_loss: 0.5997, test_loss: 0.8627, test_f1: 0.6888
 epoch: 72, train_loss: 0.5873, test_loss: 0.8803, test_f1: 0.6763
 epoch: 73, train_loss: 0.5868, test_loss: 0.7753, test_f1: 0.6790
 epoch: 74, train_loss: 0.5890, test_loss: 0.9406, test_f1: 0.6558
 epoch: 75, train_loss: 0.5844, test_loss: 0.8092, test_f1: 0.6780
 epoch: 76, train_loss: 0.6050, test_loss: 0.9422, test_f1: 0.6750
 epoch: 77, train_loss: 0.5677, test_loss: 0.9381, test_f1: 0.6717
 epoch: 78, train_loss: 0.5644, test_loss: 0.9534, test_f1: 0.6793
 epoch: 79, train_loss: 0.5751, test_loss: 0.9427, test_f1: 0.6774
 epoch: 80, train_loss: 0.5631, test_loss: 0.9648, test_f1: 0.6898
 epoch: 81, train_loss: 0.5691, test_loss: 0.9172, test_f1: 0.6712
 epoch: 82, train_loss: 0.5768, test_loss: 0.8877, test_f1: 0.6744
 epoch: 83, train_loss: 0.5809, test_loss: 0.8268, test_f1: 0.6789
 epoch: 84, train_loss: 0.5707, test_loss: 0.8612, test_f1: 0.6728
 epoch: 85, train_loss: 0.5477, test_loss: 0.8875, test_f1: 0.6769
 epoch: 86, train_loss: 0.5612, test_loss: 0.9807, test_f1: 0.6684
 epoch: 87, train_loss: 0.5478, test_loss: 0.9261, test_f1: 0.6837
 epoch: 88, train_loss: 0.5638, test_loss: 0.9077, test_f1: 0.6865
 epoch: 89, train_loss: 0.5340, test_loss: 1.0737, test_f1: 0.6758
 epoch: 90, train_loss: 0.5283, test_loss: 1.0537, test_f1: 0.6836
 epoch: 91, train_loss: 0.5592, test_loss: 0.7957, test_f1: 0.6896
 epoch: 92, train_loss: 0.5434, test_loss: 0.8692, test_f1: 0.6885
 epoch: 93, train_loss: 0.5457, test_loss: 0.8473, test_f1: 0.6715
 epoch: 94, train_loss: 0.5442, test_loss: 0.9501, test_f1: 0.6598
 epoch: 95, train_loss: 0.5471, test_loss: 0.9653, test_f1: 0.7064
 epoch: 96, train_loss: 0.5379, test_loss: 1.0221, test_f1: 0.6618
 epoch: 97, train_loss: 0.5265, test_loss: 1.0047, test_f1: 0.6936
 epoch: 98, train_loss: 0.5342, test_loss: 0.9276, test_f1: 0.6726
 epoch: 99, train_loss: 0.5327, test_loss: 0.9849, test_f1: 0.6878
##################ITERATION #4 ****************************************
 epoch: 0, train_loss: 1.0853, test_loss: 0.9694, test_f1: 0.5085
 epoch: 1, train_loss: 0.9591, test_loss: 0.9695, test_f1: 0.4969
 epoch: 2, train_loss: 0.9368, test_loss: 1.0620, test_f1: 0.4781
 epoch: 3, train_loss: 0.9202, test_loss: 1.0144, test_f1: 0.4867
 epoch: 4, train_loss: 0.9129, test_loss: 0.9249, test_f1: 0.5500
 epoch: 5, train_loss: 0.9013, test_loss: 0.8973, test_f1: 0.5261
 epoch: 6, train_loss: 0.8724, test_loss: 0.8703, test_f1: 0.5267
 epoch: 7, train_loss: 0.8821, test_loss: 0.8527, test_f1: 0.5306
 epoch: 8, train_loss: 0.8512, test_loss: 0.8895, test_f1: 0.5312
 epoch: 9, train_loss: 0.8579, test_loss: 0.8445, test_f1: 0.5529
 epoch: 10, train_loss: 0.8395, test_loss: 0.8949, test_f1: 0.6171
 epoch: 11, train_loss: 0.8372, test_loss: 0.9309, test_f1: 0.5543
 epoch: 12, train_loss: 0.8437, test_loss: 0.8042, test_f1: 0.5426
 epoch: 13, train_loss: 0.8160, test_loss: 0.8083, test_f1: 0.5859
 epoch: 14, train_loss: 0.8190, test_loss: 0.8356, test_f1: 0.6195
 epoch: 15, train_loss: 0.8369, test_loss: 0.8356, test_f1: 0.6457
 epoch: 16, train_loss: 0.8297, test_loss: 0.8089, test_f1: 0.5668
 epoch: 17, train_loss: 0.8069, test_loss: 0.8855, test_f1: 0.5944
 epoch: 18, train_loss: 0.8211, test_loss: 0.8947, test_f1: 0.5786
 epoch: 19, train_loss: 0.7901, test_loss: 0.8911, test_f1: 0.6351
 epoch: 20, train_loss: 0.8133, test_loss: 0.9068, test_f1: 0.5619
 epoch: 21, train_loss: 0.7862, test_loss: 0.9211, test_f1: 0.6018
 epoch: 22, train_loss: 0.7778, test_loss: 0.8585, test_f1: 0.5638
 epoch: 23, train_loss: 0.8134, test_loss: 0.8345, test_f1: 0.5961
 epoch: 24, train_loss: 0.7901, test_loss: 0.8915, test_f1: 0.6045
 epoch: 25, train_loss: 0.7767, test_loss: 0.8427, test_f1: 0.5863
 epoch: 26, train_loss: 0.7597, test_loss: 0.8782, test_f1: 0.6137
 epoch: 27, train_loss: 0.7549, test_loss: 0.8500, test_f1: 0.6093
 epoch: 28, train_loss: 0.7748, test_loss: 0.8447, test_f1: 0.6149
 epoch: 29, train_loss: 0.7458, test_loss: 0.8139, test_f1: 0.6034
 epoch: 30, train_loss: 0.7427, test_loss: 0.8130, test_f1: 0.6219
 epoch: 31, train_loss: 0.7536, test_loss: 0.7920, test_f1: 0.6135
 epoch: 32, train_loss: 0.7467, test_loss: 0.8173, test_f1: 0.6261
 epoch: 33, train_loss: 0.7672, test_loss: 0.8219, test_f1: 0.6056
 epoch: 34, train_loss: 0.7456, test_loss: 0.7836, test_f1: 0.6163
 epoch: 35, train_loss: 0.7309, test_loss: 0.8931, test_f1: 0.6281
 epoch: 36, train_loss: 0.7315, test_loss: 0.8893, test_f1: 0.5907
 epoch: 37, train_loss: 0.7391, test_loss: 0.8326, test_f1: 0.6342
 epoch: 38, train_loss: 0.7497, test_loss: 0.8257, test_f1: 0.5822
 epoch: 39, train_loss: 0.7459, test_loss: 0.7820, test_f1: 0.6311
 epoch: 40, train_loss: 0.7278, test_loss: 0.8113, test_f1: 0.5969
 epoch: 41, train_loss: 0.7232, test_loss: 0.8770, test_f1: 0.5946
 epoch: 42, train_loss: 0.7095, test_loss: 0.8444, test_f1: 0.6118
 epoch: 43, train_loss: 0.7148, test_loss: 0.8346, test_f1: 0.6249
 epoch: 44, train_loss: 0.6960, test_loss: 0.7863, test_f1: 0.6351
 epoch: 45, train_loss: 0.6854, test_loss: 0.8784, test_f1: 0.6518
 epoch: 46, train_loss: 0.6964, test_loss: 0.9067, test_f1: 0.6091
 epoch: 47, train_loss: 0.7028, test_loss: 0.7730, test_f1: 0.6475
 epoch: 48, train_loss: 0.6820, test_loss: 0.8897, test_f1: 0.6302
 epoch: 49, train_loss: 0.7053, test_loss: 0.7822, test_f1: 0.6454
 epoch: 50, train_loss: 0.6792, test_loss: 0.8284, test_f1: 0.6228
 epoch: 51, train_loss: 0.6589, test_loss: 0.7797, test_f1: 0.6372
 epoch: 52, train_loss: 0.6343, test_loss: 0.7535, test_f1: 0.6640
 epoch: 53, train_loss: 0.6232, test_loss: 0.7697, test_f1: 0.6789
 epoch: 54, train_loss: 0.6158, test_loss: 0.7752, test_f1: 0.6556
 epoch: 55, train_loss: 0.6161, test_loss: 0.8119, test_f1: 0.6501
 epoch: 56, train_loss: 0.6092, test_loss: 0.8581, test_f1: 0.6373
 epoch: 57, train_loss: 0.5887, test_loss: 0.8712, test_f1: 0.6659
 epoch: 58, train_loss: 0.6141, test_loss: 0.8105, test_f1: 0.6660
 epoch: 59, train_loss: 0.6013, test_loss: 0.9311, test_f1: 0.6504
 epoch: 60, train_loss: 0.5911, test_loss: 0.7468, test_f1: 0.6812
 epoch: 61, train_loss: 0.6004, test_loss: 0.8523, test_f1: 0.6566
 epoch: 62, train_loss: 0.5940, test_loss: 0.8173, test_f1: 0.6455
 epoch: 63, train_loss: 0.5977, test_loss: 0.7694, test_f1: 0.6583
 epoch: 64, train_loss: 0.5774, test_loss: 0.7969, test_f1: 0.6639
 epoch: 65, train_loss: 0.5920, test_loss: 0.7458, test_f1: 0.6853
 epoch: 66, train_loss: 0.5759, test_loss: 0.7993, test_f1: 0.6687
 epoch: 67, train_loss: 0.5638, test_loss: 0.8130, test_f1: 0.6533
 epoch: 68, train_loss: 0.5903, test_loss: 0.8427, test_f1: 0.6534
 epoch: 69, train_loss: 0.5857, test_loss: 0.8689, test_f1: 0.6698
 epoch: 70, train_loss: 0.5444, test_loss: 0.8242, test_f1: 0.6671
 epoch: 71, train_loss: 0.5674, test_loss: 0.8276, test_f1: 0.6797
 epoch: 72, train_loss: 0.5569, test_loss: 0.8439, test_f1: 0.6516
 epoch: 73, train_loss: 0.5640, test_loss: 0.8442, test_f1: 0.6526
 epoch: 74, train_loss: 0.5442, test_loss: 0.8830, test_f1: 0.6659
 epoch: 75, train_loss: 0.5337, test_loss: 0.9101, test_f1: 0.6795
 epoch: 76, train_loss: 0.5445, test_loss: 0.9164, test_f1: 0.6560
 epoch: 77, train_loss: 0.5450, test_loss: 0.7506, test_f1: 0.6847
 epoch: 78, train_loss: 0.5444, test_loss: 0.8153, test_f1: 0.6814
 epoch: 79, train_loss: 0.5378, test_loss: 0.7953, test_f1: 0.6728
 epoch: 80, train_loss: 0.5343, test_loss: 0.8328, test_f1: 0.6563
 epoch: 81, train_loss: 0.5372, test_loss: 0.8900, test_f1: 0.6763
 epoch: 82, train_loss: 0.5288, test_loss: 0.8951, test_f1: 0.6620
 epoch: 83, train_loss: 0.5351, test_loss: 0.8078, test_f1: 0.6629
 epoch: 84, train_loss: 0.5153, test_loss: 0.8807, test_f1: 0.6542
 epoch: 85, train_loss: 0.5265, test_loss: 0.9283, test_f1: 0.6557
 epoch: 86, train_loss: 0.5195, test_loss: 0.8617, test_f1: 0.6579
 epoch: 87, train_loss: 0.5209, test_loss: 0.9188, test_f1: 0.6454
 epoch: 88, train_loss: 0.5189, test_loss: 0.8338, test_f1: 0.6719
 epoch: 89, train_loss: 0.4976, test_loss: 0.8718, test_f1: 0.6624
 epoch: 90, train_loss: 0.5102, test_loss: 0.8726, test_f1: 0.6511
 epoch: 91, train_loss: 0.5176, test_loss: 0.8650, test_f1: 0.6461
 epoch: 92, train_loss: 0.5155, test_loss: 0.8511, test_f1: 0.6450
 epoch: 93, train_loss: 0.5172, test_loss: 0.9638, test_f1: 0.6631
 epoch: 94, train_loss: 0.4832, test_loss: 0.8440, test_f1: 0.6562
 epoch: 95, train_loss: 0.4994, test_loss: 0.8959, test_f1: 0.6437
 epoch: 96, train_loss: 0.5054, test_loss: 0.8727, test_f1: 0.6626
 epoch: 97, train_loss: 0.5185, test_loss: 0.7649, test_f1: 0.6715
 epoch: 98, train_loss: 0.5045, test_loss: 0.8023, test_f1: 0.6579
 epoch: 99, train_loss: 0.5189, test_loss: 0.8108, test_f1: 0.6659
##################ITERATION #5 ****************************************
 epoch: 0, train_loss: 1.0822, test_loss: 1.0895, test_f1: 0.4288
 epoch: 1, train_loss: 0.9797, test_loss: 0.9422, test_f1: 0.5158
 epoch: 2, train_loss: 0.9491, test_loss: 1.0250, test_f1: 0.4875
 epoch: 3, train_loss: 0.9289, test_loss: 0.9109, test_f1: 0.5165
 epoch: 4, train_loss: 0.9372, test_loss: 0.9957, test_f1: 0.5004
 epoch: 5, train_loss: 0.9102, test_loss: 0.9515, test_f1: 0.5096
 epoch: 6, train_loss: 0.8978, test_loss: 0.8745, test_f1: 0.5371
 epoch: 7, train_loss: 0.8862, test_loss: 0.8434, test_f1: 0.5767
 epoch: 8, train_loss: 0.8793, test_loss: 0.8904, test_f1: 0.5189
 epoch: 9, train_loss: 0.8878, test_loss: 0.8722, test_f1: 0.5525
 epoch: 10, train_loss: 0.8686, test_loss: 0.9394, test_f1: 0.5241
 epoch: 11, train_loss: 0.8675, test_loss: 0.9760, test_f1: 0.5055
 epoch: 12, train_loss: 0.8371, test_loss: 1.0263, test_f1: 0.5545
 epoch: 13, train_loss: 0.8806, test_loss: 0.8553, test_f1: 0.6064
 epoch: 14, train_loss: 0.8408, test_loss: 0.9527, test_f1: 0.5548
 epoch: 15, train_loss: 0.8431, test_loss: 0.8397, test_f1: 0.5534
 epoch: 16, train_loss: 0.8260, test_loss: 0.9114, test_f1: 0.5716
 epoch: 17, train_loss: 0.8000, test_loss: 1.0725, test_f1: 0.5652
 epoch: 18, train_loss: 0.8320, test_loss: 0.8879, test_f1: 0.5690
 epoch: 19, train_loss: 0.8221, test_loss: 0.8807, test_f1: 0.5599
 epoch: 20, train_loss: 0.8108, test_loss: 0.8716, test_f1: 0.5746
 epoch: 21, train_loss: 0.8097, test_loss: 0.9264, test_f1: 0.5782
 epoch: 22, train_loss: 0.7950, test_loss: 0.8561, test_f1: 0.5822
 epoch: 23, train_loss: 0.7975, test_loss: 0.8172, test_f1: 0.5998
 epoch: 24, train_loss: 0.7907, test_loss: 0.9032, test_f1: 0.6001
 epoch: 25, train_loss: 0.7917, test_loss: 0.9702, test_f1: 0.5670
 epoch: 26, train_loss: 0.7959, test_loss: 0.8614, test_f1: 0.5879
 epoch: 27, train_loss: 0.7646, test_loss: 0.8816, test_f1: 0.5868
 epoch: 28, train_loss: 0.7837, test_loss: 0.9483, test_f1: 0.6021
 epoch: 29, train_loss: 0.7719, test_loss: 1.0364, test_f1: 0.5851
 epoch: 30, train_loss: 0.7607, test_loss: 1.0218, test_f1: 0.5798
 epoch: 31, train_loss: 0.7596, test_loss: 1.1510, test_f1: 0.5742
 epoch: 32, train_loss: 0.7668, test_loss: 0.9029, test_f1: 0.6244
 epoch: 33, train_loss: 0.7620, test_loss: 0.9367, test_f1: 0.5862
 epoch: 34, train_loss: 0.7556, test_loss: 0.7571, test_f1: 0.6404
 epoch: 35, train_loss: 0.7809, test_loss: 0.9701, test_f1: 0.5650
 epoch: 36, train_loss: 0.7597, test_loss: 0.8636, test_f1: 0.6169
 epoch: 37, train_loss: 0.7399, test_loss: 0.9705, test_f1: 0.6306
 epoch: 38, train_loss: 0.7342, test_loss: 0.8277, test_f1: 0.6387
 epoch: 39, train_loss: 0.7476, test_loss: 0.9646, test_f1: 0.6056
 epoch: 40, train_loss: 0.7251, test_loss: 0.9997, test_f1: 0.5968
 epoch: 41, train_loss: 0.7327, test_loss: 0.9257, test_f1: 0.5855
 epoch: 42, train_loss: 0.7428, test_loss: 0.9984, test_f1: 0.6076
 epoch: 43, train_loss: 0.7283, test_loss: 0.7973, test_f1: 0.6415
 epoch: 44, train_loss: 0.7155, test_loss: 0.9176, test_f1: 0.6148
 epoch: 45, train_loss: 0.7296, test_loss: 0.9433, test_f1: 0.6446
 epoch: 46, train_loss: 0.6981, test_loss: 0.8382, test_f1: 0.6432
 epoch: 47, train_loss: 0.6927, test_loss: 0.9226, test_f1: 0.6681
 epoch: 48, train_loss: 0.6865, test_loss: 0.9728, test_f1: 0.6083
 epoch: 49, train_loss: 0.7075, test_loss: 0.8508, test_f1: 0.6258
 epoch: 50, train_loss: 0.7079, test_loss: 0.8088, test_f1: 0.6278
 epoch: 51, train_loss: 0.6650, test_loss: 0.8487, test_f1: 0.6561
 epoch: 52, train_loss: 0.6504, test_loss: 0.8732, test_f1: 0.6447
 epoch: 53, train_loss: 0.6426, test_loss: 0.9249, test_f1: 0.6559
 epoch: 54, train_loss: 0.6489, test_loss: 0.9378, test_f1: 0.6339
 epoch: 55, train_loss: 0.6339, test_loss: 0.8736, test_f1: 0.6560
 epoch: 56, train_loss: 0.6353, test_loss: 0.9877, test_f1: 0.6538
 epoch: 57, train_loss: 0.6258, test_loss: 0.8201, test_f1: 0.6492
 epoch: 58, train_loss: 0.6146, test_loss: 0.9016, test_f1: 0.6534
 epoch: 59, train_loss: 0.6170, test_loss: 0.9297, test_f1: 0.6286
 epoch: 60, train_loss: 0.6210, test_loss: 0.9540, test_f1: 0.6424
 epoch: 61, train_loss: 0.5986, test_loss: 0.9318, test_f1: 0.6378
 epoch: 62, train_loss: 0.5981, test_loss: 0.8705, test_f1: 0.6479
 epoch: 63, train_loss: 0.6029, test_loss: 1.0630, test_f1: 0.6530
 epoch: 64, train_loss: 0.6173, test_loss: 0.9487, test_f1: 0.6273
 epoch: 65, train_loss: 0.6111, test_loss: 0.9801, test_f1: 0.6518
 epoch: 66, train_loss: 0.5903, test_loss: 0.9311, test_f1: 0.6763
 epoch: 67, train_loss: 0.5863, test_loss: 0.9954, test_f1: 0.6323
 epoch: 68, train_loss: 0.5942, test_loss: 1.0312, test_f1: 0.6515
 epoch: 69, train_loss: 0.5972, test_loss: 1.0042, test_f1: 0.6427
 epoch: 70, train_loss: 0.5880, test_loss: 0.9902, test_f1: 0.6768
 epoch: 71, train_loss: 0.5845, test_loss: 1.0204, test_f1: 0.6428
 epoch: 72, train_loss: 0.5987, test_loss: 0.9393, test_f1: 0.6701
 epoch: 73, train_loss: 0.5840, test_loss: 0.9573, test_f1: 0.6862
 epoch: 74, train_loss: 0.5767, test_loss: 1.0871, test_f1: 0.6390
 epoch: 75, train_loss: 0.5566, test_loss: 1.0012, test_f1: 0.6717
 epoch: 76, train_loss: 0.5625, test_loss: 0.9997, test_f1: 0.6634
 epoch: 77, train_loss: 0.5714, test_loss: 0.9465, test_f1: 0.6600
 epoch: 78, train_loss: 0.5586, test_loss: 0.9829, test_f1: 0.6498
 epoch: 79, train_loss: 0.5655, test_loss: 1.0339, test_f1: 0.6265
 epoch: 80, train_loss: 0.5832, test_loss: 0.9627, test_f1: 0.6667
 epoch: 81, train_loss: 0.5774, test_loss: 0.9745, test_f1: 0.6683
 epoch: 82, train_loss: 0.5745, test_loss: 0.9569, test_f1: 0.6346
 epoch: 83, train_loss: 0.5712, test_loss: 0.9455, test_f1: 0.6843
 epoch: 84, train_loss: 0.5584, test_loss: 0.9754, test_f1: 0.6880
 epoch: 85, train_loss: 0.5614, test_loss: 0.9824, test_f1: 0.6607
 epoch: 86, train_loss: 0.5549, test_loss: 0.9627, test_f1: 0.6545
 epoch: 87, train_loss: 0.5580, test_loss: 0.8538, test_f1: 0.6940
 epoch: 88, train_loss: 0.5607, test_loss: 0.8497, test_f1: 0.6590
 epoch: 89, train_loss: 0.5363, test_loss: 0.9331, test_f1: 0.6799
 epoch: 90, train_loss: 0.5447, test_loss: 1.0301, test_f1: 0.6668
 epoch: 91, train_loss: 0.5351, test_loss: 1.0080, test_f1: 0.6569
 epoch: 92, train_loss: 0.5273, test_loss: 0.9194, test_f1: 0.6750
 epoch: 93, train_loss: 0.5468, test_loss: 0.9454, test_f1: 0.6784
 epoch: 94, train_loss: 0.5596, test_loss: 0.9400, test_f1: 0.6922
 epoch: 95, train_loss: 0.5460, test_loss: 0.9855, test_f1: 0.6515
 epoch: 96, train_loss: 0.5180, test_loss: 0.9856, test_f1: 0.7074
 epoch: 97, train_loss: 0.5320, test_loss: 1.0185, test_f1: 0.6443
 epoch: 98, train_loss: 0.5322, test_loss: 0.9679, test_f1: 0.6661
 epoch: 99, train_loss: 0.5300, test_loss: 1.0109, test_f1: 0.6693
##################ITERATION #6 ****************************************
 epoch: 0, train_loss: 1.0913, test_loss: 1.0478, test_f1: 0.4635
 epoch: 1, train_loss: 0.9784, test_loss: 0.9644, test_f1: 0.4801
 epoch: 2, train_loss: 0.9404, test_loss: 1.0071, test_f1: 0.5118
 epoch: 3, train_loss: 0.9284, test_loss: 0.9860, test_f1: 0.4848
 epoch: 4, train_loss: 0.9095, test_loss: 1.0000, test_f1: 0.5164
 epoch: 5, train_loss: 0.8959, test_loss: 0.9416, test_f1: 0.4790
 epoch: 6, train_loss: 0.8871, test_loss: 0.9222, test_f1: 0.5030
 epoch: 7, train_loss: 0.8787, test_loss: 0.8931, test_f1: 0.5233
 epoch: 8, train_loss: 0.8680, test_loss: 0.9261, test_f1: 0.5136
 epoch: 9, train_loss: 0.8538, test_loss: 0.9238, test_f1: 0.5272
 epoch: 10, train_loss: 0.8791, test_loss: 0.9950, test_f1: 0.4876
 epoch: 11, train_loss: 0.8502, test_loss: 0.8293, test_f1: 0.5922
 epoch: 12, train_loss: 0.8396, test_loss: 0.8605, test_f1: 0.6097
 epoch: 13, train_loss: 0.8469, test_loss: 0.9712, test_f1: 0.5173
 epoch: 14, train_loss: 0.8297, test_loss: 0.9623, test_f1: 0.5628
 epoch: 15, train_loss: 0.8158, test_loss: 0.8392, test_f1: 0.5472
 epoch: 16, train_loss: 0.8212, test_loss: 0.8359, test_f1: 0.5407
 epoch: 17, train_loss: 0.8454, test_loss: 0.8799, test_f1: 0.5425
 epoch: 18, train_loss: 0.8221, test_loss: 0.8701, test_f1: 0.5965
 epoch: 19, train_loss: 0.8087, test_loss: 0.9506, test_f1: 0.5280
 epoch: 20, train_loss: 0.8176, test_loss: 0.8477, test_f1: 0.5998
 epoch: 21, train_loss: 0.7868, test_loss: 0.8537, test_f1: 0.5872
 epoch: 22, train_loss: 0.7756, test_loss: 1.0009, test_f1: 0.5432
 epoch: 23, train_loss: 0.7909, test_loss: 1.0056, test_f1: 0.5467
 epoch: 24, train_loss: 0.7835, test_loss: 0.9282, test_f1: 0.5676
 epoch: 25, train_loss: 0.7834, test_loss: 1.3215, test_f1: 0.5731
 epoch: 26, train_loss: 0.7768, test_loss: 0.8518, test_f1: 0.5962
 epoch: 27, train_loss: 0.7727, test_loss: 1.0000, test_f1: 0.5979
 epoch: 28, train_loss: 0.7670, test_loss: 0.8693, test_f1: 0.6159
 epoch: 29, train_loss: 0.7726, test_loss: 0.9777, test_f1: 0.5267
 epoch: 30, train_loss: 0.7843, test_loss: 1.0178, test_f1: 0.5538
 epoch: 31, train_loss: 0.8015, test_loss: 0.9529, test_f1: 0.5479
 epoch: 32, train_loss: 0.7952, test_loss: 1.0626, test_f1: 0.5606
 epoch: 33, train_loss: 0.7556, test_loss: 0.9096, test_f1: 0.6217
 epoch: 34, train_loss: 0.7779, test_loss: 1.0503, test_f1: 0.6091
 epoch: 35, train_loss: 0.7520, test_loss: 0.8154, test_f1: 0.6273
 epoch: 36, train_loss: 0.7378, test_loss: 0.7717, test_f1: 0.6304
 epoch: 37, train_loss: 0.7449, test_loss: 0.8294, test_f1: 0.6107
 epoch: 38, train_loss: 0.7561, test_loss: 0.8463, test_f1: 0.6199
 epoch: 39, train_loss: 0.7291, test_loss: 0.9751, test_f1: 0.6125
 epoch: 40, train_loss: 0.7262, test_loss: 1.1273, test_f1: 0.6193
 epoch: 41, train_loss: 0.7336, test_loss: 0.9739, test_f1: 0.6002
 epoch: 42, train_loss: 0.7421, test_loss: 0.8481, test_f1: 0.6138
 epoch: 43, train_loss: 0.7370, test_loss: 0.8561, test_f1: 0.6342
 epoch: 44, train_loss: 0.7214, test_loss: 1.0036, test_f1: 0.6201
 epoch: 45, train_loss: 0.7103, test_loss: 0.9254, test_f1: 0.6144
 epoch: 46, train_loss: 0.7133, test_loss: 0.9139, test_f1: 0.5956
 epoch: 47, train_loss: 0.7268, test_loss: 0.9786, test_f1: 0.6268
 epoch: 48, train_loss: 0.6930, test_loss: 1.1337, test_f1: 0.6085
 epoch: 49, train_loss: 0.7095, test_loss: 0.8730, test_f1: 0.6279
 epoch: 50, train_loss: 0.6965, test_loss: 0.7819, test_f1: 0.6290
 epoch: 51, train_loss: 0.6898, test_loss: 0.8026, test_f1: 0.6773
 epoch: 52, train_loss: 0.6557, test_loss: 0.8471, test_f1: 0.6567
 epoch: 53, train_loss: 0.6559, test_loss: 0.8240, test_f1: 0.6454
 epoch: 54, train_loss: 0.6366, test_loss: 0.8647, test_f1: 0.6648
 epoch: 55, train_loss: 0.6320, test_loss: 0.8126, test_f1: 0.6707
 epoch: 56, train_loss: 0.6277, test_loss: 0.8565, test_f1: 0.6481
 epoch: 57, train_loss: 0.6286, test_loss: 0.7894, test_f1: 0.6740
 epoch: 58, train_loss: 0.6258, test_loss: 0.8851, test_f1: 0.6751
 epoch: 59, train_loss: 0.6155, test_loss: 1.1035, test_f1: 0.5893
 epoch: 60, train_loss: 0.6249, test_loss: 0.7981, test_f1: 0.6568
 epoch: 61, train_loss: 0.6141, test_loss: 0.9404, test_f1: 0.6329
 epoch: 62, train_loss: 0.6111, test_loss: 0.7816, test_f1: 0.6689
 epoch: 63, train_loss: 0.6043, test_loss: 0.8964, test_f1: 0.6396
 epoch: 64, train_loss: 0.5936, test_loss: 0.8394, test_f1: 0.6709
 epoch: 65, train_loss: 0.6077, test_loss: 0.7061, test_f1: 0.6668
 epoch: 66, train_loss: 0.6156, test_loss: 0.8174, test_f1: 0.6540
 epoch: 67, train_loss: 0.6035, test_loss: 0.9034, test_f1: 0.6550
 epoch: 68, train_loss: 0.5886, test_loss: 0.8013, test_f1: 0.6697
 epoch: 69, train_loss: 0.5901, test_loss: 0.8643, test_f1: 0.6793
 epoch: 70, train_loss: 0.5911, test_loss: 0.8212, test_f1: 0.7027
 epoch: 71, train_loss: 0.5823, test_loss: 1.0419, test_f1: 0.6597
 epoch: 72, train_loss: 0.5755, test_loss: 0.8046, test_f1: 0.6715
 epoch: 73, train_loss: 0.5699, test_loss: 1.0689, test_f1: 0.6369
 epoch: 74, train_loss: 0.5754, test_loss: 1.0084, test_f1: 0.6713
 epoch: 75, train_loss: 0.5966, test_loss: 0.8893, test_f1: 0.6924
 epoch: 76, train_loss: 0.5799, test_loss: 0.8806, test_f1: 0.6622
 epoch: 77, train_loss: 0.5739, test_loss: 0.8978, test_f1: 0.6329
 epoch: 78, train_loss: 0.5569, test_loss: 0.8543, test_f1: 0.6405
 epoch: 79, train_loss: 0.5606, test_loss: 0.9572, test_f1: 0.6548
 epoch: 80, train_loss: 0.5488, test_loss: 0.7665, test_f1: 0.6655
 epoch: 81, train_loss: 0.5403, test_loss: 0.8211, test_f1: 0.6648
 epoch: 82, train_loss: 0.5691, test_loss: 0.9716, test_f1: 0.6737
 epoch: 83, train_loss: 0.5774, test_loss: 0.9749, test_f1: 0.6515
 epoch: 84, train_loss: 0.5530, test_loss: 1.1035, test_f1: 0.6726
 epoch: 85, train_loss: 0.5565, test_loss: 1.0671, test_f1: 0.6536
 epoch: 86, train_loss: 0.5473, test_loss: 0.8316, test_f1: 0.6638
 epoch: 87, train_loss: 0.5534, test_loss: 0.8346, test_f1: 0.6533
 epoch: 88, train_loss: 0.5518, test_loss: 0.9631, test_f1: 0.6599
 epoch: 89, train_loss: 0.5458, test_loss: 0.9305, test_f1: 0.6839
 epoch: 90, train_loss: 0.5392, test_loss: 0.9598, test_f1: 0.6582
 epoch: 91, train_loss: 0.5334, test_loss: 0.9997, test_f1: 0.6649
 epoch: 92, train_loss: 0.5341, test_loss: 0.8143, test_f1: 0.6571
 epoch: 93, train_loss: 0.5402, test_loss: 0.9478, test_f1: 0.6324
 epoch: 94, train_loss: 0.5298, test_loss: 0.9652, test_f1: 0.6790
 epoch: 95, train_loss: 0.5597, test_loss: 1.0189, test_f1: 0.6318
 epoch: 96, train_loss: 0.5376, test_loss: 0.8734, test_f1: 0.6701
 epoch: 97, train_loss: 0.5309, test_loss: 0.9915, test_f1: 0.6824
 epoch: 98, train_loss: 0.5298, test_loss: 1.0213, test_f1: 0.6706
 epoch: 99, train_loss: 0.5340, test_loss: 0.7925, test_f1: 0.6646
##################ITERATION #7 ****************************************
 epoch: 0, train_loss: 1.1273, test_loss: 1.2273, test_f1: 0.3638
 epoch: 1, train_loss: 1.0343, test_loss: 0.9901, test_f1: 0.4409
 epoch: 2, train_loss: 1.0095, test_loss: 1.0245, test_f1: 0.4470
 epoch: 3, train_loss: 0.9833, test_loss: 1.0196, test_f1: 0.4747
 epoch: 4, train_loss: 0.9691, test_loss: 1.0827, test_f1: 0.4826
 epoch: 5, train_loss: 0.9570, test_loss: 1.0241, test_f1: 0.4760
 epoch: 6, train_loss: 0.9405, test_loss: 0.9713, test_f1: 0.4934
 epoch: 7, train_loss: 0.9419, test_loss: 0.9821, test_f1: 0.4935
 epoch: 8, train_loss: 0.9244, test_loss: 0.9864, test_f1: 0.4915
 epoch: 9, train_loss: 0.9298, test_loss: 0.9458, test_f1: 0.5315
 epoch: 10, train_loss: 0.9054, test_loss: 0.9643, test_f1: 0.5134
 epoch: 11, train_loss: 0.9021, test_loss: 0.9519, test_f1: 0.5397
 epoch: 12, train_loss: 0.8980, test_loss: 0.9475, test_f1: 0.5107
 epoch: 13, train_loss: 0.8827, test_loss: 0.8980, test_f1: 0.5316
 epoch: 14, train_loss: 0.8711, test_loss: 0.8684, test_f1: 0.5196
 epoch: 15, train_loss: 0.8768, test_loss: 0.9546, test_f1: 0.5351
 epoch: 16, train_loss: 0.8705, test_loss: 0.8995, test_f1: 0.5399
 epoch: 17, train_loss: 0.8653, test_loss: 0.9062, test_f1: 0.5446
 epoch: 18, train_loss: 0.8410, test_loss: 0.8136, test_f1: 0.5661
 epoch: 19, train_loss: 0.8487, test_loss: 0.9768, test_f1: 0.5350
 epoch: 20, train_loss: 0.8246, test_loss: 0.8396, test_f1: 0.5584
 epoch: 21, train_loss: 0.8592, test_loss: 0.9276, test_f1: 0.5493
 epoch: 22, train_loss: 0.8402, test_loss: 0.8412, test_f1: 0.5705
 epoch: 23, train_loss: 0.8131, test_loss: 0.8933, test_f1: 0.5737
 epoch: 24, train_loss: 0.8164, test_loss: 0.9173, test_f1: 0.5734
 epoch: 25, train_loss: 0.8022, test_loss: 1.0007, test_f1: 0.5158
 epoch: 26, train_loss: 0.8187, test_loss: 0.8271, test_f1: 0.5735
 epoch: 27, train_loss: 0.8265, test_loss: 0.9715, test_f1: 0.5585
 epoch: 28, train_loss: 0.8135, test_loss: 0.9261, test_f1: 0.5688
 epoch: 29, train_loss: 0.7977, test_loss: 0.9166, test_f1: 0.6016
 epoch: 30, train_loss: 0.7877, test_loss: 1.1074, test_f1: 0.5781
 epoch: 31, train_loss: 0.8137, test_loss: 0.8513, test_f1: 0.5802
 epoch: 32, train_loss: 0.7739, test_loss: 0.9174, test_f1: 0.5719
 epoch: 33, train_loss: 0.7878, test_loss: 0.8432, test_f1: 0.5928
 epoch: 34, train_loss: 0.7738, test_loss: 0.9881, test_f1: 0.5527
 epoch: 35, train_loss: 0.7619, test_loss: 1.0433, test_f1: 0.6603
 epoch: 36, train_loss: 0.7674, test_loss: 1.2024, test_f1: 0.6139
 epoch: 37, train_loss: 0.7618, test_loss: 0.8353, test_f1: 0.6040
 epoch: 38, train_loss: 0.7762, test_loss: 0.8538, test_f1: 0.5915
 epoch: 39, train_loss: 0.7562, test_loss: 1.1461, test_f1: 0.5774
 epoch: 40, train_loss: 0.7344, test_loss: 1.3108, test_f1: 0.5932
 epoch: 41, train_loss: 0.7628, test_loss: 1.2304, test_f1: 0.6038
 epoch: 42, train_loss: 0.7554, test_loss: 0.9016, test_f1: 0.5912
 epoch: 43, train_loss: 0.7347, test_loss: 1.1253, test_f1: 0.6054
 epoch: 44, train_loss: 0.7495, test_loss: 1.0756, test_f1: 0.6290
 epoch: 45, train_loss: 0.7318, test_loss: 0.9223, test_f1: 0.6000
 epoch: 46, train_loss: 0.7274, test_loss: 1.0212, test_f1: 0.6067
 epoch: 47, train_loss: 0.7327, test_loss: 1.0633, test_f1: 0.6275
 epoch: 48, train_loss: 0.7359, test_loss: 0.9085, test_f1: 0.6242
 epoch: 49, train_loss: 0.7025, test_loss: 1.2429, test_f1: 0.6054
 epoch: 50, train_loss: 0.7247, test_loss: 0.9715, test_f1: 0.6246
 epoch: 51, train_loss: 0.6876, test_loss: 0.9603, test_f1: 0.6233
 epoch: 52, train_loss: 0.6959, test_loss: 0.8948, test_f1: 0.5895
 epoch: 53, train_loss: 0.6878, test_loss: 0.9494, test_f1: 0.6281
 epoch: 54, train_loss: 0.6692, test_loss: 0.9205, test_f1: 0.6060
 epoch: 55, train_loss: 0.6714, test_loss: 0.8560, test_f1: 0.6369
 epoch: 56, train_loss: 0.6726, test_loss: 0.9550, test_f1: 0.6216
 epoch: 57, train_loss: 0.6754, test_loss: 0.9693, test_f1: 0.6216
 epoch: 58, train_loss: 0.6487, test_loss: 1.0332, test_f1: 0.6411
 epoch: 59, train_loss: 0.6513, test_loss: 1.0324, test_f1: 0.6368
 epoch: 60, train_loss: 0.6564, test_loss: 1.0511, test_f1: 0.6393
 epoch: 61, train_loss: 0.6427, test_loss: 0.9043, test_f1: 0.6623
 epoch: 62, train_loss: 0.6556, test_loss: 1.0933, test_f1: 0.6058
 epoch: 63, train_loss: 0.6606, test_loss: 0.8768, test_f1: 0.6487
 epoch: 64, train_loss: 0.6509, test_loss: 0.9821, test_f1: 0.6392
 epoch: 65, train_loss: 0.6422, test_loss: 0.7667, test_f1: 0.6363
 epoch: 66, train_loss: 0.6423, test_loss: 0.9370, test_f1: 0.6358
 epoch: 67, train_loss: 0.6350, test_loss: 0.8817, test_f1: 0.6468
 epoch: 68, train_loss: 0.6325, test_loss: 0.7919, test_f1: 0.6354
 epoch: 69, train_loss: 0.6229, test_loss: 0.8252, test_f1: 0.6236
 epoch: 70, train_loss: 0.6365, test_loss: 0.8508, test_f1: 0.6194
 epoch: 71, train_loss: 0.6437, test_loss: 0.8494, test_f1: 0.6475
 epoch: 72, train_loss: 0.6097, test_loss: 0.8177, test_f1: 0.6371
 epoch: 73, train_loss: 0.6241, test_loss: 1.0192, test_f1: 0.6253
 epoch: 74, train_loss: 0.6121, test_loss: 1.0537, test_f1: 0.6165
 epoch: 75, train_loss: 0.6085, test_loss: 0.9304, test_f1: 0.6369
 epoch: 76, train_loss: 0.6152, test_loss: 1.0137, test_f1: 0.6213
 epoch: 77, train_loss: 0.6260, test_loss: 0.9193, test_f1: 0.6672
 epoch: 78, train_loss: 0.6145, test_loss: 0.9568, test_f1: 0.6235
 epoch: 79, train_loss: 0.6057, test_loss: 0.9642, test_f1: 0.6450
 epoch: 80, train_loss: 0.6117, test_loss: 0.9965, test_f1: 0.6433
 epoch: 81, train_loss: 0.6112, test_loss: 0.9885, test_f1: 0.6175
 epoch: 82, train_loss: 0.5964, test_loss: 0.8857, test_f1: 0.6502
 epoch: 83, train_loss: 0.6085, test_loss: 1.1321, test_f1: 0.6240
 epoch: 84, train_loss: 0.6065, test_loss: 0.8717, test_f1: 0.6243
 epoch: 85, train_loss: 0.5878, test_loss: 0.9150, test_f1: 0.6273
 epoch: 86, train_loss: 0.6101, test_loss: 0.8864, test_f1: 0.6290
 epoch: 87, train_loss: 0.6115, test_loss: 0.8769, test_f1: 0.6366
 epoch: 88, train_loss: 0.5851, test_loss: 0.8129, test_f1: 0.6106
 epoch: 89, train_loss: 0.6280, test_loss: 0.9114, test_f1: 0.6282
 epoch: 90, train_loss: 0.5912, test_loss: 0.9209, test_f1: 0.6377
 epoch: 91, train_loss: 0.5906, test_loss: 0.9194, test_f1: 0.6435
 epoch: 92, train_loss: 0.5819, test_loss: 0.9297, test_f1: 0.6476
 epoch: 93, train_loss: 0.5912, test_loss: 1.0047, test_f1: 0.6353
 epoch: 94, train_loss: 0.5925, test_loss: 0.9001, test_f1: 0.6601
 epoch: 95, train_loss: 0.5985, test_loss: 0.9447, test_f1: 0.6351
 epoch: 96, train_loss: 0.5846, test_loss: 0.9442, test_f1: 0.6438
 epoch: 97, train_loss: 0.5767, test_loss: 0.8398, test_f1: 0.6203
 epoch: 98, train_loss: 0.5738, test_loss: 0.9307, test_f1: 0.6384
 epoch: 99, train_loss: 0.5705, test_loss: 0.9266, test_f1: 0.6199
##################ITERATION #8 ****************************************
 epoch: 0, train_loss: 1.1302, test_loss: 1.0711, test_f1: 0.3835
 epoch: 1, train_loss: 0.9923, test_loss: 1.0049, test_f1: 0.4777
 epoch: 2, train_loss: 0.9827, test_loss: 0.9726, test_f1: 0.5060
 epoch: 3, train_loss: 0.9509, test_loss: 0.9765, test_f1: 0.4943
 epoch: 4, train_loss: 0.9334, test_loss: 1.0163, test_f1: 0.4646
 epoch: 5, train_loss: 0.9303, test_loss: 0.9047, test_f1: 0.5760
 epoch: 6, train_loss: 0.9172, test_loss: 0.9247, test_f1: 0.5427
 epoch: 7, train_loss: 0.9051, test_loss: 0.9600, test_f1: 0.5610
 epoch: 8, train_loss: 0.8766, test_loss: 0.9251, test_f1: 0.5242
 epoch: 9, train_loss: 0.8804, test_loss: 0.9221, test_f1: 0.5777
 epoch: 10, train_loss: 0.8609, test_loss: 0.8747, test_f1: 0.5340
 epoch: 11, train_loss: 0.8701, test_loss: 0.9272, test_f1: 0.5208
 epoch: 12, train_loss: 0.8556, test_loss: 7.3593, test_f1: 0.4267
 epoch: 13, train_loss: 0.8476, test_loss: 0.8261, test_f1: 0.5991
 epoch: 14, train_loss: 0.8522, test_loss: 0.9204, test_f1: 0.5391
 epoch: 15, train_loss: 0.8331, test_loss: 0.9022, test_f1: 0.5943
 epoch: 16, train_loss: 0.8296, test_loss: 0.9606, test_f1: 0.5336
 epoch: 17, train_loss: 0.8185, test_loss: 0.9570, test_f1: 0.4992
 epoch: 18, train_loss: 0.8274, test_loss: 0.8589, test_f1: 0.5249
 epoch: 19, train_loss: 0.8159, test_loss: 0.8371, test_f1: 0.6230
 epoch: 20, train_loss: 0.8308, test_loss: 0.8654, test_f1: 0.5918
 epoch: 21, train_loss: 0.7996, test_loss: 0.9229, test_f1: 0.5450
 epoch: 22, train_loss: 0.8231, test_loss: 0.9066, test_f1: 0.5862
 epoch: 23, train_loss: 0.7981, test_loss: 0.9067, test_f1: 0.5907
 epoch: 24, train_loss: 0.7963, test_loss: 0.8856, test_f1: 0.6181
 epoch: 25, train_loss: 0.7910, test_loss: 0.8774, test_f1: 0.6186
 epoch: 26, train_loss: 0.7925, test_loss: 0.8021, test_f1: 0.6311
 epoch: 27, train_loss: 0.7888, test_loss: 0.8852, test_f1: 0.6038
 epoch: 28, train_loss: 0.7934, test_loss: 0.8867, test_f1: 0.5769
 epoch: 29, train_loss: 0.7592, test_loss: 0.8925, test_f1: 0.6285
 epoch: 30, train_loss: 0.7722, test_loss: 0.8656, test_f1: 0.6261
 epoch: 31, train_loss: 0.7791, test_loss: 0.8427, test_f1: 0.5508
 epoch: 32, train_loss: 0.7876, test_loss: 0.9062, test_f1: 0.5672
 epoch: 33, train_loss: 0.7852, test_loss: 0.9057, test_f1: 0.5941
 epoch: 34, train_loss: 0.7724, test_loss: 0.8876, test_f1: 0.6284
 epoch: 35, train_loss: 0.7598, test_loss: 0.8846, test_f1: 0.5764
 epoch: 36, train_loss: 0.7493, test_loss: 0.9363, test_f1: 0.5617
 epoch: 37, train_loss: 0.7513, test_loss: 0.8824, test_f1: 0.5889
 epoch: 38, train_loss: 0.7703, test_loss: 0.8260, test_f1: 0.6046
 epoch: 39, train_loss: 0.7204, test_loss: 0.8810, test_f1: 0.6103
 epoch: 40, train_loss: 0.7803, test_loss: 0.8201, test_f1: 0.6256
 epoch: 41, train_loss: 0.7390, test_loss: 0.8231, test_f1: 0.6061
 epoch: 42, train_loss: 0.7384, test_loss: 0.8582, test_f1: 0.6293
 epoch: 43, train_loss: 0.7320, test_loss: 1.1049, test_f1: 0.5872
 epoch: 44, train_loss: 0.7304, test_loss: 0.8713, test_f1: 0.6134
 epoch: 45, train_loss: 0.7101, test_loss: 0.9623, test_f1: 0.6446
 epoch: 46, train_loss: 0.7024, test_loss: 0.8747, test_f1: 0.5441
 epoch: 47, train_loss: 0.7134, test_loss: 0.8837, test_f1: 0.6353
 epoch: 48, train_loss: 0.7107, test_loss: 0.8489, test_f1: 0.6547
 epoch: 49, train_loss: 0.7049, test_loss: 0.9138, test_f1: 0.6016
 epoch: 50, train_loss: 0.7039, test_loss: 0.9318, test_f1: 0.6135
 epoch: 51, train_loss: 0.6689, test_loss: 0.9018, test_f1: 0.6496
 epoch: 52, train_loss: 0.6525, test_loss: 0.8367, test_f1: 0.6677
 epoch: 53, train_loss: 0.6405, test_loss: 0.8969, test_f1: 0.6634
 epoch: 54, train_loss: 0.6562, test_loss: 0.8724, test_f1: 0.6693
 epoch: 55, train_loss: 0.6475, test_loss: 0.9832, test_f1: 0.6492
 epoch: 56, train_loss: 0.6344, test_loss: 0.9661, test_f1: 0.6583
 epoch: 57, train_loss: 0.6390, test_loss: 0.9199, test_f1: 0.6424
 epoch: 58, train_loss: 0.6369, test_loss: 0.9245, test_f1: 0.6564
 epoch: 59, train_loss: 0.6294, test_loss: 0.9544, test_f1: 0.6636
 epoch: 60, train_loss: 0.6371, test_loss: 0.9626, test_f1: 0.6559
 epoch: 61, train_loss: 0.6519, test_loss: 0.9014, test_f1: 0.6761
 epoch: 62, train_loss: 0.6145, test_loss: 1.0371, test_f1: 0.6661
 epoch: 63, train_loss: 0.6176, test_loss: 0.9933, test_f1: 0.6611
 epoch: 64, train_loss: 0.6086, test_loss: 1.0030, test_f1: 0.6617
 epoch: 65, train_loss: 0.6104, test_loss: 0.9875, test_f1: 0.6697
 epoch: 66, train_loss: 0.6171, test_loss: 0.9035, test_f1: 0.6630
 epoch: 67, train_loss: 0.6111, test_loss: 1.1261, test_f1: 0.6731
 epoch: 68, train_loss: 0.6378, test_loss: 1.0695, test_f1: 0.6283
 epoch: 69, train_loss: 0.6162, test_loss: 1.0768, test_f1: 0.6497
 epoch: 70, train_loss: 0.6089, test_loss: 1.1289, test_f1: 0.6710
 epoch: 71, train_loss: 0.6039, test_loss: 1.0631, test_f1: 0.6612
 epoch: 72, train_loss: 0.5992, test_loss: 0.9875, test_f1: 0.6757
 epoch: 73, train_loss: 0.5927, test_loss: 1.0750, test_f1: 0.6738
 epoch: 74, train_loss: 0.6134, test_loss: 0.9534, test_f1: 0.6537
 epoch: 75, train_loss: 0.5820, test_loss: 1.0869, test_f1: 0.6851
 epoch: 76, train_loss: 0.5922, test_loss: 0.9738, test_f1: 0.6781
 epoch: 77, train_loss: 0.6060, test_loss: 1.0702, test_f1: 0.6629
 epoch: 78, train_loss: 0.6089, test_loss: 1.0094, test_f1: 0.6788
 epoch: 79, train_loss: 0.5761, test_loss: 1.0150, test_f1: 0.6653
 epoch: 80, train_loss: 0.5834, test_loss: 1.1050, test_f1: 0.6583
 epoch: 81, train_loss: 0.5785, test_loss: 1.1517, test_f1: 0.6355
 epoch: 82, train_loss: 0.5824, test_loss: 1.0344, test_f1: 0.6708
 epoch: 83, train_loss: 0.5848, test_loss: 1.1289, test_f1: 0.6515
 epoch: 84, train_loss: 0.5879, test_loss: 0.9810, test_f1: 0.7035
 epoch: 85, train_loss: 0.5829, test_loss: 1.0291, test_f1: 0.6812
 epoch: 86, train_loss: 0.5754, test_loss: 0.9797, test_f1: 0.6701
 epoch: 87, train_loss: 0.5714, test_loss: 1.0846, test_f1: 0.6899
 epoch: 88, train_loss: 0.5677, test_loss: 1.1670, test_f1: 0.7008
 epoch: 89, train_loss: 0.5766, test_loss: 1.1426, test_f1: 0.6761
 epoch: 90, train_loss: 0.5567, test_loss: 1.1298, test_f1: 0.6821
 epoch: 91, train_loss: 0.5954, test_loss: 1.0612, test_f1: 0.6555
 epoch: 92, train_loss: 0.6079, test_loss: 1.0853, test_f1: 0.6838
 epoch: 93, train_loss: 0.5547, test_loss: 1.0843, test_f1: 0.6708
 epoch: 94, train_loss: 0.5691, test_loss: 1.1966, test_f1: 0.6813
 epoch: 95, train_loss: 0.5655, test_loss: 1.0865, test_f1: 0.6691
 epoch: 96, train_loss: 0.5687, test_loss: 1.1358, test_f1: 0.6602
 epoch: 97, train_loss: 0.5528, test_loss: 1.0034, test_f1: 0.6488
 epoch: 98, train_loss: 0.5495, test_loss: 1.1086, test_f1: 0.6661
 epoch: 99, train_loss: 0.5581, test_loss: 1.0052, test_f1: 0.6580
##################ITERATION #9 ****************************************
 epoch: 0, train_loss: 1.0987, test_loss: 1.3222, test_f1: 0.3723
 epoch: 1, train_loss: 0.9968, test_loss: 1.0349, test_f1: 0.4993
 epoch: 2, train_loss: 0.9523, test_loss: 0.9692, test_f1: 0.5241
 epoch: 3, train_loss: 0.9380, test_loss: 0.9741, test_f1: 0.5005
 epoch: 4, train_loss: 0.9187, test_loss: 0.9234, test_f1: 0.5142
 epoch: 5, train_loss: 0.8926, test_loss: 0.8702, test_f1: 0.5274
 epoch: 6, train_loss: 0.9016, test_loss: 1.0054, test_f1: 0.4816
 epoch: 7, train_loss: 0.8822, test_loss: 0.9124, test_f1: 0.5521
 epoch: 8, train_loss: 0.8597, test_loss: 0.8643, test_f1: 0.5595
 epoch: 9, train_loss: 0.8684, test_loss: 0.9515, test_f1: 0.5803
 epoch: 10, train_loss: 0.8494, test_loss: 0.9101, test_f1: 0.5614
 epoch: 11, train_loss: 0.8311, test_loss: 0.9176, test_f1: 0.5400
 epoch: 12, train_loss: 0.8333, test_loss: 0.9729, test_f1: 0.5342
 epoch: 13, train_loss: 0.8549, test_loss: 1.0117, test_f1: 0.5760
 epoch: 14, train_loss: 0.8265, test_loss: 0.8705, test_f1: 0.6044
 epoch: 15, train_loss: 0.8216, test_loss: 0.9614, test_f1: 0.5618
 epoch: 16, train_loss: 0.8632, test_loss: 0.8350, test_f1: 0.5972
 epoch: 17, train_loss: 0.8260, test_loss: 0.8596, test_f1: 0.5305
 epoch: 18, train_loss: 0.8203, test_loss: 0.9235, test_f1: 0.6178
 epoch: 19, train_loss: 0.8057, test_loss: 1.0427, test_f1: 0.5252
 epoch: 20, train_loss: 0.7961, test_loss: 0.9224, test_f1: 0.6062
 epoch: 21, train_loss: 0.7625, test_loss: 0.9256, test_f1: 0.6124
 epoch: 22, train_loss: 0.7886, test_loss: 0.9731, test_f1: 0.5771
 epoch: 23, train_loss: 0.7702, test_loss: 0.9226, test_f1: 0.5559
 epoch: 24, train_loss: 0.7845, test_loss: 0.9470, test_f1: 0.6417
 epoch: 25, train_loss: 0.7741, test_loss: 0.8221, test_f1: 0.5769
 epoch: 26, train_loss: 0.7566, test_loss: 0.8799, test_f1: 0.6323
 epoch: 27, train_loss: 0.7782, test_loss: 1.0170, test_f1: 0.6306
 epoch: 28, train_loss: 0.7539, test_loss: 0.9946, test_f1: 0.5770
 epoch: 29, train_loss: 0.7734, test_loss: 0.8936, test_f1: 0.5701
 epoch: 30, train_loss: 0.7477, test_loss: 0.9904, test_f1: 0.6264
 epoch: 31, train_loss: 0.7421, test_loss: 0.8930, test_f1: 0.6038
 epoch: 32, train_loss: 0.7317, test_loss: 1.0314, test_f1: 0.5565
 epoch: 33, train_loss: 0.7530, test_loss: 0.9473, test_f1: 0.6072
 epoch: 34, train_loss: 0.7344, test_loss: 1.0512, test_f1: 0.5744
 epoch: 35, train_loss: 0.7348, test_loss: 0.9929, test_f1: 0.5800
 epoch: 36, train_loss: 0.7244, test_loss: 1.0339, test_f1: 0.6345
 epoch: 37, train_loss: 0.7138, test_loss: 1.0068, test_f1: 0.6299
 epoch: 38, train_loss: 0.7082, test_loss: 1.0805, test_f1: 0.5928
 epoch: 39, train_loss: 0.7250, test_loss: 0.9492, test_f1: 0.5780
 epoch: 40, train_loss: 0.7793, test_loss: 1.0560, test_f1: 0.6134
 epoch: 41, train_loss: 0.7517, test_loss: 1.1118, test_f1: 0.5360
 epoch: 42, train_loss: 0.7196, test_loss: 0.9643, test_f1: 0.6121
 epoch: 43, train_loss: 0.6984, test_loss: 0.9743, test_f1: 0.5990
 epoch: 44, train_loss: 0.7041, test_loss: 1.0555, test_f1: 0.6212
 epoch: 45, train_loss: 0.6880, test_loss: 1.1501, test_f1: 0.6174
 epoch: 46, train_loss: 0.6921, test_loss: 1.2788, test_f1: 0.6172
 epoch: 47, train_loss: 0.6905, test_loss: 1.0877, test_f1: 0.6410
 epoch: 48, train_loss: 0.7017, test_loss: 0.9022, test_f1: 0.6246
 epoch: 49, train_loss: 0.6946, test_loss: 1.1014, test_f1: 0.5960
 epoch: 50, train_loss: 0.6717, test_loss: 1.1069, test_f1: 0.6053
 epoch: 51, train_loss: 0.6551, test_loss: 1.1383, test_f1: 0.6379
 epoch: 52, train_loss: 0.6555, test_loss: 1.0887, test_f1: 0.6436
 epoch: 53, train_loss: 0.6557, test_loss: 1.1383, test_f1: 0.6595
 epoch: 54, train_loss: 0.6312, test_loss: 1.1846, test_f1: 0.6351
 epoch: 55, train_loss: 0.6398, test_loss: 1.1737, test_f1: 0.6440
 epoch: 56, train_loss: 0.6249, test_loss: 1.0645, test_f1: 0.6319
 epoch: 57, train_loss: 0.6189, test_loss: 1.1291, test_f1: 0.6235
 epoch: 58, train_loss: 0.6189, test_loss: 1.0625, test_f1: 0.6597
 epoch: 59, train_loss: 0.6154, test_loss: 1.0610, test_f1: 0.6507
 epoch: 60, train_loss: 0.6270, test_loss: 1.1295, test_f1: 0.6323
 epoch: 61, train_loss: 0.6073, test_loss: 1.0871, test_f1: 0.6500
 epoch: 62, train_loss: 0.6128, test_loss: 1.1956, test_f1: 0.6280
 epoch: 63, train_loss: 0.5916, test_loss: 1.1169, test_f1: 0.6514
 epoch: 64, train_loss: 0.6168, test_loss: 1.0648, test_f1: 0.6529
 epoch: 65, train_loss: 0.5924, test_loss: 1.2989, test_f1: 0.6669
 epoch: 66, train_loss: 0.5970, test_loss: 1.1603, test_f1: 0.6619
 epoch: 67, train_loss: 0.5800, test_loss: 1.2695, test_f1: 0.6582
 epoch: 68, train_loss: 0.5916, test_loss: 1.2287, test_f1: 0.6541
 epoch: 69, train_loss: 0.5758, test_loss: 1.2896, test_f1: 0.6497
 epoch: 70, train_loss: 0.5991, test_loss: 1.4300, test_f1: 0.6463
 epoch: 71, train_loss: 0.5888, test_loss: 1.2512, test_f1: 0.6527
 epoch: 72, train_loss: 0.5907, test_loss: 1.2175, test_f1: 0.6656
 epoch: 73, train_loss: 0.5630, test_loss: 1.1807, test_f1: 0.6602
 epoch: 74, train_loss: 0.5664, test_loss: 1.3161, test_f1: 0.6703
 epoch: 75, train_loss: 0.5828, test_loss: 1.3413, test_f1: 0.6534
 epoch: 76, train_loss: 0.6004, test_loss: 1.0020, test_f1: 0.6843
 epoch: 77, train_loss: 0.5907, test_loss: 1.1226, test_f1: 0.6800
 epoch: 78, train_loss: 0.5794, test_loss: 0.9305, test_f1: 0.6491
 epoch: 79, train_loss: 0.5801, test_loss: 1.1132, test_f1: 0.6585
 epoch: 80, train_loss: 0.5804, test_loss: 0.8881, test_f1: 0.6615
 epoch: 81, train_loss: 0.5720, test_loss: 0.9619, test_f1: 0.6666
 epoch: 82, train_loss: 0.5624, test_loss: 0.9624, test_f1: 0.6586
 epoch: 83, train_loss: 0.5600, test_loss: 1.0027, test_f1: 0.6768
 epoch: 84, train_loss: 0.5588, test_loss: 1.2614, test_f1: 0.6451
 epoch: 85, train_loss: 0.5587, test_loss: 1.2813, test_f1: 0.6745
 epoch: 86, train_loss: 0.5645, test_loss: 1.1989, test_f1: 0.6550
 epoch: 87, train_loss: 0.5602, test_loss: 1.2678, test_f1: 0.6283
 epoch: 88, train_loss: 0.5677, test_loss: 1.1918, test_f1: 0.6531
 epoch: 89, train_loss: 0.5601, test_loss: 1.0548, test_f1: 0.6548
 epoch: 90, train_loss: 0.5516, test_loss: 0.9984, test_f1: 0.6836
 epoch: 91, train_loss: 0.5440, test_loss: 1.1579, test_f1: 0.6461
 epoch: 92, train_loss: 0.5545, test_loss: 0.9624, test_f1: 0.6739
 epoch: 93, train_loss: 0.5363, test_loss: 1.1339, test_f1: 0.6486
 epoch: 94, train_loss: 0.5319, test_loss: 1.1619, test_f1: 0.6706
 epoch: 95, train_loss: 0.5322, test_loss: 1.3716, test_f1: 0.6694
 epoch: 96, train_loss: 0.5488, test_loss: 1.3040, test_f1: 0.6558
 epoch: 97, train_loss: 0.5452, test_loss: 1.1098, test_f1: 0.6630
 epoch: 98, train_loss: 0.5577, test_loss: 1.2557, test_f1: 0.6159
 epoch: 99, train_loss: 0.5470, test_loss: 1.3333, test_f1: 0.6786

Training completed in 813.52 seconds
Best F1: 0.7074 at epoch 96
Mean F1 across iterations: 0.6902  0.0141
========================FINAL RESULTS================================
FEGIN weighted F1: 0.7074  0.0141
python main.py --data ltspice_examples --representation component_pin_net --model FEGIN --layers 2 --hiddens 64 --batch_size 32 --lr 0.01 --emb_size 128 --epochs 100 --save_appendix component_pin_net_L2_H64_BS32_LR0.01_E128 --no_val
-----



STDERR:
  File "main.py", line 370, in <module>
    main()
  File "main.py", line 254, in main
    dataset = dataset_class(
  File "/home/philip/projects/ltspice_examples_code_repo/Circuit-Completion-Using-GNNs/component_classification_with_link_prediction_head/evaluation/FEGIN/kernel/circuit_datasets.py", line 15, in __init__
    self.data, self.slices = torch.load(self.processed_paths[0])
  File "/home/philip/.local/lib/python3.8/site-packages/torch/serialization.py", line 1040, in load
    warnings.warn(
  File "/usr/lib/python3.8/warnings.py", line 109, in _showwarnmsg
    sw(msg.message, msg.category, msg.filename, msg.lineno,
  File "main.py", line 47, in warn_with_traceback
    traceback.print_stack(file=log)
/home/philip/projects/ltspice_examples_code_repo/Circuit-Completion-Using-GNNs/component_classification_with_link_prediction_head/evaluation/FEGIN/kernel/circuit_datasets.py:15: FutureWarning: You are using `torch.load` with `weights_only=False` (the current default value), which uses the default pickle module implicitly. It is possible to construct malicious pickle data which will execute arbitrary code during unpickling (See https://github.com/pytorch/pytorch/blob/main/SECURITY.md#untrusted-models for more details). In a future release, the default value for `weights_only` will be flipped to `True`. This limits the functions that could be executed during unpickling. Arbitrary objects will no longer be allowed to be loaded via this mode unless they are explicitly allowlisted by the user via `torch.serialization.add_safe_globals`. We recommend you start setting `weights_only=True` for any use case where you don't have full control of the loaded file. Please open an issue on GitHub for any issues related to this experimental feature.
  self.data, self.slices = torch.load(self.processed_paths[0])
